edid-decode (hex):

00 ff ff ff ff ff ff 00 1e 6d c3 4b 01 01 01 01
01 13 01 03 80 29 17 78 ea 66 f5 a4 55 4d 9c 24
11 50 54 a5 6a 00 31 4f 45 4f 61 4f 71 40 81 00
01 01 01 01 01 01 34 21 50 b0 51 00 1b 30 40 70
36 00 9a e6 10 00 00 1e 1a 36 80 a0 70 38 1f 40
30 20 35 00 9a e6 10 00 00 1a 00 00 00 fd 00 38
4b 1e 53 0e 00 0a 20 20 20 20 20 20 00 00 00 fc
00 4d 31 39 37 57 44 50 0a 20 20 20 20 20 01 9a

----------------

Block 0, Base EDID:
  EDID Structure Version & Revision: 1.3
  Vendor & Product Identification:
    Manufacturer: GSM
    Model: 19395
    Serial Number: ...
    Made in: week 1 of 2009
  Basic Display Parameters & Features:
    Digital display
    Maximum image size: 41 cm x 23 cm
    Gamma: 2.20
    DPMS levels: Standby Suspend Off
    RGB color display
    First detailed timing is the preferred timing
  Color Characteristics:
    Red  : 0.6416, 0.3339
    Green: 0.3017, 0.6113
    Blue : 0.1435, 0.0693
    White: 0.3134, 0.3291
  Established Timings I & II:
    IBM     :   720x400    70.081663 Hz   9:5     31.467 kHz     28.320000 MHz
    DMT 0x04:   640x480    59.940476 Hz   4:3     31.469 kHz     25.175000 MHz
    DMT 0x06:   640x480    75.000000 Hz   4:3     37.500 kHz     31.500000 MHz
    DMT 0x09:   800x600    60.316541 Hz   4:3     37.879 kHz     40.000000 MHz
    DMT 0x0b:   800x600    75.000000 Hz   4:3     46.875 kHz     49.500000 MHz
    Apple   :   832x624    74.551266 Hz   4:3     49.726 kHz     57.284000 MHz
    DMT 0x10:  1024x768    60.003840 Hz   4:3     48.363 kHz     65.000000 MHz
    DMT 0x12:  1024x768    75.028582 Hz   4:3     60.023 kHz     78.750000 MHz
  Standard Timings:
    DMT 0x06:   640x480    75.000000 Hz   4:3     37.500 kHz     31.500000 MHz
    DMT 0x0b:   800x600    75.000000 Hz   4:3     46.875 kHz     49.500000 MHz
    DMT 0x12:  1024x768    75.028582 Hz   4:3     60.023 kHz     78.750000 MHz
    GTF     :  1152x864    60.000000 Hz   4:3     53.700 kHz     81.624000 MHz
    DMT 0x1c:  1280x800    59.810326 Hz  16:10    49.702 kHz     83.500000 MHz
  Detailed Timing Descriptors:
    DTD 1:  1360x768    59.664196 Hz  85:48    47.433 kHz     85.000000 MHz (410 mm x 230 mm)
                 Hfront   64 Hsync 112 Hback  256 Hpol P
                 Vfront    3 Vsync   6 Vback   18 Vpol P
    DTD 2:  1920x1080   59.933878 Hz  16:9     66.587 kHz    138.500000 MHz (410 mm x 230 mm)
                 Hfront   48 Hsync  32 Hback   80 Hpol P
                 Vfront    3 Vsync   5 Vback   23 Vpol N
    Display Range Limits:
      Monitor ranges (GTF): 56-75 Hz V, 30-83 kHz H, max dotclock 140 MHz
    Display Product Name: 'M197WDP'
  Extension blocks: 1
Checksum: 0x9a

----------------

Failures:

Block 0, Base EDID:
  Base EDID: EDID specified 1 extension block(s), but found 0 extension block(s).

EDID conformity: FAIL
