
EDID (hex):
00ffffffffffff004ee4000098509603
2a100103682c19782acfb5a355499925
105054a5ef80714f81c0810081409500
7140a9c00101023a801871382d40582c
450094f90000001a662150b051001b30
40703600baf91000001a000000fd0032
4c1e5211000a202020202020000000fc
003233310a0a0a0a0a0a0a0a0a0a008b

Extracted contents:
header:          00 ff ff ff ff ff ff 00
serial number:   4e e4 00 00 98 50 96 03 2a 10
version:         01 03
basic params:    68 2c 19 78 2a
chroma info:     cf b5 a3 55 49 99 25 10 50 54
established:     a5 ef 80
standard:        71 4f 81 c0 81 00 81 40 95 00 71 40 a9 c0 01 01
descriptor 1:    02 3a 80 18 71 38 2d 40 58 2c 45 00 94 f9 00 00 00 1a
descriptor 2:    66 21 50 b0 51 00 1b 30 40 70 36 00 ba f9 10 00 00 1a
descriptor 3:    00 00 00 fd 00 32 4c 1e 52 11 00 0a 20 20 20 20 20 20
descriptor 4:    00 00 00 fc 00 32 33 31 0a 0a 0a 0a 0a 0a 0a 0a 0a 0a
extensions:      00
checksum:        8b

EDID version: 1.3
Manufacturer: SWD Model 0 Serial Number --
Made in week 42 of 2006
Analog display, Input voltage level: 0.7/0.7 V
Sync: Separate 
Maximum image size: 44 cm x 25 cm
Gamma: 2.20
DPMS levels: Off
RGB color display
First detailed timing is preferred timing
Display x,y Chromaticity:
  Red:   0.6396, 0.3320
  Green: 0.2880, 0.6005
  Blue:  0.1464, 0.0654
  White: 0.3134, 0.3291
Established timings supported:
  720x400@70Hz 9:5 HorFreq: 31469 Hz Clock: 28.320 MHz
  640x480@60Hz 4:3 HorFreq: 31469 Hz Clock: 25.175 MHz
  640x480@75Hz 4:3 HorFreq: 37500 Hz Clock: 31.500 MHz
  800x600@60Hz 4:3 HorFreq: 37900 Hz Clock: 40.000 MHz
  800x600@72Hz 4:3 HorFreq: 48100 Hz Clock: 50.000 MHz
  800x600@75Hz 4:3 HorFreq: 46900 Hz Clock: 49.500 MHz
  832x624@75Hz 4:3 HorFreq: 49726 Hz Clock: 57.284 MHz
  1024x768@60Hz 4:3 HorFreq: 48400 Hz Clock: 65.000 MHz
  1024x768@70Hz 4:3 HorFreq: 56500 Hz Clock: 75.000 MHz
  1024x768@75Hz 4:3 HorFreq: 60000 Hz Clock: 78.750 MHz
  1280x1024@75Hz 5:4 HorFreq: 80000 Hz Clock: 135.000 MHz
  1152x870@75Hz 192:145 HorFreq: 67500 Hz Clock: 108.000 MHz
Standard timings supported:
  1152x864@75Hz 4:3 HorFreq: 67500 Hz Clock: 108.000 MHz
  1280x720@60Hz 16:9
  1280x800@60Hz 16:10
  1280x960@60Hz 4:3 HorFreq: 60000 Hz Clock: 108.000 MHz
  1440x900@60Hz 16:10 HorFreq: 55500 Hz Clock: 88.750 MHz
  1152x864@60Hz 4:3
  1600x900@60Hz 16:9
Detailed mode: Clock 148.500 MHz, 148 mm x 249 mm
               1920 2008 2052 2200 hborder 0
               1080 1084 1089 1125 vborder 0
               +hsync -vsync 
               VertFreq: 60 Hz, HorFreq: 67500 Hz
Detailed mode: Clock 85.500 MHz, 442 mm x 249 mm
               1360 1424 1536 1792 hborder 0
                768  771  777  795 vborder 0
               +hsync -vsync 
               VertFreq: 60 Hz, HorFreq: 47712 Hz
Monitor ranges (GTF): 50-76Hz V, 30-82kHz H, max dotclock 170MHz
Monitor name: 231
Checksum: 0x8b (valid)
EDID block does NOT conform to EDID 1.3!
	Detailed block string not properly terminated
