edid-decode (hex):

00 ff ff ff ff ff ff 00 15 3a 19 10 99 00 29 63
27 09 01 01 0e 24 1d 78 e8 ee e5 9e 54 4c 99 23
14 4a 4f bf ef 80 01 01 01 01 01 01 01 01 01 01
01 01 01 01 01 01 00 00 00 ff 00 36 33 32 39 30
30 39 39 0a 20 20 20 20 00 00 00 fd 00 32 4b 1b
50 0d 00 0a 20 20 20 20 20 20 00 00 00 fc 00 45
49 5a 4f 20 4c 36 36 0a 20 20 20 20 00 00 00 fe
00 0a 20 20 20 20 20 20 20 20 20 20 20 20 00 c8

----------------

Block 0, Base EDID:
  EDID Structure Version & Revision: 1.1
  Vendor & Product Identification:
    Manufacturer: EIZ
    Model: 4121
    Serial Number: ...
    Made in: week 39 of 1999
  Basic Display Parameters & Features:
    Analog display
    Input voltage level: 0.7/0.3 V
    Sync: Separate Composite SyncOnGreen
    Maximum image size: 36 cm x 29 cm
    Gamma: 2.20
    DPMS levels: Standby Suspend Off
    RGB color display
  Color Characteristics:
    Red  : 0.6201, 0.3300
    Green: 0.2998, 0.5996
    Blue : 0.1396, 0.0800
    White: 0.2900, 0.3095
  Established Timings I & II:
    IBM     :   720x400    70.082 Hz   9:5    31.467 kHz  28.320 MHz
    DMT 0x04:   640x480    59.940 Hz   4:3    31.469 kHz  25.175 MHz
    Apple   :   640x480    66.667 Hz   4:3    35.000 kHz  30.240 MHz
    DMT 0x05:   640x480    72.809 Hz   4:3    37.861 kHz  31.500 MHz
    DMT 0x06:   640x480    75.000 Hz   4:3    37.500 kHz  31.500 MHz
    DMT 0x08:   800x600    56.250 Hz   4:3    35.156 kHz  36.000 MHz
    DMT 0x09:   800x600    60.317 Hz   4:3    37.879 kHz  40.000 MHz
    DMT 0x0a:   800x600    72.188 Hz   4:3    48.077 kHz  50.000 MHz
    DMT 0x0b:   800x600    75.000 Hz   4:3    46.875 kHz  49.500 MHz
    Apple   :   832x624    74.551 Hz   4:3    49.726 kHz  57.284 MHz
    DMT 0x10:  1024x768    60.004 Hz   4:3    48.363 kHz  65.000 MHz
    DMT 0x11:  1024x768    70.069 Hz   4:3    56.476 kHz  75.000 MHz
    DMT 0x12:  1024x768    75.029 Hz   4:3    60.023 kHz  78.750 MHz
    DMT 0x24:  1280x1024   75.025 Hz   5:4    79.976 kHz 135.000 MHz
    Apple   :  1152x870    75.062 Hz 192:145  68.681 kHz 100.000 MHz
  Standard Timings: none
  Detailed Timing Descriptors:
    Display Product Serial Number: ...
  Display Range Limits:
    Monitor ranges (GTF): 50-75 Hz V, 27-80 kHz H, max dotclock 130 MHz
    Display Product Name: 'EIZO L66'
    Alphanumeric Data String: ''
Checksum: 0xc8

----------------

Warnings:

Block 0, Base EDID:
  EDID Structure Version & Revision: EDID 1.1 is deprecated, do not use.
All Blocks:
  Some timings are out of range of the Monitor Ranges:
    Maximum Clock: 135.000 MHz (Monitor: 130.000 MHz)
    Could be due to a Monitor Range off-by-one rounding issue

Failures:

Block 0, Base EDID:
  Alphanumeric Data String: Empty string.

EDID conformity: FAIL
