
EDID (hex):
00ffffffffffff004c2e000000000000
00190103800000780a2fcda354459724
11464721080001010101010101010101
010101010101023a801871382d40582c
450010090000001e8c0ad08a20e02d10
103e9600100900000018000000fc004c
43442054560a202020202020000000fd
00173f0f450f000a2020202020200193
020323704a1003202204020506070126
09070715075083010000e2007f65030c
001000011d803e73382d407e2c458010
090000001e011d801871382d40582c45
0010090000001e011d007251d01e206e
28550010090000001e662150b051001b
304070360010090000001ea91a00a050
0016303020370005030000001a000045

Extracted contents:
header:          00 ff ff ff ff ff ff 00
serial number:   4c 2e 00 00 00 00 00 00 00 19
version:         01 03
basic params:    80 00 00 78 0a
chroma info:     2f cd a3 54 45 97 24 11 46 47
established:     21 08 00
standard:        01 01 01 01 01 01 01 01 01 01 01 01 01 01 01 01
descriptor 1:    02 3a 80 18 71 38 2d 40 58 2c 45 00 10 09 00 00 00 1e
descriptor 2:    8c 0a d0 8a 20 e0 2d 10 10 3e 96 00 10 09 00 00 00 18
descriptor 3:    00 00 00 fc 00 4c 43 44 20 54 56 0a 20 20 20 20 20 20
descriptor 4:    00 00 00 fd 00 17 3f 0f 45 0f 00 0a 20 20 20 20 20 20
extensions:      01
checksum:        93

EDID version: 1.3
Manufacturer: SAN Model 0 Serial Number --
Made in year 2015
Digital display
Image size is variable
Gamma: 2.20
RGB color display
First detailed timing is preferred timing
Display x,y Chromaticity:
  Red:   0.6367, 0.3300
  Green: 0.2724, 0.5927
  Blue:  0.1435, 0.0664
  White: 0.2763, 0.2783
Established timings supported:
  640x480@60Hz 4:3 HorFreq: 31469 Hz Clock: 25.175 MHz
  800x600@60Hz 4:3 HorFreq: 37900 Hz Clock: 40.000 MHz
  1024x768@60Hz 4:3 HorFreq: 48400 Hz Clock: 65.000 MHz
Standard timings supported:
Detailed mode: Clock 148.500 MHz, 16 mm x 9 mm
               1920 2008 2052 2200 hborder 0
               1080 1084 1089 1125 vborder 0
               +hsync +vsync 
               VertFreq: 60 Hz, HorFreq: 67500 Hz
Detailed mode: Clock 27.000 MHz, 16 mm x 9 mm
                720  736  798  858 hborder 0
                480  489  495  525 vborder 0
               -hsync -vsync 
               VertFreq: 59 Hz, HorFreq: 31468 Hz
Monitor name: LCD TV
Monitor ranges (GTF): 23-63Hz V, 15-69kHz H, max dotclock 150MHz
Has 1 extension blocks
Checksum: 0x93 (valid)

CTA extension block
Extension version: 3
31 bytes of CTA data
  Video data block
    VIC  16 1920x1080@60Hz 16:9  HorFreq: 67500 Hz Clock: 148.500 MHz
    VIC   3 720x480@60Hz 16:9  HorFreq: 31469 Hz Clock: 27.000 MHz
    VIC  32 1920x1080@24Hz 16:9  HorFreq: 27000 Hz Clock: 74.250 MHz
    VIC  34 1920x1080@30Hz 16:9  HorFreq: 33750 Hz Clock: 74.250 MHz
    VIC   4 1280x720@60Hz 16:9  HorFreq: 45000 Hz Clock: 74.250 MHz
    VIC   2 720x480@60Hz 4:3  HorFreq: 31469 Hz Clock: 27.000 MHz
    VIC   5 1920x1080i@60Hz 16:9  HorFreq: 33750 Hz Clock: 74.250 MHz
    VIC   6 1440x480i@60Hz 4:3  HorFreq: 15734 Hz Clock: 27.000 MHz
    VIC   7 1440x480i@60Hz 16:9  HorFreq: 15734 Hz Clock: 27.000 MHz
    VIC   1 640x480@60Hz 4:3  HorFreq: 31469 Hz Clock: 25.175 MHz
  Audio data block
    Linear PCM, max channels 2
      Supported sample rates (kHz): 48 44.1 32
      Supported sample sizes (bits): 24 20 16
    AC-3, max channels 6
      Supported sample rates (kHz): 48 44.1 32
      Maximum bit rate: 640 kHz
  Speaker allocation data block
    Speaker map:
      FL/FR - Front Left/Right
  Extended tag: Video capability data block
    YCbCr quantization: No Data (0)
    RGB quantization: Selectable (via AVI Q) (1)
    PT scan behaviour: Support both over- and underscan (3)
    IT scan behaviour: Support both over- and underscan (3)
    CE scan behaviour: Support both over- and underscan (3)
  Vendor-specific data block, OUI 000c03 (HDMI)
    Source physical address 1.0.0.0
Basic audio support
Supports YCbCr 4:4:4
Supports YCbCr 4:2:2
0 native detailed modes
Detailed mode: Clock 74.250 MHz, 16 mm x 9 mm
               1920 2558 2602 2750 hborder 0
               1080 1084 1089 1125 vborder 0
               +hsync +vsync 
               VertFreq: 24 Hz, HorFreq: 27000 Hz
Detailed mode: Clock 74.250 MHz, 16 mm x 9 mm
               1920 2008 2052 2200 hborder 0
               1080 1084 1089 1125 vborder 0
               +hsync +vsync 
               VertFreq: 30 Hz, HorFreq: 33750 Hz
Detailed mode: Clock 74.250 MHz, 16 mm x 9 mm
               1280 1390 1430 1650 hborder 0
                720  725  730  750 vborder 0
               +hsync +vsync 
               VertFreq: 60 Hz, HorFreq: 45000 Hz
Detailed mode: Clock 85.500 MHz, 16 mm x 9 mm
               1360 1424 1536 1792 hborder 0
                768  771  777  795 vborder 0
               +hsync +vsync 
               VertFreq: 60 Hz, HorFreq: 47712 Hz
Detailed mode: Clock 68.250 MHz, 5 mm x 3 mm
               1280 1328 1360 1440 hborder 0
                768  771  778  790 vborder 0
               +hsync -vsync 
               VertFreq: 59 Hz, HorFreq: 47395 Hz
Checksum: 0x45 (valid)
