edid-decode (hex):

00 ff ff ff ff ff ff 00 0d ae 40 10 00 00 00 00
17 17 01 04 90 16 0d 78 02 f5 f5 94 56 54 91 28
22 50 54 00 00 00 01 01 01 01 01 01 01 01 01 01
01 01 01 01 01 01 da 1d 56 e2 50 00 20 30 44 2d
47 00 de 7d 00 00 00 1a e7 13 56 e2 50 00 20 30
44 2d 47 00 de 7d 00 00 00 1a 00 00 00 00 00 00
00 00 00 00 00 00 00 00 00 00 00 00 00 00 00 02
00 0c 3f d8 0c 3c 64 10 09 0f 75 00 00 00 00 7b

----------------

Block 0, Base EDID:
  EDID Structure Version & Revision: 1.4
  Vendor & Product Identification:
    Manufacturer: CMN
    Model: 4160
    Made in: week 23 of 2013
  Basic Display Parameters & Features:
    Digital display
    Bits per primary color channel: 6
    Digital interface is not defined
    Maximum image size: 22 cm x 13 cm
    Gamma: 2.20
    Supported color formats: RGB 4:4:4
    First detailed timing includes the native pixel format and preferred refresh rate
  Color Characteristics:
    Red  : 0.5810, 0.3388
    Green: 0.3291, 0.5673
    Blue : 0.1591, 0.1357
    White: 0.3134, 0.3291
  Established Timings I & II: none
  Standard Timings: none
  Detailed Timing Descriptors:
    DTD 1:  1366x768    60.003 Hz 683:384  48.003 kHz  76.420 MHz (222 mm x 125 mm)
                 Hfront   68 Hsync  45 Hback 113 Hpol P
                 Vfront    4 Vsync   7 Vback  21 Vpol N
    DTD 2:  1366x768    40.005 Hz 683:384  32.004 kHz  50.950 MHz (222 mm x 125 mm)
                 Hfront   68 Hsync  45 Hback 113 Hpol P
                 Vfront    4 Vsync   7 Vback  21 Vpol N
    Empty Descriptor
    Manufacturer-Specified Display Descriptor (0x02): 00 02 00 0c 3f d8 0c 3c 64 10 09 0f 75 00 00 00 '....?..<d...u...'
Checksum: 0x7b

----------------

Failures:

Block 0, Base EDID:
  Empty Descriptor: Use Dummy Descriptor instead of all zeroes.
  Missing Display Product Name.

EDID conformity: FAIL
