edid-decode (hex):

00 ff ff ff ff ff ff 00 42 49 18 32 00 00 00 00
1c 11 01 03 08 46 27 78 c8 f2 7c a4 54 45 9a 24
12 48 4b af ce 00 a9 40 61 59 45 59 31 59 81 80
d1 c0 01 01 01 01 a0 0f 20 00 31 58 1c 20 28 80
14 00 e7 12 11 00 00 1e 00 00 00 fc 00 4c 43 2d
33 32 48 43 33 36 0a 20 20 20 00 00 00 fd 00 37
56 1e 60 11 00 0a 20 20 20 20 20 20 00 00 00 ff
00 30 35 39 32 35 36 38 37 36 39 38 0a 20 00 0f

----------------

Block 0, Base EDID:
  EDID Structure Version & Revision: 1.3
  Vendor & Product Identification:
    Manufacturer: PRI
    Model: 12824
    Made in: week 28 of 2007
  Basic Display Parameters & Features:
    Analog display
    Input voltage level: 0.7/0.3 V
    Blank level equals black level
    Sync: Separate
    Maximum image size: 70 cm x 39 cm
    Gamma: 2.20
    DPMS levels: Standby Suspend
    RGB color display
  Color Characteristics:
    Red  : 0.6435, 0.3310
    Green: 0.2695, 0.6035
    Blue : 0.1416, 0.0732
    White: 0.2841, 0.2929
  Established Timings I & II:
    IBM     :   720x400    70.081663 Hz   9:5     31.467 kHz     28.320000 MHz
    DMT 0x04:   640x480    59.940476 Hz   4:3     31.469 kHz     25.175000 MHz
    DMT 0x05:   640x480    72.808802 Hz   4:3     37.861 kHz     31.500000 MHz
    DMT 0x06:   640x480    75.000000 Hz   4:3     37.500 kHz     31.500000 MHz
    DMT 0x08:   800x600    56.250000 Hz   4:3     35.156 kHz     36.000000 MHz
    DMT 0x09:   800x600    60.316541 Hz   4:3     37.879 kHz     40.000000 MHz
    DMT 0x0a:   800x600    72.187572 Hz   4:3     48.077 kHz     50.000000 MHz
    DMT 0x0b:   800x600    75.000000 Hz   4:3     46.875 kHz     49.500000 MHz
    DMT 0x10:  1024x768    60.003840 Hz   4:3     48.363 kHz     65.000000 MHz
    DMT 0x11:  1024x768    70.069359 Hz   4:3     56.476 kHz     75.000000 MHz
    DMT 0x12:  1024x768    75.028582 Hz   4:3     60.023 kHz     78.750000 MHz
  Standard Timings:
    DMT 0x33:  1600x1200   60.000000 Hz   4:3     75.000 kHz    162.000000 MHz
    DMT 0x13:  1024x768    84.996690 Hz   4:3     68.677 kHz     94.500000 MHz
    DMT 0x0c:   800x600    85.061274 Hz   4:3     53.674 kHz     56.250000 MHz
    DMT 0x07:   640x480    85.008312 Hz   4:3     43.269 kHz     36.000000 MHz
    DMT 0x23:  1280x1024   60.019740 Hz   5:4     63.981 kHz    108.000000 MHz
    DMT 0x52:  1920x1080   60.000000 Hz  16:9     67.500 kHz    148.500000 MHz
  Detailed Timing Descriptors:
    DTD 1:   800x600    60.316541 Hz   4:3     37.879 kHz     40.000000 MHz (487 mm x 274 mm)
                 Hfront   40 Hsync 128 Hback   88 Hpol P
                 Vfront    1 Vsync   4 Vback   23 Vpol P
    Display Product Name: 'LC-32HC36'
    Display Range Limits:
      Monitor ranges (GTF): 55-86 Hz V, 30-96 kHz H, max dotclock 170 MHz
    Display Product Serial Number: ...
Checksum: 0x0f

----------------

Failures:

Block 0, Base EDID:
  Basic Display Parameters & Features: EDID 1.3 requires that the first detailed timing is the preferred timing.
  Detailed Timing Descriptor #1: Mismatch of image size 487x274 mm vs display size 700x390 mm.

EDID conformity: FAIL
