
EDID (hex):
00ffffffffffff001ef9ff050a4b0000
260e0103681e1778eab4a5a1584e9726
165054b56a00314f454f614f01010101
01010101010164190040410026301888
360030e410000018000000fd00384b1f
3f08000a202020202020000000fe0047
4154455741590a2020202020000000fc
00465044313533300a20202020200042

Extracted contents:
header:          00 ff ff ff ff ff ff 00
serial number:   1e f9 ff 05 0a 4b 00 00 26 0e
version:         01 03
basic params:    68 1e 17 78 ea
chroma info:     b4 a5 a1 58 4e 97 26 16 50 54
established:     b5 6a 00
standard:        31 4f 45 4f 61 4f 01 01 01 01 01 01 01 01 01 01
descriptor 1:    64 19 00 40 41 00 26 30 18 88 36 00 30 e4 10 00 00 18
descriptor 2:    00 00 00 fd 00 38 4b 1f 3f 08 00 0a 20 20 20 20 20 20
descriptor 3:    00 00 00 fe 00 47 41 54 45 57 41 59 0a 20 20 20 20 20
descriptor 4:    00 00 00 fc 00 46 50 44 31 35 33 30 0a 20 20 20 20 20
extensions:      00
checksum:        42

EDID version: 1.3
Manufacturer: GWY Model 5ff Serial Number --
Analog display, Input voltage level: 0.7/0.7 V
Sync: Separate 
Maximum image size: 30 cm x 23 cm
Gamma: 2.20
DPMS levels: Standby Suspend Off
RGB color display
First detailed timing is preferred timing
Display x,y Chromaticity:
  Red:   0.6308, 0.3466
  Green: 0.3056, 0.5898
  Blue:  0.1503, 0.0878
  White: 0.3134, 0.3291
Established timings supported:
  720x400@70Hz 9:5 HorFreq: 31469 Hz Clock: 28.320 MHz
  640x480@60Hz 4:3 HorFreq: 31469 Hz Clock: 25.175 MHz
  640x480@67Hz 4:3 HorFreq: 35000 Hz Clock: 30.240 MHz
  640x480@75Hz 4:3 HorFreq: 37500 Hz Clock: 31.500 MHz
  800x600@60Hz 4:3 HorFreq: 37900 Hz Clock: 40.000 MHz
  800x600@75Hz 4:3 HorFreq: 46900 Hz Clock: 49.500 MHz
  832x624@75Hz 4:3 HorFreq: 49726 Hz Clock: 57.284 MHz
  1024x768@60Hz 4:3 HorFreq: 48400 Hz Clock: 65.000 MHz
  1024x768@75Hz 4:3 HorFreq: 60000 Hz Clock: 78.750 MHz
Standard timings supported:
  640x480@75Hz 4:3 HorFreq: 37500 Hz Clock: 31.500 MHz
  800x600@75Hz 4:3 HorFreq: 46900 Hz Clock: 49.500 MHz
  1024x768@75Hz 4:3 HorFreq: 60000 Hz Clock: 78.750 MHz
Detailed mode: Clock 65.000 MHz, 304 mm x 228 mm
               1024 1048 1184 1344 hborder 0
                768  771  777  806 vborder 0
               -hsync -vsync 
               VertFreq: 60 Hz, HorFreq: 48363 Hz
Monitor ranges (GTF): 56-75Hz V, 31-63kHz H, max dotclock 80MHz
ASCII string: GATEWAY
Monitor name: FPD1530
Checksum: 0x42 (valid)
EDID block does not conform at all!
	Bad year of manufacture
