edid-decode (hex):

00 ff ff ff ff ff ff 00 21 63 0e 03 33 60 03 00
1e 0f 01 03 68 20 18 78 2a ee a6 9e 54 4c 99 26
19 4f 54 ad cf 00 81 80 01 01 01 01 01 01 01 01
01 01 01 01 01 01 bc 34 00 98 51 00 2a 40 10 90
13 00 5e 0e 11 00 00 1e 00 00 00 fd 00 3c 4b 1f
50 0e 00 0a 20 20 20 20 20 20 00 00 00 fc 00 4c
43 44 0a 20 20 20 20 20 20 20 20 20 00 00 00 fe
00 68 63 30 30 30 35 37 32 32 31 32 33 35 00 47

----------------

Block 0, Base EDID:
  EDID Structure Version & Revision: 1.3
  Vendor & Product Identification:
    Manufacturer: HKC
    Model: 782
    Serial Number: ...
    Made in: week 30 of 2005
  Basic Display Parameters & Features:
    Analog display
    Input voltage level: 0.7/0.7 V
    Blank level equals black level
    Sync: Separate
    Maximum image size: 32 cm x 24 cm
    Gamma: 2.20
    DPMS levels: Off
    RGB color display
    First detailed timing is the preferred timing
  Color Characteristics:
    Red  : 0.6201, 0.3300
    Green: 0.2998, 0.5996
    Blue : 0.1503, 0.0996
    White: 0.3095, 0.3300
  Established Timings I & II:
    IBM     :   720x400    70.082 Hz   9:5    31.467 kHz  28.320 MHz
    DMT 0x04:   640x480    59.940 Hz   4:3    31.469 kHz  25.175 MHz
    DMT 0x05:   640x480    72.809 Hz   4:3    37.861 kHz  31.500 MHz
    DMT 0x06:   640x480    75.000 Hz   4:3    37.500 kHz  31.500 MHz
    DMT 0x09:   800x600    60.317 Hz   4:3    37.879 kHz  40.000 MHz
    DMT 0x0a:   800x600    72.188 Hz   4:3    48.077 kHz  50.000 MHz
    DMT 0x0b:   800x600    75.000 Hz   4:3    46.875 kHz  49.500 MHz
    DMT 0x10:  1024x768    60.004 Hz   4:3    48.363 kHz  65.000 MHz
    DMT 0x11:  1024x768    70.069 Hz   4:3    56.476 kHz  75.000 MHz
    DMT 0x12:  1024x768    75.029 Hz   4:3    60.023 kHz  78.750 MHz
    DMT 0x24:  1280x1024   75.025 Hz   5:4    79.976 kHz 135.000 MHz
  Standard Timings:
    DMT 0x23:  1280x1024   60.020 Hz   5:4    63.981 kHz 108.000 MHz
  Detailed Timing Descriptors:
    DTD 1:  1280x1024   75.025 Hz   5:4    79.976 kHz 135.000 MHz (350 mm x 270 mm)
                 Hfront   16 Hsync 144 Hback 248 Hpol P
                 Vfront    1 Vsync   3 Vback  38 Vpol P
  Display Range Limits:
    Monitor ranges (GTF): 60-75 Hz V, 31-80 kHz H, max dotclock 140 MHz
    Display Product Name: 'LCD'
    Alphanumeric Data String: 'hc00057221235'
Checksum: 0x47

----------------

Failures:

Block 0, Base EDID:
  Detailed Timing Descriptor #1: Mismatch of image size 350x270 mm vs display size 320x240 mm.

EDID conformity: FAIL
