edid-decode (hex):

00 ff ff ff ff ff ff 00 36 98 11 05 ad 6a 58 51
1e 0f 01 03 80 00 00 78 e8 e2 e5 a3 57 4b 9c 25
11 50 54 25 4b 00 a9 40 81 80 01 01 01 01 01 01
01 01 01 01 01 01 57 63 00 88 f0 00 2a 40 10 10
17 00 3a 20 41 00 00 1e 00 00 00 00 00 00 00 00
00 00 00 00 00 00 00 00 00 00 00 00 00 00 00 00
00 00 00 00 00 00 00 00 00 00 00 00 00 00 00 00
00 00 00 00 00 00 00 00 00 00 00 00 00 00 00 dd

----------------

Block 0, Base EDID:
  EDID Structure Version & Revision: 1.3
  Vendor & Product Identification:
    Manufacturer: MTX
    Model: 1297
    Serial Number: ...
    Made in: week 30 of 2005
  Basic Display Parameters & Features:
    Digital display
    Image size is variable
    Gamma: 2.20
    DPMS levels: Standby Suspend Off
    RGB color display
  Color Characteristics:
    Red  : 0.6396, 0.3417
    Green: 0.2929, 0.6113
    Blue : 0.1474, 0.0683
    White: 0.3134, 0.3291
  Established Timings I & II:
    DMT 0x04:   640x480    59.940 Hz   4:3    31.469 kHz  25.175 MHz
    DMT 0x06:   640x480    75.000 Hz   4:3    37.500 kHz  31.500 MHz
    DMT 0x09:   800x600    60.317 Hz   4:3    37.879 kHz  40.000 MHz
    DMT 0x0b:   800x600    75.000 Hz   4:3    46.875 kHz  49.500 MHz
    DMT 0x10:  1024x768    60.004 Hz   4:3    48.363 kHz  65.000 MHz
    DMT 0x12:  1024x768    75.029 Hz   4:3    60.023 kHz  78.750 MHz
    DMT 0x24:  1280x1024   75.025 Hz   5:4    79.976 kHz 135.000 MHz
  Standard Timings:
    DMT 0x33:  1600x1200   60.000 Hz   4:3    75.000 kHz 162.000 MHz
    DMT 0x23:  1280x1024   60.020 Hz   5:4    63.981 kHz 108.000 MHz
  Detailed Timing Descriptors:
    DTD 1:  3840x1024   60.001 Hz  15:4    63.961 kHz 254.310 MHz (1082 mm x 288 mm)
                 Hfront   16 Hsync  16 Hback 104 Hpol P
                 Vfront    1 Vsync   7 Vback  34 Vpol P
    Empty Descriptor
    Empty Descriptor
    Empty Descriptor
Checksum: 0xdd

----------------

Failures:

Block 0, Base EDID:
  Basic Display Parameters & Features: EDID 1.3 requires that the first detailed timing is the preferred timing.
  Detailed Timing Descriptor #1: Mismatch of image size vs display size: image size is set, but not display size.
  Empty Descriptor: Use Dummy Descriptor instead of all zeroes.
  Empty Descriptor: Use Dummy Descriptor instead of all zeroes.
  Empty Descriptor: Use Dummy Descriptor instead of all zeroes.
  Missing Display Product Name.
  Missing Display Range Limits Descriptor.

EDID conformity: FAIL
