
EDID (hex):
00ffffffffffff00220e263401010101
2f1b010380361e782a9055a75553a028
135054a10800d1c0a9c081c0b3009500
810081800101023a801871382d40582c
45001f2e2100001e000000fd002a901e
f021000a202020202020000000fc004f
4d454e206279204850203235000000ff
00334351373437313150560a20200142
020321f149901f041303021211012309
070765030c001000681a000001012a90
edfe5b80a07038354030203500fe1f11
00001ea96580a070383a4030203500fe
1f1100001e866f80a070384040302035
00fe1f1100001efa7e80887038124018
203500ba892100001c00000000000000
000000000000000000000000000000cb

Extracted contents:
header:          00 ff ff ff ff ff ff 00
serial number:   22 0e 26 34 01 01 01 01 2f 1b
version:         01 03
basic params:    80 36 1e 78 2a
chroma info:     90 55 a7 55 53 a0 28 13 50 54
established:     a1 08 00
standard:        d1 c0 a9 c0 81 c0 b3 00 95 00 81 00 81 80 01 01
descriptor 1:    02 3a 80 18 71 38 2d 40 58 2c 45 00 1f 2e 21 00 00 1e
descriptor 2:    00 00 00 fd 00 2a 90 1e f0 21 00 0a 20 20 20 20 20 20
descriptor 3:    00 00 00 fc 00 4f 4d 45 4e 20 62 79 20 48 50 20 32 35
descriptor 4:    00 00 00 ff 00 33 43 51 37 34 37 31 31 50 56 0a 20 20
extensions:      01
checksum:        42

EDID version: 1.3
Manufacturer: HPN Model 3426 Serial Number --
Made in week 47 of 2017
Digital display
Maximum image size: 54 cm x 30 cm
Gamma: 2.20
DPMS levels: Off
RGB color display
First detailed timing is preferred timing
Display x,y Chromaticity:
  Red:   0.6542, 0.3330
  Green: 0.3242, 0.6250
  Blue:  0.1572, 0.0751
  White: 0.3134, 0.3291
Established timings supported:
  720x400@70Hz 9:5 HorFreq: 31469 Hz Clock: 28.320 MHz
  640x480@60Hz 4:3 HorFreq: 31469 Hz Clock: 25.175 MHz
  800x600@60Hz 4:3 HorFreq: 37900 Hz Clock: 40.000 MHz
  1024x768@60Hz 4:3 HorFreq: 48400 Hz Clock: 65.000 MHz
Standard timings supported:
  1920x1080@60Hz 16:9
  1600x900@60Hz 16:9
  1280x720@60Hz 16:9
  1680x1050@60Hz 16:10 HorFreq: 64700 Hz Clock: 119.000 MHz
  1440x900@60Hz 16:10 HorFreq: 55500 Hz Clock: 88.750 MHz
  1280x800@60Hz 16:10
  1280x1024@60Hz 5:4 HorFreq: 64000 Hz Clock: 108.000 MHz
Detailed mode: Clock 148.500 MHz, 543 mm x 302 mm
               1920 2008 2052 2200 hborder 0
               1080 1084 1089 1125 vborder 0
               +hsync +vsync 
               VertFreq: 60 Hz, HorFreq: 67500 Hz
Monitor ranges (GTF): 42-144Hz V, 30-240kHz H, max dotclock 330MHz
Serial number: --
Has 1 extension blocks
Checksum: 0x42 (valid)

CTA extension block
Extension version: 3
29 bytes of CTA data
  Video data block
    VIC  16 1920x1080@60Hz 16:9 (native) HorFreq: 67500 Hz Clock: 148.500 MHz
    VIC  31 1920x1080@50Hz 16:9  HorFreq: 56250 Hz Clock: 148.500 MHz
    VIC   4 1280x720@60Hz 16:9  HorFreq: 45000 Hz Clock: 74.250 MHz
    VIC  19 1280x720@50Hz 16:9  HorFreq: 37500 Hz Clock: 74.250 MHz
    VIC   3 720x480@60Hz 16:9  HorFreq: 31469 Hz Clock: 27.000 MHz
    VIC   2 720x480@60Hz 4:3  HorFreq: 31469 Hz Clock: 27.000 MHz
    VIC  18 720x576@50Hz 16:9  HorFreq: 31250 Hz Clock: 27.000 MHz
    VIC  17 720x576@50Hz 4:3  HorFreq: 31250 Hz Clock: 27.000 MHz
    VIC   1 640x480@60Hz 4:3  HorFreq: 31469 Hz Clock: 25.175 MHz
  Audio data block
    Linear PCM, max channels 2
      Supported sample rates (kHz): 48 44.1 32
      Supported sample sizes (bits): 24 20 16
  Vendor-specific data block, OUI 000c03 (HDMI)
    Source physical address 1.0.0.0
  Vendor-specific data block, OUI 00001a
Underscans PC formats by default
Basic audio support
Supports YCbCr 4:4:4
Supports YCbCr 4:2:2
1 native detailed modes
Detailed mode: Clock 235.500 MHz, 510 mm x 287 mm
               1920 1968 2000 2080 hborder 0
               1080 1083 1088 1133 vborder 0
               +hsync +vsync 
               VertFreq: 99 Hz, HorFreq: 113221 Hz
Detailed mode: Clock 260.250 MHz, 510 mm x 287 mm
               1920 1968 2000 2080 hborder 0
               1080 1083 1088 1138 vborder 0
               +hsync +vsync 
               VertFreq: 109 Hz, HorFreq: 125120 Hz
Detailed mode: Clock 285.500 MHz, 510 mm x 287 mm
               1920 1968 2000 2080 hborder 0
               1080 1083 1088 1144 vborder 0
               +hsync +vsync 
               VertFreq: 119 Hz, HorFreq: 137259 Hz
Detailed mode: Clock 325.060 MHz, 698 mm x 393 mm
               1920 1944 1976 2056 hborder 0
               1080 1083 1088 1098 vborder 0
               -hsync +vsync 
               VertFreq: 143 Hz, HorFreq: 158103 Hz
Checksum: 0xcb (valid)

EDID block does NOT conform to EDID 1.3!
	Name descriptor not terminated with a newline
EDID block does not conform at all!
	Both the serial number and the serial string are set
