edid-decode (hex):

00 ff ff ff ff ff ff 00 22 64 6f 4b 01 01 01 01
02 15 01 03 80 2f 1e 78 ea 0d f5 a5 57 4c a1 23
10 50 54 bf ef 80 b3 00 a9 40 95 0f 81 80 81 40
81 c0 71 4f 61 46 21 39 90 30 62 1a 27 40 68 b0
36 00 d9 28 11 00 00 1c 00 00 00 fc 00 48 41 32
32 34 44 50 42 0a 20 20 20 20 00 00 00 fd 00 38
4b 18 53 11 00 0a 20 20 20 20 20 20 00 00 00 ff
00 31 30 32 35 50 33 4c 59 30 30 36 33 38 00 32

----------------

Block 0, Base EDID:
  EDID Structure Version & Revision: 1.3
  Vendor & Product Identification:
    Manufacturer: HSD
    Model: 19311
    Serial Number: ...
    Made in: week 2 of 2011
  Basic Display Parameters & Features:
    Digital display
    Maximum image size: 47 cm x 30 cm
    Gamma: 2.20
    DPMS levels: Standby Suspend Off
    RGB color display
    First detailed timing is the preferred timing
  Color Characteristics:
    Red  : 0.6445, 0.3398
    Green: 0.2998, 0.6298
    Blue : 0.1396, 0.0654
    White: 0.3134, 0.3291
  Established Timings I & II:
    IBM     :   720x400    70.081663 Hz   9:5     31.467 kHz     28.320000 MHz
    DMT 0x04:   640x480    59.940476 Hz   4:3     31.469 kHz     25.175000 MHz
    Apple   :   640x480    66.666667 Hz   4:3     35.000 kHz     30.240000 MHz
    DMT 0x05:   640x480    72.808802 Hz   4:3     37.861 kHz     31.500000 MHz
    DMT 0x06:   640x480    75.000000 Hz   4:3     37.500 kHz     31.500000 MHz
    DMT 0x08:   800x600    56.250000 Hz   4:3     35.156 kHz     36.000000 MHz
    DMT 0x09:   800x600    60.316541 Hz   4:3     37.879 kHz     40.000000 MHz
    DMT 0x0a:   800x600    72.187572 Hz   4:3     48.077 kHz     50.000000 MHz
    DMT 0x0b:   800x600    75.000000 Hz   4:3     46.875 kHz     49.500000 MHz
    Apple   :   832x624    74.551266 Hz   4:3     49.726 kHz     57.284000 MHz
    DMT 0x10:  1024x768    60.003840 Hz   4:3     48.363 kHz     65.000000 MHz
    DMT 0x11:  1024x768    70.069359 Hz   4:3     56.476 kHz     75.000000 MHz
    DMT 0x12:  1024x768    75.028582 Hz   4:3     60.023 kHz     78.750000 MHz
    DMT 0x24:  1280x1024   75.024675 Hz   5:4     79.976 kHz    135.000000 MHz
    Apple   :  1152x870    75.061550 Hz 192:145   68.681 kHz    100.000000 MHz
  Standard Timings:
    DMT 0x3a:  1680x1050   59.954250 Hz  16:10    65.290 kHz    146.250000 MHz
    DMT 0x33:  1600x1200   60.000000 Hz   4:3     75.000 kHz    162.000000 MHz
    DMT 0x30:  1440x900    74.984427 Hz  16:10    70.635 kHz    136.750000 MHz
    DMT 0x23:  1280x1024   60.019740 Hz   5:4     63.981 kHz    108.000000 MHz
    DMT 0x20:  1280x960    60.000000 Hz   4:3     60.000 kHz    108.000000 MHz
    DMT 0x55:  1280x720    60.000000 Hz  16:9     45.000 kHz     74.250000 MHz
    DMT 0x15:  1152x864    75.000000 Hz   4:3     67.500 kHz    108.000000 MHz
    GTF     :  1024x768    65.999558 Hz   4:3     52.668 kHz     71.628000 MHz
  Detailed Timing Descriptors:
    DTD 1:  1680x1050   59.954250 Hz   8:5     65.290 kHz    146.250000 MHz (473 mm x 296 mm)
                 Hfront  104 Hsync 176 Hback  280 Hpol N
                 Vfront    3 Vsync   6 Vback   30 Vpol P
    Display Product Name: 'HA224DPB'
    Display Range Limits:
      Monitor ranges (GTF): 56-75 Hz V, 24-83 kHz H, max dotclock 170 MHz
    Display Product Serial Number: ...
Checksum: 0x32

----------------

EDID conformity: PASS
