
EDID (hex):
00ffffffffffff000610b79c00000000
16130103802115780ae585a3544f9c26
0e505400000001010101010101010101
0101010101017c2e90a0601a1e403020
36004bcf100000190000000100061030
00000000000000000a20000000fe004c
544e3135344d543037000a20000000fc
00436f6c6f72204c43440a2020200008

Extracted contents:
header:          00 ff ff ff ff ff ff 00
serial number:   06 10 b7 9c 00 00 00 00 16 13
version:         01 03
basic params:    80 21 15 78 0a
chroma info:     e5 85 a3 54 4f 9c 26 0e 50 54
established:     00 00 00
standard:        01 01 01 01 01 01 01 01 01 01 01 01 01 01 01 01
descriptor 1:    7c 2e 90 a0 60 1a 1e 40 30 20 36 00 4b cf 10 00 00 19
descriptor 2:    00 00 00 01 00 06 10 30 00 00 00 00 00 00 00 00 0a 20
descriptor 3:    00 00 00 fe 00 4c 54 4e 31 35 34 4d 54 30 37 00 0a 20
descriptor 4:    00 00 00 fc 00 43 6f 6c 6f 72 20 4c 43 44 0a 20 20 20
extensions:      00
checksum:        08

EDID version: 1.3
Manufacturer: APP Model 9cb7 Serial Number --
Made in week 22 of 2009
Digital display
Maximum image size: 33 cm x 21 cm
Gamma: 2.20
RGB color display
First detailed timing is preferred timing
Display x,y Chromaticity:
  Red:   0.6396, 0.3300
  Green: 0.3095, 0.6103
  Blue:  0.1503, 0.0546
  White: 0.3134, 0.3291
Established timings supported:
Standard timings supported:
Detailed mode: Clock 119.000 MHz, 331 mm x 207 mm
               1680 1728 1760 1840 hborder 0
               1050 1053 1059 1080 vborder 0
               -hsync -vsync 
               VertFreq: 59 Hz, HorFreq: 64673 Hz
Manufacturer-specified data, tag 1
ASCII string: LTN154MT07
Monitor name: Color LCD
Checksum: 0x8 (valid)
EDID block does NOT conform to EDID 1.3!
	Missing monitor ranges
	Detailed block string not properly terminated
