
EDID (hex):
00ffffffffffff001e6d9e4e2bf80800
06130103ea2d1978eaa680a5554d9d25
115054a76a80a9c081808140714f0101
010101010101302a40c8608464301850
1300bbf91000001e302a40c860846430
18501300bbf91000001e000000fd0038
4b1e530f000a202020202020000000fc
0057323034330a20202020202020000f

edid-decode (hex):

00 ff ff ff ff ff ff 00 1e 6d 9e 4e 2b f8 08 00
06 13 01 03 ea 2d 19 78 ea a6 80 a5 55 4d 9d 25
11 50 54 a7 6a 80 a9 c0 81 80 81 40 71 4f 01 01
01 01 01 01 01 01 30 2a 40 c8 60 84 64 30 18 50
13 00 bb f9 10 00 00 1e 30 2a 40 c8 60 84 64 30
18 50 13 00 bb f9 10 00 00 1e 00 00 00 fd 00 38
4b 1e 53 0f 00 0a 20 20 20 20 20 20 00 00 00 fc
00 57 32 30 34 33 0a 20 20 20 20 20 20 20 00 0f

----------------

Block 0, Base EDID:
  EDID Structure Version & Revision: 1.3
  Vendor & Product Identification:
    Manufacturer: GSM
    Model: 20126
    Serial Number: 587819
    Made in: week 6 of 2009
  Basic Display Parameters & Features:
    Digital display
    Maximum image size: 45 cm x 25 cm
    Gamma: 2.20
    DPMS levels: Standby Suspend Off
    RGB color display
    First detailed timing is the preferred timing
  Color Characteristics:
    Red  : 0.6464, 0.3339
    Green: 0.3017, 0.6152
    Blue : 0.1464, 0.0664
    White: 0.3125, 0.3281
  Established Timings I & II:
    IBM     :   720x400    70.081663 Hz   9:5     31.467 kHz     28.320000 MHz
    DMT 0x04:   640x480    59.940476 Hz   4:3     31.469 kHz     25.175000 MHz
    DMT 0x06:   640x480    75.000000 Hz   4:3     37.500 kHz     31.500000 MHz
    DMT 0x08:   800x600    56.250000 Hz   4:3     35.156 kHz     36.000000 MHz
    DMT 0x09:   800x600    60.316541 Hz   4:3     37.879 kHz     40.000000 MHz
    DMT 0x0b:   800x600    75.000000 Hz   4:3     46.875 kHz     49.500000 MHz
    Apple   :   832x624    74.551266 Hz   4:3     49.726 kHz     57.284000 MHz
    DMT 0x10:  1024x768    60.003840 Hz   4:3     48.363 kHz     65.000000 MHz
    DMT 0x12:  1024x768    75.028582 Hz   4:3     60.023 kHz     78.750000 MHz
    Apple   :  1152x870    75.061550 Hz 192:145   68.681 kHz    100.000000 MHz
  Standard Timings:
    DMT 0x53:  1600x900    60.000000 Hz  16:9     60.000 kHz    108.000000 MHz (RB)
    DMT 0x23:  1280x1024   60.019740 Hz   5:4     63.981 kHz    108.000000 MHz
    DMT 0x20:  1280x960    60.000000 Hz   4:3     60.000 kHz    108.000000 MHz
    DMT 0x15:  1152x864    75.000000 Hz   4:3     67.500 kHz    108.000000 MHz
  Detailed Timing Descriptors:
    DTD 1:  1600x900    60.000000 Hz  16:9     60.000 kHz    108.000000 MHz (443 mm x 249 mm)
                 Hfront   24 Hsync  80 Hback   96 Hpol P
                 Vfront    1 Vsync   3 Vback   96 Vpol P
    DTD 2:  1600x900    60.000000 Hz  16:9     60.000 kHz    108.000000 MHz (443 mm x 249 mm)
                 Hfront   24 Hsync  80 Hback   96 Hpol P
                 Vfront    1 Vsync   3 Vback   96 Vpol P
    Display Range Limits:
      Monitor ranges (GTF): 56-75 Hz V, 30-83 kHz H, max dotclock 150 MHz
    Display Product Name: 'W2043'
Checksum: 0x0f
