edid-decode (hex):

00 ff ff ff ff ff ff 00 06 af 3c 36 00 00 00 00
0d 17 01 04 90 1f 11 78 02 bb f5 94 55 54 90 27
23 50 54 00 00 00 01 01 01 01 01 01 01 01 01 01
01 01 01 01 01 01 ce 1d 56 e2 50 00 1e 30 26 16
36 00 35 ad 10 00 00 18 00 00 00 0f 00 00 00 00
00 00 00 00 00 00 00 00 00 20 00 00 00 fe 00 41
55 4f 0a 20 20 20 20 20 20 20 20 20 00 00 00 fe
00 42 31 34 30 58 54 4e 30 33 2e 36 20 0a 00 c8

----------------

Block 0, Base EDID:
  EDID Structure Version & Revision: 1.4
  Vendor & Product Identification:
    Manufacturer: AUO
    Model: 13884
    Made in: week 13 of 2013
  Basic Display Parameters & Features:
    Digital display
    Bits per primary color channel: 6
    Digital interface is not defined
    Maximum image size: 31 cm x 17 cm
    Gamma: 2.20
    Supported color formats: RGB 4:4:4
    First detailed timing includes the native pixel format and preferred refresh rate
  Color Characteristics:
    Red  : 0.5800, 0.3349
    Green: 0.3300, 0.5654
    Blue : 0.1552, 0.1396
    White: 0.3134, 0.3291
  Established Timings I & II: none
  Standard Timings: none
  Detailed Timing Descriptors:
    DTD 1:  1366x768    60.059067 Hz 683:384   47.927 kHz     76.300000 MHz (309 mm x 173 mm)
                 Hfront   38 Hsync  22 Hback  166 Hpol N
                 Vfront    3 Vsync   6 Vback   21 Vpol N
    Manufacturer-Specified Display Descriptor (0x0f): 00 0f 00 00 00 00 00 00 00 00 00 00 00 00 00 20 '............... '
    Alphanumeric Data String: 'AUO'
    Alphanumeric Data String: 'B140XTN03.6 '
Checksum: 0xc8

----------------

Failures:

Block 0, Base EDID:
  Alphanumeric Data String: One or more trailing spaces.
  Missing Display Product Name.

EDID conformity: FAIL
