
EDID (hex):
00ffffffffffff000523000400000000
160f010388221b96e86e8ba25a4d9424
1a5156bfef0081800101010101010101
010101010101000000fc000a20202020
2020202020202020000000fc004c3137
31314d4e5f4449474954000000fd0028
4c1e510e000a202020202020000000ff
0030303030303030303030000000005c

edid-decode (hex):

00 ff ff ff ff ff ff 00 05 23 00 04 00 00 00 00
16 0f 01 03 88 22 1b 96 e8 6e 8b a2 5a 4d 94 24
1a 51 56 bf ef 00 81 80 01 01 01 01 01 01 01 01
01 01 01 01 01 01 00 00 00 fc 00 0a 20 20 20 20
20 20 20 20 20 20 20 20 00 00 00 fc 00 4c 31 37
31 31 4d 4e 5f 44 49 47 49 54 00 00 00 fd 00 28
4c 1e 51 0e 00 0a 20 20 20 20 20 20 00 00 00 ff
00 30 30 30 30 30 30 30 30 30 30 00 00 00 00 5c

----------------

Block 0, Base EDID:
  EDID Structure Version & Revision: 1.3
  Vendor & Product Identification:
    Manufacturer: AIC
    Model: 1024
    Made in: week 22 of 2005
  Basic Display Parameters & Features:
    Digital display
    Maximum image size: 34 cm x 27 cm
    Gamma: 2.50
    DPMS levels: Standby Suspend Off
    RGB color display
  Color Characteristics:
    Red  : 0.6337, 0.3535
    Green: 0.3037, 0.5800
    Blue : 0.1425, 0.1015
    White: 0.3183, 0.3388
  Established Timings I & II:
    IBM     :   720x400    70.081663 Hz   9:5     31.467 kHz     28.320000 MHz
    DMT 0x04:   640x480    59.940476 Hz   4:3     31.469 kHz     25.175000 MHz
    Apple   :   640x480    66.666667 Hz   4:3     35.000 kHz     30.240000 MHz
    DMT 0x05:   640x480    72.808802 Hz   4:3     37.861 kHz     31.500000 MHz
    DMT 0x06:   640x480    75.000000 Hz   4:3     37.500 kHz     31.500000 MHz
    DMT 0x08:   800x600    56.250000 Hz   4:3     35.156 kHz     36.000000 MHz
    DMT 0x09:   800x600    60.316541 Hz   4:3     37.879 kHz     40.000000 MHz
    DMT 0x0a:   800x600    72.187572 Hz   4:3     48.077 kHz     50.000000 MHz
    DMT 0x0b:   800x600    75.000000 Hz   4:3     46.875 kHz     49.500000 MHz
    Apple   :   832x624    74.551266 Hz   4:3     49.726 kHz     57.284000 MHz
    DMT 0x10:  1024x768    60.003840 Hz   4:3     48.363 kHz     65.000000 MHz
    DMT 0x11:  1024x768    70.069359 Hz   4:3     56.476 kHz     75.000000 MHz
    DMT 0x12:  1024x768    75.028582 Hz   4:3     60.023 kHz     78.750000 MHz
    DMT 0x24:  1280x1024   75.024675 Hz   5:4     79.976 kHz    135.000000 MHz
  Standard Timings:
    DMT 0x23:  1280x1024   60.019740 Hz   5:4     63.981 kHz    108.000000 MHz
  Detailed Timing Descriptors:
    Display Product Name: ''
    Display Product Name: 'L1711MN_DIGIT'
    Display Range Limits:
      Monitor ranges (GTF): 40-76 Hz V, 30-81 kHz H, max dotclock 140 MHz
    Display Product Serial Number: '0000000000'
Checksum: 0x5c
