
EDID (hex):
00ffffffffffff004c2dd0095641585a
151701030e3c22782af831a4564f9d27
0f5054bfef80714f81c0810081809500
a9c0b3000101023a801871382d40582c
450056502100001e000000fd00384b1e
5111000a202020202020000000fc0053
3237433435300a2020202020000000ff
00485451443530303534300a20200098

Extracted contents:
header:          00 ff ff ff ff ff ff 00
serial number:   4c 2d d0 09 56 41 58 5a 15 17
version:         01 03
basic params:    0e 3c 22 78 2a
chroma info:     f8 31 a4 56 4f 9d 27 0f 50 54
established:     bf ef 80
standard:        71 4f 81 c0 81 00 81 80 95 00 a9 c0 b3 00 01 01
descriptor 1:    02 3a 80 18 71 38 2d 40 58 2c 45 00 56 50 21 00 00 1e
descriptor 2:    00 00 00 fd 00 38 4b 1e 51 11 00 0a 20 20 20 20 20 20
descriptor 3:    00 00 00 fc 00 53 32 37 43 34 35 30 0a 20 20 20 20 20
descriptor 4:    00 00 00 ff 00 48 54 51 44 35 30 30 35 34 30 0a 20 20
extensions:      00
checksum:        98

EDID version: 1.3
Manufacturer: SAM Model 9d0 Serial Number --
Made in week 21 of 2013
Analog display, Input voltage level: 0.7/0.3 V
Sync: Separate Composite SyncOnGreen 
Maximum image size: 60 cm x 34 cm
Gamma: 2.20
DPMS levels: Off
RGB color display
First detailed timing is preferred timing
Display x,y Chromaticity:
  Red:   0.6435, 0.3388
  Green: 0.3105, 0.6132
  Blue:  0.1523, 0.0615
  White: 0.3125, 0.3291
Established timings supported:
  720x400@70Hz 9:5 HorFreq: 31469 Hz Clock: 28.320 MHz
  640x480@60Hz 4:3 HorFreq: 31469 Hz Clock: 25.175 MHz
  640x480@67Hz 4:3 HorFreq: 35000 Hz Clock: 30.240 MHz
  640x480@72Hz 4:3 HorFreq: 37900 Hz Clock: 31.500 MHz
  640x480@75Hz 4:3 HorFreq: 37500 Hz Clock: 31.500 MHz
  800x600@56Hz 4:3 HorFreq: 35200 Hz Clock: 36.000 MHz
  800x600@60Hz 4:3 HorFreq: 37900 Hz Clock: 40.000 MHz
  800x600@72Hz 4:3 HorFreq: 48100 Hz Clock: 50.000 MHz
  800x600@75Hz 4:3 HorFreq: 46900 Hz Clock: 49.500 MHz
  832x624@75Hz 4:3 HorFreq: 49726 Hz Clock: 57.284 MHz
  1024x768@60Hz 4:3 HorFreq: 48400 Hz Clock: 65.000 MHz
  1024x768@70Hz 4:3 HorFreq: 56500 Hz Clock: 75.000 MHz
  1024x768@75Hz 4:3 HorFreq: 60000 Hz Clock: 78.750 MHz
  1280x1024@75Hz 5:4 HorFreq: 80000 Hz Clock: 135.000 MHz
  1152x870@75Hz 192:145 HorFreq: 67500 Hz Clock: 108.000 MHz
Standard timings supported:
  1152x864@75Hz 4:3 HorFreq: 67500 Hz Clock: 108.000 MHz
  1280x720@60Hz 16:9
  1280x800@60Hz 16:10
  1280x1024@60Hz 5:4 HorFreq: 64000 Hz Clock: 108.000 MHz
  1440x900@60Hz 16:10 HorFreq: 55500 Hz Clock: 88.750 MHz
  1600x900@60Hz 16:9
  1680x1050@60Hz 16:10 HorFreq: 64700 Hz Clock: 119.000 MHz
Detailed mode: Clock 148.500 MHz, 598 mm x 336 mm
               1920 2008 2052 2200 hborder 0
               1080 1084 1089 1125 vborder 0
               +hsync +vsync 
               VertFreq: 60 Hz, HorFreq: 67500 Hz
Monitor ranges (GTF): 56-75Hz V, 30-81kHz H, max dotclock 170MHz
Monitor name: S27C450
Serial number: --
Checksum: 0x98 (valid)
