edid-decode (hex):

00 ff ff ff ff ff ff 00 5c 94 29 1e 01 01 01 01
06 19 01 03 08 58 31 78 0a 32 31 a1 54 52 9e 26
0a 47 4a af cf 80 95 00 b3 00 a9 c0 01 01 01 01
01 01 01 01 01 01 02 3a 80 18 71 38 2d 40 58 2c
45 00 00 00 00 00 00 1e 7f 21 56 aa 51 00 1e 30
46 8f 33 00 3f 43 21 00 00 1e 00 00 00 fc 00 44
57 4d 34 30 46 31 59 31 0a 20 20 20 00 00 00 ff
00 37 37 32 31 56 35 30 36 30 33 37 31 33 00 88

----------------

Block 0, Base EDID:
  EDID Structure Version & Revision: 1.3
  Vendor & Product Identification:
    Manufacturer: WDT
    Model: 7721
    Serial Number: ...
    Made in: week 6 of 2015
  Basic Display Parameters & Features:
    Analog display
    Input voltage level: 0.7/0.3 V
    Blank level equals black level
    Sync: Separate
    Maximum image size: 88 cm x 49 cm
    Gamma: 2.20
    RGB color display
    First detailed timing is the preferred timing
  Color Characteristics:
    Red  : 0.6289, 0.3310
    Green: 0.3203, 0.6191
    Blue : 0.1484, 0.0419
    White: 0.2773, 0.2900
  Established Timings I & II:
    IBM     :   720x400    70.082 Hz   9:5    31.467 kHz  28.320 MHz
    DMT 0x04:   640x480    59.940 Hz   4:3    31.469 kHz  25.175 MHz
    DMT 0x05:   640x480    72.809 Hz   4:3    37.861 kHz  31.500 MHz
    DMT 0x06:   640x480    75.000 Hz   4:3    37.500 kHz  31.500 MHz
    DMT 0x08:   800x600    56.250 Hz   4:3    35.156 kHz  36.000 MHz
    DMT 0x09:   800x600    60.317 Hz   4:3    37.879 kHz  40.000 MHz
    DMT 0x0a:   800x600    72.188 Hz   4:3    48.077 kHz  50.000 MHz
    DMT 0x0b:   800x600    75.000 Hz   4:3    46.875 kHz  49.500 MHz
    DMT 0x10:  1024x768    60.004 Hz   4:3    48.363 kHz  65.000 MHz
    DMT 0x11:  1024x768    70.069 Hz   4:3    56.476 kHz  75.000 MHz
    DMT 0x12:  1024x768    75.029 Hz   4:3    60.023 kHz  78.750 MHz
    DMT 0x24:  1280x1024   75.025 Hz   5:4    79.976 kHz 135.000 MHz
    Apple   :  1152x870    75.062 Hz 192:145  68.681 kHz 100.000 MHz
  Standard Timings:
    DMT 0x2f:  1440x900    59.887 Hz  16:10   55.935 kHz 106.500 MHz
    DMT 0x3a:  1680x1050   59.954 Hz  16:10   65.290 kHz 146.250 MHz
    DMT 0x53:  1600x900    60.000 Hz  16:9    60.000 kHz 108.000 MHz (RB)
  Detailed Timing Descriptors:
    DTD 1:  1920x1080   60.000 Hz  16:9    67.500 kHz 148.500 MHz
                 Hfront   88 Hsync  44 Hback 148 Hpol P
                 Vfront    4 Vsync   5 Vback  36 Vpol P
    DTD 2:  1366x768    59.964 Hz 683:384  47.852 kHz  85.750 MHz (575 mm x 323 mm)
                 Hfront   70 Hsync 143 Hback 213 Hpol P
                 Vfront    3 Vsync   3 Vback  24 Vpol P
    Display Product Name: 'DWM40F1Y1'
    Display Product Serial Number: ...
Checksum: 0x88

----------------

Failures:

Block 0, Base EDID:
  Detailed Timing Descriptor #1: Mismatch of image size vs display size: image size is not set, but display size is.
  Detailed Timing Descriptor #2: Mismatch of image size 575x323 mm vs display size 880x490 mm.
  Missing Display Range Limits Descriptor.

EDID conformity: FAIL
