edid-decode (hex):

00 ff ff ff ff ff ff 00 4d d9 00 26 01 01 01 01
02 10 01 03 80 26 1e 78 ea 68 75 a2 5a 49 9f 23
13 50 54 a1 08 00 81 80 81 40 01 01 01 01 01 01
01 01 01 01 01 01 30 2a 00 98 51 00 2a 40 30 70
13 00 78 2d 11 00 00 1e 00 00 00 fd 00 39 3f 1c
41 0b 00 0a 20 20 20 20 20 20 00 00 00 fc 00 53
44 4d 2d 48 53 39 35 50 0a 20 20 20 00 00 00 ff
00 31 35 31 33 34 35 30 0a 20 20 20 20 20 00 b1

----------------

Block 0, Base EDID:
  EDID Structure Version & Revision: 1.3
  Vendor & Product Identification:
    Manufacturer: SNY
    Model: 9728
    Serial Number: ...
    Made in: week 2 of 2006
  Basic Display Parameters & Features:
    Digital display
    Maximum image size: 38 cm x 30 cm
    Gamma: 2.20
    DPMS levels: Standby Suspend Off
    RGB color display
    First detailed timing is preferred timing
  Color Characteristics:
    Red  : 0.6337, 0.3535
    Green: 0.2871, 0.6210
    Blue : 0.1376, 0.0771
    White: 0.3134, 0.3291
  Established Timings I & II:
    IBM     :   720x400    70.082 Hz   9:5    31.467 kHz  28.320 MHz
    DMT 0x04:   640x480    59.940 Hz   4:3    31.469 kHz  25.175 MHz
    DMT 0x09:   800x600    60.317 Hz   4:3    37.879 kHz  40.000 MHz
    DMT 0x10:  1024x768    60.004 Hz   4:3    48.363 kHz  65.000 MHz
  Standard Timings:
    DMT 0x23:  1280x1024   60.020 Hz   5:4    63.981 kHz 108.000 MHz
    DMT 0x20:  1280x960    60.000 Hz   4:3    60.000 kHz 108.000 MHz
  Detailed Timing Descriptors:
    DTD 1:  1280x1024   60.020 Hz   5:4    63.981 kHz 108.000 MHz (376 mm x 301 mm)
                 Hfront   48 Hsync 112 Hback 248 Hpol P
                 Vfront    1 Vsync   3 Vback  38 Vpol P
  Display Range Limits:
    Monitor ranges (GTF): 57-63 Hz V, 28-65 kHz H, max dotclock 110 MHz
    Display Product Name: 'SDM-HS95P'
    Display Product Serial Number: ...
Checksum: 0xb1

----------------

Failures:

All Blocks:
  Some timings are out of range of the Monitor Ranges:
    Vertical Freq: 59.940 - 70.082 Hz (Monitor: 57.000 - 63.000 Hz)

EDID conformity: FAIL
