
EDID (hex):
00ffffffffffff004c2d99064f39454e
24140103802f1e782aee95a3544c9926
0f5454bfef8081808140714f81009500
950f810f01017c2e90a0601a1e403020
3600cb281100001a000000fd00384b1e
510f000a202020202020000000fc0053
4d4232323430570a20202020000000ff
00484d445a3930303934330a20200195
02010400011d007251d01e206e285500
cb281100001e011d00bc52d01e20b828
5540cb281100001e8c0ad09020403120
0c405500cb28110000188c0ad08a20e0
2d10103e9600cb281100001800000000
00000000000000000000000000000000
00000000000000000000000000000000
0000000000000000000000000000009b

Extracted contents:
header:          00 ff ff ff ff ff ff 00
serial number:   4c 2d 99 06 4f 39 45 4e 24 14
version:         01 03
basic params:    80 2f 1e 78 2a
chroma info:     ee 95 a3 54 4c 99 26 0f 54 54
established:     bf ef 80
standard:        81 80 81 40 71 4f 81 00 95 00 95 0f 81 0f 01 01
descriptor 1:    7c 2e 90 a0 60 1a 1e 40 30 20 36 00 cb 28 11 00 00 1a
descriptor 2:    00 00 00 fd 00 38 4b 1e 51 0f 00 0a 20 20 20 20 20 20
descriptor 3:    00 00 00 fc 00 53 4d 42 32 32 34 30 57 0a 20 20 20 20
descriptor 4:    00 00 00 ff 00 48 4d 44 5a 39 30 30 39 34 33 0a 20 20
extensions:      01
checksum:        95

EDID version: 1.3
Manufacturer: SAM Model 699 Serial Number --
Made in week 36 of 2010
Digital display
Maximum image size: 47 cm x 30 cm
Gamma: 2.20
DPMS levels: Off
RGB color display
First detailed timing is preferred timing
Display x,y Chromaticity:
  Red:   0.6396, 0.3300
  Green: 0.2998, 0.5996
  Blue:  0.1503, 0.0595
  White: 0.3291, 0.3291
Established timings supported:
  720x400@70Hz 9:5 HorFreq: 31469 Hz Clock: 28.320 MHz
  640x480@60Hz 4:3 HorFreq: 31469 Hz Clock: 25.175 MHz
  640x480@67Hz 4:3 HorFreq: 35000 Hz Clock: 30.240 MHz
  640x480@72Hz 4:3 HorFreq: 37900 Hz Clock: 31.500 MHz
  640x480@75Hz 4:3 HorFreq: 37500 Hz Clock: 31.500 MHz
  800x600@56Hz 4:3 HorFreq: 35200 Hz Clock: 36.000 MHz
  800x600@60Hz 4:3 HorFreq: 37900 Hz Clock: 40.000 MHz
  800x600@72Hz 4:3 HorFreq: 48100 Hz Clock: 50.000 MHz
  800x600@75Hz 4:3 HorFreq: 46900 Hz Clock: 49.500 MHz
  832x624@75Hz 4:3 HorFreq: 49726 Hz Clock: 57.284 MHz
  1024x768@60Hz 4:3 HorFreq: 48400 Hz Clock: 65.000 MHz
  1024x768@70Hz 4:3 HorFreq: 56500 Hz Clock: 75.000 MHz
  1024x768@75Hz 4:3 HorFreq: 60000 Hz Clock: 78.750 MHz
  1280x1024@75Hz 5:4 HorFreq: 80000 Hz Clock: 135.000 MHz
  1152x870@75Hz 192:145 HorFreq: 67500 Hz Clock: 108.000 MHz
Standard timings supported:
  1280x1024@60Hz 5:4 HorFreq: 64000 Hz Clock: 108.000 MHz
  1280x960@60Hz 4:3 HorFreq: 60000 Hz Clock: 108.000 MHz
  1152x864@75Hz 4:3 HorFreq: 67500 Hz Clock: 108.000 MHz
  1280x800@60Hz 16:10
  1440x900@60Hz 16:10 HorFreq: 55500 Hz Clock: 88.750 MHz
  1440x900@75Hz 16:10 HorFreq: 82300 Hz Clock: 156.000 MHz
  1280x800@75Hz 16:10
Detailed mode: Clock 119.000 MHz, 459 mm x 296 mm
               1680 1728 1760 1840 hborder 0
               1050 1053 1059 1080 vborder 0
               +hsync -vsync 
               VertFreq: 59 Hz, HorFreq: 64673 Hz
Monitor ranges (GTF): 56-75Hz V, 30-81kHz H, max dotclock 150MHz
Monitor name: SMB2240W
Serial number: --
Has 1 extension blocks
Checksum: 0x95 (valid)

CTA extension block
Extension version: 1
0 8-byte timing descriptors
Detailed mode: Clock 74.250 MHz, 459 mm x 296 mm
               1280 1390 1430 1650 hborder 0
                720  725  730  750 vborder 0
               +hsync +vsync 
               VertFreq: 60 Hz, HorFreq: 45000 Hz
Detailed mode: Clock 74.250 MHz, 459 mm x 296 mm
               1280 1720 1760 1980 hborder 0
                720  725  730  750 vborder 0
               +hsync +vsync 
               VertFreq: 50 Hz, HorFreq: 37500 Hz
Detailed mode: Clock 27.000 MHz, 459 mm x 296 mm
                720  732  796  864 hborder 0
                576  581  586  625 vborder 0
               -hsync -vsync 
               VertFreq: 50 Hz, HorFreq: 31250 Hz
Detailed mode: Clock 27.000 MHz, 459 mm x 296 mm
                720  736  798  858 hborder 0
                480  489  495  525 vborder 0
               -hsync -vsync 
               VertFreq: 59 Hz, HorFreq: 31468 Hz
Checksum: 0x9b (valid)

One or more of the timings is out of range of the Monitor Ranges:
  Vertical Freq: 50 - 75 Hz
  Horizontal Freq: 31250 - 82300 Hz
  Maximum Clock: 156.000 MHz
EDID block does not conform at all!
	Both the serial number and the serial string are set


