
EDID (hex):
00ffffffffffff003870360000000000
011c0104a5221378036850985c588e28
1b505400000001010101010101010101
0101010101010b8380047138ca403020
350058c21000001a0b83800471384d48
3020350058c21000001a000000fd0030
789a9a22010a202020202020000000fe
004c4d3135364c462d474c30330a00c9

Extracted contents:
header:          00 ff ff ff ff ff ff 00
serial number:   38 70 36 00 00 00 00 00 01 1c
version:         01 04
basic params:    a5 22 13 78 03
chroma info:     68 50 98 5c 58 8e 28 1b 50 54
established:     00 00 00
standard:        01 01 01 01 01 01 01 01 01 01 01 01 01 01 01 01
descriptor 1:    0b 83 80 04 71 38 ca 40 30 20 35 00 58 c2 10 00 00 1a
descriptor 2:    0b 83 80 04 71 38 4d 48 30 20 35 00 58 c2 10 00 00 1a
descriptor 3:    00 00 00 fd 00 30 78 9a 9a 22 01 0a 20 20 20 20 20 20
descriptor 4:    00 00 00 fe 00 4c 4d 31 35 36 4c 46 2d 47 4c 30 33 0a
extensions:      00
checksum:        c9

EDID version: 1.4
Manufacturer: NCP Model 36 Serial Number --
Made in week 1 of 2018
Digital display
8 bits per primary color channel
DisplayPort interface
Maximum image size: 34 cm x 19 cm
Gamma: 2.20
Supported color formats: RGB 4:4:4
First detailed timing includes the native pixel format and preferred refresh rate
Display is continuous frequency
Display x,y Chromaticity:
  Red:   0.5947, 0.3613
  Green: 0.3457, 0.5546
  Blue:  0.1572, 0.1064
  White: 0.3125, 0.3281
Established timings supported:
Standard timings supported:
Detailed mode: Clock 335.470 MHz, 344 mm x 194 mm
               1920 1968 2000 2180 hborder 0
               1080 1083 1088 1282 vborder 0
               +hsync -vsync 
               VertFreq: 120 Hz, HorFreq: 153885 Hz
Detailed mode: Clock 335.470 MHz, 344 mm x 194 mm
               1920 1968 2000 2180 hborder 0
               1080 1083 1088 3205 vborder 0
               +hsync -vsync 
               VertFreq: 48 Hz, HorFreq: 153885 Hz
Monitor ranges (bare limits): 48-120Hz V, 154-154kHz H, max dotclock 340MHz
ASCII string: LM156LF-GL03
Checksum: 0xc9 (valid)
EDID block does NOT conform to EDID 1.4!
	Missing name descriptor
Warning: One or more of the timings is out of range of the Monitor Ranges:
  Vertical Freq: 48 - 120 Hz
  Horizontal Freq: 153885 - 153885 Hz
  Maximum Clock: 335.470 MHz
