
EDID (hex):
00ffffffffffff0030e4fb0300000000
001701049026157802f195a35552a126
0f505400000001010101010101010101
0101010101014c3680a0703821403020
35007ed710000019332480a070382140
302035007ed710000019000000000000
00000000000000000000000000000002
000c33ff0a3c963223519600000000b0

Extracted contents:
header:          00 ff ff ff ff ff ff 00
serial number:   30 e4 fb 03 00 00 00 00 00 17
version:         01 04
basic params:    90 26 15 78 02
chroma info:     f1 95 a3 55 52 a1 26 0f 50 54
established:     00 00 00
standard:        01 01 01 01 01 01 01 01 01 01 01 01 01 01 01 01
descriptor 1:    4c 36 80 a0 70 38 21 40 30 20 35 00 7e d7 10 00 00 19
descriptor 2:    33 24 80 a0 70 38 21 40 30 20 35 00 7e d7 10 00 00 19
descriptor 3:    00 00 00 00 00 00 00 00 00 00 00 00 00 00 00 00 00 00
descriptor 4:    00 00 00 02 00 0c 33 ff 0a 3c 96 32 23 51 96 00 00 00
extensions:      00
checksum:        b0

EDID version: 1.4
Manufacturer: LGD Model 3fb Serial Number --
Made in year 2013
Digital display
6 bits per primary color channel
Digital interface is not defined
Maximum image size: 38 cm x 21 cm
Gamma: 2.20
Supported color formats: RGB 4:4:4
First detailed timing includes the native pixel format and preferred refresh rate
Display x,y Chromaticity:
  Red:   0.6396, 0.3349
  Green: 0.3203, 0.6298
  Blue:  0.1503, 0.0595
  White: 0.3134, 0.3291
Established timings supported:
Standard timings supported:
Detailed mode: Clock 139.000 MHz, 382 mm x 215 mm
               1920 1968 2000 2080 hborder 0
               1080 1083 1088 1113 vborder 0
               -hsync -vsync 
               VertFreq: 60 Hz, HorFreq: 66826 Hz
Detailed mode: Clock 92.670 MHz, 382 mm x 215 mm
               1920 1968 2000 2080 hborder 0
               1080 1083 1088 1113 vborder 0
               -hsync -vsync 
               VertFreq: 40 Hz, HorFreq: 44552 Hz
Manufacturer-specified data, tag 0
Manufacturer-specified data, tag 2
Checksum: 0xb0 (valid)
EDID block does NOT conform to EDID 1.4!
	Missing name descriptor
	Missing monitor ranges
