edid-decode (hex):

00 ff ff ff ff ff ff 00 4c 2d 91 00 31 32 42 4e
23 0d 01 03 0e 2b 20 a0 2a d0 c4 a1 5a 4b 97 23
17 4f 57 bf ef 80 a9 40 81 80 01 01 01 01 01 01
01 01 01 01 01 01 48 3f 40 30 62 b0 32 40 40 c0
13 00 b0 44 11 00 00 1e 00 00 00 fd 00 38 4b 1e
51 11 00 0a 20 20 20 20 20 20 00 00 00 fc 00 53
79 6e 63 4d 61 73 74 65 72 0a 20 20 00 00 00 ff
00 48 34 4a 57 38 30 36 35 36 35 0a 20 20 00 cf

00 ff ff ff ff ff ff 00 4c 2d 91 00 31 32 42 4e
23 0d 01 03 0e 2b 20 a0 2a d0 c4 a1 5a 4b 97 23
17 4f 57 bf ef 80 a9 40 81 80 01 01 01 01 01 01
01 01 01 01 01 01 48 3f 40 30 62 b0 32 40 40 c0
13 00 b0 44 11 00 00 1e 00 00 00 fd 00 38 4b 1e
51 11 00 0a 20 20 20 20 20 20 00 00 00 fc 00 53
79 6e 63 4d 61 73 74 65 72 0a 20 20 00 00 00 ff
00 48 34 4a 57 38 30 36 35 36 35 0a 20 20 00 cf

----------------

Block 0, Base EDID:
  EDID Structure Version & Revision: 1.3
  Vendor & Product Identification:
    Manufacturer: SAM
    Model: 145
    Serial Number: ...
    Made in: week 35 of 2003
  Basic Display Parameters & Features:
    Analog display
    Signal Level Standard: 0.700 : 0.300 : 1.000 V p-p
    Blank level equals black level
    Sync: Separate Composite SyncOnGreen
    Maximum image size: 43 cm x 32 cm
    Gamma: 2.60
    DPMS levels: Off
    RGB color display
    First detailed timing is the preferred timing
  Color Characteristics:
    Red  : 0.6318, 0.3525
    Green: 0.2929, 0.5898
    Blue : 0.1396, 0.0898
    White: 0.3095, 0.3398
  Established Timings I & II:
    IBM     :   720x400    70.081663 Hz   9:5     31.467 kHz     28.320000 MHz
    DMT 0x04:   640x480    59.940476 Hz   4:3     31.469 kHz     25.175000 MHz
    Apple   :   640x480    66.666667 Hz   4:3     35.000 kHz     30.240000 MHz
    DMT 0x05:   640x480    72.808802 Hz   4:3     37.861 kHz     31.500000 MHz
    DMT 0x06:   640x480    75.000000 Hz   4:3     37.500 kHz     31.500000 MHz
    DMT 0x08:   800x600    56.250000 Hz   4:3     35.156 kHz     36.000000 MHz
    DMT 0x09:   800x600    60.316541 Hz   4:3     37.879 kHz     40.000000 MHz
    DMT 0x0a:   800x600    72.187572 Hz   4:3     48.077 kHz     50.000000 MHz
    DMT 0x0b:   800x600    75.000000 Hz   4:3     46.875 kHz     49.500000 MHz
    Apple   :   832x624    74.551266 Hz   4:3     49.726 kHz     57.284000 MHz
    DMT 0x10:  1024x768    60.003840 Hz   4:3     48.363 kHz     65.000000 MHz
    DMT 0x11:  1024x768    70.069359 Hz   4:3     56.476 kHz     75.000000 MHz
    DMT 0x12:  1024x768    75.028582 Hz   4:3     60.023 kHz     78.750000 MHz
    DMT 0x24:  1280x1024   75.024675 Hz   5:4     79.976 kHz    135.000000 MHz
    Apple   :  1152x870    75.061550 Hz 192:145   68.681 kHz    100.000000 MHz
  Standard Timings:
    DMT 0x33:  1600x1200   60.000000 Hz   4:3     75.000 kHz    162.000000 MHz
    DMT 0x23:  1280x1024   60.019740 Hz   5:4     63.981 kHz    108.000000 MHz
  Detailed Timing Descriptors:
    DTD 1:  1600x1200   60.000000 Hz   4:3     75.000 kHz    162.000000 MHz (432 mm x 324 mm)
                 Hfront   64 Hsync 192 Hback  304 Hpol P
                 Vfront    1 Vsync   3 Vback   46 Vpol P
    Display Range Limits:
      Monitor ranges (GTF): 56-75 Hz V, 30-81 kHz H, max dotclock 170 MHz
    Display Product Name: 'SyncMaster'
    Display Product Serial Number: ...
Checksum: 0xcf

----------------

Block 1, Unknown EDID Extension Block 0x00:
  00 ff ff ff ff ff ff 00 4c 2d 91 00 31 32 42 4e '........L-..12BN'
  23 0d 01 03 0e 2b 20 a0 2a d0 c4 a1 5a 4b 97 23 '#....+ .*...ZK.#'
  17 4f 57 bf ef 80 a9 40 81 80 01 01 01 01 01 01 '.OW....@........'
  01 01 01 01 01 01 48 3f 40 30 62 b0 32 40 40 c0 '......H?@0b.2@@.'
  13 00 b0 44 11 00 00 1e 00 00 00 fd 00 38 4b 1e '...D.........8K.'
  51 11 00 0a 20 20 20 20 20 20 00 00 00 fc 00 53 'Q...      .....S'
  79 6e 63 4d 61 73 74 65 72 0a 20 20 00 00 00 ff 'yncMaster.  ....'
  00 48 34 4a 57 38 30 36 35 36 35 0a 20 20 00 cf '.H4JW806565.  ..'
Checksum: 0xcf

----------------

Failures:

Block 1, Base EDID:
  Unknown Extension Block.
EDID:
  Base EDID: EDID specified 0 extension block(s), but found 1 extension block(s).

EDID conformity: FAIL
