edid-decode (hex):

00 ff ff ff ff ff ff 00 06 09 02 76 74 00 00 00
15 09 01 01 0f 1e 17 55 e8 58 e0 99 57 4b 92 25
1b 50 54 bf fe 00 31 59 45 59 01 01 01 01 01 01
01 01 01 01 01 01 d5 09 80 a0 20 5e 63 10 10 60
52 08 04 03 00 08 06 1c 4e 0c 80 c0 20 5e 5f 10
20 40 03 08 0e cb 10 00 00 1a de 0d d0 d8 20 90
2e 10 24 48 13 00 0e cb 10 00 00 1c 00 00 00 fe
00 4d 6f 6e 69 74 6f 72 0a 20 20 20 20 20 00 1c

----------------

Block 0, Base EDID:
  EDID Structure Version & Revision: 1.1
  Vendor & Product Identification:
    Manufacturer: API
    Model: 30210
    Serial Number: ...
    Made in: week 21 of 1999
  Basic Display Parameters & Features:
    Analog display
    Signal Level Standard: 0.700 : 0.300 : 1.000 V p-p
    Blank level equals black level
    Sync: Separate Composite SyncOnGreen Serration
    Maximum image size: 30 cm x 23 cm
    Gamma: 1.85
    DPMS levels: Standby Suspend Off
    RGB color display
  Color Characteristics:
    Red  : 0.5986, 0.3408
    Green: 0.2949, 0.5703
    Blue : 0.1474, 0.1074
    White: 0.3125, 0.3281
  Established Timings I & II:
    IBM     :   720x400    70.081663 Hz   9:5     31.467 kHz     28.320000 MHz
    DMT 0x04:   640x480    59.940476 Hz   4:3     31.469 kHz     25.175000 MHz
    Apple   :   640x480    66.666667 Hz   4:3     35.000 kHz     30.240000 MHz
    DMT 0x05:   640x480    72.808802 Hz   4:3     37.861 kHz     31.500000 MHz
    DMT 0x06:   640x480    75.000000 Hz   4:3     37.500 kHz     31.500000 MHz
    DMT 0x08:   800x600    56.250000 Hz   4:3     35.156 kHz     36.000000 MHz
    DMT 0x09:   800x600    60.316541 Hz   4:3     37.879 kHz     40.000000 MHz
    DMT 0x0a:   800x600    72.187572 Hz   4:3     48.077 kHz     50.000000 MHz
    DMT 0x0b:   800x600    75.000000 Hz   4:3     46.875 kHz     49.500000 MHz
    Apple   :   832x624    74.551266 Hz   4:3     49.726 kHz     57.284000 MHz
    DMT 0x0f:  1024x768i   86.957532 Hz   4:3     35.522 kHz     44.900000 MHz
    DMT 0x10:  1024x768    60.003840 Hz   4:3     48.363 kHz     65.000000 MHz
    DMT 0x11:  1024x768    70.069359 Hz   4:3     56.476 kHz     75.000000 MHz
    DMT 0x12:  1024x768    75.028582 Hz   4:3     60.023 kHz     78.750000 MHz
  Standard Timings:
    DMT 0x07:   640x480    85.008312 Hz   4:3     43.269 kHz     36.000000 MHz
    DMT 0x0c:   800x600    85.061274 Hz   4:3     53.674 kHz     56.250000 MHz
  Detailed Timing Descriptors:
    DTD 1:   640x350    70.072383 Hz  64:35    31.462 kHz     25.170000 MHz (4 mm x 3 mm)
                 Hfront   16 Hsync  96 Hback   32 Hpol N Hborder 8
                 Vfront   37 Vsync   2 Vback   48 Vpol P Vborder 6
    DTD 2:   640x350    85.079948 Hz  64:35    37.861 kHz     31.500000 MHz (270 mm x 203 mm)
                 Hfront   32 Hsync  64 Hback   96 Hpol P
                 Vfront   32 Vsync   3 Vback   60 Vpol N
    DTD 3:   720x400    85.038902 Hz   9:5     37.927 kHz     35.500000 MHz (270 mm x 203 mm)
                 Hfront   36 Hsync  72 Hback  108 Hpol N
                 Vfront    1 Vsync   3 Vback   42 Vpol P
    Alphanumeric Data String: 'Monitor'
Checksum: 0x1c

----------------

Warnings:

Block 0, Base EDID:
  EDID Structure Version & Revision: EDID 1.1 is deprecated, do not use.
  Detailed Timing Descriptor #1: The use of non-zero borders in a DTD is not recommended.

Failures:

Block 0, Base EDID:
  Detailed Timing Descriptor #1: Mismatch of image size 4x3 mm vs display size 300x230 mm.
  Detailed Timing Descriptor #2: Mismatch of image size 270x203 mm vs display size 300x230 mm.
  Detailed Timing Descriptor #3: Mismatch of image size 270x203 mm vs display size 300x230 mm.

EDID conformity: FAIL
