
EDID (hex):
00ffffffffffff0034a4ed8901010101
0411010380261e962ade95a3544c9926
0f5054afcf0081800101010101010101
010101010101302a009851002a403070
1300782d1100001e000000fc004d4433
3036393950550a202020000000fd0032
4b1f530e000a202020202020000000ff
003730313033333234300a2020200096

Extracted contents:
header:          00 ff ff ff ff ff ff 00
serial number:   34 a4 ed 89 01 01 01 01 04 11
version:         01 03
basic params:    80 26 1e 96 2a
chroma info:     de 95 a3 54 4c 99 26 0f 50 54
established:     af cf 00
standard:        81 80 01 01 01 01 01 01 01 01 01 01 01 01 01 01
descriptor 1:    30 2a 00 98 51 00 2a 40 30 70 13 00 78 2d 11 00 00 1e
descriptor 2:    00 00 00 fc 00 4d 44 33 30 36 39 39 50 55 0a 20 20 20
descriptor 3:    00 00 00 fd 00 32 4b 1f 53 0e 00 0a 20 20 20 20 20 20
descriptor 4:    00 00 00 ff 00 37 30 31 30 33 33 32 34 30 0a 20 20 20
extensions:      00
checksum:        96

EDID version: 1.3
Manufacturer: MED Model 89ed Serial Number --
Made in week 4 of 2007
Digital display
Maximum image size: 38 cm x 30 cm
Gamma: 2.50
DPMS levels: Off
RGB color display
First detailed timing is preferred timing
Display x,y Chromaticity:
  Red:   0.6396, 0.3291
  Green: 0.2998, 0.5996
  Blue:  0.1503, 0.0595
  White: 0.3134, 0.3291
Established timings supported:
  720x400@70Hz 9:5 HorFreq: 31469 Hz Clock: 28.320 MHz
  640x480@60Hz 4:3 HorFreq: 31469 Hz Clock: 25.175 MHz
  640x480@72Hz 4:3 HorFreq: 37900 Hz Clock: 31.500 MHz
  640x480@75Hz 4:3 HorFreq: 37500 Hz Clock: 31.500 MHz
  800x600@56Hz 4:3 HorFreq: 35200 Hz Clock: 36.000 MHz
  800x600@60Hz 4:3 HorFreq: 37900 Hz Clock: 40.000 MHz
  800x600@72Hz 4:3 HorFreq: 48100 Hz Clock: 50.000 MHz
  800x600@75Hz 4:3 HorFreq: 46900 Hz Clock: 49.500 MHz
  1024x768@60Hz 4:3 HorFreq: 48400 Hz Clock: 65.000 MHz
  1024x768@70Hz 4:3 HorFreq: 56500 Hz Clock: 75.000 MHz
  1024x768@75Hz 4:3 HorFreq: 60000 Hz Clock: 78.750 MHz
  1280x1024@75Hz 5:4 HorFreq: 80000 Hz Clock: 135.000 MHz
Standard timings supported:
  1280x1024@60Hz 5:4 HorFreq: 64000 Hz Clock: 108.000 MHz
Detailed mode: Clock 108.000 MHz, 376 mm x 301 mm
               1280 1328 1440 1688 hborder 0
               1024 1025 1028 1066 vborder 0
               +hsync +vsync 
               VertFreq: 60 Hz, HorFreq: 63981 Hz
Monitor name: MD30699PU
Monitor ranges (GTF): 50-75Hz V, 31-83kHz H, max dotclock 140MHz
Serial number: --
Checksum: 0x96 (valid)
