
EDID (hex):
00ffffffffffff0010ac6b4053363532
331401030e2c1978ea9535a159579f27
0e5054a54b00714f8180a9c001010101
0101010101012f2640a060841a303020
3500bbf91000001a000000ff0048354a
354730434f323536530a000000fc0044
454c4c204532303131480a20000000fd
00384c1e5311000a20202020202000af

Extracted contents:
header:          00 ff ff ff ff ff ff 00
serial number:   10 ac 6b 40 53 36 35 32 33 14
version:         01 03
basic params:    0e 2c 19 78 ea
chroma info:     95 35 a1 59 57 9f 27 0e 50 54
established:     a5 4b 00
standard:        71 4f 81 80 a9 c0 01 01 01 01 01 01 01 01 01 01
descriptor 1:    2f 26 40 a0 60 84 1a 30 30 20 35 00 bb f9 10 00 00 1a
descriptor 2:    00 00 00 ff 00 48 35 4a 35 47 30 43 4f 32 35 36 53 0a
descriptor 3:    00 00 00 fc 00 44 45 4c 4c 20 45 32 30 31 31 48 0a 20
descriptor 4:    00 00 00 fd 00 38 4c 1e 53 11 00 0a 20 20 20 20 20 20
extensions:      00
checksum:        af

EDID version: 1.3
Manufacturer: DEL Model 406b Serial Number --
Made in week 51 of 2010
Analog display, Input voltage level: 0.7/0.3 V
Sync: Separate Composite SyncOnGreen 
Maximum image size: 44 cm x 25 cm
Gamma: 2.20
DPMS levels: Standby Suspend Off
RGB color display
First detailed timing is preferred timing
Display x,y Chromaticity:
  Red:   0.6308, 0.3486
  Green: 0.3408, 0.6220
  Blue:  0.1523, 0.0576
  White: 0.3134, 0.3291
Established timings supported:
  720x400@70Hz 9:5 HorFreq: 31469 Hz Clock: 28.320 MHz
  640x480@60Hz 4:3 HorFreq: 31469 Hz Clock: 25.175 MHz
  640x480@75Hz 4:3 HorFreq: 37500 Hz Clock: 31.500 MHz
  800x600@60Hz 4:3 HorFreq: 37900 Hz Clock: 40.000 MHz
  800x600@75Hz 4:3 HorFreq: 46900 Hz Clock: 49.500 MHz
  1024x768@60Hz 4:3 HorFreq: 48400 Hz Clock: 65.000 MHz
  1024x768@75Hz 4:3 HorFreq: 60000 Hz Clock: 78.750 MHz
  1280x1024@75Hz 5:4 HorFreq: 80000 Hz Clock: 135.000 MHz
Standard timings supported:
  1152x864@75Hz 4:3 HorFreq: 67500 Hz Clock: 108.000 MHz
  1280x1024@60Hz 5:4 HorFreq: 64000 Hz Clock: 108.000 MHz
  1600x900@60Hz 16:9
Detailed mode: Clock 97.750 MHz, 443 mm x 249 mm
               1600 1648 1680 1760 hborder 0
                900  903  908  926 vborder 0
               +hsync -vsync 
               VertFreq: 59 Hz, HorFreq: 55539 Hz
Serial number: --
Monitor name: DELL E2011H
Monitor ranges (GTF): 56-76Hz V, 30-83kHz H, max dotclock 170MHz
Checksum: 0xaf (valid)
