edid-decode (hex):

00 ff ff ff ff ff ff 00 06 af 14 92 00 00 00 00
01 12 01 03 80 1a 10 78 0a 08 b5 8f 59 57 8f 26
1b 50 54 00 00 00 01 01 01 01 01 01 01 01 01 01
01 01 01 01 01 01 12 1b 00 7b 50 20 15 30 30 20
36 00 05 a3 10 00 00 18 00 00 00 0f 00 00 00 00
00 00 00 00 00 00 00 00 00 20 00 00 00 fe 00 41
55 4f 0a 20 20 20 20 20 20 20 20 20 00 00 00 fe
00 42 31 32 31 45 57 30 39 20 56 32 20 0a 00 4e

----------------

Block 0, Base EDID:
  EDID Structure Version & Revision: 1.3
  Vendor & Product Identification:
    Manufacturer: AUO
    Model: 37396
    Made in: week 1 of 2008
  Basic Display Parameters & Features:
    Digital display
    Maximum image size: 26 cm x 16 cm
    Gamma: 2.20
    RGB color display
    First detailed timing is the preferred timing
  Color Characteristics:
    Red  : 0.5585, 0.3476
    Green: 0.3417, 0.5585
    Blue : 0.1503, 0.1083
    White: 0.3134, 0.3291
  Established Timings I & II: none
  Standard Timings: none
  Detailed Timing Descriptors:
    DTD 1:  1280x800    60.163405 Hz  16:10    49.394 kHz     69.300000 MHz (261 mm x 163 mm)
                 Hfront   48 Hsync  32 Hback   43 Hpol N
                 Vfront    3 Vsync   6 Vback   12 Vpol N
    Manufacturer-Specified Display Descriptor (0x0f): 00 0f 00 00 00 00 00 00 00 00 00 00 00 00 00 20 '............... '
    Alphanumeric Data String: 'AUO'
    Alphanumeric Data String: 'B121EW09 V2 '
Checksum: 0x4e

----------------

Failures:

Block 0, Base EDID:
  Alphanumeric Data String: One or more trailing spaces.
  Missing Display Product Name.
  Missing Display Range Limits Descriptor.

EDID conformity: FAIL
