
EDID (hex):
00ffffffffffff000472270079592013
20150103a02f1e782ac720a455499927
135054bfef80714f8180950f9500a940
b3008100010121399030621a274018b0
3640d9281100001c000000ff004c4333
3038313337343235380a00005ffd0038
4c1e5311000a202020202020000000fc
00416365722056323233570a20200159
02031b6223097f078301000067030c00
2000802d43011084e2000f0000360040
e86300001a1a1d008051d01c20408035
0040846300001c000000000000000000
00000000000000000000000000000000
00000000000000000000000000000000
00000000000000000000000000000000
00000000000000000000000000000015

Extracted contents:
header:          00 ff ff ff ff ff ff 00
serial number:   04 72 27 00 79 59 20 13 20 15
version:         01 03
basic params:    a0 2f 1e 78 2a
chroma info:     c7 20 a4 55 49 99 27 13 50 54
established:     bf ef 80
standard:        71 4f 81 80 95 0f 95 00 a9 40 b3 00 81 00 01 01
descriptor 1:    21 39 90 30 62 1a 27 40 18 b0 36 40 d9 28 11 00 00 1c
descriptor 2:    00 00 00 ff 00 4c 43 33 30 38 31 33 37 34 32 35 38 0a
descriptor 3:    00 00 5f fd 00 38 4c 1e 53 11 00 0a 20 20 20 20 20 20
descriptor 4:    00 00 00 fc 00 41 63 65 72 20 56 32 32 33 57 0a 20 20
extensions:      01
checksum:        59

EDID version: 1.3
Manufacturer: ACR Model 27 Serial Number --
Made in week 32 of 2011
Digital display
Maximum image size: 47 cm x 30 cm
Gamma: 2.20
DPMS levels: Off
RGB color display
First detailed timing is preferred timing
Display x,y Chromaticity:
  Red:   0.6435, 0.3320
  Green: 0.2861, 0.6005
  Blue:  0.1523, 0.0761
  White: 0.3125, 0.3281
Established timings supported:
  720x400@70Hz 9:5 HorFreq: 31469 Hz Clock: 28.320 MHz
  640x480@60Hz 4:3 HorFreq: 31469 Hz Clock: 25.175 MHz
  640x480@67Hz 4:3 HorFreq: 35000 Hz Clock: 30.240 MHz
  640x480@72Hz 4:3 HorFreq: 37900 Hz Clock: 31.500 MHz
  640x480@75Hz 4:3 HorFreq: 37500 Hz Clock: 31.500 MHz
  800x600@56Hz 4:3 HorFreq: 35200 Hz Clock: 36.000 MHz
  800x600@60Hz 4:3 HorFreq: 37900 Hz Clock: 40.000 MHz
  800x600@72Hz 4:3 HorFreq: 48100 Hz Clock: 50.000 MHz
  800x600@75Hz 4:3 HorFreq: 46900 Hz Clock: 49.500 MHz
  832x624@75Hz 4:3 HorFreq: 49726 Hz Clock: 57.284 MHz
  1024x768@60Hz 4:3 HorFreq: 48400 Hz Clock: 65.000 MHz
  1024x768@70Hz 4:3 HorFreq: 56500 Hz Clock: 75.000 MHz
  1024x768@75Hz 4:3 HorFreq: 60000 Hz Clock: 78.750 MHz
  1280x1024@75Hz 5:4 HorFreq: 80000 Hz Clock: 135.000 MHz
  1152x870@75Hz 192:145 HorFreq: 67500 Hz Clock: 108.000 MHz
Standard timings supported:
  1152x864@75Hz 4:3 HorFreq: 67500 Hz Clock: 108.000 MHz
  1280x1024@60Hz 5:4 HorFreq: 64000 Hz Clock: 108.000 MHz
  1440x900@75Hz 16:10 HorFreq: 82300 Hz Clock: 156.000 MHz
  1440x900@60Hz 16:10 HorFreq: 55500 Hz Clock: 88.750 MHz
  1600x1200@60Hz 4:3 HorFreq: 75000 Hz Clock: 162.000 MHz
  1680x1050@60Hz 16:10 HorFreq: 64700 Hz Clock: 119.000 MHz
  1280x800@60Hz 16:10
Detailed mode: Clock 146.250 MHz, 473 mm x 296 mm
               1680 1960 2136 2240 hborder 0
               1050 1053 1059 1089 vborder 0
               -hsync +vsync 
               VertFreq: 59 Hz, HorFreq: 65290 Hz
Serial number: --
Monitor descriptor block has byte 2 nonzero (0x5f)
Monitor ranges (GTF): 56-76Hz V, 30-83kHz H, max dotclock 170MHz
Monitor name: Acer V223W
Has 1 extension blocks
Checksum: 0x59 (valid)

CTA extension block
Extension version: 3
23 bytes of CTA data
  Audio data block
    Linear PCM, max channels 2
      Supported sample rates (kHz): 192 176.4 96 88.2 48 44.1 32
      Supported sample sizes (bits): 24 20 16
  Speaker allocation data block
    Speaker map:
      FL/FR - Front Left/Right
  Vendor-specific data block, OUI 000c03 (HDMI)
    Source physical address 2.0.0.0
    Supports_AI
    Maximum TMDS clock: 225MHz
  Video data block
    VIC   1 640x480@60Hz 4:3  HorFreq: 31469 Hz Clock: 25.175 MHz
    VIC  16 1920x1080@60Hz 16:9  HorFreq: 67500 Hz Clock: 148.500 MHz
    VIC   4 1280x720@60Hz 16:9 (native) HorFreq: 45000 Hz Clock: 74.250 MHz
  Extended tag: Video capability data block
    YCbCr quantization: No Data (0)
    RGB quantization: No Data (0)
    PT scan behaviour: No Data (0)
    IT scan behaviour: Support both over- and underscan (3)
    CE scan behaviour: Support both over- and underscan (3)
Basic audio support
Supports YCbCr 4:4:4
2 native detailed modes
Detailed mode: Clock 328.320 MHz, 0 mm x 0 mm
               1077 1077 1105 1077 hborder 0
                132  132  132  231 vborder 0
               -hsync -vsync analog composite 
               VertFreq: 1319 Hz, HorFreq: 304846 Hz
Checksum: 0x15 (valid)

EDID block does NOT conform to EDID 1.3!
	Digital display field contains garbage: 20
	Invalid descriptor block padding
One or more of the timings is out of range of the Monitor Ranges:
  Vertical Freq: 56 - 1319 Hz
  Horizontal Freq: 31469 - 304846 Hz
  Maximum Clock: 328.320 MHz
EDID block does not conform at all!
	Both the serial number and the serial string are set
