
EDID (hex):
00ffffffffffff000d04219000000001
2fc00103803c22610ad46ca357499c25
11484b21080081800101010101010101
010101010101011d007251d01e206e28
5500c48e21000018000000fc0043485f
4c5330370a2020202020000000fd0017
50185010000a20202020202000000000
0000000000000000000000000018012d

Extracted contents:
header:          00 ff ff ff ff ff ff 00
serial number:   0d 04 21 90 00 00 00 01 2f c0
version:         01 03
basic params:    80 3c 22 61 0a
chroma info:     d4 6c a3 57 49 9c 25 11 48 4b
established:     21 08 00
standard:        81 80 01 01 01 01 01 01 01 01 01 01 01 01 01 01
descriptor 1:    01 1d 00 72 51 d0 1e 20 6e 28 55 00 c4 8e 21 00 00 18
descriptor 2:    00 00 00 fc 00 43 48 5f 4c 53 30 37 0a 20 20 20 20 20
descriptor 3:    00 00 00 fd 00 17 50 18 50 10 00 0a 20 20 20 20 20 20
descriptor 4:    00 00 00 00 00 00 00 00 00 00 00 00 00 00 00 00 00 18
extensions:      01
checksum:        2d

EDID version: 1.3
Manufacturer: CHD Model 9021 Serial Number --
Digital display
Maximum image size: 60 cm x 34 cm
Gamma: 1.97
RGB color display
First detailed timing is preferred timing
Display x,y Chromaticity:
  Red:   0.6396, 0.3408
  Green: 0.2861, 0.6093
  Blue:  0.1455, 0.0683
  White: 0.2841, 0.2929
Established timings supported:
  640x480@60Hz 4:3 HorFreq: 31469 Hz Clock: 25.175 MHz
  800x600@60Hz 4:3 HorFreq: 37900 Hz Clock: 40.000 MHz
  1024x768@60Hz 4:3 HorFreq: 48400 Hz Clock: 65.000 MHz
Standard timings supported:
  1280x1024@60Hz 5:4 HorFreq: 64000 Hz Clock: 108.000 MHz
Detailed mode: Clock 74.250 MHz, 708 mm x 398 mm
               1280 1390 1430 1650 hborder 0
                720  725  730  750 vborder 0
               -hsync -vsync 
               VertFreq: 60 Hz, HorFreq: 45000 Hz
Monitor name: CH_LS07
Monitor ranges (GTF): 23-80Hz V, 24-80kHz H, max dotclock 160MHz
Manufacturer-specified data, tag 0
Has 1 extension blocks
Checksum: 0x2d (valid)
EDID block does not conform at all!
	Bad year of manufacture
