edid-decode (hex):

00 ff ff ff ff ff ff 00 4c 2d 32 0d 31 53 5a 42
29 1d 01 03 80 3c 22 78 2a 52 95 a5 56 54 9d 25
0e 50 54 bb 8c 00 b3 00 81 c0 81 00 81 80 95 00
a9 c0 01 01 01 01 30 2a 40 c8 60 84 64 30 18 50
13 00 bb f9 10 00 00 1e 00 00 00 ff 00 46 36 4c
4d 54 46 31 30 39 32 33 34 0a 00 00 00 fc 00 41
53 55 53 20 56 53 32 30 38 0a 20 20 00 00 00 fd
00 37 4b 18 53 10 00 0a 20 20 20 20 20 20 01 2f

02 03 1a c1 46 90 04 1f 13 12 03 23 09 07 07 83
01 00 00 66 03 0c 00 10 00 80 01 1d 00 72 51 d0
1e 20 6e 28 55 00 10 09 00 00 00 1e 8c 0a d0 8a
20 e0 2d 10 10 3e 96 00 10 09 00 00 00 18 00 00
00 00 00 00 00 00 00 00 00 00 00 00 00 00 00 00
00 00 00 00 00 00 00 00 00 00 00 00 00 00 00 00
00 00 00 00 00 00 00 00 00 00 00 00 00 00 00 00
00 00 00 00 00 00 00 00 00 00 00 00 00 00 00 e9

----------------

Block 0, Base EDID:
  EDID Structure Version & Revision: 1.3
  Vendor & Product Identification:
    Manufacturer: SAM
    Model: 3378
    Serial Number: ...
    Made in: week 41 of 2019
  Basic Display Parameters & Features:
    Digital display
    Maximum image size: 60 cm x 34 cm
    Gamma: 2.20
    DPMS levels: Off
    RGB color display
    First detailed timing is the preferred timing
  Color Characteristics:
    Red  : 0.6455, 0.3369
    Green: 0.3281, 0.6152
    Blue : 0.1464, 0.0556
    White: 0.3134, 0.3291
  Established Timings I & II:
    IBM     :   720x400    70.082 Hz   9:5    31.467 kHz  28.320 MHz
    DMT 0x04:   640x480    59.940 Hz   4:3    31.469 kHz  25.175 MHz
    Apple   :   640x480    66.667 Hz   4:3    35.000 kHz  30.240 MHz
    DMT 0x05:   640x480    72.809 Hz   4:3    37.861 kHz  31.500 MHz
    DMT 0x08:   800x600    56.250 Hz   4:3    35.156 kHz  36.000 MHz
    DMT 0x09:   800x600    60.317 Hz   4:3    37.879 kHz  40.000 MHz
    DMT 0x0a:   800x600    72.188 Hz   4:3    48.077 kHz  50.000 MHz
    DMT 0x10:  1024x768    60.004 Hz   4:3    48.363 kHz  65.000 MHz
    DMT 0x11:  1024x768    70.069 Hz   4:3    56.476 kHz  75.000 MHz
  Standard Timings:
    DMT 0x3a:  1680x1050   59.954 Hz  16:10   65.290 kHz 146.250 MHz
    DMT 0x55:  1280x720    60.000 Hz  16:9    45.000 kHz  74.250 MHz
    DMT 0x1c:  1280x800    59.810 Hz  16:10   49.702 kHz  83.500 MHz
    DMT 0x23:  1280x1024   60.020 Hz   5:4    63.981 kHz 108.000 MHz
    DMT 0x2f:  1440x900    59.887 Hz  16:10   55.935 kHz 106.500 MHz
    DMT 0x53:  1600x900    60.000 Hz  16:9    60.000 kHz 108.000 MHz (RB)
  Detailed Timing Descriptors:
    DTD 1:  1600x900    60.000 Hz  16:9    60.000 kHz 108.000 MHz (443 mm x 249 mm)
                 Hfront   24 Hsync  80 Hback  96 Hpol P
                 Vfront    1 Vsync   3 Vback  96 Vpol P
    Display Product Serial Number: ...
    Display Product Name: 'ASUS VS208'
  Display Range Limits:
    Monitor ranges (GTF): 55-75 Hz V, 24-83 kHz H, max dotclock 160 MHz
  Extension blocks: 1
Checksum: 0x2f

----------------

Block 1, CTA-861 Extension Block:
  Revision: 3
  Underscans IT Video Formats by default
  Basic audio support
  Native detailed modes: 1
  Video Data Block:
    VIC  16:  1920x1080   60.000 Hz  16:9    67.500 kHz 148.500 MHz (native)
    VIC   4:  1280x720    60.000 Hz  16:9    45.000 kHz  74.250 MHz
    VIC  31:  1920x1080   50.000 Hz  16:9    56.250 kHz 148.500 MHz
    VIC  19:  1280x720    50.000 Hz  16:9    37.500 kHz  74.250 MHz
    VIC  18:   720x576    50.000 Hz  16:9    31.250 kHz  27.000 MHz
    VIC   3:   720x480    59.940 Hz  16:9    31.469 kHz  27.000 MHz
  Audio Data Block:
    Linear PCM:
      Max channels: 2
      Supported sample rates (kHz): 48 44.1 32
      Supported sample sizes (bits): 24 20 16
  Speaker Allocation Data Block:
    FL/FR - Front Left/Right
  Vendor-Specific Data Block (HDMI), OUI 00-0C-03:
    Source physical address: 1.0.0.0
    Supports_AI
  Detailed Timing Descriptors:
    DTD 2:  1280x720    60.000 Hz  16:9    45.000 kHz  74.250 MHz (16 mm x 9 mm)
                 Hfront  110 Hsync  40 Hback 220 Hpol P
                 Vfront    5 Vsync   5 Vback  20 Vpol P
    DTD 3:   720x480    59.940 Hz   3:2    31.469 kHz  27.000 MHz (16 mm x 9 mm)
                 Hfront   16 Hsync  62 Hback  60 Hpol N
                 Vfront    9 Vsync   6 Vback  30 Vpol N
Checksum: 0xe9

----------------

Warnings:

Block 1, CTA-861 Extension Block:
  Display Product Serial Number is set, so the Serial Number in the Base EDID should be 0.
  Missing VCDB, needed for Set Selectable RGB Quantization to avoid interop issues.

Failures:

Block 0, Base EDID:
  Detailed Timing Descriptor #1: Mismatch of image size 443x249 mm vs display size 600x340 mm.
Block 1, CTA-861 Extension Block:
  Detailed Timing Descriptor #2: Mismatch of image size 16x9 mm vs display size 600x340 mm.
  Detailed Timing Descriptor #3: Mismatch of image size 16x9 mm vs display size 600x340 mm.
EDID:
  Base EDID: Some timings are out of range of the Monitor Ranges:
    Vertical Freq: 50.000 - 72.809 Hz (Monitor: 55.000 - 75.000 Hz)
  CTA-861: Native progressive timings are a mix of several resolutions.

EDID conformity: FAIL
