
EDID (hex):
00ffffffffffff000610f39c00000000
19150104951a0e7802ef059757549227
22505400000001010101010101010101
010101010101201c5686500020300e38
13000090000000180000001000000000
00000000000000000000000000fe004c
544831313641543031413034000000fc
00436f6c6f72204c43440a20202000f8

Extracted contents:
header:          00 ff ff ff ff ff ff 00
serial number:   06 10 f3 9c 00 00 00 00 19 15
version:         01 04
basic params:    95 1a 0e 78 02
chroma info:     ef 05 97 57 54 92 27 22 50 54
established:     00 00 00
standard:        01 01 01 01 01 01 01 01 01 01 01 01 01 01 01 01
descriptor 1:    20 1c 56 86 50 00 20 30 0e 38 13 00 00 90 00 00 00 18
descriptor 2:    00 00 00 10 00 00 00 00 00 00 00 00 00 00 00 00 00 00
descriptor 3:    00 00 00 fe 00 4c 54 48 31 31 36 41 54 30 31 41 30 34
descriptor 4:    00 00 00 fc 00 43 6f 6c 6f 72 20 4c 43 44 0a 20 20 20
extensions:      00
checksum:        f8

EDID version: 1.4
Manufacturer: APP Model 9cf3 Serial Number --
Made in week 25 of 2011
Digital display
6 bits per primary color channel
DisplayPort interface
Maximum image size: 26 cm x 14 cm
Gamma: 2.20
Supported color formats: RGB 4:4:4
First detailed timing includes the native pixel format and preferred refresh rate
Display x,y Chromaticity:
  Red:   0.5927, 0.3417
  Green: 0.3310, 0.5732
  Blue:  0.1523, 0.1328
  White: 0.3134, 0.3291
Established timings supported:
Standard timings supported:
Detailed mode: Clock 72.000 MHz, 0 mm x 144 mm
               1366 1380 1436 1500 hborder 0
                768  769  772  800 vborder 0
               -hsync -vsync 
               VertFreq: 60 Hz, HorFreq: 48000 Hz
Dummy block
ASCII string: LTH116AT01A04
Monitor name: Color LCD
Checksum: 0xf8 (valid)
	Missing monitor ranges
