
EDID (hex):
00ffffffffffff003064092132333139
0c140103901a10780a87f594574f8c27
27505400000001010101010101010101
0101010101010820007c512017304880
360005a31000001afe15009e51201f30
4880360005a31000001a000000fe0048
4d57314b403132314557550a000000fe
00000000000000000001010a202000e9

Extracted contents:
header:          00 ff ff ff ff ff ff 00
serial number:   30 64 09 21 32 33 31 39 0c 14
version:         01 03
basic params:    90 1a 10 78 0a
chroma info:     87 f5 94 57 4f 8c 27 27 50 54
established:     00 00 00
standard:        01 01 01 01 01 01 01 01 01 01 01 01 01 01 01 01
descriptor 1:    08 20 00 7c 51 20 17 30 48 80 36 00 05 a3 10 00 00 1a
descriptor 2:    fe 15 00 9e 51 20 1f 30 48 80 36 00 05 a3 10 00 00 1a
descriptor 3:    00 00 00 fe 00 48 4d 57 31 4b 40 31 32 31 45 57 55 0a
descriptor 4:    00 00 00 fe 00 00 00 00 00 00 00 00 00 01 01 0a 20 20
extensions:      00
checksum:        e9

EDID version: 1.3
Manufacturer: LCD Model 2109 Serial Number --
Made in week 12 of 2010
Digital display
Maximum image size: 26 cm x 16 cm
Gamma: 2.20
RGB color display
First detailed timing is preferred timing
Display x,y Chromaticity:
  Red:   0.5800, 0.3398
  Green: 0.3095, 0.5498
  Blue:  0.1552, 0.1552
  White: 0.3134, 0.3291
Established timings supported:
Standard timings supported:
Detailed mode: Clock 82.000 MHz, 261 mm x 163 mm
               1280 1352 1480 1660 hborder 0
                800  803  809  823 vborder 0
               +hsync -vsync 
               VertFreq: 60 Hz, HorFreq: 49397 Hz
Detailed mode: Clock 56.300 MHz, 261 mm x 163 mm
               1280 1352 1480 1694 hborder 0
                800  803  809  831 vborder 0
               +hsync -vsync 
               VertFreq: 39 Hz, HorFreq: 33234 Hz
ASCII string: HMW1K@121EWU
ASCII string: 
Checksum: 0xe9 (valid)
EDID block does NOT conform to EDID 1.3!
	Digital display field contains garbage: 10
	Missing name descriptor
	Missing monitor ranges
	Detailed block string not properly terminated
