
EDID (hex):
00ffffffffffff001e6d217739060100
081e0104b5502178f809c1ae5044af26
0e505421080001010101010101010101
01010101010100000000000000000000
0000000000000000000000fd00303d1e
874c000a202020202020000000fc004c
472048445220354b0a202020000000ff
003030384e54484d315a3132390a015a
701279030001000c401fe40c00147008
9078899912001680101000ff096f0800
0000000047534d217701010101030114
998d0008ff099f002f801f006f083d00
02000900000000000000000000000000
00000000000000000000000000000000
00000000000000000000000000000000
00000000000000000000000000001c90

Extracted contents:
header:          00 ff ff ff ff ff ff 00
serial number:   1e 6d 21 77 39 06 01 00 08 1e
version:         01 04
basic params:    b5 50 21 78 f8
chroma info:     09 c1 ae 50 44 af 26 0e 50 54
established:     21 08 00
standard:        01 01 01 01 01 01 01 01 01 01 01 01 01 01 01 01
descriptor 1:    00 00 00 00 00 00 00 00 00 00 00 00 00 00 00 00 00 00
descriptor 2:    00 00 00 fd 00 30 3d 1e 87 4c 00 0a 20 20 20 20 20 20
descriptor 3:    00 00 00 fc 00 4c 47 20 48 44 52 20 35 4b 0a 20 20 20
descriptor 4:    00 00 00 ff 00 30 30 38 4e 54 48 4d 31 5a 31 32 39 0a
extensions:      01
checksum:        5a

EDID version: 1.4
Manufacturer: GSM Model 7721 Serial Number --
Made in week 8 of 2020
Digital display
10 bits per primary color channel
DisplayPort interface
Maximum image size: 80 cm x 33 cm
Gamma: 2.20
DPMS levels: Standby Suspend Off
Supported color formats: RGB 4:4:4, YCrCb 4:4:4, YCrCb 4:2:2
Display x,y Chromaticity:
  Red:   0.6796, 0.3125
  Green: 0.2675, 0.6845
  Blue:  0.1513, 0.0546
  White: 0.3125, 0.3291
Established timings supported:
  640x480@60Hz 4:3 HorFreq: 31469 Hz Clock: 25.175 MHz
  800x600@60Hz 4:3 HorFreq: 37900 Hz Clock: 40.000 MHz
  1024x768@60Hz 4:3 HorFreq: 48400 Hz Clock: 65.000 MHz
Standard timings supported:
Manufacturer-specified data, tag 0
Monitor ranges (GTF): 48-61Hz V, 30-135kHz H, max dotclock 760MHz
Monitor name: LG HDR 5K
Serial number: --
Has 1 extension blocks
Checksum: 0x5a (valid)

DisplayID extension block
Extension version: 18
Length 121, version 18, extension count 0
Checksum: 0x1c (valid)
Display Parameters block
tiled display block: capabilities 0x00000080
num horizontal tiles 2, num vertical tiles 1
tile location (1, 0)
tile dimensions (2560, 2160)
Type 1 detailed timing: aspect: undefined,  
Detailed mode: Clock 362.490 MHz, 0 mm x 0 mm
               2559 2606 2637 2718
               2159 2161 2170 2220
               +hsync -vsync

EDID block does NOT conform to EDID 1.4!
	Missing preferred timing
EDID block does not conform at all!
	Has -1509949440 nonconformant extension block(s)


