edid-decode (hex):

00 ff ff ff ff ff ff 00 30 e4 a4 07 00 00 00 00
00 22 01 04 b5 1e 13 78 07 ae 05 a6 54 4c 99 25
0e 50 54 00 00 00 01 01 01 01 01 01 01 01 01 01
01 01 01 01 01 01 b2 9f 00 a0 a0 40 46 60 30 20
36 00 2e bd 10 00 00 1a 2c 55 00 a0 a0 40 46 60
30 20 36 00 2e bd 10 00 00 1a 00 00 00 fe 00 39
56 43 4a 4e 80 31 34 30 57 51 32 0a 00 00 00 00
00 03 41 39 9e 00 01 00 00 0b 41 0a 20 20 00 db

00 ff ff ff ff ff ff 00 30 e4 a4 07 00 00 00 00
00 22 01 04 b5 1e 13 78 07 ae 05 a6 54 4c 99 25
0e 50 54 00 00 00 01 01 01 01 01 01 01 01 01 01
01 01 01 01 01 01 b2 9f 00 a0 a0 40 46 60 30 20
36 00 2e bd 10 00 00 1a 2c 55 00 a0 a0 40 46 60
30 20 36 00 2e bd 10 00 00 1a 00 00 00 fe 00 39
56 43 4a 4e 80 31 34 30 57 51 32 0a 00 00 00 00
00 03 41 39 9e 00 01 00 00 0b 41 0a 20 20 00 db

----------------

Block 0, Base EDID:
  EDID Structure Version & Revision: 1.4
  Vendor & Product Identification:
    Manufacturer: LGD
    Model: 1956
    Made in: 2024
  Basic Display Parameters & Features:
    Digital display
    Bits per primary color channel: 10
    DisplayPort interface
    Maximum image size: 30 cm x 19 cm
    Gamma: 2.20
    Supported color formats: RGB 4:4:4
    Default (sRGB) color space is primary color space
    First detailed timing includes the native pixel format and preferred refresh rate
    Display is continuous frequency
  Color Characteristics:
    Red  : 0.6503, 0.3300
    Green: 0.2998, 0.5996
    Blue : 0.1445, 0.0546
    White: 0.3134, 0.3291
  Established Timings I & II: none
  Standard Timings: none
  Detailed Timing Descriptors:
    DTD 1:  2560x1600   90.000881 Hz  16:10   150.301 kHz    408.820000 MHz (302 mm x 189 mm)
                 Hfront   48 Hsync  32 Hback   80 Hpol P
                 Vfront    3 Vsync   6 Vback   61 Vpol N
    DTD 2:  2560x1600   48.001057 Hz  16:10    80.162 kHz    218.040000 MHz (302 mm x 189 mm)
                 Hfront   48 Hsync  32 Hback   80 Hpol P
                 Vfront    3 Vsync   6 Vback   61 Vpol N
    Alphanumeric Data String: '9VCJN'
    Manufacturer-Specified Display Descriptor (0x00): 00 00 00 03 41 39 9e 00 01 00 00 0b 41 0a 20 20 '....A9......A.  '
Checksum: 0xdb

----------------

Block 1, Unknown EDID Extension Block 0x00:
  00 ff ff ff ff ff ff 00 30 e4 a4 07 00 00 00 00 '........0.......'
  00 22 01 04 b5 1e 13 78 07 ae 05 a6 54 4c 99 25 '.".....x....TL.%'
  0e 50 54 00 00 00 01 01 01 01 01 01 01 01 01 01 '.PT.............'
  01 01 01 01 01 01 b2 9f 00 a0 a0 40 46 60 30 20 '...........@F`0 '
  36 00 2e bd 10 00 00 1a 2c 55 00 a0 a0 40 46 60 '6.......,U...@F`'
  30 20 36 00 2e bd 10 00 00 1a 00 00 00 fe 00 39 '0 6............9'
  56 43 4a 4e 80 31 34 30 57 51 32 0a 00 00 00 00 'VCJN.140WQ2.....'
  00 03 41 39 9e 00 01 00 00 0b 41 0a 20 20 00 db '..A9......A.  ..'
Checksum: 0xdb

----------------

Warnings:

Block 0, Base EDID:
  Missing Display Product Name.

Failures:

Block 0, Base EDID:
  Basic Display Parameters & Features: sRGB is signaled, but the chromaticities do not match.
  Alphanumeric Data String: Non-printable character.
  Missing Display Range Limits Descriptor.
Block 1, Base EDID:
  Unknown Extension Block.
EDID:
  Base EDID: EDID specified 0 extension block(s), but found 1 extension block(s).

EDID conformity: FAIL
