edid-decode (hex):

00 ff ff ff ff ff ff 00 0d ae 24 11 00 00 00 00
33 15 01 04 a5 1a 0e 78 0a a7 05 a6 56 54 9b 26
0c 50 54 00 00 00 01 01 01 01 01 01 01 01 01 01
01 01 01 01 01 01 36 36 80 a0 70 38 20 40 30 20
35 00 00 90 10 00 00 1a 24 24 80 a0 70 38 20 40
30 20 35 00 00 90 10 00 00 1a 00 00 00 fe 00 43
4d 4e 0a 20 20 20 20 20 20 20 20 20 00 00 00 fe
00 4e 31 31 36 48 53 45 2d 45 41 31 0a 20 00 a3

----------------

Block 0, Base EDID:
  EDID Structure Version & Revision: 1.4
  Vendor & Product Identification:
    Manufacturer: CMN
    Model: 4388
    Made in: week 51 of 2011
  Basic Display Parameters & Features:
    Digital display
    Bits per primary color channel: 8
    DisplayPort interface
    Maximum image size: 26 cm x 14 cm
    Gamma: 2.20
    Supported color formats: RGB 4:4:4, YCrCb 4:4:4
    First detailed timing includes the native pixel format and preferred refresh rate
  Color Characteristics:
    Red  : 0.6503, 0.3378
    Green: 0.3291, 0.6083
    Blue : 0.1484, 0.0468
    White: 0.3134, 0.3291
  Established Timings I & II: none
  Standard Timings: none
  Detailed Timing Descriptors:
    DTD 1:  1920x1080   60.001 Hz  16:9    66.721 kHz 138.780 MHz (256 mm x 144 mm)
                 Hfront   48 Hsync  32 Hback  80 Hpol P
                 Vfront    3 Vsync   5 Vback  24 Vpol N
    DTD 2:  1920x1080   40.001 Hz  16:9    44.481 kHz  92.520 MHz (256 mm x 144 mm)
                 Hfront   48 Hsync  32 Hback  80 Hpol P
                 Vfront    3 Vsync   5 Vback  24 Vpol N
    Alphanumeric Data String: 'CMN'
    Alphanumeric Data String: 'N116HSE-EA1'
Checksum: 0xa3
