
EDID (hex):
00ffffffffffff0004722d031cd80033
1e17010368301b782a84d5a25a52a226
0d5054b30c00d1c0b300950081808100
81c0714f0101023a801871382d40582c
4500dd0c1100001e000000fd00374c1e
5311000a202020202020000000ff004c
584c4545303137343230390a000000fc
0041636572205632323648514c0a0077

Extracted contents:
header:          00 ff ff ff ff ff ff 00
serial number:   04 72 2d 03 1c d8 00 33 1e 17
version:         01 03
basic params:    68 30 1b 78 2a
chroma info:     84 d5 a2 5a 52 a2 26 0d 50 54
established:     b3 0c 00
standard:        d1 c0 b3 00 95 00 81 80 81 00 81 c0 71 4f 01 01
descriptor 1:    02 3a 80 18 71 38 2d 40 58 2c 45 00 dd 0c 11 00 00 1e
descriptor 2:    00 00 00 fd 00 37 4c 1e 53 11 00 0a 20 20 20 20 20 20
descriptor 3:    00 00 00 ff 00 4c 58 4c 45 45 30 31 37 34 32 30 39 0a
descriptor 4:    00 00 00 fc 00 41 63 65 72 20 56 32 32 36 48 51 4c 0a
extensions:      00
checksum:        77

EDID version: 1.3
Manufacturer: ACR Model 32d Serial Number --
Made in week 30 of 2013
Analog display, Input voltage level: 0.7/0.7 V
Sync: Separate 
Maximum image size: 48 cm x 27 cm
Gamma: 2.20
DPMS levels: Off
RGB color display
First detailed timing is preferred timing
Display x,y Chromaticity:
  Red:   0.6347, 0.3515
  Green: 0.3212, 0.6328
  Blue:  0.1513, 0.0517
  White: 0.3134, 0.3291
Established timings supported:
  720x400@70Hz 9:5 HorFreq: 31469 Hz Clock: 28.320 MHz
  640x480@60Hz 4:3 HorFreq: 31469 Hz Clock: 25.175 MHz
  640x480@67Hz 4:3 HorFreq: 35000 Hz Clock: 30.240 MHz
  800x600@56Hz 4:3 HorFreq: 35200 Hz Clock: 36.000 MHz
  800x600@60Hz 4:3 HorFreq: 37900 Hz Clock: 40.000 MHz
  1024x768@60Hz 4:3 HorFreq: 48400 Hz Clock: 65.000 MHz
  1024x768@70Hz 4:3 HorFreq: 56500 Hz Clock: 75.000 MHz
Standard timings supported:
  1920x1080@60Hz 16:9
  1680x1050@60Hz 16:10 HorFreq: 64700 Hz Clock: 119.000 MHz
  1440x900@60Hz 16:10 HorFreq: 55500 Hz Clock: 88.750 MHz
  1280x1024@60Hz 5:4 HorFreq: 64000 Hz Clock: 108.000 MHz
  1280x800@60Hz 16:10
  1280x720@60Hz 16:9
  1152x864@75Hz 4:3 HorFreq: 67500 Hz Clock: 108.000 MHz
Detailed mode: Clock 148.500 MHz, 477 mm x 268 mm
               1920 2008 2052 2200 hborder 0
               1080 1084 1089 1125 vborder 0
               +hsync +vsync 
               VertFreq: 60 Hz, HorFreq: 67500 Hz
Monitor ranges (GTF): 55-76Hz V, 30-83kHz H, max dotclock 170MHz
Serial number: --
Monitor name: Acer V226HQL
Checksum: 0x77 (valid)
