edid-decode (hex):

00 ff ff ff ff ff ff 00 04 72 14 ad de 0c 20 54
2a 0f 01 03 68 1e 17 75 2a 58 20 97 53 50 90 26
1e 50 54 af 4e 00 61 40 61 4f 45 40 45 4f 31 40
31 4f 01 01 01 01 64 19 00 40 41 00 26 30 18 88
36 00 30 e4 10 00 00 18 00 00 00 ff 00 45 54 4c
31 34 30 38 31 36 31 0a 20 20 00 00 00 fd 00 37
4b 1e 3f 08 00 0a 20 20 20 20 20 20 00 00 00 fc
00 41 63 65 72 20 41 4c 31 35 31 31 0a 20 00 b5

----------------

Block 0, Base EDID:
  EDID Structure Version & Revision: 1.3
  Vendor & Product Identification:
    Manufacturer: ACR
    Model: 44308
    Serial Number: ...
    Made in: week 42 of 2005
  Basic Display Parameters & Features:
    Analog display
    Input voltage level: 0.7/0.7 V
    Blank level equals black level
    Sync: Separate
    Maximum image size: 30 cm x 23 cm
    Gamma: 2.17
    DPMS levels: Off
    RGB color display
    First detailed timing is the preferred timing
  Color Characteristics:
    Red  : 0.5908, 0.3251
    Green: 0.3144, 0.5625
    Blue : 0.1484, 0.1191
    White: 0.3125, 0.3281
  Established Timings I & II:
    IBM     :   720x400    70.082 Hz   9:5    31.467 kHz  28.320 MHz
    DMT 0x04:   640x480    59.940 Hz   4:3    31.469 kHz  25.175 MHz
    DMT 0x05:   640x480    72.809 Hz   4:3    37.861 kHz  31.500 MHz
    DMT 0x06:   640x480    75.000 Hz   4:3    37.500 kHz  31.500 MHz
    DMT 0x08:   800x600    56.250 Hz   4:3    35.156 kHz  36.000 MHz
    DMT 0x09:   800x600    60.317 Hz   4:3    37.879 kHz  40.000 MHz
    DMT 0x0b:   800x600    75.000 Hz   4:3    46.875 kHz  49.500 MHz
    DMT 0x10:  1024x768    60.004 Hz   4:3    48.363 kHz  65.000 MHz
    DMT 0x11:  1024x768    70.069 Hz   4:3    56.476 kHz  75.000 MHz
    DMT 0x12:  1024x768    75.029 Hz   4:3    60.023 kHz  78.750 MHz
  Standard Timings:
    DMT 0x10:  1024x768    60.004 Hz   4:3    48.363 kHz  65.000 MHz
    DMT 0x12:  1024x768    75.029 Hz   4:3    60.023 kHz  78.750 MHz
    DMT 0x09:   800x600    60.317 Hz   4:3    37.879 kHz  40.000 MHz
    DMT 0x0b:   800x600    75.000 Hz   4:3    46.875 kHz  49.500 MHz
    DMT 0x04:   640x480    59.940 Hz   4:3    31.469 kHz  25.175 MHz
    DMT 0x06:   640x480    75.000 Hz   4:3    37.500 kHz  31.500 MHz
  Detailed Timing Descriptors:
    DTD 1:  1024x768    60.004 Hz   4:3    48.363 kHz  65.000 MHz (304 mm x 228 mm)
                 Hfront   24 Hsync 136 Hback 160 Hpol N
                 Vfront    3 Vsync   6 Vback  29 Vpol N
    Display Product Serial Number: ...
  Display Range Limits:
    Monitor ranges (GTF): 55-75 Hz V, 30-63 kHz H, max dotclock 80 MHz
    Display Product Name: 'Acer AL1511'
Checksum: 0xb5

----------------

EDID conformity: PASS
