
EDID (hex):
00ffffffffffff000472b606c2234092
181d0104b55123783bc071ad5048a726
0e505421080001010101010101010101
010101010101e77c70a0d0a029503020
35002e5a3100001a000000ff00234153
4f5968776a574b685864000000fd0001
c8ffff6b010a202020202020000000fc
005833350a20202020202020202002d6
020320f12309070183010000654b0400
0101e305c000e2006ae60605018f7707
4ed470a0d0a04650302035002e5a3100
001a0000000000000000000000000000
00000000000000000000000000000000
00000000000000000000000000000000
00000000000000000000000000000000
000000000000000000000000000000f9
70137903000f000aa4140e0e07012045
000002010d31db0a507f14a764a20e01
4554030150520101046f0d9f002f801f
009f05540002000400663801046f0d9f
002f801f009f056600020004005c8d01
046f0d9f002f801f009f058100020004
00cfa101046f0d3b0007801f009f0558
0002000400000000000000000000b490

edid-decode (hex):

00 ff ff ff ff ff ff 00 04 72 b6 06 c2 23 40 92
18 1d 01 04 b5 51 23 78 3b c0 71 ad 50 48 a7 26
0e 50 54 21 08 00 01 01 01 01 01 01 01 01 01 01
01 01 01 01 01 01 e7 7c 70 a0 d0 a0 29 50 30 20
35 00 2e 5a 31 00 00 1a 00 00 00 ff 00 23 41 53
4f 59 68 77 6a 57 4b 68 58 64 00 00 00 fd 00 01
c8 ff ff 6b 01 0a 20 20 20 20 20 20 00 00 00 fc
00 58 33 35 0a 20 20 20 20 20 20 20 20 20 02 d6

02 03 20 f1 23 09 07 01 83 01 00 00 65 4b 04 00
01 01 e3 05 c0 00 e2 00 6a e6 06 05 01 8f 77 07
4e d4 70 a0 d0 a0 46 50 30 20 35 00 2e 5a 31 00
00 1a 00 00 00 00 00 00 00 00 00 00 00 00 00 00
00 00 00 00 00 00 00 00 00 00 00 00 00 00 00 00
00 00 00 00 00 00 00 00 00 00 00 00 00 00 00 00
00 00 00 00 00 00 00 00 00 00 00 00 00 00 00 00
00 00 00 00 00 00 00 00 00 00 00 00 00 00 00 f9

70 13 79 03 00 0f 00 0a a4 14 0e 0e 07 01 20 45
00 00 02 01 0d 31 db 0a 50 7f 14 a7 64 a2 0e 01
45 54 03 01 50 52 01 01 04 6f 0d 9f 00 2f 80 1f
00 9f 05 54 00 02 00 04 00 66 38 01 04 6f 0d 9f
00 2f 80 1f 00 9f 05 66 00 02 00 04 00 5c 8d 01
04 6f 0d 9f 00 2f 80 1f 00 9f 05 81 00 02 00 04
00 cf a1 01 04 6f 0d 3b 00 07 80 1f 00 9f 05 58
00 02 00 04 00 00 00 00 00 00 00 00 00 00 b4 90

----------------

Block 0, Base EDID:
  EDID Structure Version & Revision: 1.4
  Vendor & Product Identification:
    Manufacturer: ACR
    Model: 1718
    Serial Number: 2453676994
    Made in: week 24 of 2019
  Basic Display Parameters & Features:
    Digital display
    Bits per primary color channel: 10
    DisplayPort interface
    Maximum image size: 81 cm x 35 cm
    Gamma: 2.20
    DPMS levels: Off
    Supported color formats: RGB 4:4:4, YCrCb 4:4:4, YCrCb 4:2:2
    First detailed timing includes the native pixel format and preferred refresh rate
    Display is continuous frequency
  Color Characteristics:
    Red  : 0.6787, 0.3125
    Green: 0.2812, 0.6523
    Blue : 0.1494, 0.0576
    White: 0.3125, 0.3291
  Established Timings I & II:
    DMT 0x04:   640x480    59.940476 Hz   4:3     31.469 kHz     25.175000 MHz
    DMT 0x09:   800x600    60.316541 Hz   4:3     37.879 kHz     40.000000 MHz
    DMT 0x10:  1024x768    60.003840 Hz   4:3     48.363 kHz     65.000000 MHz
  Standard Timings: none
  Detailed Timing Descriptors:
    DTD 1:  3440x1440   59.972616 Hz  43:18    88.819 kHz    319.750000 MHz (814 mm x 346 mm)
                 Hfront   48 Hsync  32 Hback   80 Hpol P
                 Vfront    3 Vsync   5 Vback   33 Vpol N
    Display Product Serial Number: '#ASOYhwjWKhXd'
    Display Range Limits:
      Monitor ranges (Bare Limits): 1-200 Hz V, 255-255 kHz H, max dotclock 1070 MHz
    Display Product Name: 'X35'
  Extension blocks: 2
Checksum: 0xd6

----------------

Block 1, CTA-861 Extension Block:
  Revision: 3
  Underscans IT Video Formats by default
  Basic audio support
  Supports YCbCr 4:4:4
  Supports YCbCr 4:2:2
  Native detailed modes: 1
  Audio Data Block:
    Linear PCM:
      Max channels: 2
      Supported sample rates (kHz): 48 44.1 32
      Supported sample sizes (bits): 16
  Speaker Allocation Data Block:
    FL/FR - Front Left/Right
  Vendor-Specific Data Block (NVIDIA), OUI 00-04-4B:
    01 01                                           '..'
  Colorimetry Data Block:
    BT2020YCC
    BT2020RGB
  Video Capability Data Block:
    YCbCr quantization: No Data
    RGB quantization: Selectable (via AVI Q)
    PT scan behavior: Always Underscanned
    IT scan behavior: Always Underscanned
    CE scan behavior: Always Underscanned
  HDR Static Metadata Data Block:
    Electro optical transfer functions:
      Traditional gamma - SDR luminance range
      SMPTE ST2084
    Supported static metadata descriptors:
      Static metadata type 1
    Desired content max luminance: 143 (1107.128 cd/m^2)
    Desired content max frame-average luminance: 119 (658.302 cd/m^2)
    Desired content min luminance: 7 (0.008 cd/m^2)
  Detailed Timing Descriptors:
    DTD 2:  3440x1440   99.981604 Hz  43:18   150.972 kHz    543.500000 MHz (814 mm x 346 mm)
                 Hfront   48 Hsync  32 Hback   80 Hpol P
                 Vfront    3 Vsync   5 Vback   62 Vpol N
Checksum: 0xf9  Unused space in Extension Block: 77 bytes

----------------

Block 2, DisplayID Extension Block:
  Version: 1.3
  Extension Count: 0
  Display Product Type: Standalone display device
  Display Interface Data Block:
    Interface Type: DisplayPort
    Number of Links: 4
    Interface Standard Version: 1.4
    Supported bpc for RGB encoding: 8, 10, 12
    Supported bpc for YCbCr 4:4:4 encoding: 8, 10, 12
    Supported bpc for YCbCr 4:2:2 encoding: 8, 10, 12
    Supported Content Protection: HDCP 2.0
    Spread Spectrum: Down Spread 0.5%
  Color Characteristics Data Block:
    Uses spatial color
    Uses 1931 CIE (x, y) coordinates
    Primary #0: (0.6785, 0.3125)
    Primary #1: (0.2810, 0.6526)
    Primary #2: (0.1494, 0.0571)
    White point #0: (0.3127, 0.3291)
  Video Timing Modes Type 1 - Detailed Timings Data Block:
    DTD:  3440x1440  119.990893 Hz  16:9    182.986 kHz    658.750000 MHz (aspect 16:9, no 3D stereo)
               Hfront   48 Hsync  32 Hback   80 Hpol P
               Vfront    3 Vsync   5 Vback   77 Vpol N
    DTD:  3440x1440  143.974581 Hz  16:9    222.153 kHz    799.750000 MHz (aspect 16:9, no 3D stereo)
               Hfront   48 Hsync  32 Hback   80 Hpol P
               Vfront    3 Vsync   5 Vback   95 Vpol N
    DTD:  3440x1440  179.980538 Hz  16:9    282.569 kHz   1017.250000 MHz (aspect 16:9, no 3D stereo)
               Hfront   48 Hsync  32 Hback   80 Hpol P
               Vfront    3 Vsync   5 Vback  122 Vpol N
    DTD:  3440x1440  199.869196 Hz  16:9    305.600 kHz   1069.600000 MHz (aspect 16:9, no 3D stereo)
               Hfront    8 Hsync  32 Hback   20 Hpol P
               Vfront    3 Vsync   5 Vback   81 Vpol N
  Checksum: 0xb4
Checksum: 0x90
