
EDID (hex):
00ffffffffffff0010ac534053393431
0d1401030a2c1978eeee95a3544c9926
0f5054a54b00714f8180a9c001010101
010101010101302a40c8608464301850
1300bbf91000001e000000ff00573834
3050303431313439530a000000fc0044
454c4c204532303130480a20000000fd
00384c1e5310000a2020202020200004

Extracted contents:
header:          00 ff ff ff ff ff ff 00
serial number:   10 ac 53 40 53 39 34 31 0d 14
version:         01 03
basic params:    0a 2c 19 78 ee
chroma info:     ee 95 a3 54 4c 99 26 0f 50 54
established:     a5 4b 00
standard:        71 4f 81 80 a9 c0 01 01 01 01 01 01 01 01 01 01
descriptor 1:    30 2a 40 c8 60 84 64 30 18 50 13 00 bb f9 10 00 00 1e
descriptor 2:    00 00 00 ff 00 57 38 34 30 50 30 34 31 31 34 39 53 0a
descriptor 3:    00 00 00 fc 00 44 45 4c 4c 20 45 32 30 31 30 48 0a 20
descriptor 4:    00 00 00 fd 00 38 4c 1e 53 10 00 0a 20 20 20 20 20 20
extensions:      00
checksum:        04

EDID version: 1.3
Manufacturer: DEL Model 4053 Serial Number --
Made in week 13 of 2010
Analog display, Input voltage level: 0.7/0.3 V
Sync: Separate SyncOnGreen 
Maximum image size: 44 cm x 25 cm
Gamma: 2.20
DPMS levels: Standby Suspend Off
RGB color display
Default (sRGB) color space is primary color space
First detailed timing is preferred timing
Display x,y Chromaticity:
  Red:   0.6396, 0.3300
  Green: 0.2998, 0.5996
  Blue:  0.1503, 0.0595
  White: 0.3134, 0.3291
Established timings supported:
  720x400@70Hz 9:5 HorFreq: 31469 Hz Clock: 28.320 MHz
  640x480@60Hz 4:3 HorFreq: 31469 Hz Clock: 25.175 MHz
  640x480@75Hz 4:3 HorFreq: 37500 Hz Clock: 31.500 MHz
  800x600@60Hz 4:3 HorFreq: 37900 Hz Clock: 40.000 MHz
  800x600@75Hz 4:3 HorFreq: 46900 Hz Clock: 49.500 MHz
  1024x768@60Hz 4:3 HorFreq: 48400 Hz Clock: 65.000 MHz
  1024x768@75Hz 4:3 HorFreq: 60000 Hz Clock: 78.750 MHz
  1280x1024@75Hz 5:4 HorFreq: 80000 Hz Clock: 135.000 MHz
Standard timings supported:
  1152x864@75Hz 4:3 HorFreq: 67500 Hz Clock: 108.000 MHz
  1280x1024@60Hz 5:4 HorFreq: 64000 Hz Clock: 108.000 MHz
  1600x900@60Hz 16:9
Detailed mode: Clock 108.000 MHz, 443 mm x 249 mm
               1600 1624 1704 1800 hborder 0
                900  901  904 1000 vborder 0
               +hsync +vsync 
               VertFreq: 60 Hz, HorFreq: 60000 Hz
Serial number: --
Monitor name: DELL E2010H
Monitor ranges (GTF): 56-76Hz V, 30-83kHz H, max dotclock 160MHz
Checksum: 0x4 (valid)
EDID block does NOT conform to EDID 1.3!
	sRGB is signaled, but the chromaticities do not match
