
EDID (hex):
00ffffffffffff005a633c3101010101
341f0103802213782edae5955d599429
245054bfef80b300a940a9c095009040
8180814081c01a3680a070381f403020
350058c21000001a000000ff00574d4d
3231353232303431370a000000fd0032
4b0f5211000a202020202020000000fc
005641313635352d4648440a20200196
020322f14f900504030207061f141312
1116150123097f078301000065030c00
1400023a801871382d40582c450058c2
1000001e011d8018711c1620582c2500
58c21000009e011d007251d01e206e28
550058c21000001e023a80d072382d40
102c458058c21000001e8c0ad08a20e0
2d10103e960058c21000001800000055

Extracted contents:
header:          00 ff ff ff ff ff ff 00
serial number:   5a 63 3c 31 01 01 01 01 34 1f
version:         01 03
basic params:    80 22 13 78 2e
chroma info:     da e5 95 5d 59 94 29 24 50 54
established:     bf ef 80
standard:        b3 00 a9 40 a9 c0 95 00 90 40 81 80 81 40 81 c0
descriptor 1:    1a 36 80 a0 70 38 1f 40 30 20 35 00 58 c2 10 00 00 1a
descriptor 2:    00 00 00 ff 00 57 4d 4d 32 31 35 32 32 30 34 31 37 0a
descriptor 3:    00 00 00 fd 00 32 4b 0f 52 11 00 0a 20 20 20 20 20 20
descriptor 4:    00 00 00 fc 00 56 41 31 36 35 35 2d 46 48 44 0a 20 20
extensions:      01
checksum:        96

EDID version: 1.3
Manufacturer: VSC Model 313c Serial Number --
Made in week 52 of 2021
Digital display
Maximum image size: 34 cm x 19 cm
Gamma: 2.20
DPMS levels: Off
RGB color display
Default (sRGB) color space is primary color space
First detailed timing is preferred timing
Display x,y Chromaticity:
  Red:   0.5849, 0.3642
  Green: 0.3496, 0.5800
  Blue:  0.1630, 0.1425
  White: 0.3134, 0.3291
Established timings supported:
  720x400@70Hz 9:5 HorFreq: 31469 Hz Clock: 28.320 MHz
  640x480@60Hz 4:3 HorFreq: 31469 Hz Clock: 25.175 MHz
  640x480@67Hz 4:3 HorFreq: 35000 Hz Clock: 30.240 MHz
  640x480@72Hz 4:3 HorFreq: 37900 Hz Clock: 31.500 MHz
  640x480@75Hz 4:3 HorFreq: 37500 Hz Clock: 31.500 MHz
  800x600@56Hz 4:3 HorFreq: 35200 Hz Clock: 36.000 MHz
  800x600@60Hz 4:3 HorFreq: 37900 Hz Clock: 40.000 MHz
  800x600@72Hz 4:3 HorFreq: 48100 Hz Clock: 50.000 MHz
  800x600@75Hz 4:3 HorFreq: 46900 Hz Clock: 49.500 MHz
  832x624@75Hz 4:3 HorFreq: 49726 Hz Clock: 57.284 MHz
  1024x768@60Hz 4:3 HorFreq: 48400 Hz Clock: 65.000 MHz
  1024x768@70Hz 4:3 HorFreq: 56500 Hz Clock: 75.000 MHz
  1024x768@75Hz 4:3 HorFreq: 60000 Hz Clock: 78.750 MHz
  1280x1024@75Hz 5:4 HorFreq: 80000 Hz Clock: 135.000 MHz
  1152x870@75Hz 192:145 HorFreq: 67500 Hz Clock: 108.000 MHz
Standard timings supported:
  1680x1050@60Hz 16:10 HorFreq: 64700 Hz Clock: 119.000 MHz
  1600x1200@60Hz 4:3 HorFreq: 75000 Hz Clock: 162.000 MHz
  1600x900@60Hz 16:9
  1440x900@60Hz 16:10 HorFreq: 55500 Hz Clock: 88.750 MHz
  1400x1050@60Hz 4:3 HorFreq: 64700 Hz Clock: 101.000 MHz
  1280x1024@60Hz 5:4 HorFreq: 64000 Hz Clock: 108.000 MHz
  1280x960@60Hz 4:3 HorFreq: 60000 Hz Clock: 108.000 MHz
  1280x720@60Hz 16:9
Detailed mode: Clock 138.500 MHz, 344 mm x 194 mm
               1920 1968 2000 2080 hborder 0
               1080 1083 1088 1111 vborder 0
               +hsync -vsync 
               VertFreq: 59 Hz, HorFreq: 66586 Hz
Serial number: --
Monitor ranges (GTF): 50-75Hz V, 15-82kHz H, max dotclock 170MHz
Monitor name: VA1655-FHD
Has 1 extension blocks
Checksum: 0x96 (valid)

CTA extension block
Extension version: 3
30 bytes of CTA data
  Video data block
    VIC  16 1920x1080@60Hz 16:9 (native) HorFreq: 67500 Hz Clock: 148.500 MHz
    VIC   5 1920x1080i@60Hz 16:9  HorFreq: 33750 Hz Clock: 74.250 MHz
    VIC   4 1280x720@60Hz 16:9  HorFreq: 45000 Hz Clock: 74.250 MHz
    VIC   3 720x480@60Hz 16:9  HorFreq: 31469 Hz Clock: 27.000 MHz
    VIC   2 720x480@60Hz 4:3  HorFreq: 31469 Hz Clock: 27.000 MHz
    VIC   7 1440x480i@60Hz 16:9  HorFreq: 15734 Hz Clock: 27.000 MHz
    VIC   6 1440x480i@60Hz 4:3  HorFreq: 15734 Hz Clock: 27.000 MHz
    VIC  31 1920x1080@50Hz 16:9  HorFreq: 56250 Hz Clock: 148.500 MHz
    VIC  20 1920x1080i@50Hz 16:9  HorFreq: 28125 Hz Clock: 74.250 MHz
    VIC  19 1280x720@50Hz 16:9  HorFreq: 37500 Hz Clock: 74.250 MHz
    VIC  18 720x576@50Hz 16:9  HorFreq: 31250 Hz Clock: 27.000 MHz
    VIC  17 720x576@50Hz 4:3  HorFreq: 31250 Hz Clock: 27.000 MHz
    VIC  22 1440x576i@50Hz 16:9  HorFreq: 15625 Hz Clock: 27.000 MHz
    VIC  21 1440x576i@50Hz 4:3  HorFreq: 15625 Hz Clock: 27.000 MHz
    VIC   1 640x480@60Hz 4:3  HorFreq: 31469 Hz Clock: 25.175 MHz
  Audio data block
    Linear PCM, max channels 2
      Supported sample rates (kHz): 192 176.4 96 88.2 48 44.1 32
      Supported sample sizes (bits): 24 20 16
  Speaker allocation data block
    Speaker map:
      FL/FR - Front Left/Right
  Vendor-specific data block, OUI 000c03 (HDMI)
    Source physical address 1.4.0.0
Underscans PC formats by default
Basic audio support
Supports YCbCr 4:4:4
Supports YCbCr 4:2:2
1 native detailed modes
Detailed mode: Clock 148.500 MHz, 344 mm x 194 mm
               1920 2008 2052 2200 hborder 0
               1080 1084 1089 1125 vborder 0
               +hsync +vsync 
               VertFreq: 60 Hz, HorFreq: 67500 Hz
Detailed mode: Clock 74.250 MHz, 344 mm x 194 mm
               1920 2008 2052 2200 hborder 0
                540  542  547  562 vborder 0
               +hsync +vsync interlaced 
               VertFreq: 60 Hz, HorFreq: 33750 Hz
Detailed mode: Clock 74.250 MHz, 344 mm x 194 mm
               1280 1390 1430 1650 hborder 0
                720  725  730  750 vborder 0
               +hsync +vsync 
               VertFreq: 60 Hz, HorFreq: 45000 Hz
Detailed mode: Clock 148.500 MHz, 344 mm x 194 mm
               1920 2448 2492 2640 hborder 0
               1080 1084 1089 1125 vborder 0
               +hsync +vsync 
               VertFreq: 50 Hz, HorFreq: 56250 Hz
Detailed mode: Clock 27.000 MHz, 344 mm x 194 mm
                720  736  798  858 hborder 0
                480  489  495  525 vborder 0
               -hsync -vsync 
               VertFreq: 59 Hz, HorFreq: 31468 Hz
Checksum: 0x55 (valid)

EDID block does NOT conform to EDID 1.3!
	sRGB is signaled, but the chromaticities do not match
EDID block does not conform at all!
	Both the serial number and the serial string are set
