
EDID (hex):
00ffffffffffff001203a17401010101
29150103800000780a3003b24c2bc426
074a59bfef80457c617c81fc81008180
90409500a9409e20009051201f304880
3600000000000018011d007251d01e20
6e285500000000000018000000fd002b
781e6411000a202020202020000000fc
0050524f4a4543544f520a2020200159
020322714f0102150607160311128405
1314101f230907048301000065030c00
1000023a801871382d40582c45000000
00000018011d8018711c1620582c2500
000000000099011d80d0721c1620102c
25800000000000998f0ad08a20e02d10
103e9600000000000018011d00bc52d0
1e20b828554000000000001800000075

Extracted contents:
header:          00 ff ff ff ff ff ff 00
serial number:   12 03 a1 74 01 01 01 01 29 15
version:         01 03
basic params:    80 00 00 78 0a
chroma info:     30 03 b2 4c 2b c4 26 07 4a 59
established:     bf ef 80
standard:        45 7c 61 7c 81 fc 81 00 81 80 90 40 95 00 a9 40
descriptor 1:    9e 20 00 90 51 20 1f 30 48 80 36 00 00 00 00 00 00 18
descriptor 2:    01 1d 00 72 51 d0 1e 20 6e 28 55 00 00 00 00 00 00 18
descriptor 3:    00 00 00 fd 00 2b 78 1e 64 11 00 0a 20 20 20 20 20 20
descriptor 4:    00 00 00 fc 00 50 52 4f 4a 45 43 54 4f 52 0a 20 20 20
extensions:      01
checksum:        59

EDID version: 1.3
Manufacturer: DPC Model 74a1 Serial Number --
Made in week 41 of 2011
Digital display
Image size is variable
Gamma: 2.20
RGB color display
First detailed timing is preferred timing
Display x,y Chromaticity:
  Red:   0.6953, 0.2998
  Green: 0.1679, 0.7656
  Blue:  0.1484, 0.0273
  White: 0.2890, 0.3505
Established timings supported:
  720x400@70Hz 9:5 HorFreq: 31469 Hz Clock: 28.320 MHz
  640x480@60Hz 4:3 HorFreq: 31469 Hz Clock: 25.175 MHz
  640x480@67Hz 4:3 HorFreq: 35000 Hz Clock: 30.240 MHz
  640x480@72Hz 4:3 HorFreq: 37900 Hz Clock: 31.500 MHz
  640x480@75Hz 4:3 HorFreq: 37500 Hz Clock: 31.500 MHz
  800x600@56Hz 4:3 HorFreq: 35200 Hz Clock: 36.000 MHz
  800x600@60Hz 4:3 HorFreq: 37900 Hz Clock: 40.000 MHz
  800x600@72Hz 4:3 HorFreq: 48100 Hz Clock: 50.000 MHz
  800x600@75Hz 4:3 HorFreq: 46900 Hz Clock: 49.500 MHz
  832x624@75Hz 4:3 HorFreq: 49726 Hz Clock: 57.284 MHz
  1024x768@60Hz 4:3 HorFreq: 48400 Hz Clock: 65.000 MHz
  1024x768@70Hz 4:3 HorFreq: 56500 Hz Clock: 75.000 MHz
  1024x768@75Hz 4:3 HorFreq: 60000 Hz Clock: 78.750 MHz
  1280x1024@75Hz 5:4 HorFreq: 80000 Hz Clock: 135.000 MHz
  1152x870@75Hz 192:145 HorFreq: 67500 Hz Clock: 108.000 MHz
Standard timings supported:
  800x600@120Hz 4:3
  1024x768@120Hz 4:3
  1280x720@120Hz 16:9
  1280x800@60Hz 16:10
  1280x1024@60Hz 5:4 HorFreq: 64000 Hz Clock: 108.000 MHz
  1400x1050@60Hz 4:3 HorFreq: 64700 Hz Clock: 101.000 MHz
  1440x900@60Hz 16:10 HorFreq: 55500 Hz Clock: 88.750 MHz
  1600x1200@60Hz 4:3 HorFreq: 75000 Hz Clock: 162.000 MHz
Detailed mode: Clock 83.500 MHz, 0 mm x 0 mm
               1280 1352 1480 1680 hborder 0
                800  803  809  831 vborder 0
               -hsync -vsync 
               VertFreq: 59 Hz, HorFreq: 49702 Hz
Detailed mode: Clock 74.250 MHz, 0 mm x 0 mm
               1280 1390 1430 1650 hborder 0
                720  725  730  750 vborder 0
               -hsync -vsync 
               VertFreq: 60 Hz, HorFreq: 45000 Hz
Monitor ranges (GTF): 43-120Hz V, 30-100kHz H, max dotclock 170MHz
Monitor name: PROJECTOR
Has 1 extension blocks
Checksum: 0x59 (valid)

CTA extension block
Extension version: 3
30 bytes of CTA data
  Video data block
    VIC   1 640x480@60Hz 4:3  HorFreq: 31469 Hz Clock: 25.175 MHz
    VIC   2 720x480@60Hz 4:3  HorFreq: 31469 Hz Clock: 27.000 MHz
    VIC  21 1440x576i@50Hz 4:3  HorFreq: 15625 Hz Clock: 27.000 MHz
    VIC   6 1440x480i@60Hz 4:3  HorFreq: 15734 Hz Clock: 27.000 MHz
    VIC   7 1440x480i@60Hz 16:9  HorFreq: 15734 Hz Clock: 27.000 MHz
    VIC  22 1440x576i@50Hz 16:9  HorFreq: 15625 Hz Clock: 27.000 MHz
    VIC   3 720x480@60Hz 16:9  HorFreq: 31469 Hz Clock: 27.000 MHz
    VIC  17 720x576@50Hz 4:3  HorFreq: 31250 Hz Clock: 27.000 MHz
    VIC  18 720x576@50Hz 16:9  HorFreq: 31250 Hz Clock: 27.000 MHz
    VIC   4 1280x720@60Hz 16:9 (native) HorFreq: 45000 Hz Clock: 74.250 MHz
    VIC   5 1920x1080i@60Hz 16:9  HorFreq: 33750 Hz Clock: 74.250 MHz
    VIC  19 1280x720@50Hz 16:9  HorFreq: 37500 Hz Clock: 74.250 MHz
    VIC  20 1920x1080i@50Hz 16:9  HorFreq: 28125 Hz Clock: 74.250 MHz
    VIC  16 1920x1080@60Hz 16:9  HorFreq: 67500 Hz Clock: 148.500 MHz
    VIC  31 1920x1080@50Hz 16:9  HorFreq: 56250 Hz Clock: 148.500 MHz
  Audio data block
    Linear PCM, max channels 2
      Supported sample rates (kHz): 48 44.1 32
      Supported sample sizes (bits): 24
  Speaker allocation data block
    Speaker map:
      FL/FR - Front Left/Right
  Vendor-specific data block, OUI 000c03 (HDMI)
    Source physical address 1.0.0.0
Basic audio support
Supports YCbCr 4:4:4
Supports YCbCr 4:2:2
1 native detailed modes
Detailed mode: Clock 148.500 MHz, 0 mm x 0 mm
               1920 2008 2052 2200 hborder 0
               1080 1084 1089 1125 vborder 0
               -hsync -vsync 
               VertFreq: 60 Hz, HorFreq: 67500 Hz
Detailed mode: Clock 74.250 MHz, 0 mm x 0 mm
               1920 2008 2052 2200 hborder 0
                540  542  547  562 vborder 0
               -hsync -vsync interlaced 
               VertFreq: 60 Hz, HorFreq: 33750 Hz
Detailed mode: Clock 74.250 MHz, 0 mm x 0 mm
               1920 2448 2492 2640 hborder 0
                540  542  547  562 vborder 0
               -hsync -vsync interlaced 
               VertFreq: 50 Hz, HorFreq: 28125 Hz
Detailed mode: Clock 27.030 MHz, 0 mm x 0 mm
                720  736  798  858 hborder 0
                480  489  495  525 vborder 0
               -hsync -vsync 
               VertFreq: 60 Hz, HorFreq: 31503 Hz
Detailed mode: Clock 74.250 MHz, 0 mm x 0 mm
               1280 1720 1760 1980 hborder 0
                720  725  730  750 vborder 0
               -hsync -vsync 
               VertFreq: 50 Hz, HorFreq: 37500 Hz
Checksum: 0x75 (valid)

One or more of the timings is out of range of the Monitor Ranges:
  Vertical Freq: 50 - 120 Hz
  Horizontal Freq: 15625 - 80000 Hz
  Maximum Clock: 162.000 MHz


