edid-decode (hex):

00 ff ff ff ff ff ff 00 1a b3 5c 07 01 01 01 01
17 12 01 03 68 29 1a 78 2a de 95 a3 54 4c 99 26
0f 50 54 a5 4b 00 81 80 95 0f 01 01 01 01 01 01
01 01 01 01 01 01 9a 29 a0 d0 51 84 22 30 50 98
36 00 98 ff 10 00 00 1c 00 00 00 fd 00 38 4b 1f
51 0e 00 0a 20 20 20 20 20 20 00 00 00 fc 00 4c
31 39 57 2d 39 0a 20 20 20 20 20 20 00 00 00 ff
00 59 45 37 4d 30 31 39 31 37 33 0a 20 20 00 b3

00 ff ff ff ff ff ff 00 1a b3 5c 07 01 01 01 01
17 12 01 03 68 29 1a 78 2a de 95 a3 54 4c 99 26
0f 50 54 a5 4b 00 81 80 95 0f 01 01 01 01 01 01
01 01 01 01 01 01 9a 29 a0 d0 51 84 22 30 50 98
36 00 98 ff 10 00 00 1c 00 00 00 fd 00 38 4b 1f
51 0e 00 0a 20 20 20 20 20 20 00 00 00 fc 00 4c
31 39 57 2d 39 0a 20 20 20 20 20 20 00 00 00 ff
00 59 45 37 4d 30 31 39 31 37 33 0a 20 20 00 b3

----------------

Block 0, Base EDID:
  EDID Structure Version & Revision: 1.3
  Vendor & Product Identification:
    Manufacturer: FUS
    Model: 1884
    Serial Number: ...
    Made in: week 23 of 2008
  Basic Display Parameters & Features:
    Analog display
    Signal Level Standard: 0.700 : 0.000 : 0.700 V p-p
    Blank level equals black level
    Sync: Separate
    Maximum image size: 41 cm x 26 cm
    Gamma: 2.20
    DPMS levels: Off
    RGB color display
    First detailed timing is the preferred timing
  Color Characteristics:
    Red  : 0.6396, 0.3291
    Green: 0.2998, 0.5996
    Blue : 0.1503, 0.0595
    White: 0.3134, 0.3291
  Established Timings I & II:
    IBM     :   720x400    70.081663 Hz   9:5     31.467 kHz     28.320000 MHz
    DMT 0x04:   640x480    59.940476 Hz   4:3     31.469 kHz     25.175000 MHz
    DMT 0x06:   640x480    75.000000 Hz   4:3     37.500 kHz     31.500000 MHz
    DMT 0x09:   800x600    60.316541 Hz   4:3     37.879 kHz     40.000000 MHz
    DMT 0x0b:   800x600    75.000000 Hz   4:3     46.875 kHz     49.500000 MHz
    DMT 0x10:  1024x768    60.003840 Hz   4:3     48.363 kHz     65.000000 MHz
    DMT 0x12:  1024x768    75.028582 Hz   4:3     60.023 kHz     78.750000 MHz
    DMT 0x24:  1280x1024   75.024675 Hz   5:4     79.976 kHz    135.000000 MHz
  Standard Timings:
    DMT 0x23:  1280x1024   60.019740 Hz   5:4     63.981 kHz    108.000000 MHz
    DMT 0x30:  1440x900    74.984427 Hz  16:10    70.635 kHz    136.750000 MHz
  Detailed Timing Descriptors:
    DTD 1:  1440x900    59.887445 Hz  16:10    55.935 kHz    106.500000 MHz (408 mm x 255 mm)
                 Hfront   80 Hsync 152 Hback  232 Hpol N
                 Vfront    3 Vsync   6 Vback   25 Vpol P
    Display Range Limits:
      Monitor ranges (GTF): 56-75 Hz V, 31-81 kHz H, max dotclock 140 MHz
    Display Product Name: 'L19W-9'
    Display Product Serial Number: ...
Checksum: 0xb3

----------------

Block 1, Unknown EDID Extension Block 0x00:
  00 ff ff ff ff ff ff 00 1a b3 5c 07 01 01 01 01 '..........\.....'
  17 12 01 03 68 29 1a 78 2a de 95 a3 54 4c 99 26 '....h).x*...TL.&'
  0f 50 54 a5 4b 00 81 80 95 0f 01 01 01 01 01 01 '.PT.K...........'
  01 01 01 01 01 01 9a 29 a0 d0 51 84 22 30 50 98 '.......)..Q."0P.'
  36 00 98 ff 10 00 00 1c 00 00 00 fd 00 38 4b 1f '6............8K.'
  51 0e 00 0a 20 20 20 20 20 20 00 00 00 fc 00 4c 'Q...      .....L'
  31 39 57 2d 39 0a 20 20 20 20 20 20 00 00 00 ff '19W-9.      ....'
  00 59 45 37 4d 30 31 39 31 37 33 0a 20 20 00 b3 '.YE7M019173.  ..'
Checksum: 0xb3

----------------

Failures:

Block 1, Base EDID:
  Unknown Extension Block.
EDID:
  Base EDID: EDID specified 0 extension block(s), but found 1 extension block(s).

EDID conformity: FAIL
