edid-decode (hex):

00 ff ff ff ff ff ff 00 5a 63 34 f6 01 01 01 01
08 21 01 03 80 46 27 78 2e 2a c5 ac 4f 41 a7 14
0e 50 54 bf ef 80 d1 00 d1 c0 b3 00 a9 c0 95 00
81 80 81 00 81 c0 56 5e 00 a0 a0 a0 29 50 30 20
35 00 ba 88 21 00 00 1a 00 00 00 ff 00 56 33 47
32 33 30 38 32 30 32 32 34 0a 00 00 00 fd 00 18
4b 18 63 19 00 0a 20 20 20 20 20 20 00 00 00 fc
00 56 58 33 32 31 31 2d 32 4b 0a 20 20 20 01 cc

02 03 2b f1 56 01 02 03 04 05 06 07 0e 0f 90 11
12 13 14 09 16 1d 1e 1f 22 21 20 23 09 7f 07 83
01 00 00 67 03 0c 00 10 00 38 32 02 3a 80 18 71
38 2d 40 58 2c 45 00 ba 88 21 00 00 1e 01 1d 80
18 71 1c 16 20 58 2c 25 00 ba 88 21 00 00 9e 02
3a 80 d0 72 38 2d 40 10 2c 45 80 ba 88 21 00 00
1e 01 1d 00 72 51 d0 1e 20 6e 28 55 00 ba 88 21
00 00 1e 00 00 00 00 00 00 00 00 00 00 00 00 9d

00 ff ff ff ff ff ff 00 5a 63 34 f6 01 01 01 01
08 21 01 03 80 46 27 78 2e 2a c5 ac 4f 41 a7 14
0e 50 54 bf ef 80 d1 00 d1 c0 b3 00 a9 c0 95 00
81 80 81 00 81 c0 56 5e 00 a0 a0 a0 29 50 30 20
35 00 ba 88 21 00 00 1a 00 00 00 ff 00 56 33 47
32 33 30 38 32 30 32 32 34 0a 00 00 00 fd 00 18
4b 18 63 19 00 0a 20 20 20 20 20 20 00 00 00 fc
00 56 58 33 32 31 31 2d 32 4b 0a 20 20 20 01 cc

02 03 2b f1 56 01 02 03 04 05 06 07 0e 0f 90 11
12 13 14 09 16 1d 1e 1f 22 21 20 23 09 7f 07 83
01 00 00 67 03 0c 00 10 00 38 32 02 3a 80 18 71
38 2d 40 58 2c 45 00 ba 88 21 00 00 1e 01 1d 80
18 71 1c 16 20 58 2c 25 00 ba 88 21 00 00 9e 02
3a 80 d0 72 38 2d 40 10 2c 45 80 ba 88 21 00 00
1e 01 1d 00 72 51 d0 1e 20 6e 28 55 00 ba 88 21
00 00 1e 00 00 00 00 00 00 00 00 00 00 00 00 9d

----------------

Block 0, Base EDID:
  EDID Structure Version & Revision: 1.3
  Vendor & Product Identification:
    Manufacturer: VSC
    Model: 63028
    Serial Number: ...
    Made in: week 8 of 2023
  Basic Display Parameters & Features:
    Digital display
    Maximum image size: 70 cm x 39 cm
    Gamma: 2.20
    DPMS levels: Off
    RGB color display
    Default (sRGB) color space is primary color space
    First detailed timing is the preferred timing
  Color Characteristics:
    Red  : 0.6718, 0.3105
    Green: 0.2558, 0.6542
    Blue : 0.0810, 0.0546
    White: 0.3134, 0.3291
  Established Timings I & II:
    IBM     :   720x400    70.081663 Hz   9:5     31.467 kHz     28.320000 MHz
    DMT 0x04:   640x480    59.940476 Hz   4:3     31.469 kHz     25.175000 MHz
    Apple   :   640x480    66.666667 Hz   4:3     35.000 kHz     30.240000 MHz
    DMT 0x05:   640x480    72.808802 Hz   4:3     37.861 kHz     31.500000 MHz
    DMT 0x06:   640x480    75.000000 Hz   4:3     37.500 kHz     31.500000 MHz
    DMT 0x08:   800x600    56.250000 Hz   4:3     35.156 kHz     36.000000 MHz
    DMT 0x09:   800x600    60.316541 Hz   4:3     37.879 kHz     40.000000 MHz
    DMT 0x0a:   800x600    72.187572 Hz   4:3     48.077 kHz     50.000000 MHz
    DMT 0x0b:   800x600    75.000000 Hz   4:3     46.875 kHz     49.500000 MHz
    Apple   :   832x624    74.551266 Hz   4:3     49.726 kHz     57.284000 MHz
    DMT 0x10:  1024x768    60.003840 Hz   4:3     48.363 kHz     65.000000 MHz
    DMT 0x11:  1024x768    70.069359 Hz   4:3     56.476 kHz     75.000000 MHz
    DMT 0x12:  1024x768    75.028582 Hz   4:3     60.023 kHz     78.750000 MHz
    DMT 0x24:  1280x1024   75.024675 Hz   5:4     79.976 kHz    135.000000 MHz
    Apple   :  1152x870    75.061550 Hz 192:145   68.681 kHz    100.000000 MHz
  Standard Timings:
    DMT 0x45:  1920x1200   59.884600 Hz  16:10    74.556 kHz    193.250000 MHz
    DMT 0x52:  1920x1080   60.000000 Hz  16:9     67.500 kHz    148.500000 MHz
    DMT 0x3a:  1680x1050   59.954250 Hz  16:10    65.290 kHz    146.250000 MHz
    DMT 0x53:  1600x900    60.000000 Hz  16:9     60.000 kHz    108.000000 MHz (RB)
    DMT 0x2f:  1440x900    59.887445 Hz  16:10    55.935 kHz    106.500000 MHz
    DMT 0x23:  1280x1024   60.019740 Hz   5:4     63.981 kHz    108.000000 MHz
    DMT 0x1c:  1280x800    59.810326 Hz  16:10    49.702 kHz     83.500000 MHz
    DMT 0x55:  1280x720    60.000000 Hz  16:9     45.000 kHz     74.250000 MHz
  Detailed Timing Descriptors:
    DTD 1:  2560x1440   59.950550 Hz  16:9     88.787 kHz    241.500000 MHz (698 mm x 392 mm)
                 Hfront   48 Hsync  32 Hback   80 Hpol P
                 Vfront    3 Vsync   5 Vback   33 Vpol N
    Display Product Serial Number: ...
    Display Range Limits:
      Monitor ranges (GTF): 24-75 Hz V, 24-99 kHz H, max dotclock 250 MHz
    Display Product Name: 'VX3211-2K'
  Extension blocks: 1
Checksum: 0xcc

----------------

Block 1, CTA-861 Extension Block:
  Revision: 3
  Underscans IT Video Formats by default
  Basic audio support
  Supports YCbCr 4:4:4
  Supports YCbCr 4:2:2
  Native detailed modes: 1
  Video Data Block:
    VIC   1:   640x480    59.940476 Hz   4:3     31.469 kHz     25.175000 MHz
    VIC   2:   720x480    59.940060 Hz   4:3     31.469 kHz     27.000000 MHz
    VIC   3:   720x480    59.940060 Hz  16:9     31.469 kHz     27.000000 MHz
    VIC   4:  1280x720    60.000000 Hz  16:9     45.000 kHz     74.250000 MHz
    VIC   5:  1920x1080i  60.000000 Hz  16:9     33.750 kHz     74.250000 MHz
    VIC   6:  1440x480i   59.940060 Hz   4:3     15.734 kHz     27.000000 MHz
    VIC   7:  1440x480i   59.940060 Hz  16:9     15.734 kHz     27.000000 MHz
    VIC  14:  1440x480    59.940060 Hz   4:3     31.469 kHz     54.000000 MHz
    VIC  15:  1440x480    59.940060 Hz  16:9     31.469 kHz     54.000000 MHz
    VIC  16:  1920x1080   60.000000 Hz  16:9     67.500 kHz    148.500000 MHz (native)
    VIC  17:   720x576    50.000000 Hz   4:3     31.250 kHz     27.000000 MHz
    VIC  18:   720x576    50.000000 Hz  16:9     31.250 kHz     27.000000 MHz
    VIC  19:  1280x720    50.000000 Hz  16:9     37.500 kHz     74.250000 MHz
    VIC  20:  1920x1080i  50.000000 Hz  16:9     28.125 kHz     74.250000 MHz
    VIC   9:  1440x240    60.054449 Hz  16:9     15.734 kHz     27.000000 MHz
    VIC  22:  1440x576i   50.000000 Hz  16:9     15.625 kHz     27.000000 MHz
    VIC  29:  1440x576    50.000000 Hz   4:3     31.250 kHz     54.000000 MHz
    VIC  30:  1440x576    50.000000 Hz  16:9     31.250 kHz     54.000000 MHz
    VIC  31:  1920x1080   50.000000 Hz  16:9     56.250 kHz    148.500000 MHz
    VIC  34:  1920x1080   30.000000 Hz  16:9     33.750 kHz     74.250000 MHz
    VIC  33:  1920x1080   25.000000 Hz  16:9     28.125 kHz     74.250000 MHz
    VIC  32:  1920x1080   24.000000 Hz  16:9     27.000 kHz     74.250000 MHz
  Audio Data Block:
    Linear PCM:
      Max channels: 2
      Supported sample rates (kHz): 192 176.4 96 88.2 48 44.1 32
      Supported sample sizes (bits): 24 20 16
  Speaker Allocation Data Block:
    FL/FR - Front Left/Right
  Vendor-Specific Data Block (HDMI), OUI 00-0C-03:
    Source physical address: 1.0.0.0
    DC_36bit
    DC_30bit
    DC_Y444
    Maximum TMDS clock: 250 MHz
  Detailed Timing Descriptors:
    DTD 2:  1920x1080   60.000000 Hz  16:9     67.500 kHz    148.500000 MHz (698 mm x 392 mm)
                 Hfront   88 Hsync  44 Hback  148 Hpol P
                 Vfront    4 Vsync   5 Vback   36 Vpol P
    DTD 3:  1920x1080i  60.000000 Hz  16:9     33.750 kHz     74.250000 MHz (698 mm x 392 mm)
                 Hfront   88 Hsync  44 Hback  148 Hpol P
                 Vfront    2 Vsync   5 Vback   15 Vpol P Vfront +0.5 Odd Field
                 Vfront    2 Vsync   5 Vback   15 Vpol P Vback  +0.5 Even Field
    DTD 4:  1920x1080   50.000000 Hz  16:9     56.250 kHz    148.500000 MHz (698 mm x 392 mm)
                 Hfront  528 Hsync  44 Hback  148 Hpol P
                 Vfront    4 Vsync   5 Vback   36 Vpol P
    DTD 5:  1280x720    60.000000 Hz  16:9     45.000 kHz     74.250000 MHz (698 mm x 392 mm)
                 Hfront  110 Hsync  40 Hback  220 Hpol P
                 Vfront    5 Vsync   5 Vback   20 Vpol P
Checksum: 0x9d  Unused space in Extension Block: 12 bytes

----------------

Block 2, Unknown EDID Extension Block 0x00:
  00 ff ff ff ff ff ff 00 5a 63 34 f6 01 01 01 01 '........Zc4.....'
  08 21 01 03 80 46 27 78 2e 2a c5 ac 4f 41 a7 14 '.!...F'x.*..OA..'
  0e 50 54 bf ef 80 d1 00 d1 c0 b3 00 a9 c0 95 00 '.PT.............'
  81 80 81 00 81 c0 56 5e 00 a0 a0 a0 29 50 30 20 '......V^....)P0 '
  35 00 ba 88 21 00 00 1a 00 00 00 ff 00 56 33 47 '5...!........V3G'
  32 33 30 38 32 30 32 32 34 0a 00 00 00 fd 00 18 '230820224.......'
  4b 18 63 19 00 0a 20 20 20 20 20 20 00 00 00 fc 'K.c...      ....'
  00 56 58 33 32 31 31 2d 32 4b 0a 20 20 20 01 cc '.VX3211-2K.   ..'
Checksum: 0xcc

----------------

Block 3, CTA-861 Extension Block:
  Revision: 3
  Underscans IT Video Formats by default
  Basic audio support
  Supports YCbCr 4:4:4
  Supports YCbCr 4:2:2
  Native detailed modes: 1
  Video Data Block:
    VIC   1:   640x480    59.940476 Hz   4:3     31.469 kHz     25.175000 MHz
    VIC   2:   720x480    59.940060 Hz   4:3     31.469 kHz     27.000000 MHz
    VIC   3:   720x480    59.940060 Hz  16:9     31.469 kHz     27.000000 MHz
    VIC   4:  1280x720    60.000000 Hz  16:9     45.000 kHz     74.250000 MHz
    VIC   5:  1920x1080i  60.000000 Hz  16:9     33.750 kHz     74.250000 MHz
    VIC   6:  1440x480i   59.940060 Hz   4:3     15.734 kHz     27.000000 MHz
    VIC   7:  1440x480i   59.940060 Hz  16:9     15.734 kHz     27.000000 MHz
    VIC  14:  1440x480    59.940060 Hz   4:3     31.469 kHz     54.000000 MHz
    VIC  15:  1440x480    59.940060 Hz  16:9     31.469 kHz     54.000000 MHz
    VIC  16:  1920x1080   60.000000 Hz  16:9     67.500 kHz    148.500000 MHz (native)
    VIC  17:   720x576    50.000000 Hz   4:3     31.250 kHz     27.000000 MHz
    VIC  18:   720x576    50.000000 Hz  16:9     31.250 kHz     27.000000 MHz
    VIC  19:  1280x720    50.000000 Hz  16:9     37.500 kHz     74.250000 MHz
    VIC  20:  1920x1080i  50.000000 Hz  16:9     28.125 kHz     74.250000 MHz
    VIC   9:  1440x240    60.054449 Hz  16:9     15.734 kHz     27.000000 MHz
    VIC  22:  1440x576i   50.000000 Hz  16:9     15.625 kHz     27.000000 MHz
    VIC  29:  1440x576    50.000000 Hz   4:3     31.250 kHz     54.000000 MHz
    VIC  30:  1440x576    50.000000 Hz  16:9     31.250 kHz     54.000000 MHz
    VIC  31:  1920x1080   50.000000 Hz  16:9     56.250 kHz    148.500000 MHz
    VIC  34:  1920x1080   30.000000 Hz  16:9     33.750 kHz     74.250000 MHz
    VIC  33:  1920x1080   25.000000 Hz  16:9     28.125 kHz     74.250000 MHz
    VIC  32:  1920x1080   24.000000 Hz  16:9     27.000 kHz     74.250000 MHz
  Audio Data Block:
    Linear PCM:
      Max channels: 2
      Supported sample rates (kHz): 192 176.4 96 88.2 48 44.1 32
      Supported sample sizes (bits): 24 20 16
  Speaker Allocation Data Block:
    FL/FR - Front Left/Right
  Vendor-Specific Data Block (HDMI), OUI 00-0C-03:
    Source physical address: 1.0.0.0
    DC_36bit
    DC_30bit
    DC_Y444
    Maximum TMDS clock: 250 MHz
  Detailed Timing Descriptors:
    DTD 6:  1920x1080   60.000000 Hz  16:9     67.500 kHz    148.500000 MHz (698 mm x 392 mm)
                 Hfront   88 Hsync  44 Hback  148 Hpol P
                 Vfront    4 Vsync   5 Vback   36 Vpol P
    DTD 7:  1920x1080i  60.000000 Hz  16:9     33.750 kHz     74.250000 MHz (698 mm x 392 mm)
                 Hfront   88 Hsync  44 Hback  148 Hpol P
                 Vfront    2 Vsync   5 Vback   15 Vpol P Vfront +0.5 Odd Field
                 Vfront    2 Vsync   5 Vback   15 Vpol P Vback  +0.5 Even Field
    DTD 8:  1920x1080   50.000000 Hz  16:9     56.250 kHz    148.500000 MHz (698 mm x 392 mm)
                 Hfront  528 Hsync  44 Hback  148 Hpol P
                 Vfront    4 Vsync   5 Vback   36 Vpol P
    DTD 9:  1280x720    60.000000 Hz  16:9     45.000 kHz     74.250000 MHz (698 mm x 392 mm)
                 Hfront  110 Hsync  40 Hback  220 Hpol P
                 Vfront    5 Vsync   5 Vback   20 Vpol P
Checksum: 0x9d  Unused space in Extension Block: 12 bytes

----------------

Warnings:

Block 1, CTA-861 Extension Block:
  Display Product Serial Number is set, so the Serial Number in the Base EDID should be 0.
Block 3, CTA-861 Extension Block:
  Display Product Serial Number is set, so the Serial Number in the Base EDID should be 0.

Failures:

Block 0, Base EDID:
  Basic Display Parameters & Features: sRGB is signaled, but the chromaticities do not match.
Block 1, CTA-861 Extension Block:
  Missing VCDB, needed for Set Selectable RGB Quantization to avoid interop issues.
Block 2, Base EDID:
  Unknown Extension Block.
Block 3, CTA-861 Extension Block:
  Video Data Block: Duplicate VIC 1.
  Video Data Block: Duplicate VIC 2.
  Video Data Block: Duplicate VIC 3.
  Video Data Block: Duplicate VIC 4.
  Video Data Block: Duplicate VIC 5.
  Video Data Block: Duplicate VIC 6.
  Video Data Block: Duplicate VIC 7.
  Video Data Block: Duplicate VIC 14.
  Video Data Block: Duplicate VIC 15.
  Video Data Block: Duplicate VIC 16.
  Video Data Block: Duplicate VIC 17.
  Video Data Block: Duplicate VIC 18.
  Video Data Block: Duplicate VIC 19.
  Video Data Block: Duplicate VIC 20.
  Video Data Block: Duplicate VIC 9.
  Video Data Block: Duplicate VIC 22.
  Video Data Block: Duplicate VIC 29.
  Video Data Block: Duplicate VIC 30.
  Video Data Block: Duplicate VIC 31.
  Video Data Block: Duplicate VIC 34.
  Video Data Block: Duplicate VIC 33.
  Video Data Block: Duplicate VIC 32.
  Speaker Allocation Data Block: Only one instance of this Data Block is allowed.
  Missing VCDB, needed for Set Selectable RGB Quantization to avoid interop issues.
EDID:
  Base EDID: Some timings are out of range of the Monitor Ranges:
    Horizontal Freq: 15.625 - 88.786 kHz (Monitor: 24.000 - 99.000 kHz)
  Base EDID: EDID specified 1 extension block(s), but found 3 extension block(s).
  Base EDID: EDID 1.3 requires a Block Map Extension in Block 1 if there are more than 2 blocks in the EDID.
  CTA-861: Native progressive timings are a mix of several resolutions.

EDID conformity: FAIL
