edid-decode (hex):

00 ff ff ff ff ff ff 00 09 e5 05 07 00 00 00 00
01 1c 01 04 95 1f 11 78 02 c5 a0 95 5d 58 94 29
22 50 54 00 00 00 01 01 01 01 01 01 01 01 01 01
01 01 01 01 01 01 48 1c 56 a2 50 00 16 30 30 20
36 00 35 ad 10 00 00 1a 00 00 00 00 00 00 00 00
00 00 00 00 00 00 00 00 00 1a 00 00 00 fe 00 42
4f 45 20 43 51 0a 20 20 20 20 20 20 00 00 00 fe
00 4e 54 31 34 30 57 48 4d 2d 4e 34 34 0a 00 6b

----------------

Block 0, Base EDID:
  EDID Structure Version & Revision: 1.4
  Vendor & Product Identification:
    Manufacturer: BOE
    Model: 1797
    Made in: week 1 of 2018
  Basic Display Parameters & Features:
    Digital display
    Bits per primary color channel: 6
    DisplayPort interface
    Maximum image size: 31 cm x 17 cm
    Gamma: 2.20
    Supported color formats: RGB 4:4:4
    First detailed timing includes the native pixel format and preferred refresh rate
  Color Characteristics:
    Red  : 0.5849, 0.3632
    Green: 0.3447, 0.5791
    Blue : 0.1621, 0.1347
    White: 0.3125, 0.3281
  Established Timings I & II: none
  Standard Timings: none
  Detailed Timing Descriptors:
    DTD 1:  1366x768    59.977 Hz 683:384  47.382 kHz  72.400 MHz (309 mm x 173 mm)
                 Hfront   48 Hsync  32 Hback  82 Hpol P
                 Vfront    3 Vsync   6 Vback  13 Vpol N
    Manufacturer-Specified Display Descriptor (0x00): 00 00 00 00 00 00 00 00 00 00 00 00 00 00 00 1a '................'
    Alphanumeric Data String: 'BOE CQ'
    Alphanumeric Data String: 'NT140WHM-N44'
Checksum: 0x6b
