edid-decode (hex):

00 ff ff ff ff ff ff 00 38 70 61 00 00 00 00 00
01 1f 01 04 a5 1e 13 78 02 ee 95 a3 54 4c 99 26
0f 50 54 00 00 00 01 01 01 01 01 01 01 01 01 01
01 01 01 01 01 01 f4 69 00 a0 a0 40 3e 60 30 20
35 00 2e bd 10 00 00 1a c3 54 00 a0 a0 40 3e 60
30 20 35 00 2e bd 10 00 00 1a 00 00 00 fe 00 43
45 43 20 50 41 0a 20 20 20 20 20 20 00 00 00 fe
00 4c 4d 31 34 30 47 46 2d 32 4c 30 31 0a 00 49

----------------

Block 0, Base EDID:
  EDID Structure Version & Revision: 1.4
  Vendor & Product Identification:
    Manufacturer: NCP
    Model: 97
    Made in: week 1 of 2021
  Basic Display Parameters & Features:
    Digital display
    Bits per primary color channel: 8
    DisplayPort interface
    Maximum image size: 30 cm x 19 cm
    Gamma: 2.20
    Supported color formats: RGB 4:4:4
    First detailed timing includes the native pixel format and preferred refresh rate
  Color Characteristics:
    Red  : 0.6396, 0.3300
    Green: 0.2998, 0.5996
    Blue : 0.1503, 0.0595
    White: 0.3134, 0.3291
  Established Timings I & II: none
  Standard Timings: none
  Detailed Timing Descriptors:
    DTD 1:  2560x1600   60.000354 Hz  16:10    99.721 kHz    271.240000 MHz (302 mm x 189 mm)
                 Hfront   48 Hsync  32 Hback   80 Hpol P
                 Vfront    3 Vsync   5 Vback   54 Vpol N
    DTD 2:  2560x1600   47.999841 Hz  16:10    79.776 kHz    216.990000 MHz (302 mm x 189 mm)
                 Hfront   48 Hsync  32 Hback   80 Hpol P
                 Vfront    3 Vsync   5 Vback   54 Vpol N
    Alphanumeric Data String: 'CEC PA'
    Alphanumeric Data String: 'LM140GF-2L01'
Checksum: 0x49

----------------

Warnings:

Block 0, Base EDID:
  Missing Display Product Name.

EDID conformity: PASS
