
EDID (hex):
00ffffffffffff005613003201000000
0f19010300462778ea2d36a75438ae26
0d4f54afcf00d1c0b3009500818081c0
8100a9c00101023a801871382d40582c
4500dd0c1100001a662156aa51001e30
468f330055502100001e000000fd0037
4b1e5312000a202020202020000000fc
004d33323041310a2020202020200011

Extracted contents:
header:          00 ff ff ff ff ff ff 00
serial number:   56 13 00 32 01 00 00 00 0f 19
version:         01 03
basic params:    00 46 27 78 ea
chroma info:     2d 36 a7 54 38 ae 26 0d 4f 54
established:     af cf 00
standard:        d1 c0 b3 00 95 00 81 80 81 c0 81 00 a9 c0 01 01
descriptor 1:    02 3a 80 18 71 38 2d 40 58 2c 45 00 dd 0c 11 00 00 1a
descriptor 2:    66 21 56 aa 51 00 1e 30 46 8f 33 00 55 50 21 00 00 1e
descriptor 3:    00 00 00 fd 00 37 4b 1e 53 12 00 0a 20 20 20 20 20 20
descriptor 4:    00 00 00 fc 00 4d 33 32 30 41 31 0a 20 20 20 20 20 20
extensions:      00
checksum:        11

EDID version: 1.3
Manufacturer: UPS Model 3200 Serial Number --
Made in week 15 of 2015
Analog display, Input voltage level: 0.7/0.3 V
Sync: 
Maximum image size: 70 cm x 39 cm
Gamma: 2.20
DPMS levels: Standby Suspend Off
RGB color display
First detailed timing is preferred timing
Display x,y Chromaticity:
  Red:   0.6523, 0.3300
  Green: 0.2216, 0.6806
  Blue:  0.1484, 0.0537
  White: 0.3095, 0.3300
Established timings supported:
  720x400@70Hz 9:5 HorFreq: 31469 Hz Clock: 28.320 MHz
  640x480@60Hz 4:3 HorFreq: 31469 Hz Clock: 25.175 MHz
  640x480@72Hz 4:3 HorFreq: 37900 Hz Clock: 31.500 MHz
  640x480@75Hz 4:3 HorFreq: 37500 Hz Clock: 31.500 MHz
  800x600@56Hz 4:3 HorFreq: 35200 Hz Clock: 36.000 MHz
  800x600@60Hz 4:3 HorFreq: 37900 Hz Clock: 40.000 MHz
  800x600@72Hz 4:3 HorFreq: 48100 Hz Clock: 50.000 MHz
  800x600@75Hz 4:3 HorFreq: 46900 Hz Clock: 49.500 MHz
  1024x768@60Hz 4:3 HorFreq: 48400 Hz Clock: 65.000 MHz
  1024x768@70Hz 4:3 HorFreq: 56500 Hz Clock: 75.000 MHz
  1024x768@75Hz 4:3 HorFreq: 60000 Hz Clock: 78.750 MHz
  1280x1024@75Hz 5:4 HorFreq: 80000 Hz Clock: 135.000 MHz
Standard timings supported:
  1920x1080@60Hz 16:9
  1680x1050@60Hz 16:10 HorFreq: 64700 Hz Clock: 119.000 MHz
  1440x900@60Hz 16:10 HorFreq: 55500 Hz Clock: 88.750 MHz
  1280x1024@60Hz 5:4 HorFreq: 64000 Hz Clock: 108.000 MHz
  1280x720@60Hz 16:9
  1280x800@60Hz 16:10
  1600x900@60Hz 16:9
Detailed mode: Clock 148.500 MHz, 477 mm x 268 mm
               1920 2008 2052 2200 hborder 0
               1080 1084 1089 1125 vborder 0
               +hsync -vsync 
               VertFreq: 60 Hz, HorFreq: 67500 Hz
Detailed mode: Clock 85.500 MHz, 597 mm x 336 mm
               1366 1436 1579 1792 hborder 0
                768  771  774  798 vborder 0
               +hsync +vsync 
               VertFreq: 59 Hz, HorFreq: 47712 Hz
Monitor ranges (GTF): 55-75Hz V, 30-83kHz H, max dotclock 180MHz
Monitor name: M320A1
Checksum: 0x11 (valid)
