edid-decode (hex):

00 ff ff ff ff ff ff 00 30 e4 d3 03 00 00 00 00
00 17 01 04 90 1f 11 78 02 fc 45 95 58 55 92 28
20 50 54 00 00 00 01 01 01 01 01 01 01 01 01 01
01 01 01 01 01 01 26 2f 40 f0 61 84 3c 30 a0 60
35 00 35 ae 10 00 00 1a 00 00 00 00 00 00 00 00
00 00 00 00 00 00 00 00 00 00 00 00 00 fe 00 4a
59 30 44 4b 80 31 34 30 57 44 32 0a 00 00 00 00
00 00 41 31 9e 00 10 00 00 02 01 0a 20 20 00 e4

----------------

Block 0, Base EDID:
  EDID Structure Version & Revision: 1.4
  Vendor & Product Identification:
    Manufacturer: LGD
    Model: 979
    Made in: 2013
  Basic Display Parameters & Features:
    Digital display
    Bits per primary color channel: 6
    Digital interface is not defined
    Maximum image size: 31 cm x 17 cm
    Gamma: 2.20
    Supported color formats: RGB 4:4:4
    First detailed timing includes the native pixel format and preferred refresh rate
  Color Characteristics:
    Red  : 0.5849, 0.3466
    Green: 0.3349, 0.5703
    Blue : 0.1572, 0.1250
    White: 0.3134, 0.3291
  Established Timings I & II: none
  Standard Timings: none
  Detailed Timing Descriptors:
    DTD 1:  1600x900    59.985 Hz  16:9    57.586 kHz 120.700 MHz (309 mm x 174 mm)
                 Hfront  160 Hsync  96 Hback 240 Hpol P
                 Vfront    3 Vsync   5 Vback  52 Vpol N
    Empty Descriptor
    Alphanumeric Data String: 'JY0DK'
    Manufacturer-Specified Display Descriptor (0x00): 00 00 00 00 41 31 9e 00 10 00 00 02 01 0a 20 20 '....A1........  '
Checksum: 0xe4

----------------

Failures:

Block 0, Base EDID:
  Empty Descriptor: Use Dummy Descriptor instead of all zeroes.
  Alphanumeric Data String: Non-printable character.
  Missing Display Product Name.

EDID conformity: FAIL
