
EDID (hex):
00ffffffffffff004d10421500000000
0a1f0104951f1178003aa0975a588b27
19505400000001010101010101010101
0101010101011a3680a070381e403020
350035ae10000018482b80a070381e40
3020350035ae10000018000000fe0039
58363043804c513134304d3100000000
0000410319001000000a010a202000ec

Extracted contents:
header:          00 ff ff ff ff ff ff 00
serial number:   4d 10 42 15 00 00 00 00 0a 1f
version:         01 04
basic params:    95 1f 11 78 00
chroma info:     3a a0 97 5a 58 8b 27 19 50 54
established:     00 00 00
standard:        01 01 01 01 01 01 01 01 01 01 01 01 01 01 01 01
descriptor 1:    1a 36 80 a0 70 38 1e 40 30 20 35 00 35 ae 10 00 00 18
descriptor 2:    48 2b 80 a0 70 38 1e 40 30 20 35 00 35 ae 10 00 00 18
descriptor 3:    00 00 00 fe 00 39 58 36 30 43 80 4c 51 31 34 30 4d 31
descriptor 4:    00 00 00 00 00 00 41 03 19 00 10 00 00 0a 01 0a 20 20
extensions:      00
checksum:        ec

EDID version: 1.4
Manufacturer: SHP Model 1542 Serial Number --
Made in week 10 of 2021
Digital display
6 bits per primary color channel
DisplayPort interface
Maximum image size: 31 cm x 17 cm
Gamma: 2.20
Supported color formats: RGB 4:4:4
Display x,y Chromaticity:
  Red:   0.5898, 0.3544
  Green: 0.3457, 0.5449
  Blue:  0.1542, 0.0996
  White: 0.3125, 0.3281
Established timings supported:
Standard timings supported:
Detailed mode: Clock 138.500 MHz, 309 mm x 174 mm
               1920 1968 2000 2080 hborder 0
               1080 1083 1088 1110 vborder 0
               -hsync -vsync 
               VertFreq: 59 Hz, HorFreq: 66586 Hz
Detailed mode: Clock 110.800 MHz, 309 mm x 174 mm
               1920 1968 2000 2080 hborder 0
               1080 1083 1088 1110 vborder 0
               -hsync -vsync 
               VertFreq: 47 Hz, HorFreq: 53269 Hz
ASCII string: 9X60C
Manufacturer-specified data, tag 0
Checksum: 0xec (valid)
EDID block does NOT conform to EDID 1.4!
	Missing name descriptor
	Missing monitor ranges
	Detailed block string not properly terminated
