edid-decode (hex):

00 ff ff ff ff ff ff 00 1e 6d 66 3b 25 3a 00 00
24 0e 01 03 78 1c 15 b0 e8 5f 45 a4 54 45 9a 24
10 48 4c bf f8 00 31 40 31 4f 31 59 3b ca 45 40
45 4f 45 59 61 40 64 19 00 40 41 00 26 30 18 88
36 00 0e c8 10 00 00 18 f9 15 20 f8 30 58 1f 20
20 40 13 00 0e c8 10 00 00 1e 00 00 00 fd 00 32
78 1e 36 07 00 0a 20 20 20 20 20 20 00 00 00 fc
00 35 30 30 47 0a 20 20 20 20 20 20 20 20 00 f8

----------------

Block 0, Base EDID:
  EDID Structure Version & Revision: 1.3
  Vendor & Product Identification:
    Manufacturer: GSM
    Model: 15206
    Serial Number: ...
    Made in: week 36 of 2004
  Basic Display Parameters & Features:
    Analog display
    Input voltage level: 0.7/0.7 V
    Blank-to-black setup/pedestal
    Sync: Separate
    Maximum image size: 28 cm x 21 cm
    Gamma: 2.76
    DPMS levels: Standby Suspend Off
    RGB color display
  Color Characteristics:
    Red  : 0.6416, 0.3291
    Green: 0.2724, 0.6044
    Blue : 0.1416, 0.0625
    White: 0.2822, 0.2978
  Established Timings I & II:
    IBM     :   720x400    70.081663 Hz   9:5     31.467 kHz     28.320000 MHz
    DMT 0x04:   640x480    59.940476 Hz   4:3     31.469 kHz     25.175000 MHz
    Apple   :   640x480    66.666667 Hz   4:3     35.000 kHz     30.240000 MHz
    DMT 0x05:   640x480    72.808802 Hz   4:3     37.861 kHz     31.500000 MHz
    DMT 0x06:   640x480    75.000000 Hz   4:3     37.500 kHz     31.500000 MHz
    DMT 0x08:   800x600    56.250000 Hz   4:3     35.156 kHz     36.000000 MHz
    DMT 0x09:   800x600    60.316541 Hz   4:3     37.879 kHz     40.000000 MHz
    DMT 0x0a:   800x600    72.187572 Hz   4:3     48.077 kHz     50.000000 MHz
    DMT 0x0b:   800x600    75.000000 Hz   4:3     46.875 kHz     49.500000 MHz
    Apple   :   832x624    74.551266 Hz   4:3     49.726 kHz     57.284000 MHz
    DMT 0x0f:  1024x768i   86.957532 Hz   4:3     35.522 kHz     44.900000 MHz
    DMT 0x10:  1024x768    60.003840 Hz   4:3     48.363 kHz     65.000000 MHz
  Standard Timings:
    DMT 0x04:   640x480    59.940476 Hz   4:3     31.469 kHz     25.175000 MHz
    DMT 0x06:   640x480    75.000000 Hz   4:3     37.500 kHz     31.500000 MHz
    DMT 0x07:   640x480    85.008312 Hz   4:3     43.269 kHz     36.000000 MHz
    GTF     :   720x405    70.000423 Hz  16:9     29.540 kHz     26.468000 MHz
    DMT 0x09:   800x600    60.316541 Hz   4:3     37.879 kHz     40.000000 MHz
    DMT 0x0b:   800x600    75.000000 Hz   4:3     46.875 kHz     49.500000 MHz
    DMT 0x0c:   800x600    85.061274 Hz   4:3     53.674 kHz     56.250000 MHz
    DMT 0x10:  1024x768    60.003840 Hz   4:3     48.363 kHz     65.000000 MHz
  Detailed Timing Descriptors:
    DTD 1:  1024x768    60.003840 Hz   4:3     48.363 kHz     65.000000 MHz (270 mm x 200 mm)
                 Hfront   24 Hsync 136 Hback  160 Hpol N
                 Vfront    3 Vsync   6 Vback   29 Vpol N
    DTD 2:   800x600    85.061274 Hz   4:3     53.674 kHz     56.250000 MHz (270 mm x 200 mm)
                 Hfront   32 Hsync  64 Hback  152 Hpol P
                 Vfront    1 Vsync   3 Vback   27 Vpol P
    Display Range Limits:
      Monitor ranges (GTF): 50-120 Hz V, 30-54 kHz H, max dotclock 70 MHz
    Display Product Name: '500G'
Checksum: 0xf8

----------------

Warnings:

Block 0, Base EDID:
  Standard Timings: Standard Timing 720x405 has a dubious odd vertical resolution.

Failures:

Block 0, Base EDID:
  Basic Display Parameters & Features: EDID 1.3 requires that the first detailed timing is the preferred timing.
  Detailed Timing Descriptor #1: Mismatch of image size 270x200 mm vs display size 280x210 mm.
  Detailed Timing Descriptor #2: Mismatch of image size 270x200 mm vs display size 280x210 mm.

EDID conformity: FAIL
