
EDID (hex):
00ffffffffffff0026cf330500000000
02160103801d10780a76b09455549027
23505400000001010101010101010101
010101010101681c5686500028303a24
370025a4100000190000000000000000
00000000000000000000000000fe0049
6e666f566973696f6e0a2020000000fe
004d3133334e574e31205230200a00f0

Extracted contents:
header:          00 ff ff ff ff ff ff 00
serial number:   26 cf 33 05 00 00 00 00 02 16
version:         01 03
basic params:    80 1d 10 78 0a
chroma info:     76 b0 94 55 54 90 27 23 50 54
established:     00 00 00
standard:        01 01 01 01 01 01 01 01 01 01 01 01 01 01 01 01
descriptor 1:    68 1c 56 86 50 00 28 30 3a 24 37 00 25 a4 10 00 00 19
descriptor 2:    00 00 00 00 00 00 00 00 00 00 00 00 00 00 00 00 00 00
descriptor 3:    00 00 00 fe 00 49 6e 66 6f 56 69 73 69 6f 6e 0a 20 20
descriptor 4:    00 00 00 fe 00 4d 31 33 33 4e 57 4e 31 20 52 30 20 0a
extensions:      00
checksum:        f0

EDID version: 1.3
Manufacturer: IVO Model 533 Serial Number --
Made in week 2 of 2012
Digital display
Maximum image size: 29 cm x 16 cm
Gamma: 2.20
RGB color display
First detailed timing is preferred timing
Display x,y Chromaticity:
  Red:   0.5791, 0.3349
  Green: 0.3291, 0.5644
  Blue:  0.1542, 0.1396
  White: 0.3125, 0.3281
Established timings supported:
Standard timings supported:
Detailed mode: Clock 72.720 MHz, 293 mm x 164 mm
               1366 1424 1460 1500 hborder 0
                768  771  778  808 vborder 0
               -hsync -vsync 
               VertFreq: 60 Hz, HorFreq: 48480 Hz
Manufacturer-specified data, tag 0
ASCII string: InfoVision
ASCII string: M133NWN1 R0 
Checksum: 0xf0 (valid)
EDID block does NOT conform to EDID 1.3!
	Missing name descriptor
	Missing monitor ranges
