edid-decode (hex):

00 ff ff ff ff ff ff 00 5d 2e 86 17 47 ab 01 00
02 0b 01 01 08 1e 16 00 e8 00 b2 a0 57 49 9b 26
10 48 4f af cf 00 31 59 45 59 61 59 71 40 71 4a
71 4f 71 59 81 40 00 00 00 fa 00 81 59 81 80 81
8a 81 99 a9 40 a9 45 0a 00 00 00 fa 00 a9 4a a9
4f c1 40 c9 40 d1 40 d1 40 0a 00 00 00 00 00 00
00 00 00 00 00 00 00 00 00 00 00 00 00 00 00 00
fe 00 0a 20 20 20 20 20 20 20 20 20 20 20 00 e9

----------------

Block 0, Base EDID:
  EDID Structure Version & Revision: 1.1
  Vendor & Product Identification:
    Manufacturer: WIN
    Model: 6022
    Serial Number: ...
    Made in: week 2 of 2001
  Basic Display Parameters & Features:
    Analog display
    Input voltage level: 0.7/0.3 V
    Blank level equals black level
    Sync: Separate
    Maximum image size: 30 cm x 22 cm
    Gamma: 1.00
    DPMS levels: Standby Suspend Off
    RGB color display
  Color Characteristics:
    Red  : 0.6250, 0.3398
    Green: 0.2851, 0.6054
    Blue : 0.1503, 0.0654
    White: 0.2812, 0.3105
  Established Timings I & II:
    IBM     :   720x400    70.081663 Hz   9:5     31.467 kHz     28.320000 MHz
    DMT 0x04:   640x480    59.940476 Hz   4:3     31.469 kHz     25.175000 MHz
    DMT 0x05:   640x480    72.808802 Hz   4:3     37.861 kHz     31.500000 MHz
    DMT 0x06:   640x480    75.000000 Hz   4:3     37.500 kHz     31.500000 MHz
    DMT 0x08:   800x600    56.250000 Hz   4:3     35.156 kHz     36.000000 MHz
    DMT 0x09:   800x600    60.316541 Hz   4:3     37.879 kHz     40.000000 MHz
    DMT 0x0a:   800x600    72.187572 Hz   4:3     48.077 kHz     50.000000 MHz
    DMT 0x0b:   800x600    75.000000 Hz   4:3     46.875 kHz     49.500000 MHz
    DMT 0x10:  1024x768    60.003840 Hz   4:3     48.363 kHz     65.000000 MHz
    DMT 0x11:  1024x768    70.069359 Hz   4:3     56.476 kHz     75.000000 MHz
    DMT 0x12:  1024x768    75.028582 Hz   4:3     60.023 kHz     78.750000 MHz
    DMT 0x24:  1280x1024   75.024675 Hz   5:4     79.976 kHz    135.000000 MHz
  Standard Timings:
    DMT 0x07:   640x480    85.008312 Hz   4:3     43.269 kHz     36.000000 MHz
    DMT 0x0c:   800x600    85.061274 Hz   4:3     53.674 kHz     56.250000 MHz
    DMT 0x13:  1024x768    84.996690 Hz   4:3     68.677 kHz     94.500000 MHz
    Unknown :  1152x864    60.000 Hz   4:3
    Unknown :  1152x864    70.000 Hz   4:3
    DMT 0x15:  1152x864    75.000000 Hz   4:3     67.500 kHz    108.000000 MHz
    Unknown :  1152x864    85.000 Hz   4:3
    DMT 0x20:  1280x960    60.000000 Hz   4:3     60.000 kHz    108.000000 MHz
  Detailed Timing Descriptors:
    Standard Timing Identifications:
      DMT 0x21:  1280x960    85.002473 Hz   4:3     85.938 kHz    148.500000 MHz
      DMT 0x23:  1280x1024   60.019740 Hz   5:4     63.981 kHz    108.000000 MHz
      Unknown :  1280x1024   70.000 Hz   5:4
      DMT 0x25:  1280x1024   85.024098 Hz   5:4     91.146 kHz    157.500000 MHz
      DMT 0x33:  1600x1200   60.000000 Hz   4:3     75.000 kHz    162.000000 MHz
      DMT 0x34:  1600x1200   65.000000 Hz   4:3     81.250 kHz    175.500000 MHz
    Standard Timing Identifications:
      DMT 0x35:  1600x1200   70.000000 Hz   4:3     87.500 kHz    189.000000 MHz
      DMT 0x36:  1600x1200   75.000000 Hz   4:3     93.750 kHz    202.500000 MHz
      DMT 0x3e:  1792x1344   59.999789 Hz   4:3     83.640 kHz    204.750000 MHz
      DMT 0x41:  1856x1392   59.995184 Hz   4:3     86.333 kHz    218.250000 MHz
      DMT 0x49:  1920x1440   60.000000 Hz   4:3     90.000 kHz    234.000000 MHz
      DMT 0x49:  1920x1440   60.000000 Hz   4:3     90.000 kHz    234.000000 MHz
    Empty Descriptor
    Manufacturer-Specified Display Descriptor (0x00): 00 00 fe 00 0a 20 20 20 20 20 20 20 20 20 20 20 '.....           '
Checksum: 0xe9

----------------

Warnings:

Block 0, Base EDID:
  EDID Structure Version & Revision: EDID 1.1 is deprecated, do not use.

Failures:

Block 0, Base EDID:
  Empty Descriptor: Use Dummy Descriptor instead of all zeroes.
  Display Descriptor #4: Monitor descriptor block has byte 4 nonzero (0xfe).

EDID conformity: FAIL
