edid-decode (hex):

00 ff ff ff ff ff ff 00 06 af 5c 20 00 00 00 00
01 1d 01 04 95 1a 0e 78 03 aa 65 96 59 58 96 28
1b 50 54 00 00 00 01 01 01 01 01 01 01 01 01 01
01 01 01 01 01 01 82 1e 56 50 50 00 84 30 30 20
46 00 00 90 10 00 00 18 57 14 56 50 50 00 84 30
30 20 46 00 00 90 10 00 00 18 00 00 00 00 00 00
00 00 00 00 00 00 00 00 00 00 00 00 00 00 00 02
00 10 48 ff 0f 3c 6e 12 0a 12 6e 20 20 20 00 8e

----------------

Block 0, Base EDID:
  EDID Structure Version & Revision: 1.4
  Vendor & Product Identification:
    Manufacturer: AUO
    Model: 8284
    Made in: week 1 of 2019
  Basic Display Parameters & Features:
    Digital display
    Bits per primary color channel: 6
    DisplayPort interface
    Maximum image size: 26 cm x 14 cm
    Gamma: 2.20
    Supported color formats: RGB 4:4:4
    First detailed timing includes the native pixel format and preferred refresh rate
    Display is continuous frequency
  Color Characteristics:
    Red  : 0.5878, 0.3496
    Green: 0.3457, 0.5878
    Blue : 0.1572, 0.1074
    White: 0.3134, 0.3291
  Established Timings I & II: none
  Standard Timings: none
  Detailed Timing Descriptors:
    DTD 1:  1366x768    60.012294 Hz 683:384   54.011 kHz     78.100000 MHz (256 mm x 144 mm)
                 Hfront   48 Hsync  32 Hback    0 Hpol N
                 Vfront    4 Vsync   6 Vback  122 Vpol N
    DTD 2:  1366x768    40.010758 Hz 683:384   36.010 kHz     52.070000 MHz (256 mm x 144 mm)
                 Hfront   48 Hsync  32 Hback    0 Hpol N
                 Vfront    4 Vsync   6 Vback  122 Vpol N
    Empty Descriptor
    Manufacturer-Specified Display Descriptor (0x02): 00 02 00 10 48 ff 0f 3c 6e 12 0a 12 6e 20 20 20 '....H..<n...n   '
Checksum: 0x8e

----------------

Warnings:

Block 0, Base EDID:
  Missing Display Product Name.

Failures:

Block 0, Base EDID:
  Detailed Timing Descriptor #1: 0 or negative horizontal back porch.
  Detailed Timing Descriptor #2: 0 or negative horizontal back porch.
  Empty Descriptor: Use Dummy Descriptor instead of all zeroes.
  Missing Display Range Limits Descriptor.

EDID conformity: FAIL
