edid-decode (hex):

00 ff ff ff ff ff ff 00 0d af 04 18 00 00 00 00
28 12 01 03 80 29 17 78 0a b5 a5 a2 54 4e 91 27
14 50 54 00 00 00 01 01 01 01 01 01 01 01 01 01
01 01 01 01 01 01 29 36 80 a0 70 38 1f 40 30 20
35 00 98 e6 10 00 00 18 00 00 00 fe 00 4e 31 38
34 48 33 2d 4c 30 32 0a 20 20 00 00 00 fe 00 43
4d 4f 0a 20 20 20 20 20 20 20 20 20 00 00 00 fe
00 4e 31 38 34 48 33 2d 4c 30 32 0a 20 20 00 c6

----------------

Block 0, Base EDID:
  EDID Structure Version & Revision: 1.3
  Vendor & Product Identification:
    Manufacturer: CMO
    Model: 6148
    Made in: week 40 of 2008
  Basic Display Parameters & Features:
    Digital display
    Maximum image size: 41 cm x 23 cm
    Gamma: 2.20
    RGB color display
    First detailed timing is the preferred timing
  Color Characteristics:
    Red  : 0.6347, 0.3310
    Green: 0.3056, 0.5673
    Blue : 0.1542, 0.0800
    White: 0.3134, 0.3291
  Established Timings I & II: none
  Standard Timings: none
  Detailed Timing Descriptors:
    DTD 1:  1920x1080   59.998788 Hz  16:9     66.659 kHz    138.650000 MHz (408 mm x 230 mm)
                 Hfront   48 Hsync  32 Hback   80 Hpol N
                 Vfront    3 Vsync   5 Vback   23 Vpol N
    Alphanumeric Data String: 'N184H3-L02'
    Alphanumeric Data String: 'CMO'
    Alphanumeric Data String: 'N184H3-L02'
Checksum: 0xc6

----------------

Failures:

Block 0, Base EDID:
  Missing Display Product Name.
  Missing Display Range Limits Descriptor.

EDID conformity: FAIL
