
EDID (hex):
00ffffffffffff001e6dd64b4a270300
2a140103a0291778ead025a258559c28
0f5054a76a00314f454f614f01010101
010101010101662150b051001b304070
360096e51000001e000000fd00384b1e
530e000a202020202020000000fc0045
313934300a20202020202020000000ff
003031305558594736323636360a0162
020323f14b0000841300010203000000
2309070783010000e2000f67030c0020
00802d011d007251d01e206e28550010
090000001e0000000000000000000000
00000000000000000000000000000000
00000000000000000000000000000000
00000000000000000000000000000000
000000000000000000000000000000fc

Extracted contents:
header:          00 ff ff ff ff ff ff 00
serial number:   1e 6d d6 4b 4a 27 03 00 2a 14
version:         01 03
basic params:    a0 29 17 78 ea
chroma info:     d0 25 a2 58 55 9c 28 0f 50 54
established:     a7 6a 00
standard:        31 4f 45 4f 61 4f 01 01 01 01 01 01 01 01 01 01
descriptor 1:    66 21 50 b0 51 00 1b 30 40 70 36 00 96 e5 10 00 00 1e
descriptor 2:    00 00 00 fd 00 38 4b 1e 53 0e 00 0a 20 20 20 20 20 20
descriptor 3:    00 00 00 fc 00 45 31 39 34 30 0a 20 20 20 20 20 20 20
descriptor 4:    00 00 00 ff 00 30 31 30 55 58 59 47 36 32 36 36 36 0a
extensions:      01
checksum:        62

EDID version: 1.3
Manufacturer: GSM Model 4bd6 Serial Number --
Made in week 42 of 2010
Digital display
Maximum image size: 41 cm x 23 cm
Gamma: 2.20
DPMS levels: Standby Suspend Off
RGB color display
First detailed timing is preferred timing
Display x,y Chromaticity:
  Red:   0.6357, 0.3447
  Green: 0.3320, 0.6093
  Blue:  0.1562, 0.0605
  White: 0.3134, 0.3291
Established timings supported:
  720x400@70Hz 9:5 HorFreq: 31469 Hz Clock: 28.320 MHz
  640x480@60Hz 4:3 HorFreq: 31469 Hz Clock: 25.175 MHz
  640x480@75Hz 4:3 HorFreq: 37500 Hz Clock: 31.500 MHz
  800x600@56Hz 4:3 HorFreq: 35200 Hz Clock: 36.000 MHz
  800x600@60Hz 4:3 HorFreq: 37900 Hz Clock: 40.000 MHz
  800x600@75Hz 4:3 HorFreq: 46900 Hz Clock: 49.500 MHz
  832x624@75Hz 4:3 HorFreq: 49726 Hz Clock: 57.284 MHz
  1024x768@60Hz 4:3 HorFreq: 48400 Hz Clock: 65.000 MHz
  1024x768@75Hz 4:3 HorFreq: 60000 Hz Clock: 78.750 MHz
Standard timings supported:
  640x480@75Hz 4:3 HorFreq: 37500 Hz Clock: 31.500 MHz
  800x600@75Hz 4:3 HorFreq: 46900 Hz Clock: 49.500 MHz
  1024x768@75Hz 4:3 HorFreq: 60000 Hz Clock: 78.750 MHz
Detailed mode: Clock 85.500 MHz, 406 mm x 229 mm
               1360 1424 1536 1792 hborder 0
                768  771  777  795 vborder 0
               +hsync +vsync 
               VertFreq: 60 Hz, HorFreq: 47712 Hz
Monitor ranges (GTF): 56-75Hz V, 30-83kHz H, max dotclock 140MHz
Monitor name: E1940
Serial number: --
Has 1 extension blocks
Checksum: 0x62 (valid)

CTA extension block
Extension version: 3
31 bytes of CTA data
  Video data block
    VIC   4 1280x720@60Hz 16:9 (native) HorFreq: 45000 Hz Clock: 74.250 MHz
    VIC  19 1280x720@50Hz 16:9  HorFreq: 37500 Hz Clock: 74.250 MHz
    VIC   1 640x480@60Hz 4:3  HorFreq: 31469 Hz Clock: 25.175 MHz
    VIC   2 720x480@60Hz 4:3  HorFreq: 31469 Hz Clock: 27.000 MHz
    VIC   3 720x480@60Hz 16:9  HorFreq: 31469 Hz Clock: 27.000 MHz
  Audio data block
    Linear PCM, max channels 2
      Supported sample rates (kHz): 48 44.1 32
      Supported sample sizes (bits): 24 20 16
  Speaker allocation data block
    Speaker map:
      FL/FR - Front Left/Right
  Extended tag: Video capability data block
    YCbCr quantization: No Data (0)
    RGB quantization: No Data (0)
    PT scan behaviour: No Data (0)
    IT scan behaviour: Support both over- and underscan (3)
    CE scan behaviour: Support both over- and underscan (3)
  Vendor-specific data block, OUI 000c03 (HDMI)
    Source physical address 2.0.0.0
    Supports_AI
    Maximum TMDS clock: 225MHz
Underscans PC formats by default
Basic audio support
Supports YCbCr 4:4:4
Supports YCbCr 4:2:2
1 native detailed modes
Detailed mode: Clock 74.250 MHz, 16 mm x 9 mm
               1280 1390 1430 1650 hborder 0
                720  725  730  750 vborder 0
               +hsync +vsync 
               VertFreq: 60 Hz, HorFreq: 45000 Hz
Checksum: 0xfc (valid)

EDID block does NOT conform to EDID 1.3!
	Digital display field contains garbage: 20
One or more of the timings is out of range of the Monitor Ranges:
  Vertical Freq: 50 - 75 Hz
  Horizontal Freq: 31469 - 60000 Hz
  Maximum Clock: 85.500 MHz
EDID block does not conform at all!
	Both the serial number and the serial string are set
