edid-decode (hex):

00 ff ff ff ff ff ff 00 06 b3 38 34 00 00 00 00
06 23 01 04 b5 50 22 78 3f b9 25 af 4d 40 a7 26
10 50 54 bf ef 80 81 c0 81 8f 81 80 95 00 d1 c0
b3 00 81 00 81 40 f5 7c 70 a0 d0 a0 29 50 30 20
35 00 1d 4e 31 00 00 1e 00 00 00 fd 00 30 a5 fa
fa 5a 01 0a 20 20 20 20 20 20 00 00 00 fc 00 56
47 33 34 56 51 4c 33 41 0a 20 20 20 00 00 00 ff
00 54 32 4c 4d 44 57 30 30 31 33 33 32 0a 02 4c

02 03 3f f2 56 01 02 03 04 05 06 07 90 11 12 13
14 15 16 1f 3f 40 4b 4c 59 5a 5c 23 09 07 07 83
01 00 00 6d 1a 00 00 02 17 30 a5 00 04 62 2d 62
2d e3 05 e3 01 e6 06 07 01 62 62 2f e2 00 6a 53
9d 70 a0 d0 a0 34 50 30 20 3a 00 1d 4e 31 00 00
1a 4e d4 70 a0 d0 a0 46 50 30 20 3a 00 1d 4e 31
00 00 1a 00 00 00 00 00 00 00 00 00 00 00 00 00
00 00 00 00 00 00 00 00 00 00 00 00 00 00 00 0f

70 12 79 03 00 03 01 3c 52 01 01 06 6f 0d 9f 00
2f 00 1f 00 9f 05 54 00 02 80 09 00 66 38 01 06
6f 0d 9f 00 2f 00 1f 00 9f 05 66 00 02 80 09 00
bc 69 01 06 6f 0d 9f 00 2d 00 1f 00 9f 05 76 00
02 80 09 00 07 00 0a 08 81 00 08 04 00 04 02 10
00 00 00 00 00 00 00 00 00 00 00 00 00 00 00 00
00 00 00 00 00 00 00 00 00 00 00 00 00 00 00 00
00 00 00 00 00 00 00 00 00 00 00 00 00 00 55 90

00 ff ff ff ff ff ff 00 06 b3 38 34 00 00 00 00
06 23 01 04 b5 50 22 78 3f b9 25 af 4d 40 a7 26
10 50 54 bf ef 80 81 c0 81 8f 81 80 95 00 d1 c0
b3 00 81 00 81 40 f5 7c 70 a0 d0 a0 29 50 30 20
35 00 1d 4e 31 00 00 1e 00 00 00 fd 00 30 a5 fa
fa 5a 01 0a 20 20 20 20 20 20 00 00 00 fc 00 56
47 33 34 56 51 4c 33 41 0a 20 20 20 00 00 00 ff
00 54 32 4c 4d 44 57 30 30 31 33 33 32 0a 02 4c

02 03 3f f2 56 01 02 03 04 05 06 07 90 11 12 13
14 15 16 1f 3f 40 4b 4c 59 5a 5c 23 09 07 07 83
01 00 00 6d 1a 00 00 02 17 30 a5 00 04 62 2d 62
2d e3 05 e3 01 e6 06 07 01 62 62 2f e2 00 6a 53
9d 70 a0 d0 a0 34 50 30 20 3a 00 1d 4e 31 00 00
1a 4e d4 70 a0 d0 a0 46 50 30 20 3a 00 1d 4e 31
00 00 1a 00 00 00 00 00 00 00 00 00 00 00 00 00
00 00 00 00 00 00 00 00 00 00 00 00 00 00 00 0f

70 12 79 03 00 03 01 3c 52 01 01 06 6f 0d 9f 00
2f 00 1f 00 9f 05 54 00 02 80 09 00 66 38 01 06
6f 0d 9f 00 2f 00 1f 00 9f 05 66 00 02 80 09 00
bc 69 01 06 6f 0d 9f 00 2d 00 1f 00 9f 05 76 00
02 80 09 00 07 00 0a 08 81 00 08 04 00 04 02 10
00 00 00 00 00 00 00 00 00 00 00 00 00 00 00 00
00 00 00 00 00 00 00 00 00 00 00 00 00 00 00 00
00 00 00 00 00 00 00 00 00 00 00 00 00 00 55 90

----------------

Block 0, Base EDID:
  EDID Structure Version & Revision: 1.4
  Vendor & Product Identification:
    Manufacturer: AUS
    Model: 13368
    Made in: week 6 of 2025
  Basic Display Parameters & Features:
    Digital display
    Bits per primary color channel: 10
    DisplayPort interface
    Maximum image size: 80 cm x 34 cm
    Gamma: 2.20
    DPMS levels: Off
    Supported color formats: RGB 4:4:4, YCrCb 4:4:4, YCrCb 4:2:2
    Default (sRGB) color space is primary color space
    First detailed timing includes the native pixel format and preferred refresh rate
    Display is continuous frequency
  Color Characteristics:
    Red  : 0.6855, 0.3037
    Green: 0.2519, 0.6533
    Blue : 0.1484, 0.0644
    White: 0.3134, 0.3291
  Established Timings I & II:
    IBM     :   720x400    70.081663 Hz   9:5     31.467 kHz     28.320000 MHz
    DMT 0x04:   640x480    59.940476 Hz   4:3     31.469 kHz     25.175000 MHz
    Apple   :   640x480    66.666667 Hz   4:3     35.000 kHz     30.240000 MHz
    DMT 0x05:   640x480    72.808802 Hz   4:3     37.861 kHz     31.500000 MHz
    DMT 0x06:   640x480    75.000000 Hz   4:3     37.500 kHz     31.500000 MHz
    DMT 0x08:   800x600    56.250000 Hz   4:3     35.156 kHz     36.000000 MHz
    DMT 0x09:   800x600    60.316541 Hz   4:3     37.879 kHz     40.000000 MHz
    DMT 0x0a:   800x600    72.187572 Hz   4:3     48.077 kHz     50.000000 MHz
    DMT 0x0b:   800x600    75.000000 Hz   4:3     46.875 kHz     49.500000 MHz
    Apple   :   832x624    74.551266 Hz   4:3     49.726 kHz     57.284000 MHz
    DMT 0x10:  1024x768    60.003840 Hz   4:3     48.363 kHz     65.000000 MHz
    DMT 0x11:  1024x768    70.069359 Hz   4:3     56.476 kHz     75.000000 MHz
    DMT 0x12:  1024x768    75.028582 Hz   4:3     60.023 kHz     78.750000 MHz
    DMT 0x24:  1280x1024   75.024675 Hz   5:4     79.976 kHz    135.000000 MHz
    Apple   :  1152x870    75.061550 Hz 192:145   68.681 kHz    100.000000 MHz
  Standard Timings:
    DMT 0x55:  1280x720    60.000000 Hz  16:9     45.000 kHz     74.250000 MHz
    DMT 0x24:  1280x1024   75.024675 Hz   5:4     79.976 kHz    135.000000 MHz
    DMT 0x23:  1280x1024   60.019740 Hz   5:4     63.981 kHz    108.000000 MHz
    DMT 0x2f:  1440x900    59.887445 Hz  16:10    55.935 kHz    106.500000 MHz
    DMT 0x52:  1920x1080   60.000000 Hz  16:9     67.500 kHz    148.500000 MHz
    DMT 0x3a:  1680x1050   59.954250 Hz  16:10    65.290 kHz    146.250000 MHz
    DMT 0x1c:  1280x800    59.810326 Hz  16:10    49.702 kHz     83.500000 MHz
    DMT 0x20:  1280x960    60.000000 Hz   4:3     60.000 kHz    108.000000 MHz
  Detailed Timing Descriptors:
    DTD 1:  3440x1440   59.998875 Hz  43:18    88.858 kHz    319.890000 MHz (797 mm x 334 mm)
                 Hfront   48 Hsync  32 Hback   80 Hpol P
                 Vfront    3 Vsync   5 Vback   33 Vpol P
    Display Range Limits:
      Monitor ranges (Bare Limits): 48-165 Hz V, 250-250 kHz H, max dotclock 900 MHz
    Display Product Name: 'VG34VQL3A'
    Display Product Serial Number: ...
  Extension blocks: 2
Checksum: 0x4c

----------------

Block 1, CTA-861 Extension Block:
  Revision: 3
  Underscans IT Video Formats by default
  Basic audio support
  Supports YCbCr 4:4:4
  Supports YCbCr 4:2:2
  Native detailed modes: 2
  Video Data Block:
    VIC   1:   640x480    59.940476 Hz   4:3     31.469 kHz     25.175000 MHz
    VIC   2:   720x480    59.940060 Hz   4:3     31.469 kHz     27.000000 MHz
    VIC   3:   720x480    59.940060 Hz  16:9     31.469 kHz     27.000000 MHz
    VIC   4:  1280x720    60.000000 Hz  16:9     45.000 kHz     74.250000 MHz
    VIC   5:  1920x1080i  60.000000 Hz  16:9     33.750 kHz     74.250000 MHz
    VIC   6:  1440x480i   59.940060 Hz   4:3     15.734 kHz     27.000000 MHz
    VIC   7:  1440x480i   59.940060 Hz  16:9     15.734 kHz     27.000000 MHz
    VIC  16:  1920x1080   60.000000 Hz  16:9     67.500 kHz    148.500000 MHz (native)
    VIC  17:   720x576    50.000000 Hz   4:3     31.250 kHz     27.000000 MHz
    VIC  18:   720x576    50.000000 Hz  16:9     31.250 kHz     27.000000 MHz
    VIC  19:  1280x720    50.000000 Hz  16:9     37.500 kHz     74.250000 MHz
    VIC  20:  1920x1080i  50.000000 Hz  16:9     28.125 kHz     74.250000 MHz
    VIC  21:  1440x576i   50.000000 Hz   4:3     15.625 kHz     27.000000 MHz
    VIC  22:  1440x576i   50.000000 Hz  16:9     15.625 kHz     27.000000 MHz
    VIC  31:  1920x1080   50.000000 Hz  16:9     56.250 kHz    148.500000 MHz
    VIC  63:  1920x1080  120.000000 Hz  16:9    135.000 kHz    297.000000 MHz
    VIC  64:  1920x1080  100.000000 Hz  16:9    112.500 kHz    297.000000 MHz
    VIC  75:  1920x1080   50.000000 Hz  64:27    56.250 kHz    148.500000 MHz
    VIC  76:  1920x1080   60.000000 Hz  64:27    67.500 kHz    148.500000 MHz
    VIC  89:  2560x1080   50.000000 Hz  64:27    56.250 kHz    185.625000 MHz
    VIC  90:  2560x1080   60.000000 Hz  64:27    66.000 kHz    198.000000 MHz
    VIC  92:  2560x1080  120.000000 Hz  64:27   150.000 kHz    495.000000 MHz
  Audio Data Block:
    Linear PCM:
      Max channels: 2
      Supported sample rates (kHz): 48 44.1 32
      Supported sample sizes (bits): 24 20 16
  Speaker Allocation Data Block:
    FL/FR - Front Left/Right
  Vendor-Specific Data Block (AMD), OUI 00-00-1A:
    Version: 2.23
    Minimum Refresh Rate: 48 Hz
    Maximum Refresh Rate: 165 Hz
    Flags 1.x: 0x00
    Flags 2.x: 0x04
    Maximum luminance: 98 (417.710 cd/m^2)
    Minimum luminance: 45 (0.130 cd/m^2)
    Maximum luminance (without local dimming): 98 (417.710 cd/m^2)
    Minimum luminance (without local dimming): 45 (0.130 cd/m^2)
  Colorimetry Data Block:
    xvYCC601
    xvYCC709
    BT2020cYCC
    BT2020YCC
    BT2020RGB
    Gamut Boundary Description Metadata Profile P0
  HDR Static Metadata Data Block:
    Electro optical transfer functions:
      Traditional gamma - SDR luminance range
      Traditional gamma - HDR luminance range
      SMPTE ST2084
    Supported static metadata descriptors:
      Static metadata type 1
    Desired content max luminance: 98 (417.710 cd/m^2)
    Desired content max frame-average luminance: 98 (417.710 cd/m^2)
    Desired content min luminance: 47 (0.142 cd/m^2)
  Video Capability Data Block:
    YCbCr quantization: No Data
    RGB quantization: Selectable (via AVI Q)
    PT scan behavior: Always Underscanned
    IT scan behavior: Always Underscanned
    CE scan behavior: Always Underscanned
  Detailed Timing Descriptors:
    DTD 2:  3440x1440   74.983244 Hz  43:18   111.875 kHz    402.750000 MHz (797 mm x 334 mm)
                 Hfront   48 Hsync  32 Hback   80 Hpol P
                 Vfront    3 Vsync  10 Vback   39 Vpol N
    DTD 3:  3440x1440   99.981604 Hz  43:18   150.972 kHz    543.500000 MHz (797 mm x 334 mm)
                 Hfront   48 Hsync  32 Hback   80 Hpol P
                 Vfront    3 Vsync  10 Vback   57 Vpol N
Checksum: 0x0f  Unused space in Extension Block: 28 bytes

----------------

Block 2, DisplayID Extension Block:
  Version: 1.2
  Extension Count: 0
  Display Product Type: Standalone display device
  Video Timing Modes Type 1 - Detailed Timings Data Block:
    DTD:  3440x1440  119.990893 Hz  64:27   182.986 kHz    658.750000 MHz (aspect 64:27, no 3D stereo)
               Hfront   48 Hsync  32 Hback   80 Hpol N
               Vfront    3 Vsync  10 Vback   72 Vpol P
    DTD:  3440x1440  143.974581 Hz  64:27   222.153 kHz    799.750000 MHz (aspect 64:27, no 3D stereo)
               Hfront   48 Hsync  32 Hback   80 Hpol N
               Vfront    3 Vsync  10 Vback   90 Vpol P
    DTD:  3440x1440  165.000713 Hz  64:27   257.236 kHz    926.050000 MHz (aspect 64:27, no 3D stereo)
               Hfront   46 Hsync  32 Hback   82 Hpol N
               Vfront    3 Vsync  10 Vback  106 Vpol P
  Supported Timing Modes Type 1 - VESA DMT Timings Data Block:
    DMT 0x04:   640x480    59.940476 Hz   4:3     31.469 kHz     25.175000 MHz
    DMT 0x09:   800x600    60.316541 Hz   4:3     37.879 kHz     40.000000 MHz
    DMT 0x10:  1024x768    60.003840 Hz   4:3     48.363 kHz     65.000000 MHz
    DMT 0x1c:  1280x800    59.810326 Hz  16:10    49.702 kHz     83.500000 MHz
    DMT 0x23:  1280x1024   60.019740 Hz   5:4     63.981 kHz    108.000000 MHz
    DMT 0x33:  1600x1200   60.000000 Hz   4:3     75.000 kHz    162.000000 MHz
    DMT 0x3a:  1680x1050   59.954250 Hz  16:10    65.290 kHz    146.250000 MHz
    DMT 0x45:  1920x1200   59.884600 Hz  16:10    74.556 kHz    193.250000 MHz
  Checksum: 0x55
Checksum: 0x90

----------------

Block 3, Unknown EDID Extension Block 0x00:
  00 ff ff ff ff ff ff 00 06 b3 38 34 00 00 00 00 '..........84....'
  06 23 01 04 b5 50 22 78 3f b9 25 af 4d 40 a7 26 '.#...P"x?.%.M@.&'
  10 50 54 bf ef 80 81 c0 81 8f 81 80 95 00 d1 c0 '.PT.............'
  b3 00 81 00 81 40 f5 7c 70 a0 d0 a0 29 50 30 20 '.....@.|p...)P0 '
  35 00 1d 4e 31 00 00 1e 00 00 00 fd 00 30 a5 fa '5..N1........0..'
  fa 5a 01 0a 20 20 20 20 20 20 00 00 00 fc 00 56 '.Z..      .....V'
  47 33 34 56 51 4c 33 41 0a 20 20 20 00 00 00 ff 'G34VQL3A.   ....'
  00 54 32 4c 4d 44 57 30 30 31 33 33 32 0a 02 4c '.T2LMDW001332..L'
Checksum: 0x4c

----------------

Block 4, CTA-861 Extension Block:
  Revision: 3
  Underscans IT Video Formats by default
  Basic audio support
  Supports YCbCr 4:4:4
  Supports YCbCr 4:2:2
  Native detailed modes: 2
  Video Data Block:
    VIC   1:   640x480    59.940476 Hz   4:3     31.469 kHz     25.175000 MHz
    VIC   2:   720x480    59.940060 Hz   4:3     31.469 kHz     27.000000 MHz
    VIC   3:   720x480    59.940060 Hz  16:9     31.469 kHz     27.000000 MHz
    VIC   4:  1280x720    60.000000 Hz  16:9     45.000 kHz     74.250000 MHz
    VIC   5:  1920x1080i  60.000000 Hz  16:9     33.750 kHz     74.250000 MHz
    VIC   6:  1440x480i   59.940060 Hz   4:3     15.734 kHz     27.000000 MHz
    VIC   7:  1440x480i   59.940060 Hz  16:9     15.734 kHz     27.000000 MHz
    VIC  16:  1920x1080   60.000000 Hz  16:9     67.500 kHz    148.500000 MHz (native)
    VIC  17:   720x576    50.000000 Hz   4:3     31.250 kHz     27.000000 MHz
    VIC  18:   720x576    50.000000 Hz  16:9     31.250 kHz     27.000000 MHz
    VIC  19:  1280x720    50.000000 Hz  16:9     37.500 kHz     74.250000 MHz
    VIC  20:  1920x1080i  50.000000 Hz  16:9     28.125 kHz     74.250000 MHz
    VIC  21:  1440x576i   50.000000 Hz   4:3     15.625 kHz     27.000000 MHz
    VIC  22:  1440x576i   50.000000 Hz  16:9     15.625 kHz     27.000000 MHz
    VIC  31:  1920x1080   50.000000 Hz  16:9     56.250 kHz    148.500000 MHz
    VIC  63:  1920x1080  120.000000 Hz  16:9    135.000 kHz    297.000000 MHz
    VIC  64:  1920x1080  100.000000 Hz  16:9    112.500 kHz    297.000000 MHz
    VIC  75:  1920x1080   50.000000 Hz  64:27    56.250 kHz    148.500000 MHz
    VIC  76:  1920x1080   60.000000 Hz  64:27    67.500 kHz    148.500000 MHz
    VIC  89:  2560x1080   50.000000 Hz  64:27    56.250 kHz    185.625000 MHz
    VIC  90:  2560x1080   60.000000 Hz  64:27    66.000 kHz    198.000000 MHz
    VIC  92:  2560x1080  120.000000 Hz  64:27   150.000 kHz    495.000000 MHz
  Audio Data Block:
    Linear PCM:
      Max channels: 2
      Supported sample rates (kHz): 48 44.1 32
      Supported sample sizes (bits): 24 20 16
  Speaker Allocation Data Block:
    FL/FR - Front Left/Right
  Vendor-Specific Data Block (AMD), OUI 00-00-1A:
    Version: 2.23
    Minimum Refresh Rate: 48 Hz
    Maximum Refresh Rate: 165 Hz
    Flags 1.x: 0x00
    Flags 2.x: 0x04
    Maximum luminance: 98 (417.710 cd/m^2)
    Minimum luminance: 45 (0.130 cd/m^2)
    Maximum luminance (without local dimming): 98 (417.710 cd/m^2)
    Minimum luminance (without local dimming): 45 (0.130 cd/m^2)
  Colorimetry Data Block:
    xvYCC601
    xvYCC709
    BT2020cYCC
    BT2020YCC
    BT2020RGB
    Gamut Boundary Description Metadata Profile P0
  HDR Static Metadata Data Block:
    Electro optical transfer functions:
      Traditional gamma - SDR luminance range
      Traditional gamma - HDR luminance range
      SMPTE ST2084
    Supported static metadata descriptors:
      Static metadata type 1
    Desired content max luminance: 98 (417.710 cd/m^2)
    Desired content max frame-average luminance: 98 (417.710 cd/m^2)
    Desired content min luminance: 47 (0.142 cd/m^2)
  Video Capability Data Block:
    YCbCr quantization: No Data
    RGB quantization: Selectable (via AVI Q)
    PT scan behavior: Always Underscanned
    IT scan behavior: Always Underscanned
    CE scan behavior: Always Underscanned
  Detailed Timing Descriptors:
    DTD 4:  3440x1440   74.983244 Hz  43:18   111.875 kHz    402.750000 MHz (797 mm x 334 mm)
                 Hfront   48 Hsync  32 Hback   80 Hpol P
                 Vfront    3 Vsync  10 Vback   39 Vpol N
    DTD 5:  3440x1440   99.981604 Hz  43:18   150.972 kHz    543.500000 MHz (797 mm x 334 mm)
                 Hfront   48 Hsync  32 Hback   80 Hpol P
                 Vfront    3 Vsync  10 Vback   57 Vpol N
Checksum: 0x0f  Unused space in Extension Block: 28 bytes

----------------

Block 5, DisplayID Extension Block:
  Version: 1.2
  Extension Count: 0
  Video Timing Modes Type 1 - Detailed Timings Data Block:
    DTD:  3440x1440  119.990893 Hz  64:27   182.986 kHz    658.750000 MHz (aspect 64:27, no 3D stereo)
               Hfront   48 Hsync  32 Hback   80 Hpol N
               Vfront    3 Vsync  10 Vback   72 Vpol P
    DTD:  3440x1440  143.974581 Hz  64:27   222.153 kHz    799.750000 MHz (aspect 64:27, no 3D stereo)
               Hfront   48 Hsync  32 Hback   80 Hpol N
               Vfront    3 Vsync  10 Vback   90 Vpol P
    DTD:  3440x1440  165.000713 Hz  64:27   257.236 kHz    926.050000 MHz (aspect 64:27, no 3D stereo)
               Hfront   46 Hsync  32 Hback   82 Hpol N
               Vfront    3 Vsync  10 Vback  106 Vpol P
  Supported Timing Modes Type 1 - VESA DMT Timings Data Block:
    DMT 0x04:   640x480    59.940476 Hz   4:3     31.469 kHz     25.175000 MHz
    DMT 0x09:   800x600    60.316541 Hz   4:3     37.879 kHz     40.000000 MHz
    DMT 0x10:  1024x768    60.003840 Hz   4:3     48.363 kHz     65.000000 MHz
    DMT 0x1c:  1280x800    59.810326 Hz  16:10    49.702 kHz     83.500000 MHz
    DMT 0x23:  1280x1024   60.019740 Hz   5:4     63.981 kHz    108.000000 MHz
    DMT 0x33:  1600x1200   60.000000 Hz   4:3     75.000 kHz    162.000000 MHz
    DMT 0x3a:  1680x1050   59.954250 Hz  16:10    65.290 kHz    146.250000 MHz
    DMT 0x45:  1920x1200   59.884600 Hz  16:10    74.556 kHz    193.250000 MHz
  Checksum: 0x55
Checksum: 0x90

----------------

Warnings:

Block 1, CTA-861 Extension Block:
  Video Capability Data Block: Set Selectable YCbCr Quantization to avoid interop issues.
  Video Capability Data Block: S_PT is equal to S_IT and S_CE, so should be set to 0 instead.
Block 4, CTA-861 Extension Block:
  Video Capability Data Block: Set Selectable YCbCr Quantization to avoid interop issues.
  Video Capability Data Block: S_PT is equal to S_IT and S_CE, so should be set to 0 instead.
EDID:
  Base EDID: Some timings are out of range of the Monitor Ranges:
    Horizontal Freq: 15.625 - 257.236 kHz (Monitor: 250.000 - 250.000 kHz)
    Maximum Clock: 926.050 MHz (Monitor: 900.000 MHz)

Failures:

Block 0, Base EDID:
  Basic Display Parameters & Features: sRGB is signaled, but the chromaticities do not match.
Block 2, DisplayID Extension Block:
  Expected 0 DisplayID Extension Block, but got 1.
Block 3, Base EDID:
  Unknown Extension Block.
Block 4, CTA-861 Extension Block:
  Video Data Block: Duplicate VIC 1.
  Video Data Block: Duplicate VIC 2.
  Video Data Block: Duplicate VIC 3.
  Video Data Block: Duplicate VIC 4.
  Video Data Block: Duplicate VIC 5.
  Video Data Block: Duplicate VIC 6.
  Video Data Block: Duplicate VIC 7.
  Video Data Block: Duplicate VIC 16.
  Video Data Block: Duplicate VIC 17.
  Video Data Block: Duplicate VIC 18.
  Video Data Block: Duplicate VIC 19.
  Video Data Block: Duplicate VIC 20.
  Video Data Block: Duplicate VIC 21.
  Video Data Block: Duplicate VIC 22.
  Video Data Block: Duplicate VIC 31.
  Video Data Block: Duplicate VIC 63.
  Video Data Block: Duplicate VIC 64.
  Video Data Block: Duplicate VIC 75.
  Video Data Block: Duplicate VIC 76.
  Video Data Block: Duplicate VIC 89.
  Video Data Block: Duplicate VIC 90.
  Video Data Block: Duplicate VIC 92.
  Speaker Allocation Data Block: Only one instance of this Data Block is allowed.
  Colorimetry Data Block: Only one instance of this Data Block is allowed.
  HDR Static Metadata Data Block: Only one instance of this Data Block is allowed.
  Video Capability Data Block: Only one instance of this Data Block is allowed.
Block 5, DisplayID Extension Block:
  Product Type should be 0 in extension block.
EDID:
  Base EDID: EDID specified 2 extension block(s), but found 5 extension block(s).
  CTA-861: Native progressive timings are a mix of several resolutions.
  DisplayID: Missing DisplayID Product Identification Data Block.
  DisplayID: Missing DisplayID Display Parameters Data Block.
  DisplayID: Missing DisplayID Display Interface Features Data Block.
  DisplayID: DisplayID expects at least one preferred timing.

EDID conformity: FAIL
