
EDID (hex):
00ffffffffffff001ab3070645150000
250f010368261e6b2a9ae5a658499923
115054a54f00818f8180614f6140454f
454001010101302a009851002a403070
1300782d1100001e000000ff0059454e
433030353434350a2020000000fd0037
4c1e530e000a202020202020000000fc
004331392d31320a2020202020200005

Extracted contents:
header:          00 ff ff ff ff ff ff 00
serial number:   1a b3 07 06 45 15 00 00 25 0f
version:         01 03
basic params:    68 26 1e 6b 2a
chroma info:     9a e5 a6 58 49 99 23 11 50 54
established:     a5 4f 00
standard:        81 8f 81 80 61 4f 61 40 45 4f 45 40 01 01 01 01
descriptor 1:    30 2a 00 98 51 00 2a 40 30 70 13 00 78 2d 11 00 00 1e
descriptor 2:    00 00 00 ff 00 59 45 4e 43 30 30 35 34 34 35 0a 20 20
descriptor 3:    00 00 00 fd 00 37 4c 1e 53 0e 00 0a 20 20 20 20 20 20
descriptor 4:    00 00 00 fc 00 43 31 39 2d 31 32 0a 20 20 20 20 20 20
extensions:      00
checksum:        05

EDID version: 1.3
Manufacturer: FUS Model 607 Serial Number --
Analog display, Input voltage level: 0.7/0.7 V
Sync: Separate 
Maximum image size: 38 cm x 30 cm
Gamma: 2.07
DPMS levels: Off
RGB color display
First detailed timing is preferred timing
Display x,y Chromaticity:
  Red:   0.6503, 0.3447
  Green: 0.2871, 0.5996
  Blue:  0.1396, 0.0683
  White: 0.3134, 0.3291
Established timings supported:
  720x400@70Hz 9:5 HorFreq: 31469 Hz Clock: 28.320 MHz
  640x480@60Hz 4:3 HorFreq: 31469 Hz Clock: 25.175 MHz
  640x480@75Hz 4:3 HorFreq: 37500 Hz Clock: 31.500 MHz
  800x600@60Hz 4:3 HorFreq: 37900 Hz Clock: 40.000 MHz
  800x600@75Hz 4:3 HorFreq: 46900 Hz Clock: 49.500 MHz
  1024x768@60Hz 4:3 HorFreq: 48400 Hz Clock: 65.000 MHz
  1024x768@70Hz 4:3 HorFreq: 56500 Hz Clock: 75.000 MHz
  1024x768@75Hz 4:3 HorFreq: 60000 Hz Clock: 78.750 MHz
  1280x1024@75Hz 5:4 HorFreq: 80000 Hz Clock: 135.000 MHz
Standard timings supported:
  1280x1024@75Hz 5:4 HorFreq: 80000 Hz Clock: 135.000 MHz
  1280x1024@60Hz 5:4 HorFreq: 64000 Hz Clock: 108.000 MHz
  1024x768@75Hz 4:3 HorFreq: 60000 Hz Clock: 78.750 MHz
  1024x768@60Hz 4:3 HorFreq: 48400 Hz Clock: 65.000 MHz
  800x600@75Hz 4:3 HorFreq: 46900 Hz Clock: 49.500 MHz
  800x600@60Hz 4:3 HorFreq: 37900 Hz Clock: 40.000 MHz
Detailed mode: Clock 108.000 MHz, 376 mm x 301 mm
               1280 1328 1440 1688 hborder 0
               1024 1025 1028 1066 vborder 0
               +hsync +vsync 
               VertFreq: 60 Hz, HorFreq: 63981 Hz
Serial number: --
Monitor ranges (GTF): 55-76Hz V, 30-83kHz H, max dotclock 140MHz
Monitor name: C19-12
Checksum: 0x5 (valid)
EDID block does not conform at all!
	Bad year of manufacture
