edid-decode (hex):

00 ff ff ff ff ff ff 00 09 e5 a6 0a 00 00 00 00
20 1f 01 04 a5 1d 10 78 02 f8 90 9e 59 55 9c 26
1a 50 54 00 00 00 01 01 01 01 01 01 01 01 01 01
01 01 01 01 01 01 3e 1c 56 a0 50 00 16 30 30 20
36 00 25 a5 10 00 00 1a 9e 16 56 a0 50 00 16 30
30 20 36 00 25 a5 10 00 00 1a 00 00 00 00 00 00
00 00 00 00 00 00 00 00 00 00 00 00 00 00 00 02
00 11 43 ff 0f 3c e6 41 46 3a e6 00 00 00 00 2d

00 ff ff ff ff ff ff 00 09 e5 a6 0a 00 00 00 00
20 1f 01 04 a5 1d 10 78 02 f8 90 9e 59 55 9c 26
1a 50 54 00 00 00 01 01 01 01 01 01 01 01 01 01
01 01 01 01 01 01 3e 1c 56 a0 50 00 16 30 30 20
36 00 25 a5 10 00 00 1a 9e 16 56 a0 50 00 16 30
30 20 36 00 25 a5 10 00 00 1a 00 00 00 00 00 00
00 00 00 00 00 00 00 00 00 00 00 00 00 00 00 02
00 11 43 ff 0f 3c e6 41 46 3a e6 00 00 00 00 2d

----------------

Block 0, Base EDID:
  EDID Structure Version & Revision: 1.4
  Vendor & Product Identification:
    Manufacturer: BOE
    Model: 2726
    Made in: week 32 of 2021
  Basic Display Parameters & Features:
    Digital display
    Bits per primary color channel: 8
    DisplayPort interface
    Maximum image size: 29 cm x 16 cm
    Gamma: 2.20
    Supported color formats: RGB 4:4:4
    First detailed timing includes the native pixel format and preferred refresh rate
  Color Characteristics:
    Red  : 0.6201, 0.3505
    Green: 0.3339, 0.6093
    Blue : 0.1503, 0.1025
    White: 0.3125, 0.3281
  Established Timings I & II: none
  Standard Timings: none
  Detailed Timing Descriptors:
    DTD 1:  1366x768    59.973124 Hz 683:384   47.379 kHz     72.300000 MHz (293 mm x 165 mm)
                 Hfront   48 Hsync  32 Hback   80 Hpol P
                 Vfront    3 Vsync   6 Vback   13 Vpol N
    DTD 2:  1366x768    48.028269 Hz 683:384   37.942 kHz     57.900000 MHz (293 mm x 165 mm)
                 Hfront   48 Hsync  32 Hback   80 Hpol P
                 Vfront    3 Vsync   6 Vback   13 Vpol N
    Empty Descriptor
    Manufacturer-Specified Display Descriptor (0x02): 00 02 00 11 43 ff 0f 3c e6 41 46 3a e6 00 00 00 '....C..<.AF:....'
Checksum: 0x2d

----------------

Block 1, Unknown EDID Extension Block 0x00:
  00 ff ff ff ff ff ff 00 09 e5 a6 0a 00 00 00 00 '................'
  20 1f 01 04 a5 1d 10 78 02 f8 90 9e 59 55 9c 26 ' ......x....YU.&'
  1a 50 54 00 00 00 01 01 01 01 01 01 01 01 01 01 '.PT.............'
  01 01 01 01 01 01 3e 1c 56 a0 50 00 16 30 30 20 '......>.V.P..00 '
  36 00 25 a5 10 00 00 1a 9e 16 56 a0 50 00 16 30 '6.%.......V.P..0'
  30 20 36 00 25 a5 10 00 00 1a 00 00 00 00 00 00 '0 6.%...........'
  00 00 00 00 00 00 00 00 00 00 00 00 00 00 00 02 '................'
  00 11 43 ff 0f 3c e6 41 46 3a e6 00 00 00 00 2d '..C..<.AF:.....-'
Checksum: 0x2d

----------------

Warnings:

Block 0, Base EDID:
  Missing Display Product Name.

Failures:

Block 0, Base EDID:
  Empty Descriptor: Use Dummy Descriptor instead of all zeroes.
Block 1, Base EDID:
  Unknown Extension Block.
EDID:
  Base EDID: EDID specified 0 extension block(s), but found 1 extension block(s).

EDID conformity: FAIL
