
EDID (hex):
00ffffffffffff001ab30208f8770500
2d1b010380351e782a2195a756529c26
105054a54b00d1c0b30095008180a9c0
81c001010101023a801871382d40582c
45000f282100001e000000fd00304c1e
5211000a202020202020000000fc0042
32342d382054452050726f0a000000ff
00595639533335383339320a2020003b

edid-decode (hex):

00 ff ff ff ff ff ff 00 1a b3 02 08 f8 77 05 00
2d 1b 01 03 80 35 1e 78 2a 21 95 a7 56 52 9c 26
10 50 54 a5 4b 00 d1 c0 b3 00 95 00 81 80 a9 c0
81 c0 01 01 01 01 02 3a 80 18 71 38 2d 40 58 2c
45 00 0f 28 21 00 00 1e 00 00 00 fd 00 30 4c 1e
52 11 00 0a 20 20 20 20 20 20 00 00 00 fc 00 42
32 34 2d 38 20 54 45 20 50 72 6f 0a 00 00 00 ff
00 59 56 39 53 33 35 38 33 39 32 0a 20 20 00 3b

----------------

Block 0, Base EDID:
  EDID Structure Version & Revision: 1.3
  Vendor & Product Identification:
    Manufacturer: FUS
    Model: 2050
    Serial Number: 358392
    Made in: week 45 of 2017
  Basic Display Parameters & Features:
    Digital display
    Maximum image size: 53 cm x 30 cm
    Gamma: 2.20
    DPMS levels: Off
    RGB color display
    First detailed timing is the preferred timing
  Color Characteristics:
    Red  : 0.6523, 0.3378
    Green: 0.3203, 0.6103
    Blue : 0.1503, 0.0634
    White: 0.3134, 0.3291
  Established Timings I & II:
    IBM     :   720x400    70.081663 Hz   9:5     31.467 kHz     28.320000 MHz
    DMT 0x04:   640x480    59.940476 Hz   4:3     31.469 kHz     25.175000 MHz
    DMT 0x06:   640x480    75.000000 Hz   4:3     37.500 kHz     31.500000 MHz
    DMT 0x09:   800x600    60.316541 Hz   4:3     37.879 kHz     40.000000 MHz
    DMT 0x0b:   800x600    75.000000 Hz   4:3     46.875 kHz     49.500000 MHz
    DMT 0x10:  1024x768    60.003840 Hz   4:3     48.363 kHz     65.000000 MHz
    DMT 0x12:  1024x768    75.028582 Hz   4:3     60.023 kHz     78.750000 MHz
    DMT 0x24:  1280x1024   75.024675 Hz   5:4     79.976 kHz    135.000000 MHz
  Standard Timings:
    DMT 0x52:  1920x1080   60.000000 Hz  16:9     67.500 kHz    148.500000 MHz
    DMT 0x3a:  1680x1050   59.954250 Hz  16:10    65.290 kHz    146.250000 MHz
    DMT 0x2f:  1440x900    59.887445 Hz  16:10    55.935 kHz    106.500000 MHz
    DMT 0x23:  1280x1024   60.019740 Hz   5:4     63.981 kHz    108.000000 MHz
    DMT 0x53:  1600x900    60.000000 Hz  16:9     60.000 kHz    108.000000 MHz (RB)
    DMT 0x55:  1280x720    60.000000 Hz  16:9     45.000 kHz     74.250000 MHz
  Detailed Timing Descriptors:
    DTD 1:  1920x1080   60.000000 Hz  16:9     67.500 kHz    148.500000 MHz (527 mm x 296 mm)
                 Hfront   88 Hsync  44 Hback  148 Hpol P
                 Vfront    4 Vsync   5 Vback   36 Vpol P
    Display Range Limits:
      Monitor ranges (GTF): 48-76 Hz V, 30-82 kHz H, max dotclock 170 MHz
    Display Product Name: 'B24-8 TE Pro'
    Display Product Serial Number: 'YV9S358392'
Checksum: 0x3b


