edid-decode (hex):

00 ff ff ff ff ff ff 00 36 03 00 28 00 00 00 00
24 18 01 04 a5 3e 22 78 3a 8e 05 ad 4f 33 b0 26
0d 50 54 a5 4b 00 71 4f 81 c0 81 00 81 80 95 00
b3 00 d1 c0 d1 00 50 d0 00 a0 f0 70 3e 80 30 20
35 00 55 50 21 00 00 1e 00 00 00 ff 00 4d 53 41
31 34 30 39 30 30 30 30 31 0a 22 6f 80 a0 70 70
78 80 30 20 35 00 55 50 21 00 00 1e 00 00 00 fc
00 4d 50 43 50 32 38 55 48 44 0a 20 20 20 01 83

02 03 18 74 4b 90 9f 85 94 04 13 03 12 01 02 11
23 09 07 07 83 01 00 00 02 3a 80 d0 72 38 2d 40
10 2c 96 80 56 50 21 00 00 18 02 3a 80 18 71 38
2d 40 58 2c 96 00 56 50 21 00 00 18 04 74 00 30
f2 70 5a 80 30 20 36 00 56 50 21 00 00 1a 01 1d
00 bc 52 d0 1e 20 b8 28 55 40 56 50 21 00 00 1e
56 5e 00 a0 a0 a0 29 50 30 20 35 00 55 50 21 00
00 1e 00 00 00 00 00 00 00 00 00 00 00 00 00 d2

00 ff ff ff ff ff ff 00 36 03 00 28 00 00 00 00
24 18 01 04 a5 3e 22 78 3a 8e 05 ad 4f 33 b0 26
0d 50 54 a5 4b 00 71 4f 81 c0 81 00 81 80 95 00
b3 00 d1 c0 d1 00 50 d0 00 a0 f0 70 3e 80 30 20
35 00 55 50 21 00 00 1e 00 00 00 ff 00 4d 53 41
31 34 30 39 30 30 30 30 31 0a 22 6f 80 a0 70 70
78 80 30 20 35 00 55 50 21 00 00 1e 00 00 00 fc
00 4d 50 43 50 32 38 55 48 44 0a 20 20 20 01 83

02 03 18 74 4b 90 9f 85 94 04 13 03 12 01 02 11
23 09 07 07 83 01 00 00 02 3a 80 d0 72 38 2d 40
10 2c 96 80 56 50 21 00 00 18 02 3a 80 18 71 38
2d 40 58 2c 96 00 56 50 21 00 00 18 04 74 00 30
f2 70 5a 80 30 20 36 00 56 50 21 00 00 1a 01 1d
00 bc 52 d0 1e 20 b8 28 55 40 56 50 21 00 00 1e
56 5e 00 a0 a0 a0 29 50 30 20 35 00 55 50 21 00
00 1e 00 00 00 00 00 00 00 00 00 00 00 00 00 d2

----------------

Block 0, Base EDID:
  EDID Structure Version & Revision: 1.4
  Vendor & Product Identification:
    Manufacturer: MPC
    Model: 10240
    Made in: week 36 of 2014
  Basic Display Parameters & Features:
    Digital display
    Bits per primary color channel: 8
    DisplayPort interface
    Maximum image size: 62 cm x 34 cm
    Gamma: 2.20
    DPMS levels: Off
    Supported color formats: RGB 4:4:4, YCrCb 4:4:4, YCrCb 4:2:2
    First detailed timing includes the native pixel format and preferred refresh rate
  Color Characteristics:
    Red  : 0.6777, 0.3085
    Green: 0.2021, 0.6894
    Blue : 0.1484, 0.0507
    White: 0.3134, 0.3291
  Established Timings I & II:
    IBM     :   720x400    70.081663 Hz   9:5     31.467 kHz     28.320000 MHz
    DMT 0x04:   640x480    59.940476 Hz   4:3     31.469 kHz     25.175000 MHz
    DMT 0x06:   640x480    75.000000 Hz   4:3     37.500 kHz     31.500000 MHz
    DMT 0x09:   800x600    60.316541 Hz   4:3     37.879 kHz     40.000000 MHz
    DMT 0x0b:   800x600    75.000000 Hz   4:3     46.875 kHz     49.500000 MHz
    DMT 0x10:  1024x768    60.003840 Hz   4:3     48.363 kHz     65.000000 MHz
    DMT 0x12:  1024x768    75.028582 Hz   4:3     60.023 kHz     78.750000 MHz
    DMT 0x24:  1280x1024   75.024675 Hz   5:4     79.976 kHz    135.000000 MHz
  Standard Timings:
    DMT 0x15:  1152x864    75.000000 Hz   4:3     67.500 kHz    108.000000 MHz
    DMT 0x55:  1280x720    60.000000 Hz  16:9     45.000 kHz     74.250000 MHz
    DMT 0x1c:  1280x800    59.810326 Hz  16:10    49.702 kHz     83.500000 MHz
    DMT 0x23:  1280x1024   60.019740 Hz   5:4     63.981 kHz    108.000000 MHz
    DMT 0x2f:  1440x900    59.887445 Hz  16:10    55.935 kHz    106.500000 MHz
    DMT 0x3a:  1680x1050   59.954250 Hz  16:10    65.290 kHz    146.250000 MHz
    DMT 0x52:  1920x1080   60.000000 Hz  16:9     67.500 kHz    148.500000 MHz
    DMT 0x45:  1920x1200   59.884600 Hz  16:10    74.556 kHz    193.250000 MHz
  Detailed Timing Descriptors:
    DTD  1:  3840x2160   60.000000 Hz  16:9    133.320 kHz    533.280000 MHz (597 mm x 336 mm)
                  Hfront   48 Hsync  32 Hback   80 Hpol P
                  Vfront    3 Vsync   5 Vback   54 Vpol P
    Display Product Serial Number: ...
    DTD  2:  1920x2160   59.990722 Hz   8:9    136.779 kHz    284.500000 MHz (597 mm x 336 mm)
                  Hfront   48 Hsync  32 Hback   80 Hpol P
                  Vfront    3 Vsync   5 Vback  112 Vpol P
    Display Product Name: 'MPCP28UHD'
  Extension blocks: 1
Checksum: 0x83

----------------

Block 1, CTA-861 Extension Block:
  Revision: 3
  Basic audio support
  Supports YCbCr 4:4:4
  Supports YCbCr 4:2:2
  Native detailed modes: 4
  Video Data Block:
    VIC  16:  1920x1080   60.000000 Hz  16:9     67.500 kHz    148.500000 MHz (native)
    VIC  31:  1920x1080   50.000000 Hz  16:9     56.250 kHz    148.500000 MHz (native)
    VIC   5:  1920x1080i  60.000000 Hz  16:9     33.750 kHz     74.250000 MHz (native)
    VIC  20:  1920x1080i  50.000000 Hz  16:9     28.125 kHz     74.250000 MHz (native)
    VIC   4:  1280x720    60.000000 Hz  16:9     45.000 kHz     74.250000 MHz
    VIC  19:  1280x720    50.000000 Hz  16:9     37.500 kHz     74.250000 MHz
    VIC   3:   720x480    59.940060 Hz  16:9     31.469 kHz     27.000000 MHz
    VIC  18:   720x576    50.000000 Hz  16:9     31.250 kHz     27.000000 MHz
    VIC   1:   640x480    59.940476 Hz   4:3     31.469 kHz     25.175000 MHz
    VIC   2:   720x480    59.940060 Hz   4:3     31.469 kHz     27.000000 MHz
    VIC  17:   720x576    50.000000 Hz   4:3     31.250 kHz     27.000000 MHz
  Audio Data Block:
    Linear PCM:
      Max channels: 2
      Supported sample rates (kHz): 48 44.1 32
      Supported sample sizes (bits): 24 20 16
  Speaker Allocation Data Block:
    FL/FR - Front Left/Right
  Detailed Timing Descriptors:
    DTD  3:  1920x1080   50.000000 Hz  16:9     56.250 kHz    148.500000 MHz (598 mm x 336 mm)
                  Hfront  528 Hsync  44 Hback  148 Hpol N
                  Vfront    9 Vsync   6 Vback   30 Vpol N
    DTD  4:  1920x1080   60.000000 Hz  16:9     67.500 kHz    148.500000 MHz (598 mm x 336 mm)
                  Hfront   88 Hsync  44 Hback  148 Hpol N
                  Vfront    9 Vsync   6 Vback   30 Vpol N
    DTD  5:  3840x2160   30.000000 Hz  16:9     67.500 kHz    297.000000 MHz (598 mm x 336 mm)
                  Hfront   48 Hsync  32 Hback  480 Hpol P
                  Vfront    3 Vsync   6 Vback   81 Vpol N
    DTD  6:  1280x720    50.000000 Hz  16:9     37.500 kHz     74.250000 MHz (598 mm x 336 mm)
                  Hfront  440 Hsync  40 Hback  220 Hpol P
                  Vfront    5 Vsync   5 Vback   20 Vpol P
    DTD  7:  2560x1440   59.950550 Hz  16:9     88.787 kHz    241.500000 MHz (597 mm x 336 mm)
                  Hfront   48 Hsync  32 Hback   80 Hpol P
                  Vfront    3 Vsync   5 Vback   33 Vpol P
Checksum: 0xd2  Unused space in Extension Block: 13 bytes

----------------

Block 2, Unknown EDID Extension Block 0x00:
  00 ff ff ff ff ff ff 00 36 03 00 28 00 00 00 00 '........6..(....'
  24 18 01 04 a5 3e 22 78 3a 8e 05 ad 4f 33 b0 26 '$....>"x:...O3.&'
  0d 50 54 a5 4b 00 71 4f 81 c0 81 00 81 80 95 00 '.PT.K.qO........'
  b3 00 d1 c0 d1 00 50 d0 00 a0 f0 70 3e 80 30 20 '......P....p>.0 '
  35 00 55 50 21 00 00 1e 00 00 00 ff 00 4d 53 41 '5.UP!........MSA'
  31 34 30 39 30 30 30 30 31 0a 22 6f 80 a0 70 70 '140900001."o..pp'
  78 80 30 20 35 00 55 50 21 00 00 1e 00 00 00 fc 'x.0 5.UP!.......'
  00 4d 50 43 50 32 38 55 48 44 0a 20 20 20 01 83 '.MPCP28UHD.   ..'
Checksum: 0x83

----------------

Block 3, CTA-861 Extension Block:
  Revision: 3
  Basic audio support
  Supports YCbCr 4:4:4
  Supports YCbCr 4:2:2
  Native detailed modes: 4
  Video Data Block:
    VIC  16:  1920x1080   60.000000 Hz  16:9     67.500 kHz    148.500000 MHz (native)
    VIC  31:  1920x1080   50.000000 Hz  16:9     56.250 kHz    148.500000 MHz (native)
    VIC   5:  1920x1080i  60.000000 Hz  16:9     33.750 kHz     74.250000 MHz (native)
    VIC  20:  1920x1080i  50.000000 Hz  16:9     28.125 kHz     74.250000 MHz (native)
    VIC   4:  1280x720    60.000000 Hz  16:9     45.000 kHz     74.250000 MHz
    VIC  19:  1280x720    50.000000 Hz  16:9     37.500 kHz     74.250000 MHz
    VIC   3:   720x480    59.940060 Hz  16:9     31.469 kHz     27.000000 MHz
    VIC  18:   720x576    50.000000 Hz  16:9     31.250 kHz     27.000000 MHz
    VIC   1:   640x480    59.940476 Hz   4:3     31.469 kHz     25.175000 MHz
    VIC   2:   720x480    59.940060 Hz   4:3     31.469 kHz     27.000000 MHz
    VIC  17:   720x576    50.000000 Hz   4:3     31.250 kHz     27.000000 MHz
  Audio Data Block:
    Linear PCM:
      Max channels: 2
      Supported sample rates (kHz): 48 44.1 32
      Supported sample sizes (bits): 24 20 16
  Speaker Allocation Data Block:
    FL/FR - Front Left/Right
  Detailed Timing Descriptors:
    DTD  8:  1920x1080   50.000000 Hz  16:9     56.250 kHz    148.500000 MHz (598 mm x 336 mm)
                  Hfront  528 Hsync  44 Hback  148 Hpol N
                  Vfront    9 Vsync   6 Vback   30 Vpol N
    DTD  9:  1920x1080   60.000000 Hz  16:9     67.500 kHz    148.500000 MHz (598 mm x 336 mm)
                  Hfront   88 Hsync  44 Hback  148 Hpol N
                  Vfront    9 Vsync   6 Vback   30 Vpol N
    DTD 10:  3840x2160   30.000000 Hz  16:9     67.500 kHz    297.000000 MHz (598 mm x 336 mm)
                  Hfront   48 Hsync  32 Hback  480 Hpol P
                  Vfront    3 Vsync   6 Vback   81 Vpol N
    DTD 11:  1280x720    50.000000 Hz  16:9     37.500 kHz     74.250000 MHz (598 mm x 336 mm)
                  Hfront  440 Hsync  40 Hback  220 Hpol P
                  Vfront    5 Vsync   5 Vback   20 Vpol P
    DTD 12:  2560x1440   59.950550 Hz  16:9     88.787 kHz    241.500000 MHz (597 mm x 336 mm)
                  Hfront   48 Hsync  32 Hback   80 Hpol P
                  Vfront    3 Vsync   5 Vback   33 Vpol P
Checksum: 0xd2  Unused space in Extension Block: 13 bytes

----------------

Warnings:

Block 1, CTA-861 Extension Block:
  IT Video Formats are overscanned by default, but normally this should be underscanned.
  Detailed Timing Descriptor #3: DTD is similar but not identical to VIC 31.
  Detailed Timing Descriptor #4: DTD is similar but not identical to VIC 16.
  Detailed Timing Descriptor #5: DTD is similar but not identical to VIC 95.
  Add a Colorimetry Data Block with the sRGB colorimetry bit set to avoid interop issues.
Block 3, CTA-861 Extension Block:
  IT Video Formats are overscanned by default, but normally this should be underscanned.
  Detailed Timing Descriptor #8: DTD is similar but not identical to VIC 31.
  Detailed Timing Descriptor #9: DTD is similar but not identical to VIC 16.
  Detailed Timing Descriptor #10: DTD is similar but not identical to VIC 95.
  Add a Colorimetry Data Block with the sRGB colorimetry bit set to avoid interop issues.
EDID:
  CTA-861: Multiple native interlaced timings are defined.

Failures:

Block 0, Base EDID:
  Detailed Timing Descriptor #2: Invalid detailed timing descriptor ordering.
Block 1, CTA-861 Extension Block:
  Missing VCDB, needed for Set Selectable RGB Quantization to avoid interop issues.
Block 2, Base EDID:
  Unknown Extension Block.
Block 3, CTA-861 Extension Block:
  Video Data Block: Duplicate VIC 16.
  Video Data Block: Duplicate VIC 31.
  Video Data Block: Duplicate VIC 5.
  Video Data Block: Duplicate VIC 20.
  Video Data Block: Duplicate VIC 4.
  Video Data Block: Duplicate VIC 19.
  Video Data Block: Duplicate VIC 3.
  Video Data Block: Duplicate VIC 18.
  Video Data Block: Duplicate VIC 1.
  Video Data Block: Duplicate VIC 2.
  Video Data Block: Duplicate VIC 17.
  Speaker Allocation Data Block: Only one instance of this Data Block is allowed.
  Missing VCDB, needed for Set Selectable RGB Quantization to avoid interop issues.
EDID:
  Base EDID: EDID specified 1 extension block(s), but found 3 extension block(s).
  CTA-861: Native progressive timings are a mix of several resolutions.

EDID conformity: FAIL
