edid-decode (hex):

00 ff ff ff ff ff ff 00 0d ae b0 13 00 00 00 00
2a 1d 01 04 a5 1d 12 78 02 ee 95 a3 54 4c 99 26
0f 50 54 00 00 00 01 01 01 01 01 01 01 01 01 01
01 01 01 01 01 01 36 6a 00 a0 a0 40 42 60 30 20
36 00 1e b2 10 00 00 18 00 00 00 fe 00 4e 31 33
33 47 43 41 2d 47 51 31 0a 20 00 00 00 fe 00 43
4d 4e 0a 20 20 20 20 20 20 20 20 20 00 00 00 fe
00 4e 31 33 33 47 43 41 2d 47 51 31 0a 20 00 c4

----------------

Block 0, Base EDID:
  EDID Structure Version & Revision: 1.4
  Vendor & Product Identification:
    Manufacturer: CMN
    Model: 5040
    Made in: week 42 of 2019
  Basic Display Parameters & Features:
    Digital display
    Bits per primary color channel: 8
    DisplayPort interface
    Maximum image size: 29 cm x 18 cm
    Gamma: 2.20
    Supported color formats: RGB 4:4:4
    First detailed timing includes the native pixel format and preferred refresh rate
  Color Characteristics:
    Red  : 0.6396, 0.3300
    Green: 0.2998, 0.5996
    Blue : 0.1503, 0.0595
    White: 0.3134, 0.3291
  Established Timings I & II: none
  Standard Timings: none
  Detailed Timing Descriptors:
    DTD 1:  2560x1600   60.001942 Hz   8:5     99.963 kHz    271.900000 MHz (286 mm x 178 mm)
                 Hfront   48 Hsync  32 Hback   80 Hpol N
                 Vfront    3 Vsync   6 Vback   57 Vpol N
    Alphanumeric Data String: 'N133GCA-GQ1'
    Alphanumeric Data String: 'CMN'
    Alphanumeric Data String: 'N133GCA-GQ1'
Checksum: 0xc4

----------------

Failures:

Block 0, Base EDID:
  Missing Display Product Name.

EDID conformity: FAIL
