edid-decode (hex):

00 ff ff ff ff ff ff 00 06 af 5c 10 00 00 00 00
01 12 01 03 90 1a 0e 78 0a 99 85 95 55 56 92 28
22 50 54 00 00 00 01 01 01 01 01 01 01 01 01 01
01 01 01 01 01 01 bc 1b 56 8e 50 00 10 30 30 20
36 00 00 90 10 00 00 1a bc 1b 56 8e 50 00 10 30
30 20 36 00 00 90 10 00 00 1a 00 00 00 fe 00 56
31 56 38 35 81 42 31 31 36 58 57 31 00 00 00 00
00 00 00 00 00 00 00 00 00 01 01 0a 20 20 00 c1

----------------

Block 0, Base EDID:
  EDID Structure Version & Revision: 1.3
  Vendor & Product Identification:
    Manufacturer: AUO
    Model: 4188
    Made in: week 1 of 2008
  Basic Display Parameters & Features:
    Digital display
    Maximum image size: 26 cm x 14 cm
    Gamma: 2.20
    RGB color display
    First detailed timing is the preferred timing
  Color Characteristics:
    Red  : 0.5839, 0.3330
    Green: 0.3378, 0.5712
    Blue : 0.1582, 0.1328
    White: 0.3134, 0.3291
  Established Timings I & II: none
  Standard Timings: none
  Detailed Timing Descriptors:
    DTD 1:  1366x768    60.054 Hz 683:384  47.082 kHz  71.000 MHz (256 mm x 144 mm)
                 Hfront   48 Hsync  32 Hback  62 Hpol P
                 Vfront    3 Vsync   6 Vback   7 Vpol N
    DTD 2:  1366x768    60.054 Hz 683:384  47.082 kHz  71.000 MHz (256 mm x 144 mm)
                 Hfront   48 Hsync  32 Hback  62 Hpol P
                 Vfront    3 Vsync   6 Vback   7 Vpol N
    Alphanumeric Data String: 'V1V85'
    Manufacturer-Specified Display Descriptor (0x00): 00 00 00 00 00 00 00 00 00 00 00 01 01 0a 20 20 '..............  '
Checksum: 0xc1

----------------

Failures:

Block 0, Base EDID:
  Basic Display Parameters & Features: Digital Video Interface Standard set to reserved value 0x10.
  Alphanumeric Data String: Non-printable character.
  Missing Display Product Name.
  Missing Display Range Limits Descriptor.

EDID conformity: FAIL
