
EDID (hex):
00ffffffffffff0006af5c1000000000
01190104951a0e780299859555569228
22505400000001010101010101010101
010101010101ce1d56ec500019302820
3600009010000018df1356ec50001930
28203600009010000018000000000000
00000000000000000000000000000002
001048ff0f3c6e19140c6e2020200089

Extracted contents:
header:          00 ff ff ff ff ff ff 00
serial number:   06 af 5c 10 00 00 00 00 01 19
version:         01 04
basic params:    95 1a 0e 78 02
chroma info:     99 85 95 55 56 92 28 22 50 54
established:     00 00 00
standard:        01 01 01 01 01 01 01 01 01 01 01 01 01 01 01 01
descriptor 1:    ce 1d 56 ec 50 00 19 30 28 20 36 00 00 90 10 00 00 18
descriptor 2:    df 13 56 ec 50 00 19 30 28 20 36 00 00 90 10 00 00 18
descriptor 3:    00 00 00 00 00 00 00 00 00 00 00 00 00 00 00 00 00 00
descriptor 4:    00 00 00 02 00 10 48 ff 0f 3c 6e 19 14 0c 6e 20 20 20
extensions:      00
checksum:        89

EDID version: 1.4
Manufacturer: AUO Model 105c Serial Number --
Made in week 1 of 2015
Digital display
6 bits per primary color channel
DisplayPort interface
Maximum image size: 26 cm x 14 cm
Gamma: 2.20
Supported color formats: RGB 4:4:4
First detailed timing includes the native pixel format and preferred refresh rate
Display x,y Chromaticity:
  Red:   0.5839, 0.3330
  Green: 0.3378, 0.5712
  Blue:  0.1582, 0.1328
  White: 0.3134, 0.3291
Established timings supported:
Standard timings supported:
Detailed mode: Clock 76.300 MHz, 256 mm x 144 mm
               1366 1406 1438 1602 hborder 0
                768  771  777  793 vborder 0
               -hsync -vsync 
               VertFreq: 60 Hz, HorFreq: 47627 Hz
Detailed mode: Clock 50.870 MHz, 256 mm x 144 mm
               1366 1406 1438 1602 hborder 0
                768  771  777  793 vborder 0
               -hsync -vsync 
               VertFreq: 40 Hz, HorFreq: 31754 Hz
Manufacturer-specified data, tag 0
Manufacturer-specified data, tag 2
Checksum: 0x89 (valid)
EDID block does NOT conform to EDID 1.4!
	Missing name descriptor
	Missing monitor ranges
