
EDID (hex):
00ffffffffffff0006af5c1000000000
01120103801a0e780a99859555569228
22505400000001010101010101010101
010101010101d219563250000a301810
24000090100000180000000f00000000
00000000000000000020000000fe0041
554f0a202020202020202020000000fe
004231313658573031205630200a00c1

Extracted contents:
header:          00 ff ff ff ff ff ff 00
serial number:   06 af 5c 10 00 00 00 00 01 12
version:         01 03
basic params:    80 1a 0e 78 0a
chroma info:     99 85 95 55 56 92 28 22 50 54
established:     00 00 00
standard:        01 01 01 01 01 01 01 01 01 01 01 01 01 01 01 01
descriptor 1:    d2 19 56 32 50 00 0a 30 18 10 24 00 00 90 10 00 00 18
descriptor 2:    00 00 00 0f 00 00 00 00 00 00 00 00 00 00 00 00 00 20
descriptor 3:    00 00 00 fe 00 41 55 4f 0a 20 20 20 20 20 20 20 20 20
descriptor 4:    00 00 00 fe 00 42 31 31 36 58 57 30 31 20 56 30 20 0a
extensions:      00
checksum:        c1

EDID version: 1.3
Manufacturer: AUO Model 105c Serial Number --
Made in week 1 of 2008
Digital display
Maximum image size: 26 cm x 14 cm
Gamma: 2.20
RGB color display
First detailed timing is preferred timing
Display x,y Chromaticity:
  Red:   0.5839, 0.3330
  Green: 0.3378, 0.5712
  Blue:  0.1582, 0.1328
  White: 0.3134, 0.3291
Established timings supported:
Standard timings supported:
Detailed mode: Clock 66.100 MHz, 256 mm x 144 mm
               1366 1390 1406 1416 hborder 0
                768  770  774  778 vborder 0
               -hsync -vsync 
               VertFreq: 60 Hz, HorFreq: 46680 Hz
Manufacturer-specified data, tag 15
ASCII string: AUO
ASCII string: B116XW01 V0 
Checksum: 0xc1 (valid)
EDID block does NOT conform to EDID 1.3!
	Missing name descriptor
	Missing monitor ranges
