edid-decode (hex):

00 ff ff ff ff ff ff 00 4d d9 70 22 01 01 01 01
0b 0e 01 03 0c 22 1b 78 ea c5 c9 a3 57 4a 9c 23
12 48 4c a1 08 00 81 80 81 40 01 01 01 01 01 01
01 01 01 01 01 01 30 2a 00 98 51 00 2a 40 30 70
13 00 52 0e 11 00 00 1e 00 00 00 fd 00 30 41 1c
41 0b 00 0a 20 20 20 20 20 20 00 00 00 fc 00 53
44 4d 2d 48 53 37 33 0a 20 20 20 20 00 00 00 ff
00 33 37 31 33 34 30 36 0a 20 20 20 20 20 00 98

00 ff ff ff ff ff ff 00 4d d9 70 22 01 01 01 01
0b 0e 01 03 0c 22 1b 78 ea c5 c9 a3 57 4a 9c 23
12 48 4c a1 08 00 81 80 81 40 01 01 01 01 01 01
01 01 01 01 01 01 30 2a 00 98 51 00 2a 40 30 70
13 00 52 0e 11 00 00 1e 00 00 00 fd 00 30 41 1c
41 0b 00 0a 20 20 20 20 20 20 00 00 00 fc 00 53
44 4d 2d 48 53 37 33 0a 20 20 20 20 00 00 00 ff
00 33 37 31 33 34 30 36 0a 20 20 20 20 20 00 98

----------------

Block 0, Base EDID:
  EDID Structure Version & Revision: 1.3
  Vendor & Product Identification:
    Manufacturer: SNY
    Model: 8816
    Serial Number: ...
    Made in: week 11 of 2004
  Basic Display Parameters & Features:
    Analog display
    Signal Level Standard: 0.700 : 0.300 : 1.000 V p-p
    Blank level equals black level
    Sync: Separate Composite
    Maximum image size: 34 cm x 27 cm
    Gamma: 2.20
    DPMS levels: Standby Suspend Off
    RGB color display
    First detailed timing is the preferred timing
  Color Characteristics:
    Red  : 0.6396, 0.3398
    Green: 0.2900, 0.6103
    Blue : 0.1396, 0.0703
    White: 0.2832, 0.2978
  Established Timings I & II:
    IBM     :   720x400    70.081663 Hz   9:5     31.467 kHz     28.320000 MHz
    DMT 0x04:   640x480    59.940476 Hz   4:3     31.469 kHz     25.175000 MHz
    DMT 0x09:   800x600    60.316541 Hz   4:3     37.879 kHz     40.000000 MHz
    DMT 0x10:  1024x768    60.003840 Hz   4:3     48.363 kHz     65.000000 MHz
  Standard Timings:
    DMT 0x23:  1280x1024   60.019740 Hz   5:4     63.981 kHz    108.000000 MHz
    DMT 0x20:  1280x960    60.000000 Hz   4:3     60.000 kHz    108.000000 MHz
  Detailed Timing Descriptors:
    DTD 1:  1280x1024   60.019740 Hz   5:4     63.981 kHz    108.000000 MHz (338 mm x 270 mm)
                 Hfront   48 Hsync 112 Hback  248 Hpol P
                 Vfront    1 Vsync   3 Vback   38 Vpol P
    Display Range Limits:
      Monitor ranges (GTF): 48-65 Hz V, 28-65 kHz H, max dotclock 110 MHz
    Display Product Name: 'SDM-HS73'
    Display Product Serial Number: ...
Checksum: 0x98

----------------

Block 1, Unknown EDID Extension Block 0x00:
  00 ff ff ff ff ff ff 00 4d d9 70 22 01 01 01 01 '........M.p"....'
  0b 0e 01 03 0c 22 1b 78 ea c5 c9 a3 57 4a 9c 23 '.....".x....WJ.#'
  12 48 4c a1 08 00 81 80 81 40 01 01 01 01 01 01 '.HL......@......'
  01 01 01 01 01 01 30 2a 00 98 51 00 2a 40 30 70 '......0*..Q.*@0p'
  13 00 52 0e 11 00 00 1e 00 00 00 fd 00 30 41 1c '..R..........0A.'
  41 0b 00 0a 20 20 20 20 20 20 00 00 00 fc 00 53 'A...      .....S'
  44 4d 2d 48 53 37 33 0a 20 20 20 20 00 00 00 ff 'DM-HS73.    ....'
  00 33 37 31 33 34 30 36 0a 20 20 20 20 20 00 98 '.3713406.     ..'
Checksum: 0x98

----------------

Failures:

Block 1, Base EDID:
  Unknown Extension Block.
EDID:
  Base EDID: Some timings are out of range of the Monitor Ranges:
    Vertical Freq: 59.940 - 70.082 Hz (Monitor: 48.000 - 65.000 Hz)
  Base EDID: EDID specified 0 extension block(s), but found 1 extension block(s).

EDID conformity: FAIL
