
EDID (hex):
00ffffffffffff00047287068a119103
271e0103804627783b2a05ac4f41a726
0e50542308008140818081c081009500
b300d1c00101cc7400a0a0a01e503020
3500ba892100001a000000ff00544534
4141303032343230330a000000fd0030
4b1e781e000a202020202020000000fc
004163657220455433323251550a01c5
020329f14b101f051404130312021101
230907078301000067030c001000383c
681a00000101304bed023a801871382d
40582c4500ba892100001e011d007251
d01e206e285500ba892100001e8c0ad0
8a20e02d10103e9600ba892100001856
5e00a0a0a0295030203500ba89210000
1a00000000000000000000000000003c

Extracted contents:
header:          00 ff ff ff ff ff ff 00
serial number:   04 72 87 06 8a 11 91 03 27 1e
version:         01 03
basic params:    80 46 27 78 3b
chroma info:     2a 05 ac 4f 41 a7 26 0e 50 54
established:     23 08 00
standard:        81 40 81 80 81 c0 81 00 95 00 b3 00 d1 c0 01 01
descriptor 1:    cc 74 00 a0 a0 a0 1e 50 30 20 35 00 ba 89 21 00 00 1a
descriptor 2:    00 00 00 ff 00 54 45 34 41 41 30 30 32 34 32 30 33 0a
descriptor 3:    00 00 00 fd 00 30 4b 1e 78 1e 00 0a 20 20 20 20 20 20
descriptor 4:    00 00 00 fc 00 41 63 65 72 20 45 54 33 32 32 51 55 0a
extensions:      01
checksum:        c5

EDID version: 1.3
Manufacturer: ACR Model 687 Serial Number --
Made in week 39 of 2020
Digital display
Maximum image size: 70 cm x 39 cm
Gamma: 2.20
DPMS levels: Off
Undefined display color type
First detailed timing is preferred timing
Supports GTF timings within operating range
Display x,y Chromaticity:
  Red:   0.6718, 0.3105
  Green: 0.2558, 0.6542
  Blue:  0.1484, 0.0546
  White: 0.3134, 0.3291
Established timings supported:
  640x480@60Hz 4:3 HorFreq: 31469 Hz Clock: 25.175 MHz
  800x600@56Hz 4:3 HorFreq: 35200 Hz Clock: 36.000 MHz
  800x600@60Hz 4:3 HorFreq: 37900 Hz Clock: 40.000 MHz
  1024x768@60Hz 4:3 HorFreq: 48400 Hz Clock: 65.000 MHz
Standard timings supported:
  1280x960@60Hz 4:3 HorFreq: 60000 Hz Clock: 108.000 MHz
  1280x1024@60Hz 5:4 HorFreq: 64000 Hz Clock: 108.000 MHz
  1280x720@60Hz 16:9
  1280x800@60Hz 16:10
  1440x900@60Hz 16:10 HorFreq: 55500 Hz Clock: 88.750 MHz
  1680x1050@60Hz 16:10 HorFreq: 64700 Hz Clock: 119.000 MHz
  1920x1080@60Hz 16:9
Detailed mode: Clock 299.000 MHz, 698 mm x 393 mm
               2560 2608 2640 2720 hborder 0
               1440 1443 1448 1470 vborder 0
               +hsync -vsync 
               VertFreq: 74 Hz, HorFreq: 109926 Hz
Serial number: --
Monitor ranges (GTF): 48-75Hz V, 30-120kHz H, max dotclock 300MHz
Monitor name: Acer ET322QU
Has 1 extension blocks
Checksum: 0xc5 (valid)

CTA extension block
Extension version: 3
37 bytes of CTA data
  Video data block
    VIC  16 1920x1080@60Hz 16:9  HorFreq: 67500 Hz Clock: 148.500 MHz
    VIC  31 1920x1080@50Hz 16:9  HorFreq: 56250 Hz Clock: 148.500 MHz
    VIC   5 1920x1080i@60Hz 16:9  HorFreq: 33750 Hz Clock: 74.250 MHz
    VIC  20 1920x1080i@50Hz 16:9  HorFreq: 28125 Hz Clock: 74.250 MHz
    VIC   4 1280x720@60Hz 16:9  HorFreq: 45000 Hz Clock: 74.250 MHz
    VIC  19 1280x720@50Hz 16:9  HorFreq: 37500 Hz Clock: 74.250 MHz
    VIC   3 720x480@60Hz 16:9  HorFreq: 31469 Hz Clock: 27.000 MHz
    VIC  18 720x576@50Hz 16:9  HorFreq: 31250 Hz Clock: 27.000 MHz
    VIC   2 720x480@60Hz 4:3  HorFreq: 31469 Hz Clock: 27.000 MHz
    VIC  17 720x576@50Hz 4:3  HorFreq: 31250 Hz Clock: 27.000 MHz
    VIC   1 640x480@60Hz 4:3  HorFreq: 31469 Hz Clock: 25.175 MHz
  Audio data block
    Linear PCM, max channels 2
      Supported sample rates (kHz): 48 44.1 32
      Supported sample sizes (bits): 24 20 16
  Speaker allocation data block
    Speaker map:
      FL/FR - Front Left/Right
  Vendor-specific data block, OUI 000c03 (HDMI)
    Source physical address 1.0.0.0
    DC_36bit
    DC_30bit
    DC_Y444
    Maximum TMDS clock: 300MHz
  Vendor-specific data block, OUI 00001a
Underscans PC formats by default
Basic audio support
Supports YCbCr 4:4:4
Supports YCbCr 4:2:2
1 native detailed modes
Detailed mode: Clock 148.500 MHz, 698 mm x 393 mm
               1920 2008 2052 2200 hborder 0
               1080 1084 1089 1125 vborder 0
               +hsync +vsync 
               VertFreq: 60 Hz, HorFreq: 67500 Hz
Detailed mode: Clock 74.250 MHz, 698 mm x 393 mm
               1280 1390 1430 1650 hborder 0
                720  725  730  750 vborder 0
               +hsync +vsync 
               VertFreq: 60 Hz, HorFreq: 45000 Hz
Detailed mode: Clock 27.000 MHz, 698 mm x 393 mm
                720  736  798  858 hborder 0
                480  489  495  525 vborder 0
               -hsync -vsync 
               VertFreq: 59 Hz, HorFreq: 31468 Hz
Detailed mode: Clock 241.500 MHz, 698 mm x 393 mm
               2560 2608 2640 2720 hborder 0
               1440 1443 1448 1481 vborder 0
               +hsync -vsync 
               VertFreq: 59 Hz, HorFreq: 88786 Hz
Checksum: 0x3c (valid)

One or more of the timings is out of range of the Monitor Ranges:
  Vertical Freq: 50 - 74 Hz
  Horizontal Freq: 28125 - 109926 Hz
  Maximum Clock: 299.000 MHz
EDID block does not conform at all!
	Both the serial number and the serial string are set


