
EDID (hex):
00ffffffffffff003438e00601010101
021201036c221b78eaa2a5a3574c9d25
115054bdef80714f81908180818c454f
614001010101302a009851002a403070
1300782d1100001e000000fd00374c1f
510e000a202020202020000000fc0042
656c3130313732380a0a0a0a000000ff
003038303231303430363530350a0077

Extracted contents:
header:          00 ff ff ff ff ff ff 00
serial number:   34 38 e0 06 01 01 01 01 02 12
version:         01 03
basic params:    6c 22 1b 78 ea
chroma info:     a2 a5 a3 57 4c 9d 25 11 50 54
established:     bd ef 80
standard:        71 4f 81 90 81 80 81 8c 45 4f 61 40 01 01 01 01
descriptor 1:    30 2a 00 98 51 00 2a 40 30 70 13 00 78 2d 11 00 00 1e
descriptor 2:    00 00 00 fd 00 37 4c 1f 51 0e 00 0a 20 20 20 20 20 20
descriptor 3:    00 00 00 fc 00 42 65 6c 31 30 31 37 32 38 0a 0a 0a 0a
descriptor 4:    00 00 00 ff 00 30 38 30 32 31 30 34 30 36 35 30 35 0a
extensions:      00
checksum:        77

EDID version: 1.3
Manufacturer: MAX Model 6e0 Serial Number --
Made in week 2 of 2008
Analog display, Input voltage level: 0.7/0.7 V
Sync: Separate Composite 
Maximum image size: 34 cm x 27 cm
Gamma: 2.20
DPMS levels: Standby Suspend Off
RGB color display
First detailed timing is preferred timing
Display x,y Chromaticity:
  Red:   0.6386, 0.3417
  Green: 0.2968, 0.6152
  Blue:  0.1464, 0.0683
  White: 0.3134, 0.3291
Established timings supported:
  720x400@70Hz 9:5 HorFreq: 31469 Hz Clock: 28.320 MHz
  640x480@60Hz 4:3 HorFreq: 31469 Hz Clock: 25.175 MHz
  640x480@67Hz 4:3 HorFreq: 35000 Hz Clock: 30.240 MHz
  640x480@72Hz 4:3 HorFreq: 37900 Hz Clock: 31.500 MHz
  640x480@75Hz 4:3 HorFreq: 37500 Hz Clock: 31.500 MHz
  800x600@60Hz 4:3 HorFreq: 37900 Hz Clock: 40.000 MHz
  800x600@72Hz 4:3 HorFreq: 48100 Hz Clock: 50.000 MHz
  800x600@75Hz 4:3 HorFreq: 46900 Hz Clock: 49.500 MHz
  832x624@75Hz 4:3 HorFreq: 49726 Hz Clock: 57.284 MHz
  1024x768@60Hz 4:3 HorFreq: 48400 Hz Clock: 65.000 MHz
  1024x768@70Hz 4:3 HorFreq: 56500 Hz Clock: 75.000 MHz
  1024x768@75Hz 4:3 HorFreq: 60000 Hz Clock: 78.750 MHz
  1280x1024@75Hz 5:4 HorFreq: 80000 Hz Clock: 135.000 MHz
  1152x870@75Hz 192:145 HorFreq: 67500 Hz Clock: 108.000 MHz
Standard timings supported:
  1152x864@75Hz 4:3 HorFreq: 67500 Hz Clock: 108.000 MHz
  1280x1024@76Hz 5:4
  1280x1024@60Hz 5:4 HorFreq: 64000 Hz Clock: 108.000 MHz
  1280x1024@72Hz 5:4
  800x600@75Hz 4:3 HorFreq: 46900 Hz Clock: 49.500 MHz
  1024x768@60Hz 4:3 HorFreq: 48400 Hz Clock: 65.000 MHz
Detailed mode: Clock 108.000 MHz, 376 mm x 301 mm
               1280 1328 1440 1688 hborder 0
               1024 1025 1028 1066 vborder 0
               +hsync +vsync 
               VertFreq: 60 Hz, HorFreq: 63981 Hz
Monitor ranges (GTF): 55-76Hz V, 31-81kHz H, max dotclock 140MHz
Monitor name: Bel101728
Serial number: --
Checksum: 0x77 (valid)
EDID block does NOT conform to EDID 1.3!
	Detailed block string not properly terminated
