
EDID (hex):
00ffffffffffff004c2d180b42544b30
0c190103803420782a7c41a9544b9f25
0d505423080081c0810081809500a9c0
b300d1c00101283c80a070b023403020
360006442100001a000000fd00383c1e
5111000a202020202020000000fc0053
3234433635300a2020202020000000ff
00485453473330303130350a2020015b
02010400023a80d072382d40102c4580
06442100001e011d007251d01e206e28
550006442100001e011d00bc52d01e20
b828554006442100001e8c0ad0902040
31200c4055000644210000188c0ad08a
20e02d10103e96000644210000180000
00000000000000000000000000000000
000000000000000000000000000000d2

Extracted contents:
header:          00 ff ff ff ff ff ff 00
serial number:   4c 2d 18 0b 42 54 4b 30 0c 19
version:         01 03
basic params:    80 34 20 78 2a
chroma info:     7c 41 a9 54 4b 9f 25 0d 50 54
established:     23 08 00
standard:        81 c0 81 00 81 80 95 00 a9 c0 b3 00 d1 c0 01 01
descriptor 1:    28 3c 80 a0 70 b0 23 40 30 20 36 00 06 44 21 00 00 1a
descriptor 2:    00 00 00 fd 00 38 3c 1e 51 11 00 0a 20 20 20 20 20 20
descriptor 3:    00 00 00 fc 00 53 32 34 43 36 35 30 0a 20 20 20 20 20
descriptor 4:    00 00 00 ff 00 48 54 53 47 33 30 30 31 30 35 0a 20 20
extensions:      01
checksum:        5b

EDID version: 1.3
Manufacturer: SAM Model b18 Serial Number --
Made in week 12 of 2015
Digital display
Maximum image size: 52 cm x 32 cm
Gamma: 2.20
DPMS levels: Off
RGB color display
First detailed timing is preferred timing
Display x,y Chromaticity:
  Red:   0.6611, 0.3310
  Green: 0.2958, 0.6210
  Blue:  0.1455, 0.0507
  White: 0.3125, 0.3291
Established timings supported:
  640x480@60Hz 4:3 HorFreq: 31469 Hz Clock: 25.175 MHz
  800x600@56Hz 4:3 HorFreq: 35200 Hz Clock: 36.000 MHz
  800x600@60Hz 4:3 HorFreq: 37900 Hz Clock: 40.000 MHz
  1024x768@60Hz 4:3 HorFreq: 48400 Hz Clock: 65.000 MHz
Standard timings supported:
  1280x720@60Hz 16:9
  1280x800@60Hz 16:10
  1280x1024@60Hz 5:4 HorFreq: 64000 Hz Clock: 108.000 MHz
  1440x900@60Hz 16:10 HorFreq: 55500 Hz Clock: 88.750 MHz
  1600x900@60Hz 16:9
  1680x1050@60Hz 16:10 HorFreq: 64700 Hz Clock: 119.000 MHz
  1920x1080@60Hz 16:9
Detailed mode: Clock 154.000 MHz, 518 mm x 324 mm
               1920 1968 2000 2080 hborder 0
               1200 1203 1209 1235 vborder 0
               +hsync -vsync 
               VertFreq: 59 Hz, HorFreq: 74038 Hz
Monitor ranges (GTF): 56-60Hz V, 30-81kHz H, max dotclock 170MHz
Monitor name: S24C650
Serial number: --
Has 1 extension blocks
Checksum: 0x5b (valid)

CTA extension block
Extension version: 1
0 8-byte timing descriptors
Detailed mode: Clock 148.500 MHz, 518 mm x 324 mm
               1920 2448 2492 2640 hborder 0
               1080 1084 1089 1125 vborder 0
               +hsync +vsync 
               VertFreq: 50 Hz, HorFreq: 56250 Hz
Detailed mode: Clock 74.250 MHz, 518 mm x 324 mm
               1280 1390 1430 1650 hborder 0
                720  725  730  750 vborder 0
               +hsync +vsync 
               VertFreq: 60 Hz, HorFreq: 45000 Hz
Detailed mode: Clock 74.250 MHz, 518 mm x 324 mm
               1280 1720 1760 1980 hborder 0
                720  725  730  750 vborder 0
               +hsync +vsync 
               VertFreq: 50 Hz, HorFreq: 37500 Hz
Detailed mode: Clock 27.000 MHz, 518 mm x 324 mm
                720  732  796  864 hborder 0
                576  581  586  625 vborder 0
               -hsync -vsync 
               VertFreq: 50 Hz, HorFreq: 31250 Hz
Detailed mode: Clock 27.000 MHz, 518 mm x 324 mm
                720  736  798  858 hborder 0
                480  489  495  525 vborder 0
               -hsync -vsync 
               VertFreq: 59 Hz, HorFreq: 31468 Hz
Checksum: 0xd2 (valid)

One or more of the timings is out of range of the Monitor Ranges:
  Vertical Freq: 50 - 60 Hz
  Horizontal Freq: 31250 - 74038 Hz
  Maximum Clock: 154.000 MHz
EDID block does not conform at all!
	Both the serial number and the serial string are set


