edid-decode (hex):

00 ff ff ff ff ff ff 00 5b 4f 10 22 04 67 00 00
32 12 01 03 68 2f 1e 78 2a 37 a0 a6 55 48 9a 26
12 50 54 af ce 00 01 01 01 01 01 01 01 01 01 01
01 01 01 01 01 01 21 39 90 30 62 1a 27 40 68 b0
36 00 da 28 11 00 00 1c 00 00 00 ff 00 54 4d 43
51 41 4a 35 30 32 36 33 37 32 00 00 00 fd 00 38
4b 1f 3d 0b 00 0a 20 20 20 20 20 20 00 00 00 fc
00 56 57 32 32 4c 48 44 54 56 31 30 54 0a 00 62

----------------

Block 0, Base EDID:
  EDID Structure Version & Revision: 1.3
  Vendor & Product Identification:
    Manufacturer: VZO
    Model: 8720
    Serial Number: ...
    Made in: week 50 of 2008
  Basic Display Parameters & Features:
    Analog display
    Input voltage level: 0.7/0.7 V
    Blank level equals black level
    Sync: Separate
    Maximum image size: 47 cm x 30 cm
    Gamma: 2.20
    DPMS levels: Off
    RGB color display
    First detailed timing is the preferred timing
  Color Characteristics:
    Red  : 0.6484, 0.3349
    Green: 0.2822, 0.6044
    Blue : 0.1503, 0.0722
    White: 0.3125, 0.3281
  Established Timings I & II:
    IBM     :   720x400    70.082 Hz   9:5    31.467 kHz  28.320 MHz
    DMT 0x04:   640x480    59.940 Hz   4:3    31.469 kHz  25.175 MHz
    DMT 0x05:   640x480    72.809 Hz   4:3    37.861 kHz  31.500 MHz
    DMT 0x06:   640x480    75.000 Hz   4:3    37.500 kHz  31.500 MHz
    DMT 0x08:   800x600    56.250 Hz   4:3    35.156 kHz  36.000 MHz
    DMT 0x09:   800x600    60.317 Hz   4:3    37.879 kHz  40.000 MHz
    DMT 0x0a:   800x600    72.188 Hz   4:3    48.077 kHz  50.000 MHz
    DMT 0x0b:   800x600    75.000 Hz   4:3    46.875 kHz  49.500 MHz
    DMT 0x10:  1024x768    60.004 Hz   4:3    48.363 kHz  65.000 MHz
    DMT 0x11:  1024x768    70.069 Hz   4:3    56.476 kHz  75.000 MHz
    DMT 0x12:  1024x768    75.029 Hz   4:3    60.023 kHz  78.750 MHz
  Standard Timings: none
  Detailed Timing Descriptors:
    DTD 1:  1680x1050   59.954 Hz   8:5    65.290 kHz 146.250 MHz (474 mm x 296 mm)
                 Hfront  104 Hsync 176 Hback 280 Hpol N
                 Vfront    3 Vsync   6 Vback  30 Vpol P
    Display Product Serial Number: ...
  Display Range Limits:
    Monitor ranges (GTF): 56-75 Hz V, 31-61 kHz H, max dotclock 110 MHz
    Display Product Name: 'VW22LHDTV10T'
Checksum: 0x62

----------------

Failures:

EDID:
  Base EDID: Some timings are out of range of the Monitor Ranges:
    Horizontal Freq: 31.466 - 65.290 kHz (Monitor: 31.000 - 61.000 kHz)
    Maximum Clock: 146.250 MHz (Monitor: 110.000 MHz)

EDID conformity: FAIL
