edid-decode (hex):

00 ff ff ff ff ff ff 00 22 0e 34 36 01 01 01 01
18 1f 01 03 68 2c 18 78 2a 69 d5 a2 56 4f a0 28
0f 50 54 a1 08 00 a9 c0 95 00 81 80 81 00 81 c0
01 01 01 01 01 01 30 2a 40 c8 60 84 64 30 18 50
13 00 b0 f0 10 00 00 1e 00 00 00 fd 00 32 3c 1e
46 11 00 0a 20 20 20 20 20 20 00 00 00 fc 00 48
50 20 50 32 30 34 76 0a 20 20 20 20 00 00 00 ff
00 33 43 51 31 32 34 30 51 51 51 0a 20 20 00 3e

00 ff ff ff ff ff ff 00 22 0e 34 36 01 01 01 01
18 1f 01 03 68 2c 18 78 2a 69 d5 a2 56 4f a0 28
0f 50 54 a1 08 00 a9 c0 95 00 81 80 81 00 81 c0
01 01 01 01 01 01 30 2a 40 c8 60 84 64 30 18 50
13 00 b0 f0 10 00 00 1e 00 00 00 fd 00 32 3c 1e
46 11 00 0a 20 20 20 20 20 20 00 00 00 fc 00 48
50 20 50 32 30 34 76 0a 20 20 20 20 00 00 00 ff
00 33 43 51 31 32 34 30 51 51 51 0a 20 20 00 3e

----------------

Block 0, Base EDID:
  EDID Structure Version & Revision: 1.3
  Vendor & Product Identification:
    Manufacturer: HPN
    Model: 13876
    Serial Number: ...
    Made in: week 24 of 2021
  Basic Display Parameters & Features:
    Analog display
    Signal Level Standard: 0.700 : 0.000 : 0.700 V p-p
    Blank level equals black level
    Sync: Separate
    Maximum image size: 44 cm x 24 cm
    Gamma: 2.20
    DPMS levels: Off
    RGB color display
    First detailed timing is the preferred timing
  Color Characteristics:
    Red  : 0.6337, 0.3378
    Green: 0.3105, 0.6259
    Blue : 0.1591, 0.0595
    White: 0.3134, 0.3291
  Established Timings I & II:
    IBM     :   720x400    70.081663 Hz   9:5     31.467 kHz     28.320000 MHz
    DMT 0x04:   640x480    59.940476 Hz   4:3     31.469 kHz     25.175000 MHz
    DMT 0x09:   800x600    60.316541 Hz   4:3     37.879 kHz     40.000000 MHz
    DMT 0x10:  1024x768    60.003840 Hz   4:3     48.363 kHz     65.000000 MHz
  Standard Timings:
    DMT 0x53:  1600x900    60.000000 Hz  16:9     60.000 kHz    108.000000 MHz (RB)
    DMT 0x2f:  1440x900    59.887445 Hz  16:10    55.935 kHz    106.500000 MHz
    DMT 0x23:  1280x1024   60.019740 Hz   5:4     63.981 kHz    108.000000 MHz
    DMT 0x1c:  1280x800    59.810326 Hz  16:10    49.702 kHz     83.500000 MHz
    DMT 0x55:  1280x720    60.000000 Hz  16:9     45.000 kHz     74.250000 MHz
  Detailed Timing Descriptors:
    DTD 1:  1600x900    60.000000 Hz  16:9     60.000 kHz    108.000000 MHz (432 mm x 240 mm)
                 Hfront   24 Hsync  80 Hback   96 Hpol P
                 Vfront    1 Vsync   3 Vback   96 Vpol P
    Display Range Limits:
      Monitor ranges (GTF): 50-60 Hz V, 30-70 kHz H, max dotclock 170 MHz
    Display Product Name: 'HP P204v'
    Display Product Serial Number: ...
Checksum: 0x3e

----------------

Block 1, Unknown EDID Extension Block 0x00:
  00 ff ff ff ff ff ff 00 22 0e 34 36 01 01 01 01 '........".46....'
  18 1f 01 03 68 2c 18 78 2a 69 d5 a2 56 4f a0 28 '....h,.x*i..VO.('
  0f 50 54 a1 08 00 a9 c0 95 00 81 80 81 00 81 c0 '.PT.............'
  01 01 01 01 01 01 30 2a 40 c8 60 84 64 30 18 50 '......0*@.`.d0.P'
  13 00 b0 f0 10 00 00 1e 00 00 00 fd 00 32 3c 1e '.............2<.'
  46 11 00 0a 20 20 20 20 20 20 00 00 00 fc 00 48 'F...      .....H'
  50 20 50 32 30 34 76 0a 20 20 20 20 00 00 00 ff 'P P204v.    ....'
  00 33 43 51 31 32 34 30 51 51 51 0a 20 20 00 3e '.3CQ1240QQQ.  .>'
Checksum: 0x3e

----------------

Failures:

Block 1, Base EDID:
  Unknown Extension Block.
EDID:
  Base EDID: Some timings are out of range of the Monitor Ranges:
    Vertical Freq: 59.810 - 70.082 Hz (Monitor: 50.000 - 60.000 Hz)
  Base EDID: EDID specified 0 extension block(s), but found 1 extension block(s).

EDID conformity: FAIL
