edid-decode (hex):

00 ff ff ff ff ff ff 00 0d ae b1 14 00 00 00 00
10 19 01 04 95 1f 11 78 02 ff 35 92 55 52 95 29
25 50 54 00 00 00 01 01 01 01 01 01 01 01 01 01
01 01 01 01 01 01 b4 3b 80 4a 71 38 34 40 50 3c
68 00 34 ad 10 00 00 1a cd 27 80 4a 71 38 34 40
50 3c 68 00 34 ad 10 00 00 1a 00 00 00 00 00 00
00 00 00 00 00 00 00 00 00 00 00 00 00 00 00 02
00 0c 3d ff 0d 3c 7d 13 12 26 7d 00 00 00 00 8e

----------------

Block 0, Base EDID:
  EDID Structure Version & Revision: 1.4
  Vendor & Product Identification:
    Manufacturer: CMN
    Model: 5297
    Made in: week 16 of 2015
  Basic Display Parameters & Features:
    Digital display
    Bits per primary color channel: 6
    DisplayPort interface
    Maximum image size: 31 cm x 17 cm
    Gamma: 2.20
    Supported color formats: RGB 4:4:4
    First detailed timing includes the native pixel format and preferred refresh rate
  Color Characteristics:
    Red  : 0.5732, 0.3349
    Green: 0.3232, 0.5849
    Blue : 0.1601, 0.1474
    White: 0.3134, 0.3291
  Established Timings I & II: none
  Standard Timings: none
  Detailed Timing Descriptors:
    DTD 1:  1920x1080   60.007852 Hz  16:9     67.929 kHz    152.840000 MHz (308 mm x 173 mm)
                 Hfront   80 Hsync  60 Hback  190 Hpol P
                 Vfront    6 Vsync   8 Vback   38 Vpol N
    DTD 2:  1920x1080   40.003926 Hz  16:9     45.284 kHz    101.890000 MHz (308 mm x 173 mm)
                 Hfront   80 Hsync  60 Hback  190 Hpol P
                 Vfront    6 Vsync   8 Vback   38 Vpol N
    Empty Descriptor
    Manufacturer-Specified Display Descriptor (0x02): 00 02 00 0c 3d ff 0d 3c 7d 13 12 26 7d 00 00 00 '....=..<}..&}...'
Checksum: 0x8e

----------------

Warnings:

Block 0, Base EDID:
  Missing Display Product Name.

Failures:

Block 0, Base EDID:
  Empty Descriptor: Use Dummy Descriptor instead of all zeroes.

EDID conformity: FAIL
