edid-decode (hex):

00 ff ff ff ff ff ff 00 04 81 04 00 01 00 00 00
01 11 01 03 80 0f 0a 00 0a 00 00 00 00 00 00 00
00 00 00 00 00 00 01 01 01 01 01 01 01 01 01 01
01 01 01 01 01 01 80 0c 20 80 30 e0 2d 10 28 30
d3 00 6c 44 00 00 00 18 00 00 00 10 00 00 00 00
00 00 00 00 00 00 00 00 00 00 00 00 00 10 00 00
00 00 00 00 00 00 00 00 00 00 00 00 00 00 00 10
00 00 00 00 00 00 00 00 00 00 00 00 00 00 00 17

----------------

Block 0, Base EDID:
  EDID Structure Version & Revision: 1.3
  Vendor & Product Identification:
    Manufacturer: ADA
    Model: 4
    Serial Number: ...
    Made in: week 1 of 2007
  Basic Display Parameters & Features:
    Digital display
    Maximum image size: 15 cm x 10 cm
    Gamma: 1.00
    RGB color display
    First detailed timing is the preferred timing
  Color Characteristics:
    Red  : 0.0000, 0.0000
    Green: 0.0000, 0.0000
    Blue : 0.0000, 0.0000
    White: 0.0000, 0.0000
  Established Timings I & II: none
  Standard Timings: none
  Detailed Timing Descriptors:
    DTD 1:   800x480    65.681 Hz   5:3    34.483 kHz  32.000 MHz (108 mm x 68 mm)
                 Hfront   40 Hsync  48 Hback  40 Hpol N
                 Vfront   13 Vsync   3 Vback  29 Vpol N
    Dummy Descriptor:
    Dummy Descriptor:
    Dummy Descriptor:
Checksum: 0x17

----------------

Failures:

Block 0, Base EDID:
  Detailed Timing Descriptor #1: Mismatch of image size 108x68 mm vs display size 150x100 mm.
  Missing Display Product Name.
  Missing Display Range Limits Descriptor.

EDID conformity: FAIL
