edid-decode (hex):

00 ff ff ff ff ff ff 00 05 e3 16 21 db 03 00 00
2b 11 01 03 68 2e 1d 78 2a c3 d0 a4 55 49 9a 26
13 50 54 bf ef 00 81 80 81 40 95 00 01 01 01 01
01 01 01 01 01 01 08 39 90 30 62 1a 27 40 68 b0
36 00 cc 22 11 00 00 1a 00 00 00 fd 00 38 4b 1f
50 11 00 0a 20 20 20 20 20 20 00 00 00 fc 00 32
31 31 36 53 0a 20 20 20 20 20 20 20 00 00 00 ff
00 43 4d 41 44 37 34 33 30 30 39 38 37 0a 00 3d

----------------

Block 0, Base EDID:
  EDID Structure Version & Revision: 1.3
  Vendor & Product Identification:
    Manufacturer: AOC
    Model: 8470
    Serial Number: ...
    Made in: week 43 of 2007
  Basic Display Parameters & Features:
    Analog display
    Input voltage level: 0.7/0.7 V
    Sync: Separate
    Maximum image size: 46 cm x 29 cm
    Gamma: 2.20
    DPMS levels: Off
    RGB color display
    First detailed timing is preferred timing
  Color Characteristics:
    Red  : 0.6435, 0.3320
    Green: 0.2851, 0.6044
    Blue : 0.1513, 0.0751
    White: 0.3125, 0.3281
  Established Timings I & II:
    IBM     :   720x400    70.082 Hz   9:5    31.467 kHz  28.320 MHz
    DMT 0x04:   640x480    59.940 Hz   4:3    31.469 kHz  25.175 MHz
    Apple   :   640x480    66.667 Hz   4:3    35.000 kHz  30.240 MHz
    DMT 0x05:   640x480    72.809 Hz   4:3    37.861 kHz  31.500 MHz
    DMT 0x06:   640x480    75.000 Hz   4:3    37.500 kHz  31.500 MHz
    DMT 0x08:   800x600    56.250 Hz   4:3    35.156 kHz  36.000 MHz
    DMT 0x09:   800x600    60.317 Hz   4:3    37.879 kHz  40.000 MHz
    DMT 0x0a:   800x600    72.188 Hz   4:3    48.077 kHz  50.000 MHz
    DMT 0x0b:   800x600    75.000 Hz   4:3    46.875 kHz  49.500 MHz
    Apple   :   832x624    74.551 Hz   4:3    49.726 kHz  57.284 MHz
    DMT 0x10:  1024x768    60.004 Hz   4:3    48.363 kHz  65.000 MHz
    DMT 0x11:  1024x768    70.069 Hz   4:3    56.476 kHz  75.000 MHz
    DMT 0x12:  1024x768    75.029 Hz   4:3    60.023 kHz  78.750 MHz
    DMT 0x24:  1280x1024   75.025 Hz   5:4    79.976 kHz 135.000 MHz
  Standard Timings:
    DMT 0x23:  1280x1024   60.020 Hz   5:4    63.981 kHz 108.000 MHz
    DMT 0x20:  1280x960    60.000 Hz   4:3    60.000 kHz 108.000 MHz
    DMT 0x2f:  1440x900    59.887 Hz  16:10   55.935 kHz 106.500 MHz
  Detailed Timing Descriptors:
    DTD 1:  1680x1050   59.852 Hz   8:5    65.179 kHz 146.000 MHz (460 mm x 290 mm)
                 Hfront  104 Hsync 176 Hback 280 Hpol P
                 Vfront    3 Vsync   6 Vback  30 Vpol N
  Display Range Limits:
    Monitor ranges (GTF): 56-75 Hz V, 31-80 kHz H, max dotclock 170 MHz
    Display Product Name: '2116S'
    Display Product Serial Number: ...
Checksum: 0x3d

----------------

EDID conformity: PASS
