
EDID (hex):
00ffffffffffff000ed4210000000000
06140103080000000ad7a5a2594a9624
145054adce0001010101010101010101
010101010101662150b051001b304070
3600f8c22100001e0e1f008051001e30
40803700f8c22100001c000000100000
283040704900f8c22100001a000000fd
00324c1e410b000a20202020202000d4

Extracted contents:
header:          00 ff ff ff ff ff ff 00
serial number:   0e d4 21 00 00 00 00 00 06 14
version:         01 03
basic params:    08 00 00 00 0a
chroma info:     d7 a5 a2 59 4a 96 24 14 50 54
established:     ad ce 00
standard:        01 01 01 01 01 01 01 01 01 01 01 01 01 01 01 01
descriptor 1:    66 21 50 b0 51 00 1b 30 40 70 36 00 f8 c2 21 00 00 1e
descriptor 2:    0e 1f 00 80 51 00 1e 30 40 80 37 00 f8 c2 21 00 00 1c
descriptor 3:    00 00 00 10 00 00 28 30 40 70 49 00 f8 c2 21 00 00 1a
descriptor 4:    00 00 00 fd 00 32 4c 1e 41 0b 00 0a 20 20 20 20 20 20
extensions:      00
checksum:        d4

EDID version: 1.3
Manufacturer: CVT Model 21 Serial Number --
Made in week 6 of 2010
Analog display, Input voltage level: 0.7/0.3 V
Sync: Separate 
Image size is variable
Gamma: 1.00
RGB color display
First detailed timing is preferred timing
Display x,y Chromaticity:
  Red:   0.6357, 0.3486
  Green: 0.2900, 0.5888
  Blue:  0.1425, 0.0800
  White: 0.3134, 0.3291
Established timings supported:
  720x400@70Hz 9:5 HorFreq: 31469 Hz Clock: 28.320 MHz
  640x480@60Hz 4:3 HorFreq: 31469 Hz Clock: 25.175 MHz
  640x480@72Hz 4:3 HorFreq: 37900 Hz Clock: 31.500 MHz
  640x480@75Hz 4:3 HorFreq: 37500 Hz Clock: 31.500 MHz
  800x600@60Hz 4:3 HorFreq: 37900 Hz Clock: 40.000 MHz
  800x600@72Hz 4:3 HorFreq: 48100 Hz Clock: 50.000 MHz
  800x600@75Hz 4:3 HorFreq: 46900 Hz Clock: 49.500 MHz
  1024x768@60Hz 4:3 HorFreq: 48400 Hz Clock: 65.000 MHz
  1024x768@70Hz 4:3 HorFreq: 56500 Hz Clock: 75.000 MHz
  1024x768@75Hz 4:3 HorFreq: 60000 Hz Clock: 78.750 MHz
Standard timings supported:
Detailed mode: Clock 85.500 MHz, 760 mm x 450 mm
               1360 1424 1536 1792 hborder 0
                768  771  777  795 vborder 0
               +hsync +vsync 
               VertFreq: 60 Hz, HorFreq: 47712 Hz
Detailed mode: Clock 79.500 MHz, 760 mm x 450 mm
               1280 1344 1472 1664 hborder 0
                768  771  778  798 vborder 0
               -hsync +vsync 
               VertFreq: 59 Hz, HorFreq: 47776 Hz
Dummy block
Monitor ranges (GTF): 50-76Hz V, 30-65kHz H, max dotclock 110MHz
Checksum: 0xd4 (valid)
EDID block does NOT conform to EDID 1.3!
	Missing name descriptor
EDID block does not conform at all!
	Dummy block filled with garbage
