edid-decode (hex):

00 ff ff ff ff ff ff 00 24 62 00 32 45 54 00 00
10 1c 01 04 a5 46 27 78 3f 61 50 a6 56 50 a0 26
0d 50 54 a7 6f 80 d1 c0 81 c0 81 00 81 80 a9 c0
b3 00 95 00 71 40 90 e2 00 a0 a0 a0 28 50 30 20
35 00 00 b0 31 00 00 1a 00 00 00 ff 00 4e 41 0a
20 20 20 20 20 20 20 20 20 20 00 00 00 fd 00 30
90 de de 3c 01 0a 20 20 20 20 20 20 00 00 00 fc
00 44 50 31 0a 20 20 20 20 20 20 20 20 20 01 6d

02 03 18 f1 4b 01 02 03 04 05 90 11 12 13 14 1f
23 09 07 07 83 01 00 00 56 5e 00 a0 a0 a0 28 50
30 20 35 00 00 b0 31 00 00 1e db 58 00 a0 50 00
49 40 30 20 37 00 80 33 11 00 00 1a cf 36 00 a0
40 00 37 30 30 20 34 00 33 e6 10 00 00 1a 07 82
80 50 70 38 4d 40 08 20 f8 0c 56 50 21 00 00 1a
b8 22 20 a0 30 58 2b 20 30 20 34 00 f0 b4 00 00
00 1a 00 00 00 00 00 00 00 00 00 00 00 00 00 e3

00 ff ff ff ff ff ff 00 24 62 00 32 45 54 00 00
10 1c 01 04 a5 46 27 78 3f 61 50 a6 56 50 a0 26
0d 50 54 a7 6f 80 d1 c0 81 c0 81 00 81 80 a9 c0
b3 00 95 00 71 40 90 e2 00 a0 a0 a0 28 50 30 20
35 00 00 b0 31 00 00 1a 00 00 00 ff 00 4e 41 0a
20 20 20 20 20 20 20 20 20 20 00 00 00 fd 00 30
90 de de 3c 01 0a 20 20 20 20 20 20 00 00 00 fc
00 44 50 31 0a 20 20 20 20 20 20 20 20 20 01 6d

02 03 18 f1 4b 01 02 03 04 05 90 11 12 13 14 1f
23 09 07 07 83 01 00 00 56 5e 00 a0 a0 a0 28 50
30 20 35 00 00 b0 31 00 00 1e db 58 00 a0 50 00
49 40 30 20 37 00 80 33 11 00 00 1a cf 36 00 a0
40 00 37 30 30 20 34 00 33 e6 10 00 00 1a 07 82
80 50 70 38 4d 40 08 20 f8 0c 56 50 21 00 00 1a
b8 22 20 a0 30 58 2b 20 30 20 34 00 f0 b4 00 00
00 1a 00 00 00 00 00 00 00 00 00 00 00 00 00 e3

----------------

Block 0, Base EDID:
  EDID Structure Version & Revision: 1.4
  Vendor & Product Identification:
    Manufacturer: ICB
    Model: 12800
    Serial Number: ...
    Made in: week 16 of 2018
  Basic Display Parameters & Features:
    Digital display
    Bits per primary color channel: 8
    DisplayPort interface
    Maximum image size: 70 cm x 39 cm
    Gamma: 2.20
    DPMS levels: Off
    Supported color formats: RGB 4:4:4, YCrCb 4:4:4, YCrCb 4:2:2
    Default (sRGB) color space is primary color space
    First detailed timing includes the native pixel format and preferred refresh rate
    Display is continuous frequency
  Color Characteristics:
    Red  : 0.6494, 0.3378
    Green: 0.3125, 0.6259
    Blue : 0.1494, 0.0517
    White: 0.3125, 0.3281
  Established Timings I & II:
    IBM     :   720x400    70.081663 Hz   9:5     31.467 kHz     28.320000 MHz
    DMT 0x04:   640x480    59.940476 Hz   4:3     31.469 kHz     25.175000 MHz
    DMT 0x06:   640x480    75.000000 Hz   4:3     37.500 kHz     31.500000 MHz
    DMT 0x08:   800x600    56.250000 Hz   4:3     35.156 kHz     36.000000 MHz
    DMT 0x09:   800x600    60.316541 Hz   4:3     37.879 kHz     40.000000 MHz
    DMT 0x0b:   800x600    75.000000 Hz   4:3     46.875 kHz     49.500000 MHz
    Apple   :   832x624    74.551266 Hz   4:3     49.726 kHz     57.284000 MHz
    DMT 0x10:  1024x768    60.003840 Hz   4:3     48.363 kHz     65.000000 MHz
    DMT 0x11:  1024x768    70.069359 Hz   4:3     56.476 kHz     75.000000 MHz
    DMT 0x12:  1024x768    75.028582 Hz   4:3     60.023 kHz     78.750000 MHz
    DMT 0x24:  1280x1024   75.024675 Hz   5:4     79.976 kHz    135.000000 MHz
    Apple   :  1152x870    75.061550 Hz 192:145   68.681 kHz    100.000000 MHz
  Standard Timings:
    DMT 0x52:  1920x1080   60.000000 Hz  16:9     67.500 kHz    148.500000 MHz
    DMT 0x55:  1280x720    60.000000 Hz  16:9     45.000 kHz     74.250000 MHz
    DMT 0x1c:  1280x800    59.810326 Hz  16:10    49.702 kHz     83.500000 MHz
    DMT 0x23:  1280x1024   60.019740 Hz   5:4     63.981 kHz    108.000000 MHz
    DMT 0x53:  1600x900    60.000000 Hz  16:9     60.000 kHz    108.000000 MHz (RB)
    DMT 0x3a:  1680x1050   59.954250 Hz  16:10    65.290 kHz    146.250000 MHz
    DMT 0x2f:  1440x900    59.887445 Hz  16:10    55.935 kHz    106.500000 MHz
    GTF     :  1152x864    60.000000 Hz   4:3     53.700 kHz     81.624000 MHz
  Detailed Timing Descriptors:
    DTD  1:  2560x1440  144.077901 Hz  16:9    213.235 kHz    580.000000 MHz (768 mm x 432 mm)
                  Hfront   48 Hsync  32 Hback   80 Hpol P
                  Vfront    3 Vsync   5 Vback   32 Vpol N
    Display Product Serial Number: ...
    Display Range Limits:
      Monitor ranges (Bare Limits): 48-144 Hz V, 222-222 kHz H, max dotclock 600 MHz
    Display Product Name: 'DP1'
  Extension blocks: 1
Checksum: 0x6d

----------------

Block 1, CTA-861 Extension Block:
  Revision: 3
  Underscans IT Video Formats by default
  Basic audio support
  Supports YCbCr 4:4:4
  Supports YCbCr 4:2:2
  Native detailed modes: 1
  Video Data Block:
    VIC   1:   640x480    59.940476 Hz   4:3     31.469 kHz     25.175000 MHz
    VIC   2:   720x480    59.940060 Hz   4:3     31.469 kHz     27.000000 MHz
    VIC   3:   720x480    59.940060 Hz  16:9     31.469 kHz     27.000000 MHz
    VIC   4:  1280x720    60.000000 Hz  16:9     45.000 kHz     74.250000 MHz
    VIC   5:  1920x1080i  60.000000 Hz  16:9     33.750 kHz     74.250000 MHz
    VIC  16:  1920x1080   60.000000 Hz  16:9     67.500 kHz    148.500000 MHz (native)
    VIC  17:   720x576    50.000000 Hz   4:3     31.250 kHz     27.000000 MHz
    VIC  18:   720x576    50.000000 Hz  16:9     31.250 kHz     27.000000 MHz
    VIC  19:  1280x720    50.000000 Hz  16:9     37.500 kHz     74.250000 MHz
    VIC  20:  1920x1080i  50.000000 Hz  16:9     28.125 kHz     74.250000 MHz
    VIC  31:  1920x1080   50.000000 Hz  16:9     56.250 kHz    148.500000 MHz
  Audio Data Block:
    Linear PCM:
      Max channels: 2
      Supported sample rates (kHz): 48 44.1 32
      Supported sample sizes (bits): 24 20 16
  Speaker Allocation Data Block:
    FL/FR - Front Left/Right
  Detailed Timing Descriptors:
    DTD  2:  2560x1440   59.991057 Hz  16:9     88.787 kHz    241.500000 MHz (768 mm x 432 mm)
                  Hfront   48 Hsync  32 Hback   80 Hpol P
                  Vfront    3 Vsync   5 Vback   32 Vpol P
    DTD  3:  1280x1024  143.997518 Hz   5:4    157.965 kHz    227.470000 MHz (384 mm x 307 mm)
                  Hfront   48 Hsync  32 Hback   80 Hpol P
                  Vfront    3 Vsync   7 Vback   63 Vpol N
    DTD  4:  1024x768   143.991577 Hz   4:3    118.505 kHz    140.310000 MHz (307 mm x 230 mm)
                  Hfront   48 Hsync  32 Hback   80 Hpol P
                  Vfront    3 Vsync   4 Vback   48 Vpol N
    DTD  5:  1920x1080  143.850475 Hz  16:9    166.435 kHz    332.870000 MHz (598 mm x 336 mm)
                  Hfront    8 Hsync  32 Hback   40 Hpol P
                  Vfront   63 Vsync   8 Vback    6 Vpol N
    DTD  6:   800x600   143.986522 Hz   4:3     92.583 kHz     88.880000 MHz (240 mm x 180 mm)
                  Hfront   48 Hsync  32 Hback   80 Hpol P
                  Vfront    3 Vsync   4 Vback   36 Vpol N
Checksum: 0xe3  Unused space in Extension Block: 13 bytes

----------------

Block 2, Unknown EDID Extension Block 0x00:
  00 ff ff ff ff ff ff 00 24 62 00 32 45 54 00 00 '........$b.2ET..'
  10 1c 01 04 a5 46 27 78 3f 61 50 a6 56 50 a0 26 '.....F'x?aP.VP.&'
  0d 50 54 a7 6f 80 d1 c0 81 c0 81 00 81 80 a9 c0 '.PT.o...........'
  b3 00 95 00 71 40 90 e2 00 a0 a0 a0 28 50 30 20 '....q@......(P0 '
  35 00 00 b0 31 00 00 1a 00 00 00 ff 00 4e 41 0a '5...1........NA.'
  20 20 20 20 20 20 20 20 20 20 00 00 00 fd 00 30 '          .....0'
  90 de de 3c 01 0a 20 20 20 20 20 20 00 00 00 fc '...<..      ....'
  00 44 50 31 0a 20 20 20 20 20 20 20 20 20 01 6d '.DP1.         .m'
Checksum: 0x6d

----------------

Block 3, CTA-861 Extension Block:
  Revision: 3
  Underscans IT Video Formats by default
  Basic audio support
  Supports YCbCr 4:4:4
  Supports YCbCr 4:2:2
  Native detailed modes: 1
  Video Data Block:
    VIC   1:   640x480    59.940476 Hz   4:3     31.469 kHz     25.175000 MHz
    VIC   2:   720x480    59.940060 Hz   4:3     31.469 kHz     27.000000 MHz
    VIC   3:   720x480    59.940060 Hz  16:9     31.469 kHz     27.000000 MHz
    VIC   4:  1280x720    60.000000 Hz  16:9     45.000 kHz     74.250000 MHz
    VIC   5:  1920x1080i  60.000000 Hz  16:9     33.750 kHz     74.250000 MHz
    VIC  16:  1920x1080   60.000000 Hz  16:9     67.500 kHz    148.500000 MHz (native)
    VIC  17:   720x576    50.000000 Hz   4:3     31.250 kHz     27.000000 MHz
    VIC  18:   720x576    50.000000 Hz  16:9     31.250 kHz     27.000000 MHz
    VIC  19:  1280x720    50.000000 Hz  16:9     37.500 kHz     74.250000 MHz
    VIC  20:  1920x1080i  50.000000 Hz  16:9     28.125 kHz     74.250000 MHz
    VIC  31:  1920x1080   50.000000 Hz  16:9     56.250 kHz    148.500000 MHz
  Audio Data Block:
    Linear PCM:
      Max channels: 2
      Supported sample rates (kHz): 48 44.1 32
      Supported sample sizes (bits): 24 20 16
  Speaker Allocation Data Block:
    FL/FR - Front Left/Right
  Detailed Timing Descriptors:
    DTD  7:  2560x1440   59.991057 Hz  16:9     88.787 kHz    241.500000 MHz (768 mm x 432 mm)
                  Hfront   48 Hsync  32 Hback   80 Hpol P
                  Vfront    3 Vsync   5 Vback   32 Vpol P
    DTD  8:  1280x1024  143.997518 Hz   5:4    157.965 kHz    227.470000 MHz (384 mm x 307 mm)
                  Hfront   48 Hsync  32 Hback   80 Hpol P
                  Vfront    3 Vsync   7 Vback   63 Vpol N
    DTD  9:  1024x768   143.991577 Hz   4:3    118.505 kHz    140.310000 MHz (307 mm x 230 mm)
                  Hfront   48 Hsync  32 Hback   80 Hpol P
                  Vfront    3 Vsync   4 Vback   48 Vpol N
    DTD 10:  1920x1080  143.850475 Hz  16:9    166.435 kHz    332.870000 MHz (598 mm x 336 mm)
                  Hfront    8 Hsync  32 Hback   40 Hpol P
                  Vfront   63 Vsync   8 Vback    6 Vpol N
    DTD 11:   800x600   143.986522 Hz   4:3     92.583 kHz     88.880000 MHz (240 mm x 180 mm)
                  Hfront   48 Hsync  32 Hback   80 Hpol P
                  Vfront    3 Vsync   4 Vback   36 Vpol N
Checksum: 0xe3  Unused space in Extension Block: 13 bytes

----------------

Warnings:

Block 1, CTA-861 Extension Block:
  Display Product Serial Number is set, so the Serial Number in the Base EDID should be 0.
Block 3, CTA-861 Extension Block:
  Display Product Serial Number is set, so the Serial Number in the Base EDID should be 0.
EDID:
  Base EDID: Some timings are out of range of the Monitor Ranges:
    Horizontal Freq: 28.125 - 213.235 kHz (Monitor: 222.000 - 222.000 kHz)

Failures:

Block 0, Base EDID:
  Basic Display Parameters & Features: sRGB is signaled, but the chromaticities do not match.
  Detailed Timing Descriptor #1: Mismatch of image size 768x432 mm vs display size 700x390 mm.
Block 1, CTA-861 Extension Block:
  Detailed Timing Descriptor #2: Mismatch of image size 768x432 mm vs display size 700x390 mm.
  Detailed Timing Descriptor #3: Mismatch of image size 384x307 mm vs display size 700x390 mm.
  Detailed Timing Descriptor #4: Mismatch of image size 307x230 mm vs display size 700x390 mm.
  Detailed Timing Descriptor #5: Mismatch of image size 598x336 mm vs display size 700x390 mm.
  Detailed Timing Descriptor #6: Mismatch of image size 240x180 mm vs display size 700x390 mm.
  Missing VCDB, needed for Set Selectable RGB Quantization to avoid interop issues.
Block 2, Base EDID:
  Unknown Extension Block.
Block 3, CTA-861 Extension Block:
  Video Data Block: Duplicate VIC 1.
  Video Data Block: Duplicate VIC 2.
  Video Data Block: Duplicate VIC 3.
  Video Data Block: Duplicate VIC 4.
  Video Data Block: Duplicate VIC 5.
  Video Data Block: Duplicate VIC 16.
  Video Data Block: Duplicate VIC 17.
  Video Data Block: Duplicate VIC 18.
  Video Data Block: Duplicate VIC 19.
  Video Data Block: Duplicate VIC 20.
  Video Data Block: Duplicate VIC 31.
  Speaker Allocation Data Block: Only one instance of this Data Block is allowed.
  Detailed Timing Descriptor #7: Mismatch of image size 768x432 mm vs display size 700x390 mm.
  Detailed Timing Descriptor #8: Mismatch of image size 384x307 mm vs display size 700x390 mm.
  Detailed Timing Descriptor #9: Mismatch of image size 307x230 mm vs display size 700x390 mm.
  Detailed Timing Descriptor #10: Mismatch of image size 598x336 mm vs display size 700x390 mm.
  Detailed Timing Descriptor #11: Mismatch of image size 240x180 mm vs display size 700x390 mm.
  Missing VCDB, needed for Set Selectable RGB Quantization to avoid interop issues.
EDID:
  Base EDID: The DTD max image size is 768x432mm, which is larger than the display size 700.0x390.0mm.
  Base EDID: EDID specified 1 extension block(s), but found 3 extension block(s).
  CTA-861: Native progressive timings are a mix of several resolutions.

EDID conformity: FAIL
