
EDID (hex):
00ffffffffffff000469e91945980100
2515010308291778eafc55a4554d9d25
125054bdee0081c00101010101010101
010101010101662156aa51001e30468f
33009ae61000001e000000fd00304c26
3e09000a202020202020000000fc0041
5355532056573139300a2020000000ff
0042394c4d54463130343531370a006a

Extracted contents:
header:          00 ff ff ff ff ff ff 00
serial number:   04 69 e9 19 45 98 01 00 25 15
version:         01 03
basic params:    08 29 17 78 ea
chroma info:     fc 55 a4 55 4d 9d 25 12 50 54
established:     bd ee 00
standard:        81 c0 01 01 01 01 01 01 01 01 01 01 01 01 01 01
descriptor 1:    66 21 56 aa 51 00 1e 30 46 8f 33 00 9a e6 10 00 00 1e
descriptor 2:    00 00 00 fd 00 30 4c 26 3e 09 00 0a 20 20 20 20 20 20
descriptor 3:    00 00 00 fc 00 41 53 55 53 20 56 57 31 39 30 0a 20 20
descriptor 4:    00 00 00 ff 00 42 39 4c 4d 54 46 31 30 34 35 31 37 0a
extensions:      00
checksum:        6a

EDID version: 1.3
Manufacturer: ACI Model 19e9 Serial Number --
Made in week 37 of 2011
Analog display, Input voltage level: 0.7/0.3 V
Sync: Separate 
Maximum image size: 41 cm x 23 cm
Gamma: 2.20
DPMS levels: Standby Suspend Off
RGB color display
First detailed timing is preferred timing
Display x,y Chromaticity:
  Red:   0.6435, 0.3349
  Green: 0.3037, 0.6132
  Blue:  0.1455, 0.0712
  White: 0.3134, 0.3291
Established timings supported:
  720x400@70Hz 9:5 HorFreq: 31469 Hz Clock: 28.320 MHz
  640x480@60Hz 4:3 HorFreq: 31469 Hz Clock: 25.175 MHz
  640x480@67Hz 4:3 HorFreq: 35000 Hz Clock: 30.240 MHz
  640x480@72Hz 4:3 HorFreq: 37900 Hz Clock: 31.500 MHz
  640x480@75Hz 4:3 HorFreq: 37500 Hz Clock: 31.500 MHz
  800x600@60Hz 4:3 HorFreq: 37900 Hz Clock: 40.000 MHz
  800x600@72Hz 4:3 HorFreq: 48100 Hz Clock: 50.000 MHz
  800x600@75Hz 4:3 HorFreq: 46900 Hz Clock: 49.500 MHz
  832x624@75Hz 4:3 HorFreq: 49726 Hz Clock: 57.284 MHz
  1024x768@60Hz 4:3 HorFreq: 48400 Hz Clock: 65.000 MHz
  1024x768@70Hz 4:3 HorFreq: 56500 Hz Clock: 75.000 MHz
  1024x768@75Hz 4:3 HorFreq: 60000 Hz Clock: 78.750 MHz
Standard timings supported:
  1280x720@60Hz 16:9
Detailed mode: Clock 85.500 MHz, 410 mm x 230 mm
               1366 1436 1579 1792 hborder 0
                768  771  774  798 vborder 0
               +hsync +vsync 
               VertFreq: 59 Hz, HorFreq: 47712 Hz
Monitor ranges (GTF): 48-76Hz V, 38-62kHz H, max dotclock 90MHz
Monitor name: ASUS VW190
Serial number: --
Checksum: 0x6a (valid)
One or more of the timings is out of range of the Monitor Ranges:
  Vertical Freq: 59 - 75 Hz
  Horizontal Freq: 31469 - 60000 Hz
  Maximum Clock: 85.500 MHz
