edid-decode (hex):

00 ff ff ff ff ff ff 00 09 e5 df 05 00 00 00 00
01 16 01 04 95 1d 10 78 0a f8 90 9e 59 55 9c 26
1a 50 54 00 00 00 01 01 01 01 01 01 01 01 01 01
01 01 01 01 01 01 3e 1c 56 a0 50 00 16 30 30 20
36 00 25 a5 10 00 00 1a d4 12 56 a0 50 00 16 30
30 20 36 00 25 a5 10 00 00 1a 00 00 00 fe 00 42
4f 45 20 48 46 0a 20 20 20 20 20 20 00 00 00 fe
00 48 42 31 33 33 57 58 31 2d 34 30 32 0a 00 0c

----------------

Block 0, Base EDID:
  EDID Structure Version & Revision: 1.4
  Vendor & Product Identification:
    Manufacturer: BOE
    Model: 1503
    Made in: week 1 of 2012
  Basic Display Parameters & Features:
    Digital display
    Bits per primary color channel: 6
    DisplayPort interface
    Maximum image size: 29 cm x 16 cm
    Gamma: 2.20
    Supported color formats: RGB 4:4:4, YCrCb 4:4:4
    First detailed timing includes the native pixel format and preferred refresh rate
  Color Characteristics:
    Red  : 0.6201, 0.3505
    Green: 0.3339, 0.6093
    Blue : 0.1503, 0.1025
    White: 0.3125, 0.3281
  Established Timings I & II: none
  Standard Timings: none
  Detailed Timing Descriptors:
    DTD 1:  1366x768    59.973 Hz 683:384  47.379 kHz  72.300 MHz (293 mm x 165 mm)
                 Hfront   48 Hsync  32 Hback  80 Hpol P
                 Vfront    3 Vsync   6 Vback  13 Vpol N
    DTD 2:  1366x768    39.982 Hz 683:384  31.586 kHz  48.200 MHz (293 mm x 165 mm)
                 Hfront   48 Hsync  32 Hback  80 Hpol P
                 Vfront    3 Vsync   6 Vback  13 Vpol N
    Alphanumeric Data String: 'BOE HF'
    Alphanumeric Data String: 'HB133WX1-402'
Checksum: 0xc

----------------

Failures:

Block 0, Base EDID:
  Missing Display Product Name.

EDID conformity: FAIL
