
EDID (hex):
00ffffffffffff0031f3270000000000
101b0104b53c21783b9461a953469723
1d5054a10800d1c081c0a9c0d1008180
a940010101014dd000a0f0703e803020
3500584a2100001a000000fd003448a2
a23c010a202020202020000000fc0044
50312d32373134554420200a000000ff
002020202020202020202020200a0147
02031cf14fe1605f5a101f0413051411
12010203230907078301000004740030
f2705a80b0588a00584a2100001a0000
00000000000000000000000000000000
00000000000000000000000000000000
00000000000000000000000000000000
00000000000000000000000000000000
0000000000000000000000000000000c

Extracted contents:
header:          00 ff ff ff ff ff ff 00
serial number:   31 f3 27 00 00 00 00 00 10 1b
version:         01 04
basic params:    b5 3c 21 78 3b
chroma info:     94 61 a9 53 46 97 23 1d 50 54
established:     a1 08 00
standard:        d1 c0 81 c0 a9 c0 d1 00 81 80 a9 40 01 01 01 01
descriptor 1:    4d d0 00 a0 f0 70 3e 80 30 20 35 00 58 4a 21 00 00 1a
descriptor 2:    00 00 00 fd 00 34 48 a2 a2 3c 01 0a 20 20 20 20 20 20
descriptor 3:    00 00 00 fc 00 44 50 31 2d 32 37 31 34 55 44 20 20 0a
descriptor 4:    00 00 00 ff 00 20 20 20 20 20 20 20 20 20 20 20 20 0a
extensions:      01
checksum:        47

EDID version: 1.4
Manufacturer: LOS Model 27 Serial Number --
Made in week 16 of 2017
Digital display
10 bits per primary color channel
DisplayPort interface
Maximum image size: 60 cm x 33 cm
Gamma: 2.20
DPMS levels: Off
Supported color formats: RGB 4:4:4, YCrCb 4:4:4, YCrCb 4:2:2
First detailed timing includes the native pixel format and preferred refresh rate
Display is continuous frequency
Display x,y Chromaticity:
  Red:   0.6621, 0.3251
  Green: 0.2744, 0.5898
  Blue:  0.1376, 0.1152
  White: 0.3125, 0.3291
Established timings supported:
  720x400@70Hz 9:5 HorFreq: 31469 Hz Clock: 28.320 MHz
  640x480@60Hz 4:3 HorFreq: 31469 Hz Clock: 25.175 MHz
  800x600@60Hz 4:3 HorFreq: 37900 Hz Clock: 40.000 MHz
  1024x768@60Hz 4:3 HorFreq: 48400 Hz Clock: 65.000 MHz
Standard timings supported:
  1920x1080@60Hz 16:9
  1280x720@60Hz 16:9
  1600x900@60Hz 16:9
  1920x1200@60Hz 16:10 HorFreq: 74000 Hz Clock: 154.000 MHz
  1280x1024@60Hz 5:4 HorFreq: 64000 Hz Clock: 108.000 MHz
  1600x1200@60Hz 4:3 HorFreq: 75000 Hz Clock: 162.000 MHz
Detailed mode: Clock 533.250 MHz, 600 mm x 330 mm
               3840 3888 3920 4000 hborder 0
               2160 2163 2168 2222 vborder 0
               +hsync -vsync 
               VertFreq: 59 Hz, HorFreq: 133312 Hz
Monitor ranges (bare limits): 52-72Hz V, 162-162kHz H, max dotclock 600MHz
Monitor name: DP1-2714UD  
Serial number:             
-- 1 extension blocks
Checksum: 0x47 (valid)

CTA extension block
Extension version: 3
24 bytes of CTA data
  Video data block
    VIC 225 Unknown mode  HorFreq: 0 Hz Clock: 0.000 MHz
    VIC  96 3840x2160@50Hz 16:9  HorFreq: 112500 Hz Clock: 594.000 MHz
    VIC  95 3840x2160@30Hz 16:9  HorFreq: 67500 Hz Clock: 297.000 MHz
    VIC  90 2560x1080@60Hz 64:27  HorFreq: 66000 Hz Clock: 198.000 MHz
    VIC  16 1920x1080@60Hz 16:9  HorFreq: 67500 Hz Clock: 148.500 MHz
    VIC  31 1920x1080@50Hz 16:9  HorFreq: 56250 Hz Clock: 148.500 MHz
    VIC   4 1280x720@60Hz 16:9  HorFreq: 45000 Hz Clock: 74.250 MHz
    VIC  19 1280x720@50Hz 16:9  HorFreq: 37500 Hz Clock: 74.250 MHz
    VIC   5 1920x1080i@60Hz 16:9  HorFreq: 33750 Hz Clock: 74.250 MHz
    VIC  20 1920x1080i@50Hz 16:9  HorFreq: 28125 Hz Clock: 74.250 MHz
    VIC  17 720x576@50Hz 4:3  HorFreq: 31250 Hz Clock: 27.000 MHz
    VIC  18 720x576@50Hz 16:9  HorFreq: 31250 Hz Clock: 27.000 MHz
    VIC   1 640x480@60Hz 4:3  HorFreq: 31469 Hz Clock: 25.175 MHz
    VIC   2 720x480@60Hz 4:3  HorFreq: 31469 Hz Clock: 27.000 MHz
    VIC   3 720x480@60Hz 16:9  HorFreq: 31469 Hz Clock: 27.000 MHz
  Audio data block
    Linear PCM, max channels 2
      Supported sample rates (kHz): 48 44.1 32
      Supported sample sizes (bits): 24 20 16
  Speaker allocation data block
    Speaker map:
      FL/FR - Front Left/Right
Underscans PC formats by default
Basic audio support
Supports YCbCr 4:4:4
Supports YCbCr 4:2:2
1 native detailed modes
Detailed mode: Clock 297.000 MHz, 600 mm x 330 mm
               3840 4016 4104 4400 hborder 0
               2160 2168 2178 2250 vborder 0
               +hsync -vsync 
               VertFreq: 30 Hz, HorFreq: 67500 Hz
Checksum: 0xc (valid)

Warning: One or more of the timings is out of range of the Monitor Ranges:
  Vertical Freq: 30 - 70 Hz
  Horizontal Freq: 28125 - 133312 Hz
  Maximum Clock: 594.000 MHz
