edid-decode (hex):

00 ff ff ff ff ff ff 00 0d af 24 15 00 00 00 00
09 10 01 03 80 21 15 78 0a c6 a9 9a 57 4e 85 26
1e 50 52 00 00 00 01 01 01 01 01 01 01 01 01 01
01 01 01 01 01 01 11 1b 00 82 50 20 13 30 27 1a
24 00 4b cf 10 00 00 18 00 00 00 fe 00 4e 31 35
34 49 32 2d 4c 30 31 0a 20 20 00 00 00 fe 00 43
4d 4f 0a 20 20 20 20 20 20 20 20 20 00 00 00 fe
00 4e 31 35 34 49 32 2d 4c 30 31 0a 20 20 00 7a

----------------

Block 0, Base EDID:
  EDID Structure Version & Revision: 1.3
  Vendor & Product Identification:
    Manufacturer: CMO
    Model: 5412
    Made in: week 9 of 2006
  Basic Display Parameters & Features:
    Digital display
    Maximum image size: 33 cm x 21 cm
    Gamma: 2.20
    RGB color display
    First detailed timing is the preferred timing
  Color Characteristics:
    Red  : 0.6044, 0.3398
    Green: 0.3056, 0.5214
    Blue : 0.1503, 0.1191
    White: 0.3144, 0.3212
  Established Timings I & II: none
  Standard Timings: none
  Detailed Timing Descriptors:
    DTD 1:  1280x800    60.002251 Hz   8:5     49.142 kHz     69.290000 MHz (331 mm x 207 mm)
                 Hfront   39 Hsync  26 Hback   65 Hpol N
                 Vfront    2 Vsync   4 Vback   13 Vpol N
    Alphanumeric Data String: 'N154I2-L01'
    Alphanumeric Data String: 'CMO'
    Alphanumeric Data String: 'N154I2-L01'
Checksum: 0x7a

----------------

Failures:

Block 0, Base EDID:
  Missing Display Product Name.
  Missing Display Range Limits Descriptor.

EDID conformity: FAIL
