edid-decode (hex):

00 ff ff ff ff ff ff 00 09 e5 84 08 00 00 00 00
01 1d 01 04 a5 26 15 78 02 de 50 a3 54 4c 99 26
0f 50 54 00 00 00 01 01 01 01 01 01 01 01 01 01
01 01 01 01 01 01 67 da 80 a0 70 38 28 40 6c 30
aa 00 7e d7 10 00 00 1a 9a 36 80 a0 70 38 28 40
6c 30 aa 00 7e d7 10 00 00 1a 00 00 00 fe 00 42
4f 45 20 48 46 0a 20 20 20 20 20 20 00 00 00 fe
00 4e 45 31 37 33 46 48 4d 2d 4e 5a 31 0a 00 be

----------------

Block 0, Base EDID:
  EDID Structure Version & Revision: 1.4
  Vendor & Product Identification:
    Manufacturer: BOE
    Model: 2180
    Made in: week 1 of 2019
  Basic Display Parameters & Features:
    Digital display
    Bits per primary color channel: 8
    DisplayPort interface
    Maximum image size: 38 cm x 21 cm
    Gamma: 2.20
    Supported color formats: RGB 4:4:4
    First detailed timing includes the native pixel format and preferred refresh rate
  Color Characteristics:
    Red  : 0.6396, 0.3291
    Green: 0.2998, 0.5996
    Blue : 0.1494, 0.0595
    White: 0.3125, 0.3281
  Established Timings I & II: none
  Standard Timings: none
  Detailed Timing Descriptors:
    DTD 1:  1920x1080  240.002576 Hz  16:9    268.803 kHz    559.110000 MHz (382 mm x 215 mm)
                 Hfront  108 Hsync  48 Hback    4 Hpol P
                 Vfront   10 Vsync  10 Vback   20 Vpol N
    DTD 2:  1920x1080   60.001717 Hz  16:9     67.202 kHz    139.780000 MHz (382 mm x 215 mm)
                 Hfront  108 Hsync  48 Hback    4 Hpol P
                 Vfront   10 Vsync  10 Vback   20 Vpol N
    Alphanumeric Data String: 'BOE HF'
    Alphanumeric Data String: 'NE173FHM-NZ1'
Checksum: 0xbe

----------------

Failures:

Block 0, Base EDID:
  Missing Display Product Name.

EDID conformity: FAIL
