edid-decode (hex):

00 ff ff ff ff ff ff 00 0d af 07 18 00 00 00 00
02 13 01 03 80 29 17 78 0a e6 05 9f 5c 56 9b 2a
16 50 54 00 00 00 01 01 01 01 01 01 01 01 01 01
01 01 01 01 01 01 29 36 80 a0 70 38 1f 40 30 20
35 00 98 e6 10 00 00 18 00 00 00 fe 00 4e 31 38
34 48 36 2d 4c 30 32 0a 20 20 00 00 00 fe 00 43
4d 4f 0a 20 20 20 20 20 20 20 20 20 00 00 00 fe
00 4e 31 38 34 48 36 2d 4c 30 32 0a 20 20 00 35

----------------

Block 0, Base EDID:
  EDID Structure Version & Revision: 1.3
  Vendor & Product Identification:
    Manufacturer: CMO
    Model: 6151
    Made in: week 2 of 2009
  Basic Display Parameters & Features:
    Digital display
    Maximum image size: 41 cm x 23 cm
    Gamma: 2.20
    RGB color display
    First detailed timing is the preferred timing
  Color Characteristics:
    Red  : 0.6240, 0.3613
    Green: 0.3369, 0.6074
    Blue : 0.1640, 0.0859
    White: 0.3134, 0.3291
  Established Timings I & II: none
  Standard Timings: none
  Detailed Timing Descriptors:
    DTD 1:  1920x1080   59.998788 Hz  16:9     66.659 kHz    138.650000 MHz (408 mm x 230 mm)
                 Hfront   48 Hsync  32 Hback   80 Hpol N
                 Vfront    3 Vsync   5 Vback   23 Vpol N
    Alphanumeric Data String: 'N184H6-L02'
    Alphanumeric Data String: 'CMO'
    Alphanumeric Data String: 'N184H6-L02'
Checksum: 0x35

----------------

Failures:

Block 0, Base EDID:
  Missing Display Product Name.
  Missing Display Range Limits Descriptor.

EDID conformity: FAIL
