edid-decode (hex):

00 ff ff ff ff ff ff 00 09 e5 c3 09 00 00 00 00
2c 1e 01 04 95 1a 0e 78 0a ae 95 94 5b 57 94 29
1c 50 54 00 00 00 01 01 01 01 01 01 01 01 01 01
01 01 01 01 01 01 c7 1d 56 e2 50 00 1e 30 30 20
35 00 00 90 10 00 00 1a d2 17 56 e2 50 00 1e 30
30 20 35 00 00 90 10 00 00 1a 00 00 00 fe 00 38
33 36 58 32 80 4e 54 31 31 4e 32 31 00 00 00 00
00 00 41 21 96 00 00 00 00 09 01 0a 20 20 00 07

----------------

Block 0, Base EDID:
  EDID Structure Version & Revision: 1.4
  Vendor & Product Identification:
    Manufacturer: BOE
    Model: 2499
    Made in: week 44 of 2020
  Basic Display Parameters & Features:
    Digital display
    Bits per primary color channel: 6
    DisplayPort interface
    Maximum image size: 26 cm x 14 cm
    Gamma: 2.20
    Supported color formats: RGB 4:4:4, YCrCb 4:4:4
    First detailed timing includes the native pixel format and preferred refresh rate
  Color Characteristics:
    Red  : 0.5800, 0.3574
    Green: 0.3427, 0.5800
    Blue : 0.1621, 0.1103
    White: 0.3134, 0.3291
  Established Timings I & II: none
  Standard Timings: none
  Detailed Timing Descriptors:
    DTD 1:  1366x768    60.003967 Hz 683:384   47.883 kHz     76.230000 MHz (256 mm x 144 mm)
                 Hfront   48 Hsync  32 Hback  146 Hpol P
                 Vfront    3 Vsync   5 Vback   22 Vpol N
    DTD 2:  1366x768    48.000025 Hz 683:384   38.304 kHz     60.980000 MHz (256 mm x 144 mm)
                 Hfront   48 Hsync  32 Hback  146 Hpol P
                 Vfront    3 Vsync   5 Vback   22 Vpol N
    Alphanumeric Data String: '836X2'
    Manufacturer-Specified Display Descriptor (0x00): 00 00 00 00 41 21 96 00 00 00 00 09 01 0a 20 20 '....A!........  '
Checksum: 0x07

----------------

Failures:

Block 0, Base EDID:
  Alphanumeric Data String: Non-printable character.
  Missing Display Product Name.

EDID conformity: FAIL
