
EDID (hex):
00ffffffffffff00593a391001010101
001e0103809b55782ab257a3554d9d27
0e4849250e00d1c001ff01ffff010101
01010101012004740030f2705a80b058
8a0002616300001e023a801871382d40
582c450002616300001e000000fc0056
3730352d48330a2020202020000000fd
00174c0f8c3c000a2020202020200123
020378715f5f645d6210222005040706
0302011112131415161f616065663c3e
5e213f40320907071507505706003d07
c05f7e01677e008301000070030c0010
00383ca05b5b00800102030468d85dc4
0178800302e200ffe305e000e50f0000
e001e3060f01eb0146d0004857329c30
0f8ee5018b8490010000000000000053

Extracted contents:
header:          00 ff ff ff ff ff ff 00
serial number:   59 3a 39 10 01 01 01 01 00 1e
version:         01 03
basic params:    80 9b 55 78 2a
chroma info:     b2 57 a3 55 4d 9d 27 0e 48 49
established:     25 0e 00
standard:        d1 c0 01 ff 01 ff ff 01 01 01 01 01 01 01 01 20
descriptor 1:    04 74 00 30 f2 70 5a 80 b0 58 8a 00 02 61 63 00 00 1e
descriptor 2:    02 3a 80 18 71 38 2d 40 58 2c 45 00 02 61 63 00 00 1e
descriptor 3:    00 00 00 fc 00 56 37 30 35 2d 48 33 0a 20 20 20 20 20
descriptor 4:    00 00 00 fd 00 17 4c 0f 8c 3c 00 0a 20 20 20 20 20 20
extensions:      01
checksum:        23

EDID version: 1.3
Manufacturer: VIZ Model 1039 Serial Number --
Made in year 2020
Digital display
Maximum image size: 155 cm x 85 cm
Gamma: 2.20
DPMS levels: Off
RGB color display
First detailed timing is preferred timing
Display x,y Chromaticity:
  Red:   0.6386, 0.3349
  Green: 0.3007, 0.6152
  Blue:  0.1533, 0.0556
  White: 0.2822, 0.2880
Established timings supported:
  640x480@60Hz 4:3 HorFreq: 31469 Hz Clock: 25.175 MHz
  640x480@75Hz 4:3 HorFreq: 37500 Hz Clock: 31.500 MHz
  800x600@60Hz 4:3 HorFreq: 37900 Hz Clock: 40.000 MHz
  1024x768@60Hz 4:3 HorFreq: 48400 Hz Clock: 65.000 MHz
  1024x768@70Hz 4:3 HorFreq: 56500 Hz Clock: 75.000 MHz
  1024x768@75Hz 4:3 HorFreq: 60000 Hz Clock: 78.750 MHz
Standard timings supported:
  1920x1080@60Hz 16:9
  256x144@123Hz 16:9
  256x144@123Hz 16:9
  2288x1430@61Hz 16:10
  256x160@92Hz 16:10
Detailed mode: Clock 297.000 MHz, 1538 mm x 865 mm
               3840 4016 4104 4400 hborder 0
               2160 2168 2178 2250 vborder 0
               +hsync +vsync 
               VertFreq: 30 Hz, HorFreq: 67500 Hz
Detailed mode: Clock 148.500 MHz, 1538 mm x 865 mm
               1920 2008 2052 2200 hborder 0
               1080 1084 1089 1125 vborder 0
               +hsync +vsync 
               VertFreq: 60 Hz, HorFreq: 67500 Hz
Monitor name: V705-H3
Monitor ranges (GTF): 23-76Hz V, 15-140kHz H, max dotclock 600MHz
Has 1 extension blocks
Checksum: 0x23 (valid)

CTA extension block
Extension version: 3
116 bytes of CTA data
  Video data block
    VIC  95 3840x2160@30Hz 16:9  HorFreq: 67500 Hz Clock: 297.000 MHz
    VIC 100 4096x2160@30Hz 256:135  HorFreq: 67500 Hz Clock: 297.000 MHz
    VIC  93 3840x2160@24Hz 16:9  HorFreq: 54000 Hz Clock: 297.000 MHz
    VIC  98 4096x2160@24Hz 256:135  HorFreq: 54000 Hz Clock: 297.000 MHz
    VIC  16 1920x1080@60Hz 16:9  HorFreq: 67500 Hz Clock: 148.500 MHz
    VIC  34 1920x1080@30Hz 16:9  HorFreq: 33750 Hz Clock: 74.250 MHz
    VIC  32 1920x1080@24Hz 16:9  HorFreq: 27000 Hz Clock: 74.250 MHz
    VIC   5 1920x1080i@60Hz 16:9  HorFreq: 33750 Hz Clock: 74.250 MHz
    VIC   4 1280x720@60Hz 16:9  HorFreq: 45000 Hz Clock: 74.250 MHz
    VIC   7 1440x480i@60Hz 16:9  HorFreq: 15734 Hz Clock: 27.000 MHz
    VIC   6 1440x480i@60Hz 4:3  HorFreq: 15734 Hz Clock: 27.000 MHz
    VIC   3 720x480@60Hz 16:9  HorFreq: 31469 Hz Clock: 27.000 MHz
    VIC   2 720x480@60Hz 4:3  HorFreq: 31469 Hz Clock: 27.000 MHz
    VIC   1 640x480@60Hz 4:3  HorFreq: 31469 Hz Clock: 25.175 MHz
    VIC  17 720x576@50Hz 4:3  HorFreq: 31250 Hz Clock: 27.000 MHz
    VIC  18 720x576@50Hz 16:9  HorFreq: 31250 Hz Clock: 27.000 MHz
    VIC  19 1280x720@50Hz 16:9  HorFreq: 37500 Hz Clock: 74.250 MHz
    VIC  20 1920x1080i@50Hz 16:9  HorFreq: 28125 Hz Clock: 74.250 MHz
    VIC  21 1440x576i@50Hz 4:3  HorFreq: 15625 Hz Clock: 27.000 MHz
    VIC  22 1440x576i@50Hz 16:9  HorFreq: 15625 Hz Clock: 27.000 MHz
    VIC  31 1920x1080@50Hz 16:9  HorFreq: 56250 Hz Clock: 148.500 MHz
    VIC  97 3840x2160@60Hz 16:9  HorFreq: 135000 Hz Clock: 594.000 MHz
    VIC  96 3840x2160@50Hz 16:9  HorFreq: 112500 Hz Clock: 594.000 MHz
    VIC 101 4096x2160@50Hz 256:135  HorFreq: 112500 Hz Clock: 594.000 MHz
    VIC 102 4096x2160@60Hz 256:135  HorFreq: 135000 Hz Clock: 594.000 MHz
    VIC  60 1280x720@24Hz 16:9  HorFreq: 18000 Hz Clock: 59.400 MHz
    VIC  62 1280x720@30Hz 16:9  HorFreq: 22500 Hz Clock: 74.250 MHz
    VIC  94 3840x2160@25Hz 16:9  HorFreq: 56250 Hz Clock: 297.000 MHz
    VIC  33 1920x1080@25Hz 16:9  HorFreq: 28125 Hz Clock: 74.250 MHz
    VIC  63 1920x1080@120Hz 16:9  HorFreq: 135000 Hz Clock: 297.000 MHz
    VIC  64 1920x1080@100Hz 16:9  HorFreq: 112500 Hz Clock: 297.000 MHz
  Audio data block
    Linear PCM, max channels 2
      Supported sample rates (kHz): 48 44.1 32
      Supported sample sizes (bits): 24 20 16
    AC-3, max channels 6
      Supported sample rates (kHz): 48 44.1 32
      Maximum bit rate: 640 kHz
    Dolby Digital+, max channels 8
      Supported sample rates (kHz): 48 44.1
    DTS, max channels 6
      Supported sample rates (kHz): 48 44.1 32
      Maximum bit rate: 1536 kHz
    DTS-HD, max channels 8
      Supported sample rates (kHz): 192 176.4 96 88.2 48 44.1
    MAT (MLP), max channels 8
      Supported sample rates (kHz): 192 176.4 96 88.2 48 44.1
  Speaker allocation data block
    Speaker map:
      FL/FR - Front Left/Right
  Vendor-specific data block, OUI 000c03 (HDMI)
    Source physical address 1.0.0.0
    DC_36bit
    DC_30bit
    DC_Y444
    Maximum TMDS clock: 300MHz
    Video latency: 91
    Audio latency: 91
    Extended HDMI video details:
      HDMI VIC 1 3840x2160@30Hz 16:9 HorFreq: 67500 Hz Clock: 297.000 MHz
      HDMI VIC 2 3840x2160@25Hz 16:9 HorFreq: 56250 Hz Clock: 297.000 MHz
      HDMI VIC 3 3840x2160@24Hz 16:9 HorFreq: 54000 Hz Clock: 297.000 MHz
      HDMI VIC 4 4096x2160@24Hz 256:135 HorFreq: 54000 Hz Clock: 297.000 MHz
  Vendor-specific data block, OUI c45dd8 (HDMI Forum)
    Version: 1
    Maximum TMDS Character Rate: 600MHz
    SCDC Present
    Supports 12-bits/component Deep Color 4:2:0 Pixel Encoding
    Supports 10-bits/component Deep Color 4:2:0 Pixel Encoding
  Extended tag: Video capability data block
    YCbCr quantization: Selectable (via AVI YQ) (1)
    RGB quantization: Selectable (via AVI Q) (1)
    PT scan behaviour: Support both over- and underscan (3)
    IT scan behaviour: Support both over- and underscan (3)
    CE scan behaviour: Support both over- and underscan (3)
  Extended tag: Colorimetry data block
    BT2020cYCC
    BT2020YCC
    BT2020RGB
  Extended tag: YCbCr 4:2:0 capability map data block
    VSD Index 21
    VSD Index 22
    VSD Index 23
    VSD Index 24
  Extended tag: HDR static metadata data block
    Electro optical transfer functions:
      Traditional gamma - SDR luminance range
      Traditional gamma - HDR luminance range
      SMPTE ST2084
      Hybrid Log-Gamma
    Supported static metadata descriptors:
      Static metadata type 1
  Extended tag: Vendor-specific video data block
  Extended tag: Vendor-specific video data block
Basic audio support
Supports YCbCr 4:4:4
Supports YCbCr 4:2:2
1 native detailed modes
Checksum: 0x53 (valid)

One or more of the timings is out of range of the Monitor Ranges:
  Vertical Freq: 24 - 123 Hz
  Horizontal Freq: 15625 - 135000 Hz
  Maximum Clock: 594.000 MHz
