edid-decode (hex):

00 ff ff ff ff ff ff 00 06 10 16 c1 00 00 00 00
20 16 01 04 a5 14 0f 78 06 ef 05 a3 54 4c 99 26
0f 50 54 00 00 00 01 01 01 01 01 01 01 01 01 01
01 01 01 01 01 01 29 50 00 a0 80 00 0d 60 96 05
31 00 c5 94 00 00 00 18 00 00 00 10 00 00 00 00
00 00 00 00 00 00 00 00 00 00 00 00 00 fe 00 30
39 37 4c 31 4a 59 31 32 41 0a 20 20 00 00 00 fc
00 43 6f 6c 6f 72 20 4c 43 44 0a 20 20 20 00 88

----------------

Block 0, Base EDID:
  EDID Structure Version & Revision: 1.4
  Vendor & Product Identification:
    Manufacturer: APP
    Model: 49430
    Made in: week 32 of 2012
  Basic Display Parameters & Features:
    Digital display
    Bits per primary color channel: 8
    DisplayPort interface
    Maximum image size: 20 cm x 15 cm
    Gamma: 2.20
    Supported color formats: RGB 4:4:4
    Default (sRGB) color space is primary color space
    First detailed timing includes the native pixel format and preferred refresh rate
  Color Characteristics:
    Red  : 0.6396, 0.3300
    Green: 0.2998, 0.6005
    Blue : 0.1484, 0.0585
    White: 0.3134, 0.3291
  Established Timings I & II: none
  Standard Timings: none
  Detailed Timing Descriptors:
    DTD 1:  2048x1536   60.000 Hz   4:3    92.939 kHz 205.210 MHz (197 mm x 148 mm)
                 Hfront  150 Hsync   5 Hback   5 Hpol N
                 Vfront    3 Vsync   1 Vback   9 Vpol N
    Dummy Descriptor:
    Alphanumeric Data String: '097L1JY12A'
    Display Product Name: 'Color LCD'
Checksum: 0x88

----------------

Failures:

Block 0, Base EDID:
  Basic Display Parameters & Features: sRGB is signaled, but the chromaticities do not match.

EDID conformity: FAIL
