
EDID (hex):
00ffffffffffff0010ac04f053415030
0f11010380291a78eec125a3564b9927
115054bfef809500714f8180950f0101
0101010101019a29a0d0518422305098
360098ff1000001c000000fd00384b1e
530e000a202020202020000000ff0037
333733313734453050415301000000fc
0044454c4c20534531393857465000f5

Extracted contents:
header:          00 ff ff ff ff ff ff 00
serial number:   10 ac 04 f0 53 41 50 30 0f 11
version:         01 03
basic params:    80 29 1a 78 ee
chroma info:     c1 25 a3 56 4b 99 27 11 50 54
established:     bf ef 80
standard:        95 00 71 4f 81 80 95 0f 01 01 01 01 01 01 01 01
descriptor 1:    9a 29 a0 d0 51 84 22 30 50 98 36 00 98 ff 10 00 00 1c
descriptor 2:    00 00 00 fd 00 38 4b 1e 53 0e 00 0a 20 20 20 20 20 20
descriptor 3:    00 00 00 ff 00 37 33 37 33 31 37 34 45 30 50 41 53 01
descriptor 4:    00 00 00 fc 00 44 45 4c 4c 20 53 45 31 39 38 57 46 50
extensions:      00
checksum:        f5

EDID version: 1.3
Manufacturer: DEL Model f004 Serial Number --
Made in week 15 of 2007
Digital display
Maximum image size: 41 cm x 26 cm
Gamma: 2.20
DPMS levels: Standby Suspend Off
RGB color display
Default (sRGB) color space is primary color space
First detailed timing is preferred timing
Display x,y Chromaticity:
  Red:   0.6396, 0.3359
  Green: 0.2929, 0.5986
  Blue:  0.1523, 0.0683
  White: 0.3134, 0.3291
Established timings supported:
  720x400@70Hz 9:5 HorFreq: 31469 Hz Clock: 28.320 MHz
  640x480@60Hz 4:3 HorFreq: 31469 Hz Clock: 25.175 MHz
  640x480@67Hz 4:3 HorFreq: 35000 Hz Clock: 30.240 MHz
  640x480@72Hz 4:3 HorFreq: 37900 Hz Clock: 31.500 MHz
  640x480@75Hz 4:3 HorFreq: 37500 Hz Clock: 31.500 MHz
  800x600@56Hz 4:3 HorFreq: 35200 Hz Clock: 36.000 MHz
  800x600@60Hz 4:3 HorFreq: 37900 Hz Clock: 40.000 MHz
  800x600@72Hz 4:3 HorFreq: 48100 Hz Clock: 50.000 MHz
  800x600@75Hz 4:3 HorFreq: 46900 Hz Clock: 49.500 MHz
  832x624@75Hz 4:3 HorFreq: 49726 Hz Clock: 57.284 MHz
  1024x768@60Hz 4:3 HorFreq: 48400 Hz Clock: 65.000 MHz
  1024x768@70Hz 4:3 HorFreq: 56500 Hz Clock: 75.000 MHz
  1024x768@75Hz 4:3 HorFreq: 60000 Hz Clock: 78.750 MHz
  1280x1024@75Hz 5:4 HorFreq: 80000 Hz Clock: 135.000 MHz
  1152x870@75Hz 192:145 HorFreq: 67500 Hz Clock: 108.000 MHz
Standard timings supported:
  1440x900@60Hz 16:10 HorFreq: 55500 Hz Clock: 88.750 MHz
  1152x864@75Hz 4:3 HorFreq: 67500 Hz Clock: 108.000 MHz
  1280x1024@60Hz 5:4 HorFreq: 64000 Hz Clock: 108.000 MHz
  1440x900@75Hz 16:10 HorFreq: 82300 Hz Clock: 156.000 MHz
Detailed mode: Clock 106.500 MHz, 408 mm x 255 mm
               1440 1520 1672 1904 hborder 0
                900  903  909  934 vborder 0
               -hsync +vsync 
               VertFreq: 59 Hz, HorFreq: 55934 Hz
Monitor ranges (GTF): 56-75Hz V, 30-83kHz H, max dotclock 140MHz
Serial number: --
Checksum: 0xf5 (valid)
EDID block does NOT conform to EDID 1.3!
	sRGB is signaled, but the chromaticities do not match
	Name descriptor not terminated with a newline
	Detailed block string not properly terminated
One or more of the timings is out of range of the Monitor Ranges:
  Vertical Freq: 56 - 75 Hz
  Horizontal Freq: 31469 - 82300 Hz
  Maximum Clock: 156.000 MHz


