edid-decode (hex):

00 ff ff ff ff ff ff 00 22 67 c3 1a 01 01 01 01
19 13 01 03 0a 33 1d 78 ea c9 a5 a4 56 4b 9d 25
12 50 54 a5 6b 00 81 80 a9 40 95 00 b3 00 01 01
01 01 01 01 01 01 02 3a 80 18 71 38 2d 40 58 2c
45 00 fd 1e 11 00 00 1e 00 00 00 fc 00 48 46 32
33 37 0a 20 20 20 20 20 20 20 00 00 00 fd 00 38
4c 1f 52 12 00 0a 20 20 20 20 20 20 00 00 00 ff
00 39 32 35 52 4a 33 58 59 30 32 33 34 36 00 42

00 ff ff ff ff ff ff 00 22 67 c3 1a 01 01 01 01
19 13 01 03 0a 33 1d 78 ea c9 a5 a4 56 4b 9d 25
12 50 54 a5 6b 00 81 80 a9 40 95 00 b3 00 01 01
01 01 01 01 01 01 02 3a 80 18 71 38 2d 40 58 2c
45 00 fd 1e 11 00 00 1e 00 00 00 fc 00 48 46 32
33 37 0a 20 20 20 20 20 20 20 00 00 00 fd 00 38
4c 1f 52 12 00 0a 20 20 20 20 20 20 00 00 00 ff
00 39 32 35 52 4a 33 58 59 30 32 33 34 36 00 42

----------------

Block 0, Base EDID:
  EDID Structure Version & Revision: 1.3
  Vendor & Product Identification:
    Manufacturer: HSG
    Model: 6851
    Serial Number: ...
    Made in: week 25 of 2009
  Basic Display Parameters & Features:
    Analog display
    Signal Level Standard: 0.700 : 0.300 : 1.000 V p-p
    Blank level equals black level
    Sync: Separate SyncOnGreen
    Maximum image size: 51 cm x 29 cm
    Gamma: 2.20
    DPMS levels: Standby Suspend Off
    RGB color display
    First detailed timing is the preferred timing
  Color Characteristics:
    Red  : 0.6435, 0.3359
    Green: 0.2949, 0.6142
    Blue : 0.1464, 0.0722
    White: 0.3134, 0.3291
  Established Timings I & II:
    IBM     :   720x400    70.081663 Hz   9:5     31.467 kHz     28.320000 MHz
    DMT 0x04:   640x480    59.940476 Hz   4:3     31.469 kHz     25.175000 MHz
    DMT 0x06:   640x480    75.000000 Hz   4:3     37.500 kHz     31.500000 MHz
    DMT 0x09:   800x600    60.316541 Hz   4:3     37.879 kHz     40.000000 MHz
    DMT 0x0b:   800x600    75.000000 Hz   4:3     46.875 kHz     49.500000 MHz
    Apple   :   832x624    74.551266 Hz   4:3     49.726 kHz     57.284000 MHz
    DMT 0x10:  1024x768    60.003840 Hz   4:3     48.363 kHz     65.000000 MHz
    DMT 0x12:  1024x768    75.028582 Hz   4:3     60.023 kHz     78.750000 MHz
    DMT 0x24:  1280x1024   75.024675 Hz   5:4     79.976 kHz    135.000000 MHz
  Standard Timings:
    DMT 0x23:  1280x1024   60.019740 Hz   5:4     63.981 kHz    108.000000 MHz
    DMT 0x33:  1600x1200   60.000000 Hz   4:3     75.000 kHz    162.000000 MHz
    DMT 0x2f:  1440x900    59.887445 Hz  16:10    55.935 kHz    106.500000 MHz
    DMT 0x3a:  1680x1050   59.954250 Hz  16:10    65.290 kHz    146.250000 MHz
  Detailed Timing Descriptors:
    DTD 1:  1920x1080   60.000000 Hz  16:9     67.500 kHz    148.500000 MHz (509 mm x 286 mm)
                 Hfront   88 Hsync  44 Hback  148 Hpol P
                 Vfront    4 Vsync   5 Vback   36 Vpol P
    Display Product Name: 'HF237'
    Display Range Limits:
      Monitor ranges (GTF): 56-76 Hz V, 31-82 kHz H, max dotclock 180 MHz
    Display Product Serial Number: ...
Checksum: 0x42

----------------

Block 1, Unknown EDID Extension Block 0x00:
  00 ff ff ff ff ff ff 00 22 67 c3 1a 01 01 01 01 '........"g......'
  19 13 01 03 0a 33 1d 78 ea c9 a5 a4 56 4b 9d 25 '.....3.x....VK.%'
  12 50 54 a5 6b 00 81 80 a9 40 95 00 b3 00 01 01 '.PT.k....@......'
  01 01 01 01 01 01 02 3a 80 18 71 38 2d 40 58 2c '.......:..q8-@X,'
  45 00 fd 1e 11 00 00 1e 00 00 00 fc 00 48 46 32 'E............HF2'
  33 37 0a 20 20 20 20 20 20 20 00 00 00 fd 00 38 '37.       .....8'
  4c 1f 52 12 00 0a 20 20 20 20 20 20 00 00 00 ff 'L.R...      ....'
  00 39 32 35 52 4a 33 58 59 30 32 33 34 36 00 42 '.925RJ3XY02346.B'
Checksum: 0x42

----------------

Failures:

Block 1, Base EDID:
  Unknown Extension Block.
EDID:
  Base EDID: EDID specified 0 extension block(s), but found 1 extension block(s).

EDID conformity: FAIL
