edid-decode (hex):

00 ff ff ff ff ff ff 00 0d af 30 14 00 00 00 00
0b 11 01 03 80 1e 13 78 0a 09 05 97 57 51 8a 27
20 50 54 00 00 00 01 01 01 01 01 01 01 01 01 01
01 01 01 01 01 01 1c 2a a0 a2 51 84 43 30 7e 54
8f 00 2f be 10 00 00 18 00 00 00 fe 00 4e 31 34
31 43 33 2d 4c 30 31 0a 20 20 00 00 00 fe 00 43
4d 4f 0a 20 20 20 20 20 20 20 20 20 00 00 00 fe
00 4e 31 34 31 43 33 2d 4c 30 31 0a 20 20 00 9c

----------------

Block 0, Base EDID:
  EDID Structure Version & Revision: 1.3
  Vendor & Product Identification:
    Manufacturer: CMO
    Model: 5168
    Made in: week 11 of 2007
  Basic Display Parameters & Features:
    Digital display
    Maximum image size: 30 cm x 19 cm
    Gamma: 2.20
    RGB color display
    First detailed timing is the preferred timing
  Color Characteristics:
    Red  : 0.5898, 0.3398
    Green: 0.3183, 0.5400
    Blue : 0.1523, 0.1250
    White: 0.3134, 0.3291
  Established Timings I & II: none
  Standard Timings: none
  Detailed Timing Descriptors:
    DTD 1:  1440x900    59.999354 Hz   8:5     58.019 kHz    107.800000 MHz (303 mm x 190 mm)
                 Hfront  126 Hsync  84 Hback  208 Hpol N
                 Vfront    8 Vsync  15 Vback   44 Vpol N
    Alphanumeric Data String: 'N141C3-L01'
    Alphanumeric Data String: 'CMO'
    Alphanumeric Data String: 'N141C3-L01'
Checksum: 0x9c

----------------

Failures:

Block 0, Base EDID:
  Missing Display Product Name.
  Missing Display Range Limits Descriptor.

EDID conformity: FAIL
