
EDID (hex):
00ffffffffffff002245010be9030000
32180103804627780a1990a755469824
10494b01080001010101010101010101
010101010101011d007251d01e206e28
5500c48e2100001e011d8018711c1620
582c2500c48e2100009e000000fc0048
414945520a20202020202020000000fd
0016160e5b10000a202020202020012c
020322724d0384050710129314161f20
212223097f078301000067030c002000
b82d8c0ad08a20e02d10103e9600c48e
21000018011d00bc52d01e20b8285540
c48e2100001e011d80d0721c1620102c
2580c48e2100009e8c0ad09020403120
0c405500c48e210000188c0ad08a20e0
2d10103e9600c48e2100001800000006

Extracted contents:
header:          00 ff ff ff ff ff ff 00
serial number:   22 45 01 0b e9 03 00 00 32 18
version:         01 03
basic params:    80 46 27 78 0a
chroma info:     19 90 a7 55 46 98 24 10 49 4b
established:     01 08 00
standard:        01 01 01 01 01 01 01 01 01 01 01 01 01 01 01 01
descriptor 1:    01 1d 00 72 51 d0 1e 20 6e 28 55 00 c4 8e 21 00 00 1e
descriptor 2:    01 1d 80 18 71 1c 16 20 58 2c 25 00 c4 8e 21 00 00 9e
descriptor 3:    00 00 00 fc 00 48 41 49 45 52 0a 20 20 20 20 20 20 20
descriptor 4:    00 00 00 fd 00 16 16 0e 5b 10 00 0a 20 20 20 20 20 20
extensions:      01
checksum:        2c

EDID version: 1.3
Manufacturer: HRE Model b01 Serial Number --
Made in week 50 of 2014
Digital display
Maximum image size: 70 cm x 39 cm
Gamma: 2.20
RGB color display
First detailed timing is preferred timing
Display x,y Chromaticity:
  Red:   0.6523, 0.3330
  Green: 0.2753, 0.5947
  Blue:  0.1425, 0.0634
  White: 0.2851, 0.2929
Established timings supported:
  800x600@60Hz 4:3 HorFreq: 37900 Hz Clock: 40.000 MHz
  1024x768@60Hz 4:3 HorFreq: 48400 Hz Clock: 65.000 MHz
Standard timings supported:
Detailed mode: Clock 74.250 MHz, 708 mm x 398 mm
               1280 1390 1430 1650 hborder 0
                720  725  730  750 vborder 0
               +hsync +vsync 
               VertFreq: 60 Hz, HorFreq: 45000 Hz
Detailed mode: Clock 74.250 MHz, 708 mm x 398 mm
               1920 2008 2052 2200 hborder 0
                540  542  547  562 vborder 0
               +hsync +vsync interlaced 
               VertFreq: 60 Hz, HorFreq: 33750 Hz
Monitor name: HAIER
Monitor ranges (GTF): 22-22Hz V, 14-91kHz H, max dotclock 160MHz
Has 1 extension blocks
Checksum: 0x2c (valid)

CTA extension block
Extension version: 3
30 bytes of CTA data
  Video data block
    VIC   3 720x480@60Hz 16:9  HorFreq: 31469 Hz Clock: 27.000 MHz
    VIC   4 1280x720@60Hz 16:9 (native) HorFreq: 45000 Hz Clock: 74.250 MHz
    VIC   5 1920x1080i@60Hz 16:9  HorFreq: 33750 Hz Clock: 74.250 MHz
    VIC   7 1440x480i@60Hz 16:9  HorFreq: 15734 Hz Clock: 27.000 MHz
    VIC  16 1920x1080@60Hz 16:9  HorFreq: 67500 Hz Clock: 148.500 MHz
    VIC  18 720x576@50Hz 16:9  HorFreq: 31250 Hz Clock: 27.000 MHz
    VIC  19 1280x720@50Hz 16:9 (native) HorFreq: 37500 Hz Clock: 74.250 MHz
    VIC  20 1920x1080i@50Hz 16:9  HorFreq: 28125 Hz Clock: 74.250 MHz
    VIC  22 1440x576i@50Hz 16:9  HorFreq: 15625 Hz Clock: 27.000 MHz
    VIC  31 1920x1080@50Hz 16:9  HorFreq: 56250 Hz Clock: 148.500 MHz
    VIC  32 1920x1080@24Hz 16:9  HorFreq: 27000 Hz Clock: 74.250 MHz
    VIC  33 1920x1080@25Hz 16:9  HorFreq: 28125 Hz Clock: 74.250 MHz
    VIC  34 1920x1080@30Hz 16:9  HorFreq: 33750 Hz Clock: 74.250 MHz
  Audio data block
    Linear PCM, max channels 2
      Supported sample rates (kHz): 192 176.4 96 88.2 48 44.1 32
      Supported sample sizes (bits): 24 20 16
  Speaker allocation data block
    Speaker map:
      FL/FR - Front Left/Right
  Vendor-specific data block, OUI 000c03 (HDMI)
    Source physical address 2.0.0.0
    Supports_AI
    DC_36bit
    DC_30bit
    DC_Y444
    Maximum TMDS clock: 225MHz
Basic audio support
Supports YCbCr 4:4:4
Supports YCbCr 4:2:2
2 native detailed modes
Detailed mode: Clock 27.000 MHz, 708 mm x 398 mm
                720  736  798  858 hborder 0
                480  489  495  525 vborder 0
               -hsync -vsync 
               VertFreq: 59 Hz, HorFreq: 31468 Hz
Detailed mode: Clock 74.250 MHz, 708 mm x 398 mm
               1280 1720 1760 1980 hborder 0
                720  725  730  750 vborder 0
               +hsync +vsync 
               VertFreq: 50 Hz, HorFreq: 37500 Hz
Detailed mode: Clock 74.250 MHz, 708 mm x 398 mm
               1920 2448 2492 2640 hborder 0
                540  542  547  562 vborder 0
               +hsync +vsync interlaced 
               VertFreq: 50 Hz, HorFreq: 28125 Hz
Detailed mode: Clock 27.000 MHz, 708 mm x 398 mm
                720  732  796  864 hborder 0
                576  581  586  625 vborder 0
               -hsync -vsync 
               VertFreq: 50 Hz, HorFreq: 31250 Hz
Detailed mode: Clock 27.000 MHz, 708 mm x 398 mm
                720  736  798  858 hborder 0
                480  489  495  525 vborder 0
               -hsync -vsync 
               VertFreq: 59 Hz, HorFreq: 31468 Hz
Checksum: 0x6 (valid)

EDID block does NOT conform to EDID 1.3!
	Required 640x480p60 timings are missing in the established timings
	and/or in the SVD list (VIC 1)
One or more of the timings is out of range of the Monitor Ranges:
  Vertical Freq: 24 - 60 Hz
  Horizontal Freq: 15625 - 67500 Hz
  Maximum Clock: 148.500 MHz
