edid-decode (hex):

00 ff ff ff ff ff ff 00 09 e5 be 06 00 00 00 00
01 1a 01 04 95 1d 11 78 0a 9c a2 a6 58 54 9f 26
0e 4d 55 00 00 00 01 01 01 01 01 01 01 01 01 01
01 01 01 01 01 01 bc 39 80 18 71 38 28 40 30 20
36 00 26 a5 10 00 00 1a 36 2e 80 18 71 38 28 40
30 20 36 00 26 a5 10 00 00 1a 00 00 00 fe 00 32
4d 39 77 48 80 4e 56 31 33 46 48 4d 00 00 00 00
00 00 41 21 a3 00 10 00 00 0a 01 0a 20 20 00 f7

----------------

Block 0, Base EDID:
  EDID Structure Version & Revision: 1.4
  Vendor & Product Identification:
    Manufacturer: BOE
    Model: 1726
    Made in: week 1 of 2016
  Basic Display Parameters & Features:
    Digital display
    Bits per primary color channel: 6
    DisplayPort interface
    Maximum image size: 29 cm x 17 cm
    Gamma: 2.20
    Supported color formats: RGB 4:4:4, YCrCb 4:4:4
    First detailed timing includes the native pixel format and preferred refresh rate
  Color Characteristics:
    Red  : 0.6503, 0.3447
    Green: 0.3310, 0.6210
    Blue : 0.1503, 0.0566
    White: 0.3007, 0.3339
  Established Timings I & II: none
  Standard Timings: none
  Detailed Timing Descriptors:
    DTD 1:  1920x1080   59.984 Hz  16:9    67.182 kHz 147.800 MHz (294 mm x 165 mm)
                 Hfront   48 Hsync  32 Hback 200 Hpol P
                 Vfront    3 Vsync   6 Vback  31 Vpol N
    DTD 2:  1920x1080   48.011 Hz  16:9    53.773 kHz 118.300 MHz (294 mm x 165 mm)
                 Hfront   48 Hsync  32 Hback 200 Hpol P
                 Vfront    3 Vsync   6 Vback  31 Vpol N
    Alphanumeric Data String: '2M9wH'
    Manufacturer-Specified Display Descriptor (0x00): 00 00 00 00 41 21 a3 00 10 00 00 0a 01 0a 20 20 '....A!........  '
Checksum: 0xf7

----------------

Failures:

Block 0, Base EDID:
  Alphanumeric Data String: Non-printable character.
  Missing Display Product Name.

EDID conformity: FAIL
