
EDID (hex):
00ffffffffffff00306480e79a2a0000
1f0e010368221b782a388fa358469d24
174c55bfef0081800101010101010101
010101010101bc34009851002a401090
1300540e1100001e000000ff00313630
34374a41433130393036000000fd0037
4b1e530e000a202020202020000000fc
004c31374c4344320a20202020200014

Extracted contents:
header:          00 ff ff ff ff ff ff 00
serial number:   30 64 80 e7 9a 2a 00 00 1f 0e
version:         01 03
basic params:    68 22 1b 78 2a
chroma info:     38 8f a3 58 46 9d 24 17 4c 55
established:     bf ef 00
standard:        81 80 01 01 01 01 01 01 01 01 01 01 01 01 01 01
descriptor 1:    bc 34 00 98 51 00 2a 40 10 90 13 00 54 0e 11 00 00 1e
descriptor 2:    00 00 00 ff 00 31 36 30 34 37 4a 41 43 31 30 39 30 36
descriptor 3:    00 00 00 fd 00 37 4b 1e 53 0e 00 0a 20 20 20 20 20 20
descriptor 4:    00 00 00 fc 00 4c 31 37 4c 43 44 32 0a 20 20 20 20 20
extensions:      00
checksum:        14

EDID version: 1.3
Manufacturer: LCD Model e780 Serial Number --
Analog display, Input voltage level: 0.7/0.7 V
Sync: Separate 
Maximum image size: 34 cm x 27 cm
Gamma: 2.20
DPMS levels: Off
RGB color display
First detailed timing is preferred timing
Display x,y Chromaticity:
  Red:   0.6367, 0.3466
  Green: 0.2753, 0.6132
  Blue:  0.1425, 0.0898
  White: 0.2998, 0.3349
Established timings supported:
  720x400@70Hz 9:5 HorFreq: 31469 Hz Clock: 28.320 MHz
  640x480@60Hz 4:3 HorFreq: 31469 Hz Clock: 25.175 MHz
  640x480@67Hz 4:3 HorFreq: 35000 Hz Clock: 30.240 MHz
  640x480@72Hz 4:3 HorFreq: 37900 Hz Clock: 31.500 MHz
  640x480@75Hz 4:3 HorFreq: 37500 Hz Clock: 31.500 MHz
  800x600@56Hz 4:3 HorFreq: 35200 Hz Clock: 36.000 MHz
  800x600@60Hz 4:3 HorFreq: 37900 Hz Clock: 40.000 MHz
  800x600@72Hz 4:3 HorFreq: 48100 Hz Clock: 50.000 MHz
  800x600@75Hz 4:3 HorFreq: 46900 Hz Clock: 49.500 MHz
  832x624@75Hz 4:3 HorFreq: 49726 Hz Clock: 57.284 MHz
  1024x768@60Hz 4:3 HorFreq: 48400 Hz Clock: 65.000 MHz
  1024x768@70Hz 4:3 HorFreq: 56500 Hz Clock: 75.000 MHz
  1024x768@75Hz 4:3 HorFreq: 60000 Hz Clock: 78.750 MHz
  1280x1024@75Hz 5:4 HorFreq: 80000 Hz Clock: 135.000 MHz
Standard timings supported:
  1280x1024@60Hz 5:4 HorFreq: 64000 Hz Clock: 108.000 MHz
Detailed mode: Clock 135.000 MHz, 340 mm x 270 mm
               1280 1296 1440 1688 hborder 0
               1024 1025 1028 1066 vborder 0
               +hsync +vsync 
               VertFreq: 75 Hz, HorFreq: 79976 Hz
Serial number: --
Monitor ranges (GTF): 55-75Hz V, 30-83kHz H, max dotclock 140MHz
Monitor name: L17LCD2
Checksum: 0x14 (valid)
EDID block does not conform at all!
	Bad year of manufacture
