edid-decode (hex):

00 ff ff ff ff ff ff 00 22 f0 1a 42 01 01 01 01
0f 17 01 03 80 2f 1a 78 0a eb f5 a6 56 51 9c 26
10 50 54 00 00 00 01 01 01 01 01 01 01 01 01 01
01 01 01 01 01 01 1a 38 80 00 71 38 14 40 60 40
84 00 dd 0c 11 00 00 1e 00 00 00 ff 00 57 4c 45
44 4c 47 44 4c 4d 32 31 35 57 00 00 00 fc 00 48
50 20 41 6c 6c 2d 69 6e 2d 4f 6e 65 00 00 00 fe
00 4c 4d 32 31 35 57 46 33 2d 53 4c 4b 31 00 70

----------------

Block 0, Base EDID:
  EDID Structure Version & Revision: 1.3
  Vendor & Product Identification:
    Manufacturer: HWP
    Model: 16922
    Serial Number: ...
    Made in: week 15 of 2013
  Basic Display Parameters & Features:
    Digital display
    Maximum image size: 47 cm x 26 cm
    Gamma: 2.20
    RGB color display
    First detailed timing is preferred timing
  Color Characteristics:
    Red  : 0.6513, 0.3378
    Green: 0.3183, 0.6123
    Blue : 0.1513, 0.0654
    White: 0.3134, 0.3291
  Established Timings I & II: none
  Standard Timings: none
  Detailed Timing Descriptors:
    DTD 1:  1920x1080   60.002 Hz  16:9    66.002 kHz 143.620 MHz (477 mm x 268 mm)
                 Hfront   96 Hsync  64 Hback  96 Hpol P
                 Vfront    8 Vsync   4 Vback   8 Vpol P
    Display Product Serial Number: ...
    Display Product Name: 'HP All-in-One'
    Alphanumeric Data String: 'LM215WF3-SLK1'
Checksum: 0x70

----------------

Failures:

Block 0, Base EDID:
  Missing Display Range Limits Descriptor.

EDID conformity: FAIL
