
EDID (hex):
00ffffffffffff0010ac6ff049473741
221c0104a5301b78e27f15a354519f27
0c5054a54b00d1c08180a9c0714f0101
010101010101023a801871382d40582c
4500dc0c1100001e000000ff0037464d
395038384d413747490a000000fc0044
454c4c20453232313648560a000000fd
00384c1e5311000a20202020202000a4

Extracted contents:
header:          00 ff ff ff ff ff ff 00
serial number:   10 ac 6f f0 49 47 37 41 22 1c
version:         01 04
basic params:    a5 30 1b 78 e2
chroma info:     7f 15 a3 54 51 9f 27 0c 50 54
established:     a5 4b 00
standard:        d1 c0 81 80 a9 c0 71 4f 01 01 01 01 01 01 01 01
descriptor 1:    02 3a 80 18 71 38 2d 40 58 2c 45 00 dc 0c 11 00 00 1e
descriptor 2:    00 00 00 ff 00 37 46 4d 39 50 38 38 4d 41 37 47 49 0a
descriptor 3:    00 00 00 fc 00 44 45 4c 4c 20 45 32 32 31 36 48 56 0a
descriptor 4:    00 00 00 fd 00 38 4c 1e 53 11 00 0a 20 20 20 20 20 20
extensions:      00
checksum:        a4

EDID version: 1.4
Manufacturer: DEL Model f06f Serial Number --
Made in week 34 of 2018
Digital display
8 bits per primary color channel
DisplayPort interface
Maximum image size: 48 cm x 27 cm
Gamma: 2.20
DPMS levels: Standby Suspend Off
Supported color formats: RGB 4:4:4
First detailed timing includes the native pixel format and preferred refresh rate
Display x,y Chromaticity:
  Red:   0.6376, 0.3310
  Green: 0.3193, 0.6240
  Blue:  0.1523, 0.0478
  White: 0.3134, 0.3291
Established timings supported:
  720x400@70Hz 9:5 HorFreq: 31469 Hz Clock: 28.320 MHz
  640x480@60Hz 4:3 HorFreq: 31469 Hz Clock: 25.175 MHz
  640x480@75Hz 4:3 HorFreq: 37500 Hz Clock: 31.500 MHz
  800x600@60Hz 4:3 HorFreq: 37900 Hz Clock: 40.000 MHz
  800x600@75Hz 4:3 HorFreq: 46900 Hz Clock: 49.500 MHz
  1024x768@60Hz 4:3 HorFreq: 48400 Hz Clock: 65.000 MHz
  1024x768@75Hz 4:3 HorFreq: 60000 Hz Clock: 78.750 MHz
  1280x1024@75Hz 5:4 HorFreq: 80000 Hz Clock: 135.000 MHz
Standard timings supported:
  1920x1080@60Hz 16:9
  1280x1024@60Hz 5:4 HorFreq: 64000 Hz Clock: 108.000 MHz
  1600x900@60Hz 16:9
  1152x864@75Hz 4:3 HorFreq: 67500 Hz Clock: 108.000 MHz
Detailed mode: Clock 148.500 MHz, 476 mm x 268 mm
               1920 2008 2052 2200 hborder 0
               1080 1084 1089 1125 vborder 0
               +hsync +vsync 
               VertFreq: 60 Hz, HorFreq: 67500 Hz
Serial number: --
Monitor name: DELL E2216HV
Monitor ranges (GTF): 56-76Hz V, 30-83kHz H, max dotclock 170MHz
Checksum: 0xa4 (valid)
