edid-decode (hex):

00 ff ff ff ff ff ff 00 0d ae d5 15 00 00 00 00
11 1c 01 04 95 22 13 78 02 ec d5 8d 52 53 95 29
22 50 54 00 00 00 01 01 01 01 01 01 01 01 01 01
01 01 01 01 01 01 5e 35 80 96 70 38 14 40 2c 1c
24 00 58 c1 10 00 00 1a b2 2a 80 96 70 38 14 40
2c 1c 24 00 58 c1 10 00 00 1a 00 00 00 fe 00 44
4e 46 38 56 80 31 35 36 48 47 41 0a 00 00 00 00
00 00 41 31 96 00 10 00 00 0a 01 0a 20 20 00 ac

----------------

Block 0, Base EDID:
  EDID Structure Version & Revision: 1.4
  Vendor & Product Identification:
    Manufacturer: CMN
    Model: 5589
    Made in: week 17 of 2018
  Basic Display Parameters & Features:
    Digital display
    Bits per primary color channel: 6
    DisplayPort interface
    Maximum image size: 34 cm x 19 cm
    Gamma: 2.20
    Supported color formats: RGB 4:4:4
    First detailed timing includes the native pixel format and preferred refresh rate
  Color Characteristics:
    Red  : 0.5537, 0.3222
    Green: 0.3271, 0.5820
    Blue : 0.1630, 0.1337
    White: 0.3134, 0.3291
  Established Timings I & II: none
  Standard Timings: none
  Detailed Timing Descriptors:
    DTD 1:  1920x1080   60.000000 Hz  16:9     66.000 kHz    136.620000 MHz (344 mm x 193 mm)
                 Hfront   44 Hsync  28 Hback   78 Hpol P
                 Vfront    2 Vsync   4 Vback   14 Vpol N
    DTD 2:  1920x1080   48.001757 Hz  16:9     52.802 kHz    109.300000 MHz (344 mm x 193 mm)
                 Hfront   44 Hsync  28 Hback   78 Hpol P
                 Vfront    2 Vsync   4 Vback   14 Vpol N
    Alphanumeric Data String: 'DNF8V'
    Manufacturer-Specified Display Descriptor (0x00): 00 00 00 00 41 31 96 00 10 00 00 0a 01 0a 20 20 '....A1........  '
Checksum: 0xac

----------------

Warnings:

Block 0, Base EDID:
  Missing Display Product Name.

Failures:

Block 0, Base EDID:
  Alphanumeric Data String: Non-printable character.

EDID conformity: FAIL
