
EDID (hex):
00ffffffffffff0005e34323cc090000
2f14010368331d782a3585a656489a24
125054bfef00814081809500b300d1c0
010101010101023a801871382d40582c
4500fd1e1100001e000000fd00374b1e
5315000a202020202020000000fc0032
3334330a2020202020202020000000ff
0041415a41424f4430303235303800c3

Extracted contents:
header:          00 ff ff ff ff ff ff 00
serial number:   05 e3 43 23 cc 09 00 00 2f 14
version:         01 03
basic params:    68 33 1d 78 2a
chroma info:     35 85 a6 56 48 9a 24 12 50 54
established:     bf ef 00
standard:        81 40 81 80 95 00 b3 00 d1 c0 01 01 01 01 01 01
descriptor 1:    02 3a 80 18 71 38 2d 40 58 2c 45 00 fd 1e 11 00 00 1e
descriptor 2:    00 00 00 fd 00 37 4b 1e 53 15 00 0a 20 20 20 20 20 20
descriptor 3:    00 00 00 fc 00 32 33 34 33 0a 20 20 20 20 20 20 20 20
descriptor 4:    00 00 00 ff 00 41 41 5a 41 42 4f 44 30 30 32 35 30 38
extensions:      00
checksum:        c3

EDID version: 1.3
Manufacturer: AOC Model 2343 Serial Number --
Made in week 47 of 2010
Analog display, Input voltage level: 0.7/0.7 V
Sync: Separate 
Maximum image size: 51 cm x 29 cm
Gamma: 2.20
DPMS levels: Off
RGB color display
First detailed timing is preferred timing
Display x,y Chromaticity:
  Red:   0.6484, 0.3388
  Green: 0.2822, 0.6025
  Blue:  0.1425, 0.0703
  White: 0.3134, 0.3291
Established timings supported:
  720x400@70Hz 9:5 HorFreq: 31469 Hz Clock: 28.320 MHz
  640x480@60Hz 4:3 HorFreq: 31469 Hz Clock: 25.175 MHz
  640x480@67Hz 4:3 HorFreq: 35000 Hz Clock: 30.240 MHz
  640x480@72Hz 4:3 HorFreq: 37900 Hz Clock: 31.500 MHz
  640x480@75Hz 4:3 HorFreq: 37500 Hz Clock: 31.500 MHz
  800x600@56Hz 4:3 HorFreq: 35200 Hz Clock: 36.000 MHz
  800x600@60Hz 4:3 HorFreq: 37900 Hz Clock: 40.000 MHz
  800x600@72Hz 4:3 HorFreq: 48100 Hz Clock: 50.000 MHz
  800x600@75Hz 4:3 HorFreq: 46900 Hz Clock: 49.500 MHz
  832x624@75Hz 4:3 HorFreq: 49726 Hz Clock: 57.284 MHz
  1024x768@60Hz 4:3 HorFreq: 48400 Hz Clock: 65.000 MHz
  1024x768@70Hz 4:3 HorFreq: 56500 Hz Clock: 75.000 MHz
  1024x768@75Hz 4:3 HorFreq: 60000 Hz Clock: 78.750 MHz
  1280x1024@75Hz 5:4 HorFreq: 80000 Hz Clock: 135.000 MHz
Standard timings supported:
  1280x960@60Hz 4:3 HorFreq: 60000 Hz Clock: 108.000 MHz
  1280x1024@60Hz 5:4 HorFreq: 64000 Hz Clock: 108.000 MHz
  1440x900@60Hz 16:10 HorFreq: 55500 Hz Clock: 88.750 MHz
  1680x1050@60Hz 16:10 HorFreq: 64700 Hz Clock: 119.000 MHz
  1920x1080@60Hz 16:9
Detailed mode: Clock 148.500 MHz, 509 mm x 286 mm
               1920 2008 2052 2200 hborder 0
               1080 1084 1089 1125 vborder 0
               +hsync +vsync 
               VertFreq: 60 Hz, HorFreq: 67500 Hz
Monitor ranges (GTF): 55-75Hz V, 30-83kHz H, max dotclock 210MHz
Monitor name: 2343
Serial number: --
Checksum: 0xc3 (valid)
