edid-decode (hex):

00 ff ff ff ff ff ff 00 41 07 11 50 01 00 00 00
0c 1b 01 04 a5 5d 34 78 e2 f0 65 98 57 51 91 27
21 50 54 a1 08 00 81 c0 81 40 81 80 a9 c0 d1 c0
01 01 01 01 01 01 94 43 80 90 72 38 28 40 80 c8
35 00 a2 0b 32 00 00 1c 66 21 50 b0 51 00 1b 30
40 70 36 00 a2 0b 32 00 00 1e 00 00 00 fd 00 38
3f 1f 44 0f 00 0a 20 20 20 20 20 20 00 00 00 fc
00 34 32 50 46 47 35 30 31 31 2f 37 37 0a 00 0e

00 ff ff ff ff ff ff 00 41 07 11 50 01 00 00 00
0c 1b 01 04 a5 5d 34 78 e2 f0 65 98 57 51 91 27
21 50 54 a1 08 00 81 c0 81 40 81 80 a9 c0 d1 c0
01 01 01 01 01 01 94 43 80 90 72 38 28 40 80 c8
35 00 a2 0b 32 00 00 1c 66 21 50 b0 51 00 1b 30
40 70 36 00 a2 0b 32 00 00 1e 00 00 00 fd 00 38
3f 1f 44 0f 00 0a 20 20 20 20 20 20 00 00 00 fc
00 34 32 50 46 47 35 30 31 31 2f 37 37 0a 00 0e

----------------

Block 0, Base EDID:
  EDID Structure Version & Revision: 1.4
  Vendor & Product Identification:
    Manufacturer: PHG
    Model: 20497
    Serial Number: ...
    Made in: week 12 of 2017
  Basic Display Parameters & Features:
    Digital display
    Bits per primary color channel: 8
    DisplayPort interface
    Maximum image size: 93 cm x 52 cm
    Gamma: 2.20
    DPMS levels: Standby Suspend Off
    Supported color formats: RGB 4:4:4
    First detailed timing includes the native pixel format and preferred refresh rate
  Color Characteristics:
    Red  : 0.5966, 0.3427
    Green: 0.3164, 0.5664
    Blue : 0.1533, 0.1308
    White: 0.3134, 0.3291
  Established Timings I & II:
    IBM     :   720x400    70.081663 Hz   9:5     31.467 kHz     28.320000 MHz
    DMT 0x04:   640x480    59.940476 Hz   4:3     31.469 kHz     25.175000 MHz
    DMT 0x09:   800x600    60.316541 Hz   4:3     37.879 kHz     40.000000 MHz
    DMT 0x10:  1024x768    60.003840 Hz   4:3     48.363 kHz     65.000000 MHz
  Standard Timings:
    DMT 0x55:  1280x720    60.000000 Hz  16:9     45.000 kHz     74.250000 MHz
    DMT 0x20:  1280x960    60.000000 Hz   4:3     60.000 kHz    108.000000 MHz
    DMT 0x23:  1280x1024   60.019740 Hz   5:4     63.981 kHz    108.000000 MHz
    DMT 0x53:  1600x900    60.000000 Hz  16:9     60.000 kHz    108.000000 MHz (RB)
    DMT 0x52:  1920x1080   60.000000 Hz  16:9     67.500 kHz    148.500000 MHz
  Detailed Timing Descriptors:
    DTD 1:  1920x1080   59.962844 Hz  16:9     67.158 kHz    173.000000 MHz (930 mm x 523 mm)
                 Hfront  128 Hsync 200 Hback  328 Hpol N
                 Vfront    3 Vsync   5 Vback   32 Vpol P
    DTD 2:  1360x768    60.015162 Hz  85:48    47.712 kHz     85.500000 MHz (930 mm x 523 mm)
                 Hfront   64 Hsync 112 Hback  256 Hpol P
                 Vfront    3 Vsync   6 Vback   18 Vpol P
    Display Range Limits:
      Monitor ranges (GTF): 56-63 Hz V, 31-68 kHz H, max dotclock 150 MHz
    Display Product Name: '42PFG5011/77'
Checksum: 0x0e

----------------

Block 1, Unknown EDID Extension Block 0x00:
  00 ff ff ff ff ff ff 00 41 07 11 50 01 00 00 00 '........A..P....'
  0c 1b 01 04 a5 5d 34 78 e2 f0 65 98 57 51 91 27 '.....]4x..e.WQ.''
  21 50 54 a1 08 00 81 c0 81 40 81 80 a9 c0 d1 c0 '!PT......@......'
  01 01 01 01 01 01 94 43 80 90 72 38 28 40 80 c8 '.......C..r8(@..'
  35 00 a2 0b 32 00 00 1c 66 21 50 b0 51 00 1b 30 '5...2...f!P.Q..0'
  40 70 36 00 a2 0b 32 00 00 1e 00 00 00 fd 00 38 '@p6...2........8'
  3f 1f 44 0f 00 0a 20 20 20 20 20 20 00 00 00 fc '?.D...      ....'
  00 34 32 50 46 47 35 30 31 31 2f 37 37 0a 00 0e '.42PFG5011/77...'
Checksum: 0x0e

----------------

Warnings:

Block 0, Base EDID:
  Display Range Limits: GTF support is deprecated in EDID 1.4.
EDID:
  Base EDID: Some timings are out of range of the Monitor Ranges:
    Vertical Freq: 59.940 - 70.082 Hz (Monitor: 56.000 - 63.000 Hz)
    Maximum Clock: 173.000 MHz (Monitor: 150.000 MHz)

Failures:

Block 0, Base EDID:
  Display Range Limits: GTF can't be combined with non-continuous frequencies.
Block 1, Base EDID:
  Unknown Extension Block.
EDID:
  Base EDID: EDID specified 0 extension block(s), but found 1 extension block(s).

EDID conformity: FAIL
