
EDID (hex):
00ffffffffffff0010ac3c404d353733
30120103802f1e78eaa6e5aa5132ac26
145054a54b00714f8180b30001010101
01010101010121399030621a274068b0
3600d9281100001c000000ff00473435
36483842513337354d0a000000fc0044
454c4c20323230385746500a000000fd
00384c1e5310000a202020202020008a

Extracted contents:
header:          00 ff ff ff ff ff ff 00
serial number:   10 ac 3c 40 4d 35 37 33 30 12
version:         01 03
basic params:    80 2f 1e 78 ea
chroma info:     a6 e5 aa 51 32 ac 26 14 50 54
established:     a5 4b 00
standard:        71 4f 81 80 b3 00 01 01 01 01 01 01 01 01 01 01
descriptor 1:    21 39 90 30 62 1a 27 40 68 b0 36 00 d9 28 11 00 00 1c
descriptor 2:    00 00 00 ff 00 47 34 35 36 48 38 42 51 33 37 35 4d 0a
descriptor 3:    00 00 00 fc 00 44 45 4c 4c 20 32 32 30 38 57 46 50 0a
descriptor 4:    00 00 00 fd 00 38 4c 1e 53 10 00 0a 20 20 20 20 20 20
extensions:      00
checksum:        8a

EDID version: 1.3
Manufacturer: DEL Model 403c Serial Number --
Made in week 48 of 2008
Digital display
Maximum image size: 47 cm x 30 cm
Gamma: 2.20
DPMS levels: Standby Suspend Off
RGB color display
First detailed timing is preferred timing
Display x,y Chromaticity:
  Red:   0.6660, 0.3183
  Green: 0.1962, 0.6738
  Blue:  0.1513, 0.0800
  White: 0.3134, 0.3291
Established timings supported:
  720x400@70Hz 9:5 HorFreq: 31469 Hz Clock: 28.320 MHz
  640x480@60Hz 4:3 HorFreq: 31469 Hz Clock: 25.175 MHz
  640x480@75Hz 4:3 HorFreq: 37500 Hz Clock: 31.500 MHz
  800x600@60Hz 4:3 HorFreq: 37900 Hz Clock: 40.000 MHz
  800x600@75Hz 4:3 HorFreq: 46900 Hz Clock: 49.500 MHz
  1024x768@60Hz 4:3 HorFreq: 48400 Hz Clock: 65.000 MHz
  1024x768@75Hz 4:3 HorFreq: 60000 Hz Clock: 78.750 MHz
  1280x1024@75Hz 5:4 HorFreq: 80000 Hz Clock: 135.000 MHz
Standard timings supported:
  1152x864@75Hz 4:3 HorFreq: 67500 Hz Clock: 108.000 MHz
  1280x1024@60Hz 5:4 HorFreq: 64000 Hz Clock: 108.000 MHz
  1680x1050@60Hz 16:10 HorFreq: 64700 Hz Clock: 119.000 MHz
Detailed mode: Clock 146.250 MHz, 473 mm x 296 mm
               1680 1784 1960 2240 hborder 0
               1050 1053 1059 1089 vborder 0
               -hsync +vsync 
               VertFreq: 59 Hz, HorFreq: 65290 Hz
Serial number: --
Monitor name: DELL 2208WFP
Monitor ranges (GTF): 56-76Hz V, 30-83kHz H, max dotclock 160MHz
Checksum: 0x8a (valid)
