edid-decode (hex):

00 ff ff ff ff ff ff 00 1e 6d e7 76 01 01 01 01
01 17 01 04 b5 3c 22 78 9e e9 d5 aa 50 34 b6 25
0e 50 54 21 08 00 71 40 81 80 81 c0 a9 c0 d1 c0
01 01 01 01 01 01 50 d0 00 a0 f0 70 3e 80 08 90
65 0c 6d 55 21 00 00 1a 28 68 00 a0 f0 70 3e 80
08 90 65 0c 6d 55 21 00 00 1a 00 00 00 fd 00 38
3d 1e 87 38 00 0a 20 20 20 20 20 20 00 00 00 fc
00 33 31 4d 55 39 37 0a 20 20 20 20 20 20 02 b0

02 03 12 71 45 10 04 03 01 00 23 09 07 07 83 01
00 00 02 3a 80 18 71 38 2d 40 58 2c 45 00 b8 6f
21 00 00 1e 56 5e 00 a0 a0 a0 29 50 30 20 35 00
58 54 21 00 00 1a 00 00 00 00 00 00 00 00 00 00
00 00 00 00 00 00 00 00 00 00 00 00 00 00 00 00
00 00 00 00 00 00 00 00 00 00 00 00 00 00 00 00
00 00 00 00 00 00 00 00 00 00 00 00 00 00 00 00
00 00 00 00 00 00 00 00 00 00 00 00 00 00 00 cb

70 11 2b 06 00 03 00 28 78 d9 00 87 ff 0f 4f 00
07 00 1f 00 6f 08 3d 00 2f 00 07 00 88 cd 00 87
ff 0f 7f 02 17 02 3f 00 6f 08 3d 00 2f 00 07 00
a1 00 00 00 00 00 00 00 00 00 00 00 00 00 00 00
00 00 00 00 00 00 00 00 00 00 00 00 00 00 00 00
00 00 00 00 00 00 00 00 00 00 00 00 00 00 00 00
00 00 00 00 00 00 00 00 00 00 00 00 00 00 00 00
00 00 00 00 00 00 00 00 00 00 00 00 00 00 00 90

00 ff ff ff ff ff ff 00 1e 6d e7 76 01 01 01 01
01 17 01 04 b5 3c 22 78 9e e9 d5 aa 50 34 b6 25
0e 50 54 21 08 00 71 40 81 80 81 c0 a9 c0 d1 c0
01 01 01 01 01 01 50 d0 00 a0 f0 70 3e 80 08 90
65 0c 6d 55 21 00 00 1a 28 68 00 a0 f0 70 3e 80
08 90 65 0c 6d 55 21 00 00 1a 00 00 00 fd 00 38
3d 1e 87 38 00 0a 20 20 20 20 20 20 00 00 00 fc
00 33 31 4d 55 39 37 0a 20 20 20 20 20 20 02 b0

02 03 12 71 45 10 04 03 01 00 23 09 07 07 83 01
00 00 02 3a 80 18 71 38 2d 40 58 2c 45 00 b8 6f
21 00 00 1e 56 5e 00 a0 a0 a0 29 50 30 20 35 00
58 54 21 00 00 1a 00 00 00 00 00 00 00 00 00 00
00 00 00 00 00 00 00 00 00 00 00 00 00 00 00 00
00 00 00 00 00 00 00 00 00 00 00 00 00 00 00 00
00 00 00 00 00 00 00 00 00 00 00 00 00 00 00 00
00 00 00 00 00 00 00 00 00 00 00 00 00 00 00 cb

70 11 2b 06 00 03 00 28 78 d9 00 87 ff 0f 4f 00
07 00 1f 00 6f 08 3d 00 2f 00 07 00 88 cd 00 87
ff 0f 7f 02 17 02 3f 00 6f 08 3d 00 2f 00 07 00
a1 00 00 00 00 00 00 00 00 00 00 00 00 00 00 00
00 00 00 00 00 00 00 00 00 00 00 00 00 00 00 00
00 00 00 00 00 00 00 00 00 00 00 00 00 00 00 00
00 00 00 00 00 00 00 00 00 00 00 00 00 00 00 00
00 00 00 00 00 00 00 00 00 00 00 00 00 00 00 90

----------------

Block 0, Base EDID:
  EDID Structure Version & Revision: 1.4
  Vendor & Product Identification:
    Manufacturer: GSM
    Model: 30439
    Serial Number: ...
    Made in: week 1 of 2013
  Basic Display Parameters & Features:
    Digital display
    Bits per primary color channel: 10
    DisplayPort interface
    Maximum image size: 60 cm x 34 cm
    Gamma: 2.20
    DPMS levels: Standby
    Supported color formats: RGB 4:4:4, YCrCb 4:4:4, YCrCb 4:2:2
    Default (sRGB) color space is primary color space
    First detailed timing includes the native pixel format and preferred refresh rate
  Color Characteristics:
    Red  : 0.6669, 0.3144
    Green: 0.2050, 0.7119
    Blue : 0.1474, 0.0556
    White: 0.3134, 0.3291
  Established Timings I & II:
    DMT 0x04:   640x480    59.940476 Hz   4:3     31.469 kHz     25.175000 MHz
    DMT 0x09:   800x600    60.316541 Hz   4:3     37.879 kHz     40.000000 MHz
    DMT 0x10:  1024x768    60.003840 Hz   4:3     48.363 kHz     65.000000 MHz
  Standard Timings:
    GTF     :  1152x864    60.000000 Hz   4:3     53.700 kHz     81.624000 MHz
    DMT 0x23:  1280x1024   60.019740 Hz   5:4     63.981 kHz    108.000000 MHz
    DMT 0x55:  1280x720    60.000000 Hz  16:9     45.000 kHz     74.250000 MHz
    DMT 0x53:  1600x900    60.000000 Hz  16:9     60.000 kHz    108.000000 MHz (RB)
    DMT 0x52:  1920x1080   60.000000 Hz  16:9     67.500 kHz    148.500000 MHz
  Detailed Timing Descriptors:
    DTD 1:  3840x2160   60.000000 Hz  16:9    133.320 kHz    533.280000 MHz (621 mm x 341 mm)
                 Hfront    8 Hsync 144 Hback    8 Hpol P
                 Vfront   54 Vsync   5 Vback    3 Vpol N
    DTD 2:  3840x2160   30.000000 Hz  16:9     66.660 kHz    266.640000 MHz (621 mm x 341 mm)
                 Hfront    8 Hsync 144 Hback    8 Hpol P
                 Vfront   54 Vsync   5 Vback    3 Vpol N
    Display Range Limits:
      Monitor ranges (GTF): 56-61 Hz V, 30-135 kHz H, max dotclock 560 MHz
    Display Product Name: '31MU97'
  Extension blocks: 2
Checksum: 0xb0

----------------

Block 1, CTA-861 Extension Block:
  Revision: 3
  Basic audio support
  Supports YCbCr 4:4:4
  Supports YCbCr 4:2:2
  Native detailed modes: 1
  Video Data Block:
    VIC  16:  1920x1080   60.000000 Hz  16:9     67.500 kHz    148.500000 MHz
    VIC   4:  1280x720    60.000000 Hz  16:9     45.000 kHz     74.250000 MHz
    VIC   3:   720x480    59.940060 Hz  16:9     31.469 kHz     27.000000 MHz
    VIC   1:   640x480    59.940476 Hz   4:3     31.469 kHz     25.175000 MHz
  Audio Data Block:
    Linear PCM:
      Max channels: 2
      Supported sample rates (kHz): 48 44.1 32
      Supported sample sizes (bits): 24 20 16
  Speaker Allocation Data Block:
    FL/FR - Front Left/Right
  Detailed Timing Descriptors:
    DTD 3:  1920x1080   60.000000 Hz  16:9     67.500 kHz    148.500000 MHz (696 mm x 367 mm)
                 Hfront   88 Hsync  44 Hback  148 Hpol P
                 Vfront    4 Vsync   5 Vback   36 Vpol P
    DTD 4:  2560x1440   59.950550 Hz  16:9     88.787 kHz    241.500000 MHz (600 mm x 340 mm)
                 Hfront   48 Hsync  32 Hback   80 Hpol P
                 Vfront    3 Vsync   5 Vback   33 Vpol N
Checksum: 0xcb  Unused space in Extension Block: 73 bytes

----------------

Block 2, DisplayID Extension Block:
  Version: 1.1
  Extension Count: 0
  Display Product Type: DIRECT DRIVE monitor
  Video Timing Modes Type 1 - Detailed Timings Data Block:
    DTD:  4096x2160   59.998457 Hz 256:135  133.317 kHz    556.730000 MHz (aspect 256:135, no 3D stereo, preferred)
               Hfront    8 Hsync  32 Hback   40 Hpol N
               Vfront   48 Vsync   8 Vback    6 Vpol N
    DTD:  4096x2160   50.000038 Hz 256:135  111.100 kHz    526.170000 MHz (aspect 256:135, no 3D stereo, preferred)
               Hfront  536 Hsync  64 Hback   40 Hpol N
               Vfront   48 Vsync   8 Vback    6 Vpol N
  Checksum: 0xa1
Checksum: 0x90  Unused space in Extension Block: 78 bytes

----------------

Block 3, Unknown EDID Extension Block 0x00:
  00 ff ff ff ff ff ff 00 1e 6d e7 76 01 01 01 01 '.........m.v....'
  01 17 01 04 b5 3c 22 78 9e e9 d5 aa 50 34 b6 25 '.....<"x....P4.%'
  0e 50 54 21 08 00 71 40 81 80 81 c0 a9 c0 d1 c0 '.PT!..q@........'
  01 01 01 01 01 01 50 d0 00 a0 f0 70 3e 80 08 90 '......P....p>...'
  65 0c 6d 55 21 00 00 1a 28 68 00 a0 f0 70 3e 80 'e.mU!...(h...p>.'
  08 90 65 0c 6d 55 21 00 00 1a 00 00 00 fd 00 38 '..e.mU!........8'
  3d 1e 87 38 00 0a 20 20 20 20 20 20 00 00 00 fc '=..8..      ....'
  00 33 31 4d 55 39 37 0a 20 20 20 20 20 20 02 b0 '.31MU97.      ..'
Checksum: 0xb0

----------------

Block 4, CTA-861 Extension Block:
  Revision: 3
  Basic audio support
  Supports YCbCr 4:4:4
  Supports YCbCr 4:2:2
  Native detailed modes: 1
  Video Data Block:
    VIC  16:  1920x1080   60.000000 Hz  16:9     67.500 kHz    148.500000 MHz
    VIC   4:  1280x720    60.000000 Hz  16:9     45.000 kHz     74.250000 MHz
    VIC   3:   720x480    59.940060 Hz  16:9     31.469 kHz     27.000000 MHz
    VIC   1:   640x480    59.940476 Hz   4:3     31.469 kHz     25.175000 MHz
  Audio Data Block:
    Linear PCM:
      Max channels: 2
      Supported sample rates (kHz): 48 44.1 32
      Supported sample sizes (bits): 24 20 16
  Speaker Allocation Data Block:
    FL/FR - Front Left/Right
  Detailed Timing Descriptors:
    DTD 5:  1920x1080   60.000000 Hz  16:9     67.500 kHz    148.500000 MHz (696 mm x 367 mm)
                 Hfront   88 Hsync  44 Hback  148 Hpol P
                 Vfront    4 Vsync   5 Vback   36 Vpol P
    DTD 6:  2560x1440   59.950550 Hz  16:9     88.787 kHz    241.500000 MHz (600 mm x 340 mm)
                 Hfront   48 Hsync  32 Hback   80 Hpol P
                 Vfront    3 Vsync   5 Vback   33 Vpol N
Checksum: 0xcb  Unused space in Extension Block: 73 bytes

----------------

Block 5, DisplayID Extension Block:
  Version: 1.1
  Extension Count: 0
  Video Timing Modes Type 1 - Detailed Timings Data Block:
    DTD:  4096x2160   59.998457 Hz 256:135  133.317 kHz    556.730000 MHz (aspect 256:135, no 3D stereo, preferred)
               Hfront    8 Hsync  32 Hback   40 Hpol N
               Vfront   48 Vsync   8 Vback    6 Vpol N
    DTD:  4096x2160   50.000038 Hz 256:135  111.100 kHz    526.170000 MHz (aspect 256:135, no 3D stereo, preferred)
               Hfront  536 Hsync  64 Hback   40 Hpol N
               Vfront   48 Vsync   8 Vback    6 Vpol N
  Checksum: 0xa1
Checksum: 0x90  Unused space in Extension Block: 78 bytes

----------------

Warnings:

Block 0, Base EDID:
  Display Range Limits: GTF support is deprecated in EDID 1.4.
Block 1, CTA-861 Extension Block:
  IT Video Formats are overscanned by default, but normally this should be underscanned.
Block 4, CTA-861 Extension Block:
  IT Video Formats are overscanned by default, but normally this should be underscanned.
EDID:
  Base EDID: Some timings are out of range of the Monitor Ranges:
    Vertical Freq: 30.000 - 60.317 Hz (Monitor: 56.000 - 61.000 Hz)

Failures:

Block 0, Base EDID:
  Basic Display Parameters & Features: sRGB is signaled, but the chromaticities do not match.
  Detailed Timing Descriptor #1: Mismatch of image size 621x341 mm vs display size 600x340 mm.
  Detailed Timing Descriptor #2: Mismatch of image size 621x341 mm vs display size 600x340 mm.
  Display Range Limits: GTF can't be combined with non-continuous frequencies.
Block 1, CTA-861 Extension Block:
  Detailed Timing Descriptor #3: Mismatch of image size 696x367 mm vs display size 600x340 mm.
  Missing VCDB, needed for Set Selectable RGB Quantization to avoid interop issues.
Block 2, DisplayID Extension Block:
  Expected 0 DisplayID Extension Block, but got 1.
Block 3, Base EDID:
  Unknown Extension Block.
Block 4, CTA-861 Extension Block:
  Video Data Block: Duplicate VIC 16.
  Video Data Block: Duplicate VIC 4.
  Video Data Block: Duplicate VIC 3.
  Video Data Block: Duplicate VIC 1.
  Speaker Allocation Data Block: Only one instance of this Data Block is allowed.
  Detailed Timing Descriptor #5: Mismatch of image size 696x367 mm vs display size 600x340 mm.
  Missing VCDB, needed for Set Selectable RGB Quantization to avoid interop issues.
Block 5, DisplayID Extension Block:
  Product Type should be 0 in extension block.
EDID:
  Base EDID: The DTD max image size is 696x367mm, which is larger than the display size 600.0x340.0mm.
  Base EDID: EDID specified 2 extension block(s), but found 5 extension block(s).
  DisplayID: Missing DisplayID Product Identification Data Block.
  DisplayID: Missing DisplayID Display Parameters Data Block.
  DisplayID: Missing DisplayID Display Interface Features Data Block.

EDID conformity: FAIL
