
EDID (hex):
00ffffffffffff004e14b40a00000000
121e0104a5000078fad7a5a2594a9624
145054a30800d1c0b300810081808140
81c00101010122cc0050f0703e801810
650c58542100001a286800a0f0703e80
0890650c58542100001a000000fd0017
501ea03c010a202020202020000000fc
0053636570747265205a32370a2001cd
020328715090050403070206011f1413
1216111520230907036a030c00100000
7820000083010000011d007251d01e20
6e285500c48e2100001e011d8018711c
1620582c2500c48e2100009e8c0ad08a
20e02d10103e9600138e210000180bf4
00a0f07048803020650c58542100001e
000000000000000000000000000000db

Extracted contents:
header:          00 ff ff ff ff ff ff 00
serial number:   4e 14 b4 0a 00 00 00 00 12 1e
version:         01 04
basic params:    a5 00 00 78 fa
chroma info:     d7 a5 a2 59 4a 96 24 14 50 54
established:     a3 08 00
standard:        d1 c0 b3 00 81 00 81 80 81 40 81 c0 01 01 01 01
descriptor 1:    22 cc 00 50 f0 70 3e 80 18 10 65 0c 58 54 21 00 00 1a
descriptor 2:    28 68 00 a0 f0 70 3e 80 08 90 65 0c 58 54 21 00 00 1a
descriptor 3:    00 00 00 fd 00 17 50 1e a0 3c 01 0a 20 20 20 20 20 20
descriptor 4:    00 00 00 fc 00 53 63 65 70 74 72 65 20 5a 32 37 0a 20
extensions:      01
checksum:        cd

EDID version: 1.4
Manufacturer: SPT Model ab4 Serial Number --
Made in week 18 of 2020
Digital display
8 bits per primary color channel
DisplayPort interface
Image size is variable
Gamma: 2.20
DPMS levels: Standby Suspend Off
Supported color formats: RGB 4:4:4, YCrCb 4:4:4, YCrCb 4:2:2
First detailed timing includes the native pixel format and preferred refresh rate
Display x,y Chromaticity:
  Red:   0.6357, 0.3486
  Green: 0.2900, 0.5888
  Blue:  0.1425, 0.0800
  White: 0.3134, 0.3291
Established timings supported:
  720x400@70Hz 9:5 HorFreq: 31469 Hz Clock: 28.320 MHz
  640x480@60Hz 4:3 HorFreq: 31469 Hz Clock: 25.175 MHz
  800x600@56Hz 4:3 HorFreq: 35200 Hz Clock: 36.000 MHz
  800x600@60Hz 4:3 HorFreq: 37900 Hz Clock: 40.000 MHz
  1024x768@60Hz 4:3 HorFreq: 48400 Hz Clock: 65.000 MHz
Standard timings supported:
  1920x1080@60Hz 16:9
  1680x1050@60Hz 16:10 HorFreq: 64700 Hz Clock: 119.000 MHz
  1280x800@60Hz 16:10
  1280x1024@60Hz 5:4 HorFreq: 64000 Hz Clock: 108.000 MHz
  1280x960@60Hz 4:3 HorFreq: 60000 Hz Clock: 108.000 MHz
  1280x720@60Hz 16:9
Detailed mode: Clock 522.580 MHz, 600 mm x 340 mm
               3840 3864 3880 3920 hborder 0
               2160 2214 2219 2222 vborder 0
               +hsync -vsync 
               VertFreq: 59 Hz, HorFreq: 133311 Hz
Detailed mode: Clock 266.640 MHz, 600 mm x 340 mm
               3840 3848 3992 4000 hborder 0
               2160 2214 2219 2222 vborder 0
               +hsync -vsync 
               VertFreq: 30 Hz, HorFreq: 66660 Hz
Monitor ranges (bare limits): 23-80Hz V, 30-160kHz H, max dotclock 600MHz
Monitor name: Sceptre Z27
Has 1 extension blocks
Checksum: 0xcd (valid)

CTA extension block
Extension version: 3
36 bytes of CTA data
  Video data block
    VIC  16 1920x1080@60Hz 16:9 (native) HorFreq: 67500 Hz Clock: 148.500 MHz
    VIC   5 1920x1080i@60Hz 16:9  HorFreq: 33750 Hz Clock: 74.250 MHz
    VIC   4 1280x720@60Hz 16:9  HorFreq: 45000 Hz Clock: 74.250 MHz
    VIC   3 720x480@60Hz 16:9  HorFreq: 31469 Hz Clock: 27.000 MHz
    VIC   7 1440x480i@60Hz 16:9  HorFreq: 15734 Hz Clock: 27.000 MHz
    VIC   2 720x480@60Hz 4:3  HorFreq: 31469 Hz Clock: 27.000 MHz
    VIC   6 1440x480i@60Hz 4:3  HorFreq: 15734 Hz Clock: 27.000 MHz
    VIC   1 640x480@60Hz 4:3  HorFreq: 31469 Hz Clock: 25.175 MHz
    VIC  31 1920x1080@50Hz 16:9  HorFreq: 56250 Hz Clock: 148.500 MHz
    VIC  20 1920x1080i@50Hz 16:9  HorFreq: 28125 Hz Clock: 74.250 MHz
    VIC  19 1280x720@50Hz 16:9  HorFreq: 37500 Hz Clock: 74.250 MHz
    VIC  18 720x576@50Hz 16:9  HorFreq: 31250 Hz Clock: 27.000 MHz
    VIC  22 1440x576i@50Hz 16:9  HorFreq: 15625 Hz Clock: 27.000 MHz
    VIC  17 720x576@50Hz 4:3  HorFreq: 31250 Hz Clock: 27.000 MHz
    VIC  21 1440x576i@50Hz 4:3  HorFreq: 15625 Hz Clock: 27.000 MHz
    VIC  32 1920x1080@24Hz 16:9  HorFreq: 27000 Hz Clock: 74.250 MHz
  Audio data block
    Linear PCM, max channels 2
      Supported sample rates (kHz): 48 44.1 32
      Supported sample sizes (bits): 20 16
  Vendor-specific data block, OUI 000c03 (HDMI)
    Source physical address 1.0.0.0
    Maximum TMDS clock: 600MHz
    Extended HDMI video details:
  Speaker allocation data block
    Speaker map:
      FL/FR - Front Left/Right
Basic audio support
Supports YCbCr 4:4:4
Supports YCbCr 4:2:2
1 native detailed modes
Detailed mode: Clock 74.250 MHz, 708 mm x 398 mm
               1280 1390 1430 1650 hborder 0
                720  725  730  750 vborder 0
               +hsync +vsync 
               VertFreq: 60 Hz, HorFreq: 45000 Hz
Detailed mode: Clock 74.250 MHz, 708 mm x 398 mm
               1920 2008 2052 2200 hborder 0
                540  542  547  562 vborder 0
               +hsync +vsync interlaced 
               VertFreq: 60 Hz, HorFreq: 33750 Hz
Detailed mode: Clock 27.000 MHz, 531 mm x 398 mm
                720  736  798  858 hborder 0
                480  489  495  525 vborder 0
               -hsync -vsync 
               VertFreq: 59 Hz, HorFreq: 31468 Hz
Detailed mode: Clock 624.750 MHz, 600 mm x 340 mm
               3840 3888 3920 4000 hborder 0
               2160 2214 2219 2232 vborder 0
               +hsync +vsync 
               VertFreq: 69 Hz, HorFreq: 156187 Hz
Checksum: 0xdb (valid)

EDID block does NOT conform to EDID 1.4!
	HDMI VSDB Max TMDS rate is > 340
Warning: One or more of the timings is out of range of the Monitor Ranges:
  Vertical Freq: 24 - 70 Hz
  Horizontal Freq: 15625 - 156187 Hz
  Maximum Clock: 624.750 MHz


