
EDID (hex):
00ffffffffffff0010ac0d3034453044
020e0103801e1678eebe96a15b4c9424
184f54a54e0001010101010101010101
01010101010164190040410026301888
360030e410000018000000ff00335839
3637343138443045340a000000fc0044
454c4c203135303446500a20000000fd
003c4b1e3c08000a202020202020003f

Extracted contents:
header:          00 ff ff ff ff ff ff 00
serial number:   10 ac 0d 30 34 45 30 44 02 0e
version:         01 03
basic params:    80 1e 16 78 ee
chroma info:     be 96 a1 5b 4c 94 24 18 4f 54
established:     a5 4e 00
standard:        01 01 01 01 01 01 01 01 01 01 01 01 01 01 01 01
descriptor 1:    64 19 00 40 41 00 26 30 18 88 36 00 30 e4 10 00 00 18
descriptor 2:    00 00 00 ff 00 33 58 39 36 37 34 31 38 44 30 45 34 0a
descriptor 3:    00 00 00 fc 00 44 45 4c 4c 20 31 35 30 34 46 50 0a 20
descriptor 4:    00 00 00 fd 00 3c 4b 1e 3c 08 00 0a 20 20 20 20 20 20
extensions:      00
checksum:        3f

EDID version: 1.3
Manufacturer: DEL Model 300d Serial Number --
Digital display
Maximum image size: 30 cm x 22 cm
Gamma: 2.20
DPMS levels: Standby Suspend Off
RGB color display
Default (sRGB) color space is primary color space
First detailed timing is preferred timing
Display x,y Chromaticity:
  Red:   0.6308, 0.3583
  Green: 0.2998, 0.5800
  Blue:  0.1425, 0.0947
  White: 0.3095, 0.3300
Established timings supported:
  720x400@70Hz 9:5 HorFreq: 31469 Hz Clock: 28.320 MHz
  640x480@60Hz 4:3 HorFreq: 31469 Hz Clock: 25.175 MHz
  640x480@75Hz 4:3 HorFreq: 37500 Hz Clock: 31.500 MHz
  800x600@60Hz 4:3 HorFreq: 37900 Hz Clock: 40.000 MHz
  800x600@75Hz 4:3 HorFreq: 46900 Hz Clock: 49.500 MHz
  1024x768@60Hz 4:3 HorFreq: 48400 Hz Clock: 65.000 MHz
  1024x768@70Hz 4:3 HorFreq: 56500 Hz Clock: 75.000 MHz
  1024x768@75Hz 4:3 HorFreq: 60000 Hz Clock: 78.750 MHz
Standard timings supported:
Detailed mode: Clock 65.000 MHz, 304 mm x 228 mm
               1024 1048 1184 1344 hborder 0
                768  771  777  806 vborder 0
               -hsync -vsync 
               VertFreq: 60 Hz, HorFreq: 48363 Hz
Serial number: --
Monitor name: DELL 1504FP
Monitor ranges (GTF): 60-75Hz V, 30-60kHz H, max dotclock 80MHz
Checksum: 0x3f (valid)
EDID block does NOT conform to EDID 1.3!
	sRGB is signaled, but the chromaticities do not match
EDID block does not conform at all!
	Bad year of manufacture
