
EDID (hex):
00ffffffffffff0026cd1d5601010101
3315010381331d782a5ea5a2554da026
115054bfef80b300a9409500818f8180
950f714f81c0023a801871382d40582c
4500fe1f1100001e000000ff00313131
33383135313030393936000000fd0037
4c1e5111000a202020202020000000fc
00504c323337370a202020202020006c

Extracted contents:
header:          00 ff ff ff ff ff ff 00
serial number:   26 cd 1d 56 01 01 01 01 33 15
version:         01 03
basic params:    81 33 1d 78 2a
chroma info:     5e a5 a2 55 4d a0 26 11 50 54
established:     bf ef 80
standard:        b3 00 a9 40 95 00 81 8f 81 80 95 0f 71 4f 81 c0
descriptor 1:    02 3a 80 18 71 38 2d 40 58 2c 45 00 fe 1f 11 00 00 1e
descriptor 2:    00 00 00 ff 00 31 31 31 33 38 31 35 31 30 30 39 39 36
descriptor 3:    00 00 00 fd 00 37 4c 1e 51 11 00 0a 20 20 20 20 20 20
descriptor 4:    00 00 00 fc 00 50 4c 32 33 37 37 0a 20 20 20 20 20 20
extensions:      00
checksum:        6c

EDID version: 1.3
Manufacturer: IVM Model 561d Serial Number --
Made in week 51 of 2011
Digital display
DFP 1.x compatible TMDS
Maximum image size: 51 cm x 29 cm
Gamma: 2.20
DPMS levels: Off
RGB color display
First detailed timing is preferred timing
Display x,y Chromaticity:
  Red:   0.6337, 0.3330
  Green: 0.3037, 0.6269
  Blue:  0.1503, 0.0683
  White: 0.3134, 0.3291
Established timings supported:
  720x400@70Hz 9:5 HorFreq: 31469 Hz Clock: 28.320 MHz
  640x480@60Hz 4:3 HorFreq: 31469 Hz Clock: 25.175 MHz
  640x480@67Hz 4:3 HorFreq: 35000 Hz Clock: 30.240 MHz
  640x480@72Hz 4:3 HorFreq: 37900 Hz Clock: 31.500 MHz
  640x480@75Hz 4:3 HorFreq: 37500 Hz Clock: 31.500 MHz
  800x600@56Hz 4:3 HorFreq: 35200 Hz Clock: 36.000 MHz
  800x600@60Hz 4:3 HorFreq: 37900 Hz Clock: 40.000 MHz
  800x600@72Hz 4:3 HorFreq: 48100 Hz Clock: 50.000 MHz
  800x600@75Hz 4:3 HorFreq: 46900 Hz Clock: 49.500 MHz
  832x624@75Hz 4:3 HorFreq: 49726 Hz Clock: 57.284 MHz
  1024x768@60Hz 4:3 HorFreq: 48400 Hz Clock: 65.000 MHz
  1024x768@70Hz 4:3 HorFreq: 56500 Hz Clock: 75.000 MHz
  1024x768@75Hz 4:3 HorFreq: 60000 Hz Clock: 78.750 MHz
  1280x1024@75Hz 5:4 HorFreq: 80000 Hz Clock: 135.000 MHz
  1152x870@75Hz 192:145 HorFreq: 67500 Hz Clock: 108.000 MHz
Standard timings supported:
  1680x1050@60Hz 16:10 HorFreq: 64700 Hz Clock: 119.000 MHz
  1600x1200@60Hz 4:3 HorFreq: 75000 Hz Clock: 162.000 MHz
  1440x900@60Hz 16:10 HorFreq: 55500 Hz Clock: 88.750 MHz
  1280x1024@75Hz 5:4 HorFreq: 80000 Hz Clock: 135.000 MHz
  1280x1024@60Hz 5:4 HorFreq: 64000 Hz Clock: 108.000 MHz
  1440x900@75Hz 16:10 HorFreq: 82300 Hz Clock: 156.000 MHz
  1152x864@75Hz 4:3 HorFreq: 67500 Hz Clock: 108.000 MHz
  1280x720@60Hz 16:9
Detailed mode: Clock 148.500 MHz, 510 mm x 287 mm
               1920 2008 2052 2200 hborder 0
               1080 1084 1089 1125 vborder 0
               +hsync +vsync 
               VertFreq: 60 Hz, HorFreq: 67500 Hz
Serial number: --
Monitor ranges (GTF): 55-76Hz V, 30-81kHz H, max dotclock 170MHz
Monitor name: PL2377
Checksum: 0x6c (valid)
One or more of the timings is out of range of the Monitor Ranges:
  Vertical Freq: 56 - 75 Hz
  Horizontal Freq: 31469 - 82300 Hz
  Maximum Clock: 162.000 MHz
