edid-decode (hex):

00 ff ff ff ff ff ff 00 06 b3 d1 27 01 01 01 01
09 20 01 03 80 3c 22 78 ea ce c0 a3 55 51 9e 27
0e 50 54 bf ef 00 71 4f 81 80 81 40 81 c0 95 00
b3 00 d1 c0 d1 cf 02 3a 80 18 71 38 2d 40 58 2c
45 00 56 50 21 00 00 1e 00 00 00 fd 00 32 4b 1e
55 17 00 0a 20 20 20 20 20 20 00 00 00 fc 00 56
41 32 37 39 0a 20 20 20 20 20 20 20 00 00 00 ff
00 4e 32 4c 4d 51 53 31 35 30 39 33 34 0a 01 2a

02 03 16 b1 4b 90 05 04 03 02 01 11 12 13 14 1f
65 03 0c 00 10 00 3b 56 80 b0 72 38 32 40 88 d0
35 00 56 50 21 00 00 1a 66 21 56 aa 51 00 1e 30
46 8f 33 00 56 50 21 00 00 1e 01 1d 00 72 51 d0
1e 20 6e 28 55 00 56 50 21 00 00 1e 8c 0a d0 8a
20 e0 2d 10 10 3e 96 00 56 50 21 00 00 18 01 1d
80 18 71 1c 16 20 58 2c 25 00 56 50 21 00 00 9e
00 00 00 00 00 00 00 00 00 00 00 00 00 00 00 c9

00 ff ff ff ff ff ff 00 06 b3 d1 27 01 01 01 01
09 20 01 03 80 3c 22 78 ea ce c0 a3 55 51 9e 27
0e 50 54 bf ef 00 71 4f 81 80 81 40 81 c0 95 00
b3 00 d1 c0 d1 cf 02 3a 80 18 71 38 2d 40 58 2c
45 00 56 50 21 00 00 1e 00 00 00 fd 00 32 4b 1e
55 17 00 0a 20 20 20 20 20 20 00 00 00 fc 00 56
41 32 37 39 0a 20 20 20 20 20 20 20 00 00 00 ff
00 4e 32 4c 4d 51 53 31 35 30 39 33 34 0a 01 2a

02 03 16 b1 4b 90 05 04 03 02 01 11 12 13 14 1f
65 03 0c 00 10 00 3b 56 80 b0 72 38 32 40 88 d0
35 00 56 50 21 00 00 1a 66 21 56 aa 51 00 1e 30
46 8f 33 00 56 50 21 00 00 1e 01 1d 00 72 51 d0
1e 20 6e 28 55 00 56 50 21 00 00 1e 8c 0a d0 8a
20 e0 2d 10 10 3e 96 00 56 50 21 00 00 18 01 1d
80 18 71 1c 16 20 58 2c 25 00 56 50 21 00 00 9e
00 00 00 00 00 00 00 00 00 00 00 00 00 00 00 c9

----------------

Block 0, Base EDID:
  EDID Structure Version & Revision: 1.3
  Vendor & Product Identification:
    Manufacturer: AUS
    Model: 10193
    Serial Number: ...
    Made in: week 9 of 2022
  Basic Display Parameters & Features:
    Digital display
    Maximum image size: 60 cm x 34 cm
    Gamma: 2.20
    DPMS levels: Standby Suspend Off
    RGB color display
    First detailed timing is the preferred timing
  Color Characteristics:
    Red  : 0.6396, 0.3320
    Green: 0.3193, 0.6191
    Blue : 0.1552, 0.0546
    White: 0.3125, 0.3281
  Established Timings I & II:
    IBM     :   720x400    70.081663 Hz   9:5     31.467 kHz     28.320000 MHz
    DMT 0x04:   640x480    59.940476 Hz   4:3     31.469 kHz     25.175000 MHz
    Apple   :   640x480    66.666667 Hz   4:3     35.000 kHz     30.240000 MHz
    DMT 0x05:   640x480    72.808802 Hz   4:3     37.861 kHz     31.500000 MHz
    DMT 0x06:   640x480    75.000000 Hz   4:3     37.500 kHz     31.500000 MHz
    DMT 0x08:   800x600    56.250000 Hz   4:3     35.156 kHz     36.000000 MHz
    DMT 0x09:   800x600    60.316541 Hz   4:3     37.879 kHz     40.000000 MHz
    DMT 0x0a:   800x600    72.187572 Hz   4:3     48.077 kHz     50.000000 MHz
    DMT 0x0b:   800x600    75.000000 Hz   4:3     46.875 kHz     49.500000 MHz
    Apple   :   832x624    74.551266 Hz   4:3     49.726 kHz     57.284000 MHz
    DMT 0x10:  1024x768    60.003840 Hz   4:3     48.363 kHz     65.000000 MHz
    DMT 0x11:  1024x768    70.069359 Hz   4:3     56.476 kHz     75.000000 MHz
    DMT 0x12:  1024x768    75.028582 Hz   4:3     60.023 kHz     78.750000 MHz
    DMT 0x24:  1280x1024   75.024675 Hz   5:4     79.976 kHz    135.000000 MHz
  Standard Timings:
    DMT 0x15:  1152x864    75.000000 Hz   4:3     67.500 kHz    108.000000 MHz
    DMT 0x23:  1280x1024   60.019740 Hz   5:4     63.981 kHz    108.000000 MHz
    DMT 0x20:  1280x960    60.000000 Hz   4:3     60.000 kHz    108.000000 MHz
    DMT 0x55:  1280x720    60.000000 Hz  16:9     45.000 kHz     74.250000 MHz
    DMT 0x2f:  1440x900    59.887445 Hz  16:10    55.935 kHz    106.500000 MHz
    DMT 0x3a:  1680x1050   59.954250 Hz  16:10    65.290 kHz    146.250000 MHz
    DMT 0x52:  1920x1080   60.000000 Hz  16:9     67.500 kHz    148.500000 MHz
    GTF     :  1920x1080   75.000068 Hz  16:9     84.600 kHz    220.637000 MHz
  Detailed Timing Descriptors:
    DTD  1:  1920x1080   60.000000 Hz  16:9     67.500 kHz    148.500000 MHz (598 mm x 336 mm)
                  Hfront   88 Hsync  44 Hback  148 Hpol P
                  Vfront    4 Vsync   5 Vback   36 Vpol P
    Display Range Limits:
      Monitor ranges (GTF): 50-75 Hz V, 30-85 kHz H, max dotclock 230 MHz
    Display Product Name: 'VA279'
    Display Product Serial Number: ...
  Extension blocks: 1
Checksum: 0x2a

----------------

Block 1, CTA-861 Extension Block:
  Revision: 3
  Underscans IT Video Formats by default
  Supports YCbCr 4:4:4
  Supports YCbCr 4:2:2
  Native detailed modes: 1
  Video Data Block:
    VIC  16:  1920x1080   60.000000 Hz  16:9     67.500 kHz    148.500000 MHz (native)
    VIC   5:  1920x1080i  60.000000 Hz  16:9     33.750 kHz     74.250000 MHz
    VIC   4:  1280x720    60.000000 Hz  16:9     45.000 kHz     74.250000 MHz
    VIC   3:   720x480    59.940060 Hz  16:9     31.469 kHz     27.000000 MHz
    VIC   2:   720x480    59.940060 Hz   4:3     31.469 kHz     27.000000 MHz
    VIC   1:   640x480    59.940476 Hz   4:3     31.469 kHz     25.175000 MHz
    VIC  17:   720x576    50.000000 Hz   4:3     31.250 kHz     27.000000 MHz
    VIC  18:   720x576    50.000000 Hz  16:9     31.250 kHz     27.000000 MHz
    VIC  19:  1280x720    50.000000 Hz  16:9     37.500 kHz     74.250000 MHz
    VIC  20:  1920x1080i  50.000000 Hz  16:9     28.125 kHz     74.250000 MHz
    VIC  31:  1920x1080   50.000000 Hz  16:9     56.250 kHz    148.500000 MHz
  Vendor-Specific Data Block (HDMI), OUI 00-0C-03:
    Source physical address: 1.0.0.0
  Detailed Timing Descriptors:
    DTD  2:  1920x1080   74.905668 Hz  16:9     84.643 kHz    220.750000 MHz (598 mm x 336 mm)
                  Hfront  136 Hsync 208 Hback  344 Hpol P
                  Vfront    3 Vsync   5 Vback   42 Vpol N
    DTD  3:  1366x768    59.789541 Hz 683:384   47.712 kHz     85.500000 MHz (598 mm x 336 mm)
                  Hfront   70 Hsync 143 Hback  213 Hpol P
                  Vfront    3 Vsync   3 Vback   24 Vpol P
    DTD  4:  1280x720    60.000000 Hz  16:9     45.000 kHz     74.250000 MHz (598 mm x 336 mm)
                  Hfront  110 Hsync  40 Hback  220 Hpol P
                  Vfront    5 Vsync   5 Vback   20 Vpol P
    DTD  5:   720x480    59.940060 Hz   3:2     31.469 kHz     27.000000 MHz (598 mm x 336 mm)
                  Hfront   16 Hsync  62 Hback   60 Hpol N
                  Vfront    9 Vsync   6 Vback   30 Vpol N
    DTD  6:  1920x1080i  60.000000 Hz  16:9     33.750 kHz     74.250000 MHz (598 mm x 336 mm)
                  Hfront   88 Hsync  44 Hback  148 Hpol P
                  Vfront    2 Vsync   5 Vback   15 Vpol P Vfront +0.5 Odd Field
                  Vfront    2 Vsync   5 Vback   15 Vpol P Vback  +0.5 Even Field
Checksum: 0xc9  Unused space in Extension Block: 15 bytes

----------------

Block 2, Unknown EDID Extension Block 0x00:
  00 ff ff ff ff ff ff 00 06 b3 d1 27 01 01 01 01 '...........'....'
  09 20 01 03 80 3c 22 78 ea ce c0 a3 55 51 9e 27 '. ...<"x....UQ.''
  0e 50 54 bf ef 00 71 4f 81 80 81 40 81 c0 95 00 '.PT...qO...@....'
  b3 00 d1 c0 d1 cf 02 3a 80 18 71 38 2d 40 58 2c '.......:..q8-@X,'
  45 00 56 50 21 00 00 1e 00 00 00 fd 00 32 4b 1e 'E.VP!........2K.'
  55 17 00 0a 20 20 20 20 20 20 00 00 00 fc 00 56 'U...      .....V'
  41 32 37 39 0a 20 20 20 20 20 20 20 00 00 00 ff 'A279.       ....'
  00 4e 32 4c 4d 51 53 31 35 30 39 33 34 0a 01 2a '.N2LMQS150934..*'
Checksum: 0x2a

----------------

Block 3, CTA-861 Extension Block:
  Revision: 3
  Underscans IT Video Formats by default
  Supports YCbCr 4:4:4
  Supports YCbCr 4:2:2
  Native detailed modes: 1
  Video Data Block:
    VIC  16:  1920x1080   60.000000 Hz  16:9     67.500 kHz    148.500000 MHz (native)
    VIC   5:  1920x1080i  60.000000 Hz  16:9     33.750 kHz     74.250000 MHz
    VIC   4:  1280x720    60.000000 Hz  16:9     45.000 kHz     74.250000 MHz
    VIC   3:   720x480    59.940060 Hz  16:9     31.469 kHz     27.000000 MHz
    VIC   2:   720x480    59.940060 Hz   4:3     31.469 kHz     27.000000 MHz
    VIC   1:   640x480    59.940476 Hz   4:3     31.469 kHz     25.175000 MHz
    VIC  17:   720x576    50.000000 Hz   4:3     31.250 kHz     27.000000 MHz
    VIC  18:   720x576    50.000000 Hz  16:9     31.250 kHz     27.000000 MHz
    VIC  19:  1280x720    50.000000 Hz  16:9     37.500 kHz     74.250000 MHz
    VIC  20:  1920x1080i  50.000000 Hz  16:9     28.125 kHz     74.250000 MHz
    VIC  31:  1920x1080   50.000000 Hz  16:9     56.250 kHz    148.500000 MHz
  Vendor-Specific Data Block (HDMI), OUI 00-0C-03:
    Source physical address: 1.0.0.0
  Detailed Timing Descriptors:
    DTD  7:  1920x1080   74.905668 Hz  16:9     84.643 kHz    220.750000 MHz (598 mm x 336 mm)
                  Hfront  136 Hsync 208 Hback  344 Hpol P
                  Vfront    3 Vsync   5 Vback   42 Vpol N
    DTD  8:  1366x768    59.789541 Hz 683:384   47.712 kHz     85.500000 MHz (598 mm x 336 mm)
                  Hfront   70 Hsync 143 Hback  213 Hpol P
                  Vfront    3 Vsync   3 Vback   24 Vpol P
    DTD  9:  1280x720    60.000000 Hz  16:9     45.000 kHz     74.250000 MHz (598 mm x 336 mm)
                  Hfront  110 Hsync  40 Hback  220 Hpol P
                  Vfront    5 Vsync   5 Vback   20 Vpol P
    DTD 10:   720x480    59.940060 Hz   3:2     31.469 kHz     27.000000 MHz (598 mm x 336 mm)
                  Hfront   16 Hsync  62 Hback   60 Hpol N
                  Vfront    9 Vsync   6 Vback   30 Vpol N
    DTD 11:  1920x1080i  60.000000 Hz  16:9     33.750 kHz     74.250000 MHz (598 mm x 336 mm)
                  Hfront   88 Hsync  44 Hback  148 Hpol P
                  Vfront    2 Vsync   5 Vback   15 Vpol P Vfront +0.5 Odd Field
                  Vfront    2 Vsync   5 Vback   15 Vpol P Vback  +0.5 Even Field
Checksum: 0xc9  Unused space in Extension Block: 15 bytes

----------------

Warnings:

Block 1, CTA-861 Extension Block:
  Display Product Serial Number is set, so the Serial Number in the Base EDID should be 0.
  Add a Colorimetry Data Block with the sRGB colorimetry bit set to avoid interop issues.
Block 3, CTA-861 Extension Block:
  Display Product Serial Number is set, so the Serial Number in the Base EDID should be 0.
  Add a Colorimetry Data Block with the sRGB colorimetry bit set to avoid interop issues.
EDID:
  CTA-861: Multiple native progressive timings are defined.

Failures:

Block 1, CTA-861 Extension Block:
  Missing VCDB, needed for Set Selectable RGB Quantization to avoid interop issues.
Block 2, Base EDID:
  Unknown Extension Block.
Block 3, CTA-861 Extension Block:
  Video Data Block: Duplicate VIC 16.
  Video Data Block: Duplicate VIC 5.
  Video Data Block: Duplicate VIC 4.
  Video Data Block: Duplicate VIC 3.
  Video Data Block: Duplicate VIC 2.
  Video Data Block: Duplicate VIC 1.
  Video Data Block: Duplicate VIC 17.
  Video Data Block: Duplicate VIC 18.
  Video Data Block: Duplicate VIC 19.
  Video Data Block: Duplicate VIC 20.
  Video Data Block: Duplicate VIC 31.
  Missing VCDB, needed for Set Selectable RGB Quantization to avoid interop issues.
EDID:
  Base EDID: Some timings are out of range of the Monitor Ranges:
    Horizontal Freq: 28.125 - 84.643 kHz (Monitor: 30.000 - 85.000 kHz)
  Base EDID: EDID specified 1 extension block(s), but found 3 extension block(s).
  Base EDID: EDID 1.3 requires a Block Map Extension in Block 1 if there are more than 2 blocks in the EDID.

EDID conformity: FAIL
