edid-decode (hex):

00 ff ff ff ff ff ff 00 34 38 c3 06 9b 11 b4 00
26 0e 01 03 80 21 1b 78 ea ae a5 a6 54 4c 99 26
14 50 54 21 08 00 31 40 45 40 61 40 81 80 01 01
01 01 01 01 01 01 30 2a 00 98 51 00 2a 40 30 70
13 00 4a 0e 11 00 00 1e 00 00 00 fd 00 3b 3d 1f
43 ff 00 0a 20 20 20 20 20 20 00 00 00 fc 00 42
65 6c 69 6e 65 61 20 0a 20 20 20 20 00 00 00 fc
00 31 30 31 37 33 30 0a 20 20 20 20 20 20 00 73

----------------

Block 0, Base EDID:
  EDID Structure Version & Revision: 1.3
  Vendor & Product Identification:
    Manufacturer: MAX
    Model: 1731
    Serial Number: ...
    Made in: week 38 of 2004
  Basic Display Parameters & Features:
    Digital display
    Maximum image size: 33 cm x 27 cm
    Gamma: 2.20
    DPMS levels: Standby Suspend Off
    RGB color display
    First detailed timing is the preferred timing
  Color Characteristics:
    Red  : 0.6503, 0.3300
    Green: 0.2998, 0.5996
    Blue : 0.1503, 0.0800
    White: 0.3134, 0.3291
  Established Timings I & II:
    DMT 0x04:   640x480    59.940476 Hz   4:3     31.469 kHz     25.175000 MHz
    DMT 0x09:   800x600    60.316541 Hz   4:3     37.879 kHz     40.000000 MHz
    DMT 0x10:  1024x768    60.003840 Hz   4:3     48.363 kHz     65.000000 MHz
  Standard Timings:
    DMT 0x04:   640x480    59.940476 Hz   4:3     31.469 kHz     25.175000 MHz
    DMT 0x09:   800x600    60.316541 Hz   4:3     37.879 kHz     40.000000 MHz
    DMT 0x10:  1024x768    60.003840 Hz   4:3     48.363 kHz     65.000000 MHz
    DMT 0x23:  1280x1024   60.019740 Hz   5:4     63.981 kHz    108.000000 MHz
  Detailed Timing Descriptors:
    DTD 1:  1280x1024   60.019740 Hz   5:4     63.981 kHz    108.000000 MHz (330 mm x 270 mm)
                 Hfront   48 Hsync 112 Hback  248 Hpol P
                 Vfront    1 Vsync   3 Vback   38 Vpol P
    Display Range Limits:
      Monitor ranges (GTF): 59-61 Hz V, 31-67 kHz H, max dotclock 2550 MHz
    Display Product Name: 'Belinea '
    Display Product Name: '101730'
Checksum: 0x73

----------------

Failures:

Block 0, Base EDID:
  Display Product Name: One or more trailing spaces.

EDID conformity: FAIL
