
EDID (hex):
00ffffffffffff002264a31c01010101
27110103682f1d782ae525a65444a125
145054bfef808180714f8140950f9500
01010101010121399030621a274068b0
3600e00e1100001c000000ff00373339
4d48334a593533303235000000fd0032
4b1e520f000a202020202020000000fc
0048473231360a202020202020200033

Extracted contents:
header:          00 ff ff ff ff ff ff 00
serial number:   22 64 a3 1c 01 01 01 01 27 11
version:         01 03
basic params:    68 2f 1d 78 2a
chroma info:     e5 25 a6 54 44 a1 25 14 50 54
established:     bf ef 80
standard:        81 80 71 4f 81 40 95 0f 95 00 01 01 01 01 01 01
descriptor 1:    21 39 90 30 62 1a 27 40 68 b0 36 00 e0 0e 11 00 00 1c
descriptor 2:    00 00 00 ff 00 37 33 39 4d 48 33 4a 59 35 33 30 32 35
descriptor 3:    00 00 00 fd 00 32 4b 1e 52 0f 00 0a 20 20 20 20 20 20
descriptor 4:    00 00 00 fc 00 48 47 32 31 36 0a 20 20 20 20 20 20 20
extensions:      00
checksum:        33

EDID version: 1.3
Manufacturer: HSD Model 1ca3 Serial Number --
Made in week 39 of 2007
Analog display, Input voltage level: 0.7/0.7 V
Sync: Separate 
Maximum image size: 47 cm x 29 cm
Gamma: 2.20
DPMS levels: Off
RGB color display
First detailed timing is preferred timing
Display x,y Chromaticity:
  Red:   0.6513, 0.3300
  Green: 0.2666, 0.6298
  Blue:  0.1445, 0.0800
  White: 0.3134, 0.3291
Established timings supported:
  720x400@70Hz 9:5 HorFreq: 31469 Hz Clock: 28.320 MHz
  640x480@60Hz 4:3 HorFreq: 31469 Hz Clock: 25.175 MHz
  640x480@67Hz 4:3 HorFreq: 35000 Hz Clock: 30.240 MHz
  640x480@72Hz 4:3 HorFreq: 37900 Hz Clock: 31.500 MHz
  640x480@75Hz 4:3 HorFreq: 37500 Hz Clock: 31.500 MHz
  800x600@56Hz 4:3 HorFreq: 35200 Hz Clock: 36.000 MHz
  800x600@60Hz 4:3 HorFreq: 37900 Hz Clock: 40.000 MHz
  800x600@72Hz 4:3 HorFreq: 48100 Hz Clock: 50.000 MHz
  800x600@75Hz 4:3 HorFreq: 46900 Hz Clock: 49.500 MHz
  832x624@75Hz 4:3 HorFreq: 49726 Hz Clock: 57.284 MHz
  1024x768@60Hz 4:3 HorFreq: 48400 Hz Clock: 65.000 MHz
  1024x768@70Hz 4:3 HorFreq: 56500 Hz Clock: 75.000 MHz
  1024x768@75Hz 4:3 HorFreq: 60000 Hz Clock: 78.750 MHz
  1280x1024@75Hz 5:4 HorFreq: 80000 Hz Clock: 135.000 MHz
  1152x870@75Hz 192:145 HorFreq: 67500 Hz Clock: 108.000 MHz
Standard timings supported:
  1280x1024@60Hz 5:4 HorFreq: 64000 Hz Clock: 108.000 MHz
  1152x864@75Hz 4:3 HorFreq: 67500 Hz Clock: 108.000 MHz
  1280x960@60Hz 4:3 HorFreq: 60000 Hz Clock: 108.000 MHz
  1440x900@75Hz 16:10 HorFreq: 82300 Hz Clock: 156.000 MHz
  1440x900@60Hz 16:10 HorFreq: 55500 Hz Clock: 88.750 MHz
Detailed mode: Clock 146.250 MHz, 480 mm x 270 mm
               1680 1784 1960 2240 hborder 0
               1050 1053 1059 1089 vborder 0
               -hsync +vsync 
               VertFreq: 59 Hz, HorFreq: 65290 Hz
Serial number: --
Monitor ranges (GTF): 50-75Hz V, 30-82kHz H, max dotclock 150MHz
Monitor name: HG216
Checksum: 0x33 (valid)
One or more of the timings is out of range of the Monitor Ranges:
  Vertical Freq: 56 - 75 Hz
  Horizontal Freq: 31469 - 82300 Hz
  Maximum Clock: 156.000 MHz
