edid-decode (hex):

00 ff ff ff ff ff ff 00 26 cd b0 46 06 09 d9 01
2b 0d 01 03 81 22 1b 78 ee f3 85 a5 59 4a 99 25
1d 50 54 bf ef 00 01 40 01 40 01 40 01 40 01 40
01 40 01 40 01 40 bc 34 00 98 51 00 2a 40 10 90
13 00 52 0e 11 00 00 1e 00 00 00 ff 00 30 35 31
39 32 33 31 30 30 30 38 33 38 00 00 00 fc 00 50
72 6f 4c 69 74 65 48 34 33 30 0a 20 00 00 00 fd
00 38 4b 18 50 0e 00 0a 20 20 20 20 20 20 00 3f

----------------

Block 0, Base EDID:
  EDID Structure Version & Revision: 1.3
  Vendor & Product Identification:
    Manufacturer: IVM
    Model: 18096
    Serial Number: ...
    Made in: week 43 of 2003
  Basic Display Parameters & Features:
    Digital display
    DFP 1.x compatible TMDS
    Maximum image size: 34 cm x 27 cm
    Gamma: 2.20
    DPMS levels: Standby Suspend Off
    RGB color display
    Default (sRGB) color space is primary color space
    First detailed timing is the preferred timing
  Color Characteristics:
    Red  : 0.6474, 0.3505
    Green: 0.2890, 0.6005
    Blue : 0.1464, 0.1132
    White: 0.3134, 0.3291
  Established Timings I & II:
    IBM     :   720x400    70.082 Hz   9:5    31.467 kHz  28.320 MHz
    DMT 0x04:   640x480    59.940 Hz   4:3    31.469 kHz  25.175 MHz
    Apple   :   640x480    66.667 Hz   4:3    35.000 kHz  30.240 MHz
    DMT 0x05:   640x480    72.809 Hz   4:3    37.861 kHz  31.500 MHz
    DMT 0x06:   640x480    75.000 Hz   4:3    37.500 kHz  31.500 MHz
    DMT 0x08:   800x600    56.250 Hz   4:3    35.156 kHz  36.000 MHz
    DMT 0x09:   800x600    60.317 Hz   4:3    37.879 kHz  40.000 MHz
    DMT 0x0a:   800x600    72.188 Hz   4:3    48.077 kHz  50.000 MHz
    DMT 0x0b:   800x600    75.000 Hz   4:3    46.875 kHz  49.500 MHz
    Apple   :   832x624    74.551 Hz   4:3    49.726 kHz  57.284 MHz
    DMT 0x10:  1024x768    60.004 Hz   4:3    48.363 kHz  65.000 MHz
    DMT 0x11:  1024x768    70.069 Hz   4:3    56.476 kHz  75.000 MHz
    DMT 0x12:  1024x768    75.029 Hz   4:3    60.023 kHz  78.750 MHz
    DMT 0x24:  1280x1024   75.025 Hz   5:4    79.976 kHz 135.000 MHz
  Standard Timings:
  Detailed Timing Descriptors:
    DTD 1:  1280x1024   75.025 Hz   5:4    79.976 kHz 135.000 MHz (338 mm x 270 mm)
                 Hfront   16 Hsync 144 Hback 248 Hpol P
                 Vfront    1 Vsync   3 Vback  38 Vpol P
    Display Product Serial Number: ...
    Display Product Name: 'ProLiteH430'
  Display Range Limits:
    Monitor ranges (GTF): 56-75 Hz V, 24-80 kHz H, max dotclock 140 MHz
Checksum: 0x3f

----------------

Failures:

Block 0, Base EDID:
  Basic Display Parameters & Features: sRGB is signaled, but the chromaticities do not match.
  Standard Timings: Use 0x0101 as the invalid Standard Timings code, not 0x0140.
  Standard Timings: Use 0x0101 as the invalid Standard Timings code, not 0x0140.
  Standard Timings: Use 0x0101 as the invalid Standard Timings code, not 0x0140.
  Standard Timings: Use 0x0101 as the invalid Standard Timings code, not 0x0140.
  Standard Timings: Use 0x0101 as the invalid Standard Timings code, not 0x0140.
  Standard Timings: Use 0x0101 as the invalid Standard Timings code, not 0x0140.
  Standard Timings: Use 0x0101 as the invalid Standard Timings code, not 0x0140.
  Standard Timings: Use 0x0101 as the invalid Standard Timings code, not 0x0140.

EDID conformity: FAIL
