edid-decode (hex):

00 ff ff ff ff ff ff 00 30 a4 68 46 00 00 00 00
23 0c 01 03 00 24 1d 78 ef 0d c2 a0 57 47 98 27
12 48 4f a1 09 00 81 80 01 01 01 01 01 01 01 01
01 01 01 01 01 01 a9 1a 00 a0 50 00 16 30 30 20
37 00 00 00 00 00 00 1a cc 29 a0 d0 51 84 22 30
0a 98 36 00 68 22 11 00 00 1e 00 00 00 fc 00 4c
45 44 0a 20 20 20 20 20 20 20 20 20 94 43 80 90
72 38 28 40 a3 20 35 00 00 00 00 00 00 1c 00 bc

----------------

Block 0, Base EDID:
  EDID Structure Version & Revision: 1.3
  Vendor & Product Identification:
    Manufacturer: LED
    Model: 18024
    Made in: week 35 of 2002
  Basic Display Parameters & Features:
    Analog display
    Signal Level Standard: 0.700 : 0.300 : 1.000 V p-p
    Blank level equals black level
    Maximum image size: 36 cm x 29 cm
    Gamma: 2.20
    DPMS levels: Standby Suspend Off
    RGB color display
    Default (sRGB) color space is primary color space
    First detailed timing is the preferred timing
    Supports GTF timings within operating range
  Color Characteristics:
    Red  : 0.6250, 0.3398
    Green: 0.2802, 0.5947
    Blue : 0.1552, 0.0703
    White: 0.2812, 0.3105
  Established Timings I & II:
    IBM     :   720x400    70.081663 Hz   9:5     31.467 kHz     28.320000 MHz
    DMT 0x04:   640x480    59.940476 Hz   4:3     31.469 kHz     25.175000 MHz
    DMT 0x09:   800x600    60.316541 Hz   4:3     37.879 kHz     40.000000 MHz
    DMT 0x10:  1024x768    60.003840 Hz   4:3     48.363 kHz     65.000000 MHz
    DMT 0x24:  1280x1024   75.024675 Hz   5:4     79.976 kHz    135.000000 MHz
  Standard Timings:
    DMT 0x23:  1280x1024   60.019740 Hz   5:4     63.981 kHz    108.000000 MHz
  Detailed Timing Descriptors:
    DTD 1:  1280x768    59.994726 Hz   5:3     47.396 kHz     68.250000 MHz
                 Hfront   48 Hsync  32 Hback   80 Hpol P
                 Vfront    3 Vsync   7 Vback   12 Vpol N
    DTD 2:  1440x900    60.168607 Hz   8:5     56.197 kHz    107.000000 MHz (360 mm x 290 mm)
                 Hfront   10 Hsync 152 Hback  302 Hpol P
                 Vfront    3 Vsync   6 Vback   25 Vpol P
    Display Product Name: 'LED'
    DTD 3:  1920x1080   59.962844 Hz  16:9     67.158 kHz    173.000000 MHz
                 Hfront  163 Hsync  32 Hback  461 Hpol N
                 Vfront    3 Vsync   5 Vback   32 Vpol P
Checksum: 0xbc

----------------

Failures:

Block 0, Base EDID:
  Basic Display Parameters & Features: sRGB is signaled, but the chromaticities do not match.
  Detailed Timing Descriptor #1: Mismatch of image size vs display size: image size is not set, but display size is.
  Detailed Timing Descriptor #3: Mismatch of image size vs display size: image size is not set, but display size is.
  Detailed Timing Descriptor #3: Invalid detailed timing descriptor ordering.
  Missing Display Range Limits Descriptor.

EDID conformity: FAIL
