edid-decode (hex):

00 ff ff ff ff ff ff 00 24 4d ec 4a 01 01 01 01
15 0e 01 03 8e 24 1d 78 ea 09 20 a2 57 4b 97 24
18 50 54 a5 6a 80 01 01 01 01 01 01 81 80 01 01
01 01 01 01 01 01 30 2a 00 98 51 00 2a 40 30 70
13 00 67 1f 11 00 00 1e 00 00 00 fc 00 49 42 4d
20 4c 31 38 30 70 0a 00 00 00 00 00 00 fd 00 37
4b 1f 44 0b 00 0a 00 00 00 00 00 00 00 00 00 ff
00 36 36 2d 44 38 36 32 39 0a 20 20 20 20 00 e3

----------------

Block 0, Base EDID:
  EDID Structure Version & Revision: 1.3
  Vendor & Product Identification:
    Manufacturer: IBM
    Model: 19180
    Serial Number: ...
    Made in: week 21 of 2004
  Basic Display Parameters & Features:
    Digital display
    Maximum image size: 36 cm x 29 cm
    Gamma: 2.20
    DPMS levels: Standby Suspend Off
    RGB color display
    First detailed timing is the preferred timing
  Color Characteristics:
    Red  : 0.6328, 0.3398
    Green: 0.2949, 0.5908
    Blue : 0.1406, 0.0957
    White: 0.3125, 0.3281
  Established Timings I & II:
    IBM     :   720x400    70.081663 Hz   9:5     31.467 kHz     28.320000 MHz
    DMT 0x04:   640x480    59.940476 Hz   4:3     31.469 kHz     25.175000 MHz
    DMT 0x06:   640x480    75.000000 Hz   4:3     37.500 kHz     31.500000 MHz
    DMT 0x09:   800x600    60.316541 Hz   4:3     37.879 kHz     40.000000 MHz
    DMT 0x0b:   800x600    75.000000 Hz   4:3     46.875 kHz     49.500000 MHz
    Apple   :   832x624    74.551266 Hz   4:3     49.726 kHz     57.284000 MHz
    DMT 0x10:  1024x768    60.003840 Hz   4:3     48.363 kHz     65.000000 MHz
    DMT 0x12:  1024x768    75.028582 Hz   4:3     60.023 kHz     78.750000 MHz
    Apple   :  1152x870    75.061550 Hz 192:145   68.681 kHz    100.000000 MHz
  Standard Timings:
    DMT 0x23:  1280x1024   60.019740 Hz   5:4     63.981 kHz    108.000000 MHz
  Detailed Timing Descriptors:
    DTD 1:  1280x1024   60.019740 Hz   5:4     63.981 kHz    108.000000 MHz (359 mm x 287 mm)
                 Hfront   48 Hsync 112 Hback  248 Hpol P
                 Vfront    1 Vsync   3 Vback   38 Vpol P
    Display Product Name: 'IBM L180p'
    Display Range Limits:
      Monitor ranges (GTF): 55-75 Hz V, 31-68 kHz H, max dotclock 110 MHz
    Display Product Serial Number: ...
Checksum: 0xe3

----------------

Warnings:

EDID:
  Base EDID: Some timings are out of range of the Monitor Ranges:
    Horizontal Freq: 31.466 - 68.681 kHz (Monitor: 31.000 - 68.000 kHz)
    Could be due to a Monitor Range off-by-one rounding issue

Failures:

Block 0, Base EDID:
  Basic Display Parameters & Features: Digital Video Interface Standard set to reserved value 0x0e.
  Display Product Name: Non-space after newline.
  Display Range Limits: Bytes 12-17 must be 0x20.

EDID conformity: FAIL
