
EDID (hex):
00ffffffffffff001e6df07501010101
0811010380462778ead9b0a357499c25
11494ba56e003140454061408180d1c0
0101010101011b2150a051001e304888
3500bc862100001c023a801871382d40
582c4500c48e2100001e000000fc0033
374c47333030300a20202020000000fd
00324b1c430f000a20202020202001a6
020325f1500701160203111213041485
2021221f10230907078301000067030c
003000b82d011d008051d01c20408035
00bc882100001e8c0ad08a20e02d1010
3e9600138e21000018011d80d0721c16
20102c2580c48e2100009e8c0ad09020
4031200c405500c48e210000184e1f00
8051001e3040803700bc88210000186f

Extracted contents:
header:          00 ff ff ff ff ff ff 00
serial number:   1e 6d f0 75 01 01 01 01 08 11
version:         01 03
basic params:    80 46 27 78 ea
chroma info:     d9 b0 a3 57 49 9c 25 11 49 4b
established:     a5 6e 00
standard:        31 40 45 40 61 40 81 80 d1 c0 01 01 01 01 01 01
descriptor 1:    1b 21 50 a0 51 00 1e 30 48 88 35 00 bc 86 21 00 00 1c
descriptor 2:    02 3a 80 18 71 38 2d 40 58 2c 45 00 c4 8e 21 00 00 1e
descriptor 3:    00 00 00 fc 00 33 37 4c 47 33 30 30 30 0a 20 20 20 20
descriptor 4:    00 00 00 fd 00 32 4b 1c 43 0f 00 0a 20 20 20 20 20 20
extensions:      01
checksum:        a6

EDID version: 1.3
Manufacturer: GSM Model 75f0 Serial Number --
Made in week 8 of 2007
Digital display
Maximum image size: 70 cm x 39 cm
Gamma: 2.20
DPMS levels: Standby Suspend Off
RGB color display
First detailed timing is preferred timing
Display x,y Chromaticity:
  Red:   0.6396, 0.3408
  Green: 0.2871, 0.6103
  Blue:  0.1464, 0.0693
  White: 0.2851, 0.2929
Established timings supported:
  720x400@70Hz 9:5 HorFreq: 31469 Hz Clock: 28.320 MHz
  640x480@60Hz 4:3 HorFreq: 31469 Hz Clock: 25.175 MHz
  640x480@75Hz 4:3 HorFreq: 37500 Hz Clock: 31.500 MHz
  800x600@60Hz 4:3 HorFreq: 37900 Hz Clock: 40.000 MHz
  800x600@75Hz 4:3 HorFreq: 46900 Hz Clock: 49.500 MHz
  832x624@75Hz 4:3 HorFreq: 49726 Hz Clock: 57.284 MHz
  1024x768@60Hz 4:3 HorFreq: 48400 Hz Clock: 65.000 MHz
  1024x768@70Hz 4:3 HorFreq: 56500 Hz Clock: 75.000 MHz
  1024x768@75Hz 4:3 HorFreq: 60000 Hz Clock: 78.750 MHz
Standard timings supported:
  640x480@60Hz 4:3 HorFreq: 31469 Hz Clock: 25.175 MHz
  800x600@60Hz 4:3 HorFreq: 37900 Hz Clock: 40.000 MHz
  1024x768@60Hz 4:3 HorFreq: 48400 Hz Clock: 65.000 MHz
  1280x1024@60Hz 5:4 HorFreq: 64000 Hz Clock: 108.000 MHz
  1920x1080@60Hz 16:9
Detailed mode: Clock 84.750 MHz, 700 mm x 390 mm
               1360 1432 1568 1776 hborder 0
                768  771  776  798 vborder 0
               -hsync +vsync 
               VertFreq: 59 Hz, HorFreq: 47719 Hz
Detailed mode: Clock 148.500 MHz, 708 mm x 398 mm
               1920 2008 2052 2200 hborder 0
               1080 1084 1089 1125 vborder 0
               +hsync +vsync 
               VertFreq: 60 Hz, HorFreq: 67500 Hz
Monitor name: 37LG3000
Monitor ranges (GTF): 50-75Hz V, 28-67kHz H, max dotclock 150MHz
Has 1 extension blocks
Checksum: 0xa6 (valid)

CTA extension block
Extension version: 3
33 bytes of CTA data
  Video data block
    VIC   7 1440x480i@60Hz 16:9  HorFreq: 15734 Hz Clock: 27.000 MHz
    VIC   1 640x480@60Hz 4:3  HorFreq: 31469 Hz Clock: 25.175 MHz
    VIC  22 1440x576i@50Hz 16:9  HorFreq: 15625 Hz Clock: 27.000 MHz
    VIC   2 720x480@60Hz 4:3  HorFreq: 31469 Hz Clock: 27.000 MHz
    VIC   3 720x480@60Hz 16:9  HorFreq: 31469 Hz Clock: 27.000 MHz
    VIC  17 720x576@50Hz 4:3  HorFreq: 31250 Hz Clock: 27.000 MHz
    VIC  18 720x576@50Hz 16:9  HorFreq: 31250 Hz Clock: 27.000 MHz
    VIC  19 1280x720@50Hz 16:9  HorFreq: 37500 Hz Clock: 74.250 MHz
    VIC   4 1280x720@60Hz 16:9  HorFreq: 45000 Hz Clock: 74.250 MHz
    VIC  20 1920x1080i@50Hz 16:9  HorFreq: 28125 Hz Clock: 74.250 MHz
    VIC   5 1920x1080i@60Hz 16:9 (native) HorFreq: 33750 Hz Clock: 74.250 MHz
    VIC  32 1920x1080@24Hz 16:9  HorFreq: 27000 Hz Clock: 74.250 MHz
    VIC  33 1920x1080@25Hz 16:9  HorFreq: 28125 Hz Clock: 74.250 MHz
    VIC  34 1920x1080@30Hz 16:9  HorFreq: 33750 Hz Clock: 74.250 MHz
    VIC  31 1920x1080@50Hz 16:9  HorFreq: 56250 Hz Clock: 148.500 MHz
    VIC  16 1920x1080@60Hz 16:9  HorFreq: 67500 Hz Clock: 148.500 MHz
  Audio data block
    Linear PCM, max channels 2
      Supported sample rates (kHz): 48 44.1 32
      Supported sample sizes (bits): 24 20 16
  Speaker allocation data block
    Speaker map:
      FL/FR - Front Left/Right
  Vendor-specific data block, OUI 000c03 (HDMI)
    Source physical address 3.0.0.0
    Supports_AI
    DC_36bit
    DC_30bit
    DC_Y444
    Maximum TMDS clock: 225MHz
Underscans PC formats by default
Basic audio support
Supports YCbCr 4:4:4
Supports YCbCr 4:2:2
1 native detailed modes
Detailed mode: Clock 74.250 MHz, 700 mm x 392 mm
               1280 1344 1472 1664 hborder 0
                720  723  728  748 vborder 0
               +hsync +vsync 
               VertFreq: 59 Hz, HorFreq: 44621 Hz
Detailed mode: Clock 27.000 MHz, 531 mm x 398 mm
                720  736  798  858 hborder 0
                480  489  495  525 vborder 0
               -hsync -vsync 
               VertFreq: 59 Hz, HorFreq: 31468 Hz
Detailed mode: Clock 74.250 MHz, 708 mm x 398 mm
               1920 2448 2492 2640 hborder 0
                540  542  547  562 vborder 0
               +hsync +vsync interlaced 
               VertFreq: 50 Hz, HorFreq: 28125 Hz
Detailed mode: Clock 27.000 MHz, 708 mm x 398 mm
                720  732  796  864 hborder 0
                576  581  586  625 vborder 0
               -hsync -vsync 
               VertFreq: 50 Hz, HorFreq: 31250 Hz
Checksum: 0x6f (valid)

One or more of the timings is out of range of the Monitor Ranges:
  Vertical Freq: 24 - 75 Hz
  Horizontal Freq: 15625 - 67500 Hz
  Maximum Clock: 148.500 MHz


