edid-decode (hex):

00 ff ff ff ff ff ff 00 09 e5 cb 08 00 00 00 00
01 1d 01 04 95 22 13 78 03 28 65 97 59 54 8e 27
1e 50 54 00 00 00 01 01 01 01 01 01 01 01 01 01
01 01 01 01 01 01 c8 3a 80 18 71 38 3c 40 30 20
36 00 58 c2 10 00 00 1a 30 27 80 18 71 38 3c 40
30 20 36 00 58 c2 10 00 00 1a 00 00 00 00 00 00
00 00 00 00 00 00 00 00 00 00 00 00 00 00 00 02
00 0d 40 ff 0a 3c 7d 14 12 24 7d 00 00 00 00 46

00 ff ff ff ff ff ff 00 09 e5 cb 08 00 00 00 00
01 1d 01 04 95 22 13 78 03 28 65 97 59 54 8e 27
1e 50 54 00 00 00 01 01 01 01 01 01 01 01 01 01
01 01 01 01 01 01 c8 3a 80 18 71 38 3c 40 30 20
36 00 58 c2 10 00 00 1a 30 27 80 18 71 38 3c 40
30 20 36 00 58 c2 10 00 00 1a 00 00 00 00 00 00
00 00 00 00 00 00 00 00 00 00 00 00 00 00 00 02
00 0d 40 ff 0a 3c 7d 14 12 24 7d 00 00 00 00 46

----------------

Block 0, Base EDID:
  EDID Structure Version & Revision: 1.4
  Vendor & Product Identification:
    Manufacturer: BOE
    Model: 2251
    Made in: week 1 of 2019
  Basic Display Parameters & Features:
    Digital display
    Bits per primary color channel: 6
    DisplayPort interface
    Maximum image size: 34 cm x 19 cm
    Gamma: 2.20
    Supported color formats: RGB 4:4:4
    First detailed timing includes the native pixel format and preferred refresh rate
    Display is continuous frequency
  Color Characteristics:
    Red  : 0.5898, 0.3496
    Green: 0.3300, 0.5546
    Blue : 0.1533, 0.1191
    White: 0.3134, 0.3291
  Established Timings I & II: none
  Standard Timings: none
  Detailed Timing Descriptors:
    DTD 1:  1920x1080   60.000000 Hz  16:9     68.400 kHz    150.480000 MHz (344 mm x 194 mm)
                 Hfront   48 Hsync  32 Hback  200 Hpol P
                 Vfront    3 Vsync   6 Vback   51 Vpol N
    DTD 2:  1920x1080   40.000000 Hz  16:9     45.600 kHz    100.320000 MHz (344 mm x 194 mm)
                 Hfront   48 Hsync  32 Hback  200 Hpol P
                 Vfront    3 Vsync   6 Vback   51 Vpol N
    Empty Descriptor
    Manufacturer-Specified Display Descriptor (0x02): 00 02 00 0d 40 ff 0a 3c 7d 14 12 24 7d 00 00 00 '....@..<}..$}...'
Checksum: 0x46

----------------

Block 1, Unknown EDID Extension Block 0x00:
  00 ff ff ff ff ff ff 00 09 e5 cb 08 00 00 00 00 '................'
  01 1d 01 04 95 22 13 78 03 28 65 97 59 54 8e 27 '.....".x.(e.YT.''
  1e 50 54 00 00 00 01 01 01 01 01 01 01 01 01 01 '.PT.............'
  01 01 01 01 01 01 c8 3a 80 18 71 38 3c 40 30 20 '.......:..q8<@0 '
  36 00 58 c2 10 00 00 1a 30 27 80 18 71 38 3c 40 '6.X.....0'..q8<@'
  30 20 36 00 58 c2 10 00 00 1a 00 00 00 00 00 00 '0 6.X...........'
  00 00 00 00 00 00 00 00 00 00 00 00 00 00 00 02 '................'
  00 0d 40 ff 0a 3c 7d 14 12 24 7d 00 00 00 00 46 '..@..<}..$}....F'
Checksum: 0x46

----------------

Warnings:

Block 0, Base EDID:
  Missing Display Product Name.

Failures:

Block 0, Base EDID:
  Empty Descriptor: Use Dummy Descriptor instead of all zeroes.
  Missing Display Range Limits Descriptor.
Block 1, Base EDID:
  Unknown Extension Block.
EDID:
  Base EDID: EDID specified 0 extension block(s), but found 1 extension block(s).

EDID conformity: FAIL
