
EDID (hex):
00ffffffffffff0030aee06501010101
251c01046c3c22782eb9a5a356509f26
0e5054adcf00d1c08180818a9500b300
714f01010101023a801871382d40582c
450056502100001e000000ff00553435
524b4148300a20202020000000fd0031
4c365a11000a202020202020000000fc
004c454e204c3237692d32380a2000f2

Extracted contents:
header:          00 ff ff ff ff ff ff 00
serial number:   30 ae e0 65 01 01 01 01 25 1c
version:         01 04
basic params:    6c 3c 22 78 2e
chroma info:     b9 a5 a3 56 50 9f 26 0e 50 54
established:     ad cf 00
standard:        d1 c0 81 80 81 8a 95 00 b3 00 71 4f 01 01 01 01
descriptor 1:    02 3a 80 18 71 38 2d 40 58 2c 45 00 56 50 21 00 00 1e
descriptor 2:    00 00 00 ff 00 55 34 35 52 4b 41 48 30 0a 20 20 20 20
descriptor 3:    00 00 00 fd 00 31 4c 36 5a 11 00 0a 20 20 20 20 20 20
descriptor 4:    00 00 00 fc 00 4c 45 4e 20 4c 32 37 69 2d 32 38 0a 20
extensions:      00
checksum:        f2

EDID version: 1.4
Manufacturer: LEN Model 65e0 Serial Number --
Made in week 37 of 2018
Analog display, Input voltage level: 0.7/0.7 V
Blank level equals black level
Sync: Separate Composite 
Maximum image size: 60 cm x 34 cm
Gamma: 2.20
DPMS levels: Off
RGB color display
Default (sRGB) color space is primary color space
First detailed timing includes the native pixel format and preferred refresh rate
Display x,y Chromaticity:
  Red:   0.6386, 0.3388
  Green: 0.3144, 0.6220
  Blue:  0.1503, 0.0566
  White: 0.3134, 0.3291
Established timings supported:
  720x400@70Hz 9:5 HorFreq: 31469 Hz Clock: 28.320 MHz
  640x480@60Hz 4:3 HorFreq: 31469 Hz Clock: 25.175 MHz
  640x480@72Hz 4:3 HorFreq: 37900 Hz Clock: 31.500 MHz
  640x480@75Hz 4:3 HorFreq: 37500 Hz Clock: 31.500 MHz
  800x600@60Hz 4:3 HorFreq: 37900 Hz Clock: 40.000 MHz
  800x600@72Hz 4:3 HorFreq: 48100 Hz Clock: 50.000 MHz
  800x600@75Hz 4:3 HorFreq: 46900 Hz Clock: 49.500 MHz
  1024x768@60Hz 4:3 HorFreq: 48400 Hz Clock: 65.000 MHz
  1024x768@70Hz 4:3 HorFreq: 56500 Hz Clock: 75.000 MHz
  1024x768@75Hz 4:3 HorFreq: 60000 Hz Clock: 78.750 MHz
  1280x1024@75Hz 5:4 HorFreq: 80000 Hz Clock: 135.000 MHz
Standard timings supported:
  1920x1080@60Hz 16:9
  1280x1024@60Hz 5:4 HorFreq: 64000 Hz Clock: 108.000 MHz
  1280x1024@70Hz 5:4
  1440x900@60Hz 16:10 HorFreq: 55500 Hz Clock: 88.750 MHz
  1680x1050@60Hz 16:10 HorFreq: 64700 Hz Clock: 119.000 MHz
  1152x864@75Hz 4:3 HorFreq: 67500 Hz Clock: 108.000 MHz
Detailed mode: Clock 148.500 MHz, 598 mm x 336 mm
               1920 2008 2052 2200 hborder 0
               1080 1084 1089 1125 vborder 0
               +hsync +vsync 
               VertFreq: 60 Hz, HorFreq: 67500 Hz
Serial number: --
Monitor ranges (GTF): 49-76Hz V, 54-90kHz H, max dotclock 170MHz
Monitor name: LEN L27i-28
Checksum: 0xf2 (valid)
EDID block does NOT conform to EDID 1.4!
	sRGB is signaled, but the chromaticities do not match
Warning: One or more of the timings is out of range of the Monitor Ranges:
  Vertical Freq: 60 - 75 Hz
  Horizontal Freq: 31469 - 80000 Hz
  Maximum Clock: 148.500 MHz
