edid-decode (hex):

00 ff ff ff ff ff ff 00 10 ac c7 a0 55 30 32 32
30 1d 01 03 0e 2b 18 78 ea e8 f5 a2 56 4f a1 28
10 50 54 a5 4b 00 71 4f 81 80 a9 c0 01 01 01 01
01 01 01 01 01 01 30 2a 40 c8 60 84 64 30 18 50
13 00 b0 ec 10 00 00 1e 00 00 00 ff 00 59 30 31
47 54 39 42 51 32 32 30 55 0a 00 00 00 fc 00 44
45 4c 4c 20 45 32 30 31 36 48 0a 20 00 00 00 fd
00 32 4c 1e 53 11 00 0a 20 20 20 20 20 20 00 7b

00 ff ff ff ff ff ff 00 10 ac c7 a0 55 30 32 32
30 1d 01 03 0e 2b 18 78 ea e8 f5 a2 56 4f a1 28
10 50 54 a5 4b 00 71 4f 81 80 a9 c0 01 01 01 01
01 01 01 01 01 01 30 2a 40 c8 60 84 64 30 18 50
13 00 b0 ec 10 00 00 1e 00 00 00 ff 00 59 30 31
47 54 39 42 51 32 32 30 55 0a 00 00 00 fc 00 44
45 4c 4c 20 45 32 30 31 36 48 0a 20 00 00 00 fd
00 32 4c 1e 53 11 00 0a 20 20 20 20 20 20 00 7b

----------------

Block 0, Base EDID:
  EDID Structure Version & Revision: 1.3
  Vendor & Product Identification:
    Manufacturer: DEL
    Model: 41159
    Serial Number: ...
    Made in: week 48 of 2019
  Basic Display Parameters & Features:
    Analog display
    Signal Level Standard: 0.700 : 0.300 : 1.000 V p-p
    Blank level equals black level
    Sync: Separate Composite SyncOnGreen
    Maximum image size: 43 cm x 24 cm
    Gamma: 2.20
    DPMS levels: Standby Suspend Off
    RGB color display
    First detailed timing is the preferred timing
  Color Characteristics:
    Red  : 0.6357, 0.3378
    Green: 0.3105, 0.6289
    Blue : 0.1591, 0.0654
    White: 0.3134, 0.3291
  Established Timings I & II:
    IBM     :   720x400    70.081663 Hz   9:5     31.467 kHz     28.320000 MHz
    DMT 0x04:   640x480    59.940476 Hz   4:3     31.469 kHz     25.175000 MHz
    DMT 0x06:   640x480    75.000000 Hz   4:3     37.500 kHz     31.500000 MHz
    DMT 0x09:   800x600    60.316541 Hz   4:3     37.879 kHz     40.000000 MHz
    DMT 0x0b:   800x600    75.000000 Hz   4:3     46.875 kHz     49.500000 MHz
    DMT 0x10:  1024x768    60.003840 Hz   4:3     48.363 kHz     65.000000 MHz
    DMT 0x12:  1024x768    75.028582 Hz   4:3     60.023 kHz     78.750000 MHz
    DMT 0x24:  1280x1024   75.024675 Hz   5:4     79.976 kHz    135.000000 MHz
  Standard Timings:
    DMT 0x15:  1152x864    75.000000 Hz   4:3     67.500 kHz    108.000000 MHz
    DMT 0x23:  1280x1024   60.019740 Hz   5:4     63.981 kHz    108.000000 MHz
    DMT 0x53:  1600x900    60.000000 Hz  16:9     60.000 kHz    108.000000 MHz (RB)
  Detailed Timing Descriptors:
    DTD 1:  1600x900    60.000000 Hz  16:9     60.000 kHz    108.000000 MHz (432 mm x 236 mm)
                 Hfront   24 Hsync  80 Hback   96 Hpol P
                 Vfront    1 Vsync   3 Vback   96 Vpol P
    Display Product Serial Number: ...
    Display Product Name: 'DELL E2016H'
    Display Range Limits:
      Monitor ranges (GTF): 50-76 Hz V, 30-83 kHz H, max dotclock 170 MHz
Checksum: 0x7b

----------------

Block 1, Unknown EDID Extension Block 0x00:
  00 ff ff ff ff ff ff 00 10 ac c7 a0 55 30 32 32 '............U022'
  30 1d 01 03 0e 2b 18 78 ea e8 f5 a2 56 4f a1 28 '0....+.x....VO.('
  10 50 54 a5 4b 00 71 4f 81 80 a9 c0 01 01 01 01 '.PT.K.qO........'
  01 01 01 01 01 01 30 2a 40 c8 60 84 64 30 18 50 '......0*@.`.d0.P'
  13 00 b0 ec 10 00 00 1e 00 00 00 ff 00 59 30 31 '.............Y01'
  47 54 39 42 51 32 32 30 55 0a 00 00 00 fc 00 44 'GT9BQ220U......D'
  45 4c 4c 20 45 32 30 31 36 48 0a 20 00 00 00 fd 'ELL E2016H. ....'
  00 32 4c 1e 53 11 00 0a 20 20 20 20 20 20 00 7b '.2L.S...      .{'
Checksum: 0x7b

----------------

Failures:

Block 1, Base EDID:
  Unknown Extension Block.
EDID:
  Base EDID: EDID specified 0 extension block(s), but found 1 extension block(s).

EDID conformity: FAIL
