
EDID (hex):
00ffffffffffff0010acc7a04c523931
051a01030e2b1878eae8f5a2564fa128
105054a54b00714f8180a9c001010101
010101010101302a40c8608464301850
1300b0ec1000001e000000ff00593031
47543631503139524c0a000000fc0044
454c4c204532303136480a20000000fd
00324c1e5311000a2020202020200080

Extracted contents:
header:          00 ff ff ff ff ff ff 00
serial number:   10 ac c7 a0 4c 52 39 31 05 1a
version:         01 03
basic params:    0e 2b 18 78 ea
chroma info:     e8 f5 a2 56 4f a1 28 10 50 54
established:     a5 4b 00
standard:        71 4f 81 80 a9 c0 01 01 01 01 01 01 01 01 01 01
descriptor 1:    30 2a 40 c8 60 84 64 30 18 50 13 00 b0 ec 10 00 00 1e
descriptor 2:    00 00 00 ff 00 59 30 31 47 54 36 31 50 31 39 52 4c 0a
descriptor 3:    00 00 00 fc 00 44 45 4c 4c 20 45 32 30 31 36 48 0a 20
descriptor 4:    00 00 00 fd 00 32 4c 1e 53 11 00 0a 20 20 20 20 20 20
extensions:      00
checksum:        80

EDID version: 1.3
Manufacturer: DEL Model a0c7 Serial Number --
Made in week 5 of 2016
Analog display, Input voltage level: 0.7/0.3 V
Sync: Separate Composite SyncOnGreen 
Maximum image size: 43 cm x 24 cm
Gamma: 2.20
DPMS levels: Standby Suspend Off
RGB color display
First detailed timing is preferred timing
Display x,y Chromaticity:
  Red:   0.6357, 0.3378
  Green: 0.3105, 0.6289
  Blue:  0.1591, 0.0654
  White: 0.3134, 0.3291
Established timings supported:
  720x400@70Hz 9:5 HorFreq: 31469 Hz Clock: 28.320 MHz
  640x480@60Hz 4:3 HorFreq: 31469 Hz Clock: 25.175 MHz
  640x480@75Hz 4:3 HorFreq: 37500 Hz Clock: 31.500 MHz
  800x600@60Hz 4:3 HorFreq: 37900 Hz Clock: 40.000 MHz
  800x600@75Hz 4:3 HorFreq: 46900 Hz Clock: 49.500 MHz
  1024x768@60Hz 4:3 HorFreq: 48400 Hz Clock: 65.000 MHz
  1024x768@75Hz 4:3 HorFreq: 60000 Hz Clock: 78.750 MHz
  1280x1024@75Hz 5:4 HorFreq: 80000 Hz Clock: 135.000 MHz
Standard timings supported:
  1152x864@75Hz 4:3 HorFreq: 67500 Hz Clock: 108.000 MHz
  1280x1024@60Hz 5:4 HorFreq: 64000 Hz Clock: 108.000 MHz
  1600x900@60Hz 16:9
Detailed mode: Clock 108.000 MHz, 432 mm x 236 mm
               1600 1624 1704 1800 hborder 0
                900  901  904 1000 vborder 0
               +hsync +vsync 
               VertFreq: 60 Hz, HorFreq: 60000 Hz
Serial number: --
Monitor name: DELL E2016H
Monitor ranges (GTF): 50-76Hz V, 30-83kHz H, max dotclock 170MHz
Checksum: 0x80 (valid)
