
EDID (hex):
00ffffffffffff0026cd446643040000
031e0104a53c2278fba595a65650a026
0d50542108009500a9c0a940b300d1c0
d1cae1008180565e00a0a0a029503020
350055502100001a000000ff00313135
33383030333231303931000000fd0030
4b75751e010a202020202020000000fc
00504c32373330510a2020202020010a
020318f14b100504030201111213141f
23090707830100009774006ea0a03450
1720680856502100001e000000000000
00000000000000000000000000000000
00000000000000000000000000000000
00000000000000000000000000000000
00000000000000000000000000000000
00000000000000000000000000000098

Extracted contents:
header:          00 ff ff ff ff ff ff 00
serial number:   26 cd 44 66 43 04 00 00 03 1e
version:         01 04
basic params:    a5 3c 22 78 fb
chroma info:     a5 95 a6 56 50 a0 26 0d 50 54
established:     21 08 00
standard:        95 00 a9 c0 a9 40 b3 00 d1 c0 d1 ca e1 00 81 80
descriptor 1:    56 5e 00 a0 a0 a0 29 50 30 20 35 00 55 50 21 00 00 1a
descriptor 2:    00 00 00 ff 00 31 31 35 33 38 30 30 33 32 31 30 39 31
descriptor 3:    00 00 00 fd 00 30 4b 75 75 1e 01 0a 20 20 20 20 20 20
descriptor 4:    00 00 00 fc 00 50 4c 32 37 33 30 51 0a 20 20 20 20 20
extensions:      01
checksum:        0a

EDID version: 1.4
Manufacturer: IVM Model 6644 Serial Number --
Made in week 3 of 2020
Digital display
8 bits per primary color channel
DisplayPort interface
Maximum image size: 60 cm x 34 cm
Gamma: 2.20
DPMS levels: Standby Suspend Off
Supported color formats: RGB 4:4:4, YCrCb 4:4:4, YCrCb 4:2:2
First detailed timing includes the native pixel format and preferred refresh rate
Display is continuous frequency
Display x,y Chromaticity:
  Red:   0.6503, 0.3378
  Green: 0.3134, 0.6259
  Blue:  0.1503, 0.0517
  White: 0.3134, 0.3291
Established timings supported:
  640x480@60Hz 4:3 HorFreq: 31469 Hz Clock: 25.175 MHz
  800x600@60Hz 4:3 HorFreq: 37900 Hz Clock: 40.000 MHz
  1024x768@60Hz 4:3 HorFreq: 48400 Hz Clock: 65.000 MHz
Standard timings supported:
  1440x900@60Hz 16:10 HorFreq: 55500 Hz Clock: 88.750 MHz
  1600x900@60Hz 16:9
  1600x1200@60Hz 4:3 HorFreq: 75000 Hz Clock: 162.000 MHz
  1680x1050@60Hz 16:10 HorFreq: 64700 Hz Clock: 119.000 MHz
  1920x1080@60Hz 16:9
  1920x1080@70Hz 16:9
  2048x1280@60Hz 16:10
  1280x1024@60Hz 5:4 HorFreq: 64000 Hz Clock: 108.000 MHz
Detailed mode: Clock 241.500 MHz, 597 mm x 336 mm
               2560 2608 2640 2720 hborder 0
               1440 1443 1448 1481 vborder 0
               +hsync -vsync 
               VertFreq: 59 Hz, HorFreq: 88786 Hz
Serial number: --
Monitor ranges (bare limits): 48-75Hz V, 117-117kHz H, max dotclock 300MHz
Monitor name: PL2730Q
Has 1 extension blocks
Checksum: 0xa (valid)

CTA extension block
Extension version: 3
20 bytes of CTA data
  Video data block
    VIC  16 1920x1080@60Hz 16:9  HorFreq: 67500 Hz Clock: 148.500 MHz
    VIC   5 1920x1080i@60Hz 16:9  HorFreq: 33750 Hz Clock: 74.250 MHz
    VIC   4 1280x720@60Hz 16:9  HorFreq: 45000 Hz Clock: 74.250 MHz
    VIC   3 720x480@60Hz 16:9  HorFreq: 31469 Hz Clock: 27.000 MHz
    VIC   2 720x480@60Hz 4:3  HorFreq: 31469 Hz Clock: 27.000 MHz
    VIC   1 640x480@60Hz 4:3  HorFreq: 31469 Hz Clock: 25.175 MHz
    VIC  17 720x576@50Hz 4:3  HorFreq: 31250 Hz Clock: 27.000 MHz
    VIC  18 720x576@50Hz 16:9  HorFreq: 31250 Hz Clock: 27.000 MHz
    VIC  19 1280x720@50Hz 16:9  HorFreq: 37500 Hz Clock: 74.250 MHz
    VIC  20 1920x1080i@50Hz 16:9  HorFreq: 28125 Hz Clock: 74.250 MHz
    VIC  31 1920x1080@50Hz 16:9  HorFreq: 56250 Hz Clock: 148.500 MHz
  Audio data block
    Linear PCM, max channels 2
      Supported sample rates (kHz): 48 44.1 32
      Supported sample sizes (bits): 24 20 16
  Speaker allocation data block
    Speaker map:
      FL/FR - Front Left/Right
Underscans PC formats by default
Basic audio support
Supports YCbCr 4:4:4
Supports YCbCr 4:2:2
1 native detailed modes
Detailed mode: Clock 298.470 MHz, 598 mm x 336 mm
               2560 2583 2615 2670 hborder 0
               1440 1478 1486 1492 vborder 0
               +hsync +vsync 
               VertFreq: 74 Hz, HorFreq: 111786 Hz
Checksum: 0x98 (valid)

Warning: One or more of the timings is out of range of the Monitor Ranges:
  Vertical Freq: 50 - 74 Hz
  Horizontal Freq: 28125 - 111786 Hz
  Maximum Clock: 298.470 MHz
EDID block does not conform at all!
	Both the serial number and the serial string are set


