edid-decode (hex):

00 ff ff ff ff ff ff 00 30 e4 95 03 00 00 00 00
00 16 01 04 90 22 13 78 0a 01 a5 9c 59 5a 9b 26
18 50 54 00 00 00 01 01 01 01 01 01 01 01 01 01
01 01 01 01 01 01 d8 1d 56 f4 50 00 16 30 24 30
35 00 58 c2 10 00 00 1b e5 13 56 f4 50 00 16 30
24 30 35 00 58 c2 10 00 00 1b 00 00 00 00 00 00
00 00 00 00 00 00 00 00 00 00 00 00 00 00 00 02
00 0c 47 ff 0a 3c 64 12 22 29 64 00 00 00 00 6e

----------------

Block 0, Base EDID:
  EDID Structure Version & Revision: 1.4
  Vendor & Product Identification:
    Manufacturer: LGD
    Model: 917
    Made in: 2012
  Basic Display Parameters & Features:
    Digital display
    Bits per primary color channel: 6
    Digital interface is not defined
    Maximum image size: 34 cm x 19 cm
    Gamma: 2.20
    Supported color formats: RGB 4:4:4, YCrCb 4:4:4
    First detailed timing includes the native pixel format and preferred refresh rate
  Color Characteristics:
    Red  : 0.6093, 0.3476
    Green: 0.3515, 0.6064
    Blue : 0.1503, 0.0957
    White: 0.3134, 0.3291
  Established Timings I & II: none
  Standard Timings: none
  Detailed Timing Descriptors:
    DTD 1:  1366x768    60.067615 Hz 683:384   47.453 kHz     76.400000 MHz (344 mm x 194 mm)
                 Hfront   36 Hsync  48 Hback  160 Hpol P
                 Vfront    3 Vsync   5 Vback   14 Vpol N
    DTD 2:  1366x768    40.042456 Hz 683:384   31.634 kHz     50.930000 MHz (344 mm x 194 mm)
                 Hfront   36 Hsync  48 Hback  160 Hpol P
                 Vfront    3 Vsync   5 Vback   14 Vpol N
    Empty Descriptor
    Manufacturer-Specified Display Descriptor (0x02): 00 02 00 0c 47 ff 0a 3c 64 12 22 29 64 00 00 00 '....G..<d.")d...'
Checksum: 0x6e

----------------

Warnings:

Block 0, Base EDID:
  Missing Display Product Name.

Failures:

Block 0, Base EDID:
  Empty Descriptor: Use Dummy Descriptor instead of all zeroes.

EDID conformity: FAIL
