
EDID (hex):
00ffffffffffff004eae8f0550436d01
06100103803320962aef95a3544c9b26
0f5054bfef80d100d1c081808190a940
718601010101103b808870b022400840
240006442100001eca35808870382040
0840240006442100001e302a00985100
2a4030701300064421000018ae3340b0
60b0274008405a0006442100001e01e2
400102c0100209002419a500ffff0102
031b1ba80c60b01d0820420101800000
080808080808d0000000000000000000
00000000000000000000000000000000
00000000000000000000000000000000
006d0000000000010101020304050709
0c0f1215191d22272d343b42494f5862
6b747c858f9da7b2bbc2d1dbe9f1f81a

Extracted contents:
header:          00 ff ff ff ff ff ff 00
serial number:   4e ae 8f 05 50 43 6d 01 06 10
version:         01 03
basic params:    80 33 20 96 2a
chroma info:     ef 95 a3 54 4c 9b 26 0f 50 54
established:     bf ef 80
standard:        d1 00 d1 c0 81 80 81 90 a9 40 71 86 01 01 01 01
descriptor 1:    10 3b 80 88 70 b0 22 40 08 40 24 00 06 44 21 00 00 1e
descriptor 2:    ca 35 80 88 70 38 20 40 08 40 24 00 06 44 21 00 00 1e
descriptor 3:    30 2a 00 98 51 00 2a 40 30 70 13 00 06 44 21 00 00 18
descriptor 4:    ae 33 40 b0 60 b0 27 40 08 40 5a 00 06 44 21 00 00 1e
extensions:      01
checksum:        e2

EDID version: 1.3
Manufacturer: SUN Model 58f Serial Number --
Made in week 6 of 2006
Digital display
Maximum image size: 51 cm x 32 cm
Gamma: 2.50
DPMS levels: Off
RGB color display
First detailed timing is preferred timing
Display x,y Chromaticity:
  Red:   0.6396, 0.3300
  Green: 0.2998, 0.6083
  Blue:  0.1503, 0.0595
  White: 0.3134, 0.3291
Established timings supported:
  720x400@70Hz 9:5 HorFreq: 31469 Hz Clock: 28.320 MHz
  640x480@60Hz 4:3 HorFreq: 31469 Hz Clock: 25.175 MHz
  640x480@67Hz 4:3 HorFreq: 35000 Hz Clock: 30.240 MHz
  640x480@72Hz 4:3 HorFreq: 37900 Hz Clock: 31.500 MHz
  640x480@75Hz 4:3 HorFreq: 37500 Hz Clock: 31.500 MHz
  800x600@56Hz 4:3 HorFreq: 35200 Hz Clock: 36.000 MHz
  800x600@60Hz 4:3 HorFreq: 37900 Hz Clock: 40.000 MHz
  800x600@72Hz 4:3 HorFreq: 48100 Hz Clock: 50.000 MHz
  800x600@75Hz 4:3 HorFreq: 46900 Hz Clock: 49.500 MHz
  832x624@75Hz 4:3 HorFreq: 49726 Hz Clock: 57.284 MHz
  1024x768@60Hz 4:3 HorFreq: 48400 Hz Clock: 65.000 MHz
  1024x768@70Hz 4:3 HorFreq: 56500 Hz Clock: 75.000 MHz
  1024x768@75Hz 4:3 HorFreq: 60000 Hz Clock: 78.750 MHz
  1280x1024@75Hz 5:4 HorFreq: 80000 Hz Clock: 135.000 MHz
  1152x870@75Hz 192:145 HorFreq: 67500 Hz Clock: 108.000 MHz
Standard timings supported:
  1920x1200@60Hz 16:10 HorFreq: 74000 Hz Clock: 154.000 MHz
  1920x1080@60Hz 16:9
  1280x1024@60Hz 5:4 HorFreq: 64000 Hz Clock: 108.000 MHz
  1280x1024@76Hz 5:4
  1600x1200@60Hz 4:3 HorFreq: 75000 Hz Clock: 162.000 MHz
  1152x921@66Hz 5:4
Detailed mode: Clock 151.200 MHz, 518 mm x 324 mm
               1920 1928 1992 2056 hborder 0
               1200 1202 1206 1234 vborder 0
               +hsync +vsync 
               VertFreq: 59 Hz, HorFreq: 73540 Hz
Detailed mode: Clock 137.700 MHz, 518 mm x 324 mm
               1920 1928 1992 2056 hborder 0
               1080 1082 1086 1112 vborder 0
               +hsync +vsync 
               VertFreq: 60 Hz, HorFreq: 66974 Hz
Detailed mode: Clock 108.000 MHz, 518 mm x 324 mm
               1280 1328 1440 1688 hborder 0
               1024 1025 1028 1066 vborder 0
               -hsync -vsync 
               VertFreq: 60 Hz, HorFreq: 63981 Hz
Detailed mode: Clock 132.300 MHz, 518 mm x 324 mm
               1600 1608 1672 1776 hborder 0
               1200 1205 1215 1239 vborder 0
               +hsync +vsync 
               VertFreq: 60 Hz, HorFreq: 74493 Hz
Has 1 extension blocks
Checksum: 0xe2 (valid)

DI extension block

EDID block does NOT conform to EDID 1.3!
	Missing name descriptor
	Missing monitor ranges
EDID block does not conform at all!
	Has 503316480 nonconformant extension block(s)
