
EDID (hex):
00ffffffffffff006887000068020000
0c0d0102091e1761eae4de9e544a9723
1c4c54b76e00314f454f614f01010101
010101010101000000fc004154454e0a
2020202020202020000000fc00555039
310a0000000000000000000000fd0038
4b1f3c08000a202020202020000000ff
00320000000000000000000000000080

edid-decode (hex):

00 ff ff ff ff ff ff 00 68 87 00 00 68 02 00 00
0c 0d 01 02 09 1e 17 61 ea e4 de 9e 54 4a 97 23
1c 4c 54 b7 6e 00 31 4f 45 4f 61 4f 01 01 01 01
01 01 01 01 01 01 00 00 00 fc 00 41 54 45 4e 0a
20 20 20 20 20 20 20 20 00 00 00 fc 00 55 50 39
31 0a 00 00 00 00 00 00 00 00 00 00 00 fd 00 38
4b 1f 3c 08 00 0a 20 20 20 20 20 20 00 00 00 ff
00 32 00 00 00 00 00 00 00 00 00 00 00 00 00 80

----------------

Block 0, Base EDID:
  EDID Structure Version & Revision: 1.2
  Vendor & Product Identification:
    Manufacturer: ZDG
    Model: 0
    Serial Number: 616
    Made in: week 12 of 2003
  Basic Display Parameters & Features:
    Analog display
    Signal Level Standard: 0.700 : 0.300 : 1.000 V p-p
    Blank level equals black level
    Sync: Separate Serration
    Maximum image size: 30 cm x 23 cm
    Gamma: 1.97
    DPMS levels: Standby Suspend Off
    RGB color display
    First detailed timing is the preferred timing
  Color Characteristics:
    Red  : 0.6201, 0.3300
    Green: 0.2900, 0.5898
    Blue : 0.1396, 0.1103
    White: 0.2998, 0.3300
  Established Timings I & II:
    IBM     :   720x400    70.081663 Hz   9:5     31.467 kHz     28.320000 MHz
    DMT 0x04:   640x480    59.940476 Hz   4:3     31.469 kHz     25.175000 MHz
    Apple   :   640x480    66.666667 Hz   4:3     35.000 kHz     30.240000 MHz
    DMT 0x06:   640x480    75.000000 Hz   4:3     37.500 kHz     31.500000 MHz
    DMT 0x08:   800x600    56.250000 Hz   4:3     35.156 kHz     36.000000 MHz
    DMT 0x09:   800x600    60.316541 Hz   4:3     37.879 kHz     40.000000 MHz
    DMT 0x0b:   800x600    75.000000 Hz   4:3     46.875 kHz     49.500000 MHz
    Apple   :   832x624    74.551266 Hz   4:3     49.726 kHz     57.284000 MHz
    DMT 0x10:  1024x768    60.003840 Hz   4:3     48.363 kHz     65.000000 MHz
    DMT 0x11:  1024x768    70.069359 Hz   4:3     56.476 kHz     75.000000 MHz
    DMT 0x12:  1024x768    75.028582 Hz   4:3     60.023 kHz     78.750000 MHz
  Standard Timings:
    DMT 0x06:   640x480    75.000000 Hz   4:3     37.500 kHz     31.500000 MHz
    DMT 0x0b:   800x600    75.000000 Hz   4:3     46.875 kHz     49.500000 MHz
    DMT 0x12:  1024x768    75.028582 Hz   4:3     60.023 kHz     78.750000 MHz
  Detailed Timing Descriptors:
    Display Product Name: 'ATEN'
    Display Product Name: 'UP91'
    Display Range Limits:
      Monitor ranges (GTF): 56-75 Hz V, 31-60 kHz H, max dotclock 80 MHz
    Display Product Serial Number: '2'
Checksum: 0x80
