
EDID (hex):
00ffffffffffff0004720c036b216032
1a17010380331d782ae595a656529d27
105054b30c00714f81c0810081809500
b300d1c00101023a801871382d40582c
4500fe1f1100001e000000fd00314b1e
5e11000a202020202020000000fc0041
6365722047323336484c0a20000000ff
004c57534545303032343334300a0172
020316324b010203040590111213149f
65030c001000023a801871382d40582c
4500fe1f1100001e011d8018711c1620
582c2500fe1f1100009e011d80d0721c
1620102c2580fe1f1100009e023a80d0
72382d40102c4580fe1f1100001e0000
00000000000000000000000000000000
000000000000000000000000000000a0

Extracted contents:
header:          00 ff ff ff ff ff ff 00
serial number:   04 72 0c 03 6b 21 60 32 1a 17
version:         01 03
basic params:    80 33 1d 78 2a
chroma info:     e5 95 a6 56 52 9d 27 10 50 54
established:     b3 0c 00
standard:        71 4f 81 c0 81 00 81 80 95 00 b3 00 d1 c0 01 01
descriptor 1:    02 3a 80 18 71 38 2d 40 58 2c 45 00 fe 1f 11 00 00 1e
descriptor 2:    00 00 00 fd 00 31 4b 1e 5e 11 00 0a 20 20 20 20 20 20
descriptor 3:    00 00 00 fc 00 41 63 65 72 20 47 32 33 36 48 4c 0a 20
descriptor 4:    00 00 00 ff 00 4c 57 53 45 45 30 30 32 34 33 34 30 0a
extensions:      01
checksum:        72

EDID version: 1.3
Manufacturer: ACR Model 30c Serial Number --
Made in week 26 of 2013
Digital display
Maximum image size: 51 cm x 29 cm
Gamma: 2.20
DPMS levels: Off
RGB color display
First detailed timing is preferred timing
Display x,y Chromaticity:
  Red:   0.6513, 0.3378
  Green: 0.3212, 0.6142
  Blue:  0.1542, 0.0634
  White: 0.3134, 0.3291
Established timings supported:
  720x400@70Hz 9:5 HorFreq: 31469 Hz Clock: 28.320 MHz
  640x480@60Hz 4:3 HorFreq: 31469 Hz Clock: 25.175 MHz
  640x480@67Hz 4:3 HorFreq: 35000 Hz Clock: 30.240 MHz
  800x600@56Hz 4:3 HorFreq: 35200 Hz Clock: 36.000 MHz
  800x600@60Hz 4:3 HorFreq: 37900 Hz Clock: 40.000 MHz
  1024x768@60Hz 4:3 HorFreq: 48400 Hz Clock: 65.000 MHz
  1024x768@70Hz 4:3 HorFreq: 56500 Hz Clock: 75.000 MHz
Standard timings supported:
  1152x864@75Hz 4:3 HorFreq: 67500 Hz Clock: 108.000 MHz
  1280x720@60Hz 16:9
  1280x800@60Hz 16:10
  1280x1024@60Hz 5:4 HorFreq: 64000 Hz Clock: 108.000 MHz
  1440x900@60Hz 16:10 HorFreq: 55500 Hz Clock: 88.750 MHz
  1680x1050@60Hz 16:10 HorFreq: 64700 Hz Clock: 119.000 MHz
  1920x1080@60Hz 16:9
Detailed mode: Clock 148.500 MHz, 510 mm x 287 mm
               1920 2008 2052 2200 hborder 0
               1080 1084 1089 1125 vborder 0
               +hsync +vsync 
               VertFreq: 60 Hz, HorFreq: 67500 Hz
Monitor ranges (GTF): 49-75Hz V, 30-94kHz H, max dotclock 170MHz
Monitor name: Acer G236HL
Serial number: --
Has 1 extension blocks
Checksum: 0x72 (valid)

CTA extension block
Extension version: 3
18 bytes of CTA data
  Video data block
    VIC   1 640x480@60Hz 4:3  HorFreq: 31469 Hz Clock: 25.175 MHz
    VIC   2 720x480@60Hz 4:3  HorFreq: 31469 Hz Clock: 27.000 MHz
    VIC   3 720x480@60Hz 16:9  HorFreq: 31469 Hz Clock: 27.000 MHz
    VIC   4 1280x720@60Hz 16:9  HorFreq: 45000 Hz Clock: 74.250 MHz
    VIC   5 1920x1080i@60Hz 16:9  HorFreq: 33750 Hz Clock: 74.250 MHz
    VIC  16 1920x1080@60Hz 16:9 (native) HorFreq: 67500 Hz Clock: 148.500 MHz
    VIC  17 720x576@50Hz 4:3  HorFreq: 31250 Hz Clock: 27.000 MHz
    VIC  18 720x576@50Hz 16:9  HorFreq: 31250 Hz Clock: 27.000 MHz
    VIC  19 1280x720@50Hz 16:9  HorFreq: 37500 Hz Clock: 74.250 MHz
    VIC  20 1920x1080i@50Hz 16:9  HorFreq: 28125 Hz Clock: 74.250 MHz
    VIC  31 1920x1080@50Hz 16:9 (native) HorFreq: 56250 Hz Clock: 148.500 MHz
  Vendor-specific data block, OUI 000c03 (HDMI)
    Source physical address 1.0.0.0
Supports YCbCr 4:4:4
Supports YCbCr 4:2:2
2 native detailed modes
Detailed mode: Clock 148.500 MHz, 510 mm x 287 mm
               1920 2008 2052 2200 hborder 0
               1080 1084 1089 1125 vborder 0
               +hsync +vsync 
               VertFreq: 60 Hz, HorFreq: 67500 Hz
Detailed mode: Clock 74.250 MHz, 510 mm x 287 mm
               1920 2008 2052 2200 hborder 0
                540  542  547  562 vborder 0
               +hsync +vsync interlaced 
               VertFreq: 60 Hz, HorFreq: 33750 Hz
Detailed mode: Clock 74.250 MHz, 510 mm x 287 mm
               1920 2448 2492 2640 hborder 0
                540  542  547  562 vborder 0
               +hsync +vsync interlaced 
               VertFreq: 50 Hz, HorFreq: 28125 Hz
Detailed mode: Clock 148.500 MHz, 510 mm x 287 mm
               1920 2448 2492 2640 hborder 0
               1080 1084 1089 1125 vborder 0
               +hsync +vsync 
               VertFreq: 50 Hz, HorFreq: 56250 Hz
Checksum: 0xa0 (valid)

One or more of the timings is out of range of the Monitor Ranges:
  Vertical Freq: 50 - 75 Hz
  Horizontal Freq: 28125 - 67500 Hz
  Maximum Clock: 148.500 MHz
EDID block does not conform at all!
	Both the serial number and the serial string are set
