
EDID (hex):
00ffffffffffff000d091bbd00000000
1e17010380583278ba9d81a3544c9926
0f5054254f0071408100814081809500
950fb300a94064190040410026301888
3600a05a0000001e023a801871382d40
582c4500a05a0000001e000000fd0032
3c1e440f0200202020202020000000fc
0056474120444953504c41590a2001ad

Extracted contents:
header:          00 ff ff ff ff ff ff 00
serial number:   0d 09 1b bd 00 00 00 00 1e 17
version:         01 03
basic params:    80 58 32 78 ba
chroma info:     9d 81 a3 54 4c 99 26 0f 50 54
established:     25 4f 00
standard:        71 40 81 00 81 40 81 80 95 00 95 0f b3 00 a9 40
descriptor 1:    64 19 00 40 41 00 26 30 18 88 36 00 a0 5a 00 00 00 1e
descriptor 2:    02 3a 80 18 71 38 2d 40 58 2c 45 00 a0 5a 00 00 00 1e
descriptor 3:    00 00 00 fd 00 32 3c 1e 44 0f 02 00 20 20 20 20 20 20
descriptor 4:    00 00 00 fc 00 56 47 41 20 44 49 53 50 4c 41 59 0a 20
extensions:      01
checksum:        ad

EDID version: 1.3
Manufacturer: CHI Model bd1b Serial Number --
Made in week 30 of 2013
Digital display
Maximum image size: 88 cm x 50 cm
Gamma: 2.20
DPMS levels: Standby Off
Undefined display color type
First detailed timing is preferred timing
Display x,y Chromaticity:
  Red:   0.6386, 0.3291
  Green: 0.2998, 0.5986
  Blue:  0.1503, 0.0585
  White: 0.3125, 0.3291
Established timings supported:
  640x480@60Hz 4:3 HorFreq: 31469 Hz Clock: 25.175 MHz
  640x480@75Hz 4:3 HorFreq: 37500 Hz Clock: 31.500 MHz
  800x600@60Hz 4:3 HorFreq: 37900 Hz Clock: 40.000 MHz
  800x600@75Hz 4:3 HorFreq: 46900 Hz Clock: 49.500 MHz
  1024x768@60Hz 4:3 HorFreq: 48400 Hz Clock: 65.000 MHz
  1024x768@70Hz 4:3 HorFreq: 56500 Hz Clock: 75.000 MHz
  1024x768@75Hz 4:3 HorFreq: 60000 Hz Clock: 78.750 MHz
  1280x1024@75Hz 5:4 HorFreq: 80000 Hz Clock: 135.000 MHz
Standard timings supported:
  1152x864@60Hz 4:3
  1280x800@60Hz 16:10
  1280x960@60Hz 4:3 HorFreq: 60000 Hz Clock: 108.000 MHz
  1280x1024@60Hz 5:4 HorFreq: 64000 Hz Clock: 108.000 MHz
  1440x900@60Hz 16:10 HorFreq: 55500 Hz Clock: 88.750 MHz
  1440x900@75Hz 16:10 HorFreq: 82300 Hz Clock: 156.000 MHz
  1680x1050@60Hz 16:10 HorFreq: 64700 Hz Clock: 119.000 MHz
  1600x1200@60Hz 4:3 HorFreq: 75000 Hz Clock: 162.000 MHz
Detailed mode: Clock 65.000 MHz, 160 mm x 90 mm
               1024 1048 1184 1344 hborder 0
                768  771  777  806 vborder 0
               +hsync +vsync 
               VertFreq: 60 Hz, HorFreq: 48363 Hz
Detailed mode: Clock 148.500 MHz, 160 mm x 90 mm
               1920 2008 2052 2200 hborder 0
               1080 1084 1089 1125 vborder 0
               +hsync +vsync 
               VertFreq: 60 Hz, HorFreq: 67500 Hz
Monitor ranges (GTF with icing): 50-60Hz V, 30-68kHz H, max dotclock 150MHz
Monitor name: VGA DISPLAY
Has 1 extension blocks
Checksum: 0xad (valid)
One or more of the timings is out of range of the Monitor Ranges:
  Vertical Freq: 60 - 75 Hz
  Horizontal Freq: 31469 - 82300 Hz
  Maximum Clock: 162.000 MHz
