edid-decode (hex):

00 ff ff ff ff ff ff 00 0d 09 1b bd 00 00 00 00
1e 17 01 03 80 58 32 78 ba 9d 81 a3 54 4c 99 26
0f 50 54 25 4e 00 71 40 81 00 81 40 81 80 95 00
95 0f b3 00 a9 40 64 19 00 40 41 00 26 30 18 88
36 00 a0 5a 00 00 00 1e 02 3a 80 18 71 38 2d 40
58 2c 45 00 a0 5a 00 00 00 1e 00 00 00 fd 00 32
3c 1e 44 0f 02 00 20 20 20 20 20 20 00 00 00 fc
00 56 47 41 20 44 49 53 50 4c 41 59 0a 20 01 ae

02 03 1b 71 23 09 07 07 83 01 00 00 67 03 0c 00
11 20 00 21 43 01 10 84 e2 00 0f 01 1d 00 72 51
d0 1e 20 6e 28 55 00 81 49 00 00 00 1e 00 00 00
10 00 00 00 00 00 00 00 00 00 00 00 00 00 00 00
00 00 10 00 00 00 00 00 00 00 00 00 00 00 00 00
00 00 00 00 10 00 00 00 00 00 00 00 00 00 00 00
00 00 00 00 00 00 10 00 00 00 00 00 00 00 00 00
00 00 00 00 00 00 00 00 00 00 00 00 00 00 00 1e

----------------

Block 0, Base EDID:
  EDID Structure Version & Revision: 1.3
  Vendor & Product Identification:
    Manufacturer: CHI
    Model: 48411
    Made in: week 30 of 2013
  Basic Display Parameters & Features:
    Digital display
    Maximum image size: 88 cm x 50 cm
    Gamma: 2.20
    DPMS levels: Standby Off
    Undefined display color type
    First detailed timing is the preferred timing
  Color Characteristics:
    Red  : 0.6386, 0.3291
    Green: 0.2998, 0.5986
    Blue : 0.1503, 0.0585
    White: 0.3125, 0.3291
  Established Timings I & II:
    DMT 0x04:   640x480    59.940 Hz   4:3    31.469 kHz  25.175 MHz
    DMT 0x06:   640x480    75.000 Hz   4:3    37.500 kHz  31.500 MHz
    DMT 0x09:   800x600    60.317 Hz   4:3    37.879 kHz  40.000 MHz
    DMT 0x0b:   800x600    75.000 Hz   4:3    46.875 kHz  49.500 MHz
    DMT 0x10:  1024x768    60.004 Hz   4:3    48.363 kHz  65.000 MHz
    DMT 0x11:  1024x768    70.069 Hz   4:3    56.476 kHz  75.000 MHz
    DMT 0x12:  1024x768    75.029 Hz   4:3    60.023 kHz  78.750 MHz
  Standard Timings:
    GTF     :  1152x864    60.000 Hz   4:3    53.700 kHz  81.624 MHz
    DMT 0x1c:  1280x800    59.810 Hz  16:10   49.702 kHz  83.500 MHz
    DMT 0x20:  1280x960    60.000 Hz   4:3    60.000 kHz 108.000 MHz
    DMT 0x23:  1280x1024   60.020 Hz   5:4    63.981 kHz 108.000 MHz
    DMT 0x2f:  1440x900    59.887 Hz  16:10   55.935 kHz 106.500 MHz
    DMT 0x30:  1440x900    74.984 Hz  16:10   70.635 kHz 136.750 MHz
    DMT 0x3a:  1680x1050   59.954 Hz  16:10   65.290 kHz 146.250 MHz
    DMT 0x33:  1600x1200   60.000 Hz   4:3    75.000 kHz 162.000 MHz
  Detailed Timing Descriptors:
    DTD 1:  1024x768    60.004 Hz   4:3    48.363 kHz  65.000 MHz (160 mm x 90 mm)
                 Hfront   24 Hsync 136 Hback 160 Hpol P
                 Vfront    3 Vsync   6 Vback  29 Vpol P
    DTD 2:  1920x1080   60.000 Hz  16:9    67.500 kHz 148.500 MHz (160 mm x 90 mm)
                 Hfront   88 Hsync  44 Hback 148 Hpol P
                 Vfront    4 Vsync   5 Vback  36 Vpol P
  Display Range Limits:
    Monitor ranges (Secondary GTF): 50-60 Hz V, 30-68 kHz H, max dotclock 150 MHz
    GTF Secondary Curve Block:
      Start frequency: 64 kHz
      C: 16.000000
      M: 8224
      K: 32
      J: 16.000000
    Display Product Name: 'VGA DISPLAY'
  Extension blocks: 1
Checksum: 0xae

----------------

Block 1, CTA-861 Extension Block:
  Revision: 3
  Basic audio support
  Supports YCbCr 4:4:4
  Supports YCbCr 4:2:2
  Native detailed modes: 1
  Audio Data Block:
    Linear PCM:
      Max channels: 2
      Supported sample rates (kHz): 48 44.1 32
      Supported sample sizes (bits): 24 20 16
  Speaker Allocation Data Block:
    FL/FR - Front Left/Right
  Vendor-Specific Data Block (HDMI), OUI 00-0C-03:
    Source physical address: 1.1.2.0
    Maximum TMDS clock: 165 MHz
  Video Data Block:
    VIC   1:   640x480    59.940 Hz   4:3    31.469 kHz  25.175 MHz
    VIC  16:  1920x1080   60.000 Hz  16:9    67.500 kHz 148.500 MHz
    VIC   4:  1280x720    60.000 Hz  16:9    45.000 kHz  74.250 MHz (native)
  Video Capability Data Block:
    YCbCr quantization: No Data
    RGB quantization: No Data
    PT scan behavior: No Data
    IT scan behavior: Supports both over- and underscan
    CE scan behavior: Supports both over- and underscan
  Detailed Timing Descriptors:
    DTD 3:  1280x720    60.000 Hz  16:9    45.000 kHz  74.250 MHz (129 mm x 73 mm)
                 Hfront  110 Hsync  40 Hback 220 Hpol P
                 Vfront    5 Vsync   5 Vback  20 Vpol P
    Dummy Descriptor:
    Dummy Descriptor:
    Dummy Descriptor:
    Dummy Descriptor:
Checksum: 0x1e

----------------

Warnings:

Block 1, CTA-861 Extension Block:
  IT Video Formats are overscanned by default, but normally this should be underscanned.
  Video Capability Data Block: Set Selectable RGB Quantization to avoid interop issues.

Failures:

Block 0, Base EDID:
  Detailed Timing Descriptor #1: Mismatch of image size 160x90 mm vs display size 880x500 mm.
  Detailed Timing Descriptor #2: Mismatch of image size 160x90 mm vs display size 880x500 mm.
Block 1, CTA-861 Extension Block:
  Detailed Timing Descriptor #3: Mismatch of image size 129x73 mm vs display size 880x500 mm.
EDID:
  Base EDID: Some timings are out of range of the Monitor Ranges:
    Vertical Freq: 59.810 - 75.029 Hz (Monitor: 50.000 - 60.000 Hz)
    Horizontal Freq: 31.468 - 75.000 kHz (Monitor: 30.000 - 68.000 kHz)
    Maximum Clock: 162.000 MHz (Monitor: 150.000 MHz)
  CTA-861: Native progressive timings are a mix of several resolutions.

EDID conformity: FAIL
