edid-decode (hex):

00 ff ff ff ff ff ff 00 22 f0 82 26 01 01 01 01
1f 11 01 03 68 26 1e 78 ee f0 45 a4 53 4a 9d 24
14 4f 54 ad ef 80 81 80 01 01 01 01 01 01 01 01
01 01 01 01 01 01 30 2a 00 98 51 00 2a 40 30 70
13 00 52 0e 11 00 00 1e 00 00 00 fd 00 38 4c 1e
53 0e 00 0a 20 20 20 20 20 20 00 00 00 fc 00 48
50 20 4c 31 39 34 30 54 0a 20 20 20 00 00 00 ff
00 43 4e 43 37 33 31 51 5a 4a 4c 0a 20 20 00 ab

----------------

Block 0, Base EDID:
  EDID Structure Version & Revision: 1.3
  Vendor & Product Identification:
    Manufacturer: HWP
    Model: 9858
    Serial Number: ...
    Made in: week 31 of 2007
  Basic Display Parameters & Features:
    Analog display
    Input voltage level: 0.7/0.7 V
    Blank level equals black level
    Sync: Separate
    Maximum image size: 38 cm x 30 cm
    Gamma: 2.20
    DPMS levels: Standby Suspend Off
    RGB color display
    Default (sRGB) color space is primary color space
    First detailed timing is the preferred timing
  Color Characteristics:
    Red  : 0.6435, 0.3271
    Green: 0.2890, 0.6132
    Blue : 0.1416, 0.0781
    White: 0.3095, 0.3291
  Established Timings I & II:
    IBM     :   720x400    70.082 Hz   9:5    31.467 kHz  28.320 MHz
    DMT 0x04:   640x480    59.940 Hz   4:3    31.469 kHz  25.175 MHz
    DMT 0x05:   640x480    72.809 Hz   4:3    37.861 kHz  31.500 MHz
    DMT 0x06:   640x480    75.000 Hz   4:3    37.500 kHz  31.500 MHz
    DMT 0x09:   800x600    60.317 Hz   4:3    37.879 kHz  40.000 MHz
    DMT 0x0a:   800x600    72.188 Hz   4:3    48.077 kHz  50.000 MHz
    DMT 0x0b:   800x600    75.000 Hz   4:3    46.875 kHz  49.500 MHz
    Apple   :   832x624    74.551 Hz   4:3    49.726 kHz  57.284 MHz
    DMT 0x10:  1024x768    60.004 Hz   4:3    48.363 kHz  65.000 MHz
    DMT 0x11:  1024x768    70.069 Hz   4:3    56.476 kHz  75.000 MHz
    DMT 0x12:  1024x768    75.029 Hz   4:3    60.023 kHz  78.750 MHz
    DMT 0x24:  1280x1024   75.025 Hz   5:4    79.976 kHz 135.000 MHz
    Apple   :  1152x870    75.062 Hz 192:145  68.681 kHz 100.000 MHz
  Standard Timings:
    DMT 0x23:  1280x1024   60.020 Hz   5:4    63.981 kHz 108.000 MHz
  Detailed Timing Descriptors:
    DTD 1:  1280x1024   60.020 Hz   5:4    63.981 kHz 108.000 MHz (338 mm x 270 mm)
                 Hfront   48 Hsync 112 Hback 248 Hpol P
                 Vfront    1 Vsync   3 Vback  38 Vpol P
  Display Range Limits:
    Monitor ranges (GTF): 56-76 Hz V, 30-83 kHz H, max dotclock 140 MHz
    Display Product Name: 'HP L1940T'
    Display Product Serial Number: ...
Checksum: 0xab

----------------

Failures:

Block 0, Base EDID:
  Basic Display Parameters & Features: sRGB is signaled, but the chromaticities do not match.
  Detailed Timing Descriptor #1: Mismatch of image size 338x270 mm vs display size 380x300 mm.

EDID conformity: FAIL
