
EDID (hex):
00ffffffffffff0010ac4df149414741
29210104a51f11783aee95a3544c9926
0f5054210800a940810081809500b300
010101010101023a801871382d40582c
450035ae1000001e000000ff00484b36
4d475a330a2020202020000000fc0044
454c4c205031343234480a20000000fd
00383d1e5011000a202020202020012d
02030eb1499011040302011f12137c2e
90a0601a1e403020360035ae1000001c
9a29a0d0518422305098360035ae1000
001a662156aa51001e30468f330035ae
1000001e0e1f008051001e3040803700
35ae1000001c00000000000000000000
00000000000000000000000000000000
000000000000000000000000000000a7

edid-decode (hex):

00 ff ff ff ff ff ff 00 10 ac 4d f1 49 41 47 41
29 21 01 04 a5 1f 11 78 3a ee 95 a3 54 4c 99 26
0f 50 54 21 08 00 a9 40 81 00 81 80 95 00 b3 00
01 01 01 01 01 01 02 3a 80 18 71 38 2d 40 58 2c
45 00 35 ae 10 00 00 1e 00 00 00 ff 00 48 4b 36
4d 47 5a 33 0a 20 20 20 20 20 00 00 00 fc 00 44
45 4c 4c 20 50 31 34 32 34 48 0a 20 00 00 00 fd
00 38 3d 1e 50 11 00 0a 20 20 20 20 20 20 01 2d

02 03 0e b1 49 90 11 04 03 02 01 1f 12 13 7c 2e
90 a0 60 1a 1e 40 30 20 36 00 35 ae 10 00 00 1c
9a 29 a0 d0 51 84 22 30 50 98 36 00 35 ae 10 00
00 1a 66 21 56 aa 51 00 1e 30 46 8f 33 00 35 ae
10 00 00 1e 0e 1f 00 80 51 00 1e 30 40 80 37 00
35 ae 10 00 00 1c 00 00 00 00 00 00 00 00 00 00
00 00 00 00 00 00 00 00 00 00 00 00 00 00 00 00
00 00 00 00 00 00 00 00 00 00 00 00 00 00 00 a7

----------------

Block 0, Base EDID:
  EDID Structure Version & Revision: 1.4
  Vendor & Product Identification:
    Manufacturer: DEL
    Model: 61773
    Serial Number: 1095188809
    Made in: week 41 of 2023
  Basic Display Parameters & Features:
    Digital display
    Bits per primary color channel: 8
    DisplayPort interface
    Maximum image size: 31 cm x 17 cm
    Gamma: 2.20
    DPMS levels: Off
    Supported color formats: RGB 4:4:4, YCrCb 4:4:4, YCrCb 4:2:2
    First detailed timing includes the native pixel format and preferred refresh rate
  Color Characteristics:
    Red  : 0.6396, 0.3300
    Green: 0.2998, 0.5996
    Blue : 0.1503, 0.0595
    White: 0.3134, 0.3291
  Established Timings I & II:
    DMT 0x04:   640x480    59.940476 Hz   4:3     31.469 kHz     25.175000 MHz
    DMT 0x09:   800x600    60.316541 Hz   4:3     37.879 kHz     40.000000 MHz
    DMT 0x10:  1024x768    60.003840 Hz   4:3     48.363 kHz     65.000000 MHz
  Standard Timings:
    DMT 0x33:  1600x1200   60.000000 Hz   4:3     75.000 kHz    162.000000 MHz
    DMT 0x1c:  1280x800    59.810326 Hz  16:10    49.702 kHz     83.500000 MHz
    DMT 0x23:  1280x1024   60.019740 Hz   5:4     63.981 kHz    108.000000 MHz
    DMT 0x2f:  1440x900    59.887445 Hz  16:10    55.935 kHz    106.500000 MHz
    DMT 0x3a:  1680x1050   59.954250 Hz  16:10    65.290 kHz    146.250000 MHz
  Detailed Timing Descriptors:
    DTD 1:  1920x1080   60.000000 Hz  16:9     67.500 kHz    148.500000 MHz (309 mm x 174 mm)
                 Hfront   88 Hsync  44 Hback  148 Hpol P
                 Vfront    4 Vsync   5 Vback   36 Vpol P
    Display Product Serial Number: 'HK6MGZ3'
    Display Product Name: 'DELL P1424H'
    Display Range Limits:
      Monitor ranges (GTF): 56-61 Hz V, 30-80 kHz H, max dotclock 170 MHz
  Extension blocks: 1
Checksum: 0x2d

----------------

Block 1, CTA-861 Extension Block:
  Revision: 3
  Underscans IT Video Formats by default
  Supports YCbCr 4:4:4
  Supports YCbCr 4:2:2
  Native detailed modes: 1
  Video Data Block:
    VIC  16:  1920x1080   60.000000 Hz  16:9     67.500 kHz    148.500000 MHz (native)
    VIC  17:   720x576    50.000000 Hz   4:3     31.250 kHz     27.000000 MHz
    VIC   4:  1280x720    60.000000 Hz  16:9     45.000 kHz     74.250000 MHz
    VIC   3:   720x480    59.940060 Hz  16:9     31.469 kHz     27.000000 MHz
    VIC   2:   720x480    59.940060 Hz   4:3     31.469 kHz     27.000000 MHz
    VIC   1:   640x480    59.940476 Hz   4:3     31.469 kHz     25.175000 MHz
    VIC  31:  1920x1080   50.000000 Hz  16:9     56.250 kHz    148.500000 MHz
    VIC  18:   720x576    50.000000 Hz  16:9     31.250 kHz     27.000000 MHz
    VIC  19:  1280x720    50.000000 Hz  16:9     37.500 kHz     74.250000 MHz
  Detailed Timing Descriptors:
    DTD 2:  1680x1050   59.883253 Hz  16:10    64.674 kHz    119.000000 MHz (309 mm x 174 mm)
                 Hfront   48 Hsync  32 Hback   80 Hpol N
                 Vfront    3 Vsync   6 Vback   21 Vpol P
    DTD 3:  1440x900    59.887445 Hz  16:10    55.935 kHz    106.500000 MHz (309 mm x 174 mm)
                 Hfront   80 Hsync 152 Hback  232 Hpol P
                 Vfront    3 Vsync   6 Vback   25 Vpol N
    DTD 4:  1366x768    59.789541 Hz 683:384   47.712 kHz     85.500000 MHz (309 mm x 174 mm)
                 Hfront   70 Hsync 143 Hback  213 Hpol P
                 Vfront    3 Vsync   3 Vback   24 Vpol P
    DTD 5:  1280x768    59.870228 Hz   5:3     47.776 kHz     79.500000 MHz (309 mm x 174 mm)
                 Hfront   64 Hsync 128 Hback  192 Hpol N
                 Vfront    3 Vsync   7 Vback   20 Vpol P
Checksum: 0xa7  Unused space in Extension Block: 41 bytes


