edid-decode (hex):

00 ff ff ff ff ff ff 00 31 03 ff ff 00 00 00 00
07 21 01 03 00 30 1a 78 ea ca 65 ab 52 47 a4 23
10 50 54 bf ef 80 71 4f 81 c0 81 40 81 80 95 00
a9 c0 b3 00 d1 c0 02 3a 80 18 71 38 2d 40 58 2c
45 00 df 04 11 00 00 1a 66 21 56 aa 51 00 1e 30
46 8f 33 00 df 04 11 00 00 1e 00 00 00 fd 00 30
3c 34 43 14 00 0a 20 20 20 20 20 20 00 00 00 fc
00 4c 4d 32 32 2d 43 32 30 30 0a 20 20 20 00 b7

00 ff ff ff ff ff ff 00 31 03 ff ff 00 00 00 00
07 21 01 03 00 30 1a 78 ea ca 65 ab 52 47 a4 23
10 50 54 bf ef 80 71 4f 81 c0 81 40 81 80 95 00
a9 c0 b3 00 d1 c0 02 3a 80 18 71 38 2d 40 58 2c
45 00 df 04 11 00 00 1a 66 21 56 aa 51 00 1e 30
46 8f 33 00 df 04 11 00 00 1e 00 00 00 fd 00 30
3c 34 43 14 00 0a 20 20 20 20 20 20 00 00 00 fc
00 4c 4d 32 32 2d 43 32 30 30 0a 20 20 20 00 b7

----------------

Block 0, Base EDID:
  EDID Structure Version & Revision: 1.3
  Vendor & Product Identification:
    Manufacturer: LHC
    Model: 65535
    Made in: week 7 of 2023
  Basic Display Parameters & Features:
    Analog display
    Signal Level Standard: 0.700 : 0.300 : 1.000 V p-p
    Blank level equals black level
    Maximum image size: 48 cm x 26 cm
    Gamma: 2.20
    DPMS levels: Standby Suspend Off
    RGB color display
    First detailed timing is the preferred timing
  Color Characteristics:
    Red  : 0.6708, 0.3203
    Green: 0.2792, 0.6425
    Blue : 0.1376, 0.0644
    White: 0.3134, 0.3291
  Established Timings I & II:
    IBM     :   720x400    70.081663 Hz   9:5     31.467 kHz     28.320000 MHz
    DMT 0x04:   640x480    59.940476 Hz   4:3     31.469 kHz     25.175000 MHz
    Apple   :   640x480    66.666667 Hz   4:3     35.000 kHz     30.240000 MHz
    DMT 0x05:   640x480    72.808802 Hz   4:3     37.861 kHz     31.500000 MHz
    DMT 0x06:   640x480    75.000000 Hz   4:3     37.500 kHz     31.500000 MHz
    DMT 0x08:   800x600    56.250000 Hz   4:3     35.156 kHz     36.000000 MHz
    DMT 0x09:   800x600    60.316541 Hz   4:3     37.879 kHz     40.000000 MHz
    DMT 0x0a:   800x600    72.187572 Hz   4:3     48.077 kHz     50.000000 MHz
    DMT 0x0b:   800x600    75.000000 Hz   4:3     46.875 kHz     49.500000 MHz
    Apple   :   832x624    74.551266 Hz   4:3     49.726 kHz     57.284000 MHz
    DMT 0x10:  1024x768    60.003840 Hz   4:3     48.363 kHz     65.000000 MHz
    DMT 0x11:  1024x768    70.069359 Hz   4:3     56.476 kHz     75.000000 MHz
    DMT 0x12:  1024x768    75.028582 Hz   4:3     60.023 kHz     78.750000 MHz
    DMT 0x24:  1280x1024   75.024675 Hz   5:4     79.976 kHz    135.000000 MHz
    Apple   :  1152x870    75.061550 Hz 192:145   68.681 kHz    100.000000 MHz
  Standard Timings:
    DMT 0x15:  1152x864    75.000000 Hz   4:3     67.500 kHz    108.000000 MHz
    DMT 0x55:  1280x720    60.000000 Hz  16:9     45.000 kHz     74.250000 MHz
    DMT 0x20:  1280x960    60.000000 Hz   4:3     60.000 kHz    108.000000 MHz
    DMT 0x23:  1280x1024   60.019740 Hz   5:4     63.981 kHz    108.000000 MHz
    DMT 0x2f:  1440x900    59.887445 Hz  16:10    55.935 kHz    106.500000 MHz
    DMT 0x53:  1600x900    60.000000 Hz  16:9     60.000 kHz    108.000000 MHz (RB)
    DMT 0x3a:  1680x1050   59.954250 Hz  16:10    65.290 kHz    146.250000 MHz
    DMT 0x52:  1920x1080   60.000000 Hz  16:9     67.500 kHz    148.500000 MHz
  Detailed Timing Descriptors:
    DTD 1:  1920x1080   60.000000 Hz  16:9     67.500 kHz    148.500000 MHz (479 mm x 260 mm)
                 Hfront   88 Hsync  44 Hback  148 Hpol P
                 Vfront    4 Vsync   5 Vback   36 Vpol N
    DTD 2:  1366x768    59.789541 Hz 683:384   47.712 kHz     85.500000 MHz (479 mm x 260 mm)
                 Hfront   70 Hsync 143 Hback  213 Hpol P
                 Vfront    3 Vsync   3 Vback   24 Vpol P
    Display Range Limits:
      Monitor ranges (GTF): 48-60 Hz V, 52-67 kHz H, max dotclock 200 MHz
    Display Product Name: 'LM22-C200'
Checksum: 0xb7

----------------

Block 1, Unknown EDID Extension Block 0x00:
  00 ff ff ff ff ff ff 00 31 03 ff ff 00 00 00 00 '........1.......'
  07 21 01 03 00 30 1a 78 ea ca 65 ab 52 47 a4 23 '.!...0.x..e.RG.#'
  10 50 54 bf ef 80 71 4f 81 c0 81 40 81 80 95 00 '.PT...qO...@....'
  a9 c0 b3 00 d1 c0 02 3a 80 18 71 38 2d 40 58 2c '.......:..q8-@X,'
  45 00 df 04 11 00 00 1a 66 21 56 aa 51 00 1e 30 'E.......f!V.Q..0'
  46 8f 33 00 df 04 11 00 00 1e 00 00 00 fd 00 30 'F.3............0'
  3c 34 43 14 00 0a 20 20 20 20 20 20 00 00 00 fc '<4C...      ....'
  00 4c 4d 32 32 2d 43 32 30 30 0a 20 20 20 00 b7 '.LM22-C200.   ..'
Checksum: 0xb7

----------------

Warnings:

Block 0, Base EDID:
  Detailed Timing Descriptor #1: DTD is similar but not identical to VIC 16.

Failures:

Block 1, Base EDID:
  Unknown Extension Block.
EDID:
  Base EDID: Some timings are out of range of the Monitor Ranges:
    Vertical Freq: 56.250 - 75.062 Hz (Monitor: 48.000 - 60.000 Hz)
    Horizontal Freq: 31.466 - 79.976 kHz (Monitor: 52.000 - 67.000 kHz)
  Base EDID: EDID specified 0 extension block(s), but found 1 extension block(s).

EDID conformity: FAIL
