edid-decode (hex):

00 ff ff ff ff ff ff 00 22 d2 03 aa 00 00 00 00
08 1c 01 04 a5 0c 07 78 02 e2 95 a3 54 4c 99 26
0f 50 54 00 00 00 01 01 01 01 01 01 01 01 01 01
01 01 01 01 01 01 21 ca 40 2c b1 a4 6c 60 d8 10
d4 00 70 42 00 00 00 18 21 ca 40 2c b1 a4 6c 60
d8 10 d4 00 70 42 00 00 00 18 00 00 00 fc 00 56
49 56 45 20 43 6f 73 6d 6f 73 0a 20 00 00 00 fd
00 17 ff 0f ff 42 01 0a 20 20 20 20 20 20 01 af

02 03 0c 40 23 09 16 05 83 01 00 00 00 00 00 00
00 00 00 00 00 00 00 00 00 00 00 00 00 00 00 00
00 00 00 00 00 00 00 00 00 00 00 00 00 00 00 00
00 00 00 00 00 00 00 00 00 00 00 00 00 00 00 00
00 00 00 00 00 00 00 00 00 00 00 00 00 00 00 00
00 00 00 00 00 00 00 00 00 00 00 00 00 00 00 00
00 00 00 00 00 00 00 00 00 00 00 00 00 00 00 00
00 00 00 00 00 00 00 00 00 00 00 00 00 00 00 e4

----------------

Block 0, Base EDID:
  EDID Structure Version & Revision: 1.4
  Vendor & Product Identification:
    Manufacturer: HVR
    Model: 43523
    Made in: week 8 of 2018
  Basic Display Parameters & Features:
    Digital display
    Bits per primary color channel: 8
    DisplayPort interface
    Maximum image size: 12 cm x 7 cm
    Gamma: 2.20
    Supported color formats: RGB 4:4:4
    First detailed timing includes the native pixel format and preferred refresh rate
  Color Characteristics:
    Red  : 0.6396, 0.3300
    Green: 0.2968, 0.5996
    Blue : 0.1503, 0.0595
    White: 0.3134, 0.3291
  Established Timings I & II: none
  Standard Timings: none
  Detailed Timing Descriptors:
    DTD 1:  2880x1700   90.000070 Hz 144:85   162.720 kHz    517.450000 MHz (112 mm x 66 mm)
                 Hfront  216 Hsync  16 Hback   68 Hpol N
                 Vfront   13 Vsync   4 Vback   91 Vpol N
    DTD 2:  2880x1700   90.000070 Hz 144:85   162.720 kHz    517.450000 MHz (112 mm x 66 mm)
                 Hfront  216 Hsync  16 Hback   68 Hpol N
                 Vfront   13 Vsync   4 Vback   91 Vpol N
    Display Product Name: 'VIVE Cosmos'
    Display Range Limits:
      Monitor ranges (Bare Limits): 23-255 Hz V, 15-255 kHz H, max dotclock 660 MHz
  Extension blocks: 1
Checksum: 0xaf

----------------

Block 1, CTA-861 Extension Block:
  Revision: 3
  Basic audio support
  Native detailed modes: 0
  Audio Data Block:
    Linear PCM:
      Max channels: 2
      Supported sample rates (kHz): 96 48 44.1
      Supported sample sizes (bits): 24 16
  Speaker Allocation Data Block:
    FL/FR - Front Left/Right
Checksum: 0xe4  Unused space in Extension Block: 115 bytes

----------------

Warnings:

Block 0, Base EDID:
  Basic Display Parameters & Features: Dubious maximum image size (12x7 is smaller than 10x10 cm).
Block 1, CTA-861 Extension Block:
  IT Video Formats are overscanned by default, but normally this should be underscanned.
  Add a Colorimetry Data Block with the sRGB colorimetry bit set to avoid interop issues.

Failures:

Block 1, CTA-861 Extension Block:
  Required 640x480p60 timings are missing in the established timings and the SVD list (VIC 1).
  Missing VCDB, needed for Set Selectable RGB Quantization to avoid interop issues.

EDID conformity: FAIL
