
EDID (hex):
00ffffffffffff0020a3300001000000
321d0103807341780acf74a3574cb023
09484c21080081c08140818001010101
010101010101023a801871382d40582c
450080884200001e1b2150a051001e30
48883500444a2100001c000000fc0048
4953454e53450a2020202020000000fd
00324b0f450f000a20202020202001c7
02032e714d900204051f131422112021
01122f0907071507505707003d07c05f
7e018301000067030c002000382d8c0a
0d8a20e02d10103e9600c48e21000018
8c0ad090204031200c405500c48e2100
0018011d00bc52d01e20b8285540c48e
2100001e000000000000000000000000
0000000000000000000000000000004a

Extracted contents:
header:          00 ff ff ff ff ff ff 00
serial number:   20 a3 30 00 01 00 00 00 32 1d
version:         01 03
basic params:    80 73 41 78 0a
chroma info:     cf 74 a3 57 4c b0 23 09 48 4c
established:     21 08 00
standard:        81 c0 81 40 81 80 01 01 01 01 01 01 01 01 01 01
descriptor 1:    02 3a 80 18 71 38 2d 40 58 2c 45 00 80 88 42 00 00 1e
descriptor 2:    1b 21 50 a0 51 00 1e 30 48 88 35 00 44 4a 21 00 00 1c
descriptor 3:    00 00 00 fc 00 48 49 53 45 4e 53 45 0a 20 20 20 20 20
descriptor 4:    00 00 00 fd 00 32 4b 0f 45 0f 00 0a 20 20 20 20 20 20
extensions:      01
checksum:        c7

EDID version: 1.3
Manufacturer: HEC Model 30 Serial Number --
Made in week 50 of 2019
Digital display
Maximum image size: 115 cm x 65 cm
Gamma: 2.20
RGB color display
First detailed timing is preferred timing
Display x,y Chromaticity:
  Red:   0.6396, 0.3398
  Green: 0.2998, 0.6904
  Blue:  0.1376, 0.0380
  White: 0.2822, 0.2968
Established timings supported:
  640x480@60Hz 4:3 HorFreq: 31469 Hz Clock: 25.175 MHz
  800x600@60Hz 4:3 HorFreq: 37900 Hz Clock: 40.000 MHz
  1024x768@60Hz 4:3 HorFreq: 48400 Hz Clock: 65.000 MHz
Standard timings supported:
  1280x720@60Hz 16:9
  1280x960@60Hz 4:3 HorFreq: 60000 Hz Clock: 108.000 MHz
  1280x1024@60Hz 5:4 HorFreq: 64000 Hz Clock: 108.000 MHz
Detailed mode: Clock 148.500 MHz, 1152 mm x 648 mm
               1920 2008 2052 2200 hborder 0
               1080 1084 1089 1125 vborder 0
               +hsync +vsync 
               VertFreq: 60 Hz, HorFreq: 67500 Hz
Detailed mode: Clock 84.750 MHz, 580 mm x 330 mm
               1360 1432 1568 1776 hborder 0
                768  771  776  798 vborder 0
               -hsync +vsync 
               VertFreq: 59 Hz, HorFreq: 47719 Hz
Monitor name: HISENSE
Monitor ranges (GTF): 50-75Hz V, 15-69kHz H, max dotclock 150MHz
Has 1 extension blocks
Checksum: 0xc7 (valid)

CTA extension block
Extension version: 3
42 bytes of CTA data
  Video data block
    VIC  16 1920x1080@60Hz 16:9 (native) HorFreq: 67500 Hz Clock: 148.500 MHz
    VIC   2 720x480@60Hz 4:3  HorFreq: 31469 Hz Clock: 27.000 MHz
    VIC   4 1280x720@60Hz 16:9  HorFreq: 45000 Hz Clock: 74.250 MHz
    VIC   5 1920x1080i@60Hz 16:9  HorFreq: 33750 Hz Clock: 74.250 MHz
    VIC  31 1920x1080@50Hz 16:9  HorFreq: 56250 Hz Clock: 148.500 MHz
    VIC  19 1280x720@50Hz 16:9  HorFreq: 37500 Hz Clock: 74.250 MHz
    VIC  20 1920x1080i@50Hz 16:9  HorFreq: 28125 Hz Clock: 74.250 MHz
    VIC  34 1920x1080@30Hz 16:9  HorFreq: 33750 Hz Clock: 74.250 MHz
    VIC  17 720x576@50Hz 4:3  HorFreq: 31250 Hz Clock: 27.000 MHz
    VIC  32 1920x1080@24Hz 16:9  HorFreq: 27000 Hz Clock: 74.250 MHz
    VIC  33 1920x1080@25Hz 16:9  HorFreq: 28125 Hz Clock: 74.250 MHz
    VIC   1 640x480@60Hz 4:3  HorFreq: 31469 Hz Clock: 25.175 MHz
    VIC  18 720x576@50Hz 16:9  HorFreq: 31250 Hz Clock: 27.000 MHz
  Audio data block
    Linear PCM, max channels 2
      Supported sample rates (kHz): 48 44.1 32
      Supported sample sizes (bits): 24 20 16
    AC-3, max channels 6
      Supported sample rates (kHz): 48 44.1 32
      Maximum bit rate: 640 kHz
    Dolby Digital+, max channels 8
      Supported sample rates (kHz): 48 44.1 32
    DTS, max channels 6
      Supported sample rates (kHz): 48 44.1 32
      Maximum bit rate: 1536 kHz
    DTS-HD, max channels 8
      Supported sample rates (kHz): 192 176.4 96 88.2 48 44.1
  Speaker allocation data block
    Speaker map:
      FL/FR - Front Left/Right
  Vendor-specific data block, OUI 000c03 (HDMI)
    Source physical address 2.0.0.0
    DC_36bit
    DC_30bit
    DC_Y444
    Maximum TMDS clock: 225MHz
Basic audio support
Supports YCbCr 4:4:4
Supports YCbCr 4:2:2
1 native detailed modes
Detailed mode: Clock 27.000 MHz, 708 mm x 398 mm
                525  541  603  663 hborder 0
                480  489  495  525 vborder 0
               -hsync -vsync 
               VertFreq: 77 Hz, HorFreq: 40723 Hz
Detailed mode: Clock 27.000 MHz, 708 mm x 398 mm
                720  732  796  864 hborder 0
                576  581  586  625 vborder 0
               -hsync -vsync 
               VertFreq: 50 Hz, HorFreq: 31250 Hz
Detailed mode: Clock 74.250 MHz, 708 mm x 398 mm
               1280 1720 1760 1980 hborder 0
                720  725  730  750 vborder 0
               +hsync +vsync 
               VertFreq: 50 Hz, HorFreq: 37500 Hz
Checksum: 0x4a (valid)

One or more of the timings is out of range of the Monitor Ranges:
  Vertical Freq: 24 - 77 Hz
  Horizontal Freq: 27000 - 67500 Hz
  Maximum Clock: 148.500 MHz
