edid-decode (hex):

00 ff ff ff ff ff ff 00 10 ac 10 a0 53 35 37 30
11 0f 01 03 80 34 21 78 ee ee 50 a3 54 4c 9b 26
0f 50 54 a5 4b 00 81 80 a9 40 71 4f b3 00 01 01
01 01 01 01 01 01 28 3c 80 a0 70 b0 23 40 30 20
36 00 07 44 21 00 00 1a 00 00 00 ff 00 50 36 35
34 30 35 34 4c 30 37 35 53 20 00 00 00 fc 00 44
45 4c 4c 20 32 34 30 35 46 50 57 0a 00 00 00 fd
00 38 4c 1e 51 11 00 0a 20 20 20 20 20 20 00 43

00 ff ff ff ff ff ff 00 10 ac 10 a0 53 35 37 30
11 0f 01 03 80 34 21 78 ee ee 50 a3 54 4c 9b 26
0f 50 54 a5 4b 00 81 80 a9 40 71 4f b3 00 01 01
01 01 01 01 01 01 28 3c 80 a0 70 b0 23 40 30 20
36 00 07 44 21 00 00 1a 00 00 00 ff 00 50 36 35
34 30 35 34 4c 30 37 35 53 20 00 00 00 fc 00 44
45 4c 4c 20 32 34 30 35 46 50 57 0a 00 00 00 fd
00 38 4c 1e 51 11 00 0a 20 20 20 20 20 20 00 43

----------------

Block 0, Base EDID:
  EDID Structure Version & Revision: 1.3
  Vendor & Product Identification:
    Manufacturer: DEL
    Model: 40976
    Serial Number: ...
    Made in: week 17 of 2005
  Basic Display Parameters & Features:
    Digital display
    Maximum image size: 52 cm x 33 cm
    Gamma: 2.20
    DPMS levels: Standby Suspend Off
    RGB color display
    Default (sRGB) color space is primary color space
    First detailed timing is the preferred timing
  Color Characteristics:
    Red  : 0.6396, 0.3300
    Green: 0.2998, 0.6074
    Blue : 0.1494, 0.0595
    White: 0.3125, 0.3281
  Established Timings I & II:
    IBM     :   720x400    70.081663 Hz   9:5     31.467 kHz     28.320000 MHz
    DMT 0x04:   640x480    59.940476 Hz   4:3     31.469 kHz     25.175000 MHz
    DMT 0x06:   640x480    75.000000 Hz   4:3     37.500 kHz     31.500000 MHz
    DMT 0x09:   800x600    60.316541 Hz   4:3     37.879 kHz     40.000000 MHz
    DMT 0x0b:   800x600    75.000000 Hz   4:3     46.875 kHz     49.500000 MHz
    DMT 0x10:  1024x768    60.003840 Hz   4:3     48.363 kHz     65.000000 MHz
    DMT 0x12:  1024x768    75.028582 Hz   4:3     60.023 kHz     78.750000 MHz
    DMT 0x24:  1280x1024   75.024675 Hz   5:4     79.976 kHz    135.000000 MHz
  Standard Timings:
    DMT 0x23:  1280x1024   60.019740 Hz   5:4     63.981 kHz    108.000000 MHz
    DMT 0x33:  1600x1200   60.000000 Hz   4:3     75.000 kHz    162.000000 MHz
    DMT 0x15:  1152x864    75.000000 Hz   4:3     67.500 kHz    108.000000 MHz
    DMT 0x3a:  1680x1050   59.954250 Hz  16:10    65.290 kHz    146.250000 MHz
  Detailed Timing Descriptors:
    DTD 1:  1920x1200   59.950171 Hz  16:10    74.038 kHz    154.000000 MHz (519 mm x 324 mm)
                 Hfront   48 Hsync  32 Hback   80 Hpol P
                 Vfront    3 Vsync   6 Vback   26 Vpol N
    Display Product Serial Number: ...
    Display Product Name: 'DELL 2405FPW'
    Display Range Limits:
      Monitor ranges (GTF): 56-76 Hz V, 30-81 kHz H, max dotclock 170 MHz
Checksum: 0x43

----------------

Block 1, Unknown EDID Extension Block 0x00:
  00 ff ff ff ff ff ff 00 10 ac 10 a0 53 35 37 30 '............S570'
  11 0f 01 03 80 34 21 78 ee ee 50 a3 54 4c 9b 26 '.....4!x..P.TL.&'
  0f 50 54 a5 4b 00 81 80 a9 40 71 4f b3 00 01 01 '.PT.K....@qO....'
  01 01 01 01 01 01 28 3c 80 a0 70 b0 23 40 30 20 '......(<..p.#@0 '
  36 00 07 44 21 00 00 1a 00 00 00 ff 00 50 36 35 '6..D!........P65'
  34 30 35 34 4c 30 37 35 53 20 00 00 00 fc 00 44 '4054L075S .....D'
  45 4c 4c 20 32 34 30 35 46 50 57 0a 00 00 00 fd 'ELL 2405FPW.....'
  00 38 4c 1e 51 11 00 0a 20 20 20 20 20 20 00 43 '.8L.Q...      .C'
Checksum: 0x43

----------------

Failures:

Block 0, Base EDID:
  Basic Display Parameters & Features: sRGB is signaled, but the chromaticities do not match.
  Display Product Serial Number: ...
Block 1, Base EDID:
  Unknown Extension Block.
EDID:
  Base EDID: EDID specified 0 extension block(s), but found 1 extension block(s).

EDID conformity: FAIL
