edid-decode (hex):

00 ff ff ff ff ff ff 00 09 e5 26 07 00 00 00 00
01 1b 01 04 a5 22 13 78 02 6c 5f a6 57 53 9f 26
10 4d 54 00 00 00 01 01 01 01 01 01 01 01 01 01
01 01 01 01 01 01 2c 88 80 c8 70 38 3e 40 6c 30
aa 00 58 c1 10 00 00 1a 2c 88 80 c8 70 38 7d 46
6c 30 aa 00 58 c1 10 00 00 1a 00 00 00 fe 00 42
4f 45 20 48 46 0a 20 20 20 20 20 20 00 00 00 fe
00 4e 56 31 35 36 46 48 4d 2d 4e 34 42 0a 00 da

----------------

Block 0, Base EDID:
  EDID Structure Version & Revision: 1.4
  Vendor & Product Identification:
    Manufacturer: BOE
    Model: 1830
    Made in: week 1 of 2017
  Basic Display Parameters & Features:
    Digital display
    Bits per primary color channel: 8
    DisplayPort interface
    Maximum image size: 34 cm x 19 cm
    Gamma: 2.20
    Supported color formats: RGB 4:4:4
    First detailed timing includes the native pixel format and preferred refresh rate
  Color Characteristics:
    Red  : 0.6494, 0.3417
    Green: 0.3271, 0.6210
    Blue : 0.1494, 0.0634
    White: 0.3037, 0.3310
  Established Timings I & II: none
  Standard Timings: none
  Detailed Timing Descriptors:
    DTD 1:  1920x1080  143.987708 Hz  16:9    164.434 kHz    348.600000 MHz (344 mm x 193 mm)
                 Hfront  108 Hsync  48 Hback   44 Hpol P
                 Vfront   10 Vsync  10 Vback   42 Vpol N
    DTD 2:  1920x1080   59.990501 Hz  16:9    164.434 kHz    348.600000 MHz (344 mm x 193 mm)
                 Hfront  108 Hsync  48 Hback   44 Hpol P
                 Vfront   10 Vsync  10 Vback 1641 Vpol N
    Alphanumeric Data String: 'BOE HF'
    Alphanumeric Data String: 'NV156FHM-N4B'
Checksum: 0xda

----------------

Failures:

Block 0, Base EDID:
  Missing Display Product Name.

EDID conformity: FAIL
