edid-decode (hex):

00 ff ff ff ff ff ff 00 0e 11 97 13 37 37 31 42
03 0c 01 03 08 1c 15 7e ea fb 89 a1 55 4b 97 24
11 48 4c ff f8 00 31 59 45 59 01 01 01 01 01 01
01 01 01 01 01 01 f9 15 20 f8 30 58 1f 20 20 40
13 00 0e c8 10 00 00 18 00 00 00 fd 00 32 78 1e
36 07 00 0a 20 20 20 20 20 20 00 00 00 ff 00 32
30 33 42 4a 34 36 54 42 31 37 37 0a 00 00 00 fc
00 43 4f 4d 50 41 51 20 56 35 32 30 62 0a 00 2f

----------------

Block 0, Base EDID:
  EDID Structure Version & Revision: 1.3
  Vendor & Product Identification:
    Manufacturer: CPQ
    Model: 5015
    Serial Number: ...
    Made in: week 3 of 2002
  Basic Display Parameters & Features:
    Analog display
    Signal Level Standard: 0.700 : 0.300 : 1.000 V p-p
    Blank level equals black level
    Sync: Separate
    Maximum image size: 28 cm x 21 cm
    Gamma: 2.26
    DPMS levels: Standby Suspend Off
    RGB color display
    First detailed timing is the preferred timing
  Color Characteristics:
    Red  : 0.6318, 0.3349
    Green: 0.2949, 0.5927
    Blue : 0.1425, 0.0664
    White: 0.2832, 0.2978
  Established Timings I & II:
    IBM     :   720x400    70.081663 Hz   9:5     31.467 kHz     28.320000 MHz
    IBM     :   720x400    87.849542 Hz   9:5     39.444 kHz     35.500000 MHz
    DMT 0x04:   640x480    59.940476 Hz   4:3     31.469 kHz     25.175000 MHz
    Apple   :   640x480    66.666667 Hz   4:3     35.000 kHz     30.240000 MHz
    DMT 0x05:   640x480    72.808802 Hz   4:3     37.861 kHz     31.500000 MHz
    DMT 0x06:   640x480    75.000000 Hz   4:3     37.500 kHz     31.500000 MHz
    DMT 0x08:   800x600    56.250000 Hz   4:3     35.156 kHz     36.000000 MHz
    DMT 0x09:   800x600    60.316541 Hz   4:3     37.879 kHz     40.000000 MHz
    DMT 0x0a:   800x600    72.187572 Hz   4:3     48.077 kHz     50.000000 MHz
    DMT 0x0b:   800x600    75.000000 Hz   4:3     46.875 kHz     49.500000 MHz
    Apple   :   832x624    74.551266 Hz   4:3     49.726 kHz     57.284000 MHz
    DMT 0x0f:  1024x768i   86.957532 Hz   4:3     35.522 kHz     44.900000 MHz
    DMT 0x10:  1024x768    60.003840 Hz   4:3     48.363 kHz     65.000000 MHz
  Standard Timings:
    DMT 0x07:   640x480    85.008312 Hz   4:3     43.269 kHz     36.000000 MHz
    DMT 0x0c:   800x600    85.061274 Hz   4:3     53.674 kHz     56.250000 MHz
  Detailed Timing Descriptors:
    DTD 1:   800x600    85.061274 Hz   4:3     53.674 kHz     56.250000 MHz (270 mm x 200 mm)
                 Hfront   32 Hsync  64 Hback  152 Hpol N
                 Vfront    1 Vsync   3 Vback   27 Vpol N
    Display Range Limits:
      Monitor ranges (GTF): 50-120 Hz V, 30-54 kHz H, max dotclock 70 MHz
    Display Product Serial Number: ...
    Display Product Name: 'COMPAQ V520b'
Checksum: 0x2f

----------------

Warnings:

Block 0, Base EDID:
  Detailed Timing Descriptor #1: DTD is similar but not identical to DMT 0x0c.

Failures:

Block 0, Base EDID:
  Detailed Timing Descriptor #1: Mismatch of image size 270x200 mm vs display size 280x210 mm.

EDID conformity: FAIL
