
EDID (hex):
00ffffffffffff00044f9099f2080000
0b0d01036d251e78eaec50a5584a9a26
215054bfef0081800101010101010101
010101010101302a009851002a403070
1300772d1100001e000000fd00384b18
500e000a202020202020000000fc0041
63657220414c3932320a2020000000ff
004554393039333131303038463200c0

Extracted contents:
header:          00 ff ff ff ff ff ff 00
serial number:   04 4f 90 99 f2 08 00 00 0b 0d
version:         01 03
basic params:    6d 25 1e 78 ea
chroma info:     ec 50 a5 58 4a 9a 26 21 50 54
established:     bf ef 00
standard:        81 80 01 01 01 01 01 01 01 01 01 01 01 01 01 01
descriptor 1:    30 2a 00 98 51 00 2a 40 30 70 13 00 77 2d 11 00 00 1e
descriptor 2:    00 00 00 fd 00 38 4b 18 50 0e 00 0a 20 20 20 20 20 20
descriptor 3:    00 00 00 fc 00 41 63 65 72 20 41 4c 39 32 32 0a 20 20
descriptor 4:    00 00 00 ff 00 45 54 39 30 39 33 31 31 30 30 38 46 32
extensions:      00
checksum:        c0

EDID version: 1.3
Manufacturer: ABO Model 9990 Serial Number --
Analog display, Input voltage level: 0.7/0.7 V
Sync: Separate Composite Serration 
Maximum image size: 37 cm x 30 cm
Gamma: 2.20
DPMS levels: Standby Suspend Off
RGB color display
First detailed timing is preferred timing
Display x,y Chromaticity:
  Red:   0.6474, 0.3457
  Green: 0.2919, 0.6015
  Blue:  0.1494, 0.1298
  White: 0.3125, 0.3281
Established timings supported:
  720x400@70Hz 9:5 HorFreq: 31469 Hz Clock: 28.320 MHz
  640x480@60Hz 4:3 HorFreq: 31469 Hz Clock: 25.175 MHz
  640x480@67Hz 4:3 HorFreq: 35000 Hz Clock: 30.240 MHz
  640x480@72Hz 4:3 HorFreq: 37900 Hz Clock: 31.500 MHz
  640x480@75Hz 4:3 HorFreq: 37500 Hz Clock: 31.500 MHz
  800x600@56Hz 4:3 HorFreq: 35200 Hz Clock: 36.000 MHz
  800x600@60Hz 4:3 HorFreq: 37900 Hz Clock: 40.000 MHz
  800x600@72Hz 4:3 HorFreq: 48100 Hz Clock: 50.000 MHz
  800x600@75Hz 4:3 HorFreq: 46900 Hz Clock: 49.500 MHz
  832x624@75Hz 4:3 HorFreq: 49726 Hz Clock: 57.284 MHz
  1024x768@60Hz 4:3 HorFreq: 48400 Hz Clock: 65.000 MHz
  1024x768@70Hz 4:3 HorFreq: 56500 Hz Clock: 75.000 MHz
  1024x768@75Hz 4:3 HorFreq: 60000 Hz Clock: 78.750 MHz
  1280x1024@75Hz 5:4 HorFreq: 80000 Hz Clock: 135.000 MHz
Standard timings supported:
  1280x1024@60Hz 5:4 HorFreq: 64000 Hz Clock: 108.000 MHz
Detailed mode: Clock 108.000 MHz, 375 mm x 301 mm
               1280 1328 1440 1688 hborder 0
               1024 1025 1028 1066 vborder 0
               +hsync +vsync 
               VertFreq: 60 Hz, HorFreq: 63981 Hz
Monitor ranges (GTF): 56-75Hz V, 24-80kHz H, max dotclock 140MHz
Monitor name: Acer AL922
Serial number: --
Checksum: 0xc0 (valid)
EDID block does not conform at all!
	Bad year of manufacture
