
EDID (hex):
00ffffffffffff002264ed03403b0300
0d16010380160d780afe959459539329
1b505400000001010101010101010101
0101010101012c15004c415842203523
4500df7d00000019000000fe00000000
00000000000000000000000000fc0048
534431303150465734410a2000000010
000a202020202020202020202020003d

Extracted contents:
header:          00 ff ff ff ff ff ff 00
serial number:   22 64 ed 03 40 3b 03 00 0d 16
version:         01 03
basic params:    80 16 0d 78 0a
chroma info:     fe 95 94 59 53 93 29 1b 50 54
established:     00 00 00
standard:        01 01 01 01 01 01 01 01 01 01 01 01 01 01 01 01
descriptor 1:    2c 15 00 4c 41 58 42 20 35 23 45 00 df 7d 00 00 00 19
descriptor 2:    00 00 00 fe 00 00 00 00 00 00 00 00 00 00 00 00 00 00
descriptor 3:    00 00 00 fc 00 48 53 44 31 30 31 50 46 57 34 41 0a 20
descriptor 4:    00 00 00 10 00 0a 20 20 20 20 20 20 20 20 20 20 20 20
extensions:      00
checksum:        3d

EDID version: 1.3
Manufacturer: HSD Model 3ed Serial Number --
Made in week 13 of 2012
Digital display
Maximum image size: 22 cm x 13 cm
Gamma: 2.20
RGB color display
First detailed timing is preferred timing
Display x,y Chromaticity:
  Red:   0.5810, 0.3505
  Green: 0.3271, 0.5761
  Blue:  0.1621, 0.1064
  White: 0.3134, 0.3291
Established timings supported:
Standard timings supported:
Detailed mode: Clock 54.200 MHz, 223 mm x 125 mm
               1024 1077 1112 1356 hborder 0
                600  604  609  666 vborder 0
               -hsync -vsync 
               VertFreq: 60 Hz, HorFreq: 39970 Hz
ASCII string: 
Monitor name: HSD101PFW4A
Dummy block
Checksum: 0x3d (valid)
EDID block does NOT conform to EDID 1.3!
	Missing monitor ranges
	Detailed block string not properly terminated
EDID block does not conform at all!
	Dummy block filled with garbage
