edid-decode (hex):

00 ff ff ff ff ff ff 00 22 64 ed 03 38 ef 01 00
0a 15 01 03 80 16 0d 78 0a fe 95 94 59 53 93 29
1b 50 54 00 00 00 01 01 01 01 01 01 01 01 01 01
01 01 01 01 01 01 2c 15 00 4c 41 58 42 20 35 23
45 00 df 7d 00 00 00 19 00 00 00 fe 00 00 00 00
00 00 00 00 00 00 00 00 00 00 00 00 00 fc 00 48
53 44 31 30 31 50 46 57 34 41 0a 20 00 00 00 10
00 0a 20 20 20 20 20 20 20 20 20 20 20 20 00 97

----------------

Block 0, Base EDID:
  EDID Structure Version & Revision: 1.3
  Vendor & Product Identification:
    Manufacturer: HSD
    Model: 1005
    Serial Number: ...
    Made in: week 10 of 2011
  Basic Display Parameters & Features:
    Digital display
    Maximum image size: 22 cm x 13 cm
    Gamma: 2.20
    RGB color display
    First detailed timing is the preferred timing
  Color Characteristics:
    Red  : 0.5810, 0.3505
    Green: 0.3271, 0.5761
    Blue : 0.1621, 0.1064
    White: 0.3134, 0.3291
  Established Timings I & II: none
  Standard Timings: none
  Detailed Timing Descriptors:
    DTD 1:  1024x600    60.015768 Hz 128:75    39.971 kHz     54.200000 MHz (223 mm x 125 mm)
                 Hfront   53 Hsync  35 Hback  244 Hpol N
                 Vfront    4 Vsync   5 Vback   57 Vpol N
    Alphanumeric Data String: ''
    Display Product Name: 'HSD101PFW4A'
    Dummy Descriptor:
Checksum: 0x97

----------------

Failures:

Block 0, Base EDID:
  Alphanumeric Data String: Non-printable character.
  Dummy Descriptor: Dummy block filled with garbage.
  Missing Display Range Limits Descriptor.

EDID conformity: FAIL
