edid-decode (hex):

00 ff ff ff ff ff ff 00 0d ae 75 13 00 00 00 00
01 1b 01 04 95 1d 11 78 02 28 65 97 59 54 8e 27
1e 50 54 00 00 00 01 01 01 01 01 01 01 01 01 01
01 01 01 01 01 01 b4 3b 80 4a 71 38 34 40 2e 1e
24 00 25 a5 10 00 00 1a cc 27 80 4a 71 38 34 40
2e 1e 24 00 25 a5 10 00 00 1a 00 00 00 00 00 00
00 00 00 00 00 00 00 00 00 00 00 00 00 00 00 02
00 0c 44 ff 0b 3c 6e 16 0e 1a 6e 00 00 00 00 e3

----------------

Block 0, Base EDID:
  EDID Structure Version & Revision: 1.4
  Vendor & Product Identification:
    Manufacturer: CMN
    Model: 4981
    Made in: week 1 of 2017
  Basic Display Parameters & Features:
    Digital display
    Bits per primary color channel: 6
    DisplayPort interface
    Maximum image size: 29 cm x 17 cm
    Gamma: 2.20
    Supported color formats: RGB 4:4:4
    First detailed timing includes the native pixel format and preferred refresh rate
  Color Characteristics:
    Red  : 0.5898, 0.3496
    Green: 0.3300, 0.5546
    Blue : 0.1533, 0.1191
    White: 0.3134, 0.3291
  Established Timings I & II: none
  Standard Timings: none
  Detailed Timing Descriptors:
    DTD 1:  1920x1080   60.008 Hz  16:9    67.929 kHz 152.840 MHz (293 mm x 165 mm)
                 Hfront   46 Hsync  30 Hback 254 Hpol P
                 Vfront    2 Vsync   4 Vback  46 Vpol N
    DTD 2:  1920x1080   40.000 Hz  16:9    45.280 kHz 101.880 MHz (293 mm x 165 mm)
                 Hfront   46 Hsync  30 Hback 254 Hpol P
                 Vfront    2 Vsync   4 Vback  46 Vpol N
    Empty Descriptor
    Manufacturer-Specified Display Descriptor (0x02): 00 02 00 0c 44 ff 0b 3c 6e 16 0e 1a 6e 00 00 00 '....D..<n...n...'
Checksum: 0xe3
