
EDID (hex):
00ffffffffffff0022f0303001010101
1d17010368301b782a16c5a456509f26
125054a10800d1c081c081809500a9c0
b30001010101023a801871382d40582c
4500e00e1100001e000000fd00324c18
5e11000a202020202020000000fc0048
5020323278690a2020202020000000ff
0033434d333239303856430a20200048

Extracted contents:
header:          00 ff ff ff ff ff ff 00
serial number:   22 f0 30 30 01 01 01 01 1d 17
version:         01 03
basic params:    68 30 1b 78 2a
chroma info:     16 c5 a4 56 50 9f 26 12 50 54
established:     a1 08 00
standard:        d1 c0 81 c0 81 80 95 00 a9 c0 b3 00 01 01 01 01
descriptor 1:    02 3a 80 18 71 38 2d 40 58 2c 45 00 e0 0e 11 00 00 1e
descriptor 2:    00 00 00 fd 00 32 4c 18 5e 11 00 0a 20 20 20 20 20 20
descriptor 3:    00 00 00 fc 00 48 50 20 32 32 78 69 0a 20 20 20 20 20
descriptor 4:    00 00 00 ff 00 33 43 4d 33 32 39 30 38 56 43 0a 20 20
extensions:      00
checksum:        48

EDID version: 1.3
Manufacturer: HWP Model 3030 Serial Number --
Made in week 29 of 2013
Analog display, Input voltage level: 0.7/0.7 V
Sync: Separate 
Maximum image size: 48 cm x 27 cm
Gamma: 2.20
DPMS levels: Off
RGB color display
First detailed timing is preferred timing
Display x,y Chromaticity:
  Red:   0.6406, 0.3369
  Green: 0.3134, 0.6230
  Blue:  0.1513, 0.0703
  White: 0.3134, 0.3291
Established timings supported:
  720x400@70Hz 9:5 HorFreq: 31469 Hz Clock: 28.320 MHz
  640x480@60Hz 4:3 HorFreq: 31469 Hz Clock: 25.175 MHz
  800x600@60Hz 4:3 HorFreq: 37900 Hz Clock: 40.000 MHz
  1024x768@60Hz 4:3 HorFreq: 48400 Hz Clock: 65.000 MHz
Standard timings supported:
  1920x1080@60Hz 16:9
  1280x720@60Hz 16:9
  1280x1024@60Hz 5:4 HorFreq: 64000 Hz Clock: 108.000 MHz
  1440x900@60Hz 16:10 HorFreq: 55500 Hz Clock: 88.750 MHz
  1600x900@60Hz 16:9
  1680x1050@60Hz 16:10 HorFreq: 64700 Hz Clock: 119.000 MHz
Detailed mode: Clock 148.500 MHz, 480 mm x 270 mm
               1920 2008 2052 2200 hborder 0
               1080 1084 1089 1125 vborder 0
               +hsync +vsync 
               VertFreq: 60 Hz, HorFreq: 67500 Hz
Monitor ranges (GTF): 50-76Hz V, 24-94kHz H, max dotclock 170MHz
Monitor name: HP 22xi
Serial number: --
Checksum: 0x48 (valid)
