edid-decode (hex):

00 ff ff ff ff ff ff 00 15 c3 56 25 01 01 01 01
1c 19 01 03 68 26 1f 78 ea 6f 65 a4 57 53 9f 27
0e 50 54 a5 4b 00 81 80 81 40 71 4f 01 01 01 01
01 01 01 01 01 01 30 2a 00 98 51 00 2a 40 30 70
13 00 79 2e 11 00 00 1e 00 00 00 ff 00 35 32 39
34 33 30 37 35 0a 20 20 20 20 00 00 00 fd 00 32
4b 1f 50 0e 00 0a 20 20 20 20 20 20 00 00 00 fc
00 53 31 39 33 33 0a 20 20 20 20 20 20 20 00 25

00 ff ff ff ff ff ff 00 15 c3 56 25 01 01 01 01
1c 19 01 03 68 26 1f 78 ea 6f 65 a4 57 53 9f 27
0e 50 54 a5 4b 00 81 80 81 40 71 4f 01 01 01 01
01 01 01 01 01 01 30 2a 00 98 51 00 2a 40 30 70
13 00 79 2e 11 00 00 1e 00 00 00 ff 00 35 32 39
34 33 30 37 35 0a 20 20 20 20 00 00 00 fd 00 32
4b 1f 50 0e 00 0a 20 20 20 20 20 20 00 00 00 fc
00 53 31 39 33 33 0a 20 20 20 20 20 20 20 00 25

----------------

Block 0, Base EDID:
  EDID Structure Version & Revision: 1.3
  Vendor & Product Identification:
    Manufacturer: ENC
    Model: 9558
    Serial Number: ...
    Made in: week 28 of 2015
  Basic Display Parameters & Features:
    Analog display
    Signal Level Standard: 0.700 : 0.000 : 0.700 V p-p
    Blank level equals black level
    Sync: Separate
    Maximum image size: 38 cm x 31 cm
    Gamma: 2.20
    DPMS levels: Standby Suspend Off
    RGB color display
    First detailed timing is the preferred timing
  Color Characteristics:
    Red  : 0.6416, 0.3417
    Green: 0.3271, 0.6240
    Blue : 0.1533, 0.0566
    White: 0.3134, 0.3291
  Established Timings I & II:
    IBM     :   720x400    70.081663 Hz   9:5     31.467 kHz     28.320000 MHz
    DMT 0x04:   640x480    59.940476 Hz   4:3     31.469 kHz     25.175000 MHz
    DMT 0x06:   640x480    75.000000 Hz   4:3     37.500 kHz     31.500000 MHz
    DMT 0x09:   800x600    60.316541 Hz   4:3     37.879 kHz     40.000000 MHz
    DMT 0x0b:   800x600    75.000000 Hz   4:3     46.875 kHz     49.500000 MHz
    DMT 0x10:  1024x768    60.003840 Hz   4:3     48.363 kHz     65.000000 MHz
    DMT 0x12:  1024x768    75.028582 Hz   4:3     60.023 kHz     78.750000 MHz
    DMT 0x24:  1280x1024   75.024675 Hz   5:4     79.976 kHz    135.000000 MHz
  Standard Timings:
    DMT 0x23:  1280x1024   60.019740 Hz   5:4     63.981 kHz    108.000000 MHz
    DMT 0x20:  1280x960    60.000000 Hz   4:3     60.000 kHz    108.000000 MHz
    DMT 0x15:  1152x864    75.000000 Hz   4:3     67.500 kHz    108.000000 MHz
  Detailed Timing Descriptors:
    DTD 1:  1280x1024   60.019740 Hz   5:4     63.981 kHz    108.000000 MHz (377 mm x 302 mm)
                 Hfront   48 Hsync 112 Hback  248 Hpol P
                 Vfront    1 Vsync   3 Vback   38 Vpol P
    Display Product Serial Number: ...
    Display Range Limits:
      Monitor ranges (GTF): 50-75 Hz V, 31-80 kHz H, max dotclock 140 MHz
    Display Product Name: 'S1933'
Checksum: 0x25

----------------

Block 1, Unknown EDID Extension Block 0x00:
  00 ff ff ff ff ff ff 00 15 c3 56 25 01 01 01 01 '..........V%....'
  1c 19 01 03 68 26 1f 78 ea 6f 65 a4 57 53 9f 27 '....h&.x.oe.WS.''
  0e 50 54 a5 4b 00 81 80 81 40 71 4f 01 01 01 01 '.PT.K....@qO....'
  01 01 01 01 01 01 30 2a 00 98 51 00 2a 40 30 70 '......0*..Q.*@0p'
  13 00 79 2e 11 00 00 1e 00 00 00 ff 00 35 32 39 '..y..........529'
  34 33 30 37 35 0a 20 20 20 20 00 00 00 fd 00 32 '43075.    .....2'
  4b 1f 50 0e 00 0a 20 20 20 20 20 20 00 00 00 fc 'K.P...      ....'
  00 53 31 39 33 33 0a 20 20 20 20 20 20 20 00 25 '.S1933.       .%'
Checksum: 0x25

----------------

Failures:

Block 1, Base EDID:
  Unknown Extension Block.
EDID:
  Base EDID: EDID specified 0 extension block(s), but found 1 extension block(s).

EDID conformity: FAIL
