edid-decode (hex):

00 ff ff ff ff ff ff 00 4c 83 4d 86 00 00 00 00
00 19 01 04 a5 1d 10 78 0a 28 65 97 59 54 8e 27
1e 50 54 00 00 00 01 01 01 01 01 01 01 01 01 01
01 01 01 01 01 01 d2 37 80 a2 70 38 40 40 30 20
25 00 25 a5 10 00 00 1a a6 2c 80 a2 70 38 40 40
30 20 25 00 25 a5 10 00 00 1a 00 00 00 fe 00 50
56 46 46 35 80 31 33 33 48 4c 0a 20 00 00 00 00
00 01 41 21 96 00 00 00 00 0a 01 0a 20 20 00 d1

----------------

Block 0, Base EDID:
  EDID Structure Version & Revision: 1.4
  Vendor & Product Identification:
    Manufacturer: SDC
    Model: 34381
    Made in: 2015
  Basic Display Parameters & Features:
    Digital display
    Bits per primary color channel: 8
    DisplayPort interface
    Maximum image size: 29 cm x 16 cm
    Gamma: 2.20
    Supported color formats: RGB 4:4:4, YCrCb 4:4:4
    First detailed timing includes the native pixel format and preferred refresh rate
  Color Characteristics:
    Red  : 0.5898, 0.3496
    Green: 0.3300, 0.5546
    Blue : 0.1533, 0.1191
    White: 0.3134, 0.3291
  Established Timings I & II: none
  Standard Timings: none
  Detailed Timing Descriptors:
    DTD 1:  1920x1080   59.996 Hz  16:9    68.636 kHz 142.900 MHz (293 mm x 165 mm)
                 Hfront   48 Hsync  32 Hback  82 Hpol P
                 Vfront    2 Vsync   5 Vback  57 Vpol N
    DTD 2:  1920x1080   47.989 Hz  16:9    54.899 kHz 114.300 MHz (293 mm x 165 mm)
                 Hfront   48 Hsync  32 Hback  82 Hpol P
                 Vfront    2 Vsync   5 Vback  57 Vpol N
    Alphanumeric Data String: 'PVFF5'
    Manufacturer-Specified Display Descriptor (0x00): 00 00 00 01 41 21 96 00 00 00 00 0a 01 0a 20 20 '....A!........  '
Checksum: 0xd1

----------------

Failures:

Block 0, Base EDID:
  Alphanumeric Data String: Non-printable character.
  Missing Display Product Name.

EDID conformity: FAIL
