
EDID (hex):
00ffffffffffff001e6d3a4e156d0100
0b1001038e291f78ea60e5a3574b9c25
115054a56a808180714f615945593140
a94001010101c83240a060b023403020
340098321100001e000000fd0038551c
5311000a202020202020000000fc004c
32303030430a202020202020000000fc
000a20202020202020202020202000d8

Extracted contents:
header:          00 ff ff ff ff ff ff 00
serial number:   1e 6d 3a 4e 15 6d 01 00 0b 10
version:         01 03
basic params:    8e 29 1f 78 ea
chroma info:     60 e5 a3 57 4b 9c 25 11 50 54
established:     a5 6a 80
standard:        81 80 71 4f 61 59 45 59 31 40 a9 40 01 01 01 01
descriptor 1:    c8 32 40 a0 60 b0 23 40 30 20 34 00 98 32 11 00 00 1e
descriptor 2:    00 00 00 fd 00 38 55 1c 53 11 00 0a 20 20 20 20 20 20
descriptor 3:    00 00 00 fc 00 4c 32 30 30 30 43 0a 20 20 20 20 20 20
descriptor 4:    00 00 00 fc 00 0a 20 20 20 20 20 20 20 20 20 20 20 20
extensions:      00
checksum:        d8

EDID version: 1.3
Manufacturer: GSM Model 4e3a Serial Number --
Made in week 11 of 2006
Digital display
Maximum image size: 41 cm x 31 cm
Gamma: 2.20
DPMS levels: Standby Suspend Off
RGB color display
First detailed timing is preferred timing
Display x,y Chromaticity:
  Red:   0.6376, 0.3417
  Green: 0.2929, 0.6093
  Blue:  0.1474, 0.0683
  White: 0.3134, 0.3291
Established timings supported:
  720x400@70Hz 9:5 HorFreq: 31469 Hz Clock: 28.320 MHz
  640x480@60Hz 4:3 HorFreq: 31469 Hz Clock: 25.175 MHz
  640x480@75Hz 4:3 HorFreq: 37500 Hz Clock: 31.500 MHz
  800x600@60Hz 4:3 HorFreq: 37900 Hz Clock: 40.000 MHz
  800x600@75Hz 4:3 HorFreq: 46900 Hz Clock: 49.500 MHz
  832x624@75Hz 4:3 HorFreq: 49726 Hz Clock: 57.284 MHz
  1024x768@60Hz 4:3 HorFreq: 48400 Hz Clock: 65.000 MHz
  1024x768@75Hz 4:3 HorFreq: 60000 Hz Clock: 78.750 MHz
  1152x870@75Hz 192:145 HorFreq: 67500 Hz Clock: 108.000 MHz
Standard timings supported:
  1280x1024@60Hz 5:4 HorFreq: 64000 Hz Clock: 108.000 MHz
  1152x864@75Hz 4:3 HorFreq: 67500 Hz Clock: 108.000 MHz
  1024x768@85Hz 4:3 HorFreq: 68700 Hz Clock: 94.500 MHz
  800x600@85Hz 4:3 HorFreq: 53700 Hz Clock: 56.250 MHz
  640x480@60Hz 4:3 HorFreq: 31469 Hz Clock: 25.175 MHz
  1600x1200@60Hz 4:3 HorFreq: 75000 Hz Clock: 162.000 MHz
Detailed mode: Clock 130.000 MHz, 408 mm x 306 mm
               1600 1648 1680 1760 hborder 0
               1200 1203 1207 1235 vborder 0
               +hsync +vsync 
               VertFreq: 59 Hz, HorFreq: 73863 Hz
Monitor ranges (GTF): 56-85Hz V, 28-83kHz H, max dotclock 170MHz
Monitor name: L2000C
Checksum: 0xd8 (valid)
EDID block does NOT conform to EDID 1.3!
	Digital display field contains garbage: e
