edid-decode (hex):

00 ff ff ff ff ff ff 00 0f 33 00 61 55 00 00 00
27 21 01 03 80 23 14 78 2a 8c 75 a9 54 45 98 22
1e 50 54 21 08 00 71 40 81 c0 81 80 a9 c0 a9 40
b3 00 d1 c0 d1 00 dd 68 00 a0 a0 40 2d 60 30 20
35 00 62 c7 10 00 00 1a c8 ae 00 a0 a0 40 2d 60
30 20 35 00 62 c7 10 00 00 1a 00 00 00 fd 00 30
82 30 b4 3e 00 0a 20 20 20 20 20 20 00 00 00 fc
00 42 69 6d 61 77 65 6e 2d 31 36 0a 20 20 01 69

02 03 37 f3 43 10 1f 04 23 09 07 07 83 01 00 00
67 03 0c 00 10 00 38 82 67 d8 5d c4 01 82 80 01
68 1a 00 00 01 09 30 82 e6 e3 05 c0 00 e2 00 d5
e6 06 05 01 59 59 49 70 c2 00 a0 a0 a0 55 50 30
20 35 00 62 c7 10 00 00 1e 36 e3 00 a0 a0 40 2d
60 30 20 35 00 62 c7 10 00 00 1a bc d1 00 a0 a0
40 2d 60 30 20 35 00 62 c7 10 00 00 1e 6a 5e 00
a0 a0 a0 29 50 30 20 35 00 68 be 10 00 00 1e 88

00 ff ff ff ff ff ff 00 0f 33 00 61 55 00 00 00
27 21 01 03 80 23 14 78 2a 8c 75 a9 54 45 98 22
1e 50 54 21 08 00 71 40 81 c0 81 80 a9 c0 a9 40
b3 00 d1 c0 d1 00 dd 68 00 a0 a0 40 2d 60 30 20
35 00 62 c7 10 00 00 1a c8 ae 00 a0 a0 40 2d 60
30 20 35 00 62 c7 10 00 00 1a 00 00 00 fd 00 30
82 30 b4 3e 00 0a 20 20 20 20 20 20 00 00 00 fc
00 42 69 6d 61 77 65 6e 2d 31 36 0a 20 20 01 69

02 03 37 f3 43 10 1f 04 23 09 07 07 83 01 00 00
67 03 0c 00 10 00 38 82 67 d8 5d c4 01 82 80 01
68 1a 00 00 01 09 30 82 e6 e3 05 c0 00 e2 00 d5
e6 06 05 01 59 59 49 70 c2 00 a0 a0 a0 55 50 30
20 35 00 62 c7 10 00 00 1e 36 e3 00 a0 a0 40 2d
60 30 20 35 00 62 c7 10 00 00 1a bc d1 00 a0 a0
40 2d 60 30 20 35 00 62 c7 10 00 00 1e 6a 5e 00
a0 a0 a0 29 50 30 20 35 00 68 be 10 00 00 1e 88

----------------

Block 0, Base EDID:
  EDID Structure Version & Revision: 1.3
  Vendor & Product Identification:
    Manufacturer: CYS
    Model: 24832
    Serial Number: ...
    Made in: week 39 of 2023
  Basic Display Parameters & Features:
    Digital display
    Maximum image size: 35 cm x 20 cm
    Gamma: 2.20
    DPMS levels: Off
    RGB color display
    First detailed timing is the preferred timing
  Color Characteristics:
    Red  : 0.6621, 0.3281
    Green: 0.2724, 0.5937
    Blue : 0.1337, 0.1201
    White: 0.3134, 0.3291
  Established Timings I & II:
    DMT 0x04:   640x480    59.940476 Hz   4:3     31.469 kHz     25.175000 MHz
    DMT 0x09:   800x600    60.316541 Hz   4:3     37.879 kHz     40.000000 MHz
    DMT 0x10:  1024x768    60.003840 Hz   4:3     48.363 kHz     65.000000 MHz
  Standard Timings:
    GTF     :  1152x864    60.000000 Hz   4:3     53.700 kHz     81.624000 MHz
    DMT 0x55:  1280x720    60.000000 Hz  16:9     45.000 kHz     74.250000 MHz
    DMT 0x23:  1280x1024   60.019740 Hz   5:4     63.981 kHz    108.000000 MHz
    DMT 0x53:  1600x900    60.000000 Hz  16:9     60.000 kHz    108.000000 MHz (RB)
    DMT 0x33:  1600x1200   60.000000 Hz   4:3     75.000 kHz    162.000000 MHz
    DMT 0x3a:  1680x1050   59.954250 Hz  16:10    65.290 kHz    146.250000 MHz
    DMT 0x52:  1920x1080   60.000000 Hz  16:9     67.500 kHz    148.500000 MHz
    DMT 0x45:  1920x1200   59.884600 Hz  16:10    74.556 kHz    193.250000 MHz
  Detailed Timing Descriptors:
    DTD  1:  2560x1600   59.996871 Hz  16:10    98.695 kHz    268.450000 MHz (354 mm x 199 mm)
                  Hfront   48 Hsync  32 Hback   80 Hpol P
                  Vfront    3 Vsync   5 Vback   37 Vpol N
    DTD  2:  2560x1600  100.000000 Hz  16:10   164.500 kHz    447.440000 MHz (354 mm x 199 mm)
                  Hfront   48 Hsync  32 Hback   80 Hpol P
                  Vfront    3 Vsync   5 Vback   37 Vpol N
    Display Range Limits:
      Monitor ranges (GTF): 48-130 Hz V, 48-180 kHz H, max dotclock 620 MHz
    Display Product Name: 'Bimawen-16'
  Extension blocks: 1
Checksum: 0x69

----------------

Block 1, CTA-861 Extension Block:
  Revision: 3
  Underscans IT Video Formats by default
  Basic audio support
  Supports YCbCr 4:4:4
  Supports YCbCr 4:2:2
  Native detailed modes: 3
  Video Data Block:
    VIC  16:  1920x1080   60.000000 Hz  16:9     67.500 kHz    148.500000 MHz
    VIC  31:  1920x1080   50.000000 Hz  16:9     56.250 kHz    148.500000 MHz
    VIC   4:  1280x720    60.000000 Hz  16:9     45.000 kHz     74.250000 MHz
  Audio Data Block:
    Linear PCM:
      Max channels: 2
      Supported sample rates (kHz): 48 44.1 32
      Supported sample sizes (bits): 24 20 16
  Speaker Allocation Data Block:
    FL/FR - Front Left/Right
  Vendor-Specific Data Block (HDMI), OUI 00-0C-03:
    Source physical address: 1.0.0.0
    DC_36bit
    DC_30bit
    DC_Y444
    Maximum TMDS clock: 650 MHz
  Vendor-Specific Data Block (HDMI Forum), OUI C4-5D-D8:
    Version: 1
    Maximum TMDS Character Rate: 650 MHz
    SCDC Present
    Supports 10-bits/component Deep Color 4:2:0 Pixel Encoding
  Vendor-Specific Data Block (AMD), OUI 00-00-1A:
    Version: 1.9
    Minimum Refresh Rate: 48 Hz
    Maximum Refresh Rate: 130 Hz
    Flags 1.x: 0xe6 (MCCS)
  Colorimetry Data Block:
    BT2020YCC
    BT2020RGB
  Video Capability Data Block:
    YCbCr quantization: Selectable (via AVI YQ)
    RGB quantization: Selectable (via AVI Q)
    PT scan behavior: Always Overscanned
    IT scan behavior: Always Overscanned
    CE scan behavior: Always Overscanned
  HDR Static Metadata Data Block:
    Electro optical transfer functions:
      Traditional gamma - SDR luminance range
      SMPTE ST2084
    Supported static metadata descriptors:
      Static metadata type 1
    Desired content max luminance: 89 (343.724 cd/m^2)
    Desired content max frame-average luminance: 89 (343.724 cd/m^2)
    Desired content min luminance: 73 (0.282 cd/m^2)
  Detailed Timing Descriptors:
    DTD  3:  2560x1440  120.000000 Hz  16:9    183.000 kHz    497.760000 MHz (354 mm x 199 mm)
                  Hfront   48 Hsync  32 Hback   80 Hpol P
                  Vfront    3 Vsync   5 Vback   77 Vpol P
    DTD  4:  2560x1600  129.997318 Hz  16:10   213.846 kHz    581.660000 MHz (354 mm x 199 mm)
                  Hfront   48 Hsync  32 Hback   80 Hpol P
                  Vfront    3 Vsync   5 Vback   37 Vpol N
    DTD  5:  2560x1600  119.998212 Hz  16:10   197.397 kHz    536.920000 MHz (354 mm x 199 mm)
                  Hfront   48 Hsync  32 Hback   80 Hpol P
                  Vfront    3 Vsync   5 Vback   37 Vpol P
    DTD  6:  2560x1440   60.000199 Hz  16:9     88.860 kHz    241.700000 MHz (360 mm x 190 mm)
                  Hfront   48 Hsync  32 Hback   80 Hpol P
                  Vfront    3 Vsync   5 Vback   33 Vpol P
Checksum: 0x88

----------------

Block 2, Unknown EDID Extension Block 0x00:
  00 ff ff ff ff ff ff 00 0f 33 00 61 55 00 00 00 '.........3.aU...'
  27 21 01 03 80 23 14 78 2a 8c 75 a9 54 45 98 22 ''!...#.x*.u.TE."'
  1e 50 54 21 08 00 71 40 81 c0 81 80 a9 c0 a9 40 '.PT!..q@.......@'
  b3 00 d1 c0 d1 00 dd 68 00 a0 a0 40 2d 60 30 20 '.......h...@-`0 '
  35 00 62 c7 10 00 00 1a c8 ae 00 a0 a0 40 2d 60 '5.b..........@-`'
  30 20 35 00 62 c7 10 00 00 1a 00 00 00 fd 00 30 '0 5.b..........0'
  82 30 b4 3e 00 0a 20 20 20 20 20 20 00 00 00 fc '.0.>..      ....'
  00 42 69 6d 61 77 65 6e 2d 31 36 0a 20 20 01 69 '.Bimawen-16.  .i'
Checksum: 0x69

----------------

Block 3, CTA-861 Extension Block:
  Revision: 3
  Underscans IT Video Formats by default
  Basic audio support
  Supports YCbCr 4:4:4
  Supports YCbCr 4:2:2
  Native detailed modes: 3
  Video Data Block:
    VIC  16:  1920x1080   60.000000 Hz  16:9     67.500 kHz    148.500000 MHz
    VIC  31:  1920x1080   50.000000 Hz  16:9     56.250 kHz    148.500000 MHz
    VIC   4:  1280x720    60.000000 Hz  16:9     45.000 kHz     74.250000 MHz
  Audio Data Block:
    Linear PCM:
      Max channels: 2
      Supported sample rates (kHz): 48 44.1 32
      Supported sample sizes (bits): 24 20 16
  Speaker Allocation Data Block:
    FL/FR - Front Left/Right
  Vendor-Specific Data Block (HDMI), OUI 00-0C-03:
    Source physical address: 1.0.0.0
    DC_36bit
    DC_30bit
    DC_Y444
    Maximum TMDS clock: 650 MHz
  Vendor-Specific Data Block (HDMI Forum), OUI C4-5D-D8:
    Version: 1
    Maximum TMDS Character Rate: 650 MHz
    SCDC Present
    Supports 10-bits/component Deep Color 4:2:0 Pixel Encoding
  Vendor-Specific Data Block (AMD), OUI 00-00-1A:
    Version: 1.9
    Minimum Refresh Rate: 48 Hz
    Maximum Refresh Rate: 130 Hz
    Flags 1.x: 0xe6 (MCCS)
  Colorimetry Data Block:
    BT2020YCC
    BT2020RGB
  Video Capability Data Block:
    YCbCr quantization: Selectable (via AVI YQ)
    RGB quantization: Selectable (via AVI Q)
    PT scan behavior: Always Overscanned
    IT scan behavior: Always Overscanned
    CE scan behavior: Always Overscanned
  HDR Static Metadata Data Block:
    Electro optical transfer functions:
      Traditional gamma - SDR luminance range
      SMPTE ST2084
    Supported static metadata descriptors:
      Static metadata type 1
    Desired content max luminance: 89 (343.724 cd/m^2)
    Desired content max frame-average luminance: 89 (343.724 cd/m^2)
    Desired content min luminance: 73 (0.282 cd/m^2)
  Detailed Timing Descriptors:
    DTD  7:  2560x1440  120.000000 Hz  16:9    183.000 kHz    497.760000 MHz (354 mm x 199 mm)
                  Hfront   48 Hsync  32 Hback   80 Hpol P
                  Vfront    3 Vsync   5 Vback   77 Vpol P
    DTD  8:  2560x1600  129.997318 Hz  16:10   213.846 kHz    581.660000 MHz (354 mm x 199 mm)
                  Hfront   48 Hsync  32 Hback   80 Hpol P
                  Vfront    3 Vsync   5 Vback   37 Vpol N
    DTD  9:  2560x1600  119.998212 Hz  16:10   197.397 kHz    536.920000 MHz (354 mm x 199 mm)
                  Hfront   48 Hsync  32 Hback   80 Hpol P
                  Vfront    3 Vsync   5 Vback   37 Vpol P
    DTD 10:  2560x1440   60.000199 Hz  16:9     88.860 kHz    241.700000 MHz (360 mm x 190 mm)
                  Hfront   48 Hsync  32 Hback   80 Hpol P
                  Vfront    3 Vsync   5 Vback   33 Vpol P
Checksum: 0x88

----------------

Warnings:

Block 1, CTA-861 Extension Block:
  Colorimetry Data Block: Set the sRGB colorimetry bit to avoid interop issues.
  Video Capability Data Block: IT scan behavior is expected to support underscanned.
  Video Capability Data Block: S_PT is equal to S_IT and S_CE, so should be set to 0 instead.
Block 3, CTA-861 Extension Block:
  Colorimetry Data Block: Set the sRGB colorimetry bit to avoid interop issues.
  Video Capability Data Block: IT scan behavior is expected to support underscanned.
  Video Capability Data Block: S_PT is equal to S_IT and S_CE, so should be set to 0 instead.

Failures:

Block 1, CTA-861 Extension Block:
  Vendor-Specific Data Block (HDMI), OUI 00-0C-03: HDMI VSDB Max TMDS rate is > 340.
  Vendor-Specific Data Block (HDMI Forum), OUI C4-5D-D8: Max TMDS rate is > 0 and <= 340 or > 600.
  Video Capability Data Block: IT video formats are always overscanned, but bit 7 of Byte 3 of the CTA-861 Extension header is set to underscanned.
  Detailed Timing Descriptor #6: Mismatch of image size 360x190 mm vs display size 350x200 mm.
Block 2, Base EDID:
  Unknown Extension Block.
Block 3, CTA-861 Extension Block:
  Video Data Block: Duplicate VIC 16.
  Video Data Block: Duplicate VIC 31.
  Video Data Block: Duplicate VIC 4.
  Speaker Allocation Data Block: Only one instance of this Data Block is allowed.
  Vendor-Specific Data Block (HDMI), OUI 00-0C-03: HDMI VSDB Max TMDS rate is > 340.
  Vendor-Specific Data Block (HDMI Forum), OUI C4-5D-D8: Duplicate HDMI Forum VSDB/SCDB.
  Vendor-Specific Data Block (HDMI Forum), OUI C4-5D-D8: Max TMDS rate is > 0 and <= 340 or > 600.
  Colorimetry Data Block: Only one instance of this Data Block is allowed.
  Video Capability Data Block: Only one instance of this Data Block is allowed.
  Video Capability Data Block: IT video formats are always overscanned, but bit 7 of Byte 3 of the CTA-861 Extension header is set to underscanned.
  HDR Static Metadata Data Block: Only one instance of this Data Block is allowed.
  Detailed Timing Descriptor #10: Mismatch of image size 360x190 mm vs display size 350x200 mm.
EDID:
  Base EDID: Some timings are out of range of the Monitor Ranges:
    Horizontal Freq: 31.468 - 213.845 kHz (Monitor: 48.000 - 180.000 kHz)
  Base EDID: The DTD max image size is 360x199mm, which is larger than the display size 350.0x200.0mm.
  Base EDID: EDID specified 1 extension block(s), but found 3 extension block(s).
  Base EDID: EDID 1.3 requires a Block Map Extension in Block 1 if there are more than 2 blocks in the EDID.
  CTA-861: Native progressive timings are a mix of several resolutions.

EDID conformity: FAIL
