
EDID (hex):
00ffffffffffff0026cd38563a090000
211e0104a5301b783af000a65552a027
115054a56b80710081408180a940b300
9500d1c00101023a801871382d40582c
4500dd0c1100001e000000ff00313137
38343033333632333632000000fd0037
4c1e5312000a202020202020000000fc
00504c5832323833480a202020200155
02031cf1830100004f90020304050607
011112131415161f23090707023a8018
71382d40582c4500dd0c1100001f011d
8018711c1620582c2500dd0c1100009f
011d007251d01e206e285500dd0c1100
001e2a4480a07038274030203500dd0c
1100001a000000000000000000000000
000000000000000000000000000000f2

edid-decode (hex):

00 ff ff ff ff ff ff 00 26 cd 38 56 3a 09 00 00
21 1e 01 04 a5 30 1b 78 3a f0 00 a6 55 52 a0 27
11 50 54 a5 6b 80 71 00 81 40 81 80 a9 40 b3 00
95 00 d1 c0 01 01 02 3a 80 18 71 38 2d 40 58 2c
45 00 dd 0c 11 00 00 1e 00 00 00 ff 00 31 31 37
38 34 30 33 33 36 32 33 36 32 00 00 00 fd 00 37
4c 1e 53 12 00 0a 20 20 20 20 20 20 00 00 00 fc
00 50 4c 58 32 32 38 33 48 0a 20 20 20 20 01 55

02 03 1c f1 83 01 00 00 4f 90 02 03 04 05 06 07
01 11 12 13 14 15 16 1f 23 09 07 07 02 3a 80 18
71 38 2d 40 58 2c 45 00 dd 0c 11 00 00 1f 01 1d
80 18 71 1c 16 20 58 2c 25 00 dd 0c 11 00 00 9f
01 1d 00 72 51 d0 1e 20 6e 28 55 00 dd 0c 11 00
00 1e 2a 44 80 a0 70 38 27 40 30 20 35 00 dd 0c
11 00 00 1a 00 00 00 00 00 00 00 00 00 00 00 00
00 00 00 00 00 00 00 00 00 00 00 00 00 00 00 f2

----------------

Block 0, Base EDID:
  EDID Structure Version & Revision: 1.4
  Vendor & Product Identification:
    Manufacturer: IVM
    Model: 22072
    Serial Number: 2362
    Made in: week 33 of 2020
  Basic Display Parameters & Features:
    Digital display
    Bits per primary color channel: 8
    DisplayPort interface
    Maximum image size: 48 cm x 27 cm
    Gamma: 2.20
    DPMS levels: Off
    Supported color formats: RGB 4:4:4, YCrCb 4:4:4, YCrCb 4:2:2
    First detailed timing includes the native pixel format and preferred refresh rate
  Color Characteristics:
    Red  : 0.6513, 0.3349
    Green: 0.3203, 0.6250
    Blue : 0.1523, 0.0664
    White: 0.3125, 0.3281
  Established Timings I & II:
    IBM     :   720x400    70.081663 Hz   9:5     31.467 kHz     28.320000 MHz
    DMT 0x04:   640x480    59.940476 Hz   4:3     31.469 kHz     25.175000 MHz
    DMT 0x06:   640x480    75.000000 Hz   4:3     37.500 kHz     31.500000 MHz
    DMT 0x09:   800x600    60.316541 Hz   4:3     37.879 kHz     40.000000 MHz
    DMT 0x0b:   800x600    75.000000 Hz   4:3     46.875 kHz     49.500000 MHz
    Apple   :   832x624    74.551266 Hz   4:3     49.726 kHz     57.284000 MHz
    DMT 0x10:  1024x768    60.003840 Hz   4:3     48.363 kHz     65.000000 MHz
    DMT 0x12:  1024x768    75.028582 Hz   4:3     60.023 kHz     78.750000 MHz
    DMT 0x24:  1280x1024   75.024675 Hz   5:4     79.976 kHz    135.000000 MHz
    Apple   :  1152x870    75.061550 Hz 192:145   68.681 kHz    100.000000 MHz
  Standard Timings:
    GTF     :  1152x720    59.999964 Hz  16:10    44.760 kHz     67.319000 MHz
    DMT 0x20:  1280x960    60.000000 Hz   4:3     60.000 kHz    108.000000 MHz
    DMT 0x23:  1280x1024   60.019740 Hz   5:4     63.981 kHz    108.000000 MHz
    DMT 0x33:  1600x1200   60.000000 Hz   4:3     75.000 kHz    162.000000 MHz
    DMT 0x3a:  1680x1050   59.954250 Hz  16:10    65.290 kHz    146.250000 MHz
    DMT 0x2f:  1440x900    59.887445 Hz  16:10    55.935 kHz    106.500000 MHz
    DMT 0x52:  1920x1080   60.000000 Hz  16:9     67.500 kHz    148.500000 MHz
  Detailed Timing Descriptors:
    DTD 1:  1920x1080   60.000000 Hz  16:9     67.500 kHz    148.500000 MHz (477 mm x 268 mm)
                 Hfront   88 Hsync  44 Hback  148 Hpol P
                 Vfront    4 Vsync   5 Vback   36 Vpol P
    Display Product Serial Number: '1178403362362'
    Display Range Limits:
      Monitor ranges (GTF): 55-76 Hz V, 30-83 kHz H, max dotclock 180 MHz
    Display Product Name: 'PLX2283H'
  Extension blocks: 1
Checksum: 0x55

----------------

Block 1, CTA-861 Extension Block:
  Revision: 3
  Underscans IT Video Formats by default
  Basic audio support
  Supports YCbCr 4:4:4
  Supports YCbCr 4:2:2
  Native detailed modes: 1
  Speaker Allocation Data Block:
    FL/FR - Front Left/Right
  Video Data Block:
    VIC  16:  1920x1080   60.000000 Hz  16:9     67.500 kHz    148.500000 MHz (native)
    VIC   2:   720x480    59.940060 Hz   4:3     31.469 kHz     27.000000 MHz
    VIC   3:   720x480    59.940060 Hz  16:9     31.469 kHz     27.000000 MHz
    VIC   4:  1280x720    60.000000 Hz  16:9     45.000 kHz     74.250000 MHz
    VIC   5:  1920x1080i  60.000000 Hz  16:9     33.750 kHz     74.250000 MHz
    VIC   6:  1440x480i   59.940060 Hz   4:3     15.734 kHz     27.000000 MHz
    VIC   7:  1440x480i   59.940060 Hz  16:9     15.734 kHz     27.000000 MHz
    VIC   1:   640x480    59.940476 Hz   4:3     31.469 kHz     25.175000 MHz
    VIC  17:   720x576    50.000000 Hz   4:3     31.250 kHz     27.000000 MHz
    VIC  18:   720x576    50.000000 Hz  16:9     31.250 kHz     27.000000 MHz
    VIC  19:  1280x720    50.000000 Hz  16:9     37.500 kHz     74.250000 MHz
    VIC  20:  1920x1080i  50.000000 Hz  16:9     28.125 kHz     74.250000 MHz
    VIC  21:  1440x576i   50.000000 Hz   4:3     15.625 kHz     27.000000 MHz
    VIC  22:  1440x576i   50.000000 Hz  16:9     15.625 kHz     27.000000 MHz
    VIC  31:  1920x1080   50.000000 Hz  16:9     56.250 kHz    148.500000 MHz
  Audio Data Block:
    Linear PCM:
      Max channels: 2
      Supported sample rates (kHz): 48 44.1 32
      Supported sample sizes (bits): 24 20 16
  Detailed Timing Descriptors:
    DTD 2:  1920x1080   60.000000 Hz  16:9     67.500 kHz    148.500000 MHz (477 mm x 268 mm)
                 Hfront   88 Hsync  44 Hback  148 Hpol P
                 Vfront    4 Vsync   5 Vback   36 Vpol P
    DTD 3:  1920x1080i  60.000000 Hz  16:9     33.750 kHz     74.250000 MHz (477 mm x 268 mm)
                 Hfront   88 Hsync  44 Hback  148 Hpol P
                 Vfront    2 Vsync   5 Vback   15 Vpol P Vfront +0.5 Odd Field
                 Vfront    2 Vsync   5 Vback   15 Vpol P Vback  +0.5 Even Field
    DTD 4:  1280x720    60.000000 Hz  16:9     45.000 kHz     74.250000 MHz (477 mm x 268 mm)
                 Hfront  110 Hsync  40 Hback  220 Hpol P
                 Vfront    5 Vsync   5 Vback   20 Vpol P
    DTD 5:  1920x1080   74.972503 Hz  16:9     83.894 kHz    174.500000 MHz (477 mm x 268 mm)
                 Hfront   48 Hsync  32 Hback   80 Hpol P
                 Vfront    3 Vsync   5 Vback   31 Vpol N
Checksum: 0xf2  Unused space in Extension Block: 27 bytes
