
EDID (hex):
00ffffffffffff0004729605c16d6072
1a1b0104a53c22783b0b75a655539f28
0e5054b36c00818081c081009500b300
d1c0714f0101023a801871382d40582c
450056502100001efc7e808870381240
1820350056502100001e000000fd001e
90b4b421010a202020202020000000fc
0041636572204b4732373120410a01ad
02031ff14a010304121305141f900723
0907078301000067030c001000004286
6f80a070384040302035005650210000
1e023a801871382d40582c4500565021
00001e00000000000000000000000000
00000000000000000000000000000000
00000000000000000000000000000000
000000000000000000000000000000e0

Extracted contents:
header:          00 ff ff ff ff ff ff 00
serial number:   04 72 96 05 c1 6d 60 72 1a 1b
version:         01 04
basic params:    a5 3c 22 78 3b
chroma info:     0b 75 a6 55 53 9f 28 0e 50 54
established:     b3 6c 00
standard:        81 80 81 c0 81 00 95 00 b3 00 d1 c0 71 4f 01 01
descriptor 1:    02 3a 80 18 71 38 2d 40 58 2c 45 00 56 50 21 00 00 1e
descriptor 2:    fc 7e 80 88 70 38 12 40 18 20 35 00 56 50 21 00 00 1e
descriptor 3:    00 00 00 fd 00 1e 90 b4 b4 21 01 0a 20 20 20 20 20 20
descriptor 4:    00 00 00 fc 00 41 63 65 72 20 4b 47 32 37 31 20 41 0a
extensions:      01
checksum:        ad

EDID version: 1.4
Manufacturer: ACR Model 596 Serial Number --
Made in week 26 of 2017
Digital display
8 bits per primary color channel
DisplayPort interface
Maximum image size: 60 cm x 34 cm
Gamma: 2.20
DPMS levels: Off
Supported color formats: RGB 4:4:4, YCrCb 4:4:4, YCrCb 4:2:2
First detailed timing includes the native pixel format and preferred refresh rate
Display is continuous frequency
Display x,y Chromaticity:
  Red:   0.6484, 0.3320
  Green: 0.3261, 0.6240
  Blue:  0.1572, 0.0576
  White: 0.3134, 0.3291
Established timings supported:
  720x400@70Hz 9:5 HorFreq: 31469 Hz Clock: 28.320 MHz
  640x480@60Hz 4:3 HorFreq: 31469 Hz Clock: 25.175 MHz
  640x480@67Hz 4:3 HorFreq: 35000 Hz Clock: 30.240 MHz
  800x600@56Hz 4:3 HorFreq: 35200 Hz Clock: 36.000 MHz
  800x600@60Hz 4:3 HorFreq: 37900 Hz Clock: 40.000 MHz
  800x600@75Hz 4:3 HorFreq: 46900 Hz Clock: 49.500 MHz
  832x624@75Hz 4:3 HorFreq: 49726 Hz Clock: 57.284 MHz
  1024x768@60Hz 4:3 HorFreq: 48400 Hz Clock: 65.000 MHz
  1024x768@70Hz 4:3 HorFreq: 56500 Hz Clock: 75.000 MHz
Standard timings supported:
  1280x1024@60Hz 5:4 HorFreq: 64000 Hz Clock: 108.000 MHz
  1280x720@60Hz 16:9
  1280x800@60Hz 16:10
  1440x900@60Hz 16:10 HorFreq: 55500 Hz Clock: 88.750 MHz
  1680x1050@60Hz 16:10 HorFreq: 64700 Hz Clock: 119.000 MHz
  1920x1080@60Hz 16:9
  1152x864@75Hz 4:3 HorFreq: 67500 Hz Clock: 108.000 MHz
Detailed mode: Clock 148.500 MHz, 598 mm x 336 mm
               1920 2008 2052 2200 hborder 0
               1080 1084 1089 1125 vborder 0
               +hsync +vsync 
               VertFreq: 60 Hz, HorFreq: 67500 Hz
Detailed mode: Clock 325.080 MHz, 598 mm x 336 mm
               1920 1944 1976 2056 hborder 0
               1080 1083 1088 1098 vborder 0
               +hsync +vsync 
               VertFreq: 144 Hz, HorFreq: 158112 Hz
Monitor ranges (bare limits): 30-144Hz V, 180-180kHz H, max dotclock 330MHz
Monitor name: Acer KG271 A
Has 1 extension blocks
Checksum: 0xad (valid)

CTA extension block
Extension version: 3
27 bytes of CTA data
  Video data block
    VIC   1 640x480@60Hz 4:3  HorFreq: 31469 Hz Clock: 25.175 MHz
    VIC   3 720x480@60Hz 16:9  HorFreq: 31469 Hz Clock: 27.000 MHz
    VIC   4 1280x720@60Hz 16:9  HorFreq: 45000 Hz Clock: 74.250 MHz
    VIC  18 720x576@50Hz 16:9  HorFreq: 31250 Hz Clock: 27.000 MHz
    VIC  19 1280x720@50Hz 16:9  HorFreq: 37500 Hz Clock: 74.250 MHz
    VIC   5 1920x1080i@60Hz 16:9  HorFreq: 33750 Hz Clock: 74.250 MHz
    VIC  20 1920x1080i@50Hz 16:9  HorFreq: 28125 Hz Clock: 74.250 MHz
    VIC  31 1920x1080@50Hz 16:9  HorFreq: 56250 Hz Clock: 148.500 MHz
    VIC  16 1920x1080@60Hz 16:9 (native) HorFreq: 67500 Hz Clock: 148.500 MHz
    VIC   7 1440x480i@60Hz 16:9  HorFreq: 15734 Hz Clock: 27.000 MHz
  Audio data block
    Linear PCM, max channels 2
      Supported sample rates (kHz): 48 44.1 32
      Supported sample sizes (bits): 24 20 16
  Speaker allocation data block
    Speaker map:
      FL/FR - Front Left/Right
  Vendor-specific data block, OUI 000c03 (HDMI)
    Source physical address 1.0.0.0
    Maximum TMDS clock: 330MHz
Underscans PC formats by default
Basic audio support
Supports YCbCr 4:4:4
Supports YCbCr 4:2:2
1 native detailed modes
Detailed mode: Clock 285.500 MHz, 598 mm x 336 mm
               1920 1968 2000 2080 hborder 0
               1080 1083 1088 1144 vborder 0
               +hsync +vsync 
               VertFreq: 119 Hz, HorFreq: 137259 Hz
Detailed mode: Clock 148.500 MHz, 598 mm x 336 mm
               1920 2008 2052 2200 hborder 0
               1080 1084 1089 1125 vborder 0
               +hsync +vsync 
               VertFreq: 60 Hz, HorFreq: 67500 Hz
Checksum: 0xe0 (valid)

Warning: One or more of the timings is out of range of the Monitor Ranges:
  Vertical Freq: 50 - 144 Hz
  Horizontal Freq: 15734 - 158112 Hz
  Maximum Clock: 325.080 MHz


