
EDID (hex):
00ffffffffffff002264c76617040000
17140103802f1e782a36c1a4554c9c25
125054bfef80714f814081809500950f
90400101010121399030621a274068b0
3600da281100001c000000fd00324b1e
5511000a202020202020000000fc0048
5a323231440a202020202020000000ff
003032335453334159303130343700a3

Extracted contents:
header:          00 ff ff ff ff ff ff 00
serial number:   22 64 c7 66 17 04 00 00 17 14
version:         01 03
basic params:    80 2f 1e 78 2a
chroma info:     36 c1 a4 55 4c 9c 25 12 50 54
established:     bf ef 80
standard:        71 4f 81 40 81 80 95 00 95 0f 90 40 01 01 01 01
descriptor 1:    21 39 90 30 62 1a 27 40 68 b0 36 00 da 28 11 00 00 1c
descriptor 2:    00 00 00 fd 00 32 4b 1e 55 11 00 0a 20 20 20 20 20 20
descriptor 3:    00 00 00 fc 00 48 5a 32 32 31 44 0a 20 20 20 20 20 20
descriptor 4:    00 00 00 ff 00 30 32 33 54 53 33 41 59 30 31 30 34 37
extensions:      00
checksum:        a3

EDID version: 1.3
Manufacturer: HSD Model 66c7 Serial Number --
Made in week 23 of 2010
Digital display
Maximum image size: 47 cm x 30 cm
Gamma: 2.20
DPMS levels: Off
RGB color display
First detailed timing is preferred timing
Display x,y Chromaticity:
  Red:   0.6406, 0.3349
  Green: 0.2978, 0.6113
  Blue:  0.1474, 0.0703
  White: 0.3125, 0.3291
Established timings supported:
  720x400@70Hz 9:5 HorFreq: 31469 Hz Clock: 28.320 MHz
  640x480@60Hz 4:3 HorFreq: 31469 Hz Clock: 25.175 MHz
  640x480@67Hz 4:3 HorFreq: 35000 Hz Clock: 30.240 MHz
  640x480@72Hz 4:3 HorFreq: 37900 Hz Clock: 31.500 MHz
  640x480@75Hz 4:3 HorFreq: 37500 Hz Clock: 31.500 MHz
  800x600@56Hz 4:3 HorFreq: 35200 Hz Clock: 36.000 MHz
  800x600@60Hz 4:3 HorFreq: 37900 Hz Clock: 40.000 MHz
  800x600@72Hz 4:3 HorFreq: 48100 Hz Clock: 50.000 MHz
  800x600@75Hz 4:3 HorFreq: 46900 Hz Clock: 49.500 MHz
  832x624@75Hz 4:3 HorFreq: 49726 Hz Clock: 57.284 MHz
  1024x768@60Hz 4:3 HorFreq: 48400 Hz Clock: 65.000 MHz
  1024x768@70Hz 4:3 HorFreq: 56500 Hz Clock: 75.000 MHz
  1024x768@75Hz 4:3 HorFreq: 60000 Hz Clock: 78.750 MHz
  1280x1024@75Hz 5:4 HorFreq: 80000 Hz Clock: 135.000 MHz
  1152x870@75Hz 192:145 HorFreq: 67500 Hz Clock: 108.000 MHz
Standard timings supported:
  1152x864@75Hz 4:3 HorFreq: 67500 Hz Clock: 108.000 MHz
  1280x960@60Hz 4:3 HorFreq: 60000 Hz Clock: 108.000 MHz
  1280x1024@60Hz 5:4 HorFreq: 64000 Hz Clock: 108.000 MHz
  1440x900@60Hz 16:10 HorFreq: 55500 Hz Clock: 88.750 MHz
  1440x900@75Hz 16:10 HorFreq: 82300 Hz Clock: 156.000 MHz
  1400x1050@60Hz 4:3 HorFreq: 64700 Hz Clock: 101.000 MHz
Detailed mode: Clock 146.250 MHz, 474 mm x 296 mm
               1680 1784 1960 2240 hborder 0
               1050 1053 1059 1089 vborder 0
               -hsync +vsync 
               VertFreq: 59 Hz, HorFreq: 65290 Hz
Monitor ranges (GTF): 50-75Hz V, 30-85kHz H, max dotclock 170MHz
Monitor name: HZ221D
Serial number: --
Checksum: 0xa3 (valid)
