edid-decode (hex):

00 ff ff ff ff ff ff 00 09 e5 b1 05 00 00 00 00
01 15 01 03 80 1f 11 78 0a b0 90 97 58 54 92 26
1d 50 54 00 00 00 01 01 01 01 01 01 01 01 01 01
01 01 01 01 01 01 5e 1a 56 50 50 00 0a 30 30 20
36 00 35 ad 10 00 00 1a 5e 1a 56 50 50 00 0a 30
30 20 36 00 35 ad 10 00 00 1a 00 00 00 fe 00 42
4f 45 20 48 46 0a 20 20 20 20 20 20 00 00 00 fe
00 48 42 31 34 30 57 58 31 2d 31 30 30 0a 00 85

----------------

Block 0, Base EDID:
  EDID Structure Version & Revision: 1.3
  Vendor & Product Identification:
    Manufacturer: BOE
    Model: 1457
    Made in: week 1 of 2011
  Basic Display Parameters & Features:
    Digital display
    Maximum image size: 31 cm x 17 cm
    Gamma: 2.20
    RGB color display
    First detailed timing is preferred timing
  Color Characteristics:
    Red  : 0.5917, 0.3466
    Green: 0.3281, 0.5703
    Blue : 0.1503, 0.1142
    White: 0.3125, 0.3281
  Established Timings I & II: none
  Standard Timings: none
  Detailed Timing Descriptors:
    DTD 1:  1366x768    60.001 Hz 683:384  46.680 kHz  67.500 MHz (309 mm x 173 mm)
                 Hfront   48 Hsync  32 Hback   0 Hpol P
                 Vfront    3 Vsync   6 Vback   1 Vpol N
    DTD 2:  1366x768    60.001 Hz 683:384  46.680 kHz  67.500 MHz (309 mm x 173 mm)
                 Hfront   48 Hsync  32 Hback   0 Hpol P
                 Vfront    3 Vsync   6 Vback   1 Vpol N
    Alphanumeric Data String: 'BOE HF'
    Alphanumeric Data String: 'HB140WX1-100'
Checksum: 0x85

----------------

Failures:

Block 0, Base EDID:
  Detailed Timing Descriptor #1: 0 or negative horizontal back porch.
  Detailed Timing Descriptor #2: 0 or negative horizontal back porch.
  Missing Display Product Name.
  Missing Display Range Limits Descriptor.

EDID conformity: FAIL
