edid-decode (hex):

00 ff ff ff ff ff ff 00 22 f0 07 31 01 01 01 01
1d 1b 01 03 80 3c 22 78 2a 53 a5 a7 56 52 9c 26
11 50 54 a1 08 00 d1 c0 81 c0 81 80 95 00 a9 c0
b3 00 01 01 01 01 02 3a 80 18 71 38 2d 40 58 2c
45 00 58 54 21 00 00 1e 00 00 00 fd 00 32 4c 18
5e 11 00 0a 20 20 20 20 20 20 00 00 00 fc 00 48
50 20 45 32 37 31 69 0a 20 20 20 20 00 00 00 ff
00 33 43 4d 37 32 39 30 52 36 46 0a 20 20 00 71

00 ff ff ff ff ff ff 00 22 f0 07 31 01 01 01 01
1d 1b 01 03 80 3c 22 78 2a 53 a5 a7 56 52 9c 26
11 50 54 a1 08 00 d1 c0 81 c0 81 80 95 00 a9 c0
b3 00 01 01 01 01 02 3a 80 18 71 38 2d 40 58 2c
45 00 58 54 21 00 00 1e 00 00 00 fd 00 32 4c 18
5e 11 00 0a 20 20 20 20 20 20 00 00 00 fc 00 48
50 20 45 32 37 31 69 0a 20 20 20 20 00 00 00 ff
00 33 43 4d 37 32 39 30 52 36 46 0a 20 20 00 71

----------------

Block 0, Base EDID:
  EDID Structure Version & Revision: 1.3
  Vendor & Product Identification:
    Manufacturer: HWP
    Model: 12551
    Serial Number: ...
    Made in: week 29 of 2017
  Basic Display Parameters & Features:
    Digital display
    Maximum image size: 60 cm x 34 cm
    Gamma: 2.20
    DPMS levels: Off
    RGB color display
    First detailed timing is the preferred timing
  Color Characteristics:
    Red  : 0.6533, 0.3369
    Green: 0.3203, 0.6123
    Blue : 0.1503, 0.0683
    White: 0.3134, 0.3291
  Established Timings I & II:
    IBM     :   720x400    70.081663 Hz   9:5     31.467 kHz     28.320000 MHz
    DMT 0x04:   640x480    59.940476 Hz   4:3     31.469 kHz     25.175000 MHz
    DMT 0x09:   800x600    60.316541 Hz   4:3     37.879 kHz     40.000000 MHz
    DMT 0x10:  1024x768    60.003840 Hz   4:3     48.363 kHz     65.000000 MHz
  Standard Timings:
    DMT 0x52:  1920x1080   60.000000 Hz  16:9     67.500 kHz    148.500000 MHz
    DMT 0x55:  1280x720    60.000000 Hz  16:9     45.000 kHz     74.250000 MHz
    DMT 0x23:  1280x1024   60.019740 Hz   5:4     63.981 kHz    108.000000 MHz
    DMT 0x2f:  1440x900    59.887445 Hz  16:10    55.935 kHz    106.500000 MHz
    DMT 0x53:  1600x900    60.000000 Hz  16:9     60.000 kHz    108.000000 MHz (RB)
    DMT 0x3a:  1680x1050   59.954250 Hz  16:10    65.290 kHz    146.250000 MHz
  Detailed Timing Descriptors:
    DTD 1:  1920x1080   60.000000 Hz  16:9     67.500 kHz    148.500000 MHz (600 mm x 340 mm)
                 Hfront   88 Hsync  44 Hback  148 Hpol P
                 Vfront    4 Vsync   5 Vback   36 Vpol P
    Display Range Limits:
      Monitor ranges (GTF): 50-76 Hz V, 24-94 kHz H, max dotclock 170 MHz
    Display Product Name: 'HP E271i'
    Display Product Serial Number: ...
Checksum: 0x71

----------------

Block 1, Unknown EDID Extension Block 0x00:
  00 ff ff ff ff ff ff 00 22 f0 07 31 01 01 01 01 '........"..1....'
  1d 1b 01 03 80 3c 22 78 2a 53 a5 a7 56 52 9c 26 '.....<"x*S..VR.&'
  11 50 54 a1 08 00 d1 c0 81 c0 81 80 95 00 a9 c0 '.PT.............'
  b3 00 01 01 01 01 02 3a 80 18 71 38 2d 40 58 2c '.......:..q8-@X,'
  45 00 58 54 21 00 00 1e 00 00 00 fd 00 32 4c 18 'E.XT!........2L.'
  5e 11 00 0a 20 20 20 20 20 20 00 00 00 fc 00 48 '^...      .....H'
  50 20 45 32 37 31 69 0a 20 20 20 20 00 00 00 ff 'P E271i.    ....'
  00 33 43 4d 37 32 39 30 52 36 46 0a 20 20 00 71 '.3CM7290R6F.  .q'
Checksum: 0x71

----------------

Failures:

Block 1, Base EDID:
  Unknown Extension Block.
EDID:
  Base EDID: EDID specified 0 extension block(s), but found 1 extension block(s).

EDID conformity: FAIL
