edid-decode (hex):

00 ff ff ff ff ff ff 00 4c 2d 57 10 37 31 50 44
30 0a 01 01 68 20 18 7e e8 12 69 a5 52 49 99 24
0e 48 4c ff fe 00 31 59 45 59 61 59 81 80 01 01
01 01 01 01 01 01 f9 15 20 f8 30 58 1f 20 20 40
13 00 32 e6 10 00 00 1e ea 24 00 60 41 00 28 30
30 60 13 00 32 e6 10 00 00 1e 00 00 00 fd 00 32
a0 1e 46 0b 00 0a 20 20 20 20 20 20 00 00 00 ff
00 48 4d 43 4e 43 30 30 31 31 36 0a 20 20 00 9e

----------------

Block 0, Base EDID:
  EDID Structure Version & Revision: 1.1
  Vendor & Product Identification:
    Manufacturer: SAM
    Model: 4183
    Serial Number: ...
    Made in: week 48 of 2000
  Basic Display Parameters & Features:
    Analog display
    Input voltage level: 0.7/0.7 V
    Blank level equals black level
    Sync: Separate
    Maximum image size: 32 cm x 24 cm
    Gamma: 2.26
    DPMS levels: Standby Suspend Off
    RGB color display
  Color Characteristics:
    Red  : 0.6445, 0.3212
    Green: 0.2851, 0.5996
    Blue : 0.1416, 0.0566
    White: 0.2832, 0.2978
  Established Timings I & II:
    IBM     :   720x400    70.082 Hz   9:5    31.467 kHz  28.320 MHz
    IBM     :   720x400    87.850 Hz   9:5    39.444 kHz  35.500 MHz
    DMT 0x04:   640x480    59.940 Hz   4:3    31.469 kHz  25.175 MHz
    Apple   :   640x480    66.667 Hz   4:3    35.000 kHz  30.240 MHz
    DMT 0x05:   640x480    72.809 Hz   4:3    37.861 kHz  31.500 MHz
    DMT 0x06:   640x480    75.000 Hz   4:3    37.500 kHz  31.500 MHz
    DMT 0x08:   800x600    56.250 Hz   4:3    35.156 kHz  36.000 MHz
    DMT 0x09:   800x600    60.317 Hz   4:3    37.879 kHz  40.000 MHz
    DMT 0x0a:   800x600    72.188 Hz   4:3    48.077 kHz  50.000 MHz
    DMT 0x0b:   800x600    75.000 Hz   4:3    46.875 kHz  49.500 MHz
    Apple   :   832x624    74.551 Hz   4:3    49.726 kHz  57.284 MHz
    DMT 0x0f:  1024x768i   86.958 Hz   4:3    35.522 kHz  44.900 MHz
    DMT 0x10:  1024x768    60.004 Hz   4:3    48.363 kHz  65.000 MHz
    DMT 0x11:  1024x768    70.069 Hz   4:3    56.476 kHz  75.000 MHz
    DMT 0x12:  1024x768    75.029 Hz   4:3    60.023 kHz  78.750 MHz
  Standard Timings:
    DMT 0x07:   640x480    85.008 Hz   4:3    43.269 kHz  36.000 MHz
    DMT 0x0c:   800x600    85.061 Hz   4:3    53.674 kHz  56.250 MHz
    DMT 0x13:  1024x768    84.997 Hz   4:3    68.677 kHz  94.500 MHz
    DMT 0x23:  1280x1024   60.020 Hz   5:4    63.981 kHz 108.000 MHz
  Detailed Timing Descriptors:
    DTD 1:   800x600    85.061 Hz   4:3    53.674 kHz  56.250 MHz (306 mm x 230 mm)
                 Hfront   32 Hsync  64 Hback 152 Hpol P
                 Vfront    1 Vsync   3 Vback  27 Vpol P
    DTD 2:  1024x768    84.997 Hz   4:3    68.677 kHz  94.500 MHz (306 mm x 230 mm)
                 Hfront   48 Hsync  96 Hback 208 Hpol P
                 Vfront    1 Vsync   3 Vback  36 Vpol P
  Display Range Limits:
    Monitor ranges (GTF): 50-160 Hz V, 30-70 kHz H, max dotclock 110 MHz
    Display Product Serial Number: ...
Checksum: 0x9e

----------------

Warnings:

Block 0, Base EDID:
  EDID Structure Version & Revision: EDID 1.1 is deprecated, do not use.

Failures:

Block 0, Base EDID:
  Detailed Timing Descriptor #1: Mismatch of image size 306x230 mm vs display size 320x240 mm.
  Detailed Timing Descriptor #2: Mismatch of image size 306x230 mm vs display size 320x240 mm.

EDID conformity: FAIL
