
EDID (hex):
00ffffffffffff0022f0a42600000080
0c11010368291a782e8585a6574a9c26
125054a56b8081807100814095000101
0101010101019a29a0d0518422305098
360098ff1000001c000000fd00324c18
530e000a202020202020000000fc0043
6f6d70617120574631393037000000ff
00434e4e373132323642350a2020008a

Extracted contents:
header:          00 ff ff ff ff ff ff 00
serial number:   22 f0 a4 26 00 00 00 80 0c 11
version:         01 03
basic params:    68 29 1a 78 2e
chroma info:     85 85 a6 57 4a 9c 26 12 50 54
established:     a5 6b 80
standard:        81 80 71 00 81 40 95 00 01 01 01 01 01 01 01 01
descriptor 1:    9a 29 a0 d0 51 84 22 30 50 98 36 00 98 ff 10 00 00 1c
descriptor 2:    00 00 00 fd 00 32 4c 18 53 0e 00 0a 20 20 20 20 20 20
descriptor 3:    00 00 00 fc 00 43 6f 6d 70 61 71 20 57 46 31 39 30 37
descriptor 4:    00 00 00 ff 00 43 4e 4e 37 31 32 32 36 42 35 0a 20 20
extensions:      00
checksum:        8a

EDID version: 1.3
Manufacturer: HWP Model 26a4 Serial Number --
Made in week 12 of 2007
Analog display, Input voltage level: 0.7/0.7 V
Sync: Separate 
Maximum image size: 41 cm x 26 cm
Gamma: 2.20
DPMS levels: Off
RGB color display
Default (sRGB) color space is primary color space
First detailed timing is preferred timing
Display x,y Chromaticity:
  Red:   0.6503, 0.3398
  Green: 0.2900, 0.6103
  Blue:  0.1503, 0.0703
  White: 0.3134, 0.3291
Established timings supported:
  720x400@70Hz 9:5 HorFreq: 31469 Hz Clock: 28.320 MHz
  640x480@60Hz 4:3 HorFreq: 31469 Hz Clock: 25.175 MHz
  640x480@75Hz 4:3 HorFreq: 37500 Hz Clock: 31.500 MHz
  800x600@60Hz 4:3 HorFreq: 37900 Hz Clock: 40.000 MHz
  800x600@75Hz 4:3 HorFreq: 46900 Hz Clock: 49.500 MHz
  832x624@75Hz 4:3 HorFreq: 49726 Hz Clock: 57.284 MHz
  1024x768@60Hz 4:3 HorFreq: 48400 Hz Clock: 65.000 MHz
  1024x768@75Hz 4:3 HorFreq: 60000 Hz Clock: 78.750 MHz
  1280x1024@75Hz 5:4 HorFreq: 80000 Hz Clock: 135.000 MHz
  1152x870@75Hz 192:145 HorFreq: 67500 Hz Clock: 108.000 MHz
Standard timings supported:
  1280x1024@60Hz 5:4 HorFreq: 64000 Hz Clock: 108.000 MHz
  1152x720@60Hz 16:10
  1280x960@60Hz 4:3 HorFreq: 60000 Hz Clock: 108.000 MHz
  1440x900@60Hz 16:10 HorFreq: 55500 Hz Clock: 88.750 MHz
Detailed mode: Clock 106.500 MHz, 408 mm x 255 mm
               1440 1520 1672 1904 hborder 0
                900  903  909  934 vborder 0
               -hsync +vsync 
               VertFreq: 59 Hz, HorFreq: 55934 Hz
Monitor ranges (GTF): 50-76Hz V, 24-83kHz H, max dotclock 140MHz
Serial number: --
Checksum: 0x8a (valid)
EDID block does NOT conform to EDID 1.3!
	sRGB is signaled, but the chromaticities do not match
	Name descriptor not terminated with a newline
