
EDID (hex):
00ffffffffffff0009e5c80700000000
011c0104b51f117802b657a95345a925
13535b00000001010101010101010101
01010101010150d000a0f0703e803020
350035ae1000001aa6a600a0f0703e80
3020350035ae1000001a000000fe0042
4f452048460a202020202020000000fe
004e5631343051554d2d4e35330a016b
02030f00e3058000e606050160602800
00000000000000000000000000000000
00000000000000000000000000000000
00000000000000000000000000000000
00000000000000000000000000000000
00000000000000000000000000000000
00000000000000000000000000000000
000000000000000000000000000000aa

Extracted contents:
header:          00 ff ff ff ff ff ff 00
serial number:   09 e5 c8 07 00 00 00 00 01 1c
version:         01 04
basic params:    b5 1f 11 78 02
chroma info:     b6 57 a9 53 45 a9 25 13 53 5b
established:     00 00 00
standard:        01 01 01 01 01 01 01 01 01 01 01 01 01 01 01 01
descriptor 1:    50 d0 00 a0 f0 70 3e 80 30 20 35 00 35 ae 10 00 00 1a
descriptor 2:    a6 a6 00 a0 f0 70 3e 80 30 20 35 00 35 ae 10 00 00 1a
descriptor 3:    00 00 00 fe 00 42 4f 45 20 48 46 0a 20 20 20 20 20 20
descriptor 4:    00 00 00 fe 00 4e 56 31 34 30 51 55 4d 2d 4e 35 33 0a
extensions:      01
checksum:        6b

EDID version: 1.4
Manufacturer: BOE Model 7c8 Serial Number --
Made in week 1 of 2018
Digital display
10 bits per primary color channel
DisplayPort interface
Maximum image size: 31 cm x 17 cm
Gamma: 2.20
Supported color formats: RGB 4:4:4
First detailed timing includes the native pixel format and preferred refresh rate
Display x,y Chromaticity:
  Red:   0.6621, 0.3271
  Green: 0.2705, 0.6621
  Blue:  0.1455, 0.0751
  White: 0.3251, 0.3583
Established timings supported:
Standard timings supported:
Detailed mode: Clock 533.280 MHz, 309 mm x 174 mm
               3840 3888 3920 4000 hborder 0
               2160 2163 2168 2222 vborder 0
               +hsync -vsync 
               VertFreq: 60 Hz, HorFreq: 133320 Hz
Detailed mode: Clock 426.620 MHz, 309 mm x 174 mm
               3840 3888 3920 4000 hborder 0
               2160 2163 2168 2222 vborder 0
               +hsync -vsync 
               VertFreq: 47 Hz, HorFreq: 106655 Hz
ASCII string: BOE HF
ASCII string: NV140QUM-N53
Has 1 extension blocks
Checksum: 0x6b (valid)

CTA extension block
Extension version: 3
11 bytes of CTA data
  Extended tag: Colorimetry data block
    BT2020RGB
  Extended tag: HDR static metadata data block
    Electro optical transfer functions:
      Traditional gamma - SDR luminance range
      SMPTE ST2084
    Supported static metadata descriptors:
      Static metadata type 1
    Desired content max luminance: 96 (400.000 cd/m^2)
    Desired content max frame-average luminance: 96 (400.000 cd/m^2)
    Desired content min luminance: 40 (0.098 cd/m^2)
0 native detailed modes
Checksum: 0xaa (valid)

EDID block does NOT conform to EDID 1.4!
	Required 640x480p60 timings are missing in the established timings
	and/or in the SVD list (VIC 1)
	Missing name descriptor
	Missing monitor ranges
