
EDID (hex):
00ffffffffffff0009e5dd0600000000
011a01049522137802c9a0955d599429
24505400000001010101010101010101
010101010101393780de703814403020
360058c21000001afa2d800e71382840
3020360058c21000001a000000fe0042
4f452043510a202020202020000000fe
004e5631353646484d2d5430300a000e

Extracted contents:
header:          00 ff ff ff ff ff ff 00
serial number:   09 e5 dd 06 00 00 00 00 01 1a
version:         01 04
basic params:    95 22 13 78 02
chroma info:     c9 a0 95 5d 59 94 29 24 50 54
established:     00 00 00
standard:        01 01 01 01 01 01 01 01 01 01 01 01 01 01 01 01
descriptor 1:    39 37 80 de 70 38 14 40 30 20 36 00 58 c2 10 00 00 1a
descriptor 2:    fa 2d 80 0e 71 38 28 40 30 20 36 00 58 c2 10 00 00 1a
descriptor 3:    00 00 00 fe 00 42 4f 45 20 43 51 0a 20 20 20 20 20 20
descriptor 4:    00 00 00 fe 00 4e 56 31 35 36 46 48 4d 2d 54 30 30 0a
extensions:      00
checksum:        0e

EDID version: 1.4
Manufacturer: BOE Model 6dd Serial Number --
Made in week 1 of 2016
Digital display
6 bits per primary color channel
DisplayPort interface
Maximum image size: 34 cm x 19 cm
Gamma: 2.20
Supported color formats: RGB 4:4:4
First detailed timing includes the native pixel format and preferred refresh rate
Display x,y Chromaticity:
  Red:   0.5849, 0.3632
  Green: 0.3496, 0.5791
  Blue:  0.1621, 0.1425
  White: 0.3125, 0.3281
Established timings supported:
Standard timings supported:
Detailed mode: Clock 141.370 MHz, 344 mm x 194 mm
               1920 1968 2000 2142 hborder 0
               1080 1083 1089 1100 vborder 0
               +hsync -vsync 
               VertFreq: 59 Hz, HorFreq: 65999 Hz
Detailed mode: Clock 117.700 MHz, 344 mm x 194 mm
               1920 1968 2000 2190 hborder 0
               1080 1083 1089 1120 vborder 0
               +hsync -vsync 
               VertFreq: 47 Hz, HorFreq: 53744 Hz
ASCII string: BOE CQ
ASCII string: NV156FHM-T00
Checksum: 0xe (valid)
EDID block does NOT conform to EDID 1.4!
	Missing name descriptor
	Missing monitor ranges
