
EDID (hex):
00ffffffffffff0030e4480200000000
0013010380160d780a1ee5985a539526
1c505400000001010101010101010101
010101010101121b5660500016303020
3500e07e0000001b0000000000000000
00000000000000000000000000fe004c
4720446973706c61790a2020000000fc
004c503130315748312d544c42350013

Extracted contents:
header:          00 ff ff ff ff ff ff 00
serial number:   30 e4 48 02 00 00 00 00 00 13
version:         01 03
basic params:    80 16 0d 78 0a
chroma info:     1e e5 98 5a 53 95 26 1c 50 54
established:     00 00 00
standard:        01 01 01 01 01 01 01 01 01 01 01 01 01 01 01 01
descriptor 1:    12 1b 56 60 50 00 16 30 30 20 35 00 e0 7e 00 00 00 1b
descriptor 2:    00 00 00 00 00 00 00 00 00 00 00 00 00 00 00 00 00 00
descriptor 3:    00 00 00 fe 00 4c 47 20 44 69 73 70 6c 61 79 0a 20 20
descriptor 4:    00 00 00 fc 00 4c 50 31 30 31 57 48 31 2d 54 4c 42 35
extensions:      00
checksum:        13

EDID version: 1.3
Manufacturer: LGD Model 248 Serial Number --
Made in year 2009
Digital display
Maximum image size: 22 cm x 13 cm
Gamma: 2.20
RGB color display
First detailed timing is preferred timing
Display x,y Chromaticity:
  Red:   0.5937, 0.3525
  Green: 0.3271, 0.5839
  Blue:  0.1513, 0.1113
  White: 0.3134, 0.3291
Established timings supported:
Standard timings supported:
Detailed mode: Clock 69.300 MHz, 224 mm x 126 mm
               1366 1414 1446 1462 hborder 0
                768  771  776  790 vborder 0
               +hsync -vsync 
               VertFreq: 60 Hz, HorFreq: 47400 Hz
Manufacturer-specified data, tag 0
ASCII string: LG Display
Checksum: 0x13 (valid)
EDID block does NOT conform to EDID 1.3!
	Name descriptor not terminated with a newline
	Missing monitor ranges
