edid-decode (hex):

00 ff ff ff ff ff ff 00 30 e4 48 02 00 00 00 00
00 13 01 03 80 16 0d 78 0a 1e e5 98 5a 53 95 26
1c 50 54 00 00 00 01 01 01 01 01 01 01 01 01 01
01 01 01 01 01 01 12 1b 56 60 50 00 16 30 30 20
35 00 e0 7e 00 00 00 1b 00 00 00 00 00 00 00 00
00 00 00 00 00 00 00 00 00 00 00 00 00 fe 00 4c
47 20 44 69 73 70 6c 61 79 0a 20 20 00 00 00 fc
00 4c 50 31 30 31 57 48 31 2d 54 4c 42 34 00 14

----------------

Block 0, Base EDID:
  EDID Structure Version & Revision: 1.3
  Vendor & Product Identification:
    Manufacturer: LGD
    Model: 584
    Made in: 2009
  Basic Display Parameters & Features:
    Digital display
    Maximum image size: 22 cm x 13 cm
    Gamma: 2.20
    RGB color display
    First detailed timing is preferred timing
  Color Characteristics:
    Red  : 0.5937, 0.3525
    Green: 0.3271, 0.5839
    Blue : 0.1513, 0.1113
    White: 0.3134, 0.3291
  Established Timings I & II: none
  Standard Timings: none
  Detailed Timing Descriptors:
    DTD 1:  1366x768    60.001 Hz 683:384  47.401 kHz  69.300 MHz (224 mm x 126 mm)
                 Hfront   48 Hsync  32 Hback  16 Hpol P
                 Vfront    3 Vsync   5 Vback  14 Vpol N
    Empty Descriptor
    Alphanumeric Data String: 'LG Display'
    Display Product Name: 'LP101WH1-TLB4'
Checksum: 0x14
