
EDID (hex):
00ffffffffffff0030e4e00300000000
00160104952313780a05f59458569228
1e505400000001010101010101010101
010101010101281e56fe50001a303024
570059c21000001b1b1456fe50001a30
3024570059c21000001b000000000000
00000000000000000000000000000002
000c4cff0a3c640f131f640000000004

Extracted contents:
header:          00 ff ff ff ff ff ff 00
serial number:   30 e4 e0 03 00 00 00 00 00 16
version:         01 04
basic params:    95 23 13 78 0a
chroma info:     05 f5 94 58 56 92 28 1e 50 54
established:     00 00 00
standard:        01 01 01 01 01 01 01 01 01 01 01 01 01 01 01 01
descriptor 1:    28 1e 56 fe 50 00 1a 30 30 24 57 00 59 c2 10 00 00 1b
descriptor 2:    1b 14 56 fe 50 00 1a 30 30 24 57 00 59 c2 10 00 00 1b
descriptor 3:    00 00 00 00 00 00 00 00 00 00 00 00 00 00 00 00 00 00
descriptor 4:    00 00 00 02 00 0c 4c ff 0a 3c 64 0f 13 1f 64 00 00 00
extensions:      00
checksum:        04

EDID version: 1.4
Manufacturer: LGD Model 3e0 Serial Number --
Made in year 2012
Digital display
6 bits per primary color channel
DisplayPort interface
Maximum image size: 35 cm x 19 cm
Gamma: 2.20
Supported color formats: RGB 4:4:4, YCrCb 4:4:4
First detailed timing includes the native pixel format and preferred refresh rate
Display x,y Chromaticity:
  Red:   0.5781, 0.3437
  Green: 0.3369, 0.5712
  Blue:  0.1591, 0.1201
  White: 0.3134, 0.3291
Established timings supported:
Standard timings supported:
Detailed mode: Clock 77.200 MHz, 345 mm x 194 mm
               1366 1414 1450 1620 hborder 0
                768  773  780  794 vborder 0
               +hsync -vsync 
               VertFreq: 60 Hz, HorFreq: 47654 Hz
Detailed mode: Clock 51.470 MHz, 345 mm x 194 mm
               1366 1414 1450 1620 hborder 0
                768  773  780  794 vborder 0
               +hsync -vsync 
               VertFreq: 40 Hz, HorFreq: 31771 Hz
Manufacturer-specified data, tag 0
Manufacturer-specified data, tag 2
Checksum: 0x4 (valid)
EDID block does NOT conform to EDID 1.4!
	Missing name descriptor
	Missing monitor ranges
