edid-decode (hex):

00 ff ff ff ff ff ff 00 1e 6d 45 5b 99 a0 05 00
04 1b 01 03 6c 34 21 78 ea 3c 31 a7 55 4d a2 27
10 50 54 21 08 00 71 40 81 c0 81 00 81 80 95 00
a9 40 b3 00 d1 c0 28 3c 80 a0 70 b0 23 40 30 20
36 00 08 4a 21 00 00 1a 00 00 00 fd 00 38 3d 1e
53 11 00 0a 20 20 20 20 20 20 00 00 00 fc 00 32
34 42 4b 35 35 57 56 0a 20 20 20 20 00 00 00 ff
00 37 30 34 4e 54 48 4d 41 55 37 39 33 0a 00 49

----------------

Block 0, Base EDID:
  EDID Structure Version & Revision: 1.3
  Vendor & Product Identification:
    Manufacturer: GSM
    Model: 23365
    Serial Number: ...
    Made in: week 4 of 2017
  Basic Display Parameters & Features:
    Analog display
    Signal Level Standard: 0.700 : 0.000 : 0.700 V p-p
    Blank level equals black level
    Sync: Separate Composite
    Maximum image size: 52 cm x 33 cm
    Gamma: 2.20
    DPMS levels: Standby Suspend Off
    RGB color display
    First detailed timing is the preferred timing
  Color Characteristics:
    Red  : 0.6523, 0.3349
    Green: 0.3037, 0.6328
    Blue : 0.1523, 0.0654
    White: 0.3125, 0.3291
  Established Timings I & II:
    DMT 0x04:   640x480    59.940476 Hz   4:3     31.469 kHz     25.175000 MHz
    DMT 0x09:   800x600    60.316541 Hz   4:3     37.879 kHz     40.000000 MHz
    DMT 0x10:  1024x768    60.003840 Hz   4:3     48.363 kHz     65.000000 MHz
  Standard Timings:
    GTF     :  1152x864    60.000000 Hz   4:3     53.700 kHz     81.624000 MHz
    DMT 0x55:  1280x720    60.000000 Hz  16:9     45.000 kHz     74.250000 MHz
    DMT 0x1c:  1280x800    59.810326 Hz  16:10    49.702 kHz     83.500000 MHz
    DMT 0x23:  1280x1024   60.019740 Hz   5:4     63.981 kHz    108.000000 MHz
    DMT 0x2f:  1440x900    59.887445 Hz  16:10    55.935 kHz    106.500000 MHz
    DMT 0x33:  1600x1200   60.000000 Hz   4:3     75.000 kHz    162.000000 MHz
    DMT 0x3a:  1680x1050   59.954250 Hz  16:10    65.290 kHz    146.250000 MHz
    DMT 0x52:  1920x1080   60.000000 Hz  16:9     67.500 kHz    148.500000 MHz
  Detailed Timing Descriptors:
    DTD 1:  1920x1200   59.950171 Hz  16:10    74.038 kHz    154.000000 MHz (520 mm x 330 mm)
                 Hfront   48 Hsync  32 Hback   80 Hpol P
                 Vfront    3 Vsync   6 Vback   26 Vpol N
    Display Range Limits:
      Monitor ranges (GTF): 56-61 Hz V, 30-83 kHz H, max dotclock 170 MHz
    Display Product Name: '24BK55WV'
    Display Product Serial Number: ...
Checksum: 0x49

----------------

EDID conformity: PASS
