edid-decode (hex):

00 ff ff ff ff ff ff 00 1e 6d 51 46 a5 00 00 00
02 0b 01 01 0e 24 1d 96 e8 fd 1c 99 59 4d 92 26
22 50 5c a5 6b 80 31 59 45 59 61 59 81 80 01 01
01 01 01 01 01 01 bc 34 00 98 51 00 2a 40 10 90
13 00 67 1f 11 00 00 1e 00 00 00 fd 00 38 78 1f
50 ff 00 0a 20 20 20 20 20 20 00 00 00 fc 00 53
74 75 64 69 6f 57 6f 72 6b 73 20 38 00 00 00 fc
00 38 30 4c 43 0a 20 20 20 20 20 20 20 20 00 9b

----------------

Block 0, Base EDID:
  EDID Structure Version & Revision: 1.1
  Vendor & Product Identification:
    Manufacturer: GSM
    Model: 18001
    Serial Number: ...
    Made in: week 2 of 2001
  Basic Display Parameters & Features:
    Analog display
    Input voltage level: 0.7/0.3 V
    Sync: Separate Composite SyncOnGreen
    Maximum image size: 36 cm x 29 cm
    Gamma: 2.50
    DPMS levels: Standby Suspend Off
    RGB color display
  Color Characteristics:
    Red  : 0.6005, 0.3505
    Green: 0.3037, 0.5712
    Blue : 0.1484, 0.1337
    White: 0.3154, 0.3593
  Established Timings I & II:
    IBM     :   720x400    70.082 Hz   9:5    31.467 kHz  28.320 MHz
    DMT 0x04:   640x480    59.940 Hz   4:3    31.469 kHz  25.175 MHz
    DMT 0x06:   640x480    75.000 Hz   4:3    37.500 kHz  31.500 MHz
    DMT 0x09:   800x600    60.317 Hz   4:3    37.879 kHz  40.000 MHz
    DMT 0x0b:   800x600    75.000 Hz   4:3    46.875 kHz  49.500 MHz
    Apple   :   832x624    74.551 Hz   4:3    49.726 kHz  57.284 MHz
    DMT 0x10:  1024x768    60.004 Hz   4:3    48.363 kHz  65.000 MHz
    DMT 0x12:  1024x768    75.029 Hz   4:3    60.023 kHz  78.750 MHz
    DMT 0x24:  1280x1024   75.025 Hz   5:4    79.976 kHz 135.000 MHz
    Apple   :  1152x870    75.062 Hz 192:145  68.681 kHz 100.000 MHz
  Standard Timings:
    DMT 0x07:   640x480    85.008 Hz   4:3    43.269 kHz  36.000 MHz
    DMT 0x0c:   800x600    85.061 Hz   4:3    53.674 kHz  56.250 MHz
    DMT 0x13:  1024x768    84.997 Hz   4:3    68.677 kHz  94.500 MHz
    DMT 0x23:  1280x1024   60.020 Hz   5:4    63.981 kHz 108.000 MHz
  Detailed Timing Descriptors:
    DTD 1:  1280x1024   75.025 Hz   5:4    79.976 kHz 135.000 MHz (359 mm x 287 mm)
                 Hfront   16 Hsync 144 Hback 248 Hpol P
                 Vfront    1 Vsync   3 Vback  38 Vpol P
  Display Range Limits:
    Monitor ranges (GTF): 56-120 Hz V, 31-80 kHz H, max dotclock 2550 MHz
    Display Product Name: 'StudioWorks 8'
    Display Product Name: '80LC'
Checksum: 0x9b

----------------

Warnings:

Block 0, Base EDID:
  EDID Structure Version & Revision: EDID 1.1 is deprecated, do not use.

EDID conformity: PASS
