edid-decode (hex):

00 ff ff ff ff ff ff 00 04 72 84 07 6e 31 90 03
27 1e 01 03 80 3c 21 78 2a dc f1 a6 55 51 9d 26
0e 50 54 bf ef 80 d1 cf b3 00 a9 c0 95 00 90 40
81 80 81 40 81 c0 02 3a 80 18 71 38 2d 40 58 2c
45 00 55 4f 21 00 00 1e 00 00 00 ff 00 54 4c 58
45 45 30 30 32 33 39 30 30 20 00 00 00 fd 00 30
a7 0f be 29 00 0a 20 20 20 20 20 20 00 00 00 fc
00 52 47 32 37 31 0a 20 20 20 20 20 20 20 01 e8

02 03 3e f1 48 21 22 10 07 03 01 40 04 23 09 07
07 83 01 00 00 67 03 0c 00 20 00 38 3c 67 d8 5d
c4 01 5a 88 00 6d 1a 00 00 02 01 30 a5 e6 00 00
00 00 00 e3 05 e3 01 e6 06 07 00 60 60 46 7d 9f
80 18 71 38 2d 40 58 2c 45 00 55 4f 21 00 00 1e
8f 84 80 a0 70 38 35 40 30 20 35 00 55 4f 21 00
00 1a 77 6e 80 a0 70 38 35 40 58 2c 45 00 55 4f
21 00 00 1e 00 00 00 00 00 00 00 00 00 00 00 d5

00 ff ff ff ff ff ff 00 04 72 84 07 6e 31 90 03
27 1e 01 03 80 3c 21 78 2a dc f1 a6 55 51 9d 26
0e 50 54 bf ef 80 d1 cf b3 00 a9 c0 95 00 90 40
81 80 81 40 81 c0 02 3a 80 18 71 38 2d 40 58 2c
45 00 55 4f 21 00 00 1e 00 00 00 ff 00 54 4c 58
45 45 30 30 32 33 39 30 30 20 00 00 00 fd 00 30
a7 0f be 29 00 0a 20 20 20 20 20 20 00 00 00 fc
00 52 47 32 37 31 0a 20 20 20 20 20 20 20 01 e8

02 03 3e f1 48 21 22 10 07 03 01 40 04 23 09 07
07 83 01 00 00 67 03 0c 00 20 00 38 3c 67 d8 5d
c4 01 5a 88 00 6d 1a 00 00 02 01 30 a5 e6 00 00
00 00 00 e3 05 e3 01 e6 06 07 00 60 60 46 7d 9f
80 18 71 38 2d 40 58 2c 45 00 55 4f 21 00 00 1e
8f 84 80 a0 70 38 35 40 30 20 35 00 55 4f 21 00
00 1a 77 6e 80 a0 70 38 35 40 58 2c 45 00 55 4f
21 00 00 1e 00 00 00 00 00 00 00 00 00 00 00 d5

----------------

Block 0, Base EDID:
  EDID Structure Version & Revision: 1.3
  Vendor & Product Identification:
    Manufacturer: ACR
    Model: 1924
    Serial Number: ...
    Made in: week 39 of 2020
  Basic Display Parameters & Features:
    Digital display
    Maximum image size: 60 cm x 33 cm
    Gamma: 2.20
    DPMS levels: Off
    RGB color display
    First detailed timing is the preferred timing
  Color Characteristics:
    Red  : 0.6513, 0.3330
    Green: 0.3193, 0.6132
    Blue : 0.1513, 0.0576
    White: 0.3125, 0.3291
  Established Timings I & II:
    IBM     :   720x400    70.081663 Hz   9:5     31.467 kHz     28.320000 MHz
    DMT 0x04:   640x480    59.940476 Hz   4:3     31.469 kHz     25.175000 MHz
    Apple   :   640x480    66.666667 Hz   4:3     35.000 kHz     30.240000 MHz
    DMT 0x05:   640x480    72.808802 Hz   4:3     37.861 kHz     31.500000 MHz
    DMT 0x06:   640x480    75.000000 Hz   4:3     37.500 kHz     31.500000 MHz
    DMT 0x08:   800x600    56.250000 Hz   4:3     35.156 kHz     36.000000 MHz
    DMT 0x09:   800x600    60.316541 Hz   4:3     37.879 kHz     40.000000 MHz
    DMT 0x0a:   800x600    72.187572 Hz   4:3     48.077 kHz     50.000000 MHz
    DMT 0x0b:   800x600    75.000000 Hz   4:3     46.875 kHz     49.500000 MHz
    Apple   :   832x624    74.551266 Hz   4:3     49.726 kHz     57.284000 MHz
    DMT 0x10:  1024x768    60.003840 Hz   4:3     48.363 kHz     65.000000 MHz
    DMT 0x11:  1024x768    70.069359 Hz   4:3     56.476 kHz     75.000000 MHz
    DMT 0x12:  1024x768    75.028582 Hz   4:3     60.023 kHz     78.750000 MHz
    DMT 0x24:  1280x1024   75.024675 Hz   5:4     79.976 kHz    135.000000 MHz
    Apple   :  1152x870    75.061550 Hz 192:145   68.681 kHz    100.000000 MHz
  Standard Timings:
    GTF     :  1920x1080   75.000068 Hz  16:9     84.600 kHz    220.637000 MHz
    DMT 0x3a:  1680x1050   59.954250 Hz  16:10    65.290 kHz    146.250000 MHz
    DMT 0x53:  1600x900    60.000000 Hz  16:9     60.000 kHz    108.000000 MHz (RB)
    DMT 0x2f:  1440x900    59.887445 Hz  16:10    55.935 kHz    106.500000 MHz
    DMT 0x2a:  1400x1050   59.978442 Hz   4:3     65.317 kHz    121.750000 MHz
    DMT 0x23:  1280x1024   60.019740 Hz   5:4     63.981 kHz    108.000000 MHz
    DMT 0x20:  1280x960    60.000000 Hz   4:3     60.000 kHz    108.000000 MHz
    DMT 0x55:  1280x720    60.000000 Hz  16:9     45.000 kHz     74.250000 MHz
  Detailed Timing Descriptors:
    DTD 1:  1920x1080   60.000000 Hz  16:9     67.500 kHz    148.500000 MHz (597 mm x 335 mm)
                 Hfront   88 Hsync  44 Hback  148 Hpol P
                 Vfront    4 Vsync   5 Vback   36 Vpol P
    Display Product Serial Number: ...
    Display Range Limits:
      Monitor ranges (GTF): 48-167 Hz V, 15-190 kHz H, max dotclock 410 MHz
    Display Product Name: 'RG271'
  Extension blocks: 1
Checksum: 0xe8

----------------

Block 1, CTA-861 Extension Block:
  Revision: 3
  Underscans IT Video Formats by default
  Basic audio support
  Supports YCbCr 4:4:4
  Supports YCbCr 4:2:2
  Native detailed modes: 1
  Video Data Block:
    VIC  33:  1920x1080   25.000000 Hz  16:9     28.125 kHz     74.250000 MHz
    VIC  34:  1920x1080   30.000000 Hz  16:9     33.750 kHz     74.250000 MHz
    VIC  16:  1920x1080   60.000000 Hz  16:9     67.500 kHz    148.500000 MHz
    VIC   7:  1440x480i   59.940060 Hz  16:9     15.734 kHz     27.000000 MHz
    VIC   3:   720x480    59.940060 Hz  16:9     31.469 kHz     27.000000 MHz
    VIC   1:   640x480    59.940476 Hz   4:3     31.469 kHz     25.175000 MHz
    VIC  64:  1920x1080  100.000000 Hz  16:9    112.500 kHz    297.000000 MHz
    VIC   4:  1280x720    60.000000 Hz  16:9     45.000 kHz     74.250000 MHz
  Audio Data Block:
    Linear PCM:
      Max channels: 2
      Supported sample rates (kHz): 48 44.1 32
      Supported sample sizes (bits): 24 20 16
  Speaker Allocation Data Block:
    FL/FR - Front Left/Right
  Vendor-Specific Data Block (HDMI), OUI 00-0C-03:
    Source physical address: 2.0.0.0
    DC_36bit
    DC_30bit
    DC_Y444
    Maximum TMDS clock: 300 MHz
  Vendor-Specific Data Block (HDMI Forum), OUI C4-5D-D8:
    Version: 1
    Maximum TMDS Character Rate: 450 MHz
    SCDC Present
    Supports scrambling for <= 340 Mcsc
  Vendor-Specific Data Block (AMD), OUI 00-00-1A:
    Version: 2.1
    Minimum Refresh Rate: 48 Hz
    Maximum Refresh Rate: 165 Hz
    Flags 1.x: 0xe6 (MCCS)
    Flags 2.x: 0x00
    Maximum luminance: 0 (50.000 cd/m^2)
    Minimum luminance: 0 (0.000 cd/m^2)
    Unknown: 0x00 0x00
  Colorimetry Data Block:
    xvYCC601
    xvYCC709
    BT2020cYCC
    BT2020YCC
    BT2020RGB
    Gamut Boundary Description Metadata Profile P0
  HDR Static Metadata Data Block:
    Electro optical transfer functions:
      Traditional gamma - SDR luminance range
      Traditional gamma - HDR luminance range
      SMPTE ST2084
    Supported static metadata descriptors:
    Desired content max luminance: 96 (400.000 cd/m^2)
    Desired content max frame-average luminance: 96 (400.000 cd/m^2)
    Desired content min luminance: 70 (0.301 cd/m^2)
  Detailed Timing Descriptors:
    DTD 2:  1920x1080  164.965657 Hz  16:9    185.586 kHz    408.290000 MHz (597 mm x 335 mm)
                 Hfront   88 Hsync  44 Hback  148 Hpol P
                 Vfront    4 Vsync   5 Vback   36 Vpol P
    DTD 3:  1920x1080  143.997386 Hz  16:9    163.149 kHz    339.350000 MHz (597 mm x 335 mm)
                 Hfront   48 Hsync  32 Hback   80 Hpol P
                 Vfront    3 Vsync   5 Vback   45 Vpol N
    DTD 4:  1920x1080  119.997115 Hz  16:9    135.957 kHz    282.790000 MHz (597 mm x 335 mm)
                 Hfront   88 Hsync  44 Hback   28 Hpol P
                 Vfront    4 Vsync   5 Vback   44 Vpol P
Checksum: 0xd5  Unused space in Extension Block: 11 bytes

----------------

Block 2, Unknown EDID Extension Block 0x00:
  00 ff ff ff ff ff ff 00 04 72 84 07 6e 31 90 03 '.........r..n1..'
  27 1e 01 03 80 3c 21 78 2a dc f1 a6 55 51 9d 26 ''....<!x*...UQ.&'
  0e 50 54 bf ef 80 d1 cf b3 00 a9 c0 95 00 90 40 '.PT............@'
  81 80 81 40 81 c0 02 3a 80 18 71 38 2d 40 58 2c '...@...:..q8-@X,'
  45 00 55 4f 21 00 00 1e 00 00 00 ff 00 54 4c 58 'E.UO!........TLX'
  45 45 30 30 32 33 39 30 30 20 00 00 00 fd 00 30 'EE0023900 .....0'
  a7 0f be 29 00 0a 20 20 20 20 20 20 00 00 00 fc '...)..      ....'
  00 52 47 32 37 31 0a 20 20 20 20 20 20 20 01 e8 '.RG271.       ..'
Checksum: 0xe8

----------------

Block 3, CTA-861 Extension Block:
  Revision: 3
  Underscans IT Video Formats by default
  Basic audio support
  Supports YCbCr 4:4:4
  Supports YCbCr 4:2:2
  Native detailed modes: 1
  Video Data Block:
    VIC  33:  1920x1080   25.000000 Hz  16:9     28.125 kHz     74.250000 MHz
    VIC  34:  1920x1080   30.000000 Hz  16:9     33.750 kHz     74.250000 MHz
    VIC  16:  1920x1080   60.000000 Hz  16:9     67.500 kHz    148.500000 MHz
    VIC   7:  1440x480i   59.940060 Hz  16:9     15.734 kHz     27.000000 MHz
    VIC   3:   720x480    59.940060 Hz  16:9     31.469 kHz     27.000000 MHz
    VIC   1:   640x480    59.940476 Hz   4:3     31.469 kHz     25.175000 MHz
    VIC  64:  1920x1080  100.000000 Hz  16:9    112.500 kHz    297.000000 MHz
    VIC   4:  1280x720    60.000000 Hz  16:9     45.000 kHz     74.250000 MHz
  Audio Data Block:
    Linear PCM:
      Max channels: 2
      Supported sample rates (kHz): 48 44.1 32
      Supported sample sizes (bits): 24 20 16
  Speaker Allocation Data Block:
    FL/FR - Front Left/Right
  Vendor-Specific Data Block (HDMI), OUI 00-0C-03:
    Source physical address: 2.0.0.0
    DC_36bit
    DC_30bit
    DC_Y444
    Maximum TMDS clock: 300 MHz
  Vendor-Specific Data Block (HDMI Forum), OUI C4-5D-D8:
    Version: 1
    Maximum TMDS Character Rate: 450 MHz
    SCDC Present
    Supports scrambling for <= 340 Mcsc
  Vendor-Specific Data Block (AMD), OUI 00-00-1A:
    Version: 2.1
    Minimum Refresh Rate: 48 Hz
    Maximum Refresh Rate: 165 Hz
    Flags 1.x: 0xe6 (MCCS)
    Flags 2.x: 0x00
    Maximum luminance: 0 (50.000 cd/m^2)
    Minimum luminance: 0 (0.000 cd/m^2)
    Unknown: 0x00 0x00
  Colorimetry Data Block:
    xvYCC601
    xvYCC709
    BT2020cYCC
    BT2020YCC
    BT2020RGB
    Gamut Boundary Description Metadata Profile P0
  HDR Static Metadata Data Block:
    Electro optical transfer functions:
      Traditional gamma - SDR luminance range
      Traditional gamma - HDR luminance range
      SMPTE ST2084
    Supported static metadata descriptors:
    Desired content max luminance: 96 (400.000 cd/m^2)
    Desired content max frame-average luminance: 96 (400.000 cd/m^2)
    Desired content min luminance: 70 (0.301 cd/m^2)
  Detailed Timing Descriptors:
    DTD 5:  1920x1080  164.965657 Hz  16:9    185.586 kHz    408.290000 MHz (597 mm x 335 mm)
                 Hfront   88 Hsync  44 Hback  148 Hpol P
                 Vfront    4 Vsync   5 Vback   36 Vpol P
    DTD 6:  1920x1080  143.997386 Hz  16:9    163.149 kHz    339.350000 MHz (597 mm x 335 mm)
                 Hfront   48 Hsync  32 Hback   80 Hpol P
                 Vfront    3 Vsync   5 Vback   45 Vpol N
    DTD 7:  1920x1080  119.997115 Hz  16:9    135.957 kHz    282.790000 MHz (597 mm x 335 mm)
                 Hfront   88 Hsync  44 Hback   28 Hpol P
                 Vfront    4 Vsync   5 Vback   44 Vpol P
Checksum: 0xd5  Unused space in Extension Block: 11 bytes

----------------

Warnings:

Block 1, CTA-861 Extension Block:
  Colorimetry Data Block: Set the sRGB colorimetry bit to avoid interop issues.
  Display Product Serial Number is set, so the Serial Number in the Base EDID should be 0.
Block 3, CTA-861 Extension Block:
  Colorimetry Data Block: Set the sRGB colorimetry bit to avoid interop issues.
  Display Product Serial Number is set, so the Serial Number in the Base EDID should be 0.

Failures:

Block 0, Base EDID:
  Display Product Serial Number: ...
Block 1, CTA-861 Extension Block:
  Missing VCDB, needed for Set Selectable RGB Quantization to avoid interop issues.
Block 2, Base EDID:
  Unknown Extension Block.
Block 3, CTA-861 Extension Block:
  Video Data Block: Duplicate VIC 33.
  Video Data Block: Duplicate VIC 34.
  Video Data Block: Duplicate VIC 16.
  Video Data Block: Duplicate VIC 7.
  Video Data Block: Duplicate VIC 3.
  Video Data Block: Duplicate VIC 1.
  Video Data Block: Duplicate VIC 64.
  Video Data Block: Duplicate VIC 4.
  Speaker Allocation Data Block: Only one instance of this Data Block is allowed.
  Vendor-Specific Data Block (HDMI Forum), OUI C4-5D-D8: Duplicate HDMI Forum VSDB/SCDB.
  Colorimetry Data Block: Only one instance of this Data Block is allowed.
  HDR Static Metadata Data Block: Only one instance of this Data Block is allowed.
  Missing VCDB, needed for Set Selectable RGB Quantization to avoid interop issues.
EDID:
  Base EDID: Some timings are out of range of the Monitor Ranges:
    Vertical Freq: 25.000 - 164.966 Hz (Monitor: 48.000 - 167.000 Hz)
  Base EDID: EDID specified 1 extension block(s), but found 3 extension block(s).
  Base EDID: EDID 1.3 requires a Block Map Extension in Block 1 if there are more than 2 blocks in the EDID.

EDID conformity: FAIL
