edid-decode (hex):

00 ff ff ff ff ff ff 00 30 ae 9c 81 00 00 00 00
00 1d 01 04 a5 1d 12 78 03 de 50 a3 54 4c 99 26
0f 50 54 00 00 00 01 01 01 01 01 01 01 01 01 01
01 01 01 01 01 01 0f 3c 80 a0 70 b0 20 40 18 30
3c 00 1e b3 10 00 00 19 00 00 00 fd 00 30 3c 4a
4a 0f 01 0a 20 20 20 20 20 20 00 00 00 fe 00 4c
45 4e 4f 56 4f 0a 20 20 20 20 20 20 00 00 00 fe
00 4c 45 4e 31 33 33 57 55 58 47 41 20 20 00 8c

00 ff ff ff ff ff ff 00 30 ae 9c 81 00 00 00 00
00 1d 01 04 a5 1d 12 78 03 de 50 a3 54 4c 99 26
0f 50 54 00 00 00 01 01 01 01 01 01 01 01 01 01
01 01 01 01 01 01 0f 3c 80 a0 70 b0 20 40 18 30
3c 00 1e b3 10 00 00 19 00 00 00 fd 00 30 3c 4a
4a 0f 01 0a 20 20 20 20 20 20 00 00 00 fe 00 4c
45 4e 4f 56 4f 0a 20 20 20 20 20 20 00 00 00 fe
00 4c 45 4e 31 33 33 57 55 58 47 41 20 20 00 8c

----------------

Block 0, Base EDID:
  EDID Structure Version & Revision: 1.4
  Vendor & Product Identification:
    Manufacturer: LEN
    Model: 33180
    Made in: 2019
  Basic Display Parameters & Features:
    Digital display
    Bits per primary color channel: 8
    DisplayPort interface
    Maximum image size: 29 cm x 18 cm
    Gamma: 2.20
    Supported color formats: RGB 4:4:4
    First detailed timing includes the native pixel format and preferred refresh rate
    Display is continuous frequency
  Color Characteristics:
    Red  : 0.6396, 0.3291
    Green: 0.2998, 0.5996
    Blue : 0.1494, 0.0595
    White: 0.3125, 0.3281
  Established Timings I & II: none
  Standard Timings: none
  Detailed Timing Descriptors:
    DTD 1:  1920x1200   59.998595 Hz  16:10    73.918 kHz    153.750000 MHz (286 mm x 179 mm)
                 Hfront   24 Hsync  48 Hback   88 Hpol N
                 Vfront    3 Vsync  12 Vback   17 Vpol N
    Display Range Limits:
      Monitor ranges (Bare Limits): 48-60 Hz V, 74-74 kHz H, max dotclock 150 MHz
    Alphanumeric Data String: 'LENOVO'
    Alphanumeric Data String: 'LEN133WUXGA  '
Checksum: 0x8c

----------------

Block 1, Unknown EDID Extension Block 0x00:
  00 ff ff ff ff ff ff 00 30 ae 9c 81 00 00 00 00 '........0.......'
  00 1d 01 04 a5 1d 12 78 03 de 50 a3 54 4c 99 26 '.......x..P.TL.&'
  0f 50 54 00 00 00 01 01 01 01 01 01 01 01 01 01 '.PT.............'
  01 01 01 01 01 01 0f 3c 80 a0 70 b0 20 40 18 30 '.......<..p. @.0'
  3c 00 1e b3 10 00 00 19 00 00 00 fd 00 30 3c 4a '<............0<J'
  4a 0f 01 0a 20 20 20 20 20 20 00 00 00 fe 00 4c 'J...      .....L'
  45 4e 4f 56 4f 0a 20 20 20 20 20 20 00 00 00 fe 'ENOVO.      ....'
  00 4c 45 4e 31 33 33 57 55 58 47 41 20 20 00 8c '.LEN133WUXGA  ..'
Checksum: 0x8c

----------------

Warnings:

Block 0, Base EDID:
  Missing Display Product Name.
EDID:
  Base EDID: Some timings are out of range of the Monitor Ranges:
    Maximum Clock: 153.750 MHz (Monitor: 150.000 MHz)
    Could be due to a Monitor Range off-by-one rounding issue

Failures:

Block 0, Base EDID:
  Alphanumeric Data String: One or more trailing spaces.
Block 1, Base EDID:
  Unknown Extension Block.
EDID:
  Base EDID: EDID specified 0 extension block(s), but found 1 extension block(s).

EDID conformity: FAIL
