edid-decode (hex):

00 ff ff ff ff ff ff 00 22 64 35 67 ac 04 00 00
35 15 01 03 68 3b 25 78 2a af f1 a6 54 4c 9e 23
10 50 54 bf ef 80 71 4f 81 40 81 80 95 00 95 0f
a9 40 01 01 01 01 28 3c 80 a0 70 b0 23 40 30 20
36 00 51 73 21 00 00 1a 00 00 00 ff 00 31 35 33
4c 4d 33 41 59 30 31 31 39 36 00 00 00 fd 00 32
4b 1e 55 11 00 0a 20 20 20 20 20 20 00 00 00 fc
00 48 5a 32 38 31 48 0a 20 20 20 20 20 20 00 ad

00 ff ff ff ff ff ff 00 22 64 35 67 ac 04 00 00
35 15 01 03 68 3b 25 78 2a af f1 a6 54 4c 9e 23
10 50 54 bf ef 80 71 4f 81 40 81 80 95 00 95 0f
a9 40 01 01 01 01 28 3c 80 a0 70 b0 23 40 30 20
36 00 51 73 21 00 00 1a 00 00 00 ff 00 31 35 33
4c 4d 33 41 59 30 31 31 39 36 00 00 00 fd 00 32
4b 1e 55 11 00 0a 20 20 20 20 20 20 00 00 00 fc
00 48 5a 32 38 31 48 0a 20 20 20 20 20 20 00 ad

----------------

Block 0, Base EDID:
  EDID Structure Version & Revision: 1.3
  Vendor & Product Identification:
    Manufacturer: HSD
    Model: 26421
    Serial Number: ...
    Made in: week 53 of 2011
  Basic Display Parameters & Features:
    Analog display
    Signal Level Standard: 0.700 : 0.000 : 0.700 V p-p
    Blank level equals black level
    Sync: Separate
    Maximum image size: 59 cm x 37 cm
    Gamma: 2.20
    DPMS levels: Off
    RGB color display
    First detailed timing is the preferred timing
  Color Characteristics:
    Red  : 0.6503, 0.3300
    Green: 0.2998, 0.6201
    Blue : 0.1396, 0.0654
    White: 0.3125, 0.3291
  Established Timings I & II:
    IBM     :   720x400    70.081663 Hz   9:5     31.467 kHz     28.320000 MHz
    DMT 0x04:   640x480    59.940476 Hz   4:3     31.469 kHz     25.175000 MHz
    Apple   :   640x480    66.666667 Hz   4:3     35.000 kHz     30.240000 MHz
    DMT 0x05:   640x480    72.808802 Hz   4:3     37.861 kHz     31.500000 MHz
    DMT 0x06:   640x480    75.000000 Hz   4:3     37.500 kHz     31.500000 MHz
    DMT 0x08:   800x600    56.250000 Hz   4:3     35.156 kHz     36.000000 MHz
    DMT 0x09:   800x600    60.316541 Hz   4:3     37.879 kHz     40.000000 MHz
    DMT 0x0a:   800x600    72.187572 Hz   4:3     48.077 kHz     50.000000 MHz
    DMT 0x0b:   800x600    75.000000 Hz   4:3     46.875 kHz     49.500000 MHz
    Apple   :   832x624    74.551266 Hz   4:3     49.726 kHz     57.284000 MHz
    DMT 0x10:  1024x768    60.003840 Hz   4:3     48.363 kHz     65.000000 MHz
    DMT 0x11:  1024x768    70.069359 Hz   4:3     56.476 kHz     75.000000 MHz
    DMT 0x12:  1024x768    75.028582 Hz   4:3     60.023 kHz     78.750000 MHz
    DMT 0x24:  1280x1024   75.024675 Hz   5:4     79.976 kHz    135.000000 MHz
    Apple   :  1152x870    75.061550 Hz 192:145   68.681 kHz    100.000000 MHz
  Standard Timings:
    DMT 0x15:  1152x864    75.000000 Hz   4:3     67.500 kHz    108.000000 MHz
    DMT 0x20:  1280x960    60.000000 Hz   4:3     60.000 kHz    108.000000 MHz
    DMT 0x23:  1280x1024   60.019740 Hz   5:4     63.981 kHz    108.000000 MHz
    DMT 0x2f:  1440x900    59.887445 Hz  16:10    55.935 kHz    106.500000 MHz
    DMT 0x30:  1440x900    74.984427 Hz  16:10    70.635 kHz    136.750000 MHz
    DMT 0x33:  1600x1200   60.000000 Hz   4:3     75.000 kHz    162.000000 MHz
  Detailed Timing Descriptors:
    DTD 1:  1920x1200   59.950171 Hz  16:10    74.038 kHz    154.000000 MHz (593 mm x 371 mm)
                 Hfront   48 Hsync  32 Hback   80 Hpol P
                 Vfront    3 Vsync   6 Vback   26 Vpol N
    Display Product Serial Number: ...
    Display Range Limits:
      Monitor ranges (GTF): 50-75 Hz V, 30-85 kHz H, max dotclock 170 MHz
    Display Product Name: 'HZ281H'
Checksum: 0xad

----------------

Block 1, Unknown EDID Extension Block 0x00:
  00 ff ff ff ff ff ff 00 22 64 35 67 ac 04 00 00 '........"d5g....'
  35 15 01 03 68 3b 25 78 2a af f1 a6 54 4c 9e 23 '5...h;%x*...TL.#'
  10 50 54 bf ef 80 71 4f 81 40 81 80 95 00 95 0f '.PT...qO.@......'
  a9 40 01 01 01 01 28 3c 80 a0 70 b0 23 40 30 20 '.@....(<..p.#@0 '
  36 00 51 73 21 00 00 1a 00 00 00 ff 00 31 35 33 '6.Qs!........153'
  4c 4d 33 41 59 30 31 31 39 36 00 00 00 fd 00 32 'LM3AY01196.....2'
  4b 1e 55 11 00 0a 20 20 20 20 20 20 00 00 00 fc 'K.U...      ....'
  00 48 5a 32 38 31 48 0a 20 20 20 20 20 20 00 ad '.HZ281H.      ..'
Checksum: 0xad

----------------

Failures:

Block 1, Base EDID:
  Unknown Extension Block.
EDID:
  Base EDID: EDID specified 0 extension block(s), but found 1 extension block(s).

EDID conformity: FAIL
