edid-decode (hex):

00 ff ff ff ff ff ff 00 1c 54 05 21 78 56 34 12
28 15 01 03 85 2f 1d 78 ea 64 b5 ab 52 38 ab 25
13 50 54 00 00 00 01 01 01 01 01 01 01 01 01 01
01 01 01 01 01 01 02 3a 80 18 71 38 2d 40 58 2c
45 00 d9 28 11 00 00 1c 00 00 00 10 00 38 2d 40
58 2c 45 00 d9 28 11 00 00 1c 00 00 00 fc 00 32
31 2e 35 22 20 41 49 4f 20 50 43 0a 00 00 00 fd
00 38 4c 1e 53 10 00 0a 20 20 20 20 20 20 00 10

----------------

Block 0, Base EDID:
  EDID Structure Version & Revision: 1.3
  Vendor & Product Identification:
    Manufacturer: GBT
    Model: 8453
    Serial Number: ...
    Made in: week 40 of 2011
  Basic Display Parameters & Features:
    Digital display
    DFP 1.x compatible TMDS
    Maximum image size: 47 cm x 29 cm
    Gamma: 2.20
    DPMS levels: Standby Suspend Off
    RGB color display
    First detailed timing is the preferred timing
  Color Characteristics:
    Red  : 0.6689, 0.3222
    Green: 0.2197, 0.6679
    Blue : 0.1464, 0.0771
    White: 0.3134, 0.3291
  Established Timings I & II: none
  Standard Timings: none
  Detailed Timing Descriptors:
    DTD 1:  1920x1080   60.000000 Hz  16:9     67.500 kHz    148.500000 MHz (473 mm x 296 mm)
                 Hfront   88 Hsync  44 Hback  148 Hpol N
                 Vfront    4 Vsync   5 Vback   36 Vpol P
    Dummy Descriptor:
    Display Product Name: '21.5" AIO PC'
    Display Range Limits:
      Monitor ranges (GTF): 56-76 Hz V, 30-83 kHz H, max dotclock 160 MHz
Checksum: 0x10

----------------

Warnings:

Block 0, Base EDID:
  Detailed Timing Descriptor #1: DTD is similar but not identical to VIC 16.

Failures:

Block 0, Base EDID:
  Basic Display Parameters & Features: Digital Video Interface Standard set to reserved value 0x04.
  Dummy Descriptor: Dummy block filled with garbage.

EDID conformity: FAIL
