edid-decode (hex):

00 ff ff ff ff ff ff 00 1c 54 05 32 01 01 01 01
03 20 01 04 b5 46 27 78 fb b4 e5 ab 4f 47 a9 27
10 50 54 25 4b 00 d1 c0 01 01 01 01 01 01 01 01
01 01 01 01 01 01 f6 5b 00 6e a0 a0 1f 50 17 20
18 04 b9 88 21 00 00 1e 00 00 00 fd 00 30 a5 f6
f6 43 01 0a 20 20 20 20 20 20 00 00 00 fc 00 4d
33 32 51 43 0a 20 20 20 20 20 20 20 00 00 00 ff
00 32 32 30 33 30 42 30 30 31 34 33 34 0a 02 88

02 03 3d 71 47 01 02 03 04 90 2f 3f 23 09 17 07
83 01 00 00 67 03 0c 00 10 00 38 41 67 d8 5d c4
01 78 80 03 6d 1a 00 00 02 03 30 a5 00 0f 62 2c
62 2c e3 05 e3 01 e6 06 0d 01 62 62 2c 9e f9 00
50 a0 a0 1b 50 18 10 35 00 b9 88 21 00 00 1e 6f
c2 00 a0 a0 a0 55 50 30 20 35 00 b9 88 21 00 00
1e 96 7f 80 78 70 38 21 40 1c 20 38 04 b9 88 21
00 00 1e 00 00 00 00 00 00 00 00 00 00 00 00 5b

70 12 17 00 00 03 01 14 5f e8 00 04 ff 09 77 00
1b 00 1f 00 9f 05 66 00 08 00 07 00 a2 00 00 00
00 00 00 00 00 00 00 00 00 00 00 00 00 00 00 00
00 00 00 00 00 00 00 00 00 00 00 00 00 00 00 00
00 00 00 00 00 00 00 00 00 00 00 00 00 00 00 00
00 00 00 00 00 00 00 00 00 00 00 00 00 00 00 00
00 00 00 00 00 00 00 00 00 00 00 00 00 00 00 00
00 00 00 00 00 00 00 00 00 00 00 00 00 00 a2 ee

00 ff ff ff ff ff ff 00 1c 54 05 32 01 01 01 01
03 20 01 04 b5 46 27 78 fb b4 e5 ab 4f 47 a9 27
10 50 54 25 4b 00 d1 c0 01 01 01 01 01 01 01 01
01 01 01 01 01 01 f6 5b 00 6e a0 a0 1f 50 17 20
18 04 b9 88 21 00 00 1e 00 00 00 fd 00 30 a5 f6
f6 43 01 0a 20 20 20 20 20 20 00 00 00 fc 00 4d
33 32 51 43 0a 20 20 20 20 20 20 20 00 00 00 ff
00 32 32 30 33 30 42 30 30 31 34 33 34 0a 02 88

02 03 3d 71 47 01 02 03 04 90 2f 3f 23 09 17 07
83 01 00 00 67 03 0c 00 10 00 38 41 67 d8 5d c4
01 78 80 03 6d 1a 00 00 02 03 30 a5 00 0f 62 2c
62 2c e3 05 e3 01 e6 06 0d 01 62 62 2c 9e f9 00
50 a0 a0 1b 50 18 10 35 00 b9 88 21 00 00 1e 6f
c2 00 a0 a0 a0 55 50 30 20 35 00 b9 88 21 00 00
1e 96 7f 80 78 70 38 21 40 1c 20 38 04 b9 88 21
00 00 1e 00 00 00 00 00 00 00 00 00 00 00 00 5b

70 12 17 00 00 03 01 14 5f e8 00 04 ff 09 77 00
1b 00 1f 00 9f 05 66 00 08 00 07 00 a2 00 00 00
00 00 00 00 00 00 00 00 00 00 00 00 00 00 00 00
00 00 00 00 00 00 00 00 00 00 00 00 00 00 00 00
00 00 00 00 00 00 00 00 00 00 00 00 00 00 00 00
00 00 00 00 00 00 00 00 00 00 00 00 00 00 00 00
00 00 00 00 00 00 00 00 00 00 00 00 00 00 00 00
00 00 00 00 00 00 00 00 00 00 00 00 00 00 a2 ee

----------------

Block 0, Base EDID:
  EDID Structure Version & Revision: 1.4
  Vendor & Product Identification:
    Manufacturer: GBT
    Model: 12805
    Serial Number: ...
    Made in: week 3 of 2022
  Basic Display Parameters & Features:
    Digital display
    Bits per primary color channel: 10
    DisplayPort interface
    Maximum image size: 70 cm x 39 cm
    Gamma: 2.20
    DPMS levels: Standby Suspend Off
    Supported color formats: RGB 4:4:4, YCrCb 4:4:4, YCrCb 4:2:2
    First detailed timing includes the native pixel format and preferred refresh rate
    Display is continuous frequency
  Color Characteristics:
    Red  : 0.6699, 0.3115
    Green: 0.2783, 0.6601
    Blue : 0.1552, 0.0644
    White: 0.3134, 0.3291
  Established Timings I & II:
    DMT 0x04:   640x480    59.940476 Hz   4:3     31.469 kHz     25.175000 MHz
    DMT 0x06:   640x480    75.000000 Hz   4:3     37.500 kHz     31.500000 MHz
    DMT 0x09:   800x600    60.316541 Hz   4:3     37.879 kHz     40.000000 MHz
    DMT 0x0b:   800x600    75.000000 Hz   4:3     46.875 kHz     49.500000 MHz
    DMT 0x10:  1024x768    60.003840 Hz   4:3     48.363 kHz     65.000000 MHz
    DMT 0x12:  1024x768    75.028582 Hz   4:3     60.023 kHz     78.750000 MHz
    DMT 0x24:  1280x1024   75.024675 Hz   5:4     79.976 kHz    135.000000 MHz
  Standard Timings:
    DMT 0x52:  1920x1080   60.000000 Hz  16:9     67.500 kHz    148.500000 MHz
  Detailed Timing Descriptors:
    DTD 1:  2560x1440   59.940370 Hz  16:9     88.172 kHz    235.420000 MHz (697 mm x 392 mm)
                 Hfront   23 Hsync  32 Hback   55 Hpol P
                 Vfront   17 Vsync   8 Vback    6 Vpol P
    Display Range Limits:
      Monitor ranges (Bare Limits): 48-165 Hz V, 246-246 kHz H, max dotclock 670 MHz
    Display Product Name: 'M32QC'
    Display Product Serial Number: ...
  Extension blocks: 2
Checksum: 0x88

----------------

Block 1, CTA-861 Extension Block:
  Revision: 3
  Basic audio support
  Supports YCbCr 4:4:4
  Supports YCbCr 4:2:2
  Native detailed modes: 1
  Video Data Block:
    VIC   1:   640x480    59.940476 Hz   4:3     31.469 kHz     25.175000 MHz
    VIC   2:   720x480    59.940060 Hz   4:3     31.469 kHz     27.000000 MHz
    VIC   3:   720x480    59.940060 Hz  16:9     31.469 kHz     27.000000 MHz
    VIC   4:  1280x720    60.000000 Hz  16:9     45.000 kHz     74.250000 MHz
    VIC  16:  1920x1080   60.000000 Hz  16:9     67.500 kHz    148.500000 MHz (native)
    VIC  47:  1280x720   120.000000 Hz  16:9     90.000 kHz    148.500000 MHz
    VIC  63:  1920x1080  120.000000 Hz  16:9    135.000 kHz    297.000000 MHz
  Audio Data Block:
    Linear PCM:
      Max channels: 2
      Supported sample rates (kHz): 96 48 44.1 32
      Supported sample sizes (bits): 24 20 16
  Speaker Allocation Data Block:
    FL/FR - Front Left/Right
  Vendor-Specific Data Block (HDMI), OUI 00-0C-03:
    Source physical address: 1.0.0.0
    DC_36bit
    DC_30bit
    DC_Y444
    Maximum TMDS clock: 325 MHz
  Vendor-Specific Data Block (HDMI Forum), OUI C4-5D-D8:
    Version: 1
    Maximum TMDS Character Rate: 600 MHz
    SCDC Present
    Supports 12-bits/component Deep Color 4:2:0 Pixel Encoding
    Supports 10-bits/component Deep Color 4:2:0 Pixel Encoding
  Vendor-Specific Data Block (AMD), OUI 00-00-1A:
    Version: 2.3
    Minimum Refresh Rate: 48 Hz
    Maximum Refresh Rate: 165 Hz
    Flags 1.x: 0x00
    Flags 2.x: 0x0f
    Maximum luminance: 98 (417.710 cd/m^2)
    Minimum luminance: 44 (0.124 cd/m^2)
    Maximum luminance (without local dimming): 98 (417.710 cd/m^2)
    Minimum luminance (without local dimming): 44 (0.124 cd/m^2)
  Colorimetry Data Block:
    xvYCC601
    xvYCC709
    BT2020cYCC
    BT2020YCC
    BT2020RGB
    Gamut Boundary Description Metadata Profile P0
  HDR Static Metadata Data Block:
    Electro optical transfer functions:
      Traditional gamma - SDR luminance range
      SMPTE ST2084
      Hybrid Log-Gamma
    Supported static metadata descriptors:
      Static metadata type 1
    Desired content max luminance: 98 (417.710 cd/m^2)
    Desired content max frame-average luminance: 98 (417.710 cd/m^2)
    Desired content min luminance: 44 (0.124 cd/m^2)
  Detailed Timing Descriptors:
    DTD 2:  2560x1440  164.998657 Hz  16:9    242.053 kHz    639.020000 MHz (697 mm x 392 mm)
                 Hfront   24 Hsync  16 Hback   40 Hpol P
                 Vfront    3 Vsync   5 Vback   19 Vpol P
    DTD 3:  2560x1440  119.997589 Hz  16:9    182.996 kHz    497.750000 MHz (697 mm x 392 mm)
                 Hfront   48 Hsync  32 Hback   80 Hpol P
                 Vfront    3 Vsync   5 Vback   77 Vpol P
    DTD 4:  1920x1080  143.852510 Hz  16:9    160.108 kHz    326.620000 MHz (697 mm x 392 mm)
                 Hfront   28 Hsync  32 Hback   60 Hpol P
                 Vfront   19 Vsync   8 Vback    6 Vpol P
Checksum: 0x5b  Unused space in Extension Block: 12 bytes

----------------

Block 2, DisplayID Extension Block:
  Version: 1.2
  Extension Count: 0
  Display Product Type: Extension Section
  Video Timing Modes Type 1 - Detailed Timings Data Block:
    DTD:  2560x1440  143.856221 Hz  16:9    221.970 kHz    594.880000 MHz (aspect 16:9, no 3D stereo)
               Hfront   28 Hsync  32 Hback   60 Hpol N
               Vfront    9 Vsync   8 Vback   86 Vpol N
  Checksum: 0xa2
Checksum: 0xee  Unused space in Extension Block: 98 bytes

----------------

Block 3, Unknown EDID Extension Block 0x00:
  00 ff ff ff ff ff ff 00 1c 54 05 32 01 01 01 01 '.........T.2....'
  03 20 01 04 b5 46 27 78 fb b4 e5 ab 4f 47 a9 27 '. ...F'x....OG.''
  10 50 54 25 4b 00 d1 c0 01 01 01 01 01 01 01 01 '.PT%K...........'
  01 01 01 01 01 01 f6 5b 00 6e a0 a0 1f 50 17 20 '.......[.n...P. '
  18 04 b9 88 21 00 00 1e 00 00 00 fd 00 30 a5 f6 '....!........0..'
  f6 43 01 0a 20 20 20 20 20 20 00 00 00 fc 00 4d '.C..      .....M'
  33 32 51 43 0a 20 20 20 20 20 20 20 00 00 00 ff '32QC.       ....'
  00 32 32 30 33 30 42 30 30 31 34 33 34 0a 02 88 '.22030B001434...'
Checksum: 0x88

----------------

Block 4, CTA-861 Extension Block:
  Revision: 3
  Basic audio support
  Supports YCbCr 4:4:4
  Supports YCbCr 4:2:2
  Native detailed modes: 1
  Video Data Block:
    VIC   1:   640x480    59.940476 Hz   4:3     31.469 kHz     25.175000 MHz
    VIC   2:   720x480    59.940060 Hz   4:3     31.469 kHz     27.000000 MHz
    VIC   3:   720x480    59.940060 Hz  16:9     31.469 kHz     27.000000 MHz
    VIC   4:  1280x720    60.000000 Hz  16:9     45.000 kHz     74.250000 MHz
    VIC  16:  1920x1080   60.000000 Hz  16:9     67.500 kHz    148.500000 MHz (native)
    VIC  47:  1280x720   120.000000 Hz  16:9     90.000 kHz    148.500000 MHz
    VIC  63:  1920x1080  120.000000 Hz  16:9    135.000 kHz    297.000000 MHz
  Audio Data Block:
    Linear PCM:
      Max channels: 2
      Supported sample rates (kHz): 96 48 44.1 32
      Supported sample sizes (bits): 24 20 16
  Speaker Allocation Data Block:
    FL/FR - Front Left/Right
  Vendor-Specific Data Block (HDMI), OUI 00-0C-03:
    Source physical address: 1.0.0.0
    DC_36bit
    DC_30bit
    DC_Y444
    Maximum TMDS clock: 325 MHz
  Vendor-Specific Data Block (HDMI Forum), OUI C4-5D-D8:
    Version: 1
    Maximum TMDS Character Rate: 600 MHz
    SCDC Present
    Supports 12-bits/component Deep Color 4:2:0 Pixel Encoding
    Supports 10-bits/component Deep Color 4:2:0 Pixel Encoding
  Vendor-Specific Data Block (AMD), OUI 00-00-1A:
    Version: 2.3
    Minimum Refresh Rate: 48 Hz
    Maximum Refresh Rate: 165 Hz
    Flags 1.x: 0x00
    Flags 2.x: 0x0f
    Maximum luminance: 98 (417.710 cd/m^2)
    Minimum luminance: 44 (0.124 cd/m^2)
    Maximum luminance (without local dimming): 98 (417.710 cd/m^2)
    Minimum luminance (without local dimming): 44 (0.124 cd/m^2)
  Colorimetry Data Block:
    xvYCC601
    xvYCC709
    BT2020cYCC
    BT2020YCC
    BT2020RGB
    Gamut Boundary Description Metadata Profile P0
  HDR Static Metadata Data Block:
    Electro optical transfer functions:
      Traditional gamma - SDR luminance range
      SMPTE ST2084
      Hybrid Log-Gamma
    Supported static metadata descriptors:
      Static metadata type 1
    Desired content max luminance: 98 (417.710 cd/m^2)
    Desired content max frame-average luminance: 98 (417.710 cd/m^2)
    Desired content min luminance: 44 (0.124 cd/m^2)
  Detailed Timing Descriptors:
    DTD 5:  2560x1440  164.998657 Hz  16:9    242.053 kHz    639.020000 MHz (697 mm x 392 mm)
                 Hfront   24 Hsync  16 Hback   40 Hpol P
                 Vfront    3 Vsync   5 Vback   19 Vpol P
    DTD 6:  2560x1440  119.997589 Hz  16:9    182.996 kHz    497.750000 MHz (697 mm x 392 mm)
                 Hfront   48 Hsync  32 Hback   80 Hpol P
                 Vfront    3 Vsync   5 Vback   77 Vpol P
    DTD 7:  1920x1080  143.852510 Hz  16:9    160.108 kHz    326.620000 MHz (697 mm x 392 mm)
                 Hfront   28 Hsync  32 Hback   60 Hpol P
                 Vfront   19 Vsync   8 Vback    6 Vpol P
Checksum: 0x5b  Unused space in Extension Block: 12 bytes

----------------

Block 5, DisplayID Extension Block:
  Version: 1.2
  Extension Count: 0
  Video Timing Modes Type 1 - Detailed Timings Data Block:
    DTD:  2560x1440  143.856221 Hz  16:9    221.970 kHz    594.880000 MHz (aspect 16:9, no 3D stereo)
               Hfront   28 Hsync  32 Hback   60 Hpol N
               Vfront    9 Vsync   8 Vback   86 Vpol N
  Checksum: 0xa2
Checksum: 0xee  Unused space in Extension Block: 98 bytes

----------------

Warnings:

Block 1, CTA-861 Extension Block:
  IT Video Formats are overscanned by default, but normally this should be underscanned.
  Colorimetry Data Block: Set the sRGB colorimetry bit to avoid interop issues.
  Display Product Serial Number is set, so the Serial Number in the Base EDID should be 0.
Block 4, CTA-861 Extension Block:
  IT Video Formats are overscanned by default, but normally this should be underscanned.
  Colorimetry Data Block: Set the sRGB colorimetry bit to avoid interop issues.
  Display Product Serial Number is set, so the Serial Number in the Base EDID should be 0.
EDID:
  Base EDID: Some timings are out of range of the Monitor Ranges:
    Horizontal Freq: 31.468 - 242.053 kHz (Monitor: 246.000 - 246.000 kHz)

Failures:

Block 1, CTA-861 Extension Block:
  Vendor-Specific Data Block (HDMI), OUI 00-0C-03: The HDMI Specification requires EDID 1.3 instead of 1.4.
  Missing VCDB, needed for Set Selectable RGB Quantization to avoid interop issues.
Block 2, DisplayID Extension Block:
  DisplayID Base Block has no product type.
  Expected 0 DisplayID Extension Block, but got 1.
  Padding: Contains non-zero bytes.
Block 3, Base EDID:
  Unknown Extension Block.
Block 4, CTA-861 Extension Block:
  Video Data Block: Duplicate VIC 1.
  Video Data Block: Duplicate VIC 2.
  Video Data Block: Duplicate VIC 3.
  Video Data Block: Duplicate VIC 4.
  Video Data Block: Duplicate VIC 16.
  Video Data Block: Duplicate VIC 47.
  Video Data Block: Duplicate VIC 63.
  Speaker Allocation Data Block: Only one instance of this Data Block is allowed.
  Vendor-Specific Data Block (HDMI), OUI 00-0C-03: The HDMI Specification requires EDID 1.3 instead of 1.4.
  Vendor-Specific Data Block (HDMI Forum), OUI C4-5D-D8: Duplicate HDMI Forum VSDB/SCDB.
  Colorimetry Data Block: Only one instance of this Data Block is allowed.
  HDR Static Metadata Data Block: Only one instance of this Data Block is allowed.
  Missing VCDB, needed for Set Selectable RGB Quantization to avoid interop issues.
Block 5, DisplayID Extension Block:
  Padding: Contains non-zero bytes.
EDID:
  Base EDID: EDID specified 2 extension block(s), but found 5 extension block(s).
  CTA-861: Native progressive timings are a mix of several resolutions.
  DisplayID: Missing DisplayID Product Identification Data Block.
  DisplayID: DisplayID expects at least one preferred timing.

EDID conformity: FAIL
