edid-decode (hex):

00 ff ff ff ff ff ff 00 04 72 13 01 85 25 10 23
1f 16 01 03 68 33 1d 78 2a c2 a5 a4 56 4d 9c 25
11 50 54 b3 0c 00 71 4f 81 00 81 80 95 00 b3 00
d1 c0 01 01 01 01 02 3a 80 18 71 38 2d 40 58 2c
45 00 fe 1f 11 00 00 1e 00 00 00 fd 00 38 4b 1e
53 11 00 0a 20 20 20 20 20 20 00 00 00 fc 00 41
63 65 72 20 47 32 33 35 48 0a 20 20 00 00 00 ff
00 4c 4a 4b 30 57 30 32 32 34 33 32 30 0a 00 67

00 ff ff ff ff ff ff 00 04 72 13 01 85 25 10 23
1f 16 01 03 68 33 1d 78 2a c2 a5 a4 56 4d 9c 25
11 50 54 b3 0c 00 71 4f 81 00 81 80 95 00 b3 00
d1 c0 01 01 01 01 02 3a 80 18 71 38 2d 40 58 2c
45 00 fe 1f 11 00 00 1e 00 00 00 fd 00 38 4b 1e
53 11 00 0a 20 20 20 20 20 20 00 00 00 fc 00 41
63 65 72 20 47 32 33 35 48 0a 20 20 00 00 00 ff
00 4c 4a 4b 30 57 30 32 32 34 33 32 30 0a 00 67

----------------

Block 0, Base EDID:
  EDID Structure Version & Revision: 1.3
  Vendor & Product Identification:
    Manufacturer: ACR
    Model: 275
    Serial Number: ...
    Made in: week 31 of 2012
  Basic Display Parameters & Features:
    Analog display
    Signal Level Standard: 0.700 : 0.000 : 0.700 V p-p
    Blank level equals black level
    Sync: Separate
    Maximum image size: 51 cm x 29 cm
    Gamma: 2.20
    DPMS levels: Off
    RGB color display
    First detailed timing is the preferred timing
  Color Characteristics:
    Red  : 0.6435, 0.3359
    Green: 0.3007, 0.6113
    Blue : 0.1464, 0.0683
    White: 0.3134, 0.3291
  Established Timings I & II:
    IBM     :   720x400    70.081663 Hz   9:5     31.467 kHz     28.320000 MHz
    DMT 0x04:   640x480    59.940476 Hz   4:3     31.469 kHz     25.175000 MHz
    Apple   :   640x480    66.666667 Hz   4:3     35.000 kHz     30.240000 MHz
    DMT 0x08:   800x600    56.250000 Hz   4:3     35.156 kHz     36.000000 MHz
    DMT 0x09:   800x600    60.316541 Hz   4:3     37.879 kHz     40.000000 MHz
    DMT 0x10:  1024x768    60.003840 Hz   4:3     48.363 kHz     65.000000 MHz
    DMT 0x11:  1024x768    70.069359 Hz   4:3     56.476 kHz     75.000000 MHz
  Standard Timings:
    DMT 0x15:  1152x864    75.000000 Hz   4:3     67.500 kHz    108.000000 MHz
    DMT 0x1c:  1280x800    59.810326 Hz  16:10    49.702 kHz     83.500000 MHz
    DMT 0x23:  1280x1024   60.019740 Hz   5:4     63.981 kHz    108.000000 MHz
    DMT 0x2f:  1440x900    59.887445 Hz  16:10    55.935 kHz    106.500000 MHz
    DMT 0x3a:  1680x1050   59.954250 Hz  16:10    65.290 kHz    146.250000 MHz
    DMT 0x52:  1920x1080   60.000000 Hz  16:9     67.500 kHz    148.500000 MHz
  Detailed Timing Descriptors:
    DTD 1:  1920x1080   60.000000 Hz  16:9     67.500 kHz    148.500000 MHz (510 mm x 287 mm)
                 Hfront   88 Hsync  44 Hback  148 Hpol P
                 Vfront    4 Vsync   5 Vback   36 Vpol P
    Display Range Limits:
      Monitor ranges (GTF): 56-75 Hz V, 30-83 kHz H, max dotclock 170 MHz
    Display Product Name: 'Acer G235H'
    Display Product Serial Number: ...
Checksum: 0x67

----------------

Block 1, Unknown EDID Extension Block 0x00:
  00 ff ff ff ff ff ff 00 04 72 13 01 85 25 10 23 '.........r...%.#'
  1f 16 01 03 68 33 1d 78 2a c2 a5 a4 56 4d 9c 25 '....h3.x*...VM.%'
  11 50 54 b3 0c 00 71 4f 81 00 81 80 95 00 b3 00 '.PT...qO........'
  d1 c0 01 01 01 01 02 3a 80 18 71 38 2d 40 58 2c '.......:..q8-@X,'
  45 00 fe 1f 11 00 00 1e 00 00 00 fd 00 38 4b 1e 'E............8K.'
  53 11 00 0a 20 20 20 20 20 20 00 00 00 fc 00 41 'S...      .....A'
  63 65 72 20 47 32 33 35 48 0a 20 20 00 00 00 ff 'cer G235H.  ....'
  00 4c 4a 4b 30 57 30 32 32 34 33 32 30 0a 00 67 '.LJK0W0224320..g'
Checksum: 0x67

----------------

Failures:

Block 1, Base EDID:
  Unknown Extension Block.
EDID:
  Base EDID: EDID specified 0 extension block(s), but found 1 extension block(s).

EDID conformity: FAIL
