
EDID (hex):
00ffffffffffff0010ac79a14c524330
101f0104b53c23783b8ed1ad5043ae25
0e505421080001010101010101010101
010101010101055f00a0a0a033503020
35005b5b2100001a000000ff00234844
45594d78677741416777000000fd0001
f0ffff6a010a202020202020000000fc
0044656c6c20415732373231440a02c9
020320f12309070183010000654b0400
0101e305c000e2006ae606050178601f
5aa000a0a0a04650302035005b5b2100
001a6fc200a0a0a05550302035005b5b
2100001a79e90082a0a0675008203500
5b5b2100001a00000000000000000000
00000000000000000000000000000000
00000000000000000000000000000064
70137903000f000aa4140e0e07012045
000002010d31d91a503c94ae5b320e01
455403012802510104ff099f002f801f
009f05910002000400ca9c0104ff099f
002f801f009f05b20002000400000000
00000000000000000000000000000000
00000000000000000000000000000000
00000000000000000000000000007090

Extracted contents:
header:          00 ff ff ff ff ff ff 00
serial number:   10 ac 79 a1 4c 52 43 30 10 1f
version:         01 04
basic params:    b5 3c 23 78 3b
chroma info:     8e d1 ad 50 43 ae 25 0e 50 54
established:     21 08 00
standard:        01 01 01 01 01 01 01 01 01 01 01 01 01 01 01 01
descriptor 1:    05 5f 00 a0 a0 a0 33 50 30 20 35 00 5b 5b 21 00 00 1a
descriptor 2:    00 00 00 ff 00 23 48 44 45 59 4d 78 67 77 41 41 67 77
descriptor 3:    00 00 00 fd 00 01 f0 ff ff 6a 01 0a 20 20 20 20 20 20
descriptor 4:    00 00 00 fc 00 44 65 6c 6c 20 41 57 32 37 32 31 44 0a
extensions:      02
checksum:        c9

EDID version: 1.4
Manufacturer: DEL Model a179 Serial Number --
Made in week 16 of 2021
Digital display
10 bits per primary color channel
DisplayPort interface
Maximum image size: 60 cm x 35 cm
Gamma: 2.20
DPMS levels: Off
Supported color formats: RGB 4:4:4, YCrCb 4:4:4, YCrCb 4:2:2
First detailed timing includes the native pixel format and preferred refresh rate
Display is continuous frequency
Display x,y Chromaticity:
  Red:   0.6777, 0.3125
  Green: 0.2646, 0.6816
  Blue:  0.1474, 0.0556
  White: 0.3125, 0.3291
Established timings supported:
  640x480@60Hz 4:3 HorFreq: 31469 Hz Clock: 25.175 MHz
  800x600@60Hz 4:3 HorFreq: 37900 Hz Clock: 40.000 MHz
  1024x768@60Hz 4:3 HorFreq: 48400 Hz Clock: 65.000 MHz
Standard timings supported:
Detailed mode: Clock 243.250 MHz, 603 mm x 347 mm
               2560 2608 2640 2720 hborder 0
               1440 1443 1448 1491 vborder 0
               +hsync -vsync 
               VertFreq: 59 Hz, HorFreq: 89430 Hz
Serial number: --
Monitor ranges (bare limits): 1-240Hz V, 255-255kHz H, max dotclock 1060MHz
Monitor name: Dell AW2721D
Has 2 extension blocks
Checksum: 0xc9 (valid)

CTA extension block
Extension version: 3
28 bytes of CTA data
  Audio data block
    Linear PCM, max channels 2
      Supported sample rates (kHz): 48 44.1 32
      Supported sample sizes (bits): 16
  Speaker allocation data block
    Speaker map:
      FL/FR - Front Left/Right
  Vendor-specific data block, OUI 00044b
  Extended tag: Colorimetry data block
    BT2020YCC
    BT2020RGB
  Extended tag: Video capability data block
    YCbCr quantization: No Data (0)
    RGB quantization: Selectable (via AVI Q) (1)
    PT scan behaviour: Always Underscanned (2)
    IT scan behaviour: Always Underscanned (2)
    CE scan behaviour: Always Underscanned (2)
  Extended tag: HDR static metadata data block
    Electro optical transfer functions:
      Traditional gamma - SDR luminance range
      SMPTE ST2084
    Supported static metadata descriptors:
      Static metadata type 1
    Desired content max luminance: 120 (672.717 cd/m^2)
    Desired content max frame-average luminance: 96 (400.000 cd/m^2)
    Desired content min luminance: 31 (0.099 cd/m^2)
Underscans PC formats by default
Basic audio support
Supports YCbCr 4:4:4
Supports YCbCr 4:2:2
1 native detailed modes
Detailed mode: Clock 410.500 MHz, 603 mm x 347 mm
               2560 2608 2640 2720 hborder 0
               1440 1443 1448 1510 vborder 0
               +hsync -vsync 
               VertFreq: 99 Hz, HorFreq: 150919 Hz
Detailed mode: Clock 497.750 MHz, 603 mm x 347 mm
               2560 2608 2640 2720 hborder 0
               1440 1443 1448 1525 vborder 0
               +hsync -vsync 
               VertFreq: 119 Hz, HorFreq: 182996 Hz
Detailed mode: Clock 597.690 MHz, 603 mm x 347 mm
               2560 2568 2600 2690 hborder 0
               1440 1443 1448 1543 vborder 0
               +hsync -vsync 
               VertFreq: 143 Hz, HorFreq: 222189 Hz
Checksum: 0x64 (valid)


DisplayID extension block
Extension version: 19
Length 121, version 19, extension count 0
Checksum: 0x70 (valid)
Display interface
Color characteristics block
Type 1 detailed timing: aspect: 16:9,  
Detailed mode: Clock 862.740 MHz, 0 mm x 0 mm
               2559 2606 2637 2718
               1439 1441 1445 1584
               +hsync -vsync
Type 1 detailed timing: aspect: 16:9,  
Detailed mode: Clock 1056.740 MHz, 0 mm x 0 mm
               2559 2606 2637 2718
               1439 1441 1445 1617
               +hsync -vsync

Warning: One or more of the timings is out of range of the Monitor Ranges:
  Vertical Freq: 59 - 143 Hz
  Horizontal Freq: 31469 - 222189 Hz
  Maximum Clock: 597.690 MHz
EDID block does not conform at all!
	Both the serial number and the serial string are set


