edid-decode (hex):

00 ff ff ff ff ff ff 00 30 e4 c5 01 00 00 00 00
00 14 01 04 90 1d 10 78 02 2f 15 97 59 55 8c 27
23 50 54 00 00 00 01 01 01 01 01 01 01 01 01 01
01 01 01 01 01 01 12 1b 56 64 50 00 12 30 20 20
35 00 25 a5 10 00 00 1a 0c 12 56 64 50 00 12 30
20 20 35 00 25 a5 10 00 00 1a 00 00 00 fe 00 35
30 34 59 39 80 31 33 33 57 48 31 0a 00 00 00 00
00 00 41 01 96 00 00 00 00 01 01 0a 20 20 00 d6

----------------

Block 0, Base EDID:
  EDID Structure Version & Revision: 1.4
  Vendor & Product Identification:
    Manufacturer: LGD
    Model: 453
    Made in: 2010
  Basic Display Parameters & Features:
    Digital display
    Bits per primary color channel: 6
    Digital interface is not defined
    Maximum image size: 29 cm x 16 cm
    Gamma: 2.20
    Supported color formats: RGB 4:4:4
    First detailed timing includes the native pixel format and preferred refresh rate
  Color Characteristics:
    Red  : 0.5898, 0.3496
    Green: 0.3349, 0.5498
    Blue : 0.1523, 0.1376
    White: 0.3134, 0.3291
  Established Timings I & II: none
  Standard Timings: none
  Detailed Timing Descriptors:
    DTD 1:  1366x768    60.142 Hz 683:384  47.271 kHz  69.300 MHz (293 mm x 165 mm)
                 Hfront   32 Hsync  32 Hback  36 Hpol P
                 Vfront    3 Vsync   5 Vback  10 Vpol N
    DTD 2:  1366x768    40.095 Hz 683:384  31.514 kHz  46.200 MHz (293 mm x 165 mm)
                 Hfront   32 Hsync  32 Hback  36 Hpol P
                 Vfront    3 Vsync   5 Vback  10 Vpol N
    Alphanumeric Data String: '504Y9'
    Manufacturer-Specified Display Descriptor (0x00): 00 00 00 00 41 01 96 00 00 00 00 01 01 0a 20 20 '....A.........  '
Checksum: 0xd6

----------------

Failures:

Block 0, Base EDID:
  Alphanumeric Data String: Non-printable character.
  Missing Display Product Name.

EDID conformity: FAIL
