
EDID (hex):
00ffffffffffff004c2d5a70574a5843
131f0103804628782a43a5b14c47a625
105054bfef80714f810081c081809500
a9c0b300010198e200a0a0a029500840
3500ba892100001a000000fd0030901e
d63b000a202020202020000000fc004c
433332473778540a20202020000000ff
0048345a523530303637310a202001c5
020337f144903f1f0423090707830100
00e305c00067030c001000b83c67d85d
c4017680006d1a0000020f3090000473
175c1ee3060501565e00a0a0a0295030
203500ba892100001a6fc200a0a0a055
5030203500ba892100001a5a8780a070
384d4030203500ba892100001a023a80
1871382d40582c4500ba892100001ee0

Extracted contents:
header:          00 ff ff ff ff ff ff 00
serial number:   4c 2d 5a 70 57 4a 58 43 13 1f
version:         01 03
basic params:    80 46 28 78 2a
chroma info:     43 a5 b1 4c 47 a6 25 10 50 54
established:     bf ef 80
standard:        71 4f 81 00 81 c0 81 80 95 00 a9 c0 b3 00 01 01
descriptor 1:    98 e2 00 a0 a0 a0 29 50 08 40 35 00 ba 89 21 00 00 1a
descriptor 2:    00 00 00 fd 00 30 90 1e d6 3b 00 0a 20 20 20 20 20 20
descriptor 3:    00 00 00 fc 00 4c 43 33 32 47 37 78 54 0a 20 20 20 20
descriptor 4:    00 00 00 ff 00 48 34 5a 52 35 30 30 36 37 31 0a 20 20
extensions:      01
checksum:        c5

EDID version: 1.3
Manufacturer: SAM Model 705a Serial Number --
Made in week 19 of 2021
Digital display
Maximum image size: 70 cm x 40 cm
Gamma: 2.20
DPMS levels: Off
RGB color display
First detailed timing is preferred timing
Display x,y Chromaticity:
  Red:   0.6923, 0.2968
  Green: 0.2773, 0.6513
  Blue:  0.1464, 0.0644
  White: 0.3134, 0.3291
Established timings supported:
  720x400@70Hz 9:5 HorFreq: 31469 Hz Clock: 28.320 MHz
  640x480@60Hz 4:3 HorFreq: 31469 Hz Clock: 25.175 MHz
  640x480@67Hz 4:3 HorFreq: 35000 Hz Clock: 30.240 MHz
  640x480@72Hz 4:3 HorFreq: 37900 Hz Clock: 31.500 MHz
  640x480@75Hz 4:3 HorFreq: 37500 Hz Clock: 31.500 MHz
  800x600@56Hz 4:3 HorFreq: 35200 Hz Clock: 36.000 MHz
  800x600@60Hz 4:3 HorFreq: 37900 Hz Clock: 40.000 MHz
  800x600@72Hz 4:3 HorFreq: 48100 Hz Clock: 50.000 MHz
  800x600@75Hz 4:3 HorFreq: 46900 Hz Clock: 49.500 MHz
  832x624@75Hz 4:3 HorFreq: 49726 Hz Clock: 57.284 MHz
  1024x768@60Hz 4:3 HorFreq: 48400 Hz Clock: 65.000 MHz
  1024x768@70Hz 4:3 HorFreq: 56500 Hz Clock: 75.000 MHz
  1024x768@75Hz 4:3 HorFreq: 60000 Hz Clock: 78.750 MHz
  1280x1024@75Hz 5:4 HorFreq: 80000 Hz Clock: 135.000 MHz
  1152x870@75Hz 192:145 HorFreq: 67500 Hz Clock: 108.000 MHz
Standard timings supported:
  1152x864@75Hz 4:3 HorFreq: 67500 Hz Clock: 108.000 MHz
  1280x800@60Hz 16:10
  1280x720@60Hz 16:9
  1280x1024@60Hz 5:4 HorFreq: 64000 Hz Clock: 108.000 MHz
  1440x900@60Hz 16:10 HorFreq: 55500 Hz Clock: 88.750 MHz
  1600x900@60Hz 16:9
  1680x1050@60Hz 16:10 HorFreq: 64700 Hz Clock: 119.000 MHz
Detailed mode: Clock 580.080 MHz, 698 mm x 393 mm
               2560 2568 2632 2720 hborder 0
               1440 1443 1448 1481 vborder 0
               +hsync -vsync 
               VertFreq: 144 Hz, HorFreq: 213264 Hz
Monitor ranges (GTF): 48-144Hz V, 30-214kHz H, max dotclock 590MHz
Monitor name: LC32G7xT
Serial number: --
Has 1 extension blocks
Checksum: 0xc5 (valid)

CTA extension block
Extension version: 3
51 bytes of CTA data
  Video data block
    VIC  16 1920x1080@60Hz 16:9 (native) HorFreq: 67500 Hz Clock: 148.500 MHz
    VIC  63 1920x1080@120Hz 16:9  HorFreq: 135000 Hz Clock: 297.000 MHz
    VIC  31 1920x1080@50Hz 16:9  HorFreq: 56250 Hz Clock: 148.500 MHz
    VIC   4 1280x720@60Hz 16:9  HorFreq: 45000 Hz Clock: 74.250 MHz
  Audio data block
    Linear PCM, max channels 2
      Supported sample rates (kHz): 48 44.1 32
      Supported sample sizes (bits): 24 20 16
  Speaker allocation data block
    Speaker map:
      FL/FR - Front Left/Right
  Extended tag: Colorimetry data block
    BT2020YCC
    BT2020RGB
  Vendor-specific data block, OUI 000c03 (HDMI)
    Source physical address 1.0.0.0
    Supports_AI
    DC_36bit
    DC_30bit
    DC_Y444
    Maximum TMDS clock: 300MHz
  Vendor-specific data block, OUI c45dd8 (HDMI Forum)
    Version: 1
    Maximum TMDS Character Rate: 590MHz
    SCDC Present
  Vendor-specific data block, OUI 00001a
  Extended tag: HDR static metadata data block
    Electro optical transfer functions:
      Traditional gamma - SDR luminance range
      SMPTE ST2084
    Supported static metadata descriptors:
      Static metadata type 1
Underscans PC formats by default
Basic audio support
Supports YCbCr 4:4:4
Supports YCbCr 4:2:2
1 native detailed modes
Detailed mode: Clock 241.500 MHz, 698 mm x 393 mm
               2560 2608 2640 2720 hborder 0
               1440 1443 1448 1481 vborder 0
               +hsync -vsync 
               VertFreq: 59 Hz, HorFreq: 88786 Hz
Detailed mode: Clock 497.750 MHz, 698 mm x 393 mm
               2560 2608 2640 2720 hborder 0
               1440 1443 1448 1525 vborder 0
               +hsync -vsync 
               VertFreq: 119 Hz, HorFreq: 182996 Hz
Detailed mode: Clock 346.500 MHz, 698 mm x 393 mm
               1920 1968 2000 2080 hborder 0
               1080 1083 1088 1157 vborder 0
               +hsync -vsync 
               VertFreq: 143 Hz, HorFreq: 166586 Hz
Checksum: 0xe0 (valid)

EDID block does not conform at all!
	Both the serial number and the serial string are set


