edid-decode (hex):

00 ff ff ff ff ff ff 00 32 0c 01 1d 00 00 00 00
00 11 01 03 80 1d 12 78 0a 2f 30 97 58 53 8b 29
25 50 54 00 00 00 01 01 01 01 01 01 01 01 01 01
01 01 01 01 01 01 12 1b 00 88 50 20 11 30 30 20
46 00 1e b3 10 00 00 18 00 00 00 01 00 06 10 20
00 00 00 00 00 00 00 00 0a 20 00 00 00 fe 00 4c
47 50 68 69 6c 69 70 73 4c 43 44 0a 00 00 00 fe
00 4c 50 31 33 33 57 58 31 2d 54 4c 4e 31 00 3c

----------------

Block 0, Base EDID:
  EDID Structure Version & Revision: 1.3
  Vendor & Product Identification:
    Manufacturer: LPL
    Model: 7425
    Made in: 2007
  Basic Display Parameters & Features:
    Digital display
    Maximum image size: 29 cm x 18 cm
    Gamma: 2.20
    RGB color display
    First detailed timing is preferred timing
  Color Characteristics:
    Red  : 0.5898, 0.3457
    Green: 0.3271, 0.5458
    Blue : 0.1601, 0.1474
    White: 0.3125, 0.3281
  Established Timings I & II: none
  Standard Timings: none
  Detailed Timing Descriptors:
    DTD 1:  1280x800    59.903 Hz   8:5    48.941 kHz  69.300 MHz (286 mm x 179 mm)
                 Hfront   48 Hsync  32 Hback  56 Hpol N
                 Vfront    4 Vsync   6 Vback   7 Vpol N
    Manufacturer-Specified Display Descriptor (0x01): 00 01 00 06 10 20 00 00 00 00 00 00 00 00 0a 20 '..... ......... '
    Alphanumeric Data String: 'LGPhilipsLCD'
    Alphanumeric Data String: 'LP133WX1-TLN1'
Checksum: 0x3c
