
EDID (hex):
00ffffffffffff0022f0122601010101
2b0f01030f291f78ea60e5a3574b9c25
115054a56f8031594559615981408180
8199a940a94f483f403062b0324040c0
130098321100001e000000fd0030551e
5e15000a202020202020000000fc0068
70204c323033350a20202020000000ff
00485550353433593143430a202000b4

Extracted contents:
header:          00 ff ff ff ff ff ff 00
serial number:   22 f0 12 26 01 01 01 01 2b 0f
version:         01 03
basic params:    0f 29 1f 78 ea
chroma info:     60 e5 a3 57 4b 9c 25 11 50 54
established:     a5 6f 80
standard:        31 59 45 59 61 59 81 40 81 80 81 99 a9 40 a9 4f
descriptor 1:    48 3f 40 30 62 b0 32 40 40 c0 13 00 98 32 11 00 00 1e
descriptor 2:    00 00 00 fd 00 30 55 1e 5e 15 00 0a 20 20 20 20 20 20
descriptor 3:    00 00 00 fc 00 68 70 20 4c 32 30 33 35 0a 20 20 20 20
descriptor 4:    00 00 00 ff 00 48 55 50 35 34 33 59 31 43 43 0a 20 20
extensions:      00
checksum:        b4

EDID version: 1.3
Manufacturer: HWP Model 2612 Serial Number --
Analog display, Input voltage level: 0.7/0.3 V
Sync: Separate Composite SyncOnGreen Serration 
Maximum image size: 41 cm x 31 cm
Gamma: 2.20
DPMS levels: Standby Suspend Off
RGB color display
First detailed timing is preferred timing
Display x,y Chromaticity:
  Red:   0.6376, 0.3417
  Green: 0.2929, 0.6093
  Blue:  0.1474, 0.0683
  White: 0.3134, 0.3291
Established timings supported:
  720x400@70Hz 9:5 HorFreq: 31469 Hz Clock: 28.320 MHz
  640x480@60Hz 4:3 HorFreq: 31469 Hz Clock: 25.175 MHz
  640x480@75Hz 4:3 HorFreq: 37500 Hz Clock: 31.500 MHz
  800x600@60Hz 4:3 HorFreq: 37900 Hz Clock: 40.000 MHz
  800x600@75Hz 4:3 HorFreq: 46900 Hz Clock: 49.500 MHz
  832x624@75Hz 4:3 HorFreq: 49726 Hz Clock: 57.284 MHz
  1024x768@60Hz 4:3 HorFreq: 48400 Hz Clock: 65.000 MHz
  1024x768@70Hz 4:3 HorFreq: 56500 Hz Clock: 75.000 MHz
  1024x768@75Hz 4:3 HorFreq: 60000 Hz Clock: 78.750 MHz
  1280x1024@75Hz 5:4 HorFreq: 80000 Hz Clock: 135.000 MHz
  1152x870@75Hz 192:145 HorFreq: 67500 Hz Clock: 108.000 MHz
Standard timings supported:
  640x480@85Hz 4:3 HorFreq: 43300 Hz Clock: 36.000 MHz
  800x600@85Hz 4:3 HorFreq: 53700 Hz Clock: 56.250 MHz
  1024x768@85Hz 4:3 HorFreq: 68700 Hz Clock: 94.500 MHz
  1280x960@60Hz 4:3 HorFreq: 60000 Hz Clock: 108.000 MHz
  1280x1024@60Hz 5:4 HorFreq: 64000 Hz Clock: 108.000 MHz
  1280x1024@85Hz 5:4 HorFreq: 91100 Hz Clock: 157.500 MHz
  1600x1200@60Hz 4:3 HorFreq: 75000 Hz Clock: 162.000 MHz
  1600x1200@75Hz 4:3 HorFreq: 93800 Hz Clock: 202.500 MHz
Detailed mode: Clock 162.000 MHz, 408 mm x 306 mm
               1600 1664 1856 2160 hborder 0
               1200 1201 1204 1250 vborder 0
               +hsync +vsync 
               VertFreq: 60 Hz, HorFreq: 75000 Hz
Monitor ranges (GTF): 48-85Hz V, 30-94kHz H, max dotclock 210MHz
Monitor name: hp L2035
Serial number: --
Checksum: 0xb4 (valid)
EDID block does not conform at all!
	Bad year of manufacture
