
EDID (hex):
00ffffffffffff004c23002701000000
021c0104b53c21783b8e05ad4f33b026
0d5054a74b0081c081809500a9c0b300
d1c001010101565e00a0a0a029503020
350055502100001a8f2e00a0a0a01550
3020350055502100001a000000fd001e
90dfdf08010a202020202020000000fc
0044505f4652454553594e430a200136
020318754b909f859404130312010211
2309070783010000023a80d072382d40
102c9680565021000018023a80187138
2d40582c9600565021000018011d00bc
52d01e20b828554056502100001ed3bc
00a0a0a029503040350056502100001a
9ee00078a0a032503040350056502100
001a00000000000000000000000000e6

Extracted contents:
header:          00 ff ff ff ff ff ff 00
serial number:   4c 23 00 27 01 00 00 00 02 1c
version:         01 04
basic params:    b5 3c 21 78 3b
chroma info:     8e 05 ad 4f 33 b0 26 0d 50 54
established:     a7 4b 00
standard:        81 c0 81 80 95 00 a9 c0 b3 00 d1 c0 01 01 01 01
descriptor 1:    56 5e 00 a0 a0 a0 29 50 30 20 35 00 55 50 21 00 00 1a
descriptor 2:    8f 2e 00 a0 a0 a0 15 50 30 20 35 00 55 50 21 00 00 1a
descriptor 3:    00 00 00 fd 00 1e 90 df df 08 01 0a 20 20 20 20 20 20
descriptor 4:    00 00 00 fc 00 44 50 5f 46 52 45 45 53 59 4e 43 0a 20
extensions:      01
checksum:        36

EDID version: 1.4
Manufacturer: SAC Model 2700 Serial Number --
Made in week 2 of 2018
Digital display
10 bits per primary color channel
DisplayPort interface
Maximum image size: 60 cm x 33 cm
Gamma: 2.20
DPMS levels: Off
Supported color formats: RGB 4:4:4, YCrCb 4:4:4, YCrCb 4:2:2
First detailed timing includes the native pixel format and preferred refresh rate
Display is continuous frequency
Display x,y Chromaticity:
  Red:   0.6777, 0.3085
  Green: 0.2021, 0.6894
  Blue:  0.1484, 0.0507
  White: 0.3134, 0.3291
Established timings supported:
  720x400@70Hz 9:5 HorFreq: 31469 Hz Clock: 28.320 MHz
  640x480@60Hz 4:3 HorFreq: 31469 Hz Clock: 25.175 MHz
  640x480@75Hz 4:3 HorFreq: 37500 Hz Clock: 31.500 MHz
  800x600@56Hz 4:3 HorFreq: 35200 Hz Clock: 36.000 MHz
  800x600@60Hz 4:3 HorFreq: 37900 Hz Clock: 40.000 MHz
  800x600@75Hz 4:3 HorFreq: 46900 Hz Clock: 49.500 MHz
  1024x768@60Hz 4:3 HorFreq: 48400 Hz Clock: 65.000 MHz
  1024x768@75Hz 4:3 HorFreq: 60000 Hz Clock: 78.750 MHz
  1280x1024@75Hz 5:4 HorFreq: 80000 Hz Clock: 135.000 MHz
Standard timings supported:
  1280x720@60Hz 16:9
  1280x1024@60Hz 5:4 HorFreq: 64000 Hz Clock: 108.000 MHz
  1440x900@60Hz 16:10 HorFreq: 55500 Hz Clock: 88.750 MHz
  1600x900@60Hz 16:9
  1680x1050@60Hz 16:10 HorFreq: 64700 Hz Clock: 119.000 MHz
  1920x1080@60Hz 16:9
Detailed mode: Clock 241.500 MHz, 597 mm x 336 mm
               2560 2608 2640 2720 hborder 0
               1440 1443 1448 1481 vborder 0
               +hsync -vsync 
               VertFreq: 59 Hz, HorFreq: 88786 Hz
Detailed mode: Clock 119.190 MHz, 597 mm x 336 mm
               2560 2608 2640 2720 hborder 0
               1440 1443 1448 1461 vborder 0
               +hsync -vsync 
               VertFreq: 29 Hz, HorFreq: 43819 Hz
Monitor ranges (bare limits): 30-144Hz V, 223-223kHz H, max dotclock 80MHz
Monitor name: DP_FREESYNC
Has 1 extension blocks
Checksum: 0x36 (valid)

CTA extension block
Extension version: 3
20 bytes of CTA data
  Video data block
    VIC  16 1920x1080@60Hz 16:9 (native) HorFreq: 67500 Hz Clock: 148.500 MHz
    VIC  31 1920x1080@50Hz 16:9 (native) HorFreq: 56250 Hz Clock: 148.500 MHz
    VIC   5 1920x1080i@60Hz 16:9 (native) HorFreq: 33750 Hz Clock: 74.250 MHz
    VIC  20 1920x1080i@50Hz 16:9 (native) HorFreq: 28125 Hz Clock: 74.250 MHz
    VIC   4 1280x720@60Hz 16:9  HorFreq: 45000 Hz Clock: 74.250 MHz
    VIC  19 1280x720@50Hz 16:9  HorFreq: 37500 Hz Clock: 74.250 MHz
    VIC   3 720x480@60Hz 16:9  HorFreq: 31469 Hz Clock: 27.000 MHz
    VIC  18 720x576@50Hz 16:9  HorFreq: 31250 Hz Clock: 27.000 MHz
    VIC   1 640x480@60Hz 4:3  HorFreq: 31469 Hz Clock: 25.175 MHz
    VIC   2 720x480@60Hz 4:3  HorFreq: 31469 Hz Clock: 27.000 MHz
    VIC  17 720x576@50Hz 4:3  HorFreq: 31250 Hz Clock: 27.000 MHz
  Audio data block
    Linear PCM, max channels 2
      Supported sample rates (kHz): 48 44.1 32
      Supported sample sizes (bits): 24 20 16
  Speaker allocation data block
    Speaker map:
      FL/FR - Front Left/Right
Basic audio support
Supports YCbCr 4:4:4
Supports YCbCr 4:2:2
5 native detailed modes
Detailed mode: Clock 148.500 MHz, 598 mm x 336 mm
               1920 2448 2492 2640 hborder 0
               1080 1089 1095 1125 vborder 0
               -hsync -vsync 
               VertFreq: 50 Hz, HorFreq: 56250 Hz
Detailed mode: Clock 148.500 MHz, 598 mm x 336 mm
               1920 2008 2052 2200 hborder 0
               1080 1089 1095 1125 vborder 0
               -hsync -vsync 
               VertFreq: 60 Hz, HorFreq: 67500 Hz
Detailed mode: Clock 74.250 MHz, 598 mm x 336 mm
               1280 1720 1760 1980 hborder 0
                720  725  730  750 vborder 0
               +hsync +vsync 
               VertFreq: 50 Hz, HorFreq: 37500 Hz
Detailed mode: Clock 483.390 MHz, 598 mm x 336 mm
               2560 2608 2672 2720 hborder 0
               1440 1443 1448 1481 vborder 0
               +hsync -vsync 
               VertFreq: 119 Hz, HorFreq: 177716 Hz
Detailed mode: Clock 575.020 MHz, 598 mm x 336 mm
               2560 2608 2672 2680 hborder 0
               1440 1443 1448 1490 vborder 0
               +hsync -vsync 
               VertFreq: 143 Hz, HorFreq: 214559 Hz
Checksum: 0xe6 (valid)

Warning: One or more of the timings is out of range of the Monitor Ranges:
  Vertical Freq: 29 - 143 Hz
  Horizontal Freq: 28125 - 214559 Hz
  Maximum Clock: 575.020 MHz


