
EDID (hex):
00ffffffffffff004c23002701000000
0f1f0104a53c21783b87e5a654549f26
0d5054afcf008180b300950081809500
61404540b300023a801871382d40582c
4500584a2100001e000000ff00303030
3030303031303030300a000000fd0030
a5a3a328010a202020202020000000fc
0044500a20202020202020202020015d
020321f15090000403020700011f1213
00000011002309070783010000e30503
017d8480c870381f40582c4500dd0c11
00001e686e80c870381f40582c450058
4a2100001e8c0ad08a20e02d10103e96
00064421000018cf9780c870381f4058
2c4500dd0c1100001e00000000000000
000000000000000000000000000000cf

edid-decode (hex):

00 ff ff ff ff ff ff 00 4c 23 00 27 01 00 00 00
0f 1f 01 04 a5 3c 21 78 3b 87 e5 a6 54 54 9f 26
0d 50 54 af cf 00 81 80 b3 00 95 00 81 80 95 00
61 40 45 40 b3 00 02 3a 80 18 71 38 2d 40 58 2c
45 00 58 4a 21 00 00 1e 00 00 00 ff 00 30 30 30
30 30 30 30 31 30 30 30 30 0a 00 00 00 fd 00 30
a5 a3 a3 28 01 0a 20 20 20 20 20 20 00 00 00 fc
00 44 50 0a 20 20 20 20 20 20 20 20 20 20 01 5d

02 03 21 f1 50 90 00 04 03 02 07 00 01 1f 12 13
00 00 00 11 00 23 09 07 07 83 01 00 00 e3 05 03
01 7d 84 80 c8 70 38 1f 40 58 2c 45 00 dd 0c 11
00 00 1e 68 6e 80 c8 70 38 1f 40 58 2c 45 00 58
4a 21 00 00 1e 8c 0a d0 8a 20 e0 2d 10 10 3e 96
00 06 44 21 00 00 18 cf 97 80 c8 70 38 1f 40 58
2c 45 00 dd 0c 11 00 00 1e 00 00 00 00 00 00 00
00 00 00 00 00 00 00 00 00 00 00 00 00 00 00 cf

----------------

Block 0, Base EDID:
  EDID Structure Version & Revision: 1.4
  Vendor & Product Identification:
    Manufacturer: SAC
    Model: 9984
    Serial Number: 1
    Made in: week 15 of 2021
  Basic Display Parameters & Features:
    Digital display
    Bits per primary color channel: 8
    DisplayPort interface
    Maximum image size: 60 cm x 33 cm
    Gamma: 2.20
    DPMS levels: Off
    Supported color formats: RGB 4:4:4, YCrCb 4:4:4, YCrCb 4:2:2
    First detailed timing includes the native pixel format and preferred refresh rate
    Display is continuous frequency
  Color Characteristics:
    Red  : 0.6503, 0.3281
    Green: 0.3291, 0.6240
    Blue : 0.1513, 0.0527
    White: 0.3134, 0.3291
  Established Timings I & II:
    IBM     :   720x400    70.081663 Hz   9:5     31.467 kHz     28.320000 MHz
    DMT 0x04:   640x480    59.940476 Hz   4:3     31.469 kHz     25.175000 MHz
    DMT 0x05:   640x480    72.808802 Hz   4:3     37.861 kHz     31.500000 MHz
    DMT 0x06:   640x480    75.000000 Hz   4:3     37.500 kHz     31.500000 MHz
    DMT 0x08:   800x600    56.250000 Hz   4:3     35.156 kHz     36.000000 MHz
    DMT 0x09:   800x600    60.316541 Hz   4:3     37.879 kHz     40.000000 MHz
    DMT 0x0a:   800x600    72.187572 Hz   4:3     48.077 kHz     50.000000 MHz
    DMT 0x0b:   800x600    75.000000 Hz   4:3     46.875 kHz     49.500000 MHz
    DMT 0x10:  1024x768    60.003840 Hz   4:3     48.363 kHz     65.000000 MHz
    DMT 0x11:  1024x768    70.069359 Hz   4:3     56.476 kHz     75.000000 MHz
    DMT 0x12:  1024x768    75.028582 Hz   4:3     60.023 kHz     78.750000 MHz
    DMT 0x24:  1280x1024   75.024675 Hz   5:4     79.976 kHz    135.000000 MHz
  Standard Timings:
    DMT 0x23:  1280x1024   60.019740 Hz   5:4     63.981 kHz    108.000000 MHz
    DMT 0x3a:  1680x1050   59.954250 Hz  16:10    65.290 kHz    146.250000 MHz
    DMT 0x2f:  1440x900    59.887445 Hz  16:10    55.935 kHz    106.500000 MHz
    DMT 0x23:  1280x1024   60.019740 Hz   5:4     63.981 kHz    108.000000 MHz
    DMT 0x2f:  1440x900    59.887445 Hz  16:10    55.935 kHz    106.500000 MHz
    DMT 0x10:  1024x768    60.003840 Hz   4:3     48.363 kHz     65.000000 MHz
    DMT 0x09:   800x600    60.316541 Hz   4:3     37.879 kHz     40.000000 MHz
    DMT 0x3a:  1680x1050   59.954250 Hz  16:10    65.290 kHz    146.250000 MHz
  Detailed Timing Descriptors:
    DTD 1:  1920x1080   60.000000 Hz  16:9     67.500 kHz    148.500000 MHz (600 mm x 330 mm)
                 Hfront   88 Hsync  44 Hback  148 Hpol P
                 Vfront    4 Vsync   5 Vback   36 Vpol P
    Display Product Serial Number: '000000010000'
    Display Range Limits:
      Monitor ranges (Bare Limits): 48-165 Hz V, 163-163 kHz H, max dotclock 400 MHz
    Display Product Name: 'DP'
  Extension blocks: 1
Checksum: 0x5d

----------------

Block 1, CTA-861 Extension Block:
  Revision: 3
  Underscans IT Video Formats by default
  Basic audio support
  Supports YCbCr 4:4:4
  Supports YCbCr 4:2:2
  Native detailed modes: 1
  Video Data Block:
    VIC  16:  1920x1080   60.000000 Hz  16:9     67.500 kHz    148.500000 MHz (native)
    VIC   4:  1280x720    60.000000 Hz  16:9     45.000 kHz     74.250000 MHz
    VIC   3:   720x480    59.940060 Hz  16:9     31.469 kHz     27.000000 MHz
    VIC   2:   720x480    59.940060 Hz   4:3     31.469 kHz     27.000000 MHz
    VIC   7:  1440x480i   59.940060 Hz  16:9     15.734 kHz     27.000000 MHz
    VIC   1:   640x480    59.940476 Hz   4:3     31.469 kHz     25.175000 MHz
    VIC  31:  1920x1080   50.000000 Hz  16:9     56.250 kHz    148.500000 MHz
    VIC  18:   720x576    50.000000 Hz  16:9     31.250 kHz     27.000000 MHz
    VIC  19:  1280x720    50.000000 Hz  16:9     37.500 kHz     74.250000 MHz
    VIC  17:   720x576    50.000000 Hz   4:3     31.250 kHz     27.000000 MHz
  Audio Data Block:
    Linear PCM:
      Max channels: 2
      Supported sample rates (kHz): 48 44.1 32
      Supported sample sizes (bits): 24 20 16
  Speaker Allocation Data Block:
    FL/FR - Front Left/Right
  Colorimetry Data Block:
    xvYCC601
    xvYCC709
    Gamut Boundary Description Metadata Profile P0
  Detailed Timing Descriptors:
    DTD 2:  1920x1080  144.001664 Hz  16:9    159.986 kHz    339.170000 MHz (477 mm x 268 mm)
                 Hfront   88 Hsync  44 Hback   68 Hpol P
                 Vfront    4 Vsync   5 Vback   22 Vpol P
    DTD 3:  1920x1080  120.000679 Hz  16:9    133.321 kHz    282.640000 MHz (600 mm x 330 mm)
                 Hfront   88 Hsync  44 Hback   68 Hpol P
                 Vfront    4 Vsync   5 Vback   22 Vpol P
    DTD 4:   720x480    59.940060 Hz   3:2     31.469 kHz     27.000000 MHz (518 mm x 324 mm)
                 Hfront   16 Hsync  62 Hback   60 Hpol N
                 Vfront    9 Vsync   6 Vback   30 Vpol N
    DTD 5:  1920x1080  165.000934 Hz  16:9    183.316 kHz    388.630000 MHz (477 mm x 268 mm)
                 Hfront   88 Hsync  44 Hback   68 Hpol P
                 Vfront    4 Vsync   5 Vback   22 Vpol P
Checksum: 0xcf  Unused space in Extension Block: 22 bytes
