
EDID (hex):
00ffffffffffff00506c70174e150000
2310010368221b78eaf0659857519127
215054adcf0081808140714f01010101
010101010101302a009851002a403070
1300520e1100001e000000fd00384b1f
500e000a202020202020000000fc0054
2d373030354c0a2020202020000000fe
000a202020202020202020202020008b

Extracted contents:
header:          00 ff ff ff ff ff ff 00
serial number:   50 6c 70 17 4e 15 00 00 23 10
version:         01 03
basic params:    68 22 1b 78 ea
chroma info:     f0 65 98 57 51 91 27 21 50 54
established:     ad cf 00
standard:        81 80 81 40 71 4f 01 01 01 01 01 01 01 01 01 01
descriptor 1:    30 2a 00 98 51 00 2a 40 30 70 13 00 52 0e 11 00 00 1e
descriptor 2:    00 00 00 fd 00 38 4b 1f 50 0e 00 0a 20 20 20 20 20 20
descriptor 3:    00 00 00 fc 00 54 2d 37 30 30 35 4c 0a 20 20 20 20 20
descriptor 4:    00 00 00 fe 00 0a 20 20 20 20 20 20 20 20 20 20 20 20
extensions:      00
checksum:        8b

EDID version: 1.3
Manufacturer: TCL Model 1770 Serial Number --
Made in week 35 of 2006
Analog display, Input voltage level: 0.7/0.7 V
Sync: Separate 
Maximum image size: 34 cm x 27 cm
Gamma: 2.20
DPMS levels: Standby Suspend Off
RGB color display
First detailed timing is preferred timing
Display x,y Chromaticity:
  Red:   0.5966, 0.3427
  Green: 0.3164, 0.5664
  Blue:  0.1533, 0.1308
  White: 0.3134, 0.3291
Established timings supported:
  720x400@70Hz 9:5 HorFreq: 31469 Hz Clock: 28.320 MHz
  640x480@60Hz 4:3 HorFreq: 31469 Hz Clock: 25.175 MHz
  640x480@72Hz 4:3 HorFreq: 37900 Hz Clock: 31.500 MHz
  640x480@75Hz 4:3 HorFreq: 37500 Hz Clock: 31.500 MHz
  800x600@60Hz 4:3 HorFreq: 37900 Hz Clock: 40.000 MHz
  800x600@72Hz 4:3 HorFreq: 48100 Hz Clock: 50.000 MHz
  800x600@75Hz 4:3 HorFreq: 46900 Hz Clock: 49.500 MHz
  1024x768@60Hz 4:3 HorFreq: 48400 Hz Clock: 65.000 MHz
  1024x768@70Hz 4:3 HorFreq: 56500 Hz Clock: 75.000 MHz
  1024x768@75Hz 4:3 HorFreq: 60000 Hz Clock: 78.750 MHz
  1280x1024@75Hz 5:4 HorFreq: 80000 Hz Clock: 135.000 MHz
Standard timings supported:
  1280x1024@60Hz 5:4 HorFreq: 64000 Hz Clock: 108.000 MHz
  1280x960@60Hz 4:3 HorFreq: 60000 Hz Clock: 108.000 MHz
  1152x864@75Hz 4:3 HorFreq: 67500 Hz Clock: 108.000 MHz
Detailed mode: Clock 108.000 MHz, 338 mm x 270 mm
               1280 1328 1440 1688 hborder 0
               1024 1025 1028 1066 vborder 0
               +hsync +vsync 
               VertFreq: 60 Hz, HorFreq: 63981 Hz
Monitor ranges (GTF): 56-75Hz V, 31-80kHz H, max dotclock 140MHz
Monitor name: T-7005L
ASCII string: 
Checksum: 0x8b (valid)
