edid-decode (hex):

00 ff ff ff ff ff ff 00 09 e5 5f 08 00 00 00 00
1c 1f 01 04 a5 22 0a 78 02 de 50 a3 54 4c 99 26
0f 50 54 00 00 00 01 01 01 01 01 01 01 01 01 01
01 01 01 01 01 01 a8 6b 00 a0 f0 4c 30 40 30 20
35 00 58 63 10 00 00 1a 22 56 00 a0 f0 4c 30 40
30 20 35 00 58 63 10 00 00 1a 2e 1d 80 a0 70 26
30 20 30 20 35 00 58 63 10 00 00 1a 5c 17 80 a0
70 26 30 20 30 20 35 00 58 63 10 00 00 1a 00 9e

----------------

Block 0, Base EDID:
  EDID Structure Version & Revision: 1.4
  Vendor & Product Identification:
    Manufacturer: BOE
    Model: 2143
    Made in: week 28 of 2021
  Basic Display Parameters & Features:
    Digital display
    Bits per primary color channel: 8
    DisplayPort interface
    Maximum image size: 34 cm x 10 cm
    Gamma: 2.20
    Supported color formats: RGB 4:4:4
    First detailed timing includes the native pixel format and preferred refresh rate
  Color Characteristics:
    Red  : 0.6396, 0.3291
    Green: 0.2998, 0.5996
    Blue : 0.1494, 0.0595
    White: 0.3125, 0.3281
  Established Timings I & II: none
  Standard Timings: none
  Detailed Timing Descriptors:
    DTD 1:  3840x1100   60.017422 Hz 192:55    68.900 kHz    275.600000 MHz (344 mm x 99 mm)
                 Hfront   48 Hsync  32 Hback   80 Hpol P
                 Vfront    3 Vsync   5 Vback   40 Vpol N
    DTD 2:  3840x1100   48.018293 Hz 192:55    55.125 kHz    220.500000 MHz (344 mm x 99 mm)
                 Hfront   48 Hsync  32 Hback   80 Hpol P
                 Vfront    3 Vsync   5 Vback   40 Vpol N
    DTD 3:  1920x550    60.055956 Hz 192:55    35.913 kHz     74.700000 MHz (344 mm x 99 mm)
                 Hfront   48 Hsync  32 Hback   80 Hpol P
                 Vfront    3 Vsync   5 Vback   40 Vpol N
    DTD 4:  1920x550    48.076923 Hz 192:55    28.750 kHz     59.800000 MHz (344 mm x 99 mm)
                 Hfront   48 Hsync  32 Hback   80 Hpol P
                 Vfront    3 Vsync   5 Vback   40 Vpol N
Checksum: 0x9e

----------------

Warnings:

Block 0, Base EDID:
  Missing Display Product Name.

EDID conformity: PASS
