edid-decode (hex):

00 ff ff ff ff ff ff 00 04 69 a6 22 01 fc 00 00
30 12 01 03 80 35 1e 78 2a c7 20 a4 55 49 99 27
13 50 54 bf ef 00 71 4f 81 40 81 80 95 00 b3 00
81 00 01 01 01 01 08 39 90 30 62 1a 27 40 18 b0
36 40 d9 28 11 00 00 1c 00 00 00 ff 00 38 42 4c
4d 54 46 30 36 34 35 31 33 0a 00 00 00 fd 00 37
4b 1e 55 10 00 0a 20 20 20 20 20 20 00 00 00 fc
00 41 53 55 53 20 56 4b 32 32 32 48 0a 20 01 75

02 01 00 02 3a 80 d0 72 38 2d 40 10 2c 96 80 d9
10 2c 96 80 d9 28 11 00 00 18 01 1d 80 18 71 1c
16 20 58 2c 25 00 d9 28 11 00 00 9e 01 1d 80 d0
72 1c 16 20 10 2c 25 80 d9 28 11 00 00 9e 01 1d
00 bc 52 d0 1e 20 b8 28 55 40 d9 28 11 00 00 1e
8c 0a d0 90 20 40 31 20 0c 40 55 00 d9 28 11 00
00 18 00 00 00 00 00 00 00 00 00 00 00 00 00 24
00 00 00 00 00 00 00 00 00 00 00 00 00 00 00 a9

----------------

Block 0, Base EDID:
  EDID Structure Version & Revision: 1.3
  Vendor & Product Identification:
    Manufacturer: ACI
    Model: 8870
    Serial Number: ...
    Made in: week 48 of 2008
  Basic Display Parameters & Features:
    Digital display
    Maximum image size: 53 cm x 30 cm
    Gamma: 2.20
    DPMS levels: Off
    RGB color display
    First detailed timing is the preferred timing
  Color Characteristics:
    Red  : 0.6435, 0.3320
    Green: 0.2861, 0.6005
    Blue : 0.1523, 0.0761
    White: 0.3125, 0.3281
  Established Timings I & II:
    IBM     :   720x400    70.081663 Hz   9:5     31.467 kHz     28.320000 MHz
    DMT 0x04:   640x480    59.940476 Hz   4:3     31.469 kHz     25.175000 MHz
    Apple   :   640x480    66.666667 Hz   4:3     35.000 kHz     30.240000 MHz
    DMT 0x05:   640x480    72.808802 Hz   4:3     37.861 kHz     31.500000 MHz
    DMT 0x06:   640x480    75.000000 Hz   4:3     37.500 kHz     31.500000 MHz
    DMT 0x08:   800x600    56.250000 Hz   4:3     35.156 kHz     36.000000 MHz
    DMT 0x09:   800x600    60.316541 Hz   4:3     37.879 kHz     40.000000 MHz
    DMT 0x0a:   800x600    72.187572 Hz   4:3     48.077 kHz     50.000000 MHz
    DMT 0x0b:   800x600    75.000000 Hz   4:3     46.875 kHz     49.500000 MHz
    Apple   :   832x624    74.551266 Hz   4:3     49.726 kHz     57.284000 MHz
    DMT 0x10:  1024x768    60.003840 Hz   4:3     48.363 kHz     65.000000 MHz
    DMT 0x11:  1024x768    70.069359 Hz   4:3     56.476 kHz     75.000000 MHz
    DMT 0x12:  1024x768    75.028582 Hz   4:3     60.023 kHz     78.750000 MHz
    DMT 0x24:  1280x1024   75.024675 Hz   5:4     79.976 kHz    135.000000 MHz
  Standard Timings:
    DMT 0x15:  1152x864    75.000000 Hz   4:3     67.500 kHz    108.000000 MHz
    DMT 0x20:  1280x960    60.000000 Hz   4:3     60.000 kHz    108.000000 MHz
    DMT 0x23:  1280x1024   60.019740 Hz   5:4     63.981 kHz    108.000000 MHz
    DMT 0x2f:  1440x900    59.887445 Hz  16:10    55.935 kHz    106.500000 MHz
    DMT 0x3a:  1680x1050   59.954250 Hz  16:10    65.290 kHz    146.250000 MHz
    DMT 0x1c:  1280x800    59.810326 Hz  16:10    49.702 kHz     83.500000 MHz
  Detailed Timing Descriptors:
    DTD 1:  1680x1050   59.851764 Hz   8:5     65.179 kHz    146.000000 MHz (473 mm x 296 mm)
                 Hfront  280 Hsync 176 Hback  104 Hpol N
                 Vfront    3 Vsync   6 Vback   30 Vpol P
    Display Product Serial Number: ...
    Display Range Limits:
      Monitor ranges (GTF): 55-75 Hz V, 30-85 kHz H, max dotclock 160 MHz
    Display Product Name: 'ASUS VK222H'
  Extension blocks: 1
Checksum: 0x75

----------------

Block 1, CTA-861 Extension Block:
  Revision: 1
Checksum: 0xa9

----------------

Warnings:

Block 1, CTA-861 Extension Block:
  Display Product Serial Number is set, so the Serial Number in the Base EDID should be 0.

Failures:

Block 1, CTA-861 Extension Block:
  Non-zero byte 3.
  Missing VCDB, needed for Set Selectable RGB Quantization to avoid interop issues.

EDID conformity: FAIL
