edid-decode (hex):

00 ff ff ff ff ff ff 00 4c 2d 56 11 37 31 46 44
19 0d 01 03 68 20 18 6c 2a bb b9 a3 52 46 98 24
0f 48 4c ff ff 80 31 40 31 59 45 59 61 59 81 80
a9 45 c1 40 01 01 ea 24 00 60 41 00 28 30 30 60
13 00 38 ea 10 00 00 1e 00 00 00 fd 00 32 a0 1e
55 14 00 0a 20 20 20 20 20 20 00 00 00 fc 00 53
79 6e 63 4d 61 73 74 65 72 0a 20 20 00 00 00 ff
00 48 53 42 57 36 30 36 32 30 39 0a 20 20 00 e6

----------------

Block 0, Base EDID:
  EDID Structure Version & Revision: 1.3
  Vendor & Product Identification:
    Manufacturer: SAM
    Model: 4438
    Serial Number: ...
    Made in: week 25 of 2003
  Basic Display Parameters & Features:
    Analog display
    Input voltage level: 0.7/0.7 V
    Blank level equals black level
    Sync: Separate
    Maximum image size: 32 cm x 24 cm
    Gamma: 2.08
    DPMS levels: Off
    RGB color display
    First detailed timing is the preferred timing
  Color Characteristics:
    Red  : 0.6386, 0.3232
    Green: 0.2753, 0.5966
    Blue : 0.1425, 0.0615
    White: 0.2832, 0.2978
  Established Timings I & II:
    IBM     :   720x400    70.082 Hz   9:5    31.467 kHz  28.320 MHz
    IBM     :   720x400    87.850 Hz   9:5    39.444 kHz  35.500 MHz
    DMT 0x04:   640x480    59.940 Hz   4:3    31.469 kHz  25.175 MHz
    Apple   :   640x480    66.667 Hz   4:3    35.000 kHz  30.240 MHz
    DMT 0x05:   640x480    72.809 Hz   4:3    37.861 kHz  31.500 MHz
    DMT 0x06:   640x480    75.000 Hz   4:3    37.500 kHz  31.500 MHz
    DMT 0x08:   800x600    56.250 Hz   4:3    35.156 kHz  36.000 MHz
    DMT 0x09:   800x600    60.317 Hz   4:3    37.879 kHz  40.000 MHz
    DMT 0x0a:   800x600    72.188 Hz   4:3    48.077 kHz  50.000 MHz
    DMT 0x0b:   800x600    75.000 Hz   4:3    46.875 kHz  49.500 MHz
    Apple   :   832x624    74.551 Hz   4:3    49.726 kHz  57.284 MHz
    DMT 0x0f:  1024x768i   86.958 Hz   4:3    35.522 kHz  44.900 MHz
    DMT 0x10:  1024x768    60.004 Hz   4:3    48.363 kHz  65.000 MHz
    DMT 0x11:  1024x768    70.069 Hz   4:3    56.476 kHz  75.000 MHz
    DMT 0x12:  1024x768    75.029 Hz   4:3    60.023 kHz  78.750 MHz
    DMT 0x24:  1280x1024   75.025 Hz   5:4    79.976 kHz 135.000 MHz
    Apple   :  1152x870    75.062 Hz 192:145  68.681 kHz 100.000 MHz
  Standard Timings:
    DMT 0x04:   640x480    59.940 Hz   4:3    31.469 kHz  25.175 MHz
    DMT 0x07:   640x480    85.008 Hz   4:3    43.269 kHz  36.000 MHz
    DMT 0x0c:   800x600    85.061 Hz   4:3    53.674 kHz  56.250 MHz
    DMT 0x13:  1024x768    84.997 Hz   4:3    68.677 kHz  94.500 MHz
    DMT 0x23:  1280x1024   60.020 Hz   5:4    63.981 kHz 108.000 MHz
    DMT 0x34:  1600x1200   65.000 Hz   4:3    81.250 kHz 175.500 MHz
    DMT 0x3e:  1792x1344   60.000 Hz   4:3    83.640 kHz 204.750 MHz
  Detailed Timing Descriptors:
    DTD 1:  1024x768    84.997 Hz   4:3    68.677 kHz  94.500 MHz (312 mm x 234 mm)
                 Hfront   48 Hsync  96 Hback 208 Hpol P
                 Vfront    1 Vsync   3 Vback  36 Vpol P
  Display Range Limits:
    Monitor ranges (GTF): 50-160 Hz V, 30-85 kHz H, max dotclock 200 MHz
    Display Product Name: 'SyncMaster'
    Display Product Serial Number: ...
Checksum: 0xe6

----------------

Warnings:

EDID:
  Base EDID: Some timings are out of range of the Monitor Ranges:
    Maximum Clock: 204.750 MHz (Monitor: 200.000 MHz)
    Could be due to a Monitor Range off-by-one rounding issue

EDID conformity: PASS
