
EDID (hex):
00ffffffffffff005a63112001010101
240f01031d2018782a9ea8a154469924
0e484cbdee8061598180714f45593159
010101010101ea240060410028303060
130036e61000001e000000ff00505539
3035333630303934310a000000fd0032
a01e480c000a202020202020000000fc
00453730662d350a2020202020200046

Extracted contents:
header:          00 ff ff ff ff ff ff 00
serial number:   5a 63 11 20 01 01 01 01 24 0f
version:         01 03
basic params:    1d 20 18 78 2a
chroma info:     9e a8 a1 54 46 99 24 0e 48 4c
established:     bd ee 80
standard:        61 59 81 80 71 4f 45 59 31 59 01 01 01 01 01 01
descriptor 1:    ea 24 00 60 41 00 28 30 30 60 13 00 36 e6 10 00 00 1e
descriptor 2:    00 00 00 ff 00 50 55 39 30 35 33 36 30 30 39 34 31 0a
descriptor 3:    00 00 00 fd 00 32 a0 1e 48 0c 00 0a 20 20 20 20 20 20
descriptor 4:    00 00 00 fc 00 45 37 30 66 2d 35 0a 20 20 20 20 20 20
extensions:      00
checksum:        46

EDID version: 1.3
Manufacturer: VSC Model 2011 Serial Number --
Analog display, Input voltage level: 0.7/0.3 V
Configurable signal levels
Sync: Separate Composite Serration 
Maximum image size: 32 cm x 24 cm
Gamma: 2.20
DPMS levels: Off
RGB color display
First detailed timing is preferred timing
Display x,y Chromaticity:
  Red:   0.6308, 0.3291
  Green: 0.2763, 0.5996
  Blue:  0.1425, 0.0566
  White: 0.2832, 0.2968
Established timings supported:
  720x400@70Hz 9:5 HorFreq: 31469 Hz Clock: 28.320 MHz
  640x480@60Hz 4:3 HorFreq: 31469 Hz Clock: 25.175 MHz
  640x480@67Hz 4:3 HorFreq: 35000 Hz Clock: 30.240 MHz
  640x480@72Hz 4:3 HorFreq: 37900 Hz Clock: 31.500 MHz
  640x480@75Hz 4:3 HorFreq: 37500 Hz Clock: 31.500 MHz
  800x600@60Hz 4:3 HorFreq: 37900 Hz Clock: 40.000 MHz
  800x600@72Hz 4:3 HorFreq: 48100 Hz Clock: 50.000 MHz
  800x600@75Hz 4:3 HorFreq: 46900 Hz Clock: 49.500 MHz
  832x624@75Hz 4:3 HorFreq: 49726 Hz Clock: 57.284 MHz
  1024x768@60Hz 4:3 HorFreq: 48400 Hz Clock: 65.000 MHz
  1024x768@70Hz 4:3 HorFreq: 56500 Hz Clock: 75.000 MHz
  1024x768@75Hz 4:3 HorFreq: 60000 Hz Clock: 78.750 MHz
  1152x870@75Hz 192:145 HorFreq: 67500 Hz Clock: 108.000 MHz
Standard timings supported:
  1024x768@85Hz 4:3 HorFreq: 68700 Hz Clock: 94.500 MHz
  1280x1024@60Hz 5:4 HorFreq: 64000 Hz Clock: 108.000 MHz
  1152x864@75Hz 4:3 HorFreq: 67500 Hz Clock: 108.000 MHz
  800x600@85Hz 4:3 HorFreq: 53700 Hz Clock: 56.250 MHz
  640x480@85Hz 4:3 HorFreq: 43300 Hz Clock: 36.000 MHz
Detailed mode: Clock 94.500 MHz, 310 mm x 230 mm
               1024 1072 1168 1376 hborder 0
                768  769  772  808 vborder 0
               +hsync +vsync 
               VertFreq: 84 Hz, HorFreq: 68677 Hz
Serial number: --
Monitor ranges (GTF): 50-160Hz V, 30-72kHz H, max dotclock 120MHz
Monitor name: E70f-5
Checksum: 0x46 (valid)
EDID block does not conform at all!
	Bad year of manufacture
