edid-decode (hex):

00 ff ff ff ff ff ff 00 22 f0 0d 03 00 00 00 00
03 17 01 04 90 22 13 78 2a 00 25 9e 57 52 99 29
15 50 54 00 00 00 01 01 01 01 01 01 01 01 01 01
01 01 01 01 01 01 d8 1d 56 df 50 00 21 30 43 2d
48 00 58 c1 10 00 00 18 00 00 00 fd 00 37 41 2a
31 08 00 0a 20 20 20 20 20 20 00 00 00 fc 00 48
50 20 55 31 36 30 0a 20 20 20 20 20 00 00 00 ff
00 43 4e 34 33 30 33 30 52 48 44 0a 20 20 00 05

00 ff ff ff ff ff ff 00 22 f0 0d 03 00 00 00 00
03 17 01 04 90 22 13 78 2a 00 25 9e 57 52 99 29
15 50 54 00 00 00 01 01 01 01 01 01 01 01 01 01
01 01 01 01 01 01 d8 1d 56 df 50 00 21 30 43 2d
48 00 58 c1 10 00 00 18 00 00 00 fd 00 37 41 2a
31 08 00 0a 20 20 20 20 20 20 00 00 00 fc 00 48
50 20 55 31 36 30 0a 20 20 20 20 20 00 00 00 ff
00 43 4e 34 33 30 33 30 52 48 44 0a 20 20 00 05

----------------

Block 0, Base EDID:
  EDID Structure Version & Revision: 1.4
  Vendor & Product Identification:
    Manufacturer: HWP
    Model: 781
    Made in: week 3 of 2013
  Basic Display Parameters & Features:
    Digital display
    Bits per primary color channel: 6
    Digital interface is not defined
    Maximum image size: 34 cm x 19 cm
    Gamma: 2.20
    DPMS levels: Off
    Supported color formats: RGB 4:4:4, YCrCb 4:4:4
    First detailed timing includes the native pixel format and preferred refresh rate
  Color Characteristics:
    Red  : 0.6171, 0.3398
    Green: 0.3203, 0.5976
    Blue : 0.1601, 0.0839
    White: 0.3134, 0.3291
  Established Timings I & II: none
  Standard Timings: none
  Detailed Timing Descriptors:
    DTD 1:  1366x768    60.025660 Hz 683:384   48.081 kHz     76.400000 MHz (344 mm x 193 mm)
                 Hfront   67 Hsync  45 Hback  111 Hpol N
                 Vfront    4 Vsync   8 Vback   21 Vpol N
    Display Range Limits:
      Monitor ranges (GTF): 55-65 Hz V, 42-49 kHz H, max dotclock 80 MHz
    Display Product Name: 'HP U160'
    Display Product Serial Number: ...
Checksum: 0x05

----------------

Block 1, Unknown EDID Extension Block 0x00:
  00 ff ff ff ff ff ff 00 22 f0 0d 03 00 00 00 00 '........".......'
  03 17 01 04 90 22 13 78 2a 00 25 9e 57 52 99 29 '.....".x*.%.WR.)'
  15 50 54 00 00 00 01 01 01 01 01 01 01 01 01 01 '.PT.............'
  01 01 01 01 01 01 d8 1d 56 df 50 00 21 30 43 2d '........V.P.!0C-'
  48 00 58 c1 10 00 00 18 00 00 00 fd 00 37 41 2a 'H.X..........7A*'
  31 08 00 0a 20 20 20 20 20 20 00 00 00 fc 00 48 '1...      .....H'
  50 20 55 31 36 30 0a 20 20 20 20 20 00 00 00 ff 'P U160.     ....'
  00 43 4e 34 33 30 33 30 52 48 44 0a 20 20 00 05 '.CN43030RHD.  ..'
Checksum: 0x05

----------------

Warnings:

Block 0, Base EDID:
  Display Range Limits: GTF support is deprecated in EDID 1.4.

Failures:

Block 0, Base EDID:
  Display Range Limits: GTF can't be combined with non-continuous frequencies.
Block 1, Base EDID:
  Unknown Extension Block.
EDID:
  Base EDID: EDID specified 0 extension block(s), but found 1 extension block(s).

EDID conformity: FAIL
