edid-decode (hex):

00 ff ff ff ff ff ff 00 0d ae 34 17 00 00 00 00
2a 18 01 04 95 26 15 78 02 94 05 a0 56 51 94 28
13 50 54 00 00 00 01 01 01 01 01 01 01 01 01 01
01 01 01 01 01 01 1c 2a 40 54 61 84 1a 30 30 20
35 00 7e d6 10 00 00 1a af 21 40 54 61 84 1a 30
30 20 35 00 7e d6 10 00 00 1a 00 00 00 fe 00 31
4a 4a 35 4e 80 31 37 33 46 47 45 0a 00 00 00 00
00 00 41 31 96 01 10 00 00 09 01 0a 20 20 00 c0

----------------

Block 0, Base EDID:
  EDID Structure Version & Revision: 1.4
  Vendor & Product Identification:
    Manufacturer: CMN
    Model: 5940
    Made in: week 42 of 2014
  Basic Display Parameters & Features:
    Digital display
    Bits per primary color channel: 6
    DisplayPort interface
    Maximum image size: 38 cm x 21 cm
    Gamma: 2.20
    Supported color formats: RGB 4:4:4
    First detailed timing includes the native pixel format and preferred refresh rate
  Color Characteristics:
    Red  : 0.6269, 0.3369
    Green: 0.3173, 0.5781
    Blue : 0.1562, 0.0742
    White: 0.3134, 0.3291
  Established Timings I & II: none
  Standard Timings: none
  Detailed Timing Descriptors:
    DTD 1:  1600x900    60.007571 Hz  16:9     55.567 kHz    107.800000 MHz (382 mm x 214 mm)
                 Hfront   48 Hsync  32 Hback  260 Hpol P
                 Vfront    3 Vsync   5 Vback   18 Vpol N
    DTD 2:  1600x900    48.000490 Hz  16:9     44.448 kHz     86.230000 MHz (382 mm x 214 mm)
                 Hfront   48 Hsync  32 Hback  260 Hpol P
                 Vfront    3 Vsync   5 Vback   18 Vpol N
    Alphanumeric Data String: '1JJ5N'
    Manufacturer-Specified Display Descriptor (0x00): 00 00 00 00 41 31 96 01 10 00 00 09 01 0a 20 20 '....A1........  '
Checksum: 0xc0

----------------

Warnings:

Block 0, Base EDID:
  Missing Display Product Name.

Failures:

Block 0, Base EDID:
  Alphanumeric Data String: Non-printable character.

EDID conformity: FAIL
