edid-decode (hex):

00 ff ff ff ff ff ff 00 2c 24 00 00 00 00 00 00
18 1d 01 03 00 10 0c 78 ea c9 05 a3 57 4b 9c 25
12 50 54 25 4a 00 45 4a 01 01 01 01 01 01 01 01
01 01 01 01 01 01 a0 0f 20 00 31 58 1c 20 18 88
36 00 a2 7a 00 00 00 1e 00 00 00 fc 00 41 31 30
34 53 4e 30 33 0a 20 20 20 20 00 00 00 fd 00 32
50 1e 51 05 00 0a 20 20 20 20 20 20 00 00 00 10
00 00 00 00 00 00 00 00 00 00 00 00 00 00 00 98

----------------

Block 0, Base EDID:
  EDID Structure Version & Revision: 1.3
  Vendor & Product Identification:
    Manufacturer: KAD
    Model: 0
    Made in: week 24 of 2019
  Basic Display Parameters & Features:
    Analog display
    Signal Level Standard: 0.700 : 0.300 : 1.000 V p-p
    Blank level equals black level
    Maximum image size: 16 cm x 12 cm
    Gamma: 2.20
    DPMS levels: Standby Suspend Off
    RGB color display
    First detailed timing is the preferred timing
  Color Characteristics:
    Red  : 0.6396, 0.3398
    Green: 0.2949, 0.6103
    Blue : 0.1445, 0.0703
    White: 0.3134, 0.3291
  Established Timings I & II:
    DMT 0x04:   640x480    59.940476 Hz   4:3     31.469 kHz     25.175000 MHz
    DMT 0x06:   640x480    75.000000 Hz   4:3     37.500 kHz     31.500000 MHz
    DMT 0x09:   800x600    60.316541 Hz   4:3     37.879 kHz     40.000000 MHz
    DMT 0x0b:   800x600    75.000000 Hz   4:3     46.875 kHz     49.500000 MHz
    DMT 0x10:  1024x768    60.003840 Hz   4:3     48.363 kHz     65.000000 MHz
    DMT 0x12:  1024x768    75.028582 Hz   4:3     60.023 kHz     78.750000 MHz
  Standard Timings:
    GTF     :   800x600    70.000000 Hz   4:3     43.750 kHz     45.500000 MHz
  Detailed Timing Descriptors:
    DTD 1:   800x600    60.316541 Hz   4:3     37.879 kHz     40.000000 MHz (162 mm x 122 mm)
                 Hfront   24 Hsync 136 Hback   96 Hpol P
                 Vfront    3 Vsync   6 Vback   19 Vpol P
    Display Product Name: 'A104SN03'
    Display Range Limits:
      Monitor ranges (GTF): 50-80 Hz V, 30-81 kHz H, max dotclock 50 MHz
    Dummy Descriptor:
Checksum: 0x98

----------------

Warnings:

Block 0, Base EDID:
  Detailed Timing Descriptor #1: DTD is similar but not identical to DMT 0x09.

Failures:

EDID:
  Base EDID: Some timings are out of range of the Monitor Ranges:
    Maximum Clock: 78.750 MHz (Monitor: 50.000 MHz)

EDID conformity: FAIL
