
EDID (hex):
00ffffffffffff002c24000000000000
0f1d0103084f0078ea75e0a35753a027
0d5054210c00d1c0b300a9c095008bc0
8bca8180818a6a3780d270381e40582c
450058c21000001e000000fc00473135
3648544e30320a202020000000fd0039
57235512000a20202020202000000010
00000000000000000000000000000008

edid-decode (hex):

00 ff ff ff ff ff ff 00 2c 24 00 00 00 00 00 00
0f 1d 01 03 08 4f 00 78 ea 75 e0 a3 57 53 a0 27
0d 50 54 21 0c 00 d1 c0 b3 00 a9 c0 95 00 8b c0
8b ca 81 80 81 8a 6a 37 80 d2 70 38 1e 40 58 2c
45 00 58 c2 10 00 00 1e 00 00 00 fc 00 47 31 35
36 48 54 4e 30 32 0a 20 20 20 00 00 00 fd 00 39
57 23 55 12 00 0a 20 20 20 20 20 20 00 00 00 10
00 00 00 00 00 00 00 00 00 00 00 00 00 00 00 08

----------------

Block 0, Base EDID:
  EDID Structure Version & Revision: 1.3
  Vendor & Product Identification:
    Manufacturer: KAD
    Model: 0
    Made in: week 15 of 2019
  Basic Display Parameters & Features:
    Analog display
    Signal Level Standard: 0.700 : 0.300 : 1.000 V p-p
    Blank level equals black level
    Sync: Separate
    Image size is variable
    Gamma: 2.20
    DPMS levels: Standby Suspend Off
    RGB color display
    First detailed timing is the preferred timing
  Color Characteristics:
    Red  : 0.6376, 0.3427
    Green: 0.3251, 0.6259
    Blue : 0.1552, 0.0527
    White: 0.3125, 0.3281
  Established Timings I & II:
    DMT 0x04:   640x480    59.940476 Hz   4:3     31.469 kHz     25.175000 MHz
    DMT 0x09:   800x600    60.316541 Hz   4:3     37.879 kHz     40.000000 MHz
    DMT 0x10:  1024x768    60.003840 Hz   4:3     48.363 kHz     65.000000 MHz
    DMT 0x11:  1024x768    70.069359 Hz   4:3     56.476 kHz     75.000000 MHz
  Standard Timings:
    DMT 0x52:  1920x1080   60.000000 Hz  16:9     67.500 kHz    148.500000 MHz
    DMT 0x3a:  1680x1050   59.954250 Hz  16:10    65.290 kHz    146.250000 MHz
    DMT 0x53:  1600x900    60.000000 Hz  16:9     60.000 kHz    108.000000 MHz (RB)
    DMT 0x2f:  1440x900    59.887445 Hz  16:10    55.935 kHz    106.500000 MHz
    GTF     :  1360x765    60.000341 Hz  16:9     47.520 kHz     84.396000 MHz
    GTF     :  1360x765    69.999778 Hz  16:9     55.790 kHz    100.868000 MHz
    DMT 0x23:  1280x1024   60.019740 Hz   5:4     63.981 kHz    108.000000 MHz
    GTF     :  1280x1024   69.999805 Hz   5:4     74.620 kHz    128.943000 MHz
  Detailed Timing Descriptors:
    DTD 1:  1920x1080   60.000846 Hz  16:9     66.601 kHz    141.860000 MHz (344 mm x 194 mm)
                 Hfront   88 Hsync  44 Hback   78 Hpol P
                 Vfront    4 Vsync   5 Vback   21 Vpol P
    Display Product Name: 'G156HTN02'
    Display Range Limits:
      Monitor ranges (GTF): 57-87 Hz V, 35-85 kHz H, max dotclock 180 MHz
    Dummy Descriptor:
Checksum: 0x08
