edid-decode (hex):

00 ff ff ff ff ff ff 00 36 69 b4 3d 00 00 00 00
1a 1f 01 04 b5 46 27 78 3b 8c 75 a9 54 45 98 22
1e 50 54 a5 cb 00 81 80 01 01 b3 00 d1 c0 81 bc
95 3c b3 3c d1 fc 6a 5e 00 a0 a0 a0 29 50 30 20
35 00 bc 86 21 00 00 1a 00 00 00 fd 00 30 a5 d7
d7 46 01 0a 20 20 20 20 20 20 00 00 00 fc 00 4d
53 49 20 41 47 33 32 31 43 51 52 0a 00 00 00 ff
00 44 42 34 48 30 38 31 36 30 30 32 30 32 01 97

02 03 23 f4 48 01 02 03 04 90 12 13 1f 23 09 07
07 83 01 00 00 e3 05 e3 01 e6 06 07 01 60 50 00
e2 00 fb d4 bc 00 a0 a0 a0 29 50 30 20 35 00 58
4a 21 00 00 1a 98 e2 00 a0 a0 a0 29 50 30 20 35
00 58 4a 21 00 00 1a 9b ff 00 a0 a0 a0 12 50 30
20 35 00 58 4a 21 00 00 1a 8a 37 00 40 51 a0 29
50 30 20 35 00 1d 4d 31 00 00 1e 00 00 00 00 00
00 00 00 00 00 00 00 00 00 00 00 00 00 00 00 4c

00 ff ff ff ff ff ff 00 36 69 b4 3d 00 00 00 00
1a 1f 01 04 b5 46 27 78 3b 8c 75 a9 54 45 98 22
1e 50 54 a5 cb 00 81 80 01 01 b3 00 d1 c0 81 bc
95 3c b3 3c d1 fc 6a 5e 00 a0 a0 a0 29 50 30 20
35 00 bc 86 21 00 00 1a 00 00 00 fd 00 30 a5 d7
d7 46 01 0a 20 20 20 20 20 20 00 00 00 fc 00 4d
53 49 20 41 47 33 32 31 43 51 52 0a 00 00 00 ff
00 44 42 34 48 30 38 31 36 30 30 32 30 32 01 97

02 03 23 f4 48 01 02 03 04 90 12 13 1f 23 09 07
07 83 01 00 00 e3 05 e3 01 e6 06 07 01 60 50 00
e2 00 fb d4 bc 00 a0 a0 a0 29 50 30 20 35 00 58
4a 21 00 00 1a 98 e2 00 a0 a0 a0 29 50 30 20 35
00 58 4a 21 00 00 1a 9b ff 00 a0 a0 a0 12 50 30
20 35 00 58 4a 21 00 00 1a 8a 37 00 40 51 a0 29
50 30 20 35 00 1d 4d 31 00 00 1e 00 00 00 00 00
00 00 00 00 00 00 00 00 00 00 00 00 00 00 00 4c

----------------

Block 0, Base EDID:
  EDID Structure Version & Revision: 1.4
  Vendor & Product Identification:
    Manufacturer: MSI
    Model: 15796
    Made in: week 26 of 2021
  Basic Display Parameters & Features:
    Digital display
    Bits per primary color channel: 10
    DisplayPort interface
    Maximum image size: 70 cm x 39 cm
    Gamma: 2.20
    DPMS levels: Off
    Supported color formats: RGB 4:4:4, YCrCb 4:4:4, YCrCb 4:2:2
    First detailed timing includes the native pixel format and preferred refresh rate
    Display is continuous frequency
  Color Characteristics:
    Red  : 0.6621, 0.3281
    Green: 0.2724, 0.5937
    Blue : 0.1337, 0.1201
    White: 0.3134, 0.3291
  Established Timings I & II:
    IBM     :   720x400    70.081663 Hz   9:5     31.467 kHz     28.320000 MHz
    DMT 0x04:   640x480    59.940476 Hz   4:3     31.469 kHz     25.175000 MHz
    DMT 0x06:   640x480    75.000000 Hz   4:3     37.500 kHz     31.500000 MHz
    DMT 0x09:   800x600    60.316541 Hz   4:3     37.879 kHz     40.000000 MHz
    DMT 0x0a:   800x600    72.187572 Hz   4:3     48.077 kHz     50.000000 MHz
    DMT 0x0b:   800x600    75.000000 Hz   4:3     46.875 kHz     49.500000 MHz
    DMT 0x10:  1024x768    60.003840 Hz   4:3     48.363 kHz     65.000000 MHz
    DMT 0x12:  1024x768    75.028582 Hz   4:3     60.023 kHz     78.750000 MHz
    DMT 0x24:  1280x1024   75.024675 Hz   5:4     79.976 kHz    135.000000 MHz
  Standard Timings:
    DMT 0x23:  1280x1024   60.019740 Hz   5:4     63.981 kHz    108.000000 MHz
    DMT 0x3a:  1680x1050   59.954250 Hz  16:10    65.290 kHz    146.250000 MHz
    DMT 0x52:  1920x1080   60.000000 Hz  16:9     67.500 kHz    148.500000 MHz
    GTF     :  1280x1024  120.000185 Hz   5:4    131.640 kHz    233.793000 MHz
    GTF     :  1440x900   119.999896 Hz  16:10   115.800 kHz    229.747000 MHz
    GTF     :  1680x1050  120.000000 Hz  16:10   135.000 kHz    313.200000 MHz
    GTF     :  1920x1080  119.999987 Hz  16:9    138.840 kHz    368.759000 MHz
  Detailed Timing Descriptors:
    DTD 1:  2560x1440   60.000199 Hz  16:9     88.860 kHz    241.700000 MHz (700 mm x 390 mm)
                 Hfront   48 Hsync  32 Hback   80 Hpol P
                 Vfront    3 Vsync   5 Vback   33 Vpol N
    Display Range Limits:
      Monitor ranges (Bare Limits): 48-165 Hz V, 215-215 kHz H, max dotclock 700 MHz
    Display Product Name: 'MSI AG321CQR'
    Display Product Serial Number: ...
  Extension blocks: 1
Checksum: 0x97

----------------

Block 1, CTA-861 Extension Block:
  Revision: 3
  Underscans IT Video Formats by default
  Basic audio support
  Supports YCbCr 4:4:4
  Supports YCbCr 4:2:2
  Native detailed modes: 4
  Video Data Block:
    VIC   1:   640x480    59.940476 Hz   4:3     31.469 kHz     25.175000 MHz
    VIC   2:   720x480    59.940060 Hz   4:3     31.469 kHz     27.000000 MHz
    VIC   3:   720x480    59.940060 Hz  16:9     31.469 kHz     27.000000 MHz
    VIC   4:  1280x720    60.000000 Hz  16:9     45.000 kHz     74.250000 MHz
    VIC  16:  1920x1080   60.000000 Hz  16:9     67.500 kHz    148.500000 MHz (native)
    VIC  18:   720x576    50.000000 Hz  16:9     31.250 kHz     27.000000 MHz
    VIC  19:  1280x720    50.000000 Hz  16:9     37.500 kHz     74.250000 MHz
    VIC  31:  1920x1080   50.000000 Hz  16:9     56.250 kHz    148.500000 MHz
  Audio Data Block:
    Linear PCM:
      Max channels: 2
      Supported sample rates (kHz): 48 44.1 32
      Supported sample sizes (bits): 24 20 16
  Speaker Allocation Data Block:
    FL/FR - Front Left/Right
  Colorimetry Data Block:
    xvYCC601
    xvYCC709
    BT2020cYCC
    BT2020YCC
    BT2020RGB
    Gamut Boundary Description Metadata Profile P0
  HDR Static Metadata Data Block:
    Electro optical transfer functions:
      Traditional gamma - SDR luminance range
      Traditional gamma - HDR luminance range
      SMPTE ST2084
    Supported static metadata descriptors:
      Static metadata type 1
    Desired content max luminance: 96 (400.000 cd/m^2)
    Desired content max frame-average luminance: 80 (282.843 cd/m^2)
    Desired content min luminance: 0 (0.000 cd/m^2)
  Video Capability Data Block:
    YCbCr quantization: Selectable (via AVI YQ)
    RGB quantization: Selectable (via AVI Q)
    PT scan behavior: Supports both over- and underscan
    IT scan behavior: Always Underscanned
    CE scan behavior: Supports both over- and underscan
  Detailed Timing Descriptors:
    DTD 2:  2560x1440  120.000397 Hz  16:9    177.721 kHz    483.400000 MHz (600 mm x 330 mm)
                 Hfront   48 Hsync  32 Hback   80 Hpol P
                 Vfront    3 Vsync   5 Vback   33 Vpol N
    DTD 3:  2560x1440  144.000477 Hz  16:9    213.265 kHz    580.080000 MHz (600 mm x 330 mm)
                 Hfront   48 Hsync  32 Hback   80 Hpol P
                 Vfront    3 Vsync   5 Vback   33 Vpol N
    DTD 4:  2560x1440  164.999899 Hz  16:9    240.570 kHz    654.350000 MHz (600 mm x 330 mm)
                 Hfront   48 Hsync  32 Hback   80 Hpol P
                 Vfront    3 Vsync   5 Vback   10 Vpol N
    DTD 5:  1280x1440   60.001688 Hz   8:9     88.862 kHz    142.180000 MHz (797 mm x 333 mm)
                 Hfront   48 Hsync  32 Hback  240 Hpol P
                 Vfront    3 Vsync   5 Vback   33 Vpol P
Checksum: 0x4c  Unused space in Extension Block: 20 bytes

----------------

Block 2, Unknown EDID Extension Block 0x00:
  00 ff ff ff ff ff ff 00 36 69 b4 3d 00 00 00 00 '........6i.=....'
  1a 1f 01 04 b5 46 27 78 3b 8c 75 a9 54 45 98 22 '.....F'x;.u.TE."'
  1e 50 54 a5 cb 00 81 80 01 01 b3 00 d1 c0 81 bc '.PT.............'
  95 3c b3 3c d1 fc 6a 5e 00 a0 a0 a0 29 50 30 20 '.<.<..j^....)P0 '
  35 00 bc 86 21 00 00 1a 00 00 00 fd 00 30 a5 d7 '5...!........0..'
  d7 46 01 0a 20 20 20 20 20 20 00 00 00 fc 00 4d '.F..      .....M'
  53 49 20 41 47 33 32 31 43 51 52 0a 00 00 00 ff 'SI AG321CQR.....'
  00 44 42 34 48 30 38 31 36 30 30 32 30 32 01 97 '.DB4H081600202..'
Checksum: 0x97

----------------

Block 3, CTA-861 Extension Block:
  Revision: 3
  Underscans IT Video Formats by default
  Basic audio support
  Supports YCbCr 4:4:4
  Supports YCbCr 4:2:2
  Native detailed modes: 4
  Video Data Block:
    VIC   1:   640x480    59.940476 Hz   4:3     31.469 kHz     25.175000 MHz
    VIC   2:   720x480    59.940060 Hz   4:3     31.469 kHz     27.000000 MHz
    VIC   3:   720x480    59.940060 Hz  16:9     31.469 kHz     27.000000 MHz
    VIC   4:  1280x720    60.000000 Hz  16:9     45.000 kHz     74.250000 MHz
    VIC  16:  1920x1080   60.000000 Hz  16:9     67.500 kHz    148.500000 MHz (native)
    VIC  18:   720x576    50.000000 Hz  16:9     31.250 kHz     27.000000 MHz
    VIC  19:  1280x720    50.000000 Hz  16:9     37.500 kHz     74.250000 MHz
    VIC  31:  1920x1080   50.000000 Hz  16:9     56.250 kHz    148.500000 MHz
  Audio Data Block:
    Linear PCM:
      Max channels: 2
      Supported sample rates (kHz): 48 44.1 32
      Supported sample sizes (bits): 24 20 16
  Speaker Allocation Data Block:
    FL/FR - Front Left/Right
  Colorimetry Data Block:
    xvYCC601
    xvYCC709
    BT2020cYCC
    BT2020YCC
    BT2020RGB
    Gamut Boundary Description Metadata Profile P0
  HDR Static Metadata Data Block:
    Electro optical transfer functions:
      Traditional gamma - SDR luminance range
      Traditional gamma - HDR luminance range
      SMPTE ST2084
    Supported static metadata descriptors:
      Static metadata type 1
    Desired content max luminance: 96 (400.000 cd/m^2)
    Desired content max frame-average luminance: 80 (282.843 cd/m^2)
    Desired content min luminance: 0 (0.000 cd/m^2)
  Video Capability Data Block:
    YCbCr quantization: Selectable (via AVI YQ)
    RGB quantization: Selectable (via AVI Q)
    PT scan behavior: Supports both over- and underscan
    IT scan behavior: Always Underscanned
    CE scan behavior: Supports both over- and underscan
  Detailed Timing Descriptors:
    DTD 6:  2560x1440  120.000397 Hz  16:9    177.721 kHz    483.400000 MHz (600 mm x 330 mm)
                 Hfront   48 Hsync  32 Hback   80 Hpol P
                 Vfront    3 Vsync   5 Vback   33 Vpol N
    DTD 7:  2560x1440  144.000477 Hz  16:9    213.265 kHz    580.080000 MHz (600 mm x 330 mm)
                 Hfront   48 Hsync  32 Hback   80 Hpol P
                 Vfront    3 Vsync   5 Vback   33 Vpol N
    DTD 8:  2560x1440  164.999899 Hz  16:9    240.570 kHz    654.350000 MHz (600 mm x 330 mm)
                 Hfront   48 Hsync  32 Hback   80 Hpol P
                 Vfront    3 Vsync   5 Vback   10 Vpol N
    DTD 9:  1280x1440   60.001688 Hz   8:9     88.862 kHz    142.180000 MHz (797 mm x 333 mm)
                 Hfront   48 Hsync  32 Hback  240 Hpol P
                 Vfront    3 Vsync   5 Vback   33 Vpol P
Checksum: 0x4c  Unused space in Extension Block: 20 bytes

----------------

Warnings:

Block 1, CTA-861 Extension Block:
  Colorimetry Data Block: Set the sRGB colorimetry bit to avoid interop issues.
Block 3, CTA-861 Extension Block:
  Colorimetry Data Block: Set the sRGB colorimetry bit to avoid interop issues.
EDID:
  Base EDID: Some timings are out of range of the Monitor Ranges:
    Horizontal Freq: 31.250 - 240.569 kHz (Monitor: 215.000 - 215.000 kHz)

Failures:

Block 1, CTA-861 Extension Block:
  Detailed Timing Descriptor #2: Mismatch of image size 600x330 mm vs display size 700x390 mm.
  Detailed Timing Descriptor #3: Mismatch of image size 600x330 mm vs display size 700x390 mm.
  Detailed Timing Descriptor #4: Mismatch of image size 600x330 mm vs display size 700x390 mm.
  Detailed Timing Descriptor #5: Mismatch of image size 797x333 mm vs display size 700x390 mm.
Block 2, Base EDID:
  Unknown Extension Block.
Block 3, CTA-861 Extension Block:
  Video Data Block: Duplicate VIC 1.
  Video Data Block: Duplicate VIC 2.
  Video Data Block: Duplicate VIC 3.
  Video Data Block: Duplicate VIC 4.
  Video Data Block: Duplicate VIC 16.
  Video Data Block: Duplicate VIC 18.
  Video Data Block: Duplicate VIC 19.
  Video Data Block: Duplicate VIC 31.
  Speaker Allocation Data Block: Only one instance of this Data Block is allowed.
  Colorimetry Data Block: Only one instance of this Data Block is allowed.
  HDR Static Metadata Data Block: Only one instance of this Data Block is allowed.
  Video Capability Data Block: Only one instance of this Data Block is allowed.
  Detailed Timing Descriptor #6: Mismatch of image size 600x330 mm vs display size 700x390 mm.
  Detailed Timing Descriptor #7: Mismatch of image size 600x330 mm vs display size 700x390 mm.
  Detailed Timing Descriptor #8: Mismatch of image size 600x330 mm vs display size 700x390 mm.
  Detailed Timing Descriptor #9: Mismatch of image size 797x333 mm vs display size 700x390 mm.
EDID:
  Base EDID: The DTD max image size is 797x390mm, which is larger than the display size 700.0x390.0mm.
  Base EDID: EDID specified 1 extension block(s), but found 3 extension block(s).
  CTA-861: Native progressive timings are a mix of several resolutions.

EDID conformity: FAIL
