
EDID (hex):
00ffffffffffff004e140c1100000000
081d0103800000780ad7a5a2594a9624
145054a30800d1c0b300810081808140
81c00101010104740030f2705a80b058
8a00c48e2100001e023a801871382d40
582c45003f432100001a000000fd001e
4c1e5a1e000a202020202020000000fc
004e34330a2020202020202020200198
020335715390050403070206011f1413
121611155f5e5d202609070315075083
0100006d030c002000183c2000600102
03e30e6061011d007251d01e206e2855
00c48e2100001e011d8018711c162058
2c2500c48e2100009e8c0ad08a20e02d
10103e9600138e210000180000000000
000000000000000000000000000000ae

Extracted contents:
header:          00 ff ff ff ff ff ff 00
serial number:   4e 14 0c 11 00 00 00 00 08 1d
version:         01 03
basic params:    80 00 00 78 0a
chroma info:     d7 a5 a2 59 4a 96 24 14 50 54
established:     a3 08 00
standard:        d1 c0 b3 00 81 00 81 80 81 40 81 c0 01 01 01 01
descriptor 1:    04 74 00 30 f2 70 5a 80 b0 58 8a 00 c4 8e 21 00 00 1e
descriptor 2:    02 3a 80 18 71 38 2d 40 58 2c 45 00 3f 43 21 00 00 1a
descriptor 3:    00 00 00 fd 00 1e 4c 1e 5a 1e 00 0a 20 20 20 20 20 20
descriptor 4:    00 00 00 fc 00 4e 34 33 0a 20 20 20 20 20 20 20 20 20
extensions:      01
checksum:        98

EDID version: 1.3
Manufacturer: SPT Model 110c Serial Number --
Made in week 8 of 2019
Digital display
Image size is variable
Gamma: 2.20
RGB color display
First detailed timing is preferred timing
Display x,y Chromaticity:
  Red:   0.6357, 0.3486
  Green: 0.2900, 0.5888
  Blue:  0.1425, 0.0800
  White: 0.3134, 0.3291
Established timings supported:
  720x400@70Hz 9:5 HorFreq: 31469 Hz Clock: 28.320 MHz
  640x480@60Hz 4:3 HorFreq: 31469 Hz Clock: 25.175 MHz
  800x600@56Hz 4:3 HorFreq: 35200 Hz Clock: 36.000 MHz
  800x600@60Hz 4:3 HorFreq: 37900 Hz Clock: 40.000 MHz
  1024x768@60Hz 4:3 HorFreq: 48400 Hz Clock: 65.000 MHz
Standard timings supported:
  1920x1080@60Hz 16:9
  1680x1050@60Hz 16:10 HorFreq: 64700 Hz Clock: 119.000 MHz
  1280x800@60Hz 16:10
  1280x1024@60Hz 5:4 HorFreq: 64000 Hz Clock: 108.000 MHz
  1280x960@60Hz 4:3 HorFreq: 60000 Hz Clock: 108.000 MHz
  1280x720@60Hz 16:9
Detailed mode: Clock 297.000 MHz, 708 mm x 398 mm
               3840 4016 4104 4400 hborder 0
               2160 2168 2178 2250 vborder 0
               +hsync +vsync 
               VertFreq: 30 Hz, HorFreq: 67500 Hz
Detailed mode: Clock 148.500 MHz, 575 mm x 323 mm
               1920 2008 2052 2200 hborder 0
               1080 1084 1089 1125 vborder 0
               +hsync -vsync 
               VertFreq: 60 Hz, HorFreq: 67500 Hz
Monitor ranges (GTF): 30-76Hz V, 30-90kHz H, max dotclock 300MHz
Monitor name: N43
Has 1 extension blocks
Checksum: 0x98 (valid)

CTA extension block
Extension version: 3
49 bytes of CTA data
  Video data block
    VIC  16 1920x1080@60Hz 16:9 (native) HorFreq: 67500 Hz Clock: 148.500 MHz
    VIC   5 1920x1080i@60Hz 16:9  HorFreq: 33750 Hz Clock: 74.250 MHz
    VIC   4 1280x720@60Hz 16:9  HorFreq: 45000 Hz Clock: 74.250 MHz
    VIC   3 720x480@60Hz 16:9  HorFreq: 31469 Hz Clock: 27.000 MHz
    VIC   7 1440x480i@60Hz 16:9  HorFreq: 15734 Hz Clock: 27.000 MHz
    VIC   2 720x480@60Hz 4:3  HorFreq: 31469 Hz Clock: 27.000 MHz
    VIC   6 1440x480i@60Hz 4:3  HorFreq: 15734 Hz Clock: 27.000 MHz
    VIC   1 640x480@60Hz 4:3  HorFreq: 31469 Hz Clock: 25.175 MHz
    VIC  31 1920x1080@50Hz 16:9  HorFreq: 56250 Hz Clock: 148.500 MHz
    VIC  20 1920x1080i@50Hz 16:9  HorFreq: 28125 Hz Clock: 74.250 MHz
    VIC  19 1280x720@50Hz 16:9  HorFreq: 37500 Hz Clock: 74.250 MHz
    VIC  18 720x576@50Hz 16:9  HorFreq: 31250 Hz Clock: 27.000 MHz
    VIC  22 1440x576i@50Hz 16:9  HorFreq: 15625 Hz Clock: 27.000 MHz
    VIC  17 720x576@50Hz 4:3  HorFreq: 31250 Hz Clock: 27.000 MHz
    VIC  21 1440x576i@50Hz 4:3  HorFreq: 15625 Hz Clock: 27.000 MHz
    VIC  95 3840x2160@30Hz 16:9  HorFreq: 67500 Hz Clock: 297.000 MHz
    VIC  94 3840x2160@25Hz 16:9  HorFreq: 56250 Hz Clock: 297.000 MHz
    VIC  93 3840x2160@24Hz 16:9  HorFreq: 54000 Hz Clock: 297.000 MHz
    VIC  32 1920x1080@24Hz 16:9  HorFreq: 27000 Hz Clock: 74.250 MHz
  Audio data block
    Linear PCM, max channels 2
      Supported sample rates (kHz): 48 44.1 32
      Supported sample sizes (bits): 20 16
    AC-3, max channels 6
      Supported sample rates (kHz): 48 44.1 32
      Maximum bit rate: 640 kHz
  Speaker allocation data block
    Speaker map:
      FL/FR - Front Left/Right
  Vendor-specific data block, OUI 000c03 (HDMI)
    Source physical address 2.0.0.0
    DC_30bit
    DC_Y444
    Maximum TMDS clock: 300MHz
    Extended HDMI video details:
      HDMI VIC 1 3840x2160@30Hz 16:9 HorFreq: 67500 Hz Clock: 297.000 MHz
      HDMI VIC 2 3840x2160@25Hz 16:9 HorFreq: 56250 Hz Clock: 297.000 MHz
      HDMI VIC 3 3840x2160@24Hz 16:9 HorFreq: 54000 Hz Clock: 297.000 MHz
  Extended tag: YCbCr 4:2:0 video data block
    VIC  96 3840x2160@50Hz 16:9  HorFreq: 112500 Hz Clock: 297.000 MHz
    VIC  97 3840x2160@60Hz 16:9  HorFreq: 135000 Hz Clock: 297.000 MHz
Basic audio support
Supports YCbCr 4:4:4
Supports YCbCr 4:2:2
1 native detailed modes
Detailed mode: Clock 74.250 MHz, 708 mm x 398 mm
               1280 1390 1430 1650 hborder 0
                720  725  730  750 vborder 0
               +hsync +vsync 
               VertFreq: 60 Hz, HorFreq: 45000 Hz
Detailed mode: Clock 74.250 MHz, 708 mm x 398 mm
               1920 2008 2052 2200 hborder 0
                540  542  547  562 vborder 0
               +hsync +vsync interlaced 
               VertFreq: 60 Hz, HorFreq: 33750 Hz
Detailed mode: Clock 27.000 MHz, 531 mm x 398 mm
                720  736  798  858 hborder 0
                480  489  495  525 vborder 0
               -hsync -vsync 
               VertFreq: 59 Hz, HorFreq: 31468 Hz
Checksum: 0xae (valid)

One or more of the timings is out of range of the Monitor Ranges:
  Vertical Freq: 24 - 70 Hz
  Horizontal Freq: 15625 - 135000 Hz
  Maximum Clock: 297.000 MHz
