edid-decode (hex):

00 ff ff ff ff ff ff 00 0d ae a9 15 00 00 00 00
31 17 01 03 80 22 13 78 0a 00 25 9e 57 52 99 29
15 50 54 00 00 00 01 01 01 01 01 01 01 01 01 01
01 01 01 01 01 01 14 1b 56 64 50 00 14 30 10 22
26 00 58 c1 10 00 00 18 00 00 00 fe 00 4e 31 35
36 42 47 45 2d 4c 31 31 0a 20 00 00 00 fe 00 43
4d 4e 0a 20 20 20 20 20 20 20 20 20 00 00 00 fe
00 4e 31 35 36 42 47 45 2d 4c 31 31 0a 20 00 81

----------------

Block 0, Base EDID:
  EDID Structure Version & Revision: 1.3
  Vendor & Product Identification:
    Manufacturer: CMN
    Model: 5545
    Made in: week 49 of 2013
  Basic Display Parameters & Features:
    Digital display
    Maximum image size: 34 cm x 19 cm
    Gamma: 2.20
    RGB color display
    First detailed timing is preferred timing
  Color Characteristics:
    Red  : 0.6171, 0.3398
    Green: 0.3203, 0.5976
    Blue : 0.1601, 0.0839
    White: 0.3134, 0.3291
  Established Timings I & II: none
  Standard Timings: none
  Detailed Timing Descriptors:
    DTD 1:  1366x768    60.007 Hz 683:384  47.285 kHz  69.320 MHz (344 mm x 193 mm)
                 Hfront   16 Hsync  34 Hback  50 Hpol N
                 Vfront    2 Vsync   6 Vback  12 Vpol N
    Alphanumeric Data String: 'N156BGE-L11'
    Alphanumeric Data String: 'CMN'
    Alphanumeric Data String: 'N156BGE-L11'
Checksum: 0x81
