edid-decode (hex):

00 ff ff ff ff ff ff 00 38 a3 32 67 01 01 01 01
22 13 01 03 80 2f 1e 78 ea ee 95 a3 54 4c 99 26
0f 50 54 bf ef 80 81 c0 81 40 81 80 8b c0 95 00
90 40 b3 00 71 4f 21 39 90 30 62 1a 27 40 18 b0
36 40 da 28 11 00 00 1c 00 00 00 fd 00 38 4b 1f
53 11 00 0a 20 20 20 20 20 20 00 00 00 fc 00 4c
43 44 32 32 34 57 58 4d 0a 20 20 20 00 00 00 ff
00 39 38 33 30 34 35 37 32 54 41 0a 20 20 00 12

00 ff ff ff ff ff ff 00 38 a3 32 67 01 01 01 01
22 13 01 03 80 2f 1e 78 ea ee 95 a3 54 4c 99 26
0f 50 54 bf ef 80 81 c0 81 40 81 80 8b c0 95 00
90 40 b3 00 71 4f 21 39 90 30 62 1a 27 40 18 b0
36 40 da 28 11 00 00 1c 00 00 00 fd 00 38 4b 1f
53 11 00 0a 20 20 20 20 20 20 00 00 00 fc 00 4c
43 44 32 32 34 57 58 4d 0a 20 20 20 00 00 00 ff
00 39 38 33 30 34 35 37 32 54 41 0a 20 20 00 12

----------------

Block 0, Base EDID:
  EDID Structure Version & Revision: 1.3
  Vendor & Product Identification:
    Manufacturer: NEC
    Model: 26418
    Serial Number: ...
    Made in: week 34 of 2009
  Basic Display Parameters & Features:
    Digital display
    Maximum image size: 47 cm x 30 cm
    Gamma: 2.20
    DPMS levels: Standby Suspend Off
    RGB color display
    First detailed timing is the preferred timing
  Color Characteristics:
    Red  : 0.6396, 0.3300
    Green: 0.2998, 0.5996
    Blue : 0.1503, 0.0595
    White: 0.3134, 0.3291
  Established Timings I & II:
    IBM     :   720x400    70.081663 Hz   9:5     31.467 kHz     28.320000 MHz
    DMT 0x04:   640x480    59.940476 Hz   4:3     31.469 kHz     25.175000 MHz
    Apple   :   640x480    66.666667 Hz   4:3     35.000 kHz     30.240000 MHz
    DMT 0x05:   640x480    72.808802 Hz   4:3     37.861 kHz     31.500000 MHz
    DMT 0x06:   640x480    75.000000 Hz   4:3     37.500 kHz     31.500000 MHz
    DMT 0x08:   800x600    56.250000 Hz   4:3     35.156 kHz     36.000000 MHz
    DMT 0x09:   800x600    60.316541 Hz   4:3     37.879 kHz     40.000000 MHz
    DMT 0x0a:   800x600    72.187572 Hz   4:3     48.077 kHz     50.000000 MHz
    DMT 0x0b:   800x600    75.000000 Hz   4:3     46.875 kHz     49.500000 MHz
    Apple   :   832x624    74.551266 Hz   4:3     49.726 kHz     57.284000 MHz
    DMT 0x10:  1024x768    60.003840 Hz   4:3     48.363 kHz     65.000000 MHz
    DMT 0x11:  1024x768    70.069359 Hz   4:3     56.476 kHz     75.000000 MHz
    DMT 0x12:  1024x768    75.028582 Hz   4:3     60.023 kHz     78.750000 MHz
    DMT 0x24:  1280x1024   75.024675 Hz   5:4     79.976 kHz    135.000000 MHz
    Apple   :  1152x870    75.061550 Hz 192:145   68.681 kHz    100.000000 MHz
  Standard Timings:
    DMT 0x55:  1280x720    60.000000 Hz  16:9     45.000 kHz     74.250000 MHz
    DMT 0x20:  1280x960    60.000000 Hz   4:3     60.000 kHz    108.000000 MHz
    DMT 0x23:  1280x1024   60.019740 Hz   5:4     63.981 kHz    108.000000 MHz
    GTF     :  1360x765    60.000341 Hz  16:9     47.520 kHz     84.396000 MHz
    DMT 0x2f:  1440x900    59.887445 Hz  16:10    55.935 kHz    106.500000 MHz
    DMT 0x2a:  1400x1050   59.978442 Hz   4:3     65.317 kHz    121.750000 MHz
    DMT 0x3a:  1680x1050   59.954250 Hz  16:10    65.290 kHz    146.250000 MHz
    DMT 0x15:  1152x864    75.000000 Hz   4:3     67.500 kHz    108.000000 MHz
  Detailed Timing Descriptors:
    DTD 1:  1680x1050   59.954250 Hz  16:10    65.290 kHz    146.250000 MHz (474 mm x 296 mm)
                 Hfront  280 Hsync 176 Hback  104 Hpol N
                 Vfront    3 Vsync   6 Vback   30 Vpol P
    Display Range Limits:
      Monitor ranges (GTF): 56-75 Hz V, 31-83 kHz H, max dotclock 170 MHz
    Display Product Name: 'LCD224WXM'
    Display Product Serial Number: ...
Checksum: 0x12

----------------

Block 1, Unknown EDID Extension Block 0x00:
  00 ff ff ff ff ff ff 00 38 a3 32 67 01 01 01 01 '........8.2g....'
  22 13 01 03 80 2f 1e 78 ea ee 95 a3 54 4c 99 26 '"..../.x....TL.&'
  0f 50 54 bf ef 80 81 c0 81 40 81 80 8b c0 95 00 '.PT......@......'
  90 40 b3 00 71 4f 21 39 90 30 62 1a 27 40 18 b0 '.@..qO!9.0b.'@..'
  36 40 da 28 11 00 00 1c 00 00 00 fd 00 38 4b 1f '6@.(.........8K.'
  53 11 00 0a 20 20 20 20 20 20 00 00 00 fc 00 4c 'S...      .....L'
  43 44 32 32 34 57 58 4d 0a 20 20 20 00 00 00 ff 'CD224WXM.   ....'
  00 39 38 33 30 34 35 37 32 54 41 0a 20 20 00 12 '.98304572TA.  ..'
Checksum: 0x12

----------------

Warnings:

Block 0, Base EDID:
  Standard Timings: Standard Timing 1360x765 has a dubious odd vertical resolution.
  Detailed Timing Descriptor #1: DTD is similar but not identical to DMT 0x3a.

Failures:

Block 1, Base EDID:
  Unknown Extension Block.
EDID:
  Base EDID: EDID specified 0 extension block(s), but found 1 extension block(s).

EDID conformity: FAIL
