edid-decode (hex):

00 ff ff ff ff ff ff 00 06 af 99 c1 00 00 00 00
07 1f 01 04 a5 22 16 78 03 c2 d5 ad 51 42 b1 25
0d 50 54 00 00 00 01 01 01 01 01 01 01 01 01 01
01 01 01 01 01 01 d7 fb 00 a0 a0 40 2e 60 30 20
36 00 80 90 21 00 00 1a ef 68 00 a0 a0 40 2e 60
30 20 36 00 80 90 21 00 00 1a fd d7 00 a0 a0 40
5e 60 30 20 36 00 80 90 21 00 00 1a 00 00 00 fd
0c 30 a5 1f 1f 4e 01 0a 20 20 20 20 20 20 01 06

70 12 79 00 00 03 01 14 b6 2f 01 85 ff 09 9f 00
2f 00 1f 00 3f 06 83 00 09 00 09 00 00 00 00 00
00 00 00 00 00 00 00 00 00 00 00 00 00 00 00 00
00 00 00 00 00 00 00 00 00 00 00 00 00 00 00 00
00 00 00 00 00 00 00 00 00 00 00 00 00 00 00 00
00 00 00 00 00 00 00 00 00 00 00 00 00 00 00 00
00 00 00 00 00 00 00 00 00 00 00 00 00 00 00 00
00 00 00 00 00 00 00 00 00 00 00 00 00 00 23 90

----------------

Block 0, Base EDID:
  EDID Structure Version & Revision: 1.4
  Vendor & Product Identification:
    Manufacturer: AUO
    Model: 49561
    Made in: week 7 of 2021
  Basic Display Parameters & Features:
    Digital display
    Bits per primary color channel: 8
    DisplayPort interface
    Maximum image size: 34 cm x 22 cm
    Gamma: 2.20
    Supported color formats: RGB 4:4:4
    First detailed timing includes the native pixel format and preferred refresh rate
    Display is continuous frequency
  Color Characteristics:
    Red  : 0.6787, 0.3164
    Green: 0.2578, 0.6933
    Blue : 0.1474, 0.0517
    White: 0.3134, 0.3291
  Established Timings I & II: none
  Standard Timings: none
  Detailed Timing Descriptors:
    DTD 1:  2560x1600  144.001054 Hz   8:5    237.026 kHz    644.710000 MHz (640 mm x 400 mm)
                 Hfront   48 Hsync  32 Hback   80 Hpol P
                 Vfront    3 Vsync   6 Vback   37 Vpol N
    DTD 2:  2560x1600   60.000625 Hz   8:5     98.761 kHz    268.630000 MHz (640 mm x 400 mm)
                 Hfront   48 Hsync  32 Hback   80 Hpol P
                 Vfront    3 Vsync   6 Vback   37 Vpol N
    DTD 3:  2560x1600  120.001823 Hz   8:5    203.283 kHz    552.930000 MHz (640 mm x 400 mm)
                 Hfront   48 Hsync  32 Hback   80 Hpol P
                 Vfront    3 Vsync   6 Vback   85 Vpol N
    Display Range Limits:
      Monitor ranges (Bare Limits): 48-165 Hz V, 286-286 kHz H, max dotclock 780 MHz
  Extension blocks: 1
Checksum: 0x06

----------------

Block 1, DisplayID Extension Block:
  Version: 1.2
  Extension Count: 0
  Display Product Type: Extension Section
  Video Timing Modes Type 1 - Detailed Timings Data Block:
    DTD:  2560x1600  165.039991 Hz  16:10   285.849 kHz    777.510000 MHz (aspect 16:10, no 3D stereo, preferred)
               Hfront   48 Hsync  32 Hback   80 Hpol N
               Vfront   10 Vsync  10 Vback  112 Vpol N
  Checksum: 0x23
Checksum: 0x90

----------------

Warnings:

EDID:
  Base EDID: Some timings are out of range of the Monitor Ranges:
    Horizontal Freq: 98.761 - 285.849 kHz (Monitor: 286.000 - 286.000 kHz)

Failures:

Block 0, Base EDID:
  Detailed Timing Descriptor #1: Mismatch of image size 640x400 mm vs display size 340x220 mm.
  Detailed Timing Descriptor #2: Mismatch of image size 640x400 mm vs display size 340x220 mm.
  Detailed Timing Descriptor #3: Mismatch of image size 640x400 mm vs display size 340x220 mm.
  Missing Display Product Name.
Block 1, DisplayID Extension Block:
  DisplayID Base Block has no product type.
EDID:
  DisplayID: Missing DisplayID Product Identification Data Block.

EDID conformity: FAIL
