
EDID (hex):
00ffffffffffff003669b63c01000000
0c1e0104b53c227833b6e0a35650a027
0e5054afef00818081bc9500953cb300
b33cd1c0d1fc023a801871382d40582c
4500574f2100001e000000fd003090a2
a224010a202020202020000000fc004d
5349204d4147323733520a20000000ff
004342364830323031323034373301ad
020327f14c0103051404131f12021190
042309070783010000e305e301e60607
01595900e200c0866f80a07038404030
20350055502100001efb7e807270381e
401820350055502100001e0000000000
00000000000000000000000000000000
00000000000000000000000000000000
00000000000000000000000000000051

Extracted contents:
header:          00 ff ff ff ff ff ff 00
serial number:   36 69 b6 3c 01 00 00 00 0c 1e
version:         01 04
basic params:    b5 3c 22 78 33
chroma info:     b6 e0 a3 56 50 a0 27 0e 50 54
established:     af ef 00
standard:        81 80 81 bc 95 00 95 3c b3 00 b3 3c d1 c0 d1 fc
descriptor 1:    02 3a 80 18 71 38 2d 40 58 2c 45 00 57 4f 21 00 00 1e
descriptor 2:    00 00 00 fd 00 30 90 a2 a2 24 01 0a 20 20 20 20 20 20
descriptor 3:    00 00 00 fc 00 4d 53 49 20 4d 41 47 32 37 33 52 0a 20
descriptor 4:    00 00 00 ff 00 43 42 36 48 30 32 30 31 32 30 34 37 33
extensions:      01
checksum:        ad

EDID version: 1.4
Manufacturer: MSI Model 3cb6 Serial Number --
Made in week 12 of 2020
Digital display
10 bits per primary color channel
DisplayPort interface
Maximum image size: 60 cm x 34 cm
Gamma: 2.20
DPMS levels: Off
Supported color formats: RGB 4:4:4, YCrCb 4:2:2
First detailed timing includes the native pixel format and preferred refresh rate
Display is continuous frequency
Display x,y Chromaticity:
  Red:   0.6386, 0.3388
  Green: 0.3134, 0.6269
  Blue:  0.1552, 0.0566
  White: 0.3125, 0.3281
Established timings supported:
  720x400@70Hz 9:5 HorFreq: 31469 Hz Clock: 28.320 MHz
  640x480@60Hz 4:3 HorFreq: 31469 Hz Clock: 25.175 MHz
  640x480@72Hz 4:3 HorFreq: 37900 Hz Clock: 31.500 MHz
  640x480@75Hz 4:3 HorFreq: 37500 Hz Clock: 31.500 MHz
  800x600@56Hz 4:3 HorFreq: 35200 Hz Clock: 36.000 MHz
  800x600@60Hz 4:3 HorFreq: 37900 Hz Clock: 40.000 MHz
  800x600@72Hz 4:3 HorFreq: 48100 Hz Clock: 50.000 MHz
  800x600@75Hz 4:3 HorFreq: 46900 Hz Clock: 49.500 MHz
  832x624@75Hz 4:3 HorFreq: 49726 Hz Clock: 57.284 MHz
  1024x768@60Hz 4:3 HorFreq: 48400 Hz Clock: 65.000 MHz
  1024x768@70Hz 4:3 HorFreq: 56500 Hz Clock: 75.000 MHz
  1024x768@75Hz 4:3 HorFreq: 60000 Hz Clock: 78.750 MHz
  1280x1024@75Hz 5:4 HorFreq: 80000 Hz Clock: 135.000 MHz
Standard timings supported:
  1280x1024@60Hz 5:4 HorFreq: 64000 Hz Clock: 108.000 MHz
  1280x1024@120Hz 5:4
  1440x900@60Hz 16:10 HorFreq: 55500 Hz Clock: 88.750 MHz
  1440x900@120Hz 16:10
  1680x1050@60Hz 16:10 HorFreq: 64700 Hz Clock: 119.000 MHz
  1680x1050@120Hz 16:10
  1920x1080@60Hz 16:9
  1920x1080@120Hz 16:9
Detailed mode: Clock 148.500 MHz, 599 mm x 335 mm
               1920 2008 2052 2200 hborder 0
               1080 1084 1089 1125 vborder 0
               +hsync +vsync 
               VertFreq: 60 Hz, HorFreq: 67500 Hz
Monitor ranges (bare limits): 48-144Hz V, 162-162kHz H, max dotclock 360MHz
Monitor name: MSI MAG273R
Serial number: --
Has 1 extension blocks
Checksum: 0xad (valid)

CTA extension block
Extension version: 3
35 bytes of CTA data
  Video data block
    VIC   1 640x480@60Hz 4:3  HorFreq: 31469 Hz Clock: 25.175 MHz
    VIC   3 720x480@60Hz 16:9  HorFreq: 31469 Hz Clock: 27.000 MHz
    VIC   5 1920x1080i@60Hz 16:9  HorFreq: 33750 Hz Clock: 74.250 MHz
    VIC  20 1920x1080i@50Hz 16:9  HorFreq: 28125 Hz Clock: 74.250 MHz
    VIC   4 1280x720@60Hz 16:9  HorFreq: 45000 Hz Clock: 74.250 MHz
    VIC  19 1280x720@50Hz 16:9  HorFreq: 37500 Hz Clock: 74.250 MHz
    VIC  31 1920x1080@50Hz 16:9  HorFreq: 56250 Hz Clock: 148.500 MHz
    VIC  18 720x576@50Hz 16:9  HorFreq: 31250 Hz Clock: 27.000 MHz
    VIC   2 720x480@60Hz 4:3  HorFreq: 31469 Hz Clock: 27.000 MHz
    VIC  17 720x576@50Hz 4:3  HorFreq: 31250 Hz Clock: 27.000 MHz
    VIC  16 1920x1080@60Hz 16:9 (native) HorFreq: 67500 Hz Clock: 148.500 MHz
    VIC   4 1280x720@60Hz 16:9  HorFreq: 45000 Hz Clock: 74.250 MHz
  Audio data block
    Linear PCM, max channels 2
      Supported sample rates (kHz): 48 44.1 32
      Supported sample sizes (bits): 24 20 16
  Speaker allocation data block
    Speaker map:
      FL/FR - Front Left/Right
  Extended tag: Colorimetry data block
    xvYCC601
    xvYCC709
    BT2020cYCC
    BT2020YCC
    BT2020RGB
  Extended tag: HDR static metadata data block
    Electro optical transfer functions:
      Traditional gamma - SDR luminance range
      Traditional gamma - HDR luminance range
      SMPTE ST2084
    Supported static metadata descriptors:
      Static metadata type 1
    Desired content max luminance: 89 (343.724 cd/m^2)
    Desired content max frame-average luminance: 89 (343.724 cd/m^2)
    Desired content min luminance: 0 (0.000 cd/m^2)
  Extended tag: Video capability data block
    YCbCr quantization: Selectable (via AVI YQ) (1)
    RGB quantization: Selectable (via AVI Q) (1)
    PT scan behaviour: No Data (0)
    IT scan behaviour: IT video formats not supported (0)
    CE scan behaviour: CE video formats not supported (0)
Underscans PC formats by default
Basic audio support
Supports YCbCr 4:4:4
Supports YCbCr 4:2:2
1 native detailed modes
Detailed mode: Clock 285.500 MHz, 597 mm x 336 mm
               1920 1968 2000 2080 hborder 0
               1080 1083 1088 1144 vborder 0
               +hsync +vsync 
               VertFreq: 119 Hz, HorFreq: 137259 Hz
Detailed mode: Clock 325.070 MHz, 597 mm x 336 mm
               1920 1944 1976 2034 hborder 0
               1080 1083 1088 1110 vborder 0
               +hsync +vsync 
               VertFreq: 143 Hz, HorFreq: 159818 Hz
Checksum: 0x51 (valid)

Warning: One or more of the timings is out of range of the Monitor Ranges:
  Vertical Freq: 50 - 143 Hz
  Horizontal Freq: 28125 - 159818 Hz
  Maximum Clock: 325.070 MHz
EDID block does not conform at all!
	Both the serial number and the serial string are set


