
EDID (hex):
00ffffffffffff004ca3454800000000
00120100802115780a0ae59757548b27
22505400000001010101010101010101
0101010101018f1b0082502022301030
13004bcf100000190000000f00000000
00000000002387026401000000fe0053
414d53554e470a2020202020000000fe
004c544e3135344154313046303100f9

Extracted contents:
header:          00 ff ff ff ff ff ff 00
serial number:   4c a3 45 48 00 00 00 00 00 12
version:         01 00
basic params:    80 21 15 78 0a
chroma info:     0a e5 97 57 54 8b 27 22 50 54
established:     00 00 00
standard:        01 01 01 01 01 01 01 01 01 01 01 01 01 01 01 01
descriptor 1:    8f 1b 00 82 50 20 22 30 10 30 13 00 4b cf 10 00 00 19
descriptor 2:    00 00 00 0f 00 00 00 00 00 00 00 00 00 23 87 02 64 01
descriptor 3:    00 00 00 fe 00 53 41 4d 53 55 4e 47 0a 20 20 20 20 20
descriptor 4:    00 00 00 fe 00 4c 54 4e 31 35 34 41 54 31 30 46 30 31
extensions:      00
checksum:        f9

EDID version: 1.0
Manufacturer: SEC Model 4845 Serial Number --
Made in year 2008
Digital display
Maximum image size: 33 cm x 21 cm
Gamma: 2.20
RGB color display
First detailed timing is preferred timing
Display x,y Chromaticity:
  Red:   0.5898, 0.3398
  Green: 0.3300, 0.5449
  Blue:  0.1552, 0.1347
  White: 0.3134, 0.3291
Established timings supported:
Standard timings supported:
Detailed mode: Clock 70.550 MHz, 331 mm x 207 mm
               1280 1296 1344 1410 hborder 0
                800  801  804  834 vborder 0
               -hsync -vsync 
               VertFreq: 59 Hz, HorFreq: 50035 Hz
Manufacturer-specified data, tag 15
ASCII string: SAMSUNG
ASCII string: LTN154AT10F01
Checksum: 0xf9 (valid)
EDID block does NOT conform to EDID 1.0!
	Has descriptor blocks other than detailed timings
