
EDID (hex):
00ffffffffffff0010ac025059303032
340c01030e241b962b0cc9a057479b27
12484ca443808199a94fa95945593159
010101010101ea240060410028303060
130060081100001e000000fd0030aa1e
6b18000a202020202020000000fc0044
454c4c20503939320a202020000000ff
00384434363932434e323030590a00a3

Extracted contents:
header:          00 ff ff ff ff ff ff 00
serial number:   10 ac 02 50 59 30 30 32 34 0c
version:         01 03
basic params:    0e 24 1b 96 2b
chroma info:     0c c9 a0 57 47 9b 27 12 48 4c
established:     a4 43 80
standard:        81 99 a9 4f a9 59 45 59 31 59 01 01 01 01 01 01
descriptor 1:    ea 24 00 60 41 00 28 30 30 60 13 00 60 08 11 00 00 1e
descriptor 2:    00 00 00 fd 00 30 aa 1e 6b 18 00 0a 20 20 20 20 20 20
descriptor 3:    00 00 00 fc 00 44 45 4c 4c 20 50 39 39 32 0a 20 20 20
descriptor 4:    00 00 00 ff 00 38 44 34 36 39 32 43 4e 32 30 30 59 0a
extensions:      00
checksum:        a3

EDID version: 1.3
Manufacturer: DEL Model 5002 Serial Number --
Analog display, Input voltage level: 0.7/0.3 V
Sync: Separate Composite SyncOnGreen 
Maximum image size: 36 cm x 27 cm
Gamma: 2.50
DPMS levels: Off
RGB color display
First detailed timing is preferred timing
Supports GTF timings within operating range
Display x,y Chromaticity:
  Red:   0.6250, 0.3398
  Green: 0.2802, 0.6054
  Blue:  0.1552, 0.0703
  White: 0.2832, 0.2978
Established timings supported:
  720x400@70Hz 9:5 HorFreq: 31469 Hz Clock: 28.320 MHz
  640x480@60Hz 4:3 HorFreq: 31469 Hz Clock: 25.175 MHz
  640x480@75Hz 4:3 HorFreq: 37500 Hz Clock: 31.500 MHz
  800x600@75Hz 4:3 HorFreq: 46900 Hz Clock: 49.500 MHz
  1024x768@75Hz 4:3 HorFreq: 60000 Hz Clock: 78.750 MHz
  1280x1024@75Hz 5:4 HorFreq: 80000 Hz Clock: 135.000 MHz
  1152x870@75Hz 192:145 HorFreq: 67500 Hz Clock: 108.000 MHz
Standard timings supported:
  1280x1024@85Hz 5:4 HorFreq: 91100 Hz Clock: 157.500 MHz
  1600x1200@75Hz 4:3 HorFreq: 93800 Hz Clock: 202.500 MHz
  1600x1200@85Hz 4:3 HorFreq: 106300 Hz Clock: 229.500 MHz
  800x600@85Hz 4:3 HorFreq: 53700 Hz Clock: 56.250 MHz
  640x480@85Hz 4:3 HorFreq: 43300 Hz Clock: 36.000 MHz
Detailed mode: Clock 94.500 MHz, 352 mm x 264 mm
               1024 1072 1168 1376 hborder 0
                768  769  772  808 vborder 0
               +hsync +vsync 
               VertFreq: 84 Hz, HorFreq: 68677 Hz
Monitor ranges (GTF): 48-170Hz V, 30-107kHz H, max dotclock 240MHz
Monitor name: DELL P992
Serial number: --
Checksum: 0xa3 (valid)
EDID block does not conform at all!
	Bad year of manufacture
