
EDID (hex):
00ffffffffffff0038361000bc020000
1e1201038008057800ee91a3544c9926
0f505400000001010101010101010101
010101010101e40c200031e019102880
1300985b0000001e000000fd003b3f1d
2104000a202020202020000000fc004e
414e4f564953494f4e0a0a0a000000ff
0055373039323031303234360a0a002f

Extracted contents:
header:          00 ff ff ff ff ff ff 00
serial number:   38 36 10 00 bc 02 00 00 1e 12
version:         01 03
basic params:    80 08 05 78 00
chroma info:     ee 91 a3 54 4c 99 26 0f 50 54
established:     00 00 00
standard:        01 01 01 01 01 01 01 01 01 01 01 01 01 01 01 01
descriptor 1:    e4 0c 20 00 31 e0 19 10 28 80 13 00 98 5b 00 00 00 1e
descriptor 2:    00 00 00 fd 00 3b 3f 1d 21 04 00 0a 20 20 20 20 20 20
descriptor 3:    00 00 00 fc 00 4e 41 4e 4f 56 49 53 49 4f 4e 0a 0a 0a
descriptor 4:    00 00 00 ff 00 55 37 30 39 32 30 31 30 32 34 36 0a 0a
extensions:      00
checksum:        2f

EDID version: 1.3
Manufacturer: NAV Model 10 Serial Number --
Made in week 30 of 2008
Digital display
Maximum image size: 8 cm x 5 cm
Gamma: 2.20
Monochrome or grayscale display
Display x,y Chromaticity:
  Red:   0.6396, 0.3300
  Green: 0.2998, 0.5996
  Blue:  0.1503, 0.0595
  White: 0.3125, 0.3291
Established timings supported:
Standard timings supported:
Detailed mode: Clock 33.000 MHz, 152 mm x 91 mm
                800  840  968 1056 hborder 0
                480  481  484  505 vborder 0
               +hsync +vsync 
               VertFreq: 61 Hz, HorFreq: 31250 Hz
Monitor ranges (GTF): 59-63Hz V, 29-33kHz H, max dotclock 40MHz
Monitor name: NANOVISION
Serial number: --
Checksum: 0x2f (valid)
EDID block does NOT conform to EDID 1.3!
	Missing preferred timing
	Detailed block string not properly terminated
