edid-decode (hex):

00 ff ff ff ff ff ff 00 15 c3 30 25 01 01 01 01
14 1c 01 04 a5 35 1e 78 fa 7e 75 a7 55 52 9c 27
0f 50 54 a1 08 00 81 80 b3 00 a9 c0 81 c0 81 00
01 01 01 01 01 01 02 3a 80 18 71 38 2d 40 58 2c
45 00 10 29 21 00 00 1e 00 00 00 ff 00 37 38 32
37 36 30 35 38 0a 20 20 20 20 00 00 00 fd 00 3b
3d 1f 44 0f 00 0a 20 20 20 20 20 20 00 00 00 fc
00 45 56 32 34 35 30 0a 20 20 20 20 20 20 01 b4

02 03 12 f1 45 90 04 03 02 01 23 09 1f 07 83 01
00 00 02 3a 80 18 71 38 2d 40 58 2c 45 00 10 29
21 00 00 1e 01 1d 00 72 51 d0 1e 20 6e 28 55 00
10 29 21 00 00 1e 8f 0a d0 8a 20 e0 2d 10 10 3e
96 00 dc 29 11 00 00 18 8c 0a d0 8a 20 e0 2d 10
10 3e 96 00 8c 29 11 00 00 18 d5 09 80 a0 20 e0
2d 10 10 60 a2 00 8c 29 11 00 00 18 00 00 00 00
00 00 00 00 00 00 00 00 00 00 00 00 00 00 00 6a

00 ff ff ff ff ff ff 00 15 c3 30 25 01 01 01 01
14 1c 01 04 a5 35 1e 78 fa 7e 75 a7 55 52 9c 27
0f 50 54 a1 08 00 81 80 b3 00 a9 c0 81 c0 81 00
01 01 01 01 01 01 02 3a 80 18 71 38 2d 40 58 2c
45 00 10 29 21 00 00 1e 00 00 00 ff 00 37 38 32
37 36 30 35 38 0a 20 20 20 20 00 00 00 fd 00 3b
3d 1f 44 0f 00 0a 20 20 20 20 20 20 00 00 00 fc
00 45 56 32 34 35 30 0a 20 20 20 20 20 20 01 b4

02 03 12 f1 45 90 04 03 02 01 23 09 1f 07 83 01
00 00 02 3a 80 18 71 38 2d 40 58 2c 45 00 10 29
21 00 00 1e 01 1d 00 72 51 d0 1e 20 6e 28 55 00
10 29 21 00 00 1e 8f 0a d0 8a 20 e0 2d 10 10 3e
96 00 dc 29 11 00 00 18 8c 0a d0 8a 20 e0 2d 10
10 3e 96 00 8c 29 11 00 00 18 d5 09 80 a0 20 e0
2d 10 10 60 a2 00 8c 29 11 00 00 18 00 00 00 00
00 00 00 00 00 00 00 00 00 00 00 00 00 00 00 6a

----------------

Block 0, Base EDID:
  EDID Structure Version & Revision: 1.4
  Vendor & Product Identification:
    Manufacturer: ENC
    Model: 9520
    Serial Number: ...
    Made in: week 20 of 2018
  Basic Display Parameters & Features:
    Digital display
    Bits per primary color channel: 8
    DisplayPort interface
    Maximum image size: 53 cm x 30 cm
    Gamma: 2.20
    DPMS levels: Standby Suspend Off
    Supported color formats: RGB 4:4:4, YCrCb 4:4:4, YCrCb 4:2:2
    First detailed timing includes the native pixel format and preferred refresh rate
  Color Characteristics:
    Red  : 0.6533, 0.3349
    Green: 0.3232, 0.6113
    Blue : 0.1533, 0.0615
    White: 0.3134, 0.3291
  Established Timings I & II:
    IBM     :   720x400    70.081663 Hz   9:5     31.467 kHz     28.320000 MHz
    DMT 0x04:   640x480    59.940476 Hz   4:3     31.469 kHz     25.175000 MHz
    DMT 0x09:   800x600    60.316541 Hz   4:3     37.879 kHz     40.000000 MHz
    DMT 0x10:  1024x768    60.003840 Hz   4:3     48.363 kHz     65.000000 MHz
  Standard Timings:
    DMT 0x23:  1280x1024   60.019740 Hz   5:4     63.981 kHz    108.000000 MHz
    DMT 0x3a:  1680x1050   59.954250 Hz  16:10    65.290 kHz    146.250000 MHz
    DMT 0x53:  1600x900    60.000000 Hz  16:9     60.000 kHz    108.000000 MHz (RB)
    DMT 0x55:  1280x720    60.000000 Hz  16:9     45.000 kHz     74.250000 MHz
    DMT 0x1c:  1280x800    59.810326 Hz  16:10    49.702 kHz     83.500000 MHz
  Detailed Timing Descriptors:
    DTD  1:  1920x1080   60.000000 Hz  16:9     67.500 kHz    148.500000 MHz (528 mm x 297 mm)
                  Hfront   88 Hsync  44 Hback  148 Hpol P
                  Vfront    4 Vsync   5 Vback   36 Vpol P
    Display Product Serial Number: ...
    Display Range Limits:
      Monitor ranges (GTF): 59-61 Hz V, 31-68 kHz H, max dotclock 150 MHz
    Display Product Name: 'EV2450'
  Extension blocks: 1
Checksum: 0xb4

----------------

Block 1, CTA-861 Extension Block:
  Revision: 3
  Underscans IT Video Formats by default
  Basic audio support
  Supports YCbCr 4:4:4
  Supports YCbCr 4:2:2
  Native detailed modes: 1
  Video Data Block:
    VIC  16:  1920x1080   60.000000 Hz  16:9     67.500 kHz    148.500000 MHz (native)
    VIC   4:  1280x720    60.000000 Hz  16:9     45.000 kHz     74.250000 MHz
    VIC   3:   720x480    59.940060 Hz  16:9     31.469 kHz     27.000000 MHz
    VIC   2:   720x480    59.940060 Hz   4:3     31.469 kHz     27.000000 MHz
    VIC   1:   640x480    59.940476 Hz   4:3     31.469 kHz     25.175000 MHz
  Audio Data Block:
    Linear PCM:
      Max channels: 2
      Supported sample rates (kHz): 96 88.2 48 44.1 32
      Supported sample sizes (bits): 24 20 16
  Speaker Allocation Data Block:
    FL/FR - Front Left/Right
  Detailed Timing Descriptors:
    DTD  2:  1920x1080   60.000000 Hz  16:9     67.500 kHz    148.500000 MHz (528 mm x 297 mm)
                  Hfront   88 Hsync  44 Hback  148 Hpol P
                  Vfront    4 Vsync   5 Vback   36 Vpol P
    DTD  3:  1280x720    60.000000 Hz  16:9     45.000 kHz     74.250000 MHz (528 mm x 297 mm)
                  Hfront  110 Hsync  40 Hback  220 Hpol P
                  Vfront    5 Vsync   5 Vback   20 Vpol P
    DTD  4:   720x480    60.006660 Hz   3:2     31.503 kHz     27.030000 MHz (476 mm x 297 mm)
                  Hfront   16 Hsync  62 Hback   60 Hpol N
                  Vfront    9 Vsync   6 Vback   30 Vpol N
    DTD  5:   720x480    59.940060 Hz   3:2     31.469 kHz     27.000000 MHz (396 mm x 297 mm)
                  Hfront   16 Hsync  62 Hback   60 Hpol N
                  Vfront    9 Vsync   6 Vback   30 Vpol N
    DTD  6:   640x480    59.928571 Hz   4:3     31.462 kHz     25.170000 MHz (396 mm x 297 mm)
                  Hfront   16 Hsync  96 Hback   48 Hpol N
                  Vfront   10 Vsync   2 Vback   33 Vpol N
Checksum: 0x6a  Unused space in Extension Block: 19 bytes

----------------

Block 2, Unknown EDID Extension Block 0x00:
  00 ff ff ff ff ff ff 00 15 c3 30 25 01 01 01 01 '..........0%....'
  14 1c 01 04 a5 35 1e 78 fa 7e 75 a7 55 52 9c 27 '.....5.x.~u.UR.''
  0f 50 54 a1 08 00 81 80 b3 00 a9 c0 81 c0 81 00 '.PT.............'
  01 01 01 01 01 01 02 3a 80 18 71 38 2d 40 58 2c '.......:..q8-@X,'
  45 00 10 29 21 00 00 1e 00 00 00 ff 00 37 38 32 'E..)!........782'
  37 36 30 35 38 0a 20 20 20 20 00 00 00 fd 00 3b '76058.    .....;'
  3d 1f 44 0f 00 0a 20 20 20 20 20 20 00 00 00 fc '=.D...      ....'
  00 45 56 32 34 35 30 0a 20 20 20 20 20 20 01 b4 '.EV2450.      ..'
Checksum: 0xb4

----------------

Block 3, CTA-861 Extension Block:
  Revision: 3
  Underscans IT Video Formats by default
  Basic audio support
  Supports YCbCr 4:4:4
  Supports YCbCr 4:2:2
  Native detailed modes: 1
  Video Data Block:
    VIC  16:  1920x1080   60.000000 Hz  16:9     67.500 kHz    148.500000 MHz (native)
    VIC   4:  1280x720    60.000000 Hz  16:9     45.000 kHz     74.250000 MHz
    VIC   3:   720x480    59.940060 Hz  16:9     31.469 kHz     27.000000 MHz
    VIC   2:   720x480    59.940060 Hz   4:3     31.469 kHz     27.000000 MHz
    VIC   1:   640x480    59.940476 Hz   4:3     31.469 kHz     25.175000 MHz
  Audio Data Block:
    Linear PCM:
      Max channels: 2
      Supported sample rates (kHz): 96 88.2 48 44.1 32
      Supported sample sizes (bits): 24 20 16
  Speaker Allocation Data Block:
    FL/FR - Front Left/Right
  Detailed Timing Descriptors:
    DTD  7:  1920x1080   60.000000 Hz  16:9     67.500 kHz    148.500000 MHz (528 mm x 297 mm)
                  Hfront   88 Hsync  44 Hback  148 Hpol P
                  Vfront    4 Vsync   5 Vback   36 Vpol P
    DTD  8:  1280x720    60.000000 Hz  16:9     45.000 kHz     74.250000 MHz (528 mm x 297 mm)
                  Hfront  110 Hsync  40 Hback  220 Hpol P
                  Vfront    5 Vsync   5 Vback   20 Vpol P
    DTD  9:   720x480    60.006660 Hz   3:2     31.503 kHz     27.030000 MHz (476 mm x 297 mm)
                  Hfront   16 Hsync  62 Hback   60 Hpol N
                  Vfront    9 Vsync   6 Vback   30 Vpol N
    DTD 10:   720x480    59.940060 Hz   3:2     31.469 kHz     27.000000 MHz (396 mm x 297 mm)
                  Hfront   16 Hsync  62 Hback   60 Hpol N
                  Vfront    9 Vsync   6 Vback   30 Vpol N
    DTD 11:   640x480    59.928571 Hz   4:3     31.462 kHz     25.170000 MHz (396 mm x 297 mm)
                  Hfront   16 Hsync  96 Hback   48 Hpol N
                  Vfront   10 Vsync   2 Vback   33 Vpol N
Checksum: 0x6a  Unused space in Extension Block: 19 bytes

----------------

Warnings:

Block 0, Base EDID:
  Display Range Limits: GTF support is deprecated in EDID 1.4.
Block 1, CTA-861 Extension Block:
  Display Product Serial Number is set, so the Serial Number in the Base EDID should be 0.
  Add a Colorimetry Data Block with the sRGB colorimetry bit set to avoid interop issues.
Block 3, CTA-861 Extension Block:
  Display Product Serial Number is set, so the Serial Number in the Base EDID should be 0.
  Add a Colorimetry Data Block with the sRGB colorimetry bit set to avoid interop issues.
EDID:
  Base EDID: Some timings are out of range of the Monitor Ranges:
    Vertical Freq: 59.810 - 70.082 Hz (Monitor: 59.000 - 61.000 Hz)
  CTA-861: Multiple native progressive timings are defined.

Failures:

Block 0, Base EDID:
  Display Range Limits: GTF can't be combined with non-continuous frequencies.
Block 1, CTA-861 Extension Block:
  Missing VCDB, needed for Set Selectable RGB Quantization to avoid interop issues.
Block 2, Base EDID:
  Unknown Extension Block.
Block 3, CTA-861 Extension Block:
  Video Data Block: Duplicate VIC 16.
  Video Data Block: Duplicate VIC 4.
  Video Data Block: Duplicate VIC 3.
  Video Data Block: Duplicate VIC 2.
  Video Data Block: Duplicate VIC 1.
  Speaker Allocation Data Block: Only one instance of this Data Block is allowed.
  Missing VCDB, needed for Set Selectable RGB Quantization to avoid interop issues.
EDID:
  Base EDID: EDID specified 1 extension block(s), but found 3 extension block(s).

EDID conformity: FAIL
