
EDID (hex):
00ffffffffffff0009d17f7f00000000
031f0104a5351e783ec895a25651a227
0e5054a56b80d1c081c081008180a9c0
b30081bc617c023a801871382d40582c
4500132b2100001e000000ff00454236
314d3030343239534c30000000fd0028
901ea723010a202020202020000000fc
005a4f57494520584c204c43440a0132
020322f1529005040302011112133f1f
20212206151640e200cf230907078301
0000fe5b80a07038354030203500132b
2100001a866f80a07038404030203500
132b2100001a5a8780a070384d403020
3500132b2100001a9f6f00f451005c40
6c8e3700132b2100001cc93600a04000
373030203400132b2100001a0000003f

Extracted contents:
header:          00 ff ff ff ff ff ff 00
serial number:   09 d1 7f 7f 00 00 00 00 03 1f
version:         01 04
basic params:    a5 35 1e 78 3e
chroma info:     c8 95 a2 56 51 a2 27 0e 50 54
established:     a5 6b 80
standard:        d1 c0 81 c0 81 00 81 80 a9 c0 b3 00 81 bc 61 7c
descriptor 1:    02 3a 80 18 71 38 2d 40 58 2c 45 00 13 2b 21 00 00 1e
descriptor 2:    00 00 00 ff 00 45 42 36 31 4d 30 30 34 32 39 53 4c 30
descriptor 3:    00 00 00 fd 00 28 90 1e a7 23 01 0a 20 20 20 20 20 20
descriptor 4:    00 00 00 fc 00 5a 4f 57 49 45 20 58 4c 20 4c 43 44 0a
extensions:      01
checksum:        32

EDID version: 1.4
Manufacturer: BNQ Model 7f7f Serial Number --
Made in week 3 of 2021
Digital display
8 bits per primary color channel
DisplayPort interface
Maximum image size: 53 cm x 30 cm
Gamma: 2.20
DPMS levels: Off
Supported color formats: RGB 4:4:4, YCrCb 4:4:4, YCrCb 4:2:2
Default (sRGB) color space is primary color space
First detailed timing includes the native pixel format and preferred refresh rate
Display x,y Chromaticity:
  Red:   0.6357, 0.3359
  Green: 0.3183, 0.6328
  Blue:  0.1542, 0.0556
  White: 0.3134, 0.3291
Established timings supported:
  720x400@70Hz 9:5 HorFreq: 31469 Hz Clock: 28.320 MHz
  640x480@60Hz 4:3 HorFreq: 31469 Hz Clock: 25.175 MHz
  640x480@75Hz 4:3 HorFreq: 37500 Hz Clock: 31.500 MHz
  800x600@60Hz 4:3 HorFreq: 37900 Hz Clock: 40.000 MHz
  800x600@75Hz 4:3 HorFreq: 46900 Hz Clock: 49.500 MHz
  832x624@75Hz 4:3 HorFreq: 49726 Hz Clock: 57.284 MHz
  1024x768@60Hz 4:3 HorFreq: 48400 Hz Clock: 65.000 MHz
  1024x768@75Hz 4:3 HorFreq: 60000 Hz Clock: 78.750 MHz
  1280x1024@75Hz 5:4 HorFreq: 80000 Hz Clock: 135.000 MHz
  1152x870@75Hz 192:145 HorFreq: 67500 Hz Clock: 108.000 MHz
Standard timings supported:
  1920x1080@60Hz 16:9
  1280x720@60Hz 16:9
  1280x800@60Hz 16:10
  1280x1024@60Hz 5:4 HorFreq: 64000 Hz Clock: 108.000 MHz
  1600x900@60Hz 16:9
  1680x1050@60Hz 16:10 HorFreq: 64700 Hz Clock: 119.000 MHz
  1280x1024@120Hz 5:4
  1024x768@120Hz 4:3
Detailed mode: Clock 148.500 MHz, 531 mm x 299 mm
               1920 2008 2052 2200 hborder 0
               1080 1084 1089 1125 vborder 0
               +hsync +vsync 
               VertFreq: 60 Hz, HorFreq: 67500 Hz
Serial number: --
Monitor ranges (bare limits): 40-144Hz V, 30-167kHz H, max dotclock 350MHz
Monitor name: ZOWIE XL LCD
Has 1 extension blocks
Checksum: 0x32 (valid)

CTA extension block
Extension version: 3
30 bytes of CTA data
  Video data block
    VIC  16 1920x1080@60Hz 16:9 (native) HorFreq: 67500 Hz Clock: 148.500 MHz
    VIC   5 1920x1080i@60Hz 16:9  HorFreq: 33750 Hz Clock: 74.250 MHz
    VIC   4 1280x720@60Hz 16:9  HorFreq: 45000 Hz Clock: 74.250 MHz
    VIC   3 720x480@60Hz 16:9  HorFreq: 31469 Hz Clock: 27.000 MHz
    VIC   2 720x480@60Hz 4:3  HorFreq: 31469 Hz Clock: 27.000 MHz
    VIC   1 640x480@60Hz 4:3  HorFreq: 31469 Hz Clock: 25.175 MHz
    VIC  17 720x576@50Hz 4:3  HorFreq: 31250 Hz Clock: 27.000 MHz
    VIC  18 720x576@50Hz 16:9  HorFreq: 31250 Hz Clock: 27.000 MHz
    VIC  19 1280x720@50Hz 16:9  HorFreq: 37500 Hz Clock: 74.250 MHz
    VIC  63 1920x1080@120Hz 16:9  HorFreq: 135000 Hz Clock: 297.000 MHz
    VIC  31 1920x1080@50Hz 16:9  HorFreq: 56250 Hz Clock: 148.500 MHz
    VIC  32 1920x1080@24Hz 16:9  HorFreq: 27000 Hz Clock: 74.250 MHz
    VIC  33 1920x1080@25Hz 16:9  HorFreq: 28125 Hz Clock: 74.250 MHz
    VIC  34 1920x1080@30Hz 16:9  HorFreq: 33750 Hz Clock: 74.250 MHz
    VIC   6 1440x480i@60Hz 4:3  HorFreq: 15734 Hz Clock: 27.000 MHz
    VIC  21 1440x576i@50Hz 4:3  HorFreq: 15625 Hz Clock: 27.000 MHz
    VIC  22 1440x576i@50Hz 16:9  HorFreq: 15625 Hz Clock: 27.000 MHz
    VIC  64 1920x1080@100Hz 16:9  HorFreq: 112500 Hz Clock: 297.000 MHz
  Extended tag: Video capability data block
    YCbCr quantization: Selectable (via AVI YQ) (1)
    RGB quantization: Selectable (via AVI Q) (1)
    PT scan behaviour: No Data (0)
    IT scan behaviour: Support both over- and underscan (3)
    CE scan behaviour: Support both over- and underscan (3)
  Audio data block
    Linear PCM, max channels 2
      Supported sample rates (kHz): 48 44.1 32
      Supported sample sizes (bits): 24 20 16
  Speaker allocation data block
    Speaker map:
      FL/FR - Front Left/Right
Underscans PC formats by default
Basic audio support
Supports YCbCr 4:4:4
Supports YCbCr 4:2:2
1 native detailed modes
Detailed mode: Clock 235.500 MHz, 531 mm x 299 mm
               1920 1968 2000 2080 hborder 0
               1080 1083 1088 1133 vborder 0
               +hsync -vsync 
               VertFreq: 99 Hz, HorFreq: 113221 Hz
Detailed mode: Clock 285.500 MHz, 531 mm x 299 mm
               1920 1968 2000 2080 hborder 0
               1080 1083 1088 1144 vborder 0
               +hsync -vsync 
               VertFreq: 119 Hz, HorFreq: 137259 Hz
Detailed mode: Clock 346.500 MHz, 531 mm x 299 mm
               1920 1968 2000 2080 hborder 0
               1080 1083 1088 1157 vborder 0
               +hsync -vsync 
               VertFreq: 143 Hz, HorFreq: 166586 Hz
Detailed mode: Clock 285.750 MHz, 531 mm x 299 mm
               1280 1388 1530 1780 hborder 0
               1024 1027 1034 1116 vborder 0
               -hsync +vsync 
               VertFreq: 143 Hz, HorFreq: 160533 Hz
Detailed mode: Clock 140.250 MHz, 531 mm x 299 mm
               1024 1072 1104 1184 hborder 0
                768  771  775  823 vborder 0
               +hsync -vsync 
               VertFreq: 143 Hz, HorFreq: 118454 Hz
Checksum: 0x3f (valid)

EDID block does NOT conform to EDID 1.4!
	sRGB is signaled, but the chromaticities do not match
Warning: One or more of the timings is out of range of the Monitor Ranges:
  Vertical Freq: 24 - 143 Hz
  Horizontal Freq: 15625 - 166586 Hz
  Maximum Clock: 346.500 MHz
