edid-decode (hex):

00 ff ff ff ff ff ff 00 1e 6d 09 5b 06 02 07 00
06 1b 01 04 b5 3c 22 78 9e 30 35 a7 55 4e a3 26
0f 50 54 21 08 00 71 40 81 80 81 c0 a9 c0 d1 c0
81 00 01 01 01 01 4d d0 00 a0 f0 70 3e 80 30 20
65 0c 58 54 21 00 00 1a 28 68 00 a0 f0 70 3e 80
08 90 65 0c 58 54 21 00 00 1a 00 00 00 fd 00 38
3d 1e 87 38 00 0a 20 20 20 20 20 20 00 00 00 fc
00 4c 47 20 55 6c 74 72 61 20 48 44 0a 20 01 8b

----------------

Block 0, Base EDID:
  EDID Structure Version & Revision: 1.4
  Vendor & Product Identification:
    Manufacturer: GSM
    Model: 23305
    Serial Number: ...
    Made in: week 6 of 2017
  Basic Display Parameters & Features:
    Digital display
    Bits per primary color channel: 10
    DisplayPort interface
    Maximum image size: 60 cm x 34 cm
    Gamma: 2.20
    DPMS levels: Standby
    Supported color formats: RGB 4:4:4, YCrCb 4:4:4, YCrCb 4:2:2
    Default (sRGB) color space is primary color space
    First detailed timing includes the native pixel format and preferred refresh rate
  Color Characteristics:
    Red  : 0.6523, 0.3349
    Green: 0.3046, 0.6367
    Blue : 0.1484, 0.0615
    White: 0.3134, 0.3291
  Established Timings I & II:
    DMT 0x04:   640x480    59.940 Hz   4:3    31.469 kHz  25.175 MHz
    DMT 0x09:   800x600    60.317 Hz   4:3    37.879 kHz  40.000 MHz
    DMT 0x10:  1024x768    60.004 Hz   4:3    48.363 kHz  65.000 MHz
  Standard Timings:
    CVT     :  1152x864    59.959 Hz   4:3    53.783 kHz  81.750 MHz (EDID 1.4 source)
    GTF     :  1152x864    60.000 Hz   4:3    53.700 kHz  81.624 MHz (EDID 1.3 source)
    DMT 0x23:  1280x1024   60.020 Hz   5:4    63.981 kHz 108.000 MHz
    DMT 0x55:  1280x720    60.000 Hz  16:9    45.000 kHz  74.250 MHz
    DMT 0x53:  1600x900    60.000 Hz  16:9    60.000 kHz 108.000 MHz (RB)
    DMT 0x52:  1920x1080   60.000 Hz  16:9    67.500 kHz 148.500 MHz
    DMT 0x1c:  1280x800    59.810 Hz  16:10   49.702 kHz  83.500 MHz
  Detailed Timing Descriptors:
    DTD 1:  3840x2160   59.997 Hz  16:9   133.312 kHz 533.250 MHz (600 mm x 340 mm)
                 Hfront   48 Hsync  32 Hback  80 Hpol P
                 Vfront   54 Vsync   5 Vback   3 Vpol N
    DTD 2:  3840x2160   30.000 Hz  16:9    66.660 kHz 266.640 MHz (600 mm x 340 mm)
                 Hfront    8 Hsync 144 Hback   8 Hpol P
                 Vfront   54 Vsync   5 Vback   3 Vpol N
  Display Range Limits:
    Monitor ranges (GTF): 56-61 Hz V, 30-135 kHz H, max dotclock 560 MHz
    Display Product Name: 'LG Ultra HD'
  Extension blocks: 1
Checksum: 0x8b

----------------

Warnings:

All Blocks:
  Some timings are out of range of the Monitor Ranges:
    Vertical Freq: 30.000 - 60.317 Hz (Monitor: 56.000 - 61.000 Hz)

Failures:

Block 0, Base EDID:
  Basic Display Parameters & Features: sRGB is signaled, but the chromaticities do not match.
  Display Range Limits: GTF can't be combined with non-continuous frequencies.
  Base EDID: EDID specified 1 extension block(s), but found 0 extension block(s).
All Blocks:
  CVT timings are used, but the EDID does not signal CVT support.

EDID conformity: FAIL
