edid-decode (hex):

00 ff ff ff ff ff ff 00 10 ac 11 11 01 00 00 00
1e 15 01 03 80 33 1d 78 ee 9a 80 a3 58 51 9e 25
0e 50 54 00 00 00 01 01 01 01 01 01 01 01 01 01
01 01 01 01 01 01 a2 35 80 a0 70 38 14 40 58 2c
45 00 fe 1e 11 00 00 00 00 00 00 fc 00 4f 70 74
69 50 6c 65 78 20 39 30 31 30 00 00 00 fc 00 0a
20 20 20 20 20 20 20 20 20 20 20 20 00 00 00 fc
00 0a 20 20 20 20 20 20 20 20 20 20 20 20 00 bf

----------------

Block 0, Base EDID:
  EDID Structure Version & Revision: 1.3
  Vendor & Product Identification:
    Manufacturer: DEL
    Model: 4369
    Serial Number: ...
    Made in: week 30 of 2011
  Basic Display Parameters & Features:
    Digital display
    Maximum image size: 51 cm x 29 cm
    Gamma: 2.20
    DPMS levels: Standby Suspend Off
    RGB color display
    Default (sRGB) color space is primary color space
    First detailed timing is the preferred timing
  Color Characteristics:
    Red  : 0.6386, 0.3447
    Green: 0.3183, 0.6191
    Blue : 0.1464, 0.0546
    White: 0.3125, 0.3281
  Established Timings I & II: none
  Standard Timings: none
  Detailed Timing Descriptors:
    DTD 1:  1920x1080   60.008741 Hz  16:9     66.010 kHz    137.300000 MHz (analog composite, sync-on-green, 510 mm x 286 mm)
                 Hfront   88 Hsync  44 Hback   28 Hpol N
                 Vfront    4 Vsync   5 Vback   11 Vpol N
    Display Product Name: 'OptiPlex 9010'
    Display Product Name: ''
    Display Product Name: ''
Checksum: 0xbf

----------------

Failures:

Block 0, Base EDID:
  Basic Display Parameters & Features: sRGB is signaled, but the chromaticities do not match.
  Display Product Name: Empty string.
  Display Product Name: Empty string.
  Missing Display Range Limits Descriptor.

EDID conformity: FAIL
