
EDID (hex):
00ffffffffffff0030e4860300000000
00160104901f11780aa9259658578e28
1f505400000001010101010101010101
010101010101d81d56f4500016302430
350035ae1000001be51356f450001630
2430350035ae1000001b000000000000
00000000000000000000000000000002
000c47ff0a3c64121c296400000000dc

Extracted contents:
header:          00 ff ff ff ff ff ff 00
serial number:   30 e4 86 03 00 00 00 00 00 16
version:         01 04
basic params:    90 1f 11 78 0a
chroma info:     a9 25 96 58 57 8e 28 1f 50 54
established:     00 00 00
standard:        01 01 01 01 01 01 01 01 01 01 01 01 01 01 01 01
descriptor 1:    d8 1d 56 f4 50 00 16 30 24 30 35 00 35 ae 10 00 00 1b
descriptor 2:    e5 13 56 f4 50 00 16 30 24 30 35 00 35 ae 10 00 00 1b
descriptor 3:    00 00 00 00 00 00 00 00 00 00 00 00 00 00 00 00 00 00
descriptor 4:    00 00 00 02 00 0c 47 ff 0a 3c 64 12 1c 29 64 00 00 00
extensions:      00
checksum:        dc

EDID version: 1.4
Manufacturer: LGD Model 386 Serial Number --
Made in year 2012
Digital display
6 bits per primary color channel
Digital interface is not defined
Maximum image size: 31 cm x 17 cm
Gamma: 2.20
Supported color formats: RGB 4:4:4, YCrCb 4:4:4
First detailed timing includes the native pixel format and preferred refresh rate
Display x,y Chromaticity:
  Red:   0.5878, 0.3457
  Green: 0.3417, 0.5556
  Blue:  0.1562, 0.1230
  White: 0.3134, 0.3291
Established timings supported:
Standard timings supported:
Detailed mode: Clock 76.400 MHz, 309 mm x 174 mm
               1366 1402 1450 1610 hborder 0
                768  771  776  790 vborder 0
               +hsync -vsync 
               VertFreq: 60 Hz, HorFreq: 47453 Hz
Detailed mode: Clock 50.930 MHz, 309 mm x 174 mm
               1366 1402 1450 1610 hborder 0
                768  771  776  790 vborder 0
               +hsync -vsync 
               VertFreq: 40 Hz, HorFreq: 31633 Hz
Manufacturer-specified data, tag 0
Manufacturer-specified data, tag 2
Checksum: 0xdc (valid)
EDID block does NOT conform to EDID 1.4!
	Missing name descriptor
	Missing monitor ranges
