edid-decode (hex):

00 ff ff ff ff ff ff 00 52 64 00 00 00 00 00 00
1c 12 01 03 80 46 27 78 0a 5c dd a4 56 47 9b 25
0f 47 4a a3 08 00 01 01 01 01 01 01 01 01 01 01
01 01 01 01 01 01 01 1d 80 d0 72 1c 16 20 10 2c
25 80 c4 8e 21 00 00 9e 02 3a 80 d0 72 38 2d 40
10 2c 45 80 c4 8e 21 00 00 1e 00 00 00 fc 00 48
44 54 56 20 33 32 0a 20 20 20 20 20 00 00 00 fd
00 30 3f 2e 46 0f 00 0a 20 20 20 20 20 20 01 a6

02 03 1f 71 4f 94 1f 05 10 12 03 20 13 04 21 22
15 16 06 07 23 09 07 07 66 03 0c 00 30 00 80 8c
0a d0 90 20 40 31 20 0c 40 55 00 c4 8e 21 00 00
18 01 1d 80 18 71 1c 16 20 58 2c 25 00 c4 8e 21
00 00 9e 02 3a 80 18 71 38 2d 40 58 2c 45 00 c4
8e 21 00 00 1e 8c 0a d0 8a 20 e0 2d 10 10 3e 96
00 c4 8e 21 00 00 18 01 1d 80 3e 73 38 2d 40 7e
2c 45 80 c4 8e 21 00 00 1e 00 00 00 00 00 00 54

00 ff ff ff ff ff ff 00 52 64 00 00 00 00 00 00
1c 12 01 03 80 46 27 78 0a 5c dd a4 56 47 9b 25
0f 47 4a a3 08 00 01 01 01 01 01 01 01 01 01 01
01 01 01 01 01 01 01 1d 80 d0 72 1c 16 20 10 2c
25 80 c4 8e 21 00 00 9e 02 3a 80 d0 72 38 2d 40
10 2c 45 80 c4 8e 21 00 00 1e 00 00 00 fc 00 48
44 54 56 20 33 32 0a 20 20 20 20 20 00 00 00 fd
00 30 3f 2e 46 0f 00 0a 20 20 20 20 20 20 01 a6

02 03 1f 71 4f 94 1f 05 10 12 03 20 13 04 21 22
15 16 06 07 23 09 07 07 66 03 0c 00 30 00 80 8c
0a d0 90 20 40 31 20 0c 40 55 00 c4 8e 21 00 00
18 01 1d 80 18 71 1c 16 20 58 2c 25 00 c4 8e 21
00 00 9e 02 3a 80 18 71 38 2d 40 58 2c 45 00 c4
8e 21 00 00 1e 8c 0a d0 8a 20 e0 2d 10 10 3e 96
00 c4 8e 21 00 00 18 01 1d 80 3e 73 38 2d 40 7e
2c 45 80 c4 8e 21 00 00 1e 00 00 00 00 00 00 54

----------------

Block 0, Base EDID:
  EDID Structure Version & Revision: 1.3
  Vendor & Product Identification:
    Manufacturer: TSD
    Model: 0
    Made in: week 28 of 2008
  Basic Display Parameters & Features:
    Digital display
    Maximum image size: 70 cm x 39 cm
    Gamma: 2.20
    RGB color display
    First detailed timing is the preferred timing
  Color Characteristics:
    Red  : 0.6416, 0.3369
    Green: 0.2802, 0.6054
    Blue : 0.1474, 0.0595
    White: 0.2802, 0.2900
  Established Timings I & II:
    IBM     :   720x400    70.081663 Hz   9:5     31.467 kHz     28.320000 MHz
    DMT 0x04:   640x480    59.940476 Hz   4:3     31.469 kHz     25.175000 MHz
    DMT 0x08:   800x600    56.250000 Hz   4:3     35.156 kHz     36.000000 MHz
    DMT 0x09:   800x600    60.316541 Hz   4:3     37.879 kHz     40.000000 MHz
    DMT 0x10:  1024x768    60.003840 Hz   4:3     48.363 kHz     65.000000 MHz
  Standard Timings: none
  Detailed Timing Descriptors:
    DTD  1:  1920x1080i  50.000000 Hz  16:9     28.125 kHz     74.250000 MHz (708 mm x 398 mm)
                  Hfront  528 Hsync  44 Hback  148 Hpol P
                  Vfront    2 Vsync   5 Vback   15 Vpol P Vfront +0.5 Odd Field
                  Vfront    2 Vsync   5 Vback   15 Vpol P Vback  +0.5 Even Field
    DTD  2:  1920x1080   50.000000 Hz  16:9     56.250 kHz    148.500000 MHz (708 mm x 398 mm)
                  Hfront  528 Hsync  44 Hback  148 Hpol P
                  Vfront    4 Vsync   5 Vback   36 Vpol P
    Display Product Name: 'HDTV 32'
    Display Range Limits:
      Monitor ranges (GTF): 48-63 Hz V, 46-70 kHz H, max dotclock 150 MHz
  Extension blocks: 1
Checksum: 0xa6

----------------

Block 1, CTA-861 Extension Block:
  Revision: 3
  Basic audio support
  Supports YCbCr 4:4:4
  Supports YCbCr 4:2:2
  Native detailed modes: 1
  Video Data Block:
    VIC  20:  1920x1080i  50.000000 Hz  16:9     28.125 kHz     74.250000 MHz (native)
    VIC  31:  1920x1080   50.000000 Hz  16:9     56.250 kHz    148.500000 MHz
    VIC   5:  1920x1080i  60.000000 Hz  16:9     33.750 kHz     74.250000 MHz
    VIC  16:  1920x1080   60.000000 Hz  16:9     67.500 kHz    148.500000 MHz
    VIC  18:   720x576    50.000000 Hz  16:9     31.250 kHz     27.000000 MHz
    VIC   3:   720x480    59.940060 Hz  16:9     31.469 kHz     27.000000 MHz
    VIC  32:  1920x1080   24.000000 Hz  16:9     27.000 kHz     74.250000 MHz
    VIC  19:  1280x720    50.000000 Hz  16:9     37.500 kHz     74.250000 MHz
    VIC   4:  1280x720    60.000000 Hz  16:9     45.000 kHz     74.250000 MHz
    VIC  33:  1920x1080   25.000000 Hz  16:9     28.125 kHz     74.250000 MHz
    VIC  34:  1920x1080   30.000000 Hz  16:9     33.750 kHz     74.250000 MHz
    VIC  21:  1440x576i   50.000000 Hz   4:3     15.625 kHz     27.000000 MHz
    VIC  22:  1440x576i   50.000000 Hz  16:9     15.625 kHz     27.000000 MHz
    VIC   6:  1440x480i   59.940060 Hz   4:3     15.734 kHz     27.000000 MHz
    VIC   7:  1440x480i   59.940060 Hz  16:9     15.734 kHz     27.000000 MHz
  Audio Data Block:
    Linear PCM:
      Max channels: 2
      Supported sample rates (kHz): 48 44.1 32
      Supported sample sizes (bits): 24 20 16
  Vendor-Specific Data Block (HDMI), OUI 00-0C-03:
    Source physical address: 3.0.0.0
    Supports_AI
  Detailed Timing Descriptors:
    DTD  3:   720x576    50.000000 Hz   5:4     31.250 kHz     27.000000 MHz (708 mm x 398 mm)
                  Hfront   12 Hsync  64 Hback   68 Hpol N
                  Vfront    5 Vsync   5 Vback   39 Vpol N
    DTD  4:  1920x1080i  60.000000 Hz  16:9     33.750 kHz     74.250000 MHz (708 mm x 398 mm)
                  Hfront   88 Hsync  44 Hback  148 Hpol P
                  Vfront    2 Vsync   5 Vback   15 Vpol P Vfront +0.5 Odd Field
                  Vfront    2 Vsync   5 Vback   15 Vpol P Vback  +0.5 Even Field
    DTD  5:  1920x1080   60.000000 Hz  16:9     67.500 kHz    148.500000 MHz (708 mm x 398 mm)
                  Hfront   88 Hsync  44 Hback  148 Hpol P
                  Vfront    4 Vsync   5 Vback   36 Vpol P
    DTD  6:   720x480    59.940060 Hz   3:2     31.469 kHz     27.000000 MHz (708 mm x 398 mm)
                  Hfront   16 Hsync  62 Hback   60 Hpol N
                  Vfront    9 Vsync   6 Vback   30 Vpol N
    DTD  7:  1920x1080   24.000000 Hz  16:9     27.000 kHz     74.250000 MHz (708 mm x 398 mm)
                  Hfront  638 Hsync  44 Hback  148 Hpol P
                  Vfront    4 Vsync   5 Vback   36 Vpol P
Checksum: 0x54  Unused space in Extension Block: 6 bytes

----------------

Block 2, Unknown EDID Extension Block 0x00:
  00 ff ff ff ff ff ff 00 52 64 00 00 00 00 00 00 '........Rd......'
  1c 12 01 03 80 46 27 78 0a 5c dd a4 56 47 9b 25 '.....F'x.\..VG.%'
  0f 47 4a a3 08 00 01 01 01 01 01 01 01 01 01 01 '.GJ.............'
  01 01 01 01 01 01 01 1d 80 d0 72 1c 16 20 10 2c '..........r.. .,'
  25 80 c4 8e 21 00 00 9e 02 3a 80 d0 72 38 2d 40 '%...!....:..r8-@'
  10 2c 45 80 c4 8e 21 00 00 1e 00 00 00 fc 00 48 '.,E...!........H'
  44 54 56 20 33 32 0a 20 20 20 20 20 00 00 00 fd 'DTV 32.     ....'
  00 30 3f 2e 46 0f 00 0a 20 20 20 20 20 20 01 a6 '.0?.F...      ..'
Checksum: 0xa6

----------------

Block 3, CTA-861 Extension Block:
  Revision: 3
  Basic audio support
  Supports YCbCr 4:4:4
  Supports YCbCr 4:2:2
  Native detailed modes: 1
  Video Data Block:
    VIC  20:  1920x1080i  50.000000 Hz  16:9     28.125 kHz     74.250000 MHz (native)
    VIC  31:  1920x1080   50.000000 Hz  16:9     56.250 kHz    148.500000 MHz
    VIC   5:  1920x1080i  60.000000 Hz  16:9     33.750 kHz     74.250000 MHz
    VIC  16:  1920x1080   60.000000 Hz  16:9     67.500 kHz    148.500000 MHz
    VIC  18:   720x576    50.000000 Hz  16:9     31.250 kHz     27.000000 MHz
    VIC   3:   720x480    59.940060 Hz  16:9     31.469 kHz     27.000000 MHz
    VIC  32:  1920x1080   24.000000 Hz  16:9     27.000 kHz     74.250000 MHz
    VIC  19:  1280x720    50.000000 Hz  16:9     37.500 kHz     74.250000 MHz
    VIC   4:  1280x720    60.000000 Hz  16:9     45.000 kHz     74.250000 MHz
    VIC  33:  1920x1080   25.000000 Hz  16:9     28.125 kHz     74.250000 MHz
    VIC  34:  1920x1080   30.000000 Hz  16:9     33.750 kHz     74.250000 MHz
    VIC  21:  1440x576i   50.000000 Hz   4:3     15.625 kHz     27.000000 MHz
    VIC  22:  1440x576i   50.000000 Hz  16:9     15.625 kHz     27.000000 MHz
    VIC   6:  1440x480i   59.940060 Hz   4:3     15.734 kHz     27.000000 MHz
    VIC   7:  1440x480i   59.940060 Hz  16:9     15.734 kHz     27.000000 MHz
  Audio Data Block:
    Linear PCM:
      Max channels: 2
      Supported sample rates (kHz): 48 44.1 32
      Supported sample sizes (bits): 24 20 16
  Vendor-Specific Data Block (HDMI), OUI 00-0C-03:
    Source physical address: 3.0.0.0
    Supports_AI
  Detailed Timing Descriptors:
    DTD  8:   720x576    50.000000 Hz   5:4     31.250 kHz     27.000000 MHz (708 mm x 398 mm)
                  Hfront   12 Hsync  64 Hback   68 Hpol N
                  Vfront    5 Vsync   5 Vback   39 Vpol N
    DTD  9:  1920x1080i  60.000000 Hz  16:9     33.750 kHz     74.250000 MHz (708 mm x 398 mm)
                  Hfront   88 Hsync  44 Hback  148 Hpol P
                  Vfront    2 Vsync   5 Vback   15 Vpol P Vfront +0.5 Odd Field
                  Vfront    2 Vsync   5 Vback   15 Vpol P Vback  +0.5 Even Field
    DTD 10:  1920x1080   60.000000 Hz  16:9     67.500 kHz    148.500000 MHz (708 mm x 398 mm)
                  Hfront   88 Hsync  44 Hback  148 Hpol P
                  Vfront    4 Vsync   5 Vback   36 Vpol P
    DTD 11:   720x480    59.940060 Hz   3:2     31.469 kHz     27.000000 MHz (708 mm x 398 mm)
                  Hfront   16 Hsync  62 Hback   60 Hpol N
                  Vfront    9 Vsync   6 Vback   30 Vpol N
    DTD 12:  1920x1080   24.000000 Hz  16:9     27.000 kHz     74.250000 MHz (708 mm x 398 mm)
                  Hfront  638 Hsync  44 Hback  148 Hpol P
                  Vfront    4 Vsync   5 Vback   36 Vpol P
Checksum: 0x54  Unused space in Extension Block: 6 bytes

----------------

Warnings:

Block 1, CTA-861 Extension Block:
  IT Video Formats are overscanned by default, but normally this should be underscanned.
  Add a Colorimetry Data Block with the sRGB colorimetry bit set to avoid interop issues.
Block 3, CTA-861 Extension Block:
  IT Video Formats are overscanned by default, but normally this should be underscanned.
  Add a Colorimetry Data Block with the sRGB colorimetry bit set to avoid interop issues.
EDID:
  CTA-861: Multiple native interlaced timings are defined.

Failures:

Block 1, CTA-861 Extension Block:
  Missing VCDB, needed for Set Selectable RGB Quantization to avoid interop issues.
Block 2, Base EDID:
  Unknown Extension Block.
Block 3, CTA-861 Extension Block:
  Video Data Block: Duplicate VIC 20.
  Video Data Block: Duplicate VIC 31.
  Video Data Block: Duplicate VIC 5.
  Video Data Block: Duplicate VIC 16.
  Video Data Block: Duplicate VIC 18.
  Video Data Block: Duplicate VIC 3.
  Video Data Block: Duplicate VIC 32.
  Video Data Block: Duplicate VIC 19.
  Video Data Block: Duplicate VIC 4.
  Video Data Block: Duplicate VIC 33.
  Video Data Block: Duplicate VIC 34.
  Video Data Block: Duplicate VIC 21.
  Video Data Block: Duplicate VIC 22.
  Video Data Block: Duplicate VIC 6.
  Video Data Block: Duplicate VIC 7.
  Missing VCDB, needed for Set Selectable RGB Quantization to avoid interop issues.
EDID:
  Base EDID: Some timings are out of range of the Monitor Ranges:
    Vertical Freq: 24.000 - 70.082 Hz (Monitor: 48.000 - 63.000 Hz)
    Horizontal Freq: 15.625 - 67.500 kHz (Monitor: 46.000 - 70.000 kHz)
  Base EDID: EDID specified 1 extension block(s), but found 3 extension block(s).
  Base EDID: EDID 1.3 requires a Block Map Extension in Block 1 if there are more than 2 blocks in the EDID.
  CTA-861: A native interlaced timing is present, but not a native progressive timing.

EDID conformity: FAIL
