
EDID (hex):
00ffffffffffff004d103e1400000000
28190104a52313780e0aa8a95434b925
0d4f5800000001010101010101010101
0101010101014dd000a0f0703e803020
35005ac2100000180000000000000000
00000000000000000000000000fe0037
50485054824c51313536443100000000
0002410328001200000b010a20200010

Extracted contents:
header:          00 ff ff ff ff ff ff 00
serial number:   4d 10 3e 14 00 00 00 00 28 19
version:         01 04
basic params:    a5 23 13 78 0e
chroma info:     0a a8 a9 54 34 b9 25 0d 4f 58
established:     00 00 00
standard:        01 01 01 01 01 01 01 01 01 01 01 01 01 01 01 01
descriptor 1:    4d d0 00 a0 f0 70 3e 80 30 20 35 00 5a c2 10 00 00 18
descriptor 2:    00 00 00 00 00 00 00 00 00 00 00 00 00 00 00 00 00 00
descriptor 3:    00 00 00 fe 00 37 50 48 50 54 82 4c 51 31 35 36 44 31
descriptor 4:    00 00 00 00 00 02 41 03 28 00 12 00 00 0b 01 0a 20 20
extensions:      00
checksum:        10

EDID version: 1.4
Manufacturer: SHP Model 143e Serial Number --
Made in week 40 of 2015
Digital display
8 bits per primary color channel
DisplayPort interface
Maximum image size: 35 cm x 19 cm
Gamma: 2.20
Supported color formats: RGB 4:4:4, YCrCb 4:4:4
Default (sRGB) color space is primary color space
First detailed timing includes the native pixel format and preferred refresh rate
Display x,y Chromaticity:
  Red:   0.6601, 0.3281
  Green: 0.2050, 0.7246
  Blue:  0.1464, 0.0527
  White: 0.3105, 0.3437
Established timings supported:
Standard timings supported:
Detailed mode: Clock 533.250 MHz, 346 mm x 194 mm
               3840 3888 3920 4000 hborder 0
               2160 2163 2168 2222 vborder 0
               -hsync -vsync 
               VertFreq: 59 Hz, HorFreq: 133312 Hz
Manufacturer-specified data, tag 0
ASCII string: 7PHPT
Manufacturer-specified data, tag 0
Checksum: 0x10 (valid)
EDID block does NOT conform to EDID 1.4!
	sRGB is signaled, but the chromaticities do not match
	Missing name descriptor
	Missing monitor ranges
	Detailed block string not properly terminated
