
EDID (hex):
00ffffffffffff004d10633201010101
001a0103804627780a2e6da7554ea327
0c474aa3080081c08100810f81409500
b30081800101023a801871382d40582c
4500ba882100001ea91a00a050001630
30203700ba882100001a000000fc004c
432d33324c42343830550a20000000fd
00174c0f510f000a202020202020019d
020320714a0102030405060720902226
09070715075066030c00300080e2000f
023a801871382d40582c4500ba882100
001e011d8018711c1620582c2500ba88
2100009e011d007251d01e206e285500
ba882100001e8c0ad08a20e02d10103e
9600ba88210000188c0aa01451f01600
267c4300ba88210000980000000000b4

Extracted contents:
header:          00 ff ff ff ff ff ff 00
serial number:   4d 10 63 32 01 01 01 01 00 1a
version:         01 03
basic params:    80 46 27 78 0a
chroma info:     2e 6d a7 55 4e a3 27 0c 47 4a
established:     a3 08 00
standard:        81 c0 81 00 81 0f 81 40 95 00 b3 00 81 80 01 01
descriptor 1:    02 3a 80 18 71 38 2d 40 58 2c 45 00 ba 88 21 00 00 1e
descriptor 2:    a9 1a 00 a0 50 00 16 30 30 20 37 00 ba 88 21 00 00 1a
descriptor 3:    00 00 00 fc 00 4c 43 2d 33 32 4c 42 34 38 30 55 0a 20
descriptor 4:    00 00 00 fd 00 17 4c 0f 51 0f 00 0a 20 20 20 20 20 20
extensions:      01
checksum:        9d

EDID version: 1.3
Manufacturer: SHP Model 3263 Serial Number --
Made in year 2016
Digital display
Maximum image size: 70 cm x 39 cm
Gamma: 2.20
RGB color display
First detailed timing is preferred timing
Display x,y Chromaticity:
  Red:   0.6523, 0.3339
  Green: 0.3076, 0.6386
  Blue:  0.1533, 0.0488
  White: 0.2802, 0.2900
Established timings supported:
  720x400@70Hz 9:5 HorFreq: 31469 Hz Clock: 28.320 MHz
  640x480@60Hz 4:3 HorFreq: 31469 Hz Clock: 25.175 MHz
  800x600@56Hz 4:3 HorFreq: 35200 Hz Clock: 36.000 MHz
  800x600@60Hz 4:3 HorFreq: 37900 Hz Clock: 40.000 MHz
  1024x768@60Hz 4:3 HorFreq: 48400 Hz Clock: 65.000 MHz
Standard timings supported:
  1280x720@60Hz 16:9
  1280x800@60Hz 16:10
  1280x800@75Hz 16:10
  1280x960@60Hz 4:3 HorFreq: 60000 Hz Clock: 108.000 MHz
  1440x900@60Hz 16:10 HorFreq: 55500 Hz Clock: 88.750 MHz
  1680x1050@60Hz 16:10 HorFreq: 64700 Hz Clock: 119.000 MHz
  1280x1024@60Hz 5:4 HorFreq: 64000 Hz Clock: 108.000 MHz
Detailed mode: Clock 148.500 MHz, 698 mm x 392 mm
               1920 2008 2052 2200 hborder 0
               1080 1084 1089 1125 vborder 0
               +hsync +vsync 
               VertFreq: 60 Hz, HorFreq: 67500 Hz
Detailed mode: Clock 68.250 MHz, 698 mm x 392 mm
               1280 1328 1360 1440 hborder 0
                768  771  778  790 vborder 0
               +hsync -vsync 
               VertFreq: 59 Hz, HorFreq: 47395 Hz
Monitor name: LC-32LB480U
Monitor ranges (GTF): 23-76Hz V, 15-81kHz H, max dotclock 150MHz
Has 1 extension blocks
Checksum: 0x9d (valid)

CTA extension block
Extension version: 3
28 bytes of CTA data
  Video data block
    VIC   1 640x480@60Hz 4:3  HorFreq: 31469 Hz Clock: 25.175 MHz
    VIC   2 720x480@60Hz 4:3  HorFreq: 31469 Hz Clock: 27.000 MHz
    VIC   3 720x480@60Hz 16:9  HorFreq: 31469 Hz Clock: 27.000 MHz
    VIC   4 1280x720@60Hz 16:9  HorFreq: 45000 Hz Clock: 74.250 MHz
    VIC   5 1920x1080i@60Hz 16:9  HorFreq: 33750 Hz Clock: 74.250 MHz
    VIC   6 1440x480i@60Hz 4:3  HorFreq: 15734 Hz Clock: 27.000 MHz
    VIC   7 1440x480i@60Hz 16:9  HorFreq: 15734 Hz Clock: 27.000 MHz
    VIC  32 1920x1080@24Hz 16:9  HorFreq: 27000 Hz Clock: 74.250 MHz
    VIC  16 1920x1080@60Hz 16:9 (native) HorFreq: 67500 Hz Clock: 148.500 MHz
    VIC  34 1920x1080@30Hz 16:9  HorFreq: 33750 Hz Clock: 74.250 MHz
  Audio data block
    Linear PCM, max channels 2
      Supported sample rates (kHz): 48 44.1 32
      Supported sample sizes (bits): 24 20 16
    AC-3, max channels 6
      Supported sample rates (kHz): 48 44.1 32
      Maximum bit rate: 640 kHz
  Vendor-specific data block, OUI 000c03 (HDMI)
    Source physical address 3.0.0.0
    Supports_AI
  Extended tag: Video capability data block
    YCbCr quantization: No Data (0)
    RGB quantization: No Data (0)
    PT scan behaviour: No Data (0)
    IT scan behaviour: Support both over- and underscan (3)
    CE scan behaviour: Support both over- and underscan (3)
Basic audio support
Supports YCbCr 4:4:4
Supports YCbCr 4:2:2
1 native detailed modes
Detailed mode: Clock 148.500 MHz, 698 mm x 392 mm
               1920 2008 2052 2200 hborder 0
               1080 1084 1089 1125 vborder 0
               +hsync +vsync 
               VertFreq: 60 Hz, HorFreq: 67500 Hz
Detailed mode: Clock 74.250 MHz, 698 mm x 392 mm
               1920 2008 2052 2200 hborder 0
                540  542  547  562 vborder 0
               +hsync +vsync interlaced 
               VertFreq: 60 Hz, HorFreq: 33750 Hz
Detailed mode: Clock 74.250 MHz, 698 mm x 392 mm
               1280 1390 1430 1650 hborder 0
                720  725  730  750 vborder 0
               +hsync +vsync 
               VertFreq: 60 Hz, HorFreq: 45000 Hz
Detailed mode: Clock 27.000 MHz, 698 mm x 392 mm
                720  736  798  858 hborder 0
                480  489  495  525 vborder 0
               -hsync -vsync 
               VertFreq: 59 Hz, HorFreq: 31468 Hz
Detailed mode: Clock 27.000 MHz, 698 mm x 392 mm
               1440 1478 1602 1716 hborder 0
                240  244  247  262 vborder 0
               -hsync -vsync interlaced 
               VertFreq: 60 Hz, HorFreq: 15734 Hz
Checksum: 0xb4 (valid)
