
EDID (hex):
00ffffffffffff004c23362700040000
211e0104a53c21783bee9da3544c9926
0f474abfef00d1c081803168317c4568
457c6168617c023a801871382d40582c
450055502100001efc7e808870381240
1820350055502100001e000000fd0030
a5a0a021010a202020202020000000fc
0044500a202020202020202020200139
020318f14b0103051404131f12021190
2309070783010000fe5b80a070383540
30203500534f2100001e866f80a07038
404030203500534f2100001e909780a0
703835403020450055502100001eab22
a0a050841a3030203600ba892100001a
7c2e90a0601a1e4030203600ba892100
001a0000000000000000000000000080

Extracted contents:
header:          00 ff ff ff ff ff ff 00
serial number:   4c 23 36 27 00 04 00 00 21 1e
version:         01 04
basic params:    a5 3c 21 78 3b
chroma info:     ee 9d a3 54 4c 99 26 0f 47 4a
established:     bf ef 00
standard:        d1 c0 81 80 31 68 31 7c 45 68 45 7c 61 68 61 7c
descriptor 1:    02 3a 80 18 71 38 2d 40 58 2c 45 00 55 50 21 00 00 1e
descriptor 2:    fc 7e 80 88 70 38 12 40 18 20 35 00 55 50 21 00 00 1e
descriptor 3:    00 00 00 fd 00 30 a5 a0 a0 21 01 0a 20 20 20 20 20 20
descriptor 4:    00 00 00 fc 00 44 50 0a 20 20 20 20 20 20 20 20 20 20
extensions:      01
checksum:        39

EDID version: 1.4
Manufacturer: SAC Model 2736 Serial Number --
Made in week 33 of 2020
Digital display
8 bits per primary color channel
DisplayPort interface
Maximum image size: 60 cm x 33 cm
Gamma: 2.20
DPMS levels: Off
Supported color formats: RGB 4:4:4, YCrCb 4:4:4, YCrCb 4:2:2
First detailed timing includes the native pixel format and preferred refresh rate
Display is continuous frequency
Display x,y Chromaticity:
  Red:   0.6396, 0.3300
  Green: 0.2998, 0.5996
  Blue:  0.1503, 0.0595
  White: 0.2802, 0.2900
Established timings supported:
  720x400@70Hz 9:5 HorFreq: 31469 Hz Clock: 28.320 MHz
  640x480@60Hz 4:3 HorFreq: 31469 Hz Clock: 25.175 MHz
  640x480@67Hz 4:3 HorFreq: 35000 Hz Clock: 30.240 MHz
  640x480@72Hz 4:3 HorFreq: 37900 Hz Clock: 31.500 MHz
  640x480@75Hz 4:3 HorFreq: 37500 Hz Clock: 31.500 MHz
  800x600@56Hz 4:3 HorFreq: 35200 Hz Clock: 36.000 MHz
  800x600@60Hz 4:3 HorFreq: 37900 Hz Clock: 40.000 MHz
  800x600@72Hz 4:3 HorFreq: 48100 Hz Clock: 50.000 MHz
  800x600@75Hz 4:3 HorFreq: 46900 Hz Clock: 49.500 MHz
  832x624@75Hz 4:3 HorFreq: 49726 Hz Clock: 57.284 MHz
  1024x768@60Hz 4:3 HorFreq: 48400 Hz Clock: 65.000 MHz
  1024x768@70Hz 4:3 HorFreq: 56500 Hz Clock: 75.000 MHz
  1024x768@75Hz 4:3 HorFreq: 60000 Hz Clock: 78.750 MHz
  1280x1024@75Hz 5:4 HorFreq: 80000 Hz Clock: 135.000 MHz
Standard timings supported:
  1920x1080@60Hz 16:9
  1280x1024@60Hz 5:4 HorFreq: 64000 Hz Clock: 108.000 MHz
  640x480@100Hz 4:3
  640x480@120Hz 4:3
  800x600@100Hz 4:3
  800x600@120Hz 4:3
  1024x768@100Hz 4:3
  1024x768@120Hz 4:3
Detailed mode: Clock 148.500 MHz, 597 mm x 336 mm
               1920 2008 2052 2200 hborder 0
               1080 1084 1089 1125 vborder 0
               +hsync +vsync 
               VertFreq: 60 Hz, HorFreq: 67500 Hz
Detailed mode: Clock 325.080 MHz, 597 mm x 336 mm
               1920 1944 1976 2056 hborder 0
               1080 1083 1088 1098 vborder 0
               +hsync +vsync 
               VertFreq: 144 Hz, HorFreq: 158112 Hz
Monitor ranges (bare limits): 48-165Hz V, 160-160kHz H, max dotclock 330MHz
Monitor name: DP
Has 1 extension blocks
Checksum: 0x39 (valid)

CTA extension block
Extension version: 3
20 bytes of CTA data
  Video data block
    VIC   1 640x480@60Hz 4:3  HorFreq: 31469 Hz Clock: 25.175 MHz
    VIC   3 720x480@60Hz 16:9  HorFreq: 31469 Hz Clock: 27.000 MHz
    VIC   5 1920x1080i@60Hz 16:9  HorFreq: 33750 Hz Clock: 74.250 MHz
    VIC  20 1920x1080i@50Hz 16:9  HorFreq: 28125 Hz Clock: 74.250 MHz
    VIC   4 1280x720@60Hz 16:9  HorFreq: 45000 Hz Clock: 74.250 MHz
    VIC  19 1280x720@50Hz 16:9  HorFreq: 37500 Hz Clock: 74.250 MHz
    VIC  31 1920x1080@50Hz 16:9  HorFreq: 56250 Hz Clock: 148.500 MHz
    VIC  18 720x576@50Hz 16:9  HorFreq: 31250 Hz Clock: 27.000 MHz
    VIC   2 720x480@60Hz 4:3  HorFreq: 31469 Hz Clock: 27.000 MHz
    VIC  17 720x576@50Hz 4:3  HorFreq: 31250 Hz Clock: 27.000 MHz
    VIC  16 1920x1080@60Hz 16:9 (native) HorFreq: 67500 Hz Clock: 148.500 MHz
  Audio data block
    Linear PCM, max channels 2
      Supported sample rates (kHz): 48 44.1 32
      Supported sample sizes (bits): 24 20 16
  Speaker allocation data block
    Speaker map:
      FL/FR - Front Left/Right
Underscans PC formats by default
Basic audio support
Supports YCbCr 4:4:4
Supports YCbCr 4:2:2
1 native detailed modes
Detailed mode: Clock 235.500 MHz, 595 mm x 335 mm
               1920 1968 2000 2080 hborder 0
               1080 1083 1088 1133 vborder 0
               +hsync +vsync 
               VertFreq: 99 Hz, HorFreq: 113221 Hz
Detailed mode: Clock 285.500 MHz, 595 mm x 335 mm
               1920 1968 2000 2080 hborder 0
               1080 1083 1088 1144 vborder 0
               +hsync +vsync 
               VertFreq: 119 Hz, HorFreq: 137259 Hz
Detailed mode: Clock 388.000 MHz, 597 mm x 336 mm
               1920 1968 2000 2080 hborder 0
               1080 1084 1089 1133 vborder 0
               +hsync +vsync 
               VertFreq: 164 Hz, HorFreq: 186538 Hz
Detailed mode: Clock 88.750 MHz, 698 mm x 393 mm
               1440 1488 1520 1600 hborder 0
                900  903  909  926 vborder 0
               +hsync -vsync 
               VertFreq: 59 Hz, HorFreq: 55468 Hz
Detailed mode: Clock 119.000 MHz, 698 mm x 393 mm
               1680 1728 1760 1840 hborder 0
               1050 1053 1059 1080 vborder 0
               +hsync -vsync 
               VertFreq: 59 Hz, HorFreq: 64673 Hz
Checksum: 0x80 (valid)

Warning: One or more of the timings is out of range of the Monitor Ranges:
  Vertical Freq: 50 - 164 Hz
  Horizontal Freq: 28125 - 186538 Hz
  Maximum Clock: 388.000 MHz
