
EDID (hex):
00ffffffffffff0038a3576601010101
0b0f0103081e1778eacb9ea0584b9624
164e54bfee0001010101010101010101
010101010101c31e0020410020301060
130030e41000001e000000fd00384b1f
3d08000a202020202020000000fc004c
43443532564d0a2020202020000000ff
0035333134373935374e420a202000c8

Extracted contents:
header:          00 ff ff ff ff ff ff 00
serial number:   38 a3 57 66 01 01 01 01 0b 0f
version:         01 03
basic params:    08 1e 17 78 ea
chroma info:     cb 9e a0 58 4b 96 24 16 4e 54
established:     bf ee 00
standard:        01 01 01 01 01 01 01 01 01 01 01 01 01 01 01 01
descriptor 1:    c3 1e 00 20 41 00 20 30 10 60 13 00 30 e4 10 00 00 1e
descriptor 2:    00 00 00 fd 00 38 4b 1f 3d 08 00 0a 20 20 20 20 20 20
descriptor 3:    00 00 00 fc 00 4c 43 44 35 32 56 4d 0a 20 20 20 20 20
descriptor 4:    00 00 00 ff 00 35 33 31 34 37 39 35 37 4e 42 0a 20 20
extensions:      00
checksum:        c8

EDID version: 1.3
Manufacturer: NEC Model 6657 Serial Number --
Analog display, Input voltage level: 0.7/0.3 V
Sync: Separate 
Maximum image size: 30 cm x 23 cm
Gamma: 2.20
DPMS levels: Standby Suspend Off
RGB color display
First detailed timing is preferred timing
Display x,y Chromaticity:
  Red:   0.6279, 0.3437
  Green: 0.2949, 0.5888
  Blue:  0.1425, 0.0869
  White: 0.3076, 0.3300
Established timings supported:
  720x400@70Hz 9:5 HorFreq: 31469 Hz Clock: 28.320 MHz
  640x480@60Hz 4:3 HorFreq: 31469 Hz Clock: 25.175 MHz
  640x480@67Hz 4:3 HorFreq: 35000 Hz Clock: 30.240 MHz
  640x480@72Hz 4:3 HorFreq: 37900 Hz Clock: 31.500 MHz
  640x480@75Hz 4:3 HorFreq: 37500 Hz Clock: 31.500 MHz
  800x600@56Hz 4:3 HorFreq: 35200 Hz Clock: 36.000 MHz
  800x600@60Hz 4:3 HorFreq: 37900 Hz Clock: 40.000 MHz
  800x600@72Hz 4:3 HorFreq: 48100 Hz Clock: 50.000 MHz
  800x600@75Hz 4:3 HorFreq: 46900 Hz Clock: 49.500 MHz
  832x624@75Hz 4:3 HorFreq: 49726 Hz Clock: 57.284 MHz
  1024x768@60Hz 4:3 HorFreq: 48400 Hz Clock: 65.000 MHz
  1024x768@70Hz 4:3 HorFreq: 56500 Hz Clock: 75.000 MHz
  1024x768@75Hz 4:3 HorFreq: 60000 Hz Clock: 78.750 MHz
Standard timings supported:
Detailed mode: Clock 78.750 MHz, 304 mm x 228 mm
               1024 1040 1136 1312 hborder 0
                768  769  772  800 vborder 0
               +hsync +vsync 
               VertFreq: 75 Hz, HorFreq: 60022 Hz
Monitor ranges (GTF): 56-75Hz V, 31-61kHz H, max dotclock 80MHz
Monitor name: LCD52VM
Serial number: --
Checksum: 0xc8 (valid)
EDID block does not conform at all!
	Bad year of manufacture
