edid-decode (hex):

00 ff ff ff ff ff ff 00 22 f0 04 26 37 35 30 43
2d 0d 01 03 68 24 1b 80 ea 5e 89 a3 53 46 98 24
11 48 4c a4 43 00 31 59 45 59 61 59 a9 45 01 01
01 01 01 01 01 01 ea 24 00 60 41 00 28 30 30 60
13 00 38 ea 10 00 00 1e 00 00 00 fd 00 32 8c 1e
56 12 00 0a 20 20 20 20 20 20 00 00 00 fc 00 68
70 20 37 35 35 30 0a 20 20 20 20 20 00 00 00 ff
00 4d 58 33 34 35 57 43 30 35 37 0a 20 20 00 25

00 ff ff ff ff ff ff 00 22 f0 04 26 37 35 30 43
2d 0d 01 03 68 24 1b 80 ea 5e 89 a3 53 46 98 24
11 48 4c a4 43 00 31 59 45 59 61 59 a9 45 01 01
01 01 01 01 01 01 ea 24 00 60 41 00 28 30 30 60
13 00 38 ea 10 00 00 1e 00 00 00 fd 00 32 8c 1e
56 12 00 0a 20 20 20 20 20 20 00 00 00 fc 00 68
70 20 37 35 35 30 0a 20 20 20 20 20 00 00 00 ff
00 4d 58 33 34 35 57 43 30 35 37 0a 20 20 00 25

----------------

Block 0, Base EDID:
  EDID Structure Version & Revision: 1.3
  Vendor & Product Identification:
    Manufacturer: HWP
    Model: 9732
    Serial Number: ...
    Made in: week 45 of 2003
  Basic Display Parameters & Features:
    Analog display
    Signal Level Standard: 0.700 : 0.000 : 0.700 V p-p
    Blank level equals black level
    Sync: Separate
    Maximum image size: 36 cm x 27 cm
    Gamma: 2.28
    DPMS levels: Standby Suspend Off
    RGB color display
    First detailed timing is the preferred timing
  Color Characteristics:
    Red  : 0.6376, 0.3251
    Green: 0.2763, 0.5957
    Blue : 0.1425, 0.0664
    White: 0.2832, 0.2978
  Established Timings I & II:
    IBM     :   720x400    70.081663 Hz   9:5     31.467 kHz     28.320000 MHz
    DMT 0x04:   640x480    59.940476 Hz   4:3     31.469 kHz     25.175000 MHz
    DMT 0x06:   640x480    75.000000 Hz   4:3     37.500 kHz     31.500000 MHz
    DMT 0x0b:   800x600    75.000000 Hz   4:3     46.875 kHz     49.500000 MHz
    DMT 0x12:  1024x768    75.028582 Hz   4:3     60.023 kHz     78.750000 MHz
    DMT 0x24:  1280x1024   75.024675 Hz   5:4     79.976 kHz    135.000000 MHz
  Standard Timings:
    DMT 0x07:   640x480    85.008312 Hz   4:3     43.269 kHz     36.000000 MHz
    DMT 0x0c:   800x600    85.061274 Hz   4:3     53.674 kHz     56.250000 MHz
    DMT 0x13:  1024x768    84.996690 Hz   4:3     68.677 kHz     94.500000 MHz
    DMT 0x34:  1600x1200   65.000000 Hz   4:3     81.250 kHz    175.500000 MHz
  Detailed Timing Descriptors:
    DTD 1:  1024x768    84.996690 Hz   4:3     68.677 kHz     94.500000 MHz (312 mm x 234 mm)
                 Hfront   48 Hsync  96 Hback  208 Hpol P
                 Vfront    1 Vsync   3 Vback   36 Vpol P
    Display Range Limits:
      Monitor ranges (GTF): 50-140 Hz V, 30-86 kHz H, max dotclock 180 MHz
    Display Product Name: 'hp 7550'
    Display Product Serial Number: ...
Checksum: 0x25

----------------

Block 1, Unknown EDID Extension Block 0x00:
  00 ff ff ff ff ff ff 00 22 f0 04 26 37 35 30 43 '........"..&750C'
  2d 0d 01 03 68 24 1b 80 ea 5e 89 a3 53 46 98 24 '-...h$...^..SF.$'
  11 48 4c a4 43 00 31 59 45 59 61 59 a9 45 01 01 '.HL.C.1YEYaY.E..'
  01 01 01 01 01 01 ea 24 00 60 41 00 28 30 30 60 '.......$.`A.(00`'
  13 00 38 ea 10 00 00 1e 00 00 00 fd 00 32 8c 1e '..8..........2..'
  56 12 00 0a 20 20 20 20 20 20 00 00 00 fc 00 68 'V...      .....h'
  70 20 37 35 35 30 0a 20 20 20 20 20 00 00 00 ff 'p 7550.     ....'
  00 4d 58 33 34 35 57 43 30 35 37 0a 20 20 00 25 '.MX345WC057.  .%'
Checksum: 0x25

----------------

Failures:

Block 0, Base EDID:
  Detailed Timing Descriptor #1: Mismatch of image size 312x234 mm vs display size 360x270 mm.
Block 1, Base EDID:
  Unknown Extension Block.
EDID:
  Base EDID: EDID specified 0 extension block(s), but found 1 extension block(s).

EDID conformity: FAIL
