edid-decode (hex):

00 ff ff ff ff ff ff 00 04 69 b4 19 9b 0a 01 00
2f 11 01 03 80 26 1e 78 ea 85 85 a6 57 4a 9c 26
12 50 54 bf ee 80 81 cf 81 8f 71 4f 81 80 01 01
01 01 01 01 01 01 30 2a 00 98 51 00 2a 40 30 70
13 00 54 0e 11 00 00 1e 00 00 00 ff 00 37 42 4c
4d 54 46 30 36 38 32 35 31 0a 00 00 00 fd 00 37
4b 1e 53 0f 00 0a 20 20 20 20 20 20 00 00 00 fc
00 41 53 55 53 20 56 42 31 39 31 0a 20 20 00 23

00 ff ff ff ff ff ff 00 04 69 b4 19 9b 0a 01 00
2f 11 01 03 80 26 1e 78 ea 85 85 a6 57 4a 9c 26
12 50 54 bf ee 80 81 cf 81 8f 71 4f 81 80 01 01
01 01 01 01 01 01 30 2a 00 98 51 00 2a 40 30 70
13 00 54 0e 11 00 00 1e 00 00 00 ff 00 37 42 4c
4d 54 46 30 36 38 32 35 31 0a 00 00 00 fd 00 37
4b 1e 53 0f 00 0a 20 20 20 20 20 20 00 00 00 fc
00 41 53 55 53 20 56 42 31 39 31 0a 20 20 00 23

----------------

Block 0, Base EDID:
  EDID Structure Version & Revision: 1.3
  Vendor & Product Identification:
    Manufacturer: ACI
    Model: 6580
    Serial Number: ...
    Made in: week 47 of 2007
  Basic Display Parameters & Features:
    Digital display
    Maximum image size: 38 cm x 30 cm
    Gamma: 2.20
    DPMS levels: Standby Suspend Off
    RGB color display
    First detailed timing is the preferred timing
  Color Characteristics:
    Red  : 0.6503, 0.3398
    Green: 0.2900, 0.6103
    Blue : 0.1503, 0.0703
    White: 0.3134, 0.3291
  Established Timings I & II:
    IBM     :   720x400    70.081663 Hz   9:5     31.467 kHz     28.320000 MHz
    DMT 0x04:   640x480    59.940476 Hz   4:3     31.469 kHz     25.175000 MHz
    Apple   :   640x480    66.666667 Hz   4:3     35.000 kHz     30.240000 MHz
    DMT 0x05:   640x480    72.808802 Hz   4:3     37.861 kHz     31.500000 MHz
    DMT 0x06:   640x480    75.000000 Hz   4:3     37.500 kHz     31.500000 MHz
    DMT 0x08:   800x600    56.250000 Hz   4:3     35.156 kHz     36.000000 MHz
    DMT 0x09:   800x600    60.316541 Hz   4:3     37.879 kHz     40.000000 MHz
    DMT 0x0a:   800x600    72.187572 Hz   4:3     48.077 kHz     50.000000 MHz
    DMT 0x0b:   800x600    75.000000 Hz   4:3     46.875 kHz     49.500000 MHz
    Apple   :   832x624    74.551266 Hz   4:3     49.726 kHz     57.284000 MHz
    DMT 0x10:  1024x768    60.003840 Hz   4:3     48.363 kHz     65.000000 MHz
    DMT 0x11:  1024x768    70.069359 Hz   4:3     56.476 kHz     75.000000 MHz
    DMT 0x12:  1024x768    75.028582 Hz   4:3     60.023 kHz     78.750000 MHz
    Apple   :  1152x870    75.061550 Hz 192:145   68.681 kHz    100.000000 MHz
  Standard Timings:
    GTF     :  1280x720    74.999686 Hz  16:9     56.400 kHz     95.654000 MHz
    DMT 0x24:  1280x1024   75.024675 Hz   5:4     79.976 kHz    135.000000 MHz
    DMT 0x15:  1152x864    75.000000 Hz   4:3     67.500 kHz    108.000000 MHz
    DMT 0x23:  1280x1024   60.019740 Hz   5:4     63.981 kHz    108.000000 MHz
  Detailed Timing Descriptors:
    DTD 1:  1280x1024   60.019740 Hz   5:4     63.981 kHz    108.000000 MHz (340 mm x 270 mm)
                 Hfront   48 Hsync 112 Hback  248 Hpol P
                 Vfront    1 Vsync   3 Vback   38 Vpol P
    Display Product Serial Number: ...
    Display Range Limits:
      Monitor ranges (GTF): 55-75 Hz V, 30-83 kHz H, max dotclock 150 MHz
    Display Product Name: 'ASUS VB191'
Checksum: 0x23

----------------

Block 1, Unknown EDID Extension Block 0x00:
  00 ff ff ff ff ff ff 00 04 69 b4 19 9b 0a 01 00 '.........i......'
  2f 11 01 03 80 26 1e 78 ea 85 85 a6 57 4a 9c 26 '/....&.x....WJ.&'
  12 50 54 bf ee 80 81 cf 81 8f 71 4f 81 80 01 01 '.PT.......qO....'
  01 01 01 01 01 01 30 2a 00 98 51 00 2a 40 30 70 '......0*..Q.*@0p'
  13 00 54 0e 11 00 00 1e 00 00 00 ff 00 37 42 4c '..T..........7BL'
  4d 54 46 30 36 38 32 35 31 0a 00 00 00 fd 00 37 'MTF068251......7'
  4b 1e 53 0f 00 0a 20 20 20 20 20 20 00 00 00 fc 'K.S...      ....'
  00 41 53 55 53 20 56 42 31 39 31 0a 20 20 00 23 '.ASUS VB191.  .#'
Checksum: 0x23

----------------

Failures:

Block 0, Base EDID:
  Detailed Timing Descriptor #1: Mismatch of image size 340x270 mm vs display size 380x300 mm.
Block 1, Base EDID:
  Unknown Extension Block.
EDID:
  Base EDID: EDID specified 0 extension block(s), but found 1 extension block(s).

EDID conformity: FAIL
