
EDID (hex):
00ffffffffffff000daf951500000000
0c130103802213780a7b959c57579429
15505400000001010101010101010101
0101010101011c2a4024618431301a3c
9a0058c110000018000000fe004e3135
364f362d4c30310a2020000000fe0043
4d4f0a202020202020202020000000fe
004e3135364f362d4c30310a2020001c

Extracted contents:
header:          00 ff ff ff ff ff ff 00
serial number:   0d af 95 15 00 00 00 00 0c 13
version:         01 03
basic params:    80 22 13 78 0a
chroma info:     7b 95 9c 57 57 94 29 15 50 54
established:     00 00 00
standard:        01 01 01 01 01 01 01 01 01 01 01 01 01 01 01 01
descriptor 1:    1c 2a 40 24 61 84 31 30 1a 3c 9a 00 58 c1 10 00 00 18
descriptor 2:    00 00 00 fe 00 4e 31 35 36 4f 36 2d 4c 30 31 0a 20 20
descriptor 3:    00 00 00 fe 00 43 4d 4f 0a 20 20 20 20 20 20 20 20 20
descriptor 4:    00 00 00 fe 00 4e 31 35 36 4f 36 2d 4c 30 31 0a 20 20
extensions:      00
checksum:        1c

EDID version: 1.3
Manufacturer: CMO Model 1595 Serial Number --
Made in week 12 of 2009
Digital display
Maximum image size: 34 cm x 19 cm
Gamma: 2.20
RGB color display
First detailed timing is preferred timing
Display x,y Chromaticity:
  Red:   0.6103, 0.3427
  Green: 0.3417, 0.5810
  Blue:  0.1621, 0.0830
  White: 0.3134, 0.3291
Established timings supported:
Standard timings supported:
Detailed mode: Clock 107.800 MHz, 344 mm x 193 mm
               1600 1626 1686 1892 hborder 0
                900  909  919  949 vborder 0
               -hsync -vsync 
               VertFreq: 60 Hz, HorFreq: 56976 Hz
ASCII string: N156O6-L01
ASCII string: CMO
ASCII string: N156O6-L01
Checksum: 0x1c (valid)
EDID block does NOT conform to EDID 1.3!
	Missing name descriptor
	Missing monitor ranges
