
EDID (hex):
00ffffffffffff00061032a01eb6f94f
19190104a5301b78200f51ae5243b026
0e505400000001010101010101010101
0101010101014dd000a0f0703e803020
3500db0b1100001a1a3680a070381f40
30203500db0b1100001a000000fc0069
4d61630a2020202020202020000000ff
00353330423644373145423633390125
701379030003003c53ec0084ff0f9f00
2f801f00ff0841000200040059a00004
1f0d9f002f801f006107350002000400
555e0004ff099f002f801f009f052800
020004007f8116fa1000010100127631
fc78b1bd02108841d2f3f5feff810008
23090707830100000000000000000000
0000000000000000000000000000d990

Extracted contents:
header:          00 ff ff ff ff ff ff 00
serial number:   06 10 32 a0 1e b6 f9 4f 19 19
version:         01 04
basic params:    a5 30 1b 78 20
chroma info:     0f 51 ae 52 43 b0 26 0e 50 54
established:     00 00 00
standard:        01 01 01 01 01 01 01 01 01 01 01 01 01 01 01 01
descriptor 1:    4d d0 00 a0 f0 70 3e 80 30 20 35 00 db 0b 11 00 00 1a
descriptor 2:    1a 36 80 a0 70 38 1f 40 30 20 35 00 db 0b 11 00 00 1a
descriptor 3:    00 00 00 fc 00 69 4d 61 63 0a 20 20 20 20 20 20 20 20
descriptor 4:    00 00 00 ff 00 35 33 30 42 36 44 37 31 45 42 36 33 39
extensions:      01
checksum:        25

EDID version: 1.4
Manufacturer: APP Model a032 Serial Number --
Made in week 25 of 2015
Digital display
8 bits per primary color channel
DisplayPort interface
Maximum image size: 48 cm x 27 cm
Gamma: 2.20
DPMS levels: Off
Supported color formats: RGB 4:4:4
Display x,y Chromaticity:
  Red:   0.6796, 0.3203
  Green: 0.2646, 0.6904
  Blue:  0.1494, 0.0556
  White: 0.3125, 0.3291
Established timings supported:
Standard timings supported:
Detailed mode: Clock 533.250 MHz, 475 mm x 267 mm
               3840 3888 3920 4000 hborder 0
               2160 2163 2168 2222 vborder 0
               +hsync -vsync 
               VertFreq: 59 Hz, HorFreq: 133312 Hz
Detailed mode: Clock 138.500 MHz, 475 mm x 267 mm
               1920 1968 2000 2080 hborder 0
               1080 1083 1088 1111 vborder 0
               +hsync -vsync 
               VertFreq: 59 Hz, HorFreq: 66586 Hz
Monitor name: iMac
Serial number: --
Has 1 extension blocks
Checksum: 0x25 (valid)

DisplayID extension block
Extension version: 19
Length 121, version 19, extension count 0
Checksum: 0xd9 (valid)
Type 1 detailed timing: aspect: 16:9, Preferred  
Detailed mode: Clock 604.990 MHz, 0 mm x 0 mm
               4095 4142 4173 4254
               2303 2305 2309 2368
               +hsync -vsync
Type 1 detailed timing: aspect: 16:9,  
Detailed mode: Clock 410.490 MHz, 0 mm x 0 mm
               3359 3406 3437 3518
               1889 1891 1895 1942
               +hsync -vsync
Type 1 detailed timing: aspect: 16:9,  
Detailed mode: Clock 241.490 MHz, 0 mm x 0 mm
               2559 2606 2637 2718
               1439 1441 1445 1479
               +hsync -vsync
Unknown displayid data block 0x7f
Unknown displayid data block 0x81

	Missing monitor ranges
EDID block does not conform at all!
	Has -620756992 nonconformant extension block(s)
