edid-decode (hex):

00 ff ff ff ff ff ff 00 0d ae c3 15 00 00 00 00
28 17 01 04 95 22 13 78 02 f2 35 9e 55 52 95 29
10 50 54 00 00 00 01 01 01 01 01 01 01 01 01 01
01 01 01 01 01 01 5e 35 80 96 70 38 14 40 2c 1c
24 00 58 c1 10 00 00 18 00 00 00 fe 00 4e 31 35
36 48 47 45 2d 45 41 32 0a 20 00 00 00 fe 00 43
4d 4e 0a 20 20 20 20 20 20 20 20 20 00 00 00 fe
00 4e 31 35 36 48 47 45 2d 45 41 32 0a 20 00 0f

----------------

Block 0, Base EDID:
  EDID Structure Version & Revision: 1.4
  Vendor & Product Identification:
    Manufacturer: CMN
    Model: 5571
    Made in: week 40 of 2013
  Basic Display Parameters & Features:
    Digital display
    Bits per primary color channel: 6
    DisplayPort interface
    Maximum image size: 34 cm x 19 cm
    Gamma: 2.20
    Supported color formats: RGB 4:4:4
    First detailed timing includes the native pixel format and preferred refresh rate
  Color Characteristics:
    Red  : 0.6201, 0.3349
    Green: 0.3203, 0.5839
    Blue : 0.1601, 0.0654
    White: 0.3134, 0.3291
  Established Timings I & II: none
  Standard Timings: none
  Detailed Timing Descriptors:
    DTD 1:  1920x1080   60.000 Hz  16:9    66.000 kHz 136.620 MHz (344 mm x 193 mm)
                 Hfront   44 Hsync  28 Hback  78 Hpol N
                 Vfront    2 Vsync   4 Vback  14 Vpol N
    Alphanumeric Data String: 'N156HGE-EA2'
    Alphanumeric Data String: 'CMN'
    Alphanumeric Data String: 'N156HGE-EA2'
Checksum: 0xf

----------------

Failures:

Block 0, Base EDID:
  Missing Display Product Name.

EDID conformity: FAIL
