edid-decode (hex):

00 ff ff ff ff ff ff 00 0d ae c3 15 00 00 00 00
0a 18 01 04 95 22 13 78 02 f2 35 9e 55 52 95 29
10 50 54 00 00 00 01 01 01 01 01 01 01 01 01 01
01 01 01 01 01 01 37 36 80 a0 70 38 20 40 30 20
35 00 58 c1 10 00 00 1a 25 24 80 a0 70 38 20 40
30 20 35 00 58 c1 10 00 00 1a 00 00 00 00 00 00
00 00 00 00 00 00 00 00 00 00 00 00 00 00 00 02
00 0c 33 ff 0f 3c 96 15 16 36 96 00 00 00 00 6c

----------------

Block 0, Base EDID:
  EDID Structure Version & Revision: 1.4
  Vendor & Product Identification:
    Manufacturer: CMN
    Model: 5571
    Made in: week 10 of 2014
  Basic Display Parameters & Features:
    Digital display
    Bits per primary color channel: 6
    DisplayPort interface
    Maximum image size: 34 cm x 19 cm
    Gamma: 2.20
    Supported color formats: RGB 4:4:4
    First detailed timing includes the native pixel format and preferred refresh rate
  Color Characteristics:
    Red  : 0.6201, 0.3349
    Green: 0.3203, 0.5839
    Blue : 0.1601, 0.0654
    White: 0.3134, 0.3291
  Established Timings I & II: none
  Standard Timings: none
  Detailed Timing Descriptors:
    DTD 1:  1920x1080   60.005 Hz  16:9    66.726 kHz 138.790 MHz (344 mm x 193 mm)
                 Hfront   48 Hsync  32 Hback  80 Hpol P
                 Vfront    3 Vsync   5 Vback  24 Vpol N
    DTD 2:  1920x1080   40.005 Hz  16:9    44.486 kHz  92.530 MHz (344 mm x 193 mm)
                 Hfront   48 Hsync  32 Hback  80 Hpol P
                 Vfront    3 Vsync   5 Vback  24 Vpol N
    Empty Descriptor
    Manufacturer-Specified Display Descriptor (0x02): 00 02 00 0c 33 ff 0f 3c 96 15 16 36 96 00 00 00 '....3..<...6....'
Checksum: 0x6c

----------------

Failures:

Block 0, Base EDID:
  Empty Descriptor: Use Dummy Descriptor instead of all zeroes.
  Missing Display Product Name.

EDID conformity: FAIL
