edid-decode (hex):

00 ff ff ff ff ff ff 00 0d ae 6c 17 00 00 00 00
19 1c 01 04 a5 26 15 78 02 ee 95 a3 54 4c 99 26
0f 50 54 00 00 00 01 01 01 01 01 01 01 01 01 01
01 01 01 01 01 01 b4 3b 80 4a 71 38 34 40 30 20
a5 00 7d d6 10 00 00 1a c2 2f 80 4a 71 38 34 40
30 20 a5 00 7d d6 10 00 00 1a 00 00 00 fe 00 31
32 36 32 4b 80 31 37 33 48 43 45 0a 00 00 00 00
00 02 41 31 9e 00 10 00 00 0a 01 0a 20 20 00 da

----------------

Block 0, Base EDID:
  EDID Structure Version & Revision: 1.4
  Vendor & Product Identification:
    Manufacturer: CMN
    Model: 5996
    Made in: week 25 of 2018
  Basic Display Parameters & Features:
    Digital display
    Bits per primary color channel: 8
    DisplayPort interface
    Maximum image size: 38 cm x 21 cm
    Gamma: 2.20
    Supported color formats: RGB 4:4:4
    First detailed timing includes the native pixel format and preferred refresh rate
  Color Characteristics:
    Red  : 0.6396, 0.3300
    Green: 0.2998, 0.5996
    Blue : 0.1503, 0.0595
    White: 0.3134, 0.3291
  Established Timings I & II: none
  Standard Timings: none
  Detailed Timing Descriptors:
    DTD 1:  1920x1080   60.008 Hz  16:9    67.929 kHz 152.840 MHz (381 mm x 214 mm)
                 Hfront   48 Hsync  32 Hback 250 Hpol P
                 Vfront   10 Vsync   5 Vback  37 Vpol N
    DTD 2:  1920x1080   48.002 Hz  16:9    54.338 kHz 122.260 MHz (381 mm x 214 mm)
                 Hfront   48 Hsync  32 Hback 250 Hpol P
                 Vfront   10 Vsync   5 Vback  37 Vpol N
    Alphanumeric Data String: '1262K'
    Manufacturer-Specified Display Descriptor (0x00): 00 00 00 02 41 31 9e 00 10 00 00 0a 01 0a 20 20 '....A1........  '
Checksum: 0xda

----------------

Failures:

Block 0, Base EDID:
  Alphanumeric Data String: Non-printable character.
  Missing Display Product Name.

EDID conformity: FAIL
