edid-decode (hex):

00 ff ff ff ff ff ff 00 1a b3 cd 07 73 97 00 00
03 15 01 03 68 26 1e 78 2a de 95 a3 54 4c 99 26
0f 50 54 a5 4b 00 81 80 01 01 01 01 01 01 01 01
01 01 01 01 01 01 30 2a 00 98 51 00 2a 40 30 70
13 00 78 2d 11 00 00 1e 00 00 00 fd 00 38 4c 1e
52 0e 00 0a 20 20 20 20 20 20 00 00 00 fc 00 45
31 39 2d 35 0a 20 20 20 20 20 20 20 00 00 00 ff
00 59 56 32 41 30 33 38 37 37 31 0a 20 20 00 31

00 ff ff ff ff ff ff 00 1a b3 cd 07 73 97 00 00
03 15 01 03 68 26 1e 78 2a de 95 a3 54 4c 99 26
0f 50 54 a5 4b 00 81 80 01 01 01 01 01 01 01 01
01 01 01 01 01 01 30 2a 00 98 51 00 2a 40 30 70
13 00 78 2d 11 00 00 1e 00 00 00 fd 00 38 4c 1e
52 0e 00 0a 20 20 20 20 20 20 00 00 00 fc 00 45
31 39 2d 35 0a 20 20 20 20 20 20 20 00 00 00 ff
00 59 56 32 41 30 33 38 37 37 31 0a 20 20 00 31

----------------

Block 0, Base EDID:
  EDID Structure Version & Revision: 1.3
  Vendor & Product Identification:
    Manufacturer: FUS
    Model: 1997
    Serial Number: ...
    Made in: week 3 of 2011
  Basic Display Parameters & Features:
    Analog display
    Signal Level Standard: 0.700 : 0.000 : 0.700 V p-p
    Blank level equals black level
    Sync: Separate
    Maximum image size: 38 cm x 30 cm
    Gamma: 2.20
    DPMS levels: Off
    RGB color display
    First detailed timing is the preferred timing
  Color Characteristics:
    Red  : 0.6396, 0.3291
    Green: 0.2998, 0.5996
    Blue : 0.1503, 0.0595
    White: 0.3134, 0.3291
  Established Timings I & II:
    IBM     :   720x400    70.081663 Hz   9:5     31.467 kHz     28.320000 MHz
    DMT 0x04:   640x480    59.940476 Hz   4:3     31.469 kHz     25.175000 MHz
    DMT 0x06:   640x480    75.000000 Hz   4:3     37.500 kHz     31.500000 MHz
    DMT 0x09:   800x600    60.316541 Hz   4:3     37.879 kHz     40.000000 MHz
    DMT 0x0b:   800x600    75.000000 Hz   4:3     46.875 kHz     49.500000 MHz
    DMT 0x10:  1024x768    60.003840 Hz   4:3     48.363 kHz     65.000000 MHz
    DMT 0x12:  1024x768    75.028582 Hz   4:3     60.023 kHz     78.750000 MHz
    DMT 0x24:  1280x1024   75.024675 Hz   5:4     79.976 kHz    135.000000 MHz
  Standard Timings:
    DMT 0x23:  1280x1024   60.019740 Hz   5:4     63.981 kHz    108.000000 MHz
  Detailed Timing Descriptors:
    DTD 1:  1280x1024   60.019740 Hz   5:4     63.981 kHz    108.000000 MHz (376 mm x 301 mm)
                 Hfront   48 Hsync 112 Hback  248 Hpol P
                 Vfront    1 Vsync   3 Vback   38 Vpol P
    Display Range Limits:
      Monitor ranges (GTF): 56-76 Hz V, 30-82 kHz H, max dotclock 140 MHz
    Display Product Name: 'E19-5'
    Display Product Serial Number: ...
Checksum: 0x31

----------------

Block 1, Unknown EDID Extension Block 0x00:
  00 ff ff ff ff ff ff 00 1a b3 cd 07 73 97 00 00 '............s...'
  03 15 01 03 68 26 1e 78 2a de 95 a3 54 4c 99 26 '....h&.x*...TL.&'
  0f 50 54 a5 4b 00 81 80 01 01 01 01 01 01 01 01 '.PT.K...........'
  01 01 01 01 01 01 30 2a 00 98 51 00 2a 40 30 70 '......0*..Q.*@0p'
  13 00 78 2d 11 00 00 1e 00 00 00 fd 00 38 4c 1e '..x-.........8L.'
  52 0e 00 0a 20 20 20 20 20 20 00 00 00 fc 00 45 'R...      .....E'
  31 39 2d 35 0a 20 20 20 20 20 20 20 00 00 00 ff '19-5.       ....'
  00 59 56 32 41 30 33 38 37 37 31 0a 20 20 00 31 '.YV2A038771.  .1'
Checksum: 0x31

----------------

Failures:

Block 1, Base EDID:
  Unknown Extension Block.
EDID:
  Base EDID: EDID specified 0 extension block(s), but found 1 extension block(s).

EDID conformity: FAIL
