
EDID (hex):
00ffffffffffff0006af000100000000
0020010481000078022290a456509e26
0d5054000000d1c00101010101010101
010101010101143780b8703824401010
3e0000000000001800000010000a2020
2020020020202020200a000000100001
01010101010101010101010a00000010
000a20202020020020202020200a0069

Extracted contents:
header:          00 ff ff ff ff ff ff 00
serial number:   06 af 00 01 00 00 00 00 00 20
version:         01 04
basic params:    81 00 00 78 02
chroma info:     22 90 a4 56 50 9e 26 0d 50 54
established:     00 00 00
standard:        d1 c0 01 01 01 01 01 01 01 01 01 01 01 01 01 01
descriptor 1:    14 37 80 b8 70 38 24 40 10 10 3e 00 00 00 00 00 00 18
descriptor 2:    00 00 00 10 00 0a 20 20 20 20 02 00 20 20 20 20 20 0a
descriptor 3:    00 00 00 10 00 01 01 01 01 01 01 01 01 01 01 01 01 0a
descriptor 4:    00 00 00 10 00 0a 20 20 20 20 02 00 20 20 20 20 20 0a
extensions:      00
checksum:        69

EDID version: 1.4
Manufacturer: AUO Model 100 Serial Number --
Made in year 2022
Digital display
Color depth is undefined
DVI interface
Image size is variable
Gamma: 2.20
Supported color formats: RGB 4:4:4
First detailed timing includes the native pixel format and preferred refresh rate
Display x,y Chromaticity:
  Red:   0.6406, 0.3378
  Green: 0.3125, 0.6191
  Blue:  0.1503, 0.0517
  White: 0.3125, 0.3281
Established timings supported:
Standard timings supported:
  1920x1080@60Hz 16:9
Detailed mode: Clock 141.000 MHz, 0 mm x 0 mm
               1920 1936 1952 2104 hborder 0
               1080 1083 1097 1116 vborder 0
               -hsync -vsync 
               VertFreq: 60 Hz, HorFreq: 67015 Hz
Dummy block
Dummy block
Dummy block
Checksum: 0x69 (valid)
EDID block does NOT conform to EDID 1.4!
	Missing name descriptor
	Missing monitor ranges
EDID block does not conform at all!
	Dummy block filled with garbage
