edid-decode (hex):

00 ff ff ff ff ff ff 00 09 e5 9a 06 00 00 00 00
01 19 01 04 95 1f 11 78 02 8f a0 92 5c 56 95 28
1a 50 54 00 00 00 01 01 01 01 01 01 01 01 01 01
01 01 01 01 01 01 ce 1d 56 f4 50 00 16 30 30 20
36 00 35 ad 10 00 00 1a e2 13 56 f4 50 00 16 30
30 20 36 00 35 ad 10 00 00 1a 00 00 00 00 00 00
00 00 00 00 00 00 00 00 00 00 00 00 00 00 00 02
00 0c 42 f2 0b 3c 6e 13 13 1f 78 0a 20 20 00 5a

----------------

Block 0, Base EDID:
  EDID Structure Version & Revision: 1.4
  Vendor & Product Identification:
    Manufacturer: BOE
    Model: 1690
    Made in: week 1 of 2015
  Basic Display Parameters & Features:
    Digital display
    Bits per primary color channel: 6
    DisplayPort interface
    Maximum image size: 31 cm x 17 cm
    Gamma: 2.20
    Supported color formats: RGB 4:4:4
    First detailed timing includes the native pixel format and preferred refresh rate
  Color Characteristics:
    Red  : 0.5722, 0.3593
    Green: 0.3388, 0.5849
    Blue : 0.1582, 0.1035
    White: 0.3125, 0.3281
  Established Timings I & II: none
  Standard Timings: none
  Detailed Timing Descriptors:
    DTD 1:  1366x768    59.989 Hz 683:384  47.391 kHz  76.300 MHz (309 mm x 173 mm)
                 Hfront   48 Hsync  32 Hback 164 Hpol P
                 Vfront    3 Vsync   6 Vback  13 Vpol N
    DTD 2:  1366x768    40.019 Hz 683:384  31.615 kHz  50.900 MHz (309 mm x 173 mm)
                 Hfront   48 Hsync  32 Hback 164 Hpol P
                 Vfront    3 Vsync   6 Vback  13 Vpol N
    Empty Descriptor
    Manufacturer-Specified Display Descriptor (0x02): 00 02 00 0c 42 f2 0b 3c 6e 13 13 1f 78 0a 20 20 '....B..<n...x.  '
Checksum: 0x5a

----------------

Failures:

Block 0, Base EDID:
  Empty Descriptor: Use Dummy Descriptor instead of all zeroes.
  Missing Display Product Name.

EDID conformity: FAIL
