edid-decode (hex):

00 ff ff ff ff ff ff 00 09 e5 3a 09 00 00 00 00
0f 1e 01 04 a5 1d 11 78 07 54 35 a7 54 4b 9c 25
0f 50 54 00 00 00 01 01 01 01 01 01 01 01 01 01
01 01 01 01 01 01 b7 39 80 f0 70 38 3c 40 30 20
36 00 26 a5 10 00 00 1a 2c 2e 80 f0 70 38 3c 40
30 20 36 00 26 a5 10 00 00 1a 00 00 00 fe 00 34
50 46 56 30 80 4e 56 31 33 4e 36 4c 00 00 00 00
00 02 41 21 a8 00 11 00 00 0a 01 0a 20 20 00 7e

----------------

Block 0, Base EDID:
  EDID Structure Version & Revision: 1.4
  Vendor & Product Identification:
    Manufacturer: BOE
    Model: 2362
    Made in: week 15 of 2020
  Basic Display Parameters & Features:
    Digital display
    Bits per primary color channel: 8
    DisplayPort interface
    Maximum image size: 29 cm x 17 cm
    Gamma: 2.20
    Supported color formats: RGB 4:4:4
    Default (sRGB) color space is primary color space
    First detailed timing includes the native pixel format and preferred refresh rate
    Display is continuous frequency
  Color Characteristics:
    Red  : 0.6533, 0.3291
    Green: 0.2939, 0.6093
    Blue : 0.1445, 0.0615
    White: 0.3134, 0.3291
  Established Timings I & II: none
  Standard Timings: none
  Detailed Timing Descriptors:
    DTD 1:  1920x1080   60.002437 Hz  16:9     68.403 kHz    147.750000 MHz (294 mm x 165 mm)
                 Hfront   48 Hsync  32 Hback  160 Hpol P
                 Vfront    3 Vsync   6 Vback   51 Vpol N
    DTD 2:  1920x1080   48.001949 Hz  16:9     54.722 kHz    118.200000 MHz (294 mm x 165 mm)
                 Hfront   48 Hsync  32 Hback  160 Hpol P
                 Vfront    3 Vsync   6 Vback   51 Vpol N
    Alphanumeric Data String: '4PFV0'
    Manufacturer-Specified Display Descriptor (0x00): 00 00 00 02 41 21 a8 00 11 00 00 0a 01 0a 20 20 '....A!........  '
Checksum: 0x7e

----------------

Failures:

Block 0, Base EDID:
  Basic Display Parameters & Features: sRGB is signaled, but the chromaticities do not match.
  Alphanumeric Data String: Non-printable character.
  Missing Display Product Name.
  Missing Display Range Limits Descriptor.

EDID conformity: FAIL
