
EDID (hex):
00ffffffffffff00158f393216140200
161601036e452778eee69da3544a9926
0f474a2308008180a9408bc081400101
010101010101342156aa51001b304070
3600b9882100001c6829a0d051842230
5098360098ff1000001c7c2e90a0601a
1e4030203600d9281100001c000000fd
00323f1e4b10000a202020202020009a

Extracted contents:
header:          00 ff ff ff ff ff ff 00
serial number:   15 8f 39 32 16 14 02 00 16 16
version:         01 03
basic params:    6e 45 27 78 ee
chroma info:     e6 9d a3 54 4a 99 26 0f 47 4a
established:     23 08 00
standard:        81 80 a9 40 8b c0 81 40 01 01 01 01 01 01 01 01
descriptor 1:    34 21 56 aa 51 00 1b 30 40 70 36 00 b9 88 21 00 00 1c
descriptor 2:    68 29 a0 d0 51 84 22 30 50 98 36 00 98 ff 10 00 00 1c
descriptor 3:    7c 2e 90 a0 60 1a 1e 40 30 20 36 00 d9 28 11 00 00 1c
descriptor 4:    00 00 00 fd 00 32 3f 1e 4b 10 00 0a 20 20 20 20 20 20
extensions:      00
checksum:        9a

EDID version: 1.3
Manufacturer: ELO Model 3239 Serial Number --
Made in week 22 of 2012
Analog display, Input voltage level: 0.7/0.7 V
Sync: Separate Composite SyncOnGreen 
Maximum image size: 69 cm x 39 cm
Gamma: 2.20
DPMS levels: Standby Suspend Off
RGB color display
Default (sRGB) color space is primary color space
First detailed timing is preferred timing
Display x,y Chromaticity:
  Red:   0.6396, 0.3300
  Green: 0.2900, 0.5996
  Blue:  0.1503, 0.0595
  White: 0.2802, 0.2900
Established timings supported:
  640x480@60Hz 4:3 HorFreq: 31469 Hz Clock: 25.175 MHz
  800x600@56Hz 4:3 HorFreq: 35200 Hz Clock: 36.000 MHz
  800x600@60Hz 4:3 HorFreq: 37900 Hz Clock: 40.000 MHz
  1024x768@60Hz 4:3 HorFreq: 48400 Hz Clock: 65.000 MHz
Standard timings supported:
  1280x1024@60Hz 5:4 HorFreq: 64000 Hz Clock: 108.000 MHz
  1600x1200@60Hz 4:3 HorFreq: 75000 Hz Clock: 162.000 MHz
  1360x765@60Hz 16:9
  1280x960@60Hz 4:3 HorFreq: 60000 Hz Clock: 108.000 MHz
Detailed mode: Clock 85.000 MHz, 697 mm x 392 mm
               1366 1430 1542 1792 hborder 0
                768  771  777  795 vborder 0
               -hsync +vsync 
               VertFreq: 59 Hz, HorFreq: 47433 Hz
Detailed mode: Clock 106.000 MHz, 408 mm x 255 mm
               1440 1520 1672 1904 hborder 0
                900  903  909  934 vborder 0
               -hsync +vsync 
               VertFreq: 59 Hz, HorFreq: 55672 Hz
Detailed mode: Clock 119.000 MHz, 473 mm x 296 mm
               1680 1728 1760 1840 hborder 0
               1050 1053 1059 1080 vborder 0
               -hsync +vsync 
               VertFreq: 59 Hz, HorFreq: 64673 Hz
Monitor ranges (GTF): 50-63Hz V, 30-75kHz H, max dotclock 160MHz
Checksum: 0x9a (valid)
EDID block does NOT conform to EDID 1.3!
	sRGB is signaled, but the chromaticities do not match
	Missing name descriptor
One or more of the timings is out of range of the Monitor Ranges:
  Vertical Freq: 56 - 60 Hz
  Horizontal Freq: 31469 - 75000 Hz
  Maximum Clock: 162.000 MHz
