
EDID (hex):
00ffffffffffff0030ae4f1101010101
061701036c251e782af7c1a3554c9b25
125054bdef00714f8190010101010101
010101010101302a009851002a403070
1300782d1100001e000000ff00563150
545431360a2020202020000000fd0038
4c1e510e000a202020202020000000fc
004c454e204c3139303070410a2000e0

Extracted contents:
header:          00 ff ff ff ff ff ff 00
serial number:   30 ae 4f 11 01 01 01 01 06 17
version:         01 03
basic params:    6c 25 1e 78 2a
chroma info:     f7 c1 a3 55 4c 9b 25 12 50 54
established:     bd ef 00
standard:        71 4f 81 90 01 01 01 01 01 01 01 01 01 01 01 01
descriptor 1:    30 2a 00 98 51 00 2a 40 30 70 13 00 78 2d 11 00 00 1e
descriptor 2:    00 00 00 ff 00 56 31 50 54 54 31 36 0a 20 20 20 20 20
descriptor 3:    00 00 00 fd 00 38 4c 1e 51 0e 00 0a 20 20 20 20 20 20
descriptor 4:    00 00 00 fc 00 4c 45 4e 20 4c 31 39 30 30 70 41 0a 20
extensions:      00
checksum:        e0

EDID version: 1.3
Manufacturer: LEN Model 114f Serial Number --
Made in week 6 of 2013
Analog display, Input voltage level: 0.7/0.7 V
Sync: Separate Composite 
Maximum image size: 37 cm x 30 cm
Gamma: 2.20
DPMS levels: Off
RGB color display
First detailed timing is preferred timing
Display x,y Chromaticity:
  Red:   0.6396, 0.3349
  Green: 0.2978, 0.6083
  Blue:  0.1474, 0.0703
  White: 0.3125, 0.3291
Established timings supported:
  720x400@70Hz 9:5 HorFreq: 31469 Hz Clock: 28.320 MHz
  640x480@60Hz 4:3 HorFreq: 31469 Hz Clock: 25.175 MHz
  640x480@67Hz 4:3 HorFreq: 35000 Hz Clock: 30.240 MHz
  640x480@72Hz 4:3 HorFreq: 37900 Hz Clock: 31.500 MHz
  640x480@75Hz 4:3 HorFreq: 37500 Hz Clock: 31.500 MHz
  800x600@60Hz 4:3 HorFreq: 37900 Hz Clock: 40.000 MHz
  800x600@72Hz 4:3 HorFreq: 48100 Hz Clock: 50.000 MHz
  800x600@75Hz 4:3 HorFreq: 46900 Hz Clock: 49.500 MHz
  832x624@75Hz 4:3 HorFreq: 49726 Hz Clock: 57.284 MHz
  1024x768@60Hz 4:3 HorFreq: 48400 Hz Clock: 65.000 MHz
  1024x768@70Hz 4:3 HorFreq: 56500 Hz Clock: 75.000 MHz
  1024x768@75Hz 4:3 HorFreq: 60000 Hz Clock: 78.750 MHz
  1280x1024@75Hz 5:4 HorFreq: 80000 Hz Clock: 135.000 MHz
Standard timings supported:
  1152x864@75Hz 4:3 HorFreq: 67500 Hz Clock: 108.000 MHz
  1280x1024@76Hz 5:4
Detailed mode: Clock 108.000 MHz, 376 mm x 301 mm
               1280 1328 1440 1688 hborder 0
               1024 1025 1028 1066 vborder 0
               +hsync +vsync 
               VertFreq: 60 Hz, HorFreq: 63981 Hz
Serial number: --
Monitor ranges (GTF): 56-76Hz V, 30-81kHz H, max dotclock 140MHz
Monitor name: LEN L1900pA
Checksum: 0xe0 (valid)
