
EDID (hex):
00ffffffffffff004ca3425800000000
00120103801f11780a859599574f8f26
21505400000001010101010101010101
010101010101121b567250000c303020
250035ae100000190000000f00000000
00000000001eb4027400000000fe0053
414d53554e470a2020202020000000fe
00313430415430372d3330360a2000b4

Extracted contents:
header:          00 ff ff ff ff ff ff 00
serial number:   4c a3 42 58 00 00 00 00 00 12
version:         01 03
basic params:    80 1f 11 78 0a
chroma info:     85 95 99 57 4f 8f 26 21 50 54
established:     00 00 00
standard:        01 01 01 01 01 01 01 01 01 01 01 01 01 01 01 01
descriptor 1:    12 1b 56 72 50 00 0c 30 30 20 25 00 35 ae 10 00 00 19
descriptor 2:    00 00 00 0f 00 00 00 00 00 00 00 00 00 1e b4 02 74 00
descriptor 3:    00 00 00 fe 00 53 41 4d 53 55 4e 47 0a 20 20 20 20 20
descriptor 4:    00 00 00 fe 00 31 34 30 41 54 30 37 2d 33 30 36 0a 20
extensions:      00
checksum:        b4

EDID version: 1.3
Manufacturer: SEC Model 5842 Serial Number --
Made in year 2008
Digital display
Maximum image size: 31 cm x 17 cm
Gamma: 2.20
RGB color display
First detailed timing is preferred timing
Display x,y Chromaticity:
  Red:   0.5996, 0.3398
  Green: 0.3095, 0.5595
  Blue:  0.1503, 0.1298
  White: 0.3134, 0.3291
Established timings supported:
Standard timings supported:
Detailed mode: Clock 69.300 MHz, 309 mm x 174 mm
               1366 1414 1446 1480 hborder 0
                768  770  775  780 vborder 0
               -hsync -vsync 
               VertFreq: 60 Hz, HorFreq: 46824 Hz
Manufacturer-specified data, tag 15
ASCII string: SAMSUNG
ASCII string: 140AT07-306
Checksum: 0xb4 (valid)
EDID block does NOT conform to EDID 1.3!
	Missing name descriptor
	Missing monitor ranges
