
EDID (hex):
00ffffffffffff000e11611401010101
230f0104a52018b4e29ea8a154469924
0e484ca44200315945596159714f8180
010101010101ea240060410028303060
130038ea1000001e000000fd0032a01e
460b000a202020202020000000fc0043
4f4d50415120465337363030000000ff
00434e43353335324742390a20200062

edid-decode (hex):

00 ff ff ff ff ff ff 00 0e 11 61 14 01 01 01 01
23 0f 01 04 a5 20 18 b4 e2 9e a8 a1 54 46 99 24
0e 48 4c a4 42 00 31 59 45 59 61 59 71 4f 81 80
01 01 01 01 01 01 ea 24 00 60 41 00 28 30 30 60
13 00 38 ea 10 00 00 1e 00 00 00 fd 00 32 a0 1e
46 0b 00 0a 20 20 20 20 20 20 00 00 00 fc 00 43
4f 4d 50 41 51 20 46 53 37 36 30 30 00 00 00 ff
00 43 4e 43 35 33 35 32 47 42 39 0a 20 20 00 62

----------------

Block 0, Base EDID:
  EDID Structure Version & Revision: 1.4
  Vendor & Product Identification:
    Manufacturer: CPQ
    Model: 5217
    Serial Number: 16843009
    Made in: week 35 of 2005
  Basic Display Parameters & Features:
    Digital display
    Bits per primary color channel: 8
    DisplayPort interface
    Maximum image size: 32 cm x 24 cm
    Gamma: 2.80
    DPMS levels: Standby Suspend Off
    Supported color formats: RGB 4:4:4
    First detailed timing includes the native pixel format and preferred refresh rate
  Color Characteristics:
    Red  : 0.6308, 0.3291
    Green: 0.2763, 0.5996
    Blue : 0.1425, 0.0566
    White: 0.2832, 0.2968
  Established Timings I & II:
    IBM     :   720x400    70.081663 Hz   9:5     31.467 kHz     28.320000 MHz
    DMT 0x04:   640x480    59.940476 Hz   4:3     31.469 kHz     25.175000 MHz
    DMT 0x06:   640x480    75.000000 Hz   4:3     37.500 kHz     31.500000 MHz
    DMT 0x0b:   800x600    75.000000 Hz   4:3     46.875 kHz     49.500000 MHz
    DMT 0x12:  1024x768    75.028582 Hz   4:3     60.023 kHz     78.750000 MHz
  Standard Timings:
    DMT 0x07:   640x480    85.008312 Hz   4:3     43.269 kHz     36.000000 MHz
    DMT 0x0c:   800x600    85.061274 Hz   4:3     53.674 kHz     56.250000 MHz
    DMT 0x13:  1024x768    84.996690 Hz   4:3     68.677 kHz     94.500000 MHz
    DMT 0x15:  1152x864    75.000000 Hz   4:3     67.500 kHz    108.000000 MHz
    DMT 0x23:  1280x1024   60.019740 Hz   5:4     63.981 kHz    108.000000 MHz
  Detailed Timing Descriptors:
    DTD 1:  1024x768    84.996690 Hz   4:3     68.677 kHz     94.500000 MHz (312 mm x 234 mm)
                 Hfront   48 Hsync  96 Hback  208 Hpol P
                 Vfront    1 Vsync   3 Vback   36 Vpol P
    Display Range Limits:
      Monitor ranges (GTF): 50-160 Hz V, 30-70 kHz H, max dotclock 110 MHz
    Display Product Name: 'COMPAQ FS7600'
    Display Product Serial Number: 'CNC5352GB9'
Checksum: 0x62
