edid-decode (hex):

00 ff ff ff ff ff ff 00 4c 83 4e 48 00 00 00 00
00 16 01 04 90 1f 11 78 0a 35 05 94 5b 58 8f 2a
22 50 54 00 00 00 01 01 01 01 01 01 01 01 01 01
01 01 01 01 01 01 a4 2e 40 1c 62 84 1e 30 30 20
25 00 35 ae 10 00 00 19 19 1f 40 1c 62 84 1e 30
30 20 25 00 35 ae 10 00 00 19 00 00 00 00 00 00
00 00 00 00 00 00 00 00 00 00 00 00 00 00 00 02
00 0c 3d ff 0c 3c 7d 20 0f 24 7d 00 00 00 00 29

----------------

Block 0, Base EDID:
  EDID Structure Version & Revision: 1.4
  Vendor & Product Identification:
    Manufacturer: SDC
    Model: 18510
    Made in: 2012
  Basic Display Parameters & Features:
    Digital display
    Bits per primary color channel: 6
    Digital interface is not defined
    Maximum image size: 31 cm x 17 cm
    Gamma: 2.20
    Supported color formats: RGB 4:4:4, YCrCb 4:4:4
    First detailed timing includes the native pixel format and preferred refresh rate
  Color Characteristics:
    Red  : 0.5781, 0.3583
    Green: 0.3447, 0.5595
    Blue : 0.1640, 0.1328
    White: 0.3134, 0.3291
  Established Timings I & II: none
  Standard Timings: none
  Detailed Timing Descriptors:
    DTD 1:  1600x900    59.994 Hz  16:9    55.794 kHz 119.400 MHz (309 mm x 174 mm)
                 Hfront   48 Hsync  32 Hback 460 Hpol N
                 Vfront    2 Vsync   5 Vback  23 Vpol N
    DTD 2:  1600x900    40.001 Hz  16:9    37.201 kHz  79.610 MHz (309 mm x 174 mm)
                 Hfront   48 Hsync  32 Hback 460 Hpol N
                 Vfront    2 Vsync   5 Vback  23 Vpol N
    Empty Descriptor
    Manufacturer-Specified Display Descriptor (0x02): 00 02 00 0c 3d ff 0c 3c 7d 20 0f 24 7d 00 00 00 '....=..<} .$}...'
Checksum: 0x29
