
EDID (hex):
00ffffffffffff0022643f2101010101
1613010380261e78ea1f35a4564d9e24
125054a56b80714f8140010101010101
010101010101302a009851002a403070
1300782d1100001e000000fc0048616e
6e732e47204848313931000000fd0038
4c1f520e000a202020202020000000ff
003932324350335859303036393000d5

Extracted contents:
header:          00 ff ff ff ff ff ff 00
serial number:   22 64 3f 21 01 01 01 01 16 13
version:         01 03
basic params:    80 26 1e 78 ea
chroma info:     1f 35 a4 56 4d 9e 24 12 50 54
established:     a5 6b 80
standard:        71 4f 81 40 01 01 01 01 01 01 01 01 01 01 01 01
descriptor 1:    30 2a 00 98 51 00 2a 40 30 70 13 00 78 2d 11 00 00 1e
descriptor 2:    00 00 00 fc 00 48 61 6e 6e 73 2e 47 20 48 48 31 39 31
descriptor 3:    00 00 00 fd 00 38 4c 1f 52 0e 00 0a 20 20 20 20 20 20
descriptor 4:    00 00 00 ff 00 39 32 32 43 50 33 58 59 30 30 36 39 30
extensions:      00
checksum:        d5

EDID version: 1.3
Manufacturer: HSD Model 213f Serial Number --
Made in week 22 of 2009
Digital display
Maximum image size: 38 cm x 30 cm
Gamma: 2.20
DPMS levels: Standby Suspend Off
RGB color display
First detailed timing is preferred timing
Display x,y Chromaticity:
  Red:   0.6406, 0.3369
  Green: 0.3037, 0.6201
  Blue:  0.1406, 0.0732
  White: 0.3134, 0.3291
Established timings supported:
  720x400@70Hz 9:5 HorFreq: 31469 Hz Clock: 28.320 MHz
  640x480@60Hz 4:3 HorFreq: 31469 Hz Clock: 25.175 MHz
  640x480@75Hz 4:3 HorFreq: 37500 Hz Clock: 31.500 MHz
  800x600@60Hz 4:3 HorFreq: 37900 Hz Clock: 40.000 MHz
  800x600@75Hz 4:3 HorFreq: 46900 Hz Clock: 49.500 MHz
  832x624@75Hz 4:3 HorFreq: 49726 Hz Clock: 57.284 MHz
  1024x768@60Hz 4:3 HorFreq: 48400 Hz Clock: 65.000 MHz
  1024x768@75Hz 4:3 HorFreq: 60000 Hz Clock: 78.750 MHz
  1280x1024@75Hz 5:4 HorFreq: 80000 Hz Clock: 135.000 MHz
  1152x870@75Hz 192:145 HorFreq: 67500 Hz Clock: 108.000 MHz
Standard timings supported:
  1152x864@75Hz 4:3 HorFreq: 67500 Hz Clock: 108.000 MHz
  1280x960@60Hz 4:3 HorFreq: 60000 Hz Clock: 108.000 MHz
Detailed mode: Clock 108.000 MHz, 376 mm x 301 mm
               1280 1328 1440 1688 hborder 0
               1024 1025 1028 1066 vborder 0
               +hsync +vsync 
               VertFreq: 60 Hz, HorFreq: 63981 Hz
Monitor ranges (GTF): 56-76Hz V, 31-82kHz H, max dotclock 140MHz
Serial number: --
Checksum: 0xd5 (valid)
EDID block does NOT conform to EDID 1.3!
	Name descriptor not terminated with a newline
