
EDID (hex):
00ffffffffffff005df2102270030000
01170104a5000078e28042ac5130b425
10505300000001010101010101010101
010101010101253880c8703832402142
800107442100001ac92e80c870383240
2142800107442100001a000000fd0038
4c1e5311000a202020202020000000fc
0041494f20504320323231300a20001b

Extracted contents:
header:          00 ff ff ff ff ff ff 00
serial number:   5d f2 10 22 70 03 00 00 01 17
version:         01 04
basic params:    a5 00 00 78 e2
chroma info:     80 42 ac 51 30 b4 25 10 50 53
established:     00 00 00
standard:        01 01 01 01 01 01 01 01 01 01 01 01 01 01 01 01
descriptor 1:    25 38 80 c8 70 38 32 40 21 42 80 01 07 44 21 00 00 1a
descriptor 2:    c9 2e 80 c8 70 38 32 40 21 42 80 01 07 44 21 00 00 1a
descriptor 3:    00 00 00 fd 00 38 4c 1e 53 11 00 0a 20 20 20 20 20 20
descriptor 4:    00 00 00 fc 00 41 49 4f 20 50 43 20 32 32 31 30 0a 20
extensions:      00
checksum:        1b

EDID version: 1.4
Manufacturer: WOR Model 2210 Serial Number --
Made in week 1 of 2013
Digital display
8 bits per primary color channel
DisplayPort interface
Image size is variable
Gamma: 2.20
DPMS levels: Standby Suspend Off
Supported color formats: RGB 4:4:4
First detailed timing includes the native pixel format and preferred refresh rate
Display x,y Chromaticity:
  Red:   0.6738, 0.3164
  Green: 0.1875, 0.7031
  Blue:  0.1455, 0.0625
  White: 0.3125, 0.3261
Established timings supported:
Standard timings supported:
Detailed mode: Clock 143.730 MHz, 519 mm x 324 mm
               1920 1953 2019 2120 hborder 0
               1080 1088 1104 1130 vborder 0
               +hsync -vsync 
               VertFreq: 59 Hz, HorFreq: 67797 Hz
Detailed mode: Clock 119.770 MHz, 519 mm x 324 mm
               1920 1953 2019 2120 hborder 0
               1080 1088 1104 1130 vborder 0
               +hsync -vsync 
               VertFreq: 49 Hz, HorFreq: 56495 Hz
Monitor ranges (GTF): 56-76Hz V, 30-83kHz H, max dotclock 170MHz
Monitor name: AIO PC 2210
Checksum: 0x1b (valid)
Warning: One or more of the timings is out of range of the Monitor Ranges:
  Vertical Freq: 49 - 59 Hz
  Horizontal Freq: 56495 - 67797 Hz
  Maximum Clock: 143.730 MHz
