
EDID (hex):
00ffffffffffff005934800700000000
2418010380000078eeee95a3544c9926
0f5054a3080081c08100814081809500
b30000000000023a801871382d40582c
450000000000001e662150b051001b30
4070360000000000001e0e1f00805100
1e304080370000000000001e000000ff
003134393234574430463030333900e4

Extracted contents:
header:          00 ff ff ff ff ff ff 00
serial number:   59 34 80 07 00 00 00 00 24 18
version:         01 03
basic params:    80 00 00 78 ee
chroma info:     ee 95 a3 54 4c 99 26 0f 50 54
established:     a3 08 00
standard:        81 c0 81 00 81 40 81 80 95 00 b3 00 00 00 00 00
descriptor 1:    02 3a 80 18 71 38 2d 40 58 2c 45 00 00 00 00 00 00 1e
descriptor 2:    66 21 50 b0 51 00 1b 30 40 70 36 00 00 00 00 00 00 1e
descriptor 3:    0e 1f 00 80 51 00 1e 30 40 80 37 00 00 00 00 00 00 1e
descriptor 4:    00 00 00 ff 00 31 34 39 32 34 57 44 30 46 30 30 33 39
extensions:      00
checksum:        e4

EDID version: 1.3
Manufacturer: VIT Model 780 Serial Number --
Made in week 36 of 2014
Digital display
Image size is variable
Gamma: 2.20
DPMS levels: Standby Suspend Off
RGB color display
Default (sRGB) color space is primary color space
First detailed timing is preferred timing
Display x,y Chromaticity:
  Red:   0.6396, 0.3300
  Green: 0.2998, 0.5996
  Blue:  0.1503, 0.0595
  White: 0.3134, 0.3291
Established timings supported:
  720x400@70Hz 9:5 HorFreq: 31469 Hz Clock: 28.320 MHz
  640x480@60Hz 4:3 HorFreq: 31469 Hz Clock: 25.175 MHz
  800x600@56Hz 4:3 HorFreq: 35200 Hz Clock: 36.000 MHz
  800x600@60Hz 4:3 HorFreq: 37900 Hz Clock: 40.000 MHz
  1024x768@60Hz 4:3 HorFreq: 48400 Hz Clock: 65.000 MHz
Standard timings supported:
  1280x720@60Hz 16:9
  1280x800@60Hz 16:10
  1280x960@60Hz 4:3 HorFreq: 60000 Hz Clock: 108.000 MHz
  1280x1024@60Hz 5:4 HorFreq: 64000 Hz Clock: 108.000 MHz
  1440x900@60Hz 16:10 HorFreq: 55500 Hz Clock: 88.750 MHz
  1680x1050@60Hz 16:10 HorFreq: 64700 Hz Clock: 119.000 MHz
non-conformant standard timing (0 horiz)
non-conformant standard timing (0 horiz)
Detailed mode: Clock 148.500 MHz, 0 mm x 0 mm
               1920 2008 2052 2200 hborder 0
               1080 1084 1089 1125 vborder 0
               +hsync +vsync 
               VertFreq: 60 Hz, HorFreq: 67500 Hz
Detailed mode: Clock 85.500 MHz, 0 mm x 0 mm
               1360 1424 1536 1792 hborder 0
                768  771  777  795 vborder 0
               +hsync +vsync 
               VertFreq: 60 Hz, HorFreq: 47712 Hz
Detailed mode: Clock 79.500 MHz, 0 mm x 0 mm
               1280 1344 1472 1664 hborder 0
                768  771  778  798 vborder 0
               +hsync +vsync 
               VertFreq: 59 Hz, HorFreq: 47776 Hz
Serial number: --
Checksum: 0xe4 (valid)
EDID block does NOT conform to EDID 1.3!
	sRGB is signaled, but the chromaticities do not match
	Missing name descriptor
	Missing monitor ranges


