edid-decode (hex):

00 ff ff ff ff ff ff 00 09 e5 15 06 00 00 00 00
01 18 01 04 95 22 13 78 0a fb 0f 95 58 55 91 2a
1e 4f 56 00 00 00 01 01 01 01 01 01 01 01 01 01
01 01 01 01 01 01 64 1b 56 77 50 00 13 30 30 20
36 00 35 ad 10 00 00 1a a2 17 56 b9 50 00 2d 30
30 20 36 00 35 ad 10 00 00 1a 00 00 00 fe 00 31
57 37 4e 48 80 4e 54 31 35 36 57 48 00 00 00 00
00 00 41 01 94 01 00 00 00 09 01 0a 20 20 00 66

----------------

Block 0, Base EDID:
  EDID Structure Version & Revision: 1.4
  Vendor & Product Identification:
    Manufacturer: BOE
    Model: 1557
    Made in: week 1 of 2014
  Basic Display Parameters & Features:
    Digital display
    Bits per primary color channel: 6
    DisplayPort interface
    Maximum image size: 34 cm x 19 cm
    Gamma: 2.20
    Supported color formats: RGB 4:4:4, YCrCb 4:4:4
    First detailed timing includes the native pixel format and preferred refresh rate
  Color Characteristics:
    Red  : 0.5849, 0.3466
    Green: 0.3339, 0.5693
    Blue : 0.1640, 0.1171
    White: 0.3115, 0.3388
  Established Timings I & II: none
  Standard Timings: none
  Detailed Timing Descriptors:
    DTD 1:  1366x768    59.999 Hz 683:384  47.219 kHz  70.120 MHz (309 mm x 173 mm)
                 Hfront   48 Hsync  32 Hback  39 Hpol P
                 Vfront    3 Vsync   6 Vback  10 Vpol N
    DTD 2:  1366x768    47.979 Hz 683:384  39.007 kHz  60.500 MHz (309 mm x 173 mm)
                 Hfront   48 Hsync  32 Hback 105 Hpol P
                 Vfront    3 Vsync   6 Vback  36 Vpol N
    Alphanumeric Data String: '1W7NH'
    Manufacturer-Specified Display Descriptor (0x00): 00 00 00 00 41 01 94 01 00 00 00 09 01 0a 20 20 '....A.........  '
Checksum: 0x66
