
EDID (hex):
00ffffffffffff0005e303347c020000
26210104a55021783b3945ad4f47a627
125054bfef00d1c0b3009500818081c0
316845686168e77c70a0d0a029503020
3a001d4e3100001a000000ff00585546
50394841303030363336000000fc0043
5533345033430a2020202020000000fd
003064a0a03c010a2020202020200125
020325f14f0103051404131f12021190
4b4c595a2309070783010000681a0000
010130640088d170a0d0a0325030403a
001d4e3100001c539d70a0d0a0345030
403a001d4e3100001a733e70a0d0a029
5030203a001d4e3100001a0000000000
00000000000000000000000000000000
00000000000000000000000000000073

edid-decode (hex):

00 ff ff ff ff ff ff 00 05 e3 03 34 7c 02 00 00
26 21 01 04 a5 50 21 78 3b 39 45 ad 4f 47 a6 27
12 50 54 bf ef 00 d1 c0 b3 00 95 00 81 80 81 c0
31 68 45 68 61 68 e7 7c 70 a0 d0 a0 29 50 30 20
3a 00 1d 4e 31 00 00 1a 00 00 00 ff 00 58 55 46
50 39 48 41 30 30 30 36 33 36 00 00 00 fc 00 43
55 33 34 50 33 43 0a 20 20 20 20 20 00 00 00 fd
00 30 64 a0 a0 3c 01 0a 20 20 20 20 20 20 01 25

02 03 25 f1 4f 01 03 05 14 04 13 1f 12 02 11 90
4b 4c 59 5a 23 09 07 07 83 01 00 00 68 1a 00 00
01 01 30 64 00 88 d1 70 a0 d0 a0 32 50 30 40 3a
00 1d 4e 31 00 00 1c 53 9d 70 a0 d0 a0 34 50 30
40 3a 00 1d 4e 31 00 00 1a 73 3e 70 a0 d0 a0 29
50 30 20 3a 00 1d 4e 31 00 00 1a 00 00 00 00 00
00 00 00 00 00 00 00 00 00 00 00 00 00 00 00 00
00 00 00 00 00 00 00 00 00 00 00 00 00 00 00 73

----------------

Block 0, Base EDID:
  EDID Structure Version & Revision: 1.4
  Vendor & Product Identification:
    Manufacturer: AOC
    Model: 13315
    Serial Number: 636
    Made in: week 38 of 2023
  Basic Display Parameters & Features:
    Digital display
    Bits per primary color channel: 8
    DisplayPort interface
    Maximum image size: 80 cm x 33 cm
    Gamma: 2.20
    DPMS levels: Off
    Supported color formats: RGB 4:4:4, YCrCb 4:4:4, YCrCb 4:2:2
    First detailed timing includes the native pixel format and preferred refresh rate
    Display is continuous frequency
  Color Characteristics:
    Red  : 0.6757, 0.3115
    Green: 0.2792, 0.6494
    Blue : 0.1533, 0.0703
    White: 0.3134, 0.3291
  Established Timings I & II:
    IBM     :   720x400    70.081663 Hz   9:5     31.467 kHz     28.320000 MHz
    DMT 0x04:   640x480    59.940476 Hz   4:3     31.469 kHz     25.175000 MHz
    Apple   :   640x480    66.666667 Hz   4:3     35.000 kHz     30.240000 MHz
    DMT 0x05:   640x480    72.808802 Hz   4:3     37.861 kHz     31.500000 MHz
    DMT 0x06:   640x480    75.000000 Hz   4:3     37.500 kHz     31.500000 MHz
    DMT 0x08:   800x600    56.250000 Hz   4:3     35.156 kHz     36.000000 MHz
    DMT 0x09:   800x600    60.316541 Hz   4:3     37.879 kHz     40.000000 MHz
    DMT 0x0a:   800x600    72.187572 Hz   4:3     48.077 kHz     50.000000 MHz
    DMT 0x0b:   800x600    75.000000 Hz   4:3     46.875 kHz     49.500000 MHz
    Apple   :   832x624    74.551266 Hz   4:3     49.726 kHz     57.284000 MHz
    DMT 0x10:  1024x768    60.003840 Hz   4:3     48.363 kHz     65.000000 MHz
    DMT 0x11:  1024x768    70.069359 Hz   4:3     56.476 kHz     75.000000 MHz
    DMT 0x12:  1024x768    75.028582 Hz   4:3     60.023 kHz     78.750000 MHz
    DMT 0x24:  1280x1024   75.024675 Hz   5:4     79.976 kHz    135.000000 MHz
  Standard Timings:
    DMT 0x52:  1920x1080   60.000000 Hz  16:9     67.500 kHz    148.500000 MHz
    DMT 0x3a:  1680x1050   59.954250 Hz  16:10    65.290 kHz    146.250000 MHz
    DMT 0x2f:  1440x900    59.887445 Hz  16:10    55.935 kHz    106.500000 MHz
    DMT 0x23:  1280x1024   60.019740 Hz   5:4     63.981 kHz    108.000000 MHz
    DMT 0x55:  1280x720    60.000000 Hz  16:9     45.000 kHz     74.250000 MHz
    GTF     :   640x480    99.999537 Hz   4:3     50.900 kHz     43.163000 MHz
    GTF     :   800x600    99.999707 Hz   4:3     63.600 kHz     68.179000 MHz
    GTF     :  1024x768   100.000177 Hz   4:3     81.400 kHz    113.309000 MHz
  Detailed Timing Descriptors:
    DTD 1:  3440x1440   59.972616 Hz  43:18    88.819 kHz    319.750000 MHz (797 mm x 334 mm)
                 Hfront   48 Hsync  32 Hback   80 Hpol P
                 Vfront    3 Vsync  10 Vback   28 Vpol N
    Display Product Serial Number: 'XUFP9HA000636'
    Display Product Name: 'CU34P3C'
    Display Range Limits:
      Monitor ranges (Bare Limits): 48-100 Hz V, 160-160 kHz H, max dotclock 600 MHz
  Extension blocks: 1
Checksum: 0x25

----------------

Block 1, CTA-861 Extension Block:
  Revision: 3
  Underscans IT Video Formats by default
  Basic audio support
  Supports YCbCr 4:4:4
  Supports YCbCr 4:2:2
  Native detailed modes: 1
  Video Data Block:
    VIC   1:   640x480    59.940476 Hz   4:3     31.469 kHz     25.175000 MHz
    VIC   3:   720x480    59.940060 Hz  16:9     31.469 kHz     27.000000 MHz
    VIC   5:  1920x1080i  60.000000 Hz  16:9     33.750 kHz     74.250000 MHz
    VIC  20:  1920x1080i  50.000000 Hz  16:9     28.125 kHz     74.250000 MHz
    VIC   4:  1280x720    60.000000 Hz  16:9     45.000 kHz     74.250000 MHz
    VIC  19:  1280x720    50.000000 Hz  16:9     37.500 kHz     74.250000 MHz
    VIC  31:  1920x1080   50.000000 Hz  16:9     56.250 kHz    148.500000 MHz
    VIC  18:   720x576    50.000000 Hz  16:9     31.250 kHz     27.000000 MHz
    VIC   2:   720x480    59.940060 Hz   4:3     31.469 kHz     27.000000 MHz
    VIC  17:   720x576    50.000000 Hz   4:3     31.250 kHz     27.000000 MHz
    VIC  16:  1920x1080   60.000000 Hz  16:9     67.500 kHz    148.500000 MHz (native)
    VIC  75:  1920x1080   50.000000 Hz  64:27    56.250 kHz    148.500000 MHz
    VIC  76:  1920x1080   60.000000 Hz  64:27    67.500 kHz    148.500000 MHz
    VIC  89:  2560x1080   50.000000 Hz  64:27    56.250 kHz    185.625000 MHz
    VIC  90:  2560x1080   60.000000 Hz  64:27    66.000 kHz    198.000000 MHz
  Audio Data Block:
    Linear PCM:
      Max channels: 2
      Supported sample rates (kHz): 48 44.1 32
      Supported sample sizes (bits): 24 20 16
  Speaker Allocation Data Block:
    FL/FR - Front Left/Right
  Vendor-Specific Data Block (AMD), OUI 00-00-1A:
    Version: 1.1
    Minimum Refresh Rate: 48 Hz
    Maximum Refresh Rate: 100 Hz
    Flags 1.x: 0x00
  Detailed Timing Descriptors:
    DTD 2:  3440x1440  100.000000 Hz  43:18   149.000 kHz    536.400000 MHz (797 mm x 334 mm)
                 Hfront   48 Hsync  64 Hback   48 Hpol N
                 Vfront    3 Vsync  10 Vback   37 Vpol P
    DTD 3:  3440x1440   74.983244 Hz  43:18   111.875 kHz    402.750000 MHz (797 mm x 334 mm)
                 Hfront   48 Hsync  64 Hback   48 Hpol P
                 Vfront    3 Vsync  10 Vback   39 Vpol N
    DTD 4:  3440x1440   29.985370 Hz  43:18    44.408 kHz    159.870000 MHz (797 mm x 334 mm)
                 Hfront   48 Hsync  32 Hback   80 Hpol P
                 Vfront    3 Vsync  10 Vback   28 Vpol N
Checksum: 0x73  Unused space in Extension Block: 36 bytes


