edid-decode (hex):

00 ff ff ff ff ff ff 00 41 0c 39 09 8e 3f 00 00
0f 1e 01 04 b5 69 21 78 3f 7f 25 ad 4f 47 a5 26
10 50 54 bf ef 00 d1 c0 b3 00 95 00 81 80 81 40
81 c0 d1 00 01 01 68 73 00 a0 f0 b0 1f 40 30 40
35 00 1c 49 41 00 00 1a 00 00 00 ff 00 41 55 30
32 30 31 35 30 31 36 32 37 30 00 00 00 fc 00 50
48 4c 20 34 33 39 50 39 48 0a 20 20 00 00 00 fd
00 30 64 96 96 3c 01 0a 20 20 20 20 20 20 01 a3

02 03 2d f1 4d 61 60 1f 90 14 01 03 04 12 13 05
02 40 23 09 07 07 83 01 00 00 67 03 0c 00 20 00
18 78 e3 05 e3 01 e6 06 07 01 61 56 1c a2 4e 00
a0 a0 b0 23 40 30 20 58 04 1c 49 41 00 00 1a 58
c0 00 a0 f0 b0 1f 40 30 40 3a 00 1c 49 41 00 00
1a d6 74 00 c8 f0 b0 23 40 44 20 58 04 1c 49 41
00 00 1a 28 3c 80 a0 70 b0 23 40 30 20 36 00 1c
49 41 00 00 1a 00 00 00 00 00 00 00 00 00 00 6f

00 ff ff ff ff ff ff 00 41 0c 39 09 8e 3f 00 00
0f 1e 01 04 b5 69 21 78 3f 7f 25 ad 4f 47 a5 26
10 50 54 bf ef 00 d1 c0 b3 00 95 00 81 80 81 40
81 c0 d1 00 01 01 68 73 00 a0 f0 b0 1f 40 30 40
35 00 1c 49 41 00 00 1a 00 00 00 ff 00 41 55 30
32 30 31 35 30 31 36 32 37 30 00 00 00 fc 00 50
48 4c 20 34 33 39 50 39 48 0a 20 20 00 00 00 fd
00 30 64 96 96 3c 01 0a 20 20 20 20 20 20 01 a3

02 03 2d f1 4d 61 60 1f 90 14 01 03 04 12 13 05
02 40 23 09 07 07 83 01 00 00 67 03 0c 00 20 00
18 78 e3 05 e3 01 e6 06 07 01 61 56 1c a2 4e 00
a0 a0 b0 23 40 30 20 58 04 1c 49 41 00 00 1a 58
c0 00 a0 f0 b0 1f 40 30 40 3a 00 1c 49 41 00 00
1a d6 74 00 c8 f0 b0 23 40 44 20 58 04 1c 49 41
00 00 1a 28 3c 80 a0 70 b0 23 40 30 20 36 00 1c
49 41 00 00 1a 00 00 00 00 00 00 00 00 00 00 6f

----------------

Block 0, Base EDID:
  EDID Structure Version & Revision: 1.4
  Vendor & Product Identification:
    Manufacturer: PHL
    Model: 2361
    Serial Number: ...
    Made in: week 15 of 2020
  Basic Display Parameters & Features:
    Digital display
    Bits per primary color channel: 10
    DisplayPort interface
    Maximum image size: 105 cm x 33 cm
    Gamma: 2.20
    DPMS levels: Off
    Supported color formats: RGB 4:4:4, YCrCb 4:4:4, YCrCb 4:2:2
    Default (sRGB) color space is primary color space
    First detailed timing includes the native pixel format and preferred refresh rate
    Display is continuous frequency
  Color Characteristics:
    Red  : 0.6767, 0.3115
    Green: 0.2802, 0.6474
    Blue : 0.1484, 0.0644
    White: 0.3134, 0.3291
  Established Timings I & II:
    IBM     :   720x400    70.081663 Hz   9:5     31.467 kHz     28.320000 MHz
    DMT 0x04:   640x480    59.940476 Hz   4:3     31.469 kHz     25.175000 MHz
    Apple   :   640x480    66.666667 Hz   4:3     35.000 kHz     30.240000 MHz
    DMT 0x05:   640x480    72.808802 Hz   4:3     37.861 kHz     31.500000 MHz
    DMT 0x06:   640x480    75.000000 Hz   4:3     37.500 kHz     31.500000 MHz
    DMT 0x08:   800x600    56.250000 Hz   4:3     35.156 kHz     36.000000 MHz
    DMT 0x09:   800x600    60.316541 Hz   4:3     37.879 kHz     40.000000 MHz
    DMT 0x0a:   800x600    72.187572 Hz   4:3     48.077 kHz     50.000000 MHz
    DMT 0x0b:   800x600    75.000000 Hz   4:3     46.875 kHz     49.500000 MHz
    Apple   :   832x624    74.551266 Hz   4:3     49.726 kHz     57.284000 MHz
    DMT 0x10:  1024x768    60.003840 Hz   4:3     48.363 kHz     65.000000 MHz
    DMT 0x11:  1024x768    70.069359 Hz   4:3     56.476 kHz     75.000000 MHz
    DMT 0x12:  1024x768    75.028582 Hz   4:3     60.023 kHz     78.750000 MHz
    DMT 0x24:  1280x1024   75.024675 Hz   5:4     79.976 kHz    135.000000 MHz
  Standard Timings:
    DMT 0x52:  1920x1080   60.000000 Hz  16:9     67.500 kHz    148.500000 MHz
    DMT 0x3a:  1680x1050   59.954250 Hz  16:10    65.290 kHz    146.250000 MHz
    DMT 0x2f:  1440x900    59.887445 Hz  16:10    55.935 kHz    106.500000 MHz
    DMT 0x23:  1280x1024   60.019740 Hz   5:4     63.981 kHz    108.000000 MHz
    DMT 0x20:  1280x960    60.000000 Hz   4:3     60.000 kHz    108.000000 MHz
    DMT 0x55:  1280x720    60.000000 Hz  16:9     45.000 kHz     74.250000 MHz
    DMT 0x45:  1920x1200   59.884600 Hz  16:10    74.556 kHz    193.250000 MHz
  Detailed Timing Descriptors:
    DTD 1:  3840x1200   60.000000 Hz  16:5     73.860 kHz    295.440000 MHz (1052 mm x 329 mm)
                 Hfront   48 Hsync  64 Hback   48 Hpol P
                 Vfront    3 Vsync   5 Vback   23 Vpol N
    Display Product Serial Number: ...
    Display Product Name: 'PHL 439P9H'
    Display Range Limits:
      Monitor ranges (Bare Limits): 48-100 Hz V, 150-150 kHz H, max dotclock 600 MHz
  Extension blocks: 1
Checksum: 0xa3

----------------

Block 1, CTA-861 Extension Block:
  Revision: 3
  Underscans IT Video Formats by default
  Basic audio support
  Supports YCbCr 4:4:4
  Supports YCbCr 4:2:2
  Native detailed modes: 1
  Video Data Block:
    VIC  97:  3840x2160   60.000000 Hz  16:9    135.000 kHz    594.000000 MHz
    VIC  96:  3840x2160   50.000000 Hz  16:9    112.500 kHz    594.000000 MHz
    VIC  31:  1920x1080   50.000000 Hz  16:9     56.250 kHz    148.500000 MHz
    VIC  16:  1920x1080   60.000000 Hz  16:9     67.500 kHz    148.500000 MHz (native)
    VIC  20:  1920x1080i  50.000000 Hz  16:9     28.125 kHz     74.250000 MHz
    VIC   1:   640x480    59.940476 Hz   4:3     31.469 kHz     25.175000 MHz
    VIC   3:   720x480    59.940060 Hz  16:9     31.469 kHz     27.000000 MHz
    VIC   4:  1280x720    60.000000 Hz  16:9     45.000 kHz     74.250000 MHz
    VIC  18:   720x576    50.000000 Hz  16:9     31.250 kHz     27.000000 MHz
    VIC  19:  1280x720    50.000000 Hz  16:9     37.500 kHz     74.250000 MHz
    VIC   5:  1920x1080i  60.000000 Hz  16:9     33.750 kHz     74.250000 MHz
    VIC   2:   720x480    59.940060 Hz   4:3     31.469 kHz     27.000000 MHz
    VIC  64:  1920x1080  100.000000 Hz  16:9    112.500 kHz    297.000000 MHz
  Audio Data Block:
    Linear PCM:
      Max channels: 2
      Supported sample rates (kHz): 48 44.1 32
      Supported sample sizes (bits): 24 20 16
  Speaker Allocation Data Block:
    FL/FR - Front Left/Right
  Vendor-Specific Data Block (HDMI), OUI 00-0C-03:
    Source physical address: 2.0.0.0
    DC_30bit
    DC_Y444
    Maximum TMDS clock: 600 MHz
  Colorimetry Data Block:
    xvYCC601
    xvYCC709
    BT2020cYCC
    BT2020YCC
    BT2020RGB
    Gamut Boundary Description Metadata Profile P0
  HDR Static Metadata Data Block:
    Electro optical transfer functions:
      Traditional gamma - SDR luminance range
      Traditional gamma - HDR luminance range
      SMPTE ST2084
    Supported static metadata descriptors:
      Static metadata type 1
    Desired content max luminance: 97 (408.759 cd/m^2)
    Desired content max frame-average luminance: 86 (322.098 cd/m^2)
    Desired content min luminance: 28 (0.049 cd/m^2)
  Detailed Timing Descriptors:
    DTD 2:  2560x1200   59.924982 Hz  32:15    74.007 kHz    201.300000 MHz (1052 mm x 329 mm)
                 Hfront   48 Hsync  32 Hback   80 Hpol P
                 Vfront   21 Vsync   8 Vback    6 Vpol N
    DTD 3:  3840x1200  100.000000 Hz  16:5    123.100 kHz    492.400000 MHz (1052 mm x 329 mm)
                 Hfront   48 Hsync  64 Hback   48 Hpol P
                 Vfront    3 Vsync  10 Vback   18 Vpol N
    DTD 4:  3840x1200   59.947088 Hz  16:5     74.035 kHz    299.100000 MHz (1052 mm x 329 mm)
                 Hfront   68 Hsync  32 Hback  100 Hpol P
                 Vfront   21 Vsync   8 Vback    6 Vpol N
    DTD 5:  1920x1200   59.950171 Hz  16:10    74.038 kHz    154.000000 MHz (1052 mm x 329 mm)
                 Hfront   48 Hsync  32 Hback   80 Hpol P
                 Vfront    3 Vsync   6 Vback   26 Vpol N
Checksum: 0x6f  Unused space in Extension Block: 10 bytes

----------------

Block 2, Unknown EDID Extension Block 0x00:
  00 ff ff ff ff ff ff 00 41 0c 39 09 8e 3f 00 00 '........A.9..?..'
  0f 1e 01 04 b5 69 21 78 3f 7f 25 ad 4f 47 a5 26 '.....i!x?.%.OG.&'
  10 50 54 bf ef 00 d1 c0 b3 00 95 00 81 80 81 40 '.PT............@'
  81 c0 d1 00 01 01 68 73 00 a0 f0 b0 1f 40 30 40 '......hs.....@0@'
  35 00 1c 49 41 00 00 1a 00 00 00 ff 00 41 55 30 '5..IA........AU0'
  32 30 31 35 30 31 36 32 37 30 00 00 00 fc 00 50 '2015016270.....P'
  48 4c 20 34 33 39 50 39 48 0a 20 20 00 00 00 fd 'HL 439P9H.  ....'
  00 30 64 96 96 3c 01 0a 20 20 20 20 20 20 01 a3 '.0d..<..      ..'
Checksum: 0xa3

----------------

Block 3, CTA-861 Extension Block:
  Revision: 3
  Underscans IT Video Formats by default
  Basic audio support
  Supports YCbCr 4:4:4
  Supports YCbCr 4:2:2
  Native detailed modes: 1
  Video Data Block:
    VIC  97:  3840x2160   60.000000 Hz  16:9    135.000 kHz    594.000000 MHz
    VIC  96:  3840x2160   50.000000 Hz  16:9    112.500 kHz    594.000000 MHz
    VIC  31:  1920x1080   50.000000 Hz  16:9     56.250 kHz    148.500000 MHz
    VIC  16:  1920x1080   60.000000 Hz  16:9     67.500 kHz    148.500000 MHz (native)
    VIC  20:  1920x1080i  50.000000 Hz  16:9     28.125 kHz     74.250000 MHz
    VIC   1:   640x480    59.940476 Hz   4:3     31.469 kHz     25.175000 MHz
    VIC   3:   720x480    59.940060 Hz  16:9     31.469 kHz     27.000000 MHz
    VIC   4:  1280x720    60.000000 Hz  16:9     45.000 kHz     74.250000 MHz
    VIC  18:   720x576    50.000000 Hz  16:9     31.250 kHz     27.000000 MHz
    VIC  19:  1280x720    50.000000 Hz  16:9     37.500 kHz     74.250000 MHz
    VIC   5:  1920x1080i  60.000000 Hz  16:9     33.750 kHz     74.250000 MHz
    VIC   2:   720x480    59.940060 Hz   4:3     31.469 kHz     27.000000 MHz
    VIC  64:  1920x1080  100.000000 Hz  16:9    112.500 kHz    297.000000 MHz
  Audio Data Block:
    Linear PCM:
      Max channels: 2
      Supported sample rates (kHz): 48 44.1 32
      Supported sample sizes (bits): 24 20 16
  Speaker Allocation Data Block:
    FL/FR - Front Left/Right
  Vendor-Specific Data Block (HDMI), OUI 00-0C-03:
    Source physical address: 2.0.0.0
    DC_30bit
    DC_Y444
    Maximum TMDS clock: 600 MHz
  Colorimetry Data Block:
    xvYCC601
    xvYCC709
    BT2020cYCC
    BT2020YCC
    BT2020RGB
    Gamut Boundary Description Metadata Profile P0
  HDR Static Metadata Data Block:
    Electro optical transfer functions:
      Traditional gamma - SDR luminance range
      Traditional gamma - HDR luminance range
      SMPTE ST2084
    Supported static metadata descriptors:
      Static metadata type 1
    Desired content max luminance: 97 (408.759 cd/m^2)
    Desired content max frame-average luminance: 86 (322.098 cd/m^2)
    Desired content min luminance: 28 (0.049 cd/m^2)
  Detailed Timing Descriptors:
    DTD 6:  2560x1200   59.924982 Hz  32:15    74.007 kHz    201.300000 MHz (1052 mm x 329 mm)
                 Hfront   48 Hsync  32 Hback   80 Hpol P
                 Vfront   21 Vsync   8 Vback    6 Vpol N
    DTD 7:  3840x1200  100.000000 Hz  16:5    123.100 kHz    492.400000 MHz (1052 mm x 329 mm)
                 Hfront   48 Hsync  64 Hback   48 Hpol P
                 Vfront    3 Vsync  10 Vback   18 Vpol N
    DTD 8:  3840x1200   59.947088 Hz  16:5     74.035 kHz    299.100000 MHz (1052 mm x 329 mm)
                 Hfront   68 Hsync  32 Hback  100 Hpol P
                 Vfront   21 Vsync   8 Vback    6 Vpol N
    DTD 9:  1920x1200   59.950171 Hz  16:10    74.038 kHz    154.000000 MHz (1052 mm x 329 mm)
                 Hfront   48 Hsync  32 Hback   80 Hpol P
                 Vfront    3 Vsync   6 Vback   26 Vpol N
Checksum: 0x6f  Unused space in Extension Block: 10 bytes

----------------

Warnings:

Block 1, CTA-861 Extension Block:
  Display Product Serial Number is set, so the Serial Number in the Base EDID should be 0.
Block 3, CTA-861 Extension Block:
  Display Product Serial Number is set, so the Serial Number in the Base EDID should be 0.
EDID:
  Base EDID: Some timings are out of range of the Monitor Ranges:
    Horizontal Freq: 28.125 - 135.000 kHz (Monitor: 150.000 - 150.000 kHz)

Failures:

Block 0, Base EDID:
  Basic Display Parameters & Features: sRGB is signaled, but the chromaticities do not match.
Block 1, CTA-861 Extension Block:
  Vendor-Specific Data Block (HDMI), OUI 00-0C-03: HDMI VSDB Max TMDS rate is > 340.
  Vendor-Specific Data Block (HDMI), OUI 00-0C-03: The HDMI Specification requires EDID 1.3 instead of 1.4.
  Missing VCDB, needed for Set Selectable RGB Quantization to avoid interop issues.
Block 2, Base EDID:
  Unknown Extension Block.
Block 3, CTA-861 Extension Block:
  Video Data Block: Duplicate VIC 97.
  Video Data Block: Duplicate VIC 96.
  Video Data Block: Duplicate VIC 31.
  Video Data Block: Duplicate VIC 16.
  Video Data Block: Duplicate VIC 20.
  Video Data Block: Duplicate VIC 1.
  Video Data Block: Duplicate VIC 3.
  Video Data Block: Duplicate VIC 4.
  Video Data Block: Duplicate VIC 18.
  Video Data Block: Duplicate VIC 19.
  Video Data Block: Duplicate VIC 5.
  Video Data Block: Duplicate VIC 2.
  Video Data Block: Duplicate VIC 64.
  Speaker Allocation Data Block: Only one instance of this Data Block is allowed.
  Vendor-Specific Data Block (HDMI), OUI 00-0C-03: HDMI VSDB Max TMDS rate is > 340.
  Vendor-Specific Data Block (HDMI), OUI 00-0C-03: The HDMI Specification requires EDID 1.3 instead of 1.4.
  Colorimetry Data Block: Only one instance of this Data Block is allowed.
  HDR Static Metadata Data Block: Only one instance of this Data Block is allowed.
  Missing VCDB, needed for Set Selectable RGB Quantization to avoid interop issues.
EDID:
  Base EDID: EDID specified 1 extension block(s), but found 3 extension block(s).
  CTA-861: Native progressive timings are a mix of several resolutions.

EDID conformity: FAIL
