edid-decode (hex):

00 ff ff ff ff ff ff 00 34 a9 0e a0 74 00 00 00
1c 0c 01 01 0e 5c 34 78 08 da ff a3 58 4a a2 29
17 49 4b ff ef 80 61 59 31 4a 45 59 81 40 81 59
4b c0 61 40 31 40 df 21 56 aa 51 26 26 30 20 b5
03 06 98 06 32 00 00 18 26 15 30 60 41 58 1c 20
30 b0 01 04 98 06 32 00 00 1c 00 00 00 fd 00 30
78 0f 6e ff 00 0a 20 20 20 20 20 20 00 00 00 fc
00 54 48 2d 34 32 50 48 2a 35 0a 20 20 20 00 b7

----------------

Block 0, Base EDID:
  EDID Structure Version & Revision: 1.1
  Vendor & Product Identification:
    Manufacturer: MEI
    Model: 40974
    Serial Number: ...
    Made in: week 28 of 2002
  Basic Display Parameters & Features:
    Analog display
    Input voltage level: 0.7/0.3 V
    Sync: Separate Composite SyncOnGreen
    Maximum image size: 92 cm x 52 cm
    Gamma: 2.20
    RGB color display
  Color Characteristics:
    Red  : 0.6396, 0.3447
    Green: 0.2910, 0.6347
    Blue : 0.1630, 0.0927
    White: 0.2880, 0.2958
  Established Timings I & II:
    IBM     :   720x400    70.082 Hz   9:5    31.467 kHz  28.320 MHz
    IBM     :   720x400    87.850 Hz   9:5    39.444 kHz  35.500 MHz
    DMT 0x04:   640x480    59.940 Hz   4:3    31.469 kHz  25.175 MHz
    Apple   :   640x480    66.667 Hz   4:3    35.000 kHz  30.240 MHz
    DMT 0x05:   640x480    72.809 Hz   4:3    37.861 kHz  31.500 MHz
    DMT 0x06:   640x480    75.000 Hz   4:3    37.500 kHz  31.500 MHz
    DMT 0x08:   800x600    56.250 Hz   4:3    35.156 kHz  36.000 MHz
    DMT 0x09:   800x600    60.317 Hz   4:3    37.879 kHz  40.000 MHz
    DMT 0x0a:   800x600    72.188 Hz   4:3    48.077 kHz  50.000 MHz
    DMT 0x0b:   800x600    75.000 Hz   4:3    46.875 kHz  49.500 MHz
    Apple   :   832x624    74.551 Hz   4:3    49.726 kHz  57.284 MHz
    DMT 0x10:  1024x768    60.004 Hz   4:3    48.363 kHz  65.000 MHz
    DMT 0x11:  1024x768    70.069 Hz   4:3    56.476 kHz  75.000 MHz
    DMT 0x12:  1024x768    75.029 Hz   4:3    60.023 kHz  78.750 MHz
    DMT 0x24:  1280x1024   75.025 Hz   5:4    79.976 kHz 135.000 MHz
    Apple   :  1152x870    75.062 Hz 192:145  68.681 kHz 100.000 MHz
  Standard Timings:
    DMT 0x13:  1024x768    84.997 Hz   4:3    68.677 kHz  94.500 MHz
    Unknown :   640x480    70.000 Hz   4:3
    DMT 0x0c:   800x600    85.061 Hz   4:3    53.674 kHz  56.250 MHz
    DMT 0x20:  1280x960    60.000 Hz   4:3    60.000 kHz 108.000 MHz
    DMT 0x21:  1280x960    85.002 Hz   4:3    85.938 kHz 148.500 MHz
    Unknown :   848x480    60.000 Hz  16:9
    DMT 0x10:  1024x768    60.004 Hz   4:3    48.363 kHz  65.000 MHz
    DMT 0x04:   640x480    59.940 Hz   4:3    31.469 kHz  25.175 MHz
  Detailed Timing Descriptors:
    DTD 1:  1366x806    57.331 Hz 683:403  48.387 kHz  86.710 MHz (920 mm x 518 mm)
                 Hfront   32 Hsync 181 Hback 213 Hpol N
                 Vfront   16 Vsync  35 Vback -13 Vpol N
    DTD 2:  1072x600    60.541 Hz 134:75   38.020 kHz  54.140 MHz (920 mm x 518 mm)
                 Hfront   48 Hsync 176 Hback 128 Hpol N
                 Vfront   16 Vsync   1 Vback  11 Vpol P
  Display Range Limits:
    Monitor ranges (GTF): 48-120 Hz V, 15-110 kHz H, max dotclock 2550 MHz
    Display Product Name: 'TH-42PH*5'
Checksum: 0xb7
