edid-decode (hex):

00 ff ff ff ff ff ff 00 26 cd 39 66 0a 05 00 00
27 1c 01 03 68 3c 22 78 2a 0b 75 a6 55 53 9f 28
0e 50 54 a5 6b 80 71 00 81 40 81 80 a9 40 b3 00
95 00 95 0f d1 c0 02 3a 80 18 71 38 2d 40 58 2c
45 00 56 50 21 00 00 1e 00 00 00 ff 00 31 31 35
33 36 38 33 39 30 31 32 39 30 00 00 00 fd 00 37
4c 1e 53 11 00 0a 20 20 20 20 20 20 00 00 00 fc
00 50 4c 32 37 33 30 48 0a 20 20 20 20 20 00 ed

----------------

Block 0, Base EDID:
  EDID Structure Version & Revision: 1.3
  Vendor & Product Identification:
    Manufacturer: IVM
    Model: 26169
    Serial Number: ...
    Made in: week 39 of 2018
  Basic Display Parameters & Features:
    Analog display
    Input voltage level: 0.7/0.7 V
    Sync: Separate
    Maximum image size: 60 cm x 34 cm
    Gamma: 2.20
    DPMS levels: Off
    RGB color display
    First detailed timing is the preferred timing
  Color Characteristics:
    Red  : 0.6484, 0.3320
    Green: 0.3261, 0.6240
    Blue : 0.1572, 0.0576
    White: 0.3134, 0.3291
  Established Timings I & II:
    IBM     :   720x400    70.082 Hz   9:5    31.467 kHz  28.320 MHz
    DMT 0x04:   640x480    59.940 Hz   4:3    31.469 kHz  25.175 MHz
    DMT 0x06:   640x480    75.000 Hz   4:3    37.500 kHz  31.500 MHz
    DMT 0x09:   800x600    60.317 Hz   4:3    37.879 kHz  40.000 MHz
    DMT 0x0b:   800x600    75.000 Hz   4:3    46.875 kHz  49.500 MHz
    Apple   :   832x624    74.551 Hz   4:3    49.726 kHz  57.284 MHz
    DMT 0x10:  1024x768    60.004 Hz   4:3    48.363 kHz  65.000 MHz
    DMT 0x12:  1024x768    75.029 Hz   4:3    60.023 kHz  78.750 MHz
    DMT 0x24:  1280x1024   75.025 Hz   5:4    79.976 kHz 135.000 MHz
    Apple   :  1152x870    75.062 Hz 192:145  68.681 kHz 100.000 MHz
  Standard Timings:
    GTF     :  1152x720    60.000 Hz  16:10   44.760 kHz  67.319 MHz
    DMT 0x20:  1280x960    60.000 Hz   4:3    60.000 kHz 108.000 MHz
    DMT 0x23:  1280x1024   60.020 Hz   5:4    63.981 kHz 108.000 MHz
    DMT 0x33:  1600x1200   60.000 Hz   4:3    75.000 kHz 162.000 MHz
    DMT 0x3a:  1680x1050   59.954 Hz  16:10   65.290 kHz 146.250 MHz
    DMT 0x2f:  1440x900    59.887 Hz  16:10   55.935 kHz 106.500 MHz
    DMT 0x30:  1440x900    74.984 Hz  16:10   70.635 kHz 136.750 MHz
    DMT 0x52:  1920x1080   60.000 Hz  16:9    67.500 kHz 148.500 MHz
  Detailed Timing Descriptors:
    DTD 1:  1920x1080   60.000 Hz  16:9    67.500 kHz 148.500 MHz (598 mm x 336 mm)
                 Hfront   88 Hsync  44 Hback 148 Hpol P
                 Vfront    4 Vsync   5 Vback  36 Vpol P
    Display Product Serial Number: ...
  Display Range Limits:
    Monitor ranges (GTF): 55-76 Hz V, 30-83 kHz H, max dotclock 170 MHz
    Display Product Name: 'PL2730H'
Checksum: 0xed

----------------

EDID conformity: PASS
