
EDID (hex):
00ffffffffffff001e6def56312b0200
0a13010380331d78eaee91a3544c9926
0f5054a76b80b300818f8180714f0101
0101010101011a3680a070381f403020
3500fe221100001e023a801871382d40
582c4500fe221100001e000000fd0038
4b1e530f000a202020202020000000fc
0057323335330a202020202020200012

Extracted contents:
header:          00 ff ff ff ff ff ff 00
serial number:   1e 6d ef 56 31 2b 02 00 0a 13
version:         01 03
basic params:    80 33 1d 78 ea
chroma info:     ee 91 a3 54 4c 99 26 0f 50 54
established:     a7 6b 80
standard:        b3 00 81 8f 81 80 71 4f 01 01 01 01 01 01 01 01
descriptor 1:    1a 36 80 a0 70 38 1f 40 30 20 35 00 fe 22 11 00 00 1e
descriptor 2:    02 3a 80 18 71 38 2d 40 58 2c 45 00 fe 22 11 00 00 1e
descriptor 3:    00 00 00 fd 00 38 4b 1e 53 0f 00 0a 20 20 20 20 20 20
descriptor 4:    00 00 00 fc 00 57 32 33 35 33 0a 20 20 20 20 20 20 20
extensions:      00
checksum:        12

EDID version: 1.3
Manufacturer: GSM Model 56ef Serial Number --
Made in week 10 of 2009
Digital display
Maximum image size: 51 cm x 29 cm
Gamma: 2.20
DPMS levels: Standby Suspend Off
RGB color display
First detailed timing is preferred timing
Display x,y Chromaticity:
  Red:   0.6396, 0.3300
  Green: 0.2998, 0.5996
  Blue:  0.1503, 0.0595
  White: 0.3125, 0.3291
Established timings supported:
  720x400@70Hz 9:5 HorFreq: 31469 Hz Clock: 28.320 MHz
  640x480@60Hz 4:3 HorFreq: 31469 Hz Clock: 25.175 MHz
  640x480@75Hz 4:3 HorFreq: 37500 Hz Clock: 31.500 MHz
  800x600@56Hz 4:3 HorFreq: 35200 Hz Clock: 36.000 MHz
  800x600@60Hz 4:3 HorFreq: 37900 Hz Clock: 40.000 MHz
  800x600@75Hz 4:3 HorFreq: 46900 Hz Clock: 49.500 MHz
  832x624@75Hz 4:3 HorFreq: 49726 Hz Clock: 57.284 MHz
  1024x768@60Hz 4:3 HorFreq: 48400 Hz Clock: 65.000 MHz
  1024x768@75Hz 4:3 HorFreq: 60000 Hz Clock: 78.750 MHz
  1280x1024@75Hz 5:4 HorFreq: 80000 Hz Clock: 135.000 MHz
  1152x870@75Hz 192:145 HorFreq: 67500 Hz Clock: 108.000 MHz
Standard timings supported:
  1680x1050@60Hz 16:10 HorFreq: 64700 Hz Clock: 119.000 MHz
  1280x1024@75Hz 5:4 HorFreq: 80000 Hz Clock: 135.000 MHz
  1280x1024@60Hz 5:4 HorFreq: 64000 Hz Clock: 108.000 MHz
  1152x864@75Hz 4:3 HorFreq: 67500 Hz Clock: 108.000 MHz
Detailed mode: Clock 138.500 MHz, 510 mm x 290 mm
               1920 1968 2000 2080 hborder 0
               1080 1083 1088 1111 vborder 0
               +hsync +vsync 
               VertFreq: 59 Hz, HorFreq: 66586 Hz
Detailed mode: Clock 148.500 MHz, 510 mm x 290 mm
               1920 2008 2052 2200 hborder 0
               1080 1084 1089 1125 vborder 0
               +hsync +vsync 
               VertFreq: 60 Hz, HorFreq: 67500 Hz
Monitor ranges (GTF): 56-75Hz V, 30-83kHz H, max dotclock 150MHz
Monitor name: W2353
Checksum: 0x12 (valid)
