
EDID (hex):
00ffffffffffff004c2d1b0230324148
2c1101030e291e782aee95a3544c9926
0f5054bfef8090408140714f81800101
0101010101018f2f78d0511a27405890
3400982c1100001d000000fd00384b1e
5110000a202020202020000000fc0053
796e634d61737465720a2020000000ff
00485333504230393133300a202000e9

Extracted contents:
header:          00 ff ff ff ff ff ff 00
serial number:   4c 2d 1b 02 30 32 41 48 2c 11
version:         01 03
basic params:    0e 29 1e 78 2a
chroma info:     ee 95 a3 54 4c 99 26 0f 50 54
established:     bf ef 80
standard:        90 40 81 40 71 4f 81 80 01 01 01 01 01 01 01 01
descriptor 1:    8f 2f 78 d0 51 1a 27 40 58 90 34 00 98 2c 11 00 00 1d
descriptor 2:    00 00 00 fd 00 38 4b 1e 51 10 00 0a 20 20 20 20 20 20
descriptor 3:    00 00 00 fc 00 53 79 6e 63 4d 61 73 74 65 72 0a 20 20
descriptor 4:    00 00 00 ff 00 48 53 33 50 42 30 39 31 33 30 0a 20 20
extensions:      00
checksum:        e9

EDID version: 1.3
Manufacturer: SAM Model 21b Serial Number --
Made in week 44 of 2007
Analog display, Input voltage level: 0.7/0.3 V
Sync: Separate Composite SyncOnGreen 
Maximum image size: 41 cm x 30 cm
Gamma: 2.20
DPMS levels: Off
RGB color display
First detailed timing is preferred timing
Display x,y Chromaticity:
  Red:   0.6396, 0.3300
  Green: 0.2998, 0.5996
  Blue:  0.1503, 0.0595
  White: 0.3134, 0.3291
Established timings supported:
  720x400@70Hz 9:5 HorFreq: 31469 Hz Clock: 28.320 MHz
  640x480@60Hz 4:3 HorFreq: 31469 Hz Clock: 25.175 MHz
  640x480@67Hz 4:3 HorFreq: 35000 Hz Clock: 30.240 MHz
  640x480@72Hz 4:3 HorFreq: 37900 Hz Clock: 31.500 MHz
  640x480@75Hz 4:3 HorFreq: 37500 Hz Clock: 31.500 MHz
  800x600@56Hz 4:3 HorFreq: 35200 Hz Clock: 36.000 MHz
  800x600@60Hz 4:3 HorFreq: 37900 Hz Clock: 40.000 MHz
  800x600@72Hz 4:3 HorFreq: 48100 Hz Clock: 50.000 MHz
  800x600@75Hz 4:3 HorFreq: 46900 Hz Clock: 49.500 MHz
  832x624@75Hz 4:3 HorFreq: 49726 Hz Clock: 57.284 MHz
  1024x768@60Hz 4:3 HorFreq: 48400 Hz Clock: 65.000 MHz
  1024x768@70Hz 4:3 HorFreq: 56500 Hz Clock: 75.000 MHz
  1024x768@75Hz 4:3 HorFreq: 60000 Hz Clock: 78.750 MHz
  1280x1024@75Hz 5:4 HorFreq: 80000 Hz Clock: 135.000 MHz
  1152x870@75Hz 192:145 HorFreq: 67500 Hz Clock: 108.000 MHz
Standard timings supported:
  1400x1050@60Hz 4:3 HorFreq: 64700 Hz Clock: 101.000 MHz
  1280x960@60Hz 4:3 HorFreq: 60000 Hz Clock: 108.000 MHz
  1152x864@75Hz 4:3 HorFreq: 67500 Hz Clock: 108.000 MHz
  1280x1024@60Hz 5:4 HorFreq: 64000 Hz Clock: 108.000 MHz
Detailed mode: Clock 121.750 MHz, 408 mm x 300 mm
               1400 1488 1632 1864 hborder 0
               1050 1053 1057 1089 vborder 0
               -hsync +vsync 
               VertFreq: 59 Hz, HorFreq: 65316 Hz
Monitor ranges (GTF): 56-75Hz V, 30-81kHz H, max dotclock 160MHz
Monitor name: SyncMaster
Serial number: --
Checksum: 0xe9 (valid)
