edid-decode (hex):

00 ff ff ff ff ff ff 00 06 af 9d 43 00 00 00 00
00 1c 01 04 a5 26 16 78 03 bf a5 a5 55 4d 9d 26
0e 50 54 00 00 00 01 01 01 01 01 01 01 01 01 01
01 01 01 01 01 01 14 37 80 b4 70 38 26 40 10 10
3e 00 7e d7 10 00 00 18 b8 24 80 b4 70 38 26 40
10 10 3e 00 7e d7 10 00 00 18 00 00 00 00 00 00
00 00 00 00 00 00 00 00 00 00 00 00 00 00 00 02
00 10 36 ff 0f 3c 96 1b 1d 49 96 20 20 20 00 c4

----------------

Block 0, Base EDID:
  EDID Structure Version & Revision: 1.4
  Vendor & Product Identification:
    Manufacturer: AUO
    Model: 17309
    Made in: 2018
  Basic Display Parameters & Features:
    Digital display
    Bits per primary color channel: 8
    DisplayPort interface
    Maximum image size: 38 cm x 22 cm
    Gamma: 2.20
    Supported color formats: RGB 4:4:4
    First detailed timing includes the native pixel format and preferred refresh rate
    Display is continuous frequency
  Color Characteristics:
    Red  : 0.6464, 0.3349
    Green: 0.3037, 0.6162
    Blue : 0.1503, 0.0566
    White: 0.3134, 0.3291
  Established Timings I & II: none
  Standard Timings: none
  Detailed Timing Descriptors:
    DTD 1:  1920x1080   60.056223 Hz  16:9     67.143 kHz    141.000000 MHz (382 mm x 215 mm)
                 Hfront   16 Hsync  16 Hback  148 Hpol N
                 Vfront    3 Vsync  14 Vback   21 Vpol N
    DTD 2:  1920x1080   40.037482 Hz  16:9     44.762 kHz     94.000000 MHz (382 mm x 215 mm)
                 Hfront   16 Hsync  16 Hback  148 Hpol N
                 Vfront    3 Vsync  14 Vback   21 Vpol N
    Empty Descriptor
    Manufacturer-Specified Display Descriptor (0x02): 00 02 00 10 36 ff 0f 3c 96 1b 1d 49 96 20 20 20 '....6..<...I.   '
Checksum: 0xc4

----------------

Warnings:

Block 0, Base EDID:
  Missing Display Product Name.

Failures:

Block 0, Base EDID:
  Empty Descriptor: Use Dummy Descriptor instead of all zeroes.
  Missing Display Range Limits Descriptor.

EDID conformity: FAIL
