
EDID (hex):
00ffffffffffff001e6d4c5a24d30000
0b1a010380342178ea3c31a7554da227
105054a54b00714f81008180818f9500
a940b300d1c0283c80a070b023403020
3600084a2100001a000000fd00384b1e
5311000a202020202020000000fc0032
344d4236350a202020202020000000ff
003631314e545144314c3035320a004f

Extracted contents:
header:          00 ff ff ff ff ff ff 00
serial number:   1e 6d 4c 5a 24 d3 00 00 0b 1a
version:         01 03
basic params:    80 34 21 78 ea
chroma info:     3c 31 a7 55 4d a2 27 10 50 54
established:     a5 4b 00
standard:        71 4f 81 00 81 80 81 8f 95 00 a9 40 b3 00 d1 c0
descriptor 1:    28 3c 80 a0 70 b0 23 40 30 20 36 00 08 4a 21 00 00 1a
descriptor 2:    00 00 00 fd 00 38 4b 1e 53 11 00 0a 20 20 20 20 20 20
descriptor 3:    00 00 00 fc 00 32 34 4d 42 36 35 0a 20 20 20 20 20 20
descriptor 4:    00 00 00 ff 00 36 31 31 4e 54 51 44 31 4c 30 35 32 0a
extensions:      00
checksum:        4f

EDID version: 1.3
Manufacturer: GSM Model 5a4c Serial Number --
Made in week 11 of 2016
Digital display
Maximum image size: 52 cm x 33 cm
Gamma: 2.20
DPMS levels: Standby Suspend Off
RGB color display
First detailed timing is preferred timing
Display x,y Chromaticity:
  Red:   0.6523, 0.3349
  Green: 0.3037, 0.6328
  Blue:  0.1523, 0.0654
  White: 0.3125, 0.3291
Established timings supported:
  720x400@70Hz 9:5 HorFreq: 31469 Hz Clock: 28.320 MHz
  640x480@60Hz 4:3 HorFreq: 31469 Hz Clock: 25.175 MHz
  640x480@75Hz 4:3 HorFreq: 37500 Hz Clock: 31.500 MHz
  800x600@60Hz 4:3 HorFreq: 37900 Hz Clock: 40.000 MHz
  800x600@75Hz 4:3 HorFreq: 46900 Hz Clock: 49.500 MHz
  1024x768@60Hz 4:3 HorFreq: 48400 Hz Clock: 65.000 MHz
  1024x768@75Hz 4:3 HorFreq: 60000 Hz Clock: 78.750 MHz
  1280x1024@75Hz 5:4 HorFreq: 80000 Hz Clock: 135.000 MHz
Standard timings supported:
  1152x864@75Hz 4:3 HorFreq: 67500 Hz Clock: 108.000 MHz
  1280x800@60Hz 16:10
  1280x1024@60Hz 5:4 HorFreq: 64000 Hz Clock: 108.000 MHz
  1280x1024@75Hz 5:4 HorFreq: 80000 Hz Clock: 135.000 MHz
  1440x900@60Hz 16:10 HorFreq: 55500 Hz Clock: 88.750 MHz
  1600x1200@60Hz 4:3 HorFreq: 75000 Hz Clock: 162.000 MHz
  1680x1050@60Hz 16:10 HorFreq: 64700 Hz Clock: 119.000 MHz
  1920x1080@60Hz 16:9
Detailed mode: Clock 154.000 MHz, 520 mm x 330 mm
               1920 1968 2000 2080 hborder 0
               1200 1203 1209 1235 vborder 0
               +hsync -vsync 
               VertFreq: 59 Hz, HorFreq: 74038 Hz
Monitor ranges (GTF): 56-75Hz V, 30-83kHz H, max dotclock 170MHz
Monitor name: 24MB65
Serial number: --
Checksum: 0x4f (valid)


