
EDID (hex):
00ffffffffffff0030aea36601010101
331e0103803c21783a9255a755539328
135054afed00714f81c08180818ab300
d1c0a9c00101023a801871382d40582c
450055502100001e000000ff00555257
30344b39590a20202020000000fd0030
a51ea83c010a202020202020000000fc
004c454e20473237632d31300a200172
020335f1490304901f021112133f2309
07078301000068030c00200038780067
d85dc4017880006d1a0000020130a5ed
00000000007b7f807870381f40302045
0055502100001a129e800471382d4058
2c450055502100001e662156aa51001e
30468f330055502100001e7f48801871
382d403028550055502100001e000038

Extracted contents:
header:          00 ff ff ff ff ff ff 00
serial number:   30 ae a3 66 01 01 01 01 33 1e
version:         01 03
basic params:    80 3c 21 78 3a
chroma info:     92 55 a7 55 53 93 28 13 50 54
established:     af ed 00
standard:        71 4f 81 c0 81 80 81 8a b3 00 d1 c0 a9 c0 01 01
descriptor 1:    02 3a 80 18 71 38 2d 40 58 2c 45 00 55 50 21 00 00 1e
descriptor 2:    00 00 00 ff 00 55 52 57 30 34 4b 39 59 0a 20 20 20 20
descriptor 3:    00 00 00 fd 00 30 a5 1e a8 3c 01 0a 20 20 20 20 20 20
descriptor 4:    00 00 00 fc 00 4c 45 4e 20 47 32 37 63 2d 31 30 0a 20
extensions:      01
checksum:        72

EDID version: 1.3
Manufacturer: LEN Model 66a3 Serial Number --
Made in week 51 of 2020
Digital display
Maximum image size: 60 cm x 33 cm
Gamma: 2.20
DPMS levels: Off
Undefined display color type
First detailed timing is preferred timing
Display x,y Chromaticity:
  Red:   0.6542, 0.3330
  Green: 0.3242, 0.5761
  Blue:  0.1572, 0.0751
  White: 0.3134, 0.3291
Established timings supported:
  720x400@70Hz 9:5 HorFreq: 31469 Hz Clock: 28.320 MHz
  640x480@60Hz 4:3 HorFreq: 31469 Hz Clock: 25.175 MHz
  640x480@72Hz 4:3 HorFreq: 37900 Hz Clock: 31.500 MHz
  640x480@75Hz 4:3 HorFreq: 37500 Hz Clock: 31.500 MHz
  800x600@56Hz 4:3 HorFreq: 35200 Hz Clock: 36.000 MHz
  800x600@60Hz 4:3 HorFreq: 37900 Hz Clock: 40.000 MHz
  800x600@72Hz 4:3 HorFreq: 48100 Hz Clock: 50.000 MHz
  800x600@75Hz 4:3 HorFreq: 46900 Hz Clock: 49.500 MHz
  832x624@75Hz 4:3 HorFreq: 49726 Hz Clock: 57.284 MHz
  1024x768@60Hz 4:3 HorFreq: 48400 Hz Clock: 65.000 MHz
  1024x768@70Hz 4:3 HorFreq: 56500 Hz Clock: 75.000 MHz
  1280x1024@75Hz 5:4 HorFreq: 80000 Hz Clock: 135.000 MHz
Standard timings supported:
  1152x864@75Hz 4:3 HorFreq: 67500 Hz Clock: 108.000 MHz
  1280x720@60Hz 16:9
  1280x1024@60Hz 5:4 HorFreq: 64000 Hz Clock: 108.000 MHz
  1280x1024@70Hz 5:4
  1680x1050@60Hz 16:10 HorFreq: 64700 Hz Clock: 119.000 MHz
  1920x1080@60Hz 16:9
  1600x900@60Hz 16:9
Detailed mode: Clock 148.500 MHz, 597 mm x 336 mm
               1920 2008 2052 2200 hborder 0
               1080 1084 1089 1125 vborder 0
               +hsync +vsync 
               VertFreq: 60 Hz, HorFreq: 67500 Hz
Serial number: --
Monitor ranges (bare limits): 48-165Hz V, 30-168kHz H, max dotclock 600MHz
Monitor name: LEN G27c-10
Has 1 extension blocks
Checksum: 0x72 (valid)

CTA extension block
Extension version: 3
49 bytes of CTA data
  Video data block
    VIC   3 720x480@60Hz 16:9  HorFreq: 31469 Hz Clock: 27.000 MHz
    VIC   4 1280x720@60Hz 16:9  HorFreq: 45000 Hz Clock: 74.250 MHz
    VIC  16 1920x1080@60Hz 16:9 (native) HorFreq: 67500 Hz Clock: 148.500 MHz
    VIC  31 1920x1080@50Hz 16:9  HorFreq: 56250 Hz Clock: 148.500 MHz
    VIC   2 720x480@60Hz 4:3  HorFreq: 31469 Hz Clock: 27.000 MHz
    VIC  17 720x576@50Hz 4:3  HorFreq: 31250 Hz Clock: 27.000 MHz
    VIC  18 720x576@50Hz 16:9  HorFreq: 31250 Hz Clock: 27.000 MHz
    VIC  19 1280x720@50Hz 16:9  HorFreq: 37500 Hz Clock: 74.250 MHz
    VIC  63 1920x1080@120Hz 16:9  HorFreq: 135000 Hz Clock: 297.000 MHz
  Audio data block
    Linear PCM, max channels 2
      Supported sample rates (kHz): 48 44.1 32
      Supported sample sizes (bits): 24 20 16
  Speaker allocation data block
    Speaker map:
      FL/FR - Front Left/Right
  Vendor-specific data block, OUI 000c03 (HDMI)
    Source physical address 2.0.0.0
    DC_36bit
    DC_30bit
    DC_Y444
    Maximum TMDS clock: 600MHz
  Vendor-specific data block, OUI c45dd8 (HDMI Forum)
    Version: 1
    Maximum TMDS Character Rate: 600MHz
    SCDC Present
  Vendor-specific data block, OUI 00001a
Underscans PC formats by default
Basic audio support
Supports YCbCr 4:4:4
Supports YCbCr 4:2:2
1 native detailed modes
Detailed mode: Clock 326.350 MHz, 597 mm x 336 mm
               1920 1968 2000 2040 hborder 0
               1080 1084 1089 1111 vborder 0
               +hsync -vsync 
               VertFreq: 143 Hz, HorFreq: 159975 Hz
Detailed mode: Clock 404.660 MHz, 597 mm x 336 mm
               1920 2008 2052 2180 hborder 0
               1080 1084 1089 1125 vborder 0
               +hsync +vsync 
               VertFreq: 164 Hz, HorFreq: 185623 Hz
Detailed mode: Clock 85.500 MHz, 597 mm x 336 mm
               1366 1436 1579 1792 hborder 0
                768  771  774  798 vborder 0
               +hsync +vsync 
               VertFreq: 59 Hz, HorFreq: 47712 Hz
Detailed mode: Clock 185.590 MHz, 597 mm x 336 mm
               1920 1968 2008 2200 hborder 0
               1080 1085 1090 1125 vborder 0
               +hsync +vsync 
               VertFreq: 74 Hz, HorFreq: 84359 Hz
Checksum: 0x38 (valid)

EDID block does NOT conform to EDID 1.3!
	HDMI VSDB Max TMDS rate is > 340
EDID block does not conform at all!
	Both the serial number and the serial string are set
	Detailed blocks filled with garbage
	Range descriptor contains garbage


