edid-decode (hex):

00 ff ff ff ff ff ff 00 1e 6d fa 76 c7 2e 02 00
0a 1c 01 04 a5 50 22 78 9f ca 95 a6 55 4e a1 26
0f 50 54 25 6b 80 71 40 81 80 81 c0 a9 c0 b3 00
d1 c0 81 00 d1 cf cd 46 00 a0 a0 38 1f 40 30 20
3a 00 1e 4e 31 00 00 1a 00 3a 80 18 71 38 2d 40
58 2c 45 00 13 2a 21 00 00 1e 00 00 00 fd 00 28
4b 5a 5a 18 01 0a 20 20 20 20 20 20 00 00 00 fc
00 4c 47 20 55 4c 54 52 41 57 49 44 45 0a 01 fe

02 03 14 71 23 09 06 07 47 10 04 03 01 1f 13 12
83 01 00 00 8c 0a d0 8a 20 e0 2d 10 10 3e 96 00
1e 4e 31 00 00 18 29 59 00 a0 a0 38 27 40 30 20
3a 00 1e 4e 31 00 00 1a 00 00 00 00 00 00 00 00
00 00 00 00 00 00 00 00 00 00 00 00 00 00 00 00
00 00 00 00 00 00 00 00 00 00 00 00 00 00 00 00
00 00 00 00 00 00 00 00 00 00 00 00 00 00 00 00
00 00 00 00 00 00 00 00 00 00 00 00 00 00 00 ae

----------------

Block 0, Base EDID:
  EDID Structure Version & Revision: 1.4
  Vendor & Product Identification:
    Manufacturer: GSM
    Model: 30458
    Serial Number: ...
    Made in: week 10 of 2018
  Basic Display Parameters & Features:
    Digital display
    Bits per primary color channel: 8
    DisplayPort interface
    Maximum image size: 80 cm x 34 cm
    Gamma: 2.20
    DPMS levels: Standby
    Supported color formats: RGB 4:4:4, YCrCb 4:4:4, YCrCb 4:2:2
    Default (sRGB) color space is primary color space
    First detailed timing includes the native pixel format and preferred refresh rate
    Display is continuous frequency
  Color Characteristics:
    Red  : 0.6513, 0.3320
    Green: 0.3066, 0.6308
    Blue : 0.1503, 0.0595
    White: 0.3134, 0.3291
  Established Timings I & II:
    DMT 0x04:   640x480    59.940 Hz   4:3    31.469 kHz  25.175 MHz
    DMT 0x06:   640x480    75.000 Hz   4:3    37.500 kHz  31.500 MHz
    DMT 0x09:   800x600    60.317 Hz   4:3    37.879 kHz  40.000 MHz
    DMT 0x0b:   800x600    75.000 Hz   4:3    46.875 kHz  49.500 MHz
    Apple   :   832x624    74.551 Hz   4:3    49.726 kHz  57.284 MHz
    DMT 0x10:  1024x768    60.004 Hz   4:3    48.363 kHz  65.000 MHz
    DMT 0x12:  1024x768    75.029 Hz   4:3    60.023 kHz  78.750 MHz
    DMT 0x24:  1280x1024   75.025 Hz   5:4    79.976 kHz 135.000 MHz
    Apple   :  1152x870    75.062 Hz 192:145  68.681 kHz 100.000 MHz
  Standard Timings:
    CVT     :  1152x864    59.959 Hz   4:3    53.783 kHz  81.750 MHz (EDID 1.4 source)
    GTF     :  1152x864    60.000 Hz   4:3    53.700 kHz  81.624 MHz (EDID 1.3 source)
    DMT 0x23:  1280x1024   60.020 Hz   5:4    63.981 kHz 108.000 MHz
    DMT 0x55:  1280x720    60.000 Hz  16:9    45.000 kHz  74.250 MHz
    DMT 0x53:  1600x900    60.000 Hz  16:9    60.000 kHz 108.000 MHz (RB)
    DMT 0x3a:  1680x1050   59.954 Hz  16:10   65.290 kHz 146.250 MHz
    DMT 0x52:  1920x1080   60.000 Hz  16:9    67.500 kHz 148.500 MHz
    DMT 0x1c:  1280x800    59.810 Hz  16:10   49.702 kHz  83.500 MHz
    CVT     :  1920x1080   74.906 Hz  16:9    84.643 kHz 220.750 MHz (EDID 1.4 source)
    GTF     :  1920x1080   75.000 Hz  16:9    84.600 kHz 220.637 MHz (EDID 1.3 source)
  Detailed Timing Descriptors:
    DTD 1:  2560x1080   59.978 Hz  64:27   66.636 kHz 181.250 MHz (798 mm x 334 mm)
                 Hfront   48 Hsync  32 Hback  80 Hpol P
                 Vfront    3 Vsync  10 Vback  18 Vpol N
    DTD 2:  1920x1080   59.992 Hz  16:9    67.491 kHz 148.480 MHz (531 mm x 298 mm)
                 Hfront   88 Hsync  44 Hback 148 Hpol P
                 Vfront    4 Vsync   5 Vback  36 Vpol P
  Display Range Limits:
    Monitor ranges (Bare Limits): 40-75 Hz V, 90-90 kHz H, max dotclock 240 MHz
    Display Product Name: 'LG ULTRAWIDE'
  Extension blocks: 1
Checksum: 0xfe

----------------

Block 1, CTA-861 Extension Block:
  Revision: 3
  Basic audio support
  Supports YCbCr 4:4:4
  Supports YCbCr 4:2:2
  Native detailed modes: 1
  Audio Data Block:
    Linear PCM:
      Max channels: 2
      Supported sample rates (kHz): 48 44.1
      Supported sample sizes (bits): 24 20 16
  Video Data Block:
    VIC  16:  1920x1080   60.000 Hz  16:9    67.500 kHz 148.500 MHz
    VIC   4:  1280x720    60.000 Hz  16:9    45.000 kHz  74.250 MHz
    VIC   3:   720x480    59.940 Hz  16:9    31.469 kHz  27.000 MHz
    VIC   1:   640x480    59.940 Hz   4:3    31.469 kHz  25.175 MHz
    VIC  31:  1920x1080   50.000 Hz  16:9    56.250 kHz 148.500 MHz
    VIC  19:  1280x720    50.000 Hz  16:9    37.500 kHz  74.250 MHz
    VIC  18:   720x576    50.000 Hz  16:9    31.250 kHz  27.000 MHz
  Speaker Allocation Data Block:
    FL/FR - Front Left/Right
  Detailed Timing Descriptors:
    DTD 3:   720x480    59.940 Hz   3:2    31.469 kHz  27.000 MHz (798 mm x 334 mm)
                 Hfront   16 Hsync  62 Hback  60 Hpol N
                 Vfront    9 Vsync   6 Vback  30 Vpol N
    DTD 4:  2560x1080   74.991 Hz  64:27   83.915 kHz 228.250 MHz (798 mm x 334 mm)
                 Hfront   48 Hsync  32 Hback  80 Hpol P
                 Vfront    3 Vsync  10 Vback  26 Vpol N
Checksum: 0xae

----------------

Warnings:

Block 1, CTA-861 Extension Block:
  IT Video Formats are overscanned by default, but normally this should be underscanned.
  Missing VCDB, needed for Set Selectable RGB Quantization to avoid interop issues.
EDID:
  Base EDID: Some timings are out of range of the Monitor Ranges:
    Horizontal Freq: 31.250 - 84.643 kHz (Monitor: 90.000 - 90.000 kHz)

Failures:

Block 0, Base EDID:
  Basic Display Parameters & Features: sRGB is signaled, but the chromaticities do not match.
  Detailed Timing Descriptor #2: Mismatch of image size 531x298 mm vs display size 800x340 mm.
EDID:
  Base EDID: GTF timings are used, but the EDID does not signal GTF support.
  Base EDID: CVT timings are used, but the EDID does not signal CVT support.

EDID conformity: FAIL
