
EDID (hex):
00ffffffffffff0009d1cf7845540000
261701030e291a782e8584a6574a9c26
125054a56b80710081009500950f8180
81c0010101019a29a0d0518420305098
360098ff1000001c000000ff004d3944
3033313638534c300a20000000fd0032
4c1e5315000a202020202020000000fc
0042656e51204739313057414c0a0032

Extracted contents:
header:          00 ff ff ff ff ff ff 00
serial number:   09 d1 cf 78 45 54 00 00 26 17
version:         01 03
basic params:    0e 29 1a 78 2e
chroma info:     85 84 a6 57 4a 9c 26 12 50 54
established:     a5 6b 80
standard:        71 00 81 00 95 00 95 0f 81 80 81 c0 01 01 01 01
descriptor 1:    9a 29 a0 d0 51 84 20 30 50 98 36 00 98 ff 10 00 00 1c
descriptor 2:    00 00 00 ff 00 4d 39 44 30 33 31 36 38 53 4c 30 0a 20
descriptor 3:    00 00 00 fd 00 32 4c 1e 53 15 00 0a 20 20 20 20 20 20
descriptor 4:    00 00 00 fc 00 42 65 6e 51 20 47 39 31 30 57 41 4c 0a
extensions:      00
checksum:        32

EDID version: 1.3
Manufacturer: BNQ Model 78cf Serial Number --
Made in week 38 of 2013
Analog display, Input voltage level: 0.7/0.3 V
Sync: Separate Composite SyncOnGreen 
Maximum image size: 41 cm x 26 cm
Gamma: 2.20
DPMS levels: Off
RGB color display
Default (sRGB) color space is primary color space
First detailed timing is preferred timing
Display x,y Chromaticity:
  Red:   0.6503, 0.3398
  Green: 0.2900, 0.6103
  Blue:  0.1503, 0.0703
  White: 0.3134, 0.3281
Established timings supported:
  720x400@70Hz 9:5 HorFreq: 31469 Hz Clock: 28.320 MHz
  640x480@60Hz 4:3 HorFreq: 31469 Hz Clock: 25.175 MHz
  640x480@75Hz 4:3 HorFreq: 37500 Hz Clock: 31.500 MHz
  800x600@60Hz 4:3 HorFreq: 37900 Hz Clock: 40.000 MHz
  800x600@75Hz 4:3 HorFreq: 46900 Hz Clock: 49.500 MHz
  832x624@75Hz 4:3 HorFreq: 49726 Hz Clock: 57.284 MHz
  1024x768@60Hz 4:3 HorFreq: 48400 Hz Clock: 65.000 MHz
  1024x768@75Hz 4:3 HorFreq: 60000 Hz Clock: 78.750 MHz
  1280x1024@75Hz 5:4 HorFreq: 80000 Hz Clock: 135.000 MHz
  1152x870@75Hz 192:145 HorFreq: 67500 Hz Clock: 108.000 MHz
Standard timings supported:
  1152x720@60Hz 16:10
  1280x800@60Hz 16:10
  1440x900@60Hz 16:10 HorFreq: 55500 Hz Clock: 88.750 MHz
  1440x900@75Hz 16:10 HorFreq: 82300 Hz Clock: 156.000 MHz
  1280x1024@60Hz 5:4 HorFreq: 64000 Hz Clock: 108.000 MHz
  1280x720@60Hz 16:9
Detailed mode: Clock 106.500 MHz, 408 mm x 255 mm
               1440 1520 1672 1904 hborder 0
                900  903  909  932 vborder 0
               -hsync +vsync 
               VertFreq: 60 Hz, HorFreq: 55934 Hz
Serial number: --
Monitor ranges (GTF): 50-76Hz V, 30-83kHz H, max dotclock 210MHz
Monitor name: BenQ G910WAL
Checksum: 0x32 (valid)
EDID block does NOT conform to EDID 1.3!
	sRGB is signaled, but the chromaticities do not match
