edid-decode (hex):

00 ff ff ff ff ff ff 00 06 af 77 20 00 00 00 00
01 12 01 03 90 21 15 78 0a 1c f5 97 58 50 8e 27
27 50 54 00 00 00 01 01 01 01 01 01 01 01 01 01
01 01 01 01 01 01 9e 25 a0 40 51 84 0c 30 40 20
33 00 4b cf 10 00 00 1a 9e 25 a0 40 51 84 0c 30
40 20 33 00 4b cf 10 00 00 1a 00 00 00 fe 00 4a
38 30 33 43 80 42 31 35 34 50 57 32 00 00 00 00
00 00 00 00 00 00 00 00 00 02 01 0a 20 20 00 bd

----------------

Block 0, Base EDID:
  EDID Structure Version & Revision: 1.3
  Vendor & Product Identification:
    Manufacturer: AUO
    Model: 8311
    Made in: week 1 of 2008
  Basic Display Parameters & Features:
    Digital display
    Maximum image size: 33 cm x 21 cm
    Gamma: 2.20
    RGB color display
    First detailed timing is the preferred timing
  Color Characteristics:
    Red  : 0.5898, 0.3447
    Green: 0.3154, 0.5546
    Blue : 0.1552, 0.1552
    White: 0.3134, 0.3291
  Established Timings I & II: none
  Standard Timings: none
  Detailed Timing Descriptors:
    DTD 1:  1440x900    59.995514 Hz  16:10    54.716 kHz     96.300000 MHz (331 mm x 207 mm)
                 Hfront   64 Hsync  32 Hback  224 Hpol P
                 Vfront    3 Vsync   3 Vback    6 Vpol N
    DTD 2:  1440x900    59.995514 Hz  16:10    54.716 kHz     96.300000 MHz (331 mm x 207 mm)
                 Hfront   64 Hsync  32 Hback  224 Hpol P
                 Vfront    3 Vsync   3 Vback    6 Vpol N
    Alphanumeric Data String: 'J803C'
    Manufacturer-Specified Display Descriptor (0x00): 00 00 00 00 00 00 00 00 00 00 00 02 01 0a 20 20 '..............  '
Checksum: 0xbd

----------------

Failures:

Block 0, Base EDID:
  Basic Display Parameters & Features: Digital Video Interface Standard set to reserved value 0x10.
  Alphanumeric Data String: Non-printable character.
  Missing Display Product Name.
  Missing Display Range Limits Descriptor.

EDID conformity: FAIL
