edid-decode (hex):

00 ff ff ff ff ff ff 00 04 72 d0 08 42 5f 21 24
2a 20 01 04 b5 46 27 78 3b ce d5 ad 51 44 a4 24
0e 50 54 bf ef 00 d1 c0 81 80 31 68 31 7c 45 68
45 7c 61 68 61 7c 56 5e 00 a0 a0 a0 29 50 30 20
35 00 ba 89 21 00 00 1e 00 00 00 ff 00 31 32 34
32 31 35 46 34 32 34 32 30 30 00 00 00 fc 00 58
56 33 32 32 51 55 20 4b 56 0a 20 20 00 00 00 fd
00 30 aa fa fa 42 01 0a 20 20 20 20 20 20 02 35

02 03 35 f1 4c 01 03 05 14 04 13 1f 12 02 11 90
3f 23 09 07 07 83 01 00 00 e2 00 d5 e3 05 c3 01
e6 06 05 01 62 62 1c 6d 1a 00 00 02 01 30 aa 00
0f 63 31 00 31 98 fc 00 6a a0 a0 1e 50 08 20 35
00 ba 89 21 00 00 1a 40 e7 00 6a a0 a0 67 50 08
20 98 04 ba 89 21 00 00 1a 6f c2 00 a0 a0 a0 55
50 30 20 35 00 ba 89 21 00 00 1e f0 3c 00 d0 51
a0 35 50 60 88 3a 00 ba 89 21 00 00 1c 00 00 f5

70 12 79 00 00 03 01 14 5a 04 01 84 ff 09 69 00
07 80 1f 00 9f 05 1d 00 02 00 04 00 00 00 00 00
00 00 00 00 00 00 00 00 00 00 00 00 00 00 00 00
00 00 00 00 00 00 00 00 00 00 00 00 00 00 00 00
00 00 00 00 00 00 00 00 00 00 00 00 00 00 00 00
00 00 00 00 00 00 00 00 00 00 00 00 00 00 00 00
00 00 00 00 00 00 00 00 00 00 00 00 00 00 00 00
00 00 00 00 00 00 00 00 00 00 00 00 00 00 9c 90

00 ff ff ff ff ff ff 00 04 72 d0 08 42 5f 21 24
2a 20 01 04 b5 46 27 78 3b ce d5 ad 51 44 a4 24
0e 50 54 bf ef 00 d1 c0 81 80 31 68 31 7c 45 68
45 7c 61 68 61 7c 56 5e 00 a0 a0 a0 29 50 30 20
35 00 ba 89 21 00 00 1e 00 00 00 ff 00 31 32 34
32 31 35 46 34 32 34 32 30 30 00 00 00 fc 00 58
56 33 32 32 51 55 20 4b 56 0a 20 20 00 00 00 fd
00 30 aa fa fa 42 01 0a 20 20 20 20 20 20 02 35

02 03 35 f1 4c 01 03 05 14 04 13 1f 12 02 11 90
3f 23 09 07 07 83 01 00 00 e2 00 d5 e3 05 c3 01
e6 06 05 01 62 62 1c 6d 1a 00 00 02 01 30 aa 00
0f 63 31 00 31 98 fc 00 6a a0 a0 1e 50 08 20 35
00 ba 89 21 00 00 1a 40 e7 00 6a a0 a0 67 50 08
20 98 04 ba 89 21 00 00 1a 6f c2 00 a0 a0 a0 55
50 30 20 35 00 ba 89 21 00 00 1e f0 3c 00 d0 51
a0 35 50 60 88 3a 00 ba 89 21 00 00 1c 00 00 f5

70 12 79 00 00 03 01 14 5a 04 01 84 ff 09 69 00
07 80 1f 00 9f 05 1d 00 02 00 04 00 00 00 00 00
00 00 00 00 00 00 00 00 00 00 00 00 00 00 00 00
00 00 00 00 00 00 00 00 00 00 00 00 00 00 00 00
00 00 00 00 00 00 00 00 00 00 00 00 00 00 00 00
00 00 00 00 00 00 00 00 00 00 00 00 00 00 00 00
00 00 00 00 00 00 00 00 00 00 00 00 00 00 00 00
00 00 00 00 00 00 00 00 00 00 00 00 00 00 9c 90

----------------

Block 0, Base EDID:
  EDID Structure Version & Revision: 1.4
  Vendor & Product Identification:
    Manufacturer: ACR
    Model: 2256
    Serial Number: ...
    Made in: week 42 of 2022
  Basic Display Parameters & Features:
    Digital display
    Bits per primary color channel: 10
    DisplayPort interface
    Maximum image size: 70 cm x 39 cm
    Gamma: 2.20
    DPMS levels: Off
    Supported color formats: RGB 4:4:4, YCrCb 4:4:4, YCrCb 4:2:2
    First detailed timing includes the native pixel format and preferred refresh rate
    Display is continuous frequency
  Color Characteristics:
    Red  : 0.6787, 0.3164
    Green: 0.2685, 0.6425
    Blue : 0.1435, 0.0556
    White: 0.3134, 0.3291
  Established Timings I & II:
    IBM     :   720x400    70.081663 Hz   9:5     31.467 kHz     28.320000 MHz
    DMT 0x04:   640x480    59.940476 Hz   4:3     31.469 kHz     25.175000 MHz
    Apple   :   640x480    66.666667 Hz   4:3     35.000 kHz     30.240000 MHz
    DMT 0x05:   640x480    72.808802 Hz   4:3     37.861 kHz     31.500000 MHz
    DMT 0x06:   640x480    75.000000 Hz   4:3     37.500 kHz     31.500000 MHz
    DMT 0x08:   800x600    56.250000 Hz   4:3     35.156 kHz     36.000000 MHz
    DMT 0x09:   800x600    60.316541 Hz   4:3     37.879 kHz     40.000000 MHz
    DMT 0x0a:   800x600    72.187572 Hz   4:3     48.077 kHz     50.000000 MHz
    DMT 0x0b:   800x600    75.000000 Hz   4:3     46.875 kHz     49.500000 MHz
    Apple   :   832x624    74.551266 Hz   4:3     49.726 kHz     57.284000 MHz
    DMT 0x10:  1024x768    60.003840 Hz   4:3     48.363 kHz     65.000000 MHz
    DMT 0x11:  1024x768    70.069359 Hz   4:3     56.476 kHz     75.000000 MHz
    DMT 0x12:  1024x768    75.028582 Hz   4:3     60.023 kHz     78.750000 MHz
    DMT 0x24:  1280x1024   75.024675 Hz   5:4     79.976 kHz    135.000000 MHz
  Standard Timings:
    DMT 0x52:  1920x1080   60.000000 Hz  16:9     67.500 kHz    148.500000 MHz
    DMT 0x23:  1280x1024   60.019740 Hz   5:4     63.981 kHz    108.000000 MHz
    GTF     :   640x480    99.999537 Hz   4:3     50.900 kHz     43.163000 MHz
    GTF     :   640x480   119.999084 Hz   4:3     61.800 kHz     52.406000 MHz
    GTF     :   800x600    99.999707 Hz   4:3     63.600 kHz     68.179000 MHz
    GTF     :   800x600   119.999886 Hz   4:3     77.160 kHz     83.950000 MHz
    GTF     :  1024x768   100.000177 Hz   4:3     81.400 kHz    113.309000 MHz
    GTF     :  1024x768   119.999931 Hz   4:3     98.760 kHz    139.054000 MHz
  Detailed Timing Descriptors:
    DTD 1:  2560x1440   59.950550 Hz  16:9     88.787 kHz    241.500000 MHz (698 mm x 393 mm)
                 Hfront   48 Hsync  32 Hback   80 Hpol P
                 Vfront    3 Vsync   5 Vback   33 Vpol P
    Display Product Serial Number: ...
    Display Product Name: 'XV322QU KV'
    Display Range Limits:
      Monitor ranges (Bare Limits): 48-170 Hz V, 250-250 kHz H, max dotclock 660 MHz
  Extension blocks: 2
Checksum: 0x35

----------------

Block 1, CTA-861 Extension Block:
  Revision: 3
  Underscans IT Video Formats by default
  Basic audio support
  Supports YCbCr 4:4:4
  Supports YCbCr 4:2:2
  Native detailed modes: 1
  Video Data Block:
    VIC   1:   640x480    59.940476 Hz   4:3     31.469 kHz     25.175000 MHz
    VIC   3:   720x480    59.940060 Hz  16:9     31.469 kHz     27.000000 MHz
    VIC   5:  1920x1080i  60.000000 Hz  16:9     33.750 kHz     74.250000 MHz
    VIC  20:  1920x1080i  50.000000 Hz  16:9     28.125 kHz     74.250000 MHz
    VIC   4:  1280x720    60.000000 Hz  16:9     45.000 kHz     74.250000 MHz
    VIC  19:  1280x720    50.000000 Hz  16:9     37.500 kHz     74.250000 MHz
    VIC  31:  1920x1080   50.000000 Hz  16:9     56.250 kHz    148.500000 MHz
    VIC  18:   720x576    50.000000 Hz  16:9     31.250 kHz     27.000000 MHz
    VIC   2:   720x480    59.940060 Hz   4:3     31.469 kHz     27.000000 MHz
    VIC  17:   720x576    50.000000 Hz   4:3     31.250 kHz     27.000000 MHz
    VIC  16:  1920x1080   60.000000 Hz  16:9     67.500 kHz    148.500000 MHz (native)
    VIC  63:  1920x1080  120.000000 Hz  16:9    135.000 kHz    297.000000 MHz
  Audio Data Block:
    Linear PCM:
      Max channels: 2
      Supported sample rates (kHz): 48 44.1 32
      Supported sample sizes (bits): 24 20 16
  Speaker Allocation Data Block:
    FL/FR - Front Left/Right
  Video Capability Data Block:
    YCbCr quantization: Selectable (via AVI YQ)
    RGB quantization: Selectable (via AVI Q)
    PT scan behavior: Always Overscanned
    IT scan behavior: Always Overscanned
    CE scan behavior: Always Overscanned
  Colorimetry Data Block:
    xvYCC601
    xvYCC709
    BT2020YCC
    BT2020RGB
    Gamut Boundary Description Metadata Profile P0
  HDR Static Metadata Data Block:
    Electro optical transfer functions:
      Traditional gamma - SDR luminance range
      SMPTE ST2084
    Supported static metadata descriptors:
      Static metadata type 1
    Desired content max luminance: 98 (417.710 cd/m^2)
    Desired content max frame-average luminance: 98 (417.710 cd/m^2)
    Desired content min luminance: 28 (0.050 cd/m^2)
  Vendor-Specific Data Block (AMD), OUI 00-00-1A:
    Version: 2.1
    Minimum Refresh Rate: 48 Hz
    Maximum Refresh Rate: 170 Hz
    Flags 1.x: 0x00
    Flags 2.x: 0x0f
    Maximum luminance: 99 (426.856 cd/m^2)
    Minimum luminance: 49 (0.158 cd/m^2)
    Maximum luminance (without local dimming): 0 (50.000 cd/m^2)
    Minimum luminance (without local dimming): 49 (0.018 cd/m^2)
  Detailed Timing Descriptors:
    DTD 2:  2560x1440  165.000434 Hz  16:9    242.551 kHz    646.640000 MHz (698 mm x 393 mm)
                 Hfront    8 Hsync  32 Hback   66 Hpol P
                 Vfront    3 Vsync   5 Vback   22 Vpol N
    DTD 3:  2560x1440  143.911545 Hz  16:9    222.056 kHz    592.000000 MHz (698 mm x 393 mm)
                 Hfront    8 Hsync  32 Hback   66 Hpol P
                 Vfront   25 Vsync   8 Vback   70 Vpol N
    DTD 4:  2560x1440  119.997589 Hz  16:9    182.996 kHz    497.750000 MHz (698 mm x 393 mm)
                 Hfront   48 Hsync  32 Hback   80 Hpol P
                 Vfront    3 Vsync   5 Vback   77 Vpol P
    DTD 5:  1280x1440   59.912620 Hz   8:9     89.450 kHz    156.000000 MHz (698 mm x 393 mm)
                 Hfront   96 Hsync 136 Hback  232 Hpol N
                 Vfront    3 Vsync  10 Vback   40 Vpol P
Checksum: 0xf5  Unused space in Extension Block: 2 bytes

----------------

Block 2, DisplayID Extension Block:
  Version: 1.2
  Extension Count: 0
  Display Product Type: Extension Section
  Video Timing Modes Type 1 - Detailed Timings Data Block:
    DTD:  2560x1440  170.070579 Hz  16:9    250.004 kHz    666.510000 MHz (aspect 16:9, no 3D stereo, preferred)
               Hfront    8 Hsync  32 Hback   66 Hpol P
               Vfront    3 Vsync   5 Vback   22 Vpol N
  Checksum: 0x9c
Checksum: 0x90

----------------

Block 3, Unknown EDID Extension Block 0x00:
  00 ff ff ff ff ff ff 00 04 72 d0 08 42 5f 21 24 '.........r..B_!$'
  2a 20 01 04 b5 46 27 78 3b ce d5 ad 51 44 a4 24 '* ...F'x;...QD.$'
  0e 50 54 bf ef 00 d1 c0 81 80 31 68 31 7c 45 68 '.PT.......1h1|Eh'
  45 7c 61 68 61 7c 56 5e 00 a0 a0 a0 29 50 30 20 'E|aha|V^....)P0 '
  35 00 ba 89 21 00 00 1e 00 00 00 ff 00 31 32 34 '5...!........124'
  32 31 35 46 34 32 34 32 30 30 00 00 00 fc 00 58 '215F424200.....X'
  56 33 32 32 51 55 20 4b 56 0a 20 20 00 00 00 fd 'V322QU KV.  ....'
  00 30 aa fa fa 42 01 0a 20 20 20 20 20 20 02 35 '.0...B..      .5'
Checksum: 0x35

----------------

Block 4, CTA-861 Extension Block:
  Revision: 3
  Underscans IT Video Formats by default
  Basic audio support
  Supports YCbCr 4:4:4
  Supports YCbCr 4:2:2
  Native detailed modes: 1
  Video Data Block:
    VIC   1:   640x480    59.940476 Hz   4:3     31.469 kHz     25.175000 MHz
    VIC   3:   720x480    59.940060 Hz  16:9     31.469 kHz     27.000000 MHz
    VIC   5:  1920x1080i  60.000000 Hz  16:9     33.750 kHz     74.250000 MHz
    VIC  20:  1920x1080i  50.000000 Hz  16:9     28.125 kHz     74.250000 MHz
    VIC   4:  1280x720    60.000000 Hz  16:9     45.000 kHz     74.250000 MHz
    VIC  19:  1280x720    50.000000 Hz  16:9     37.500 kHz     74.250000 MHz
    VIC  31:  1920x1080   50.000000 Hz  16:9     56.250 kHz    148.500000 MHz
    VIC  18:   720x576    50.000000 Hz  16:9     31.250 kHz     27.000000 MHz
    VIC   2:   720x480    59.940060 Hz   4:3     31.469 kHz     27.000000 MHz
    VIC  17:   720x576    50.000000 Hz   4:3     31.250 kHz     27.000000 MHz
    VIC  16:  1920x1080   60.000000 Hz  16:9     67.500 kHz    148.500000 MHz (native)
    VIC  63:  1920x1080  120.000000 Hz  16:9    135.000 kHz    297.000000 MHz
  Audio Data Block:
    Linear PCM:
      Max channels: 2
      Supported sample rates (kHz): 48 44.1 32
      Supported sample sizes (bits): 24 20 16
  Speaker Allocation Data Block:
    FL/FR - Front Left/Right
  Video Capability Data Block:
    YCbCr quantization: Selectable (via AVI YQ)
    RGB quantization: Selectable (via AVI Q)
    PT scan behavior: Always Overscanned
    IT scan behavior: Always Overscanned
    CE scan behavior: Always Overscanned
  Colorimetry Data Block:
    xvYCC601
    xvYCC709
    BT2020YCC
    BT2020RGB
    Gamut Boundary Description Metadata Profile P0
  HDR Static Metadata Data Block:
    Electro optical transfer functions:
      Traditional gamma - SDR luminance range
      SMPTE ST2084
    Supported static metadata descriptors:
      Static metadata type 1
    Desired content max luminance: 98 (417.710 cd/m^2)
    Desired content max frame-average luminance: 98 (417.710 cd/m^2)
    Desired content min luminance: 28 (0.050 cd/m^2)
  Vendor-Specific Data Block (AMD), OUI 00-00-1A:
    Version: 2.1
    Minimum Refresh Rate: 48 Hz
    Maximum Refresh Rate: 170 Hz
    Flags 1.x: 0x00
    Flags 2.x: 0x0f
    Maximum luminance: 99 (426.856 cd/m^2)
    Minimum luminance: 49 (0.158 cd/m^2)
    Maximum luminance (without local dimming): 0 (50.000 cd/m^2)
    Minimum luminance (without local dimming): 49 (0.018 cd/m^2)
  Detailed Timing Descriptors:
    DTD 6:  2560x1440  165.000434 Hz  16:9    242.551 kHz    646.640000 MHz (698 mm x 393 mm)
                 Hfront    8 Hsync  32 Hback   66 Hpol P
                 Vfront    3 Vsync   5 Vback   22 Vpol N
    DTD 7:  2560x1440  143.911545 Hz  16:9    222.056 kHz    592.000000 MHz (698 mm x 393 mm)
                 Hfront    8 Hsync  32 Hback   66 Hpol P
                 Vfront   25 Vsync   8 Vback   70 Vpol N
    DTD 8:  2560x1440  119.997589 Hz  16:9    182.996 kHz    497.750000 MHz (698 mm x 393 mm)
                 Hfront   48 Hsync  32 Hback   80 Hpol P
                 Vfront    3 Vsync   5 Vback   77 Vpol P
    DTD 9:  1280x1440   59.912620 Hz   8:9     89.450 kHz    156.000000 MHz (698 mm x 393 mm)
                 Hfront   96 Hsync 136 Hback  232 Hpol N
                 Vfront    3 Vsync  10 Vback   40 Vpol P
Checksum: 0xf5  Unused space in Extension Block: 2 bytes

----------------

Block 5, DisplayID Extension Block:
  Version: 1.2
  Extension Count: 0
  Video Timing Modes Type 1 - Detailed Timings Data Block:
    DTD:  2560x1440  170.070579 Hz  16:9    250.004 kHz    666.510000 MHz (aspect 16:9, no 3D stereo, preferred)
               Hfront    8 Hsync  32 Hback   66 Hpol P
               Vfront    3 Vsync   5 Vback   22 Vpol N
  Checksum: 0x9c
Checksum: 0x90

----------------

Warnings:

Block 1, CTA-861 Extension Block:
  Video Capability Data Block: IT scan behavior is expected to support underscanned.
  Video Capability Data Block: S_PT is equal to S_IT and S_CE, so should be set to 0 instead.
  Colorimetry Data Block: Set the sRGB colorimetry bit to avoid interop issues.
  Display Product Serial Number is set, so the Serial Number in the Base EDID should be 0.
Block 4, CTA-861 Extension Block:
  Video Capability Data Block: IT scan behavior is expected to support underscanned.
  Video Capability Data Block: S_PT is equal to S_IT and S_CE, so should be set to 0 instead.
  Colorimetry Data Block: Set the sRGB colorimetry bit to avoid interop issues.
  Display Product Serial Number is set, so the Serial Number in the Base EDID should be 0.
EDID:
  Base EDID: Some timings are out of range of the Monitor Ranges:
    Horizontal Freq: 28.125 - 250.003 kHz (Monitor: 250.000 - 250.000 kHz)
    Maximum Clock: 666.510 MHz (Monitor: 660.000 MHz)

Failures:

Block 1, CTA-861 Extension Block:
  Video Capability Data Block: IT video formats are always overscanned, but bit 7 of Byte 3 of the CTA-861 Extension header is set to underscanned.
Block 2, DisplayID Extension Block:
  DisplayID Base Block has no product type.
  Expected 0 DisplayID Extension Block, but got 1.
Block 3, Base EDID:
  Unknown Extension Block.
Block 4, CTA-861 Extension Block:
  Video Data Block: Duplicate VIC 1.
  Video Data Block: Duplicate VIC 3.
  Video Data Block: Duplicate VIC 5.
  Video Data Block: Duplicate VIC 20.
  Video Data Block: Duplicate VIC 4.
  Video Data Block: Duplicate VIC 19.
  Video Data Block: Duplicate VIC 31.
  Video Data Block: Duplicate VIC 18.
  Video Data Block: Duplicate VIC 2.
  Video Data Block: Duplicate VIC 17.
  Video Data Block: Duplicate VIC 16.
  Video Data Block: Duplicate VIC 63.
  Speaker Allocation Data Block: Only one instance of this Data Block is allowed.
  Video Capability Data Block: Only one instance of this Data Block is allowed.
  Video Capability Data Block: IT video formats are always overscanned, but bit 7 of Byte 3 of the CTA-861 Extension header is set to underscanned.
  Colorimetry Data Block: Only one instance of this Data Block is allowed.
  HDR Static Metadata Data Block: Only one instance of this Data Block is allowed.
EDID:
  Base EDID: EDID specified 2 extension block(s), but found 5 extension block(s).
  CTA-861: Native progressive timings are a mix of several resolutions.
  DisplayID: Missing DisplayID Product Identification Data Block.

EDID conformity: FAIL
