edid-decode (hex):

00 ff ff ff ff ff ff 00 09 e5 c6 0c 00 00 00 00
01 22 01 04 a5 22 16 78 03 fc 65 96 5d 58 95 29
1e 50 54 00 00 00 01 01 01 01 01 01 01 01 01 01
01 01 01 01 01 01 61 40 80 04 71 b0 3c 40 30 20
36 00 59 d7 10 00 00 1a 81 33 80 04 71 b0 3c 40
30 20 36 00 59 d7 10 00 00 1a 00 00 00 fe 00 58
35 50 4a 46 80 4e 56 31 36 4e 34 42 00 00 00 00
00 01 41 31 9e 00 00 00 00 0a 01 0a 20 20 00 13

00 ff ff ff ff ff ff 00 09 e5 c6 0c 00 00 00 00
01 22 01 04 a5 22 16 78 03 fc 65 96 5d 58 95 29
1e 50 54 00 00 00 01 01 01 01 01 01 01 01 01 01
01 01 01 01 01 01 61 40 80 04 71 b0 3c 40 30 20
36 00 59 d7 10 00 00 1a 81 33 80 04 71 b0 3c 40
30 20 36 00 59 d7 10 00 00 1a 00 00 00 fe 00 58
35 50 4a 46 80 4e 56 31 36 4e 34 42 00 00 00 00
00 01 41 31 9e 00 00 00 00 0a 01 0a 20 20 00 13

----------------

Block 0, Base EDID:
  EDID Structure Version & Revision: 1.4
  Vendor & Product Identification:
    Manufacturer: BOE
    Model: 3270
    Made in: week 1 of 2024
  Basic Display Parameters & Features:
    Digital display
    Bits per primary color channel: 8
    DisplayPort interface
    Maximum image size: 34 cm x 22 cm
    Gamma: 2.20
    Supported color formats: RGB 4:4:4
    First detailed timing includes the native pixel format and preferred refresh rate
    Display is continuous frequency
  Color Characteristics:
    Red  : 0.5888, 0.3662
    Green: 0.3466, 0.5820
    Blue : 0.1611, 0.1191
    White: 0.3134, 0.3291
  Established Timings I & II: none
  Standard Timings: none
  Detailed Timing Descriptors:
    DTD 1:  1920x1200   60.000728 Hz  16:10    75.601 kHz    164.810000 MHz (345 mm x 215 mm)
                 Hfront   48 Hsync  32 Hback  180 Hpol P
                 Vfront    3 Vsync   6 Vback   51 Vpol N
    DTD 2:  1920x1200   48.001311 Hz  16:10    60.482 kHz    131.850000 MHz (345 mm x 215 mm)
                 Hfront   48 Hsync  32 Hback  180 Hpol P
                 Vfront    3 Vsync   6 Vback   51 Vpol N
    Alphanumeric Data String: 'X5PJF'
    Manufacturer-Specified Display Descriptor (0x00): 00 00 00 01 41 31 9e 00 00 00 00 0a 01 0a 20 20 '....A1........  '
Checksum: 0x13

----------------

Block 1, Unknown EDID Extension Block 0x00:
  00 ff ff ff ff ff ff 00 09 e5 c6 0c 00 00 00 00 '................'
  01 22 01 04 a5 22 16 78 03 fc 65 96 5d 58 95 29 '."...".x..e.]X.)'
  1e 50 54 00 00 00 01 01 01 01 01 01 01 01 01 01 '.PT.............'
  01 01 01 01 01 01 61 40 80 04 71 b0 3c 40 30 20 '......a@..q.<@0 '
  36 00 59 d7 10 00 00 1a 81 33 80 04 71 b0 3c 40 '6.Y......3..q.<@'
  30 20 36 00 59 d7 10 00 00 1a 00 00 00 fe 00 58 '0 6.Y..........X'
  35 50 4a 46 80 4e 56 31 36 4e 34 42 00 00 00 00 '5PJF.NV16N4B....'
  00 01 41 31 9e 00 00 00 00 0a 01 0a 20 20 00 13 '..A1........  ..'
Checksum: 0x13

----------------

Warnings:

Block 0, Base EDID:
  Missing Display Product Name.

Failures:

Block 0, Base EDID:
  Alphanumeric Data String: Non-printable character.
  Missing Display Range Limits Descriptor.
Block 1, Base EDID:
  Unknown Extension Block.
EDID:
  Base EDID: EDID specified 0 extension block(s), but found 1 extension block(s).

EDID conformity: FAIL
