edid-decode (hex):

00 ff ff ff ff ff ff 00 52 62 00 02 00 00 00 00
2d 14 01 03 80 35 1e ff 2a ba 45 a1 59 55 9d 28
0d 50 54 23 08 00 81 80 01 01 01 01 01 01 01 01
01 01 01 01 01 01 0e 1f 00 80 51 00 1e 30 40 80
37 00 99 e6 10 00 00 1c 66 21 50 b0 51 00 1b 30
40 70 36 00 99 e6 10 00 00 1e 00 00 00 fc 00 54
4f 53 48 49 42 41 2d 54 56 0a 20 20 00 00 00 fd
00 37 3d 1f 31 0b 00 0a 20 20 20 20 20 20 01 af

02 03 1f 71 4a 10 22 20 05 04 03 02 01 07 06 23
09 07 07 83 01 00 00 67 03 0c 00 10 00 00 1e 02
3a 80 18 71 38 2d 40 58 2c 45 00 13 2a 21 00 00
1e fa 1c 80 3e 73 38 2d 40 7e 2c 45 80 13 2a 21
00 00 1e 01 1d 00 72 51 d0 1e 20 6e 28 55 00 13
2a 21 00 00 1e 00 00 00 00 00 00 00 00 00 00 00
00 00 00 00 00 00 00 00 00 00 00 00 00 00 00 00
00 00 00 00 00 00 00 00 00 00 00 00 00 00 00 f5

----------------

Block 0, Base EDID:
  EDID Structure Version & Revision: 1.3
  Vendor & Product Identification:
    Manufacturer: TSB
    Model: 512
    Made in: week 45 of 2010
  Basic Display Parameters & Features:
    Digital display
    Maximum image size: 53 cm x 30 cm
    Gamma: 1.0
    DPMS levels: Off
    RGB color display
    First detailed timing is preferred timing
  Color Characteristics:
    Red  : 0.6308, 0.3505
    Green: 0.3339, 0.6152
    Blue : 0.1572, 0.0507
    White: 0.3134, 0.3291
  Established Timings I & II:
    DMT 0x04:   640x480    59.940 Hz   4:3    31.469 kHz  25.175 MHz
    DMT 0x08:   800x600    56.250 Hz   4:3    35.156 kHz  36.000 MHz
    DMT 0x09:   800x600    60.317 Hz   4:3    37.879 kHz  40.000 MHz
    DMT 0x10:  1024x768    60.004 Hz   4:3    48.363 kHz  65.000 MHz
  Standard Timings:
    DMT 0x23:  1280x1024   60.020 Hz   5:4    63.981 kHz 108.000 MHz
  Detailed Timing Descriptors:
    DTD 1:  1280x768    59.870 Hz   5:3    47.776 kHz  79.500 MHz (409 mm x 230 mm)
                 Hfront   64 Hsync 128 Hback 192 Hpol N
                 Vfront    3 Vsync   7 Vback  20 Vpol P
    DTD 2:  1360x768    60.015 Hz  85:48   47.712 kHz  85.500 MHz (409 mm x 230 mm)
                 Hfront   64 Hsync 112 Hback 256 Hpol P
                 Vfront    3 Vsync   6 Vback  18 Vpol P
    Display Product Name: 'TOSHIBA-TV'
  Display Range Limits:
    Monitor ranges (GTF): 55-61 Hz V, 31-49 kHz H, max dotclock 110 MHz
  Extension blocks: 1
Checksum: 0xaf

----------------

Block 1, CTA-861 Extension Block:
  Revision: 3
  Basic audio support
  Supports YCbCr 4:4:4
  Supports YCbCr 4:2:2
  Native detailed modes: 1
  Video Data Block:
    VIC  16:  1920x1080   60.000 Hz  16:9    67.500 kHz 148.500 MHz
    VIC  34:  1920x1080   30.000 Hz  16:9    33.750 kHz  74.250 MHz
    VIC  32:  1920x1080   24.000 Hz  16:9    27.000 kHz  74.250 MHz
    VIC   5:  1920x1080i  60.000 Hz  16:9    33.750 kHz  74.250 MHz
    VIC   4:  1280x720    60.000 Hz  16:9    45.000 kHz  74.250 MHz
    VIC   3:   720x480    59.940 Hz  16:9    31.469 kHz  27.000 MHz
    VIC   2:   720x480    59.940 Hz   4:3    31.469 kHz  27.000 MHz
    VIC   1:   640x480    59.940 Hz   4:3    31.469 kHz  25.175 MHz
    VIC   7:  1440x480i   59.940 Hz  16:9    15.734 kHz  27.000 MHz
    VIC   6:  1440x480i   59.940 Hz   4:3    15.734 kHz  27.000 MHz
  Audio Data Block:
    Linear PCM:
      Max channels: 2
      Supported sample rates (kHz): 48 44.1 32
      Supported sample sizes (bits): 24 20 16
  Speaker Allocation Data Block:
    FL/FR - Front Left/Right
  Vendor-Specific Data Block (HDMI), OUI 00-0C-03:
    Source physical address: 1.0.0.0
    Maximum TMDS clock: 150 MHz
  Detailed Timing Descriptors:
    DTD 3:  1920x1080   60.000 Hz  16:9    67.500 kHz 148.500 MHz (531 mm x 298 mm)
                 Hfront   88 Hsync  44 Hback 148 Hpol P
                 Vfront    4 Vsync   5 Vback  36 Vpol P
    DTD 4:  1920x1080   23.977 Hz  16:9    26.975 kHz  74.180 MHz (531 mm x 298 mm)
                 Hfront  638 Hsync  44 Hback 148 Hpol P
                 Vfront    4 Vsync   5 Vback  36 Vpol P
    DTD 5:  1280x720    60.000 Hz  16:9    45.000 kHz  74.250 MHz (531 mm x 298 mm)
                 Hfront  110 Hsync  40 Hback 220 Hpol P
                 Vfront    5 Vsync   5 Vback  20 Vpol P
Checksum: 0xf5

----------------

Failures:

Block 0, Base EDID:
  Detailed Timing Descriptor #1: Mismatch of image size 409x230 mm vs display size 530x300 mm.
  Detailed Timing Descriptor #2: Mismatch of image size 409x230 mm vs display size 530x300 mm.
All Blocks:
  Some timings are out of range of the Monitor Ranges:
    Vertical Freq: 23.977 - 60.317 Hz (Monitor: 55.000 - 61.000 Hz)
    Horizontal Freq: 15.734 - 67.500 kHz (Monitor: 31.000 - 49.000 kHz)
    Maximum Clock: 148.500 MHz (Monitor: 110.000 MHz)

EDID conformity: FAIL
