
EDID (hex):
00ffffffffffff00220e4b3501000000
111d0103803c22782a1e50a756519c26
115054a10800d1c0a9c081c0b3009500
810081800101023a801871382d40582c
450056502100001e000000fd00304b1e
5612000a202020202020000000fc0048
5020323766770a2020202020000000ff
0033434d393137304b594a20202001da
020320b149901f041303120102116503
0c002000681a00000101304bede2002b
023a801871382d40582c450056502100
001e2a4480a070382740302035005650
2100001a011d007251d01e206e285500
56502100001e011d00bc52d01e20b828
554056502100001e8c0ad08a20e02d10
103e9600565021000018000000000087

edid-decode (hex):

00 ff ff ff ff ff ff 00 22 0e 4b 35 01 00 00 00
11 1d 01 03 80 3c 22 78 2a 1e 50 a7 56 51 9c 26
11 50 54 a1 08 00 d1 c0 a9 c0 81 c0 b3 00 95 00
81 00 81 80 01 01 02 3a 80 18 71 38 2d 40 58 2c
45 00 56 50 21 00 00 1e 00 00 00 fd 00 30 4b 1e
56 12 00 0a 20 20 20 20 20 20 00 00 00 fc 00 48
50 20 32 37 66 77 0a 20 20 20 20 20 00 00 00 ff
00 33 43 4d 39 31 37 30 4b 59 4a 20 20 20 01 da

02 03 20 b1 49 90 1f 04 13 03 12 01 02 11 65 03
0c 00 20 00 68 1a 00 00 01 01 30 4b ed e2 00 2b
02 3a 80 18 71 38 2d 40 58 2c 45 00 56 50 21 00
00 1e 2a 44 80 a0 70 38 27 40 30 20 35 00 56 50
21 00 00 1a 01 1d 00 72 51 d0 1e 20 6e 28 55 00
56 50 21 00 00 1e 01 1d 00 bc 52 d0 1e 20 b8 28
55 40 56 50 21 00 00 1e 8c 0a d0 8a 20 e0 2d 10
10 3e 96 00 56 50 21 00 00 18 00 00 00 00 00 87

----------------

Block 0, Base EDID:
  EDID Structure Version & Revision: 1.3
  Vendor & Product Identification:
    Manufacturer: HPN
    Model: 13643
    Serial Number: 1
    Made in: week 17 of 2019
  Basic Display Parameters & Features:
    Digital display
    Maximum image size: 60 cm x 34 cm
    Gamma: 2.20
    DPMS levels: Off
    RGB color display
    First detailed timing is the preferred timing
  Color Characteristics:
    Red  : 0.6523, 0.3369
    Green: 0.3193, 0.6113
    Blue : 0.1494, 0.0673
    White: 0.3125, 0.3281
  Established Timings I & II:
    IBM     :   720x400    70.081663 Hz   9:5     31.467 kHz     28.320000 MHz
    DMT 0x04:   640x480    59.940476 Hz   4:3     31.469 kHz     25.175000 MHz
    DMT 0x09:   800x600    60.316541 Hz   4:3     37.879 kHz     40.000000 MHz
    DMT 0x10:  1024x768    60.003840 Hz   4:3     48.363 kHz     65.000000 MHz
  Standard Timings:
    DMT 0x52:  1920x1080   60.000000 Hz  16:9     67.500 kHz    148.500000 MHz
    DMT 0x53:  1600x900    60.000000 Hz  16:9     60.000 kHz    108.000000 MHz (RB)
    DMT 0x55:  1280x720    60.000000 Hz  16:9     45.000 kHz     74.250000 MHz
    DMT 0x3a:  1680x1050   59.954250 Hz  16:10    65.290 kHz    146.250000 MHz
    DMT 0x2f:  1440x900    59.887445 Hz  16:10    55.935 kHz    106.500000 MHz
    DMT 0x1c:  1280x800    59.810326 Hz  16:10    49.702 kHz     83.500000 MHz
    DMT 0x23:  1280x1024   60.019740 Hz   5:4     63.981 kHz    108.000000 MHz
  Detailed Timing Descriptors:
    DTD 1:  1920x1080   60.000000 Hz  16:9     67.500 kHz    148.500000 MHz (598 mm x 336 mm)
                 Hfront   88 Hsync  44 Hback  148 Hpol P
                 Vfront    4 Vsync   5 Vback   36 Vpol P
    Display Range Limits:
      Monitor ranges (GTF): 48-75 Hz V, 30-86 kHz H, max dotclock 180 MHz
    Display Product Name: 'HP 27fw'
    Display Product Serial Number: '3CM9170KYJ   '
  Extension blocks: 1
Checksum: 0xda

----------------

Block 1, CTA-861 Extension Block:
  Revision: 3
  Underscans IT Video Formats by default
  Supports YCbCr 4:4:4
  Supports YCbCr 4:2:2
  Native detailed modes: 1
  Video Data Block:
    VIC  16:  1920x1080   60.000000 Hz  16:9     67.500 kHz    148.500000 MHz (native)
    VIC  31:  1920x1080   50.000000 Hz  16:9     56.250 kHz    148.500000 MHz
    VIC   4:  1280x720    60.000000 Hz  16:9     45.000 kHz     74.250000 MHz
    VIC  19:  1280x720    50.000000 Hz  16:9     37.500 kHz     74.250000 MHz
    VIC   3:   720x480    59.940060 Hz  16:9     31.469 kHz     27.000000 MHz
    VIC  18:   720x576    50.000000 Hz  16:9     31.250 kHz     27.000000 MHz
    VIC   1:   640x480    59.940476 Hz   4:3     31.469 kHz     25.175000 MHz
    VIC   2:   720x480    59.940060 Hz   4:3     31.469 kHz     27.000000 MHz
    VIC  17:   720x576    50.000000 Hz   4:3     31.250 kHz     27.000000 MHz
  Vendor-Specific Data Block (HDMI), OUI 00-0C-03:
    Source physical address: 2.0.0.0
  Vendor-Specific Data Block (AMD), OUI 00-00-1A:
    Version: 1.1
    Minimum Refresh Rate: 48 Hz
    Maximum Refresh Rate: 75 Hz
    Flags 1.x: 0xed (MCCS)
  Video Capability Data Block:
    YCbCr quantization: No Data
    RGB quantization: No Data
    PT scan behavior: Always Underscanned
    IT scan behavior: Always Underscanned
    CE scan behavior: Supports both over- and underscan
  Detailed Timing Descriptors:
    DTD 2:  1920x1080   60.000000 Hz  16:9     67.500 kHz    148.500000 MHz (598 mm x 336 mm)
                 Hfront   88 Hsync  44 Hback  148 Hpol P
                 Vfront    4 Vsync   5 Vback   36 Vpol P
    DTD 3:  1920x1080   74.972503 Hz  16:9     83.894 kHz    174.500000 MHz (598 mm x 336 mm)
                 Hfront   48 Hsync  32 Hback   80 Hpol P
                 Vfront    3 Vsync   5 Vback   31 Vpol N
    DTD 4:  1280x720    60.000000 Hz  16:9     45.000 kHz     74.250000 MHz (598 mm x 336 mm)
                 Hfront  110 Hsync  40 Hback  220 Hpol P
                 Vfront    5 Vsync   5 Vback   20 Vpol P
    DTD 5:  1280x720    50.000000 Hz  16:9     37.500 kHz     74.250000 MHz (598 mm x 336 mm)
                 Hfront  440 Hsync  40 Hback  220 Hpol P
                 Vfront    5 Vsync   5 Vback   20 Vpol P
    DTD 6:   720x480    59.940060 Hz   3:2     31.469 kHz     27.000000 MHz (598 mm x 336 mm)
                 Hfront   16 Hsync  62 Hback   60 Hpol N
                 Vfront    9 Vsync   6 Vback   30 Vpol N
Checksum: 0x87  Unused space in Extension Block: 5 bytes
