edid-decode (hex):

00 ff ff ff ff ff ff 00 06 af d4 18 00 00 00 00
23 17 01 04 a0 16 0e 78 02 99 85 95 55 56 92 28
22 50 54 00 00 00 01 01 01 01 01 01 01 01 01 01
01 01 01 01 01 01 de 1c 00 c8 50 20 20 30 93 20
44 00 d8 87 00 00 00 18 3f 13 00 c8 50 20 20 30
93 20 44 00 d8 87 00 00 00 18 00 00 00 00 00 00
00 00 00 00 00 00 00 00 00 00 00 00 00 00 00 02
00 10 3f ff 0f 3c 7d 19 14 0c 7d 20 20 20 00 94

----------------

Block 0, Base EDID:
  EDID Structure Version & Revision: 1.4
  Vendor & Product Identification:
    Manufacturer: AUO
    Model: 6356
    Made in: week 35 of 2013
  Basic Display Parameters & Features:
    Digital display
    Bits per primary color channel: 8
    Digital interface is not defined
    Maximum image size: 22 cm x 14 cm
    Gamma: 2.20
    Supported color formats: RGB 4:4:4
    First detailed timing includes the native pixel format and preferred refresh rate
  Color Characteristics:
    Red  : 0.5839, 0.3330
    Green: 0.3378, 0.5712
    Blue : 0.1582, 0.1328
    White: 0.3134, 0.3291
  Established Timings I & II: none
  Standard Timings: none
  Detailed Timing Descriptors:
    DTD 1:  1280x800    60.014943 Hz  16:10    49.932 kHz     73.900000 MHz (216 mm x 135 mm)
                 Hfront  147 Hsync  32 Hback   21 Hpol N
                 Vfront    4 Vsync   4 Vback   24 Vpol N
    DTD 2:  1280x800    40.012669 Hz  16:10    33.291 kHz     49.270000 MHz (216 mm x 135 mm)
                 Hfront  147 Hsync  32 Hback   21 Hpol N
                 Vfront    4 Vsync   4 Vback   24 Vpol N
    Empty Descriptor
    Manufacturer-Specified Display Descriptor (0x02): 00 02 00 10 3f ff 0f 3c 7d 19 14 0c 7d 20 20 20 '....?..<}...}   '
Checksum: 0x94

----------------

Warnings:

Block 0, Base EDID:
  Missing Display Product Name.

Failures:

Block 0, Base EDID:
  Empty Descriptor: Use Dummy Descriptor instead of all zeroes.

EDID conformity: FAIL
