
EDID (hex):
00ffffffffffff0030e46d0400000000
00180104951f1178eadc95a35855a026
0d505400000001010101010101010101
0101010101012e3680a070381f403020
350035ae1000001a522b80a070381f40
3020350035ae1000001a000000fe0032
31314830803134305746330a00000000
000041319e001000000a010a20200034

Extracted contents:
header:          00 ff ff ff ff ff ff 00
serial number:   30 e4 6d 04 00 00 00 00 00 18
version:         01 04
basic params:    95 1f 11 78 ea
chroma info:     dc 95 a3 58 55 a0 26 0d 50 54
established:     00 00 00
standard:        01 01 01 01 01 01 01 01 01 01 01 01 01 01 01 01
descriptor 1:    2e 36 80 a0 70 38 1f 40 30 20 35 00 35 ae 10 00 00 1a
descriptor 2:    52 2b 80 a0 70 38 1f 40 30 20 35 00 35 ae 10 00 00 1a
descriptor 3:    00 00 00 fe 00 32 31 31 48 30 80 31 34 30 57 46 33 0a
descriptor 4:    00 00 00 00 00 00 41 31 9e 00 10 00 00 0a 01 0a 20 20
extensions:      00
checksum:        34

EDID version: 1.4
Manufacturer: LGD Model 46d Serial Number --
Made in year 2014
Digital display
6 bits per primary color channel
DisplayPort interface
Maximum image size: 31 cm x 17 cm
Gamma: 2.20
DPMS levels: Standby Suspend Off
Supported color formats: RGB 4:4:4, YCrCb 4:4:4
First detailed timing includes the native pixel format and preferred refresh rate
Display x,y Chromaticity:
  Red:   0.6396, 0.3447
  Green: 0.3349, 0.6250
  Blue:  0.1503, 0.0517
  White: 0.3134, 0.3291
Established timings supported:
Standard timings supported:
Detailed mode: Clock 138.700 MHz, 309 mm x 174 mm
               1920 1968 2000 2080 hborder 0
               1080 1083 1088 1111 vborder 0
               +hsync -vsync 
               VertFreq: 60 Hz, HorFreq: 66682 Hz
Detailed mode: Clock 110.900 MHz, 309 mm x 174 mm
               1920 1968 2000 2080 hborder 0
               1080 1083 1088 1111 vborder 0
               +hsync -vsync 
               VertFreq: 47 Hz, HorFreq: 53317 Hz
ASCII string: 211H0
Manufacturer-specified data, tag 0
Checksum: 0x34 (valid)
EDID block does NOT conform to EDID 1.4!
	Missing name descriptor
	Missing monitor ranges
	Detailed block string not properly terminated
