edid-decode (hex):

00 ff ff ff ff ff ff 00 4c a3 42 47 00 00 00 00
00 14 01 03 80 17 0e 78 0a b8 55 94 58 54 92 2a
1c 50 54 00 00 00 01 01 01 01 01 01 01 01 01 01
01 01 01 01 01 01 12 1b 56 72 50 00 0c 30 30 20
25 00 df 7d 00 00 00 19 00 00 00 0f 00 00 00 00
00 00 00 00 00 1e b4 02 74 00 00 00 00 fe 00 53
41 4d 53 55 4e 47 0a 20 20 20 20 20 00 00 00 fe
00 31 30 31 41 54 30 33 2d 37 30 31 0a 20 00 77

00 ff ff ff ff ff ff 00 4c a3 42 47 00 00 00 00
00 14 01 03 80 17 0e 78 0a b8 55 94 58 54 92 2a
1c 50 54 00 00 00 01 01 01 01 01 01 01 01 01 01
01 01 01 01 01 01 12 1b 56 72 50 00 0c 30 30 20
25 00 df 7d 00 00 00 19 00 00 00 0f 00 00 00 00
00 00 00 00 00 1e b4 02 74 00 00 00 00 fe 00 53
41 4d 53 55 4e 47 0a 20 20 20 20 20 00 00 00 fe
00 31 30 31 41 54 30 33 2d 37 30 31 0a 20 00 77

----------------

Block 0, Base EDID:
  EDID Structure Version & Revision: 1.3
  Vendor & Product Identification:
    Manufacturer: SEC
    Model: 18242
    Made in: 2010
  Basic Display Parameters & Features:
    Digital display
    Maximum image size: 23 cm x 14 cm
    Gamma: 2.20
    RGB color display
    First detailed timing is the preferred timing
  Color Characteristics:
    Red  : 0.5800, 0.3466
    Green: 0.3300, 0.5703
    Blue : 0.1650, 0.1103
    White: 0.3134, 0.3291
  Established Timings I & II: none
  Standard Timings: none
  Detailed Timing Descriptors:
    DTD 1:  1366x768    60.031185 Hz 683:384   46.824 kHz     69.300000 MHz (223 mm x 125 mm)
                 Hfront   48 Hsync  32 Hback   34 Hpol N
                 Vfront    2 Vsync   5 Vback    5 Vpol N
    Manufacturer-Specified Display Descriptor (0x0f): 00 0f 00 00 00 00 00 00 00 00 00 1e b4 02 74 00 '..............t.'
    Alphanumeric Data String: 'SAMSUNG'
    Alphanumeric Data String: '101AT03-701'
Checksum: 0x77

----------------

Block 1, Unknown EDID Extension Block 0x00:
  00 ff ff ff ff ff ff 00 4c a3 42 47 00 00 00 00 '........L.BG....'
  00 14 01 03 80 17 0e 78 0a b8 55 94 58 54 92 2a '.......x..U.XT.*'
  1c 50 54 00 00 00 01 01 01 01 01 01 01 01 01 01 '.PT.............'
  01 01 01 01 01 01 12 1b 56 72 50 00 0c 30 30 20 '........VrP..00 '
  25 00 df 7d 00 00 00 19 00 00 00 0f 00 00 00 00 '%..}............'
  00 00 00 00 00 1e b4 02 74 00 00 00 00 fe 00 53 '........t......S'
  41 4d 53 55 4e 47 0a 20 20 20 20 20 00 00 00 fe 'AMSUNG.     ....'
  00 31 30 31 41 54 30 33 2d 37 30 31 0a 20 00 77 '.101AT03-701. .w'
Checksum: 0x77

----------------

Failures:

Block 0, Base EDID:
  Missing Display Product Name.
  Missing Display Range Limits Descriptor.
Block 1, Base EDID:
  Unknown Extension Block.
EDID:
  Base EDID: EDID specified 0 extension block(s), but found 1 extension block(s).

EDID conformity: FAIL
