
EDID (hex):
00ffffffffffff0051f3915000000000
0e100103801f1178cae3f59059579027
1e505400000001010101010101010101
010101010101301c56a0500012303020
350035ae10000018000000fd003b3d2e
3008000a202020202020000000fc0049
6e7465726e616c204c43440a000000fe
00544f53484942410a2020202020003b

Extracted contents:
header:          00 ff ff ff ff ff ff 00
serial number:   51 f3 91 50 00 00 00 00 0e 10
version:         01 03
basic params:    80 1f 11 78 ca
chroma info:     e3 f5 90 59 57 90 27 1e 50 54
established:     00 00 00
standard:        01 01 01 01 01 01 01 01 01 01 01 01 01 01 01 01
descriptor 1:    30 1c 56 a0 50 00 12 30 30 20 35 00 35 ae 10 00 00 18
descriptor 2:    00 00 00 fd 00 3b 3d 2e 30 08 00 0a 20 20 20 20 20 20
descriptor 3:    00 00 00 fc 00 49 6e 74 65 72 6e 61 6c 20 4c 43 44 0a
descriptor 4:    00 00 00 fe 00 54 4f 53 48 49 42 41 0a 20 20 20 20 20
extensions:      00
checksum:        3b

EDID version: 1.3
Manufacturer: TOS Model 5091 Serial Number --
Made in week 14 of 2006
Digital display
Maximum image size: 31 cm x 17 cm
Gamma: 2.20
DPMS levels: Standby Suspend
RGB color display
First detailed timing is preferred timing
Display x,y Chromaticity:
  Red:   0.5654, 0.3496
  Green: 0.3398, 0.5654
  Blue:  0.1552, 0.1201
  White: 0.3134, 0.3291
Established timings supported:
Standard timings supported:
Detailed mode: Clock 72.160 MHz, 309 mm x 174 mm
               1366 1414 1446 1526 hborder 0
                768  771  776  786 vborder 0
               -hsync -vsync 
               VertFreq: 60 Hz, HorFreq: 47287 Hz
Monitor ranges (GTF): 59-61Hz V, 46-48kHz H, max dotclock 80MHz
Monitor name: Internal LCD
ASCII string: TOSHIBA
Checksum: 0x3b (valid)
