edid-decode (hex):

00 ff ff ff ff ff ff 00 51 f3 91 50 00 00 00 00
0e 10 01 03 80 22 13 78 ca 50 25 93 58 57 92 29
22 50 54 00 00 00 01 01 01 01 01 01 01 01 01 01
01 01 01 01 01 01 54 1c 56 a0 50 00 16 30 30 20
35 00 58 c1 10 00 00 18 00 00 00 fd 00 3b 3d 2e
30 08 00 0a 20 20 20 20 20 20 00 00 00 fc 00 49
6e 74 65 72 6e 61 6c 20 4c 43 44 0a 00 00 00 fe
00 54 4f 53 48 49 42 41 0a 20 20 20 20 20 00 31

----------------

Block 0, Base EDID:
  EDID Structure Version & Revision: 1.3
  Vendor & Product Identification:
    Manufacturer: TOS
    Model: 20625
    Made in: week 14 of 2006
  Basic Display Parameters & Features:
    Digital display
    Maximum image size: 34 cm x 19 cm
    Gamma: 2.20
    DPMS levels: Standby Suspend
    RGB color display
    First detailed timing is the preferred timing
  Color Characteristics:
    Red  : 0.5751, 0.3447
    Green: 0.3398, 0.5703
    Blue : 0.1601, 0.1347
    White: 0.3134, 0.3291
  Established Timings I & II: none
  Standard Timings: none
  Detailed Timing Descriptors:
    DTD 1:  1366x768    60.155615 Hz 683:384   47.523 kHz     72.520000 MHz (344 mm x 193 mm)
                 Hfront   48 Hsync  32 Hback   80 Hpol N
                 Vfront    3 Vsync   5 Vback   14 Vpol N
    Display Range Limits:
      Monitor ranges (GTF): 59-61 Hz V, 46-48 kHz H, max dotclock 80 MHz
    Display Product Name: 'Internal LCD'
    Alphanumeric Data String: 'TOSHIBA'
Checksum: 0x31

----------------

EDID conformity: PASS
