
EDID (hex):
00ffffffffffff004c2df30b39354454
1c180103683c22782a0fa0a5564d9a26
104a5c21080081c0810081809500a9c0
b30001010101023a801871382d40582c
450056502100001e662156aa51001e30
468f330056502100001e000000fd0038
3c1e5111000a202020202020000000fc
00543237443539300a20202020200030

Extracted contents:
header:          00 ff ff ff ff ff ff 00
serial number:   4c 2d f3 0b 39 35 44 54 1c 18
version:         01 03
basic params:    68 3c 22 78 2a
chroma info:     0f a0 a5 56 4d 9a 26 10 4a 5c
established:     21 08 00
standard:        81 c0 81 00 81 80 95 00 a9 c0 b3 00 01 01 01 01
descriptor 1:    02 3a 80 18 71 38 2d 40 58 2c 45 00 56 50 21 00 00 1e
descriptor 2:    66 21 56 aa 51 00 1e 30 46 8f 33 00 56 50 21 00 00 1e
descriptor 3:    00 00 00 fd 00 38 3c 1e 51 11 00 0a 20 20 20 20 20 20
descriptor 4:    00 00 00 fc 00 54 32 37 44 35 39 30 0a 20 20 20 20 20
extensions:      00
checksum:        30

EDID version: 1.3
Manufacturer: SAM Model bf3 Serial Number --
Made in week 28 of 2014
Analog display, Input voltage level: 0.7/0.7 V
Sync: Separate 
Maximum image size: 60 cm x 34 cm
Gamma: 2.20
DPMS levels: Off
RGB color display
First detailed timing is preferred timing
Display x,y Chromaticity:
  Red:   0.6445, 0.3359
  Green: 0.3037, 0.6044
  Blue:  0.1503, 0.0644
  White: 0.2890, 0.3593
Established timings supported:
  640x480@60Hz 4:3 HorFreq: 31469 Hz Clock: 25.175 MHz
  800x600@60Hz 4:3 HorFreq: 37900 Hz Clock: 40.000 MHz
  1024x768@60Hz 4:3 HorFreq: 48400 Hz Clock: 65.000 MHz
Standard timings supported:
  1280x720@60Hz 16:9
  1280x800@60Hz 16:10
  1280x1024@60Hz 5:4 HorFreq: 64000 Hz Clock: 108.000 MHz
  1440x900@60Hz 16:10 HorFreq: 55500 Hz Clock: 88.750 MHz
  1600x900@60Hz 16:9
  1680x1050@60Hz 16:10 HorFreq: 64700 Hz Clock: 119.000 MHz
Detailed mode: Clock 148.500 MHz, 598 mm x 336 mm
               1920 2008 2052 2200 hborder 0
               1080 1084 1089 1125 vborder 0
               +hsync +vsync 
               VertFreq: 60 Hz, HorFreq: 67500 Hz
Detailed mode: Clock 85.500 MHz, 598 mm x 336 mm
               1366 1436 1579 1792 hborder 0
                768  771  774  798 vborder 0
               +hsync +vsync 
               VertFreq: 59 Hz, HorFreq: 47712 Hz
Monitor ranges (GTF): 56-60Hz V, 30-81kHz H, max dotclock 170MHz
Monitor name: T27D590
Checksum: 0x30 (valid)
