edid-decode (hex):

00 ff ff ff ff ff ff 00 09 e5 0c 08 00 00 00 00
1f 1c 01 04 95 1a 0e 78 03 5d 40 94 5b 57 94 29
1c 50 54 00 00 00 01 01 01 01 01 01 01 01 01 01
01 01 01 01 01 01 18 1d 56 b4 50 00 23 30 30 20
36 00 00 90 10 00 00 1a 65 13 56 b4 50 00 23 30
30 20 36 00 00 90 10 00 00 1a 00 00 00 00 00 00
00 00 00 00 00 00 00 00 00 00 00 00 00 00 00 02
00 0d 49 ff 0a 3c 6e 11 0b 14 6e 00 00 00 00 ec

----------------

Block 0, Base EDID:
  EDID Structure Version & Revision: 1.4
  Vendor & Product Identification:
    Manufacturer: BOE
    Model: 2060
    Made in: week 31 of 2018
  Basic Display Parameters & Features:
    Digital display
    Bits per primary color channel: 6
    DisplayPort interface
    Maximum image size: 26 cm x 14 cm
    Gamma: 2.20
    Supported color formats: RGB 4:4:4
    First detailed timing includes the native pixel format and preferred refresh rate
    Display is continuous frequency
  Color Characteristics:
    Red  : 0.5791, 0.3564
    Green: 0.3427, 0.5791
    Blue : 0.1611, 0.1093
    White: 0.3125, 0.3281
  Established Timings I & II: none
  Standard Timings: none
  Detailed Timing Descriptors:
    DTD 1:  1366x768    59.995 Hz 683:384  48.176 kHz  74.480 MHz (256 mm x 144 mm)
                 Hfront   48 Hsync  32 Hback 100 Hpol P
                 Vfront    3 Vsync   6 Vback  26 Vpol N
    DTD 2:  1366x768    39.994 Hz 683:384  32.115 kHz  49.650 MHz (256 mm x 144 mm)
                 Hfront   48 Hsync  32 Hback 100 Hpol P
                 Vfront    3 Vsync   6 Vback  26 Vpol N
    Empty Descriptor
    Manufacturer-Specified Display Descriptor (0x02): 00 02 00 0d 49 ff 0a 3c 6e 11 0b 14 6e 00 00 00 '....I..<n...n...'
Checksum: 0xec

----------------

Failures:

Block 0, Base EDID:
  Empty Descriptor: Use Dummy Descriptor instead of all zeroes.
  Missing Display Product Name.
  Missing Display Range Limits Descriptor.

EDID conformity: FAIL
