edid-decode (hex):

00 ff ff ff ff ff ff 00 5a 63 1e ba 01 01 01 01
04 11 01 03 80 2f 1e 78 2e 75 35 a5 56 4a 9a 25
10 50 54 bf ef 80 b3 00 a9 40 95 00 90 40 81 80
81 40 71 4f 31 0a 21 39 90 30 62 1a 27 40 68 b0
36 00 da 28 11 00 00 1c 00 00 00 ff 00 51 43 5a
30 37 30 34 30 31 32 36 34 0a 00 00 00 fd 00 32
4b 1e 52 11 00 0a 20 20 20 20 20 20 00 00 00 fc
00 56 58 32 32 33 35 77 6d 2d 33 0a 20 20 00 91

00 ff ff ff ff ff ff 00 5a 63 1e ba 01 01 01 01
04 11 01 03 80 2f 1e 78 2e 75 35 a5 56 4a 9a 25
10 50 54 bf ef 80 b3 00 a9 40 95 00 90 40 81 80
81 40 71 4f 31 0a 21 39 90 30 62 1a 27 40 68 b0
36 00 da 28 11 00 00 1c 00 00 00 ff 00 51 43 5a
30 37 30 34 30 31 32 36 34 0a 00 00 00 fd 00 32
4b 1e 52 11 00 0a 20 20 20 20 20 20 00 00 00 fc
00 56 58 32 32 33 35 77 6d 2d 33 0a 20 20 00 91

----------------

Block 0, Base EDID:
  EDID Structure Version & Revision: 1.3
  Vendor & Product Identification:
    Manufacturer: VSC
    Model: 47646
    Serial Number: ...
    Made in: week 4 of 2007
  Basic Display Parameters & Features:
    Digital display
    Maximum image size: 47 cm x 30 cm
    Gamma: 2.20
    DPMS levels: Off
    RGB color display
    Default (sRGB) color space is primary color space
    First detailed timing is the preferred timing
  Color Characteristics:
    Red  : 0.6455, 0.3388
    Green: 0.2900, 0.6025
    Blue : 0.1445, 0.0654
    White: 0.3134, 0.3291
  Established Timings I & II:
    IBM     :   720x400    70.081663 Hz   9:5     31.467 kHz     28.320000 MHz
    DMT 0x04:   640x480    59.940476 Hz   4:3     31.469 kHz     25.175000 MHz
    Apple   :   640x480    66.666667 Hz   4:3     35.000 kHz     30.240000 MHz
    DMT 0x05:   640x480    72.808802 Hz   4:3     37.861 kHz     31.500000 MHz
    DMT 0x06:   640x480    75.000000 Hz   4:3     37.500 kHz     31.500000 MHz
    DMT 0x08:   800x600    56.250000 Hz   4:3     35.156 kHz     36.000000 MHz
    DMT 0x09:   800x600    60.316541 Hz   4:3     37.879 kHz     40.000000 MHz
    DMT 0x0a:   800x600    72.187572 Hz   4:3     48.077 kHz     50.000000 MHz
    DMT 0x0b:   800x600    75.000000 Hz   4:3     46.875 kHz     49.500000 MHz
    Apple   :   832x624    74.551266 Hz   4:3     49.726 kHz     57.284000 MHz
    DMT 0x10:  1024x768    60.003840 Hz   4:3     48.363 kHz     65.000000 MHz
    DMT 0x11:  1024x768    70.069359 Hz   4:3     56.476 kHz     75.000000 MHz
    DMT 0x12:  1024x768    75.028582 Hz   4:3     60.023 kHz     78.750000 MHz
    DMT 0x24:  1280x1024   75.024675 Hz   5:4     79.976 kHz    135.000000 MHz
    Apple   :  1152x870    75.061550 Hz 192:145   68.681 kHz    100.000000 MHz
  Standard Timings:
    DMT 0x3a:  1680x1050   59.954250 Hz  16:10    65.290 kHz    146.250000 MHz
    DMT 0x33:  1600x1200   60.000000 Hz   4:3     75.000 kHz    162.000000 MHz
    DMT 0x2f:  1440x900    59.887445 Hz  16:10    55.935 kHz    106.500000 MHz
    DMT 0x2a:  1400x1050   59.978442 Hz   4:3     65.317 kHz    121.750000 MHz
    DMT 0x23:  1280x1024   60.019740 Hz   5:4     63.981 kHz    108.000000 MHz
    DMT 0x20:  1280x960    60.000000 Hz   4:3     60.000 kHz    108.000000 MHz
    DMT 0x15:  1152x864    75.000000 Hz   4:3     67.500 kHz    108.000000 MHz
    GTF     :   640x400    70.000000 Hz  16:10    29.190 kHz     23.352000 MHz
  Detailed Timing Descriptors:
    DTD 1:  1680x1050   59.954250 Hz  16:10    65.290 kHz    146.250000 MHz (474 mm x 296 mm)
                 Hfront  104 Hsync 176 Hback  280 Hpol N
                 Vfront    3 Vsync   6 Vback   30 Vpol P
    Display Product Serial Number: ...
    Display Range Limits:
      Monitor ranges (GTF): 50-75 Hz V, 30-82 kHz H, max dotclock 170 MHz
    Display Product Name: 'VX2235wm-3'
Checksum: 0x91

----------------

Block 1, Unknown EDID Extension Block 0x00:
  00 ff ff ff ff ff ff 00 5a 63 1e ba 01 01 01 01 '........Zc......'
  04 11 01 03 80 2f 1e 78 2e 75 35 a5 56 4a 9a 25 '...../.x.u5.VJ.%'
  10 50 54 bf ef 80 b3 00 a9 40 95 00 90 40 81 80 '.PT......@...@..'
  81 40 71 4f 31 0a 21 39 90 30 62 1a 27 40 68 b0 '.@qO1.!9.0b.'@h.'
  36 00 da 28 11 00 00 1c 00 00 00 ff 00 51 43 5a '6..(.........QCZ'
  30 37 30 34 30 31 32 36 34 0a 00 00 00 fd 00 32 '070401264......2'
  4b 1e 52 11 00 0a 20 20 20 20 20 20 00 00 00 fc 'K.R...      ....'
  00 56 58 32 32 33 35 77 6d 2d 33 0a 20 20 00 91 '.VX2235wm-3.  ..'
Checksum: 0x91

----------------

Warnings:

EDID:
  Base EDID: Some timings are out of range of the Monitor Ranges:
    Horizontal Freq: 29.190 - 79.976 kHz (Monitor: 30.000 - 82.000 kHz)
    Could be due to a Monitor Range off-by-one rounding issue

Failures:

Block 0, Base EDID:
  Basic Display Parameters & Features: sRGB is signaled, but the chromaticities do not match.
Block 1, Base EDID:
  Unknown Extension Block.
EDID:
  Base EDID: EDID specified 0 extension block(s), but found 1 extension block(s).

EDID conformity: FAIL
