edid-decode (hex):

00 ff ff ff ff ff ff 00 09 e5 a9 0a 00 00 00 00
17 1f 01 04 a5 26 15 78 03 60 75 98 5d 57 8f 28
1f 50 54 00 00 00 01 01 01 01 01 01 01 01 01 01
01 01 01 01 01 01 d0 39 80 04 71 38 32 40 30 20
35 00 7d d6 10 00 00 1a 18 2e 80 04 71 38 32 40
30 20 35 00 7d d6 10 00 00 1a 00 00 00 fd 00 28
3c 44 44 0f 01 0a 20 20 20 20 20 20 00 00 00 fe
00 4e 45 31 37 33 46 48 4d 2d 4e 36 31 0a 01 dc

02 03 0d 00 68 1a 00 00 01 01 28 3c 00 00 00 00
00 00 00 00 00 00 00 00 00 00 00 00 00 00 00 00
00 00 00 00 00 00 00 00 00 00 00 00 00 00 00 00
00 00 00 00 00 00 00 00 00 00 00 00 00 00 00 00
00 00 00 00 00 00 00 00 00 00 00 00 00 00 00 00
00 00 00 00 00 00 00 00 00 00 00 00 00 00 00 00
00 00 00 00 00 00 00 00 00 00 00 00 00 00 00 00
00 00 00 00 00 00 00 00 00 00 00 00 00 00 00 06

----------------

Block 0, Base EDID:
  EDID Structure Version & Revision: 1.4
  Vendor & Product Identification:
    Manufacturer: BOE
    Model: 2729
    Made in: week 23 of 2021
  Basic Display Parameters & Features:
    Digital display
    Bits per primary color channel: 8
    DisplayPort interface
    Maximum image size: 38 cm x 21 cm
    Gamma: 2.20
    Supported color formats: RGB 4:4:4
    First detailed timing includes the native pixel format and preferred refresh rate
    Display is continuous frequency
  Color Characteristics:
    Red  : 0.5947, 0.3652
    Green: 0.3398, 0.5585
    Blue : 0.1572, 0.1240
    White: 0.3134, 0.3291
  Established Timings I & II: none
  Standard Timings: none
  Detailed Timing Descriptors:
    DTD 1:  1920x1080   60.079565 Hz  16:9     67.890 kHz    148.000000 MHz (381 mm x 214 mm)
                 Hfront   48 Hsync  32 Hback  180 Hpol P
                 Vfront    3 Vsync   5 Vback   42 Vpol N
    DTD 2:  1920x1080   47.901275 Hz  16:9     54.128 kHz    118.000000 MHz (381 mm x 214 mm)
                 Hfront   48 Hsync  32 Hback  180 Hpol P
                 Vfront    3 Vsync   5 Vback   42 Vpol N
    Display Range Limits:
      Monitor ranges (Bare Limits): 40-60 Hz V, 68-68 kHz H, max dotclock 150 MHz
    Alphanumeric Data String: 'NE173FHM-N61'
  Extension blocks: 1
Checksum: 0xdc

----------------

Block 1, CTA-861 Extension Block:
  Revision: 3
  Native detailed modes: 0
  Vendor-Specific Data Block (AMD), OUI 00-00-1A:
    Version: 1.1
    Minimum Refresh Rate: 40 Hz
    Maximum Refresh Rate: 60 Hz
    Flags 1.x: 0x00
Checksum: 0x06  Unused space in Extension Block: 114 bytes

----------------

Warnings:

Block 0, Base EDID:
  Missing Display Product Name.
Block 1, CTA-861 Extension Block:
  IT Video Formats are overscanned by default, but normally this should be underscanned.
  Add a Colorimetry Data Block with the sRGB colorimetry bit set to avoid interop issues.
EDID:
  Base EDID: Some timings are out of range of the Monitor Ranges:
    Horizontal Freq: 54.128 - 67.889 kHz (Monitor: 68.000 - 68.000 kHz)

Failures:

Block 1, CTA-861 Extension Block:
  Required 640x480p60 timings are missing in the established timings and the SVD list (VIC 1).
  Missing VCDB, needed for Set Selectable RGB Quantization to avoid interop issues.

EDID conformity: FAIL
