
EDID (hex):
00ffffffffffff0030ae002001000000
0116010380301b78ee2455a3544fa027
115054a10800d1c09500818081c0a9c0
010101010101023a801871382d40582c
450040846300001e000000fc004c656e
6f766f2041494f205043000000fd003b
3d1e440f000a202020202020000000ff
003030303030310a2020202020200053

Extracted contents:
header:          00 ff ff ff ff ff ff 00
serial number:   30 ae 00 20 01 00 00 00 01 16
version:         01 03
basic params:    80 30 1b 78 ee
chroma info:     24 55 a3 54 4f a0 27 11 50 54
established:     a1 08 00
standard:        d1 c0 95 00 81 80 81 c0 a9 c0 01 01 01 01 01 01
descriptor 1:    02 3a 80 18 71 38 2d 40 58 2c 45 00 40 84 63 00 00 1e
descriptor 2:    00 00 00 fc 00 4c 65 6e 6f 76 6f 20 41 49 4f 20 50 43
descriptor 3:    00 00 00 fd 00 3b 3d 1e 44 0f 00 0a 20 20 20 20 20 20
descriptor 4:    00 00 00 ff 00 30 30 30 30 30 31 0a 20 20 20 20 20 20
extensions:      00
checksum:        53

EDID version: 1.3
Manufacturer: LEN Model 2000 Serial Number --
Made in week 1 of 2012
Digital display
Maximum image size: 48 cm x 27 cm
Gamma: 2.20
DPMS levels: Standby Suspend Off
RGB color display
Default (sRGB) color space is primary color space
First detailed timing is preferred timing
Display x,y Chromaticity:
  Red:   0.6367, 0.3300
  Green: 0.3095, 0.6250
  Blue:  0.1533, 0.0673
  White: 0.3134, 0.3291
Established timings supported:
  720x400@70Hz 9:5 HorFreq: 31469 Hz Clock: 28.320 MHz
  640x480@60Hz 4:3 HorFreq: 31469 Hz Clock: 25.175 MHz
  800x600@60Hz 4:3 HorFreq: 37900 Hz Clock: 40.000 MHz
  1024x768@60Hz 4:3 HorFreq: 48400 Hz Clock: 65.000 MHz
Standard timings supported:
  1920x1080@60Hz 16:9
  1440x900@60Hz 16:10 HorFreq: 55500 Hz Clock: 88.750 MHz
  1280x1024@60Hz 5:4 HorFreq: 64000 Hz Clock: 108.000 MHz
  1280x720@60Hz 16:9
  1600x900@60Hz 16:9
Detailed mode: Clock 148.500 MHz, 1600 mm x 900 mm
               1920 2008 2052 2200 hborder 0
               1080 1084 1089 1125 vborder 0
               +hsync +vsync 
               VertFreq: 60 Hz, HorFreq: 67500 Hz
Monitor ranges (GTF): 59-61Hz V, 30-68kHz H, max dotclock 150MHz
Serial number: --
Checksum: 0x53 (valid)
EDID block does NOT conform to EDID 1.3!
	sRGB is signaled, but the chromaticities do not match
	Name descriptor not terminated with a newline
One or more of the timings is out of range of the Monitor Ranges:
  Vertical Freq: 60 - 70 Hz
  Horizontal Freq: 31469 - 67500 Hz
  Maximum Clock: 148.500 MHz
