edid-decode (hex):

00 ff ff ff ff ff ff 00 30 ae 00 20 01 01 01 01
15 17 01 03 80 30 1b 78 ee 25 65 a3 54 4f a0 27
ab 50 54 00 00 00 01 01 01 01 01 01 01 01 01 01
01 01 01 01 01 01 19 38 80 00 71 38 14 40 60 40
84 00 e0 0e 11 00 00 1e 00 00 00 fc 00 4c 65 6e
6f 76 6f 20 41 49 4f 20 50 43 00 00 00 fd 00 3b
3d 1e 44 0f 00 0a 20 20 20 20 20 20 00 00 00 ff
00 4c 4d 32 31 35 57 46 34 2d 54 4c 47 31 00 8d

----------------

Block 0, Base EDID:
  EDID Structure Version & Revision: 1.3
  Vendor & Product Identification:
    Manufacturer: LEN
    Model: 8192
    Serial Number: ...
    Made in: week 21 of 2013
  Basic Display Parameters & Features:
    Digital display
    Maximum image size: 48 cm x 27 cm
    Gamma: 2.20
    DPMS levels: Standby Suspend Off
    RGB color display
    Default (sRGB) color space is primary color space
    First detailed timing is preferred timing
  Color Characteristics:
    Red  : 0.6367, 0.3300
    Green: 0.3095, 0.6259
    Blue : 0.1533, 0.6699
    White: 0.3134, 0.3291
  Established Timings I & II: none
  Standard Timings: none
  Detailed Timing Descriptors:
    DTD 1:  1920x1080   59.997 Hz  16:9    65.997 kHz 143.610 MHz (480 mm x 270 mm)
                 Hfront   96 Hsync  64 Hback  96 Hpol P
                 Vfront    8 Vsync   4 Vback   8 Vpol P
    Display Product Name: 'Lenovo AIO PC'
  Display Range Limits:
    Monitor ranges (GTF): 59-61 Hz V, 30-68 kHz H, max dotclock 150 MHz
    Display Product Serial Number: ...
Checksum: 0x8d
