
EDID (hex):
00ffffffffffff0030ae002001000000
01160103802c1978eefda5a256519e27
0c5054a10800a9c09500818081c00101
010101010101302a40c8608464301850
130040846300001e000000fc004c656e
6f766f2041494f205043000000fd003b
3d1e440f000a202020202020000000ff
003030303030310a2020202020200021

Extracted contents:
header:          00 ff ff ff ff ff ff 00
serial number:   30 ae 00 20 01 00 00 00 01 16
version:         01 03
basic params:    80 2c 19 78 ee
chroma info:     fd a5 a2 56 51 9e 27 0c 50 54
established:     a1 08 00
standard:        a9 c0 95 00 81 80 81 c0 01 01 01 01 01 01 01 01
descriptor 1:    30 2a 40 c8 60 84 64 30 18 50 13 00 40 84 63 00 00 1e
descriptor 2:    00 00 00 fc 00 4c 65 6e 6f 76 6f 20 41 49 4f 20 50 43
descriptor 3:    00 00 00 fd 00 3b 3d 1e 44 0f 00 0a 20 20 20 20 20 20
descriptor 4:    00 00 00 ff 00 30 30 30 30 30 31 0a 20 20 20 20 20 20
extensions:      00
checksum:        21

EDID version: 1.3
Manufacturer: LEN Model 2000 Serial Number --
Made in week 1 of 2012
Digital display
Maximum image size: 44 cm x 25 cm
Gamma: 2.20
DPMS levels: Standby Suspend Off
RGB color display
Default (sRGB) color space is primary color space
First detailed timing is preferred timing
Display x,y Chromaticity:
  Red:   0.6357, 0.3388
  Green: 0.3193, 0.6181
  Blue:  0.1542, 0.0488
  White: 0.3134, 0.3291
Established timings supported:
  720x400@70Hz 9:5 HorFreq: 31469 Hz Clock: 28.320 MHz
  640x480@60Hz 4:3 HorFreq: 31469 Hz Clock: 25.175 MHz
  800x600@60Hz 4:3 HorFreq: 37900 Hz Clock: 40.000 MHz
  1024x768@60Hz 4:3 HorFreq: 48400 Hz Clock: 65.000 MHz
Standard timings supported:
  1600x900@60Hz 16:9
  1440x900@60Hz 16:10 HorFreq: 55500 Hz Clock: 88.750 MHz
  1280x1024@60Hz 5:4 HorFreq: 64000 Hz Clock: 108.000 MHz
  1280x720@60Hz 16:9
Detailed mode: Clock 108.000 MHz, 1600 mm x 900 mm
               1600 1624 1704 1800 hborder 0
                900  901  904 1000 vborder 0
               +hsync +vsync 
               VertFreq: 60 Hz, HorFreq: 60000 Hz
Monitor ranges (GTF): 59-61Hz V, 30-68kHz H, max dotclock 150MHz
Serial number: --
Checksum: 0x21 (valid)
EDID block does NOT conform to EDID 1.3!
	sRGB is signaled, but the chromaticities do not match
	Name descriptor not terminated with a newline
One or more of the timings is out of range of the Monitor Ranges:
  Vertical Freq: 60 - 70 Hz
  Horizontal Freq: 31469 - 64000 Hz
  Maximum Clock: 108.000 MHz
