
EDID (hex):
00ffffffffffff000e6f031400000000
001e0104b51e1378030ae6af5041af23
0e505300000001010101010101010101
01010101010180e800a0f06050903020
36002ebd10000018000000fd00303c95
953c010a202020202020000000fe0043
534f542054330a2020202020000000fe
004d4e453030375a41312d320a20016d
02030f00e3058000e60605016a6a2400
00000000000000000000000000000000
00000000000000000000000000000000
00000000000000000000000000000000
00000000000000000000000000000000
00000000000000000000000000000000
00000000000000000000000000000000
0000000000000000000000000000009a

Extracted contents:
header:          00 ff ff ff ff ff ff 00
serial number:   0e 6f 03 14 00 00 00 00 00 1e
version:         01 04
basic params:    b5 1e 13 78 03
chroma info:     0a e6 af 50 41 af 23 0e 50 53
established:     00 00 00
standard:        01 01 01 01 01 01 01 01 01 01 01 01 01 01 01 01
descriptor 1:    80 e8 00 a0 f0 60 50 90 30 20 36 00 2e bd 10 00 00 18
descriptor 2:    00 00 00 fd 00 30 3c 95 95 3c 01 0a 20 20 20 20 20 20
descriptor 3:    00 00 00 fe 00 43 53 4f 54 20 54 33 0a 20 20 20 20 20
descriptor 4:    00 00 00 fe 00 4d 4e 45 30 30 37 5a 41 31 2d 32 0a 20
extensions:      01
checksum:        6d

EDID version: 1.4
Manufacturer: CSO Model 1403 Serial Number --
Made in year 2020
Digital display
10 bits per primary color channel
DisplayPort interface
Maximum image size: 30 cm x 19 cm
Gamma: 2.20
Supported color formats: RGB 4:4:4
First detailed timing includes the native pixel format and preferred refresh rate
Display is continuous frequency
Display x,y Chromaticity:
  Red:   0.6835, 0.3125
  Green: 0.2558, 0.6855
  Blue:  0.1396, 0.0566
  White: 0.3134, 0.3261
Established timings supported:
Standard timings supported:
Detailed mode: Clock 595.200 MHz, 302 mm x 189 mm
               3840 3888 3920 4000 hborder 0
               2400 2403 2409 2480 vborder 0
               -hsync -vsync 
               VertFreq: 60 Hz, HorFreq: 148800 Hz
Monitor ranges (bare limits): 48-60Hz V, 149-149kHz H, max dotclock 600MHz
ASCII string: CSOT T3
ASCII string: MNE007ZA1-2
Has 1 extension blocks
Checksum: 0x6d (valid)

CTA extension block
Extension version: 3
11 bytes of CTA data
  Extended tag: Colorimetry data block
    BT2020RGB
  Extended tag: HDR static metadata data block
    Electro optical transfer functions:
      Traditional gamma - SDR luminance range
      SMPTE ST2084
    Supported static metadata descriptors:
      Static metadata type 1
    Desired content max luminance: 106 (496.743 cd/m^2)
    Desired content max frame-average luminance: 106 (496.743 cd/m^2)
    Desired content min luminance: 36 (0.099 cd/m^2)
0 native detailed modes
Checksum: 0x9a (valid)

EDID block does NOT conform to EDID 1.4!
	Required 640x480p60 timings are missing in the established timings
	and/or in the SVD list (VIC 1)
	Missing name descriptor
Warning: One or more of the timings is out of range of the Monitor Ranges:
  Vertical Freq: 60 - 60 Hz
  Horizontal Freq: 148800 - 148800 Hz
  Maximum Clock: 595.200 MHz
