
EDID (hex):
00ffffffffffff000e14db1700000000
21160104951d10780a4afd9156599129
1e505400000001010101010101010101
010101010101322640a060841a303020
350025a410000018322640a060841a30
3020350025a410000018000000fe0043
50542020202020202020202000000000
00434c4141313333554130338220003f

edid-decode (hex):

00 ff ff ff ff ff ff 00 0e 14 db 17 00 00 00 00
21 16 01 04 95 1d 10 78 0a 4a fd 91 56 59 91 29
1e 50 54 00 00 00 01 01 01 01 01 01 01 01 01 01
01 01 01 01 01 01 32 26 40 a0 60 84 1a 30 30 20
35 00 25 a4 10 00 00 18 32 26 40 a0 60 84 1a 30
30 20 35 00 25 a4 10 00 00 18 00 00 00 fe 00 43
50 54 20 20 20 20 20 20 20 20 20 20 00 00 00 00
00 43 4c 41 41 31 33 33 55 41 30 33 82 20 00 3f

----------------

Block 0, Base EDID:
  EDID Structure Version & Revision: 1.4
  Vendor & Product Identification:
    Manufacturer: CPT
    Model: 6107
    Made in: week 33 of 2012
  Basic Display Parameters & Features:
    Digital display
    Bits per primary color channel: 6
    DisplayPort interface
    Maximum image size: 29 cm x 16 cm
    Gamma: 2.20
    Supported color formats: RGB 4:4:4, YCrCb 4:4:4
    First detailed timing includes the native pixel format and preferred refresh rate
  Color Characteristics:
    Red  : 0.5673, 0.3359
    Green: 0.3496, 0.5683
    Blue : 0.1630, 0.1201
    White: 0.3154, 0.3291
  Established Timings I & II: none
  Standard Timings: none
  Detailed Timing Descriptors:
    DTD 1:  1600x900    59.996564 Hz  16:9     55.557 kHz     97.780000 MHz (293 mm x 164 mm)
                 Hfront   48 Hsync  32 Hback   80 Hpol N
                 Vfront    3 Vsync   5 Vback   18 Vpol N
    DTD 2:  1600x900    59.996564 Hz  16:9     55.557 kHz     97.780000 MHz (293 mm x 164 mm)
                 Hfront   48 Hsync  32 Hback   80 Hpol N
                 Vfront    3 Vsync   5 Vback   18 Vpol N
    Alphanumeric Data String: 'CPT          '
    Manufacturer-Specified Display Descriptor (0x00): 00 00 00 43 4c 41 41 31 33 33 55 41 30 33 82 20 '...CLAA133UA03. '
Checksum: 0x3f
