edid-decode (hex):

00 ff ff ff ff ff ff 00 30 e4 01 6e 00 00 00 00
00 12 01 03 80 22 13 78 0a de 05 a3 5a 51 92 26
1a 50 54 00 00 00 01 01 01 01 01 01 01 01 01 01
01 01 01 01 01 01 3e 1c 56 a0 50 00 16 30 30 20
35 00 58 c2 10 00 00 19 00 00 00 00 00 00 00 00
00 00 00 00 00 00 00 00 00 00 00 00 00 fe 00 4c
47 20 44 69 73 70 6c 61 79 0a 20 20 00 00 00 fe
00 4c 50 31 35 36 57 48 31 2d 54 4c 43 31 00 b9

----------------

Block 0, Base EDID:
  EDID Structure Version & Revision: 1.3
  Vendor & Product Identification:
    Manufacturer: LGD
    Model: 28161
    Made in: 2008
  Basic Display Parameters & Features:
    Digital display
    Maximum image size: 34 cm x 19 cm
    Gamma: 2.20
    RGB color display
    First detailed timing is preferred timing
  Color Characteristics:
    Red  : 0.6396, 0.3525
    Green: 0.3193, 0.5722
    Blue : 0.1484, 0.1015
    White: 0.3134, 0.3291
  Established Timings I & II: none
  Standard Timings: none
  Detailed Timing Descriptors:
    DTD 1:  1366x768    59.973 Hz 683:384  47.379 kHz  72.300 MHz (344 mm x 194 mm)
                 Hfront   48 Hsync  32 Hback  80 Hpol N
                 Vfront    3 Vsync   5 Vback  14 Vpol N
    Empty Descriptor
    Alphanumeric Data String: 'LG Display'
    Alphanumeric Data String: 'LP156WH1-TLC1'
Checksum: 0xb9
