
EDID (hex):
00ffffffffffff002163000001010101
0c180103800000780adebda355479926
0c474aa1080081c00101010101010101
010101010101662150b051001b304070
3600f8ae2100001ea91a00a050001630
302037003f432100001a000000fd0032
4c1f4b10000a202020202020000000fc
00484b432054560a20202020202001d5
020324744f90050403070206011f1413
12161115230907038301000067030c00
2000b82d011d00bc52d01e20b8285540
c48e2100001e011d80d0721c1620102c
2580c48e2100009e8c0ad08a20e02d10
103e9600138e210000188c0ad0902040
31200c405500138e2100001800000000
0000000000000000000000000000002e

Extracted contents:
header:          00 ff ff ff ff ff ff 00
serial number:   21 63 00 00 01 01 01 01 0c 18
version:         01 03
basic params:    80 00 00 78 0a
chroma info:     de bd a3 55 47 99 26 0c 47 4a
established:     a1 08 00
standard:        81 c0 01 01 01 01 01 01 01 01 01 01 01 01 01 01
descriptor 1:    66 21 50 b0 51 00 1b 30 40 70 36 00 f8 ae 21 00 00 1e
descriptor 2:    a9 1a 00 a0 50 00 16 30 30 20 37 00 3f 43 21 00 00 1a
descriptor 3:    00 00 00 fd 00 32 4c 1f 4b 10 00 0a 20 20 20 20 20 20
descriptor 4:    00 00 00 fc 00 48 4b 43 20 54 56 0a 20 20 20 20 20 20
extensions:      01
checksum:        d5

EDID version: 1.3
Manufacturer: HKC Model 0 Serial Number --
Made in week 12 of 2014
Digital display
Image size is variable
Gamma: 2.20
RGB color display
First detailed timing is preferred timing
Display x,y Chromaticity:
  Red:   0.6396, 0.3330
  Green: 0.2802, 0.5996
  Blue:  0.1503, 0.0498
  White: 0.2802, 0.2900
Established timings supported:
  720x400@70Hz 9:5 HorFreq: 31469 Hz Clock: 28.320 MHz
  640x480@60Hz 4:3 HorFreq: 31469 Hz Clock: 25.175 MHz
  800x600@60Hz 4:3 HorFreq: 37900 Hz Clock: 40.000 MHz
  1024x768@60Hz 4:3 HorFreq: 48400 Hz Clock: 65.000 MHz
Standard timings supported:
  1280x720@60Hz 16:9
Detailed mode: Clock 85.500 MHz, 760 mm x 430 mm
               1360 1424 1536 1792 hborder 0
                768  771  777  795 vborder 0
               +hsync +vsync 
               VertFreq: 60 Hz, HorFreq: 47712 Hz
Detailed mode: Clock 68.250 MHz, 575 mm x 323 mm
               1280 1328 1360 1440 hborder 0
                768  771  778  790 vborder 0
               +hsync -vsync 
               VertFreq: 59 Hz, HorFreq: 47395 Hz
Monitor ranges (GTF): 50-76Hz V, 31-75kHz H, max dotclock 160MHz
Monitor name: HKC TV
Has 1 extension blocks
Checksum: 0xd5 (valid)

CTA extension block
Extension version: 3
32 bytes of CTA data
  Video data block
    VIC  16 1920x1080@60Hz 16:9 (native) HorFreq: 67500 Hz Clock: 148.500 MHz
    VIC   5 1920x1080i@60Hz 16:9  HorFreq: 33750 Hz Clock: 74.250 MHz
    VIC   4 1280x720@60Hz 16:9  HorFreq: 45000 Hz Clock: 74.250 MHz
    VIC   3 720x480@60Hz 16:9  HorFreq: 31469 Hz Clock: 27.000 MHz
    VIC   7 1440x480i@60Hz 16:9  HorFreq: 15734 Hz Clock: 27.000 MHz
    VIC   2 720x480@60Hz 4:3  HorFreq: 31469 Hz Clock: 27.000 MHz
    VIC   6 1440x480i@60Hz 4:3  HorFreq: 15734 Hz Clock: 27.000 MHz
    VIC   1 640x480@60Hz 4:3  HorFreq: 31469 Hz Clock: 25.175 MHz
    VIC  31 1920x1080@50Hz 16:9  HorFreq: 56250 Hz Clock: 148.500 MHz
    VIC  20 1920x1080i@50Hz 16:9  HorFreq: 28125 Hz Clock: 74.250 MHz
    VIC  19 1280x720@50Hz 16:9  HorFreq: 37500 Hz Clock: 74.250 MHz
    VIC  18 720x576@50Hz 16:9  HorFreq: 31250 Hz Clock: 27.000 MHz
    VIC  22 1440x576i@50Hz 16:9  HorFreq: 15625 Hz Clock: 27.000 MHz
    VIC  17 720x576@50Hz 4:3  HorFreq: 31250 Hz Clock: 27.000 MHz
    VIC  21 1440x576i@50Hz 4:3  HorFreq: 15625 Hz Clock: 27.000 MHz
  Audio data block
    Linear PCM, max channels 2
      Supported sample rates (kHz): 48 44.1 32
      Supported sample sizes (bits): 20 16
  Speaker allocation data block
    Speaker map:
      FL/FR - Front Left/Right
  Vendor-specific data block, OUI 000c03 (HDMI)
    Source physical address 2.0.0.0
    Supports_AI
    DC_36bit
    DC_30bit
    DC_Y444
    Maximum TMDS clock: 225MHz
Basic audio support
Supports YCbCr 4:4:4
Supports YCbCr 4:2:2
4 native detailed modes
Detailed mode: Clock 74.250 MHz, 708 mm x 398 mm
               1280 1720 1760 1980 hborder 0
                720  725  730  750 vborder 0
               +hsync +vsync 
               VertFreq: 50 Hz, HorFreq: 37500 Hz
Detailed mode: Clock 74.250 MHz, 708 mm x 398 mm
               1920 2448 2492 2640 hborder 0
                540  542  547  562 vborder 0
               +hsync +vsync interlaced 
               VertFreq: 50 Hz, HorFreq: 28125 Hz
Detailed mode: Clock 27.000 MHz, 531 mm x 398 mm
                720  736  798  858 hborder 0
                480  489  495  525 vborder 0
               -hsync -vsync 
               VertFreq: 59 Hz, HorFreq: 31468 Hz
Detailed mode: Clock 27.000 MHz, 531 mm x 398 mm
                720  732  796  864 hborder 0
                576  581  586  625 vborder 0
               -hsync -vsync 
               VertFreq: 50 Hz, HorFreq: 31250 Hz
Checksum: 0x2e (valid)

One or more of the timings is out of range of the Monitor Ranges:
  Vertical Freq: 50 - 70 Hz
  Horizontal Freq: 15625 - 67500 Hz
  Maximum Clock: 148.500 MHz


