
EDID (hex):
00ffffffffffff002163000001000000
211b0104a53c22783387e5a456509e26
0d5054afcf008180617c81bc9500953c
b300b33cd1fc023a801871382d40582c
450053502100001e378b801871382d40
582c450053502100001e000000fd005a
90a2a2240100202020202020000000ff
0043454343393238313530323131015e
020313c1230907078301000000000000
0000002a82805070384d400820f80c53
502100001a0000000000000000000000
00000000000000000000000000000000
00000000000000000000000000000000
00000000000000000000000000000000
00000000000000000000000000000000
000000000000000000000000000000ae

edid-decode (hex):

00 ff ff ff ff ff ff 00 21 63 00 00 01 00 00 00
21 1b 01 04 a5 3c 22 78 33 87 e5 a4 56 50 9e 26
0d 50 54 af cf 00 81 80 61 7c 81 bc 95 00 95 3c
b3 00 b3 3c d1 fc 02 3a 80 18 71 38 2d 40 58 2c
45 00 53 50 21 00 00 1e 37 8b 80 18 71 38 2d 40
58 2c 45 00 53 50 21 00 00 1e 00 00 00 fd 00 5a
90 a2 a2 24 01 00 20 20 20 20 20 20 00 00 00 ff
00 43 45 43 43 39 32 38 31 35 30 32 31 31 01 5e

02 03 13 c1 23 09 07 07 83 01 00 00 00 00 00 00
00 00 00 2a 82 80 50 70 38 4d 40 08 20 f8 0c 53
50 21 00 00 1a 00 00 00 00 00 00 00 00 00 00 00
00 00 00 00 00 00 00 00 00 00 00 00 00 00 00 00
00 00 00 00 00 00 00 00 00 00 00 00 00 00 00 00
00 00 00 00 00 00 00 00 00 00 00 00 00 00 00 00
00 00 00 00 00 00 00 00 00 00 00 00 00 00 00 00
00 00 00 00 00 00 00 00 00 00 00 00 00 00 00 ae

----------------

Block 0, Base EDID:
  EDID Structure Version & Revision: 1.4
  Vendor & Product Identification:
    Manufacturer: HKC
    Model: 0
    Serial Number: 1
    Made in: week 33 of 2017
  Basic Display Parameters & Features:
    Digital display
    Bits per primary color channel: 8
    DisplayPort interface
    Maximum image size: 60 cm x 34 cm
    Gamma: 2.20
    DPMS levels: Off
    Supported color formats: RGB 4:4:4, YCrCb 4:2:2
    First detailed timing includes the native pixel format and preferred refresh rate
    Display is continuous frequency
  Color Characteristics:
    Red  : 0.6425, 0.3359
    Green: 0.3134, 0.6201
    Blue : 0.1513, 0.0527
    White: 0.3134, 0.3291
  Established Timings I & II:
    IBM     :   720x400    70.081663 Hz   9:5     31.467 kHz     28.320000 MHz
    DMT 0x04:   640x480    59.940476 Hz   4:3     31.469 kHz     25.175000 MHz
    DMT 0x05:   640x480    72.808802 Hz   4:3     37.861 kHz     31.500000 MHz
    DMT 0x06:   640x480    75.000000 Hz   4:3     37.500 kHz     31.500000 MHz
    DMT 0x08:   800x600    56.250000 Hz   4:3     35.156 kHz     36.000000 MHz
    DMT 0x09:   800x600    60.316541 Hz   4:3     37.879 kHz     40.000000 MHz
    DMT 0x0a:   800x600    72.187572 Hz   4:3     48.077 kHz     50.000000 MHz
    DMT 0x0b:   800x600    75.000000 Hz   4:3     46.875 kHz     49.500000 MHz
    DMT 0x10:  1024x768    60.003840 Hz   4:3     48.363 kHz     65.000000 MHz
    DMT 0x11:  1024x768    70.069359 Hz   4:3     56.476 kHz     75.000000 MHz
    DMT 0x12:  1024x768    75.028582 Hz   4:3     60.023 kHz     78.750000 MHz
    DMT 0x24:  1280x1024   75.024675 Hz   5:4     79.976 kHz    135.000000 MHz
  Standard Timings:
    DMT 0x23:  1280x1024   60.019740 Hz   5:4     63.981 kHz    108.000000 MHz
    GTF     :  1024x768   119.999931 Hz   4:3     98.760 kHz    139.054000 MHz
    GTF     :  1280x1024  120.000185 Hz   5:4    131.640 kHz    233.793000 MHz
    DMT 0x2f:  1440x900    59.887445 Hz  16:10    55.935 kHz    106.500000 MHz
    GTF     :  1440x900   119.999896 Hz  16:10   115.800 kHz    229.747000 MHz
    DMT 0x3a:  1680x1050   59.954250 Hz  16:10    65.290 kHz    146.250000 MHz
    GTF     :  1680x1050  120.000000 Hz  16:10   135.000 kHz    313.200000 MHz
    GTF     :  1920x1080  119.999987 Hz  16:9    138.840 kHz    368.759000 MHz
  Detailed Timing Descriptors:
    DTD 1:  1920x1080   60.000000 Hz  16:9     67.500 kHz    148.500000 MHz (595 mm x 336 mm)
                 Hfront   88 Hsync  44 Hback  148 Hpol P
                 Vfront    4 Vsync   5 Vback   36 Vpol P
    DTD 2:  1920x1080  143.995960 Hz  16:9    161.995 kHz    356.390000 MHz (595 mm x 336 mm)
                 Hfront   88 Hsync  44 Hback  148 Hpol P
                 Vfront    4 Vsync   5 Vback   36 Vpol P
    Display Range Limits:
      Monitor ranges (Bare Limits): 90-144 Hz V, 162-162 kHz H, max dotclock 360 MHz
    Display Product Serial Number: 'CECC928150211'
  Extension blocks: 1
Checksum: 0x5e

----------------

Block 1, CTA-861 Extension Block:
  Revision: 3
  Underscans IT Video Formats by default
  Basic audio support
  Native detailed modes: 1
  Audio Data Block:
    Linear PCM:
      Max channels: 2
      Supported sample rates (kHz): 48 44.1 32
      Supported sample sizes (bits): 24 20 16
  Speaker Allocation Data Block:
    FL/FR - Front Left/Right
  Unknown CTA-861 Data Block (tag 0x00, length 0):
  Unknown CTA-861 Data Block (tag 0x00, length 0):
  Unknown CTA-861 Data Block (tag 0x00, length 0):
  Unknown CTA-861 Data Block (tag 0x00, length 0):
  Unknown CTA-861 Data Block (tag 0x00, length 0):
  Unknown CTA-861 Data Block (tag 0x00, length 0):
  Unknown CTA-861 Data Block (tag 0x00, length 0):
  Detailed Timing Descriptors:
    DTD 3:  1920x1080  144.001729 Hz  16:9    166.610 kHz    333.220000 MHz (595 mm x 336 mm)
                 Hfront    8 Hsync  32 Hback   40 Hpol P
                 Vfront   63 Vsync   8 Vback    6 Vpol N
Checksum: 0xae  Unused space in Extension Block: 90 bytes
