
EDID (hex):
00ffffffffffff00367f250000000000
0413010380261578f2ce50a3574c9926
0f505400000001010101010101010101
010101010101763a8064713811403b76
25007cd210000000c430806471381140
3b7625007cd210000000000000000000
00000000000000000000000000000000
0000000000000000000000000000003e

Extracted contents:
header:          00 ff ff ff ff ff ff 00
serial number:   36 7f 25 00 00 00 00 00 04 13
version:         01 03
basic params:    80 26 15 78 f2
chroma info:     ce 50 a3 57 4c 99 26 0f 50 54
established:     00 00 00
standard:        01 01 01 01 01 01 01 01 01 01 01 01 01 01 01 01
descriptor 1:    76 3a 80 64 71 38 11 40 3b 76 25 00 7c d2 10 00 00 00
descriptor 2:    c4 30 80 64 71 38 11 40 3b 76 25 00 7c d2 10 00 00 00
descriptor 3:    00 00 00 00 00 00 00 00 00 00 00 00 00 00 00 00 00 00
descriptor 4:    00 00 00 00 00 00 00 00 00 00 00 00 00 00 00 00 00 00
extensions:      00
checksum:        3e

EDID version: 1.3
Manufacturer: MS_ Model 25 Serial Number --
Made in week 4 of 2009
Digital display
Maximum image size: 38 cm x 21 cm
Gamma: 2.20
DPMS levels: Standby Suspend Off
Non-RGB color display
First detailed timing is preferred timing
Display x,y Chromaticity:
  Red:   0.6396, 0.3398
  Green: 0.2998, 0.5996
  Blue:  0.1494, 0.0595
  White: 0.3125, 0.3281
Established timings supported:
Standard timings supported:
Detailed mode: Clock 149.660 MHz, 380 mm x 210 mm
               1920 1979 2097 2276 hborder 0
               1080 1082 1087 1097 vborder 0
               -hsync -vsync analog composite 
               VertFreq: 59 Hz, HorFreq: 65755 Hz
Detailed mode: Clock 124.840 MHz, 380 mm x 210 mm
               1920 1979 2097 2276 hborder 0
               1080 1082 1087 1097 vborder 0
               -hsync -vsync analog composite 
               VertFreq: 50 Hz, HorFreq: 54850 Hz
Manufacturer-specified data, tag 0
Manufacturer-specified data, tag 0
Checksum: 0x3e (valid)
EDID block does NOT conform to EDID 1.3!
	Missing name descriptor
	Missing monitor ranges
EDID block does not conform at all!
	Manufacturer name field contains garbage
