edid-decode (hex):

00 ff ff ff ff ff ff 00 09 e5 81 05 00 00 00 00
00 12 01 01 80 1e 13 78 08 22 c0 95 56 4e 8e 26
24 50 54 00 00 00 01 01 01 01 01 01 01 01 01 01
01 01 01 01 01 01 c7 1b 00 a0 50 20 17 30 30 20
36 00 2f be 10 00 00 19 00 00 00 fe 00 0a 20 20
20 20 20 20 20 20 20 20 20 20 00 00 00 fe 00 42
4f 45 20 4f 54 0a 20 20 20 20 20 20 00 00 00 fe
00 48 54 31 34 31 57 58 42 2d 31 30 30 0a 00 ff

----------------

Block 0, Base EDID:
  EDID Structure Version & Revision: 1.1
  Vendor & Product Identification:
    Manufacturer: BOE
    Model: 1409
    Made in: 2008
  Basic Display Parameters & Features:
    Digital display
    Maximum image size: 30 cm x 19 cm
    Gamma: 2.20
    RGB color display
  Color Characteristics:
    Red  : 0.5820, 0.3378
    Green: 0.3046, 0.5566
    Blue : 0.1513, 0.1406
    White: 0.3125, 0.3281
  Established Timings I & II: none
  Standard Timings: none
  Detailed Timing Descriptors:
    DTD 1:  1280x800    60.002363 Hz  16:10    49.382 kHz     71.110000 MHz (303 mm x 190 mm)
                 Hfront   48 Hsync  32 Hback   80 Hpol N
                 Vfront    3 Vsync   6 Vback   14 Vpol N
    Alphanumeric Data String: ''
    Alphanumeric Data String: 'BOE OT'
    Alphanumeric Data String: 'HT141WXB-100'
Checksum: 0xff

----------------

Warnings:

Block 0, Base EDID:
  EDID Structure Version & Revision: EDID 1.1 is deprecated, do not use.

Failures:

Block 0, Base EDID:
  Alphanumeric Data String: Empty string.

EDID conformity: FAIL
