
EDID (hex):
00ffffffffffff0010ac05e04c45344e
180e010380241d78ee0195a3574c9c25
125054a54b008180714f010101010101
010101010101302a009851002a403070
1300671f1100001e000000ff00583131
30363436474e34454c0a000000fc0044
454c4c203138303146500a20000000fd
00384b1e500e000a2020202020200062

Extracted contents:
header:          00 ff ff ff ff ff ff 00
serial number:   10 ac 05 e0 4c 45 34 4e 18 0e
version:         01 03
basic params:    80 24 1d 78 ee
chroma info:     01 95 a3 57 4c 9c 25 12 50 54
established:     a5 4b 00
standard:        81 80 71 4f 01 01 01 01 01 01 01 01 01 01 01 01
descriptor 1:    30 2a 00 98 51 00 2a 40 30 70 13 00 67 1f 11 00 00 1e
descriptor 2:    00 00 00 ff 00 58 31 31 30 36 34 36 47 4e 34 45 4c 0a
descriptor 3:    00 00 00 fc 00 44 45 4c 4c 20 31 38 30 31 46 50 0a 20
descriptor 4:    00 00 00 fd 00 38 4b 1e 50 0e 00 0a 20 20 20 20 20 20
extensions:      00
checksum:        62

EDID version: 1.3
Manufacturer: DEL Model e005 Serial Number --
Digital display
Maximum image size: 36 cm x 29 cm
Gamma: 2.20
DPMS levels: Standby Suspend Off
RGB color display
Default (sRGB) color space is primary color space
First detailed timing is preferred timing
Display x,y Chromaticity:
  Red:   0.6367, 0.3398
  Green: 0.2968, 0.6103
  Blue:  0.1464, 0.0712
  White: 0.3134, 0.3291
Established timings supported:
  720x400@70Hz 9:5 HorFreq: 31469 Hz Clock: 28.320 MHz
  640x480@60Hz 4:3 HorFreq: 31469 Hz Clock: 25.175 MHz
  640x480@75Hz 4:3 HorFreq: 37500 Hz Clock: 31.500 MHz
  800x600@60Hz 4:3 HorFreq: 37900 Hz Clock: 40.000 MHz
  800x600@75Hz 4:3 HorFreq: 46900 Hz Clock: 49.500 MHz
  1024x768@60Hz 4:3 HorFreq: 48400 Hz Clock: 65.000 MHz
  1024x768@75Hz 4:3 HorFreq: 60000 Hz Clock: 78.750 MHz
  1280x1024@75Hz 5:4 HorFreq: 80000 Hz Clock: 135.000 MHz
Standard timings supported:
  1280x1024@60Hz 5:4 HorFreq: 64000 Hz Clock: 108.000 MHz
  1152x864@75Hz 4:3 HorFreq: 67500 Hz Clock: 108.000 MHz
Detailed mode: Clock 108.000 MHz, 359 mm x 287 mm
               1280 1328 1440 1688 hborder 0
               1024 1025 1028 1066 vborder 0
               +hsync +vsync 
               VertFreq: 60 Hz, HorFreq: 63981 Hz
Serial number: --
Monitor name: DELL 1801FP
Monitor ranges (GTF): 56-75Hz V, 30-80kHz H, max dotclock 140MHz
Checksum: 0x62 (valid)
EDID block does NOT conform to EDID 1.3!
	sRGB is signaled, but the chromaticities do not match
EDID block does not conform at all!
	Bad year of manufacture
