edid-decode (hex):

00 ff ff ff ff ff ff 00 04 69 a7 27 46 48 01 00
32 1a 01 04 a5 3c 22 78 3a c8 c5 a8 55 4e a2 26
0d 50 54 b7 ef 00 d1 c0 95 00 81 80 71 4f 01 01
01 01 01 01 01 01 e8 e4 00 50 a0 a0 67 50 08 20
98 04 55 50 21 00 00 1e 56 5e 00 a0 a0 a0 29 50
30 20 35 00 55 50 21 00 00 1e 00 00 00 fd 00 32
90 18 de 3c 00 0a 20 20 20 20 20 20 00 00 00 fc
00 41 53 55 53 20 4d 47 32 37 39 0a 20 20 01 8b

02 03 1c f1 49 12 13 04 1f 90 0e 0f 1d 1e 23 09
17 07 83 01 00 00 65 03 0c 00 20 00 e8 e4 00 50
a0 a0 67 50 08 20 98 04 55 50 21 00 00 1e 01 1d
00 72 51 d0 1e 20 6e 28 55 00 55 50 21 00 00 1e
01 1d 00 bc 52 d0 1e 20 b8 28 55 40 55 50 21 00
00 1e 56 5e 00 a0 a0 a0 29 50 30 20 35 00 55 50
21 00 00 1e 87 bc 00 50 a0 a0 55 50 08 20 78 00
55 50 21 00 00 1e 00 00 00 00 00 00 00 00 00 95

00 ff ff ff ff ff ff 00 04 69 a7 27 46 48 01 00
32 1a 01 04 a5 3c 22 78 3a c8 c5 a8 55 4e a2 26
0d 50 54 b7 ef 00 d1 c0 95 00 81 80 71 4f 01 01
01 01 01 01 01 01 e8 e4 00 50 a0 a0 67 50 08 20
98 04 55 50 21 00 00 1e 56 5e 00 a0 a0 a0 29 50
30 20 35 00 55 50 21 00 00 1e 00 00 00 fd 00 32
90 18 de 3c 00 0a 20 20 20 20 20 20 00 00 00 fc
00 41 53 55 53 20 4d 47 32 37 39 0a 20 20 01 8b

02 03 1c f1 49 12 13 04 1f 90 0e 0f 1d 1e 23 09
17 07 83 01 00 00 65 03 0c 00 20 00 e8 e4 00 50
a0 a0 67 50 08 20 98 04 55 50 21 00 00 1e 01 1d
00 72 51 d0 1e 20 6e 28 55 00 55 50 21 00 00 1e
01 1d 00 bc 52 d0 1e 20 b8 28 55 40 55 50 21 00
00 1e 56 5e 00 a0 a0 a0 29 50 30 20 35 00 55 50
21 00 00 1e 87 bc 00 50 a0 a0 55 50 08 20 78 00
55 50 21 00 00 1e 00 00 00 00 00 00 00 00 00 95

----------------

Block 0, Base EDID:
  EDID Structure Version & Revision: 1.4
  Vendor & Product Identification:
    Manufacturer: ACI
    Model: 10151
    Serial Number: ...
    Made in: week 50 of 2016
  Basic Display Parameters & Features:
    Digital display
    Bits per primary color channel: 8
    DisplayPort interface
    Maximum image size: 60 cm x 34 cm
    Gamma: 2.20
    DPMS levels: Off
    Supported color formats: RGB 4:4:4, YCrCb 4:4:4, YCrCb 4:2:2
    First detailed timing includes the native pixel format and preferred refresh rate
  Color Characteristics:
    Red  : 0.6591, 0.3320
    Green: 0.3066, 0.6328
    Blue : 0.1513, 0.0507
    White: 0.3134, 0.3291
  Established Timings I & II:
    IBM     :   720x400    70.081663 Hz   9:5     31.467 kHz     28.320000 MHz
    DMT 0x04:   640x480    59.940476 Hz   4:3     31.469 kHz     25.175000 MHz
    Apple   :   640x480    66.666667 Hz   4:3     35.000 kHz     30.240000 MHz
    DMT 0x06:   640x480    75.000000 Hz   4:3     37.500 kHz     31.500000 MHz
    DMT 0x08:   800x600    56.250000 Hz   4:3     35.156 kHz     36.000000 MHz
    DMT 0x09:   800x600    60.316541 Hz   4:3     37.879 kHz     40.000000 MHz
    DMT 0x0a:   800x600    72.187572 Hz   4:3     48.077 kHz     50.000000 MHz
    DMT 0x0b:   800x600    75.000000 Hz   4:3     46.875 kHz     49.500000 MHz
    Apple   :   832x624    74.551266 Hz   4:3     49.726 kHz     57.284000 MHz
    DMT 0x10:  1024x768    60.003840 Hz   4:3     48.363 kHz     65.000000 MHz
    DMT 0x11:  1024x768    70.069359 Hz   4:3     56.476 kHz     75.000000 MHz
    DMT 0x12:  1024x768    75.028582 Hz   4:3     60.023 kHz     78.750000 MHz
    DMT 0x24:  1280x1024   75.024675 Hz   5:4     79.976 kHz    135.000000 MHz
  Standard Timings:
    DMT 0x52:  1920x1080   60.000000 Hz  16:9     67.500 kHz    148.500000 MHz
    DMT 0x2f:  1440x900    59.887445 Hz  16:10    55.935 kHz    106.500000 MHz
    DMT 0x23:  1280x1024   60.019740 Hz   5:4     63.981 kHz    108.000000 MHz
    DMT 0x15:  1152x864    75.000000 Hz   4:3     67.500 kHz    108.000000 MHz
  Detailed Timing Descriptors:
    DTD  1:  2560x1440  143.855928 Hz  16:9    221.970 kHz    586.000000 MHz (597 mm x 336 mm)
                  Hfront    8 Hsync  32 Hback   40 Hpol P
                  Vfront   25 Vsync   8 Vback   70 Vpol P
    DTD  2:  2560x1440   59.950550 Hz  16:9     88.787 kHz    241.500000 MHz (597 mm x 336 mm)
                  Hfront   48 Hsync  32 Hback   80 Hpol P
                  Vfront    3 Vsync   5 Vback   33 Vpol P
    Display Range Limits:
      Monitor ranges (GTF): 50-144 Hz V, 24-222 kHz H, max dotclock 600 MHz
    Display Product Name: 'ASUS MG279'
  Extension blocks: 1
Checksum: 0x8b

----------------

Block 1, CTA-861 Extension Block:
  Revision: 3
  Underscans IT Video Formats by default
  Basic audio support
  Supports YCbCr 4:4:4
  Supports YCbCr 4:2:2
  Native detailed modes: 1
  Video Data Block:
    VIC  18:   720x576    50.000000 Hz  16:9     31.250 kHz     27.000000 MHz
    VIC  19:  1280x720    50.000000 Hz  16:9     37.500 kHz     74.250000 MHz
    VIC   4:  1280x720    60.000000 Hz  16:9     45.000 kHz     74.250000 MHz
    VIC  31:  1920x1080   50.000000 Hz  16:9     56.250 kHz    148.500000 MHz
    VIC  16:  1920x1080   60.000000 Hz  16:9     67.500 kHz    148.500000 MHz (native)
    VIC  14:  1440x480    59.940060 Hz   4:3     31.469 kHz     54.000000 MHz
    VIC  15:  1440x480    59.940060 Hz  16:9     31.469 kHz     54.000000 MHz
    VIC  29:  1440x576    50.000000 Hz   4:3     31.250 kHz     54.000000 MHz
    VIC  30:  1440x576    50.000000 Hz  16:9     31.250 kHz     54.000000 MHz
  Audio Data Block:
    Linear PCM:
      Max channels: 2
      Supported sample rates (kHz): 96 48 44.1 32
      Supported sample sizes (bits): 24 20 16
  Speaker Allocation Data Block:
    FL/FR - Front Left/Right
  Vendor-Specific Data Block (HDMI), OUI 00-0C-03:
    Source physical address: 2.0.0.0
  Detailed Timing Descriptors:
    DTD  3:  2560x1440  143.855928 Hz  16:9    221.970 kHz    586.000000 MHz (597 mm x 336 mm)
                  Hfront    8 Hsync  32 Hback   40 Hpol P
                  Vfront   25 Vsync   8 Vback   70 Vpol P
    DTD  4:  1280x720    60.000000 Hz  16:9     45.000 kHz     74.250000 MHz (597 mm x 336 mm)
                  Hfront  110 Hsync  40 Hback  220 Hpol P
                  Vfront    5 Vsync   5 Vback   20 Vpol P
    DTD  5:  1280x720    50.000000 Hz  16:9     37.500 kHz     74.250000 MHz (597 mm x 336 mm)
                  Hfront  440 Hsync  40 Hback  220 Hpol P
                  Vfront    5 Vsync   5 Vback   20 Vpol P
    DTD  6:  2560x1440   59.950550 Hz  16:9     88.787 kHz    241.500000 MHz (597 mm x 336 mm)
                  Hfront   48 Hsync  32 Hback   80 Hpol P
                  Vfront    3 Vsync   5 Vback   33 Vpol P
    DTD  7:  2560x1440  119.878291 Hz  16:9    182.814 kHz    482.630000 MHz (597 mm x 336 mm)
                  Hfront    8 Hsync  32 Hback   40 Hpol P
                  Vfront    7 Vsync   8 Vback   70 Vpol P
Checksum: 0x95  Unused space in Extension Block: 9 bytes

----------------

Block 2, Unknown EDID Extension Block 0x00:
  00 ff ff ff ff ff ff 00 04 69 a7 27 46 48 01 00 '.........i.'FH..'
  32 1a 01 04 a5 3c 22 78 3a c8 c5 a8 55 4e a2 26 '2....<"x:...UN.&'
  0d 50 54 b7 ef 00 d1 c0 95 00 81 80 71 4f 01 01 '.PT.........qO..'
  01 01 01 01 01 01 e8 e4 00 50 a0 a0 67 50 08 20 '.........P..gP. '
  98 04 55 50 21 00 00 1e 56 5e 00 a0 a0 a0 29 50 '..UP!...V^....)P'
  30 20 35 00 55 50 21 00 00 1e 00 00 00 fd 00 32 '0 5.UP!........2'
  90 18 de 3c 00 0a 20 20 20 20 20 20 00 00 00 fc '...<..      ....'
  00 41 53 55 53 20 4d 47 32 37 39 0a 20 20 01 8b '.ASUS MG279.  ..'
Checksum: 0x8b

----------------

Block 3, CTA-861 Extension Block:
  Revision: 3
  Underscans IT Video Formats by default
  Basic audio support
  Supports YCbCr 4:4:4
  Supports YCbCr 4:2:2
  Native detailed modes: 1
  Video Data Block:
    VIC  18:   720x576    50.000000 Hz  16:9     31.250 kHz     27.000000 MHz
    VIC  19:  1280x720    50.000000 Hz  16:9     37.500 kHz     74.250000 MHz
    VIC   4:  1280x720    60.000000 Hz  16:9     45.000 kHz     74.250000 MHz
    VIC  31:  1920x1080   50.000000 Hz  16:9     56.250 kHz    148.500000 MHz
    VIC  16:  1920x1080   60.000000 Hz  16:9     67.500 kHz    148.500000 MHz (native)
    VIC  14:  1440x480    59.940060 Hz   4:3     31.469 kHz     54.000000 MHz
    VIC  15:  1440x480    59.940060 Hz  16:9     31.469 kHz     54.000000 MHz
    VIC  29:  1440x576    50.000000 Hz   4:3     31.250 kHz     54.000000 MHz
    VIC  30:  1440x576    50.000000 Hz  16:9     31.250 kHz     54.000000 MHz
  Audio Data Block:
    Linear PCM:
      Max channels: 2
      Supported sample rates (kHz): 96 48 44.1 32
      Supported sample sizes (bits): 24 20 16
  Speaker Allocation Data Block:
    FL/FR - Front Left/Right
  Vendor-Specific Data Block (HDMI), OUI 00-0C-03:
    Source physical address: 2.0.0.0
  Detailed Timing Descriptors:
    DTD  8:  2560x1440  143.855928 Hz  16:9    221.970 kHz    586.000000 MHz (597 mm x 336 mm)
                  Hfront    8 Hsync  32 Hback   40 Hpol P
                  Vfront   25 Vsync   8 Vback   70 Vpol P
    DTD  9:  1280x720    60.000000 Hz  16:9     45.000 kHz     74.250000 MHz (597 mm x 336 mm)
                  Hfront  110 Hsync  40 Hback  220 Hpol P
                  Vfront    5 Vsync   5 Vback   20 Vpol P
    DTD 10:  1280x720    50.000000 Hz  16:9     37.500 kHz     74.250000 MHz (597 mm x 336 mm)
                  Hfront  440 Hsync  40 Hback  220 Hpol P
                  Vfront    5 Vsync   5 Vback   20 Vpol P
    DTD 11:  2560x1440   59.950550 Hz  16:9     88.787 kHz    241.500000 MHz (597 mm x 336 mm)
                  Hfront   48 Hsync  32 Hback   80 Hpol P
                  Vfront    3 Vsync   5 Vback   33 Vpol P
    DTD 12:  2560x1440  119.878291 Hz  16:9    182.814 kHz    482.630000 MHz (597 mm x 336 mm)
                  Hfront    8 Hsync  32 Hback   40 Hpol P
                  Vfront    7 Vsync   8 Vback   70 Vpol P
Checksum: 0x95  Unused space in Extension Block: 9 bytes

----------------

Warnings:

Block 0, Base EDID:
  Display Range Limits: GTF support is deprecated in EDID 1.4.
Block 1, CTA-861 Extension Block:
  Add a Colorimetry Data Block with the sRGB colorimetry bit set to avoid interop issues.
Block 3, CTA-861 Extension Block:
  Add a Colorimetry Data Block with the sRGB colorimetry bit set to avoid interop issues.

Failures:

Block 0, Base EDID:
  Display Range Limits: GTF can't be combined with non-continuous frequencies.
Block 1, CTA-861 Extension Block:
  Vendor-Specific Data Block (HDMI), OUI 00-0C-03: The HDMI Specification requires EDID 1.3 instead of 1.4.
  Missing VCDB, needed for Set Selectable RGB Quantization to avoid interop issues.
Block 2, Base EDID:
  Unknown Extension Block.
Block 3, CTA-861 Extension Block:
  Video Data Block: Duplicate VIC 18.
  Video Data Block: Duplicate VIC 19.
  Video Data Block: Duplicate VIC 4.
  Video Data Block: Duplicate VIC 31.
  Video Data Block: Duplicate VIC 16.
  Video Data Block: Duplicate VIC 14.
  Video Data Block: Duplicate VIC 15.
  Video Data Block: Duplicate VIC 29.
  Video Data Block: Duplicate VIC 30.
  Speaker Allocation Data Block: Only one instance of this Data Block is allowed.
  Vendor-Specific Data Block (HDMI), OUI 00-0C-03: The HDMI Specification requires EDID 1.3 instead of 1.4.
  Missing VCDB, needed for Set Selectable RGB Quantization to avoid interop issues.
EDID:
  Base EDID: EDID specified 1 extension block(s), but found 3 extension block(s).
  CTA-861: Native progressive timings are a mix of several resolutions.

EDID conformity: FAIL
