edid-decode (hex):

00 ff ff ff ff ff ff 00 04 69 a7 27 00 00 00 00
0a 19 01 04 a5 3c 22 78 3b 87 e5 a4 56 50 9e 26
0d 50 54 b7 ef 00 d1 c0 d1 e8 81 c0 71 4f d1 de
81 de a9 c0 a9 de 56 5e 00 a0 a0 a0 29 50 30 20
35 00 55 50 21 00 00 1a 5b 8b 00 50 a0 a0 3f 50
08 20 18 0c 55 50 21 00 00 1a 00 00 00 fd 00 23
5a 87 87 3b 01 0a 20 20 20 20 20 20 00 00 00 fc
00 41 53 55 53 20 4d 47 32 37 39 0a 20 20 01 c9

02 03 16 f5 49 12 13 04 1f 90 0e 0f 1d 1e 23 09
07 07 83 01 00 00 e8 e4 00 50 a0 a0 67 50 08 20
f8 0c 55 50 21 00 00 1a 08 82 80 50 70 38 4d 40
08 20 f8 0c 55 50 21 00 00 1a 88 bc 00 50 a0 a0
55 50 08 20 f8 0c 55 50 21 00 00 1a 86 6f 80 a0
70 38 40 40 30 20 35 00 55 50 21 00 00 1a 53 52
80 a0 70 38 2f 40 30 20 35 00 55 50 21 00 00 1a
00 00 00 00 00 00 00 00 00 00 00 00 00 00 00 97

----------------

Block 0, Base EDID:
  EDID Structure Version & Revision: 1.4
  Vendor & Product Identification:
    Manufacturer: ACI
    Model: 10151
    Made in: week 10 of 2015
  Basic Display Parameters & Features:
    Digital display
    Bits per primary color channel: 8
    DisplayPort interface
    Maximum image size: 60 cm x 34 cm
    Gamma: 2.20
    DPMS levels: Off
    Supported color formats: RGB 4:4:4, YCrCb 4:4:4, YCrCb 4:2:2
    First detailed timing includes the native pixel format and preferred refresh rate
    Display is continuous frequency
  Color Characteristics:
    Red  : 0.6425, 0.3359
    Green: 0.3134, 0.6201
    Blue : 0.1513, 0.0527
    White: 0.3134, 0.3291
  Established Timings I & II:
    IBM     :   720x400    70.082 Hz   9:5    31.467 kHz  28.320 MHz
    DMT 0x04:   640x480    59.940 Hz   4:3    31.469 kHz  25.175 MHz
    Apple   :   640x480    66.667 Hz   4:3    35.000 kHz  30.240 MHz
    DMT 0x06:   640x480    75.000 Hz   4:3    37.500 kHz  31.500 MHz
    DMT 0x08:   800x600    56.250 Hz   4:3    35.156 kHz  36.000 MHz
    DMT 0x09:   800x600    60.317 Hz   4:3    37.879 kHz  40.000 MHz
    DMT 0x0a:   800x600    72.188 Hz   4:3    48.077 kHz  50.000 MHz
    DMT 0x0b:   800x600    75.000 Hz   4:3    46.875 kHz  49.500 MHz
    Apple   :   832x624    74.551 Hz   4:3    49.726 kHz  57.284 MHz
    DMT 0x10:  1024x768    60.004 Hz   4:3    48.363 kHz  65.000 MHz
    DMT 0x11:  1024x768    70.069 Hz   4:3    56.476 kHz  75.000 MHz
    DMT 0x12:  1024x768    75.029 Hz   4:3    60.023 kHz  78.750 MHz
    DMT 0x24:  1280x1024   75.025 Hz   5:4    79.976 kHz 135.000 MHz
  Standard Timings:
    DMT 0x52:  1920x1080   60.000 Hz  16:9    67.500 kHz 148.500 MHz
    CVT     :  1920x1080   99.898 Hz  16:9   114.583 kHz 302.500 MHz (EDID 1.4 source)
    GTF     :  1920x1080  100.000 Hz  16:9   114.400 kHz 302.016 MHz (EDID 1.3 source)
    DMT 0x55:  1280x720    60.000 Hz  16:9    45.000 kHz  74.250 MHz
    DMT 0x15:  1152x864    75.000 Hz   4:3    67.500 kHz 108.000 MHz
    CVT     :  1920x1080   89.926 Hz  16:9   102.515 kHz 269.000 MHz (EDID 1.4 source)
    GTF     :  1920x1080   90.000 Hz  16:9   102.330 kHz 270.151 MHz (EDID 1.3 source)
    CVT     :  1280x720    89.804 Hz  16:9    68.341 kHz 117.000 MHz (EDID 1.4 source)
    GTF     :  1280x720    90.000 Hz  16:9    68.310 kHz 118.040 MHz (EDID 1.3 source)
    DMT 0x53:  1600x900    60.000 Hz  16:9    60.000 kHz 108.000 MHz (RB)
    CVT     :  1600x904    89.867 Hz  16:9    85.823 kHz 186.750 MHz (EDID 1.4 source)
    GTF     :  1600x904    90.000 Hz  16:9    85.680 kHz 186.440 MHz (EDID 1.3 source)
  Detailed Timing Descriptors:
    DTD 1:  2560x1440   59.951 Hz  16:9    88.787 kHz 241.500 MHz (597 mm x 336 mm)
                 Hfront   48 Hsync  32 Hback  80 Hpol P
                 Vfront    3 Vsync   5 Vback  33 Vpol N
    DTD 2:  2560x1440   89.909 Hz  16:9   135.133 kHz 356.750 MHz (597 mm x 336 mm)
                 Hfront    8 Hsync  32 Hback  40 Hpol P
                 Vfront   49 Vsync   8 Vback   6 Vpol N
  Display Range Limits:
    Monitor ranges (Bare Limits): 35-90 Hz V, 135-135 kHz H, max dotclock 590 MHz
    Display Product Name: 'ASUS MG279'
  Extension blocks: 1
Checksum: 0xc9

----------------

Block 1, CTA-861 Extension Block:
  Revision: 3
  Underscans PC formats by default
  Basic audio support
  Supports YCbCr 4:4:4
  Supports YCbCr 4:2:2
  Native detailed modes: 5
  Video Data Block:
    VIC  18:   720x576    50.000 Hz  16:9    31.250 kHz  27.000 MHz
    VIC  19:  1280x720    50.000 Hz  16:9    37.500 kHz  74.250 MHz
    VIC   4:  1280x720    60.000 Hz  16:9    45.000 kHz  74.250 MHz
    VIC  31:  1920x1080   50.000 Hz  16:9    56.250 kHz 148.500 MHz
    VIC  16:  1920x1080   60.000 Hz  16:9    67.500 kHz 148.500 MHz (native)
    VIC  14:  1440x480    59.940 Hz   4:3    31.469 kHz  54.000 MHz
    VIC  15:  1440x480    59.940 Hz  16:9    31.469 kHz  54.000 MHz
    VIC  29:  1440x576    50.000 Hz   4:3    31.250 kHz  54.000 MHz
    VIC  30:  1440x576    50.000 Hz  16:9    31.250 kHz  54.000 MHz
  Audio Data Block:
    Linear PCM:
      Max channels: 2
      Supported sample rates (kHz): 48 44.1 32
      Supported sample sizes (bits): 24 20 16
  Speaker Allocation Data Block:
    FL/FR - Front Left/Right
  Detailed Timing Descriptors:
    DTD 3:  2560x1440  143.856 Hz  16:9   221.970 kHz 586.000 MHz (597 mm x 336 mm)
                 Hfront    8 Hsync  32 Hback  40 Hpol P
                 Vfront   63 Vsync   8 Vback  32 Vpol N
    DTD 4:  1920x1080  143.855 Hz  16:9   166.440 kHz 332.880 MHz (597 mm x 336 mm)
                 Hfront    8 Hsync  32 Hback  40 Hpol P
                 Vfront   63 Vsync   8 Vback   6 Vpol N
    DTD 5:  2560x1440  119.881 Hz  16:9   182.818 kHz 482.640 MHz (597 mm x 336 mm)
                 Hfront    8 Hsync  32 Hback  40 Hpol P
                 Vfront   63 Vsync   8 Vback  14 Vpol N
    DTD 6:  1920x1080  119.982 Hz  16:9   137.260 kHz 285.500 MHz (597 mm x 336 mm)
                 Hfront   48 Hsync  32 Hback  80 Hpol P
                 Vfront    3 Vsync   5 Vback  56 Vpol N
    DTD 7:  1920x1080   89.904 Hz  16:9   101.322 kHz 210.750 MHz (597 mm x 336 mm)
                 Hfront   48 Hsync  32 Hback  80 Hpol P
                 Vfront    3 Vsync   5 Vback  39 Vpol N
Checksum: 0x97

----------------

Warnings:

All Blocks:
  Some timings are out of range of the Monitor Ranges:
    Vertical Freq: 50.000 - 143.856 Hz (Monitor: 35.000 - 90.000 Hz)
    Horizontal Freq: 31.250 - 221.969 kHz (Monitor: 135.000 - 135.000 kHz)

Failures:

All Blocks:
  GTF timings are used, but the EDID does not signal GTF support.
  CVT timings are used, but the EDID does not signal CVT support.

EDID conformity: FAIL
