
EDID (hex):
00ffffffffffff004dd9002501010101
210f01030c261e78ead855a359489924
125054adcf0081808140010101010101
010101010101302a009851002a403070
1300782d1100001e000000fd00304b1c
510e000a202020202020000000fc0053
444d2d48533935500a202020000000ff
00363632333333300a202020202000d2

Extracted contents:
header:          00 ff ff ff ff ff ff 00
serial number:   4d d9 00 25 01 01 01 01 21 0f
version:         01 03
basic params:    0c 26 1e 78 ea
chroma info:     d8 55 a3 59 48 99 24 12 50 54
established:     ad cf 00
standard:        81 80 81 40 01 01 01 01 01 01 01 01 01 01 01 01
descriptor 1:    30 2a 00 98 51 00 2a 40 30 70 13 00 78 2d 11 00 00 1e
descriptor 2:    00 00 00 fd 00 30 4b 1c 51 0e 00 0a 20 20 20 20 20 20
descriptor 3:    00 00 00 fc 00 53 44 4d 2d 48 53 39 35 50 0a 20 20 20
descriptor 4:    00 00 00 ff 00 36 36 32 33 33 33 30 0a 20 20 20 20 20
extensions:      00
checksum:        d2

EDID version: 1.3
Manufacturer: SNY Model 2500 Serial Number --
Analog display, Input voltage level: 0.7/0.3 V
Sync: Separate Composite 
Maximum image size: 38 cm x 30 cm
Gamma: 2.20
DPMS levels: Standby Suspend Off
RGB color display
First detailed timing is preferred timing
Display x,y Chromaticity:
  Red:   0.6396, 0.3486
  Green: 0.2832, 0.5976
  Blue:  0.1416, 0.0712
  White: 0.3134, 0.3291
Established timings supported:
  720x400@70Hz 9:5 HorFreq: 31469 Hz Clock: 28.320 MHz
  640x480@60Hz 4:3 HorFreq: 31469 Hz Clock: 25.175 MHz
  640x480@72Hz 4:3 HorFreq: 37900 Hz Clock: 31.500 MHz
  640x480@75Hz 4:3 HorFreq: 37500 Hz Clock: 31.500 MHz
  800x600@60Hz 4:3 HorFreq: 37900 Hz Clock: 40.000 MHz
  800x600@72Hz 4:3 HorFreq: 48100 Hz Clock: 50.000 MHz
  800x600@75Hz 4:3 HorFreq: 46900 Hz Clock: 49.500 MHz
  1024x768@60Hz 4:3 HorFreq: 48400 Hz Clock: 65.000 MHz
  1024x768@70Hz 4:3 HorFreq: 56500 Hz Clock: 75.000 MHz
  1024x768@75Hz 4:3 HorFreq: 60000 Hz Clock: 78.750 MHz
  1280x1024@75Hz 5:4 HorFreq: 80000 Hz Clock: 135.000 MHz
Standard timings supported:
  1280x1024@60Hz 5:4 HorFreq: 64000 Hz Clock: 108.000 MHz
  1280x960@60Hz 4:3 HorFreq: 60000 Hz Clock: 108.000 MHz
Detailed mode: Clock 108.000 MHz, 376 mm x 301 mm
               1280 1328 1440 1688 hborder 0
               1024 1025 1028 1066 vborder 0
               +hsync +vsync 
               VertFreq: 60 Hz, HorFreq: 63981 Hz
Monitor ranges (GTF): 48-75Hz V, 28-81kHz H, max dotclock 140MHz
Monitor name: SDM-HS95P
Serial number: --
Checksum: 0xd2 (valid)
EDID block does not conform at all!
	Bad year of manufacture
