
EDID (hex):
00ffffffffffff001e6da05773c80300
0b1501036c301b78ea3335a5554d9d25
115054a54b00b3008180818f714f0101
010101010101023a801871382d40582c
4500dd0c1100001a000000fd00384b1e
530f000a202020202020000000fc0057
323234300a20202020202020000000ff
003131314e444d5437393932330a00f4

Extracted contents:
header:          00 ff ff ff ff ff ff 00
serial number:   1e 6d a0 57 73 c8 03 00 0b 15
version:         01 03
basic params:    6c 30 1b 78 ea
chroma info:     33 35 a5 55 4d 9d 25 11 50 54
established:     a5 4b 00
standard:        b3 00 81 80 81 8f 71 4f 01 01 01 01 01 01 01 01
descriptor 1:    02 3a 80 18 71 38 2d 40 58 2c 45 00 dd 0c 11 00 00 1a
descriptor 2:    00 00 00 fd 00 38 4b 1e 53 0f 00 0a 20 20 20 20 20 20
descriptor 3:    00 00 00 fc 00 57 32 32 34 30 0a 20 20 20 20 20 20 20
descriptor 4:    00 00 00 ff 00 31 31 31 4e 44 4d 54 37 39 39 32 33 0a
extensions:      00
checksum:        f4

EDID version: 1.3
Manufacturer: GSM Model 57a0 Serial Number --
Made in week 11 of 2011
Analog display, Input voltage level: 0.7/0.7 V
Sync: Separate Composite 
Maximum image size: 48 cm x 27 cm
Gamma: 2.20
DPMS levels: Standby Suspend Off
RGB color display
First detailed timing is preferred timing
Display x,y Chromaticity:
  Red:   0.6445, 0.3349
  Green: 0.3007, 0.6162
  Blue:  0.1445, 0.0693
  White: 0.3134, 0.3291
Established timings supported:
  720x400@70Hz 9:5 HorFreq: 31469 Hz Clock: 28.320 MHz
  640x480@60Hz 4:3 HorFreq: 31469 Hz Clock: 25.175 MHz
  640x480@75Hz 4:3 HorFreq: 37500 Hz Clock: 31.500 MHz
  800x600@60Hz 4:3 HorFreq: 37900 Hz Clock: 40.000 MHz
  800x600@75Hz 4:3 HorFreq: 46900 Hz Clock: 49.500 MHz
  1024x768@60Hz 4:3 HorFreq: 48400 Hz Clock: 65.000 MHz
  1024x768@75Hz 4:3 HorFreq: 60000 Hz Clock: 78.750 MHz
  1280x1024@75Hz 5:4 HorFreq: 80000 Hz Clock: 135.000 MHz
Standard timings supported:
  1680x1050@60Hz 16:10 HorFreq: 64700 Hz Clock: 119.000 MHz
  1280x1024@60Hz 5:4 HorFreq: 64000 Hz Clock: 108.000 MHz
  1280x1024@75Hz 5:4 HorFreq: 80000 Hz Clock: 135.000 MHz
  1152x864@75Hz 4:3 HorFreq: 67500 Hz Clock: 108.000 MHz
Detailed mode: Clock 148.500 MHz, 477 mm x 268 mm
               1920 2008 2052 2200 hborder 0
               1080 1084 1089 1125 vborder 0
               +hsync -vsync 
               VertFreq: 60 Hz, HorFreq: 67500 Hz
Monitor ranges (GTF): 56-75Hz V, 30-83kHz H, max dotclock 150MHz
Monitor name: W2240
Serial number: --
Checksum: 0xf4 (valid)
