edid-decode (hex):

00 ff ff ff ff ff ff 00 10 ac 16 40 34 41 32 47
26 10 01 03 80 40 28 78 28 fe 87 a3 57 4a 9c 25
13 50 54 00 00 00 01 01 01 01 01 01 01 01 01 01
01 01 01 01 01 01 bc 1b 00 a0 50 20 17 30 30 20
36 00 86 96 21 00 00 1a b0 68 00 a0 a0 40 2e 60
30 20 36 00 86 96 21 00 00 1e 00 00 00 fc 00 44
45 4c 4c 20 33 30 30 37 57 46 50 0a 00 00 00 ff
00 46 4b 32 38 35 36 39 4a 47 32 41 34 0a 00 03

----------------

Block 0, Base EDID:
  EDID Structure Version & Revision: 1.3
  Vendor & Product Identification:
    Manufacturer: DEL
    Model: 16406
    Serial Number: ...
    Made in: week 38 of 2006
  Basic Display Parameters & Features:
    Digital display
    Maximum image size: 64 cm x 40 cm
    Gamma: 2.20
    DPMS levels: Off
    RGB color display
  Color Characteristics:
    Red  : 0.6396, 0.3427
    Green: 0.2919, 0.6113
    Blue : 0.1464, 0.0742
    White: 0.3134, 0.3310
  Established Timings I & II: none
  Standard Timings: none
  Detailed Timing Descriptors:
    DTD 1:  1280x800    59.909545 Hz   8:5     49.306 kHz     71.000000 MHz (646 mm x 406 mm)
                 Hfront   48 Hsync  32 Hback   80 Hpol P
                 Vfront    3 Vsync   6 Vback   14 Vpol N
    DTD 2:  2560x1600   59.859910 Hz   8:5     98.529 kHz    268.000000 MHz (646 mm x 406 mm)
                 Hfront   48 Hsync  32 Hback   80 Hpol P
                 Vfront    3 Vsync   6 Vback   37 Vpol P
    Display Product Name: 'DELL 3007WFP'
    Display Product Serial Number: ...
Checksum: 0x03

----------------

Failures:

Block 0, Base EDID:
  Basic Display Parameters & Features: EDID 1.3 requires that the first detailed timing is the preferred timing.
  Missing Display Range Limits Descriptor.

EDID conformity: FAIL
