
EDID (hex):
00ffffffffffff0026cd0f5632040000
0816010380301e782a78f1a655489b26
125054bfef00714f818081409500950f
01010101010121399030621a274068b0
3600de2c1100001c000000ff00313130
31315332323031303734000000fd0037
4c1e530f000a202020202020000000fc
00504c32323036570a202020202000ff

Extracted contents:
header:          00 ff ff ff ff ff ff 00
serial number:   26 cd 0f 56 32 04 00 00 08 16
version:         01 03
basic params:    80 30 1e 78 2a
chroma info:     78 f1 a6 55 48 9b 26 12 50 54
established:     bf ef 00
standard:        71 4f 81 80 81 40 95 00 95 0f 01 01 01 01 01 01
descriptor 1:    21 39 90 30 62 1a 27 40 68 b0 36 00 de 2c 11 00 00 1c
descriptor 2:    00 00 00 ff 00 31 31 30 31 31 53 32 32 30 31 30 37 34
descriptor 3:    00 00 00 fd 00 37 4c 1e 53 0f 00 0a 20 20 20 20 20 20
descriptor 4:    00 00 00 fc 00 50 4c 32 32 30 36 57 0a 20 20 20 20 20
extensions:      00
checksum:        ff

EDID version: 1.3
Manufacturer: IVM Model 560f Serial Number --
Made in week 8 of 2012
Digital display
Maximum image size: 48 cm x 30 cm
Gamma: 2.20
DPMS levels: Off
RGB color display
First detailed timing is preferred timing
Display x,y Chromaticity:
  Red:   0.6494, 0.3349
  Green: 0.2832, 0.6054
  Blue:  0.1513, 0.0732
  White: 0.3125, 0.3291
Established timings supported:
  720x400@70Hz 9:5 HorFreq: 31469 Hz Clock: 28.320 MHz
  640x480@60Hz 4:3 HorFreq: 31469 Hz Clock: 25.175 MHz
  640x480@67Hz 4:3 HorFreq: 35000 Hz Clock: 30.240 MHz
  640x480@72Hz 4:3 HorFreq: 37900 Hz Clock: 31.500 MHz
  640x480@75Hz 4:3 HorFreq: 37500 Hz Clock: 31.500 MHz
  800x600@56Hz 4:3 HorFreq: 35200 Hz Clock: 36.000 MHz
  800x600@60Hz 4:3 HorFreq: 37900 Hz Clock: 40.000 MHz
  800x600@72Hz 4:3 HorFreq: 48100 Hz Clock: 50.000 MHz
  800x600@75Hz 4:3 HorFreq: 46900 Hz Clock: 49.500 MHz
  832x624@75Hz 4:3 HorFreq: 49726 Hz Clock: 57.284 MHz
  1024x768@60Hz 4:3 HorFreq: 48400 Hz Clock: 65.000 MHz
  1024x768@70Hz 4:3 HorFreq: 56500 Hz Clock: 75.000 MHz
  1024x768@75Hz 4:3 HorFreq: 60000 Hz Clock: 78.750 MHz
  1280x1024@75Hz 5:4 HorFreq: 80000 Hz Clock: 135.000 MHz
Standard timings supported:
  1152x864@75Hz 4:3 HorFreq: 67500 Hz Clock: 108.000 MHz
  1280x1024@60Hz 5:4 HorFreq: 64000 Hz Clock: 108.000 MHz
  1280x960@60Hz 4:3 HorFreq: 60000 Hz Clock: 108.000 MHz
  1440x900@60Hz 16:10 HorFreq: 55500 Hz Clock: 88.750 MHz
  1440x900@75Hz 16:10 HorFreq: 82300 Hz Clock: 156.000 MHz
Detailed mode: Clock 146.250 MHz, 478 mm x 300 mm
               1680 1784 1960 2240 hborder 0
               1050 1053 1059 1089 vborder 0
               -hsync +vsync 
               VertFreq: 59 Hz, HorFreq: 65290 Hz
Serial number: --
Monitor ranges (GTF): 55-76Hz V, 30-83kHz H, max dotclock 150MHz
Monitor name: PL2206W
Checksum: 0xff (valid)
One or more of the timings is out of range of the Monitor Ranges:
  Vertical Freq: 56 - 75 Hz
  Horizontal Freq: 31469 - 82300 Hz
  Maximum Clock: 156.000 MHz


