edid-decode (hex):

00 ff ff ff ff ff ff 00 5a 63 3a fc 01 01 01 01
07 1f 01 04 b5 50 22 78 3f 96 e5 a3 55 53 9f 25
0a 50 54 bf ef 80 d1 c0 e1 c0 d1 00 b3 00 a9 40
a9 c0 81 80 81 00 e7 7c 70 a0 d0 a0 29 50 30 20
3a 00 20 4f 31 00 00 1e 00 00 00 ff 00 57 43 4b
32 31 30 37 30 30 33 38 30 0a 00 00 00 fd 00 30
4c 78 78 3c 01 0a 20 20 20 20 20 20 00 00 00 fc
00 56 41 33 34 35 36 2d 57 51 48 44 0a 20 01 5e

02 03 32 f0 51 01 02 03 04 05 06 07 10 11 12 13
14 15 16 1f 59 5a 23 09 7f 07 83 01 00 00 68 1a
00 00 01 01 30 4b 00 e3 05 e3 01 e6 06 07 01 61
61 01 4e ab 70 b8 d1 a0 42 50 90 60 64 08 20 4f
31 00 00 1e e9 75 00 a0 a0 a0 29 50 30 20 35 00
20 4f 31 00 00 1e 56 5e 00 a0 a0 a0 29 50 30 20
35 00 20 4f 31 00 00 1a 60 86 70 b0 d4 a0 2c 50
e8 70 3a 10 20 4f 31 00 00 1c 00 00 00 00 00 85

00 ff ff ff ff ff ff 00 5a 63 3a fc 01 01 01 01
07 1f 01 04 b5 50 22 78 3f 96 e5 a3 55 53 9f 25
0a 50 54 bf ef 80 d1 c0 e1 c0 d1 00 b3 00 a9 40
a9 c0 81 80 81 00 e7 7c 70 a0 d0 a0 29 50 30 20
3a 00 20 4f 31 00 00 1e 00 00 00 ff 00 57 43 4b
32 31 30 37 30 30 33 38 30 0a 00 00 00 fd 00 30
4c 78 78 3c 01 0a 20 20 20 20 20 20 00 00 00 fc
00 56 41 33 34 35 36 2d 57 51 48 44 0a 20 01 5e

02 03 32 f0 51 01 02 03 04 05 06 07 10 11 12 13
14 15 16 1f 59 5a 23 09 7f 07 83 01 00 00 68 1a
00 00 01 01 30 4b 00 e3 05 e3 01 e6 06 07 01 61
61 01 4e ab 70 b8 d1 a0 42 50 90 60 64 08 20 4f
31 00 00 1e e9 75 00 a0 a0 a0 29 50 30 20 35 00
20 4f 31 00 00 1e 56 5e 00 a0 a0 a0 29 50 30 20
35 00 20 4f 31 00 00 1a 60 86 70 b0 d4 a0 2c 50
e8 70 3a 10 20 4f 31 00 00 1c 00 00 00 00 00 85

----------------

Block 0, Base EDID:
  EDID Structure Version & Revision: 1.4
  Vendor & Product Identification:
    Manufacturer: VSC
    Model: 64570
    Serial Number: ...
    Made in: week 7 of 2021
  Basic Display Parameters & Features:
    Digital display
    Bits per primary color channel: 10
    DisplayPort interface
    Maximum image size: 80 cm x 34 cm
    Gamma: 2.20
    DPMS levels: Off
    Supported color formats: RGB 4:4:4, YCrCb 4:4:4, YCrCb 4:2:2
    Default (sRGB) color space is primary color space
    First detailed timing includes the native pixel format and preferred refresh rate
    Display is continuous frequency
  Color Characteristics:
    Red  : 0.6386, 0.3330
    Green: 0.3251, 0.6230
    Blue : 0.1474, 0.0410
    White: 0.3134, 0.3291
  Established Timings I & II:
    IBM     :   720x400    70.081663 Hz   9:5     31.467 kHz     28.320000 MHz
    DMT 0x04:   640x480    59.940476 Hz   4:3     31.469 kHz     25.175000 MHz
    Apple   :   640x480    66.666667 Hz   4:3     35.000 kHz     30.240000 MHz
    DMT 0x05:   640x480    72.808802 Hz   4:3     37.861 kHz     31.500000 MHz
    DMT 0x06:   640x480    75.000000 Hz   4:3     37.500 kHz     31.500000 MHz
    DMT 0x08:   800x600    56.250000 Hz   4:3     35.156 kHz     36.000000 MHz
    DMT 0x09:   800x600    60.316541 Hz   4:3     37.879 kHz     40.000000 MHz
    DMT 0x0a:   800x600    72.187572 Hz   4:3     48.077 kHz     50.000000 MHz
    DMT 0x0b:   800x600    75.000000 Hz   4:3     46.875 kHz     49.500000 MHz
    Apple   :   832x624    74.551266 Hz   4:3     49.726 kHz     57.284000 MHz
    DMT 0x10:  1024x768    60.003840 Hz   4:3     48.363 kHz     65.000000 MHz
    DMT 0x11:  1024x768    70.069359 Hz   4:3     56.476 kHz     75.000000 MHz
    DMT 0x12:  1024x768    75.028582 Hz   4:3     60.023 kHz     78.750000 MHz
    DMT 0x24:  1280x1024   75.024675 Hz   5:4     79.976 kHz    135.000000 MHz
    Apple   :  1152x870    75.061550 Hz 192:145   68.681 kHz    100.000000 MHz
  Standard Timings:
    DMT 0x52:  1920x1080   60.000000 Hz  16:9     67.500 kHz    148.500000 MHz
    DMT 0x54:  2048x1152   60.000000 Hz  16:9     72.000 kHz    162.000000 MHz (RB)
    DMT 0x45:  1920x1200   59.884600 Hz  16:10    74.556 kHz    193.250000 MHz
    DMT 0x3a:  1680x1050   59.954250 Hz  16:10    65.290 kHz    146.250000 MHz
    DMT 0x33:  1600x1200   60.000000 Hz   4:3     75.000 kHz    162.000000 MHz
    DMT 0x53:  1600x900    60.000000 Hz  16:9     60.000 kHz    108.000000 MHz (RB)
    DMT 0x23:  1280x1024   60.019740 Hz   5:4     63.981 kHz    108.000000 MHz
    DMT 0x1c:  1280x800    59.810326 Hz  16:10    49.702 kHz     83.500000 MHz
  Detailed Timing Descriptors:
    DTD 1:  3440x1440   59.972616 Hz  43:18    88.819 kHz    319.750000 MHz (800 mm x 335 mm)
                 Hfront   48 Hsync  32 Hback   80 Hpol P
                 Vfront    3 Vsync  10 Vback   28 Vpol P
    Display Product Serial Number: ...
    Display Range Limits:
      Monitor ranges (Bare Limits): 48-76 Hz V, 120-120 kHz H, max dotclock 600 MHz
    Display Product Name: 'VA3456-WQHD'
  Extension blocks: 1
Checksum: 0x5e

----------------

Block 1, CTA-861 Extension Block:
  Revision: 3
  Underscans IT Video Formats by default
  Basic audio support
  Supports YCbCr 4:4:4
  Supports YCbCr 4:2:2
  Native detailed modes: 0
  Video Data Block:
    VIC   1:   640x480    59.940476 Hz   4:3     31.469 kHz     25.175000 MHz
    VIC   2:   720x480    59.940060 Hz   4:3     31.469 kHz     27.000000 MHz
    VIC   3:   720x480    59.940060 Hz  16:9     31.469 kHz     27.000000 MHz
    VIC   4:  1280x720    60.000000 Hz  16:9     45.000 kHz     74.250000 MHz
    VIC   5:  1920x1080i  60.000000 Hz  16:9     33.750 kHz     74.250000 MHz
    VIC   6:  1440x480i   59.940060 Hz   4:3     15.734 kHz     27.000000 MHz
    VIC   7:  1440x480i   59.940060 Hz  16:9     15.734 kHz     27.000000 MHz
    VIC  16:  1920x1080   60.000000 Hz  16:9     67.500 kHz    148.500000 MHz
    VIC  17:   720x576    50.000000 Hz   4:3     31.250 kHz     27.000000 MHz
    VIC  18:   720x576    50.000000 Hz  16:9     31.250 kHz     27.000000 MHz
    VIC  19:  1280x720    50.000000 Hz  16:9     37.500 kHz     74.250000 MHz
    VIC  20:  1920x1080i  50.000000 Hz  16:9     28.125 kHz     74.250000 MHz
    VIC  21:  1440x576i   50.000000 Hz   4:3     15.625 kHz     27.000000 MHz
    VIC  22:  1440x576i   50.000000 Hz  16:9     15.625 kHz     27.000000 MHz
    VIC  31:  1920x1080   50.000000 Hz  16:9     56.250 kHz    148.500000 MHz
    VIC  89:  2560x1080   50.000000 Hz  64:27    56.250 kHz    185.625000 MHz
    VIC  90:  2560x1080   60.000000 Hz  64:27    66.000 kHz    198.000000 MHz
  Audio Data Block:
    Linear PCM:
      Max channels: 2
      Supported sample rates (kHz): 192 176.4 96 88.2 48 44.1 32
      Supported sample sizes (bits): 24 20 16
  Speaker Allocation Data Block:
    FL/FR - Front Left/Right
  Vendor-Specific Data Block (AMD), OUI 00-00-1A:
    Version: 1.1
    Minimum Refresh Rate: 48 Hz
    Maximum Refresh Rate: 75 Hz
    Flags 1.x: 0x00
  Colorimetry Data Block:
    xvYCC601
    xvYCC709
    BT2020cYCC
    BT2020YCC
    BT2020RGB
    Gamut Boundary Description Metadata Profile P0
  HDR Static Metadata Data Block:
    Electro optical transfer functions:
      Traditional gamma - SDR luminance range
      Traditional gamma - HDR luminance range
      SMPTE ST2084
    Supported static metadata descriptors:
      Static metadata type 1
    Desired content max luminance: 97 (408.759 cd/m^2)
    Desired content max frame-average luminance: 97 (408.759 cd/m^2)
    Desired content min luminance: 1 (0.000 cd/m^2)
  Detailed Timing Descriptors:
    DTD 2:  3440x1440   75.050314 Hz  43:18   113.026 kHz    438.540000 MHz (800 mm x 335 mm)
                 Hfront  144 Hsync  96 Hback  200 Hpol P
                 Vfront   38 Vsync   4 Vback   24 Vpol P
    DTD 3:  2560x1440   74.931982 Hz  16:9    110.974 kHz    301.850000 MHz (800 mm x 335 mm)
                 Hfront   48 Hsync  32 Hback   80 Hpol P
                 Vfront    3 Vsync   5 Vback   33 Vpol P
    DTD 4:  2560x1440   59.950550 Hz  16:9     88.787 kHz    241.500000 MHz (800 mm x 335 mm)
                 Hfront   48 Hsync  32 Hback   80 Hpol P
                 Vfront    3 Vsync   5 Vback   33 Vpol N
    DTD 5:  3440x1440   49.958175 Hz  43:18    74.138 kHz    344.000000 MHz (800 mm x 335 mm)
                 Hfront  232 Hsync 368 Hback  600 Hpol N
                 Vfront    3 Vsync  10 Vback   31 Vpol P
Checksum: 0x85  Unused space in Extension Block: 5 bytes

----------------

Block 2, Unknown EDID Extension Block 0x00:
  00 ff ff ff ff ff ff 00 5a 63 3a fc 01 01 01 01 '........Zc:.....'
  07 1f 01 04 b5 50 22 78 3f 96 e5 a3 55 53 9f 25 '.....P"x?...US.%'
  0a 50 54 bf ef 80 d1 c0 e1 c0 d1 00 b3 00 a9 40 '.PT............@'
  a9 c0 81 80 81 00 e7 7c 70 a0 d0 a0 29 50 30 20 '.......|p...)P0 '
  3a 00 20 4f 31 00 00 1e 00 00 00 ff 00 57 43 4b ':. O1........WCK'
  32 31 30 37 30 30 33 38 30 0a 00 00 00 fd 00 30 '210700380......0'
  4c 78 78 3c 01 0a 20 20 20 20 20 20 00 00 00 fc 'Lxx<..      ....'
  00 56 41 33 34 35 36 2d 57 51 48 44 0a 20 01 5e '.VA3456-WQHD. .^'
Checksum: 0x5e

----------------

Block 3, CTA-861 Extension Block:
  Revision: 3
  Underscans IT Video Formats by default
  Basic audio support
  Supports YCbCr 4:4:4
  Supports YCbCr 4:2:2
  Native detailed modes: 0
  Video Data Block:
    VIC   1:   640x480    59.940476 Hz   4:3     31.469 kHz     25.175000 MHz
    VIC   2:   720x480    59.940060 Hz   4:3     31.469 kHz     27.000000 MHz
    VIC   3:   720x480    59.940060 Hz  16:9     31.469 kHz     27.000000 MHz
    VIC   4:  1280x720    60.000000 Hz  16:9     45.000 kHz     74.250000 MHz
    VIC   5:  1920x1080i  60.000000 Hz  16:9     33.750 kHz     74.250000 MHz
    VIC   6:  1440x480i   59.940060 Hz   4:3     15.734 kHz     27.000000 MHz
    VIC   7:  1440x480i   59.940060 Hz  16:9     15.734 kHz     27.000000 MHz
    VIC  16:  1920x1080   60.000000 Hz  16:9     67.500 kHz    148.500000 MHz
    VIC  17:   720x576    50.000000 Hz   4:3     31.250 kHz     27.000000 MHz
    VIC  18:   720x576    50.000000 Hz  16:9     31.250 kHz     27.000000 MHz
    VIC  19:  1280x720    50.000000 Hz  16:9     37.500 kHz     74.250000 MHz
    VIC  20:  1920x1080i  50.000000 Hz  16:9     28.125 kHz     74.250000 MHz
    VIC  21:  1440x576i   50.000000 Hz   4:3     15.625 kHz     27.000000 MHz
    VIC  22:  1440x576i   50.000000 Hz  16:9     15.625 kHz     27.000000 MHz
    VIC  31:  1920x1080   50.000000 Hz  16:9     56.250 kHz    148.500000 MHz
    VIC  89:  2560x1080   50.000000 Hz  64:27    56.250 kHz    185.625000 MHz
    VIC  90:  2560x1080   60.000000 Hz  64:27    66.000 kHz    198.000000 MHz
  Audio Data Block:
    Linear PCM:
      Max channels: 2
      Supported sample rates (kHz): 192 176.4 96 88.2 48 44.1 32
      Supported sample sizes (bits): 24 20 16
  Speaker Allocation Data Block:
    FL/FR - Front Left/Right
  Vendor-Specific Data Block (AMD), OUI 00-00-1A:
    Version: 1.1
    Minimum Refresh Rate: 48 Hz
    Maximum Refresh Rate: 75 Hz
    Flags 1.x: 0x00
  Colorimetry Data Block:
    xvYCC601
    xvYCC709
    BT2020cYCC
    BT2020YCC
    BT2020RGB
    Gamut Boundary Description Metadata Profile P0
  HDR Static Metadata Data Block:
    Electro optical transfer functions:
      Traditional gamma - SDR luminance range
      Traditional gamma - HDR luminance range
      SMPTE ST2084
    Supported static metadata descriptors:
      Static metadata type 1
    Desired content max luminance: 97 (408.759 cd/m^2)
    Desired content max frame-average luminance: 97 (408.759 cd/m^2)
    Desired content min luminance: 1 (0.000 cd/m^2)
  Detailed Timing Descriptors:
    DTD 6:  3440x1440   75.050314 Hz  43:18   113.026 kHz    438.540000 MHz (800 mm x 335 mm)
                 Hfront  144 Hsync  96 Hback  200 Hpol P
                 Vfront   38 Vsync   4 Vback   24 Vpol P
    DTD 7:  2560x1440   74.931982 Hz  16:9    110.974 kHz    301.850000 MHz (800 mm x 335 mm)
                 Hfront   48 Hsync  32 Hback   80 Hpol P
                 Vfront    3 Vsync   5 Vback   33 Vpol P
    DTD 8:  2560x1440   59.950550 Hz  16:9     88.787 kHz    241.500000 MHz (800 mm x 335 mm)
                 Hfront   48 Hsync  32 Hback   80 Hpol P
                 Vfront    3 Vsync   5 Vback   33 Vpol N
    DTD 9:  3440x1440   49.958175 Hz  43:18    74.138 kHz    344.000000 MHz (800 mm x 335 mm)
                 Hfront  232 Hsync 368 Hback  600 Hpol N
                 Vfront    3 Vsync  10 Vback   31 Vpol P
Checksum: 0x85  Unused space in Extension Block: 5 bytes

----------------

Warnings:

Block 1, CTA-861 Extension Block:
  Video Data Block: VIC 1 is the preferred timing, overriding the first detailed timings. Is this intended?
  Display Product Serial Number is set, so the Serial Number in the Base EDID should be 0.
Block 3, CTA-861 Extension Block:
  Display Product Serial Number is set, so the Serial Number in the Base EDID should be 0.
EDID:
  Base EDID: Some timings are out of range of the Monitor Ranges:
    Horizontal Freq: 15.625 - 113.025 kHz (Monitor: 120.000 - 120.000 kHz)

Failures:

Block 0, Base EDID:
  Basic Display Parameters & Features: sRGB is signaled, but the chromaticities do not match.
Block 1, CTA-861 Extension Block:
  Missing VCDB, needed for Set Selectable RGB Quantization to avoid interop issues.
Block 2, Base EDID:
  Unknown Extension Block.
Block 3, CTA-861 Extension Block:
  Video Data Block: Duplicate VIC 1.
  Video Data Block: Duplicate VIC 2.
  Video Data Block: Duplicate VIC 3.
  Video Data Block: Duplicate VIC 4.
  Video Data Block: Duplicate VIC 5.
  Video Data Block: Duplicate VIC 6.
  Video Data Block: Duplicate VIC 7.
  Video Data Block: Duplicate VIC 16.
  Video Data Block: Duplicate VIC 17.
  Video Data Block: Duplicate VIC 18.
  Video Data Block: Duplicate VIC 19.
  Video Data Block: Duplicate VIC 20.
  Video Data Block: Duplicate VIC 21.
  Video Data Block: Duplicate VIC 22.
  Video Data Block: Duplicate VIC 31.
  Video Data Block: Duplicate VIC 89.
  Video Data Block: Duplicate VIC 90.
  Speaker Allocation Data Block: Only one instance of this Data Block is allowed.
  Colorimetry Data Block: Only one instance of this Data Block is allowed.
  HDR Static Metadata Data Block: Only one instance of this Data Block is allowed.
  Missing VCDB, needed for Set Selectable RGB Quantization to avoid interop issues.
EDID:
  Base EDID: EDID specified 1 extension block(s), but found 3 extension block(s).

EDID conformity: FAIL
