
EDID (hex):
00ffffffffffff001ab303087dea0300
32150103802c19822a9535a159579f27
0e5054a54a0081c00101010101010101
010101010101302a40c8608464301850
1300baf91000001e000000fd003b4b1f
5210000a202020202020000000fc004c
3230542d33204c45440a2020000000ff
00595634543235363633370a202000d9

Extracted contents:
header:          00 ff ff ff ff ff ff 00
serial number:   1a b3 03 08 7d ea 03 00 32 15
version:         01 03
basic params:    80 2c 19 82 2a
chroma info:     95 35 a1 59 57 9f 27 0e 50 54
established:     a5 4a 00
standard:        81 c0 01 01 01 01 01 01 01 01 01 01 01 01 01 01
descriptor 1:    30 2a 40 c8 60 84 64 30 18 50 13 00 ba f9 10 00 00 1e
descriptor 2:    00 00 00 fd 00 3b 4b 1f 52 10 00 0a 20 20 20 20 20 20
descriptor 3:    00 00 00 fc 00 4c 32 30 54 2d 33 20 4c 45 44 0a 20 20
descriptor 4:    00 00 00 ff 00 59 56 34 54 32 35 36 36 33 37 0a 20 20
extensions:      00
checksum:        d9

EDID version: 1.3
Manufacturer: FUS Model 803 Serial Number --
Made in week 50 of 2011
Digital display
Maximum image size: 44 cm x 25 cm
Gamma: 2.30
DPMS levels: Off
RGB color display
First detailed timing is preferred timing
Display x,y Chromaticity:
  Red:   0.6308, 0.3486
  Green: 0.3408, 0.6220
  Blue:  0.1523, 0.0576
  White: 0.3134, 0.3291
Established timings supported:
  720x400@70Hz 9:5 HorFreq: 31469 Hz Clock: 28.320 MHz
  640x480@60Hz 4:3 HorFreq: 31469 Hz Clock: 25.175 MHz
  640x480@75Hz 4:3 HorFreq: 37500 Hz Clock: 31.500 MHz
  800x600@60Hz 4:3 HorFreq: 37900 Hz Clock: 40.000 MHz
  800x600@75Hz 4:3 HorFreq: 46900 Hz Clock: 49.500 MHz
  1024x768@60Hz 4:3 HorFreq: 48400 Hz Clock: 65.000 MHz
  1024x768@75Hz 4:3 HorFreq: 60000 Hz Clock: 78.750 MHz
Standard timings supported:
  1280x720@60Hz 16:9
Detailed mode: Clock 108.000 MHz, 442 mm x 249 mm
               1600 1624 1704 1800 hborder 0
                900  901  904 1000 vborder 0
               +hsync +vsync 
               VertFreq: 60 Hz, HorFreq: 60000 Hz
Monitor ranges (GTF): 59-75Hz V, 31-82kHz H, max dotclock 160MHz
Monitor name: L20T-3 LED
Serial number: --
Checksum: 0xd9 (valid)
