
EDID (hex):
00ffffffffffff0038a35d6701010101
2e12010380372278eadb55ae4f34b026
0e5054bfef8081c0818090408bc09500
a940b300d100283c80a070b023403020
360026582100001a000000fd0032551f
5c11000a202020202020000000fc004c
43443236393057555869320a000000ff
00385933303030303159420a2020006c

Extracted contents:
header:          00 ff ff ff ff ff ff 00
serial number:   38 a3 5d 67 01 01 01 01 2e 12
version:         01 03
basic params:    80 37 22 78 ea
chroma info:     db 55 ae 4f 34 b0 26 0e 50 54
established:     bf ef 80
standard:        81 c0 81 80 90 40 8b c0 95 00 a9 40 b3 00 d1 00
descriptor 1:    28 3c 80 a0 70 b0 23 40 30 20 36 00 26 58 21 00 00 1a
descriptor 2:    00 00 00 fd 00 32 55 1f 5c 11 00 0a 20 20 20 20 20 20
descriptor 3:    00 00 00 fc 00 4c 43 44 32 36 39 30 57 55 58 69 32 0a
descriptor 4:    00 00 00 ff 00 38 59 33 30 30 30 30 31 59 42 0a 20 20
extensions:      00
checksum:        6c

EDID version: 1.3
Manufacturer: NEC Model 675d Serial Number --
Made in week 46 of 2008
Digital display
Maximum image size: 55 cm x 34 cm
Gamma: 2.20
DPMS levels: Standby Suspend Off
RGB color display
First detailed timing is preferred timing
Display x,y Chromaticity:
  Red:   0.6826, 0.3095
  Green: 0.2050, 0.6904
  Blue:  0.1494, 0.0556
  White: 0.3134, 0.3291
Established timings supported:
  720x400@70Hz 9:5 HorFreq: 31469 Hz Clock: 28.320 MHz
  640x480@60Hz 4:3 HorFreq: 31469 Hz Clock: 25.175 MHz
  640x480@67Hz 4:3 HorFreq: 35000 Hz Clock: 30.240 MHz
  640x480@72Hz 4:3 HorFreq: 37900 Hz Clock: 31.500 MHz
  640x480@75Hz 4:3 HorFreq: 37500 Hz Clock: 31.500 MHz
  800x600@56Hz 4:3 HorFreq: 35200 Hz Clock: 36.000 MHz
  800x600@60Hz 4:3 HorFreq: 37900 Hz Clock: 40.000 MHz
  800x600@72Hz 4:3 HorFreq: 48100 Hz Clock: 50.000 MHz
  800x600@75Hz 4:3 HorFreq: 46900 Hz Clock: 49.500 MHz
  832x624@75Hz 4:3 HorFreq: 49726 Hz Clock: 57.284 MHz
  1024x768@60Hz 4:3 HorFreq: 48400 Hz Clock: 65.000 MHz
  1024x768@70Hz 4:3 HorFreq: 56500 Hz Clock: 75.000 MHz
  1024x768@75Hz 4:3 HorFreq: 60000 Hz Clock: 78.750 MHz
  1280x1024@75Hz 5:4 HorFreq: 80000 Hz Clock: 135.000 MHz
  1152x870@75Hz 192:145 HorFreq: 67500 Hz Clock: 108.000 MHz
Standard timings supported:
  1280x720@60Hz 16:9
  1280x1024@60Hz 5:4 HorFreq: 64000 Hz Clock: 108.000 MHz
  1400x1050@60Hz 4:3 HorFreq: 64700 Hz Clock: 101.000 MHz
  1360x765@60Hz 16:9
  1440x900@60Hz 16:10 HorFreq: 55500 Hz Clock: 88.750 MHz
  1600x1200@60Hz 4:3 HorFreq: 75000 Hz Clock: 162.000 MHz
  1680x1050@60Hz 16:10 HorFreq: 64700 Hz Clock: 119.000 MHz
  1920x1200@60Hz 16:10 HorFreq: 74000 Hz Clock: 154.000 MHz
Detailed mode: Clock 154.000 MHz, 550 mm x 344 mm
               1920 1968 2000 2080 hborder 0
               1200 1203 1209 1235 vborder 0
               +hsync -vsync 
               VertFreq: 59 Hz, HorFreq: 74038 Hz
Monitor ranges (GTF): 50-85Hz V, 31-92kHz H, max dotclock 170MHz
Monitor name: LCD2690WUXi2
Serial number: --
Checksum: 0x6c (valid)
