
EDID (hex):
00ffffffffffff0006af149500000000
01130103801a10780a26759658579328
1e505400000001010101010101010101
010101010101121b007d502016302d20
360005a3100000180000000f00000000
00000000000000000020000000fe0041
554f0a202020202020202020000000fe
004231323145573039205635200a005a

Extracted contents:
header:          00 ff ff ff ff ff ff 00
serial number:   06 af 14 95 00 00 00 00 01 13
version:         01 03
basic params:    80 1a 10 78 0a
chroma info:     26 75 96 58 57 93 28 1e 50 54
established:     00 00 00
standard:        01 01 01 01 01 01 01 01 01 01 01 01 01 01 01 01
descriptor 1:    12 1b 00 7d 50 20 16 30 2d 20 36 00 05 a3 10 00 00 18
descriptor 2:    00 00 00 0f 00 00 00 00 00 00 00 00 00 00 00 00 00 20
descriptor 3:    00 00 00 fe 00 41 55 4f 0a 20 20 20 20 20 20 20 20 20
descriptor 4:    00 00 00 fe 00 42 31 32 31 45 57 30 39 20 56 35 20 0a
extensions:      00
checksum:        5a

EDID version: 1.3
Manufacturer: AUO Model 9514 Serial Number --
Made in week 1 of 2009
Digital display
Maximum image size: 26 cm x 16 cm
Gamma: 2.20
RGB color display
First detailed timing is preferred timing
Display x,y Chromaticity:
  Red:   0.5859, 0.3457
  Green: 0.3408, 0.5761
  Blue:  0.1572, 0.1201
  White: 0.3134, 0.3291
Established timings supported:
Standard timings supported:
Detailed mode: Clock 69.300 MHz, 261 mm x 163 mm
               1280 1325 1357 1405 hborder 0
                800  803  809  822 vborder 0
               -hsync -vsync 
               VertFreq: 60 Hz, HorFreq: 49323 Hz
Manufacturer-specified data, tag 15
ASCII string: AUO
ASCII string: B121EW09 V5 
Checksum: 0x5a (valid)
EDID block does NOT conform to EDID 1.3!
	Missing name descriptor
	Missing monitor ranges
