
EDID (hex):
00ffffffffffff000e6f031300000000
001d0104a51c117803dfcaa5544a9b26
0e505400000001010101010101010101
0101010101015046702c804611501010
810018af100000185023702c80461150
1010810018af10000018000000fe0043
534f542054330a2020202020000000fe
004d4e443030375a41312d320a200095

Extracted contents:
header:          00 ff ff ff ff ff ff 00
serial number:   0e 6f 03 13 00 00 00 00 00 1d
version:         01 04
basic params:    a5 1c 11 78 03
chroma info:     df ca a5 54 4a 9b 26 0e 50 54
established:     00 00 00
standard:        01 01 01 01 01 01 01 01 01 01 01 01 01 01 01 01
descriptor 1:    50 46 70 2c 80 46 11 50 10 10 81 00 18 af 10 00 00 18
descriptor 2:    50 23 70 2c 80 46 11 50 10 10 81 00 18 af 10 00 00 18
descriptor 3:    00 00 00 fe 00 43 53 4f 54 20 54 33 0a 20 20 20 20 20
descriptor 4:    00 00 00 fe 00 4d 4e 44 30 30 37 5a 41 31 2d 32 0a 20
extensions:      00
checksum:        95

EDID version: 1.4
Manufacturer: CSO Model 1303 Serial Number --
Made in year 2019
Digital display
8 bits per primary color channel
DisplayPort interface
Maximum image size: 28 cm x 17 cm
Gamma: 2.20
Supported color formats: RGB 4:4:4
First detailed timing includes the native pixel format and preferred refresh rate
Display is continuous frequency
Display x,y Chromaticity:
  Red:   0.6474, 0.3291
  Green: 0.2919, 0.6083
  Blue:  0.1513, 0.0546
  White: 0.3144, 0.3300
Established timings supported:
Standard timings supported:
Detailed mode: Clock 180.000 MHz, 280 mm x 175 mm
               2160 2176 2192 2204 hborder 0
               1350 1358 1359 1367 vborder 0
               -hsync -vsync 
               VertFreq: 59 Hz, HorFreq: 81669 Hz
Detailed mode: Clock 90.400 MHz, 280 mm x 175 mm
               2160 2176 2192 2204 hborder 0
               1350 1358 1359 1367 vborder 0
               -hsync -vsync 
               VertFreq: 30 Hz, HorFreq: 41016 Hz
ASCII string: CSOT T3
ASCII string: MND007ZA1-2
Checksum: 0x95 (valid)
EDID block does NOT conform to EDID 1.4!
	Missing name descriptor
	Missing monitor ranges
