edid-decode (hex):

00 ff ff ff ff ff ff 00 30 e4 4f 02 00 00 00 00
00 14 01 04 80 1a 10 78 02 ba 95 97 59 55 8c 27
21 50 54 00 00 00 01 01 01 01 01 01 01 01 01 01
01 01 01 01 01 01 12 1b 00 80 50 20 14 30 18 20
44 00 04 a0 10 00 00 18 70 12 00 80 50 20 20 30
18 20 d4 00 04 a0 10 00 00 18 00 00 00 00 00 00
00 00 00 00 00 00 00 00 00 00 00 00 00 00 00 02
00 0f 44 e5 0c 3c 64 18 16 27 64 00 00 00 00 66

----------------

Block 0, Base EDID:
  EDID Structure Version & Revision: 1.4
  Vendor & Product Identification:
    Manufacturer: LGD
    Model: 591
    Made in: 2010
  Basic Display Parameters & Features:
    Digital display
    Color depth is undefined
    Digital interface is not defined
    Maximum image size: 26 cm x 16 cm
    Gamma: 2.20
    Supported color formats: RGB 4:4:4
    First detailed timing includes the native pixel format and preferred refresh rate
  Color Characteristics:
    Red  : 0.5917, 0.3505
    Green: 0.3339, 0.5488
    Blue : 0.1542, 0.1298
    White: 0.3134, 0.3291
  Established Timings I & II: none
  Standard Timings: none
  Detailed Timing Descriptors:
    DTD 1:  1280x800    60.023 Hz   8:5    49.219 kHz  69.300 MHz (260 mm x 160 mm)
                 Hfront   24 Hsync  32 Hback  72 Hpol N
                 Vfront    4 Vsync   4 Vback  12 Vpol N
    DTD 2:  1280x800    40.292 Hz   8:5    33.523 kHz  47.200 MHz (260 mm x 160 mm)
                 Hfront   24 Hsync  32 Hback  72 Hpol N
                 Vfront   13 Vsync   4 Vback  15 Vpol N
    Empty Descriptor
    Manufacturer-Specified Display Descriptor (0x02): 00 02 00 0f 44 e5 0c 3c 64 18 16 27 64 00 00 00 '....D..<d..'d...'
Checksum: 0x66
