edid-decode (hex):

00 ff ff ff ff ff ff 00 59 3a 33 00 01 01 01 01
22 11 01 04 a5 5d 34 78 c2 d2 58 a3 54 4a 99 26
0f 47 4a a5 4f 00 31 0a 31 59 45 59 61 59 81 c0
71 4f 81 4f 81 80 66 21 50 b0 51 00 1b 30 40 70
36 00 a2 08 32 00 00 1e 00 00 00 fd 00 32 55 0f
55 0e 00 0a 20 20 20 20 20 20 00 00 00 ff 00 53
41 41 50 41 48 33 34 30 38 35 37 32 00 00 00 fc
00 56 55 34 32 4c 46 48 44 54 56 31 30 41 00 93

00 ff ff ff ff ff ff 00 59 3a 33 00 01 01 01 01
22 11 01 04 a5 5d 34 78 c2 d2 58 a3 54 4a 99 26
0f 47 4a a5 4f 00 31 0a 31 59 45 59 61 59 81 c0
71 4f 81 4f 81 80 66 21 50 b0 51 00 1b 30 40 70
36 00 a2 08 32 00 00 1e 00 00 00 fd 00 32 55 0f
55 0e 00 0a 20 20 20 20 20 20 00 00 00 ff 00 53
41 41 50 41 48 33 34 30 38 35 37 32 00 00 00 fc
00 56 55 34 32 4c 46 48 44 54 56 31 30 41 00 93

----------------

Block 0, Base EDID:
  EDID Structure Version & Revision: 1.4
  Vendor & Product Identification:
    Manufacturer: VIZ
    Model: 51
    Serial Number: ...
    Made in: week 34 of 2007
  Basic Display Parameters & Features:
    Digital display
    Bits per primary color channel: 8
    DisplayPort interface
    Maximum image size: 93 cm x 52 cm
    Gamma: 2.20
    DPMS levels: Standby Suspend
    Supported color formats: RGB 4:4:4
    First detailed timing includes the native pixel format and preferred refresh rate
  Color Characteristics:
    Red  : 0.6396, 0.3291
    Green: 0.2890, 0.5996
    Blue : 0.1494, 0.0595
    White: 0.2792, 0.2890
  Established Timings I & II:
    IBM     :   720x400    70.081663 Hz   9:5     31.467 kHz     28.320000 MHz
    DMT 0x04:   640x480    59.940476 Hz   4:3     31.469 kHz     25.175000 MHz
    DMT 0x06:   640x480    75.000000 Hz   4:3     37.500 kHz     31.500000 MHz
    DMT 0x09:   800x600    60.316541 Hz   4:3     37.879 kHz     40.000000 MHz
    DMT 0x0b:   800x600    75.000000 Hz   4:3     46.875 kHz     49.500000 MHz
    DMT 0x10:  1024x768    60.003840 Hz   4:3     48.363 kHz     65.000000 MHz
    DMT 0x11:  1024x768    70.069359 Hz   4:3     56.476 kHz     75.000000 MHz
    DMT 0x12:  1024x768    75.028582 Hz   4:3     60.023 kHz     78.750000 MHz
    DMT 0x24:  1280x1024   75.024675 Hz   5:4     79.976 kHz    135.000000 MHz
  Standard Timings:
    GTF     :   640x400    70.000000 Hz  16:10    29.190 kHz     23.352000 MHz
    DMT 0x07:   640x480    85.008312 Hz   4:3     43.269 kHz     36.000000 MHz
    DMT 0x0c:   800x600    85.061274 Hz   4:3     53.674 kHz     56.250000 MHz
    DMT 0x13:  1024x768    84.996690 Hz   4:3     68.677 kHz     94.500000 MHz
    DMT 0x55:  1280x720    60.000000 Hz  16:9     45.000 kHz     74.250000 MHz
    DMT 0x15:  1152x864    75.000000 Hz   4:3     67.500 kHz    108.000000 MHz
    GTF     :  1280x960    74.999884 Hz   4:3     75.150 kHz    129.859000 MHz
    DMT 0x23:  1280x1024   60.019740 Hz   5:4     63.981 kHz    108.000000 MHz
  Detailed Timing Descriptors:
    DTD 1:  1360x768    60.015162 Hz  85:48    47.712 kHz     85.500000 MHz (930 mm x 520 mm)
                 Hfront   64 Hsync 112 Hback  256 Hpol P
                 Vfront    3 Vsync   6 Vback   18 Vpol P
    Display Range Limits:
      Monitor ranges (GTF): 50-85 Hz V, 15-85 kHz H, max dotclock 140 MHz
    Display Product Serial Number: ...
    Display Product Name: 'VU42LFHDTV10A'
Checksum: 0x93

----------------

Block 1, Unknown EDID Extension Block 0x00:
  00 ff ff ff ff ff ff 00 59 3a 33 00 01 01 01 01 '........Y:3.....'
  22 11 01 04 a5 5d 34 78 c2 d2 58 a3 54 4a 99 26 '"....]4x..X.TJ.&'
  0f 47 4a a5 4f 00 31 0a 31 59 45 59 61 59 81 c0 '.GJ.O.1.1YEYaY..'
  71 4f 81 4f 81 80 66 21 50 b0 51 00 1b 30 40 70 'qO.O..f!P.Q..0@p'
  36 00 a2 08 32 00 00 1e 00 00 00 fd 00 32 55 0f '6...2........2U.'
  55 0e 00 0a 20 20 20 20 20 20 00 00 00 ff 00 53 'U...      .....S'
  41 41 50 41 48 33 34 30 38 35 37 32 00 00 00 fc 'AAPAH3408572....'
  00 56 55 34 32 4c 46 48 44 54 56 31 30 41 00 93 '.VU42LFHDTV10A..'
Checksum: 0x93

----------------

Warnings:

Block 0, Base EDID:
  Display Range Limits: GTF support is deprecated in EDID 1.4.

Failures:

Block 0, Base EDID:
  Display Range Limits: GTF can't be combined with non-continuous frequencies.
Block 1, Base EDID:
  Unknown Extension Block.
EDID:
  Base EDID: EDID specified 0 extension block(s), but found 1 extension block(s).

EDID conformity: FAIL
