edid-decode (hex):

00 ff ff ff ff ff ff 00 18 23 24 22 01 01 01 01
01 1a 01 03 00 34 1f 78 ea 2d 36 a7 54 38 ae 26
0d 4f 54 bd cf 00 d1 c0 b3 00 95 00 81 80 a9 c0
81 00 71 40 81 40 02 3a 80 18 71 38 2d 40 58 2c
45 00 dd 0c 11 00 00 1e 66 21 56 b0 51 00 1b 30
40 70 36 00 9a e6 10 00 00 1e 00 00 00 fd 00 38
4c 1e 53 0f 00 0a 20 20 20 20 20 20 00 00 00 fc
00 4d 41 32 32 32 34 0a 20 20 20 20 20 20 00 60

00 ff ff ff ff ff ff 00 18 23 24 22 01 01 01 01
01 1a 01 03 00 34 1f 78 ea 2d 36 a7 54 38 ae 26
0d 4f 54 bd cf 00 d1 c0 b3 00 95 00 81 80 a9 c0
81 00 71 40 81 40 02 3a 80 18 71 38 2d 40 58 2c
45 00 dd 0c 11 00 00 1e 66 21 56 b0 51 00 1b 30
40 70 36 00 9a e6 10 00 00 1e 00 00 00 fd 00 38
4c 1e 53 0f 00 0a 20 20 20 20 20 20 00 00 00 fc
00 4d 41 32 32 32 34 0a 20 20 20 20 20 20 00 60

----------------

Block 0, Base EDID:
  EDID Structure Version & Revision: 1.3
  Vendor & Product Identification:
    Manufacturer: FAC
    Model: 8740
    Serial Number: ...
    Made in: week 1 of 2016
  Basic Display Parameters & Features:
    Analog display
    Signal Level Standard: 0.700 : 0.300 : 1.000 V p-p
    Blank level equals black level
    Maximum image size: 52 cm x 31 cm
    Gamma: 2.20
    DPMS levels: Standby Suspend Off
    RGB color display
    First detailed timing is the preferred timing
  Color Characteristics:
    Red  : 0.6523, 0.3300
    Green: 0.2216, 0.6806
    Blue : 0.1484, 0.0537
    White: 0.3095, 0.3300
  Established Timings I & II:
    IBM     :   720x400    70.081663 Hz   9:5     31.467 kHz     28.320000 MHz
    DMT 0x04:   640x480    59.940476 Hz   4:3     31.469 kHz     25.175000 MHz
    Apple   :   640x480    66.666667 Hz   4:3     35.000 kHz     30.240000 MHz
    DMT 0x05:   640x480    72.808802 Hz   4:3     37.861 kHz     31.500000 MHz
    DMT 0x06:   640x480    75.000000 Hz   4:3     37.500 kHz     31.500000 MHz
    DMT 0x09:   800x600    60.316541 Hz   4:3     37.879 kHz     40.000000 MHz
    DMT 0x0a:   800x600    72.187572 Hz   4:3     48.077 kHz     50.000000 MHz
    DMT 0x0b:   800x600    75.000000 Hz   4:3     46.875 kHz     49.500000 MHz
    DMT 0x10:  1024x768    60.003840 Hz   4:3     48.363 kHz     65.000000 MHz
    DMT 0x11:  1024x768    70.069359 Hz   4:3     56.476 kHz     75.000000 MHz
    DMT 0x12:  1024x768    75.028582 Hz   4:3     60.023 kHz     78.750000 MHz
    DMT 0x24:  1280x1024   75.024675 Hz   5:4     79.976 kHz    135.000000 MHz
  Standard Timings:
    DMT 0x52:  1920x1080   60.000000 Hz  16:9     67.500 kHz    148.500000 MHz
    DMT 0x3a:  1680x1050   59.954250 Hz  16:10    65.290 kHz    146.250000 MHz
    DMT 0x2f:  1440x900    59.887445 Hz  16:10    55.935 kHz    106.500000 MHz
    DMT 0x23:  1280x1024   60.019740 Hz   5:4     63.981 kHz    108.000000 MHz
    DMT 0x53:  1600x900    60.000000 Hz  16:9     60.000 kHz    108.000000 MHz (RB)
    DMT 0x1c:  1280x800    59.810326 Hz  16:10    49.702 kHz     83.500000 MHz
    GTF     :  1152x864    60.000000 Hz   4:3     53.700 kHz     81.624000 MHz
    DMT 0x20:  1280x960    60.000000 Hz   4:3     60.000 kHz    108.000000 MHz
  Detailed Timing Descriptors:
    DTD 1:  1920x1080   60.000000 Hz  16:9     67.500 kHz    148.500000 MHz (477 mm x 268 mm)
                 Hfront   88 Hsync  44 Hback  148 Hpol P
                 Vfront    4 Vsync   5 Vback   36 Vpol P
    DTD 2:  1366x768    59.814889 Hz 683:384   47.553 kHz     85.500000 MHz (410 mm x 230 mm)
                 Hfront   64 Hsync 112 Hback  256 Hpol P
                 Vfront    3 Vsync   6 Vback   18 Vpol P
    Display Range Limits:
      Monitor ranges (GTF): 56-76 Hz V, 30-83 kHz H, max dotclock 150 MHz
    Display Product Name: 'MA2224'
Checksum: 0x60

----------------

Block 1, Unknown EDID Extension Block 0x00:
  00 ff ff ff ff ff ff 00 18 23 24 22 01 01 01 01 '.........#$"....'
  01 1a 01 03 00 34 1f 78 ea 2d 36 a7 54 38 ae 26 '.....4.x.-6.T8.&'
  0d 4f 54 bd cf 00 d1 c0 b3 00 95 00 81 80 a9 c0 '.OT.............'
  81 00 71 40 81 40 02 3a 80 18 71 38 2d 40 58 2c '..q@.@.:..q8-@X,'
  45 00 dd 0c 11 00 00 1e 66 21 56 b0 51 00 1b 30 'E.......f!V.Q..0'
  40 70 36 00 9a e6 10 00 00 1e 00 00 00 fd 00 38 '@p6............8'
  4c 1e 53 0f 00 0a 20 20 20 20 20 20 00 00 00 fc 'L.S...      ....'
  00 4d 41 32 32 32 34 0a 20 20 20 20 20 20 00 60 '.MA2224.      .`'
Checksum: 0x60

----------------

Failures:

Block 0, Base EDID:
  Detailed Timing Descriptor #1: Mismatch of image size 477x268 mm vs display size 520x310 mm.
  Detailed Timing Descriptor #2: Mismatch of image size 410x230 mm vs display size 520x310 mm.
Block 1, Base EDID:
  Unknown Extension Block.
EDID:
  Base EDID: EDID specified 0 extension block(s), but found 1 extension block(s).

EDID conformity: FAIL
