
EDID (hex):
00ffffffffffff004ca3000000000000
000d0103802115780a87f594574f8c27
27505400000001010101010101010101
010101010101bc1b00a0502017303020
26004bcf100000190000000f00000000
00000000002387026402000000fe0053
414d53554e470a2020202020000000fe
004c544e31353458312d4c30320a00c8

Extracted contents:
header:          00 ff ff ff ff ff ff 00
serial number:   4c a3 00 00 00 00 00 00 00 0d
version:         01 03
basic params:    80 21 15 78 0a
chroma info:     87 f5 94 57 4f 8c 27 27 50 54
established:     00 00 00
standard:        01 01 01 01 01 01 01 01 01 01 01 01 01 01 01 01
descriptor 1:    bc 1b 00 a0 50 20 17 30 30 20 26 00 4b cf 10 00 00 19
descriptor 2:    00 00 00 0f 00 00 00 00 00 00 00 00 00 23 87 02 64 02
descriptor 3:    00 00 00 fe 00 53 41 4d 53 55 4e 47 0a 20 20 20 20 20
descriptor 4:    00 00 00 fe 00 4c 54 4e 31 35 34 58 31 2d 4c 30 32 0a
extensions:      00
checksum:        c8

EDID version: 1.3
Manufacturer: SEC Model 0 Serial Number --
Digital display
Maximum image size: 33 cm x 21 cm
Gamma: 2.20
RGB color display
First detailed timing is preferred timing
Display x,y Chromaticity:
  Red:   0.5800, 0.3398
  Green: 0.3095, 0.5498
  Blue:  0.1552, 0.1552
  White: 0.3134, 0.3291
Established timings supported:
Standard timings supported:
Detailed mode: Clock 71.000 MHz, 331 mm x 207 mm
               1280 1328 1360 1440 hborder 0
                800  802  808  823 vborder 0
               -hsync -vsync 
               VertFreq: 59 Hz, HorFreq: 49305 Hz
Manufacturer-specified data, tag 15
ASCII string: SAMSUNG
ASCII string: LTN154X1-L02
Checksum: 0xc8 (valid)
EDID block does NOT conform to EDID 1.3!
	Missing name descriptor
	Missing monitor ranges
EDID block does not conform at all!
	Bad year of manufacture
