
EDID (hex):
00ffffffffffff004ca3000000000000
000d0103801f17780ad90e9656528627
23505400000001010101010101010101
01010101010164190040410026301888
360030e4100000190000000f00047e18
ff0105026f18ff027401000000fe0053
414d53554e470a2020202020000000fe
004c544e31353058422d4c30330a0049

Extracted contents:
header:          00 ff ff ff ff ff ff 00
serial number:   4c a3 00 00 00 00 00 00 00 0d
version:         01 03
basic params:    80 1f 17 78 0a
chroma info:     d9 0e 96 56 52 86 27 23 50 54
established:     00 00 00
standard:        01 01 01 01 01 01 01 01 01 01 01 01 01 01 01 01
descriptor 1:    64 19 00 40 41 00 26 30 18 88 36 00 30 e4 10 00 00 19
descriptor 2:    00 00 00 0f 00 04 7e 18 ff 01 05 02 6f 18 ff 02 74 01
descriptor 3:    00 00 00 fe 00 53 41 4d 53 55 4e 47 0a 20 20 20 20 20
descriptor 4:    00 00 00 fe 00 4c 54 4e 31 35 30 58 42 2d 4c 30 33 0a
extensions:      00
checksum:        49

EDID version: 1.3
Manufacturer: SEC Model 0 Serial Number --
Digital display
Maximum image size: 31 cm x 23 cm
Gamma: 2.20
RGB color display
First detailed timing is preferred timing
Display x,y Chromaticity:
  Red:   0.5888, 0.3369
  Green: 0.3222, 0.5244
  Blue:  0.1523, 0.1367
  White: 0.3154, 0.3300
Established timings supported:
Standard timings supported:
Detailed mode: Clock 65.000 MHz, 304 mm x 228 mm
               1024 1048 1184 1344 hborder 0
                768  771  777  806 vborder 0
               -hsync -vsync 
               VertFreq: 60 Hz, HorFreq: 48363 Hz
Manufacturer-specified data, tag 15
ASCII string: SAMSUNG
ASCII string: LTN150XB-L03
Checksum: 0x49 (valid)
EDID block does NOT conform to EDID 1.3!
	Missing name descriptor
	Missing monitor ranges
EDID block does not conform at all!
	Bad year of manufacture
