edid-decode (hex):

00 ff ff ff ff ff ff 00 22 0e 79 34 01 01 01 01
23 1d 01 04 68 30 1b 78 2a c7 b5 a7 56 53 9c 27
10 50 54 a5 4b 00 d1 c0 81 c0 a9 c0 b3 00 95 00
81 00 81 80 01 01 02 3a 80 18 71 38 2d 40 58 2c
45 00 dc 0c 11 00 00 1e 00 00 00 fd 00 32 4b 1e
54 11 00 0a 20 20 20 20 20 20 00 00 00 fc 00 48
50 20 5a 32 32 6e 20 47 32 0a 20 20 00 00 00 ff
00 36 43 4d 39 33 35 32 43 53 48 0a 20 20 00 3d

00 ff ff ff ff ff ff 00 22 0e 79 34 01 01 01 01
23 1d 01 04 68 30 1b 78 2a c7 b5 a7 56 53 9c 27
10 50 54 a5 4b 00 d1 c0 81 c0 a9 c0 b3 00 95 00
81 00 81 80 01 01 02 3a 80 18 71 38 2d 40 58 2c
45 00 dc 0c 11 00 00 1e 00 00 00 fd 00 32 4b 1e
54 11 00 0a 20 20 20 20 20 20 00 00 00 fc 00 48
50 20 5a 32 32 6e 20 47 32 0a 20 20 00 00 00 ff
00 36 43 4d 39 33 35 32 43 53 48 0a 20 20 00 3d

----------------

Block 0, Base EDID:
  EDID Structure Version & Revision: 1.4
  Vendor & Product Identification:
    Manufacturer: HPN
    Model: 13433
    Serial Number: ...
    Made in: week 35 of 2019
  Basic Display Parameters & Features:
    Analog display
    Signal Level Standard: 0.700 : 0.000 : 0.700 V p-p
    Blank level equals black level
    Sync: Separate
    Maximum image size: 48 cm x 27 cm
    Gamma: 2.20
    DPMS levels: Off
    RGB color display
    First detailed timing includes the native pixel format and preferred refresh rate
  Color Characteristics:
    Red  : 0.6552, 0.3359
    Green: 0.3251, 0.6123
    Blue : 0.1542, 0.0654
    White: 0.3134, 0.3291
  Established Timings I & II:
    IBM     :   720x400    70.081663 Hz   9:5     31.467 kHz     28.320000 MHz
    DMT 0x04:   640x480    59.940476 Hz   4:3     31.469 kHz     25.175000 MHz
    DMT 0x06:   640x480    75.000000 Hz   4:3     37.500 kHz     31.500000 MHz
    DMT 0x09:   800x600    60.316541 Hz   4:3     37.879 kHz     40.000000 MHz
    DMT 0x0b:   800x600    75.000000 Hz   4:3     46.875 kHz     49.500000 MHz
    DMT 0x10:  1024x768    60.003840 Hz   4:3     48.363 kHz     65.000000 MHz
    DMT 0x12:  1024x768    75.028582 Hz   4:3     60.023 kHz     78.750000 MHz
    DMT 0x24:  1280x1024   75.024675 Hz   5:4     79.976 kHz    135.000000 MHz
  Standard Timings:
    DMT 0x52:  1920x1080   60.000000 Hz  16:9     67.500 kHz    148.500000 MHz
    DMT 0x55:  1280x720    60.000000 Hz  16:9     45.000 kHz     74.250000 MHz
    DMT 0x53:  1600x900    60.000000 Hz  16:9     60.000 kHz    108.000000 MHz (RB)
    DMT 0x3a:  1680x1050   59.954250 Hz  16:10    65.290 kHz    146.250000 MHz
    DMT 0x2f:  1440x900    59.887445 Hz  16:10    55.935 kHz    106.500000 MHz
    DMT 0x1c:  1280x800    59.810326 Hz  16:10    49.702 kHz     83.500000 MHz
    DMT 0x23:  1280x1024   60.019740 Hz   5:4     63.981 kHz    108.000000 MHz
  Detailed Timing Descriptors:
    DTD 1:  1920x1080   60.000000 Hz  16:9     67.500 kHz    148.500000 MHz (476 mm x 268 mm)
                 Hfront   88 Hsync  44 Hback  148 Hpol P
                 Vfront    4 Vsync   5 Vback   36 Vpol P
    Display Range Limits:
      Monitor ranges (GTF): 50-75 Hz V, 30-84 kHz H, max dotclock 170 MHz
    Display Product Name: 'HP Z22n G2'
    Display Product Serial Number: ...
Checksum: 0x3d

----------------

Block 1, Unknown EDID Extension Block 0x00:
  00 ff ff ff ff ff ff 00 22 0e 79 34 01 01 01 01 '........".y4....'
  23 1d 01 04 68 30 1b 78 2a c7 b5 a7 56 53 9c 27 '#...h0.x*...VS.''
  10 50 54 a5 4b 00 d1 c0 81 c0 a9 c0 b3 00 95 00 '.PT.K...........'
  81 00 81 80 01 01 02 3a 80 18 71 38 2d 40 58 2c '.......:..q8-@X,'
  45 00 dc 0c 11 00 00 1e 00 00 00 fd 00 32 4b 1e 'E............2K.'
  54 11 00 0a 20 20 20 20 20 20 00 00 00 fc 00 48 'T...      .....H'
  50 20 5a 32 32 6e 20 47 32 0a 20 20 00 00 00 ff 'P Z22n G2.  ....'
  00 36 43 4d 39 33 35 32 43 53 48 0a 20 20 00 3d '.6CM9352CSH.  .='
Checksum: 0x3d

----------------

Warnings:

Block 0, Base EDID:
  Display Range Limits: GTF support is deprecated in EDID 1.4.

Failures:

Block 0, Base EDID:
  Display Range Limits: GTF can't be combined with non-continuous frequencies.
Block 1, Base EDID:
  Unknown Extension Block.
EDID:
  Base EDID: EDID specified 0 extension block(s), but found 1 extension block(s).

EDID conformity: FAIL
