
EDID (hex):
00ffffffffffff0006af148100000000
01110103801a10780a87f594574f8c27
27505400000001010101010101010101
010101010101e91b00b4502010301520
440005a310000019761b00a250200c30
1520440005a310000000000000fe004d
4e3930360542313231455738000000fe
00212a3e5f7b99beff01010a2020008a

Extracted contents:
header:          00 ff ff ff ff ff ff 00
serial number:   06 af 14 81 00 00 00 00 01 11
version:         01 03
basic params:    80 1a 10 78 0a
chroma info:     87 f5 94 57 4f 8c 27 27 50 54
established:     00 00 00
standard:        01 01 01 01 01 01 01 01 01 01 01 01 01 01 01 01
descriptor 1:    e9 1b 00 b4 50 20 10 30 15 20 44 00 05 a3 10 00 00 19
descriptor 2:    76 1b 00 a2 50 20 0c 30 15 20 44 00 05 a3 10 00 00 00
descriptor 3:    00 00 00 fe 00 4d 4e 39 30 36 05 42 31 32 31 45 57 38
descriptor 4:    00 00 00 fe 00 21 2a 3e 5f 7b 99 be ff 01 01 0a 20 20
extensions:      00
checksum:        8a

EDID version: 1.3
Manufacturer: AUO Model 8114 Serial Number --
Made in week 1 of 2007
Digital display
Maximum image size: 26 cm x 16 cm
Gamma: 2.20
RGB color display
First detailed timing is preferred timing
Display x,y Chromaticity:
  Red:   0.5800, 0.3398
  Green: 0.3095, 0.5498
  Blue:  0.1552, 0.1552
  White: 0.3134, 0.3291
Established timings supported:
Standard timings supported:
Detailed mode: Clock 71.450 MHz, 261 mm x 163 mm
               1280 1301 1333 1460 hborder 0
                800  804  808  816 vborder 0
               -hsync -vsync 
               VertFreq: 59 Hz, HorFreq: 48938 Hz
Detailed mode: Clock 70.300 MHz, 261 mm x 163 mm
               1280 1301 1333 1442 hborder 0
                800  804  808  812 vborder 0
               -hsync -vsync analog composite 
               VertFreq: 60 Hz, HorFreq: 48751 Hz
ASCII string: MN906
ASCII string: !*>_{
Checksum: 0x8a (valid)
EDID block does NOT conform to EDID 1.3!
	Missing name descriptor
	Missing monitor ranges
	Detailed block string not properly terminated
