
EDID (hex):
00ffffffffffff0026cd28610c0b0000
1e1e010380351e782aa1a5a755529f27
125054a56b80710081408180a940b300
9500d1c00101023a801871382d40582c
45000f282100001e000000ff00313135
36343033303432383238000000fd0037
4c1e5312000a202020202020000000fc
0058323438332f323438310a20200128
020322f14f9005040302011112131406
0715161f230907018301000065030c00
1000023a801871382d40582c45000f28
2100001f011d80d0721c1620102c2580
0f282100009e011d00bc52d01e20b828
55400f282100001e2a4480a070382740
302035000f282100001a023a80d07238
2d40102c45800f282100001e00000017

Extracted contents:
header:          00 ff ff ff ff ff ff 00
serial number:   26 cd 28 61 0c 0b 00 00 1e 1e
version:         01 03
basic params:    80 35 1e 78 2a
chroma info:     a1 a5 a7 55 52 9f 27 12 50 54
established:     a5 6b 80
standard:        71 00 81 40 81 80 a9 40 b3 00 95 00 d1 c0 01 01
descriptor 1:    02 3a 80 18 71 38 2d 40 58 2c 45 00 0f 28 21 00 00 1e
descriptor 2:    00 00 00 ff 00 31 31 35 36 34 30 33 30 34 32 38 32 38
descriptor 3:    00 00 00 fd 00 37 4c 1e 53 12 00 0a 20 20 20 20 20 20
descriptor 4:    00 00 00 fc 00 58 32 34 38 33 2f 32 34 38 31 0a 20 20
extensions:      01
checksum:        28

EDID version: 1.3
Manufacturer: IVM Model 6128 Serial Number --
Made in week 30 of 2020
Digital display
Maximum image size: 53 cm x 30 cm
Gamma: 2.20
DPMS levels: Off
RGB color display
First detailed timing is preferred timing
Display x,y Chromaticity:
  Red:   0.6542, 0.3339
  Green: 0.3203, 0.6220
  Blue:  0.1542, 0.0722
  White: 0.3134, 0.3291
Established timings supported:
  720x400@70Hz 9:5 HorFreq: 31469 Hz Clock: 28.320 MHz
  640x480@60Hz 4:3 HorFreq: 31469 Hz Clock: 25.175 MHz
  640x480@75Hz 4:3 HorFreq: 37500 Hz Clock: 31.500 MHz
  800x600@60Hz 4:3 HorFreq: 37900 Hz Clock: 40.000 MHz
  800x600@75Hz 4:3 HorFreq: 46900 Hz Clock: 49.500 MHz
  832x624@75Hz 4:3 HorFreq: 49726 Hz Clock: 57.284 MHz
  1024x768@60Hz 4:3 HorFreq: 48400 Hz Clock: 65.000 MHz
  1024x768@75Hz 4:3 HorFreq: 60000 Hz Clock: 78.750 MHz
  1280x1024@75Hz 5:4 HorFreq: 80000 Hz Clock: 135.000 MHz
  1152x870@75Hz 192:145 HorFreq: 67500 Hz Clock: 108.000 MHz
Standard timings supported:
  1152x720@60Hz 16:10
  1280x960@60Hz 4:3 HorFreq: 60000 Hz Clock: 108.000 MHz
  1280x1024@60Hz 5:4 HorFreq: 64000 Hz Clock: 108.000 MHz
  1600x1200@60Hz 4:3 HorFreq: 75000 Hz Clock: 162.000 MHz
  1680x1050@60Hz 16:10 HorFreq: 64700 Hz Clock: 119.000 MHz
  1440x900@60Hz 16:10 HorFreq: 55500 Hz Clock: 88.750 MHz
  1920x1080@60Hz 16:9
Detailed mode: Clock 148.500 MHz, 527 mm x 296 mm
               1920 2008 2052 2200 hborder 0
               1080 1084 1089 1125 vborder 0
               +hsync +vsync 
               VertFreq: 60 Hz, HorFreq: 67500 Hz
Serial number: --
Monitor ranges (GTF): 55-76Hz V, 30-83kHz H, max dotclock 180MHz
Monitor name: X2483/2481
Has 1 extension blocks
Checksum: 0x28 (valid)

CTA extension block
Extension version: 3
30 bytes of CTA data
  Video data block
    VIC  16 1920x1080@60Hz 16:9 (native) HorFreq: 67500 Hz Clock: 148.500 MHz
    VIC   5 1920x1080i@60Hz 16:9  HorFreq: 33750 Hz Clock: 74.250 MHz
    VIC   4 1280x720@60Hz 16:9  HorFreq: 45000 Hz Clock: 74.250 MHz
    VIC   3 720x480@60Hz 16:9  HorFreq: 31469 Hz Clock: 27.000 MHz
    VIC   2 720x480@60Hz 4:3  HorFreq: 31469 Hz Clock: 27.000 MHz
    VIC   1 640x480@60Hz 4:3  HorFreq: 31469 Hz Clock: 25.175 MHz
    VIC  17 720x576@50Hz 4:3  HorFreq: 31250 Hz Clock: 27.000 MHz
    VIC  18 720x576@50Hz 16:9  HorFreq: 31250 Hz Clock: 27.000 MHz
    VIC  19 1280x720@50Hz 16:9  HorFreq: 37500 Hz Clock: 74.250 MHz
    VIC  20 1920x1080i@50Hz 16:9  HorFreq: 28125 Hz Clock: 74.250 MHz
    VIC   6 1440x480i@60Hz 4:3  HorFreq: 15734 Hz Clock: 27.000 MHz
    VIC   7 1440x480i@60Hz 16:9  HorFreq: 15734 Hz Clock: 27.000 MHz
    VIC  21 1440x576i@50Hz 4:3  HorFreq: 15625 Hz Clock: 27.000 MHz
    VIC  22 1440x576i@50Hz 16:9  HorFreq: 15625 Hz Clock: 27.000 MHz
    VIC  31 1920x1080@50Hz 16:9  HorFreq: 56250 Hz Clock: 148.500 MHz
  Audio data block
    Linear PCM, max channels 2
      Supported sample rates (kHz): 48 44.1 32
      Supported sample sizes (bits): 16
  Speaker allocation data block
    Speaker map:
      FL/FR - Front Left/Right
  Vendor-specific data block, OUI 000c03 (HDMI)
    Source physical address 1.0.0.0
Underscans PC formats by default
Basic audio support
Supports YCbCr 4:4:4
Supports YCbCr 4:2:2
1 native detailed modes
Detailed mode: Clock 148.500 MHz, 527 mm x 296 mm
               1920 2008 2052 2200 hborder 0
               1080 1084 1089 1125 vborder 0
               +hsync +vsync 
               VertFreq: 60 Hz, HorFreq: 67500 Hz
Detailed mode: Clock 74.250 MHz, 527 mm x 296 mm
               1920 2448 2492 2640 hborder 0
                540  542  547  562 vborder 0
               +hsync +vsync interlaced 
               VertFreq: 50 Hz, HorFreq: 28125 Hz
Detailed mode: Clock 74.250 MHz, 527 mm x 296 mm
               1280 1720 1760 1980 hborder 0
                720  725  730  750 vborder 0
               +hsync +vsync 
               VertFreq: 50 Hz, HorFreq: 37500 Hz
Detailed mode: Clock 174.500 MHz, 527 mm x 296 mm
               1920 1968 2000 2080 hborder 0
               1080 1083 1088 1119 vborder 0
               +hsync -vsync 
               VertFreq: 74 Hz, HorFreq: 83894 Hz
Detailed mode: Clock 148.500 MHz, 527 mm x 296 mm
               1920 2448 2492 2640 hborder 0
               1080 1084 1089 1125 vborder 0
               +hsync +vsync 
               VertFreq: 50 Hz, HorFreq: 56250 Hz
Checksum: 0x17 (valid)

One or more of the timings is out of range of the Monitor Ranges:
  Vertical Freq: 50 - 75 Hz
  Horizontal Freq: 15625 - 83894 Hz
  Maximum Clock: 174.500 MHz
EDID block does not conform at all!
	Both the serial number and the serial string are set
