
EDID (hex):
00ffffffffffff005a6330ad01010101
22190104a52917782662a5a25653a127
0a5054bfef8081808140810081c00101
010101010101662156aa51001e30468f
33009ae61000001e000000ff00553931
3135333430333535330a000000fd0032
4b185213000a202020202020000000fc
005641313931372053455249455300a1

Extracted contents:
header:          00 ff ff ff ff ff ff 00
serial number:   5a 63 30 ad 01 01 01 01 22 19
version:         01 04
basic params:    a5 29 17 78 26
chroma info:     62 a5 a2 56 53 a1 27 0a 50 54
established:     bf ef 80
standard:        81 80 81 40 81 00 81 c0 01 01 01 01 01 01 01 01
descriptor 1:    66 21 56 aa 51 00 1e 30 46 8f 33 00 9a e6 10 00 00 1e
descriptor 2:    00 00 00 ff 00 55 39 31 31 35 33 34 30 33 35 35 33 0a
descriptor 3:    00 00 00 fd 00 32 4b 18 52 13 00 0a 20 20 20 20 20 20
descriptor 4:    00 00 00 fc 00 56 41 31 39 31 37 20 53 45 52 49 45 53
extensions:      00
checksum:        a1

EDID version: 1.4
Manufacturer: VSC Model ad30 Serial Number --
Made in week 34 of 2015
Digital display
8 bits per primary color channel
DisplayPort interface
Maximum image size: 41 cm x 23 cm
Gamma: 2.20
DPMS levels: Off
Supported color formats: RGB 4:4:4
Default (sRGB) color space is primary color space
First detailed timing includes the native pixel format and preferred refresh rate
Display x,y Chromaticity:
  Red:   0.6337, 0.3378
  Green: 0.3242, 0.6308
  Blue:  0.1542, 0.0410
  White: 0.3134, 0.3291
Established timings supported:
  720x400@70Hz 9:5 HorFreq: 31469 Hz Clock: 28.320 MHz
  640x480@60Hz 4:3 HorFreq: 31469 Hz Clock: 25.175 MHz
  640x480@67Hz 4:3 HorFreq: 35000 Hz Clock: 30.240 MHz
  640x480@72Hz 4:3 HorFreq: 37900 Hz Clock: 31.500 MHz
  640x480@75Hz 4:3 HorFreq: 37500 Hz Clock: 31.500 MHz
  800x600@56Hz 4:3 HorFreq: 35200 Hz Clock: 36.000 MHz
  800x600@60Hz 4:3 HorFreq: 37900 Hz Clock: 40.000 MHz
  800x600@72Hz 4:3 HorFreq: 48100 Hz Clock: 50.000 MHz
  800x600@75Hz 4:3 HorFreq: 46900 Hz Clock: 49.500 MHz
  832x624@75Hz 4:3 HorFreq: 49726 Hz Clock: 57.284 MHz
  1024x768@60Hz 4:3 HorFreq: 48400 Hz Clock: 65.000 MHz
  1024x768@70Hz 4:3 HorFreq: 56500 Hz Clock: 75.000 MHz
  1024x768@75Hz 4:3 HorFreq: 60000 Hz Clock: 78.750 MHz
  1280x1024@75Hz 5:4 HorFreq: 80000 Hz Clock: 135.000 MHz
  1152x870@75Hz 192:145 HorFreq: 67500 Hz Clock: 108.000 MHz
Standard timings supported:
  1280x1024@60Hz 5:4 HorFreq: 64000 Hz Clock: 108.000 MHz
  1280x960@60Hz 4:3 HorFreq: 60000 Hz Clock: 108.000 MHz
  1280x800@60Hz 16:10
  1280x720@60Hz 16:9
Detailed mode: Clock 85.500 MHz, 410 mm x 230 mm
               1366 1436 1579 1792 hborder 0
                768  771  774  798 vborder 0
               +hsync +vsync 
               VertFreq: 59 Hz, HorFreq: 47712 Hz
Serial number: --
Monitor ranges (GTF): 50-75Hz V, 24-82kHz H, max dotclock 190MHz
Checksum: 0xa1 (valid)
EDID block does NOT conform to EDID 1.4!
	sRGB is signaled, but the chromaticities do not match
	Name descriptor not terminated with a newline
