edid-decode (hex):

00 ff ff ff ff ff ff 00 21 63 51 90 00 00 00 00
00 1f 01 04 95 22 13 78 03 56 60 97 5b 5a 93 29
1f 50 54 00 00 00 01 01 01 01 01 01 01 01 01 01
01 01 01 01 01 01 99 3b 80 10 71 38 50 40 30 20
36 00 58 c2 10 00 00 19 bb 27 80 10 71 38 50 40
30 20 36 00 58 c2 10 00 00 19 00 00 00 00 00 00
00 00 00 00 00 00 00 00 00 00 00 00 00 00 00 02
00 0c 3d ff 0c 3c 7d 11 13 29 7d 00 00 00 00 f4

----------------

Block 0, Base EDID:
  EDID Structure Version & Revision: 1.4
  Vendor & Product Identification:
    Manufacturer: HKC
    Model: 36945
    Made in: 2021
  Basic Display Parameters & Features:
    Digital display
    Bits per primary color channel: 6
    DisplayPort interface
    Maximum image size: 34 cm x 19 cm
    Gamma: 2.20
    Supported color formats: RGB 4:4:4
    First detailed timing includes the native pixel format and preferred refresh rate
    Display is continuous frequency
  Color Characteristics:
    Red  : 0.5908, 0.3564
    Green: 0.3525, 0.5761
    Blue : 0.1611, 0.1230
    White: 0.3125, 0.3281
  Established Timings I & II: none
  Standard Timings: none
  Detailed Timing Descriptors:
    DTD 1:  1920x1080   60.002674 Hz  16:9     69.603 kHz    152.570000 MHz (344 mm x 194 mm)
                 Hfront   48 Hsync  32 Hback  192 Hpol N
                 Vfront    3 Vsync   6 Vback   71 Vpol N
    DTD 2:  1920x1080   40.000472 Hz  16:9     46.401 kHz    101.710000 MHz (344 mm x 194 mm)
                 Hfront   48 Hsync  32 Hback  192 Hpol N
                 Vfront    3 Vsync   6 Vback   71 Vpol N
    Empty Descriptor
    Manufacturer-Specified Display Descriptor (0x02): 00 02 00 0c 3d ff 0c 3c 7d 11 13 29 7d 00 00 00 '....=..<}..)}...'
Checksum: 0xf4

----------------

Failures:

Block 0, Base EDID:
  Empty Descriptor: Use Dummy Descriptor instead of all zeroes.
  Missing Display Product Name.
  Missing Display Range Limits Descriptor.

EDID conformity: FAIL
