
EDID (hex):
00ffffffffffff002a59501900000000
0b1e0103802c1778eafff5a556499d24
165054adcf0081408180950001010101
010101010101fd2540a060841a303020
3500b8e61000001e662150b051001b30
40703600b0f31000001e000000fd0032
4c1e5211000a202020202020000000fc
0048444d490a202020202020202001ee
02031bf1489345040201130312230907
078301000065030c001000011d007251
d01e206e285500a05a0000001e000000
00000000000000000000000000000000
00000000000000000000000000000000
00000000000000000000000000000000
00000000000000000000000000000000
0000000000000000000000000000006c

Extracted contents:
header:          00 ff ff ff ff ff ff 00
serial number:   2a 59 50 19 00 00 00 00 0b 1e
version:         01 03
basic params:    80 2c 17 78 ea
chroma info:     ff f5 a5 56 49 9d 24 16 50 54
established:     ad cf 00
standard:        81 40 81 80 95 00 01 01 01 01 01 01 01 01 01 01
descriptor 1:    fd 25 40 a0 60 84 1a 30 30 20 35 00 b8 e6 10 00 00 1e
descriptor 2:    66 21 50 b0 51 00 1b 30 40 70 36 00 b0 f3 10 00 00 1e
descriptor 3:    00 00 00 fd 00 32 4c 1e 52 11 00 0a 20 20 20 20 20 20
descriptor 4:    00 00 00 fc 00 48 44 4d 49 0a 20 20 20 20 20 20 20 20
extensions:      01
checksum:        ee

EDID version: 1.3
Manufacturer: JRY Model 1950 Serial Number --
Made in week 11 of 2020
Digital display
Maximum image size: 44 cm x 23 cm
Gamma: 2.20
DPMS levels: Standby Suspend Off
RGB color display
First detailed timing is preferred timing
Display x,y Chromaticity:
  Red:   0.6474, 0.3388
  Green: 0.2880, 0.6162
  Blue:  0.1435, 0.0888
  White: 0.3134, 0.3291
Established timings supported:
  720x400@70Hz 9:5 HorFreq: 31469 Hz Clock: 28.320 MHz
  640x480@60Hz 4:3 HorFreq: 31469 Hz Clock: 25.175 MHz
  640x480@72Hz 4:3 HorFreq: 37900 Hz Clock: 31.500 MHz
  640x480@75Hz 4:3 HorFreq: 37500 Hz Clock: 31.500 MHz
  800x600@60Hz 4:3 HorFreq: 37900 Hz Clock: 40.000 MHz
  800x600@72Hz 4:3 HorFreq: 48100 Hz Clock: 50.000 MHz
  800x600@75Hz 4:3 HorFreq: 46900 Hz Clock: 49.500 MHz
  1024x768@60Hz 4:3 HorFreq: 48400 Hz Clock: 65.000 MHz
  1024x768@70Hz 4:3 HorFreq: 56500 Hz Clock: 75.000 MHz
  1024x768@75Hz 4:3 HorFreq: 60000 Hz Clock: 78.750 MHz
  1280x1024@75Hz 5:4 HorFreq: 80000 Hz Clock: 135.000 MHz
Standard timings supported:
  1280x960@60Hz 4:3 HorFreq: 60000 Hz Clock: 108.000 MHz
  1280x1024@60Hz 5:4 HorFreq: 64000 Hz Clock: 108.000 MHz
  1440x900@60Hz 16:10 HorFreq: 55500 Hz Clock: 88.750 MHz
Detailed mode: Clock 97.250 MHz, 440 mm x 230 mm
               1600 1648 1680 1760 hborder 0
                900  903  908  926 vborder 0
               +hsync +vsync 
               VertFreq: 59 Hz, HorFreq: 55255 Hz
Detailed mode: Clock 85.500 MHz, 432 mm x 243 mm
               1360 1424 1536 1792 hborder 0
                768  771  777  795 vborder 0
               +hsync +vsync 
               VertFreq: 60 Hz, HorFreq: 47712 Hz
Monitor ranges (GTF): 50-76Hz V, 30-82kHz H, max dotclock 170MHz
Monitor name: HDMI
Has 1 extension blocks
Checksum: 0xee (valid)

CTA extension block
Extension version: 3
23 bytes of CTA data
  Video data block
    VIC  19 1280x720@50Hz 16:9 (native) HorFreq: 37500 Hz Clock: 74.250 MHz
    VIC  69 1280x720@60Hz 64:27  HorFreq: 45000 Hz Clock: 74.250 MHz
    VIC   4 1280x720@60Hz 16:9  HorFreq: 45000 Hz Clock: 74.250 MHz
    VIC   2 720x480@60Hz 4:3  HorFreq: 31469 Hz Clock: 27.000 MHz
    VIC   1 640x480@60Hz 4:3  HorFreq: 31469 Hz Clock: 25.175 MHz
    VIC  19 1280x720@50Hz 16:9  HorFreq: 37500 Hz Clock: 74.250 MHz
    VIC   3 720x480@60Hz 16:9  HorFreq: 31469 Hz Clock: 27.000 MHz
    VIC  18 720x576@50Hz 16:9  HorFreq: 31250 Hz Clock: 27.000 MHz
  Audio data block
    Linear PCM, max channels 2
      Supported sample rates (kHz): 48 44.1 32
      Supported sample sizes (bits): 24 20 16
  Speaker allocation data block
    Speaker map:
      FL/FR - Front Left/Right
  Vendor-specific data block, OUI 000c03 (HDMI)
    Source physical address 1.0.0.0
Underscans PC formats by default
Basic audio support
Supports YCbCr 4:4:4
Supports YCbCr 4:2:2
1 native detailed modes
Detailed mode: Clock 74.250 MHz, 160 mm x 90 mm
               1280 1390 1430 1650 hborder 0
                720  725  730  750 vborder 0
               +hsync +vsync 
               VertFreq: 60 Hz, HorFreq: 45000 Hz
Checksum: 0x6c (valid)



