edid-decode (hex):

00 ff ff ff ff ff ff 00 22 f0 0e 28 01 01 01 01
29 13 01 03 68 34 20 78 ee b5 35 a5 56 4a 9a 25
10 50 54 a5 6b 80 81 40 81 80 95 00 b3 00 d1 00
01 01 01 01 01 01 28 3c 80 a0 70 b0 23 40 30 20
36 00 06 44 21 00 00 1a 00 00 00 fd 00 30 55 18
5e 14 00 0a 20 20 20 20 20 20 00 00 00 fc 00 48
50 20 4c 32 34 34 35 77 0a 20 20 20 00 00 00 ff
00 43 5a 51 39 34 31 30 35 5a 39 0a 20 20 00 e0

00 ff ff ff ff ff ff 00 22 f0 0e 28 01 01 01 01
29 13 01 03 68 34 20 78 ee b5 35 a5 56 4a 9a 25
10 50 54 a5 6b 80 81 40 81 80 95 00 b3 00 d1 00
01 01 01 01 01 01 28 3c 80 a0 70 b0 23 40 30 20
36 00 06 44 21 00 00 1a 00 00 00 fd 00 30 55 18
5e 14 00 0a 20 20 20 20 20 20 00 00 00 fc 00 48
50 20 4c 32 34 34 35 77 0a 20 20 20 00 00 00 ff
00 43 5a 51 39 34 31 30 35 5a 39 0a 20 20 00 e0

----------------

Block 0, Base EDID:
  EDID Structure Version & Revision: 1.3
  Vendor & Product Identification:
    Manufacturer: HWP
    Model: 10254
    Serial Number: ...
    Made in: week 41 of 2009
  Basic Display Parameters & Features:
    Analog display
    Signal Level Standard: 0.700 : 0.000 : 0.700 V p-p
    Blank level equals black level
    Sync: Separate
    Maximum image size: 52 cm x 32 cm
    Gamma: 2.20
    DPMS levels: Standby Suspend Off
    RGB color display
    Default (sRGB) color space is primary color space
    First detailed timing is the preferred timing
  Color Characteristics:
    Red  : 0.6464, 0.3388
    Green: 0.2900, 0.6025
    Blue : 0.1445, 0.0654
    White: 0.3134, 0.3291
  Established Timings I & II:
    IBM     :   720x400    70.081663 Hz   9:5     31.467 kHz     28.320000 MHz
    DMT 0x04:   640x480    59.940476 Hz   4:3     31.469 kHz     25.175000 MHz
    DMT 0x06:   640x480    75.000000 Hz   4:3     37.500 kHz     31.500000 MHz
    DMT 0x09:   800x600    60.316541 Hz   4:3     37.879 kHz     40.000000 MHz
    DMT 0x0b:   800x600    75.000000 Hz   4:3     46.875 kHz     49.500000 MHz
    Apple   :   832x624    74.551266 Hz   4:3     49.726 kHz     57.284000 MHz
    DMT 0x10:  1024x768    60.003840 Hz   4:3     48.363 kHz     65.000000 MHz
    DMT 0x12:  1024x768    75.028582 Hz   4:3     60.023 kHz     78.750000 MHz
    DMT 0x24:  1280x1024   75.024675 Hz   5:4     79.976 kHz    135.000000 MHz
    Apple   :  1152x870    75.061550 Hz 192:145   68.681 kHz    100.000000 MHz
  Standard Timings:
    DMT 0x20:  1280x960    60.000000 Hz   4:3     60.000 kHz    108.000000 MHz
    DMT 0x23:  1280x1024   60.019740 Hz   5:4     63.981 kHz    108.000000 MHz
    DMT 0x2f:  1440x900    59.887445 Hz  16:10    55.935 kHz    106.500000 MHz
    DMT 0x3a:  1680x1050   59.954250 Hz  16:10    65.290 kHz    146.250000 MHz
    DMT 0x45:  1920x1200   59.884600 Hz  16:10    74.556 kHz    193.250000 MHz
  Detailed Timing Descriptors:
    DTD 1:  1920x1200   59.950171 Hz  16:10    74.038 kHz    154.000000 MHz (518 mm x 324 mm)
                 Hfront   48 Hsync  32 Hback   80 Hpol P
                 Vfront    3 Vsync   6 Vback   26 Vpol N
    Display Range Limits:
      Monitor ranges (GTF): 48-85 Hz V, 24-94 kHz H, max dotclock 200 MHz
    Display Product Name: 'HP L2445w'
    Display Product Serial Number: ...
Checksum: 0xe0

----------------

Block 1, Unknown EDID Extension Block 0x00:
  00 ff ff ff ff ff ff 00 22 f0 0e 28 01 01 01 01 '........"..(....'
  29 13 01 03 68 34 20 78 ee b5 35 a5 56 4a 9a 25 ')...h4 x..5.VJ.%'
  10 50 54 a5 6b 80 81 40 81 80 95 00 b3 00 d1 00 '.PT.k..@........'
  01 01 01 01 01 01 28 3c 80 a0 70 b0 23 40 30 20 '......(<..p.#@0 '
  36 00 06 44 21 00 00 1a 00 00 00 fd 00 30 55 18 '6..D!........0U.'
  5e 14 00 0a 20 20 20 20 20 20 00 00 00 fc 00 48 '^...      .....H'
  50 20 4c 32 34 34 35 77 0a 20 20 20 00 00 00 ff 'P L2445w.   ....'
  00 43 5a 51 39 34 31 30 35 5a 39 0a 20 20 00 e0 '.CZQ94105Z9.  ..'
Checksum: 0xe0

----------------

Failures:

Block 0, Base EDID:
  Basic Display Parameters & Features: sRGB is signaled, but the chromaticities do not match.
Block 1, Base EDID:
  Unknown Extension Block.
EDID:
  Base EDID: EDID specified 0 extension block(s), but found 1 extension block(s).

EDID conformity: FAIL
