
EDID (hex):
00ffffffffffff000dae901400000000
28160104951f117802f8459657549228
23505400000001010101010101010101
010101010101da1d56e250002030442d
470035ae10000018000000fe004e3134
304247452d4541330a20000000fe0043
4d4e0a202020202020202020000000fe
004e3134304247452d4541330a200000

Extracted contents:
header:          00 ff ff ff ff ff ff 00
serial number:   0d ae 90 14 00 00 00 00 28 16
version:         01 04
basic params:    95 1f 11 78 02
chroma info:     f8 45 96 57 54 92 28 23 50 54
established:     00 00 00
standard:        01 01 01 01 01 01 01 01 01 01 01 01 01 01 01 01
descriptor 1:    da 1d 56 e2 50 00 20 30 44 2d 47 00 35 ae 10 00 00 18
descriptor 2:    00 00 00 fe 00 4e 31 34 30 42 47 45 2d 45 41 33 0a 20
descriptor 3:    00 00 00 fe 00 43 4d 4e 0a 20 20 20 20 20 20 20 20 20
descriptor 4:    00 00 00 fe 00 4e 31 34 30 42 47 45 2d 45 41 33 0a 20
extensions:      00
checksum:        00

EDID version: 1.4
Manufacturer: CMN Model 1490 Serial Number --
Made in week 40 of 2012
Digital display
6 bits per primary color channel
DisplayPort interface
Maximum image size: 31 cm x 17 cm
Gamma: 2.20
Supported color formats: RGB 4:4:4
First detailed timing includes the native pixel format and preferred refresh rate
Display x,y Chromaticity:
  Red:   0.5888, 0.3427
  Green: 0.3300, 0.5703
  Blue:  0.1572, 0.1367
  White: 0.3134, 0.3291
Established timings supported:
Standard timings supported:
Detailed mode: Clock 76.420 MHz, 309 mm x 174 mm
               1366 1434 1479 1592 hborder 0
                768  772  779  800 vborder 0
               -hsync -vsync 
               VertFreq: 60 Hz, HorFreq: 48002 Hz
ASCII string: N140BGE-EA3
ASCII string: CMN
ASCII string: N140BGE-EA3
Checksum: 0x0 (valid)
EDID block does NOT conform to EDID 1.4!
	Missing name descriptor
	Missing monitor ranges
