edid-decode (hex):

00 ff ff ff ff ff ff 00 41 8e 00 22 00 00 00 00
24 1f 01 03 08 30 1b 78 ea 79 a5 a8 55 51 a2 27
10 50 54 bf ef 80 d1 c0 b3 00 95 00 81 80 81 40
81 c0 81 00 71 40 1a 36 80 a0 70 38 1f 40 30 20
25 00 dc 0c 11 00 00 1e 00 00 00 fd 00 38 4b 1e
53 11 00 0a 20 20 20 20 20 20 00 00 00 ff 00 4e
41 0a 20 20 20 20 20 20 20 20 20 20 00 00 00 fc
00 50 4c 4e 32 32 30 30 0a 20 20 20 20 20 00 f9

00 ff ff ff ff ff ff 00 41 8e 00 22 00 00 00 00
24 1f 01 03 08 30 1b 78 ea 79 a5 a8 55 51 a2 27
10 50 54 bf ef 80 d1 c0 b3 00 95 00 81 80 81 40
81 c0 81 00 71 40 1a 36 80 a0 70 38 1f 40 30 20
25 00 dc 0c 11 00 00 1e 00 00 00 fd 00 38 4b 1e
53 11 00 0a 20 20 20 20 20 20 00 00 00 ff 00 4e
41 0a 20 20 20 20 20 20 20 20 20 20 00 00 00 fc
00 50 4c 4e 32 32 30 30 0a 20 20 20 20 20 00 f9

----------------

Block 0, Base EDID:
  EDID Structure Version & Revision: 1.3
  Vendor & Product Identification:
    Manufacturer: PLN
    Model: 8704
    Made in: week 36 of 2021
  Basic Display Parameters & Features:
    Analog display
    Signal Level Standard: 0.700 : 0.300 : 1.000 V p-p
    Blank level equals black level
    Sync: Separate
    Maximum image size: 48 cm x 27 cm
    Gamma: 2.20
    DPMS levels: Standby Suspend Off
    RGB color display
    First detailed timing is the preferred timing
  Color Characteristics:
    Red  : 0.6572, 0.3349
    Green: 0.3183, 0.6337
    Blue : 0.1542, 0.0644
    White: 0.3134, 0.3291
  Established Timings I & II:
    IBM     :   720x400    70.081663 Hz   9:5     31.467 kHz     28.320000 MHz
    DMT 0x04:   640x480    59.940476 Hz   4:3     31.469 kHz     25.175000 MHz
    Apple   :   640x480    66.666667 Hz   4:3     35.000 kHz     30.240000 MHz
    DMT 0x05:   640x480    72.808802 Hz   4:3     37.861 kHz     31.500000 MHz
    DMT 0x06:   640x480    75.000000 Hz   4:3     37.500 kHz     31.500000 MHz
    DMT 0x08:   800x600    56.250000 Hz   4:3     35.156 kHz     36.000000 MHz
    DMT 0x09:   800x600    60.316541 Hz   4:3     37.879 kHz     40.000000 MHz
    DMT 0x0a:   800x600    72.187572 Hz   4:3     48.077 kHz     50.000000 MHz
    DMT 0x0b:   800x600    75.000000 Hz   4:3     46.875 kHz     49.500000 MHz
    Apple   :   832x624    74.551266 Hz   4:3     49.726 kHz     57.284000 MHz
    DMT 0x10:  1024x768    60.003840 Hz   4:3     48.363 kHz     65.000000 MHz
    DMT 0x11:  1024x768    70.069359 Hz   4:3     56.476 kHz     75.000000 MHz
    DMT 0x12:  1024x768    75.028582 Hz   4:3     60.023 kHz     78.750000 MHz
    DMT 0x24:  1280x1024   75.024675 Hz   5:4     79.976 kHz    135.000000 MHz
    Apple   :  1152x870    75.061550 Hz 192:145   68.681 kHz    100.000000 MHz
  Standard Timings:
    DMT 0x52:  1920x1080   60.000000 Hz  16:9     67.500 kHz    148.500000 MHz
    DMT 0x3a:  1680x1050   59.954250 Hz  16:10    65.290 kHz    146.250000 MHz
    DMT 0x2f:  1440x900    59.887445 Hz  16:10    55.935 kHz    106.500000 MHz
    DMT 0x23:  1280x1024   60.019740 Hz   5:4     63.981 kHz    108.000000 MHz
    DMT 0x20:  1280x960    60.000000 Hz   4:3     60.000 kHz    108.000000 MHz
    DMT 0x55:  1280x720    60.000000 Hz  16:9     45.000 kHz     74.250000 MHz
    DMT 0x1c:  1280x800    59.810326 Hz  16:10    49.702 kHz     83.500000 MHz
    GTF     :  1152x864    60.000000 Hz   4:3     53.700 kHz     81.624000 MHz
  Detailed Timing Descriptors:
    DTD 1:  1920x1080   59.933878 Hz  16:9     66.587 kHz    138.500000 MHz (476 mm x 268 mm)
                 Hfront   48 Hsync  32 Hback   80 Hpol P
                 Vfront    2 Vsync   5 Vback   24 Vpol P
    Display Range Limits:
      Monitor ranges (GTF): 56-75 Hz V, 30-83 kHz H, max dotclock 170 MHz
    Display Product Serial Number: ...
    Display Product Name: 'PLN2200'
Checksum: 0xf9

----------------

Block 1, Unknown EDID Extension Block 0x00:
  00 ff ff ff ff ff ff 00 41 8e 00 22 00 00 00 00 '........A.."....'
  24 1f 01 03 08 30 1b 78 ea 79 a5 a8 55 51 a2 27 '$....0.x.y..UQ.''
  10 50 54 bf ef 80 d1 c0 b3 00 95 00 81 80 81 40 '.PT............@'
  81 c0 81 00 71 40 1a 36 80 a0 70 38 1f 40 30 20 '....q@.6..p8.@0 '
  25 00 dc 0c 11 00 00 1e 00 00 00 fd 00 38 4b 1e '%............8K.'
  53 11 00 0a 20 20 20 20 20 20 00 00 00 ff 00 4e 'S...      .....N'
  41 0a 20 20 20 20 20 20 20 20 20 20 00 00 00 fc 'A.          ....'
  00 50 4c 4e 32 32 30 30 0a 20 20 20 20 20 00 f9 '.PLN2200.     ..'
Checksum: 0xf9

----------------

Failures:

Block 1, Base EDID:
  Unknown Extension Block.
EDID:
  Base EDID: EDID specified 0 extension block(s), but found 1 extension block(s).

EDID conformity: FAIL
