
EDID (hex):
00ffffffffffff0030e4270700000000
001f0104a51d127807ed85a7544c9c26
0e505400000001010101010101010101
010101010101353c80a070b023403020
36001eb31000001a0000000000000000
00000000000000000000000000fe004c
4720446973706c61790a2020000000fe
004c503133335755312d535042320058

Extracted contents:
header:          00 ff ff ff ff ff ff 00
serial number:   30 e4 27 07 00 00 00 00 00 1f
version:         01 04
basic params:    a5 1d 12 78 07
chroma info:     ed 85 a7 54 4c 9c 26 0e 50 54
established:     00 00 00
standard:        01 01 01 01 01 01 01 01 01 01 01 01 01 01 01 01
descriptor 1:    35 3c 80 a0 70 b0 23 40 30 20 36 00 1e b3 10 00 00 1a
descriptor 2:    00 00 00 00 00 00 00 00 00 00 00 00 00 00 00 00 00 00
descriptor 3:    00 00 00 fe 00 4c 47 20 44 69 73 70 6c 61 79 0a 20 20
descriptor 4:    00 00 00 fe 00 4c 50 31 33 33 57 55 31 2d 53 50 42 32
extensions:      00
checksum:        58

EDID version: 1.4
Manufacturer: LGD Model 727 Serial Number --
Made in year 2021
Digital display
8 bits per primary color channel
DisplayPort interface
Maximum image size: 29 cm x 18 cm
Gamma: 2.20
Supported color formats: RGB 4:4:4
Default (sRGB) color space is primary color space
First detailed timing includes the native pixel format and preferred refresh rate
Display is continuous frequency
Display x,y Chromaticity:
  Red:   0.6552, 0.3300
  Green: 0.2998, 0.6103
  Blue:  0.1503, 0.0546
  White: 0.3134, 0.3291
Established timings supported:
Standard timings supported:
Detailed mode: Clock 154.130 MHz, 286 mm x 179 mm
               1920 1968 2000 2080 hborder 0
               1200 1203 1209 1235 vborder 0
               +hsync -vsync 
               VertFreq: 60 Hz, HorFreq: 74100 Hz
Manufacturer-specified data, tag 0
ASCII string: LG Display
ASCII string: LP133WU1-SPB2
Checksum: 0x58 (valid)
EDID block does NOT conform to EDID 1.4!
	sRGB is signaled, but the chromaticities do not match
	Missing name descriptor
	Missing monitor ranges
