
EDID (hex):
00ffffffffffff0009e5520700000000
011b0104952213780224309357589329
21505400000001010101010101010101
010101010101ce1d56e250001e303020
360058c21000001ace1d56a953003c30
3020360058c21000001a000000000000
00000000000000000000000000000002
00113fea0b3c6e0d0e196e0a20200058

Extracted contents:
header:          00 ff ff ff ff ff ff 00
serial number:   09 e5 52 07 00 00 00 00 01 1b
version:         01 04
basic params:    95 22 13 78 02
chroma info:     24 30 93 57 58 93 29 21 50 54
established:     00 00 00
standard:        01 01 01 01 01 01 01 01 01 01 01 01 01 01 01 01
descriptor 1:    ce 1d 56 e2 50 00 1e 30 30 20 36 00 58 c2 10 00 00 1a
descriptor 2:    ce 1d 56 a9 53 00 3c 30 30 20 36 00 58 c2 10 00 00 1a
descriptor 3:    00 00 00 00 00 00 00 00 00 00 00 00 00 00 00 00 00 00
descriptor 4:    00 00 00 02 00 11 3f ea 0b 3c 6e 0d 0e 19 6e 0a 20 20
extensions:      00
checksum:        58

EDID version: 1.4
Manufacturer: BOE Model 752 Serial Number --
Made in week 1 of 2017
Digital display
6 bits per primary color channel
DisplayPort interface
Maximum image size: 34 cm x 19 cm
Gamma: 2.20
Supported color formats: RGB 4:4:4
First detailed timing includes the native pixel format and preferred refresh rate
Display x,y Chromaticity:
  Red:   0.5742, 0.3417
  Green: 0.3447, 0.5742
  Blue:  0.1601, 0.1318
  White: 0.3125, 0.3281
Established timings supported:
Standard timings supported:
Detailed mode: Clock 76.300 MHz, 344 mm x 194 mm
               1366 1414 1446 1592 hborder 0
                768  771  777  798 vborder 0
               +hsync -vsync 
               VertFreq: 60 Hz, HorFreq: 47927 Hz
Detailed mode: Clock 76.300 MHz, 344 mm x 194 mm
               1366 1414 1446 2303 hborder 0
                768  771  777  828 vborder 0
               +hsync -vsync 
               VertFreq: 40 Hz, HorFreq: 33130 Hz
Manufacturer-specified data, tag 0
Manufacturer-specified data, tag 2
Checksum: 0x58 (valid)
EDID block does NOT conform to EDID 1.4!
	Missing name descriptor
	Missing monitor ranges


