edid-decode (hex):

00 ff ff ff ff ff ff 00 0d ae b5 15 00 00 00 00
02 16 01 03 80 22 13 78 0a d1 f5 93 5d 59 90 26
1d 50 54 00 00 00 01 01 01 01 01 01 01 01 01 01
01 01 01 01 01 01 d8 1d 56 e2 50 00 1f 30 44 2e
46 00 58 c2 10 00 00 18 a6 00 00 fe 00 4e 31 35
36 42 47 45 2d 4c 41 31 0a 20 00 00 00 fe 00 43
4d 4e 0a 20 20 20 20 20 20 20 20 20 00 00 00 fe
00 4e 31 35 36 42 47 45 2d 4c 41 31 0a 20 00 90

----------------

Block 0, Base EDID:
  EDID Structure Version & Revision: 1.3
  Vendor & Product Identification:
    Manufacturer: CMN
    Model: 5557
    Made in: week 2 of 2012
  Basic Display Parameters & Features:
    Digital display
    Maximum image size: 34 cm x 19 cm
    Gamma: 2.20
    RGB color display
    First detailed timing is preferred timing
  Color Characteristics:
    Red  : 0.5771, 0.3642
    Green: 0.3476, 0.5634
    Blue : 0.1513, 0.1162
    White: 0.3134, 0.3291
  Established Timings I & II: none
  Standard Timings: none
  Detailed Timing Descriptors:
    DTD 1:  1366x768    60.063 Hz 683:384  47.990 kHz  76.400 MHz (344 mm x 194 mm)
                 Hfront   68 Hsync  46 Hback 112 Hpol N
                 Vfront    4 Vsync   6 Vback  21 Vpol N
    Detailed mode: a6 00 00 fe 00 4e 31 35 36 42 47 45 2d 4c 41 31 0a 20 '.....N156BGE-LA1. '
    Alphanumeric Data String: 'CMN'
    Alphanumeric Data String: 'N156BGE-LA1'
Checksum: 0x90
