edid-decode (hex):

00 ff ff ff ff ff ff 00 06 af ec 40 00 00 00 00
00 13 01 03 80 22 13 78 0a d7 75 93 55 55 8d 29
24 50 54 00 00 00 01 01 01 01 01 01 01 01 01 01
01 01 01 01 01 01 15 1c 56 aa 50 00 0c 30 30 20
36 00 58 c1 10 00 00 18 b9 12 56 aa 50 00 0c 30
30 20 36 00 58 c1 10 00 00 18 00 00 00 fe 00 41
55 4f 0a 20 20 20 20 20 20 20 20 20 00 00 00 fe
00 42 31 35 36 58 57 30 34 20 56 30 20 0a 00 52

----------------

Block 0, Base EDID:
  EDID Structure Version & Revision: 1.3
  Vendor & Product Identification:
    Manufacturer: AUO
    Model: 16620
    Made in: 2009
  Basic Display Parameters & Features:
    Digital display
    Maximum image size: 34 cm x 19 cm
    Gamma: 2.20
    RGB color display
    First detailed timing is the preferred timing
  Color Characteristics:
    Red  : 0.5771, 0.3330
    Green: 0.3330, 0.5537
    Blue : 0.1611, 0.1435
    White: 0.3134, 0.3291
  Established Timings I & II: none
  Standard Timings: none
  Detailed Timing Descriptors:
    DTD 1:  1366x768    60.004 Hz 683:384  46.803 kHz  71.890 MHz (344 mm x 193 mm)
                 Hfront   48 Hsync  32 Hback  90 Hpol N
                 Vfront    3 Vsync   6 Vback   3 Vpol N
    DTD 2:  1366x768    40.006 Hz 683:384  31.204 kHz  47.930 MHz (344 mm x 193 mm)
                 Hfront   48 Hsync  32 Hback  90 Hpol N
                 Vfront    3 Vsync   6 Vback   3 Vpol N
    Alphanumeric Data String: 'AUO'
    Alphanumeric Data String: 'B156XW04 V0 '
Checksum: 0x52

----------------

Failures:

Block 0, Base EDID:
  Alphanumeric Data String: One or more trailing spaces.
  Missing Display Product Name.
  Missing Display Range Limits Descriptor.

EDID conformity: FAIL
