edid-decode (hex):

00 ff ff ff ff ff ff 00 09 e5 66 0b 00 00 00 00
1a 20 01 04 a5 1e 13 78 07 14 1b a7 54 4c 9b 24
12 52 58 00 00 00 01 01 01 01 01 01 01 01 01 01
01 01 01 01 01 01 9c 3e 80 c8 70 b0 3c 40 30 20
36 00 2e bc 10 00 00 1a 16 32 80 c8 70 b0 3c 40
30 20 36 00 2e bc 10 00 00 1a 00 00 00 fd 00 1e
3c 4c 4c 10 01 0a 20 20 20 20 20 20 00 00 00 fe
00 4e 45 31 34 30 57 55 4d 2d 4e 36 47 0a 00 09

00 ff ff ff ff ff ff 00 09 e5 66 0b 00 00 00 00
1a 20 01 04 a5 1e 13 78 07 14 1b a7 54 4c 9b 24
12 52 58 00 00 00 01 01 01 01 01 01 01 01 01 01
01 01 01 01 01 01 9c 3e 80 c8 70 b0 3c 40 30 20
36 00 2e bc 10 00 00 1a 16 32 80 c8 70 b0 3c 40
30 20 36 00 2e bc 10 00 00 1a 00 00 00 fd 00 1e
3c 4c 4c 10 01 0a 20 20 20 20 20 20 00 00 00 fe
00 4e 45 31 34 30 57 55 4d 2d 4e 36 47 0a 00 09

----------------

Block 0, Base EDID:
  EDID Structure Version & Revision: 1.4
  Vendor & Product Identification:
    Manufacturer: BOE
    Model: 2918
    Made in: week 26 of 2022
  Basic Display Parameters & Features:
    Digital display
    Bits per primary color channel: 8
    DisplayPort interface
    Maximum image size: 30 cm x 19 cm
    Gamma: 2.20
    Supported color formats: RGB 4:4:4
    Default (sRGB) color space is primary color space
    First detailed timing includes the native pixel format and preferred refresh rate
    Display is continuous frequency
  Color Characteristics:
    Red  : 0.6523, 0.3291
    Green: 0.2978, 0.6054
    Blue : 0.1406, 0.0712
    White: 0.3222, 0.3466
  Established Timings I & II: none
  Standard Timings: none
  Detailed Timing Descriptors:
    DTD 1:  1920x1200   60.002995 Hz  16:10    75.604 kHz    160.280000 MHz (302 mm x 188 mm)
                 Hfront   48 Hsync  32 Hback  120 Hpol P
                 Vfront    3 Vsync   6 Vback   51 Vpol N
    DTD 2:  1920x1200   48.000898 Hz  16:10    60.481 kHz    128.220000 MHz (302 mm x 188 mm)
                 Hfront   48 Hsync  32 Hback  120 Hpol P
                 Vfront    3 Vsync   6 Vback   51 Vpol N
    Display Range Limits:
      Monitor ranges (Bare Limits): 30-60 Hz V, 76-76 kHz H, max dotclock 160 MHz
    Alphanumeric Data String: 'NE140WUM-N6G'
Checksum: 0x09

----------------

Block 1, Unknown EDID Extension Block 0x00:
  00 ff ff ff ff ff ff 00 09 e5 66 0b 00 00 00 00 '..........f.....'
  1a 20 01 04 a5 1e 13 78 07 14 1b a7 54 4c 9b 24 '. .....x....TL.$'
  12 52 58 00 00 00 01 01 01 01 01 01 01 01 01 01 '.RX.............'
  01 01 01 01 01 01 9c 3e 80 c8 70 b0 3c 40 30 20 '.......>..p.<@0 '
  36 00 2e bc 10 00 00 1a 16 32 80 c8 70 b0 3c 40 '6........2..p.<@'
  30 20 36 00 2e bc 10 00 00 1a 00 00 00 fd 00 1e '0 6.............'
  3c 4c 4c 10 01 0a 20 20 20 20 20 20 00 00 00 fe '<LL...      ....'
  00 4e 45 31 34 30 57 55 4d 2d 4e 36 47 0a 00 09 '.NE140WUM-N6G...'
Checksum: 0x09

----------------

Warnings:

Block 0, Base EDID:
  Missing Display Product Name.
EDID:
  Base EDID: Some timings are out of range of the Monitor Ranges:
    Horizontal Freq: 60.481 - 75.603 kHz (Monitor: 76.000 - 76.000 kHz)
    Maximum Clock: 160.280 MHz (Monitor: 160.000 MHz)

Failures:

Block 0, Base EDID:
  Basic Display Parameters & Features: sRGB is signaled, but the chromaticities do not match.
Block 1, Base EDID:
  Unknown Extension Block.
EDID:
  Base EDID: EDID specified 0 extension block(s), but found 1 extension block(s).

EDID conformity: FAIL
