
EDID (hex):
00ffffffffffff000472fb01ea897003
25140104a5331d7822c285a4564d9c25
125054b30c00714f810081809500d1c0
010101010101023a801871382d40582c
4500fe1f1100001e000000fd00314b1e
5e15000a202020202020000000fc0041
6365722050323336480a2020000000ff
004c51533057303232343332310a00ea

Extracted contents:
header:          00 ff ff ff ff ff ff 00
serial number:   04 72 fb 01 ea 89 70 03 25 14
version:         01 04
basic params:    a5 33 1d 78 22
chroma info:     c2 85 a4 56 4d 9c 25 12 50 54
established:     b3 0c 00
standard:        71 4f 81 00 81 80 95 00 d1 c0 01 01 01 01 01 01
descriptor 1:    02 3a 80 18 71 38 2d 40 58 2c 45 00 fe 1f 11 00 00 1e
descriptor 2:    00 00 00 fd 00 31 4b 1e 5e 15 00 0a 20 20 20 20 20 20
descriptor 3:    00 00 00 fc 00 41 63 65 72 20 50 32 33 36 48 0a 20 20
descriptor 4:    00 00 00 ff 00 4c 51 53 30 57 30 32 32 34 33 32 31 0a
extensions:      00
checksum:        ea

EDID version: 1.4
Manufacturer: ACR Model 1fb Serial Number --
Made in week 37 of 2010
Digital display
8 bits per primary color channel
DisplayPort interface
Maximum image size: 51 cm x 29 cm
Gamma: 2.20
DPMS levels: Off
Supported color formats: RGB 4:4:4
First detailed timing includes the native pixel format and preferred refresh rate
Display x,y Chromaticity:
  Red:   0.6435, 0.3359
  Green: 0.3007, 0.6113
  Blue:  0.1464, 0.0703
  White: 0.3134, 0.3291
Established timings supported:
  720x400@70Hz 9:5 HorFreq: 31469 Hz Clock: 28.320 MHz
  640x480@60Hz 4:3 HorFreq: 31469 Hz Clock: 25.175 MHz
  640x480@67Hz 4:3 HorFreq: 35000 Hz Clock: 30.240 MHz
  800x600@56Hz 4:3 HorFreq: 35200 Hz Clock: 36.000 MHz
  800x600@60Hz 4:3 HorFreq: 37900 Hz Clock: 40.000 MHz
  1024x768@60Hz 4:3 HorFreq: 48400 Hz Clock: 65.000 MHz
  1024x768@70Hz 4:3 HorFreq: 56500 Hz Clock: 75.000 MHz
Standard timings supported:
  1152x864@75Hz 4:3 HorFreq: 67500 Hz Clock: 108.000 MHz
  1280x800@60Hz 16:10
  1280x1024@60Hz 5:4 HorFreq: 64000 Hz Clock: 108.000 MHz
  1440x900@60Hz 16:10 HorFreq: 55500 Hz Clock: 88.750 MHz
  1920x1080@60Hz 16:9
Detailed mode: Clock 148.500 MHz, 510 mm x 287 mm
               1920 2008 2052 2200 hborder 0
               1080 1084 1089 1125 vborder 0
               +hsync +vsync 
               VertFreq: 60 Hz, HorFreq: 67500 Hz
Monitor ranges (GTF): 49-75Hz V, 30-94kHz H, max dotclock 210MHz
Monitor name: Acer P236H
Serial number: --
Checksum: 0xea (valid)


