
EDID (hex):
00ffffffffffff000472f60183714103
22140103682c19782aee91a3544c9926
0f5054bfcf80714f818081c08100a9c0
010101010101302a40c8608464301850
1300bbf91000001e000000fd00374b1e
5110000a202020202020000000ff0051
33513038303034343230300a000000fc
0041636572204532303048560a2000cf

Extracted contents:
header:          00 ff ff ff ff ff ff 00
serial number:   04 72 f6 01 83 71 41 03 22 14
version:         01 03
basic params:    68 2c 19 78 2a
chroma info:     ee 91 a3 54 4c 99 26 0f 50 54
established:     bf cf 80
standard:        71 4f 81 80 81 c0 81 00 a9 c0 01 01 01 01 01 01
descriptor 1:    30 2a 40 c8 60 84 64 30 18 50 13 00 bb f9 10 00 00 1e
descriptor 2:    00 00 00 fd 00 37 4b 1e 51 10 00 0a 20 20 20 20 20 20
descriptor 3:    00 00 00 ff 00 51 33 51 30 38 30 30 34 34 32 30 30 0a
descriptor 4:    00 00 00 fc 00 41 63 65 72 20 45 32 30 30 48 56 0a 20
extensions:      00
checksum:        cf

EDID version: 1.3
Manufacturer: ACR Model 1f6 Serial Number --
Made in week 34 of 2010
Analog display, Input voltage level: 0.7/0.7 V
Sync: Separate 
Maximum image size: 44 cm x 25 cm
Gamma: 2.20
DPMS levels: Off
RGB color display
First detailed timing is preferred timing
Display x,y Chromaticity:
  Red:   0.6396, 0.3300
  Green: 0.2998, 0.5996
  Blue:  0.1503, 0.0595
  White: 0.3125, 0.3291
Established timings supported:
  720x400@70Hz 9:5 HorFreq: 31469 Hz Clock: 28.320 MHz
  640x480@60Hz 4:3 HorFreq: 31469 Hz Clock: 25.175 MHz
  640x480@67Hz 4:3 HorFreq: 35000 Hz Clock: 30.240 MHz
  640x480@72Hz 4:3 HorFreq: 37900 Hz Clock: 31.500 MHz
  640x480@75Hz 4:3 HorFreq: 37500 Hz Clock: 31.500 MHz
  800x600@56Hz 4:3 HorFreq: 35200 Hz Clock: 36.000 MHz
  800x600@60Hz 4:3 HorFreq: 37900 Hz Clock: 40.000 MHz
  800x600@72Hz 4:3 HorFreq: 48100 Hz Clock: 50.000 MHz
  800x600@75Hz 4:3 HorFreq: 46900 Hz Clock: 49.500 MHz
  1024x768@60Hz 4:3 HorFreq: 48400 Hz Clock: 65.000 MHz
  1024x768@70Hz 4:3 HorFreq: 56500 Hz Clock: 75.000 MHz
  1024x768@75Hz 4:3 HorFreq: 60000 Hz Clock: 78.750 MHz
  1280x1024@75Hz 5:4 HorFreq: 80000 Hz Clock: 135.000 MHz
  1152x870@75Hz 192:145 HorFreq: 67500 Hz Clock: 108.000 MHz
Standard timings supported:
  1152x864@75Hz 4:3 HorFreq: 67500 Hz Clock: 108.000 MHz
  1280x1024@60Hz 5:4 HorFreq: 64000 Hz Clock: 108.000 MHz
  1280x720@60Hz 16:9
  1280x800@60Hz 16:10
  1600x900@60Hz 16:9
Detailed mode: Clock 108.000 MHz, 443 mm x 249 mm
               1600 1624 1704 1800 hborder 0
                900  901  904 1000 vborder 0
               +hsync +vsync 
               VertFreq: 60 Hz, HorFreq: 60000 Hz
Monitor ranges (GTF): 55-75Hz V, 30-81kHz H, max dotclock 160MHz
Serial number: --
Monitor name: Acer E200HV
Checksum: 0xcf (valid)


