edid-decode (hex):

00 ff ff ff ff ff ff 00 0d ae 76 14 00 00 00 00
33 15 01 03 80 1f 11 78 0a 2b 35 97 57 54 8f 29
23 50 54 00 00 00 01 01 01 01 01 01 01 01 01 01
01 01 01 01 01 01 da 1d 56 e2 50 00 20 30 44 2d
47 00 35 ae 10 00 00 18 00 00 00 fe 00 4e 31 34
30 42 47 45 2d 4c 42 32 0a 20 00 00 00 fe 00 43
4d 4e 0a 20 20 20 20 20 20 20 20 20 00 00 00 fe
00 4e 31 34 30 42 47 45 2d 4c 42 32 0a 20 00 ee

----------------

Block 0, Base EDID:
  EDID Structure Version & Revision: 1.3
  Vendor & Product Identification:
    Manufacturer: CMN
    Model: 5238
    Made in: week 51 of 2011
  Basic Display Parameters & Features:
    Digital display
    Maximum image size: 31 cm x 17 cm
    Gamma: 2.20
    RGB color display
    First detailed timing is preferred timing
  Color Characteristics:
    Red  : 0.5898, 0.3417
    Green: 0.3300, 0.5615
    Blue : 0.1601, 0.1396
    White: 0.3134, 0.3291
  Established Timings I & II: none
  Standard Timings: none
  Detailed Timing Descriptors:
    DTD 1:  1366x768    60.003 Hz 683:384  48.003 kHz  76.420 MHz (309 mm x 174 mm)
                 Hfront   68 Hsync  45 Hback 113 Hpol N
                 Vfront    4 Vsync   7 Vback  21 Vpol N
    Alphanumeric Data String: 'N140BGE-LB2'
    Alphanumeric Data String: 'CMN'
    Alphanumeric Data String: 'N140BGE-LB2'
Checksum: 0xee
