
EDID (hex):
00ffffffffffff0004720803a8062041
0c18010380331d782add45a3554fa027
125054b30c00714f81c0810081809500
b300d1c00101023a801871382d40582c
4500fe1f1100001e000000fd00314b1e
5e11000a202020202020000000fc0041
6365722053323331484c0a20000000ff
004c574b4141303031343334300a00f7

edid-decode (hex):

00 ff ff ff ff ff ff 00 04 72 08 03 a8 06 20 41
0c 18 01 03 80 33 1d 78 2a dd 45 a3 55 4f a0 27
12 50 54 b3 0c 00 71 4f 81 c0 81 00 81 80 95 00
b3 00 d1 c0 01 01 02 3a 80 18 71 38 2d 40 58 2c
45 00 fe 1f 11 00 00 1e 00 00 00 fd 00 31 4b 1e
5e 11 00 0a 20 20 20 20 20 20 00 00 00 fc 00 41
63 65 72 20 53 32 33 31 48 4c 0a 20 00 00 00 ff
00 4c 57 4b 41 41 30 30 31 34 33 34 30 0a 00 f7

----------------

Block 0, Base EDID:
  EDID Structure Version & Revision: 1.3
  Vendor & Product Identification:
    Manufacturer: ACR
    Model: 776
    Serial Number: 1092617896
    Made in: week 12 of 2014
  Basic Display Parameters & Features:
    Digital display
    Maximum image size: 51 cm x 29 cm
    Gamma: 2.20
    DPMS levels: Off
    RGB color display
    First detailed timing is the preferred timing
  Color Characteristics:
    Red  : 0.6396, 0.3330
    Green: 0.3115, 0.6259
    Blue : 0.1533, 0.0703
    White: 0.3134, 0.3291
  Established Timings I & II:
    IBM     :   720x400    70.081663 Hz   9:5     31.467 kHz     28.320000 MHz
    DMT 0x04:   640x480    59.940476 Hz   4:3     31.469 kHz     25.175000 MHz
    Apple   :   640x480    66.666667 Hz   4:3     35.000 kHz     30.240000 MHz
    DMT 0x08:   800x600    56.250000 Hz   4:3     35.156 kHz     36.000000 MHz
    DMT 0x09:   800x600    60.316541 Hz   4:3     37.879 kHz     40.000000 MHz
    DMT 0x10:  1024x768    60.003840 Hz   4:3     48.363 kHz     65.000000 MHz
    DMT 0x11:  1024x768    70.069359 Hz   4:3     56.476 kHz     75.000000 MHz
  Standard Timings:
    DMT 0x15:  1152x864    75.000000 Hz   4:3     67.500 kHz    108.000000 MHz
    DMT 0x55:  1280x720    60.000000 Hz  16:9     45.000 kHz     74.250000 MHz
    DMT 0x1c:  1280x800    59.810326 Hz  16:10    49.702 kHz     83.500000 MHz
    DMT 0x23:  1280x1024   60.019740 Hz   5:4     63.981 kHz    108.000000 MHz
    DMT 0x2f:  1440x900    59.887445 Hz  16:10    55.935 kHz    106.500000 MHz
    DMT 0x3a:  1680x1050   59.954250 Hz  16:10    65.290 kHz    146.250000 MHz
    DMT 0x52:  1920x1080   60.000000 Hz  16:9     67.500 kHz    148.500000 MHz
  Detailed Timing Descriptors:
    DTD 1:  1920x1080   60.000000 Hz  16:9     67.500 kHz    148.500000 MHz (510 mm x 287 mm)
                 Hfront   88 Hsync  44 Hback  148 Hpol P
                 Vfront    4 Vsync   5 Vback   36 Vpol P
    Display Range Limits:
      Monitor ranges (GTF): 49-75 Hz V, 30-94 kHz H, max dotclock 170 MHz
    Display Product Name: 'Acer S231HL'
    Display Product Serial Number: 'LWKAA0014340'
Checksum: 0xf7


