edid-decode (hex):

00 ff ff ff ff ff ff 00 15 c3 50 16 00 00 00 00
18 0f 01 02 80 22 1b 78 ea e5 e6 a3 59 4a 9c 23
14 4f 54 a1 08 00 81 80 01 01 01 01 01 01 01 01
01 01 01 01 01 01 30 2a 00 98 51 00 2a 40 30 70
13 00 52 0f 11 00 00 1e 00 00 00 ff 00 34 33 32
39 31 30 36 32 0a 20 20 20 20 00 00 00 fd 00 3b
3d 1e 41 0b 00 0a 20 20 20 20 20 20 00 00 00 fc
00 4c 35 36 35 0a 20 20 20 20 20 20 20 20 00 91

----------------

Block 0, Base EDID:
  EDID Structure Version & Revision: 1.2
  Vendor & Product Identification:
    Manufacturer: ENC
    Model: 5712
    Made in: week 24 of 2005
  Basic Display Parameters & Features:
    Digital display
    Maximum image size: 34 cm x 27 cm
    Gamma: 2.20
    DPMS levels: Standby Suspend Off
    RGB color display
    First detailed timing is preferred timing
  Color Characteristics:
    Red  : 0.6396, 0.3496
    Green: 0.2900, 0.6103
    Blue : 0.1396, 0.0800
    White: 0.3095, 0.3300
  Established Timings I & II:
    IBM     :   720x400    70.082 Hz   9:5    31.467 kHz  28.320 MHz
    DMT 0x04:   640x480    59.940 Hz   4:3    31.469 kHz  25.175 MHz
    DMT 0x09:   800x600    60.317 Hz   4:3    37.879 kHz  40.000 MHz
    DMT 0x10:  1024x768    60.004 Hz   4:3    48.363 kHz  65.000 MHz
  Standard Timings:
    DMT 0x23:  1280x1024   60.020 Hz   5:4    63.981 kHz 108.000 MHz
  Detailed Timing Descriptors:
    DTD 1:  1280x1024   60.020 Hz   5:4    63.981 kHz 108.000 MHz (338 mm x 271 mm)
                 Hfront   48 Hsync 112 Hback 248 Hpol P
                 Vfront    1 Vsync   3 Vback  38 Vpol P
    Display Product Serial Number: ...
  Display Range Limits:
    Monitor ranges (GTF): 59-61 Hz V, 30-65 kHz H, max dotclock 110 MHz
    Display Product Name: 'L565'
Checksum: 0x91
