
EDID (hex):
00ffffffffffff001e6d715bb9d80600
0a200104b53c22789f0331a6574ea226
0d5054a54b80317c4568457c617c8168
818081bc953ccb8480a0703837403020
3a0055502100001a023a801871382d40
582c4500132a2100001e000000fd0030
90a0a03c010a202020202020000000fc
004c4720554c545241474541520a01db
020323f1230907074b01020304111213
1f903f0083010000e305c000e6060501
6059288048801871382d40582c450013
2a2100001e866f80a070384040302035
00132a2100001efe5b80a07038354030
203500132a21000018011d007251d01e
206e285500132a2100001e0000000000
00000000000000000000000000000055

edid-decode (hex):

00 ff ff ff ff ff ff 00 1e 6d 71 5b b9 d8 06 00
0a 20 01 04 b5 3c 22 78 9f 03 31 a6 57 4e a2 26
0d 50 54 a5 4b 80 31 7c 45 68 45 7c 61 7c 81 68
81 80 81 bc 95 3c cb 84 80 a0 70 38 37 40 30 20
3a 00 55 50 21 00 00 1a 02 3a 80 18 71 38 2d 40
58 2c 45 00 13 2a 21 00 00 1e 00 00 00 fd 00 30
90 a0 a0 3c 01 0a 20 20 20 20 20 20 00 00 00 fc
00 4c 47 20 55 4c 54 52 41 47 45 41 52 0a 01 db

02 03 23 f1 23 09 07 07 4b 01 02 03 04 11 12 13
1f 90 3f 00 83 01 00 00 e3 05 c0 00 e6 06 05 01
60 59 28 80 48 80 18 71 38 2d 40 58 2c 45 00 13
2a 21 00 00 1e 86 6f 80 a0 70 38 40 40 30 20 35
00 13 2a 21 00 00 1e fe 5b 80 a0 70 38 35 40 30
20 35 00 13 2a 21 00 00 18 01 1d 00 72 51 d0 1e
20 6e 28 55 00 13 2a 21 00 00 1e 00 00 00 00 00
00 00 00 00 00 00 00 00 00 00 00 00 00 00 00 55

----------------

Block 0, Base EDID:
  EDID Structure Version & Revision: 1.4
  Vendor & Product Identification:
    Manufacturer: GSM
    Model: 23409
    Serial Number: 448697
    Made in: week 10 of 2022
  Basic Display Parameters & Features:
    Digital display
    Bits per primary color channel: 10
    DisplayPort interface
    Maximum image size: 60 cm x 34 cm
    Gamma: 2.20
    DPMS levels: Standby
    Supported color formats: RGB 4:4:4, YCrCb 4:4:4, YCrCb 4:2:2
    Default (sRGB) color space is primary color space
    First detailed timing includes the native pixel format and preferred refresh rate
    Display is continuous frequency
  Color Characteristics:
    Red  : 0.6484, 0.3398
    Green: 0.3046, 0.6357
    Blue : 0.1484, 0.0537
    White: 0.3125, 0.3291
  Established Timings I & II:
    IBM     :   720x400    70.081663 Hz   9:5     31.467 kHz     28.320000 MHz
    DMT 0x04:   640x480    59.940476 Hz   4:3     31.469 kHz     25.175000 MHz
    DMT 0x06:   640x480    75.000000 Hz   4:3     37.500 kHz     31.500000 MHz
    DMT 0x09:   800x600    60.316541 Hz   4:3     37.879 kHz     40.000000 MHz
    DMT 0x0b:   800x600    75.000000 Hz   4:3     46.875 kHz     49.500000 MHz
    DMT 0x10:  1024x768    60.003840 Hz   4:3     48.363 kHz     65.000000 MHz
    DMT 0x12:  1024x768    75.028582 Hz   4:3     60.023 kHz     78.750000 MHz
    DMT 0x24:  1280x1024   75.024675 Hz   5:4     79.976 kHz    135.000000 MHz
    Apple   :  1152x870    75.061550 Hz 192:145   68.681 kHz    100.000000 MHz
  Standard Timings:
    GTF     :   640x480   119.999084 Hz   4:3     61.800 kHz     52.406000 MHz
    GTF     :   800x600    99.999707 Hz   4:3     63.600 kHz     68.179000 MHz
    GTF     :   800x600   119.999886 Hz   4:3     77.160 kHz     83.950000 MHz
    GTF     :  1024x768   119.999931 Hz   4:3     98.760 kHz    139.054000 MHz
    GTF     :  1280x960   100.000000 Hz   4:3    101.700 kHz    178.992000 MHz
    DMT 0x23:  1280x1024   60.019740 Hz   5:4     63.981 kHz    108.000000 MHz
    GTF     :  1280x1024  120.000185 Hz   5:4    131.640 kHz    233.793000 MHz
    GTF     :  1440x900   119.999896 Hz  16:10   115.800 kHz    229.747000 MHz
  Detailed Timing Descriptors:
    DTD 1:  1920x1080  143.997797 Hz  16:9    163.438 kHz    339.950000 MHz (597 mm x 336 mm)
                 Hfront   48 Hsync  32 Hback   80 Hpol P
                 Vfront    3 Vsync  10 Vback   42 Vpol N
    DTD 2:  1920x1080   60.000000 Hz  16:9     67.500 kHz    148.500000 MHz (531 mm x 298 mm)
                 Hfront   88 Hsync  44 Hback  148 Hpol P
                 Vfront    4 Vsync   5 Vback   36 Vpol P
    Display Range Limits:
      Monitor ranges (Bare Limits): 48-144 Hz V, 160-160 kHz H, max dotclock 600 MHz
    Display Product Name: 'LG ULTRAGEAR'
  Extension blocks: 1
Checksum: 0xdb

----------------

Block 1, CTA-861 Extension Block:
  Revision: 3
  Underscans IT Video Formats by default
  Basic audio support
  Supports YCbCr 4:4:4
  Supports YCbCr 4:2:2
  Native detailed modes: 1
  Audio Data Block:
    Linear PCM:
      Max channels: 2
      Supported sample rates (kHz): 48 44.1 32
      Supported sample sizes (bits): 24 20 16
  Video Data Block:
    VIC   1:   640x480    59.940476 Hz   4:3     31.469 kHz     25.175000 MHz
    VIC   2:   720x480    59.940060 Hz   4:3     31.469 kHz     27.000000 MHz
    VIC   3:   720x480    59.940060 Hz  16:9     31.469 kHz     27.000000 MHz
    VIC   4:  1280x720    60.000000 Hz  16:9     45.000 kHz     74.250000 MHz
    VIC  17:   720x576    50.000000 Hz   4:3     31.250 kHz     27.000000 MHz
    VIC  18:   720x576    50.000000 Hz  16:9     31.250 kHz     27.000000 MHz
    VIC  19:  1280x720    50.000000 Hz  16:9     37.500 kHz     74.250000 MHz
    VIC  31:  1920x1080   50.000000 Hz  16:9     56.250 kHz    148.500000 MHz
    VIC  16:  1920x1080   60.000000 Hz  16:9     67.500 kHz    148.500000 MHz (native)
    VIC  63:  1920x1080  120.000000 Hz  16:9    135.000 kHz    297.000000 MHz
  Speaker Allocation Data Block:
    FL/FR - Front Left/Right
  Colorimetry Data Block:
    BT2020YCC
    BT2020RGB
  HDR Static Metadata Data Block:
    Electro optical transfer functions:
      Traditional gamma - SDR luminance range
      SMPTE ST2084
    Supported static metadata descriptors:
      Static metadata type 1
    Desired content max luminance: 96 (400.000 cd/m^2)
    Desired content max frame-average luminance: 89 (343.724 cd/m^2)
    Desired content min luminance: 40 (0.098 cd/m^2)
  Detailed Timing Descriptors:
    DTD 3:  1920x1080   74.989899 Hz  16:9     84.364 kHz    185.600000 MHz (531 mm x 298 mm)
                 Hfront   88 Hsync  44 Hback  148 Hpol P
                 Vfront    4 Vsync   5 Vback   36 Vpol P
    DTD 4:  1920x1080  119.982181 Hz  16:9    137.260 kHz    285.500000 MHz (531 mm x 298 mm)
                 Hfront   48 Hsync  32 Hback   80 Hpol P
                 Vfront    3 Vsync   5 Vback   56 Vpol P
    DTD 5:  1920x1080   99.930409 Hz  16:9    113.221 kHz    235.500000 MHz (531 mm x 298 mm)
                 Hfront   48 Hsync  32 Hback   80 Hpol N
                 Vfront    3 Vsync   5 Vback   45 Vpol N
    DTD 6:  1280x720    60.000000 Hz  16:9     45.000 kHz     74.250000 MHz (531 mm x 298 mm)
                 Hfront  110 Hsync  40 Hback  220 Hpol P
                 Vfront    5 Vsync   5 Vback   20 Vpol P
Checksum: 0x55  Unused space in Extension Block: 20 bytes
