edid-decode (hex):

00 ff ff ff ff ff ff 00 4c 83 52 48 00 00 00 00
00 18 01 04 95 22 13 78 0a 59 35 a3 56 4b 9c 25
10 50 54 00 00 00 01 01 01 01 01 01 01 01 01 01
01 01 01 01 01 01 dc 37 80 a0 70 38 40 40 30 20
25 00 58 c2 10 00 00 19 00 00 00 0f 00 00 00 00
00 00 00 00 00 1e 82 10 52 00 00 00 00 fe 00 53
41 4d 53 55 4e 47 0a 20 4c 83 48 4c 00 00 00 fe
00 4c 54 4e 31 35 36 48 4c 30 37 34 30 31 00 f8

----------------

Block 0, Base EDID:
  EDID Structure Version & Revision: 1.4
  Vendor & Product Identification:
    Manufacturer: SDC
    Model: 18514
    Made in: 2014
  Basic Display Parameters & Features:
    Digital display
    Bits per primary color channel: 6
    DisplayPort interface
    Maximum image size: 34 cm x 19 cm
    Gamma: 2.20
    Supported color formats: RGB 4:4:4, YCrCb 4:4:4
    First detailed timing includes the native pixel format and preferred refresh rate
  Color Characteristics:
    Red  : 0.6376, 0.3369
    Green: 0.2949, 0.6103
    Blue : 0.1445, 0.0654
    White: 0.3134, 0.3291
  Established Timings I & II: none
  Standard Timings: none
  Detailed Timing Descriptors:
    DTD 1:  1920x1080   60.096154 Hz  16:9     68.750 kHz    143.000000 MHz (344 mm x 194 mm)
                 Hfront   48 Hsync  32 Hback   80 Hpol N
                 Vfront    2 Vsync   5 Vback   57 Vpol N
    Manufacturer-Specified Display Descriptor (0x0f): 00 0f 00 00 00 00 00 00 00 00 00 1e 82 10 52 00 '..............R.'
    Alphanumeric Data String: 'SAMSUNG'
    Alphanumeric Data String: 'LTN156HL07401'
Checksum: 0xf8

----------------

Warnings:

Block 0, Base EDID:
  Missing Display Product Name.

Failures:

Block 0, Base EDID:
  Alphanumeric Data String: Non-space after newline.

EDID conformity: FAIL
