edid-decode (hex):

00 ff ff ff ff ff ff 00 05 f0 e5 08 a8 e7 40 23
22 20 01 03 80 3c 21 78 ea 31 35 a5 55 4e a1 26
0c 50 54 bf ef 80 71 4f 81 80 81 40 81 00 81 c0
95 00 b3 00 01 01 02 3a 80 18 71 38 2d 40 58 2c
45 00 55 50 21 00 00 1e 00 00 00 fd 00 30 4b 1e
55 15 00 0a 20 20 20 20 20 20 00 00 00 fc 00 32
37 48 43 35 52 0a 20 20 20 20 20 20 00 00 00 ff
00 35 32 33 34 30 45 37 41 38 33 57 30 31 01 4c

02 03 23 f4 47 01 03 04 90 12 13 9f 23 09 07 05
83 01 00 00 65 03 0c 00 10 00 68 1a 00 00 01 01
30 4b e6 f1 44 80 c8 70 38 1e 40 30 20 35 00 55
50 21 00 00 1a 00 00 00 00 00 00 00 00 00 00 00
00 00 00 00 00 00 00 00 00 00 00 00 00 00 00 00
00 00 00 00 00 00 00 00 00 00 00 00 00 00 00 00
00 00 00 00 00 00 00 00 00 00 00 00 00 00 00 00
00 00 00 00 00 00 00 00 00 00 00 00 00 00 00 34

00 ff ff ff ff ff ff 00 05 f0 e5 08 a8 e7 40 23
22 20 01 03 80 3c 21 78 ea 31 35 a5 55 4e a1 26
0c 50 54 bf ef 80 71 4f 81 80 81 40 81 00 81 c0
95 00 b3 00 01 01 02 3a 80 18 71 38 2d 40 58 2c
45 00 55 50 21 00 00 1e 00 00 00 fd 00 30 4b 1e
55 15 00 0a 20 20 20 20 20 20 00 00 00 fc 00 32
37 48 43 35 52 0a 20 20 20 20 20 20 00 00 00 ff
00 35 32 33 34 30 45 37 41 38 33 57 30 31 01 4c

02 03 23 f4 47 01 03 04 90 12 13 9f 23 09 07 05
83 01 00 00 65 03 0c 00 10 00 68 1a 00 00 01 01
30 4b e6 f1 44 80 c8 70 38 1e 40 30 20 35 00 55
50 21 00 00 1a 00 00 00 00 00 00 00 00 00 00 00
00 00 00 00 00 00 00 00 00 00 00 00 00 00 00 00
00 00 00 00 00 00 00 00 00 00 00 00 00 00 00 00
00 00 00 00 00 00 00 00 00 00 00 00 00 00 00 00
00 00 00 00 00 00 00 00 00 00 00 00 00 00 00 34

----------------

Block 0, Base EDID:
  EDID Structure Version & Revision: 1.3
  Vendor & Product Identification:
    Manufacturer: AOP
    Model: 2277
    Serial Number: ...
    Made in: week 34 of 2022
  Basic Display Parameters & Features:
    Digital display
    Maximum image size: 60 cm x 33 cm
    Gamma: 2.20
    DPMS levels: Standby Suspend Off
    RGB color display
    First detailed timing is the preferred timing
  Color Characteristics:
    Red  : 0.6445, 0.3349
    Green: 0.3046, 0.6298
    Blue : 0.1484, 0.0498
    White: 0.3134, 0.3291
  Established Timings I & II:
    IBM     :   720x400    70.081663 Hz   9:5     31.467 kHz     28.320000 MHz
    DMT 0x04:   640x480    59.940476 Hz   4:3     31.469 kHz     25.175000 MHz
    Apple   :   640x480    66.666667 Hz   4:3     35.000 kHz     30.240000 MHz
    DMT 0x05:   640x480    72.808802 Hz   4:3     37.861 kHz     31.500000 MHz
    DMT 0x06:   640x480    75.000000 Hz   4:3     37.500 kHz     31.500000 MHz
    DMT 0x08:   800x600    56.250000 Hz   4:3     35.156 kHz     36.000000 MHz
    DMT 0x09:   800x600    60.316541 Hz   4:3     37.879 kHz     40.000000 MHz
    DMT 0x0a:   800x600    72.187572 Hz   4:3     48.077 kHz     50.000000 MHz
    DMT 0x0b:   800x600    75.000000 Hz   4:3     46.875 kHz     49.500000 MHz
    Apple   :   832x624    74.551266 Hz   4:3     49.726 kHz     57.284000 MHz
    DMT 0x10:  1024x768    60.003840 Hz   4:3     48.363 kHz     65.000000 MHz
    DMT 0x11:  1024x768    70.069359 Hz   4:3     56.476 kHz     75.000000 MHz
    DMT 0x12:  1024x768    75.028582 Hz   4:3     60.023 kHz     78.750000 MHz
    DMT 0x24:  1280x1024   75.024675 Hz   5:4     79.976 kHz    135.000000 MHz
    Apple   :  1152x870    75.061550 Hz 192:145   68.681 kHz    100.000000 MHz
  Standard Timings:
    DMT 0x15:  1152x864    75.000000 Hz   4:3     67.500 kHz    108.000000 MHz
    DMT 0x23:  1280x1024   60.019740 Hz   5:4     63.981 kHz    108.000000 MHz
    DMT 0x20:  1280x960    60.000000 Hz   4:3     60.000 kHz    108.000000 MHz
    DMT 0x1c:  1280x800    59.810326 Hz  16:10    49.702 kHz     83.500000 MHz
    DMT 0x55:  1280x720    60.000000 Hz  16:9     45.000 kHz     74.250000 MHz
    DMT 0x2f:  1440x900    59.887445 Hz  16:10    55.935 kHz    106.500000 MHz
    DMT 0x3a:  1680x1050   59.954250 Hz  16:10    65.290 kHz    146.250000 MHz
  Detailed Timing Descriptors:
    DTD 1:  1920x1080   60.000000 Hz  16:9     67.500 kHz    148.500000 MHz (597 mm x 336 mm)
                 Hfront   88 Hsync  44 Hback  148 Hpol P
                 Vfront    4 Vsync   5 Vback   36 Vpol P
    Display Range Limits:
      Monitor ranges (GTF): 48-75 Hz V, 30-85 kHz H, max dotclock 210 MHz
    Display Product Name: '27HC5R'
    Display Product Serial Number: ...
  Extension blocks: 1
Checksum: 0x4c

----------------

Block 1, CTA-861 Extension Block:
  Revision: 3
  Underscans IT Video Formats by default
  Basic audio support
  Supports YCbCr 4:4:4
  Supports YCbCr 4:2:2
  Native detailed modes: 4
  Video Data Block:
    VIC   1:   640x480    59.940476 Hz   4:3     31.469 kHz     25.175000 MHz
    VIC   3:   720x480    59.940060 Hz  16:9     31.469 kHz     27.000000 MHz
    VIC   4:  1280x720    60.000000 Hz  16:9     45.000 kHz     74.250000 MHz
    VIC  16:  1920x1080   60.000000 Hz  16:9     67.500 kHz    148.500000 MHz (native)
    VIC  18:   720x576    50.000000 Hz  16:9     31.250 kHz     27.000000 MHz
    VIC  19:  1280x720    50.000000 Hz  16:9     37.500 kHz     74.250000 MHz
    VIC  31:  1920x1080   50.000000 Hz  16:9     56.250 kHz    148.500000 MHz (native)
  Audio Data Block:
    Linear PCM:
      Max channels: 2
      Supported sample rates (kHz): 48 44.1 32
      Supported sample sizes (bits): 24 16
  Speaker Allocation Data Block:
    FL/FR - Front Left/Right
  Vendor-Specific Data Block (HDMI), OUI 00-0C-03:
    Source physical address: 1.0.0.0
  Vendor-Specific Data Block (AMD), OUI 00-00-1A:
    Version: 1.1
    Minimum Refresh Rate: 48 Hz
    Maximum Refresh Rate: 75 Hz
    Flags 1.x: 0xe6 (MCCS)
  Detailed Timing Descriptors:
    DTD 2:  1920x1080   75.000000 Hz  16:9     83.250 kHz    176.490000 MHz (597 mm x 336 mm)
                 Hfront   48 Hsync  32 Hback  120 Hpol P
                 Vfront    3 Vsync   5 Vback   22 Vpol N
Checksum: 0x34  Unused space in Extension Block: 74 bytes

----------------

Block 2, Unknown EDID Extension Block 0x00:
  00 ff ff ff ff ff ff 00 05 f0 e5 08 a8 e7 40 23 '..............@#'
  22 20 01 03 80 3c 21 78 ea 31 35 a5 55 4e a1 26 '" ...<!x.15.UN.&'
  0c 50 54 bf ef 80 71 4f 81 80 81 40 81 00 81 c0 '.PT...qO...@....'
  95 00 b3 00 01 01 02 3a 80 18 71 38 2d 40 58 2c '.......:..q8-@X,'
  45 00 55 50 21 00 00 1e 00 00 00 fd 00 30 4b 1e 'E.UP!........0K.'
  55 15 00 0a 20 20 20 20 20 20 00 00 00 fc 00 32 'U...      .....2'
  37 48 43 35 52 0a 20 20 20 20 20 20 00 00 00 ff '7HC5R.      ....'
  00 35 32 33 34 30 45 37 41 38 33 57 30 31 01 4c '.52340E7A83W01.L'
Checksum: 0x4c

----------------

Block 3, CTA-861 Extension Block:
  Revision: 3
  Underscans IT Video Formats by default
  Basic audio support
  Supports YCbCr 4:4:4
  Supports YCbCr 4:2:2
  Native detailed modes: 4
  Video Data Block:
    VIC   1:   640x480    59.940476 Hz   4:3     31.469 kHz     25.175000 MHz
    VIC   3:   720x480    59.940060 Hz  16:9     31.469 kHz     27.000000 MHz
    VIC   4:  1280x720    60.000000 Hz  16:9     45.000 kHz     74.250000 MHz
    VIC  16:  1920x1080   60.000000 Hz  16:9     67.500 kHz    148.500000 MHz (native)
    VIC  18:   720x576    50.000000 Hz  16:9     31.250 kHz     27.000000 MHz
    VIC  19:  1280x720    50.000000 Hz  16:9     37.500 kHz     74.250000 MHz
    VIC  31:  1920x1080   50.000000 Hz  16:9     56.250 kHz    148.500000 MHz (native)
  Audio Data Block:
    Linear PCM:
      Max channels: 2
      Supported sample rates (kHz): 48 44.1 32
      Supported sample sizes (bits): 24 16
  Speaker Allocation Data Block:
    FL/FR - Front Left/Right
  Vendor-Specific Data Block (HDMI), OUI 00-0C-03:
    Source physical address: 1.0.0.0
  Vendor-Specific Data Block (AMD), OUI 00-00-1A:
    Version: 1.1
    Minimum Refresh Rate: 48 Hz
    Maximum Refresh Rate: 75 Hz
    Flags 1.x: 0xe6 (MCCS)
  Detailed Timing Descriptors:
    DTD 3:  1920x1080   75.000000 Hz  16:9     83.250 kHz    176.490000 MHz (597 mm x 336 mm)
                 Hfront   48 Hsync  32 Hback  120 Hpol P
                 Vfront    3 Vsync   5 Vback   22 Vpol N
Checksum: 0x34  Unused space in Extension Block: 74 bytes

----------------

Warnings:

Block 1, CTA-861 Extension Block:
  Display Product Serial Number is set, so the Serial Number in the Base EDID should be 0.
  Add a Colorimetry Data Block with the sRGB colorimetry bit set to avoid interop issues.
Block 3, CTA-861 Extension Block:
  Display Product Serial Number is set, so the Serial Number in the Base EDID should be 0.
  Add a Colorimetry Data Block with the sRGB colorimetry bit set to avoid interop issues.
EDID:
  CTA-861: Multiple native progressive timings are defined.

Failures:

Block 1, CTA-861 Extension Block:
  There are more Native DTDs (4) than DTDs (3).
  Missing VCDB, needed for Set Selectable RGB Quantization to avoid interop issues.
Block 2, Base EDID:
  Unknown Extension Block.
Block 3, CTA-861 Extension Block:
  Video Data Block: Duplicate VIC 1.
  Video Data Block: Duplicate VIC 3.
  Video Data Block: Duplicate VIC 4.
  Video Data Block: Duplicate VIC 16.
  Video Data Block: Duplicate VIC 18.
  Video Data Block: Duplicate VIC 19.
  Video Data Block: Duplicate VIC 31.
  Speaker Allocation Data Block: Only one instance of this Data Block is allowed.
  Missing VCDB, needed for Set Selectable RGB Quantization to avoid interop issues.
EDID:
  Base EDID: EDID specified 1 extension block(s), but found 3 extension block(s).
  Base EDID: EDID 1.3 requires a Block Map Extension in Block 1 if there are more than 2 blocks in the EDID.

EDID conformity: FAIL
