
EDID (hex):
00ffffffffffff0010ac0fa053444732
230f01030e342178eeee50a3544c9b26
0f5054a54b008180a940714fb3000101
010101010101283c80a070b023403020
360007442100001a000000ff00543631
333335384e3247445320000000fc0044
454c4c20323430354650570a000000fd
00384c1e5111000a202020202020005a

Extracted contents:
header:          00 ff ff ff ff ff ff 00
serial number:   10 ac 0f a0 53 44 47 32 23 0f
version:         01 03
basic params:    0e 34 21 78 ee
chroma info:     ee 50 a3 54 4c 9b 26 0f 50 54
established:     a5 4b 00
standard:        81 80 a9 40 71 4f b3 00 01 01 01 01 01 01 01 01
descriptor 1:    28 3c 80 a0 70 b0 23 40 30 20 36 00 07 44 21 00 00 1a
descriptor 2:    00 00 00 ff 00 54 36 31 33 33 35 38 4e 32 47 44 53 20
descriptor 3:    00 00 00 fc 00 44 45 4c 4c 20 32 34 30 35 46 50 57 0a
descriptor 4:    00 00 00 fd 00 38 4c 1e 51 11 00 0a 20 20 20 20 20 20
extensions:      00
checksum:        5a

EDID version: 1.3
Manufacturer: DEL Model a00f Serial Number --
Analog display, Input voltage level: 0.7/0.3 V
Sync: Separate Composite SyncOnGreen 
Maximum image size: 52 cm x 33 cm
Gamma: 2.20
DPMS levels: Standby Suspend Off
RGB color display
Default (sRGB) color space is primary color space
First detailed timing is preferred timing
Display x,y Chromaticity:
  Red:   0.6396, 0.3300
  Green: 0.2998, 0.6074
  Blue:  0.1494, 0.0595
  White: 0.3125, 0.3281
Established timings supported:
  720x400@70Hz 9:5 HorFreq: 31469 Hz Clock: 28.320 MHz
  640x480@60Hz 4:3 HorFreq: 31469 Hz Clock: 25.175 MHz
  640x480@75Hz 4:3 HorFreq: 37500 Hz Clock: 31.500 MHz
  800x600@60Hz 4:3 HorFreq: 37900 Hz Clock: 40.000 MHz
  800x600@75Hz 4:3 HorFreq: 46900 Hz Clock: 49.500 MHz
  1024x768@60Hz 4:3 HorFreq: 48400 Hz Clock: 65.000 MHz
  1024x768@75Hz 4:3 HorFreq: 60000 Hz Clock: 78.750 MHz
  1280x1024@75Hz 5:4 HorFreq: 80000 Hz Clock: 135.000 MHz
Standard timings supported:
  1280x1024@60Hz 5:4 HorFreq: 64000 Hz Clock: 108.000 MHz
  1600x1200@60Hz 4:3 HorFreq: 75000 Hz Clock: 162.000 MHz
  1152x864@75Hz 4:3 HorFreq: 67500 Hz Clock: 108.000 MHz
  1680x1050@60Hz 16:10 HorFreq: 64700 Hz Clock: 119.000 MHz
Detailed mode: Clock 154.000 MHz, 519 mm x 324 mm
               1920 1968 2000 2080 hborder 0
               1200 1203 1209 1235 vborder 0
               +hsync -vsync 
               VertFreq: 59 Hz, HorFreq: 74038 Hz
Serial number: -- 
Monitor name: DELL 2405FPW
Monitor ranges (GTF): 56-76Hz V, 30-81kHz H, max dotclock 170MHz
Checksum: 0x5a (valid)
EDID block does NOT conform to EDID 1.3!
	sRGB is signaled, but the chromaticities do not match
EDID block does not conform at all!
	Bad year of manufacture
