edid-decode (hex):

00 ff ff ff ff ff ff 00 30 e4 7b 02 00 00 00 00
00 15 01 04 90 26 15 78 0a ec 15 9d 58 50 9a 27
1c 50 54 00 00 00 01 01 01 01 01 01 01 01 01 01
01 01 01 01 01 01 1c 2a 40 40 61 84 24 30 30 20
35 00 7e d7 10 00 00 19 13 1c 40 40 61 84 24 30
30 20 35 00 7e d7 10 00 00 19 00 00 00 00 00 00
00 00 00 00 00 00 00 00 00 00 00 00 00 00 00 02
00 0c 47 ff 0a 3c 64 26 23 3f 64 00 00 00 00 60

----------------

Block 0, Base EDID:
  EDID Structure Version & Revision: 1.4
  Vendor & Product Identification:
    Manufacturer: LGD
    Model: 635
    Made in: 2011
  Basic Display Parameters & Features:
    Digital display
    Bits per primary color channel: 6
    Digital interface is not defined
    Maximum image size: 38 cm x 21 cm
    Gamma: 2.20
    Supported color formats: RGB 4:4:4, YCrCb 4:4:4
    First detailed timing includes the native pixel format and preferred refresh rate
  Color Characteristics:
    Red  : 0.6162, 0.3457
    Green: 0.3154, 0.6015
    Blue : 0.1523, 0.1103
    White: 0.3134, 0.3291
  Established Timings I & II: none
  Standard Timings: none
  Detailed Timing Descriptors:
    DTD 1:  1600x900    59.984865 Hz  16:9     56.146 kHz    107.800000 MHz (382 mm x 215 mm)
                 Hfront   48 Hsync  32 Hback  240 Hpol N
                 Vfront    3 Vsync   5 Vback   28 Vpol N
    DTD 2:  1600x900    39.991765 Hz  16:9     37.432 kHz     71.870000 MHz (382 mm x 215 mm)
                 Hfront   48 Hsync  32 Hback  240 Hpol N
                 Vfront    3 Vsync   5 Vback   28 Vpol N
    Empty Descriptor
    Manufacturer-Specified Display Descriptor (0x02): 00 02 00 0c 47 ff 0a 3c 64 26 23 3f 64 00 00 00 '....G..<d&#?d...'
Checksum: 0x60

----------------

Failures:

Block 0, Base EDID:
  Empty Descriptor: Use Dummy Descriptor instead of all zeroes.
  Missing Display Product Name.

EDID conformity: FAIL
