
EDID (hex):
00ffffffffffff000daf041200000000
110f0103801912780afe659555518726
22505400080001010101010101010101
01010101010164190040410026301888
3600f6b800000018000000fe004e3132
3158352d4c30310a2020000000fe0043
4d4f0a202020202020202020000000fe
004e31323158352d4c30310a202000a1

Extracted contents:
header:          00 ff ff ff ff ff ff 00
serial number:   0d af 04 12 00 00 00 00 11 0f
version:         01 03
basic params:    80 19 12 78 0a
chroma info:     fe 65 95 55 51 87 26 22 50 54
established:     00 08 00
standard:        01 01 01 01 01 01 01 01 01 01 01 01 01 01 01 01
descriptor 1:    64 19 00 40 41 00 26 30 18 88 36 00 f6 b8 00 00 00 18
descriptor 2:    00 00 00 fe 00 4e 31 32 31 58 35 2d 4c 30 31 0a 20 20
descriptor 3:    00 00 00 fe 00 43 4d 4f 0a 20 20 20 20 20 20 20 20 20
descriptor 4:    00 00 00 fe 00 4e 31 32 31 58 35 2d 4c 30 31 0a 20 20
extensions:      00
checksum:        a1

EDID version: 1.3
Manufacturer: CMO Model 1204 Serial Number --
Digital display
Maximum image size: 25 cm x 18 cm
Gamma: 2.20
RGB color display
First detailed timing is preferred timing
Display x,y Chromaticity:
  Red:   0.5849, 0.3349
  Green: 0.3193, 0.5292
  Blue:  0.1494, 0.1347
  White: 0.3134, 0.3291
Established timings supported:
  1024x768@60Hz 4:3 HorFreq: 48400 Hz Clock: 65.000 MHz
Standard timings supported:
Detailed mode: Clock 65.000 MHz, 246 mm x 184 mm
               1024 1048 1184 1344 hborder 0
                768  771  777  806 vborder 0
               -hsync -vsync 
               VertFreq: 60 Hz, HorFreq: 48363 Hz
ASCII string: N121X5-L01
ASCII string: CMO
ASCII string: N121X5-L01
Checksum: 0xa1 (valid)
EDID block does NOT conform to EDID 1.3!
	Missing name descriptor
	Missing monitor ranges
EDID block does not conform at all!
	Bad year of manufacture


