
EDID (hex):
00ffffffffffff004d10091001010101
0012010380522e782a1bbea25534b326
144a52afce0001010101010101010101
010101010101011d007251d01e206e28
550034cd3100001e662150b051001b30
4070360000000000001e000000fc0053
484152502048444d490a2020000000fd
00374c0f3009000a20202020202001d0
02031b71478405030207060123090701
8301000066030c00100080011d801871
1c1620582c250034cd3100009a8c0ad0
8a20e02d10103e960034cd310000188c
0ad08a20e02d10103e960067cd210000
188c0aa01451f01600267c430034cd31
0000988c0aa01451f01600267c430067
cd210000980000000000000000000045

Extracted contents:
header:          00 ff ff ff ff ff ff 00
serial number:   4d 10 09 10 01 01 01 01 00 12
version:         01 03
basic params:    80 52 2e 78 2a
chroma info:     1b be a2 55 34 b3 26 14 4a 52
established:     af ce 00
standard:        01 01 01 01 01 01 01 01 01 01 01 01 01 01 01 01
descriptor 1:    01 1d 00 72 51 d0 1e 20 6e 28 55 00 34 cd 31 00 00 1e
descriptor 2:    66 21 50 b0 51 00 1b 30 40 70 36 00 00 00 00 00 00 1e
descriptor 3:    00 00 00 fc 00 53 48 41 52 50 20 48 44 4d 49 0a 20 20
descriptor 4:    00 00 00 fd 00 37 4c 0f 30 09 00 0a 20 20 20 20 20 20
extensions:      01
checksum:        d0

EDID version: 1.3
Manufacturer: SHP Model 1009 Serial Number --
Made in year 2008
Digital display
Maximum image size: 82 cm x 46 cm
Gamma: 2.20
DPMS levels: Off
RGB color display
First detailed timing is preferred timing
Display x,y Chromaticity:
  Red:   0.6328, 0.3330
  Green: 0.2050, 0.7021
  Blue:  0.1503, 0.0810
  White: 0.2919, 0.3222
Established timings supported:
  720x400@70Hz 9:5 HorFreq: 31469 Hz Clock: 28.320 MHz
  640x480@60Hz 4:3 HorFreq: 31469 Hz Clock: 25.175 MHz
  640x480@72Hz 4:3 HorFreq: 37900 Hz Clock: 31.500 MHz
  640x480@75Hz 4:3 HorFreq: 37500 Hz Clock: 31.500 MHz
  800x600@56Hz 4:3 HorFreq: 35200 Hz Clock: 36.000 MHz
  800x600@60Hz 4:3 HorFreq: 37900 Hz Clock: 40.000 MHz
  800x600@72Hz 4:3 HorFreq: 48100 Hz Clock: 50.000 MHz
  800x600@75Hz 4:3 HorFreq: 46900 Hz Clock: 49.500 MHz
  1024x768@60Hz 4:3 HorFreq: 48400 Hz Clock: 65.000 MHz
  1024x768@70Hz 4:3 HorFreq: 56500 Hz Clock: 75.000 MHz
  1024x768@75Hz 4:3 HorFreq: 60000 Hz Clock: 78.750 MHz
Standard timings supported:
Detailed mode: Clock 74.250 MHz, 820 mm x 461 mm
               1280 1390 1430 1650 hborder 0
                720  725  730  750 vborder 0
               +hsync +vsync 
               VertFreq: 60 Hz, HorFreq: 45000 Hz
Detailed mode: Clock 85.500 MHz, 0 mm x 0 mm
               1360 1424 1536 1792 hborder 0
                768  771  777  795 vborder 0
               +hsync +vsync 
               VertFreq: 60 Hz, HorFreq: 47712 Hz
Monitor name: SHARP HDMI
Monitor ranges (GTF): 55-76Hz V, 15-48kHz H, max dotclock 90MHz
Has 1 extension blocks
Checksum: 0xd0 (valid)

CTA extension block
Extension version: 3
23 bytes of CTA data
  Video data block
    VIC   4 1280x720@60Hz 16:9 (native) HorFreq: 45000 Hz Clock: 74.250 MHz
    VIC   5 1920x1080i@60Hz 16:9  HorFreq: 33750 Hz Clock: 74.250 MHz
    VIC   3 720x480@60Hz 16:9  HorFreq: 31469 Hz Clock: 27.000 MHz
    VIC   2 720x480@60Hz 4:3  HorFreq: 31469 Hz Clock: 27.000 MHz
    VIC   7 1440x480i@60Hz 16:9  HorFreq: 15734 Hz Clock: 27.000 MHz
    VIC   6 1440x480i@60Hz 4:3  HorFreq: 15734 Hz Clock: 27.000 MHz
    VIC   1 640x480@60Hz 4:3  HorFreq: 31469 Hz Clock: 25.175 MHz
  Audio data block
    Linear PCM, max channels 2
      Supported sample rates (kHz): 48 44.1 32
      Supported sample sizes (bits): 16
  Speaker allocation data block
    Speaker map:
      FL/FR - Front Left/Right
  Vendor-specific data block, OUI 000c03 (HDMI)
    Source physical address 1.0.0.0
    Supports_AI
Basic audio support
Supports YCbCr 4:4:4
Supports YCbCr 4:2:2
1 native detailed modes
Detailed mode: Clock 74.250 MHz, 820 mm x 461 mm
               1920 2008 2052 2200 hborder 0
                540  542  547  562 vborder 0
               +hsync -vsync interlaced 
               VertFreq: 60 Hz, HorFreq: 33750 Hz
Detailed mode: Clock 27.000 MHz, 820 mm x 461 mm
                720  736  798  858 hborder 0
                480  489  495  525 vborder 0
               -hsync -vsync 
               VertFreq: 59 Hz, HorFreq: 31468 Hz
Detailed mode: Clock 27.000 MHz, 615 mm x 461 mm
                720  736  798  858 hborder 0
                480  489  495  525 vborder 0
               -hsync -vsync 
               VertFreq: 59 Hz, HorFreq: 31468 Hz
Detailed mode: Clock 27.000 MHz, 820 mm x 461 mm
               1440 1478 1602 1716 hborder 0
                240  244  247  262 vborder 0
               -hsync -vsync interlaced 
               VertFreq: 60 Hz, HorFreq: 15734 Hz
Detailed mode: Clock 27.000 MHz, 615 mm x 461 mm
               1440 1478 1602 1716 hborder 0
                240  244  247  262 vborder 0
               -hsync -vsync interlaced 
               VertFreq: 60 Hz, HorFreq: 15734 Hz
Checksum: 0x45 (valid)

One or more of the timings is out of range of the Monitor Ranges:
  Vertical Freq: 56 - 75 Hz
  Horizontal Freq: 15734 - 60000 Hz
  Maximum Clock: 85.500 MHz
