
EDID (hex):
00ffffffffffff00220e813401010101
0a1e0104a5342078225595a9544c9e24
0d5054a54b00b30095008100d1c0a9c0
81c0a9408180283c80a070b023403020
360006442100001a000000fd00324b1e
5e13010a202020202020000000fc0048
50205a3234692047320a2020000000ff
0036434d303130314456530a20200174
02030eb149101f04130312021101023a
801871382d40582c450006442100001e
023a80d072382d40102c458006442100
001ec248805070b02b400820d8040644
2100001a000000000000000000000000
00000000000000000000000000000000
00000000000000000000000000000000
0000000000000000000000000000002d

Extracted contents:
header:          00 ff ff ff ff ff ff 00
serial number:   22 0e 81 34 01 01 01 01 0a 1e
version:         01 04
basic params:    a5 34 20 78 22
chroma info:     55 95 a9 54 4c 9e 24 0d 50 54
established:     a5 4b 00
standard:        b3 00 95 00 81 00 d1 c0 a9 c0 81 c0 a9 40 81 80
descriptor 1:    28 3c 80 a0 70 b0 23 40 30 20 36 00 06 44 21 00 00 1a
descriptor 2:    00 00 00 fd 00 32 4b 1e 5e 13 01 0a 20 20 20 20 20 20
descriptor 3:    00 00 00 fc 00 48 50 20 5a 32 34 69 20 47 32 0a 20 20
descriptor 4:    00 00 00 ff 00 36 43 4d 30 31 30 31 44 56 53 0a 20 20
extensions:      01
checksum:        74

EDID version: 1.4
Manufacturer: HPN Model 3481 Serial Number --
Made in week 10 of 2020
Digital display
8 bits per primary color channel
DisplayPort interface
Maximum image size: 52 cm x 32 cm
Gamma: 2.20
DPMS levels: Off
Supported color formats: RGB 4:4:4
First detailed timing includes the native pixel format and preferred refresh rate
Display x,y Chromaticity:
  Red:   0.6611, 0.3291
  Green: 0.2978, 0.6181
  Blue:  0.1425, 0.0517
  White: 0.3134, 0.3291
Established timings supported:
  720x400@70Hz 9:5 HorFreq: 31469 Hz Clock: 28.320 MHz
  640x480@60Hz 4:3 HorFreq: 31469 Hz Clock: 25.175 MHz
  640x480@75Hz 4:3 HorFreq: 37500 Hz Clock: 31.500 MHz
  800x600@60Hz 4:3 HorFreq: 37900 Hz Clock: 40.000 MHz
  800x600@75Hz 4:3 HorFreq: 46900 Hz Clock: 49.500 MHz
  1024x768@60Hz 4:3 HorFreq: 48400 Hz Clock: 65.000 MHz
  1024x768@75Hz 4:3 HorFreq: 60000 Hz Clock: 78.750 MHz
  1280x1024@75Hz 5:4 HorFreq: 80000 Hz Clock: 135.000 MHz
Standard timings supported:
  1680x1050@60Hz 16:10 HorFreq: 64700 Hz Clock: 119.000 MHz
  1440x900@60Hz 16:10 HorFreq: 55500 Hz Clock: 88.750 MHz
  1280x800@60Hz 16:10
  1920x1080@60Hz 16:9
  1600x900@60Hz 16:9
  1280x720@60Hz 16:9
  1600x1200@60Hz 4:3 HorFreq: 75000 Hz Clock: 162.000 MHz
  1280x1024@60Hz 5:4 HorFreq: 64000 Hz Clock: 108.000 MHz
Detailed mode: Clock 154.000 MHz, 518 mm x 324 mm
               1920 1968 2000 2080 hborder 0
               1200 1203 1209 1235 vborder 0
               +hsync -vsync 
               VertFreq: 59 Hz, HorFreq: 74038 Hz
Monitor ranges (bare limits): 50-75Hz V, 30-94kHz H, max dotclock 190MHz
Monitor name: HP Z24i G2
Serial number: --
Has 1 extension blocks
Checksum: 0x74 (valid)

CTA extension block
Extension version: 3
10 bytes of CTA data
  Video data block
    VIC  16 1920x1080@60Hz 16:9  HorFreq: 67500 Hz Clock: 148.500 MHz
    VIC  31 1920x1080@50Hz 16:9  HorFreq: 56250 Hz Clock: 148.500 MHz
    VIC   4 1280x720@60Hz 16:9  HorFreq: 45000 Hz Clock: 74.250 MHz
    VIC  19 1280x720@50Hz 16:9  HorFreq: 37500 Hz Clock: 74.250 MHz
    VIC   3 720x480@60Hz 16:9  HorFreq: 31469 Hz Clock: 27.000 MHz
    VIC  18 720x576@50Hz 16:9  HorFreq: 31250 Hz Clock: 27.000 MHz
    VIC   2 720x480@60Hz 4:3  HorFreq: 31469 Hz Clock: 27.000 MHz
    VIC  17 720x576@50Hz 4:3  HorFreq: 31250 Hz Clock: 27.000 MHz
    VIC   1 640x480@60Hz 4:3  HorFreq: 31469 Hz Clock: 25.175 MHz
Underscans PC formats by default
Supports YCbCr 4:4:4
Supports YCbCr 4:2:2
1 native detailed modes
Detailed mode: Clock 148.500 MHz, 518 mm x 324 mm
               1920 2008 2052 2200 hborder 0
               1080 1084 1089 1125 vborder 0
               +hsync +vsync 
               VertFreq: 60 Hz, HorFreq: 67500 Hz
Detailed mode: Clock 148.500 MHz, 518 mm x 324 mm
               1920 2448 2492 2640 hborder 0
               1080 1084 1089 1125 vborder 0
               +hsync +vsync 
               VertFreq: 50 Hz, HorFreq: 56250 Hz
Detailed mode: Clock 186.260 MHz, 518 mm x 324 mm
               1920 1928 1960 2000 hborder 0
               1200 1229 1237 1243 vborder 0
               +hsync -vsync 
               VertFreq: 74 Hz, HorFreq: 93130 Hz
Checksum: 0x2d (valid)

EDID block does not conform at all!
	Both the serial number and the serial string are set
