edid-decode (hex):

00 ff ff ff ff ff ff 00 30 ae b1 40 00 00 00 00
00 13 01 03 80 23 13 78 ea 43 c5 9c 59 51 96 26
11 50 54 00 00 00 01 01 01 01 01 01 01 01 01 01
01 01 01 01 01 01 2f 26 40 a0 60 84 1a 30 30 20
35 00 59 c2 10 00 00 19 d5 1f 40 a0 60 84 1a 30
30 20 35 00 59 c2 10 00 00 19 00 00 00 0f 00 a9
09 32 a9 09 28 16 09 00 30 e4 00 02 00 00 00 fe
00 4c 50 31 35 36 57 44 31 2d 54 4c 42 32 00 fd

----------------

Block 0, Base EDID:
  EDID Structure Version & Revision: 1.3
  Vendor & Product Identification:
    Manufacturer: LEN
    Model: 16561
    Made in: 2009
  Basic Display Parameters & Features:
    Digital display
    Maximum image size: 35 cm x 19 cm
    Gamma: 2.20
    DPMS levels: Standby Suspend Off
    RGB color display
    First detailed timing is the preferred timing
  Color Characteristics:
    Red  : 0.6103, 0.3476
    Green: 0.3164, 0.5888
    Blue : 0.1513, 0.0664
    White: 0.3134, 0.3291
  Established Timings I & II: none
  Standard Timings: none
  Detailed Timing Descriptors:
    DTD 1:  1600x900    59.978156 Hz  16:9     55.540 kHz     97.750000 MHz (345 mm x 194 mm)
                 Hfront   48 Hsync  32 Hback   80 Hpol N
                 Vfront    3 Vsync   5 Vback   18 Vpol N
    DTD 2:  1600x900    50.001227 Hz  16:9     46.301 kHz     81.490000 MHz (345 mm x 194 mm)
                 Hfront   48 Hsync  32 Hback   80 Hpol N
                 Vfront    3 Vsync   5 Vback   18 Vpol N
    Manufacturer-Specified Display Descriptor (0x0f): 00 0f 00 a9 09 32 a9 09 28 16 09 00 30 e4 00 02 '.....2..(...0...'
    Alphanumeric Data String: 'LP156WD1-TLB2'
Checksum: 0xfd

----------------

Failures:

Block 0, Base EDID:
  Missing Display Product Name.
  Missing Display Range Limits Descriptor.

EDID conformity: FAIL
