edid-decode (hex):

00 ff ff ff ff ff ff 00 30 ae b1 40 00 00 00 00
00 14 01 03 80 22 13 78 ea c8 95 9e 57 54 92 26
0f 50 54 00 00 00 01 01 01 01 01 01 01 01 01 01
01 01 01 01 01 01 9f 25 40 7e 60 84 1e 30 30 20
25 00 58 c2 10 00 00 19 7f 1f 40 86 60 84 1e 30
30 20 25 00 58 c2 10 00 00 19 00 00 00 0f 00 a9
09 32 a9 09 28 16 09 00 4c a3 4b 54 00 00 00 fe
00 4c 54 4e 31 35 36 4b 54 30 32 34 30 31 00 95

----------------

Block 0, Base EDID:
  EDID Structure Version & Revision: 1.3
  Vendor & Product Identification:
    Manufacturer: LEN
    Model: 16561
    Made in: 2010
  Basic Display Parameters & Features:
    Digital display
    Maximum image size: 34 cm x 19 cm
    Gamma: 2.20
    DPMS levels: Standby Suspend Off
    RGB color display
    First detailed timing is the preferred timing
  Color Characteristics:
    Red  : 0.6201, 0.3398
    Green: 0.3300, 0.5703
    Blue : 0.1503, 0.0595
    White: 0.3134, 0.3291
  Established Timings I & II: none
  Standard Timings: none
  Detailed Timing Descriptors:
    DTD 1:  1600x900    60.000 Hz  16:9    55.800 kHz  96.310 MHz (344 mm x 194 mm)
                 Hfront   48 Hsync  32 Hback  46 Hpol N
                 Vfront    2 Vsync   5 Vback  23 Vpol N
    DTD 2:  1600x900    49.999 Hz  16:9    46.499 kHz  80.630 MHz (344 mm x 194 mm)
                 Hfront   48 Hsync  32 Hback  54 Hpol N
                 Vfront    2 Vsync   5 Vback  23 Vpol N
    Manufacturer-Specified Display Descriptor (0x0f): 00 0f 00 a9 09 32 a9 09 28 16 09 00 4c a3 4b 54 '.....2..(...L.KT'
    Alphanumeric Data String: 'LTN156KT02401'
Checksum: 0x95

----------------

Failures:

Block 0, Base EDID:
  Missing Display Product Name.
  Missing Display Range Limits Descriptor.

EDID conformity: FAIL
