
EDID (hex):
00ffffffffffff0009e5c30600000000
121a0104a5221378022e10a757549f26
11505400000001010101010101010101
0101010101014dd000a0f0703e803020
350059c21000001ae08a00a0f0703e80
3020350059c21000001a000000000000
00000000000000000000000000000002
000c2dff103ca632463aa60000000095

Extracted contents:
header:          00 ff ff ff ff ff ff 00
serial number:   09 e5 c3 06 00 00 00 00 12 1a
version:         01 04
basic params:    a5 22 13 78 02
chroma info:     2e 10 a7 57 54 9f 26 11 50 54
established:     00 00 00
standard:        01 01 01 01 01 01 01 01 01 01 01 01 01 01 01 01
descriptor 1:    4d d0 00 a0 f0 70 3e 80 30 20 35 00 59 c2 10 00 00 1a
descriptor 2:    e0 8a 00 a0 f0 70 3e 80 30 20 35 00 59 c2 10 00 00 1a
descriptor 3:    00 00 00 00 00 00 00 00 00 00 00 00 00 00 00 00 00 00
descriptor 4:    00 00 00 02 00 0c 2d ff 10 3c a6 32 46 3a a6 00 00 00
extensions:      00
checksum:        95

EDID version: 1.4
Manufacturer: BOE Model 6c3 Serial Number --
Made in week 18 of 2016
Digital display
8 bits per primary color channel
DisplayPort interface
Maximum image size: 34 cm x 19 cm
Gamma: 2.20
Supported color formats: RGB 4:4:4
First detailed timing includes the native pixel format and preferred refresh rate
Display x,y Chromaticity:
  Red:   0.6523, 0.3417
  Green: 0.3310, 0.6230
  Blue:  0.1484, 0.0673
  White: 0.3125, 0.3281
Established timings supported:
Standard timings supported:
Detailed mode: Clock 533.250 MHz, 345 mm x 194 mm
               3840 3888 3920 4000 hborder 0
               2160 2163 2168 2222 vborder 0
               +hsync -vsync 
               VertFreq: 59 Hz, HorFreq: 133312 Hz
Detailed mode: Clock 355.520 MHz, 345 mm x 194 mm
               3840 3888 3920 4000 hborder 0
               2160 2163 2168 2222 vborder 0
               +hsync -vsync 
               VertFreq: 40 Hz, HorFreq: 88880 Hz
Manufacturer-specified data, tag 0
Manufacturer-specified data, tag 2
Checksum: 0x95 (valid)
EDID block does NOT conform to EDID 1.4!
	Missing name descriptor
	Missing monitor ranges
