edid-decode (hex):

00 ff ff ff ff ff ff 00 06 af 3e 23 00 00 00 00
00 16 01 04 95 1f 11 78 02 2a 25 97 56 53 97 28
20 50 54 00 00 00 01 01 01 01 01 01 01 01 01 01
01 01 01 01 01 01 60 2c 40 74 61 84 3c 30 40 2a
33 00 35 ae 10 00 00 18 95 1d 40 74 61 84 3c 30
40 2a 33 00 35 ae 10 00 00 18 00 00 00 00 00 00
00 00 00 00 00 00 00 00 00 00 00 00 00 00 00 02
00 0c 3d ff 0c 3c 7d 1b 0d 1c 7d 20 20 20 00 ac

----------------

Block 0, Base EDID:
  EDID Structure Version & Revision: 1.4
  Vendor & Product Identification:
    Manufacturer: AUO
    Model: 9022
    Made in: 2012
  Basic Display Parameters & Features:
    Digital display
    Bits per primary color channel: 6
    DisplayPort interface
    Maximum image size: 31 cm x 17 cm
    Gamma: 2.20
    Supported color formats: RGB 4:4:4
    First detailed timing includes the native pixel format and preferred refresh rate
  Color Characteristics:
    Red  : 0.5898, 0.3378
    Green: 0.3261, 0.5917
    Blue : 0.1562, 0.1269
    White: 0.3134, 0.3291
  Established Timings I & II: none
  Standard Timings: none
  Detailed Timing Descriptors:
    DTD 1:  1600x900    60.007 Hz  16:9    57.606 kHz 113.600 MHz (309 mm x 174 mm)
                 Hfront   64 Hsync  42 Hback 266 Hpol N
                 Vfront    3 Vsync   3 Vback  54 Vpol N
    DTD 2:  1600x900    40.003 Hz  16:9    38.403 kHz  75.730 MHz (309 mm x 174 mm)
                 Hfront   64 Hsync  42 Hback 266 Hpol N
                 Vfront    3 Vsync   3 Vback  54 Vpol N
    Empty Descriptor
    Manufacturer-Specified Display Descriptor (0x02): 00 02 00 0c 3d ff 0c 3c 7d 1b 0d 1c 7d 20 20 20 '....=..<}...}   '
Checksum: 0xac
