
EDID (hex):
00ffffffffffff002264b83f01010101
341301030a2f1e78eadc55a359489e24
115054bfef806146714f81c081408180
950fa940b30021399030621a274068b0
3600da281100001c000000fc00485032
32320a20202020202020000000fd0038
4b185311000a202020202020000000ff
00393532545033585930313332360046

Extracted contents:
header:          00 ff ff ff ff ff ff 00
serial number:   22 64 b8 3f 01 01 01 01 34 13
version:         01 03
basic params:    0a 2f 1e 78 ea
chroma info:     dc 55 a3 59 48 9e 24 11 50 54
established:     bf ef 80
standard:        61 46 71 4f 81 c0 81 40 81 80 95 0f a9 40 b3 00
descriptor 1:    21 39 90 30 62 1a 27 40 68 b0 36 00 da 28 11 00 00 1c
descriptor 2:    00 00 00 fc 00 48 50 32 32 32 0a 20 20 20 20 20 20 20
descriptor 3:    00 00 00 fd 00 38 4b 18 53 11 00 0a 20 20 20 20 20 20
descriptor 4:    00 00 00 ff 00 39 35 32 54 50 33 58 59 30 31 33 32 36
extensions:      00
checksum:        46

EDID version: 1.3
Manufacturer: HSD Model 3fb8 Serial Number --
Made in week 52 of 2009
Analog display, Input voltage level: 0.7/0.3 V
Sync: Separate SyncOnGreen 
Maximum image size: 47 cm x 30 cm
Gamma: 2.20
DPMS levels: Standby Suspend Off
RGB color display
First detailed timing is preferred timing
Display x,y Chromaticity:
  Red:   0.6396, 0.3486
  Green: 0.2841, 0.6171
  Blue:  0.1416, 0.0673
  White: 0.3134, 0.3291
Established timings supported:
  720x400@70Hz 9:5 HorFreq: 31469 Hz Clock: 28.320 MHz
  640x480@60Hz 4:3 HorFreq: 31469 Hz Clock: 25.175 MHz
  640x480@67Hz 4:3 HorFreq: 35000 Hz Clock: 30.240 MHz
  640x480@72Hz 4:3 HorFreq: 37900 Hz Clock: 31.500 MHz
  640x480@75Hz 4:3 HorFreq: 37500 Hz Clock: 31.500 MHz
  800x600@56Hz 4:3 HorFreq: 35200 Hz Clock: 36.000 MHz
  800x600@60Hz 4:3 HorFreq: 37900 Hz Clock: 40.000 MHz
  800x600@72Hz 4:3 HorFreq: 48100 Hz Clock: 50.000 MHz
  800x600@75Hz 4:3 HorFreq: 46900 Hz Clock: 49.500 MHz
  832x624@75Hz 4:3 HorFreq: 49726 Hz Clock: 57.284 MHz
  1024x768@60Hz 4:3 HorFreq: 48400 Hz Clock: 65.000 MHz
  1024x768@70Hz 4:3 HorFreq: 56500 Hz Clock: 75.000 MHz
  1024x768@75Hz 4:3 HorFreq: 60000 Hz Clock: 78.750 MHz
  1280x1024@75Hz 5:4 HorFreq: 80000 Hz Clock: 135.000 MHz
  1152x870@75Hz 192:145 HorFreq: 67500 Hz Clock: 108.000 MHz
Standard timings supported:
  1024x768@66Hz 4:3
  1152x864@75Hz 4:3 HorFreq: 67500 Hz Clock: 108.000 MHz
  1280x720@60Hz 16:9
  1280x960@60Hz 4:3 HorFreq: 60000 Hz Clock: 108.000 MHz
  1280x1024@60Hz 5:4 HorFreq: 64000 Hz Clock: 108.000 MHz
  1440x900@75Hz 16:10 HorFreq: 82300 Hz Clock: 156.000 MHz
  1600x1200@60Hz 4:3 HorFreq: 75000 Hz Clock: 162.000 MHz
  1680x1050@60Hz 16:10 HorFreq: 64700 Hz Clock: 119.000 MHz
Detailed mode: Clock 146.250 MHz, 474 mm x 296 mm
               1680 1784 1960 2240 hborder 0
               1050 1053 1059 1089 vborder 0
               -hsync +vsync 
               VertFreq: 59 Hz, HorFreq: 65290 Hz
Monitor name: HP222
Monitor ranges (GTF): 56-75Hz V, 24-83kHz H, max dotclock 170MHz
Serial number: --
Checksum: 0x46 (valid)
