edid-decode (hex):

00 ff ff ff ff ff ff 00 30 e4 00 00 00 00 00 00
00 12 01 03 80 16 0d 78 0a bf b5 96 58 54 8b 27
20 50 54 00 00 00 01 01 01 01 01 01 01 01 01 01
01 01 01 01 01 01 7c 10 00 a0 40 40 11 20 30 20
35 00 e0 7e 00 00 00 19 00 00 00 00 00 00 00 00
00 00 00 00 00 00 00 00 00 00 00 00 00 fe 00 4c
47 20 44 69 73 70 6c 61 79 0a 20 20 00 00 00 fc
00 4c 50 31 30 31 57 53 31 2d 54 4c 41 31 00 8d

----------------

Block 0, Base EDID:
  EDID Structure Version & Revision: 1.3
  Vendor & Product Identification:
    Manufacturer: LGD
    Model: 0
    Made in: 2008
  Basic Display Parameters & Features:
    Digital display
    Maximum image size: 22 cm x 13 cm
    Gamma: 2.20
    RGB color display
    First detailed timing is preferred timing
  Color Characteristics:
    Red  : 0.5878, 0.3466
    Green: 0.3310, 0.5458
    Blue : 0.1542, 0.1279
    White: 0.3134, 0.3291
  Established Timings I & II: none
  Standard Timings: none
  Detailed Timing Descriptors:
    DTD 1:  1024x576    60.104 Hz  16:9    35.642 kHz  42.200 MHz (224 mm x 126 mm)
                 Hfront   48 Hsync  32 Hback  80 Hpol N
                 Vfront    3 Vsync   5 Vback   9 Vpol N
    Empty Descriptor
    Alphanumeric Data String: 'LG Display'
    Display Product Name: 'LP101WS1-TLA1'
Checksum: 0x8d
