
EDID (hex):
00ffffffffffff0030e4000000000000
00170104a01d117802f195a35552a126
0f505400000001010101010101010101
010101010101885e00a0a0a029503020
230025a510000019053f00a0a0a02950
3020230025a510000019000000000000
00000000000000000000000000000002
00072dff0a3caa221432aa0000000055

Extracted contents:
header:          00 ff ff ff ff ff ff 00
serial number:   30 e4 00 00 00 00 00 00 00 17
version:         01 04
basic params:    a0 1d 11 78 02
chroma info:     f1 95 a3 55 52 a1 26 0f 50 54
established:     00 00 00
standard:        01 01 01 01 01 01 01 01 01 01 01 01 01 01 01 01
descriptor 1:    88 5e 00 a0 a0 a0 29 50 30 20 23 00 25 a5 10 00 00 19
descriptor 2:    05 3f 00 a0 a0 a0 29 50 30 20 23 00 25 a5 10 00 00 19
descriptor 3:    00 00 00 00 00 00 00 00 00 00 00 00 00 00 00 00 00 00
descriptor 4:    00 00 00 02 00 07 2d ff 0a 3c aa 22 14 32 aa 00 00 00
extensions:      00
checksum:        55

EDID version: 1.4
Manufacturer: LGD Model 0 Serial Number --
Made in year 2013
Digital display
8 bits per primary color channel
Digital interface is not defined
Maximum image size: 29 cm x 17 cm
Gamma: 2.20
Supported color formats: RGB 4:4:4
First detailed timing includes the native pixel format and preferred refresh rate
Display x,y Chromaticity:
  Red:   0.6396, 0.3349
  Green: 0.3203, 0.6298
  Blue:  0.1503, 0.0595
  White: 0.3134, 0.3291
Established timings supported:
Standard timings supported:
Detailed mode: Clock 242.000 MHz, 293 mm x 165 mm
               2560 2608 2640 2720 hborder 0
               1440 1442 1445 1481 vborder 0
               -hsync -vsync 
               VertFreq: 60 Hz, HorFreq: 88970 Hz
Detailed mode: Clock 161.330 MHz, 293 mm x 165 mm
               2560 2608 2640 2720 hborder 0
               1440 1442 1445 1481 vborder 0
               -hsync -vsync 
               VertFreq: 40 Hz, HorFreq: 59312 Hz
Manufacturer-specified data, tag 0
Manufacturer-specified data, tag 2
Checksum: 0x55 (valid)
EDID block does NOT conform to EDID 1.4!
	Missing name descriptor
	Missing monitor ranges
