
EDID (hex):
00ffffffffffff0030e4000000000000
00180104a50b12780246b59f5b559426
12505400000001010101010101010101
010101010101be3cb0b6408014704020
55006fb2000000190000000000000000
00000000000000000000000000fe004c
4720446973706c61790a2020000000fe
004c443038335755312d535041330021

Extracted contents:
header:          00 ff ff ff ff ff ff 00
serial number:   30 e4 00 00 00 00 00 00 00 18
version:         01 04
basic params:    a5 0b 12 78 02
chroma info:     46 b5 9f 5b 55 94 26 12 50 54
established:     00 00 00
standard:        01 01 01 01 01 01 01 01 01 01 01 01 01 01 01 01
descriptor 1:    be 3c b0 b6 40 80 14 70 40 20 55 00 6f b2 00 00 00 19
descriptor 2:    00 00 00 00 00 00 00 00 00 00 00 00 00 00 00 00 00 00
descriptor 3:    00 00 00 fe 00 4c 47 20 44 69 73 70 6c 61 79 0a 20 20
descriptor 4:    00 00 00 fe 00 4c 44 30 38 33 57 55 31 2d 53 50 41 33
extensions:      00
checksum:        21

EDID version: 1.4
Manufacturer: LGD Model 0 Serial Number --
Made in year 2014
Digital display
8 bits per primary color channel
DisplayPort interface
Maximum image size: 11 cm x 18 cm
Gamma: 2.20
Supported color formats: RGB 4:4:4
First detailed timing includes the native pixel format and preferred refresh rate
Display x,y Chromaticity:
  Red:   0.6220, 0.3554
  Green: 0.3330, 0.5800
  Blue:  0.1503, 0.0732
  White: 0.3134, 0.3291
Established timings supported:
Standard timings supported:
Detailed mode: Clock 155.500 MHz, 111 mm x 178 mm
               1200 1264 1296 1382 hborder 0
               1920 1925 1930 1940 vborder 0
               -hsync -vsync 
               VertFreq: 57 Hz, HorFreq: 112518 Hz
Manufacturer-specified data, tag 0
ASCII string: LG Display
ASCII string: LD083WU1-SPA3
Checksum: 0x21 (valid)
EDID block does NOT conform to EDID 1.4!
	Missing name descriptor
	Missing monitor ranges
