
EDID (hex):
00ffffffffffff004ca3454f00000000
00120103802115780a87f594574f8c27
27505400000001010101010101010101
010101010101121b0088502010301030
13004bcf100000190000000f00000000
00000000002387026400000000fe0053
414d53554e470a2020202020000000fe
00313534415430372d333031200a0092

Extracted contents:
header:          00 ff ff ff ff ff ff 00
serial number:   4c a3 45 4f 00 00 00 00 00 12
version:         01 03
basic params:    80 21 15 78 0a
chroma info:     87 f5 94 57 4f 8c 27 27 50 54
established:     00 00 00
standard:        01 01 01 01 01 01 01 01 01 01 01 01 01 01 01 01
descriptor 1:    12 1b 00 88 50 20 10 30 10 30 13 00 4b cf 10 00 00 19
descriptor 2:    00 00 00 0f 00 00 00 00 00 00 00 00 00 23 87 02 64 00
descriptor 3:    00 00 00 fe 00 53 41 4d 53 55 4e 47 0a 20 20 20 20 20
descriptor 4:    00 00 00 fe 00 31 35 34 41 54 30 37 2d 33 30 31 20 0a
extensions:      00
checksum:        92

EDID version: 1.3
Manufacturer: SEC Model 4f45 Serial Number --
Made in year 2008
Digital display
Maximum image size: 33 cm x 21 cm
Gamma: 2.20
RGB color display
First detailed timing is preferred timing
Display x,y Chromaticity:
  Red:   0.5800, 0.3398
  Green: 0.3095, 0.5498
  Blue:  0.1552, 0.1552
  White: 0.3134, 0.3291
Established timings supported:
Standard timings supported:
Detailed mode: Clock 69.300 MHz, 331 mm x 207 mm
               1280 1296 1344 1416 hborder 0
                800  801  804  816 vborder 0
               -hsync -vsync 
               VertFreq: 59 Hz, HorFreq: 48940 Hz
Manufacturer-specified data, tag 15
ASCII string: SAMSUNG
ASCII string: 154AT07-301 
Checksum: 0x92 (valid)
EDID block does NOT conform to EDID 1.3!
	Missing name descriptor
	Missing monitor ranges
