edid-decode (hex):

00 ff ff ff ff ff ff 00 4c a3 52 32 00 00 00 00
00 15 01 03 80 22 13 78 ea c8 95 9e 57 54 92 26
0f 50 54 00 00 00 01 01 01 01 01 01 01 01 01 01
01 01 01 01 01 01 10 33 40 18 62 84 78 30 30 20
25 00 58 c2 10 00 00 19 00 00 00 0f 00 00 00 00
00 00 00 00 00 25 d9 06 6a 00 00 00 00 fe 00 53
41 4d 53 55 4e 47 0a 20 4c a3 4b 54 00 00 00 fe
00 4c 54 4e 31 35 36 4b 54 30 34 34 30 31 00 f0

----------------

Block 0, Base EDID:
  EDID Structure Version & Revision: 1.3
  Vendor & Product Identification:
    Manufacturer: SEC
    Model: 12882
    Made in: 2011
  Basic Display Parameters & Features:
    Digital display
    Maximum image size: 34 cm x 19 cm
    Gamma: 2.20
    DPMS levels: Standby Suspend Off
    RGB color display
    First detailed timing is preferred timing
  Color Characteristics:
    Red  : 0.6201, 0.3398
    Green: 0.3300, 0.5703
    Blue : 0.1503, 0.0595
    White: 0.3134, 0.3291
  Established Timings I & II: none
  Standard Timings: none
  Detailed Timing Descriptors:
    DTD 1:  1600x900    59.999 Hz  16:9    61.199 kHz 130.720 MHz (344 mm x 194 mm)
                 Hfront   48 Hsync  32 Hback 456 Hpol N
                 Vfront    2 Vsync   5 Vback 113 Vpol N
    Manufacturer-Specified Display Descriptor (0x0f): 00 0f 00 00 00 00 00 00 00 00 00 25 d9 06 6a 00 '...........%..j.'
    Alphanumeric Data String: 'SAMSUNG'
    Alphanumeric Data String: 'LTN156KT04401'
Checksum: 0xf0

----------------

Failures:

Block 0, Base EDID:
  Alphanumeric Data String: Non-space after newline.
  Missing Display Product Name.
  Missing Display Range Limits Descriptor.

EDID conformity: FAIL
