edid-decode (hex):

00 ff ff ff ff ff ff 00 30 f0 00 00 00 00 00 00
00 0d 01 03 80 21 15 78 0a 00 00 00 00 00 00 00
00 00 00 00 00 00 01 01 01 01 01 01 01 01 01 01
01 01 01 01 01 01 ea 1a 00 80 50 20 10 30 15 20
44 00 4b cf 10 00 00 19 00 00 00 0f 00 00 00 00
00 00 00 00 00 32 4a 04 14 00 00 00 00 10 00 00
00 00 00 00 00 00 00 00 00 00 00 00 00 00 00 fe
00 4c 50 31 35 34 57 30 31 2d 41 33 4b 33 00 df

----------------

Block 0, Base EDID:
  EDID Structure Version & Revision: 1.3
  Vendor & Product Identification:
    Manufacturer: LGP
    Model: 0
    Made in: 2003
  Basic Display Parameters & Features:
    Digital display
    Maximum image size: 33 cm x 21 cm
    Gamma: 2.20
    RGB color display
    First detailed timing is preferred timing
  Color Characteristics:
    Red  : 0.0000, 0.0000
    Green: 0.0000, 0.0000
    Blue : 0.0000, 0.0000
    White: 0.0000, 0.0000
  Established Timings I & II: none
  Standard Timings: none
  Detailed Timing Descriptors:
    DTD 1:  1280x800    59.969 Hz   8:5    48.935 kHz  68.900 MHz (331 mm x 207 mm)
                 Hfront   21 Hsync  32 Hback  75 Hpol N
                 Vfront    4 Vsync   4 Vback   8 Vpol N
    Manufacturer-Specified Display Descriptor (0x0f): 00 0f 00 00 00 00 00 00 00 00 00 32 4a 04 14 00 '...........2J...'
    Dummy Descriptor:
    Alphanumeric Data String: 'LP154W01-A3K3'
Checksum: 0xdf
