edid-decode (hex):

00 ff ff ff ff ff ff 00 0d af 25 14 00 00 00 00
2d 10 01 03 80 1e 13 78 0a 9f 05 96 56 50 88 27
20 50 54 00 00 00 01 01 01 01 01 01 01 01 01 01
01 01 01 01 01 01 bc 1b 00 a0 50 20 17 30 30 20
36 00 2f be 10 00 00 18 00 00 00 fe 00 4e 31 34
31 49 33 2d 4c 30 32 0a 20 20 00 00 00 fe 00 43
4d 4f 0a 20 20 20 20 20 20 20 20 20 00 00 00 fe
00 4e 31 34 31 49 33 2d 4c 30 32 0a 20 20 00 64

----------------

Block 0, Base EDID:
  EDID Structure Version & Revision: 1.3
  Vendor & Product Identification:
    Manufacturer: CMO
    Model: 5157
    Made in: week 45 of 2006
  Basic Display Parameters & Features:
    Digital display
    Maximum image size: 30 cm x 19 cm
    Gamma: 2.20
    RGB color display
    First detailed timing is the preferred timing
  Color Characteristics:
    Red  : 0.5878, 0.3369
    Green: 0.3154, 0.5341
    Blue : 0.1523, 0.1250
    White: 0.3134, 0.3291
  Established Timings I & II: none
  Standard Timings: none
  Detailed Timing Descriptors:
    DTD 1:  1280x800    59.909545 Hz   8:5     49.306 kHz     71.000000 MHz (303 mm x 190 mm)
                 Hfront   48 Hsync  32 Hback   80 Hpol N
                 Vfront    3 Vsync   6 Vback   14 Vpol N
    Alphanumeric Data String: 'N141I3-L02'
    Alphanumeric Data String: 'CMO'
    Alphanumeric Data String: 'N141I3-L02'
Checksum: 0x64

----------------

Warnings:

Block 0, Base EDID:
  Detailed Timing Descriptor #1: DTD is similar but not identical to DMT 0x1b.

Failures:

Block 0, Base EDID:
  Missing Display Product Name.
  Missing Display Range Limits Descriptor.

EDID conformity: FAIL
