edid-decode (hex):

00 ff ff ff ff ff ff 00 09 d1 13 77 45 54 00 00
0f 11 01 03 08 29 1a 78 ea e5 b5 a3 55 49 99 27
13 50 54 bf ef 80 95 0f 81 80 81 40 01 01 01 01
01 01 01 01 01 01 9a 29 a0 d0 51 84 22 30 50 98
36 00 9a 00 11 00 00 1c 00 00 00 fc 00 42 65 6e
51 20 54 39 31 57 0a 20 20 20 00 00 00 fd 00 38
4c 1f 54 10 00 0a 20 20 20 20 20 20 00 00 00 ff
00 43 34 37 30 31 33 32 38 30 32 36 0a 20 00 cd

00 ff ff ff ff ff ff 00 09 d1 13 77 45 54 00 00
0f 11 01 03 08 29 1a 78 ea e5 b5 a3 55 49 99 27
13 50 54 bf ef 80 95 0f 81 80 81 40 01 01 01 01
01 01 01 01 01 01 9a 29 a0 d0 51 84 22 30 50 98
36 00 9a 00 11 00 00 1c 00 00 00 fc 00 42 65 6e
51 20 54 39 31 57 0a 20 20 20 00 00 00 fd 00 38
4c 1f 54 10 00 0a 20 20 20 20 20 20 00 00 00 ff
00 43 34 37 30 31 33 32 38 30 32 36 0a 20 00 cd

----------------

Block 0, Base EDID:
  EDID Structure Version & Revision: 1.3
  Vendor & Product Identification:
    Manufacturer: BNQ
    Model: 30483
    Serial Number: ...
    Made in: week 15 of 2007
  Basic Display Parameters & Features:
    Analog display
    Signal Level Standard: 0.700 : 0.300 : 1.000 V p-p
    Blank level equals black level
    Sync: Separate
    Maximum image size: 41 cm x 26 cm
    Gamma: 2.20
    DPMS levels: Standby Suspend Off
    RGB color display
    First detailed timing is the preferred timing
  Color Characteristics:
    Red  : 0.6396, 0.3339
    Green: 0.2861, 0.5986
    Blue : 0.1542, 0.0771
    White: 0.3134, 0.3291
  Established Timings I & II:
    IBM     :   720x400    70.081663 Hz   9:5     31.467 kHz     28.320000 MHz
    DMT 0x04:   640x480    59.940476 Hz   4:3     31.469 kHz     25.175000 MHz
    Apple   :   640x480    66.666667 Hz   4:3     35.000 kHz     30.240000 MHz
    DMT 0x05:   640x480    72.808802 Hz   4:3     37.861 kHz     31.500000 MHz
    DMT 0x06:   640x480    75.000000 Hz   4:3     37.500 kHz     31.500000 MHz
    DMT 0x08:   800x600    56.250000 Hz   4:3     35.156 kHz     36.000000 MHz
    DMT 0x09:   800x600    60.316541 Hz   4:3     37.879 kHz     40.000000 MHz
    DMT 0x0a:   800x600    72.187572 Hz   4:3     48.077 kHz     50.000000 MHz
    DMT 0x0b:   800x600    75.000000 Hz   4:3     46.875 kHz     49.500000 MHz
    Apple   :   832x624    74.551266 Hz   4:3     49.726 kHz     57.284000 MHz
    DMT 0x10:  1024x768    60.003840 Hz   4:3     48.363 kHz     65.000000 MHz
    DMT 0x11:  1024x768    70.069359 Hz   4:3     56.476 kHz     75.000000 MHz
    DMT 0x12:  1024x768    75.028582 Hz   4:3     60.023 kHz     78.750000 MHz
    DMT 0x24:  1280x1024   75.024675 Hz   5:4     79.976 kHz    135.000000 MHz
    Apple   :  1152x870    75.061550 Hz 192:145   68.681 kHz    100.000000 MHz
  Standard Timings:
    DMT 0x30:  1440x900    74.984427 Hz  16:10    70.635 kHz    136.750000 MHz
    DMT 0x23:  1280x1024   60.019740 Hz   5:4     63.981 kHz    108.000000 MHz
    DMT 0x20:  1280x960    60.000000 Hz   4:3     60.000 kHz    108.000000 MHz
  Detailed Timing Descriptors:
    DTD 1:  1440x900    59.887445 Hz  16:10    55.935 kHz    106.500000 MHz (410 mm x 256 mm)
                 Hfront   80 Hsync 152 Hback  232 Hpol N
                 Vfront    3 Vsync   6 Vback   25 Vpol P
    Display Product Name: 'BenQ T91W'
    Display Range Limits:
      Monitor ranges (GTF): 56-76 Hz V, 31-84 kHz H, max dotclock 160 MHz
    Display Product Serial Number: ...
Checksum: 0xcd

----------------

Block 1, Unknown EDID Extension Block 0x00:
  00 ff ff ff ff ff ff 00 09 d1 13 77 45 54 00 00 '...........wET..'
  0f 11 01 03 08 29 1a 78 ea e5 b5 a3 55 49 99 27 '.....).x....UI.''
  13 50 54 bf ef 80 95 0f 81 80 81 40 01 01 01 01 '.PT........@....'
  01 01 01 01 01 01 9a 29 a0 d0 51 84 22 30 50 98 '.......)..Q."0P.'
  36 00 9a 00 11 00 00 1c 00 00 00 fc 00 42 65 6e '6............Ben'
  51 20 54 39 31 57 0a 20 20 20 00 00 00 fd 00 38 'Q T91W.   .....8'
  4c 1f 54 10 00 0a 20 20 20 20 20 20 00 00 00 ff 'L.T...      ....'
  00 43 34 37 30 31 33 32 38 30 32 36 0a 20 00 cd '.C4701328026. ..'
Checksum: 0xcd

----------------

Failures:

Block 1, Base EDID:
  Unknown Extension Block.
EDID:
  Base EDID: EDID specified 0 extension block(s), but found 1 extension block(s).

EDID conformity: FAIL
