edid-decode (hex):

00 ff ff ff ff ff ff 00 09 e5 ba 05 00 00 00 00
01 16 01 03 80 1f 11 78 0a b0 90 97 58 54 92 26
1d 50 54 00 00 00 01 01 01 01 01 01 01 01 01 01
01 01 01 01 01 01 9e 1b 56 7e 50 00 16 30 30 20
36 00 35 ad 10 00 00 1a 9e 1b 56 7e 50 00 16 30
30 20 36 00 35 ad 10 00 00 1a 00 00 00 fe 00 42
4f 45 20 48 46 0a 20 20 20 20 20 20 00 00 00 fe
00 48 42 31 34 30 57 58 31 2d 32 30 30 0a 00 84

----------------

Block 0, Base EDID:
  EDID Structure Version & Revision: 1.3
  Vendor & Product Identification:
    Manufacturer: BOE
    Model: 1466
    Made in: week 1 of 2012
  Basic Display Parameters & Features:
    Digital display
    Maximum image size: 31 cm x 17 cm
    Gamma: 2.20
    RGB color display
    First detailed timing is preferred timing
  Color Characteristics:
    Red  : 0.5917, 0.3466
    Green: 0.3281, 0.5703
    Blue : 0.1503, 0.1142
    White: 0.3125, 0.3281
  Established Timings I & II: none
  Standard Timings: none
  Detailed Timing Descriptors:
    DTD 1:  1366x768    59.982 Hz 683:384  47.386 kHz  70.700 MHz (309 mm x 173 mm)
                 Hfront   48 Hsync  32 Hback  46 Hpol P
                 Vfront    3 Vsync   6 Vback  13 Vpol N
    DTD 2:  1366x768    59.982 Hz 683:384  47.386 kHz  70.700 MHz (309 mm x 173 mm)
                 Hfront   48 Hsync  32 Hback  46 Hpol P
                 Vfront    3 Vsync   6 Vback  13 Vpol N
    Alphanumeric Data String: 'BOE HF'
    Alphanumeric Data String: 'HB140WX1-200'
Checksum: 0x84
