edid-decode (hex):

00 ff ff ff ff ff ff 00 06 af 3e 30 00 00 00 00
00 16 01 04 95 1f 11 78 02 a0 95 99 59 52 92 26
21 50 54 00 00 00 01 01 01 01 01 01 01 01 01 01
01 01 01 01 01 01 fc 2b 40 a0 61 84 1e 30 40 2a
33 00 35 ae 10 00 00 18 53 1d 40 a0 61 84 1e 30
40 2a 33 00 35 ae 10 00 00 18 00 00 00 00 00 00
00 00 00 00 00 00 00 00 00 00 00 00 00 00 00 02
00 0c 3d ff 0a 3c 7d 1b 11 24 7d 20 20 20 00 3c

----------------

Block 0, Base EDID:
  EDID Structure Version & Revision: 1.4
  Vendor & Product Identification:
    Manufacturer: AUO
    Model: 12350
    Made in: 2012
  Basic Display Parameters & Features:
    Digital display
    Bits per primary color channel: 6
    DisplayPort interface
    Maximum image size: 31 cm x 17 cm
    Gamma: 2.20
    Supported color formats: RGB 4:4:4
    First detailed timing includes the native pixel format and preferred refresh rate
  Color Characteristics:
    Red  : 0.5996, 0.3496
    Green: 0.3203, 0.5703
    Blue : 0.1503, 0.1298
    White: 0.3134, 0.3291
  Established Timings I & II: none
  Standard Timings: none
  Detailed Timing Descriptors:
    DTD 1:  1600x900    60.057 Hz  16:9    55.853 kHz 112.600 MHz (309 mm x 174 mm)
                 Hfront   64 Hsync  42 Hback 310 Hpol N
                 Vfront    3 Vsync   3 Vback  24 Vpol N
    DTD 2:  1600x900    40.040 Hz  16:9    37.237 kHz  75.070 MHz (309 mm x 174 mm)
                 Hfront   64 Hsync  42 Hback 310 Hpol N
                 Vfront    3 Vsync   3 Vback  24 Vpol N
    Empty Descriptor
    Manufacturer-Specified Display Descriptor (0x02): 00 02 00 0c 3d ff 0a 3c 7d 1b 11 24 7d 20 20 20 '....=..<}..$}   '
Checksum: 0x3c

----------------

Failures:

Block 0, Base EDID:
  Empty Descriptor: Use Dummy Descriptor instead of all zeroes.
  Missing Display Product Name.

EDID conformity: FAIL
