
EDID (hex):
00ffffffffffff0051f38f5000000b00
13140104802f1a78028c05a55554a028
0d505400000001010101010101010101
010101010101023a801871382d40582c
4500dc0c110000180000000f00000000
00000000000000000020000000fd0038
551f5e15000a202020202020000000fc
00544f53484942410a20202020200078

Extracted contents:
header:          00 ff ff ff ff ff ff 00
serial number:   51 f3 8f 50 00 00 0b 00 13 14
version:         01 04
basic params:    80 2f 1a 78 02
chroma info:     8c 05 a5 55 54 a0 28 0d 50 54
established:     00 00 00
standard:        01 01 01 01 01 01 01 01 01 01 01 01 01 01 01 01
descriptor 1:    02 3a 80 18 71 38 2d 40 58 2c 45 00 dc 0c 11 00 00 18
descriptor 2:    00 00 00 0f 00 00 00 00 00 00 00 00 00 00 00 00 00 20
descriptor 3:    00 00 00 fd 00 38 55 1f 5e 15 00 0a 20 20 20 20 20 20
descriptor 4:    00 00 00 fc 00 54 4f 53 48 49 42 41 0a 20 20 20 20 20
extensions:      00
checksum:        78

EDID version: 1.4
Manufacturer: TOS Model 508f Serial Number --
Made in week 19 of 2010
Digital display
Color depth is undefined
Digital interface is not defined
Maximum image size: 47 cm x 26 cm
Gamma: 2.20
Supported color formats: RGB 4:4:4
First detailed timing includes the native pixel format and preferred refresh rate
Display x,y Chromaticity:
  Red:   0.6464, 0.3320
  Green: 0.3310, 0.6250
  Blue:  0.1562, 0.0507
  White: 0.3134, 0.3291
Established timings supported:
Standard timings supported:
Detailed mode: Clock 148.500 MHz, 476 mm x 268 mm
               1920 2008 2052 2200 hborder 0
               1080 1084 1089 1125 vborder 0
               -hsync -vsync 
               VertFreq: 60 Hz, HorFreq: 67500 Hz
Manufacturer-specified data, tag 15
Monitor ranges (GTF): 56-85Hz V, 31-94kHz H, max dotclock 210MHz
Monitor name: TOSHIBA
Checksum: 0x78 (valid)
