edid-decode (hex):

00 ff ff ff ff ff ff 00 59 3a 67 00 01 01 01 01
0d 12 01 03 08 46 27 78 2a f9 6b a2 55 4a 9a 25
0f 47 4a a5 ce 00 81 c0 01 01 01 01 01 01 01 01
01 01 01 01 01 01 66 21 56 b0 51 00 1b 30 80 82
26 00 bc 86 21 00 00 1a 00 00 00 fd 00 32 4d 1f
46 0f 00 0a 20 20 20 20 20 20 00 00 00 ff 00 55
4b 48 4c 41 4c 30 31 30 30 30 30 31 00 00 00 fc
00 45 33 32 31 56 4c 0a 20 20 20 20 20 20 00 2b

----------------

Block 0, Base EDID:
  EDID Structure Version & Revision: 1.3
  Vendor & Product Identification:
    Manufacturer: VIZ
    Model: 103
    Serial Number: ...
    Made in: week 13 of 2008
  Basic Display Parameters & Features:
    Analog display
    Signal Level Standard: 0.700 : 0.300 : 1.000 V p-p
    Blank level equals black level
    Sync: Separate
    Maximum image size: 70 cm x 39 cm
    Gamma: 2.20
    DPMS levels: Off
    RGB color display
    First detailed timing is the preferred timing
  Color Characteristics:
    Red  : 0.6357, 0.3349
    Green: 0.2910, 0.6025
    Blue : 0.1455, 0.0605
    White: 0.2792, 0.2919
  Established Timings I & II:
    IBM     :   720x400    70.081663 Hz   9:5     31.467 kHz     28.320000 MHz
    DMT 0x04:   640x480    59.940476 Hz   4:3     31.469 kHz     25.175000 MHz
    DMT 0x06:   640x480    75.000000 Hz   4:3     37.500 kHz     31.500000 MHz
    DMT 0x09:   800x600    60.316541 Hz   4:3     37.879 kHz     40.000000 MHz
    DMT 0x0a:   800x600    72.187572 Hz   4:3     48.077 kHz     50.000000 MHz
    DMT 0x0b:   800x600    75.000000 Hz   4:3     46.875 kHz     49.500000 MHz
    DMT 0x10:  1024x768    60.003840 Hz   4:3     48.363 kHz     65.000000 MHz
    DMT 0x11:  1024x768    70.069359 Hz   4:3     56.476 kHz     75.000000 MHz
    DMT 0x12:  1024x768    75.028582 Hz   4:3     60.023 kHz     78.750000 MHz
  Standard Timings:
    DMT 0x55:  1280x720    60.000000 Hz  16:9     45.000 kHz     74.250000 MHz
  Detailed Timing Descriptors:
    DTD 1:  1366x768    59.814889 Hz 683:384   47.553 kHz     85.500000 MHz (700 mm x 390 mm)
                 Hfront  128 Hsync 130 Hback  174 Hpol P
                 Vfront    2 Vsync   6 Vback   19 Vpol N
    Display Range Limits:
      Monitor ranges (GTF): 50-77 Hz V, 31-70 kHz H, max dotclock 150 MHz
    Display Product Serial Number: ...
    Display Product Name: 'E321VL'
Checksum: 0x2b

----------------

EDID conformity: PASS
