
EDID (hex):
00ffffffffffff00593a670001010101
00150103082917782a5da5a35953a027
0f5054a5460001010101010101010101
010101010101662150b051001b304070
36009ae61000001e6419004041002630
188836009ae610000018000000fc0045
31393056410a202020202020000000fd
003a4c1e3d09000a20202020202000c9

Extracted contents:
header:          00 ff ff ff ff ff ff 00
serial number:   59 3a 67 00 01 01 01 01 00 15
version:         01 03
basic params:    08 29 17 78 2a
chroma info:     5d a5 a3 59 53 a0 27 0f 50 54
established:     a5 46 00
standard:        01 01 01 01 01 01 01 01 01 01 01 01 01 01 01 01
descriptor 1:    66 21 50 b0 51 00 1b 30 40 70 36 00 9a e6 10 00 00 1e
descriptor 2:    64 19 00 40 41 00 26 30 18 88 36 00 9a e6 10 00 00 18
descriptor 3:    00 00 00 fc 00 45 31 39 30 56 41 0a 20 20 20 20 20 20
descriptor 4:    00 00 00 fd 00 3a 4c 1e 3d 09 00 0a 20 20 20 20 20 20
extensions:      00
checksum:        c9

EDID version: 1.3
Manufacturer: VIZ Model 67 Serial Number --
Made in year 2011
Analog display, Input voltage level: 0.7/0.3 V
Sync: Separate 
Maximum image size: 41 cm x 23 cm
Gamma: 2.20
DPMS levels: Off
RGB color display
First detailed timing is preferred timing
Display x,y Chromaticity:
  Red:   0.6376, 0.3486
  Green: 0.3271, 0.6259
  Blue:  0.1542, 0.0605
  White: 0.3134, 0.3291
Established timings supported:
  720x400@70Hz 9:5 HorFreq: 31469 Hz Clock: 28.320 MHz
  640x480@60Hz 4:3 HorFreq: 31469 Hz Clock: 25.175 MHz
  640x480@75Hz 4:3 HorFreq: 37500 Hz Clock: 31.500 MHz
  800x600@60Hz 4:3 HorFreq: 37900 Hz Clock: 40.000 MHz
  800x600@75Hz 4:3 HorFreq: 46900 Hz Clock: 49.500 MHz
  1024x768@70Hz 4:3 HorFreq: 56500 Hz Clock: 75.000 MHz
  1024x768@75Hz 4:3 HorFreq: 60000 Hz Clock: 78.750 MHz
Standard timings supported:
Detailed mode: Clock 85.500 MHz, 410 mm x 230 mm
               1360 1424 1536 1792 hborder 0
                768  771  777  795 vborder 0
               +hsync +vsync 
               VertFreq: 60 Hz, HorFreq: 47712 Hz
Detailed mode: Clock 65.000 MHz, 410 mm x 230 mm
               1024 1048 1184 1344 hborder 0
                768  771  777  806 vborder 0
               -hsync -vsync 
               VertFreq: 60 Hz, HorFreq: 48363 Hz
Monitor name: E190VA
Monitor ranges (GTF): 58-76Hz V, 30-61kHz H, max dotclock 90MHz
Checksum: 0xc9 (valid)
