edid-decode (hex):

00 ff ff ff ff ff ff 00 32 0c 2b 01 00 00 00 00
00 12 01 03 90 1e 13 78 0a b3 85 95 58 53 8a 28
25 50 54 00 00 00 01 01 01 01 01 01 01 01 01 01
01 01 01 01 01 01 31 1c 00 98 50 20 28 30 28 20
88 00 30 be 10 00 00 1a cc 12 00 98 50 20 28 30
28 20 88 00 30 be 10 00 00 1a 00 00 00 fe 00 47
59 32 31 39 00 31 34 31 57 58 33 0a 00 00 00 00
00 00 00 00 00 00 00 00 00 01 01 0a 20 20 00 7d

----------------

Block 0, Base EDID:
  EDID Structure Version & Revision: 1.3
  Vendor & Product Identification:
    Manufacturer: LPL
    Model: 299
    Made in: 2008
  Basic Display Parameters & Features:
    Digital display
    Maximum image size: 30 cm x 19 cm
    Gamma: 2.20
    RGB color display
    First detailed timing is the preferred timing
  Color Characteristics:
    Red  : 0.5839, 0.3466
    Green: 0.3242, 0.5419
    Blue : 0.1582, 0.1445
    White: 0.3134, 0.3291
  Established Timings I & II: none
  Standard Timings: none
  Detailed Timing Descriptors:
    DTD 1:  1280x800    59.998 Hz   8:5    50.398 kHz  72.170 MHz (304 mm x 190 mm)
                 Hfront   40 Hsync  32 Hback  80 Hpol P
                 Vfront    8 Vsync   8 Vback  24 Vpol N
    DTD 2:  1280x800    40.004 Hz   8:5    33.603 kHz  48.120 MHz (304 mm x 190 mm)
                 Hfront   40 Hsync  32 Hback  80 Hpol P
                 Vfront    8 Vsync   8 Vback  24 Vpol N
    Alphanumeric Data String: 'GY219'
    Manufacturer-Specified Display Descriptor (0x00): 00 00 00 00 00 00 00 00 00 00 00 01 01 0a 20 20 '..............  '
Checksum: 0x7d

----------------

Failures:

Block 0, Base EDID:
  Basic Display Parameters & Features: Digital Video Interface Standard set to reserved value 0x10.
  Alphanumeric Data String: Non-printable character.
  Missing Display Product Name.
  Missing Display Range Limits Descriptor.

EDID conformity: FAIL
