edid-decode (hex):

00 ff ff ff ff ff ff 00 52 62 08 01 01 01 01 01
ff 13 01 03 80 a0 5a 78 0a 0d c9 a0 57 47 98 27
12 48 4c 2f cf 00 81 80 01 01 01 01 01 01 01 01
01 01 01 01 01 01 01 1d 80 d0 72 1c 16 20 10 2c
25 80 40 84 63 00 00 9e 66 21 50 b0 51 00 1b 30
40 70 36 00 3a 84 63 00 00 1e 00 00 00 fc 00 54
4f 53 48 49 42 41 2d 54 56 0a 20 20 00 00 00 fd
00 17 4c 0f 51 0f 00 0a 20 20 20 20 20 20 01 cc

02 03 24 71 52 94 13 12 16 11 15 1f 05 04 03 07
02 06 10 01 20 21 22 23 09 07 07 65 03 0c 00 30
00 e2 00 7f 02 3a 80 d0 72 38 2d 40 10 2c 45 80
40 84 63 00 00 1e 8c 0a d0 90 20 40 31 20 0c 40
55 00 b0 84 43 00 00 18 0e 1f 00 80 51 00 1e 30
40 80 37 00 dc 84 53 00 00 1c f1 27 00 a0 51 00
25 30 50 80 37 00 dc 84 53 00 00 1c a9 1a 00 a0
50 00 16 30 30 20 37 00 dc 84 53 00 00 1a 00 df

00 ff ff ff ff ff ff 00 52 62 08 01 01 01 01 01
ff 13 01 03 80 a0 5a 78 0a 0d c9 a0 57 47 98 27
12 48 4c 2f cf 00 81 80 01 01 01 01 01 01 01 01
01 01 01 01 01 01 01 1d 80 d0 72 1c 16 20 10 2c
25 80 40 84 63 00 00 9e 66 21 50 b0 51 00 1b 30
40 70 36 00 3a 84 63 00 00 1e 00 00 00 fc 00 54
4f 53 48 49 42 41 2d 54 56 0a 20 20 00 00 00 fd
00 17 4c 0f 51 0f 00 0a 20 20 20 20 20 20 01 cc

02 03 24 71 52 94 13 12 16 11 15 1f 05 04 03 07
02 06 10 01 20 21 22 23 09 07 07 65 03 0c 00 30
00 e2 00 7f 02 3a 80 d0 72 38 2d 40 10 2c 45 80
40 84 63 00 00 1e 8c 0a d0 90 20 40 31 20 0c 40
55 00 b0 84 43 00 00 18 0e 1f 00 80 51 00 1e 30
40 80 37 00 dc 84 53 00 00 1c f1 27 00 a0 51 00
25 30 50 80 37 00 dc 84 53 00 00 1c a9 1a 00 a0
50 00 16 30 30 20 37 00 dc 84 53 00 00 1a 00 df

----------------

Block 0, Base EDID:
  EDID Structure Version & Revision: 1.3
  Vendor & Product Identification:
    Manufacturer: TSB
    Model: 264
    Serial Number: ...
    Model year: 2009
  Basic Display Parameters & Features:
    Digital display
    Maximum image size: 160 cm x 90 cm
    Gamma: 2.20
    RGB color display
    First detailed timing is the preferred timing
  Color Characteristics:
    Red  : 0.6250, 0.3398
    Green: 0.2802, 0.5947
    Blue : 0.1552, 0.0703
    White: 0.2832, 0.2978
  Established Timings I & II:
    DMT 0x04:   640x480    59.940476 Hz   4:3     31.469 kHz     25.175000 MHz
    DMT 0x05:   640x480    72.808802 Hz   4:3     37.861 kHz     31.500000 MHz
    DMT 0x06:   640x480    75.000000 Hz   4:3     37.500 kHz     31.500000 MHz
    DMT 0x08:   800x600    56.250000 Hz   4:3     35.156 kHz     36.000000 MHz
    DMT 0x09:   800x600    60.316541 Hz   4:3     37.879 kHz     40.000000 MHz
    DMT 0x0a:   800x600    72.187572 Hz   4:3     48.077 kHz     50.000000 MHz
    DMT 0x0b:   800x600    75.000000 Hz   4:3     46.875 kHz     49.500000 MHz
    DMT 0x10:  1024x768    60.003840 Hz   4:3     48.363 kHz     65.000000 MHz
    DMT 0x11:  1024x768    70.069359 Hz   4:3     56.476 kHz     75.000000 MHz
    DMT 0x12:  1024x768    75.028582 Hz   4:3     60.023 kHz     78.750000 MHz
    DMT 0x24:  1280x1024   75.024675 Hz   5:4     79.976 kHz    135.000000 MHz
  Standard Timings:
    DMT 0x23:  1280x1024   60.019740 Hz   5:4     63.981 kHz    108.000000 MHz
  Detailed Timing Descriptors:
    DTD  1:  1920x1080i  50.000000 Hz  16:9     28.125 kHz     74.250000 MHz (1600 mm x 900 mm)
                  Hfront  528 Hsync  44 Hback  148 Hpol P
                  Vfront    2 Vsync   5 Vback   15 Vpol P Vfront +0.5 Odd Field
                  Vfront    2 Vsync   5 Vback   15 Vpol P Vback  +0.5 Even Field
    DTD  2:  1360x768    60.015162 Hz  85:48    47.712 kHz     85.500000 MHz (1594 mm x 900 mm)
                  Hfront   64 Hsync 112 Hback  256 Hpol P
                  Vfront    3 Vsync   6 Vback   18 Vpol P
    Display Product Name: 'TOSHIBA-TV'
    Display Range Limits:
      Monitor ranges (GTF): 23-76 Hz V, 15-81 kHz H, max dotclock 150 MHz
  Extension blocks: 1
Checksum: 0xcc

----------------

Block 1, CTA-861 Extension Block:
  Revision: 3
  Basic audio support
  Supports YCbCr 4:4:4
  Supports YCbCr 4:2:2
  Native detailed modes: 1
  Video Data Block:
    VIC  20:  1920x1080i  50.000000 Hz  16:9     28.125 kHz     74.250000 MHz (native)
    VIC  19:  1280x720    50.000000 Hz  16:9     37.500 kHz     74.250000 MHz
    VIC  18:   720x576    50.000000 Hz  16:9     31.250 kHz     27.000000 MHz
    VIC  22:  1440x576i   50.000000 Hz  16:9     15.625 kHz     27.000000 MHz
    VIC  17:   720x576    50.000000 Hz   4:3     31.250 kHz     27.000000 MHz
    VIC  21:  1440x576i   50.000000 Hz   4:3     15.625 kHz     27.000000 MHz
    VIC  31:  1920x1080   50.000000 Hz  16:9     56.250 kHz    148.500000 MHz
    VIC   5:  1920x1080i  60.000000 Hz  16:9     33.750 kHz     74.250000 MHz
    VIC   4:  1280x720    60.000000 Hz  16:9     45.000 kHz     74.250000 MHz
    VIC   3:   720x480    59.940060 Hz  16:9     31.469 kHz     27.000000 MHz
    VIC   7:  1440x480i   59.940060 Hz  16:9     15.734 kHz     27.000000 MHz
    VIC   2:   720x480    59.940060 Hz   4:3     31.469 kHz     27.000000 MHz
    VIC   6:  1440x480i   59.940060 Hz   4:3     15.734 kHz     27.000000 MHz
    VIC  16:  1920x1080   60.000000 Hz  16:9     67.500 kHz    148.500000 MHz
    VIC   1:   640x480    59.940476 Hz   4:3     31.469 kHz     25.175000 MHz
    VIC  32:  1920x1080   24.000000 Hz  16:9     27.000 kHz     74.250000 MHz
    VIC  33:  1920x1080   25.000000 Hz  16:9     28.125 kHz     74.250000 MHz
    VIC  34:  1920x1080   30.000000 Hz  16:9     33.750 kHz     74.250000 MHz
  Audio Data Block:
    Linear PCM:
      Max channels: 2
      Supported sample rates (kHz): 48 44.1 32
      Supported sample sizes (bits): 24 20 16
  Vendor-Specific Data Block (HDMI), OUI 00-0C-03:
    Source physical address: 3.0.0.0
  Video Capability Data Block:
    YCbCr quantization: No Data
    RGB quantization: Selectable (via AVI Q)
    PT scan behavior: Supports both over- and underscan
    IT scan behavior: Supports both over- and underscan
    CE scan behavior: Supports both over- and underscan
  Detailed Timing Descriptors:
    DTD  3:  1920x1080   50.000000 Hz  16:9     56.250 kHz    148.500000 MHz (1600 mm x 900 mm)
                  Hfront  528 Hsync  44 Hback  148 Hpol P
                  Vfront    4 Vsync   5 Vback   36 Vpol P
    DTD  4:   720x576    50.000000 Hz   5:4     31.250 kHz     27.000000 MHz (1200 mm x 900 mm)
                  Hfront   12 Hsync  64 Hback   68 Hpol N
                  Vfront    5 Vsync   5 Vback   39 Vpol N
    DTD  5:  1280x768    59.870228 Hz   5:3     47.776 kHz     79.500000 MHz (1500 mm x 900 mm)
                  Hfront   64 Hsync 128 Hback  192 Hpol N
                  Vfront    3 Vsync   7 Vback   20 Vpol P
    DTD  6:  1280x768    74.893062 Hz   5:3     60.289 kHz    102.250000 MHz (1500 mm x 900 mm)
                  Hfront   80 Hsync 128 Hback  208 Hpol N
                  Vfront    3 Vsync   7 Vback   27 Vpol P
    DTD  7:  1280x768    59.994726 Hz   5:3     47.396 kHz     68.250000 MHz (1500 mm x 900 mm)
                  Hfront   48 Hsync  32 Hback   80 Hpol P
                  Vfront    3 Vsync   7 Vback   12 Vpol N
Checksum: 0xdf  Unused space in Extension Block: 1 byte

----------------

Block 2, Unknown EDID Extension Block 0x00:
  00 ff ff ff ff ff ff 00 52 62 08 01 01 01 01 01 '........Rb......'
  ff 13 01 03 80 a0 5a 78 0a 0d c9 a0 57 47 98 27 '......Zx....WG.''
  12 48 4c 2f cf 00 81 80 01 01 01 01 01 01 01 01 '.HL/............'
  01 01 01 01 01 01 01 1d 80 d0 72 1c 16 20 10 2c '..........r.. .,'
  25 80 40 84 63 00 00 9e 66 21 50 b0 51 00 1b 30 '%.@.c...f!P.Q..0'
  40 70 36 00 3a 84 63 00 00 1e 00 00 00 fc 00 54 '@p6.:.c........T'
  4f 53 48 49 42 41 2d 54 56 0a 20 20 00 00 00 fd 'OSHIBA-TV.  ....'
  00 17 4c 0f 51 0f 00 0a 20 20 20 20 20 20 01 cc '..L.Q...      ..'
Checksum: 0xcc

----------------

Block 3, CTA-861 Extension Block:
  Revision: 3
  Basic audio support
  Supports YCbCr 4:4:4
  Supports YCbCr 4:2:2
  Native detailed modes: 1
  Video Data Block:
    VIC  20:  1920x1080i  50.000000 Hz  16:9     28.125 kHz     74.250000 MHz (native)
    VIC  19:  1280x720    50.000000 Hz  16:9     37.500 kHz     74.250000 MHz
    VIC  18:   720x576    50.000000 Hz  16:9     31.250 kHz     27.000000 MHz
    VIC  22:  1440x576i   50.000000 Hz  16:9     15.625 kHz     27.000000 MHz
    VIC  17:   720x576    50.000000 Hz   4:3     31.250 kHz     27.000000 MHz
    VIC  21:  1440x576i   50.000000 Hz   4:3     15.625 kHz     27.000000 MHz
    VIC  31:  1920x1080   50.000000 Hz  16:9     56.250 kHz    148.500000 MHz
    VIC   5:  1920x1080i  60.000000 Hz  16:9     33.750 kHz     74.250000 MHz
    VIC   4:  1280x720    60.000000 Hz  16:9     45.000 kHz     74.250000 MHz
    VIC   3:   720x480    59.940060 Hz  16:9     31.469 kHz     27.000000 MHz
    VIC   7:  1440x480i   59.940060 Hz  16:9     15.734 kHz     27.000000 MHz
    VIC   2:   720x480    59.940060 Hz   4:3     31.469 kHz     27.000000 MHz
    VIC   6:  1440x480i   59.940060 Hz   4:3     15.734 kHz     27.000000 MHz
    VIC  16:  1920x1080   60.000000 Hz  16:9     67.500 kHz    148.500000 MHz
    VIC   1:   640x480    59.940476 Hz   4:3     31.469 kHz     25.175000 MHz
    VIC  32:  1920x1080   24.000000 Hz  16:9     27.000 kHz     74.250000 MHz
    VIC  33:  1920x1080   25.000000 Hz  16:9     28.125 kHz     74.250000 MHz
    VIC  34:  1920x1080   30.000000 Hz  16:9     33.750 kHz     74.250000 MHz
  Audio Data Block:
    Linear PCM:
      Max channels: 2
      Supported sample rates (kHz): 48 44.1 32
      Supported sample sizes (bits): 24 20 16
  Vendor-Specific Data Block (HDMI), OUI 00-0C-03:
    Source physical address: 3.0.0.0
  Video Capability Data Block:
    YCbCr quantization: No Data
    RGB quantization: Selectable (via AVI Q)
    PT scan behavior: Supports both over- and underscan
    IT scan behavior: Supports both over- and underscan
    CE scan behavior: Supports both over- and underscan
  Detailed Timing Descriptors:
    DTD  8:  1920x1080   50.000000 Hz  16:9     56.250 kHz    148.500000 MHz (1600 mm x 900 mm)
                  Hfront  528 Hsync  44 Hback  148 Hpol P
                  Vfront    4 Vsync   5 Vback   36 Vpol P
    DTD  9:   720x576    50.000000 Hz   5:4     31.250 kHz     27.000000 MHz (1200 mm x 900 mm)
                  Hfront   12 Hsync  64 Hback   68 Hpol N
                  Vfront    5 Vsync   5 Vback   39 Vpol N
    DTD 10:  1280x768    59.870228 Hz   5:3     47.776 kHz     79.500000 MHz (1500 mm x 900 mm)
                  Hfront   64 Hsync 128 Hback  192 Hpol N
                  Vfront    3 Vsync   7 Vback   20 Vpol P
    DTD 11:  1280x768    74.893062 Hz   5:3     60.289 kHz    102.250000 MHz (1500 mm x 900 mm)
                  Hfront   80 Hsync 128 Hback  208 Hpol N
                  Vfront    3 Vsync   7 Vback   27 Vpol P
    DTD 12:  1280x768    59.994726 Hz   5:3     47.396 kHz     68.250000 MHz (1500 mm x 900 mm)
                  Hfront   48 Hsync  32 Hback   80 Hpol P
                  Vfront    3 Vsync   7 Vback   12 Vpol N
Checksum: 0xdf  Unused space in Extension Block: 1 byte

----------------

Warnings:

Block 1, CTA-861 Extension Block:
  IT Video Formats are overscanned by default, but normally this should be underscanned.
  Video Capability Data Block: Set Selectable YCbCr Quantization to avoid interop issues.
  Video Capability Data Block: S_PT is equal to S_IT and S_CE, so should be set to 0 instead.
  Add a Colorimetry Data Block with the sRGB colorimetry bit set to avoid interop issues.
Block 3, CTA-861 Extension Block:
  IT Video Formats are overscanned by default, but normally this should be underscanned.
  Video Capability Data Block: Set Selectable YCbCr Quantization to avoid interop issues.
  Video Capability Data Block: S_PT is equal to S_IT and S_CE, so should be set to 0 instead.
  Add a Colorimetry Data Block with the sRGB colorimetry bit set to avoid interop issues.
EDID:
  CTA-861: Multiple native interlaced timings are defined.

Failures:

Block 0, Base EDID:
  Vendor & Product Identification: EDID 1.3 does not support week 0xff.
Block 2, Base EDID:
  Unknown Extension Block.
Block 3, CTA-861 Extension Block:
  Video Data Block: Duplicate VIC 20.
  Video Data Block: Duplicate VIC 19.
  Video Data Block: Duplicate VIC 18.
  Video Data Block: Duplicate VIC 22.
  Video Data Block: Duplicate VIC 17.
  Video Data Block: Duplicate VIC 21.
  Video Data Block: Duplicate VIC 31.
  Video Data Block: Duplicate VIC 5.
  Video Data Block: Duplicate VIC 4.
  Video Data Block: Duplicate VIC 3.
  Video Data Block: Duplicate VIC 7.
  Video Data Block: Duplicate VIC 2.
  Video Data Block: Duplicate VIC 6.
  Video Data Block: Duplicate VIC 16.
  Video Data Block: Duplicate VIC 1.
  Video Data Block: Duplicate VIC 32.
  Video Data Block: Duplicate VIC 33.
  Video Data Block: Duplicate VIC 34.
  Video Capability Data Block: Only one instance of this Data Block is allowed.
EDID:
  Base EDID: EDID specified 1 extension block(s), but found 3 extension block(s).
  Base EDID: EDID 1.3 requires a Block Map Extension in Block 1 if there are more than 2 blocks in the EDID.
  CTA-861: A native interlaced timing is present, but not a native progressive timing.

EDID conformity: FAIL
