
EDID (hex):
00ffffffffffff005262080101010101
ff140103804627780a463da155499925
0e474a00000001010101010101010101
010101010101023a80d072382d40102c
4580ba892100001e011d80d0721c1620
102c2580ba892100009e000000fc0054
4f53484942412d54560a2020000000fd
00314c0f510e000a202020202020017b
02032770511f21141312161115100504
030702060120230907076c030c002000
001ec015151f1f011d00bc52d01e20b8
285540ba892100001e023a801871382d
40582c4500ba892100001e011d801871
1c1620582c2500ba892100009e011d00
7251d01e206e285500ba892100001e00
00000000000000000000000000000011

Extracted contents:
header:          00 ff ff ff ff ff ff 00
serial number:   52 62 08 01 01 01 01 01 ff 14
version:         01 03
basic params:    80 46 27 78 0a
chroma info:     46 3d a1 55 49 99 25 0e 47 4a
established:     00 00 00
standard:        01 01 01 01 01 01 01 01 01 01 01 01 01 01 01 01
descriptor 1:    02 3a 80 d0 72 38 2d 40 10 2c 45 80 ba 89 21 00 00 1e
descriptor 2:    01 1d 80 d0 72 1c 16 20 10 2c 25 80 ba 89 21 00 00 9e
descriptor 3:    00 00 00 fc 00 54 4f 53 48 49 42 41 2d 54 56 0a 20 20
descriptor 4:    00 00 00 fd 00 31 4c 0f 51 0e 00 0a 20 20 20 20 20 20
extensions:      01
checksum:        7b

EDID version: 1.3
Manufacturer: TSB Model 108 Serial Number --
Digital display
Maximum image size: 70 cm x 39 cm
Gamma: 2.20
RGB color display
First detailed timing is preferred timing
Display x,y Chromaticity:
  Red:   0.6298, 0.3320
  Green: 0.2861, 0.5996
  Blue:  0.1445, 0.0576
  White: 0.2802, 0.2900
Established timings supported:
Standard timings supported:
Detailed mode: Clock 148.500 MHz, 698 mm x 393 mm
               1920 2448 2492 2640 hborder 0
               1080 1084 1089 1125 vborder 0
               +hsync +vsync 
               VertFreq: 50 Hz, HorFreq: 56250 Hz
Detailed mode: Clock 74.250 MHz, 698 mm x 393 mm
               1920 2448 2492 2640 hborder 0
                540  542  547  562 vborder 0
               +hsync +vsync interlaced 
               VertFreq: 50 Hz, HorFreq: 28125 Hz
Monitor name: TOSHIBA-TV
Monitor ranges (GTF): 49-76Hz V, 15-81kHz H, max dotclock 140MHz
Has 1 extension blocks
Checksum: 0x7b (valid)

CTA extension block
Extension version: 3
35 bytes of CTA data
  Video data block
    VIC  31 1920x1080@50Hz 16:9  HorFreq: 56250 Hz Clock: 148.500 MHz
    VIC  33 1920x1080@25Hz 16:9  HorFreq: 28125 Hz Clock: 74.250 MHz
    VIC  20 1920x1080i@50Hz 16:9  HorFreq: 28125 Hz Clock: 74.250 MHz
    VIC  19 1280x720@50Hz 16:9  HorFreq: 37500 Hz Clock: 74.250 MHz
    VIC  18 720x576@50Hz 16:9  HorFreq: 31250 Hz Clock: 27.000 MHz
    VIC  22 1440x576i@50Hz 16:9  HorFreq: 15625 Hz Clock: 27.000 MHz
    VIC  17 720x576@50Hz 4:3  HorFreq: 31250 Hz Clock: 27.000 MHz
    VIC  21 1440x576i@50Hz 4:3  HorFreq: 15625 Hz Clock: 27.000 MHz
    VIC  16 1920x1080@60Hz 16:9  HorFreq: 67500 Hz Clock: 148.500 MHz
    VIC   5 1920x1080i@60Hz 16:9  HorFreq: 33750 Hz Clock: 74.250 MHz
    VIC   4 1280x720@60Hz 16:9  HorFreq: 45000 Hz Clock: 74.250 MHz
    VIC   3 720x480@60Hz 16:9  HorFreq: 31469 Hz Clock: 27.000 MHz
    VIC   7 1440x480i@60Hz 16:9  HorFreq: 15734 Hz Clock: 27.000 MHz
    VIC   2 720x480@60Hz 4:3  HorFreq: 31469 Hz Clock: 27.000 MHz
    VIC   6 1440x480i@60Hz 4:3  HorFreq: 15734 Hz Clock: 27.000 MHz
    VIC   1 640x480@60Hz 4:3  HorFreq: 31469 Hz Clock: 25.175 MHz
    VIC  32 1920x1080@24Hz 16:9  HorFreq: 27000 Hz Clock: 74.250 MHz
  Audio data block
    Linear PCM, max channels 2
      Supported sample rates (kHz): 48 44.1 32
      Supported sample sizes (bits): 24 20 16
  Vendor-specific data block, OUI 000c03 (HDMI)
    Source physical address 2.0.0.0
    Maximum TMDS clock: 150MHz
    Video latency: 21
    Audio latency: 21
    Interlaced video latency: 31
    Interlaced audio latency: 31
Basic audio support
Supports YCbCr 4:4:4
Supports YCbCr 4:2:2
0 native detailed modes
Detailed mode: Clock 74.250 MHz, 698 mm x 393 mm
               1280 1720 1760 1980 hborder 0
                720  725  730  750 vborder 0
               +hsync +vsync 
               VertFreq: 50 Hz, HorFreq: 37500 Hz
Detailed mode: Clock 148.500 MHz, 698 mm x 393 mm
               1920 2008 2052 2200 hborder 0
               1080 1084 1089 1125 vborder 0
               +hsync +vsync 
               VertFreq: 60 Hz, HorFreq: 67500 Hz
Detailed mode: Clock 74.250 MHz, 698 mm x 393 mm
               1920 2008 2052 2200 hborder 0
                540  542  547  562 vborder 0
               +hsync +vsync interlaced 
               VertFreq: 60 Hz, HorFreq: 33750 Hz
Detailed mode: Clock 74.250 MHz, 698 mm x 393 mm
               1280 1390 1430 1650 hborder 0
                720  725  730  750 vborder 0
               +hsync +vsync 
               VertFreq: 60 Hz, HorFreq: 45000 Hz
Checksum: 0x11 (valid)

One or more of the timings is out of range of the Monitor Ranges:
  Vertical Freq: 24 - 60 Hz
  Horizontal Freq: 15625 - 67500 Hz
  Maximum Clock: 148.500 MHz
EDID block does not conform at all!
	Bad year of manufacture
	Bad week of manufacture
