
EDID (hex):
00ffffffffffff001e6d3d7601010101
0713010401462778ead9b0a357499c25
11494ba56e00314045406140d1c00101
0101010101011b2150a051001e304888
3500bc862100001c263680a070381f40
50208500bc8621000018000000fc0033
324c47333530300a20202020000000fd
003c4b1d430e000a202020202020001c

edid-decode (hex):

00 ff ff ff ff ff ff 00 1e 6d 3d 76 01 01 01 01
07 13 01 04 01 46 27 78 ea d9 b0 a3 57 49 9c 25
11 49 4b a5 6e 00 31 40 45 40 61 40 d1 c0 01 01
01 01 01 01 01 01 1b 21 50 a0 51 00 1e 30 48 88
35 00 bc 86 21 00 00 1c 26 36 80 a0 70 38 1f 40
50 20 85 00 bc 86 21 00 00 18 00 00 00 fc 00 33
32 4c 47 33 35 30 30 0a 20 20 20 20 00 00 00 fd
00 3c 4b 1d 43 0e 00 0a 20 20 20 20 20 20 00 1c

----------------

Block 0, Base EDID:
  EDID Structure Version & Revision: 1.4
  Vendor & Product Identification:
    Manufacturer: GSM
    Model: 30269
    Serial Number: 16843009
    Made in: week 7 of 2009
  Basic Display Parameters & Features:
    Analog display
    Signal Level Standard: 0.700 : 0.300 : 1.000 V p-p
    Blank level equals black level
    Sync: Serration
    Maximum image size: 70 cm x 39 cm
    Gamma: 2.20
    DPMS levels: Standby Suspend Off
    RGB color display
    First detailed timing includes the native pixel format and preferred refresh rate
  Color Characteristics:
    Red  : 0.6396, 0.3408
    Green: 0.2871, 0.6103
    Blue : 0.1464, 0.0693
    White: 0.2851, 0.2929
  Established Timings I & II:
    IBM     :   720x400    70.081663 Hz   9:5     31.467 kHz     28.320000 MHz
    DMT 0x04:   640x480    59.940476 Hz   4:3     31.469 kHz     25.175000 MHz
    DMT 0x06:   640x480    75.000000 Hz   4:3     37.500 kHz     31.500000 MHz
    DMT 0x09:   800x600    60.316541 Hz   4:3     37.879 kHz     40.000000 MHz
    DMT 0x0b:   800x600    75.000000 Hz   4:3     46.875 kHz     49.500000 MHz
    Apple   :   832x624    74.551266 Hz   4:3     49.726 kHz     57.284000 MHz
    DMT 0x10:  1024x768    60.003840 Hz   4:3     48.363 kHz     65.000000 MHz
    DMT 0x11:  1024x768    70.069359 Hz   4:3     56.476 kHz     75.000000 MHz
    DMT 0x12:  1024x768    75.028582 Hz   4:3     60.023 kHz     78.750000 MHz
  Standard Timings:
    DMT 0x04:   640x480    59.940476 Hz   4:3     31.469 kHz     25.175000 MHz
    DMT 0x09:   800x600    60.316541 Hz   4:3     37.879 kHz     40.000000 MHz
    DMT 0x10:  1024x768    60.003840 Hz   4:3     48.363 kHz     65.000000 MHz
    DMT 0x52:  1920x1080   60.000000 Hz  16:9     67.500 kHz    148.500000 MHz
  Detailed Timing Descriptors:
    DTD 1:  1360x768    59.798991 Hz  85:48    47.720 kHz     84.750000 MHz (700 mm x 390 mm)
                 Hfront   72 Hsync 136 Hback  208 Hpol N
                 Vfront    3 Vsync   5 Vback   22 Vpol P
    DTD 2:  1920x1080   59.985806 Hz  16:9     66.644 kHz    138.620000 MHz (700 mm x 390 mm)
                 Hfront   80 Hsync  32 Hback   48 Hpol N
                 Vfront    8 Vsync   5 Vback   18 Vpol N
    Display Product Name: '32LG3500'
    Display Range Limits:
      Monitor ranges (GTF): 60-75 Hz V, 29-67 kHz H, max dotclock 140 MHz
Checksum: 0x1c
