edid-decode (hex):

00 ff ff ff ff ff ff 00 1e f9 af 06 b4 57 00 00
03 11 01 03 08 25 15 78 2a 5e 95 a7 53 4c 98 24
14 50 54 bf ef 00 31 ca 81 80 01 01 01 01 01 01
01 01 01 01 01 01 1a 1d 00 80 51 d0 1c 20 40 80
35 00 75 d1 10 00 00 1c 00 00 00 fd 00 38 4c 1e
51 0e 00 0a 20 20 20 20 20 20 00 00 00 fc 00 46
50 44 31 37 37 35 57 0a 20 20 20 20 00 00 00 ff
00 4d 47 4d 37 31 37 30 50 32 32 34 35 32 00 04

00 ff ff ff ff ff ff 00 1e f9 af 06 b4 57 00 00
03 11 01 03 08 25 15 78 2a 5e 95 a7 53 4c 98 24
14 50 54 bf ef 00 31 ca 81 80 01 01 01 01 01 01
01 01 01 01 01 01 1a 1d 00 80 51 d0 1c 20 40 80
35 00 75 d1 10 00 00 1c 00 00 00 fd 00 38 4c 1e
51 0e 00 0a 20 20 20 20 20 20 00 00 00 fc 00 46
50 44 31 37 37 35 57 0a 20 20 20 20 00 00 00 ff
00 4d 47 4d 37 31 37 30 50 32 32 34 35 32 00 04

----------------

Block 0, Base EDID:
  EDID Structure Version & Revision: 1.3
  Vendor & Product Identification:
    Manufacturer: GWY
    Model: 1711
    Serial Number: ...
    Made in: week 3 of 2007
  Basic Display Parameters & Features:
    Analog display
    Signal Level Standard: 0.700 : 0.300 : 1.000 V p-p
    Blank level equals black level
    Sync: Separate
    Maximum image size: 37 cm x 21 cm
    Gamma: 2.20
    DPMS levels: Off
    RGB color display
    First detailed timing is the preferred timing
  Color Characteristics:
    Red  : 0.6533, 0.3251
    Green: 0.2998, 0.5957
    Blue : 0.1425, 0.0791
    White: 0.3134, 0.3291
  Established Timings I & II:
    IBM     :   720x400    70.081663 Hz   9:5     31.467 kHz     28.320000 MHz
    DMT 0x04:   640x480    59.940476 Hz   4:3     31.469 kHz     25.175000 MHz
    Apple   :   640x480    66.666667 Hz   4:3     35.000 kHz     30.240000 MHz
    DMT 0x05:   640x480    72.808802 Hz   4:3     37.861 kHz     31.500000 MHz
    DMT 0x06:   640x480    75.000000 Hz   4:3     37.500 kHz     31.500000 MHz
    DMT 0x08:   800x600    56.250000 Hz   4:3     35.156 kHz     36.000000 MHz
    DMT 0x09:   800x600    60.316541 Hz   4:3     37.879 kHz     40.000000 MHz
    DMT 0x0a:   800x600    72.187572 Hz   4:3     48.077 kHz     50.000000 MHz
    DMT 0x0b:   800x600    75.000000 Hz   4:3     46.875 kHz     49.500000 MHz
    Apple   :   832x624    74.551266 Hz   4:3     49.726 kHz     57.284000 MHz
    DMT 0x10:  1024x768    60.003840 Hz   4:3     48.363 kHz     65.000000 MHz
    DMT 0x11:  1024x768    70.069359 Hz   4:3     56.476 kHz     75.000000 MHz
    DMT 0x12:  1024x768    75.028582 Hz   4:3     60.023 kHz     78.750000 MHz
    DMT 0x24:  1280x1024   75.024675 Hz   5:4     79.976 kHz    135.000000 MHz
  Standard Timings:
    GTF     :   640x360    70.000000 Hz  16:9     26.250 kHz     20.580000 MHz
    DMT 0x23:  1280x1024   60.019740 Hz   5:4     63.981 kHz    108.000000 MHz
  Detailed Timing Descriptors:
    DTD 1:  1280x720    59.855126 Hz  16:9     44.772 kHz     74.500000 MHz (373 mm x 209 mm)
                 Hfront   64 Hsync 128 Hback  192 Hpol N
                 Vfront    3 Vsync   5 Vback   20 Vpol P
    Display Range Limits:
      Monitor ranges (GTF): 56-76 Hz V, 30-81 kHz H, max dotclock 140 MHz
    Display Product Name: 'FPD1775W'
    Display Product Serial Number: ...
Checksum: 0x04

----------------

Block 1, Unknown EDID Extension Block 0x00:
  00 ff ff ff ff ff ff 00 1e f9 af 06 b4 57 00 00 '.............W..'
  03 11 01 03 08 25 15 78 2a 5e 95 a7 53 4c 98 24 '.....%.x*^..SL.$'
  14 50 54 bf ef 00 31 ca 81 80 01 01 01 01 01 01 '.PT...1.........'
  01 01 01 01 01 01 1a 1d 00 80 51 d0 1c 20 40 80 '..........Q.. @.'
  35 00 75 d1 10 00 00 1c 00 00 00 fd 00 38 4c 1e '5.u..........8L.'
  51 0e 00 0a 20 20 20 20 20 20 00 00 00 fc 00 46 'Q...      .....F'
  50 44 31 37 37 35 57 0a 20 20 20 20 00 00 00 ff 'PD1775W.    ....'
  00 4d 47 4d 37 31 37 30 50 32 32 34 35 32 00 04 '.MGM7170P22452..'
Checksum: 0x04

----------------

Failures:

Block 1, Base EDID:
  Unknown Extension Block.
EDID:
  Base EDID: Some timings are out of range of the Monitor Ranges:
    Horizontal Freq: 26.250 - 79.976 kHz (Monitor: 30.000 - 81.000 kHz)
  Base EDID: EDID specified 0 extension block(s), but found 1 extension block(s).

EDID conformity: FAIL
