edid-decode (hex):

00 ff ff ff ff ff ff 00 30 64 ea 58 01 01 01 01
10 11 01 03 80 1a 10 78 0a 87 ae 99 57 4f 8c 26
22 50 54 00 00 00 81 00 01 01 01 01 01 01 01 01
01 01 01 01 01 01 ee 1a 00 80 50 20 10 30 10 30
13 00 05 a3 10 00 00 18 00 00 00 fd 00 3b 3d 2f
33 08 00 0a 20 20 20 20 20 20 00 00 00 fc 00 4c
54 44 31 32 31 45 58 50 4b 0a 20 20 00 00 00 ff
00 50 42 52 37 44 31 30 33 34 39 38 0a 20 00 a5

00 ff ff ff ff ff ff 00 30 64 ea 58 01 01 01 01
10 11 01 03 80 1a 10 78 0a 87 ae 99 57 4f 8c 26
22 50 54 00 00 00 81 00 01 01 01 01 01 01 01 01
01 01 01 01 01 01 ee 1a 00 80 50 20 10 30 10 30
13 00 05 a3 10 00 00 18 00 00 00 fd 00 3b 3d 2f
33 08 00 0a 20 20 20 20 20 20 00 00 00 fc 00 4c
54 44 31 32 31 45 58 50 4b 0a 20 20 00 00 00 ff
00 50 42 52 37 44 31 30 33 34 39 38 0a 20 00 a5

----------------

Block 0, Base EDID:
  EDID Structure Version & Revision: 1.3
  Vendor & Product Identification:
    Manufacturer: LCD
    Model: 22762
    Serial Number: ...
    Made in: week 16 of 2007
  Basic Display Parameters & Features:
    Digital display
    Maximum image size: 26 cm x 16 cm
    Gamma: 2.20
    RGB color display
    First detailed timing is the preferred timing
  Color Characteristics:
    Red  : 0.5996, 0.3398
    Green: 0.3095, 0.5498
    Blue : 0.1503, 0.1347
    White: 0.3154, 0.3300
  Established Timings I & II: none
  Standard Timings:
    DMT 0x1c:  1280x800    59.810326 Hz  16:10    49.702 kHz     83.500000 MHz
  Detailed Timing Descriptors:
    DTD 1:  1280x800    60.003760 Hz  16:10    48.963 kHz     68.940000 MHz (261 mm x 163 mm)
                 Hfront   16 Hsync  48 Hback   64 Hpol N
                 Vfront    1 Vsync   3 Vback   12 Vpol N
    Display Range Limits:
      Monitor ranges (GTF): 59-61 Hz V, 47-51 kHz H, max dotclock 80 MHz
    Display Product Name: 'LTD121EXPK'
    Display Product Serial Number: ...
Checksum: 0xa5

----------------

Block 1, Unknown EDID Extension Block 0x00:
  00 ff ff ff ff ff ff 00 30 64 ea 58 01 01 01 01 '........0d.X....'
  10 11 01 03 80 1a 10 78 0a 87 ae 99 57 4f 8c 26 '.......x....WO.&'
  22 50 54 00 00 00 81 00 01 01 01 01 01 01 01 01 '"PT.............'
  01 01 01 01 01 01 ee 1a 00 80 50 20 10 30 10 30 '..........P .0.0'
  13 00 05 a3 10 00 00 18 00 00 00 fd 00 3b 3d 2f '.............;=/'
  33 08 00 0a 20 20 20 20 20 20 00 00 00 fc 00 4c '3...      .....L'
  54 44 31 32 31 45 58 50 4b 0a 20 20 00 00 00 ff 'TD121EXPK.  ....'
  00 50 42 52 37 44 31 30 33 34 39 38 0a 20 00 a5 '.PBR7D103498. ..'
Checksum: 0xa5

----------------

Warnings:

EDID:
  Base EDID: Some timings are out of range of the Monitor Ranges:
    Maximum Clock: 83.500 MHz (Monitor: 80.000 MHz)
    Could be due to a Monitor Range off-by-one rounding issue

Failures:

Block 1, Base EDID:
  Unknown Extension Block.
EDID:
  Base EDID: EDID specified 0 extension block(s), but found 1 extension block(s).

EDID conformity: FAIL
