edid-decode (hex):

00 ff ff ff ff ff ff 00 53 04 00 00 38 56 4c 05
00 3a 01 04 68 00 00 ff ea bb b9 a3 52 46 98 24
0f 48 4c a3 0c 01 01 01 01 01 01 01 01 01 01 01
01 01 01 01 01 01 d0 20 00 98 51 20 1e 30 d0 80
47 04 00 00 00 00 00 1c 48 26 00 98 51 20 1e 30
d0 80 47 04 68 22 11 00 00 1c 00 00 00 10 00 20
1e 30 d0 80 47 04 68 22 11 00 00 1c 00 00 00 fc
00 56 47 41 0a 20 20 20 20 20 20 20 20 20 00 89

----------------

Block 0, Base EDID:
  EDID Structure Version & Revision: 1.4
  Vendor & Product Identification:
    Manufacturer: TXD
    Model: 0
    Serial Number: ...
    Made in: 2048
  Basic Display Parameters & Features:
    Analog display
    Input voltage level: 0.7/0.7 V
    Blank level equals black level
    Sync: Separate
    Image size is variable
    Gamma is defined in an extension block
    DPMS levels: Standby Suspend Off
    RGB color display
    First detailed timing includes the native pixel format and preferred refresh rate
  Color Characteristics:
    Red  : 0.6386, 0.3232
    Green: 0.2753, 0.5966
    Blue : 0.1425, 0.0615
    White: 0.2832, 0.2978
  Established Timings I & II:
    IBM     :   720x400    70.081663 Hz   9:5     31.467 kHz     28.320000 MHz
    DMT 0x04:   640x480    59.940476 Hz   4:3     31.469 kHz     25.175000 MHz
    DMT 0x08:   800x600    56.250000 Hz   4:3     35.156 kHz     36.000000 MHz
    DMT 0x09:   800x600    60.316541 Hz   4:3     37.879 kHz     40.000000 MHz
    DMT 0x10:  1024x768    60.003840 Hz   4:3     48.363 kHz     65.000000 MHz
    DMT 0x11:  1024x768    70.069359 Hz   4:3     56.476 kHz     75.000000 MHz
  Standard Timings: none
  Detailed Timing Descriptors:
    DTD 1:  1280x800    59.955462 Hz   8:5     49.763 kHz     84.000000 MHz
                 Hfront  208 Hsync 128 Hback   72 Hpol N
                 Vfront   20 Vsync   7 Vback    3 Vpol P
    DTD 2:  1280x800    69.948039 Hz   8:5     58.057 kHz     98.000000 MHz (360 mm x 290 mm)
                 Hfront  208 Hsync 128 Hback   72 Hpol N
                 Vfront   20 Vsync   7 Vback    3 Vpol P
    Dummy Descriptor:
    Display Product Name: 'VGA'
Checksum: 0x89

----------------

Failures:

Block 0, Base EDID:
  Vendor & Product Identification: The year 2048 is more than one year in the future.
  Dummy Descriptor: Dummy block filled with garbage.
EDID:
  Base EDID: The DTD image sizes all fit inside 255x255cm, but no display size was set.

EDID conformity: FAIL
