edid-decode (hex):

00 ff ff ff ff ff ff 00 53 04 00 00 96 11 12 09
00 3a 01 03 00 00 00 78 2a c9 05 a3 57 4b 9c 25
12 50 54 af cf 00 81 8a 81 80 01 01 01 01 01 01
01 01 01 01 01 01 cc 29 a0 d0 51 84 22 30 50 98
36 00 00 00 00 00 00 1c 00 00 00 10 00 31 35 34
57 4d 53 30 39 31 32 31 31 39 00 00 00 fd 00 38
4b 26 51 0e 00 0a 20 20 20 20 20 20 00 00 00 fc
00 56 47 41 0a 20 20 20 20 20 20 20 20 20 00 4c

----------------

Block 0, Base EDID:
  EDID Structure Version & Revision: 1.3
  Vendor & Product Identification:
    Manufacturer: TXD
    Model: 0
    Serial Number: ...
    Made in: 2048
  Basic Display Parameters & Features:
    Analog display
    Input voltage level: 0.7/0.3 V
    Blank level equals black level
    Image size is variable
    Gamma: 2.20
    DPMS levels: Off
    RGB color display
    First detailed timing is the preferred timing
  Color Characteristics:
    Red  : 0.6396, 0.3398
    Green: 0.2949, 0.6103
    Blue : 0.1445, 0.0703
    White: 0.3134, 0.3291
  Established Timings I & II:
    IBM     :   720x400    70.081663 Hz   9:5     31.467 kHz     28.320000 MHz
    DMT 0x04:   640x480    59.940476 Hz   4:3     31.469 kHz     25.175000 MHz
    DMT 0x05:   640x480    72.808802 Hz   4:3     37.861 kHz     31.500000 MHz
    DMT 0x06:   640x480    75.000000 Hz   4:3     37.500 kHz     31.500000 MHz
    DMT 0x08:   800x600    56.250000 Hz   4:3     35.156 kHz     36.000000 MHz
    DMT 0x09:   800x600    60.316541 Hz   4:3     37.879 kHz     40.000000 MHz
    DMT 0x0a:   800x600    72.187572 Hz   4:3     48.077 kHz     50.000000 MHz
    DMT 0x0b:   800x600    75.000000 Hz   4:3     46.875 kHz     49.500000 MHz
    DMT 0x10:  1024x768    60.003840 Hz   4:3     48.363 kHz     65.000000 MHz
    DMT 0x11:  1024x768    70.069359 Hz   4:3     56.476 kHz     75.000000 MHz
    DMT 0x12:  1024x768    75.028582 Hz   4:3     60.023 kHz     78.750000 MHz
    DMT 0x24:  1280x1024   75.024675 Hz   5:4     79.976 kHz    135.000000 MHz
  Standard Timings:
    GTF     :  1280x1024   69.999805 Hz   5:4     74.620 kHz    128.943000 MHz
    DMT 0x23:  1280x1024   60.019740 Hz   5:4     63.981 kHz    108.000000 MHz
  Detailed Timing Descriptors:
    DTD 1:  1440x900    60.168607 Hz   8:5     56.197 kHz    107.000000 MHz
                 Hfront   80 Hsync 152 Hback  232 Hpol N
                 Vfront    3 Vsync   6 Vback   25 Vpol P
    Dummy Descriptor:
    Display Range Limits:
      Monitor ranges (GTF): 56-75 Hz V, 38-81 kHz H, max dotclock 140 MHz
    Display Product Name: 'VGA'
Checksum: 0x4c

----------------

Failures:

Block 0, Base EDID:
  Vendor & Product Identification: The year 2048 is more than one year in the future.
  Dummy Descriptor: Dummy block filled with garbage.
EDID:
  Base EDID: Some timings are out of range of the Monitor Ranges:
    Horizontal Freq: 31.466 - 79.976 kHz (Monitor: 38.000 - 81.000 kHz)

EDID conformity: FAIL
