
EDID (hex):
00ffffffffffff00410c3e095d0a0000
251d0104a55021783a3ec5ad4f47a326
125054bfef00d1c0b3009500818081c0
316845686168e77c70a0d0a029503020
3a001d4e3100001a4ed470a0d0a04650
30403a001d4e3100001c000000fc0050
484c203334364231430a2020000000fd
0017641ea03c010a202020202020014e
020322f14d0103051404131f12021190
595a230907078301000067030c001000
0078d8590060a3382840a0103a101d4e
3100001a507800a0a038354030203a00
1d4e3100001e023a801871382d40582c
45001d4e3100001efe5b80a070383540
302035001d4e3100001eef51b87062a0
355080b83a001d4e3100001c0000004c

Extracted contents:
header:          00 ff ff ff ff ff ff 00
serial number:   41 0c 3e 09 5d 0a 00 00 25 1d
version:         01 04
basic params:    a5 50 21 78 3a
chroma info:     3e c5 ad 4f 47 a3 26 12 50 54
established:     bf ef 00
standard:        d1 c0 b3 00 95 00 81 80 81 c0 31 68 45 68 61 68
descriptor 1:    e7 7c 70 a0 d0 a0 29 50 30 20 3a 00 1d 4e 31 00 00 1a
descriptor 2:    4e d4 70 a0 d0 a0 46 50 30 40 3a 00 1d 4e 31 00 00 1c
descriptor 3:    00 00 00 fc 00 50 48 4c 20 33 34 36 42 31 43 0a 20 20
descriptor 4:    00 00 00 fd 00 17 64 1e a0 3c 01 0a 20 20 20 20 20 20
extensions:      01
checksum:        4e

EDID version: 1.4
Manufacturer: PHL Model 93e Serial Number --
Made in week 37 of 2019
Digital display
8 bits per primary color channel
DisplayPort interface
Maximum image size: 80 cm x 33 cm
Gamma: 2.20
DPMS levels: Off
Supported color formats: RGB 4:4:4, YCrCb 4:4:4, YCrCb 4:2:2
First detailed timing includes the native pixel format and preferred refresh rate
Display x,y Chromaticity:
  Red:   0.6757, 0.3115
  Green: 0.2802, 0.6386
  Blue:  0.1513, 0.0703
  White: 0.3134, 0.3291
Established timings supported:
  720x400@70Hz 9:5 HorFreq: 31469 Hz Clock: 28.320 MHz
  640x480@60Hz 4:3 HorFreq: 31469 Hz Clock: 25.175 MHz
  640x480@67Hz 4:3 HorFreq: 35000 Hz Clock: 30.240 MHz
  640x480@72Hz 4:3 HorFreq: 37900 Hz Clock: 31.500 MHz
  640x480@75Hz 4:3 HorFreq: 37500 Hz Clock: 31.500 MHz
  800x600@56Hz 4:3 HorFreq: 35200 Hz Clock: 36.000 MHz
  800x600@60Hz 4:3 HorFreq: 37900 Hz Clock: 40.000 MHz
  800x600@72Hz 4:3 HorFreq: 48100 Hz Clock: 50.000 MHz
  800x600@75Hz 4:3 HorFreq: 46900 Hz Clock: 49.500 MHz
  832x624@75Hz 4:3 HorFreq: 49726 Hz Clock: 57.284 MHz
  1024x768@60Hz 4:3 HorFreq: 48400 Hz Clock: 65.000 MHz
  1024x768@70Hz 4:3 HorFreq: 56500 Hz Clock: 75.000 MHz
  1024x768@75Hz 4:3 HorFreq: 60000 Hz Clock: 78.750 MHz
  1280x1024@75Hz 5:4 HorFreq: 80000 Hz Clock: 135.000 MHz
Standard timings supported:
  1920x1080@60Hz 16:9
  1680x1050@60Hz 16:10 HorFreq: 64700 Hz Clock: 119.000 MHz
  1440x900@60Hz 16:10 HorFreq: 55500 Hz Clock: 88.750 MHz
  1280x1024@60Hz 5:4 HorFreq: 64000 Hz Clock: 108.000 MHz
  1280x720@60Hz 16:9
  640x480@100Hz 4:3
  800x600@100Hz 4:3
  1024x768@100Hz 4:3
Detailed mode: Clock 319.750 MHz, 797 mm x 334 mm
               3440 3488 3520 3600 hborder 0
               1440 1443 1453 1481 vborder 0
               +hsync -vsync 
               VertFreq: 59 Hz, HorFreq: 88819 Hz
Detailed mode: Clock 543.500 MHz, 797 mm x 334 mm
               3440 3488 3552 3600 hborder 0
               1440 1443 1453 1510 vborder 0
               -hsync +vsync 
               VertFreq: 99 Hz, HorFreq: 150972 Hz
Monitor name: PHL 346B1C
Monitor ranges (bare limits): 23-100Hz V, 30-160kHz H, max dotclock 600MHz
Has 1 extension blocks
Checksum: 0x4e (valid)

CTA extension block
Extension version: 3
30 bytes of CTA data
  Video data block
    VIC   1 640x480@60Hz 4:3  HorFreq: 31469 Hz Clock: 25.175 MHz
    VIC   3 720x480@60Hz 16:9  HorFreq: 31469 Hz Clock: 27.000 MHz
    VIC   5 1920x1080i@60Hz 16:9  HorFreq: 33750 Hz Clock: 74.250 MHz
    VIC  20 1920x1080i@50Hz 16:9  HorFreq: 28125 Hz Clock: 74.250 MHz
    VIC   4 1280x720@60Hz 16:9  HorFreq: 45000 Hz Clock: 74.250 MHz
    VIC  19 1280x720@50Hz 16:9  HorFreq: 37500 Hz Clock: 74.250 MHz
    VIC  31 1920x1080@50Hz 16:9  HorFreq: 56250 Hz Clock: 148.500 MHz
    VIC  18 720x576@50Hz 16:9  HorFreq: 31250 Hz Clock: 27.000 MHz
    VIC   2 720x480@60Hz 4:3  HorFreq: 31469 Hz Clock: 27.000 MHz
    VIC  17 720x576@50Hz 4:3  HorFreq: 31250 Hz Clock: 27.000 MHz
    VIC  16 1920x1080@60Hz 16:9 (native) HorFreq: 67500 Hz Clock: 148.500 MHz
    VIC  89 2560x1080@50Hz 64:27  HorFreq: 56250 Hz Clock: 185.625 MHz
    VIC  90 2560x1080@60Hz 64:27  HorFreq: 66000 Hz Clock: 198.000 MHz
  Audio data block
    Linear PCM, max channels 2
      Supported sample rates (kHz): 48 44.1 32
      Supported sample sizes (bits): 24 20 16
  Speaker allocation data block
    Speaker map:
      FL/FR - Front Left/Right
  Vendor-specific data block, OUI 000c03 (HDMI)
    Source physical address 1.0.0.0
    Maximum TMDS clock: 600MHz
Underscans PC formats by default
Basic audio support
Supports YCbCr 4:4:4
Supports YCbCr 4:2:2
1 native detailed modes
Detailed mode: Clock 230.000 MHz, 797 mm x 334 mm
               2560 2720 2992 3424 hborder 0
               1080 1083 1093 1120 vborder 0
               +hsync -vsync 
               VertFreq: 59 Hz, HorFreq: 67172 Hz
Detailed mode: Clock 308.000 MHz, 797 mm x 334 mm
               2560 2608 2640 2720 hborder 0
               1080 1083 1093 1133 vborder 0
               +hsync +vsync 
               VertFreq: 99 Hz, HorFreq: 113235 Hz
Detailed mode: Clock 148.500 MHz, 797 mm x 334 mm
               1920 2008 2052 2200 hborder 0
               1080 1084 1089 1125 vborder 0
               +hsync +vsync 
               VertFreq: 60 Hz, HorFreq: 67500 Hz
Detailed mode: Clock 235.500 MHz, 797 mm x 334 mm
               1920 1968 2000 2080 hborder 0
               1080 1083 1088 1133 vborder 0
               +hsync +vsync 
               VertFreq: 99 Hz, HorFreq: 113221 Hz
Detailed mode: Clock 209.750 MHz, 797 mm x 334 mm
               1720 1848 2032 2344 hborder 0
               1440 1443 1453 1493 vborder 0
               -hsync +vsync 
               VertFreq: 59 Hz, HorFreq: 89483 Hz
Checksum: 0x4c (valid)

EDID block does NOT conform to EDID 1.4!
	HDMI VSDB Max TMDS rate is > 340
Warning: One or more of the timings is out of range of the Monitor Ranges:
  Vertical Freq: 50 - 100 Hz
  Horizontal Freq: 28125 - 150972 Hz
  Maximum Clock: 543.500 MHz


