edid-decode (hex):

00 ff ff ff ff ff ff 00 06 af 2d 10 00 00 00 00
00 19 01 04 95 1d 11 78 02 c3 14 93 58 59 92 29
22 51 57 00 00 00 01 01 01 01 01 01 01 01 01 01
01 01 01 01 01 01 14 37 80 b8 70 38 24 40 10 10
3e 00 25 a5 10 00 00 18 00 00 00 0f 00 00 00 00
00 00 00 00 00 00 00 00 00 20 00 00 00 fe 00 41
55 4f 0a 20 20 20 20 20 20 20 20 20 00 00 00 fe
00 42 31 33 33 48 41 4b 30 31 2e 30 20 0a 00 5a

00 ff ff ff ff ff ff 00 06 af 2d 10 00 00 00 00
00 19 01 04 95 1d 11 78 02 c3 14 93 58 59 92 29
22 51 57 00 00 00 01 01 01 01 01 01 01 01 01 01
01 01 01 01 01 01 14 37 80 b8 70 38 24 40 10 10
3e 00 25 a5 10 00 00 18 00 00 00 0f 00 00 00 00
00 00 00 00 00 00 00 00 00 20 00 00 00 fe 00 41
55 4f 0a 20 20 20 20 20 20 20 20 20 00 00 00 fe
00 42 31 33 33 48 41 4b 30 31 2e 30 20 0a 00 5a

----------------

Block 0, Base EDID:
  EDID Structure Version & Revision: 1.4
  Vendor & Product Identification:
    Manufacturer: AUO
    Model: 4141
    Made in: 2015
  Basic Display Parameters & Features:
    Digital display
    Bits per primary color channel: 6
    DisplayPort interface
    Maximum image size: 29 cm x 17 cm
    Gamma: 2.20
    Supported color formats: RGB 4:4:4
    First detailed timing includes the native pixel format and preferred refresh rate
  Color Characteristics:
    Red  : 0.5771, 0.3437
    Green: 0.3476, 0.5732
    Blue : 0.1601, 0.1337
    White: 0.3173, 0.3398
  Established Timings I & II: none
  Standard Timings: none
  Detailed Timing Descriptors:
    DTD 1:  1920x1080   60.049471 Hz  16:9     67.015 kHz    141.000000 MHz (293 mm x 165 mm)
                 Hfront   16 Hsync  16 Hback  152 Hpol N
                 Vfront    3 Vsync  14 Vback   19 Vpol N
    Manufacturer-Specified Display Descriptor (0x0f): 00 0f 00 00 00 00 00 00 00 00 00 00 00 00 00 20 '............... '
    Alphanumeric Data String: 'AUO'
    Alphanumeric Data String: 'B133HAK01.0 '
Checksum: 0x5a

----------------

Block 1, Unknown EDID Extension Block 0x00:
  00 ff ff ff ff ff ff 00 06 af 2d 10 00 00 00 00 '..........-.....'
  00 19 01 04 95 1d 11 78 02 c3 14 93 58 59 92 29 '.......x....XY.)'
  22 51 57 00 00 00 01 01 01 01 01 01 01 01 01 01 '"QW.............'
  01 01 01 01 01 01 14 37 80 b8 70 38 24 40 10 10 '.......7..p8$@..'
  3e 00 25 a5 10 00 00 18 00 00 00 0f 00 00 00 00 '>.%.............'
  00 00 00 00 00 00 00 00 00 20 00 00 00 fe 00 41 '......... .....A'
  55 4f 0a 20 20 20 20 20 20 20 20 20 00 00 00 fe 'UO.         ....'
  00 42 31 33 33 48 41 4b 30 31 2e 30 20 0a 00 5a '.B133HAK01.0 ..Z'
Checksum: 0x5a

----------------

Warnings:

Block 0, Base EDID:
  Missing Display Product Name.

Failures:

Block 0, Base EDID:
  Alphanumeric Data String: One or more trailing spaces.
Block 1, Base EDID:
  Unknown Extension Block.
EDID:
  Base EDID: EDID specified 0 extension block(s), but found 1 extension block(s).

EDID conformity: FAIL
