edid-decode (hex):

00 ff ff ff ff ff ff 00 32 0c 04 a1 00 00 00 00
00 11 01 02 80 25 17 78 0a 1c 85 9a 59 52 8d 28
24 50 54 00 00 00 01 01 01 01 01 01 01 01 01 01
01 01 01 01 01 01 95 25 a0 40 51 84 0c 30 40 20
13 00 6f e6 10 00 00 19 00 00 00 00 00 00 00 00
00 00 00 00 00 00 00 00 00 00 00 00 00 fe 00 4c
47 50 68 69 6c 69 70 73 4c 43 44 0a 00 00 00 fe
00 4c 50 31 37 31 57 50 34 2d 54 4c 4e 32 00 20

----------------

Block 0, Base EDID:
  EDID Structure Version & Revision: 1.2
  Vendor & Product Identification:
    Manufacturer: LPL
    Model: 41220
    Made in: 2007
  Basic Display Parameters & Features:
    Digital display
    Maximum image size: 37 cm x 23 cm
    Gamma: 2.20
    RGB color display
    First detailed timing is preferred timing
  Color Characteristics:
    Red  : 0.6015, 0.3486
    Green: 0.3232, 0.5507
    Blue : 0.1582, 0.1406
    White: 0.3134, 0.3291
  Established Timings I & II: none
  Standard Timings: none
  Detailed Timing Descriptors:
    DTD 1:  1440x900    59.939 Hz   8:5    54.665 kHz  96.210 MHz (367 mm x 230 mm)
                 Hfront   64 Hsync  32 Hback 224 Hpol N
                 Vfront    1 Vsync   3 Vback   8 Vpol N
    Empty Descriptor
    Alphanumeric Data String: 'LGPhilipsLCD'
    Alphanumeric Data String: 'LP171WP4-TLN2'
Checksum: 0x20

----------------

Warnings:

Block 0, Base EDID:
  EDID Structure Version & Revision: EDID 1.2 is deprecated, do not use.

Failures:

Block 0, Base EDID:
  Empty Descriptor: Use Dummy Descriptor instead of all zeroes.

EDID conformity: FAIL
