edid-decode (hex):

00 ff ff ff ff ff ff 00 10 ac 62 40 4c 30 33 33
1c 16 01 03 0e 40 28 78 ea 8d 85 ad 4f 35 b1 25
0e 50 54 a5 4b 00 71 4f 81 00 81 80 a9 40 d1 00
e1 c0 01 01 01 01 11 44 00 a0 80 00 25 50 30 20
36 00 81 91 21 00 00 1a 00 00 00 ff 00 50 48 35
4e 59 32 37 43 33 33 30 4c 0a 00 00 00 fc 00 44
45 4c 4c 20 55 33 30 31 31 0a 20 20 00 00 00 fd
00 31 56 1d 5e 15 00 0a 20 20 20 20 20 20 00 15

00 ff ff ff ff ff ff 00 10 ac 62 40 4c 30 33 33
1c 16 01 03 0e 40 28 78 ea 8d 85 ad 4f 35 b1 25
0e 50 54 a5 4b 00 71 4f 81 00 81 80 a9 40 d1 00
e1 c0 01 01 01 01 11 44 00 a0 80 00 25 50 30 20
36 00 81 91 21 00 00 1a 00 00 00 ff 00 50 48 35
4e 59 32 37 43 33 33 30 4c 0a 00 00 00 fc 00 44
45 4c 4c 20 55 33 30 31 31 0a 20 20 00 00 00 fd
00 31 56 1d 5e 15 00 0a 20 20 20 20 20 20 00 15

----------------

Block 0, Base EDID:
  EDID Structure Version & Revision: 1.3
  Vendor & Product Identification:
    Manufacturer: DEL
    Model: 16482
    Serial Number: ...
    Made in: week 28 of 2012
  Basic Display Parameters & Features:
    Analog display
    Signal Level Standard: 0.700 : 0.300 : 1.000 V p-p
    Blank level equals black level
    Sync: Separate Composite SyncOnGreen
    Maximum image size: 64 cm x 40 cm
    Gamma: 2.20
    DPMS levels: Standby Suspend Off
    RGB color display
    First detailed timing is the preferred timing
  Color Characteristics:
    Red  : 0.6777, 0.3085
    Green: 0.2099, 0.6923
    Blue : 0.1464, 0.0546
    White: 0.3134, 0.3291
  Established Timings I & II:
    IBM     :   720x400    70.081663 Hz   9:5     31.467 kHz     28.320000 MHz
    DMT 0x04:   640x480    59.940476 Hz   4:3     31.469 kHz     25.175000 MHz
    DMT 0x06:   640x480    75.000000 Hz   4:3     37.500 kHz     31.500000 MHz
    DMT 0x09:   800x600    60.316541 Hz   4:3     37.879 kHz     40.000000 MHz
    DMT 0x0b:   800x600    75.000000 Hz   4:3     46.875 kHz     49.500000 MHz
    DMT 0x10:  1024x768    60.003840 Hz   4:3     48.363 kHz     65.000000 MHz
    DMT 0x12:  1024x768    75.028582 Hz   4:3     60.023 kHz     78.750000 MHz
    DMT 0x24:  1280x1024   75.024675 Hz   5:4     79.976 kHz    135.000000 MHz
  Standard Timings:
    DMT 0x15:  1152x864    75.000000 Hz   4:3     67.500 kHz    108.000000 MHz
    DMT 0x1c:  1280x800    59.810326 Hz  16:10    49.702 kHz     83.500000 MHz
    DMT 0x23:  1280x1024   60.019740 Hz   5:4     63.981 kHz    108.000000 MHz
    DMT 0x33:  1600x1200   60.000000 Hz   4:3     75.000 kHz    162.000000 MHz
    DMT 0x45:  1920x1200   59.884600 Hz  16:10    74.556 kHz    193.250000 MHz
    DMT 0x54:  2048x1152   60.000000 Hz  16:9     72.000 kHz    162.000000 MHz (RB)
  Detailed Timing Descriptors:
    DTD 1:  2048x1280   59.922227 Hz  16:10    78.918 kHz    174.250000 MHz (641 mm x 401 mm)
                 Hfront   48 Hsync  32 Hback   80 Hpol P
                 Vfront    3 Vsync   6 Vback   28 Vpol N
    Display Product Serial Number: ...
    Display Product Name: 'DELL U3011'
    Display Range Limits:
      Monitor ranges (GTF): 49-86 Hz V, 29-94 kHz H, max dotclock 210 MHz
Checksum: 0x15

----------------

Block 1, Unknown EDID Extension Block 0x00:
  00 ff ff ff ff ff ff 00 10 ac 62 40 4c 30 33 33 '..........b@L033'
  1c 16 01 03 0e 40 28 78 ea 8d 85 ad 4f 35 b1 25 '.....@(x....O5.%'
  0e 50 54 a5 4b 00 71 4f 81 00 81 80 a9 40 d1 00 '.PT.K.qO.....@..'
  e1 c0 01 01 01 01 11 44 00 a0 80 00 25 50 30 20 '.......D....%P0 '
  36 00 81 91 21 00 00 1a 00 00 00 ff 00 50 48 35 '6...!........PH5'
  4e 59 32 37 43 33 33 30 4c 0a 00 00 00 fc 00 44 'NY27C330L......D'
  45 4c 4c 20 55 33 30 31 31 0a 20 20 00 00 00 fd 'ELL U3011.  ....'
  00 31 56 1d 5e 15 00 0a 20 20 20 20 20 20 00 15 '.1V.^...      ..'
Checksum: 0x15

----------------

Failures:

Block 1, Base EDID:
  Unknown Extension Block.
EDID:
  Base EDID: EDID specified 0 extension block(s), but found 1 extension block(s).

EDID conformity: FAIL
