
EDID (hex):
00ffffffffffff0011ee540001010101
001b0103807944780a23ada4544d9926
0f474abdef80714f81c0810081809500
a9c0b3000101023a801871382d40582c
4500c48e2100001e023a80d072382d40
102c4580c48e2100001e000000fc0044
454e4f4e2d4156520a202020000000fd
00184b0f873c000a2020202020200195

Extracted contents:
header:          00 ff ff ff ff ff ff 00
serial number:   11 ee 54 00 01 01 01 01 00 1b
version:         01 03
basic params:    80 79 44 78 0a
chroma info:     23 ad a4 54 4d 99 26 0f 47 4a
established:     bd ef 80
standard:        71 4f 81 c0 81 00 81 80 95 00 a9 c0 b3 00 01 01
descriptor 1:    02 3a 80 18 71 38 2d 40 58 2c 45 00 c4 8e 21 00 00 1e
descriptor 2:    02 3a 80 d0 72 38 2d 40 10 2c 45 80 c4 8e 21 00 00 1e
descriptor 3:    00 00 00 fc 00 44 45 4e 4f 4e 2d 41 56 52 0a 20 20 20
descriptor 4:    00 00 00 fd 00 18 4b 0f 87 3c 00 0a 20 20 20 20 20 20
extensions:      01
checksum:        95

EDID version: 1.3
Manufacturer: DON Model 54 Serial Number --
Made in year 2017
Digital display
Maximum image size: 121 cm x 68 cm
Gamma: 2.20
RGB color display
First detailed timing is preferred timing
Display x,y Chromaticity:
  Red:   0.6406, 0.3300
  Green: 0.3007, 0.6005
  Blue:  0.1503, 0.0605
  White: 0.2802, 0.2900
Established timings supported:
  720x400@70Hz 9:5 HorFreq: 31469 Hz Clock: 28.320 MHz
  640x480@60Hz 4:3 HorFreq: 31469 Hz Clock: 25.175 MHz
  640x480@67Hz 4:3 HorFreq: 35000 Hz Clock: 30.240 MHz
  640x480@72Hz 4:3 HorFreq: 37900 Hz Clock: 31.500 MHz
  640x480@75Hz 4:3 HorFreq: 37500 Hz Clock: 31.500 MHz
  800x600@60Hz 4:3 HorFreq: 37900 Hz Clock: 40.000 MHz
  800x600@72Hz 4:3 HorFreq: 48100 Hz Clock: 50.000 MHz
  800x600@75Hz 4:3 HorFreq: 46900 Hz Clock: 49.500 MHz
  832x624@75Hz 4:3 HorFreq: 49726 Hz Clock: 57.284 MHz
  1024x768@60Hz 4:3 HorFreq: 48400 Hz Clock: 65.000 MHz
  1024x768@70Hz 4:3 HorFreq: 56500 Hz Clock: 75.000 MHz
  1024x768@75Hz 4:3 HorFreq: 60000 Hz Clock: 78.750 MHz
  1280x1024@75Hz 5:4 HorFreq: 80000 Hz Clock: 135.000 MHz
  1152x870@75Hz 192:145 HorFreq: 67500 Hz Clock: 108.000 MHz
Standard timings supported:
  1152x864@75Hz 4:3 HorFreq: 67500 Hz Clock: 108.000 MHz
  1280x720@60Hz 16:9
  1280x800@60Hz 16:10
  1280x1024@60Hz 5:4 HorFreq: 64000 Hz Clock: 108.000 MHz
  1440x900@60Hz 16:10 HorFreq: 55500 Hz Clock: 88.750 MHz
  1600x900@60Hz 16:9
  1680x1050@60Hz 16:10 HorFreq: 64700 Hz Clock: 119.000 MHz
Detailed mode: Clock 148.500 MHz, 708 mm x 398 mm
               1920 2008 2052 2200 hborder 0
               1080 1084 1089 1125 vborder 0
               +hsync +vsync 
               VertFreq: 60 Hz, HorFreq: 67500 Hz
Detailed mode: Clock 148.500 MHz, 708 mm x 398 mm
               1920 2448 2492 2640 hborder 0
               1080 1084 1089 1125 vborder 0
               +hsync +vsync 
               VertFreq: 50 Hz, HorFreq: 56250 Hz
Monitor name: DENON-AVR
Monitor ranges (GTF): 24-75Hz V, 15-135kHz H, max dotclock 600MHz
Has 1 extension blocks
Checksum: 0x95 (valid)
