edid-decode (hex):

00 ff ff ff ff ff ff 00 22 f0 53 42 00 00 00 00
2d 18 01 01 80 33 1d 78 ee 3d 90 a2 56 54 a1 28
0a 50 54 00 00 00 01 01 01 01 01 01 01 01 01 01
01 01 01 01 01 01 98 34 80 64 70 38 1f 40 58 2c
45 00 fe 1f 11 00 00 00 00 00 00 fc 00 48 50 20
41 6c 6c 2d 69 6e 2d 4f 6e 65 00 00 00 fc 00 0a
20 20 20 20 20 20 20 20 20 20 20 20 00 00 00 fc
00 0a 20 20 20 20 20 20 20 20 20 20 20 20 00 68

----------------

Block 0, Base EDID:
  EDID Structure Version & Revision: 1.1
  Vendor & Product Identification:
    Manufacturer: HWP
    Model: 16979
    Made in: week 45 of 2014
  Basic Display Parameters & Features:
    Digital display
    Maximum image size: 51 cm x 29 cm
    Gamma: 2.20
    DPMS levels: Standby Suspend Off
    RGB color display
    Default (sRGB) color space is primary color space
    First detailed timing is the preferred timing
  Color Characteristics:
    Red  : 0.6328, 0.3388
    Green: 0.3310, 0.6298
    Blue : 0.1582, 0.0400
    White: 0.3125, 0.3281
  Established Timings I & II: none
  Standard Timings: none
  Detailed Timing Descriptors:
    DTD 1:  1920x1080   59.994 Hz  16:9    66.653 kHz 134.640 MHz (analog composite, sync-on-green, 510 mm x 287 mm)
                 Hfront   88 Hsync  44 Hback -32 Hpol N
                 Vfront    4 Vsync   5 Vback  22 Vpol N
    Display Product Name: 'HP All-in-One'
    Display Product Name: ''
    Display Product Name: ''
Checksum: 0x68

----------------

Warnings:

Block 0, Base EDID:
  EDID Structure Version & Revision: EDID 1.1 is deprecated, do not use.

Failures:

Block 0, Base EDID:
  Basic Display Parameters & Features: sRGB is signaled, but the chromaticities do not match.
  Detailed Timing Descriptor #1: 0 or negative horizontal back porch.
  Display Product Name: Empty string.
  Display Product Name: Empty string.

EDID conformity: FAIL
