
EDID (hex):
00ffffffffffff005c85022201010101
14100103e82f1e782ec585a459499a24
125054bfef0081808140714f9500950f
b30081c08bc021399030621a274068b0
3600d9281100001c000000ff00300a20
20202020202020202020000000fd0038
431e5210000a202020202020000000fc
004c434d2d323277320a2020202000de

Extracted contents:
header:          00 ff ff ff ff ff ff 00
serial number:   5c 85 02 22 01 01 01 01 14 10
version:         01 03
basic params:    e8 2f 1e 78 2e
chroma info:     c5 85 a4 59 49 9a 24 12 50 54
established:     bf ef 00
standard:        81 80 81 40 71 4f 95 00 95 0f b3 00 81 c0 8b c0
descriptor 1:    21 39 90 30 62 1a 27 40 68 b0 36 00 d9 28 11 00 00 1c
descriptor 2:    00 00 00 ff 00 30 0a 20 20 20 20 20 20 20 20 20 20 20
descriptor 3:    00 00 00 fd 00 38 43 1e 52 10 00 0a 20 20 20 20 20 20
descriptor 4:    00 00 00 fc 00 4c 43 4d 2d 32 32 77 32 0a 20 20 20 20
extensions:      00
checksum:        de

EDID version: 1.3
Manufacturer: WDE Model 2202 Serial Number --
Made in week 20 of 2006
Digital display
Maximum image size: 47 cm x 30 cm
Gamma: 2.20
DPMS levels: Off
RGB color display
Default (sRGB) color space is primary color space
First detailed timing is preferred timing
Display x,y Chromaticity:
  Red:   0.6435, 0.3476
  Green: 0.2861, 0.6025
  Blue:  0.1425, 0.0703
  White: 0.3134, 0.3291
Established timings supported:
  720x400@70Hz 9:5 HorFreq: 31469 Hz Clock: 28.320 MHz
  640x480@60Hz 4:3 HorFreq: 31469 Hz Clock: 25.175 MHz
  640x480@67Hz 4:3 HorFreq: 35000 Hz Clock: 30.240 MHz
  640x480@72Hz 4:3 HorFreq: 37900 Hz Clock: 31.500 MHz
  640x480@75Hz 4:3 HorFreq: 37500 Hz Clock: 31.500 MHz
  800x600@56Hz 4:3 HorFreq: 35200 Hz Clock: 36.000 MHz
  800x600@60Hz 4:3 HorFreq: 37900 Hz Clock: 40.000 MHz
  800x600@72Hz 4:3 HorFreq: 48100 Hz Clock: 50.000 MHz
  800x600@75Hz 4:3 HorFreq: 46900 Hz Clock: 49.500 MHz
  832x624@75Hz 4:3 HorFreq: 49726 Hz Clock: 57.284 MHz
  1024x768@60Hz 4:3 HorFreq: 48400 Hz Clock: 65.000 MHz
  1024x768@70Hz 4:3 HorFreq: 56500 Hz Clock: 75.000 MHz
  1024x768@75Hz 4:3 HorFreq: 60000 Hz Clock: 78.750 MHz
  1280x1024@75Hz 5:4 HorFreq: 80000 Hz Clock: 135.000 MHz
Standard timings supported:
  1280x1024@60Hz 5:4 HorFreq: 64000 Hz Clock: 108.000 MHz
  1280x960@60Hz 4:3 HorFreq: 60000 Hz Clock: 108.000 MHz
  1152x864@75Hz 4:3 HorFreq: 67500 Hz Clock: 108.000 MHz
  1440x900@60Hz 16:10 HorFreq: 55500 Hz Clock: 88.750 MHz
  1440x900@75Hz 16:10 HorFreq: 82300 Hz Clock: 156.000 MHz
  1680x1050@60Hz 16:10 HorFreq: 64700 Hz Clock: 119.000 MHz
  1280x720@60Hz 16:9
  1360x765@60Hz 16:9
Detailed mode: Clock 146.250 MHz, 473 mm x 296 mm
               1680 1784 1960 2240 hborder 0
               1050 1053 1059 1089 vborder 0
               -hsync +vsync 
               VertFreq: 59 Hz, HorFreq: 65290 Hz
Serial number: --
Monitor ranges (GTF): 56-67Hz V, 30-82kHz H, max dotclock 160MHz
Monitor name: LCM-22w2
Checksum: 0xde (valid)
EDID block does NOT conform to EDID 1.3!
	sRGB is signaled, but the chromaticities do not match
	Digital display field contains garbage: 68
One or more of the timings is out of range of the Monitor Ranges:
  Vertical Freq: 56 - 75 Hz
  Horizontal Freq: 31469 - 82300 Hz
  Maximum Clock: 156.000 MHz


