
EDID (hex):
00ffffffffffff005a631c2100000000
300f010318261e782efd56a5534a9d24
144f54bfef8081806159455931590101
010101010101302a009851002a403070
1300782d1100001e000000ff00505357
3035343830313339300a000000fd0032
551e520e000a202020202020000000fc
005641393032620a2020202020200076

Extracted contents:
header:          00 ff ff ff ff ff ff 00
serial number:   5a 63 1c 21 00 00 00 00 30 0f
version:         01 03
basic params:    18 26 1e 78 2e
chroma info:     fd 56 a5 53 4a 9d 24 14 4f 54
established:     bf ef 80
standard:        81 80 61 59 45 59 31 59 01 01 01 01 01 01 01 01
descriptor 1:    30 2a 00 98 51 00 2a 40 30 70 13 00 78 2d 11 00 00 1e
descriptor 2:    00 00 00 ff 00 50 53 57 30 35 34 38 30 31 33 39 30 0a
descriptor 3:    00 00 00 fd 00 32 55 1e 52 0e 00 0a 20 20 20 20 20 20
descriptor 4:    00 00 00 fc 00 56 41 39 30 32 62 0a 20 20 20 20 20 20
extensions:      00
checksum:        76

EDID version: 1.3
Manufacturer: VSC Model 211c Serial Number --
Analog display, Input voltage level: 0.7/0.3 V
Configurable signal levels
Sync: Separate 
Maximum image size: 38 cm x 30 cm
Gamma: 2.20
DPMS levels: Off
RGB color display
Default (sRGB) color space is primary color space
First detailed timing is preferred timing
Display x,y Chromaticity:
  Red:   0.6474, 0.3271
  Green: 0.2919, 0.6142
  Blue:  0.1416, 0.0791
  White: 0.3095, 0.3300
Established timings supported:
  720x400@70Hz 9:5 HorFreq: 31469 Hz Clock: 28.320 MHz
  640x480@60Hz 4:3 HorFreq: 31469 Hz Clock: 25.175 MHz
  640x480@67Hz 4:3 HorFreq: 35000 Hz Clock: 30.240 MHz
  640x480@72Hz 4:3 HorFreq: 37900 Hz Clock: 31.500 MHz
  640x480@75Hz 4:3 HorFreq: 37500 Hz Clock: 31.500 MHz
  800x600@56Hz 4:3 HorFreq: 35200 Hz Clock: 36.000 MHz
  800x600@60Hz 4:3 HorFreq: 37900 Hz Clock: 40.000 MHz
  800x600@72Hz 4:3 HorFreq: 48100 Hz Clock: 50.000 MHz
  800x600@75Hz 4:3 HorFreq: 46900 Hz Clock: 49.500 MHz
  832x624@75Hz 4:3 HorFreq: 49726 Hz Clock: 57.284 MHz
  1024x768@60Hz 4:3 HorFreq: 48400 Hz Clock: 65.000 MHz
  1024x768@70Hz 4:3 HorFreq: 56500 Hz Clock: 75.000 MHz
  1024x768@75Hz 4:3 HorFreq: 60000 Hz Clock: 78.750 MHz
  1280x1024@75Hz 5:4 HorFreq: 80000 Hz Clock: 135.000 MHz
  1152x870@75Hz 192:145 HorFreq: 67500 Hz Clock: 108.000 MHz
Standard timings supported:
  1280x1024@60Hz 5:4 HorFreq: 64000 Hz Clock: 108.000 MHz
  1024x768@85Hz 4:3 HorFreq: 68700 Hz Clock: 94.500 MHz
  800x600@85Hz 4:3 HorFreq: 53700 Hz Clock: 56.250 MHz
  640x480@85Hz 4:3 HorFreq: 43300 Hz Clock: 36.000 MHz
Detailed mode: Clock 108.000 MHz, 376 mm x 301 mm
               1280 1328 1440 1688 hborder 0
               1024 1025 1028 1066 vborder 0
               +hsync +vsync 
               VertFreq: 60 Hz, HorFreq: 63981 Hz
Serial number: --
Monitor ranges (GTF): 50-85Hz V, 30-82kHz H, max dotclock 140MHz
Monitor name: VA902b
Checksum: 0x76 (valid)
EDID block does NOT conform to EDID 1.3!
	sRGB is signaled, but the chromaticities do not match
EDID block does not conform at all!
	Bad year of manufacture
