
EDID (hex):
00ffffffffffff0022f0952601010101
1c110103802b1b78eed105a655479d25
155054adee808180b300b30f01010101
01010101010121399030621a274068b0
3600ae0e1100001c000000fd00324c18
5d10000a202020202020000000fc0048
50204c32303435770a202020000000ff
00435a54373238303235570a20200037

Extracted contents:
header:          00 ff ff ff ff ff ff 00
serial number:   22 f0 95 26 01 01 01 01 1c 11
version:         01 03
basic params:    80 2b 1b 78 ee
chroma info:     d1 05 a6 55 47 9d 25 15 50 54
established:     ad ee 80
standard:        81 80 b3 00 b3 0f 01 01 01 01 01 01 01 01 01 01
descriptor 1:    21 39 90 30 62 1a 27 40 68 b0 36 00 ae 0e 11 00 00 1c
descriptor 2:    00 00 00 fd 00 32 4c 18 5d 10 00 0a 20 20 20 20 20 20
descriptor 3:    00 00 00 fc 00 48 50 20 4c 32 30 34 35 77 0a 20 20 20
descriptor 4:    00 00 00 ff 00 43 5a 54 37 32 38 30 32 35 57 0a 20 20
extensions:      00
checksum:        37

EDID version: 1.3
Manufacturer: HWP Model 2695 Serial Number --
Made in week 28 of 2007
Digital display
Maximum image size: 43 cm x 27 cm
Gamma: 2.20
DPMS levels: Standby Suspend Off
RGB color display
Default (sRGB) color space is primary color space
First detailed timing is preferred timing
Display x,y Chromaticity:
  Red:   0.6513, 0.3330
  Green: 0.2773, 0.6142
  Blue:  0.1445, 0.0820
  White: 0.3134, 0.3291
Established timings supported:
  720x400@70Hz 9:5 HorFreq: 31469 Hz Clock: 28.320 MHz
  640x480@60Hz 4:3 HorFreq: 31469 Hz Clock: 25.175 MHz
  640x480@72Hz 4:3 HorFreq: 37900 Hz Clock: 31.500 MHz
  640x480@75Hz 4:3 HorFreq: 37500 Hz Clock: 31.500 MHz
  800x600@60Hz 4:3 HorFreq: 37900 Hz Clock: 40.000 MHz
  800x600@72Hz 4:3 HorFreq: 48100 Hz Clock: 50.000 MHz
  800x600@75Hz 4:3 HorFreq: 46900 Hz Clock: 49.500 MHz
  832x624@75Hz 4:3 HorFreq: 49726 Hz Clock: 57.284 MHz
  1024x768@60Hz 4:3 HorFreq: 48400 Hz Clock: 65.000 MHz
  1024x768@70Hz 4:3 HorFreq: 56500 Hz Clock: 75.000 MHz
  1024x768@75Hz 4:3 HorFreq: 60000 Hz Clock: 78.750 MHz
  1152x870@75Hz 192:145 HorFreq: 67500 Hz Clock: 108.000 MHz
Standard timings supported:
  1280x1024@60Hz 5:4 HorFreq: 64000 Hz Clock: 108.000 MHz
  1680x1050@60Hz 16:10 HorFreq: 64700 Hz Clock: 119.000 MHz
  1680x1050@75Hz 16:10 HorFreq: 82300 Hz Clock: 187.000 MHz
Detailed mode: Clock 146.250 MHz, 430 mm x 270 mm
               1680 1784 1960 2240 hborder 0
               1050 1053 1059 1089 vborder 0
               -hsync +vsync 
               VertFreq: 59 Hz, HorFreq: 65290 Hz
Monitor ranges (GTF): 50-76Hz V, 24-93kHz H, max dotclock 160MHz
Monitor name: HP L2045w
Serial number: --
Checksum: 0x37 (valid)
EDID block does NOT conform to EDID 1.3!
	sRGB is signaled, but the chromaticities do not match
One or more of the timings is out of range of the Monitor Ranges:
  Vertical Freq: 59 - 75 Hz
  Horizontal Freq: 31469 - 82300 Hz
  Maximum Clock: 187.000 MHz


