edid-decode (hex):

00 ff ff ff ff ff ff 00 0d ae 04 01 00 00 00 00
16 19 01 04 a0 15 10 78 02 21 d5 9e 5b 56 91 25
16 50 54 00 00 00 01 01 01 01 01 01 01 01 01 01
01 01 01 01 01 01 64 19 00 9c 40 00 96 30 0a 88
36 00 d2 9e 00 00 00 18 64 19 00 9c 40 00 96 30
0a 88 36 00 d2 9e 00 00 00 18 00 00 00 fe 00 49
4e 58 2d 4f 50 45 4e 2d 43 45 4c 4c 00 00 00 fc
00 47 31 30 34 58 47 4a 2d 50 30 31 0a 20 00 ce

----------------

Block 0, Base EDID:
  EDID Structure Version & Revision: 1.4
  Vendor & Product Identification:
    Manufacturer: CMN
    Model: 260
    Made in: week 22 of 2015
  Basic Display Parameters & Features:
    Digital display
    Bits per primary color channel: 8
    Digital interface is not defined
    Maximum image size: 21 cm x 16 cm
    Gamma: 2.20
    Supported color formats: RGB 4:4:4
    First detailed timing includes the native pixel format and preferred refresh rate
  Color Characteristics:
    Red  : 0.6171, 0.3574
    Green: 0.3359, 0.5673
    Blue : 0.1474, 0.0869
    White: 0.3134, 0.3291
  Established Timings I & II: none
  Standard Timings: none
  Detailed Timing Descriptors:
    DTD 1:  1024x768    60.005170 Hz   4:3     55.085 kHz     65.000000 MHz (210 mm x 158 mm)
                 Hfront   10 Hsync 136 Hback   10 Hpol N
                 Vfront    3 Vsync   6 Vback  141 Vpol N
    DTD 2:  1024x768    60.005170 Hz   4:3     55.085 kHz     65.000000 MHz (210 mm x 158 mm)
                 Hfront   10 Hsync 136 Hback   10 Hpol N
                 Vfront    3 Vsync   6 Vback  141 Vpol N
    Alphanumeric Data String: 'INX-OPEN-CELL'
    Display Product Name: 'G104XGJ-P01'
Checksum: 0xce

----------------

EDID conformity: PASS
