edid-decode (hex):

00 ff ff ff ff ff ff 00 09 e5 e3 05 00 00 00 00
01 17 01 03 80 1d 11 78 0a 92 9e a9 53 4a 9a 22
19 4f 55 00 00 00 01 01 01 01 01 01 01 01 01 01
01 01 01 01 01 01 36 36 80 a0 70 38 20 40 30 20
35 00 26 a5 10 00 00 1a 36 36 80 a0 70 38 20 40
30 20 35 00 26 a5 10 00 00 1a 00 00 00 fe 00 42
4f 45 20 48 46 0a 20 20 20 20 20 20 00 00 00 fe
00 48 4e 31 33 33 57 55 33 2d 31 30 32 0a 00 a9

----------------

Block 0, Base EDID:
  EDID Structure Version & Revision: 1.3
  Vendor & Product Identification:
    Manufacturer: BOE
    Model: 1507
    Made in: week 1 of 2013
  Basic Display Parameters & Features:
    Digital display
    Maximum image size: 29 cm x 17 cm
    Gamma: 2.20
    RGB color display
    First detailed timing is the preferred timing
  Color Characteristics:
    Red  : 0.6621, 0.3251
    Green: 0.2890, 0.6035
    Blue : 0.1347, 0.0986
    White: 0.3115, 0.3339
  Established Timings I & II: none
  Standard Timings: none
  Detailed Timing Descriptors:
    DTD 1:  1920x1080   60.001038 Hz  16:9     66.721 kHz    138.780000 MHz (294 mm x 165 mm)
                 Hfront   48 Hsync  32 Hback   80 Hpol P
                 Vfront    3 Vsync   5 Vback   24 Vpol N
    DTD 2:  1920x1080   60.001038 Hz  16:9     66.721 kHz    138.780000 MHz (294 mm x 165 mm)
                 Hfront   48 Hsync  32 Hback   80 Hpol P
                 Vfront    3 Vsync   5 Vback   24 Vpol N
    Alphanumeric Data String: 'BOE HF'
    Alphanumeric Data String: 'HN133WU3-102'
Checksum: 0xa9

----------------

Failures:

Block 0, Base EDID:
  Missing Display Product Name.
  Missing Display Range Limits Descriptor.

EDID conformity: FAIL
