edid-decode (hex):

00 ff ff ff ff ff ff 00 41 0c 23 c3 40 00 00 00
14 22 01 04 b5 46 27 78 3b f5 b0 af 4f 2e c3 26
0b 50 54 bf ef 00 d1 c0 81 80 31 68 31 7c 45 68
45 7c 61 68 61 7c 50 d0 00 a0 f0 70 3e 80 30 58
8a 00 ba 89 21 00 00 1a 00 00 00 ff 00 41 55 38
32 34 32 30 30 30 30 30 36 34 00 00 00 fc 00 33
32 4d 32 4e 36 38 30 30 4d 0a 20 20 00 00 00 fd
00 30 90 ff ff 8c 01 0a 20 20 20 20 20 20 02 ac

02 03 3c f1 4c 01 03 05 14 04 13 1f 12 02 11 90
3f 23 09 07 07 83 01 00 00 e2 00 ea e3 05 c3 01
e6 06 05 01 91 91 0a 74 1a 00 00 03 0b 30 90 00
60 91 0a 91 0a 90 00 00 00 00 00 00 a3 66 00 a0
f0 70 1f 80 30 20 35 00 ba 89 21 00 00 1a 65 e7
00 6a a0 a0 67 50 08 20 98 04 ba 89 21 00 00 1a
70 c2 00 a0 a0 a0 55 50 30 20 35 00 ba 89 21 00
00 1e 00 00 00 00 00 00 00 00 00 00 00 00 00 0d

70 12 79 03 00 03 01 64 f2 07 02 04 ff 0e 3f 01
5f 80 7f 00 6f 08 3d 00 02 00 04 00 04 a4 01 84
ff 0e 9f 00 2f 80 3f 00 6f 08 4f 00 07 00 09 00
30 5b 01 04 ff 0e 9f 00 2f 80 3f 00 6f 08 3d 00
02 00 04 00 1b 27 01 04 ff 0e 9f 00 2f 80 3f 00
6f 08 3d 00 02 00 04 00 64 04 01 04 ff 0e 9f 00
2f 80 3f 00 6f 08 3d 00 02 00 04 00 00 00 00 00
00 00 00 00 00 00 00 00 00 00 00 00 00 00 c9 90

00 ff ff ff ff ff ff 00 41 0c 23 c3 40 00 00 00
14 22 01 04 b5 46 27 78 3b f5 b0 af 4f 2e c3 26
0b 50 54 bf ef 00 d1 c0 81 80 31 68 31 7c 45 68
45 7c 61 68 61 7c 50 d0 00 a0 f0 70 3e 80 30 58
8a 00 ba 89 21 00 00 1a 00 00 00 ff 00 41 55 38
32 34 32 30 30 30 30 30 36 34 00 00 00 fc 00 33
32 4d 32 4e 36 38 30 30 4d 0a 20 20 00 00 00 fd
00 30 90 ff ff 8c 01 0a 20 20 20 20 20 20 02 ac

02 03 3c f1 4c 01 03 05 14 04 13 1f 12 02 11 90
3f 23 09 07 07 83 01 00 00 e2 00 ea e3 05 c3 01
e6 06 05 01 91 91 0a 74 1a 00 00 03 0b 30 90 00
60 91 0a 91 0a 90 00 00 00 00 00 00 a3 66 00 a0
f0 70 1f 80 30 20 35 00 ba 89 21 00 00 1a 65 e7
00 6a a0 a0 67 50 08 20 98 04 ba 89 21 00 00 1a
70 c2 00 a0 a0 a0 55 50 30 20 35 00 ba 89 21 00
00 1e 00 00 00 00 00 00 00 00 00 00 00 00 00 0d

70 12 79 03 00 03 01 64 f2 07 02 04 ff 0e 3f 01
5f 80 7f 00 6f 08 3d 00 02 00 04 00 04 a4 01 84
ff 0e 9f 00 2f 80 3f 00 6f 08 4f 00 07 00 09 00
30 5b 01 04 ff 0e 9f 00 2f 80 3f 00 6f 08 3d 00
02 00 04 00 1b 27 01 04 ff 0e 9f 00 2f 80 3f 00
6f 08 3d 00 02 00 04 00 64 04 01 04 ff 0e 9f 00
2f 80 3f 00 6f 08 3d 00 02 00 04 00 00 00 00 00
00 00 00 00 00 00 00 00 00 00 00 00 00 00 c9 90

----------------

Block 0, Base EDID:
  EDID Structure Version & Revision: 1.4
  Vendor & Product Identification:
    Manufacturer: PHL
    Model: 49955
    Serial Number: ...
    Made in: week 20 of 2024
  Basic Display Parameters & Features:
    Digital display
    Bits per primary color channel: 10
    DisplayPort interface
    Maximum image size: 70 cm x 39 cm
    Gamma: 2.20
    DPMS levels: Off
    Supported color formats: RGB 4:4:4, YCrCb 4:4:4, YCrCb 4:2:2
    First detailed timing includes the native pixel format and preferred refresh rate
    Display is continuous frequency
  Color Characteristics:
    Red  : 0.6865, 0.3115
    Green: 0.1806, 0.7626
    Blue : 0.1503, 0.0458
    White: 0.3125, 0.3281
  Established Timings I & II:
    IBM     :   720x400    70.081663 Hz   9:5     31.467 kHz     28.320000 MHz
    DMT 0x04:   640x480    59.940476 Hz   4:3     31.469 kHz     25.175000 MHz
    Apple   :   640x480    66.666667 Hz   4:3     35.000 kHz     30.240000 MHz
    DMT 0x05:   640x480    72.808802 Hz   4:3     37.861 kHz     31.500000 MHz
    DMT 0x06:   640x480    75.000000 Hz   4:3     37.500 kHz     31.500000 MHz
    DMT 0x08:   800x600    56.250000 Hz   4:3     35.156 kHz     36.000000 MHz
    DMT 0x09:   800x600    60.316541 Hz   4:3     37.879 kHz     40.000000 MHz
    DMT 0x0a:   800x600    72.187572 Hz   4:3     48.077 kHz     50.000000 MHz
    DMT 0x0b:   800x600    75.000000 Hz   4:3     46.875 kHz     49.500000 MHz
    Apple   :   832x624    74.551266 Hz   4:3     49.726 kHz     57.284000 MHz
    DMT 0x10:  1024x768    60.003840 Hz   4:3     48.363 kHz     65.000000 MHz
    DMT 0x11:  1024x768    70.069359 Hz   4:3     56.476 kHz     75.000000 MHz
    DMT 0x12:  1024x768    75.028582 Hz   4:3     60.023 kHz     78.750000 MHz
    DMT 0x24:  1280x1024   75.024675 Hz   5:4     79.976 kHz    135.000000 MHz
  Standard Timings:
    DMT 0x52:  1920x1080   60.000000 Hz  16:9     67.500 kHz    148.500000 MHz
    DMT 0x23:  1280x1024   60.019740 Hz   5:4     63.981 kHz    108.000000 MHz
    GTF     :   640x480    99.999537 Hz   4:3     50.900 kHz     43.163000 MHz
    GTF     :   640x480   119.999084 Hz   4:3     61.800 kHz     52.406000 MHz
    GTF     :   800x600    99.999707 Hz   4:3     63.600 kHz     68.179000 MHz
    GTF     :   800x600   119.999886 Hz   4:3     77.160 kHz     83.950000 MHz
    GTF     :  1024x768   100.000177 Hz   4:3     81.400 kHz    113.309000 MHz
    GTF     :  1024x768   119.999931 Hz   4:3     98.760 kHz    139.054000 MHz
  Detailed Timing Descriptors:
    DTD 1:  3840x2160   60.000000 Hz  16:9    133.320 kHz    533.280000 MHz (698 mm x 393 mm)
                 Hfront   48 Hsync  88 Hback   24 Hpol P
                 Vfront    8 Vsync  10 Vback   44 Vpol N
    Display Product Serial Number: ...
    Display Product Name: '32M2N6800M'
    Display Range Limits:
      Monitor ranges (Bare Limits): 48-144 Hz V, 255-255 kHz H, max dotclock 1400 MHz
  Extension blocks: 2
Checksum: 0xac

----------------

Block 1, CTA-861 Extension Block:
  Revision: 3
  Underscans IT Video Formats by default
  Basic audio support
  Supports YCbCr 4:4:4
  Supports YCbCr 4:2:2
  Native detailed modes: 1
  Video Data Block:
    VIC   1:   640x480    59.940476 Hz   4:3     31.469 kHz     25.175000 MHz
    VIC   3:   720x480    59.940060 Hz  16:9     31.469 kHz     27.000000 MHz
    VIC   5:  1920x1080i  60.000000 Hz  16:9     33.750 kHz     74.250000 MHz
    VIC  20:  1920x1080i  50.000000 Hz  16:9     28.125 kHz     74.250000 MHz
    VIC   4:  1280x720    60.000000 Hz  16:9     45.000 kHz     74.250000 MHz
    VIC  19:  1280x720    50.000000 Hz  16:9     37.500 kHz     74.250000 MHz
    VIC  31:  1920x1080   50.000000 Hz  16:9     56.250 kHz    148.500000 MHz
    VIC  18:   720x576    50.000000 Hz  16:9     31.250 kHz     27.000000 MHz
    VIC   2:   720x480    59.940060 Hz   4:3     31.469 kHz     27.000000 MHz
    VIC  17:   720x576    50.000000 Hz   4:3     31.250 kHz     27.000000 MHz
    VIC  16:  1920x1080   60.000000 Hz  16:9     67.500 kHz    148.500000 MHz (native)
    VIC  63:  1920x1080  120.000000 Hz  16:9    135.000 kHz    297.000000 MHz
  Audio Data Block:
    Linear PCM:
      Max channels: 2
      Supported sample rates (kHz): 48 44.1 32
      Supported sample sizes (bits): 24 20 16
  Speaker Allocation Data Block:
    FL/FR - Front Left/Right
  Video Capability Data Block:
    YCbCr quantization: Selectable (via AVI YQ)
    RGB quantization: Selectable (via AVI Q)
    PT scan behavior: Always Underscanned
    IT scan behavior: Always Underscanned
    CE scan behavior: Always Underscanned
  Colorimetry Data Block:
    xvYCC601
    xvYCC709
    BT2020YCC
    BT2020RGB
    Gamut Boundary Description Metadata Profile P0
  HDR Static Metadata Data Block:
    Electro optical transfer functions:
      Traditional gamma - SDR luminance range
      SMPTE ST2084
    Supported static metadata descriptors:
      Static metadata type 1
    Desired content max luminance: 145 (1156.145 cd/m^2)
    Desired content max frame-average luminance: 145 (1156.145 cd/m^2)
    Desired content min luminance: 10 (0.018 cd/m^2)
  Vendor-Specific Data Block (AMD), OUI 00-00-1A:
    Version: 3.11
    Minimum Refresh Rate: 48 Hz
    Maximum Refresh Rate: 144 Hz
    Flags 1.x: 0x00
    Flags 2.x: 0x60
    Maximum luminance: 145 (1156.145 cd/m^2)
    Minimum luminance: 10 (0.018 cd/m^2)
    Unknown: 0x91 0x0a
  Detailed Timing Descriptors:
    DTD 2:  3840x2160   29.980602 Hz  16:9     65.688 kHz    262.750000 MHz (698 mm x 393 mm)
                 Hfront   48 Hsync  32 Hback   80 Hpol P
                 Vfront    3 Vsync   5 Vback   23 Vpol N
    DTD 3:  2560x1440  144.001490 Hz  16:9    222.194 kHz    592.370000 MHz (698 mm x 393 mm)
                 Hfront    8 Hsync  32 Hback   66 Hpol P
                 Vfront   25 Vsync   8 Vback   70 Vpol N
    DTD 4:  2560x1440  120.000000 Hz  16:9    183.000 kHz    497.760000 MHz (698 mm x 393 mm)
                 Hfront   48 Hsync  32 Hback   80 Hpol P
                 Vfront    3 Vsync   5 Vback   77 Vpol P
Checksum: 0x0d  Unused space in Extension Block: 13 bytes

----------------

Block 2, DisplayID Extension Block:
  Version: 1.2
  Extension Count: 0
  Display Product Type: Standalone display device
  Video Timing Modes Type 1 - Detailed Timings Data Block:
    DTD:  3840x2160  144.000338 Hz  16:9    319.969 kHz   1331.070000 MHz (aspect 16:9, no 3D stereo)
               Hfront   96 Hsync 128 Hback   96 Hpol P
               Vfront    3 Vsync   5 Vback   54 Vpol N
    DTD:  3840x2160  120.005580 Hz  16:9    268.812 kHz   1075.250000 MHz (aspect 16:9, no 3D stereo, preferred)
               Hfront   48 Hsync  64 Hback   48 Hpol P
               Vfront    8 Vsync  10 Vback   62 Vpol N
    DTD:  3840x2160  100.001125 Hz  16:9    222.202 kHz    888.810000 MHz (aspect 16:9, no 3D stereo)
               Hfront   48 Hsync  64 Hback   48 Hpol P
               Vfront    3 Vsync   5 Vback   54 Vpol N
    DTD:  3840x2160   85.000000 Hz  16:9    188.870 kHz    755.480000 MHz (aspect 16:9, no 3D stereo)
               Hfront   48 Hsync  64 Hback   48 Hpol P
               Vfront    3 Vsync   5 Vback   54 Vpol N
    DTD:  3840x2160   75.001125 Hz  16:9    166.653 kHz    666.610000 MHz (aspect 16:9, no 3D stereo)
               Hfront   48 Hsync  64 Hback   48 Hpol P
               Vfront    3 Vsync   5 Vback   54 Vpol N
  Checksum: 0xc9
Checksum: 0x90

----------------

Block 3, Unknown EDID Extension Block 0x00:
  00 ff ff ff ff ff ff 00 41 0c 23 c3 40 00 00 00 '........A.#.@...'
  14 22 01 04 b5 46 27 78 3b f5 b0 af 4f 2e c3 26 '."...F'x;...O..&'
  0b 50 54 bf ef 00 d1 c0 81 80 31 68 31 7c 45 68 '.PT.......1h1|Eh'
  45 7c 61 68 61 7c 50 d0 00 a0 f0 70 3e 80 30 58 'E|aha|P....p>.0X'
  8a 00 ba 89 21 00 00 1a 00 00 00 ff 00 41 55 38 '....!........AU8'
  32 34 32 30 30 30 30 30 36 34 00 00 00 fc 00 33 '2420000064.....3'
  32 4d 32 4e 36 38 30 30 4d 0a 20 20 00 00 00 fd '2M2N6800M.  ....'
  00 30 90 ff ff 8c 01 0a 20 20 20 20 20 20 02 ac '.0......      ..'
Checksum: 0xac

----------------

Block 4, CTA-861 Extension Block:
  Revision: 3
  Underscans IT Video Formats by default
  Basic audio support
  Supports YCbCr 4:4:4
  Supports YCbCr 4:2:2
  Native detailed modes: 1
  Video Data Block:
    VIC   1:   640x480    59.940476 Hz   4:3     31.469 kHz     25.175000 MHz
    VIC   3:   720x480    59.940060 Hz  16:9     31.469 kHz     27.000000 MHz
    VIC   5:  1920x1080i  60.000000 Hz  16:9     33.750 kHz     74.250000 MHz
    VIC  20:  1920x1080i  50.000000 Hz  16:9     28.125 kHz     74.250000 MHz
    VIC   4:  1280x720    60.000000 Hz  16:9     45.000 kHz     74.250000 MHz
    VIC  19:  1280x720    50.000000 Hz  16:9     37.500 kHz     74.250000 MHz
    VIC  31:  1920x1080   50.000000 Hz  16:9     56.250 kHz    148.500000 MHz
    VIC  18:   720x576    50.000000 Hz  16:9     31.250 kHz     27.000000 MHz
    VIC   2:   720x480    59.940060 Hz   4:3     31.469 kHz     27.000000 MHz
    VIC  17:   720x576    50.000000 Hz   4:3     31.250 kHz     27.000000 MHz
    VIC  16:  1920x1080   60.000000 Hz  16:9     67.500 kHz    148.500000 MHz (native)
    VIC  63:  1920x1080  120.000000 Hz  16:9    135.000 kHz    297.000000 MHz
  Audio Data Block:
    Linear PCM:
      Max channels: 2
      Supported sample rates (kHz): 48 44.1 32
      Supported sample sizes (bits): 24 20 16
  Speaker Allocation Data Block:
    FL/FR - Front Left/Right
  Video Capability Data Block:
    YCbCr quantization: Selectable (via AVI YQ)
    RGB quantization: Selectable (via AVI Q)
    PT scan behavior: Always Underscanned
    IT scan behavior: Always Underscanned
    CE scan behavior: Always Underscanned
  Colorimetry Data Block:
    xvYCC601
    xvYCC709
    BT2020YCC
    BT2020RGB
    Gamut Boundary Description Metadata Profile P0
  HDR Static Metadata Data Block:
    Electro optical transfer functions:
      Traditional gamma - SDR luminance range
      SMPTE ST2084
    Supported static metadata descriptors:
      Static metadata type 1
    Desired content max luminance: 145 (1156.145 cd/m^2)
    Desired content max frame-average luminance: 145 (1156.145 cd/m^2)
    Desired content min luminance: 10 (0.018 cd/m^2)
  Vendor-Specific Data Block (AMD), OUI 00-00-1A:
    Version: 3.11
    Minimum Refresh Rate: 48 Hz
    Maximum Refresh Rate: 144 Hz
    Flags 1.x: 0x00
    Flags 2.x: 0x60
    Maximum luminance: 145 (1156.145 cd/m^2)
    Minimum luminance: 10 (0.018 cd/m^2)
    Unknown: 0x91 0x0a
  Detailed Timing Descriptors:
    DTD 5:  3840x2160   29.980602 Hz  16:9     65.688 kHz    262.750000 MHz (698 mm x 393 mm)
                 Hfront   48 Hsync  32 Hback   80 Hpol P
                 Vfront    3 Vsync   5 Vback   23 Vpol N
    DTD 6:  2560x1440  144.001490 Hz  16:9    222.194 kHz    592.370000 MHz (698 mm x 393 mm)
                 Hfront    8 Hsync  32 Hback   66 Hpol P
                 Vfront   25 Vsync   8 Vback   70 Vpol N
    DTD 7:  2560x1440  120.000000 Hz  16:9    183.000 kHz    497.760000 MHz (698 mm x 393 mm)
                 Hfront   48 Hsync  32 Hback   80 Hpol P
                 Vfront    3 Vsync   5 Vback   77 Vpol P
Checksum: 0x0d  Unused space in Extension Block: 13 bytes

----------------

Block 5, DisplayID Extension Block:
  Version: 1.2
  Extension Count: 0
  Video Timing Modes Type 1 - Detailed Timings Data Block:
    DTD:  3840x2160  144.000338 Hz  16:9    319.969 kHz   1331.070000 MHz (aspect 16:9, no 3D stereo)
               Hfront   96 Hsync 128 Hback   96 Hpol P
               Vfront    3 Vsync   5 Vback   54 Vpol N
    DTD:  3840x2160  120.005580 Hz  16:9    268.812 kHz   1075.250000 MHz (aspect 16:9, no 3D stereo, preferred)
               Hfront   48 Hsync  64 Hback   48 Hpol P
               Vfront    8 Vsync  10 Vback   62 Vpol N
    DTD:  3840x2160  100.001125 Hz  16:9    222.202 kHz    888.810000 MHz (aspect 16:9, no 3D stereo)
               Hfront   48 Hsync  64 Hback   48 Hpol P
               Vfront    3 Vsync   5 Vback   54 Vpol N
    DTD:  3840x2160   85.000000 Hz  16:9    188.870 kHz    755.480000 MHz (aspect 16:9, no 3D stereo)
               Hfront   48 Hsync  64 Hback   48 Hpol P
               Vfront    3 Vsync   5 Vback   54 Vpol N
    DTD:  3840x2160   75.001125 Hz  16:9    166.653 kHz    666.610000 MHz (aspect 16:9, no 3D stereo)
               Hfront   48 Hsync  64 Hback   48 Hpol P
               Vfront    3 Vsync   5 Vback   54 Vpol N
  Checksum: 0xc9
Checksum: 0x90

----------------

Warnings:

Block 1, CTA-861 Extension Block:
  Video Capability Data Block: S_PT is equal to S_IT and S_CE, so should be set to 0 instead.
  Colorimetry Data Block: Set the sRGB colorimetry bit to avoid interop issues.
  Display Product Serial Number is set, so the Serial Number in the Base EDID should be 0.
Block 4, CTA-861 Extension Block:
  Video Capability Data Block: S_PT is equal to S_IT and S_CE, so should be set to 0 instead.
  Colorimetry Data Block: Set the sRGB colorimetry bit to avoid interop issues.
  Display Product Serial Number is set, so the Serial Number in the Base EDID should be 0.
EDID:
  Base EDID: Some timings are out of range of the Monitor Ranges:
    Vertical Freq: 29.981 - 144.001 Hz (Monitor: 48.000 - 144.000 Hz)
    Horizontal Freq: 28.125 - 319.968 kHz (Monitor: 255.000 - 255.000 kHz)

Failures:

Block 2, DisplayID Extension Block:
  Expected 0 DisplayID Extension Block, but got 1.
Block 3, Base EDID:
  Unknown Extension Block.
Block 4, CTA-861 Extension Block:
  Video Data Block: Duplicate VIC 1.
  Video Data Block: Duplicate VIC 3.
  Video Data Block: Duplicate VIC 5.
  Video Data Block: Duplicate VIC 20.
  Video Data Block: Duplicate VIC 4.
  Video Data Block: Duplicate VIC 19.
  Video Data Block: Duplicate VIC 31.
  Video Data Block: Duplicate VIC 18.
  Video Data Block: Duplicate VIC 2.
  Video Data Block: Duplicate VIC 17.
  Video Data Block: Duplicate VIC 16.
  Video Data Block: Duplicate VIC 63.
  Speaker Allocation Data Block: Only one instance of this Data Block is allowed.
  Video Capability Data Block: Only one instance of this Data Block is allowed.
  Colorimetry Data Block: Only one instance of this Data Block is allowed.
  HDR Static Metadata Data Block: Only one instance of this Data Block is allowed.
Block 5, DisplayID Extension Block:
  Product Type should be 0 in extension block.
EDID:
  Base EDID: EDID specified 2 extension block(s), but found 5 extension block(s).
  CTA-861: Native progressive timings are a mix of several resolutions.
  DisplayID: Missing DisplayID Product Identification Data Block.
  DisplayID: Missing DisplayID Display Parameters Data Block.
  DisplayID: Missing DisplayID Display Interface Features Data Block.

EDID conformity: FAIL
