edid-decode (hex):

00 ff ff ff ff ff ff 00 0d af 58 15 00 00 00 00
28 11 01 03 80 23 13 78 0a 07 f5 9a 57 4e 87 26
1e 50 54 00 00 00 01 01 01 01 01 01 01 01 01 01
01 01 01 01 01 01 69 1e 56 e6 50 00 2d 30 54 4d
5e 00 58 c1 10 00 00 18 00 00 00 fe 00 4e 31 35
36 42 33 2d 4c 30 32 0a 20 20 00 00 00 fe 00 43
4d 4f 0a 20 20 20 20 20 20 20 20 20 00 00 00 fe
00 4e 31 35 36 42 33 2d 4c 30 32 0a 20 20 00 f3

----------------

Block 0, Base EDID:
  EDID Structure Version & Revision: 1.3
  Vendor & Product Identification:
    Manufacturer: CMO
    Model: 5464
    Made in: week 40 of 2007
  Basic Display Parameters & Features:
    Digital display
    Maximum image size: 35 cm x 19 cm
    Gamma: 2.20
    RGB color display
    First detailed timing is the preferred timing
  Color Characteristics:
    Red  : 0.6015, 0.3398
    Green: 0.3056, 0.5302
    Blue : 0.1513, 0.1201
    White: 0.3134, 0.3291
  Established Timings I & II: none
  Standard Timings: none
  Detailed Timing Descriptors:
    DTD 1:  1366x768    59.997780 Hz 683:384   48.778 kHz     77.850000 MHz (344 mm x 193 mm)
                 Hfront   84 Hsync  77 Hback   69 Hpol N
                 Vfront    5 Vsync  14 Vback   26 Vpol N
    Alphanumeric Data String: 'N156B3-L02'
    Alphanumeric Data String: 'CMO'
    Alphanumeric Data String: 'N156B3-L02'
Checksum: 0xf3

----------------

Failures:

Block 0, Base EDID:
  Missing Display Product Name.
  Missing Display Range Limits Descriptor.

EDID conformity: FAIL
