edid-decode (hex):

00 ff ff ff ff ff ff 00 09 e5 4d 09 00 00 00 00
12 1e 01 04 a5 22 13 78 03 95 b5 96 5d 5a 92 29
1e 50 54 00 00 00 01 01 01 01 01 01 01 01 01 01
01 01 01 01 01 01 ed 89 80 a5 70 38 60 40 30 20
36 00 58 c2 10 00 00 1a 78 39 80 a5 70 38 60 40
30 20 36 00 58 c2 10 00 00 1a 00 00 00 00 00 00
00 00 00 00 00 00 00 00 00 00 00 00 00 00 00 02
00 0d 40 ff 0a 3c 7d 30 12 25 7d 00 00 00 00 8a

----------------

Block 0, Base EDID:
  EDID Structure Version & Revision: 1.4
  Vendor & Product Identification:
    Manufacturer: BOE
    Model: 2381
    Made in: week 18 of 2020
  Basic Display Parameters & Features:
    Digital display
    Bits per primary color channel: 8
    DisplayPort interface
    Maximum image size: 34 cm x 19 cm
    Gamma: 2.20
    Supported color formats: RGB 4:4:4
    First detailed timing includes the native pixel format and preferred refresh rate
    Display is continuous frequency
  Color Characteristics:
    Red  : 0.5878, 0.3642
    Green: 0.3525, 0.5712
    Blue : 0.1621, 0.1201
    White: 0.3134, 0.3291
  Established Timings I & II: none
  Standard Timings: none
  Detailed Timing Descriptors:
    DTD 1:  1920x1080  144.003165 Hz  16:9    169.348 kHz    353.090000 MHz (344 mm x 194 mm)
                 Hfront   48 Hsync  32 Hback   85 Hpol P
                 Vfront    3 Vsync   6 Vback   87 Vpol N
    DTD 2:  1920x1080   60.000979 Hz  16:9     70.561 kHz    147.120000 MHz (344 mm x 194 mm)
                 Hfront   48 Hsync  32 Hback   85 Hpol P
                 Vfront    3 Vsync   6 Vback   87 Vpol N
    Empty Descriptor
    Manufacturer-Specified Display Descriptor (0x02): 00 02 00 0d 40 ff 0a 3c 7d 30 12 25 7d 00 00 00 '....@..<}0.%}...'
Checksum: 0x8a

----------------

Warnings:

Block 0, Base EDID:
  Missing Display Product Name.

Failures:

Block 0, Base EDID:
  Empty Descriptor: Use Dummy Descriptor instead of all zeroes.
  Missing Display Range Limits Descriptor.

EDID conformity: FAIL
