
EDID (hex):
00ffffffffffff000d12080408040000
10170104a5000078e28042ac5130b425
10505300000001010101010101010101
0101010101016419004041002630356a
6c00064d2100001a2815004041002630
356a6c00064d2100001a000000fd0038
4c1e5311000a202020202020000000fc
0032303133303430385f31360a200034

Extracted contents:
header:          00 ff ff ff ff ff ff 00
serial number:   0d 12 08 04 08 04 00 00 10 17
version:         01 04
basic params:    a5 00 00 78 e2
chroma info:     80 42 ac 51 30 b4 25 10 50 53
established:     00 00 00
standard:        01 01 01 01 01 01 01 01 01 01 01 01 01 01 01 01
descriptor 1:    64 19 00 40 41 00 26 30 35 6a 6c 00 06 4d 21 00 00 1a
descriptor 2:    28 15 00 40 41 00 26 30 35 6a 6c 00 06 4d 21 00 00 1a
descriptor 3:    00 00 00 fd 00 38 4c 1e 53 11 00 0a 20 20 20 20 20 20
descriptor 4:    00 00 00 fc 00 32 30 31 33 30 34 30 38 5f 31 36 0a 20
extensions:      00
checksum:        34

EDID version: 1.4
Manufacturer: CHR Model 408 Serial Number --
Made in week 16 of 2013
Digital display
8 bits per primary color channel
DisplayPort interface
Image size is variable
Gamma: 2.20
DPMS levels: Standby Suspend Off
Supported color formats: RGB 4:4:4
First detailed timing includes the native pixel format and preferred refresh rate
Display x,y Chromaticity:
  Red:   0.6738, 0.3164
  Green: 0.1875, 0.7031
  Blue:  0.1455, 0.0625
  White: 0.3125, 0.3261
Established timings supported:
Standard timings supported:
Detailed mode: Clock 65.000 MHz, 518 mm x 333 mm
               1024 1077 1183 1344 hborder 0
                768  774  786  806 vborder 0
               +hsync -vsync 
               VertFreq: 60 Hz, HorFreq: 48363 Hz
Detailed mode: Clock 54.160 MHz, 518 mm x 333 mm
               1024 1077 1183 1344 hborder 0
                768  774  786  806 vborder 0
               +hsync -vsync 
               VertFreq: 49 Hz, HorFreq: 40297 Hz
Monitor ranges (GTF): 56-76Hz V, 30-83kHz H, max dotclock 170MHz
Monitor name: 20130408_16
Checksum: 0x34 (valid)
Warning: One or more of the timings is out of range of the Monitor Ranges:
  Vertical Freq: 49 - 60 Hz
  Horizontal Freq: 40297 - 48363 Hz
  Maximum Clock: 65.000 MHz
