
EDID (hex):
00ffffffffffff0022f07f3100000000
2f1b0104b53c22783a4dd5a7554a9d24
0e5054a1080081c081809500a9c0b300
d1c0a940d1004dd000a0f0703e803020
3500544f2100001a000000fd00183c1e
873c000a202020202020000000fc0048
50205a3237730a2020202020000000ff
00434e4b3734373047304e0a202001e3
020318f14b101f041303120211010514
2309070783010000a36600a0f0701f80
30203500544f2100001a565e00a0a0a0
295030203500544f2100001aef5100a0
f070198030203500544f2100001a7d39
00a080381f4030203a00544f2100001a
283c80a070b0234030203600544f2100
001a000000000000000000000000006a

Extracted contents:
header:          00 ff ff ff ff ff ff 00
serial number:   22 f0 7f 31 00 00 00 00 2f 1b
version:         01 04
basic params:    b5 3c 22 78 3a
chroma info:     4d d5 a7 55 4a 9d 24 0e 50 54
established:     a1 08 00
standard:        81 c0 81 80 95 00 a9 c0 b3 00 d1 c0 a9 40 d1 00
descriptor 1:    4d d0 00 a0 f0 70 3e 80 30 20 35 00 54 4f 21 00 00 1a
descriptor 2:    00 00 00 fd 00 18 3c 1e 87 3c 00 0a 20 20 20 20 20 20
descriptor 3:    00 00 00 fc 00 48 50 20 5a 32 37 73 0a 20 20 20 20 20
descriptor 4:    00 00 00 ff 00 43 4e 4b 37 34 37 30 47 30 4e 0a 20 20
extensions:      01
checksum:        e3

EDID version: 1.4
Manufacturer: HWP Model 317f Serial Number --
Made in week 47 of 2017
Digital display
10 bits per primary color channel
DisplayPort interface
Maximum image size: 60 cm x 34 cm
Gamma: 2.20
DPMS levels: Off
Supported color formats: RGB 4:4:4, YCrCb 4:4:4, YCrCb 4:2:2
First detailed timing includes the native pixel format and preferred refresh rate
Display x,y Chromaticity:
  Red:   0.6533, 0.3320
  Green: 0.2919, 0.6142
  Blue:  0.1435, 0.0556
  White: 0.3134, 0.3291
Established timings supported:
  720x400@70Hz 9:5 HorFreq: 31469 Hz Clock: 28.320 MHz
  640x480@60Hz 4:3 HorFreq: 31469 Hz Clock: 25.175 MHz
  800x600@60Hz 4:3 HorFreq: 37900 Hz Clock: 40.000 MHz
  1024x768@60Hz 4:3 HorFreq: 48400 Hz Clock: 65.000 MHz
Standard timings supported:
  1280x720@60Hz 16:9
  1280x1024@60Hz 5:4 HorFreq: 64000 Hz Clock: 108.000 MHz
  1440x900@60Hz 16:10 HorFreq: 55500 Hz Clock: 88.750 MHz
  1600x900@60Hz 16:9
  1680x1050@60Hz 16:10 HorFreq: 64700 Hz Clock: 119.000 MHz
  1920x1080@60Hz 16:9
  1600x1200@60Hz 4:3 HorFreq: 75000 Hz Clock: 162.000 MHz
  1920x1200@60Hz 16:10 HorFreq: 74000 Hz Clock: 154.000 MHz
Detailed mode: Clock 533.250 MHz, 596 mm x 335 mm
               3840 3888 3920 4000 hborder 0
               2160 2163 2168 2222 vborder 0
               +hsync -vsync 
               VertFreq: 59 Hz, HorFreq: 133312 Hz
Monitor ranges (GTF): 24-60Hz V, 30-135kHz H, max dotclock 600MHz
Monitor name: HP Z27s
Serial number: --
Has 1 extension blocks
Checksum: 0xe3 (valid)

CTA extension block
Extension version: 3
20 bytes of CTA data
  Video data block
    VIC  16 1920x1080@60Hz 16:9  HorFreq: 67500 Hz Clock: 148.500 MHz
    VIC  31 1920x1080@50Hz 16:9  HorFreq: 56250 Hz Clock: 148.500 MHz
    VIC   4 1280x720@60Hz 16:9  HorFreq: 45000 Hz Clock: 74.250 MHz
    VIC  19 1280x720@50Hz 16:9  HorFreq: 37500 Hz Clock: 74.250 MHz
    VIC   3 720x480@60Hz 16:9  HorFreq: 31469 Hz Clock: 27.000 MHz
    VIC  18 720x576@50Hz 16:9  HorFreq: 31250 Hz Clock: 27.000 MHz
    VIC   2 720x480@60Hz 4:3  HorFreq: 31469 Hz Clock: 27.000 MHz
    VIC  17 720x576@50Hz 4:3  HorFreq: 31250 Hz Clock: 27.000 MHz
    VIC   1 640x480@60Hz 4:3  HorFreq: 31469 Hz Clock: 25.175 MHz
    VIC   5 1920x1080i@60Hz 16:9  HorFreq: 33750 Hz Clock: 74.250 MHz
    VIC  20 1920x1080i@50Hz 16:9  HorFreq: 28125 Hz Clock: 74.250 MHz
  Audio data block
    Linear PCM, max channels 2
      Supported sample rates (kHz): 48 44.1 32
      Supported sample sizes (bits): 24 20 16
  Speaker allocation data block
    Speaker map:
      FL/FR - Front Left/Right
Underscans PC formats by default
Basic audio support
Supports YCbCr 4:4:4
Supports YCbCr 4:2:2
1 native detailed modes
Detailed mode: Clock 262.750 MHz, 596 mm x 335 mm
               3840 3888 3920 4000 hborder 0
               2160 2163 2168 2191 vborder 0
               +hsync -vsync 
               VertFreq: 29 Hz, HorFreq: 65687 Hz
Detailed mode: Clock 241.500 MHz, 596 mm x 335 mm
               2560 2608 2640 2720 hborder 0
               1440 1443 1448 1481 vborder 0
               +hsync -vsync 
               VertFreq: 59 Hz, HorFreq: 88786 Hz
Detailed mode: Clock 209.750 MHz, 596 mm x 335 mm
               3840 3888 3920 4000 hborder 0
               2160 2163 2168 2185 vborder 0
               +hsync -vsync 
               VertFreq: 23 Hz, HorFreq: 52437 Hz
Detailed mode: Clock 147.170 MHz, 596 mm x 335 mm
               2048 2096 2128 2208 hborder 0
               1080 1083 1093 1111 vborder 0
               +hsync -vsync 
               VertFreq: 59 Hz, HorFreq: 66653 Hz
Detailed mode: Clock 154.000 MHz, 596 mm x 335 mm
               1920 1968 2000 2080 hborder 0
               1200 1203 1209 1235 vborder 0
               +hsync -vsync 
               VertFreq: 59 Hz, HorFreq: 74038 Hz
Checksum: 0x6a (valid)

Warning: One or more of the timings is out of range of the Monitor Ranges:
  Vertical Freq: 23 - 70 Hz
  Horizontal Freq: 28125 - 133312 Hz
  Maximum Clock: 533.250 MHz
