edid-decode (hex):

00 ff ff ff ff ff ff 00 4e 16 00 71 01 00 00 00
01 10 01 03 68 26 1e 6b 2a 6c 55 a2 5a 4e 9b 23
16 4f 54 af cf 00 71 40 71 4a 71 4f 81 00 81 40
81 4f 81 80 45 40 3c 00 00 a0 50 00 16 30 30 20
37 00 a0 d0 00 00 00 00 3c 00 00 80 51 00 1e 30
40 80 37 00 5a d0 10 00 00 00 4b 00 00 a0 51 00
25 30 50 80 37 00 5a d0 10 00 00 00 00 00 00 00
00 00 00 00 00 00 00 00 00 00 00 00 00 00 00 4f

----------------

Block 0, Base EDID:
  EDID Structure Version & Revision: 1.3
  Vendor & Product Identification:
    Manufacturer: SPV
    Model: 28928
    Serial Number: ...
    Made in: week 1 of 2006
  Basic Display Parameters & Features:
    Analog display
    Signal Level Standard: 0.700 : 0.000 : 0.700 V p-p
    Blank level equals black level
    Sync: Separate
    Maximum image size: 38 cm x 30 cm
    Gamma: 2.07
    DPMS levels: Off
    RGB color display
    First detailed timing is the preferred timing
  Color Characteristics:
    Red  : 0.6337, 0.3535
    Green: 0.3076, 0.6054
    Blue : 0.1376, 0.0869
    White: 0.3095, 0.3291
  Established Timings I & II:
    IBM     :   720x400    70.081663 Hz   9:5     31.467 kHz     28.320000 MHz
    DMT 0x04:   640x480    59.940476 Hz   4:3     31.469 kHz     25.175000 MHz
    DMT 0x05:   640x480    72.808802 Hz   4:3     37.861 kHz     31.500000 MHz
    DMT 0x06:   640x480    75.000000 Hz   4:3     37.500 kHz     31.500000 MHz
    DMT 0x08:   800x600    56.250000 Hz   4:3     35.156 kHz     36.000000 MHz
    DMT 0x09:   800x600    60.316541 Hz   4:3     37.879 kHz     40.000000 MHz
    DMT 0x0a:   800x600    72.187572 Hz   4:3     48.077 kHz     50.000000 MHz
    DMT 0x0b:   800x600    75.000000 Hz   4:3     46.875 kHz     49.500000 MHz
    DMT 0x10:  1024x768    60.003840 Hz   4:3     48.363 kHz     65.000000 MHz
    DMT 0x11:  1024x768    70.069359 Hz   4:3     56.476 kHz     75.000000 MHz
    DMT 0x12:  1024x768    75.028582 Hz   4:3     60.023 kHz     78.750000 MHz
    DMT 0x24:  1280x1024   75.024675 Hz   5:4     79.976 kHz    135.000000 MHz
  Standard Timings:
    GTF     :  1152x864    60.000000 Hz   4:3     53.700 kHz     81.624000 MHz
    GTF     :  1152x864    70.000000 Hz   4:3     63.000 kHz     96.768000 MHz
    DMT 0x15:  1152x864    75.000000 Hz   4:3     67.500 kHz    108.000000 MHz
    DMT 0x1c:  1280x800    59.810326 Hz  16:10    49.702 kHz     83.500000 MHz
    DMT 0x20:  1280x960    60.000000 Hz   4:3     60.000 kHz    108.000000 MHz
    GTF     :  1280x960    74.999884 Hz   4:3     75.150 kHz    129.859000 MHz
    DMT 0x23:  1280x1024   60.019740 Hz   5:4     63.981 kHz    108.000000 MHz
    DMT 0x09:   800x600    60.316541 Hz   4:3     37.879 kHz     40.000000 MHz
  Detailed Timing Descriptors:
    Detailed mode: 3c 00 00 a0 50 00 16 30 30 20 37 00 a0 d0 00 00 00 00 '<...P..00 7.......'
    Detailed mode: 3c 00 00 80 51 00 1e 30 40 80 37 00 5a d0 10 00 00 00 '<...Q..0@.7.Z.....'
    Detailed mode: 4b 00 00 a0 51 00 25 30 50 80 37 00 5a d0 10 00 00 00 'K...Q.%0P.7.Z.....'
    Empty Descriptor
Checksum: 0x4f

----------------

Failures:

Block 0, Base EDID:
  Detailed Timing Descriptor #1: Pixelclock < 10 MHz, assuming invalid data 0x3c 0x00.
  Detailed Timing Descriptor #2: Pixelclock < 10 MHz, assuming invalid data 0x3c 0x00.
  Detailed Timing Descriptor #3: Pixelclock < 10 MHz, assuming invalid data 0x4b 0x00.
  Empty Descriptor: Use Dummy Descriptor instead of all zeroes.
  Missing Display Product Name.
  Missing Display Range Limits Descriptor.

EDID conformity: FAIL
