edid-decode (hex):

00 ff ff ff ff ff ff 00 09 e5 2a 0a 00 00 00 00
11 1f 01 04 a5 1e 13 78 03 21 95 95 5c 5a 93 2a
1e 50 54 00 00 00 01 01 01 01 01 01 01 01 01 01
01 01 01 01 01 01 61 40 80 04 71 b0 3c 40 30 20
36 00 2e bc 10 00 00 1a 81 33 80 04 71 b0 3c 40
30 20 36 00 2e bc 10 00 00 1a 00 00 00 fe 00 59
33 47 37 33 80 4e 56 31 34 4e 34 32 00 00 00 00
00 01 41 21 99 00 10 00 00 0a 01 0a 20 20 00 2a

----------------

Block 0, Base EDID:
  EDID Structure Version & Revision: 1.4
  Vendor & Product Identification:
    Manufacturer: BOE
    Model: 2602
    Made in: week 17 of 2021
  Basic Display Parameters & Features:
    Digital display
    Bits per primary color channel: 8
    DisplayPort interface
    Maximum image size: 30 cm x 19 cm
    Gamma: 2.20
    Supported color formats: RGB 4:4:4
    First detailed timing includes the native pixel format and preferred refresh rate
    Display is continuous frequency
  Color Characteristics:
    Red  : 0.5820, 0.3613
    Green: 0.3515, 0.5751
    Blue : 0.1660, 0.1181
    White: 0.3134, 0.3291
  Established Timings I & II: none
  Standard Timings: none
  Detailed Timing Descriptors:
    DTD 1:  1920x1200   60.000728 Hz  16:10    75.601 kHz    164.810000 MHz (302 mm x 188 mm)
                 Hfront   48 Hsync  32 Hback  180 Hpol P
                 Vfront    3 Vsync   6 Vback   51 Vpol N
    DTD 2:  1920x1200   48.001311 Hz  16:10    60.482 kHz    131.850000 MHz (302 mm x 188 mm)
                 Hfront   48 Hsync  32 Hback  180 Hpol P
                 Vfront    3 Vsync   6 Vback   51 Vpol N
    Alphanumeric Data String: 'Y3G73'
    Manufacturer-Specified Display Descriptor (0x00): 00 00 00 01 41 21 99 00 10 00 00 0a 01 0a 20 20 '....A!........  '
Checksum: 0x2a

----------------

Warnings:

Block 0, Base EDID:
  Missing Display Product Name.

Failures:

Block 0, Base EDID:
  Alphanumeric Data String: Non-printable character.
  Missing Display Range Limits Descriptor.

EDID conformity: FAIL
