edid-decode (hex):

00 ff ff ff ff ff ff 00 34 38 8b 07 01 01 01 01
26 10 01 03 0c 26 1e 96 ea 67 35 a6 57 47 96 22
1b 50 54 bf ef 00 81 80 71 4f 01 01 01 01 01 01
01 01 01 01 01 01 30 2a 00 98 51 00 2a 40 30 70
13 00 78 2d 11 00 00 1e 00 00 00 ff 00 36 33 38
42 44 30 31 34 30 32 38 30 30 00 00 00 fc 00 31
39 30 35 20 53 31 0a 20 20 20 20 20 00 00 00 fd
00 38 4b 1f 53 0e 00 0a 20 20 20 20 20 20 00 5c

00 ff ff ff ff ff ff 00 34 38 8b 07 01 01 01 01
26 10 01 03 0c 26 1e 96 ea 67 35 a6 57 47 96 22
1b 50 54 bf ef 00 81 80 71 4f 01 01 01 01 01 01
01 01 01 01 01 01 30 2a 00 98 51 00 2a 40 30 70
13 00 78 2d 11 00 00 1e 00 00 00 ff 00 36 33 38
42 44 30 31 34 30 32 38 30 30 00 00 00 fc 00 31
39 30 35 20 53 31 0a 20 20 20 20 20 00 00 00 fd
00 38 4b 1f 53 0e 00 0a 20 20 20 20 20 20 00 5c

----------------

Block 0, Base EDID:
  EDID Structure Version & Revision: 1.3
  Vendor & Product Identification:
    Manufacturer: MAX
    Model: 1931
    Serial Number: ...
    Made in: week 38 of 2006
  Basic Display Parameters & Features:
    Analog display
    Signal Level Standard: 0.700 : 0.300 : 1.000 V p-p
    Blank level equals black level
    Sync: Separate Composite
    Maximum image size: 38 cm x 30 cm
    Gamma: 2.50
    DPMS levels: Standby Suspend Off
    RGB color display
    First detailed timing is the preferred timing
  Color Characteristics:
    Red  : 0.6494, 0.3417
    Green: 0.2783, 0.5888
    Blue : 0.1328, 0.1083
    White: 0.3134, 0.3291
  Established Timings I & II:
    IBM     :   720x400    70.081663 Hz   9:5     31.467 kHz     28.320000 MHz
    DMT 0x04:   640x480    59.940476 Hz   4:3     31.469 kHz     25.175000 MHz
    Apple   :   640x480    66.666667 Hz   4:3     35.000 kHz     30.240000 MHz
    DMT 0x05:   640x480    72.808802 Hz   4:3     37.861 kHz     31.500000 MHz
    DMT 0x06:   640x480    75.000000 Hz   4:3     37.500 kHz     31.500000 MHz
    DMT 0x08:   800x600    56.250000 Hz   4:3     35.156 kHz     36.000000 MHz
    DMT 0x09:   800x600    60.316541 Hz   4:3     37.879 kHz     40.000000 MHz
    DMT 0x0a:   800x600    72.187572 Hz   4:3     48.077 kHz     50.000000 MHz
    DMT 0x0b:   800x600    75.000000 Hz   4:3     46.875 kHz     49.500000 MHz
    Apple   :   832x624    74.551266 Hz   4:3     49.726 kHz     57.284000 MHz
    DMT 0x10:  1024x768    60.003840 Hz   4:3     48.363 kHz     65.000000 MHz
    DMT 0x11:  1024x768    70.069359 Hz   4:3     56.476 kHz     75.000000 MHz
    DMT 0x12:  1024x768    75.028582 Hz   4:3     60.023 kHz     78.750000 MHz
    DMT 0x24:  1280x1024   75.024675 Hz   5:4     79.976 kHz    135.000000 MHz
  Standard Timings:
    DMT 0x23:  1280x1024   60.019740 Hz   5:4     63.981 kHz    108.000000 MHz
    DMT 0x15:  1152x864    75.000000 Hz   4:3     67.500 kHz    108.000000 MHz
  Detailed Timing Descriptors:
    DTD 1:  1280x1024   60.019740 Hz   5:4     63.981 kHz    108.000000 MHz (376 mm x 301 mm)
                 Hfront   48 Hsync 112 Hback  248 Hpol P
                 Vfront    1 Vsync   3 Vback   38 Vpol P
    Display Product Serial Number: ...
    Display Product Name: '1905 S1'
    Display Range Limits:
      Monitor ranges (GTF): 56-75 Hz V, 31-83 kHz H, max dotclock 140 MHz
Checksum: 0x5c

----------------

Block 1, Unknown EDID Extension Block 0x00:
  00 ff ff ff ff ff ff 00 34 38 8b 07 01 01 01 01 '........48......'
  26 10 01 03 0c 26 1e 96 ea 67 35 a6 57 47 96 22 '&....&...g5.WG."'
  1b 50 54 bf ef 00 81 80 71 4f 01 01 01 01 01 01 '.PT.....qO......'
  01 01 01 01 01 01 30 2a 00 98 51 00 2a 40 30 70 '......0*..Q.*@0p'
  13 00 78 2d 11 00 00 1e 00 00 00 ff 00 36 33 38 '..x-.........638'
  42 44 30 31 34 30 32 38 30 30 00 00 00 fc 00 31 'BD01402800.....1'
  39 30 35 20 53 31 0a 20 20 20 20 20 00 00 00 fd '905 S1.     ....'
  00 38 4b 1f 53 0e 00 0a 20 20 20 20 20 20 00 5c '.8K.S...      .\'
Checksum: 0x5c

----------------

Failures:

Block 1, Base EDID:
  Unknown Extension Block.
EDID:
  Base EDID: EDID specified 0 extension block(s), but found 1 extension block(s).

EDID conformity: FAIL
