
EDID (hex):
00ffffffffffff0026cd3766b8050000
2b1e0104b53c2278fb0c95ab554ca024
0d50542108009500a9c0a940b300d1c0
d1cae1008180565e00a0a0a029503020
350055502100001a000000ff00313135
32313034333031343634000000fd0030
4678781e010a202020202020000000fc
00504c32373932510a202020202001fd
020318f14b100504030201111213141f
23090707830100004c6b0050a0a03050
0820280855502100001a000000000000
00000000000000000000000000000000
00000000000000000000000000000000
00000000000000000000000000000000
00000000000000000000000000000000
00000000000000000000000000000062

Extracted contents:
header:          00 ff ff ff ff ff ff 00
serial number:   26 cd 37 66 b8 05 00 00 2b 1e
version:         01 04
basic params:    b5 3c 22 78 fb
chroma info:     0c 95 ab 55 4c a0 24 0d 50 54
established:     21 08 00
standard:        95 00 a9 c0 a9 40 b3 00 d1 c0 d1 ca e1 00 81 80
descriptor 1:    56 5e 00 a0 a0 a0 29 50 30 20 35 00 55 50 21 00 00 1a
descriptor 2:    00 00 00 ff 00 31 31 35 32 31 30 34 33 30 31 34 36 34
descriptor 3:    00 00 00 fd 00 30 46 78 78 1e 01 0a 20 20 20 20 20 20
descriptor 4:    00 00 00 fc 00 50 4c 32 37 39 32 51 0a 20 20 20 20 20
extensions:      01
checksum:        fd

EDID version: 1.4
Manufacturer: IVM Model 6637 Serial Number --
Made in week 43 of 2020
Digital display
10 bits per primary color channel
DisplayPort interface
Maximum image size: 60 cm x 34 cm
Gamma: 2.20
DPMS levels: Standby Suspend Off
Supported color formats: RGB 4:4:4, YCrCb 4:4:4, YCrCb 4:2:2
First detailed timing includes the native pixel format and preferred refresh rate
Display is continuous frequency
Display x,y Chromaticity:
  Red:   0.6679, 0.3320
  Green: 0.2998, 0.6250
  Blue:  0.1425, 0.0517
  White: 0.3134, 0.3291
Established timings supported:
  640x480@60Hz 4:3 HorFreq: 31469 Hz Clock: 25.175 MHz
  800x600@60Hz 4:3 HorFreq: 37900 Hz Clock: 40.000 MHz
  1024x768@60Hz 4:3 HorFreq: 48400 Hz Clock: 65.000 MHz
Standard timings supported:
  1440x900@60Hz 16:10 HorFreq: 55500 Hz Clock: 88.750 MHz
  1600x900@60Hz 16:9
  1600x1200@60Hz 4:3 HorFreq: 75000 Hz Clock: 162.000 MHz
  1680x1050@60Hz 16:10 HorFreq: 64700 Hz Clock: 119.000 MHz
  1920x1080@60Hz 16:9
  1920x1080@70Hz 16:9
  2048x1280@60Hz 16:10
  1280x1024@60Hz 5:4 HorFreq: 64000 Hz Clock: 108.000 MHz
Detailed mode: Clock 241.500 MHz, 597 mm x 336 mm
               2560 2608 2640 2720 hborder 0
               1440 1443 1448 1481 vborder 0
               +hsync -vsync 
               VertFreq: 59 Hz, HorFreq: 88786 Hz
Serial number: --
Monitor ranges (bare limits): 48-70Hz V, 120-120kHz H, max dotclock 300MHz
Monitor name: PL2792Q
Has 1 extension blocks
Checksum: 0xfd (valid)

CTA extension block
Extension version: 3
20 bytes of CTA data
  Video data block
    VIC  16 1920x1080@60Hz 16:9  HorFreq: 67500 Hz Clock: 148.500 MHz
    VIC   5 1920x1080i@60Hz 16:9  HorFreq: 33750 Hz Clock: 74.250 MHz
    VIC   4 1280x720@60Hz 16:9  HorFreq: 45000 Hz Clock: 74.250 MHz
    VIC   3 720x480@60Hz 16:9  HorFreq: 31469 Hz Clock: 27.000 MHz
    VIC   2 720x480@60Hz 4:3  HorFreq: 31469 Hz Clock: 27.000 MHz
    VIC   1 640x480@60Hz 4:3  HorFreq: 31469 Hz Clock: 25.175 MHz
    VIC  17 720x576@50Hz 4:3  HorFreq: 31250 Hz Clock: 27.000 MHz
    VIC  18 720x576@50Hz 16:9  HorFreq: 31250 Hz Clock: 27.000 MHz
    VIC  19 1280x720@50Hz 16:9  HorFreq: 37500 Hz Clock: 74.250 MHz
    VIC  20 1920x1080i@50Hz 16:9  HorFreq: 28125 Hz Clock: 74.250 MHz
    VIC  31 1920x1080@50Hz 16:9  HorFreq: 56250 Hz Clock: 148.500 MHz
  Audio data block
    Linear PCM, max channels 2
      Supported sample rates (kHz): 48 44.1 32
      Supported sample sizes (bits): 24 20 16
  Speaker allocation data block
    Speaker map:
      FL/FR - Front Left/Right
Underscans PC formats by default
Basic audio support
Supports YCbCr 4:4:4
Supports YCbCr 4:2:2
1 native detailed modes
Detailed mode: Clock 274.680 MHz, 597 mm x 336 mm
               2560 2568 2600 2640 hborder 0
               1440 1474 1482 1488 vborder 0
               +hsync -vsync 
               VertFreq: 69 Hz, HorFreq: 104045 Hz
Checksum: 0x62 (valid)

Warning: One or more of the timings is out of range of the Monitor Ranges:
  Vertical Freq: 50 - 70 Hz
  Horizontal Freq: 28125 - 104045 Hz
  Maximum Clock: 274.680 MHz
EDID block does not conform at all!
	Both the serial number and the serial string are set


