edid-decode (hex):

00 ff ff ff ff ff ff 00 26 cd 37 66 4d 05 00 00
2b 1d 01 04 b5 3c 22 78 fb 0c 95 ab 55 4c a0 24
0d 50 54 21 08 00 95 00 a9 c0 a9 40 b3 00 d1 c0
d1 ca e1 00 81 80 56 5e 00 a0 a0 a0 29 50 30 20
35 00 55 50 21 00 00 1a 00 00 00 ff 00 31 31 35
32 31 39 34 33 30 31 33 35 37 00 00 00 fd 00 30
46 78 78 1e 01 0a 20 20 20 20 20 20 00 00 00 fc
00 50 4c 32 37 39 32 51 0a 20 20 20 20 20 01 5f

----------------

Block 0, Base EDID:
  EDID Structure Version & Revision: 1.4
  Vendor & Product Identification:
    Manufacturer: IVM
    Model: 26167
    Serial Number: ...
    Made in: week 43 of 2019
  Basic Display Parameters & Features:
    Digital display
    Bits per primary color channel: 10
    DisplayPort interface
    Maximum image size: 60 cm x 34 cm
    Gamma: 2.20
    DPMS levels: Standby Suspend Off
    Supported color formats: RGB 4:4:4, YCrCb 4:4:4, YCrCb 4:2:2
    First detailed timing includes the native pixel format and preferred refresh rate
    Display is continuous frequency
  Color Characteristics:
    Red  : 0.6679, 0.3320
    Green: 0.2998, 0.6250
    Blue : 0.1425, 0.0517
    White: 0.3134, 0.3291
  Established Timings I & II:
    DMT 0x04:   640x480    59.940 Hz   4:3    31.469 kHz  25.175 MHz
    DMT 0x09:   800x600    60.317 Hz   4:3    37.879 kHz  40.000 MHz
    DMT 0x10:  1024x768    60.004 Hz   4:3    48.363 kHz  65.000 MHz
  Standard Timings:
    DMT 0x2f:  1440x900    59.887 Hz  16:10   55.935 kHz 106.500 MHz
    DMT 0x53:  1600x900    60.000 Hz  16:9    60.000 kHz 108.000 MHz (RB)
    DMT 0x33:  1600x1200   60.000 Hz   4:3    75.000 kHz 162.000 MHz
    DMT 0x3a:  1680x1050   59.954 Hz  16:10   65.290 kHz 146.250 MHz
    DMT 0x52:  1920x1080   60.000 Hz  16:9    67.500 kHz 148.500 MHz
    CVT     :  1920x1080   69.920 Hz  16:9    78.800 kHz 204.250 MHz (EDID 1.4 source)
    GTF     :  1920x1080   70.000 Hz  16:9    78.680 kHz 205.197 MHz (EDID 1.3 source)
    CVT     :  2048x1280   59.962 Hz  16:10   79.570 kHz 220.250 MHz (EDID 1.4 source)
    GTF     :  2048x1280   60.000 Hz  16:10   79.500 kHz 221.328 MHz (EDID 1.3 source)
    DMT 0x23:  1280x1024   60.020 Hz   5:4    63.981 kHz 108.000 MHz
  Detailed Timing Descriptors:
    DTD 1:  2560x1440   59.951 Hz  16:9    88.787 kHz 241.500 MHz (597 mm x 336 mm)
                 Hfront   48 Hsync  32 Hback  80 Hpol P
                 Vfront    3 Vsync   5 Vback  33 Vpol N
    Display Product Serial Number: ...
  Display Range Limits:
    Monitor ranges (Bare Limits): 48-70 Hz V, 120-120 kHz H, max dotclock 300 MHz
    Display Product Name: 'PL2792Q'
  Extension blocks: 1
Checksum: 0x5f

----------------

Warnings:

EDID:
  Base EDID: Some timings are out of range of the Monitor Ranges:
    Horizontal Freq: 31.468 - 88.786 kHz (Monitor: 120.000 - 120.000 kHz)

Failures:

Block 0, Base EDID:
  Base EDID: EDID specified 1 extension block(s), but found 0 extension block(s).
EDID:
  Base EDID: GTF timings are used, but the EDID does not signal GTF support.
  Base EDID: CVT timings are used, but the EDID does not signal CVT support.

EDID conformity: FAIL
