
EDID (hex):
00ffffffffffff0038702d0000000000
011c010495221378036850985c588e28
1b505400000001010101010101010101
0101010101011a3680a070381f403020
350058c21000001a1a3680a070384942
3020350058c21000001a000000fd0028
3c43430e010a202020202020000000fe
004c4d3135364c462d434c30330a00e7

Extracted contents:
header:          00 ff ff ff ff ff ff 00
serial number:   38 70 2d 00 00 00 00 00 01 1c
version:         01 04
basic params:    95 22 13 78 03
chroma info:     68 50 98 5c 58 8e 28 1b 50 54
established:     00 00 00
standard:        01 01 01 01 01 01 01 01 01 01 01 01 01 01 01 01
descriptor 1:    1a 36 80 a0 70 38 1f 40 30 20 35 00 58 c2 10 00 00 1a
descriptor 2:    1a 36 80 a0 70 38 49 42 30 20 35 00 58 c2 10 00 00 1a
descriptor 3:    00 00 00 fd 00 28 3c 43 43 0e 01 0a 20 20 20 20 20 20
descriptor 4:    00 00 00 fe 00 4c 4d 31 35 36 4c 46 2d 43 4c 30 33 0a
extensions:      00
checksum:        e7

EDID version: 1.4
Manufacturer: NCP Model 2d Serial Number --
Made in week 1 of 2018
Digital display
6 bits per primary color channel
DisplayPort interface
Maximum image size: 34 cm x 19 cm
Gamma: 2.20
Supported color formats: RGB 4:4:4
First detailed timing includes the native pixel format and preferred refresh rate
Display is continuous frequency
Display x,y Chromaticity:
  Red:   0.5947, 0.3613
  Green: 0.3457, 0.5546
  Blue:  0.1572, 0.1064
  White: 0.3125, 0.3281
Established timings supported:
Standard timings supported:
Detailed mode: Clock 138.500 MHz, 344 mm x 194 mm
               1920 1968 2000 2080 hborder 0
               1080 1083 1088 1111 vborder 0
               +hsync -vsync 
               VertFreq: 59 Hz, HorFreq: 66586 Hz
Detailed mode: Clock 138.500 MHz, 344 mm x 194 mm
               1920 1968 2000 2080 hborder 0
               1080 1083 1088 1665 vborder 0
               +hsync -vsync 
               VertFreq: 39 Hz, HorFreq: 66586 Hz
Monitor ranges (bare limits): 40-60Hz V, 67-67kHz H, max dotclock 140MHz
ASCII string: LM156LF-CL03
Checksum: 0xe7 (valid)
EDID block does NOT conform to EDID 1.4!
	Missing name descriptor
Warning: One or more of the timings is out of range of the Monitor Ranges:
  Vertical Freq: 39 - 59 Hz
  Horizontal Freq: 66586 - 66586 Hz
  Maximum Clock: 138.500 MHz
