edid-decode (hex):

00 ff ff ff ff ff ff 00 30 ae 51 90 00 00 00 00
00 1d 01 04 a5 22 13 78 03 6e 85 93 58 58 92 28
1e 50 54 00 00 00 01 01 01 01 01 01 01 01 01 01
01 01 01 01 01 01 d9 40 80 18 72 38 2e 40 6c 30
aa 00 58 c2 10 00 00 18 00 00 00 0f 00 28 3c 44
44 0e 00 00 00 00 00 00 00 20 00 00 00 fd 00 4c
45 4e 4f 56 4f 0a 20 20 20 20 20 20 00 00 00 fe
00 4c 45 4e 31 35 36 46 48 44 20 20 20 20 00 2f

00 ff ff ff ff ff ff 00 30 ae 51 90 00 00 00 00
00 1d 01 04 a5 22 13 78 03 6e 85 93 58 58 92 28
1e 50 54 00 00 00 01 01 01 01 01 01 01 01 01 01
01 01 01 01 01 01 d9 40 80 18 72 38 2e 40 6c 30
aa 00 58 c2 10 00 00 18 00 00 00 0f 00 28 3c 44
44 0e 00 00 00 00 00 00 00 20 00 00 00 fd 00 4c
45 4e 4f 56 4f 0a 20 20 20 20 20 20 00 00 00 fe
00 4c 45 4e 31 35 36 46 48 44 20 20 20 20 00 2f

----------------

Block 0, Base EDID:
  EDID Structure Version & Revision: 1.4
  Vendor & Product Identification:
    Manufacturer: LEN
    Model: 36945
    Made in: 2019
  Basic Display Parameters & Features:
    Digital display
    Bits per primary color channel: 8
    DisplayPort interface
    Maximum image size: 34 cm x 19 cm
    Gamma: 2.20
    Supported color formats: RGB 4:4:4
    First detailed timing includes the native pixel format and preferred refresh rate
    Display is continuous frequency
  Color Characteristics:
    Red  : 0.5751, 0.3457
    Green: 0.3466, 0.5722
    Blue : 0.1582, 0.1171
    White: 0.3134, 0.3291
  Established Timings I & II: none
  Standard Timings: none
  Detailed Timing Descriptors:
    DTD 1:  1920x1080   60.029883 Hz  16:9     67.594 kHz    166.010000 MHz (344 mm x 194 mm)
                 Hfront  108 Hsync  48 Hback  380 Hpol N
                 Vfront   10 Vsync  10 Vback   26 Vpol N
    Manufacturer-Specified Display Descriptor (0x0f): 00 0f 00 28 3c 44 44 0e 00 00 00 00 00 00 00 20 '...(<DD........ '
    Display Range Limits:
      Monitor ranges (Unknown (0x4f)): 76-69 Hz V, 78-79 kHz H, max dotclock 860 MHz
    Alphanumeric Data String: 'LEN156FHD    '
Checksum: 0x2f

----------------

Block 1, Unknown EDID Extension Block 0x00:
  00 ff ff ff ff ff ff 00 30 ae 51 90 00 00 00 00 '........0.Q.....'
  00 1d 01 04 a5 22 13 78 03 6e 85 93 58 58 92 28 '.....".x.n..XX.('
  1e 50 54 00 00 00 01 01 01 01 01 01 01 01 01 01 '.PT.............'
  01 01 01 01 01 01 d9 40 80 18 72 38 2e 40 6c 30 '.......@..r8.@l0'
  aa 00 58 c2 10 00 00 18 00 00 00 0f 00 28 3c 44 '..X..........(<D'
  44 0e 00 00 00 00 00 00 00 20 00 00 00 fd 00 4c 'D........ .....L'
  45 4e 4f 56 4f 0a 20 20 20 20 20 20 00 00 00 fe 'ENOVO.      ....'
  00 4c 45 4e 31 35 36 46 48 44 20 20 20 20 00 2f '.LEN156FHD    ./'
Checksum: 0x2f

----------------

Warnings:

Block 0, Base EDID:
  Missing Display Product Name.
EDID:
  Base EDID: Some timings are out of range of the Monitor Ranges:
    Vertical Freq: 60.030 - 60.030 Hz (Monitor: 76.000 - 69.000 Hz)
    Horizontal Freq: 67.593 - 67.593 kHz (Monitor: 78.000 - 79.000 kHz)

Failures:

Block 0, Base EDID:
  Display Range Limits: Unknown range class (0x4f).
  Display Range Limits: Min vertical rate > max vertical rate.
  Alphanumeric Data String: One or more trailing spaces.
Block 1, Base EDID:
  Unknown Extension Block.
EDID:
  Base EDID: EDID specified 0 extension block(s), but found 1 extension block(s).

EDID conformity: FAIL
