
EDID (hex):
00ffffffffffff001c540043ffffffff
141f0103803c22783ac6a5b14d38b626
115054254a00714f81c081408180d1c0
d1fc9500b30008e80030f2705a80b058
8a00ad113200001a000000fd0030781e
873c000a202020202020000000fc0041
4f5255532046563433550a20000000ff
003231323030423030303630300a02ae
020351f24c61760311121304292f1f90
3f230907078301000067030c00100038
3c6dd85dc401788833003090c3350c6d
1a0000020b3090ec0f8c158015e305c3
01e20f01e20e76e6060d018c8012e200
d53ec200a0a0a0555030203500ad1132
00001e565e00a0a0a0295030203500ad
113200001e00000000000000000000ec
701279000003013cb9fd0184ff0e4f00
07801f006f089900450007005fe80004
ff0977001b801f009f05660008000700
d48900047f07c70043801f0037044c00
3e000700000000000000000000000000
00000000000000000000000000000000
00000000000000000000000000000000
0000000000000000000000000000a390

Extracted contents:
header:          00 ff ff ff ff ff ff 00
serial number:   1c 54 00 43 ff ff ff ff 14 1f
version:         01 03
basic params:    80 3c 22 78 3a
chroma info:     c6 a5 b1 4d 38 b6 26 11 50 54
established:     25 4a 00
standard:        71 4f 81 c0 81 40 81 80 d1 c0 d1 fc 95 00 b3 00
descriptor 1:    08 e8 00 30 f2 70 5a 80 b0 58 8a 00 ad 11 32 00 00 1a
descriptor 2:    00 00 00 fd 00 30 78 1e 87 3c 00 0a 20 20 20 20 20 20
descriptor 3:    00 00 00 fc 00 41 4f 52 55 53 20 46 56 34 33 55 0a 20
descriptor 4:    00 00 00 ff 00 32 31 32 30 30 42 30 30 30 36 30 30 0a
extensions:      02
checksum:        ae

EDID version: 1.3
Manufacturer: GBT Model 4300 Serial Number --
Made in week 20 of 2021
Digital display
Maximum image size: 60 cm x 34 cm
Gamma: 2.20
DPMS levels: Off
Undefined display color type
First detailed timing is preferred timing
Display x,y Chromaticity:
  Red:   0.6943, 0.3007
  Green: 0.2197, 0.7128
  Blue:  0.1503, 0.0683
  White: 0.3134, 0.3291
Established timings supported:
  640x480@60Hz 4:3 HorFreq: 31469 Hz Clock: 25.175 MHz
  640x480@75Hz 4:3 HorFreq: 37500 Hz Clock: 31.500 MHz
  800x600@60Hz 4:3 HorFreq: 37900 Hz Clock: 40.000 MHz
  800x600@75Hz 4:3 HorFreq: 46900 Hz Clock: 49.500 MHz
  1024x768@60Hz 4:3 HorFreq: 48400 Hz Clock: 65.000 MHz
  1024x768@75Hz 4:3 HorFreq: 60000 Hz Clock: 78.750 MHz
Standard timings supported:
  1152x864@75Hz 4:3 HorFreq: 67500 Hz Clock: 108.000 MHz
  1280x720@60Hz 16:9
  1280x960@60Hz 4:3 HorFreq: 60000 Hz Clock: 108.000 MHz
  1280x1024@60Hz 5:4 HorFreq: 64000 Hz Clock: 108.000 MHz
  1920x1080@60Hz 16:9
  1920x1080@120Hz 16:9
  1440x900@60Hz 16:10 HorFreq: 55500 Hz Clock: 88.750 MHz
  1680x1050@60Hz 16:10 HorFreq: 64700 Hz Clock: 119.000 MHz
Detailed mode: Clock 594.000 MHz, 941 mm x 529 mm
               3840 4016 4104 4400 hborder 0
               2160 2168 2178 2250 vborder 0
               +hsync -vsync 
               VertFreq: 60 Hz, HorFreq: 135000 Hz
Monitor ranges (GTF): 48-120Hz V, 30-135kHz H, max dotclock 600MHz
Monitor name: AORUS FV43U
Serial number: --
Has 2 extension blocks
Checksum: 0xae (valid)

CTA extension block
Extension version: 3
77 bytes of CTA data
  Video data block
    VIC  97 3840x2160@60Hz 16:9  HorFreq: 135000 Hz Clock: 594.000 MHz
    VIC 118 3840x2160@120Hz 16:9  HorFreq: 270000 Hz Clock: 1188.000 MHz
    VIC   3 720x480@60Hz 16:9  HorFreq: 31469 Hz Clock: 27.000 MHz
    VIC  17 720x576@50Hz 4:3  HorFreq: 31250 Hz Clock: 27.000 MHz
    VIC  18 720x576@50Hz 16:9  HorFreq: 31250 Hz Clock: 27.000 MHz
    VIC  19 1280x720@50Hz 16:9  HorFreq: 37500 Hz Clock: 74.250 MHz
    VIC   4 1280x720@60Hz 16:9  HorFreq: 45000 Hz Clock: 74.250 MHz
    VIC  41 1280x720@100Hz 16:9  HorFreq: 75000 Hz Clock: 148.500 MHz
    VIC  47 1280x720@120Hz 16:9  HorFreq: 90000 Hz Clock: 148.500 MHz
    VIC  31 1920x1080@50Hz 16:9  HorFreq: 56250 Hz Clock: 148.500 MHz
    VIC  16 1920x1080@60Hz 16:9 (native) HorFreq: 67500 Hz Clock: 148.500 MHz
    VIC  63 1920x1080@120Hz 16:9  HorFreq: 135000 Hz Clock: 297.000 MHz
  Audio data block
    Linear PCM, max channels 2
      Supported sample rates (kHz): 48 44.1 32
      Supported sample sizes (bits): 24 20 16
  Speaker allocation data block
    Speaker map:
      FL/FR - Front Left/Right
  Vendor-specific data block, OUI 000c03 (HDMI)
    Source physical address 1.0.0.0
    DC_36bit
    DC_30bit
    DC_Y444
    Maximum TMDS clock: 300MHz
  Vendor-specific data block, OUI c45dd8 (HDMI Forum)
    Version: 1
    Maximum TMDS Character Rate: 600MHz
    SCDC Present
    Supports scrambling for <= 340 Mcsc
    Supports 12-bits/component Deep Color 4:2:0 Pixel Encoding
    Supports 10-bits/component Deep Color 4:2:0 Pixel Encoding
  Vendor-specific data block, OUI 00001a
  Extended tag: Colorimetry data block
    xvYCC601
    xvYCC709
    BT2020YCC
    BT2020RGB
  Extended tag: YCbCr 4:2:0 capability map data block
    VSD Index 0
  Extended tag: YCbCr 4:2:0 video data block
    VIC 118 3840x2160@120Hz 16:9  HorFreq: 270000 Hz Clock: 594.000 MHz
  Extended tag: HDR static metadata data block
    Electro optical transfer functions:
      Traditional gamma - SDR luminance range
      SMPTE ST2084
      Hybrid Log-Gamma
    Supported static metadata descriptors:
      Static metadata type 1
    Desired content max luminance: 140 (1037.472 cd/m^2)
    Desired content max frame-average luminance: 128 (800.000 cd/m^2)
    Desired content min luminance: 18 (0.052 cd/m^2)
  Extended tag: Video capability data block
    YCbCr quantization: Selectable (via AVI YQ) (1)
    RGB quantization: Selectable (via AVI Q) (1)
    PT scan behaviour: Always Overscannned (1)
    IT scan behaviour: Always Overscannned (1)
    CE scan behaviour: Always Overscannned (1)
Underscans PC formats by default
Basic audio support
Supports YCbCr 4:4:4
Supports YCbCr 4:2:2
2 native detailed modes
Detailed mode: Clock 497.260 MHz, 941 mm x 529 mm
               2560 2608 2640 2720 hborder 0
               1440 1443 1448 1525 vborder 0
               +hsync +vsync 
               VertFreq: 119 Hz, HorFreq: 182816 Hz
Detailed mode: Clock 241.500 MHz, 941 mm x 529 mm
               2560 2608 2640 2720 hborder 0
               1440 1443 1448 1481 vborder 0
               +hsync +vsync 
               VertFreq: 59 Hz, HorFreq: 88786 Hz
Checksum: 0xec (valid)


DisplayID extension block
Extension version: 18
Length 121, version 18, extension count 0
Checksum: 0xa3 (valid)
Type 1 detailed timing: aspect: 16:9, Preferred  
Detailed mode: Clock 1304.890 MHz, 0 mm x 0 mm
               3839 3846 3877 3918
               2159 2228 2235 2312
               +hsync -vsync
Type 1 detailed timing: aspect: 16:9,  
Detailed mode: Clock 594.870 MHz, 0 mm x 0 mm
               2559 2586 2617 2678
               1439 1447 1454 1541
               +hsync -vsync
Type 1 detailed timing: aspect: 16:9,  
Detailed mode: Clock 352.840 MHz, 0 mm x 0 mm
               1919 1986 2017 2118
               1079 1141 1148 1155
               +hsync -vsync

One or more of the timings is out of range of the Monitor Ranges:
  Vertical Freq: 50 - 120 Hz
  Horizontal Freq: 31250 - 270000 Hz
  Maximum Clock: 1188.000 MHz
EDID block does not conform at all!
	Both the serial number and the serial string are set
