
EDID (hex):
00ffffffffffff0022f09e3001010101
0d180104a5342078263c50a7544da226
105054a1080081009500b3008180a940
81c0d1c00101283c80a070b023403020
360006442100001a000000fd00324c18
5e11000a202020202020000000fc0048
50205a3234690a2020202020000000ff
00434e4b343133303247300a202000e6

Extracted contents:
header:          00 ff ff ff ff ff ff 00
serial number:   22 f0 9e 30 01 01 01 01 0d 18
version:         01 04
basic params:    a5 34 20 78 26
chroma info:     3c 50 a7 54 4d a2 26 10 50 54
established:     a1 08 00
standard:        81 00 95 00 b3 00 81 80 a9 40 81 c0 d1 c0 01 01
descriptor 1:    28 3c 80 a0 70 b0 23 40 30 20 36 00 06 44 21 00 00 1a
descriptor 2:    00 00 00 fd 00 32 4c 18 5e 11 00 0a 20 20 20 20 20 20
descriptor 3:    00 00 00 fc 00 48 50 20 5a 32 34 69 0a 20 20 20 20 20
descriptor 4:    00 00 00 ff 00 43 4e 4b 34 31 33 30 32 47 30 0a 20 20
extensions:      00
checksum:        e6

EDID version: 1.4
Manufacturer: HWP Model 309e Serial Number --
Made in week 13 of 2014
Digital display
8 bits per primary color channel
DisplayPort interface
Maximum image size: 52 cm x 32 cm
Gamma: 2.20
DPMS levels: Off
Supported color formats: RGB 4:4:4
Default (sRGB) color space is primary color space
First detailed timing includes the native pixel format and preferred refresh rate
Display x,y Chromaticity:
  Red:   0.6523, 0.3310
  Green: 0.3037, 0.6328
  Blue:  0.1494, 0.0634
  White: 0.3125, 0.3281
Established timings supported:
  720x400@70Hz 9:5 HorFreq: 31469 Hz Clock: 28.320 MHz
  640x480@60Hz 4:3 HorFreq: 31469 Hz Clock: 25.175 MHz
  800x600@60Hz 4:3 HorFreq: 37900 Hz Clock: 40.000 MHz
  1024x768@60Hz 4:3 HorFreq: 48400 Hz Clock: 65.000 MHz
Standard timings supported:
  1280x800@60Hz 16:10
  1440x900@60Hz 16:10 HorFreq: 55500 Hz Clock: 88.750 MHz
  1680x1050@60Hz 16:10 HorFreq: 64700 Hz Clock: 119.000 MHz
  1280x1024@60Hz 5:4 HorFreq: 64000 Hz Clock: 108.000 MHz
  1600x1200@60Hz 4:3 HorFreq: 75000 Hz Clock: 162.000 MHz
  1280x720@60Hz 16:9
  1920x1080@60Hz 16:9
Detailed mode: Clock 154.000 MHz, 518 mm x 324 mm
               1920 1968 2000 2080 hborder 0
               1200 1203 1209 1235 vborder 0
               +hsync -vsync 
               VertFreq: 59 Hz, HorFreq: 74038 Hz
Monitor ranges (GTF): 50-76Hz V, 24-94kHz H, max dotclock 170MHz
Monitor name: HP Z24i
Serial number: --
Checksum: 0xe6 (valid)
EDID block does NOT conform to EDID 1.4!
	sRGB is signaled, but the chromaticities do not match


