
EDID (hex):
00ffffffffffff000daf261500000000
09100103802115780ac6a99a574e8526
1e505200000001010101010101010101
010101010101bc1b00a0502017303020
36004bcf10000018000000fe004e3135
3449322d4c30320a2020000000fe0043
4d4f0a202020202020202020000000fe
004e31353449322d4c30320a20200088

Extracted contents:
header:          00 ff ff ff ff ff ff 00
serial number:   0d af 26 15 00 00 00 00 09 10
version:         01 03
basic params:    80 21 15 78 0a
chroma info:     c6 a9 9a 57 4e 85 26 1e 50 52
established:     00 00 00
standard:        01 01 01 01 01 01 01 01 01 01 01 01 01 01 01 01
descriptor 1:    bc 1b 00 a0 50 20 17 30 30 20 36 00 4b cf 10 00 00 18
descriptor 2:    00 00 00 fe 00 4e 31 35 34 49 32 2d 4c 30 32 0a 20 20
descriptor 3:    00 00 00 fe 00 43 4d 4f 0a 20 20 20 20 20 20 20 20 20
descriptor 4:    00 00 00 fe 00 4e 31 35 34 49 32 2d 4c 30 32 0a 20 20
extensions:      00
checksum:        88

EDID version: 1.3
Manufacturer: CMO Model 1526 Serial Number --
Made in week 9 of 2006
Digital display
Maximum image size: 33 cm x 21 cm
Gamma: 2.20
RGB color display
First detailed timing is preferred timing
Display x,y Chromaticity:
  Red:   0.6044, 0.3398
  Green: 0.3056, 0.5214
  Blue:  0.1503, 0.1191
  White: 0.3144, 0.3212
Established timings supported:
Standard timings supported:
Detailed mode: Clock 71.000 MHz, 331 mm x 207 mm
               1280 1328 1360 1440 hborder 0
                800  803  809  823 vborder 0
               -hsync -vsync 
               VertFreq: 59 Hz, HorFreq: 49305 Hz
ASCII string: N154I2-L02
ASCII string: CMO
ASCII string: N154I2-L02
Checksum: 0x88 (valid)
EDID block does NOT conform to EDID 1.3!
	Missing name descriptor
	Missing monitor ranges
