edid-decode (hex):

00 ff ff ff ff ff ff 00 22 f0 51 28 01 01 01 01
2f 13 01 03 68 29 17 78 ea 75 a5 9c 54 51 96 27
18 50 54 a1 08 00 81 40 81 80 01 01 01 01 01 01
01 01 01 01 01 01 66 21 56 aa 51 00 1e 30 46 8f
33 00 9a e6 10 00 00 1e 00 00 00 fd 00 32 4c 1e
41 0b 00 0a 20 20 20 20 20 20 00 00 00 fc 00 43
6f 6d 70 61 71 20 43 51 31 38 35 39 00 00 00 ff
00 43 4e 54 39 34 37 34 38 34 30 0a 20 20 00 c7

----------------

Block 0, Base EDID:
  EDID Structure Version & Revision: 1.3
  Vendor & Product Identification:
    Manufacturer: HWP
    Model: 10321
    Serial Number: ...
    Made in: week 47 of 2009
  Basic Display Parameters & Features:
    Analog display
    Input voltage level: 0.7/0.7 V
    Blank level equals black level
    Sync: Separate
    Maximum image size: 41 cm x 23 cm
    Gamma: 2.20
    DPMS levels: Standby Suspend Off
    RGB color display
    First detailed timing is the preferred timing
  Color Characteristics:
    Red  : 0.6103, 0.3310
    Green: 0.3173, 0.5869
    Blue : 0.1542, 0.0957
    White: 0.3134, 0.3291
  Established Timings I & II:
    IBM     :   720x400    70.082 Hz   9:5    31.467 kHz  28.320 MHz
    DMT 0x04:   640x480    59.940 Hz   4:3    31.469 kHz  25.175 MHz
    DMT 0x09:   800x600    60.317 Hz   4:3    37.879 kHz  40.000 MHz
    DMT 0x10:  1024x768    60.004 Hz   4:3    48.363 kHz  65.000 MHz
  Standard Timings:
    DMT 0x20:  1280x960    60.000 Hz   4:3    60.000 kHz 108.000 MHz
    DMT 0x23:  1280x1024   60.020 Hz   5:4    63.981 kHz 108.000 MHz
  Detailed Timing Descriptors:
    DTD 1:  1366x768    59.790 Hz 683:384  47.712 kHz  85.500 MHz (410 mm x 230 mm)
                 Hfront   70 Hsync 143 Hback 213 Hpol P
                 Vfront    3 Vsync   3 Vback  24 Vpol P
  Display Range Limits:
    Monitor ranges (GTF): 50-76 Hz V, 30-65 kHz H, max dotclock 110 MHz
    Display Product Name: 'Compaq CQ1859'
    Display Product Serial Number: ...
Checksum: 0xc7

----------------

EDID conformity: PASS
