edid-decode (hex):

00 ff ff ff ff ff ff 00 15 c3 45 16 00 00 00 00
24 0c 01 02 80 24 1d 78 ea e6 9b a3 54 4a 99 26
0f 4c 50 a1 08 00 81 80 71 40 01 01 01 01 01 01
01 01 01 01 01 01 30 2a 00 98 51 00 2a 40 30 70
13 00 67 20 11 00 00 1e 00 00 00 ff 00 39 36 32
30 38 30 39 32 0a 20 20 20 20 00 00 00 fd 00 3b
3d 1b 41 0b 00 0a 20 20 20 20 20 20 00 00 00 fc
00 4c 36 38 35 0a 20 20 20 20 20 20 20 20 00 0c

00 ff ff ff ff ff ff 00 15 c3 45 16 00 00 00 00
24 0c 01 02 80 24 1d 78 ea e6 9b a3 54 4a 99 26
0f 4c 50 a1 08 00 81 80 71 40 01 01 01 01 01 01
01 01 01 01 01 01 30 2a 00 98 51 00 2a 40 30 70
13 00 67 20 11 00 00 1e 00 00 00 ff 00 39 36 32
30 38 30 39 32 0a 20 20 20 20 00 00 00 fd 00 3b
3d 1b 41 0b 00 0a 20 20 20 20 20 20 00 00 00 fc
00 4c 36 38 35 0a 20 20 20 20 20 20 20 20 00 0c

----------------

Block 0, Base EDID:
  EDID Structure Version & Revision: 1.2
  Vendor & Product Identification:
    Manufacturer: ENC
    Model: 5701
    Made in: week 36 of 2002
  Basic Display Parameters & Features:
    Digital display
    Maximum image size: 36 cm x 29 cm
    Gamma: 2.20
    DPMS levels: Standby Suspend Off
    RGB color display
    First detailed timing is the preferred timing
  Color Characteristics:
    Red  : 0.6396, 0.3300
    Green: 0.2900, 0.5996
    Blue : 0.1503, 0.0595
    White: 0.2988, 0.3154
  Established Timings I & II:
    IBM     :   720x400    70.081663 Hz   9:5     31.467 kHz     28.320000 MHz
    DMT 0x04:   640x480    59.940476 Hz   4:3     31.469 kHz     25.175000 MHz
    DMT 0x09:   800x600    60.316541 Hz   4:3     37.879 kHz     40.000000 MHz
    DMT 0x10:  1024x768    60.003840 Hz   4:3     48.363 kHz     65.000000 MHz
  Standard Timings:
    DMT 0x23:  1280x1024   60.019740 Hz   5:4     63.981 kHz    108.000000 MHz
    GTF     :  1152x864    60.000000 Hz   4:3     53.700 kHz     81.624000 MHz
  Detailed Timing Descriptors:
    DTD 1:  1280x1024   60.019740 Hz   5:4     63.981 kHz    108.000000 MHz (359 mm x 288 mm)
                 Hfront   48 Hsync 112 Hback  248 Hpol P
                 Vfront    1 Vsync   3 Vback   38 Vpol P
    Display Product Serial Number: ...
    Display Range Limits:
      Monitor ranges (GTF): 59-61 Hz V, 27-65 kHz H, max dotclock 110 MHz
    Display Product Name: 'L685'
Checksum: 0x0c

----------------

Block 1, Unknown EDID Extension Block 0x00:
  00 ff ff ff ff ff ff 00 15 c3 45 16 00 00 00 00 '..........E.....'
  24 0c 01 02 80 24 1d 78 ea e6 9b a3 54 4a 99 26 '$....$.x....TJ.&'
  0f 4c 50 a1 08 00 81 80 71 40 01 01 01 01 01 01 '.LP.....q@......'
  01 01 01 01 01 01 30 2a 00 98 51 00 2a 40 30 70 '......0*..Q.*@0p'
  13 00 67 20 11 00 00 1e 00 00 00 ff 00 39 36 32 '..g .........962'
  30 38 30 39 32 0a 20 20 20 20 00 00 00 fd 00 3b '08092.    .....;'
  3d 1b 41 0b 00 0a 20 20 20 20 20 20 00 00 00 fc '=.A...      ....'
  00 4c 36 38 35 0a 20 20 20 20 20 20 20 20 00 0c '.L685.        ..'
Checksum: 0x0c

----------------

Warnings:

Block 0, Base EDID:
  EDID Structure Version & Revision: EDID 1.2 is deprecated, do not use.

Failures:

Block 1, Base EDID:
  Unknown Extension Block.
EDID:
  Base EDID: Some timings are out of range of the Monitor Ranges:
    Vertical Freq: 59.940 - 70.082 Hz (Monitor: 59.000 - 61.000 Hz)
  Base EDID: EDID specified 0 extension block(s), but found 1 extension block(s).

EDID conformity: FAIL
