edid-decode (hex):

00 ff ff ff ff ff ff 00 06 10 1d 92 38 04 fe 02
23 0f 01 03 80 2b 1b 78 2e c9 01 a3 57 4b 9c 25
12 50 54 00 00 00 b3 00 01 01 01 01 01 01 01 01
01 01 01 01 01 01 7c 2e 90 a0 60 1a 1e 40 30 20
36 00 b1 0e 11 00 00 1a 00 00 00 fc 00 43 69 6e
65 6d 61 20 44 69 73 70 6c 61 00 00 00 fc 00 79
0a 00 00 00 00 00 00 00 00 00 00 00 00 00 00 00
00 00 00 00 00 00 00 00 00 00 00 00 00 00 01 b4

40 01 02 00 00 00 00 76 00 01 a5 00 ff ff 03 1a
1a a8 01 00 00 00 00 00 40 00 00 00 00 00 00 00
00 00 00 00 00 00 00 00 00 00 00 00 00 00 00 00
00 00 00 00 00 00 00 00 00 00 00 00 00 00 00 00
00 00 00 00 00 00 00 00 00 00 00 00 00 00 00 00
00 00 00 00 00 00 00 00 00 00 00 00 00 00 00 00
00 00 00 00 00 00 00 00 00 00 00 00 00 00 00 00
00 00 00 00 00 00 00 00 00 00 00 00 00 00 00 83

00 ff ff ff ff ff ff 00 06 10 1d 92 38 04 fe 02
23 0f 01 03 80 2b 1b 78 2e c9 01 a3 57 4b 9c 25
12 50 54 00 00 00 b3 00 01 01 01 01 01 01 01 01
01 01 01 01 01 01 7c 2e 90 a0 60 1a 1e 40 30 20
36 00 b1 0e 11 00 00 1a 00 00 00 fc 00 43 69 6e
65 6d 61 20 44 69 73 70 6c 61 00 00 00 fc 00 79
0a 00 00 00 00 00 00 00 00 00 00 00 00 00 00 00
00 00 00 00 00 00 00 00 00 00 00 00 00 00 01 b4

40 01 02 00 00 00 00 76 00 01 a5 00 ff ff 03 1a
1a a8 01 00 00 00 00 00 40 00 00 00 00 00 00 00
00 00 00 00 00 00 00 00 00 00 00 00 00 00 00 00
00 00 00 00 00 00 00 00 00 00 00 00 00 00 00 00
00 00 00 00 00 00 00 00 00 00 00 00 00 00 00 00
00 00 00 00 00 00 00 00 00 00 00 00 00 00 00 00
00 00 00 00 00 00 00 00 00 00 00 00 00 00 00 00
00 00 00 00 00 00 00 00 00 00 00 00 00 00 00 83

----------------

Block 0, Base EDID:
  EDID Structure Version & Revision: 1.3
  Vendor & Product Identification:
    Manufacturer: APP
    Model: 37405
    Serial Number: ...
    Made in: week 35 of 2005
  Basic Display Parameters & Features:
    Digital display
    Maximum image size: 43 cm x 27 cm
    Gamma: 2.20
    DPMS levels: Off
    RGB color display
    Default (sRGB) color space is primary color space
    First detailed timing is the preferred timing
  Color Characteristics:
    Red  : 0.6396, 0.3398
    Green: 0.2949, 0.6103
    Blue : 0.1445, 0.0703
    White: 0.3125, 0.3291
  Established Timings I & II: none
  Standard Timings:
    DMT 0x3a:  1680x1050   59.954250 Hz  16:10    65.290 kHz    146.250000 MHz
  Detailed Timing Descriptors:
    DTD 1:  1680x1050   59.883253 Hz  16:10    64.674 kHz    119.000000 MHz (433 mm x 270 mm)
                 Hfront   48 Hsync  32 Hback   80 Hpol P
                 Vfront    3 Vsync   6 Vback   21 Vpol N
    Display Product Name: 'Cinema Displa'
    Display Product Name: 'y'
    Empty Descriptor
  Extension blocks: 1
Checksum: 0xb4

----------------

Block 1, Display Information Extension Block:
  Version: 1
  Digital Interface:
    Supported Digital Interface: DVI Single Link
    Data Enable Signal Usage Not Available
    Edge of Shift Clock: Use both edges of shift clock
    HDCP is not supported
    Digital Receivers support Double Clocking of Input Data
    Packetized Digital Video is supported
    Data Formats: Unknown (0x00)
    Minimum Pixel Clock Frequency Per Link: 1 MHz
    Maximum Pixel Clock Frequency Per Link: 165 MHz
    Crossover Frequency: None - Single Link
  Display Device:
    Sub-Pixel Layout: Quad Pixel - G at bottom left & top right
    Sub-Pixel Configuration: Unknown (0x1a)
    Sub-Pixel Shape: Unknown (0x1a)
    Horizontal Dot/Pixel Pitch: 1.68 mm
    Vertical Dot/Pixel Pitch: 0.01 mm
    Display Device does not have a Fixed Pixel Format
    View Direction: Not specified
    Display Device uses non-transparent background
    Physical Implementation: Not specified
    Monitor/display does not support DDC/CI
  Display Capabities & Feature Support Set:
    Legacy Modes: Not all VGA/DOS Legacy Timing Modes are supported
    Stereo Video: No direct stereo
    Scaler On Board: No
    Image Centering: No
    Conditional Update: No
    Interlaced Video: No
    Frame Lock: No
    Frame Rate Conversion: Not supported
    Vertical Frequency: Not available
    Horizontal Frequency: 0.64 kHz
    Display/Scan Orientation Definition Type: Not defined
    Screen Orientation: Landscape
    Zero Pixel Location: Upper Left
    Scan Direction: Not defined
    Standalone Projector: No
    Default Color/Luminance Decoding: Not defined
    Preferred Color/Luminance Decoder: Uses Default Decoding
    Color/Luminance Decoding Capabilities: None
    Dithering: No
    Supported Color Bit-Depth of Sub-Channel 0 (Blue): No Information
    Supported Color Bit-Depth of Sub-Channel 1 (Green): No Information
    Supported Color Bit-Depth of Sub-Channel 2 (Red): No Information
    Supported Color Bit-Depth of Sub-Channel 0 (Cb/Pb): No Information
    Supported Color Bit-Depth of Sub-Channel 1 (Y): No Information
    Supported Color Bit-Depth of Sub-Channel 2 (Cr/Pr): No Information
    Aspect Ratio Conversion Modes: None
  Display Transfer Characteristics - Gamma:
    No Display Transfer Characteristics
Checksum: 0x83

----------------

Block 2, Unknown EDID Extension Block 0x00:
  00 ff ff ff ff ff ff 00 06 10 1d 92 38 04 fe 02 '............8...'
  23 0f 01 03 80 2b 1b 78 2e c9 01 a3 57 4b 9c 25 '#....+.x....WK.%'
  12 50 54 00 00 00 b3 00 01 01 01 01 01 01 01 01 '.PT.............'
  01 01 01 01 01 01 7c 2e 90 a0 60 1a 1e 40 30 20 '......|...`..@0 '
  36 00 b1 0e 11 00 00 1a 00 00 00 fc 00 43 69 6e '6............Cin'
  65 6d 61 20 44 69 73 70 6c 61 00 00 00 fc 00 79 'ema Displa.....y'
  0a 00 00 00 00 00 00 00 00 00 00 00 00 00 00 00 '................'
  00 00 00 00 00 00 00 00 00 00 00 00 00 00 01 b4 '................'
Checksum: 0xb4

----------------

Block 3, Display Information Extension Block:
  Version: 1
  Digital Interface:
    Supported Digital Interface: DVI Single Link
    Data Enable Signal Usage Not Available
    Edge of Shift Clock: Use both edges of shift clock
    HDCP is not supported
    Digital Receivers support Double Clocking of Input Data
    Packetized Digital Video is supported
    Data Formats: Unknown (0x00)
    Minimum Pixel Clock Frequency Per Link: 1 MHz
    Maximum Pixel Clock Frequency Per Link: 165 MHz
    Crossover Frequency: None - Single Link
  Display Device:
    Sub-Pixel Layout: Quad Pixel - G at bottom left & top right
    Sub-Pixel Configuration: Unknown (0x1a)
    Sub-Pixel Shape: Unknown (0x1a)
    Horizontal Dot/Pixel Pitch: 1.68 mm
    Vertical Dot/Pixel Pitch: 0.01 mm
    Display Device does not have a Fixed Pixel Format
    View Direction: Not specified
    Display Device uses non-transparent background
    Physical Implementation: Not specified
    Monitor/display does not support DDC/CI
  Display Capabities & Feature Support Set:
    Legacy Modes: Not all VGA/DOS Legacy Timing Modes are supported
    Stereo Video: No direct stereo
    Scaler On Board: No
    Image Centering: No
    Conditional Update: No
    Interlaced Video: No
    Frame Lock: No
    Frame Rate Conversion: Not supported
    Vertical Frequency: Not available
    Horizontal Frequency: 0.64 kHz
    Display/Scan Orientation Definition Type: Not defined
    Screen Orientation: Landscape
    Zero Pixel Location: Upper Left
    Scan Direction: Not defined
    Standalone Projector: No
    Default Color/Luminance Decoding: Not defined
    Preferred Color/Luminance Decoder: Uses Default Decoding
    Color/Luminance Decoding Capabilities: None
    Dithering: No
    Supported Color Bit-Depth of Sub-Channel 0 (Blue): No Information
    Supported Color Bit-Depth of Sub-Channel 1 (Green): No Information
    Supported Color Bit-Depth of Sub-Channel 2 (Red): No Information
    Supported Color Bit-Depth of Sub-Channel 0 (Cb/Pb): No Information
    Supported Color Bit-Depth of Sub-Channel 1 (Y): No Information
    Supported Color Bit-Depth of Sub-Channel 2 (Cr/Pr): No Information
    Aspect Ratio Conversion Modes: None
  Display Transfer Characteristics - Gamma:
    No Display Transfer Characteristics
Checksum: 0x83

----------------

Failures:

Block 0, Base EDID:
  Basic Display Parameters & Features: sRGB is signaled, but the chromaticities do not match.
  Display Product Name: Non-space after newline.
  Empty Descriptor: Use Dummy Descriptor instead of all zeroes.
  Missing Display Range Limits Descriptor.
Block 1, Display Information Extension Block:
  Digital Interface: Bit 6 of byte 0x07 should be 0.
  Digital Interface: Unknown Data Format 0x00.
  Display Device: Unknown Sub-Pixel Configuration 0x1a.
  Display Device: Unknown Sub-Pixel Shape 0x1a.
Block 2, Base EDID:
  Unknown Extension Block.
Block 3, Display Information Extension Block:
  Digital Interface: Bit 6 of byte 0x07 should be 0.
  Digital Interface: Unknown Data Format 0x00.
  Display Device: Unknown Sub-Pixel Configuration 0x1a.
  Display Device: Unknown Sub-Pixel Shape 0x1a.
EDID:
  Base EDID: EDID specified 1 extension block(s), but found 3 extension block(s).
  Base EDID: EDID 1.3 requires a Block Map Extension in Block 1 if there are more than 2 blocks in the EDID.

EDID conformity: FAIL
