
EDID (hex):
00ffffffffffff000469a32645070200
1a130103803722782acbd0a35a49a024
135054bfef00714f0101814081809500
b30001010101283c80a070b023403020
360026542100001a000000ff0039364c
4d54463133323933330a000000fd0032
4b1e5511000a202020202020000000fc
004153555320564b323636480a200009

Extracted contents:
header:          00 ff ff ff ff ff ff 00
serial number:   04 69 a3 26 45 07 02 00 1a 13
version:         01 03
basic params:    80 37 22 78 2a
chroma info:     cb d0 a3 5a 49 a0 24 13 50 54
established:     bf ef 00
standard:        71 4f 01 01 81 40 81 80 95 00 b3 00 01 01 01 01
descriptor 1:    28 3c 80 a0 70 b0 23 40 30 20 36 00 26 54 21 00 00 1a
descriptor 2:    00 00 00 ff 00 39 36 4c 4d 54 46 31 33 32 39 33 33 0a
descriptor 3:    00 00 00 fd 00 32 4b 1e 55 11 00 0a 20 20 20 20 20 20
descriptor 4:    00 00 00 fc 00 41 53 55 53 20 56 4b 32 36 36 48 0a 20
extensions:      00
checksum:        09

EDID version: 1.3
Manufacturer: ACI Model 26a3 Serial Number --
Made in week 26 of 2009
Digital display
Maximum image size: 55 cm x 34 cm
Gamma: 2.20
DPMS levels: Off
RGB color display
First detailed timing is preferred timing
Display x,y Chromaticity:
  Red:   0.6396, 0.3515
  Green: 0.2871, 0.6279
  Blue:  0.1435, 0.0751
  White: 0.3125, 0.3281
Established timings supported:
  720x400@70Hz 9:5 HorFreq: 31469 Hz Clock: 28.320 MHz
  640x480@60Hz 4:3 HorFreq: 31469 Hz Clock: 25.175 MHz
  640x480@67Hz 4:3 HorFreq: 35000 Hz Clock: 30.240 MHz
  640x480@72Hz 4:3 HorFreq: 37900 Hz Clock: 31.500 MHz
  640x480@75Hz 4:3 HorFreq: 37500 Hz Clock: 31.500 MHz
  800x600@56Hz 4:3 HorFreq: 35200 Hz Clock: 36.000 MHz
  800x600@60Hz 4:3 HorFreq: 37900 Hz Clock: 40.000 MHz
  800x600@72Hz 4:3 HorFreq: 48100 Hz Clock: 50.000 MHz
  800x600@75Hz 4:3 HorFreq: 46900 Hz Clock: 49.500 MHz
  832x624@75Hz 4:3 HorFreq: 49726 Hz Clock: 57.284 MHz
  1024x768@60Hz 4:3 HorFreq: 48400 Hz Clock: 65.000 MHz
  1024x768@70Hz 4:3 HorFreq: 56500 Hz Clock: 75.000 MHz
  1024x768@75Hz 4:3 HorFreq: 60000 Hz Clock: 78.750 MHz
  1280x1024@75Hz 5:4 HorFreq: 80000 Hz Clock: 135.000 MHz
Standard timings supported:
  1152x864@75Hz 4:3 HorFreq: 67500 Hz Clock: 108.000 MHz
  1280x960@60Hz 4:3 HorFreq: 60000 Hz Clock: 108.000 MHz
  1280x1024@60Hz 5:4 HorFreq: 64000 Hz Clock: 108.000 MHz
  1440x900@60Hz 16:10 HorFreq: 55500 Hz Clock: 88.750 MHz
  1680x1050@60Hz 16:10 HorFreq: 64700 Hz Clock: 119.000 MHz
Detailed mode: Clock 154.000 MHz, 550 mm x 340 mm
               1920 1968 2000 2080 hborder 0
               1200 1203 1209 1235 vborder 0
               +hsync -vsync 
               VertFreq: 59 Hz, HorFreq: 74038 Hz
Serial number: --
Monitor ranges (GTF): 50-75Hz V, 30-85kHz H, max dotclock 170MHz
Monitor name: ASUS VK266H
Checksum: 0x9 (valid)


