edid-decode (hex):

00 ff ff ff ff ff ff 00 04 69 a3 26 c6 04 02 00
1a 13 01 03 80 37 22 78 2a cb d0 a3 5a 49 a0 24
13 50 54 bf ef 00 71 4f 01 01 81 40 81 80 95 00
b3 00 01 01 01 01 28 3c 80 a0 70 b0 23 40 30 20
36 00 26 54 21 00 00 1a 00 00 00 ff 00 39 36 4c
4d 54 46 31 33 32 32 39 34 0a 00 00 00 fd 00 32
4b 1e 55 11 00 0a 20 20 20 20 20 20 00 00 00 fc
00 41 53 55 53 20 56 4b 32 36 36 48 0a 20 01 8a

02 03 22 71 4f 1f 14 04 13 02 11 06 15 01 10 05
03 12 07 16 23 09 07 07 83 01 00 00 65 03 0c 00
10 00 8c 0a d0 8a 20 e0 2d 10 10 3e 96 00 c4 8e
21 00 00 18 01 1d 00 72 51 d0 1e 20 6e 28 55 00
c4 8e 21 00 00 1e 01 1d 00 bc 52 d0 1e 20 b8 28
55 40 c4 8e 21 00 00 1e 8c 0a d0 90 20 40 31 20
0c 40 55 00 c4 8e 21 00 00 18 8c 0a a0 20 51 20
18 10 18 7e 23 00 c4 8e 21 00 00 98 00 00 00 4a

----------------

Block 0, Base EDID:
  EDID Structure Version & Revision: 1.3
  Vendor & Product Identification:
    Manufacturer: ACI
    Model: 9891
    Serial Number: ...
    Made in: week 26 of 2009
  Basic Display Parameters & Features:
    Digital display
    Maximum image size: 55 cm x 34 cm
    Gamma: 2.20
    DPMS levels: Off
    RGB color display
    First detailed timing is preferred timing
  Color Characteristics:
    Red  : 0.6396, 0.3515
    Green: 0.2871, 0.6279
    Blue : 0.1435, 0.0751
    White: 0.3125, 0.3281
  Established Timings I & II:
    IBM     :   720x400    70.082 Hz   9:5    31.467 kHz  28.320 MHz
    DMT 0x04:   640x480    59.940 Hz   4:3    31.469 kHz  25.175 MHz
    Apple   :   640x480    66.667 Hz   4:3    35.000 kHz  30.240 MHz
    DMT 0x05:   640x480    72.809 Hz   4:3    37.861 kHz  31.500 MHz
    DMT 0x06:   640x480    75.000 Hz   4:3    37.500 kHz  31.500 MHz
    DMT 0x08:   800x600    56.250 Hz   4:3    35.156 kHz  36.000 MHz
    DMT 0x09:   800x600    60.317 Hz   4:3    37.879 kHz  40.000 MHz
    DMT 0x0a:   800x600    72.188 Hz   4:3    48.077 kHz  50.000 MHz
    DMT 0x0b:   800x600    75.000 Hz   4:3    46.875 kHz  49.500 MHz
    Apple   :   832x624    74.551 Hz   4:3    49.726 kHz  57.284 MHz
    DMT 0x10:  1024x768    60.004 Hz   4:3    48.363 kHz  65.000 MHz
    DMT 0x11:  1024x768    70.069 Hz   4:3    56.476 kHz  75.000 MHz
    DMT 0x12:  1024x768    75.029 Hz   4:3    60.023 kHz  78.750 MHz
    DMT 0x24:  1280x1024   75.025 Hz   5:4    79.976 kHz 135.000 MHz
  Standard Timings:
    DMT 0x15:  1152x864    75.000 Hz   4:3    67.500 kHz 108.000 MHz
    DMT 0x20:  1280x960    60.000 Hz   4:3    60.000 kHz 108.000 MHz
    DMT 0x23:  1280x1024   60.020 Hz   5:4    63.981 kHz 108.000 MHz
    DMT 0x2f:  1440x900    59.887 Hz  16:10   55.935 kHz 106.500 MHz
    DMT 0x3a:  1680x1050   59.954 Hz  16:10   65.290 kHz 146.250 MHz
  Detailed Timing Descriptors:
    DTD 1:  1920x1200   59.950 Hz   8:5    74.038 kHz 154.000 MHz (550 mm x 340 mm)
                 Hfront   48 Hsync  32 Hback  80 Hpol P
                 Vfront    3 Vsync   6 Vback  26 Vpol N
    Display Product Serial Number: ...
  Display Range Limits:
    Monitor ranges (GTF): 50-75 Hz V, 30-85 kHz H, max dotclock 170 MHz
    Display Product Name: 'ASUS VK266H'
  Extension blocks: 1
Checksum: 0x8a

----------------

Block 1, CTA-861 Extension Block:
  Revision: 3
  Basic audio support
  Supports YCbCr 4:4:4
  Supports YCbCr 4:2:2
  Native detailed modes: 1
  Video Data Block:
    VIC  31:  1920x1080   50.000 Hz  16:9    56.250 kHz 148.500 MHz
    VIC  20:  1920x1080i  50.000 Hz  16:9    28.125 kHz  74.250 MHz
    VIC   4:  1280x720    60.000 Hz  16:9    45.000 kHz  74.250 MHz
    VIC  19:  1280x720    50.000 Hz  16:9    37.500 kHz  74.250 MHz
    VIC   2:   720x480    59.940 Hz   4:3    31.469 kHz  27.000 MHz
    VIC  17:   720x576    50.000 Hz   4:3    31.250 kHz  27.000 MHz
    VIC   6:  1440x480i   59.940 Hz   4:3    15.734 kHz  27.000 MHz
    VIC  21:  1440x576i   50.000 Hz   4:3    15.625 kHz  27.000 MHz
    VIC   1:   640x480    59.940 Hz   4:3    31.469 kHz  25.175 MHz
    VIC  16:  1920x1080   60.000 Hz  16:9    67.500 kHz 148.500 MHz
    VIC   5:  1920x1080i  60.000 Hz  16:9    33.750 kHz  74.250 MHz
    VIC   3:   720x480    59.940 Hz  16:9    31.469 kHz  27.000 MHz
    VIC  18:   720x576    50.000 Hz  16:9    31.250 kHz  27.000 MHz
    VIC   7:  1440x480i   59.940 Hz  16:9    15.734 kHz  27.000 MHz
    VIC  22:  1440x576i   50.000 Hz  16:9    15.625 kHz  27.000 MHz
  Audio Data Block:
    Linear PCM:
      Max channels: 2
      Supported sample rates (kHz): 48 44.1 32
      Supported sample sizes (bits): 24 20 16
  Speaker Allocation Data Block:
    FL/FR - Front Left/Right
  Vendor-Specific Data Block (HDMI), OUI 00-0C-03:
    Source physical address: 1.0.0.0
  Detailed Timing Descriptors:
    DTD 2:   720x480    59.940 Hz   3:2    31.469 kHz  27.000 MHz (708 mm x 398 mm)
                 Hfront   16 Hsync  62 Hback  60 Hpol N
                 Vfront    9 Vsync   6 Vback  30 Vpol N
    DTD 3:  1280x720    60.000 Hz  16:9    45.000 kHz  74.250 MHz (708 mm x 398 mm)
                 Hfront  110 Hsync  40 Hback 220 Hpol P
                 Vfront    5 Vsync   5 Vback  20 Vpol P
    DTD 4:  1280x720    50.000 Hz  16:9    37.500 kHz  74.250 MHz (708 mm x 398 mm)
                 Hfront  440 Hsync  40 Hback 220 Hpol P
                 Vfront    5 Vsync   5 Vback  20 Vpol P
    DTD 5:   720x576    50.000 Hz   5:4    31.250 kHz  27.000 MHz (708 mm x 398 mm)
                 Hfront   12 Hsync  64 Hback  68 Hpol N
                 Vfront    5 Vsync   5 Vback  39 Vpol N
    DTD 6:  1440x576i   50.000 Hz   5:2    15.625 kHz  27.000 MHz (708 mm x 398 mm)
                 Hfront   24 Hsync 126 Hback 138 Hpol N
                 Vfront    2 Vsync   3 Vback  19 Vpol N Vfront +0.5 Odd Field
                 Vfront    2 Vsync   3 Vback  19 Vpol N Vback  +0.5 Even Field
Checksum: 0x4a

----------------

Warnings:

Block 1, CTA-861 Extension Block:
  Display Product Serial Number is set, so the Serial Number in the Base EDID should be 0.

Failures:

Block 1, CTA-861 Extension Block:
  Detailed Timing Descriptor #2: Mismatch of image size 708x398 mm vs display size 550x340 mm.
  Detailed Timing Descriptor #3: Mismatch of image size 708x398 mm vs display size 550x340 mm.
  Detailed Timing Descriptor #4: Mismatch of image size 708x398 mm vs display size 550x340 mm.
  Detailed Timing Descriptor #5: Mismatch of image size 708x398 mm vs display size 550x340 mm.
  Detailed Timing Descriptor #6: Mismatch of image size 708x398 mm vs display size 550x340 mm.
All Blocks:
  Some timings are out of range of the Monitor Ranges:
    Horizontal Freq: 15.625 - 79.976 kHz (Monitor: 30.000 - 85.000 kHz)

EDID conformity: FAIL
