
EDID (hex):
00ffffffffffff004162585001010101
26110103082f1e78ead515a455499a27
145054a54b008180b3009500950f0101
0101010101012d399030621a274068b0
6e01da281100001e000000fc00504b42
204d4145323231570a20000000fd0038
4c1f500f000a202020202020000000ff
003131323839363431333138320a0058

Extracted contents:
header:          00 ff ff ff ff ff ff 00
serial number:   41 62 58 50 01 01 01 01 26 11
version:         01 03
basic params:    08 2f 1e 78 ea
chroma info:     d5 15 a4 55 49 9a 27 14 50 54
established:     a5 4b 00
standard:        81 80 b3 00 95 00 95 0f 01 01 01 01 01 01 01 01
descriptor 1:    2d 39 90 30 62 1a 27 40 68 b0 6e 01 da 28 11 00 00 1e
descriptor 2:    00 00 00 fc 00 50 4b 42 20 4d 41 45 32 32 31 57 0a 20
descriptor 3:    00 00 00 fd 00 38 4c 1f 50 0f 00 0a 20 20 20 20 20 20
descriptor 4:    00 00 00 ff 00 31 31 32 38 39 36 34 31 33 31 38 32 0a
extensions:      00
checksum:        58

EDID version: 1.3
Manufacturer: PKB Model 5058 Serial Number --
Made in week 38 of 2007
Analog display, Input voltage level: 0.7/0.3 V
Sync: Separate 
Maximum image size: 47 cm x 30 cm
Gamma: 2.20
DPMS levels: Standby Suspend Off
RGB color display
First detailed timing is preferred timing
Display x,y Chromaticity:
  Red:   0.6435, 0.3330
  Green: 0.2861, 0.6025
  Blue:  0.1523, 0.0791
  White: 0.3134, 0.3291
Established timings supported:
  720x400@70Hz 9:5 HorFreq: 31469 Hz Clock: 28.320 MHz
  640x480@60Hz 4:3 HorFreq: 31469 Hz Clock: 25.175 MHz
  640x480@75Hz 4:3 HorFreq: 37500 Hz Clock: 31.500 MHz
  800x600@60Hz 4:3 HorFreq: 37900 Hz Clock: 40.000 MHz
  800x600@75Hz 4:3 HorFreq: 46900 Hz Clock: 49.500 MHz
  1024x768@60Hz 4:3 HorFreq: 48400 Hz Clock: 65.000 MHz
  1024x768@75Hz 4:3 HorFreq: 60000 Hz Clock: 78.750 MHz
  1280x1024@75Hz 5:4 HorFreq: 80000 Hz Clock: 135.000 MHz
Standard timings supported:
  1280x1024@60Hz 5:4 HorFreq: 64000 Hz Clock: 108.000 MHz
  1680x1050@60Hz 16:10 HorFreq: 64700 Hz Clock: 119.000 MHz
  1440x900@60Hz 16:10 HorFreq: 55500 Hz Clock: 88.750 MHz
  1440x900@75Hz 16:10 HorFreq: 82300 Hz Clock: 156.000 MHz
Detailed mode: Clock 146.370 MHz, 474 mm x 296 mm
               1680 1784 1960 2240 hborder 0
               1050 1056 1086 1089 vborder 0
               +hsync +vsync 
               VertFreq: 60 Hz, HorFreq: 65343 Hz
Monitor name: PKB MAE221W
Monitor ranges (GTF): 56-76Hz V, 31-80kHz H, max dotclock 150MHz
Serial number: --
Checksum: 0x58 (valid)
One or more of the timings is out of range of the Monitor Ranges:
  Vertical Freq: 60 - 75 Hz
  Horizontal Freq: 31469 - 82300 Hz
  Maximum Clock: 156.000 MHz
