edid-decode (hex):

00 ff ff ff ff ff ff 00 41 62 58 50 01 01 01 01
1d 11 01 03 08 2f 1e 78 ea d5 15 a4 55 49 9a 27
14 50 54 a5 4b 00 81 80 b3 00 95 00 95 0f 01 01
01 01 01 01 01 01 2d 39 90 30 62 1a 27 40 68 b0
6e 01 da 28 11 00 00 1e 00 00 00 fc 00 50 4b 42
20 4d 41 45 32 32 31 57 0a 20 00 00 00 fd 00 38
4c 1f 50 0f 00 0a 20 20 20 20 20 20 00 00 00 ff
00 31 31 32 31 38 39 31 32 33 31 38 37 0a 00 63

----------------

Block 0, Base EDID:
  EDID Structure Version & Revision: 1.3
  Vendor & Product Identification:
    Manufacturer: PKB
    Model: 20568
    Serial Number: ...
    Made in: week 29 of 2007
  Basic Display Parameters & Features:
    Analog display
    Input voltage level: 0.7/0.3 V
    Blank level equals black level
    Sync: Separate
    Maximum image size: 47 cm x 30 cm
    Gamma: 2.20
    DPMS levels: Standby Suspend Off
    RGB color display
    First detailed timing is the preferred timing
  Color Characteristics:
    Red  : 0.6435, 0.3330
    Green: 0.2861, 0.6025
    Blue : 0.1523, 0.0791
    White: 0.3134, 0.3291
  Established Timings I & II:
    IBM     :   720x400    70.081663 Hz   9:5     31.467 kHz     28.320000 MHz
    DMT 0x04:   640x480    59.940476 Hz   4:3     31.469 kHz     25.175000 MHz
    DMT 0x06:   640x480    75.000000 Hz   4:3     37.500 kHz     31.500000 MHz
    DMT 0x09:   800x600    60.316541 Hz   4:3     37.879 kHz     40.000000 MHz
    DMT 0x0b:   800x600    75.000000 Hz   4:3     46.875 kHz     49.500000 MHz
    DMT 0x10:  1024x768    60.003840 Hz   4:3     48.363 kHz     65.000000 MHz
    DMT 0x12:  1024x768    75.028582 Hz   4:3     60.023 kHz     78.750000 MHz
    DMT 0x24:  1280x1024   75.024675 Hz   5:4     79.976 kHz    135.000000 MHz
  Standard Timings:
    DMT 0x23:  1280x1024   60.019740 Hz   5:4     63.981 kHz    108.000000 MHz
    DMT 0x3a:  1680x1050   59.954250 Hz  16:10    65.290 kHz    146.250000 MHz
    DMT 0x2f:  1440x900    59.887445 Hz  16:10    55.935 kHz    106.500000 MHz
    DMT 0x30:  1440x900    74.984427 Hz  16:10    70.635 kHz    136.750000 MHz
  Detailed Timing Descriptors:
    DTD 1:  1680x1050   60.003444 Hz   8:5     65.344 kHz    146.370000 MHz (474 mm x 296 mm)
                 Hfront  104 Hsync 176 Hback  280 Hpol P
                 Vfront    6 Vsync  30 Vback    3 Vpol P
    Display Product Name: 'PKB MAE221W'
    Display Range Limits:
      Monitor ranges (GTF): 56-76 Hz V, 31-80 kHz H, max dotclock 150 MHz
    Display Product Serial Number: ...
Checksum: 0x63

----------------

EDID conformity: PASS
