edid-decode (hex):

00 ff ff ff ff ff ff 00 4c a3 30 30 00 00 00 00
00 14 01 03 80 16 0d 78 0a a0 55 8d 51 5a 96 2a
1c 50 54 00 00 00 01 01 01 01 01 01 01 01 01 01
01 01 01 01 01 01 2c 15 00 40 41 58 46 20 18 88
36 00 df 7d 00 00 00 19 00 00 00 0f 00 00 00 00
00 00 00 00 00 23 87 02 64 00 00 00 00 fe 00 53
41 4d 53 55 4e 47 0a 20 20 20 20 20 00 00 00 fe
00 31 30 31 4e 54 30 36 2d 32 30 31 0a 20 00 8b

----------------

Block 0, Base EDID:
  EDID Structure Version & Revision: 1.3
  Vendor & Product Identification:
    Manufacturer: SEC
    Model: 12336
    Made in: 2010
  Basic Display Parameters & Features:
    Digital display
    Maximum image size: 22 cm x 13 cm
    Gamma: 2.20
    RGB color display
    First detailed timing is the preferred timing
  Color Characteristics:
    Red  : 0.5527, 0.3183
    Green: 0.3515, 0.5859
    Blue : 0.1650, 0.1103
    White: 0.3134, 0.3291
  Established Timings I & II: none
  Standard Timings: none
  Detailed Timing Descriptors:
    DTD 1:  1024x600    60.190121 Hz 128:75    40.327 kHz     54.200000 MHz (223 mm x 125 mm)
                 Hfront   24 Hsync 136 Hback  160 Hpol N
                 Vfront    3 Vsync   6 Vback   61 Vpol N
    Manufacturer-Specified Display Descriptor (0x0f): 00 0f 00 00 00 00 00 00 00 00 00 23 87 02 64 00 '...........#..d.'
    Alphanumeric Data String: 'SAMSUNG'
    Alphanumeric Data String: '101NT06-201'
Checksum: 0x8b

----------------

Failures:

Block 0, Base EDID:
  Missing Display Product Name.
  Missing Display Range Limits Descriptor.

EDID conformity: FAIL
