
EDID (hex):
00ffffffffffff000472030648b99092
1d1d0104b5361e783f38f0a75452a027
125054bfef80714f8140818081c08100
9500b300d1c0023a801871382d40582c
4500202f2100001e000000fd0030f0ff
ff3c010a202020202020000000fc0058
46323530510a202020202020000000ff
005441314141303033383534310a01c2
020318f14b010203040590111213141f
23090707830100000f4c807870382c40
1c20e804202f2100001a866f80a07038
404030203500202f2100001a23e88078
703887401c20980c202f2100001a0000
00000000000000000000000000000000
00000000000000000000000000000000
000000000000000000000000000000a0

Extracted contents:
header:          00 ff ff ff ff ff ff 00
serial number:   04 72 03 06 48 b9 90 92 1d 1d
version:         01 04
basic params:    b5 36 1e 78 3f
chroma info:     38 f0 a7 54 52 a0 27 12 50 54
established:     bf ef 80
standard:        71 4f 81 40 81 80 81 c0 81 00 95 00 b3 00 d1 c0
descriptor 1:    02 3a 80 18 71 38 2d 40 58 2c 45 00 20 2f 21 00 00 1e
descriptor 2:    00 00 00 fd 00 30 f0 ff ff 3c 01 0a 20 20 20 20 20 20
descriptor 3:    00 00 00 fc 00 58 46 32 35 30 51 0a 20 20 20 20 20 20
descriptor 4:    00 00 00 ff 00 54 41 31 41 41 30 30 33 38 35 34 31 0a
extensions:      01
checksum:        c2

EDID version: 1.4
Manufacturer: ACR Model 603 Serial Number --
Made in week 29 of 2019
Digital display
10 bits per primary color channel
DisplayPort interface
Maximum image size: 54 cm x 30 cm
Gamma: 2.20
DPMS levels: Off
Supported color formats: RGB 4:4:4, YCrCb 4:4:4, YCrCb 4:2:2
Default (sRGB) color space is primary color space
First detailed timing includes the native pixel format and preferred refresh rate
Display is continuous frequency
Display x,y Chromaticity:
  Red:   0.6523, 0.3310
  Green: 0.3222, 0.6250
  Blue:  0.1552, 0.0732
  White: 0.3125, 0.3281
Established timings supported:
  720x400@70Hz 9:5 HorFreq: 31469 Hz Clock: 28.320 MHz
  640x480@60Hz 4:3 HorFreq: 31469 Hz Clock: 25.175 MHz
  640x480@67Hz 4:3 HorFreq: 35000 Hz Clock: 30.240 MHz
  640x480@72Hz 4:3 HorFreq: 37900 Hz Clock: 31.500 MHz
  640x480@75Hz 4:3 HorFreq: 37500 Hz Clock: 31.500 MHz
  800x600@56Hz 4:3 HorFreq: 35200 Hz Clock: 36.000 MHz
  800x600@60Hz 4:3 HorFreq: 37900 Hz Clock: 40.000 MHz
  800x600@72Hz 4:3 HorFreq: 48100 Hz Clock: 50.000 MHz
  800x600@75Hz 4:3 HorFreq: 46900 Hz Clock: 49.500 MHz
  832x624@75Hz 4:3 HorFreq: 49726 Hz Clock: 57.284 MHz
  1024x768@60Hz 4:3 HorFreq: 48400 Hz Clock: 65.000 MHz
  1024x768@70Hz 4:3 HorFreq: 56500 Hz Clock: 75.000 MHz
  1024x768@75Hz 4:3 HorFreq: 60000 Hz Clock: 78.750 MHz
  1280x1024@75Hz 5:4 HorFreq: 80000 Hz Clock: 135.000 MHz
  1152x870@75Hz 192:145 HorFreq: 67500 Hz Clock: 108.000 MHz
Standard timings supported:
  1152x864@75Hz 4:3 HorFreq: 67500 Hz Clock: 108.000 MHz
  1280x960@60Hz 4:3 HorFreq: 60000 Hz Clock: 108.000 MHz
  1280x1024@60Hz 5:4 HorFreq: 64000 Hz Clock: 108.000 MHz
  1280x720@60Hz 16:9
  1280x800@60Hz 16:10
  1440x900@60Hz 16:10 HorFreq: 55500 Hz Clock: 88.750 MHz
  1680x1050@60Hz 16:10 HorFreq: 64700 Hz Clock: 119.000 MHz
  1920x1080@60Hz 16:9
Detailed mode: Clock 148.500 MHz, 544 mm x 303 mm
               1920 2008 2052 2200 hborder 0
               1080 1084 1089 1125 vborder 0
               +hsync +vsync 
               VertFreq: 60 Hz, HorFreq: 67500 Hz
Monitor ranges (bare limits): 48-240Hz V, 255-255kHz H, max dotclock 600MHz
Monitor name: XF250Q
Serial number: --
Has 1 extension blocks
Checksum: 0xc2 (valid)

CTA extension block
Extension version: 3
20 bytes of CTA data
  Video data block
    VIC   1 640x480@60Hz 4:3  HorFreq: 31469 Hz Clock: 25.175 MHz
    VIC   2 720x480@60Hz 4:3  HorFreq: 31469 Hz Clock: 27.000 MHz
    VIC   3 720x480@60Hz 16:9  HorFreq: 31469 Hz Clock: 27.000 MHz
    VIC   4 1280x720@60Hz 16:9  HorFreq: 45000 Hz Clock: 74.250 MHz
    VIC   5 1920x1080i@60Hz 16:9  HorFreq: 33750 Hz Clock: 74.250 MHz
    VIC  16 1920x1080@60Hz 16:9 (native) HorFreq: 67500 Hz Clock: 148.500 MHz
    VIC  17 720x576@50Hz 4:3  HorFreq: 31250 Hz Clock: 27.000 MHz
    VIC  18 720x576@50Hz 16:9  HorFreq: 31250 Hz Clock: 27.000 MHz
    VIC  19 1280x720@50Hz 16:9  HorFreq: 37500 Hz Clock: 74.250 MHz
    VIC  20 1920x1080i@50Hz 16:9  HorFreq: 28125 Hz Clock: 74.250 MHz
    VIC  31 1920x1080@50Hz 16:9  HorFreq: 56250 Hz Clock: 148.500 MHz
  Audio data block
    Linear PCM, max channels 2
      Supported sample rates (kHz): 48 44.1 32
      Supported sample sizes (bits): 24 20 16
  Speaker allocation data block
    Speaker map:
      FL/FR - Front Left/Right
Underscans PC formats by default
Basic audio support
Supports YCbCr 4:4:4
Supports YCbCr 4:2:2
1 native detailed modes
Detailed mode: Clock 194.710 MHz, 544 mm x 303 mm
               1920 1948 1980 2040 hborder 0
               1080 1110 1118 1124 vborder 0
               +hsync -vsync 
               VertFreq: 84 Hz, HorFreq: 95446 Hz
Detailed mode: Clock 285.500 MHz, 544 mm x 303 mm
               1920 1968 2000 2080 hborder 0
               1080 1083 1088 1144 vborder 0
               +hsync -vsync 
               VertFreq: 119 Hz, HorFreq: 137259 Hz
Detailed mode: Clock 594.270 MHz, 544 mm x 303 mm
               1920 1948 1980 2040 hborder 0
               1080 1137 1145 1215 vborder 0
               +hsync -vsync 
               VertFreq: 239 Hz, HorFreq: 291308 Hz
Checksum: 0xa0 (valid)

EDID block does NOT conform to EDID 1.4!
	sRGB is signaled, but the chromaticities do not match
Warning: One or more of the timings is out of range of the Monitor Ranges:
  Vertical Freq: 50 - 239 Hz
  Horizontal Freq: 28125 - 291308 Hz
  Maximum Clock: 594.270 MHz
EDID block does not conform at all!
	Both the serial number and the serial string are set
