edid-decode (hex):

00 ff ff ff ff ff ff 00 15 c3 03 18 01 01 01 01
29 11 01 03 80 2c 21 78 ea ee 95 a3 54 4c 99 26
0f 50 54 a1 08 00 a9 40 81 80 81 40 01 01 01 01
01 01 01 01 01 01 48 3f 40 30 62 b0 32 40 40 c0
13 00 b0 44 11 00 00 1e 00 00 00 ff 00 37 36 39
34 36 31 30 37 0a 20 20 20 20 00 00 00 fd 00 3b
3d 1f 4c 11 00 0a 20 20 20 20 20 20 00 00 00 fc
00 53 32 31 30 30 0a 20 20 20 20 20 20 20 00 73

00 ff ff ff ff ff ff 00 15 c3 03 18 01 01 01 01
29 11 01 03 80 2c 21 78 ea ee 95 a3 54 4c 99 26
0f 50 54 a1 08 00 a9 40 81 80 81 40 01 01 01 01
01 01 01 01 01 01 48 3f 40 30 62 b0 32 40 40 c0
13 00 b0 44 11 00 00 1e 00 00 00 ff 00 37 36 39
34 36 31 30 37 0a 20 20 20 20 00 00 00 fd 00 3b
3d 1f 4c 11 00 0a 20 20 20 20 20 20 00 00 00 fc
00 53 32 31 30 30 0a 20 20 20 20 20 20 20 00 73

----------------

Block 0, Base EDID:
  EDID Structure Version & Revision: 1.3
  Vendor & Product Identification:
    Manufacturer: ENC
    Model: 6147
    Serial Number: ...
    Made in: week 41 of 2007
  Basic Display Parameters & Features:
    Digital display
    Maximum image size: 44 cm x 33 cm
    Gamma: 2.20
    DPMS levels: Standby Suspend Off
    RGB color display
    First detailed timing is the preferred timing
  Color Characteristics:
    Red  : 0.6396, 0.3300
    Green: 0.2998, 0.5996
    Blue : 0.1503, 0.0595
    White: 0.3134, 0.3291
  Established Timings I & II:
    IBM     :   720x400    70.081663 Hz   9:5     31.467 kHz     28.320000 MHz
    DMT 0x04:   640x480    59.940476 Hz   4:3     31.469 kHz     25.175000 MHz
    DMT 0x09:   800x600    60.316541 Hz   4:3     37.879 kHz     40.000000 MHz
    DMT 0x10:  1024x768    60.003840 Hz   4:3     48.363 kHz     65.000000 MHz
  Standard Timings:
    DMT 0x33:  1600x1200   60.000000 Hz   4:3     75.000 kHz    162.000000 MHz
    DMT 0x23:  1280x1024   60.019740 Hz   5:4     63.981 kHz    108.000000 MHz
    DMT 0x20:  1280x960    60.000000 Hz   4:3     60.000 kHz    108.000000 MHz
  Detailed Timing Descriptors:
    DTD 1:  1600x1200   60.000000 Hz   4:3     75.000 kHz    162.000000 MHz (432 mm x 324 mm)
                 Hfront   64 Hsync 192 Hback  304 Hpol P
                 Vfront    1 Vsync   3 Vback   46 Vpol P
    Display Product Serial Number: ...
    Display Range Limits:
      Monitor ranges (GTF): 59-61 Hz V, 31-76 kHz H, max dotclock 170 MHz
    Display Product Name: 'S2100'
Checksum: 0x73

----------------

Block 1, Unknown EDID Extension Block 0x00:
  00 ff ff ff ff ff ff 00 15 c3 03 18 01 01 01 01 '................'
  29 11 01 03 80 2c 21 78 ea ee 95 a3 54 4c 99 26 ')....,!x....TL.&'
  0f 50 54 a1 08 00 a9 40 81 80 81 40 01 01 01 01 '.PT....@...@....'
  01 01 01 01 01 01 48 3f 40 30 62 b0 32 40 40 c0 '......H?@0b.2@@.'
  13 00 b0 44 11 00 00 1e 00 00 00 ff 00 37 36 39 '...D.........769'
  34 36 31 30 37 0a 20 20 20 20 00 00 00 fd 00 3b '46107.    .....;'
  3d 1f 4c 11 00 0a 20 20 20 20 20 20 00 00 00 fc '=.L...      ....'
  00 53 32 31 30 30 0a 20 20 20 20 20 20 20 00 73 '.S2100.       .s'
Checksum: 0x73

----------------

Failures:

Block 1, Base EDID:
  Unknown Extension Block.
EDID:
  Base EDID: Some timings are out of range of the Monitor Ranges:
    Vertical Freq: 59.940 - 70.082 Hz (Monitor: 59.000 - 61.000 Hz)
  Base EDID: EDID specified 0 extension block(s), but found 1 extension block(s).

EDID conformity: FAIL
