edid-decode (hex):

00 ff ff ff ff ff ff 00 04 72 67 00 d2 e0 70 92
1b 13 01 03 08 29 17 78 ea 3d 85 a6 56 4a 9a 24
12 50 54 bf ef 90 81 c0 81 00 81 80 81 40 71 4f
01 01 01 01 01 01 66 21 56 aa 51 00 1e 30 46 8f
33 00 9a e6 10 00 00 1c 00 00 00 ff 00 4c 45 48
30 43 30 34 38 34 30 30 39 0a 00 00 00 fd 00 37
4c 1f 50 0e 00 0a 20 20 20 20 20 20 00 00 00 fc
00 58 31 39 33 48 51 0a 20 20 20 20 20 20 00 e2

00 ff ff ff ff ff ff 00 04 72 67 00 d2 e0 70 92
1b 13 01 03 08 29 17 78 ea 3d 85 a6 56 4a 9a 24
12 50 54 bf ef 90 81 c0 81 00 81 80 81 40 71 4f
01 01 01 01 01 01 66 21 56 aa 51 00 1e 30 46 8f
33 00 9a e6 10 00 00 1c 00 00 00 ff 00 4c 45 48
30 43 30 34 38 34 30 30 39 0a 00 00 00 fd 00 37
4c 1f 50 0e 00 0a 20 20 20 20 20 20 00 00 00 fc
00 58 31 39 33 48 51 0a 20 20 20 20 20 20 00 e2

----------------

Block 0, Base EDID:
  EDID Structure Version & Revision: 1.3
  Vendor & Product Identification:
    Manufacturer: ACR
    Model: 103
    Serial Number: ...
    Made in: week 27 of 2009
  Basic Display Parameters & Features:
    Analog display
    Signal Level Standard: 0.700 : 0.300 : 1.000 V p-p
    Blank level equals black level
    Sync: Separate
    Maximum image size: 41 cm x 23 cm
    Gamma: 2.20
    DPMS levels: Standby Suspend Off
    RGB color display
    First detailed timing is the preferred timing
  Color Characteristics:
    Red  : 0.6484, 0.3388
    Green: 0.2919, 0.6025
    Blue : 0.1425, 0.0703
    White: 0.3134, 0.3291
  Established Timings I & II:
    IBM     :   720x400    70.081663 Hz   9:5     31.467 kHz     28.320000 MHz
    DMT 0x04:   640x480    59.940476 Hz   4:3     31.469 kHz     25.175000 MHz
    Apple   :   640x480    66.666667 Hz   4:3     35.000 kHz     30.240000 MHz
    DMT 0x05:   640x480    72.808802 Hz   4:3     37.861 kHz     31.500000 MHz
    DMT 0x06:   640x480    75.000000 Hz   4:3     37.500 kHz     31.500000 MHz
    DMT 0x08:   800x600    56.250000 Hz   4:3     35.156 kHz     36.000000 MHz
    DMT 0x09:   800x600    60.316541 Hz   4:3     37.879 kHz     40.000000 MHz
    DMT 0x0a:   800x600    72.187572 Hz   4:3     48.077 kHz     50.000000 MHz
    DMT 0x0b:   800x600    75.000000 Hz   4:3     46.875 kHz     49.500000 MHz
    Apple   :   832x624    74.551266 Hz   4:3     49.726 kHz     57.284000 MHz
    DMT 0x10:  1024x768    60.003840 Hz   4:3     48.363 kHz     65.000000 MHz
    DMT 0x11:  1024x768    70.069359 Hz   4:3     56.476 kHz     75.000000 MHz
    DMT 0x12:  1024x768    75.028582 Hz   4:3     60.023 kHz     78.750000 MHz
    DMT 0x24:  1280x1024   75.024675 Hz   5:4     79.976 kHz    135.000000 MHz
    Apple   :  1152x870    75.061550 Hz 192:145   68.681 kHz    100.000000 MHz
  Standard Timings:
    DMT 0x55:  1280x720    60.000000 Hz  16:9     45.000 kHz     74.250000 MHz
    DMT 0x1c:  1280x800    59.810326 Hz  16:10    49.702 kHz     83.500000 MHz
    DMT 0x23:  1280x1024   60.019740 Hz   5:4     63.981 kHz    108.000000 MHz
    DMT 0x20:  1280x960    60.000000 Hz   4:3     60.000 kHz    108.000000 MHz
    DMT 0x15:  1152x864    75.000000 Hz   4:3     67.500 kHz    108.000000 MHz
  Detailed Timing Descriptors:
    DTD 1:  1366x768    59.789541 Hz 683:384   47.712 kHz     85.500000 MHz (410 mm x 230 mm)
                 Hfront   70 Hsync 143 Hback  213 Hpol N
                 Vfront    3 Vsync   3 Vback   24 Vpol P
    Display Product Serial Number: ...
    Display Range Limits:
      Monitor ranges (GTF): 55-76 Hz V, 31-80 kHz H, max dotclock 140 MHz
    Display Product Name: 'X193HQ'
Checksum: 0xe2

----------------

Block 1, Unknown EDID Extension Block 0x00:
  00 ff ff ff ff ff ff 00 04 72 67 00 d2 e0 70 92 '.........rg...p.'
  1b 13 01 03 08 29 17 78 ea 3d 85 a6 56 4a 9a 24 '.....).x.=..VJ.$'
  12 50 54 bf ef 90 81 c0 81 00 81 80 81 40 71 4f '.PT..........@qO'
  01 01 01 01 01 01 66 21 56 aa 51 00 1e 30 46 8f '......f!V.Q..0F.'
  33 00 9a e6 10 00 00 1c 00 00 00 ff 00 4c 45 48 '3............LEH'
  30 43 30 34 38 34 30 30 39 0a 00 00 00 fd 00 37 '0C0484009......7'
  4c 1f 50 0e 00 0a 20 20 20 20 20 20 00 00 00 fc 'L.P...      ....'
  00 58 31 39 33 48 51 0a 20 20 20 20 20 20 00 e2 '.X193HQ.      ..'
Checksum: 0xe2

----------------

Warnings:

Block 0, Base EDID:
  Detailed Timing Descriptor #1: DTD is similar but not identical to DMT 0x51.

Failures:

Block 1, Base EDID:
  Unknown Extension Block.
EDID:
  Base EDID: EDID specified 0 extension block(s), but found 1 extension block(s).

EDID conformity: FAIL
