
EDID (hex):
00ffffffffffff0004722300090b1115
3315010380221b6b2ac0f5a3574a9c23
114f54a54f00818f8180614f6140454f
454081000101302a009851002a403070
1300540e1100001e000000ff004c4259
3038313839343231360a000000fd0037
4b1e530e000a202020202020000000fc
004163657220563137330a20202001c4
02031b61230907078301000067030c00
2000802d43908402e2000f8c0ad08a20
e02d10103e9600a05a00000000000000
00000000000000000000000000000000
00000000000000000000000000000000
00000000000000000000000000000000
00000000000000000000000000000000
00000000000000000000000000000029

Extracted contents:
header:          00 ff ff ff ff ff ff 00
serial number:   04 72 23 00 09 0b 11 15 33 15
version:         01 03
basic params:    80 22 1b 6b 2a
chroma info:     c0 f5 a3 57 4a 9c 23 11 4f 54
established:     a5 4f 00
standard:        81 8f 81 80 61 4f 61 40 45 4f 45 40 81 00 01 01
descriptor 1:    30 2a 00 98 51 00 2a 40 30 70 13 00 54 0e 11 00 00 1e
descriptor 2:    00 00 00 ff 00 4c 42 59 30 38 31 38 39 34 32 31 36 0a
descriptor 3:    00 00 00 fd 00 37 4b 1e 53 0e 00 0a 20 20 20 20 20 20
descriptor 4:    00 00 00 fc 00 41 63 65 72 20 56 31 37 33 0a 20 20 20
extensions:      01
checksum:        c4

EDID version: 1.3
Manufacturer: ACR Model 23 Serial Number --
Made in week 51 of 2011
Digital display
Maximum image size: 34 cm x 27 cm
Gamma: 2.07
DPMS levels: Off
RGB color display
First detailed timing is preferred timing
Display x,y Chromaticity:
  Red:   0.6396, 0.3398
  Green: 0.2890, 0.6093
  Blue:  0.1396, 0.0693
  White: 0.3095, 0.3291
Established timings supported:
  720x400@70Hz 9:5 HorFreq: 31469 Hz Clock: 28.320 MHz
  640x480@60Hz 4:3 HorFreq: 31469 Hz Clock: 25.175 MHz
  640x480@75Hz 4:3 HorFreq: 37500 Hz Clock: 31.500 MHz
  800x600@60Hz 4:3 HorFreq: 37900 Hz Clock: 40.000 MHz
  800x600@75Hz 4:3 HorFreq: 46900 Hz Clock: 49.500 MHz
  1024x768@60Hz 4:3 HorFreq: 48400 Hz Clock: 65.000 MHz
  1024x768@70Hz 4:3 HorFreq: 56500 Hz Clock: 75.000 MHz
  1024x768@75Hz 4:3 HorFreq: 60000 Hz Clock: 78.750 MHz
  1280x1024@75Hz 5:4 HorFreq: 80000 Hz Clock: 135.000 MHz
Standard timings supported:
  1280x1024@75Hz 5:4 HorFreq: 80000 Hz Clock: 135.000 MHz
  1280x1024@60Hz 5:4 HorFreq: 64000 Hz Clock: 108.000 MHz
  1024x768@75Hz 4:3 HorFreq: 60000 Hz Clock: 78.750 MHz
  1024x768@60Hz 4:3 HorFreq: 48400 Hz Clock: 65.000 MHz
  800x600@75Hz 4:3 HorFreq: 46900 Hz Clock: 49.500 MHz
  800x600@60Hz 4:3 HorFreq: 37900 Hz Clock: 40.000 MHz
  1280x800@60Hz 16:10
Detailed mode: Clock 108.000 MHz, 340 mm x 270 mm
               1280 1328 1440 1688 hborder 0
               1024 1025 1028 1066 vborder 0
               +hsync +vsync 
               VertFreq: 60 Hz, HorFreq: 63981 Hz
Serial number: --
Monitor ranges (GTF): 55-75Hz V, 30-83kHz H, max dotclock 140MHz
Monitor name: Acer V173
Has 1 extension blocks
Checksum: 0xc4 (valid)

CTA extension block
Extension version: 3
23 bytes of CTA data
  Audio data block
    Linear PCM, max channels 2
      Supported sample rates (kHz): 48 44.1 32
      Supported sample sizes (bits): 24 20 16
  Speaker allocation data block
    Speaker map:
      FL/FR - Front Left/Right
  Vendor-specific data block, OUI 000c03 (HDMI)
    Source physical address 2.0.0.0
    Supports_AI
    Maximum TMDS clock: 225MHz
  Video data block
    VIC  16 1920x1080@60Hz 16:9 (native) HorFreq: 67500 Hz Clock: 148.500 MHz
    VIC   4 1280x720@60Hz 16:9 (native) HorFreq: 45000 Hz Clock: 74.250 MHz
    VIC   2 720x480@60Hz 4:3  HorFreq: 31469 Hz Clock: 27.000 MHz
  Extended tag: Video capability data block
    YCbCr quantization: No Data (0)
    RGB quantization: No Data (0)
    PT scan behaviour: No Data (0)
    IT scan behaviour: Support both over- and underscan (3)
    CE scan behaviour: Support both over- and underscan (3)
Basic audio support
Supports YCbCr 4:4:4
1 native detailed modes
Detailed mode: Clock 27.000 MHz, 160 mm x 90 mm
                720  736  798  858 hborder 0
                480  489  495  525 vborder 0
               -hsync -vsync analog composite 
               VertFreq: 59 Hz, HorFreq: 31468 Hz
Checksum: 0x29 (valid)

One or more of the timings is out of range of the Monitor Ranges:
  Vertical Freq: 59 - 75 Hz
  Horizontal Freq: 31468 - 80000 Hz
  Maximum Clock: 148.500 MHz
EDID block does not conform at all!
	Both the serial number and the serial string are set
