edid-decode (hex):

00 ff ff ff ff ff ff 00 21 63 4c b3 01 00 00 00
11 1d 01 04 a5 50 21 78 3b 8e 05 ad 4f 33 b0 26
0d 50 54 af cf 00 81 80 81 a8 95 00 95 28 b3 00
b3 28 d1 e8 d1 c0 43 d0 70 a0 d0 a0 29 50 30 20
35 00 1d 4d 31 00 00 1a 00 00 00 fd 00 30 64 a2
a2 02 01 0a 20 20 20 20 20 20 00 00 00 fc 00 43
33 34 30 0a 20 20 20 20 20 20 20 20 00 00 00 ff
00 43 45 54 42 39 34 34 32 36 30 38 32 35 01 ad

02 03 18 75 4b 90 9f 85 94 04 13 03 12 01 02 11
23 09 07 07 83 01 00 00 02 3a 80 d0 72 38 2d 40
10 2c 35 80 1d 4d 31 00 00 18 fe 7c 70 a0 d0 a0
29 50 30 20 35 00 1d 4d 31 00 00 18 56 5e 00 a0
a0 a0 29 50 30 20 35 00 1d 4d 31 00 00 1e 3a 9d
00 a0 a0 a0 29 50 30 40 35 00 1d 4d 31 00 00 1e
ae 60 80 18 71 38 2d 40 30 2c 35 00 1d 4d 31 00
00 18 00 00 00 00 00 00 00 00 00 00 00 00 00 12

----------------

Block 0, Base EDID:
  EDID Structure Version & Revision: 1.4
  Vendor & Product Identification:
    Manufacturer: HKC
    Model: 45900
    Serial Number: ...
    Made in: week 17 of 2019
  Basic Display Parameters & Features:
    Digital display
    Bits per primary color channel: 8
    DisplayPort interface
    Maximum image size: 80 cm x 33 cm
    Gamma: 2.20
    DPMS levels: Off
    Supported color formats: RGB 4:4:4, YCrCb 4:4:4, YCrCb 4:2:2
    First detailed timing includes the native pixel format and preferred refresh rate
    Display is continuous frequency
  Color Characteristics:
    Red  : 0.6777, 0.3085
    Green: 0.2021, 0.6894
    Blue : 0.1484, 0.0507
    White: 0.3134, 0.3291
  Established Timings I & II:
    IBM     :   720x400    70.082 Hz   9:5    31.467 kHz  28.320 MHz
    DMT 0x04:   640x480    59.940 Hz   4:3    31.469 kHz  25.175 MHz
    DMT 0x05:   640x480    72.809 Hz   4:3    37.861 kHz  31.500 MHz
    DMT 0x06:   640x480    75.000 Hz   4:3    37.500 kHz  31.500 MHz
    DMT 0x08:   800x600    56.250 Hz   4:3    35.156 kHz  36.000 MHz
    DMT 0x09:   800x600    60.317 Hz   4:3    37.879 kHz  40.000 MHz
    DMT 0x0a:   800x600    72.188 Hz   4:3    48.077 kHz  50.000 MHz
    DMT 0x0b:   800x600    75.000 Hz   4:3    46.875 kHz  49.500 MHz
    DMT 0x10:  1024x768    60.004 Hz   4:3    48.363 kHz  65.000 MHz
    DMT 0x11:  1024x768    70.069 Hz   4:3    56.476 kHz  75.000 MHz
    DMT 0x12:  1024x768    75.029 Hz   4:3    60.023 kHz  78.750 MHz
    DMT 0x24:  1280x1024   75.025 Hz   5:4    79.976 kHz 135.000 MHz
  Standard Timings:
    DMT 0x23:  1280x1024   60.020 Hz   5:4    63.981 kHz 108.000 MHz
    CVT     :  1280x1024   99.962 Hz   5:4   108.658 kHz 189.500 MHz (EDID 1.4 source)
    GTF     :  1280x1024  100.000 Hz   5:4   108.500 kHz 190.960 MHz (EDID 1.3 source)
    DMT 0x2f:  1440x900    59.887 Hz  16:10   55.935 kHz 106.500 MHz
    CVT     :  1440x904    99.906 Hz  16:10   95.910 kHz 188.750 MHz (EDID 1.4 source)
    GTF     :  1440x904   100.000 Hz  16:10   95.800 kHz 188.534 MHz (EDID 1.3 source)
    DMT 0x3a:  1680x1050   59.954 Hz  16:10   65.290 kHz 146.250 MHz
    CVT     :  1680x1056   99.892 Hz  16:10  111.979 kHz 258.000 MHz (EDID 1.4 source)
    GTF     :  1680x1056  100.000 Hz  16:10  111.900 kHz 257.818 MHz (EDID 1.3 source)
    CVT     :  1920x1080   99.898 Hz  16:9   114.583 kHz 302.500 MHz (EDID 1.4 source)
    GTF     :  1920x1080  100.000 Hz  16:9   114.400 kHz 302.016 MHz (EDID 1.3 source)
    DMT 0x52:  1920x1080   60.000 Hz  16:9    67.500 kHz 148.500 MHz
  Detailed Timing Descriptors:
    DTD 1:  3440x1440   99.998 Hz  43:18  148.097 kHz 533.150 MHz (797 mm x 333 mm)
                 Hfront   48 Hsync  32 Hback  80 Hpol P
                 Vfront    3 Vsync   5 Vback  33 Vpol N
  Display Range Limits:
    Monitor ranges (Bare Limits): 48-100 Hz V, 162-162 kHz H, max dotclock 20 MHz
    Display Product Name: 'C340'
    Display Product Serial Number: ...
  Extension blocks: 1
Checksum: 0xad

----------------

Block 1, CTA-861 Extension Block:
  Revision: 3
  Basic audio support
  Supports YCbCr 4:4:4
  Supports YCbCr 4:2:2
  Native detailed modes: 5
  Video Data Block:
    VIC  16:  1920x1080   60.000 Hz  16:9    67.500 kHz 148.500 MHz (native)
    VIC  31:  1920x1080   50.000 Hz  16:9    56.250 kHz 148.500 MHz (native)
    VIC   5:  1920x1080i  60.000 Hz  16:9    33.750 kHz  74.250 MHz (native)
    VIC  20:  1920x1080i  50.000 Hz  16:9    28.125 kHz  74.250 MHz (native)
    VIC   4:  1280x720    60.000 Hz  16:9    45.000 kHz  74.250 MHz
    VIC  19:  1280x720    50.000 Hz  16:9    37.500 kHz  74.250 MHz
    VIC   3:   720x480    59.940 Hz  16:9    31.469 kHz  27.000 MHz
    VIC  18:   720x576    50.000 Hz  16:9    31.250 kHz  27.000 MHz
    VIC   1:   640x480    59.940 Hz   4:3    31.469 kHz  25.175 MHz
    VIC   2:   720x480    59.940 Hz   4:3    31.469 kHz  27.000 MHz
    VIC  17:   720x576    50.000 Hz   4:3    31.250 kHz  27.000 MHz
  Audio Data Block:
    Linear PCM:
      Max channels: 2
      Supported sample rates (kHz): 48 44.1 32
      Supported sample sizes (bits): 24 20 16
  Speaker Allocation Data Block:
    FL/FR - Front Left/Right
  Detailed Timing Descriptors:
    DTD 2:  1920x1080   50.000 Hz  16:9    56.250 kHz 148.500 MHz (797 mm x 333 mm)
                 Hfront  528 Hsync  44 Hback 148 Hpol N
                 Vfront    3 Vsync   5 Vback  37 Vpol N
    DTD 3:  3440x1440   60.016 Hz  43:18   88.883 kHz 319.980 MHz (797 mm x 333 mm)
                 Hfront   48 Hsync  32 Hback  80 Hpol N
                 Vfront    3 Vsync   5 Vback  33 Vpol N
    DTD 4:  2560x1440   59.951 Hz  16:9    88.787 kHz 241.500 MHz (797 mm x 333 mm)
                 Hfront   48 Hsync  32 Hback  80 Hpol P
                 Vfront    3 Vsync   5 Vback  33 Vpol P
    DTD 5:  2560x1440   99.918 Hz  16:9   147.978 kHz 402.500 MHz (797 mm x 333 mm)
                 Hfront   48 Hsync  64 Hback  48 Hpol P
                 Vfront    3 Vsync   5 Vback  33 Vpol P
    DTD 6:  1920x1080  100.000 Hz  16:9   112.500 kHz 247.500 MHz (797 mm x 333 mm)
                 Hfront   48 Hsync  44 Hback 188 Hpol N
                 Vfront    3 Vsync   5 Vback  37 Vpol N
Checksum: 0x12

----------------

Warnings:

Block 1, CTA-861 Extension Block:
  IT Video Formats are overscanned by default, but normally this should be underscanned.
  Display Product Serial Number is set, so the Serial Number in the Base EDID should be 0.
  Missing VCDB, needed for Set Selectable RGB Quantization to avoid interop issues.
EDID:
  Base EDID: Some timings are out of range of the Monitor Ranges:
    Horizontal Freq: 28.125 - 148.097 kHz (Monitor: 162.000 - 162.000 kHz)
    Maximum Clock: 533.150 MHz (Monitor: 20.000 MHz)
  CTA-861: Multiple native interlaced timings are defined.

Failures:

EDID:
  Base EDID: GTF timings are used, but the EDID does not signal GTF support.
  Base EDID: CVT timings are used, but the EDID does not signal CVT support.
  CTA-861: Native progressive timings are a mix of several resolutions.

EDID conformity: FAIL
