edid-decode (hex):

00 ff ff ff ff ff ff 00 34 38 c2 0b f1 01 00 00
0f 0a 01 00 28 20 18 32 e8 7e 4e 9e 57 45 98 24
10 47 4f a4 42 01 31 59 45 59 61 59 71 4f 81 80
01 01 01 01 01 01 f9 15 20 f8 30 58 1f 20 20 40
13 00 40 f0 10 00 00 1e a4 1a 20 10 31 58 24 20
2f 55 33 00 40 f0 10 00 00 1e 30 2a 00 98 51 00
2a 40 30 70 13 00 40 f0 10 00 00 1e ea 24 00 60
41 00 28 30 30 60 13 00 40 f0 10 00 00 1e 00 fb

----------------

Block 0, Base EDID:
  EDID Structure Version & Revision: 1.0
  Vendor & Product Identification:
    Manufacturer: MAX
    Model: 3010
    Serial Number: ...
    Made in: week 15 of 2000
  Basic Display Parameters & Features:
    Analog display
    Input voltage level: 0.714/0.286 V
    Blank level equals black level
    Sync: Separate
    Maximum image size: 32 cm x 24 cm
    Gamma: 1.50
    DPMS levels: Standby Suspend Off
    RGB color display
  Color Characteristics:
    Red  : 0.6181, 0.3427
    Green: 0.2724, 0.5957
    Blue : 0.1416, 0.0625
    White: 0.2802, 0.3105
  Established Timings I & II:
    IBM     :   720x400    70.082 Hz   9:5    31.467 kHz  28.320 MHz
    DMT 0x04:   640x480    59.940 Hz   4:3    31.469 kHz  25.175 MHz
    DMT 0x06:   640x480    75.000 Hz   4:3    37.500 kHz  31.500 MHz
    DMT 0x0b:   800x600    75.000 Hz   4:3    46.875 kHz  49.500 MHz
    DMT 0x12:  1024x768    75.029 Hz   4:3    60.023 kHz  78.750 MHz
  Standard Timings:
    DMT 0x07:   640x480    85.008 Hz   4:3    43.269 kHz  36.000 MHz
    DMT 0x0c:   800x600    85.061 Hz   4:3    53.674 kHz  56.250 MHz
    DMT 0x13:  1024x768    84.997 Hz   4:3    68.677 kHz  94.500 MHz
    DMT 0x15:  1152x864    75.000 Hz   4:3    67.500 kHz 108.000 MHz
    DMT 0x23:  1280x1024   60.020 Hz   5:4    63.981 kHz 108.000 MHz
  Detailed Timing Descriptors:
    DTD 1:   800x600    85.061 Hz   4:3    53.674 kHz  56.250 MHz (320 mm x 240 mm)
                 Hfront   32 Hsync  64 Hback 152 Hpol P
                 Vfront    1 Vsync   3 Vback  27 Vpol P
    DTD 2:   800x600   100.031 Hz   4:3    63.619 kHz  68.200 MHz (320 mm x 240 mm)
                 Hfront   47 Hsync  85 Hback 140 Hpol P
                 Vfront    3 Vsync   3 Vback  30 Vpol P
    DTD 3:  1280x1024   60.020 Hz   5:4    63.981 kHz 108.000 MHz (320 mm x 240 mm)
                 Hfront   48 Hsync 112 Hback 248 Hpol P
                 Vfront    1 Vsync   3 Vback  38 Vpol P
    DTD 4:  1024x768    84.997 Hz   4:3    68.677 kHz  94.500 MHz (320 mm x 240 mm)
                 Hfront   48 Hsync  96 Hback 208 Hpol P
                 Vfront    1 Vsync   3 Vback  36 Vpol P
Checksum: 0xfb

----------------

Warnings:

Block 0, Base EDID:
  EDID Structure Version & Revision: EDID 1.0 is deprecated, do not use.

EDID conformity: PASS
