edid-decode (hex):

00 ff ff ff ff ff ff 00 30 e4 2f 02 00 00 00 00
00 14 01 04 90 16 0d 78 0a bf 45 95 58 52 8a 28
25 50 54 00 00 00 01 01 01 01 01 01 01 01 01 01
01 01 01 01 01 01 06 18 00 b8 41 58 64 20 30 20
36 00 df 7d 00 00 00 1b 06 18 00 b8 41 58 64 20
30 20 36 00 df 7d 00 00 00 1b 00 00 00 fe 00 58
47 36 31 31 80 31 30 31 57 53 41 0a 00 00 00 00
00 00 41 33 94 01 00 00 00 01 01 0a 20 20 00 34

----------------

Block 0, Base EDID:
  EDID Structure Version & Revision: 1.4
  Vendor & Product Identification:
    Manufacturer: LGD
    Model: 559
    Made in: 2010
  Basic Display Parameters & Features:
    Digital display
    Bits per primary color channel: 6
    Digital interface is not defined
    Maximum image size: 22 cm x 13 cm
    Gamma: 2.20
    Supported color formats: RGB 4:4:4, YCrCb 4:4:4
    First detailed timing includes the native pixel format and preferred refresh rate
  Color Characteristics:
    Red  : 0.5839, 0.3466
    Green: 0.3232, 0.5419
    Blue : 0.1572, 0.1445
    White: 0.3134, 0.3291
  Established Timings I & II: none
  Standard Timings: none
  Detailed Timing Descriptors:
    DTD 1:  1024x600    60.011710 Hz 128:75    42.008 kHz     61.500000 MHz (223 mm x 125 mm)
                 Hfront   48 Hsync  32 Hback  360 Hpol P
                 Vfront    3 Vsync   6 Vback   91 Vpol N
    DTD 2:  1024x600    60.011710 Hz 128:75    42.008 kHz     61.500000 MHz (223 mm x 125 mm)
                 Hfront   48 Hsync  32 Hback  360 Hpol P
                 Vfront    3 Vsync   6 Vback   91 Vpol N
    Alphanumeric Data String: 'XG611'
    Manufacturer-Specified Display Descriptor (0x00): 00 00 00 00 41 33 94 01 00 00 00 01 01 0a 20 20 '....A3........  '
Checksum: 0x34

----------------

Warnings:

Block 0, Base EDID:
  Missing Display Product Name.

Failures:

Block 0, Base EDID:
  Alphanumeric Data String: Non-printable character.

EDID conformity: FAIL
