edid-decode (hex):

00 ff ff ff ff ff ff 00 24 4d ec 19 01 01 01 01
1d 0e 01 03 68 1e 17 78 2a 8c 3e a4 58 4d 91 24
15 4f 51 bf ee 00 01 01 01 01 01 01 01 01 01 01
01 01 01 01 01 01 64 19 00 40 41 00 26 30 18 88
36 00 30 e4 10 00 00 18 00 00 00 fd 00 38 4b 1e
3d 08 00 0a 20 20 20 20 20 20 00 00 00 fc 00 49
42 4d 20 4c 31 35 30 0a 20 20 20 20 00 00 00 ff
00 32 34 2d 54 59 34 36 38 0a 20 20 20 20 00 06

00 ff ff ff ff ff ff 00 24 4d ec 19 01 01 01 01
1d 0e 01 03 68 1e 17 78 2a 8c 3e a4 58 4d 91 24
15 4f 51 bf ee 00 01 01 01 01 01 01 01 01 01 01
01 01 01 01 01 01 64 19 00 40 41 00 26 30 18 88
36 00 30 e4 10 00 00 18 00 00 00 fd 00 38 4b 1e
3d 08 00 0a 20 20 20 20 20 20 00 00 00 fc 00 49
42 4d 20 4c 31 35 30 0a 20 20 20 20 00 00 00 ff
00 32 34 2d 54 59 34 36 38 0a 20 20 20 20 00 06

----------------

Block 0, Base EDID:
  EDID Structure Version & Revision: 1.3
  Vendor & Product Identification:
    Manufacturer: IBM
    Model: 6636
    Serial Number: ...
    Made in: week 29 of 2004
  Basic Display Parameters & Features:
    Analog display
    Signal Level Standard: 0.700 : 0.000 : 0.700 V p-p
    Blank level equals black level
    Sync: Separate
    Maximum image size: 30 cm x 23 cm
    Gamma: 2.20
    DPMS levels: Off
    RGB color display
    First detailed timing is the preferred timing
  Color Characteristics:
    Red  : 0.6425, 0.3437
    Green: 0.3037, 0.5664
    Blue : 0.1406, 0.0849
    White: 0.3115, 0.3183
  Established Timings I & II:
    IBM     :   720x400    70.081663 Hz   9:5     31.467 kHz     28.320000 MHz
    DMT 0x04:   640x480    59.940476 Hz   4:3     31.469 kHz     25.175000 MHz
    Apple   :   640x480    66.666667 Hz   4:3     35.000 kHz     30.240000 MHz
    DMT 0x05:   640x480    72.808802 Hz   4:3     37.861 kHz     31.500000 MHz
    DMT 0x06:   640x480    75.000000 Hz   4:3     37.500 kHz     31.500000 MHz
    DMT 0x08:   800x600    56.250000 Hz   4:3     35.156 kHz     36.000000 MHz
    DMT 0x09:   800x600    60.316541 Hz   4:3     37.879 kHz     40.000000 MHz
    DMT 0x0a:   800x600    72.187572 Hz   4:3     48.077 kHz     50.000000 MHz
    DMT 0x0b:   800x600    75.000000 Hz   4:3     46.875 kHz     49.500000 MHz
    Apple   :   832x624    74.551266 Hz   4:3     49.726 kHz     57.284000 MHz
    DMT 0x10:  1024x768    60.003840 Hz   4:3     48.363 kHz     65.000000 MHz
    DMT 0x11:  1024x768    70.069359 Hz   4:3     56.476 kHz     75.000000 MHz
    DMT 0x12:  1024x768    75.028582 Hz   4:3     60.023 kHz     78.750000 MHz
  Standard Timings: none
  Detailed Timing Descriptors:
    DTD 1:  1024x768    60.003840 Hz   4:3     48.363 kHz     65.000000 MHz (304 mm x 228 mm)
                 Hfront   24 Hsync 136 Hback  160 Hpol N
                 Vfront    3 Vsync   6 Vback   29 Vpol N
    Display Range Limits:
      Monitor ranges (GTF): 56-75 Hz V, 30-61 kHz H, max dotclock 80 MHz
    Display Product Name: 'IBM L150'
    Display Product Serial Number: ...
Checksum: 0x06

----------------

Block 1, Unknown EDID Extension Block 0x00:
  00 ff ff ff ff ff ff 00 24 4d ec 19 01 01 01 01 '........$M......'
  1d 0e 01 03 68 1e 17 78 2a 8c 3e a4 58 4d 91 24 '....h..x*.>.XM.$'
  15 4f 51 bf ee 00 01 01 01 01 01 01 01 01 01 01 '.OQ.............'
  01 01 01 01 01 01 64 19 00 40 41 00 26 30 18 88 '......d..@A.&0..'
  36 00 30 e4 10 00 00 18 00 00 00 fd 00 38 4b 1e '6.0..........8K.'
  3d 08 00 0a 20 20 20 20 20 20 00 00 00 fc 00 49 '=...      .....I'
  42 4d 20 4c 31 35 30 0a 20 20 20 20 00 00 00 ff 'BM L150.    ....'
  00 32 34 2d 54 59 34 36 38 0a 20 20 20 20 00 06 '.24-TY468.    ..'
Checksum: 0x06

----------------

Failures:

Block 1, Base EDID:
  Unknown Extension Block.
EDID:
  Base EDID: EDID specified 0 extension block(s), but found 1 extension block(s).

EDID conformity: FAIL
