
EDID (hex):
00ffffffffffff003669a73c01010101
2a200104b53b2178ff55b5ac5047ac25
0a50543fcf0081809500b300d1c00101
0101010101015335809c70381040582c
450055502100001a000000fd0030a5a7
a73c010a202020202020000000fc004d
534920473237330a20202020000000ff
00434137413439324130323532310139
02033df14b01020304901112131f3f40
23091707830100006a030c001000383c
20000067d85dc4017880036d1a000002
0130a5000000000000e305e301d09480
a070381e40304035000f282100001a13
8480a070383240302075085550210000
1ab24d80a07038324030207508555021
00001a0000000000000000000000009d

edid-decode (hex):

00 ff ff ff ff ff ff 00 36 69 a7 3c 01 01 01 01
2a 20 01 04 b5 3b 21 78 ff 55 b5 ac 50 47 ac 25
0a 50 54 3f cf 00 81 80 95 00 b3 00 d1 c0 01 01
01 01 01 01 01 01 53 35 80 9c 70 38 10 40 58 2c
45 00 55 50 21 00 00 1a 00 00 00 fd 00 30 a5 a7
a7 3c 01 0a 20 20 20 20 20 20 00 00 00 fc 00 4d
53 49 20 47 32 37 33 0a 20 20 20 20 00 00 00 ff
00 43 41 37 41 34 39 32 41 30 32 35 32 31 01 39

02 03 3d f1 4b 01 02 03 04 90 11 12 13 1f 3f 40
23 09 17 07 83 01 00 00 6a 03 0c 00 10 00 38 3c
20 00 00 67 d8 5d c4 01 78 80 03 6d 1a 00 00 02
01 30 a5 00 00 00 00 00 00 e3 05 e3 01 d0 94 80
a0 70 38 1e 40 30 40 35 00 0f 28 21 00 00 1a 13
84 80 a0 70 38 32 40 30 20 75 08 55 50 21 00 00
1a b2 4d 80 a0 70 38 32 40 30 20 75 08 55 50 21
00 00 1a 00 00 00 00 00 00 00 00 00 00 00 00 9d

----------------

Block 0, Base EDID:
  EDID Structure Version & Revision: 1.4
  Vendor & Product Identification:
    Manufacturer: MSI
    Model: 15527
    Serial Number: 16843009
    Made in: week 42 of 2022
  Basic Display Parameters & Features:
    Digital display
    Bits per primary color channel: 10
    DisplayPort interface
    Maximum image size: 59 cm x 33 cm
    Gamma: 2.20
    DPMS levels: Standby Suspend Off
    Supported color formats: RGB 4:4:4, YCrCb 4:4:4, YCrCb 4:2:2
    Default (sRGB) color space is primary color space
    First detailed timing includes the native pixel format and preferred refresh rate
    Display is continuous frequency
  Color Characteristics:
    Red  : 0.6728, 0.3134
    Green: 0.2783, 0.6728
    Blue : 0.1464, 0.0419
    White: 0.3134, 0.3291
  Established Timings I & II:
    DMT 0x04:   640x480    59.940476 Hz   4:3     31.469 kHz     25.175000 MHz
    Apple   :   640x480    66.666667 Hz   4:3     35.000 kHz     30.240000 MHz
    DMT 0x05:   640x480    72.808802 Hz   4:3     37.861 kHz     31.500000 MHz
    DMT 0x06:   640x480    75.000000 Hz   4:3     37.500 kHz     31.500000 MHz
    DMT 0x08:   800x600    56.250000 Hz   4:3     35.156 kHz     36.000000 MHz
    DMT 0x09:   800x600    60.316541 Hz   4:3     37.879 kHz     40.000000 MHz
    DMT 0x0a:   800x600    72.187572 Hz   4:3     48.077 kHz     50.000000 MHz
    DMT 0x0b:   800x600    75.000000 Hz   4:3     46.875 kHz     49.500000 MHz
    DMT 0x10:  1024x768    60.003840 Hz   4:3     48.363 kHz     65.000000 MHz
    DMT 0x11:  1024x768    70.069359 Hz   4:3     56.476 kHz     75.000000 MHz
    DMT 0x12:  1024x768    75.028582 Hz   4:3     60.023 kHz     78.750000 MHz
    DMT 0x24:  1280x1024   75.024675 Hz   5:4     79.976 kHz    135.000000 MHz
  Standard Timings:
    DMT 0x23:  1280x1024   60.019740 Hz   5:4     63.981 kHz    108.000000 MHz
    DMT 0x2f:  1440x900    59.887445 Hz  16:10    55.935 kHz    106.500000 MHz
    DMT 0x3a:  1680x1050   59.954250 Hz  16:10    65.290 kHz    146.250000 MHz
    DMT 0x52:  1920x1080   60.000000 Hz  16:9     67.500 kHz    148.500000 MHz
  Detailed Timing Descriptors:
    DTD 1:  1920x1080   59.996589 Hz  16:9     65.756 kHz    136.510000 MHz (597 mm x 336 mm)
                 Hfront   88 Hsync  44 Hback   24 Hpol P
                 Vfront    4 Vsync   5 Vback    7 Vpol N
    Display Range Limits:
      Monitor ranges (Bare Limits): 48-165 Hz V, 167-167 kHz H, max dotclock 600 MHz
    Display Product Name: 'MSI G273'
    Display Product Serial Number: 'CA7A492A02521'
  Extension blocks: 1
Checksum: 0x39

----------------

Block 1, CTA-861 Extension Block:
  Revision: 3
  Underscans IT Video Formats by default
  Basic audio support
  Supports YCbCr 4:4:4
  Supports YCbCr 4:2:2
  Native detailed modes: 1
  Video Data Block:
    VIC   1:   640x480    59.940476 Hz   4:3     31.469 kHz     25.175000 MHz
    VIC   2:   720x480    59.940060 Hz   4:3     31.469 kHz     27.000000 MHz
    VIC   3:   720x480    59.940060 Hz  16:9     31.469 kHz     27.000000 MHz
    VIC   4:  1280x720    60.000000 Hz  16:9     45.000 kHz     74.250000 MHz
    VIC  16:  1920x1080   60.000000 Hz  16:9     67.500 kHz    148.500000 MHz (native)
    VIC  17:   720x576    50.000000 Hz   4:3     31.250 kHz     27.000000 MHz
    VIC  18:   720x576    50.000000 Hz  16:9     31.250 kHz     27.000000 MHz
    VIC  19:  1280x720    50.000000 Hz  16:9     37.500 kHz     74.250000 MHz
    VIC  31:  1920x1080   50.000000 Hz  16:9     56.250 kHz    148.500000 MHz
    VIC  63:  1920x1080  120.000000 Hz  16:9    135.000 kHz    297.000000 MHz
    VIC  64:  1920x1080  100.000000 Hz  16:9    112.500 kHz    297.000000 MHz
  Audio Data Block:
    Linear PCM:
      Max channels: 2
      Supported sample rates (kHz): 96 48 44.1 32
      Supported sample sizes (bits): 24 20 16
  Speaker Allocation Data Block:
    FL/FR - Front Left/Right
  Vendor-Specific Data Block (HDMI), OUI 00-0C-03:
    Source physical address: 1.0.0.0
    DC_36bit
    DC_30bit
    DC_Y444
    Maximum TMDS clock: 300 MHz
    Extended HDMI video details:
  Vendor-Specific Data Block (HDMI Forum), OUI C4-5D-D8:
    Version: 1
    Maximum TMDS Character Rate: 600 MHz
    SCDC Present
    Supports 12-bits/component Deep Color 4:2:0 Pixel Encoding
    Supports 10-bits/component Deep Color 4:2:0 Pixel Encoding
  Vendor-Specific Data Block (AMD), OUI 00-00-1A:
    Version: 2.1
    Minimum Refresh Rate: 48 Hz
    Maximum Refresh Rate: 165 Hz
    Flags 1.x: 0x00
    Flags 2.x: 0x00
    Maximum luminance: 0 (50.000 cd/m^2)
    Minimum luminance: 0 (0.000 cd/m^2)
    Unknown: 0x00 0x00
  Colorimetry Data Block:
    xvYCC601
    xvYCC709
    BT2020cYCC
    BT2020YCC
    BT2020RGB
    Gamut Boundary Description Metadata Profile P0
  Detailed Timing Descriptors:
    DTD 2:  1920x1080  165.003465 Hz  16:9    183.154 kHz    380.960000 MHz (527 mm x 296 mm)
                 Hfront   48 Hsync  64 Hback   48 Hpol P
                 Vfront    3 Vsync   5 Vback   22 Vpol N
    DTD 3:  1920x1080  143.852110 Hz  16:9    162.553 kHz    338.110000 MHz (597 mm x 336 mm)
                 Hfront   48 Hsync  32 Hback   80 Hpol P
                 Vfront   39 Vsync   5 Vback    6 Vpol N
    DTD 4:  1920x1080   84.623894 Hz  16:9     95.625 kHz    198.900000 MHz (597 mm x 336 mm)
                 Hfront   48 Hsync  32 Hback   80 Hpol P
                 Vfront   39 Vsync   5 Vback    6 Vpol N
Checksum: 0x9d  Unused space in Extension Block: 12 bytes
