edid-decode (hex):

00 ff ff ff ff ff ff 00 06 af 74 91 00 00 00 00
01 12 01 03 80 21 15 78 0a 27 75 98 58 58 92 27
1d 50 54 00 00 00 01 01 01 01 01 01 01 01 01 01
01 01 01 01 01 01 c7 1b 00 9e 50 20 18 30 30 20
36 00 4b cf 10 00 00 18 00 00 00 0f 00 00 00 00
00 00 00 00 00 00 00 00 00 20 00 00 00 fe 00 41
55 4f 0a 20 00 20 20 20 20 20 20 20 00 00 00 fe
00 42 31 35 34 45 57 30 39 20 56 31 20 0a 00 c3

----------------

Block 0, Base EDID:
  EDID Structure Version & Revision: 1.3
  Vendor & Product Identification:
    Manufacturer: AUO
    Model: 37236
    Made in: week 1 of 2008
  Basic Display Parameters & Features:
    Digital display
    Maximum image size: 33 cm x 21 cm
    Gamma: 2.20
    RGB color display
    First detailed timing is the preferred timing
  Color Characteristics:
    Red  : 0.5937, 0.3457
    Green: 0.3447, 0.5732
    Blue : 0.1533, 0.1162
    White: 0.3134, 0.3291
  Established Timings I & II: none
  Standard Timings: none
  Detailed Timing Descriptors:
    DTD 1:  1280x800    60.013 Hz   8:5    49.451 kHz  71.110 MHz (331 mm x 207 mm)
                 Hfront   48 Hsync  32 Hback  78 Hpol N
                 Vfront    3 Vsync   6 Vback  15 Vpol N
    Manufacturer-Specified Display Descriptor (0x0f): 00 0f 00 00 00 00 00 00 00 00 00 00 00 00 00 20 '............... '
    Alphanumeric Data String: 'AUO'
    Alphanumeric Data String: 'B154EW09 V1 '
Checksum: 0xc3

----------------

Failures:

Block 0, Base EDID:
  Alphanumeric Data String: Non-space after newline.
  Alphanumeric Data String: One or more trailing spaces.
  Missing Display Product Name.
  Missing Display Range Limits Descriptor.

EDID conformity: FAIL
