edid-decode (hex):

00 ff ff ff ff ff ff 00 26 cd 70 46 00 00 00 00
06 0c 01 03 81 22 1b 78 ef 0d c2 a0 57 47 98 27
12 48 4f bf ee 00 81 80 61 40 61 59 45 40 45 59
31 40 31 59 01 01 30 2a 00 98 51 00 2a 40 30 70
13 00 68 22 11 00 00 1e 00 00 00 fd 00 38 55 1f
40 0b 00 0a 20 20 20 20 20 20 00 00 00 fc 00 41
53 34 33 33 32 20 20 20 20 20 20 0a 00 00 00 ff
00 30 0a 20 20 20 20 20 20 20 20 20 20 20 00 ee

00 ff ff ff ff ff ff 00 26 cd 70 46 00 00 00 00
06 0c 01 03 81 22 1b 78 ef 0d c2 a0 57 47 98 27
12 48 4f bf ee 00 81 80 61 40 61 59 45 40 45 59
31 40 31 59 01 01 30 2a 00 98 51 00 2a 40 30 70
13 00 68 22 11 00 00 1e 00 00 00 fd 00 38 55 1f
40 0b 00 0a 20 20 20 20 20 20 00 00 00 fc 00 41
53 34 33 33 32 20 20 20 20 20 20 0a 00 00 00 ff
00 30 0a 20 20 20 20 20 20 20 20 20 20 20 00 ee

----------------

Block 0, Base EDID:
  EDID Structure Version & Revision: 1.3
  Vendor & Product Identification:
    Manufacturer: IVM
    Model: 18032
    Made in: week 6 of 2002
  Basic Display Parameters & Features:
    Digital display
    DFP 1.x compatible TMDS
    Maximum image size: 34 cm x 27 cm
    Gamma: 2.20
    DPMS levels: Standby Suspend Off
    RGB color display
    Default (sRGB) color space is primary color space
    First detailed timing is the preferred timing
    Supports GTF timings within operating range
  Color Characteristics:
    Red  : 0.6250, 0.3398
    Green: 0.2802, 0.5947
    Blue : 0.1552, 0.0703
    White: 0.2812, 0.3105
  Established Timings I & II:
    IBM     :   720x400    70.081663 Hz   9:5     31.467 kHz     28.320000 MHz
    DMT 0x04:   640x480    59.940476 Hz   4:3     31.469 kHz     25.175000 MHz
    Apple   :   640x480    66.666667 Hz   4:3     35.000 kHz     30.240000 MHz
    DMT 0x05:   640x480    72.808802 Hz   4:3     37.861 kHz     31.500000 MHz
    DMT 0x06:   640x480    75.000000 Hz   4:3     37.500 kHz     31.500000 MHz
    DMT 0x08:   800x600    56.250000 Hz   4:3     35.156 kHz     36.000000 MHz
    DMT 0x09:   800x600    60.316541 Hz   4:3     37.879 kHz     40.000000 MHz
    DMT 0x0a:   800x600    72.187572 Hz   4:3     48.077 kHz     50.000000 MHz
    DMT 0x0b:   800x600    75.000000 Hz   4:3     46.875 kHz     49.500000 MHz
    Apple   :   832x624    74.551266 Hz   4:3     49.726 kHz     57.284000 MHz
    DMT 0x10:  1024x768    60.003840 Hz   4:3     48.363 kHz     65.000000 MHz
    DMT 0x11:  1024x768    70.069359 Hz   4:3     56.476 kHz     75.000000 MHz
    DMT 0x12:  1024x768    75.028582 Hz   4:3     60.023 kHz     78.750000 MHz
  Standard Timings:
    DMT 0x23:  1280x1024   60.019740 Hz   5:4     63.981 kHz    108.000000 MHz
    DMT 0x10:  1024x768    60.003840 Hz   4:3     48.363 kHz     65.000000 MHz
    DMT 0x13:  1024x768    84.996690 Hz   4:3     68.677 kHz     94.500000 MHz
    DMT 0x09:   800x600    60.316541 Hz   4:3     37.879 kHz     40.000000 MHz
    DMT 0x0c:   800x600    85.061274 Hz   4:3     53.674 kHz     56.250000 MHz
    DMT 0x04:   640x480    59.940476 Hz   4:3     31.469 kHz     25.175000 MHz
    DMT 0x07:   640x480    85.008312 Hz   4:3     43.269 kHz     36.000000 MHz
  Detailed Timing Descriptors:
    DTD 1:  1280x1024   60.019740 Hz   5:4     63.981 kHz    108.000000 MHz (360 mm x 290 mm)
                 Hfront   48 Hsync 112 Hback  248 Hpol P
                 Vfront    1 Vsync   3 Vback   38 Vpol P
    Display Range Limits:
      Monitor ranges (GTF): 56-85 Hz V, 31-64 kHz H, max dotclock 110 MHz
    Display Product Name: 'AS4332      '
    Display Product Serial Number: ...
Checksum: 0xee

----------------

Block 1, Unknown EDID Extension Block 0x00:
  00 ff ff ff ff ff ff 00 26 cd 70 46 00 00 00 00 '........&.pF....'
  06 0c 01 03 81 22 1b 78 ef 0d c2 a0 57 47 98 27 '.....".x....WG.''
  12 48 4f bf ee 00 81 80 61 40 61 59 45 40 45 59 '.HO.....a@aYE@EY'
  31 40 31 59 01 01 30 2a 00 98 51 00 2a 40 30 70 '1@1Y..0*..Q.*@0p'
  13 00 68 22 11 00 00 1e 00 00 00 fd 00 38 55 1f '..h".........8U.'
  40 0b 00 0a 20 20 20 20 20 20 00 00 00 fc 00 41 '@...      .....A'
  53 34 33 33 32 20 20 20 20 20 20 0a 00 00 00 ff 'S4332      .....'
  00 30 0a 20 20 20 20 20 20 20 20 20 20 20 00 ee '.0.           ..'
Checksum: 0xee

----------------

Failures:

Block 0, Base EDID:
  Basic Display Parameters & Features: sRGB is signaled, but the chromaticities do not match.
  Detailed Timing Descriptor #1: Mismatch of image size 360x290 mm vs display size 340x270 mm.
  Display Product Name: One or more trailing spaces.
Block 1, Base EDID:
  Unknown Extension Block.
EDID:
  Base EDID: Some timings are out of range of the Monitor Ranges:
    Horizontal Freq: 31.466 - 68.677 kHz (Monitor: 31.000 - 64.000 kHz)
  Base EDID: The DTD max image size is 360x290mm, which is larger than the display size 340.0x270.0mm.
  Base EDID: EDID specified 0 extension block(s), but found 1 extension block(s).

EDID conformity: FAIL
