edid-decode (hex):

00 ff ff ff ff ff ff 00 09 e5 ea 06 00 00 00 00
01 1a 01 04 a5 1f 11 78 02 e7 b0 95 5c 59 94 29
22 50 54 00 00 00 01 01 01 01 01 01 01 01 01 01
01 01 01 01 01 01 c8 36 80 cc 70 38 14 40 30 20
36 00 35 ad 10 00 00 1a 86 24 80 cc 70 38 14 40
64 64 44 05 35 ad 10 00 00 1a 00 00 00 00 00 00
00 00 00 00 00 00 00 00 00 00 00 00 00 00 00 02
00 0b 43 f4 0a 3c 6e 12 0e 18 73 00 00 00 00 bb

00 ff ff ff ff ff ff 00 09 e5 ea 06 00 00 00 00
01 1a 01 04 a5 1f 11 78 02 e7 b0 95 5c 59 94 29
22 50 54 00 00 00 01 01 01 01 01 01 01 01 01 01
01 01 01 01 01 01 c8 36 80 cc 70 38 14 40 30 20
36 00 35 ad 10 00 00 1a 86 24 80 cc 70 38 14 40
64 64 44 05 35 ad 10 00 00 1a 00 00 00 00 00 00
00 00 00 00 00 00 00 00 00 00 00 00 00 00 00 02
00 0b 43 f4 0a 3c 6e 12 0e 18 73 00 00 00 00 bb

----------------

Block 0, Base EDID:
  EDID Structure Version & Revision: 1.4
  Vendor & Product Identification:
    Manufacturer: BOE
    Model: 1770
    Made in: week 1 of 2016
  Basic Display Parameters & Features:
    Digital display
    Bits per primary color channel: 8
    DisplayPort interface
    Maximum image size: 31 cm x 17 cm
    Gamma: 2.20
    Supported color formats: RGB 4:4:4
    First detailed timing includes the native pixel format and preferred refresh rate
  Color Characteristics:
    Red  : 0.5849, 0.3613
    Green: 0.3486, 0.5810
    Blue : 0.1621, 0.1357
    White: 0.3125, 0.3281
  Established Timings I & II: none
  Standard Timings: none
  Detailed Timing Descriptors:
    DTD 1:  1920x1080   60.023968 Hz  16:9     66.026 kHz    140.240000 MHz (309 mm x 173 mm)
                 Hfront   48 Hsync  32 Hback  124 Hpol P
                 Vfront    3 Vsync   6 Vback   11 Vpol N
    DTD 2:  1920x1080   40.018832 Hz  16:9     44.021 kHz     93.500000 MHz (309 mm x 173 mm)
                 Hfront  100 Hsync 100 Hback    4 Hpol P
                 Vfront   20 Vsync  20 Vback  -20 Vpol N
    Empty Descriptor
    Manufacturer-Specified Display Descriptor (0x02): 00 02 00 0b 43 f4 0a 3c 6e 12 0e 18 73 00 00 00 '....C..<n...s...'
Checksum: 0xbb

----------------

Block 1, Unknown EDID Extension Block 0x00:
  00 ff ff ff ff ff ff 00 09 e5 ea 06 00 00 00 00 '................'
  01 1a 01 04 a5 1f 11 78 02 e7 b0 95 5c 59 94 29 '.......x....\Y.)'
  22 50 54 00 00 00 01 01 01 01 01 01 01 01 01 01 '"PT.............'
  01 01 01 01 01 01 c8 36 80 cc 70 38 14 40 30 20 '.......6..p8.@0 '
  36 00 35 ad 10 00 00 1a 86 24 80 cc 70 38 14 40 '6.5......$..p8.@'
  64 64 44 05 35 ad 10 00 00 1a 00 00 00 00 00 00 'ddD.5...........'
  00 00 00 00 00 00 00 00 00 00 00 00 00 00 00 02 '................'
  00 0b 43 f4 0a 3c 6e 12 0e 18 73 00 00 00 00 bb '..C..<n...s.....'
Checksum: 0xbb

----------------

Warnings:

Block 0, Base EDID:
  Missing Display Product Name.

Failures:

Block 0, Base EDID:
  Detailed Timing Descriptor #2: 0 or negative vertical back porch.
  Empty Descriptor: Use Dummy Descriptor instead of all zeroes.
Block 1, Base EDID:
  Unknown Extension Block.
EDID:
  Base EDID: EDID specified 0 extension block(s), but found 1 extension block(s).

EDID conformity: FAIL
