edid-decode (hex):

00 ff ff ff ff ff ff 00 10 ac c0 ef 49 58 4a 30
05 0f 01 03 68 2a 19 78 2e d9 ad a3 55 46 98 24
10 47 4a a5 4a 00 81 80 01 01 01 01 01 01 01 01
01 01 01 01 01 01 0e 1f 00 80 51 00 1e 30 40 80
37 00 9c f7 10 00 00 1c 00 00 00 fd 00 38 4b 1e
40 0b 00 0a 20 20 20 20 20 20 00 00 00 fc 00 57
31 39 30 30 20 4c 43 44 20 54 56 0a 00 00 00 ff
00 30 57 35 36 34 36 35 31 53 30 4a 58 49 00 30

----------------

Block 0, Base EDID:
  EDID Structure Version & Revision: 1.3
  Vendor & Product Identification:
    Manufacturer: DEL
    Model: 61376
    Serial Number: ...
    Made in: week 5 of 2005
  Basic Display Parameters & Features:
    Analog display
    Signal Level Standard: 0.700 : 0.000 : 0.700 V p-p
    Blank level equals black level
    Sync: Separate
    Maximum image size: 42 cm x 25 cm
    Gamma: 2.20
    DPMS levels: Off
    RGB color display
    Default (sRGB) color space is primary color space
    First detailed timing is the preferred timing
  Color Characteristics:
    Red  : 0.6396, 0.3330
    Green: 0.2753, 0.5947
    Blue : 0.1425, 0.0644
    White: 0.2802, 0.2900
  Established Timings I & II:
    IBM     :   720x400    70.081663 Hz   9:5     31.467 kHz     28.320000 MHz
    DMT 0x04:   640x480    59.940476 Hz   4:3     31.469 kHz     25.175000 MHz
    DMT 0x06:   640x480    75.000000 Hz   4:3     37.500 kHz     31.500000 MHz
    DMT 0x09:   800x600    60.316541 Hz   4:3     37.879 kHz     40.000000 MHz
    DMT 0x0b:   800x600    75.000000 Hz   4:3     46.875 kHz     49.500000 MHz
    DMT 0x10:  1024x768    60.003840 Hz   4:3     48.363 kHz     65.000000 MHz
    DMT 0x12:  1024x768    75.028582 Hz   4:3     60.023 kHz     78.750000 MHz
  Standard Timings:
    DMT 0x23:  1280x1024   60.019740 Hz   5:4     63.981 kHz    108.000000 MHz
  Detailed Timing Descriptors:
    DTD 1:  1280x768    59.870228 Hz   5:3     47.776 kHz     79.500000 MHz (412 mm x 247 mm)
                 Hfront   64 Hsync 128 Hback  192 Hpol N
                 Vfront    3 Vsync   7 Vback   20 Vpol P
    Display Range Limits:
      Monitor ranges (GTF): 56-75 Hz V, 30-64 kHz H, max dotclock 110 MHz
    Display Product Name: 'W1900 LCD TV'
    Display Product Serial Number: ...
Checksum: 0x30

----------------

Failures:

Block 0, Base EDID:
  Basic Display Parameters & Features: sRGB is signaled, but the chromaticities do not match.

EDID conformity: FAIL
