edid-decode (hex):

00 ff ff ff ff ff ff 00 5a 63 11 67 01 01 01 01
1c 0d 01 03 0e 24 1d 78 2a 0a 25 a2 57 4b 99 24
18 50 54 bf ef 80 81 80 81 99 81 59 81 40 71 4f
61 59 45 59 31 59 30 2a 00 98 51 00 2a 40 30 70
13 00 67 1f 11 00 00 1e 00 00 00 ff 00 41 31 5a
30 33 32 38 31 34 37 37 36 0a 00 00 00 fd 00 32
55 1e 5c 10 00 0a 20 20 20 20 20 20 00 00 00 fc
00 56 50 31 38 31 62 2d 32 0a 20 20 20 20 00 1e

00 ff ff ff ff ff ff 00 5a 63 11 67 01 01 01 01
1c 0d 01 03 0e 24 1d 78 2a 0a 25 a2 57 4b 99 24
18 50 54 bf ef 80 81 80 81 99 81 59 81 40 71 4f
61 59 45 59 31 59 30 2a 00 98 51 00 2a 40 30 70
13 00 67 1f 11 00 00 1e 00 00 00 ff 00 41 31 5a
30 33 32 38 31 34 37 37 36 0a 00 00 00 fd 00 32
55 1e 5c 10 00 0a 20 20 20 20 20 20 00 00 00 fc
00 56 50 31 38 31 62 2d 32 0a 20 20 20 20 00 1e

----------------

Block 0, Base EDID:
  EDID Structure Version & Revision: 1.3
  Vendor & Product Identification:
    Manufacturer: VSC
    Model: 26385
    Serial Number: ...
    Made in: week 28 of 2003
  Basic Display Parameters & Features:
    Analog display
    Signal Level Standard: 0.700 : 0.300 : 1.000 V p-p
    Blank level equals black level
    Sync: Separate Composite SyncOnGreen
    Maximum image size: 36 cm x 29 cm
    Gamma: 2.20
    DPMS levels: Off
    RGB color display
    First detailed timing is the preferred timing
  Color Characteristics:
    Red  : 0.6328, 0.3398
    Green: 0.2949, 0.5996
    Blue : 0.1406, 0.0957
    White: 0.3134, 0.3291
  Established Timings I & II:
    IBM     :   720x400    70.081663 Hz   9:5     31.467 kHz     28.320000 MHz
    DMT 0x04:   640x480    59.940476 Hz   4:3     31.469 kHz     25.175000 MHz
    Apple   :   640x480    66.666667 Hz   4:3     35.000 kHz     30.240000 MHz
    DMT 0x05:   640x480    72.808802 Hz   4:3     37.861 kHz     31.500000 MHz
    DMT 0x06:   640x480    75.000000 Hz   4:3     37.500 kHz     31.500000 MHz
    DMT 0x08:   800x600    56.250000 Hz   4:3     35.156 kHz     36.000000 MHz
    DMT 0x09:   800x600    60.316541 Hz   4:3     37.879 kHz     40.000000 MHz
    DMT 0x0a:   800x600    72.187572 Hz   4:3     48.077 kHz     50.000000 MHz
    DMT 0x0b:   800x600    75.000000 Hz   4:3     46.875 kHz     49.500000 MHz
    Apple   :   832x624    74.551266 Hz   4:3     49.726 kHz     57.284000 MHz
    DMT 0x10:  1024x768    60.003840 Hz   4:3     48.363 kHz     65.000000 MHz
    DMT 0x11:  1024x768    70.069359 Hz   4:3     56.476 kHz     75.000000 MHz
    DMT 0x12:  1024x768    75.028582 Hz   4:3     60.023 kHz     78.750000 MHz
    DMT 0x24:  1280x1024   75.024675 Hz   5:4     79.976 kHz    135.000000 MHz
    Apple   :  1152x870    75.061550 Hz 192:145   68.681 kHz    100.000000 MHz
  Standard Timings:
    DMT 0x23:  1280x1024   60.019740 Hz   5:4     63.981 kHz    108.000000 MHz
    DMT 0x25:  1280x1024   85.024098 Hz   5:4     91.146 kHz    157.500000 MHz
    DMT 0x21:  1280x960    85.002473 Hz   4:3     85.938 kHz    148.500000 MHz
    DMT 0x20:  1280x960    60.000000 Hz   4:3     60.000 kHz    108.000000 MHz
    DMT 0x15:  1152x864    75.000000 Hz   4:3     67.500 kHz    108.000000 MHz
    DMT 0x13:  1024x768    84.996690 Hz   4:3     68.677 kHz     94.500000 MHz
    DMT 0x0c:   800x600    85.061274 Hz   4:3     53.674 kHz     56.250000 MHz
    DMT 0x07:   640x480    85.008312 Hz   4:3     43.269 kHz     36.000000 MHz
  Detailed Timing Descriptors:
    DTD 1:  1280x1024   60.019740 Hz   5:4     63.981 kHz    108.000000 MHz (359 mm x 287 mm)
                 Hfront   48 Hsync 112 Hback  248 Hpol P
                 Vfront    1 Vsync   3 Vback   38 Vpol P
    Display Product Serial Number: ...
    Display Range Limits:
      Monitor ranges (GTF): 50-85 Hz V, 30-92 kHz H, max dotclock 160 MHz
    Display Product Name: 'VP181b-2'
Checksum: 0x1e

----------------

Block 1, Unknown EDID Extension Block 0x00:
  00 ff ff ff ff ff ff 00 5a 63 11 67 01 01 01 01 '........Zc.g....'
  1c 0d 01 03 0e 24 1d 78 2a 0a 25 a2 57 4b 99 24 '.....$.x*.%.WK.$'
  18 50 54 bf ef 80 81 80 81 99 81 59 81 40 71 4f '.PT........Y.@qO'
  61 59 45 59 31 59 30 2a 00 98 51 00 2a 40 30 70 'aYEY1Y0*..Q.*@0p'
  13 00 67 1f 11 00 00 1e 00 00 00 ff 00 41 31 5a '..g..........A1Z'
  30 33 32 38 31 34 37 37 36 0a 00 00 00 fd 00 32 '032814776......2'
  55 1e 5c 10 00 0a 20 20 20 20 20 20 00 00 00 fc 'U.\...      ....'
  00 56 50 31 38 31 62 2d 32 0a 20 20 20 20 00 1e '.VP181b-2.    ..'
Checksum: 0x1e

----------------

Failures:

Block 1, Base EDID:
  Unknown Extension Block.
EDID:
  Base EDID: EDID specified 0 extension block(s), but found 1 extension block(s).

EDID conformity: FAIL
