edid-decode (hex):

00 ff ff ff ff ff ff 00 22 f0 27 42 01 00 00 00
01 18 01 04 a5 3c 22 78 fe 0d 4f a5 56 53 9d 25
0e 4f 53 00 00 00 01 01 01 01 01 01 01 01 01 01
01 01 01 01 01 01 94 34 80 64 70 38 1f 40 2c 16
45 00 55 50 21 00 00 1e 00 00 00 fd 00 31 4b 36
54 13 00 0a 20 20 20 20 20 20 00 00 00 fc 00 48
50 20 41 6c 6c 2d 69 6e 2d 4f 6e 65 00 00 00 ff
00 4c 54 4d 32 37 30 48 4c 30 32 48 30 33 00 83

----------------

Block 0, Base EDID:
  EDID Structure Version & Revision: 1.4
  Vendor & Product Identification:
    Manufacturer: HWP
    Model: 16935
    Serial Number: ...
    Made in: week 1 of 2014
  Basic Display Parameters & Features:
    Digital display
    Bits per primary color channel: 8
    DisplayPort interface
    Maximum image size: 60 cm x 34 cm
    Gamma: 2.20
    DPMS levels: Standby Suspend Off
    Supported color formats: RGB 4:4:4, YCrCb 4:4:4, YCrCb 4:2:2
    Default (sRGB) color space is primary color space
    First detailed timing includes the native pixel format and preferred refresh rate
  Color Characteristics:
    Red  : 0.6445, 0.3359
    Green: 0.3271, 0.6142
    Blue : 0.1455, 0.0546
    White: 0.3115, 0.3271
  Established Timings I & II: none
  Standard Timings: none
  Detailed Timing Descriptors:
    DTD 1:  1920x1080   59.976 Hz  16:9    66.634 kHz 134.600 MHz (597 mm x 336 mm)
                 Hfront   44 Hsync  22 Hback  34 Hpol P
                 Vfront    4 Vsync   5 Vback  22 Vpol P
  Display Range Limits:
    Monitor ranges (GTF): 49-75 Hz V, 54-84 kHz H, max dotclock 190 MHz
    Display Product Name: 'HP All-in-One'
    Display Product Serial Number: ...
Checksum: 0x83

----------------

Failures:

Block 0, Base EDID:
  Basic Display Parameters & Features: sRGB is signaled, but the chromaticities do not match.
  Display Range Limits: GTF can't be combined with non-continuous frequencies.

EDID conformity: FAIL
