edid-decode (hex):

00 ff ff ff ff ff ff 00 26 cf 14 34 00 00 00 00
00 1c 01 04 a5 1d 11 78 0a 1d 30 a7 50 47 97 27
13 50 54 00 00 00 01 01 01 01 01 01 01 01 01 01
01 01 01 01 01 01 70 6c 80 a0 70 38 20 40 18 30
3c 00 26 a5 10 00 00 19 00 00 00 fe 00 4d 31 33
33 4e 56 46 33 20 52 32 20 0a 00 00 00 03 00 04
36 ff 05 3c 8d 1f 13 31 8d 00 00 00 00 00 00 03
00 06 18 ff 0f 3c 3b 1e 08 31 3b 01 01 00 00 c6

----------------

Block 0, Base EDID:
  EDID Structure Version & Revision: 1.4
  Vendor & Product Identification:
    Manufacturer: IVO
    Model: 13332
    Made in: 2018
  Basic Display Parameters & Features:
    Digital display
    Bits per primary color channel: 8
    DisplayPort interface
    Maximum image size: 29 cm x 17 cm
    Gamma: 2.20
    Supported color formats: RGB 4:4:4, YCrCb 4:4:4
    First detailed timing includes the native pixel format and preferred refresh rate
  Color Characteristics:
    Red  : 0.6523, 0.3134
    Green: 0.2802, 0.5908
    Blue : 0.1523, 0.0771
    White: 0.3125, 0.3281
  Established Timings I & II: none
  Standard Timings: none
  Detailed Timing Descriptors:
    DTD 1:  1920x1080  120.019369 Hz  16:9    133.462 kHz    277.600000 MHz (294 mm x 165 mm)
                 Hfront   24 Hsync  48 Hback   88 Hpol N
                 Vfront    3 Vsync  12 Vback   17 Vpol N
    Alphanumeric Data String: 'M133NVF3 R2 '
    Manufacturer-Specified Display Descriptor (0x03): 00 03 00 04 36 ff 05 3c 8d 1f 13 31 8d 00 00 00 '....6..<...1....'
    Manufacturer-Specified Display Descriptor (0x03): 00 03 00 06 18 ff 0f 3c 3b 1e 08 31 3b 01 01 00 '.......<;..1;...'
Checksum: 0xc6

----------------

Warnings:

Block 0, Base EDID:
  Missing Display Product Name.

Failures:

Block 0, Base EDID:
  Alphanumeric Data String: One or more trailing spaces.

EDID conformity: FAIL
