edid-decode (hex):

00 ff ff ff ff ff ff 00 34 a4 21 36 01 01 01 01
0f 14 01 03 81 30 1e 78 2a 78 f5 a6 55 48 9b 26
12 50 54 bf ef 80 81 80 71 4f 81 40 95 0f 95 00
b3 00 01 01 01 01 21 39 90 30 62 1a 27 40 68 b0
36 00 da 28 11 00 00 1c 66 21 50 b0 51 00 1b 30
40 70 36 00 da 28 11 00 00 1e 00 00 00 fd 00 32
4c 1e 53 0f 00 0a 20 20 20 20 20 20 00 00 00 fc
00 4d 44 20 32 30 30 38 36 0a 20 20 20 20 00 c4

----------------

Block 0, Base EDID:
  EDID Structure Version & Revision: 1.3
  Vendor & Product Identification:
    Manufacturer: MED
    Model: 13857
    Serial Number: ...
    Made in: week 15 of 2010
  Basic Display Parameters & Features:
    Digital display
    DFP 1.x compatible TMDS
    Maximum image size: 48 cm x 30 cm
    Gamma: 2.20
    DPMS levels: Off
    RGB color display
    First detailed timing is preferred timing
  Color Characteristics:
    Red  : 0.6494, 0.3349
    Green: 0.2832, 0.6054
    Blue : 0.1513, 0.0732
    White: 0.3134, 0.3291
  Established Timings I & II:
    IBM     :   720x400    70.082 Hz   9:5    31.467 kHz  28.320 MHz
    DMT 0x04:   640x480    59.940 Hz   4:3    31.469 kHz  25.175 MHz
    Apple   :   640x480    66.667 Hz   4:3    35.000 kHz  30.240 MHz
    DMT 0x05:   640x480    72.809 Hz   4:3    37.861 kHz  31.500 MHz
    DMT 0x06:   640x480    75.000 Hz   4:3    37.500 kHz  31.500 MHz
    DMT 0x08:   800x600    56.250 Hz   4:3    35.156 kHz  36.000 MHz
    DMT 0x09:   800x600    60.317 Hz   4:3    37.879 kHz  40.000 MHz
    DMT 0x0a:   800x600    72.188 Hz   4:3    48.077 kHz  50.000 MHz
    DMT 0x0b:   800x600    75.000 Hz   4:3    46.875 kHz  49.500 MHz
    Apple   :   832x624    74.551 Hz   4:3    49.726 kHz  57.284 MHz
    DMT 0x10:  1024x768    60.004 Hz   4:3    48.363 kHz  65.000 MHz
    DMT 0x11:  1024x768    70.069 Hz   4:3    56.476 kHz  75.000 MHz
    DMT 0x12:  1024x768    75.029 Hz   4:3    60.023 kHz  78.750 MHz
    DMT 0x24:  1280x1024   75.025 Hz   5:4    79.976 kHz 135.000 MHz
    Apple   :  1152x870    75.062 Hz 192:145  68.681 kHz 100.000 MHz
  Standard Timings:
    DMT 0x23:  1280x1024   60.020 Hz   5:4    63.981 kHz 108.000 MHz
    DMT 0x15:  1152x864    75.000 Hz   4:3    67.500 kHz 108.000 MHz
    DMT 0x20:  1280x960    60.000 Hz   4:3    60.000 kHz 108.000 MHz
    DMT 0x30:  1440x900    74.984 Hz  16:10   70.635 kHz 136.750 MHz
    DMT 0x2f:  1440x900    59.887 Hz  16:10   55.935 kHz 106.500 MHz
    DMT 0x3a:  1680x1050   59.954 Hz  16:10   65.290 kHz 146.250 MHz
  Detailed Timing Descriptors:
    DTD 1:  1680x1050   59.954 Hz   8:5    65.290 kHz 146.250 MHz (474 mm x 296 mm)
                 Hfront  104 Hsync 176 Hback 280 Hpol N
                 Vfront    3 Vsync   6 Vback  30 Vpol P
    DTD 2:  1360x768    60.015 Hz  85:48   47.712 kHz  85.500 MHz (474 mm x 296 mm)
                 Hfront   64 Hsync 112 Hback 256 Hpol P
                 Vfront    3 Vsync   6 Vback  18 Vpol P
  Display Range Limits:
    Monitor ranges (GTF): 50-76 Hz V, 30-83 kHz H, max dotclock 150 MHz
    Display Product Name: 'MD 20086'
Checksum: 0xc4
