edid-decode (hex):

00 ff ff ff ff ff ff 00 1e 6d 19 58 41 1b 00 00
0a 15 01 03 80 30 1b 78 ea 95 35 a1 59 57 9f 27
0e 50 54 a5 4b 00 71 4f 81 80 81 8f b3 00 01 01
01 01 01 01 01 01 02 3a 80 18 71 38 2d 40 58 2c
45 00 dd 0c 11 00 00 1e 00 00 00 fd 00 38 4b 1e
53 0f 00 0a 20 20 20 20 20 20 00 00 00 fc 00 45
32 32 34 31 0a 20 20 20 20 20 20 20 00 00 00 ff
00 31 31 30 54 50 54 4d 30 36 39 37 37 0a 00 d9

00 ff ff ff ff ff ff 00 1e 6d 19 58 41 1b 00 00
0a 15 01 03 80 30 1b 78 ea 95 35 a1 59 57 9f 27
0e 50 54 a5 4b 00 71 4f 81 80 81 8f b3 00 01 01
01 01 01 01 01 01 02 3a 80 18 71 38 2d 40 58 2c
45 00 dd 0c 11 00 00 1e 00 00 00 fd 00 38 4b 1e
53 0f 00 0a 20 20 20 20 20 20 00 00 00 fc 00 45
32 32 34 31 0a 20 20 20 20 20 20 20 00 00 00 ff
00 31 31 30 54 50 54 4d 30 36 39 37 37 0a 00 d9

----------------

Block 0, Base EDID:
  EDID Structure Version & Revision: 1.3
  Vendor & Product Identification:
    Manufacturer: GSM
    Model: 22553
    Serial Number: ...
    Made in: week 10 of 2011
  Basic Display Parameters & Features:
    Digital display
    Maximum image size: 48 cm x 27 cm
    Gamma: 2.20
    DPMS levels: Standby Suspend Off
    RGB color display
    First detailed timing is the preferred timing
  Color Characteristics:
    Red  : 0.6308, 0.3486
    Green: 0.3408, 0.6220
    Blue : 0.1523, 0.0576
    White: 0.3134, 0.3291
  Established Timings I & II:
    IBM     :   720x400    70.081663 Hz   9:5     31.467 kHz     28.320000 MHz
    DMT 0x04:   640x480    59.940476 Hz   4:3     31.469 kHz     25.175000 MHz
    DMT 0x06:   640x480    75.000000 Hz   4:3     37.500 kHz     31.500000 MHz
    DMT 0x09:   800x600    60.316541 Hz   4:3     37.879 kHz     40.000000 MHz
    DMT 0x0b:   800x600    75.000000 Hz   4:3     46.875 kHz     49.500000 MHz
    DMT 0x10:  1024x768    60.003840 Hz   4:3     48.363 kHz     65.000000 MHz
    DMT 0x12:  1024x768    75.028582 Hz   4:3     60.023 kHz     78.750000 MHz
    DMT 0x24:  1280x1024   75.024675 Hz   5:4     79.976 kHz    135.000000 MHz
  Standard Timings:
    DMT 0x15:  1152x864    75.000000 Hz   4:3     67.500 kHz    108.000000 MHz
    DMT 0x23:  1280x1024   60.019740 Hz   5:4     63.981 kHz    108.000000 MHz
    DMT 0x24:  1280x1024   75.024675 Hz   5:4     79.976 kHz    135.000000 MHz
    DMT 0x3a:  1680x1050   59.954250 Hz  16:10    65.290 kHz    146.250000 MHz
  Detailed Timing Descriptors:
    DTD 1:  1920x1080   60.000000 Hz  16:9     67.500 kHz    148.500000 MHz (477 mm x 268 mm)
                 Hfront   88 Hsync  44 Hback  148 Hpol P
                 Vfront    4 Vsync   5 Vback   36 Vpol P
    Display Range Limits:
      Monitor ranges (GTF): 56-75 Hz V, 30-83 kHz H, max dotclock 150 MHz
    Display Product Name: 'E2241'
    Display Product Serial Number: ...
Checksum: 0xd9

----------------

Block 1, Unknown EDID Extension Block 0x00:
  00 ff ff ff ff ff ff 00 1e 6d 19 58 41 1b 00 00 '.........m.XA...'
  0a 15 01 03 80 30 1b 78 ea 95 35 a1 59 57 9f 27 '.....0.x..5.YW.''
  0e 50 54 a5 4b 00 71 4f 81 80 81 8f b3 00 01 01 '.PT.K.qO........'
  01 01 01 01 01 01 02 3a 80 18 71 38 2d 40 58 2c '.......:..q8-@X,'
  45 00 dd 0c 11 00 00 1e 00 00 00 fd 00 38 4b 1e 'E............8K.'
  53 0f 00 0a 20 20 20 20 20 20 00 00 00 fc 00 45 'S...      .....E'
  32 32 34 31 0a 20 20 20 20 20 20 20 00 00 00 ff '2241.       ....'
  00 31 31 30 54 50 54 4d 30 36 39 37 37 0a 00 d9 '.110TPTM06977...'
Checksum: 0xd9

----------------

Failures:

Block 1, Base EDID:
  Unknown Extension Block.
EDID:
  Base EDID: EDID specified 0 extension block(s), but found 1 extension block(s).

EDID conformity: FAIL
