edid-decode (hex):

00 ff ff ff ff ff ff 00 09 e5 4c 08 00 00 00 00
01 1c 01 04 a5 1f 11 78 02 66 e5 a6 58 54 9f 26
10 50 54 00 00 00 01 01 01 01 01 01 01 01 01 01
01 01 01 01 01 01 2e 37 80 b6 70 38 28 40 30 20
36 00 36 ae 10 00 00 1a 25 2c 80 b6 70 38 28 40
30 20 36 00 36 ae 10 00 00 1a 00 00 00 fe 00 42
4f 45 20 43 51 0a 20 20 20 20 20 20 00 00 00 fe
00 4e 56 31 34 30 46 48 4d 2d 4e 36 34 0a 00 70

----------------

Block 0, Base EDID:
  EDID Structure Version & Revision: 1.4
  Vendor & Product Identification:
    Manufacturer: BOE
    Model: 2124
    Made in: week 1 of 2018
  Basic Display Parameters & Features:
    Digital display
    Bits per primary color channel: 8
    DisplayPort interface
    Maximum image size: 31 cm x 17 cm
    Gamma: 2.20
    Supported color formats: RGB 4:4:4
    First detailed timing includes the native pixel format and preferred refresh rate
  Color Characteristics:
    Red  : 0.6494, 0.3457
    Green: 0.3291, 0.6230
    Blue : 0.1513, 0.0644
    White: 0.3134, 0.3291
  Established Timings I & II: none
  Standard Timings: none
  Detailed Timing Descriptors:
    DTD 1:  1920x1080   60.002 Hz  16:9    67.203 kHz 141.260 MHz (310 mm x 174 mm)
                 Hfront   48 Hsync  32 Hback 102 Hpol P
                 Vfront    3 Vsync   6 Vback  31 Vpol N
    DTD 2:  1920x1080   48.003 Hz  16:9    53.763 kHz 113.010 MHz (310 mm x 174 mm)
                 Hfront   48 Hsync  32 Hback 102 Hpol P
                 Vfront    3 Vsync   6 Vback  31 Vpol N
    Alphanumeric Data String: 'BOE CQ'
    Alphanumeric Data String: 'NV140FHM-N64'
Checksum: 0x70

----------------

Failures:

Block 0, Base EDID:
  Missing Display Product Name.

EDID conformity: FAIL
