edid-decode (hex):

00 ff ff ff ff ff ff 00 10 ac 6c f0 42 43 30 45
07 1b 01 03 0e 29 17 78 ea 41 e5 a4 55 51 a0 26
0c 50 54 a5 4b 00 01 01 01 01 01 01 01 01 01 01
01 01 01 01 01 01 66 21 56 aa 51 00 1e 30 46 8f
33 00 99 e6 10 00 00 1e 00 00 00 ff 00 39 59 4b
56 37 37 32 49 45 30 43 42 0a 00 00 00 fc 00 44
45 4c 4c 20 45 31 39 31 36 48 56 0a 00 00 00 fd
00 38 4b 1e 53 11 00 0a 20 20 20 20 20 20 00 77

00 ff ff ff ff ff ff 00 10 ac 6c f0 42 43 30 45
07 1b 01 03 0e 29 17 78 ea 41 e5 a4 55 51 a0 26
0c 50 54 a5 4b 00 01 01 01 01 01 01 01 01 01 01
01 01 01 01 01 01 66 21 56 aa 51 00 1e 30 46 8f
33 00 99 e6 10 00 00 1e 00 00 00 ff 00 39 59 4b
56 37 37 32 49 45 30 43 42 0a 00 00 00 fc 00 44
45 4c 4c 20 45 31 39 31 36 48 56 0a 00 00 00 fd
00 38 4b 1e 53 11 00 0a 20 20 20 20 20 20 00 77

----------------

Block 0, Base EDID:
  EDID Structure Version & Revision: 1.3
  Vendor & Product Identification:
    Manufacturer: DEL
    Model: 61548
    Serial Number: ...
    Made in: week 7 of 2017
  Basic Display Parameters & Features:
    Analog display
    Signal Level Standard: 0.700 : 0.300 : 1.000 V p-p
    Blank level equals black level
    Sync: Separate Composite SyncOnGreen
    Maximum image size: 41 cm x 23 cm
    Gamma: 2.20
    DPMS levels: Standby Suspend Off
    RGB color display
    First detailed timing is the preferred timing
  Color Characteristics:
    Red  : 0.6416, 0.3320
    Green: 0.3164, 0.6259
    Blue : 0.1513, 0.0488
    White: 0.3134, 0.3291
  Established Timings I & II:
    IBM     :   720x400    70.081663 Hz   9:5     31.467 kHz     28.320000 MHz
    DMT 0x04:   640x480    59.940476 Hz   4:3     31.469 kHz     25.175000 MHz
    DMT 0x06:   640x480    75.000000 Hz   4:3     37.500 kHz     31.500000 MHz
    DMT 0x09:   800x600    60.316541 Hz   4:3     37.879 kHz     40.000000 MHz
    DMT 0x0b:   800x600    75.000000 Hz   4:3     46.875 kHz     49.500000 MHz
    DMT 0x10:  1024x768    60.003840 Hz   4:3     48.363 kHz     65.000000 MHz
    DMT 0x12:  1024x768    75.028582 Hz   4:3     60.023 kHz     78.750000 MHz
    DMT 0x24:  1280x1024   75.024675 Hz   5:4     79.976 kHz    135.000000 MHz
  Standard Timings: none
  Detailed Timing Descriptors:
    DTD 1:  1366x768    59.789541 Hz 683:384   47.712 kHz     85.500000 MHz (409 mm x 230 mm)
                 Hfront   70 Hsync 143 Hback  213 Hpol P
                 Vfront    3 Vsync   3 Vback   24 Vpol P
    Display Product Serial Number: ...
    Display Product Name: 'DELL E1916HV'
    Display Range Limits:
      Monitor ranges (GTF): 56-75 Hz V, 30-83 kHz H, max dotclock 170 MHz
Checksum: 0x77

----------------

Block 1, Unknown EDID Extension Block 0x00:
  00 ff ff ff ff ff ff 00 10 ac 6c f0 42 43 30 45 '..........l.BC0E'
  07 1b 01 03 0e 29 17 78 ea 41 e5 a4 55 51 a0 26 '.....).x.A..UQ.&'
  0c 50 54 a5 4b 00 01 01 01 01 01 01 01 01 01 01 '.PT.K...........'
  01 01 01 01 01 01 66 21 56 aa 51 00 1e 30 46 8f '......f!V.Q..0F.'
  33 00 99 e6 10 00 00 1e 00 00 00 ff 00 39 59 4b '3............9YK'
  56 37 37 32 49 45 30 43 42 0a 00 00 00 fc 00 44 'V772IE0CB......D'
  45 4c 4c 20 45 31 39 31 36 48 56 0a 00 00 00 fd 'ELL E1916HV.....'
  00 38 4b 1e 53 11 00 0a 20 20 20 20 20 20 00 77 '.8K.S...      .w'
Checksum: 0x77

----------------

Failures:

Block 1, Base EDID:
  Unknown Extension Block.
EDID:
  Base EDID: EDID specified 0 extension block(s), but found 1 extension block(s).

EDID conformity: FAIL
