edid-decode (hex):

00 ff ff ff ff ff ff 00 08 59 0a 0a 01 00 00 00
20 14 01 03 08 5d 34 78 ca d2 58 a3 54 4a 99 26
0f 47 4a a1 08 00 81 80 01 01 01 01 01 01 01 01
01 01 01 01 01 01 1a 36 80 a0 70 38 1f 40 30 20
35 00 34 cc 31 00 00 1a 00 00 00 fd 00 3b 47 1f
44 0f 00 0a 20 20 20 20 20 20 66 21 50 b0 51 00
1b 30 40 70 35 00 34 cc 31 00 00 1e 00 00 00 fc
00 44 58 2d 32 34 45 31 35 30 41 31 31 0a 00 ef

----------------

Block 0, Base EDID:
  EDID Structure Version & Revision: 1.3
  Vendor & Product Identification:
    Manufacturer: BBY
    Model: 2570
    Serial Number: ...
    Made in: week 32 of 2010
  Basic Display Parameters & Features:
    Analog display
    Signal Level Standard: 0.700 : 0.300 : 1.000 V p-p
    Blank level equals black level
    Sync: Separate
    Maximum image size: 93 cm x 52 cm
    Gamma: 2.20
    DPMS levels: Standby Suspend
    RGB color display
    First detailed timing is the preferred timing
  Color Characteristics:
    Red  : 0.6396, 0.3291
    Green: 0.2890, 0.5996
    Blue : 0.1494, 0.0595
    White: 0.2792, 0.2890
  Established Timings I & II:
    IBM     :   720x400    70.081663 Hz   9:5     31.467 kHz     28.320000 MHz
    DMT 0x04:   640x480    59.940476 Hz   4:3     31.469 kHz     25.175000 MHz
    DMT 0x09:   800x600    60.316541 Hz   4:3     37.879 kHz     40.000000 MHz
    DMT 0x10:  1024x768    60.003840 Hz   4:3     48.363 kHz     65.000000 MHz
  Standard Timings:
    DMT 0x23:  1280x1024   60.019740 Hz   5:4     63.981 kHz    108.000000 MHz
  Detailed Timing Descriptors:
    DTD 1:  1920x1080   59.933878 Hz  16:9     66.587 kHz    138.500000 MHz (820 mm x 460 mm)
                 Hfront   48 Hsync  32 Hback   80 Hpol P
                 Vfront    3 Vsync   5 Vback   23 Vpol N
    Display Range Limits:
      Monitor ranges (GTF): 59-71 Hz V, 31-68 kHz H, max dotclock 150 MHz
    DTD 2:  1360x768    60.015162 Hz  85:48    47.712 kHz     85.500000 MHz (820 mm x 460 mm)
                 Hfront   64 Hsync 112 Hback  256 Hpol P
                 Vfront    3 Vsync   5 Vback   19 Vpol P
    Display Product Name: 'DX-24E150A11'
Checksum: 0xef

----------------

Warnings:

Block 0, Base EDID:
  Detailed Timing Descriptor #2: DTD is similar but not identical to DMT 0x27.

Failures:

Block 0, Base EDID:
  Detailed Timing Descriptor #1: Mismatch of image size 820x460 mm vs display size 930x520 mm.
  Detailed Timing Descriptor #2: Mismatch of image size 820x460 mm vs display size 930x520 mm.
  Detailed Timing Descriptor #2: Invalid detailed timing descriptor ordering.

EDID conformity: FAIL
