
EDID (hex):
00ffffffffffff004c2d260c01000001
2c18010380693b780a23a5a4544d9926
0f5054bdef80714f81c0810081809500
a9c0b3000101023a801871382d40582c
4500b9a84200001e662156aa51001e30
468f3300b9a84200001e000000fd0018
4b0f5117000a202020202020000000fc
0053414d53554e470a202020202001c1

Extracted contents:
header:          00 ff ff ff ff ff ff 00
serial number:   4c 2d 26 0c 01 00 00 01 2c 18
version:         01 03
basic params:    80 69 3b 78 0a
chroma info:     23 a5 a4 54 4d 99 26 0f 50 54
established:     bd ef 80
standard:        71 4f 81 c0 81 00 81 80 95 00 a9 c0 b3 00 01 01
descriptor 1:    02 3a 80 18 71 38 2d 40 58 2c 45 00 b9 a8 42 00 00 1e
descriptor 2:    66 21 56 aa 51 00 1e 30 46 8f 33 00 b9 a8 42 00 00 1e
descriptor 3:    00 00 00 fd 00 18 4b 0f 51 17 00 0a 20 20 20 20 20 20
descriptor 4:    00 00 00 fc 00 53 41 4d 53 55 4e 47 0a 20 20 20 20 20
extensions:      01
checksum:        c1

EDID version: 1.3
Manufacturer: SAM Model c26 Serial Number --
Made in week 44 of 2014
Digital display
Maximum image size: 105 cm x 59 cm
Gamma: 2.20
RGB color display
First detailed timing is preferred timing
Display x,y Chromaticity:
  Red:   0.6406, 0.3300
  Green: 0.3007, 0.6005
  Blue:  0.1503, 0.0605
  White: 0.3134, 0.3291
Established timings supported:
  720x400@70Hz 9:5 HorFreq: 31469 Hz Clock: 28.320 MHz
  640x480@60Hz 4:3 HorFreq: 31469 Hz Clock: 25.175 MHz
  640x480@67Hz 4:3 HorFreq: 35000 Hz Clock: 30.240 MHz
  640x480@72Hz 4:3 HorFreq: 37900 Hz Clock: 31.500 MHz
  640x480@75Hz 4:3 HorFreq: 37500 Hz Clock: 31.500 MHz
  800x600@60Hz 4:3 HorFreq: 37900 Hz Clock: 40.000 MHz
  800x600@72Hz 4:3 HorFreq: 48100 Hz Clock: 50.000 MHz
  800x600@75Hz 4:3 HorFreq: 46900 Hz Clock: 49.500 MHz
  832x624@75Hz 4:3 HorFreq: 49726 Hz Clock: 57.284 MHz
  1024x768@60Hz 4:3 HorFreq: 48400 Hz Clock: 65.000 MHz
  1024x768@70Hz 4:3 HorFreq: 56500 Hz Clock: 75.000 MHz
  1024x768@75Hz 4:3 HorFreq: 60000 Hz Clock: 78.750 MHz
  1280x1024@75Hz 5:4 HorFreq: 80000 Hz Clock: 135.000 MHz
  1152x870@75Hz 192:145 HorFreq: 67500 Hz Clock: 108.000 MHz
Standard timings supported:
  1152x864@75Hz 4:3 HorFreq: 67500 Hz Clock: 108.000 MHz
  1280x720@60Hz 16:9
  1280x800@60Hz 16:10
  1280x1024@60Hz 5:4 HorFreq: 64000 Hz Clock: 108.000 MHz
  1440x900@60Hz 16:10 HorFreq: 55500 Hz Clock: 88.750 MHz
  1600x900@60Hz 16:9
  1680x1050@60Hz 16:10 HorFreq: 64700 Hz Clock: 119.000 MHz
Detailed mode: Clock 148.500 MHz, 1209 mm x 680 mm
               1920 2008 2052 2200 hborder 0
               1080 1084 1089 1125 vborder 0
               +hsync +vsync 
               VertFreq: 60 Hz, HorFreq: 67500 Hz
Detailed mode: Clock 85.500 MHz, 1209 mm x 680 mm
               1366 1436 1579 1792 hborder 0
                768  771  774  798 vborder 0
               +hsync +vsync 
               VertFreq: 59 Hz, HorFreq: 47712 Hz
Monitor ranges (GTF): 24-75Hz V, 15-81kHz H, max dotclock 230MHz
Monitor name: SAMSUNG
Has 1 extension blocks
Checksum: 0xc1 (valid)
