edid-decode (hex):

00 ff ff ff ff ff ff 00 4c a3 41 54 00 00 00 00
00 14 01 00 95 22 13 78 0a c8 95 9e 57 54 92 26
0f 50 54 00 00 00 01 01 01 01 01 01 01 01 01 01
01 01 01 01 01 01 5e 1d 56 dc 50 00 16 30 30 20
25 00 58 c2 10 00 00 1a d6 12 56 a0 50 00 16 30
30 20 25 00 58 c2 10 00 00 1a 00 00 00 fe 00 33
59 56 50 34 81 31 35 36 41 54 0a 20 00 00 00 00
00 00 41 01 19 00 00 00 00 09 01 0a 20 20 00 e8

----------------

Block 0, Base EDID:
  EDID Structure Version & Revision: 1.0
  Vendor & Product Identification:
    Manufacturer: SEC
    Model: 21569
    Made in: 2010
  Basic Display Parameters & Features:
    Digital display
    Maximum image size: 34 cm x 19 cm
    Gamma: 2.20
    RGB color display
    First detailed timing is preferred timing
  Color Characteristics:
    Red  : 0.6201, 0.3398
    Green: 0.3300, 0.5703
    Blue : 0.1503, 0.0595
    White: 0.3134, 0.3291
  Established Timings I & II: none
  Standard Timings: none
  Detailed Timing Descriptors:
    DTD 1:  1366x768    60.003 Hz 683:384  47.402 kHz  75.180 MHz (344 mm x 194 mm)
                 Hfront   48 Hsync  32 Hback 140 Hpol P
                 Vfront    2 Vsync   5 Vback  15 Vpol N
    DTD 2:  1366x768    39.999 Hz 683:384  31.599 kHz  48.220 MHz (344 mm x 194 mm)
                 Hfront   48 Hsync  32 Hback  80 Hpol P
                 Vfront    2 Vsync   5 Vback  15 Vpol N
    Alphanumeric Data String: '3YVP4'
    Manufacturer-Specified Display Descriptor (0x00): 00 00 00 00 41 01 19 00 00 00 00 09 01 0a 20 20 '....A.........  '
Checksum: 0xe8

----------------

Warnings:

Block 0, Base EDID:
  EDID Structure Version & Revision: EDID 1.0 is deprecated, do not use.

Failures:

Block 0, Base EDID:
  Basic Display Parameters & Features: Digital Video Interface Standard set to reserved value 0x15.
  Display Descriptor #3: Has descriptor blocks other than detailed timings.
  Alphanumeric Data String: Non-printable character.
  Display Descriptor #4: Has descriptor blocks other than detailed timings.

EDID conformity: FAIL
