edid-decode (hex):

00 ff ff ff ff ff ff 00 4c a3 41 54 00 00 00 00
00 13 01 03 90 21 15 78 0a 87 f5 94 57 4f 8c 27
27 50 54 00 00 00 01 01 01 01 01 01 01 01 01 01
01 01 01 01 01 01 79 1d 00 e4 50 20 22 30 10 30
13 00 4b cf 10 00 00 1a a7 13 00 e4 50 20 22 30
10 30 13 00 4b cf 10 00 00 1a 00 00 00 fe 00 43
30 32 33 54 80 31 35 34 41 54 0a 20 00 00 00 00
00 00 00 00 00 00 00 00 00 01 01 0a 20 20 00 c6

----------------

Block 0, Base EDID:
  EDID Structure Version & Revision: 1.3
  Vendor & Product Identification:
    Manufacturer: SEC
    Model: 21569
    Made in: 2009
  Basic Display Parameters & Features:
    Digital display
    Maximum image size: 33 cm x 21 cm
    Gamma: 2.20
    RGB color display
    First detailed timing is the preferred timing
  Color Characteristics:
    Red  : 0.5800, 0.3398
    Green: 0.3095, 0.5498
    Blue : 0.1552, 0.1552
    White: 0.3134, 0.3291
  Established Timings I & II: none
  Standard Timings: none
  Detailed Timing Descriptors:
    DTD 1:  1280x800    59.991794 Hz   8:5     50.033 kHz     75.450000 MHz (331 mm x 207 mm)
                 Hfront   16 Hsync  48 Hback  164 Hpol P
                 Vfront    1 Vsync   3 Vback   30 Vpol N
    DTD 2:  1280x800    40.002481 Hz   8:5     33.362 kHz     50.310000 MHz (331 mm x 207 mm)
                 Hfront   16 Hsync  48 Hback  164 Hpol P
                 Vfront    1 Vsync   3 Vback   30 Vpol N
    Alphanumeric Data String: 'C023T'
    Manufacturer-Specified Display Descriptor (0x00): 00 00 00 00 00 00 00 00 00 00 00 01 01 0a 20 20 '..............  '
Checksum: 0xc6

----------------

Failures:

Block 0, Base EDID:
  Basic Display Parameters & Features: Digital Video Interface Standard set to reserved value 0x10.
  Alphanumeric Data String: Non-printable character.
  Missing Display Product Name.
  Missing Display Range Limits Descriptor.

EDID conformity: FAIL
