edid-decode (hex):

00 ff ff ff ff ff ff 00 4c a3 41 54 00 00 00 00
00 12 01 03 90 21 15 78 0a 87 f5 94 57 4f 8c 27
27 50 54 00 00 00 01 01 01 01 01 01 01 01 01 01
01 01 01 01 01 01 34 1d 00 d6 50 20 22 30 10 30
13 00 4b cf 10 00 00 1a 78 13 00 d6 50 20 22 30
10 30 13 00 4b cf 10 00 00 1a 00 00 00 fe 00 43
33 38 32 48 80 31 35 34 41 54 0a 20 00 00 00 00
00 00 00 00 00 00 00 00 00 01 01 0a 20 20 00 5b

----------------

Block 0, Base EDID:
  EDID Structure Version & Revision: 1.3
  Vendor & Product Identification:
    Manufacturer: SEC
    Model: 21569
    Made in: 2008
  Basic Display Parameters & Features:
    Digital display
    Maximum image size: 33 cm x 21 cm
    Gamma: 2.20
    RGB color display
    First detailed timing is preferred timing
  Color Characteristics:
    Red  : 0.5800, 0.3398
    Green: 0.3095, 0.5498
    Blue : 0.1552, 0.1552
    White: 0.3134, 0.3291
  Established Timings I & II: none
  Standard Timings: none
  Detailed Timing Descriptors:
    DTD 1:  1280x800    60.000 Hz   8:5    50.040 kHz  74.760 MHz (331 mm x 207 mm)
                 Hfront   16 Hsync  48 Hback 150 Hpol P
                 Vfront    1 Vsync   3 Vback  30 Vpol N
    DTD 2:  1280x800    40.000 Hz   8:5    33.360 kHz  49.840 MHz (331 mm x 207 mm)
                 Hfront   16 Hsync  48 Hback 150 Hpol P
                 Vfront    1 Vsync   3 Vback  30 Vpol N
    Alphanumeric Data String: 'C382H'
    Manufacturer-Specified Display Descriptor (0x00): 00 00 00 00 00 00 00 00 00 00 00 01 01 0a 20 20 '..............  '
Checksum: 0x5b
