edid-decode (hex):

00 ff ff ff ff ff ff 00 4c a3 41 54 00 00 00 00
00 11 01 03 80 1a 10 78 0a 87 f5 94 57 4f 8c 27
27 50 54 00 00 00 01 01 01 01 01 01 01 01 01 01
01 01 01 01 01 01 12 1b 00 8b 50 20 10 30 30 20
36 00 05 a3 10 00 00 19 00 00 00 0f 00 00 00 00
00 00 00 00 00 32 d2 02 32 00 00 00 00 fe 00 50
59 36 37 35 03 31 32 31 41 54 0a 20 00 00 00 fe
00 26 37 41 49 6c 88 b0 ff 01 01 0a 20 20 00 84

----------------

Block 0, Base EDID:
  EDID Structure Version & Revision: 1.3
  Vendor & Product Identification:
    Manufacturer: SEC
    Model: 21569
    Made in: 2007
  Basic Display Parameters & Features:
    Digital display
    Maximum image size: 26 cm x 16 cm
    Gamma: 2.20
    RGB color display
    First detailed timing is the preferred timing
  Color Characteristics:
    Red  : 0.5800, 0.3398
    Green: 0.3095, 0.5498
    Blue : 0.1552, 0.1552
    White: 0.3134, 0.3291
  Established Timings I & II: none
  Standard Timings: none
  Detailed Timing Descriptors:
    DTD 1:  1280x800    59.849521 Hz   8:5     48.837 kHz     69.300000 MHz (261 mm x 163 mm)
                 Hfront   48 Hsync  32 Hback   59 Hpol N
                 Vfront    3 Vsync   6 Vback    7 Vpol N
    Manufacturer-Specified Display Descriptor (0x0f): 00 0f 00 00 00 00 00 00 00 00 00 32 d2 02 32 00 '...........2..2.'
    Alphanumeric Data String: 'PY675'
    Alphanumeric Data String: '&7AIl'
Checksum: 0x84

----------------

Failures:

Block 0, Base EDID:
  Alphanumeric Data String: Non-printable character.
  Alphanumeric Data String: Non-printable character.
  Missing Display Product Name.
  Missing Display Range Limits Descriptor.

EDID conformity: FAIL
