
EDID (hex):
00ffffffffffff0030ae011201000000
191a010381301b78ea64b5ab5238ab25
13505400000001010101010101010101
010101010101023a801871382d404040
8800dc0c1100001c0000001000000000
00000000000000000000000000100048
5020414c000a202020202020000000ff
004c4d3231355746392d535341310049

Extracted contents:
header:          00 ff ff ff ff ff ff 00
serial number:   30 ae 01 12 01 00 00 00 19 1a
version:         01 03
basic params:    81 30 1b 78 ea
chroma info:     64 b5 ab 52 38 ab 25 13 50 54
established:     00 00 00
standard:        01 01 01 01 01 01 01 01 01 01 01 01 01 01 01 01
descriptor 1:    02 3a 80 18 71 38 2d 40 40 40 88 00 dc 0c 11 00 00 1c
descriptor 2:    00 00 00 10 00 00 00 00 00 00 00 00 00 00 00 00 00 00
descriptor 3:    00 00 00 10 00 48 50 20 41 4c 00 0a 20 20 20 20 20 20
descriptor 4:    00 00 00 ff 00 4c 4d 32 31 35 57 46 39 2d 53 53 41 31
extensions:      00
checksum:        49

EDID version: 1.3
Manufacturer: LEN Model 1201 Serial Number --
Made in week 25 of 2016
Digital display
DFP 1.x compatible TMDS
Maximum image size: 48 cm x 27 cm
Gamma: 2.20
DPMS levels: Standby Suspend Off
RGB color display
First detailed timing is preferred timing
Display x,y Chromaticity:
  Red:   0.6689, 0.3222
  Green: 0.2197, 0.6679
  Blue:  0.1464, 0.0771
  White: 0.3134, 0.3291
Established timings supported:
Standard timings supported:
Detailed mode: Clock 148.500 MHz, 476 mm x 268 mm
               1920 1984 2048 2200 hborder 0
               1080 1088 1096 1125 vborder 0
               -hsync +vsync 
               VertFreq: 60 Hz, HorFreq: 67500 Hz
Dummy block
Dummy block
Serial number: --
Checksum: 0x49 (valid)
EDID block does NOT conform to EDID 1.3!
	Missing name descriptor
	Missing monitor ranges
EDID block does not conform at all!
	Dummy block filled with garbage
