edid-decode (hex):

00 ff ff ff ff ff ff 00 0d ae ab 15 00 00 00 00
30 17 01 03 80 22 13 78 0a e5 65 92 58 57 98 29
1d 50 54 00 00 00 01 01 01 01 01 01 01 01 01 01
01 01 01 01 01 01 79 1d 56 c2 50 00 26 30 1f 41
4c 00 58 c1 10 00 00 18 00 00 00 fe 00 4e 31 35
36 42 47 45 2d 4c 34 31 0a 20 00 00 00 fe 00 43
4d 4e 0a 20 20 20 20 20 20 20 20 20 00 00 00 fe
00 4e 31 35 36 42 47 45 2d 4c 34 31 0a 20 00 29

----------------

Block 0, Base EDID:
  EDID Structure Version & Revision: 1.3
  Vendor & Product Identification:
    Manufacturer: CMN
    Model: 5547
    Made in: week 48 of 2013
  Basic Display Parameters & Features:
    Digital display
    Maximum image size: 34 cm x 19 cm
    Gamma: 2.20
    RGB color display
    First detailed timing is the preferred timing
  Color Characteristics:
    Red  : 0.5732, 0.3457
    Green: 0.3408, 0.5947
    Blue : 0.1611, 0.1152
    White: 0.3134, 0.3291
  Established Timings I & II: none
  Standard Timings: none
  Detailed Timing Descriptors:
    DTD 1:  1366x768    60.007 Hz 683:384  48.365 kHz  75.450 MHz (344 mm x 193 mm)
                 Hfront   31 Hsync  65 Hback  98 Hpol N
                 Vfront    4 Vsync  12 Vback  22 Vpol N
    Alphanumeric Data String: 'N156BGE-L41'
    Alphanumeric Data String: 'CMN'
    Alphanumeric Data String: 'N156BGE-L41'
Checksum: 0x29

----------------

Failures:

Block 0, Base EDID:
  Missing Display Product Name.
  Missing Display Range Limits Descriptor.

EDID conformity: FAIL
