edid-decode (hex):

00 ff ff ff ff ff ff 00 06 10 22 ae 0a 14 09 20
01 1d 01 04 c5 46 27 78 00 0f 91 ae 52 43 b0 26
0f 50 54 00 00 00 01 01 01 01 01 01 01 01 01 01
01 01 01 01 01 01 42 ce 00 50 f0 70 55 80 08 20
78 00 bb 89 21 00 00 1a 42 ce 00 50 f0 70 16 82
08 20 88 00 bb 89 21 00 00 1a a0 5c 00 50 a0 a0
39 50 08 20 b8 08 bb 89 21 00 00 1a 00 00 00 fc
00 50 72 6f 44 69 73 70 6c 61 79 58 44 52 05 e3

02 03 0f 80 e3 05 80 00 e6 06 07 01 a0 6b 01 3c
ce 00 50 f0 70 57 80 08 20 98 00 bb 89 21 00 00
1a 3d ce 00 50 f0 70 86 82 08 20 88 0c bb 89 21
00 00 1a 41 ce 00 50 f0 70 89 82 08 20 b8 0c bb
89 21 00 00 1a 00 00 00 00 00 00 00 00 00 00 00
00 00 00 00 00 00 00 00 00 00 00 00 00 00 00 00
00 00 00 00 00 00 00 00 00 00 00 00 00 00 00 00
00 00 00 00 00 00 00 00 00 00 00 00 00 00 00 01

70 12 79 00 00 29 00 10 61 37 cf 3e f8 7e 4f cd
a1 cf 41 28 3a 5a 82 40 01 00 0c 52 1b 5e 0f 80
17 38 0d 10 78 4e bb 7f 81 07 fa 10 00 04 01 00
00 12 00 16 82 10 00 00 bf 0b 37 0d 00 00 00 00
00 41 50 50 23 ae 0a 14 09 20 7e 00 05 3a 02 92
81 00 03 00 28 41 ce 00 04 ff 0e 4f 00 07 80 1f
00 6f 08 54 00 46 00 07 00 fe bb 00 08 ff 09 77
00 07 80 1f 00 3f 0b 70 00 62 00 07 00 00 78 90

70 12 79 00 00 03 00 50 ee bb 00 08 ff 09 77 00
07 80 1f 00 3f 0b 72 00 64 00 07 00 f6 bb 00 08
ff 09 77 00 07 80 1f 00 3f 0b c6 02 b8 02 07 00
fb bb 00 08 ff 09 77 00 07 80 1f 00 3f 0b 5c 03
4e 03 07 00 f1 bb 00 08 ff 09 77 00 07 80 1f 00
3f 0b 5f 03 51 03 07 00 00 00 00 00 00 00 00 00
00 00 00 00 00 00 00 00 00 00 00 00 00 00 00 00
00 00 00 00 00 00 00 00 00 00 00 00 00 00 b0 90

70 12 79 00 00 03 00 64 c4 6c 01 04 ff 13 4f 00
07 80 1f 00 3f 0b 70 00 62 00 07 00 a5 6c 01 04
ff 13 4f 00 07 80 1f 00 3f 0b 72 00 64 00 07 00
b5 6c 01 04 ff 13 4f 00 07 80 1f 00 3f 0b c6 02
b8 02 07 00 be 6c 01 04 ff 13 4f 00 07 80 1f 00
3f 0b 5c 03 4e 03 07 00 ab 6c 01 04 ff 13 4f 00
07 80 1f 00 3f 0b 5f 03 51 03 07 00 00 00 00 00
00 00 00 00 00 00 00 00 00 00 00 00 00 00 0a 90

70 12 79 00 00 03 00 64 58 f6 01 84 7f 17 4f 00
07 80 1f 00 37 0d 83 00 75 00 07 00 45 f6 01 04
7f 17 4f 00 07 80 1f 00 37 0d 86 00 78 00 07 00
52 f6 01 04 7f 17 4f 00 07 80 1f 00 37 0d 42 03
34 03 07 00 58 f6 01 04 7f 17 4f 00 07 80 1f 00
37 0d f2 03 e4 03 07 00 4c f6 01 04 7f 17 4f 00
07 80 1f 00 37 0d f6 03 e8 03 07 00 00 00 00 00
00 00 00 00 00 00 00 00 00 00 00 00 00 00 b4 90

----------------

Block 0, Base EDID:
  EDID Structure Version & Revision: 1.4
  Vendor & Product Identification:
    Manufacturer: APP
    Model: 44578
    Serial Number: ...
    Made in: week 1 of 2019
  Basic Display Parameters & Features:
    Digital display
    Bits per primary color channel: 12
    DisplayPort interface
    Maximum image size: 70 cm x 39 cm
    Gamma: 2.20
    Supported color formats: RGB 4:4:4
    First detailed timing does not include the native pixel format and preferred refresh rate
  Color Characteristics:
    Red  : 0.6796, 0.3203
    Green: 0.2646, 0.6904
    Blue : 0.1503, 0.0595
    White: 0.3125, 0.3291
  Established Timings I & II: none
  Standard Timings: none
  Detailed Timing Descriptors:
    DTD 1:  3840x2160   59.999545 Hz  16:9    134.699 kHz    528.020000 MHz (699 mm x 393 mm)
                 Hfront    8 Hsync  32 Hback   40 Hpol P
                 Vfront    7 Vsync   8 Vback   70 Vpol N
    DTD 2:  3840x2160   49.999621 Hz  16:9    134.699 kHz    528.020000 MHz (699 mm x 393 mm)
                 Hfront    8 Hsync  32 Hback   40 Hpol P
                 Vfront    8 Vsync   8 Vback  518 Vpol N
    DTD 3:  2560x1440   59.998785 Hz  16:9     89.818 kHz    237.120000 MHz (699 mm x 393 mm)
                 Hfront    8 Hsync  32 Hback   40 Hpol P
                 Vfront   43 Vsync   8 Vback    6 Vpol N
    Display Product Name: 'ProDisplayXDR'
  Extension blocks: 5
Checksum: 0xe3

----------------

Block 1, CTA-861 Extension Block:
  Revision: 3
  Underscans IT Video Formats by default
  Native detailed modes: 0
  Colorimetry Data Block:
    BT2020RGB
  HDR Static Metadata Data Block:
    Electro optical transfer functions:
      Traditional gamma - SDR luminance range
      Traditional gamma - HDR luminance range
      SMPTE ST2084
    Supported static metadata descriptors:
      Static metadata type 1
    Desired content max luminance: 160 (1600.000 cd/m^2)
    Desired content max frame-average luminance: 107 (507.620 cd/m^2)
    Desired content min luminance: 1 (0.000 cd/m^2)
  Detailed Timing Descriptors:
    DTD 4:  3840x2160   59.939330 Hz  16:9    134.684 kHz    527.960000 MHz (699 mm x 393 mm)
                 Hfront    8 Hsync  32 Hback   40 Hpol P
                 Vfront    9 Vsync   8 Vback   70 Vpol N
    DTD 5:  3840x2160   47.999367 Hz  16:9    134.686 kHz    527.970000 MHz (699 mm x 393 mm)
                 Hfront    8 Hsync  32 Hback   40 Hpol P
                 Vfront   56 Vsync   8 Vback  582 Vpol N
    DTD 6:  3840x2160   47.951737 Hz  16:9    134.696 kHz    528.010000 MHz (699 mm x 393 mm)
                 Hfront    8 Hsync  32 Hback   40 Hpol P
                 Vfront   59 Vsync   8 Vback  582 Vpol N
Checksum: 0x01

----------------

Block 2, DisplayID Extension Block:
  Version: 1.2
  Extension Count: 0
  Display Product Type: Extension Section
  ContainerID Data Block:
    Container ID: 6137cf3e-f87e-4fcd-a1cf-41283a5a8240
  Display Parameters Data Block (0x01):
    Image size: 699.4 mm x 393.4 mm
    Display native pixel format: 6016x3384
    Feature support flags:
      Power management (DPM)
    Gamma: 2.20
    Aspect ratio: 1.78
    Dynamic bpc native: 12
    Dynamic bpc overall: 12
  Vendor-Specific Data Block (0x7f) (Apple), OUI 00-10-FA:
    Type: 4, Version: 1
    00 00                                           '..'
  Tiled Display Topology Data Block (0x12):
    Capabilities:
      Behavior if it is the only tile: Image is scaled to fit the entire tiled display
      Behavior if more than one tile and fewer than total number of tiles: Undefined
    Tiled display consists of a single physical display enclosure
    Num horizontal tiles: 2 Num vertical tiles: 1
    Tile location: 0, 0
    Tile resolution: 3008x3384
    Tiled Display Manufacturer/Vendor ID: APP
    Tiled Display Product ID Code: 44579
    Tiled Display Serial Number: ...
  Vendor-Specific Data Block (0x7e) (VESA), OUI 3A-02-92:
    Data Structure Type: DP
    Default Colorspace and EOTF Handling: Native as specified in the Display Parameters DB
    Number of Pixels in Hor Pix Cnt Overlapping an Adjacent Panel: 0
    Multi-SST Operation: Not Supported
  Video Timing Modes Type 1 - Detailed Timings Data Block:
    DTD:  3840x2160   59.999545 Hz  16:9    134.699 kHz    528.020000 MHz (aspect 16:9, no 3D stereo)
               Hfront    8 Hsync  32 Hback   40 Hpol P
               Vfront   71 Vsync   8 Vback    6 Vpol N
    DTD:  2560x2880   59.999451 Hz   0:0    179.578 kHz    481.270000 MHz (aspect undefined, no 3D stereo)
               Hfront    8 Hsync  32 Hback   80 Hpol P
               Vfront   99 Vsync   8 Vback    6 Vpol N
  Checksum: 0x78
Checksum: 0x90

----------------

Block 3, DisplayID Extension Block:
  Version: 1.2
  Extension Count: 0
  Video Timing Modes Type 1 - Detailed Timings Data Block:
    DTD:  2560x2880   59.939451 Hz   0:0    179.519 kHz    481.110000 MHz (aspect undefined, no 3D stereo)
               Hfront    8 Hsync  32 Hback   80 Hpol P
               Vfront  101 Vsync   8 Vback    6 Vpol N
    DTD:  2560x2880   49.999584 Hz   0:0    179.549 kHz    481.190000 MHz (aspect undefined, no 3D stereo)
               Hfront    8 Hsync  32 Hback   80 Hpol P
               Vfront  697 Vsync   8 Vback    6 Vpol N
    DTD:  2560x2880   47.999777 Hz   0:0    179.567 kHz    481.240000 MHz (aspect undefined, no 3D stereo)
               Hfront    8 Hsync  32 Hback   80 Hpol P
               Vfront  847 Vsync   8 Vback    6 Vpol N
    DTD:  2560x2880   47.951349 Hz   0:0    179.530 kHz    481.140000 MHz (aspect undefined, no 3D stereo)
               Hfront    8 Hsync  32 Hback   80 Hpol P
               Vfront  850 Vsync   8 Vback    6 Vpol N
  Checksum: 0xb0
Checksum: 0x90

----------------

Block 4, DisplayID Extension Block:
  Version: 1.2
  Extension Count: 0
  Video Timing Modes Type 1 - Detailed Timings Data Block:
    DTD:  5120x2880   59.999614 Hz  16:9    179.579 kHz    933.810000 MHz (aspect 16:9, no 3D stereo)
               Hfront    8 Hsync  32 Hback   40 Hpol P
               Vfront   99 Vsync   8 Vback    6 Vpol N
    DTD:  5120x2880   59.939643 Hz  16:9    179.519 kHz    933.500000 MHz (aspect 16:9, no 3D stereo)
               Hfront    8 Hsync  32 Hback   40 Hpol P
               Vfront  101 Vsync   8 Vback    6 Vpol N
    DTD:  5120x2880   50.000000 Hz  16:9    179.550 kHz    933.660000 MHz (aspect 16:9, no 3D stereo)
               Hfront    8 Hsync  32 Hback   40 Hpol P
               Vfront  697 Vsync   8 Vback    6 Vpol N
    DTD:  5120x2880   47.999815 Hz  16:9    179.567 kHz    933.750000 MHz (aspect 16:9, no 3D stereo)
               Hfront    8 Hsync  32 Hback   40 Hpol P
               Vfront  847 Vsync   8 Vback    6 Vpol N
    DTD:  5120x2880   47.951594 Hz  16:9    179.531 kHz    933.560000 MHz (aspect 16:9, no 3D stereo)
               Hfront    8 Hsync  32 Hback   40 Hpol P
               Vfront  850 Vsync   8 Vback    6 Vpol N
  Checksum: 0x0a
Checksum: 0x90

----------------

Block 5, DisplayID Extension Block:
  Version: 1.2
  Extension Count: 0
  Video Timing Modes Type 1 - Detailed Timings Data Block:
    DTD:  6016x3384   59.999899 Hz  16:9    210.960 kHz   1286.010000 MHz (aspect 16:9, no 3D stereo, preferred)
               Hfront    8 Hsync  32 Hback   40 Hpol P
               Vfront  118 Vsync   8 Vback    6 Vpol N
    DTD:  6016x3384   59.939891 Hz  16:9    210.928 kHz   1285.820000 MHz (aspect 16:9, no 3D stereo)
               Hfront    8 Hsync  32 Hback   40 Hpol P
               Vfront  121 Vsync   8 Vback    6 Vpol N
    DTD:  6016x3384   49.999953 Hz  16:9    210.950 kHz   1285.950000 MHz (aspect 16:9, no 3D stereo)
               Hfront    8 Hsync  32 Hback   40 Hpol P
               Vfront  821 Vsync   8 Vback    6 Vpol N
    DTD:  6016x3384   47.999919 Hz  16:9    210.960 kHz   1286.010000 MHz (aspect 16:9, no 3D stereo)
               Hfront    8 Hsync  32 Hback   40 Hpol P
               Vfront  997 Vsync   8 Vback    6 Vpol N
    DTD:  6016x3384   47.951798 Hz  16:9    210.940 kHz   1285.890000 MHz (aspect 16:9, no 3D stereo)
               Hfront    8 Hsync  32 Hback   40 Hpol P
               Vfront 1001 Vsync   8 Vback    6 Vpol N
  Checksum: 0xb4
Checksum: 0x90

----------------

Warnings:

Block 2, DisplayID Extension Block:
  Vendor-Specific Data Block (0x7f) (Apple), OUI 00-10-FA: Expected PNP ID but found OUI.

Failures:

Block 1, CTA-861 Extension Block:
  Required 640x480p60 timings are missing in the established timings and the SVD list (VIC 1).
  Missing VCDB, needed for Set Selectable RGB Quantization to avoid interop issues.
Block 2, DisplayID Extension Block:
  DisplayID Base Block has no product type.
  Expected 0 DisplayID Extension Block, but got 3.
  ContainerID Data Block: Use of DisplayID v2.0 tag for DisplayID v1.2.
  Vendor-Specific Data Block (0x7f) (Apple), OUI 00-10-FA: Endian-ness (le) of OUI is different than expected (be).
  Vendor-Specific Data Block (0x7e) (VESA), OUI 3A-02-92: Use of DisplayID v2.0 tag for DisplayID v1.2.
EDID:
  DisplayID: Missing DisplayID Product Identification Data Block.

EDID conformity: FAIL
