edid-decode (hex):

00 ff ff ff ff ff ff 00 39 ee 00 14 a6 03 fc 02
24 12 01 03 7a 1e 13 78 2e 87 c5 94 57 4f 8c 27
25 50 54 af ce 00 01 01 01 01 01 01 01 01 01 01
01 01 01 01 01 01 9e 20 00 90 51 20 1f 30 48 80
36 00 2f be 10 00 00 1c 00 00 00 fc 00 20 31 34
31 30 57 0a 20 20 20 20 20 20 9a 29 00 a0 51 20
26 30 50 80 36 00 2f be 10 00 00 1c 00 00 00 ff
00 0a 20 20 20 20 20 20 20 20 20 20 20 20 00 10

----------------

Block 0, Base EDID:
  EDID Structure Version & Revision: 1.3
  Vendor & Product Identification:
    Manufacturer: NON
    Model: 5120
    Serial Number: ...
    Made in: week 36 of 2008
  Basic Display Parameters & Features:
    Analog display
    Signal Level Standard: 0.700 : 0.000 : 0.700 V p-p
    Blank-to-black setup/pedestal
    Sync: Separate SyncOnGreen
    Maximum image size: 30 cm x 19 cm
    Gamma: 2.20
    DPMS levels: Off
    RGB color display
    Default (sRGB) color space is primary color space
    First detailed timing is the preferred timing
  Color Characteristics:
    Red  : 0.5800, 0.3398
    Green: 0.3095, 0.5498
    Blue : 0.1552, 0.1445
    White: 0.3134, 0.3291
  Established Timings I & II:
    IBM     :   720x400    70.081663 Hz   9:5     31.467 kHz     28.320000 MHz
    DMT 0x04:   640x480    59.940476 Hz   4:3     31.469 kHz     25.175000 MHz
    DMT 0x05:   640x480    72.808802 Hz   4:3     37.861 kHz     31.500000 MHz
    DMT 0x06:   640x480    75.000000 Hz   4:3     37.500 kHz     31.500000 MHz
    DMT 0x08:   800x600    56.250000 Hz   4:3     35.156 kHz     36.000000 MHz
    DMT 0x09:   800x600    60.316541 Hz   4:3     37.879 kHz     40.000000 MHz
    DMT 0x0a:   800x600    72.187572 Hz   4:3     48.077 kHz     50.000000 MHz
    DMT 0x0b:   800x600    75.000000 Hz   4:3     46.875 kHz     49.500000 MHz
    DMT 0x10:  1024x768    60.003840 Hz   4:3     48.363 kHz     65.000000 MHz
    DMT 0x11:  1024x768    70.069359 Hz   4:3     56.476 kHz     75.000000 MHz
    DMT 0x12:  1024x768    75.028582 Hz   4:3     60.023 kHz     78.750000 MHz
  Standard Timings: none
  Detailed Timing Descriptors:
    DTD 1:  1280x800    59.810326 Hz  16:10    49.702 kHz     83.500000 MHz (303 mm x 190 mm)
                 Hfront   72 Hsync 128 Hback  200 Hpol N
                 Vfront    3 Vsync   6 Vback   22 Vpol P
    Display Product Name: ' 1410W'
    DTD 2:  1280x800    74.934142 Hz  16:10    62.795 kHz    106.500000 MHz (303 mm x 190 mm)
                 Hfront   80 Hsync 128 Hback  208 Hpol N
                 Vfront    3 Vsync   6 Vback   29 Vpol P
    Display Product Serial Number: ...
Checksum: 0x10

----------------

Failures:

Block 0, Base EDID:
  Basic Display Parameters & Features: sRGB is signaled, but the chromaticities do not match.
  Detailed Timing Descriptor #2: Invalid detailed timing descriptor ordering.
  Display Product Serial Number: ...
  Missing Display Range Limits Descriptor.

EDID conformity: FAIL
