edid-decode (hex):

00 ff ff ff ff ff ff 00 0d ae c4 15 00 00 00 00
26 18 01 04 95 22 13 78 02 ef 05 90 54 52 93 29
25 50 54 00 00 00 01 01 01 01 01 01 01 01 01 01
01 01 01 01 01 01 b4 3b 80 4a 71 38 34 40 64 42
6a 00 58 c1 10 00 00 1a cd 27 80 4a 71 38 34 40
64 42 6a 00 58 c1 10 00 00 1a 00 00 00 00 00 00
00 00 00 00 00 00 00 00 00 00 00 00 00 00 00 02
00 0c 44 ff 0b 3c 6e 13 10 1f 6e 00 00 00 00 1f

----------------

Block 0, Base EDID:
  EDID Structure Version & Revision: 1.4
  Vendor & Product Identification:
    Manufacturer: CMN
    Model: 5572
    Made in: week 38 of 2014
  Basic Display Parameters & Features:
    Digital display
    Bits per primary color channel: 6
    DisplayPort interface
    Maximum image size: 34 cm x 19 cm
    Gamma: 2.20
    Supported color formats: RGB 4:4:4
    First detailed timing includes the native pixel format and preferred refresh rate
  Color Characteristics:
    Red  : 0.5654, 0.3300
    Green: 0.3232, 0.5771
    Blue : 0.1601, 0.1445
    White: 0.3134, 0.3291
  Established Timings I & II: none
  Standard Timings: none
  Detailed Timing Descriptors:
    DTD 1:  1920x1080   60.007852 Hz  16:9     67.929 kHz    152.840000 MHz (344 mm x 193 mm)
                 Hfront  100 Hsync  66 Hback  164 Hpol P
                 Vfront    6 Vsync  10 Vback   36 Vpol N
    DTD 2:  1920x1080   40.003926 Hz  16:9     45.284 kHz    101.890000 MHz (344 mm x 193 mm)
                 Hfront  100 Hsync  66 Hback  164 Hpol P
                 Vfront    6 Vsync  10 Vback   36 Vpol N
    Empty Descriptor
    Manufacturer-Specified Display Descriptor (0x02): 00 02 00 0c 44 ff 0b 3c 6e 13 10 1f 6e 00 00 00 '....D..<n...n...'
Checksum: 0x1f

----------------

Failures:

Block 0, Base EDID:
  Empty Descriptor: Use Dummy Descriptor instead of all zeroes.
  Missing Display Product Name.

EDID conformity: FAIL
