edid-decode (hex):

00 ff ff ff ff ff ff 00 04 69 ac 19 01 01 01 01
0f 12 01 03 08 29 1a 78 ea ee d5 a5 55 48 9b 26
12 50 54 2f 4c 00 81 80 71 4f 81 40 81 c0 81 00
8b c0 95 00 95 0f 6b 35 a0 f0 51 84 2a 30 60 98
36 00 98 ff 10 00 00 1c 00 00 00 fd 00 37 4b 1e
50 0e 00 0a 20 20 20 20 20 20 00 00 00 ff 00 38
34 4c 4d 4d 53 30 30 36 31 36 38 0a 00 00 00 fc
00 56 4b 31 39 31 0a 20 20 20 20 20 20 20 00 25

----------------

Block 0, Base EDID:
  EDID Structure Version & Revision: 1.3
  Vendor & Product Identification:
    Manufacturer: ACI
    Model: 6572
    Serial Number: ...
    Made in: week 15 of 2008
  Basic Display Parameters & Features:
    Analog display
    Input voltage level: 0.7/0.3 V
    Blank level equals black level
    Sync: Separate
    Maximum image size: 41 cm x 26 cm
    Gamma: 2.20
    DPMS levels: Standby Suspend Off
    RGB color display
    First detailed timing is the preferred timing
  Color Characteristics:
    Red  : 0.6474, 0.3339
    Green: 0.2841, 0.6074
    Blue : 0.1513, 0.0712
    White: 0.3134, 0.3291
  Established Timings I & II:
    DMT 0x04:   640x480    59.940 Hz   4:3    31.469 kHz  25.175 MHz
    DMT 0x05:   640x480    72.809 Hz   4:3    37.861 kHz  31.500 MHz
    DMT 0x06:   640x480    75.000 Hz   4:3    37.500 kHz  31.500 MHz
    DMT 0x08:   800x600    56.250 Hz   4:3    35.156 kHz  36.000 MHz
    DMT 0x09:   800x600    60.317 Hz   4:3    37.879 kHz  40.000 MHz
    DMT 0x0b:   800x600    75.000 Hz   4:3    46.875 kHz  49.500 MHz
    DMT 0x10:  1024x768    60.004 Hz   4:3    48.363 kHz  65.000 MHz
    DMT 0x11:  1024x768    70.069 Hz   4:3    56.476 kHz  75.000 MHz
  Standard Timings:
    DMT 0x23:  1280x1024   60.020 Hz   5:4    63.981 kHz 108.000 MHz
    DMT 0x15:  1152x864    75.000 Hz   4:3    67.500 kHz 108.000 MHz
    DMT 0x20:  1280x960    60.000 Hz   4:3    60.000 kHz 108.000 MHz
    DMT 0x55:  1280x720    60.000 Hz  16:9    45.000 kHz  74.250 MHz
    DMT 0x1c:  1280x800    59.810 Hz  16:10   49.702 kHz  83.500 MHz
    GTF     :  1360x768    60.000 Hz  16:9    47.700 kHz  84.715 MHz
    DMT 0x2f:  1440x900    59.887 Hz  16:10   55.935 kHz 106.500 MHz
    DMT 0x30:  1440x900    74.984 Hz  16:10   70.635 kHz 136.750 MHz
  Detailed Timing Descriptors:
    DTD 1:  1440x900    74.984 Hz   8:5    70.635 kHz 136.750 MHz (408 mm x 255 mm)
                 Hfront   96 Hsync 152 Hback 248 Hpol N
                 Vfront    3 Vsync   6 Vback  33 Vpol P
  Display Range Limits:
    Monitor ranges (GTF): 55-75 Hz V, 30-80 kHz H, max dotclock 140 MHz
    Display Product Serial Number: ...
    Display Product Name: 'VK191'
Checksum: 0x25

----------------

EDID conformity: PASS
