
EDID (hex):
00ffffffffffff0006afab5300000000
06210104a526167803707593585a9429
20505400000001010101010101010101
010101010101868b80b6703864403020
a5007ed710000018233a80b670386440
3020a5007ed710000018000000fd003c
90aaaa24010a202020202020000000fe
004231373348414e30342e39200a0007

edid-decode (hex):

00 ff ff ff ff ff ff 00 06 af ab 53 00 00 00 00
06 21 01 04 a5 26 16 78 03 70 75 93 58 5a 94 29
20 50 54 00 00 00 01 01 01 01 01 01 01 01 01 01
01 01 01 01 01 01 86 8b 80 b6 70 38 64 40 30 20
a5 00 7e d7 10 00 00 18 23 3a 80 b6 70 38 64 40
30 20 a5 00 7e d7 10 00 00 18 00 00 00 fd 00 3c
90 aa aa 24 01 0a 20 20 20 20 20 20 00 00 00 fe
00 42 31 37 33 48 41 4e 30 34 2e 39 20 0a 00 07

----------------

Block 0, Base EDID:
  EDID Structure Version & Revision: 1.4
  Vendor & Product Identification:
    Manufacturer: AUO
    Model: 21419
    Made in: week 6 of 2023
  Basic Display Parameters & Features:
    Digital display
    Bits per primary color channel: 8
    DisplayPort interface
    Maximum image size: 38 cm x 22 cm
    Gamma: 2.20
    Supported color formats: RGB 4:4:4
    First detailed timing includes the native pixel format and preferred refresh rate
    Display is continuous frequency
  Color Characteristics:
    Red  : 0.5751, 0.3466
    Green: 0.3515, 0.5781
    Blue : 0.1611, 0.1279
    White: 0.3134, 0.3291
  Established Timings I & II: none
  Standard Timings: none
  Detailed Timing Descriptors:
    DTD 1:  1920x1080  144.003290 Hz  16:9    169.924 kHz    357.180000 MHz (382 mm x 215 mm)
                 Hfront   48 Hsync  32 Hback  102 Hpol N
                 Vfront   10 Vsync   5 Vback   85 Vpol N
    DTD 2:  1920x1080   60.003387 Hz  16:9     70.804 kHz    148.830000 MHz (382 mm x 215 mm)
                 Hfront   48 Hsync  32 Hback  102 Hpol N
                 Vfront   10 Vsync   5 Vback   85 Vpol N
    Display Range Limits:
      Monitor ranges (Bare Limits): 60-144 Hz V, 170-170 kHz H, max dotclock 360 MHz
    Alphanumeric Data String: 'B173HAN04.9 '
Checksum: 0x07
