edid-decode (hex):

00 ff ff ff ff ff ff 00 09 e5 1f 08 00 00 00 00
21 1c 01 04 95 1f 11 78 03 e7 b0 95 5c 59 94 29
22 50 54 00 00 00 01 01 01 01 01 01 01 01 01 01
01 01 01 01 01 01 c1 37 80 cc 70 38 28 40 30 20
36 00 35 ae 10 00 00 1a 2b 25 80 cc 70 38 28 40
30 20 36 00 35 ae 10 00 00 1a 00 00 00 00 00 00
00 00 00 00 00 00 00 00 00 00 00 00 00 00 00 02
00 0d 49 ff 0a 3c 6e 16 12 20 6e 00 00 00 00 14

----------------

Block 0, Base EDID:
  EDID Structure Version & Revision: 1.4
  Vendor & Product Identification:
    Manufacturer: BOE
    Model: 2079
    Made in: week 33 of 2018
  Basic Display Parameters & Features:
    Digital display
    Bits per primary color channel: 6
    DisplayPort interface
    Maximum image size: 31 cm x 17 cm
    Gamma: 2.20
    Supported color formats: RGB 4:4:4
    First detailed timing includes the native pixel format and preferred refresh rate
    Display is continuous frequency
  Color Characteristics:
    Red  : 0.5849, 0.3613
    Green: 0.3486, 0.5810
    Blue : 0.1621, 0.1357
    White: 0.3125, 0.3281
  Established Timings I & II: none
  Standard Timings: none
  Detailed Timing Descriptors:
    DTD 1:  1920x1080   59.998823 Hz  16:9     67.199 kHz    142.730000 MHz (309 mm x 174 mm)
                 Hfront   48 Hsync  32 Hback  124 Hpol P
                 Vfront    3 Vsync   6 Vback   31 Vpol N
    DTD 2:  1920x1080   39.997814 Hz  16:9     44.798 kHz     95.150000 MHz (309 mm x 174 mm)
                 Hfront   48 Hsync  32 Hback  124 Hpol P
                 Vfront    3 Vsync   6 Vback   31 Vpol N
    Empty Descriptor
    Manufacturer-Specified Display Descriptor (0x02): 00 02 00 0d 49 ff 0a 3c 6e 16 12 20 6e 00 00 00 '....I..<n.. n...'
Checksum: 0x14

----------------

Warnings:

Block 0, Base EDID:
  Missing Display Product Name.

Failures:

Block 0, Base EDID:
  Empty Descriptor: Use Dummy Descriptor instead of all zeroes.
  Missing Display Range Limits Descriptor.

EDID conformity: FAIL
