edid-decode (hex):

00 ff ff ff ff ff ff 00 06 af 8a f0 00 00 00 00
00 1d 01 04 95 22 13 78 02 05 b5 94 59 59 92 28
1d 50 54 00 00 00 01 01 01 01 01 01 01 01 01 01
01 01 01 01 01 01 14 37 80 b4 70 38 24 40 6c 30
aa 00 58 c2 10 00 00 18 00 00 00 0f 00 00 00 00
00 00 00 00 00 00 00 00 00 20 00 00 00 fe 00 41
55 4f 0a 20 20 20 20 20 20 20 20 20 00 00 00 fe
00 42 31 35 36 48 41 42 30 33 2e 30 20 0a 00 05

----------------

Block 0, Base EDID:
  EDID Structure Version & Revision: 1.4
  Vendor & Product Identification:
    Manufacturer: AUO
    Model: 61578
    Made in: 2019
  Basic Display Parameters & Features:
    Digital display
    Bits per primary color channel: 6
    DisplayPort interface
    Maximum image size: 34 cm x 19 cm
    Gamma: 2.20
    Supported color formats: RGB 4:4:4
    First detailed timing includes the native pixel format and preferred refresh rate
  Color Characteristics:
    Red  : 0.5781, 0.3476
    Green: 0.3486, 0.5712
    Blue : 0.1582, 0.1162
    White: 0.3134, 0.3291
  Established Timings I & II: none
  Standard Timings: none
  Detailed Timing Descriptors:
    DTD 1:  1920x1080   60.163850 Hz  16:9     67.143 kHz    141.000000 MHz (344 mm x 194 mm)
                 Hfront  108 Hsync  48 Hback   24 Hpol N
                 Vfront   10 Vsync  10 Vback   16 Vpol N
    Manufacturer-Specified Display Descriptor (0x0f): 00 0f 00 00 00 00 00 00 00 00 00 00 00 00 00 20 '............... '
    Alphanumeric Data String: 'AUO'
    Alphanumeric Data String: 'B156HAB03.0 '
Checksum: 0x05

----------------

Warnings:

Block 0, Base EDID:
  Missing Display Product Name.

Failures:

Block 0, Base EDID:
  Alphanumeric Data String: One or more trailing spaces.

EDID conformity: FAIL
