
EDID (hex):
00ffffffffffff00410c51209cc80000
27140103802c19782ac720a455499927
135054bfee0081c00101010101010101
010101010101302a40c8608464301850
1300bbf91000001e000000ff00465836
31303339303531333536000000fd0038
4b1f500e000a202020202020000000fc
005068696c697073203230305677007c

Extracted contents:
header:          00 ff ff ff ff ff ff 00
serial number:   41 0c 51 20 9c c8 00 00 27 14
version:         01 03
basic params:    80 2c 19 78 2a
chroma info:     c7 20 a4 55 49 99 27 13 50 54
established:     bf ee 00
standard:        81 c0 01 01 01 01 01 01 01 01 01 01 01 01 01 01
descriptor 1:    30 2a 40 c8 60 84 64 30 18 50 13 00 bb f9 10 00 00 1e
descriptor 2:    00 00 00 ff 00 46 58 36 31 30 33 39 30 35 31 33 35 36
descriptor 3:    00 00 00 fd 00 38 4b 1f 50 0e 00 0a 20 20 20 20 20 20
descriptor 4:    00 00 00 fc 00 50 68 69 6c 69 70 73 20 32 30 30 56 77
extensions:      00
checksum:        7c

EDID version: 1.3
Manufacturer: PHL Model 2051 Serial Number --
Made in week 39 of 2010
Digital display
Maximum image size: 44 cm x 25 cm
Gamma: 2.20
DPMS levels: Off
RGB color display
First detailed timing is preferred timing
Display x,y Chromaticity:
  Red:   0.6435, 0.3320
  Green: 0.2861, 0.6005
  Blue:  0.1523, 0.0761
  White: 0.3125, 0.3281
Established timings supported:
  720x400@70Hz 9:5 HorFreq: 31469 Hz Clock: 28.320 MHz
  640x480@60Hz 4:3 HorFreq: 31469 Hz Clock: 25.175 MHz
  640x480@67Hz 4:3 HorFreq: 35000 Hz Clock: 30.240 MHz
  640x480@72Hz 4:3 HorFreq: 37900 Hz Clock: 31.500 MHz
  640x480@75Hz 4:3 HorFreq: 37500 Hz Clock: 31.500 MHz
  800x600@56Hz 4:3 HorFreq: 35200 Hz Clock: 36.000 MHz
  800x600@60Hz 4:3 HorFreq: 37900 Hz Clock: 40.000 MHz
  800x600@72Hz 4:3 HorFreq: 48100 Hz Clock: 50.000 MHz
  800x600@75Hz 4:3 HorFreq: 46900 Hz Clock: 49.500 MHz
  832x624@75Hz 4:3 HorFreq: 49726 Hz Clock: 57.284 MHz
  1024x768@60Hz 4:3 HorFreq: 48400 Hz Clock: 65.000 MHz
  1024x768@70Hz 4:3 HorFreq: 56500 Hz Clock: 75.000 MHz
  1024x768@75Hz 4:3 HorFreq: 60000 Hz Clock: 78.750 MHz
Standard timings supported:
  1280x720@60Hz 16:9
Detailed mode: Clock 108.000 MHz, 443 mm x 249 mm
               1600 1624 1704 1800 hborder 0
                900  901  904 1000 vborder 0
               +hsync +vsync 
               VertFreq: 60 Hz, HorFreq: 60000 Hz
Serial number: --
Monitor ranges (GTF): 56-75Hz V, 31-80kHz H, max dotclock 140MHz
Checksum: 0x7c (valid)
EDID block does NOT conform to EDID 1.3!
	Name descriptor not terminated with a newline


