edid-decode (hex):

00 ff ff ff ff ff ff 00 04 72 33 0a f8 8c 10 22
15 20 01 03 80 35 1e 78 2a 68 81 a3 55 4e 9e 26
0f 50 54 bf ef 80 71 4f 81 80 81 40 81 00 81 c0
95 00 b3 00 01 01 02 3a 80 18 71 38 2d 40 30 20
35 00 14 30 21 00 00 1e 00 00 00 fd 00 30 a5 1e
e0 28 00 0a 20 20 20 20 20 20 00 00 00 fc 00 4b
47 32 34 31 59 20 53 0a 20 20 20 20 00 00 00 ff
00 35 32 32 31 30 38 43 46 38 33 57 30 31 01 80

02 03 40 f1 4a 01 03 04 90 11 13 9f 3f 60 61 23
09 07 05 83 01 00 00 67 03 0c 00 10 00 38 2d 67
d8 5d c4 01 78 80 00 e3 05 c3 01 e6 06 05 01 5b
5b 1c 6d 1a 00 00 02 01 30 a5 e6 00 63 31 00 31
f0 6e 80 b4 70 38 2d 40 30 20 35 00 14 30 21 00
00 1a 38 8b 80 18 71 38 2d 40 30 20 35 00 55 50
21 00 00 1e f2 91 80 78 70 38 1e 40 30 20 35 00
56 50 21 00 00 1e 00 00 00 00 00 00 00 00 00 3b

00 ff ff ff ff ff ff 00 04 72 33 0a f8 8c 10 22
15 20 01 03 80 35 1e 78 2a 68 81 a3 55 4e 9e 26
0f 50 54 bf ef 80 71 4f 81 80 81 40 81 00 81 c0
95 00 b3 00 01 01 02 3a 80 18 71 38 2d 40 30 20
35 00 14 30 21 00 00 1e 00 00 00 fd 00 30 a5 1e
e0 28 00 0a 20 20 20 20 20 20 00 00 00 fc 00 4b
47 32 34 31 59 20 53 0a 20 20 20 20 00 00 00 ff
00 35 32 32 31 30 38 43 46 38 33 57 30 31 01 80

02 03 40 f1 4a 01 03 04 90 11 13 9f 3f 60 61 23
09 07 05 83 01 00 00 67 03 0c 00 10 00 38 2d 67
d8 5d c4 01 78 80 00 e3 05 c3 01 e6 06 05 01 5b
5b 1c 6d 1a 00 00 02 01 30 a5 e6 00 63 31 00 31
f0 6e 80 b4 70 38 2d 40 30 20 35 00 14 30 21 00
00 1a 38 8b 80 18 71 38 2d 40 30 20 35 00 55 50
21 00 00 1e f2 91 80 78 70 38 1e 40 30 20 35 00
56 50 21 00 00 1e 00 00 00 00 00 00 00 00 00 3b

----------------

Block 0, Base EDID:
  EDID Structure Version & Revision: 1.3
  Vendor & Product Identification:
    Manufacturer: ACR
    Model: 2611
    Serial Number: ...
    Made in: week 21 of 2022
  Basic Display Parameters & Features:
    Digital display
    Maximum image size: 53 cm x 30 cm
    Gamma: 2.20
    DPMS levels: Off
    RGB color display
    First detailed timing is the preferred timing
  Color Characteristics:
    Red  : 0.6376, 0.3339
    Green: 0.3066, 0.6171
    Blue : 0.1503, 0.0585
    White: 0.3125, 0.3291
  Established Timings I & II:
    IBM     :   720x400    70.081663 Hz   9:5     31.467 kHz     28.320000 MHz
    DMT 0x04:   640x480    59.940476 Hz   4:3     31.469 kHz     25.175000 MHz
    Apple   :   640x480    66.666667 Hz   4:3     35.000 kHz     30.240000 MHz
    DMT 0x05:   640x480    72.808802 Hz   4:3     37.861 kHz     31.500000 MHz
    DMT 0x06:   640x480    75.000000 Hz   4:3     37.500 kHz     31.500000 MHz
    DMT 0x08:   800x600    56.250000 Hz   4:3     35.156 kHz     36.000000 MHz
    DMT 0x09:   800x600    60.316541 Hz   4:3     37.879 kHz     40.000000 MHz
    DMT 0x0a:   800x600    72.187572 Hz   4:3     48.077 kHz     50.000000 MHz
    DMT 0x0b:   800x600    75.000000 Hz   4:3     46.875 kHz     49.500000 MHz
    Apple   :   832x624    74.551266 Hz   4:3     49.726 kHz     57.284000 MHz
    DMT 0x10:  1024x768    60.003840 Hz   4:3     48.363 kHz     65.000000 MHz
    DMT 0x11:  1024x768    70.069359 Hz   4:3     56.476 kHz     75.000000 MHz
    DMT 0x12:  1024x768    75.028582 Hz   4:3     60.023 kHz     78.750000 MHz
    DMT 0x24:  1280x1024   75.024675 Hz   5:4     79.976 kHz    135.000000 MHz
    Apple   :  1152x870    75.061550 Hz 192:145   68.681 kHz    100.000000 MHz
  Standard Timings:
    DMT 0x15:  1152x864    75.000000 Hz   4:3     67.500 kHz    108.000000 MHz
    DMT 0x23:  1280x1024   60.019740 Hz   5:4     63.981 kHz    108.000000 MHz
    DMT 0x20:  1280x960    60.000000 Hz   4:3     60.000 kHz    108.000000 MHz
    DMT 0x1c:  1280x800    59.810326 Hz  16:10    49.702 kHz     83.500000 MHz
    DMT 0x55:  1280x720    60.000000 Hz  16:9     45.000 kHz     74.250000 MHz
    DMT 0x2f:  1440x900    59.887445 Hz  16:10    55.935 kHz    106.500000 MHz
    DMT 0x3a:  1680x1050   59.954250 Hz  16:10    65.290 kHz    146.250000 MHz
  Detailed Timing Descriptors:
    DTD 1:  1920x1080   60.000000 Hz  16:9     67.500 kHz    148.500000 MHz (532 mm x 304 mm)
                 Hfront   48 Hsync  32 Hback  200 Hpol P
                 Vfront    3 Vsync   5 Vback   37 Vpol P
    Display Range Limits:
      Monitor ranges (GTF): 48-165 Hz V, 30-224 kHz H, max dotclock 400 MHz
    Display Product Name: 'KG241Y S'
    Display Product Serial Number: ...
  Extension blocks: 1
Checksum: 0x80

----------------

Block 1, CTA-861 Extension Block:
  Revision: 3
  Underscans IT Video Formats by default
  Basic audio support
  Supports YCbCr 4:4:4
  Supports YCbCr 4:2:2
  Native detailed modes: 1
  Video Data Block:
    VIC   1:   640x480    59.940476 Hz   4:3     31.469 kHz     25.175000 MHz
    VIC   3:   720x480    59.940060 Hz  16:9     31.469 kHz     27.000000 MHz
    VIC   4:  1280x720    60.000000 Hz  16:9     45.000 kHz     74.250000 MHz
    VIC  16:  1920x1080   60.000000 Hz  16:9     67.500 kHz    148.500000 MHz (native)
    VIC  17:   720x576    50.000000 Hz   4:3     31.250 kHz     27.000000 MHz
    VIC  19:  1280x720    50.000000 Hz  16:9     37.500 kHz     74.250000 MHz
    VIC  31:  1920x1080   50.000000 Hz  16:9     56.250 kHz    148.500000 MHz (native)
    VIC  63:  1920x1080  120.000000 Hz  16:9    135.000 kHz    297.000000 MHz
    VIC  96:  3840x2160   50.000000 Hz  16:9    112.500 kHz    594.000000 MHz
    VIC  97:  3840x2160   60.000000 Hz  16:9    135.000 kHz    594.000000 MHz
  Audio Data Block:
    Linear PCM:
      Max channels: 2
      Supported sample rates (kHz): 48 44.1 32
      Supported sample sizes (bits): 24 16
  Speaker Allocation Data Block:
    FL/FR - Front Left/Right
  Vendor-Specific Data Block (HDMI), OUI 00-0C-03:
    Source physical address: 1.0.0.0
    DC_36bit
    DC_30bit
    DC_Y444
    Maximum TMDS clock: 225 MHz
  Vendor-Specific Data Block (HDMI Forum), OUI C4-5D-D8:
    Version: 1
    Maximum TMDS Character Rate: 600 MHz
    SCDC Present
  Colorimetry Data Block:
    xvYCC601
    xvYCC709
    BT2020YCC
    BT2020RGB
    Gamut Boundary Description Metadata Profile P0
  HDR Static Metadata Data Block:
    Electro optical transfer functions:
      Traditional gamma - SDR luminance range
      SMPTE ST2084
    Supported static metadata descriptors:
      Static metadata type 1
    Desired content max luminance: 91 (358.942 cd/m^2)
    Desired content max frame-average luminance: 91 (358.942 cd/m^2)
    Desired content min luminance: 28 (0.043 cd/m^2)
  Vendor-Specific Data Block (AMD), OUI 00-00-1A:
    Version: 2.1
    Minimum Refresh Rate: 48 Hz
    Maximum Refresh Rate: 165 Hz
    Flags 1.x: 0xe6 (MCCS)
    Flags 2.x: 0x00
    Maximum luminance: 99 (426.856 cd/m^2)
    Minimum luminance: 49 (0.158 cd/m^2)
    Unknown: 0x00 0x31
  Detailed Timing Descriptors:
    DTD 2:  1920x1080  120.211640 Hz  16:9    135.238 kHz    284.000000 MHz (532 mm x 304 mm)
                 Hfront   48 Hsync  32 Hback  100 Hpol P
                 Vfront    3 Vsync   5 Vback   37 Vpol N
    DTD 3:  1920x1080  144.000000 Hz  16:9    162.000 kHz    356.400000 MHz (597 mm x 336 mm)
                 Hfront   48 Hsync  32 Hback  200 Hpol P
                 Vfront    3 Vsync   5 Vback   37 Vpol P
    DTD 4:  1920x1080  164.997350 Hz  16:9    183.147 kHz    373.620000 MHz (598 mm x 336 mm)
                 Hfront   48 Hsync  32 Hback   40 Hpol P
                 Vfront    3 Vsync   5 Vback   22 Vpol P
Checksum: 0x3b  Unused space in Extension Block: 9 bytes

----------------

Block 2, Unknown EDID Extension Block 0x00:
  00 ff ff ff ff ff ff 00 04 72 33 0a f8 8c 10 22 '.........r3...."'
  15 20 01 03 80 35 1e 78 2a 68 81 a3 55 4e 9e 26 '. ...5.x*h..UN.&'
  0f 50 54 bf ef 80 71 4f 81 80 81 40 81 00 81 c0 '.PT...qO...@....'
  95 00 b3 00 01 01 02 3a 80 18 71 38 2d 40 30 20 '.......:..q8-@0 '
  35 00 14 30 21 00 00 1e 00 00 00 fd 00 30 a5 1e '5..0!........0..'
  e0 28 00 0a 20 20 20 20 20 20 00 00 00 fc 00 4b '.(..      .....K'
  47 32 34 31 59 20 53 0a 20 20 20 20 00 00 00 ff 'G241Y S.    ....'
  00 35 32 32 31 30 38 43 46 38 33 57 30 31 01 80 '.522108CF83W01..'
Checksum: 0x80

----------------

Block 3, CTA-861 Extension Block:
  Revision: 3
  Underscans IT Video Formats by default
  Basic audio support
  Supports YCbCr 4:4:4
  Supports YCbCr 4:2:2
  Native detailed modes: 1
  Video Data Block:
    VIC   1:   640x480    59.940476 Hz   4:3     31.469 kHz     25.175000 MHz
    VIC   3:   720x480    59.940060 Hz  16:9     31.469 kHz     27.000000 MHz
    VIC   4:  1280x720    60.000000 Hz  16:9     45.000 kHz     74.250000 MHz
    VIC  16:  1920x1080   60.000000 Hz  16:9     67.500 kHz    148.500000 MHz (native)
    VIC  17:   720x576    50.000000 Hz   4:3     31.250 kHz     27.000000 MHz
    VIC  19:  1280x720    50.000000 Hz  16:9     37.500 kHz     74.250000 MHz
    VIC  31:  1920x1080   50.000000 Hz  16:9     56.250 kHz    148.500000 MHz (native)
    VIC  63:  1920x1080  120.000000 Hz  16:9    135.000 kHz    297.000000 MHz
    VIC  96:  3840x2160   50.000000 Hz  16:9    112.500 kHz    594.000000 MHz
    VIC  97:  3840x2160   60.000000 Hz  16:9    135.000 kHz    594.000000 MHz
  Audio Data Block:
    Linear PCM:
      Max channels: 2
      Supported sample rates (kHz): 48 44.1 32
      Supported sample sizes (bits): 24 16
  Speaker Allocation Data Block:
    FL/FR - Front Left/Right
  Vendor-Specific Data Block (HDMI), OUI 00-0C-03:
    Source physical address: 1.0.0.0
    DC_36bit
    DC_30bit
    DC_Y444
    Maximum TMDS clock: 225 MHz
  Vendor-Specific Data Block (HDMI Forum), OUI C4-5D-D8:
    Version: 1
    Maximum TMDS Character Rate: 600 MHz
    SCDC Present
  Colorimetry Data Block:
    xvYCC601
    xvYCC709
    BT2020YCC
    BT2020RGB
    Gamut Boundary Description Metadata Profile P0
  HDR Static Metadata Data Block:
    Electro optical transfer functions:
      Traditional gamma - SDR luminance range
      SMPTE ST2084
    Supported static metadata descriptors:
      Static metadata type 1
    Desired content max luminance: 91 (358.942 cd/m^2)
    Desired content max frame-average luminance: 91 (358.942 cd/m^2)
    Desired content min luminance: 28 (0.043 cd/m^2)
  Vendor-Specific Data Block (AMD), OUI 00-00-1A:
    Version: 2.1
    Minimum Refresh Rate: 48 Hz
    Maximum Refresh Rate: 165 Hz
    Flags 1.x: 0xe6 (MCCS)
    Flags 2.x: 0x00
    Maximum luminance: 99 (426.856 cd/m^2)
    Minimum luminance: 49 (0.158 cd/m^2)
    Unknown: 0x00 0x31
  Detailed Timing Descriptors:
    DTD 5:  1920x1080  120.211640 Hz  16:9    135.238 kHz    284.000000 MHz (532 mm x 304 mm)
                 Hfront   48 Hsync  32 Hback  100 Hpol P
                 Vfront    3 Vsync   5 Vback   37 Vpol N
    DTD 6:  1920x1080  144.000000 Hz  16:9    162.000 kHz    356.400000 MHz (597 mm x 336 mm)
                 Hfront   48 Hsync  32 Hback  200 Hpol P
                 Vfront    3 Vsync   5 Vback   37 Vpol P
    DTD 7:  1920x1080  164.997350 Hz  16:9    183.147 kHz    373.620000 MHz (598 mm x 336 mm)
                 Hfront   48 Hsync  32 Hback   40 Hpol P
                 Vfront    3 Vsync   5 Vback   22 Vpol P
Checksum: 0x3b  Unused space in Extension Block: 9 bytes

----------------

Warnings:

Block 0, Base EDID:
  Detailed Timing Descriptor #1: DTD is similar but not identical to VIC 16.
Block 1, CTA-861 Extension Block:
  Colorimetry Data Block: Set the sRGB colorimetry bit to avoid interop issues.
  Display Product Serial Number is set, so the Serial Number in the Base EDID should be 0.
Block 3, CTA-861 Extension Block:
  Colorimetry Data Block: Set the sRGB colorimetry bit to avoid interop issues.
  Display Product Serial Number is set, so the Serial Number in the Base EDID should be 0.
EDID:
  CTA-861: Multiple native progressive timings are defined.

Failures:

Block 1, CTA-861 Extension Block:
  Detailed Timing Descriptor #3: Mismatch of image size 597x336 mm vs display size 530x300 mm.
  Detailed Timing Descriptor #4: Mismatch of image size 598x336 mm vs display size 530x300 mm.
  Missing VCDB, needed for Set Selectable RGB Quantization to avoid interop issues.
Block 2, Base EDID:
  Unknown Extension Block.
Block 3, CTA-861 Extension Block:
  Video Data Block: Duplicate VIC 1.
  Video Data Block: Duplicate VIC 3.
  Video Data Block: Duplicate VIC 4.
  Video Data Block: Duplicate VIC 16.
  Video Data Block: Duplicate VIC 17.
  Video Data Block: Duplicate VIC 19.
  Video Data Block: Duplicate VIC 31.
  Video Data Block: Duplicate VIC 63.
  Video Data Block: Duplicate VIC 96.
  Video Data Block: Duplicate VIC 97.
  Speaker Allocation Data Block: Only one instance of this Data Block is allowed.
  Vendor-Specific Data Block (HDMI Forum), OUI C4-5D-D8: Duplicate HDMI Forum VSDB/SCDB.
  Colorimetry Data Block: Only one instance of this Data Block is allowed.
  HDR Static Metadata Data Block: Only one instance of this Data Block is allowed.
  Detailed Timing Descriptor #6: Mismatch of image size 597x336 mm vs display size 530x300 mm.
  Detailed Timing Descriptor #7: Mismatch of image size 598x336 mm vs display size 530x300 mm.
  Missing VCDB, needed for Set Selectable RGB Quantization to avoid interop issues.
EDID:
  Base EDID: Some timings are out of range of the Monitor Ranges:
    Maximum Clock: 594.000 MHz (Monitor: 400.000 MHz)
  Base EDID: The DTD max image size is 598x336mm, which is larger than the display size 530.0x300.0mm.
  Base EDID: EDID specified 1 extension block(s), but found 3 extension block(s).
  Base EDID: EDID 1.3 requires a Block Map Extension in Block 1 if there are more than 2 blocks in the EDID.

EDID conformity: FAIL
