edid-decode (hex):

00 ff ff ff ff ff ff 00 22 f0 12 29 01 01 01 01
17 14 01 03 68 33 1d 78 ee c6 65 a0 59 58 9d 27
0e 50 54 a1 08 00 81 c0 81 40 81 80 95 00 a9 40
b3 00 01 01 01 01 02 3a 80 18 71 38 2d 40 58 2c
45 00 fd 1e 11 00 00 1e 00 00 00 fd 00 32 4b 18
53 11 00 0a 20 20 20 20 20 20 00 00 00 ff 00 43
4e 43 30 32 33 51 30 30 39 0a 20 20 00 00 00 fc
00 48 50 20 78 32 33 4c 45 44 0a 20 20 20 00 6c

00 ff ff ff ff ff ff 00 22 f0 12 29 01 01 01 01
17 14 01 03 68 33 1d 78 ee c6 65 a0 59 58 9d 27
0e 50 54 a1 08 00 81 c0 81 40 81 80 95 00 a9 40
b3 00 01 01 01 01 02 3a 80 18 71 38 2d 40 58 2c
45 00 fd 1e 11 00 00 1e 00 00 00 fd 00 32 4b 18
53 11 00 0a 20 20 20 20 20 20 00 00 00 ff 00 43
4e 43 30 32 33 51 30 30 39 0a 20 20 00 00 00 fc
00 48 50 20 78 32 33 4c 45 44 0a 20 20 20 00 6c

----------------

Block 0, Base EDID:
  EDID Structure Version & Revision: 1.3
  Vendor & Product Identification:
    Manufacturer: HWP
    Model: 10514
    Serial Number: ...
    Made in: week 23 of 2010
  Basic Display Parameters & Features:
    Analog display
    Signal Level Standard: 0.700 : 0.000 : 0.700 V p-p
    Blank level equals black level
    Sync: Separate
    Maximum image size: 51 cm x 29 cm
    Gamma: 2.20
    DPMS levels: Standby Suspend Off
    RGB color display
    Default (sRGB) color space is primary color space
    First detailed timing is the preferred timing
  Color Characteristics:
    Red  : 0.6279, 0.3476
    Green: 0.3447, 0.6152
    Blue : 0.1533, 0.0566
    White: 0.3134, 0.3291
  Established Timings I & II:
    IBM     :   720x400    70.081663 Hz   9:5     31.467 kHz     28.320000 MHz
    DMT 0x04:   640x480    59.940476 Hz   4:3     31.469 kHz     25.175000 MHz
    DMT 0x09:   800x600    60.316541 Hz   4:3     37.879 kHz     40.000000 MHz
    DMT 0x10:  1024x768    60.003840 Hz   4:3     48.363 kHz     65.000000 MHz
  Standard Timings:
    DMT 0x55:  1280x720    60.000000 Hz  16:9     45.000 kHz     74.250000 MHz
    DMT 0x20:  1280x960    60.000000 Hz   4:3     60.000 kHz    108.000000 MHz
    DMT 0x23:  1280x1024   60.019740 Hz   5:4     63.981 kHz    108.000000 MHz
    DMT 0x2f:  1440x900    59.887445 Hz  16:10    55.935 kHz    106.500000 MHz
    DMT 0x33:  1600x1200   60.000000 Hz   4:3     75.000 kHz    162.000000 MHz
    DMT 0x3a:  1680x1050   59.954250 Hz  16:10    65.290 kHz    146.250000 MHz
  Detailed Timing Descriptors:
    DTD 1:  1920x1080   60.000000 Hz  16:9     67.500 kHz    148.500000 MHz (509 mm x 286 mm)
                 Hfront   88 Hsync  44 Hback  148 Hpol P
                 Vfront    4 Vsync   5 Vback   36 Vpol P
    Display Range Limits:
      Monitor ranges (GTF): 50-75 Hz V, 24-83 kHz H, max dotclock 170 MHz
    Display Product Serial Number: ...
    Display Product Name: 'HP x23LED'
Checksum: 0x6c

----------------

Block 1, Unknown EDID Extension Block 0x00:
  00 ff ff ff ff ff ff 00 22 f0 12 29 01 01 01 01 '........"..)....'
  17 14 01 03 68 33 1d 78 ee c6 65 a0 59 58 9d 27 '....h3.x..e.YX.''
  0e 50 54 a1 08 00 81 c0 81 40 81 80 95 00 a9 40 '.PT......@.....@'
  b3 00 01 01 01 01 02 3a 80 18 71 38 2d 40 58 2c '.......:..q8-@X,'
  45 00 fd 1e 11 00 00 1e 00 00 00 fd 00 32 4b 18 'E............2K.'
  53 11 00 0a 20 20 20 20 20 20 00 00 00 ff 00 43 'S...      .....C'
  4e 43 30 32 33 51 30 30 39 0a 20 20 00 00 00 fc 'NC023Q009.  ....'
  00 48 50 20 78 32 33 4c 45 44 0a 20 20 20 00 6c '.HP x23LED.   .l'
Checksum: 0x6c

----------------

Failures:

Block 0, Base EDID:
  Basic Display Parameters & Features: sRGB is signaled, but the chromaticities do not match.
Block 1, Base EDID:
  Unknown Extension Block.
EDID:
  Base EDID: EDID specified 0 extension block(s), but found 1 extension block(s).

EDID conformity: FAIL
