edid-decode (hex):

00 ff ff ff ff ff ff 00 63 30 29 34 00 00 00 00
0b 23 01 03 b4 4f 23 78 2a ee 95 a3 54 4c 99 26
0f 50 54 25 4b 00 81 c0 81 80 95 00 a9 c0 b3 00
01 01 01 01 01 01 b2 d2 70 b4 d0 a0 32 50 58 40
45 00 1c 4d 31 00 00 1e 00 00 00 ff 00 30 30 30
30 30 30 30 30 30 30 30 30 30 00 00 00 fd 00 30
64 17 eb 3c 00 0a 20 20 20 20 20 20 00 00 00 fc
00 4d 50 33 34 32 39 2d 59 0a 20 20 20 20 01 c8

02 03 3d f1 4b 01 02 03 04 05 90 12 13 01 1f 40
23 09 1f 07 83 01 00 00 68 03 0c 00 10 00 38 44
00 67 d8 5d c4 01 78 80 03 68 1a 00 00 01 01 30
64 ed e3 05 e3 01 e6 06 07 01 60 59 41 26 9d 70
a0 d0 a0 32 50 30 20 3a 00 1c 4d 31 00 00 1e 69
5e 00 a0 a0 a0 29 50 30 20 35 00 1c 4d 31 00 00
1e 6a 7e 70 b4 d0 a0 32 50 30 20 36 00 1c 4d 31
00 00 1e 00 00 00 00 00 00 00 00 00 00 00 00 ca

00 ff ff ff ff ff ff 00 63 30 29 34 00 00 00 00
0b 23 01 03 b4 4f 23 78 2a ee 95 a3 54 4c 99 26
0f 50 54 25 4b 00 81 c0 81 80 95 00 a9 c0 b3 00
01 01 01 01 01 01 b2 d2 70 b4 d0 a0 32 50 58 40
45 00 1c 4d 31 00 00 1e 00 00 00 ff 00 30 30 30
30 30 30 30 30 30 30 30 30 30 00 00 00 fd 00 30
64 17 eb 3c 00 0a 20 20 20 20 20 20 00 00 00 fc
00 4d 50 33 34 32 39 2d 59 0a 20 20 20 20 01 c8

02 03 3d f1 4b 01 02 03 04 05 90 12 13 01 1f 40
23 09 1f 07 83 01 00 00 68 03 0c 00 10 00 38 44
00 67 d8 5d c4 01 78 80 03 68 1a 00 00 01 01 30
64 ed e3 05 e3 01 e6 06 07 01 60 59 41 26 9d 70
a0 d0 a0 32 50 30 20 3a 00 1c 4d 31 00 00 1e 69
5e 00 a0 a0 a0 29 50 30 20 35 00 1c 4d 31 00 00
1e 6a 7e 70 b4 d0 a0 32 50 30 20 36 00 1c 4d 31
00 00 1e 00 00 00 00 00 00 00 00 00 00 00 00 ca

----------------

Block 0, Base EDID:
  EDID Structure Version & Revision: 1.3
  Vendor & Product Identification:
    Manufacturer: XYP
    Model: 13353
    Made in: week 11 of 2025
  Basic Display Parameters & Features:
    Digital display
    Maximum image size: 79 cm x 35 cm
    Gamma: 2.20
    DPMS levels: Off
    RGB color display
    First detailed timing is the preferred timing
  Color Characteristics:
    Red  : 0.6396, 0.3300
    Green: 0.2998, 0.5996
    Blue : 0.1503, 0.0595
    White: 0.3134, 0.3291
  Established Timings I & II:
    DMT 0x04:   640x480    59.940476 Hz   4:3     31.469 kHz     25.175000 MHz
    DMT 0x06:   640x480    75.000000 Hz   4:3     37.500 kHz     31.500000 MHz
    DMT 0x09:   800x600    60.316541 Hz   4:3     37.879 kHz     40.000000 MHz
    DMT 0x0b:   800x600    75.000000 Hz   4:3     46.875 kHz     49.500000 MHz
    DMT 0x10:  1024x768    60.003840 Hz   4:3     48.363 kHz     65.000000 MHz
    DMT 0x12:  1024x768    75.028582 Hz   4:3     60.023 kHz     78.750000 MHz
    DMT 0x24:  1280x1024   75.024675 Hz   5:4     79.976 kHz    135.000000 MHz
  Standard Timings:
    DMT 0x55:  1280x720    60.000000 Hz  16:9     45.000 kHz     74.250000 MHz
    DMT 0x23:  1280x1024   60.019740 Hz   5:4     63.981 kHz    108.000000 MHz
    DMT 0x2f:  1440x900    59.887445 Hz  16:10    55.935 kHz    106.500000 MHz
    DMT 0x53:  1600x900    60.000000 Hz  16:9     60.000 kHz    108.000000 MHz (RB)
    DMT 0x3a:  1680x1050   59.954250 Hz  16:10    65.290 kHz    146.250000 MHz
  Detailed Timing Descriptors:
    DTD 1:  3440x1440  100.000000 Hz  43:18   149.000 kHz    539.380000 MHz (796 mm x 333 mm)
                 Hfront   88 Hsync  64 Hback   28 Hpol P
                 Vfront    4 Vsync   5 Vback   41 Vpol P
    Display Product Serial Number: ...
    Display Range Limits:
      Monitor ranges (GTF): 48-100 Hz V, 23-235 kHz H, max dotclock 600 MHz
    Display Product Name: 'MP3429-Y'
  Extension blocks: 1
Checksum: 0xc8

----------------

Block 1, CTA-861 Extension Block:
  Revision: 3
  Underscans IT Video Formats by default
  Basic audio support
  Supports YCbCr 4:4:4
  Supports YCbCr 4:2:2
  Native detailed modes: 1
  Video Data Block:
    VIC   1:   640x480    59.940476 Hz   4:3     31.469 kHz     25.175000 MHz
    VIC   2:   720x480    59.940060 Hz   4:3     31.469 kHz     27.000000 MHz
    VIC   3:   720x480    59.940060 Hz  16:9     31.469 kHz     27.000000 MHz
    VIC   4:  1280x720    60.000000 Hz  16:9     45.000 kHz     74.250000 MHz
    VIC   5:  1920x1080i  60.000000 Hz  16:9     33.750 kHz     74.250000 MHz
    VIC  16:  1920x1080   60.000000 Hz  16:9     67.500 kHz    148.500000 MHz (native)
    VIC  18:   720x576    50.000000 Hz  16:9     31.250 kHz     27.000000 MHz
    VIC  19:  1280x720    50.000000 Hz  16:9     37.500 kHz     74.250000 MHz
    VIC   1:   640x480    59.940476 Hz   4:3     31.469 kHz     25.175000 MHz
    VIC  31:  1920x1080   50.000000 Hz  16:9     56.250 kHz    148.500000 MHz
    VIC  64:  1920x1080  100.000000 Hz  16:9    112.500 kHz    297.000000 MHz
  Audio Data Block:
    Linear PCM:
      Max channels: 2
      Supported sample rates (kHz): 96 88.2 48 44.1 32
      Supported sample sizes (bits): 24 20 16
  Speaker Allocation Data Block:
    FL/FR - Front Left/Right
  Vendor-Specific Data Block (HDMI), OUI 00-0C-03:
    Source physical address: 1.0.0.0
    DC_36bit
    DC_30bit
    DC_Y444
    Maximum TMDS clock: 340 MHz
  Vendor-Specific Data Block (HDMI Forum), OUI C4-5D-D8:
    Version: 1
    Maximum TMDS Character Rate: 600 MHz
    SCDC Present
    Supports 12-bits/component Deep Color 4:2:0 Pixel Encoding
    Supports 10-bits/component Deep Color 4:2:0 Pixel Encoding
  Vendor-Specific Data Block (AMD), OUI 00-00-1A:
    Version: 1.1
    Minimum Refresh Rate: 48 Hz
    Maximum Refresh Rate: 100 Hz
    Flags 1.x: 0xed (MCCS)
  Colorimetry Data Block:
    xvYCC601
    xvYCC709
    BT2020cYCC
    BT2020YCC
    BT2020RGB
    Gamut Boundary Description Metadata Profile P0
  HDR Static Metadata Data Block:
    Electro optical transfer functions:
      Traditional gamma - SDR luminance range
      Traditional gamma - HDR luminance range
      SMPTE ST2084
    Supported static metadata descriptors:
      Static metadata type 1
    Desired content max luminance: 96 (400.000 cd/m^2)
    Desired content max frame-average luminance: 89 (343.724 cd/m^2)
    Desired content min luminance: 65 (0.260 cd/m^2)
  Detailed Timing Descriptors:
    DTD 2:  3440x1440   75.000000 Hz  43:18   111.750 kHz    402.300000 MHz (796 mm x 333 mm)
                 Hfront   48 Hsync  32 Hback   80 Hpol P
                 Vfront    3 Vsync  10 Vback   37 Vpol P
    DTD 3:  2560x1440   59.997716 Hz  16:9     88.857 kHz    241.690000 MHz (796 mm x 333 mm)
                 Hfront   48 Hsync  32 Hback   80 Hpol P
                 Vfront    3 Vsync   5 Vback   33 Vpol P
    DTD 4:  3440x1440   59.998517 Hz  43:18    89.398 kHz    323.620000 MHz (796 mm x 333 mm)
                 Hfront   48 Hsync  32 Hback  100 Hpol P
                 Vfront    3 Vsync   6 Vback   41 Vpol P
Checksum: 0xca  Unused space in Extension Block: 12 bytes

----------------

Block 2, Unknown EDID Extension Block 0x00:
  00 ff ff ff ff ff ff 00 63 30 29 34 00 00 00 00 '........c0)4....'
  0b 23 01 03 b4 4f 23 78 2a ee 95 a3 54 4c 99 26 '.#...O#x*...TL.&'
  0f 50 54 25 4b 00 81 c0 81 80 95 00 a9 c0 b3 00 '.PT%K...........'
  01 01 01 01 01 01 b2 d2 70 b4 d0 a0 32 50 58 40 '........p...2PX@'
  45 00 1c 4d 31 00 00 1e 00 00 00 ff 00 30 30 30 'E..M1........000'
  30 30 30 30 30 30 30 30 30 30 00 00 00 fd 00 30 '0000000000.....0'
  64 17 eb 3c 00 0a 20 20 20 20 20 20 00 00 00 fc 'd..<..      ....'
  00 4d 50 33 34 32 39 2d 59 0a 20 20 20 20 01 c8 '.MP3429-Y.    ..'
Checksum: 0xc8

----------------

Block 3, CTA-861 Extension Block:
  Revision: 3
  Underscans IT Video Formats by default
  Basic audio support
  Supports YCbCr 4:4:4
  Supports YCbCr 4:2:2
  Native detailed modes: 1
  Video Data Block:
    VIC   1:   640x480    59.940476 Hz   4:3     31.469 kHz     25.175000 MHz
    VIC   2:   720x480    59.940060 Hz   4:3     31.469 kHz     27.000000 MHz
    VIC   3:   720x480    59.940060 Hz  16:9     31.469 kHz     27.000000 MHz
    VIC   4:  1280x720    60.000000 Hz  16:9     45.000 kHz     74.250000 MHz
    VIC   5:  1920x1080i  60.000000 Hz  16:9     33.750 kHz     74.250000 MHz
    VIC  16:  1920x1080   60.000000 Hz  16:9     67.500 kHz    148.500000 MHz (native)
    VIC  18:   720x576    50.000000 Hz  16:9     31.250 kHz     27.000000 MHz
    VIC  19:  1280x720    50.000000 Hz  16:9     37.500 kHz     74.250000 MHz
    VIC   1:   640x480    59.940476 Hz   4:3     31.469 kHz     25.175000 MHz
    VIC  31:  1920x1080   50.000000 Hz  16:9     56.250 kHz    148.500000 MHz
    VIC  64:  1920x1080  100.000000 Hz  16:9    112.500 kHz    297.000000 MHz
  Audio Data Block:
    Linear PCM:
      Max channels: 2
      Supported sample rates (kHz): 96 88.2 48 44.1 32
      Supported sample sizes (bits): 24 20 16
  Speaker Allocation Data Block:
    FL/FR - Front Left/Right
  Vendor-Specific Data Block (HDMI), OUI 00-0C-03:
    Source physical address: 1.0.0.0
    DC_36bit
    DC_30bit
    DC_Y444
    Maximum TMDS clock: 340 MHz
  Vendor-Specific Data Block (HDMI Forum), OUI C4-5D-D8:
    Version: 1
    Maximum TMDS Character Rate: 600 MHz
    SCDC Present
    Supports 12-bits/component Deep Color 4:2:0 Pixel Encoding
    Supports 10-bits/component Deep Color 4:2:0 Pixel Encoding
  Vendor-Specific Data Block (AMD), OUI 00-00-1A:
    Version: 1.1
    Minimum Refresh Rate: 48 Hz
    Maximum Refresh Rate: 100 Hz
    Flags 1.x: 0xed (MCCS)
  Colorimetry Data Block:
    xvYCC601
    xvYCC709
    BT2020cYCC
    BT2020YCC
    BT2020RGB
    Gamut Boundary Description Metadata Profile P0
  HDR Static Metadata Data Block:
    Electro optical transfer functions:
      Traditional gamma - SDR luminance range
      Traditional gamma - HDR luminance range
      SMPTE ST2084
    Supported static metadata descriptors:
      Static metadata type 1
    Desired content max luminance: 96 (400.000 cd/m^2)
    Desired content max frame-average luminance: 89 (343.724 cd/m^2)
    Desired content min luminance: 65 (0.260 cd/m^2)
  Detailed Timing Descriptors:
    DTD 5:  3440x1440   75.000000 Hz  43:18   111.750 kHz    402.300000 MHz (796 mm x 333 mm)
                 Hfront   48 Hsync  32 Hback   80 Hpol P
                 Vfront    3 Vsync  10 Vback   37 Vpol P
    DTD 6:  2560x1440   59.997716 Hz  16:9     88.857 kHz    241.690000 MHz (796 mm x 333 mm)
                 Hfront   48 Hsync  32 Hback   80 Hpol P
                 Vfront    3 Vsync   5 Vback   33 Vpol P
    DTD 7:  3440x1440   59.998517 Hz  43:18    89.398 kHz    323.620000 MHz (796 mm x 333 mm)
                 Hfront   48 Hsync  32 Hback  100 Hpol P
                 Vfront    3 Vsync   6 Vback   41 Vpol P
Checksum: 0xca  Unused space in Extension Block: 12 bytes

----------------

Warnings:

Block 1, CTA-861 Extension Block:
  Colorimetry Data Block: Set the sRGB colorimetry bit to avoid interop issues.
Block 3, CTA-861 Extension Block:
  Colorimetry Data Block: Set the sRGB colorimetry bit to avoid interop issues.

Failures:

Block 0, Base EDID:
  Basic Display Parameters & Features: Digital Video Interface Standard set to reserved value 0x34.
Block 1, CTA-861 Extension Block:
  Video Data Block: Duplicate VIC 1.
  Missing VCDB, needed for Set Selectable RGB Quantization to avoid interop issues.
Block 2, Base EDID:
  Unknown Extension Block.
Block 3, CTA-861 Extension Block:
  Video Data Block: Duplicate VIC 2.
  Video Data Block: Duplicate VIC 3.
  Video Data Block: Duplicate VIC 4.
  Video Data Block: Duplicate VIC 5.
  Video Data Block: Duplicate VIC 16.
  Video Data Block: Duplicate VIC 18.
  Video Data Block: Duplicate VIC 19.
  Video Data Block: Duplicate VIC 31.
  Video Data Block: Duplicate VIC 64.
  Speaker Allocation Data Block: Only one instance of this Data Block is allowed.
  Vendor-Specific Data Block (HDMI Forum), OUI C4-5D-D8: Duplicate HDMI Forum VSDB/SCDB.
  Colorimetry Data Block: Only one instance of this Data Block is allowed.
  HDR Static Metadata Data Block: Only one instance of this Data Block is allowed.
  Missing VCDB, needed for Set Selectable RGB Quantization to avoid interop issues.
EDID:
  Base EDID: EDID specified 1 extension block(s), but found 3 extension block(s).
  Base EDID: EDID 1.3 requires a Block Map Extension in Block 1 if there are more than 2 blocks in the EDID.
  CTA-861: Native progressive timings are a mix of several resolutions.

EDID conformity: FAIL
