edid-decode (hex):

00 ff ff ff ff ff ff 00 04 72 25 00 43 34 21 90
02 13 01 03 68 28 19 6b 2a 67 60 a2 5a 49 9e 23
13 50 54 bf ef 00 81 8f 81 80 95 0f 95 00 81 00
71 4f 01 01 01 01 9a 29 a0 d0 51 84 22 30 50 98
36 00 98 ff 10 00 00 1c 00 00 00 ff 00 4c 43 31
30 38 30 30 33 34 32 30 31 0a 00 00 00 fd 00 37
4b 1e 53 0e 00 0a 20 20 20 20 20 20 00 00 00 fc
00 41 63 65 72 20 56 31 39 33 57 0a 20 20 00 72

----------------

Block 0, Base EDID:
  EDID Structure Version & Revision: 1.3
  Vendor & Product Identification:
    Manufacturer: ACR
    Model: 37
    Serial Number: ...
    Made in: week 2 of 2009
  Basic Display Parameters & Features:
    Analog display
    Input voltage level: 0.7/0.7 V
    Blank level equals black level
    Sync: Separate
    Maximum image size: 40 cm x 25 cm
    Gamma: 2.07
    DPMS levels: Off
    RGB color display
    First detailed timing is the preferred timing
  Color Characteristics:
    Red  : 0.6337, 0.3535
    Green: 0.2861, 0.6201
    Blue : 0.1376, 0.0761
    White: 0.3125, 0.3281
  Established Timings I & II:
    IBM     :   720x400    70.082 Hz   9:5    31.467 kHz  28.320 MHz
    DMT 0x04:   640x480    59.940 Hz   4:3    31.469 kHz  25.175 MHz
    Apple   :   640x480    66.667 Hz   4:3    35.000 kHz  30.240 MHz
    DMT 0x05:   640x480    72.809 Hz   4:3    37.861 kHz  31.500 MHz
    DMT 0x06:   640x480    75.000 Hz   4:3    37.500 kHz  31.500 MHz
    DMT 0x08:   800x600    56.250 Hz   4:3    35.156 kHz  36.000 MHz
    DMT 0x09:   800x600    60.317 Hz   4:3    37.879 kHz  40.000 MHz
    DMT 0x0a:   800x600    72.188 Hz   4:3    48.077 kHz  50.000 MHz
    DMT 0x0b:   800x600    75.000 Hz   4:3    46.875 kHz  49.500 MHz
    Apple   :   832x624    74.551 Hz   4:3    49.726 kHz  57.284 MHz
    DMT 0x10:  1024x768    60.004 Hz   4:3    48.363 kHz  65.000 MHz
    DMT 0x11:  1024x768    70.069 Hz   4:3    56.476 kHz  75.000 MHz
    DMT 0x12:  1024x768    75.029 Hz   4:3    60.023 kHz  78.750 MHz
    DMT 0x24:  1280x1024   75.025 Hz   5:4    79.976 kHz 135.000 MHz
  Standard Timings:
    DMT 0x24:  1280x1024   75.025 Hz   5:4    79.976 kHz 135.000 MHz
    DMT 0x23:  1280x1024   60.020 Hz   5:4    63.981 kHz 108.000 MHz
    DMT 0x30:  1440x900    74.984 Hz  16:10   70.635 kHz 136.750 MHz
    DMT 0x2f:  1440x900    59.887 Hz  16:10   55.935 kHz 106.500 MHz
    DMT 0x1c:  1280x800    59.810 Hz  16:10   49.702 kHz  83.500 MHz
    DMT 0x15:  1152x864    75.000 Hz   4:3    67.500 kHz 108.000 MHz
  Detailed Timing Descriptors:
    DTD 1:  1440x900    59.887 Hz   8:5    55.935 kHz 106.500 MHz (408 mm x 255 mm)
                 Hfront   80 Hsync 152 Hback 232 Hpol N
                 Vfront    3 Vsync   6 Vback  25 Vpol P
    Display Product Serial Number: ...
  Display Range Limits:
    Monitor ranges (GTF): 55-75 Hz V, 30-83 kHz H, max dotclock 140 MHz
    Display Product Name: 'Acer V193W'
Checksum: 0x72

----------------

EDID conformity: PASS
