
EDID (hex):
00ffffffffffff0004722f008a522082
161201036c221b782a3d85a6564a9a24
125054bfef0061467140714f81008140
814a814f8180302a009851002a403070
1300520e1100001e000000fd00314b1e
500e000a202020202020000000fc0041
63657220563137330a202020000000ff
004c43413032303031343130310a001a

Extracted contents:
header:          00 ff ff ff ff ff ff 00
serial number:   04 72 2f 00 8a 52 20 82 16 12
version:         01 03
basic params:    6c 22 1b 78 2a
chroma info:     3d 85 a6 56 4a 9a 24 12 50 54
established:     bf ef 00
standard:        61 46 71 40 71 4f 81 00 81 40 81 4a 81 4f 81 80
descriptor 1:    30 2a 00 98 51 00 2a 40 30 70 13 00 52 0e 11 00 00 1e
descriptor 2:    00 00 00 fd 00 31 4b 1e 50 0e 00 0a 20 20 20 20 20 20
descriptor 3:    00 00 00 fc 00 41 63 65 72 20 56 31 37 33 0a 20 20 20
descriptor 4:    00 00 00 ff 00 4c 43 41 30 32 30 30 31 34 31 30 31 0a
extensions:      00
checksum:        1a

EDID version: 1.3
Manufacturer: ACR Model 2f Serial Number --
Made in week 22 of 2008
Analog display, Input voltage level: 0.7/0.7 V
Sync: Separate Composite 
Maximum image size: 34 cm x 27 cm
Gamma: 2.20
DPMS levels: Off
RGB color display
First detailed timing is preferred timing
Display x,y Chromaticity:
  Red:   0.6484, 0.3388
  Green: 0.2919, 0.6025
  Blue:  0.1425, 0.0703
  White: 0.3134, 0.3291
Established timings supported:
  720x400@70Hz 9:5 HorFreq: 31469 Hz Clock: 28.320 MHz
  640x480@60Hz 4:3 HorFreq: 31469 Hz Clock: 25.175 MHz
  640x480@67Hz 4:3 HorFreq: 35000 Hz Clock: 30.240 MHz
  640x480@72Hz 4:3 HorFreq: 37900 Hz Clock: 31.500 MHz
  640x480@75Hz 4:3 HorFreq: 37500 Hz Clock: 31.500 MHz
  800x600@56Hz 4:3 HorFreq: 35200 Hz Clock: 36.000 MHz
  800x600@60Hz 4:3 HorFreq: 37900 Hz Clock: 40.000 MHz
  800x600@72Hz 4:3 HorFreq: 48100 Hz Clock: 50.000 MHz
  800x600@75Hz 4:3 HorFreq: 46900 Hz Clock: 49.500 MHz
  832x624@75Hz 4:3 HorFreq: 49726 Hz Clock: 57.284 MHz
  1024x768@60Hz 4:3 HorFreq: 48400 Hz Clock: 65.000 MHz
  1024x768@70Hz 4:3 HorFreq: 56500 Hz Clock: 75.000 MHz
  1024x768@75Hz 4:3 HorFreq: 60000 Hz Clock: 78.750 MHz
  1280x1024@75Hz 5:4 HorFreq: 80000 Hz Clock: 135.000 MHz
Standard timings supported:
  1024x768@66Hz 4:3
  1152x864@60Hz 4:3
  1152x864@75Hz 4:3 HorFreq: 67500 Hz Clock: 108.000 MHz
  1280x800@60Hz 16:10
  1280x960@60Hz 4:3 HorFreq: 60000 Hz Clock: 108.000 MHz
  1280x960@70Hz 4:3
  1280x960@75Hz 4:3
  1280x1024@60Hz 5:4 HorFreq: 64000 Hz Clock: 108.000 MHz
Detailed mode: Clock 108.000 MHz, 338 mm x 270 mm
               1280 1328 1440 1688 hborder 0
               1024 1025 1028 1066 vborder 0
               +hsync +vsync 
               VertFreq: 60 Hz, HorFreq: 63981 Hz
Monitor ranges (GTF): 49-75Hz V, 30-80kHz H, max dotclock 140MHz
Monitor name: Acer V173
Serial number: --
Checksum: 0x1a (valid)
