edid-decode (hex):

00 ff ff ff ff ff ff 00 10 ac fd 93 58 26 df 04
1c 1b 01 03 80 35 1e 78 0a 54 c0 a3 5b 4f a4 26
12 50 54 00 00 00 01 01 01 01 01 01 01 01 01 01
01 01 01 01 01 01 02 3a 80 18 71 38 2d 40 30 21
84 00 10 29 21 00 00 1e 00 00 00 fc 00 49 6e 73
70 69 72 6f 6e 20 33 34 38 30 00 00 00 10 00 00
0a 20 20 20 20 20 20 20 20 20 20 20 00 00 00 10
00 00 0a 20 20 20 20 20 20 20 21 20 20 20 00 6f

00 ff ff ff ff ff ff 00 10 ac fd 93 58 26 df 04
1c 1b 01 03 80 35 1e 78 0a 54 c0 a3 5b 4f a4 26
12 50 54 00 00 00 01 01 01 01 01 01 01 01 01 01
01 01 01 01 01 01 02 3a 80 18 71 38 2d 40 30 21
84 00 10 29 21 00 00 1e 00 00 00 fc 00 49 6e 73
70 69 72 6f 6e 20 33 34 38 30 00 00 00 10 00 00
0a 20 20 20 20 20 20 20 20 20 20 20 00 00 00 10
00 00 0a 20 20 20 20 20 20 20 21 20 20 20 00 6f

----------------

Block 0, Base EDID:
  EDID Structure Version & Revision: 1.3
  Vendor & Product Identification:
    Manufacturer: DEL
    Model: 37885
    Serial Number: ...
    Made in: week 28 of 2017
  Basic Display Parameters & Features:
    Digital display
    Maximum image size: 53 cm x 30 cm
    Gamma: 2.20
    RGB color display
    First detailed timing is the preferred timing
  Color Characteristics:
    Red  : 0.6376, 0.3564
    Green: 0.3095, 0.6406
    Blue : 0.1513, 0.0703
    White: 0.3125, 0.3281
  Established Timings I & II: none
  Standard Timings: none
  Detailed Timing Descriptors:
    DTD 1:  1920x1080   60.000000 Hz  16:9     67.500 kHz    148.500000 MHz (528 mm x 297 mm)
                 Hfront   48 Hsync  33 Hback  199 Hpol P
                 Vfront    8 Vsync   4 Vback   33 Vpol P
    Display Product Name: 'Inspiron 3480'
    Dummy Descriptor:
    Dummy Descriptor:
Checksum: 0x6f

----------------

Block 1, Unknown EDID Extension Block 0x00:
  00 ff ff ff ff ff ff 00 10 ac fd 93 58 26 df 04 '............X&..'
  1c 1b 01 03 80 35 1e 78 0a 54 c0 a3 5b 4f a4 26 '.....5.x.T..[O.&'
  12 50 54 00 00 00 01 01 01 01 01 01 01 01 01 01 '.PT.............'
  01 01 01 01 01 01 02 3a 80 18 71 38 2d 40 30 21 '.......:..q8-@0!'
  84 00 10 29 21 00 00 1e 00 00 00 fc 00 49 6e 73 '...)!........Ins'
  70 69 72 6f 6e 20 33 34 38 30 00 00 00 10 00 00 'piron 3480......'
  0a 20 20 20 20 20 20 20 20 20 20 20 00 00 00 10 '.           ....'
  00 00 0a 20 20 20 20 20 20 20 21 20 20 20 00 6f '...       !   .o'
Checksum: 0x6f

----------------

Warnings:

Block 0, Base EDID:
  Detailed Timing Descriptor #1: DTD is similar but not identical to VIC 16.

Failures:

Block 0, Base EDID:
  Dummy Descriptor: Dummy block filled with garbage.
  Dummy Descriptor: Dummy block filled with garbage.
  Missing Display Range Limits Descriptor.
Block 1, Base EDID:
  Unknown Extension Block.
EDID:
  Base EDID: EDID specified 0 extension block(s), but found 1 extension block(s).

EDID conformity: FAIL
