edid-decode (hex):

00 ff ff ff ff ff ff 00 41 0c 5c 10 d1 bf 00 00
1d 07 01 00 08 1c 15 7d e8 c2 f2 9e 57 4e 99 27
10 48 4f 25 48 00 45 59 00 00 00 00 00 00 00 00
00 00 00 00 00 00 d5 09 80 a0 20 5e 63 10 10 60
52 08 04 c3 10 00 00 1a d5 09 80 a0 20 90 31 10
10 60 c2 00 04 c3 10 00 00 1c 00 00 00 00 00 00
00 00 00 00 00 00 00 00 00 00 00 00 00 00 00 00
00 00 00 00 00 00 00 00 00 00 00 00 00 00 00 d3

----------------

Block 0, Base EDID:
  EDID Structure Version & Revision: 1.0
  Vendor & Product Identification:
    Manufacturer: PHL
    Model: 4188
    Serial Number: ...
    Made in: week 29 of 1997
  Basic Display Parameters & Features:
    Analog display
    Input voltage level: 0.7/0.3 V
    Blank level equals black level
    Sync: Separate
    Maximum image size: 28 cm x 21 cm
    Gamma: 2.25
    DPMS levels: Standby Suspend Off
    RGB color display
  Color Characteristics:
    Red  : 0.6201, 0.3398
    Green: 0.3046, 0.5996
    Blue : 0.1552, 0.0654
    White: 0.2812, 0.3105
  Established Timings I & II:
    DMT 0x04:   640x480    59.940 Hz   4:3    31.469 kHz  25.175 MHz
    DMT 0x06:   640x480    75.000 Hz   4:3    37.500 kHz  31.500 MHz
    DMT 0x09:   800x600    60.317 Hz   4:3    37.879 kHz  40.000 MHz
    DMT 0x0b:   800x600    75.000 Hz   4:3    46.875 kHz  49.500 MHz
    DMT 0x10:  1024x768    60.004 Hz   4:3    48.363 kHz  65.000 MHz
  Standard Timings:
    DMT 0x0c:   800x600    85.061 Hz   4:3    53.674 kHz  56.250 MHz
  Detailed Timing Descriptors:
    DTD 1:   640x350    70.072 Hz  64:35   31.462 kHz  25.170 MHz (260 mm x 195 mm)
                 Hfront   16 Hsync  96 Hback  48 Hpol P
                 Vfront   37 Vsync   2 Vback  60 Vpol N
    DTD 2:   640x400    70.072 Hz   8:5    31.462 kHz  25.170 MHz (260 mm x 195 mm)
                 Hfront   16 Hsync  96 Hback  48 Hpol N
                 Vfront   12 Vsync   2 Vback  35 Vpol P
    Empty Descriptor
    Empty Descriptor
Checksum: 0xd3

----------------

Warnings:

Block 0, Base EDID:
  EDID Structure Version & Revision: EDID 1.0 is deprecated, do not use.

Failures:

Block 0, Base EDID:
  Standard Timings: Use 0x0101 as the invalid Standard Timings code, not 0x0000.
  Standard Timings: Use 0x0101 as the invalid Standard Timings code, not 0x0000.
  Standard Timings: Use 0x0101 as the invalid Standard Timings code, not 0x0000.
  Standard Timings: Use 0x0101 as the invalid Standard Timings code, not 0x0000.
  Standard Timings: Use 0x0101 as the invalid Standard Timings code, not 0x0000.
  Standard Timings: Use 0x0101 as the invalid Standard Timings code, not 0x0000.
  Standard Timings: Use 0x0101 as the invalid Standard Timings code, not 0x0000.
  Detailed Timing Descriptor #1: Mismatch of image size 260x195 mm vs display size 280x210 mm.
  Detailed Timing Descriptor #2: Mismatch of image size 260x195 mm vs display size 280x210 mm.
  Display Descriptor #3: Has descriptor blocks other than detailed timings.
  Empty Descriptor: Use Dummy Descriptor instead of all zeroes.
  Display Descriptor #4: Has descriptor blocks other than detailed timings.
  Empty Descriptor: Use Dummy Descriptor instead of all zeroes.

EDID conformity: FAIL
