edid-decode (hex):

00 ff ff ff ff ff ff 00 4c ab 3e 12 0f 00 00 00
23 15 01 03 80 66 39 78 0a 01 c1 a0 57 47 98 27
12 4c 4c 21 08 00 31 40 45 40 61 40 81 80 01 01
01 01 01 01 01 01 02 3a 80 18 71 38 2d 40 58 2c
46 00 40 84 63 00 00 1e 00 00 00 ff 00 34 36 37
30 4d 38 31 33 35 53 30 30 31 00 00 00 fc 00 53
43 34 36 31 54 53 0a 20 20 20 20 20 00 00 00 fd
00 30 3e 0e 44 0f 00 0a 20 20 20 20 20 20 01 c1

02 03 25 70 52 01 02 03 04 05 06 07 10 11 12 13
14 15 16 1f 20 21 22 23 09 07 07 83 01 00 00 65
03 0c 00 30 00 01 1d 80 d0 72 1c 16 20 10 2c 25
80 40 84 63 00 00 9f 01 1d 80 18 71 1c 16 20 58
2c 25 00 40 84 63 00 00 99 01 1d 00 bc 52 d0 1e
20 b8 28 55 40 40 84 63 00 00 1e 02 3a 80 d0 72
38 2d 40 10 2c 45 80 40 84 63 00 00 1e 00 00 00
00 00 00 00 00 00 00 00 00 00 00 00 00 00 00 f7

----------------

Block 0, Base EDID:
  EDID Structure Version & Revision: 1.3
  Vendor & Product Identification:
    Manufacturer: SEK
    Model: 4670
    Serial Number: ...
    Made in: week 35 of 2011
  Basic Display Parameters & Features:
    Digital display
    Maximum image size: 102 cm x 57 cm
    Gamma: 2.20
    RGB color display
    First detailed timing is the preferred timing
  Color Characteristics:
    Red  : 0.6250, 0.3398
    Green: 0.2773, 0.5947
    Blue : 0.1552, 0.0703
    White: 0.2968, 0.2978
  Established Timings I & II:
    DMT 0x04:   640x480    59.940476 Hz   4:3     31.469 kHz     25.175000 MHz
    DMT 0x09:   800x600    60.316541 Hz   4:3     37.879 kHz     40.000000 MHz
    DMT 0x10:  1024x768    60.003840 Hz   4:3     48.363 kHz     65.000000 MHz
  Standard Timings:
    DMT 0x04:   640x480    59.940476 Hz   4:3     31.469 kHz     25.175000 MHz
    DMT 0x09:   800x600    60.316541 Hz   4:3     37.879 kHz     40.000000 MHz
    DMT 0x10:  1024x768    60.003840 Hz   4:3     48.363 kHz     65.000000 MHz
    DMT 0x23:  1280x1024   60.019740 Hz   5:4     63.981 kHz    108.000000 MHz
  Detailed Timing Descriptors:
    DTD 1:  1920x1080   60.000000 Hz  16:9     67.500 kHz    148.500000 MHz (1600 mm x 900 mm)
                 Hfront   88 Hsync  44 Hback  148 Hpol P
                 Vfront    4 Vsync   6 Vback   35 Vpol P
    Display Product Serial Number: ...
    Display Product Name: 'SC461TS'
    Display Range Limits:
      Monitor ranges (GTF): 48-62 Hz V, 14-68 kHz H, max dotclock 150 MHz
  Extension blocks: 1
Checksum: 0xc1

----------------

Block 1, CTA-861 Extension Block:
  Revision: 3
  Basic audio support
  Supports YCbCr 4:4:4
  Supports YCbCr 4:2:2
  Native detailed modes: 0
  Video Data Block:
    VIC   1:   640x480    59.940476 Hz   4:3     31.469 kHz     25.175000 MHz
    VIC   2:   720x480    59.940060 Hz   4:3     31.469 kHz     27.000000 MHz
    VIC   3:   720x480    59.940060 Hz  16:9     31.469 kHz     27.000000 MHz
    VIC   4:  1280x720    60.000000 Hz  16:9     45.000 kHz     74.250000 MHz
    VIC   5:  1920x1080i  60.000000 Hz  16:9     33.750 kHz     74.250000 MHz
    VIC   6:  1440x480i   59.940060 Hz   4:3     15.734 kHz     27.000000 MHz
    VIC   7:  1440x480i   59.940060 Hz  16:9     15.734 kHz     27.000000 MHz
    VIC  16:  1920x1080   60.000000 Hz  16:9     67.500 kHz    148.500000 MHz
    VIC  17:   720x576    50.000000 Hz   4:3     31.250 kHz     27.000000 MHz
    VIC  18:   720x576    50.000000 Hz  16:9     31.250 kHz     27.000000 MHz
    VIC  19:  1280x720    50.000000 Hz  16:9     37.500 kHz     74.250000 MHz
    VIC  20:  1920x1080i  50.000000 Hz  16:9     28.125 kHz     74.250000 MHz
    VIC  21:  1440x576i   50.000000 Hz   4:3     15.625 kHz     27.000000 MHz
    VIC  22:  1440x576i   50.000000 Hz  16:9     15.625 kHz     27.000000 MHz
    VIC  31:  1920x1080   50.000000 Hz  16:9     56.250 kHz    148.500000 MHz
    VIC  32:  1920x1080   24.000000 Hz  16:9     27.000 kHz     74.250000 MHz
    VIC  33:  1920x1080   25.000000 Hz  16:9     28.125 kHz     74.250000 MHz
    VIC  34:  1920x1080   30.000000 Hz  16:9     33.750 kHz     74.250000 MHz
  Audio Data Block:
    Linear PCM:
      Max channels: 2
      Supported sample rates (kHz): 48 44.1 32
      Supported sample sizes (bits): 24 20 16
  Speaker Allocation Data Block:
    FL/FR - Front Left/Right
  Vendor-Specific Data Block (HDMI), OUI 00-0C-03:
    Source physical address: 3.0.0.0
  Detailed Timing Descriptors:
    DTD 2:  1920x1080i  50.000000 Hz  16:9     28.125 kHz     74.250000 MHz (1600 mm x 900 mm)
                 Hfront  528 Hsync  44 Hback  148 Hpol P
                 Vfront    2 Vsync   5 Vback   15 Vpol P Vfront +0.5 Odd Field
                 Vfront    2 Vsync   5 Vback   15 Vpol P Vback  +0.5 Even Field
    DTD 3:  1920x1080i  60.000000 Hz  16:9     33.750 kHz     74.250000 MHz (1600 mm x 900 mm)
                 Hfront   88 Hsync  44 Hback  148 Hpol N
                 Vfront    2 Vsync   5 Vback   15 Vpol N Vfront +0.5 Odd Field
                 Vfront    2 Vsync   5 Vback   15 Vpol N Vback  +0.5 Even Field
    DTD 4:  1280x720    50.000000 Hz  16:9     37.500 kHz     74.250000 MHz (1600 mm x 900 mm)
                 Hfront  440 Hsync  40 Hback  220 Hpol P
                 Vfront    5 Vsync   5 Vback   20 Vpol P
    DTD 5:  1920x1080   50.000000 Hz  16:9     56.250 kHz    148.500000 MHz (1600 mm x 900 mm)
                 Hfront  528 Hsync  44 Hback  148 Hpol P
                 Vfront    4 Vsync   5 Vback   36 Vpol P
Checksum: 0xf7

----------------

Warnings:

Block 0, Base EDID:
  Detailed Timing Descriptor #1: DTD is similar but not identical to VIC 16.
Block 1, CTA-861 Extension Block:
  IT Video Formats are overscanned by default, but normally this should be underscanned.
  Video Data Block: VIC 1 is the preferred timing, overriding the first detailed timings. Is this intended?
  Detailed Timing Descriptor #3: DTD is similar but not identical to VIC 5.
  Display Product Serial Number is set, so the Serial Number in the Base EDID should be 0.

Failures:

Block 0, Base EDID:
  Detailed Timing Descriptor #1: Mismatch of image size 1600x900 mm vs display size 1020x570 mm.
Block 1, CTA-861 Extension Block:
  Detailed Timing Descriptor #2: Mismatch of image size 1600x900 mm vs display size 1020x570 mm.
  Detailed Timing Descriptor #3: Mismatch of image size 1600x900 mm vs display size 1020x570 mm.
  Detailed Timing Descriptor #4: Mismatch of image size 1600x900 mm vs display size 1020x570 mm.
  Detailed Timing Descriptor #5: Mismatch of image size 1600x900 mm vs display size 1020x570 mm.
  Missing VCDB, needed for Set Selectable RGB Quantization to avoid interop issues.
EDID:
  Base EDID: Some timings are out of range of the Monitor Ranges:
    Vertical Freq: 24.000 - 60.317 Hz (Monitor: 48.000 - 62.000 Hz)

EDID conformity: FAIL
