edid-decode (hex):

00 ff ff ff ff ff ff 00 09 e5 12 08 00 00 00 00
1f 1c 01 04 a5 22 13 78 03 09 80 95 5c 5a 91 29
21 50 54 00 00 00 01 01 01 01 01 01 01 01 01 01
01 01 01 01 01 01 03 3a 80 36 71 38 1e 40 30 20
36 00 58 c2 10 00 00 1a 00 00 00 00 00 00 00 00
00 00 00 00 00 00 00 00 00 00 00 00 00 fe 00 42
4f 45 20 43 51 0a 20 20 20 20 20 20 00 00 00 fe
00 4e 54 31 35 36 46 48 4d 2d 4e 36 31 0a 00 ed

----------------

Block 0, Base EDID:
  EDID Structure Version & Revision: 1.4
  Vendor & Product Identification:
    Manufacturer: BOE
    Model: 2066
    Made in: week 31 of 2018
  Basic Display Parameters & Features:
    Digital display
    Bits per primary color channel: 8
    DisplayPort interface
    Maximum image size: 34 cm x 19 cm
    Gamma: 2.20
    Supported color formats: RGB 4:4:4
    First detailed timing includes the native pixel format and preferred refresh rate
    Display is continuous frequency
  Color Characteristics:
    Red  : 0.5820, 0.3593
    Green: 0.3535, 0.5673
    Blue : 0.1621, 0.1289
    White: 0.3125, 0.3281
  Established Timings I & II: none
  Standard Timings: none
  Detailed Timing Descriptors:
    DTD 1:  1920x1080   59.997 Hz  16:9    66.596 kHz 148.510 MHz (344 mm x 194 mm)
                 Hfront   48 Hsync  32 Hback 230 Hpol P
                 Vfront    3 Vsync   6 Vback  21 Vpol N
    Empty Descriptor
    Alphanumeric Data String: 'BOE CQ'
    Alphanumeric Data String: 'NT156FHM-N61'
Checksum: 0xed
