
EDID (hex):
00ffffffffffff00320c011e00000000
00110103802115780ab3409959538d27
25505400000001010101010101010101
010101010101ea1a0078502014301820
44004bcf100000190000000000000000
00000000000000000000000000fe004c
475068696c6970734c43440a000000fe
004c503135345758352d544c4131000a

Extracted contents:
header:          00 ff ff ff ff ff ff 00
serial number:   32 0c 01 1e 00 00 00 00 00 11
version:         01 03
basic params:    80 21 15 78 0a
chroma info:     b3 40 99 59 53 8d 27 25 50 54
established:     00 00 00
standard:        01 01 01 01 01 01 01 01 01 01 01 01 01 01 01 01
descriptor 1:    ea 1a 00 78 50 20 14 30 18 20 44 00 4b cf 10 00 00 19
descriptor 2:    00 00 00 00 00 00 00 00 00 00 00 00 00 00 00 00 00 00
descriptor 3:    00 00 00 fe 00 4c 47 50 68 69 6c 69 70 73 4c 43 44 0a
descriptor 4:    00 00 00 fe 00 4c 50 31 35 34 57 58 35 2d 54 4c 41 31
extensions:      00
checksum:        0a

EDID version: 1.3
Manufacturer: LPL Model 1e01 Serial Number --
Made in year 2007
Digital display
Maximum image size: 33 cm x 21 cm
Gamma: 2.20
RGB color display
First detailed timing is preferred timing
Display x,y Chromaticity:
  Red:   0.5996, 0.3505
  Green: 0.3242, 0.5537
  Blue:  0.1533, 0.1445
  White: 0.3125, 0.3281
Established timings supported:
Standard timings supported:
Detailed mode: Clock 68.900 MHz, 331 mm x 207 mm
               1280 1304 1336 1400 hborder 0
                800  804  808  820 vborder 0
               -hsync -vsync 
               VertFreq: 60 Hz, HorFreq: 49214 Hz
Manufacturer-specified data, tag 0
ASCII string: LGPhilipsLCD
ASCII string: LP154WX5-TLA1
Checksum: 0xa (valid)
EDID block does NOT conform to EDID 1.3!
	Missing name descriptor
	Missing monitor ranges
