edid-decode (hex):

00 ff ff ff ff ff ff 00 0d 05 01 00 71 f1 00 00
17 17 01 03 80 2b 18 78 ee 40 a0 a3 5a 52 a2 26
0e 50 54 00 00 00 01 01 01 01 01 01 01 01 01 01
01 01 01 01 01 01 d5 2d 40 00 62 84 1a 30 18 50
13 00 b0 f0 10 00 00 00 00 00 00 fc 00 41 49 4f
20 4c 43 44 0a 20 20 20 20 20 00 00 00 fc 00 0a
20 20 20 20 20 20 20 20 20 20 20 20 00 00 00 fc
00 0a 20 20 20 20 20 20 20 20 20 20 20 20 00 62

----------------

Block 0, Base EDID:
  EDID Structure Version & Revision: 1.3
  Vendor & Product Identification:
    Manufacturer: CHE
    Model: 1
    Serial Number: ...
    Made in: week 23 of 2013
  Basic Display Parameters & Features:
    Digital display
    Maximum image size: 43 cm x 24 cm
    Gamma: 2.20
    DPMS levels: Standby Suspend Off
    RGB color display
    Default (sRGB) color space is primary color space
    First detailed timing is the preferred timing
  Color Characteristics:
    Red  : 0.6376, 0.3515
    Green: 0.3203, 0.6328
    Blue : 0.1503, 0.0566
    White: 0.3125, 0.3281
  Established Timings I & II: none
  Standard Timings: none
  Detailed Timing Descriptors:
    DTD 1:  1600x900    59.993496 Hz  16:9     55.554 kHz    117.330000 MHz (analog composite, sync-on-green, 432 mm x 240 mm)
                 Hfront   24 Hsync  80 Hback  408 Hpol N
                 Vfront    1 Vsync   3 Vback   22 Vpol N
    Display Product Name: 'AIO LCD'
    Display Product Name: ''
    Display Product Name: ''
Checksum: 0x62

----------------

Failures:

Block 0, Base EDID:
  Basic Display Parameters & Features: sRGB is signaled, but the chromaticities do not match.
  Display Product Name: Empty string.
  Display Product Name: Empty string.
  Missing Display Range Limits Descriptor.

EDID conformity: FAIL
