edid-decode (hex):

00 ff ff ff ff ff ff 00 0d 05 01 00 21 f1 00 00
0d 15 01 03 80 30 1b 78 ee 16 04 a3 54 4f 9e 27
11 50 54 a1 08 00 b3 00 81 c0 a9 c0 d1 c0 81 80
01 01 01 01 01 01 18 38 80 00 71 38 14 40 60 40
84 00 dd 0c 11 00 00 1e 00 00 00 fd 00 32 4b 40
53 12 00 0a 20 20 20 20 20 20 00 00 00 fc 00 41
49 4f 20 4c 43 44 0a 20 20 20 20 20 00 00 00 ff
00 31 0a 20 20 20 20 20 20 20 20 20 20 20 00 14

----------------

Block 0, Base EDID:
  EDID Structure Version & Revision: 1.3
  Vendor & Product Identification:
    Manufacturer: CHE
    Model: 1
    Serial Number: ...
    Made in: week 13 of 2011
  Basic Display Parameters & Features:
    Digital display
    Maximum image size: 48 cm x 27 cm
    Gamma: 2.20
    DPMS levels: Standby Suspend Off
    RGB color display
    Default (sRGB) color space is primary color space
    First detailed timing is the preferred timing
  Color Characteristics:
    Red  : 0.6367, 0.3291
    Green: 0.3095, 0.6191
    Blue : 0.1523, 0.0664
    White: 0.3134, 0.3281
  Established Timings I & II:
    IBM     :   720x400    70.081663 Hz   9:5     31.467 kHz     28.320000 MHz
    DMT 0x04:   640x480    59.940476 Hz   4:3     31.469 kHz     25.175000 MHz
    DMT 0x09:   800x600    60.316541 Hz   4:3     37.879 kHz     40.000000 MHz
    DMT 0x10:  1024x768    60.003840 Hz   4:3     48.363 kHz     65.000000 MHz
  Standard Timings:
    DMT 0x3a:  1680x1050   59.954250 Hz  16:10    65.290 kHz    146.250000 MHz
    DMT 0x55:  1280x720    60.000000 Hz  16:9     45.000 kHz     74.250000 MHz
    DMT 0x53:  1600x900    60.000000 Hz  16:9     60.000 kHz    108.000000 MHz (RB)
    DMT 0x52:  1920x1080   60.000000 Hz  16:9     67.500 kHz    148.500000 MHz
    DMT 0x23:  1280x1024   60.019740 Hz   5:4     63.981 kHz    108.000000 MHz
  Detailed Timing Descriptors:
    DTD 1:  1920x1080   59.993316 Hz  16:9     65.993 kHz    143.600000 MHz (477 mm x 268 mm)
                 Hfront   96 Hsync  64 Hback   96 Hpol P
                 Vfront    8 Vsync   4 Vback    8 Vpol P
    Display Range Limits:
      Monitor ranges (GTF): 50-75 Hz V, 64-83 kHz H, max dotclock 180 MHz
    Display Product Name: 'AIO LCD'
    Display Product Serial Number: ...
Checksum: 0x14

----------------

Failures:

Block 0, Base EDID:
  Basic Display Parameters & Features: sRGB is signaled, but the chromaticities do not match.
EDID:
  Base EDID: Some timings are out of range of the Monitor Ranges:
    Horizontal Freq: 31.466 - 67.500 kHz (Monitor: 64.000 - 83.000 kHz)

EDID conformity: FAIL
