
EDID (hex):
00ffffffffffff0010ac9ca149335630
15200104a53b21783be4a5a6544c9e26
0d5054a54b00714f8180a9c0d1c00101
010101010101565e00a0a0a029503020
350055502100001a000000ff00365431
575134330a2020202020000000fc0044
454c4c20533237323144530a000000fd
00304b73733c010a20202020202001de
020326f150101f200514041312110302
16150706012309070783010000681a00
000101304b00bf1600a0803813403020
3a0055502100001a7e3900a080381f40
30203a0055502100001a023a80187138
2d40582c450055502100001ed97600a0
a0a034503020350055502100001a0000
00000000000000000000000000000086

Extracted contents:
header:          00 ff ff ff ff ff ff 00
serial number:   10 ac 9c a1 49 33 56 30 15 20
version:         01 04
basic params:    a5 3b 21 78 3b
chroma info:     e4 a5 a6 54 4c 9e 26 0d 50 54
established:     a5 4b 00
standard:        71 4f 81 80 a9 c0 d1 c0 01 01 01 01 01 01 01 01
descriptor 1:    56 5e 00 a0 a0 a0 29 50 30 20 35 00 55 50 21 00 00 1a
descriptor 2:    00 00 00 ff 00 36 54 31 57 51 34 33 0a 20 20 20 20 20
descriptor 3:    00 00 00 fc 00 44 45 4c 4c 20 53 32 37 32 31 44 53 0a
descriptor 4:    00 00 00 fd 00 30 4b 73 73 3c 01 0a 20 20 20 20 20 20
extensions:      01
checksum:        de

EDID version: 1.4
Manufacturer: DEL Model a19c Serial Number --
Made in week 21 of 2022
Digital display
8 bits per primary color channel
DisplayPort interface
Maximum image size: 59 cm x 33 cm
Gamma: 2.20
DPMS levels: Off
Supported color formats: RGB 4:4:4, YCrCb 4:4:4, YCrCb 4:2:2
First detailed timing includes the native pixel format and preferred refresh rate
Display is continuous frequency
Display x,y Chromaticity:
  Red:   0.6513, 0.3300
  Green: 0.2978, 0.6171
  Blue:  0.1503, 0.0527
  White: 0.3134, 0.3291
Established timings supported:
  720x400@70Hz 9:5 HorFreq: 31469 Hz Clock: 28.320 MHz
  640x480@60Hz 4:3 HorFreq: 31469 Hz Clock: 25.175 MHz
  640x480@75Hz 4:3 HorFreq: 37500 Hz Clock: 31.500 MHz
  800x600@60Hz 4:3 HorFreq: 37900 Hz Clock: 40.000 MHz
  800x600@75Hz 4:3 HorFreq: 46900 Hz Clock: 49.500 MHz
  1024x768@60Hz 4:3 HorFreq: 48400 Hz Clock: 65.000 MHz
  1024x768@75Hz 4:3 HorFreq: 60000 Hz Clock: 78.750 MHz
  1280x1024@75Hz 5:4 HorFreq: 80000 Hz Clock: 135.000 MHz
Standard timings supported:
  1152x864@75Hz 4:3 HorFreq: 67500 Hz Clock: 108.000 MHz
  1280x1024@60Hz 5:4 HorFreq: 64000 Hz Clock: 108.000 MHz
  1600x900@60Hz 16:9
  1920x1080@60Hz 16:9
Detailed mode: Clock 241.500 MHz, 597 mm x 336 mm
               2560 2608 2640 2720 hborder 0
               1440 1443 1448 1481 vborder 0
               +hsync -vsync 
               VertFreq: 59 Hz, HorFreq: 88786 Hz
Serial number: --
Monitor name: DELL S2721DS
Monitor ranges (bare limits): 48-75Hz V, 115-115kHz H, max dotclock 600MHz
Has 1 extension blocks
Checksum: 0xde (valid)

CTA extension block
Extension version: 3
34 bytes of CTA data
  Video data block
    VIC  16 1920x1080@60Hz 16:9  HorFreq: 67500 Hz Clock: 148.500 MHz
    VIC  31 1920x1080@50Hz 16:9  HorFreq: 56250 Hz Clock: 148.500 MHz
    VIC  32 1920x1080@24Hz 16:9  HorFreq: 27000 Hz Clock: 74.250 MHz
    VIC   5 1920x1080i@60Hz 16:9  HorFreq: 33750 Hz Clock: 74.250 MHz
    VIC  20 1920x1080i@50Hz 16:9  HorFreq: 28125 Hz Clock: 74.250 MHz
    VIC   4 1280x720@60Hz 16:9  HorFreq: 45000 Hz Clock: 74.250 MHz
    VIC  19 1280x720@50Hz 16:9  HorFreq: 37500 Hz Clock: 74.250 MHz
    VIC  18 720x576@50Hz 16:9  HorFreq: 31250 Hz Clock: 27.000 MHz
    VIC  17 720x576@50Hz 4:3  HorFreq: 31250 Hz Clock: 27.000 MHz
    VIC   3 720x480@60Hz 16:9  HorFreq: 31469 Hz Clock: 27.000 MHz
    VIC   2 720x480@60Hz 4:3  HorFreq: 31469 Hz Clock: 27.000 MHz
    VIC  22 1440x576i@50Hz 16:9  HorFreq: 15625 Hz Clock: 27.000 MHz
    VIC  21 1440x576i@50Hz 4:3  HorFreq: 15625 Hz Clock: 27.000 MHz
    VIC   7 1440x480i@60Hz 16:9  HorFreq: 15734 Hz Clock: 27.000 MHz
    VIC   6 1440x480i@60Hz 4:3  HorFreq: 15734 Hz Clock: 27.000 MHz
    VIC   1 640x480@60Hz 4:3  HorFreq: 31469 Hz Clock: 25.175 MHz
  Audio data block
    Linear PCM, max channels 2
      Supported sample rates (kHz): 48 44.1 32
      Supported sample sizes (bits): 24 20 16
  Speaker allocation data block
    Speaker map:
      FL/FR - Front Left/Right
  Vendor-specific data block, OUI 00001a
Underscans PC formats by default
Basic audio support
Supports YCbCr 4:4:4
Supports YCbCr 4:2:2
1 native detailed modes
Detailed mode: Clock 58.230 MHz, 597 mm x 336 mm
               2048 2096 2128 2208 hborder 0
               1080 1083 1093 1099 vborder 0
               +hsync -vsync 
               VertFreq: 23 Hz, HorFreq: 26372 Hz
Detailed mode: Clock 147.180 MHz, 597 mm x 336 mm
               2048 2096 2128 2208 hborder 0
               1080 1083 1093 1111 vborder 0
               +hsync -vsync 
               VertFreq: 59 Hz, HorFreq: 66657 Hz
Detailed mode: Clock 148.500 MHz, 597 mm x 336 mm
               1920 2008 2052 2200 hborder 0
               1080 1084 1089 1125 vborder 0
               +hsync +vsync 
               VertFreq: 60 Hz, HorFreq: 67500 Hz
Detailed mode: Clock 304.250 MHz, 597 mm x 336 mm
               2560 2608 2640 2720 hborder 0
               1440 1443 1448 1492 vborder 0
               +hsync -vsync 
               VertFreq: 74 Hz, HorFreq: 111856 Hz
Checksum: 0x86 (valid)

Warning: One or more of the timings is out of range of the Monitor Ranges:
  Vertical Freq: 23 - 75 Hz
  Horizontal Freq: 15625 - 111856 Hz
  Maximum Clock: 304.250 MHz
EDID block does not conform at all!
	Both the serial number and the serial string are set


