edid-decode (hex):

00 ff ff ff ff ff ff 00 4c a3 48 34 00 00 00 00
00 12 01 03 80 29 17 78 0a 7c d5 a8 53 36 ae 25
13 50 54 00 00 00 01 01 01 01 01 01 01 01 01 01
01 01 01 01 01 01 7a 3a 80 20 71 38 32 40 30 20
26 00 99 e6 10 00 00 19 00 00 00 0f 00 00 00 00
00 00 00 00 00 46 d2 05 32 00 00 00 00 fe 00 53
41 4d 53 55 4e 47 0a 20 20 20 20 20 00 00 00 fe
00 4c 54 4e 31 38 34 48 54 30 34 54 30 31 00 38

----------------

Block 0, Base EDID:
  EDID Structure Version & Revision: 1.3
  Vendor & Product Identification:
    Manufacturer: SEC
    Model: 13384
    Made in: 2008
  Basic Display Parameters & Features:
    Digital display
    Maximum image size: 41 cm x 23 cm
    Gamma: 2.20
    RGB color display
    First detailed timing is the preferred timing
  Color Characteristics:
    Red  : 0.6572, 0.3271
    Green: 0.2138, 0.6796
    Blue : 0.1474, 0.0751
    White: 0.3134, 0.3291
  Established Timings I & II: none
  Standard Timings: none
  Detailed Timing Descriptors:
    DTD 1:  1920x1080   59.999038 Hz  16:9     67.799 kHz    149.700000 MHz (409 mm x 230 mm)
                 Hfront   48 Hsync  32 Hback  208 Hpol N
                 Vfront    2 Vsync   6 Vback   42 Vpol N
    Manufacturer-Specified Display Descriptor (0x0f): 00 0f 00 00 00 00 00 00 00 00 00 46 d2 05 32 00 '...........F..2.'
    Alphanumeric Data String: 'SAMSUNG'
    Alphanumeric Data String: 'LTN184HT04T01'
Checksum: 0x38

----------------

Failures:

Block 0, Base EDID:
  Missing Display Product Name.
  Missing Display Range Limits Descriptor.

EDID conformity: FAIL
