edid-decode (hex):

00 ff ff ff ff ff ff 00 22 f0 58 42 00 00 00 00
01 18 01 04 b5 35 1d 78 fe a2 00 a8 55 4d a3 26
0b 50 54 01 08 00 01 01 01 01 01 01 01 01 01 01
01 01 01 01 01 01 50 d0 00 a0 f0 70 3e 80 30 20
35 00 c4 8f 21 00 00 1a 56 5e 00 9a a0 a0 29 50
30 20 35 00 18 28 21 00 00 00 00 00 00 ff 00 4c
4d 32 33 38 57 52 32 2d 53 50 41 31 00 00 00 fc
00 48 50 20 41 6c 6c 2d 69 6e 2d 4f 6e 65 00 f2

00 ff ff ff ff ff ff 00 22 f0 58 42 00 00 00 00
01 18 01 04 b5 35 1d 78 fe a2 00 a8 55 4d a3 26
0b 50 54 01 08 00 01 01 01 01 01 01 01 01 01 01
01 01 01 01 01 01 50 d0 00 a0 f0 70 3e 80 30 20
35 00 c4 8f 21 00 00 1a 56 5e 00 9a a0 a0 29 50
30 20 35 00 18 28 21 00 00 00 00 00 00 ff 00 4c
4d 32 33 38 57 52 32 2d 53 50 41 31 00 00 00 fc
00 48 50 20 41 6c 6c 2d 69 6e 2d 4f 6e 65 00 f2

----------------

Block 0, Base EDID:
  EDID Structure Version & Revision: 1.4
  Vendor & Product Identification:
    Manufacturer: HWP
    Model: 16984
    Made in: week 1 of 2014
  Basic Display Parameters & Features:
    Digital display
    Bits per primary color channel: 10
    DisplayPort interface
    Maximum image size: 53 cm x 29 cm
    Gamma: 2.20
    DPMS levels: Standby Suspend Off
    Supported color formats: RGB 4:4:4, YCrCb 4:4:4, YCrCb 4:2:2
    Default (sRGB) color space is primary color space
    First detailed timing includes the native pixel format and preferred refresh rate
  Color Characteristics:
    Red  : 0.6582, 0.3339
    Green: 0.3007, 0.6386
    Blue : 0.1484, 0.0429
    White: 0.3125, 0.3281
  Established Timings I & II:
    DMT 0x09:   800x600    60.316541 Hz   4:3     37.879 kHz     40.000000 MHz
    DMT 0x10:  1024x768    60.003840 Hz   4:3     48.363 kHz     65.000000 MHz
  Standard Timings: none
  Detailed Timing Descriptors:
    DTD 1:  3840x2160   60.000000 Hz  16:9    133.320 kHz    533.280000 MHz (708 mm x 399 mm)
                 Hfront   48 Hsync  32 Hback   80 Hpol P
                 Vfront    3 Vsync   5 Vback   54 Vpol N
    DTD 2:  2560x1440   60.083086 Hz  16:9     88.983 kHz    241.500000 MHz (analog composite, sync-on-green, 536 mm x 296 mm)
                 Hfront   48 Hsync  32 Hback   74 Hpol N
                 Vfront    3 Vsync   5 Vback   33 Vpol N
    Display Product Serial Number: ...
    Display Product Name: 'HP All-in-One'
Checksum: 0xf2

----------------

Block 1, Unknown EDID Extension Block 0x00:
  00 ff ff ff ff ff ff 00 22 f0 58 42 00 00 00 00 '........".XB....'
  01 18 01 04 b5 35 1d 78 fe a2 00 a8 55 4d a3 26 '.....5.x....UM.&'
  0b 50 54 01 08 00 01 01 01 01 01 01 01 01 01 01 '.PT.............'
  01 01 01 01 01 01 50 d0 00 a0 f0 70 3e 80 30 20 '......P....p>.0 '
  35 00 c4 8f 21 00 00 1a 56 5e 00 9a a0 a0 29 50 '5...!...V^....)P'
  30 20 35 00 18 28 21 00 00 00 00 00 00 ff 00 4c '0 5..(!........L'
  4d 32 33 38 57 52 32 2d 53 50 41 31 00 00 00 fc 'M238WR2-SPA1....'
  00 48 50 20 41 6c 6c 2d 69 6e 2d 4f 6e 65 00 f2 '.HP All-in-One..'
Checksum: 0xf2

----------------

Failures:

Block 0, Base EDID:
  Basic Display Parameters & Features: sRGB is signaled, but the chromaticities do not match.
  Detailed Timing Descriptor #1: Mismatch of image size 708x399 mm vs display size 530x290 mm.
Block 1, Base EDID:
  Unknown Extension Block.
EDID:
  Base EDID: The DTD max image size is 708x399mm, which is larger than the display size 530.0x290.0mm.
  Base EDID: EDID specified 0 extension block(s), but found 1 extension block(s).

EDID conformity: FAIL
