
EDID (hex):
00ffffffffffff0022f06a2801010101
1c150103803420782efc81a4554d9d25
125054210800814081809500a940b300
d1c001010101283c80a070b023403020
360006442100001a000000fd003b3d18
5011000a202020202020000000fc0048
50205a523234770a20202020000000ff
00434e54313238313159310a2020007d

Extracted contents:
header:          00 ff ff ff ff ff ff 00
serial number:   22 f0 6a 28 01 01 01 01 1c 15
version:         01 03
basic params:    80 34 20 78 2e
chroma info:     fc 81 a4 55 4d 9d 25 12 50 54
established:     21 08 00
standard:        81 40 81 80 95 00 a9 40 b3 00 d1 c0 01 01 01 01
descriptor 1:    28 3c 80 a0 70 b0 23 40 30 20 36 00 06 44 21 00 00 1a
descriptor 2:    00 00 00 fd 00 3b 3d 18 50 11 00 0a 20 20 20 20 20 20
descriptor 3:    00 00 00 fc 00 48 50 20 5a 52 32 34 77 0a 20 20 20 20
descriptor 4:    00 00 00 ff 00 43 4e 54 31 32 38 31 31 59 31 0a 20 20
extensions:      00
checksum:        7d

EDID version: 1.3
Manufacturer: HWP Model 286a Serial Number --
Made in week 28 of 2011
Digital display
Maximum image size: 52 cm x 32 cm
Gamma: 2.20
DPMS levels: Off
RGB color display
Default (sRGB) color space is primary color space
First detailed timing is preferred timing
Display x,y Chromaticity:
  Red:   0.6435, 0.3349
  Green: 0.3037, 0.6132
  Blue:  0.1464, 0.0703
  White: 0.3125, 0.3291
Established timings supported:
  640x480@60Hz 4:3 HorFreq: 31469 Hz Clock: 25.175 MHz
  800x600@60Hz 4:3 HorFreq: 37900 Hz Clock: 40.000 MHz
  1024x768@60Hz 4:3 HorFreq: 48400 Hz Clock: 65.000 MHz
Standard timings supported:
  1280x960@60Hz 4:3 HorFreq: 60000 Hz Clock: 108.000 MHz
  1280x1024@60Hz 5:4 HorFreq: 64000 Hz Clock: 108.000 MHz
  1440x900@60Hz 16:10 HorFreq: 55500 Hz Clock: 88.750 MHz
  1600x1200@60Hz 4:3 HorFreq: 75000 Hz Clock: 162.000 MHz
  1680x1050@60Hz 16:10 HorFreq: 64700 Hz Clock: 119.000 MHz
  1920x1080@60Hz 16:9
Detailed mode: Clock 154.000 MHz, 518 mm x 324 mm
               1920 1968 2000 2080 hborder 0
               1200 1203 1209 1235 vborder 0
               +hsync -vsync 
               VertFreq: 59 Hz, HorFreq: 74038 Hz
Monitor ranges (GTF): 59-61Hz V, 24-80kHz H, max dotclock 170MHz
Monitor name: HP ZR24w
Serial number: --
Checksum: 0x7d (valid)
EDID block does NOT conform to EDID 1.3!
	sRGB is signaled, but the chromaticities do not match
