edid-decode (hex):

00 ff ff ff ff ff ff 00 1e 6d 3e 4b 34 12 06 00
03 11 01 04 a5 22 1b 78 e2 32 31 a3 57 4c 9d 25
11 50 54 a5 6b 80 31 4f 45 4f 61 4f 81 80 01 01
01 01 01 01 01 01 30 2a 00 98 51 00 2a 40 30 70
13 00 52 0e 11 00 00 1e 00 00 00 fd 00 38 4b 1e
53 0e 00 0a 20 20 20 20 20 20 00 00 00 fc 00 4c
31 39 35 33 53 0a 20 20 20 20 20 20 00 00 00 fc
00 0a 20 20 20 20 20 20 20 20 20 20 20 20 00 5f

00 ff ff ff ff ff ff 00 1e 6d 3e 4b 34 12 06 00
03 11 01 04 a5 22 1b 78 e2 32 31 a3 57 4c 9d 25
11 50 54 a5 6b 80 31 4f 45 4f 61 4f 81 80 01 01
01 01 01 01 01 01 30 2a 00 98 51 00 2a 40 30 70
13 00 52 0e 11 00 00 1e 00 00 00 fd 00 38 4b 1e
53 0e 00 0a 20 20 20 20 20 20 00 00 00 fc 00 4c
31 39 35 33 53 0a 20 20 20 20 20 20 00 00 00 fc
00 0a 20 20 20 20 20 20 20 20 20 20 20 20 00 5f

----------------

Block 0, Base EDID:
  EDID Structure Version & Revision: 1.4
  Vendor & Product Identification:
    Manufacturer: GSM
    Model: 19262
    Serial Number: ...
    Made in: week 3 of 2007
  Basic Display Parameters & Features:
    Digital display
    Bits per primary color channel: 8
    DisplayPort interface
    Maximum image size: 34 cm x 27 cm
    Gamma: 2.20
    DPMS levels: Standby Suspend Off
    Supported color formats: RGB 4:4:4
    First detailed timing includes the native pixel format and preferred refresh rate
  Color Characteristics:
    Red  : 0.6367, 0.3427
    Green: 0.2968, 0.6152
    Blue : 0.1445, 0.0693
    White: 0.3125, 0.3291
  Established Timings I & II:
    IBM     :   720x400    70.081663 Hz   9:5     31.467 kHz     28.320000 MHz
    DMT 0x04:   640x480    59.940476 Hz   4:3     31.469 kHz     25.175000 MHz
    DMT 0x06:   640x480    75.000000 Hz   4:3     37.500 kHz     31.500000 MHz
    DMT 0x09:   800x600    60.316541 Hz   4:3     37.879 kHz     40.000000 MHz
    DMT 0x0b:   800x600    75.000000 Hz   4:3     46.875 kHz     49.500000 MHz
    Apple   :   832x624    74.551266 Hz   4:3     49.726 kHz     57.284000 MHz
    DMT 0x10:  1024x768    60.003840 Hz   4:3     48.363 kHz     65.000000 MHz
    DMT 0x12:  1024x768    75.028582 Hz   4:3     60.023 kHz     78.750000 MHz
    DMT 0x24:  1280x1024   75.024675 Hz   5:4     79.976 kHz    135.000000 MHz
    Apple   :  1152x870    75.061550 Hz 192:145   68.681 kHz    100.000000 MHz
  Standard Timings:
    DMT 0x06:   640x480    75.000000 Hz   4:3     37.500 kHz     31.500000 MHz
    DMT 0x0b:   800x600    75.000000 Hz   4:3     46.875 kHz     49.500000 MHz
    DMT 0x12:  1024x768    75.028582 Hz   4:3     60.023 kHz     78.750000 MHz
    DMT 0x23:  1280x1024   60.019740 Hz   5:4     63.981 kHz    108.000000 MHz
  Detailed Timing Descriptors:
    DTD 1:  1280x1024   60.019740 Hz   5:4     63.981 kHz    108.000000 MHz (338 mm x 270 mm)
                 Hfront   48 Hsync 112 Hback  248 Hpol P
                 Vfront    1 Vsync   3 Vback   38 Vpol P
    Display Range Limits:
      Monitor ranges (GTF): 56-75 Hz V, 30-83 kHz H, max dotclock 140 MHz
    Display Product Name: 'L1953S'
    Display Product Name: ''
Checksum: 0x5f

----------------

Block 1, Unknown EDID Extension Block 0x00:
  00 ff ff ff ff ff ff 00 1e 6d 3e 4b 34 12 06 00 '.........m>K4...'
  03 11 01 04 a5 22 1b 78 e2 32 31 a3 57 4c 9d 25 '.....".x.21.WL.%'
  11 50 54 a5 6b 80 31 4f 45 4f 61 4f 81 80 01 01 '.PT.k.1OEOaO....'
  01 01 01 01 01 01 30 2a 00 98 51 00 2a 40 30 70 '......0*..Q.*@0p'
  13 00 52 0e 11 00 00 1e 00 00 00 fd 00 38 4b 1e '..R..........8K.'
  53 0e 00 0a 20 20 20 20 20 20 00 00 00 fc 00 4c 'S...      .....L'
  31 39 35 33 53 0a 20 20 20 20 20 20 00 00 00 fc '1953S.      ....'
  00 0a 20 20 20 20 20 20 20 20 20 20 20 20 00 5f '..            ._'
Checksum: 0x5f

----------------

Warnings:

Block 0, Base EDID:
  Display Range Limits: GTF support is deprecated in EDID 1.4.

Failures:

Block 0, Base EDID:
  Display Range Limits: GTF can't be combined with non-continuous frequencies.
  Display Product Name: Empty string.
Block 1, Base EDID:
  Unknown Extension Block.
EDID:
  Base EDID: EDID specified 0 extension block(s), but found 1 extension block(s).

EDID conformity: FAIL
