edid-decode (hex):

00 ff ff ff ff ff ff 00 41 0c 00 68 c4 22 00 00
28 06 01 00 2c 1e 17 c8 e8 9d 12 a2 55 47 98 27
10 48 4f 37 7e 00 00 00 00 00 00 00 00 00 00 00
00 00 00 00 00 00 1f 2a 00 94 51 00 2b 40 50 6c
15 00 2c e1 10 00 00 00 d5 09 80 a0 20 90 32 10
10 60 d2 00 2c e1 10 00 00 1c 00 00 00 00 00 00
00 00 00 00 00 00 00 00 00 00 00 00 00 00 00 00
00 00 00 00 00 00 00 00 00 00 00 00 00 00 00 31

----------------

Block 0, Base EDID:
  EDID Structure Version & Revision: 1.0
  Vendor & Product Identification:
    Manufacturer: PHL
    Model: 26624
    Serial Number: ...
    Made in: week 40 of 1996
  Basic Display Parameters & Features:
    Analog display
    Input voltage level: 0.714/0.286 V
    Blank level equals black level
    Sync: Separate Composite
    Maximum image size: 30 cm x 23 cm
    Gamma: 3.00
    DPMS levels: Standby Suspend Off
    RGB color display
  Color Characteristics:
    Red  : 0.6347, 0.3330
    Green: 0.2802, 0.5947
    Blue : 0.1523, 0.0634
    White: 0.2812, 0.3105
  Established Timings I & II:
    DMT 0x04:   640x480    59.940476 Hz   4:3     31.469 kHz     25.175000 MHz
    Apple   :   640x480    66.666667 Hz   4:3     35.000 kHz     30.240000 MHz
    DMT 0x06:   640x480    75.000000 Hz   4:3     37.500 kHz     31.500000 MHz
    DMT 0x08:   800x600    56.250000 Hz   4:3     35.156 kHz     36.000000 MHz
    DMT 0x09:   800x600    60.316541 Hz   4:3     37.879 kHz     40.000000 MHz
    DMT 0x0b:   800x600    75.000000 Hz   4:3     46.875 kHz     49.500000 MHz
    Apple   :   832x624    74.551266 Hz   4:3     49.726 kHz     57.284000 MHz
    DMT 0x0f:  1024x768i   86.957532 Hz   4:3     35.522 kHz     44.900000 MHz
    DMT 0x10:  1024x768    60.003840 Hz   4:3     48.363 kHz     65.000000 MHz
    DMT 0x11:  1024x768    70.069359 Hz   4:3     56.476 kHz     75.000000 MHz
    DMT 0x12:  1024x768    75.028582 Hz   4:3     60.023 kHz     78.750000 MHz
  Standard Timings:
  Detailed Timing Descriptors:
    DTD 1:  1280x1024   60.011309 Hz   5:4     64.032 kHz    107.830000 MHz (analog composite, sync-on-green, 300 mm x 225 mm)
                 Hfront   80 Hsync 108 Hback  216 Hpol N
                 Vfront    1 Vsync   5 Vback   37 Vpol N
    DTD 2:   640x400    69.916667 Hz   8:5     31.462 kHz     25.170000 MHz (300 mm x 225 mm)
                 Hfront   16 Hsync  96 Hback   48 Hpol N
                 Vfront   13 Vsync   2 Vback   35 Vpol P
    Empty Descriptor
    Empty Descriptor
Checksum: 0x31

----------------

Warnings:

Block 0, Base EDID:
  EDID Structure Version & Revision: EDID 1.0 is deprecated, do not use.

Failures:

Block 0, Base EDID:
  Standard Timings: Use 0x0101 as the invalid Standard Timings code, not 0x0000.
  Standard Timings: Use 0x0101 as the invalid Standard Timings code, not 0x0000.
  Standard Timings: Use 0x0101 as the invalid Standard Timings code, not 0x0000.
  Standard Timings: Use 0x0101 as the invalid Standard Timings code, not 0x0000.
  Standard Timings: Use 0x0101 as the invalid Standard Timings code, not 0x0000.
  Standard Timings: Use 0x0101 as the invalid Standard Timings code, not 0x0000.
  Standard Timings: Use 0x0101 as the invalid Standard Timings code, not 0x0000.
  Standard Timings: Use 0x0101 as the invalid Standard Timings code, not 0x0000.
  Display Descriptor #3: Has descriptor blocks other than detailed timings.
  Empty Descriptor: Use Dummy Descriptor instead of all zeroes.
  Display Descriptor #4: Has descriptor blocks other than detailed timings.
  Empty Descriptor: Use Dummy Descriptor instead of all zeroes.

EDID conformity: FAIL
