
EDID (hex):
00ffffffffffff0030e4200300000000
00150103802213780a5ea59558578f28
1d505400000001010101010101010101
010101010101581b567e50000e302430
350058c2100000190000000000000000
00000000000000000000000000fe004c
4720446973706c61790a2020000000fe
004c503135365748352d544a413100f7

Extracted contents:
header:          00 ff ff ff ff ff ff 00
serial number:   30 e4 20 03 00 00 00 00 00 15
version:         01 03
basic params:    80 22 13 78 0a
chroma info:     5e a5 95 58 57 8f 28 1d 50 54
established:     00 00 00
standard:        01 01 01 01 01 01 01 01 01 01 01 01 01 01 01 01
descriptor 1:    58 1b 56 7e 50 00 0e 30 24 30 35 00 58 c2 10 00 00 19
descriptor 2:    00 00 00 00 00 00 00 00 00 00 00 00 00 00 00 00 00 00
descriptor 3:    00 00 00 fe 00 4c 47 20 44 69 73 70 6c 61 79 0a 20 20
descriptor 4:    00 00 00 fe 00 4c 50 31 35 36 57 48 35 2d 54 4a 41 31
extensions:      00
checksum:        f7

EDID version: 1.3
Manufacturer: LGD Model 320 Serial Number --
Made in year 2011
Digital display
Maximum image size: 34 cm x 19 cm
Gamma: 2.20
RGB color display
First detailed timing is preferred timing
Display x,y Chromaticity:
  Red:   0.5830, 0.3447
  Green: 0.3427, 0.5605
  Blue:  0.1582, 0.1152
  White: 0.3134, 0.3291
Established timings supported:
Standard timings supported:
Detailed mode: Clock 70.000 MHz, 344 mm x 194 mm
               1366 1402 1450 1492 hborder 0
                768  771  776  782 vborder 0
               -hsync -vsync 
               VertFreq: 59 Hz, HorFreq: 46916 Hz
Manufacturer-specified data, tag 0
ASCII string: LG Display
ASCII string: LP156WH5-TJA1
Checksum: 0xf7 (valid)
EDID block does NOT conform to EDID 1.3!
	Missing name descriptor
	Missing monitor ranges
