edid-decode (hex):

00 ff ff ff ff ff ff 00 06 af 2d 55 00 00 00 00
00 1b 01 04 95 1d 11 78 02 a4 15 9e 55 4e 9b 26
0f 50 54 00 00 00 01 01 01 01 01 01 01 01 01 01
01 01 01 01 01 01 b4 37 80 a0 70 38 3e 40 3a 2a
35 00 25 a5 10 00 00 18 b4 37 80 a0 70 38 7a 42
3a 2a 35 00 25 a5 10 00 00 18 00 00 00 00 00 00
00 00 00 00 00 00 00 00 00 00 00 00 00 00 00 02
00 10 36 ff 0f 3c 96 4e 0c 1f 96 20 20 20 00 a7

----------------

Block 0, Base EDID:
  EDID Structure Version & Revision: 1.4
  Vendor & Product Identification:
    Manufacturer: AUO
    Model: 21805
    Made in: 2017
  Basic Display Parameters & Features:
    Digital display
    Bits per primary color channel: 6
    DisplayPort interface
    Maximum image size: 29 cm x 17 cm
    Gamma: 2.20
    Supported color formats: RGB 4:4:4
    First detailed timing includes the native pixel format and preferred refresh rate
  Color Characteristics:
    Red  : 0.6191, 0.3339
    Green: 0.3056, 0.6054
    Blue : 0.1484, 0.0595
    White: 0.3134, 0.3291
  Established Timings I & II: none
  Standard Timings: none
  Detailed Timing Descriptors:
    DTD 1:  1920x1080   60.033006 Hz  16:9     68.558 kHz    142.600000 MHz (293 mm x 165 mm)
                 Hfront   58 Hsync  42 Hback   60 Hpol N
                 Vfront    3 Vsync   5 Vback   54 Vpol N
    DTD 2:  1920x1080   39.998654 Hz  16:9     68.558 kHz    142.600000 MHz (293 mm x 165 mm)
                 Hfront   58 Hsync  42 Hback   60 Hpol N
                 Vfront    3 Vsync   5 Vback  626 Vpol N
    Empty Descriptor
    Manufacturer-Specified Display Descriptor (0x02): 00 02 00 10 36 ff 0f 3c 96 4e 0c 1f 96 20 20 20 '....6..<.N...   '
Checksum: 0xa7

----------------

Warnings:

Block 0, Base EDID:
  Missing Display Product Name.

Failures:

Block 0, Base EDID:
  Empty Descriptor: Use Dummy Descriptor instead of all zeroes.

EDID conformity: FAIL
