
EDID (hex):
00ffffffffffff0009e5680800000000
031d0104951f11780328659759548e27
1e505400000001010101010101010101
010101010101c23780cc703828403020
360035ae1000001a2c2580cc70382840
3020360035ae1000001a000000000000
00000000000000000000000000000002
000d40ff0a3c7d1611217d00000000ed

Extracted contents:
header:          00 ff ff ff ff ff ff 00
serial number:   09 e5 68 08 00 00 00 00 03 1d
version:         01 04
basic params:    95 1f 11 78 03
chroma info:     28 65 97 59 54 8e 27 1e 50 54
established:     00 00 00
standard:        01 01 01 01 01 01 01 01 01 01 01 01 01 01 01 01
descriptor 1:    c2 37 80 cc 70 38 28 40 30 20 36 00 35 ae 10 00 00 1a
descriptor 2:    2c 25 80 cc 70 38 28 40 30 20 36 00 35 ae 10 00 00 1a
descriptor 3:    00 00 00 00 00 00 00 00 00 00 00 00 00 00 00 00 00 00
descriptor 4:    00 00 00 02 00 0d 40 ff 0a 3c 7d 16 11 21 7d 00 00 00
extensions:      00
checksum:        ed

EDID version: 1.4
Manufacturer: BOE Model 868 Serial Number --
Made in week 3 of 2019
Digital display
6 bits per primary color channel
DisplayPort interface
Maximum image size: 31 cm x 17 cm
Gamma: 2.20
Supported color formats: RGB 4:4:4
First detailed timing includes the native pixel format and preferred refresh rate
Display is continuous frequency
Display x,y Chromaticity:
  Red:   0.5898, 0.3496
  Green: 0.3300, 0.5546
  Blue:  0.1533, 0.1191
  White: 0.3134, 0.3291
Established timings supported:
Standard timings supported:
Detailed mode: Clock 142.740 MHz, 309 mm x 174 mm
               1920 1968 2000 2124 hborder 0
               1080 1083 1089 1120 vborder 0
               +hsync -vsync 
               VertFreq: 60 Hz, HorFreq: 67203 Hz
Detailed mode: Clock 95.160 MHz, 309 mm x 174 mm
               1920 1968 2000 2124 hborder 0
               1080 1083 1089 1120 vborder 0
               +hsync -vsync 
               VertFreq: 40 Hz, HorFreq: 44802 Hz
Manufacturer-specified data, tag 0
Manufacturer-specified data, tag 2
Checksum: 0xed (valid)
EDID block does NOT conform to EDID 1.4!
	Missing name descriptor
	Missing monitor ranges
