
EDID (hex):
00ffffffffffff0004722013b4013021
0d160103800000788aa1c8a2595c8f23
16505cbfcf80317c457c617c81c08180
81009500a9409e20009051201f304880
360000000000001c000000fd0032781f
6411000a202020202020000000fc0050
31333230570a202020202020000000fe
0032313330303142340a20202020015a
020320f14d0102038405071011131415
1f20230907078301000065030c001000
8c0ad08a20e02d10103e9600138e2100
0018011d00bc52d01e20b8285540c48e
2100001e011d80d0721c1620102c2580
c48e2100009e8c0ad090204031200c40
5500138e210000188c0ad09020403120
0c405500c48e210000180000000000e5

Extracted contents:
header:          00 ff ff ff ff ff ff 00
serial number:   04 72 20 13 b4 01 30 21 0d 16
version:         01 03
basic params:    80 00 00 78 8a
chroma info:     a1 c8 a2 59 5c 8f 23 16 50 5c
established:     bf cf 80
standard:        31 7c 45 7c 61 7c 81 c0 81 80 81 00 95 00 a9 40
descriptor 1:    9e 20 00 90 51 20 1f 30 48 80 36 00 00 00 00 00 00 1c
descriptor 2:    00 00 00 fd 00 32 78 1f 64 11 00 0a 20 20 20 20 20 20
descriptor 3:    00 00 00 fc 00 50 31 33 32 30 57 0a 20 20 20 20 20 20
descriptor 4:    00 00 00 fe 00 32 31 33 30 30 31 42 34 0a 20 20 20 20
extensions:      01
checksum:        5a

EDID version: 1.3
Manufacturer: ACR Model 1320 Serial Number --
Made in week 13 of 2012
Digital display
Image size is variable
Gamma: 2.20
DPMS levels: Standby
RGB color display
First detailed timing is preferred timing
Display x,y Chromaticity:
  Red:   0.6347, 0.3496
  Green: 0.3593, 0.5595
  Blue:  0.1396, 0.0859
  White: 0.3144, 0.3593
Established timings supported:
  720x400@70Hz 9:5 HorFreq: 31469 Hz Clock: 28.320 MHz
  640x480@60Hz 4:3 HorFreq: 31469 Hz Clock: 25.175 MHz
  640x480@67Hz 4:3 HorFreq: 35000 Hz Clock: 30.240 MHz
  640x480@72Hz 4:3 HorFreq: 37900 Hz Clock: 31.500 MHz
  640x480@75Hz 4:3 HorFreq: 37500 Hz Clock: 31.500 MHz
  800x600@56Hz 4:3 HorFreq: 35200 Hz Clock: 36.000 MHz
  800x600@60Hz 4:3 HorFreq: 37900 Hz Clock: 40.000 MHz
  800x600@72Hz 4:3 HorFreq: 48100 Hz Clock: 50.000 MHz
  800x600@75Hz 4:3 HorFreq: 46900 Hz Clock: 49.500 MHz
  1024x768@60Hz 4:3 HorFreq: 48400 Hz Clock: 65.000 MHz
  1024x768@70Hz 4:3 HorFreq: 56500 Hz Clock: 75.000 MHz
  1024x768@75Hz 4:3 HorFreq: 60000 Hz Clock: 78.750 MHz
  1280x1024@75Hz 5:4 HorFreq: 80000 Hz Clock: 135.000 MHz
  1152x870@75Hz 192:145 HorFreq: 67500 Hz Clock: 108.000 MHz
Standard timings supported:
  640x480@120Hz 4:3
  800x600@120Hz 4:3
  1024x768@120Hz 4:3
  1280x720@60Hz 16:9
  1280x1024@60Hz 5:4 HorFreq: 64000 Hz Clock: 108.000 MHz
  1280x800@60Hz 16:10
  1440x900@60Hz 16:10 HorFreq: 55500 Hz Clock: 88.750 MHz
  1600x1200@60Hz 4:3 HorFreq: 75000 Hz Clock: 162.000 MHz
Detailed mode: Clock 83.500 MHz, 0 mm x 0 mm
               1280 1352 1480 1680 hborder 0
                800  803  809  831 vborder 0
               -hsync +vsync 
               VertFreq: 59 Hz, HorFreq: 49702 Hz
Monitor ranges (GTF): 50-120Hz V, 31-100kHz H, max dotclock 170MHz
Monitor name: P1320W
ASCII string: 213001B4
Has 1 extension blocks
Checksum: 0x5a (valid)

CTA extension block
Extension version: 3
28 bytes of CTA data
  Video data block
    VIC   1 640x480@60Hz 4:3  HorFreq: 31469 Hz Clock: 25.175 MHz
    VIC   2 720x480@60Hz 4:3  HorFreq: 31469 Hz Clock: 27.000 MHz
    VIC   3 720x480@60Hz 16:9  HorFreq: 31469 Hz Clock: 27.000 MHz
    VIC   4 1280x720@60Hz 16:9 (native) HorFreq: 45000 Hz Clock: 74.250 MHz
    VIC   5 1920x1080i@60Hz 16:9  HorFreq: 33750 Hz Clock: 74.250 MHz
    VIC   7 1440x480i@60Hz 16:9  HorFreq: 15734 Hz Clock: 27.000 MHz
    VIC  16 1920x1080@60Hz 16:9  HorFreq: 67500 Hz Clock: 148.500 MHz
    VIC  17 720x576@50Hz 4:3  HorFreq: 31250 Hz Clock: 27.000 MHz
    VIC  19 1280x720@50Hz 16:9  HorFreq: 37500 Hz Clock: 74.250 MHz
    VIC  20 1920x1080i@50Hz 16:9  HorFreq: 28125 Hz Clock: 74.250 MHz
    VIC  21 1440x576i@50Hz 4:3  HorFreq: 15625 Hz Clock: 27.000 MHz
    VIC  31 1920x1080@50Hz 16:9  HorFreq: 56250 Hz Clock: 148.500 MHz
    VIC  32 1920x1080@24Hz 16:9  HorFreq: 27000 Hz Clock: 74.250 MHz
  Audio data block
    Linear PCM, max channels 2
      Supported sample rates (kHz): 48 44.1 32
      Supported sample sizes (bits): 24 20 16
  Speaker allocation data block
    Speaker map:
      FL/FR - Front Left/Right
  Vendor-specific data block, OUI 000c03 (HDMI)
    Source physical address 1.0.0.0
Underscans PC formats by default
Basic audio support
Supports YCbCr 4:4:4
Supports YCbCr 4:2:2
1 native detailed modes
Detailed mode: Clock 27.000 MHz, 531 mm x 398 mm
                720  736  798  858 hborder 0
                480  489  495  525 vborder 0
               -hsync -vsync 
               VertFreq: 59 Hz, HorFreq: 31468 Hz
Detailed mode: Clock 74.250 MHz, 708 mm x 398 mm
               1280 1720 1760 1980 hborder 0
                720  725  730  750 vborder 0
               +hsync +vsync 
               VertFreq: 50 Hz, HorFreq: 37500 Hz
Detailed mode: Clock 74.250 MHz, 708 mm x 398 mm
               1920 2448 2492 2640 hborder 0
                540  542  547  562 vborder 0
               +hsync +vsync interlaced 
               VertFreq: 50 Hz, HorFreq: 28125 Hz
Detailed mode: Clock 27.000 MHz, 531 mm x 398 mm
                720  732  796  864 hborder 0
                576  581  586  625 vborder 0
               -hsync -vsync 
               VertFreq: 50 Hz, HorFreq: 31250 Hz
Detailed mode: Clock 27.000 MHz, 708 mm x 398 mm
                720  732  796  864 hborder 0
                576  581  586  625 vborder 0
               -hsync -vsync 
               VertFreq: 50 Hz, HorFreq: 31250 Hz
Checksum: 0xe5 (valid)

One or more of the timings is out of range of the Monitor Ranges:
  Vertical Freq: 24 - 120 Hz
  Horizontal Freq: 15625 - 80000 Hz
  Maximum Clock: 162.000 MHz
