edid-decode (hex):

00 ff ff ff ff ff ff 00 32 0c 00 df 00 00 00 00
00 12 01 03 80 21 15 78 0a e9 d5 99 59 53 8e 28
26 50 54 00 00 00 01 01 01 01 01 01 01 01 01 01
01 01 01 01 01 01 de 21 a0 70 50 84 1f 30 20 20
56 00 4b cf 10 00 00 18 de 21 a0 70 50 84 1f 30
20 20 56 00 4b cf 10 00 00 00 00 00 00 fe 00 57
36 35 37 47 00 31 35 34 57 50 31 0a 00 00 00 fe
00 23 33 3d 48 65 84 aa ff 02 01 0a 20 20 00 9a

----------------

Block 0, Base EDID:
  EDID Structure Version & Revision: 1.3
  Vendor & Product Identification:
    Manufacturer: LPL
    Model: 57088
    Made in: 2008
  Basic Display Parameters & Features:
    Digital display
    Maximum image size: 33 cm x 21 cm
    Gamma: 2.20
    RGB color display
    First detailed timing is the preferred timing
  Color Characteristics:
    Red  : 0.6005, 0.3496
    Green: 0.3261, 0.5556
    Blue : 0.1591, 0.1494
    White: 0.3134, 0.3291
  Established Timings I & II: none
  Standard Timings: none
  Detailed Timing Descriptors:
    DTD 1:  1440x900    60.003654 Hz  16:10    55.863 kHz     86.700000 MHz (331 mm x 207 mm)
                 Hfront   32 Hsync  32 Hback   48 Hpol N
                 Vfront    5 Vsync   6 Vback   20 Vpol N
    DTD 2:  1440x900    60.003654 Hz  16:10    55.863 kHz     86.700000 MHz (331 mm x 207 mm)
                 Hfront   32 Hsync  32 Hback   48 Hpol N
                 Vfront    5 Vsync   6 Vback   20 Vpol N
    SPWG Module Revision: 0
    SPWG Descriptor #3:
      SPWG PC Maker P/N: 'W657G'
      SPWG LCD Supplier EEDID Revision: 0
      SPWG Manufacturer P/N: '154WP1'
    SPWG Descriptor #4:
      SMBUS Values: 0x23 0x33 0x3d 0x48 0x65 0x84 0xaa 0xff
      LVDS Channels: 2
      Panel Self Test Present
Checksum: 0x9a

----------------

Failures:

Block 0, Base EDID:
  Missing Display Product Name.
  Missing Display Range Limits Descriptor.

EDID conformity: FAIL
