
EDID (hex):
00ffffffffffff00047295ad31817071
1111010308261e782ae5c5a4564a9c23
125054bfef808bc09500950f81808140
81c0714f614f6b35a0f051842a306098
3600782d1100001c000000fd00384b1f
500e0a0a202020202020000000fc0058
313931570a20202020202020000000ff
004c393530423231313339323420000e

Extracted contents:
header:          00 ff ff ff ff ff ff 00
serial number:   04 72 95 ad 31 81 70 71 11 11
version:         01 03
basic params:    08 26 1e 78 2a
chroma info:     e5 c5 a4 56 4a 9c 23 12 50 54
established:     bf ef 80
standard:        8b c0 95 00 95 0f 81 80 81 40 81 c0 71 4f 61 4f
descriptor 1:    6b 35 a0 f0 51 84 2a 30 60 98 36 00 78 2d 11 00 00 1c
descriptor 2:    00 00 00 fd 00 38 4b 1f 50 0e 0a 0a 20 20 20 20 20 20
descriptor 3:    00 00 00 fc 00 58 31 39 31 57 0a 20 20 20 20 20 20 20
descriptor 4:    00 00 00 ff 00 4c 39 35 30 42 32 31 31 33 39 32 34 20
extensions:      00
checksum:        0e

EDID version: 1.3
Manufacturer: ACR Model ad95 Serial Number --
Made in week 17 of 2007
Analog display, Input voltage level: 0.7/0.3 V
Sync: Separate 
Maximum image size: 38 cm x 30 cm
Gamma: 2.20
DPMS levels: Off
RGB color display
First detailed timing is preferred timing
Display x,y Chromaticity:
  Red:   0.6435, 0.3378
  Green: 0.2900, 0.6103
  Blue:  0.1396, 0.0703
  White: 0.3134, 0.3291
Established timings supported:
  720x400@70Hz 9:5 HorFreq: 31469 Hz Clock: 28.320 MHz
  640x480@60Hz 4:3 HorFreq: 31469 Hz Clock: 25.175 MHz
  640x480@67Hz 4:3 HorFreq: 35000 Hz Clock: 30.240 MHz
  640x480@72Hz 4:3 HorFreq: 37900 Hz Clock: 31.500 MHz
  640x480@75Hz 4:3 HorFreq: 37500 Hz Clock: 31.500 MHz
  800x600@56Hz 4:3 HorFreq: 35200 Hz Clock: 36.000 MHz
  800x600@60Hz 4:3 HorFreq: 37900 Hz Clock: 40.000 MHz
  800x600@72Hz 4:3 HorFreq: 48100 Hz Clock: 50.000 MHz
  800x600@75Hz 4:3 HorFreq: 46900 Hz Clock: 49.500 MHz
  832x624@75Hz 4:3 HorFreq: 49726 Hz Clock: 57.284 MHz
  1024x768@60Hz 4:3 HorFreq: 48400 Hz Clock: 65.000 MHz
  1024x768@70Hz 4:3 HorFreq: 56500 Hz Clock: 75.000 MHz
  1024x768@75Hz 4:3 HorFreq: 60000 Hz Clock: 78.750 MHz
  1280x1024@75Hz 5:4 HorFreq: 80000 Hz Clock: 135.000 MHz
  1152x870@75Hz 192:145 HorFreq: 67500 Hz Clock: 108.000 MHz
Standard timings supported:
  1360x765@60Hz 16:9
  1440x900@60Hz 16:10 HorFreq: 55500 Hz Clock: 88.750 MHz
  1440x900@75Hz 16:10 HorFreq: 82300 Hz Clock: 156.000 MHz
  1280x1024@60Hz 5:4 HorFreq: 64000 Hz Clock: 108.000 MHz
  1280x960@60Hz 4:3 HorFreq: 60000 Hz Clock: 108.000 MHz
  1280x720@60Hz 16:9
  1152x864@75Hz 4:3 HorFreq: 67500 Hz Clock: 108.000 MHz
  1024x768@75Hz 4:3 HorFreq: 60000 Hz Clock: 78.750 MHz
Detailed mode: Clock 136.750 MHz, 376 mm x 301 mm
               1440 1536 1688 1936 hborder 0
                900  903  909  942 vborder 0
               -hsync +vsync 
               VertFreq: 74 Hz, HorFreq: 70635 Hz
Monitor ranges (invalid): 56-75Hz V, 31-80kHz H, max dotclock 140MHz
Monitor name: X191W
Serial number: -- 
Checksum: 0xe (valid)
EDID block does not conform at all!
	Detailed blocks filled with garbage
	Range descriptor contains garbage
