edid-decode (hex):

00 ff ff ff ff ff ff 00 30 ae c9 60 01 01 01 01
34 19 01 03 6c 34 20 78 2e 4c a5 a7 55 4d a2 26
10 50 54 bd cf 00 d1 c0 81 00 81 80 95 00 a9 40
b3 00 01 01 01 01 28 3c 80 a0 70 b0 23 40 30 20
36 00 06 44 21 00 00 1a 1a 36 80 a0 70 38 1f 40
30 20 35 00 06 44 21 00 00 1a 00 00 00 fd 00 32
4b 1e 53 15 00 0a 20 20 20 20 20 20 00 00 00 fc
00 4c 45 4e 20 54 32 34 35 34 70 41 0a 20 00 64

00 ff ff ff ff ff ff 00 30 ae c9 60 01 01 01 01
34 19 01 03 6c 34 20 78 2e 4c a5 a7 55 4d a2 26
10 50 54 bd cf 00 d1 c0 81 00 81 80 95 00 a9 40
b3 00 01 01 01 01 28 3c 80 a0 70 b0 23 40 30 20
36 00 06 44 21 00 00 1a 1a 36 80 a0 70 38 1f 40
30 20 35 00 06 44 21 00 00 1a 00 00 00 fd 00 32
4b 1e 53 15 00 0a 20 20 20 20 20 20 00 00 00 fc
00 4c 45 4e 20 54 32 34 35 34 70 41 0a 20 00 64

----------------

Block 0, Base EDID:
  EDID Structure Version & Revision: 1.3
  Vendor & Product Identification:
    Manufacturer: LEN
    Model: 24777
    Serial Number: ...
    Made in: week 52 of 2015
  Basic Display Parameters & Features:
    Analog display
    Signal Level Standard: 0.700 : 0.000 : 0.700 V p-p
    Blank level equals black level
    Sync: Separate Composite
    Maximum image size: 52 cm x 32 cm
    Gamma: 2.20
    DPMS levels: Off
    RGB color display
    Default (sRGB) color space is primary color space
    First detailed timing is the preferred timing
  Color Characteristics:
    Red  : 0.6533, 0.3320
    Green: 0.3037, 0.6328
    Blue : 0.1503, 0.0644
    White: 0.3134, 0.3291
  Established Timings I & II:
    IBM     :   720x400    70.081663 Hz   9:5     31.467 kHz     28.320000 MHz
    DMT 0x04:   640x480    59.940476 Hz   4:3     31.469 kHz     25.175000 MHz
    Apple   :   640x480    66.666667 Hz   4:3     35.000 kHz     30.240000 MHz
    DMT 0x05:   640x480    72.808802 Hz   4:3     37.861 kHz     31.500000 MHz
    DMT 0x06:   640x480    75.000000 Hz   4:3     37.500 kHz     31.500000 MHz
    DMT 0x09:   800x600    60.316541 Hz   4:3     37.879 kHz     40.000000 MHz
    DMT 0x0a:   800x600    72.187572 Hz   4:3     48.077 kHz     50.000000 MHz
    DMT 0x0b:   800x600    75.000000 Hz   4:3     46.875 kHz     49.500000 MHz
    DMT 0x10:  1024x768    60.003840 Hz   4:3     48.363 kHz     65.000000 MHz
    DMT 0x11:  1024x768    70.069359 Hz   4:3     56.476 kHz     75.000000 MHz
    DMT 0x12:  1024x768    75.028582 Hz   4:3     60.023 kHz     78.750000 MHz
    DMT 0x24:  1280x1024   75.024675 Hz   5:4     79.976 kHz    135.000000 MHz
  Standard Timings:
    DMT 0x52:  1920x1080   60.000000 Hz  16:9     67.500 kHz    148.500000 MHz
    DMT 0x1c:  1280x800    59.810326 Hz  16:10    49.702 kHz     83.500000 MHz
    DMT 0x23:  1280x1024   60.019740 Hz   5:4     63.981 kHz    108.000000 MHz
    DMT 0x2f:  1440x900    59.887445 Hz  16:10    55.935 kHz    106.500000 MHz
    DMT 0x33:  1600x1200   60.000000 Hz   4:3     75.000 kHz    162.000000 MHz
    DMT 0x3a:  1680x1050   59.954250 Hz  16:10    65.290 kHz    146.250000 MHz
  Detailed Timing Descriptors:
    DTD 1:  1920x1200   59.950171 Hz  16:10    74.038 kHz    154.000000 MHz (518 mm x 324 mm)
                 Hfront   48 Hsync  32 Hback   80 Hpol P
                 Vfront    3 Vsync   6 Vback   26 Vpol N
    DTD 2:  1920x1080   59.933878 Hz  16:9     66.587 kHz    138.500000 MHz (518 mm x 324 mm)
                 Hfront   48 Hsync  32 Hback   80 Hpol P
                 Vfront    3 Vsync   5 Vback   23 Vpol N
    Display Range Limits:
      Monitor ranges (GTF): 50-75 Hz V, 30-83 kHz H, max dotclock 210 MHz
    Display Product Name: 'LEN T2454pA'
Checksum: 0x64

----------------

Block 1, Unknown EDID Extension Block 0x00:
  00 ff ff ff ff ff ff 00 30 ae c9 60 01 01 01 01 '........0..`....'
  34 19 01 03 6c 34 20 78 2e 4c a5 a7 55 4d a2 26 '4...l4 x.L..UM.&'
  10 50 54 bd cf 00 d1 c0 81 00 81 80 95 00 a9 40 '.PT............@'
  b3 00 01 01 01 01 28 3c 80 a0 70 b0 23 40 30 20 '......(<..p.#@0 '
  36 00 06 44 21 00 00 1a 1a 36 80 a0 70 38 1f 40 '6..D!....6..p8.@'
  30 20 35 00 06 44 21 00 00 1a 00 00 00 fd 00 32 '0 5..D!........2'
  4b 1e 53 15 00 0a 20 20 20 20 20 20 00 00 00 fc 'K.S...      ....'
  00 4c 45 4e 20 54 32 34 35 34 70 41 0a 20 00 64 '.LEN T2454pA. .d'
Checksum: 0x64

----------------

Failures:

Block 0, Base EDID:
  Basic Display Parameters & Features: sRGB is signaled, but the chromaticities do not match.
Block 1, Base EDID:
  Unknown Extension Block.
EDID:
  Base EDID: EDID specified 0 extension block(s), but found 1 extension block(s).

EDID conformity: FAIL
