edid-decode (hex):

00 ff ff ff ff ff ff 00 26 cd 1c 76 01 01 01 01
03 22 01 04 b5 46 27 78 3b 5a 85 a7 54 50 9b 25
0b 50 54 bf ef 80 d1 c0 e1 c0 d1 00 b3 00 a9 40
a9 c0 81 80 81 00 56 5e 00 a0 a0 a0 29 50 30 20
35 00 ba 89 21 00 00 1a fc fd 00 80 a0 a0 1a 50
08 20 68 00 ba 89 21 00 00 1a 00 00 00 fd 00 30
a5 fa fa 44 01 0a 20 20 20 20 20 20 00 00 00 fc
00 50 4c 33 32 37 31 51 0a 20 20 20 20 20 01 b6

02 03 31 f3 4b 10 1f 04 14 03 12 05 07 16 01 3f
23 09 07 07 83 01 00 00 6d 1a 00 00 02 01 30 a5
00 00 00 00 00 00 e3 05 e0 00 e6 06 07 01 61 61
01 5a a0 00 a0 a0 a0 46 50 30 20 35 00 ba 89 21
00 00 1e 38 95 80 a0 70 38 21 40 30 40 35 00 ba
89 21 00 00 1e f8 e3 00 a0 a0 a0 32 50 08 20 98
04 ba 89 21 00 00 1e 6f c2 00 a0 a0 a0 55 50 30
20 35 00 ba 89 21 00 00 1a 00 00 00 00 00 00 62

00 ff ff ff ff ff ff 00 26 cd 1c 76 01 01 01 01
03 22 01 04 b5 46 27 78 3b 5a 85 a7 54 50 9b 25
0b 50 54 bf ef 80 d1 c0 e1 c0 d1 00 b3 00 a9 40
a9 c0 81 80 81 00 56 5e 00 a0 a0 a0 29 50 30 20
35 00 ba 89 21 00 00 1a fc fd 00 80 a0 a0 1a 50
08 20 68 00 ba 89 21 00 00 1a 00 00 00 fd 00 30
a5 fa fa 44 01 0a 20 20 20 20 20 20 00 00 00 fc
00 50 4c 33 32 37 31 51 0a 20 20 20 20 20 01 b6

02 03 31 f3 4b 10 1f 04 14 03 12 05 07 16 01 3f
23 09 07 07 83 01 00 00 6d 1a 00 00 02 01 30 a5
00 00 00 00 00 00 e3 05 e0 00 e6 06 07 01 61 61
01 5a a0 00 a0 a0 a0 46 50 30 20 35 00 ba 89 21
00 00 1e 38 95 80 a0 70 38 21 40 30 40 35 00 ba
89 21 00 00 1e f8 e3 00 a0 a0 a0 32 50 08 20 98
04 ba 89 21 00 00 1e 6f c2 00 a0 a0 a0 55 50 30
20 35 00 ba 89 21 00 00 1a 00 00 00 00 00 00 62

----------------

Block 0, Base EDID:
  EDID Structure Version & Revision: 1.4
  Vendor & Product Identification:
    Manufacturer: IVM
    Model: 30236
    Serial Number: ...
    Made in: week 3 of 2024
  Basic Display Parameters & Features:
    Digital display
    Bits per primary color channel: 10
    DisplayPort interface
    Maximum image size: 70 cm x 39 cm
    Gamma: 2.20
    DPMS levels: Off
    Supported color formats: RGB 4:4:4, YCrCb 4:4:4, YCrCb 4:2:2
    First detailed timing includes the native pixel format and preferred refresh rate
    Display is continuous frequency
  Color Characteristics:
    Red  : 0.6533, 0.3291
    Green: 0.3144, 0.6074
    Blue : 0.1464, 0.0429
    White: 0.3134, 0.3291
  Established Timings I & II:
    IBM     :   720x400    70.081663 Hz   9:5     31.467 kHz     28.320000 MHz
    DMT 0x04:   640x480    59.940476 Hz   4:3     31.469 kHz     25.175000 MHz
    Apple   :   640x480    66.666667 Hz   4:3     35.000 kHz     30.240000 MHz
    DMT 0x05:   640x480    72.808802 Hz   4:3     37.861 kHz     31.500000 MHz
    DMT 0x06:   640x480    75.000000 Hz   4:3     37.500 kHz     31.500000 MHz
    DMT 0x08:   800x600    56.250000 Hz   4:3     35.156 kHz     36.000000 MHz
    DMT 0x09:   800x600    60.316541 Hz   4:3     37.879 kHz     40.000000 MHz
    DMT 0x0a:   800x600    72.187572 Hz   4:3     48.077 kHz     50.000000 MHz
    DMT 0x0b:   800x600    75.000000 Hz   4:3     46.875 kHz     49.500000 MHz
    Apple   :   832x624    74.551266 Hz   4:3     49.726 kHz     57.284000 MHz
    DMT 0x10:  1024x768    60.003840 Hz   4:3     48.363 kHz     65.000000 MHz
    DMT 0x11:  1024x768    70.069359 Hz   4:3     56.476 kHz     75.000000 MHz
    DMT 0x12:  1024x768    75.028582 Hz   4:3     60.023 kHz     78.750000 MHz
    DMT 0x24:  1280x1024   75.024675 Hz   5:4     79.976 kHz    135.000000 MHz
    Apple   :  1152x870    75.061550 Hz 192:145   68.681 kHz    100.000000 MHz
  Standard Timings:
    DMT 0x52:  1920x1080   60.000000 Hz  16:9     67.500 kHz    148.500000 MHz
    DMT 0x54:  2048x1152   60.000000 Hz  16:9     72.000 kHz    162.000000 MHz (RB)
    DMT 0x45:  1920x1200   59.884600 Hz  16:10    74.556 kHz    193.250000 MHz
    DMT 0x3a:  1680x1050   59.954250 Hz  16:10    65.290 kHz    146.250000 MHz
    DMT 0x33:  1600x1200   60.000000 Hz   4:3     75.000 kHz    162.000000 MHz
    DMT 0x53:  1600x900    60.000000 Hz  16:9     60.000 kHz    108.000000 MHz (RB)
    DMT 0x23:  1280x1024   60.019740 Hz   5:4     63.981 kHz    108.000000 MHz
    DMT 0x1c:  1280x800    59.810326 Hz  16:10    49.702 kHz     83.500000 MHz
  Detailed Timing Descriptors:
    DTD  1:  2560x1440   59.950550 Hz  16:9     88.787 kHz    241.500000 MHz (698 mm x 393 mm)
                  Hfront   48 Hsync  32 Hback   80 Hpol P
                  Vfront    3 Vsync   5 Vback   33 Vpol N
    DTD  2:  2560x1440  164.999919 Hz  16:9    241.890 kHz    650.200000 MHz (698 mm x 393 mm)
                  Hfront    8 Hsync  32 Hback   88 Hpol P
                  Vfront    6 Vsync   8 Vback   12 Vpol N
    Display Range Limits:
      Monitor ranges (Bare Limits): 48-165 Hz V, 250-250 kHz H, max dotclock 680 MHz
    Display Product Name: 'PL3271Q'
  Extension blocks: 1
Checksum: 0xb6

----------------

Block 1, CTA-861 Extension Block:
  Revision: 3
  Underscans IT Video Formats by default
  Basic audio support
  Supports YCbCr 4:4:4
  Supports YCbCr 4:2:2
  Native detailed modes: 3
  Video Data Block:
    VIC  16:  1920x1080   60.000000 Hz  16:9     67.500 kHz    148.500000 MHz
    VIC  31:  1920x1080   50.000000 Hz  16:9     56.250 kHz    148.500000 MHz
    VIC   4:  1280x720    60.000000 Hz  16:9     45.000 kHz     74.250000 MHz
    VIC  20:  1920x1080i  50.000000 Hz  16:9     28.125 kHz     74.250000 MHz
    VIC   3:   720x480    59.940060 Hz  16:9     31.469 kHz     27.000000 MHz
    VIC  18:   720x576    50.000000 Hz  16:9     31.250 kHz     27.000000 MHz
    VIC   5:  1920x1080i  60.000000 Hz  16:9     33.750 kHz     74.250000 MHz
    VIC   7:  1440x480i   59.940060 Hz  16:9     15.734 kHz     27.000000 MHz
    VIC  22:  1440x576i   50.000000 Hz  16:9     15.625 kHz     27.000000 MHz
    VIC   1:   640x480    59.940476 Hz   4:3     31.469 kHz     25.175000 MHz
    VIC  63:  1920x1080  120.000000 Hz  16:9    135.000 kHz    297.000000 MHz
  Audio Data Block:
    Linear PCM:
      Max channels: 2
      Supported sample rates (kHz): 48 44.1 32
      Supported sample sizes (bits): 24 20 16
  Speaker Allocation Data Block:
    FL/FR - Front Left/Right
  Vendor-Specific Data Block (AMD), OUI 00-00-1A:
    Version: 2.1
    Minimum Refresh Rate: 48 Hz
    Maximum Refresh Rate: 165 Hz
    Flags 1.x: 0x00
    Flags 2.x: 0x00
    Maximum luminance: 0 (50.000 cd/m^2)
    Minimum luminance: 0 (0.000 cd/m^2)
    Unknown: 0x00 0x00
  Colorimetry Data Block:
    BT2020cYCC
    BT2020YCC
    BT2020RGB
  HDR Static Metadata Data Block:
    Electro optical transfer functions:
      Traditional gamma - SDR luminance range
      Traditional gamma - HDR luminance range
      SMPTE ST2084
    Supported static metadata descriptors:
      Static metadata type 1
    Desired content max luminance: 97 (408.759 cd/m^2)
    Desired content max frame-average luminance: 97 (408.759 cd/m^2)
    Desired content min luminance: 1 (0.000 cd/m^2)
  Detailed Timing Descriptors:
    DTD  3:  2560x1440   99.946436 Hz  16:9    150.919 kHz    410.500000 MHz (698 mm x 393 mm)
                  Hfront   48 Hsync  32 Hback   80 Hpol P
                  Vfront    3 Vsync   5 Vback   62 Vpol P
    DTD  4:  1920x1080  165.007948 Hz  16:9    183.654 kHz    382.000000 MHz (698 mm x 393 mm)
                  Hfront   48 Hsync  64 Hback   48 Hpol P
                  Vfront    3 Vsync   5 Vback   25 Vpol P
    DTD  5:  2560x1440  143.999210 Hz  16:9    214.559 kHz    583.600000 MHz (698 mm x 393 mm)
                  Hfront    8 Hsync  32 Hback  120 Hpol P
                  Vfront   25 Vsync   8 Vback   17 Vpol P
    DTD  6:  2560x1440  119.997589 Hz  16:9    182.996 kHz    497.750000 MHz (698 mm x 393 mm)
                  Hfront   48 Hsync  32 Hback   80 Hpol P
                  Vfront    3 Vsync   5 Vback   77 Vpol N
Checksum: 0x62  Unused space in Extension Block: 6 bytes

----------------

Block 2, Unknown EDID Extension Block 0x00:
  00 ff ff ff ff ff ff 00 26 cd 1c 76 01 01 01 01 '........&..v....'
  03 22 01 04 b5 46 27 78 3b 5a 85 a7 54 50 9b 25 '."...F'x;Z..TP.%'
  0b 50 54 bf ef 80 d1 c0 e1 c0 d1 00 b3 00 a9 40 '.PT............@'
  a9 c0 81 80 81 00 56 5e 00 a0 a0 a0 29 50 30 20 '......V^....)P0 '
  35 00 ba 89 21 00 00 1a fc fd 00 80 a0 a0 1a 50 '5...!..........P'
  08 20 68 00 ba 89 21 00 00 1a 00 00 00 fd 00 30 '. h...!........0'
  a5 fa fa 44 01 0a 20 20 20 20 20 20 00 00 00 fc '...D..      ....'
  00 50 4c 33 32 37 31 51 0a 20 20 20 20 20 01 b6 '.PL3271Q.     ..'
Checksum: 0xb6

----------------

Block 3, CTA-861 Extension Block:
  Revision: 3
  Underscans IT Video Formats by default
  Basic audio support
  Supports YCbCr 4:4:4
  Supports YCbCr 4:2:2
  Native detailed modes: 3
  Video Data Block:
    VIC  16:  1920x1080   60.000000 Hz  16:9     67.500 kHz    148.500000 MHz
    VIC  31:  1920x1080   50.000000 Hz  16:9     56.250 kHz    148.500000 MHz
    VIC   4:  1280x720    60.000000 Hz  16:9     45.000 kHz     74.250000 MHz
    VIC  20:  1920x1080i  50.000000 Hz  16:9     28.125 kHz     74.250000 MHz
    VIC   3:   720x480    59.940060 Hz  16:9     31.469 kHz     27.000000 MHz
    VIC  18:   720x576    50.000000 Hz  16:9     31.250 kHz     27.000000 MHz
    VIC   5:  1920x1080i  60.000000 Hz  16:9     33.750 kHz     74.250000 MHz
    VIC   7:  1440x480i   59.940060 Hz  16:9     15.734 kHz     27.000000 MHz
    VIC  22:  1440x576i   50.000000 Hz  16:9     15.625 kHz     27.000000 MHz
    VIC   1:   640x480    59.940476 Hz   4:3     31.469 kHz     25.175000 MHz
    VIC  63:  1920x1080  120.000000 Hz  16:9    135.000 kHz    297.000000 MHz
  Audio Data Block:
    Linear PCM:
      Max channels: 2
      Supported sample rates (kHz): 48 44.1 32
      Supported sample sizes (bits): 24 20 16
  Speaker Allocation Data Block:
    FL/FR - Front Left/Right
  Vendor-Specific Data Block (AMD), OUI 00-00-1A:
    Version: 2.1
    Minimum Refresh Rate: 48 Hz
    Maximum Refresh Rate: 165 Hz
    Flags 1.x: 0x00
    Flags 2.x: 0x00
    Maximum luminance: 0 (50.000 cd/m^2)
    Minimum luminance: 0 (0.000 cd/m^2)
    Unknown: 0x00 0x00
  Colorimetry Data Block:
    BT2020cYCC
    BT2020YCC
    BT2020RGB
  HDR Static Metadata Data Block:
    Electro optical transfer functions:
      Traditional gamma - SDR luminance range
      Traditional gamma - HDR luminance range
      SMPTE ST2084
    Supported static metadata descriptors:
      Static metadata type 1
    Desired content max luminance: 97 (408.759 cd/m^2)
    Desired content max frame-average luminance: 97 (408.759 cd/m^2)
    Desired content min luminance: 1 (0.000 cd/m^2)
  Detailed Timing Descriptors:
    DTD  7:  2560x1440   99.946436 Hz  16:9    150.919 kHz    410.500000 MHz (698 mm x 393 mm)
                  Hfront   48 Hsync  32 Hback   80 Hpol P
                  Vfront    3 Vsync   5 Vback   62 Vpol P
    DTD  8:  1920x1080  165.007948 Hz  16:9    183.654 kHz    382.000000 MHz (698 mm x 393 mm)
                  Hfront   48 Hsync  64 Hback   48 Hpol P
                  Vfront    3 Vsync   5 Vback   25 Vpol P
    DTD  9:  2560x1440  143.999210 Hz  16:9    214.559 kHz    583.600000 MHz (698 mm x 393 mm)
                  Hfront    8 Hsync  32 Hback  120 Hpol P
                  Vfront   25 Vsync   8 Vback   17 Vpol P
    DTD 10:  2560x1440  119.997589 Hz  16:9    182.996 kHz    497.750000 MHz (698 mm x 393 mm)
                  Hfront   48 Hsync  32 Hback   80 Hpol P
                  Vfront    3 Vsync   5 Vback   77 Vpol N
Checksum: 0x62  Unused space in Extension Block: 6 bytes

----------------

Warnings:

Block 1, CTA-861 Extension Block:
  Colorimetry Data Block: Set the sRGB colorimetry bit to avoid interop issues.
Block 3, CTA-861 Extension Block:
  Colorimetry Data Block: Set the sRGB colorimetry bit to avoid interop issues.
EDID:
  Base EDID: Some timings are out of range of the Monitor Ranges:
    Horizontal Freq: 15.625 - 241.889 kHz (Monitor: 250.000 - 250.000 kHz)
  CTA-861: Multiple native progressive timings are defined.

Failures:

Block 1, CTA-861 Extension Block:
  Missing VCDB, needed for Set Selectable RGB Quantization to avoid interop issues.
Block 2, Base EDID:
  Unknown Extension Block.
Block 3, CTA-861 Extension Block:
  Video Data Block: Duplicate VIC 16.
  Video Data Block: Duplicate VIC 31.
  Video Data Block: Duplicate VIC 4.
  Video Data Block: Duplicate VIC 20.
  Video Data Block: Duplicate VIC 3.
  Video Data Block: Duplicate VIC 18.
  Video Data Block: Duplicate VIC 5.
  Video Data Block: Duplicate VIC 7.
  Video Data Block: Duplicate VIC 22.
  Video Data Block: Duplicate VIC 1.
  Video Data Block: Duplicate VIC 63.
  Speaker Allocation Data Block: Only one instance of this Data Block is allowed.
  Colorimetry Data Block: Only one instance of this Data Block is allowed.
  HDR Static Metadata Data Block: Only one instance of this Data Block is allowed.
  Missing VCDB, needed for Set Selectable RGB Quantization to avoid interop issues.
EDID:
  Base EDID: EDID specified 1 extension block(s), but found 3 extension block(s).

EDID conformity: FAIL
