
EDID (hex):
00ffffffffffff0006af91d200000000
161e0104a51e1378030be5a7564a9c21
0d505700000001010101010101010101
010101010101fa3c80b870b024401010
3e002dbc10000018000000fd00303c4b
4b10010a202020202020000000fe0041
554f0a202020202020202020000000fe
004231343055414e30322e31200a00c0

edid-decode (hex):

00 ff ff ff ff ff ff 00 06 af 91 d2 00 00 00 00
16 1e 01 04 a5 1e 13 78 03 0b e5 a7 56 4a 9c 21
0d 50 57 00 00 00 01 01 01 01 01 01 01 01 01 01
01 01 01 01 01 01 fa 3c 80 b8 70 b0 24 40 10 10
3e 00 2d bc 10 00 00 18 00 00 00 fd 00 30 3c 4b
4b 10 01 0a 20 20 20 20 20 20 00 00 00 fe 00 41
55 4f 0a 20 20 20 20 20 20 20 20 20 00 00 00 fe
00 42 31 34 30 55 41 4e 30 32 2e 31 20 0a 00 c0

----------------

Block 0, Base EDID:
  EDID Structure Version & Revision: 1.4
  Vendor & Product Identification:
    Manufacturer: AUO
    Model: 53905
    Made in: week 22 of 2020
  Basic Display Parameters & Features:
    Digital display
    Bits per primary color channel: 8
    DisplayPort interface
    Maximum image size: 30 cm x 19 cm
    Gamma: 2.20
    Supported color formats: RGB 4:4:4
    First detailed timing includes the native pixel format and preferred refresh rate
    Display is continuous frequency
  Color Characteristics:
    Red  : 0.6523, 0.3359
    Green: 0.2910, 0.6123
    Blue : 0.1318, 0.0527
    White: 0.3134, 0.3408
  Established Timings I & II: none
  Standard Timings: none
  Detailed Timing Descriptors:
    DTD 1:  1920x1200   60.025902 Hz  16:10    74.192 kHz    156.100000 MHz (301 mm x 188 mm)
                 Hfront   16 Hsync  16 Hback  152 Hpol N
                 Vfront    3 Vsync  14 Vback   19 Vpol N
    Display Range Limits:
      Monitor ranges (Bare Limits): 48-60 Hz V, 75-75 kHz H, max dotclock 160 MHz
    Alphanumeric Data String: 'AUO'
    Alphanumeric Data String: 'B140UAN02.1 '
Checksum: 0xc0


