
EDID (hex):
00ffffffffffff003438b50685030000
210e010368221c78e8f596a3584d9624
195256bfef00714f8180010101010101
010101010101000000fe0a2020202020
2020202020202020000000fe0a202020
20202020202020202020000000fd0038
4b1f530e000a202020202020000000fc
00423130313731350a20202020200024

Extracted contents:
header:          00 ff ff ff ff ff ff 00
serial number:   34 38 b5 06 85 03 00 00 21 0e
version:         01 03
basic params:    68 22 1c 78 e8
chroma info:     f5 96 a3 58 4d 96 24 19 52 56
established:     bf ef 00
standard:        71 4f 81 80 01 01 01 01 01 01 01 01 01 01 01 01
descriptor 1:    00 00 00 fe 0a 20 20 20 20 20 20 20 20 20 20 20 20 20
descriptor 2:    00 00 00 fe 0a 20 20 20 20 20 20 20 20 20 20 20 20 20
descriptor 3:    00 00 00 fd 00 38 4b 1f 53 0e 00 0a 20 20 20 20 20 20
descriptor 4:    00 00 00 fc 00 42 31 30 31 37 31 35 0a 20 20 20 20 20
extensions:      00
checksum:        24

EDID version: 1.3
Manufacturer: MAX Model 6b5 Serial Number --
Analog display, Input voltage level: 0.7/0.7 V
Sync: Separate 
Maximum image size: 34 cm x 28 cm
Gamma: 2.20
DPMS levels: Standby Suspend Off
RGB color display
Display x,y Chromaticity:
  Red:   0.6396, 0.3466
  Green: 0.3017, 0.5869
  Blue:  0.1425, 0.0986
  White: 0.3212, 0.3378
Established timings supported:
  720x400@70Hz 9:5 HorFreq: 31469 Hz Clock: 28.320 MHz
  640x480@60Hz 4:3 HorFreq: 31469 Hz Clock: 25.175 MHz
  640x480@67Hz 4:3 HorFreq: 35000 Hz Clock: 30.240 MHz
  640x480@72Hz 4:3 HorFreq: 37900 Hz Clock: 31.500 MHz
  640x480@75Hz 4:3 HorFreq: 37500 Hz Clock: 31.500 MHz
  800x600@56Hz 4:3 HorFreq: 35200 Hz Clock: 36.000 MHz
  800x600@60Hz 4:3 HorFreq: 37900 Hz Clock: 40.000 MHz
  800x600@72Hz 4:3 HorFreq: 48100 Hz Clock: 50.000 MHz
  800x600@75Hz 4:3 HorFreq: 46900 Hz Clock: 49.500 MHz
  832x624@75Hz 4:3 HorFreq: 49726 Hz Clock: 57.284 MHz
  1024x768@60Hz 4:3 HorFreq: 48400 Hz Clock: 65.000 MHz
  1024x768@70Hz 4:3 HorFreq: 56500 Hz Clock: 75.000 MHz
  1024x768@75Hz 4:3 HorFreq: 60000 Hz Clock: 78.750 MHz
  1280x1024@75Hz 5:4 HorFreq: 80000 Hz Clock: 135.000 MHz
Standard timings supported:
  1152x864@75Hz 4:3 HorFreq: 67500 Hz Clock: 108.000 MHz
  1280x1024@60Hz 5:4 HorFreq: 64000 Hz Clock: 108.000 MHz
Monitor descriptor block has byte 4 nonzero (0x0a)
ASCII string:              
Monitor descriptor block has byte 4 nonzero (0x0a)
ASCII string:              
Monitor ranges (GTF): 56-75Hz V, 31-83kHz H, max dotclock 140MHz
Monitor name: B101715
Checksum: 0x24 (valid)
EDID block does NOT conform to EDID 1.3!
	Missing preferred timing
	Invalid descriptor block padding
EDID block does not conform at all!
	Bad year of manufacture
