edid-decode (hex):

00 ff ff ff ff ff ff 00 1e 6d 92 3e 45 5a 02 00
03 19 01 03 68 22 13 78 ea 00 25 9e 57 52 99 29
15 50 54 23 08 00 31 40 45 40 61 40 81 c0 01 01
01 01 01 01 01 01 20 1c 56 86 50 00 20 30 0e 38
13 00 58 c2 10 00 00 1e 00 00 00 fd 00 38 3f 1e
35 08 00 0a 20 20 20 20 20 20 00 00 00 fc 00 4c
47 20 48 44 20 31 36 0a 20 20 20 20 00 00 00 ff
00 35 30 33 49 4e 42 53 34 4a 31 38 31 0a 00 d6

00 ff ff ff ff ff ff 00 1e 6d 92 3e 45 5a 02 00
03 19 01 03 68 22 13 78 ea 00 25 9e 57 52 99 29
15 50 54 23 08 00 31 40 45 40 61 40 81 c0 01 01
01 01 01 01 01 01 20 1c 56 86 50 00 20 30 0e 38
13 00 58 c2 10 00 00 1e 00 00 00 fd 00 38 3f 1e
35 08 00 0a 20 20 20 20 20 20 00 00 00 fc 00 4c
47 20 48 44 20 31 36 0a 20 20 20 20 00 00 00 ff
00 35 30 33 49 4e 42 53 34 4a 31 38 31 0a 00 d6

----------------

Block 0, Base EDID:
  EDID Structure Version & Revision: 1.3
  Vendor & Product Identification:
    Manufacturer: GSM
    Model: 16018
    Serial Number: ...
    Made in: week 3 of 2015
  Basic Display Parameters & Features:
    Analog display
    Signal Level Standard: 0.700 : 0.000 : 0.700 V p-p
    Blank level equals black level
    Sync: Separate
    Maximum image size: 34 cm x 19 cm
    Gamma: 2.20
    DPMS levels: Standby Suspend Off
    RGB color display
    First detailed timing is the preferred timing
  Color Characteristics:
    Red  : 0.6171, 0.3398
    Green: 0.3203, 0.5976
    Blue : 0.1601, 0.0839
    White: 0.3134, 0.3291
  Established Timings I & II:
    DMT 0x04:   640x480    59.940476 Hz   4:3     31.469 kHz     25.175000 MHz
    DMT 0x08:   800x600    56.250000 Hz   4:3     35.156 kHz     36.000000 MHz
    DMT 0x09:   800x600    60.316541 Hz   4:3     37.879 kHz     40.000000 MHz
    DMT 0x10:  1024x768    60.003840 Hz   4:3     48.363 kHz     65.000000 MHz
  Standard Timings:
    DMT 0x04:   640x480    59.940476 Hz   4:3     31.469 kHz     25.175000 MHz
    DMT 0x09:   800x600    60.316541 Hz   4:3     37.879 kHz     40.000000 MHz
    DMT 0x10:  1024x768    60.003840 Hz   4:3     48.363 kHz     65.000000 MHz
    DMT 0x55:  1280x720    60.000000 Hz  16:9     45.000 kHz     74.250000 MHz
  Detailed Timing Descriptors:
    DTD 1:  1366x768    60.000000 Hz 683:384   48.000 kHz     72.000000 MHz (344 mm x 194 mm)
                 Hfront   14 Hsync  56 Hback   64 Hpol P
                 Vfront    1 Vsync   3 Vback   28 Vpol P
    Display Range Limits:
      Monitor ranges (GTF): 56-63 Hz V, 30-53 kHz H, max dotclock 80 MHz
    Display Product Name: 'LG HD 16'
    Display Product Serial Number: ...
Checksum: 0xd6

----------------

Block 1, Unknown EDID Extension Block 0x00:
  00 ff ff ff ff ff ff 00 1e 6d 92 3e 45 5a 02 00 '.........m.>EZ..'
  03 19 01 03 68 22 13 78 ea 00 25 9e 57 52 99 29 '....h".x..%.WR.)'
  15 50 54 23 08 00 31 40 45 40 61 40 81 c0 01 01 '.PT#..1@E@a@....'
  01 01 01 01 01 01 20 1c 56 86 50 00 20 30 0e 38 '...... .V.P. 0.8'
  13 00 58 c2 10 00 00 1e 00 00 00 fd 00 38 3f 1e '..X..........8?.'
  35 08 00 0a 20 20 20 20 20 20 00 00 00 fc 00 4c '5...      .....L'
  47 20 48 44 20 31 36 0a 20 20 20 20 00 00 00 ff 'G HD 16.    ....'
  00 35 30 33 49 4e 42 53 34 4a 31 38 31 0a 00 d6 '.503INBS4J181...'
Checksum: 0xd6

----------------

Failures:

Block 1, Base EDID:
  Unknown Extension Block.
EDID:
  Base EDID: EDID specified 0 extension block(s), but found 1 extension block(s).

EDID conformity: FAIL
