edid-decode (hex):

00 ff ff ff ff ff ff 00 26 cd 06 61 52 2f 00 00
09 15 01 03 80 35 1e 78 2a b7 d5 a4 56 54 9f 27
0c 50 54 33 08 00 71 00 81 40 81 80 a9 40 b3 00
95 00 d1 c0 01 01 02 3a 80 18 71 38 2d 40 58 2c
45 00 13 2b 21 00 00 1e 00 00 00 ff 00 31 31 30
39 36 31 30 39 31 32 31 31 34 00 00 00 fd 00 37
4c 1e 54 11 00 0a 20 20 20 20 20 20 00 00 00 fc
00 50 4c 58 32 34 37 32 48 44 0a 20 20 20 01 cc

02 03 22 f1 4f 90 05 04 03 02 01 11 12 13 14 06
07 15 16 1f 23 09 07 01 83 01 00 00 65 03 0c 00
10 00 02 3a 80 18 71 38 2d 40 58 2c 45 00 13 2b
21 00 00 1f 01 1d 80 d0 72 1c 16 20 10 2c 25 80
13 2b 21 00 00 9e 01 1d 00 bc 52 d0 1e 20 b8 28
55 40 13 2b 21 00 00 1e 8c 0a d0 90 20 40 31 20
0c 40 55 00 13 2b 21 00 00 18 02 3a 80 d0 72 38
2d 40 10 2c 45 80 13 2b 21 00 00 1e 00 00 00 d0

00 ff ff ff ff ff ff 00 26 cd 06 61 52 2f 00 00
09 15 01 03 80 35 1e 78 2a b7 d5 a4 56 54 9f 27
0c 50 54 33 08 00 71 00 81 40 81 80 a9 40 b3 00
95 00 d1 c0 01 01 02 3a 80 18 71 38 2d 40 58 2c
45 00 13 2b 21 00 00 1e 00 00 00 ff 00 31 31 30
39 36 31 30 39 31 32 31 31 34 00 00 00 fd 00 37
4c 1e 54 11 00 0a 20 20 20 20 20 20 00 00 00 fc
00 50 4c 58 32 34 37 32 48 44 0a 20 20 20 01 cc

02 03 22 f1 4f 90 05 04 03 02 01 11 12 13 14 06
07 15 16 1f 23 09 07 01 83 01 00 00 65 03 0c 00
10 00 02 3a 80 18 71 38 2d 40 58 2c 45 00 13 2b
21 00 00 1f 01 1d 80 d0 72 1c 16 20 10 2c 25 80
13 2b 21 00 00 9e 01 1d 00 bc 52 d0 1e 20 b8 28
55 40 13 2b 21 00 00 1e 8c 0a d0 90 20 40 31 20
0c 40 55 00 13 2b 21 00 00 18 02 3a 80 d0 72 38
2d 40 10 2c 45 80 13 2b 21 00 00 1e 00 00 00 d0

----------------

Block 0, Base EDID:
  EDID Structure Version & Revision: 1.3
  Vendor & Product Identification:
    Manufacturer: IVM
    Model: 24838
    Serial Number: ...
    Made in: week 9 of 2011
  Basic Display Parameters & Features:
    Digital display
    Maximum image size: 53 cm x 30 cm
    Gamma: 2.20
    DPMS levels: Off
    RGB color display
    First detailed timing is the preferred timing
  Color Characteristics:
    Red  : 0.6425, 0.3388
    Green: 0.3291, 0.6240
    Blue : 0.1552, 0.0478
    White: 0.3134, 0.3291
  Established Timings I & II:
    DMT 0x04:   640x480    59.940476 Hz   4:3     31.469 kHz     25.175000 MHz
    Apple   :   640x480    66.666667 Hz   4:3     35.000 kHz     30.240000 MHz
    DMT 0x08:   800x600    56.250000 Hz   4:3     35.156 kHz     36.000000 MHz
    DMT 0x09:   800x600    60.316541 Hz   4:3     37.879 kHz     40.000000 MHz
    DMT 0x10:  1024x768    60.003840 Hz   4:3     48.363 kHz     65.000000 MHz
  Standard Timings:
    GTF     :  1152x720    59.999964 Hz  16:10    44.760 kHz     67.319000 MHz
    DMT 0x20:  1280x960    60.000000 Hz   4:3     60.000 kHz    108.000000 MHz
    DMT 0x23:  1280x1024   60.019740 Hz   5:4     63.981 kHz    108.000000 MHz
    DMT 0x33:  1600x1200   60.000000 Hz   4:3     75.000 kHz    162.000000 MHz
    DMT 0x3a:  1680x1050   59.954250 Hz  16:10    65.290 kHz    146.250000 MHz
    DMT 0x2f:  1440x900    59.887445 Hz  16:10    55.935 kHz    106.500000 MHz
    DMT 0x52:  1920x1080   60.000000 Hz  16:9     67.500 kHz    148.500000 MHz
  Detailed Timing Descriptors:
    DTD  1:  1920x1080   60.000000 Hz  16:9     67.500 kHz    148.500000 MHz (531 mm x 299 mm)
                  Hfront   88 Hsync  44 Hback  148 Hpol P
                  Vfront    4 Vsync   5 Vback   36 Vpol P
    Display Product Serial Number: ...
    Display Range Limits:
      Monitor ranges (GTF): 55-76 Hz V, 30-84 kHz H, max dotclock 170 MHz
    Display Product Name: 'PLX2472HD'
  Extension blocks: 1
Checksum: 0xcc

----------------

Block 1, CTA-861 Extension Block:
  Revision: 3
  Underscans IT Video Formats by default
  Basic audio support
  Supports YCbCr 4:4:4
  Supports YCbCr 4:2:2
  Native detailed modes: 1
  Video Data Block:
    VIC  16:  1920x1080   60.000000 Hz  16:9     67.500 kHz    148.500000 MHz (native)
    VIC   5:  1920x1080i  60.000000 Hz  16:9     33.750 kHz     74.250000 MHz
    VIC   4:  1280x720    60.000000 Hz  16:9     45.000 kHz     74.250000 MHz
    VIC   3:   720x480    59.940060 Hz  16:9     31.469 kHz     27.000000 MHz
    VIC   2:   720x480    59.940060 Hz   4:3     31.469 kHz     27.000000 MHz
    VIC   1:   640x480    59.940476 Hz   4:3     31.469 kHz     25.175000 MHz
    VIC  17:   720x576    50.000000 Hz   4:3     31.250 kHz     27.000000 MHz
    VIC  18:   720x576    50.000000 Hz  16:9     31.250 kHz     27.000000 MHz
    VIC  19:  1280x720    50.000000 Hz  16:9     37.500 kHz     74.250000 MHz
    VIC  20:  1920x1080i  50.000000 Hz  16:9     28.125 kHz     74.250000 MHz
    VIC   6:  1440x480i   59.940060 Hz   4:3     15.734 kHz     27.000000 MHz
    VIC   7:  1440x480i   59.940060 Hz  16:9     15.734 kHz     27.000000 MHz
    VIC  21:  1440x576i   50.000000 Hz   4:3     15.625 kHz     27.000000 MHz
    VIC  22:  1440x576i   50.000000 Hz  16:9     15.625 kHz     27.000000 MHz
    VIC  31:  1920x1080   50.000000 Hz  16:9     56.250 kHz    148.500000 MHz
  Audio Data Block:
    Linear PCM:
      Max channels: 2
      Supported sample rates (kHz): 48 44.1 32
      Supported sample sizes (bits): 16
  Speaker Allocation Data Block:
    FL/FR - Front Left/Right
  Vendor-Specific Data Block (HDMI), OUI 00-0C-03:
    Source physical address: 1.0.0.0
  Detailed Timing Descriptors:
    DTD  2:  1920x1080   60.000000 Hz  16:9     67.500 kHz    148.500000 MHz (531 mm x 299 mm)
                  Hfront   88 Hsync  44 Hback  148 Hpol P
                  Vfront    4 Vsync   5 Vback   36 Vpol P
    DTD  3:  1920x1080i  50.000000 Hz  16:9     28.125 kHz     74.250000 MHz (531 mm x 299 mm)
                  Hfront  528 Hsync  44 Hback  148 Hpol P
                  Vfront    2 Vsync   5 Vback   15 Vpol P Vfront +0.5 Odd Field
                  Vfront    2 Vsync   5 Vback   15 Vpol P Vback  +0.5 Even Field
    DTD  4:  1280x720    50.000000 Hz  16:9     37.500 kHz     74.250000 MHz (531 mm x 299 mm)
                  Hfront  440 Hsync  40 Hback  220 Hpol P
                  Vfront    5 Vsync   5 Vback   20 Vpol P
    DTD  5:   720x576    50.000000 Hz   5:4     31.250 kHz     27.000000 MHz (531 mm x 299 mm)
                  Hfront   12 Hsync  64 Hback   68 Hpol N
                  Vfront    5 Vsync   5 Vback   39 Vpol N
    DTD  6:  1920x1080   50.000000 Hz  16:9     56.250 kHz    148.500000 MHz (531 mm x 299 mm)
                  Hfront  528 Hsync  44 Hback  148 Hpol P
                  Vfront    4 Vsync   5 Vback   36 Vpol P
Checksum: 0xd0  Unused space in Extension Block: 3 bytes

----------------

Block 2, Unknown EDID Extension Block 0x00:
  00 ff ff ff ff ff ff 00 26 cd 06 61 52 2f 00 00 '........&..aR/..'
  09 15 01 03 80 35 1e 78 2a b7 d5 a4 56 54 9f 27 '.....5.x*...VT.''
  0c 50 54 33 08 00 71 00 81 40 81 80 a9 40 b3 00 '.PT3..q..@...@..'
  95 00 d1 c0 01 01 02 3a 80 18 71 38 2d 40 58 2c '.......:..q8-@X,'
  45 00 13 2b 21 00 00 1e 00 00 00 ff 00 31 31 30 'E..+!........110'
  39 36 31 30 39 31 32 31 31 34 00 00 00 fd 00 37 '9610912114.....7'
  4c 1e 54 11 00 0a 20 20 20 20 20 20 00 00 00 fc 'L.T...      ....'
  00 50 4c 58 32 34 37 32 48 44 0a 20 20 20 01 cc '.PLX2472HD.   ..'
Checksum: 0xcc

----------------

Block 3, CTA-861 Extension Block:
  Revision: 3
  Underscans IT Video Formats by default
  Basic audio support
  Supports YCbCr 4:4:4
  Supports YCbCr 4:2:2
  Native detailed modes: 1
  Video Data Block:
    VIC  16:  1920x1080   60.000000 Hz  16:9     67.500 kHz    148.500000 MHz (native)
    VIC   5:  1920x1080i  60.000000 Hz  16:9     33.750 kHz     74.250000 MHz
    VIC   4:  1280x720    60.000000 Hz  16:9     45.000 kHz     74.250000 MHz
    VIC   3:   720x480    59.940060 Hz  16:9     31.469 kHz     27.000000 MHz
    VIC   2:   720x480    59.940060 Hz   4:3     31.469 kHz     27.000000 MHz
    VIC   1:   640x480    59.940476 Hz   4:3     31.469 kHz     25.175000 MHz
    VIC  17:   720x576    50.000000 Hz   4:3     31.250 kHz     27.000000 MHz
    VIC  18:   720x576    50.000000 Hz  16:9     31.250 kHz     27.000000 MHz
    VIC  19:  1280x720    50.000000 Hz  16:9     37.500 kHz     74.250000 MHz
    VIC  20:  1920x1080i  50.000000 Hz  16:9     28.125 kHz     74.250000 MHz
    VIC   6:  1440x480i   59.940060 Hz   4:3     15.734 kHz     27.000000 MHz
    VIC   7:  1440x480i   59.940060 Hz  16:9     15.734 kHz     27.000000 MHz
    VIC  21:  1440x576i   50.000000 Hz   4:3     15.625 kHz     27.000000 MHz
    VIC  22:  1440x576i   50.000000 Hz  16:9     15.625 kHz     27.000000 MHz
    VIC  31:  1920x1080   50.000000 Hz  16:9     56.250 kHz    148.500000 MHz
  Audio Data Block:
    Linear PCM:
      Max channels: 2
      Supported sample rates (kHz): 48 44.1 32
      Supported sample sizes (bits): 16
  Speaker Allocation Data Block:
    FL/FR - Front Left/Right
  Vendor-Specific Data Block (HDMI), OUI 00-0C-03:
    Source physical address: 1.0.0.0
  Detailed Timing Descriptors:
    DTD  7:  1920x1080   60.000000 Hz  16:9     67.500 kHz    148.500000 MHz (531 mm x 299 mm)
                  Hfront   88 Hsync  44 Hback  148 Hpol P
                  Vfront    4 Vsync   5 Vback   36 Vpol P
    DTD  8:  1920x1080i  50.000000 Hz  16:9     28.125 kHz     74.250000 MHz (531 mm x 299 mm)
                  Hfront  528 Hsync  44 Hback  148 Hpol P
                  Vfront    2 Vsync   5 Vback   15 Vpol P Vfront +0.5 Odd Field
                  Vfront    2 Vsync   5 Vback   15 Vpol P Vback  +0.5 Even Field
    DTD  9:  1280x720    50.000000 Hz  16:9     37.500 kHz     74.250000 MHz (531 mm x 299 mm)
                  Hfront  440 Hsync  40 Hback  220 Hpol P
                  Vfront    5 Vsync   5 Vback   20 Vpol P
    DTD 10:   720x576    50.000000 Hz   5:4     31.250 kHz     27.000000 MHz (531 mm x 299 mm)
                  Hfront   12 Hsync  64 Hback   68 Hpol N
                  Vfront    5 Vsync   5 Vback   39 Vpol N
    DTD 11:  1920x1080   50.000000 Hz  16:9     56.250 kHz    148.500000 MHz (531 mm x 299 mm)
                  Hfront  528 Hsync  44 Hback  148 Hpol P
                  Vfront    4 Vsync   5 Vback   36 Vpol P
Checksum: 0xd0  Unused space in Extension Block: 3 bytes

----------------

Warnings:

Block 1, CTA-861 Extension Block:
  Display Product Serial Number is set, so the Serial Number in the Base EDID should be 0.
  Add a Colorimetry Data Block with the sRGB colorimetry bit set to avoid interop issues.
Block 3, CTA-861 Extension Block:
  Display Product Serial Number is set, so the Serial Number in the Base EDID should be 0.
  Add a Colorimetry Data Block with the sRGB colorimetry bit set to avoid interop issues.
EDID:
  CTA-861: Multiple native progressive timings are defined.

Failures:

Block 1, CTA-861 Extension Block:
  Missing VCDB, needed for Set Selectable RGB Quantization to avoid interop issues.
Block 2, Base EDID:
  Unknown Extension Block.
Block 3, CTA-861 Extension Block:
  Video Data Block: Duplicate VIC 16.
  Video Data Block: Duplicate VIC 5.
  Video Data Block: Duplicate VIC 4.
  Video Data Block: Duplicate VIC 3.
  Video Data Block: Duplicate VIC 2.
  Video Data Block: Duplicate VIC 1.
  Video Data Block: Duplicate VIC 17.
  Video Data Block: Duplicate VIC 18.
  Video Data Block: Duplicate VIC 19.
  Video Data Block: Duplicate VIC 20.
  Video Data Block: Duplicate VIC 6.
  Video Data Block: Duplicate VIC 7.
  Video Data Block: Duplicate VIC 21.
  Video Data Block: Duplicate VIC 22.
  Video Data Block: Duplicate VIC 31.
  Speaker Allocation Data Block: Only one instance of this Data Block is allowed.
  Missing VCDB, needed for Set Selectable RGB Quantization to avoid interop issues.
EDID:
  Base EDID: Some timings are out of range of the Monitor Ranges:
    Vertical Freq: 50.000 - 66.667 Hz (Monitor: 55.000 - 76.000 Hz)
    Horizontal Freq: 15.625 - 75.000 kHz (Monitor: 30.000 - 84.000 kHz)
  Base EDID: EDID specified 1 extension block(s), but found 3 extension block(s).
  Base EDID: EDID 1.3 requires a Block Map Extension in Block 1 if there are more than 2 blocks in the EDID.

EDID conformity: FAIL
