
EDID (hex):
00ffffffffffff0026cd036601010101
09140103813722782a7b65a555489926
125054bdef80714f8180818f9500950f
a940b3000101283c80a070b023403020
360026582100001a1a3680a070381f40
5020850426582100001a000000fd0037
4c1d5111000a202020202020000000fc
00504c45323630375753440a20200082

Extracted contents:
header:          00 ff ff ff ff ff ff 00
serial number:   26 cd 03 66 01 01 01 01 09 14
version:         01 03
basic params:    81 37 22 78 2a
chroma info:     7b 65 a5 55 48 99 26 12 50 54
established:     bd ef 80
standard:        71 4f 81 80 81 8f 95 00 95 0f a9 40 b3 00 01 01
descriptor 1:    28 3c 80 a0 70 b0 23 40 30 20 36 00 26 58 21 00 00 1a
descriptor 2:    1a 36 80 a0 70 38 1f 40 50 20 85 04 26 58 21 00 00 1a
descriptor 3:    00 00 00 fd 00 37 4c 1d 51 11 00 0a 20 20 20 20 20 20
descriptor 4:    00 00 00 fc 00 50 4c 45 32 36 30 37 57 53 44 0a 20 20
extensions:      00
checksum:        82

EDID version: 1.3
Manufacturer: IVM Model 6603 Serial Number --
Made in week 9 of 2010
Digital display
DFP 1.x compatible TMDS
Maximum image size: 55 cm x 34 cm
Gamma: 2.20
DPMS levels: Off
RGB color display
First detailed timing is preferred timing
Display x,y Chromaticity:
  Red:   0.6455, 0.3349
  Green: 0.2832, 0.6005
  Blue:  0.1494, 0.0722
  White: 0.3134, 0.3291
Established timings supported:
  720x400@70Hz 9:5 HorFreq: 31469 Hz Clock: 28.320 MHz
  640x480@60Hz 4:3 HorFreq: 31469 Hz Clock: 25.175 MHz
  640x480@67Hz 4:3 HorFreq: 35000 Hz Clock: 30.240 MHz
  640x480@72Hz 4:3 HorFreq: 37900 Hz Clock: 31.500 MHz
  640x480@75Hz 4:3 HorFreq: 37500 Hz Clock: 31.500 MHz
  800x600@60Hz 4:3 HorFreq: 37900 Hz Clock: 40.000 MHz
  800x600@72Hz 4:3 HorFreq: 48100 Hz Clock: 50.000 MHz
  800x600@75Hz 4:3 HorFreq: 46900 Hz Clock: 49.500 MHz
  832x624@75Hz 4:3 HorFreq: 49726 Hz Clock: 57.284 MHz
  1024x768@60Hz 4:3 HorFreq: 48400 Hz Clock: 65.000 MHz
  1024x768@70Hz 4:3 HorFreq: 56500 Hz Clock: 75.000 MHz
  1024x768@75Hz 4:3 HorFreq: 60000 Hz Clock: 78.750 MHz
  1280x1024@75Hz 5:4 HorFreq: 80000 Hz Clock: 135.000 MHz
  1152x870@75Hz 192:145 HorFreq: 67500 Hz Clock: 108.000 MHz
Standard timings supported:
  1152x864@75Hz 4:3 HorFreq: 67500 Hz Clock: 108.000 MHz
  1280x1024@60Hz 5:4 HorFreq: 64000 Hz Clock: 108.000 MHz
  1280x1024@75Hz 5:4 HorFreq: 80000 Hz Clock: 135.000 MHz
  1440x900@60Hz 16:10 HorFreq: 55500 Hz Clock: 88.750 MHz
  1440x900@75Hz 16:10 HorFreq: 82300 Hz Clock: 156.000 MHz
  1600x1200@60Hz 4:3 HorFreq: 75000 Hz Clock: 162.000 MHz
  1680x1050@60Hz 16:10 HorFreq: 64700 Hz Clock: 119.000 MHz
Detailed mode: Clock 154.000 MHz, 550 mm x 344 mm
               1920 1968 2000 2080 hborder 0
               1200 1203 1209 1235 vborder 0
               +hsync -vsync 
               VertFreq: 59 Hz, HorFreq: 74038 Hz
Detailed mode: Clock 138.500 MHz, 550 mm x 344 mm
               1920 2000 2032 2080 hborder 0
               1080 1104 1109 1111 vborder 0
               +hsync -vsync 
               VertFreq: 59 Hz, HorFreq: 66586 Hz
Monitor ranges (GTF): 55-76Hz V, 29-81kHz H, max dotclock 170MHz
Monitor name: PLE2607WSD
Checksum: 0x82 (valid)
One or more of the timings is out of range of the Monitor Ranges:
  Vertical Freq: 59 - 75 Hz
  Horizontal Freq: 31469 - 82300 Hz
  Maximum Clock: 162.000 MHz


