
EDID (hex):
00ffffffffffff0006b341169ecc0000
131c0104a52213783a28659759548e27
1e5054a10800b30095008180814081c0
010101010101023a801871382d40582c
450058c21000001e000000ff004a354c
4d54463035323338320a000000fd0032
4b185311000a202020202020000000fc
0041535553204d42313641430a2001e3
02030a3165030c001000000000000000
00000000000000000000000000000000
00000000000000000000000000000000
00000000000000000000000000000000
00000000000000000000000000000000
00000000000000000000000000000000
00000000000000000000000000000000
0000000000000000000000000000003c

Extracted contents:
header:          00 ff ff ff ff ff ff 00
serial number:   06 b3 41 16 9e cc 00 00 13 1c
version:         01 04
basic params:    a5 22 13 78 3a
chroma info:     28 65 97 59 54 8e 27 1e 50 54
established:     a1 08 00
standard:        b3 00 95 00 81 80 81 40 81 c0 01 01 01 01 01 01
descriptor 1:    02 3a 80 18 71 38 2d 40 58 2c 45 00 58 c2 10 00 00 1e
descriptor 2:    00 00 00 ff 00 4a 35 4c 4d 54 46 30 35 32 33 38 32 0a
descriptor 3:    00 00 00 fd 00 32 4b 18 53 11 00 0a 20 20 20 20 20 20
descriptor 4:    00 00 00 fc 00 41 53 55 53 20 4d 42 31 36 41 43 0a 20
extensions:      01
checksum:        e3

EDID version: 1.4
Manufacturer: AUS Model 1641 Serial Number --
Made in week 19 of 2018
Digital display
8 bits per primary color channel
DisplayPort interface
Maximum image size: 34 cm x 19 cm
Gamma: 2.20
DPMS levels: Off
Supported color formats: RGB 4:4:4, YCrCb 4:4:4, YCrCb 4:2:2
First detailed timing includes the native pixel format and preferred refresh rate
Display x,y Chromaticity:
  Red:   0.5898, 0.3496
  Green: 0.3300, 0.5546
  Blue:  0.1533, 0.1191
  White: 0.3134, 0.3291
Established timings supported:
  720x400@70Hz 9:5 HorFreq: 31469 Hz Clock: 28.320 MHz
  640x480@60Hz 4:3 HorFreq: 31469 Hz Clock: 25.175 MHz
  800x600@60Hz 4:3 HorFreq: 37900 Hz Clock: 40.000 MHz
  1024x768@60Hz 4:3 HorFreq: 48400 Hz Clock: 65.000 MHz
Standard timings supported:
  1680x1050@60Hz 16:10 HorFreq: 64700 Hz Clock: 119.000 MHz
  1440x900@60Hz 16:10 HorFreq: 55500 Hz Clock: 88.750 MHz
  1280x1024@60Hz 5:4 HorFreq: 64000 Hz Clock: 108.000 MHz
  1280x960@60Hz 4:3 HorFreq: 60000 Hz Clock: 108.000 MHz
  1280x720@60Hz 16:9
Detailed mode: Clock 148.500 MHz, 344 mm x 194 mm
               1920 2008 2052 2200 hborder 0
               1080 1084 1089 1125 vborder 0
               +hsync +vsync 
               VertFreq: 60 Hz, HorFreq: 67500 Hz
Serial number: --
Monitor ranges (GTF): 50-75Hz V, 24-83kHz H, max dotclock 170MHz
Monitor name: ASUS MB16AC
Has 1 extension blocks
Checksum: 0xe3 (valid)

CTA extension block
Extension version: 3
6 bytes of CTA data
  Vendor-specific data block, OUI 000c03 (HDMI)
    Source physical address 1.0.0.0
Supports YCbCr 4:4:4
Supports YCbCr 4:2:2
1 native detailed modes
Checksum: 0x3c (valid)

EDID block does not conform at all!
	Both the serial number and the serial string are set


