edid-decode (hex):

00 ff ff ff ff ff ff 00 09 e5 fa 08 00 00 00 00
01 1d 01 04 a5 1d 11 78 0a a4 7a a9 53 4c 9c 26
12 50 56 00 00 00 01 01 01 01 01 01 01 01 01 01
01 01 01 01 01 01 c6 39 80 18 71 38 28 40 30 20
36 00 26 a5 10 00 00 1a 00 00 00 00 00 00 00 00
00 00 00 00 00 00 00 00 00 00 00 00 00 fe 00 42
4f 45 20 48 46 0a 20 20 20 20 20 20 00 00 00 fe
00 4e 45 31 33 33 46 48 4d 4e 35 37 42 0a 00 36

----------------

Block 0, Base EDID:
  EDID Structure Version & Revision: 1.4
  Vendor & Product Identification:
    Manufacturer: BOE
    Model: 2298
    Made in: week 1 of 2019
  Basic Display Parameters & Features:
    Digital display
    Bits per primary color channel: 8
    DisplayPort interface
    Maximum image size: 29 cm x 17 cm
    Gamma: 2.20
    Supported color formats: RGB 4:4:4, YCrCb 4:4:4
    First detailed timing includes the native pixel format and preferred refresh rate
  Color Characteristics:
    Red  : 0.6621, 0.3261
    Green: 0.2978, 0.6093
    Blue : 0.1494, 0.0732
    White: 0.3144, 0.3378
  Established Timings I & II: none
  Standard Timings: none
  Detailed Timing Descriptors:
    DTD 1:  1920x1080   60.024351 Hz  16:9     67.227 kHz    147.900000 MHz (294 mm x 165 mm)
                 Hfront   48 Hsync  32 Hback  200 Hpol P
                 Vfront    3 Vsync   6 Vback   31 Vpol N
    Empty Descriptor
    Alphanumeric Data String: 'BOE HF'
    Alphanumeric Data String: 'NE133FHMN57B'
Checksum: 0x36

----------------

Warnings:

Block 0, Base EDID:
  Missing Display Product Name.

Failures:

Block 0, Base EDID:
  Empty Descriptor: Use Dummy Descriptor instead of all zeroes.

EDID conformity: FAIL
