edid-decode (hex):

00 ff ff ff ff ff ff 00 06 10 37 a0 00 00 00 00
1c 1a 01 04 b5 1d 12 78 02 0f d1 ae 52 43 b0 26
0e 50 54 00 00 00 01 01 01 01 01 01 01 01 01 01
01 01 01 01 01 01 d9 65 00 50 a0 40 2e 60 08 20
08 08 1e b3 10 00 00 1a 7c 80 40 50 b0 08 34 70
08 20 68 08 1e b3 10 00 00 1a 00 00 00 fc 00 43
6f 6c 6f 72 20 4c 43 44 0a 20 20 20 00 00 00 10
00 00 00 00 00 00 00 00 00 00 00 00 00 00 00 b3

00 ff ff ff ff ff ff 00 06 10 37 a0 00 00 00 00
1c 1a 01 04 b5 1d 12 78 02 0f d1 ae 52 43 b0 26
0e 50 54 00 00 00 01 01 01 01 01 01 01 01 01 01
01 01 01 01 01 01 d9 65 00 50 a0 40 2e 60 08 20
08 08 1e b3 10 00 00 1a 7c 80 40 50 b0 08 34 70
08 20 68 08 1e b3 10 00 00 1a 00 00 00 fc 00 43
6f 6c 6f 72 20 4c 43 44 0a 20 20 20 00 00 00 10
00 00 00 00 00 00 00 00 00 00 00 00 00 00 00 b3

----------------

Block 0, Base EDID:
  EDID Structure Version & Revision: 1.4
  Vendor & Product Identification:
    Manufacturer: APP
    Model: 41015
    Made in: week 28 of 2016
  Basic Display Parameters & Features:
    Digital display
    Bits per primary color channel: 10
    DisplayPort interface
    Maximum image size: 29 cm x 18 cm
    Gamma: 2.20
    Supported color formats: RGB 4:4:4
    First detailed timing includes the native pixel format and preferred refresh rate
  Color Characteristics:
    Red  : 0.6796, 0.3203
    Green: 0.2646, 0.6904
    Blue : 0.1513, 0.0556
    White: 0.3125, 0.3291
  Established Timings I & II: none
  Standard Timings: none
  Detailed Timing Descriptors:
    DTD 1:  2560x1600   60.000828 Hz  16:10    98.761 kHz    260.730000 MHz (286 mm x 179 mm)
                 Hfront    8 Hsync  32 Hback   40 Hpol P
                 Vfront   32 Vsync   8 Vback    6 Vpol N
    DTD 2:  2880x1800   60.000876 Hz  16:10   111.122 kHz    328.920000 MHz (286 mm x 179 mm)
                 Hfront    8 Hsync  32 Hback   40 Hpol P
                 Vfront   38 Vsync   8 Vback    6 Vpol N
    Display Product Name: 'Color LCD'
    Dummy Descriptor:
Checksum: 0xb3

----------------

Block 1, Unknown EDID Extension Block 0x00:
  00 ff ff ff ff ff ff 00 06 10 37 a0 00 00 00 00 '..........7.....'
  1c 1a 01 04 b5 1d 12 78 02 0f d1 ae 52 43 b0 26 '.......x....RC.&'
  0e 50 54 00 00 00 01 01 01 01 01 01 01 01 01 01 '.PT.............'
  01 01 01 01 01 01 d9 65 00 50 a0 40 2e 60 08 20 '.......e.P.@.`. '
  08 08 1e b3 10 00 00 1a 7c 80 40 50 b0 08 34 70 '........|.@P..4p'
  08 20 68 08 1e b3 10 00 00 1a 00 00 00 fc 00 43 '. h............C'
  6f 6c 6f 72 20 4c 43 44 0a 20 20 20 00 00 00 10 'olor LCD.   ....'
  00 00 00 00 00 00 00 00 00 00 00 00 00 00 00 b3 '................'
Checksum: 0xb3

----------------

Failures:

Block 1, Base EDID:
  Unknown Extension Block.
EDID:
  Base EDID: EDID specified 0 extension block(s), but found 1 extension block(s).

EDID conformity: FAIL
