edid-decode (hex):

00 ff ff ff ff ff ff 00 5c 94 e4 1b 7c 03 00 00
2b 16 01 03 80 2b 19 78 0a 81 dd a2 55 48 9d 25
0e 47 4a a1 08 00 95 00 61 40 b3 00 01 01 01 01
01 01 01 01 01 01 7f 21 56 aa 51 00 1e 30 46 8f
33 00 00 00 00 00 00 1e 00 00 00 ff 00 37 31 34
30 59 32 34 33 30 30 38 39 32 00 00 00 fd 00 3b
3d 0f 44 0f 00 0a 20 20 20 20 20 20 00 00 00 fc
00 55 57 33 37 53 43 31 57 0a 20 20 20 20 01 f2

----------------

Block 0, Base EDID:
  EDID Structure Version & Revision: 1.3
  Vendor & Product Identification:
    Manufacturer: WDT
    Model: 7140
    Serial Number: ...
    Made in: week 43 of 2012
  Basic Display Parameters & Features:
    Digital display
    Maximum image size: 43 cm x 25 cm
    Gamma: 2.20
    RGB color display
    First detailed timing is the preferred timing
  Color Characteristics:
    Red  : 0.6347, 0.3320
    Green: 0.2812, 0.6142
    Blue : 0.1474, 0.0556
    White: 0.2802, 0.2900
  Established Timings I & II:
    IBM     :   720x400    70.081663 Hz   9:5     31.467 kHz     28.320000 MHz
    DMT 0x04:   640x480    59.940476 Hz   4:3     31.469 kHz     25.175000 MHz
    DMT 0x09:   800x600    60.316541 Hz   4:3     37.879 kHz     40.000000 MHz
    DMT 0x10:  1024x768    60.003840 Hz   4:3     48.363 kHz     65.000000 MHz
  Standard Timings:
    DMT 0x2f:  1440x900    59.887445 Hz  16:10    55.935 kHz    106.500000 MHz
    DMT 0x10:  1024x768    60.003840 Hz   4:3     48.363 kHz     65.000000 MHz
    DMT 0x3a:  1680x1050   59.954250 Hz  16:10    65.290 kHz    146.250000 MHz
  Detailed Timing Descriptors:
    DTD 1:  1366x768    59.964364 Hz 683:384   47.852 kHz     85.750000 MHz
                 Hfront   70 Hsync 143 Hback  213 Hpol P
                 Vfront    3 Vsync   3 Vback   24 Vpol P
    Display Product Serial Number: ...
    Display Range Limits:
      Monitor ranges (GTF): 59-61 Hz V, 15-68 kHz H, max dotclock 150 MHz
    Display Product Name: 'UW37SC1W'
  Extension blocks: 1
Checksum: 0xf2

----------------

Failures:

Block 0, Base EDID:
  Detailed Timing Descriptor #1: Mismatch of image size vs display size: image size is not set, but display size is.
  Base EDID: EDID specified 1 extension block(s), but found 0 extension block(s).
EDID:
  Base EDID: Some timings are out of range of the Monitor Ranges:
    Vertical Freq: 59.887 - 70.082 Hz (Monitor: 59.000 - 61.000 Hz)

EDID conformity: FAIL
