
EDID (hex):
00ffffffffffff000e14c01b00000000
0c14010380160c780af88d90575a9227
20505400000001010101010101010101
0101010101014c1d00d0435819203020
3600df7d000000190000000f00202020
20202020203cd2050f00000000fe0043
50540a202020202020202020000000fe
00434c41413130314e423033410a0047

Extracted contents:
header:          00 ff ff ff ff ff ff 00
serial number:   0e 14 c0 1b 00 00 00 00 0c 14
version:         01 03
basic params:    80 16 0c 78 0a
chroma info:     f8 8d 90 57 5a 92 27 20 50 54
established:     00 00 00
standard:        01 01 01 01 01 01 01 01 01 01 01 01 01 01 01 01
descriptor 1:    4c 1d 00 d0 43 58 19 20 30 20 36 00 df 7d 00 00 00 19
descriptor 2:    00 00 00 0f 00 20 20 20 20 20 20 20 20 3c d2 05 0f 00
descriptor 3:    00 00 00 fe 00 43 50 54 0a 20 20 20 20 20 20 20 20 20
descriptor 4:    00 00 00 fe 00 43 4c 41 41 31 30 31 4e 42 30 33 41 0a
extensions:      00
checksum:        47

EDID version: 1.3
Manufacturer: CPT Model 1bc0 Serial Number --
Made in week 12 of 2010
Digital display
Maximum image size: 22 cm x 12 cm
Gamma: 2.20
RGB color display
First detailed timing is preferred timing
Display x,y Chromaticity:
  Red:   0.5654, 0.3427
  Green: 0.3535, 0.5703
  Blue:  0.1542, 0.1250
  White: 0.3154, 0.3291
Established timings supported:
Standard timings supported:
Detailed mode: Clock 75.000 MHz, 223 mm x 125 mm
               1024 1072 1104 2000 hborder 0
                600  603  609  625 vborder 0
               -hsync -vsync 
               VertFreq: 60 Hz, HorFreq: 37500 Hz
Manufacturer-specified data, tag 15
ASCII string: CPT
ASCII string: CLAA101NB03A
Checksum: 0x47 (valid)
EDID block does NOT conform to EDID 1.3!
	Missing name descriptor
	Missing monitor ranges
