edid-decode (hex):

00 ff ff ff ff ff ff 00 26 cf 79 8c 04 00 00 00
00 1f 01 04 a5 1f 11 78 0b de 50 a3 54 4c 99 26
0f 50 54 00 00 00 01 01 01 01 01 01 01 01 01 01
01 01 01 01 01 01 38 36 80 a0 70 38 20 40 18 30
3c 00 35 ae 10 00 00 19 00 00 00 fe 00 58 31 34
30 4e 56 46 43 20 52 31 20 0a 00 00 00 03 00 03
54 d8 04 64 7d 13 0c 19 af 00 00 00 00 00 00 03
00 19 51 ff 64 a0 f4 15 0c 4a f4 01 01 00 00 cb

00 ff ff ff ff ff ff 00 26 cf 79 8c 04 00 00 00
00 1f 01 04 a5 1f 11 78 0b de 50 a3 54 4c 99 26
0f 50 54 00 00 00 01 01 01 01 01 01 01 01 01 01
01 01 01 01 01 01 38 36 80 a0 70 38 20 40 18 30
3c 00 35 ae 10 00 00 19 00 00 00 fe 00 58 31 34
30 4e 56 46 43 20 52 31 20 0a 00 00 00 03 00 03
54 d8 04 64 7d 13 0c 19 af 00 00 00 00 00 00 03
00 19 51 ff 64 a0 f4 15 0c 4a f4 01 01 00 00 cb

----------------

Block 0, Base EDID:
  EDID Structure Version & Revision: 1.4
  Vendor & Product Identification:
    Manufacturer: IVO
    Model: 35961
    Serial Number: ...
    Made in: 2021
  Basic Display Parameters & Features:
    Digital display
    Bits per primary color channel: 8
    DisplayPort interface
    Maximum image size: 31 cm x 17 cm
    Gamma: 2.20
    Supported color formats: RGB 4:4:4, YCrCb 4:4:4
    First detailed timing includes the native pixel format and preferred refresh rate
    Display is continuous frequency
  Color Characteristics:
    Red  : 0.6396, 0.3291
    Green: 0.2998, 0.5996
    Blue : 0.1494, 0.0595
    White: 0.3125, 0.3281
  Established Timings I & II: none
  Standard Timings: none
  Detailed Timing Descriptors:
    DTD 1:  1920x1080   60.009685 Hz  16:9     66.731 kHz    138.800000 MHz (309 mm x 174 mm)
                 Hfront   24 Hsync  48 Hback   88 Hpol N
                 Vfront    3 Vsync  12 Vback   17 Vpol N
    Alphanumeric Data String: 'X140NVFC R1 '
    Manufacturer-Specified Display Descriptor (0x03): 00 03 00 03 54 d8 04 64 7d 13 0c 19 af 00 00 00 '....T..d}.......'
    Manufacturer-Specified Display Descriptor (0x03): 00 03 00 19 51 ff 64 a0 f4 15 0c 4a f4 01 01 00 '....Q.d....J....'
Checksum: 0xcb

----------------

Block 1, Unknown EDID Extension Block 0x00:
  00 ff ff ff ff ff ff 00 26 cf 79 8c 04 00 00 00 '........&.y.....'
  00 1f 01 04 a5 1f 11 78 0b de 50 a3 54 4c 99 26 '.......x..P.TL.&'
  0f 50 54 00 00 00 01 01 01 01 01 01 01 01 01 01 '.PT.............'
  01 01 01 01 01 01 38 36 80 a0 70 38 20 40 18 30 '......86..p8 @.0'
  3c 00 35 ae 10 00 00 19 00 00 00 fe 00 58 31 34 '<.5..........X14'
  30 4e 56 46 43 20 52 31 20 0a 00 00 00 03 00 03 '0NVFC R1 .......'
  54 d8 04 64 7d 13 0c 19 af 00 00 00 00 00 00 03 'T..d}...........'
  00 19 51 ff 64 a0 f4 15 0c 4a f4 01 01 00 00 cb '..Q.d....J......'
Checksum: 0xcb

----------------

Warnings:

Block 0, Base EDID:
  Missing Display Product Name.

Failures:

Block 0, Base EDID:
  Alphanumeric Data String: One or more trailing spaces.
  Missing Display Range Limits Descriptor.
Block 1, Base EDID:
  Unknown Extension Block.
EDID:
  Base EDID: EDID specified 0 extension block(s), but found 1 extension block(s).

EDID conformity: FAIL
