edid-decode (hex):

00 ff ff ff ff ff ff 00 38 70 1c 00 00 00 00 00
00 1b 01 04 95 22 13 78 06 9a 85 97 5c 57 8e 28
1c 50 54 00 00 00 01 01 01 01 01 01 01 01 01 01
01 01 01 01 01 01 99 36 80 a0 70 38 28 40 30 20
36 00 58 c2 10 00 00 18 ae 2b 80 a0 70 38 28 40
30 20 36 00 58 c2 10 00 00 18 00 00 00 10 00 00
00 00 00 00 00 00 00 00 00 00 00 00 00 00 00 fc
00 4c 4d 31 35 36 4c 46 31 4c 30 33 0a 20 00 76

----------------

Block 0, Base EDID:
  EDID Structure Version & Revision: 1.4
  Vendor & Product Identification:
    Manufacturer: NCP
    Model: 28
    Made in: 2017
  Basic Display Parameters & Features:
    Digital display
    Bits per primary color channel: 6
    DisplayPort interface
    Maximum image size: 34 cm x 19 cm
    Gamma: 2.20
    Supported color formats: RGB 4:4:4
    Default (sRGB) color space is primary color space
    First detailed timing includes the native pixel format and preferred refresh rate
  Color Characteristics:
    Red  : 0.5917, 0.3603
    Green: 0.3417, 0.5566
    Blue : 0.1582, 0.1093
    White: 0.3134, 0.3291
  Established Timings I & II: none
  Standard Timings: none
  Detailed Timing Descriptors:
    DTD 1:  1920x1080   59.997 Hz  16:9    67.197 kHz 139.770 MHz (344 mm x 194 mm)
                 Hfront   48 Hsync  32 Hback  80 Hpol N
                 Vfront    3 Vsync   6 Vback  31 Vpol N
    DTD 2:  1920x1080   48.000 Hz  16:9    53.760 kHz 111.820 MHz (344 mm x 194 mm)
                 Hfront   48 Hsync  32 Hback  80 Hpol N
                 Vfront    3 Vsync   6 Vback  31 Vpol N
    Dummy Descriptor:
    Display Product Name: 'LM156LF1L03'
Checksum: 0x76
