edid-decode (hex):

00 ff ff ff ff ff ff 00 30 ae 52 11 01 01 01 01
32 11 01 03 80 29 1a 78 ef e5 b5 a3 55 49 99 27
13 50 54 af cf 10 31 46 81 c0 81 8a 81 8c 81 90
95 00 95 0f 71 4f 9a 29 a0 d0 51 84 22 30 50 98
36 00 9a 01 11 00 00 1c 00 00 00 fc 00 4c 31 39
34 20 57 69 64 65 0a 20 20 20 00 00 00 fd 00 32
4c 1e 51 0e 00 0a 20 20 20 20 20 20 00 00 00 ff
00 37 35 30 30 30 37 33 32 0a 20 20 20 20 00 7a

00 ff ff ff ff ff ff 00 30 ae 52 11 01 01 01 01
32 11 01 03 80 29 1a 78 ef e5 b5 a3 55 49 99 27
13 50 54 af cf 10 31 46 81 c0 81 8a 81 8c 81 90
95 00 95 0f 71 4f 9a 29 a0 d0 51 84 22 30 50 98
36 00 9a 01 11 00 00 1c 00 00 00 fc 00 4c 31 39
34 20 57 69 64 65 0a 20 20 20 00 00 00 fd 00 32
4c 1e 51 0e 00 0a 20 20 20 20 20 20 00 00 00 ff
00 37 35 30 30 30 37 33 32 0a 20 20 20 20 00 7a

----------------

Block 0, Base EDID:
  EDID Structure Version & Revision: 1.3
  Vendor & Product Identification:
    Manufacturer: LEN
    Model: 4434
    Serial Number: ...
    Made in: week 50 of 2007
  Basic Display Parameters & Features:
    Digital display
    Maximum image size: 41 cm x 26 cm
    Gamma: 2.20
    DPMS levels: Standby Suspend Off
    RGB color display
    Default (sRGB) color space is primary color space
    First detailed timing is the preferred timing
    Supports GTF timings within operating range
  Color Characteristics:
    Red  : 0.6396, 0.3339
    Green: 0.2861, 0.5986
    Blue : 0.1542, 0.0771
    White: 0.3134, 0.3291
  Established Timings I & II:
    IBM     :   720x400    70.081663 Hz   9:5     31.467 kHz     28.320000 MHz
    DMT 0x04:   640x480    59.940476 Hz   4:3     31.469 kHz     25.175000 MHz
    DMT 0x05:   640x480    72.808802 Hz   4:3     37.861 kHz     31.500000 MHz
    DMT 0x06:   640x480    75.000000 Hz   4:3     37.500 kHz     31.500000 MHz
    DMT 0x08:   800x600    56.250000 Hz   4:3     35.156 kHz     36.000000 MHz
    DMT 0x09:   800x600    60.316541 Hz   4:3     37.879 kHz     40.000000 MHz
    DMT 0x0a:   800x600    72.187572 Hz   4:3     48.077 kHz     50.000000 MHz
    DMT 0x0b:   800x600    75.000000 Hz   4:3     46.875 kHz     49.500000 MHz
    DMT 0x10:  1024x768    60.003840 Hz   4:3     48.363 kHz     65.000000 MHz
    DMT 0x11:  1024x768    70.069359 Hz   4:3     56.476 kHz     75.000000 MHz
    DMT 0x12:  1024x768    75.028582 Hz   4:3     60.023 kHz     78.750000 MHz
    DMT 0x24:  1280x1024   75.024675 Hz   5:4     79.976 kHz    135.000000 MHz
  Standard Timings:
    GTF     :   640x480    65.999646 Hz   4:3     32.934 kHz     26.874000 MHz
    DMT 0x55:  1280x720    60.000000 Hz  16:9     45.000 kHz     74.250000 MHz
    GTF     :  1280x1024   69.999805 Hz   5:4     74.620 kHz    128.943000 MHz
    GTF     :  1280x1024   72.000069 Hz   5:4     76.824 kHz    132.752000 MHz
    GTF     :  1280x1024   75.999957 Hz   5:4     81.320 kHz    141.822000 MHz
    DMT 0x2f:  1440x900    59.887445 Hz  16:10    55.935 kHz    106.500000 MHz
    DMT 0x30:  1440x900    74.984427 Hz  16:10    70.635 kHz    136.750000 MHz
    DMT 0x15:  1152x864    75.000000 Hz   4:3     67.500 kHz    108.000000 MHz
  Detailed Timing Descriptors:
    DTD 1:  1440x900    59.887445 Hz  16:10    55.935 kHz    106.500000 MHz (410 mm x 257 mm)
                 Hfront   80 Hsync 152 Hback  232 Hpol N
                 Vfront    3 Vsync   6 Vback   25 Vpol P
    Display Product Name: 'L194 Wide'
    Display Range Limits:
      Monitor ranges (GTF): 50-76 Hz V, 30-81 kHz H, max dotclock 140 MHz
    Display Product Serial Number: ...
Checksum: 0x7a

----------------

Block 1, Unknown EDID Extension Block 0x00:
  00 ff ff ff ff ff ff 00 30 ae 52 11 01 01 01 01 '........0.R.....'
  32 11 01 03 80 29 1a 78 ef e5 b5 a3 55 49 99 27 '2....).x....UI.''
  13 50 54 af cf 10 31 46 81 c0 81 8a 81 8c 81 90 '.PT...1F........'
  95 00 95 0f 71 4f 9a 29 a0 d0 51 84 22 30 50 98 '....qO.)..Q."0P.'
  36 00 9a 01 11 00 00 1c 00 00 00 fc 00 4c 31 39 '6............L19'
  34 20 57 69 64 65 0a 20 20 20 00 00 00 fd 00 32 '4 Wide.   .....2'
  4c 1e 51 0e 00 0a 20 20 20 20 20 20 00 00 00 ff 'L.Q...      ....'
  00 37 35 30 30 30 37 33 32 0a 20 20 20 20 00 7a '.75000732.    .z'
Checksum: 0x7a

----------------

Warnings:

EDID:
  Base EDID: Some timings are out of range of the Monitor Ranges:
    Maximum Clock: 141.822 MHz (Monitor: 140.000 MHz)
    Could be due to a Monitor Range off-by-one rounding issue

Failures:

Block 0, Base EDID:
  Basic Display Parameters & Features: sRGB is signaled, but the chromaticities do not match.
Block 1, Base EDID:
  Unknown Extension Block.
EDID:
  Base EDID: EDID specified 0 extension block(s), but found 1 extension block(s).

EDID conformity: FAIL
