edid-decode (hex):

00 ff ff ff ff ff ff 00 09 d1 76 76 03 01 00 00
28 0e 01 03 6c 25 16 78 ea c0 f5 a3 57 4a 9c 23
11 4f 54 bd ee 00 01 01 01 01 01 01 01 01 01 01
01 01 01 01 01 01 d8 27 00 98 51 00 25 30 48 80
a7 00 72 de 10 00 00 1e 7c 1f 00 98 51 00 1b 30
5a 80 23 00 72 de 10 00 00 1e 00 00 00 fd 00 37
4c 1f 53 0e 00 0a 20 20 20 20 20 20 00 00 00 fc
00 42 65 6e 51 20 46 50 37 31 57 0a 20 20 00 73

----------------

Block 0, Base EDID:
  EDID Structure Version & Revision: 1.3
  Vendor & Product Identification:
    Manufacturer: BNQ
    Model: 30326
    Serial Number: ...
    Made in: week 40 of 2004
  Basic Display Parameters & Features:
    Analog display
    Signal Level Standard: 0.700 : 0.000 : 0.700 V p-p
    Blank level equals black level
    Sync: Separate Composite
    Maximum image size: 37 cm x 22 cm
    Gamma: 2.20
    DPMS levels: Standby Suspend Off
    RGB color display
    First detailed timing is the preferred timing
  Color Characteristics:
    Red  : 0.6396, 0.3398
    Green: 0.2890, 0.6093
    Blue : 0.1396, 0.0693
    White: 0.3095, 0.3291
  Established Timings I & II:
    IBM     :   720x400    70.081663 Hz   9:5     31.467 kHz     28.320000 MHz
    DMT 0x04:   640x480    59.940476 Hz   4:3     31.469 kHz     25.175000 MHz
    Apple   :   640x480    66.666667 Hz   4:3     35.000 kHz     30.240000 MHz
    DMT 0x05:   640x480    72.808802 Hz   4:3     37.861 kHz     31.500000 MHz
    DMT 0x06:   640x480    75.000000 Hz   4:3     37.500 kHz     31.500000 MHz
    DMT 0x09:   800x600    60.316541 Hz   4:3     37.879 kHz     40.000000 MHz
    DMT 0x0a:   800x600    72.187572 Hz   4:3     48.077 kHz     50.000000 MHz
    DMT 0x0b:   800x600    75.000000 Hz   4:3     46.875 kHz     49.500000 MHz
    Apple   :   832x624    74.551266 Hz   4:3     49.726 kHz     57.284000 MHz
    DMT 0x10:  1024x768    60.003840 Hz   4:3     48.363 kHz     65.000000 MHz
    DMT 0x11:  1024x768    70.069359 Hz   4:3     56.476 kHz     75.000000 MHz
    DMT 0x12:  1024x768    75.028582 Hz   4:3     60.023 kHz     78.750000 MHz
  Standard Timings: none
  Detailed Timing Descriptors:
    DTD 1:  1280x768    75.064025 Hz   5:3     60.427 kHz    102.000000 MHz (370 mm x 222 mm)
                 Hfront   72 Hsync 128 Hback  208 Hpol P
                 Vfront   10 Vsync   7 Vback   20 Vpol P
    DTD 2:  1280x768    60.061403 Hz   5:3     47.749 kHz     80.600000 MHz (370 mm x 222 mm)
                 Hfront   90 Hsync 128 Hback  190 Hpol P
                 Vfront    2 Vsync   3 Vback   22 Vpol P
    Display Range Limits:
      Monitor ranges (GTF): 55-76 Hz V, 31-83 kHz H, max dotclock 140 MHz
    Display Product Name: 'BenQ FP71W'
Checksum: 0x73

----------------

EDID conformity: PASS
