
EDID (hex):
00ffffffffffff005a63af3601010101
321e0104a5341e783bdcf1a655519d26
0e5054bfef8081c08140818090409500
a940b300a9c0023a801871382d40582c
350009252100001e000000ff00564641
3230353030313135330a000000fd0030
90b4b422010a202020202020000000fc
00565832343538205365726965730166
020323f150010304050790121314161f
2021223f40230907078301000065030c
001000fe5b80a0703835403020350009
252100001e866f80a070384040302035
0009252100001efb7e80887038124018
20350009252100001e8c0ad08a20e02d
10103e9600092521000018011d007251
d01e206e28550009252100001e000096

edid-decode (hex):

00 ff ff ff ff ff ff 00 5a 63 af 36 01 01 01 01
32 1e 01 04 a5 34 1e 78 3b dc f1 a6 55 51 9d 26
0e 50 54 bf ef 80 81 c0 81 40 81 80 90 40 95 00
a9 40 b3 00 a9 c0 02 3a 80 18 71 38 2d 40 58 2c
35 00 09 25 21 00 00 1e 00 00 00 ff 00 56 46 41
32 30 35 30 30 31 31 35 33 0a 00 00 00 fd 00 30
90 b4 b4 22 01 0a 20 20 20 20 20 20 00 00 00 fc
00 56 58 32 34 35 38 20 53 65 72 69 65 73 01 66

02 03 23 f1 50 01 03 04 05 07 90 12 13 14 16 1f
20 21 22 3f 40 23 09 07 07 83 01 00 00 65 03 0c
00 10 00 fe 5b 80 a0 70 38 35 40 30 20 35 00 09
25 21 00 00 1e 86 6f 80 a0 70 38 40 40 30 20 35
00 09 25 21 00 00 1e fb 7e 80 88 70 38 12 40 18
20 35 00 09 25 21 00 00 1e 8c 0a d0 8a 20 e0 2d
10 10 3e 96 00 09 25 21 00 00 18 01 1d 00 72 51
d0 1e 20 6e 28 55 00 09 25 21 00 00 1e 00 00 96

----------------

Block 0, Base EDID:
  EDID Structure Version & Revision: 1.4
  Vendor & Product Identification:
    Manufacturer: VSC
    Model: 13999
    Serial Number: 16843009
    Made in: week 50 of 2020
  Basic Display Parameters & Features:
    Digital display
    Bits per primary color channel: 8
    DisplayPort interface
    Maximum image size: 52 cm x 30 cm
    Gamma: 2.20
    DPMS levels: Off
    Supported color formats: RGB 4:4:4, YCrCb 4:4:4, YCrCb 4:2:2
    First detailed timing includes the native pixel format and preferred refresh rate
    Display is continuous frequency
  Color Characteristics:
    Red  : 0.6513, 0.3330
    Green: 0.3193, 0.6132
    Blue : 0.1513, 0.0576
    White: 0.3125, 0.3291
  Established Timings I & II:
    IBM     :   720x400    70.081663 Hz   9:5     31.467 kHz     28.320000 MHz
    DMT 0x04:   640x480    59.940476 Hz   4:3     31.469 kHz     25.175000 MHz
    Apple   :   640x480    66.666667 Hz   4:3     35.000 kHz     30.240000 MHz
    DMT 0x05:   640x480    72.808802 Hz   4:3     37.861 kHz     31.500000 MHz
    DMT 0x06:   640x480    75.000000 Hz   4:3     37.500 kHz     31.500000 MHz
    DMT 0x08:   800x600    56.250000 Hz   4:3     35.156 kHz     36.000000 MHz
    DMT 0x09:   800x600    60.316541 Hz   4:3     37.879 kHz     40.000000 MHz
    DMT 0x0a:   800x600    72.187572 Hz   4:3     48.077 kHz     50.000000 MHz
    DMT 0x0b:   800x600    75.000000 Hz   4:3     46.875 kHz     49.500000 MHz
    Apple   :   832x624    74.551266 Hz   4:3     49.726 kHz     57.284000 MHz
    DMT 0x10:  1024x768    60.003840 Hz   4:3     48.363 kHz     65.000000 MHz
    DMT 0x11:  1024x768    70.069359 Hz   4:3     56.476 kHz     75.000000 MHz
    DMT 0x12:  1024x768    75.028582 Hz   4:3     60.023 kHz     78.750000 MHz
    DMT 0x24:  1280x1024   75.024675 Hz   5:4     79.976 kHz    135.000000 MHz
    Apple   :  1152x870    75.061550 Hz 192:145   68.681 kHz    100.000000 MHz
  Standard Timings:
    DMT 0x55:  1280x720    60.000000 Hz  16:9     45.000 kHz     74.250000 MHz
    DMT 0x20:  1280x960    60.000000 Hz   4:3     60.000 kHz    108.000000 MHz
    DMT 0x23:  1280x1024   60.019740 Hz   5:4     63.981 kHz    108.000000 MHz
    DMT 0x2a:  1400x1050   59.978442 Hz   4:3     65.317 kHz    121.750000 MHz
    DMT 0x2f:  1440x900    59.887445 Hz  16:10    55.935 kHz    106.500000 MHz
    DMT 0x33:  1600x1200   60.000000 Hz   4:3     75.000 kHz    162.000000 MHz
    DMT 0x3a:  1680x1050   59.954250 Hz  16:10    65.290 kHz    146.250000 MHz
    DMT 0x53:  1600x900    60.000000 Hz  16:9     60.000 kHz    108.000000 MHz (RB)
  Detailed Timing Descriptors:
    DTD 1:  1920x1080   60.000000 Hz  16:9     67.500 kHz    148.500000 MHz (521 mm x 293 mm)
                 Hfront   88 Hsync  44 Hback  148 Hpol P
                 Vfront    3 Vsync   5 Vback   37 Vpol P
    Display Product Serial Number: 'VFA205001153'
    Display Range Limits:
      Monitor ranges (Bare Limits): 48-144 Hz V, 180-180 kHz H, max dotclock 340 MHz
    Display Product Name: 'VX2458 Series'
  Extension blocks: 1
Checksum: 0x66

----------------

Block 1, CTA-861 Extension Block:
  Revision: 3
  Underscans IT Video Formats by default
  Basic audio support
  Supports YCbCr 4:4:4
  Supports YCbCr 4:2:2
  Native detailed modes: 1
  Video Data Block:
    VIC   1:   640x480    59.940476 Hz   4:3     31.469 kHz     25.175000 MHz
    VIC   3:   720x480    59.940060 Hz  16:9     31.469 kHz     27.000000 MHz
    VIC   4:  1280x720    60.000000 Hz  16:9     45.000 kHz     74.250000 MHz
    VIC   5:  1920x1080i  60.000000 Hz  16:9     33.750 kHz     74.250000 MHz
    VIC   7:  1440x480i   59.940060 Hz  16:9     15.734 kHz     27.000000 MHz
    VIC  16:  1920x1080   60.000000 Hz  16:9     67.500 kHz    148.500000 MHz (native)
    VIC  18:   720x576    50.000000 Hz  16:9     31.250 kHz     27.000000 MHz
    VIC  19:  1280x720    50.000000 Hz  16:9     37.500 kHz     74.250000 MHz
    VIC  20:  1920x1080i  50.000000 Hz  16:9     28.125 kHz     74.250000 MHz
    VIC  22:  1440x576i   50.000000 Hz  16:9     15.625 kHz     27.000000 MHz
    VIC  31:  1920x1080   50.000000 Hz  16:9     56.250 kHz    148.500000 MHz
    VIC  32:  1920x1080   24.000000 Hz  16:9     27.000 kHz     74.250000 MHz
    VIC  33:  1920x1080   25.000000 Hz  16:9     28.125 kHz     74.250000 MHz
    VIC  34:  1920x1080   30.000000 Hz  16:9     33.750 kHz     74.250000 MHz
    VIC  63:  1920x1080  120.000000 Hz  16:9    135.000 kHz    297.000000 MHz
    VIC  64:  1920x1080  100.000000 Hz  16:9    112.500 kHz    297.000000 MHz
  Audio Data Block:
    Linear PCM:
      Max channels: 2
      Supported sample rates (kHz): 48 44.1 32
      Supported sample sizes (bits): 24 20 16
  Speaker Allocation Data Block:
    FL/FR - Front Left/Right
  Vendor-Specific Data Block (HDMI), OUI 00-0C-03:
    Source physical address: 1.0.0.0
  Detailed Timing Descriptors:
    DTD 2:  1920x1080   99.930409 Hz  16:9    113.221 kHz    235.500000 MHz (521 mm x 293 mm)
                 Hfront   48 Hsync  32 Hback   80 Hpol P
                 Vfront    3 Vsync   5 Vback   45 Vpol P
    DTD 3:  1920x1080  119.982181 Hz  16:9    137.260 kHz    285.500000 MHz (521 mm x 293 mm)
                 Hfront   48 Hsync  32 Hback   80 Hpol P
                 Vfront    3 Vsync   5 Vback   56 Vpol P
    DTD 4:  1920x1080  143.996336 Hz  16:9    158.108 kHz    325.070000 MHz (521 mm x 293 mm)
                 Hfront   24 Hsync  32 Hback   80 Hpol P
                 Vfront    3 Vsync   5 Vback   10 Vpol P
    DTD 5:   720x480    59.940060 Hz   3:2     31.469 kHz     27.000000 MHz (521 mm x 293 mm)
                 Hfront   16 Hsync  62 Hback   60 Hpol N
                 Vfront    9 Vsync   6 Vback   30 Vpol N
    DTD 6:  1280x720    60.000000 Hz  16:9     45.000 kHz     74.250000 MHz (521 mm x 293 mm)
                 Hfront  110 Hsync  40 Hback  220 Hpol P
                 Vfront    5 Vsync   5 Vback   20 Vpol P
Checksum: 0x96  Unused space in Extension Block: 2 bytes
