
EDID (hex):
00ffffffffffff001e6da75b80d80600
031e010380351e78eaa435a5544f9e27
125054a54b80317c4568457c617c8168
818081bc953cc281808870382a401820
3500132a2100001e023a801871382d40
582c4500132a2100001e000000fd0030
90a0a022000a202020202020000000fc
003234474e3530570a20202020200109
02032ff1230907074b01020304111213
1f903f408301000065030c00100067d8
5dc401448000681a0000010130900080
48801871382d40582c4500132a210000
1e866f80a07038404030203500132a21
00001efe5b80a0703835403020350013
2a21000018000000ff003030334e5441
4244363634300a000000000000000018

Extracted contents:
header:          00 ff ff ff ff ff ff 00
serial number:   1e 6d a7 5b 80 d8 06 00 03 1e
version:         01 03
basic params:    80 35 1e 78 ea
chroma info:     a4 35 a5 54 4f 9e 27 12 50 54
established:     a5 4b 80
standard:        31 7c 45 68 45 7c 61 7c 81 68 81 80 81 bc 95 3c
descriptor 1:    c2 81 80 88 70 38 2a 40 18 20 35 00 13 2a 21 00 00 1e
descriptor 2:    02 3a 80 18 71 38 2d 40 58 2c 45 00 13 2a 21 00 00 1e
descriptor 3:    00 00 00 fd 00 30 90 a0 a0 22 00 0a 20 20 20 20 20 20
descriptor 4:    00 00 00 fc 00 32 34 47 4e 35 30 57 0a 20 20 20 20 20
extensions:      01
checksum:        09

EDID version: 1.3
Manufacturer: GSM Model 5ba7 Serial Number --
Made in week 3 of 2020
Digital display
Maximum image size: 53 cm x 30 cm
Gamma: 2.20
DPMS levels: Standby Suspend Off
RGB color display
First detailed timing is preferred timing
Display x,y Chromaticity:
  Red:   0.6464, 0.3300
  Green: 0.3095, 0.6171
  Blue:  0.1523, 0.0732
  White: 0.3134, 0.3291
Established timings supported:
  720x400@70Hz 9:5 HorFreq: 31469 Hz Clock: 28.320 MHz
  640x480@60Hz 4:3 HorFreq: 31469 Hz Clock: 25.175 MHz
  640x480@75Hz 4:3 HorFreq: 37500 Hz Clock: 31.500 MHz
  800x600@60Hz 4:3 HorFreq: 37900 Hz Clock: 40.000 MHz
  800x600@75Hz 4:3 HorFreq: 46900 Hz Clock: 49.500 MHz
  1024x768@60Hz 4:3 HorFreq: 48400 Hz Clock: 65.000 MHz
  1024x768@75Hz 4:3 HorFreq: 60000 Hz Clock: 78.750 MHz
  1280x1024@75Hz 5:4 HorFreq: 80000 Hz Clock: 135.000 MHz
  1152x870@75Hz 192:145 HorFreq: 67500 Hz Clock: 108.000 MHz
Standard timings supported:
  640x480@120Hz 4:3
  800x600@100Hz 4:3
  800x600@120Hz 4:3
  1024x768@120Hz 4:3
  1280x960@100Hz 4:3
  1280x1024@60Hz 5:4 HorFreq: 64000 Hz Clock: 108.000 MHz
  1280x1024@120Hz 5:4
  1440x900@120Hz 16:10
Detailed mode: Clock 332.180 MHz, 531 mm x 298 mm
               1920 1944 1976 2056 hborder 0
               1080 1083 1088 1122 vborder 0
               +hsync +vsync 
               VertFreq: 143 Hz, HorFreq: 161566 Hz
Detailed mode: Clock 148.500 MHz, 531 mm x 298 mm
               1920 2008 2052 2200 hborder 0
               1080 1084 1089 1125 vborder 0
               +hsync +vsync 
               VertFreq: 60 Hz, HorFreq: 67500 Hz
Monitor ranges (GTF): 48-144Hz V, 160-160kHz H, max dotclock 340MHz
Monitor name: 24GN50W
Has 1 extension blocks
Checksum: 0x9 (valid)

CTA extension block
Extension version: 3
43 bytes of CTA data
  Audio data block
    Linear PCM, max channels 2
      Supported sample rates (kHz): 48 44.1 32
      Supported sample sizes (bits): 24 20 16
  Video data block
    VIC   1 640x480@60Hz 4:3  HorFreq: 31469 Hz Clock: 25.175 MHz
    VIC   2 720x480@60Hz 4:3  HorFreq: 31469 Hz Clock: 27.000 MHz
    VIC   3 720x480@60Hz 16:9  HorFreq: 31469 Hz Clock: 27.000 MHz
    VIC   4 1280x720@60Hz 16:9  HorFreq: 45000 Hz Clock: 74.250 MHz
    VIC  17 720x576@50Hz 4:3  HorFreq: 31250 Hz Clock: 27.000 MHz
    VIC  18 720x576@50Hz 16:9  HorFreq: 31250 Hz Clock: 27.000 MHz
    VIC  19 1280x720@50Hz 16:9  HorFreq: 37500 Hz Clock: 74.250 MHz
    VIC  31 1920x1080@50Hz 16:9  HorFreq: 56250 Hz Clock: 148.500 MHz
    VIC  16 1920x1080@60Hz 16:9 (native) HorFreq: 67500 Hz Clock: 148.500 MHz
    VIC  63 1920x1080@120Hz 16:9  HorFreq: 135000 Hz Clock: 297.000 MHz
    VIC  64 1920x1080@100Hz 16:9  HorFreq: 112500 Hz Clock: 297.000 MHz
  Speaker allocation data block
    Speaker map:
      FL/FR - Front Left/Right
  Vendor-specific data block, OUI 000c03 (HDMI)
    Source physical address 1.0.0.0
  Vendor-specific data block, OUI c45dd8 (HDMI Forum)
    Version: 1
    Maximum TMDS Character Rate: 340MHz
    SCDC Present
  Vendor-specific data block, OUI 00001a
Underscans PC formats by default
Basic audio support
Supports YCbCr 4:4:4
Supports YCbCr 4:2:2
1 native detailed modes
Detailed mode: Clock 185.600 MHz, 531 mm x 298 mm
               1920 2008 2052 2200 hborder 0
               1080 1084 1089 1125 vborder 0
               +hsync +vsync 
               VertFreq: 74 Hz, HorFreq: 84363 Hz
Detailed mode: Clock 285.500 MHz, 531 mm x 298 mm
               1920 1968 2000 2080 hborder 0
               1080 1083 1088 1144 vborder 0
               +hsync +vsync 
               VertFreq: 119 Hz, HorFreq: 137259 Hz
Detailed mode: Clock 235.500 MHz, 531 mm x 298 mm
               1920 1968 2000 2080 hborder 0
               1080 1083 1088 1133 vborder 0
               -hsync -vsync 
               VertFreq: 99 Hz, HorFreq: 113221 Hz
Checksum: 0x18 (valid)

EDID block does NOT conform to EDID 1.3!
	HDMI Forum VSDB Max TMDS rate is > 0 and <= 340 or > 600
One or more of the timings is out of range of the Monitor Ranges:
  Vertical Freq: 50 - 143 Hz
  Horizontal Freq: 31250 - 161566 Hz
  Maximum Clock: 332.180 MHz
