
EDID (hex):
00ffffffffffff0005e3541901010101
24150103682917782a2cc5a45650a128
0f5054afce0081c00101010101010101
010101010101662150b051001b304070
360099e61000001ea91a00a050001630
3020370099e61000001a000000fd0037
4c1e460f000a202020202020000000fc
005439353477650a202020202020006f

Extracted contents:
header:          00 ff ff ff ff ff ff 00
serial number:   05 e3 54 19 01 01 01 01 24 15
version:         01 03
basic params:    68 29 17 78 2a
chroma info:     2c c5 a4 56 50 a1 28 0f 50 54
established:     af ce 00
standard:        81 c0 01 01 01 01 01 01 01 01 01 01 01 01 01 01
descriptor 1:    66 21 50 b0 51 00 1b 30 40 70 36 00 99 e6 10 00 00 1e
descriptor 2:    a9 1a 00 a0 50 00 16 30 30 20 37 00 99 e6 10 00 00 1a
descriptor 3:    00 00 00 fd 00 37 4c 1e 46 0f 00 0a 20 20 20 20 20 20
descriptor 4:    00 00 00 fc 00 54 39 35 34 77 65 0a 20 20 20 20 20 20
extensions:      00
checksum:        6f

EDID version: 1.3
Manufacturer: AOC Model 1954 Serial Number --
Made in week 36 of 2011
Analog display, Input voltage level: 0.7/0.7 V
Sync: Separate 
Maximum image size: 41 cm x 23 cm
Gamma: 2.20
DPMS levels: Off
RGB color display
First detailed timing is preferred timing
Display x,y Chromaticity:
  Red:   0.6406, 0.3378
  Green: 0.3154, 0.6289
  Blue:  0.1591, 0.0585
  White: 0.3134, 0.3291
Established timings supported:
  720x400@70Hz 9:5 HorFreq: 31469 Hz Clock: 28.320 MHz
  640x480@60Hz 4:3 HorFreq: 31469 Hz Clock: 25.175 MHz
  640x480@72Hz 4:3 HorFreq: 37900 Hz Clock: 31.500 MHz
  640x480@75Hz 4:3 HorFreq: 37500 Hz Clock: 31.500 MHz
  800x600@56Hz 4:3 HorFreq: 35200 Hz Clock: 36.000 MHz
  800x600@60Hz 4:3 HorFreq: 37900 Hz Clock: 40.000 MHz
  800x600@72Hz 4:3 HorFreq: 48100 Hz Clock: 50.000 MHz
  800x600@75Hz 4:3 HorFreq: 46900 Hz Clock: 49.500 MHz
  1024x768@60Hz 4:3 HorFreq: 48400 Hz Clock: 65.000 MHz
  1024x768@70Hz 4:3 HorFreq: 56500 Hz Clock: 75.000 MHz
  1024x768@75Hz 4:3 HorFreq: 60000 Hz Clock: 78.750 MHz
Standard timings supported:
  1280x720@60Hz 16:9
Detailed mode: Clock 85.500 MHz, 409 mm x 230 mm
               1360 1424 1536 1792 hborder 0
                768  771  777  795 vborder 0
               +hsync +vsync 
               VertFreq: 60 Hz, HorFreq: 47712 Hz
Detailed mode: Clock 68.250 MHz, 409 mm x 230 mm
               1280 1328 1360 1440 hborder 0
                768  771  778  790 vborder 0
               +hsync -vsync 
               VertFreq: 59 Hz, HorFreq: 47395 Hz
Monitor ranges (GTF): 55-76Hz V, 30-70kHz H, max dotclock 150MHz
Monitor name: T954we
Checksum: 0x6f (valid)
