edid-decode (hex):

00 ff ff ff ff ff ff 00 30 e4 15 03 00 00 00 00
00 15 01 03 80 1d 10 78 ea fa e5 93 58 56 8f 28
20 50 54 00 00 00 01 01 01 01 01 01 01 01 01 01
01 01 01 01 01 01 3a 1b 56 70 50 00 12 30 20 20
35 00 25 a5 10 00 00 19 00 00 00 00 00 00 00 00
00 00 00 00 00 00 00 00 00 00 00 00 00 fe 00 4c
47 20 44 69 73 70 6c 61 79 0a 20 20 00 00 00 fe
00 4c 50 31 33 33 57 48 32 2d 54 4c 4d 35 00 d0

----------------

Block 0, Base EDID:
  EDID Structure Version & Revision: 1.3
  Vendor & Product Identification:
    Manufacturer: LGD
    Model: 789
    Made in: 2011
  Basic Display Parameters & Features:
    Digital display
    Maximum image size: 29 cm x 16 cm
    Gamma: 2.20
    DPMS levels: Standby Suspend Off
    RGB color display
    First detailed timing is the preferred timing
  Color Characteristics:
    Red  : 0.5771, 0.3466
    Green: 0.3378, 0.5605
    Blue : 0.1591, 0.1269
    White: 0.3134, 0.3291
  Established Timings I & II: none
  Standard Timings: none
  Detailed Timing Descriptors:
    DTD 1:  1366x768    59.997865 Hz 683:384   47.158 kHz     69.700000 MHz (293 mm x 165 mm)
                 Hfront   32 Hsync  32 Hback   48 Hpol N
                 Vfront    3 Vsync   5 Vback   10 Vpol N
    Empty Descriptor
    Alphanumeric Data String: 'LG Display'
    Alphanumeric Data String: 'LP133WH2-TLM5'
Checksum: 0xd0

----------------

Failures:

Block 0, Base EDID:
  Empty Descriptor: Use Dummy Descriptor instead of all zeroes.
  Missing Display Product Name.
  Missing Display Range Limits Descriptor.

EDID conformity: FAIL
