edid-decode (hex):

00 ff ff ff ff ff ff 00 26 34 90 f7 f8 00 00 00
07 0d 01 03 0c 20 18 64 e8 57 a8 a4 52 46 97 24
10 48 4c 84 43 00 45 59 61 59 71 4f 81 99 a9 4f
01 01 01 01 01 01 d2 0f 80 a0 20 e0 1a 10 10 40
13 00 40 f0 10 00 00 18 1a 4f 40 30 62 b0 32 40
40 c0 13 00 40 f0 10 00 00 1e 00 00 00 fd 00 32
96 1e 61 ff 00 0a 20 20 20 20 20 20 00 00 00 fc
00 46 37 39 30 44 0a 20 20 20 20 20 20 20 00 23

----------------

Block 0, Base EDID:
  EDID Structure Version & Revision: 1.3
  Vendor & Product Identification:
    Manufacturer: IQT
    Model: 63376
    Serial Number: ...
    Made in: week 7 of 2003
  Basic Display Parameters & Features:
    Analog display
    Signal Level Standard: 0.700 : 0.300 : 1.000 V p-p
    Blank level equals black level
    Sync: Separate Composite
    Maximum image size: 32 cm x 24 cm
    Gamma: 2.00
    DPMS levels: Standby Suspend Off
    RGB color display
  Color Characteristics:
    Red  : 0.6416, 0.3212
    Green: 0.2744, 0.5927
    Blue : 0.1425, 0.0644
    White: 0.2832, 0.2968
  Established Timings I & II:
    IBM     :   720x400    70.081663 Hz   9:5     31.467 kHz     28.320000 MHz
    DMT 0x06:   640x480    75.000000 Hz   4:3     37.500 kHz     31.500000 MHz
    DMT 0x0b:   800x600    75.000000 Hz   4:3     46.875 kHz     49.500000 MHz
    DMT 0x12:  1024x768    75.028582 Hz   4:3     60.023 kHz     78.750000 MHz
    DMT 0x24:  1280x1024   75.024675 Hz   5:4     79.976 kHz    135.000000 MHz
  Standard Timings:
    DMT 0x0c:   800x600    85.061274 Hz   4:3     53.674 kHz     56.250000 MHz
    DMT 0x13:  1024x768    84.996690 Hz   4:3     68.677 kHz     94.500000 MHz
    DMT 0x15:  1152x864    75.000000 Hz   4:3     67.500 kHz    108.000000 MHz
    DMT 0x25:  1280x1024   85.024098 Hz   5:4     91.146 kHz    157.500000 MHz
    DMT 0x36:  1600x1200   75.000000 Hz   4:3     93.750 kHz    202.500000 MHz
  Detailed Timing Descriptors:
    DTD 1:   640x480   100.049407 Hz   4:3     50.625 kHz     40.500000 MHz (320 mm x 240 mm)
                 Hfront   16 Hsync  64 Hback   80 Hpol N
                 Vfront    1 Vsync   3 Vback   22 Vpol N
    DTD 2:  1600x1200   75.000000 Hz   4:3     93.750 kHz    202.500000 MHz (320 mm x 240 mm)
                 Hfront   64 Hsync 192 Hback  304 Hpol P
                 Vfront    1 Vsync   3 Vback   46 Vpol P
    Display Range Limits:
      Monitor ranges (GTF): 50-150 Hz V, 30-97 kHz H, max dotclock 2550 MHz
    Display Product Name: 'F790D'
Checksum: 0x23

----------------

Failures:

Block 0, Base EDID:
  Basic Display Parameters & Features: EDID 1.3 requires that the first detailed timing is the preferred timing.

EDID conformity: FAIL
