
EDID (hex):
00ffffffffffff000dae481300000000
16160104a51c107802a705a656549b26
0c505400000001010101010101010101
010101010101363680a0703820402e1e
24001aa510000018242480a070382040
2e1e24001aa510000018000000fe0043
4d4e0a202020202020202020000000fe
004e3133334853472d4633310a200079

Extracted contents:
header:          00 ff ff ff ff ff ff 00
serial number:   0d ae 48 13 00 00 00 00 16 16
version:         01 04
basic params:    a5 1c 10 78 02
chroma info:     a7 05 a6 56 54 9b 26 0c 50 54
established:     00 00 00
standard:        01 01 01 01 01 01 01 01 01 01 01 01 01 01 01 01
descriptor 1:    36 36 80 a0 70 38 20 40 2e 1e 24 00 1a a5 10 00 00 18
descriptor 2:    24 24 80 a0 70 38 20 40 2e 1e 24 00 1a a5 10 00 00 18
descriptor 3:    00 00 00 fe 00 43 4d 4e 0a 20 20 20 20 20 20 20 20 20
descriptor 4:    00 00 00 fe 00 4e 31 33 33 48 53 47 2d 46 33 31 0a 20
extensions:      00
checksum:        79

EDID version: 1.4
Manufacturer: CMN Model 1348 Serial Number --
Made in week 22 of 2012
Digital display
8 bits per primary color channel
DisplayPort interface
Maximum image size: 28 cm x 16 cm
Gamma: 2.20
Supported color formats: RGB 4:4:4
First detailed timing includes the native pixel format and preferred refresh rate
Display x,y Chromaticity:
  Red:   0.6503, 0.3378
  Green: 0.3291, 0.6083
  Blue:  0.1484, 0.0468
  White: 0.3134, 0.3291
Established timings supported:
Standard timings supported:
Detailed mode: Clock 138.780 MHz, 282 mm x 165 mm
               1920 1966 1996 2080 hborder 0
               1080 1082 1086 1112 vborder 0
               -hsync -vsync 
               VertFreq: 60 Hz, HorFreq: 66721 Hz
Detailed mode: Clock 92.520 MHz, 282 mm x 165 mm
               1920 1966 1996 2080 hborder 0
               1080 1082 1086 1112 vborder 0
               -hsync -vsync 
               VertFreq: 40 Hz, HorFreq: 44480 Hz
ASCII string: CMN
ASCII string: N133HSG-F31
Checksum: 0x79 (valid)
EDID block does NOT conform to EDID 1.4!
	Missing name descriptor
	Missing monitor ranges
