edid-decode (hex):

00 ff ff ff ff ff ff 00 30 e4 7a 03 00 00 00 00
00 16 01 03 80 1c 10 78 0a dc e5 97 5a 55 92 27
1d 50 54 00 00 00 01 01 01 01 01 01 01 01 01 01
01 01 01 01 01 01 24 1d 56 d4 50 00 16 30 30 20
25 00 15 9c 10 00 00 1b 00 00 00 00 00 00 00 00
00 00 00 00 00 00 00 00 00 00 00 00 00 fe 00 4c
47 20 44 69 73 70 6c 61 79 0a 20 20 00 00 00 fe
00 4c 50 31 32 35 57 48 32 2d 53 4c 54 31 00 25

----------------

Block 0, Base EDID:
  EDID Structure Version & Revision: 1.3
  Vendor & Product Identification:
    Manufacturer: LGD
    Model: 890
    Made in: 2012
  Basic Display Parameters & Features:
    Digital display
    Maximum image size: 28 cm x 16 cm
    Gamma: 2.20
    RGB color display
    First detailed timing is the preferred timing
  Color Characteristics:
    Red  : 0.5927, 0.3525
    Green: 0.3349, 0.5703
    Blue : 0.1552, 0.1152
    White: 0.3134, 0.3291
  Established Timings I & II: none
  Standard Timings: none
  Detailed Timing Descriptors:
    DTD 1:  1366x768    59.841812 Hz 683:384   47.275 kHz     74.600000 MHz (277 mm x 156 mm)
                 Hfront   48 Hsync  32 Hback  132 Hpol P
                 Vfront    2 Vsync   5 Vback   15 Vpol N
    Empty Descriptor
    Alphanumeric Data String: 'LG Display'
    Alphanumeric Data String: 'LP125WH2-SLT1'
Checksum: 0x25

----------------

Failures:

Block 0, Base EDID:
  Empty Descriptor: Use Dummy Descriptor instead of all zeroes.
  Missing Display Product Name.
  Missing Display Range Limits Descriptor.

EDID conformity: FAIL
