edid-decode (hex):

00 ff ff ff ff ff ff 00 04 72 08 04 ff ff ff ff
ff 17 01 04 a5 3c 22 78 06 ee 91 a3 54 4c 99 26
0f 50 54 21 08 00 01 01 01 01 01 01 01 01 01 01
01 01 01 01 01 01 56 5e 00 a0 a0 a0 29 50 30 20
35 00 56 50 21 00 00 1a 00 00 00 ff 00 23 41 53
4f 45 64 43 66 43 51 42 33 64 00 00 00 fd 00 1e
90 22 d0 36 01 0a 20 20 20 20 20 20 00 00 00 fc
00 58 42 32 37 30 48 55 0a 20 20 20 20 20 01 33

02 03 0a 01 65 4b 04 00 01 01 5a 87 00 a0 a0 a0
3b 50 30 20 35 00 56 50 21 00 00 1a 5a a0 00 a0
a0 a0 46 50 30 20 35 00 56 50 21 00 00 1a 6f c2
00 a0 a0 a0 55 50 30 20 35 00 56 50 21 00 00 1a
74 d2 00 16 a0 a0 09 50 04 10 11 00 56 50 21 00
00 1e 1c 25 00 a0 a0 a0 11 50 30 20 35 00 56 50
21 00 00 1a 00 00 00 00 00 00 00 00 00 00 00 00
00 00 00 00 00 00 00 00 00 00 00 00 00 00 00 af

00 ff ff ff ff ff ff 00 04 72 08 04 ff ff ff ff
ff 17 01 04 a5 3c 22 78 06 ee 91 a3 54 4c 99 26
0f 50 54 21 08 00 01 01 01 01 01 01 01 01 01 01
01 01 01 01 01 01 56 5e 00 a0 a0 a0 29 50 30 20
35 00 56 50 21 00 00 1a 00 00 00 ff 00 23 41 53
4f 45 64 43 66 43 51 42 33 64 00 00 00 fd 00 1e
90 22 d0 36 01 0a 20 20 20 20 20 20 00 00 00 fc
00 58 42 32 37 30 48 55 0a 20 20 20 20 20 01 33

02 03 0a 01 65 4b 04 00 01 01 5a 87 00 a0 a0 a0
3b 50 30 20 35 00 56 50 21 00 00 1a 5a a0 00 a0
a0 a0 46 50 30 20 35 00 56 50 21 00 00 1a 6f c2
00 a0 a0 a0 55 50 30 20 35 00 56 50 21 00 00 1a
74 d2 00 16 a0 a0 09 50 04 10 11 00 56 50 21 00
00 1e 1c 25 00 a0 a0 a0 11 50 30 20 35 00 56 50
21 00 00 1a 00 00 00 00 00 00 00 00 00 00 00 00
00 00 00 00 00 00 00 00 00 00 00 00 00 00 00 af

----------------

Block 0, Base EDID:
  EDID Structure Version & Revision: 1.4
  Vendor & Product Identification:
    Manufacturer: ACR
    Model: 1032
    Serial Number: ...
    Model year: 2013
  Basic Display Parameters & Features:
    Digital display
    Bits per primary color channel: 8
    DisplayPort interface
    Maximum image size: 60 cm x 34 cm
    Gamma: 2.20
    Supported color formats: RGB 4:4:4
    Default (sRGB) color space is primary color space
    First detailed timing includes the native pixel format and preferred refresh rate
  Color Characteristics:
    Red  : 0.6396, 0.3300
    Green: 0.2998, 0.5996
    Blue : 0.1503, 0.0595
    White: 0.3125, 0.3291
  Established Timings I & II:
    DMT 0x04:   640x480    59.940476 Hz   4:3     31.469 kHz     25.175000 MHz
    DMT 0x09:   800x600    60.316541 Hz   4:3     37.879 kHz     40.000000 MHz
    DMT 0x10:  1024x768    60.003840 Hz   4:3     48.363 kHz     65.000000 MHz
  Standard Timings: none
  Detailed Timing Descriptors:
    DTD  1:  2560x1440   59.950550 Hz  16:9     88.787 kHz    241.500000 MHz (598 mm x 336 mm)
                  Hfront   48 Hsync  32 Hback   80 Hpol P
                  Vfront    3 Vsync   5 Vback   33 Vpol N
    Display Product Serial Number: ...
    Display Range Limits:
      Monitor ranges (Bare Limits): 30-144 Hz V, 34-208 kHz H, max dotclock 540 MHz
    Display Product Name: 'XB270HU'
  Extension blocks: 1
Checksum: 0x33

----------------

Block 1, CTA-861 Extension Block:
  Revision: 3
  Native detailed modes: 1
  Vendor-Specific Data Block (NVIDIA), OUI 00-04-4B:
    01 01                                           '..'
  Detailed Timing Descriptors:
    DTD  2:  2560x1440   84.983126 Hz  16:9    127.390 kHz    346.500000 MHz (598 mm x 336 mm)
                  Hfront   48 Hsync  32 Hback   80 Hpol P
                  Vfront    3 Vsync   5 Vback   51 Vpol N
    DTD  3:  2560x1440   99.946436 Hz  16:9    150.919 kHz    410.500000 MHz (598 mm x 336 mm)
                  Hfront   48 Hsync  32 Hback   80 Hpol P
                  Vfront    3 Vsync   5 Vback   62 Vpol N
    DTD  4:  2560x1440  119.997589 Hz  16:9    182.996 kHz    497.750000 MHz (598 mm x 336 mm)
                  Hfront   48 Hsync  32 Hback   80 Hpol P
                  Vfront    3 Vsync   5 Vback   77 Vpol N
    DTD  5:  2560x1440  144.002728 Hz  16:9    208.660 kHz    538.760000 MHz (598 mm x 336 mm)
                  Hfront    4 Hsync  16 Hback    2 Hpol P
                  Vfront    1 Vsync   1 Vback    7 Vpol P
    DTD  6:  2560x1440   23.971497 Hz  16:9     34.926 kHz     95.000000 MHz (598 mm x 336 mm)
                  Hfront   48 Hsync  32 Hback   80 Hpol P
                  Vfront    3 Vsync   5 Vback    9 Vpol N
Checksum: 0xaf  Unused space in Extension Block: 27 bytes

----------------

Block 2, Unknown EDID Extension Block 0x00:
  00 ff ff ff ff ff ff 00 04 72 08 04 ff ff ff ff '.........r......'
  ff 17 01 04 a5 3c 22 78 06 ee 91 a3 54 4c 99 26 '.....<"x....TL.&'
  0f 50 54 21 08 00 01 01 01 01 01 01 01 01 01 01 '.PT!............'
  01 01 01 01 01 01 56 5e 00 a0 a0 a0 29 50 30 20 '......V^....)P0 '
  35 00 56 50 21 00 00 1a 00 00 00 ff 00 23 41 53 '5.VP!........#AS'
  4f 45 64 43 66 43 51 42 33 64 00 00 00 fd 00 1e 'OEdCfCQB3d......'
  90 22 d0 36 01 0a 20 20 20 20 20 20 00 00 00 fc '.".6..      ....'
  00 58 42 32 37 30 48 55 0a 20 20 20 20 20 01 33 '.XB270HU.     .3'
Checksum: 0x33

----------------

Block 3, CTA-861 Extension Block:
  Revision: 3
  Native detailed modes: 1
  Vendor-Specific Data Block (NVIDIA), OUI 00-04-4B:
    01 01                                           '..'
  Detailed Timing Descriptors:
    DTD  7:  2560x1440   84.983126 Hz  16:9    127.390 kHz    346.500000 MHz (598 mm x 336 mm)
                  Hfront   48 Hsync  32 Hback   80 Hpol P
                  Vfront    3 Vsync   5 Vback   51 Vpol N
    DTD  8:  2560x1440   99.946436 Hz  16:9    150.919 kHz    410.500000 MHz (598 mm x 336 mm)
                  Hfront   48 Hsync  32 Hback   80 Hpol P
                  Vfront    3 Vsync   5 Vback   62 Vpol N
    DTD  9:  2560x1440  119.997589 Hz  16:9    182.996 kHz    497.750000 MHz (598 mm x 336 mm)
                  Hfront   48 Hsync  32 Hback   80 Hpol P
                  Vfront    3 Vsync   5 Vback   77 Vpol N
    DTD 10:  2560x1440  144.002728 Hz  16:9    208.660 kHz    538.760000 MHz (598 mm x 336 mm)
                  Hfront    4 Hsync  16 Hback    2 Hpol P
                  Vfront    1 Vsync   1 Vback    7 Vpol P
    DTD 11:  2560x1440   23.971497 Hz  16:9     34.926 kHz     95.000000 MHz (598 mm x 336 mm)
                  Hfront   48 Hsync  32 Hback   80 Hpol P
                  Vfront    3 Vsync   5 Vback    9 Vpol N
Checksum: 0xaf  Unused space in Extension Block: 27 bytes

----------------

Warnings:

Block 1, CTA-861 Extension Block:
  IT Video Formats are overscanned by default, but normally this should be underscanned.
  Display Product Serial Number is set, so the Serial Number in the Base EDID should be 0.
Block 3, CTA-861 Extension Block:
  IT Video Formats are overscanned by default, but normally this should be underscanned.
  Display Product Serial Number is set, so the Serial Number in the Base EDID should be 0.
EDID:
  Base EDID: Some timings are out of range of the Monitor Ranges:
    Vertical Freq: 23.971 - 144.003 Hz (Monitor: 30.000 - 144.000 Hz)
    Horizontal Freq: 31.468 - 208.659 kHz (Monitor: 34.000 - 208.000 kHz)

Failures:

Block 1, CTA-861 Extension Block:
  Missing VCDB, needed for Set Selectable RGB Quantization to avoid interop issues.
Block 2, Base EDID:
  Unknown Extension Block.
Block 3, CTA-861 Extension Block:
  Missing VCDB, needed for Set Selectable RGB Quantization to avoid interop issues.
EDID:
  Base EDID: EDID specified 1 extension block(s), but found 3 extension block(s).

EDID conformity: FAIL
