edid-decode (hex):

00 ff ff ff ff ff ff 00 24 4d 87 28 00 00 00 00
00 0f 01 03 80 21 15 78 0a bc a5 98 58 55 8b 28
24 50 54 00 00 00 01 01 01 01 01 01 01 01 01 01
01 01 01 01 01 01 1c 2f 90 d0 60 1a 0f 40 20 30
13 00 4b cf 10 00 00 19 45 27 90 d0 60 1a 0f 40
20 30 13 00 4b cf 10 00 00 19 00 00 00 0f 00 b3
0a 32 b3 0a 28 14 01 00 32 0c 00 00 00 00 00 fe
00 4c 50 31 35 34 57 30 32 2d 54 4c 31 30 00 c4

00 ff ff ff ff ff ff 00 24 4d 87 28 00 00 00 00
00 0f 01 03 80 21 15 78 0a bc a5 98 58 55 8b 28
24 50 54 00 00 00 01 01 01 01 01 01 01 01 01 01
01 01 01 01 01 01 1c 2f 90 d0 60 1a 0f 40 20 30
13 00 4b cf 10 00 00 19 45 27 90 d0 60 1a 0f 40
20 30 13 00 4b cf 10 00 00 19 00 00 00 0f 00 b3
0a 32 b3 0a 28 14 01 00 32 0c 00 00 00 00 00 fe
00 4c 50 31 35 34 57 30 32 2d 54 4c 31 30 00 c4

----------------

Block 0, Base EDID:
  EDID Structure Version & Revision: 1.3
  Vendor & Product Identification:
    Manufacturer: IBM
    Model: 10375
    Made in: 2005
  Basic Display Parameters & Features:
    Digital display
    Maximum image size: 33 cm x 21 cm
    Gamma: 2.20
    RGB color display
    First detailed timing is the preferred timing
  Color Characteristics:
    Red  : 0.5957, 0.3466
    Green: 0.3349, 0.5429
    Blue : 0.1582, 0.1425
    White: 0.3134, 0.3291
  Established Timings I & II: none
  Standard Timings: none
  Detailed Timing Descriptors:
    DTD 1:  1680x1050   59.978515 Hz  16:10    63.877 kHz    120.600000 MHz (331 mm x 207 mm)
                 Hfront   32 Hsync  48 Hback  128 Hpol N
                 Vfront    1 Vsync   3 Vback   11 Vpol N
    DTD 2:  1680x1050   49.997016 Hz  16:10    53.247 kHz    100.530000 MHz (331 mm x 207 mm)
                 Hfront   32 Hsync  48 Hback  128 Hpol N
                 Vfront    1 Vsync   3 Vback   11 Vpol N
    Manufacturer-Specified Display Descriptor (0x0f): 00 0f 00 b3 0a 32 b3 0a 28 14 01 00 32 0c 00 00 '.....2..(...2...'
    Alphanumeric Data String: 'LP154W02-TL10'
Checksum: 0xc4

----------------

Block 1, Unknown EDID Extension Block 0x00:
  00 ff ff ff ff ff ff 00 24 4d 87 28 00 00 00 00 '........$M.(....'
  00 0f 01 03 80 21 15 78 0a bc a5 98 58 55 8b 28 '.....!.x....XU.('
  24 50 54 00 00 00 01 01 01 01 01 01 01 01 01 01 '$PT.............'
  01 01 01 01 01 01 1c 2f 90 d0 60 1a 0f 40 20 30 '......./..`..@ 0'
  13 00 4b cf 10 00 00 19 45 27 90 d0 60 1a 0f 40 '..K.....E'..`..@'
  20 30 13 00 4b cf 10 00 00 19 00 00 00 0f 00 b3 ' 0..K...........'
  0a 32 b3 0a 28 14 01 00 32 0c 00 00 00 00 00 fe '.2..(...2.......'
  00 4c 50 31 35 34 57 30 32 2d 54 4c 31 30 00 c4 '.LP154W02-TL10..'
Checksum: 0xc4

----------------

Failures:

Block 0, Base EDID:
  Missing Display Product Name.
  Missing Display Range Limits Descriptor.
Block 1, Base EDID:
  Unknown Extension Block.
EDID:
  Base EDID: EDID specified 0 extension block(s), but found 1 extension block(s).

EDID conformity: FAIL
