
EDID (hex):
00ffffffffffff00244d872800000000
000f0103802115780abca59858558b28
24505400000001010101010101010101
0101010101011c2f90d0601a0f402030
13004bcf10000019452790d0601a0f40
203013004bcf100000190000000f00b3
0a32b30a28140100320c0000000000fe
004c503135345730322d544c303600bf

Extracted contents:
header:          00 ff ff ff ff ff ff 00
serial number:   24 4d 87 28 00 00 00 00 00 0f
version:         01 03
basic params:    80 21 15 78 0a
chroma info:     bc a5 98 58 55 8b 28 24 50 54
established:     00 00 00
standard:        01 01 01 01 01 01 01 01 01 01 01 01 01 01 01 01
descriptor 1:    1c 2f 90 d0 60 1a 0f 40 20 30 13 00 4b cf 10 00 00 19
descriptor 2:    45 27 90 d0 60 1a 0f 40 20 30 13 00 4b cf 10 00 00 19
descriptor 3:    00 00 00 0f 00 b3 0a 32 b3 0a 28 14 01 00 32 0c 00 00
descriptor 4:    00 00 00 fe 00 4c 50 31 35 34 57 30 32 2d 54 4c 30 36
extensions:      00
checksum:        bf

EDID version: 1.3
Manufacturer: IBM Model 2887 Serial Number --
Digital display
Maximum image size: 33 cm x 21 cm
Gamma: 2.20
RGB color display
First detailed timing is preferred timing
Display x,y Chromaticity:
  Red:   0.5957, 0.3466
  Green: 0.3349, 0.5429
  Blue:  0.1582, 0.1425
  White: 0.3134, 0.3291
Established timings supported:
Standard timings supported:
Detailed mode: Clock 120.600 MHz, 331 mm x 207 mm
               1680 1712 1760 1888 hborder 0
               1050 1051 1054 1065 vborder 0
               -hsync -vsync 
               VertFreq: 59 Hz, HorFreq: 63877 Hz
Detailed mode: Clock 100.530 MHz, 331 mm x 207 mm
               1680 1712 1760 1888 hborder 0
               1050 1051 1054 1065 vborder 0
               -hsync -vsync 
               VertFreq: 49 Hz, HorFreq: 53246 Hz
Manufacturer-specified data, tag 15
ASCII string: LP154W02-TL06
Checksum: 0xbf (valid)
EDID block does NOT conform to EDID 1.3!
	Missing name descriptor
	Missing monitor ranges
EDID block does not conform at all!
	Bad year of manufacture
