edid-decode (hex):

00 ff ff ff ff ff ff 00 1e f9 dc 01 cd b8 97 14
31 15 01 03 80 30 1b 78 ea ee d5 a5 55 48 9b 26
12 50 54 b3 0c 00 81 80 71 4f 81 00 95 00 01 01
01 01 01 01 01 01 02 3a 80 18 71 38 2d 40 58 2c
45 00 dd 0c 11 00 00 1e 00 00 00 fc 00 46 48 58
32 31 35 32 4c 0a 20 20 20 20 00 00 00 fd 00 38
4c 1f 53 12 00 0a 20 20 20 20 20 20 00 00 00 ff
00 43 32 42 30 43 30 30 33 38 30 30 31 0a 00 a6

----------------

Block 0, Base EDID:
  EDID Structure Version & Revision: 1.3
  Vendor & Product Identification:
    Manufacturer: GWY
    Model: 476
    Serial Number: ...
    Made in: week 49 of 2011
  Basic Display Parameters & Features:
    Digital display
    Maximum image size: 48 cm x 27 cm
    Gamma: 2.20
    DPMS levels: Standby Suspend Off
    RGB color display
    First detailed timing is the preferred timing
  Color Characteristics:
    Red  : 0.6474, 0.3339
    Green: 0.2841, 0.6074
    Blue : 0.1513, 0.0712
    White: 0.3134, 0.3291
  Established Timings I & II:
    IBM     :   720x400    70.081663 Hz   9:5     31.467 kHz     28.320000 MHz
    DMT 0x04:   640x480    59.940476 Hz   4:3     31.469 kHz     25.175000 MHz
    Apple   :   640x480    66.666667 Hz   4:3     35.000 kHz     30.240000 MHz
    DMT 0x08:   800x600    56.250000 Hz   4:3     35.156 kHz     36.000000 MHz
    DMT 0x09:   800x600    60.316541 Hz   4:3     37.879 kHz     40.000000 MHz
    DMT 0x10:  1024x768    60.003840 Hz   4:3     48.363 kHz     65.000000 MHz
    DMT 0x11:  1024x768    70.069359 Hz   4:3     56.476 kHz     75.000000 MHz
  Standard Timings:
    DMT 0x23:  1280x1024   60.019740 Hz   5:4     63.981 kHz    108.000000 MHz
    DMT 0x15:  1152x864    75.000000 Hz   4:3     67.500 kHz    108.000000 MHz
    DMT 0x1c:  1280x800    59.810326 Hz  16:10    49.702 kHz     83.500000 MHz
    DMT 0x2f:  1440x900    59.887445 Hz  16:10    55.935 kHz    106.500000 MHz
  Detailed Timing Descriptors:
    DTD 1:  1920x1080   60.000000 Hz  16:9     67.500 kHz    148.500000 MHz (477 mm x 268 mm)
                 Hfront   88 Hsync  44 Hback  148 Hpol P
                 Vfront    4 Vsync   5 Vback   36 Vpol P
    Display Product Name: 'FHX2152L'
    Display Range Limits:
      Monitor ranges (GTF): 56-76 Hz V, 31-83 kHz H, max dotclock 180 MHz
    Display Product Serial Number: ...
Checksum: 0xa6

----------------

EDID conformity: PASS
