
EDID (hex):
00ffffffffffff001ab3c90701000000
2314010368331d782ac9a5a4564b9d25
125054a54b008180a9409500b3000101
010101010101023a801871382d40582c
4500fd1e1100001e000000fd00324c1c
5211000a202020202020000000fc0053
4c33323330540a2020202020000000ff
00595634483030323834390a202000b1

Extracted contents:
header:          00 ff ff ff ff ff ff 00
serial number:   1a b3 c9 07 01 00 00 00 23 14
version:         01 03
basic params:    68 33 1d 78 2a
chroma info:     c9 a5 a4 56 4b 9d 25 12 50 54
established:     a5 4b 00
standard:        81 80 a9 40 95 00 b3 00 01 01 01 01 01 01 01 01
descriptor 1:    02 3a 80 18 71 38 2d 40 58 2c 45 00 fd 1e 11 00 00 1e
descriptor 2:    00 00 00 fd 00 32 4c 1c 52 11 00 0a 20 20 20 20 20 20
descriptor 3:    00 00 00 fc 00 53 4c 33 32 33 30 54 0a 20 20 20 20 20
descriptor 4:    00 00 00 ff 00 59 56 34 48 30 30 32 38 34 39 0a 20 20
extensions:      00
checksum:        b1

EDID version: 1.3
Manufacturer: FUS Model 7c9 Serial Number --
Made in week 35 of 2010
Analog display, Input voltage level: 0.7/0.7 V
Sync: Separate 
Maximum image size: 51 cm x 29 cm
Gamma: 2.20
DPMS levels: Off
RGB color display
First detailed timing is preferred timing
Display x,y Chromaticity:
  Red:   0.6435, 0.3359
  Green: 0.2949, 0.6142
  Blue:  0.1464, 0.0722
  White: 0.3134, 0.3291
Established timings supported:
  720x400@70Hz 9:5 HorFreq: 31469 Hz Clock: 28.320 MHz
  640x480@60Hz 4:3 HorFreq: 31469 Hz Clock: 25.175 MHz
  640x480@75Hz 4:3 HorFreq: 37500 Hz Clock: 31.500 MHz
  800x600@60Hz 4:3 HorFreq: 37900 Hz Clock: 40.000 MHz
  800x600@75Hz 4:3 HorFreq: 46900 Hz Clock: 49.500 MHz
  1024x768@60Hz 4:3 HorFreq: 48400 Hz Clock: 65.000 MHz
  1024x768@75Hz 4:3 HorFreq: 60000 Hz Clock: 78.750 MHz
  1280x1024@75Hz 5:4 HorFreq: 80000 Hz Clock: 135.000 MHz
Standard timings supported:
  1280x1024@60Hz 5:4 HorFreq: 64000 Hz Clock: 108.000 MHz
  1600x1200@60Hz 4:3 HorFreq: 75000 Hz Clock: 162.000 MHz
  1440x900@60Hz 16:10 HorFreq: 55500 Hz Clock: 88.750 MHz
  1680x1050@60Hz 16:10 HorFreq: 64700 Hz Clock: 119.000 MHz
Detailed mode: Clock 148.500 MHz, 509 mm x 286 mm
               1920 2008 2052 2200 hborder 0
               1080 1084 1089 1125 vborder 0
               +hsync +vsync 
               VertFreq: 60 Hz, HorFreq: 67500 Hz
Monitor ranges (GTF): 50-76Hz V, 28-82kHz H, max dotclock 170MHz
Monitor name: SL3230T
Serial number: --
Checksum: 0xb1 (valid)
