
EDID (hex):
00ffffffffffff003609027001000000
0111010380120d000a00000000000000
00000000000045c061c071c081c08bc0
95c0a9c0d1c02413002041581620050d
2300ffff0000001c000000fc004d5049
373030320a2020202020000000100000
00000000000000000000000000000010
00000000000000000000000000000178
02031441410023090707830100006503
0c0010000000001000100a2020202020
2020202020200000001000100a202020
20202020202020200000001000010120
20202020202020202020000000100010
0a202020202020202020202000000010
00100a20202020202020202020200000
00000000000000000000000000000089

Extracted contents:
header:          00 ff ff ff ff ff ff 00
serial number:   36 09 02 70 01 00 00 00 01 11
version:         01 03
basic params:    80 12 0d 00 0a
chroma info:     00 00 00 00 00 00 00 00 00 00
established:     00 00 00
standard:        45 c0 61 c0 71 c0 81 c0 8b c0 95 c0 a9 c0 d1 c0
descriptor 1:    24 13 00 20 41 58 16 20 05 0d 23 00 ff ff 00 00 00 1c
descriptor 2:    00 00 00 fc 00 4d 50 49 37 30 30 32 0a 20 20 20 20 20
descriptor 3:    00 00 00 10 00 00 00 00 00 00 00 00 00 00 00 00 00 00
descriptor 4:    00 00 00 10 00 00 00 00 00 00 00 00 00 00 00 00 00 00
extensions:      01
checksum:        78

EDID version: 1.3
Manufacturer: MPI Model 7002 Serial Number --
Made in week 1 of 2007
Digital display
Maximum image size: 18 cm x 13 cm
Gamma: 1.00
RGB color display
First detailed timing is preferred timing
Display x,y Chromaticity:
  Red:   0.0000, 0.0000
  Green: 0.0000, 0.0000
  Blue:  0.0000, 0.0000
  White: 0.0000, 0.0000
Established timings supported:
Standard timings supported:
  800x450@60Hz 16:9
  1024x576@60Hz 16:9
  1152x648@60Hz 16:9
  1280x720@60Hz 16:9
  1360x765@60Hz 16:9
  1440x810@60Hz 16:9
  1600x900@60Hz 16:9
  1920x1080@60Hz 16:9
Detailed mode: Clock 49.000 MHz, 255 mm x 255 mm
               1024 1029 1042 1312 hborder 0
                600  602  605  622 vborder 0
               -hsync +vsync 
               VertFreq: 60 Hz, HorFreq: 37347 Hz
Monitor name: MPI7002
Dummy block
Dummy block
Has 1 extension blocks
Checksum: 0x78 (valid)

CTA extension block
Extension version: 3
16 bytes of CTA data
  Video data block
  Audio data block
    Linear PCM, max channels 2
      Supported sample rates (kHz): 48 44.1 32
      Supported sample sizes (bits): 24 20 16
  Speaker allocation data block
    Speaker map:
      FL/FR - Front Left/Right
  Vendor-specific data block, OUI 000c03 (HDMI)
    Source physical address 1.0.0.0
Basic audio support
1 native detailed modes
Checksum: 0x89 (valid)

EDID block does NOT conform to EDID 1.3!
	Required 640x480p60 timings are missing in the established timings
	and/or in the SVD list (VIC 1)
	Missing monitor ranges
