
EDID (hex):
00ffffffffffff0024ed802301010101
241e010368341d782a4995a556529f27
0d5054bfef80b300a940a9c095008180
810081c0714f023a801871382d40582c
450009252100001e000000ff00383732
44303336433031323233000000fd0037
4c1e5311000a202020202020000000fc
004c32333656410a20202020202000d8

Extracted contents:
header:          00 ff ff ff ff ff ff 00
serial number:   24 ed 80 23 01 01 01 01 24 1e
version:         01 03
basic params:    68 34 1d 78 2a
chroma info:     49 95 a5 56 52 9f 27 0d 50 54
established:     bf ef 80
standard:        b3 00 a9 40 a9 c0 95 00 81 80 81 00 81 c0 71 4f
descriptor 1:    02 3a 80 18 71 38 2d 40 58 2c 45 00 09 25 21 00 00 1e
descriptor 2:    00 00 00 ff 00 38 37 32 44 30 33 36 43 30 31 32 32 33
descriptor 3:    00 00 00 fd 00 37 4c 1e 53 11 00 0a 20 20 20 20 20 20
descriptor 4:    00 00 00 fc 00 4c 32 33 36 56 41 0a 20 20 20 20 20 20
extensions:      00
checksum:        d8

EDID version: 1.3
Manufacturer: IGM Model 2380 Serial Number --
Made in week 36 of 2020
Analog display, Input voltage level: 0.7/0.7 V
Sync: Separate 
Maximum image size: 52 cm x 29 cm
Gamma: 2.20
DPMS levels: Off
RGB color display
First detailed timing is preferred timing
Display x,y Chromaticity:
  Red:   0.6455, 0.3359
  Green: 0.3222, 0.6220
  Blue:  0.1542, 0.0517
  White: 0.3134, 0.3291
Established timings supported:
  720x400@70Hz 9:5 HorFreq: 31469 Hz Clock: 28.320 MHz
  640x480@60Hz 4:3 HorFreq: 31469 Hz Clock: 25.175 MHz
  640x480@67Hz 4:3 HorFreq: 35000 Hz Clock: 30.240 MHz
  640x480@72Hz 4:3 HorFreq: 37900 Hz Clock: 31.500 MHz
  640x480@75Hz 4:3 HorFreq: 37500 Hz Clock: 31.500 MHz
  800x600@56Hz 4:3 HorFreq: 35200 Hz Clock: 36.000 MHz
  800x600@60Hz 4:3 HorFreq: 37900 Hz Clock: 40.000 MHz
  800x600@72Hz 4:3 HorFreq: 48100 Hz Clock: 50.000 MHz
  800x600@75Hz 4:3 HorFreq: 46900 Hz Clock: 49.500 MHz
  832x624@75Hz 4:3 HorFreq: 49726 Hz Clock: 57.284 MHz
  1024x768@60Hz 4:3 HorFreq: 48400 Hz Clock: 65.000 MHz
  1024x768@70Hz 4:3 HorFreq: 56500 Hz Clock: 75.000 MHz
  1024x768@75Hz 4:3 HorFreq: 60000 Hz Clock: 78.750 MHz
  1280x1024@75Hz 5:4 HorFreq: 80000 Hz Clock: 135.000 MHz
  1152x870@75Hz 192:145 HorFreq: 67500 Hz Clock: 108.000 MHz
Standard timings supported:
  1680x1050@60Hz 16:10 HorFreq: 64700 Hz Clock: 119.000 MHz
  1600x1200@60Hz 4:3 HorFreq: 75000 Hz Clock: 162.000 MHz
  1600x900@60Hz 16:9
  1440x900@60Hz 16:10 HorFreq: 55500 Hz Clock: 88.750 MHz
  1280x1024@60Hz 5:4 HorFreq: 64000 Hz Clock: 108.000 MHz
  1280x800@60Hz 16:10
  1280x720@60Hz 16:9
  1152x864@75Hz 4:3 HorFreq: 67500 Hz Clock: 108.000 MHz
Detailed mode: Clock 148.500 MHz, 521 mm x 293 mm
               1920 2008 2052 2200 hborder 0
               1080 1084 1089 1125 vborder 0
               +hsync +vsync 
               VertFreq: 60 Hz, HorFreq: 67500 Hz
Serial number: --
Monitor ranges (GTF): 55-76Hz V, 30-83kHz H, max dotclock 170MHz
Monitor name: L236VA
Checksum: 0xd8 (valid)
