
EDID (hex):
00ffffffffffff001e6dc55a2cff0600
051a01046c2c1978ea9535a159579f27
0e5054a76a80714f81c0a9c081009500
010101010101302a40c8608464301850
1300b8fa1000001e000000fd00384b1e
530d000a202020202020000000fc004c
4720484420504c55530a2020000000ff
003630354e54514444473534300a0065

Extracted contents:
header:          00 ff ff ff ff ff ff 00
serial number:   1e 6d c5 5a 2c ff 06 00 05 1a
version:         01 04
basic params:    6c 2c 19 78 ea
chroma info:     95 35 a1 59 57 9f 27 0e 50 54
established:     a7 6a 80
standard:        71 4f 81 c0 a9 c0 81 00 95 00 01 01 01 01 01 01
descriptor 1:    30 2a 40 c8 60 84 64 30 18 50 13 00 b8 fa 10 00 00 1e
descriptor 2:    00 00 00 fd 00 38 4b 1e 53 0d 00 0a 20 20 20 20 20 20
descriptor 3:    00 00 00 fc 00 4c 47 20 48 44 20 50 4c 55 53 0a 20 20
descriptor 4:    00 00 00 ff 00 36 30 35 4e 54 51 44 44 47 35 34 30 0a
extensions:      00
checksum:        65

EDID version: 1.4
Manufacturer: GSM Model 5ac5 Serial Number --
Made in week 5 of 2016
Analog display, Input voltage level: 0.7/0.7 V
Blank level equals black level
Sync: Separate Composite 
Maximum image size: 44 cm x 25 cm
Gamma: 2.20
DPMS levels: Standby Suspend Off
RGB color display
First detailed timing includes the native pixel format and preferred refresh rate
Display x,y Chromaticity:
  Red:   0.6308, 0.3486
  Green: 0.3408, 0.6220
  Blue:  0.1523, 0.0576
  White: 0.3134, 0.3291
Established timings supported:
  720x400@70Hz 9:5 HorFreq: 31469 Hz Clock: 28.320 MHz
  640x480@60Hz 4:3 HorFreq: 31469 Hz Clock: 25.175 MHz
  640x480@75Hz 4:3 HorFreq: 37500 Hz Clock: 31.500 MHz
  800x600@56Hz 4:3 HorFreq: 35200 Hz Clock: 36.000 MHz
  800x600@60Hz 4:3 HorFreq: 37900 Hz Clock: 40.000 MHz
  800x600@75Hz 4:3 HorFreq: 46900 Hz Clock: 49.500 MHz
  832x624@75Hz 4:3 HorFreq: 49726 Hz Clock: 57.284 MHz
  1024x768@60Hz 4:3 HorFreq: 48400 Hz Clock: 65.000 MHz
  1024x768@75Hz 4:3 HorFreq: 60000 Hz Clock: 78.750 MHz
  1152x870@75Hz 192:145 HorFreq: 67500 Hz Clock: 108.000 MHz
Standard timings supported:
  1152x864@75Hz 4:3 HorFreq: 67500 Hz Clock: 108.000 MHz
  1280x720@60Hz 16:9
  1600x900@60Hz 16:9
  1280x800@60Hz 16:10
  1440x900@60Hz 16:10 HorFreq: 55500 Hz Clock: 88.750 MHz
Detailed mode: Clock 108.000 MHz, 440 mm x 250 mm
               1600 1624 1704 1800 hborder 0
                900  901  904 1000 vborder 0
               +hsync +vsync 
               VertFreq: 60 Hz, HorFreq: 60000 Hz
Monitor ranges (GTF): 56-75Hz V, 30-83kHz H, max dotclock 130MHz
Monitor name: LG HD PLUS
Serial number: --
Checksum: 0x65 (valid)
