edid-decode (hex):

00 ff ff ff ff ff ff 00 09 e5 e9 05 00 00 00 00
0c 16 01 03 80 19 0e 78 0a 21 60 99 5a 5b 99 28
21 50 54 00 00 00 01 01 01 01 01 01 01 01 01 01
01 01 01 01 01 01 3e 1c 56 a0 50 00 16 30 30 20
36 00 00 90 10 00 00 1a 00 00 00 00 00 00 00 00
00 00 00 00 00 00 00 00 00 1a 00 00 00 fe 00 42
4f 45 20 48 46 0a 20 20 20 20 20 20 00 00 00 fe
00 48 4e 31 31 36 57 58 41 2d 31 30 30 0a 00 06

----------------

Block 0, Base EDID:
  EDID Structure Version & Revision: 1.3
  Vendor & Product Identification:
    Manufacturer: BOE
    Model: 1513
    Made in: week 12 of 2012
  Basic Display Parameters & Features:
    Digital display
    Maximum image size: 25 cm x 14 cm
    Gamma: 2.20
    RGB color display
    First detailed timing is the preferred timing
  Color Characteristics:
    Red  : 0.5976, 0.3535
    Green: 0.3554, 0.5986
    Blue : 0.1572, 0.1308
    White: 0.3125, 0.3281
  Established Timings I & II: none
  Standard Timings: none
  Detailed Timing Descriptors:
    DTD 1:  1366x768    59.973 Hz 683:384  47.379 kHz  72.300 MHz (256 mm x 144 mm)
                 Hfront   48 Hsync  32 Hback  80 Hpol P
                 Vfront    3 Vsync   6 Vback  13 Vpol N
    Manufacturer-Specified Display Descriptor (0x00): 00 00 00 00 00 00 00 00 00 00 00 00 00 00 00 1a '................'
    Alphanumeric Data String: 'BOE HF'
    Alphanumeric Data String: 'HN116WXA-100'
Checksum: 0x06

----------------

Failures:

Block 0, Base EDID:
  Missing Display Product Name.
  Missing Display Range Limits Descriptor.

EDID conformity: FAIL
