
EDID (hex):
00ffffffffffff0010ac29a053384432
23120104a5342078e2b325ac5130b426
105054a54b008180a940714f01010101
010101010101283c80a070b023403020
360007442100001a000000ff00473239
3348383850324438530a000000fc0044
454c4c20323430385746500a000000fd
00384c1e5311000a20202020202000e3

edid-decode (hex):

00 ff ff ff ff ff ff 00 10 ac 29 a0 53 38 44 32
23 12 01 04 a5 34 20 78 e2 b3 25 ac 51 30 b4 26
10 50 54 a5 4b 00 81 80 a9 40 71 4f 01 01 01 01
01 01 01 01 01 01 28 3c 80 a0 70 b0 23 40 30 20
36 00 07 44 21 00 00 1a 00 00 00 ff 00 47 32 39
33 48 38 38 50 32 44 38 53 0a 00 00 00 fc 00 44
45 4c 4c 20 32 34 30 38 57 46 50 0a 00 00 00 fd
00 38 4c 1e 53 11 00 0a 20 20 20 20 20 20 00 e3

----------------

Block 0, Base EDID:
  EDID Structure Version & Revision: 1.4
  Vendor & Product Identification:
    Manufacturer: DEL
    Model: 41001
    Serial Number: 843331667
    Made in: week 35 of 2008
  Basic Display Parameters & Features:
    Digital display
    Bits per primary color channel: 8
    DisplayPort interface
    Maximum image size: 52 cm x 32 cm
    Gamma: 2.20
    DPMS levels: Standby Suspend Off
    Supported color formats: RGB 4:4:4
    First detailed timing includes the native pixel format and preferred refresh rate
  Color Characteristics:
    Red  : 0.6738, 0.3193
    Green: 0.1875, 0.7060
    Blue : 0.1484, 0.0644
    White: 0.3134, 0.3291
  Established Timings I & II:
    IBM     :   720x400    70.081663 Hz   9:5     31.467 kHz     28.320000 MHz
    DMT 0x04:   640x480    59.940476 Hz   4:3     31.469 kHz     25.175000 MHz
    DMT 0x06:   640x480    75.000000 Hz   4:3     37.500 kHz     31.500000 MHz
    DMT 0x09:   800x600    60.316541 Hz   4:3     37.879 kHz     40.000000 MHz
    DMT 0x0b:   800x600    75.000000 Hz   4:3     46.875 kHz     49.500000 MHz
    DMT 0x10:  1024x768    60.003840 Hz   4:3     48.363 kHz     65.000000 MHz
    DMT 0x12:  1024x768    75.028582 Hz   4:3     60.023 kHz     78.750000 MHz
    DMT 0x24:  1280x1024   75.024675 Hz   5:4     79.976 kHz    135.000000 MHz
  Standard Timings:
    DMT 0x23:  1280x1024   60.019740 Hz   5:4     63.981 kHz    108.000000 MHz
    DMT 0x33:  1600x1200   60.000000 Hz   4:3     75.000 kHz    162.000000 MHz
    DMT 0x15:  1152x864    75.000000 Hz   4:3     67.500 kHz    108.000000 MHz
  Detailed Timing Descriptors:
    DTD 1:  1920x1200   59.950171 Hz  16:10    74.038 kHz    154.000000 MHz (519 mm x 324 mm)
                 Hfront   48 Hsync  32 Hback   80 Hpol P
                 Vfront    3 Vsync   6 Vback   26 Vpol N
    Display Product Serial Number: 'G293H88P2D8S'
    Display Product Name: 'DELL 2408WFP'
    Display Range Limits:
      Monitor ranges (GTF): 56-76 Hz V, 30-83 kHz H, max dotclock 170 MHz
Checksum: 0xe3
