edid-decode (hex):

00 ff ff ff ff ff ff 00 25 cc 13 00 00 00 00 00
00 14 01 03 90 1f 11 78 0a c8 85 9e 57 54 9b 26
12 50 54 00 00 00 01 01 01 01 01 01 01 01 01 01
01 01 01 01 01 01 9a 1a 56 50 50 00 10 30 14 0d
32 00 35 ae 10 00 00 1a 9a 1a 56 50 50 00 10 30
14 0d 32 00 35 ae 10 00 00 00 00 00 00 fe 00 31
39 4a 54 50 80 31 34 30 47 57 30 31 00 00 00 00
00 00 00 00 00 00 00 00 00 01 01 0a 20 20 00 5b

----------------

Block 0, Base EDID:
  EDID Structure Version & Revision: 1.3
  Vendor & Product Identification:
    Manufacturer: INL
    Model: 19
    Made in: 2010
  Basic Display Parameters & Features:
    Digital display
    Maximum image size: 31 cm x 17 cm
    Gamma: 2.20
    RGB color display
    First detailed timing is the preferred timing
  Color Characteristics:
    Red  : 0.6201, 0.3398
    Green: 0.3300, 0.6054
    Blue : 0.1503, 0.0703
    White: 0.3134, 0.3291
  Established Timings I & II: none
  Standard Timings: none
  Detailed Timing Descriptors:
    DTD 1:  1366x768    60.071 Hz 683:384  47.095 kHz  68.100 MHz (309 mm x 174 mm)
                 Hfront   20 Hsync  13 Hback  47 Hpol P
                 Vfront    3 Vsync   2 Vback  11 Vpol N
    DTD 2:  1366x768    60.071 Hz 683:384  47.095 kHz  68.100 MHz (analog composite, sync-on-green, 309 mm x 174 mm)
                 Hfront   20 Hsync  13 Hback  47 Hpol N
                 Vfront    3 Vsync   2 Vback  11 Vpol N
    Alphanumeric Data String: '19JTP'
    Manufacturer-Specified Display Descriptor (0x00): 00 00 00 00 00 00 00 00 00 00 00 01 01 0a 20 20 '..............  '
Checksum: 0x5b

----------------

Failures:

Block 0, Base EDID:
  Basic Display Parameters & Features: Digital Video Interface Standard set to reserved value 0x10.
  Alphanumeric Data String: Non-printable character.
  Missing Display Product Name.
  Missing Display Range Limits Descriptor.

EDID conformity: FAIL
