
EDID (hex):
00ffffffffffff004c2d110d00000000
21190104a54627783a23ada4544d9926
0f474abfef8081c0810081809500a9c0
b300714f0101023a801871382d40582c
4500ba882100001e011d007251d01e20
6e285500ba882100001e000000fd0038
4b1e5111000a202020202020000000fc
00533332453531310a20202020200100
020307b1429004000000000000000000
00000000000000000000000000000000
00000000000000000000000000000000
00000000000000000000000000000000
00000000000000000000000000000000
00000000000000000000000000000000
00000000000000000000000000000000
0000000000000000000000000000006d

Extracted contents:
header:          00 ff ff ff ff ff ff 00
serial number:   4c 2d 11 0d 00 00 00 00 21 19
version:         01 04
basic params:    a5 46 27 78 3a
chroma info:     23 ad a4 54 4d 99 26 0f 47 4a
established:     bf ef 80
standard:        81 c0 81 00 81 80 95 00 a9 c0 b3 00 71 4f 01 01
descriptor 1:    02 3a 80 18 71 38 2d 40 58 2c 45 00 ba 88 21 00 00 1e
descriptor 2:    01 1d 00 72 51 d0 1e 20 6e 28 55 00 ba 88 21 00 00 1e
descriptor 3:    00 00 00 fd 00 38 4b 1e 51 11 00 0a 20 20 20 20 20 20
descriptor 4:    00 00 00 fc 00 53 33 32 45 35 31 31 0a 20 20 20 20 20
extensions:      01
checksum:        00

EDID version: 1.4
Manufacturer: SAM Model d11 Serial Number --
Made in week 33 of 2015
Digital display
8 bits per primary color channel
DisplayPort interface
Maximum image size: 70 cm x 39 cm
Gamma: 2.20
DPMS levels: Off
Supported color formats: RGB 4:4:4, YCrCb 4:4:4, YCrCb 4:2:2
First detailed timing includes the native pixel format and preferred refresh rate
Display x,y Chromaticity:
  Red:   0.6406, 0.3300
  Green: 0.3007, 0.6005
  Blue:  0.1503, 0.0605
  White: 0.2802, 0.2900
Established timings supported:
  720x400@70Hz 9:5 HorFreq: 31469 Hz Clock: 28.320 MHz
  640x480@60Hz 4:3 HorFreq: 31469 Hz Clock: 25.175 MHz
  640x480@67Hz 4:3 HorFreq: 35000 Hz Clock: 30.240 MHz
  640x480@72Hz 4:3 HorFreq: 37900 Hz Clock: 31.500 MHz
  640x480@75Hz 4:3 HorFreq: 37500 Hz Clock: 31.500 MHz
  800x600@56Hz 4:3 HorFreq: 35200 Hz Clock: 36.000 MHz
  800x600@60Hz 4:3 HorFreq: 37900 Hz Clock: 40.000 MHz
  800x600@72Hz 4:3 HorFreq: 48100 Hz Clock: 50.000 MHz
  800x600@75Hz 4:3 HorFreq: 46900 Hz Clock: 49.500 MHz
  832x624@75Hz 4:3 HorFreq: 49726 Hz Clock: 57.284 MHz
  1024x768@60Hz 4:3 HorFreq: 48400 Hz Clock: 65.000 MHz
  1024x768@70Hz 4:3 HorFreq: 56500 Hz Clock: 75.000 MHz
  1024x768@75Hz 4:3 HorFreq: 60000 Hz Clock: 78.750 MHz
  1280x1024@75Hz 5:4 HorFreq: 80000 Hz Clock: 135.000 MHz
  1152x870@75Hz 192:145 HorFreq: 67500 Hz Clock: 108.000 MHz
Standard timings supported:
  1280x720@60Hz 16:9
  1280x800@60Hz 16:10
  1280x1024@60Hz 5:4 HorFreq: 64000 Hz Clock: 108.000 MHz
  1440x900@60Hz 16:10 HorFreq: 55500 Hz Clock: 88.750 MHz
  1600x900@60Hz 16:9
  1680x1050@60Hz 16:10 HorFreq: 64700 Hz Clock: 119.000 MHz
  1152x864@75Hz 4:3 HorFreq: 67500 Hz Clock: 108.000 MHz
Detailed mode: Clock 148.500 MHz, 698 mm x 392 mm
               1920 2008 2052 2200 hborder 0
               1080 1084 1089 1125 vborder 0
               +hsync +vsync 
               VertFreq: 60 Hz, HorFreq: 67500 Hz
Detailed mode: Clock 74.250 MHz, 698 mm x 392 mm
               1280 1390 1430 1650 hborder 0
                720  725  730  750 vborder 0
               +hsync +vsync 
               VertFreq: 60 Hz, HorFreq: 45000 Hz
Monitor ranges (GTF): 56-75Hz V, 30-81kHz H, max dotclock 170MHz
Monitor name: S32E511
Has 1 extension blocks
Checksum: 0x0 (valid)

CTA extension block
Extension version: 3
3 bytes of CTA data
  Video data block
    VIC  16 1920x1080@60Hz 16:9 (native) HorFreq: 67500 Hz Clock: 148.500 MHz
    VIC   4 1280x720@60Hz 16:9  HorFreq: 45000 Hz Clock: 74.250 MHz
Underscans PC formats by default
Supports YCbCr 4:4:4
Supports YCbCr 4:2:2
1 native detailed modes
Checksum: 0x6d (valid)



