edid-decode (hex):

00 ff ff ff ff ff ff 00 4d d9 00 25 01 01 01 01
2d 0f 01 03 a0 26 1e 78 ba 68 75 a2 5a 49 9f 23
13 50 54 ad cf 00 81 80 81 40 01 01 01 01 01 01
01 01 01 01 01 01 30 2a 00 98 51 00 2a 40 30 70
13 00 78 2d 11 00 00 1e 00 00 00 fd 00 30 4b 1c
51 0e 00 0a 20 20 20 20 20 20 00 00 00 fc 00 53
44 4d 2d 48 53 39 35 50 0a 20 20 20 00 00 00 ff
00 31 30 30 37 39 34 34 0a 20 20 20 20 20 01 a8

02 03 1b 62 23 09 7f 07 83 01 00 00 67 03 0c 00
20 00 80 2d 43 01 10 84 e2 00 0f 00 00 36 00 40
e8 63 00 00 1a 1a 1d 00 80 51 d0 1c 20 40 80 35
00 40 84 63 00 00 1c 00 00 00 00 00 00 00 00 00
00 00 00 00 00 00 00 00 00 00 00 00 00 00 00 00
00 00 00 00 00 00 00 00 00 00 00 00 00 00 00 00
00 00 00 00 00 00 00 00 00 00 00 00 00 00 00 00
00 00 00 00 00 00 00 00 00 00 00 00 00 00 00 15

----------------

Block 0, Base EDID:
  EDID Structure Version & Revision: 1.3
  Vendor & Product Identification:
    Manufacturer: SNY
    Model: 9472
    Serial Number: ...
    Made in: week 45 of 2005
  Basic Display Parameters & Features:
    Digital display
    Maximum image size: 38 cm x 30 cm
    Gamma: 2.20
    DPMS levels: Standby Off
    Undefined display color type
    First detailed timing is preferred timing
  Color Characteristics:
    Red  : 0.6337, 0.3535
    Green: 0.2871, 0.6210
    Blue : 0.1376, 0.0771
    White: 0.3134, 0.3291
  Established Timings I & II:
    IBM     :   720x400    70.082 Hz   9:5    31.467 kHz  28.320 MHz
    DMT 0x04:   640x480    59.940 Hz   4:3    31.469 kHz  25.175 MHz
    DMT 0x05:   640x480    72.809 Hz   4:3    37.861 kHz  31.500 MHz
    DMT 0x06:   640x480    75.000 Hz   4:3    37.500 kHz  31.500 MHz
    DMT 0x09:   800x600    60.317 Hz   4:3    37.879 kHz  40.000 MHz
    DMT 0x0a:   800x600    72.188 Hz   4:3    48.077 kHz  50.000 MHz
    DMT 0x0b:   800x600    75.000 Hz   4:3    46.875 kHz  49.500 MHz
    DMT 0x10:  1024x768    60.004 Hz   4:3    48.363 kHz  65.000 MHz
    DMT 0x11:  1024x768    70.069 Hz   4:3    56.476 kHz  75.000 MHz
    DMT 0x12:  1024x768    75.029 Hz   4:3    60.023 kHz  78.750 MHz
    DMT 0x24:  1280x1024   75.025 Hz   5:4    79.976 kHz 135.000 MHz
  Standard Timings:
    DMT 0x23:  1280x1024   60.020 Hz   5:4    63.981 kHz 108.000 MHz
    DMT 0x20:  1280x960    60.000 Hz   4:3    60.000 kHz 108.000 MHz
  Detailed Timing Descriptors:
    DTD 1:  1280x1024   60.020 Hz   5:4    63.981 kHz 108.000 MHz (376 mm x 301 mm)
                 Hfront   48 Hsync 112 Hback 248 Hpol P
                 Vfront    1 Vsync   3 Vback  38 Vpol P
  Display Range Limits:
    Monitor ranges (GTF): 48-75 Hz V, 28-81 kHz H, max dotclock 140 MHz
    Display Product Name: 'SDM-HS95P'
    Display Product Serial Number: ...
  Extension blocks: 1
Checksum: 0xa8

----------------

Block 1, CTA-861 Extension Block:
  Revision: 3
  Basic audio support
  Supports YCbCr 4:4:4
  Native detailed modes: 2
  Audio Data Block:
    Linear PCM:
      Max channels: 2
      Supported sample rates (kHz): 192 176.4 96 88.2 48 44.1 32
      Supported sample sizes (bits): 24 20 16
  Speaker Allocation Data Block:
    FL/FR - Front Left/Right
  Vendor-Specific Data Block (HDMI), OUI 00-0C-03:
    Source physical address: 2.0.0.0
    Supports_AI
    Maximum TMDS clock: 225 MHz
  Video Data Block:
    VIC   1:   640x480    59.940 Hz   4:3    31.469 kHz  25.175 MHz
    VIC  16:  1920x1080   60.000 Hz  16:9    67.500 kHz 148.500 MHz
    VIC   4:  1280x720    60.000 Hz  16:9    45.000 kHz  74.250 MHz (native)
  Video Capability Data Block:
    YCbCr quantization: No Data
    RGB quantization: No Data
    PT scan behavior: No Data
    IT scan behavior: IT video formats not supported
    CE scan behavior: Supports both over- and underscan
  Detailed Timing Descriptors:
    Manufacturer-Specified Display Descriptor (0x00): 36 00 40 e8 63 00 00 1a 1a 1d 00 80 51 d0 1c 20 '6.@.c.......Q.. '
    DTD 2:  1077x132   1319.683 Hz 359:44  304.847 kHz 328.320 MHz (analog composite, sync-on-green)
                 Hfront    0 Hsync  28 Hback -28 Hpol N
                 Vfront    0 Vsync   0 Vback  99 Vpol N
                   40 80 35 00 40 84 63 00 00 1c 00 00 00 00 00 00 00 00 '@.5.@.c...........'
Checksum: 0x15

----------------

Warnings:

Block 1, CTA-861 Extension Block:
  Video Capability Data Block: Set Selectable RGB Quantization to avoid interop issues.
  Display Product Serial Number is set, so the Serial Number in the Base EDID should be 0.

Failures:

Block 0, Base EDID:
  Basic Display Parameters & Features: Digital Video Interface Standard set to reserved value 0x20.
Block 1, CTA-861 Extension Block:
  Display Descriptor #5: Monitor descriptor block has byte 2 nonzero (0x36).
  Display Descriptor #5: Monitor descriptor block has byte 4 nonzero (0x40).
  Detailed Timing Descriptor #2: 0 values in the video timing:
    Horizontal Active/Blanking 1077/0
    Horizontal Frontporch/Sync Width 0/28
    Vertical Active/Blanking 132/99
    Vertical Frontporch/Sync Width 0/0
  Detailed Timing Descriptor #2: 0 or negative horizontal front porch.
  Detailed Timing Descriptor #2: 0 or negative horizontal back porch.
  Detailed Timing Descriptor #2: Mismatch of image size vs display size: image size is not set, but display size is.
  Detailed Timing Descriptor #2: Invalid detailed timing descriptor ordering.
All Blocks:
  Some timings are out of range of the Monitor Ranges:
    Vertical Freq: 59.940 - 1319.683 Hz (Monitor: 48.000 - 75.000 Hz)
    Horizontal Freq: 31.466 - 304.846 kHz (Monitor: 28.000 - 81.000 kHz)
    Maximum Clock: 328.320 MHz (Monitor: 140.000 MHz)

EDID conformity: FAIL
