
EDID (hex):
00ffffffffffff0030aea26600000000
2a1f0104a54627783f3125a6554e9c26
0e5054afef00b300a9c0d1fcd1c0714f
818081c0818a565e00a0a0a029503020
3500ba882100001a000000ff00554757
30384238340a20202020000000fd0030
90dfdf3c010a202020202020000000fc
004c454e2047333271632d31300a019a
020322f5470103130412901f23090707
830100006d1a00000201309000000000
000086bc0050a0a05550082078005650
2100001a40e7006aa0a0675008209804
56502100001a662156aa51001e30468f
3300c4fe1000001ee69c0064a0a04650
3020880c56502100001a000000000000
000000000000000000000000000000f5

Extracted contents:
header:          00 ff ff ff ff ff ff 00
serial number:   30 ae a2 66 00 00 00 00 2a 1f
version:         01 04
basic params:    a5 46 27 78 3f
chroma info:     31 25 a6 55 4e 9c 26 0e 50 54
established:     af ef 00
standard:        b3 00 a9 c0 d1 fc d1 c0 71 4f 81 80 81 c0 81 8a
descriptor 1:    56 5e 00 a0 a0 a0 29 50 30 20 35 00 ba 88 21 00 00 1a
descriptor 2:    00 00 00 ff 00 55 47 57 30 38 42 38 34 0a 20 20 20 20
descriptor 3:    00 00 00 fd 00 30 90 df df 3c 01 0a 20 20 20 20 20 20
descriptor 4:    00 00 00 fc 00 4c 45 4e 20 47 33 32 71 63 2d 31 30 0a
extensions:      01
checksum:        9a

EDID version: 1.4
Manufacturer: LEN Model 66a2 Serial Number --
Made in week 42 of 2021
Digital display
8 bits per primary color channel
DisplayPort interface
Maximum image size: 70 cm x 39 cm
Gamma: 2.20
DPMS levels: Off
Supported color formats: RGB 4:4:4, YCrCb 4:4:4, YCrCb 4:2:2
Default (sRGB) color space is primary color space
First detailed timing includes the native pixel format and preferred refresh rate
Display is continuous frequency
Display x,y Chromaticity:
  Red:   0.6484, 0.3349
  Green: 0.3046, 0.6103
  Blue:  0.1484, 0.0566
  White: 0.3134, 0.3291
Established timings supported:
  720x400@70Hz 9:5 HorFreq: 31469 Hz Clock: 28.320 MHz
  640x480@60Hz 4:3 HorFreq: 31469 Hz Clock: 25.175 MHz
  640x480@72Hz 4:3 HorFreq: 37900 Hz Clock: 31.500 MHz
  640x480@75Hz 4:3 HorFreq: 37500 Hz Clock: 31.500 MHz
  800x600@56Hz 4:3 HorFreq: 35200 Hz Clock: 36.000 MHz
  800x600@60Hz 4:3 HorFreq: 37900 Hz Clock: 40.000 MHz
  800x600@72Hz 4:3 HorFreq: 48100 Hz Clock: 50.000 MHz
  800x600@75Hz 4:3 HorFreq: 46900 Hz Clock: 49.500 MHz
  832x624@75Hz 4:3 HorFreq: 49726 Hz Clock: 57.284 MHz
  1024x768@60Hz 4:3 HorFreq: 48400 Hz Clock: 65.000 MHz
  1024x768@70Hz 4:3 HorFreq: 56500 Hz Clock: 75.000 MHz
  1024x768@75Hz 4:3 HorFreq: 60000 Hz Clock: 78.750 MHz
  1280x1024@75Hz 5:4 HorFreq: 80000 Hz Clock: 135.000 MHz
Standard timings supported:
  1680x1050@60Hz 16:10 HorFreq: 64700 Hz Clock: 119.000 MHz
  1600x900@60Hz 16:9
  1920x1080@120Hz 16:9
  1920x1080@60Hz 16:9
  1152x864@75Hz 4:3 HorFreq: 67500 Hz Clock: 108.000 MHz
  1280x1024@60Hz 5:4 HorFreq: 64000 Hz Clock: 108.000 MHz
  1280x720@60Hz 16:9
  1280x1024@70Hz 5:4
Detailed mode: Clock 241.500 MHz, 698 mm x 392 mm
               2560 2608 2640 2720 hborder 0
               1440 1443 1448 1481 vborder 0
               +hsync -vsync 
               VertFreq: 59 Hz, HorFreq: 88786 Hz
Serial number: --
Monitor ranges (bare limits): 48-144Hz V, 223-223kHz H, max dotclock 600MHz
Monitor name: LEN G32qc-10
Has 1 extension blocks
Checksum: 0x9a (valid)

CTA extension block
Extension version: 3
30 bytes of CTA data
  Video data block
    VIC   1 640x480@60Hz 4:3  HorFreq: 31469 Hz Clock: 25.175 MHz
    VIC   3 720x480@60Hz 16:9  HorFreq: 31469 Hz Clock: 27.000 MHz
    VIC  19 1280x720@50Hz 16:9  HorFreq: 37500 Hz Clock: 74.250 MHz
    VIC   4 1280x720@60Hz 16:9  HorFreq: 45000 Hz Clock: 74.250 MHz
    VIC  18 720x576@50Hz 16:9  HorFreq: 31250 Hz Clock: 27.000 MHz
    VIC  16 1920x1080@60Hz 16:9 (native) HorFreq: 67500 Hz Clock: 148.500 MHz
    VIC  31 1920x1080@50Hz 16:9  HorFreq: 56250 Hz Clock: 148.500 MHz
  Audio data block
    Linear PCM, max channels 2
      Supported sample rates (kHz): 48 44.1 32
      Supported sample sizes (bits): 24 20 16
  Speaker allocation data block
    Speaker map:
      FL/FR - Front Left/Right
  Vendor-specific data block, OUI 00001a
Underscans PC formats by default
Basic audio support
Supports YCbCr 4:4:4
Supports YCbCr 4:2:2
5 native detailed modes
Detailed mode: Clock 482.620 MHz, 598 mm x 336 mm
               2560 2568 2600 2640 hborder 0
               1440 1447 1455 1525 vborder 0
               +hsync -vsync 
               VertFreq: 119 Hz, HorFreq: 182810 Hz
Detailed mode: Clock 592.000 MHz, 598 mm x 336 mm
               2560 2568 2600 2666 hborder 0
               1440 1465 1473 1543 vborder 0
               +hsync -vsync 
               VertFreq: 143 Hz, HorFreq: 222055 Hz
Detailed mode: Clock 85.500 MHz, 452 mm x 254 mm
               1366 1436 1579 1792 hborder 0
                768  771  774  798 vborder 0
               +hsync +vsync 
               VertFreq: 59 Hz, HorFreq: 47712 Hz
Detailed mode: Clock 401.660 MHz, 598 mm x 336 mm
               2560 2608 2640 2660 hborder 0
               1440 1496 1504 1510 vborder 0
               +hsync -vsync 
               VertFreq: 100 Hz, HorFreq: 151000 Hz
Checksum: 0xf5 (valid)

EDID block does NOT conform to EDID 1.4!
	sRGB is signaled, but the chromaticities do not match
Warning: One or more of the timings is out of range of the Monitor Ranges:
  Vertical Freq: 50 - 143 Hz
  Horizontal Freq: 31250 - 222055 Hz
  Maximum Clock: 592.000 MHz


