
EDID (hex):
00ffffffffffff000daf181000000000
3313010380160c780a4f05955b558f27
22505400000001010101010101010101
0101010101012c15006a415834206d48
7d00de7d00000018000000fe004e3130
314c362d4c30440a2020000000fe0043
4d4f0a202020202020202020000000fe
004e3130314c362d4c30440a2020001d

Extracted contents:
header:          00 ff ff ff ff ff ff 00
serial number:   0d af 18 10 00 00 00 00 33 13
version:         01 03
basic params:    80 16 0c 78 0a
chroma info:     4f 05 95 5b 55 8f 27 22 50 54
established:     00 00 00
standard:        01 01 01 01 01 01 01 01 01 01 01 01 01 01 01 01
descriptor 1:    2c 15 00 6a 41 58 34 20 6d 48 7d 00 de 7d 00 00 00 18
descriptor 2:    00 00 00 fe 00 4e 31 30 31 4c 36 2d 4c 30 44 0a 20 20
descriptor 3:    00 00 00 fe 00 43 4d 4f 0a 20 20 20 20 20 20 20 20 20
descriptor 4:    00 00 00 fe 00 4e 31 30 31 4c 36 2d 4c 30 44 0a 20 20
extensions:      00
checksum:        1d

EDID version: 1.3
Manufacturer: CMO Model 1018 Serial Number --
Made in week 51 of 2009
Digital display
Maximum image size: 22 cm x 12 cm
Gamma: 2.20
RGB color display
First detailed timing is preferred timing
Display x,y Chromaticity:
  Red:   0.5830, 0.3554
  Green: 0.3349, 0.5615
  Blue:  0.1523, 0.1328
  White: 0.3134, 0.3291
Established timings supported:
Standard timings supported:
Detailed mode: Clock 54.200 MHz, 222 mm x 125 mm
               1024 1133 1205 1386 hborder 0
                600  607  620  652 vborder 0
               -hsync -vsync 
               VertFreq: 59 Hz, HorFreq: 39105 Hz
ASCII string: N101L6-L0D
ASCII string: CMO
ASCII string: N101L6-L0D
Checksum: 0x1d (valid)
EDID block does NOT conform to EDID 1.3!
	Missing name descriptor
	Missing monitor ranges


