
EDID (hex):
00ffffffffffff005a63217b61040000
15120103182e1d782ae525a65444a125
145054afcf00b300a9409500950f8180
8100810f010121399030621a274068b0
3600da281100001c000000ff00515a31
3038323130313132310a000000fd0037
4b1e500f000a202020202020000000fc
00513232303257420a202020202000b0

Extracted contents:
header:          00 ff ff ff ff ff ff 00
serial number:   5a 63 21 7b 61 04 00 00 15 12
version:         01 03
basic params:    18 2e 1d 78 2a
chroma info:     e5 25 a6 54 44 a1 25 14 50 54
established:     af cf 00
standard:        b3 00 a9 40 95 00 95 0f 81 80 81 00 81 0f 01 01
descriptor 1:    21 39 90 30 62 1a 27 40 68 b0 36 00 da 28 11 00 00 1c
descriptor 2:    00 00 00 ff 00 51 5a 31 30 38 32 31 30 31 31 32 31 0a
descriptor 3:    00 00 00 fd 00 37 4b 1e 50 0f 00 0a 20 20 20 20 20 20
descriptor 4:    00 00 00 fc 00 51 32 32 30 32 57 42 0a 20 20 20 20 20
extensions:      00
checksum:        b0

EDID version: 1.3
Manufacturer: VSC Model 7b21 Serial Number --
Made in week 21 of 2008
Analog display, Input voltage level: 0.7/0.3 V
Configurable signal levels
Sync: Separate 
Maximum image size: 46 cm x 29 cm
Gamma: 2.20
DPMS levels: Off
RGB color display
First detailed timing is preferred timing
Display x,y Chromaticity:
  Red:   0.6513, 0.3300
  Green: 0.2666, 0.6298
  Blue:  0.1445, 0.0800
  White: 0.3134, 0.3291
Established timings supported:
  720x400@70Hz 9:5 HorFreq: 31469 Hz Clock: 28.320 MHz
  640x480@60Hz 4:3 HorFreq: 31469 Hz Clock: 25.175 MHz
  640x480@72Hz 4:3 HorFreq: 37900 Hz Clock: 31.500 MHz
  640x480@75Hz 4:3 HorFreq: 37500 Hz Clock: 31.500 MHz
  800x600@56Hz 4:3 HorFreq: 35200 Hz Clock: 36.000 MHz
  800x600@60Hz 4:3 HorFreq: 37900 Hz Clock: 40.000 MHz
  800x600@72Hz 4:3 HorFreq: 48100 Hz Clock: 50.000 MHz
  800x600@75Hz 4:3 HorFreq: 46900 Hz Clock: 49.500 MHz
  1024x768@60Hz 4:3 HorFreq: 48400 Hz Clock: 65.000 MHz
  1024x768@70Hz 4:3 HorFreq: 56500 Hz Clock: 75.000 MHz
  1024x768@75Hz 4:3 HorFreq: 60000 Hz Clock: 78.750 MHz
  1280x1024@75Hz 5:4 HorFreq: 80000 Hz Clock: 135.000 MHz
Standard timings supported:
  1680x1050@60Hz 16:10 HorFreq: 64700 Hz Clock: 119.000 MHz
  1600x1200@60Hz 4:3 HorFreq: 75000 Hz Clock: 162.000 MHz
  1440x900@60Hz 16:10 HorFreq: 55500 Hz Clock: 88.750 MHz
  1440x900@75Hz 16:10 HorFreq: 82300 Hz Clock: 156.000 MHz
  1280x1024@60Hz 5:4 HorFreq: 64000 Hz Clock: 108.000 MHz
  1280x800@60Hz 16:10
  1280x800@75Hz 16:10
Detailed mode: Clock 146.250 MHz, 474 mm x 296 mm
               1680 1784 1960 2240 hborder 0
               1050 1053 1059 1089 vborder 0
               -hsync +vsync 
               VertFreq: 59 Hz, HorFreq: 65290 Hz
Serial number: --
Monitor ranges (GTF): 55-75Hz V, 30-80kHz H, max dotclock 150MHz
Monitor name: Q2202WB
Checksum: 0xb0 (valid)
One or more of the timings is out of range of the Monitor Ranges:
  Vertical Freq: 56 - 75 Hz
  Horizontal Freq: 31469 - 82300 Hz
  Maximum Clock: 162.000 MHz
