edid-decode (hex):

00 ff ff ff ff ff ff 00 4c 2d c5 0a 00 00 00 00
34 16 01 03 80 3c 22 78 0a a7 81 a4 58 55 a1 27
10 50 54 bd ef 80 71 4f 81 c0 81 00 81 80 95 00
a9 c0 b3 00 01 01 02 3a 80 18 71 38 2d 40 58 2c
45 00 56 50 21 00 00 1e 66 21 56 aa 51 00 1e 30
46 8f 33 00 56 50 21 00 00 1e 00 00 00 fc 00 54
32 37 43 33 35 30 0a 20 20 20 20 20 00 00 00 fd
00 18 4b 0f 51 17 00 0a 20 20 20 20 20 20 01 2e

02 03 25 f1 4d 90 1f 04 13 05 14 03 12 20 21 22
07 16 23 0d 04 03 83 0f 00 00 67 03 0c 00 13 00
a8 2d e2 00 0f 02 3a 80 18 71 38 2d 40 58 2c 45
00 10 09 00 00 00 1e 02 3a 80 d0 72 38 2d 40 10
2c 45 80 10 09 00 00 00 1e 01 1d 00 72 51 d0 1e
20 6e 28 55 00 10 09 00 00 00 1e 01 1d 00 bc 52
d0 1e 20 b8 28 55 40 10 09 00 00 00 1e 01 1d 80
18 71 1c 16 20 58 2c 25 00 10 09 00 00 00 00 15

----------------

Block 0, Base EDID:
  EDID Structure Version & Revision: 1.3
  Vendor & Product Identification:
    Manufacturer: SAM
    Model: 2757
    Made in: week 52 of 2012
  Basic Display Parameters & Features:
    Digital display
    Maximum image size: 60 cm x 34 cm
    Gamma: 2.20
    RGB color display
    First detailed timing is the preferred timing
  Color Characteristics:
    Red  : 0.6425, 0.3457
    Green: 0.3330, 0.6318
    Blue : 0.1542, 0.0625
    White: 0.3125, 0.3291
  Established Timings I & II:
    IBM     :   720x400    70.082 Hz   9:5    31.467 kHz  28.320 MHz
    DMT 0x04:   640x480    59.940 Hz   4:3    31.469 kHz  25.175 MHz
    Apple   :   640x480    66.667 Hz   4:3    35.000 kHz  30.240 MHz
    DMT 0x05:   640x480    72.809 Hz   4:3    37.861 kHz  31.500 MHz
    DMT 0x06:   640x480    75.000 Hz   4:3    37.500 kHz  31.500 MHz
    DMT 0x09:   800x600    60.317 Hz   4:3    37.879 kHz  40.000 MHz
    DMT 0x0a:   800x600    72.188 Hz   4:3    48.077 kHz  50.000 MHz
    DMT 0x0b:   800x600    75.000 Hz   4:3    46.875 kHz  49.500 MHz
    Apple   :   832x624    74.551 Hz   4:3    49.726 kHz  57.284 MHz
    DMT 0x10:  1024x768    60.004 Hz   4:3    48.363 kHz  65.000 MHz
    DMT 0x11:  1024x768    70.069 Hz   4:3    56.476 kHz  75.000 MHz
    DMT 0x12:  1024x768    75.029 Hz   4:3    60.023 kHz  78.750 MHz
    DMT 0x24:  1280x1024   75.025 Hz   5:4    79.976 kHz 135.000 MHz
    Apple   :  1152x870    75.062 Hz 192:145  68.681 kHz 100.000 MHz
  Standard Timings:
    DMT 0x15:  1152x864    75.000 Hz   4:3    67.500 kHz 108.000 MHz
    DMT 0x55:  1280x720    60.000 Hz  16:9    45.000 kHz  74.250 MHz
    DMT 0x1c:  1280x800    59.810 Hz  16:10   49.702 kHz  83.500 MHz
    DMT 0x23:  1280x1024   60.020 Hz   5:4    63.981 kHz 108.000 MHz
    DMT 0x2f:  1440x900    59.887 Hz  16:10   55.935 kHz 106.500 MHz
    DMT 0x53:  1600x900    60.000 Hz  16:9    60.000 kHz 108.000 MHz (RB)
    DMT 0x3a:  1680x1050   59.954 Hz  16:10   65.290 kHz 146.250 MHz
  Detailed Timing Descriptors:
    DTD 1:  1920x1080   60.000 Hz  16:9    67.500 kHz 148.500 MHz (598 mm x 336 mm)
                 Hfront   88 Hsync  44 Hback 148 Hpol P
                 Vfront    4 Vsync   5 Vback  36 Vpol P
    DTD 2:  1366x768    59.790 Hz 683:384  47.712 kHz  85.500 MHz (598 mm x 336 mm)
                 Hfront   70 Hsync 143 Hback 213 Hpol P
                 Vfront    3 Vsync   3 Vback  24 Vpol P
    Display Product Name: 'T27C350'
  Display Range Limits:
    Monitor ranges (GTF): 24-75 Hz V, 15-81 kHz H, max dotclock 230 MHz
  Extension blocks: 1
Checksum: 0x2e

----------------

Block 1, CTA-861 Extension Block:
  Revision: 3
  Underscans IT Video Formats by default
  Basic audio support
  Supports YCbCr 4:4:4
  Supports YCbCr 4:2:2
  Native detailed modes: 1
  Video Data Block:
    VIC  16:  1920x1080   60.000 Hz  16:9    67.500 kHz 148.500 MHz (native)
    VIC  31:  1920x1080   50.000 Hz  16:9    56.250 kHz 148.500 MHz
    VIC   4:  1280x720    60.000 Hz  16:9    45.000 kHz  74.250 MHz
    VIC  19:  1280x720    50.000 Hz  16:9    37.500 kHz  74.250 MHz
    VIC   5:  1920x1080i  60.000 Hz  16:9    33.750 kHz  74.250 MHz
    VIC  20:  1920x1080i  50.000 Hz  16:9    28.125 kHz  74.250 MHz
    VIC   3:   720x480    59.940 Hz  16:9    31.469 kHz  27.000 MHz
    VIC  18:   720x576    50.000 Hz  16:9    31.250 kHz  27.000 MHz
    VIC  32:  1920x1080   24.000 Hz  16:9    27.000 kHz  74.250 MHz
    VIC  33:  1920x1080   25.000 Hz  16:9    28.125 kHz  74.250 MHz
    VIC  34:  1920x1080   30.000 Hz  16:9    33.750 kHz  74.250 MHz
    VIC   7:  1440x480i   59.940 Hz  16:9    15.734 kHz  27.000 MHz
    VIC  22:  1440x576i   50.000 Hz  16:9    15.625 kHz  27.000 MHz
  Audio Data Block:
    Linear PCM:
      Max channels: 6
      Supported sample rates (kHz): 48
      Supported sample sizes (bits): 20 16
  Speaker Allocation Data Block:
    FL/FR - Front Left/Right
    LFE1 - Low Frequency Effects 1
    FC - Front Center
    BL/BR - Back Left/Right
  Vendor-Specific Data Block (HDMI), OUI 00-0C-03:
    Source physical address: 1.3.0.0
    Supports_AI
    DC_36bit
    DC_Y444
    Maximum TMDS clock: 225 MHz
  Video Capability Data Block:
    YCbCr quantization: No Data
    RGB quantization: No Data
    PT scan behavior: No Data
    IT scan behavior: Supports both over- and underscan
    CE scan behavior: Supports both over- and underscan
  Detailed Timing Descriptors:
    DTD 3:  1920x1080   60.000 Hz  16:9    67.500 kHz 148.500 MHz (16 mm x 9 mm)
                 Hfront   88 Hsync  44 Hback 148 Hpol P
                 Vfront    4 Vsync   5 Vback  36 Vpol P
    DTD 4:  1920x1080   50.000 Hz  16:9    56.250 kHz 148.500 MHz (16 mm x 9 mm)
                 Hfront  528 Hsync  44 Hback 148 Hpol P
                 Vfront    4 Vsync   5 Vback  36 Vpol P
    DTD 5:  1280x720    60.000 Hz  16:9    45.000 kHz  74.250 MHz (16 mm x 9 mm)
                 Hfront  110 Hsync  40 Hback 220 Hpol P
                 Vfront    5 Vsync   5 Vback  20 Vpol P
    DTD 6:  1280x720    50.000 Hz  16:9    37.500 kHz  74.250 MHz (16 mm x 9 mm)
                 Hfront  440 Hsync  40 Hback 220 Hpol P
                 Vfront    5 Vsync   5 Vback  20 Vpol P
    DTD 7:  1920x540    60.053 Hz  32:9    33.750 kHz  74.250 MHz (analog composite, sync-on-green, 16 mm x 9 mm)
                 Hfront   88 Hsync  44 Hback 148 Hpol N
                 Vfront    2 Vsync   5 Vback  15 Vpol N
Checksum: 0x15

----------------

Warnings:

Block 1, CTA-861 Extension Block:
  Video Capability Data Block: Set Selectable RGB Quantization to avoid interop issues.
EDID:
  CTA-861: Multiple native progressive timings are defined.

Failures:

Block 1, CTA-861 Extension Block:
  Detailed Timing Descriptor #3: Mismatch of image size 16x9 mm vs display size 600x340 mm.
  Detailed Timing Descriptor #4: Mismatch of image size 16x9 mm vs display size 600x340 mm.
  Detailed Timing Descriptor #5: Mismatch of image size 16x9 mm vs display size 600x340 mm.
  Detailed Timing Descriptor #6: Mismatch of image size 16x9 mm vs display size 600x340 mm.
  Detailed Timing Descriptor #7: Mismatch of image size 16x9 mm vs display size 600x340 mm.

EDID conformity: FAIL
