
EDID (hex):
00ffffffffffff00220e573501010101
161c0104b54728783b8f15a6574da126
0d5054a10800d1c081c081809500a9c0
a940b300d100565e00a0a0a029503020
3500c48f2100001a000000fd00304b70
701f010a202020202020000000fc0048
502047616d696e672033320a000000ff
00434e43383232333043580a2020013b
020321f149101f041303021211012309
070783010000e305e000e6060701735a
1a023a801871382d40582c4500c48f21
00001e023a80d072382d40102c4580c4
8f2100001ed97600a0a0a03450302035
00c48f2100001a000000000000000000
00000000000000000000000000000000
0000000000000000000000000000008f

Extracted contents:
header:          00 ff ff ff ff ff ff 00
serial number:   22 0e 57 35 01 01 01 01 16 1c
version:         01 04
basic params:    b5 47 28 78 3b
chroma info:     8f 15 a6 57 4d a1 26 0d 50 54
established:     a1 08 00
standard:        d1 c0 81 c0 81 80 95 00 a9 c0 a9 40 b3 00 d1 00
descriptor 1:    56 5e 00 a0 a0 a0 29 50 30 20 35 00 c4 8f 21 00 00 1a
descriptor 2:    00 00 00 fd 00 30 4b 70 70 1f 01 0a 20 20 20 20 20 20
descriptor 3:    00 00 00 fc 00 48 50 20 47 61 6d 69 6e 67 20 33 32 0a
descriptor 4:    00 00 00 ff 00 43 4e 43 38 32 32 33 30 43 58 0a 20 20
extensions:      01
checksum:        3b

EDID version: 1.4
Manufacturer: HPN Model 3557 Serial Number --
Made in week 22 of 2018
Digital display
10 bits per primary color channel
DisplayPort interface
Maximum image size: 71 cm x 40 cm
Gamma: 2.20
DPMS levels: Off
Supported color formats: RGB 4:4:4, YCrCb 4:4:4, YCrCb 4:2:2
First detailed timing includes the native pixel format and preferred refresh rate
Display is continuous frequency
Display x,y Chromaticity:
  Red:   0.6503, 0.3398
  Green: 0.3037, 0.6318
  Blue:  0.1484, 0.0517
  White: 0.3134, 0.3291
Established timings supported:
  720x400@70Hz 9:5 HorFreq: 31469 Hz Clock: 28.320 MHz
  640x480@60Hz 4:3 HorFreq: 31469 Hz Clock: 25.175 MHz
  800x600@60Hz 4:3 HorFreq: 37900 Hz Clock: 40.000 MHz
  1024x768@60Hz 4:3 HorFreq: 48400 Hz Clock: 65.000 MHz
Standard timings supported:
  1920x1080@60Hz 16:9
  1280x720@60Hz 16:9
  1280x1024@60Hz 5:4 HorFreq: 64000 Hz Clock: 108.000 MHz
  1440x900@60Hz 16:10 HorFreq: 55500 Hz Clock: 88.750 MHz
  1600x900@60Hz 16:9
  1600x1200@60Hz 4:3 HorFreq: 75000 Hz Clock: 162.000 MHz
  1680x1050@60Hz 16:10 HorFreq: 64700 Hz Clock: 119.000 MHz
  1920x1200@60Hz 16:10 HorFreq: 74000 Hz Clock: 154.000 MHz
Detailed mode: Clock 241.500 MHz, 708 mm x 399 mm
               2560 2608 2640 2720 hborder 0
               1440 1443 1448 1481 vborder 0
               +hsync -vsync 
               VertFreq: 59 Hz, HorFreq: 88786 Hz
Monitor ranges (bare limits): 48-75Hz V, 112-112kHz H, max dotclock 310MHz
Monitor name: HP Gaming 32
Serial number: --
Has 1 extension blocks
Checksum: 0x3b (valid)

CTA extension block
Extension version: 3
29 bytes of CTA data
  Video data block
    VIC  16 1920x1080@60Hz 16:9  HorFreq: 67500 Hz Clock: 148.500 MHz
    VIC  31 1920x1080@50Hz 16:9  HorFreq: 56250 Hz Clock: 148.500 MHz
    VIC   4 1280x720@60Hz 16:9  HorFreq: 45000 Hz Clock: 74.250 MHz
    VIC  19 1280x720@50Hz 16:9  HorFreq: 37500 Hz Clock: 74.250 MHz
    VIC   3 720x480@60Hz 16:9  HorFreq: 31469 Hz Clock: 27.000 MHz
    VIC   2 720x480@60Hz 4:3  HorFreq: 31469 Hz Clock: 27.000 MHz
    VIC  18 720x576@50Hz 16:9  HorFreq: 31250 Hz Clock: 27.000 MHz
    VIC  17 720x576@50Hz 4:3  HorFreq: 31250 Hz Clock: 27.000 MHz
    VIC   1 640x480@60Hz 4:3  HorFreq: 31469 Hz Clock: 25.175 MHz
  Audio data block
    Linear PCM, max channels 2
      Supported sample rates (kHz): 48 44.1 32
      Supported sample sizes (bits): 24 20 16
  Speaker allocation data block
    Speaker map:
      FL/FR - Front Left/Right
  Extended tag: Colorimetry data block
    BT2020cYCC
    BT2020YCC
    BT2020RGB
  Extended tag: HDR static metadata data block
    Electro optical transfer functions:
      Traditional gamma - SDR luminance range
      Traditional gamma - HDR luminance range
      SMPTE ST2084
    Supported static metadata descriptors:
      Static metadata type 1
    Desired content max luminance: 115 (603.666 cd/m^2)
    Desired content max frame-average luminance: 90 (351.250 cd/m^2)
    Desired content min luminance: 26 (0.063 cd/m^2)
Underscans PC formats by default
Basic audio support
Supports YCbCr 4:4:4
Supports YCbCr 4:2:2
1 native detailed modes
Detailed mode: Clock 148.500 MHz, 708 mm x 399 mm
               1920 2008 2052 2200 hborder 0
               1080 1084 1089 1125 vborder 0
               +hsync +vsync 
               VertFreq: 60 Hz, HorFreq: 67500 Hz
Detailed mode: Clock 148.500 MHz, 708 mm x 399 mm
               1920 2448 2492 2640 hborder 0
               1080 1084 1089 1125 vborder 0
               +hsync +vsync 
               VertFreq: 50 Hz, HorFreq: 56250 Hz
Detailed mode: Clock 304.250 MHz, 708 mm x 399 mm
               2560 2608 2640 2720 hborder 0
               1440 1443 1448 1492 vborder 0
               +hsync -vsync 
               VertFreq: 74 Hz, HorFreq: 111856 Hz
Checksum: 0x8f (valid)

Warning: One or more of the timings is out of range of the Monitor Ranges:
  Vertical Freq: 50 - 74 Hz
  Horizontal Freq: 31250 - 111856 Hz
  Maximum Clock: 304.250 MHz
EDID block does not conform at all!
	Both the serial number and the serial string are set
