
EDID (hex):
00ffffffffffff0009e5850600000000
01190104952615780254f09f5a569c27
19505400000001010101010101010101
010101010101f02840f2608430303020
36007ed71000001a0000000000000000
0000000000000000001a000000000000
00000000000000000000000000000002
000c43f90b3c6e1e16286f000000008a

Extracted contents:
header:          00 ff ff ff ff ff ff 00
serial number:   09 e5 85 06 00 00 00 00 01 19
version:         01 04
basic params:    95 26 15 78 02
chroma info:     54 f0 9f 5a 56 9c 27 19 50 54
established:     00 00 00
standard:        01 01 01 01 01 01 01 01 01 01 01 01 01 01 01 01
descriptor 1:    f0 28 40 f2 60 84 30 30 30 20 36 00 7e d7 10 00 00 1a
descriptor 2:    00 00 00 00 00 00 00 00 00 00 00 00 00 00 00 00 00 1a
descriptor 3:    00 00 00 00 00 00 00 00 00 00 00 00 00 00 00 00 00 00
descriptor 4:    00 00 00 02 00 0c 43 f9 0b 3c 6e 1e 16 28 6f 00 00 00
extensions:      00
checksum:        8a

EDID version: 1.4
Manufacturer: BOE Model 685 Serial Number --
Made in week 1 of 2015
Digital display
6 bits per primary color channel
DisplayPort interface
Maximum image size: 38 cm x 21 cm
Gamma: 2.20
Supported color formats: RGB 4:4:4
First detailed timing includes the native pixel format and preferred refresh rate
Display x,y Chromaticity:
  Red:   0.6220, 0.3525
  Green: 0.3369, 0.6093
  Blue:  0.1552, 0.1005
  White: 0.3125, 0.3281
Established timings supported:
Standard timings supported:
Detailed mode: Clock 104.800 MHz, 382 mm x 215 mm
               1600 1648 1680 1842 hborder 0
                900  903  909  948 vborder 0
               +hsync -vsync 
               VertFreq: 60 Hz, HorFreq: 56894 Hz
Manufacturer-specified data, tag 0
Manufacturer-specified data, tag 0
Manufacturer-specified data, tag 2
Checksum: 0x8a (valid)
EDID block does NOT conform to EDID 1.4!
	Missing name descriptor
	Missing monitor ranges
