edid-decode (hex):

00 ff ff ff ff ff ff 00 4c a3 41 57 00 00 00 00
00 15 01 04 90 1a 10 78 0a 87 f5 94 57 4f 8c 27
27 50 54 00 00 00 01 01 01 01 01 01 01 01 01 01
01 01 01 01 01 01 12 1b 00 49 50 20 36 30 10 30
13 00 05 a3 10 00 00 19 0c 12 00 49 50 20 36 30
10 30 13 00 05 a3 10 00 00 19 00 00 00 00 00 00
00 00 00 00 00 00 00 00 00 00 00 00 00 00 00 02
00 0c 3f f4 0a 3c 6e 18 15 27 6e 00 00 00 00 5d

----------------

Block 0, Base EDID:
  EDID Structure Version & Revision: 1.4
  Vendor & Product Identification:
    Manufacturer: SEC
    Model: 22337
    Made in: 2011
  Basic Display Parameters & Features:
    Digital display
    Bits per primary color channel: 6
    Digital interface is not defined
    Maximum image size: 26 cm x 16 cm
    Gamma: 2.20
    Supported color formats: RGB 4:4:4, YCrCb 4:4:4
    First detailed timing includes the native pixel format and preferred refresh rate
  Color Characteristics:
    Red  : 0.5800, 0.3398
    Green: 0.3095, 0.5498
    Blue : 0.1552, 0.1552
    White: 0.3134, 0.3291
  Established Timings I & II: none
  Standard Timings: none
  Detailed Timing Descriptors:
    DTD 1:  1280x800    59.976 Hz   8:5    51.220 kHz  69.300 MHz (261 mm x 163 mm)
                 Hfront   16 Hsync  48 Hback   9 Hpol N
                 Vfront    1 Vsync   3 Vback  50 Vpol N
    DTD 2:  1280x800    39.984 Hz   8:5    34.146 kHz  46.200 MHz (261 mm x 163 mm)
                 Hfront   16 Hsync  48 Hback   9 Hpol N
                 Vfront    1 Vsync   3 Vback  50 Vpol N
    Empty Descriptor
    Manufacturer-Specified Display Descriptor (0x02): 00 02 00 0c 3f f4 0a 3c 6e 18 15 27 6e 00 00 00 '....?..<n..'n...'
Checksum: 0x5d
