edid-decode (hex):

00 ff ff ff ff ff ff 00 0e d4 1a 00 01 00 00 00
1e 14 01 03 00 21 15 78 0a 43 d5 98 57 52 8c 27
21 50 54 af ce 00 01 01 01 01 01 01 01 01 01 01
01 01 01 01 01 01 66 21 50 b0 51 00 1b 30 40 70
36 00 00 00 00 00 00 1e 00 00 00 10 00 00 00 00
00 00 00 00 00 00 00 00 00 1e 00 00 00 fd 00 37
4d 0f 46 0f 00 0a 20 20 20 20 20 20 00 00 00 fc
00 4c 43 44 0a 20 20 20 20 20 20 20 20 0a 00 d6

----------------

Block 0, Base EDID:
  EDID Structure Version & Revision: 1.3
  Vendor & Product Identification:
    Manufacturer: CVT
    Model: 26
    Serial Number: ...
    Made in: week 30 of 2010
  Basic Display Parameters & Features:
    Analog display
    Input voltage level: 0.7/0.3 V
    Blank level equals black level
    Maximum image size: 33 cm x 21 cm
    Gamma: 2.20
    RGB color display
    First detailed timing is the preferred timing
  Color Characteristics:
    Red  : 0.5947, 0.3398
    Green: 0.3203, 0.5498
    Blue : 0.1552, 0.1298
    White: 0.3134, 0.3291
  Established Timings I & II:
    IBM     :   720x400    70.081663 Hz   9:5     31.467 kHz     28.320000 MHz
    DMT 0x04:   640x480    59.940476 Hz   4:3     31.469 kHz     25.175000 MHz
    DMT 0x05:   640x480    72.808802 Hz   4:3     37.861 kHz     31.500000 MHz
    DMT 0x06:   640x480    75.000000 Hz   4:3     37.500 kHz     31.500000 MHz
    DMT 0x08:   800x600    56.250000 Hz   4:3     35.156 kHz     36.000000 MHz
    DMT 0x09:   800x600    60.316541 Hz   4:3     37.879 kHz     40.000000 MHz
    DMT 0x0a:   800x600    72.187572 Hz   4:3     48.077 kHz     50.000000 MHz
    DMT 0x0b:   800x600    75.000000 Hz   4:3     46.875 kHz     49.500000 MHz
    DMT 0x10:  1024x768    60.003840 Hz   4:3     48.363 kHz     65.000000 MHz
    DMT 0x11:  1024x768    70.069359 Hz   4:3     56.476 kHz     75.000000 MHz
    DMT 0x12:  1024x768    75.028582 Hz   4:3     60.023 kHz     78.750000 MHz
  Standard Timings: none
  Detailed Timing Descriptors:
    DTD 1:  1360x768    60.015162 Hz  85:48    47.712 kHz     85.500000 MHz
                 Hfront   64 Hsync 112 Hback  256 Hpol P
                 Vfront    3 Vsync   6 Vback   18 Vpol P
    Dummy Descriptor:
    Display Range Limits:
      Monitor ranges (GTF): 55-77 Hz V, 15-70 kHz H, max dotclock 150 MHz
    Display Product Name: 'LCD'
Checksum: 0xd6

----------------

Failures:

Block 0, Base EDID:
  Detailed Timing Descriptor #1: Mismatch of image size vs display size: image size is not set, but display size is.
  Dummy Descriptor: Dummy block filled with garbage.
  Display Product Name: Non-space after newline.

EDID conformity: FAIL
