
EDID (hex):
00ffffffffffff000dae431300000000
34150104a51c10780293ada9534c9625
114f5300000001010101010101010101
010101010101363680a0703820402e1e
24001aa5100000180000001000382040
2e1e24001aa510000018000000fe0043
4d4e0a202020202020202020000000fe
004e3133334853452d4541310a200095

Extracted contents:
header:          00 ff ff ff ff ff ff 00
serial number:   0d ae 43 13 00 00 00 00 34 15
version:         01 04
basic params:    a5 1c 10 78 02
chroma info:     93 ad a9 53 4c 96 25 11 4f 53
established:     00 00 00
standard:        01 01 01 01 01 01 01 01 01 01 01 01 01 01 01 01
descriptor 1:    36 36 80 a0 70 38 20 40 2e 1e 24 00 1a a5 10 00 00 18
descriptor 2:    00 00 00 10 00 38 20 40 2e 1e 24 00 1a a5 10 00 00 18
descriptor 3:    00 00 00 fe 00 43 4d 4e 0a 20 20 20 20 20 20 20 20 20
descriptor 4:    00 00 00 fe 00 4e 31 33 33 48 53 45 2d 45 41 31 0a 20
extensions:      00
checksum:        95

EDID version: 1.4
Manufacturer: CMN Model 1343 Serial Number --
Made in week 52 of 2011
Digital display
8 bits per primary color channel
DisplayPort interface
Maximum image size: 28 cm x 16 cm
Gamma: 2.20
Supported color formats: RGB 4:4:4
First detailed timing includes the native pixel format and preferred refresh rate
Display x,y Chromaticity:
  Red:   0.6621, 0.3251
  Green: 0.2968, 0.5888
  Blue:  0.1464, 0.0683
  White: 0.3115, 0.3251
Established timings supported:
Standard timings supported:
Detailed mode: Clock 138.780 MHz, 282 mm x 165 mm
               1920 1966 1996 2080 hborder 0
               1080 1082 1086 1112 vborder 0
               -hsync -vsync 
               VertFreq: 60 Hz, HorFreq: 66721 Hz
Dummy block
ASCII string: CMN
ASCII string: N133HSE-EA1
Checksum: 0x95 (valid)
EDID block does NOT conform to EDID 1.4!
	Missing name descriptor
	Missing monitor ranges
EDID block does not conform at all!
	Dummy block filled with garbage
