edid-decode (hex):

00 ff ff ff ff ff ff 00 41 0c 6f 08 d2 01 0b 00
1e 13 01 03 0e 2f 1d 78 ee b5 05 a5 56 4a 9a 25
12 50 54 bf ef 80 b3 00 81 80 81 8f 95 00 95 0f
b3 0f a9 40 a9 4f 21 39 90 30 62 1a 27 40 68 b0
36 00 da 28 11 00 00 1e 00 00 00 ff 00 44 4c 35
30 39 33 30 37 32 31 33 36 32 00 00 00 fc 00 50
68 69 6c 69 70 73 20 32 32 30 53 57 00 00 00 fd
00 38 4c 1e 53 11 00 0a 20 20 20 20 20 20 00 ec

00 ff ff ff ff ff ff 00 41 0c 6f 08 d2 01 0b 00
1e 13 01 03 0e 2f 1d 78 ee b5 05 a5 56 4a 9a 25
12 50 54 bf ef 80 b3 00 81 80 81 8f 95 00 95 0f
b3 0f a9 40 a9 4f 21 39 90 30 62 1a 27 40 68 b0
36 00 da 28 11 00 00 1e 00 00 00 ff 00 44 4c 35
30 39 33 30 37 32 31 33 36 32 00 00 00 fc 00 50
68 69 6c 69 70 73 20 32 32 30 53 57 00 00 00 fd
00 38 4c 1e 53 11 00 0a 20 20 20 20 20 20 00 ec

----------------

Block 0, Base EDID:
  EDID Structure Version & Revision: 1.3
  Vendor & Product Identification:
    Manufacturer: PHL
    Model: 2159
    Serial Number: ...
    Made in: week 30 of 2009
  Basic Display Parameters & Features:
    Analog display
    Signal Level Standard: 0.700 : 0.300 : 1.000 V p-p
    Blank level equals black level
    Sync: Separate Composite SyncOnGreen
    Maximum image size: 47 cm x 29 cm
    Gamma: 2.20
    DPMS levels: Standby Suspend Off
    RGB color display
    Default (sRGB) color space is primary color space
    First detailed timing is the preferred timing
  Color Characteristics:
    Red  : 0.6464, 0.3388
    Green: 0.2900, 0.6025
    Blue : 0.1445, 0.0703
    White: 0.3134, 0.3291
  Established Timings I & II:
    IBM     :   720x400    70.081663 Hz   9:5     31.467 kHz     28.320000 MHz
    DMT 0x04:   640x480    59.940476 Hz   4:3     31.469 kHz     25.175000 MHz
    Apple   :   640x480    66.666667 Hz   4:3     35.000 kHz     30.240000 MHz
    DMT 0x05:   640x480    72.808802 Hz   4:3     37.861 kHz     31.500000 MHz
    DMT 0x06:   640x480    75.000000 Hz   4:3     37.500 kHz     31.500000 MHz
    DMT 0x08:   800x600    56.250000 Hz   4:3     35.156 kHz     36.000000 MHz
    DMT 0x09:   800x600    60.316541 Hz   4:3     37.879 kHz     40.000000 MHz
    DMT 0x0a:   800x600    72.187572 Hz   4:3     48.077 kHz     50.000000 MHz
    DMT 0x0b:   800x600    75.000000 Hz   4:3     46.875 kHz     49.500000 MHz
    Apple   :   832x624    74.551266 Hz   4:3     49.726 kHz     57.284000 MHz
    DMT 0x10:  1024x768    60.003840 Hz   4:3     48.363 kHz     65.000000 MHz
    DMT 0x11:  1024x768    70.069359 Hz   4:3     56.476 kHz     75.000000 MHz
    DMT 0x12:  1024x768    75.028582 Hz   4:3     60.023 kHz     78.750000 MHz
    DMT 0x24:  1280x1024   75.024675 Hz   5:4     79.976 kHz    135.000000 MHz
    Apple   :  1152x870    75.061550 Hz 192:145   68.681 kHz    100.000000 MHz
  Standard Timings:
    DMT 0x3a:  1680x1050   59.954250 Hz  16:10    65.290 kHz    146.250000 MHz
    DMT 0x23:  1280x1024   60.019740 Hz   5:4     63.981 kHz    108.000000 MHz
    DMT 0x24:  1280x1024   75.024675 Hz   5:4     79.976 kHz    135.000000 MHz
    DMT 0x2f:  1440x900    59.887445 Hz  16:10    55.935 kHz    106.500000 MHz
    DMT 0x30:  1440x900    74.984427 Hz  16:10    70.635 kHz    136.750000 MHz
    DMT 0x3b:  1680x1050   74.892027 Hz  16:10    82.306 kHz    187.000000 MHz
    DMT 0x33:  1600x1200   60.000000 Hz   4:3     75.000 kHz    162.000000 MHz
    DMT 0x36:  1600x1200   75.000000 Hz   4:3     93.750 kHz    202.500000 MHz
  Detailed Timing Descriptors:
    DTD 1:  1680x1050   59.954250 Hz  16:10    65.290 kHz    146.250000 MHz (474 mm x 296 mm)
                 Hfront  104 Hsync 176 Hback  280 Hpol P
                 Vfront    3 Vsync   6 Vback   30 Vpol P
    Display Product Serial Number: ...
    Display Product Name: 'Philips 220SW'
    Display Range Limits:
      Monitor ranges (GTF): 56-76 Hz V, 30-83 kHz H, max dotclock 170 MHz
Checksum: 0xec

----------------

Block 1, Unknown EDID Extension Block 0x00:
  00 ff ff ff ff ff ff 00 41 0c 6f 08 d2 01 0b 00 '........A.o.....'
  1e 13 01 03 0e 2f 1d 78 ee b5 05 a5 56 4a 9a 25 '...../.x....VJ.%'
  12 50 54 bf ef 80 b3 00 81 80 81 8f 95 00 95 0f '.PT.............'
  b3 0f a9 40 a9 4f 21 39 90 30 62 1a 27 40 68 b0 '...@.O!9.0b.'@h.'
  36 00 da 28 11 00 00 1e 00 00 00 ff 00 44 4c 35 '6..(.........DL5'
  30 39 33 30 37 32 31 33 36 32 00 00 00 fc 00 50 '0930721362.....P'
  68 69 6c 69 70 73 20 32 32 30 53 57 00 00 00 fd 'hilips 220SW....'
  00 38 4c 1e 53 11 00 0a 20 20 20 20 20 20 00 ec '.8L.S...      ..'
Checksum: 0xec

----------------

Warnings:

Block 0, Base EDID:
  Detailed Timing Descriptor #1: DTD is similar but not identical to DMT 0x3a.

Failures:

Block 0, Base EDID:
  Basic Display Parameters & Features: sRGB is signaled, but the chromaticities do not match.
Block 1, Base EDID:
  Unknown Extension Block.
EDID:
  Base EDID: Some timings are out of range of the Monitor Ranges:
    Horizontal Freq: 31.466 - 93.750 kHz (Monitor: 30.000 - 83.000 kHz)
    Maximum Clock: 202.500 MHz (Monitor: 170.000 MHz)
  Base EDID: EDID specified 0 extension block(s), but found 1 extension block(s).

EDID conformity: FAIL
