edid-decode (hex):

00 ff ff ff ff ff ff 00 30 e4 4c 03 00 00 00 00
00 16 01 03 80 1d 10 78 0a c2 85 96 59 57 8e 28
1f 50 54 00 00 00 01 01 01 01 01 01 01 01 01 01
01 01 01 01 01 01 58 1b 56 6e 50 00 16 30 24 24
48 00 25 a5 10 00 00 19 00 00 00 00 00 00 00 00
00 00 00 00 00 00 00 00 00 00 00 00 00 fe 00 4c
47 20 44 69 73 70 6c 61 79 0a 20 20 00 00 00 fe
00 4c 50 31 33 33 57 48 32 2d 54 4c 45 31 00 de

----------------

Block 0, Base EDID:
  EDID Structure Version & Revision: 1.3
  Vendor & Product Identification:
    Manufacturer: LGD
    Model: 844
    Made in: 2012
  Basic Display Parameters & Features:
    Digital display
    Maximum image size: 29 cm x 16 cm
    Gamma: 2.20
    RGB color display
    First detailed timing is the preferred timing
  Color Characteristics:
    Red  : 0.5888, 0.3476
    Green: 0.3398, 0.5566
    Blue : 0.1582, 0.1210
    White: 0.3134, 0.3291
  Established Timings I & II: none
  Standard Timings: none
  Detailed Timing Descriptors:
    DTD 1:  1366x768    60.032246 Hz 683:384   47.425 kHz     70.000000 MHz (293 mm x 165 mm)
                 Hfront   36 Hsync  36 Hback   38 Hpol N
                 Vfront    4 Vsync   8 Vback   10 Vpol N
    Empty Descriptor
    Alphanumeric Data String: 'LG Display'
    Alphanumeric Data String: 'LP133WH2-TLE1'
Checksum: 0xde

----------------

Failures:

Block 0, Base EDID:
  Empty Descriptor: Use Dummy Descriptor instead of all zeroes.
  Missing Display Product Name.
  Missing Display Range Limits Descriptor.

EDID conformity: FAIL
