
EDID (hex):
00ffffffffffff0022f0812901010101
2615010380331d782ad945a2554da027
125054a1080081c081809500b300d1c0
010101010101023a801871382d40582c
4500fe1f1100005f000000fd00324c18
5e11000a202020202020000000fc0048
50203233313167740a202020000000ff
003343513133384e58394e0a20200146
02031bb24990040302019f1312116c03
0c001000b82d00000000008c0ad08a20
e02d10103e9600fe1f110000188c0ad0
90204031200c405500fe1f1100001801
1d007251d01e206e285500fe1f110000
1e011d00bc52d01e20b8285540fe1f11
00001e00000000000000000000000000
00000000000000000000000000000000

Extracted contents:
header:          00 ff ff ff ff ff ff 00
serial number:   22 f0 81 29 01 01 01 01 26 15
version:         01 03
basic params:    80 33 1d 78 2a
chroma info:     d9 45 a2 55 4d a0 27 12 50 54
established:     a1 08 00
standard:        81 c0 81 80 95 00 b3 00 d1 c0 01 01 01 01 01 01
descriptor 1:    02 3a 80 18 71 38 2d 40 58 2c 45 00 fe 1f 11 00 00 5f
descriptor 2:    00 00 00 fd 00 32 4c 18 5e 11 00 0a 20 20 20 20 20 20
descriptor 3:    00 00 00 fc 00 48 50 20 32 33 31 31 67 74 0a 20 20 20
descriptor 4:    00 00 00 ff 00 33 43 51 31 33 38 4e 58 39 4e 0a 20 20
extensions:      01
checksum:        46

EDID version: 1.3
Manufacturer: HWP Model 2981 Serial Number --
Made in week 38 of 2011
Digital display
Maximum image size: 51 cm x 29 cm
Gamma: 2.20
DPMS levels: Off
RGB color display
First detailed timing is preferred timing
Display x,y Chromaticity:
  Red:   0.6357, 0.3330
  Green: 0.3027, 0.6259
  Blue:  0.1533, 0.0703
  White: 0.3134, 0.3291
Established timings supported:
  720x400@70Hz 9:5 HorFreq: 31469 Hz Clock: 28.320 MHz
  640x480@60Hz 4:3 HorFreq: 31469 Hz Clock: 25.175 MHz
  800x600@60Hz 4:3 HorFreq: 37900 Hz Clock: 40.000 MHz
  1024x768@60Hz 4:3 HorFreq: 48400 Hz Clock: 65.000 MHz
Standard timings supported:
  1280x720@60Hz 16:9
  1280x1024@60Hz 5:4 HorFreq: 64000 Hz Clock: 108.000 MHz
  1440x900@60Hz 16:10 HorFreq: 55500 Hz Clock: 88.750 MHz
  1680x1050@60Hz 16:10 HorFreq: 64700 Hz Clock: 119.000 MHz
  1920x1080@60Hz 16:9
Detailed mode: Clock 148.500 MHz, 510 mm x 287 mm
               1920 2008 2052 2200 hborder 0
               1080 1084 1089 1125 vborder 0
               +hsync +vsync interleaved left even
               VertFreq: 60 Hz, HorFreq: 67500 Hz
Monitor ranges (GTF): 50-76Hz V, 24-94kHz H, max dotclock 170MHz
Monitor name: HP 2311gt
Serial number: --
Has 1 extension blocks
Checksum: 0x46 (valid)

CTA extension block
Extension version: 3
23 bytes of CTA data
  Video data block
    VIC  16 1920x1080@60Hz 16:9 (native) HorFreq: 67500 Hz Clock: 148.500 MHz
    VIC   4 1280x720@60Hz 16:9  HorFreq: 45000 Hz Clock: 74.250 MHz
    VIC   3 720x480@60Hz 16:9  HorFreq: 31469 Hz Clock: 27.000 MHz
    VIC   2 720x480@60Hz 4:3  HorFreq: 31469 Hz Clock: 27.000 MHz
    VIC   1 640x480@60Hz 4:3  HorFreq: 31469 Hz Clock: 25.175 MHz
    VIC  31 1920x1080@50Hz 16:9 (native) HorFreq: 56250 Hz Clock: 148.500 MHz
    VIC  19 1280x720@50Hz 16:9  HorFreq: 37500 Hz Clock: 74.250 MHz
    VIC  18 720x576@50Hz 16:9  HorFreq: 31250 Hz Clock: 27.000 MHz
    VIC  17 720x576@50Hz 4:3  HorFreq: 31250 Hz Clock: 27.000 MHz
  Vendor-specific data block, OUI 000c03 (HDMI)
    Source physical address 1.0.0.0
    Supports_AI
    DC_36bit
    DC_30bit
    DC_Y444
    Maximum TMDS clock: 225MHz
Underscans PC formats by default
Supports YCbCr 4:4:4
Supports YCbCr 4:2:2
2 native detailed modes
Detailed mode: Clock 27.000 MHz, 510 mm x 287 mm
                720  736  798  858 hborder 0
                480  489  495  525 vborder 0
               -hsync -vsync 
               VertFreq: 59 Hz, HorFreq: 31468 Hz
Detailed mode: Clock 27.000 MHz, 510 mm x 287 mm
                720  732  796  864 hborder 0
                576  581  586  625 vborder 0
               -hsync -vsync 
               VertFreq: 50 Hz, HorFreq: 31250 Hz
Detailed mode: Clock 74.250 MHz, 510 mm x 287 mm
               1280 1390 1430 1650 hborder 0
                720  725  730  750 vborder 0
               +hsync +vsync 
               VertFreq: 60 Hz, HorFreq: 45000 Hz
Detailed mode: Clock 74.250 MHz, 510 mm x 287 mm
               1280 1720 1760 1980 hborder 0
                720  725  730  750 vborder 0
               +hsync +vsync 
               VertFreq: 50 Hz, HorFreq: 37500 Hz
Checksum: 0x0 (valid)

EDID block does not conform at all!
	Both the serial number and the serial string are set


