edid-decode (hex):

00 ff ff ff ff ff ff 00 22 f0 81 29 01 01 01 01
30 15 01 03 80 33 1d 78 2a d9 45 a2 55 4d a0 27
12 50 54 a1 08 00 81 c0 81 80 95 00 b3 00 d1 c0
01 01 01 01 01 01 02 3a 80 18 71 38 2d 40 58 2c
45 00 fe 1f 11 00 00 5f 00 00 00 fd 00 32 4c 18
5e 11 00 0a 20 20 20 20 20 20 00 00 00 fc 00 48
50 20 32 33 31 31 67 74 0a 20 20 20 00 00 00 ff
00 33 43 51 31 34 38 4e 58 30 46 0a 20 20 01 4c

02 03 1b b2 49 90 04 03 02 01 9f 13 12 11 6c 03
0c 00 10 00 b8 2d 00 00 00 00 00 8c 0a d0 8a 20
e0 2d 10 10 3e 96 00 fe 1f 11 00 00 18 8c 0a d0
90 20 40 31 20 0c 40 55 00 fe 1f 11 00 00 18 01
1d 00 72 51 d0 1e 20 6e 28 55 00 fe 1f 11 00 00
1e 01 1d 00 bc 52 d0 1e 20 b8 28 55 40 fe 1f 11
00 00 1e 00 00 00 00 00 00 00 00 00 00 00 00 00
00 00 00 00 00 00 00 00 00 00 00 00 00 00 00 00

----------------

Block 0, Base EDID:
  EDID Structure Version & Revision: 1.3
  Vendor & Product Identification:
    Manufacturer: HWP
    Model: 10625
    Serial Number: ...
    Made in: week 48 of 2011
  Basic Display Parameters & Features:
    Digital display
    Maximum image size: 51 cm x 29 cm
    Gamma: 2.20
    DPMS levels: Off
    RGB color display
    First detailed timing is the preferred timing
  Color Characteristics:
    Red  : 0.6357, 0.3330
    Green: 0.3027, 0.6259
    Blue : 0.1533, 0.0703
    White: 0.3134, 0.3291
  Established Timings I & II:
    IBM     :   720x400    70.082 Hz   9:5    31.467 kHz  28.320 MHz
    DMT 0x04:   640x480    59.940 Hz   4:3    31.469 kHz  25.175 MHz
    DMT 0x09:   800x600    60.317 Hz   4:3    37.879 kHz  40.000 MHz
    DMT 0x10:  1024x768    60.004 Hz   4:3    48.363 kHz  65.000 MHz
  Standard Timings:
    DMT 0x55:  1280x720    60.000 Hz  16:9    45.000 kHz  74.250 MHz
    DMT 0x23:  1280x1024   60.020 Hz   5:4    63.981 kHz 108.000 MHz
    DMT 0x2f:  1440x900    59.887 Hz  16:10   55.935 kHz 106.500 MHz
    DMT 0x3a:  1680x1050   59.954 Hz  16:10   65.290 kHz 146.250 MHz
    DMT 0x52:  1920x1080   60.000 Hz  16:9    67.500 kHz 148.500 MHz
  Detailed Timing Descriptors:
    DTD 1:  1920x1080   60.000 Hz  16:9    67.500 kHz 148.500 MHz (interleaved left even, 510 mm x 287 mm)
                 Hfront   88 Hsync  44 Hback 148 Hpol P
                 Vfront    4 Vsync   5 Vback  36 Vpol P
  Display Range Limits:
    Monitor ranges (GTF): 50-76 Hz V, 24-94 kHz H, max dotclock 170 MHz
    Display Product Name: 'HP 2311gt'
    Display Product Serial Number: ...
  Extension blocks: 1
Checksum: 0x4c

----------------

Block 1, CTA-861 Extension Block:
  Revision: 3
  Underscans IT Video Formats by default
  Supports YCbCr 4:4:4
  Supports YCbCr 4:2:2
  Native detailed modes: 2
  Video Data Block:
    VIC  16:  1920x1080   60.000 Hz  16:9    67.500 kHz 148.500 MHz (native)
    VIC   4:  1280x720    60.000 Hz  16:9    45.000 kHz  74.250 MHz
    VIC   3:   720x480    59.940 Hz  16:9    31.469 kHz  27.000 MHz
    VIC   2:   720x480    59.940 Hz   4:3    31.469 kHz  27.000 MHz
    VIC   1:   640x480    59.940 Hz   4:3    31.469 kHz  25.175 MHz
    VIC  31:  1920x1080   50.000 Hz  16:9    56.250 kHz 148.500 MHz (native)
    VIC  19:  1280x720    50.000 Hz  16:9    37.500 kHz  74.250 MHz
    VIC  18:   720x576    50.000 Hz  16:9    31.250 kHz  27.000 MHz
    VIC  17:   720x576    50.000 Hz   4:3    31.250 kHz  27.000 MHz
  Vendor-Specific Data Block (HDMI), OUI 00-0C-03:
    Source physical address: 1.0.0.0
    Supports_AI
    DC_36bit
    DC_30bit
    DC_Y444
    Maximum TMDS clock: 225 MHz
  Detailed Timing Descriptors:
    DTD 2:   720x480    59.940 Hz   3:2    31.469 kHz  27.000 MHz (510 mm x 287 mm)
                 Hfront   16 Hsync  62 Hback  60 Hpol N
                 Vfront    9 Vsync   6 Vback  30 Vpol N
    DTD 3:   720x576    50.000 Hz   5:4    31.250 kHz  27.000 MHz (510 mm x 287 mm)
                 Hfront   12 Hsync  64 Hback  68 Hpol N
                 Vfront    5 Vsync   5 Vback  39 Vpol N
    DTD 4:  1280x720    60.000 Hz  16:9    45.000 kHz  74.250 MHz (510 mm x 287 mm)
                 Hfront  110 Hsync  40 Hback 220 Hpol P
                 Vfront    5 Vsync   5 Vback  20 Vpol P
    DTD 5:  1280x720    50.000 Hz  16:9    37.500 kHz  74.250 MHz (510 mm x 287 mm)
                 Hfront  440 Hsync  40 Hback 220 Hpol P
                 Vfront    5 Vsync   5 Vback  20 Vpol P
Checksum: 0x00

----------------

Warnings:

Block 1, CTA-861 Extension Block:
  Display Product Serial Number is set, so the Serial Number in the Base EDID should be 0.
  Missing VCDB, needed for Set Selectable RGB Quantization to avoid interop issues.

Failures:

EDID:
  CTA-861: Native progressive timings are a mix of several resolutions.

EDID conformity: FAIL
