edid-decode (hex):

00 ff ff ff ff ff ff 00 09 e5 67 09 00 00 00 00
16 1e 01 04 95 1a 0e 78 03 35 20 99 59 5d 98 29
20 50 54 00 00 00 01 01 01 01 01 01 01 01 01 01
01 01 01 01 01 01 3e 1c 56 a0 50 00 16 30 30 20
36 00 00 90 10 00 00 1a d4 12 56 a0 50 00 16 30
30 20 36 00 00 90 10 00 00 1a 00 00 00 00 00 00
00 00 00 00 00 00 00 00 00 00 00 00 00 00 00 02
00 0c 43 f9 0b 3c 6e 1e 16 28 6f 00 00 00 00 5c

00 ff ff ff ff ff ff 00 09 e5 67 09 00 00 00 00
16 1e 01 04 95 1a 0e 78 03 35 20 99 59 5d 98 29
20 50 54 00 00 00 01 01 01 01 01 01 01 01 01 01
01 01 01 01 01 01 3e 1c 56 a0 50 00 16 30 30 20
36 00 00 90 10 00 00 1a d4 12 56 a0 50 00 16 30
30 20 36 00 00 90 10 00 00 1a 00 00 00 00 00 00
00 00 00 00 00 00 00 00 00 00 00 00 00 00 00 02
00 0c 43 f9 0b 3c 6e 1e 16 28 6f 00 00 00 00 5c

----------------

Block 0, Base EDID:
  EDID Structure Version & Revision: 1.4
  Vendor & Product Identification:
    Manufacturer: BOE
    Model: 2407
    Made in: week 22 of 2020
  Basic Display Parameters & Features:
    Digital display
    Bits per primary color channel: 6
    DisplayPort interface
    Maximum image size: 26 cm x 14 cm
    Gamma: 2.20
    Supported color formats: RGB 4:4:4
    First detailed timing includes the native pixel format and preferred refresh rate
    Display is continuous frequency
  Color Characteristics:
    Red  : 0.5976, 0.3505
    Green: 0.3642, 0.5947
    Blue : 0.1601, 0.1269
    White: 0.3125, 0.3281
  Established Timings I & II: none
  Standard Timings: none
  Detailed Timing Descriptors:
    DTD 1:  1366x768    59.973124 Hz 683:384   47.379 kHz     72.300000 MHz (256 mm x 144 mm)
                 Hfront   48 Hsync  32 Hback   80 Hpol P
                 Vfront    3 Vsync   6 Vback   13 Vpol N
    DTD 2:  1366x768    39.982083 Hz 683:384   31.586 kHz     48.200000 MHz (256 mm x 144 mm)
                 Hfront   48 Hsync  32 Hback   80 Hpol P
                 Vfront    3 Vsync   6 Vback   13 Vpol N
    Empty Descriptor
    Manufacturer-Specified Display Descriptor (0x02): 00 02 00 0c 43 f9 0b 3c 6e 1e 16 28 6f 00 00 00 '....C..<n..(o...'
Checksum: 0x5c

----------------

Block 1, Unknown EDID Extension Block 0x00:
  00 ff ff ff ff ff ff 00 09 e5 67 09 00 00 00 00 '..........g.....'
  16 1e 01 04 95 1a 0e 78 03 35 20 99 59 5d 98 29 '.......x.5 .Y].)'
  20 50 54 00 00 00 01 01 01 01 01 01 01 01 01 01 ' PT.............'
  01 01 01 01 01 01 3e 1c 56 a0 50 00 16 30 30 20 '......>.V.P..00 '
  36 00 00 90 10 00 00 1a d4 12 56 a0 50 00 16 30 '6.........V.P..0'
  30 20 36 00 00 90 10 00 00 1a 00 00 00 00 00 00 '0 6.............'
  00 00 00 00 00 00 00 00 00 00 00 00 00 00 00 02 '................'
  00 0c 43 f9 0b 3c 6e 1e 16 28 6f 00 00 00 00 5c '..C..<n..(o....\'
Checksum: 0x5c

----------------

Warnings:

Block 0, Base EDID:
  Missing Display Product Name.

Failures:

Block 0, Base EDID:
  Empty Descriptor: Use Dummy Descriptor instead of all zeroes.
  Missing Display Range Limits Descriptor.
Block 1, Base EDID:
  Unknown Extension Block.
EDID:
  Base EDID: EDID specified 0 extension block(s), but found 1 extension block(s).

EDID conformity: FAIL
