
EDID (hex):
00ffffffffffff001e6d475a1ff60000
0318010380331d78ea6275a3554fa027
125054210800714081c0810081809500
9040a9c0b300023a801871382d40582c
4500fe221100001e000000fd00383d1e
530f000a202020202020000000fc0032
334d5037350a202020202020000000ff
000a202020202020202020202020013f

Extracted contents:
header:          00 ff ff ff ff ff ff 00
serial number:   1e 6d 47 5a 1f f6 00 00 03 18
version:         01 03
basic params:    80 33 1d 78 ea
chroma info:     62 75 a3 55 4f a0 27 12 50 54
established:     21 08 00
standard:        71 40 81 c0 81 00 81 80 95 00 90 40 a9 c0 b3 00
descriptor 1:    02 3a 80 18 71 38 2d 40 58 2c 45 00 fe 22 11 00 00 1e
descriptor 2:    00 00 00 fd 00 38 3d 1e 53 0f 00 0a 20 20 20 20 20 20
descriptor 3:    00 00 00 fc 00 32 33 4d 50 37 35 0a 20 20 20 20 20 20
descriptor 4:    00 00 00 ff 00 0a 20 20 20 20 20 20 20 20 20 20 20 20
extensions:      01
checksum:        3f

EDID version: 1.3
Manufacturer: GSM Model 5a47 Serial Number --
Made in week 3 of 2014
Digital display
Maximum image size: 51 cm x 29 cm
Gamma: 2.20
DPMS levels: Standby Suspend Off
RGB color display
First detailed timing is preferred timing
Display x,y Chromaticity:
  Red:   0.6376, 0.3339
  Green: 0.3085, 0.6269
  Blue:  0.1533, 0.0732
  White: 0.3134, 0.3291
Established timings supported:
  640x480@60Hz 4:3 HorFreq: 31469 Hz Clock: 25.175 MHz
  800x600@60Hz 4:3 HorFreq: 37900 Hz Clock: 40.000 MHz
  1024x768@60Hz 4:3 HorFreq: 48400 Hz Clock: 65.000 MHz
Standard timings supported:
  1152x864@60Hz 4:3
  1280x720@60Hz 16:9
  1280x800@60Hz 16:10
  1280x1024@60Hz 5:4 HorFreq: 64000 Hz Clock: 108.000 MHz
  1440x900@60Hz 16:10 HorFreq: 55500 Hz Clock: 88.750 MHz
  1400x1050@60Hz 4:3 HorFreq: 64700 Hz Clock: 101.000 MHz
  1600x900@60Hz 16:9
  1680x1050@60Hz 16:10 HorFreq: 64700 Hz Clock: 119.000 MHz
Detailed mode: Clock 148.500 MHz, 510 mm x 290 mm
               1920 2008 2052 2200 hborder 0
               1080 1084 1089 1125 vborder 0
               +hsync +vsync 
               VertFreq: 60 Hz, HorFreq: 67500 Hz
Monitor ranges (GTF): 56-61Hz V, 30-83kHz H, max dotclock 150MHz
Monitor name: 23MP75
Serial number: 
-- 1 extension blocks
Checksum: 0x3f (valid)


