edid-decode (hex):

00 ff ff ff ff ff ff 00 09 e5 37 08 00 00 00 00
01 1d 01 04 a5 26 15 78 0a c8 10 a4 57 51 9b 27
0e 50 54 00 00 00 01 01 01 01 01 01 01 01 01 01
01 01 01 01 01 01 c4 36 80 cc 70 38 14 40 6c 30
aa 00 7e d7 10 00 00 1a ce 2b 80 cc 70 38 14 40
6c 30 aa 00 7e d7 10 00 00 1a 00 00 00 fe 00 36
4d 33 37 4b 80 4e 56 31 37 33 46 48 00 00 00 00
00 03 41 01 1e 02 10 00 00 0a 01 0a 20 20 00 52

----------------

Block 0, Base EDID:
  EDID Structure Version & Revision: 1.4
  Vendor & Product Identification:
    Manufacturer: BOE
    Model: 2103
    Made in: week 1 of 2019
  Basic Display Parameters & Features:
    Digital display
    Bits per primary color channel: 8
    DisplayPort interface
    Maximum image size: 38 cm x 21 cm
    Gamma: 2.20
    Supported color formats: RGB 4:4:4, YCrCb 4:4:4
    First detailed timing includes the native pixel format and preferred refresh rate
  Color Characteristics:
    Red  : 0.6435, 0.3398
    Green: 0.3183, 0.6054
    Blue : 0.1523, 0.0556
    White: 0.3125, 0.3281
  Established Timings I & II: none
  Standard Timings: none
  Detailed Timing Descriptors:
    DTD 1:  1920x1080   60.006848 Hz  16:9     66.008 kHz    140.200000 MHz (382 mm x 215 mm)
                 Hfront  108 Hsync  48 Hback   48 Hpol P
                 Vfront   10 Vsync  10 Vback    0 Vpol N
    DTD 2:  1920x1080   47.996918 Hz  16:9     52.797 kHz    112.140000 MHz (382 mm x 215 mm)
                 Hfront  108 Hsync  48 Hback   48 Hpol P
                 Vfront   10 Vsync  10 Vback    0 Vpol N
    Alphanumeric Data String: '6M37K'
    Manufacturer-Specified Display Descriptor (0x00): 00 00 00 03 41 01 1e 02 10 00 00 0a 01 0a 20 20 '....A.........  '
Checksum: 0x52

----------------

Failures:

Block 0, Base EDID:
  Detailed Timing Descriptor #1: 0 or negative vertical back porch.
  Detailed Timing Descriptor #2: 0 or negative vertical back porch.
  Alphanumeric Data String: Non-printable character.
  Missing Display Product Name.

EDID conformity: FAIL
