
EDID (hex):
00ffffffffffff0022f0252801010101
2f13010380291778ee69b5a655489c25
145054a1080081408180010101010101
010101010101662156aa51001e30468f
33009ae61000001e000000fd00304c18
5311000a202020202020000000fc0048
5020313835396d0a20202020000000ff
0033435139343734484a4b0a20200004

edid-decode (hex):

00 ff ff ff ff ff ff 00 22 f0 25 28 01 01 01 01
2f 13 01 03 80 29 17 78 ee 69 b5 a6 55 48 9c 25
14 50 54 a1 08 00 81 40 81 80 01 01 01 01 01 01
01 01 01 01 01 01 66 21 56 aa 51 00 1e 30 46 8f
33 00 9a e6 10 00 00 1e 00 00 00 fd 00 30 4c 18
53 11 00 0a 20 20 20 20 20 20 00 00 00 fc 00 48
50 20 31 38 35 39 6d 0a 20 20 20 20 00 00 00 ff
00 33 43 51 39 34 37 34 48 4a 4b 0a 20 20 00 04

----------------

Block 0, Base EDID:
  EDID Structure Version & Revision: 1.3
  Vendor & Product Identification:
    Manufacturer: HWP
    Model: 10277
    Serial Number: 16843009
    Made in: week 47 of 2009
  Basic Display Parameters & Features:
    Digital display
    Maximum image size: 41 cm x 23 cm
    Gamma: 2.20
    DPMS levels: Standby Suspend Off
    RGB color display
    Default (sRGB) color space is primary color space
    First detailed timing is the preferred timing
  Color Characteristics:
    Red  : 0.6494, 0.3339
    Green: 0.2832, 0.6103
    Blue : 0.1464, 0.0810
    White: 0.3134, 0.3291
  Established Timings I & II:
    IBM     :   720x400    70.081663 Hz   9:5     31.467 kHz     28.320000 MHz
    DMT 0x04:   640x480    59.940476 Hz   4:3     31.469 kHz     25.175000 MHz
    DMT 0x09:   800x600    60.316541 Hz   4:3     37.879 kHz     40.000000 MHz
    DMT 0x10:  1024x768    60.003840 Hz   4:3     48.363 kHz     65.000000 MHz
  Standard Timings:
    DMT 0x20:  1280x960    60.000000 Hz   4:3     60.000 kHz    108.000000 MHz
    DMT 0x23:  1280x1024   60.019740 Hz   5:4     63.981 kHz    108.000000 MHz
  Detailed Timing Descriptors:
    DTD 1:  1366x768    59.789541 Hz 683:384   47.712 kHz     85.500000 MHz (410 mm x 230 mm)
                 Hfront   70 Hsync 143 Hback  213 Hpol P
                 Vfront    3 Vsync   3 Vback   24 Vpol P
    Display Range Limits:
      Monitor ranges (GTF): 48-76 Hz V, 24-83 kHz H, max dotclock 170 MHz
    Display Product Name: 'HP 1859m'
    Display Product Serial Number: '3CQ9474HJK'
Checksum: 0x04
