
EDID (hex):
00ffffffffffff000472460a70036030
06210104b53c22783b24f5a8543da625
115054bfef8081c0818001018140b300
d1c07140714f565e00a0a0a029503020
350055502100001a000000fd0030aaf2
f250010a202020202020000000fc0058
563237355520560a20202020000000ff
003133303630303337303258303002fd
020333f14d1f01020304051011121314
3f222309070783010000e305c2006d1a
0000021730aa000462205f23e6060701
625f21d4bc00a0a0a0295020403500b9
882100001a5b9d00a0a0a02950302035
00b8882100001a866f80a07038404030
203500b9882100001a98e200a0a0a029
5030203500b9882100001a0000000084
701279000003003ca2030104ff099f00
2f001f009f05280002800400810b0104
ff099f002f801f009f05280002800400
d19600047f079f0057802b0037042c00
0300040007000a088100080400040200
00000000000000000000000000000000
00000000000000000000000000000000
00000000000000000000000000004190

edid-decode (hex):

00 ff ff ff ff ff ff 00 04 72 46 0a 70 03 60 30
06 21 01 04 b5 3c 22 78 3b 24 f5 a8 54 3d a6 25
11 50 54 bf ef 80 81 c0 81 80 01 01 81 40 b3 00
d1 c0 71 40 71 4f 56 5e 00 a0 a0 a0 29 50 30 20
35 00 55 50 21 00 00 1a 00 00 00 fd 00 30 aa f2
f2 50 01 0a 20 20 20 20 20 20 00 00 00 fc 00 58
56 32 37 35 55 20 56 0a 20 20 20 20 00 00 00 ff
00 31 33 30 36 30 30 33 37 30 32 58 30 30 02 fd

02 03 33 f1 4d 1f 01 02 03 04 05 10 11 12 13 14
3f 22 23 09 07 07 83 01 00 00 e3 05 c2 00 6d 1a
00 00 02 17 30 aa 00 04 62 20 5f 23 e6 06 07 01
62 5f 21 d4 bc 00 a0 a0 a0 29 50 20 40 35 00 b9
88 21 00 00 1a 5b 9d 00 a0 a0 a0 29 50 30 20 35
00 b8 88 21 00 00 1a 86 6f 80 a0 70 38 40 40 30
20 35 00 b9 88 21 00 00 1a 98 e2 00 a0 a0 a0 29
50 30 20 35 00 b9 88 21 00 00 1a 00 00 00 00 84

70 12 79 00 00 03 00 3c a2 03 01 04 ff 09 9f 00
2f 00 1f 00 9f 05 28 00 02 80 04 00 81 0b 01 04
ff 09 9f 00 2f 80 1f 00 9f 05 28 00 02 80 04 00
d1 96 00 04 7f 07 9f 00 57 80 2b 00 37 04 2c 00
03 00 04 00 07 00 0a 08 81 00 08 04 00 04 02 00
00 00 00 00 00 00 00 00 00 00 00 00 00 00 00 00
00 00 00 00 00 00 00 00 00 00 00 00 00 00 00 00
00 00 00 00 00 00 00 00 00 00 00 00 00 00 41 90

----------------

Block 0, Base EDID:
  EDID Structure Version & Revision: 1.4
  Vendor & Product Identification:
    Manufacturer: ACR
    Model: 2630
    Serial Number: 811598704
    Made in: week 6 of 2023
  Basic Display Parameters & Features:
    Digital display
    Bits per primary color channel: 10
    DisplayPort interface
    Maximum image size: 60 cm x 34 cm
    Gamma: 2.20
    DPMS levels: Off
    Supported color formats: RGB 4:4:4, YCrCb 4:4:4, YCrCb 4:2:2
    First detailed timing includes the native pixel format and preferred refresh rate
    Display is continuous frequency
  Color Characteristics:
    Red  : 0.6562, 0.3300
    Green: 0.2392, 0.6484
    Blue : 0.1474, 0.0693
    White: 0.3134, 0.3291
  Established Timings I & II:
    IBM     :   720x400    70.081663 Hz   9:5     31.467 kHz     28.320000 MHz
    DMT 0x04:   640x480    59.940476 Hz   4:3     31.469 kHz     25.175000 MHz
    Apple   :   640x480    66.666667 Hz   4:3     35.000 kHz     30.240000 MHz
    DMT 0x05:   640x480    72.808802 Hz   4:3     37.861 kHz     31.500000 MHz
    DMT 0x06:   640x480    75.000000 Hz   4:3     37.500 kHz     31.500000 MHz
    DMT 0x08:   800x600    56.250000 Hz   4:3     35.156 kHz     36.000000 MHz
    DMT 0x09:   800x600    60.316541 Hz   4:3     37.879 kHz     40.000000 MHz
    DMT 0x0a:   800x600    72.187572 Hz   4:3     48.077 kHz     50.000000 MHz
    DMT 0x0b:   800x600    75.000000 Hz   4:3     46.875 kHz     49.500000 MHz
    Apple   :   832x624    74.551266 Hz   4:3     49.726 kHz     57.284000 MHz
    DMT 0x10:  1024x768    60.003840 Hz   4:3     48.363 kHz     65.000000 MHz
    DMT 0x11:  1024x768    70.069359 Hz   4:3     56.476 kHz     75.000000 MHz
    DMT 0x12:  1024x768    75.028582 Hz   4:3     60.023 kHz     78.750000 MHz
    DMT 0x24:  1280x1024   75.024675 Hz   5:4     79.976 kHz    135.000000 MHz
    Apple   :  1152x870    75.061550 Hz 192:145   68.681 kHz    100.000000 MHz
  Standard Timings:
    DMT 0x55:  1280x720    60.000000 Hz  16:9     45.000 kHz     74.250000 MHz
    DMT 0x23:  1280x1024   60.019740 Hz   5:4     63.981 kHz    108.000000 MHz
    DMT 0x20:  1280x960    60.000000 Hz   4:3     60.000 kHz    108.000000 MHz
    DMT 0x3a:  1680x1050   59.954250 Hz  16:10    65.290 kHz    146.250000 MHz
    DMT 0x52:  1920x1080   60.000000 Hz  16:9     67.500 kHz    148.500000 MHz
    GTF     :  1152x864    60.000000 Hz   4:3     53.700 kHz     81.624000 MHz
    DMT 0x15:  1152x864    75.000000 Hz   4:3     67.500 kHz    108.000000 MHz
  Detailed Timing Descriptors:
    DTD 1:  2560x1440   59.950550 Hz  16:9     88.787 kHz    241.500000 MHz (597 mm x 336 mm)
                 Hfront   48 Hsync  32 Hback   80 Hpol P
                 Vfront    3 Vsync   5 Vback   33 Vpol N
    Display Range Limits:
      Monitor ranges (Bare Limits): 48-170 Hz V, 242-242 kHz H, max dotclock 800 MHz
    Display Product Name: 'XV275U V'
    Display Product Serial Number: '1306003702X00'
  Extension blocks: 2
Checksum: 0xfd

----------------

Block 1, CTA-861 Extension Block:
  Revision: 3
  Underscans IT Video Formats by default
  Basic audio support
  Supports YCbCr 4:4:4
  Supports YCbCr 4:2:2
  Native detailed modes: 1
  Video Data Block:
    VIC  31:  1920x1080   50.000000 Hz  16:9     56.250 kHz    148.500000 MHz
    VIC   1:   640x480    59.940476 Hz   4:3     31.469 kHz     25.175000 MHz
    VIC   2:   720x480    59.940060 Hz   4:3     31.469 kHz     27.000000 MHz
    VIC   3:   720x480    59.940060 Hz  16:9     31.469 kHz     27.000000 MHz
    VIC   4:  1280x720    60.000000 Hz  16:9     45.000 kHz     74.250000 MHz
    VIC   5:  1920x1080i  60.000000 Hz  16:9     33.750 kHz     74.250000 MHz
    VIC  16:  1920x1080   60.000000 Hz  16:9     67.500 kHz    148.500000 MHz
    VIC  17:   720x576    50.000000 Hz   4:3     31.250 kHz     27.000000 MHz
    VIC  18:   720x576    50.000000 Hz  16:9     31.250 kHz     27.000000 MHz
    VIC  19:  1280x720    50.000000 Hz  16:9     37.500 kHz     74.250000 MHz
    VIC  20:  1920x1080i  50.000000 Hz  16:9     28.125 kHz     74.250000 MHz
    VIC  63:  1920x1080  120.000000 Hz  16:9    135.000 kHz    297.000000 MHz
    VIC  34:  1920x1080   30.000000 Hz  16:9     33.750 kHz     74.250000 MHz
  Audio Data Block:
    Linear PCM:
      Max channels: 2
      Supported sample rates (kHz): 48 44.1 32
      Supported sample sizes (bits): 24 20 16
  Speaker Allocation Data Block:
    FL/FR - Front Left/Right
  Colorimetry Data Block:
    xvYCC709
    BT2020YCC
    BT2020RGB
  Vendor-Specific Data Block (AMD), OUI 00-00-1A:
    Version: 2.23
    Minimum Refresh Rate: 48 Hz
    Maximum Refresh Rate: 170 Hz
    Flags 1.x: 0x00
    Flags 2.x: 0x04
    Maximum luminance: 98 (417.710 cd/m^2)
    Minimum luminance: 32 (0.066 cd/m^2)
    Maximum luminance (without local dimming): 95 (391.429 cd/m^2)
    Minimum luminance (without local dimming): 35 (0.074 cd/m^2)
  HDR Static Metadata Data Block:
    Electro optical transfer functions:
      Traditional gamma - SDR luminance range
      Traditional gamma - HDR luminance range
      SMPTE ST2084
    Supported static metadata descriptors:
      Static metadata type 1
    Desired content max luminance: 98 (417.710 cd/m^2)
    Desired content max frame-average luminance: 95 (391.429 cd/m^2)
    Desired content min luminance: 33 (0.070 cd/m^2)
  Detailed Timing Descriptors:
    DTD 2:  2560x1440  120.000397 Hz  16:9    177.721 kHz    483.400000 MHz (697 mm x 392 mm)
                 Hfront   32 Hsync  64 Hback   64 Hpol P
                 Vfront    3 Vsync   5 Vback   33 Vpol N
    DTD 3:  2560x1440   99.999504 Hz  16:9    148.099 kHz    402.830000 MHz (696 mm x 392 mm)
                 Hfront   48 Hsync  32 Hback   80 Hpol P
                 Vfront    3 Vsync   5 Vback   33 Vpol N
    DTD 4:  1920x1080  119.982181 Hz  16:9    137.260 kHz    285.500000 MHz (697 mm x 392 mm)
                 Hfront   48 Hsync  32 Hback   80 Hpol P
                 Vfront    3 Vsync   5 Vback   56 Vpol N
    DTD 5:  2560x1440  144.000477 Hz  16:9    213.265 kHz    580.080000 MHz (697 mm x 392 mm)
                 Hfront   48 Hsync  32 Hback   80 Hpol P
                 Vfront    3 Vsync   5 Vback   33 Vpol N
Checksum: 0x84  Unused space in Extension Block: 4 bytes

----------------

Block 2, DisplayID Extension Block:
  Version: 1.2
  Extension Count: 0
  Display Product Type: Extension Section
  Video Timing Modes Type 1 - Detailed Timings Data Block:
    DTD:  2560x1440  164.999305 Hz  16:9    244.364 kHz    664.670000 MHz (aspect 16:9, no 3D stereo)
               Hfront   48 Hsync  32 Hback   80 Hpol N
               Vfront    3 Vsync   5 Vback   33 Vpol P
    DTD:  2560x1440  170.001390 Hz  16:9    251.772 kHz    684.820000 MHz (aspect 16:9, no 3D stereo)
               Hfront   48 Hsync  32 Hback   80 Hpol P
               Vfront    3 Vsync   5 Vback   33 Vpol P
    DTD:  1920x1080  165.000000 Hz  16:9    185.625 kHz    386.100000 MHz (aspect 16:9, no 3D stereo)
               Hfront   88 Hsync  44 Hback   28 Hpol P
               Vfront    4 Vsync   5 Vback   36 Vpol N
  Supported Timing Modes Type 1 - VESA DMT Timings Data Block:
    DMT 0x04:   640x480    59.940476 Hz   4:3     31.469 kHz     25.175000 MHz
    DMT 0x09:   800x600    60.316541 Hz   4:3     37.879 kHz     40.000000 MHz
    DMT 0x10:  1024x768    60.003840 Hz   4:3     48.363 kHz     65.000000 MHz
    DMT 0x1c:  1280x800    59.810326 Hz  16:10    49.702 kHz     83.500000 MHz
    DMT 0x23:  1280x1024   60.019740 Hz   5:4     63.981 kHz    108.000000 MHz
    DMT 0x33:  1600x1200   60.000000 Hz   4:3     75.000 kHz    162.000000 MHz
    DMT 0x3a:  1680x1050   59.954250 Hz  16:10    65.290 kHz    146.250000 MHz
  Checksum: 0x41
Checksum: 0x90


