
EDID (hex):
00ffffffffffff005304000001000000
003a010380000078ea8db4a65438ae25
0d4f54ad0e0001010101010101010101
0101010101019e20009051201f304880
3600dd0c1100007f4826009851201e30
d080470468221100001c362900985120
1e30d080470468221100001c000000fc
0048444d492020200a20202020200100
020319f14601020304121323091f0783
01000065030c0010008c0ad08a20e02d
10103e9600565021000018011d007251
d01e206e28550056502100001e8c0ad0
8a20e02d10103e96005650210000188c
0ad090204031200c4055005650210000
18000000000000000000000000000000
0000000000000000000000000000005c

edid-decode (hex):

00 ff ff ff ff ff ff 00 53 04 00 00 01 00 00 00
00 3a 01 03 80 00 00 78 ea 8d b4 a6 54 38 ae 25
0d 4f 54 ad 0e 00 01 01 01 01 01 01 01 01 01 01
01 01 01 01 01 01 9e 20 00 90 51 20 1f 30 48 80
36 00 dd 0c 11 00 00 7f 48 26 00 98 51 20 1e 30
d0 80 47 04 68 22 11 00 00 1c 36 29 00 98 51 20
1e 30 d0 80 47 04 68 22 11 00 00 1c 00 00 00 fc
00 48 44 4d 49 20 20 20 0a 20 20 20 20 20 01 00

02 03 19 f1 46 01 02 03 04 12 13 23 09 1f 07 83
01 00 00 65 03 0c 00 10 00 8c 0a d0 8a 20 e0 2d
10 10 3e 96 00 56 50 21 00 00 18 01 1d 00 72 51
d0 1e 20 6e 28 55 00 56 50 21 00 00 1e 8c 0a d0
8a 20 e0 2d 10 10 3e 96 00 56 50 21 00 00 18 8c
0a d0 90 20 40 31 20 0c 40 55 00 56 50 21 00 00
18 00 00 00 00 00 00 00 00 00 00 00 00 00 00 00
00 00 00 00 00 00 00 00 00 00 00 00 00 00 00 5c

----------------

Block 0, Base EDID:
  EDID Structure Version & Revision: 1.3
  Vendor & Product Identification:
    Manufacturer: TXD
    Model: 0
    Serial Number: 1
    Made in: 2048
  Basic Display Parameters & Features:
    Digital display
    Image size is variable
    Gamma: 2.20
    DPMS levels: Standby Suspend Off
    RGB color display
    First detailed timing is the preferred timing
  Color Characteristics:
    Red  : 0.6503, 0.3281
    Green: 0.2216, 0.6806
    Blue : 0.1464, 0.0537
    White: 0.3095, 0.3281
  Established Timings I & II:
    IBM     :   720x400    70.081663 Hz   9:5     31.467 kHz     28.320000 MHz
    DMT 0x04:   640x480    59.940476 Hz   4:3     31.469 kHz     25.175000 MHz
    DMT 0x05:   640x480    72.808802 Hz   4:3     37.861 kHz     31.500000 MHz
    DMT 0x06:   640x480    75.000000 Hz   4:3     37.500 kHz     31.500000 MHz
    DMT 0x09:   800x600    60.316541 Hz   4:3     37.879 kHz     40.000000 MHz
    DMT 0x10:  1024x768    60.003840 Hz   4:3     48.363 kHz     65.000000 MHz
    DMT 0x11:  1024x768    70.069359 Hz   4:3     56.476 kHz     75.000000 MHz
    DMT 0x12:  1024x768    75.028582 Hz   4:3     60.023 kHz     78.750000 MHz
  Standard Timings: none
  Detailed Timing Descriptors:
    DTD 1:  1280x800    59.810326 Hz   8:5     49.702 kHz     83.500000 MHz (side by side interleaved, 477 mm x 268 mm)
                 Hfront   72 Hsync 128 Hback  200 Hpol P
                 Vfront    3 Vsync   6 Vback   22 Vpol P
    DTD 2:  1280x800    69.948039 Hz   8:5     58.057 kHz     98.000000 MHz (360 mm x 290 mm)
                 Hfront  208 Hsync 128 Hback   72 Hpol N
                 Vfront   20 Vsync   7 Vback    3 Vpol P
    DTD 3:  1280x800    75.301205 Hz   8:5     62.500 kHz    105.500000 MHz (360 mm x 290 mm)
                 Hfront  208 Hsync 128 Hback   72 Hpol N
                 Vfront   20 Vsync   7 Vback    3 Vpol P
    Display Product Name: 'HDMI   '
  Extension blocks: 1
Checksum: 0x00

----------------

Block 1, CTA-861 Extension Block:
  Revision: 3
  Underscans IT Video Formats by default
  Basic audio support
  Supports YCbCr 4:4:4
  Supports YCbCr 4:2:2
  Native detailed modes: 1
  Video Data Block:
    VIC   1:   640x480    59.940476 Hz   4:3     31.469 kHz     25.175000 MHz
    VIC   2:   720x480    59.940060 Hz   4:3     31.469 kHz     27.000000 MHz
    VIC   3:   720x480    59.940060 Hz  16:9     31.469 kHz     27.000000 MHz
    VIC   4:  1280x720    60.000000 Hz  16:9     45.000 kHz     74.250000 MHz
    VIC  18:   720x576    50.000000 Hz  16:9     31.250 kHz     27.000000 MHz
    VIC  19:  1280x720    50.000000 Hz  16:9     37.500 kHz     74.250000 MHz
  Audio Data Block:
    Linear PCM:
      Max channels: 2
      Supported sample rates (kHz): 96 88.2 48 44.1 32
      Supported sample sizes (bits): 24 20 16
  Speaker Allocation Data Block:
    FL/FR - Front Left/Right
  Vendor-Specific Data Block (HDMI), OUI 00-0C-03:
    Source physical address: 1.0.0.0
  Detailed Timing Descriptors:
    DTD 4:   720x480    59.940060 Hz   3:2     31.469 kHz     27.000000 MHz (598 mm x 336 mm)
                 Hfront   16 Hsync  62 Hback   60 Hpol N
                 Vfront    9 Vsync   6 Vback   30 Vpol N
    DTD 5:  1280x720    60.000000 Hz  16:9     45.000 kHz     74.250000 MHz (598 mm x 336 mm)
                 Hfront  110 Hsync  40 Hback  220 Hpol P
                 Vfront    5 Vsync   5 Vback   20 Vpol P
    DTD 6:   720x480    59.940060 Hz   3:2     31.469 kHz     27.000000 MHz (598 mm x 336 mm)
                 Hfront   16 Hsync  62 Hback   60 Hpol N
                 Vfront    9 Vsync   6 Vback   30 Vpol N
    DTD 7:   720x576    50.000000 Hz   5:4     31.250 kHz     27.000000 MHz (598 mm x 336 mm)
                 Hfront   12 Hsync  64 Hback   68 Hpol N
                 Vfront    5 Vsync   5 Vback   39 Vpol N
Checksum: 0x5c
