edid-decode (hex):

00 ff ff ff ff ff ff 00 22 f0 0b 28 01 01 01 01
31 12 01 03 68 2f 1d 78 ee 04 05 a5 56 47 9e 25
15 50 54 a5 6b 80 71 00 81 40 81 80 95 00 a9 00
b3 00 01 01 01 01 21 39 90 30 62 1a 27 40 68 b0
36 00 d1 23 11 00 00 1c 00 00 00 fd 00 30 4c 18
53 10 00 0a 20 20 20 20 20 20 00 00 00 fc 00 48
50 20 77 32 32 31 36 0a 20 20 20 20 00 00 00 ff
00 43 4e 54 38 34 39 4c 43 4a 54 0a 20 20 00 33

----------------

Block 0, Base EDID:
  EDID Structure Version & Revision: 1.3
  Vendor & Product Identification:
    Manufacturer: HWP
    Model: 10251
    Serial Number: ...
    Made in: week 49 of 2008
  Basic Display Parameters & Features:
    Analog display
    Input voltage level: 0.7/0.7 V
    Sync: Separate
    Maximum image size: 47 cm x 29 cm
    Gamma: 2.20
    DPMS levels: Standby Suspend Off
    RGB color display
    Default (sRGB) color space is primary color space
    First detailed timing is the preferred timing
  Color Characteristics:
    Red  : 0.6445, 0.3359
    Green: 0.2783, 0.6171
    Blue : 0.1445, 0.0820
    White: 0.3134, 0.3291
  Established Timings I & II:
    IBM     :   720x400    70.082 Hz   9:5    31.467 kHz  28.320 MHz
    DMT 0x04:   640x480    59.940 Hz   4:3    31.469 kHz  25.175 MHz
    DMT 0x06:   640x480    75.000 Hz   4:3    37.500 kHz  31.500 MHz
    DMT 0x09:   800x600    60.317 Hz   4:3    37.879 kHz  40.000 MHz
    DMT 0x0b:   800x600    75.000 Hz   4:3    46.875 kHz  49.500 MHz
    Apple   :   832x624    74.551 Hz   4:3    49.726 kHz  57.284 MHz
    DMT 0x10:  1024x768    60.004 Hz   4:3    48.363 kHz  65.000 MHz
    DMT 0x12:  1024x768    75.029 Hz   4:3    60.023 kHz  78.750 MHz
    DMT 0x24:  1280x1024   75.025 Hz   5:4    79.976 kHz 135.000 MHz
    Apple   :  1152x870    75.062 Hz 192:145  68.681 kHz 100.000 MHz
  Standard Timings:
    GTF     :  1152x720    60.000 Hz  16:10   44.760 kHz  67.319 MHz
    DMT 0x20:  1280x960    60.000 Hz   4:3    60.000 kHz 108.000 MHz
    DMT 0x23:  1280x1024   60.020 Hz   5:4    63.981 kHz 108.000 MHz
    DMT 0x2f:  1440x900    59.887 Hz  16:10   55.935 kHz 106.500 MHz
    GTF     :  1600x1000   60.000 Hz  16:10   62.100 kHz 133.142 MHz
    DMT 0x3a:  1680x1050   59.954 Hz  16:10   65.290 kHz 146.250 MHz
  Detailed Timing Descriptors:
    DTD 1:  1680x1050   59.954 Hz   8:5    65.290 kHz 146.250 MHz (465 mm x 291 mm)
                 Hfront  104 Hsync 176 Hback 280 Hpol N
                 Vfront    3 Vsync   6 Vback  30 Vpol P
  Display Range Limits:
    Monitor ranges (GTF): 48-76 Hz V, 24-83 kHz H, max dotclock 160 MHz
    Display Product Name: 'HP w2216'
    Display Product Serial Number: ...
Checksum: 0x33

----------------

Failures:

Block 0, Base EDID:
  Basic Display Parameters & Features: sRGB is signaled, but the chromaticities do not match.

EDID conformity: FAIL
