edid-decode (hex):

00 ff ff ff ff ff ff 00 0d ae 87 14 00 00 00 00
28 16 01 04 95 1f 11 78 02 f8 45 96 57 54 92 28
23 50 54 00 00 00 01 01 01 01 01 01 01 01 01 01
01 01 01 01 01 01 da 1d 56 e2 50 00 20 30 44 2d
47 00 35 ae 10 00 00 18 00 00 00 fe 00 4e 31 34
30 42 47 45 2d 45 42 33 0a 20 00 00 00 fe 00 43
4d 4e 0a 20 20 20 20 20 20 20 20 20 00 00 00 fe
00 4e 31 34 30 42 47 45 2d 45 42 33 0a 20 00 07

----------------

Block 0, Base EDID:
  EDID Structure Version & Revision: 1.4
  Vendor & Product Identification:
    Manufacturer: CMN
    Model: 5255
    Made in: week 40 of 2012
  Basic Display Parameters & Features:
    Digital display
    Bits per primary color channel: 6
    DisplayPort interface
    Maximum image size: 31 cm x 17 cm
    Gamma: 2.20
    Supported color formats: RGB 4:4:4
    First detailed timing includes the native pixel format and preferred refresh rate
  Color Characteristics:
    Red  : 0.5888, 0.3427
    Green: 0.3300, 0.5703
    Blue : 0.1572, 0.1367
    White: 0.3134, 0.3291
  Established Timings I & II: none
  Standard Timings: none
  Detailed Timing Descriptors:
    DTD 1:  1366x768    60.003141 Hz 683:384   48.003 kHz     76.420000 MHz (309 mm x 174 mm)
                 Hfront   68 Hsync  45 Hback  113 Hpol N
                 Vfront    4 Vsync   7 Vback   21 Vpol N
    Alphanumeric Data String: 'N140BGE-EB3'
    Alphanumeric Data String: 'CMN'
    Alphanumeric Data String: 'N140BGE-EB3'
Checksum: 0x07

----------------

Warnings:

Block 0, Base EDID:
  Missing Display Product Name.

EDID conformity: PASS
