
EDID (hex):
00ffffffffffff0030aec36100000000
251d0104a5311e783a3a65a755529c27
0f5054310c0081009500a94ab300d1c0
d1008180a940283c80a070b023403020
360006442100001a000000fc00543233
642d31300a2020202020000000fd0032
4b1e5114000a202020202020000000ff
005639303458335a440affffffff0123
020316b14b9005040302011f12131411
65030c001000011d8018711c1620582c
2500c48e2100009e7c2e90a0601a1e40
30203600dc0b1100001cab22a0a05084
1a3030203600dc0b1100001c662156aa
51001e30468f3300dc0b1100001e0000
00000000000000000000000000000000
000000000000000000000000000000d5

Extracted contents:
header:          00 ff ff ff ff ff ff 00
serial number:   30 ae c3 61 00 00 00 00 25 1d
version:         01 04
basic params:    a5 31 1e 78 3a
chroma info:     3a 65 a7 55 52 9c 27 0f 50 54
established:     31 0c 00
standard:        81 00 95 00 a9 4a b3 00 d1 c0 d1 00 81 80 a9 40
descriptor 1:    28 3c 80 a0 70 b0 23 40 30 20 36 00 06 44 21 00 00 1a
descriptor 2:    00 00 00 fc 00 54 32 33 64 2d 31 30 0a 20 20 20 20 20
descriptor 3:    00 00 00 fd 00 32 4b 1e 51 14 00 0a 20 20 20 20 20 20
descriptor 4:    00 00 00 ff 00 56 39 30 34 58 33 5a 44 0a ff ff ff ff
extensions:      01
checksum:        23

EDID version: 1.4
Manufacturer: LEN Model 61c3 Serial Number --
Made in week 37 of 2019
Digital display
8 bits per primary color channel
DisplayPort interface
Maximum image size: 49 cm x 30 cm
Gamma: 2.20
DPMS levels: Off
Supported color formats: RGB 4:4:4, YCrCb 4:4:4, YCrCb 4:2:2
First detailed timing includes the native pixel format and preferred refresh rate
Display x,y Chromaticity:
  Red:   0.6523, 0.3349
  Green: 0.3222, 0.6113
  Blue:  0.1533, 0.0605
  White: 0.3134, 0.3291
Established timings supported:
  640x480@60Hz 4:3 HorFreq: 31469 Hz Clock: 25.175 MHz
  640x480@67Hz 4:3 HorFreq: 35000 Hz Clock: 30.240 MHz
  800x600@60Hz 4:3 HorFreq: 37900 Hz Clock: 40.000 MHz
  1024x768@60Hz 4:3 HorFreq: 48400 Hz Clock: 65.000 MHz
  1024x768@70Hz 4:3 HorFreq: 56500 Hz Clock: 75.000 MHz
Standard timings supported:
  1280x800@60Hz 16:10
  1440x900@60Hz 16:10 HorFreq: 55500 Hz Clock: 88.750 MHz
  1600x1200@70Hz 4:3 HorFreq: 87500 Hz Clock: 189.000 MHz
  1680x1050@60Hz 16:10 HorFreq: 64700 Hz Clock: 119.000 MHz
  1920x1080@60Hz 16:9
  1920x1200@60Hz 16:10 HorFreq: 74000 Hz Clock: 154.000 MHz
  1280x1024@60Hz 5:4 HorFreq: 64000 Hz Clock: 108.000 MHz
  1600x1200@60Hz 4:3 HorFreq: 75000 Hz Clock: 162.000 MHz
Detailed mode: Clock 154.000 MHz, 518 mm x 324 mm
               1920 1968 2000 2080 hborder 0
               1200 1203 1209 1235 vborder 0
               +hsync -vsync 
               VertFreq: 59 Hz, HorFreq: 74038 Hz
Monitor name: T23d-10
Monitor ranges (GTF): 50-75Hz V, 30-81kHz H, max dotclock 200MHz
Serial number: --
Has 1 extension blocks
Checksum: 0x23 (valid)

CTA extension block
Extension version: 3
18 bytes of CTA data
  Video data block
    VIC  16 1920x1080@60Hz 16:9 (native) HorFreq: 67500 Hz Clock: 148.500 MHz
    VIC   5 1920x1080i@60Hz 16:9  HorFreq: 33750 Hz Clock: 74.250 MHz
    VIC   4 1280x720@60Hz 16:9  HorFreq: 45000 Hz Clock: 74.250 MHz
    VIC   3 720x480@60Hz 16:9  HorFreq: 31469 Hz Clock: 27.000 MHz
    VIC   2 720x480@60Hz 4:3  HorFreq: 31469 Hz Clock: 27.000 MHz
    VIC   1 640x480@60Hz 4:3  HorFreq: 31469 Hz Clock: 25.175 MHz
    VIC  31 1920x1080@50Hz 16:9  HorFreq: 56250 Hz Clock: 148.500 MHz
    VIC  18 720x576@50Hz 16:9  HorFreq: 31250 Hz Clock: 27.000 MHz
    VIC  19 1280x720@50Hz 16:9  HorFreq: 37500 Hz Clock: 74.250 MHz
    VIC  20 1920x1080i@50Hz 16:9  HorFreq: 28125 Hz Clock: 74.250 MHz
    VIC  17 720x576@50Hz 4:3  HorFreq: 31250 Hz Clock: 27.000 MHz
  Vendor-specific data block, OUI 000c03 (HDMI)
    Source physical address 1.0.0.0
Underscans PC formats by default
Supports YCbCr 4:4:4
Supports YCbCr 4:2:2
1 native detailed modes
Detailed mode: Clock 74.250 MHz, 708 mm x 398 mm
               1920 2008 2052 2200 hborder 0
                540  542  547  562 vborder 0
               +hsync +vsync interlaced 
               VertFreq: 60 Hz, HorFreq: 33750 Hz
Detailed mode: Clock 119.000 MHz, 476 mm x 267 mm
               1680 1728 1760 1840 hborder 0
               1050 1053 1059 1080 vborder 0
               -hsync +vsync 
               VertFreq: 59 Hz, HorFreq: 64673 Hz
Detailed mode: Clock 88.750 MHz, 476 mm x 267 mm
               1440 1488 1520 1600 hborder 0
                900  903  909  926 vborder 0
               -hsync +vsync 
               VertFreq: 59 Hz, HorFreq: 55468 Hz
Detailed mode: Clock 85.500 MHz, 476 mm x 267 mm
               1366 1436 1579 1792 hborder 0
                768  771  774  798 vborder 0
               +hsync +vsync 
               VertFreq: 59 Hz, HorFreq: 47712 Hz
Checksum: 0xd5 (valid)

EDID block does NOT conform to EDID 1.4!
	Detailed block string not properly terminated
Warning: One or more of the timings is out of range of the Monitor Ranges:
  Vertical Freq: 50 - 70 Hz
  Horizontal Freq: 28125 - 87500 Hz
  Maximum Clock: 189.000 MHz
