
EDID (hex):
00ffffffffffff000469b22001010101
01120103802b1b782ecfc5a35a49a025
125054bfef806140714f81809500950f
904001010101a82f78d0511a27405890
3400b10f1100001c000000ff0038314c
4d56443030303533350a000000fd0038
4b1f5011000a202020202020000000fc
0041535553204c53323031ffff0a0026

Extracted contents:
header:          00 ff ff ff ff ff ff 00
serial number:   04 69 b2 20 01 01 01 01 01 12
version:         01 03
basic params:    80 2b 1b 78 2e
chroma info:     cf c5 a3 5a 49 a0 25 12 50 54
established:     bf ef 80
standard:        61 40 71 4f 81 80 95 00 95 0f 90 40 01 01 01 01
descriptor 1:    a8 2f 78 d0 51 1a 27 40 58 90 34 00 b1 0f 11 00 00 1c
descriptor 2:    00 00 00 ff 00 38 31 4c 4d 56 44 30 30 30 35 33 35 0a
descriptor 3:    00 00 00 fd 00 38 4b 1f 50 11 00 0a 20 20 20 20 20 20
descriptor 4:    00 00 00 fc 00 41 53 55 53 20 4c 53 32 30 31 ff ff 0a
extensions:      00
checksum:        26

EDID version: 1.3
Manufacturer: ACI Model 20b2 Serial Number --
Made in week 1 of 2008
Digital display
Maximum image size: 43 cm x 27 cm
Gamma: 2.20
DPMS levels: Off
RGB color display
Default (sRGB) color space is primary color space
First detailed timing is preferred timing
Display x,y Chromaticity:
  Red:   0.6396, 0.3515
  Green: 0.2880, 0.6279
  Blue:  0.1474, 0.0703
  White: 0.3134, 0.3291
Established timings supported:
  720x400@70Hz 9:5 HorFreq: 31469 Hz Clock: 28.320 MHz
  640x480@60Hz 4:3 HorFreq: 31469 Hz Clock: 25.175 MHz
  640x480@67Hz 4:3 HorFreq: 35000 Hz Clock: 30.240 MHz
  640x480@72Hz 4:3 HorFreq: 37900 Hz Clock: 31.500 MHz
  640x480@75Hz 4:3 HorFreq: 37500 Hz Clock: 31.500 MHz
  800x600@56Hz 4:3 HorFreq: 35200 Hz Clock: 36.000 MHz
  800x600@60Hz 4:3 HorFreq: 37900 Hz Clock: 40.000 MHz
  800x600@72Hz 4:3 HorFreq: 48100 Hz Clock: 50.000 MHz
  800x600@75Hz 4:3 HorFreq: 46900 Hz Clock: 49.500 MHz
  832x624@75Hz 4:3 HorFreq: 49726 Hz Clock: 57.284 MHz
  1024x768@60Hz 4:3 HorFreq: 48400 Hz Clock: 65.000 MHz
  1024x768@70Hz 4:3 HorFreq: 56500 Hz Clock: 75.000 MHz
  1024x768@75Hz 4:3 HorFreq: 60000 Hz Clock: 78.750 MHz
  1280x1024@75Hz 5:4 HorFreq: 80000 Hz Clock: 135.000 MHz
  1152x870@75Hz 192:145 HorFreq: 67500 Hz Clock: 108.000 MHz
Standard timings supported:
  1024x768@60Hz 4:3 HorFreq: 48400 Hz Clock: 65.000 MHz
  1152x864@75Hz 4:3 HorFreq: 67500 Hz Clock: 108.000 MHz
  1280x1024@60Hz 5:4 HorFreq: 64000 Hz Clock: 108.000 MHz
  1440x900@60Hz 16:10 HorFreq: 55500 Hz Clock: 88.750 MHz
  1440x900@75Hz 16:10 HorFreq: 82300 Hz Clock: 156.000 MHz
  1400x1050@60Hz 4:3 HorFreq: 64700 Hz Clock: 101.000 MHz
Detailed mode: Clock 122.000 MHz, 433 mm x 271 mm
               1400 1488 1632 1864 hborder 0
               1050 1053 1057 1089 vborder 0
               -hsync +vsync 
               VertFreq: 60 Hz, HorFreq: 65450 Hz
Serial number: --
Monitor ranges (GTF): 56-75Hz V, 31-80kHz H, max dotclock 170MHz
Monitor name: ASUS LS201
Checksum: 0x26 (valid)
EDID block does NOT conform to EDID 1.3!
	sRGB is signaled, but the chromaticities do not match
	Detailed block string not properly terminated
One or more of the timings is out of range of the Monitor Ranges:
  Vertical Freq: 56 - 75 Hz
  Horizontal Freq: 31469 - 82300 Hz
  Maximum Clock: 156.000 MHz
