edid-decode (hex):

00 ff ff ff ff ff ff 00 0d af 02 17 00 00 00 00
0d 10 01 03 80 25 17 78 0a 69 35 92 55 54 91 27
21 50 54 00 00 00 01 01 01 01 01 01 01 01 01 01
01 01 01 01 01 01 ab 22 a0 a0 50 84 1a 30 30 20
36 00 6f e6 10 00 00 18 00 00 00 fe 00 4e 31 37
30 43 32 2d 4c 30 31 0a 20 20 00 00 00 fe 00 43
4d 4f 0a 20 20 20 20 20 20 20 20 20 00 00 00 fe
00 4e 31 37 30 43 32 2d 4c 30 31 0a 20 20 00 3d

----------------

Block 0, Base EDID:
  EDID Structure Version & Revision: 1.3
  Vendor & Product Identification:
    Manufacturer: CMO
    Model: 5890
    Made in: week 13 of 2006
  Basic Display Parameters & Features:
    Digital display
    Maximum image size: 37 cm x 23 cm
    Gamma: 2.20
    RGB color display
    First detailed timing is preferred timing
  Color Characteristics:
    Red  : 0.5712, 0.3339
    Green: 0.3300, 0.5673
    Blue : 0.1523, 0.1318
    White: 0.3134, 0.3291
  Established Timings I & II: none
  Standard Timings: none
  Detailed Timing Descriptors:
    DTD 1:  1440x900    59.901 Hz   8:5    55.469 kHz  88.750 MHz (367 mm x 230 mm)
                 Hfront   48 Hsync  32 Hback  80 Hpol N
                 Vfront    3 Vsync   6 Vback  17 Vpol N
    Alphanumeric Data String: 'N170C2-L01'
    Alphanumeric Data String: 'CMO'
    Alphanumeric Data String: 'N170C2-L01'
Checksum: 0x3d
