edid-decode (hex):

00 ff ff ff ff ff ff 00 4c a3 42 35 00 00 00 00
00 17 01 01 95 19 11 78 0a ee 95 a3 54 4c 99 26
0f 50 54 00 00 00 01 01 01 01 01 01 01 01 01 01
01 01 01 01 01 01 78 50 70 a0 80 a0 29 50 30 20
3a 00 fe a9 00 00 00 19 6a 40 70 a0 80 a0 29 50
30 20 3a 00 fe a9 00 00 00 19 00 00 00 fe 00 53
41 4d 53 55 4e 47 0a 20 20 20 20 20 00 00 00 fe
00 31 32 30 51 4c 30 31 2d 30 30 31 0a 20 00 69

----------------

Block 0, Base EDID:
  EDID Structure Version & Revision: 1.1
  Vendor & Product Identification:
    Manufacturer: SEC
    Model: 13634
    Made in: 2013
  Basic Display Parameters & Features:
    Digital display
    Maximum image size: 25 cm x 17 cm
    Gamma: 2.20
    RGB color display
    First detailed timing is preferred timing
  Color Characteristics:
    Red  : 0.6396, 0.3300
    Green: 0.2998, 0.5996
    Blue : 0.1503, 0.0595
    White: 0.3134, 0.3291
  Established Timings I & II: none
  Standard Timings: none
  Detailed Timing Descriptors:
    DTD 1:  2160x1440   59.955 Hz   3:2    88.793 kHz 206.000 MHz (254 mm x 169 mm)
                 Hfront   48 Hsync  32 Hback  80 Hpol N
                 Vfront    3 Vsync  10 Vback  28 Vpol N
    DTD 2:  2160x1440   47.993 Hz   3:2    71.078 kHz 164.900 MHz (254 mm x 169 mm)
                 Hfront   48 Hsync  32 Hback  80 Hpol N
                 Vfront    3 Vsync  10 Vback  28 Vpol N
    Alphanumeric Data String: 'SAMSUNG'
    Alphanumeric Data String: '120QL01-001'
Checksum: 0x69
