
EDID (hex):
00ffffffffffff000469a93201010101
0b1b0104b54728783a70b5b04d33bc27
0c5054afcf00714f818081409500a940
b300d1c0d1004dd000a0f0703e803020
3500c48f2100001a000000fd00184c1c
873c000a202020202020000000fc0050
413332390a20202020202020000000ff
0048334c4d51533038333732320a0139
020324f157605f5e5d10050403020111
1213141f0e0f1d1e0607151623090707
83010000a86600a0f0701f8030203500
c48f2100001a565e00a0a0a029503020
3500c48f2100001af45100a0f0701980
30203500c48f2100001a283c80a070b0
234030203600c48f2100001a023a8018
71382d40582c4500c48f2100001e000e

Extracted contents:
header:          00 ff ff ff ff ff ff 00
serial number:   04 69 a9 32 01 01 01 01 0b 1b
version:         01 04
basic params:    b5 47 28 78 3a
chroma info:     70 b5 b0 4d 33 bc 27 0c 50 54
established:     af cf 00
standard:        71 4f 81 80 81 40 95 00 a9 40 b3 00 d1 c0 d1 00
descriptor 1:    4d d0 00 a0 f0 70 3e 80 30 20 35 00 c4 8f 21 00 00 1a
descriptor 2:    00 00 00 fd 00 18 4c 1c 87 3c 00 0a 20 20 20 20 20 20
descriptor 3:    00 00 00 fc 00 50 41 33 32 39 0a 20 20 20 20 20 20 20
descriptor 4:    00 00 00 ff 00 48 33 4c 4d 51 53 30 38 33 37 32 32 0a
extensions:      01
checksum:        39

EDID version: 1.4
Manufacturer: ACI Model 32a9 Serial Number --
Made in week 11 of 2017
Digital display
10 bits per primary color channel
DisplayPort interface
Maximum image size: 71 cm x 40 cm
Gamma: 2.20
DPMS levels: Off
Supported color formats: RGB 4:4:4, YCrCb 4:4:4, YCrCb 4:2:2
First detailed timing includes the native pixel format and preferred refresh rate
Display x,y Chromaticity:
  Red:   0.6884, 0.3037
  Green: 0.1992, 0.7343
  Blue:  0.1542, 0.0498
  White: 0.3134, 0.3291
Established timings supported:
  720x400@70Hz 9:5 HorFreq: 31469 Hz Clock: 28.320 MHz
  640x480@60Hz 4:3 HorFreq: 31469 Hz Clock: 25.175 MHz
  640x480@72Hz 4:3 HorFreq: 37900 Hz Clock: 31.500 MHz
  640x480@75Hz 4:3 HorFreq: 37500 Hz Clock: 31.500 MHz
  800x600@56Hz 4:3 HorFreq: 35200 Hz Clock: 36.000 MHz
  800x600@60Hz 4:3 HorFreq: 37900 Hz Clock: 40.000 MHz
  800x600@72Hz 4:3 HorFreq: 48100 Hz Clock: 50.000 MHz
  800x600@75Hz 4:3 HorFreq: 46900 Hz Clock: 49.500 MHz
  1024x768@60Hz 4:3 HorFreq: 48400 Hz Clock: 65.000 MHz
  1024x768@70Hz 4:3 HorFreq: 56500 Hz Clock: 75.000 MHz
  1024x768@75Hz 4:3 HorFreq: 60000 Hz Clock: 78.750 MHz
  1280x1024@75Hz 5:4 HorFreq: 80000 Hz Clock: 135.000 MHz
Standard timings supported:
  1152x864@75Hz 4:3 HorFreq: 67500 Hz Clock: 108.000 MHz
  1280x1024@60Hz 5:4 HorFreq: 64000 Hz Clock: 108.000 MHz
  1280x960@60Hz 4:3 HorFreq: 60000 Hz Clock: 108.000 MHz
  1440x900@60Hz 16:10 HorFreq: 55500 Hz Clock: 88.750 MHz
  1600x1200@60Hz 4:3 HorFreq: 75000 Hz Clock: 162.000 MHz
  1680x1050@60Hz 16:10 HorFreq: 64700 Hz Clock: 119.000 MHz
  1920x1080@60Hz 16:9
  1920x1200@60Hz 16:10 HorFreq: 74000 Hz Clock: 154.000 MHz
Detailed mode: Clock 533.250 MHz, 708 mm x 399 mm
               3840 3888 3920 4000 hborder 0
               2160 2163 2168 2222 vborder 0
               +hsync -vsync 
               VertFreq: 59 Hz, HorFreq: 133312 Hz
Monitor ranges (GTF): 24-76Hz V, 28-135kHz H, max dotclock 600MHz
Monitor name: PA329
Serial number: --
Has 1 extension blocks
Checksum: 0x39 (valid)

CTA extension block
Extension version: 3
32 bytes of CTA data
  Video data block
    VIC  96 3840x2160@50Hz 16:9  HorFreq: 112500 Hz Clock: 594.000 MHz
    VIC  95 3840x2160@30Hz 16:9  HorFreq: 67500 Hz Clock: 297.000 MHz
    VIC  94 3840x2160@25Hz 16:9  HorFreq: 56250 Hz Clock: 297.000 MHz
    VIC  93 3840x2160@24Hz 16:9  HorFreq: 54000 Hz Clock: 297.000 MHz
    VIC  16 1920x1080@60Hz 16:9  HorFreq: 67500 Hz Clock: 148.500 MHz
    VIC   5 1920x1080i@60Hz 16:9  HorFreq: 33750 Hz Clock: 74.250 MHz
    VIC   4 1280x720@60Hz 16:9  HorFreq: 45000 Hz Clock: 74.250 MHz
    VIC   3 720x480@60Hz 16:9  HorFreq: 31469 Hz Clock: 27.000 MHz
    VIC   2 720x480@60Hz 4:3  HorFreq: 31469 Hz Clock: 27.000 MHz
    VIC   1 640x480@60Hz 4:3  HorFreq: 31469 Hz Clock: 25.175 MHz
    VIC  17 720x576@50Hz 4:3  HorFreq: 31250 Hz Clock: 27.000 MHz
    VIC  18 720x576@50Hz 16:9  HorFreq: 31250 Hz Clock: 27.000 MHz
    VIC  19 1280x720@50Hz 16:9  HorFreq: 37500 Hz Clock: 74.250 MHz
    VIC  20 1920x1080i@50Hz 16:9  HorFreq: 28125 Hz Clock: 74.250 MHz
    VIC  31 1920x1080@50Hz 16:9  HorFreq: 56250 Hz Clock: 148.500 MHz
    VIC  14 1440x480@60Hz 4:3  HorFreq: 31469 Hz Clock: 54.000 MHz
    VIC  15 1440x480@60Hz 16:9  HorFreq: 31469 Hz Clock: 54.000 MHz
    VIC  29 1440x576@50Hz 4:3  HorFreq: 31250 Hz Clock: 54.000 MHz
    VIC  30 1440x576@50Hz 16:9  HorFreq: 31250 Hz Clock: 54.000 MHz
    VIC   6 1440x480i@60Hz 4:3  HorFreq: 15734 Hz Clock: 27.000 MHz
    VIC   7 1440x480i@60Hz 16:9  HorFreq: 15734 Hz Clock: 27.000 MHz
    VIC  21 1440x576i@50Hz 4:3  HorFreq: 15625 Hz Clock: 27.000 MHz
    VIC  22 1440x576i@50Hz 16:9  HorFreq: 15625 Hz Clock: 27.000 MHz
  Audio data block
    Linear PCM, max channels 2
      Supported sample rates (kHz): 48 44.1 32
      Supported sample sizes (bits): 24 20 16
  Speaker allocation data block
    Speaker map:
      FL/FR - Front Left/Right
Underscans PC formats by default
Basic audio support
Supports YCbCr 4:4:4
Supports YCbCr 4:2:2
1 native detailed modes
Detailed mode: Clock 262.800 MHz, 708 mm x 399 mm
               3840 3888 3920 4000 hborder 0
               2160 2163 2168 2191 vborder 0
               +hsync -vsync 
               VertFreq: 29 Hz, HorFreq: 65700 Hz
Detailed mode: Clock 241.500 MHz, 708 mm x 399 mm
               2560 2608 2640 2720 hborder 0
               1440 1443 1448 1481 vborder 0
               +hsync -vsync 
               VertFreq: 59 Hz, HorFreq: 88786 Hz
Detailed mode: Clock 209.800 MHz, 708 mm x 399 mm
               3840 3888 3920 4000 hborder 0
               2160 2163 2168 2185 vborder 0
               +hsync -vsync 
               VertFreq: 24 Hz, HorFreq: 52450 Hz
Detailed mode: Clock 154.000 MHz, 708 mm x 399 mm
               1920 1968 2000 2080 hborder 0
               1200 1203 1209 1235 vborder 0
               +hsync -vsync 
               VertFreq: 59 Hz, HorFreq: 74038 Hz
Detailed mode: Clock 148.500 MHz, 708 mm x 399 mm
               1920 2008 2052 2200 hborder 0
               1080 1084 1089 1125 vborder 0
               +hsync +vsync 
               VertFreq: 60 Hz, HorFreq: 67500 Hz
Checksum: 0xe (valid)

Warning: One or more of the timings is out of range of the Monitor Ranges:
  Vertical Freq: 24 - 75 Hz
  Horizontal Freq: 15625 - 133312 Hz
  Maximum Clock: 594.000 MHz
EDID block does not conform at all!
	Both the serial number and the serial string are set
