edid-decode (hex):

00 ff ff ff ff ff ff 00 04 2e 07 00 00 00 00 00
01 19 01 03 80 32 28 00 0a 07 f5 9a 57 4e 87 26
1e 50 54 00 00 00 01 01 01 01 01 01 01 01 01 01
01 01 01 01 01 01 2c 2a 00 98 51 00 2a 40 30 70
13 00 00 2c 21 00 00 1e 00 00 00 fc 00 31 32 38
30 78 31 30 32 34 0a 0a 0a 0a 00 00 00 10 00 00
00 00 00 00 00 00 00 00 00 00 00 00 00 00 00 10
00 00 00 00 00 00 00 00 00 00 00 00 00 00 00 fc

----------------

Block 0, Base EDID:
  EDID Structure Version & Revision: 1.3
  Vendor & Product Identification:
    Manufacturer: AAN
    Model: 7
    Made in: week 1 of 2015
  Basic Display Parameters & Features:
    Digital display
    Maximum image size: 50 cm x 40 cm
    Gamma: 1.00
    RGB color display
    First detailed timing is the preferred timing
  Color Characteristics:
    Red  : 0.6015, 0.3398
    Green: 0.3056, 0.5302
    Blue : 0.1513, 0.1201
    White: 0.3134, 0.3291
  Established Timings I & II: none
  Standard Timings: none
  Detailed Timing Descriptors:
    DTD 1:  1280x1024   59.998 Hz   5:4    63.957 kHz 107.960 MHz (512 mm x 300 mm)
                 Hfront   48 Hsync 112 Hback 248 Hpol P
                 Vfront    1 Vsync   3 Vback  38 Vpol P
    Display Product Name: '1280x1024'
    Dummy Descriptor:
    Dummy Descriptor:
Checksum: 0xfc

----------------

Failures:

Block 0, Base EDID:
  Detailed Timing Descriptor #1: Mismatch of image size 512x300 mm vs display size 500x400 mm.
  Display Product Name: Non-space after newline.
  Missing Display Range Limits Descriptor.

EDID conformity: FAIL
