edid-decode (hex):

00 ff ff ff ff ff ff 00 36 69 a7 3f 21 02 00 00
1f 1d 01 04 a5 3c 22 78 3b 1a d5 ae 50 48 a6 25
12 50 54 bf cf 00 d1 c0 71 4f 81 c0 81 40 81 80
95 00 b3 00 01 01 69 5e 00 a0 a0 a0 29 50 30 20
b8 04 55 50 21 00 00 1a f8 e3 00 a0 a0 a0 32 50
08 20 98 04 55 50 21 00 00 1e 00 00 00 fd 00 30
90 de de 3c 01 0a 20 20 20 20 20 20 00 00 00 fc
00 4d 53 49 20 4d 41 47 32 37 31 43 51 52 01 b9

80 00 00 00 00 00 00 00 00 00 00 00 00 00 00 00
80 00 00 00 00 00 00 00 00 00 00 00 00 00 00 00
80 00 00 00 00 00 00 00 00 00 00 00 00 00 00 00
80 00 00 00 00 00 00 00 00 00 00 00 00 00 00 00
80 00 00 00 00 00 00 00 00 00 00 00 00 00 00 00
80 00 00 00 00 00 00 00 00 00 00 00 00 00 00 00
80 00 00 00 00 00 00 00 00 00 00 00 00 00 00 00
80 00 00 00 00 00 00 00 00 00 00 00 00 00 00 00

----------------

Block 0, Base EDID:
  EDID Structure Version & Revision: 1.4
  Vendor & Product Identification:
    Manufacturer: MSI
    Model: 16295
    Serial Number: ...
    Made in: week 31 of 2019
  Basic Display Parameters & Features:
    Digital display
    Bits per primary color channel: 8
    DisplayPort interface
    Maximum image size: 60 cm x 34 cm
    Gamma: 2.20
    DPMS levels: Off
    Supported color formats: RGB 4:4:4, YCrCb 4:4:4, YCrCb 4:2:2
    First detailed timing includes the native pixel format and preferred refresh rate
    Display is continuous frequency
  Color Characteristics:
    Red  : 0.6796, 0.3134
    Green: 0.2832, 0.6503
    Blue : 0.1474, 0.0712
    White: 0.3134, 0.3291
  Established Timings I & II:
    IBM     :   720x400    70.082 Hz   9:5    31.467 kHz  28.320 MHz
    DMT 0x04:   640x480    59.940 Hz   4:3    31.469 kHz  25.175 MHz
    Apple   :   640x480    66.667 Hz   4:3    35.000 kHz  30.240 MHz
    DMT 0x05:   640x480    72.809 Hz   4:3    37.861 kHz  31.500 MHz
    DMT 0x06:   640x480    75.000 Hz   4:3    37.500 kHz  31.500 MHz
    DMT 0x08:   800x600    56.250 Hz   4:3    35.156 kHz  36.000 MHz
    DMT 0x09:   800x600    60.317 Hz   4:3    37.879 kHz  40.000 MHz
    DMT 0x0a:   800x600    72.188 Hz   4:3    48.077 kHz  50.000 MHz
    DMT 0x0b:   800x600    75.000 Hz   4:3    46.875 kHz  49.500 MHz
    DMT 0x10:  1024x768    60.004 Hz   4:3    48.363 kHz  65.000 MHz
    DMT 0x11:  1024x768    70.069 Hz   4:3    56.476 kHz  75.000 MHz
    DMT 0x12:  1024x768    75.029 Hz   4:3    60.023 kHz  78.750 MHz
    DMT 0x24:  1280x1024   75.025 Hz   5:4    79.976 kHz 135.000 MHz
  Standard Timings:
    DMT 0x52:  1920x1080   60.000 Hz  16:9    67.500 kHz 148.500 MHz
    DMT 0x15:  1152x864    75.000 Hz   4:3    67.500 kHz 108.000 MHz
    DMT 0x55:  1280x720    60.000 Hz  16:9    45.000 kHz  74.250 MHz
    DMT 0x20:  1280x960    60.000 Hz   4:3    60.000 kHz 108.000 MHz
    DMT 0x23:  1280x1024   60.020 Hz   5:4    63.981 kHz 108.000 MHz
    DMT 0x2f:  1440x900    59.887 Hz  16:10   55.935 kHz 106.500 MHz
    DMT 0x3a:  1680x1050   59.954 Hz  16:10   65.290 kHz 146.250 MHz
  Detailed Timing Descriptors:
    DTD 1:  2560x1440   59.998 Hz  16:9    88.857 kHz 241.690 MHz (597 mm x 336 mm)
                 Hfront   48 Hsync  32 Hback  80 Hpol P
                 Vfront   27 Vsync   8 Vback   6 Vpol N
    DTD 2:  2560x1440  143.999 Hz  16:9   214.559 kHz 583.600 MHz (597 mm x 336 mm)
                 Hfront    8 Hsync  32 Hback 120 Hpol P
                 Vfront   25 Vsync   8 Vback  17 Vpol P
  Display Range Limits:
    Monitor ranges (Bare Limits): 48-144 Hz V, 222-222 kHz H, max dotclock 600 MHz
    Display Product Name: 'MSI MAG271CQR'
  Extension blocks: 1
Checksum: 0xb9

----------------

Block 1, Unknown EDID Extension Block 0x80:
Unknown EDID Extension Block 0x80
  80 00 00 00 00 00 00 00 00 00 00 00 00 00 00 00 '................'
  80 00 00 00 00 00 00 00 00 00 00 00 00 00 00 00 '................'
  80 00 00 00 00 00 00 00 00 00 00 00 00 00 00 00 '................'
  80 00 00 00 00 00 00 00 00 00 00 00 00 00 00 00 '................'
  80 00 00 00 00 00 00 00 00 00 00 00 00 00 00 00 '................'
  80 00 00 00 00 00 00 00 00 00 00 00 00 00 00 00 '................'
  80 00 00 00 00 00 00 00 00 00 00 00 00 00 00 00 '................'
  80 00 00 00 00 00 00 00 00 00 00 00 00 00 00 00 '................'
Checksum: 0x0
