edid-decode (hex):

00 ff ff ff ff ff ff 00 32 0c 38 01 00 00 00 00
00 11 01 03 90 1e 13 78 0a ae 10 96 58 53 8c 28
24 50 54 00 00 00 01 01 01 01 01 01 01 01 01 01
01 01 01 01 01 01 94 25 a0 20 51 84 1a 30 60 60
36 00 30 be 10 00 00 1b 94 25 a0 20 51 84 1a 30
60 60 36 00 30 be 10 00 00 1b 00 00 00 fe 00 4e
59 36 39 35 80 31 34 31 57 50 31 0a 00 00 00 fe
00 2b 3d 4c 53 79 9d c9 ff 02 01 0a 20 20 00 ed

----------------

Block 0, Base EDID:
  EDID Structure Version & Revision: 1.3
  Vendor & Product Identification:
    Manufacturer: LPL
    Model: 312
    Made in: 2007
  Basic Display Parameters & Features:
    Digital display
    Maximum image size: 30 cm x 19 cm
    Gamma: 2.20
    RGB color display
    First detailed timing is preferred timing
  Color Characteristics:
    Red  : 0.5878, 0.3457
    Green: 0.3271, 0.5488
    Blue : 0.1562, 0.1416
    White: 0.3125, 0.3281
  Established Timings I & II: none
  Standard Timings: none
  Detailed Timing Descriptors:
    DTD 1:  1440x900    60.120 Hz   8:5    55.671 kHz  96.200 MHz (DE timing only, 304 mm x 190 mm)
                 Hfront   96 Hsync  96 Hback  96 Hpol P
                 Vfront    3 Vsync   6 Vback  17 Vpol N
    DTD 2:  1440x900    60.120 Hz   8:5    55.671 kHz  96.200 MHz (DE timing only, 304 mm x 190 mm)
                 Hfront   96 Hsync  96 Hback  96 Hpol P
                 Vfront    3 Vsync   6 Vback  17 Vpol N
    SPWG Module Revision: 27
    SPWG Descriptor #3:
      SPWG PC Maker P/N: 'NY695'
      SPWG LCD Supplier EEDID Revision: 128
      SPWG Manufacturer P/N: '141WP1'
    SPWG Descriptor #4:
      SMBUS Values: 0x2b 0x3d 0x4c 0x53 0x79 0x9d 0xc9 0xff
      LVDS Channels: 2
      Panel Self Test Present
Checksum: 0xed

----------------

Failures:

Block 0, Base EDID:
  Basic Display Parameters & Features: Digital Video Interface Standard set to reserved value 0x10.
  Missing Display Product Name.
  Missing Display Range Limits Descriptor.

EDID conformity: FAIL
