edid-decode (hex):

00 ff ff ff ff ff ff 00 1e 6d fe 56 39 aa 02 00
0a 13 01 03 80 30 1b 78 e2 ae c5 a2 57 4a 9c 25
12 50 54 a5 4b 00 b3 00 81 80 71 4f 81 c0 81 4f
81 c0 01 01 01 01 1a 36 80 a0 70 ff 1f 40 30 20
d0 00 dd 0d 11 00 00 1a 02 3a 80 18 71 38 2d 40
d0 2c 45 00 dd 0d 11 00 00 1e 00 00 00 fd 00 38
4b 1e 53 0f 00 0a 20 20 20 20 20 20 00 00 00 fc
00 57 32 32 34 33 0a 20 20 20 20 20 20 20 00 8c

----------------

Block 0, Base EDID:
  EDID Structure Version & Revision: 1.3
  Vendor & Product Identification:
    Manufacturer: GSM
    Model: 22270
    Serial Number: ...
    Made in: week 10 of 2009
  Basic Display Parameters & Features:
    Digital display
    Maximum image size: 48 cm x 27 cm
    Gamma: 2.20
    DPMS levels: Standby Suspend Off
    Monochrome or grayscale display
    First detailed timing is the preferred timing
  Color Characteristics:
    Red  : 0.6347, 0.3417
    Green: 0.2919, 0.6113
    Blue : 0.1474, 0.0703
    White: 0.3134, 0.3291
  Established Timings I & II:
    IBM     :   720x400    70.082 Hz   9:5    31.467 kHz  28.320 MHz
    DMT 0x04:   640x480    59.940 Hz   4:3    31.469 kHz  25.175 MHz
    DMT 0x06:   640x480    75.000 Hz   4:3    37.500 kHz  31.500 MHz
    DMT 0x09:   800x600    60.317 Hz   4:3    37.879 kHz  40.000 MHz
    DMT 0x0b:   800x600    75.000 Hz   4:3    46.875 kHz  49.500 MHz
    DMT 0x10:  1024x768    60.004 Hz   4:3    48.363 kHz  65.000 MHz
    DMT 0x12:  1024x768    75.029 Hz   4:3    60.023 kHz  78.750 MHz
    DMT 0x24:  1280x1024   75.025 Hz   5:4    79.976 kHz 135.000 MHz
  Standard Timings:
    DMT 0x3a:  1680x1050   59.954 Hz  16:10   65.290 kHz 146.250 MHz
    DMT 0x23:  1280x1024   60.020 Hz   5:4    63.981 kHz 108.000 MHz
    DMT 0x15:  1152x864    75.000 Hz   4:3    67.500 kHz 108.000 MHz
    DMT 0x55:  1280x720    60.000 Hz  16:9    45.000 kHz  74.250 MHz
    GTF     :  1280x960    75.000 Hz   4:3    75.150 kHz 129.859 MHz
    DMT 0x55:  1280x720    60.000 Hz  16:9    45.000 kHz  74.250 MHz
  Detailed Timing Descriptors:
    DTD 1:  1920x1279   50.829 Hz 1920:1279  66.587 kHz 138.500 MHz (477 mm x 269 mm)
                 Hfront   48 Hsync  32 Hback  80 Hpol P
                 Vfront   13 Vsync   0 Vback  18 Vpol N
                   1a 36 80 a0 70 ff 1f 40 30 20 d0 00 dd 0d 11 00 00 1a '.6..p..@0 ........'
    DTD 2:  1920x1080   60.000 Hz  16:9    67.500 kHz 148.500 MHz (477 mm x 269 mm)
                 Hfront  208 Hsync  44 Hback  28 Hpol P
                 Vfront    4 Vsync   5 Vback  36 Vpol P
  Display Range Limits:
    Monitor ranges (GTF): 56-75 Hz V, 30-83 kHz H, max dotclock 150 MHz
    Display Product Name: 'W2243'
Checksum: 0x8c

----------------

Failures:

Block 0, Base EDID:
  Detailed Timing Descriptor #1: 0 values in the video timing:
    Horizontal Active/Blanking 1920/160
    Horizontal Frontporch/Sync Width 48/32
    Vertical Active/Blanking 1279/31
    Vertical Frontporch/Sync Width 13/0
EDID:
  Base EDID: Some timings are out of range of the Monitor Ranges:
    Vertical Freq: 50.829 - 75.029 Hz (Monitor: 56.000 - 75.000 Hz)

EDID conformity: FAIL
