edid-decode (hex):

00 ff ff ff ff ff ff 00 34 38 74 07 4e 03 00 00
1d 0e 01 03 80 26 1e 78 2e 6d 55 a2 5a 4e 9b 23
16 50 54 bf ef 80 81 80 71 4f 31 0a 01 01 01 01
01 01 01 01 01 01 30 2a 00 98 51 00 2a 40 30 70
13 00 78 2d 11 00 00 1e 00 00 00 fe 00 4d 41 58
44 41 54 41 0a 20 20 20 20 20 00 00 00 fd 00 38
4b 1f 53 0e 00 0a 20 20 20 20 20 20 00 00 00 fc
00 42 31 30 31 39 31 30 0a 20 20 20 20 20 00 c3

----------------

Block 0, Base EDID:
  EDID Structure Version & Revision: 1.3
  Vendor & Product Identification:
    Manufacturer: MAX
    Model: 1908
    Serial Number: ...
    Made in: week 29 of 2004
  Basic Display Parameters & Features:
    Digital display
    Maximum image size: 38 cm x 30 cm
    Gamma: 2.20
    DPMS levels: Off
    RGB color display
    Default (sRGB) color space is primary color space
    First detailed timing is the preferred timing
  Color Characteristics:
    Red  : 0.6337, 0.3535
    Green: 0.3076, 0.6064
    Blue : 0.1376, 0.0869
    White: 0.3134, 0.3291
  Established Timings I & II:
    IBM     :   720x400    70.082 Hz   9:5    31.467 kHz  28.320 MHz
    DMT 0x04:   640x480    59.940 Hz   4:3    31.469 kHz  25.175 MHz
    Apple   :   640x480    66.667 Hz   4:3    35.000 kHz  30.240 MHz
    DMT 0x05:   640x480    72.809 Hz   4:3    37.861 kHz  31.500 MHz
    DMT 0x06:   640x480    75.000 Hz   4:3    37.500 kHz  31.500 MHz
    DMT 0x08:   800x600    56.250 Hz   4:3    35.156 kHz  36.000 MHz
    DMT 0x09:   800x600    60.317 Hz   4:3    37.879 kHz  40.000 MHz
    DMT 0x0a:   800x600    72.188 Hz   4:3    48.077 kHz  50.000 MHz
    DMT 0x0b:   800x600    75.000 Hz   4:3    46.875 kHz  49.500 MHz
    Apple   :   832x624    74.551 Hz   4:3    49.726 kHz  57.284 MHz
    DMT 0x10:  1024x768    60.004 Hz   4:3    48.363 kHz  65.000 MHz
    DMT 0x11:  1024x768    70.069 Hz   4:3    56.476 kHz  75.000 MHz
    DMT 0x12:  1024x768    75.029 Hz   4:3    60.023 kHz  78.750 MHz
    DMT 0x24:  1280x1024   75.025 Hz   5:4    79.976 kHz 135.000 MHz
    Apple   :  1152x870    75.062 Hz 192:145  68.681 kHz 100.000 MHz
  Standard Timings:
    DMT 0x23:  1280x1024   60.020 Hz   5:4    63.981 kHz 108.000 MHz
    DMT 0x15:  1152x864    75.000 Hz   4:3    67.500 kHz 108.000 MHz
    GTF     :   640x400    70.000 Hz  16:10   29.190 kHz  23.352 MHz
  Detailed Timing Descriptors:
    DTD 1:  1280x1024   60.020 Hz   5:4    63.981 kHz 108.000 MHz (376 mm x 301 mm)
                 Hfront   48 Hsync 112 Hback 248 Hpol P
                 Vfront    1 Vsync   3 Vback  38 Vpol P
    Alphanumeric Data String: 'MAXDATA'
  Display Range Limits:
    Monitor ranges (GTF): 56-75 Hz V, 31-83 kHz H, max dotclock 140 MHz
    Display Product Name: 'B101910'
Checksum: 0xc3

----------------

Failures:

Block 0, Base EDID:
  Basic Display Parameters & Features: sRGB is signaled, but the chromaticities do not match.
EDID:
  Base EDID: Some timings are out of range of the Monitor Ranges:
    Horizontal Freq: 29.190 - 79.976 kHz (Monitor: 31.000 - 83.000 kHz)

EDID conformity: FAIL
