edid-decode (hex):

00 ff ff ff ff ff ff 00 30 64 ef 58 01 01 01 01
31 12 01 03 80 1a 10 78 0a 87 ae 99 57 4f 8c 26
22 50 54 00 00 00 01 01 01 01 01 01 01 01 01 01
01 01 01 01 01 01 6a 1d 00 e8 50 20 1e 30 10 30
22 00 05 a3 10 00 00 18 00 00 00 0f 00 02 d3 04
d5 00 17 01 18 54 d7 04 19 00 00 00 00 fe 00 54
4d 44 49 53 50 4c 41 59 0a 20 20 20 00 00 00 fe
00 4c 54 44 31 32 31 45 57 37 56 0a 20 20 00 1c

00 ff ff ff ff ff ff 00 30 64 ef 58 01 01 01 01
31 12 01 03 80 1a 10 78 0a 87 ae 99 57 4f 8c 26
22 50 54 00 00 00 01 01 01 01 01 01 01 01 01 01
01 01 01 01 01 01 6a 1d 00 e8 50 20 1e 30 10 30
22 00 05 a3 10 00 00 18 00 00 00 0f 00 02 d3 04
d5 00 17 01 18 54 d7 04 19 00 00 00 00 fe 00 54
4d 44 49 53 50 4c 41 59 0a 20 20 20 00 00 00 fe
00 4c 54 44 31 32 31 45 57 37 56 0a 20 20 00 1c

----------------

Block 0, Base EDID:
  EDID Structure Version & Revision: 1.3
  Vendor & Product Identification:
    Manufacturer: LCD
    Model: 22767
    Serial Number: ...
    Made in: week 49 of 2008
  Basic Display Parameters & Features:
    Digital display
    Maximum image size: 26 cm x 16 cm
    Gamma: 2.20
    RGB color display
    First detailed timing is the preferred timing
  Color Characteristics:
    Red  : 0.5996, 0.3398
    Green: 0.3095, 0.5498
    Blue : 0.1503, 0.1347
    White: 0.3154, 0.3300
  Established Timings I & II: none
  Standard Timings: none
  Detailed Timing Descriptors:
    DTD 1:  1280x800    60.001912 Hz  16:10    49.802 kHz     75.300000 MHz (261 mm x 163 mm)
                 Hfront   16 Hsync  48 Hback  168 Hpol N
                 Vfront    2 Vsync   2 Vback   26 Vpol N
    Manufacturer-Specified Display Descriptor (0x0f): 00 0f 00 02 d3 04 d5 00 17 01 18 54 d7 04 19 00 '...........T....'
    Alphanumeric Data String: 'TMDISPLAY'
    Alphanumeric Data String: 'LTD121EW7V'
Checksum: 0x1c

----------------

Block 1, Unknown EDID Extension Block 0x00:
  00 ff ff ff ff ff ff 00 30 64 ef 58 01 01 01 01 '........0d.X....'
  31 12 01 03 80 1a 10 78 0a 87 ae 99 57 4f 8c 26 '1......x....WO.&'
  22 50 54 00 00 00 01 01 01 01 01 01 01 01 01 01 '"PT.............'
  01 01 01 01 01 01 6a 1d 00 e8 50 20 1e 30 10 30 '......j...P .0.0'
  22 00 05 a3 10 00 00 18 00 00 00 0f 00 02 d3 04 '"...............'
  d5 00 17 01 18 54 d7 04 19 00 00 00 00 fe 00 54 '.....T.........T'
  4d 44 49 53 50 4c 41 59 0a 20 20 20 00 00 00 fe 'MDISPLAY.   ....'
  00 4c 54 44 31 32 31 45 57 37 56 0a 20 20 00 1c '.LTD121EW7V.  ..'
Checksum: 0x1c

----------------

Failures:

Block 0, Base EDID:
  Missing Display Product Name.
  Missing Display Range Limits Descriptor.
Block 1, Base EDID:
  Unknown Extension Block.
EDID:
  Base EDID: EDID specified 0 extension block(s), but found 1 extension block(s).

EDID conformity: FAIL
