
EDID (hex):
00ffffffffffff0009e5400600000000
01190104951f117802aa7095625c9229
1e505400000001010101010101010101
010101010101283780c870381e403020
350035ad1000001ac22480c870381e40
3020350035ad1000001a000000000000
00000000000000000000000000000002
000c42f90b3c6a1213236e0a2020007d

Extracted contents:
header:          00 ff ff ff ff ff ff 00
serial number:   09 e5 40 06 00 00 00 00 01 19
version:         01 04
basic params:    95 1f 11 78 02
chroma info:     aa 70 95 62 5c 92 29 1e 50 54
established:     00 00 00
standard:        01 01 01 01 01 01 01 01 01 01 01 01 01 01 01 01
descriptor 1:    28 37 80 c8 70 38 1e 40 30 20 35 00 35 ad 10 00 00 1a
descriptor 2:    c2 24 80 c8 70 38 1e 40 30 20 35 00 35 ad 10 00 00 1a
descriptor 3:    00 00 00 00 00 00 00 00 00 00 00 00 00 00 00 00 00 00
descriptor 4:    00 00 00 02 00 0c 42 f9 0b 3c 6a 12 13 23 6e 0a 20 20
extensions:      00
checksum:        7d

EDID version: 1.4
Manufacturer: BOE Model 640 Serial Number --
Made in week 1 of 2015
Digital display
6 bits per primary color channel
DisplayPort interface
Maximum image size: 31 cm x 17 cm
Gamma: 2.20
Supported color formats: RGB 4:4:4
First detailed timing includes the native pixel format and preferred refresh rate
Display x,y Chromaticity:
  Red:   0.5839, 0.3847
  Green: 0.3613, 0.5722
  Blue:  0.1611, 0.1201
  White: 0.3125, 0.3281
Established timings supported:
Standard timings supported:
Detailed mode: Clock 141.200 MHz, 309 mm x 173 mm
               1920 1968 2000 2120 hborder 0
               1080 1083 1088 1110 vborder 0
               +hsync -vsync 
               VertFreq: 60 Hz, HorFreq: 66603 Hz
Detailed mode: Clock 94.100 MHz, 309 mm x 173 mm
               1920 1968 2000 2120 hborder 0
               1080 1083 1088 1110 vborder 0
               +hsync -vsync 
               VertFreq: 39 Hz, HorFreq: 44386 Hz
Manufacturer-specified data, tag 0
Manufacturer-specified data, tag 2
Checksum: 0x7d (valid)
EDID block does NOT conform to EDID 1.4!
	Missing name descriptor
	Missing monitor ranges
