edid-decode (hex):

00 ff ff ff ff ff ff 00 0e 6f 10 14 00 00 00 00
00 1f 01 04 b5 1f 14 78 03 6c 53 a4 54 4c 9a 26
0f 51 55 00 00 00 01 01 01 01 01 01 01 01 01 01
01 01 01 01 01 01 80 97 00 a0 c0 80 50 70 30 20
36 00 38 c3 10 00 00 18 00 00 00 fd 00 1e 78 f0
f0 4e 01 0a 20 20 20 20 20 20 00 00 00 fe 00 43
53 4f 54 20 54 33 0a 20 20 20 20 20 00 00 00 fe
00 4d 4e 45 35 30 37 5a 41 31 2d 31 0a 20 02 12

02 03 0f 00 e6 06 01 01 60 60 28 00 00 00 00 00
00 00 00 00 00 00 00 00 00 00 00 00 00 00 00 00
00 00 00 00 00 00 00 00 00 00 00 00 00 00 00 00
00 00 00 00 00 00 00 00 00 00 00 00 00 00 00 00
00 00 00 00 00 00 00 00 00 00 00 00 00 00 00 00
00 00 00 00 00 00 00 00 00 00 00 00 00 00 00 00
00 00 00 00 00 00 00 00 00 00 00 00 00 00 00 00
00 00 00 00 00 00 00 00 00 00 00 00 00 00 18 fe

70 13 79 00 00 03 01 14 00 2f 01 05 ff 0b 9f 00
2f 00 1f 00 7f 07 4f 00 02 00 05 00 00 00 00 00
00 00 00 00 00 00 00 00 00 00 00 00 00 00 00 00
00 00 00 00 00 00 00 00 00 00 00 00 00 00 00 00
00 00 00 00 00 00 00 00 00 00 00 00 00 00 00 00
00 00 00 00 00 00 00 00 00 00 00 00 00 00 00 00
00 00 00 00 00 00 00 00 00 00 00 00 00 00 00 00
00 00 00 00 00 00 00 00 00 00 00 00 00 00 54 90

00 ff ff ff ff ff ff 00 0e 6f 10 14 00 00 00 00
00 1f 01 04 b5 1f 14 78 03 6c 53 a4 54 4c 9a 26
0f 51 55 00 00 00 01 01 01 01 01 01 01 01 01 01
01 01 01 01 01 01 80 97 00 a0 c0 80 50 70 30 20
36 00 38 c3 10 00 00 18 00 00 00 fd 00 1e 78 f0
f0 4e 01 0a 20 20 20 20 20 20 00 00 00 fe 00 43
53 4f 54 20 54 33 0a 20 20 20 20 20 00 00 00 fe
00 4d 4e 45 35 30 37 5a 41 31 2d 31 0a 20 02 12

02 03 0f 00 e6 06 01 01 60 60 28 00 00 00 00 00
00 00 00 00 00 00 00 00 00 00 00 00 00 00 00 00
00 00 00 00 00 00 00 00 00 00 00 00 00 00 00 00
00 00 00 00 00 00 00 00 00 00 00 00 00 00 00 00
00 00 00 00 00 00 00 00 00 00 00 00 00 00 00 00
00 00 00 00 00 00 00 00 00 00 00 00 00 00 00 00
00 00 00 00 00 00 00 00 00 00 00 00 00 00 00 00
00 00 00 00 00 00 00 00 00 00 00 00 00 00 18 fe

70 13 79 00 00 03 01 14 00 2f 01 05 ff 0b 9f 00
2f 00 1f 00 7f 07 4f 00 02 00 05 00 00 00 00 00
00 00 00 00 00 00 00 00 00 00 00 00 00 00 00 00
00 00 00 00 00 00 00 00 00 00 00 00 00 00 00 00
00 00 00 00 00 00 00 00 00 00 00 00 00 00 00 00
00 00 00 00 00 00 00 00 00 00 00 00 00 00 00 00
00 00 00 00 00 00 00 00 00 00 00 00 00 00 00 00
00 00 00 00 00 00 00 00 00 00 00 00 00 00 54 90

----------------

Block 0, Base EDID:
  EDID Structure Version & Revision: 1.4
  Vendor & Product Identification:
    Manufacturer: CSO
    Model: 5136
    Made in: 2021
  Basic Display Parameters & Features:
    Digital display
    Bits per primary color channel: 10
    DisplayPort interface
    Maximum image size: 31 cm x 20 cm
    Gamma: 2.20
    Supported color formats: RGB 4:4:4
    First detailed timing includes the native pixel format and preferred refresh rate
    Display is continuous frequency
  Color Characteristics:
    Red  : 0.6416, 0.3300
    Green: 0.2998, 0.6015
    Blue : 0.1494, 0.0595
    White: 0.3164, 0.3349
  Established Timings I & II: none
  Standard Timings: none
  Detailed Timing Descriptors:
    DTD 1:  3072x1920   60.000000 Hz  16:10   120.000 kHz    387.840000 MHz (312 mm x 195 mm)
                 Hfront   48 Hsync  32 Hback   80 Hpol N
                 Vfront    3 Vsync   6 Vback   71 Vpol N
    Display Range Limits:
      Monitor ranges (Bare Limits): 30-120 Hz V, 240-240 kHz H, max dotclock 780 MHz
    Alphanumeric Data String: 'CSOT T3'
    Alphanumeric Data String: 'MNE507ZA1-1'
  Extension blocks: 2
Checksum: 0x12

----------------

Block 1, CTA-861 Extension Block:
  Revision: 3
  Native detailed modes: 0
  HDR Static Metadata Data Block:
    Electro optical transfer functions:
      Traditional gamma - SDR luminance range
    Supported static metadata descriptors:
      Static metadata type 1
    Desired content max luminance: 96 (400.000 cd/m^2)
    Desired content max frame-average luminance: 96 (400.000 cd/m^2)
    Desired content min luminance: 40 (0.098 cd/m^2)
  Unknown CTA-861 Data Block (tag 0x00, length 0):
  Unknown CTA-861 Data Block (tag 0x00, length 0):
  Unknown CTA-861 Data Block (tag 0x00, length 0):
  Unknown CTA-861 Data Block (tag 0x00, length 0):
Checksum: 0xfe  Unused space in Extension Block: 112 bytes

----------------

Block 2, DisplayID Extension Block:
  Version: 1.3
  Extension Count: 0
  Display Product Type: Extension Section
  Video Timing Modes Type 1 - Detailed Timings Data Block:
    DTD:  3072x1920  120.001547 Hz  16:10   240.003 kHz    775.690000 MHz (aspect 16:10, no 3D stereo)
               Hfront   48 Hsync  32 Hback   80 Hpol N
               Vfront    3 Vsync   6 Vback   71 Vpol N
  Checksum: 0x54
Checksum: 0x90

----------------

Block 3, Unknown EDID Extension Block 0x00:
  00 ff ff ff ff ff ff 00 0e 6f 10 14 00 00 00 00 '.........o......'
  00 1f 01 04 b5 1f 14 78 03 6c 53 a4 54 4c 9a 26 '.......x.lS.TL.&'
  0f 51 55 00 00 00 01 01 01 01 01 01 01 01 01 01 '.QU.............'
  01 01 01 01 01 01 80 97 00 a0 c0 80 50 70 30 20 '............Pp0 '
  36 00 38 c3 10 00 00 18 00 00 00 fd 00 1e 78 f0 '6.8...........x.'
  f0 4e 01 0a 20 20 20 20 20 20 00 00 00 fe 00 43 '.N..      .....C'
  53 4f 54 20 54 33 0a 20 20 20 20 20 00 00 00 fe 'SOT T3.     ....'
  00 4d 4e 45 35 30 37 5a 41 31 2d 31 0a 20 02 12 '.MNE507ZA1-1. ..'
Checksum: 0x12

----------------

Block 4, CTA-861 Extension Block:
  Revision: 3
  Native detailed modes: 0
  HDR Static Metadata Data Block:
    Electro optical transfer functions:
      Traditional gamma - SDR luminance range
    Supported static metadata descriptors:
      Static metadata type 1
    Desired content max luminance: 96 (400.000 cd/m^2)
    Desired content max frame-average luminance: 96 (400.000 cd/m^2)
    Desired content min luminance: 40 (0.098 cd/m^2)
  Unknown CTA-861 Data Block (tag 0x00, length 0):
  Unknown CTA-861 Data Block (tag 0x00, length 0):
  Unknown CTA-861 Data Block (tag 0x00, length 0):
  Unknown CTA-861 Data Block (tag 0x00, length 0):
Checksum: 0xfe  Unused space in Extension Block: 112 bytes

----------------

Block 5, DisplayID Extension Block:
  Version: 1.3
  Extension Count: 0
  Video Timing Modes Type 1 - Detailed Timings Data Block:
    DTD:  3072x1920  120.001547 Hz  16:10   240.003 kHz    775.690000 MHz (aspect 16:10, no 3D stereo)
               Hfront   48 Hsync  32 Hback   80 Hpol N
               Vfront    3 Vsync   6 Vback   71 Vpol N
  Checksum: 0x54
Checksum: 0x90

----------------

Warnings:

Block 0, Base EDID:
  Missing Display Product Name.
Block 1, CTA-861 Extension Block:
  IT Video Formats are overscanned by default, but normally this should be underscanned.
  Unknown CTA-861 Data Block (tag 0x00, length 0).
  Unknown CTA-861 Data Block (tag 0x00, length 0).
  Unknown CTA-861 Data Block (tag 0x00, length 0).
  Unknown CTA-861 Data Block (tag 0x00, length 0).
  Add a Colorimetry Data Block with the sRGB colorimetry bit set to avoid interop issues.
Block 4, CTA-861 Extension Block:
  IT Video Formats are overscanned by default, but normally this should be underscanned.
  Unknown CTA-861 Data Block (tag 0x00, length 0).
  Unknown CTA-861 Data Block (tag 0x00, length 0).
  Unknown CTA-861 Data Block (tag 0x00, length 0).
  Unknown CTA-861 Data Block (tag 0x00, length 0).
  Add a Colorimetry Data Block with the sRGB colorimetry bit set to avoid interop issues.
EDID:
  Base EDID: Some timings are out of range of the Monitor Ranges:
    Horizontal Freq: 120.000 - 240.003 kHz (Monitor: 240.000 - 240.000 kHz)

Failures:

Block 1, CTA-861 Extension Block:
  Padding: Contains non-zero bytes.
  Required 640x480p60 timings are missing in the established timings and the SVD list (VIC 1).
  Missing VCDB, needed for Set Selectable RGB Quantization to avoid interop issues.
Block 2, DisplayID Extension Block:
  DisplayID Base Block has no product type.
  Expected 0 DisplayID Extension Block, but got 1.
Block 3, Base EDID:
  Unknown Extension Block.
Block 4, CTA-861 Extension Block:
  HDR Static Metadata Data Block: Only one instance of this Data Block is allowed.
  Padding: Contains non-zero bytes.
  Required 640x480p60 timings are missing in the established timings and the SVD list (VIC 1).
  Missing VCDB, needed for Set Selectable RGB Quantization to avoid interop issues.
EDID:
  Base EDID: EDID specified 2 extension block(s), but found 5 extension block(s).
  DisplayID: Missing DisplayID Product Identification Data Block.
  DisplayID: DisplayID expects at least one preferred timing.

EDID conformity: FAIL
