edid-decode (hex):

00 ff ff ff ff ff ff 00 1c 54 00 34 00 00 00 00
27 1e 01 04 b5 50 21 78 3b 26 15 ad 4e 49 a4 26
0e 50 54 bf ef 80 71 4f 81 c0 81 40 81 80 95 00
a9 c0 b3 00 d1 c0 f5 7c 70 a0 d0 a0 29 50 30 20
35 00 1d 4e 31 00 00 1a 00 00 00 ff 00 32 30 33
39 32 42 30 30 33 31 36 35 0a 00 00 00 fd 00 30
90 de de 4e 01 0a 20 20 20 20 20 20 00 00 00 fc
00 47 33 34 57 51 43 0a 20 20 20 20 20 20 02 ff

02 03 34 f4 4e 91 9f 85 94 04 13 03 12 01 02 11
4e 47 00 23 0a 07 07 83 01 00 00 6d 1a 00 00 02
11 30 90 00 00 00 00 00 00 e3 05 e3 01 e6 06 07
01 63 61 27 d4 bc 00 a0 a0 a0 29 50 30 1f 35 00
1d 4e 31 00 00 18 3a 6b 70 a0 d0 a0 55 50 30 20
35 00 1d 4e 31 00 00 1e 42 d0 70 a0 d0 a0 29 50
30 20 35 00 1d 4e 31 00 00 1e 6a 5e 00 a0 a0 a0
29 50 30 20 35 00 1d 4e 31 00 00 1e 00 00 00 cf

70 12 79 00 00 03 00 14 bf 2f 01 84 6f 0d 9f 00
2f 00 1f 00 9f 05 3b 00 02 80 04 00 07 00 0a 08
81 00 08 04 00 04 02 10 00 03 01 14 50 ae 00 84
ff 09 b3 00 2f 00 3f 00 37 04 32 00 02 80 04 00
03 01 14 57 ec 00 84 ff 09 03 01 2d 00 3f 00 9f
05 31 00 02 80 04 00 03 01 14 42 91 00 84 ff 09
b3 00 2f 00 3f 00 37 04 32 00 02 80 04 00 00 00
00 00 00 00 00 00 00 00 00 00 00 00 00 00 6e 90

----------------

Block 0, Base EDID:
  EDID Structure Version & Revision: 1.4
  Vendor & Product Identification:
    Manufacturer: GBT
    Model: 13312
    Made in: week 39 of 2020
  Basic Display Parameters & Features:
    Digital display
    Bits per primary color channel: 10
    DisplayPort interface
    Maximum image size: 80 cm x 33 cm
    Gamma: 2.20
    DPMS levels: Off
    Supported color formats: RGB 4:4:4, YCrCb 4:4:4, YCrCb 4:2:2
    First detailed timing includes the native pixel format and preferred refresh rate
    Display is continuous frequency
  Color Characteristics:
    Red  : 0.6757, 0.3066
    Green: 0.2861, 0.6425
    Blue : 0.1484, 0.0556
    White: 0.3134, 0.3291
  Established Timings I & II:
    IBM     :   720x400    70.082 Hz   9:5    31.467 kHz  28.320 MHz
    DMT 0x04:   640x480    59.940 Hz   4:3    31.469 kHz  25.175 MHz
    Apple   :   640x480    66.667 Hz   4:3    35.000 kHz  30.240 MHz
    DMT 0x05:   640x480    72.809 Hz   4:3    37.861 kHz  31.500 MHz
    DMT 0x06:   640x480    75.000 Hz   4:3    37.500 kHz  31.500 MHz
    DMT 0x08:   800x600    56.250 Hz   4:3    35.156 kHz  36.000 MHz
    DMT 0x09:   800x600    60.317 Hz   4:3    37.879 kHz  40.000 MHz
    DMT 0x0a:   800x600    72.188 Hz   4:3    48.077 kHz  50.000 MHz
    DMT 0x0b:   800x600    75.000 Hz   4:3    46.875 kHz  49.500 MHz
    Apple   :   832x624    74.551 Hz   4:3    49.726 kHz  57.284 MHz
    DMT 0x10:  1024x768    60.004 Hz   4:3    48.363 kHz  65.000 MHz
    DMT 0x11:  1024x768    70.069 Hz   4:3    56.476 kHz  75.000 MHz
    DMT 0x12:  1024x768    75.029 Hz   4:3    60.023 kHz  78.750 MHz
    DMT 0x24:  1280x1024   75.025 Hz   5:4    79.976 kHz 135.000 MHz
    Apple   :  1152x870    75.062 Hz 192:145  68.681 kHz 100.000 MHz
  Standard Timings:
    DMT 0x15:  1152x864    75.000 Hz   4:3    67.500 kHz 108.000 MHz
    DMT 0x55:  1280x720    60.000 Hz  16:9    45.000 kHz  74.250 MHz
    DMT 0x20:  1280x960    60.000 Hz   4:3    60.000 kHz 108.000 MHz
    DMT 0x23:  1280x1024   60.020 Hz   5:4    63.981 kHz 108.000 MHz
    DMT 0x2f:  1440x900    59.887 Hz  16:10   55.935 kHz 106.500 MHz
    DMT 0x53:  1600x900    60.000 Hz  16:9    60.000 kHz 108.000 MHz (RB)
    DMT 0x3a:  1680x1050   59.954 Hz  16:10   65.290 kHz 146.250 MHz
    DMT 0x52:  1920x1080   60.000 Hz  16:9    67.500 kHz 148.500 MHz
  Detailed Timing Descriptors:
    DTD 1:  3440x1440   59.999 Hz  43:18   88.858 kHz 319.890 MHz (797 mm x 334 mm)
                 Hfront   48 Hsync  32 Hback  80 Hpol P
                 Vfront    3 Vsync   5 Vback  33 Vpol N
    Display Product Serial Number: ...
  Display Range Limits:
    Monitor ranges (Bare Limits): 48-144 Hz V, 222-222 kHz H, max dotclock 780 MHz
    Display Product Name: 'G34WQC'
  Extension blocks: 2
Checksum: 0xff

----------------

Block 1, CTA-861 Extension Block:
  Revision: 3
  Underscans IT Video Formats by default
  Basic audio support
  Supports YCbCr 4:4:4
  Supports YCbCr 4:2:2
  Native detailed modes: 4
  Video Data Block:
    VIC  17:   720x576    50.000 Hz   4:3    31.250 kHz  27.000 MHz (native)
    VIC  31:  1920x1080   50.000 Hz  16:9    56.250 kHz 148.500 MHz (native)
    VIC   5:  1920x1080i  60.000 Hz  16:9    33.750 kHz  74.250 MHz (native)
    VIC  20:  1920x1080i  50.000 Hz  16:9    28.125 kHz  74.250 MHz (native)
    VIC   4:  1280x720    60.000 Hz  16:9    45.000 kHz  74.250 MHz
    VIC  19:  1280x720    50.000 Hz  16:9    37.500 kHz  74.250 MHz
    VIC   3:   720x480    59.940 Hz  16:9    31.469 kHz  27.000 MHz
    VIC  18:   720x576    50.000 Hz  16:9    31.250 kHz  27.000 MHz
    VIC   1:   640x480    59.940 Hz   4:3    31.469 kHz  25.175 MHz
    VIC   2:   720x480    59.940 Hz   4:3    31.469 kHz  27.000 MHz
    VIC  17:   720x576    50.000 Hz   4:3    31.250 kHz  27.000 MHz
    VIC  78:  1920x1080  120.000 Hz  64:27  135.000 kHz 297.000 MHz
    VIC  71:  1280x720   120.000 Hz  64:27   90.000 kHz 148.500 MHz
  Audio Data Block:
    Linear PCM:
      Max channels: 3
      Supported sample rates (kHz): 48 44.1 32
      Supported sample sizes (bits): 24 20 16
  Speaker Allocation Data Block:
    FL/FR - Front Left/Right
  Vendor-Specific Data Block (AMD), OUI 00-00-1A:
    Version: 2.17
    Minimum Refresh Rate: 48 Hz
    Maximum Refresh Rate: 144 Hz
    Flags 1.x: 0x00
    Flags 2.x: 0x00
    Maximum luminance: 0 (50.000 cd/m^2)
    Minimum luminance: 0 (0.000 cd/m^2)
    Unknown: 0x00 0x00
  Colorimetry Data Block:
    xvYCC601
    xvYCC709
    BT2020cYCC
    BT2020YCC
    BT2020RGB
  HDR Static Metadata Data Block:
    Electro optical transfer functions:
      Traditional gamma - SDR luminance range
      Traditional gamma - HDR luminance range
      SMPTE ST2084
    Supported static metadata descriptors:
      Static metadata type 1
    Desired content max luminance: 99 (426.856 cd/m^2)
    Desired content max frame-average luminance: 97 (408.759 cd/m^2)
    Desired content min luminance: 39 (0.100 cd/m^2)
  Detailed Timing Descriptors:
    DTD 2:  2560x1440  120.000 Hz  16:9   177.721 kHz 483.400 MHz (797 mm x 334 mm)
                 Hfront   48 Hsync  31 Hback  81 Hpol N
                 Vfront    3 Vsync   5 Vback  33 Vpol N
    DTD 3:  3440x1440   50.000 Hz  43:18   76.250 kHz 274.500 MHz (797 mm x 334 mm)
                 Hfront   48 Hsync  32 Hback  80 Hpol P
                 Vfront    3 Vsync   5 Vback  77 Vpol P
    DTD 4:  3440x1440   99.996 Hz  43:18  148.094 kHz 533.140 MHz (797 mm x 334 mm)
                 Hfront   48 Hsync  32 Hback  80 Hpol P
                 Vfront    3 Vsync   5 Vback  33 Vpol P
    DTD 5:  2560x1440   60.000 Hz  16:9    88.860 kHz 241.700 MHz (797 mm x 334 mm)
                 Hfront   48 Hsync  32 Hback  80 Hpol P
                 Vfront    3 Vsync   5 Vback  33 Vpol P
Checksum: 0xcf

----------------

Block 2, DisplayID Extension Block:
  Version: 1.2
  Extension Count: 0
  Display Product Type: Extension Section
  Video Timing Modes Type 1 - Detailed Timings Data Block:
    DTD:  3440x1440  144.000 Hz  16:9   216.000 kHz 777.600 MHz (aspect 16:9, no 3D stereo, preferred)
               Hfront   48 Hsync  32 Hback  80 Hpol N
               Vfront    3 Vsync   5 Vback  52 Vpol P
  Supported Timing Modes Type 1 - VESA DMT Timings Data Block:
    DMT 0x04:   640x480    59.940 Hz   4:3    31.469 kHz  25.175 MHz
    DMT 0x09:   800x600    60.317 Hz   4:3    37.879 kHz  40.000 MHz
    DMT 0x10:  1024x768    60.004 Hz   4:3    48.363 kHz  65.000 MHz
    DMT 0x1c:  1280x800    59.810 Hz  16:10   49.702 kHz  83.500 MHz
    DMT 0x23:  1280x1024   60.020 Hz   5:4    63.981 kHz 108.000 MHz
    DMT 0x33:  1600x1200   60.000 Hz   4:3    75.000 kHz 162.000 MHz
    DMT 0x3a:  1680x1050   59.954 Hz  16:10   65.290 kHz 146.250 MHz
    DMT 0x45:  1920x1200   59.885 Hz  16:10   74.556 kHz 193.250 MHz
  Video Timing Modes Type 1 - Detailed Timings Data Block:
    DTD:  2560x1080  144.001 Hz  16:9   162.865 kHz 446.250 MHz (aspect 16:9, no 3D stereo, preferred)
               Hfront   48 Hsync  64 Hback  68 Hpol N
               Vfront    3 Vsync   5 Vback  43 Vpol P
  Video Timing Modes Type 1 - Detailed Timings Data Block:
    DTD:  2560x1440  143.995 Hz  16:9   214.553 kHz 605.040 MHz (aspect 16:9, no 3D stereo, preferred)
               Hfront   46 Hsync  64 Hback 150 Hpol N
               Vfront    3 Vsync   5 Vback  42 Vpol P
  Video Timing Modes Type 1 - Detailed Timings Data Block:
    DTD:  2560x1080  119.999 Hz  16:9   135.719 kHz 371.870 MHz (aspect 16:9, no 3D stereo, preferred)
               Hfront   48 Hsync  64 Hback  68 Hpol N
               Vfront    3 Vsync   5 Vback  43 Vpol P
  Checksum: 0x6e
Checksum: 0x90

----------------

Warnings:

Block 1, CTA-861 Extension Block:
  Missing VCDB, needed for Set Selectable RGB Quantization to avoid interop issues.
EDID:
  Base EDID: Some timings are out of range of the Monitor Ranges:
    Horizontal Freq: 28.125 - 216.000 kHz (Monitor: 222.000 - 222.000 kHz)
  CTA-861: Multiple native interlaced timings are defined.

Failures:

Block 1, CTA-861 Extension Block:
  Video Data Block: Duplicate VIC 17.
Block 2, DisplayID Extension Block:
  DisplayID Base Block has no product type.
EDID:
  CTA-861: Native progressive timings are a mix of several resolutions.
  DisplayID: Missing DisplayID Product Identification Data Block.

EDID conformity: FAIL
