edid-decode (hex):

00 ff ff ff ff ff ff 00 0d af 63 14 00 00 00 00
29 13 01 04 95 1f 11 78 0a 59 e5 93 5c 59 93 27
1c 50 54 00 00 00 01 01 01 01 01 01 01 01 01 01
01 01 01 01 01 01 12 1b 56 72 50 00 0c 30 10 22
26 00 35 ae 10 00 00 1a 13 12 56 72 50 00 0c 30
10 22 26 00 35 ae 10 00 00 1a 00 00 00 00 00 00
00 00 00 00 00 00 00 00 00 00 00 00 00 00 00 02
00 0c 44 f2 0a 3c 64 13 0f 1b 69 00 00 00 00 e3

----------------

Block 0, Base EDID:
  EDID Structure Version & Revision: 1.4
  Vendor & Product Identification:
    Manufacturer: CMO
    Model: 5219
    Made in: week 41 of 2009
  Basic Display Parameters & Features:
    Digital display
    Bits per primary color channel: 6
    DisplayPort interface
    Maximum image size: 31 cm x 17 cm
    Gamma: 2.20
    Supported color formats: RGB 4:4:4, YCrCb 4:4:4
    First detailed timing includes the native pixel format and preferred refresh rate
  Color Characteristics:
    Red  : 0.5751, 0.3603
    Green: 0.3496, 0.5751
    Blue : 0.1552, 0.1113
    White: 0.3134, 0.3291
  Established Timings I & II: none
  Standard Timings: none
  Detailed Timing Descriptors:
    DTD 1:  1366x768    60.031185 Hz 683:384   46.824 kHz     69.300000 MHz (309 mm x 174 mm)
                 Hfront   16 Hsync  34 Hback   64 Hpol P
                 Vfront    2 Vsync   6 Vback    4 Vpol N
    DTD 2:  1366x768    40.081428 Hz 683:384   31.264 kHz     46.270000 MHz (309 mm x 174 mm)
                 Hfront   16 Hsync  34 Hback   64 Hpol P
                 Vfront    2 Vsync   6 Vback    4 Vpol N
    Empty Descriptor
    Manufacturer-Specified Display Descriptor (0x02): 00 02 00 0c 44 f2 0a 3c 64 13 0f 1b 69 00 00 00 '....D..<d...i...'
Checksum: 0xe3

----------------

Failures:

Block 0, Base EDID:
  Empty Descriptor: Use Dummy Descriptor instead of all zeroes.
  Missing Display Product Name.

EDID conformity: FAIL
