
EDID (hex):
00ffffffffffff0015c31930610e1a02
111d0104a5342178fa3a05a9544c9c26
115054a10800a9408180b300a9c081c0
810001010101283c80a070b023403020
360007442100001a023a801871382d40
582c450007442100001e000000fd003b
3d1f4c11010a202020202020000000fc
004556323435370a2020202020200107
020312f145100403020123097f078301
0000023a801871382d40582c45000744
2100001e011d007251d01e206e285500
07442100001e8f0ad08a20e02d10103e
96000744210000188c0ad08a20e02d10
103e9600074421000018d50980a020e0
2d101060a20007442100001800000000
000000000000000000000000000000c4

Extracted contents:
header:          00 ff ff ff ff ff ff 00
serial number:   15 c3 19 30 61 0e 1a 02 11 1d
version:         01 04
basic params:    a5 34 21 78 fa
chroma info:     3a 05 a9 54 4c 9c 26 11 50 54
established:     a1 08 00
standard:        a9 40 81 80 b3 00 a9 c0 81 c0 81 00 01 01 01 01
descriptor 1:    28 3c 80 a0 70 b0 23 40 30 20 36 00 07 44 21 00 00 1a
descriptor 2:    02 3a 80 18 71 38 2d 40 58 2c 45 00 07 44 21 00 00 1e
descriptor 3:    00 00 00 fd 00 3b 3d 1f 4c 11 01 0a 20 20 20 20 20 20
descriptor 4:    00 00 00 fc 00 45 56 32 34 35 37 0a 20 20 20 20 20 20
extensions:      01
checksum:        07

EDID version: 1.4
Manufacturer: ENC Model 3019 Serial Number --
Made in week 17 of 2019
Digital display
8 bits per primary color channel
DisplayPort interface
Maximum image size: 52 cm x 33 cm
Gamma: 2.20
DPMS levels: Standby Suspend Off
Supported color formats: RGB 4:4:4, YCrCb 4:4:4, YCrCb 4:2:2
First detailed timing includes the native pixel format and preferred refresh rate
Display x,y Chromaticity:
  Red:   0.6601, 0.3310
  Green: 0.2988, 0.6113
  Blue:  0.1484, 0.0664
  White: 0.3134, 0.3291
Established timings supported:
  720x400@70Hz 9:5 HorFreq: 31469 Hz Clock: 28.320 MHz
  640x480@60Hz 4:3 HorFreq: 31469 Hz Clock: 25.175 MHz
  800x600@60Hz 4:3 HorFreq: 37900 Hz Clock: 40.000 MHz
  1024x768@60Hz 4:3 HorFreq: 48400 Hz Clock: 65.000 MHz
Standard timings supported:
  1600x1200@60Hz 4:3 HorFreq: 75000 Hz Clock: 162.000 MHz
  1280x1024@60Hz 5:4 HorFreq: 64000 Hz Clock: 108.000 MHz
  1680x1050@60Hz 16:10 HorFreq: 64700 Hz Clock: 119.000 MHz
  1600x900@60Hz 16:9
  1280x720@60Hz 16:9
  1280x800@60Hz 16:10
Detailed mode: Clock 154.000 MHz, 519 mm x 324 mm
               1920 1968 2000 2080 hborder 0
               1200 1203 1209 1235 vborder 0
               +hsync -vsync 
               VertFreq: 59 Hz, HorFreq: 74038 Hz
Detailed mode: Clock 148.500 MHz, 519 mm x 324 mm
               1920 2008 2052 2200 hborder 0
               1080 1084 1089 1125 vborder 0
               +hsync +vsync 
               VertFreq: 60 Hz, HorFreq: 67500 Hz
Monitor ranges (bare limits): 59-61Hz V, 31-76kHz H, max dotclock 170MHz
Monitor name: EV2457
Has 1 extension blocks
Checksum: 0x7 (valid)

CTA extension block
Extension version: 3
14 bytes of CTA data
  Video data block
    VIC  16 1920x1080@60Hz 16:9  HorFreq: 67500 Hz Clock: 148.500 MHz
    VIC   4 1280x720@60Hz 16:9  HorFreq: 45000 Hz Clock: 74.250 MHz
    VIC   3 720x480@60Hz 16:9  HorFreq: 31469 Hz Clock: 27.000 MHz
    VIC   2 720x480@60Hz 4:3  HorFreq: 31469 Hz Clock: 27.000 MHz
    VIC   1 640x480@60Hz 4:3  HorFreq: 31469 Hz Clock: 25.175 MHz
  Audio data block
    Linear PCM, max channels 2
      Supported sample rates (kHz): 192 176.4 96 88.2 48 44.1 32
      Supported sample sizes (bits): 24 20 16
  Speaker allocation data block
    Speaker map:
      FL/FR - Front Left/Right
Underscans PC formats by default
Basic audio support
Supports YCbCr 4:4:4
Supports YCbCr 4:2:2
1 native detailed modes
Detailed mode: Clock 148.500 MHz, 519 mm x 324 mm
               1920 2008 2052 2200 hborder 0
               1080 1084 1089 1125 vborder 0
               +hsync +vsync 
               VertFreq: 60 Hz, HorFreq: 67500 Hz
Detailed mode: Clock 74.250 MHz, 519 mm x 324 mm
               1280 1390 1430 1650 hborder 0
                720  725  730  750 vborder 0
               +hsync +vsync 
               VertFreq: 60 Hz, HorFreq: 45000 Hz
Detailed mode: Clock 27.030 MHz, 519 mm x 324 mm
                720  736  798  858 hborder 0
                480  489  495  525 vborder 0
               -hsync -vsync 
               VertFreq: 60 Hz, HorFreq: 31503 Hz
Detailed mode: Clock 27.000 MHz, 519 mm x 324 mm
                720  736  798  858 hborder 0
                480  489  495  525 vborder 0
               -hsync -vsync 
               VertFreq: 59 Hz, HorFreq: 31468 Hz
Detailed mode: Clock 25.170 MHz, 519 mm x 324 mm
                640  656  752  800 hborder 0
                480  490  492  525 vborder 0
               -hsync -vsync 
               VertFreq: 59 Hz, HorFreq: 31462 Hz
Checksum: 0xc4 (valid)

Warning: One or more of the timings is out of range of the Monitor Ranges:
  Vertical Freq: 59 - 70 Hz
  Horizontal Freq: 31462 - 75000 Hz
  Maximum Clock: 162.000 MHz


