
EDID (hex):
00ffffffffffff00047268050c5d3194
2b1d01036a4627782adcf5a655519d26
0e5054b30c00b30095008180810081c0
714f01010101023a801871382d40582c
4500ba892100001e000000fd00374c1e
5311000a202020202020000000ff0054
394b5341303031343230300a000000fc
004163657220455433323251520a00cf

Extracted contents:
header:          00 ff ff ff ff ff ff 00
serial number:   04 72 68 05 0c 5d 31 94 2b 1d
version:         01 03
basic params:    6a 46 27 78 2a
chroma info:     dc f5 a6 55 51 9d 26 0e 50 54
established:     b3 0c 00
standard:        b3 00 95 00 81 80 81 00 81 c0 71 4f 01 01 01 01
descriptor 1:    02 3a 80 18 71 38 2d 40 58 2c 45 00 ba 89 21 00 00 1e
descriptor 2:    00 00 00 fd 00 37 4c 1e 53 11 00 0a 20 20 20 20 20 20
descriptor 3:    00 00 00 ff 00 54 39 4b 53 41 30 30 31 34 32 30 30 0a
descriptor 4:    00 00 00 fc 00 41 63 65 72 20 45 54 33 32 32 51 52 0a
extensions:      00
checksum:        cf

EDID version: 1.3
Manufacturer: ACR Model 568 Serial Number --
Made in week 43 of 2019
Analog display, Input voltage level: 0.7/0.7 V
Sync: Separate SyncOnGreen 
Maximum image size: 70 cm x 39 cm
Gamma: 2.20
DPMS levels: Off
RGB color display
First detailed timing is preferred timing
Display x,y Chromaticity:
  Red:   0.6513, 0.3330
  Green: 0.3193, 0.6132
  Blue:  0.1513, 0.0576
  White: 0.3134, 0.3291
Established timings supported:
  720x400@70Hz 9:5 HorFreq: 31469 Hz Clock: 28.320 MHz
  640x480@60Hz 4:3 HorFreq: 31469 Hz Clock: 25.175 MHz
  640x480@67Hz 4:3 HorFreq: 35000 Hz Clock: 30.240 MHz
  800x600@56Hz 4:3 HorFreq: 35200 Hz Clock: 36.000 MHz
  800x600@60Hz 4:3 HorFreq: 37900 Hz Clock: 40.000 MHz
  1024x768@60Hz 4:3 HorFreq: 48400 Hz Clock: 65.000 MHz
  1024x768@70Hz 4:3 HorFreq: 56500 Hz Clock: 75.000 MHz
Standard timings supported:
  1680x1050@60Hz 16:10 HorFreq: 64700 Hz Clock: 119.000 MHz
  1440x900@60Hz 16:10 HorFreq: 55500 Hz Clock: 88.750 MHz
  1280x1024@60Hz 5:4 HorFreq: 64000 Hz Clock: 108.000 MHz
  1280x800@60Hz 16:10
  1280x720@60Hz 16:9
  1152x864@75Hz 4:3 HorFreq: 67500 Hz Clock: 108.000 MHz
Detailed mode: Clock 148.500 MHz, 698 mm x 393 mm
               1920 2008 2052 2200 hborder 0
               1080 1084 1089 1125 vborder 0
               +hsync +vsync 
               VertFreq: 60 Hz, HorFreq: 67500 Hz
Monitor ranges (GTF): 55-76Hz V, 30-83kHz H, max dotclock 170MHz
Serial number: --
Monitor name: Acer ET322QR
Checksum: 0xcf (valid)


