edid-decode (hex):

00 ff ff ff ff ff ff 00 06 af 9b 11 00 00 00 00
00 19 01 04 a5 26 15 78 02 24 25 a8 50 36 b6 26
0e 50 54 00 00 00 01 01 01 01 01 01 01 01 01 01
01 01 01 01 01 01 66 d0 00 a0 f0 70 3e 80 30 20
35 00 7e d6 10 00 00 18 d4 ad 00 a0 f0 70 3e 80
30 20 35 00 7e d6 10 00 00 18 cc a6 00 a0 f0 70
3e 80 30 20 35 00 7e d6 10 00 00 18 00 00 00 02
00 10 36 ff 0f 3c 96 3e 32 7d 96 20 20 20 00 a7

----------------

Block 0, Base EDID:
  EDID Structure Version & Revision: 1.4
  Vendor & Product Identification:
    Manufacturer: AUO
    Model: 4507
    Made in: 2015
  Basic Display Parameters & Features:
    Digital display
    Bits per primary color channel: 8
    DisplayPort interface
    Maximum image size: 38 cm x 21 cm
    Gamma: 2.20
    Supported color formats: RGB 4:4:4
    First detailed timing includes the native pixel format and preferred refresh rate
  Color Characteristics:
    Red  : 0.6562, 0.3144
    Green: 0.2119, 0.7109
    Blue : 0.1484, 0.0566
    White: 0.3134, 0.3291
  Established Timings I & II: none
  Standard Timings: none
  Detailed Timing Descriptors:
    DTD 1:  3840x2160   60.024752 Hz  16:9    133.375 kHz    533.500000 MHz (382 mm x 214 mm)
                 Hfront   48 Hsync  32 Hback   80 Hpol N
                 Vfront    3 Vsync   5 Vback   54 Vpol N
    DTD 2:  3840x2160   50.067507 Hz  16:9    111.250 kHz    445.000000 MHz (382 mm x 214 mm)
                 Hfront   48 Hsync  32 Hback   80 Hpol N
                 Vfront    3 Vsync   5 Vback   54 Vpol N
    DTD 3:  3840x2160   48.042304 Hz  16:9    106.750 kHz    427.000000 MHz (382 mm x 214 mm)
                 Hfront   48 Hsync  32 Hback   80 Hpol N
                 Vfront    3 Vsync   5 Vback   54 Vpol N
    Manufacturer-Specified Display Descriptor (0x02): 00 02 00 10 36 ff 0f 3c 96 3e 32 7d 96 20 20 20 '....6..<.>2}.   '
Checksum: 0xa7

----------------

Warnings:

Block 0, Base EDID:
  Missing Display Product Name.

EDID conformity: PASS
