edid-decode (hex):

00 ff ff ff ff ff ff 00 30 e4 49 02 00 00 00 00
00 14 01 04 95 1e 13 78 02 95 d5 94 58 56 8e 28
22 50 54 00 00 00 01 01 01 01 01 01 01 01 01 01
01 01 01 01 01 01 38 1d 00 c0 50 20 2e 30 36 2c
98 00 30 be 10 00 00 1a 7b 13 00 c0 50 20 2e 30
36 2c 98 00 30 be 10 00 00 1a 00 00 00 fe 00 36
48 57 56 56 81 31 34 31 57 58 35 0a 00 00 00 00
00 00 41 31 16 00 00 00 00 09 01 0a 20 20 00 93

----------------

Block 0, Base EDID:
  EDID Structure Version & Revision: 1.4
  Vendor & Product Identification:
    Manufacturer: LGD
    Model: 585
    Made in: 2010
  Basic Display Parameters & Features:
    Digital display
    Bits per primary color channel: 6
    DisplayPort interface
    Maximum image size: 30 cm x 19 cm
    Gamma: 2.20
    Supported color formats: RGB 4:4:4
    First detailed timing includes the native pixel format and preferred refresh rate
  Color Characteristics:
    Red  : 0.5800, 0.3447
    Green: 0.3369, 0.5556
    Blue : 0.1591, 0.1337
    White: 0.3134, 0.3291
  Established Timings I & II: none
  Standard Timings: none
  Detailed Timing Descriptors:
    DTD 1:  1280x800    60.065269 Hz  16:10    50.815 kHz     74.800000 MHz (304 mm x 190 mm)
                 Hfront   54 Hsync  44 Hback   94 Hpol P
                 Vfront    9 Vsync   8 Vback   29 Vpol N
    DTD 2:  1280x800    40.046189 Hz  16:10    33.879 kHz     49.870000 MHz (304 mm x 190 mm)
                 Hfront   54 Hsync  44 Hback   94 Hpol P
                 Vfront    9 Vsync   8 Vback   29 Vpol N
    Alphanumeric Data String: '6HWVV'
    Manufacturer-Specified Display Descriptor (0x00): 00 00 00 00 41 31 16 00 00 00 00 09 01 0a 20 20 '....A1........  '
Checksum: 0x93

----------------

Warnings:

Block 0, Base EDID:
  Missing Display Product Name.

Failures:

Block 0, Base EDID:
  Alphanumeric Data String: Non-printable character.

EDID conformity: FAIL
