
EDID (hex):
00ffffffffffff004c2d817152304730
131f0104b53c22783b8cb5af4f43ab26
0e5054bfef80714f810081c081809500
a9c0b300010198e200a0a0a029500840
350055502100001a000000fd0030a5f5
f543010a202020202020000000fc004c
53323741473530304e0a2020000000ff
00484e4d523530303533370a202002d5
020327f144903f1f0423090707830100
00e305c0006d1a0000020130a5000000
000000e3060501565e00a0a0a0295030
20350055502100001a6fc200a0a0a055
503020350055502100001a5a8780a070
384d403020350055502100001a023a80
1871382d40582c450055502100001e00
0000000000000000000000000000003a
7012790000030128a2030188ff099f00
2f801f009f0528001a00070048960008
7f079f002f801f00370428001a000700
00000000000000000000000000000000
00000000000000000000000000000000
00000000000000000000000000000000
00000000000000000000000000000000
00000000000000000000000000005c90

Extracted contents:
header:          00 ff ff ff ff ff ff 00
serial number:   4c 2d 81 71 52 30 47 30 13 1f
version:         01 04
basic params:    b5 3c 22 78 3b
chroma info:     8c b5 af 4f 43 ab 26 0e 50 54
established:     bf ef 80
standard:        71 4f 81 00 81 c0 81 80 95 00 a9 c0 b3 00 01 01
descriptor 1:    98 e2 00 a0 a0 a0 29 50 08 40 35 00 55 50 21 00 00 1a
descriptor 2:    00 00 00 fd 00 30 a5 f5 f5 43 01 0a 20 20 20 20 20 20
descriptor 3:    00 00 00 fc 00 4c 53 32 37 41 47 35 30 30 4e 0a 20 20
descriptor 4:    00 00 00 ff 00 48 4e 4d 52 35 30 30 35 33 37 0a 20 20
extensions:      02
checksum:        d5

EDID version: 1.4
Manufacturer: SAM Model 7181 Serial Number --
Made in week 19 of 2021
Digital display
10 bits per primary color channel
DisplayPort interface
Maximum image size: 60 cm x 34 cm
Gamma: 2.20
DPMS levels: Off
Supported color formats: RGB 4:4:4, YCrCb 4:4:4, YCrCb 4:2:2
First detailed timing includes the native pixel format and preferred refresh rate
Display is continuous frequency
Display x,y Chromaticity:
  Red:   0.6855, 0.3085
  Green: 0.2646, 0.6679
  Blue:  0.1503, 0.0576
  White: 0.3134, 0.3291
Established timings supported:
  720x400@70Hz 9:5 HorFreq: 31469 Hz Clock: 28.320 MHz
  640x480@60Hz 4:3 HorFreq: 31469 Hz Clock: 25.175 MHz
  640x480@67Hz 4:3 HorFreq: 35000 Hz Clock: 30.240 MHz
  640x480@72Hz 4:3 HorFreq: 37900 Hz Clock: 31.500 MHz
  640x480@75Hz 4:3 HorFreq: 37500 Hz Clock: 31.500 MHz
  800x600@56Hz 4:3 HorFreq: 35200 Hz Clock: 36.000 MHz
  800x600@60Hz 4:3 HorFreq: 37900 Hz Clock: 40.000 MHz
  800x600@72Hz 4:3 HorFreq: 48100 Hz Clock: 50.000 MHz
  800x600@75Hz 4:3 HorFreq: 46900 Hz Clock: 49.500 MHz
  832x624@75Hz 4:3 HorFreq: 49726 Hz Clock: 57.284 MHz
  1024x768@60Hz 4:3 HorFreq: 48400 Hz Clock: 65.000 MHz
  1024x768@70Hz 4:3 HorFreq: 56500 Hz Clock: 75.000 MHz
  1024x768@75Hz 4:3 HorFreq: 60000 Hz Clock: 78.750 MHz
  1280x1024@75Hz 5:4 HorFreq: 80000 Hz Clock: 135.000 MHz
  1152x870@75Hz 192:145 HorFreq: 67500 Hz Clock: 108.000 MHz
Standard timings supported:
  1152x864@75Hz 4:3 HorFreq: 67500 Hz Clock: 108.000 MHz
  1280x800@60Hz 16:10
  1280x720@60Hz 16:9
  1280x1024@60Hz 5:4 HorFreq: 64000 Hz Clock: 108.000 MHz
  1440x900@60Hz 16:10 HorFreq: 55500 Hz Clock: 88.750 MHz
  1600x900@60Hz 16:9
  1680x1050@60Hz 16:10 HorFreq: 64700 Hz Clock: 119.000 MHz
Detailed mode: Clock 580.080 MHz, 597 mm x 336 mm
               2560 2568 2632 2720 hborder 0
               1440 1443 1448 1481 vborder 0
               +hsync -vsync 
               VertFreq: 144 Hz, HorFreq: 213264 Hz
Monitor ranges (bare limits): 48-165Hz V, 245-245kHz H, max dotclock 670MHz
Monitor name: LS27AG500N
Serial number: --
Has 2 extension blocks
Checksum: 0xd5 (valid)

CTA extension block
Extension version: 3
35 bytes of CTA data
  Video data block
    VIC  16 1920x1080@60Hz 16:9 (native) HorFreq: 67500 Hz Clock: 148.500 MHz
    VIC  63 1920x1080@120Hz 16:9  HorFreq: 135000 Hz Clock: 297.000 MHz
    VIC  31 1920x1080@50Hz 16:9  HorFreq: 56250 Hz Clock: 148.500 MHz
    VIC   4 1280x720@60Hz 16:9  HorFreq: 45000 Hz Clock: 74.250 MHz
  Audio data block
    Linear PCM, max channels 2
      Supported sample rates (kHz): 48 44.1 32
      Supported sample sizes (bits): 24 20 16
  Speaker allocation data block
    Speaker map:
      FL/FR - Front Left/Right
  Extended tag: Colorimetry data block
    BT2020YCC
    BT2020RGB
  Vendor-specific data block, OUI 00001a
  Extended tag: HDR static metadata data block
    Electro optical transfer functions:
      Traditional gamma - SDR luminance range
      SMPTE ST2084
    Supported static metadata descriptors:
      Static metadata type 1
Underscans PC formats by default
Basic audio support
Supports YCbCr 4:4:4
Supports YCbCr 4:2:2
1 native detailed modes
Detailed mode: Clock 241.500 MHz, 597 mm x 336 mm
               2560 2608 2640 2720 hborder 0
               1440 1443 1448 1481 vborder 0
               +hsync -vsync 
               VertFreq: 59 Hz, HorFreq: 88786 Hz
Detailed mode: Clock 497.750 MHz, 597 mm x 336 mm
               2560 2608 2640 2720 hborder 0
               1440 1443 1448 1525 vborder 0
               +hsync -vsync 
               VertFreq: 119 Hz, HorFreq: 182996 Hz
Detailed mode: Clock 346.500 MHz, 597 mm x 336 mm
               1920 1968 2000 2080 hborder 0
               1080 1083 1088 1157 vborder 0
               +hsync -vsync 
               VertFreq: 143 Hz, HorFreq: 166586 Hz
Detailed mode: Clock 148.500 MHz, 597 mm x 336 mm
               1920 2008 2052 2200 hborder 0
               1080 1084 1089 1125 vborder 0
               +hsync +vsync 
               VertFreq: 60 Hz, HorFreq: 67500 Hz
Checksum: 0x3a (valid)


DisplayID extension block
Extension version: 18
Length 121, version 18, extension count 0
Checksum: 0x5c (valid)
Type 1 detailed timing: aspect: undefined, Preferred  
Detailed mode: Clock 664.660 MHz, 0 mm x 0 mm
               2559 2606 2637 2718
               1439 1465 1472 1479
               +hsync -vsync
Type 1 detailed timing: aspect: undefined,  
Detailed mode: Clock 384.720 MHz, 0 mm x 0 mm
               1919 1966 1997 2078
               1079 1105 1112 1119
               +hsync -vsync

Warning: One or more of the timings is out of range of the Monitor Ranges:
  Vertical Freq: 50 - 144 Hz
  Horizontal Freq: 31469 - 213264 Hz
  Maximum Clock: 580.080 MHz
EDID block does not conform at all!
	Both the serial number and the serial string are set
