
EDID (hex):
00ffffffffffff00320c00f700000000
00110102802517780ab3d09758568927
21505400000001010101010101010101
010101010101283c80a070b023403020
36006fe6100000190000000000000000
00000000000000000000000000fe004c
475068696c6970734c43440a0000fe4c
503137315755332d544c41310a200065

Extracted contents:
header:          00 ff ff ff ff ff ff 00
serial number:   32 0c 00 f7 00 00 00 00 00 11
version:         01 02
basic params:    80 25 17 78 0a
chroma info:     b3 d0 97 58 56 89 27 21 50 54
established:     00 00 00
standard:        01 01 01 01 01 01 01 01 01 01 01 01 01 01 01 01
descriptor 1:    28 3c 80 a0 70 b0 23 40 30 20 36 00 6f e6 10 00 00 19
descriptor 2:    00 00 00 00 00 00 00 00 00 00 00 00 00 00 00 00 00 00
descriptor 3:    00 00 00 fe 00 4c 47 50 68 69 6c 69 70 73 4c 43 44 0a
descriptor 4:    00 00 fe 4c 50 31 37 31 57 55 33 2d 54 4c 41 31 0a 20
extensions:      00
checksum:        65

EDID version: 1.2
Manufacturer: LPL Model f700 Serial Number --
Made in year 2007
Digital display
Maximum image size: 37 cm x 23 cm
Gamma: 2.20
RGB color display
First detailed timing is preferred timing
Display x,y Chromaticity:
  Red:   0.5917, 0.3466
  Green: 0.3359, 0.5380
  Blue:  0.1552, 0.1298
  White: 0.3125, 0.3281
Established timings supported:
Standard timings supported:
Detailed mode: Clock 154.000 MHz, 367 mm x 230 mm
               1920 1968 2000 2080 hborder 0
               1200 1203 1209 1235 vborder 0
               -hsync -vsync 
               VertFreq: 59 Hz, HorFreq: 74038 Hz
Manufacturer-specified data, tag 0
ASCII string: LGPhilipsLCD
Monitor descriptor block has byte 2 nonzero (0xfe)
Monitor descriptor block has byte 4 nonzero (0x50)
Unknown monitor description type 76
Checksum: 0x65 (valid)
EDID block does not conform at all!
	Detailed blocks filled with garbage
