
EDID (hex):
00ffffffffffff002264918969120000
0b14010380291a78ea9bb6a4534b9d24
144f54bfef80818081c08140714f6146
904f950f01019a29a0d0518422305098
360098ff1000001e000000fd00314b1e
530e000a202020202020000000ff0030
313147483342593034373133000000fc
0048616e6e732e4720485731393100cc

Extracted contents:
header:          00 ff ff ff ff ff ff 00
serial number:   22 64 91 89 69 12 00 00 0b 14
version:         01 03
basic params:    80 29 1a 78 ea
chroma info:     9b b6 a4 53 4b 9d 24 14 4f 54
established:     bf ef 80
standard:        81 80 81 c0 81 40 71 4f 61 46 90 4f 95 0f 01 01
descriptor 1:    9a 29 a0 d0 51 84 22 30 50 98 36 00 98 ff 10 00 00 1e
descriptor 2:    00 00 00 fd 00 31 4b 1e 53 0e 00 0a 20 20 20 20 20 20
descriptor 3:    00 00 00 ff 00 30 31 31 47 48 33 42 59 30 34 37 31 33
descriptor 4:    00 00 00 fc 00 48 61 6e 6e 73 2e 47 20 48 57 31 39 31
extensions:      00
checksum:        cc

EDID version: 1.3
Manufacturer: HSD Model 8991 Serial Number --
Made in week 11 of 2010
Digital display
Maximum image size: 41 cm x 26 cm
Gamma: 2.20
DPMS levels: Standby Suspend Off
RGB color display
First detailed timing is preferred timing
Display x,y Chromaticity:
  Red:   0.6425, 0.3251
  Green: 0.2949, 0.6162
  Blue:  0.1425, 0.0810
  White: 0.3095, 0.3300
Established timings supported:
  720x400@70Hz 9:5 HorFreq: 31469 Hz Clock: 28.320 MHz
  640x480@60Hz 4:3 HorFreq: 31469 Hz Clock: 25.175 MHz
  640x480@67Hz 4:3 HorFreq: 35000 Hz Clock: 30.240 MHz
  640x480@72Hz 4:3 HorFreq: 37900 Hz Clock: 31.500 MHz
  640x480@75Hz 4:3 HorFreq: 37500 Hz Clock: 31.500 MHz
  800x600@56Hz 4:3 HorFreq: 35200 Hz Clock: 36.000 MHz
  800x600@60Hz 4:3 HorFreq: 37900 Hz Clock: 40.000 MHz
  800x600@72Hz 4:3 HorFreq: 48100 Hz Clock: 50.000 MHz
  800x600@75Hz 4:3 HorFreq: 46900 Hz Clock: 49.500 MHz
  832x624@75Hz 4:3 HorFreq: 49726 Hz Clock: 57.284 MHz
  1024x768@60Hz 4:3 HorFreq: 48400 Hz Clock: 65.000 MHz
  1024x768@70Hz 4:3 HorFreq: 56500 Hz Clock: 75.000 MHz
  1024x768@75Hz 4:3 HorFreq: 60000 Hz Clock: 78.750 MHz
  1280x1024@75Hz 5:4 HorFreq: 80000 Hz Clock: 135.000 MHz
  1152x870@75Hz 192:145 HorFreq: 67500 Hz Clock: 108.000 MHz
Standard timings supported:
  1280x1024@60Hz 5:4 HorFreq: 64000 Hz Clock: 108.000 MHz
  1280x720@60Hz 16:9
  1280x960@60Hz 4:3 HorFreq: 60000 Hz Clock: 108.000 MHz
  1152x864@75Hz 4:3 HorFreq: 67500 Hz Clock: 108.000 MHz
  1024x768@66Hz 4:3
  1400x1050@75Hz 4:3 HorFreq: 82300 Hz Clock: 156.000 MHz
  1440x900@75Hz 16:10 HorFreq: 82300 Hz Clock: 156.000 MHz
Detailed mode: Clock 106.500 MHz, 408 mm x 255 mm
               1440 1520 1672 1904 hborder 0
                900  903  909  934 vborder 0
               +hsync +vsync 
               VertFreq: 59 Hz, HorFreq: 55934 Hz
Monitor ranges (GTF): 49-75Hz V, 30-83kHz H, max dotclock 140MHz
Serial number: --
Checksum: 0xcc (valid)
EDID block does NOT conform to EDID 1.3!
	Name descriptor not terminated with a newline
One or more of the timings is out of range of the Monitor Ranges:
  Vertical Freq: 56 - 75 Hz
  Horizontal Freq: 31469 - 82300 Hz
  Maximum Clock: 156.000 MHz


