
EDID (hex):
00ffffffffffff0006afac1900000000
10210104a522167803d7a5ad5144b026
0c505400000001010101010101010101
010101010101106900a0a04030603020
aa0058d710000018106900a0a040cc61
3020aa0058d710000018000000fd0030
3c63631b010a202020202020000000fe
004231363051414e30332e52200a0080

edid-decode (hex):

00 ff ff ff ff ff ff 00 06 af ac 19 00 00 00 00
10 21 01 04 a5 22 16 78 03 d7 a5 ad 51 44 b0 26
0c 50 54 00 00 00 01 01 01 01 01 01 01 01 01 01
01 01 01 01 01 01 10 69 00 a0 a0 40 30 60 30 20
aa 00 58 d7 10 00 00 18 10 69 00 a0 a0 40 cc 61
30 20 aa 00 58 d7 10 00 00 18 00 00 00 fd 00 30
3c 63 63 1b 01 0a 20 20 20 20 20 20 00 00 00 fe
00 42 31 36 30 51 41 4e 30 33 2e 52 20 0a 00 80

----------------

Block 0, Base EDID:
  EDID Structure Version & Revision: 1.4
  Vendor & Product Identification:
    Manufacturer: AUO
    Model: 6572
    Made in: week 16 of 2023
  Basic Display Parameters & Features:
    Digital display
    Bits per primary color channel: 8
    DisplayPort interface
    Maximum image size: 34 cm x 22 cm
    Gamma: 2.20
    Supported color formats: RGB 4:4:4
    First detailed timing includes the native pixel format and preferred refresh rate
    Display is continuous frequency
  Color Characteristics:
    Red  : 0.6787, 0.3173
    Green: 0.2666, 0.6904
    Blue : 0.1503, 0.0488
    White: 0.3134, 0.3291
  Established Timings I & II: none
  Standard Timings: none
  Detailed Timing Descriptors:
    DTD 1:  2560x1600   60.001428 Hz  16:10    98.882 kHz    268.960000 MHz (344 mm x 215 mm)
                 Hfront   48 Hsync  32 Hback   80 Hpol N
                 Vfront   10 Vsync  10 Vback   28 Vpol N
    DTD 2:  2560x1600   48.001142 Hz  16:10    98.882 kHz    268.960000 MHz (344 mm x 215 mm)
                 Hfront   48 Hsync  32 Hback   80 Hpol N
                 Vfront   10 Vsync  10 Vback  440 Vpol N
    Display Range Limits:
      Monitor ranges (Bare Limits): 48-60 Hz V, 99-99 kHz H, max dotclock 270 MHz
    Alphanumeric Data String: 'B160QAN03.R '
Checksum: 0x80
