edid-decode (hex):

00 ff ff ff ff ff ff 00 30 e4 37 04 00 00 00 00
00 17 01 04 95 1c 10 78 03 bf 05 9a 59 55 8e 26
1d 50 54 00 00 00 01 01 01 01 01 01 01 01 01 01
01 01 01 01 01 01 bf 35 80 b4 70 38 0c 40 30 20
35 00 14 9c 10 00 00 1a 00 00 00 fe 00 4c 47 20
44 69 73 70 6c 61 79 0a 20 20 00 00 00 fd 00 28
3c 35 43 0e 00 0a 20 20 20 20 20 20 00 00 00 fe
00 4c 50 31 32 35 57 46 32 2d 53 50 42 32 00 8c

----------------

Block 0, Base EDID:
  EDID Structure Version & Revision: 1.4
  Vendor & Product Identification:
    Manufacturer: LGD
    Model: 1079
    Made in: 2013
  Basic Display Parameters & Features:
    Digital display
    Bits per primary color channel: 6
    DisplayPort interface
    Maximum image size: 28 cm x 16 cm
    Gamma: 2.20
    Supported color formats: RGB 4:4:4
    First detailed timing includes the native pixel format and preferred refresh rate
    Display is continuous frequency
  Color Characteristics:
    Red  : 0.6035, 0.3505
    Green: 0.3349, 0.5576
    Blue : 0.1484, 0.1132
    White: 0.3134, 0.3291
  Established Timings I & II: none
  Standard Timings: none
  Detailed Timing Descriptors:
    DTD 1:  1920x1080   59.999128 Hz  16:9     65.519 kHz    137.590000 MHz (276 mm x 156 mm)
                 Hfront   48 Hsync  32 Hback  100 Hpol P
                 Vfront    3 Vsync   5 Vback    4 Vpol N
    Alphanumeric Data String: 'LG Display'
    Display Range Limits:
      Monitor ranges (GTF): 40-60 Hz V, 53-67 kHz H, max dotclock 140 MHz
    Alphanumeric Data String: 'LP125WF2-SPB2'
Checksum: 0x8c

----------------

Warnings:

Block 0, Base EDID:
  Display Range Limits: GTF support is deprecated in EDID 1.4.

Failures:

Block 0, Base EDID:
  Missing Display Product Name.

EDID conformity: FAIL
