
EDID (hex):
00ffffffffffff001e6db95a68e50500
0319010380301b78eb3135a5554ea126
0c5054a54b00714f81809500b300a9c0
810081c09040023a801871382d40582c
4500e00e1100001e000000fd00384b1e
530f000a202020202020000000fc004c
472046554c4c2048440a2020000000ff
003530334e44504842433430380a0150
02031a71450402031112230907078301
000067030c000000881e000000000000
00000000000000000000000000000000
00000000000000000000000000000000
00000000000000000000000000000000
00000000000000000000000000000000
00000000000000000000000000000000
00000000000000000000000000000025

Extracted contents:
header:          00 ff ff ff ff ff ff 00
serial number:   1e 6d b9 5a 68 e5 05 00 03 19
version:         01 03
basic params:    80 30 1b 78 eb
chroma info:     31 35 a5 55 4e a1 26 0c 50 54
established:     a5 4b 00
standard:        71 4f 81 80 95 00 b3 00 a9 c0 81 00 81 c0 90 40
descriptor 1:    02 3a 80 18 71 38 2d 40 58 2c 45 00 e0 0e 11 00 00 1e
descriptor 2:    00 00 00 fd 00 38 4b 1e 53 0f 00 0a 20 20 20 20 20 20
descriptor 3:    00 00 00 fc 00 4c 47 20 46 55 4c 4c 20 48 44 0a 20 20
descriptor 4:    00 00 00 ff 00 35 30 33 4e 44 50 48 42 43 34 30 38 0a
extensions:      01
checksum:        50

EDID version: 1.3
Manufacturer: GSM Model 5ab9 Serial Number --
Made in week 3 of 2015
Digital display
Maximum image size: 48 cm x 27 cm
Gamma: 2.20
DPMS levels: Standby Suspend Off
RGB color display
First detailed timing is preferred timing
Supports GTF timings within operating range
Display x,y Chromaticity:
  Red:   0.6445, 0.3349
  Green: 0.3046, 0.6298
  Blue:  0.1484, 0.0498
  White: 0.3134, 0.3291
Established timings supported:
  720x400@70Hz 9:5 HorFreq: 31469 Hz Clock: 28.320 MHz
  640x480@60Hz 4:3 HorFreq: 31469 Hz Clock: 25.175 MHz
  640x480@75Hz 4:3 HorFreq: 37500 Hz Clock: 31.500 MHz
  800x600@60Hz 4:3 HorFreq: 37900 Hz Clock: 40.000 MHz
  800x600@75Hz 4:3 HorFreq: 46900 Hz Clock: 49.500 MHz
  1024x768@60Hz 4:3 HorFreq: 48400 Hz Clock: 65.000 MHz
  1024x768@75Hz 4:3 HorFreq: 60000 Hz Clock: 78.750 MHz
  1280x1024@75Hz 5:4 HorFreq: 80000 Hz Clock: 135.000 MHz
Standard timings supported:
  1152x864@75Hz 4:3 HorFreq: 67500 Hz Clock: 108.000 MHz
  1280x1024@60Hz 5:4 HorFreq: 64000 Hz Clock: 108.000 MHz
  1440x900@60Hz 16:10 HorFreq: 55500 Hz Clock: 88.750 MHz
  1680x1050@60Hz 16:10 HorFreq: 64700 Hz Clock: 119.000 MHz
  1600x900@60Hz 16:9
  1280x800@60Hz 16:10
  1280x720@60Hz 16:9
  1400x1050@60Hz 4:3 HorFreq: 64700 Hz Clock: 101.000 MHz
Detailed mode: Clock 148.500 MHz, 480 mm x 270 mm
               1920 2008 2052 2200 hborder 0
               1080 1084 1089 1125 vborder 0
               +hsync +vsync 
               VertFreq: 60 Hz, HorFreq: 67500 Hz
Monitor ranges (GTF): 56-75Hz V, 30-83kHz H, max dotclock 150MHz
Monitor name: LG FULL HD
Serial number: --
Has 1 extension blocks
Checksum: 0x50 (valid)

CTA extension block
Extension version: 3
22 bytes of CTA data
  Video data block
    VIC   4 1280x720@60Hz 16:9  HorFreq: 45000 Hz Clock: 74.250 MHz
    VIC   2 720x480@60Hz 4:3  HorFreq: 31469 Hz Clock: 27.000 MHz
    VIC   3 720x480@60Hz 16:9  HorFreq: 31469 Hz Clock: 27.000 MHz
    VIC  17 720x576@50Hz 4:3  HorFreq: 31250 Hz Clock: 27.000 MHz
    VIC  18 720x576@50Hz 16:9  HorFreq: 31250 Hz Clock: 27.000 MHz
  Audio data block
    Linear PCM, max channels 2
      Supported sample rates (kHz): 48 44.1 32
      Supported sample sizes (bits): 24 20 16
  Speaker allocation data block
    Speaker map:
      FL/FR - Front Left/Right
  Vendor-specific data block, OUI 000c03 (HDMI)
    Source physical address 0.0.0.0
    Supports_AI
    DC_Y444
    Maximum TMDS clock: 150MHz
Basic audio support
Supports YCbCr 4:4:4
Supports YCbCr 4:2:2
1 native detailed modes
Checksum: 0x25 (valid)

One or more of the timings is out of range of the Monitor Ranges:
  Vertical Freq: 50 - 75 Hz
  Horizontal Freq: 31250 - 80000 Hz
  Maximum Clock: 148.500 MHz
EDID block does not conform at all!
	Both the serial number and the serial string are set


