edid-decode (hex):

00 ff ff ff ff ff ff 00 5a 63 3f d2 01 01 01 01
2a 21 01 04 b5 3c 21 78 3b 28 51 a9 53 46 a5 25
0e 50 54 af ef 80 a9 c0 b3 00 95 00 81 80 71 40
81 c0 81 40 a9 40 6a 5e 00 a0 a0 a0 29 50 30 20
35 00 55 50 21 00 00 1a 00 00 00 fd 00 30 b9 ff
ff 50 01 0a 20 20 20 20 20 20 00 00 00 fc 00 56
58 32 37 35 38 2d 32 4b 2d 50 52 4f 00 00 00 ff
00 58 45 46 32 33 34 32 30 31 36 39 39 0a 02 ed

02 03 33 f1 4d 1f 01 02 03 04 05 10 11 12 13 14
3f 4d 23 09 07 07 83 01 00 00 6d 1a 00 00 02 01
30 b9 00 00 00 00 00 00 e3 05 c2 00 e6 06 05 01
64 64 4f d4 bc 00 a0 a0 a0 29 50 30 20 35 00 55
50 21 00 00 1a 5c 9d 00 a0 a0 a0 29 50 30 20 35
00 55 50 21 00 00 1a 1c 82 80 88 70 38 2d 40 18
20 35 00 55 50 21 00 00 1a 98 e2 00 a0 a0 a0 29
50 30 20 35 00 55 50 21 00 00 1a 00 00 00 00 4d

70 12 79 00 00 03 01 50 a3 03 01 04 ff 09 9f 00
2f 80 1f 00 9f 05 28 00 02 80 04 00 84 09 01 04
ff 09 9f 00 2f 80 1f 00 9f 05 1d 00 02 80 04 00
22 19 01 04 ff 09 9f 00 2f 80 1f 00 9f 05 1d 00
02 80 04 00 d1 1e 01 04 ff 09 8b 00 2f 00 1f 00
9f 05 1d 00 02 00 04 00 00 00 00 00 00 00 00 00
00 00 00 00 00 00 00 00 00 00 00 00 00 00 00 00
00 00 00 00 00 00 00 00 00 00 00 00 00 00 c9 90

00 ff ff ff ff ff ff 00 5a 63 3f d2 01 01 01 01
2a 21 01 04 b5 3c 21 78 3b 28 51 a9 53 46 a5 25
0e 50 54 af ef 80 a9 c0 b3 00 95 00 81 80 71 40
81 c0 81 40 a9 40 6a 5e 00 a0 a0 a0 29 50 30 20
35 00 55 50 21 00 00 1a 00 00 00 fd 00 30 b9 ff
ff 50 01 0a 20 20 20 20 20 20 00 00 00 fc 00 56
58 32 37 35 38 2d 32 4b 2d 50 52 4f 00 00 00 ff
00 58 45 46 32 33 34 32 30 31 36 39 39 0a 02 ed

02 03 33 f1 4d 1f 01 02 03 04 05 10 11 12 13 14
3f 4d 23 09 07 07 83 01 00 00 6d 1a 00 00 02 01
30 b9 00 00 00 00 00 00 e3 05 c2 00 e6 06 05 01
64 64 4f d4 bc 00 a0 a0 a0 29 50 30 20 35 00 55
50 21 00 00 1a 5c 9d 00 a0 a0 a0 29 50 30 20 35
00 55 50 21 00 00 1a 1c 82 80 88 70 38 2d 40 18
20 35 00 55 50 21 00 00 1a 98 e2 00 a0 a0 a0 29
50 30 20 35 00 55 50 21 00 00 1a 00 00 00 00 4d

70 12 79 00 00 03 01 50 a3 03 01 04 ff 09 9f 00
2f 80 1f 00 9f 05 28 00 02 80 04 00 84 09 01 04
ff 09 9f 00 2f 80 1f 00 9f 05 1d 00 02 80 04 00
22 19 01 04 ff 09 9f 00 2f 80 1f 00 9f 05 1d 00
02 80 04 00 d1 1e 01 04 ff 09 8b 00 2f 00 1f 00
9f 05 1d 00 02 00 04 00 00 00 00 00 00 00 00 00
00 00 00 00 00 00 00 00 00 00 00 00 00 00 00 00
00 00 00 00 00 00 00 00 00 00 00 00 00 00 c9 90

----------------

Block 0, Base EDID:
  EDID Structure Version & Revision: 1.4
  Vendor & Product Identification:
    Manufacturer: VSC
    Model: 53823
    Serial Number: ...
    Made in: week 42 of 2023
  Basic Display Parameters & Features:
    Digital display
    Bits per primary color channel: 10
    DisplayPort interface
    Maximum image size: 60 cm x 33 cm
    Gamma: 2.20
    DPMS levels: Off
    Supported color formats: RGB 4:4:4, YCrCb 4:4:4, YCrCb 4:2:2
    First detailed timing includes the native pixel format and preferred refresh rate
    Display is continuous frequency
  Color Characteristics:
    Red  : 0.6601, 0.3261
    Green: 0.2753, 0.6445
    Blue : 0.1455, 0.0556
    White: 0.3125, 0.3291
  Established Timings I & II:
    IBM     :   720x400    70.081663 Hz   9:5     31.467 kHz     28.320000 MHz
    DMT 0x04:   640x480    59.940476 Hz   4:3     31.469 kHz     25.175000 MHz
    DMT 0x05:   640x480    72.808802 Hz   4:3     37.861 kHz     31.500000 MHz
    DMT 0x06:   640x480    75.000000 Hz   4:3     37.500 kHz     31.500000 MHz
    DMT 0x08:   800x600    56.250000 Hz   4:3     35.156 kHz     36.000000 MHz
    DMT 0x09:   800x600    60.316541 Hz   4:3     37.879 kHz     40.000000 MHz
    DMT 0x0a:   800x600    72.187572 Hz   4:3     48.077 kHz     50.000000 MHz
    DMT 0x0b:   800x600    75.000000 Hz   4:3     46.875 kHz     49.500000 MHz
    Apple   :   832x624    74.551266 Hz   4:3     49.726 kHz     57.284000 MHz
    DMT 0x10:  1024x768    60.003840 Hz   4:3     48.363 kHz     65.000000 MHz
    DMT 0x11:  1024x768    70.069359 Hz   4:3     56.476 kHz     75.000000 MHz
    DMT 0x12:  1024x768    75.028582 Hz   4:3     60.023 kHz     78.750000 MHz
    DMT 0x24:  1280x1024   75.024675 Hz   5:4     79.976 kHz    135.000000 MHz
    Apple   :  1152x870    75.061550 Hz 192:145   68.681 kHz    100.000000 MHz
  Standard Timings:
    DMT 0x53:  1600x900    60.000000 Hz  16:9     60.000 kHz    108.000000 MHz (RB)
    DMT 0x3a:  1680x1050   59.954250 Hz  16:10    65.290 kHz    146.250000 MHz
    DMT 0x2f:  1440x900    59.887445 Hz  16:10    55.935 kHz    106.500000 MHz
    DMT 0x23:  1280x1024   60.019740 Hz   5:4     63.981 kHz    108.000000 MHz
    GTF     :  1152x864    60.000000 Hz   4:3     53.700 kHz     81.624000 MHz
    DMT 0x55:  1280x720    60.000000 Hz  16:9     45.000 kHz     74.250000 MHz
    DMT 0x20:  1280x960    60.000000 Hz   4:3     60.000 kHz    108.000000 MHz
    DMT 0x33:  1600x1200   60.000000 Hz   4:3     75.000 kHz    162.000000 MHz
  Detailed Timing Descriptors:
    DTD 1:  2560x1440   60.000199 Hz  16:9     88.860 kHz    241.700000 MHz (597 mm x 336 mm)
                 Hfront   48 Hsync  32 Hback   80 Hpol P
                 Vfront    3 Vsync   5 Vback   33 Vpol N
    Display Range Limits:
      Monitor ranges (Bare Limits): 48-185 Hz V, 255-255 kHz H, max dotclock 800 MHz
    Display Product Name: 'VX2758-2K-PRO'
    Display Product Serial Number: ...
  Extension blocks: 2
Checksum: 0xed

----------------

Block 1, CTA-861 Extension Block:
  Revision: 3
  Underscans IT Video Formats by default
  Basic audio support
  Supports YCbCr 4:4:4
  Supports YCbCr 4:2:2
  Native detailed modes: 1
  Video Data Block:
    VIC  31:  1920x1080   50.000000 Hz  16:9     56.250 kHz    148.500000 MHz
    VIC   1:   640x480    59.940476 Hz   4:3     31.469 kHz     25.175000 MHz
    VIC   2:   720x480    59.940060 Hz   4:3     31.469 kHz     27.000000 MHz
    VIC   3:   720x480    59.940060 Hz  16:9     31.469 kHz     27.000000 MHz
    VIC   4:  1280x720    60.000000 Hz  16:9     45.000 kHz     74.250000 MHz
    VIC   5:  1920x1080i  60.000000 Hz  16:9     33.750 kHz     74.250000 MHz
    VIC  16:  1920x1080   60.000000 Hz  16:9     67.500 kHz    148.500000 MHz
    VIC  17:   720x576    50.000000 Hz   4:3     31.250 kHz     27.000000 MHz
    VIC  18:   720x576    50.000000 Hz  16:9     31.250 kHz     27.000000 MHz
    VIC  19:  1280x720    50.000000 Hz  16:9     37.500 kHz     74.250000 MHz
    VIC  20:  1920x1080i  50.000000 Hz  16:9     28.125 kHz     74.250000 MHz
    VIC  63:  1920x1080  120.000000 Hz  16:9    135.000 kHz    297.000000 MHz
    VIC  77:  1920x1080  100.000000 Hz  64:27   112.500 kHz    297.000000 MHz
  Audio Data Block:
    Linear PCM:
      Max channels: 2
      Supported sample rates (kHz): 48 44.1 32
      Supported sample sizes (bits): 24 20 16
  Speaker Allocation Data Block:
    FL/FR - Front Left/Right
  Vendor-Specific Data Block (AMD), OUI 00-00-1A:
    Version: 2.1
    Minimum Refresh Rate: 48 Hz
    Maximum Refresh Rate: 185 Hz
    Flags 1.x: 0x00
    Flags 2.x: 0x00
    Maximum luminance: 0 (50.000 cd/m^2)
    Minimum luminance: 0 (0.000 cd/m^2)
    Unknown: 0x00 0x00
  Colorimetry Data Block:
    xvYCC709
    BT2020YCC
    BT2020RGB
  HDR Static Metadata Data Block:
    Electro optical transfer functions:
      Traditional gamma - SDR luminance range
      SMPTE ST2084
    Supported static metadata descriptors:
      Static metadata type 1
    Desired content max luminance: 100 (436.203 cd/m^2)
    Desired content max frame-average luminance: 100 (436.203 cd/m^2)
    Desired content min luminance: 79 (0.419 cd/m^2)
  Detailed Timing Descriptors:
    DTD 2:  2560x1440  120.000397 Hz  16:9    177.721 kHz    483.400000 MHz (597 mm x 336 mm)
                 Hfront   48 Hsync  32 Hback   80 Hpol P
                 Vfront    3 Vsync   5 Vback   33 Vpol N
    DTD 3:  2560x1440  100.001986 Hz  16:9    148.103 kHz    402.840000 MHz (597 mm x 336 mm)
                 Hfront   48 Hsync  32 Hback   80 Hpol P
                 Vfront    3 Vsync   5 Vback   33 Vpol N
    DTD 4:  1920x1080  144.003459 Hz  16:9    162.004 kHz    333.080000 MHz (597 mm x 336 mm)
                 Hfront   24 Hsync  32 Hback   80 Hpol P
                 Vfront    3 Vsync   5 Vback   37 Vpol N
    DTD 5:  2560x1440  144.000477 Hz  16:9    213.265 kHz    580.080000 MHz (597 mm x 336 mm)
                 Hfront   48 Hsync  32 Hback   80 Hpol P
                 Vfront    3 Vsync   5 Vback   33 Vpol N
Checksum: 0x4d  Unused space in Extension Block: 4 bytes

----------------

Block 2, DisplayID Extension Block:
  Version: 1.2
  Extension Count: 0
  Display Product Type: Extension Section
  Video Timing Modes Type 1 - Detailed Timings Data Block:
    DTD:  2560x1440  165.001787 Hz  16:9    244.368 kHz    664.680000 MHz (aspect 16:9, no 3D stereo)
               Hfront   48 Hsync  32 Hback   80 Hpol P
               Vfront    3 Vsync   5 Vback   33 Vpol P
    DTD:  2560x1440  170.000500 Hz  16:9    249.901 kHz    679.730000 MHz (aspect 16:9, no 3D stereo)
               Hfront   48 Hsync  32 Hback   80 Hpol P
               Vfront    3 Vsync   5 Vback   22 Vpol P
    DTD:  2560x1440  179.999500 Hz  16:9    264.599 kHz    719.710000 MHz (aspect 16:9, no 3D stereo)
               Hfront   48 Hsync  32 Hback   80 Hpol P
               Vfront    3 Vsync   5 Vback   22 Vpol P
    DTD:  2560x1440  184.998740 Hz  16:9    271.948 kHz    734.260000 MHz (aspect 16:9, no 3D stereo)
               Hfront   48 Hsync  32 Hback   60 Hpol N
               Vfront    3 Vsync   5 Vback   22 Vpol N
  Checksum: 0xc9
Checksum: 0x90

----------------

Block 3, Unknown EDID Extension Block 0x00:
  00 ff ff ff ff ff ff 00 5a 63 3f d2 01 01 01 01 '........Zc?.....'
  2a 21 01 04 b5 3c 21 78 3b 28 51 a9 53 46 a5 25 '*!...<!x;(Q.SF.%'
  0e 50 54 af ef 80 a9 c0 b3 00 95 00 81 80 71 40 '.PT...........q@'
  81 c0 81 40 a9 40 6a 5e 00 a0 a0 a0 29 50 30 20 '...@.@j^....)P0 '
  35 00 55 50 21 00 00 1a 00 00 00 fd 00 30 b9 ff '5.UP!........0..'
  ff 50 01 0a 20 20 20 20 20 20 00 00 00 fc 00 56 '.P..      .....V'
  58 32 37 35 38 2d 32 4b 2d 50 52 4f 00 00 00 ff 'X2758-2K-PRO....'
  00 58 45 46 32 33 34 32 30 31 36 39 39 0a 02 ed '.XEF234201699...'
Checksum: 0xed

----------------

Block 4, CTA-861 Extension Block:
  Revision: 3
  Underscans IT Video Formats by default
  Basic audio support
  Supports YCbCr 4:4:4
  Supports YCbCr 4:2:2
  Native detailed modes: 1
  Video Data Block:
    VIC  31:  1920x1080   50.000000 Hz  16:9     56.250 kHz    148.500000 MHz
    VIC   1:   640x480    59.940476 Hz   4:3     31.469 kHz     25.175000 MHz
    VIC   2:   720x480    59.940060 Hz   4:3     31.469 kHz     27.000000 MHz
    VIC   3:   720x480    59.940060 Hz  16:9     31.469 kHz     27.000000 MHz
    VIC   4:  1280x720    60.000000 Hz  16:9     45.000 kHz     74.250000 MHz
    VIC   5:  1920x1080i  60.000000 Hz  16:9     33.750 kHz     74.250000 MHz
    VIC  16:  1920x1080   60.000000 Hz  16:9     67.500 kHz    148.500000 MHz
    VIC  17:   720x576    50.000000 Hz   4:3     31.250 kHz     27.000000 MHz
    VIC  18:   720x576    50.000000 Hz  16:9     31.250 kHz     27.000000 MHz
    VIC  19:  1280x720    50.000000 Hz  16:9     37.500 kHz     74.250000 MHz
    VIC  20:  1920x1080i  50.000000 Hz  16:9     28.125 kHz     74.250000 MHz
    VIC  63:  1920x1080  120.000000 Hz  16:9    135.000 kHz    297.000000 MHz
    VIC  77:  1920x1080  100.000000 Hz  64:27   112.500 kHz    297.000000 MHz
  Audio Data Block:
    Linear PCM:
      Max channels: 2
      Supported sample rates (kHz): 48 44.1 32
      Supported sample sizes (bits): 24 20 16
  Speaker Allocation Data Block:
    FL/FR - Front Left/Right
  Vendor-Specific Data Block (AMD), OUI 00-00-1A:
    Version: 2.1
    Minimum Refresh Rate: 48 Hz
    Maximum Refresh Rate: 185 Hz
    Flags 1.x: 0x00
    Flags 2.x: 0x00
    Maximum luminance: 0 (50.000 cd/m^2)
    Minimum luminance: 0 (0.000 cd/m^2)
    Unknown: 0x00 0x00
  Colorimetry Data Block:
    xvYCC709
    BT2020YCC
    BT2020RGB
  HDR Static Metadata Data Block:
    Electro optical transfer functions:
      Traditional gamma - SDR luminance range
      SMPTE ST2084
    Supported static metadata descriptors:
      Static metadata type 1
    Desired content max luminance: 100 (436.203 cd/m^2)
    Desired content max frame-average luminance: 100 (436.203 cd/m^2)
    Desired content min luminance: 79 (0.419 cd/m^2)
  Detailed Timing Descriptors:
    DTD 6:  2560x1440  120.000397 Hz  16:9    177.721 kHz    483.400000 MHz (597 mm x 336 mm)
                 Hfront   48 Hsync  32 Hback   80 Hpol P
                 Vfront    3 Vsync   5 Vback   33 Vpol N
    DTD 7:  2560x1440  100.001986 Hz  16:9    148.103 kHz    402.840000 MHz (597 mm x 336 mm)
                 Hfront   48 Hsync  32 Hback   80 Hpol P
                 Vfront    3 Vsync   5 Vback   33 Vpol N
    DTD 8:  1920x1080  144.003459 Hz  16:9    162.004 kHz    333.080000 MHz (597 mm x 336 mm)
                 Hfront   24 Hsync  32 Hback   80 Hpol P
                 Vfront    3 Vsync   5 Vback   37 Vpol N
    DTD 9:  2560x1440  144.000477 Hz  16:9    213.265 kHz    580.080000 MHz (597 mm x 336 mm)
                 Hfront   48 Hsync  32 Hback   80 Hpol P
                 Vfront    3 Vsync   5 Vback   33 Vpol N
Checksum: 0x4d  Unused space in Extension Block: 4 bytes

----------------

Block 5, DisplayID Extension Block:
  Version: 1.2
  Extension Count: 0
  Video Timing Modes Type 1 - Detailed Timings Data Block:
    DTD:  2560x1440  165.001787 Hz  16:9    244.368 kHz    664.680000 MHz (aspect 16:9, no 3D stereo)
               Hfront   48 Hsync  32 Hback   80 Hpol P
               Vfront    3 Vsync   5 Vback   33 Vpol P
    DTD:  2560x1440  170.000500 Hz  16:9    249.901 kHz    679.730000 MHz (aspect 16:9, no 3D stereo)
               Hfront   48 Hsync  32 Hback   80 Hpol P
               Vfront    3 Vsync   5 Vback   22 Vpol P
    DTD:  2560x1440  179.999500 Hz  16:9    264.599 kHz    719.710000 MHz (aspect 16:9, no 3D stereo)
               Hfront   48 Hsync  32 Hback   80 Hpol P
               Vfront    3 Vsync   5 Vback   22 Vpol P
    DTD:  2560x1440  184.998740 Hz  16:9    271.948 kHz    734.260000 MHz (aspect 16:9, no 3D stereo)
               Hfront   48 Hsync  32 Hback   60 Hpol N
               Vfront    3 Vsync   5 Vback   22 Vpol N
  Checksum: 0xc9
Checksum: 0x90

----------------

Warnings:

Block 1, CTA-861 Extension Block:
  Colorimetry Data Block: Set the sRGB colorimetry bit to avoid interop issues.
  Display Product Serial Number is set, so the Serial Number in the Base EDID should be 0.
Block 4, CTA-861 Extension Block:
  Colorimetry Data Block: Set the sRGB colorimetry bit to avoid interop issues.
  Display Product Serial Number is set, so the Serial Number in the Base EDID should be 0.
EDID:
  Base EDID: Some timings are out of range of the Monitor Ranges:
    Horizontal Freq: 28.125 - 271.948 kHz (Monitor: 255.000 - 255.000 kHz)

Failures:

Block 1, CTA-861 Extension Block:
  Missing VCDB, needed for Set Selectable RGB Quantization to avoid interop issues.
Block 2, DisplayID Extension Block:
  DisplayID Base Block has no product type.
  Expected 0 DisplayID Extension Block, but got 1.
Block 3, Base EDID:
  Unknown Extension Block.
Block 4, CTA-861 Extension Block:
  Video Data Block: Duplicate VIC 31.
  Video Data Block: Duplicate VIC 1.
  Video Data Block: Duplicate VIC 2.
  Video Data Block: Duplicate VIC 3.
  Video Data Block: Duplicate VIC 4.
  Video Data Block: Duplicate VIC 5.
  Video Data Block: Duplicate VIC 16.
  Video Data Block: Duplicate VIC 17.
  Video Data Block: Duplicate VIC 18.
  Video Data Block: Duplicate VIC 19.
  Video Data Block: Duplicate VIC 20.
  Video Data Block: Duplicate VIC 63.
  Video Data Block: Duplicate VIC 77.
  Speaker Allocation Data Block: Only one instance of this Data Block is allowed.
  Colorimetry Data Block: Only one instance of this Data Block is allowed.
  HDR Static Metadata Data Block: Only one instance of this Data Block is allowed.
  Missing VCDB, needed for Set Selectable RGB Quantization to avoid interop issues.
EDID:
  Base EDID: EDID specified 2 extension block(s), but found 5 extension block(s).
  DisplayID: Missing DisplayID Product Identification Data Block.
  DisplayID: DisplayID expects at least one preferred timing.

EDID conformity: FAIL
