
EDID (hex):
00ffffffffffff003674000000000000
0f110103682b1b78eeb505a5564a9a25
125054210800714f8180b300d1c08bc0
010101010101023a801871382d40582c
4500e00e1100001e000000ff00585958
5858594d44313233500a000000fc004d
737461722064656d6f200a20000000fd
00384c1e5310000a20202020202000f1

Extracted contents:
header:          00 ff ff ff ff ff ff 00
serial number:   36 74 00 00 00 00 00 00 0f 11
version:         01 03
basic params:    68 2b 1b 78 ee
chroma info:     b5 05 a5 56 4a 9a 25 12 50 54
established:     21 08 00
standard:        71 4f 81 80 b3 00 d1 c0 8b c0 01 01 01 01 01 01
descriptor 1:    02 3a 80 18 71 38 2d 40 58 2c 45 00 e0 0e 11 00 00 1e
descriptor 2:    00 00 00 ff 00 58 59 58 58 58 59 4d 44 31 32 33 50 0a
descriptor 3:    00 00 00 fc 00 4d 73 74 61 72 20 64 65 6d 6f 20 0a 20
descriptor 4:    00 00 00 fd 00 38 4c 1e 53 10 00 0a 20 20 20 20 20 20
extensions:      00
checksum:        f1

EDID version: 1.3
Manufacturer: MST Model 0 Serial Number --
Made in week 15 of 2007
Analog display, Input voltage level: 0.7/0.7 V
Sync: Separate 
Maximum image size: 43 cm x 27 cm
Gamma: 2.20
DPMS levels: Standby Suspend Off
RGB color display
Default (sRGB) color space is primary color space
First detailed timing is preferred timing
Display x,y Chromaticity:
  Red:   0.6464, 0.3388
  Green: 0.2900, 0.6025
  Blue:  0.1445, 0.0703
  White: 0.3134, 0.3291
Established timings supported:
  640x480@60Hz 4:3 HorFreq: 31469 Hz Clock: 25.175 MHz
  800x600@60Hz 4:3 HorFreq: 37900 Hz Clock: 40.000 MHz
  1024x768@60Hz 4:3 HorFreq: 48400 Hz Clock: 65.000 MHz
Standard timings supported:
  1152x864@75Hz 4:3 HorFreq: 67500 Hz Clock: 108.000 MHz
  1280x1024@60Hz 5:4 HorFreq: 64000 Hz Clock: 108.000 MHz
  1680x1050@60Hz 16:10 HorFreq: 64700 Hz Clock: 119.000 MHz
  1920x1080@60Hz 16:9
  1360x765@60Hz 16:9
Detailed mode: Clock 148.500 MHz, 480 mm x 270 mm
               1920 2008 2052 2200 hborder 0
               1080 1084 1089 1125 vborder 0
               +hsync +vsync 
               VertFreq: 60 Hz, HorFreq: 67500 Hz
Serial number: --
Monitor name: Mstar demo 
Monitor ranges (GTF): 56-76Hz V, 30-83kHz H, max dotclock 160MHz
Checksum: 0xf1 (valid)
EDID block does NOT conform to EDID 1.3!
	sRGB is signaled, but the chromaticities do not match
