
EDID (hex):
00ffffffffffff00306484b911030000
06100103682819782fd390a2594a9624
145054bfef0081808140714f95000101
0101010101018435a0f051842a306098
360098ff1000001c000000ff00353131
36324a41303030373835000000fd0032
4c1e520e000a202020202020000000fc
0052393035452d570a20202020200088

edid-decode (hex):

00 ff ff ff ff ff ff 00 30 64 84 b9 11 03 00 00
06 10 01 03 68 28 19 78 2f d3 90 a2 59 4a 96 24
14 50 54 bf ef 00 81 80 81 40 71 4f 95 00 01 01
01 01 01 01 01 01 84 35 a0 f0 51 84 2a 30 60 98
36 00 98 ff 10 00 00 1c 00 00 00 ff 00 35 31 31
36 32 4a 41 30 30 30 37 38 35 00 00 00 fd 00 32
4c 1e 52 0e 00 0a 20 20 20 20 20 20 00 00 00 fc
00 52 39 30 35 45 2d 57 0a 20 20 20 20 20 00 88

----------------

Block 0, Base EDID:
  EDID Structure Version & Revision: 1.3
  Vendor & Product Identification:
    Manufacturer: LCD
    Model: 47492
    Serial Number: 785
    Made in: week 6 of 2006
  Basic Display Parameters & Features:
    Analog display
    Signal Level Standard: 0.700 : 0.000 : 0.700 V p-p
    Blank level equals black level
    Sync: Separate
    Maximum image size: 40 cm x 25 cm
    Gamma: 2.20
    DPMS levels: Off
    RGB color display
    Default (sRGB) color space is primary color space
    First detailed timing is the preferred timing
    Supports GTF timings within operating range
  Color Characteristics:
    Red  : 0.6357, 0.3486
    Green: 0.2890, 0.5888
    Blue : 0.1425, 0.0791
    White: 0.3125, 0.3281
  Established Timings I & II:
    IBM     :   720x400    70.081663 Hz   9:5     31.467 kHz     28.320000 MHz
    DMT 0x04:   640x480    59.940476 Hz   4:3     31.469 kHz     25.175000 MHz
    Apple   :   640x480    66.666667 Hz   4:3     35.000 kHz     30.240000 MHz
    DMT 0x05:   640x480    72.808802 Hz   4:3     37.861 kHz     31.500000 MHz
    DMT 0x06:   640x480    75.000000 Hz   4:3     37.500 kHz     31.500000 MHz
    DMT 0x08:   800x600    56.250000 Hz   4:3     35.156 kHz     36.000000 MHz
    DMT 0x09:   800x600    60.316541 Hz   4:3     37.879 kHz     40.000000 MHz
    DMT 0x0a:   800x600    72.187572 Hz   4:3     48.077 kHz     50.000000 MHz
    DMT 0x0b:   800x600    75.000000 Hz   4:3     46.875 kHz     49.500000 MHz
    Apple   :   832x624    74.551266 Hz   4:3     49.726 kHz     57.284000 MHz
    DMT 0x10:  1024x768    60.003840 Hz   4:3     48.363 kHz     65.000000 MHz
    DMT 0x11:  1024x768    70.069359 Hz   4:3     56.476 kHz     75.000000 MHz
    DMT 0x12:  1024x768    75.028582 Hz   4:3     60.023 kHz     78.750000 MHz
    DMT 0x24:  1280x1024   75.024675 Hz   5:4     79.976 kHz    135.000000 MHz
  Standard Timings:
    DMT 0x23:  1280x1024   60.019740 Hz   5:4     63.981 kHz    108.000000 MHz
    DMT 0x20:  1280x960    60.000000 Hz   4:3     60.000 kHz    108.000000 MHz
    DMT 0x15:  1152x864    75.000000 Hz   4:3     67.500 kHz    108.000000 MHz
    DMT 0x2f:  1440x900    59.887445 Hz  16:10    55.935 kHz    106.500000 MHz
  Detailed Timing Descriptors:
    DTD 1:  1440x900    75.121510 Hz  16:10    70.764 kHz    137.000000 MHz (408 mm x 255 mm)
                 Hfront   96 Hsync 152 Hback  248 Hpol N
                 Vfront    3 Vsync   6 Vback   33 Vpol P
    Display Product Serial Number: '51162JA000785'
    Display Range Limits:
      Monitor ranges (GTF): 50-76 Hz V, 30-82 kHz H, max dotclock 140 MHz
    Display Product Name: 'R905E-W'
Checksum: 0x88
