
EDID (hex):
00ffffffffffff001ab37a0701010101
0c130103803420782aef95a3544c9b26
0f5054a54b009500950f8100810f81c0
8180a9400101283c80a070b023403020
360006442100001a000000fd00384c1e
5210000a202020202020000000fc004c
3234572d320a202020202020000000ff
00594535523032383237360a202000c7

Extracted contents:
header:          00 ff ff ff ff ff ff 00
serial number:   1a b3 7a 07 01 01 01 01 0c 13
version:         01 03
basic params:    80 34 20 78 2a
chroma info:     ef 95 a3 54 4c 9b 26 0f 50 54
established:     a5 4b 00
standard:        95 00 95 0f 81 00 81 0f 81 c0 81 80 a9 40 01 01
descriptor 1:    28 3c 80 a0 70 b0 23 40 30 20 36 00 06 44 21 00 00 1a
descriptor 2:    00 00 00 fd 00 38 4c 1e 52 10 00 0a 20 20 20 20 20 20
descriptor 3:    00 00 00 fc 00 4c 32 34 57 2d 32 0a 20 20 20 20 20 20
descriptor 4:    00 00 00 ff 00 59 45 35 52 30 32 38 32 37 36 0a 20 20
extensions:      00
checksum:        c7

EDID version: 1.3
Manufacturer: FUS Model 77a Serial Number --
Made in week 12 of 2009
Digital display
Maximum image size: 52 cm x 32 cm
Gamma: 2.20
DPMS levels: Off
RGB color display
First detailed timing is preferred timing
Display x,y Chromaticity:
  Red:   0.6396, 0.3300
  Green: 0.2998, 0.6083
  Blue:  0.1503, 0.0595
  White: 0.3134, 0.3291
Established timings supported:
  720x400@70Hz 9:5 HorFreq: 31469 Hz Clock: 28.320 MHz
  640x480@60Hz 4:3 HorFreq: 31469 Hz Clock: 25.175 MHz
  640x480@75Hz 4:3 HorFreq: 37500 Hz Clock: 31.500 MHz
  800x600@60Hz 4:3 HorFreq: 37900 Hz Clock: 40.000 MHz
  800x600@75Hz 4:3 HorFreq: 46900 Hz Clock: 49.500 MHz
  1024x768@60Hz 4:3 HorFreq: 48400 Hz Clock: 65.000 MHz
  1024x768@75Hz 4:3 HorFreq: 60000 Hz Clock: 78.750 MHz
  1280x1024@75Hz 5:4 HorFreq: 80000 Hz Clock: 135.000 MHz
Standard timings supported:
  1440x900@60Hz 16:10 HorFreq: 55500 Hz Clock: 88.750 MHz
  1440x900@75Hz 16:10 HorFreq: 82300 Hz Clock: 156.000 MHz
  1280x800@60Hz 16:10
  1280x800@75Hz 16:10
  1280x720@60Hz 16:9
  1280x1024@60Hz 5:4 HorFreq: 64000 Hz Clock: 108.000 MHz
  1600x1200@60Hz 4:3 HorFreq: 75000 Hz Clock: 162.000 MHz
Detailed mode: Clock 154.000 MHz, 518 mm x 324 mm
               1920 1968 2000 2080 hborder 0
               1200 1203 1209 1235 vborder 0
               +hsync -vsync 
               VertFreq: 59 Hz, HorFreq: 74038 Hz
Monitor ranges (GTF): 56-76Hz V, 30-82kHz H, max dotclock 160MHz
Monitor name: L24W-2
Serial number: --
Checksum: 0xc7 (valid)
One or more of the timings is out of range of the Monitor Ranges:
  Vertical Freq: 59 - 75 Hz
  Horizontal Freq: 31469 - 82300 Hz
  Maximum Clock: 162.000 MHz
