edid-decode (hex):

00 ff ff ff ff ff ff 00 34 38 de 05 63 04 00 00
13 0d 01 03 e8 1e 17 78 6e 9d 9e 99 58 4c 93 26
21 4c 54 af ce 00 31 4c 31 4f 45 40 45 4c 45 4f
61 40 61 4a 61 4f d6 09 80 a0 20 5e 63 10 30 60
c2 0c 30 e4 10 00 00 1a 00 00 00 fd 00 38 4b 1f
3e 08 0a 20 20 20 20 20 20 20 00 00 00 fc 00 42
31 30 31 35 35 36 0a 20 20 20 20 20 00 00 00 fe
00 4d 41 58 44 41 54 41 0a 20 20 20 20 20 00 fa

----------------

Block 0, Base EDID:
  EDID Structure Version & Revision: 1.3
  Vendor & Product Identification:
    Manufacturer: MAX
    Model: 1502
    Serial Number: ...
    Made in: week 19 of 2003
  Basic Display Parameters & Features:
    Digital display
    Maximum image size: 30 cm x 23 cm
    Gamma: 2.20
    DPMS levels: Suspend Off
    RGB color display
    Default (sRGB) color space is primary color space
    First detailed timing is preferred timing
  Color Characteristics:
    Red  : 0.5996, 0.3447
    Green: 0.2998, 0.5751
    Blue : 0.1503, 0.1298
    White: 0.2998, 0.3300
  Established Timings I & II:
    IBM     :   720x400    70.082 Hz   9:5    31.467 kHz  28.320 MHz
    DMT 0x04:   640x480    59.940 Hz   4:3    31.469 kHz  25.175 MHz
    DMT 0x05:   640x480    72.809 Hz   4:3    37.861 kHz  31.500 MHz
    DMT 0x06:   640x480    75.000 Hz   4:3    37.500 kHz  31.500 MHz
    DMT 0x08:   800x600    56.250 Hz   4:3    35.156 kHz  36.000 MHz
    DMT 0x09:   800x600    60.317 Hz   4:3    37.879 kHz  40.000 MHz
    DMT 0x0a:   800x600    72.188 Hz   4:3    48.077 kHz  50.000 MHz
    DMT 0x0b:   800x600    75.000 Hz   4:3    46.875 kHz  49.500 MHz
    DMT 0x10:  1024x768    60.004 Hz   4:3    48.363 kHz  65.000 MHz
    DMT 0x11:  1024x768    70.069 Hz   4:3    56.476 kHz  75.000 MHz
    DMT 0x12:  1024x768    75.029 Hz   4:3    60.023 kHz  78.750 MHz
  Standard Timings:
    DMT 0x05:   640x480    72.809 Hz   4:3    37.861 kHz  31.500 MHz
    DMT 0x06:   640x480    75.000 Hz   4:3    37.500 kHz  31.500 MHz
    DMT 0x09:   800x600    60.317 Hz   4:3    37.879 kHz  40.000 MHz
    DMT 0x0a:   800x600    72.188 Hz   4:3    48.077 kHz  50.000 MHz
    DMT 0x0b:   800x600    75.000 Hz   4:3    46.875 kHz  49.500 MHz
    DMT 0x10:  1024x768    60.004 Hz   4:3    48.363 kHz  65.000 MHz
    GTF     :  1024x768    70.000 Hz   4:3    56.000 kHz  76.160 MHz
    DMT 0x12:  1024x768    75.029 Hz   4:3    60.023 kHz  78.750 MHz
  Detailed Timing Descriptors:
    DTD 1:   640x350    70.100 Hz  64:35   31.475 kHz  25.180 MHz (304 mm x 228 mm)
                 Hfront   48 Hsync  96 Hback  16 Hpol P
                 Vfront   60 Vsync   2 Vback  37 Vpol N
  Display Range Limits:
    Monitor ranges (Unknown (0x0a)): 56-75 Hz V, 31-62 kHz H, max dotclock 80 MHz
    Display Product Name: 'B101556'
    Alphanumeric Data String: 'MAXDATA'
Checksum: 0xfa
