edid-decode (hex):

00 ff ff ff ff ff ff 00 09 e5 6c 07 00 00 00 00
01 1a 01 04 a5 22 13 78 02 f1 00 94 5c 58 92 29
21 50 54 00 00 00 01 01 01 01 01 01 01 01 01 01
01 01 01 01 01 01 ce 1d 56 e2 50 00 1e 30 30 20
36 00 14 9b 10 00 00 1a df 13 56 e2 50 00 1e 30
30 20 36 00 14 9b 10 00 00 1a 00 00 00 fe 00 42
4f 45 20 43 51 0a 20 20 20 20 20 20 00 00 00 fe
00 4e 54 31 32 35 57 48 4d 2d 4e 34 35 0a 00 bd

----------------

Block 0, Base EDID:
  EDID Structure Version & Revision: 1.4
  Vendor & Product Identification:
    Manufacturer: BOE
    Model: 1900
    Made in: week 1 of 2016
  Basic Display Parameters & Features:
    Digital display
    Bits per primary color channel: 8
    DisplayPort interface
    Maximum image size: 34 cm x 19 cm
    Gamma: 2.20
    Supported color formats: RGB 4:4:4
    First detailed timing includes the native pixel format and preferred refresh rate
  Color Characteristics:
    Red  : 0.5810, 0.3623
    Green: 0.3437, 0.5712
    Blue : 0.1601, 0.1289
    White: 0.3125, 0.3281
  Established Timings I & II: none
  Standard Timings: none
  Detailed Timing Descriptors:
    DTD 1:  1366x768    60.059067 Hz 683:384   47.927 kHz     76.300000 MHz (276 mm x 155 mm)
                 Hfront   48 Hsync  32 Hback  146 Hpol P
                 Vfront    3 Vsync   6 Vback   21 Vpol N
    DTD 2:  1366x768    40.042002 Hz 683:384   31.954 kHz     50.870000 MHz (276 mm x 155 mm)
                 Hfront   48 Hsync  32 Hback  146 Hpol P
                 Vfront    3 Vsync   6 Vback   21 Vpol N
    Alphanumeric Data String: 'BOE CQ'
    Alphanumeric Data String: 'NT125WHM-N45'
Checksum: 0xbd

----------------

Failures:

Block 0, Base EDID:
  Detailed Timing Descriptor #1: Mismatch of image size 276x155 mm vs display size 340x190 mm.
  Detailed Timing Descriptor #2: Mismatch of image size 276x155 mm vs display size 340x190 mm.
  Missing Display Product Name.

EDID conformity: FAIL
