edid-decode (hex):

00 ff ff ff ff ff ff 00 04 72 ed 01 8e b8 30 03
21 14 01 03 08 2c 19 78 ea de 95 a3 54 4c 99 26
0f 50 54 bf ee 80 71 4f 81 c0 81 00 01 01 01 01
01 01 01 01 01 01 31 2e 40 00 62 84 22 30 58 a8
35 00 bb f9 10 00 00 1d 00 00 00 fd 00 37 4b 1f
50 0c 00 0a 20 20 20 20 20 20 00 00 00 ff 00 4c
51 4d 30 43 30 31 31 34 30 31 31 0a 00 00 00 fc
00 50 32 30 36 48 56 0a 20 20 20 20 20 20 00 a5

00 ff ff ff ff ff ff 00 04 72 ed 01 8e b8 30 03
21 14 01 03 08 2c 19 78 ea de 95 a3 54 4c 99 26
0f 50 54 bf ee 80 71 4f 81 c0 81 00 01 01 01 01
01 01 01 01 01 01 31 2e 40 00 62 84 22 30 58 a8
35 00 bb f9 10 00 00 1d 00 00 00 fd 00 37 4b 1f
50 0c 00 0a 20 20 20 20 20 20 00 00 00 ff 00 4c
51 4d 30 43 30 31 31 34 30 31 31 0a 00 00 00 fc
00 50 32 30 36 48 56 0a 20 20 20 20 20 20 00 a5

----------------

Block 0, Base EDID:
  EDID Structure Version & Revision: 1.3
  Vendor & Product Identification:
    Manufacturer: ACR
    Model: 493
    Serial Number: ...
    Made in: week 33 of 2010
  Basic Display Parameters & Features:
    Analog display
    Signal Level Standard: 0.700 : 0.300 : 1.000 V p-p
    Blank level equals black level
    Sync: Separate
    Maximum image size: 44 cm x 25 cm
    Gamma: 2.20
    DPMS levels: Standby Suspend Off
    RGB color display
    First detailed timing is the preferred timing
  Color Characteristics:
    Red  : 0.6396, 0.3291
    Green: 0.2998, 0.5996
    Blue : 0.1503, 0.0595
    White: 0.3134, 0.3291
  Established Timings I & II:
    IBM     :   720x400    70.081663 Hz   9:5     31.467 kHz     28.320000 MHz
    DMT 0x04:   640x480    59.940476 Hz   4:3     31.469 kHz     25.175000 MHz
    Apple   :   640x480    66.666667 Hz   4:3     35.000 kHz     30.240000 MHz
    DMT 0x05:   640x480    72.808802 Hz   4:3     37.861 kHz     31.500000 MHz
    DMT 0x06:   640x480    75.000000 Hz   4:3     37.500 kHz     31.500000 MHz
    DMT 0x08:   800x600    56.250000 Hz   4:3     35.156 kHz     36.000000 MHz
    DMT 0x09:   800x600    60.316541 Hz   4:3     37.879 kHz     40.000000 MHz
    DMT 0x0a:   800x600    72.187572 Hz   4:3     48.077 kHz     50.000000 MHz
    DMT 0x0b:   800x600    75.000000 Hz   4:3     46.875 kHz     49.500000 MHz
    Apple   :   832x624    74.551266 Hz   4:3     49.726 kHz     57.284000 MHz
    DMT 0x10:  1024x768    60.003840 Hz   4:3     48.363 kHz     65.000000 MHz
    DMT 0x11:  1024x768    70.069359 Hz   4:3     56.476 kHz     75.000000 MHz
    DMT 0x12:  1024x768    75.028582 Hz   4:3     60.023 kHz     78.750000 MHz
    Apple   :  1152x870    75.061550 Hz 192:145   68.681 kHz    100.000000 MHz
  Standard Timings:
    DMT 0x15:  1152x864    75.000000 Hz   4:3     67.500 kHz    108.000000 MHz
    DMT 0x55:  1280x720    60.000000 Hz  16:9     45.000 kHz     74.250000 MHz
    DMT 0x1c:  1280x800    59.810326 Hz  16:10    49.702 kHz     83.500000 MHz
  Detailed Timing Descriptors:
    DTD 1:  1600x900    59.946021 Hz  16:9     55.990 kHz    118.250000 MHz (443 mm x 249 mm)
                 Hfront   88 Hsync 168 Hback  256 Hpol N
                 Vfront    3 Vsync   5 Vback   26 Vpol P
    Display Range Limits:
      Monitor ranges (GTF): 55-75 Hz V, 31-80 kHz H, max dotclock 120 MHz
    Display Product Serial Number: ...
    Display Product Name: 'P206HV'
Checksum: 0xa5

----------------

Block 1, Unknown EDID Extension Block 0x00:
  00 ff ff ff ff ff ff 00 04 72 ed 01 8e b8 30 03 '.........r....0.'
  21 14 01 03 08 2c 19 78 ea de 95 a3 54 4c 99 26 '!....,.x....TL.&'
  0f 50 54 bf ee 80 71 4f 81 c0 81 00 01 01 01 01 '.PT...qO........'
  01 01 01 01 01 01 31 2e 40 00 62 84 22 30 58 a8 '......1.@.b."0X.'
  35 00 bb f9 10 00 00 1d 00 00 00 fd 00 37 4b 1f '5............7K.'
  50 0c 00 0a 20 20 20 20 20 20 00 00 00 ff 00 4c 'P...      .....L'
  51 4d 30 43 30 31 31 34 30 31 31 0a 00 00 00 fc 'QM0C0114011.....'
  00 50 32 30 36 48 56 0a 20 20 20 20 20 20 00 a5 '.P206HV.      ..'
Checksum: 0xa5

----------------

Failures:

Block 1, Base EDID:
  Unknown Extension Block.
EDID:
  Base EDID: EDID specified 0 extension block(s), but found 1 extension block(s).

EDID conformity: FAIL
