
EDID (hex):
00ffffffffffff000472ed01c7e08003
26140103082c1978eade95a3544c9926
0f5054bfee80714f81c0810001010101
010101010101312e40006284223058a8
3500bbf91000001d000000fd00374b1f
500c000a202020202020000000ff004c
514d3043303033343030310a000000fc
005032303648560a20202020202000ef

Extracted contents:
header:          00 ff ff ff ff ff ff 00
serial number:   04 72 ed 01 c7 e0 80 03 26 14
version:         01 03
basic params:    08 2c 19 78 ea
chroma info:     de 95 a3 54 4c 99 26 0f 50 54
established:     bf ee 80
standard:        71 4f 81 c0 81 00 01 01 01 01 01 01 01 01 01 01
descriptor 1:    31 2e 40 00 62 84 22 30 58 a8 35 00 bb f9 10 00 00 1d
descriptor 2:    00 00 00 fd 00 37 4b 1f 50 0c 00 0a 20 20 20 20 20 20
descriptor 3:    00 00 00 ff 00 4c 51 4d 30 43 30 30 33 34 30 30 31 0a
descriptor 4:    00 00 00 fc 00 50 32 30 36 48 56 0a 20 20 20 20 20 20
extensions:      00
checksum:        ef

EDID version: 1.3
Manufacturer: ACR Model 1ed Serial Number --
Made in week 38 of 2010
Analog display, Input voltage level: 0.7/0.3 V
Sync: Separate 
Maximum image size: 44 cm x 25 cm
Gamma: 2.20
DPMS levels: Standby Suspend Off
RGB color display
First detailed timing is preferred timing
Display x,y Chromaticity:
  Red:   0.6396, 0.3291
  Green: 0.2998, 0.5996
  Blue:  0.1503, 0.0595
  White: 0.3134, 0.3291
Established timings supported:
  720x400@70Hz 9:5 HorFreq: 31469 Hz Clock: 28.320 MHz
  640x480@60Hz 4:3 HorFreq: 31469 Hz Clock: 25.175 MHz
  640x480@67Hz 4:3 HorFreq: 35000 Hz Clock: 30.240 MHz
  640x480@72Hz 4:3 HorFreq: 37900 Hz Clock: 31.500 MHz
  640x480@75Hz 4:3 HorFreq: 37500 Hz Clock: 31.500 MHz
  800x600@56Hz 4:3 HorFreq: 35200 Hz Clock: 36.000 MHz
  800x600@60Hz 4:3 HorFreq: 37900 Hz Clock: 40.000 MHz
  800x600@72Hz 4:3 HorFreq: 48100 Hz Clock: 50.000 MHz
  800x600@75Hz 4:3 HorFreq: 46900 Hz Clock: 49.500 MHz
  832x624@75Hz 4:3 HorFreq: 49726 Hz Clock: 57.284 MHz
  1024x768@60Hz 4:3 HorFreq: 48400 Hz Clock: 65.000 MHz
  1024x768@70Hz 4:3 HorFreq: 56500 Hz Clock: 75.000 MHz
  1024x768@75Hz 4:3 HorFreq: 60000 Hz Clock: 78.750 MHz
  1152x870@75Hz 192:145 HorFreq: 67500 Hz Clock: 108.000 MHz
Standard timings supported:
  1152x864@75Hz 4:3 HorFreq: 67500 Hz Clock: 108.000 MHz
  1280x720@60Hz 16:9
  1280x800@60Hz 16:10
Detailed mode: Clock 118.250 MHz, 443 mm x 249 mm
               1600 1688 1856 2112 hborder 0
                900  903  908  934 vborder 0
               -hsync +vsync 
               VertFreq: 59 Hz, HorFreq: 55989 Hz
Monitor ranges (GTF): 55-75Hz V, 31-80kHz H, max dotclock 120MHz
Serial number: --
Monitor name: P206HV
Checksum: 0xef (valid)
