
EDID (hex):
00ffffffffffff004ca3554e00000000
0014010380160d780a93359458579029
1e505400000001010101010101010101
0101010101011b150040415846201888
3600df7d000000190000000f00000000
000000000071ee136e00000000fe0053
414d53554e470a2020202020000000fe
003130314e5430352d5530330a20008c

Extracted contents:
header:          00 ff ff ff ff ff ff 00
serial number:   4c a3 55 4e 00 00 00 00 00 14
version:         01 03
basic params:    80 16 0d 78 0a
chroma info:     93 35 94 58 57 90 29 1e 50 54
established:     00 00 00
standard:        01 01 01 01 01 01 01 01 01 01 01 01 01 01 01 01
descriptor 1:    1b 15 00 40 41 58 46 20 18 88 36 00 df 7d 00 00 00 19
descriptor 2:    00 00 00 0f 00 00 00 00 00 00 00 00 00 71 ee 13 6e 00
descriptor 3:    00 00 00 fe 00 53 41 4d 53 55 4e 47 0a 20 20 20 20 20
descriptor 4:    00 00 00 fe 00 31 30 31 4e 54 30 35 2d 55 30 33 0a 20
extensions:      00
checksum:        8c

EDID version: 1.3
Manufacturer: SEC Model 4e55 Serial Number --
Made in year 2010
Digital display
Maximum image size: 22 cm x 13 cm
Gamma: 2.20
RGB color display
First detailed timing is preferred timing
Display x,y Chromaticity:
  Red:   0.5800, 0.3447
  Green: 0.3398, 0.5654
  Blue:  0.1601, 0.1201
  White: 0.3134, 0.3291
Established timings supported:
Standard timings supported:
Detailed mode: Clock 54.030 MHz, 223 mm x 125 mm
               1024 1048 1184 1344 hborder 0
                600  603  609  670 vborder 0
               -hsync -vsync 
               VertFreq: 60 Hz, HorFreq: 40200 Hz
Manufacturer-specified data, tag 15
ASCII string: SAMSUNG
ASCII string: 101NT05-U03
Checksum: 0x8c (valid)
EDID block does NOT conform to EDID 1.3!
	Missing name descriptor
	Missing monitor ranges
