
EDID (hex):
00ffffffffffff0022f0442801010101
1415010368291a78ee37c5a4554c9b25
125054a1080081408180010101010101
0101010101019a29a0d0518422305098
360098ff1000001c000000fd00324c18
530e000a202020202020000000fc004c
41313930350a202020202020000000ff
00434e43313230305342350a20200053

Extracted contents:
header:          00 ff ff ff ff ff ff 00
serial number:   22 f0 44 28 01 01 01 01 14 15
version:         01 03
basic params:    68 29 1a 78 ee
chroma info:     37 c5 a4 55 4c 9b 25 12 50 54
established:     a1 08 00
standard:        81 40 81 80 01 01 01 01 01 01 01 01 01 01 01 01
descriptor 1:    9a 29 a0 d0 51 84 22 30 50 98 36 00 98 ff 10 00 00 1c
descriptor 2:    00 00 00 fd 00 32 4c 18 53 0e 00 0a 20 20 20 20 20 20
descriptor 3:    00 00 00 fc 00 4c 41 31 39 30 35 0a 20 20 20 20 20 20
descriptor 4:    00 00 00 ff 00 43 4e 43 31 32 30 30 53 42 35 0a 20 20
extensions:      00
checksum:        53

EDID version: 1.3
Manufacturer: HWP Model 2844 Serial Number --
Made in week 20 of 2011
Analog display, Input voltage level: 0.7/0.7 V
Sync: Separate 
Maximum image size: 41 cm x 26 cm
Gamma: 2.20
DPMS levels: Standby Suspend Off
RGB color display
Default (sRGB) color space is primary color space
First detailed timing is preferred timing
Display x,y Chromaticity:
  Red:   0.6406, 0.3349
  Green: 0.2978, 0.6083
  Blue:  0.1474, 0.0703
  White: 0.3134, 0.3291
Established timings supported:
  720x400@70Hz 9:5 HorFreq: 31469 Hz Clock: 28.320 MHz
  640x480@60Hz 4:3 HorFreq: 31469 Hz Clock: 25.175 MHz
  800x600@60Hz 4:3 HorFreq: 37900 Hz Clock: 40.000 MHz
  1024x768@60Hz 4:3 HorFreq: 48400 Hz Clock: 65.000 MHz
Standard timings supported:
  1280x960@60Hz 4:3 HorFreq: 60000 Hz Clock: 108.000 MHz
  1280x1024@60Hz 5:4 HorFreq: 64000 Hz Clock: 108.000 MHz
Detailed mode: Clock 106.500 MHz, 408 mm x 255 mm
               1440 1520 1672 1904 hborder 0
                900  903  909  934 vborder 0
               -hsync +vsync 
               VertFreq: 59 Hz, HorFreq: 55934 Hz
Monitor ranges (GTF): 50-76Hz V, 24-83kHz H, max dotclock 140MHz
Monitor name: LA1905
Serial number: --
Checksum: 0x53 (valid)
EDID block does NOT conform to EDID 1.3!
	sRGB is signaled, but the chromaticities do not match
