edid-decode (hex):

00 ff ff ff ff ff ff 00 06 af ec 20 00 00 00 00
01 12 01 03 90 22 13 78 0a c8 95 9e 57 54 92 26
0f 50 54 00 00 00 01 01 01 01 01 01 01 01 01 01
01 01 01 01 01 01 26 1b 56 47 50 00 26 30 30 20
34 00 58 c1 10 00 00 1a 26 1b 56 47 50 00 26 30
30 20 34 00 58 c1 10 00 00 1a 00 00 00 fe 00 46
34 31 34 4a 80 42 31 35 36 58 57 32 00 00 00 00
00 00 00 00 00 00 00 00 00 01 01 0a 20 20 00 7e

----------------

Block 0, Base EDID:
  EDID Structure Version & Revision: 1.3
  Vendor & Product Identification:
    Manufacturer: AUO
    Model: 8428
    Made in: week 1 of 2008
  Basic Display Parameters & Features:
    Digital display
    Maximum image size: 34 cm x 19 cm
    Gamma: 2.20
    RGB color display
    First detailed timing is the preferred timing
  Color Characteristics:
    Red  : 0.6201, 0.3398
    Green: 0.3300, 0.5703
    Blue : 0.1503, 0.0595
    White: 0.3134, 0.3291
  Established Timings I & II: none
  Standard Timings: none
  Detailed Timing Descriptors:
    DTD 1:  1366x768    60.005767 Hz 683:384   48.365 kHz     69.500000 MHz (344 mm x 193 mm)
                 Hfront   48 Hsync  32 Hback   -9 Hpol P
                 Vfront    3 Vsync   4 Vback   31 Vpol N
    DTD 2:  1366x768    60.005767 Hz 683:384   48.365 kHz     69.500000 MHz (344 mm x 193 mm)
                 Hfront   48 Hsync  32 Hback   -9 Hpol P
                 Vfront    3 Vsync   4 Vback   31 Vpol N
    Alphanumeric Data String: 'F414J'
    Manufacturer-Specified Display Descriptor (0x00): 00 00 00 00 00 00 00 00 00 00 00 01 01 0a 20 20 '..............  '
Checksum: 0x7e

----------------

Failures:

Block 0, Base EDID:
  Basic Display Parameters & Features: Digital Video Interface Standard set to reserved value 0x10.
  Detailed Timing Descriptor #1: 0 or negative horizontal back porch.
  Detailed Timing Descriptor #2: 0 or negative horizontal back porch.
  Alphanumeric Data String: Non-printable character.
  Missing Display Product Name.
  Missing Display Range Limits Descriptor.

EDID conformity: FAIL
