
EDID (hex):
00ffffffffffff001e6d875724c20500
0414010380331c78ee4135a4564c9d26
125054a56f808180818f7140b300814f
714f01010101023a801871382d40582c
4500fe1f1100001e000000fd003b791e
8d1e000a202020202020000000fc0057
32333633440a202020202020000000ff
003030344e44514142333338300a014b
02010400fe5b80a07038354030203500
fe1f1100001ea96580a070383a403020
3500fe1f1100001e866f80a070384040
30203500fe1f1100001e000000000000
00000000000000000000000000000000
00000000000000000000000000000000
00000000000000000000000000000000
00000000000000000000000000000063

Extracted contents:
header:          00 ff ff ff ff ff ff 00
serial number:   1e 6d 87 57 24 c2 05 00 04 14
version:         01 03
basic params:    80 33 1c 78 ee
chroma info:     41 35 a4 56 4c 9d 26 12 50 54
established:     a5 6f 80
standard:        81 80 81 8f 71 40 b3 00 81 4f 71 4f 01 01 01 01
descriptor 1:    02 3a 80 18 71 38 2d 40 58 2c 45 00 fe 1f 11 00 00 1e
descriptor 2:    00 00 00 fd 00 3b 79 1e 8d 1e 00 0a 20 20 20 20 20 20
descriptor 3:    00 00 00 fc 00 57 32 33 36 33 44 0a 20 20 20 20 20 20
descriptor 4:    00 00 00 ff 00 30 30 34 4e 44 51 41 42 33 33 38 30 0a
extensions:      01
checksum:        4b

EDID version: 1.3
Manufacturer: GSM Model 5787 Serial Number --
Made in week 4 of 2010
Digital display
Maximum image size: 51 cm x 28 cm
Gamma: 2.20
DPMS levels: Standby Suspend Off
RGB color display
Default (sRGB) color space is primary color space
First detailed timing is preferred timing
Display x,y Chromaticity:
  Red:   0.6416, 0.3359
  Green: 0.2968, 0.6142
  Blue:  0.1484, 0.0732
  White: 0.3134, 0.3291
Established timings supported:
  720x400@70Hz 9:5 HorFreq: 31469 Hz Clock: 28.320 MHz
  640x480@60Hz 4:3 HorFreq: 31469 Hz Clock: 25.175 MHz
  640x480@75Hz 4:3 HorFreq: 37500 Hz Clock: 31.500 MHz
  800x600@60Hz 4:3 HorFreq: 37900 Hz Clock: 40.000 MHz
  800x600@75Hz 4:3 HorFreq: 46900 Hz Clock: 49.500 MHz
  832x624@75Hz 4:3 HorFreq: 49726 Hz Clock: 57.284 MHz
  1024x768@60Hz 4:3 HorFreq: 48400 Hz Clock: 65.000 MHz
  1024x768@70Hz 4:3 HorFreq: 56500 Hz Clock: 75.000 MHz
  1024x768@75Hz 4:3 HorFreq: 60000 Hz Clock: 78.750 MHz
  1280x1024@75Hz 5:4 HorFreq: 80000 Hz Clock: 135.000 MHz
  1152x870@75Hz 192:145 HorFreq: 67500 Hz Clock: 108.000 MHz
Standard timings supported:
  1280x1024@60Hz 5:4 HorFreq: 64000 Hz Clock: 108.000 MHz
  1280x1024@75Hz 5:4 HorFreq: 80000 Hz Clock: 135.000 MHz
  1152x864@60Hz 4:3
  1680x1050@60Hz 16:10 HorFreq: 64700 Hz Clock: 119.000 MHz
  1280x960@75Hz 4:3
  1152x864@75Hz 4:3 HorFreq: 67500 Hz Clock: 108.000 MHz
Detailed mode: Clock 148.500 MHz, 510 mm x 287 mm
               1920 2008 2052 2200 hborder 0
               1080 1084 1089 1125 vborder 0
               +hsync +vsync 
               VertFreq: 60 Hz, HorFreq: 67500 Hz
Monitor ranges (GTF): 59-121Hz V, 30-141kHz H, max dotclock 300MHz
Monitor name: W2363D
Serial number: --
Has 1 extension blocks
Checksum: 0x4b (valid)

CTA extension block
Extension version: 1
0 8-byte timing descriptors
Detailed mode: Clock 235.500 MHz, 510 mm x 287 mm
               1920 1968 2000 2080 hborder 0
               1080 1083 1088 1133 vborder 0
               +hsync +vsync 
               VertFreq: 99 Hz, HorFreq: 113221 Hz
Detailed mode: Clock 260.250 MHz, 510 mm x 287 mm
               1920 1968 2000 2080 hborder 0
               1080 1083 1088 1138 vborder 0
               +hsync +vsync 
               VertFreq: 109 Hz, HorFreq: 125120 Hz
Detailed mode: Clock 285.500 MHz, 510 mm x 287 mm
               1920 1968 2000 2080 hborder 0
               1080 1083 1088 1144 vborder 0
               +hsync +vsync 
               VertFreq: 119 Hz, HorFreq: 137259 Hz
Checksum: 0x63 (valid)

EDID block does NOT conform to EDID 1.3!
	sRGB is signaled, but the chromaticities do not match
EDID block does not conform at all!
	Both the serial number and the serial string are set
