edid-decode (hex):

00 ff ff ff ff ff ff 00 09 d1 01 a4 a5 02 00 00
1e 11 01 03 80 00 00 78 0a 54 ac a1 5a 5a 89 23
18 50 58 ad ce 00 01 01 31 4f 31 59 45 59 61 59
81 80 01 01 01 01 9a 20 00 90 51 20 1f 30 48 80
36 00 00 00 00 00 00 18 00 00 00 fe 00 42 45 4e
51 0a 20 20 20 20 20 20 20 20 00 00 00 fc 00 4d
50 36 32 30 63 0a 20 20 20 20 20 20 a9 1a 00 a0
50 00 16 30 30 20 37 00 00 00 00 00 00 00 00 da

----------------

Block 0, Base EDID:
  EDID Structure Version & Revision: 1.3
  Vendor & Product Identification:
    Manufacturer: BNQ
    Model: 41985
    Serial Number: ...
    Made in: week 30 of 2007
  Basic Display Parameters & Features:
    Digital display
    Image size is variable
    Gamma: 2.20
    RGB color display
    First detailed timing is the preferred timing
  Color Characteristics:
    Red  : 0.6298, 0.3525
    Green: 0.3525, 0.5351
    Blue : 0.1386, 0.0957
    White: 0.3154, 0.3437
  Established Timings I & II:
    IBM     :   720x400    70.081663 Hz   9:5     31.467 kHz     28.320000 MHz
    DMT 0x04:   640x480    59.940476 Hz   4:3     31.469 kHz     25.175000 MHz
    DMT 0x05:   640x480    72.808802 Hz   4:3     37.861 kHz     31.500000 MHz
    DMT 0x06:   640x480    75.000000 Hz   4:3     37.500 kHz     31.500000 MHz
    DMT 0x09:   800x600    60.316541 Hz   4:3     37.879 kHz     40.000000 MHz
    DMT 0x0a:   800x600    72.187572 Hz   4:3     48.077 kHz     50.000000 MHz
    DMT 0x0b:   800x600    75.000000 Hz   4:3     46.875 kHz     49.500000 MHz
    DMT 0x10:  1024x768    60.003840 Hz   4:3     48.363 kHz     65.000000 MHz
    DMT 0x11:  1024x768    70.069359 Hz   4:3     56.476 kHz     75.000000 MHz
    DMT 0x12:  1024x768    75.028582 Hz   4:3     60.023 kHz     78.750000 MHz
  Standard Timings:
    DMT 0x06:   640x480    75.000000 Hz   4:3     37.500 kHz     31.500000 MHz
    DMT 0x07:   640x480    85.008312 Hz   4:3     43.269 kHz     36.000000 MHz
    DMT 0x0c:   800x600    85.061274 Hz   4:3     53.674 kHz     56.250000 MHz
    DMT 0x13:  1024x768    84.996690 Hz   4:3     68.677 kHz     94.500000 MHz
    DMT 0x23:  1280x1024   60.019740 Hz   5:4     63.981 kHz    108.000000 MHz
  Detailed Timing Descriptors:
    DTD 1:  1280x800    59.781674 Hz   8:5     49.679 kHz     83.460000 MHz
                 Hfront   72 Hsync 128 Hback  200 Hpol N
                 Vfront    3 Vsync   6 Vback   22 Vpol N
    Alphanumeric Data String: 'BENQ'
    Display Product Name: 'MP620c'
    DTD 2:  1280x768    59.994726 Hz   5:3     47.396 kHz     68.250000 MHz (analog composite, sync-on-green)
                 Hfront   48 Hsync  32 Hback   80 Hpol N
                 Vfront    3 Vsync   7 Vback   12 Vpol N
Checksum: 0xda

----------------

Warnings:

Block 0, Base EDID:
  Detailed Timing Descriptor #2: DTD is similar but not identical to DMT 0x16.

Failures:

Block 0, Base EDID:
  Detailed Timing Descriptor #2: Invalid detailed timing descriptor ordering.
  Missing Display Range Limits Descriptor.

EDID conformity: FAIL
