
EDID (hex):
00ffffffffffff0009e5de0800000000
011d0104b526157803080ea75333bc20
10535f00000001010101010101010101
01010101010152d000a0f0703e803020
35007ed71000001a0000000000000000
0000000000000000001a000000fe0042
4f452048460a202020202020000000fe
004e4531373351554d2d4e34320a015e
02030f00e3058000e60605016a6a2400
00000000000000000000000000000000
00000000000000000000000000000000
00000000000000000000000000000000
00000000000000000000000000000000
00000000000000000000000000000000
00000000000000000000000000000000
0000000000000000000000000000009a

Extracted contents:
header:          00 ff ff ff ff ff ff 00
serial number:   09 e5 de 08 00 00 00 00 01 1d
version:         01 04
basic params:    b5 26 15 78 03
chroma info:     08 0e a7 53 33 bc 20 10 53 5f
established:     00 00 00
standard:        01 01 01 01 01 01 01 01 01 01 01 01 01 01 01 01
descriptor 1:    52 d0 00 a0 f0 70 3e 80 30 20 35 00 7e d7 10 00 00 1a
descriptor 2:    00 00 00 00 00 00 00 00 00 00 00 00 00 00 00 00 00 1a
descriptor 3:    00 00 00 fe 00 42 4f 45 20 48 46 0a 20 20 20 20 20 20
descriptor 4:    00 00 00 fe 00 4e 45 31 37 33 51 55 4d 2d 4e 34 32 0a
extensions:      01
checksum:        5e

EDID version: 1.4
Manufacturer: BOE Model 8de Serial Number --
Made in week 1 of 2019
Digital display
10 bits per primary color channel
DisplayPort interface
Maximum image size: 38 cm x 21 cm
Gamma: 2.20
Supported color formats: RGB 4:4:4
First detailed timing includes the native pixel format and preferred refresh rate
Display is continuous frequency
Display x,y Chromaticity:
  Red:   0.6523, 0.3242
  Green: 0.2011, 0.7343
  Blue:  0.1250, 0.0625
  White: 0.3271, 0.3730
Established timings supported:
Standard timings supported:
Detailed mode: Clock 533.300 MHz, 382 mm x 215 mm
               3840 3888 3920 4000 hborder 0
               2160 2163 2168 2222 vborder 0
               +hsync -vsync 
               VertFreq: 60 Hz, HorFreq: 133325 Hz
Manufacturer-specified data, tag 0
ASCII string: BOE HF
ASCII string: NE173QUM-N42
Has 1 extension blocks
Checksum: 0x5e (valid)

CTA extension block
Extension version: 3
11 bytes of CTA data
  Extended tag: Colorimetry data block
    BT2020RGB
  Extended tag: HDR static metadata data block
    Electro optical transfer functions:
      Traditional gamma - SDR luminance range
      SMPTE ST2084
    Supported static metadata descriptors:
      Static metadata type 1
    Desired content max luminance: 106 (496.743 cd/m^2)
    Desired content max frame-average luminance: 106 (496.743 cd/m^2)
    Desired content min luminance: 36 (0.099 cd/m^2)
0 native detailed modes
Checksum: 0x9a (valid)

EDID block does NOT conform to EDID 1.4!
	Required 640x480p60 timings are missing in the established timings
	and/or in the SVD list (VIC 1)
	Missing name descriptor
	Missing monitor ranges
