edid-decode (hex):

00 ff ff ff ff ff ff 00 22 f0 2a 33 01 01 01 01
14 1d 01 03 68 2e 1a 78 2a fb 25 a2 56 4e 97 26
0e 50 54 a1 08 00 d1 c0 81 c0 81 80 95 00 a9 c0
b3 00 81 00 01 01 02 3a 80 18 71 38 2d 40 58 2c
45 00 ca 02 11 00 00 1e 00 00 00 fd 00 32 3c 1e
50 11 00 0a 20 20 20 20 20 20 00 00 00 fc 00 48
50 20 32 31 6b 64 0a 20 20 20 20 20 00 00 00 ff
00 43 4e 43 39 32 30 30 32 58 43 0a 20 20 00 e0

00 ff ff ff ff ff ff 00 22 f0 2a 33 01 01 01 01
14 1d 01 03 68 2e 1a 78 2a fb 25 a2 56 4e 97 26
0e 50 54 a1 08 00 d1 c0 81 c0 81 80 95 00 a9 c0
b3 00 81 00 01 01 02 3a 80 18 71 38 2d 40 58 2c
45 00 ca 02 11 00 00 1e 00 00 00 fd 00 32 3c 1e
50 11 00 0a 20 20 20 20 20 20 00 00 00 fc 00 48
50 20 32 31 6b 64 0a 20 20 20 20 20 00 00 00 ff
00 43 4e 43 39 32 30 30 32 58 43 0a 20 20 00 e0

----------------

Block 0, Base EDID:
  EDID Structure Version & Revision: 1.3
  Vendor & Product Identification:
    Manufacturer: HWP
    Model: 13098
    Serial Number: ...
    Made in: week 20 of 2019
  Basic Display Parameters & Features:
    Analog display
    Signal Level Standard: 0.700 : 0.000 : 0.700 V p-p
    Blank level equals black level
    Sync: Separate
    Maximum image size: 46 cm x 26 cm
    Gamma: 2.20
    DPMS levels: Off
    RGB color display
    First detailed timing is the preferred timing
  Color Characteristics:
    Red  : 0.6357, 0.3388
    Green: 0.3066, 0.5927
    Blue : 0.1484, 0.0566
    White: 0.3134, 0.3291
  Established Timings I & II:
    IBM     :   720x400    70.081663 Hz   9:5     31.467 kHz     28.320000 MHz
    DMT 0x04:   640x480    59.940476 Hz   4:3     31.469 kHz     25.175000 MHz
    DMT 0x09:   800x600    60.316541 Hz   4:3     37.879 kHz     40.000000 MHz
    DMT 0x10:  1024x768    60.003840 Hz   4:3     48.363 kHz     65.000000 MHz
  Standard Timings:
    DMT 0x52:  1920x1080   60.000000 Hz  16:9     67.500 kHz    148.500000 MHz
    DMT 0x55:  1280x720    60.000000 Hz  16:9     45.000 kHz     74.250000 MHz
    DMT 0x23:  1280x1024   60.019740 Hz   5:4     63.981 kHz    108.000000 MHz
    DMT 0x2f:  1440x900    59.887445 Hz  16:10    55.935 kHz    106.500000 MHz
    DMT 0x53:  1600x900    60.000000 Hz  16:9     60.000 kHz    108.000000 MHz (RB)
    DMT 0x3a:  1680x1050   59.954250 Hz  16:10    65.290 kHz    146.250000 MHz
    DMT 0x1c:  1280x800    59.810326 Hz  16:10    49.702 kHz     83.500000 MHz
  Detailed Timing Descriptors:
    DTD 1:  1920x1080   60.000000 Hz  16:9     67.500 kHz    148.500000 MHz (458 mm x 258 mm)
                 Hfront   88 Hsync  44 Hback  148 Hpol P
                 Vfront    4 Vsync   5 Vback   36 Vpol P
    Display Range Limits:
      Monitor ranges (GTF): 50-60 Hz V, 30-80 kHz H, max dotclock 170 MHz
    Display Product Name: 'HP 21kd'
    Display Product Serial Number: ...
Checksum: 0xe0

----------------

Block 1, Unknown EDID Extension Block 0x00:
  00 ff ff ff ff ff ff 00 22 f0 2a 33 01 01 01 01 '........".*3....'
  14 1d 01 03 68 2e 1a 78 2a fb 25 a2 56 4e 97 26 '....h..x*.%.VN.&'
  0e 50 54 a1 08 00 d1 c0 81 c0 81 80 95 00 a9 c0 '.PT.............'
  b3 00 81 00 01 01 02 3a 80 18 71 38 2d 40 58 2c '.......:..q8-@X,'
  45 00 ca 02 11 00 00 1e 00 00 00 fd 00 32 3c 1e 'E............2<.'
  50 11 00 0a 20 20 20 20 20 20 00 00 00 fc 00 48 'P...      .....H'
  50 20 32 31 6b 64 0a 20 20 20 20 20 00 00 00 ff 'P 21kd.     ....'
  00 43 4e 43 39 32 30 30 32 58 43 0a 20 20 00 e0 '.CNC92002XC.  ..'
Checksum: 0xe0

----------------

Failures:

Block 1, Base EDID:
  Unknown Extension Block.
EDID:
  Base EDID: Some timings are out of range of the Monitor Ranges:
    Vertical Freq: 59.810 - 70.082 Hz (Monitor: 50.000 - 60.000 Hz)
  Base EDID: EDID specified 0 extension block(s), but found 1 extension block(s).

EDID conformity: FAIL
