edid-decode (hex):

00 ff ff ff ff ff ff 00 06 af 47 30 00 00 00 00
01 11 01 03 80 1e 13 78 0a 24 e5 97 54 4f 92 27
22 50 54 00 00 00 01 01 01 01 01 01 01 01 01 01
01 01 01 01 01 01 1c 2a a0 f4 51 84 1a 30 30 20
36 00 2f bd 10 00 00 18 00 00 00 0f 00 00 00 00
00 00 00 00 00 00 00 00 00 20 00 00 00 fe 00 41
55 4f 0a 20 20 20 20 20 20 20 20 20 00 00 00 fe
00 42 31 34 31 50 57 30 33 20 56 30 20 0a 00 40

----------------

Block 0, Base EDID:
  EDID Structure Version & Revision: 1.3
  Vendor & Product Identification:
    Manufacturer: AUO
    Model: 12359
    Made in: week 1 of 2007
  Basic Display Parameters & Features:
    Digital display
    Maximum image size: 30 cm x 19 cm
    Gamma: 2.20
    RGB color display
    First detailed timing is preferred timing
  Color Characteristics:
    Red  : 0.5898, 0.3300
    Green: 0.3095, 0.5703
    Blue : 0.1552, 0.1347
    White: 0.3134, 0.3291
  Established Timings I & II: none
  Standard Timings: none
  Detailed Timing Descriptors:
    DTD 1:  1440x900    60.008 Hz   8:5    55.567 kHz 107.800 MHz (303 mm x 189 mm)
                 Hfront   48 Hsync  32 Hback 420 Hpol N
                 Vfront    3 Vsync   6 Vback  17 Vpol N
    Manufacturer-Specified Display Descriptor (0x0f): 00 0f 00 00 00 00 00 00 00 00 00 00 00 00 00 20 '............... '
    Alphanumeric Data String: 'AUO'
    Alphanumeric Data String: 'B141PW03 V0 '
Checksum: 0x40
