edid-decode (hex):

00 ff ff ff ff ff ff 00 38 70 50 00 00 00 00 00
01 1d 01 04 a5 1f 11 78 03 c4 55 a1 56 51 a1 28
0d 50 54 00 00 00 01 01 01 01 01 01 01 01 01 01
01 01 01 01 01 01 02 83 80 04 71 38 ca 40 30 20
35 00 35 ae 10 00 00 1a 81 41 80 04 71 38 ca 40
30 20 35 00 35 ae 10 00 00 1a 00 00 00 fd 00 30
78 9a 9a 22 01 0a 20 20 20 20 20 20 00 00 00 fe
00 4c 4d 31 34 30 4c 46 2d 31 46 30 31 0a 00 44

----------------

Block 0, Base EDID:
  EDID Structure Version & Revision: 1.4
  Vendor & Product Identification:
    Manufacturer: NCP
    Model: 80
    Made in: week 1 of 2019
  Basic Display Parameters & Features:
    Digital display
    Bits per primary color channel: 8
    DisplayPort interface
    Maximum image size: 31 cm x 17 cm
    Gamma: 2.20
    Supported color formats: RGB 4:4:4
    First detailed timing includes the native pixel format and preferred refresh rate
    Display is continuous frequency
  Color Characteristics:
    Red  : 0.6318, 0.3359
    Green: 0.3173, 0.6289
    Blue : 0.1572, 0.0517
    White: 0.3134, 0.3291
  Established Timings I & II: none
  Standard Timings: none
  Detailed Timing Descriptors:
    DTD 1:  1920x1080  120.003 Hz  16:9   153.844 kHz 335.380 MHz (309 mm x 174 mm)
                 Hfront   48 Hsync  32 Hback 180 Hpol P
                 Vfront    3 Vsync   5 Vback 194 Vpol N
    DTD 2:  1920x1080   60.002 Hz  16:9    76.922 kHz 167.690 MHz (309 mm x 174 mm)
                 Hfront   48 Hsync  32 Hback 180 Hpol P
                 Vfront    3 Vsync   5 Vback 194 Vpol N
  Display Range Limits:
    Monitor ranges (Bare Limits): 48-120 Hz V, 154-154 kHz H, max dotclock 340 MHz
    Alphanumeric Data String: 'LM140LF-1F01'
Checksum: 0x44

----------------

Warnings:

All Blocks:
  Some timings are out of range of the Monitor Ranges:
    Horizontal Freq: 76.922 - 153.844 kHz (Monitor: 154.000 - 154.000 kHz)

Failures:

Block 0, Base EDID:
  Missing Display Product Name.

EDID conformity: FAIL
