edid-decode (hex):

00 ff ff ff ff ff ff 00 38 70 50 00 00 00 00 00
01 1d 01 04 a5 1f 11 78 03 a1 05 a1 56 4f a0 27
0f 50 54 00 00 00 01 01 01 01 01 01 01 01 01 01
01 01 01 01 01 01 81 41 80 04 71 38 ca 40 30 20
35 00 35 ae 10 00 00 1a 00 00 00 00 00 00 00 00
00 00 00 00 00 00 00 00 00 1a 00 00 00 00 00 00
00 00 00 00 00 00 00 00 00 00 00 1a 00 00 00 fe
00 4c 4d 31 34 30 4c 46 2d 31 46 30 31 0a 00 99

00 ff ff ff ff ff ff 00 38 70 50 00 00 00 00 00
01 1d 01 04 a5 1f 11 78 03 a1 05 a1 56 4f a0 27
0f 50 54 00 00 00 01 01 01 01 01 01 01 01 01 01
01 01 01 01 01 01 81 41 80 04 71 38 ca 40 30 20
35 00 35 ae 10 00 00 1a 00 00 00 00 00 00 00 00
00 00 00 00 00 00 00 00 00 1a 00 00 00 00 00 00
00 00 00 00 00 00 00 00 00 00 00 1a 00 00 00 fe
00 4c 4d 31 34 30 4c 46 2d 31 46 30 31 0a 00 99

----------------

Block 0, Base EDID:
  EDID Structure Version & Revision: 1.4
  Vendor & Product Identification:
    Manufacturer: NCP
    Model: 80
    Made in: week 1 of 2019
  Basic Display Parameters & Features:
    Digital display
    Bits per primary color channel: 8
    DisplayPort interface
    Maximum image size: 31 cm x 17 cm
    Gamma: 2.20
    Supported color formats: RGB 4:4:4
    First detailed timing includes the native pixel format and preferred refresh rate
    Display is continuous frequency
  Color Characteristics:
    Red  : 0.6308, 0.3378
    Green: 0.3085, 0.6259
    Blue : 0.1523, 0.0585
    White: 0.3134, 0.3291
  Established Timings I & II: none
  Standard Timings: none
  Detailed Timing Descriptors:
    DTD 1:  1920x1080   60.001574 Hz  16:9     76.922 kHz    167.690000 MHz (309 mm x 174 mm)
                 Hfront   48 Hsync  32 Hback  180 Hpol P
                 Vfront    3 Vsync   5 Vback  194 Vpol N
    Manufacturer-Specified Display Descriptor (0x00): 00 00 00 00 00 00 00 00 00 00 00 00 00 00 00 1a '................'
    Manufacturer-Specified Display Descriptor (0x00): 00 00 00 00 00 00 00 00 00 00 00 00 00 00 00 1a '................'
    Alphanumeric Data String: 'LM140LF-1F01'
Checksum: 0x99

----------------

Block 1, Unknown EDID Extension Block 0x00:
  00 ff ff ff ff ff ff 00 38 70 50 00 00 00 00 00 '........8pP.....'
  01 1d 01 04 a5 1f 11 78 03 a1 05 a1 56 4f a0 27 '.......x....VO.''
  0f 50 54 00 00 00 01 01 01 01 01 01 01 01 01 01 '.PT.............'
  01 01 01 01 01 01 81 41 80 04 71 38 ca 40 30 20 '.......A..q8.@0 '
  35 00 35 ae 10 00 00 1a 00 00 00 00 00 00 00 00 '5.5.............'
  00 00 00 00 00 00 00 00 00 1a 00 00 00 00 00 00 '................'
  00 00 00 00 00 00 00 00 00 00 00 1a 00 00 00 fe '................'
  00 4c 4d 31 34 30 4c 46 2d 31 46 30 31 0a 00 99 '.LM140LF-1F01...'
Checksum: 0x99

----------------

Warnings:

Block 0, Base EDID:
  Missing Display Product Name.

Failures:

Block 0, Base EDID:
  Missing Display Range Limits Descriptor.
Block 1, Base EDID:
  Unknown Extension Block.
EDID:
  Base EDID: EDID specified 0 extension block(s), but found 1 extension block(s).

EDID conformity: FAIL
