edid-decode (hex):

00 ff ff ff ff ff ff 00 4c 2d 86 02 37 31 41 48
30 12 01 03 0e 25 15 78 2a ae a5 a6 54 4c 99 26
14 50 54 bf ee 00 01 01 01 01 01 01 01 01 01 01
01 01 01 01 01 01 1a 1d 00 80 51 d0 1c 20 40 80
35 00 74 d1 10 00 00 1c 00 00 00 fd 00 38 4b 1e
3d 08 00 0a 20 20 20 20 20 20 00 00 00 fc 00 53
79 6e 63 4d 61 73 74 65 72 0a 20 20 00 00 00 ff
00 48 56 4c 51 42 30 30 38 33 30 0a 20 20 00 e0

----------------

Block 0, Base EDID:
  EDID Structure Version & Revision: 1.3
  Vendor & Product Identification:
    Manufacturer: SAM
    Model: 646
    Serial Number: ...
    Made in: week 48 of 2008
  Basic Display Parameters & Features:
    Analog display
    Input voltage level: 0.7/0.3 V
    Blank level equals black level
    Sync: Separate Composite SyncOnGreen
    Maximum image size: 37 cm x 21 cm
    Gamma: 2.20
    DPMS levels: Off
    RGB color display
    First detailed timing is the preferred timing
  Color Characteristics:
    Red  : 0.6503, 0.3300
    Green: 0.2998, 0.5996
    Blue : 0.1503, 0.0800
    White: 0.3134, 0.3291
  Established Timings I & II:
    IBM     :   720x400    70.081663 Hz   9:5     31.467 kHz     28.320000 MHz
    DMT 0x04:   640x480    59.940476 Hz   4:3     31.469 kHz     25.175000 MHz
    Apple   :   640x480    66.666667 Hz   4:3     35.000 kHz     30.240000 MHz
    DMT 0x05:   640x480    72.808802 Hz   4:3     37.861 kHz     31.500000 MHz
    DMT 0x06:   640x480    75.000000 Hz   4:3     37.500 kHz     31.500000 MHz
    DMT 0x08:   800x600    56.250000 Hz   4:3     35.156 kHz     36.000000 MHz
    DMT 0x09:   800x600    60.316541 Hz   4:3     37.879 kHz     40.000000 MHz
    DMT 0x0a:   800x600    72.187572 Hz   4:3     48.077 kHz     50.000000 MHz
    DMT 0x0b:   800x600    75.000000 Hz   4:3     46.875 kHz     49.500000 MHz
    Apple   :   832x624    74.551266 Hz   4:3     49.726 kHz     57.284000 MHz
    DMT 0x10:  1024x768    60.003840 Hz   4:3     48.363 kHz     65.000000 MHz
    DMT 0x11:  1024x768    70.069359 Hz   4:3     56.476 kHz     75.000000 MHz
    DMT 0x12:  1024x768    75.028582 Hz   4:3     60.023 kHz     78.750000 MHz
  Standard Timings: none
  Detailed Timing Descriptors:
    DTD 1:  1280x720    59.855126 Hz  16:9     44.772 kHz     74.500000 MHz (372 mm x 209 mm)
                 Hfront   64 Hsync 128 Hback  192 Hpol N
                 Vfront    3 Vsync   5 Vback   20 Vpol P
    Display Range Limits:
      Monitor ranges (GTF): 56-75 Hz V, 30-61 kHz H, max dotclock 80 MHz
    Display Product Name: 'SyncMaster'
    Display Product Serial Number: ...
Checksum: 0xe0

----------------

EDID conformity: PASS
