
EDID (hex):
00ffffffffffff0006af95e400000000
231f0104b5221678037e85ad5142b126
0e505400000001010101010101010101
01010101010104d800a0a0405e603020
aa0058d7100000180c6c00a0a0405e60
3020aa0058d710000018000000fd0030
78cccc37010a202020202020000000fe
004231363051414e30322e4c200a01de
02031d00e3058000e60607016b6b476d
1a00000203307800046b476b47000000
00000000000000000000000000000000
00000000000000000000000000000000
00000000000000000000000000000000
00000000000000000000000000000000
00000000000000000000000000000000
000000000000000000000000000000c9

Extracted contents:
header:          00 ff ff ff ff ff ff 00
serial number:   06 af 95 e4 00 00 00 00 23 1f
version:         01 04
basic params:    b5 22 16 78 03
chroma info:     7e 85 ad 51 42 b1 26 0e 50 54
established:     00 00 00
standard:        01 01 01 01 01 01 01 01 01 01 01 01 01 01 01 01
descriptor 1:    04 d8 00 a0 a0 40 5e 60 30 20 aa 00 58 d7 10 00 00 18
descriptor 2:    0c 6c 00 a0 a0 40 5e 60 30 20 aa 00 58 d7 10 00 00 18
descriptor 3:    00 00 00 fd 00 30 78 cc cc 37 01 0a 20 20 20 20 20 20
descriptor 4:    00 00 00 fe 00 42 31 36 30 51 41 4e 30 32 2e 4c 20 0a
extensions:      01
checksum:        de

EDID version: 1.4
Manufacturer: AUO Model e495 Serial Number --
Made in week 35 of 2021
Digital display
10 bits per primary color channel
DisplayPort interface
Maximum image size: 34 cm x 22 cm
Gamma: 2.20
Supported color formats: RGB 4:4:4
First detailed timing includes the native pixel format and preferred refresh rate
Display is continuous frequency
Display x,y Chromaticity:
  Red:   0.6767, 0.3193
  Green: 0.2607, 0.6933
  Blue:  0.1503, 0.0546
  White: 0.3134, 0.3291
Established timings supported:
Standard timings supported:
Detailed mode: Clock 553.000 MHz, 344 mm x 215 mm
               2560 2608 2640 2720 hborder 0
               1600 1610 1620 1694 vborder 0
               -hsync -vsync 
               VertFreq: 120 Hz, HorFreq: 203308 Hz
Detailed mode: Clock 276.600 MHz, 344 mm x 215 mm
               2560 2608 2640 2720 hborder 0
               1600 1610 1620 1694 vborder 0
               -hsync -vsync 
               VertFreq: 60 Hz, HorFreq: 101691 Hz
Monitor ranges (bare limits): 48-120Hz V, 204-204kHz H, max dotclock 550MHz
ASCII string: B160QAN02.L 
Has 1 extension blocks
Checksum: 0xde (valid)

CTA extension block
Extension version: 3
25 bytes of CTA data
  Extended tag: Colorimetry data block
    BT2020RGB
  Extended tag: HDR static metadata data block
    Electro optical transfer functions:
      Traditional gamma - SDR luminance range
      Traditional gamma - HDR luminance range
      SMPTE ST2084
    Supported static metadata descriptors:
      Static metadata type 1
    Desired content max luminance: 107 (507.620 cd/m^2)
    Desired content max frame-average luminance: 107 (507.620 cd/m^2)
    Desired content min luminance: 71 (0.394 cd/m^2)
  Vendor-specific data block, OUI 00001a
0 native detailed modes
Checksum: 0xc9 (valid)

EDID block does NOT conform to EDID 1.4!
	Required 640x480p60 timings are missing in the established timings
	and/or in the SVD list (VIC 1)
	Missing name descriptor
Warning: One or more of the timings is out of range of the Monitor Ranges:
  Vertical Freq: 60 - 120 Hz
  Horizontal Freq: 101691 - 203308 Hz
  Maximum Clock: 553.000 MHz
