edid-decode (hex):

00 ff ff ff ff ff ff 00 15 c3 06 19 01 01 01 01
10 11 01 03 80 34 21 78 12 ef 95 a3 54 4c 9b 26
0f 50 54 20 00 00 01 01 01 01 01 01 01 01 01 01
01 01 01 01 01 01 01 1d 80 d0 72 1c 16 20 10 2c
25 80 07 44 21 00 00 9e 8c 0a d0 90 20 40 31 20
0c 40 55 00 07 44 21 00 00 18 00 00 00 fd 00 31
33 0f 39 0f 00 0a 20 20 20 20 20 20 00 00 00 fc
00 48 44 32 34 34 31 57 0a 20 20 20 20 20 01 5c

02 03 1b 76 47 94 12 1f 13 11 16 15 23 09 7f 07
83 01 00 00 66 03 0c 00 10 00 80 01 1d 00 bc 52
d0 1e 20 b8 28 55 40 00 00 00 00 00 1e 8c 0a d0
90 20 40 31 20 0c 40 55 00 00 00 00 00 00 18 8c
0a a0 20 51 20 18 10 18 7e 23 00 00 00 00 00 00
98 8c 0a a0 20 51 20 18 10 18 7e 23 00 00 00 00
00 00 98 00 00 00 00 00 00 00 00 00 00 00 00 00
00 00 00 00 00 00 00 00 00 00 00 00 00 00 00 27

----------------

Block 0, Base EDID:
  EDID Structure Version & Revision: 1.3
  Vendor & Product Identification:
    Manufacturer: ENC
    Model: 6406
    Serial Number: ...
    Made in: week 16 of 2007
  Basic Display Parameters & Features:
    Digital display
    Maximum image size: 52 cm x 33 cm
    Gamma: 2.20
    Non-RGB color display
    First detailed timing is the preferred timing
  Color Characteristics:
    Red  : 0.6396, 0.3300
    Green: 0.2998, 0.6083
    Blue : 0.1503, 0.0595
    White: 0.3134, 0.3291
  Established Timings I & II:
    DMT 0x04:   640x480    59.940476 Hz   4:3     31.469 kHz     25.175000 MHz
  Standard Timings: none
  Detailed Timing Descriptors:
    DTD 1:  1920x1080i  50.000000 Hz  16:9     28.125 kHz     74.250000 MHz (519 mm x 324 mm)
                 Hfront  528 Hsync  44 Hback  148 Hpol P
                 Vfront    2 Vsync   5 Vback   15 Vpol P Vfront +0.5 Odd Field
                 Vfront    2 Vsync   5 Vback   15 Vpol P Vback  +0.5 Even Field
    DTD 2:   720x576    50.000000 Hz   5:4     31.250 kHz     27.000000 MHz (519 mm x 324 mm)
                 Hfront   12 Hsync  64 Hback   68 Hpol N
                 Vfront    5 Vsync   5 Vback   39 Vpol N
    Display Range Limits:
      Monitor ranges (GTF): 49-51 Hz V, 15-57 kHz H, max dotclock 150 MHz
    Display Product Name: 'HD2441W'
  Extension blocks: 1
Checksum: 0x5c

----------------

Block 1, CTA-861 Extension Block:
  Revision: 3
  Basic audio support
  Supports YCbCr 4:4:4
  Supports YCbCr 4:2:2
  Native detailed modes: 6
  Video Data Block:
    VIC  20:  1920x1080i  50.000000 Hz  16:9     28.125 kHz     74.250000 MHz (native)
    VIC  18:   720x576    50.000000 Hz  16:9     31.250 kHz     27.000000 MHz
    VIC  31:  1920x1080   50.000000 Hz  16:9     56.250 kHz    148.500000 MHz
    VIC  19:  1280x720    50.000000 Hz  16:9     37.500 kHz     74.250000 MHz
    VIC  17:   720x576    50.000000 Hz   4:3     31.250 kHz     27.000000 MHz
    VIC  22:  1440x576i   50.000000 Hz  16:9     15.625 kHz     27.000000 MHz
    VIC  21:  1440x576i   50.000000 Hz   4:3     15.625 kHz     27.000000 MHz
  Audio Data Block:
    Linear PCM:
      Max channels: 2
      Supported sample rates (kHz): 192 176.4 96 88.2 48 44.1 32
      Supported sample sizes (bits): 24 20 16
  Speaker Allocation Data Block:
    FL/FR - Front Left/Right
  Vendor-Specific Data Block (HDMI), OUI 00-0C-03:
    Source physical address: 1.0.0.0
    Supports_AI
  Detailed Timing Descriptors:
    DTD 3:  1280x720    50.000000 Hz  16:9     37.500 kHz     74.250000 MHz
                 Hfront  440 Hsync  40 Hback  220 Hpol P
                 Vfront    5 Vsync   5 Vback   20 Vpol P
    DTD 4:   720x576    50.000000 Hz   5:4     31.250 kHz     27.000000 MHz
                 Hfront   12 Hsync  64 Hback   68 Hpol N
                 Vfront    5 Vsync   5 Vback   39 Vpol N
    DTD 5:  1440x576i   50.000000 Hz   5:2     15.625 kHz     27.000000 MHz
                 Hfront   24 Hsync 126 Hback  138 Hpol N
                 Vfront    2 Vsync   3 Vback   19 Vpol N Vfront +0.5 Odd Field
                 Vfront    2 Vsync   3 Vback   19 Vpol N Vback  +0.5 Even Field
    DTD 6:  1440x576i   50.000000 Hz   5:2     15.625 kHz     27.000000 MHz
                 Hfront   24 Hsync 126 Hback  138 Hpol N
                 Vfront    2 Vsync   3 Vback   19 Vpol N Vfront +0.5 Odd Field
                 Vfront    2 Vsync   3 Vback   19 Vpol N Vback  +0.5 Even Field
Checksum: 0x27

----------------

Warnings:

Block 1, CTA-861 Extension Block:
  IT Video Formats are overscanned by default, but normally this should be underscanned.

Failures:

Block 1, CTA-861 Extension Block:
  Detailed Timing Descriptor #3: Mismatch of image size vs display size: image size is not set, but display size is.
  Detailed Timing Descriptor #4: Mismatch of image size vs display size: image size is not set, but display size is.
  Detailed Timing Descriptor #5: Mismatch of image size vs display size: image size is not set, but display size is.
  Detailed Timing Descriptor #6: Mismatch of image size vs display size: image size is not set, but display size is.
  Missing VCDB, needed for Set Selectable RGB Quantization to avoid interop issues.
EDID:
  Base EDID: Some timings are out of range of the Monitor Ranges:
    Vertical Freq: 50.000 - 59.940 Hz (Monitor: 49.000 - 51.000 Hz)
  CTA-861: Native progressive timings are a mix of several resolutions.
  CTA-861: Native interlaced timings are a mix of several resolutions.

EDID conformity: FAIL
