
EDID (hex):
00ffffffffffff00593a700000000000
18150103803a207832d53da0564b9e27
0e474a25ce0001010101010101010101
010101010101023a801871382d40582c
450040442100001e000000fd00384c0f
520f000a202020202020000000fc0045
3236304d560a20202020202000000010
0020202020202020202020202020016c
02031c71489005040302070601231107
508301000066030c00100000023a8018
71382d40582c250040442100001e011d
007251d01e206e28550040442100001e
8c0ad08a20e02d10103e960040442100
0018011d8018711c1620582c25004044
2100009e000000000000000000000000
000000000000000000000000000000c0

Extracted contents:
header:          00 ff ff ff ff ff ff 00
serial number:   59 3a 70 00 00 00 00 00 18 15
version:         01 03
basic params:    80 3a 20 78 32
chroma info:     d5 3d a0 56 4b 9e 27 0e 47 4a
established:     25 ce 00
standard:        01 01 01 01 01 01 01 01 01 01 01 01 01 01 01 01
descriptor 1:    02 3a 80 18 71 38 2d 40 58 2c 45 00 40 44 21 00 00 1e
descriptor 2:    00 00 00 fd 00 38 4c 0f 52 0f 00 0a 20 20 20 20 20 20
descriptor 3:    00 00 00 fc 00 45 32 36 30 4d 56 0a 20 20 20 20 20 20
descriptor 4:    00 00 00 10 00 20 20 20 20 20 20 20 20 20 20 20 20 20
extensions:      01
checksum:        6c

EDID version: 1.3
Manufacturer: VIZ Model 70 Serial Number --
Made in week 24 of 2011
Digital display
Maximum image size: 58 cm x 32 cm
Gamma: 2.20
DPMS levels: Off
Non-RGB color display
First detailed timing is preferred timing
Display x,y Chromaticity:
  Red:   0.6279, 0.3369
  Green: 0.2939, 0.6181
  Blue:  0.1523, 0.0576
  White: 0.2802, 0.2900
Established timings supported:
  640x480@60Hz 4:3 HorFreq: 31469 Hz Clock: 25.175 MHz
  640x480@75Hz 4:3 HorFreq: 37500 Hz Clock: 31.500 MHz
  800x600@60Hz 4:3 HorFreq: 37900 Hz Clock: 40.000 MHz
  800x600@72Hz 4:3 HorFreq: 48100 Hz Clock: 50.000 MHz
  800x600@75Hz 4:3 HorFreq: 46900 Hz Clock: 49.500 MHz
  1024x768@60Hz 4:3 HorFreq: 48400 Hz Clock: 65.000 MHz
  1024x768@70Hz 4:3 HorFreq: 56500 Hz Clock: 75.000 MHz
  1024x768@75Hz 4:3 HorFreq: 60000 Hz Clock: 78.750 MHz
Standard timings supported:
Detailed mode: Clock 148.500 MHz, 576 mm x 324 mm
               1920 2008 2052 2200 hborder 0
               1080 1084 1089 1125 vborder 0
               +hsync +vsync 
               VertFreq: 60 Hz, HorFreq: 67500 Hz
Monitor ranges (GTF): 56-76Hz V, 15-82kHz H, max dotclock 150MHz
Monitor name: E260MV
Dummy block
Has 1 extension blocks
Checksum: 0x6c (valid)

CTA extension block
Extension version: 3
24 bytes of CTA data
  Video data block
    VIC  16 1920x1080@60Hz 16:9 (native) HorFreq: 67500 Hz Clock: 148.500 MHz
    VIC   5 1920x1080i@60Hz 16:9  HorFreq: 33750 Hz Clock: 74.250 MHz
    VIC   4 1280x720@60Hz 16:9  HorFreq: 45000 Hz Clock: 74.250 MHz
    VIC   3 720x480@60Hz 16:9  HorFreq: 31469 Hz Clock: 27.000 MHz
    VIC   2 720x480@60Hz 4:3  HorFreq: 31469 Hz Clock: 27.000 MHz
    VIC   7 1440x480i@60Hz 16:9  HorFreq: 15734 Hz Clock: 27.000 MHz
    VIC   6 1440x480i@60Hz 4:3  HorFreq: 15734 Hz Clock: 27.000 MHz
    VIC   1 640x480@60Hz 4:3  HorFreq: 31469 Hz Clock: 25.175 MHz
  Audio data block
    AC-3, max channels 2
      Supported sample rates (kHz): 48 44.1 32
      Maximum bit rate: 640 kHz
  Speaker allocation data block
    Speaker map:
      FL/FR - Front Left/Right
  Vendor-specific data block, OUI 000c03 (HDMI)
    Source physical address 1.0.0.0
Basic audio support
Supports YCbCr 4:4:4
Supports YCbCr 4:2:2
1 native detailed modes
Detailed mode: Clock 148.500 MHz, 576 mm x 324 mm
               1920 2008 2052 2200 hborder 0
               1080 1082 1087 1125 vborder 0
               +hsync +vsync 
               VertFreq: 60 Hz, HorFreq: 67500 Hz
Detailed mode: Clock 74.250 MHz, 576 mm x 324 mm
               1280 1390 1430 1650 hborder 0
                720  725  730  750 vborder 0
               +hsync +vsync 
               VertFreq: 60 Hz, HorFreq: 45000 Hz
Detailed mode: Clock 27.000 MHz, 576 mm x 324 mm
                720  736  798  858 hborder 0
                480  489  495  525 vborder 0
               -hsync -vsync 
               VertFreq: 59 Hz, HorFreq: 31468 Hz
Detailed mode: Clock 74.250 MHz, 576 mm x 324 mm
               1920 2008 2052 2200 hborder 0
                540  542  547  562 vborder 0
               +hsync +vsync interlaced 
               VertFreq: 60 Hz, HorFreq: 33750 Hz
Checksum: 0xc0 (valid)

EDID block does not conform at all!
	Dummy block filled with garbage


