
EDID (hex):
00ffffffffffff0004721a00fbef7004
2f140104a5291a78e2d7a5a2594a9624
145054bfef909500950f81808140714f
0101010101019a29a0d0518422305098
36009a001100001c000000ff004c4250
3043313638343047330a000000fd0032
4b1e520e000a202020202020000000fc
0056313933570a202020202020200054

Extracted contents:
header:          00 ff ff ff ff ff ff 00
serial number:   04 72 1a 00 fb ef 70 04 2f 14
version:         01 04
basic params:    a5 29 1a 78 e2
chroma info:     d7 a5 a2 59 4a 96 24 14 50 54
established:     bf ef 90
standard:        95 00 95 0f 81 80 81 40 71 4f 01 01 01 01 01 01
descriptor 1:    9a 29 a0 d0 51 84 22 30 50 98 36 00 9a 00 11 00 00 1c
descriptor 2:    00 00 00 ff 00 4c 42 50 30 43 31 36 38 34 30 47 33 0a
descriptor 3:    00 00 00 fd 00 32 4b 1e 52 0e 00 0a 20 20 20 20 20 20
descriptor 4:    00 00 00 fc 00 56 31 39 33 57 0a 20 20 20 20 20 20 20
extensions:      00
checksum:        54

EDID version: 1.4
Manufacturer: ACR Model 1a Serial Number --
Made in week 47 of 2010
Digital display
8 bits per primary color channel
DisplayPort interface
Maximum image size: 41 cm x 26 cm
Gamma: 2.20
DPMS levels: Standby Suspend Off
Supported color formats: RGB 4:4:4
First detailed timing includes the native pixel format and preferred refresh rate
Display x,y Chromaticity:
  Red:   0.6357, 0.3486
  Green: 0.2900, 0.5888
  Blue:  0.1425, 0.0800
  White: 0.3134, 0.3291
Established timings supported:
  720x400@70Hz 9:5 HorFreq: 31469 Hz Clock: 28.320 MHz
  640x480@60Hz 4:3 HorFreq: 31469 Hz Clock: 25.175 MHz
  640x480@67Hz 4:3 HorFreq: 35000 Hz Clock: 30.240 MHz
  640x480@72Hz 4:3 HorFreq: 37900 Hz Clock: 31.500 MHz
  640x480@75Hz 4:3 HorFreq: 37500 Hz Clock: 31.500 MHz
  800x600@56Hz 4:3 HorFreq: 35200 Hz Clock: 36.000 MHz
  800x600@60Hz 4:3 HorFreq: 37900 Hz Clock: 40.000 MHz
  800x600@72Hz 4:3 HorFreq: 48100 Hz Clock: 50.000 MHz
  800x600@75Hz 4:3 HorFreq: 46900 Hz Clock: 49.500 MHz
  832x624@75Hz 4:3 HorFreq: 49726 Hz Clock: 57.284 MHz
  1024x768@60Hz 4:3 HorFreq: 48400 Hz Clock: 65.000 MHz
  1024x768@70Hz 4:3 HorFreq: 56500 Hz Clock: 75.000 MHz
  1024x768@75Hz 4:3 HorFreq: 60000 Hz Clock: 78.750 MHz
  1280x1024@75Hz 5:4 HorFreq: 80000 Hz Clock: 135.000 MHz
  1152x870@75Hz 192:145 HorFreq: 67500 Hz Clock: 108.000 MHz
Standard timings supported:
  1440x900@60Hz 16:10 HorFreq: 55500 Hz Clock: 88.750 MHz
  1440x900@75Hz 16:10 HorFreq: 82300 Hz Clock: 156.000 MHz
  1280x1024@60Hz 5:4 HorFreq: 64000 Hz Clock: 108.000 MHz
  1280x960@60Hz 4:3 HorFreq: 60000 Hz Clock: 108.000 MHz
  1152x864@75Hz 4:3 HorFreq: 67500 Hz Clock: 108.000 MHz
Detailed mode: Clock 106.500 MHz, 410 mm x 256 mm
               1440 1520 1672 1904 hborder 0
                900  903  909  934 vborder 0
               -hsync +vsync 
               VertFreq: 59 Hz, HorFreq: 55934 Hz
Serial number: --
Monitor ranges (GTF): 50-75Hz V, 30-82kHz H, max dotclock 140MHz
Monitor name: V193W
Checksum: 0x54 (valid)
Warning: One or more of the timings is out of range of the Monitor Ranges:
  Vertical Freq: 56 - 75 Hz
  Horizontal Freq: 31469 - 82300 Hz
  Maximum Clock: 156.000 MHz


