
EDID (hex):
00ffffffffffff003669c53c01010101
231f0104b5451d78eb8525a6574ea326
0c50543fcf00d1c00101010101018180
9500b3000101584d00b8a1381440f82c
4500b2232100001e000000fd0030c8e8
e83c010a202020202020000000fc004d
5349204d414733303152460a000000ff
0043433541303231383030323436019d
020345714f020311121304292f101f40
3f5a5b5c230917078301000067030c00
1000383c67d85dc4017880036d1a0000
020130c8000000000000e305e301e606
0701575731e8ed00a0a038db413020f8
0cb2232100001afac600a0a038374030
209808b2232100001a2cea00a0a03816
4030206800b2232100001a0000000033

Extracted contents:
header:          00 ff ff ff ff ff ff 00
serial number:   36 69 c5 3c 01 01 01 01 23 1f
version:         01 04
basic params:    b5 45 1d 78 eb
chroma info:     85 25 a6 57 4e a3 26 0c 50 54
established:     3f cf 00
standard:        d1 c0 01 01 01 01 01 01 81 80 95 00 b3 00 01 01
descriptor 1:    58 4d 00 b8 a1 38 14 40 f8 2c 45 00 b2 23 21 00 00 1e
descriptor 2:    00 00 00 fd 00 30 c8 e8 e8 3c 01 0a 20 20 20 20 20 20
descriptor 3:    00 00 00 fc 00 4d 53 49 20 4d 41 47 33 30 31 52 46 0a
descriptor 4:    00 00 00 ff 00 43 43 35 41 30 32 31 38 30 30 32 34 36
extensions:      01
checksum:        9d

EDID version: 1.4
Manufacturer: MSI Model 3cc5 Serial Number --
Made in week 35 of 2021
Digital display
10 bits per primary color channel
DisplayPort interface
Maximum image size: 69 cm x 29 cm
Gamma: 2.20
DPMS levels: Standby Suspend Off
Supported color formats: RGB 4:4:4, YCrCb 4:4:4
First detailed timing includes the native pixel format and preferred refresh rate
Display is continuous frequency
Display x,y Chromaticity:
  Red:   0.6503, 0.3398
  Green: 0.3056, 0.6376
  Blue:  0.1484, 0.0488
  White: 0.3134, 0.3291
Established timings supported:
  640x480@60Hz 4:3 HorFreq: 31469 Hz Clock: 25.175 MHz
  640x480@67Hz 4:3 HorFreq: 35000 Hz Clock: 30.240 MHz
  640x480@72Hz 4:3 HorFreq: 37900 Hz Clock: 31.500 MHz
  640x480@75Hz 4:3 HorFreq: 37500 Hz Clock: 31.500 MHz
  800x600@56Hz 4:3 HorFreq: 35200 Hz Clock: 36.000 MHz
  800x600@60Hz 4:3 HorFreq: 37900 Hz Clock: 40.000 MHz
  800x600@72Hz 4:3 HorFreq: 48100 Hz Clock: 50.000 MHz
  800x600@75Hz 4:3 HorFreq: 46900 Hz Clock: 49.500 MHz
  1024x768@60Hz 4:3 HorFreq: 48400 Hz Clock: 65.000 MHz
  1024x768@70Hz 4:3 HorFreq: 56500 Hz Clock: 75.000 MHz
  1024x768@75Hz 4:3 HorFreq: 60000 Hz Clock: 78.750 MHz
  1280x1024@75Hz 5:4 HorFreq: 80000 Hz Clock: 135.000 MHz
Standard timings supported:
  1920x1080@60Hz 16:9
  1280x1024@60Hz 5:4 HorFreq: 64000 Hz Clock: 108.000 MHz
  1440x900@60Hz 16:10 HorFreq: 55500 Hz Clock: 88.750 MHz
  1680x1050@60Hz 16:10 HorFreq: 64700 Hz Clock: 119.000 MHz
Detailed mode: Clock 198.000 MHz, 690 mm x 291 mm
               2560 2808 2852 3000 hborder 0
               1080 1084 1089 1100 vborder 0
               +hsync +vsync 
               VertFreq: 60 Hz, HorFreq: 66000 Hz
Monitor ranges (bare limits): 48-200Hz V, 232-232kHz H, max dotclock 600MHz
Monitor name: MSI MAG301RF
Serial number: --
Has 1 extension blocks
Checksum: 0x9d (valid)

CTA extension block
Extension version: 3
65 bytes of CTA data
  Video data block
    VIC   2 720x480@60Hz 4:3  HorFreq: 31469 Hz Clock: 27.000 MHz
    VIC   3 720x480@60Hz 16:9  HorFreq: 31469 Hz Clock: 27.000 MHz
    VIC  17 720x576@50Hz 4:3  HorFreq: 31250 Hz Clock: 27.000 MHz
    VIC  18 720x576@50Hz 16:9  HorFreq: 31250 Hz Clock: 27.000 MHz
    VIC  19 1280x720@50Hz 16:9  HorFreq: 37500 Hz Clock: 74.250 MHz
    VIC   4 1280x720@60Hz 16:9  HorFreq: 45000 Hz Clock: 74.250 MHz
    VIC  41 1280x720@100Hz 16:9  HorFreq: 75000 Hz Clock: 148.500 MHz
    VIC  47 1280x720@120Hz 16:9  HorFreq: 90000 Hz Clock: 148.500 MHz
    VIC  16 1920x1080@60Hz 16:9  HorFreq: 67500 Hz Clock: 148.500 MHz
    VIC  31 1920x1080@50Hz 16:9  HorFreq: 56250 Hz Clock: 148.500 MHz
    VIC  64 1920x1080@100Hz 16:9  HorFreq: 112500 Hz Clock: 297.000 MHz
    VIC  63 1920x1080@120Hz 16:9  HorFreq: 135000 Hz Clock: 297.000 MHz
    VIC  90 2560x1080@60Hz 64:27  HorFreq: 66000 Hz Clock: 198.000 MHz
    VIC  91 2560x1080@100Hz 64:27  HorFreq: 125000 Hz Clock: 371.250 MHz
    VIC  92 2560x1080@120Hz 64:27  HorFreq: 150000 Hz Clock: 495.000 MHz
  Audio data block
    Linear PCM, max channels 2
      Supported sample rates (kHz): 96 48 44.1 32
      Supported sample sizes (bits): 24 20 16
  Speaker allocation data block
    Speaker map:
      FL/FR - Front Left/Right
  Vendor-specific data block, OUI 000c03 (HDMI)
    Source physical address 1.0.0.0
    DC_36bit
    DC_30bit
    DC_Y444
    Maximum TMDS clock: 300MHz
  Vendor-specific data block, OUI c45dd8 (HDMI Forum)
    Version: 1
    Maximum TMDS Character Rate: 600MHz
    SCDC Present
    Supports 12-bits/component Deep Color 4:2:0 Pixel Encoding
    Supports 10-bits/component Deep Color 4:2:0 Pixel Encoding
  Vendor-specific data block, OUI 00001a
  Extended tag: Colorimetry data block
    xvYCC601
    xvYCC709
    BT2020cYCC
    BT2020YCC
    BT2020RGB
  Extended tag: HDR static metadata data block
    Electro optical transfer functions:
      Traditional gamma - SDR luminance range
      Traditional gamma - HDR luminance range
      SMPTE ST2084
    Supported static metadata descriptors:
      Static metadata type 1
    Desired content max luminance: 87 (329.151 cd/m^2)
    Desired content max frame-average luminance: 87 (329.151 cd/m^2)
    Desired content min luminance: 49 (0.122 cd/m^2)
Basic audio support
Supports YCbCr 4:4:4
Supports YCbCr 4:2:2
1 native detailed modes
Detailed mode: Clock 609.040 MHz, 690 mm x 291 mm
               2560 2608 2640 2720 hborder 0
               1080 1143 1151 1555 vborder 0
               +hsync -vsync 
               VertFreq: 143 Hz, HorFreq: 223911 Hz
Detailed mode: Clock 509.380 MHz, 690 mm x 291 mm
               2560 2608 2640 2720 hborder 0
               1080 1121 1129 1135 vborder 0
               +hsync -vsync 
               VertFreq: 164 Hz, HorFreq: 187272 Hz
Detailed mode: Clock 599.480 MHz, 690 mm x 291 mm
               2560 2608 2640 2720 hborder 0
               1080 1086 1094 1102 vborder 0
               +hsync -vsync 
               VertFreq: 199 Hz, HorFreq: 220397 Hz
Checksum: 0x33 (valid)

Warning: One or more of the timings is out of range of the Monitor Ranges:
  Vertical Freq: 50 - 199 Hz
  Horizontal Freq: 31250 - 223911 Hz
  Maximum Clock: 609.040 MHz
EDID block does not conform at all!
	Both the serial number and the serial string are set
