
EDID (hex):
00ffffffffffff001e6d9a5b50be0200
041f0104b53c2278f919c1ae5044af26
0e5054210800d1c06140454031400101
0101010101014dd000a0f0703e803020
350058542100001a000000fd0c309050
5086010a202020202020000000fc0032
37474e3935300a2020202020000000ff
003130344e54504335393739320a02a6
02032d71230907078301000044100403
01e2006ae305c000e60605017360216d
1a0000020b3090000473216029000000
00000000000000000000000000000000
00000000000000000000000000000000
00000000000000000000000000000000
00000000000000000000000000000000
000000000000000000000000000000f4
7012790300030128d8060284ff0e9f00
2f801f006f08910002000400404f0104
ff0e9f002f801f006f08620002000400
00000000000000000000000000000000
00000000000000000000000000000000
00000000000000000000000000000000
00000000000000000000000000000000
00000000000000000000000000006d90

Extracted contents:
header:          00 ff ff ff ff ff ff 00
serial number:   1e 6d 9a 5b 50 be 02 00 04 1f
version:         01 04
basic params:    b5 3c 22 78 f9
chroma info:     19 c1 ae 50 44 af 26 0e 50 54
established:     21 08 00
standard:        d1 c0 61 40 45 40 31 40 01 01 01 01 01 01 01 01
descriptor 1:    4d d0 00 a0 f0 70 3e 80 30 20 35 00 58 54 21 00 00 1a
descriptor 2:    00 00 00 fd 0c 30 90 50 50 86 01 0a 20 20 20 20 20 20
descriptor 3:    00 00 00 fc 00 32 37 47 4e 39 35 30 0a 20 20 20 20 20
descriptor 4:    00 00 00 ff 00 31 30 34 4e 54 50 43 35 39 37 39 32 0a
extensions:      02
checksum:        a6

EDID version: 1.4
Manufacturer: GSM Model 5b9a Serial Number --
Made in week 4 of 2021
Digital display
10 bits per primary color channel
DisplayPort interface
Maximum image size: 60 cm x 34 cm
Gamma: 2.20
DPMS levels: Standby Suspend Off
Supported color formats: RGB 4:4:4, YCrCb 4:4:4, YCrCb 4:2:2
Display is continuous frequency
Display x,y Chromaticity:
  Red:   0.6796, 0.3134
  Green: 0.2675, 0.6845
  Blue:  0.1513, 0.0546
  White: 0.3125, 0.3291
Established timings supported:
  640x480@60Hz 4:3 HorFreq: 31469 Hz Clock: 25.175 MHz
  800x600@60Hz 4:3 HorFreq: 37900 Hz Clock: 40.000 MHz
  1024x768@60Hz 4:3 HorFreq: 48400 Hz Clock: 65.000 MHz
Standard timings supported:
  1920x1080@60Hz 16:9
  1024x768@60Hz 4:3 HorFreq: 48400 Hz Clock: 65.000 MHz
  800x600@60Hz 4:3 HorFreq: 37900 Hz Clock: 40.000 MHz
  640x480@60Hz 4:3 HorFreq: 31469 Hz Clock: 25.175 MHz
Detailed mode: Clock 533.250 MHz, 600 mm x 340 mm
               3840 3888 3920 4000 hborder 0
               2160 2163 2168 2222 vborder 0
               +hsync -vsync 
               VertFreq: 59 Hz, HorFreq: 133312 Hz
Monitor ranges (bare limits): 48-144Hz V, 80-335kHz H, max dotclock 1340MHz
Monitor name: 27GN950
Serial number: --
Has 2 extension blocks
Checksum: 0xa6 (valid)

CTA extension block
Extension version: 3
41 bytes of CTA data
  Audio data block
    Linear PCM, max channels 2
      Supported sample rates (kHz): 48 44.1 32
      Supported sample sizes (bits): 24 20 16
  Speaker allocation data block
    Speaker map:
      FL/FR - Front Left/Right
  Video data block
    VIC  16 1920x1080@60Hz 16:9  HorFreq: 67500 Hz Clock: 148.500 MHz
    VIC   4 1280x720@60Hz 16:9  HorFreq: 45000 Hz Clock: 74.250 MHz
    VIC   3 720x480@60Hz 16:9  HorFreq: 31469 Hz Clock: 27.000 MHz
    VIC   1 640x480@60Hz 4:3  HorFreq: 31469 Hz Clock: 25.175 MHz
  Extended tag: Video capability data block
    YCbCr quantization: No Data (0)
    RGB quantization: Selectable (via AVI Q) (1)
    PT scan behaviour: Always Underscanned (2)
    IT scan behaviour: Always Underscanned (2)
    CE scan behaviour: Always Underscanned (2)
  Extended tag: Colorimetry data block
    BT2020YCC
    BT2020RGB
  Extended tag: HDR static metadata data block
    Electro optical transfer functions:
      Traditional gamma - SDR luminance range
      SMPTE ST2084
    Supported static metadata descriptors:
      Static metadata type 1
    Desired content max luminance: 115 (603.666 cd/m^2)
    Desired content max frame-average luminance: 96 (400.000 cd/m^2)
    Desired content min luminance: 33 (0.101 cd/m^2)
  Vendor-specific data block, OUI 00001a
Basic audio support
Supports YCbCr 4:4:4
Supports YCbCr 4:2:2
1 native detailed modes
Checksum: 0xf4 (valid)


DisplayID extension block
Extension version: 18
Length 121, version 18, extension count 0
Checksum: 0x6d (valid)
Type 1 detailed timing: aspect: 16:9, Preferred  
Detailed mode: Clock 1328.240 MHz, 0 mm x 0 mm
               3839 3886 3917 3998
               2159 2161 2165 2304
               +hsync -vsync
Type 1 detailed timing: aspect: 16:9,  
Detailed mode: Clock 858.240 MHz, 0 mm x 0 mm
               3839 3886 3917 3998
               2159 2161 2165 2257
               +hsync -vsync

Warning: One or more of the timings is out of range of the Monitor Ranges:
  Vertical Freq: 59 - 60 Hz
  Horizontal Freq: 31469 - 133312 Hz
  Maximum Clock: 533.250 MHz
EDID block does not conform at all!
	Both the serial number and the serial string are set


