
EDID (hex):
00ffffffffffff0022f0422801010101
2f1301046e291a78ee37c5a4554c9b25
125054a56b8095008180814001010101
0101010101019a29a0d0518422305098
36009a001100001c000000fd00324c18
530e000a202020202020000000fc0048
50204c4531393031770a2020000000ff
0033435139343732364c340a20200016

Extracted contents:
header:          00 ff ff ff ff ff ff 00
serial number:   22 f0 42 28 01 01 01 01 2f 13
version:         01 04
basic params:    6e 29 1a 78 ee
chroma info:     37 c5 a4 55 4c 9b 25 12 50 54
established:     a5 6b 80
standard:        95 00 81 80 81 40 01 01 01 01 01 01 01 01 01 01
descriptor 1:    9a 29 a0 d0 51 84 22 30 50 98 36 00 9a 00 11 00 00 1c
descriptor 2:    00 00 00 fd 00 32 4c 18 53 0e 00 0a 20 20 20 20 20 20
descriptor 3:    00 00 00 fc 00 48 50 20 4c 45 31 39 30 31 77 0a 20 20
descriptor 4:    00 00 00 ff 00 33 43 51 39 34 37 32 36 4c 34 0a 20 20
extensions:      00
checksum:        16

EDID version: 1.4
Manufacturer: HWP Model 2842 Serial Number --
Made in week 47 of 2009
Analog display, Input voltage level: 0.7/0.7 V
Blank level equals black level
Sync: Separate Composite SyncOnGreen 
Maximum image size: 41 cm x 26 cm
Gamma: 2.20
DPMS levels: Standby Suspend Off
RGB color display
Default (sRGB) color space is primary color space
First detailed timing includes the native pixel format and preferred refresh rate
Display x,y Chromaticity:
  Red:   0.6406, 0.3349
  Green: 0.2978, 0.6083
  Blue:  0.1474, 0.0703
  White: 0.3134, 0.3291
Established timings supported:
  720x400@70Hz 9:5 HorFreq: 31469 Hz Clock: 28.320 MHz
  640x480@60Hz 4:3 HorFreq: 31469 Hz Clock: 25.175 MHz
  640x480@75Hz 4:3 HorFreq: 37500 Hz Clock: 31.500 MHz
  800x600@60Hz 4:3 HorFreq: 37900 Hz Clock: 40.000 MHz
  800x600@75Hz 4:3 HorFreq: 46900 Hz Clock: 49.500 MHz
  832x624@75Hz 4:3 HorFreq: 49726 Hz Clock: 57.284 MHz
  1024x768@60Hz 4:3 HorFreq: 48400 Hz Clock: 65.000 MHz
  1024x768@75Hz 4:3 HorFreq: 60000 Hz Clock: 78.750 MHz
  1280x1024@75Hz 5:4 HorFreq: 80000 Hz Clock: 135.000 MHz
  1152x870@75Hz 192:145 HorFreq: 67500 Hz Clock: 108.000 MHz
Standard timings supported:
  1440x900@60Hz 16:10 HorFreq: 55500 Hz Clock: 88.750 MHz
  1280x1024@60Hz 5:4 HorFreq: 64000 Hz Clock: 108.000 MHz
  1280x960@60Hz 4:3 HorFreq: 60000 Hz Clock: 108.000 MHz
Detailed mode: Clock 106.500 MHz, 410 mm x 256 mm
               1440 1520 1672 1904 hborder 0
                900  903  909  934 vborder 0
               -hsync +vsync 
               VertFreq: 59 Hz, HorFreq: 55934 Hz
Monitor ranges (GTF): 50-76Hz V, 24-83kHz H, max dotclock 140MHz
Monitor name: HP LE1901w
Serial number: --
Checksum: 0x16 (valid)
EDID block does NOT conform to EDID 1.4!
	sRGB is signaled, but the chromaticities do not match
