edid-decode (hex):

00 ff ff ff ff ff ff 00 22 f0 42 28 01 01 01 01
03 14 01 03 6e 29 1a 78 ee 37 c5 a4 55 4c 9b 25
12 50 54 a5 6b 80 95 00 81 80 81 40 01 01 01 01
01 01 01 01 01 01 9a 29 a0 d0 51 84 22 30 50 98
36 00 9a 00 11 00 00 1c 00 00 00 fd 00 32 4c 18
53 0e 00 0a 20 20 20 20 20 20 00 00 00 fc 00 48
50 20 4c 45 31 39 30 31 77 0a 20 20 00 00 00 ff
00 33 43 51 30 30 33 33 44 59 42 0a 20 20 00 29

00 ff ff ff ff ff ff 00 22 f0 42 28 01 01 01 01
03 14 01 03 6e 29 1a 78 ee 37 c5 a4 55 4c 9b 25
12 50 54 a5 6b 80 95 00 81 80 81 40 01 01 01 01
01 01 01 01 01 01 9a 29 a0 d0 51 84 22 30 50 98
36 00 9a 00 11 00 00 1c 00 00 00 fd 00 32 4c 18
53 0e 00 0a 20 20 20 20 20 20 00 00 00 fc 00 48
50 20 4c 45 31 39 30 31 77 0a 20 20 00 00 00 ff
00 33 43 51 30 30 33 33 44 59 42 0a 20 20 00 29

----------------

Block 0, Base EDID:
  EDID Structure Version & Revision: 1.3
  Vendor & Product Identification:
    Manufacturer: HWP
    Model: 10306
    Serial Number: ...
    Made in: week 3 of 2010
  Basic Display Parameters & Features:
    Analog display
    Signal Level Standard: 0.700 : 0.000 : 0.700 V p-p
    Blank level equals black level
    Sync: Separate Composite SyncOnGreen
    Maximum image size: 41 cm x 26 cm
    Gamma: 2.20
    DPMS levels: Standby Suspend Off
    RGB color display
    Default (sRGB) color space is primary color space
    First detailed timing is the preferred timing
  Color Characteristics:
    Red  : 0.6406, 0.3349
    Green: 0.2978, 0.6083
    Blue : 0.1474, 0.0703
    White: 0.3134, 0.3291
  Established Timings I & II:
    IBM     :   720x400    70.081663 Hz   9:5     31.467 kHz     28.320000 MHz
    DMT 0x04:   640x480    59.940476 Hz   4:3     31.469 kHz     25.175000 MHz
    DMT 0x06:   640x480    75.000000 Hz   4:3     37.500 kHz     31.500000 MHz
    DMT 0x09:   800x600    60.316541 Hz   4:3     37.879 kHz     40.000000 MHz
    DMT 0x0b:   800x600    75.000000 Hz   4:3     46.875 kHz     49.500000 MHz
    Apple   :   832x624    74.551266 Hz   4:3     49.726 kHz     57.284000 MHz
    DMT 0x10:  1024x768    60.003840 Hz   4:3     48.363 kHz     65.000000 MHz
    DMT 0x12:  1024x768    75.028582 Hz   4:3     60.023 kHz     78.750000 MHz
    DMT 0x24:  1280x1024   75.024675 Hz   5:4     79.976 kHz    135.000000 MHz
    Apple   :  1152x870    75.061550 Hz 192:145   68.681 kHz    100.000000 MHz
  Standard Timings:
    DMT 0x2f:  1440x900    59.887445 Hz  16:10    55.935 kHz    106.500000 MHz
    DMT 0x23:  1280x1024   60.019740 Hz   5:4     63.981 kHz    108.000000 MHz
    DMT 0x20:  1280x960    60.000000 Hz   4:3     60.000 kHz    108.000000 MHz
  Detailed Timing Descriptors:
    DTD 1:  1440x900    59.887445 Hz  16:10    55.935 kHz    106.500000 MHz (410 mm x 256 mm)
                 Hfront   80 Hsync 152 Hback  232 Hpol N
                 Vfront    3 Vsync   6 Vback   25 Vpol P
    Display Range Limits:
      Monitor ranges (GTF): 50-76 Hz V, 24-83 kHz H, max dotclock 140 MHz
    Display Product Name: 'HP LE1901w'
    Display Product Serial Number: ...
Checksum: 0x29

----------------

Block 1, Unknown EDID Extension Block 0x00:
  00 ff ff ff ff ff ff 00 22 f0 42 28 01 01 01 01 '........".B(....'
  03 14 01 03 6e 29 1a 78 ee 37 c5 a4 55 4c 9b 25 '....n).x.7..UL.%'
  12 50 54 a5 6b 80 95 00 81 80 81 40 01 01 01 01 '.PT.k......@....'
  01 01 01 01 01 01 9a 29 a0 d0 51 84 22 30 50 98 '.......)..Q."0P.'
  36 00 9a 00 11 00 00 1c 00 00 00 fd 00 32 4c 18 '6............2L.'
  53 0e 00 0a 20 20 20 20 20 20 00 00 00 fc 00 48 'S...      .....H'
  50 20 4c 45 31 39 30 31 77 0a 20 20 00 00 00 ff 'P LE1901w.  ....'
  00 33 43 51 30 30 33 33 44 59 42 0a 20 20 00 29 '.3CQ0033DYB.  .)'
Checksum: 0x29

----------------

Failures:

Block 0, Base EDID:
  Basic Display Parameters & Features: sRGB is signaled, but the chromaticities do not match.
Block 1, Base EDID:
  Unknown Extension Block.
EDID:
  Base EDID: EDID specified 0 extension block(s), but found 1 extension block(s).

EDID conformity: FAIL
