
EDID (hex):
00ffffffffffff00410c07086b1e0000
0d0d01030f221b6eeaeea69e544c9926
194f54bfef80714a714f814081800101
010101010101302a009851002a403070
1300510e1100001e000000ff00204844
20203030373738370a20000000fc0050
68696c697073203137304232000000fd
00384c1e520e000a2020202020200095

Extracted contents:
header:          00 ff ff ff ff ff ff 00
serial number:   41 0c 07 08 6b 1e 00 00 0d 0d
version:         01 03
basic params:    0f 22 1b 6e ea
chroma info:     ee a6 9e 54 4c 99 26 19 4f 54
established:     bf ef 80
standard:        71 4a 71 4f 81 40 81 80 01 01 01 01 01 01 01 01
descriptor 1:    30 2a 00 98 51 00 2a 40 30 70 13 00 51 0e 11 00 00 1e
descriptor 2:    00 00 00 ff 00 20 48 44 20 20 30 30 37 37 38 37 0a 20
descriptor 3:    00 00 00 fc 00 50 68 69 6c 69 70 73 20 31 37 30 42 32
descriptor 4:    00 00 00 fd 00 38 4c 1e 52 0e 00 0a 20 20 20 20 20 20
extensions:      00
checksum:        95

EDID version: 1.3
Manufacturer: PHL Model 807 Serial Number --
Analog display, Input voltage level: 0.7/0.3 V
Sync: Separate Composite SyncOnGreen Serration 
Maximum image size: 34 cm x 27 cm
Gamma: 2.10
DPMS levels: Standby Suspend Off
RGB color display
First detailed timing is preferred timing
Display x,y Chromaticity:
  Red:   0.6201, 0.3300
  Green: 0.2998, 0.5996
  Blue:  0.1503, 0.0996
  White: 0.3095, 0.3300
Established timings supported:
  720x400@70Hz 9:5 HorFreq: 31469 Hz Clock: 28.320 MHz
  640x480@60Hz 4:3 HorFreq: 31469 Hz Clock: 25.175 MHz
  640x480@67Hz 4:3 HorFreq: 35000 Hz Clock: 30.240 MHz
  640x480@72Hz 4:3 HorFreq: 37900 Hz Clock: 31.500 MHz
  640x480@75Hz 4:3 HorFreq: 37500 Hz Clock: 31.500 MHz
  800x600@56Hz 4:3 HorFreq: 35200 Hz Clock: 36.000 MHz
  800x600@60Hz 4:3 HorFreq: 37900 Hz Clock: 40.000 MHz
  800x600@72Hz 4:3 HorFreq: 48100 Hz Clock: 50.000 MHz
  800x600@75Hz 4:3 HorFreq: 46900 Hz Clock: 49.500 MHz
  832x624@75Hz 4:3 HorFreq: 49726 Hz Clock: 57.284 MHz
  1024x768@60Hz 4:3 HorFreq: 48400 Hz Clock: 65.000 MHz
  1024x768@70Hz 4:3 HorFreq: 56500 Hz Clock: 75.000 MHz
  1024x768@75Hz 4:3 HorFreq: 60000 Hz Clock: 78.750 MHz
  1280x1024@75Hz 5:4 HorFreq: 80000 Hz Clock: 135.000 MHz
  1152x870@75Hz 192:145 HorFreq: 67500 Hz Clock: 108.000 MHz
Standard timings supported:
  1152x864@70Hz 4:3
  1152x864@75Hz 4:3 HorFreq: 67500 Hz Clock: 108.000 MHz
  1280x960@60Hz 4:3 HorFreq: 60000 Hz Clock: 108.000 MHz
  1280x1024@60Hz 5:4 HorFreq: 64000 Hz Clock: 108.000 MHz
Detailed mode: Clock 108.000 MHz, 337 mm x 270 mm
               1280 1328 1440 1688 hborder 0
               1024 1025 1028 1066 vborder 0
               +hsync +vsync 
               VertFreq: 60 Hz, HorFreq: 63981 Hz
Serial number:  --  007787
Monitor ranges (GTF): 56-76Hz V, 30-82kHz H, max dotclock 140MHz
Checksum: 0x95 (valid)
EDID block does NOT conform to EDID 1.3!
	Name descriptor not terminated with a newline
EDID block does not conform at all!
	Bad year of manufacture
