edid-decode (hex):

00 ff ff ff ff ff ff 00 26 cf 44 85 00 00 00 00
00 1e 01 04 a5 1d 12 78 0e de 50 a3 54 4c 99 26
0f 50 54 00 00 00 01 01 01 01 01 01 01 01 01 01
01 01 01 01 01 01 0f 3c 80 a0 70 b0 20 40 18 30
3c 00 1e b3 10 00 00 18 0c 30 80 a0 70 b0 20 40
18 30 3c 00 1e b3 10 00 00 18 00 00 00 fe 00 37
56 33 37 31 80 31 33 33 4e 57 34 4a 00 00 00 00
00 02 41 21 1e 00 11 00 00 0a 01 0a 20 20 00 cf

----------------

Block 0, Base EDID:
  EDID Structure Version & Revision: 1.4
  Vendor & Product Identification:
    Manufacturer: IVO
    Model: 34116
    Made in: 2020
  Basic Display Parameters & Features:
    Digital display
    Bits per primary color channel: 8
    DisplayPort interface
    Maximum image size: 29 cm x 18 cm
    Gamma: 2.20
    Supported color formats: RGB 4:4:4, YCrCb 4:4:4
    Default (sRGB) color space is primary color space
    First detailed timing includes the native pixel format and preferred refresh rate
  Color Characteristics:
    Red  : 0.6396, 0.3291
    Green: 0.2998, 0.5996
    Blue : 0.1494, 0.0595
    White: 0.3125, 0.3281
  Established Timings I & II: none
  Standard Timings: none
  Detailed Timing Descriptors:
    DTD 1:  1920x1200   59.998595 Hz   8:5     73.918 kHz    153.750000 MHz (286 mm x 179 mm)
                 Hfront   24 Hsync  48 Hback   88 Hpol N
                 Vfront    3 Vsync  12 Vback   17 Vpol N
    DTD 2:  1920x1200   47.998876 Hz   8:5     59.135 kHz    123.000000 MHz (286 mm x 179 mm)
                 Hfront   24 Hsync  48 Hback   88 Hpol N
                 Vfront    3 Vsync  12 Vback   17 Vpol N
    Alphanumeric Data String: '7V371'
    Manufacturer-Specified Display Descriptor (0x00): 00 00 00 02 41 21 1e 00 11 00 00 0a 01 0a 20 20 '....A!........  '
Checksum: 0xcf

----------------

Failures:

Block 0, Base EDID:
  Basic Display Parameters & Features: sRGB is signaled, but the chromaticities do not match.
  Alphanumeric Data String: Non-printable character.
  Missing Display Product Name.

EDID conformity: FAIL
