edid-decode (hex):

00 ff ff ff ff ff ff 00 09 e5 4b 0b 00 00 00 00
09 20 01 04 a5 1e 13 78 07 ee 95 a3 54 4c 99 26
0f 50 54 00 00 00 01 01 01 01 01 01 01 01 01 01
01 01 01 01 01 01 07 53 c0 dc 80 78 28 50 30 20
36 00 2e bd 10 00 00 1a 00 00 00 fd 00 28 3c 56
56 15 01 0a 20 20 20 20 20 20 00 00 00 fe 00 42
4f 45 20 43 51 0a 20 20 20 20 20 20 00 00 00 fe
00 4e 56 31 34 30 44 52 4d 2d 4e 34 33 0a 00 b1

00 ff ff ff ff ff ff 00 09 e5 4b 0b 00 00 00 00
09 20 01 04 a5 1e 13 78 07 ee 95 a3 54 4c 99 26
0f 50 54 00 00 00 01 01 01 01 01 01 01 01 01 01
01 01 01 01 01 01 07 53 c0 dc 80 78 28 50 30 20
36 00 2e bd 10 00 00 1a 00 00 00 fd 00 28 3c 56
56 15 01 0a 20 20 20 20 20 20 00 00 00 fe 00 42
4f 45 20 43 51 0a 20 20 20 20 20 20 00 00 00 fe
00 4e 56 31 34 30 44 52 4d 2d 4e 34 33 0a 00 b1

----------------

Block 0, Base EDID:
  EDID Structure Version & Revision: 1.4
  Vendor & Product Identification:
    Manufacturer: BOE
    Model: 2891
    Made in: week 9 of 2022
  Basic Display Parameters & Features:
    Digital display
    Bits per primary color channel: 8
    DisplayPort interface
    Maximum image size: 30 cm x 19 cm
    Gamma: 2.20
    Supported color formats: RGB 4:4:4
    Default (sRGB) color space is primary color space
    First detailed timing includes the native pixel format and preferred refresh rate
    Display is continuous frequency
  Color Characteristics:
    Red  : 0.6396, 0.3300
    Green: 0.2998, 0.5996
    Blue : 0.1503, 0.0595
    White: 0.3134, 0.3291
  Established Timings I & II: none
  Standard Timings: none
  Detailed Timing Descriptors:
    DTD 1:  2240x1400   60.001694 Hz  16:10    86.402 kHz    212.550000 MHz (302 mm x 189 mm)
                 Hfront   48 Hsync  32 Hback  140 Hpol P
                 Vfront    3 Vsync   6 Vback   31 Vpol N
    Display Range Limits:
      Monitor ranges (Bare Limits): 40-60 Hz V, 86-86 kHz H, max dotclock 210 MHz
    Alphanumeric Data String: 'BOE CQ'
    Alphanumeric Data String: 'NV140DRM-N43'
Checksum: 0xb1

----------------

Block 1, Unknown EDID Extension Block 0x00:
  00 ff ff ff ff ff ff 00 09 e5 4b 0b 00 00 00 00 '..........K.....'
  09 20 01 04 a5 1e 13 78 07 ee 95 a3 54 4c 99 26 '. .....x....TL.&'
  0f 50 54 00 00 00 01 01 01 01 01 01 01 01 01 01 '.PT.............'
  01 01 01 01 01 01 07 53 c0 dc 80 78 28 50 30 20 '.......S...x(P0 '
  36 00 2e bd 10 00 00 1a 00 00 00 fd 00 28 3c 56 '6............(<V'
  56 15 01 0a 20 20 20 20 20 20 00 00 00 fe 00 42 'V...      .....B'
  4f 45 20 43 51 0a 20 20 20 20 20 20 00 00 00 fe 'OE CQ.      ....'
  00 4e 56 31 34 30 44 52 4d 2d 4e 34 33 0a 00 b1 '.NV140DRM-N43...'
Checksum: 0xb1

----------------

Warnings:

Block 0, Base EDID:
  Missing Display Product Name.
EDID:
  Base EDID: Some timings are out of range of the Monitor Ranges:
    Maximum Clock: 212.550 MHz (Monitor: 210.000 MHz)
    Could be due to a Monitor Range off-by-one rounding issue

Failures:

Block 0, Base EDID:
  Basic Display Parameters & Features: sRGB is signaled, but the chromaticities do not match.
Block 1, Base EDID:
  Unknown Extension Block.
EDID:
  Base EDID: EDID specified 0 extension block(s), but found 1 extension block(s).

EDID conformity: FAIL
