edid-decode (hex):

00 ff ff ff ff ff ff 00 34 38 90 1f c5 00 00 00
29 0a 01 02 6c 29 1e ac e8 7a 68 9f 56 47 99 26
12 48 4c ad ef 80 31 59 45 59 61 59 71 4f 81 99
d1 4f a9 59 e1 4f f8 7c 00 60 82 00 46 60 40 d8
13 00 88 26 11 00 00 1e 00 00 00 ff 00 30 30 31
39 37 0a 20 20 20 20 20 20 20 00 00 00 fc 00 31
30 38 30 38 30 0a 20 20 20 20 20 20 00 00 00 fd
00 32 a0 1e 79 ff 00 0a 20 20 20 20 20 20 00 e8

----------------

Block 0, Base EDID:
  EDID Structure Version & Revision: 1.2
  Vendor & Product Identification:
    Manufacturer: MAX
    Model: 8080
    Serial Number: ...
    Made in: week 41 of 2000
  Basic Display Parameters & Features:
    Analog display
    Input voltage level: 0.7/0.7 V
    Blank level equals black level
    Sync: Separate Composite
    Maximum image size: 41 cm x 30 cm
    Gamma: 2.72
    DPMS levels: Standby Suspend Off
    RGB color display
  Color Characteristics:
    Red  : 0.6220, 0.3388
    Green: 0.2792, 0.5996
    Blue : 0.1494, 0.0722
    White: 0.2832, 0.2968
  Established Timings I & II:
    IBM     :   720x400    70.082 Hz   9:5    31.467 kHz  28.320 MHz
    DMT 0x04:   640x480    59.940 Hz   4:3    31.469 kHz  25.175 MHz
    DMT 0x05:   640x480    72.809 Hz   4:3    37.861 kHz  31.500 MHz
    DMT 0x06:   640x480    75.000 Hz   4:3    37.500 kHz  31.500 MHz
    DMT 0x09:   800x600    60.317 Hz   4:3    37.879 kHz  40.000 MHz
    DMT 0x0a:   800x600    72.188 Hz   4:3    48.077 kHz  50.000 MHz
    DMT 0x0b:   800x600    75.000 Hz   4:3    46.875 kHz  49.500 MHz
    Apple   :   832x624    74.551 Hz   4:3    49.726 kHz  57.284 MHz
    DMT 0x10:  1024x768    60.004 Hz   4:3    48.363 kHz  65.000 MHz
    DMT 0x11:  1024x768    70.069 Hz   4:3    56.476 kHz  75.000 MHz
    DMT 0x12:  1024x768    75.029 Hz   4:3    60.023 kHz  78.750 MHz
    DMT 0x24:  1280x1024   75.025 Hz   5:4    79.976 kHz 135.000 MHz
    Apple   :  1152x870    75.062 Hz 192:145  68.681 kHz 100.000 MHz
  Standard Timings:
    DMT 0x07:   640x480    85.008 Hz   4:3    43.269 kHz  36.000 MHz
    DMT 0x0c:   800x600    85.061 Hz   4:3    53.674 kHz  56.250 MHz
    DMT 0x13:  1024x768    84.997 Hz   4:3    68.677 kHz  94.500 MHz
    DMT 0x15:  1152x864    75.000 Hz   4:3    67.500 kHz 108.000 MHz
    DMT 0x25:  1280x1024   85.024 Hz   5:4    91.146 kHz 157.500 MHz
    DMT 0x4a:  1920x1440   75.000 Hz   4:3   112.500 kHz 297.000 MHz
    DMT 0x37:  1600x1200   85.000 Hz   4:3   106.250 kHz 229.500 MHz
    GTF     :  2048x1536   75.000 Hz   4:3   120.225 kHz 340.477 MHz
  Detailed Timing Descriptors:
    DTD 1:  2048x1536   75.001 Hz   4:3   120.452 kHz 319.920 MHz (392 mm x 294 mm)
                 Hfront   64 Hsync 216 Hback 328 Hpol P
                 Vfront    1 Vsync   3 Vback  66 Vpol P
    Display Product Serial Number: ...
    Display Product Name: '108080'
  Display Range Limits:
    Monitor ranges (GTF): 50-160 Hz V, 30-121 kHz H, max dotclock 2550 MHz
Checksum: 0xe8

----------------

Warnings:

Block 0, Base EDID:
  EDID Structure Version & Revision: EDID 1.2 is deprecated, do not use.

EDID conformity: PASS
