
EDID (hex):
00ffffffffffff0041d2101901010101
13130103a0291a78baeed5a555489b26
125054bfef00310a6146714f814f8180
9500950f01019a29a0d0518422305098
36009a011100001c000000fd00384b1e
500e000a202020202020000000fc0050
4e5220504c313931304d570a000000ff
00310a202020202020202020202001ed
02031b71230907078301000067030c00
1000802143011084e2000f011d007251
d01e206e28550081490000001e000000
10000000000000000000000000000000
00001000000000000000000000000000
00000000100000000000000000000000
00000000000010000000000000000000
000000000000000000000000000000bf

Extracted contents:
header:          00 ff ff ff ff ff ff 00
serial number:   41 d2 10 19 01 01 01 01 13 13
version:         01 03
basic params:    a0 29 1a 78 ba
chroma info:     ee d5 a5 55 48 9b 26 12 50 54
established:     bf ef 00
standard:        31 0a 61 46 71 4f 81 4f 81 80 95 00 95 0f 01 01
descriptor 1:    9a 29 a0 d0 51 84 22 30 50 98 36 00 9a 01 11 00 00 1c
descriptor 2:    00 00 00 fd 00 38 4b 1e 50 0e 00 0a 20 20 20 20 20 20
descriptor 3:    00 00 00 fc 00 50 4e 52 20 50 4c 31 39 31 30 4d 57 0a
descriptor 4:    00 00 00 ff 00 31 0a 20 20 20 20 20 20 20 20 20 20 20
extensions:      01
checksum:        ed

EDID version: 1.3
Manufacturer: PNR Model 1910 Serial Number --
Made in week 19 of 2009
Digital display
Maximum image size: 41 cm x 26 cm
Gamma: 2.20
DPMS levels: Standby Off
Undefined display color type
First detailed timing is preferred timing
Display x,y Chromaticity:
  Red:   0.6474, 0.3339
  Green: 0.2841, 0.6074
  Blue:  0.1513, 0.0712
  White: 0.3134, 0.3291
Established timings supported:
  720x400@70Hz 9:5 HorFreq: 31469 Hz Clock: 28.320 MHz
  640x480@60Hz 4:3 HorFreq: 31469 Hz Clock: 25.175 MHz
  640x480@67Hz 4:3 HorFreq: 35000 Hz Clock: 30.240 MHz
  640x480@72Hz 4:3 HorFreq: 37900 Hz Clock: 31.500 MHz
  640x480@75Hz 4:3 HorFreq: 37500 Hz Clock: 31.500 MHz
  800x600@56Hz 4:3 HorFreq: 35200 Hz Clock: 36.000 MHz
  800x600@60Hz 4:3 HorFreq: 37900 Hz Clock: 40.000 MHz
  800x600@72Hz 4:3 HorFreq: 48100 Hz Clock: 50.000 MHz
  800x600@75Hz 4:3 HorFreq: 46900 Hz Clock: 49.500 MHz
  832x624@75Hz 4:3 HorFreq: 49726 Hz Clock: 57.284 MHz
  1024x768@60Hz 4:3 HorFreq: 48400 Hz Clock: 65.000 MHz
  1024x768@70Hz 4:3 HorFreq: 56500 Hz Clock: 75.000 MHz
  1024x768@75Hz 4:3 HorFreq: 60000 Hz Clock: 78.750 MHz
  1280x1024@75Hz 5:4 HorFreq: 80000 Hz Clock: 135.000 MHz
Standard timings supported:
  640x400@70Hz 16:10
  1024x768@66Hz 4:3
  1152x864@75Hz 4:3 HorFreq: 67500 Hz Clock: 108.000 MHz
  1280x960@75Hz 4:3
  1280x1024@60Hz 5:4 HorFreq: 64000 Hz Clock: 108.000 MHz
  1440x900@60Hz 16:10 HorFreq: 55500 Hz Clock: 88.750 MHz
  1440x900@75Hz 16:10 HorFreq: 82300 Hz Clock: 156.000 MHz
Detailed mode: Clock 106.500 MHz, 410 mm x 257 mm
               1440 1520 1672 1904 hborder 0
                900  903  909  934 vborder 0
               -hsync +vsync 
               VertFreq: 59 Hz, HorFreq: 55934 Hz
Monitor ranges (GTF): 56-75Hz V, 30-80kHz H, max dotclock 140MHz
Monitor name: PNR PL1910MW
Serial number: --
Has 1 extension blocks
Checksum: 0xed (valid)

CTA extension block
Extension version: 3
23 bytes of CTA data
  Audio data block
    Linear PCM, max channels 2
      Supported sample rates (kHz): 48 44.1 32
      Supported sample sizes (bits): 24 20 16
  Speaker allocation data block
    Speaker map:
      FL/FR - Front Left/Right
  Vendor-specific data block, OUI 000c03 (HDMI)
    Source physical address 1.0.0.0
    Supports_AI
    Maximum TMDS clock: 165MHz
  Video data block
    VIC   1 640x480@60Hz 4:3  HorFreq: 31469 Hz Clock: 25.175 MHz
    VIC  16 1920x1080@60Hz 16:9  HorFreq: 67500 Hz Clock: 148.500 MHz
    VIC   4 1280x720@60Hz 16:9 (native) HorFreq: 45000 Hz Clock: 74.250 MHz
  Extended tag: Video capability data block
    YCbCr quantization: No Data (0)
    RGB quantization: No Data (0)
    PT scan behaviour: No Data (0)
    IT scan behaviour: Support both over- and underscan (3)
    CE scan behaviour: Support both over- and underscan (3)
Basic audio support
Supports YCbCr 4:4:4
Supports YCbCr 4:2:2
1 native detailed modes
Detailed mode: Clock 74.250 MHz, 129 mm x 73 mm
               1280 1390 1430 1650 hborder 0
                720  725  730  750 vborder 0
               +hsync +vsync 
               VertFreq: 60 Hz, HorFreq: 45000 Hz
Checksum: 0xbf (valid)

EDID block does NOT conform to EDID 1.3!
	Digital display field contains garbage: 20
One or more of the timings is out of range of the Monitor Ranges:
  Vertical Freq: 56 - 75 Hz
  Horizontal Freq: 31469 - 82300 Hz
  Maximum Clock: 156.000 MHz
EDID block does not conform at all!
	Both the serial number and the serial string are set
