
EDID (hex):
00ffffffffffff005a632bd201010101
0c1e0104a5341d782f8995a556529f27
0d5054bfef80b300a940a9c095009040
818081408100023a801871382d40582c
450009252100001e000000ff00564257
3230313234303931370a000000fd0032
4b0f5211000a202020202020000000fc
00564732343339205365726965730130
020321f1549005040302070608090f1f
1413121115161d1e0123097f07830100
00023a801871382d40582c4500092521
00001e011d8018711c1620582c250009
252100009e011d007251d01e206e2855
0009252100001e8c0ad08a20e02d1010
3e960009252100001800000000000000
000000000000000000000000000000d6

Extracted contents:
header:          00 ff ff ff ff ff ff 00
serial number:   5a 63 2b d2 01 01 01 01 0c 1e
version:         01 04
basic params:    a5 34 1d 78 2f
chroma info:     89 95 a5 56 52 9f 27 0d 50 54
established:     bf ef 80
standard:        b3 00 a9 40 a9 c0 95 00 90 40 81 80 81 40 81 00
descriptor 1:    02 3a 80 18 71 38 2d 40 58 2c 45 00 09 25 21 00 00 1e
descriptor 2:    00 00 00 ff 00 56 42 57 32 30 31 32 34 30 39 31 37 0a
descriptor 3:    00 00 00 fd 00 32 4b 0f 52 11 00 0a 20 20 20 20 20 20
descriptor 4:    00 00 00 fc 00 56 47 32 34 33 39 20 53 65 72 69 65 73
extensions:      01
checksum:        30

EDID version: 1.4
Manufacturer: VSC Model d22b Serial Number --
Made in week 12 of 2020
Digital display
8 bits per primary color channel
DisplayPort interface
Maximum image size: 52 cm x 29 cm
Gamma: 2.20
DPMS levels: Off
Supported color formats: RGB 4:4:4, YCrCb 4:4:4
Default (sRGB) color space is primary color space
First detailed timing includes the native pixel format and preferred refresh rate
Display is continuous frequency
Display x,y Chromaticity:
  Red:   0.6464, 0.3359
  Green: 0.3222, 0.6220
  Blue:  0.1542, 0.0517
  White: 0.3134, 0.3291
Established timings supported:
  720x400@70Hz 9:5 HorFreq: 31469 Hz Clock: 28.320 MHz
  640x480@60Hz 4:3 HorFreq: 31469 Hz Clock: 25.175 MHz
  640x480@67Hz 4:3 HorFreq: 35000 Hz Clock: 30.240 MHz
  640x480@72Hz 4:3 HorFreq: 37900 Hz Clock: 31.500 MHz
  640x480@75Hz 4:3 HorFreq: 37500 Hz Clock: 31.500 MHz
  800x600@56Hz 4:3 HorFreq: 35200 Hz Clock: 36.000 MHz
  800x600@60Hz 4:3 HorFreq: 37900 Hz Clock: 40.000 MHz
  800x600@72Hz 4:3 HorFreq: 48100 Hz Clock: 50.000 MHz
  800x600@75Hz 4:3 HorFreq: 46900 Hz Clock: 49.500 MHz
  832x624@75Hz 4:3 HorFreq: 49726 Hz Clock: 57.284 MHz
  1024x768@60Hz 4:3 HorFreq: 48400 Hz Clock: 65.000 MHz
  1024x768@70Hz 4:3 HorFreq: 56500 Hz Clock: 75.000 MHz
  1024x768@75Hz 4:3 HorFreq: 60000 Hz Clock: 78.750 MHz
  1280x1024@75Hz 5:4 HorFreq: 80000 Hz Clock: 135.000 MHz
  1152x870@75Hz 192:145 HorFreq: 67500 Hz Clock: 108.000 MHz
Standard timings supported:
  1680x1050@60Hz 16:10 HorFreq: 64700 Hz Clock: 119.000 MHz
  1600x1200@60Hz 4:3 HorFreq: 75000 Hz Clock: 162.000 MHz
  1600x900@60Hz 16:9
  1440x900@60Hz 16:10 HorFreq: 55500 Hz Clock: 88.750 MHz
  1400x1050@60Hz 4:3 HorFreq: 64700 Hz Clock: 101.000 MHz
  1280x1024@60Hz 5:4 HorFreq: 64000 Hz Clock: 108.000 MHz
  1280x960@60Hz 4:3 HorFreq: 60000 Hz Clock: 108.000 MHz
  1280x800@60Hz 16:10
Detailed mode: Clock 148.500 MHz, 521 mm x 293 mm
               1920 2008 2052 2200 hborder 0
               1080 1084 1089 1125 vborder 0
               +hsync +vsync 
               VertFreq: 60 Hz, HorFreq: 67500 Hz
Serial number: --
Monitor ranges (GTF): 50-75Hz V, 15-82kHz H, max dotclock 170MHz
Has 1 extension blocks
Checksum: 0x30 (valid)

CTA extension block
Extension version: 3
29 bytes of CTA data
  Video data block
    VIC  16 1920x1080@60Hz 16:9 (native) HorFreq: 67500 Hz Clock: 148.500 MHz
    VIC   5 1920x1080i@60Hz 16:9  HorFreq: 33750 Hz Clock: 74.250 MHz
    VIC   4 1280x720@60Hz 16:9  HorFreq: 45000 Hz Clock: 74.250 MHz
    VIC   3 720x480@60Hz 16:9  HorFreq: 31469 Hz Clock: 27.000 MHz
    VIC   2 720x480@60Hz 4:3  HorFreq: 31469 Hz Clock: 27.000 MHz
    VIC   7 1440x480i@60Hz 16:9  HorFreq: 15734 Hz Clock: 27.000 MHz
    VIC   6 1440x480i@60Hz 4:3  HorFreq: 15734 Hz Clock: 27.000 MHz
    VIC   8 1440x240@60Hz 4:3  HorFreq: 15734 Hz Clock: 27.000 MHz
    VIC   9 1440x240@60Hz 16:9  HorFreq: 15734 Hz Clock: 27.000 MHz
    VIC  15 1440x480@60Hz 16:9  HorFreq: 31469 Hz Clock: 54.000 MHz
    VIC  31 1920x1080@50Hz 16:9  HorFreq: 56250 Hz Clock: 148.500 MHz
    VIC  20 1920x1080i@50Hz 16:9  HorFreq: 28125 Hz Clock: 74.250 MHz
    VIC  19 1280x720@50Hz 16:9  HorFreq: 37500 Hz Clock: 74.250 MHz
    VIC  18 720x576@50Hz 16:9  HorFreq: 31250 Hz Clock: 27.000 MHz
    VIC  17 720x576@50Hz 4:3  HorFreq: 31250 Hz Clock: 27.000 MHz
    VIC  21 1440x576i@50Hz 4:3  HorFreq: 15625 Hz Clock: 27.000 MHz
    VIC  22 1440x576i@50Hz 16:9  HorFreq: 15625 Hz Clock: 27.000 MHz
    VIC  29 1440x576@50Hz 4:3  HorFreq: 31250 Hz Clock: 54.000 MHz
    VIC  30 1440x576@50Hz 16:9  HorFreq: 31250 Hz Clock: 54.000 MHz
    VIC   1 640x480@60Hz 4:3  HorFreq: 31469 Hz Clock: 25.175 MHz
  Audio data block
    Linear PCM, max channels 2
      Supported sample rates (kHz): 192 176.4 96 88.2 48 44.1 32
      Supported sample sizes (bits): 24 20 16
  Speaker allocation data block
    Speaker map:
      FL/FR - Front Left/Right
Underscans PC formats by default
Basic audio support
Supports YCbCr 4:4:4
Supports YCbCr 4:2:2
1 native detailed modes
Detailed mode: Clock 148.500 MHz, 521 mm x 293 mm
               1920 2008 2052 2200 hborder 0
               1080 1084 1089 1125 vborder 0
               +hsync +vsync 
               VertFreq: 60 Hz, HorFreq: 67500 Hz
Detailed mode: Clock 74.250 MHz, 521 mm x 293 mm
               1920 2008 2052 2200 hborder 0
                540  542  547  562 vborder 0
               +hsync +vsync interlaced 
               VertFreq: 60 Hz, HorFreq: 33750 Hz
Detailed mode: Clock 74.250 MHz, 521 mm x 293 mm
               1280 1390 1430 1650 hborder 0
                720  725  730  750 vborder 0
               +hsync +vsync 
               VertFreq: 60 Hz, HorFreq: 45000 Hz
Detailed mode: Clock 27.000 MHz, 521 mm x 293 mm
                720  736  798  858 hborder 0
                480  489  495  525 vborder 0
               -hsync -vsync 
               VertFreq: 59 Hz, HorFreq: 31468 Hz
Checksum: 0xd6 (valid)

EDID block does NOT conform to EDID 1.4!
	sRGB is signaled, but the chromaticities do not match
	Name descriptor not terminated with a newline
EDID block does not conform at all!
	Both the serial number and the serial string are set
