
EDID (hex):
00ffffffffffff001e6d725b54940500
0b1e010380351e78eaa435a5544f9e27
125054a54b80317c4568457c617c8168
818081bc953c023a801871382d40582c
4500132a2100001ead4380a070384d40
30203a00132a2100001a000000fd0038
901eaa24000a202020202020000000fc
004c4720554c545241474541520a0111
020326c1230907074b01020304040413
1f903f408301000065030c0010006700
0000017880038048801871382d40582c
4500132a2100001e866f80a070384040
30203500132a2100001efe5b80a07038
354030203500132a21000018000000ff
003031314e54514441523635320a0000
00000000000000000000000000000045

Extracted contents:
header:          00 ff ff ff ff ff ff 00
serial number:   1e 6d 72 5b 54 94 05 00 0b 1e
version:         01 03
basic params:    80 35 1e 78 ea
chroma info:     a4 35 a5 54 4f 9e 27 12 50 54
established:     a5 4b 80
standard:        31 7c 45 68 45 7c 61 7c 81 68 81 80 81 bc 95 3c
descriptor 1:    02 3a 80 18 71 38 2d 40 58 2c 45 00 13 2a 21 00 00 1e
descriptor 2:    ad 43 80 a0 70 38 4d 40 30 20 3a 00 13 2a 21 00 00 1a
descriptor 3:    00 00 00 fd 00 38 90 1e aa 24 00 0a 20 20 20 20 20 20
descriptor 4:    00 00 00 fc 00 4c 47 20 55 4c 54 52 41 47 45 41 52 0a
extensions:      01
checksum:        11

EDID version: 1.3
Manufacturer: GSM Model 5b72 Serial Number --
Made in week 11 of 2020
Digital display
Maximum image size: 53 cm x 30 cm
Gamma: 2.20
DPMS levels: Standby Suspend Off
RGB color display
First detailed timing is preferred timing
Display x,y Chromaticity:
  Red:   0.6464, 0.3300
  Green: 0.3095, 0.6171
  Blue:  0.1523, 0.0732
  White: 0.3134, 0.3291
Established timings supported:
  720x400@70Hz 9:5 HorFreq: 31469 Hz Clock: 28.320 MHz
  640x480@60Hz 4:3 HorFreq: 31469 Hz Clock: 25.175 MHz
  640x480@75Hz 4:3 HorFreq: 37500 Hz Clock: 31.500 MHz
  800x600@60Hz 4:3 HorFreq: 37900 Hz Clock: 40.000 MHz
  800x600@75Hz 4:3 HorFreq: 46900 Hz Clock: 49.500 MHz
  1024x768@60Hz 4:3 HorFreq: 48400 Hz Clock: 65.000 MHz
  1024x768@75Hz 4:3 HorFreq: 60000 Hz Clock: 78.750 MHz
  1280x1024@75Hz 5:4 HorFreq: 80000 Hz Clock: 135.000 MHz
  1152x870@75Hz 192:145 HorFreq: 67500 Hz Clock: 108.000 MHz
Standard timings supported:
  640x480@120Hz 4:3
  800x600@100Hz 4:3
  800x600@120Hz 4:3
  1024x768@120Hz 4:3
  1280x960@100Hz 4:3
  1280x1024@60Hz 5:4 HorFreq: 64000 Hz Clock: 108.000 MHz
  1280x1024@120Hz 5:4
  1440x900@120Hz 16:10
Detailed mode: Clock 148.500 MHz, 531 mm x 298 mm
               1920 2008 2052 2200 hborder 0
               1080 1084 1089 1125 vborder 0
               +hsync +vsync 
               VertFreq: 60 Hz, HorFreq: 67500 Hz
Detailed mode: Clock 173.250 MHz, 531 mm x 298 mm
               1920 1968 2000 2080 hborder 0
               1080 1083 1093 1157 vborder 0
               +hsync -vsync 
               VertFreq: 71 Hz, HorFreq: 83293 Hz
Monitor ranges (GTF): 56-144Hz V, 30-170kHz H, max dotclock 360MHz
Monitor name: LG ULTRAGEAR
Has 1 extension blocks
Checksum: 0x11 (valid)

CTA extension block
Extension version: 3
34 bytes of CTA data
  Audio data block
    Linear PCM, max channels 2
      Supported sample rates (kHz): 48 44.1 32
      Supported sample sizes (bits): 24 20 16
  Video data block
    VIC   1 640x480@60Hz 4:3  HorFreq: 31469 Hz Clock: 25.175 MHz
    VIC   2 720x480@60Hz 4:3  HorFreq: 31469 Hz Clock: 27.000 MHz
    VIC   3 720x480@60Hz 16:9  HorFreq: 31469 Hz Clock: 27.000 MHz
    VIC   4 1280x720@60Hz 16:9  HorFreq: 45000 Hz Clock: 74.250 MHz
    VIC   4 1280x720@60Hz 16:9  HorFreq: 45000 Hz Clock: 74.250 MHz
    VIC   4 1280x720@60Hz 16:9  HorFreq: 45000 Hz Clock: 74.250 MHz
    VIC  19 1280x720@50Hz 16:9  HorFreq: 37500 Hz Clock: 74.250 MHz
    VIC  31 1920x1080@50Hz 16:9  HorFreq: 56250 Hz Clock: 148.500 MHz
    VIC  16 1920x1080@60Hz 16:9 (native) HorFreq: 67500 Hz Clock: 148.500 MHz
    VIC  63 1920x1080@120Hz 16:9  HorFreq: 135000 Hz Clock: 297.000 MHz
    VIC  64 1920x1080@100Hz 16:9  HorFreq: 112500 Hz Clock: 297.000 MHz
  Speaker allocation data block
    Speaker map:
      FL/FR - Front Left/Right
  Vendor-specific data block, OUI 000c03 (HDMI)
    Source physical address 1.0.0.0
  Vendor-specific data block, OUI 000000
Underscans PC formats by default
Basic audio support
1 native detailed modes
Detailed mode: Clock 185.600 MHz, 531 mm x 298 mm
               1920 2008 2052 2200 hborder 0
               1080 1084 1089 1125 vborder 0
               +hsync +vsync 
               VertFreq: 74 Hz, HorFreq: 84363 Hz
Detailed mode: Clock 285.500 MHz, 531 mm x 298 mm
               1920 1968 2000 2080 hborder 0
               1080 1083 1088 1144 vborder 0
               +hsync +vsync 
               VertFreq: 119 Hz, HorFreq: 137259 Hz
Detailed mode: Clock 235.500 MHz, 531 mm x 298 mm
               1920 1968 2000 2080 hborder 0
               1080 1083 1088 1133 vborder 0
               -hsync -vsync 
               VertFreq: 99 Hz, HorFreq: 113221 Hz
Checksum: 0x45 (valid)

One or more of the timings is out of range of the Monitor Ranges:
  Vertical Freq: 50 - 120 Hz
  Horizontal Freq: 31469 - 137259 Hz
  Maximum Clock: 297.000 MHz


