edid-decode (hex):

00 ff ff ff ff ff ff 00 09 e5 f7 08 00 00 00 00
2e 1d 01 04 a5 24 14 78 03 0b b5 a6 57 52 9c 25
0d 50 54 00 00 00 01 01 01 01 01 01 01 01 01 01
01 01 01 01 01 01 9c 8b 80 18 71 38 30 40 6c 30
aa 00 63 c8 10 00 00 1a 9c 8b 80 18 71 38 5b 46
6c 30 aa 00 63 c8 10 00 00 1a 00 00 00 00 00 00
00 00 00 00 00 00 00 00 00 00 00 00 00 00 00 02
00 0a 36 ff 0a 3c 96 3e 1c 43 96 00 00 00 00 79

----------------

Block 0, Base EDID:
  EDID Structure Version & Revision: 1.4
  Vendor & Product Identification:
    Manufacturer: BOE
    Model: 2295
    Made in: week 46 of 2019
  Basic Display Parameters & Features:
    Digital display
    Bits per primary color channel: 8
    DisplayPort interface
    Maximum image size: 36 cm x 20 cm
    Gamma: 2.20
    Supported color formats: RGB 4:4:4
    First detailed timing includes the native pixel format and preferred refresh rate
    Display is continuous frequency
  Color Characteristics:
    Red  : 0.6484, 0.3398
    Green: 0.3222, 0.6123
    Blue : 0.1464, 0.0537
    White: 0.3134, 0.3291
  Established Timings I & II: none
  Standard Timings: none
  Detailed Timing Descriptors:
    DTD 1:  1920x1080  144.019987 Hz  16:9    162.455 kHz    357.400000 MHz (355 mm x 200 mm)
                 Hfront  108 Hsync  48 Hback  124 Hpol P
                 Vfront   10 Vsync  10 Vback   28 Vpol N
    DTD 2:  1920x1080   60.012762 Hz  16:9    162.455 kHz    357.400000 MHz (355 mm x 200 mm)
                 Hfront  108 Hsync  48 Hback  124 Hpol P
                 Vfront   10 Vsync  10 Vback 1607 Vpol N
    Empty Descriptor
    Manufacturer-Specified Display Descriptor (0x02): 00 02 00 0a 36 ff 0a 3c 96 3e 1c 43 96 00 00 00 '....6..<.>.C....'
Checksum: 0x79

----------------

Failures:

Block 0, Base EDID:
  Empty Descriptor: Use Dummy Descriptor instead of all zeroes.
  Missing Display Product Name.
  Missing Display Range Limits Descriptor.

EDID conformity: FAIL
