
EDID (hex):
00ffffffffffff0009e5440600000000
01190104951f1178029820925b579629
19505400000001010101010101010101
010101010101ce1d56f4500016303020
360035ad1000001ae21356f450001630
3020360035ad1000001a000000000000
00000000000000000000000000000002
000a3ddd0a3c6e130f1a7d0a20200047

Extracted contents:
header:          00 ff ff ff ff ff ff 00
serial number:   09 e5 44 06 00 00 00 00 01 19
version:         01 04
basic params:    95 1f 11 78 02
chroma info:     98 20 92 5b 57 96 29 19 50 54
established:     00 00 00
standard:        01 01 01 01 01 01 01 01 01 01 01 01 01 01 01 01
descriptor 1:    ce 1d 56 f4 50 00 16 30 30 20 36 00 35 ad 10 00 00 1a
descriptor 2:    e2 13 56 f4 50 00 16 30 30 20 36 00 35 ad 10 00 00 1a
descriptor 3:    00 00 00 00 00 00 00 00 00 00 00 00 00 00 00 00 00 00
descriptor 4:    00 00 00 02 00 0a 3d dd 0a 3c 6e 13 0f 1a 7d 0a 20 20
extensions:      00
checksum:        47

EDID version: 1.4
Manufacturer: BOE Model 644 Serial Number --
Made in week 1 of 2015
Digital display
6 bits per primary color channel
DisplayPort interface
Maximum image size: 31 cm x 17 cm
Gamma: 2.20
Supported color formats: RGB 4:4:4
First detailed timing includes the native pixel format and preferred refresh rate
Display x,y Chromaticity:
  Red:   0.5722, 0.3564
  Green: 0.3417, 0.5859
  Blue:  0.1601, 0.0996
  White: 0.3125, 0.3281
Established timings supported:
Standard timings supported:
Detailed mode: Clock 76.300 MHz, 309 mm x 173 mm
               1366 1414 1446 1610 hborder 0
                768  771  777  790 vborder 0
               +hsync -vsync 
               VertFreq: 59 Hz, HorFreq: 47391 Hz
Detailed mode: Clock 50.900 MHz, 309 mm x 173 mm
               1366 1414 1446 1610 hborder 0
                768  771  777  790 vborder 0
               +hsync -vsync 
               VertFreq: 40 Hz, HorFreq: 31614 Hz
Manufacturer-specified data, tag 0
Manufacturer-specified data, tag 2
Checksum: 0x47 (valid)
EDID block does NOT conform to EDID 1.4!
	Missing name descriptor
	Missing monitor ranges
