edid-decode (hex):

00 ff ff ff ff ff ff 00 2e 83 42 15 6b 00 00 00
13 12 01 03 68 21 15 78 ea f0 65 98 57 51 91 27
21 50 54 a1 08 00 01 01 01 01 01 01 01 01 01 01
01 01 01 01 01 01 9a 20 00 90 51 20 1c 30 40 88
13 00 4b cf 10 00 00 1c 0e 1f 00 80 51 00 1e 30
40 80 37 00 4b cf 10 00 00 1c 00 00 00 fd 00 38
3f 1f 32 09 00 0a 20 20 20 20 20 20 00 00 00 fc
00 57 35 30 30 36 4c 0a 20 20 20 20 20 20 00 22

----------------

Block 0, Base EDID:
  EDID Structure Version & Revision: 1.3
  Vendor & Product Identification:
    Manufacturer: KTC
    Model: 5442
    Serial Number: ...
    Made in: week 19 of 2008
  Basic Display Parameters & Features:
    Analog display
    Input voltage level: 0.7/0.7 V
    Sync: Separate
    Maximum image size: 33 cm x 21 cm
    Gamma: 2.20
    DPMS levels: Standby Suspend Off
    RGB color display
    First detailed timing is preferred timing
  Color Characteristics:
    Red  : 0.5966, 0.3427
    Green: 0.3164, 0.5664
    Blue : 0.1533, 0.1308
    White: 0.3134, 0.3291
  Established Timings I & II:
    IBM     :   720x400    70.082 Hz   9:5    31.467 kHz  28.320 MHz
    DMT 0x04:   640x480    59.940 Hz   4:3    31.469 kHz  25.175 MHz
    DMT 0x09:   800x600    60.317 Hz   4:3    37.879 kHz  40.000 MHz
    DMT 0x10:  1024x768    60.004 Hz   4:3    48.363 kHz  65.000 MHz
  Standard Timings: none
  Detailed Timing Descriptors:
    DTD 1:  1280x800    59.998 Hz   8:5    49.679 kHz  83.460 MHz (331 mm x 207 mm)
                 Hfront   64 Hsync 136 Hback 200 Hpol N
                 Vfront    1 Vsync   3 Vback  24 Vpol P
    DTD 2:  1280x768    59.870 Hz   5:3    47.776 kHz  79.500 MHz (331 mm x 207 mm)
                 Hfront   64 Hsync 128 Hback 192 Hpol N
                 Vfront    3 Vsync   7 Vback  20 Vpol P
  Display Range Limits:
    Monitor ranges (GTF): 56-63 Hz V, 31-50 kHz H, max dotclock 90 MHz
    Display Product Name: 'W5006L'
Checksum: 0x22

----------------

Failures:

All Blocks:
  Some timings are out of range of the Monitor Ranges:
    Vertical Freq: 59.870 - 70.082 Hz (Monitor: 56.000 - 63.000 Hz)

EDID conformity: FAIL
