edid-decode (hex):

00 ff ff ff ff ff ff 00 4c 2d db 0b 33 44 5a 5a
2b 1a 01 04 a5 2b 18 78 22 2f c1 a5 55 52 9f 27
0f 50 54 bf ee 00 81 c0 01 01 01 01 01 01 01 01
01 01 01 01 01 01 66 21 56 aa 51 00 1e 30 46 8f
33 00 b0 f0 10 00 00 1e 00 00 00 fd 00 38 4b 1e
51 09 00 0a 20 20 20 20 20 20 00 00 00 fc 00 53
32 30 44 33 30 30 0a 20 20 20 20 20 00 00 00 ff
00 48 34 4c 48 41 30 30 37 36 39 0a 20 20 00 6f

00 ff ff ff ff ff ff 00 4c 2d db 0b 33 44 5a 5a
2b 1a 01 04 a5 2b 18 78 22 2f c1 a5 55 52 9f 27
0f 50 54 bf ee 00 81 c0 01 01 01 01 01 01 01 01
01 01 01 01 01 01 66 21 56 aa 51 00 1e 30 46 8f
33 00 b0 f0 10 00 00 1e 00 00 00 fd 00 38 4b 1e
51 09 00 0a 20 20 20 20 20 20 00 00 00 fc 00 53
32 30 44 33 30 30 0a 20 20 20 20 20 00 00 00 ff
00 48 34 4c 48 41 30 30 37 36 39 0a 20 20 00 6f

----------------

Block 0, Base EDID:
  EDID Structure Version & Revision: 1.4
  Vendor & Product Identification:
    Manufacturer: SAM
    Model: 3035
    Serial Number: ...
    Made in: week 43 of 2016
  Basic Display Parameters & Features:
    Digital display
    Bits per primary color channel: 8
    DisplayPort interface
    Maximum image size: 43 cm x 24 cm
    Gamma: 2.20
    DPMS levels: Off
    Supported color formats: RGB 4:4:4
    First detailed timing includes the native pixel format and preferred refresh rate
  Color Characteristics:
    Red  : 0.6445, 0.3339
    Green: 0.3232, 0.6240
    Blue : 0.1552, 0.0585
    White: 0.3125, 0.3291
  Established Timings I & II:
    IBM     :   720x400    70.081663 Hz   9:5     31.467 kHz     28.320000 MHz
    DMT 0x04:   640x480    59.940476 Hz   4:3     31.469 kHz     25.175000 MHz
    Apple   :   640x480    66.666667 Hz   4:3     35.000 kHz     30.240000 MHz
    DMT 0x05:   640x480    72.808802 Hz   4:3     37.861 kHz     31.500000 MHz
    DMT 0x06:   640x480    75.000000 Hz   4:3     37.500 kHz     31.500000 MHz
    DMT 0x08:   800x600    56.250000 Hz   4:3     35.156 kHz     36.000000 MHz
    DMT 0x09:   800x600    60.316541 Hz   4:3     37.879 kHz     40.000000 MHz
    DMT 0x0a:   800x600    72.187572 Hz   4:3     48.077 kHz     50.000000 MHz
    DMT 0x0b:   800x600    75.000000 Hz   4:3     46.875 kHz     49.500000 MHz
    Apple   :   832x624    74.551266 Hz   4:3     49.726 kHz     57.284000 MHz
    DMT 0x10:  1024x768    60.003840 Hz   4:3     48.363 kHz     65.000000 MHz
    DMT 0x11:  1024x768    70.069359 Hz   4:3     56.476 kHz     75.000000 MHz
    DMT 0x12:  1024x768    75.028582 Hz   4:3     60.023 kHz     78.750000 MHz
  Standard Timings:
    DMT 0x55:  1280x720    60.000000 Hz  16:9     45.000 kHz     74.250000 MHz
  Detailed Timing Descriptors:
    DTD 1:  1366x768    59.789541 Hz 683:384   47.712 kHz     85.500000 MHz (432 mm x 240 mm)
                 Hfront   70 Hsync 143 Hback  213 Hpol P
                 Vfront    3 Vsync   3 Vback   24 Vpol P
    Display Range Limits:
      Monitor ranges (GTF): 56-75 Hz V, 30-81 kHz H, max dotclock 90 MHz
    Display Product Name: 'S20D300'
    Display Product Serial Number: ...
Checksum: 0x6f

----------------

Block 1, Unknown EDID Extension Block 0x00:
  00 ff ff ff ff ff ff 00 4c 2d db 0b 33 44 5a 5a '........L-..3DZZ'
  2b 1a 01 04 a5 2b 18 78 22 2f c1 a5 55 52 9f 27 '+....+.x"/..UR.''
  0f 50 54 bf ee 00 81 c0 01 01 01 01 01 01 01 01 '.PT.............'
  01 01 01 01 01 01 66 21 56 aa 51 00 1e 30 46 8f '......f!V.Q..0F.'
  33 00 b0 f0 10 00 00 1e 00 00 00 fd 00 38 4b 1e '3............8K.'
  51 09 00 0a 20 20 20 20 20 20 00 00 00 fc 00 53 'Q...      .....S'
  32 30 44 33 30 30 0a 20 20 20 20 20 00 00 00 ff '20D300.     ....'
  00 48 34 4c 48 41 30 30 37 36 39 0a 20 20 00 6f '.H4LHA00769.  .o'
Checksum: 0x6f

----------------

Warnings:

Block 0, Base EDID:
  Display Range Limits: GTF support is deprecated in EDID 1.4.

Failures:

Block 0, Base EDID:
  Display Range Limits: GTF can't be combined with non-continuous frequencies.
Block 1, Base EDID:
  Unknown Extension Block.
EDID:
  Base EDID: EDID specified 0 extension block(s), but found 1 extension block(s).

EDID conformity: FAIL
