edid-decode (hex):

00 ff ff ff ff ff ff 00 09 e5 29 09 00 00 00 00
01 1e 01 04 a5 1e 13 78 03 ee 95 a3 54 4c 99 26
0f 50 54 00 00 00 01 01 01 01 01 01 01 01 01 01
01 01 01 01 01 01 9c 3e 80 c8 70 b0 3c 40 30 20
36 00 2e bc 10 00 00 1a bd 29 80 c8 70 b0 3c 40
30 20 36 00 2e bc 10 00 00 1a 00 00 00 00 00 00
00 00 00 00 00 00 00 00 00 00 00 00 00 00 00 02
00 0d 28 ff 0a 3c c8 0a 0b 24 c8 00 00 00 00 28

----------------

Block 0, Base EDID:
  EDID Structure Version & Revision: 1.4
  Vendor & Product Identification:
    Manufacturer: BOE
    Model: 2345
    Made in: week 1 of 2020
  Basic Display Parameters & Features:
    Digital display
    Bits per primary color channel: 8
    DisplayPort interface
    Maximum image size: 30 cm x 19 cm
    Gamma: 2.20
    Supported color formats: RGB 4:4:4
    First detailed timing includes the native pixel format and preferred refresh rate
    Display is continuous frequency
  Color Characteristics:
    Red  : 0.6396, 0.3300
    Green: 0.2998, 0.5996
    Blue : 0.1503, 0.0595
    White: 0.3134, 0.3291
  Established Timings I & II: none
  Standard Timings: none
  Detailed Timing Descriptors:
    DTD 1:  1920x1200   60.002995 Hz   8:5     75.604 kHz    160.280000 MHz (302 mm x 188 mm)
                 Hfront   48 Hsync  32 Hback  120 Hpol P
                 Vfront    3 Vsync   6 Vback   51 Vpol N
    DTD 2:  1920x1200   40.000749 Hz   8:5     50.401 kHz    106.850000 MHz (302 mm x 188 mm)
                 Hfront   48 Hsync  32 Hback  120 Hpol P
                 Vfront    3 Vsync   6 Vback   51 Vpol N
    Empty Descriptor
    Manufacturer-Specified Display Descriptor (0x02): 00 02 00 0d 28 ff 0a 3c c8 0a 0b 24 c8 00 00 00 '....(..<...$....'
Checksum: 0x28

----------------

Failures:

Block 0, Base EDID:
  Empty Descriptor: Use Dummy Descriptor instead of all zeroes.
  Missing Display Product Name.
  Missing Display Range Limits Descriptor.

EDID conformity: FAIL
