edid-decode (hex):

00 ff ff ff ff ff ff 00 4c 2d 0d 06 00 00 00 00
1d 13 01 03 80 10 09 78 2a 35 81 a6 56 48 9a 24
12 50 54 bf ef 80 71 4f 81 00 81 40 81 80 95 00
a9 40 b3 00 01 01 02 3a 80 18 71 38 2d 40 58 2c
45 00 a0 5a 00 00 00 1e 01 1d 00 bc 52 d0 1e 20
b8 28 55 40 a0 5a 00 00 00 1e 00 00 00 fd 00 17
4b 1b 51 11 00 0a 20 20 20 20 20 20 00 00 00 fc
00 53 79 6e 63 4d 61 73 74 65 72 0a 20 20 01 b1

02 03 1d f1 4d 93 04 12 03 14 05 20 21 22 1f 10
07 16 23 09 07 07 66 03 0c 00 10 00 80 01 1d 80
d0 72 1c 16 20 10 2c 25 80 a0 5a 00 00 00 9e 01
1d 80 18 71 1c 16 20 58 2c 25 00 a0 5a 00 00 00
9e 01 1d 00 72 51 d0 1e 20 6e 28 55 00 a0 5a 00
00 00 1e 8c 0a d0 90 20 40 31 20 0c 40 55 00 a0
5a 00 00 00 1e 8c 0a d0 8a 20 e0 2d 10 10 3e 96
00 a0 5a 00 00 00 1e 00 00 00 00 00 00 00 00 0d

00 ff ff ff ff ff ff 00 4c 2d 0d 06 00 00 00 00
1d 13 01 03 80 10 09 78 2a 35 81 a6 56 48 9a 24
12 50 54 bf ef 80 71 4f 81 00 81 40 81 80 95 00
a9 40 b3 00 01 01 02 3a 80 18 71 38 2d 40 58 2c
45 00 a0 5a 00 00 00 1e 01 1d 00 bc 52 d0 1e 20
b8 28 55 40 a0 5a 00 00 00 1e 00 00 00 fd 00 17
4b 1b 51 11 00 0a 20 20 20 20 20 20 00 00 00 fc
00 53 79 6e 63 4d 61 73 74 65 72 0a 20 20 01 b1

02 03 1d f1 4d 93 04 12 03 14 05 20 21 22 1f 10
07 16 23 09 07 07 66 03 0c 00 10 00 80 01 1d 80
d0 72 1c 16 20 10 2c 25 80 a0 5a 00 00 00 9e 01
1d 80 18 71 1c 16 20 58 2c 25 00 a0 5a 00 00 00
9e 01 1d 00 72 51 d0 1e 20 6e 28 55 00 a0 5a 00
00 00 1e 8c 0a d0 90 20 40 31 20 0c 40 55 00 a0
5a 00 00 00 1e 8c 0a d0 8a 20 e0 2d 10 10 3e 96
00 a0 5a 00 00 00 1e 00 00 00 00 00 00 00 00 0d

----------------

Block 0, Base EDID:
  EDID Structure Version & Revision: 1.3
  Vendor & Product Identification:
    Manufacturer: SAM
    Model: 1549
    Made in: week 29 of 2009
  Basic Display Parameters & Features:
    Digital display
    Maximum image size: 16 cm x 9 cm
    Gamma: 2.20
    DPMS levels: Off
    RGB color display
    First detailed timing is the preferred timing
  Color Characteristics:
    Red  : 0.6484, 0.3388
    Green: 0.2822, 0.6025
    Blue : 0.1425, 0.0703
    White: 0.3125, 0.3291
  Established Timings I & II:
    IBM     :   720x400    70.081663 Hz   9:5     31.467 kHz     28.320000 MHz
    DMT 0x04:   640x480    59.940476 Hz   4:3     31.469 kHz     25.175000 MHz
    Apple   :   640x480    66.666667 Hz   4:3     35.000 kHz     30.240000 MHz
    DMT 0x05:   640x480    72.808802 Hz   4:3     37.861 kHz     31.500000 MHz
    DMT 0x06:   640x480    75.000000 Hz   4:3     37.500 kHz     31.500000 MHz
    DMT 0x08:   800x600    56.250000 Hz   4:3     35.156 kHz     36.000000 MHz
    DMT 0x09:   800x600    60.316541 Hz   4:3     37.879 kHz     40.000000 MHz
    DMT 0x0a:   800x600    72.187572 Hz   4:3     48.077 kHz     50.000000 MHz
    DMT 0x0b:   800x600    75.000000 Hz   4:3     46.875 kHz     49.500000 MHz
    Apple   :   832x624    74.551266 Hz   4:3     49.726 kHz     57.284000 MHz
    DMT 0x10:  1024x768    60.003840 Hz   4:3     48.363 kHz     65.000000 MHz
    DMT 0x11:  1024x768    70.069359 Hz   4:3     56.476 kHz     75.000000 MHz
    DMT 0x12:  1024x768    75.028582 Hz   4:3     60.023 kHz     78.750000 MHz
    DMT 0x24:  1280x1024   75.024675 Hz   5:4     79.976 kHz    135.000000 MHz
    Apple   :  1152x870    75.061550 Hz 192:145   68.681 kHz    100.000000 MHz
  Standard Timings:
    DMT 0x15:  1152x864    75.000000 Hz   4:3     67.500 kHz    108.000000 MHz
    DMT 0x1c:  1280x800    59.810326 Hz  16:10    49.702 kHz     83.500000 MHz
    DMT 0x20:  1280x960    60.000000 Hz   4:3     60.000 kHz    108.000000 MHz
    DMT 0x23:  1280x1024   60.019740 Hz   5:4     63.981 kHz    108.000000 MHz
    DMT 0x2f:  1440x900    59.887445 Hz  16:10    55.935 kHz    106.500000 MHz
    DMT 0x33:  1600x1200   60.000000 Hz   4:3     75.000 kHz    162.000000 MHz
    DMT 0x3a:  1680x1050   59.954250 Hz  16:10    65.290 kHz    146.250000 MHz
  Detailed Timing Descriptors:
    DTD  1:  1920x1080   60.000000 Hz  16:9     67.500 kHz    148.500000 MHz (160 mm x 90 mm)
                  Hfront   88 Hsync  44 Hback  148 Hpol P
                  Vfront    4 Vsync   5 Vback   36 Vpol P
    DTD  2:  1280x720    50.000000 Hz  16:9     37.500 kHz     74.250000 MHz (160 mm x 90 mm)
                  Hfront  440 Hsync  40 Hback  220 Hpol P
                  Vfront    5 Vsync   5 Vback   20 Vpol P
    Display Range Limits:
      Monitor ranges (GTF): 23-75 Hz V, 27-81 kHz H, max dotclock 170 MHz
    Display Product Name: 'SyncMaster'
  Extension blocks: 1
Checksum: 0xb1

----------------

Block 1, CTA-861 Extension Block:
  Revision: 3
  Underscans IT Video Formats by default
  Basic audio support
  Supports YCbCr 4:4:4
  Supports YCbCr 4:2:2
  Native detailed modes: 1
  Video Data Block:
    VIC  19:  1280x720    50.000000 Hz  16:9     37.500 kHz     74.250000 MHz (native)
    VIC   4:  1280x720    60.000000 Hz  16:9     45.000 kHz     74.250000 MHz
    VIC  18:   720x576    50.000000 Hz  16:9     31.250 kHz     27.000000 MHz
    VIC   3:   720x480    59.940060 Hz  16:9     31.469 kHz     27.000000 MHz
    VIC  20:  1920x1080i  50.000000 Hz  16:9     28.125 kHz     74.250000 MHz
    VIC   5:  1920x1080i  60.000000 Hz  16:9     33.750 kHz     74.250000 MHz
    VIC  32:  1920x1080   24.000000 Hz  16:9     27.000 kHz     74.250000 MHz
    VIC  33:  1920x1080   25.000000 Hz  16:9     28.125 kHz     74.250000 MHz
    VIC  34:  1920x1080   30.000000 Hz  16:9     33.750 kHz     74.250000 MHz
    VIC  31:  1920x1080   50.000000 Hz  16:9     56.250 kHz    148.500000 MHz
    VIC  16:  1920x1080   60.000000 Hz  16:9     67.500 kHz    148.500000 MHz
    VIC   7:  1440x480i   59.940060 Hz  16:9     15.734 kHz     27.000000 MHz
    VIC  22:  1440x576i   50.000000 Hz  16:9     15.625 kHz     27.000000 MHz
  Audio Data Block:
    Linear PCM:
      Max channels: 2
      Supported sample rates (kHz): 48 44.1 32
      Supported sample sizes (bits): 24 20 16
  Vendor-Specific Data Block (HDMI), OUI 00-0C-03:
    Source physical address: 1.0.0.0
    Supports_AI
  Detailed Timing Descriptors:
    DTD  3:  1920x1080i  50.000000 Hz  16:9     28.125 kHz     74.250000 MHz (160 mm x 90 mm)
                  Hfront  528 Hsync  44 Hback  148 Hpol P
                  Vfront    2 Vsync   5 Vback   15 Vpol P Vfront +0.5 Odd Field
                  Vfront    2 Vsync   5 Vback   15 Vpol P Vback  +0.5 Even Field
    DTD  4:  1920x1080i  60.000000 Hz  16:9     33.750 kHz     74.250000 MHz (160 mm x 90 mm)
                  Hfront   88 Hsync  44 Hback  148 Hpol P
                  Vfront    2 Vsync   5 Vback   15 Vpol P Vfront +0.5 Odd Field
                  Vfront    2 Vsync   5 Vback   15 Vpol P Vback  +0.5 Even Field
    DTD  5:  1280x720    60.000000 Hz  16:9     45.000 kHz     74.250000 MHz (160 mm x 90 mm)
                  Hfront  110 Hsync  40 Hback  220 Hpol P
                  Vfront    5 Vsync   5 Vback   20 Vpol P
    DTD  6:   720x576    50.000000 Hz   5:4     31.250 kHz     27.000000 MHz (160 mm x 90 mm)
                  Hfront   12 Hsync  64 Hback   68 Hpol P
                  Vfront    5 Vsync   5 Vback   39 Vpol P
    DTD  7:   720x480    59.940060 Hz   3:2     31.469 kHz     27.000000 MHz (160 mm x 90 mm)
                  Hfront   16 Hsync  62 Hback   60 Hpol P
                  Vfront    9 Vsync   6 Vback   30 Vpol P
Checksum: 0x0d  Unused space in Extension Block: 8 bytes

----------------

Block 2, Unknown EDID Extension Block 0x00:
  00 ff ff ff ff ff ff 00 4c 2d 0d 06 00 00 00 00 '........L-......'
  1d 13 01 03 80 10 09 78 2a 35 81 a6 56 48 9a 24 '.......x*5..VH.$'
  12 50 54 bf ef 80 71 4f 81 00 81 40 81 80 95 00 '.PT...qO...@....'
  a9 40 b3 00 01 01 02 3a 80 18 71 38 2d 40 58 2c '.@.....:..q8-@X,'
  45 00 a0 5a 00 00 00 1e 01 1d 00 bc 52 d0 1e 20 'E..Z........R.. '
  b8 28 55 40 a0 5a 00 00 00 1e 00 00 00 fd 00 17 '.(U@.Z..........'
  4b 1b 51 11 00 0a 20 20 20 20 20 20 00 00 00 fc 'K.Q...      ....'
  00 53 79 6e 63 4d 61 73 74 65 72 0a 20 20 01 b1 '.SyncMaster.  ..'
Checksum: 0xb1

----------------

Block 3, CTA-861 Extension Block:
  Revision: 3
  Underscans IT Video Formats by default
  Basic audio support
  Supports YCbCr 4:4:4
  Supports YCbCr 4:2:2
  Native detailed modes: 1
  Video Data Block:
    VIC  19:  1280x720    50.000000 Hz  16:9     37.500 kHz     74.250000 MHz (native)
    VIC   4:  1280x720    60.000000 Hz  16:9     45.000 kHz     74.250000 MHz
    VIC  18:   720x576    50.000000 Hz  16:9     31.250 kHz     27.000000 MHz
    VIC   3:   720x480    59.940060 Hz  16:9     31.469 kHz     27.000000 MHz
    VIC  20:  1920x1080i  50.000000 Hz  16:9     28.125 kHz     74.250000 MHz
    VIC   5:  1920x1080i  60.000000 Hz  16:9     33.750 kHz     74.250000 MHz
    VIC  32:  1920x1080   24.000000 Hz  16:9     27.000 kHz     74.250000 MHz
    VIC  33:  1920x1080   25.000000 Hz  16:9     28.125 kHz     74.250000 MHz
    VIC  34:  1920x1080   30.000000 Hz  16:9     33.750 kHz     74.250000 MHz
    VIC  31:  1920x1080   50.000000 Hz  16:9     56.250 kHz    148.500000 MHz
    VIC  16:  1920x1080   60.000000 Hz  16:9     67.500 kHz    148.500000 MHz
    VIC   7:  1440x480i   59.940060 Hz  16:9     15.734 kHz     27.000000 MHz
    VIC  22:  1440x576i   50.000000 Hz  16:9     15.625 kHz     27.000000 MHz
  Audio Data Block:
    Linear PCM:
      Max channels: 2
      Supported sample rates (kHz): 48 44.1 32
      Supported sample sizes (bits): 24 20 16
  Vendor-Specific Data Block (HDMI), OUI 00-0C-03:
    Source physical address: 1.0.0.0
    Supports_AI
  Detailed Timing Descriptors:
    DTD  8:  1920x1080i  50.000000 Hz  16:9     28.125 kHz     74.250000 MHz (160 mm x 90 mm)
                  Hfront  528 Hsync  44 Hback  148 Hpol P
                  Vfront    2 Vsync   5 Vback   15 Vpol P Vfront +0.5 Odd Field
                  Vfront    2 Vsync   5 Vback   15 Vpol P Vback  +0.5 Even Field
    DTD  9:  1920x1080i  60.000000 Hz  16:9     33.750 kHz     74.250000 MHz (160 mm x 90 mm)
                  Hfront   88 Hsync  44 Hback  148 Hpol P
                  Vfront    2 Vsync   5 Vback   15 Vpol P Vfront +0.5 Odd Field
                  Vfront    2 Vsync   5 Vback   15 Vpol P Vback  +0.5 Even Field
    DTD 10:  1280x720    60.000000 Hz  16:9     45.000 kHz     74.250000 MHz (160 mm x 90 mm)
                  Hfront  110 Hsync  40 Hback  220 Hpol P
                  Vfront    5 Vsync   5 Vback   20 Vpol P
    DTD 11:   720x576    50.000000 Hz   5:4     31.250 kHz     27.000000 MHz (160 mm x 90 mm)
                  Hfront   12 Hsync  64 Hback   68 Hpol P
                  Vfront    5 Vsync   5 Vback   39 Vpol P
    DTD 12:   720x480    59.940060 Hz   3:2     31.469 kHz     27.000000 MHz (160 mm x 90 mm)
                  Hfront   16 Hsync  62 Hback   60 Hpol P
                  Vfront    9 Vsync   6 Vback   30 Vpol P
Checksum: 0x0d  Unused space in Extension Block: 8 bytes

----------------

Warnings:

Block 0, Base EDID:
  Basic Display Parameters & Features: Dubious maximum image size (16x9 is smaller than 10x10 cm).
Block 1, CTA-861 Extension Block:
  Detailed Timing Descriptor #6: DTD is similar but not identical to VIC 17.
  Detailed Timing Descriptor #7: DTD is similar but not identical to VIC 2.
  Add a Colorimetry Data Block with the sRGB colorimetry bit set to avoid interop issues.
Block 3, CTA-861 Extension Block:
  Detailed Timing Descriptor #11: DTD is similar but not identical to VIC 17.
  Detailed Timing Descriptor #12: DTD is similar but not identical to VIC 2.
  Add a Colorimetry Data Block with the sRGB colorimetry bit set to avoid interop issues.

Failures:

Block 1, CTA-861 Extension Block:
  Missing VCDB, needed for Set Selectable RGB Quantization to avoid interop issues.
Block 2, Base EDID:
  Unknown Extension Block.
Block 3, CTA-861 Extension Block:
  Video Data Block: Duplicate VIC 19.
  Video Data Block: Duplicate VIC 4.
  Video Data Block: Duplicate VIC 18.
  Video Data Block: Duplicate VIC 3.
  Video Data Block: Duplicate VIC 20.
  Video Data Block: Duplicate VIC 5.
  Video Data Block: Duplicate VIC 32.
  Video Data Block: Duplicate VIC 33.
  Video Data Block: Duplicate VIC 34.
  Video Data Block: Duplicate VIC 31.
  Video Data Block: Duplicate VIC 16.
  Video Data Block: Duplicate VIC 7.
  Video Data Block: Duplicate VIC 22.
  Missing VCDB, needed for Set Selectable RGB Quantization to avoid interop issues.
EDID:
  Base EDID: Some timings are out of range of the Monitor Ranges:
    Horizontal Freq: 15.625 - 79.976 kHz (Monitor: 27.000 - 81.000 kHz)
  Base EDID: EDID specified 1 extension block(s), but found 3 extension block(s).
  Base EDID: EDID 1.3 requires a Block Map Extension in Block 1 if there are more than 2 blocks in the EDID.
  CTA-861: Native progressive timings are a mix of several resolutions.

EDID conformity: FAIL
