edid-decode (hex):

00 ff ff ff ff ff ff 00 4c a3 43 54 00 00 00 00
00 14 01 04 90 25 17 78 0a 19 35 94 58 55 8d 29
1e 50 54 00 00 00 01 01 01 01 01 01 01 01 01 01
01 01 01 01 01 01 14 40 80 14 71 b0 2d 40 30 20
36 00 6f e6 10 00 00 1a b8 2a 80 14 71 b0 2d 40
30 20 36 00 6f e6 10 00 00 1a 00 00 00 fe 00 43
37 35 31 52 83 31 37 30 43 54 0a 20 00 00 00 00
00 00 41 01 18 00 00 00 00 06 01 0a 20 20 00 c7

----------------

Block 0, Base EDID:
  EDID Structure Version & Revision: 1.4
  Vendor & Product Identification:
    Manufacturer: SEC
    Model: 21571
    Made in: 2010
  Basic Display Parameters & Features:
    Digital display
    Bits per primary color channel: 6
    Digital interface is not defined
    Maximum image size: 37 cm x 23 cm
    Gamma: 2.20
    Supported color formats: RGB 4:4:4, YCrCb 4:4:4
    First detailed timing includes the native pixel format and preferred refresh rate
  Color Characteristics:
    Red  : 0.5781, 0.3447
    Green: 0.3339, 0.5517
    Blue : 0.1601, 0.1201
    White: 0.3134, 0.3291
  Established Timings I & II: none
  Standard Timings: none
  Detailed Timing Descriptors:
    DTD 1:  1920x1200   60.000 Hz   8:5    74.699 kHz 164.040 MHz (367 mm x 230 mm)
                 Hfront   48 Hsync  32 Hback 196 Hpol P
                 Vfront    3 Vsync   6 Vback  36 Vpol N
    DTD 2:  1920x1200   40.000 Hz   8:5    49.800 kHz 109.360 MHz (367 mm x 230 mm)
                 Hfront   48 Hsync  32 Hback 196 Hpol P
                 Vfront    3 Vsync   6 Vback  36 Vpol N
    Alphanumeric Data String: 'C751R'
    Manufacturer-Specified Display Descriptor (0x00): 00 00 00 00 41 01 18 00 00 00 00 06 01 0a 20 20 '....A.........  '
Checksum: 0xc7

----------------

Failures:

Block 0, Base EDID:
  Alphanumeric Data String: Non-printable character.
  Missing Display Product Name.

EDID conformity: FAIL
