edid-decode (hex):

00 ff ff ff ff ff ff 00 4c a3 43 54 00 00 00 00
00 12 01 03 90 21 15 78 0a 87 f5 94 57 4f 8c 27
27 50 54 00 00 00 01 01 01 01 01 01 01 01 01 01
01 01 01 01 01 01 24 40 80 28 71 b0 23 40 64 20
26 00 4b cf 10 00 00 1a c3 2a 80 28 71 b0 23 40
64 20 26 00 4b cf 10 00 00 1a 00 00 00 fe 00 52
58 33 39 32 80 31 35 34 43 54 0a 20 00 00 00 fe
00 00 00 00 00 00 00 00 00 02 01 0a 20 20 00 ed

----------------

Block 0, Base EDID:
  EDID Structure Version & Revision: 1.3
  Vendor & Product Identification:
    Manufacturer: SEC
    Model: 21571
    Made in: 2008
  Basic Display Parameters & Features:
    Digital display
    Maximum image size: 33 cm x 21 cm
    Gamma: 2.20
    RGB color display
    First detailed timing is the preferred timing
  Color Characteristics:
    Red  : 0.5800, 0.3398
    Green: 0.3095, 0.5498
    Blue : 0.1552, 0.1552
    White: 0.3134, 0.3291
  Established Timings I & II: none
  Standard Timings: none
  Detailed Timing Descriptors:
    DTD 1:  1920x1200   59.997954 Hz  16:10    74.097 kHz    164.200000 MHz (331 mm x 207 mm)
                 Hfront  100 Hsync  32 Hback  164 Hpol P
                 Vfront    2 Vsync   6 Vback   27 Vpol N
    DTD 2:  1920x1200   39.999854 Hz  16:10    49.400 kHz    109.470000 MHz (331 mm x 207 mm)
                 Hfront  100 Hsync  32 Hback  164 Hpol P
                 Vfront    2 Vsync   6 Vback   27 Vpol N
    SPWG Module Revision: 26
    SPWG Descriptor #3:
      SPWG PC Maker P/N: 'RX392'
      SPWG LCD Supplier EEDID Revision: 128
      SPWG Manufacturer P/N: '154CT'
    SPWG Descriptor #4:
      SMBUS Values: 0x00 0x00 0x00 0x00 0x00 0x00 0x00 0x00
      LVDS Channels: 2
      Panel Self Test Present
Checksum: 0xed

----------------

Failures:

Block 0, Base EDID:
  Basic Display Parameters & Features: Digital Video Interface Standard set to reserved value 0x10.
  Missing Display Product Name.
  Missing Display Range Limits Descriptor.

EDID conformity: FAIL
