edid-decode (hex):

00 ff ff ff ff ff ff 00 4c a3 43 54 00 00 00 00
00 12 01 03 90 21 15 78 0a 87 f5 94 57 4f 8c 27
27 50 54 00 00 00 01 01 01 01 01 01 01 01 01 01
01 01 01 01 01 01 72 41 80 58 71 b0 21 40 64 20
26 00 4b cf 10 00 00 1a 72 41 80 58 71 b0 21 40
64 20 26 00 4b cf 10 00 00 1a 00 00 00 fe 00 58
58 30 35 35 81 31 35 34 43 54 0a 20 00 00 00 fe
00 00 00 00 00 00 00 00 00 02 01 0a 20 20 00 79

----------------

Block 0, Base EDID:
  EDID Structure Version & Revision: 1.3
  Vendor & Product Identification:
    Manufacturer: SEC
    Model: 21571
    Made in: 2008
  Basic Display Parameters & Features:
    Digital display
    Maximum image size: 33 cm x 21 cm
    Gamma: 2.20
    RGB color display
    First detailed timing is the preferred timing
  Color Characteristics:
    Red  : 0.5800, 0.3398
    Green: 0.3095, 0.5498
    Blue : 0.1552, 0.1552
    White: 0.3134, 0.3291
  Established Timings I & II: none
  Standard Timings: none
  Detailed Timing Descriptors:
    DTD 1:  1920x1200   60.018 Hz   8:5    74.002 kHz 167.540 MHz (331 mm x 207 mm)
                 Hfront  100 Hsync  32 Hback 212 Hpol P
                 Vfront    2 Vsync   6 Vback  25 Vpol N
    DTD 2:  1920x1200   60.018 Hz   8:5    74.002 kHz 167.540 MHz (331 mm x 207 mm)
                 Hfront  100 Hsync  32 Hback 212 Hpol P
                 Vfront    2 Vsync   6 Vback  25 Vpol N
    SPWG Module Revision: 26
    SPWG Descriptor #3:
      SPWG PC Maker P/N: 'XX055'
      SPWG LCD Supplier EEDID Revision: 129
      SPWG Manufacturer P/N: '154CT'
    SPWG Descriptor #4:
      SMBUS Values: 0x00 0x00 0x00 0x00 0x00 0x00 0x00 0x00
      LVDS Channels: 2
      Panel Self Test Present
Checksum: 0x79

----------------

Failures:

Block 0, Base EDID:
  Basic Display Parameters & Features: Digital Video Interface Standard set to reserved value 0x10.
  Missing Display Product Name.
  Missing Display Range Limits Descriptor.

EDID conformity: FAIL
