
EDID (hex):
00ffffffffffff004d108a1400000000
161b0104a51a117806de50a3544c9926
0f505400000001010101010101010101
010101010101bb6260a090402e603020
3a0003ad100000180000001000000000
00000000000000000000000000100000
000000000000000000000000000000fc
004c5131323350314a5833320a2000b6

Extracted contents:
header:          00 ff ff ff ff ff ff 00
serial number:   4d 10 8a 14 00 00 00 00 16 1b
version:         01 04
basic params:    a5 1a 11 78 06
chroma info:     de 50 a3 54 4c 99 26 0f 50 54
established:     00 00 00
standard:        01 01 01 01 01 01 01 01 01 01 01 01 01 01 01 01
descriptor 1:    bb 62 60 a0 90 40 2e 60 30 20 3a 00 03 ad 10 00 00 18
descriptor 2:    00 00 00 10 00 00 00 00 00 00 00 00 00 00 00 00 00 00
descriptor 3:    00 00 00 10 00 00 00 00 00 00 00 00 00 00 00 00 00 00
descriptor 4:    00 00 00 fc 00 4c 51 31 32 33 50 31 4a 58 33 32 0a 20
extensions:      00
checksum:        b6

EDID version: 1.4
Manufacturer: SHP Model 148a Serial Number --
Made in week 22 of 2017
Digital display
8 bits per primary color channel
DisplayPort interface
Maximum image size: 26 cm x 17 cm
Gamma: 2.20
Supported color formats: RGB 4:4:4
Default (sRGB) color space is primary color space
First detailed timing includes the native pixel format and preferred refresh rate
Display x,y Chromaticity:
  Red:   0.6396, 0.3291
  Green: 0.2998, 0.5996
  Blue:  0.1494, 0.0595
  White: 0.3125, 0.3281
Established timings supported:
Standard timings supported:
Detailed mode: Clock 252.750 MHz, 259 mm x 173 mm
               2400 2448 2480 2560 hborder 0
               1600 1603 1613 1646 vborder 0
               -hsync -vsync 
               VertFreq: 59 Hz, HorFreq: 98730 Hz
Dummy block
Dummy block
Monitor name: LQ123P1JX32
Checksum: 0xb6 (valid)
EDID block does NOT conform to EDID 1.4!
	sRGB is signaled, but the chromaticities do not match
	Missing monitor ranges
