
EDID (hex):
00ffffffffffff0004728700c8331091
0b13010368301b78caa985a3544c9926
0f5054bfef80714f8140818081c09500
a940b300d1c01a3680a070381e403020
3500132b21000000000000fd00384c1f
5311000a202020202020000000fc0048
323133480a20202020202020000000ff
004c46383044303032383530300a00e6

Extracted contents:
header:          00 ff ff ff ff ff ff 00
serial number:   04 72 87 00 c8 33 10 91 0b 13
version:         01 03
basic params:    68 30 1b 78 ca
chroma info:     a9 85 a3 54 4c 99 26 0f 50 54
established:     bf ef 80
standard:        71 4f 81 40 81 80 81 c0 95 00 a9 40 b3 00 d1 c0
descriptor 1:    1a 36 80 a0 70 38 1e 40 30 20 35 00 13 2b 21 00 00 00
descriptor 2:    00 00 00 fd 00 38 4c 1f 53 11 00 0a 20 20 20 20 20 20
descriptor 3:    00 00 00 fc 00 48 32 31 33 48 0a 20 20 20 20 20 20 20
descriptor 4:    00 00 00 ff 00 4c 46 38 30 44 30 30 32 38 35 30 30 0a
extensions:      00
checksum:        e6

EDID version: 1.3
Manufacturer: ACR Model 87 Serial Number --
Made in week 11 of 2009
Analog display, Input voltage level: 0.7/0.7 V
Sync: Separate 
Maximum image size: 48 cm x 27 cm
Gamma: 2.20
DPMS levels: Standby Suspend
RGB color display
First detailed timing is preferred timing
Display x,y Chromaticity:
  Red:   0.6386, 0.3300
  Green: 0.2988, 0.5986
  Blue:  0.1503, 0.0585
  White: 0.3134, 0.3291
Established timings supported:
  720x400@70Hz 9:5 HorFreq: 31469 Hz Clock: 28.320 MHz
  640x480@60Hz 4:3 HorFreq: 31469 Hz Clock: 25.175 MHz
  640x480@67Hz 4:3 HorFreq: 35000 Hz Clock: 30.240 MHz
  640x480@72Hz 4:3 HorFreq: 37900 Hz Clock: 31.500 MHz
  640x480@75Hz 4:3 HorFreq: 37500 Hz Clock: 31.500 MHz
  800x600@56Hz 4:3 HorFreq: 35200 Hz Clock: 36.000 MHz
  800x600@60Hz 4:3 HorFreq: 37900 Hz Clock: 40.000 MHz
  800x600@72Hz 4:3 HorFreq: 48100 Hz Clock: 50.000 MHz
  800x600@75Hz 4:3 HorFreq: 46900 Hz Clock: 49.500 MHz
  832x624@75Hz 4:3 HorFreq: 49726 Hz Clock: 57.284 MHz
  1024x768@60Hz 4:3 HorFreq: 48400 Hz Clock: 65.000 MHz
  1024x768@70Hz 4:3 HorFreq: 56500 Hz Clock: 75.000 MHz
  1024x768@75Hz 4:3 HorFreq: 60000 Hz Clock: 78.750 MHz
  1280x1024@75Hz 5:4 HorFreq: 80000 Hz Clock: 135.000 MHz
  1152x870@75Hz 192:145 HorFreq: 67500 Hz Clock: 108.000 MHz
Standard timings supported:
  1152x864@75Hz 4:3 HorFreq: 67500 Hz Clock: 108.000 MHz
  1280x960@60Hz 4:3 HorFreq: 60000 Hz Clock: 108.000 MHz
  1280x1024@60Hz 5:4 HorFreq: 64000 Hz Clock: 108.000 MHz
  1280x720@60Hz 16:9
  1440x900@60Hz 16:10 HorFreq: 55500 Hz Clock: 88.750 MHz
  1600x1200@60Hz 4:3 HorFreq: 75000 Hz Clock: 162.000 MHz
  1680x1050@60Hz 16:10 HorFreq: 64700 Hz Clock: 119.000 MHz
  1920x1080@60Hz 16:9
Detailed mode: Clock 138.500 MHz, 531 mm x 299 mm
               1920 1968 2000 2080 hborder 0
               1080 1083 1088 1110 vborder 0
               -hsync -vsync analog composite 
               VertFreq: 59 Hz, HorFreq: 66586 Hz
Monitor ranges (GTF): 56-76Hz V, 31-83kHz H, max dotclock 170MHz
Monitor name: H213H
Serial number: --
Checksum: 0xe6 (valid)
