
EDID (hex):
00ffffffffffff0009d1667f45540000
341e0104b54627783fdd35ac4f45ac26
105054a56b80d1fcd1e8d1c0b300a9c0
8180810081c0565e00a0a0a029502f20
3500ba892100001a000000ff004e434c
30303536313031390a20000000fd0018
90dede3c010a202020202020000000fc
0042656e5120455833323033520a01c9
020350f1515c5b5a3f40101f22212004
13120301616b2309070783010000e200
c06d030c001000387820006001020367
d85dc4017800036d1a00000203309000
056037082fe305e301e6060701605d3a
f8e300a0a0a0325008209804ba892100
001e0782805070384d400820f80cba89
2100001c0000000000000000000000bd

edid-decode (hex):

00 ff ff ff ff ff ff 00 09 d1 66 7f 45 54 00 00
34 1e 01 04 b5 46 27 78 3f dd 35 ac 4f 45 ac 26
10 50 54 a5 6b 80 d1 fc d1 e8 d1 c0 b3 00 a9 c0
81 80 81 00 81 c0 56 5e 00 a0 a0 a0 29 50 2f 20
35 00 ba 89 21 00 00 1a 00 00 00 ff 00 4e 43 4c
30 30 35 36 31 30 31 39 0a 20 00 00 00 fd 00 18
90 de de 3c 01 0a 20 20 20 20 20 20 00 00 00 fc
00 42 65 6e 51 20 45 58 33 32 30 33 52 0a 01 c9

02 03 50 f1 51 5c 5b 5a 3f 40 10 1f 22 21 20 04
13 12 03 01 61 6b 23 09 07 07 83 01 00 00 e2 00
c0 6d 03 0c 00 10 00 38 78 20 00 60 01 02 03 67
d8 5d c4 01 78 00 03 6d 1a 00 00 02 03 30 90 00
05 60 37 08 2f e3 05 e3 01 e6 06 07 01 60 5d 3a
f8 e3 00 a0 a0 a0 32 50 08 20 98 04 ba 89 21 00
00 1e 07 82 80 50 70 38 4d 40 08 20 f8 0c ba 89
21 00 00 1c 00 00 00 00 00 00 00 00 00 00 00 bd

----------------

Block 0, Base EDID:
  EDID Structure Version & Revision: 1.4
  Vendor & Product Identification:
    Manufacturer: BNQ
    Model: 32614
    Serial Number: 21573
    Made in: week 52 of 2020
  Basic Display Parameters & Features:
    Digital display
    Bits per primary color channel: 10
    DisplayPort interface
    Maximum image size: 70 cm x 39 cm
    Gamma: 2.20
    DPMS levels: Off
    Supported color formats: RGB 4:4:4, YCrCb 4:4:4, YCrCb 4:2:2
    Default (sRGB) color space is primary color space
    First detailed timing includes the native pixel format and preferred refresh rate
    Display is continuous frequency
  Color Characteristics:
    Red  : 0.6748, 0.3095
    Green: 0.2724, 0.6728
    Blue : 0.1484, 0.0654
    White: 0.3134, 0.3291
  Established Timings I & II:
    IBM     :   720x400    70.081663 Hz   9:5     31.467 kHz     28.320000 MHz
    DMT 0x04:   640x480    59.940476 Hz   4:3     31.469 kHz     25.175000 MHz
    DMT 0x06:   640x480    75.000000 Hz   4:3     37.500 kHz     31.500000 MHz
    DMT 0x09:   800x600    60.316541 Hz   4:3     37.879 kHz     40.000000 MHz
    DMT 0x0b:   800x600    75.000000 Hz   4:3     46.875 kHz     49.500000 MHz
    Apple   :   832x624    74.551266 Hz   4:3     49.726 kHz     57.284000 MHz
    DMT 0x10:  1024x768    60.003840 Hz   4:3     48.363 kHz     65.000000 MHz
    DMT 0x12:  1024x768    75.028582 Hz   4:3     60.023 kHz     78.750000 MHz
    DMT 0x24:  1280x1024   75.024675 Hz   5:4     79.976 kHz    135.000000 MHz
    Apple   :  1152x870    75.061550 Hz 192:145   68.681 kHz    100.000000 MHz
  Standard Timings:
    GTF     :  1920x1080  119.999987 Hz  16:9    138.840 kHz    368.759000 MHz
    GTF     :  1920x1080  100.000000 Hz  16:9    114.400 kHz    302.016000 MHz
    DMT 0x52:  1920x1080   60.000000 Hz  16:9     67.500 kHz    148.500000 MHz
    DMT 0x3a:  1680x1050   59.954250 Hz  16:10    65.290 kHz    146.250000 MHz
    DMT 0x53:  1600x900    60.000000 Hz  16:9     60.000 kHz    108.000000 MHz (RB)
    DMT 0x23:  1280x1024   60.019740 Hz   5:4     63.981 kHz    108.000000 MHz
    DMT 0x1c:  1280x800    59.810326 Hz  16:10    49.702 kHz     83.500000 MHz
    DMT 0x55:  1280x720    60.000000 Hz  16:9     45.000 kHz     74.250000 MHz
  Detailed Timing Descriptors:
    DTD 1:  2560x1440   59.950550 Hz  16:9     88.787 kHz    241.500000 MHz (698 mm x 393 mm)
                 Hfront   47 Hsync  32 Hback   81 Hpol P
                 Vfront    3 Vsync   5 Vback   33 Vpol N
    Display Product Serial Number: 'NCL00561019'
    Display Range Limits:
      Monitor ranges (Bare Limits): 24-144 Hz V, 222-222 kHz H, max dotclock 600 MHz
    Display Product Name: 'BenQ EX3203R'
  Extension blocks: 1
Checksum: 0xc9

----------------

Block 1, CTA-861 Extension Block:
  Revision: 3
  Underscans IT Video Formats by default
  Basic audio support
  Supports YCbCr 4:4:4
  Supports YCbCr 4:2:2
  Native detailed modes: 1
  Video Data Block:
    VIC  92:  2560x1080  120.000000 Hz  64:27   150.000 kHz    495.000000 MHz
    VIC  91:  2560x1080  100.000000 Hz  64:27   125.000 kHz    371.250000 MHz
    VIC  90:  2560x1080   60.000000 Hz  64:27    66.000 kHz    198.000000 MHz
    VIC  63:  1920x1080  120.000000 Hz  16:9    135.000 kHz    297.000000 MHz
    VIC  64:  1920x1080  100.000000 Hz  16:9    112.500 kHz    297.000000 MHz
    VIC  16:  1920x1080   60.000000 Hz  16:9     67.500 kHz    148.500000 MHz
    VIC  31:  1920x1080   50.000000 Hz  16:9     56.250 kHz    148.500000 MHz
    VIC  34:  1920x1080   30.000000 Hz  16:9     33.750 kHz     74.250000 MHz
    VIC  33:  1920x1080   25.000000 Hz  16:9     28.125 kHz     74.250000 MHz
    VIC  32:  1920x1080   24.000000 Hz  16:9     27.000 kHz     74.250000 MHz
    VIC   4:  1280x720    60.000000 Hz  16:9     45.000 kHz     74.250000 MHz
    VIC  19:  1280x720    50.000000 Hz  16:9     37.500 kHz     74.250000 MHz
    VIC  18:   720x576    50.000000 Hz  16:9     31.250 kHz     27.000000 MHz
    VIC   3:   720x480    59.940060 Hz  16:9     31.469 kHz     27.000000 MHz
    VIC   1:   640x480    59.940476 Hz   4:3     31.469 kHz     25.175000 MHz
    VIC  97:  3840x2160   60.000000 Hz  16:9    135.000 kHz    594.000000 MHz
    VIC 107:  3840x2160   60.000000 Hz  64:27   135.000 kHz    594.000000 MHz
  Audio Data Block:
    Linear PCM:
      Max channels: 2
      Supported sample rates (kHz): 48 44.1 32
      Supported sample sizes (bits): 24 20 16
  Speaker Allocation Data Block:
    FL/FR - Front Left/Right
  Video Capability Data Block:
    YCbCr quantization: Selectable (via AVI YQ)
    RGB quantization: Selectable (via AVI Q)
    PT scan behavior: No Data
    IT scan behavior: IT video formats not supported
    CE scan behavior: CE video formats not supported
  Vendor-Specific Data Block (HDMI), OUI 00-0C-03:
    Source physical address: 1.0.0.0
    DC_36bit
    DC_30bit
    DC_Y444
    Maximum TMDS clock: 600 MHz
    Extended HDMI video details:
      HDMI VICs:
        HDMI VIC 1:  3840x2160   30.000000 Hz  16:9     67.500 kHz    297.000000 MHz
        HDMI VIC 2:  3840x2160   25.000000 Hz  16:9     56.250 kHz    297.000000 MHz
        HDMI VIC 3:  3840x2160   24.000000 Hz  16:9     54.000 kHz    297.000000 MHz
  Vendor-Specific Data Block (HDMI Forum), OUI C4-5D-D8:
    Version: 1
    Maximum TMDS Character Rate: 600 MHz
    Supports 12-bits/component Deep Color 4:2:0 Pixel Encoding
    Supports 10-bits/component Deep Color 4:2:0 Pixel Encoding
  Vendor-Specific Data Block (AMD), OUI 00-00-1A:
    Version: 2.3
    Minimum Refresh Rate: 48 Hz
    Maximum Refresh Rate: 144 Hz
    Flags 1.x: 0x00
    Flags 2.x: 0x05
    Maximum luminance: 96 (400.000 cd/m^2)
    Minimum luminance: 55 (0.186 cd/m^2)
    Maximum luminance (without local dimming): 8 (59.460 cd/m^2)
    Minimum luminance (without local dimming): 47 (0.020 cd/m^2)
  Colorimetry Data Block:
    xvYCC601
    xvYCC709
    BT2020cYCC
    BT2020YCC
    BT2020RGB
    Gamut Boundary Description Metadata Profile P0
  HDR Static Metadata Data Block:
    Electro optical transfer functions:
      Traditional gamma - SDR luminance range
      Traditional gamma - HDR luminance range
      SMPTE ST2084
    Supported static metadata descriptors:
      Static metadata type 1
    Desired content max luminance: 96 (400.000 cd/m^2)
    Desired content max frame-average luminance: 93 (374.834 cd/m^2)
    Desired content min luminance: 58 (0.207 cd/m^2)
  Detailed Timing Descriptors:
    DTD 2:  2560x1440  143.999210 Hz  16:9    214.559 kHz    583.600000 MHz (698 mm x 393 mm)
                 Hfront    8 Hsync  32 Hback  120 Hpol P
                 Vfront   25 Vsync   8 Vback   17 Vpol P
    DTD 3:  1920x1080  143.850475 Hz  16:9    166.435 kHz    332.870000 MHz (698 mm x 393 mm)
                 Hfront    8 Hsync  32 Hback   40 Hpol N
                 Vfront   63 Vsync   8 Vback    6 Vpol P
Checksum: 0xbd  Unused space in Extension Block: 11 bytes


