edid-decode (hex):

00 ff ff ff ff ff ff 00 09 d1 66 7f 45 54 00 00
01 1e 01 04 b5 46 27 78 3f dd 35 ac 4f 45 ac 26
10 50 54 a5 6b 80 d1 fc d1 e8 d1 c0 b3 00 a9 c0
81 80 81 00 81 c0 56 5e 00 a0 a0 a0 29 50 2f 20
35 00 ba 89 21 00 00 1a 00 00 00 ff 00 33 31 4c
30 30 34 31 39 30 31 39 0a 20 00 00 00 fd 00 18
90 de de 3c 01 0a 20 20 20 20 20 20 00 00 00 fc
00 42 65 6e 51 20 45 58 33 32 30 33 52 0a 01 27

02 03 50 f1 51 5c 5b 5a 3f 40 10 1f 22 21 20 04
13 12 03 01 61 6b 23 09 07 07 83 01 00 00 e2 00
c0 6d 03 0c 00 10 00 38 78 20 00 60 01 02 03 67
d8 5d c4 01 78 00 03 6d 1a 00 00 02 03 30 90 00
03 60 37 08 2f e3 05 e3 01 e6 06 07 01 60 5d 3a
f8 e3 00 a0 a0 a0 32 50 08 20 98 04 ba 89 21 00
00 1e 07 82 80 50 70 38 4d 40 08 20 f8 0c ba 89
21 00 00 1c 00 00 00 00 00 00 00 00 00 00 00 bf

----------------

Block 0, Base EDID:
  EDID Structure Version & Revision: 1.4
  Vendor & Product Identification:
    Manufacturer: BNQ
    Model: 32614
    Serial Number: ...
    Made in: week 1 of 2020
  Basic Display Parameters & Features:
    Digital display
    Bits per primary color channel: 10
    DisplayPort interface
    Maximum image size: 70 cm x 39 cm
    Gamma: 2.20
    DPMS levels: Off
    Supported color formats: RGB 4:4:4, YCrCb 4:4:4, YCrCb 4:2:2
    Default (sRGB) color space is primary color space
    First detailed timing includes the native pixel format and preferred refresh rate
    Display is continuous frequency
  Color Characteristics:
    Red  : 0.6748, 0.3095
    Green: 0.2724, 0.6728
    Blue : 0.1484, 0.0654
    White: 0.3134, 0.3291
  Established Timings I & II:
    IBM     :   720x400    70.082 Hz   9:5    31.467 kHz  28.320 MHz
    DMT 0x04:   640x480    59.940 Hz   4:3    31.469 kHz  25.175 MHz
    DMT 0x06:   640x480    75.000 Hz   4:3    37.500 kHz  31.500 MHz
    DMT 0x09:   800x600    60.317 Hz   4:3    37.879 kHz  40.000 MHz
    DMT 0x0b:   800x600    75.000 Hz   4:3    46.875 kHz  49.500 MHz
    Apple   :   832x624    74.551 Hz   4:3    49.726 kHz  57.284 MHz
    DMT 0x10:  1024x768    60.004 Hz   4:3    48.363 kHz  65.000 MHz
    DMT 0x12:  1024x768    75.029 Hz   4:3    60.023 kHz  78.750 MHz
    DMT 0x24:  1280x1024   75.025 Hz   5:4    79.976 kHz 135.000 MHz
    Apple   :  1152x870    75.062 Hz 192:145  68.681 kHz 100.000 MHz
  Standard Timings:
    CVT     :  1920x1080  119.930 Hz  16:9   139.119 kHz 369.500 MHz (EDID 1.4 source)
    GTF     :  1920x1080  120.000 Hz  16:9   138.840 kHz 368.759 MHz (EDID 1.3 source)
    CVT     :  1920x1080   99.898 Hz  16:9   114.583 kHz 302.500 MHz (EDID 1.4 source)
    GTF     :  1920x1080  100.000 Hz  16:9   114.400 kHz 302.016 MHz (EDID 1.3 source)
    DMT 0x52:  1920x1080   60.000 Hz  16:9    67.500 kHz 148.500 MHz
    DMT 0x3a:  1680x1050   59.954 Hz  16:10   65.290 kHz 146.250 MHz
    DMT 0x53:  1600x900    60.000 Hz  16:9    60.000 kHz 108.000 MHz (RB)
    DMT 0x23:  1280x1024   60.020 Hz   5:4    63.981 kHz 108.000 MHz
    DMT 0x1c:  1280x800    59.810 Hz  16:10   49.702 kHz  83.500 MHz
    DMT 0x55:  1280x720    60.000 Hz  16:9    45.000 kHz  74.250 MHz
  Detailed Timing Descriptors:
    DTD 1:  2560x1440   59.951 Hz  16:9    88.787 kHz 241.500 MHz (698 mm x 393 mm)
                 Hfront   47 Hsync  32 Hback  81 Hpol P
                 Vfront    3 Vsync   5 Vback  33 Vpol N
    Display Product Serial Number: ...
  Display Range Limits:
    Monitor ranges (Bare Limits): 24-144 Hz V, 222-222 kHz H, max dotclock 600 MHz
    Display Product Name: 'BenQ EX3203R'
  Extension blocks: 1
Checksum: 0x27

----------------

Block 1, CTA-861 Extension Block:
  Revision: 3
  Underscans PC formats by default
  Basic audio support
  Supports YCbCr 4:4:4
  Supports YCbCr 4:2:2
  Native detailed modes: 1
  Video Data Block:
    VIC  92:  2560x1080  120.000 Hz  64:27  150.000 kHz 495.000 MHz
    VIC  91:  2560x1080  100.000 Hz  64:27  125.000 kHz 371.250 MHz
    VIC  90:  2560x1080   60.000 Hz  64:27   66.000 kHz 198.000 MHz
    VIC  63:  1920x1080  120.000 Hz  16:9   135.000 kHz 297.000 MHz
    VIC  64:  1920x1080  100.000 Hz  16:9   112.500 kHz 297.000 MHz
    VIC  16:  1920x1080   60.000 Hz  16:9    67.500 kHz 148.500 MHz
    VIC  31:  1920x1080   50.000 Hz  16:9    56.250 kHz 148.500 MHz
    VIC  34:  1920x1080   30.000 Hz  16:9    33.750 kHz  74.250 MHz
    VIC  33:  1920x1080   25.000 Hz  16:9    28.125 kHz  74.250 MHz
    VIC  32:  1920x1080   24.000 Hz  16:9    27.000 kHz  74.250 MHz
    VIC   4:  1280x720    60.000 Hz  16:9    45.000 kHz  74.250 MHz
    VIC  19:  1280x720    50.000 Hz  16:9    37.500 kHz  74.250 MHz
    VIC  18:   720x576    50.000 Hz  16:9    31.250 kHz  27.000 MHz
    VIC   3:   720x480    59.940 Hz  16:9    31.469 kHz  27.000 MHz
    VIC   1:   640x480    59.940 Hz   4:3    31.469 kHz  25.175 MHz
    VIC  97:  3840x2160   60.000 Hz  16:9   135.000 kHz 594.000 MHz
    VIC 107:  3840x2160   60.000 Hz  64:27  135.000 kHz 594.000 MHz
  Audio Data Block:
    Linear PCM:
      Max channels: 2
      Supported sample rates (kHz): 48 44.1 32
      Supported sample sizes (bits): 24 20 16
  Speaker Allocation Data Block:
    FL/FR - Front Left/Right
  Video Capability Data Block:
    YCbCr quantization: Selectable (via AVI YQ)
    RGB quantization: Selectable (via AVI Q)
    PT scan behavior: No Data
    IT scan behavior: Supports both over- and underscan
    CE scan behavior: CE video formats not supported
  Vendor-Specific Data Block (HDMI), OUI 00-0C-03:
    Source physical address: 1.0.0.0
    DC_36bit
    DC_30bit
    DC_Y444
    Maximum TMDS clock: 600 MHz
    Extended HDMI video details:
      HDMI VICs:
        HDMI VIC 1:  3840x2160   30.000 Hz  16:9    67.500 kHz 297.000 MHz
        HDMI VIC 2:  3840x2160   25.000 Hz  16:9    56.250 kHz 297.000 MHz
        HDMI VIC 3:  3840x2160   24.000 Hz  16:9    54.000 kHz 297.000 MHz
  Vendor-Specific Data Block (HDMI Forum), OUI C4-5D-D8:
    Version: 1
    Maximum TMDS Character Rate: 600 MHz
    Supports 12-bits/component Deep Color 4:2:0 Pixel Encoding
    Supports 10-bits/component Deep Color 4:2:0 Pixel Encoding
  Vendor-Specific Data Block (AMD), OUI 00-00-1A:
    02 03 30 90 00 03 60 37 08 2f                   '..0...`7./'
  Colorimetry Data Block:
    xvYCC601
    xvYCC709
    BT2020cYCC
    BT2020YCC
    BT2020RGB
  HDR Static Metadata Data Block:
    Electro optical transfer functions:
      Traditional gamma - SDR luminance range
      Traditional gamma - HDR luminance range
      SMPTE ST2084
    Supported static metadata descriptors:
      Static metadata type 1
    Desired content max luminance: 96 (400.000 cd/m^2)
    Desired content max frame-average luminance: 93 (374.834 cd/m^2)
    Desired content min luminance: 58 (0.207 cd/m^2)
  Detailed Timing Descriptors:
    DTD 2:  2560x1440  143.999 Hz  16:9   214.559 kHz 583.600 MHz (698 mm x 393 mm)
                 Hfront    8 Hsync  32 Hback 120 Hpol P
                 Vfront   25 Vsync   8 Vback  17 Vpol P
    DTD 3:  1920x1080  143.850 Hz  16:9   166.435 kHz 332.870 MHz (698 mm x 393 mm)
                 Hfront    8 Hsync  32 Hback  40 Hpol N
                 Vfront   63 Vsync   8 Vback   6 Vpol P
Checksum: 0xbf

----------------

Warnings:

Block 1, CTA-861 Extension Block:
  Display Product Serial Number is set, so the Serial Number in the Base EDID should be 0.
All Blocks:
  Some timings are out of range of the Monitor Ranges:
    Horizontal Freq: 27.000 - 214.558 kHz (Monitor: 222.000 - 222.000 kHz)

Failures:

Block 0, Base EDID:
  Basic Display Parameters & Features: sRGB is signaled, but the chromaticities do not match.
Block 1, CTA-861 Extension Block:
  Vendor-Specific Data Block (HDMI): HDMI VSDB Max TMDS rate is > 340.
  Vendor-Specific Data Block (HDMI): The HDMI Specification uses EDID 1.3, not 1.4.
  HDMI VIC Codes must have their CTA-861 VIC equivalents in the VSB.
All Blocks:
  GTF timings are used, but the EDID does not signal GTF support.
  CVT timings are used, but the EDID does not signal CVT support.

EDID conformity: FAIL
