edid-decode (hex):

00 ff ff ff ff ff ff 00 0e 14 5a 1b 00 00 00 00
07 11 01 03 80 1a 10 78 0a ee cd 94 53 50 8a 26
21 50 54 00 00 00 01 01 01 01 01 01 01 01 01 01
01 01 01 01 01 01 bc 1b 00 a0 50 20 0d 30 15 20
36 00 05 a3 10 00 00 19 00 00 00 0f 00 20 20 20
20 20 20 20 20 50 a0 02 32 00 00 00 00 fe 00 43
50 54 0a 20 20 20 20 20 20 20 20 20 00 00 00 fe
00 43 4c 41 41 31 32 31 57 41 30 31 41 20 00 11

----------------

Block 0, Base EDID:
  EDID Structure Version & Revision: 1.3
  Vendor & Product Identification:
    Manufacturer: CPT
    Model: 7002
    Made in: week 7 of 2007
  Basic Display Parameters & Features:
    Digital display
    Maximum image size: 26 cm x 16 cm
    Gamma: 2.20
    RGB color display
    First detailed timing is the preferred timing
  Color Characteristics:
    Red  : 0.5810, 0.3261
    Green: 0.3154, 0.5410
    Blue : 0.1513, 0.1289
    White: 0.3154, 0.3291
  Established Timings I & II: none
  Standard Timings: none
  Detailed Timing Descriptors:
    DTD 1:  1280x800    60.646440 Hz  16:10    49.306 kHz     71.000000 MHz (261 mm x 163 mm)
                 Hfront   21 Hsync  32 Hback  107 Hpol N
                 Vfront    3 Vsync   6 Vback    4 Vpol N
    Manufacturer-Specified Display Descriptor (0x0f): 00 0f 00 20 20 20 20 20 20 20 20 50 a0 02 32 00 '...        P..2.'
    Alphanumeric Data String: 'CPT'
    Alphanumeric Data String: 'CLAA121WA01A '
Checksum: 0x11

----------------

Failures:

Block 0, Base EDID:
  Alphanumeric Data String: One or more trailing spaces.
  Missing Display Product Name.
  Missing Display Range Limits Descriptor.

EDID conformity: FAIL
