
EDID (hex):
00ffffffffffff0038a3776701010101
21130103802f1e78ea36c5a4554c9c25
125054bfef8081c0814081808bc09500
9040b300714f21399030621a274018b0
3640da281100001c000000fd00384b1f
5311000a202020202020000000fc0045
323232570a20202020202020000000ff
0039383030323536324e420a2020010e
02010400011d007251d01e206e285500
da281100001e8c0ad08a20e02d10103e
9600da28110000188c0ad09020403120
0c405500da2811000018011d00bc52d0
1e20b8285540da281100001e00000000
00000000000000000000000000000000
00000000000000000000000000000000
0000000000000000000000000000005f

edid-decode (hex):

00 ff ff ff ff ff ff 00 38 a3 77 67 01 01 01 01
21 13 01 03 80 2f 1e 78 ea 36 c5 a4 55 4c 9c 25
12 50 54 bf ef 80 81 c0 81 40 81 80 8b c0 95 00
90 40 b3 00 71 4f 21 39 90 30 62 1a 27 40 18 b0
36 40 da 28 11 00 00 1c 00 00 00 fd 00 38 4b 1f
53 11 00 0a 20 20 20 20 20 20 00 00 00 fc 00 45
32 32 32 57 0a 20 20 20 20 20 20 20 00 00 00 ff
00 39 38 30 30 32 35 36 32 4e 42 0a 20 20 01 0e

02 01 04 00 01 1d 00 72 51 d0 1e 20 6e 28 55 00
da 28 11 00 00 1e 8c 0a d0 8a 20 e0 2d 10 10 3e
96 00 da 28 11 00 00 18 8c 0a d0 90 20 40 31 20
0c 40 55 00 da 28 11 00 00 18 01 1d 00 bc 52 d0
1e 20 b8 28 55 40 da 28 11 00 00 1e 00 00 00 00
00 00 00 00 00 00 00 00 00 00 00 00 00 00 00 00
00 00 00 00 00 00 00 00 00 00 00 00 00 00 00 00
00 00 00 00 00 00 00 00 00 00 00 00 00 00 00 5f

----------------

Block 0, Base EDID:
  EDID Structure Version & Revision: 1.3
  Vendor & Product Identification:
    Manufacturer: NEC
    Model: 26487
    Serial Number: 16843009
    Made in: week 33 of 2009
  Basic Display Parameters & Features:
    Digital display
    Maximum image size: 47 cm x 30 cm
    Gamma: 2.20
    DPMS levels: Standby Suspend Off
    RGB color display
    First detailed timing is the preferred timing
  Color Characteristics:
    Red  : 0.6406, 0.3349
    Green: 0.2978, 0.6113
    Blue : 0.1474, 0.0703
    White: 0.3134, 0.3291
  Established Timings I & II:
    IBM     :   720x400    70.081663 Hz   9:5     31.467 kHz     28.320000 MHz
    DMT 0x04:   640x480    59.940476 Hz   4:3     31.469 kHz     25.175000 MHz
    Apple   :   640x480    66.666667 Hz   4:3     35.000 kHz     30.240000 MHz
    DMT 0x05:   640x480    72.808802 Hz   4:3     37.861 kHz     31.500000 MHz
    DMT 0x06:   640x480    75.000000 Hz   4:3     37.500 kHz     31.500000 MHz
    DMT 0x08:   800x600    56.250000 Hz   4:3     35.156 kHz     36.000000 MHz
    DMT 0x09:   800x600    60.316541 Hz   4:3     37.879 kHz     40.000000 MHz
    DMT 0x0a:   800x600    72.187572 Hz   4:3     48.077 kHz     50.000000 MHz
    DMT 0x0b:   800x600    75.000000 Hz   4:3     46.875 kHz     49.500000 MHz
    Apple   :   832x624    74.551266 Hz   4:3     49.726 kHz     57.284000 MHz
    DMT 0x10:  1024x768    60.003840 Hz   4:3     48.363 kHz     65.000000 MHz
    DMT 0x11:  1024x768    70.069359 Hz   4:3     56.476 kHz     75.000000 MHz
    DMT 0x12:  1024x768    75.028582 Hz   4:3     60.023 kHz     78.750000 MHz
    DMT 0x24:  1280x1024   75.024675 Hz   5:4     79.976 kHz    135.000000 MHz
    Apple   :  1152x870    75.061550 Hz 192:145   68.681 kHz    100.000000 MHz
  Standard Timings:
    DMT 0x55:  1280x720    60.000000 Hz  16:9     45.000 kHz     74.250000 MHz
    DMT 0x20:  1280x960    60.000000 Hz   4:3     60.000 kHz    108.000000 MHz
    DMT 0x23:  1280x1024   60.019740 Hz   5:4     63.981 kHz    108.000000 MHz
    GTF     :  1360x765    60.000341 Hz  16:9     47.520 kHz     84.396000 MHz
    DMT 0x2f:  1440x900    59.887445 Hz  16:10    55.935 kHz    106.500000 MHz
    DMT 0x2a:  1400x1050   59.978442 Hz   4:3     65.317 kHz    121.750000 MHz
    DMT 0x3a:  1680x1050   59.954250 Hz  16:10    65.290 kHz    146.250000 MHz
    DMT 0x15:  1152x864    75.000000 Hz   4:3     67.500 kHz    108.000000 MHz
  Detailed Timing Descriptors:
    DTD 1:  1680x1050   59.954250 Hz  16:10    65.290 kHz    146.250000 MHz (474 mm x 296 mm)
                 Hfront  280 Hsync 176 Hback  104 Hpol N
                 Vfront    3 Vsync   6 Vback   30 Vpol P
    Display Range Limits:
      Monitor ranges (GTF): 56-75 Hz V, 31-83 kHz H, max dotclock 170 MHz
    Display Product Name: 'E222W'
    Display Product Serial Number: '98002562NB'
  Extension blocks: 1
Checksum: 0x0e

----------------

Block 1, CTA-861 Extension Block:
  Revision: 1
  Detailed Timing Descriptors:
    DTD 2:  1280x720    60.000000 Hz  16:9     45.000 kHz     74.250000 MHz (474 mm x 296 mm)
                 Hfront  110 Hsync  40 Hback  220 Hpol P
                 Vfront    5 Vsync   5 Vback   20 Vpol P
    DTD 3:   720x480    59.940060 Hz   3:2     31.469 kHz     27.000000 MHz (474 mm x 296 mm)
                 Hfront   16 Hsync  62 Hback   60 Hpol N
                 Vfront    9 Vsync   6 Vback   30 Vpol N
    DTD 4:   720x576    50.000000 Hz   5:4     31.250 kHz     27.000000 MHz (474 mm x 296 mm)
                 Hfront   12 Hsync  64 Hback   68 Hpol N
                 Vfront    5 Vsync   5 Vback   39 Vpol N
    DTD 5:  1280x720    50.000000 Hz  16:9     37.500 kHz     74.250000 MHz (474 mm x 296 mm)
                 Hfront  440 Hsync  40 Hback  220 Hpol P
                 Vfront    5 Vsync   5 Vback   20 Vpol P
Checksum: 0x5f  Unused space in Extension Block: 51 bytes


