edid-decode (hex):

00 ff ff ff ff ff ff 00 3a d4 3a 56 00 00 00 00
1c 0e 01 03 0e 26 1e 78 e8 2c 9d a6 58 4a 9a 26
21 52 56 bf ef 80 81 80 81 8a 81 8c 71 4f 45 4a
01 01 01 01 01 01 bc 34 00 98 51 00 2a 40 30 70
13 00 7c 2c 11 00 00 06 d6 09 80 a0 20 5e 63 10
10 60 52 08 7c 2c 11 00 00 02 00 00 00 fd 00 32
4b 1e 50 0e 00 0a 20 20 20 20 20 20 00 00 00 fc
00 4e 6f 76 61 74 65 6b 20 20 35 36 33 41 00 75

----------------

Block 0, Base EDID:
  EDID Structure Version & Revision: 1.3
  Vendor & Product Identification:
    Manufacturer: NVT
    Model: 22074
    Made in: week 28 of 2004
  Basic Display Parameters & Features:
    Analog display
    Input voltage level: 0.7/0.3 V
    Sync: Separate Composite SyncOnGreen
    Maximum image size: 38 cm x 30 cm
    Gamma: 2.20
    DPMS levels: Standby Suspend Off
    RGB color display
  Color Characteristics:
    Red  : 0.6484, 0.3457
    Green: 0.2919, 0.6015
    Blue : 0.1503, 0.1298
    White: 0.3232, 0.3369
  Established Timings I & II:
    IBM     :   720x400    70.082 Hz   9:5    31.467 kHz  28.320 MHz
    DMT 0x04:   640x480    59.940 Hz   4:3    31.469 kHz  25.175 MHz
    Apple   :   640x480    66.667 Hz   4:3    35.000 kHz  30.240 MHz
    DMT 0x05:   640x480    72.809 Hz   4:3    37.861 kHz  31.500 MHz
    DMT 0x06:   640x480    75.000 Hz   4:3    37.500 kHz  31.500 MHz
    DMT 0x08:   800x600    56.250 Hz   4:3    35.156 kHz  36.000 MHz
    DMT 0x09:   800x600    60.317 Hz   4:3    37.879 kHz  40.000 MHz
    DMT 0x0a:   800x600    72.188 Hz   4:3    48.077 kHz  50.000 MHz
    DMT 0x0b:   800x600    75.000 Hz   4:3    46.875 kHz  49.500 MHz
    Apple   :   832x624    74.551 Hz   4:3    49.726 kHz  57.284 MHz
    DMT 0x10:  1024x768    60.004 Hz   4:3    48.363 kHz  65.000 MHz
    DMT 0x11:  1024x768    70.069 Hz   4:3    56.476 kHz  75.000 MHz
    DMT 0x12:  1024x768    75.029 Hz   4:3    60.023 kHz  78.750 MHz
    DMT 0x24:  1280x1024   75.025 Hz   5:4    79.976 kHz 135.000 MHz
    Apple   :  1152x870    75.062 Hz 192:145  68.681 kHz 100.000 MHz
  Standard Timings:
    DMT 0x23:  1280x1024   60.020 Hz   5:4    63.981 kHz 108.000 MHz
    GTF     :  1280x1024   70.000 Hz   5:4    74.620 kHz 128.943 MHz
    GTF     :  1280x1024   72.000 Hz   5:4    76.824 kHz 132.752 MHz
    DMT 0x15:  1152x864    75.000 Hz   4:3    67.500 kHz 108.000 MHz
    GTF     :   800x600    70.000 Hz   4:3    43.750 kHz  45.500 MHz
  Detailed Timing Descriptors:
    DTD 1:  1280x1024   75.025 Hz   5:4    79.976 kHz 135.000 MHz (analog composite, serrate, 380 mm x 300 mm)
                 Hfront   48 Hsync 112 Hback 248 Hpol N
                 Vfront    1 Vsync   3 Vback  38 Vpol N
    DTD 2:   640x350    70.100 Hz  64:35   31.475 kHz  25.180 MHz (analog composite, 380 mm x 300 mm)
                 Hfront   16 Hsync  96 Hback  48 Hpol N
                 Vfront   37 Vsync   2 Vback  60 Vpol N
  Display Range Limits:
    Monitor ranges (GTF): 50-75 Hz V, 30-80 kHz H, max dotclock 140 MHz
    Display Product Name: 'Novatek  563A'
Checksum: 0x75
