edid-decode (hex):

00 ff ff ff ff ff ff 00 54 e4 02 11 30 06 20 19
19 1d 01 03 80 1a 0f 78 aa 2d 8f a6 56 53 9b 25
0c 4f 53 21 08 00 71 c0 81 80 81 c0 8b c0 95 00
01 40 b3 01 01 01 02 3a 80 d2 70 38 1e 40 5a 3c
aa 00 00 90 10 00 00 1e 00 00 00 fc 00 41 72 74
69 73 74 20 31 32 20 70 72 6f 00 00 00 10 00 34
47 43 48 30 30 30 30 36 33 0a 20 20 00 00 00 fd
00 3c 3c 1f 46 0f 00 0a 20 20 20 20 20 20 00 26

----------------

Block 0, Base EDID:
  EDID Structure Version & Revision: 1.3
  Vendor & Product Identification:
    Manufacturer: UGD
    Model: 4354
    Serial Number: ...
    Made in: week 25 of 2019
  Basic Display Parameters & Features:
    Digital display
    Maximum image size: 26 cm x 15 cm
    Gamma: 2.20
    DPMS levels: Standby Off
    RGB color display
    First detailed timing is the preferred timing
  Color Characteristics:
    Red  : 0.6484, 0.3378
    Green: 0.3271, 0.6064
    Blue : 0.1464, 0.0468
    White: 0.3115, 0.3271
  Established Timings I & II:
    DMT 0x04:   640x480    59.940476 Hz   4:3     31.469 kHz     25.175000 MHz
    DMT 0x09:   800x600    60.316541 Hz   4:3     37.879 kHz     40.000000 MHz
    DMT 0x10:  1024x768    60.003840 Hz   4:3     48.363 kHz     65.000000 MHz
  Standard Timings:
    GTF     :  1152x648    60.000120 Hz  16:9     40.260 kHz     59.907000 MHz
    DMT 0x23:  1280x1024   60.019740 Hz   5:4     63.981 kHz    108.000000 MHz
    DMT 0x55:  1280x720    60.000000 Hz  16:9     45.000 kHz     74.250000 MHz
    GTF     :  1360x765    60.000341 Hz  16:9     47.520 kHz     84.396000 MHz
    DMT 0x2f:  1440x900    59.887445 Hz  16:10    55.935 kHz    106.500000 MHz
    GTF     :  1680x1050   61.000166 Hz  16:10    66.307 kHz    149.589000 MHz
  Detailed Timing Descriptors:
    DTD 1:  1920x1080   62.809288 Hz  16:9     69.718 kHz    148.500000 MHz (256 mm x 144 mm)
                 Hfront   90 Hsync  60 Hback   60 Hpol P
                 Vfront   10 Vsync  10 Vback   10 Vpol P
    Display Product Name: 'Artist 12 pro'
    Dummy Descriptor:
    Display Range Limits:
      Monitor ranges (GTF): 60-60 Hz V, 31-70 kHz H, max dotclock 150 MHz
Checksum: 0x26

----------------

Warnings:

Block 0, Base EDID:
  Standard Timings: Standard Timing 1360x765 has a dubious odd vertical resolution.

Failures:

Block 0, Base EDID:
  Standard Timings: Use 0x0101 as the invalid Standard Timings code, not 0x0140.
  Dummy Descriptor: Dummy block filled with garbage.
EDID:
  Base EDID: Some timings are out of range of the Monitor Ranges:
    Vertical Freq: 59.887 - 62.809 Hz (Monitor: 60.000 - 60.000 Hz)

EDID conformity: FAIL
