
EDID (hex):
00ffffffffffff00061001ae745fea6d
0c180104b53c227820c805a7554ba026
0c505400000001010101010101010101
0101010101014dd000a0f0703e803020
350055502100001a565e00a0a0a02950
3020350055502100001a000000fc0069
4d61630a2020202020202020000000ff
003339303137433737343546324101a0
020326c0230907078301000070fa1000
00127a31fc78bdcc02908851d368fa10
00f5f9faffffcd9180a0c00834703020
350055502100001a0000000000000000
00000000000000000000000000000000
00000000000000000000000000000000
00000000000000000000000000000000
0000000000000000000000000000003e

edid-decode (hex):

00 ff ff ff ff ff ff 00 06 10 01 ae 74 5f ea 6d
0c 18 01 04 b5 3c 22 78 20 c8 05 a7 55 4b a0 26
0c 50 54 00 00 00 01 01 01 01 01 01 01 01 01 01
01 01 01 01 01 01 4d d0 00 a0 f0 70 3e 80 30 20
35 00 55 50 21 00 00 1a 56 5e 00 a0 a0 a0 29 50
30 20 35 00 55 50 21 00 00 1a 00 00 00 fc 00 69
4d 61 63 0a 20 20 20 20 20 20 20 20 00 00 00 ff
00 33 39 30 31 37 43 37 37 34 35 46 32 41 01 a0

02 03 26 c0 23 09 07 07 83 01 00 00 70 fa 10 00
00 12 7a 31 fc 78 bd cc 02 90 88 51 d3 68 fa 10
00 f5 f9 fa ff ff cd 91 80 a0 c0 08 34 70 30 20
35 00 55 50 21 00 00 1a 00 00 00 00 00 00 00 00
00 00 00 00 00 00 00 00 00 00 00 00 00 00 00 00
00 00 00 00 00 00 00 00 00 00 00 00 00 00 00 00
00 00 00 00 00 00 00 00 00 00 00 00 00 00 00 00
00 00 00 00 00 00 00 00 00 00 00 00 00 00 00 3e

----------------

Block 0, Base EDID:
  EDID Structure Version & Revision: 1.4
  Vendor & Product Identification:
    Manufacturer: APP
    Model: 44545
    Serial Number: 1844076404
    Made in: week 12 of 2014
  Basic Display Parameters & Features:
    Digital display
    Bits per primary color channel: 10
    DisplayPort interface
    Maximum image size: 60 cm x 34 cm
    Gamma: 2.20
    DPMS levels: Off
    Supported color formats: RGB 4:4:4
    First detailed timing does not include the native pixel format and preferred refresh rate
  Color Characteristics:
    Red  : 0.6552, 0.3320
    Green: 0.2949, 0.6250
    Blue : 0.1484, 0.0468
    White: 0.3134, 0.3291
  Established Timings I & II: none
  Standard Timings: none
  Detailed Timing Descriptors:
    DTD 1:  3840x2160   59.996625 Hz  16:9    133.312 kHz    533.250000 MHz (597 mm x 336 mm)
                 Hfront   48 Hsync  32 Hback   80 Hpol P
                 Vfront    3 Vsync   5 Vback   54 Vpol N
    DTD 2:  2560x1440   59.950550 Hz  16:9     88.787 kHz    241.500000 MHz (597 mm x 336 mm)
                 Hfront   48 Hsync  32 Hback   80 Hpol P
                 Vfront    3 Vsync   5 Vback   33 Vpol N
    Display Product Name: 'iMac'
    Display Product Serial Number: '39017C7745F2A'
  Extension blocks: 1
Checksum: 0xa0

----------------

Block 1, CTA-861 Extension Block:
  Revision: 3
  Underscans IT Video Formats by default
  Basic audio support
  Native detailed modes: 0
  Audio Data Block:
    Linear PCM:
      Max channels: 2
      Supported sample rates (kHz): 48 44.1 32
      Supported sample sizes (bits): 24 20 16
  Speaker Allocation Data Block:
    FL/FR - Front Left/Right
  Vendor-Specific Data Block (Apple), OUI 00-10-FA:
    00 12 7a 31 fc 78 bd cc 02 90 88 51 d3          '..z1.x.....Q.'
  Vendor-Specific Data Block (Apple), OUI 00-10-FA:
    f5 f9 fa ff ff                                  '.....'
  Detailed Timing Descriptors:
    DTD 3:  3200x1800   59.981809 Hz  16:9    111.086 kHz    373.250000 MHz (597 mm x 336 mm)
                 Hfront   48 Hsync  32 Hback   80 Hpol P
                 Vfront    3 Vsync   5 Vback   44 Vpol N
Checksum: 0x3e  Unused space in Extension Block: 71 bytes
