
EDID (hex):
00ffffffffffff00061001ae7db4e90c
0c180104b53c227820c805a7554ba026
0c505400000001010101010101010101
0101010101014dd000a0f0703e803020
350055502100001a565e00a0a0a02950
3020350055502100001a000000fc0069
4d61630a2020202020202020000000ff
003339303335443737444234323901a0
020326c0230907078301000070fa1000
00127a31fc78bdcc02908851d368fa10
00f5f9faffffcd9180a0c00834703020
350055502100001a0000000000000000
00000000000000000000000000000000
00000000000000000000000000000000
00000000000000000000000000000000
0000000000000000000000000000003e

Extracted contents:
header:          00 ff ff ff ff ff ff 00
serial number:   06 10 01 ae 7d b4 e9 0c 0c 18
version:         01 04
basic params:    b5 3c 22 78 20
chroma info:     c8 05 a7 55 4b a0 26 0c 50 54
established:     00 00 00
standard:        01 01 01 01 01 01 01 01 01 01 01 01 01 01 01 01
descriptor 1:    4d d0 00 a0 f0 70 3e 80 30 20 35 00 55 50 21 00 00 1a
descriptor 2:    56 5e 00 a0 a0 a0 29 50 30 20 35 00 55 50 21 00 00 1a
descriptor 3:    00 00 00 fc 00 69 4d 61 63 0a 20 20 20 20 20 20 20 20
descriptor 4:    00 00 00 ff 00 33 39 30 33 35 44 37 37 44 42 34 32 39
extensions:      01
checksum:        a0

EDID version: 1.4
Manufacturer: APP Model ae01 Serial Number --
Made in week 12 of 2014
Digital display
10 bits per primary color channel
DisplayPort interface
Maximum image size: 60 cm x 34 cm
Gamma: 2.20
DPMS levels: Off
Supported color formats: RGB 4:4:4
Display x,y Chromaticity:
  Red:   0.6552, 0.3320
  Green: 0.2949, 0.6250
  Blue:  0.1484, 0.0468
  White: 0.3134, 0.3291
Established timings supported:
Standard timings supported:
Detailed mode: Clock 533.250 MHz, 597 mm x 336 mm
               3840 3888 3920 4000 hborder 0
               2160 2163 2168 2222 vborder 0
               +hsync -vsync 
               VertFreq: 59 Hz, HorFreq: 133312 Hz
Detailed mode: Clock 241.500 MHz, 597 mm x 336 mm
               2560 2608 2640 2720 hborder 0
               1440 1443 1448 1481 vborder 0
               +hsync -vsync 
               VertFreq: 59 Hz, HorFreq: 88786 Hz
Monitor name: iMac
Serial number: --
Has 1 extension blocks
Checksum: 0xa0 (valid)

CTA extension block
Extension version: 3
34 bytes of CTA data
  Audio data block
    Linear PCM, max channels 2
      Supported sample rates (kHz): 48 44.1 32
      Supported sample sizes (bits): 24 20 16
  Speaker allocation data block
    Speaker map:
      FL/FR - Front Left/Right
  Vendor-specific data block, OUI 0010fa
  Vendor-specific data block, OUI 0010fa
Underscans PC formats by default
Basic audio support
0 native detailed modes
Detailed mode: Clock 373.250 MHz, 597 mm x 336 mm
               3200 3248 3280 3360 hborder 0
               1800 1803 1808 1852 vborder 0
               +hsync -vsync 
               VertFreq: 59 Hz, HorFreq: 111086 Hz
Checksum: 0x3e (valid)

EDID block does NOT conform to EDID 1.4!
	Required 640x480p60 timings are missing in the established timings
	and/or in the SVD list (VIC 1)
	Missing monitor ranges
EDID block does not conform at all!
	Both the serial number and the serial string are set
