edid-decode (hex):

00 ff ff ff ff ff ff 00 3a c4 00 05 00 00 00 00
2d 0c 01 03 80 20 14 00 ea a8 e0 99 57 4b 92 25
1c 50 54 00 00 00 01 01 01 01 01 01 01 01 01 01
01 01 01 01 01 01 e8 1a 00 82 50 20 0f 30 15 20
44 00 42 c9 10 00 00 1e 00 00 00 fc 00 4e 76 69
64 69 61 20 44 65 66 61 75 6c 00 00 00 fc 00 74
20 46 6c 61 74 20 50 61 6e 65 6c 00 00 00 00 fd
00 00 3d 1d 31 07 00 00 20 20 20 20 20 00 00 db

----------------

Block 0, Base EDID:
  EDID Structure Version & Revision: 1.3
  Vendor & Product Identification:
    Manufacturer: NVD
    Model: 1280
    Made in: week 45 of 2002
  Basic Display Parameters & Features:
    Digital display
    Maximum image size: 32 cm x 20 cm
    Gamma: 1.00
    DPMS levels: Standby Suspend Off
    RGB color display
    First detailed timing is the preferred timing
  Color Characteristics:
    Red  : 0.5996, 0.3417
    Green: 0.2949, 0.5703
    Blue : 0.1474, 0.1113
    White: 0.3125, 0.3281
  Established Timings I & II: none
  Standard Timings: none
  Detailed Timing Descriptors:
    DTD 1:  1280x800    59.940 Hz   8:5    48.851 kHz  68.880 MHz (322 mm x 201 mm)
                 Hfront   21 Hsync  32 Hback  77 Hpol P
                 Vfront    4 Vsync   4 Vback   7 Vpol P
    Display Product Name: 'Nvidia Defaul'
    Display Product Name: 't Flat Panel'
  Display Range Limits:
    Monitor ranges (GTF): 0-61 Hz V, 29-49 kHz H, max dotclock 70 MHz
Checksum: 0xdb

----------------

Failures:

Block 0, Base EDID:
  Display Product Name: Non-printable character.
  Display Range Limits: Byte 11 is 0x00 instead of 0x0a.
  Display Range Limits: Bytes 12-17 must be 0x20.

EDID conformity: FAIL
