edid-decode (hex):

00 ff ff ff ff ff ff 00 1e 6d 57 56 61 8f 03 00
0a 11 01 03 80 34 20 78 ea 5a d5 a7 56 4b 9b 24
13 50 54 a5 4b 00 a9 40 81 8f b3 00 81 4f 81 80
01 01 01 01 01 01 28 3c 80 a0 70 b0 23 40 30 20
36 00 b0 44 11 00 00 1a 48 3f 40 30 62 b0 32 40
40 c0 13 00 b0 44 11 00 00 1e 00 00 00 fd 00 38
4b 1e 53 11 00 0a 20 20 20 20 20 20 00 00 00 fc
00 4c 32 34 36 57 48 0a 20 20 20 20 20 20 01 af

02 03 1c 71 49 90 05 04 03 01 1f 14 12 13 23 09
07 07 83 01 00 00 65 03 0c 00 10 00 02 3a 80 18
71 38 2d 40 58 2c 45 00 06 44 21 00 00 1e 01 1d
80 18 71 1c 16 20 58 2c 25 00 06 44 21 00 00 9e
01 1d 00 72 51 d0 1e 20 6e 28 55 00 06 44 21 00
00 1e 8c 0a d0 8a 20 e0 2d 10 10 3e 96 00 06 44
21 00 00 1e 02 3a 80 d0 72 38 2d 40 10 2c 45 20
06 44 21 00 00 1e 00 00 00 00 00 00 00 00 00 bd

00 ff ff ff ff ff ff 00 1e 6d 57 56 61 8f 03 00
0a 11 01 03 80 34 20 78 ea 5a d5 a7 56 4b 9b 24
13 50 54 a5 4b 00 a9 40 81 8f b3 00 81 4f 81 80
01 01 01 01 01 01 28 3c 80 a0 70 b0 23 40 30 20
36 00 b0 44 11 00 00 1a 48 3f 40 30 62 b0 32 40
40 c0 13 00 b0 44 11 00 00 1e 00 00 00 fd 00 38
4b 1e 53 11 00 0a 20 20 20 20 20 20 00 00 00 fc
00 4c 32 34 36 57 48 0a 20 20 20 20 20 20 01 af

02 03 1c 71 49 90 05 04 03 01 1f 14 12 13 23 09
07 07 83 01 00 00 65 03 0c 00 10 00 02 3a 80 18
71 38 2d 40 58 2c 45 00 06 44 21 00 00 1e 01 1d
80 18 71 1c 16 20 58 2c 25 00 06 44 21 00 00 9e
01 1d 00 72 51 d0 1e 20 6e 28 55 00 06 44 21 00
00 1e 8c 0a d0 8a 20 e0 2d 10 10 3e 96 00 06 44
21 00 00 1e 02 3a 80 d0 72 38 2d 40 10 2c 45 20
06 44 21 00 00 1e 00 00 00 00 00 00 00 00 00 bd

----------------

Block 0, Base EDID:
  EDID Structure Version & Revision: 1.3
  Vendor & Product Identification:
    Manufacturer: GSM
    Model: 22103
    Serial Number: ...
    Made in: week 10 of 2007
  Basic Display Parameters & Features:
    Digital display
    Maximum image size: 52 cm x 32 cm
    Gamma: 2.20
    DPMS levels: Standby Suspend Off
    RGB color display
    First detailed timing is the preferred timing
  Color Characteristics:
    Red  : 0.6533, 0.3369
    Green: 0.2949, 0.6074
    Blue : 0.1435, 0.0751
    White: 0.3134, 0.3291
  Established Timings I & II:
    IBM     :   720x400    70.081663 Hz   9:5     31.467 kHz     28.320000 MHz
    DMT 0x04:   640x480    59.940476 Hz   4:3     31.469 kHz     25.175000 MHz
    DMT 0x06:   640x480    75.000000 Hz   4:3     37.500 kHz     31.500000 MHz
    DMT 0x09:   800x600    60.316541 Hz   4:3     37.879 kHz     40.000000 MHz
    DMT 0x0b:   800x600    75.000000 Hz   4:3     46.875 kHz     49.500000 MHz
    DMT 0x10:  1024x768    60.003840 Hz   4:3     48.363 kHz     65.000000 MHz
    DMT 0x12:  1024x768    75.028582 Hz   4:3     60.023 kHz     78.750000 MHz
    DMT 0x24:  1280x1024   75.024675 Hz   5:4     79.976 kHz    135.000000 MHz
  Standard Timings:
    DMT 0x33:  1600x1200   60.000000 Hz   4:3     75.000 kHz    162.000000 MHz
    DMT 0x24:  1280x1024   75.024675 Hz   5:4     79.976 kHz    135.000000 MHz
    DMT 0x3a:  1680x1050   59.954250 Hz  16:10    65.290 kHz    146.250000 MHz
    GTF     :  1280x960    74.999884 Hz   4:3     75.150 kHz    129.859000 MHz
    DMT 0x23:  1280x1024   60.019740 Hz   5:4     63.981 kHz    108.000000 MHz
  Detailed Timing Descriptors:
    DTD  1:  1920x1200   59.950171 Hz  16:10    74.038 kHz    154.000000 MHz (432 mm x 324 mm)
                  Hfront   48 Hsync  32 Hback   80 Hpol P
                  Vfront    3 Vsync   6 Vback   26 Vpol N
    DTD  2:  1600x1200   60.000000 Hz   4:3     75.000 kHz    162.000000 MHz (432 mm x 324 mm)
                  Hfront   64 Hsync 192 Hback  304 Hpol P
                  Vfront    1 Vsync   3 Vback   46 Vpol P
    Display Range Limits:
      Monitor ranges (GTF): 56-75 Hz V, 30-83 kHz H, max dotclock 170 MHz
    Display Product Name: 'L246WH'
  Extension blocks: 1
Checksum: 0xaf

----------------

Block 1, CTA-861 Extension Block:
  Revision: 3
  Basic audio support
  Supports YCbCr 4:4:4
  Supports YCbCr 4:2:2
  Native detailed modes: 1
  Video Data Block:
    VIC  16:  1920x1080   60.000000 Hz  16:9     67.500 kHz    148.500000 MHz (native)
    VIC   5:  1920x1080i  60.000000 Hz  16:9     33.750 kHz     74.250000 MHz
    VIC   4:  1280x720    60.000000 Hz  16:9     45.000 kHz     74.250000 MHz
    VIC   3:   720x480    59.940060 Hz  16:9     31.469 kHz     27.000000 MHz
    VIC   1:   640x480    59.940476 Hz   4:3     31.469 kHz     25.175000 MHz
    VIC  31:  1920x1080   50.000000 Hz  16:9     56.250 kHz    148.500000 MHz
    VIC  20:  1920x1080i  50.000000 Hz  16:9     28.125 kHz     74.250000 MHz
    VIC  18:   720x576    50.000000 Hz  16:9     31.250 kHz     27.000000 MHz
    VIC  19:  1280x720    50.000000 Hz  16:9     37.500 kHz     74.250000 MHz
  Audio Data Block:
    Linear PCM:
      Max channels: 2
      Supported sample rates (kHz): 48 44.1 32
      Supported sample sizes (bits): 24 20 16
  Speaker Allocation Data Block:
    FL/FR - Front Left/Right
  Vendor-Specific Data Block (HDMI), OUI 00-0C-03:
    Source physical address: 1.0.0.0
  Detailed Timing Descriptors:
    DTD  3:  1920x1080   60.000000 Hz  16:9     67.500 kHz    148.500000 MHz (518 mm x 324 mm)
                  Hfront   88 Hsync  44 Hback  148 Hpol P
                  Vfront    4 Vsync   5 Vback   36 Vpol P
    DTD  4:  1920x1080i  60.000000 Hz  16:9     33.750 kHz     74.250000 MHz (518 mm x 324 mm)
                  Hfront   88 Hsync  44 Hback  148 Hpol P
                  Vfront    2 Vsync   5 Vback   15 Vpol P Vfront +0.5 Odd Field
                  Vfront    2 Vsync   5 Vback   15 Vpol P Vback  +0.5 Even Field
    DTD  5:  1280x720    60.000000 Hz  16:9     45.000 kHz     74.250000 MHz (518 mm x 324 mm)
                  Hfront  110 Hsync  40 Hback  220 Hpol P
                  Vfront    5 Vsync   5 Vback   20 Vpol P
    DTD  6:   720x480    59.940060 Hz   3:2     31.469 kHz     27.000000 MHz (518 mm x 324 mm)
                  Hfront   16 Hsync  62 Hback   60 Hpol P
                  Vfront    9 Vsync   6 Vback   30 Vpol P
    DTD  7:  1920x1080   50.000000 Hz  16:9     56.250 kHz    148.500000 MHz (518 mm x 324 mm)
                  Hfront   16 Hsync 556 Hback  148 Hpol P
                  Vfront    4 Vsync   5 Vback   36 Vpol P
Checksum: 0xbd  Unused space in Extension Block: 9 bytes

----------------

Block 2, Unknown EDID Extension Block 0x00:
  00 ff ff ff ff ff ff 00 1e 6d 57 56 61 8f 03 00 '.........mWVa...'
  0a 11 01 03 80 34 20 78 ea 5a d5 a7 56 4b 9b 24 '.....4 x.Z..VK.$'
  13 50 54 a5 4b 00 a9 40 81 8f b3 00 81 4f 81 80 '.PT.K..@.....O..'
  01 01 01 01 01 01 28 3c 80 a0 70 b0 23 40 30 20 '......(<..p.#@0 '
  36 00 b0 44 11 00 00 1a 48 3f 40 30 62 b0 32 40 '6..D....H?@0b.2@'
  40 c0 13 00 b0 44 11 00 00 1e 00 00 00 fd 00 38 '@....D.........8'
  4b 1e 53 11 00 0a 20 20 20 20 20 20 00 00 00 fc 'K.S...      ....'
  00 4c 32 34 36 57 48 0a 20 20 20 20 20 20 01 af '.L246WH.      ..'
Checksum: 0xaf

----------------

Block 3, CTA-861 Extension Block:
  Revision: 3
  Basic audio support
  Supports YCbCr 4:4:4
  Supports YCbCr 4:2:2
  Native detailed modes: 1
  Video Data Block:
    VIC  16:  1920x1080   60.000000 Hz  16:9     67.500 kHz    148.500000 MHz (native)
    VIC   5:  1920x1080i  60.000000 Hz  16:9     33.750 kHz     74.250000 MHz
    VIC   4:  1280x720    60.000000 Hz  16:9     45.000 kHz     74.250000 MHz
    VIC   3:   720x480    59.940060 Hz  16:9     31.469 kHz     27.000000 MHz
    VIC   1:   640x480    59.940476 Hz   4:3     31.469 kHz     25.175000 MHz
    VIC  31:  1920x1080   50.000000 Hz  16:9     56.250 kHz    148.500000 MHz
    VIC  20:  1920x1080i  50.000000 Hz  16:9     28.125 kHz     74.250000 MHz
    VIC  18:   720x576    50.000000 Hz  16:9     31.250 kHz     27.000000 MHz
    VIC  19:  1280x720    50.000000 Hz  16:9     37.500 kHz     74.250000 MHz
  Audio Data Block:
    Linear PCM:
      Max channels: 2
      Supported sample rates (kHz): 48 44.1 32
      Supported sample sizes (bits): 24 20 16
  Speaker Allocation Data Block:
    FL/FR - Front Left/Right
  Vendor-Specific Data Block (HDMI), OUI 00-0C-03:
    Source physical address: 1.0.0.0
  Detailed Timing Descriptors:
    DTD  8:  1920x1080   60.000000 Hz  16:9     67.500 kHz    148.500000 MHz (518 mm x 324 mm)
                  Hfront   88 Hsync  44 Hback  148 Hpol P
                  Vfront    4 Vsync   5 Vback   36 Vpol P
    DTD  9:  1920x1080i  60.000000 Hz  16:9     33.750 kHz     74.250000 MHz (518 mm x 324 mm)
                  Hfront   88 Hsync  44 Hback  148 Hpol P
                  Vfront    2 Vsync   5 Vback   15 Vpol P Vfront +0.5 Odd Field
                  Vfront    2 Vsync   5 Vback   15 Vpol P Vback  +0.5 Even Field
    DTD 10:  1280x720    60.000000 Hz  16:9     45.000 kHz     74.250000 MHz (518 mm x 324 mm)
                  Hfront  110 Hsync  40 Hback  220 Hpol P
                  Vfront    5 Vsync   5 Vback   20 Vpol P
    DTD 11:   720x480    59.940060 Hz   3:2     31.469 kHz     27.000000 MHz (518 mm x 324 mm)
                  Hfront   16 Hsync  62 Hback   60 Hpol P
                  Vfront    9 Vsync   6 Vback   30 Vpol P
    DTD 12:  1920x1080   50.000000 Hz  16:9     56.250 kHz    148.500000 MHz (518 mm x 324 mm)
                  Hfront   16 Hsync 556 Hback  148 Hpol P
                  Vfront    4 Vsync   5 Vback   36 Vpol P
Checksum: 0xbd  Unused space in Extension Block: 9 bytes

----------------

Warnings:

Block 1, CTA-861 Extension Block:
  IT Video Formats are overscanned by default, but normally this should be underscanned.
  Detailed Timing Descriptor #6: DTD is similar but not identical to VIC 2.
  Detailed Timing Descriptor #7: DTD is similar but not identical to VIC 31.
  Add a Colorimetry Data Block with the sRGB colorimetry bit set to avoid interop issues.
Block 3, CTA-861 Extension Block:
  IT Video Formats are overscanned by default, but normally this should be underscanned.
  Detailed Timing Descriptor #11: DTD is similar but not identical to VIC 2.
  Detailed Timing Descriptor #12: DTD is similar but not identical to VIC 31.
  Add a Colorimetry Data Block with the sRGB colorimetry bit set to avoid interop issues.

Failures:

Block 1, CTA-861 Extension Block:
  Missing VCDB, needed for Set Selectable RGB Quantization to avoid interop issues.
Block 2, Base EDID:
  Unknown Extension Block.
Block 3, CTA-861 Extension Block:
  Video Data Block: Duplicate VIC 16.
  Video Data Block: Duplicate VIC 5.
  Video Data Block: Duplicate VIC 4.
  Video Data Block: Duplicate VIC 3.
  Video Data Block: Duplicate VIC 1.
  Video Data Block: Duplicate VIC 31.
  Video Data Block: Duplicate VIC 20.
  Video Data Block: Duplicate VIC 18.
  Video Data Block: Duplicate VIC 19.
  Speaker Allocation Data Block: Only one instance of this Data Block is allowed.
  Missing VCDB, needed for Set Selectable RGB Quantization to avoid interop issues.
EDID:
  Base EDID: Some timings are out of range of the Monitor Ranges:
    Vertical Freq: 50.000 - 75.029 Hz (Monitor: 56.000 - 75.000 Hz)
    Horizontal Freq: 28.125 - 79.976 kHz (Monitor: 30.000 - 83.000 kHz)
  Base EDID: EDID specified 1 extension block(s), but found 3 extension block(s).
  Base EDID: EDID 1.3 requires a Block Map Extension in Block 1 if there are more than 2 blocks in the EDID.
  CTA-861: Native progressive timings are a mix of several resolutions.

EDID conformity: FAIL
