
EDID (hex):
00ffffffffffff0005e324a50b000000
16220104b53c22783b6fa5af4f3bbb27
0b5054bfef00d1c081803168317c4568
457c6168617c50d000a0f0703e803058
8a0055502100001a000000ff00324f4e
51364a41303030303131000000fc0041
4732373555584d0a20202020000000fd
0c30a57373a0010a2020202020200226
02033cf14c0103051404131f12021190
3f2309070783010000e200eae305c301
e606050191910a741a0000030b30a500
60910a910aa5000000000000a36600a0
f0701f803020350055502100001a65e7
006aa0a067500820980455502100001a
70c200a0a0a055503020350055502100
001e00000000000000000000000000bd
7012790300030150f2070204ff0e3f01
5f807f006f083d000200040004a40184
ff0e9f002f803f006f084f0007000900
2f370204ff0e9f002f803f006f082700
0200040009260204ff0e9f002f003f00
6f082700020004000000000000000000
00000000000000000000000000000000
00000000000000000000000000008090

edid-decode (hex):

00 ff ff ff ff ff ff 00 05 e3 24 a5 0b 00 00 00
16 22 01 04 b5 3c 22 78 3b 6f a5 af 4f 3b bb 27
0b 50 54 bf ef 00 d1 c0 81 80 31 68 31 7c 45 68
45 7c 61 68 61 7c 50 d0 00 a0 f0 70 3e 80 30 58
8a 00 55 50 21 00 00 1a 00 00 00 ff 00 32 4f 4e
51 36 4a 41 30 30 30 30 31 31 00 00 00 fc 00 41
47 32 37 35 55 58 4d 0a 20 20 20 20 00 00 00 fd
0c 30 a5 73 73 a0 01 0a 20 20 20 20 20 20 02 26

02 03 3c f1 4c 01 03 05 14 04 13 1f 12 02 11 90
3f 23 09 07 07 83 01 00 00 e2 00 ea e3 05 c3 01
e6 06 05 01 91 91 0a 74 1a 00 00 03 0b 30 a5 00
60 91 0a 91 0a a5 00 00 00 00 00 00 a3 66 00 a0
f0 70 1f 80 30 20 35 00 55 50 21 00 00 1a 65 e7
00 6a a0 a0 67 50 08 20 98 04 55 50 21 00 00 1a
70 c2 00 a0 a0 a0 55 50 30 20 35 00 55 50 21 00
00 1e 00 00 00 00 00 00 00 00 00 00 00 00 00 bd

70 12 79 03 00 03 01 50 f2 07 02 04 ff 0e 3f 01
5f 80 7f 00 6f 08 3d 00 02 00 04 00 04 a4 01 84
ff 0e 9f 00 2f 80 3f 00 6f 08 4f 00 07 00 09 00
2f 37 02 04 ff 0e 9f 00 2f 80 3f 00 6f 08 27 00
02 00 04 00 09 26 02 04 ff 0e 9f 00 2f 00 3f 00
6f 08 27 00 02 00 04 00 00 00 00 00 00 00 00 00
00 00 00 00 00 00 00 00 00 00 00 00 00 00 00 00
00 00 00 00 00 00 00 00 00 00 00 00 00 00 80 90

----------------

Block 0, Base EDID:
  EDID Structure Version & Revision: 1.4
  Vendor & Product Identification:
    Manufacturer: AOC
    Model: 42276
    Serial Number: 11
    Made in: week 22 of 2024
  Basic Display Parameters & Features:
    Digital display
    Bits per primary color channel: 10
    DisplayPort interface
    Maximum image size: 60 cm x 34 cm
    Gamma: 2.20
    DPMS levels: Off
    Supported color formats: RGB 4:4:4, YCrCb 4:4:4, YCrCb 4:2:2
    First detailed timing includes the native pixel format and preferred refresh rate
    Display is continuous frequency
  Color Characteristics:
    Red  : 0.6845, 0.3105
    Green: 0.2333, 0.7333
    Blue : 0.1542, 0.0449
    White: 0.3134, 0.3291
  Established Timings I & II:
    IBM     :   720x400    70.081663 Hz   9:5     31.467 kHz     28.320000 MHz
    DMT 0x04:   640x480    59.940476 Hz   4:3     31.469 kHz     25.175000 MHz
    Apple   :   640x480    66.666667 Hz   4:3     35.000 kHz     30.240000 MHz
    DMT 0x05:   640x480    72.808802 Hz   4:3     37.861 kHz     31.500000 MHz
    DMT 0x06:   640x480    75.000000 Hz   4:3     37.500 kHz     31.500000 MHz
    DMT 0x08:   800x600    56.250000 Hz   4:3     35.156 kHz     36.000000 MHz
    DMT 0x09:   800x600    60.316541 Hz   4:3     37.879 kHz     40.000000 MHz
    DMT 0x0a:   800x600    72.187572 Hz   4:3     48.077 kHz     50.000000 MHz
    DMT 0x0b:   800x600    75.000000 Hz   4:3     46.875 kHz     49.500000 MHz
    Apple   :   832x624    74.551266 Hz   4:3     49.726 kHz     57.284000 MHz
    DMT 0x10:  1024x768    60.003840 Hz   4:3     48.363 kHz     65.000000 MHz
    DMT 0x11:  1024x768    70.069359 Hz   4:3     56.476 kHz     75.000000 MHz
    DMT 0x12:  1024x768    75.028582 Hz   4:3     60.023 kHz     78.750000 MHz
    DMT 0x24:  1280x1024   75.024675 Hz   5:4     79.976 kHz    135.000000 MHz
  Standard Timings:
    DMT 0x52:  1920x1080   60.000000 Hz  16:9     67.500 kHz    148.500000 MHz
    DMT 0x23:  1280x1024   60.019740 Hz   5:4     63.981 kHz    108.000000 MHz
    GTF     :   640x480    99.999537 Hz   4:3     50.900 kHz     43.163000 MHz
    GTF     :   640x480   119.999084 Hz   4:3     61.800 kHz     52.406000 MHz
    GTF     :   800x600    99.999707 Hz   4:3     63.600 kHz     68.179000 MHz
    GTF     :   800x600   119.999886 Hz   4:3     77.160 kHz     83.950000 MHz
    GTF     :  1024x768   100.000177 Hz   4:3     81.400 kHz    113.309000 MHz
    GTF     :  1024x768   119.999931 Hz   4:3     98.760 kHz    139.054000 MHz
  Detailed Timing Descriptors:
    DTD 1:  3840x2160   60.000000 Hz  16:9    133.320 kHz    533.280000 MHz (597 mm x 336 mm)
                 Hfront   48 Hsync  88 Hback   24 Hpol P
                 Vfront    8 Vsync  10 Vback   44 Vpol N
    Display Product Serial Number: '2ONQ6JA000011'
    Display Product Name: 'AG275UXM'
    Display Range Limits:
      Monitor ranges (Bare Limits): 48-165 Hz V, 370-370 kHz H, max dotclock 1600 MHz
  Extension blocks: 2
Checksum: 0x26

----------------

Block 1, CTA-861 Extension Block:
  Revision: 3
  Underscans IT Video Formats by default
  Basic audio support
  Supports YCbCr 4:4:4
  Supports YCbCr 4:2:2
  Native detailed modes: 1
  Video Data Block:
    VIC   1:   640x480    59.940476 Hz   4:3     31.469 kHz     25.175000 MHz
    VIC   3:   720x480    59.940060 Hz  16:9     31.469 kHz     27.000000 MHz
    VIC   5:  1920x1080i  60.000000 Hz  16:9     33.750 kHz     74.250000 MHz
    VIC  20:  1920x1080i  50.000000 Hz  16:9     28.125 kHz     74.250000 MHz
    VIC   4:  1280x720    60.000000 Hz  16:9     45.000 kHz     74.250000 MHz
    VIC  19:  1280x720    50.000000 Hz  16:9     37.500 kHz     74.250000 MHz
    VIC  31:  1920x1080   50.000000 Hz  16:9     56.250 kHz    148.500000 MHz
    VIC  18:   720x576    50.000000 Hz  16:9     31.250 kHz     27.000000 MHz
    VIC   2:   720x480    59.940060 Hz   4:3     31.469 kHz     27.000000 MHz
    VIC  17:   720x576    50.000000 Hz   4:3     31.250 kHz     27.000000 MHz
    VIC  16:  1920x1080   60.000000 Hz  16:9     67.500 kHz    148.500000 MHz (native)
    VIC  63:  1920x1080  120.000000 Hz  16:9    135.000 kHz    297.000000 MHz
  Audio Data Block:
    Linear PCM:
      Max channels: 2
      Supported sample rates (kHz): 48 44.1 32
      Supported sample sizes (bits): 24 20 16
  Speaker Allocation Data Block:
    FL/FR - Front Left/Right
  Video Capability Data Block:
    YCbCr quantization: Selectable (via AVI YQ)
    RGB quantization: Selectable (via AVI Q)
    PT scan behavior: Always Underscanned
    IT scan behavior: Always Underscanned
    CE scan behavior: Always Underscanned
  Colorimetry Data Block:
    xvYCC601
    xvYCC709
    BT2020YCC
    BT2020RGB
    Gamut Boundary Description Metadata Profile P0
  HDR Static Metadata Data Block:
    Electro optical transfer functions:
      Traditional gamma - SDR luminance range
      SMPTE ST2084
    Supported static metadata descriptors:
      Static metadata type 1
    Desired content max luminance: 145 (1156.145 cd/m^2)
    Desired content max frame-average luminance: 145 (1156.145 cd/m^2)
    Desired content min luminance: 10 (0.018 cd/m^2)
  Vendor-Specific Data Block (AMD), OUI 00-00-1A:
    Version: 3.11
    Minimum Refresh Rate: 48 Hz
    Maximum Refresh Rate: 165 Hz
    Flags 1.x: 0x00
    Flags 2.x: 0x60
    Maximum luminance: 145 (1156.145 cd/m^2)
    Minimum luminance: 10 (0.018 cd/m^2)
    Unknown: 0x91 0x0a
  Detailed Timing Descriptors:
    DTD 2:  3840x2160   29.980602 Hz  16:9     65.688 kHz    262.750000 MHz (597 mm x 336 mm)
                 Hfront   48 Hsync  32 Hback   80 Hpol P
                 Vfront    3 Vsync   5 Vback   23 Vpol N
    DTD 3:  2560x1440  144.001490 Hz  16:9    222.194 kHz    592.370000 MHz (597 mm x 336 mm)
                 Hfront    8 Hsync  32 Hback   66 Hpol P
                 Vfront   25 Vsync   8 Vback   70 Vpol N
    DTD 4:  2560x1440  120.000000 Hz  16:9    183.000 kHz    497.760000 MHz (597 mm x 336 mm)
                 Hfront   48 Hsync  32 Hback   80 Hpol P
                 Vfront    3 Vsync   5 Vback   77 Vpol P
Checksum: 0xbd  Unused space in Extension Block: 13 bytes

----------------

Block 2, DisplayID Extension Block:
  Version: 1.2
  Extension Count: 0
  Display Product Type: Standalone display device
  Video Timing Modes Type 1 - Detailed Timings Data Block:
    DTD:  3840x2160  144.000338 Hz  16:9    319.969 kHz   1331.070000 MHz (aspect 16:9, no 3D stereo)
               Hfront   96 Hsync 128 Hback   96 Hpol P
               Vfront    3 Vsync   5 Vback   54 Vpol N
    DTD:  3840x2160  120.005580 Hz  16:9    268.812 kHz   1075.250000 MHz (aspect 16:9, no 3D stereo, preferred)
               Hfront   48 Hsync  64 Hback   48 Hpol P
               Vfront    8 Vsync  10 Vback   62 Vpol N
    DTD:  3840x2160  165.000000 Hz  16:9    363.000 kHz   1452.000000 MHz (aspect 16:9, no 3D stereo)
               Hfront   48 Hsync  64 Hback   48 Hpol P
               Vfront    3 Vsync   5 Vback   32 Vpol N
    DTD:  3840x2160  160.011364 Hz  16:9    352.025 kHz   1408.100000 MHz (aspect 16:9, no 3D stereo)
               Hfront   48 Hsync  64 Hback   48 Hpol N
               Vfront    3 Vsync   5 Vback   32 Vpol N
  Checksum: 0x80
Checksum: 0x90
