
EDID (hex):
00ffffffffffff001e6d6a771700f8ff
ff1f0103805123782a9e01af4f41ac26
0f505421080001010101010101010101
0101010101014ed470a0d0a046503020
350029623100001a000000ff00234772
4d594d7867774141316f000000fd0018
781e963c010a202020202020000000fc
0033344750393530470a2020202001ad
020337f148101f04130312013f230907
018301000068030c001000383c006ad8
5dc401788000000278e305c000e2006a
e606050178601fc87d70a0d0a0335030
20350029623100001ac4b370a0d0a040
503020350029623100001a796870a0d0
a02e503020350029623100001a6fc200
a0a0a055503020350029623100001aba

Extracted contents:
header:          00 ff ff ff ff ff ff 00
serial number:   1e 6d 6a 77 17 00 f8 ff ff 1f
version:         01 03
basic params:    80 51 23 78 2a
chroma info:     9e 01 af 4f 41 ac 26 0f 50 54
established:     21 08 00
standard:        01 01 01 01 01 01 01 01 01 01 01 01 01 01 01 01
descriptor 1:    4e d4 70 a0 d0 a0 46 50 30 20 35 00 29 62 31 00 00 1a
descriptor 2:    00 00 00 ff 00 23 47 72 4d 59 4d 78 67 77 41 41 31 6f
descriptor 3:    00 00 00 fd 00 18 78 1e 96 3c 01 0a 20 20 20 20 20 20
descriptor 4:    00 00 00 fc 00 33 34 47 50 39 35 30 47 0a 20 20 20 20
extensions:      01
checksum:        ad

EDID version: 1.3
Manufacturer: GSM Model 776a Serial Number --
Digital display
Maximum image size: 81 cm x 35 cm
Gamma: 2.20
DPMS levels: Off
RGB color display
First detailed timing is preferred timing
Display x,y Chromaticity:
  Red:   0.6855, 0.3095
  Green: 0.2568, 0.6738
  Blue:  0.1484, 0.0585
  White: 0.3125, 0.3291
Established timings supported:
  640x480@60Hz 4:3 HorFreq: 31469 Hz Clock: 25.175 MHz
  800x600@60Hz 4:3 HorFreq: 37900 Hz Clock: 40.000 MHz
  1024x768@60Hz 4:3 HorFreq: 48400 Hz Clock: 65.000 MHz
Standard timings supported:
Detailed mode: Clock 543.500 MHz, 809 mm x 354 mm
               3440 3488 3520 3600 hborder 0
               1440 1443 1448 1510 vborder 0
               +hsync -vsync 
               VertFreq: 99 Hz, HorFreq: 150972 Hz
Serial number: --
Monitor ranges (bare limits): 24-120Hz V, 30-150kHz H, max dotclock 600MHz
Monitor name: 34GP950G
Has 1 extension blocks
Checksum: 0xad (valid)

CTA extension block
Extension version: 3
51 bytes of CTA data
  Video data block
    VIC  16 1920x1080@60Hz 16:9  HorFreq: 67500 Hz Clock: 148.500 MHz
    VIC  31 1920x1080@50Hz 16:9  HorFreq: 56250 Hz Clock: 148.500 MHz
    VIC   4 1280x720@60Hz 16:9  HorFreq: 45000 Hz Clock: 74.250 MHz
    VIC  19 1280x720@50Hz 16:9  HorFreq: 37500 Hz Clock: 74.250 MHz
    VIC   3 720x480@60Hz 16:9  HorFreq: 31469 Hz Clock: 27.000 MHz
    VIC  18 720x576@50Hz 16:9  HorFreq: 31250 Hz Clock: 27.000 MHz
    VIC   1 640x480@60Hz 4:3  HorFreq: 31469 Hz Clock: 25.175 MHz
    VIC  63 1920x1080@120Hz 16:9  HorFreq: 135000 Hz Clock: 297.000 MHz
  Audio data block
    Linear PCM, max channels 2
      Supported sample rates (kHz): 48 44.1 32
      Supported sample sizes (bits): 16
  Speaker allocation data block
    Speaker map:
      FL/FR - Front Left/Right
  Vendor-specific data block, OUI 000c03 (HDMI)
    Source physical address 1.0.0.0
    DC_36bit
    DC_30bit
    DC_Y444
    Maximum TMDS clock: 300MHz
  Vendor-specific data block, OUI c45dd8 (HDMI Forum)
    Version: 1
    Maximum TMDS Character Rate: 600MHz
    SCDC Present
  Extended tag: Colorimetry data block
    BT2020YCC
    BT2020RGB
  Extended tag: Video capability data block
    YCbCr quantization: No Data (0)
    RGB quantization: Selectable (via AVI Q) (1)
    PT scan behaviour: Always Underscanned (2)
    IT scan behaviour: Always Underscanned (2)
    CE scan behaviour: Always Underscanned (2)
  Extended tag: HDR static metadata data block
    Electro optical transfer functions:
      Traditional gamma - SDR luminance range
      SMPTE ST2084
    Supported static metadata descriptors:
      Static metadata type 1
    Desired content max luminance: 120 (672.717 cd/m^2)
    Desired content max frame-average luminance: 96 (400.000 cd/m^2)
    Desired content min luminance: 31 (0.099 cd/m^2)
Underscans PC formats by default
Basic audio support
Supports YCbCr 4:4:4
Supports YCbCr 4:2:2
1 native detailed modes
Detailed mode: Clock 322.000 MHz, 809 mm x 354 mm
               3440 3488 3520 3600 hborder 0
               1440 1443 1448 1491 vborder 0
               +hsync -vsync 
               VertFreq: 59 Hz, HorFreq: 89444 Hz
Detailed mode: Clock 460.200 MHz, 809 mm x 354 mm
               3440 3488 3520 3600 hborder 0
               1440 1443 1448 1504 vborder 0
               +hsync -vsync 
               VertFreq: 84 Hz, HorFreq: 127833 Hz
Detailed mode: Clock 267.450 MHz, 809 mm x 354 mm
               3440 3488 3520 3600 hborder 0
               1440 1443 1448 1486 vborder 0
               +hsync -vsync 
               VertFreq: 49 Hz, HorFreq: 74291 Hz
Checksum: 0xba (valid)

EDID block does not conform at all!
	Bad year of manufacture
	Bad week of manufacture
	Both the serial number and the serial string are set
	Detailed blocks filled with garbage
	Range descriptor contains garbage


