edid-decode (hex):

00 ff ff ff ff ff ff 00 30 e4 ca 04 00 00 00 00
00 19 01 04 95 1f 11 78 ea db 85 93 5a 54 91 28
1c 50 54 00 00 00 01 01 01 01 01 01 01 01 01 01
01 01 01 01 01 01 d0 1d 56 f4 50 00 16 30 30 20
35 00 36 ae 10 00 00 19 00 00 00 00 00 00 00 00
00 00 00 00 00 00 00 00 00 00 00 00 00 fe 00 4c
47 20 44 69 73 70 6c 61 79 0a 20 20 00 00 00 fe
00 4c 50 31 34 30 57 48 55 2d 54 50 42 32 00 1d

00 ff ff ff ff ff ff 00 30 e4 ca 04 00 00 00 00
00 19 01 04 95 1f 11 78 ea db 85 93 5a 54 91 28
1c 50 54 00 00 00 01 01 01 01 01 01 01 01 01 01
01 01 01 01 01 01 d0 1d 56 f4 50 00 16 30 30 20
35 00 36 ae 10 00 00 19 00 00 00 00 00 00 00 00
00 00 00 00 00 00 00 00 00 00 00 00 00 fe 00 4c
47 20 44 69 73 70 6c 61 79 0a 20 20 00 00 00 fe
00 4c 50 31 34 30 57 48 55 2d 54 50 42 32 00 1d

----------------

Block 0, Base EDID:
  EDID Structure Version & Revision: 1.4
  Vendor & Product Identification:
    Manufacturer: LGD
    Model: 1226
    Made in: 2015
  Basic Display Parameters & Features:
    Digital display
    Bits per primary color channel: 6
    DisplayPort interface
    Maximum image size: 31 cm x 17 cm
    Gamma: 2.20
    DPMS levels: Standby Suspend Off
    Supported color formats: RGB 4:4:4, YCrCb 4:4:4
    First detailed timing includes the native pixel format and preferred refresh rate
  Color Characteristics:
    Red  : 0.5771, 0.3525
    Green: 0.3300, 0.5693
    Blue : 0.1582, 0.1093
    White: 0.3134, 0.3291
  Established Timings I & II: none
  Standard Timings: none
  Detailed Timing Descriptors:
    DTD 1:  1366x768    60.004717 Hz 683:384   47.404 kHz     76.320000 MHz (310 mm x 174 mm)
                 Hfront   48 Hsync  32 Hback  164 Hpol N
                 Vfront    3 Vsync   5 Vback   14 Vpol N
    Empty Descriptor
    Alphanumeric Data String: 'LG Display'
    Alphanumeric Data String: 'LP140WHU-TPB2'
Checksum: 0x1d

----------------

Block 1, Unknown EDID Extension Block 0x00:
  00 ff ff ff ff ff ff 00 30 e4 ca 04 00 00 00 00 '........0.......'
  00 19 01 04 95 1f 11 78 ea db 85 93 5a 54 91 28 '.......x....ZT.('
  1c 50 54 00 00 00 01 01 01 01 01 01 01 01 01 01 '.PT.............'
  01 01 01 01 01 01 d0 1d 56 f4 50 00 16 30 30 20 '........V.P..00 '
  35 00 36 ae 10 00 00 19 00 00 00 00 00 00 00 00 '5.6.............'
  00 00 00 00 00 00 00 00 00 00 00 00 00 fe 00 4c '...............L'
  47 20 44 69 73 70 6c 61 79 0a 20 20 00 00 00 fe 'G Display.  ....'
  00 4c 50 31 34 30 57 48 55 2d 54 50 42 32 00 1d '.LP140WHU-TPB2..'
Checksum: 0x1d

----------------

Warnings:

Block 0, Base EDID:
  Missing Display Product Name.

Failures:

Block 0, Base EDID:
  Empty Descriptor: Use Dummy Descriptor instead of all zeroes.
Block 1, Base EDID:
  Unknown Extension Block.
EDID:
  Base EDID: EDID specified 0 extension block(s), but found 1 extension block(s).

EDID conformity: FAIL
