edid-decode (hex):

00 ff ff ff ff ff ff 00 06 10 1c 92 f5 7a 00 02
12 11 01 03 80 31 1f 78 2e fd 45 a3 57 4a 9e 25
13 50 54 00 00 00 d1 00 01 01 01 01 01 01 01 01
01 01 01 01 01 01 28 3c 80 a0 70 b0 23 40 30 20
36 00 ef 36 11 00 00 1a 00 00 00 ff 00 32 41 37
31 38 30 4e 33 58 4d 4e 0a 20 00 00 00 fc 00 43
69 6e 65 6d 61 20 48 44 0a 20 20 20 00 00 00 00
00 00 00 00 00 00 00 00 00 00 00 00 00 00 01 38

----------------

Block 0, Base EDID:
  EDID Structure Version & Revision: 1.3
  Vendor & Product Identification:
    Manufacturer: APP
    Model: 37404
    Serial Number: ...
    Made in: week 18 of 2007
  Basic Display Parameters & Features:
    Digital display
    Maximum image size: 49 cm x 31 cm
    Gamma: 2.20
    DPMS levels: Off
    RGB color display
    Default (sRGB) color space is primary color space
    First detailed timing is the preferred timing
  Color Characteristics:
    Red  : 0.6396, 0.3427
    Green: 0.2919, 0.6181
    Blue : 0.1455, 0.0742
    White: 0.3134, 0.3291
  Established Timings I & II: none
  Standard Timings:
    DMT 0x45:  1920x1200   59.884600 Hz  16:10    74.556 kHz    193.250000 MHz
  Detailed Timing Descriptors:
    DTD 1:  1920x1200   59.950171 Hz  16:10    74.038 kHz    154.000000 MHz (495 mm x 310 mm)
                 Hfront   48 Hsync  32 Hback   80 Hpol P
                 Vfront    3 Vsync   6 Vback   26 Vpol N
    Display Product Serial Number: ...
    Display Product Name: 'Cinema HD'
    Empty Descriptor
  Extension blocks: 1
Checksum: 0x38

----------------

Failures:

Block 0, Base EDID:
  Basic Display Parameters & Features: sRGB is signaled, but the chromaticities do not match.
  Empty Descriptor: Use Dummy Descriptor instead of all zeroes.
  Missing Display Range Limits Descriptor.
EDID:
  Base EDID: EDID specified 1 extension block(s), but found 0 extension block(s).

EDID conformity: FAIL
