
EDID (hex):
00ffffffffffff0006101c9280ab0102
1012010380311f782efd45a3574a9e25
135054000000d1000101010101010101
010101010101283c80a070b023403020
3600ef361100001a000000ff00324138
3136313432584d4e0a20000000fc0043
696e656d612048440a20202000000000
00000000000000000000000000000197
400102000000007e2401a500ffff031a
1aa80100000000004000000000000000
00000000000000000000000000000000
00000000000000000000000000000000
00000000000000000000000000000000
00000000000000000000000000000000
00000000000000000000000000000000
00000000000000000000000000000057

edid-decode (hex):

00 ff ff ff ff ff ff 00 06 10 1c 92 80 ab 01 02
10 12 01 03 80 31 1f 78 2e fd 45 a3 57 4a 9e 25
13 50 54 00 00 00 d1 00 01 01 01 01 01 01 01 01
01 01 01 01 01 01 28 3c 80 a0 70 b0 23 40 30 20
36 00 ef 36 11 00 00 1a 00 00 00 ff 00 32 41 38
31 36 31 34 32 58 4d 4e 0a 20 00 00 00 fc 00 43
69 6e 65 6d 61 20 48 44 0a 20 20 20 00 00 00 00
00 00 00 00 00 00 00 00 00 00 00 00 00 00 01 97

40 01 02 00 00 00 00 7e 24 01 a5 00 ff ff 03 1a
1a a8 01 00 00 00 00 00 40 00 00 00 00 00 00 00
00 00 00 00 00 00 00 00 00 00 00 00 00 00 00 00
00 00 00 00 00 00 00 00 00 00 00 00 00 00 00 00
00 00 00 00 00 00 00 00 00 00 00 00 00 00 00 00
00 00 00 00 00 00 00 00 00 00 00 00 00 00 00 00
00 00 00 00 00 00 00 00 00 00 00 00 00 00 00 00
00 00 00 00 00 00 00 00 00 00 00 00 00 00 00 57

----------------

Block 0, Base EDID:
  EDID Structure Version & Revision: 1.3
  Vendor & Product Identification:
    Manufacturer: APP
    Model: 37404
    Serial Number: 33663872
    Made in: week 16 of 2008
  Basic Display Parameters & Features:
    Digital display
    Maximum image size: 49 cm x 31 cm
    Gamma: 2.20
    DPMS levels: Off
    RGB color display
    Default (sRGB) color space is primary color space
    First detailed timing is the preferred timing
  Color Characteristics:
    Red  : 0.6396, 0.3427
    Green: 0.2919, 0.6181
    Blue : 0.1455, 0.0742
    White: 0.3134, 0.3291
  Established Timings I & II: none
  Standard Timings:
    DMT 0x45:  1920x1200   59.884600 Hz  16:10    74.556 kHz    193.250000 MHz
  Detailed Timing Descriptors:
    DTD 1:  1920x1200   59.950171 Hz  16:10    74.038 kHz    154.000000 MHz (495 mm x 310 mm)
                 Hfront   48 Hsync  32 Hback   80 Hpol P
                 Vfront    3 Vsync   6 Vback   26 Vpol N
    Display Product Serial Number: '2A816142XMN'
    Display Product Name: 'Cinema HD'
    Empty Descriptor
  Extension blocks: 1
Checksum: 0x97

----------------

Block 1, Display Information Extension Block:
  Version: 1
  Digital Interface:
    Supported Digital Interface: DVI Single Link
    Data Enable Signal Usage Not Available
    Edge of Shift Clock: Use both edges of shift clock
    HDCP is supported
    Digital Receivers support Double Clocking of Input Data
    Packetized Digital Video is supported
    Data Formats: 24-Bit MSB-Aligned RGB (Single Link)
    Minimum Pixel Clock Frequency Per Link: 1 MHz
    Maximum Pixel Clock Frequency Per Link: 165 MHz
    Crossover Frequency: None - Single Link
  Display Device:
    Sub-Pixel Layout: Quad Pixel - G at bottom left & top right
    Sub-Pixel Configuration: Unknown (0x1a)
    Sub-Pixel Shape: Unknown (0x1a)
    Horizontal Dot/Pixel Pitch: 1.68 mm
    Vertical Dot/Pixel Pitch: 0.01 mm
    Display Device does not have a Fixed Pixel Format
    View Direction: Not specified
    Display Device uses non-transparent background
    Physical Implementation: Not specified
    Monitor/display does not support DDC/CI
  Display Capabities & Feature Support Set:
    Legacy Modes: Not all VGA/DOS Legacy Timing Modes are supported
    Stereo Video: No direct stereo
    Scaler On Board: No
    Image Centering: No
    Conditional Update: No
    Interlaced Video: No
    Frame Lock: No
    Frame Rate Conversion: Not supported
    Vertical Frequency: Not available
    Horizontal Frequency: 0.64 kHz
    Display/Scan Orientation Definition Type: Not defined
    Screen Orientation: Landscape
    Zero Pixel Location: Upper Left
    Scan Direction: Not defined
    Standalone Projector: No
    Default Color/Luminance Decoding: Not defined
    Preferred Color/Luminance Decoder: Uses Default Decoding
    Color/Luminance Decoding Capabilities: None
    Dithering: No
    Supported Color Bit-Depth of Sub-Channel 0 (Blue): No Information
    Supported Color Bit-Depth of Sub-Channel 1 (Green): No Information
    Supported Color Bit-Depth of Sub-Channel 2 (Red): No Information
    Supported Color Bit-Depth of Sub-Channel 0 (Cb/Pb): No Information
    Supported Color Bit-Depth of Sub-Channel 1 (Y): No Information
    Supported Color Bit-Depth of Sub-Channel 2 (Cr/Pr): No Information
    Aspect Ratio Conversion Modes: None
  Display Transfer Characteristics - Gamma:
    No Display Transfer Characteristics
Checksum: 0x57
