
EDID (hex):
00ffffffffffff0022647766f91a0000
23140103682917782a8210a4564f9d24
125054bfee0081c08100810f310a314a
010101010101662156aa51001e30468f
33009ae61000001e000000ff00303335
534a3342593036393035000000fd0038
4b1e3d0b000a202020202020000000fc
00485a313934410a2020202020200025

Extracted contents:
header:          00 ff ff ff ff ff ff 00
serial number:   22 64 77 66 f9 1a 00 00 23 14
version:         01 03
basic params:    68 29 17 78 2a
chroma info:     82 10 a4 56 4f 9d 24 12 50 54
established:     bf ee 00
standard:        81 c0 81 00 81 0f 31 0a 31 4a 01 01 01 01 01 01
descriptor 1:    66 21 56 aa 51 00 1e 30 46 8f 33 00 9a e6 10 00 00 1e
descriptor 2:    00 00 00 ff 00 30 33 35 53 4a 33 42 59 30 36 39 30 35
descriptor 3:    00 00 00 fd 00 38 4b 1e 3d 0b 00 0a 20 20 20 20 20 20
descriptor 4:    00 00 00 fc 00 48 5a 31 39 34 41 0a 20 20 20 20 20 20
extensions:      00
checksum:        25

EDID version: 1.3
Manufacturer: HSD Model 6677 Serial Number --
Made in week 35 of 2010
Analog display, Input voltage level: 0.7/0.7 V
Sync: Separate 
Maximum image size: 41 cm x 23 cm
Gamma: 2.20
DPMS levels: Off
RGB color display
First detailed timing is preferred timing
Display x,y Chromaticity:
  Red:   0.6425, 0.3359
  Green: 0.3085, 0.6152
  Blue:  0.1406, 0.0712
  White: 0.3125, 0.3281
Established timings supported:
  720x400@70Hz 9:5 HorFreq: 31469 Hz Clock: 28.320 MHz
  640x480@60Hz 4:3 HorFreq: 31469 Hz Clock: 25.175 MHz
  640x480@67Hz 4:3 HorFreq: 35000 Hz Clock: 30.240 MHz
  640x480@72Hz 4:3 HorFreq: 37900 Hz Clock: 31.500 MHz
  640x480@75Hz 4:3 HorFreq: 37500 Hz Clock: 31.500 MHz
  800x600@56Hz 4:3 HorFreq: 35200 Hz Clock: 36.000 MHz
  800x600@60Hz 4:3 HorFreq: 37900 Hz Clock: 40.000 MHz
  800x600@72Hz 4:3 HorFreq: 48100 Hz Clock: 50.000 MHz
  800x600@75Hz 4:3 HorFreq: 46900 Hz Clock: 49.500 MHz
  832x624@75Hz 4:3 HorFreq: 49726 Hz Clock: 57.284 MHz
  1024x768@60Hz 4:3 HorFreq: 48400 Hz Clock: 65.000 MHz
  1024x768@70Hz 4:3 HorFreq: 56500 Hz Clock: 75.000 MHz
  1024x768@75Hz 4:3 HorFreq: 60000 Hz Clock: 78.750 MHz
Standard timings supported:
  1280x720@60Hz 16:9
  1280x800@60Hz 16:10
  1280x800@75Hz 16:10
  640x400@70Hz 16:10
  640x480@70Hz 4:3
Detailed mode: Clock 85.500 MHz, 410 mm x 230 mm
               1366 1436 1579 1792 hborder 0
                768  771  774  798 vborder 0
               +hsync +vsync 
               VertFreq: 59 Hz, HorFreq: 47712 Hz
Serial number: --
Monitor ranges (GTF): 56-75Hz V, 30-61kHz H, max dotclock 110MHz
Monitor name: HZ194A
Checksum: 0x25 (valid)
