
EDID (hex):
00ffffffffffff003669e13cffffffff
17220104b53c21783b2cf1a7564e9f24
0e50543fcf0081809500b30001010101
010101010101023a801871382d40582c
450056502100001e000000fd0030b4c8
c832010a202020202020000000fc004d
5349204d4147203237433646000000ff
004345314d3137343630313233340113
02032af44901020304901112139f2309
070783010000681a0000010130b400e3
05e301e60607015a5a25fb8180a07038
1f402040450056502100001ef29480a0
70381f402040450056502100001e56a2
80a070381e403030350056502100001e
526c80a070381f402040450056502100
001e00000000000000000000000000fb

edid-decode (hex):

00 ff ff ff ff ff ff 00 36 69 e1 3c ff ff ff ff
17 22 01 04 b5 3c 21 78 3b 2c f1 a7 56 4e 9f 24
0e 50 54 3f cf 00 81 80 95 00 b3 00 01 01 01 01
01 01 01 01 01 01 02 3a 80 18 71 38 2d 40 58 2c
45 00 56 50 21 00 00 1e 00 00 00 fd 00 30 b4 c8
c8 32 01 0a 20 20 20 20 20 20 00 00 00 fc 00 4d
53 49 20 4d 41 47 20 32 37 43 36 46 00 00 00 ff
00 43 45 31 4d 31 37 34 36 30 31 32 33 34 01 13

02 03 2a f4 49 01 02 03 04 90 11 12 13 9f 23 09
07 07 83 01 00 00 68 1a 00 00 01 01 30 b4 00 e3
05 e3 01 e6 06 07 01 5a 5a 25 fb 81 80 a0 70 38
1f 40 20 40 45 00 56 50 21 00 00 1e f2 94 80 a0
70 38 1f 40 20 40 45 00 56 50 21 00 00 1e 56 a2
80 a0 70 38 1e 40 30 30 35 00 56 50 21 00 00 1e
52 6c 80 a0 70 38 1f 40 20 40 45 00 56 50 21 00
00 1e 00 00 00 00 00 00 00 00 00 00 00 00 00 fb

----------------

Block 0, Base EDID:
  EDID Structure Version & Revision: 1.4
  Vendor & Product Identification:
    Manufacturer: MSI
    Model: 15585
    Serial Number: 4294967295
    Made in: week 23 of 2024
  Basic Display Parameters & Features:
    Digital display
    Bits per primary color channel: 10
    DisplayPort interface
    Maximum image size: 60 cm x 33 cm
    Gamma: 2.20
    DPMS levels: Off
    Supported color formats: RGB 4:4:4, YCrCb 4:4:4, YCrCb 4:2:2
    First detailed timing includes the native pixel format and preferred refresh rate
    Display is continuous frequency
  Color Characteristics:
    Red  : 0.6523, 0.3378
    Green: 0.3076, 0.6210
    Blue : 0.1435, 0.0576
    White: 0.3125, 0.3291
  Established Timings I & II:
    DMT 0x04:   640x480    59.940476 Hz   4:3     31.469 kHz     25.175000 MHz
    Apple   :   640x480    66.666667 Hz   4:3     35.000 kHz     30.240000 MHz
    DMT 0x05:   640x480    72.808802 Hz   4:3     37.861 kHz     31.500000 MHz
    DMT 0x06:   640x480    75.000000 Hz   4:3     37.500 kHz     31.500000 MHz
    DMT 0x08:   800x600    56.250000 Hz   4:3     35.156 kHz     36.000000 MHz
    DMT 0x09:   800x600    60.316541 Hz   4:3     37.879 kHz     40.000000 MHz
    DMT 0x0a:   800x600    72.187572 Hz   4:3     48.077 kHz     50.000000 MHz
    DMT 0x0b:   800x600    75.000000 Hz   4:3     46.875 kHz     49.500000 MHz
    DMT 0x10:  1024x768    60.003840 Hz   4:3     48.363 kHz     65.000000 MHz
    DMT 0x11:  1024x768    70.069359 Hz   4:3     56.476 kHz     75.000000 MHz
    DMT 0x12:  1024x768    75.028582 Hz   4:3     60.023 kHz     78.750000 MHz
    DMT 0x24:  1280x1024   75.024675 Hz   5:4     79.976 kHz    135.000000 MHz
  Standard Timings:
    DMT 0x23:  1280x1024   60.019740 Hz   5:4     63.981 kHz    108.000000 MHz
    DMT 0x2f:  1440x900    59.887445 Hz  16:10    55.935 kHz    106.500000 MHz
    DMT 0x3a:  1680x1050   59.954250 Hz  16:10    65.290 kHz    146.250000 MHz
  Detailed Timing Descriptors:
    DTD 1:  1920x1080   60.000000 Hz  16:9     67.500 kHz    148.500000 MHz (598 mm x 336 mm)
                 Hfront   88 Hsync  44 Hback  148 Hpol P
                 Vfront    4 Vsync   5 Vback   36 Vpol P
    Display Range Limits:
      Monitor ranges (Bare Limits): 48-180 Hz V, 200-200 kHz H, max dotclock 500 MHz
    Display Product Name: 'MSI MAG 27C6F'
    Display Product Serial Number: 'CE1M174601234'
  Extension blocks: 1
Checksum: 0x13

----------------

Block 1, CTA-861 Extension Block:
  Revision: 3
  Underscans IT Video Formats by default
  Basic audio support
  Supports YCbCr 4:4:4
  Supports YCbCr 4:2:2
  Native detailed modes: 4
  Video Data Block:
    VIC   1:   640x480    59.940476 Hz   4:3     31.469 kHz     25.175000 MHz
    VIC   2:   720x480    59.940060 Hz   4:3     31.469 kHz     27.000000 MHz
    VIC   3:   720x480    59.940060 Hz  16:9     31.469 kHz     27.000000 MHz
    VIC   4:  1280x720    60.000000 Hz  16:9     45.000 kHz     74.250000 MHz
    VIC  16:  1920x1080   60.000000 Hz  16:9     67.500 kHz    148.500000 MHz (native)
    VIC  17:   720x576    50.000000 Hz   4:3     31.250 kHz     27.000000 MHz
    VIC  18:   720x576    50.000000 Hz  16:9     31.250 kHz     27.000000 MHz
    VIC  19:  1280x720    50.000000 Hz  16:9     37.500 kHz     74.250000 MHz
    VIC  31:  1920x1080   50.000000 Hz  16:9     56.250 kHz    148.500000 MHz (native)
  Audio Data Block:
    Linear PCM:
      Max channels: 2
      Supported sample rates (kHz): 48 44.1 32
      Supported sample sizes (bits): 24 20 16
  Speaker Allocation Data Block:
    FL/FR - Front Left/Right
  Vendor-Specific Data Block (AMD), OUI 00-00-1A:
    Version: 1.1
    Minimum Refresh Rate: 48 Hz
    Maximum Refresh Rate: 180 Hz
    Flags 1.x: 0x00
  Colorimetry Data Block:
    xvYCC601
    xvYCC709
    BT2020cYCC
    BT2020YCC
    BT2020RGB
    Gamut Boundary Description Metadata Profile P0
  HDR Static Metadata Data Block:
    Electro optical transfer functions:
      Traditional gamma - SDR luminance range
      Traditional gamma - HDR luminance range
      SMPTE ST2084
    Supported static metadata descriptors:
      Static metadata type 1
    Desired content max luminance: 90 (351.250 cd/m^2)
    Desired content max frame-average luminance: 90 (351.250 cd/m^2)
    Desired content min luminance: 37 (0.074 cd/m^2)
  Detailed Timing Descriptors:
    DTD 2:  1920x1080  143.992765 Hz  16:9    159.976 kHz    332.750000 MHz (598 mm x 336 mm)
                 Hfront   32 Hsync  64 Hback   64 Hpol P
                 Vfront    4 Vsync   5 Vback   22 Vpol P
    DTD 3:  1920x1080  165.002077 Hz  16:9    183.317 kHz    381.300000 MHz (598 mm x 336 mm)
                 Hfront   32 Hsync  64 Hback   64 Hpol P
                 Vfront    4 Vsync   5 Vback   22 Vpol P
    DTD 4:  1920x1080  179.998267 Hz  16:9    199.798 kHz    415.580000 MHz (598 mm x 336 mm)
                 Hfront   48 Hsync  48 Hback   64 Hpol P
                 Vfront    3 Vsync   5 Vback   22 Vpol P
    DTD 5:  1920x1080  119.997577 Hz  16:9    133.317 kHz    277.300000 MHz (598 mm x 336 mm)
                 Hfront   32 Hsync  64 Hback   64 Hpol P
                 Vfront    4 Vsync   5 Vback   22 Vpol P
Checksum: 0xfb  Unused space in Extension Block: 13 bytes
