edid-decode (hex):

00 ff ff ff ff ff ff 00 4c 2d c7 71 30 4c 47 30
15 20 01 03 80 34 21 78 2a 3d b5 aa 54 4c a1 24
0c 50 54 bf cf 80 81 c0 81 00 81 80 95 00 a9 c0
b3 00 71 4f 01 01 af 4b 80 a0 70 b0 2b 40 30 20
36 00 07 44 21 00 00 1a 00 00 00 fd 00 32 4b 1e
5e 14 00 0a 20 20 20 20 20 20 00 00 00 fc 00 4c
46 32 34 54 34 35 30 47 0a 20 20 20 00 00 00 ff
00 48 4e 4d 54 35 30 32 33 37 35 0a 20 20 01 ef

02 03 1b f1 46 90 04 1f 13 03 12 23 09 07 07 83
01 00 00 67 03 0c 00 10 00 80 28 28 3c 80 a0 70
b0 23 40 30 20 36 00 07 44 21 00 00 1a 8c 0a d0
90 20 40 31 20 0c 40 55 00 07 44 21 00 00 18 8c
0a d0 8a 20 e0 2d 10 10 3e 96 00 07 44 21 00 00
18 01 1d 00 72 51 d0 1e 20 6e 28 55 00 07 44 21
00 00 1e 2a 44 80 a0 70 38 27 40 30 20 35 00 07
44 21 00 00 1a 00 00 00 00 00 00 00 00 00 00 62

00 ff ff ff ff ff ff 00 4c 2d c7 71 30 4c 47 30
15 20 01 03 80 34 21 78 2a 3d b5 aa 54 4c a1 24
0c 50 54 bf cf 80 81 c0 81 00 81 80 95 00 a9 c0
b3 00 71 4f 01 01 af 4b 80 a0 70 b0 2b 40 30 20
36 00 07 44 21 00 00 1a 00 00 00 fd 00 32 4b 1e
5e 14 00 0a 20 20 20 20 20 20 00 00 00 fc 00 4c
46 32 34 54 34 35 30 47 0a 20 20 20 00 00 00 ff
00 48 4e 4d 54 35 30 32 33 37 35 0a 20 20 01 ef

02 03 1b f1 46 90 04 1f 13 03 12 23 09 07 07 83
01 00 00 67 03 0c 00 10 00 80 28 28 3c 80 a0 70
b0 23 40 30 20 36 00 07 44 21 00 00 1a 8c 0a d0
90 20 40 31 20 0c 40 55 00 07 44 21 00 00 18 8c
0a d0 8a 20 e0 2d 10 10 3e 96 00 07 44 21 00 00
18 01 1d 00 72 51 d0 1e 20 6e 28 55 00 07 44 21
00 00 1e 2a 44 80 a0 70 38 27 40 30 20 35 00 07
44 21 00 00 1a 00 00 00 00 00 00 00 00 00 00 62

----------------

Block 0, Base EDID:
  EDID Structure Version & Revision: 1.3
  Vendor & Product Identification:
    Manufacturer: SAM
    Model: 29127
    Serial Number: ...
    Made in: week 21 of 2022
  Basic Display Parameters & Features:
    Digital display
    Maximum image size: 52 cm x 33 cm
    Gamma: 2.20
    DPMS levels: Off
    RGB color display
    First detailed timing is the preferred timing
  Color Characteristics:
    Red  : 0.6640, 0.3310
    Green: 0.2998, 0.6298
    Blue : 0.1425, 0.0498
    White: 0.3134, 0.3291
  Established Timings I & II:
    IBM     :   720x400    70.081663 Hz   9:5     31.467 kHz     28.320000 MHz
    DMT 0x04:   640x480    59.940476 Hz   4:3     31.469 kHz     25.175000 MHz
    Apple   :   640x480    66.666667 Hz   4:3     35.000 kHz     30.240000 MHz
    DMT 0x05:   640x480    72.808802 Hz   4:3     37.861 kHz     31.500000 MHz
    DMT 0x06:   640x480    75.000000 Hz   4:3     37.500 kHz     31.500000 MHz
    DMT 0x08:   800x600    56.250000 Hz   4:3     35.156 kHz     36.000000 MHz
    DMT 0x09:   800x600    60.316541 Hz   4:3     37.879 kHz     40.000000 MHz
    DMT 0x0a:   800x600    72.187572 Hz   4:3     48.077 kHz     50.000000 MHz
    DMT 0x0b:   800x600    75.000000 Hz   4:3     46.875 kHz     49.500000 MHz
    DMT 0x10:  1024x768    60.003840 Hz   4:3     48.363 kHz     65.000000 MHz
    DMT 0x11:  1024x768    70.069359 Hz   4:3     56.476 kHz     75.000000 MHz
    DMT 0x12:  1024x768    75.028582 Hz   4:3     60.023 kHz     78.750000 MHz
    DMT 0x24:  1280x1024   75.024675 Hz   5:4     79.976 kHz    135.000000 MHz
    Apple   :  1152x870    75.061550 Hz 192:145   68.681 kHz    100.000000 MHz
  Standard Timings:
    DMT 0x55:  1280x720    60.000000 Hz  16:9     45.000 kHz     74.250000 MHz
    DMT 0x1c:  1280x800    59.810326 Hz  16:10    49.702 kHz     83.500000 MHz
    DMT 0x23:  1280x1024   60.019740 Hz   5:4     63.981 kHz    108.000000 MHz
    DMT 0x2f:  1440x900    59.887445 Hz  16:10    55.935 kHz    106.500000 MHz
    DMT 0x53:  1600x900    60.000000 Hz  16:9     60.000 kHz    108.000000 MHz (RB)
    DMT 0x3a:  1680x1050   59.954250 Hz  16:10    65.290 kHz    146.250000 MHz
    DMT 0x15:  1152x864    75.000000 Hz   4:3     67.500 kHz    108.000000 MHz
  Detailed Timing Descriptors:
    DTD  1:  1920x1200   74.938889 Hz  16:10    93.149 kHz    193.750000 MHz (519 mm x 324 mm)
                  Hfront   48 Hsync  32 Hback   80 Hpol P
                  Vfront    3 Vsync   6 Vback   34 Vpol N
    Display Range Limits:
      Monitor ranges (GTF): 50-75 Hz V, 30-94 kHz H, max dotclock 200 MHz
    Display Product Name: 'LF24T450G'
    Display Product Serial Number: ...
  Extension blocks: 1
Checksum: 0xef

----------------

Block 1, CTA-861 Extension Block:
  Revision: 3
  Underscans IT Video Formats by default
  Basic audio support
  Supports YCbCr 4:4:4
  Supports YCbCr 4:2:2
  Native detailed modes: 1
  Video Data Block:
    VIC  16:  1920x1080   60.000000 Hz  16:9     67.500 kHz    148.500000 MHz (native)
    VIC   4:  1280x720    60.000000 Hz  16:9     45.000 kHz     74.250000 MHz
    VIC  31:  1920x1080   50.000000 Hz  16:9     56.250 kHz    148.500000 MHz
    VIC  19:  1280x720    50.000000 Hz  16:9     37.500 kHz     74.250000 MHz
    VIC   3:   720x480    59.940060 Hz  16:9     31.469 kHz     27.000000 MHz
    VIC  18:   720x576    50.000000 Hz  16:9     31.250 kHz     27.000000 MHz
  Audio Data Block:
    Linear PCM:
      Max channels: 2
      Supported sample rates (kHz): 48 44.1 32
      Supported sample sizes (bits): 24 20 16
  Speaker Allocation Data Block:
    FL/FR - Front Left/Right
  Vendor-Specific Data Block (HDMI), OUI 00-0C-03:
    Source physical address: 1.0.0.0
    Supports_AI
    Maximum TMDS clock: 200 MHz
  Detailed Timing Descriptors:
    DTD  2:  1920x1200   59.950171 Hz  16:10    74.038 kHz    154.000000 MHz (519 mm x 324 mm)
                  Hfront   48 Hsync  32 Hback   80 Hpol P
                  Vfront    3 Vsync   6 Vback   26 Vpol N
    DTD  3:   720x576    50.000000 Hz   5:4     31.250 kHz     27.000000 MHz (519 mm x 324 mm)
                  Hfront   12 Hsync  64 Hback   68 Hpol N
                  Vfront    5 Vsync   5 Vback   39 Vpol N
    DTD  4:   720x480    59.940060 Hz   3:2     31.469 kHz     27.000000 MHz (519 mm x 324 mm)
                  Hfront   16 Hsync  62 Hback   60 Hpol N
                  Vfront    9 Vsync   6 Vback   30 Vpol N
    DTD  5:  1280x720    60.000000 Hz  16:9     45.000 kHz     74.250000 MHz (519 mm x 324 mm)
                  Hfront  110 Hsync  40 Hback  220 Hpol P
                  Vfront    5 Vsync   5 Vback   20 Vpol P
    DTD  6:  1920x1080   74.972503 Hz  16:9     83.894 kHz    174.500000 MHz (519 mm x 324 mm)
                  Hfront   48 Hsync  32 Hback   80 Hpol P
                  Vfront    3 Vsync   5 Vback   31 Vpol N
Checksum: 0x62  Unused space in Extension Block: 10 bytes

----------------

Block 2, Unknown EDID Extension Block 0x00:
  00 ff ff ff ff ff ff 00 4c 2d c7 71 30 4c 47 30 '........L-.q0LG0'
  15 20 01 03 80 34 21 78 2a 3d b5 aa 54 4c a1 24 '. ...4!x*=..TL.$'
  0c 50 54 bf cf 80 81 c0 81 00 81 80 95 00 a9 c0 '.PT.............'
  b3 00 71 4f 01 01 af 4b 80 a0 70 b0 2b 40 30 20 '..qO...K..p.+@0 '
  36 00 07 44 21 00 00 1a 00 00 00 fd 00 32 4b 1e '6..D!........2K.'
  5e 14 00 0a 20 20 20 20 20 20 00 00 00 fc 00 4c '^...      .....L'
  46 32 34 54 34 35 30 47 0a 20 20 20 00 00 00 ff 'F24T450G.   ....'
  00 48 4e 4d 54 35 30 32 33 37 35 0a 20 20 01 ef '.HNMT502375.  ..'
Checksum: 0xef

----------------

Block 3, CTA-861 Extension Block:
  Revision: 3
  Underscans IT Video Formats by default
  Basic audio support
  Supports YCbCr 4:4:4
  Supports YCbCr 4:2:2
  Native detailed modes: 1
  Video Data Block:
    VIC  16:  1920x1080   60.000000 Hz  16:9     67.500 kHz    148.500000 MHz (native)
    VIC   4:  1280x720    60.000000 Hz  16:9     45.000 kHz     74.250000 MHz
    VIC  31:  1920x1080   50.000000 Hz  16:9     56.250 kHz    148.500000 MHz
    VIC  19:  1280x720    50.000000 Hz  16:9     37.500 kHz     74.250000 MHz
    VIC   3:   720x480    59.940060 Hz  16:9     31.469 kHz     27.000000 MHz
    VIC  18:   720x576    50.000000 Hz  16:9     31.250 kHz     27.000000 MHz
  Audio Data Block:
    Linear PCM:
      Max channels: 2
      Supported sample rates (kHz): 48 44.1 32
      Supported sample sizes (bits): 24 20 16
  Speaker Allocation Data Block:
    FL/FR - Front Left/Right
  Vendor-Specific Data Block (HDMI), OUI 00-0C-03:
    Source physical address: 1.0.0.0
    Supports_AI
    Maximum TMDS clock: 200 MHz
  Detailed Timing Descriptors:
    DTD  7:  1920x1200   59.950171 Hz  16:10    74.038 kHz    154.000000 MHz (519 mm x 324 mm)
                  Hfront   48 Hsync  32 Hback   80 Hpol P
                  Vfront    3 Vsync   6 Vback   26 Vpol N
    DTD  8:   720x576    50.000000 Hz   5:4     31.250 kHz     27.000000 MHz (519 mm x 324 mm)
                  Hfront   12 Hsync  64 Hback   68 Hpol N
                  Vfront    5 Vsync   5 Vback   39 Vpol N
    DTD  9:   720x480    59.940060 Hz   3:2     31.469 kHz     27.000000 MHz (519 mm x 324 mm)
                  Hfront   16 Hsync  62 Hback   60 Hpol N
                  Vfront    9 Vsync   6 Vback   30 Vpol N
    DTD 10:  1280x720    60.000000 Hz  16:9     45.000 kHz     74.250000 MHz (519 mm x 324 mm)
                  Hfront  110 Hsync  40 Hback  220 Hpol P
                  Vfront    5 Vsync   5 Vback   20 Vpol P
    DTD 11:  1920x1080   74.972503 Hz  16:9     83.894 kHz    174.500000 MHz (519 mm x 324 mm)
                  Hfront   48 Hsync  32 Hback   80 Hpol P
                  Vfront    3 Vsync   5 Vback   31 Vpol N
Checksum: 0x62  Unused space in Extension Block: 10 bytes

----------------

Warnings:

Block 1, CTA-861 Extension Block:
  Display Product Serial Number is set, so the Serial Number in the Base EDID should be 0.
  Add a Colorimetry Data Block with the sRGB colorimetry bit set to avoid interop issues.
Block 3, CTA-861 Extension Block:
  Display Product Serial Number is set, so the Serial Number in the Base EDID should be 0.
  Add a Colorimetry Data Block with the sRGB colorimetry bit set to avoid interop issues.

Failures:

Block 1, CTA-861 Extension Block:
  Missing VCDB, needed for Set Selectable RGB Quantization to avoid interop issues.
Block 2, Base EDID:
  Unknown Extension Block.
Block 3, CTA-861 Extension Block:
  Video Data Block: Duplicate VIC 16.
  Video Data Block: Duplicate VIC 4.
  Video Data Block: Duplicate VIC 31.
  Video Data Block: Duplicate VIC 19.
  Video Data Block: Duplicate VIC 3.
  Video Data Block: Duplicate VIC 18.
  Speaker Allocation Data Block: Only one instance of this Data Block is allowed.
  Missing VCDB, needed for Set Selectable RGB Quantization to avoid interop issues.
EDID:
  Base EDID: EDID specified 1 extension block(s), but found 3 extension block(s).
  Base EDID: EDID 1.3 requires a Block Map Extension in Block 1 if there are more than 2 blocks in the EDID.
  CTA-861: Native progressive timings are a mix of several resolutions.

EDID conformity: FAIL
