
EDID (hex):
00ffffffffffff00047249ada6b64071
0e110104a5261e6b226760a25a499e23
135054bfef00818f8180714f7140614f
6140454f4540302a009851002a403070
1300782d1100001e000000ff004c3439
3038363034343233480a000000fd0037
4b1e530e000a202020202020000000fc
004163657220414c313931360a200015

Extracted contents:
header:          00 ff ff ff ff ff ff 00
serial number:   04 72 49 ad a6 b6 40 71 0e 11
version:         01 04
basic params:    a5 26 1e 6b 22
chroma info:     67 60 a2 5a 49 9e 23 13 50 54
established:     bf ef 00
standard:        81 8f 81 80 71 4f 71 40 61 4f 61 40 45 4f 45 40
descriptor 1:    30 2a 00 98 51 00 2a 40 30 70 13 00 78 2d 11 00 00 1e
descriptor 2:    00 00 00 ff 00 4c 34 39 30 38 36 30 34 34 32 33 48 0a
descriptor 3:    00 00 00 fd 00 37 4b 1e 53 0e 00 0a 20 20 20 20 20 20
descriptor 4:    00 00 00 fc 00 41 63 65 72 20 41 4c 31 39 31 36 0a 20
extensions:      00
checksum:        15

EDID version: 1.4
Manufacturer: ACR Model ad49 Serial Number --
Made in week 14 of 2007
Digital display
8 bits per primary color channel
DisplayPort interface
Maximum image size: 38 cm x 30 cm
Gamma: 2.07
DPMS levels: Off
Supported color formats: RGB 4:4:4
First detailed timing includes the native pixel format and preferred refresh rate
Display x,y Chromaticity:
  Red:   0.6337, 0.3535
  Green: 0.2861, 0.6201
  Blue:  0.1376, 0.0761
  White: 0.3125, 0.3281
Established timings supported:
  720x400@70Hz 9:5 HorFreq: 31469 Hz Clock: 28.320 MHz
  640x480@60Hz 4:3 HorFreq: 31469 Hz Clock: 25.175 MHz
  640x480@67Hz 4:3 HorFreq: 35000 Hz Clock: 30.240 MHz
  640x480@72Hz 4:3 HorFreq: 37900 Hz Clock: 31.500 MHz
  640x480@75Hz 4:3 HorFreq: 37500 Hz Clock: 31.500 MHz
  800x600@56Hz 4:3 HorFreq: 35200 Hz Clock: 36.000 MHz
  800x600@60Hz 4:3 HorFreq: 37900 Hz Clock: 40.000 MHz
  800x600@72Hz 4:3 HorFreq: 48100 Hz Clock: 50.000 MHz
  800x600@75Hz 4:3 HorFreq: 46900 Hz Clock: 49.500 MHz
  832x624@75Hz 4:3 HorFreq: 49726 Hz Clock: 57.284 MHz
  1024x768@60Hz 4:3 HorFreq: 48400 Hz Clock: 65.000 MHz
  1024x768@70Hz 4:3 HorFreq: 56500 Hz Clock: 75.000 MHz
  1024x768@75Hz 4:3 HorFreq: 60000 Hz Clock: 78.750 MHz
  1280x1024@75Hz 5:4 HorFreq: 80000 Hz Clock: 135.000 MHz
Standard timings supported:
  1280x1024@75Hz 5:4 HorFreq: 80000 Hz Clock: 135.000 MHz
  1280x1024@60Hz 5:4 HorFreq: 64000 Hz Clock: 108.000 MHz
  1152x864@75Hz 4:3 HorFreq: 67500 Hz Clock: 108.000 MHz
  1152x864@60Hz 4:3
  1024x768@75Hz 4:3 HorFreq: 60000 Hz Clock: 78.750 MHz
  1024x768@60Hz 4:3 HorFreq: 48400 Hz Clock: 65.000 MHz
  800x600@75Hz 4:3 HorFreq: 46900 Hz Clock: 49.500 MHz
  800x600@60Hz 4:3 HorFreq: 37900 Hz Clock: 40.000 MHz
Detailed mode: Clock 108.000 MHz, 376 mm x 301 mm
               1280 1328 1440 1688 hborder 0
               1024 1025 1028 1066 vborder 0
               +hsync +vsync 
               VertFreq: 60 Hz, HorFreq: 63981 Hz
Serial number: --
Monitor ranges (GTF): 55-75Hz V, 30-83kHz H, max dotclock 140MHz
Monitor name: Acer AL1916
Checksum: 0x15 (valid)
