
EDID (hex):
00ffffffffffff0039ee031503000000
301301037a2213782e1e95a355489827
155054afce0001010101010101010101
0101010101011b2150a051001e304888
350058c21000001c000000fc00534d49
4c453536332020202020000000ff000a
000000000000000000000000000000ff
003541303032504a375a2020200a00c1

Extracted contents:
header:          00 ff ff ff ff ff ff 00
serial number:   39 ee 03 15 03 00 00 00 30 13
version:         01 03
basic params:    7a 22 13 78 2e
chroma info:     1e 95 a3 55 48 98 27 15 50 54
established:     af ce 00
standard:        01 01 01 01 01 01 01 01 01 01 01 01 01 01 01 01
descriptor 1:    1b 21 50 a0 51 00 1e 30 48 88 35 00 58 c2 10 00 00 1c
descriptor 2:    00 00 00 fc 00 53 4d 49 4c 45 35 36 33 20 20 20 20 20
descriptor 3:    00 00 00 ff 00 0a 00 00 00 00 00 00 00 00 00 00 00 00
descriptor 4:    00 00 00 ff 00 35 41 30 30 32 50 4a 37 5a 20 20 20 0a
extensions:      00
checksum:        c1

EDID version: 1.3
Manufacturer: NON Model 1503 Serial Number --
Made in week 48 of 2009
Analog display, Input voltage level: 0.7/0.7 V
Configurable signal levels
Sync: Separate SyncOnGreen 
Maximum image size: 34 cm x 19 cm
Gamma: 2.20
DPMS levels: Off
RGB color display
Default (sRGB) color space is primary color space
First detailed timing is preferred timing
Display x,y Chromaticity:
  Red:   0.6367, 0.3330
  Green: 0.2841, 0.5957
  Blue:  0.1542, 0.0830
  White: 0.3134, 0.3291
Established timings supported:
  720x400@70Hz 9:5 HorFreq: 31469 Hz Clock: 28.320 MHz
  640x480@60Hz 4:3 HorFreq: 31469 Hz Clock: 25.175 MHz
  640x480@72Hz 4:3 HorFreq: 37900 Hz Clock: 31.500 MHz
  640x480@75Hz 4:3 HorFreq: 37500 Hz Clock: 31.500 MHz
  800x600@56Hz 4:3 HorFreq: 35200 Hz Clock: 36.000 MHz
  800x600@60Hz 4:3 HorFreq: 37900 Hz Clock: 40.000 MHz
  800x600@72Hz 4:3 HorFreq: 48100 Hz Clock: 50.000 MHz
  800x600@75Hz 4:3 HorFreq: 46900 Hz Clock: 49.500 MHz
  1024x768@60Hz 4:3 HorFreq: 48400 Hz Clock: 65.000 MHz
  1024x768@70Hz 4:3 HorFreq: 56500 Hz Clock: 75.000 MHz
  1024x768@75Hz 4:3 HorFreq: 60000 Hz Clock: 78.750 MHz
Standard timings supported:
Detailed mode: Clock 84.750 MHz, 344 mm x 194 mm
               1360 1432 1568 1776 hborder 0
                768  771  776  798 vborder 0
               -hsync +vsync 
               VertFreq: 59 Hz, HorFreq: 47719 Hz
Serial number: 
-- number: 5A002PJ7Z   
Checksum: 0xc1 (valid)
EDID block does NOT conform to EDID 1.3!
	sRGB is signaled, but the chromaticities do not match
	Name descriptor not terminated with a newline
	Missing monitor ranges
	Detailed block string not properly terminated
