
EDID (hex):
00ffffffffffff0010ac05d037483130
1f0f0103682018782e8aa9a154469924
0e484ca442003159455961598180714f
010101010101c31e0020410020301060
130036e61000001e000000ff00363431
3830353831303148370a000000fc0044
454c4c2045373733630a2020000000fd
0032a01e460b000a2020202020200000

Extracted contents:
header:          00 ff ff ff ff ff ff 00
serial number:   10 ac 05 d0 37 48 31 30 1f 0f
version:         01 03
basic params:    68 20 18 78 2e
chroma info:     8a a9 a1 54 46 99 24 0e 48 4c
established:     a4 42 00
standard:        31 59 45 59 61 59 81 80 71 4f 01 01 01 01 01 01
descriptor 1:    c3 1e 00 20 41 00 20 30 10 60 13 00 36 e6 10 00 00 1e
descriptor 2:    00 00 00 ff 00 36 34 31 38 30 35 38 31 30 31 48 37 0a
descriptor 3:    00 00 00 fc 00 44 45 4c 4c 20 45 37 37 33 63 0a 20 20
descriptor 4:    00 00 00 fd 00 32 a0 1e 46 0b 00 0a 20 20 20 20 20 20
extensions:      00
checksum:        00

EDID version: 1.3
Manufacturer: DEL Model d005 Serial Number --
Analog display, Input voltage level: 0.7/0.7 V
Sync: Separate 
Maximum image size: 32 cm x 24 cm
Gamma: 2.20
DPMS levels: Off
RGB color display
Default (sRGB) color space is primary color space
First detailed timing is preferred timing
Display x,y Chromaticity:
  Red:   0.6308, 0.3281
  Green: 0.2753, 0.5996
  Blue:  0.1425, 0.0566
  White: 0.2832, 0.2978
Established timings supported:
  720x400@70Hz 9:5 HorFreq: 31469 Hz Clock: 28.320 MHz
  640x480@60Hz 4:3 HorFreq: 31469 Hz Clock: 25.175 MHz
  640x480@75Hz 4:3 HorFreq: 37500 Hz Clock: 31.500 MHz
  800x600@75Hz 4:3 HorFreq: 46900 Hz Clock: 49.500 MHz
  1024x768@75Hz 4:3 HorFreq: 60000 Hz Clock: 78.750 MHz
Standard timings supported:
  640x480@85Hz 4:3 HorFreq: 43300 Hz Clock: 36.000 MHz
  800x600@85Hz 4:3 HorFreq: 53700 Hz Clock: 56.250 MHz
  1024x768@85Hz 4:3 HorFreq: 68700 Hz Clock: 94.500 MHz
  1280x1024@60Hz 5:4 HorFreq: 64000 Hz Clock: 108.000 MHz
  1152x864@75Hz 4:3 HorFreq: 67500 Hz Clock: 108.000 MHz
Detailed mode: Clock 78.750 MHz, 310 mm x 230 mm
               1024 1040 1136 1312 hborder 0
                768  769  772  800 vborder 0
               +hsync +vsync 
               VertFreq: 75 Hz, HorFreq: 60022 Hz
Serial number: --
Monitor name: DELL E773c
Monitor ranges (GTF): 50-160Hz V, 30-70kHz H, max dotclock 110MHz
Checksum: 0x0 (valid)
EDID block does NOT conform to EDID 1.3!
	sRGB is signaled, but the chromaticities do not match
EDID block does not conform at all!
	Bad year of manufacture
