
EDID (hex):
00ffffffffffff00220e893401010101
301b0104a53c22783a9325a9544d9e25
0c5054a54b00d1c0a9c081c0d100b300
950081008180565e00a0a0a029503020
350055502100001a000000fd00184b1b
701f010a202020202020000000fc0048
50205a32376e2047320a2020000000ff
0036434d3734383130364c0a20200130
020316f149101f041303120211012309
070783010000023a801871382d40582c
450055502100001fd97600a0a0a03450
3020350055502100001af33980d07238
2d40102c450055502100001f00000000
00000000000000000000000000000000
00000000000000000000000000000000
000000000000000000000000000000d5

edid-decode (hex):

00 ff ff ff ff ff ff 00 22 0e 89 34 01 01 01 01
30 1b 01 04 a5 3c 22 78 3a 93 25 a9 54 4d 9e 25
0c 50 54 a5 4b 00 d1 c0 a9 c0 81 c0 d1 00 b3 00
95 00 81 00 81 80 56 5e 00 a0 a0 a0 29 50 30 20
35 00 55 50 21 00 00 1a 00 00 00 fd 00 18 4b 1b
70 1f 01 0a 20 20 20 20 20 20 00 00 00 fc 00 48
50 20 5a 32 37 6e 20 47 32 0a 20 20 00 00 00 ff
00 36 43 4d 37 34 38 31 30 36 4c 0a 20 20 01 30

02 03 16 f1 49 10 1f 04 13 03 12 02 11 01 23 09
07 07 83 01 00 00 02 3a 80 18 71 38 2d 40 58 2c
45 00 55 50 21 00 00 1f d9 76 00 a0 a0 a0 34 50
30 20 35 00 55 50 21 00 00 1a f3 39 80 d0 72 38
2d 40 10 2c 45 00 55 50 21 00 00 1f 00 00 00 00
00 00 00 00 00 00 00 00 00 00 00 00 00 00 00 00
00 00 00 00 00 00 00 00 00 00 00 00 00 00 00 00
00 00 00 00 00 00 00 00 00 00 00 00 00 00 00 d5

----------------

Block 0, Base EDID:
  EDID Structure Version & Revision: 1.4
  Vendor & Product Identification:
    Manufacturer: HPN
    Model: 13449
    Serial Number: 16843009
    Made in: week 48 of 2017
  Basic Display Parameters & Features:
    Digital display
    Bits per primary color channel: 8
    DisplayPort interface
    Maximum image size: 60 cm x 34 cm
    Gamma: 2.20
    DPMS levels: Off
    Supported color formats: RGB 4:4:4, YCrCb 4:4:4, YCrCb 4:2:2
    First detailed timing includes the native pixel format and preferred refresh rate
  Color Characteristics:
    Red  : 0.6621, 0.3291
    Green: 0.3007, 0.6201
    Blue : 0.1445, 0.0488
    White: 0.3134, 0.3291
  Established Timings I & II:
    IBM     :   720x400    70.081663 Hz   9:5     31.467 kHz     28.320000 MHz
    DMT 0x04:   640x480    59.940476 Hz   4:3     31.469 kHz     25.175000 MHz
    DMT 0x06:   640x480    75.000000 Hz   4:3     37.500 kHz     31.500000 MHz
    DMT 0x09:   800x600    60.316541 Hz   4:3     37.879 kHz     40.000000 MHz
    DMT 0x0b:   800x600    75.000000 Hz   4:3     46.875 kHz     49.500000 MHz
    DMT 0x10:  1024x768    60.003840 Hz   4:3     48.363 kHz     65.000000 MHz
    DMT 0x12:  1024x768    75.028582 Hz   4:3     60.023 kHz     78.750000 MHz
    DMT 0x24:  1280x1024   75.024675 Hz   5:4     79.976 kHz    135.000000 MHz
  Standard Timings:
    DMT 0x52:  1920x1080   60.000000 Hz  16:9     67.500 kHz    148.500000 MHz
    DMT 0x53:  1600x900    60.000000 Hz  16:9     60.000 kHz    108.000000 MHz (RB)
    DMT 0x55:  1280x720    60.000000 Hz  16:9     45.000 kHz     74.250000 MHz
    DMT 0x45:  1920x1200   59.884600 Hz  16:10    74.556 kHz    193.250000 MHz
    DMT 0x3a:  1680x1050   59.954250 Hz  16:10    65.290 kHz    146.250000 MHz
    DMT 0x2f:  1440x900    59.887445 Hz  16:10    55.935 kHz    106.500000 MHz
    DMT 0x1c:  1280x800    59.810326 Hz  16:10    49.702 kHz     83.500000 MHz
    DMT 0x23:  1280x1024   60.019740 Hz   5:4     63.981 kHz    108.000000 MHz
  Detailed Timing Descriptors:
    DTD 1:  2560x1440   59.950550 Hz  16:9     88.787 kHz    241.500000 MHz (597 mm x 336 mm)
                 Hfront   48 Hsync  32 Hback   80 Hpol P
                 Vfront    3 Vsync   5 Vback   33 Vpol N
    Display Range Limits:
      Monitor ranges (Bare Limits): 24-75 Hz V, 27-112 kHz H, max dotclock 310 MHz
    Display Product Name: 'HP Z27n G2'
    Display Product Serial Number: '6CM748106L'
  Extension blocks: 1
Checksum: 0x30

----------------

Block 1, CTA-861 Extension Block:
  Revision: 3
  Underscans IT Video Formats by default
  Basic audio support
  Supports YCbCr 4:4:4
  Supports YCbCr 4:2:2
  Native detailed modes: 1
  Video Data Block:
    VIC  16:  1920x1080   60.000000 Hz  16:9     67.500 kHz    148.500000 MHz
    VIC  31:  1920x1080   50.000000 Hz  16:9     56.250 kHz    148.500000 MHz
    VIC   4:  1280x720    60.000000 Hz  16:9     45.000 kHz     74.250000 MHz
    VIC  19:  1280x720    50.000000 Hz  16:9     37.500 kHz     74.250000 MHz
    VIC   3:   720x480    59.940060 Hz  16:9     31.469 kHz     27.000000 MHz
    VIC  18:   720x576    50.000000 Hz  16:9     31.250 kHz     27.000000 MHz
    VIC   2:   720x480    59.940060 Hz   4:3     31.469 kHz     27.000000 MHz
    VIC  17:   720x576    50.000000 Hz   4:3     31.250 kHz     27.000000 MHz
    VIC   1:   640x480    59.940476 Hz   4:3     31.469 kHz     25.175000 MHz
  Audio Data Block:
    Linear PCM:
      Max channels: 2
      Supported sample rates (kHz): 48 44.1 32
      Supported sample sizes (bits): 24 20 16
  Speaker Allocation Data Block:
    FL/FR - Front Left/Right
  Detailed Timing Descriptors:
    DTD 2:  1920x1080   60.000000 Hz  16:9     67.500 kHz    148.500000 MHz (597 mm x 336 mm)
                 Hfront   88 Hsync  44 Hback  148 Hpol P
                 Vfront    4 Vsync   5 Vback   36 Vpol P
    DTD 3:  2560x1440   74.970923 Hz  16:9    111.857 kHz    304.250000 MHz (597 mm x 336 mm)
                 Hfront   48 Hsync  32 Hback   80 Hpol P
                 Vfront    3 Vsync   5 Vback   44 Vpol N
    DTD 4:  1920x1080   49.949495 Hz  16:9     56.193 kHz    148.350000 MHz (597 mm x 336 mm)
                 Hfront   16 Hsync  44 Hback  660 Hpol P
                 Vfront    4 Vsync   5 Vback   36 Vpol P
Checksum: 0xd5  Unused space in Extension Block: 51 bytes


