edid-decode (hex):

00 ff ff ff ff ff ff 00 06 af 5c 30 00 00 00 00
00 16 01 04 90 1a 0e 78 02 99 85 95 55 56 92 28
22 50 54 00 00 00 01 01 01 01 01 01 01 01 01 01
01 01 01 01 01 01 3e 1c 56 a0 50 00 16 30 28 20
36 00 00 90 10 00 00 18 d4 12 56 a0 50 00 16 30
28 20 36 00 00 90 10 00 00 18 00 00 00 00 00 00
00 00 00 00 00 00 00 00 00 00 00 00 00 00 00 02
00 0c 26 e5 0a 3c c8 0f 09 1e e1 20 20 20 00 28

----------------

Block 0, Base EDID:
  EDID Structure Version & Revision: 1.4
  Vendor & Product Identification:
    Manufacturer: AUO
    Model: 12380
    Made in: 2012
  Basic Display Parameters & Features:
    Digital display
    Bits per primary color channel: 6
    Digital interface is not defined
    Maximum image size: 26 cm x 14 cm
    Gamma: 2.20
    Supported color formats: RGB 4:4:4
    First detailed timing includes the native pixel format and preferred refresh rate
  Color Characteristics:
    Red  : 0.5839, 0.3330
    Green: 0.3378, 0.5712
    Blue : 0.1582, 0.1328
    White: 0.3134, 0.3291
  Established Timings I & II: none
  Standard Timings: none
  Detailed Timing Descriptors:
    DTD 1:  1366x768    59.973 Hz 683:384  47.379 kHz  72.300 MHz (256 mm x 144 mm)
                 Hfront   40 Hsync  32 Hback  88 Hpol N
                 Vfront    3 Vsync   6 Vback  13 Vpol N
    DTD 2:  1366x768    39.982 Hz 683:384  31.586 kHz  48.200 MHz (256 mm x 144 mm)
                 Hfront   40 Hsync  32 Hback  88 Hpol N
                 Vfront    3 Vsync   6 Vback  13 Vpol N
    Empty Descriptor
    Manufacturer-Specified Display Descriptor (0x02): 00 02 00 0c 26 e5 0a 3c c8 0f 09 1e e1 20 20 20 '....&..<.....   '
Checksum: 0x28
