
EDID (hex):
00ffffffffffff0006af5c3000000000
00130104901a0e780299859555569228
22505400000001010101010101010101
010101010101581b5668500019303020
360000901000001a581b566850001930
3020360000901000001a000000fe0032
5644324b804231313658573300000000
0000410a960111000002010a202000b6

Extracted contents:
header:          00 ff ff ff ff ff ff 00
serial number:   06 af 5c 30 00 00 00 00 00 13
version:         01 04
basic params:    90 1a 0e 78 02
chroma info:     99 85 95 55 56 92 28 22 50 54
established:     00 00 00
standard:        01 01 01 01 01 01 01 01 01 01 01 01 01 01 01 01
descriptor 1:    58 1b 56 68 50 00 19 30 30 20 36 00 00 90 10 00 00 1a
descriptor 2:    58 1b 56 68 50 00 19 30 30 20 36 00 00 90 10 00 00 1a
descriptor 3:    00 00 00 fe 00 32 56 44 32 4b 80 42 31 31 36 58 57 33
descriptor 4:    00 00 00 00 00 00 41 0a 96 01 11 00 00 02 01 0a 20 20
extensions:      00
checksum:        b6

EDID version: 1.4
Manufacturer: AUO Model 305c Serial Number --
Made in year 2009
Digital display
6 bits per primary color channel
Digital interface is not defined
Maximum image size: 26 cm x 14 cm
Gamma: 2.20
Supported color formats: RGB 4:4:4
First detailed timing includes the native pixel format and preferred refresh rate
Display x,y Chromaticity:
  Red:   0.5839, 0.3330
  Green: 0.3378, 0.5712
  Blue:  0.1582, 0.1328
  White: 0.3134, 0.3291
Established timings supported:
Standard timings supported:
Detailed mode: Clock 70.000 MHz, 256 mm x 144 mm
               1366 1414 1446 1470 hborder 0
                768  771  777  793 vborder 0
               +hsync -vsync 
               VertFreq: 60 Hz, HorFreq: 47619 Hz
Detailed mode: Clock 70.000 MHz, 256 mm x 144 mm
               1366 1414 1446 1470 hborder 0
                768  771  777  793 vborder 0
               +hsync -vsync 
               VertFreq: 60 Hz, HorFreq: 47619 Hz
ASCII string: 2VD2K
Manufacturer-specified data, tag 0
Checksum: 0xb6 (valid)
EDID block does NOT conform to EDID 1.4!
	Missing name descriptor
	Missing monitor ranges
	Detailed block string not properly terminated
