edid-decode (hex):

00 ff ff ff ff ff ff 00 4e d4 09 03 01 01 01 01
17 1b 01 03 80 46 27 96 0a 67 55 a5 5b 47 9c 25
1e 4f 54 a1 08 00 45 40 61 40 01 01 01 01 01 01
01 01 01 01 01 01 66 21 56 aa 51 00 1e 30 28 8f
33 00 ba 88 21 00 00 1e 0e 1f 00 80 51 00 1e 30
40 80 37 00 55 00 53 00 00 1c 00 00 00 fc 00 48
44 20 54 56 0a 20 20 20 20 20 20 20 00 00 00 fd
00 38 3f 1e 50 09 00 0a 20 20 20 20 20 20 01 27

02 03 24 71 4d 01 03 84 05 06 10 12 13 14 15 1f
21 22 26 15 07 50 09 57 07 83 4f 00 00 66 03 0c
00 10 00 80 8f 0a d0 8a 20 e0 2d 10 10 3e 96 00
c4 8e 21 00 00 18 8c 0a d0 8a 20 e0 2d 10 10 3e
96 00 13 8e 21 00 00 18 8c 0a d0 90 20 40 31 20
0c 40 55 00 13 8e 21 00 00 18 8c 0a d0 90 20 40
31 20 0c 40 55 00 c4 8e 21 00 00 18 8c 0a d0 8a
20 e0 2d 10 10 3e 96 00 c4 8e 21 00 00 18 00 db

00 ff ff ff ff ff ff 00 4e d4 09 03 01 01 01 01
17 1b 01 03 80 46 27 96 0a 67 55 a5 5b 47 9c 25
1e 4f 54 a1 08 00 45 40 61 40 01 01 01 01 01 01
01 01 01 01 01 01 66 21 56 aa 51 00 1e 30 28 8f
33 00 ba 88 21 00 00 1e 0e 1f 00 80 51 00 1e 30
40 80 37 00 55 00 53 00 00 1c 00 00 00 fc 00 48
44 20 54 56 0a 20 20 20 20 20 20 20 00 00 00 fd
00 38 3f 1e 50 09 00 0a 20 20 20 20 20 20 01 27

02 03 24 71 4d 01 03 84 05 06 10 12 13 14 15 1f
21 22 26 15 07 50 09 57 07 83 4f 00 00 66 03 0c
00 10 00 80 8f 0a d0 8a 20 e0 2d 10 10 3e 96 00
c4 8e 21 00 00 18 8c 0a d0 8a 20 e0 2d 10 10 3e
96 00 13 8e 21 00 00 18 8c 0a d0 90 20 40 31 20
0c 40 55 00 13 8e 21 00 00 18 8c 0a d0 90 20 40
31 20 0c 40 55 00 c4 8e 21 00 00 18 8c 0a d0 8a
20 e0 2d 10 10 3e 96 00 c4 8e 21 00 00 18 00 db

----------------

Block 0, Base EDID:
  EDID Structure Version & Revision: 1.3
  Vendor & Product Identification:
    Manufacturer: SVT
    Model: 777
    Serial Number: ...
    Made in: week 23 of 2017
  Basic Display Parameters & Features:
    Digital display
    Maximum image size: 70 cm x 39 cm
    Gamma: 2.50
    RGB color display
    First detailed timing is the preferred timing
  Color Characteristics:
    Red  : 0.6455, 0.3574
    Green: 0.2783, 0.6123
    Blue : 0.1455, 0.1181
    White: 0.3095, 0.3291
  Established Timings I & II:
    IBM     :   720x400    70.081663 Hz   9:5     31.467 kHz     28.320000 MHz
    DMT 0x04:   640x480    59.940476 Hz   4:3     31.469 kHz     25.175000 MHz
    DMT 0x09:   800x600    60.316541 Hz   4:3     37.879 kHz     40.000000 MHz
    DMT 0x10:  1024x768    60.003840 Hz   4:3     48.363 kHz     65.000000 MHz
  Standard Timings:
    DMT 0x09:   800x600    60.316541 Hz   4:3     37.879 kHz     40.000000 MHz
    DMT 0x10:  1024x768    60.003840 Hz   4:3     48.363 kHz     65.000000 MHz
  Detailed Timing Descriptors:
    DTD  1:  1366x768    59.789541 Hz 683:384   47.712 kHz     85.500000 MHz (698 mm x 392 mm)
                  Hfront   40 Hsync 143 Hback  243 Hpol P
                  Vfront    3 Vsync   3 Vback   24 Vpol P
    DTD  2:  1280x768    59.870228 Hz   5:3     47.776 kHz     79.500000 MHz (1365 mm x 768 mm)
                  Hfront   64 Hsync 128 Hback  192 Hpol N
                  Vfront    3 Vsync   7 Vback   20 Vpol P
    Display Product Name: 'HD TV'
    Display Range Limits:
      Monitor ranges (GTF): 56-63 Hz V, 30-80 kHz H, max dotclock 90 MHz
  Extension blocks: 1
Checksum: 0x27

----------------

Block 1, CTA-861 Extension Block:
  Revision: 3
  Basic audio support
  Supports YCbCr 4:4:4
  Supports YCbCr 4:2:2
  Native detailed modes: 1
  Video Data Block:
    VIC   1:   640x480    59.940476 Hz   4:3     31.469 kHz     25.175000 MHz
    VIC   3:   720x480    59.940060 Hz  16:9     31.469 kHz     27.000000 MHz
    VIC   4:  1280x720    60.000000 Hz  16:9     45.000 kHz     74.250000 MHz (native)
    VIC   5:  1920x1080i  60.000000 Hz  16:9     33.750 kHz     74.250000 MHz
    VIC   6:  1440x480i   59.940060 Hz   4:3     15.734 kHz     27.000000 MHz
    VIC  16:  1920x1080   60.000000 Hz  16:9     67.500 kHz    148.500000 MHz
    VIC  18:   720x576    50.000000 Hz  16:9     31.250 kHz     27.000000 MHz
    VIC  19:  1280x720    50.000000 Hz  16:9     37.500 kHz     74.250000 MHz
    VIC  20:  1920x1080i  50.000000 Hz  16:9     28.125 kHz     74.250000 MHz
    VIC  21:  1440x576i   50.000000 Hz   4:3     15.625 kHz     27.000000 MHz
    VIC  31:  1920x1080   50.000000 Hz  16:9     56.250 kHz    148.500000 MHz
    VIC  33:  1920x1080   25.000000 Hz  16:9     28.125 kHz     74.250000 MHz
    VIC  34:  1920x1080   30.000000 Hz  16:9     33.750 kHz     74.250000 MHz
  Audio Data Block:
    AC-3:
      Max channels: 6
      Supported sample rates (kHz): 48 44.1 32
      Maximum bit rate: 640 kb/s
    Linear PCM:
      Max channels: 2
      Supported sample rates (kHz): 192 96 48 44.1 32
      Supported sample sizes (bits): 24 20 16
  Speaker Allocation Data Block:
    FL/FR - Front Left/Right
    LFE1 - Low Frequency Effects 1
    FC - Front Center
    BL/BR - Back Left/Right
    RLC/RRC - Rear Left/Right of Center (Deprecated)
  Vendor-Specific Data Block (HDMI), OUI 00-0C-03:
    Source physical address: 1.0.0.0
    Supports_AI
  Detailed Timing Descriptors:
    DTD  3:   720x480    60.006660 Hz   3:2     31.503 kHz     27.030000 MHz (708 mm x 398 mm)
                  Hfront   16 Hsync  62 Hback   60 Hpol N
                  Vfront    9 Vsync   6 Vback   30 Vpol N
    DTD  4:   720x480    59.940060 Hz   3:2     31.469 kHz     27.000000 MHz (531 mm x 398 mm)
                  Hfront   16 Hsync  62 Hback   60 Hpol N
                  Vfront    9 Vsync   6 Vback   30 Vpol N
    DTD  5:   720x576    50.000000 Hz   5:4     31.250 kHz     27.000000 MHz (531 mm x 398 mm)
                  Hfront   12 Hsync  64 Hback   68 Hpol N
                  Vfront    5 Vsync   5 Vback   39 Vpol N
    DTD  6:   720x576    50.000000 Hz   5:4     31.250 kHz     27.000000 MHz (708 mm x 398 mm)
                  Hfront   12 Hsync  64 Hback   68 Hpol N
                  Vfront    5 Vsync   5 Vback   39 Vpol N
    DTD  7:   720x480    59.940060 Hz   3:2     31.469 kHz     27.000000 MHz (708 mm x 398 mm)
                  Hfront   16 Hsync  62 Hback   60 Hpol N
                  Vfront    9 Vsync   6 Vback   30 Vpol N
Checksum: 0xdb  Unused space in Extension Block: 1 byte

----------------

Block 2, Unknown EDID Extension Block 0x00:
  00 ff ff ff ff ff ff 00 4e d4 09 03 01 01 01 01 '........N.......'
  17 1b 01 03 80 46 27 96 0a 67 55 a5 5b 47 9c 25 '.....F'..gU.[G.%'
  1e 4f 54 a1 08 00 45 40 61 40 01 01 01 01 01 01 '.OT...E@a@......'
  01 01 01 01 01 01 66 21 56 aa 51 00 1e 30 28 8f '......f!V.Q..0(.'
  33 00 ba 88 21 00 00 1e 0e 1f 00 80 51 00 1e 30 '3...!.......Q..0'
  40 80 37 00 55 00 53 00 00 1c 00 00 00 fc 00 48 '@.7.U.S........H'
  44 20 54 56 0a 20 20 20 20 20 20 20 00 00 00 fd 'D TV.       ....'
  00 38 3f 1e 50 09 00 0a 20 20 20 20 20 20 01 27 '.8?.P...      .''
Checksum: 0x27

----------------

Block 3, CTA-861 Extension Block:
  Revision: 3
  Basic audio support
  Supports YCbCr 4:4:4
  Supports YCbCr 4:2:2
  Native detailed modes: 1
  Video Data Block:
    VIC   1:   640x480    59.940476 Hz   4:3     31.469 kHz     25.175000 MHz
    VIC   3:   720x480    59.940060 Hz  16:9     31.469 kHz     27.000000 MHz
    VIC   4:  1280x720    60.000000 Hz  16:9     45.000 kHz     74.250000 MHz (native)
    VIC   5:  1920x1080i  60.000000 Hz  16:9     33.750 kHz     74.250000 MHz
    VIC   6:  1440x480i   59.940060 Hz   4:3     15.734 kHz     27.000000 MHz
    VIC  16:  1920x1080   60.000000 Hz  16:9     67.500 kHz    148.500000 MHz
    VIC  18:   720x576    50.000000 Hz  16:9     31.250 kHz     27.000000 MHz
    VIC  19:  1280x720    50.000000 Hz  16:9     37.500 kHz     74.250000 MHz
    VIC  20:  1920x1080i  50.000000 Hz  16:9     28.125 kHz     74.250000 MHz
    VIC  21:  1440x576i   50.000000 Hz   4:3     15.625 kHz     27.000000 MHz
    VIC  31:  1920x1080   50.000000 Hz  16:9     56.250 kHz    148.500000 MHz
    VIC  33:  1920x1080   25.000000 Hz  16:9     28.125 kHz     74.250000 MHz
    VIC  34:  1920x1080   30.000000 Hz  16:9     33.750 kHz     74.250000 MHz
  Audio Data Block:
    AC-3:
      Max channels: 6
      Supported sample rates (kHz): 48 44.1 32
      Maximum bit rate: 640 kb/s
    Linear PCM:
      Max channels: 2
      Supported sample rates (kHz): 192 96 48 44.1 32
      Supported sample sizes (bits): 24 20 16
  Speaker Allocation Data Block:
    FL/FR - Front Left/Right
    LFE1 - Low Frequency Effects 1
    FC - Front Center
    BL/BR - Back Left/Right
    RLC/RRC - Rear Left/Right of Center (Deprecated)
  Vendor-Specific Data Block (HDMI), OUI 00-0C-03:
    Source physical address: 1.0.0.0
    Supports_AI
  Detailed Timing Descriptors:
    DTD  8:   720x480    60.006660 Hz   3:2     31.503 kHz     27.030000 MHz (708 mm x 398 mm)
                  Hfront   16 Hsync  62 Hback   60 Hpol N
                  Vfront    9 Vsync   6 Vback   30 Vpol N
    DTD  9:   720x480    59.940060 Hz   3:2     31.469 kHz     27.000000 MHz (531 mm x 398 mm)
                  Hfront   16 Hsync  62 Hback   60 Hpol N
                  Vfront    9 Vsync   6 Vback   30 Vpol N
    DTD 10:   720x576    50.000000 Hz   5:4     31.250 kHz     27.000000 MHz (531 mm x 398 mm)
                  Hfront   12 Hsync  64 Hback   68 Hpol N
                  Vfront    5 Vsync   5 Vback   39 Vpol N
    DTD 11:   720x576    50.000000 Hz   5:4     31.250 kHz     27.000000 MHz (708 mm x 398 mm)
                  Hfront   12 Hsync  64 Hback   68 Hpol N
                  Vfront    5 Vsync   5 Vback   39 Vpol N
    DTD 12:   720x480    59.940060 Hz   3:2     31.469 kHz     27.000000 MHz (708 mm x 398 mm)
                  Hfront   16 Hsync  62 Hback   60 Hpol N
                  Vfront    9 Vsync   6 Vback   30 Vpol N
Checksum: 0xdb  Unused space in Extension Block: 1 byte

----------------

Warnings:

Block 0, Base EDID:
  Detailed Timing Descriptor #1: DTD is similar but not identical to DMT 0x51.
Block 1, CTA-861 Extension Block:
  IT Video Formats are overscanned by default, but normally this should be underscanned.
  Add a Colorimetry Data Block with the sRGB colorimetry bit set to avoid interop issues.
Block 3, CTA-861 Extension Block:
  IT Video Formats are overscanned by default, but normally this should be underscanned.
  Add a Colorimetry Data Block with the sRGB colorimetry bit set to avoid interop issues.

Failures:

Block 0, Base EDID:
  Detailed Timing Descriptor #2: Mismatch of image size 1365x768 mm vs display size 700x390 mm.
Block 1, CTA-861 Extension Block:
  Missing VCDB, needed for Set Selectable RGB Quantization to avoid interop issues.
Block 2, Base EDID:
  Unknown Extension Block.
Block 3, CTA-861 Extension Block:
  Video Data Block: Duplicate VIC 1.
  Video Data Block: Duplicate VIC 3.
  Video Data Block: Duplicate VIC 4.
  Video Data Block: Duplicate VIC 5.
  Video Data Block: Duplicate VIC 6.
  Video Data Block: Duplicate VIC 16.
  Video Data Block: Duplicate VIC 18.
  Video Data Block: Duplicate VIC 19.
  Video Data Block: Duplicate VIC 20.
  Video Data Block: Duplicate VIC 21.
  Video Data Block: Duplicate VIC 31.
  Video Data Block: Duplicate VIC 33.
  Video Data Block: Duplicate VIC 34.
  Speaker Allocation Data Block: Only one instance of this Data Block is allowed.
  Missing VCDB, needed for Set Selectable RGB Quantization to avoid interop issues.
EDID:
  Base EDID: Some timings are out of range of the Monitor Ranges:
    Vertical Freq: 25.000 - 70.082 Hz (Monitor: 56.000 - 63.000 Hz)
    Horizontal Freq: 15.625 - 67.500 kHz (Monitor: 30.000 - 80.000 kHz)
    Maximum Clock: 148.500 MHz (Monitor: 90.000 MHz)
  Base EDID: The DTD max image size is 1365x768mm, which is larger than the display size 700.0x390.0mm.
  Base EDID: EDID specified 1 extension block(s), but found 3 extension block(s).
  Base EDID: EDID 1.3 requires a Block Map Extension in Block 1 if there are more than 2 blocks in the EDID.
  CTA-861: Native progressive timings are a mix of several resolutions.

EDID conformity: FAIL
