edid-decode (hex):

00 ff ff ff ff ff ff 00 1e 6d a8 3a 00 00 00 00
00 06 01 01 18 1c 15 70 e8 d2 83 9d 57 47 96 24
10 48 4f ff fe 00 3b 4a 31 40 31 4f 45 4f 61 4a
81 40 01 01 01 01 d6 09 80 a0 20 e0 2d 10 10 60
a2 00 04 be 10 00 00 18 56 13 20 00 31 58 19 20
10 50 13 00 04 be 10 00 00 1e 4c 1d 00 30 41 00
26 30 18 88 36 00 04 be 10 00 00 18 30 2a 00 98
51 00 2a 40 30 70 13 00 04 be 10 00 00 1e 00 62

----------------

Block 0, Base EDID:
  EDID Structure Version & Revision: 1.1
  Vendor & Product Identification:
    Manufacturer: GSM
    Model: 15016
    Made in: 1996
  Basic Display Parameters & Features:
    Analog display
    Input voltage level: 0.7/0.3 V
    Configurable signal levels
    Sync: Separate
    Maximum image size: 28 cm x 21 cm
    Gamma: 2.12
    DPMS levels: Standby Suspend Off
    RGB color display
  Color Characteristics:
    Red  : 0.6162, 0.3408
    Green: 0.2773, 0.5878
    Blue : 0.1425, 0.0625
    White: 0.2812, 0.3115
  Established Timings I & II:
    IBM     :   720x400    70.082 Hz   9:5    31.467 kHz  28.320 MHz
    IBM     :   720x400    87.850 Hz   9:5    39.444 kHz  35.500 MHz
    DMT 0x04:   640x480    59.940 Hz   4:3    31.469 kHz  25.175 MHz
    Apple   :   640x480    66.667 Hz   4:3    35.000 kHz  30.240 MHz
    DMT 0x05:   640x480    72.809 Hz   4:3    37.861 kHz  31.500 MHz
    DMT 0x06:   640x480    75.000 Hz   4:3    37.500 kHz  31.500 MHz
    DMT 0x08:   800x600    56.250 Hz   4:3    35.156 kHz  36.000 MHz
    DMT 0x09:   800x600    60.317 Hz   4:3    37.879 kHz  40.000 MHz
    DMT 0x0a:   800x600    72.188 Hz   4:3    48.077 kHz  50.000 MHz
    DMT 0x0b:   800x600    75.000 Hz   4:3    46.875 kHz  49.500 MHz
    Apple   :   832x624    74.551 Hz   4:3    49.726 kHz  57.284 MHz
    DMT 0x0f:  1024x768i   86.958 Hz   4:3    35.522 kHz  44.900 MHz
    DMT 0x10:  1024x768    60.004 Hz   4:3    48.363 kHz  65.000 MHz
    DMT 0x11:  1024x768    70.069 Hz   4:3    56.476 kHz  75.000 MHz
    DMT 0x12:  1024x768    75.029 Hz   4:3    60.023 kHz  78.750 MHz
  Standard Timings:
    Unknown :   720x544    70.000 Hz   4:3
    DMT 0x04:   640x480    59.940 Hz   4:3    31.469 kHz  25.175 MHz
    DMT 0x06:   640x480    75.000 Hz   4:3    37.500 kHz  31.500 MHz
    DMT 0x0b:   800x600    75.000 Hz   4:3    46.875 kHz  49.500 MHz
    Unknown :  1024x768    70.000 Hz   4:3
    DMT 0x20:  1280x960    60.000 Hz   4:3    60.000 kHz 108.000 MHz
  Detailed Timing Descriptors:
    DTD 1:   640x480    59.952 Hz   4:3    31.475 kHz  25.180 MHz (260 mm x 190 mm)
                 Hfront   16 Hsync  96 Hback  48 Hpol N
                 Vfront   10 Vsync   2 Vback  33 Vpol N
    DTD 2:   800x600    75.000 Hz   4:3    46.875 kHz  49.500 MHz (260 mm x 190 mm)
                 Hfront   16 Hsync  80 Hback 160 Hpol P
                 Vfront    1 Vsync   3 Vback  21 Vpol P
    DTD 3:  1024x768    70.069 Hz   4:3    56.476 kHz  75.000 MHz (260 mm x 190 mm)
                 Hfront   24 Hsync 136 Hback 144 Hpol N
                 Vfront    3 Vsync   6 Vback  29 Vpol N
    DTD 4:  1280x1024   60.020 Hz   5:4    63.981 kHz 108.000 MHz (260 mm x 190 mm)
                 Hfront   48 Hsync 112 Hback 248 Hpol P
                 Vfront    1 Vsync   3 Vback  38 Vpol P
Checksum: 0x62
