
EDID (hex):
00ffffffffffff0030e41f0500000000
001b010495221378025be59358549027
1d505400000001010101010101010101
010101010101243680a070381f403020
350058c210000019502b80a070381f40
3020350058c210000019000000fe0044
4a35384d803135365746390a00000000
0000413196011000000a010a20200000

Extracted contents:
header:          00 ff ff ff ff ff ff 00
serial number:   30 e4 1f 05 00 00 00 00 00 1b
version:         01 04
basic params:    95 22 13 78 02
chroma info:     5b e5 93 58 54 90 27 1d 50 54
established:     00 00 00
standard:        01 01 01 01 01 01 01 01 01 01 01 01 01 01 01 01
descriptor 1:    24 36 80 a0 70 38 1f 40 30 20 35 00 58 c2 10 00 00 19
descriptor 2:    50 2b 80 a0 70 38 1f 40 30 20 35 00 58 c2 10 00 00 19
descriptor 3:    00 00 00 fe 00 44 4a 35 38 4d 80 31 35 36 57 46 39 0a
descriptor 4:    00 00 00 00 00 00 41 31 96 01 10 00 00 0a 01 0a 20 20
extensions:      00
checksum:        00

EDID version: 1.4
Manufacturer: LGD Model 51f Serial Number --
Made in year 2017
Digital display
6 bits per primary color channel
DisplayPort interface
Maximum image size: 34 cm x 19 cm
Gamma: 2.20
Supported color formats: RGB 4:4:4
First detailed timing includes the native pixel format and preferred refresh rate
Display x,y Chromaticity:
  Red:   0.5751, 0.3447
  Green: 0.3300, 0.5654
  Blue:  0.1552, 0.1152
  White: 0.3134, 0.3291
Established timings supported:
Standard timings supported:
Detailed mode: Clock 138.600 MHz, 344 mm x 194 mm
               1920 1968 2000 2080 hborder 0
               1080 1083 1088 1111 vborder 0
               -hsync -vsync 
               VertFreq: 59 Hz, HorFreq: 66634 Hz
Detailed mode: Clock 110.880 MHz, 344 mm x 194 mm
               1920 1968 2000 2080 hborder 0
               1080 1083 1088 1111 vborder 0
               -hsync -vsync 
               VertFreq: 47 Hz, HorFreq: 53307 Hz
ASCII string: DJ58M
Manufacturer-specified data, tag 0
Checksum: 0x0 (valid)
EDID block does NOT conform to EDID 1.4!
	Missing name descriptor
	Missing monitor ranges
	Detailed block string not properly terminated
