
EDID (hex):
00ffffffffffff0009e5a80a00000000
141f0104b51f137803ed9ca3544c9926
0f4f5400000001010101010101010101
010101010101609900c8c08050703020
360038c31000001a000000fd001e78f0
f04f010a202020202020000000fe0042
4f452043510a202020202020000000fe
004e4531343546384d2d4e36310a0250
02030f00e60601016060280000000000
00000000000000000000000000000000
00000000000000000000000000000000
00000000000000000000000000000000
00000000000000000000000000000000
00000000000000000000000000000000
00000000000000000000000000000000
000000000000000000000000000018fe
7013790000030114c0320105ff0bc700
2f001f007f074f000200050000000000
00000000000000000000000000000000
00000000000000000000000000000000
00000000000000000000000000000000
00000000000000000000000000000000
00000000000000000000000000000000
00000000000000000000000000006990

Extracted contents:
header:          00 ff ff ff ff ff ff 00
serial number:   09 e5 a8 0a 00 00 00 00 14 1f
version:         01 04
basic params:    b5 1f 13 78 03
chroma info:     ed 9c a3 54 4c 99 26 0f 4f 54
established:     00 00 00
standard:        01 01 01 01 01 01 01 01 01 01 01 01 01 01 01 01
descriptor 1:    60 99 00 c8 c0 80 50 70 30 20 36 00 38 c3 10 00 00 1a
descriptor 2:    00 00 00 fd 00 1e 78 f0 f0 4f 01 0a 20 20 20 20 20 20
descriptor 3:    00 00 00 fe 00 42 4f 45 20 43 51 0a 20 20 20 20 20 20
descriptor 4:    00 00 00 fe 00 4e 45 31 34 35 46 38 4d 2d 4e 36 31 0a
extensions:      02
checksum:        50

EDID version: 1.4
Manufacturer: BOE Model aa8 Serial Number --
Made in week 20 of 2021
Digital display
10 bits per primary color channel
DisplayPort interface
Maximum image size: 31 cm x 19 cm
Gamma: 2.20
Supported color formats: RGB 4:4:4
First detailed timing includes the native pixel format and preferred refresh rate
Display is continuous frequency
Display x,y Chromaticity:
  Red:   0.6396, 0.3300
  Green: 0.2998, 0.5986
  Blue:  0.1503, 0.0595
  White: 0.3115, 0.3281
Established timings supported:
Standard timings supported:
Detailed mode: Clock 392.640 MHz, 312 mm x 195 mm
               3072 3120 3152 3272 hborder 0
               1920 1923 1929 2000 vborder 0
               +hsync -vsync 
               VertFreq: 60 Hz, HorFreq: 120000 Hz
Monitor ranges (bare limits): 30-120Hz V, 240-240kHz H, max dotclock 790MHz
ASCII string: BOE CQ
ASCII string: NE145F8M-N61
Has 2 extension blocks
Checksum: 0x50 (valid)

CTA extension block
Extension version: 3
11 bytes of CTA data
  Extended tag: HDR static metadata data block
    Electro optical transfer functions:
      Traditional gamma - SDR luminance range
    Supported static metadata descriptors:
      Static metadata type 1
    Desired content max luminance: 96 (400.000 cd/m^2)
    Desired content max frame-average luminance: 96 (400.000 cd/m^2)
    Desired content min luminance: 40 (0.098 cd/m^2)
  Unknown tag 0, length 0 (raw 00)
  Unknown tag 0, length 0 (raw 00)
  Unknown tag 0, length 0 (raw 00)
  Unknown tag 0, length 0 (raw 00)
0 native detailed modes
Checksum: 0xfe (valid)


DisplayID extension block
Extension version: 19
Length 121, version 19, extension count 0
Checksum: 0x69 (valid)
Type 1 detailed timing: aspect: 16:10,  
Detailed mode: Clock 785.280 MHz, 0 mm x 0 mm
               3071 3118 3149 3270
               1919 1921 1926 1998
               -hsync -vsync

EDID block does NOT conform to EDID 1.4!
	Required 640x480p60 timings are missing in the established timings
	and/or in the SVD list (VIC 1)
	Missing name descriptor
Warning: One or more of the timings is out of range of the Monitor Ranges:
  Vertical Freq: 60 - 60 Hz
  Horizontal Freq: 120000 - 120000 Hz
  Maximum Clock: 392.640 MHz
