
EDID (hex):
00ffffffffffff00373300170a1a0000
321f0103802418008a00000000000000
000000afcf0001010101010101010101
010101010101302a009851002a403070
1600510e1100001e0e1f008051002030
4080370020560000001c00000010000a
0a0a0a0a0a0a0a0a0a0a0a0a000000fc
000a2020202020202020202020200058

Extracted contents:
header:          00 ff ff ff ff ff ff 00
serial number:   37 33 00 17 0a 1a 00 00 32 1f
version:         01 03
basic params:    80 24 18 00 8a
chroma info:     00 00 00 00 00 00 00 00 00 00
established:     af cf 00
standard:        01 01 01 01 01 01 01 01 01 01 01 01 01 01 01 01
descriptor 1:    30 2a 00 98 51 00 2a 40 30 70 16 00 51 0e 11 00 00 1e
descriptor 2:    0e 1f 00 80 51 00 20 30 40 80 37 00 20 56 00 00 00 1c
descriptor 3:    00 00 00 10 00 0a 0a 0a 0a 0a 0a 0a 0a 0a 0a 0a 0a 0a
descriptor 4:    00 00 00 fc 00 0a 20 20 20 20 20 20 20 20 20 20 20 20
extensions:      00
checksum:        58

EDID version: 1.3
Manufacturer: MYS Model 1700 Serial Number --
Made in week 50 of 2021
Digital display
Maximum image size: 36 cm x 24 cm
Gamma: 1.00
DPMS levels: Standby
RGB color display
First detailed timing is preferred timing
Display x,y Chromaticity:
  Red:   0.0000, 0.0000
  Green: 0.0000, 0.0000
  Blue:  0.0000, 0.0000
  White: 0.0000, 0.0000
Established timings supported:
  720x400@70Hz 9:5 HorFreq: 31469 Hz Clock: 28.320 MHz
  640x480@60Hz 4:3 HorFreq: 31469 Hz Clock: 25.175 MHz
  640x480@72Hz 4:3 HorFreq: 37900 Hz Clock: 31.500 MHz
  640x480@75Hz 4:3 HorFreq: 37500 Hz Clock: 31.500 MHz
  800x600@56Hz 4:3 HorFreq: 35200 Hz Clock: 36.000 MHz
  800x600@60Hz 4:3 HorFreq: 37900 Hz Clock: 40.000 MHz
  800x600@72Hz 4:3 HorFreq: 48100 Hz Clock: 50.000 MHz
  800x600@75Hz 4:3 HorFreq: 46900 Hz Clock: 49.500 MHz
  1024x768@60Hz 4:3 HorFreq: 48400 Hz Clock: 65.000 MHz
  1024x768@70Hz 4:3 HorFreq: 56500 Hz Clock: 75.000 MHz
  1024x768@75Hz 4:3 HorFreq: 60000 Hz Clock: 78.750 MHz
  1280x1024@75Hz 5:4 HorFreq: 80000 Hz Clock: 135.000 MHz
Standard timings supported:
Detailed mode: Clock 108.000 MHz, 337 mm x 270 mm
               1280 1328 1440 1688 hborder 0
               1024 1025 1031 1066 vborder 0
               +hsync +vsync 
               VertFreq: 60 Hz, HorFreq: 63981 Hz
Detailed mode: Clock 79.500 MHz, 32 mm x 86 mm
               1280 1344 1472 1664 hborder 0
                768  771  778  800 vborder 0
               -hsync +vsync 
               VertFreq: 59 Hz, HorFreq: 47776 Hz
Dummy block
Monitor name: 
Checksum: 0x58 (valid)
EDID block does NOT conform to EDID 1.3!
	Missing monitor ranges
EDID block does not conform at all!
	Dummy block filled with garbage
