edid-decode (hex):

00 ff ff ff ff ff ff 00 04 72 69 ad 1a 0d 60 60
06 10 01 03 68 29 1f 78 2e 0a c4 a3 59 4a 97 24
13 50 59 bf ef 00 81 80 81 40 71 4f 90 40 01 01
01 01 01 01 01 01 8f 2f 78 d0 51 1a 27 40 58 90
34 00 98 32 11 00 00 1c 00 00 00 fd 00 38 4c 1e
52 0e 00 0a 20 20 20 20 20 20 00 00 00 fc 00 41
63 65 72 20 41 4c 32 30 31 37 0a 20 00 00 00 ff
00 45 54 4c 36 39 30 39 30 30 31 20 20 20 00 17

00 ff ff ff ff ff ff 00 04 72 69 ad 1a 0d 60 60
06 10 01 03 68 29 1f 78 2e 0a c4 a3 59 4a 97 24
13 50 59 bf ef 00 81 80 81 40 71 4f 90 40 01 01
01 01 01 01 01 01 8f 2f 78 d0 51 1a 27 40 58 90
34 00 98 32 11 00 00 1c 00 00 00 fd 00 38 4c 1e
52 0e 00 0a 20 20 20 20 20 20 00 00 00 fc 00 41
63 65 72 20 41 4c 32 30 31 37 0a 20 00 00 00 ff
00 45 54 4c 36 39 30 39 30 30 31 20 20 20 00 17

----------------

Block 0, Base EDID:
  EDID Structure Version & Revision: 1.3
  Vendor & Product Identification:
    Manufacturer: ACR
    Model: 44393
    Serial Number: ...
    Made in: week 6 of 2006
  Basic Display Parameters & Features:
    Analog display
    Signal Level Standard: 0.700 : 0.000 : 0.700 V p-p
    Blank level equals black level
    Sync: Separate
    Maximum image size: 41 cm x 31 cm
    Gamma: 2.20
    DPMS levels: Off
    RGB color display
    Default (sRGB) color space is primary color space
    First detailed timing is the preferred timing
  Color Characteristics:
    Red  : 0.6367, 0.3476
    Green: 0.2910, 0.5917
    Blue : 0.1435, 0.0742
    White: 0.3134, 0.3476
  Established Timings I & II:
    IBM     :   720x400    70.081663 Hz   9:5     31.467 kHz     28.320000 MHz
    DMT 0x04:   640x480    59.940476 Hz   4:3     31.469 kHz     25.175000 MHz
    Apple   :   640x480    66.666667 Hz   4:3     35.000 kHz     30.240000 MHz
    DMT 0x05:   640x480    72.808802 Hz   4:3     37.861 kHz     31.500000 MHz
    DMT 0x06:   640x480    75.000000 Hz   4:3     37.500 kHz     31.500000 MHz
    DMT 0x08:   800x600    56.250000 Hz   4:3     35.156 kHz     36.000000 MHz
    DMT 0x09:   800x600    60.316541 Hz   4:3     37.879 kHz     40.000000 MHz
    DMT 0x0a:   800x600    72.187572 Hz   4:3     48.077 kHz     50.000000 MHz
    DMT 0x0b:   800x600    75.000000 Hz   4:3     46.875 kHz     49.500000 MHz
    Apple   :   832x624    74.551266 Hz   4:3     49.726 kHz     57.284000 MHz
    DMT 0x10:  1024x768    60.003840 Hz   4:3     48.363 kHz     65.000000 MHz
    DMT 0x11:  1024x768    70.069359 Hz   4:3     56.476 kHz     75.000000 MHz
    DMT 0x12:  1024x768    75.028582 Hz   4:3     60.023 kHz     78.750000 MHz
    DMT 0x24:  1280x1024   75.024675 Hz   5:4     79.976 kHz    135.000000 MHz
  Standard Timings:
    DMT 0x23:  1280x1024   60.019740 Hz   5:4     63.981 kHz    108.000000 MHz
    DMT 0x20:  1280x960    60.000000 Hz   4:3     60.000 kHz    108.000000 MHz
    DMT 0x15:  1152x864    75.000000 Hz   4:3     67.500 kHz    108.000000 MHz
    DMT 0x2a:  1400x1050   59.978442 Hz   4:3     65.317 kHz    121.750000 MHz
  Detailed Timing Descriptors:
    DTD 1:  1400x1050   59.978442 Hz   4:3     65.317 kHz    121.750000 MHz (408 mm x 306 mm)
                 Hfront   88 Hsync 144 Hback  232 Hpol N
                 Vfront    3 Vsync   4 Vback   32 Vpol P
    Display Range Limits:
      Monitor ranges (GTF): 56-76 Hz V, 30-82 kHz H, max dotclock 140 MHz
    Display Product Name: 'Acer AL2017'
    Display Product Serial Number: ...
Checksum: 0x17

----------------

Block 1, Unknown EDID Extension Block 0x00:
  00 ff ff ff ff ff ff 00 04 72 69 ad 1a 0d 60 60 '.........ri...``'
  06 10 01 03 68 29 1f 78 2e 0a c4 a3 59 4a 97 24 '....h).x....YJ.$'
  13 50 59 bf ef 00 81 80 81 40 71 4f 90 40 01 01 '.PY......@qO.@..'
  01 01 01 01 01 01 8f 2f 78 d0 51 1a 27 40 58 90 '......./x.Q.'@X.'
  34 00 98 32 11 00 00 1c 00 00 00 fd 00 38 4c 1e '4..2.........8L.'
  52 0e 00 0a 20 20 20 20 20 20 00 00 00 fc 00 41 'R...      .....A'
  63 65 72 20 41 4c 32 30 31 37 0a 20 00 00 00 ff 'cer AL2017. ....'
  00 45 54 4c 36 39 30 39 30 30 31 20 20 20 00 17 '.ETL6909001   ..'
Checksum: 0x17

----------------

Failures:

Block 0, Base EDID:
  Basic Display Parameters & Features: sRGB is signaled, but the chromaticities do not match.
  Display Product Serial Number: ...
Block 1, Base EDID:
  Unknown Extension Block.
EDID:
  Base EDID: EDID specified 0 extension block(s), but found 1 extension block(s).

EDID conformity: FAIL
