
EDID (hex):
00ffffffffffff000dae211600010000
1b200104b52216780328659759548e27
1e505400000001010101010101010101
0101010101011a9880a070b064403020
a60058d710000018000000fd003090bc
bc27010a202020202020000000fe0043
4d4e0a202020202020202020000000fe
004e3136304a4d452d47544b0a200007

edid-decode (hex):

00 ff ff ff ff ff ff 00 0d ae 21 16 00 01 00 00
1b 20 01 04 b5 22 16 78 03 28 65 97 59 54 8e 27
1e 50 54 00 00 00 01 01 01 01 01 01 01 01 01 01
01 01 01 01 01 01 1a 98 80 a0 70 b0 64 40 30 20
a6 00 58 d7 10 00 00 18 00 00 00 fd 00 30 90 bc
bc 27 01 0a 20 20 20 20 20 20 00 00 00 fe 00 43
4d 4e 0a 20 20 20 20 20 20 20 20 20 00 00 00 fe
00 4e 31 36 30 4a 4d 45 2d 47 54 4b 0a 20 00 07

----------------

Block 0, Base EDID:
  EDID Structure Version & Revision: 1.4
  Vendor & Product Identification:
    Manufacturer: CMN
    Model: 5665
    Serial Number: 256
    Made in: week 27 of 2022
  Basic Display Parameters & Features:
    Digital display
    Bits per primary color channel: 10
    DisplayPort interface
    Maximum image size: 34 cm x 22 cm
    Gamma: 2.20
    Supported color formats: RGB 4:4:4
    First detailed timing includes the native pixel format and preferred refresh rate
    Display is continuous frequency
  Color Characteristics:
    Red  : 0.5898, 0.3496
    Green: 0.3300, 0.5546
    Blue : 0.1533, 0.1191
    White: 0.3134, 0.3291
  Established Timings I & II: none
  Standard Timings: none
  Detailed Timing Descriptors:
    DTD 1:  1920x1200  144.001479 Hz  16:10   187.202 kHz    389.380000 MHz (344 mm x 215 mm)
                 Hfront   48 Hsync  32 Hback   80 Hpol N
                 Vfront   10 Vsync   6 Vback   84 Vpol N
    Display Range Limits:
      Monitor ranges (Bare Limits): 48-144 Hz V, 188-188 kHz H, max dotclock 390 MHz
    Alphanumeric Data String: 'CMN'
    Alphanumeric Data String: 'N160JME-GTK'
Checksum: 0x07
