edid-decode (hex):

00 ff ff ff ff ff ff 00 1e 6d 2a 59 01 01 01 01
01 16 01 03 80 32 1c 78 ea e2 95 a2 55 4f 9f 26
11 50 54 21 08 00 71 40 81 c0 81 00 81 80 95 00
90 40 a9 c0 b3 00 02 3a 80 18 71 38 2d 40 58 2c
45 00 e0 0e 11 00 00 1e 80 43 80 08 71 38 14 40
30 20 35 00 e0 0e 11 00 00 1a 00 00 00 fd 00 38
3d 1e 53 14 00 0a 20 20 20 20 20 20 00 00 00 fc
00 44 32 33 34 33 0a 20 20 20 20 20 20 20 01 e6

02 03 34 f1 4c 90 1f 04 13 05 14 03 12 20 21 22
01 23 09 07 07 83 01 00 00 7a 03 0c 00 10 00 00
2d 20 c0 10 01 41 05 0f 08 10 18 10 88 10 58 10
38 10 48 10 02 3a 80 18 71 38 2d 40 58 2c 45 00
fe 22 11 00 00 1e 01 1d 80 18 71 1c 16 20 58 2c
25 00 fe 22 11 00 00 9e 01 1d 00 72 51 d0 1e 20
6e 28 55 00 fe 22 11 00 00 1e 00 00 00 00 00 00
00 00 00 00 00 00 00 00 00 00 00 00 00 00 00 6c

----------------

Block 0, Base EDID:
  EDID Structure Version & Revision: 1.3
  Vendor & Product Identification:
    Manufacturer: GSM
    Model: 22826
    Serial Number: ...
    Made in: week 1 of 2012
  Basic Display Parameters & Features:
    Digital display
    Maximum image size: 50 cm x 28 cm
    Gamma: 2.20
    DPMS levels: Standby Suspend Off
    RGB color display
    First detailed timing is the preferred timing
  Color Characteristics:
    Red  : 0.6357, 0.3339
    Green: 0.3085, 0.6230
    Blue : 0.1503, 0.0673
    White: 0.3134, 0.3291
  Established Timings I & II:
    DMT 0x04:   640x480    59.940 Hz   4:3    31.469 kHz  25.175 MHz
    DMT 0x09:   800x600    60.317 Hz   4:3    37.879 kHz  40.000 MHz
    DMT 0x10:  1024x768    60.004 Hz   4:3    48.363 kHz  65.000 MHz
  Standard Timings:
    GTF     :  1152x864    60.000 Hz   4:3    53.700 kHz  81.624 MHz
    DMT 0x55:  1280x720    60.000 Hz  16:9    45.000 kHz  74.250 MHz
    DMT 0x1c:  1280x800    59.810 Hz  16:10   49.702 kHz  83.500 MHz
    DMT 0x23:  1280x1024   60.020 Hz   5:4    63.981 kHz 108.000 MHz
    DMT 0x2f:  1440x900    59.887 Hz  16:10   55.935 kHz 106.500 MHz
    DMT 0x2a:  1400x1050   59.978 Hz   4:3    65.317 kHz 121.750 MHz
    DMT 0x53:  1600x900    60.000 Hz  16:9    60.000 kHz 108.000 MHz (RB)
    DMT 0x3a:  1680x1050   59.954 Hz  16:10   65.290 kHz 146.250 MHz
  Detailed Timing Descriptors:
    DTD 1:  1920x1080   60.000 Hz  16:9    67.500 kHz 148.500 MHz (480 mm x 270 mm)
                 Hfront   88 Hsync  44 Hback 148 Hpol P
                 Vfront    4 Vsync   5 Vback  36 Vpol P
    DTD 2:  1920x1080   71.928 Hz  16:9    79.121 kHz 172.800 MHz (480 mm x 270 mm)
                 Hfront   48 Hsync  32 Hback 184 Hpol P
                 Vfront    3 Vsync   5 Vback  12 Vpol N
  Display Range Limits:
    Monitor ranges (GTF): 56-61 Hz V, 30-83 kHz H, max dotclock 200 MHz
    Display Product Name: 'D2343'
  Extension blocks: 1
Checksum: 0xe6

----------------

Block 1, CTA-861 Extension Block:
  Revision: 3
  Underscans IT Video Formats by default
  Basic audio support
  Supports YCbCr 4:4:4
  Supports YCbCr 4:2:2
  Native detailed modes: 1
  Video Data Block:
    VIC  16:  1920x1080   60.000 Hz  16:9    67.500 kHz 148.500 MHz (native)
    VIC  31:  1920x1080   50.000 Hz  16:9    56.250 kHz 148.500 MHz
    VIC   4:  1280x720    60.000 Hz  16:9    45.000 kHz  74.250 MHz
    VIC  19:  1280x720    50.000 Hz  16:9    37.500 kHz  74.250 MHz
    VIC   5:  1920x1080i  60.000 Hz  16:9    33.750 kHz  74.250 MHz
    VIC  20:  1920x1080i  50.000 Hz  16:9    28.125 kHz  74.250 MHz
    VIC   3:   720x480    59.940 Hz  16:9    31.469 kHz  27.000 MHz
    VIC  18:   720x576    50.000 Hz  16:9    31.250 kHz  27.000 MHz
    VIC  32:  1920x1080   24.000 Hz  16:9    27.000 kHz  74.250 MHz
    VIC  33:  1920x1080   25.000 Hz  16:9    28.125 kHz  74.250 MHz
    VIC  34:  1920x1080   30.000 Hz  16:9    33.750 kHz  74.250 MHz
    VIC   1:   640x480    59.940 Hz   4:3    31.469 kHz  25.175 MHz
  Audio Data Block:
    Linear PCM:
      Max channels: 2
      Supported sample rates (kHz): 48 44.1 32
      Supported sample sizes (bits): 24 20 16
  Speaker Allocation Data Block:
    FL/FR - Front Left/Right
  Vendor-Specific Data Block (HDMI), OUI 00-0C-03:
    Source physical address: 1.0.0.0
    Maximum TMDS clock: 225 MHz
    Extended HDMI video details:
      3D present
      3D-capable-VIC mask present
      3D: Side-by-side (half, horizontal)
      3D: Top-and-bottom
      3D: Frame-packing
      3D VIC indices that support these capabilities:
        VIC  16:  1920x1080   60.000 Hz  16:9    67.500 kHz 148.500 MHz
        VIC  31:  1920x1080   50.000 Hz  16:9    56.250 kHz 148.500 MHz
        VIC   4:  1280x720    60.000 Hz  16:9    45.000 kHz  74.250 MHz
        VIC  19:  1280x720    50.000 Hz  16:9    37.500 kHz  74.250 MHz
        VIC  32:  1920x1080   24.000 Hz  16:9    27.000 kHz  74.250 MHz
        VIC  34:  1920x1080   30.000 Hz  16:9    33.750 kHz  74.250 MHz
      3D VIC indices with specific capabilities:
        VIC  16:  1920x1080   60.000 Hz  16:9    67.500 kHz 148.500 MHz (side-by-side, horizontal)
        VIC  31:  1920x1080   50.000 Hz  16:9    56.250 kHz 148.500 MHz (side-by-side, horizontal)
        VIC  32:  1920x1080   24.000 Hz  16:9    27.000 kHz  74.250 MHz (side-by-side, horizontal)
        VIC  20:  1920x1080i  50.000 Hz  16:9    28.125 kHz  74.250 MHz (side-by-side, horizontal)
        VIC  19:  1280x720    50.000 Hz  16:9    37.500 kHz  74.250 MHz (side-by-side, horizontal)
        VIC   5:  1920x1080i  60.000 Hz  16:9    33.750 kHz  74.250 MHz (side-by-side, horizontal)
  Detailed Timing Descriptors:
    DTD 3:  1920x1080   60.000 Hz  16:9    67.500 kHz 148.500 MHz (510 mm x 290 mm)
                 Hfront   88 Hsync  44 Hback 148 Hpol P
                 Vfront    4 Vsync   5 Vback  36 Vpol P
    DTD 4:  1920x1080i  60.000 Hz  16:9    33.750 kHz  74.250 MHz (510 mm x 290 mm)
                 Hfront   88 Hsync  44 Hback 148 Hpol P
                 Vfront    2 Vsync   5 Vback  15 Vpol P Vfront +0.5 Odd Field
                 Vfront    2 Vsync   5 Vback  15 Vpol P Vback  +0.5 Even Field
    DTD 5:  1280x720    60.000 Hz  16:9    45.000 kHz  74.250 MHz (510 mm x 290 mm)
                 Hfront  110 Hsync  40 Hback 220 Hpol P
                 Vfront    5 Vsync   5 Vback  20 Vpol P
Checksum: 0x6c

----------------

Warnings:

Block 1, CTA-861 Extension Block:
  Missing VCDB, needed for Set Selectable RGB Quantization to avoid interop issues.
EDID:
  CTA-861: Multiple native progressive timings are defined.

Failures:

Block 0, Base EDID:
  Detailed Timing Descriptor #1: Mismatch of image size 480x270 mm vs display size 500x280 mm.
  Detailed Timing Descriptor #2: Mismatch of image size 480x270 mm vs display size 500x280 mm.
Block 1, CTA-861 Extension Block:
  Detailed Timing Descriptor #3: Mismatch of image size 510x290 mm vs display size 500x280 mm.
  Detailed Timing Descriptor #4: Mismatch of image size 510x290 mm vs display size 500x280 mm.
  Detailed Timing Descriptor #5: Mismatch of image size 510x290 mm vs display size 500x280 mm.
EDID:
  Base EDID: Some timings are out of range of the Monitor Ranges:
    Vertical Freq: 24.000 - 71.928 Hz (Monitor: 56.000 - 61.000 Hz)
    Horizontal Freq: 27.000 - 79.120 kHz (Monitor: 30.000 - 83.000 kHz)

EDID conformity: FAIL
