edid-decode (hex):

00 ff ff ff ff ff ff 00 4c a3 42 38 00 00 00 00
00 12 01 03 80 1f 11 78 0a 85 95 99 57 4f 8f 26
21 50 54 00 00 00 01 01 01 01 01 01 01 01 01 01
01 01 01 01 01 01 12 1b 56 72 50 00 0c 30 30 20
25 00 35 ae 10 00 00 19 00 00 00 0f 00 00 00 00
00 00 00 00 00 1e b4 02 74 00 00 00 00 fe 00 53
41 4d 53 55 4e 47 0a 20 20 20 20 20 00 00 00 fe
00 31 34 30 41 54 30 37 2d 48 30 31 0a 20 00 c4

----------------

Block 0, Base EDID:
  EDID Structure Version & Revision: 1.3
  Vendor & Product Identification:
    Manufacturer: SEC
    Model: 14402
    Made in: 2008
  Basic Display Parameters & Features:
    Digital display
    Maximum image size: 31 cm x 17 cm
    Gamma: 2.20
    RGB color display
    First detailed timing is the preferred timing
  Color Characteristics:
    Red  : 0.5996, 0.3398
    Green: 0.3095, 0.5595
    Blue : 0.1503, 0.1298
    White: 0.3134, 0.3291
  Established Timings I & II: none
  Standard Timings: none
  Detailed Timing Descriptors:
    DTD 1:  1366x768    60.031185 Hz 683:384   46.824 kHz     69.300000 MHz (309 mm x 174 mm)
                 Hfront   48 Hsync  32 Hback   34 Hpol N
                 Vfront    2 Vsync   5 Vback    5 Vpol N
    Manufacturer-Specified Display Descriptor (0x0f): 00 0f 00 00 00 00 00 00 00 00 00 1e b4 02 74 00 '..............t.'
    Alphanumeric Data String: 'SAMSUNG'
    Alphanumeric Data String: '140AT07-H01'
Checksum: 0xc4

----------------

Failures:

Block 0, Base EDID:
  Missing Display Product Name.
  Missing Display Range Limits Descriptor.

EDID conformity: FAIL
