edid-decode (hex):

00 ff ff ff ff ff ff 00 10 ac 23 b1 40 42 0f 00
23 15 01 03 80 33 1d 78 0a c6 65 a0 59 58 9d 27
0e 50 54 21 08 00 d1 c0 81 c0 81 80 95 00 b3 00
01 01 01 01 01 01 02 3a 80 18 71 38 2d 40 94 2c
45 08 fe 1f 11 00 00 1e 00 00 00 10 00 00 1b 30
40 70 36 00 fe 1f 11 00 00 1e 00 00 00 fc 00 32
33 22 20 41 49 4f 0a 20 20 20 20 20 00 00 00 fd
00 31 4b 1c 5f 15 00 0a 20 20 20 20 20 20 01 51

02 03 13 70 23 09 07 07 83 01 00 00 65 03 0c 00
10 00 00 02 3a 80 d0 72 38 2d 40 94 2c 45 08 fe
1f 11 00 00 1e 00 00 00 fc 00 32 33 22 20 41 49
4f 0a 20 20 20 20 20 00 00 00 fd 00 31 4b 1c 5f
15 00 0a 20 20 20 20 20 20 00 00 00 10 00 21 00
00 1e 00 00 00 10 00 d0 1e 20 6e 00 00 00 10 00
21 00 00 1e 00 00 00 10 00 1c 16 20 10 00 00 00
10 00 21 00 00 9a 00 00 00 00 00 00 00 00 00 da

----------------

Block 0, Base EDID:
  EDID Structure Version & Revision: 1.3
  Vendor & Product Identification:
    Manufacturer: DEL
    Model: 45347
    Serial Number: ...
    Made in: week 35 of 2011
  Basic Display Parameters & Features:
    Digital display
    Maximum image size: 51 cm x 29 cm
    Gamma: 2.20
    RGB color display
    First detailed timing is preferred timing
  Color Characteristics:
    Red  : 0.6279, 0.3476
    Green: 0.3447, 0.6152
    Blue : 0.1533, 0.0566
    White: 0.3134, 0.3291
  Established Timings I & II:
    DMT 0x04:   640x480    59.940 Hz   4:3    31.469 kHz  25.175 MHz
    DMT 0x09:   800x600    60.317 Hz   4:3    37.879 kHz  40.000 MHz
    DMT 0x10:  1024x768    60.004 Hz   4:3    48.363 kHz  65.000 MHz
  Standard Timings:
    DMT 0x52:  1920x1080   60.000 Hz  16:9    67.500 kHz 148.500 MHz
    DMT 0x55:  1280x720    60.000 Hz  16:9    45.000 kHz  74.250 MHz
    DMT 0x23:  1280x1024   60.020 Hz   5:4    63.981 kHz 108.000 MHz
    DMT 0x2f:  1440x900    59.887 Hz  16:10   55.935 kHz 106.500 MHz
    DMT 0x3a:  1680x1050   59.954 Hz  16:10   65.290 kHz 146.250 MHz
  Detailed Timing Descriptors:
    DTD 1:  1920x1080   60.000 Hz  16:9    67.500 kHz 148.500 MHz (510 mm x 287 mm)
                 Hfront  148 Hsync  44 Hback  88 Hpol P
                 Vfront   36 Vsync   5 Vback   4 Vpol P
    Dummy Descriptor:
    Display Product Name: '23" AIO'
  Display Range Limits:
    Monitor ranges (GTF): 49-75 Hz V, 28-95 kHz H, max dotclock 210 MHz
  Extension blocks: 1
Checksum: 0x51

----------------

Block 1, CTA-861 Extension Block:
  Revision: 3
  Basic audio support
  Supports YCbCr 4:4:4
  Supports YCbCr 4:2:2
  Native detailed modes: 0
  Audio Data Block:
    Linear PCM:
      Max channels: 2
      Supported sample rates (kHz): 48 44.1 32
      Supported sample sizes (bits): 24 20 16
  Speaker Allocation Data Block:
    FL/FR - Front Left/Right
  Vendor-Specific Data Block (HDMI), OUI 00-0C-03:
    Source physical address: 1.0.0.0
  Unknown CTA tag 0x00, length 0
  Detailed Timing Descriptors:
    DTD 2:  1920x1080   50.000 Hz  16:9    56.250 kHz 148.500 MHz (510 mm x 287 mm)
                 Hfront  148 Hsync  44 Hback 528 Hpol P
                 Vfront   36 Vsync   5 Vback   4 Vpol P
    Display Product Name: '23" AIO'
  Display Range Limits:
    Monitor ranges (GTF): 49-75 Hz V, 28-95 kHz H, max dotclock 210 MHz
    Dummy Descriptor:
    Dummy Descriptor:
Checksum: 0xda
