
EDID (hex):
00ffffffffffff002124240200000000
0813010380342078eac905a3574b9c25
125054afee807140814081808100a940
a9c090400000e83580a070381f403020
250033cc3100001a000000ff00202020
20202020202020202020000000fd0039
3f1f4611000a202020202020000000fc
00484944313932305831303830440030

Extracted contents:
header:          00 ff ff ff ff ff ff 00
serial number:   21 24 24 02 00 00 00 00 08 13
version:         01 03
basic params:    80 34 20 78 ea
chroma info:     c9 05 a3 57 4b 9c 25 12 50 54
established:     af ee 80
standard:        71 40 81 40 81 80 81 00 a9 40 a9 c0 90 40 00 00
descriptor 1:    e8 35 80 a0 70 38 1f 40 30 20 25 00 33 cc 31 00 00 1a
descriptor 2:    00 00 00 ff 00 20 20 20 20 20 20 20 20 20 20 20 20 20
descriptor 3:    00 00 00 fd 00 39 3f 1f 46 11 00 0a 20 20 20 20 20 20
descriptor 4:    00 00 00 fc 00 48 49 44 31 39 32 30 58 31 30 38 30 44
extensions:      00
checksum:        30

EDID version: 1.3
Manufacturer: HID Model 224 Serial Number --
Made in week 8 of 2009
Digital display
Maximum image size: 52 cm x 32 cm
Gamma: 2.20
DPMS levels: Standby Suspend Off
RGB color display
First detailed timing is preferred timing
Display x,y Chromaticity:
  Red:   0.6396, 0.3398
  Green: 0.2949, 0.6103
  Blue:  0.1445, 0.0703
  White: 0.3134, 0.3291
Established timings supported:
  720x400@70Hz 9:5 HorFreq: 31469 Hz Clock: 28.320 MHz
  640x480@60Hz 4:3 HorFreq: 31469 Hz Clock: 25.175 MHz
  640x480@72Hz 4:3 HorFreq: 37900 Hz Clock: 31.500 MHz
  640x480@75Hz 4:3 HorFreq: 37500 Hz Clock: 31.500 MHz
  800x600@56Hz 4:3 HorFreq: 35200 Hz Clock: 36.000 MHz
  800x600@60Hz 4:3 HorFreq: 37900 Hz Clock: 40.000 MHz
  800x600@72Hz 4:3 HorFreq: 48100 Hz Clock: 50.000 MHz
  800x600@75Hz 4:3 HorFreq: 46900 Hz Clock: 49.500 MHz
  832x624@75Hz 4:3 HorFreq: 49726 Hz Clock: 57.284 MHz
  1024x768@60Hz 4:3 HorFreq: 48400 Hz Clock: 65.000 MHz
  1024x768@70Hz 4:3 HorFreq: 56500 Hz Clock: 75.000 MHz
  1024x768@75Hz 4:3 HorFreq: 60000 Hz Clock: 78.750 MHz
  1152x870@75Hz 192:145 HorFreq: 67500 Hz Clock: 108.000 MHz
Standard timings supported:
  1152x864@60Hz 4:3
  1280x960@60Hz 4:3 HorFreq: 60000 Hz Clock: 108.000 MHz
  1280x1024@60Hz 5:4 HorFreq: 64000 Hz Clock: 108.000 MHz
  1280x800@60Hz 16:10
  1600x1200@60Hz 4:3 HorFreq: 75000 Hz Clock: 162.000 MHz
  1600x900@60Hz 16:9
  1400x1050@60Hz 4:3 HorFreq: 64700 Hz Clock: 101.000 MHz
non-conformant standard timing (0 horiz)
Detailed mode: Clock 138.000 MHz, 819 mm x 460 mm
               1920 1968 2000 2080 hborder 0
               1080 1082 1087 1111 vborder 0
               +hsync -vsync 
               VertFreq: 59 Hz, HorFreq: 66346 Hz
Serial number:              
-- ranges (GTF): 57-63Hz V, 31-70kHz H, max dotclock 170MHz
Checksum: 0x30 (valid)
EDID block does NOT conform to EDID 1.3!
	Name descriptor not terminated with a newline
One or more of the timings is out of range of the Monitor Ranges:
  Vertical Freq: 56 - 75 Hz
  Horizontal Freq: 31469 - 75000 Hz
  Maximum Clock: 162.000 MHz
