edid-decode (hex):

00 ff ff ff ff ff ff 00 0d ae 21 11 00 00 00 00
2d 15 01 03 80 1a 0e 78 0a 69 65 96 57 52 8f 27
22 50 54 00 00 00 01 01 01 01 01 01 01 01 01 01
01 01 01 01 01 01 12 1b 56 72 50 00 0c 30 10 22
26 00 00 90 10 00 00 18 00 00 00 fe 00 4e 31 31
36 42 47 45 2d 4c 42 31 0a 20 00 00 00 fe 00 43
4d 4e 0a 20 20 20 20 20 20 20 20 20 00 00 00 fe
00 4e 31 31 36 42 47 45 2d 4c 42 31 0a 20 00 e9

----------------

Block 0, Base EDID:
  EDID Structure Version & Revision: 1.3
  Vendor & Product Identification:
    Manufacturer: CMN
    Model: 4385
    Made in: week 45 of 2011
  Basic Display Parameters & Features:
    Digital display
    Maximum image size: 26 cm x 14 cm
    Gamma: 2.20
    RGB color display
    First detailed timing is the preferred timing
  Color Characteristics:
    Red  : 0.5869, 0.3417
    Green: 0.3222, 0.5595
    Blue : 0.1533, 0.1347
    White: 0.3134, 0.3291
  Established Timings I & II: none
  Standard Timings: none
  Detailed Timing Descriptors:
    DTD 1:  1366x768    60.031185 Hz 683:384   46.824 kHz     69.300000 MHz (256 mm x 144 mm)
                 Hfront   16 Hsync  34 Hback   64 Hpol N
                 Vfront    2 Vsync   6 Vback    4 Vpol N
    Alphanumeric Data String: 'N116BGE-LB1'
    Alphanumeric Data String: 'CMN'
    Alphanumeric Data String: 'N116BGE-LB1'
Checksum: 0xe9

----------------

Failures:

Block 0, Base EDID:
  Missing Display Product Name.
  Missing Display Range Limits Descriptor.

EDID conformity: FAIL
