
EDID (hex):
00ffffffffffff0061a4e20001000000
0a1e0103807a45780acf74a3574cb023
09484c210800818081c0614095000101
01010101010104740030f2705a80b058
8a0020c23100001e023a801871382d40
582c450020c23100001e000000fc004d
692054560a20202020202020000000fd
00324b1e501e000a20202020202001cd
02034af251010304050790121314161f
5d5e5f6263642f097f07150750570600
3d06c05f7e0183010000e200c96e030c
003000b83c2f008001020304e50e6061
6566e305c301e3060501011d00bc52d0
1e20b8285540c48e2100001e011d80d0
721c1620102c2580c48e2100009e0000
000000000000000000000000000000aa

Extracted contents:
header:          00 ff ff ff ff ff ff 00
serial number:   61 a4 e2 00 01 00 00 00 0a 1e
version:         01 03
basic params:    80 7a 45 78 0a
chroma info:     cf 74 a3 57 4c b0 23 09 48 4c
established:     21 08 00
standard:        81 80 81 c0 61 40 95 00 01 01 01 01 01 01 01 01
descriptor 1:    04 74 00 30 f2 70 5a 80 b0 58 8a 00 20 c2 31 00 00 1e
descriptor 2:    02 3a 80 18 71 38 2d 40 58 2c 45 00 20 c2 31 00 00 1e
descriptor 3:    00 00 00 fc 00 4d 69 20 54 56 0a 20 20 20 20 20 20 20
descriptor 4:    00 00 00 fd 00 32 4b 1e 50 1e 00 0a 20 20 20 20 20 20
extensions:      01
checksum:        cd

EDID version: 1.3
Manufacturer: XMD Model e2 Serial Number --
Made in week 10 of 2020
Digital display
Maximum image size: 122 cm x 69 cm
Gamma: 2.20
RGB color display
First detailed timing is preferred timing
Display x,y Chromaticity:
  Red:   0.6396, 0.3398
  Green: 0.2998, 0.6904
  Blue:  0.1376, 0.0380
  White: 0.2822, 0.2968
Established timings supported:
  640x480@60Hz 4:3 HorFreq: 31469 Hz Clock: 25.175 MHz
  800x600@60Hz 4:3 HorFreq: 37900 Hz Clock: 40.000 MHz
  1024x768@60Hz 4:3 HorFreq: 48400 Hz Clock: 65.000 MHz
Standard timings supported:
  1280x1024@60Hz 5:4 HorFreq: 64000 Hz Clock: 108.000 MHz
  1280x720@60Hz 16:9
  1024x768@60Hz 4:3 HorFreq: 48400 Hz Clock: 65.000 MHz
  1440x900@60Hz 16:10 HorFreq: 55500 Hz Clock: 88.750 MHz
Detailed mode: Clock 297.000 MHz, 800 mm x 450 mm
               3840 4016 4104 4400 hborder 0
               2160 2168 2178 2250 vborder 0
               +hsync +vsync 
               VertFreq: 30 Hz, HorFreq: 67500 Hz
Detailed mode: Clock 148.500 MHz, 800 mm x 450 mm
               1920 2008 2052 2200 hborder 0
               1080 1084 1089 1125 vborder 0
               +hsync +vsync 
               VertFreq: 60 Hz, HorFreq: 67500 Hz
Monitor name: Mi TV
Monitor ranges (GTF): 50-75Hz V, 30-80kHz H, max dotclock 300MHz
Has 1 extension blocks
Checksum: 0xcd (valid)

CTA extension block
Extension version: 3
70 bytes of CTA data
  Video data block
    VIC   1 640x480@60Hz 4:3  HorFreq: 31469 Hz Clock: 25.175 MHz
    VIC   3 720x480@60Hz 16:9  HorFreq: 31469 Hz Clock: 27.000 MHz
    VIC   4 1280x720@60Hz 16:9  HorFreq: 45000 Hz Clock: 74.250 MHz
    VIC   5 1920x1080i@60Hz 16:9  HorFreq: 33750 Hz Clock: 74.250 MHz
    VIC   7 1440x480i@60Hz 16:9  HorFreq: 15734 Hz Clock: 27.000 MHz
    VIC  16 1920x1080@60Hz 16:9 (native) HorFreq: 67500 Hz Clock: 148.500 MHz
    VIC  18 720x576@50Hz 16:9  HorFreq: 31250 Hz Clock: 27.000 MHz
    VIC  19 1280x720@50Hz 16:9  HorFreq: 37500 Hz Clock: 74.250 MHz
    VIC  20 1920x1080i@50Hz 16:9  HorFreq: 28125 Hz Clock: 74.250 MHz
    VIC  22 1440x576i@50Hz 16:9  HorFreq: 15625 Hz Clock: 27.000 MHz
    VIC  31 1920x1080@50Hz 16:9  HorFreq: 56250 Hz Clock: 148.500 MHz
    VIC  93 3840x2160@24Hz 16:9  HorFreq: 54000 Hz Clock: 297.000 MHz
    VIC  94 3840x2160@25Hz 16:9  HorFreq: 56250 Hz Clock: 297.000 MHz
    VIC  95 3840x2160@30Hz 16:9  HorFreq: 67500 Hz Clock: 297.000 MHz
    VIC  98 4096x2160@24Hz 256:135  HorFreq: 54000 Hz Clock: 297.000 MHz
    VIC  99 4096x2160@25Hz 256:135  HorFreq: 56250 Hz Clock: 297.000 MHz
    VIC 100 4096x2160@30Hz 256:135  HorFreq: 67500 Hz Clock: 297.000 MHz
  Audio data block
    Linear PCM, max channels 2
      Supported sample rates (kHz): 192 176.4 96 88.2 48 44.1 32
      Supported sample sizes (bits): 24 20 16
    AC-3, max channels 6
      Supported sample rates (kHz): 48 44.1 32
      Maximum bit rate: 640 kHz
    Dolby Digital+, max channels 8
      Supported sample rates (kHz): 48 44.1
    DTS, max channels 6
      Supported sample rates (kHz): 48 44.1
      Maximum bit rate: 1536 kHz
    DTS-HD, max channels 8
      Supported sample rates (kHz): 192 176.4 96 88.2 48 44.1
  Speaker allocation data block
    Speaker map:
      FL/FR - Front Left/Right
  Extended tag: Video capability data block
    YCbCr quantization: Selectable (via AVI YQ) (1)
    RGB quantization: Selectable (via AVI Q) (1)
    PT scan behaviour: No Data (0)
    IT scan behaviour: Always Underscanned (2)
    CE scan behaviour: Always Overscannned (1)
  Vendor-specific data block, OUI 000c03 (HDMI)
    Source physical address 3.0.0.0
    Supports_AI
    DC_36bit
    DC_30bit
    DC_Y444
    Maximum TMDS clock: 300MHz
    Extended HDMI video details:
      HDMI VIC 1 3840x2160@30Hz 16:9 HorFreq: 67500 Hz Clock: 297.000 MHz
      HDMI VIC 2 3840x2160@25Hz 16:9 HorFreq: 56250 Hz Clock: 297.000 MHz
      HDMI VIC 3 3840x2160@24Hz 16:9 HorFreq: 54000 Hz Clock: 297.000 MHz
      HDMI VIC 4 4096x2160@24Hz 256:135 HorFreq: 54000 Hz Clock: 297.000 MHz
  Extended tag: YCbCr 4:2:0 video data block
    VIC  96 3840x2160@50Hz 16:9  HorFreq: 112500 Hz Clock: 297.000 MHz
    VIC  97 3840x2160@60Hz 16:9  HorFreq: 135000 Hz Clock: 297.000 MHz
    VIC 101 4096x2160@50Hz 256:135  HorFreq: 112500 Hz Clock: 297.000 MHz
    VIC 102 4096x2160@60Hz 256:135  HorFreq: 135000 Hz Clock: 297.000 MHz
  Extended tag: Colorimetry data block
    xvYCC601
    xvYCC709
    BT2020YCC
    BT2020RGB
  Extended tag: HDR static metadata data block
    Electro optical transfer functions:
      Traditional gamma - SDR luminance range
      SMPTE ST2084
    Supported static metadata descriptors:
      Static metadata type 1
Underscans PC formats by default
Basic audio support
Supports YCbCr 4:4:4
Supports YCbCr 4:2:2
2 native detailed modes
Detailed mode: Clock 74.250 MHz, 708 mm x 398 mm
               1280 1720 1760 1980 hborder 0
                720  725  730  750 vborder 0
               +hsync +vsync 
               VertFreq: 50 Hz, HorFreq: 37500 Hz
Detailed mode: Clock 74.250 MHz, 708 mm x 398 mm
               1920 2448 2492 2640 hborder 0
                540  542  547  562 vborder 0
               +hsync +vsync interlaced 
               VertFreq: 50 Hz, HorFreq: 28125 Hz
Checksum: 0xaa (valid)

One or more of the timings is out of range of the Monitor Ranges:
  Vertical Freq: 24 - 60 Hz
  Horizontal Freq: 15625 - 135000 Hz
  Maximum Clock: 297.000 MHz
