edid-decode (hex):

00 ff ff ff ff ff ff 00 52 62 13 01 01 01 01 01
ff 19 01 03 80 7a 44 78 0a 0d c9 a0 57 47 98 27
12 48 4c 2f ce 00 81 80 01 01 01 01 01 01 01 01
01 01 01 01 01 01 02 3a 80 d0 72 38 2d 40 10 2c
45 80 c1 ad 42 00 00 1e 66 21 50 b0 51 00 1b 30
40 70 36 00 bd ad 42 00 00 1e 00 00 00 fc 00 54
4f 53 48 49 42 41 2d 54 56 0a 20 20 00 00 00 fd
00 17 4c 0f 44 0f 00 0a 20 20 20 20 20 20 01 e0

02 03 2a 70 50 1f 10 20 13 04 14 05 12 11 03 02
16 15 07 06 01 26 09 07 07 15 07 50 6d 03 0c 00
20 00 38 2d c0 15 15 1f 1f 00 8c 0a d0 90 20 40
31 20 0c 40 55 00 91 ad 32 00 00 18 0e 1f 00 80
51 00 1e 30 40 80 37 00 75 ad 42 00 00 1c a9 1a
00 a0 50 00 16 30 30 20 37 00 75 ad 42 00 00 1a
f1 27 00 a0 51 00 25 30 50 80 37 00 75 ad 42 00
00 1c 00 00 00 00 00 00 00 00 00 00 00 00 00 e9

----------------

Block 0, Base EDID:
  EDID Structure Version & Revision: 1.3
  Vendor & Product Identification:
    Manufacturer: TSB
    Model: 275
    Serial Number: ...
    Model year: 2015
  Basic Display Parameters & Features:
    Digital display
    Maximum image size: 122 cm x 68 cm
    Gamma: 2.20
    RGB color display
    First detailed timing is preferred timing
  Color Characteristics:
    Red  : 0.6250, 0.3398
    Green: 0.2802, 0.5947
    Blue : 0.1552, 0.0703
    White: 0.2832, 0.2978
  Established Timings I & II:
    DMT 0x04:   640x480    59.940 Hz   4:3    31.469 kHz  25.175 MHz
    DMT 0x05:   640x480    72.809 Hz   4:3    37.861 kHz  31.500 MHz
    DMT 0x06:   640x480    75.000 Hz   4:3    37.500 kHz  31.500 MHz
    DMT 0x08:   800x600    56.250 Hz   4:3    35.156 kHz  36.000 MHz
    DMT 0x09:   800x600    60.317 Hz   4:3    37.879 kHz  40.000 MHz
    DMT 0x0a:   800x600    72.188 Hz   4:3    48.077 kHz  50.000 MHz
    DMT 0x0b:   800x600    75.000 Hz   4:3    46.875 kHz  49.500 MHz
    DMT 0x10:  1024x768    60.004 Hz   4:3    48.363 kHz  65.000 MHz
    DMT 0x11:  1024x768    70.069 Hz   4:3    56.476 kHz  75.000 MHz
    DMT 0x12:  1024x768    75.029 Hz   4:3    60.023 kHz  78.750 MHz
  Standard Timings:
    DMT 0x23:  1280x1024   60.020 Hz   5:4    63.981 kHz 108.000 MHz
  Detailed Timing Descriptors:
    DTD 1:  1920x1080   50.000 Hz  16:9    56.250 kHz 148.500 MHz (1217 mm x 685 mm)
                 Hfront  528 Hsync  44 Hback 148 Hpol P
                 Vfront    4 Vsync   5 Vback  36 Vpol P
    DTD 2:  1360x768    60.015 Hz  85:48   47.712 kHz  85.500 MHz (1213 mm x 685 mm)
                 Hfront   64 Hsync 112 Hback 256 Hpol P
                 Vfront    3 Vsync   6 Vback  18 Vpol P
    Display Product Name: 'TOSHIBA-TV'
  Display Range Limits:
    Monitor ranges (GTF): 23-76 Hz V, 15-68 kHz H, max dotclock 150 MHz
  Extension blocks: 1
Checksum: 0xe0

----------------

Block 1, CTA-861 Extension Block:
  Revision: 3
  Basic audio support
  Supports YCbCr 4:4:4
  Supports YCbCr 4:2:2
  Native detailed modes: 0
  Video Data Block:
    VIC  31:  1920x1080   50.000 Hz  16:9    56.250 kHz 148.500 MHz
    VIC  16:  1920x1080   60.000 Hz  16:9    67.500 kHz 148.500 MHz
    VIC  32:  1920x1080   24.000 Hz  16:9    27.000 kHz  74.250 MHz
    VIC  19:  1280x720    50.000 Hz  16:9    37.500 kHz  74.250 MHz
    VIC   4:  1280x720    60.000 Hz  16:9    45.000 kHz  74.250 MHz
    VIC  20:  1920x1080i  50.000 Hz  16:9    28.125 kHz  74.250 MHz
    VIC   5:  1920x1080i  60.000 Hz  16:9    33.750 kHz  74.250 MHz
    VIC  18:   720x576    50.000 Hz  16:9    31.250 kHz  27.000 MHz
    VIC  17:   720x576    50.000 Hz   4:3    31.250 kHz  27.000 MHz
    VIC   3:   720x480    59.940 Hz  16:9    31.469 kHz  27.000 MHz
    VIC   2:   720x480    59.940 Hz   4:3    31.469 kHz  27.000 MHz
    VIC  22:  1440x576i   50.000 Hz  16:9    15.625 kHz  27.000 MHz
    VIC  21:  1440x576i   50.000 Hz   4:3    15.625 kHz  27.000 MHz
    VIC   7:  1440x480i   59.940 Hz  16:9    15.734 kHz  27.000 MHz
    VIC   6:  1440x480i   59.940 Hz   4:3    15.734 kHz  27.000 MHz
    VIC   1:   640x480    59.940 Hz   4:3    31.469 kHz  25.175 MHz
  Audio Data Block:
    Linear PCM:
      Max channels: 2
      Supported sample rates (kHz): 48 44.1 32
      Supported sample sizes (bits): 24 20 16
    AC-3:
      Max channels: 6
      Supported sample rates (kHz): 48 44.1 32
      Maximum bit rate: 640 kb/s
  Vendor-Specific Data Block (HDMI), OUI 00-0C-03:
    Source physical address: 2.0.0.0
    DC_36bit
    DC_30bit
    DC_Y444
    Maximum TMDS clock: 225 MHz
    Video latency: 43 ms
    Audio latency: 43 ms
    Interlaced video latency: 63 ms
    Interlaced audio latency: 63 ms
  Detailed Timing Descriptors:
    DTD 3:   720x576    50.000 Hz   5:4    31.250 kHz  27.000 MHz (913 mm x 685 mm)
                 Hfront   12 Hsync  64 Hback  68 Hpol N
                 Vfront    5 Vsync   5 Vback  39 Vpol N
    DTD 4:  1280x768    59.870 Hz   5:3    47.776 kHz  79.500 MHz (1141 mm x 685 mm)
                 Hfront   64 Hsync 128 Hback 192 Hpol N
                 Vfront    3 Vsync   7 Vback  20 Vpol P
    DTD 5:  1280x768    59.995 Hz   5:3    47.396 kHz  68.250 MHz (1141 mm x 685 mm)
                 Hfront   48 Hsync  32 Hback  80 Hpol P
                 Vfront    3 Vsync   7 Vback  12 Vpol N
    DTD 6:  1280x768    74.893 Hz   5:3    60.289 kHz 102.250 MHz (1141 mm x 685 mm)
                 Hfront   80 Hsync 128 Hback 208 Hpol N
                 Vfront    3 Vsync   7 Vback  27 Vpol P
Checksum: 0xe9

----------------

Failures:

Block 0, Base EDID:
  Vendor & Product Identification: EDID 1.3 does not support week 0xff.

EDID conformity: FAIL
