
EDID (hex):
00ffffffffffff002ceeffff00000000
1e1f0104b55021783b8365b34a39b327
135054a54b00714f81c0814081800101
a9c0b300d1c04d7d70a0d0a02d503020
35001d4e3100001a99fa70a0d0a02d50
302035001d4e3100001a000000fd0030
90a0a03c010a202020202020000000fc
004b414d4e3334465851554c420a0289
02032ef44d010203040590111213141f
403f2309070783010000e60607016560
29e305e301681a00000101309000023a
801871382d40582c96001d4e3100001e
58bd00a0a0a02d50302035001d4e3100
001ad5d070a0d0a02d50302035001d4e
3100001aa348b86861a0325030403500
1d4e3100001a00000000000000000024
00ffffffffffff002ceeffff00000000
1e1f0104b55021783b8365b34a39b327
135054a54b00714f81c0814081800101
a9c0b300d1c04d7d70a0d0a02d503020
35001d4e3100001a99fa70a0d0a02d50
302035001d4e3100001a000000fd0030
90a0a03c010a202020202020000000fc
004b414d4e3334465851554c420a0289

edid-decode (hex):

00 ff ff ff ff ff ff 00 2c ee ff ff 00 00 00 00
1e 1f 01 04 b5 50 21 78 3b 83 65 b3 4a 39 b3 27
13 50 54 a5 4b 00 71 4f 81 c0 81 40 81 80 01 01
a9 c0 b3 00 d1 c0 4d 7d 70 a0 d0 a0 2d 50 30 20
35 00 1d 4e 31 00 00 1a 99 fa 70 a0 d0 a0 2d 50
30 20 35 00 1d 4e 31 00 00 1a 00 00 00 fd 00 30
90 a0 a0 3c 01 0a 20 20 20 20 20 20 00 00 00 fc
00 4b 41 4d 4e 33 34 46 58 51 55 4c 42 0a 02 89

02 03 2e f4 4d 01 02 03 04 05 90 11 12 13 14 1f
40 3f 23 09 07 07 83 01 00 00 e6 06 07 01 65 60
29 e3 05 e3 01 68 1a 00 00 01 01 30 90 00 02 3a
80 18 71 38 2d 40 58 2c 96 00 1d 4e 31 00 00 1e
58 bd 00 a0 a0 a0 2d 50 30 20 35 00 1d 4e 31 00
00 1a d5 d0 70 a0 d0 a0 2d 50 30 20 35 00 1d 4e
31 00 00 1a a3 48 b8 68 61 a0 32 50 30 40 35 00
1d 4e 31 00 00 1a 00 00 00 00 00 00 00 00 00 24

00 ff ff ff ff ff ff 00 2c ee ff ff 00 00 00 00
1e 1f 01 04 b5 50 21 78 3b 83 65 b3 4a 39 b3 27
13 50 54 a5 4b 00 71 4f 81 c0 81 40 81 80 01 01
a9 c0 b3 00 d1 c0 4d 7d 70 a0 d0 a0 2d 50 30 20
35 00 1d 4e 31 00 00 1a 99 fa 70 a0 d0 a0 2d 50
30 20 35 00 1d 4e 31 00 00 1a 00 00 00 fd 00 30
90 a0 a0 3c 01 0a 20 20 20 20 20 20 00 00 00 fc
00 4b 41 4d 4e 33 34 46 58 51 55 4c 42 0a 02 89

----------------

Block 0, Base EDID:
  EDID Structure Version & Revision: 1.4
  Vendor & Product Identification:
    Manufacturer: KGN
    Model: 65535
    Made in: week 30 of 2021
  Basic Display Parameters & Features:
    Digital display
    Bits per primary color channel: 10
    DisplayPort interface
    Maximum image size: 80 cm x 33 cm
    Gamma: 2.20
    DPMS levels: Off
    Supported color formats: RGB 4:4:4, YCrCb 4:4:4, YCrCb 4:2:2
    First detailed timing includes the native pixel format and preferred refresh rate
    Display is continuous frequency
  Color Characteristics:
    Red  : 0.7011, 0.2890
    Green: 0.2226, 0.7021
    Blue : 0.1533, 0.0761
    White: 0.3134, 0.3291
  Established Timings I & II:
    IBM     :   720x400    70.081663 Hz   9:5     31.467 kHz     28.320000 MHz
    DMT 0x04:   640x480    59.940476 Hz   4:3     31.469 kHz     25.175000 MHz
    DMT 0x06:   640x480    75.000000 Hz   4:3     37.500 kHz     31.500000 MHz
    DMT 0x09:   800x600    60.316541 Hz   4:3     37.879 kHz     40.000000 MHz
    DMT 0x0b:   800x600    75.000000 Hz   4:3     46.875 kHz     49.500000 MHz
    DMT 0x10:  1024x768    60.003840 Hz   4:3     48.363 kHz     65.000000 MHz
    DMT 0x12:  1024x768    75.028582 Hz   4:3     60.023 kHz     78.750000 MHz
    DMT 0x24:  1280x1024   75.024675 Hz   5:4     79.976 kHz    135.000000 MHz
  Standard Timings:
    DMT 0x15:  1152x864    75.000000 Hz   4:3     67.500 kHz    108.000000 MHz
    DMT 0x55:  1280x720    60.000000 Hz  16:9     45.000 kHz     74.250000 MHz
    DMT 0x20:  1280x960    60.000000 Hz   4:3     60.000 kHz    108.000000 MHz
    DMT 0x23:  1280x1024   60.019740 Hz   5:4     63.981 kHz    108.000000 MHz
    DMT 0x53:  1600x900    60.000000 Hz  16:9     60.000 kHz    108.000000 MHz (RB)
    DMT 0x3a:  1680x1050   59.954250 Hz  16:10    65.290 kHz    146.250000 MHz
    DMT 0x52:  1920x1080   60.000000 Hz  16:9     67.500 kHz    148.500000 MHz
  Detailed Timing Descriptors:
    DTD 1:  3440x1440   60.001871 Hz  43:18    89.103 kHz    320.770000 MHz (797 mm x 334 mm)
                 Hfront   48 Hsync  32 Hback   80 Hpol P
                 Vfront    3 Vsync   5 Vback   37 Vpol N
    DTD 2:  3440x1440  120.001871 Hz  43:18   178.203 kHz    641.530000 MHz (797 mm x 334 mm)
                 Hfront   48 Hsync  32 Hback   80 Hpol P
                 Vfront    3 Vsync   5 Vback   37 Vpol N
    Display Range Limits:
      Monitor ranges (Bare Limits): 48-144 Hz V, 160-160 kHz H, max dotclock 600 MHz
    Display Product Name: 'KAMN34FXQULB'
  Extension blocks: 2
Checksum: 0x89

----------------

Block 1, CTA-861 Extension Block:
  Revision: 3
  Underscans IT Video Formats by default
  Basic audio support
  Supports YCbCr 4:4:4
  Supports YCbCr 4:2:2
  Native detailed modes: 4
  Video Data Block:
    VIC   1:   640x480    59.940476 Hz   4:3     31.469 kHz     25.175000 MHz
    VIC   2:   720x480    59.940060 Hz   4:3     31.469 kHz     27.000000 MHz
    VIC   3:   720x480    59.940060 Hz  16:9     31.469 kHz     27.000000 MHz
    VIC   4:  1280x720    60.000000 Hz  16:9     45.000 kHz     74.250000 MHz
    VIC   5:  1920x1080i  60.000000 Hz  16:9     33.750 kHz     74.250000 MHz
    VIC  16:  1920x1080   60.000000 Hz  16:9     67.500 kHz    148.500000 MHz (native)
    VIC  17:   720x576    50.000000 Hz   4:3     31.250 kHz     27.000000 MHz
    VIC  18:   720x576    50.000000 Hz  16:9     31.250 kHz     27.000000 MHz
    VIC  19:  1280x720    50.000000 Hz  16:9     37.500 kHz     74.250000 MHz
    VIC  20:  1920x1080i  50.000000 Hz  16:9     28.125 kHz     74.250000 MHz
    VIC  31:  1920x1080   50.000000 Hz  16:9     56.250 kHz    148.500000 MHz
    VIC  64:  1920x1080  100.000000 Hz  16:9    112.500 kHz    297.000000 MHz
    VIC  63:  1920x1080  120.000000 Hz  16:9    135.000 kHz    297.000000 MHz
  Audio Data Block:
    Linear PCM:
      Max channels: 2
      Supported sample rates (kHz): 48 44.1 32
      Supported sample sizes (bits): 24 20 16
  Speaker Allocation Data Block:
    FL/FR - Front Left/Right
  HDR Static Metadata Data Block:
    Electro optical transfer functions:
      Traditional gamma - SDR luminance range
      Traditional gamma - HDR luminance range
      SMPTE ST2084
    Supported static metadata descriptors:
      Static metadata type 1
    Desired content max luminance: 101 (445.755 cd/m^2)
    Desired content max frame-average luminance: 96 (400.000 cd/m^2)
    Desired content min luminance: 41 (0.115 cd/m^2)
  Colorimetry Data Block:
    xvYCC601
    xvYCC709
    BT2020cYCC
    BT2020YCC
    BT2020RGB
    Gamut Boundary Description Metadata Profile P0
  Vendor-Specific Data Block (AMD), OUI 00-00-1A:
    Version: 1.1
    Minimum Refresh Rate: 48 Hz
    Maximum Refresh Rate: 144 Hz
    Flags 1.x: 0x00
  Detailed Timing Descriptors:
    DTD 3:  1920x1080   60.000000 Hz  16:9     67.500 kHz    148.500000 MHz (797 mm x 334 mm)
                 Hfront   88 Hsync  44 Hback  148 Hpol P
                 Vfront    9 Vsync   6 Vback   30 Vpol P
    DTD 4:  2560x1440  120.003961 Hz  16:9    178.206 kHz    484.720000 MHz (797 mm x 334 mm)
                 Hfront   48 Hsync  32 Hback   80 Hpol P
                 Vfront    3 Vsync   5 Vback   37 Vpol N
    DTD 5:  3440x1440  100.001871 Hz  43:18   148.503 kHz    534.610000 MHz (797 mm x 334 mm)
                 Hfront   48 Hsync  32 Hback   80 Hpol P
                 Vfront    3 Vsync   5 Vback   37 Vpol N
    DTD 6:  1720x1440   59.999355 Hz  43:36    89.399 kHz    185.950000 MHz (797 mm x 334 mm)
                 Hfront   48 Hsync  64 Hback  248 Hpol P
                 Vfront    3 Vsync   5 Vback   42 Vpol N
Checksum: 0x24  Unused space in Extension Block: 9 bytes

----------------

Block 2, Unknown EDID Extension Block 0x00:
  00 ff ff ff ff ff ff 00 2c ee ff ff 00 00 00 00 '........,.......'
  1e 1f 01 04 b5 50 21 78 3b 83 65 b3 4a 39 b3 27 '.....P!x;.e.J9.''
  13 50 54 a5 4b 00 71 4f 81 c0 81 40 81 80 01 01 '.PT.K.qO...@....'
  a9 c0 b3 00 d1 c0 4d 7d 70 a0 d0 a0 2d 50 30 20 '......M}p...-P0 '
  35 00 1d 4e 31 00 00 1a 99 fa 70 a0 d0 a0 2d 50 '5..N1.....p...-P'
  30 20 35 00 1d 4e 31 00 00 1a 00 00 00 fd 00 30 '0 5..N1........0'
  90 a0 a0 3c 01 0a 20 20 20 20 20 20 00 00 00 fc '...<..      ....'
  00 4b 41 4d 4e 33 34 46 58 51 55 4c 42 0a 02 89 '.KAMN34FXQULB...'
Checksum: 0x89
