
EDID (hex):
00ffffffffffff003eb4960000000000
05190103a01e1778820013a057499b26
10484eadce003140454c614a01010101
01010101010164190040410026301888
360055001100001c0e1f008051001e30
3020370070cf1000001c9e2000905120
1f304880360014cf1000001c000000fc
00416e616c6f670a2020202020200183
02031b41230907078301000067030c00
2000002143100403e2000f8c0ad08a20
e02d10103e9600a05a00000000000000
00000000000000000000000000000000
00000000000000000000000000000000
00000000000000000000000000000000
00000000000000000000000000000000
000000000000000000000000000000d4

Extracted contents:
header:          00 ff ff ff ff ff ff 00
serial number:   3e b4 96 00 00 00 00 00 05 19
version:         01 03
basic params:    a0 1e 17 78 82
chroma info:     00 13 a0 57 49 9b 26 10 48 4e
established:     ad ce 00
standard:        31 40 45 4c 61 4a 01 01 01 01 01 01 01 01 01 01
descriptor 1:    64 19 00 40 41 00 26 30 18 88 36 00 55 00 11 00 00 1c
descriptor 2:    0e 1f 00 80 51 00 1e 30 30 20 37 00 70 cf 10 00 00 1c
descriptor 3:    9e 20 00 90 51 20 1f 30 48 80 36 00 14 cf 10 00 00 1c
descriptor 4:    00 00 00 fc 00 41 6e 61 6c 6f 67 0a 20 20 20 20 20 20
extensions:      01
checksum:        83

EDID version: 1.3
Manufacturer: OUT Model 96 Serial Number --
Made in week 5 of 2015
Digital display
Maximum image size: 30 cm x 23 cm
Gamma: 2.20
DPMS levels: Standby
Monochrome or grayscale display
First detailed timing is preferred timing
Display x,y Chromaticity:
  Red:   0.6250, 0.3398
  Green: 0.2851, 0.6054
  Blue:  0.1484, 0.0634
  White: 0.2812, 0.3076
Established timings supported:
  720x400@70Hz 9:5 HorFreq: 31469 Hz Clock: 28.320 MHz
  640x480@60Hz 4:3 HorFreq: 31469 Hz Clock: 25.175 MHz
  640x480@72Hz 4:3 HorFreq: 37900 Hz Clock: 31.500 MHz
  640x480@75Hz 4:3 HorFreq: 37500 Hz Clock: 31.500 MHz
  800x600@60Hz 4:3 HorFreq: 37900 Hz Clock: 40.000 MHz
  800x600@72Hz 4:3 HorFreq: 48100 Hz Clock: 50.000 MHz
  800x600@75Hz 4:3 HorFreq: 46900 Hz Clock: 49.500 MHz
  1024x768@60Hz 4:3 HorFreq: 48400 Hz Clock: 65.000 MHz
  1024x768@70Hz 4:3 HorFreq: 56500 Hz Clock: 75.000 MHz
  1024x768@75Hz 4:3 HorFreq: 60000 Hz Clock: 78.750 MHz
Standard timings supported:
  640x480@60Hz 4:3 HorFreq: 31469 Hz Clock: 25.175 MHz
  800x600@72Hz 4:3 HorFreq: 48100 Hz Clock: 50.000 MHz
  1024x768@70Hz 4:3 HorFreq: 56500 Hz Clock: 75.000 MHz
Detailed mode: Clock 65.000 MHz, 341 mm x 256 mm
               1024 1048 1184 1344 hborder 0
                768  771  777  806 vborder 0
               -hsync +vsync 
               VertFreq: 60 Hz, HorFreq: 48363 Hz
Detailed mode: Clock 79.500 MHz, 368 mm x 207 mm
               1280 1328 1360 1664 hborder 0
                768  771  778  798 vborder 0
               -hsync +vsync 
               VertFreq: 59 Hz, HorFreq: 47776 Hz
Detailed mode: Clock 83.500 MHz, 276 mm x 207 mm
               1280 1352 1480 1680 hborder 0
                800  803  809  831 vborder 0
               -hsync +vsync 
               VertFreq: 59 Hz, HorFreq: 49702 Hz
Monitor name: Analog
Has 1 extension blocks
Checksum: 0x83 (valid)

CTA extension block
Extension version: 3
23 bytes of CTA data
  Audio data block
    Linear PCM, max channels 2
      Supported sample rates (kHz): 48 44.1 32
      Supported sample sizes (bits): 24 20 16
  Speaker allocation data block
    Speaker map:
      FL/FR - Front Left/Right
  Vendor-specific data block, OUI 000c03 (HDMI)
    Source physical address 2.0.0.0
    Maximum TMDS clock: 165MHz
  Video data block
    VIC  16 1920x1080@60Hz 16:9  HorFreq: 67500 Hz Clock: 148.500 MHz
    VIC   4 1280x720@60Hz 16:9  HorFreq: 45000 Hz Clock: 74.250 MHz
    VIC   3 720x480@60Hz 16:9  HorFreq: 31469 Hz Clock: 27.000 MHz
  Extended tag: Video capability data block
    YCbCr quantization: No Data (0)
    RGB quantization: No Data (0)
    PT scan behaviour: No Data (0)
    IT scan behaviour: Support both over- and underscan (3)
    CE scan behaviour: Support both over- and underscan (3)
Basic audio support
1 native detailed modes
Detailed mode: Clock 27.000 MHz, 160 mm x 90 mm
                720  736  798  858 hborder 0
                480  489  495  525 vborder 0
               -hsync -vsync analog composite 
               VertFreq: 59 Hz, HorFreq: 31468 Hz
Checksum: 0xd4 (valid)

EDID block does NOT conform to EDID 1.3!
	Digital display field contains garbage: 20
	Missing monitor ranges
