edid-decode (hex):

00 ff ff ff ff ff ff 00 04 72 8c 04 98 46 90 81
13 1c 01 03 68 29 17 78 ca 94 a5 a5 55 51 a0 27
0f 50 54 bf ef 80 81 c0 81 00 71 4f 81 40 81 80
01 01 01 01 01 01 66 21 56 aa 51 00 1e 30 46 8f
33 00 9a e6 10 00 00 1e 00 00 00 fd 00 38 4c 1f
53 0e 00 0a 20 20 20 20 20 20 00 00 00 fc 00 4b
31 39 32 48 51 4c 0a 20 20 20 20 20 00 00 00 ff
00 54 34 53 45 45 30 30 31 38 35 30 35 0a 00 94

00 ff ff ff ff ff ff 00 04 72 8c 04 98 46 90 81
13 1c 01 03 68 29 17 78 ca 94 a5 a5 55 51 a0 27
0f 50 54 bf ef 80 81 c0 81 00 71 4f 81 40 81 80
01 01 01 01 01 01 66 21 56 aa 51 00 1e 30 46 8f
33 00 9a e6 10 00 00 1e 00 00 00 fd 00 38 4c 1f
53 0e 00 0a 20 20 20 20 20 20 00 00 00 fc 00 4b
31 39 32 48 51 4c 0a 20 20 20 20 20 00 00 00 ff
00 54 34 53 45 45 30 30 31 38 35 30 35 0a 00 94

----------------

Block 0, Base EDID:
  EDID Structure Version & Revision: 1.3
  Vendor & Product Identification:
    Manufacturer: ACR
    Model: 1164
    Serial Number: ...
    Made in: week 19 of 2018
  Basic Display Parameters & Features:
    Analog display
    Signal Level Standard: 0.700 : 0.000 : 0.700 V p-p
    Blank level equals black level
    Sync: Separate
    Maximum image size: 41 cm x 23 cm
    Gamma: 2.20
    DPMS levels: Standby Suspend
    RGB color display
    First detailed timing is the preferred timing
  Color Characteristics:
    Red  : 0.6464, 0.3330
    Green: 0.3173, 0.6250
    Blue : 0.1542, 0.0605
    White: 0.3134, 0.3291
  Established Timings I & II:
    IBM     :   720x400    70.081663 Hz   9:5     31.467 kHz     28.320000 MHz
    DMT 0x04:   640x480    59.940476 Hz   4:3     31.469 kHz     25.175000 MHz
    Apple   :   640x480    66.666667 Hz   4:3     35.000 kHz     30.240000 MHz
    DMT 0x05:   640x480    72.808802 Hz   4:3     37.861 kHz     31.500000 MHz
    DMT 0x06:   640x480    75.000000 Hz   4:3     37.500 kHz     31.500000 MHz
    DMT 0x08:   800x600    56.250000 Hz   4:3     35.156 kHz     36.000000 MHz
    DMT 0x09:   800x600    60.316541 Hz   4:3     37.879 kHz     40.000000 MHz
    DMT 0x0a:   800x600    72.187572 Hz   4:3     48.077 kHz     50.000000 MHz
    DMT 0x0b:   800x600    75.000000 Hz   4:3     46.875 kHz     49.500000 MHz
    Apple   :   832x624    74.551266 Hz   4:3     49.726 kHz     57.284000 MHz
    DMT 0x10:  1024x768    60.003840 Hz   4:3     48.363 kHz     65.000000 MHz
    DMT 0x11:  1024x768    70.069359 Hz   4:3     56.476 kHz     75.000000 MHz
    DMT 0x12:  1024x768    75.028582 Hz   4:3     60.023 kHz     78.750000 MHz
    DMT 0x24:  1280x1024   75.024675 Hz   5:4     79.976 kHz    135.000000 MHz
    Apple   :  1152x870    75.061550 Hz 192:145   68.681 kHz    100.000000 MHz
  Standard Timings:
    DMT 0x55:  1280x720    60.000000 Hz  16:9     45.000 kHz     74.250000 MHz
    DMT 0x1c:  1280x800    59.810326 Hz  16:10    49.702 kHz     83.500000 MHz
    DMT 0x15:  1152x864    75.000000 Hz   4:3     67.500 kHz    108.000000 MHz
    DMT 0x20:  1280x960    60.000000 Hz   4:3     60.000 kHz    108.000000 MHz
    DMT 0x23:  1280x1024   60.019740 Hz   5:4     63.981 kHz    108.000000 MHz
  Detailed Timing Descriptors:
    DTD 1:  1366x768    59.789541 Hz 683:384   47.712 kHz     85.500000 MHz (410 mm x 230 mm)
                 Hfront   70 Hsync 143 Hback  213 Hpol P
                 Vfront    3 Vsync   3 Vback   24 Vpol P
    Display Range Limits:
      Monitor ranges (GTF): 56-76 Hz V, 31-83 kHz H, max dotclock 140 MHz
    Display Product Name: 'K192HQL'
    Display Product Serial Number: ...
Checksum: 0x94

----------------

Block 1, Unknown EDID Extension Block 0x00:
  00 ff ff ff ff ff ff 00 04 72 8c 04 98 46 90 81 '.........r...F..'
  13 1c 01 03 68 29 17 78 ca 94 a5 a5 55 51 a0 27 '....h).x....UQ.''
  0f 50 54 bf ef 80 81 c0 81 00 71 4f 81 40 81 80 '.PT.......qO.@..'
  01 01 01 01 01 01 66 21 56 aa 51 00 1e 30 46 8f '......f!V.Q..0F.'
  33 00 9a e6 10 00 00 1e 00 00 00 fd 00 38 4c 1f '3............8L.'
  53 0e 00 0a 20 20 20 20 20 20 00 00 00 fc 00 4b 'S...      .....K'
  31 39 32 48 51 4c 0a 20 20 20 20 20 00 00 00 ff '192HQL.     ....'
  00 54 34 53 45 45 30 30 31 38 35 30 35 0a 00 94 '.T4SEE0018505...'
Checksum: 0x94

----------------

Failures:

Block 1, Base EDID:
  Unknown Extension Block.
EDID:
  Base EDID: EDID specified 0 extension block(s), but found 1 extension block(s).

EDID conformity: FAIL
