
EDID (hex):
00ffffffffffff0006afed4100000000
0019010495221378022e8e9558599329
25535a00000001010101010101010101
010101010101143780b4703826406c30
aa0058c110000018b82480b470382640
6c30aa0058c110000018000000000000
00000000000000000000000000000002
001048ff0f3c6e1e14216e2020200035

Extracted contents:
header:          00 ff ff ff ff ff ff 00
serial number:   06 af ed 41 00 00 00 00 00 19
version:         01 04
basic params:    95 22 13 78 02
chroma info:     2e 8e 95 58 59 93 29 25 53 5a
established:     00 00 00
standard:        01 01 01 01 01 01 01 01 01 01 01 01 01 01 01 01
descriptor 1:    14 37 80 b4 70 38 26 40 6c 30 aa 00 58 c1 10 00 00 18
descriptor 2:    b8 24 80 b4 70 38 26 40 6c 30 aa 00 58 c1 10 00 00 18
descriptor 3:    00 00 00 00 00 00 00 00 00 00 00 00 00 00 00 00 00 00
descriptor 4:    00 00 00 02 00 10 48 ff 0f 3c 6e 1e 14 21 6e 20 20 20
extensions:      00
checksum:        35

EDID version: 1.4
Manufacturer: AUO Model 41ed Serial Number --
Made in year 2015
Digital display
6 bits per primary color channel
DisplayPort interface
Maximum image size: 34 cm x 19 cm
Gamma: 2.20
Supported color formats: RGB 4:4:4
First detailed timing includes the native pixel format and preferred refresh rate
Display x,y Chromaticity:
  Red:   0.5820, 0.3457
  Green: 0.3505, 0.5761
  Blue:  0.1621, 0.1445
  White: 0.3271, 0.3535
Established timings supported:
Standard timings supported:
Detailed mode: Clock 141.000 MHz, 344 mm x 193 mm
               1920 2028 2076 2100 hborder 0
               1080 1090 1100 1118 vborder 0
               -hsync -vsync 
               VertFreq: 60 Hz, HorFreq: 67142 Hz
Detailed mode: Clock 94.000 MHz, 344 mm x 193 mm
               1920 2028 2076 2100 hborder 0
               1080 1090 1100 1118 vborder 0
               -hsync -vsync 
               VertFreq: 40 Hz, HorFreq: 44761 Hz
Manufacturer-specified data, tag 0
Manufacturer-specified data, tag 2
Checksum: 0x35 (valid)
EDID block does NOT conform to EDID 1.4!
	Missing name descriptor
	Missing monitor ranges
