edid-decode (hex):

00 ff ff ff ff ff ff 00 4c 2d 67 08 33 32 39 31
03 16 01 03 0e 29 17 78 2a fc 91 a2 57 53 a1 27
0c 50 54 bf ee 00 01 01 01 01 01 01 01 01 01 01
01 01 01 01 01 01 66 21 56 aa 51 00 1e 30 46 8f
33 00 9a e6 10 00 00 1e 00 00 00 fd 00 38 4b 1e
51 09 00 0a 20 20 20 20 20 20 00 00 00 fc 00 53
4d 53 31 39 41 31 30 30 0a 20 20 20 00 00 00 ff
00 48 4c 4e 43 31 30 37 30 36 39 0a 20 20 00 5c

00 ff ff ff ff ff ff 00 4c 2d 67 08 33 32 39 31
03 16 01 03 0e 29 17 78 2a fc 91 a2 57 53 a1 27
0c 50 54 bf ee 00 01 01 01 01 01 01 01 01 01 01
01 01 01 01 01 01 66 21 56 aa 51 00 1e 30 46 8f
33 00 9a e6 10 00 00 1e 00 00 00 fd 00 38 4b 1e
51 09 00 0a 20 20 20 20 20 20 00 00 00 fc 00 53
4d 53 31 39 41 31 30 30 0a 20 20 20 00 00 00 ff
00 48 4c 4e 43 31 30 37 30 36 39 0a 20 20 00 5c

----------------

Block 0, Base EDID:
  EDID Structure Version & Revision: 1.3
  Vendor & Product Identification:
    Manufacturer: SAM
    Model: 2151
    Serial Number: ...
    Made in: week 3 of 2012
  Basic Display Parameters & Features:
    Analog display
    Signal Level Standard: 0.700 : 0.300 : 1.000 V p-p
    Blank level equals black level
    Sync: Separate Composite SyncOnGreen
    Maximum image size: 41 cm x 23 cm
    Gamma: 2.20
    DPMS levels: Off
    RGB color display
    First detailed timing is the preferred timing
  Color Characteristics:
    Red  : 0.6357, 0.3427
    Green: 0.3271, 0.6289
    Blue : 0.1542, 0.0478
    White: 0.3125, 0.3291
  Established Timings I & II:
    IBM     :   720x400    70.081663 Hz   9:5     31.467 kHz     28.320000 MHz
    DMT 0x04:   640x480    59.940476 Hz   4:3     31.469 kHz     25.175000 MHz
    Apple   :   640x480    66.666667 Hz   4:3     35.000 kHz     30.240000 MHz
    DMT 0x05:   640x480    72.808802 Hz   4:3     37.861 kHz     31.500000 MHz
    DMT 0x06:   640x480    75.000000 Hz   4:3     37.500 kHz     31.500000 MHz
    DMT 0x08:   800x600    56.250000 Hz   4:3     35.156 kHz     36.000000 MHz
    DMT 0x09:   800x600    60.316541 Hz   4:3     37.879 kHz     40.000000 MHz
    DMT 0x0a:   800x600    72.187572 Hz   4:3     48.077 kHz     50.000000 MHz
    DMT 0x0b:   800x600    75.000000 Hz   4:3     46.875 kHz     49.500000 MHz
    Apple   :   832x624    74.551266 Hz   4:3     49.726 kHz     57.284000 MHz
    DMT 0x10:  1024x768    60.003840 Hz   4:3     48.363 kHz     65.000000 MHz
    DMT 0x11:  1024x768    70.069359 Hz   4:3     56.476 kHz     75.000000 MHz
    DMT 0x12:  1024x768    75.028582 Hz   4:3     60.023 kHz     78.750000 MHz
  Standard Timings: none
  Detailed Timing Descriptors:
    DTD 1:  1366x768    59.789541 Hz 683:384   47.712 kHz     85.500000 MHz (410 mm x 230 mm)
                 Hfront   70 Hsync 143 Hback  213 Hpol P
                 Vfront    3 Vsync   3 Vback   24 Vpol P
    Display Range Limits:
      Monitor ranges (GTF): 56-75 Hz V, 30-81 kHz H, max dotclock 90 MHz
    Display Product Name: 'SMS19A100'
    Display Product Serial Number: ...
Checksum: 0x5c

----------------

Block 1, Unknown EDID Extension Block 0x00:
  00 ff ff ff ff ff ff 00 4c 2d 67 08 33 32 39 31 '........L-g.3291'
  03 16 01 03 0e 29 17 78 2a fc 91 a2 57 53 a1 27 '.....).x*...WS.''
  0c 50 54 bf ee 00 01 01 01 01 01 01 01 01 01 01 '.PT.............'
  01 01 01 01 01 01 66 21 56 aa 51 00 1e 30 46 8f '......f!V.Q..0F.'
  33 00 9a e6 10 00 00 1e 00 00 00 fd 00 38 4b 1e '3............8K.'
  51 09 00 0a 20 20 20 20 20 20 00 00 00 fc 00 53 'Q...      .....S'
  4d 53 31 39 41 31 30 30 0a 20 20 20 00 00 00 ff 'MS19A100.   ....'
  00 48 4c 4e 43 31 30 37 30 36 39 0a 20 20 00 5c '.HLNC107069.  .\'
Checksum: 0x5c

----------------

Failures:

Block 1, Base EDID:
  Unknown Extension Block.
EDID:
  Base EDID: EDID specified 0 extension block(s), but found 1 extension block(s).

EDID conformity: FAIL
