
EDID (hex):
00ffffffffffff0030e4af0100000000
00120103802115780a19459758538b28
24505400000001010101010101010101
010101010101442f90cc601a14404060
46004bcf100000190000000000000000
00000000000000000000000000fe004c
4720446973706c61790a2020000000fe
004c503135345745322d544c413800ea

Extracted contents:
header:          00 ff ff ff ff ff ff 00
serial number:   30 e4 af 01 00 00 00 00 00 12
version:         01 03
basic params:    80 21 15 78 0a
chroma info:     19 45 97 58 53 8b 28 24 50 54
established:     00 00 00
standard:        01 01 01 01 01 01 01 01 01 01 01 01 01 01 01 01
descriptor 1:    44 2f 90 cc 60 1a 14 40 40 60 46 00 4b cf 10 00 00 19
descriptor 2:    00 00 00 00 00 00 00 00 00 00 00 00 00 00 00 00 00 00
descriptor 3:    00 00 00 fe 00 4c 47 20 44 69 73 70 6c 61 79 0a 20 20
descriptor 4:    00 00 00 fe 00 4c 50 31 35 34 57 45 32 2d 54 4c 41 38
extensions:      00
checksum:        ea

EDID version: 1.3
Manufacturer: LGD Model 1af Serial Number --
Made in year 2008
Digital display
Maximum image size: 33 cm x 21 cm
Gamma: 2.20
RGB color display
First detailed timing is preferred timing
Display x,y Chromaticity:
  Red:   0.5898, 0.3447
  Green: 0.3261, 0.5439
  Blue:  0.1572, 0.1406
  White: 0.3134, 0.3291
Established timings supported:
Standard timings supported:
Detailed mode: Clock 121.000 MHz, 331 mm x 207 mm
               1680 1744 1840 1884 hborder 0
               1050 1054 1060 1070 vborder 0
               -hsync -vsync 
               VertFreq: 60 Hz, HorFreq: 64225 Hz
Manufacturer-specified data, tag 0
ASCII string: LG Display
ASCII string: LP154WE2-TLA8
Checksum: 0xea (valid)
EDID block does NOT conform to EDID 1.3!
	Missing name descriptor
	Missing monitor ranges
