
EDID (hex):
00ffffffffffff001d65850101000000
0f16010300291a782ac905a3574b9c25
125054afcf00814081808100010181cf
010101010101342150b051001b304070
3600520e1100001e000000ff00353035
3344303031303030310a000000fd0038
4b1f5109000a202020202020000000fc
004554313835610a2020202020200059

Extracted contents:
header:          00 ff ff ff ff ff ff 00
serial number:   1d 65 85 01 01 00 00 00 0f 16
version:         01 03
basic params:    00 29 1a 78 2a
chroma info:     c9 05 a3 57 4b 9c 25 12 50 54
established:     af cf 00
standard:        81 40 81 80 81 00 01 01 81 cf 01 01 01 01 01 01
descriptor 1:    34 21 50 b0 51 00 1b 30 40 70 36 00 52 0e 11 00 00 1e
descriptor 2:    00 00 00 ff 00 35 30 35 33 44 30 30 31 30 30 30 31 0a
descriptor 3:    00 00 00 fd 00 38 4b 1f 51 09 00 0a 20 20 20 20 20 20
descriptor 4:    00 00 00 fc 00 45 54 31 38 35 61 0a 20 20 20 20 20 20
extensions:      00
checksum:        59

EDID version: 1.3
Manufacturer: GKE Model 185 Serial Number --
Made in week 15 of 2012
Analog display, Input voltage level: 0.7/0.3 V
Sync: 
Maximum image size: 41 cm x 26 cm
Gamma: 2.20
DPMS levels: Off
RGB color display
First detailed timing is preferred timing
Display x,y Chromaticity:
  Red:   0.6396, 0.3398
  Green: 0.2949, 0.6103
  Blue:  0.1445, 0.0703
  White: 0.3134, 0.3291
Established timings supported:
  720x400@70Hz 9:5 HorFreq: 31469 Hz Clock: 28.320 MHz
  640x480@60Hz 4:3 HorFreq: 31469 Hz Clock: 25.175 MHz
  640x480@72Hz 4:3 HorFreq: 37900 Hz Clock: 31.500 MHz
  640x480@75Hz 4:3 HorFreq: 37500 Hz Clock: 31.500 MHz
  800x600@56Hz 4:3 HorFreq: 35200 Hz Clock: 36.000 MHz
  800x600@60Hz 4:3 HorFreq: 37900 Hz Clock: 40.000 MHz
  800x600@72Hz 4:3 HorFreq: 48100 Hz Clock: 50.000 MHz
  800x600@75Hz 4:3 HorFreq: 46900 Hz Clock: 49.500 MHz
  1024x768@60Hz 4:3 HorFreq: 48400 Hz Clock: 65.000 MHz
  1024x768@70Hz 4:3 HorFreq: 56500 Hz Clock: 75.000 MHz
  1024x768@75Hz 4:3 HorFreq: 60000 Hz Clock: 78.750 MHz
  1280x1024@75Hz 5:4 HorFreq: 80000 Hz Clock: 135.000 MHz
Standard timings supported:
  1280x960@60Hz 4:3 HorFreq: 60000 Hz Clock: 108.000 MHz
  1280x1024@60Hz 5:4 HorFreq: 64000 Hz Clock: 108.000 MHz
  1280x800@60Hz 16:10
  1280x720@75Hz 16:9
Detailed mode: Clock 85.000 MHz, 338 mm x 270 mm
               1360 1424 1536 1792 hborder 0
                768  771  777  795 vborder 0
               +hsync +vsync 
               VertFreq: 59 Hz, HorFreq: 47433 Hz
Serial number: --
Monitor ranges (GTF): 56-75Hz V, 31-81kHz H, max dotclock 90MHz
Monitor name: ET185a
Checksum: 0x59 (valid)
One or more of the timings is out of range of the Monitor Ranges:
  Vertical Freq: 56 - 75 Hz
  Horizontal Freq: 31469 - 80000 Hz
  Maximum Clock: 135.000 MHz
