
EDID (hex):
00ffffffffffff00220e943401010101
2a1b0103803c22782ae265a8534f9f26
125054a10800d1c081c0a9c0b3009500
810081800101023a801871382d40582c
450056502100001e000000fd00323c1e
5011000a202020202020000000fc0048
50203237770a202020202020000000ff
00434e43373432303134560a20200135
02031ab149901f041303120211016803
0c001000002200e2002b023a80187138
2d40582c450056502100001e023a80d0
72382d40102c458056502100001e0000
00000000000000000000000000000000
00000000000000000000000000000000
00000000000000000000000000000000
00000000000000000000000000000021

Extracted contents:
header:          00 ff ff ff ff ff ff 00
serial number:   22 0e 94 34 01 01 01 01 2a 1b
version:         01 03
basic params:    80 3c 22 78 2a
chroma info:     e2 65 a8 53 4f 9f 26 12 50 54
established:     a1 08 00
standard:        d1 c0 81 c0 a9 c0 b3 00 95 00 81 00 81 80 01 01
descriptor 1:    02 3a 80 18 71 38 2d 40 58 2c 45 00 56 50 21 00 00 1e
descriptor 2:    00 00 00 fd 00 32 3c 1e 50 11 00 0a 20 20 20 20 20 20
descriptor 3:    00 00 00 fc 00 48 50 20 32 37 77 0a 20 20 20 20 20 20
descriptor 4:    00 00 00 ff 00 43 4e 43 37 34 32 30 31 34 56 0a 20 20
extensions:      01
checksum:        35

EDID version: 1.3
Manufacturer: HPN Model 3494 Serial Number --
Made in week 42 of 2017
Digital display
Maximum image size: 60 cm x 34 cm
Gamma: 2.20
DPMS levels: Off
RGB color display
First detailed timing is preferred timing
Display x,y Chromaticity:
  Red:   0.6591, 0.3261
  Green: 0.3085, 0.6230
  Blue:  0.1494, 0.0722
  White: 0.3134, 0.3291
Established timings supported:
  720x400@70Hz 9:5 HorFreq: 31469 Hz Clock: 28.320 MHz
  640x480@60Hz 4:3 HorFreq: 31469 Hz Clock: 25.175 MHz
  800x600@60Hz 4:3 HorFreq: 37900 Hz Clock: 40.000 MHz
  1024x768@60Hz 4:3 HorFreq: 48400 Hz Clock: 65.000 MHz
Standard timings supported:
  1920x1080@60Hz 16:9
  1280x720@60Hz 16:9
  1600x900@60Hz 16:9
  1680x1050@60Hz 16:10 HorFreq: 64700 Hz Clock: 119.000 MHz
  1440x900@60Hz 16:10 HorFreq: 55500 Hz Clock: 88.750 MHz
  1280x800@60Hz 16:10
  1280x1024@60Hz 5:4 HorFreq: 64000 Hz Clock: 108.000 MHz
Detailed mode: Clock 148.500 MHz, 598 mm x 336 mm
               1920 2008 2052 2200 hborder 0
               1080 1084 1089 1125 vborder 0
               +hsync +vsync 
               VertFreq: 60 Hz, HorFreq: 67500 Hz
Monitor ranges (GTF): 50-60Hz V, 30-80kHz H, max dotclock 170MHz
Monitor name: HP 27w
Serial number: --
Has 1 extension blocks
Checksum: 0x35 (valid)

CTA extension block
Extension version: 3
22 bytes of CTA data
  Video data block
    VIC  16 1920x1080@60Hz 16:9 (native) HorFreq: 67500 Hz Clock: 148.500 MHz
    VIC  31 1920x1080@50Hz 16:9  HorFreq: 56250 Hz Clock: 148.500 MHz
    VIC   4 1280x720@60Hz 16:9  HorFreq: 45000 Hz Clock: 74.250 MHz
    VIC  19 1280x720@50Hz 16:9  HorFreq: 37500 Hz Clock: 74.250 MHz
    VIC   3 720x480@60Hz 16:9  HorFreq: 31469 Hz Clock: 27.000 MHz
    VIC  18 720x576@50Hz 16:9  HorFreq: 31250 Hz Clock: 27.000 MHz
    VIC   2 720x480@60Hz 4:3  HorFreq: 31469 Hz Clock: 27.000 MHz
    VIC  17 720x576@50Hz 4:3  HorFreq: 31250 Hz Clock: 27.000 MHz
    VIC   1 640x480@60Hz 4:3  HorFreq: 31469 Hz Clock: 25.175 MHz
  Vendor-specific data block, OUI 000c03 (HDMI)
    Source physical address 1.0.0.0
    Maximum TMDS clock: 170MHz
  Extended tag: Video capability data block
    YCbCr quantization: No Data (0)
    RGB quantization: No Data (0)
    PT scan behaviour: Always Underscanned (2)
    IT scan behaviour: Always Underscanned (2)
    CE scan behaviour: Support both over- and underscan (3)
Underscans PC formats by default
Supports YCbCr 4:4:4
Supports YCbCr 4:2:2
1 native detailed modes
Detailed mode: Clock 148.500 MHz, 598 mm x 336 mm
               1920 2008 2052 2200 hborder 0
               1080 1084 1089 1125 vborder 0
               +hsync +vsync 
               VertFreq: 60 Hz, HorFreq: 67500 Hz
Detailed mode: Clock 148.500 MHz, 598 mm x 336 mm
               1920 2448 2492 2640 hborder 0
               1080 1084 1089 1125 vborder 0
               +hsync +vsync 
               VertFreq: 50 Hz, HorFreq: 56250 Hz
Checksum: 0x21 (valid)

One or more of the timings is out of range of the Monitor Ranges:
  Vertical Freq: 50 - 70 Hz
  Horizontal Freq: 31250 - 67500 Hz
  Maximum Clock: 148.500 MHz
EDID block does not conform at all!
	Both the serial number and the serial string are set


