
EDID (hex):
00ffffffffffff001ef9760701010101
1710010308291a78ea9bb6a4534b9d24
144f54afcf0081809500950f01010101
0101010101019a29a0d0518422305098
36009a001100001c000000fc00465044
31393735570a20202020000000fd0038
4b1f510e000a202020202020000000ff
005836362035304e2031303137320084

Extracted contents:
header:          00 ff ff ff ff ff ff 00
serial number:   1e f9 76 07 01 01 01 01 17 10
version:         01 03
basic params:    08 29 1a 78 ea
chroma info:     9b b6 a4 53 4b 9d 24 14 4f 54
established:     af cf 00
standard:        81 80 95 00 95 0f 01 01 01 01 01 01 01 01 01 01
descriptor 1:    9a 29 a0 d0 51 84 22 30 50 98 36 00 9a 00 11 00 00 1c
descriptor 2:    00 00 00 fc 00 46 50 44 31 39 37 35 57 0a 20 20 20 20
descriptor 3:    00 00 00 fd 00 38 4b 1f 51 0e 00 0a 20 20 20 20 20 20
descriptor 4:    00 00 00 ff 00 58 36 36 20 35 30 4e 20 31 30 31 37 32
extensions:      00
checksum:        84

EDID version: 1.3
Manufacturer: GWY Model 776 Serial Number --
Made in week 23 of 2006
Analog display, Input voltage level: 0.7/0.3 V
Sync: Separate 
Maximum image size: 41 cm x 26 cm
Gamma: 2.20
DPMS levels: Standby Suspend Off
RGB color display
First detailed timing is preferred timing
Display x,y Chromaticity:
  Red:   0.6425, 0.3251
  Green: 0.2949, 0.6162
  Blue:  0.1425, 0.0810
  White: 0.3095, 0.3300
Established timings supported:
  720x400@70Hz 9:5 HorFreq: 31469 Hz Clock: 28.320 MHz
  640x480@60Hz 4:3 HorFreq: 31469 Hz Clock: 25.175 MHz
  640x480@72Hz 4:3 HorFreq: 37900 Hz Clock: 31.500 MHz
  640x480@75Hz 4:3 HorFreq: 37500 Hz Clock: 31.500 MHz
  800x600@56Hz 4:3 HorFreq: 35200 Hz Clock: 36.000 MHz
  800x600@60Hz 4:3 HorFreq: 37900 Hz Clock: 40.000 MHz
  800x600@72Hz 4:3 HorFreq: 48100 Hz Clock: 50.000 MHz
  800x600@75Hz 4:3 HorFreq: 46900 Hz Clock: 49.500 MHz
  1024x768@60Hz 4:3 HorFreq: 48400 Hz Clock: 65.000 MHz
  1024x768@70Hz 4:3 HorFreq: 56500 Hz Clock: 75.000 MHz
  1024x768@75Hz 4:3 HorFreq: 60000 Hz Clock: 78.750 MHz
  1280x1024@75Hz 5:4 HorFreq: 80000 Hz Clock: 135.000 MHz
Standard timings supported:
  1280x1024@60Hz 5:4 HorFreq: 64000 Hz Clock: 108.000 MHz
  1440x900@60Hz 16:10 HorFreq: 55500 Hz Clock: 88.750 MHz
  1440x900@75Hz 16:10 HorFreq: 82300 Hz Clock: 156.000 MHz
Detailed mode: Clock 106.500 MHz, 410 mm x 256 mm
               1440 1520 1672 1904 hborder 0
                900  903  909  934 vborder 0
               -hsync +vsync 
               VertFreq: 59 Hz, HorFreq: 55934 Hz
Monitor name: FPD1975W
Monitor ranges (GTF): 56-75Hz V, 31-81kHz H, max dotclock 140MHz
Serial number: -- 50N 10172
Checksum: 0x84 (valid)
One or more of the timings is out of range of the Monitor Ranges:
  Vertical Freq: 56 - 75 Hz
  Horizontal Freq: 31469 - 82300 Hz
  Maximum Clock: 156.000 MHz
