
EDID (hex):
00ffffffffffff00320c006500000000
000f0102801e16780a74b09657548b28
25505400000001010101010101010101
01010101010164190040410026301888
360030e4100000180000000000000000
00000000000000000000000000fe004c
475068696c6970734c43440a000000fe
004c503135305830382d544c41390046

Extracted contents:
header:          00 ff ff ff ff ff ff 00
serial number:   32 0c 00 65 00 00 00 00 00 0f
version:         01 02
basic params:    80 1e 16 78 0a
chroma info:     74 b0 96 57 54 8b 28 25 50 54
established:     00 00 00
standard:        01 01 01 01 01 01 01 01 01 01 01 01 01 01 01 01
descriptor 1:    64 19 00 40 41 00 26 30 18 88 36 00 30 e4 10 00 00 18
descriptor 2:    00 00 00 00 00 00 00 00 00 00 00 00 00 00 00 00 00 00
descriptor 3:    00 00 00 fe 00 4c 47 50 68 69 6c 69 70 73 4c 43 44 0a
descriptor 4:    00 00 00 fe 00 4c 50 31 35 30 58 30 38 2d 54 4c 41 39
extensions:      00
checksum:        46

EDID version: 1.2
Manufacturer: LPL Model 6500 Serial Number --
Digital display
Maximum image size: 30 cm x 22 cm
Gamma: 2.20
RGB color display
First detailed timing is preferred timing
Display x,y Chromaticity:
  Red:   0.5869, 0.3427
  Green: 0.3291, 0.5429
  Blue:  0.1582, 0.1474
  White: 0.3125, 0.3281
Established timings supported:
Standard timings supported:
Detailed mode: Clock 65.000 MHz, 304 mm x 228 mm
               1024 1048 1184 1344 hborder 0
                768  771  777  806 vborder 0
               -hsync -vsync 
               VertFreq: 60 Hz, HorFreq: 48363 Hz
Manufacturer-specified data, tag 0
ASCII string: LGPhilipsLCD
ASCII string: LP150X08-TLA9
Checksum: 0x46 (valid)
EDID block does not conform at all!
	Bad year of manufacture
