edid-decode (hex):

00 ff ff ff ff ff ff 00 09 e5 fa 07 00 00 00 00
01 1c 01 04 a5 22 13 78 02 4c 30 a4 54 51 9b 27
0c 50 54 00 00 00 01 01 01 01 01 01 01 01 01 01
01 01 01 01 01 01 97 8b 80 18 71 38 30 40 6c 30
aa 00 58 c1 10 00 00 1a 97 8b 80 18 71 38 5b 46
6c 30 aa 00 58 c1 10 00 00 1a 00 00 00 fe 00 42
4f 45 20 48 46 0a 20 20 20 20 20 20 00 00 00 fe
00 4e 56 31 35 36 46 48 4d 2d 4e 34 4b 0a 00 08

----------------

Block 0, Base EDID:
  EDID Structure Version & Revision: 1.4
  Vendor & Product Identification:
    Manufacturer: BOE
    Model: 2042
    Made in: week 1 of 2018
  Basic Display Parameters & Features:
    Digital display
    Bits per primary color channel: 8
    DisplayPort interface
    Maximum image size: 34 cm x 19 cm
    Gamma: 2.20
    Supported color formats: RGB 4:4:4
    First detailed timing includes the native pixel format and preferred refresh rate
  Color Characteristics:
    Red  : 0.6416, 0.3281
    Green: 0.3193, 0.6054
    Blue : 0.1523, 0.0498
    White: 0.3125, 0.3281
  Established Timings I & II: none
  Standard Timings: none
  Detailed Timing Descriptors:
    DTD 1:  1920x1080  144.000 Hz  16:9   162.432 kHz 357.350 MHz (344 mm x 193 mm)
                 Hfront  108 Hsync  48 Hback 124 Hpol P
                 Vfront   10 Vsync  10 Vback  28 Vpol N
    DTD 2:  1920x1080   60.004 Hz  16:9   162.432 kHz 357.350 MHz (344 mm x 193 mm)
                 Hfront  108 Hsync  48 Hback 124 Hpol P
                 Vfront   10 Vsync  10 Vback 1607 Vpol N
    Alphanumeric Data String: 'BOE HF'
    Alphanumeric Data String: 'NV156FHM-N4K'
Checksum: 0x08

----------------

Failures:

Block 0, Base EDID:
  Missing Display Product Name.

EDID conformity: FAIL
