edid-decode (hex):

00 ff ff ff ff ff ff 00 4e ae 8c 05 4d 52 96 01
20 0e 01 03 80 26 1e 78 eb ee 84 a3 54 4c 99 26
11 50 54 bf ef 00 81 80 81 90 71 86 81 8f 01 01
01 01 01 01 01 01 30 2a 00 98 51 00 2a 40 30 70
13 00 7c 2c 11 00 00 14 00 00 00 fd 00 38 4b 1e
51 0e 00 0a 20 20 20 20 20 20 00 00 00 fc 00 47
48 31 39 50 53 0a 20 20 20 20 20 20 00 00 00 ff
00 30 34 33 32 4d 52 30 34 30 36 0a 20 20 00 21

----------------

Block 0, Base EDID:
  EDID Structure Version & Revision: 1.3
  Vendor & Product Identification:
    Manufacturer: SUN
    Model: 1420
    Serial Number: ...
    Made in: week 32 of 2004
  Basic Display Parameters & Features:
    Digital display
    Maximum image size: 38 cm x 30 cm
    Gamma: 2.20
    DPMS levels: Standby Suspend Off
    RGB color display
    First detailed timing is the preferred timing
    Supports GTF timings within operating range
  Color Characteristics:
    Red  : 0.6396, 0.3300
    Green: 0.2998, 0.5996
    Blue : 0.1503, 0.0664
    White: 0.3134, 0.3281
  Established Timings I & II:
    IBM     :   720x400    70.081663 Hz   9:5     31.467 kHz     28.320000 MHz
    DMT 0x04:   640x480    59.940476 Hz   4:3     31.469 kHz     25.175000 MHz
    Apple   :   640x480    66.666667 Hz   4:3     35.000 kHz     30.240000 MHz
    DMT 0x05:   640x480    72.808802 Hz   4:3     37.861 kHz     31.500000 MHz
    DMT 0x06:   640x480    75.000000 Hz   4:3     37.500 kHz     31.500000 MHz
    DMT 0x08:   800x600    56.250000 Hz   4:3     35.156 kHz     36.000000 MHz
    DMT 0x09:   800x600    60.316541 Hz   4:3     37.879 kHz     40.000000 MHz
    DMT 0x0a:   800x600    72.187572 Hz   4:3     48.077 kHz     50.000000 MHz
    DMT 0x0b:   800x600    75.000000 Hz   4:3     46.875 kHz     49.500000 MHz
    Apple   :   832x624    74.551266 Hz   4:3     49.726 kHz     57.284000 MHz
    DMT 0x10:  1024x768    60.003840 Hz   4:3     48.363 kHz     65.000000 MHz
    DMT 0x11:  1024x768    70.069359 Hz   4:3     56.476 kHz     75.000000 MHz
    DMT 0x12:  1024x768    75.028582 Hz   4:3     60.023 kHz     78.750000 MHz
    DMT 0x24:  1280x1024   75.024675 Hz   5:4     79.976 kHz    135.000000 MHz
  Standard Timings:
    DMT 0x23:  1280x1024   60.019740 Hz   5:4     63.981 kHz    108.000000 MHz
    GTF     :  1280x1024   75.999957 Hz   5:4     81.320 kHz    141.822000 MHz
    GTF     :  1152x921    66.000114 Hz   5:4     63.162 kHz     97.017000 MHz
    DMT 0x24:  1280x1024   75.024675 Hz   5:4     79.976 kHz    135.000000 MHz
  Detailed Timing Descriptors:
    DTD 1:  1280x1024   60.019740 Hz   5:4     63.981 kHz    108.000000 MHz (digital composite, serrate, 380 mm x 300 mm)
                 Hfront   48 Hsync 112 Hback  248 Hpol N
                 Vfront    1 Vsync   3 Vback   38
    Display Range Limits:
      Monitor ranges (GTF): 56-75 Hz V, 30-81 kHz H, max dotclock 140 MHz
    Display Product Name: 'GH19PS'
    Display Product Serial Number: ...
Checksum: 0x21

----------------

Warnings:

Block 0, Base EDID:
  Standard Timings: Standard Timing 1152x921 has a dubious odd vertical resolution.
  Detailed Timing Descriptor #1: DTD is similar but not identical to DMT 0x23.
EDID:
  Base EDID: Some timings are out of range of the Monitor Ranges:
    Vertical Freq: 56.250 - 76.000 Hz (Monitor: 56.000 - 75.000 Hz)
    Maximum Clock: 141.822 MHz (Monitor: 140.000 MHz)
    Could be due to a Monitor Range off-by-one rounding issue

EDID conformity: PASS
