
EDID (hex):
00ffffffffffff004c2d130637324645
16140103801009782aeed1a555489b26
125054230800a9408180814081009500
b30001010101023a801871382d40582c
4500a05a0000001e011d007251d01e20
6e285500a05a0000001e000000fd0032
3c1e5111000a202020202020000000fc
0053796e634d61737465720a2020013a

Extracted contents:
header:          00 ff ff ff ff ff ff 00
serial number:   4c 2d 13 06 37 32 46 45 16 14
version:         01 03
basic params:    80 10 09 78 2a
chroma info:     ee d1 a5 55 48 9b 26 12 50 54
established:     23 08 00
standard:        a9 40 81 80 81 40 81 00 95 00 b3 00 01 01 01 01
descriptor 1:    02 3a 80 18 71 38 2d 40 58 2c 45 00 a0 5a 00 00 00 1e
descriptor 2:    01 1d 00 72 51 d0 1e 20 6e 28 55 00 a0 5a 00 00 00 1e
descriptor 3:    00 00 00 fd 00 32 3c 1e 51 11 00 0a 20 20 20 20 20 20
descriptor 4:    00 00 00 fc 00 53 79 6e 63 4d 61 73 74 65 72 0a 20 20
extensions:      01
checksum:        3a

EDID version: 1.3
Manufacturer: SAM Model 613 Serial Number --
Made in week 22 of 2010
Digital display
Maximum image size: 16 cm x 9 cm
Gamma: 2.20
DPMS levels: Off
RGB color display
First detailed timing is preferred timing
Display x,y Chromaticity:
  Red:   0.6474, 0.3339
  Green: 0.2841, 0.6074
  Blue:  0.1513, 0.0712
  White: 0.3125, 0.3291
Established timings supported:
  640x480@60Hz 4:3 HorFreq: 31469 Hz Clock: 25.175 MHz
  800x600@56Hz 4:3 HorFreq: 35200 Hz Clock: 36.000 MHz
  800x600@60Hz 4:3 HorFreq: 37900 Hz Clock: 40.000 MHz
  1024x768@60Hz 4:3 HorFreq: 48400 Hz Clock: 65.000 MHz
Standard timings supported:
  1600x1200@60Hz 4:3 HorFreq: 75000 Hz Clock: 162.000 MHz
  1280x1024@60Hz 5:4 HorFreq: 64000 Hz Clock: 108.000 MHz
  1280x960@60Hz 4:3 HorFreq: 60000 Hz Clock: 108.000 MHz
  1280x800@60Hz 16:10
  1440x900@60Hz 16:10 HorFreq: 55500 Hz Clock: 88.750 MHz
  1680x1050@60Hz 16:10 HorFreq: 64700 Hz Clock: 119.000 MHz
Detailed mode: Clock 148.500 MHz, 160 mm x 90 mm
               1920 2008 2052 2200 hborder 0
               1080 1084 1089 1125 vborder 0
               +hsync +vsync 
               VertFreq: 60 Hz, HorFreq: 67500 Hz
Detailed mode: Clock 74.250 MHz, 160 mm x 90 mm
               1280 1390 1430 1650 hborder 0
                720  725  730  750 vborder 0
               +hsync +vsync 
               VertFreq: 60 Hz, HorFreq: 45000 Hz
Monitor ranges (GTF): 50-60Hz V, 30-81kHz H, max dotclock 170MHz
Monitor name: SyncMaster
Has 1 extension blocks
Checksum: 0x3a (valid)
