edid-decode (hex):

00 ff ff ff ff ff ff 00 22 0e 4b 40 f2 06 22 00
1c 1b 01 03 80 2e 1a 78 0a 91 e0 a3 5b 4f a3 26
11 50 54 00 00 00 01 01 01 01 01 01 01 01 01 01
01 01 01 01 01 01 e3 39 80 18 71 38 2e 40 a8 20
36 04 ca 02 11 00 00 1e 00 00 00 fc 00 48 50 20
41 6c 6c 2d 69 6e 2d 4f 6e 65 00 00 00 10 00 00
0a 20 20 20 20 20 20 20 20 20 20 20 00 00 00 10
00 00 0a 20 20 20 20 20 20 20 21 20 20 20 00 83

----------------

Block 0, Base EDID:
  EDID Structure Version & Revision: 1.3
  Vendor & Product Identification:
    Manufacturer: HPN
    Model: 16459
    Serial Number: ...
    Made in: week 28 of 2017
  Basic Display Parameters & Features:
    Digital display
    Maximum image size: 46 cm x 26 cm
    Gamma: 2.20
    RGB color display
    First detailed timing is the preferred timing
  Color Characteristics:
    Red  : 0.6386, 0.3564
    Green: 0.3085, 0.6376
    Blue : 0.1513, 0.0683
    White: 0.3125, 0.3281
  Established Timings I & II: none
  Standard Timings: none
  Detailed Timing Descriptors:
    DTD 1:  1920x1080   59.821573 Hz  16:9     67.359 kHz    148.190000 MHz (458 mm x 258 mm)
                 Hfront  168 Hsync  32 Hback   80 Hpol P
                 Vfront   19 Vsync   6 Vback   21 Vpol P
    Display Product Name: 'HP All-in-One'
    Dummy Descriptor:
    Dummy Descriptor:
Checksum: 0x83

----------------

Failures:

Block 0, Base EDID:
  Dummy Descriptor: Dummy block filled with garbage.
  Dummy Descriptor: Dummy block filled with garbage.
  Missing Display Range Limits Descriptor.

EDID conformity: FAIL
