
EDID (hex):
00ffffffffffff0006af2c2000000000
01120103801d10780aba659b59549e26
1a4d5200000001010101010101010101
010101010101121b565a500019303020
360025a4100000180000000f00000000
00000000000000000020000000fe0041
554f0a202020202020202020000000fe
004231333358573032205630200a00ea

Extracted contents:
header:          00 ff ff ff ff ff ff 00
serial number:   06 af 2c 20 00 00 00 00 01 12
version:         01 03
basic params:    80 1d 10 78 0a
chroma info:     ba 65 9b 59 54 9e 26 1a 4d 52
established:     00 00 00
standard:        01 01 01 01 01 01 01 01 01 01 01 01 01 01 01 01
descriptor 1:    12 1b 56 5a 50 00 19 30 30 20 36 00 25 a4 10 00 00 18
descriptor 2:    00 00 00 0f 00 00 00 00 00 00 00 00 00 00 00 00 00 20
descriptor 3:    00 00 00 fe 00 41 55 4f 0a 20 20 20 20 20 20 20 20 20
descriptor 4:    00 00 00 fe 00 42 31 33 33 58 57 30 32 20 56 30 20 0a
extensions:      00
checksum:        ea

EDID version: 1.3
Manufacturer: AUO Model 202c Serial Number --
Made in week 1 of 2008
Digital display
Maximum image size: 29 cm x 16 cm
Gamma: 2.20
RGB color display
First detailed timing is preferred timing
Display x,y Chromaticity:
  Red:   0.6074, 0.3505
  Green: 0.3300, 0.6191
  Blue:  0.1494, 0.1035
  White: 0.3017, 0.3212
Established timings supported:
Standard timings supported:
Detailed mode: Clock 69.300 MHz, 293 mm x 164 mm
               1366 1414 1446 1456 hborder 0
                768  771  777  793 vborder 0
               -hsync -vsync 
               VertFreq: 60 Hz, HorFreq: 47596 Hz
Manufacturer-specified data, tag 15
ASCII string: AUO
ASCII string: B133XW02 V0 
Checksum: 0xea (valid)
EDID block does NOT conform to EDID 1.3!
	Missing name descriptor
	Missing monitor ranges
