edid-decode (hex):

00 ff ff ff ff ff ff 00 15 c3 04 26 53 bb ff 02
18 1b 01 03 80 46 28 78 ea a3 05 a4 58 48 a3 24
0d 50 54 a1 08 00 81 80 a9 40 d1 00 b3 00 81 00
a9 c0 81 c0 01 01 a3 66 00 a0 f0 70 1f 80 30 20
35 00 b9 88 21 00 00 1a 02 3a 80 18 71 38 2d 40
58 2c 45 00 b9 88 21 00 00 1e 00 00 00 fd 00 1d
3d 1f 86 1c 00 0a 20 20 20 20 20 20 00 00 00 fc
00 45 56 33 32 33 37 0a 20 20 20 20 20 20 01 d7

02 01 04 00 4d 6c 80 a0 70 70 3e 80 30 20 3a 00
b9 88 21 00 00 1a 52 35 80 a0 70 70 1f 80 30 20
3a 00 b9 88 21 00 00 1a 1a 68 00 a0 f0 38 1f 40
30 20 3a 00 b9 88 21 00 00 1a 56 5e 00 a0 a0 a0
29 50 30 20 35 00 b9 88 21 00 00 1a 21 39 00 00
a3 a0 1c 50 78 08 35 10 b9 88 21 00 00 1c e2 68
00 a0 a0 40 2e 60 30 20 3a 00 b9 88 21 00 00 1a
00 00 00 00 00 00 00 00 00 00 00 00 00 00 00 e9

----------------

Block 0, Base EDID:
  EDID Structure Version & Revision: 1.3
  Vendor & Product Identification:
    Manufacturer: ENC
    Model: 9732
    Serial Number: ...
    Made in: week 24 of 2017
  Basic Display Parameters & Features:
    Digital display
    Maximum image size: 70 cm x 40 cm
    Gamma: 2.20
    DPMS levels: Standby Suspend Off
    RGB color display
    First detailed timing is the preferred timing
  Color Characteristics:
    Red  : 0.6425, 0.3457
    Green: 0.2812, 0.6396
    Blue : 0.1406, 0.0507
    White: 0.3134, 0.3291
  Established Timings I & II:
    IBM     :   720x400    70.081663 Hz   9:5     31.467 kHz     28.320000 MHz
    DMT 0x04:   640x480    59.940476 Hz   4:3     31.469 kHz     25.175000 MHz
    DMT 0x09:   800x600    60.316541 Hz   4:3     37.879 kHz     40.000000 MHz
    DMT 0x10:  1024x768    60.003840 Hz   4:3     48.363 kHz     65.000000 MHz
  Standard Timings:
    DMT 0x23:  1280x1024   60.019740 Hz   5:4     63.981 kHz    108.000000 MHz
    DMT 0x33:  1600x1200   60.000000 Hz   4:3     75.000 kHz    162.000000 MHz
    DMT 0x45:  1920x1200   59.884600 Hz  16:10    74.556 kHz    193.250000 MHz
    DMT 0x3a:  1680x1050   59.954250 Hz  16:10    65.290 kHz    146.250000 MHz
    DMT 0x1c:  1280x800    59.810326 Hz  16:10    49.702 kHz     83.500000 MHz
    DMT 0x53:  1600x900    60.000000 Hz  16:9     60.000 kHz    108.000000 MHz (RB)
    DMT 0x55:  1280x720    60.000000 Hz  16:9     45.000 kHz     74.250000 MHz
  Detailed Timing Descriptors:
    DTD 1:  3840x2160   29.980602 Hz  16:9     65.688 kHz    262.750000 MHz (697 mm x 392 mm)
                 Hfront   48 Hsync  32 Hback   80 Hpol P
                 Vfront    3 Vsync   5 Vback   23 Vpol N
    DTD 2:  1920x1080   60.000000 Hz  16:9     67.500 kHz    148.500000 MHz (697 mm x 392 mm)
                 Hfront   88 Hsync  44 Hback  148 Hpol P
                 Vfront    4 Vsync   5 Vback   36 Vpol P
    Display Range Limits:
      Monitor ranges (GTF): 29-61 Hz V, 31-134 kHz H, max dotclock 280 MHz
    Display Product Name: 'EV3237'
  Extension blocks: 1
Checksum: 0xd7

----------------

Block 1, CTA-861 Extension Block:
  Revision: 1
  Detailed Timing Descriptors:
    DTD 3:  1920x2160   59.987970 Hz   8:9    133.293 kHz    277.250000 MHz (697 mm x 392 mm)
                 Hfront   48 Hsync  32 Hback   80 Hpol P
                 Vfront    3 Vsync  10 Vback   49 Vpol N
    DTD 4:  1920x2160   29.952077 Hz   8:9     65.625 kHz    136.500000 MHz (697 mm x 392 mm)
                 Hfront   48 Hsync  32 Hback   80 Hpol P
                 Vfront    3 Vsync  10 Vback   18 Vpol N
    DTD 5:  3840x1080   59.968497 Hz  32:9     66.625 kHz    266.500000 MHz (697 mm x 392 mm)
                 Hfront   48 Hsync  32 Hback   80 Hpol P
                 Vfront    3 Vsync  10 Vback   18 Vpol N
    DTD 6:  2560x1440   59.950550 Hz  16:9     88.787 kHz    241.500000 MHz (697 mm x 392 mm)
                 Hfront   48 Hsync  32 Hback   80 Hpol P
                 Vfront    3 Vsync   5 Vback   33 Vpol N
    DTD 7:  2560x1440   29.935499 Hz  16:9     43.945 kHz    146.250000 MHz (697 mm x 392 mm)
                 Hfront  120 Hsync 264 Hback  384 Hpol N
                 Vfront    3 Vsync   5 Vback   20 Vpol P
    DTD 8:  2560x1600   59.971589 Hz  16:10    98.713 kHz    268.500000 MHz (697 mm x 392 mm)
                 Hfront   48 Hsync  32 Hback   80 Hpol P
                 Vfront    3 Vsync  10 Vback   33 Vpol N
Checksum: 0xe9  Unused space in Extension Block: 15 bytes

----------------

Warnings:

Block 1, CTA-861 Extension Block:
  Detailed Timing Descriptor #8: DTD is similar but not identical to DMT 0x4c.
  Add a Colorimetry Data Block with the sRGB colorimetry bit set to avoid interop issues.

Failures:

Block 1, CTA-861 Extension Block:
  Missing VCDB, needed for Set Selectable RGB Quantization to avoid interop issues.
EDID:
  Base EDID: Some timings are out of range of the Monitor Ranges:
    Vertical Freq: 29.935 - 70.082 Hz (Monitor: 29.000 - 61.000 Hz)

EDID conformity: FAIL
