edid-decode (hex):

00 ff ff ff ff ff ff 00 0d ae 01 82 00 00 00 00
19 1c 01 04 a5 1c 12 78 02 5c 75 a4 55 4d 9d 27
0d 50 54 00 00 00 01 01 01 01 01 01 01 01 01 01
01 01 01 01 01 01 7a 50 70 a0 80 a0 28 50 30 20
3a 00 13 b7 10 00 00 18 00 00 00 00 00 00 00 00
00 00 00 00 00 00 00 00 00 00 00 00 00 00 00 00
00 00 00 00 00 00 00 00 00 00 00 00 00 00 00 fc
00 50 31 33 30 5a 46 41 2d 42 41 31 0a 0a 00 01

----------------

Block 0, Base EDID:
  EDID Structure Version & Revision: 1.4
  Vendor & Product Identification:
    Manufacturer: CMN
    Model: 33281
    Made in: week 25 of 2018
  Basic Display Parameters & Features:
    Digital display
    Bits per primary color channel: 8
    DisplayPort interface
    Maximum image size: 28 cm x 18 cm
    Gamma: 2.20
    Supported color formats: RGB 4:4:4
    First detailed timing includes the native pixel format and preferred refresh rate
  Color Characteristics:
    Red  : 0.6416, 0.3330
    Green: 0.3037, 0.6132
    Blue : 0.1533, 0.0537
    White: 0.3134, 0.3291
  Established Timings I & II: none
  Standard Timings: none
  Detailed Timing Descriptors:
    DTD 1:  2160x1440   60.001 Hz   3:2    88.802 kHz 206.020 MHz (275 mm x 183 mm)
                 Hfront   48 Hsync  32 Hback  80 Hpol N
                 Vfront    3 Vsync  10 Vback  27 Vpol N
    Empty Descriptor
    Empty Descriptor
    Display Product Name: 'P130ZFA-BA1'
Checksum: 0x1
