
EDID (hex):
00ffffffffffff000dae018200000000
2f1a0104a51c12780253d0ac5249a326
0f4c5100000001010101010101010101
0101010101017a5070a080a028503020
3a0013b7100000180000000000000000
00000000000000000000000000000000
000000000000000000000000000000fc
00503133305a445a2d4546310a0a007b

Extracted contents:
header:          00 ff ff ff ff ff ff 00
serial number:   0d ae 01 82 00 00 00 00 2f 1a
version:         01 04
basic params:    a5 1c 12 78 02
chroma info:     53 d0 ac 52 49 a3 26 0f 4c 51
established:     00 00 00
standard:        01 01 01 01 01 01 01 01 01 01 01 01 01 01 01 01
descriptor 1:    7a 50 70 a0 80 a0 28 50 30 20 3a 00 13 b7 10 00 00 18
descriptor 2:    00 00 00 00 00 00 00 00 00 00 00 00 00 00 00 00 00 00
descriptor 3:    00 00 00 00 00 00 00 00 00 00 00 00 00 00 00 00 00 00
descriptor 4:    00 00 00 fc 00 50 31 33 30 5a 44 5a 2d 45 46 31 0a 0a
extensions:      00
checksum:        7b

EDID version: 1.4
Manufacturer: CMN Model 8201 Serial Number --
Made in week 47 of 2016
Digital display
8 bits per primary color channel
DisplayPort interface
Maximum image size: 28 cm x 18 cm
Gamma: 2.20
Supported color formats: RGB 4:4:4
First detailed timing includes the native pixel format and preferred refresh rate
Display x,y Chromaticity:
  Red:   0.6728, 0.3212
  Green: 0.2851, 0.6396
  Blue:  0.1513, 0.0595
  White: 0.2968, 0.3164
Established timings supported:
Standard timings supported:
Detailed mode: Clock 206.020 MHz, 275 mm x 183 mm
               2160 2208 2240 2320 hborder 0
               1440 1443 1453 1480 vborder 0
               -hsync -vsync 
               VertFreq: 60 Hz, HorFreq: 88801 Hz
Manufacturer-specified data, tag 0
Manufacturer-specified data, tag 0
Monitor name: P130ZDZ-EF1
Checksum: 0x7b (valid)
EDID block does NOT conform to EDID 1.4!
	Missing monitor ranges
	Detailed block string not properly terminated
