
EDID (hex):
00ffffffffffff004ca3463300000000
000f0103802115780a87f594574f8c27
27505400000001010101010101010101
010101010101932e90a0601a1e403020
26004bcf100000190000000f00000000
00000000003cd2026403000000fe0053
414d53554e470a2020202020000000fe
004c544e31353450312d4c30330a0054

Extracted contents:
header:          00 ff ff ff ff ff ff 00
serial number:   4c a3 46 33 00 00 00 00 00 0f
version:         01 03
basic params:    80 21 15 78 0a
chroma info:     87 f5 94 57 4f 8c 27 27 50 54
established:     00 00 00
standard:        01 01 01 01 01 01 01 01 01 01 01 01 01 01 01 01
descriptor 1:    93 2e 90 a0 60 1a 1e 40 30 20 26 00 4b cf 10 00 00 19
descriptor 2:    00 00 00 0f 00 00 00 00 00 00 00 00 00 3c d2 02 64 03
descriptor 3:    00 00 00 fe 00 53 41 4d 53 55 4e 47 0a 20 20 20 20 20
descriptor 4:    00 00 00 fe 00 4c 54 4e 31 35 34 50 31 2d 4c 30 33 0a
extensions:      00
checksum:        54

EDID version: 1.3
Manufacturer: SEC Model 3346 Serial Number --
Digital display
Maximum image size: 33 cm x 21 cm
Gamma: 2.20
RGB color display
First detailed timing is preferred timing
Display x,y Chromaticity:
  Red:   0.5800, 0.3398
  Green: 0.3095, 0.5498
  Blue:  0.1552, 0.1552
  White: 0.3134, 0.3291
Established timings supported:
Standard timings supported:
Detailed mode: Clock 119.230 MHz, 331 mm x 207 mm
               1680 1728 1760 1840 hborder 0
               1050 1052 1058 1080 vborder 0
               -hsync -vsync 
               VertFreq: 59 Hz, HorFreq: 64798 Hz
Manufacturer-specified data, tag 15
ASCII string: SAMSUNG
ASCII string: LTN154P1-L03
Checksum: 0x54 (valid)
EDID block does NOT conform to EDID 1.3!
	Missing name descriptor
	Missing monitor ranges
EDID block does not conform at all!
	Bad year of manufacture
