edid-decode (hex):

00 ff ff ff ff ff ff 00 06 b3 ac 24 01 01 01 01
0e 1f 01 04 a5 35 1e 78 3b 57 e0 a5 54 4f 9d 26
12 50 54 b7 ef 00 71 4f 81 80 81 40 81 c0 81 00
95 00 b3 00 01 01 86 6f 80 a0 70 38 40 40 30 20
35 00 13 2b 21 00 00 1a 00 00 00 fd 00 30 a5 c1
c1 29 01 0a 20 20 20 20 20 20 00 00 00 fc 00 56
47 32 34 38 0a 20 20 20 20 20 20 20 00 00 00 ff
00 4d 33 4c 4d 51 53 33 36 36 34 30 31 0a 01 d1

02 03 18 f1 4b 90 05 04 03 02 01 11 12 13 14 1f
23 09 07 07 83 01 00 00 8a 4d 80 a0 70 38 2c 40
30 20 35 00 13 2b 21 00 00 1a fe 5b 80 a0 70 38
35 40 30 20 35 00 13 2b 21 00 00 1a fc 7e 80 88
70 38 12 40 18 20 35 00 13 2b 21 00 00 1e a4 9c
80 a0 70 38 59 40 30 20 35 00 13 2b 21 00 00 1a
02 3a 80 18 71 38 2d 40 58 2c 45 00 13 2b 21 00
00 1e 00 00 00 00 00 00 00 00 00 00 00 00 00 0f

00 ff ff ff ff ff ff 00 06 b3 ac 24 01 01 01 01
0e 1f 01 04 a5 35 1e 78 3b 57 e0 a5 54 4f 9d 26
12 50 54 b7 ef 00 71 4f 81 80 81 40 81 c0 81 00
95 00 b3 00 01 01 86 6f 80 a0 70 38 40 40 30 20
35 00 13 2b 21 00 00 1a 00 00 00 fd 00 30 a5 c1
c1 29 01 0a 20 20 20 20 20 20 00 00 00 fc 00 56
47 32 34 38 0a 20 20 20 20 20 20 20 00 00 00 ff
00 4d 33 4c 4d 51 53 33 36 36 34 30 31 0a 01 d1

02 03 18 f1 4b 90 05 04 03 02 01 11 12 13 14 1f
23 09 07 07 83 01 00 00 8a 4d 80 a0 70 38 2c 40
30 20 35 00 13 2b 21 00 00 1a fe 5b 80 a0 70 38
35 40 30 20 35 00 13 2b 21 00 00 1a fc 7e 80 88
70 38 12 40 18 20 35 00 13 2b 21 00 00 1e a4 9c
80 a0 70 38 59 40 30 20 35 00 13 2b 21 00 00 1a
02 3a 80 18 71 38 2d 40 58 2c 45 00 13 2b 21 00
00 1e 00 00 00 00 00 00 00 00 00 00 00 00 00 0f

----------------

Block 0, Base EDID:
  EDID Structure Version & Revision: 1.4
  Vendor & Product Identification:
    Manufacturer: AUS
    Model: 9388
    Serial Number: ...
    Made in: week 14 of 2021
  Basic Display Parameters & Features:
    Digital display
    Bits per primary color channel: 8
    DisplayPort interface
    Maximum image size: 53 cm x 30 cm
    Gamma: 2.20
    DPMS levels: Off
    Supported color formats: RGB 4:4:4, YCrCb 4:4:4, YCrCb 4:2:2
    First detailed timing includes the native pixel format and preferred refresh rate
    Display is continuous frequency
  Color Characteristics:
    Red  : 0.6455, 0.3291
    Green: 0.3095, 0.6162
    Blue : 0.1513, 0.0722
    White: 0.3125, 0.3281
  Established Timings I & II:
    IBM     :   720x400    70.081663 Hz   9:5     31.467 kHz     28.320000 MHz
    DMT 0x04:   640x480    59.940476 Hz   4:3     31.469 kHz     25.175000 MHz
    Apple   :   640x480    66.666667 Hz   4:3     35.000 kHz     30.240000 MHz
    DMT 0x06:   640x480    75.000000 Hz   4:3     37.500 kHz     31.500000 MHz
    DMT 0x08:   800x600    56.250000 Hz   4:3     35.156 kHz     36.000000 MHz
    DMT 0x09:   800x600    60.316541 Hz   4:3     37.879 kHz     40.000000 MHz
    DMT 0x0a:   800x600    72.187572 Hz   4:3     48.077 kHz     50.000000 MHz
    DMT 0x0b:   800x600    75.000000 Hz   4:3     46.875 kHz     49.500000 MHz
    Apple   :   832x624    74.551266 Hz   4:3     49.726 kHz     57.284000 MHz
    DMT 0x10:  1024x768    60.003840 Hz   4:3     48.363 kHz     65.000000 MHz
    DMT 0x11:  1024x768    70.069359 Hz   4:3     56.476 kHz     75.000000 MHz
    DMT 0x12:  1024x768    75.028582 Hz   4:3     60.023 kHz     78.750000 MHz
    DMT 0x24:  1280x1024   75.024675 Hz   5:4     79.976 kHz    135.000000 MHz
  Standard Timings:
    DMT 0x15:  1152x864    75.000000 Hz   4:3     67.500 kHz    108.000000 MHz
    DMT 0x23:  1280x1024   60.019740 Hz   5:4     63.981 kHz    108.000000 MHz
    DMT 0x20:  1280x960    60.000000 Hz   4:3     60.000 kHz    108.000000 MHz
    DMT 0x55:  1280x720    60.000000 Hz  16:9     45.000 kHz     74.250000 MHz
    DMT 0x1c:  1280x800    59.810326 Hz  16:10    49.702 kHz     83.500000 MHz
    DMT 0x2f:  1440x900    59.887445 Hz  16:10    55.935 kHz    106.500000 MHz
    DMT 0x3a:  1680x1050   59.954250 Hz  16:10    65.290 kHz    146.250000 MHz
  Detailed Timing Descriptors:
    DTD  1:  1920x1080  119.982181 Hz  16:9    137.260 kHz    285.500000 MHz (531 mm x 299 mm)
                  Hfront   48 Hsync  32 Hback   80 Hpol P
                  Vfront    3 Vsync   5 Vback   56 Vpol N
    Display Range Limits:
      Monitor ranges (Bare Limits): 48-165 Hz V, 193-193 kHz H, max dotclock 410 MHz
    Display Product Name: 'VG248'
    Display Product Serial Number: ...
  Extension blocks: 1
Checksum: 0xd1

----------------

Block 1, CTA-861 Extension Block:
  Revision: 3
  Underscans IT Video Formats by default
  Basic audio support
  Supports YCbCr 4:4:4
  Supports YCbCr 4:2:2
  Native detailed modes: 1
  Video Data Block:
    VIC  16:  1920x1080   60.000000 Hz  16:9     67.500 kHz    148.500000 MHz (native)
    VIC   5:  1920x1080i  60.000000 Hz  16:9     33.750 kHz     74.250000 MHz
    VIC   4:  1280x720    60.000000 Hz  16:9     45.000 kHz     74.250000 MHz
    VIC   3:   720x480    59.940060 Hz  16:9     31.469 kHz     27.000000 MHz
    VIC   2:   720x480    59.940060 Hz   4:3     31.469 kHz     27.000000 MHz
    VIC   1:   640x480    59.940476 Hz   4:3     31.469 kHz     25.175000 MHz
    VIC  17:   720x576    50.000000 Hz   4:3     31.250 kHz     27.000000 MHz
    VIC  18:   720x576    50.000000 Hz  16:9     31.250 kHz     27.000000 MHz
    VIC  19:  1280x720    50.000000 Hz  16:9     37.500 kHz     74.250000 MHz
    VIC  20:  1920x1080i  50.000000 Hz  16:9     28.125 kHz     74.250000 MHz
    VIC  31:  1920x1080   50.000000 Hz  16:9     56.250 kHz    148.500000 MHz
  Audio Data Block:
    Linear PCM:
      Max channels: 2
      Supported sample rates (kHz): 48 44.1 32
      Supported sample sizes (bits): 24 20 16
  Speaker Allocation Data Block:
    FL/FR - Front Left/Right
  Detailed Timing Descriptors:
    DTD  2:  1920x1080   84.904531 Hz  16:9     95.433 kHz    198.500000 MHz (531 mm x 299 mm)
                  Hfront   48 Hsync  32 Hback   80 Hpol P
                  Vfront    3 Vsync   5 Vback   36 Vpol N
    DTD  3:  1920x1080   99.930409 Hz  16:9    113.221 kHz    235.500000 MHz (531 mm x 299 mm)
                  Hfront   48 Hsync  32 Hback   80 Hpol P
                  Vfront    3 Vsync   5 Vback   45 Vpol N
    DTD  4:  1920x1080  144.000765 Hz  16:9    158.113 kHz    325.080000 MHz (531 mm x 299 mm)
                  Hfront   24 Hsync  32 Hback   80 Hpol P
                  Vfront    3 Vsync   5 Vback   10 Vpol P
    DTD  5:  1920x1080  164.917418 Hz  16:9    192.788 kHz    401.000000 MHz (531 mm x 299 mm)
                  Hfront   48 Hsync  32 Hback   80 Hpol P
                  Vfront    3 Vsync   5 Vback   81 Vpol N
    DTD  6:  1920x1080   60.000000 Hz  16:9     67.500 kHz    148.500000 MHz (531 mm x 299 mm)
                  Hfront   88 Hsync  44 Hback  148 Hpol P
                  Vfront    4 Vsync   5 Vback   36 Vpol P
Checksum: 0x0f  Unused space in Extension Block: 13 bytes

----------------

Block 2, Unknown EDID Extension Block 0x00:
  00 ff ff ff ff ff ff 00 06 b3 ac 24 01 01 01 01 '...........$....'
  0e 1f 01 04 a5 35 1e 78 3b 57 e0 a5 54 4f 9d 26 '.....5.x;W..TO.&'
  12 50 54 b7 ef 00 71 4f 81 80 81 40 81 c0 81 00 '.PT...qO...@....'
  95 00 b3 00 01 01 86 6f 80 a0 70 38 40 40 30 20 '.......o..p8@@0 '
  35 00 13 2b 21 00 00 1a 00 00 00 fd 00 30 a5 c1 '5..+!........0..'
  c1 29 01 0a 20 20 20 20 20 20 00 00 00 fc 00 56 '.)..      .....V'
  47 32 34 38 0a 20 20 20 20 20 20 20 00 00 00 ff 'G248.       ....'
  00 4d 33 4c 4d 51 53 33 36 36 34 30 31 0a 01 d1 '.M3LMQS366401...'
Checksum: 0xd1

----------------

Block 3, CTA-861 Extension Block:
  Revision: 3
  Underscans IT Video Formats by default
  Basic audio support
  Supports YCbCr 4:4:4
  Supports YCbCr 4:2:2
  Native detailed modes: 1
  Video Data Block:
    VIC  16:  1920x1080   60.000000 Hz  16:9     67.500 kHz    148.500000 MHz (native)
    VIC   5:  1920x1080i  60.000000 Hz  16:9     33.750 kHz     74.250000 MHz
    VIC   4:  1280x720    60.000000 Hz  16:9     45.000 kHz     74.250000 MHz
    VIC   3:   720x480    59.940060 Hz  16:9     31.469 kHz     27.000000 MHz
    VIC   2:   720x480    59.940060 Hz   4:3     31.469 kHz     27.000000 MHz
    VIC   1:   640x480    59.940476 Hz   4:3     31.469 kHz     25.175000 MHz
    VIC  17:   720x576    50.000000 Hz   4:3     31.250 kHz     27.000000 MHz
    VIC  18:   720x576    50.000000 Hz  16:9     31.250 kHz     27.000000 MHz
    VIC  19:  1280x720    50.000000 Hz  16:9     37.500 kHz     74.250000 MHz
    VIC  20:  1920x1080i  50.000000 Hz  16:9     28.125 kHz     74.250000 MHz
    VIC  31:  1920x1080   50.000000 Hz  16:9     56.250 kHz    148.500000 MHz
  Audio Data Block:
    Linear PCM:
      Max channels: 2
      Supported sample rates (kHz): 48 44.1 32
      Supported sample sizes (bits): 24 20 16
  Speaker Allocation Data Block:
    FL/FR - Front Left/Right
  Detailed Timing Descriptors:
    DTD  7:  1920x1080   84.904531 Hz  16:9     95.433 kHz    198.500000 MHz (531 mm x 299 mm)
                  Hfront   48 Hsync  32 Hback   80 Hpol P
                  Vfront    3 Vsync   5 Vback   36 Vpol N
    DTD  8:  1920x1080   99.930409 Hz  16:9    113.221 kHz    235.500000 MHz (531 mm x 299 mm)
                  Hfront   48 Hsync  32 Hback   80 Hpol P
                  Vfront    3 Vsync   5 Vback   45 Vpol N
    DTD  9:  1920x1080  144.000765 Hz  16:9    158.113 kHz    325.080000 MHz (531 mm x 299 mm)
                  Hfront   24 Hsync  32 Hback   80 Hpol P
                  Vfront    3 Vsync   5 Vback   10 Vpol P
    DTD 10:  1920x1080  164.917418 Hz  16:9    192.788 kHz    401.000000 MHz (531 mm x 299 mm)
                  Hfront   48 Hsync  32 Hback   80 Hpol P
                  Vfront    3 Vsync   5 Vback   81 Vpol N
    DTD 11:  1920x1080   60.000000 Hz  16:9     67.500 kHz    148.500000 MHz (531 mm x 299 mm)
                  Hfront   88 Hsync  44 Hback  148 Hpol P
                  Vfront    4 Vsync   5 Vback   36 Vpol P
Checksum: 0x0f  Unused space in Extension Block: 13 bytes

----------------

Warnings:

Block 1, CTA-861 Extension Block:
  Display Product Serial Number is set, so the Serial Number in the Base EDID should be 0.
  Add a Colorimetry Data Block with the sRGB colorimetry bit set to avoid interop issues.
Block 3, CTA-861 Extension Block:
  Display Product Serial Number is set, so the Serial Number in the Base EDID should be 0.
  Add a Colorimetry Data Block with the sRGB colorimetry bit set to avoid interop issues.
EDID:
  Base EDID: Some timings are out of range of the Monitor Ranges:
    Horizontal Freq: 28.125 - 192.788 kHz (Monitor: 193.000 - 193.000 kHz)
  CTA-861: Multiple native progressive timings are defined.

Failures:

Block 1, CTA-861 Extension Block:
  Missing VCDB, needed for Set Selectable RGB Quantization to avoid interop issues.
Block 2, Base EDID:
  Unknown Extension Block.
Block 3, CTA-861 Extension Block:
  Video Data Block: Duplicate VIC 16.
  Video Data Block: Duplicate VIC 5.
  Video Data Block: Duplicate VIC 4.
  Video Data Block: Duplicate VIC 3.
  Video Data Block: Duplicate VIC 2.
  Video Data Block: Duplicate VIC 1.
  Video Data Block: Duplicate VIC 17.
  Video Data Block: Duplicate VIC 18.
  Video Data Block: Duplicate VIC 19.
  Video Data Block: Duplicate VIC 20.
  Video Data Block: Duplicate VIC 31.
  Speaker Allocation Data Block: Only one instance of this Data Block is allowed.
  Missing VCDB, needed for Set Selectable RGB Quantization to avoid interop issues.
EDID:
  Base EDID: EDID specified 1 extension block(s), but found 3 extension block(s).

EDID conformity: FAIL
