
EDID (hex):
00ffffffffffff002163721400000000
00210104951f11780300409558579229
21505400000001010101010101010101
010101010101a01d56d6500020302820
ac0035ae10000019c01356d650002030
2820ac0035ae10000019000000000000
00000000000000000000000000000002
000c3dff0c3c7d1112217d000000008a

edid-decode (hex):

00 ff ff ff ff ff ff 00 21 63 72 14 00 00 00 00
00 21 01 04 95 1f 11 78 03 00 40 95 58 57 92 29
21 50 54 00 00 00 01 01 01 01 01 01 01 01 01 01
01 01 01 01 01 01 a0 1d 56 d6 50 00 20 30 28 20
ac 00 35 ae 10 00 00 19 c0 13 56 d6 50 00 20 30
28 20 ac 00 35 ae 10 00 00 19 00 00 00 00 00 00
00 00 00 00 00 00 00 00 00 00 00 00 00 00 00 02
00 0c 3d ff 0c 3c 7d 11 12 21 7d 00 00 00 00 8a

----------------

Block 0, Base EDID:
  EDID Structure Version & Revision: 1.4
  Vendor & Product Identification:
    Manufacturer: HKC
    Model: 5234
    Made in: 2023
  Basic Display Parameters & Features:
    Digital display
    Bits per primary color channel: 6
    DisplayPort interface
    Maximum image size: 31 cm x 17 cm
    Gamma: 2.20
    Supported color formats: RGB 4:4:4
    First detailed timing includes the native pixel format and preferred refresh rate
    Display is continuous frequency
  Color Characteristics:
    Red  : 0.5820, 0.3437
    Green: 0.3398, 0.5703
    Blue : 0.1611, 0.1289
    White: 0.3125, 0.3281
  Established Timings I & II: none
  Standard Timings: none
  Detailed Timing Descriptors:
    DTD 1:  1366x768    60.000000 Hz 683:384   48.000 kHz     75.840000 MHz (309 mm x 174 mm)
                 Hfront   40 Hsync  32 Hback  142 Hpol N
                 Vfront   10 Vsync  12 Vback   10 Vpol N
    DTD 2:  1366x768    40.000000 Hz 683:384   32.000 kHz     50.560000 MHz (309 mm x 174 mm)
                 Hfront   40 Hsync  32 Hback  142 Hpol N
                 Vfront   10 Vsync  12 Vback   10 Vpol N
    Empty Descriptor
    Manufacturer-Specified Display Descriptor (0x02): 00 02 00 0c 3d ff 0c 3c 7d 11 12 21 7d 00 00 00 '....=..<}..!}...'
Checksum: 0x8a
