edid-decode (hex):

00 ff ff ff ff ff ff 00 26 cd 40 19 a2 67 fb 02
0a 0c 01 03 0e 24 1d 63 e8 a4 91 9f 55 4c 54 23
1a 4e 4f bf ef 80 a9 59 81 99 61 59 d1 59 01 01
01 01 01 01 01 01 86 3d 00 c0 51 00 30 40 40 a0
13 00 8b 27 11 00 00 1e 00 00 00 fc 00 48 4d 39
30 33 44 2f 44 54 20 0a 20 20 00 00 00 fd 00 32
c8 1e 82 23 02 00 20 50 10 0e 80 46 47 68 00 f0
82 00 35 60 98 e0 13 00 68 22 11 00 00 1e 00 63

----------------

Block 0, Base EDID:
  EDID Structure Version & Revision: 1.3
  Vendor & Product Identification:
    Manufacturer: IVM
    Model: 6464
    Serial Number: ...
    Made in: week 10 of 2002
  Basic Display Parameters & Features:
    Analog display
    Input voltage level: 0.7/0.3 V
    Blank level equals black level
    Sync: Separate Composite SyncOnGreen
    Maximum image size: 36 cm x 29 cm
    Gamma: 1.99
    DPMS levels: Standby Suspend Off
    RGB color display
  Color Characteristics:
    Red  : 0.6230, 0.3339
    Green: 0.2978, 0.3281
    Blue : 0.1386, 0.1025
    White: 0.3046, 0.3095
  Established Timings I & II:
    IBM     :   720x400    70.082 Hz   9:5    31.467 kHz  28.320 MHz
    DMT 0x04:   640x480    59.940 Hz   4:3    31.469 kHz  25.175 MHz
    Apple   :   640x480    66.667 Hz   4:3    35.000 kHz  30.240 MHz
    DMT 0x05:   640x480    72.809 Hz   4:3    37.861 kHz  31.500 MHz
    DMT 0x06:   640x480    75.000 Hz   4:3    37.500 kHz  31.500 MHz
    DMT 0x08:   800x600    56.250 Hz   4:3    35.156 kHz  36.000 MHz
    DMT 0x09:   800x600    60.317 Hz   4:3    37.879 kHz  40.000 MHz
    DMT 0x0a:   800x600    72.188 Hz   4:3    48.077 kHz  50.000 MHz
    DMT 0x0b:   800x600    75.000 Hz   4:3    46.875 kHz  49.500 MHz
    Apple   :   832x624    74.551 Hz   4:3    49.726 kHz  57.284 MHz
    DMT 0x10:  1024x768    60.004 Hz   4:3    48.363 kHz  65.000 MHz
    DMT 0x11:  1024x768    70.069 Hz   4:3    56.476 kHz  75.000 MHz
    DMT 0x12:  1024x768    75.029 Hz   4:3    60.023 kHz  78.750 MHz
    DMT 0x24:  1280x1024   75.025 Hz   5:4    79.976 kHz 135.000 MHz
    Apple   :  1152x870    75.062 Hz 192:145  68.681 kHz 100.000 MHz
  Standard Timings:
    DMT 0x37:  1600x1200   85.000 Hz   4:3   106.250 kHz 229.500 MHz
    DMT 0x25:  1280x1024   85.024 Hz   5:4    91.146 kHz 157.500 MHz
    DMT 0x13:  1024x768    84.997 Hz   4:3    68.677 kHz  94.500 MHz
    GTF     :  1920x1440   85.000 Hz   4:3   128.520 kHz 341.349 MHz
  Detailed Timing Descriptors:
    DTD 1:  1280x1024   85.024 Hz   5:4    91.146 kHz 157.500 MHz (395 mm x 295 mm)
                 Hfront   64 Hsync 160 Hback 224 Hpol P
                 Vfront    1 Vsync   3 Vback  44 Vpol P
    Display Product Name: 'HM903D/DT '
  Display Range Limits:
    Monitor ranges (Secondary GTF): 50-200 Hz V, 30-130 kHz H, max dotclock 350 MHz
    GTF Secondary Curve Block:
      Start frequency: 64 kHz
      C: 40.000000
      M: 3600
      K: 128
      J: 35.000000
    DTD 2:  2048x1536   60.000 Hz   4:3    95.339 kHz 266.950 MHz (360 mm x 290 mm)
                 Hfront  152 Hsync 224 Hback 376 Hpol P
                 Vfront    1 Vsync   3 Vback  49 Vpol P
Checksum: 0x63

----------------

Failures:

Block 0, Base EDID:
  Basic Display Parameters & Features: EDID 1.3 requires that the first detailed timing is the preferred timing.
  Detailed Timing Descriptor #1: Mismatch of image size 395x295 mm vs display size 360x290 mm.
  Display Product Name: One or more trailing spaces.
  Detailed Timing Descriptor #2: Invalid detailed timing descriptor ordering.

EDID conformity: FAIL
