
EDID (hex):
00ffffffffffff004ca34e3500000000
0014010380160d780a93359458579029
1e505400000001010101010101010101
0101010101011b150040415846201888
3600df7d000000190000000f00000000
000000000071ee136e00000000fe0053
414d53554e470a2020202020000000fe
003130314e5430352d5430310a2000af

edid-decode (hex):

00 ff ff ff ff ff ff 00 4c a3 4e 35 00 00 00 00
00 14 01 03 80 16 0d 78 0a 93 35 94 58 57 90 29
1e 50 54 00 00 00 01 01 01 01 01 01 01 01 01 01
01 01 01 01 01 01 1b 15 00 40 41 58 46 20 18 88
36 00 df 7d 00 00 00 19 00 00 00 0f 00 00 00 00
00 00 00 00 00 71 ee 13 6e 00 00 00 00 fe 00 53
41 4d 53 55 4e 47 0a 20 20 20 20 20 00 00 00 fe
00 31 30 31 4e 54 30 35 2d 54 30 31 0a 20 00 af

----------------

Block 0, Base EDID:
  EDID Structure Version & Revision: 1.3
  Vendor & Product Identification:
    Manufacturer: SEC
    Model: 13646
    Made in: 2010
  Basic Display Parameters & Features:
    Digital display
    Maximum image size: 22 cm x 13 cm
    Gamma: 2.20
    RGB color display
    First detailed timing is the preferred timing
  Color Characteristics:
    Red  : 0.5800, 0.3447
    Green: 0.3398, 0.5654
    Blue : 0.1601, 0.1201
    White: 0.3134, 0.3291
  Established Timings I & II: none
  Standard Timings: none
  Detailed Timing Descriptors:
    DTD 1:  1024x600    60.001333 Hz 128:75    40.201 kHz     54.030000 MHz (223 mm x 125 mm)
                 Hfront   24 Hsync 136 Hback  160 Hpol N
                 Vfront    3 Vsync   6 Vback   61 Vpol N
    Manufacturer-Specified Display Descriptor (0x0f): 00 0f 00 00 00 00 00 00 00 00 00 71 ee 13 6e 00 '...........q..n.'
    Alphanumeric Data String: 'SAMSUNG'
    Alphanumeric Data String: '101NT05-T01'
Checksum: 0xaf
