
EDID (hex):
00ffffffffffff0022f06b2801010101
31150104683420782efc81a4554d9d25
125054210800814081809500a940b300
d1c0d1000101283c80a070b023403020
360006442100001a000000fd003b3d18
5014000a202020202020000000fc0048
50205a523234770a20202020000000ff
00434e54313439313038570a202000a5

Extracted contents:
header:          00 ff ff ff ff ff ff 00
serial number:   22 f0 6b 28 01 01 01 01 31 15
version:         01 04
basic params:    68 34 20 78 2e
chroma info:     fc 81 a4 55 4d 9d 25 12 50 54
established:     21 08 00
standard:        81 40 81 80 95 00 a9 40 b3 00 d1 c0 d1 00 01 01
descriptor 1:    28 3c 80 a0 70 b0 23 40 30 20 36 00 06 44 21 00 00 1a
descriptor 2:    00 00 00 fd 00 3b 3d 18 50 14 00 0a 20 20 20 20 20 20
descriptor 3:    00 00 00 fc 00 48 50 20 5a 52 32 34 77 0a 20 20 20 20
descriptor 4:    00 00 00 ff 00 43 4e 54 31 34 39 31 30 38 57 0a 20 20
extensions:      00
checksum:        a5

EDID version: 1.4
Manufacturer: HWP Model 286b Serial Number --
Made in week 49 of 2011
Analog display, Input voltage level: 0.7/0.7 V
Blank level equals black level
Sync: Separate 
Maximum image size: 52 cm x 32 cm
Gamma: 2.20
DPMS levels: Off
RGB color display
Default (sRGB) color space is primary color space
First detailed timing includes the native pixel format and preferred refresh rate
Display x,y Chromaticity:
  Red:   0.6435, 0.3349
  Green: 0.3037, 0.6132
  Blue:  0.1464, 0.0703
  White: 0.3125, 0.3291
Established timings supported:
  640x480@60Hz 4:3 HorFreq: 31469 Hz Clock: 25.175 MHz
  800x600@60Hz 4:3 HorFreq: 37900 Hz Clock: 40.000 MHz
  1024x768@60Hz 4:3 HorFreq: 48400 Hz Clock: 65.000 MHz
Standard timings supported:
  1280x960@60Hz 4:3 HorFreq: 60000 Hz Clock: 108.000 MHz
  1280x1024@60Hz 5:4 HorFreq: 64000 Hz Clock: 108.000 MHz
  1440x900@60Hz 16:10 HorFreq: 55500 Hz Clock: 88.750 MHz
  1600x1200@60Hz 4:3 HorFreq: 75000 Hz Clock: 162.000 MHz
  1680x1050@60Hz 16:10 HorFreq: 64700 Hz Clock: 119.000 MHz
  1920x1080@60Hz 16:9
  1920x1200@60Hz 16:10 HorFreq: 74000 Hz Clock: 154.000 MHz
Detailed mode: Clock 154.000 MHz, 518 mm x 324 mm
               1920 1968 2000 2080 hborder 0
               1200 1203 1209 1235 vborder 0
               +hsync -vsync 
               VertFreq: 59 Hz, HorFreq: 74038 Hz
Monitor ranges (GTF): 59-61Hz V, 24-80kHz H, max dotclock 200MHz
Monitor name: HP ZR24w
Serial number: --
Checksum: 0xa5 (valid)
EDID block does NOT conform to EDID 1.4!
	sRGB is signaled, but the chromaticities do not match
