
EDID (hex):
00ffffffffffff0009e54a0700000000
011b0104951d117802de50a3544c9926
0f505400000001010101010101010101
010101010101b43b803b71383c403020
360026a51000001ab43b803b71387642
3020360026a51000001a000000000000
00000000000000000000000000000002
000726f20b3cc814102dc8000000005d

Extracted contents:
header:          00 ff ff ff ff ff ff 00
serial number:   09 e5 4a 07 00 00 00 00 01 1b
version:         01 04
basic params:    95 1d 11 78 02
chroma info:     de 50 a3 54 4c 99 26 0f 50 54
established:     00 00 00
standard:        01 01 01 01 01 01 01 01 01 01 01 01 01 01 01 01
descriptor 1:    b4 3b 80 3b 71 38 3c 40 30 20 36 00 26 a5 10 00 00 1a
descriptor 2:    b4 3b 80 3b 71 38 76 42 30 20 36 00 26 a5 10 00 00 1a
descriptor 3:    00 00 00 00 00 00 00 00 00 00 00 00 00 00 00 00 00 00
descriptor 4:    00 00 00 02 00 07 26 f2 0b 3c c8 14 10 2d c8 00 00 00
extensions:      00
checksum:        5d

EDID version: 1.4
Manufacturer: BOE Model 74a Serial Number --
Made in week 1 of 2017
Digital display
6 bits per primary color channel
DisplayPort interface
Maximum image size: 29 cm x 17 cm
Gamma: 2.20
Supported color formats: RGB 4:4:4
First detailed timing includes the native pixel format and preferred refresh rate
Display x,y Chromaticity:
  Red:   0.6396, 0.3291
  Green: 0.2998, 0.5996
  Blue:  0.1494, 0.0595
  White: 0.3125, 0.3281
Established timings supported:
Standard timings supported:
Detailed mode: Clock 152.840 MHz, 294 mm x 165 mm
               1920 1968 2000 2235 hborder 0
               1080 1083 1089 1140 vborder 0
               +hsync -vsync 
               VertFreq: 59 Hz, HorFreq: 68384 Hz
Detailed mode: Clock 152.840 MHz, 294 mm x 165 mm
               1920 1968 2000 2235 hborder 0
               1080 1083 1089 1710 vborder 0
               +hsync -vsync 
               VertFreq: 39 Hz, HorFreq: 68384 Hz
Manufacturer-specified data, tag 0
Manufacturer-specified data, tag 2
Checksum: 0x5d (valid)
EDID block does NOT conform to EDID 1.4!
	Missing name descriptor
	Missing monitor ranges
