
EDID (hex):
00ffffffffffff0006afed2500000000
01140103802213780ab2259f59565a26
0d505400000001010101010101010101
0101010101014c368082703832403c30
aa0058c1100000180000000f00000000
00000000000000000020000000fe0041
554f0a202020202020202020000000fe
004231353648573032205635200a00a6

Extracted contents:
header:          00 ff ff ff ff ff ff 00
serial number:   06 af ed 25 00 00 00 00 01 14
version:         01 03
basic params:    80 22 13 78 0a
chroma info:     b2 25 9f 59 56 5a 26 0d 50 54
established:     00 00 00
standard:        01 01 01 01 01 01 01 01 01 01 01 01 01 01 01 01
descriptor 1:    4c 36 80 82 70 38 32 40 3c 30 aa 00 58 c1 10 00 00 18
descriptor 2:    00 00 00 0f 00 00 00 00 00 00 00 00 00 00 00 00 00 20
descriptor 3:    00 00 00 fe 00 41 55 4f 0a 20 20 20 20 20 20 20 20 20
descriptor 4:    00 00 00 fe 00 42 31 35 36 48 57 30 32 20 56 35 20 0a
extensions:      00
checksum:        a6

EDID version: 1.3
Manufacturer: AUO Model 25ed Serial Number --
Made in week 1 of 2010
Digital display
Maximum image size: 34 cm x 19 cm
Gamma: 2.20
RGB color display
First detailed timing is preferred timing
Display x,y Chromaticity:
  Red:   0.6230, 0.3505
  Green: 0.3359, 0.3535
  Blue:  0.1484, 0.0527
  White: 0.3134, 0.3291
Established timings supported:
Standard timings supported:
Detailed mode: Clock 139.000 MHz, 344 mm x 193 mm
               1920 1980 2028 2050 hborder 0
               1080 1090 1100 1130 vborder 0
               -hsync -vsync 
               VertFreq: 60 Hz, HorFreq: 67804 Hz
Manufacturer-specified data, tag 15
ASCII string: AUO
ASCII string: B156HW02 V5 
Checksum: 0xa6 (valid)
EDID block does NOT conform to EDID 1.3!
	Missing name descriptor
	Missing monitor ranges
