
EDID (hex):
00ffffffffffff001ab30d0701010101
3110010368291a782a8585a6574a9c26
125054a54b0081809500950f90408100
0101010101019a29a0d0518422305098
36009a001100001c000000ff00594531
4e3031333231370a2020000000fd0038
4b1f530e000a202020202020000000fc
004c3139572d320a2020202020200076

Extracted contents:
header:          00 ff ff ff ff ff ff 00
serial number:   1a b3 0d 07 01 01 01 01 31 10
version:         01 03
basic params:    68 29 1a 78 2a
chroma info:     85 85 a6 57 4a 9c 26 12 50 54
established:     a5 4b 00
standard:        81 80 95 00 95 0f 90 40 81 00 01 01 01 01 01 01
descriptor 1:    9a 29 a0 d0 51 84 22 30 50 98 36 00 9a 00 11 00 00 1c
descriptor 2:    00 00 00 ff 00 59 45 31 4e 30 31 33 32 31 37 0a 20 20
descriptor 3:    00 00 00 fd 00 38 4b 1f 53 0e 00 0a 20 20 20 20 20 20
descriptor 4:    00 00 00 fc 00 4c 31 39 57 2d 32 0a 20 20 20 20 20 20
extensions:      00
checksum:        76

EDID version: 1.3
Manufacturer: FUS Model 70d Serial Number --
Made in week 49 of 2006
Analog display, Input voltage level: 0.7/0.7 V
Sync: Separate 
Maximum image size: 41 cm x 26 cm
Gamma: 2.20
DPMS levels: Off
RGB color display
First detailed timing is preferred timing
Display x,y Chromaticity:
  Red:   0.6503, 0.3398
  Green: 0.2900, 0.6103
  Blue:  0.1503, 0.0703
  White: 0.3134, 0.3291
Established timings supported:
  720x400@70Hz 9:5 HorFreq: 31469 Hz Clock: 28.320 MHz
  640x480@60Hz 4:3 HorFreq: 31469 Hz Clock: 25.175 MHz
  640x480@75Hz 4:3 HorFreq: 37500 Hz Clock: 31.500 MHz
  800x600@60Hz 4:3 HorFreq: 37900 Hz Clock: 40.000 MHz
  800x600@75Hz 4:3 HorFreq: 46900 Hz Clock: 49.500 MHz
  1024x768@60Hz 4:3 HorFreq: 48400 Hz Clock: 65.000 MHz
  1024x768@75Hz 4:3 HorFreq: 60000 Hz Clock: 78.750 MHz
  1280x1024@75Hz 5:4 HorFreq: 80000 Hz Clock: 135.000 MHz
Standard timings supported:
  1280x1024@60Hz 5:4 HorFreq: 64000 Hz Clock: 108.000 MHz
  1440x900@60Hz 16:10 HorFreq: 55500 Hz Clock: 88.750 MHz
  1440x900@75Hz 16:10 HorFreq: 82300 Hz Clock: 156.000 MHz
  1400x1050@60Hz 4:3 HorFreq: 64700 Hz Clock: 101.000 MHz
  1280x800@60Hz 16:10
Detailed mode: Clock 106.500 MHz, 410 mm x 256 mm
               1440 1520 1672 1904 hborder 0
                900  903  909  934 vborder 0
               -hsync +vsync 
               VertFreq: 59 Hz, HorFreq: 55934 Hz
Serial number: --
Monitor ranges (GTF): 56-75Hz V, 31-83kHz H, max dotclock 140MHz
Monitor name: L19W-2
Checksum: 0x76 (valid)
One or more of the timings is out of range of the Monitor Ranges:
  Vertical Freq: 59 - 75 Hz
  Horizontal Freq: 31469 - 82300 Hz
  Maximum Clock: 156.000 MHz
