
EDID (hex):
00ffffffffffff00593a051001010101
001801031c341d782a2ac5a4564f9e28
0f5054a5ce0001010101010101010101
010101010101023a801871382d40582c
450009252100001e6419004041002630
18883600092521000018000000fc0045
323431692d41310a20202020000000fd
00384c1f500f000a2020202020200017

Extracted contents:
header:          00 ff ff ff ff ff ff 00
serial number:   59 3a 05 10 01 01 01 01 00 18
version:         01 03
basic params:    1c 34 1d 78 2a
chroma info:     2a c5 a4 56 4f 9e 28 0f 50 54
established:     a5 ce 00
standard:        01 01 01 01 01 01 01 01 01 01 01 01 01 01 01 01
descriptor 1:    02 3a 80 18 71 38 2d 40 58 2c 45 00 09 25 21 00 00 1e
descriptor 2:    64 19 00 40 41 00 26 30 18 88 36 00 09 25 21 00 00 18
descriptor 3:    00 00 00 fc 00 45 32 34 31 69 2d 41 31 0a 20 20 20 20
descriptor 4:    00 00 00 fd 00 38 4c 1f 50 0f 00 0a 20 20 20 20 20 20
extensions:      00
checksum:        17

EDID version: 1.3
Manufacturer: VIZ Model 1005 Serial Number --
Made in year 2014
Analog display, Input voltage level: 0.7/0.3 V
Configurable signal levels
Sync: Separate Composite 
Maximum image size: 52 cm x 29 cm
Gamma: 2.20
DPMS levels: Off
RGB color display
First detailed timing is preferred timing
Display x,y Chromaticity:
  Red:   0.6406, 0.3378
  Green: 0.3105, 0.6191
  Blue:  0.1591, 0.0585
  White: 0.3134, 0.3291
Established timings supported:
  720x400@70Hz 9:5 HorFreq: 31469 Hz Clock: 28.320 MHz
  640x480@60Hz 4:3 HorFreq: 31469 Hz Clock: 25.175 MHz
  640x480@75Hz 4:3 HorFreq: 37500 Hz Clock: 31.500 MHz
  800x600@60Hz 4:3 HorFreq: 37900 Hz Clock: 40.000 MHz
  800x600@72Hz 4:3 HorFreq: 48100 Hz Clock: 50.000 MHz
  800x600@75Hz 4:3 HorFreq: 46900 Hz Clock: 49.500 MHz
  1024x768@60Hz 4:3 HorFreq: 48400 Hz Clock: 65.000 MHz
  1024x768@70Hz 4:3 HorFreq: 56500 Hz Clock: 75.000 MHz
  1024x768@75Hz 4:3 HorFreq: 60000 Hz Clock: 78.750 MHz
Standard timings supported:
Detailed mode: Clock 148.500 MHz, 521 mm x 293 mm
               1920 2008 2052 2200 hborder 0
               1080 1084 1089 1125 vborder 0
               +hsync +vsync 
               VertFreq: 60 Hz, HorFreq: 67500 Hz
Detailed mode: Clock 65.000 MHz, 521 mm x 293 mm
               1024 1048 1184 1344 hborder 0
                768  771  777  806 vborder 0
               -hsync -vsync 
               VertFreq: 60 Hz, HorFreq: 48363 Hz
Monitor name: E241i-A1
Monitor ranges (GTF): 56-76Hz V, 31-80kHz H, max dotclock 150MHz
Checksum: 0x17 (valid)
