
EDID (hex):
00ffffffffffff002283066601010101
09100104a500007802d9eda358599c23
0b4c5cbfef00315945596159714f8140
81c08199a94064190040410026301888
3600000000000018000000ff00303030
3030303030300a202020000000fd0038
781f6a17000a202020202020000000fc
0050524f4a4543544f520a2020200043

Extracted contents:
header:          00 ff ff ff ff ff ff 00
serial number:   22 83 06 66 01 01 01 01 09 10
version:         01 04
basic params:    a5 00 00 78 02
chroma info:     d9 ed a3 58 59 9c 23 0b 4c 5c
established:     bf ef 00
standard:        31 59 45 59 61 59 71 4f 81 40 81 c0 81 99 a9 40
descriptor 1:    64 19 00 40 41 00 26 30 18 88 36 00 00 00 00 00 00 18
descriptor 2:    00 00 00 ff 00 30 30 30 30 30 30 30 30 30 0a 20 20 20
descriptor 3:    00 00 00 fd 00 38 78 1f 6a 17 00 0a 20 20 20 20 20 20
descriptor 4:    00 00 00 fc 00 50 52 4f 4a 45 43 54 4f 52 0a 20 20 20
extensions:      00
checksum:        43

EDID version: 1.4
Manufacturer: HTC Model 6606 Serial Number --
Made in week 9 of 2006
Digital display
8 bits per primary color channel
DisplayPort interface
Image size is variable
Gamma: 2.20
Supported color formats: RGB 4:4:4
First detailed timing includes the native pixel format and preferred refresh rate
Display x,y Chromaticity:
  Red:   0.6396, 0.3447
  Green: 0.3496, 0.6103
  Blue:  0.1396, 0.0449
  White: 0.2998, 0.3603
Established timings supported:
  720x400@70Hz 9:5 HorFreq: 31469 Hz Clock: 28.320 MHz
  640x480@60Hz 4:3 HorFreq: 31469 Hz Clock: 25.175 MHz
  640x480@67Hz 4:3 HorFreq: 35000 Hz Clock: 30.240 MHz
  640x480@72Hz 4:3 HorFreq: 37900 Hz Clock: 31.500 MHz
  640x480@75Hz 4:3 HorFreq: 37500 Hz Clock: 31.500 MHz
  800x600@56Hz 4:3 HorFreq: 35200 Hz Clock: 36.000 MHz
  800x600@60Hz 4:3 HorFreq: 37900 Hz Clock: 40.000 MHz
  800x600@72Hz 4:3 HorFreq: 48100 Hz Clock: 50.000 MHz
  800x600@75Hz 4:3 HorFreq: 46900 Hz Clock: 49.500 MHz
  832x624@75Hz 4:3 HorFreq: 49726 Hz Clock: 57.284 MHz
  1024x768@60Hz 4:3 HorFreq: 48400 Hz Clock: 65.000 MHz
  1024x768@70Hz 4:3 HorFreq: 56500 Hz Clock: 75.000 MHz
  1024x768@75Hz 4:3 HorFreq: 60000 Hz Clock: 78.750 MHz
  1280x1024@75Hz 5:4 HorFreq: 80000 Hz Clock: 135.000 MHz
Standard timings supported:
  640x480@85Hz 4:3 HorFreq: 43300 Hz Clock: 36.000 MHz
  800x600@85Hz 4:3 HorFreq: 53700 Hz Clock: 56.250 MHz
  1024x768@85Hz 4:3 HorFreq: 68700 Hz Clock: 94.500 MHz
  1152x864@75Hz 4:3 HorFreq: 67500 Hz Clock: 108.000 MHz
  1280x960@60Hz 4:3 HorFreq: 60000 Hz Clock: 108.000 MHz
  1280x720@60Hz 16:9
  1280x1024@85Hz 5:4 HorFreq: 91100 Hz Clock: 157.500 MHz
  1600x1200@60Hz 4:3 HorFreq: 75000 Hz Clock: 162.000 MHz
Detailed mode: Clock 65.000 MHz, 0 mm x 0 mm
               1024 1048 1184 1344 hborder 0
                768  771  777  806 vborder 0
               -hsync -vsync 
               VertFreq: 60 Hz, HorFreq: 48363 Hz
Serial number: --
Monitor ranges (GTF): 56-120Hz V, 31-106kHz H, max dotclock 230MHz
Monitor name: PROJECTOR
Checksum: 0x43 (valid)


