
EDID (hex):
00ffffffffffff0006af9be600000000
101f0104a522167802a935a754499f25
0f505400000001010101010101010101
010101010101fa3c80b870b024401010
3e0058d71000001ac83080b870b02440
10103e0058d71000001a000000fe0035
314e3838804231363055414b00000000
000381029e001100000a410a20200062

Extracted contents:
header:          00 ff ff ff ff ff ff 00
serial number:   06 af 9b e6 00 00 00 00 10 1f
version:         01 04
basic params:    a5 22 16 78 02
chroma info:     a9 35 a7 54 49 9f 25 0f 50 54
established:     00 00 00
standard:        01 01 01 01 01 01 01 01 01 01 01 01 01 01 01 01
descriptor 1:    fa 3c 80 b8 70 b0 24 40 10 10 3e 00 58 d7 10 00 00 1a
descriptor 2:    c8 30 80 b8 70 b0 24 40 10 10 3e 00 58 d7 10 00 00 1a
descriptor 3:    00 00 00 fe 00 35 31 4e 38 38 80 42 31 36 30 55 41 4b
descriptor 4:    00 00 00 00 00 03 81 02 9e 00 11 00 00 0a 41 0a 20 20
extensions:      00
checksum:        62

EDID version: 1.4
Manufacturer: AUO Model e69b Serial Number --
Made in week 16 of 2021
Digital display
8 bits per primary color channel
DisplayPort interface
Maximum image size: 34 cm x 22 cm
Gamma: 2.20
Supported color formats: RGB 4:4:4
First detailed timing includes the native pixel format and preferred refresh rate
Display x,y Chromaticity:
  Red:   0.6542, 0.3300
  Green: 0.2871, 0.6220
  Blue:  0.1445, 0.0615
  White: 0.3134, 0.3291
Established timings supported:
Standard timings supported:
Detailed mode: Clock 156.100 MHz, 344 mm x 215 mm
               1920 1936 1952 2104 hborder 0
               1200 1203 1217 1236 vborder 0
               +hsync -vsync 
               VertFreq: 60 Hz, HorFreq: 74192 Hz
Detailed mode: Clock 124.880 MHz, 344 mm x 215 mm
               1920 1936 1952 2104 hborder 0
               1200 1203 1217 1236 vborder 0
               +hsync -vsync 
               VertFreq: 48 Hz, HorFreq: 59353 Hz
ASCII string: 51N88
Manufacturer-specified data, tag 0
Checksum: 0x62 (valid)
EDID block does NOT conform to EDID 1.4!
	Missing name descriptor
	Missing monitor ranges
	Detailed block string not properly terminated
