edid-decode (hex):

00 ff ff ff ff ff ff 00 06 af 9b e6 00 00 00 00
10 1f 01 04 a5 22 16 78 02 a9 35 a7 54 49 9f 25
0f 50 54 00 00 00 01 01 01 01 01 01 01 01 01 01
01 01 01 01 01 01 fa 3c 80 b8 70 b0 24 40 10 10
3e 00 58 d7 10 00 00 1a c8 30 80 b8 70 b0 24 40
10 10 3e 00 58 d7 10 00 00 1a 00 00 00 fe 00 58
52 58 54 47 80 42 31 36 30 55 41 4b 00 00 00 00
00 03 81 02 9e 00 11 00 00 0a 41 0a 20 20 00 e9

----------------

Block 0, Base EDID:
  EDID Structure Version & Revision: 1.4
  Vendor & Product Identification:
    Manufacturer: AUO
    Model: 59035
    Made in: week 16 of 2021
  Basic Display Parameters & Features:
    Digital display
    Bits per primary color channel: 8
    DisplayPort interface
    Maximum image size: 34 cm x 22 cm
    Gamma: 2.20
    Supported color formats: RGB 4:4:4
    First detailed timing includes the native pixel format and preferred refresh rate
  Color Characteristics:
    Red  : 0.6542, 0.3300
    Green: 0.2871, 0.6220
    Blue : 0.1445, 0.0615
    White: 0.3134, 0.3291
  Established Timings I & II: none
  Standard Timings: none
  Detailed Timing Descriptors:
    DTD 1:  1920x1200   60.025902 Hz   8:5     74.192 kHz    156.100000 MHz (344 mm x 215 mm)
                 Hfront   16 Hsync  16 Hback  152 Hpol P
                 Vfront    3 Vsync  14 Vback   19 Vpol N
    DTD 2:  1920x1200   48.020722 Hz   8:5     59.354 kHz    124.880000 MHz (344 mm x 215 mm)
                 Hfront   16 Hsync  16 Hback  152 Hpol P
                 Vfront    3 Vsync  14 Vback   19 Vpol N
    Alphanumeric Data String: 'XRXTG'
    Manufacturer-Specified Display Descriptor (0x00): 00 00 00 03 81 02 9e 00 11 00 00 0a 41 0a 20 20 '............A.  '
Checksum: 0xe9

----------------

Failures:

Block 0, Base EDID:
  Alphanumeric Data String: Non-printable character.
  Missing Display Product Name.

EDID conformity: FAIL
