
EDID (hex):
00ffffffffffff0006af3c3900000000
00190104951f117802bbf59455549027
23505400000001010101010101010101
010101010101ec1d56e850001e302616
360035ad100000180000000f00000000
00000000000000000020000000fe0041
554f0a202020202020202020000000fe
004231343058544e30332e39200a00a4

Extracted contents:
header:          00 ff ff ff ff ff ff 00
serial number:   06 af 3c 39 00 00 00 00 00 19
version:         01 04
basic params:    95 1f 11 78 02
chroma info:     bb f5 94 55 54 90 27 23 50 54
established:     00 00 00
standard:        01 01 01 01 01 01 01 01 01 01 01 01 01 01 01 01
descriptor 1:    ec 1d 56 e8 50 00 1e 30 26 16 36 00 35 ad 10 00 00 18
descriptor 2:    00 00 00 0f 00 00 00 00 00 00 00 00 00 00 00 00 00 20
descriptor 3:    00 00 00 fe 00 41 55 4f 0a 20 20 20 20 20 20 20 20 20
descriptor 4:    00 00 00 fe 00 42 31 34 30 58 54 4e 30 33 2e 39 20 0a
extensions:      00
checksum:        a4

EDID version: 1.4
Manufacturer: AUO Model 393c Serial Number --
Made in year 2015
Digital display
6 bits per primary color channel
DisplayPort interface
Maximum image size: 31 cm x 17 cm
Gamma: 2.20
Supported color formats: RGB 4:4:4
First detailed timing includes the native pixel format and preferred refresh rate
Display x,y Chromaticity:
  Red:   0.5800, 0.3349
  Green: 0.3300, 0.5654
  Blue:  0.1552, 0.1396
  White: 0.3134, 0.3291
Established timings supported:
Standard timings supported:
Detailed mode: Clock 76.600 MHz, 309 mm x 173 mm
               1366 1404 1426 1598 hborder 0
                768  771  777  798 vborder 0
               -hsync -vsync 
               VertFreq: 60 Hz, HorFreq: 47934 Hz
Manufacturer-specified data, tag 15
ASCII string: AUO
ASCII string: B140XTN03.9 
Checksum: 0xa4 (valid)
EDID block does NOT conform to EDID 1.4!
	Missing name descriptor
	Missing monitor ranges
