edid-decode (hex):

00 ff ff ff ff ff ff 00 22 83 0b 67 01 01 01 01
09 19 01 03 68 00 00 78 0a 8b dd a6 57 59 9e 23
0f 4c 5c af cf 00 81 00 81 80 90 40 95 00 a9 c0
a9 40 b3 00 d1 c0 9a 20 00 90 51 20 1c 30 40 88
13 00 00 00 00 00 00 1c 66 21 56 aa 51 00 1e 30
46 8f 33 00 00 00 00 00 00 1e 00 00 00 fd 00 38
78 1f 5c 11 00 0a 20 20 20 20 20 20 00 00 00 fc
00 50 52 4f 4a 45 43 54 4f 52 0a 20 20 20 00 3f

----------------

Block 0, Base EDID:
  EDID Structure Version & Revision: 1.3
  Vendor & Product Identification:
    Manufacturer: HTC
    Model: 26379
    Serial Number: ...
    Made in: week 9 of 2015
  Basic Display Parameters & Features:
    Analog display
    Input voltage level: 0.7/0.7 V
    Blank level equals black level
    Sync: Separate
    Image size is variable
    Gamma: 2.20
    RGB color display
    First detailed timing is the preferred timing
  Color Characteristics:
    Red  : 0.6503, 0.3398
    Green: 0.3496, 0.6201
    Blue : 0.1396, 0.0595
    White: 0.2998, 0.3603
  Established Timings I & II:
    IBM     :   720x400    70.081663 Hz   9:5     31.467 kHz     28.320000 MHz
    DMT 0x04:   640x480    59.940476 Hz   4:3     31.469 kHz     25.175000 MHz
    DMT 0x05:   640x480    72.808802 Hz   4:3     37.861 kHz     31.500000 MHz
    DMT 0x06:   640x480    75.000000 Hz   4:3     37.500 kHz     31.500000 MHz
    DMT 0x08:   800x600    56.250000 Hz   4:3     35.156 kHz     36.000000 MHz
    DMT 0x09:   800x600    60.316541 Hz   4:3     37.879 kHz     40.000000 MHz
    DMT 0x0a:   800x600    72.187572 Hz   4:3     48.077 kHz     50.000000 MHz
    DMT 0x0b:   800x600    75.000000 Hz   4:3     46.875 kHz     49.500000 MHz
    DMT 0x10:  1024x768    60.003840 Hz   4:3     48.363 kHz     65.000000 MHz
    DMT 0x11:  1024x768    70.069359 Hz   4:3     56.476 kHz     75.000000 MHz
    DMT 0x12:  1024x768    75.028582 Hz   4:3     60.023 kHz     78.750000 MHz
    DMT 0x24:  1280x1024   75.024675 Hz   5:4     79.976 kHz    135.000000 MHz
  Standard Timings:
    DMT 0x1c:  1280x800    59.810326 Hz  16:10    49.702 kHz     83.500000 MHz
    DMT 0x23:  1280x1024   60.019740 Hz   5:4     63.981 kHz    108.000000 MHz
    DMT 0x2a:  1400x1050   59.978442 Hz   4:3     65.317 kHz    121.750000 MHz
    DMT 0x2f:  1440x900    59.887445 Hz  16:10    55.935 kHz    106.500000 MHz
    DMT 0x53:  1600x900    60.000000 Hz  16:9     60.000 kHz    108.000000 MHz (RB)
    DMT 0x33:  1600x1200   60.000000 Hz   4:3     75.000 kHz    162.000000 MHz
    DMT 0x3a:  1680x1050   59.954250 Hz  16:10    65.290 kHz    146.250000 MHz
    DMT 0x52:  1920x1080   60.000000 Hz  16:9     67.500 kHz    148.500000 MHz
  Detailed Timing Descriptors:
    DTD 1:  1280x800    59.998275 Hz   8:5     49.679 kHz     83.460000 MHz
                 Hfront   64 Hsync 136 Hback  200 Hpol N
                 Vfront    1 Vsync   3 Vback   24 Vpol P
    DTD 2:  1366x768    59.789541 Hz 683:384   47.712 kHz     85.500000 MHz
                 Hfront   70 Hsync 143 Hback  213 Hpol P
                 Vfront    3 Vsync   3 Vback   24 Vpol P
    Display Range Limits:
      Monitor ranges (GTF): 56-120 Hz V, 31-92 kHz H, max dotclock 170 MHz
    Display Product Name: 'PROJECTOR'
Checksum: 0x3f

----------------

EDID conformity: PASS
