edid-decode (hex):

00 ff ff ff ff ff ff 00 22 f0 05 32 01 01 01 01
16 19 01 03 80 50 21 78 2a a8 35 a5 55 4d a0 28
0d 50 54 21 08 00 d1 c0 a9 c0 81 c0 d1 00 b3 00
95 00 a9 40 81 80 a9 4c 70 00 d4 a0 1c 50 a0 60
3a 10 1d 4d 31 00 00 1a 00 00 00 fd 00 18 3c 1b
5a 19 00 0a 20 20 20 20 20 20 00 00 00 fc 00 48
50 20 45 4e 56 59 20 33 34 63 0a 20 00 00 00 ff
00 43 4e 34 35 32 32 30 48 4a 32 0a 20 20 01 5c

02 03 29 f1 50 10 1f 20 04 13 03 02 12 11 01 05
14 07 06 16 15 23 09 07 07 83 01 00 00 68 03 0c
00 10 00 00 32 00 e2 00 2b 56 5e 00 a0 a0 a0 29
50 30 20 35 00 1d 4d 31 00 00 1a 58 4d 00 b8 a1
38 14 40 f8 2c 45 00 1d 4d 31 00 00 1e 82 48 00
e4 a2 38 2d 40 24 2c 45 80 1d 4d 31 00 00 1e 40
3c 80 a0 70 b0 23 40 30 20 36 00 1d 4d 31 00 00
1a 00 00 00 00 00 00 00 00 00 00 00 00 00 00 1d

----------------

Block 0, Base EDID:
  EDID Structure Version & Revision: 1.3
  Vendor & Product Identification:
    Manufacturer: HWP
    Model: 12805
    Serial Number: ...
    Made in: week 22 of 2015
  Basic Display Parameters & Features:
    Digital display
    Maximum image size: 80 cm x 33 cm
    Gamma: 2.20
    DPMS levels: Off
    RGB color display
    First detailed timing is preferred timing
  Color Characteristics:
    Red  : 0.6464, 0.3339
    Green: 0.3027, 0.6250
    Blue : 0.1562, 0.0537
    White: 0.3134, 0.3291
  Established Timings I & II:
    DMT 0x04:   640x480    59.940 Hz   4:3    31.469 kHz  25.175 MHz
    DMT 0x09:   800x600    60.317 Hz   4:3    37.879 kHz  40.000 MHz
    DMT 0x10:  1024x768    60.004 Hz   4:3    48.363 kHz  65.000 MHz
  Standard Timings:
    DMT 0x52:  1920x1080   60.000 Hz  16:9    67.500 kHz 148.500 MHz
    DMT 0x53:  1600x900    60.000 Hz  16:9    60.000 kHz 108.000 MHz (RB)
    DMT 0x55:  1280x720    60.000 Hz  16:9    45.000 kHz  74.250 MHz
    DMT 0x45:  1920x1200   59.885 Hz  16:10   74.556 kHz 193.250 MHz
    DMT 0x3a:  1680x1050   59.954 Hz  16:10   65.290 kHz 146.250 MHz
    DMT 0x2f:  1440x900    59.887 Hz  16:10   55.935 kHz 106.500 MHz
    DMT 0x33:  1600x1200   60.000 Hz   4:3    75.000 kHz 162.000 MHz
    DMT 0x23:  1280x1024   60.020 Hz   5:4    63.981 kHz 108.000 MHz
  Detailed Timing Descriptors:
    DTD 1:  3440x1440   29.947 Hz  43:18   43.963 kHz 196.250 MHz (797 mm x 333 mm)
                 Hfront  160 Hsync 352 Hback 512 Hpol P
                 Vfront    3 Vsync  10 Vback  15 Vpol N
  Display Range Limits:
    Monitor ranges (GTF): 24-60 Hz V, 27-90 kHz H, max dotclock 250 MHz
    Display Product Name: 'HP ENVY 34c'
    Display Product Serial Number: ...
  Extension blocks: 1
Checksum: 0x5c

----------------

Block 1, CTA-861 Extension Block:
  Revision: 3
  Underscans PC formats by default
  Basic audio support
  Supports YCbCr 4:4:4
  Supports YCbCr 4:2:2
  Native detailed modes: 1
  Video Data Block:
    VIC  16:  1920x1080   60.000 Hz  16:9    67.500 kHz 148.500 MHz
    VIC  31:  1920x1080   50.000 Hz  16:9    56.250 kHz 148.500 MHz
    VIC  32:  1920x1080   24.000 Hz  16:9    27.000 kHz  74.250 MHz
    VIC   4:  1280x720    60.000 Hz  16:9    45.000 kHz  74.250 MHz
    VIC  19:  1280x720    50.000 Hz  16:9    37.500 kHz  74.250 MHz
    VIC   3:   720x480    59.940 Hz  16:9    31.469 kHz  27.000 MHz
    VIC   2:   720x480    59.940 Hz   4:3    31.469 kHz  27.000 MHz
    VIC  18:   720x576    50.000 Hz  16:9    31.250 kHz  27.000 MHz
    VIC  17:   720x576    50.000 Hz   4:3    31.250 kHz  27.000 MHz
    VIC   1:   640x480    59.940 Hz   4:3    31.469 kHz  25.175 MHz
    VIC   5:  1920x1080i  60.000 Hz  16:9    33.750 kHz  74.250 MHz
    VIC  20:  1920x1080i  50.000 Hz  16:9    28.125 kHz  74.250 MHz
    VIC   7:  1440x480i   59.940 Hz  16:9    15.734 kHz  27.000 MHz
    VIC   6:  1440x480i   59.940 Hz   4:3    15.734 kHz  27.000 MHz
    VIC  22:  1440x576i   50.000 Hz  16:9    15.625 kHz  27.000 MHz
    VIC  21:  1440x576i   50.000 Hz   4:3    15.625 kHz  27.000 MHz
  Audio Data Block:
    Linear PCM:
      Max channels: 2
      Supported sample rates (kHz): 48 44.1 32
      Supported sample sizes (bits): 24 20 16
  Speaker Allocation Data Block:
    FL/FR - Front Left/Right
  Vendor-Specific Data Block (HDMI), OUI 00-0C-03:
    Source physical address: 1.0.0.0
    Maximum TMDS clock: 250 MHz
  Video Capability Data Block:
    YCbCr quantization: No Data
    RGB quantization: No Data
    PT scan behavior: Always Underscanned
    IT scan behavior: IT video formats not supported
    CE scan behavior: Supports both over- and underscan
  Detailed Timing Descriptors:
    DTD 2:  2560x1440   59.951 Hz  16:9    88.787 kHz 241.500 MHz (797 mm x 333 mm)
                 Hfront   48 Hsync  32 Hback  80 Hpol P
                 Vfront    3 Vsync   5 Vback  33 Vpol N
    DTD 3:  2560x1080   60.000 Hz  64:27   66.000 kHz 198.000 MHz (797 mm x 333 mm)
                 Hfront  248 Hsync  44 Hback 148 Hpol P
                 Vfront    4 Vsync   5 Vback  11 Vpol P
    DTD 4:  2560x1080   49.999 Hz  64:27   56.248 kHz 185.620 MHz (797 mm x 333 mm)
                 Hfront  548 Hsync  44 Hback 148 Hpol P
                 Vfront    4 Vsync   5 Vback  36 Vpol P
    DTD 5:  1920x1200   60.044 Hz   8:5    74.154 kHz 154.240 MHz (797 mm x 333 mm)
                 Hfront   48 Hsync  32 Hback  80 Hpol P
                 Vfront    3 Vsync   6 Vback  26 Vpol N
Checksum: 0x1d

----------------

Warnings:

Block 1, CTA-861 Extension Block:
  Video Capability Data Block: Set Selectable RGB Quantization to avoid interop issues.
  Display Product Serial Number is set, so the Serial Number in the Base EDID should be 0.

Failures:

All Blocks:
  Some timings are out of range of the Monitor Ranges:
    Horizontal Freq: 15.625 - 88.786 kHz (Monitor: 27.000 - 90.000 kHz)

EDID conformity: FAIL
