edid-decode (hex):

00 ff ff ff ff ff ff 00 22 f0 a9 26 01 01 01 01
15 11 01 03 80 2f 1e 78 ee b5 35 a5 56 4a 9a 25
10 50 54 a5 6b 90 71 00 81 40 95 00 a9 00 b3 00
01 01 01 01 01 01 21 39 90 30 62 1a 27 40 68 b0
36 00 d9 28 11 00 00 1c 00 00 00 fd 00 30 4c 18
52 10 00 0a 20 20 20 20 20 20 00 00 00 fc 00 48
50 20 77 32 32 30 37 0a 20 20 20 20 00 00 00 ff
00 43 4e 44 37 32 31 31 42 4e 59 0a 20 20 00 d1

00 ff ff ff ff ff ff 00 22 f0 a9 26 01 01 01 01
15 11 01 03 80 2f 1e 78 ee b5 35 a5 56 4a 9a 25
10 50 54 a5 6b 90 71 00 81 40 95 00 a9 00 b3 00
01 01 01 01 01 01 21 39 90 30 62 1a 27 40 68 b0
36 00 d9 28 11 00 00 1c 00 00 00 fd 00 30 4c 18
52 10 00 0a 20 20 20 20 20 20 00 00 00 fc 00 48
50 20 77 32 32 30 37 0a 20 20 20 20 00 00 00 ff
00 43 4e 44 37 32 31 31 42 4e 59 0a 20 20 00 d1

----------------

Block 0, Base EDID:
  EDID Structure Version & Revision: 1.3
  Vendor & Product Identification:
    Manufacturer: HWP
    Model: 9897
    Serial Number: ...
    Made in: week 21 of 2007
  Basic Display Parameters & Features:
    Digital display
    Maximum image size: 47 cm x 30 cm
    Gamma: 2.20
    DPMS levels: Standby Suspend Off
    RGB color display
    Default (sRGB) color space is primary color space
    First detailed timing is the preferred timing
  Color Characteristics:
    Red  : 0.6464, 0.3388
    Green: 0.2900, 0.6025
    Blue : 0.1445, 0.0654
    White: 0.3134, 0.3291
  Established Timings I & II:
    IBM     :   720x400    70.081663 Hz   9:5     31.467 kHz     28.320000 MHz
    DMT 0x04:   640x480    59.940476 Hz   4:3     31.469 kHz     25.175000 MHz
    DMT 0x06:   640x480    75.000000 Hz   4:3     37.500 kHz     31.500000 MHz
    DMT 0x09:   800x600    60.316541 Hz   4:3     37.879 kHz     40.000000 MHz
    DMT 0x0b:   800x600    75.000000 Hz   4:3     46.875 kHz     49.500000 MHz
    Apple   :   832x624    74.551266 Hz   4:3     49.726 kHz     57.284000 MHz
    DMT 0x10:  1024x768    60.003840 Hz   4:3     48.363 kHz     65.000000 MHz
    DMT 0x12:  1024x768    75.028582 Hz   4:3     60.023 kHz     78.750000 MHz
    DMT 0x24:  1280x1024   75.024675 Hz   5:4     79.976 kHz    135.000000 MHz
    Apple   :  1152x870    75.061550 Hz 192:145   68.681 kHz    100.000000 MHz
  Standard Timings:
    GTF     :  1152x720    59.999964 Hz  16:10    44.760 kHz     67.319000 MHz
    DMT 0x20:  1280x960    60.000000 Hz   4:3     60.000 kHz    108.000000 MHz
    DMT 0x2f:  1440x900    59.887445 Hz  16:10    55.935 kHz    106.500000 MHz
    GTF     :  1600x1000   59.999820 Hz  16:10    62.100 kHz    133.142000 MHz
    DMT 0x3a:  1680x1050   59.954250 Hz  16:10    65.290 kHz    146.250000 MHz
  Detailed Timing Descriptors:
    DTD 1:  1680x1050   59.954250 Hz  16:10    65.290 kHz    146.250000 MHz (473 mm x 296 mm)
                 Hfront  104 Hsync 176 Hback  280 Hpol N
                 Vfront    3 Vsync   6 Vback   30 Vpol P
    Display Range Limits:
      Monitor ranges (GTF): 48-76 Hz V, 24-82 kHz H, max dotclock 160 MHz
    Display Product Name: 'HP w2207'
    Display Product Serial Number: ...
Checksum: 0xd1

----------------

Block 1, Unknown EDID Extension Block 0x00:
  00 ff ff ff ff ff ff 00 22 f0 a9 26 01 01 01 01 '........"..&....'
  15 11 01 03 80 2f 1e 78 ee b5 35 a5 56 4a 9a 25 '...../.x..5.VJ.%'
  10 50 54 a5 6b 90 71 00 81 40 95 00 a9 00 b3 00 '.PT.k.q..@......'
  01 01 01 01 01 01 21 39 90 30 62 1a 27 40 68 b0 '......!9.0b.'@h.'
  36 00 d9 28 11 00 00 1c 00 00 00 fd 00 30 4c 18 '6..(.........0L.'
  52 10 00 0a 20 20 20 20 20 20 00 00 00 fc 00 48 'R...      .....H'
  50 20 77 32 32 30 37 0a 20 20 20 20 00 00 00 ff 'P w2207.    ....'
  00 43 4e 44 37 32 31 31 42 4e 59 0a 20 20 00 d1 '.CND7211BNY.  ..'
Checksum: 0xd1

----------------

Failures:

Block 0, Base EDID:
  Basic Display Parameters & Features: sRGB is signaled, but the chromaticities do not match.
Block 1, Base EDID:
  Unknown Extension Block.
EDID:
  Base EDID: EDID specified 0 extension block(s), but found 1 extension block(s).

EDID conformity: FAIL
