
EDID (hex):
00ffffffffffff0006b3e048ffffffff
32200103803c22783a8ce5ad5244af25
0c5054254a00714f81c081408180d1c0
d1fc9500b30008e80030f2705a80b058
8a00ad113200001e000000fd00307812
1289000a202020202020000000fc0050
47343855510a202020202020000000ff
004e434c4d41533030303139360a02b3
020353f2e278024a6176031304291f10
3f5d23090707830100006b030c001000
383c200020036dd85dc4017888630200
00c3350c6d1a00000201307800007300
7300e305e301e20f03e6060d01808000
e200d54d6c80a070703e8030203a00ad
113200001e565e00a0a0a02950302035
00ad113200001e000000000000000024
70126700000301644b9a0008ff0e9f00
2f801f003f062d00020009004dd40006
6f0d9f002f801f009f05450002000900
3dc20004ff099f002f801f009f055400
028004001fd60008ff0e9f002f801f00
37043d0002800400ba7e00066f0d9f00
2f801f009f053d00028004003e000000
00000000000000000000000000000090

edid-decode (hex):

00 ff ff ff ff ff ff 00 06 b3 e0 48 ff ff ff ff
32 20 01 03 80 3c 22 78 3a 8c e5 ad 52 44 af 25
0c 50 54 25 4a 00 71 4f 81 c0 81 40 81 80 d1 c0
d1 fc 95 00 b3 00 08 e8 00 30 f2 70 5a 80 b0 58
8a 00 ad 11 32 00 00 1e 00 00 00 fd 00 30 78 12
12 89 00 0a 20 20 20 20 20 20 00 00 00 fc 00 50
47 34 38 55 51 0a 20 20 20 20 20 20 00 00 00 ff
00 4e 43 4c 4d 41 53 30 30 30 31 39 36 0a 02 b3

02 03 53 f2 e2 78 02 4a 61 76 03 13 04 29 1f 10
3f 5d 23 09 07 07 83 01 00 00 6b 03 0c 00 10 00
38 3c 20 00 20 03 6d d8 5d c4 01 78 88 63 02 00
00 c3 35 0c 6d 1a 00 00 02 01 30 78 00 00 73 00
73 00 e3 05 e3 01 e2 0f 03 e6 06 0d 01 80 80 00
e2 00 d5 4d 6c 80 a0 70 70 3e 80 30 20 3a 00 ad
11 32 00 00 1e 56 5e 00 a0 a0 a0 29 50 30 20 35
00 ad 11 32 00 00 1e 00 00 00 00 00 00 00 00 24

70 12 67 00 00 03 01 64 4b 9a 00 08 ff 0e 9f 00
2f 80 1f 00 3f 06 2d 00 02 00 09 00 4d d4 00 06
6f 0d 9f 00 2f 80 1f 00 9f 05 45 00 02 00 09 00
3d c2 00 04 ff 09 9f 00 2f 80 1f 00 9f 05 54 00
02 80 04 00 1f d6 00 08 ff 0e 9f 00 2f 80 1f 00
37 04 3d 00 02 80 04 00 ba 7e 00 06 6f 0d 9f 00
2f 80 1f 00 9f 05 3d 00 02 80 04 00 3e 00 00 00
00 00 00 00 00 00 00 00 00 00 00 00 00 00 00 90

----------------

Block 0, Base EDID:
  EDID Structure Version & Revision: 1.3
  Vendor & Product Identification:
    Manufacturer: AUS
    Model: 18656
    Serial Number: 4294967295
    Made in: week 50 of 2022
  Basic Display Parameters & Features:
    Digital display
    Maximum image size: 60 cm x 34 cm
    Gamma: 2.20
    DPMS levels: Off
    Undefined display color type
    First detailed timing is the preferred timing
  Color Characteristics:
    Red  : 0.6777, 0.3203
    Green: 0.2685, 0.6835
    Blue : 0.1474, 0.0488
    White: 0.3134, 0.3291
  Established Timings I & II:
    DMT 0x04:   640x480    59.940476 Hz   4:3     31.469 kHz     25.175000 MHz
    DMT 0x06:   640x480    75.000000 Hz   4:3     37.500 kHz     31.500000 MHz
    DMT 0x09:   800x600    60.316541 Hz   4:3     37.879 kHz     40.000000 MHz
    DMT 0x0b:   800x600    75.000000 Hz   4:3     46.875 kHz     49.500000 MHz
    DMT 0x10:  1024x768    60.003840 Hz   4:3     48.363 kHz     65.000000 MHz
    DMT 0x12:  1024x768    75.028582 Hz   4:3     60.023 kHz     78.750000 MHz
  Standard Timings:
    DMT 0x15:  1152x864    75.000000 Hz   4:3     67.500 kHz    108.000000 MHz
    DMT 0x55:  1280x720    60.000000 Hz  16:9     45.000 kHz     74.250000 MHz
    DMT 0x20:  1280x960    60.000000 Hz   4:3     60.000 kHz    108.000000 MHz
    DMT 0x23:  1280x1024   60.019740 Hz   5:4     63.981 kHz    108.000000 MHz
    DMT 0x52:  1920x1080   60.000000 Hz  16:9     67.500 kHz    148.500000 MHz
    GTF     :  1920x1080  119.999987 Hz  16:9    138.840 kHz    368.759000 MHz
    DMT 0x2f:  1440x900    59.887445 Hz  16:10    55.935 kHz    106.500000 MHz
    DMT 0x3a:  1680x1050   59.954250 Hz  16:10    65.290 kHz    146.250000 MHz
  Detailed Timing Descriptors:
    DTD 1:  3840x2160   60.000000 Hz  16:9    135.000 kHz    594.000000 MHz (941 mm x 529 mm)
                 Hfront  176 Hsync  88 Hback  296 Hpol P
                 Vfront    8 Vsync  10 Vback   72 Vpol P
    Display Range Limits:
      Monitor ranges (GTF): 48-120 Hz V, 18-18 kHz H, max dotclock 1370 MHz
    Display Product Name: 'PG48UQ'
    Display Product Serial Number: 'NCLMAS000196'
  Extension blocks: 2
Checksum: 0xb3

----------------

Block 1, CTA-861 Extension Block:
  Revision: 3
  Underscans IT Video Formats by default
  Basic audio support
  Supports YCbCr 4:4:4
  Supports YCbCr 4:2:2
  Native detailed modes: 2
  HDMI Forum EDID Extension Override Data Block:
    EDID Extension Block Count: 2
  Video Data Block:
    VIC  97:  3840x2160   60.000000 Hz  16:9    135.000 kHz    594.000000 MHz
    VIC 118:  3840x2160  120.000000 Hz  16:9    270.000 kHz   1188.000000 MHz
    VIC   3:   720x480    59.940060 Hz  16:9     31.469 kHz     27.000000 MHz
    VIC  19:  1280x720    50.000000 Hz  16:9     37.500 kHz     74.250000 MHz
    VIC   4:  1280x720    60.000000 Hz  16:9     45.000 kHz     74.250000 MHz
    VIC  41:  1280x720   100.000000 Hz  16:9     75.000 kHz    148.500000 MHz
    VIC  31:  1920x1080   50.000000 Hz  16:9     56.250 kHz    148.500000 MHz
    VIC  16:  1920x1080   60.000000 Hz  16:9     67.500 kHz    148.500000 MHz
    VIC  63:  1920x1080  120.000000 Hz  16:9    135.000 kHz    297.000000 MHz
    VIC  93:  3840x2160   24.000000 Hz  16:9     54.000 kHz    297.000000 MHz
  Audio Data Block:
    Linear PCM:
      Max channels: 2
      Supported sample rates (kHz): 48 44.1 32
      Supported sample sizes (bits): 24 20 16
  Speaker Allocation Data Block:
    FL/FR - Front Left/Right
  Vendor-Specific Data Block (HDMI), OUI 00-0C-03:
    Source physical address: 1.0.0.0
    DC_36bit
    DC_30bit
    DC_Y444
    Maximum TMDS clock: 300 MHz
    Extended HDMI video details:
      HDMI VICs:
        HDMI VIC 3:  3840x2160   24.000000 Hz  16:9     54.000 kHz    297.000000 MHz
  Vendor-Specific Data Block (HDMI Forum), OUI C4-5D-D8:
    Version: 1
    Maximum TMDS Character Rate: 600 MHz
    SCDC Present
    Supports scrambling for <= 340 Mcsc
    Max Fixed Rate Link: 3 and 6 Gbps per lane on 3 lanes, 6, 8, 10 and 12 Gbps on 4 lanes
    Supports 12-bits/component Deep Color 4:2:0 Pixel Encoding
    Supports 10-bits/component Deep Color 4:2:0 Pixel Encoding
    Supports Auto Low-Latency Mode
    Supports VESA DSC 1.2a compression
    Supports Compressed Video Transport for 4:2:0 Pixel Encoding
    Supports 12 bpc Compressed Video Transport
    Supports 10 bpc Compressed Video Transport
    DSC Max Slices: up to 8 slices and up to (400 MHz/Ksliceadjust) pixel clock per slice
    DSC Max Fixed Rate Link: 3 and 6 Gbps per lane on 3 lanes, 6 Gbps on 4 lanes
    Maximum number of bytes in a line of chunks: 13312
  Vendor-Specific Data Block (AMD), OUI 00-00-1A:
    Version: 2.1
    Minimum Refresh Rate: 48 Hz
    Maximum Refresh Rate: 120 Hz
    Flags 1.x: 0x00
    Flags 2.x: 0x00
    Maximum luminance: 115 (603.666 cd/m^2)
    Minimum luminance: 0 (0.000 cd/m^2)
    Unknown: 0x73 0x00
  Colorimetry Data Block:
    xvYCC601
    xvYCC709
    BT2020cYCC
    BT2020YCC
    BT2020RGB
    Gamut Boundary Description Metadata Profile P0
  YCbCr 4:2:0 Capability Map Data Block:
    VIC  97:  3840x2160   60.000000 Hz  16:9    135.000 kHz    594.000000 MHz
    VIC 118:  3840x2160  120.000000 Hz  16:9    270.000 kHz   1188.000000 MHz
  HDR Static Metadata Data Block:
    Electro optical transfer functions:
      Traditional gamma - SDR luminance range
      SMPTE ST2084
      Hybrid Log-Gamma
    Supported static metadata descriptors:
      Static metadata type 1
    Desired content max luminance: 128 (800.000 cd/m^2)
    Desired content max frame-average luminance: 128 (800.000 cd/m^2)
    Desired content min luminance: 0 (0.000 cd/m^2)
  Video Capability Data Block:
    YCbCr quantization: Selectable (via AVI YQ)
    RGB quantization: Selectable (via AVI Q)
    PT scan behavior: Always Overscanned
    IT scan behavior: Always Overscanned
    CE scan behavior: Always Overscanned
  Detailed Timing Descriptors:
    DTD 2:  1920x2160   59.987970 Hz   8:9    133.293 kHz    277.250000 MHz (941 mm x 529 mm)
                 Hfront   48 Hsync  32 Hback   80 Hpol P
                 Vfront    3 Vsync  10 Vback   49 Vpol P
    DTD 3:  2560x1440   59.950550 Hz  16:9     88.787 kHz    241.500000 MHz (941 mm x 529 mm)
                 Hfront   48 Hsync  32 Hback   80 Hpol P
                 Vfront    3 Vsync   5 Vback   33 Vpol P
Checksum: 0x24  Unused space in Extension Block: 8 bytes

----------------

Block 2, DisplayID Extension Block:
  Version: 1.2
  Extension Count: 0
  Display Product Type: Extension Section
  Video Timing Modes Type 1 - Detailed Timings Data Block:
    DTD:  3840x1600   59.993925 Hz   0:0     98.750 kHz    395.000000 MHz (aspect undefined, no 3D stereo)
               Hfront   48 Hsync  32 Hback   80 Hpol P
               Vfront    3 Vsync  10 Vback   33 Vpol N
    DTD:  3440x1440   99.981604 Hz  64:27   150.972 kHz    543.500000 MHz (aspect 64:27, no 3D stereo)
               Hfront   48 Hsync  32 Hback   80 Hpol P
               Vfront    3 Vsync  10 Vback   57 Vpol N
    DTD:  2560x1440  119.879460 Hz  16:9    182.816 kHz    497.260000 MHz (aspect 16:9, no 3D stereo)
               Hfront   48 Hsync  32 Hback   80 Hpol P
               Vfront    3 Vsync   5 Vback   77 Vpol P
    DTD:  3840x1080  120.000000 Hz   0:0    137.040 kHz    548.160000 MHz (aspect undefined, no 3D stereo)
               Hfront   48 Hsync  32 Hback   80 Hpol P
               Vfront    3 Vsync   5 Vback   54 Vpol P
    DTD:  3440x1440   59.999630 Hz  64:27    90.119 kHz    324.430000 MHz (aspect 64:27, no 3D stereo)
               Hfront   48 Hsync  32 Hback   80 Hpol P
               Vfront    3 Vsync   5 Vback   54 Vpol P
  Checksum: 0x3e
Checksum: 0x90  Unused space in Extension Block: 18 bytes
