edid-decode (hex):

00 ff ff ff ff ff ff 00 30 e4 18 02 00 00 00 00
00 13 01 03 80 1d 10 78 0a ee 25 95 59 55 8b 29
22 50 54 00 00 00 01 01 01 01 01 01 01 01 01 01
01 01 01 01 01 01 12 1b 56 68 50 00 12 30 20 20
35 00 25 a5 10 00 00 19 00 00 00 00 00 00 00 00
00 00 00 00 00 00 00 00 00 00 00 00 00 fe 00 00
00 00 4c 47 44 69 73 70 6c 61 79 0a 00 00 00 fe
00 4c 50 31 33 33 57 48 32 2d 54 4c 42 32 00 19

----------------

Block 0, Base EDID:
  EDID Structure Version & Revision: 1.3
  Vendor & Product Identification:
    Manufacturer: LGD
    Model: 536
    Made in: 2009
  Basic Display Parameters & Features:
    Digital display
    Maximum image size: 29 cm x 16 cm
    Gamma: 2.20
    RGB color display
    First detailed timing is the preferred timing
  Color Characteristics:
    Red  : 0.5849, 0.3496
    Green: 0.3349, 0.5449
    Blue : 0.1601, 0.1347
    White: 0.3134, 0.3291
  Established Timings I & II: none
  Standard Timings: none
  Detailed Timing Descriptors:
    DTD 1:  1366x768    59.978190 Hz 683:384   47.143 kHz     69.300000 MHz (293 mm x 165 mm)
                 Hfront   32 Hsync  32 Hback   40 Hpol N
                 Vfront    3 Vsync   5 Vback   10 Vpol N
    Empty Descriptor
    Alphanumeric Data String: ''
    Alphanumeric Data String: 'LP133WH2-TLB2'
Checksum: 0x19

----------------

Failures:

Block 0, Base EDID:
  Empty Descriptor: Use Dummy Descriptor instead of all zeroes.
  Alphanumeric Data String: Non-printable character.
  Missing Display Product Name.
  Missing Display Range Limits Descriptor.

EDID conformity: FAIL
