edid-decode (hex):

00 ff ff ff ff ff ff 00 04 72 bb 06 9a 24 00 00
2c 10 01 03 68 22 1b 78 2a ce 45 a6 52 4c 99 27
1c 50 54 bf ef 80 71 4f 81 c0 81 40 81 80 01 01
01 01 01 01 01 01 30 2a 00 98 51 00 2a 40 30 70
13 00 05 04 00 00 00 04 00 00 00 fd 00 37 4b 1e
51 0e 00 0a 20 20 20 20 20 20 00 00 00 fc 00 41
4c 31 37 32 33 0a 20 20 20 20 20 20 00 00 00 fe
00 41 43 45 52 2d 56 31 2e 30 30 0a 20 20 00 c2

----------------

Block 0, Base EDID:
  EDID Structure Version & Revision: 1.3
  Vendor & Product Identification:
    Manufacturer: ACR
    Model: 1723
    Serial Number: ...
    Made in: week 44 of 2006
  Basic Display Parameters & Features:
    Analog display
    Input voltage level: 0.7/0.7 V
    Sync: Separate
    Maximum image size: 34 cm x 27 cm
    Gamma: 2.20
    DPMS levels: Off
    RGB color display
    First detailed timing is the preferred timing
  Color Characteristics:
    Red  : 0.6513, 0.3203
    Green: 0.2998, 0.5996
    Blue : 0.1533, 0.1093
    White: 0.3134, 0.3291
  Established Timings I & II:
    IBM     :   720x400    70.082 Hz   9:5    31.467 kHz  28.320 MHz
    DMT 0x04:   640x480    59.940 Hz   4:3    31.469 kHz  25.175 MHz
    Apple   :   640x480    66.667 Hz   4:3    35.000 kHz  30.240 MHz
    DMT 0x05:   640x480    72.809 Hz   4:3    37.861 kHz  31.500 MHz
    DMT 0x06:   640x480    75.000 Hz   4:3    37.500 kHz  31.500 MHz
    DMT 0x08:   800x600    56.250 Hz   4:3    35.156 kHz  36.000 MHz
    DMT 0x09:   800x600    60.317 Hz   4:3    37.879 kHz  40.000 MHz
    DMT 0x0a:   800x600    72.188 Hz   4:3    48.077 kHz  50.000 MHz
    DMT 0x0b:   800x600    75.000 Hz   4:3    46.875 kHz  49.500 MHz
    Apple   :   832x624    74.551 Hz   4:3    49.726 kHz  57.284 MHz
    DMT 0x10:  1024x768    60.004 Hz   4:3    48.363 kHz  65.000 MHz
    DMT 0x11:  1024x768    70.069 Hz   4:3    56.476 kHz  75.000 MHz
    DMT 0x12:  1024x768    75.029 Hz   4:3    60.023 kHz  78.750 MHz
    DMT 0x24:  1280x1024   75.025 Hz   5:4    79.976 kHz 135.000 MHz
    Apple   :  1152x870    75.062 Hz 192:145  68.681 kHz 100.000 MHz
  Standard Timings:
    DMT 0x15:  1152x864    75.000 Hz   4:3    67.500 kHz 108.000 MHz
    DMT 0x55:  1280x720    60.000 Hz  16:9    45.000 kHz  74.250 MHz
    DMT 0x20:  1280x960    60.000 Hz   4:3    60.000 kHz 108.000 MHz
    DMT 0x23:  1280x1024   60.020 Hz   5:4    63.981 kHz 108.000 MHz
  Detailed Timing Descriptors:
    DTD 1:  1280x1024   60.020 Hz   5:4    63.981 kHz 108.000 MHz (analog composite, serrate, sync-on-green, 5 mm x 4 mm)
                 Hfront   48 Hsync 112 Hback 248 Hpol N
                 Vfront    1 Vsync   3 Vback  38 Vpol N
  Display Range Limits:
    Monitor ranges (GTF): 55-75 Hz V, 30-81 kHz H, max dotclock 140 MHz
    Display Product Name: 'AL1723'
    Alphanumeric Data String: 'ACER-V1.00'
Checksum: 0xc2

----------------

Failures:

Block 0, Base EDID:
  Detailed Timing Descriptor #1: Mismatch of image size 5x4 mm vs display size 340x270 mm.

EDID conformity: FAIL
