edid-decode (hex):

00 ff ff ff ff ff ff 00 5a 63 35 08 01 01 01 01
24 1c 01 04 a5 3c 22 78 37 2b 85 a7 54 4f 9c 26
11 50 54 bf ef 80 d1 c0 d1 e8 d1 fc 95 00 90 40
81 80 81 40 81 c0 56 5e 00 a0 a0 a0 29 50 30 20
35 00 55 50 21 00 00 1e 40 e7 00 6a a0 a0 67 50
08 20 78 00 55 50 21 00 00 1e 00 00 00 fd 00 30
90 de de 3c 01 0a 20 20 20 20 20 20 00 00 00 fc
00 58 47 32 37 33 30 20 53 45 52 49 45 53 01 9e

02 03 1d f1 50 bf 40 10 05 04 03 07 1f 22 21 20
13 12 16 01 14 23 09 7f 07 83 01 00 00 56 5e 00
a0 a0 a0 29 50 30 20 35 00 55 50 21 00 00 1e 44
9d 00 6a a0 a0 46 50 08 20 98 04 55 50 21 00 00
1c 96 be 00 6a a0 a0 55 50 08 20 98 04 55 50 21
00 00 1e ce 72 00 6a a0 a0 33 50 20 15 85 02 55
50 21 00 00 1a a4 83 80 6a 70 38 4d 40 08 20 f8
0c 55 50 21 00 00 1c 00 00 00 00 00 00 00 00 8e

00 ff ff ff ff ff ff 00 5a 63 35 08 01 01 01 01
24 1c 01 04 a5 3c 22 78 37 2b 85 a7 54 4f 9c 26
11 50 54 bf ef 80 d1 c0 d1 e8 d1 fc 95 00 90 40
81 80 81 40 81 c0 56 5e 00 a0 a0 a0 29 50 30 20
35 00 55 50 21 00 00 1e 40 e7 00 6a a0 a0 67 50
08 20 78 00 55 50 21 00 00 1e 00 00 00 fd 00 30
90 de de 3c 01 0a 20 20 20 20 20 20 00 00 00 fc
00 58 47 32 37 33 30 20 53 45 52 49 45 53 01 9e

02 03 1d f1 50 bf 40 10 05 04 03 07 1f 22 21 20
13 12 16 01 14 23 09 7f 07 83 01 00 00 56 5e 00
a0 a0 a0 29 50 30 20 35 00 55 50 21 00 00 1e 44
9d 00 6a a0 a0 46 50 08 20 98 04 55 50 21 00 00
1c 96 be 00 6a a0 a0 55 50 08 20 98 04 55 50 21
00 00 1e ce 72 00 6a a0 a0 33 50 20 15 85 02 55
50 21 00 00 1a a4 83 80 6a 70 38 4d 40 08 20 f8
0c 55 50 21 00 00 1c 00 00 00 00 00 00 00 00 8e

----------------

Block 0, Base EDID:
  EDID Structure Version & Revision: 1.4
  Vendor & Product Identification:
    Manufacturer: VSC
    Model: 2101
    Serial Number: ...
    Made in: week 36 of 2018
  Basic Display Parameters & Features:
    Digital display
    Bits per primary color channel: 8
    DisplayPort interface
    Maximum image size: 60 cm x 34 cm
    Gamma: 2.20
    DPMS levels: Off
    Supported color formats: RGB 4:4:4, YCrCb 4:2:2
    Default (sRGB) color space is primary color space
    First detailed timing includes the native pixel format and preferred refresh rate
    Display is continuous frequency
  Color Characteristics:
    Red  : 0.6523, 0.3300
    Green: 0.3105, 0.6123
    Blue : 0.1503, 0.0664
    White: 0.3134, 0.3291
  Established Timings I & II:
    IBM     :   720x400    70.081663 Hz   9:5     31.467 kHz     28.320000 MHz
    DMT 0x04:   640x480    59.940476 Hz   4:3     31.469 kHz     25.175000 MHz
    Apple   :   640x480    66.666667 Hz   4:3     35.000 kHz     30.240000 MHz
    DMT 0x05:   640x480    72.808802 Hz   4:3     37.861 kHz     31.500000 MHz
    DMT 0x06:   640x480    75.000000 Hz   4:3     37.500 kHz     31.500000 MHz
    DMT 0x08:   800x600    56.250000 Hz   4:3     35.156 kHz     36.000000 MHz
    DMT 0x09:   800x600    60.316541 Hz   4:3     37.879 kHz     40.000000 MHz
    DMT 0x0a:   800x600    72.187572 Hz   4:3     48.077 kHz     50.000000 MHz
    DMT 0x0b:   800x600    75.000000 Hz   4:3     46.875 kHz     49.500000 MHz
    Apple   :   832x624    74.551266 Hz   4:3     49.726 kHz     57.284000 MHz
    DMT 0x10:  1024x768    60.003840 Hz   4:3     48.363 kHz     65.000000 MHz
    DMT 0x11:  1024x768    70.069359 Hz   4:3     56.476 kHz     75.000000 MHz
    DMT 0x12:  1024x768    75.028582 Hz   4:3     60.023 kHz     78.750000 MHz
    DMT 0x24:  1280x1024   75.024675 Hz   5:4     79.976 kHz    135.000000 MHz
    Apple   :  1152x870    75.061550 Hz 192:145   68.681 kHz    100.000000 MHz
  Standard Timings:
    DMT 0x52:  1920x1080   60.000000 Hz  16:9     67.500 kHz    148.500000 MHz
    GTF     :  1920x1080  100.000000 Hz  16:9    114.400 kHz    302.016000 MHz
    GTF     :  1920x1080  119.999987 Hz  16:9    138.840 kHz    368.759000 MHz
    DMT 0x2f:  1440x900    59.887445 Hz  16:10    55.935 kHz    106.500000 MHz
    DMT 0x2a:  1400x1050   59.978442 Hz   4:3     65.317 kHz    121.750000 MHz
    DMT 0x23:  1280x1024   60.019740 Hz   5:4     63.981 kHz    108.000000 MHz
    DMT 0x20:  1280x960    60.000000 Hz   4:3     60.000 kHz    108.000000 MHz
    DMT 0x55:  1280x720    60.000000 Hz  16:9     45.000 kHz     74.250000 MHz
  Detailed Timing Descriptors:
    DTD  1:  2560x1440   59.950550 Hz  16:9     88.787 kHz    241.500000 MHz (597 mm x 336 mm)
                  Hfront   48 Hsync  32 Hback   80 Hpol P
                  Vfront    3 Vsync   5 Vback   33 Vpol P
    DTD  2:  2560x1440  143.911545 Hz  16:9    222.056 kHz    592.000000 MHz (597 mm x 336 mm)
                  Hfront    8 Hsync  32 Hback   66 Hpol P
                  Vfront    7 Vsync   8 Vback   88 Vpol P
    Display Range Limits:
      Monitor ranges (Bare Limits): 48-144 Hz V, 222-222 kHz H, max dotclock 600 MHz
    Display Product Name: 'XG2730 SERIES'
  Extension blocks: 1
Checksum: 0x9e

----------------

Block 1, CTA-861 Extension Block:
  Revision: 3
  Underscans IT Video Formats by default
  Basic audio support
  Supports YCbCr 4:4:4
  Supports YCbCr 4:2:2
  Native detailed modes: 1
  Video Data Block:
    VIC  63:  1920x1080  120.000000 Hz  16:9    135.000 kHz    297.000000 MHz (native)
    VIC  64:  1920x1080  100.000000 Hz  16:9    112.500 kHz    297.000000 MHz
    VIC  16:  1920x1080   60.000000 Hz  16:9     67.500 kHz    148.500000 MHz
    VIC   5:  1920x1080i  60.000000 Hz  16:9     33.750 kHz     74.250000 MHz
    VIC   4:  1280x720    60.000000 Hz  16:9     45.000 kHz     74.250000 MHz
    VIC   3:   720x480    59.940060 Hz  16:9     31.469 kHz     27.000000 MHz
    VIC   7:  1440x480i   59.940060 Hz  16:9     15.734 kHz     27.000000 MHz
    VIC  31:  1920x1080   50.000000 Hz  16:9     56.250 kHz    148.500000 MHz
    VIC  34:  1920x1080   30.000000 Hz  16:9     33.750 kHz     74.250000 MHz
    VIC  33:  1920x1080   25.000000 Hz  16:9     28.125 kHz     74.250000 MHz
    VIC  32:  1920x1080   24.000000 Hz  16:9     27.000 kHz     74.250000 MHz
    VIC  19:  1280x720    50.000000 Hz  16:9     37.500 kHz     74.250000 MHz
    VIC  18:   720x576    50.000000 Hz  16:9     31.250 kHz     27.000000 MHz
    VIC  22:  1440x576i   50.000000 Hz  16:9     15.625 kHz     27.000000 MHz
    VIC   1:   640x480    59.940476 Hz   4:3     31.469 kHz     25.175000 MHz
    VIC  20:  1920x1080i  50.000000 Hz  16:9     28.125 kHz     74.250000 MHz
  Audio Data Block:
    Linear PCM:
      Max channels: 2
      Supported sample rates (kHz): 192 176.4 96 88.2 48 44.1 32
      Supported sample sizes (bits): 24 20 16
  Speaker Allocation Data Block:
    FL/FR - Front Left/Right
  Detailed Timing Descriptors:
    DTD  3:  2560x1440   59.950550 Hz  16:9     88.787 kHz    241.500000 MHz (597 mm x 336 mm)
                  Hfront   48 Hsync  32 Hback   80 Hpol P
                  Vfront    3 Vsync   5 Vback   33 Vpol P
    DTD  4:  2560x1440  100.008446 Hz  16:9    151.013 kHz    402.600000 MHz (597 mm x 336 mm)
                  Hfront    8 Hsync  32 Hback   66 Hpol N
                  Vfront   25 Vsync   8 Vback   37 Vpol P
    DTD  5:  2560x1440  120.005411 Hz  16:9    183.008 kHz    487.900000 MHz (597 mm x 336 mm)
                  Hfront    8 Hsync  32 Hback   66 Hpol P
                  Vfront   25 Vsync   8 Vback   52 Vpol P
    DTD  6:  2560x1440   73.936995 Hz  16:9    110.240 kHz    293.900000 MHz (597 mm x 336 mm)
                  Hfront   32 Hsync  21 Hback   53 Hpol P
                  Vfront    8 Vsync  37 Vback    6 Vpol N
    DTD  7:  1920x1080  143.766302 Hz  16:9    166.338 kHz    337.000000 MHz (597 mm x 336 mm)
                  Hfront    8 Hsync  32 Hback   66 Hpol N
                  Vfront   63 Vsync   8 Vback    6 Vpol P
Checksum: 0x8e  Unused space in Extension Block: 8 bytes

----------------

Block 2, Unknown EDID Extension Block 0x00:
  00 ff ff ff ff ff ff 00 5a 63 35 08 01 01 01 01 '........Zc5.....'
  24 1c 01 04 a5 3c 22 78 37 2b 85 a7 54 4f 9c 26 '$....<"x7+..TO.&'
  11 50 54 bf ef 80 d1 c0 d1 e8 d1 fc 95 00 90 40 '.PT............@'
  81 80 81 40 81 c0 56 5e 00 a0 a0 a0 29 50 30 20 '...@..V^....)P0 '
  35 00 55 50 21 00 00 1e 40 e7 00 6a a0 a0 67 50 '5.UP!...@..j..gP'
  08 20 78 00 55 50 21 00 00 1e 00 00 00 fd 00 30 '. x.UP!........0'
  90 de de 3c 01 0a 20 20 20 20 20 20 00 00 00 fc '...<..      ....'
  00 58 47 32 37 33 30 20 53 45 52 49 45 53 01 9e '.XG2730 SERIES..'
Checksum: 0x9e

----------------

Block 3, CTA-861 Extension Block:
  Revision: 3
  Underscans IT Video Formats by default
  Basic audio support
  Supports YCbCr 4:4:4
  Supports YCbCr 4:2:2
  Native detailed modes: 1
  Video Data Block:
    VIC  63:  1920x1080  120.000000 Hz  16:9    135.000 kHz    297.000000 MHz (native)
    VIC  64:  1920x1080  100.000000 Hz  16:9    112.500 kHz    297.000000 MHz
    VIC  16:  1920x1080   60.000000 Hz  16:9     67.500 kHz    148.500000 MHz
    VIC   5:  1920x1080i  60.000000 Hz  16:9     33.750 kHz     74.250000 MHz
    VIC   4:  1280x720    60.000000 Hz  16:9     45.000 kHz     74.250000 MHz
    VIC   3:   720x480    59.940060 Hz  16:9     31.469 kHz     27.000000 MHz
    VIC   7:  1440x480i   59.940060 Hz  16:9     15.734 kHz     27.000000 MHz
    VIC  31:  1920x1080   50.000000 Hz  16:9     56.250 kHz    148.500000 MHz
    VIC  34:  1920x1080   30.000000 Hz  16:9     33.750 kHz     74.250000 MHz
    VIC  33:  1920x1080   25.000000 Hz  16:9     28.125 kHz     74.250000 MHz
    VIC  32:  1920x1080   24.000000 Hz  16:9     27.000 kHz     74.250000 MHz
    VIC  19:  1280x720    50.000000 Hz  16:9     37.500 kHz     74.250000 MHz
    VIC  18:   720x576    50.000000 Hz  16:9     31.250 kHz     27.000000 MHz
    VIC  22:  1440x576i   50.000000 Hz  16:9     15.625 kHz     27.000000 MHz
    VIC   1:   640x480    59.940476 Hz   4:3     31.469 kHz     25.175000 MHz
    VIC  20:  1920x1080i  50.000000 Hz  16:9     28.125 kHz     74.250000 MHz
  Audio Data Block:
    Linear PCM:
      Max channels: 2
      Supported sample rates (kHz): 192 176.4 96 88.2 48 44.1 32
      Supported sample sizes (bits): 24 20 16
  Speaker Allocation Data Block:
    FL/FR - Front Left/Right
  Detailed Timing Descriptors:
    DTD  8:  2560x1440   59.950550 Hz  16:9     88.787 kHz    241.500000 MHz (597 mm x 336 mm)
                  Hfront   48 Hsync  32 Hback   80 Hpol P
                  Vfront    3 Vsync   5 Vback   33 Vpol P
    DTD  9:  2560x1440  100.008446 Hz  16:9    151.013 kHz    402.600000 MHz (597 mm x 336 mm)
                  Hfront    8 Hsync  32 Hback   66 Hpol N
                  Vfront   25 Vsync   8 Vback   37 Vpol P
    DTD 10:  2560x1440  120.005411 Hz  16:9    183.008 kHz    487.900000 MHz (597 mm x 336 mm)
                  Hfront    8 Hsync  32 Hback   66 Hpol P
                  Vfront   25 Vsync   8 Vback   52 Vpol P
    DTD 11:  2560x1440   73.936995 Hz  16:9    110.240 kHz    293.900000 MHz (597 mm x 336 mm)
                  Hfront   32 Hsync  21 Hback   53 Hpol P
                  Vfront    8 Vsync  37 Vback    6 Vpol N
    DTD 12:  1920x1080  143.766302 Hz  16:9    166.338 kHz    337.000000 MHz (597 mm x 336 mm)
                  Hfront    8 Hsync  32 Hback   66 Hpol N
                  Vfront   63 Vsync   8 Vback    6 Vpol P
Checksum: 0x8e  Unused space in Extension Block: 8 bytes

----------------

Warnings:

EDID:
  Base EDID: Some timings are out of range of the Monitor Ranges:
    Vertical Freq: 24.000 - 143.912 Hz (Monitor: 48.000 - 144.000 Hz)
    Horizontal Freq: 15.625 - 222.055 kHz (Monitor: 222.000 - 222.000 kHz)

Failures:

Block 0, Base EDID:
  Basic Display Parameters & Features: sRGB is signaled, but the chromaticities do not match.
Block 1, CTA-861 Extension Block:
  Missing VCDB, needed for Set Selectable RGB Quantization to avoid interop issues.
Block 2, Base EDID:
  Unknown Extension Block.
Block 3, CTA-861 Extension Block:
  Video Data Block: Duplicate VIC 63.
  Video Data Block: Duplicate VIC 64.
  Video Data Block: Duplicate VIC 16.
  Video Data Block: Duplicate VIC 5.
  Video Data Block: Duplicate VIC 4.
  Video Data Block: Duplicate VIC 3.
  Video Data Block: Duplicate VIC 7.
  Video Data Block: Duplicate VIC 31.
  Video Data Block: Duplicate VIC 34.
  Video Data Block: Duplicate VIC 33.
  Video Data Block: Duplicate VIC 32.
  Video Data Block: Duplicate VIC 19.
  Video Data Block: Duplicate VIC 18.
  Video Data Block: Duplicate VIC 22.
  Video Data Block: Duplicate VIC 1.
  Video Data Block: Duplicate VIC 20.
  Speaker Allocation Data Block: Only one instance of this Data Block is allowed.
  Missing VCDB, needed for Set Selectable RGB Quantization to avoid interop issues.
EDID:
  Base EDID: EDID specified 1 extension block(s), but found 3 extension block(s).
  CTA-861: Native progressive timings are a mix of several resolutions.

EDID conformity: FAIL
