
EDID (hex):
00ffffffffffff000469b12039420000
02110103802b1b782a8c30a655469d25
145054bfef80714f81808140814f81cf
95009040b30021399030621a274018b0
3640b10e1100001c000000fd00374b2f
510f000a202020202020000000ff0037
314c383031363935330a2020000000fc
004d573230310a2020202020202000e6

Extracted contents:
header:          00 ff ff ff ff ff ff 00
serial number:   04 69 b1 20 39 42 00 00 02 11
version:         01 03
basic params:    80 2b 1b 78 2a
chroma info:     8c 30 a6 55 46 9d 25 14 50 54
established:     bf ef 80
standard:        71 4f 81 80 81 40 81 4f 81 cf 95 00 90 40 b3 00
descriptor 1:    21 39 90 30 62 1a 27 40 18 b0 36 40 b1 0e 11 00 00 1c
descriptor 2:    00 00 00 fd 00 37 4b 2f 51 0f 00 0a 20 20 20 20 20 20
descriptor 3:    00 00 00 ff 00 37 31 4c 38 30 31 36 39 35 33 0a 20 20
descriptor 4:    00 00 00 fc 00 4d 57 32 30 31 0a 20 20 20 20 20 20 20
extensions:      00
checksum:        e6

EDID version: 1.3
Manufacturer: ACI Model 20b1 Serial Number --
Made in week 2 of 2007
Digital display
Maximum image size: 43 cm x 27 cm
Gamma: 2.20
DPMS levels: Off
RGB color display
First detailed timing is preferred timing
Display x,y Chromaticity:
  Red:   0.6503, 0.3320
  Green: 0.2763, 0.6132
  Blue:  0.1445, 0.0810
  White: 0.3125, 0.3281
Established timings supported:
  720x400@70Hz 9:5 HorFreq: 31469 Hz Clock: 28.320 MHz
  640x480@60Hz 4:3 HorFreq: 31469 Hz Clock: 25.175 MHz
  640x480@67Hz 4:3 HorFreq: 35000 Hz Clock: 30.240 MHz
  640x480@72Hz 4:3 HorFreq: 37900 Hz Clock: 31.500 MHz
  640x480@75Hz 4:3 HorFreq: 37500 Hz Clock: 31.500 MHz
  800x600@56Hz 4:3 HorFreq: 35200 Hz Clock: 36.000 MHz
  800x600@60Hz 4:3 HorFreq: 37900 Hz Clock: 40.000 MHz
  800x600@72Hz 4:3 HorFreq: 48100 Hz Clock: 50.000 MHz
  800x600@75Hz 4:3 HorFreq: 46900 Hz Clock: 49.500 MHz
  832x624@75Hz 4:3 HorFreq: 49726 Hz Clock: 57.284 MHz
  1024x768@60Hz 4:3 HorFreq: 48400 Hz Clock: 65.000 MHz
  1024x768@70Hz 4:3 HorFreq: 56500 Hz Clock: 75.000 MHz
  1024x768@75Hz 4:3 HorFreq: 60000 Hz Clock: 78.750 MHz
  1280x1024@75Hz 5:4 HorFreq: 80000 Hz Clock: 135.000 MHz
  1152x870@75Hz 192:145 HorFreq: 67500 Hz Clock: 108.000 MHz
Standard timings supported:
  1152x864@75Hz 4:3 HorFreq: 67500 Hz Clock: 108.000 MHz
  1280x1024@60Hz 5:4 HorFreq: 64000 Hz Clock: 108.000 MHz
  1280x960@60Hz 4:3 HorFreq: 60000 Hz Clock: 108.000 MHz
  1280x960@75Hz 4:3
  1280x720@75Hz 16:9
  1440x900@60Hz 16:10 HorFreq: 55500 Hz Clock: 88.750 MHz
  1400x1050@60Hz 4:3 HorFreq: 64700 Hz Clock: 101.000 MHz
  1680x1050@60Hz 16:10 HorFreq: 64700 Hz Clock: 119.000 MHz
Detailed mode: Clock 146.250 MHz, 433 mm x 270 mm
               1680 1960 2136 2240 hborder 0
               1050 1053 1059 1089 vborder 0
               -hsync +vsync 
               VertFreq: 59 Hz, HorFreq: 65290 Hz
Monitor ranges (GTF): 55-75Hz V, 47-81kHz H, max dotclock 150MHz
Serial number: --
Monitor name: MW201
Checksum: 0xe6 (valid)
One or more of the timings is out of range of the Monitor Ranges:
  Vertical Freq: 56 - 75 Hz
  Horizontal Freq: 31469 - 80000 Hz
  Maximum Clock: 146.250 MHz
