edid-decode (hex):

00 ff ff ff ff ff ff 00 2e 83 03 20 28 00 00 00
21 14 01 03 80 2c 19 78 ea f0 65 98 57 51 91 27
21 50 54 a1 08 00 a9 c0 81 80 81 40 81 c0 01 01
01 01 01 01 01 01 31 2e 40 00 62 84 22 30 58 a8
35 00 bb f9 10 00 00 1c 00 00 00 fd 00 38 3f 1f
41 0c 00 0a 20 20 20 20 20 20 00 00 00 fc 00 57
32 30 30 39 53 2d 44 0a 20 20 20 20 00 00 00 fe
00 0a 20 20 20 20 20 20 20 20 20 20 20 20 00 f1

----------------

Block 0, Base EDID:
  EDID Structure Version & Revision: 1.3
  Vendor & Product Identification:
    Manufacturer: KTC
    Model: 8195
    Serial Number: ...
    Made in: week 33 of 2010
  Basic Display Parameters & Features:
    Digital display
    Maximum image size: 44 cm x 25 cm
    Gamma: 2.20
    DPMS levels: Standby Suspend Off
    RGB color display
    First detailed timing is the preferred timing
  Color Characteristics:
    Red  : 0.5966, 0.3427
    Green: 0.3164, 0.5664
    Blue : 0.1533, 0.1308
    White: 0.3134, 0.3291
  Established Timings I & II:
    IBM     :   720x400    70.082 Hz   9:5    31.467 kHz  28.320 MHz
    DMT 0x04:   640x480    59.940 Hz   4:3    31.469 kHz  25.175 MHz
    DMT 0x09:   800x600    60.317 Hz   4:3    37.879 kHz  40.000 MHz
    DMT 0x10:  1024x768    60.004 Hz   4:3    48.363 kHz  65.000 MHz
  Standard Timings:
    DMT 0x53:  1600x900    60.000 Hz  16:9    60.000 kHz 108.000 MHz (RB)
    DMT 0x23:  1280x1024   60.020 Hz   5:4    63.981 kHz 108.000 MHz
    DMT 0x20:  1280x960    60.000 Hz   4:3    60.000 kHz 108.000 MHz
    DMT 0x55:  1280x720    60.000 Hz  16:9    45.000 kHz  74.250 MHz
  Detailed Timing Descriptors:
    DTD 1:  1600x900    59.946 Hz  16:9    55.990 kHz 118.250 MHz (443 mm x 249 mm)
                 Hfront   88 Hsync 168 Hback 256 Hpol N
                 Vfront    3 Vsync   5 Vback  26 Vpol P
  Display Range Limits:
    Monitor ranges (GTF): 56-63 Hz V, 31-65 kHz H, max dotclock 120 MHz
    Display Product Name: 'W2009S-D'
    Alphanumeric Data String: ''
Checksum: 0xf1

----------------

Failures:

Block 0, Base EDID:
  Alphanumeric Data String: Empty string.
EDID:
  Base EDID: Some timings are out of range of the Monitor Ranges:
    Vertical Freq: 59.940 - 70.082 Hz (Monitor: 56.000 - 63.000 Hz)

EDID conformity: FAIL
