
EDID (hex):
00ffffffffffff0022f0053001010101
14180103682917782eb8b5a058559f27
0c5054a1080081c08180010101010101
010101010101662156aa51001e30468f
33009ae61000001e000000fd00324c18
530e000a202020202020000000fc0048
50204c56313931310a202020000000ff
0036434d343230325032330a20200064

Extracted contents:
header:          00 ff ff ff ff ff ff 00
serial number:   22 f0 05 30 01 01 01 01 14 18
version:         01 03
basic params:    68 29 17 78 2e
chroma info:     b8 b5 a0 58 55 9f 27 0c 50 54
established:     a1 08 00
standard:        81 c0 81 80 01 01 01 01 01 01 01 01 01 01 01 01
descriptor 1:    66 21 56 aa 51 00 1e 30 46 8f 33 00 9a e6 10 00 00 1e
descriptor 2:    00 00 00 fd 00 32 4c 18 53 0e 00 0a 20 20 20 20 20 20
descriptor 3:    00 00 00 fc 00 48 50 20 4c 56 31 39 31 31 0a 20 20 20
descriptor 4:    00 00 00 ff 00 36 43 4d 34 32 30 32 50 32 33 0a 20 20
extensions:      00
checksum:        64

EDID version: 1.3
Manufacturer: HWP Model 3005 Serial Number --
Made in week 20 of 2014
Analog display, Input voltage level: 0.7/0.7 V
Sync: Separate 
Maximum image size: 41 cm x 23 cm
Gamma: 2.20
DPMS levels: Off
RGB color display
Default (sRGB) color space is primary color space
First detailed timing is preferred timing
Display x,y Chromaticity:
  Red:   0.6269, 0.3466
  Green: 0.3339, 0.6210
  Blue:  0.1542, 0.0498
  White: 0.3134, 0.3291
Established timings supported:
  720x400@70Hz 9:5 HorFreq: 31469 Hz Clock: 28.320 MHz
  640x480@60Hz 4:3 HorFreq: 31469 Hz Clock: 25.175 MHz
  800x600@60Hz 4:3 HorFreq: 37900 Hz Clock: 40.000 MHz
  1024x768@60Hz 4:3 HorFreq: 48400 Hz Clock: 65.000 MHz
Standard timings supported:
  1280x720@60Hz 16:9
  1280x1024@60Hz 5:4 HorFreq: 64000 Hz Clock: 108.000 MHz
Detailed mode: Clock 85.500 MHz, 410 mm x 230 mm
               1366 1436 1579 1792 hborder 0
                768  771  774  798 vborder 0
               +hsync +vsync 
               VertFreq: 59 Hz, HorFreq: 47712 Hz
Monitor ranges (GTF): 50-76Hz V, 24-83kHz H, max dotclock 140MHz
Monitor name: HP LV1911
Serial number: --
Checksum: 0x64 (valid)
EDID block does NOT conform to EDID 1.3!
	sRGB is signaled, but the chromaticities do not match
