
EDID (hex):
00ffffffffffff0009e57a0900000000
1b1e0104951e117802baf0a756509f27
0e505400000001010101010101010101
010101010101c0398018713828403020
360035ae1000001a0000000000000000
0000000000000000001a000000fe0042
4f452043510a202020202020000000fe
0051563135364648422d4e38310a00fa

Extracted contents:
header:          00 ff ff ff ff ff ff 00
serial number:   09 e5 7a 09 00 00 00 00 1b 1e
version:         01 04
basic params:    95 1e 11 78 02
chroma info:     ba f0 a7 56 50 9f 27 0e 50 54
established:     00 00 00
standard:        01 01 01 01 01 01 01 01 01 01 01 01 01 01 01 01
descriptor 1:    c0 39 80 18 71 38 28 40 30 20 36 00 35 ae 10 00 00 1a
descriptor 2:    00 00 00 00 00 00 00 00 00 00 00 00 00 00 00 00 00 1a
descriptor 3:    00 00 00 fe 00 42 4f 45 20 43 51 0a 20 20 20 20 20 20
descriptor 4:    00 00 00 fe 00 51 56 31 35 36 46 48 42 2d 4e 38 31 0a
extensions:      00
checksum:        fa

EDID version: 1.4
Manufacturer: BOE Model 97a Serial Number --
Made in week 27 of 2020
Digital display
6 bits per primary color channel
DisplayPort interface
Maximum image size: 30 cm x 17 cm
Gamma: 2.20
Supported color formats: RGB 4:4:4
First detailed timing includes the native pixel format and preferred refresh rate
Display x,y Chromaticity:
  Red:   0.6542, 0.3388
  Green: 0.3144, 0.6230
  Blue:  0.1552, 0.0576
  White: 0.3125, 0.3281
Established timings supported:
Standard timings supported:
Detailed mode: Clock 147.840 MHz, 309 mm x 174 mm
               1920 1968 2000 2200 hborder 0
               1080 1083 1089 1120 vborder 0
               +hsync -vsync 
               VertFreq: 60 Hz, HorFreq: 67200 Hz
Manufacturer-specified data, tag 0
ASCII string: BOE CQ
ASCII string: QV156FHB-N81
Checksum: 0xfa (valid)
EDID block does NOT conform to EDID 1.4!
	Missing name descriptor
	Missing monitor ranges
