edid-decode (hex):

00 ff ff ff ff ff ff 00 30 ae de 65 54 36 38 35
1e 1e 01 03 6c 30 1b 78 2e 79 a5 a8 55 51 a2 27
10 50 54 ad cf 00 d1 c0 81 80 81 8a 95 00 b3 00
71 4f 01 01 01 01 02 3a 80 18 71 38 2d 40 58 2c
45 00 dc 0c 11 00 00 1e 00 00 00 ff 00 55 37 36
30 35 38 36 54 0a 20 20 20 20 00 00 00 fd 00 31
4c 36 5a 15 00 0a 20 20 20 20 20 20 00 00 00 fc
00 4c 45 4e 20 4c 32 32 65 2d 32 30 0a 20 00 55

00 ff ff ff ff ff ff 00 30 ae de 65 54 36 38 35
1e 1e 01 03 6c 30 1b 78 2e 79 a5 a8 55 51 a2 27
10 50 54 ad cf 00 d1 c0 81 80 81 8a 95 00 b3 00
71 4f 01 01 01 01 02 3a 80 18 71 38 2d 40 58 2c
45 00 dc 0c 11 00 00 1e 00 00 00 ff 00 55 37 36
30 35 38 36 54 0a 20 20 20 20 00 00 00 fd 00 31
4c 36 5a 15 00 0a 20 20 20 20 20 20 00 00 00 fc
00 4c 45 4e 20 4c 32 32 65 2d 32 30 0a 20 00 55

----------------

Block 0, Base EDID:
  EDID Structure Version & Revision: 1.3
  Vendor & Product Identification:
    Manufacturer: LEN
    Model: 26078
    Serial Number: ...
    Made in: week 30 of 2020
  Basic Display Parameters & Features:
    Analog display
    Signal Level Standard: 0.700 : 0.000 : 0.700 V p-p
    Blank level equals black level
    Sync: Separate Composite
    Maximum image size: 48 cm x 27 cm
    Gamma: 2.20
    DPMS levels: Off
    RGB color display
    Default (sRGB) color space is primary color space
    First detailed timing is the preferred timing
  Color Characteristics:
    Red  : 0.6572, 0.3349
    Green: 0.3183, 0.6337
    Blue : 0.1542, 0.0644
    White: 0.3134, 0.3291
  Established Timings I & II:
    IBM     :   720x400    70.081663 Hz   9:5     31.467 kHz     28.320000 MHz
    DMT 0x04:   640x480    59.940476 Hz   4:3     31.469 kHz     25.175000 MHz
    DMT 0x05:   640x480    72.808802 Hz   4:3     37.861 kHz     31.500000 MHz
    DMT 0x06:   640x480    75.000000 Hz   4:3     37.500 kHz     31.500000 MHz
    DMT 0x09:   800x600    60.316541 Hz   4:3     37.879 kHz     40.000000 MHz
    DMT 0x0a:   800x600    72.187572 Hz   4:3     48.077 kHz     50.000000 MHz
    DMT 0x0b:   800x600    75.000000 Hz   4:3     46.875 kHz     49.500000 MHz
    DMT 0x10:  1024x768    60.003840 Hz   4:3     48.363 kHz     65.000000 MHz
    DMT 0x11:  1024x768    70.069359 Hz   4:3     56.476 kHz     75.000000 MHz
    DMT 0x12:  1024x768    75.028582 Hz   4:3     60.023 kHz     78.750000 MHz
    DMT 0x24:  1280x1024   75.024675 Hz   5:4     79.976 kHz    135.000000 MHz
  Standard Timings:
    DMT 0x52:  1920x1080   60.000000 Hz  16:9     67.500 kHz    148.500000 MHz
    DMT 0x23:  1280x1024   60.019740 Hz   5:4     63.981 kHz    108.000000 MHz
    GTF     :  1280x1024   69.999805 Hz   5:4     74.620 kHz    128.943000 MHz
    DMT 0x2f:  1440x900    59.887445 Hz  16:10    55.935 kHz    106.500000 MHz
    DMT 0x3a:  1680x1050   59.954250 Hz  16:10    65.290 kHz    146.250000 MHz
    DMT 0x15:  1152x864    75.000000 Hz   4:3     67.500 kHz    108.000000 MHz
  Detailed Timing Descriptors:
    DTD 1:  1920x1080   60.000000 Hz  16:9     67.500 kHz    148.500000 MHz (476 mm x 268 mm)
                 Hfront   88 Hsync  44 Hback  148 Hpol P
                 Vfront    4 Vsync   5 Vback   36 Vpol P
    Display Product Serial Number: ...
    Display Range Limits:
      Monitor ranges (GTF): 49-76 Hz V, 54-90 kHz H, max dotclock 210 MHz
    Display Product Name: 'LEN L22e-20'
Checksum: 0x55

----------------

Block 1, Unknown EDID Extension Block 0x00:
  00 ff ff ff ff ff ff 00 30 ae de 65 54 36 38 35 '........0..eT685'
  1e 1e 01 03 6c 30 1b 78 2e 79 a5 a8 55 51 a2 27 '....l0.x.y..UQ.''
  10 50 54 ad cf 00 d1 c0 81 80 81 8a 95 00 b3 00 '.PT.............'
  71 4f 01 01 01 01 02 3a 80 18 71 38 2d 40 58 2c 'qO.....:..q8-@X,'
  45 00 dc 0c 11 00 00 1e 00 00 00 ff 00 55 37 36 'E............U76'
  30 35 38 36 54 0a 20 20 20 20 00 00 00 fd 00 31 '0586T.    .....1'
  4c 36 5a 15 00 0a 20 20 20 20 20 20 00 00 00 fc 'L6Z...      ....'
  00 4c 45 4e 20 4c 32 32 65 2d 32 30 0a 20 00 55 '.LEN L22e-20. .U'
Checksum: 0x55

----------------

Failures:

Block 0, Base EDID:
  Basic Display Parameters & Features: sRGB is signaled, but the chromaticities do not match.
Block 1, Base EDID:
  Unknown Extension Block.
EDID:
  Base EDID: Some timings are out of range of the Monitor Ranges:
    Horizontal Freq: 31.466 - 79.976 kHz (Monitor: 54.000 - 90.000 kHz)
  Base EDID: EDID specified 0 extension block(s), but found 1 extension block(s).

EDID conformity: FAIL
