edid-decode (hex):

00 ff ff ff ff ff ff 00 06 af 87 37 00 00 00 00
01 11 01 03 80 25 17 78 0a 05 25 97 57 4f 8f 25
19 50 54 00 00 00 01 01 01 01 01 01 01 01 01 01
01 01 01 01 01 01 b2 25 a0 3c 51 84 10 30 41 21
44 00 6f e6 10 00 00 19 b2 25 a0 3c 51 84 10 30
41 21 44 00 6f e6 10 00 00 00 00 00 00 fe 00 57
52 35 34 32 01 42 31 37 30 50 57 33 00 00 00 fe
00 29 3a 48 51 72 9c c0 f7 02 01 0a 20 20 00 95

----------------

Block 0, Base EDID:
  EDID Structure Version & Revision: 1.3
  Vendor & Product Identification:
    Manufacturer: AUO
    Model: 14215
    Made in: week 1 of 2007
  Basic Display Parameters & Features:
    Digital display
    Maximum image size: 37 cm x 23 cm
    Gamma: 2.20
    RGB color display
    First detailed timing is the preferred timing
  Color Characteristics:
    Red  : 0.5898, 0.3398
    Green: 0.3095, 0.5595
    Blue : 0.1445, 0.0996
    White: 0.3134, 0.3291
  Established Timings I & II: none
  Standard Timings: none
  Detailed Timing Descriptors:
    DTD 1:  1440x900    59.993932 Hz   8:5     54.954 kHz     96.500000 MHz (DE timing only, 367 mm x 230 mm)
                 Hfront   65 Hsync  33 Hback  218 Hpol N
                 Vfront    4 Vsync   4 Vback    8 Vpol N
    DTD 2:  1440x900    59.993932 Hz   8:5     54.954 kHz     96.500000 MHz (DE timing only, 367 mm x 230 mm)
                 Hfront   65 Hsync  33 Hback  218 Hpol N
                 Vfront    4 Vsync   4 Vback    8 Vpol N
    SPWG Module Revision: 0
    SPWG Descriptor #3:
      SPWG PC Maker P/N: 'WR542'
      SPWG LCD Supplier EEDID Revision: 1
      SPWG Manufacturer P/N: 'B170PW3'
    SPWG Descriptor #4:
      SMBUS Values: 0x29 0x3a 0x48 0x51 0x72 0x9c 0xc0 0xf7
      LVDS Channels: 2
      Panel Self Test Present
Checksum: 0x95

----------------

Failures:

Block 0, Base EDID:
  Missing Display Product Name.
  Missing Display Range Limits Descriptor.

EDID conformity: FAIL
