edid-decode (hex):

00 ff ff ff ff ff ff 00 10 ac d0 40 42 39 31 35
1c 1b 01 03 0e 2a 1a 78 ea 59 e5 a7 56 52 9c 26
10 50 54 a5 4b 00 95 00 71 4f 81 80 95 0f 81 00
01 01 01 01 01 01 9a 29 a0 d0 51 84 22 30 50 98
36 00 a3 06 11 00 00 1c 00 00 00 ff 00 35 30 50
37 57 37 37 43 35 31 39 42 0a 00 00 00 fc 00 44
45 4c 4c 20 50 32 30 31 36 0a 20 20 00 00 00 fd
00 38 4c 1e 53 0e 00 0a 20 20 20 20 20 20 00 60

00 ff ff ff ff ff ff 00 10 ac d0 40 42 39 31 35
1c 1b 01 03 0e 2a 1a 78 ea 59 e5 a7 56 52 9c 26
10 50 54 a5 4b 00 95 00 71 4f 81 80 95 0f 81 00
01 01 01 01 01 01 9a 29 a0 d0 51 84 22 30 50 98
36 00 a3 06 11 00 00 1c 00 00 00 ff 00 35 30 50
37 57 37 37 43 35 31 39 42 0a 00 00 00 fc 00 44
45 4c 4c 20 50 32 30 31 36 0a 20 20 00 00 00 fd
00 38 4c 1e 53 0e 00 0a 20 20 20 20 20 20 00 60

----------------

Block 0, Base EDID:
  EDID Structure Version & Revision: 1.3
  Vendor & Product Identification:
    Manufacturer: DEL
    Model: 16592
    Serial Number: ...
    Made in: week 28 of 2017
  Basic Display Parameters & Features:
    Analog display
    Signal Level Standard: 0.700 : 0.300 : 1.000 V p-p
    Blank level equals black level
    Sync: Separate Composite SyncOnGreen
    Maximum image size: 42 cm x 26 cm
    Gamma: 2.20
    DPMS levels: Standby Suspend Off
    RGB color display
    First detailed timing is the preferred timing
  Color Characteristics:
    Red  : 0.6533, 0.3369
    Green: 0.3222, 0.6103
    Blue : 0.1513, 0.0644
    White: 0.3134, 0.3291
  Established Timings I & II:
    IBM     :   720x400    70.081663 Hz   9:5     31.467 kHz     28.320000 MHz
    DMT 0x04:   640x480    59.940476 Hz   4:3     31.469 kHz     25.175000 MHz
    DMT 0x06:   640x480    75.000000 Hz   4:3     37.500 kHz     31.500000 MHz
    DMT 0x09:   800x600    60.316541 Hz   4:3     37.879 kHz     40.000000 MHz
    DMT 0x0b:   800x600    75.000000 Hz   4:3     46.875 kHz     49.500000 MHz
    DMT 0x10:  1024x768    60.003840 Hz   4:3     48.363 kHz     65.000000 MHz
    DMT 0x12:  1024x768    75.028582 Hz   4:3     60.023 kHz     78.750000 MHz
    DMT 0x24:  1280x1024   75.024675 Hz   5:4     79.976 kHz    135.000000 MHz
  Standard Timings:
    DMT 0x2f:  1440x900    59.887445 Hz  16:10    55.935 kHz    106.500000 MHz
    DMT 0x15:  1152x864    75.000000 Hz   4:3     67.500 kHz    108.000000 MHz
    DMT 0x23:  1280x1024   60.019740 Hz   5:4     63.981 kHz    108.000000 MHz
    DMT 0x30:  1440x900    74.984427 Hz  16:10    70.635 kHz    136.750000 MHz
    DMT 0x1c:  1280x800    59.810326 Hz  16:10    49.702 kHz     83.500000 MHz
  Detailed Timing Descriptors:
    DTD 1:  1440x900    59.887445 Hz  16:10    55.935 kHz    106.500000 MHz (419 mm x 262 mm)
                 Hfront   80 Hsync 152 Hback  232 Hpol N
                 Vfront    3 Vsync   6 Vback   25 Vpol P
    Display Product Serial Number: ...
    Display Product Name: 'DELL P2016'
    Display Range Limits:
      Monitor ranges (GTF): 56-76 Hz V, 30-83 kHz H, max dotclock 140 MHz
Checksum: 0x60

----------------

Block 1, Unknown EDID Extension Block 0x00:
  00 ff ff ff ff ff ff 00 10 ac d0 40 42 39 31 35 '...........@B915'
  1c 1b 01 03 0e 2a 1a 78 ea 59 e5 a7 56 52 9c 26 '.....*.x.Y..VR.&'
  10 50 54 a5 4b 00 95 00 71 4f 81 80 95 0f 81 00 '.PT.K...qO......'
  01 01 01 01 01 01 9a 29 a0 d0 51 84 22 30 50 98 '.......)..Q."0P.'
  36 00 a3 06 11 00 00 1c 00 00 00 ff 00 35 30 50 '6............50P'
  37 57 37 37 43 35 31 39 42 0a 00 00 00 fc 00 44 '7W77C519B......D'
  45 4c 4c 20 50 32 30 31 36 0a 20 20 00 00 00 fd 'ELL P2016.  ....'
  00 38 4c 1e 53 0e 00 0a 20 20 20 20 20 20 00 60 '.8L.S...      .`'
Checksum: 0x60

----------------

Failures:

Block 1, Base EDID:
  Unknown Extension Block.
EDID:
  Base EDID: EDID specified 0 extension block(s), but found 1 extension block(s).

EDID conformity: FAIL
