edid-decode (hex):

00 ff ff ff ff ff ff 00 10 ac 04 a0 51 37 30 31
35 0c 01 03 68 1f 17 78 ea 06 30 a2 56 4b 9a 25
18 50 54 af ce 00 01 01 01 01 01 01 01 01 01 01
01 01 01 01 01 01 64 19 00 40 41 00 26 30 18 88
36 00 30 e4 10 00 00 18 d5 09 80 a0 20 33 4b 36
34 38 32 43 54 31 30 37 51 1a 00 00 00 fd 00 38
4b 1f 3c 08 0a 20 20 20 20 20 20 20 00 00 00 fc
00 45 31 35 31 46 50 0a 20 20 20 20 20 20 00 82

----------------

Block 0, Base EDID:
  EDID Structure Version & Revision: 1.3
  Vendor & Product Identification:
    Manufacturer: DEL
    Model: 40964
    Serial Number: ...
    Made in: week 53 of 2002
  Basic Display Parameters & Features:
    Analog display
    Signal Level Standard: 0.700 : 0.000 : 0.700 V p-p
    Blank level equals black level
    Sync: Separate
    Maximum image size: 31 cm x 23 cm
    Gamma: 2.20
    DPMS levels: Standby Suspend Off
    RGB color display
    First detailed timing is the preferred timing
  Color Characteristics:
    Red  : 0.6328, 0.3359
    Green: 0.2939, 0.6035
    Blue : 0.1445, 0.0966
    White: 0.3125, 0.3281
  Established Timings I & II:
    IBM     :   720x400    70.081663 Hz   9:5     31.467 kHz     28.320000 MHz
    DMT 0x04:   640x480    59.940476 Hz   4:3     31.469 kHz     25.175000 MHz
    DMT 0x05:   640x480    72.808802 Hz   4:3     37.861 kHz     31.500000 MHz
    DMT 0x06:   640x480    75.000000 Hz   4:3     37.500 kHz     31.500000 MHz
    DMT 0x08:   800x600    56.250000 Hz   4:3     35.156 kHz     36.000000 MHz
    DMT 0x09:   800x600    60.316541 Hz   4:3     37.879 kHz     40.000000 MHz
    DMT 0x0a:   800x600    72.187572 Hz   4:3     48.077 kHz     50.000000 MHz
    DMT 0x0b:   800x600    75.000000 Hz   4:3     46.875 kHz     49.500000 MHz
    DMT 0x10:  1024x768    60.003840 Hz   4:3     48.363 kHz     65.000000 MHz
    DMT 0x11:  1024x768    70.069359 Hz   4:3     56.476 kHz     75.000000 MHz
    DMT 0x12:  1024x768    75.028582 Hz   4:3     60.023 kHz     78.750000 MHz
  Standard Timings: none
  Detailed Timing Descriptors:
    DTD 1:  1024x768    60.003840 Hz   4:3     48.363 kHz     65.000000 MHz (304 mm x 228 mm)
                 Hfront   24 Hsync 136 Hback  160 Hpol N
                 Vfront    3 Vsync   6 Vback   29 Vpol N
    DTD 2:   640x819    12.947531 Hz 640:819   31.462 kHz     25.170000 MHz (852 mm x 49 mm)
                 Hfront  308 Hsync  56 Hback -314 Hpol P Hborder 55
                 Vfront    3 Vsync  50 Vback 1396 Vpol N Vborder 81
    Display Range Limits:
      Monitor ranges (Unknown (0x0a)): 56-75 Hz V, 31-60 kHz H, max dotclock 80 MHz
    Display Product Name: 'E151FP'
Checksum: 0x82

----------------

Warnings:

Block 0, Base EDID:
  Detailed Timing Descriptor #2: The use of non-zero borders in a DTD is not recommended.

Failures:

Block 0, Base EDID:
  Detailed Timing Descriptor #2: 0 or negative horizontal back porch.
  Detailed Timing Descriptor #2: Mismatch of image size 852x49 mm vs display size 310x230 mm.
  Display Range Limits: Unknown range class (0x0a).
  Display Range Limits: Byte 11 is 0x20 instead of 0x0a.
EDID:
  Base EDID: Some timings are out of range of the Monitor Ranges:
    Vertical Freq: 12.948 - 75.029 Hz (Monitor: 56.000 - 75.000 Hz)
  Base EDID: The DTD max image size is 852x228mm, which is larger than the display size 310.0x230.0mm.

EDID conformity: FAIL
