edid-decode (hex):

00 ff ff ff ff ff ff 00 44 93 15 00 00 00 00 00
00 0e 01 03 80 1d 15 78 0a 47 a9 94 57 4f 8c 27
27 50 54 00 00 00 01 01 01 01 01 01 01 01 01 01
01 01 01 01 01 01 64 19 00 40 41 00 26 30 18 88
36 00 1d d6 10 00 00 18 4a 15 00 40 41 00 26 30
18 88 36 00 1d d6 10 00 00 00 00 00 00 fe 00 4b
34 31 35 36 01 00 00 00 00 00 00 00 00 00 00 fe
00 f8 e6 d9 ce ad 8a 5f 00 01 01 0a 20 20 00 49

----------------

Block 0, Base EDID:
  EDID Structure Version & Revision: 1.3
  Vendor & Product Identification:
    Manufacturer: QDS
    Model: 21
    Made in: 2004
  Basic Display Parameters & Features:
    Digital display
    Maximum image size: 29 cm x 21 cm
    Gamma: 2.20
    RGB color display
    First detailed timing is the preferred timing
  Color Characteristics:
    Red  : 0.5791, 0.3398
    Green: 0.3095, 0.5498
    Blue : 0.1542, 0.1542
    White: 0.3144, 0.3291
  Established Timings I & II: none
  Standard Timings: none
  Detailed Timing Descriptors:
    DTD 1:  1024x768    60.003840 Hz   4:3     48.363 kHz     65.000000 MHz (285 mm x 214 mm)
                 Hfront   24 Hsync 136 Hback  160 Hpol N
                 Vfront    3 Vsync   6 Vback   29 Vpol N
    DTD 2:  1024x768    50.310912 Hz   4:3     40.551 kHz     54.500000 MHz (285 mm x 214 mm)
                 Hfront   24 Hsync 136 Hback  160 Hpol N
                 Vfront    3 Vsync   6 Vback   29 Vpol N
    SPWG Module Revision: 0
    SPWG Descriptor #3:
      SPWG PC Maker P/N: 'K4156'
      SPWG LCD Supplier EEDID Revision: 1
      SPWG Manufacturer P/N: ''
    SPWG Descriptor #4:
      SMBUS Values: 0xf8 0xe6 0xd9 0xce 0xad 0x8a 0x5f 0x00
      LVDS Channels: 1
      Panel Self Test Present
Checksum: 0x49

----------------

Failures:

Block 0, Base EDID:
  SPWG Descriptor #3: Non-printable character.
  Missing Display Product Name.
  Missing Display Range Limits Descriptor.

EDID conformity: FAIL
