edid-decode (hex):

00 ff ff ff ff ff ff 00 04 21 00 00 00 00 00 00
12 18 01 03 08 00 00 00 0a d7 a5 a2 59 4a 96 24
14 50 54 a3 08 00 b3 00 81 00 81 80 81 40 81 c0
01 01 01 01 01 01 21 39 90 30 62 1a 27 40 68 b0
36 00 3f 43 21 00 00 1c 9a 29 a0 d0 51 84 22 30
50 98 36 00 3f 43 21 00 00 1c 00 00 00 fd 00 32
4c 1e 50 10 00 0a 20 20 20 20 20 20 00 00 00 fc
00 48 44 54 56 0a 20 20 20 20 20 20 20 20 00 46

00 ff ff ff ff ff ff 00 04 21 00 00 00 00 00 00
12 18 01 03 08 00 00 00 0a d7 a5 a2 59 4a 96 24
14 50 54 a3 08 00 b3 00 81 00 81 80 81 40 81 c0
01 01 01 01 01 01 21 39 90 30 62 1a 27 40 68 b0
36 00 3f 43 21 00 00 1c 9a 29 a0 d0 51 84 22 30
50 98 36 00 3f 43 21 00 00 1c 00 00 00 fd 00 32
4c 1e 50 10 00 0a 20 20 20 20 20 20 00 00 00 fc
00 48 44 54 56 0a 20 20 20 20 20 20 20 20 00 46

----------------

Block 0, Base EDID:
  EDID Structure Version & Revision: 1.3
  Vendor & Product Identification:
    Manufacturer: AAA
    Model: 0
    Made in: week 18 of 2014
  Basic Display Parameters & Features:
    Analog display
    Signal Level Standard: 0.700 : 0.300 : 1.000 V p-p
    Blank level equals black level
    Sync: Separate
    Image size is variable
    Gamma: 1.00
    RGB color display
    First detailed timing is the preferred timing
  Color Characteristics:
    Red  : 0.6357, 0.3486
    Green: 0.2900, 0.5888
    Blue : 0.1425, 0.0800
    White: 0.3134, 0.3291
  Established Timings I & II:
    IBM     :   720x400    70.081663 Hz   9:5     31.467 kHz     28.320000 MHz
    DMT 0x04:   640x480    59.940476 Hz   4:3     31.469 kHz     25.175000 MHz
    DMT 0x08:   800x600    56.250000 Hz   4:3     35.156 kHz     36.000000 MHz
    DMT 0x09:   800x600    60.316541 Hz   4:3     37.879 kHz     40.000000 MHz
    DMT 0x10:  1024x768    60.003840 Hz   4:3     48.363 kHz     65.000000 MHz
  Standard Timings:
    DMT 0x3a:  1680x1050   59.954250 Hz  16:10    65.290 kHz    146.250000 MHz
    DMT 0x1c:  1280x800    59.810326 Hz  16:10    49.702 kHz     83.500000 MHz
    DMT 0x23:  1280x1024   60.019740 Hz   5:4     63.981 kHz    108.000000 MHz
    DMT 0x20:  1280x960    60.000000 Hz   4:3     60.000 kHz    108.000000 MHz
    DMT 0x55:  1280x720    60.000000 Hz  16:9     45.000 kHz     74.250000 MHz
  Detailed Timing Descriptors:
    DTD 1:  1680x1050   59.954250 Hz  16:10    65.290 kHz    146.250000 MHz (575 mm x 323 mm)
                 Hfront  104 Hsync 176 Hback  280 Hpol N
                 Vfront    3 Vsync   6 Vback   30 Vpol P
    DTD 2:  1440x900    59.887445 Hz  16:10    55.935 kHz    106.500000 MHz (575 mm x 323 mm)
                 Hfront   80 Hsync 152 Hback  232 Hpol N
                 Vfront    3 Vsync   6 Vback   25 Vpol P
    Display Range Limits:
      Monitor ranges (GTF): 50-76 Hz V, 30-80 kHz H, max dotclock 160 MHz
    Display Product Name: 'HDTV'
Checksum: 0x46

----------------

Block 1, Unknown EDID Extension Block 0x00:
  00 ff ff ff ff ff ff 00 04 21 00 00 00 00 00 00 '.........!......'
  12 18 01 03 08 00 00 00 0a d7 a5 a2 59 4a 96 24 '............YJ.$'
  14 50 54 a3 08 00 b3 00 81 00 81 80 81 40 81 c0 '.PT..........@..'
  01 01 01 01 01 01 21 39 90 30 62 1a 27 40 68 b0 '......!9.0b.'@h.'
  36 00 3f 43 21 00 00 1c 9a 29 a0 d0 51 84 22 30 '6.?C!....)..Q."0'
  50 98 36 00 3f 43 21 00 00 1c 00 00 00 fd 00 32 'P.6.?C!........2'
  4c 1e 50 10 00 0a 20 20 20 20 20 20 00 00 00 fc 'L.P...      ....'
  00 48 44 54 56 0a 20 20 20 20 20 20 20 20 00 46 '.HDTV.        .F'
Checksum: 0x46

----------------

Failures:

Block 1, Base EDID:
  Unknown Extension Block.
EDID:
  Base EDID: The DTD max image size is 575x323mm, but the display size is not specified anywhere.
  Base EDID: EDID specified 0 extension block(s), but found 1 extension block(s).

EDID conformity: FAIL
