
EDID (hex):
00ffffffffffff005a632b8301010101
32160104b53c22783f2595a9544fa126
0a5054bfef80e1c0d100d1c0b300a940
a9c095008180565e00a0a0a029503020
350055502100001a000000ff00543536
3132353030303138360a000000fc0056
503237373020534552494553000000fd
00324b0f5e1b000a202020202020010e

Extracted contents:
header:          00 ff ff ff ff ff ff 00
serial number:   5a 63 2b 83 01 01 01 01 32 16
version:         01 04
basic params:    b5 3c 22 78 3f
chroma info:     25 95 a9 54 4f a1 26 0a 50 54
established:     bf ef 80
standard:        e1 c0 d1 00 d1 c0 b3 00 a9 40 a9 c0 95 00 81 80
descriptor 1:    56 5e 00 a0 a0 a0 29 50 30 20 35 00 55 50 21 00 00 1a
descriptor 2:    00 00 00 ff 00 54 35 36 31 32 35 30 30 30 31 38 36 0a
descriptor 3:    00 00 00 fc 00 56 50 32 37 37 30 20 53 45 52 49 45 53
descriptor 4:    00 00 00 fd 00 32 4b 0f 5e 1b 00 0a 20 20 20 20 20 20
extensions:      01
checksum:        0e

EDID version: 1.4
Manufacturer: VSC Model 832b Serial Number --
Made in week 50 of 2012
Digital display
10 bits per primary color channel
DisplayPort interface
Maximum image size: 60 cm x 34 cm
Gamma: 2.20
DPMS levels: Off
Supported color formats: RGB 4:4:4, YCrCb 4:4:4, YCrCb 4:2:2
Default (sRGB) color space is primary color space
First detailed timing includes the native pixel format and preferred refresh rate
Display is continuous frequency
Display x,y Chromaticity:
  Red:   0.6601, 0.3300
  Green: 0.3095, 0.6298
  Blue:  0.1503, 0.0400
  White: 0.3134, 0.3291
Established timings supported:
  720x400@70Hz 9:5 HorFreq: 31469 Hz Clock: 28.320 MHz
  640x480@60Hz 4:3 HorFreq: 31469 Hz Clock: 25.175 MHz
  640x480@67Hz 4:3 HorFreq: 35000 Hz Clock: 30.240 MHz
  640x480@72Hz 4:3 HorFreq: 37900 Hz Clock: 31.500 MHz
  640x480@75Hz 4:3 HorFreq: 37500 Hz Clock: 31.500 MHz
  800x600@56Hz 4:3 HorFreq: 35200 Hz Clock: 36.000 MHz
  800x600@60Hz 4:3 HorFreq: 37900 Hz Clock: 40.000 MHz
  800x600@72Hz 4:3 HorFreq: 48100 Hz Clock: 50.000 MHz
  800x600@75Hz 4:3 HorFreq: 46900 Hz Clock: 49.500 MHz
  832x624@75Hz 4:3 HorFreq: 49726 Hz Clock: 57.284 MHz
  1024x768@60Hz 4:3 HorFreq: 48400 Hz Clock: 65.000 MHz
  1024x768@70Hz 4:3 HorFreq: 56500 Hz Clock: 75.000 MHz
  1024x768@75Hz 4:3 HorFreq: 60000 Hz Clock: 78.750 MHz
  1280x1024@75Hz 5:4 HorFreq: 80000 Hz Clock: 135.000 MHz
  1152x870@75Hz 192:145 HorFreq: 67500 Hz Clock: 108.000 MHz
Standard timings supported:
  2048x1152@60Hz 16:9
  1920x1200@60Hz 16:10 HorFreq: 74000 Hz Clock: 154.000 MHz
  1920x1080@60Hz 16:9
  1680x1050@60Hz 16:10 HorFreq: 64700 Hz Clock: 119.000 MHz
  1600x1200@60Hz 4:3 HorFreq: 75000 Hz Clock: 162.000 MHz
  1600x900@60Hz 16:9
  1440x900@60Hz 16:10 HorFreq: 55500 Hz Clock: 88.750 MHz
  1280x1024@60Hz 5:4 HorFreq: 64000 Hz Clock: 108.000 MHz
Detailed mode: Clock 241.500 MHz, 597 mm x 336 mm
               2560 2608 2640 2720 hborder 0
               1440 1443 1448 1481 vborder 0
               +hsync -vsync 
               VertFreq: 59 Hz, HorFreq: 88786 Hz
Serial number: --
Monitor ranges (GTF): 50-75Hz V, 15-94kHz H, max dotclock 270MHz
Has 1 extension blocks
Checksum: 0xe (valid)
EDID block does NOT conform to EDID 1.4!
	sRGB is signaled, but the chromaticities do not match
	Name descriptor not terminated with a newline
