
EDID (hex):
00ffffffffffff0030aeaf6201010101
251f0103803c22782eee95a3544c9926
0f5054ad4b00714f81809500a9c0a9cf
b300d1c00101023a801871382d40582c
450055502100001e000000fd00304b1e
5312000a202020202020000000fc0053
3237652d32300a2020202020000000ff
00564e4136544733430a202020200132
020327f14b901f051404131211030201
230907078301000065030c001000681a
00000101304be62a4480a07038274030
20350055502100001aab22a0a050841a
303020360055502100001a7c2e90a060
1a1e403020360055502100001a000000
00000000000000000000000000000000
000000000000000000000000000000be

Extracted contents:
header:          00 ff ff ff ff ff ff 00
serial number:   30 ae af 62 01 01 01 01 25 1f
version:         01 03
basic params:    80 3c 22 78 2e
chroma info:     ee 95 a3 54 4c 99 26 0f 50 54
established:     ad 4b 00
standard:        71 4f 81 80 95 00 a9 c0 a9 cf b3 00 d1 c0 01 01
descriptor 1:    02 3a 80 18 71 38 2d 40 58 2c 45 00 55 50 21 00 00 1e
descriptor 2:    00 00 00 fd 00 30 4b 1e 53 12 00 0a 20 20 20 20 20 20
descriptor 3:    00 00 00 fc 00 53 32 37 65 2d 32 30 0a 20 20 20 20 20
descriptor 4:    00 00 00 ff 00 56 4e 41 36 54 47 33 43 0a 20 20 20 20
extensions:      01
checksum:        32

EDID version: 1.3
Manufacturer: LEN Model 62af Serial Number --
Made in week 37 of 2021
Digital display
Maximum image size: 60 cm x 34 cm
Gamma: 2.20
DPMS levels: Off
RGB color display
Default (sRGB) color space is primary color space
First detailed timing is preferred timing
Display x,y Chromaticity:
  Red:   0.6396, 0.3300
  Green: 0.2998, 0.5996
  Blue:  0.1503, 0.0595
  White: 0.3134, 0.3291
Established timings supported:
  720x400@70Hz 9:5 HorFreq: 31469 Hz Clock: 28.320 MHz
  640x480@60Hz 4:3 HorFreq: 31469 Hz Clock: 25.175 MHz
  640x480@72Hz 4:3 HorFreq: 37900 Hz Clock: 31.500 MHz
  640x480@75Hz 4:3 HorFreq: 37500 Hz Clock: 31.500 MHz
  800x600@60Hz 4:3 HorFreq: 37900 Hz Clock: 40.000 MHz
  800x600@75Hz 4:3 HorFreq: 46900 Hz Clock: 49.500 MHz
  1024x768@60Hz 4:3 HorFreq: 48400 Hz Clock: 65.000 MHz
  1024x768@75Hz 4:3 HorFreq: 60000 Hz Clock: 78.750 MHz
  1280x1024@75Hz 5:4 HorFreq: 80000 Hz Clock: 135.000 MHz
Standard timings supported:
  1152x864@75Hz 4:3 HorFreq: 67500 Hz Clock: 108.000 MHz
  1280x1024@60Hz 5:4 HorFreq: 64000 Hz Clock: 108.000 MHz
  1440x900@60Hz 16:10 HorFreq: 55500 Hz Clock: 88.750 MHz
  1600x900@60Hz 16:9
  1600x900@75Hz 16:9
  1680x1050@60Hz 16:10 HorFreq: 64700 Hz Clock: 119.000 MHz
  1920x1080@60Hz 16:9
Detailed mode: Clock 148.500 MHz, 597 mm x 336 mm
               1920 2008 2052 2200 hborder 0
               1080 1084 1089 1125 vborder 0
               +hsync +vsync 
               VertFreq: 60 Hz, HorFreq: 67500 Hz
Monitor ranges (GTF): 48-75Hz V, 30-83kHz H, max dotclock 180MHz
Monitor name: S27e-20
Serial number: --
Has 1 extension blocks
Checksum: 0x32 (valid)

CTA extension block
Extension version: 3
35 bytes of CTA data
  Video data block
    VIC  16 1920x1080@60Hz 16:9 (native) HorFreq: 67500 Hz Clock: 148.500 MHz
    VIC  31 1920x1080@50Hz 16:9  HorFreq: 56250 Hz Clock: 148.500 MHz
    VIC   5 1920x1080i@60Hz 16:9  HorFreq: 33750 Hz Clock: 74.250 MHz
    VIC  20 1920x1080i@50Hz 16:9  HorFreq: 28125 Hz Clock: 74.250 MHz
    VIC   4 1280x720@60Hz 16:9  HorFreq: 45000 Hz Clock: 74.250 MHz
    VIC  19 1280x720@50Hz 16:9  HorFreq: 37500 Hz Clock: 74.250 MHz
    VIC  18 720x576@50Hz 16:9  HorFreq: 31250 Hz Clock: 27.000 MHz
    VIC  17 720x576@50Hz 4:3  HorFreq: 31250 Hz Clock: 27.000 MHz
    VIC   3 720x480@60Hz 16:9  HorFreq: 31469 Hz Clock: 27.000 MHz
    VIC   2 720x480@60Hz 4:3  HorFreq: 31469 Hz Clock: 27.000 MHz
    VIC   1 640x480@60Hz 4:3  HorFreq: 31469 Hz Clock: 25.175 MHz
  Audio data block
    Linear PCM, max channels 2
      Supported sample rates (kHz): 48 44.1 32
      Supported sample sizes (bits): 24 20 16
  Speaker allocation data block
    Speaker map:
      FL/FR - Front Left/Right
  Vendor-specific data block, OUI 000c03 (HDMI)
    Source physical address 1.0.0.0
  Vendor-specific data block, OUI 00001a
Underscans PC formats by default
Basic audio support
Supports YCbCr 4:4:4
Supports YCbCr 4:2:2
1 native detailed modes
Detailed mode: Clock 174.500 MHz, 597 mm x 336 mm
               1920 1968 2000 2080 hborder 0
               1080 1083 1088 1119 vborder 0
               +hsync -vsync 
               VertFreq: 74 Hz, HorFreq: 83894 Hz
Detailed mode: Clock 88.750 MHz, 597 mm x 336 mm
               1440 1488 1520 1600 hborder 0
                900  903  909  926 vborder 0
               +hsync -vsync 
               VertFreq: 59 Hz, HorFreq: 55468 Hz
Detailed mode: Clock 119.000 MHz, 597 mm x 336 mm
               1680 1728 1760 1840 hborder 0
               1050 1053 1059 1080 vborder 0
               +hsync -vsync 
               VertFreq: 59 Hz, HorFreq: 64673 Hz
Checksum: 0xbe (valid)

EDID block does NOT conform to EDID 1.3!
	sRGB is signaled, but the chromaticities do not match
One or more of the timings is out of range of the Monitor Ranges:
  Vertical Freq: 50 - 75 Hz
  Horizontal Freq: 28125 - 83894 Hz
  Maximum Clock: 174.500 MHz
EDID block does not conform at all!
	Both the serial number and the serial string are set


