
EDID (hex):
00ffffffffffff000472b04078563412
28190104a0341d78e264b5ab5238ab25
13505400000001010101010101010101
0101010101016039800071382d405064
5a000f282100001e0000001000496e73
7069726f6e2033343535000000fc0041
494f204c43440a202020202000000010
0041494f204c43440a20202020200018

Extracted contents:
header:          00 ff ff ff ff ff ff 00
serial number:   04 72 b0 40 78 56 34 12 28 19
version:         01 04
basic params:    a0 34 1d 78 e2
chroma info:     64 b5 ab 52 38 ab 25 13 50 54
established:     00 00 00
standard:        01 01 01 01 01 01 01 01 01 01 01 01 01 01 01 01
descriptor 1:    60 39 80 00 71 38 2d 40 50 64 5a 00 0f 28 21 00 00 1e
descriptor 2:    00 00 00 10 00 49 6e 73 70 69 72 6f 6e 20 33 34 35 35
descriptor 3:    00 00 00 fc 00 41 49 4f 20 4c 43 44 0a 20 20 20 20 20
descriptor 4:    00 00 00 10 00 41 49 4f 20 4c 43 44 0a 20 20 20 20 20
extensions:      00
checksum:        18

EDID version: 1.4
Manufacturer: ACR Model 40b0 Serial Number --
Made in week 40 of 2015
Digital display
8 bits per primary color channel
Digital interface is not defined
Maximum image size: 52 cm x 29 cm
Gamma: 2.20
DPMS levels: Standby Suspend Off
Supported color formats: RGB 4:4:4
First detailed timing includes the native pixel format and preferred refresh rate
Display x,y Chromaticity:
  Red:   0.6689, 0.3222
  Green: 0.2197, 0.6679
  Blue:  0.1464, 0.0771
  White: 0.3134, 0.3291
Established timings supported:
Standard timings supported:
Detailed mode: Clock 146.880 MHz, 527 mm x 296 mm
               1920 2000 2100 2176 hborder 0
               1080 1085 1095 1125 vborder 0
               +hsync +vsync 
               VertFreq: 60 Hz, HorFreq: 67500 Hz
Dummy block
Monitor name: AIO LCD
Dummy block
Checksum: 0x18 (valid)
	Missing monitor ranges
EDID block does not conform at all!
	Dummy block filled with garbage
