
EDID (hex):
00ffffffffffff002264021700000000
271c0104a5251778029da1aa5544a223
144e5100000001010101010101010101
0101010101015a3c808c70b032402828
26046de4100000180000001000000000
00000000000000000000000000fe0048
616e6e537461720a20202020000000fe
00313730505557312d4230300a200021

edid-decode (hex):

00 ff ff ff ff ff ff 00 22 64 02 17 00 00 00 00
27 1c 01 04 a5 25 17 78 02 9d a1 aa 55 44 a2 23
14 4e 51 00 00 00 01 01 01 01 01 01 01 01 01 01
01 01 01 01 01 01 5a 3c 80 8c 70 b0 32 40 28 28
26 04 6d e4 10 00 00 18 00 00 00 10 00 00 00 00
00 00 00 00 00 00 00 00 00 00 00 00 00 fe 00 48
61 6e 6e 53 74 61 72 0a 20 20 20 20 00 00 00 fe
00 31 37 30 50 55 57 31 2d 42 30 30 0a 20 00 21

----------------

Block 0, Base EDID:
  EDID Structure Version & Revision: 1.4
  Vendor & Product Identification:
    Manufacturer: HSD
    Model: 5890
    Made in: week 39 of 2018
  Basic Display Parameters & Features:
    Digital display
    Bits per primary color channel: 8
    DisplayPort interface
    Maximum image size: 37 cm x 23 cm
    Gamma: 2.20
    Supported color formats: RGB 4:4:4
    First detailed timing includes the native pixel format and preferred refresh rate
  Color Characteristics:
    Red  : 0.6660, 0.3330
    Green: 0.2685, 0.6337
    Blue : 0.1386, 0.0800
    White: 0.3046, 0.3173
  Established Timings I & II: none
  Standard Timings: none
  Detailed Timing Descriptors:
    DTD 1:  1920x1200   60.000000 Hz  16:10    75.000 kHz    154.500000 MHz (365 mm x 228 mm)
                 Hfront   40 Hsync  40 Hback   60 Hpol N
                 Vfront   18 Vsync   6 Vback   26 Vpol N
    Dummy Descriptor:
    Alphanumeric Data String: 'HannStar'
    Alphanumeric Data String: '170PUW1-B00'
Checksum: 0x21


