
EDID (hex):
00ffffffffffff003870670000000000
011e0104a51f117802a105a1564fa027
0f505400000001010101010101010101
0101010101011a3680a070381f403020
350035ae1000001a0000000000000000
0000000000000000001a000000fe0043
45432050410a202020202020000000fe
004c4d3134304c462d374c30310a00ce

Extracted contents:
header:          00 ff ff ff ff ff ff 00
serial number:   38 70 67 00 00 00 00 00 01 1e
version:         01 04
basic params:    a5 1f 11 78 02
chroma info:     a1 05 a1 56 4f a0 27 0f 50 54
established:     00 00 00
standard:        01 01 01 01 01 01 01 01 01 01 01 01 01 01 01 01
descriptor 1:    1a 36 80 a0 70 38 1f 40 30 20 35 00 35 ae 10 00 00 1a
descriptor 2:    00 00 00 00 00 00 00 00 00 00 00 00 00 00 00 00 00 1a
descriptor 3:    00 00 00 fe 00 43 45 43 20 50 41 0a 20 20 20 20 20 20
descriptor 4:    00 00 00 fe 00 4c 4d 31 34 30 4c 46 2d 37 4c 30 31 0a
extensions:      00
checksum:        ce

EDID version: 1.4
Manufacturer: NCP Model 67 Serial Number --
Made in week 1 of 2020
Digital display
8 bits per primary color channel
DisplayPort interface
Maximum image size: 31 cm x 17 cm
Gamma: 2.20
Supported color formats: RGB 4:4:4
First detailed timing includes the native pixel format and preferred refresh rate
Display x,y Chromaticity:
  Red:   0.6308, 0.3378
  Green: 0.3085, 0.6259
  Blue:  0.1523, 0.0585
  White: 0.3134, 0.3291
Established timings supported:
Standard timings supported:
Detailed mode: Clock 138.500 MHz, 309 mm x 174 mm
               1920 1968 2000 2080 hborder 0
               1080 1083 1088 1111 vborder 0
               +hsync -vsync 
               VertFreq: 59 Hz, HorFreq: 66586 Hz
Manufacturer-specified data, tag 0
ASCII string: CEC PA
ASCII string: LM140LF-7L01
Checksum: 0xce (valid)
EDID block does NOT conform to EDID 1.4!
	Missing name descriptor
	Missing monitor ranges
