edid-decode (hex):

00 ff ff ff ff ff ff 00 22 f0 3e 32 01 01 01 01
10 19 01 03 68 29 17 78 2a 54 a5 a5 55 51 a0 27
0f 50 54 a1 08 00 81 c0 81 00 81 80 01 01 01 01
01 01 01 01 01 01 66 21 56 aa 51 00 1e 30 46 8f
33 00 9a e6 10 00 00 1e 00 00 00 fd 00 32 3c 1e
46 0b 00 0a 20 20 20 20 20 20 00 00 00 fc 00 48
50 20 56 31 39 36 62 7a 0a 20 20 20 00 00 00 ff
00 42 52 43 35 31 36 30 30 37 38 0a 20 20 00 da

----------------

Block 0, Base EDID:
  EDID Structure Version & Revision: 1.3
  Vendor & Product Identification:
    Manufacturer: HWP
    Model: 12862
    Serial Number: ...
    Made in: week 16 of 2015
  Basic Display Parameters & Features:
    Analog display
    Input voltage level: 0.7/0.7 V
    Blank level equals black level
    Sync: Separate
    Maximum image size: 41 cm x 23 cm
    Gamma: 2.20
    DPMS levels: Off
    RGB color display
    First detailed timing is the preferred timing
  Color Characteristics:
    Red  : 0.6455, 0.3330
    Green: 0.3173, 0.6250
    Blue : 0.1542, 0.0605
    White: 0.3134, 0.3291
  Established Timings I & II:
    IBM     :   720x400    70.081663 Hz   9:5     31.467 kHz     28.320000 MHz
    DMT 0x04:   640x480    59.940476 Hz   4:3     31.469 kHz     25.175000 MHz
    DMT 0x09:   800x600    60.316541 Hz   4:3     37.879 kHz     40.000000 MHz
    DMT 0x10:  1024x768    60.003840 Hz   4:3     48.363 kHz     65.000000 MHz
  Standard Timings:
    DMT 0x55:  1280x720    60.000000 Hz  16:9     45.000 kHz     74.250000 MHz
    DMT 0x1c:  1280x800    59.810326 Hz  16:10    49.702 kHz     83.500000 MHz
    DMT 0x23:  1280x1024   60.019740 Hz   5:4     63.981 kHz    108.000000 MHz
  Detailed Timing Descriptors:
    DTD 1:  1366x768    59.789541 Hz 683:384   47.712 kHz     85.500000 MHz (410 mm x 230 mm)
                 Hfront   70 Hsync 143 Hback  213 Hpol P
                 Vfront    3 Vsync   3 Vback   24 Vpol P
    Display Range Limits:
      Monitor ranges (GTF): 50-60 Hz V, 30-70 kHz H, max dotclock 110 MHz
    Display Product Name: 'HP V196bz'
    Display Product Serial Number: ...
Checksum: 0xda

----------------

Failures:

EDID:
  Base EDID: Some timings are out of range of the Monitor Ranges:
    Vertical Freq: 59.790 - 70.082 Hz (Monitor: 50.000 - 60.000 Hz)

EDID conformity: FAIL
