
EDID (hex):
00ffffffffffff004c2d1d0f30373930
32300104a55021783a0275ae5043a926
0e5054bfef80714f810081c081809500
a9c0b30001013c41b8a060a029503020
3a001d4d3100001a000000fd00383c1e
5a11000a202020202020000000fc0043
33344a3739780a2020202020000000ff
00484e544e3830303637370a20200134
02030ff1428403230907078301000000
00000000000000000000000000000000
00000000000000000000000000000000
00000000000000000000000000000000
00000000000000000000000000000000
00000000000000000000000000000000
00000000000000000000000000000000
00000000000000000000000000000074

Extracted contents:
header:          00 ff ff ff ff ff ff 00
serial number:   4c 2d 1d 0f 30 37 39 30 32 30
version:         01 04
basic params:    a5 50 21 78 3a
chroma info:     02 75 ae 50 43 a9 26 0e 50 54
established:     bf ef 80
standard:        71 4f 81 00 81 c0 81 80 95 00 a9 c0 b3 00 01 01
descriptor 1:    3c 41 b8 a0 60 a0 29 50 30 20 3a 00 1d 4d 31 00 00 1a
descriptor 2:    00 00 00 fd 00 38 3c 1e 5a 11 00 0a 20 20 20 20 20 20
descriptor 3:    00 00 00 fc 00 43 33 34 4a 37 39 78 0a 20 20 20 20 20
descriptor 4:    00 00 00 ff 00 48 4e 54 4e 38 30 30 36 37 37 0a 20 20
extensions:      01
checksum:        34

EDID version: 1.4
Manufacturer: SAM Model f1d Serial Number --
Digital display
8 bits per primary color channel
DisplayPort interface
Maximum image size: 80 cm x 33 cm
Gamma: 2.20
DPMS levels: Off
Supported color formats: RGB 4:4:4, YCrCb 4:4:4, YCrCb 4:2:2
First detailed timing includes the native pixel format and preferred refresh rate
Display x,y Chromaticity:
  Red:   0.6796, 0.3125
  Green: 0.2617, 0.6621
  Blue:  0.1494, 0.0576
  White: 0.3134, 0.3291
Established timings supported:
  720x400@70Hz 9:5 HorFreq: 31469 Hz Clock: 28.320 MHz
  640x480@60Hz 4:3 HorFreq: 31469 Hz Clock: 25.175 MHz
  640x480@67Hz 4:3 HorFreq: 35000 Hz Clock: 30.240 MHz
  640x480@72Hz 4:3 HorFreq: 37900 Hz Clock: 31.500 MHz
  640x480@75Hz 4:3 HorFreq: 37500 Hz Clock: 31.500 MHz
  800x600@56Hz 4:3 HorFreq: 35200 Hz Clock: 36.000 MHz
  800x600@60Hz 4:3 HorFreq: 37900 Hz Clock: 40.000 MHz
  800x600@72Hz 4:3 HorFreq: 48100 Hz Clock: 50.000 MHz
  800x600@75Hz 4:3 HorFreq: 46900 Hz Clock: 49.500 MHz
  832x624@75Hz 4:3 HorFreq: 49726 Hz Clock: 57.284 MHz
  1024x768@60Hz 4:3 HorFreq: 48400 Hz Clock: 65.000 MHz
  1024x768@70Hz 4:3 HorFreq: 56500 Hz Clock: 75.000 MHz
  1024x768@75Hz 4:3 HorFreq: 60000 Hz Clock: 78.750 MHz
  1280x1024@75Hz 5:4 HorFreq: 80000 Hz Clock: 135.000 MHz
  1152x870@75Hz 192:145 HorFreq: 67500 Hz Clock: 108.000 MHz
Standard timings supported:
  1152x864@75Hz 4:3 HorFreq: 67500 Hz Clock: 108.000 MHz
  1280x800@60Hz 16:10
  1280x720@60Hz 16:9
  1280x1024@60Hz 5:4 HorFreq: 64000 Hz Clock: 108.000 MHz
  1440x900@60Hz 16:10 HorFreq: 55500 Hz Clock: 88.750 MHz
  1600x900@60Hz 16:9
  1680x1050@60Hz 16:10 HorFreq: 64700 Hz Clock: 119.000 MHz
Detailed mode: Clock 167.000 MHz, 797 mm x 333 mm
               1720 1768 1800 1880 hborder 0
               1440 1443 1453 1481 vborder 0
               +hsync -vsync 
               VertFreq: 59 Hz, HorFreq: 88829 Hz
Monitor ranges (GTF): 56-60Hz V, 30-90kHz H, max dotclock 170MHz
Monitor name: C34J79x
Serial number: --
Has 1 extension blocks
Checksum: 0x34 (valid)

CTA extension block
Extension version: 3
11 bytes of CTA data
  Video data block
    VIC   4 1280x720@60Hz 16:9 (native) HorFreq: 45000 Hz Clock: 74.250 MHz
    VIC   3 720x480@60Hz 16:9  HorFreq: 31469 Hz Clock: 27.000 MHz
  Audio data block
    Linear PCM, max channels 2
      Supported sample rates (kHz): 48 44.1 32
      Supported sample sizes (bits): 24 20 16
  Speaker allocation data block
    Speaker map:
      FL/FR - Front Left/Right
Underscans PC formats by default
Basic audio support
Supports YCbCr 4:4:4
Supports YCbCr 4:2:2
1 native detailed modes
Checksum: 0x74 (valid)

Warning: One or more of the timings is out of range of the Monitor Ranges:
  Vertical Freq: 56 - 75 Hz
  Horizontal Freq: 31469 - 88829 Hz
  Maximum Clock: 167.000 MHz
EDID block does not conform at all!
	Bad year of manufacture
	Both the serial number and the serial string are set


