edid-decode (hex):

00 ff ff ff ff ff ff 00 22 f0 eb 10 7b 5e 0f 00
34 05 01 00 2e 27 1d a0 e8 0d c9 a0 57 47 98 27
12 48 4c 25 43 54 81 80 01 01 01 01 01 01 01 01
01 01 01 01 01 01 bc 34 00 98 51 00 2a 20 10 90
13 00 5e 18 11 00 00 3e 3c 29 80 40 41 84 2b 30
10 60 28 00 5e 0e 11 00 00 12 01 01 01 01 01 01
01 01 01 01 01 01 01 01 01 01 01 01 01 01 01 01
01 01 01 01 01 01 01 01 01 01 01 01 01 01 00 6e

----------------

Block 0, Base EDID:
  EDID Structure Version & Revision: 1.0
  Vendor & Product Identification:
    Manufacturer: HWP
    Model: 4331
    Serial Number: ...
    Made in: week 52 of 1995
  Basic Display Parameters & Features:
    Analog display
    Input voltage level: 0.714/0.286 V
    Blank level equals black level
    Sync: Separate Composite SyncOnGreen
    Maximum image size: 39 cm x 29 cm
    Gamma: 2.60
    DPMS levels: Standby Suspend Off
    RGB color display
  Color Characteristics:
    Red  : 0.6250, 0.3398
    Green: 0.2802, 0.5947
    Blue : 0.1552, 0.0703
    White: 0.2832, 0.2978
  Established Timings I & II:
    DMT 0x04:   640x480    59.940476 Hz   4:3     31.469 kHz     25.175000 MHz
    DMT 0x06:   640x480    75.000000 Hz   4:3     37.500 kHz     31.500000 MHz
    DMT 0x09:   800x600    60.316541 Hz   4:3     37.879 kHz     40.000000 MHz
    DMT 0x0b:   800x600    75.000000 Hz   4:3     46.875 kHz     49.500000 MHz
    DMT 0x12:  1024x768    75.028582 Hz   4:3     60.023 kHz     78.750000 MHz
    DMT 0x24:  1280x1024   75.024675 Hz   5:4     79.976 kHz    135.000000 MHz
  Standard Timings:
    DMT 0x23:  1280x1024   60.019740 Hz   5:4     63.981 kHz    108.000000 MHz
  Detailed Timing Descriptors:
    DTD 1:  1280x512   144.361558 Hz   5:2     79.976 kHz    135.000000 MHz (field sequential L/R, 350 mm x 280 mm)
                 Hfront   16 Hsync 144 Hback  248 Hpol P
                 Vfront    1 Vsync   3 Vback   38 Vpol P
    DTD 2:  1152x900    76.046613 Hz  32:25    71.712 kHz    105.560000 MHz (digital composite, 350 mm x 270 mm)
                 Hfront   16 Hsync  96 Hback  208 Hpol P
                 Vfront    2 Vsync   8 Vback   33
    Detailed mode: 01 01 01 01 01 01 01 01 01 01 01 01 01 01 01 01 01 01 '..................'
    Detailed mode: 01 01 01 01 01 01 01 01 01 01 01 01 01 01 01 01 01 01 '..................'
Checksum: 0x6e

----------------

Warnings:

Block 0, Base EDID:
  EDID Structure Version & Revision: EDID 1.0 is deprecated, do not use.

Failures:

Block 0, Base EDID:
  Detailed Timing Descriptor #1: Mismatch of image size 350x280 mm vs display size 390x290 mm.
  Detailed Timing Descriptor #2: Mismatch of image size 350x270 mm vs display size 390x290 mm.
  Detailed Timing Descriptor #3: Pixelclock < 10 MHz, assuming invalid data 0x01 0x01.
  Detailed Timing Descriptor #4: Pixelclock < 10 MHz, assuming invalid data 0x01 0x01.

EDID conformity: FAIL
