edid-decode (hex):

00 ff ff ff ff ff ff 00 0e 11 21 14 21 42 55 48
2d 0b 01 03 0e 28 1e 66 eb a8 15 a1 57 49 9d 26
11 47 4b ff ef 80 31 59 45 59 61 59 81 99 a9 59
c2 59 d1 4f e1 54 a6 59 40 30 62 b0 32 40 40 c0
13 00 8c 29 11 00 00 1e 00 00 00 fd 00 32 a0 1e
82 27 00 0a 20 20 20 20 20 20 00 00 00 fc 00 43
4f 4d 50 41 51 20 50 31 32 32 30 0a 00 00 00 0d
00 02 02 4d 03 38 06 0c 0b d5 00 f7 01 ff 00 c9

00 ff ff ff ff ff ff 00 0e 11 21 14 21 42 55 48
2d 0b 01 03 0e 28 1e 66 eb a8 15 a1 57 49 9d 26
11 47 4b ff ef 80 31 59 45 59 61 59 81 99 a9 59
c2 59 d1 4f e1 54 a6 59 40 30 62 b0 32 40 40 c0
13 00 8c 29 11 00 00 1e 00 00 00 fd 00 32 a0 1e
82 27 00 0a 20 20 20 20 20 20 00 00 00 fc 00 43
4f 4d 50 41 51 20 50 31 32 32 30 0a 00 00 00 0d
00 02 02 4d 03 38 06 0c 0b d5 00 f7 01 ff 00 c9

----------------

Block 0, Base EDID:
  EDID Structure Version & Revision: 1.3
  Vendor & Product Identification:
    Manufacturer: CPQ
    Model: 5153
    Serial Number: ...
    Made in: week 45 of 2001
  Basic Display Parameters & Features:
    Analog display
    Signal Level Standard: 0.700 : 0.300 : 1.000 V p-p
    Blank level equals black level
    Sync: Separate Composite SyncOnGreen
    Maximum image size: 40 cm x 30 cm
    Gamma: 2.02
    DPMS levels: Standby Suspend Off
    RGB color display
    First detailed timing is the preferred timing
    Supports GTF timings within operating range
  Color Characteristics:
    Red  : 0.6308, 0.3417
    Green: 0.2871, 0.6132
    Blue : 0.1484, 0.0673
    White: 0.2783, 0.2939
  Established Timings I & II:
    IBM     :   720x400    70.081663 Hz   9:5     31.467 kHz     28.320000 MHz
    IBM     :   720x400    87.849542 Hz   9:5     39.444 kHz     35.500000 MHz
    DMT 0x04:   640x480    59.940476 Hz   4:3     31.469 kHz     25.175000 MHz
    Apple   :   640x480    66.666667 Hz   4:3     35.000 kHz     30.240000 MHz
    DMT 0x05:   640x480    72.808802 Hz   4:3     37.861 kHz     31.500000 MHz
    DMT 0x06:   640x480    75.000000 Hz   4:3     37.500 kHz     31.500000 MHz
    DMT 0x08:   800x600    56.250000 Hz   4:3     35.156 kHz     36.000000 MHz
    DMT 0x09:   800x600    60.316541 Hz   4:3     37.879 kHz     40.000000 MHz
    DMT 0x0a:   800x600    72.187572 Hz   4:3     48.077 kHz     50.000000 MHz
    DMT 0x0b:   800x600    75.000000 Hz   4:3     46.875 kHz     49.500000 MHz
    Apple   :   832x624    74.551266 Hz   4:3     49.726 kHz     57.284000 MHz
    DMT 0x10:  1024x768    60.003840 Hz   4:3     48.363 kHz     65.000000 MHz
    DMT 0x11:  1024x768    70.069359 Hz   4:3     56.476 kHz     75.000000 MHz
    DMT 0x12:  1024x768    75.028582 Hz   4:3     60.023 kHz     78.750000 MHz
    DMT 0x24:  1280x1024   75.024675 Hz   5:4     79.976 kHz    135.000000 MHz
    Apple   :  1152x870    75.061550 Hz 192:145   68.681 kHz    100.000000 MHz
  Standard Timings:
    DMT 0x07:   640x480    85.008312 Hz   4:3     43.269 kHz     36.000000 MHz
    DMT 0x0c:   800x600    85.061274 Hz   4:3     53.674 kHz     56.250000 MHz
    DMT 0x13:  1024x768    84.996690 Hz   4:3     68.677 kHz     94.500000 MHz
    DMT 0x25:  1280x1024   85.024098 Hz   5:4     91.146 kHz    157.500000 MHz
    DMT 0x37:  1600x1200   85.000000 Hz   4:3    106.250 kHz    229.500000 MHz
    GTF     :  1800x1350   84.999955 Hz   4:3    120.445 kHz    299.667000 MHz
    DMT 0x4a:  1920x1440   75.000000 Hz   4:3    112.500 kHz    297.000000 MHz
    GTF     :  2048x1536   79.999895 Hz   4:3    128.640 kHz    364.308000 MHz
  Detailed Timing Descriptors:
    DTD 1:  1600x1200   85.000000 Hz   4:3    106.250 kHz    229.500000 MHz (396 mm x 297 mm)
                 Hfront   64 Hsync 192 Hback  304 Hpol P
                 Vfront    1 Vsync   3 Vback   46 Vpol P
    Display Range Limits:
      Monitor ranges (GTF): 50-160 Hz V, 30-130 kHz H, max dotclock 390 MHz
    Display Product Name: 'COMPAQ P1220'
    Manufacturer-Specified Display Descriptor (0x0d): 00 0d 00 02 02 4d 03 38 06 0c 0b d5 00 f7 01 ff '.....M.8........'
Checksum: 0xc9

----------------

Block 1, Unknown EDID Extension Block 0x00:
  00 ff ff ff ff ff ff 00 0e 11 21 14 21 42 55 48 '..........!.!BUH'
  2d 0b 01 03 0e 28 1e 66 eb a8 15 a1 57 49 9d 26 '-....(.f....WI.&'
  11 47 4b ff ef 80 31 59 45 59 61 59 81 99 a9 59 '.GK...1YEYaY...Y'
  c2 59 d1 4f e1 54 a6 59 40 30 62 b0 32 40 40 c0 '.Y.O.T.Y@0b.2@@.'
  13 00 8c 29 11 00 00 1e 00 00 00 fd 00 32 a0 1e '...).........2..'
  82 27 00 0a 20 20 20 20 20 20 00 00 00 fc 00 43 '.'..      .....C'
  4f 4d 50 41 51 20 50 31 32 32 30 0a 00 00 00 0d 'OMPAQ P1220.....'
  00 02 02 4d 03 38 06 0c 0b d5 00 f7 01 ff 00 c9 '...M.8..........'
Checksum: 0xc9

----------------

Failures:

Block 1, Base EDID:
  Unknown Extension Block.
EDID:
  Base EDID: EDID specified 0 extension block(s), but found 1 extension block(s).

EDID conformity: FAIL
