
EDID (hex):
00ffffffffffff0025e4c81701010101
3317010318331d782e0d15a5574aa226
0f5054bfef0081808140b300950081c0
0101010101011a3680a070381f403020
3500fe1f1100001a000000fd00374c18
530f000a202020202020000000ff0047
415030303031323436384c0a000000fc
004c43442d4d4632333558440a200023

Extracted contents:
header:          00 ff ff ff ff ff ff 00
serial number:   25 e4 c8 17 01 01 01 01 33 17
version:         01 03
basic params:    18 33 1d 78 2e
chroma info:     0d 15 a5 57 4a a2 26 0f 50 54
established:     bf ef 00
standard:        81 80 81 40 b3 00 95 00 81 c0 01 01 01 01 01 01
descriptor 1:    1a 36 80 a0 70 38 1f 40 30 20 35 00 fe 1f 11 00 00 1a
descriptor 2:    00 00 00 fd 00 37 4c 18 53 0f 00 0a 20 20 20 20 20 20
descriptor 3:    00 00 00 ff 00 47 41 50 30 30 30 31 32 34 36 38 4c 0a
descriptor 4:    00 00 00 fc 00 4c 43 44 2d 4d 46 32 33 35 58 44 0a 20
extensions:      00
checksum:        23

EDID version: 1.3
Manufacturer: IOD Model 17c8 Serial Number --
Made in week 51 of 2013
Analog display, Input voltage level: 0.7/0.3 V
Configurable signal levels
Sync: Separate 
Maximum image size: 51 cm x 29 cm
Gamma: 2.20
DPMS levels: Off
RGB color display
Default (sRGB) color space is primary color space
First detailed timing is preferred timing
Display x,y Chromaticity:
  Red:   0.6445, 0.3398
  Green: 0.2919, 0.6337
  Blue:  0.1484, 0.0595
  White: 0.3134, 0.3291
Established timings supported:
  720x400@70Hz 9:5 HorFreq: 31469 Hz Clock: 28.320 MHz
  640x480@60Hz 4:3 HorFreq: 31469 Hz Clock: 25.175 MHz
  640x480@67Hz 4:3 HorFreq: 35000 Hz Clock: 30.240 MHz
  640x480@72Hz 4:3 HorFreq: 37900 Hz Clock: 31.500 MHz
  640x480@75Hz 4:3 HorFreq: 37500 Hz Clock: 31.500 MHz
  800x600@56Hz 4:3 HorFreq: 35200 Hz Clock: 36.000 MHz
  800x600@60Hz 4:3 HorFreq: 37900 Hz Clock: 40.000 MHz
  800x600@72Hz 4:3 HorFreq: 48100 Hz Clock: 50.000 MHz
  800x600@75Hz 4:3 HorFreq: 46900 Hz Clock: 49.500 MHz
  832x624@75Hz 4:3 HorFreq: 49726 Hz Clock: 57.284 MHz
  1024x768@60Hz 4:3 HorFreq: 48400 Hz Clock: 65.000 MHz
  1024x768@70Hz 4:3 HorFreq: 56500 Hz Clock: 75.000 MHz
  1024x768@75Hz 4:3 HorFreq: 60000 Hz Clock: 78.750 MHz
  1280x1024@75Hz 5:4 HorFreq: 80000 Hz Clock: 135.000 MHz
Standard timings supported:
  1280x1024@60Hz 5:4 HorFreq: 64000 Hz Clock: 108.000 MHz
  1280x960@60Hz 4:3 HorFreq: 60000 Hz Clock: 108.000 MHz
  1680x1050@60Hz 16:10 HorFreq: 64700 Hz Clock: 119.000 MHz
  1440x900@60Hz 16:10 HorFreq: 55500 Hz Clock: 88.750 MHz
  1280x720@60Hz 16:9
Detailed mode: Clock 138.500 MHz, 510 mm x 287 mm
               1920 1968 2000 2080 hborder 0
               1080 1083 1088 1111 vborder 0
               +hsync -vsync 
               VertFreq: 59 Hz, HorFreq: 66586 Hz
Monitor ranges (GTF): 55-76Hz V, 24-83kHz H, max dotclock 150MHz
Serial number: --
Monitor name: LCD-MF235XD
Checksum: 0x23 (valid)
EDID block does NOT conform to EDID 1.3!
	sRGB is signaled, but the chromaticities do not match
