
EDID (hex):
00ffffffffffff000469ae1901010101
141201030e291a782eeed5a555489b26
125054bfef00b300a940950081008180
714f614c81406c399030621a274068b0
3600da281100001c000000ff0038354c
4d56443031303239370a000000fd0038
4b1f5010000a202020202020000000fc
004143492056573139320a202020009c

Extracted contents:
header:          00 ff ff ff ff ff ff 00
serial number:   04 69 ae 19 01 01 01 01 14 12
version:         01 03
basic params:    0e 29 1a 78 2e
chroma info:     ee d5 a5 55 48 9b 26 12 50 54
established:     bf ef 00
standard:        b3 00 a9 40 95 00 81 00 81 80 71 4f 61 4c 81 40
descriptor 1:    6c 39 90 30 62 1a 27 40 68 b0 36 00 da 28 11 00 00 1c
descriptor 2:    00 00 00 ff 00 38 35 4c 4d 56 44 30 31 30 32 39 37 0a
descriptor 3:    00 00 00 fd 00 38 4b 1f 50 10 00 0a 20 20 20 20 20 20
descriptor 4:    00 00 00 fc 00 41 43 49 20 56 57 31 39 32 0a 20 20 20
extensions:      00
checksum:        9c

EDID version: 1.3
Manufacturer: ACI Model 19ae Serial Number --
Made in week 20 of 2008
Analog display, Input voltage level: 0.7/0.3 V
Sync: Separate Composite SyncOnGreen 
Maximum image size: 41 cm x 26 cm
Gamma: 2.20
DPMS levels: Off
RGB color display
Default (sRGB) color space is primary color space
First detailed timing is preferred timing
Display x,y Chromaticity:
  Red:   0.6474, 0.3339
  Green: 0.2841, 0.6074
  Blue:  0.1513, 0.0712
  White: 0.3134, 0.3291
Established timings supported:
  720x400@70Hz 9:5 HorFreq: 31469 Hz Clock: 28.320 MHz
  640x480@60Hz 4:3 HorFreq: 31469 Hz Clock: 25.175 MHz
  640x480@67Hz 4:3 HorFreq: 35000 Hz Clock: 30.240 MHz
  640x480@72Hz 4:3 HorFreq: 37900 Hz Clock: 31.500 MHz
  640x480@75Hz 4:3 HorFreq: 37500 Hz Clock: 31.500 MHz
  800x600@56Hz 4:3 HorFreq: 35200 Hz Clock: 36.000 MHz
  800x600@60Hz 4:3 HorFreq: 37900 Hz Clock: 40.000 MHz
  800x600@72Hz 4:3 HorFreq: 48100 Hz Clock: 50.000 MHz
  800x600@75Hz 4:3 HorFreq: 46900 Hz Clock: 49.500 MHz
  832x624@75Hz 4:3 HorFreq: 49726 Hz Clock: 57.284 MHz
  1024x768@60Hz 4:3 HorFreq: 48400 Hz Clock: 65.000 MHz
  1024x768@70Hz 4:3 HorFreq: 56500 Hz Clock: 75.000 MHz
  1024x768@75Hz 4:3 HorFreq: 60000 Hz Clock: 78.750 MHz
  1280x1024@75Hz 5:4 HorFreq: 80000 Hz Clock: 135.000 MHz
Standard timings supported:
  1680x1050@60Hz 16:10 HorFreq: 64700 Hz Clock: 119.000 MHz
  1600x1200@60Hz 4:3 HorFreq: 75000 Hz Clock: 162.000 MHz
  1440x900@60Hz 16:10 HorFreq: 55500 Hz Clock: 88.750 MHz
  1280x800@60Hz 16:10
  1280x1024@60Hz 5:4 HorFreq: 64000 Hz Clock: 108.000 MHz
  1152x864@75Hz 4:3 HorFreq: 67500 Hz Clock: 108.000 MHz
  1024x768@72Hz 4:3
  1280x960@60Hz 4:3 HorFreq: 60000 Hz Clock: 108.000 MHz
Detailed mode: Clock 147.000 MHz, 474 mm x 296 mm
               1680 1784 1960 2240 hborder 0
               1050 1053 1059 1089 vborder 0
               -hsync +vsync 
               VertFreq: 60 Hz, HorFreq: 65625 Hz
Serial number: --
Monitor ranges (GTF): 56-75Hz V, 31-80kHz H, max dotclock 160MHz
Monitor name: ACI VW192
Checksum: 0x9c (valid)
EDID block does NOT conform to EDID 1.3!
	sRGB is signaled, but the chromaticities do not match
One or more of the timings is out of range of the Monitor Ranges:
  Vertical Freq: 56 - 75 Hz
  Horizontal Freq: 31469 - 80000 Hz
  Maximum Clock: 162.000 MHz
