
EDID (hex):
00ffffffffffff004493450000000000
000f0103801a10780a3b9097574b8e29
26505400000001010101010101010101
010101010101ea1a0080502010301520
440005a3100000180000000f00081812
72010a02321ea0043201000000fe0051
55414e5441444953504c4159000000fe
0051443132544c3032310a2020200041

Extracted contents:
header:          00 ff ff ff ff ff ff 00
serial number:   44 93 45 00 00 00 00 00 00 0f
version:         01 03
basic params:    80 1a 10 78 0a
chroma info:     3b 90 97 57 4b 8e 29 26 50 54
established:     00 00 00
standard:        01 01 01 01 01 01 01 01 01 01 01 01 01 01 01 01
descriptor 1:    ea 1a 00 80 50 20 10 30 15 20 44 00 05 a3 10 00 00 18
descriptor 2:    00 00 00 0f 00 08 18 12 72 01 0a 02 32 1e a0 04 32 01
descriptor 3:    00 00 00 fe 00 51 55 41 4e 54 41 44 49 53 50 4c 41 59
descriptor 4:    00 00 00 fe 00 51 44 31 32 54 4c 30 32 31 0a 20 20 20
extensions:      00
checksum:        41

EDID version: 1.3
Manufacturer: QDS Model 45 Serial Number --
Digital display
Maximum image size: 26 cm x 16 cm
Gamma: 2.20
RGB color display
First detailed timing is preferred timing
Display x,y Chromaticity:
  Red:   0.5898, 0.3427
  Green: 0.2949, 0.5576
  Blue:  0.1621, 0.1494
  White: 0.3125, 0.3281
Established timings supported:
Standard timings supported:
Detailed mode: Clock 68.900 MHz, 261 mm x 163 mm
               1280 1301 1333 1408 hborder 0
                800  804  808  816 vborder 0
               -hsync -vsync 
               VertFreq: 59 Hz, HorFreq: 48934 Hz
Manufacturer-specified data, tag 15
ASCII string: QUANTADISPLAY
ASCII string: QD12TL021
Checksum: 0x41 (valid)
EDID block does NOT conform to EDID 1.3!
	Missing name descriptor
	Missing monitor ranges
EDID block does not conform at all!
	Bad year of manufacture
