edid-decode (hex):

00 ff ff ff ff ff ff 00 31 d8 00 00 00 00 00 00
05 16 01 03 6d 23 14 78 ea 5e c0 a4 59 4a 98 25
20 50 54 00 00 00 8b c0 01 01 01 01 01 01 01 01
01 01 01 01 01 01 1b 21 50 a0 51 00 1e 30 48 88
3a 00 62 c8 10 00 00 1e 00 00 00 ff 00 4c 69 6e
75 78 20 23 30 0a 20 20 20 20 00 00 00 fd 00 3b
3d 2e 30 09 00 0a 20 20 20 20 20 20 00 00 00 fc
00 31 33 36 30 78 37 36 38 0a 20 20 20 20 00 4d

----------------

Block 0, Base EDID:
  EDID Structure Version & Revision: 1.3
  Vendor & Product Identification:
    Manufacturer: LNX
    Model: 0
    Made in: week 5 of 2012
  Basic Display Parameters & Features:
    Analog display
    Input voltage level: 0.7/0.7 V
    Blank level equals black level
    Sync: Separate Composite Serration
    Maximum image size: 35 cm x 20 cm
    Gamma: 2.20
    DPMS levels: Standby Suspend Off
    RGB color display
    First detailed timing is the preferred timing
  Color Characteristics:
    Red  : 0.6416, 0.3486
    Green: 0.2919, 0.5957
    Blue : 0.1474, 0.1250
    White: 0.3125, 0.3281
  Established Timings I & II: none
  Standard Timings:
    GTF     :  1360x768    60.000 Hz  16:9    47.700 kHz  84.715 MHz
  Detailed Timing Descriptors:
    DTD 1:  1360x768    59.799 Hz  85:48   47.720 kHz  84.750 MHz (354 mm x 200 mm)
                 Hfront   72 Hsync 136 Hback 208 Hpol P
                 Vfront    3 Vsync  10 Vback  17 Vpol P
    Display Product Serial Number: ...
  Display Range Limits:
    Monitor ranges (GTF): 59-61 Hz V, 46-48 kHz H, max dotclock 90 MHz
    Display Product Name: '1360x768'
Checksum: 0x4d

----------------

EDID conformity: PASS
