edid-decode (hex):

00 ff ff ff ff ff ff 00 26 cd 39 56 35 03 00 00
29 1d 01 03 80 31 1e 78 2a 3a 65 a7 55 52 9c 27
0f 50 54 b5 4b 00 d1 c0 81 c0 81 80 95 00 95 0f
b3 00 71 40 81 40 28 3c 80 a0 70 b0 23 40 30 20
36 00 e8 29 11 00 00 1a 00 00 00 fd 00 32 4c 1e
59 11 00 0a 20 20 20 20 20 20 00 00 00 fc 00 50
4c 32 33 39 35 57 0a 20 20 20 20 20 00 00 00 ff
00 31 31 36 33 37 4a 4b 41 30 30 38 32 31 01 28

02 03 1e f1 4b 10 1f 05 14 04 13 03 12 02 11 01
23 09 07 07 83 01 00 00 65 03 0c 00 10 00 02 3a
80 18 71 38 2d 40 58 2c 45 00 e8 29 11 00 00 1e
01 1d 00 72 51 d0 1e 20 6e 28 55 00 e8 29 11 00
00 1e 8c 0a d0 8a 20 e0 2d 10 10 3e 96 00 e8 29
11 00 00 18 8c 0a d0 90 20 40 31 20 0c 40 55 00
e8 29 11 00 00 18 00 00 00 00 00 00 00 00 00 00
00 00 00 00 00 00 00 00 00 00 00 00 00 00 00 fd

00 ff ff ff ff ff ff 00 26 cd 39 56 35 03 00 00
29 1d 01 03 80 31 1e 78 2a 3a 65 a7 55 52 9c 27
0f 50 54 b5 4b 00 d1 c0 81 c0 81 80 95 00 95 0f
b3 00 71 40 81 40 28 3c 80 a0 70 b0 23 40 30 20
36 00 e8 29 11 00 00 1a 00 00 00 fd 00 32 4c 1e
59 11 00 0a 20 20 20 20 20 20 00 00 00 fc 00 50
4c 32 33 39 35 57 0a 20 20 20 20 20 00 00 00 ff
00 31 31 36 33 37 4a 4b 41 30 30 38 32 31 01 28

02 03 1e f1 4b 10 1f 05 14 04 13 03 12 02 11 01
23 09 07 07 83 01 00 00 65 03 0c 00 10 00 02 3a
80 18 71 38 2d 40 58 2c 45 00 e8 29 11 00 00 1e
01 1d 00 72 51 d0 1e 20 6e 28 55 00 e8 29 11 00
00 1e 8c 0a d0 8a 20 e0 2d 10 10 3e 96 00 e8 29
11 00 00 18 8c 0a d0 90 20 40 31 20 0c 40 55 00
e8 29 11 00 00 18 00 00 00 00 00 00 00 00 00 00
00 00 00 00 00 00 00 00 00 00 00 00 00 00 00 fd

----------------

Block 0, Base EDID:
  EDID Structure Version & Revision: 1.3
  Vendor & Product Identification:
    Manufacturer: IVM
    Model: 22073
    Serial Number: ...
    Made in: week 41 of 2019
  Basic Display Parameters & Features:
    Digital display
    Maximum image size: 49 cm x 30 cm
    Gamma: 2.20
    DPMS levels: Off
    RGB color display
    First detailed timing is the preferred timing
  Color Characteristics:
    Red  : 0.6523, 0.3349
    Green: 0.3222, 0.6113
    Blue : 0.1533, 0.0605
    White: 0.3134, 0.3291
  Established Timings I & II:
    IBM     :   720x400    70.081663 Hz   9:5     31.467 kHz     28.320000 MHz
    DMT 0x04:   640x480    59.940476 Hz   4:3     31.469 kHz     25.175000 MHz
    Apple   :   640x480    66.666667 Hz   4:3     35.000 kHz     30.240000 MHz
    DMT 0x06:   640x480    75.000000 Hz   4:3     37.500 kHz     31.500000 MHz
    DMT 0x09:   800x600    60.316541 Hz   4:3     37.879 kHz     40.000000 MHz
    DMT 0x0b:   800x600    75.000000 Hz   4:3     46.875 kHz     49.500000 MHz
    DMT 0x10:  1024x768    60.003840 Hz   4:3     48.363 kHz     65.000000 MHz
    DMT 0x12:  1024x768    75.028582 Hz   4:3     60.023 kHz     78.750000 MHz
    DMT 0x24:  1280x1024   75.024675 Hz   5:4     79.976 kHz    135.000000 MHz
  Standard Timings:
    DMT 0x52:  1920x1080   60.000000 Hz  16:9     67.500 kHz    148.500000 MHz
    DMT 0x55:  1280x720    60.000000 Hz  16:9     45.000 kHz     74.250000 MHz
    DMT 0x23:  1280x1024   60.019740 Hz   5:4     63.981 kHz    108.000000 MHz
    DMT 0x2f:  1440x900    59.887445 Hz  16:10    55.935 kHz    106.500000 MHz
    DMT 0x30:  1440x900    74.984427 Hz  16:10    70.635 kHz    136.750000 MHz
    DMT 0x3a:  1680x1050   59.954250 Hz  16:10    65.290 kHz    146.250000 MHz
    GTF     :  1152x864    60.000000 Hz   4:3     53.700 kHz     81.624000 MHz
    DMT 0x20:  1280x960    60.000000 Hz   4:3     60.000 kHz    108.000000 MHz
  Detailed Timing Descriptors:
    DTD 1:  1920x1200   59.950171 Hz  16:10    74.038 kHz    154.000000 MHz (488 mm x 297 mm)
                 Hfront   48 Hsync  32 Hback   80 Hpol P
                 Vfront    3 Vsync   6 Vback   26 Vpol N
    Display Range Limits:
      Monitor ranges (GTF): 50-76 Hz V, 30-89 kHz H, max dotclock 170 MHz
    Display Product Name: 'PL2395W'
    Display Product Serial Number: ...
  Extension blocks: 1
Checksum: 0x28

----------------

Block 1, CTA-861 Extension Block:
  Revision: 3
  Underscans IT Video Formats by default
  Basic audio support
  Supports YCbCr 4:4:4
  Supports YCbCr 4:2:2
  Native detailed modes: 1
  Video Data Block:
    VIC  16:  1920x1080   60.000000 Hz  16:9     67.500 kHz    148.500000 MHz
    VIC  31:  1920x1080   50.000000 Hz  16:9     56.250 kHz    148.500000 MHz
    VIC   5:  1920x1080i  60.000000 Hz  16:9     33.750 kHz     74.250000 MHz
    VIC  20:  1920x1080i  50.000000 Hz  16:9     28.125 kHz     74.250000 MHz
    VIC   4:  1280x720    60.000000 Hz  16:9     45.000 kHz     74.250000 MHz
    VIC  19:  1280x720    50.000000 Hz  16:9     37.500 kHz     74.250000 MHz
    VIC   3:   720x480    59.940060 Hz  16:9     31.469 kHz     27.000000 MHz
    VIC  18:   720x576    50.000000 Hz  16:9     31.250 kHz     27.000000 MHz
    VIC   2:   720x480    59.940060 Hz   4:3     31.469 kHz     27.000000 MHz
    VIC  17:   720x576    50.000000 Hz   4:3     31.250 kHz     27.000000 MHz
    VIC   1:   640x480    59.940476 Hz   4:3     31.469 kHz     25.175000 MHz
  Audio Data Block:
    Linear PCM:
      Max channels: 2
      Supported sample rates (kHz): 48 44.1 32
      Supported sample sizes (bits): 24 20 16
  Speaker Allocation Data Block:
    FL/FR - Front Left/Right
  Vendor-Specific Data Block (HDMI), OUI 00-0C-03:
    Source physical address: 1.0.0.0
  Detailed Timing Descriptors:
    DTD 2:  1920x1080   60.000000 Hz  16:9     67.500 kHz    148.500000 MHz (488 mm x 297 mm)
                 Hfront   88 Hsync  44 Hback  148 Hpol P
                 Vfront    4 Vsync   5 Vback   36 Vpol P
    DTD 3:  1280x720    60.000000 Hz  16:9     45.000 kHz     74.250000 MHz (488 mm x 297 mm)
                 Hfront  110 Hsync  40 Hback  220 Hpol P
                 Vfront    5 Vsync   5 Vback   20 Vpol P
    DTD 4:   720x480    59.940060 Hz   3:2     31.469 kHz     27.000000 MHz (488 mm x 297 mm)
                 Hfront   16 Hsync  62 Hback   60 Hpol N
                 Vfront    9 Vsync   6 Vback   30 Vpol N
    DTD 5:   720x576    50.000000 Hz   5:4     31.250 kHz     27.000000 MHz (488 mm x 297 mm)
                 Hfront   12 Hsync  64 Hback   68 Hpol N
                 Vfront    5 Vsync   5 Vback   39 Vpol N
Checksum: 0xfd  Unused space in Extension Block: 25 bytes

----------------

Block 2, Unknown EDID Extension Block 0x00:
  00 ff ff ff ff ff ff 00 26 cd 39 56 35 03 00 00 '........&.9V5...'
  29 1d 01 03 80 31 1e 78 2a 3a 65 a7 55 52 9c 27 ')....1.x*:e.UR.''
  0f 50 54 b5 4b 00 d1 c0 81 c0 81 80 95 00 95 0f '.PT.K...........'
  b3 00 71 40 81 40 28 3c 80 a0 70 b0 23 40 30 20 '..q@.@(<..p.#@0 '
  36 00 e8 29 11 00 00 1a 00 00 00 fd 00 32 4c 1e '6..).........2L.'
  59 11 00 0a 20 20 20 20 20 20 00 00 00 fc 00 50 'Y...      .....P'
  4c 32 33 39 35 57 0a 20 20 20 20 20 00 00 00 ff 'L2395W.     ....'
  00 31 31 36 33 37 4a 4b 41 30 30 38 32 31 01 28 '.11637JKA00821.('
Checksum: 0x28

----------------

Block 3, CTA-861 Extension Block:
  Revision: 3
  Underscans IT Video Formats by default
  Basic audio support
  Supports YCbCr 4:4:4
  Supports YCbCr 4:2:2
  Native detailed modes: 1
  Video Data Block:
    VIC  16:  1920x1080   60.000000 Hz  16:9     67.500 kHz    148.500000 MHz
    VIC  31:  1920x1080   50.000000 Hz  16:9     56.250 kHz    148.500000 MHz
    VIC   5:  1920x1080i  60.000000 Hz  16:9     33.750 kHz     74.250000 MHz
    VIC  20:  1920x1080i  50.000000 Hz  16:9     28.125 kHz     74.250000 MHz
    VIC   4:  1280x720    60.000000 Hz  16:9     45.000 kHz     74.250000 MHz
    VIC  19:  1280x720    50.000000 Hz  16:9     37.500 kHz     74.250000 MHz
    VIC   3:   720x480    59.940060 Hz  16:9     31.469 kHz     27.000000 MHz
    VIC  18:   720x576    50.000000 Hz  16:9     31.250 kHz     27.000000 MHz
    VIC   2:   720x480    59.940060 Hz   4:3     31.469 kHz     27.000000 MHz
    VIC  17:   720x576    50.000000 Hz   4:3     31.250 kHz     27.000000 MHz
    VIC   1:   640x480    59.940476 Hz   4:3     31.469 kHz     25.175000 MHz
  Audio Data Block:
    Linear PCM:
      Max channels: 2
      Supported sample rates (kHz): 48 44.1 32
      Supported sample sizes (bits): 24 20 16
  Speaker Allocation Data Block:
    FL/FR - Front Left/Right
  Vendor-Specific Data Block (HDMI), OUI 00-0C-03:
    Source physical address: 1.0.0.0
  Detailed Timing Descriptors:
    DTD 6:  1920x1080   60.000000 Hz  16:9     67.500 kHz    148.500000 MHz (488 mm x 297 mm)
                 Hfront   88 Hsync  44 Hback  148 Hpol P
                 Vfront    4 Vsync   5 Vback   36 Vpol P
    DTD 7:  1280x720    60.000000 Hz  16:9     45.000 kHz     74.250000 MHz (488 mm x 297 mm)
                 Hfront  110 Hsync  40 Hback  220 Hpol P
                 Vfront    5 Vsync   5 Vback   20 Vpol P
    DTD 8:   720x480    59.940060 Hz   3:2     31.469 kHz     27.000000 MHz (488 mm x 297 mm)
                 Hfront   16 Hsync  62 Hback   60 Hpol N
                 Vfront    9 Vsync   6 Vback   30 Vpol N
    DTD 9:   720x576    50.000000 Hz   5:4     31.250 kHz     27.000000 MHz (488 mm x 297 mm)
                 Hfront   12 Hsync  64 Hback   68 Hpol N
                 Vfront    5 Vsync   5 Vback   39 Vpol N
Checksum: 0xfd  Unused space in Extension Block: 25 bytes

----------------

Warnings:

Block 1, CTA-861 Extension Block:
  Display Product Serial Number is set, so the Serial Number in the Base EDID should be 0.
  Add a Colorimetry Data Block with the sRGB colorimetry bit set to avoid interop issues.
Block 3, CTA-861 Extension Block:
  Display Product Serial Number is set, so the Serial Number in the Base EDID should be 0.
  Add a Colorimetry Data Block with the sRGB colorimetry bit set to avoid interop issues.

Failures:

Block 1, CTA-861 Extension Block:
  Missing VCDB, needed for Set Selectable RGB Quantization to avoid interop issues.
Block 2, Base EDID:
  Unknown Extension Block.
Block 3, CTA-861 Extension Block:
  Video Data Block: Duplicate VIC 16.
  Video Data Block: Duplicate VIC 31.
  Video Data Block: Duplicate VIC 5.
  Video Data Block: Duplicate VIC 20.
  Video Data Block: Duplicate VIC 4.
  Video Data Block: Duplicate VIC 19.
  Video Data Block: Duplicate VIC 3.
  Video Data Block: Duplicate VIC 18.
  Video Data Block: Duplicate VIC 2.
  Video Data Block: Duplicate VIC 17.
  Video Data Block: Duplicate VIC 1.
  Speaker Allocation Data Block: Only one instance of this Data Block is allowed.
  Missing VCDB, needed for Set Selectable RGB Quantization to avoid interop issues.
EDID:
  Base EDID: Some timings are out of range of the Monitor Ranges:
    Horizontal Freq: 28.125 - 79.976 kHz (Monitor: 30.000 - 89.000 kHz)
  Base EDID: EDID specified 1 extension block(s), but found 3 extension block(s).
  Base EDID: EDID 1.3 requires a Block Map Extension in Block 1 if there are more than 2 blocks in the EDID.

EDID conformity: FAIL
