
EDID (hex):
00ffffffffffff0026cd395670030000
291d0104a5311e783b3a65a755529c27
0f5054b54b00d1c081c081809500950f
b30071408140af4b80a070b02b403020
3600e8291100001a283c80a070b02340
30203600e8291100001a000000fd0030
4b5f5f14010a202020202020000000fc
00504c32333935570a202020202001d9
02031ef14b101f051404130312021101
230907078301000065030c001000023a
801871382d40582c4500e8291100001e
011d007251d01e206e285500e8291100
001e8c0ad08a20e02d10103e9600e829
110000188c0ad090204031200c405500
e8291100001800000000000000000000
000000000000000000000000000000fd

Extracted contents:
header:          00 ff ff ff ff ff ff 00
serial number:   26 cd 39 56 70 03 00 00 29 1d
version:         01 04
basic params:    a5 31 1e 78 3b
chroma info:     3a 65 a7 55 52 9c 27 0f 50 54
established:     b5 4b 00
standard:        d1 c0 81 c0 81 80 95 00 95 0f b3 00 71 40 81 40
descriptor 1:    af 4b 80 a0 70 b0 2b 40 30 20 36 00 e8 29 11 00 00 1a
descriptor 2:    28 3c 80 a0 70 b0 23 40 30 20 36 00 e8 29 11 00 00 1a
descriptor 3:    00 00 00 fd 00 30 4b 5f 5f 14 01 0a 20 20 20 20 20 20
descriptor 4:    00 00 00 fc 00 50 4c 32 33 39 35 57 0a 20 20 20 20 20
extensions:      01
checksum:        d9

EDID version: 1.4
Manufacturer: IVM Model 5639 Serial Number --
Made in week 41 of 2019
Digital display
8 bits per primary color channel
DisplayPort interface
Maximum image size: 49 cm x 30 cm
Gamma: 2.20
DPMS levels: Off
Supported color formats: RGB 4:4:4, YCrCb 4:4:4, YCrCb 4:2:2
First detailed timing includes the native pixel format and preferred refresh rate
Display is continuous frequency
Display x,y Chromaticity:
  Red:   0.6523, 0.3349
  Green: 0.3222, 0.6113
  Blue:  0.1533, 0.0605
  White: 0.3134, 0.3291
Established timings supported:
  720x400@70Hz 9:5 HorFreq: 31469 Hz Clock: 28.320 MHz
  640x480@60Hz 4:3 HorFreq: 31469 Hz Clock: 25.175 MHz
  640x480@67Hz 4:3 HorFreq: 35000 Hz Clock: 30.240 MHz
  640x480@75Hz 4:3 HorFreq: 37500 Hz Clock: 31.500 MHz
  800x600@60Hz 4:3 HorFreq: 37900 Hz Clock: 40.000 MHz
  800x600@75Hz 4:3 HorFreq: 46900 Hz Clock: 49.500 MHz
  1024x768@60Hz 4:3 HorFreq: 48400 Hz Clock: 65.000 MHz
  1024x768@75Hz 4:3 HorFreq: 60000 Hz Clock: 78.750 MHz
  1280x1024@75Hz 5:4 HorFreq: 80000 Hz Clock: 135.000 MHz
Standard timings supported:
  1920x1080@60Hz 16:9
  1280x720@60Hz 16:9
  1280x1024@60Hz 5:4 HorFreq: 64000 Hz Clock: 108.000 MHz
  1440x900@60Hz 16:10 HorFreq: 55500 Hz Clock: 88.750 MHz
  1440x900@75Hz 16:10 HorFreq: 82300 Hz Clock: 156.000 MHz
  1680x1050@60Hz 16:10 HorFreq: 64700 Hz Clock: 119.000 MHz
  1152x864@60Hz 4:3
  1280x960@60Hz 4:3 HorFreq: 60000 Hz Clock: 108.000 MHz
Detailed mode: Clock 193.750 MHz, 488 mm x 297 mm
               1920 1968 2000 2080 hborder 0
               1200 1203 1209 1243 vborder 0
               +hsync -vsync 
               VertFreq: 74 Hz, HorFreq: 93149 Hz
Detailed mode: Clock 154.000 MHz, 488 mm x 297 mm
               1920 1968 2000 2080 hborder 0
               1200 1203 1209 1235 vborder 0
               +hsync -vsync 
               VertFreq: 59 Hz, HorFreq: 74038 Hz
Monitor ranges (bare limits): 48-75Hz V, 95-95kHz H, max dotclock 200MHz
Monitor name: PL2395W
Has 1 extension blocks
Checksum: 0xd9 (valid)

CTA extension block
Extension version: 3
26 bytes of CTA data
  Video data block
    VIC  16 1920x1080@60Hz 16:9  HorFreq: 67500 Hz Clock: 148.500 MHz
    VIC  31 1920x1080@50Hz 16:9  HorFreq: 56250 Hz Clock: 148.500 MHz
    VIC   5 1920x1080i@60Hz 16:9  HorFreq: 33750 Hz Clock: 74.250 MHz
    VIC  20 1920x1080i@50Hz 16:9  HorFreq: 28125 Hz Clock: 74.250 MHz
    VIC   4 1280x720@60Hz 16:9  HorFreq: 45000 Hz Clock: 74.250 MHz
    VIC  19 1280x720@50Hz 16:9  HorFreq: 37500 Hz Clock: 74.250 MHz
    VIC   3 720x480@60Hz 16:9  HorFreq: 31469 Hz Clock: 27.000 MHz
    VIC  18 720x576@50Hz 16:9  HorFreq: 31250 Hz Clock: 27.000 MHz
    VIC   2 720x480@60Hz 4:3  HorFreq: 31469 Hz Clock: 27.000 MHz
    VIC  17 720x576@50Hz 4:3  HorFreq: 31250 Hz Clock: 27.000 MHz
    VIC   1 640x480@60Hz 4:3  HorFreq: 31469 Hz Clock: 25.175 MHz
  Audio data block
    Linear PCM, max channels 2
      Supported sample rates (kHz): 48 44.1 32
      Supported sample sizes (bits): 24 20 16
  Speaker allocation data block
    Speaker map:
      FL/FR - Front Left/Right
  Vendor-specific data block, OUI 000c03 (HDMI)
    Source physical address 1.0.0.0
Underscans PC formats by default
Basic audio support
Supports YCbCr 4:4:4
Supports YCbCr 4:2:2
1 native detailed modes
Detailed mode: Clock 148.500 MHz, 488 mm x 297 mm
               1920 2008 2052 2200 hborder 0
               1080 1084 1089 1125 vborder 0
               +hsync +vsync 
               VertFreq: 60 Hz, HorFreq: 67500 Hz
Detailed mode: Clock 74.250 MHz, 488 mm x 297 mm
               1280 1390 1430 1650 hborder 0
                720  725  730  750 vborder 0
               +hsync +vsync 
               VertFreq: 60 Hz, HorFreq: 45000 Hz
Detailed mode: Clock 27.000 MHz, 488 mm x 297 mm
                720  736  798  858 hborder 0
                480  489  495  525 vborder 0
               -hsync -vsync 
               VertFreq: 59 Hz, HorFreq: 31468 Hz
Detailed mode: Clock 27.000 MHz, 488 mm x 297 mm
                720  732  796  864 hborder 0
                576  581  586  625 vborder 0
               -hsync -vsync 
               VertFreq: 50 Hz, HorFreq: 31250 Hz
Checksum: 0xfd (valid)

Warning: One or more of the timings is out of range of the Monitor Ranges:
  Vertical Freq: 50 - 75 Hz
  Horizontal Freq: 28125 - 93149 Hz
  Maximum Clock: 193.750 MHz
