
EDID (hex):
00ffffffffffff0004729f0019342085
3412010368341d782aef95a3544c9b26
0f5054b30c00d1c0714f818081009500
010101010101023a80a0703823403020
360009252100001a000000fd00374b1e
5011000a202020202020000000fc0058
32343348510a202020202020000000ff
004c46523042303035333931302000ad

Extracted contents:
header:          00 ff ff ff ff ff ff 00
serial number:   04 72 9f 00 19 34 20 85 34 12
version:         01 03
basic params:    68 34 1d 78 2a
chroma info:     ef 95 a3 54 4c 9b 26 0f 50 54
established:     b3 0c 00
standard:        d1 c0 71 4f 81 80 81 00 95 00 01 01 01 01 01 01
descriptor 1:    02 3a 80 a0 70 38 23 40 30 20 36 00 09 25 21 00 00 1a
descriptor 2:    00 00 00 fd 00 37 4b 1e 50 11 00 0a 20 20 20 20 20 20
descriptor 3:    00 00 00 fc 00 58 32 34 33 48 51 0a 20 20 20 20 20 20
descriptor 4:    00 00 00 ff 00 4c 46 52 30 42 30 30 35 33 39 31 30 20
extensions:      00
checksum:        ad

EDID version: 1.3
Manufacturer: ACR Model 9f Serial Number --
Made in week 52 of 2008
Analog display, Input voltage level: 0.7/0.7 V
Sync: Separate 
Maximum image size: 52 cm x 29 cm
Gamma: 2.20
DPMS levels: Off
RGB color display
First detailed timing is preferred timing
Display x,y Chromaticity:
  Red:   0.6396, 0.3300
  Green: 0.2998, 0.6083
  Blue:  0.1503, 0.0595
  White: 0.3134, 0.3291
Established timings supported:
  720x400@70Hz 9:5 HorFreq: 31469 Hz Clock: 28.320 MHz
  640x480@60Hz 4:3 HorFreq: 31469 Hz Clock: 25.175 MHz
  640x480@67Hz 4:3 HorFreq: 35000 Hz Clock: 30.240 MHz
  800x600@56Hz 4:3 HorFreq: 35200 Hz Clock: 36.000 MHz
  800x600@60Hz 4:3 HorFreq: 37900 Hz Clock: 40.000 MHz
  1024x768@60Hz 4:3 HorFreq: 48400 Hz Clock: 65.000 MHz
  1024x768@70Hz 4:3 HorFreq: 56500 Hz Clock: 75.000 MHz
Standard timings supported:
  1920x1080@60Hz 16:9
  1152x864@75Hz 4:3 HorFreq: 67500 Hz Clock: 108.000 MHz
  1280x1024@60Hz 5:4 HorFreq: 64000 Hz Clock: 108.000 MHz
  1280x800@60Hz 16:10
  1440x900@60Hz 16:10 HorFreq: 55500 Hz Clock: 88.750 MHz
Detailed mode: Clock 148.500 MHz, 521 mm x 293 mm
               1920 1968 2000 2080 hborder 0
               1080 1083 1089 1115 vborder 0
               +hsync -vsync 
               VertFreq: 64 Hz, HorFreq: 71394 Hz
Monitor ranges (GTF): 55-75Hz V, 30-80kHz H, max dotclock 170MHz
Monitor name: X243HQ
Serial number: -- 
Checksum: 0xad (valid)
