
EDID (hex):
00ffffffffffff005a631c1301010101
201101030e291f782e3085a6564a9924
145054bfef80a940904f904081808140
714f01010101483f403062b0324040c0
130098321100001e000000ff00505342
3037333231323330350a000000fd0032
4b1e5c11000a202020202020000000fc
005650323033302053455249455300cc

Extracted contents:
header:          00 ff ff ff ff ff ff 00
serial number:   5a 63 1c 13 01 01 01 01 20 11
version:         01 03
basic params:    0e 29 1f 78 2e
chroma info:     30 85 a6 56 4a 99 24 14 50 54
established:     bf ef 80
standard:        a9 40 90 4f 90 40 81 80 81 40 71 4f 01 01 01 01
descriptor 1:    48 3f 40 30 62 b0 32 40 40 c0 13 00 98 32 11 00 00 1e
descriptor 2:    00 00 00 ff 00 50 53 42 30 37 33 32 31 32 33 30 35 0a
descriptor 3:    00 00 00 fd 00 32 4b 1e 5c 11 00 0a 20 20 20 20 20 20
descriptor 4:    00 00 00 fc 00 56 50 32 30 33 30 20 53 45 52 49 45 53
extensions:      00
checksum:        cc

EDID version: 1.3
Manufacturer: VSC Model 131c Serial Number --
Made in week 32 of 2007
Analog display, Input voltage level: 0.7/0.3 V
Sync: Separate Composite SyncOnGreen 
Maximum image size: 41 cm x 31 cm
Gamma: 2.20
DPMS levels: Off
RGB color display
Default (sRGB) color space is primary color space
First detailed timing is preferred timing
Display x,y Chromaticity:
  Red:   0.6484, 0.3388
  Green: 0.2890, 0.5976
  Blue:  0.1425, 0.0781
  White: 0.3134, 0.3291
Established timings supported:
  720x400@70Hz 9:5 HorFreq: 31469 Hz Clock: 28.320 MHz
  640x480@60Hz 4:3 HorFreq: 31469 Hz Clock: 25.175 MHz
  640x480@67Hz 4:3 HorFreq: 35000 Hz Clock: 30.240 MHz
  640x480@72Hz 4:3 HorFreq: 37900 Hz Clock: 31.500 MHz
  640x480@75Hz 4:3 HorFreq: 37500 Hz Clock: 31.500 MHz
  800x600@56Hz 4:3 HorFreq: 35200 Hz Clock: 36.000 MHz
  800x600@60Hz 4:3 HorFreq: 37900 Hz Clock: 40.000 MHz
  800x600@72Hz 4:3 HorFreq: 48100 Hz Clock: 50.000 MHz
  800x600@75Hz 4:3 HorFreq: 46900 Hz Clock: 49.500 MHz
  832x624@75Hz 4:3 HorFreq: 49726 Hz Clock: 57.284 MHz
  1024x768@60Hz 4:3 HorFreq: 48400 Hz Clock: 65.000 MHz
  1024x768@70Hz 4:3 HorFreq: 56500 Hz Clock: 75.000 MHz
  1024x768@75Hz 4:3 HorFreq: 60000 Hz Clock: 78.750 MHz
  1280x1024@75Hz 5:4 HorFreq: 80000 Hz Clock: 135.000 MHz
  1152x870@75Hz 192:145 HorFreq: 67500 Hz Clock: 108.000 MHz
Standard timings supported:
  1600x1200@60Hz 4:3 HorFreq: 75000 Hz Clock: 162.000 MHz
  1400x1050@75Hz 4:3 HorFreq: 82300 Hz Clock: 156.000 MHz
  1400x1050@60Hz 4:3 HorFreq: 64700 Hz Clock: 101.000 MHz
  1280x1024@60Hz 5:4 HorFreq: 64000 Hz Clock: 108.000 MHz
  1280x960@60Hz 4:3 HorFreq: 60000 Hz Clock: 108.000 MHz
  1152x864@75Hz 4:3 HorFreq: 67500 Hz Clock: 108.000 MHz
Detailed mode: Clock 162.000 MHz, 408 mm x 306 mm
               1600 1664 1856 2160 hborder 0
               1200 1201 1204 1250 vborder 0
               +hsync +vsync 
               VertFreq: 60 Hz, HorFreq: 75000 Hz
Serial number: --
Monitor ranges (GTF): 50-75Hz V, 30-92kHz H, max dotclock 170MHz
Checksum: 0xcc (valid)
EDID block does NOT conform to EDID 1.3!
	sRGB is signaled, but the chromaticities do not match
	Name descriptor not terminated with a newline
