
EDID (hex):
00ffffffffffff0010ac4a0701000000
2819010381351e78ea64b5ab5238ab25
13505400000001010101010101010101
0101010101012736809670381f401850
ae000f282100001e0000001000496e73
7069726f6e2033343535000000fc0049
6e737069726f6e203332363500000000
00034102990000000002010a202000d5

Extracted contents:
header:          00 ff ff ff ff ff ff 00
serial number:   10 ac 4a 07 01 00 00 00 28 19
version:         01 03
basic params:    81 35 1e 78 ea
chroma info:     64 b5 ab 52 38 ab 25 13 50 54
established:     00 00 00
standard:        01 01 01 01 01 01 01 01 01 01 01 01 01 01 01 01
descriptor 1:    27 36 80 96 70 38 1f 40 18 50 ae 00 0f 28 21 00 00 1e
descriptor 2:    00 00 00 10 00 49 6e 73 70 69 72 6f 6e 20 33 34 35 35
descriptor 3:    00 00 00 fc 00 49 6e 73 70 69 72 6f 6e 20 33 32 36 35
descriptor 4:    00 00 00 00 00 03 41 02 99 00 00 00 00 02 01 0a 20 20
extensions:      00
checksum:        d5

EDID version: 1.3
Manufacturer: DEL Model 74a Serial Number --
Made in week 40 of 2015
Digital display
DFP 1.x compatible TMDS
Maximum image size: 53 cm x 30 cm
Gamma: 2.20
DPMS levels: Standby Suspend Off
RGB color display
First detailed timing is preferred timing
Display x,y Chromaticity:
  Red:   0.6689, 0.3222
  Green: 0.2197, 0.6679
  Blue:  0.1464, 0.0771
  White: 0.3134, 0.3291
Established timings supported:
Standard timings supported:
Detailed mode: Clock 138.630 MHz, 527 mm x 296 mm
               1920 1944 2024 2070 hborder 0
               1080 1090 1104 1111 vborder 0
               +hsync +vsync 
               VertFreq: 60 Hz, HorFreq: 66971 Hz
Dummy block
Manufacturer-specified data, tag 0
Checksum: 0xd5 (valid)
EDID block does NOT conform to EDID 1.3!
	Name descriptor not terminated with a newline
	Missing monitor ranges
EDID block does not conform at all!
	Dummy block filled with garbage
