
EDID (hex):
00ffffffffffff000e14151400000000
2d110103802115780a092d9d564f9027
21505400000001010101010101010101
010101010101ea1a008050200d301820
13004bcf100000190000000f00202020
2020202020206e050f00000000fe0043
50540a202020202020202020000000fe
00434c414131353457423035412000b6

Extracted contents:
header:          00 ff ff ff ff ff ff 00
serial number:   0e 14 15 14 00 00 00 00 2d 11
version:         01 03
basic params:    80 21 15 78 0a
chroma info:     09 2d 9d 56 4f 90 27 21 50 54
established:     00 00 00
standard:        01 01 01 01 01 01 01 01 01 01 01 01 01 01 01 01
descriptor 1:    ea 1a 00 80 50 20 0d 30 18 20 13 00 4b cf 10 00 00 19
descriptor 2:    00 00 00 0f 00 20 20 20 20 20 20 20 20 20 6e 05 0f 00
descriptor 3:    00 00 00 fe 00 43 50 54 0a 20 20 20 20 20 20 20 20 20
descriptor 4:    00 00 00 fe 00 43 4c 41 41 31 35 34 57 42 30 35 41 20
extensions:      00
checksum:        b6

EDID version: 1.3
Manufacturer: CPT Model 1415 Serial Number --
Made in week 45 of 2007
Digital display
Maximum image size: 33 cm x 21 cm
Gamma: 2.20
RGB color display
First detailed timing is preferred timing
Display x,y Chromaticity:
  Red:   0.6132, 0.3359
  Green: 0.3105, 0.5634
  Blue:  0.1523, 0.1308
  White: 0.3154, 0.3291
Established timings supported:
Standard timings supported:
Detailed mode: Clock 68.900 MHz, 331 mm x 207 mm
               1280 1304 1336 1408 hborder 0
                800  801  804  813 vborder 0
               -hsync -vsync 
               VertFreq: 60 Hz, HorFreq: 48934 Hz
Manufacturer-specified data, tag 15
ASCII string: CPT
ASCII string: CLAA154WB05A 
Checksum: 0xb6 (valid)
EDID block does NOT conform to EDID 1.3!
	Missing name descriptor
	Missing monitor ranges
