
EDID (hex):
00ffffffffffff004c2d327200000000
01200104b53e22783b32b5ad5045a125
0e505421880081c0810081809500a9c0
b300010101014dd000a0f0703e803020
3500ba882100001a000000fd0c379045
458f010a202020202020000000fc004f
64797373657920473730420a000000ff
004831414b3530303030300a2020022d
020333f04761103f04035f7623090707
83010000e305c3016d1a0000020f3790
000460085b36e6060501615a00e5018b
84903d565e00a0a0a0295030203500ba
882100001a6fc200a0a0a05550302035
00ba882100001a0474801871382d4058
2c4500ba882100001e00000000000000
00000000000000000000000000000099
70127903000301640fd00184ff0e2f02
af8057006f08590007800900d52c0204
ff0e2f02f7801f006f08590002000400
4cd00004ff0e9f002f801f006f083d00
0200040008ec0004ff099f002f801f00
9f05660002000400598700047f079f00
2f801f0037044c000200040000000000
00000000000000000000000000009c90

edid-decode (hex):

00 ff ff ff ff ff ff 00 4c 2d 32 72 00 00 00 00
01 20 01 04 b5 3e 22 78 3b 32 b5 ad 50 45 a1 25
0e 50 54 21 88 00 81 c0 81 00 81 80 95 00 a9 c0
b3 00 01 01 01 01 4d d0 00 a0 f0 70 3e 80 30 20
35 00 ba 88 21 00 00 1a 00 00 00 fd 0c 37 90 45
45 8f 01 0a 20 20 20 20 20 20 00 00 00 fc 00 4f
64 79 73 73 65 79 20 47 37 30 42 0a 00 00 00 ff
00 48 31 41 4b 35 30 30 30 30 30 0a 20 20 02 2d

02 03 33 f0 47 61 10 3f 04 03 5f 76 23 09 07 07
83 01 00 00 e3 05 c3 01 6d 1a 00 00 02 0f 37 90
00 04 60 08 5b 36 e6 06 05 01 61 5a 00 e5 01 8b
84 90 3d 56 5e 00 a0 a0 a0 29 50 30 20 35 00 ba
88 21 00 00 1a 6f c2 00 a0 a0 a0 55 50 30 20 35
00 ba 88 21 00 00 1a 04 74 80 18 71 38 2d 40 58
2c 45 00 ba 88 21 00 00 1e 00 00 00 00 00 00 00
00 00 00 00 00 00 00 00 00 00 00 00 00 00 00 99

70 12 79 03 00 03 01 64 0f d0 01 84 ff 0e 2f 02
af 80 57 00 6f 08 59 00 07 80 09 00 d5 2c 02 04
ff 0e 2f 02 f7 80 1f 00 6f 08 59 00 02 00 04 00
4c d0 00 04 ff 0e 9f 00 2f 80 1f 00 6f 08 3d 00
02 00 04 00 08 ec 00 04 ff 09 9f 00 2f 80 1f 00
9f 05 66 00 02 00 04 00 59 87 00 04 7f 07 9f 00
2f 80 1f 00 37 04 4c 00 02 00 04 00 00 00 00 00
00 00 00 00 00 00 00 00 00 00 00 00 00 00 9c 90

----------------

Block 0, Base EDID:
  EDID Structure Version & Revision: 1.4
  Vendor & Product Identification:
    Manufacturer: SAM
    Model: 29234
    Made in: week 1 of 2022
  Basic Display Parameters & Features:
    Digital display
    Bits per primary color channel: 10
    DisplayPort interface
    Maximum image size: 62 cm x 34 cm
    Gamma: 2.20
    DPMS levels: Off
    Supported color formats: RGB 4:4:4, YCrCb 4:4:4, YCrCb 4:2:2
    First detailed timing includes the native pixel format and preferred refresh rate
    Display is continuous frequency
  Color Characteristics:
    Red  : 0.6757, 0.3154
    Green: 0.2695, 0.6308
    Blue : 0.1464, 0.0576
    White: 0.3134, 0.3291
  Established Timings I & II:
    DMT 0x04:   640x480    59.940476 Hz   4:3     31.469 kHz     25.175000 MHz
    DMT 0x09:   800x600    60.316541 Hz   4:3     37.879 kHz     40.000000 MHz
    DMT 0x0a:   800x600    72.187572 Hz   4:3     48.077 kHz     50.000000 MHz
    DMT 0x10:  1024x768    60.003840 Hz   4:3     48.363 kHz     65.000000 MHz
  Standard Timings:
    DMT 0x55:  1280x720    60.000000 Hz  16:9     45.000 kHz     74.250000 MHz
    DMT 0x1c:  1280x800    59.810326 Hz  16:10    49.702 kHz     83.500000 MHz
    DMT 0x23:  1280x1024   60.019740 Hz   5:4     63.981 kHz    108.000000 MHz
    DMT 0x2f:  1440x900    59.887445 Hz  16:10    55.935 kHz    106.500000 MHz
    DMT 0x53:  1600x900    60.000000 Hz  16:9     60.000 kHz    108.000000 MHz (RB)
    DMT 0x3a:  1680x1050   59.954250 Hz  16:10    65.290 kHz    146.250000 MHz
  Detailed Timing Descriptors:
    DTD 1:  3840x2160   59.996625 Hz  16:9    133.312 kHz    533.250000 MHz (698 mm x 392 mm)
                 Hfront   48 Hsync  32 Hback   80 Hpol P
                 Vfront    3 Vsync   5 Vback   54 Vpol N
    Display Range Limits:
      Monitor ranges (Bare Limits): 55-144 Hz V, 324-324 kHz H, max dotclock 1430 MHz
    Display Product Name: 'Odyssey G70B'
    Display Product Serial Number: 'H1AK500000'
  Extension blocks: 2
Checksum: 0x2d

----------------

Block 1, CTA-861 Extension Block:
  Revision: 3
  Underscans IT Video Formats by default
  Basic audio support
  Supports YCbCr 4:4:4
  Supports YCbCr 4:2:2
  Native detailed modes: 0
  Video Data Block:
    VIC  97:  3840x2160   60.000000 Hz  16:9    135.000 kHz    594.000000 MHz
    VIC  16:  1920x1080   60.000000 Hz  16:9     67.500 kHz    148.500000 MHz
    VIC  63:  1920x1080  120.000000 Hz  16:9    135.000 kHz    297.000000 MHz
    VIC   4:  1280x720    60.000000 Hz  16:9     45.000 kHz     74.250000 MHz
    VIC   3:   720x480    59.940060 Hz  16:9     31.469 kHz     27.000000 MHz
    VIC  95:  3840x2160   30.000000 Hz  16:9     67.500 kHz    297.000000 MHz
    VIC 118:  3840x2160  120.000000 Hz  16:9    270.000 kHz   1188.000000 MHz
  Audio Data Block:
    Linear PCM:
      Max channels: 2
      Supported sample rates (kHz): 48 44.1 32
      Supported sample sizes (bits): 24 20 16
  Speaker Allocation Data Block:
    FL/FR - Front Left/Right
  Colorimetry Data Block:
    xvYCC601
    xvYCC709
    BT2020YCC
    BT2020RGB
    Gamut Boundary Description Metadata Profile P0
  Vendor-Specific Data Block (AMD), OUI 00-00-1A:
    Version: 2.15
    Minimum Refresh Rate: 55 Hz
    Maximum Refresh Rate: 144 Hz
    Flags 1.x: 0x00
    Flags 2.x: 0x04
    Maximum luminance: 96 (400.000 cd/m^2)
    Minimum luminance: 8 (0.004 cd/m^2)
    Maximum luminance (without local dimming): 91 (358.942 cd/m^2)
    Minimum luminance (without local dimming): 54 (0.161 cd/m^2)
  HDR Static Metadata Data Block:
    Electro optical transfer functions:
      Traditional gamma - SDR luminance range
      SMPTE ST2084
    Supported static metadata descriptors:
      Static metadata type 1
    Desired content max luminance: 97 (408.759 cd/m^2)
    Desired content max frame-average luminance: 90 (351.250 cd/m^2)
    Desired content min luminance: 0 (0.000 cd/m^2)
  Vendor-Specific Video Data Block (HDR10+), OUI 90-84-8B:
    Application Version: 61
  Detailed Timing Descriptors:
    DTD 2:  2560x1440   59.950550 Hz  16:9     88.787 kHz    241.500000 MHz (698 mm x 392 mm)
                 Hfront   48 Hsync  32 Hback   80 Hpol P
                 Vfront    3 Vsync   5 Vback   33 Vpol N
    DTD 3:  2560x1440  119.997589 Hz  16:9    182.996 kHz    497.750000 MHz (698 mm x 392 mm)
                 Hfront   48 Hsync  32 Hback   80 Hpol P
                 Vfront    3 Vsync   5 Vback   77 Vpol N
    DTD 4:  1920x1080  120.000000 Hz  16:9    135.000 kHz    297.000000 MHz (698 mm x 392 mm)
                 Hfront   88 Hsync  44 Hback  148 Hpol P
                 Vfront    4 Vsync   5 Vback   36 Vpol P
Checksum: 0x99  Unused space in Extension Block: 22 bytes

----------------

Block 2, DisplayID Extension Block:
  Version: 1.2
  Extension Count: 0
  Display Product Type: Standalone display device
  Video Timing Modes Type 1 - Detailed Timings Data Block:
    DTD:  3840x2160  120.000000 Hz  16:9    270.000 kHz   1188.000000 MHz (aspect 16:9, no 3D stereo, preferred)
               Hfront  176 Hsync  88 Hback  296 Hpol P
               Vfront    8 Vsync  10 Vback   72 Vpol P
    DTD:  3840x2160  143.989899 Hz  16:9    323.977 kHz   1425.500000 MHz (aspect 16:9, no 3D stereo)
               Hfront  248 Hsync  32 Hback  280 Hpol P
               Vfront    3 Vsync   5 Vback   82 Vpol N
    DTD:  3840x2160   59.996625 Hz  16:9    133.312 kHz    533.250000 MHz (aspect 16:9, no 3D stereo)
               Hfront   48 Hsync  32 Hback   80 Hpol P
               Vfront    3 Vsync   5 Vback   54 Vpol N
    DTD:  2560x1440  143.973257 Hz  16:9    222.151 kHz    604.250000 MHz (aspect 16:9, no 3D stereo)
               Hfront   48 Hsync  32 Hback   80 Hpol P
               Vfront    3 Vsync   5 Vback   95 Vpol N
    DTD:  1920x1080  143.981451 Hz  16:9    166.587 kHz    346.500000 MHz (aspect 16:9, no 3D stereo)
               Hfront   48 Hsync  32 Hback   80 Hpol P
               Vfront    3 Vsync   5 Vback   69 Vpol N
  Checksum: 0x9c
Checksum: 0x90


