edid-decode (hex):

00 ff ff ff ff ff ff 00 4c 2d cb 05 34 32 52 4c
09 14 01 03 0e 35 1e 78 2a 60 41 a6 56 4a 9c 25
12 50 54 23 08 00 81 00 81 40 81 80 95 00 a9 40
b3 00 01 01 01 01 02 3a 80 18 71 38 2d 40 58 2c
45 00 12 2c 21 00 00 1e 00 00 00 fd 00 38 3c 1e
51 11 00 0a 20 20 20 20 20 20 00 00 00 fc 00 53
79 6e 63 4d 61 73 74 65 72 0a 20 20 00 00 00 ff
00 48 39 4d 5a 33 30 32 30 37 34 0a 20 20 00 b9

00 ff ff ff ff ff ff 00 4c 2d cb 05 34 32 52 4c
09 14 01 03 0e 35 1e 78 2a 60 41 a6 56 4a 9c 25
12 50 54 23 08 00 81 00 81 40 81 80 95 00 a9 40
b3 00 01 01 01 01 02 3a 80 18 71 38 2d 40 58 2c
45 00 12 2c 21 00 00 1e 00 00 00 fd 00 38 3c 1e
51 11 00 0a 20 20 20 20 20 20 00 00 00 fc 00 53
79 6e 63 4d 61 73 74 65 72 0a 20 20 00 00 00 ff
00 48 39 4d 5a 33 30 32 30 37 34 0a 20 20 00 b9

----------------

Block 0, Base EDID:
  EDID Structure Version & Revision: 1.3
  Vendor & Product Identification:
    Manufacturer: SAM
    Model: 1483
    Serial Number: ...
    Made in: week 9 of 2010
  Basic Display Parameters & Features:
    Analog display
    Signal Level Standard: 0.700 : 0.300 : 1.000 V p-p
    Blank level equals black level
    Sync: Separate Composite SyncOnGreen
    Maximum image size: 53 cm x 30 cm
    Gamma: 2.20
    DPMS levels: Off
    RGB color display
    First detailed timing is the preferred timing
  Color Characteristics:
    Red  : 0.6494, 0.3378
    Green: 0.2890, 0.6093
    Blue : 0.1455, 0.0703
    White: 0.3125, 0.3291
  Established Timings I & II:
    DMT 0x04:   640x480    59.940476 Hz   4:3     31.469 kHz     25.175000 MHz
    DMT 0x08:   800x600    56.250000 Hz   4:3     35.156 kHz     36.000000 MHz
    DMT 0x09:   800x600    60.316541 Hz   4:3     37.879 kHz     40.000000 MHz
    DMT 0x10:  1024x768    60.003840 Hz   4:3     48.363 kHz     65.000000 MHz
  Standard Timings:
    DMT 0x1c:  1280x800    59.810326 Hz  16:10    49.702 kHz     83.500000 MHz
    DMT 0x20:  1280x960    60.000000 Hz   4:3     60.000 kHz    108.000000 MHz
    DMT 0x23:  1280x1024   60.019740 Hz   5:4     63.981 kHz    108.000000 MHz
    DMT 0x2f:  1440x900    59.887445 Hz  16:10    55.935 kHz    106.500000 MHz
    DMT 0x33:  1600x1200   60.000000 Hz   4:3     75.000 kHz    162.000000 MHz
    DMT 0x3a:  1680x1050   59.954250 Hz  16:10    65.290 kHz    146.250000 MHz
  Detailed Timing Descriptors:
    DTD 1:  1920x1080   60.000000 Hz  16:9     67.500 kHz    148.500000 MHz (530 mm x 300 mm)
                 Hfront   88 Hsync  44 Hback  148 Hpol P
                 Vfront    4 Vsync   5 Vback   36 Vpol P
    Display Range Limits:
      Monitor ranges (GTF): 56-60 Hz V, 30-81 kHz H, max dotclock 170 MHz
    Display Product Name: 'SyncMaster'
    Display Product Serial Number: ...
Checksum: 0xb9

----------------

Block 1, Unknown EDID Extension Block 0x00:
  00 ff ff ff ff ff ff 00 4c 2d cb 05 34 32 52 4c '........L-..42RL'
  09 14 01 03 0e 35 1e 78 2a 60 41 a6 56 4a 9c 25 '.....5.x*`A.VJ.%'
  12 50 54 23 08 00 81 00 81 40 81 80 95 00 a9 40 '.PT#.....@.....@'
  b3 00 01 01 01 01 02 3a 80 18 71 38 2d 40 58 2c '.......:..q8-@X,'
  45 00 12 2c 21 00 00 1e 00 00 00 fd 00 38 3c 1e 'E..,!........8<.'
  51 11 00 0a 20 20 20 20 20 20 00 00 00 fc 00 53 'Q...      .....S'
  79 6e 63 4d 61 73 74 65 72 0a 20 20 00 00 00 ff 'yncMaster.  ....'
  00 48 39 4d 5a 33 30 32 30 37 34 0a 20 20 00 b9 '.H9MZ302074.  ..'
Checksum: 0xb9

----------------

Failures:

Block 1, Base EDID:
  Unknown Extension Block.
EDID:
  Base EDID: EDID specified 0 extension block(s), but found 1 extension block(s).

EDID conformity: FAIL
