
EDID (hex):
00ffffffffffff0005e3402490600000
1415010380351e782a4a60a359559b26
0e5054bfef00814081809500b300714f
81c001010101023a801871382d40582c
4500122c2100001e000000fd00324b1e
5311000a202020202020000000fc0032
3434300a2020202020202020000000ff
00415652423548413032343732300020

Extracted contents:
header:          00 ff ff ff ff ff ff 00
serial number:   05 e3 40 24 90 60 00 00 14 15
version:         01 03
basic params:    80 35 1e 78 2a
chroma info:     4a 60 a3 59 55 9b 26 0e 50 54
established:     bf ef 00
standard:        81 40 81 80 95 00 b3 00 71 4f 81 c0 01 01 01 01
descriptor 1:    02 3a 80 18 71 38 2d 40 58 2c 45 00 12 2c 21 00 00 1e
descriptor 2:    00 00 00 fd 00 32 4b 1e 53 11 00 0a 20 20 20 20 20 20
descriptor 3:    00 00 00 fc 00 32 34 34 30 0a 20 20 20 20 20 20 20 20
descriptor 4:    00 00 00 ff 00 41 56 52 42 35 48 41 30 32 34 37 32 30
extensions:      00
checksum:        20

EDID version: 1.3
Manufacturer: AOC Model 2440 Serial Number --
Made in week 20 of 2011
Digital display
Maximum image size: 53 cm x 30 cm
Gamma: 2.20
DPMS levels: Off
RGB color display
First detailed timing is preferred timing
Display x,y Chromaticity:
  Red:   0.6376, 0.3476
  Green: 0.3339, 0.6074
  Blue:  0.1494, 0.0566
  White: 0.3125, 0.3281
Established timings supported:
  720x400@70Hz 9:5 HorFreq: 31469 Hz Clock: 28.320 MHz
  640x480@60Hz 4:3 HorFreq: 31469 Hz Clock: 25.175 MHz
  640x480@67Hz 4:3 HorFreq: 35000 Hz Clock: 30.240 MHz
  640x480@72Hz 4:3 HorFreq: 37900 Hz Clock: 31.500 MHz
  640x480@75Hz 4:3 HorFreq: 37500 Hz Clock: 31.500 MHz
  800x600@56Hz 4:3 HorFreq: 35200 Hz Clock: 36.000 MHz
  800x600@60Hz 4:3 HorFreq: 37900 Hz Clock: 40.000 MHz
  800x600@72Hz 4:3 HorFreq: 48100 Hz Clock: 50.000 MHz
  800x600@75Hz 4:3 HorFreq: 46900 Hz Clock: 49.500 MHz
  832x624@75Hz 4:3 HorFreq: 49726 Hz Clock: 57.284 MHz
  1024x768@60Hz 4:3 HorFreq: 48400 Hz Clock: 65.000 MHz
  1024x768@70Hz 4:3 HorFreq: 56500 Hz Clock: 75.000 MHz
  1024x768@75Hz 4:3 HorFreq: 60000 Hz Clock: 78.750 MHz
  1280x1024@75Hz 5:4 HorFreq: 80000 Hz Clock: 135.000 MHz
Standard timings supported:
  1280x960@60Hz 4:3 HorFreq: 60000 Hz Clock: 108.000 MHz
  1280x1024@60Hz 5:4 HorFreq: 64000 Hz Clock: 108.000 MHz
  1440x900@60Hz 16:10 HorFreq: 55500 Hz Clock: 88.750 MHz
  1680x1050@60Hz 16:10 HorFreq: 64700 Hz Clock: 119.000 MHz
  1152x864@75Hz 4:3 HorFreq: 67500 Hz Clock: 108.000 MHz
  1280x720@60Hz 16:9
Detailed mode: Clock 148.500 MHz, 530 mm x 300 mm
               1920 2008 2052 2200 hborder 0
               1080 1084 1089 1125 vborder 0
               +hsync +vsync 
               VertFreq: 60 Hz, HorFreq: 67500 Hz
Monitor ranges (GTF): 50-75Hz V, 30-83kHz H, max dotclock 170MHz
Monitor name: 2440
Serial number: --
Checksum: 0x20 (valid)


