
EDID (hex):
00ffffffffffff004ca34b5400000000
00130103902615780a56259d5b539a28
17505400000001010101010101010101
010101010101a5254088608416303020
15007ed71000001aa525408860841630
302015007ed71000001a000000fe004a
31334a58803137334b540a2000000000
00000000000000000002010a20200002

Extracted contents:
header:          00 ff ff ff ff ff ff 00
serial number:   4c a3 4b 54 00 00 00 00 00 13
version:         01 03
basic params:    90 26 15 78 0a
chroma info:     56 25 9d 5b 53 9a 28 17 50 54
established:     00 00 00
standard:        01 01 01 01 01 01 01 01 01 01 01 01 01 01 01 01
descriptor 1:    a5 25 40 88 60 84 16 30 30 20 15 00 7e d7 10 00 00 1a
descriptor 2:    a5 25 40 88 60 84 16 30 30 20 15 00 7e d7 10 00 00 1a
descriptor 3:    00 00 00 fe 00 4a 31 33 4a 58 80 31 37 33 4b 54 0a 20
descriptor 4:    00 00 00 00 00 00 00 00 00 00 00 00 00 02 01 0a 20 20
extensions:      00
checksum:        02

EDID version: 1.3
Manufacturer: SEC Model 544b Serial Number --
Made in year 2009
Digital display
Maximum image size: 38 cm x 21 cm
Gamma: 2.20
RGB color display
First detailed timing is preferred timing
Display x,y Chromaticity:
  Red:   0.6142, 0.3564
  Green: 0.3251, 0.6035
  Blue:  0.1562, 0.0917
  White: 0.3134, 0.3291
Established timings supported:
Standard timings supported:
Detailed mode: Clock 96.370 MHz, 382 mm x 215 mm
               1600 1648 1680 1736 hborder 0
                900  901  906  922 vborder 0
               +hsync -vsync 
               VertFreq: 60 Hz, HorFreq: 55512 Hz
Detailed mode: Clock 96.370 MHz, 382 mm x 215 mm
               1600 1648 1680 1736 hborder 0
                900  901  906  922 vborder 0
               +hsync -vsync 
               VertFreq: 60 Hz, HorFreq: 55512 Hz
ASCII string: J13JX
Manufacturer-specified data, tag 0
Checksum: 0x2 (valid)
EDID block does NOT conform to EDID 1.3!
	Digital display field contains garbage: 10
	Missing name descriptor
	Missing monitor ranges
	Detailed block string not properly terminated
