edid-decode (hex):

00 ff ff ff ff ff ff 00 36 84 01 00 00 00 00 00
00 11 01 01 80 21 15 78 0a cf c0 97 59 4e 91 27
21 50 54 00 00 00 01 01 01 01 01 01 01 01 01 01
01 01 01 01 01 01 bc 1b 00 a0 50 20 17 30 30 20
36 00 2f be 10 00 00 18 00 00 00 0f 00 00 00 00
00 00 00 00 00 00 00 00 00 01 00 00 00 fe 00 4d
49 4e 44 54 45 43 48 00 00 00 00 0a 00 00 00 fe
00 4d 31 34 31 4e 57 57 31 30 30 31 20 20 00 9a

----------------

Block 0, Base EDID:
  EDID Structure Version & Revision: 1.1
  Vendor & Product Identification:
    Manufacturer: MTD
    Model: 1
    Made in: 2007
  Basic Display Parameters & Features:
    Digital display
    Maximum image size: 33 cm x 21 cm
    Gamma: 2.20
    RGB color display
    First detailed timing is the preferred timing
  Color Characteristics:
    Red  : 0.5927, 0.3476
    Green: 0.3076, 0.5693
    Blue : 0.1552, 0.1289
    White: 0.3125, 0.3281
  Established Timings I & II: none
  Standard Timings: none
  Detailed Timing Descriptors:
    DTD 1:  1280x800    59.909545 Hz   8:5     49.306 kHz     71.000000 MHz (303 mm x 190 mm)
                 Hfront   48 Hsync  32 Hback   80 Hpol N
                 Vfront    3 Vsync   6 Vback   14 Vpol N
    Manufacturer-Specified Display Descriptor (0x0f): 00 0f 00 00 00 00 00 00 00 00 00 00 00 00 00 01 '................'
    Alphanumeric Data String: 'MINDTECH'
    Alphanumeric Data String: 'M141NWW1001  '
Checksum: 0x9a

----------------

Warnings:

Block 0, Base EDID:
  EDID Structure Version & Revision: EDID 1.1 is deprecated, do not use.
  Detailed Timing Descriptor #1: DTD is similar but not identical to DMT 0x1b.

Failures:

Block 0, Base EDID:
  Detailed Timing Descriptor #1: Mismatch of image size 303x190 mm vs display size 330x210 mm.
  Alphanumeric Data String: Non-printable character.
  Alphanumeric Data String: One or more trailing spaces.

EDID conformity: FAIL
