edid-decode (hex):

00 ff ff ff ff ff ff 00 06 af 3d 59 00 00 00 00
00 1c 01 04 a5 1f 11 78 03 84 55 a5 55 4a 9b 26
0f 50 54 00 00 00 01 01 01 01 01 01 01 01 01 01
01 01 01 01 01 01 b4 37 80 a0 70 38 3e 40 10 10
35 00 35 ae 10 00 00 18 23 25 80 a0 70 38 3e 40
10 10 35 00 35 ae 10 00 00 18 00 00 00 00 00 00
00 00 00 00 00 00 00 00 00 00 00 00 00 00 00 02
00 14 30 ff 12 3c c8 0a 06 14 c8 20 20 20 00 83

----------------

Block 0, Base EDID:
  EDID Structure Version & Revision: 1.4
  Vendor & Product Identification:
    Manufacturer: AUO
    Model: 22845
    Made in: 2018
  Basic Display Parameters & Features:
    Digital display
    Bits per primary color channel: 8
    DisplayPort interface
    Maximum image size: 31 cm x 17 cm
    Gamma: 2.20
    Supported color formats: RGB 4:4:4
    First detailed timing includes the native pixel format and preferred refresh rate
    Display is continuous frequency
  Color Characteristics:
    Red  : 0.6464, 0.3320
    Green: 0.2900, 0.6054
    Blue : 0.1494, 0.0595
    White: 0.3134, 0.3291
  Established Timings I & II: none
  Standard Timings: none
  Detailed Timing Descriptors:
    DTD 1:  1920x1080   60.033006 Hz  16:9     68.558 kHz    142.600000 MHz (309 mm x 174 mm)
                 Hfront   16 Hsync  16 Hback  128 Hpol N
                 Vfront    3 Vsync   5 Vback   54 Vpol N
    DTD 2:  1920x1080   40.023407 Hz  16:9     45.707 kHz     95.070000 MHz (309 mm x 174 mm)
                 Hfront   16 Hsync  16 Hback  128 Hpol N
                 Vfront    3 Vsync   5 Vback   54 Vpol N
    Empty Descriptor
    Manufacturer-Specified Display Descriptor (0x02): 00 02 00 14 30 ff 12 3c c8 0a 06 14 c8 20 20 20 '....0..<.....   '
Checksum: 0x83

----------------

Warnings:

Block 0, Base EDID:
  Missing Display Product Name.

Failures:

Block 0, Base EDID:
  Empty Descriptor: Use Dummy Descriptor instead of all zeroes.
  Missing Display Range Limits Descriptor.

EDID conformity: FAIL
