edid-decode (hex):

00 ff ff ff ff ff ff 00 0e 6f 04 13 00 00 00 00
01 1e 01 04 a5 1d 10 78 02 ef 2c af 4f 40 b3 27
0b 4e 54 00 00 00 01 01 01 01 01 01 01 01 01 01
01 01 01 01 01 01 36 36 80 a0 70 38 20 40 30 20
35 00 25 a5 10 00 00 1a 00 00 00 00 00 00 00 00
00 00 00 00 00 00 00 00 00 1a 00 00 00 fe 00 43
53 4f 54 54 33 0a 20 20 20 20 20 20 00 00 00 fe
00 4d 4e 31 33 33 31 42 41 32 2d 31 0a 20 00 c5

00 ff ff ff ff ff ff 00 0e 6f 04 13 00 00 00 00
01 1e 01 04 a5 1d 10 78 02 ef 2c af 4f 40 b3 27
0b 4e 54 00 00 00 01 01 01 01 01 01 01 01 01 01
01 01 01 01 01 01 36 36 80 a0 70 38 20 40 30 20
35 00 25 a5 10 00 00 1a 00 00 00 00 00 00 00 00
00 00 00 00 00 00 00 00 00 1a 00 00 00 fe 00 43
53 4f 54 54 33 0a 20 20 20 20 20 20 00 00 00 fe
00 4d 4e 31 33 33 31 42 41 32 2d 31 0a 20 00 c5

----------------

Block 0, Base EDID:
  EDID Structure Version & Revision: 1.4
  Vendor & Product Identification:
    Manufacturer: CSO
    Model: 4868
    Made in: week 1 of 2020
  Basic Display Parameters & Features:
    Digital display
    Bits per primary color channel: 8
    DisplayPort interface
    Maximum image size: 29 cm x 16 cm
    Gamma: 2.20
    Supported color formats: RGB 4:4:4
    First detailed timing includes the native pixel format and preferred refresh rate
  Color Characteristics:
    Red  : 0.6865, 0.3105
    Green: 0.2529, 0.7021
    Blue : 0.1523, 0.0449
    White: 0.3076, 0.3281
  Established Timings I & II: none
  Standard Timings: none
  Detailed Timing Descriptors:
    DTD 1:  1920x1080   60.001038 Hz  16:9     66.721 kHz    138.780000 MHz (293 mm x 165 mm)
                 Hfront   48 Hsync  32 Hback   80 Hpol P
                 Vfront    3 Vsync   5 Vback   24 Vpol N
    Manufacturer-Specified Display Descriptor (0x00): 00 00 00 00 00 00 00 00 00 00 00 00 00 00 00 1a '................'
    Alphanumeric Data String: 'CSOTT3'
    Alphanumeric Data String: 'MN1331BA2-1'
Checksum: 0xc5

----------------

Block 1, Unknown EDID Extension Block 0x00:
  00 ff ff ff ff ff ff 00 0e 6f 04 13 00 00 00 00 '.........o......'
  01 1e 01 04 a5 1d 10 78 02 ef 2c af 4f 40 b3 27 '.......x..,.O@.''
  0b 4e 54 00 00 00 01 01 01 01 01 01 01 01 01 01 '.NT.............'
  01 01 01 01 01 01 36 36 80 a0 70 38 20 40 30 20 '......66..p8 @0 '
  35 00 25 a5 10 00 00 1a 00 00 00 00 00 00 00 00 '5.%.............'
  00 00 00 00 00 00 00 00 00 1a 00 00 00 fe 00 43 '...............C'
  53 4f 54 54 33 0a 20 20 20 20 20 20 00 00 00 fe 'SOTT3.      ....'
  00 4d 4e 31 33 33 31 42 41 32 2d 31 0a 20 00 c5 '.MN1331BA2-1. ..'
Checksum: 0xc5

----------------

Warnings:

Block 0, Base EDID:
  Missing Display Product Name.

Failures:

Block 1, Base EDID:
  Unknown Extension Block.
EDID:
  Base EDID: EDID specified 0 extension block(s), but found 1 extension block(s).

EDID conformity: FAIL
