
EDID (hex):
00ffffffffffff0010acec414c584b42
271e0104a53420783eee95a3544c9926
0f5054a54b00714f8180a940d1c0d100
010101010101283c80a070b023403020
360006442100001e000000ff00315447
355731330a2020202020000000fc0044
454c4c205532343231450a20000000fd
00314c1e5311010a20202020202001ac
02031ff152900504030206071601141f
11121315202122230907078301000002
3a801871382d40582c45000644210000
1e011d8018711c1620582c2500064421
00009e011d007251d01e206e28550006
442100001e8c0ad08a20e02d10103e96
00064421000018000000000000000000
000000000000000000000000000000da

Extracted contents:
header:          00 ff ff ff ff ff ff 00
serial number:   10 ac ec 41 4c 58 4b 42 27 1e
version:         01 04
basic params:    a5 34 20 78 3e
chroma info:     ee 95 a3 54 4c 99 26 0f 50 54
established:     a5 4b 00
standard:        71 4f 81 80 a9 40 d1 c0 d1 00 01 01 01 01 01 01
descriptor 1:    28 3c 80 a0 70 b0 23 40 30 20 36 00 06 44 21 00 00 1e
descriptor 2:    00 00 00 ff 00 31 54 47 35 57 31 33 0a 20 20 20 20 20
descriptor 3:    00 00 00 fc 00 44 45 4c 4c 20 55 32 34 32 31 45 0a 20
descriptor 4:    00 00 00 fd 00 31 4c 1e 53 11 01 0a 20 20 20 20 20 20
extensions:      01
checksum:        ac

EDID version: 1.4
Manufacturer: DEL Model 41ec Serial Number --
Made in week 39 of 2020
Digital display
8 bits per primary color channel
DisplayPort interface
Maximum image size: 52 cm x 32 cm
Gamma: 2.20
DPMS levels: Off
Supported color formats: RGB 4:4:4, YCrCb 4:4:4, YCrCb 4:2:2
Default (sRGB) color space is primary color space
First detailed timing includes the native pixel format and preferred refresh rate
Display x,y Chromaticity:
  Red:   0.6396, 0.3300
  Green: 0.2998, 0.5996
  Blue:  0.1503, 0.0595
  White: 0.3134, 0.3291
Established timings supported:
  720x400@70Hz 9:5 HorFreq: 31469 Hz Clock: 28.320 MHz
  640x480@60Hz 4:3 HorFreq: 31469 Hz Clock: 25.175 MHz
  640x480@75Hz 4:3 HorFreq: 37500 Hz Clock: 31.500 MHz
  800x600@60Hz 4:3 HorFreq: 37900 Hz Clock: 40.000 MHz
  800x600@75Hz 4:3 HorFreq: 46900 Hz Clock: 49.500 MHz
  1024x768@60Hz 4:3 HorFreq: 48400 Hz Clock: 65.000 MHz
  1024x768@75Hz 4:3 HorFreq: 60000 Hz Clock: 78.750 MHz
  1280x1024@75Hz 5:4 HorFreq: 80000 Hz Clock: 135.000 MHz
Standard timings supported:
  1152x864@75Hz 4:3 HorFreq: 67500 Hz Clock: 108.000 MHz
  1280x1024@60Hz 5:4 HorFreq: 64000 Hz Clock: 108.000 MHz
  1600x1200@60Hz 4:3 HorFreq: 75000 Hz Clock: 162.000 MHz
  1920x1080@60Hz 16:9
  1920x1200@60Hz 16:10 HorFreq: 74000 Hz Clock: 154.000 MHz
Detailed mode: Clock 154.000 MHz, 518 mm x 324 mm
               1920 1968 2000 2080 hborder 0
               1200 1203 1209 1235 vborder 0
               +hsync +vsync 
               VertFreq: 59 Hz, HorFreq: 74038 Hz
Serial number: --
Monitor name: DELL U2421E
Monitor ranges (bare limits): 49-76Hz V, 30-83kHz H, max dotclock 170MHz
Has 1 extension blocks
Checksum: 0xac (valid)

CTA extension block
Extension version: 3
27 bytes of CTA data
  Video data block
    VIC  16 1920x1080@60Hz 16:9 (native) HorFreq: 67500 Hz Clock: 148.500 MHz
    VIC   5 1920x1080i@60Hz 16:9  HorFreq: 33750 Hz Clock: 74.250 MHz
    VIC   4 1280x720@60Hz 16:9  HorFreq: 45000 Hz Clock: 74.250 MHz
    VIC   3 720x480@60Hz 16:9  HorFreq: 31469 Hz Clock: 27.000 MHz
    VIC   2 720x480@60Hz 4:3  HorFreq: 31469 Hz Clock: 27.000 MHz
    VIC   6 1440x480i@60Hz 4:3  HorFreq: 15734 Hz Clock: 27.000 MHz
    VIC   7 1440x480i@60Hz 16:9  HorFreq: 15734 Hz Clock: 27.000 MHz
    VIC  22 1440x576i@50Hz 16:9  HorFreq: 15625 Hz Clock: 27.000 MHz
    VIC   1 640x480@60Hz 4:3  HorFreq: 31469 Hz Clock: 25.175 MHz
    VIC  20 1920x1080i@50Hz 16:9  HorFreq: 28125 Hz Clock: 74.250 MHz
    VIC  31 1920x1080@50Hz 16:9  HorFreq: 56250 Hz Clock: 148.500 MHz
    VIC  17 720x576@50Hz 4:3  HorFreq: 31250 Hz Clock: 27.000 MHz
    VIC  18 720x576@50Hz 16:9  HorFreq: 31250 Hz Clock: 27.000 MHz
    VIC  19 1280x720@50Hz 16:9  HorFreq: 37500 Hz Clock: 74.250 MHz
    VIC  21 1440x576i@50Hz 4:3  HorFreq: 15625 Hz Clock: 27.000 MHz
    VIC  32 1920x1080@24Hz 16:9  HorFreq: 27000 Hz Clock: 74.250 MHz
    VIC  33 1920x1080@25Hz 16:9  HorFreq: 28125 Hz Clock: 74.250 MHz
    VIC  34 1920x1080@30Hz 16:9  HorFreq: 33750 Hz Clock: 74.250 MHz
  Audio data block
    Linear PCM, max channels 2
      Supported sample rates (kHz): 48 44.1 32
      Supported sample sizes (bits): 24 20 16
  Speaker allocation data block
    Speaker map:
      FL/FR - Front Left/Right
Underscans PC formats by default
Basic audio support
Supports YCbCr 4:4:4
Supports YCbCr 4:2:2
1 native detailed modes
Detailed mode: Clock 148.500 MHz, 518 mm x 324 mm
               1920 2008 2052 2200 hborder 0
               1080 1084 1089 1125 vborder 0
               +hsync +vsync 
               VertFreq: 60 Hz, HorFreq: 67500 Hz
Detailed mode: Clock 74.250 MHz, 518 mm x 324 mm
               1920 2008 2052 2200 hborder 0
                540  542  547  562 vborder 0
               +hsync +vsync interlaced 
               VertFreq: 60 Hz, HorFreq: 33750 Hz
Detailed mode: Clock 74.250 MHz, 518 mm x 324 mm
               1280 1390 1430 1650 hborder 0
                720  725  730  750 vborder 0
               +hsync +vsync 
               VertFreq: 60 Hz, HorFreq: 45000 Hz
Detailed mode: Clock 27.000 MHz, 518 mm x 324 mm
                720  736  798  858 hborder 0
                480  489  495  525 vborder 0
               -hsync -vsync 
               VertFreq: 59 Hz, HorFreq: 31468 Hz
Checksum: 0xda (valid)

EDID block does NOT conform to EDID 1.4!
	sRGB is signaled, but the chromaticities do not match
Warning: One or more of the timings is out of range of the Monitor Ranges:
  Vertical Freq: 24 - 75 Hz
  Horizontal Freq: 15625 - 80000 Hz
  Maximum Clock: 162.000 MHz
EDID block does not conform at all!
	Both the serial number and the serial string are set
