edid-decode (hex):

00 ff ff ff ff ff ff 00 4c 83 56 31 00 00 00 00
00 19 01 04 95 26 15 78 ea fc d5 9e 55 55 9b 27
18 50 54 00 00 00 01 01 01 01 01 01 01 01 01 01
01 01 01 01 01 01 fc 2b 40 a2 61 84 1e 30 30 20
25 00 35 ae 10 00 00 19 00 00 00 0f 00 00 00 00
00 00 00 00 00 64 96 07 16 00 00 00 00 fe 00 53
41 4d 53 55 4e 47 0a 20 4c 83 4b 54 00 00 00 fe
00 4c 54 4e 31 37 33 4b 54 30 34 34 30 31 00 03

----------------

Block 0, Base EDID:
  EDID Structure Version & Revision: 1.4
  Vendor & Product Identification:
    Manufacturer: SDC
    Model: 12630
    Made in: 2015
  Basic Display Parameters & Features:
    Digital display
    Bits per primary color channel: 6
    DisplayPort interface
    Maximum image size: 38 cm x 21 cm
    Gamma: 2.20
    DPMS levels: Standby Suspend Off
    Supported color formats: RGB 4:4:4, YCrCb 4:4:4
    First detailed timing includes the native pixel format and preferred refresh rate
  Color Characteristics:
    Red  : 0.6201, 0.3349
    Green: 0.3349, 0.6054
    Blue : 0.1552, 0.0947
    White: 0.3134, 0.3291
  Established Timings I & II: none
  Standard Timings: none
  Detailed Timing Descriptors:
    DTD 1:  1600x900    59.997656 Hz  16:9     55.798 kHz    112.600000 MHz (309 mm x 174 mm)
                 Hfront   48 Hsync  32 Hback  338 Hpol N
                 Vfront    2 Vsync   5 Vback   23 Vpol N
    Manufacturer-Specified Display Descriptor (0x0f): 00 0f 00 00 00 00 00 00 00 00 00 64 96 07 16 00 '...........d....'
    Alphanumeric Data String: 'SAMSUNG'
    Alphanumeric Data String: 'LTN173KT04401'
Checksum: 0x03

----------------

Warnings:

Block 0, Base EDID:
  Missing Display Product Name.

Failures:

Block 0, Base EDID:
  Detailed Timing Descriptor #1: Mismatch of image size 309x174 mm vs display size 380x210 mm.
  Alphanumeric Data String: Non-space after newline.

EDID conformity: FAIL
