edid-decode (hex):

00 ff ff ff ff ff ff 00 30 e4 81 05 00 00 00 00
00 1b 01 04 a5 1d 11 78 ea 0e 35 a2 51 47 9d 27
0c 50 54 00 00 00 01 01 01 01 01 01 01 01 01 01
01 01 01 01 01 01 29 36 80 a0 70 38 1f 40 30 20
35 00 26 a5 10 00 00 1a 00 00 00 00 00 00 00 00
00 00 00 00 00 00 00 00 00 00 00 00 00 fe 00 4c
47 20 44 69 73 70 6c 61 79 0a 20 20 00 00 00 fe
00 4c 50 31 33 33 57 46 36 2d 53 50 42 32 00 fd

00 ff ff ff ff ff ff 00 30 e4 81 05 00 00 00 00
00 1b 01 04 a5 1d 11 78 ea 0e 35 a2 51 47 9d 27
0c 50 54 00 00 00 01 01 01 01 01 01 01 01 01 01
01 01 01 01 01 01 29 36 80 a0 70 38 1f 40 30 20
35 00 26 a5 10 00 00 1a 00 00 00 00 00 00 00 00
00 00 00 00 00 00 00 00 00 00 00 00 00 fe 00 4c
47 20 44 69 73 70 6c 61 79 0a 20 20 00 00 00 fe
00 4c 50 31 33 33 57 46 36 2d 53 50 42 32 00 fd

----------------

Block 0, Base EDID:
  EDID Structure Version & Revision: 1.4
  Vendor & Product Identification:
    Manufacturer: LGD
    Model: 1409
    Made in: 2017
  Basic Display Parameters & Features:
    Digital display
    Bits per primary color channel: 8
    DisplayPort interface
    Maximum image size: 29 cm x 17 cm
    Gamma: 2.20
    DPMS levels: Standby Suspend Off
    Supported color formats: RGB 4:4:4, YCrCb 4:4:4
    First detailed timing includes the native pixel format and preferred refresh rate
  Color Characteristics:
    Red  : 0.6328, 0.3164
    Green: 0.2802, 0.6152
    Blue : 0.1523, 0.0498
    White: 0.3134, 0.3291
  Established Timings I & II: none
  Standard Timings: none
  Detailed Timing Descriptors:
    DTD 1:  1920x1080   59.998788 Hz  16:9     66.659 kHz    138.650000 MHz (294 mm x 165 mm)
                 Hfront   48 Hsync  32 Hback   80 Hpol P
                 Vfront    3 Vsync   5 Vback   23 Vpol N
    Empty Descriptor
    Alphanumeric Data String: 'LG Display'
    Alphanumeric Data String: 'LP133WF6-SPB2'
Checksum: 0xfd

----------------

Block 1, Unknown EDID Extension Block 0x00:
  00 ff ff ff ff ff ff 00 30 e4 81 05 00 00 00 00 '........0.......'
  00 1b 01 04 a5 1d 11 78 ea 0e 35 a2 51 47 9d 27 '.......x..5.QG.''
  0c 50 54 00 00 00 01 01 01 01 01 01 01 01 01 01 '.PT.............'
  01 01 01 01 01 01 29 36 80 a0 70 38 1f 40 30 20 '......)6..p8.@0 '
  35 00 26 a5 10 00 00 1a 00 00 00 00 00 00 00 00 '5.&.............'
  00 00 00 00 00 00 00 00 00 00 00 00 00 fe 00 4c '...............L'
  47 20 44 69 73 70 6c 61 79 0a 20 20 00 00 00 fe 'G Display.  ....'
  00 4c 50 31 33 33 57 46 36 2d 53 50 42 32 00 fd '.LP133WF6-SPB2..'
Checksum: 0xfd

----------------

Warnings:

Block 0, Base EDID:
  Missing Display Product Name.

Failures:

Block 0, Base EDID:
  Empty Descriptor: Use Dummy Descriptor instead of all zeroes.
Block 1, Base EDID:
  Unknown Extension Block.
EDID:
  Base EDID: EDID specified 0 extension block(s), but found 1 extension block(s).

EDID conformity: FAIL
