
EDID (hex):
00ffffffffffff0006af5c2300000000
01180104901a0e78026bf59155549127
22505400000001010101010101010101
010101010101ce1d56e250001e302616
360000901000001ace1d567052001e30
2616360000901000001a000000fe0032
39364b43804231313658544e00000000
00004122960111000002010a20200017

Extracted contents:
header:          00 ff ff ff ff ff ff 00
serial number:   06 af 5c 23 00 00 00 00 01 18
version:         01 04
basic params:    90 1a 0e 78 02
chroma info:     6b f5 91 55 54 91 27 22 50 54
established:     00 00 00
standard:        01 01 01 01 01 01 01 01 01 01 01 01 01 01 01 01
descriptor 1:    ce 1d 56 e2 50 00 1e 30 26 16 36 00 00 90 10 00 00 1a
descriptor 2:    ce 1d 56 70 52 00 1e 30 26 16 36 00 00 90 10 00 00 1a
descriptor 3:    00 00 00 fe 00 32 39 36 4b 43 80 42 31 31 36 58 54 4e
descriptor 4:    00 00 00 00 00 00 41 22 96 01 11 00 00 02 01 0a 20 20
extensions:      00
checksum:        17

EDID version: 1.4
Manufacturer: AUO Model 235c Serial Number --
Made in week 1 of 2014
Digital display
6 bits per primary color channel
Digital interface is not defined
Maximum image size: 26 cm x 14 cm
Gamma: 2.20
Supported color formats: RGB 4:4:4
First detailed timing includes the native pixel format and preferred refresh rate
Display x,y Chromaticity:
  Red:   0.5673, 0.3339
  Green: 0.3300, 0.5693
  Blue:  0.1552, 0.1357
  White: 0.3134, 0.3291
Established timings supported:
Standard timings supported:
Detailed mode: Clock 76.300 MHz, 256 mm x 144 mm
               1366 1404 1426 1592 hborder 0
                768  771  777  798 vborder 0
               +hsync -vsync 
               VertFreq: 60 Hz, HorFreq: 47927 Hz
Detailed mode: Clock 76.300 MHz, 256 mm x 144 mm
               1366 1404 1426 1990 hborder 0
                768  771  777  798 vborder 0
               +hsync -vsync 
               VertFreq: 48 Hz, HorFreq: 38341 Hz
ASCII string: 296KC
Manufacturer-specified data, tag 0
Checksum: 0x17 (valid)
EDID block does NOT conform to EDID 1.4!
	Missing name descriptor
	Missing monitor ranges
	Detailed block string not properly terminated
