edid-decode (hex):

00 ff ff ff ff ff ff 00 4c a3 52 30 00 00 00 00
00 13 01 03 80 1b 10 78 0a 35 25 93 56 55 8e 29
1d 50 54 00 00 00 01 01 01 01 01 01 01 01 01 01
01 01 01 01 01 01 ab 1b 56 80 50 00 16 30 30 20
25 00 00 90 10 00 00 19 00 00 00 0f 00 00 00 00
00 00 00 00 00 1e b4 02 74 00 00 00 00 fe 00 53
41 4d 53 55 4e 47 0a 20 20 20 20 20 00 00 00 fe
00 31 31 36 41 54 30 31 2d 50 30 31 0a 20 00 20

----------------

Block 0, Base EDID:
  EDID Structure Version & Revision: 1.3
  Vendor & Product Identification:
    Manufacturer: SEC
    Model: 12370
    Made in: 2009
  Basic Display Parameters & Features:
    Digital display
    Maximum image size: 27 cm x 16 cm
    Gamma: 2.20
    RGB color display
    First detailed timing is preferred timing
  Color Characteristics:
    Red  : 0.5742, 0.3388
    Green: 0.3330, 0.5556
    Blue : 0.1601, 0.1152
    White: 0.3134, 0.3291
  Established Timings I & II: none
  Standard Timings: none
  Detailed Timing Descriptors:
    DTD 1:  1366x768    60.012 Hz 683:384  47.410 kHz  70.830 MHz (256 mm x 144 mm)
                 Hfront   48 Hsync  32 Hback  48 Hpol N
                 Vfront    2 Vsync   5 Vback  15 Vpol N
    Manufacturer-Specified Display Descriptor (0x0f): 00 0f 00 00 00 00 00 00 00 00 00 1e b4 02 74 00 '..............t.'
    Alphanumeric Data String: 'SAMSUNG'
    Alphanumeric Data String: '116AT01-P01'
Checksum: 0x20

----------------

Failures:

Block 0, Base EDID:
  Detailed Timing Descriptor #1: Mismatch of image size 256x144 mm vs display size 270x160 mm.
  Missing Display Product Name.
  Missing Display Range Limits Descriptor.

EDID conformity: FAIL
