edid-decode (hex):

00 ff ff ff ff ff ff 00 1e 6d 01 59 75 38 07 00
03 17 01 03 80 33 1d 78 ea 62 75 a3 55 4f a0 27
12 50 54 21 08 00 71 40 81 c0 81 00 81 80 95 00
90 40 a9 c0 b3 00 02 3a 80 18 71 38 2d 40 58 2c
45 00 fe 22 11 00 00 1e 00 00 00 fd 00 38 3d 1e
53 0f 00 0a 20 20 20 20 20 20 00 00 00 fc 00 49
50 53 32 33 37 0a 20 20 20 20 20 20 00 00 00 ff
00 0a 20 20 20 20 20 20 20 20 20 20 20 20 01 ce

02 03 21 c1 49 90 1f 05 14 13 04 03 02 01 23 09
07 07 83 01 00 00 67 03 0c 00 00 00 00 1e e2 00
0f 01 1d 80 18 71 1c 16 20 58 2c 25 00 c4 8e 21
00 00 9e 00 00 00 00 00 00 00 00 00 00 00 00 00
00 00 00 00 00 00 00 00 00 00 00 00 00 00 00 00
00 00 00 00 00 00 00 00 00 00 00 00 00 00 00 00
00 00 00 00 00 00 00 00 00 00 00 00 00 00 00 00
00 00 00 00 00 00 00 00 00 00 00 00 00 00 00 75

00 ff ff ff ff ff ff 00 1e 6d 01 59 75 38 07 00
03 17 01 03 80 33 1d 78 ea 62 75 a3 55 4f a0 27
12 50 54 21 08 00 71 40 81 c0 81 00 81 80 95 00
90 40 a9 c0 b3 00 02 3a 80 18 71 38 2d 40 58 2c
45 00 fe 22 11 00 00 1e 00 00 00 fd 00 38 3d 1e
53 0f 00 0a 20 20 20 20 20 20 00 00 00 fc 00 49
50 53 32 33 37 0a 20 20 20 20 20 20 00 00 00 ff
00 0a 20 20 20 20 20 20 20 20 20 20 20 20 01 ce

02 03 21 c1 49 90 1f 05 14 13 04 03 02 01 23 09
07 07 83 01 00 00 67 03 0c 00 00 00 00 1e e2 00
0f 01 1d 80 18 71 1c 16 20 58 2c 25 00 c4 8e 21
00 00 9e 00 00 00 00 00 00 00 00 00 00 00 00 00
00 00 00 00 00 00 00 00 00 00 00 00 00 00 00 00
00 00 00 00 00 00 00 00 00 00 00 00 00 00 00 00
00 00 00 00 00 00 00 00 00 00 00 00 00 00 00 00
00 00 00 00 00 00 00 00 00 00 00 00 00 00 00 75

----------------

Block 0, Base EDID:
  EDID Structure Version & Revision: 1.3
  Vendor & Product Identification:
    Manufacturer: GSM
    Model: 22785
    Serial Number: ...
    Made in: week 3 of 2013
  Basic Display Parameters & Features:
    Digital display
    Maximum image size: 51 cm x 29 cm
    Gamma: 2.20
    DPMS levels: Standby Suspend Off
    RGB color display
    First detailed timing is the preferred timing
  Color Characteristics:
    Red  : 0.6376, 0.3339
    Green: 0.3085, 0.6269
    Blue : 0.1533, 0.0732
    White: 0.3134, 0.3291
  Established Timings I & II:
    DMT 0x04:   640x480    59.940476 Hz   4:3     31.469 kHz     25.175000 MHz
    DMT 0x09:   800x600    60.316541 Hz   4:3     37.879 kHz     40.000000 MHz
    DMT 0x10:  1024x768    60.003840 Hz   4:3     48.363 kHz     65.000000 MHz
  Standard Timings:
    GTF     :  1152x864    60.000000 Hz   4:3     53.700 kHz     81.624000 MHz
    DMT 0x55:  1280x720    60.000000 Hz  16:9     45.000 kHz     74.250000 MHz
    DMT 0x1c:  1280x800    59.810326 Hz  16:10    49.702 kHz     83.500000 MHz
    DMT 0x23:  1280x1024   60.019740 Hz   5:4     63.981 kHz    108.000000 MHz
    DMT 0x2f:  1440x900    59.887445 Hz  16:10    55.935 kHz    106.500000 MHz
    DMT 0x2a:  1400x1050   59.978442 Hz   4:3     65.317 kHz    121.750000 MHz
    DMT 0x53:  1600x900    60.000000 Hz  16:9     60.000 kHz    108.000000 MHz (RB)
    DMT 0x3a:  1680x1050   59.954250 Hz  16:10    65.290 kHz    146.250000 MHz
  Detailed Timing Descriptors:
    DTD 1:  1920x1080   60.000000 Hz  16:9     67.500 kHz    148.500000 MHz (510 mm x 290 mm)
                 Hfront   88 Hsync  44 Hback  148 Hpol P
                 Vfront    4 Vsync   5 Vback   36 Vpol P
    Display Range Limits:
      Monitor ranges (GTF): 56-61 Hz V, 30-83 kHz H, max dotclock 150 MHz
    Display Product Name: 'IPS237'
    Display Product Serial Number: ...
  Extension blocks: 1
Checksum: 0xce

----------------

Block 1, CTA-861 Extension Block:
  Revision: 3
  Underscans IT Video Formats by default
  Basic audio support
  Native detailed modes: 1
  Video Data Block:
    VIC  16:  1920x1080   60.000000 Hz  16:9     67.500 kHz    148.500000 MHz (native)
    VIC  31:  1920x1080   50.000000 Hz  16:9     56.250 kHz    148.500000 MHz
    VIC   5:  1920x1080i  60.000000 Hz  16:9     33.750 kHz     74.250000 MHz
    VIC  20:  1920x1080i  50.000000 Hz  16:9     28.125 kHz     74.250000 MHz
    VIC  19:  1280x720    50.000000 Hz  16:9     37.500 kHz     74.250000 MHz
    VIC   4:  1280x720    60.000000 Hz  16:9     45.000 kHz     74.250000 MHz
    VIC   3:   720x480    59.940060 Hz  16:9     31.469 kHz     27.000000 MHz
    VIC   2:   720x480    59.940060 Hz   4:3     31.469 kHz     27.000000 MHz
    VIC   1:   640x480    59.940476 Hz   4:3     31.469 kHz     25.175000 MHz
  Audio Data Block:
    Linear PCM:
      Max channels: 2
      Supported sample rates (kHz): 48 44.1 32
      Supported sample sizes (bits): 24 20 16
  Speaker Allocation Data Block:
    FL/FR - Front Left/Right
  Vendor-Specific Data Block (HDMI), OUI 00-0C-03:
    Source physical address: 0.0.0.0
    Maximum TMDS clock: 150 MHz
  Video Capability Data Block:
    YCbCr quantization: No Data
    RGB quantization: No Data
    PT scan behavior: No Data
    IT scan behavior: Supports both over- and underscan
    CE scan behavior: Supports both over- and underscan
  Detailed Timing Descriptors:
    DTD 2:  1920x1080i  60.000000 Hz  16:9     33.750 kHz     74.250000 MHz (708 mm x 398 mm)
                 Hfront   88 Hsync  44 Hback  148 Hpol P
                 Vfront    2 Vsync   5 Vback   15 Vpol P Vfront +0.5 Odd Field
                 Vfront    2 Vsync   5 Vback   15 Vpol P Vback  +0.5 Even Field
Checksum: 0x75  Unused space in Extension Block: 76 bytes

----------------

Block 2, Unknown EDID Extension Block 0x00:
  00 ff ff ff ff ff ff 00 1e 6d 01 59 75 38 07 00 '.........m.Yu8..'
  03 17 01 03 80 33 1d 78 ea 62 75 a3 55 4f a0 27 '.....3.x.bu.UO.''
  12 50 54 21 08 00 71 40 81 c0 81 00 81 80 95 00 '.PT!..q@........'
  90 40 a9 c0 b3 00 02 3a 80 18 71 38 2d 40 58 2c '.@.....:..q8-@X,'
  45 00 fe 22 11 00 00 1e 00 00 00 fd 00 38 3d 1e 'E..".........8=.'
  53 0f 00 0a 20 20 20 20 20 20 00 00 00 fc 00 49 'S...      .....I'
  50 53 32 33 37 0a 20 20 20 20 20 20 00 00 00 ff 'PS237.      ....'
  00 0a 20 20 20 20 20 20 20 20 20 20 20 20 01 ce '..            ..'
Checksum: 0xce

----------------

Block 3, CTA-861 Extension Block:
  Revision: 3
  Underscans IT Video Formats by default
  Basic audio support
  Native detailed modes: 1
  Video Data Block:
    VIC  16:  1920x1080   60.000000 Hz  16:9     67.500 kHz    148.500000 MHz (native)
    VIC  31:  1920x1080   50.000000 Hz  16:9     56.250 kHz    148.500000 MHz
    VIC   5:  1920x1080i  60.000000 Hz  16:9     33.750 kHz     74.250000 MHz
    VIC  20:  1920x1080i  50.000000 Hz  16:9     28.125 kHz     74.250000 MHz
    VIC  19:  1280x720    50.000000 Hz  16:9     37.500 kHz     74.250000 MHz
    VIC   4:  1280x720    60.000000 Hz  16:9     45.000 kHz     74.250000 MHz
    VIC   3:   720x480    59.940060 Hz  16:9     31.469 kHz     27.000000 MHz
    VIC   2:   720x480    59.940060 Hz   4:3     31.469 kHz     27.000000 MHz
    VIC   1:   640x480    59.940476 Hz   4:3     31.469 kHz     25.175000 MHz
  Audio Data Block:
    Linear PCM:
      Max channels: 2
      Supported sample rates (kHz): 48 44.1 32
      Supported sample sizes (bits): 24 20 16
  Speaker Allocation Data Block:
    FL/FR - Front Left/Right
  Vendor-Specific Data Block (HDMI), OUI 00-0C-03:
    Source physical address: 0.0.0.0
    Maximum TMDS clock: 150 MHz
  Video Capability Data Block:
    YCbCr quantization: No Data
    RGB quantization: No Data
    PT scan behavior: No Data
    IT scan behavior: Supports both over- and underscan
    CE scan behavior: Supports both over- and underscan
  Detailed Timing Descriptors:
    DTD 3:  1920x1080i  60.000000 Hz  16:9     33.750 kHz     74.250000 MHz (708 mm x 398 mm)
                 Hfront   88 Hsync  44 Hback  148 Hpol P
                 Vfront    2 Vsync   5 Vback   15 Vpol P Vfront +0.5 Odd Field
                 Vfront    2 Vsync   5 Vback   15 Vpol P Vback  +0.5 Even Field
Checksum: 0x75  Unused space in Extension Block: 76 bytes

----------------

Warnings:

Block 1, CTA-861 Extension Block:
  Display Product Serial Number is set, so the Serial Number in the Base EDID should be 0.
  Add a Colorimetry Data Block with the sRGB colorimetry bit set to avoid interop issues.
Block 3, CTA-861 Extension Block:
  Display Product Serial Number is set, so the Serial Number in the Base EDID should be 0.
  Add a Colorimetry Data Block with the sRGB colorimetry bit set to avoid interop issues.
EDID:
  CTA-861: Multiple native progressive timings are defined.

Failures:

Block 0, Base EDID:
  Display Product Serial Number: ...
Block 1, CTA-861 Extension Block:
  Video Capability Data Block: Set Selectable RGB Quantization to avoid interop issues.
  Detailed Timing Descriptor #2: Mismatch of image size 708x398 mm vs display size 510x290 mm.
Block 2, Base EDID:
  Unknown Extension Block.
Block 3, CTA-861 Extension Block:
  Video Data Block: Duplicate VIC 16.
  Video Data Block: Duplicate VIC 31.
  Video Data Block: Duplicate VIC 5.
  Video Data Block: Duplicate VIC 20.
  Video Data Block: Duplicate VIC 19.
  Video Data Block: Duplicate VIC 4.
  Video Data Block: Duplicate VIC 3.
  Video Data Block: Duplicate VIC 2.
  Video Data Block: Duplicate VIC 1.
  Speaker Allocation Data Block: Only one instance of this Data Block is allowed.
  Video Capability Data Block: Only one instance of this Data Block is allowed.
  Video Capability Data Block: Set Selectable RGB Quantization to avoid interop issues.
  Detailed Timing Descriptor #3: Mismatch of image size 708x398 mm vs display size 510x290 mm.
EDID:
  Base EDID: Some timings are out of range of the Monitor Ranges:
    Vertical Freq: 50.000 - 60.317 Hz (Monitor: 56.000 - 61.000 Hz)
    Horizontal Freq: 28.125 - 67.500 kHz (Monitor: 30.000 - 83.000 kHz)
  Base EDID: The DTD max image size is 708x398mm, which is larger than the display size 510.0x290.0mm.
  Base EDID: EDID specified 1 extension block(s), but found 3 extension block(s).
  Base EDID: EDID 1.3 requires a Block Map Extension in Block 1 if there are more than 2 blocks in the EDID.

EDID conformity: FAIL
