
EDID (hex):
00ffffffffffff0009e55f0700000000
051b0104a51d11780a5390a658549f26
0e505400000001010101010101010101
010101010101bc398018713828403020
360026a51000001a0000000000000000
0000000000000000001a000000fe0042
4f452043510a202020202020000000fe
004e5631333346484d2d4e35410a00e8

Extracted contents:
header:          00 ff ff ff ff ff ff 00
serial number:   09 e5 5f 07 00 00 00 00 05 1b
version:         01 04
basic params:    a5 1d 11 78 0a
chroma info:     53 90 a6 58 54 9f 26 0e 50 54
established:     00 00 00
standard:        01 01 01 01 01 01 01 01 01 01 01 01 01 01 01 01
descriptor 1:    bc 39 80 18 71 38 28 40 30 20 36 00 26 a5 10 00 00 1a
descriptor 2:    00 00 00 00 00 00 00 00 00 00 00 00 00 00 00 00 00 1a
descriptor 3:    00 00 00 fe 00 42 4f 45 20 43 51 0a 20 20 20 20 20 20
descriptor 4:    00 00 00 fe 00 4e 56 31 33 33 46 48 4d 2d 4e 35 41 0a
extensions:      00
checksum:        e8

EDID version: 1.4
Manufacturer: BOE Model 75f Serial Number --
Made in week 5 of 2017
Digital display
8 bits per primary color channel
DisplayPort interface
Maximum image size: 29 cm x 17 cm
Gamma: 2.20
Supported color formats: RGB 4:4:4, YCrCb 4:4:4
First detailed timing includes the native pixel format and preferred refresh rate
Display x,y Chromaticity:
  Red:   0.6494, 0.3447
  Green: 0.3281, 0.6240
  Blue:  0.1503, 0.0556
  White: 0.3125, 0.3281
Established timings supported:
Standard timings supported:
Detailed mode: Clock 147.800 MHz, 294 mm x 165 mm
               1920 1968 2000 2200 hborder 0
               1080 1083 1089 1120 vborder 0
               +hsync -vsync 
               VertFreq: 59 Hz, HorFreq: 67181 Hz
Manufacturer-specified data, tag 0
ASCII string: BOE CQ
ASCII string: NV133FHM-N5A
Checksum: 0xe8 (valid)
EDID block does NOT conform to EDID 1.4!
	Missing name descriptor
	Missing monitor ranges
