
EDID (hex):
00ffffffffffff004c2e2d9539593f1e
0a170103802f1c782a3581a656489a24
125054afcf008100814081809500a940
b30001010101023a801871382d40582c
4500dd0c1100001e2f2640a060841a30
30203500bbf91000001c000000fd0038
4c1f5311000a202020202020000000fc
004c4544204d4f4e49544f520a200041

Extracted contents:
header:          00 ff ff ff ff ff ff 00
serial number:   4c 2e 2d 95 39 59 3f 1e 0a 17
version:         01 03
basic params:    80 2f 1c 78 2a
chroma info:     35 81 a6 56 48 9a 24 12 50 54
established:     af cf 00
standard:        81 00 81 40 81 80 95 00 a9 40 b3 00 01 01 01 01
descriptor 1:    02 3a 80 18 71 38 2d 40 58 2c 45 00 dd 0c 11 00 00 1e
descriptor 2:    2f 26 40 a0 60 84 1a 30 30 20 35 00 bb f9 10 00 00 1c
descriptor 3:    00 00 00 fd 00 38 4c 1f 53 11 00 0a 20 20 20 20 20 20
descriptor 4:    00 00 00 fc 00 4c 45 44 20 4d 4f 4e 49 54 4f 52 0a 20
extensions:      00
checksum:        41

EDID version: 1.3
Manufacturer: SAN Model 952d Serial Number --
Made in week 10 of 2013
Digital display
Maximum image size: 47 cm x 28 cm
Gamma: 2.20
DPMS levels: Off
RGB color display
First detailed timing is preferred timing
Display x,y Chromaticity:
  Red:   0.6484, 0.3388
  Green: 0.2822, 0.6025
  Blue:  0.1425, 0.0703
  White: 0.3125, 0.3291
Established timings supported:
  720x400@70Hz 9:5 HorFreq: 31469 Hz Clock: 28.320 MHz
  640x480@60Hz 4:3 HorFreq: 31469 Hz Clock: 25.175 MHz
  640x480@72Hz 4:3 HorFreq: 37900 Hz Clock: 31.500 MHz
  640x480@75Hz 4:3 HorFreq: 37500 Hz Clock: 31.500 MHz
  800x600@56Hz 4:3 HorFreq: 35200 Hz Clock: 36.000 MHz
  800x600@60Hz 4:3 HorFreq: 37900 Hz Clock: 40.000 MHz
  800x600@72Hz 4:3 HorFreq: 48100 Hz Clock: 50.000 MHz
  800x600@75Hz 4:3 HorFreq: 46900 Hz Clock: 49.500 MHz
  1024x768@60Hz 4:3 HorFreq: 48400 Hz Clock: 65.000 MHz
  1024x768@70Hz 4:3 HorFreq: 56500 Hz Clock: 75.000 MHz
  1024x768@75Hz 4:3 HorFreq: 60000 Hz Clock: 78.750 MHz
  1280x1024@75Hz 5:4 HorFreq: 80000 Hz Clock: 135.000 MHz
Standard timings supported:
  1280x800@60Hz 16:10
  1280x960@60Hz 4:3 HorFreq: 60000 Hz Clock: 108.000 MHz
  1280x1024@60Hz 5:4 HorFreq: 64000 Hz Clock: 108.000 MHz
  1440x900@60Hz 16:10 HorFreq: 55500 Hz Clock: 88.750 MHz
  1600x1200@60Hz 4:3 HorFreq: 75000 Hz Clock: 162.000 MHz
  1680x1050@60Hz 16:10 HorFreq: 64700 Hz Clock: 119.000 MHz
Detailed mode: Clock 148.500 MHz, 477 mm x 268 mm
               1920 2008 2052 2200 hborder 0
               1080 1084 1089 1125 vborder 0
               +hsync +vsync 
               VertFreq: 60 Hz, HorFreq: 67500 Hz
Detailed mode: Clock 97.750 MHz, 443 mm x 249 mm
               1600 1648 1680 1760 hborder 0
                900  903  908  926 vborder 0
               -hsync +vsync 
               VertFreq: 59 Hz, HorFreq: 55539 Hz
Monitor ranges (GTF): 56-76Hz V, 31-83kHz H, max dotclock 170MHz
Monitor name: LED MONITOR
Checksum: 0x41 (valid)
