
EDID (hex):
00ffffffffffff001ef9d70601010101
2a10010368221b78ea5a65a35a479a24
115054afcf0001010101010101018180
000000000000302a009851002a403070
1300510e1100001e000000fc00465044
313736300a2020202020000000fd0038
4c1e500e000a202020202020000000ff
004c36412035304e2030343733360010

Extracted contents:
header:          00 ff ff ff ff ff ff 00
serial number:   1e f9 d7 06 01 01 01 01 2a 10
version:         01 03
basic params:    68 22 1b 78 ea
chroma info:     5a 65 a3 5a 47 9a 24 11 50 54
established:     af cf 00
standard:        01 01 01 01 01 01 01 01 81 80 00 00 00 00 00 00
descriptor 1:    30 2a 00 98 51 00 2a 40 30 70 13 00 51 0e 11 00 00 1e
descriptor 2:    00 00 00 fc 00 46 50 44 31 37 36 30 0a 20 20 20 20 20
descriptor 3:    00 00 00 fd 00 38 4c 1e 50 0e 00 0a 20 20 20 20 20 20
descriptor 4:    00 00 00 ff 00 4c 36 41 20 35 30 4e 20 30 34 37 33 36
extensions:      00
checksum:        10

EDID version: 1.3
Manufacturer: GWY Model 6d7 Serial Number --
Made in week 42 of 2006
Analog display, Input voltage level: 0.7/0.7 V
Sync: Separate 
Maximum image size: 34 cm x 27 cm
Gamma: 2.20
DPMS levels: Standby Suspend Off
RGB color display
First detailed timing is preferred timing
Display x,y Chromaticity:
  Red:   0.6376, 0.3525
  Green: 0.2792, 0.6035
  Blue:  0.1416, 0.0683
  White: 0.3134, 0.3291
Established timings supported:
  720x400@70Hz 9:5 HorFreq: 31469 Hz Clock: 28.320 MHz
  640x480@60Hz 4:3 HorFreq: 31469 Hz Clock: 25.175 MHz
  640x480@72Hz 4:3 HorFreq: 37900 Hz Clock: 31.500 MHz
  640x480@75Hz 4:3 HorFreq: 37500 Hz Clock: 31.500 MHz
  800x600@56Hz 4:3 HorFreq: 35200 Hz Clock: 36.000 MHz
  800x600@60Hz 4:3 HorFreq: 37900 Hz Clock: 40.000 MHz
  800x600@72Hz 4:3 HorFreq: 48100 Hz Clock: 50.000 MHz
  800x600@75Hz 4:3 HorFreq: 46900 Hz Clock: 49.500 MHz
  1024x768@60Hz 4:3 HorFreq: 48400 Hz Clock: 65.000 MHz
  1024x768@70Hz 4:3 HorFreq: 56500 Hz Clock: 75.000 MHz
  1024x768@75Hz 4:3 HorFreq: 60000 Hz Clock: 78.750 MHz
  1280x1024@75Hz 5:4 HorFreq: 80000 Hz Clock: 135.000 MHz
Standard timings supported:
  1280x1024@60Hz 5:4 HorFreq: 64000 Hz Clock: 108.000 MHz
non-conformant standard timing (0 horiz)
non-conformant standard timing (0 horiz)
non-conformant standard timing (0 horiz)
Detailed mode: Clock 108.000 MHz, 337 mm x 270 mm
               1280 1328 1440 1688 hborder 0
               1024 1025 1028 1066 vborder 0
               +hsync +vsync 
               VertFreq: 60 Hz, HorFreq: 63981 Hz
Monitor name: FPD1760
Monitor ranges (GTF): 56-76Hz V, 30-80kHz H, max dotclock 140MHz
Serial number: -- 50N 04736
Checksum: 0x10 (valid)
