edid-decode (hex):

00 ff ff ff ff ff ff 00 4c 83 48 85 00 00 00 00
00 19 01 04 a5 1b 0f 78 0a ab f5 99 59 54 90 27
1e 50 54 00 00 00 01 01 01 01 01 01 01 01 01 01
01 01 01 01 01 01 60 39 80 dc 70 38 40 40 30 20
25 00 14 9b 10 00 00 1a e7 2d 80 dc 70 38 40 40
30 20 25 00 58 c2 10 00 00 1a 00 00 00 fe 00 34
4e 38 37 52 80 31 32 35 48 4c 0a 20 00 00 00 00
00 01 41 21 9e 00 10 00 00 0a 01 0a 20 20 00 53

----------------

Block 0, Base EDID:
  EDID Structure Version & Revision: 1.4
  Vendor & Product Identification:
    Manufacturer: SDC
    Model: 34120
    Made in: 2015
  Basic Display Parameters & Features:
    Digital display
    Bits per primary color channel: 8
    DisplayPort interface
    Maximum image size: 27 cm x 15 cm
    Gamma: 2.20
    Supported color formats: RGB 4:4:4, YCrCb 4:4:4
    First detailed timing includes the native pixel format and preferred refresh rate
  Color Characteristics:
    Red  : 0.5996, 0.3496
    Green: 0.3300, 0.5654
    Blue : 0.1552, 0.1201
    White: 0.3134, 0.3291
  Established Timings I & II: none
  Standard Timings: none
  Detailed Timing Descriptors:
    DTD 1:  1920x1080   59.996079 Hz  16:9     68.636 kHz    146.880000 MHz (276 mm x 155 mm)
                 Hfront   48 Hsync  32 Hback  140 Hpol P
                 Vfront    2 Vsync   5 Vback   57 Vpol N
    DTD 2:  1920x1080   47.999314 Hz  16:9     54.911 kHz    117.510000 MHz (344 mm x 194 mm)
                 Hfront   48 Hsync  32 Hback  140 Hpol P
                 Vfront    2 Vsync   5 Vback   57 Vpol N
    Alphanumeric Data String: '4N87R'
    Manufacturer-Specified Display Descriptor (0x00): 00 00 00 01 41 21 9e 00 10 00 00 0a 01 0a 20 20 '....A!........  '
Checksum: 0x53

----------------

Warnings:

Block 0, Base EDID:
  Missing Display Product Name.

Failures:

Block 0, Base EDID:
  Detailed Timing Descriptor #2: Mismatch of image size 344x194 mm vs display size 270x150 mm.
  Alphanumeric Data String: Non-printable character.
EDID:
  Base EDID: The DTD max image size is 344x194mm, which is larger than the display size 270.0x150.0mm.

EDID conformity: FAIL
