
EDID (hex):
00ffffffffffff0026cd4846eb230000
050c010308221b782a5a41a15b4b8d24
185153bfef0001010101010101010101
010101010101bc34009851002a401090
1300540e11000018000000ff00313530
37334b32313039313935000000fd0037
4b18500d000a202020202020000000fc
0041533433313455540a2020200a0001

edid-decode (hex):

00 ff ff ff ff ff ff 00 26 cd 48 46 eb 23 00 00
05 0c 01 03 08 22 1b 78 2a 5a 41 a1 5b 4b 8d 24
18 51 53 bf ef 00 01 01 01 01 01 01 01 01 01 01
01 01 01 01 01 01 bc 34 00 98 51 00 2a 40 10 90
13 00 54 0e 11 00 00 18 00 00 00 ff 00 31 35 30
37 33 4b 32 31 30 39 31 39 35 00 00 00 fd 00 37
4b 18 50 0d 00 0a 20 20 20 20 20 20 00 00 00 fc
00 41 53 34 33 31 34 55 54 0a 20 20 20 0a 00 01

----------------

Block 0, Base EDID:
  EDID Structure Version & Revision: 1.3
  Vendor & Product Identification:
    Manufacturer: IVM
    Model: 17992
    Serial Number: 9195
    Made in: week 5 of 2002
  Basic Display Parameters & Features:
    Analog display
    Signal Level Standard: 0.700 : 0.300 : 1.000 V p-p
    Blank level equals black level
    Sync: Separate
    Maximum image size: 34 cm x 27 cm
    Gamma: 2.20
    DPMS levels: Off
    RGB color display
    First detailed timing is the preferred timing
  Color Characteristics:
    Red  : 0.6298, 0.3564
    Green: 0.2949, 0.5527
    Blue : 0.1416, 0.0937
    White: 0.3164, 0.3251
  Established Timings I & II:
    IBM     :   720x400    70.081663 Hz   9:5     31.467 kHz     28.320000 MHz
    DMT 0x04:   640x480    59.940476 Hz   4:3     31.469 kHz     25.175000 MHz
    Apple   :   640x480    66.666667 Hz   4:3     35.000 kHz     30.240000 MHz
    DMT 0x05:   640x480    72.808802 Hz   4:3     37.861 kHz     31.500000 MHz
    DMT 0x06:   640x480    75.000000 Hz   4:3     37.500 kHz     31.500000 MHz
    DMT 0x08:   800x600    56.250000 Hz   4:3     35.156 kHz     36.000000 MHz
    DMT 0x09:   800x600    60.316541 Hz   4:3     37.879 kHz     40.000000 MHz
    DMT 0x0a:   800x600    72.187572 Hz   4:3     48.077 kHz     50.000000 MHz
    DMT 0x0b:   800x600    75.000000 Hz   4:3     46.875 kHz     49.500000 MHz
    Apple   :   832x624    74.551266 Hz   4:3     49.726 kHz     57.284000 MHz
    DMT 0x10:  1024x768    60.003840 Hz   4:3     48.363 kHz     65.000000 MHz
    DMT 0x11:  1024x768    70.069359 Hz   4:3     56.476 kHz     75.000000 MHz
    DMT 0x12:  1024x768    75.028582 Hz   4:3     60.023 kHz     78.750000 MHz
    DMT 0x24:  1280x1024   75.024675 Hz   5:4     79.976 kHz    135.000000 MHz
  Standard Timings: none
  Detailed Timing Descriptors:
    DTD 1:  1280x1024   75.024675 Hz   5:4     79.976 kHz    135.000000 MHz (340 mm x 270 mm)
                 Hfront   16 Hsync 144 Hback  248 Hpol N
                 Vfront    1 Vsync   3 Vback   38 Vpol N
    Display Product Serial Number: '15073K2109195'
    Display Range Limits:
      Monitor ranges (GTF): 55-75 Hz V, 24-80 kHz H, max dotclock 130 MHz
    Display Product Name: 'AS4314UT'
Checksum: 0x01
