
EDID (hex):
00ffffffffffff003674000000000000
02190103808048780adaffa3584aa229
17494b21080031404540614081800101
01010101010108e80030f2705a80b058
8a00ba882100001e023a801871382d40
582c4500ba882100001e000000fc0053
574544582054560a20202020000000fd
003b461f8c3c000a2020202020200168
020349f05c9001020304055d5e5f6061
626364656606071112131415161f2021
222309070177030c001000b84420006a
0103040000000000000000000067d85d
c401788000e30f00c600000000000000
00000000000000000000000000000000
00000000000000000000000000000000
0000000000000000000000000000008b

Extracted contents:
header:          00 ff ff ff ff ff ff 00
serial number:   36 74 00 00 00 00 00 00 02 19
version:         01 03
basic params:    80 80 48 78 0a
chroma info:     da ff a3 58 4a a2 29 17 49 4b
established:     21 08 00
standard:        31 40 45 40 61 40 81 80 01 01 01 01 01 01 01 01
descriptor 1:    08 e8 00 30 f2 70 5a 80 b0 58 8a 00 ba 88 21 00 00 1e
descriptor 2:    02 3a 80 18 71 38 2d 40 58 2c 45 00 ba 88 21 00 00 1e
descriptor 3:    00 00 00 fc 00 53 57 45 44 58 20 54 56 0a 20 20 20 20
descriptor 4:    00 00 00 fd 00 3b 46 1f 8c 3c 00 0a 20 20 20 20 20 20
extensions:      01
checksum:        68

EDID version: 1.3
Manufacturer: MST Model 0 Serial Number --
Made in week 2 of 2015
Digital display
Maximum image size: 128 cm x 72 cm
Gamma: 2.20
RGB color display
First detailed timing is preferred timing
Display x,y Chromaticity:
  Red:   0.6396, 0.3447
  Green: 0.2910, 0.6347
  Blue:  0.1630, 0.0927
  White: 0.2880, 0.2958
Established timings supported:
  640x480@60Hz 4:3 HorFreq: 31469 Hz Clock: 25.175 MHz
  800x600@60Hz 4:3 HorFreq: 37900 Hz Clock: 40.000 MHz
  1024x768@60Hz 4:3 HorFreq: 48400 Hz Clock: 65.000 MHz
Standard timings supported:
  640x480@60Hz 4:3 HorFreq: 31469 Hz Clock: 25.175 MHz
  800x600@60Hz 4:3 HorFreq: 37900 Hz Clock: 40.000 MHz
  1024x768@60Hz 4:3 HorFreq: 48400 Hz Clock: 65.000 MHz
  1280x1024@60Hz 5:4 HorFreq: 64000 Hz Clock: 108.000 MHz
Detailed mode: Clock 594.000 MHz, 698 mm x 392 mm
               3840 4016 4104 4400 hborder 0
               2160 2168 2178 2250 vborder 0
               +hsync +vsync 
               VertFreq: 60 Hz, HorFreq: 135000 Hz
Detailed mode: Clock 148.500 MHz, 698 mm x 392 mm
               1920 2008 2052 2200 hborder 0
               1080 1084 1089 1125 vborder 0
               +hsync +vsync 
               VertFreq: 60 Hz, HorFreq: 67500 Hz
Monitor name: SWEDX TV
Monitor ranges (GTF): 59-70Hz V, 31-140kHz H, max dotclock 600MHz
Has 1 extension blocks
Checksum: 0x68 (valid)

CTA extension block
Extension version: 3
69 bytes of CTA data
  Video data block
    VIC  16 1920x1080@60Hz 16:9 (native) HorFreq: 67500 Hz Clock: 148.500 MHz
    VIC   1 640x480@60Hz 4:3  HorFreq: 31469 Hz Clock: 25.175 MHz
    VIC   2 720x480@60Hz 4:3  HorFreq: 31469 Hz Clock: 27.000 MHz
    VIC   3 720x480@60Hz 16:9  HorFreq: 31469 Hz Clock: 27.000 MHz
    VIC   4 1280x720@60Hz 16:9  HorFreq: 45000 Hz Clock: 74.250 MHz
    VIC   5 1920x1080i@60Hz 16:9  HorFreq: 33750 Hz Clock: 74.250 MHz
    VIC  93 3840x2160@24Hz 16:9  HorFreq: 54000 Hz Clock: 297.000 MHz
    VIC  94 3840x2160@25Hz 16:9  HorFreq: 56250 Hz Clock: 297.000 MHz
    VIC  95 3840x2160@30Hz 16:9  HorFreq: 67500 Hz Clock: 297.000 MHz
    VIC  96 3840x2160@50Hz 16:9  HorFreq: 112500 Hz Clock: 594.000 MHz
    VIC  97 3840x2160@60Hz 16:9  HorFreq: 135000 Hz Clock: 594.000 MHz
    VIC  98 4096x2160@24Hz 256:135  HorFreq: 54000 Hz Clock: 297.000 MHz
    VIC  99 4096x2160@25Hz 256:135  HorFreq: 56250 Hz Clock: 297.000 MHz
    VIC 100 4096x2160@30Hz 256:135  HorFreq: 67500 Hz Clock: 297.000 MHz
    VIC 101 4096x2160@50Hz 256:135  HorFreq: 112500 Hz Clock: 594.000 MHz
    VIC 102 4096x2160@60Hz 256:135  HorFreq: 135000 Hz Clock: 594.000 MHz
    VIC   6 1440x480i@60Hz 4:3  HorFreq: 15734 Hz Clock: 27.000 MHz
    VIC   7 1440x480i@60Hz 16:9  HorFreq: 15734 Hz Clock: 27.000 MHz
    VIC  17 720x576@50Hz 4:3  HorFreq: 31250 Hz Clock: 27.000 MHz
    VIC  18 720x576@50Hz 16:9  HorFreq: 31250 Hz Clock: 27.000 MHz
    VIC  19 1280x720@50Hz 16:9  HorFreq: 37500 Hz Clock: 74.250 MHz
    VIC  20 1920x1080i@50Hz 16:9  HorFreq: 28125 Hz Clock: 74.250 MHz
    VIC  21 1440x576i@50Hz 4:3  HorFreq: 15625 Hz Clock: 27.000 MHz
    VIC  22 1440x576i@50Hz 16:9  HorFreq: 15625 Hz Clock: 27.000 MHz
    VIC  31 1920x1080@50Hz 16:9  HorFreq: 56250 Hz Clock: 148.500 MHz
    VIC  32 1920x1080@24Hz 16:9  HorFreq: 27000 Hz Clock: 74.250 MHz
    VIC  33 1920x1080@25Hz 16:9  HorFreq: 28125 Hz Clock: 74.250 MHz
    VIC  34 1920x1080@30Hz 16:9  HorFreq: 33750 Hz Clock: 74.250 MHz
  Audio data block
    Linear PCM, max channels 2
      Supported sample rates (kHz): 48 44.1 32
      Supported sample sizes (bits): 16
  Vendor-specific data block, OUI 000c03 (HDMI)
    Source physical address 1.0.0.0
    Supports_AI
    DC_36bit
    DC_30bit
    DC_Y444
    Maximum TMDS clock: 340MHz
    Extended HDMI video details:
      HDMI VIC 1 3840x2160@30Hz 16:9 HorFreq: 67500 Hz Clock: 297.000 MHz
      HDMI VIC 3 3840x2160@24Hz 16:9 HorFreq: 54000 Hz Clock: 297.000 MHz
      HDMI VIC 4 4096x2160@24Hz 256:135 HorFreq: 54000 Hz Clock: 297.000 MHz
      VIC index 0 supports frame packing
      VIC index 0 supports frame packing
      VIC index 0 supports frame packing
      VIC index 0 supports frame packing
      VIC index 0 supports frame packing
      VIC index 0 supports frame packing
      VIC index 0 supports frame packing
      VIC index 0 supports frame packing
      VIC index 0 supports frame packing
      VIC index 0 supports frame packing
  Vendor-specific data block, OUI c45dd8 (HDMI Forum)
    Version: 1
    Maximum TMDS Character Rate: 600MHz
    SCDC Present
  Extended tag: YCbCr 4:2:0 capability map data block
    VSD Index 9
    VSD Index 10
    VSD Index 14
    VSD Index 15
Underscans PC formats by default
Basic audio support
Supports YCbCr 4:4:4
Supports YCbCr 4:2:2
0 native detailed modes
Checksum: 0x8b (valid)

One or more of the timings is out of range of the Monitor Ranges:
  Vertical Freq: 24 - 60 Hz
  Horizontal Freq: 15625 - 135000 Hz
  Maximum Clock: 594.000 MHz
