
EDID (hex):
00ffffffffffff0004729059f6140000
080f01036d251e78ea5ec0a4594a9825
205054bfef007140714a714f8140814a
814f81800101302a009851002a403070
1300772d1100001e000000ff0045544c
323330323034350a2020000000fd0031
4b18500e000a202020202020000000fc
004163657220414c313931320a2000bc

Extracted contents:
header:          00 ff ff ff ff ff ff 00
serial number:   04 72 90 59 f6 14 00 00 08 0f
version:         01 03
basic params:    6d 25 1e 78 ea
chroma info:     5e c0 a4 59 4a 98 25 20 50 54
established:     bf ef 00
standard:        71 40 71 4a 71 4f 81 40 81 4a 81 4f 81 80 01 01
descriptor 1:    30 2a 00 98 51 00 2a 40 30 70 13 00 77 2d 11 00 00 1e
descriptor 2:    00 00 00 ff 00 45 54 4c 32 33 30 32 30 34 35 0a 20 20
descriptor 3:    00 00 00 fd 00 31 4b 18 50 0e 00 0a 20 20 20 20 20 20
descriptor 4:    00 00 00 fc 00 41 63 65 72 20 41 4c 31 39 31 32 0a 20
extensions:      00
checksum:        bc

EDID version: 1.3
Manufacturer: ACR Model 5990 Serial Number --
Analog display, Input voltage level: 0.7/0.7 V
Sync: Separate Composite Serration 
Maximum image size: 37 cm x 30 cm
Gamma: 2.20
DPMS levels: Standby Suspend Off
RGB color display
First detailed timing is preferred timing
Display x,y Chromaticity:
  Red:   0.6416, 0.3486
  Green: 0.2919, 0.5957
  Blue:  0.1474, 0.1250
  White: 0.3125, 0.3281
Established timings supported:
  720x400@70Hz 9:5 HorFreq: 31469 Hz Clock: 28.320 MHz
  640x480@60Hz 4:3 HorFreq: 31469 Hz Clock: 25.175 MHz
  640x480@67Hz 4:3 HorFreq: 35000 Hz Clock: 30.240 MHz
  640x480@72Hz 4:3 HorFreq: 37900 Hz Clock: 31.500 MHz
  640x480@75Hz 4:3 HorFreq: 37500 Hz Clock: 31.500 MHz
  800x600@56Hz 4:3 HorFreq: 35200 Hz Clock: 36.000 MHz
  800x600@60Hz 4:3 HorFreq: 37900 Hz Clock: 40.000 MHz
  800x600@72Hz 4:3 HorFreq: 48100 Hz Clock: 50.000 MHz
  800x600@75Hz 4:3 HorFreq: 46900 Hz Clock: 49.500 MHz
  832x624@75Hz 4:3 HorFreq: 49726 Hz Clock: 57.284 MHz
  1024x768@60Hz 4:3 HorFreq: 48400 Hz Clock: 65.000 MHz
  1024x768@70Hz 4:3 HorFreq: 56500 Hz Clock: 75.000 MHz
  1024x768@75Hz 4:3 HorFreq: 60000 Hz Clock: 78.750 MHz
  1280x1024@75Hz 5:4 HorFreq: 80000 Hz Clock: 135.000 MHz
Standard timings supported:
  1152x864@60Hz 4:3
  1152x864@70Hz 4:3
  1152x864@75Hz 4:3 HorFreq: 67500 Hz Clock: 108.000 MHz
  1280x960@60Hz 4:3 HorFreq: 60000 Hz Clock: 108.000 MHz
  1280x960@70Hz 4:3
  1280x960@75Hz 4:3
  1280x1024@60Hz 5:4 HorFreq: 64000 Hz Clock: 108.000 MHz
Detailed mode: Clock 108.000 MHz, 375 mm x 301 mm
               1280 1328 1440 1688 hborder 0
               1024 1025 1028 1066 vborder 0
               +hsync +vsync 
               VertFreq: 60 Hz, HorFreq: 63981 Hz
Serial number: --
Monitor ranges (GTF): 49-75Hz V, 24-80kHz H, max dotclock 140MHz
Monitor name: Acer AL1912
Checksum: 0xbc (valid)
EDID block does not conform at all!
	Bad year of manufacture
