
EDID (hex):
00ffffffffffff005a633fdd00000000
09220104b53c22783fdf65a755509b26
125054bfef80b300a940a9c095009040
8180814081c01a3680a070381f403020
350056502100001a000000ff00574848
3234303930303032360a000000fd0030
64737317010a202020202020000000fc
0056583237363720313030487a0a01a6
020321f14b01030204909211131e1d1f
23097f0783010000681a000001013064
00023a801871382d40582c4500565021
00001e745980a0703814403020350056
502100001e011d007251d01e206e2855
0056502100501e2a4480a07038274030
20350056502100001a023a80d072382d
40102c458056502100001e0000000020

edid-decode (hex):

00 ff ff ff ff ff ff 00 5a 63 3f dd 00 00 00 00
09 22 01 04 b5 3c 22 78 3f df 65 a7 55 50 9b 26
12 50 54 bf ef 80 b3 00 a9 40 a9 c0 95 00 90 40
81 80 81 40 81 c0 1a 36 80 a0 70 38 1f 40 30 20
35 00 56 50 21 00 00 1a 00 00 00 ff 00 57 48 48
32 34 30 39 30 30 30 32 36 0a 00 00 00 fd 00 30
64 73 73 17 01 0a 20 20 20 20 20 20 00 00 00 fc
00 56 58 32 37 36 37 20 31 30 30 48 7a 0a 01 a6

02 03 21 f1 4b 01 03 02 04 90 92 11 13 1e 1d 1f
23 09 7f 07 83 01 00 00 68 1a 00 00 01 01 30 64
00 02 3a 80 18 71 38 2d 40 58 2c 45 00 56 50 21
00 00 1e 74 59 80 a0 70 38 14 40 30 20 35 00 56
50 21 00 00 1e 01 1d 00 72 51 d0 1e 20 6e 28 55
00 56 50 21 00 50 1e 2a 44 80 a0 70 38 27 40 30
20 35 00 56 50 21 00 00 1a 02 3a 80 d0 72 38 2d
40 10 2c 45 80 56 50 21 00 00 1e 00 00 00 00 20

----------------

Block 0, Base EDID:
  EDID Structure Version & Revision: 1.4
  Vendor & Product Identification:
    Manufacturer: VSC
    Model: 56639
    Made in: week 9 of 2024
  Basic Display Parameters & Features:
    Digital display
    Bits per primary color channel: 10
    DisplayPort interface
    Maximum image size: 60 cm x 34 cm
    Gamma: 2.20
    DPMS levels: Off
    Supported color formats: RGB 4:4:4, YCrCb 4:4:4, YCrCb 4:2:2
    Default (sRGB) color space is primary color space
    First detailed timing includes the native pixel format and preferred refresh rate
    Display is continuous frequency
  Color Characteristics:
    Red  : 0.6552, 0.3330
    Green: 0.3154, 0.6083
    Blue : 0.1494, 0.0722
    White: 0.3134, 0.3291
  Established Timings I & II:
    IBM     :   720x400    70.081663 Hz   9:5     31.467 kHz     28.320000 MHz
    DMT 0x04:   640x480    59.940476 Hz   4:3     31.469 kHz     25.175000 MHz
    Apple   :   640x480    66.666667 Hz   4:3     35.000 kHz     30.240000 MHz
    DMT 0x05:   640x480    72.808802 Hz   4:3     37.861 kHz     31.500000 MHz
    DMT 0x06:   640x480    75.000000 Hz   4:3     37.500 kHz     31.500000 MHz
    DMT 0x08:   800x600    56.250000 Hz   4:3     35.156 kHz     36.000000 MHz
    DMT 0x09:   800x600    60.316541 Hz   4:3     37.879 kHz     40.000000 MHz
    DMT 0x0a:   800x600    72.187572 Hz   4:3     48.077 kHz     50.000000 MHz
    DMT 0x0b:   800x600    75.000000 Hz   4:3     46.875 kHz     49.500000 MHz
    Apple   :   832x624    74.551266 Hz   4:3     49.726 kHz     57.284000 MHz
    DMT 0x10:  1024x768    60.003840 Hz   4:3     48.363 kHz     65.000000 MHz
    DMT 0x11:  1024x768    70.069359 Hz   4:3     56.476 kHz     75.000000 MHz
    DMT 0x12:  1024x768    75.028582 Hz   4:3     60.023 kHz     78.750000 MHz
    DMT 0x24:  1280x1024   75.024675 Hz   5:4     79.976 kHz    135.000000 MHz
    Apple   :  1152x870    75.061550 Hz 192:145   68.681 kHz    100.000000 MHz
  Standard Timings:
    DMT 0x3a:  1680x1050   59.954250 Hz  16:10    65.290 kHz    146.250000 MHz
    DMT 0x33:  1600x1200   60.000000 Hz   4:3     75.000 kHz    162.000000 MHz
    DMT 0x53:  1600x900    60.000000 Hz  16:9     60.000 kHz    108.000000 MHz (RB)
    DMT 0x2f:  1440x900    59.887445 Hz  16:10    55.935 kHz    106.500000 MHz
    DMT 0x2a:  1400x1050   59.978442 Hz   4:3     65.317 kHz    121.750000 MHz
    DMT 0x23:  1280x1024   60.019740 Hz   5:4     63.981 kHz    108.000000 MHz
    DMT 0x20:  1280x960    60.000000 Hz   4:3     60.000 kHz    108.000000 MHz
    DMT 0x55:  1280x720    60.000000 Hz  16:9     45.000 kHz     74.250000 MHz
  Detailed Timing Descriptors:
    DTD 1:  1920x1080   59.933878 Hz  16:9     66.587 kHz    138.500000 MHz (598 mm x 336 mm)
                 Hfront   48 Hsync  32 Hback   80 Hpol P
                 Vfront    3 Vsync   5 Vback   23 Vpol N
    Display Product Serial Number: 'WHH240900026'
    Display Range Limits:
      Monitor ranges (Bare Limits): 48-100 Hz V, 115-115 kHz H, max dotclock 230 MHz
    Display Product Name: 'VX2767 100Hz'
  Extension blocks: 1
Checksum: 0xa6

----------------

Block 1, CTA-861 Extension Block:
  Revision: 3
  Underscans IT Video Formats by default
  Basic audio support
  Supports YCbCr 4:4:4
  Supports YCbCr 4:2:2
  Native detailed modes: 1
  Video Data Block:
    VIC   1:   640x480    59.940476 Hz   4:3     31.469 kHz     25.175000 MHz
    VIC   3:   720x480    59.940060 Hz  16:9     31.469 kHz     27.000000 MHz
    VIC   2:   720x480    59.940060 Hz   4:3     31.469 kHz     27.000000 MHz
    VIC   4:  1280x720    60.000000 Hz  16:9     45.000 kHz     74.250000 MHz
    VIC  16:  1920x1080   60.000000 Hz  16:9     67.500 kHz    148.500000 MHz (native)
    VIC  18:   720x576    50.000000 Hz  16:9     31.250 kHz     27.000000 MHz (native)
    VIC  17:   720x576    50.000000 Hz   4:3     31.250 kHz     27.000000 MHz
    VIC  19:  1280x720    50.000000 Hz  16:9     37.500 kHz     74.250000 MHz
    VIC  30:  1440x576    50.000000 Hz  16:9     31.250 kHz     54.000000 MHz
    VIC  29:  1440x576    50.000000 Hz   4:3     31.250 kHz     54.000000 MHz
    VIC  31:  1920x1080   50.000000 Hz  16:9     56.250 kHz    148.500000 MHz
  Audio Data Block:
    Linear PCM:
      Max channels: 2
      Supported sample rates (kHz): 192 176.4 96 88.2 48 44.1 32
      Supported sample sizes (bits): 24 20 16
  Speaker Allocation Data Block:
    FL/FR - Front Left/Right
  Vendor-Specific Data Block (AMD), OUI 00-00-1A:
    Version: 1.1
    Minimum Refresh Rate: 48 Hz
    Maximum Refresh Rate: 100 Hz
    Flags 1.x: 0x00
  Detailed Timing Descriptors:
    DTD 2:  1920x1080   60.000000 Hz  16:9     67.500 kHz    148.500000 MHz (598 mm x 336 mm)
                 Hfront   88 Hsync  44 Hback  148 Hpol P
                 Vfront    4 Vsync   5 Vback   36 Vpol P
    DTD 3:  1920x1080  100.087413 Hz  16:9    110.096 kHz    229.000000 MHz (598 mm x 336 mm)
                 Hfront   48 Hsync  32 Hback   80 Hpol P
                 Vfront    3 Vsync   5 Vback   12 Vpol P
    DTD 4:  1280x720    60.000000 Hz  16:9     45.000 kHz     74.250000 MHz (598 mm x 336 mm)
                 Hfront  110 Hsync  40 Hback  220 Hpol P
                 Vfront    5 Vsync   5 Vback -140 Vpol P Vborder 80
    DTD 5:  1920x1080   74.972503 Hz  16:9     83.894 kHz    174.500000 MHz (598 mm x 336 mm)
                 Hfront   48 Hsync  32 Hback   80 Hpol P
                 Vfront    3 Vsync   5 Vback   31 Vpol N
    DTD 6:  1920x1080   50.000000 Hz  16:9     56.250 kHz    148.500000 MHz (598 mm x 336 mm)
                 Hfront  528 Hsync  44 Hback  148 Hpol P
                 Vfront    4 Vsync   5 Vback   36 Vpol P
Checksum: 0x20  Unused space in Extension Block: 4 bytes


