edid-decode (hex):

00 ff ff ff ff ff ff 00 06 af 9d 21 00 00 00 00
00 15 01 04 90 26 15 78 02 c8 95 9e 57 54 92 26
0f 50 54 00 00 00 01 01 01 01 01 01 01 01 01 01
01 01 01 01 01 01 e2 36 80 b8 70 38 20 40 30 64
36 00 7d d6 10 00 00 18 97 24 80 b8 70 38 20 40
30 64 36 00 7d d6 10 00 00 18 00 00 00 00 00 00
00 00 00 00 00 00 00 00 00 00 00 00 00 00 00 02
00 0c 33 f9 0a 3c 64 1f 14 22 6e 20 20 20 00 2f

----------------

Block 0, Base EDID:
  EDID Structure Version & Revision: 1.4
  Vendor & Product Identification:
    Manufacturer: AUO
    Model: 8605
    Made in: 2011
  Basic Display Parameters & Features:
    Digital display
    Bits per primary color channel: 6
    Digital interface is not defined
    Maximum image size: 38 cm x 21 cm
    Gamma: 2.20
    Supported color formats: RGB 4:4:4
    First detailed timing includes the native pixel format and preferred refresh rate
  Color Characteristics:
    Red  : 0.6201, 0.3398
    Green: 0.3300, 0.5703
    Blue : 0.1503, 0.0595
    White: 0.3134, 0.3291
  Established Timings I & II: none
  Standard Timings: none
  Detailed Timing Descriptors:
    DTD 1:  1920x1080   60.051768 Hz  16:9     66.778 kHz    140.500000 MHz (381 mm x 214 mm)
                 Hfront   48 Hsync 100 Hback   36 Hpol N
                 Vfront    3 Vsync   6 Vback   23 Vpol N
    DTD 2:  1920x1080   40.035937 Hz  16:9     44.520 kHz     93.670000 MHz (381 mm x 214 mm)
                 Hfront   48 Hsync 100 Hback   36 Hpol N
                 Vfront    3 Vsync   6 Vback   23 Vpol N
    Empty Descriptor
    Manufacturer-Specified Display Descriptor (0x02): 00 02 00 0c 33 f9 0a 3c 64 1f 14 22 6e 20 20 20 '....3..<d.."n   '
Checksum: 0x2f

----------------

Failures:

Block 0, Base EDID:
  Empty Descriptor: Use Dummy Descriptor instead of all zeroes.
  Missing Display Product Name.

EDID conformity: FAIL
