
EDID (hex):
00ffffffffffff0019c9000000000000
00170103080000780a2fcda354459724
114647210800d1c0b30090408180a9c0
950001010101662150b051001b304070
360010090000001ea91a00a050001630
3020370005030000001a000000fd0017
3f0f450f000a202020202020000000fc
004c43442054560a20202020202000e9

Extracted contents:
header:          00 ff ff ff ff ff ff 00
serial number:   19 c9 00 00 00 00 00 00 00 17
version:         01 03
basic params:    08 00 00 78 0a
chroma info:     2f cd a3 54 45 97 24 11 46 47
established:     21 08 00
standard:        d1 c0 b3 00 90 40 81 80 a9 c0 95 00 01 01 01 01
descriptor 1:    66 21 50 b0 51 00 1b 30 40 70 36 00 10 09 00 00 00 1e
descriptor 2:    a9 1a 00 a0 50 00 16 30 30 20 37 00 05 03 00 00 00 1a
descriptor 3:    00 00 00 fd 00 17 3f 0f 45 0f 00 0a 20 20 20 20 20 20
descriptor 4:    00 00 00 fc 00 4c 43 44 20 54 56 0a 20 20 20 20 20 20
extensions:      00
checksum:        e9

EDID version: 1.3
Manufacturer: FNI Model 0 Serial Number --
Made in year 2013
Analog display, Input voltage level: 0.7/0.3 V
Sync: Separate 
Image size is variable
Gamma: 2.20
RGB color display
First detailed timing is preferred timing
Display x,y Chromaticity:
  Red:   0.6367, 0.3300
  Green: 0.2724, 0.5927
  Blue:  0.1435, 0.0664
  White: 0.2763, 0.2783
Established timings supported:
  640x480@60Hz 4:3 HorFreq: 31469 Hz Clock: 25.175 MHz
  800x600@60Hz 4:3 HorFreq: 37900 Hz Clock: 40.000 MHz
  1024x768@60Hz 4:3 HorFreq: 48400 Hz Clock: 65.000 MHz
Standard timings supported:
  1920x1080@60Hz 16:9
  1680x1050@60Hz 16:10 HorFreq: 64700 Hz Clock: 119.000 MHz
  1400x1050@60Hz 4:3 HorFreq: 64700 Hz Clock: 101.000 MHz
  1280x1024@60Hz 5:4 HorFreq: 64000 Hz Clock: 108.000 MHz
  1600x900@60Hz 16:9
  1440x900@60Hz 16:10 HorFreq: 55500 Hz Clock: 88.750 MHz
Detailed mode: Clock 85.500 MHz, 16 mm x 9 mm
               1360 1424 1536 1792 hborder 0
                768  771  777  795 vborder 0
               +hsync +vsync 
               VertFreq: 60 Hz, HorFreq: 47712 Hz
Detailed mode: Clock 68.250 MHz, 5 mm x 3 mm
               1280 1328 1360 1440 hborder 0
                768  771  778  790 vborder 0
               +hsync -vsync 
               VertFreq: 59 Hz, HorFreq: 47395 Hz
Monitor ranges (GTF): 23-63Hz V, 15-69kHz H, max dotclock 150MHz
Monitor name: LCD TV
Checksum: 0xe9 (valid)
