edid-decode (hex):

00 ff ff ff ff ff ff 00 30 ae 3d 40 00 00 00 00
00 21 01 04 a5 1e 13 78 03 cb 55 91 57 5a 91 29
1c 50 54 00 00 00 01 01 01 01 01 01 01 01 01 01
01 01 01 01 01 01 26 3d 80 b8 70 b0 28 40 10 10
3e 00 2e bc 10 00 00 18 00 00 00 fd 00 28 3c 4b
4b 10 01 0a 20 20 20 20 20 20 00 00 00 0f 00 d1
0a 3c d1 0a 28 28 0a 00 06 af ad 3c 00 00 00 fe
00 42 31 34 30 55 41 4e 30 34 2e 37 20 0a 00 3e

00 ff ff ff ff ff ff 00 30 ae 3d 40 00 00 00 00
00 21 01 04 a5 1e 13 78 03 cb 55 91 57 5a 91 29
1c 50 54 00 00 00 01 01 01 01 01 01 01 01 01 01
01 01 01 01 01 01 26 3d 80 b8 70 b0 28 40 10 10
3e 00 2e bc 10 00 00 18 00 00 00 fd 00 28 3c 4b
4b 10 01 0a 20 20 20 20 20 20 00 00 00 0f 00 d1
0a 3c d1 0a 28 28 0a 00 06 af ad 3c 00 00 00 fe
00 42 31 34 30 55 41 4e 30 34 2e 37 20 0a 00 3e

----------------

Block 0, Base EDID:
  EDID Structure Version & Revision: 1.4
  Vendor & Product Identification:
    Manufacturer: LEN
    Model: 16445
    Made in: 2023
  Basic Display Parameters & Features:
    Digital display
    Bits per primary color channel: 8
    DisplayPort interface
    Maximum image size: 30 cm x 19 cm
    Gamma: 2.20
    Supported color formats: RGB 4:4:4
    First detailed timing includes the native pixel format and preferred refresh rate
    Display is continuous frequency
  Color Characteristics:
    Red  : 0.5693, 0.3398
    Green: 0.3535, 0.5693
    Blue : 0.1611, 0.1103
    White: 0.3134, 0.3291
  Established Timings I & II: none
  Standard Timings: none
  Detailed Timing Descriptors:
    DTD 1:  1920x1200   60.000920 Hz  16:10    74.401 kHz    156.540000 MHz (302 mm x 188 mm)
                 Hfront   16 Hsync  16 Hback  152 Hpol N
                 Vfront    3 Vsync  14 Vback   23 Vpol N
    Display Range Limits:
      Monitor ranges (Bare Limits): 40-60 Hz V, 75-75 kHz H, max dotclock 160 MHz
    Manufacturer-Specified Display Descriptor (0x0f): 00 0f 00 d1 0a 3c d1 0a 28 28 0a 00 06 af ad 3c '.....<..((.....<'
    Alphanumeric Data String: 'B140UAN04.7 '
Checksum: 0x3e

----------------

Block 1, Unknown EDID Extension Block 0x00:
  00 ff ff ff ff ff ff 00 30 ae 3d 40 00 00 00 00 '........0.=@....'
  00 21 01 04 a5 1e 13 78 03 cb 55 91 57 5a 91 29 '.!.....x..U.WZ.)'
  1c 50 54 00 00 00 01 01 01 01 01 01 01 01 01 01 '.PT.............'
  01 01 01 01 01 01 26 3d 80 b8 70 b0 28 40 10 10 '......&=..p.(@..'
  3e 00 2e bc 10 00 00 18 00 00 00 fd 00 28 3c 4b '>............(<K'
  4b 10 01 0a 20 20 20 20 20 20 00 00 00 0f 00 d1 'K...      ......'
  0a 3c d1 0a 28 28 0a 00 06 af ad 3c 00 00 00 fe '.<..((.....<....'
  00 42 31 34 30 55 41 4e 30 34 2e 37 20 0a 00 3e '.B140UAN04.7 ..>'
Checksum: 0x3e

----------------

Warnings:

Block 0, Base EDID:
  Missing Display Product Name.
EDID:
  Base EDID: Some timings are out of range of the Monitor Ranges:
    Horizontal Freq: 74.401 - 74.401 kHz (Monitor: 75.000 - 75.000 kHz)
    Could be due to a Monitor Range off-by-one rounding issue

Failures:

Block 0, Base EDID:
  Alphanumeric Data String: One or more trailing spaces.
Block 1, Base EDID:
  Unknown Extension Block.
EDID:
  Base EDID: EDID specified 0 extension block(s), but found 1 extension block(s).

EDID conformity: FAIL
