edid-decode (hex):

00 ff ff ff ff ff ff 00 26 cd 2e 56 0b 06 00 00
06 1e 01 03 80 32 1d 78 2a 80 90 a2 5a 52 a2 26
0d 50 54 a5 6b 80 71 00 81 40 81 80 a9 40 b3 00
95 00 d1 c0 01 01 02 3a 80 18 71 38 2d 40 58 2c
45 00 f0 24 11 00 00 1e 00 00 00 ff 00 31 31 36
35 32 30 30 36 36 31 35 34 37 00 00 00 fd 00 37
4c 1e 53 11 00 0a 20 20 20 20 20 20 00 00 00 fc
00 50 4c 32 32 38 33 48 0a 20 20 20 20 20 00 d1

00 ff ff ff ff ff ff 00 26 cd 2e 56 0b 06 00 00
06 1e 01 03 80 32 1d 78 2a 80 90 a2 5a 52 a2 26
0d 50 54 a5 6b 80 71 00 81 40 81 80 a9 40 b3 00
95 00 d1 c0 01 01 02 3a 80 18 71 38 2d 40 58 2c
45 00 f0 24 11 00 00 1e 00 00 00 ff 00 31 31 36
35 32 30 30 36 36 31 35 34 37 00 00 00 fd 00 37
4c 1e 53 11 00 0a 20 20 20 20 20 20 00 00 00 fc
00 50 4c 32 32 38 33 48 0a 20 20 20 20 20 00 d1

----------------

Block 0, Base EDID:
  EDID Structure Version & Revision: 1.3
  Vendor & Product Identification:
    Manufacturer: IVM
    Model: 22062
    Serial Number: ...
    Made in: week 6 of 2020
  Basic Display Parameters & Features:
    Digital display
    Maximum image size: 50 cm x 29 cm
    Gamma: 2.20
    DPMS levels: Off
    RGB color display
    First detailed timing is the preferred timing
  Color Characteristics:
    Red  : 0.6347, 0.3515
    Green: 0.3203, 0.6328
    Blue : 0.1503, 0.0517
    White: 0.3125, 0.3281
  Established Timings I & II:
    IBM     :   720x400    70.081663 Hz   9:5     31.467 kHz     28.320000 MHz
    DMT 0x04:   640x480    59.940476 Hz   4:3     31.469 kHz     25.175000 MHz
    DMT 0x06:   640x480    75.000000 Hz   4:3     37.500 kHz     31.500000 MHz
    DMT 0x09:   800x600    60.316541 Hz   4:3     37.879 kHz     40.000000 MHz
    DMT 0x0b:   800x600    75.000000 Hz   4:3     46.875 kHz     49.500000 MHz
    Apple   :   832x624    74.551266 Hz   4:3     49.726 kHz     57.284000 MHz
    DMT 0x10:  1024x768    60.003840 Hz   4:3     48.363 kHz     65.000000 MHz
    DMT 0x12:  1024x768    75.028582 Hz   4:3     60.023 kHz     78.750000 MHz
    DMT 0x24:  1280x1024   75.024675 Hz   5:4     79.976 kHz    135.000000 MHz
    Apple   :  1152x870    75.061550 Hz 192:145   68.681 kHz    100.000000 MHz
  Standard Timings:
    GTF     :  1152x720    59.999964 Hz  16:10    44.760 kHz     67.319000 MHz
    DMT 0x20:  1280x960    60.000000 Hz   4:3     60.000 kHz    108.000000 MHz
    DMT 0x23:  1280x1024   60.019740 Hz   5:4     63.981 kHz    108.000000 MHz
    DMT 0x33:  1600x1200   60.000000 Hz   4:3     75.000 kHz    162.000000 MHz
    DMT 0x3a:  1680x1050   59.954250 Hz  16:10    65.290 kHz    146.250000 MHz
    DMT 0x2f:  1440x900    59.887445 Hz  16:10    55.935 kHz    106.500000 MHz
    DMT 0x52:  1920x1080   60.000000 Hz  16:9     67.500 kHz    148.500000 MHz
  Detailed Timing Descriptors:
    DTD 1:  1920x1080   60.000000 Hz  16:9     67.500 kHz    148.500000 MHz (496 mm x 292 mm)
                 Hfront   88 Hsync  44 Hback  148 Hpol P
                 Vfront    4 Vsync   5 Vback   36 Vpol P
    Display Product Serial Number: ...
    Display Range Limits:
      Monitor ranges (GTF): 55-76 Hz V, 30-83 kHz H, max dotclock 170 MHz
    Display Product Name: 'PL2283H'
Checksum: 0xd1

----------------

Block 1, Unknown EDID Extension Block 0x00:
  00 ff ff ff ff ff ff 00 26 cd 2e 56 0b 06 00 00 '........&..V....'
  06 1e 01 03 80 32 1d 78 2a 80 90 a2 5a 52 a2 26 '.....2.x*...ZR.&'
  0d 50 54 a5 6b 80 71 00 81 40 81 80 a9 40 b3 00 '.PT.k.q..@...@..'
  95 00 d1 c0 01 01 02 3a 80 18 71 38 2d 40 58 2c '.......:..q8-@X,'
  45 00 f0 24 11 00 00 1e 00 00 00 ff 00 31 31 36 'E..$.........116'
  35 32 30 30 36 36 31 35 34 37 00 00 00 fd 00 37 '5200661547.....7'
  4c 1e 53 11 00 0a 20 20 20 20 20 20 00 00 00 fc 'L.S...      ....'
  00 50 4c 32 32 38 33 48 0a 20 20 20 20 20 00 d1 '.PL2283H.     ..'
Checksum: 0xd1

----------------

Failures:

Block 1, Base EDID:
  Unknown Extension Block.
EDID:
  Base EDID: EDID specified 0 extension block(s), but found 1 extension block(s).

EDID conformity: FAIL
