
EDID (hex):
00ffffffffffff00444cb209920b0000
1510010368221b78eaf0d5a753469e24
145054bfef00714f8140010101010101
010101010101302a009851002a403070
1300520e1100001e000000ff00373632
3154473030323936320a000000fd0032
4b1e530e000a202020202020000000fc
0051422e3137462d34445649205200ba

Extracted contents:
header:          00 ff ff ff ff ff ff 00
serial number:   44 4c b2 09 92 0b 00 00 15 10
version:         01 03
basic params:    68 22 1b 78 ea
chroma info:     f0 d5 a7 53 46 9e 24 14 50 54
established:     bf ef 00
standard:        71 4f 81 40 01 01 01 01 01 01 01 01 01 01 01 01
descriptor 1:    30 2a 00 98 51 00 2a 40 30 70 13 00 52 0e 11 00 00 1e
descriptor 2:    00 00 00 ff 00 37 36 32 31 54 47 30 30 32 39 36 32 0a
descriptor 3:    00 00 00 fd 00 32 4b 1e 53 0e 00 0a 20 20 20 20 20 20
descriptor 4:    00 00 00 fc 00 51 42 2e 31 37 46 2d 34 44 56 49 20 52
extensions:      00
checksum:        ba

EDID version: 1.3
Manufacturer: QBL Model 9b2 Serial Number --
Made in week 21 of 2006
Analog display, Input voltage level: 0.7/0.7 V
Sync: Separate 
Maximum image size: 34 cm x 27 cm
Gamma: 2.20
DPMS levels: Standby Suspend Off
RGB color display
First detailed timing is preferred timing
Display x,y Chromaticity:
  Red:   0.6552, 0.3271
  Green: 0.2734, 0.6171
  Blue:  0.1435, 0.0791
  White: 0.3134, 0.3291
Established timings supported:
  720x400@70Hz 9:5 HorFreq: 31469 Hz Clock: 28.320 MHz
  640x480@60Hz 4:3 HorFreq: 31469 Hz Clock: 25.175 MHz
  640x480@67Hz 4:3 HorFreq: 35000 Hz Clock: 30.240 MHz
  640x480@72Hz 4:3 HorFreq: 37900 Hz Clock: 31.500 MHz
  640x480@75Hz 4:3 HorFreq: 37500 Hz Clock: 31.500 MHz
  800x600@56Hz 4:3 HorFreq: 35200 Hz Clock: 36.000 MHz
  800x600@60Hz 4:3 HorFreq: 37900 Hz Clock: 40.000 MHz
  800x600@72Hz 4:3 HorFreq: 48100 Hz Clock: 50.000 MHz
  800x600@75Hz 4:3 HorFreq: 46900 Hz Clock: 49.500 MHz
  832x624@75Hz 4:3 HorFreq: 49726 Hz Clock: 57.284 MHz
  1024x768@60Hz 4:3 HorFreq: 48400 Hz Clock: 65.000 MHz
  1024x768@70Hz 4:3 HorFreq: 56500 Hz Clock: 75.000 MHz
  1024x768@75Hz 4:3 HorFreq: 60000 Hz Clock: 78.750 MHz
  1280x1024@75Hz 5:4 HorFreq: 80000 Hz Clock: 135.000 MHz
Standard timings supported:
  1152x864@75Hz 4:3 HorFreq: 67500 Hz Clock: 108.000 MHz
  1280x960@60Hz 4:3 HorFreq: 60000 Hz Clock: 108.000 MHz
Detailed mode: Clock 108.000 MHz, 338 mm x 270 mm
               1280 1328 1440 1688 hborder 0
               1024 1025 1028 1066 vborder 0
               +hsync +vsync 
               VertFreq: 60 Hz, HorFreq: 63981 Hz
Serial number: --
Monitor ranges (GTF): 50-75Hz V, 30-83kHz H, max dotclock 140MHz
Checksum: 0xba (valid)
EDID block does NOT conform to EDID 1.3!
	Name descriptor not terminated with a newline
