
EDID (hex):
00ffffffffffff0022f0332901010101
2c150103682917782a68d0a555489a26
135054a1080081c08140818001010101
010101010101662156aa51001e30468f
33009dea1000001e000000fd00374b1e
530e000a202020202020000000fc0048
502053313933330a20202020000000ff
00434e43313434523854460a20200078

Extracted contents:
header:          00 ff ff ff ff ff ff 00
serial number:   22 f0 33 29 01 01 01 01 2c 15
version:         01 03
basic params:    68 29 17 78 2a
chroma info:     68 d0 a5 55 48 9a 26 13 50 54
established:     a1 08 00
standard:        81 c0 81 40 81 80 01 01 01 01 01 01 01 01 01 01
descriptor 1:    66 21 56 aa 51 00 1e 30 46 8f 33 00 9d ea 10 00 00 1e
descriptor 2:    00 00 00 fd 00 37 4b 1e 53 0e 00 0a 20 20 20 20 20 20
descriptor 3:    00 00 00 fc 00 48 50 20 53 31 39 33 33 0a 20 20 20 20
descriptor 4:    00 00 00 ff 00 43 4e 43 31 34 34 52 38 54 46 0a 20 20
extensions:      00
checksum:        78

EDID version: 1.3
Manufacturer: HWP Model 2933 Serial Number --
Made in week 44 of 2011
Analog display, Input voltage level: 0.7/0.7 V
Sync: Separate 
Maximum image size: 41 cm x 23 cm
Gamma: 2.20
DPMS levels: Off
RGB color display
First detailed timing is preferred timing
Display x,y Chromaticity:
  Red:   0.6455, 0.3339
  Green: 0.2832, 0.6015
  Blue:  0.1513, 0.0751
  White: 0.3125, 0.3281
Established timings supported:
  720x400@70Hz 9:5 HorFreq: 31469 Hz Clock: 28.320 MHz
  640x480@60Hz 4:3 HorFreq: 31469 Hz Clock: 25.175 MHz
  800x600@60Hz 4:3 HorFreq: 37900 Hz Clock: 40.000 MHz
  1024x768@60Hz 4:3 HorFreq: 48400 Hz Clock: 65.000 MHz
Standard timings supported:
  1280x720@60Hz 16:9
  1280x960@60Hz 4:3 HorFreq: 60000 Hz Clock: 108.000 MHz
  1280x1024@60Hz 5:4 HorFreq: 64000 Hz Clock: 108.000 MHz
Detailed mode: Clock 85.500 MHz, 413 mm x 234 mm
               1366 1436 1579 1792 hborder 0
                768  771  774  798 vborder 0
               +hsync +vsync 
               VertFreq: 59 Hz, HorFreq: 47712 Hz
Monitor ranges (GTF): 55-75Hz V, 30-83kHz H, max dotclock 140MHz
Monitor name: HP S1933
Serial number: --
Checksum: 0x78 (valid)
