edid-decode (hex):

00 ff ff ff ff ff ff 00 06 af 06 0f fd 00 00 00
0f 0e 01 02 80 1e 17 78 0a 12 e5 91 52 52 89 27
24 50 54 00 00 00 01 01 01 01 01 01 01 01 01 01
01 01 01 01 01 01 64 19 00 40 41 00 26 30 18 88
36 00 30 e6 10 00 00 18 00 00 00 0f 00 06 77 08
ff 01 0f 05 2e 2d ff 05 3f 01 00 00 00 fe 00 41
55 4f 0a 20 20 20 20 20 20 20 20 20 00 00 00 fe
00 42 31 35 30 58 47 30 31 56 32 0a 20 20 00 d0

00 ff ff ff ff ff ff 00 06 af 06 0f fd 00 00 00
0f 0e 01 02 80 1e 17 78 0a 12 e5 91 52 52 89 27
24 50 54 00 00 00 01 01 01 01 01 01 01 01 01 01
01 01 01 01 01 01 64 19 00 40 41 00 26 30 18 88
36 00 30 e6 10 00 00 18 00 00 00 0f 00 06 77 08
ff 01 0f 05 2e 2d ff 05 3f 01 00 00 00 fe 00 41
55 4f 0a 20 20 20 20 20 20 20 20 20 00 00 00 fe
00 42 31 35 30 58 47 30 31 56 32 0a 20 20 00 d0

----------------

Block 0, Base EDID:
  EDID Structure Version & Revision: 1.2
  Vendor & Product Identification:
    Manufacturer: AUO
    Model: 3846
    Serial Number: ...
    Made in: week 15 of 2004
  Basic Display Parameters & Features:
    Digital display
    Maximum image size: 30 cm x 23 cm
    Gamma: 2.20
    RGB color display
    First detailed timing is the preferred timing
  Color Characteristics:
    Red  : 0.5664, 0.3212
    Green: 0.3203, 0.5371
    Blue : 0.1552, 0.1425
    White: 0.3134, 0.3291
  Established Timings I & II: none
  Standard Timings: none
  Detailed Timing Descriptors:
    DTD 1:  1024x768    60.003840 Hz   4:3     48.363 kHz     65.000000 MHz (304 mm x 230 mm)
                 Hfront   24 Hsync 136 Hback  160 Hpol N
                 Vfront    3 Vsync   6 Vback   29 Vpol N
    Manufacturer-Specified Display Descriptor (0x0f): 00 0f 00 06 77 08 ff 01 0f 05 2e 2d ff 05 3f 01 '....w......-..?.'
    Alphanumeric Data String: 'AUO'
    Alphanumeric Data String: 'B150XG01V2'
Checksum: 0xd0

----------------

Block 1, Unknown EDID Extension Block 0x00:
  00 ff ff ff ff ff ff 00 06 af 06 0f fd 00 00 00 '................'
  0f 0e 01 02 80 1e 17 78 0a 12 e5 91 52 52 89 27 '.......x....RR.''
  24 50 54 00 00 00 01 01 01 01 01 01 01 01 01 01 '$PT.............'
  01 01 01 01 01 01 64 19 00 40 41 00 26 30 18 88 '......d..@A.&0..'
  36 00 30 e6 10 00 00 18 00 00 00 0f 00 06 77 08 '6.0...........w.'
  ff 01 0f 05 2e 2d ff 05 3f 01 00 00 00 fe 00 41 '.....-..?......A'
  55 4f 0a 20 20 20 20 20 20 20 20 20 00 00 00 fe 'UO.         ....'
  00 42 31 35 30 58 47 30 31 56 32 0a 20 20 00 d0 '.B150XG01V2.  ..'
Checksum: 0xd0

----------------

Warnings:

Block 0, Base EDID:
  EDID Structure Version & Revision: EDID 1.2 is deprecated, do not use.

Failures:

Block 1, Base EDID:
  Unknown Extension Block.
EDID:
  Base EDID: EDID specified 0 extension block(s), but found 1 extension block(s).

EDID conformity: FAIL
