
EDID (hex):
00ffffffffffff000469f2223c040000
021301031e301b78eec4f6a3574a9c23
114f54bfef00714f818081409500a940
b300d1c00101023a801871382d40582c
4500dd0c1100001e000000fd00324c1f
5311000a202020202020000000fc0056
483232360a20202020202020000000ff
0039314c4d51433030313038340a007a

Extracted contents:
header:          00 ff ff ff ff ff ff 00
serial number:   04 69 f2 22 3c 04 00 00 02 13
version:         01 03
basic params:    1e 30 1b 78 ee
chroma info:     c4 f6 a3 57 4a 9c 23 11 4f 54
established:     bf ef 00
standard:        71 4f 81 80 81 40 95 00 a9 40 b3 00 d1 c0 01 01
descriptor 1:    02 3a 80 18 71 38 2d 40 58 2c 45 00 dd 0c 11 00 00 1e
descriptor 2:    00 00 00 fd 00 32 4c 1f 53 11 00 0a 20 20 20 20 20 20
descriptor 3:    00 00 00 fc 00 56 48 32 32 36 0a 20 20 20 20 20 20 20
descriptor 4:    00 00 00 ff 00 39 31 4c 4d 51 43 30 30 31 30 38 34 0a
extensions:      00
checksum:        7a

EDID version: 1.3
Manufacturer: ACI Model 22f2 Serial Number --
Made in week 2 of 2009
Analog display, Input voltage level: 0.7/0.3 V
Configurable signal levels
Sync: Separate Composite SyncOnGreen 
Maximum image size: 48 cm x 27 cm
Gamma: 2.20
DPMS levels: Standby Suspend Off
RGB color display
Default (sRGB) color space is primary color space
First detailed timing is preferred timing
Display x,y Chromaticity:
  Red:   0.6396, 0.3398
  Green: 0.2900, 0.6093
  Blue:  0.1396, 0.0693
  White: 0.3095, 0.3300
Established timings supported:
  720x400@70Hz 9:5 HorFreq: 31469 Hz Clock: 28.320 MHz
  640x480@60Hz 4:3 HorFreq: 31469 Hz Clock: 25.175 MHz
  640x480@67Hz 4:3 HorFreq: 35000 Hz Clock: 30.240 MHz
  640x480@72Hz 4:3 HorFreq: 37900 Hz Clock: 31.500 MHz
  640x480@75Hz 4:3 HorFreq: 37500 Hz Clock: 31.500 MHz
  800x600@56Hz 4:3 HorFreq: 35200 Hz Clock: 36.000 MHz
  800x600@60Hz 4:3 HorFreq: 37900 Hz Clock: 40.000 MHz
  800x600@72Hz 4:3 HorFreq: 48100 Hz Clock: 50.000 MHz
  800x600@75Hz 4:3 HorFreq: 46900 Hz Clock: 49.500 MHz
  832x624@75Hz 4:3 HorFreq: 49726 Hz Clock: 57.284 MHz
  1024x768@60Hz 4:3 HorFreq: 48400 Hz Clock: 65.000 MHz
  1024x768@70Hz 4:3 HorFreq: 56500 Hz Clock: 75.000 MHz
  1024x768@75Hz 4:3 HorFreq: 60000 Hz Clock: 78.750 MHz
  1280x1024@75Hz 5:4 HorFreq: 80000 Hz Clock: 135.000 MHz
Standard timings supported:
  1152x864@75Hz 4:3 HorFreq: 67500 Hz Clock: 108.000 MHz
  1280x1024@60Hz 5:4 HorFreq: 64000 Hz Clock: 108.000 MHz
  1280x960@60Hz 4:3 HorFreq: 60000 Hz Clock: 108.000 MHz
  1440x900@60Hz 16:10 HorFreq: 55500 Hz Clock: 88.750 MHz
  1600x1200@60Hz 4:3 HorFreq: 75000 Hz Clock: 162.000 MHz
  1680x1050@60Hz 16:10 HorFreq: 64700 Hz Clock: 119.000 MHz
  1920x1080@60Hz 16:9
Detailed mode: Clock 148.500 MHz, 477 mm x 268 mm
               1920 2008 2052 2200 hborder 0
               1080 1084 1089 1125 vborder 0
               +hsync +vsync 
               VertFreq: 60 Hz, HorFreq: 67500 Hz
Monitor ranges (GTF): 50-76Hz V, 31-83kHz H, max dotclock 170MHz
Monitor name: VH226
Serial number: --
Checksum: 0x7a (valid)
EDID block does NOT conform to EDID 1.3!
	sRGB is signaled, but the chromaticities do not match
