
EDID (hex):
00ffffffffffff0030ae5211e5190000
2014010368291a782ae160a355499927
135054bfcf008180818a818c9500950f
010101010101ab22a0a050841a303020
36009a011100001a000000ff00343334
48453156464a36363239000000fd0032
4c1e510e000a202020202020000000fc
004c31393720576964650a2020200019

Extracted contents:
header:          00 ff ff ff ff ff ff 00
serial number:   30 ae 52 11 e5 19 00 00 20 14
version:         01 03
basic params:    68 29 1a 78 2a
chroma info:     e1 60 a3 55 49 99 27 13 50 54
established:     bf cf 00
standard:        81 80 81 8a 81 8c 95 00 95 0f 01 01 01 01 01 01
descriptor 1:    ab 22 a0 a0 50 84 1a 30 30 20 36 00 9a 01 11 00 00 1a
descriptor 2:    00 00 00 ff 00 34 33 34 48 45 31 56 46 4a 36 36 32 39
descriptor 3:    00 00 00 fd 00 32 4c 1e 51 0e 00 0a 20 20 20 20 20 20
descriptor 4:    00 00 00 fc 00 4c 31 39 37 20 57 69 64 65 0a 20 20 20
extensions:      00
checksum:        19

EDID version: 1.3
Manufacturer: LEN Model 1152 Serial Number --
Made in week 32 of 2010
Analog display, Input voltage level: 0.7/0.7 V
Sync: Separate 
Maximum image size: 41 cm x 26 cm
Gamma: 2.20
DPMS levels: Off
RGB color display
First detailed timing is preferred timing
Display x,y Chromaticity:
  Red:   0.6396, 0.3339
  Green: 0.2851, 0.5986
  Blue:  0.1533, 0.0761
  White: 0.3125, 0.3281
Established timings supported:
  720x400@70Hz 9:5 HorFreq: 31469 Hz Clock: 28.320 MHz
  640x480@60Hz 4:3 HorFreq: 31469 Hz Clock: 25.175 MHz
  640x480@67Hz 4:3 HorFreq: 35000 Hz Clock: 30.240 MHz
  640x480@72Hz 4:3 HorFreq: 37900 Hz Clock: 31.500 MHz
  640x480@75Hz 4:3 HorFreq: 37500 Hz Clock: 31.500 MHz
  800x600@56Hz 4:3 HorFreq: 35200 Hz Clock: 36.000 MHz
  800x600@60Hz 4:3 HorFreq: 37900 Hz Clock: 40.000 MHz
  800x600@72Hz 4:3 HorFreq: 48100 Hz Clock: 50.000 MHz
  800x600@75Hz 4:3 HorFreq: 46900 Hz Clock: 49.500 MHz
  1024x768@60Hz 4:3 HorFreq: 48400 Hz Clock: 65.000 MHz
  1024x768@70Hz 4:3 HorFreq: 56500 Hz Clock: 75.000 MHz
  1024x768@75Hz 4:3 HorFreq: 60000 Hz Clock: 78.750 MHz
  1280x1024@75Hz 5:4 HorFreq: 80000 Hz Clock: 135.000 MHz
Standard timings supported:
  1280x1024@60Hz 5:4 HorFreq: 64000 Hz Clock: 108.000 MHz
  1280x1024@70Hz 5:4
  1280x1024@72Hz 5:4
  1440x900@60Hz 16:10 HorFreq: 55500 Hz Clock: 88.750 MHz
  1440x900@75Hz 16:10 HorFreq: 82300 Hz Clock: 156.000 MHz
Detailed mode: Clock 88.750 MHz, 410 mm x 257 mm
               1440 1488 1520 1600 hborder 0
                900  903  909  926 vborder 0
               +hsync -vsync 
               VertFreq: 59 Hz, HorFreq: 55468 Hz
Serial number: --
Monitor ranges (GTF): 50-76Hz V, 30-81kHz H, max dotclock 140MHz
Monitor name: L197 Wide
Checksum: 0x19 (valid)
One or more of the timings is out of range of the Monitor Ranges:
  Vertical Freq: 56 - 75 Hz
  Horizontal Freq: 31469 - 82300 Hz
  Maximum Clock: 156.000 MHz
