edid-decode (hex):

00 ff ff ff ff ff ff 00 30 ae 52 11 01 01 01 01
0a 12 01 03 6c 29 1a 78 ee e5 b5 a3 55 49 99 27
13 50 54 af cf 10 31 46 81 c0 81 8a 81 8c 81 90
95 00 95 0f 71 4f 9a 29 a0 d0 51 84 22 30 50 98
36 00 9a 01 11 00 00 1c 00 00 00 fc 00 4c 31 39
34 20 57 69 64 65 0a 20 20 20 00 00 00 fd 00 32
4c 1e 51 0e 00 0a 20 20 20 20 20 20 00 00 00 ff
00 36 56 36 39 37 38 32 34 0a 20 20 20 20 00 7e

----------------

Block 0, Base EDID:
  EDID Structure Version & Revision: 1.3
  Vendor & Product Identification:
    Manufacturer: LEN
    Model: 4434
    Serial Number: ...
    Made in: week 10 of 2008
  Basic Display Parameters & Features:
    Analog display
    Input voltage level: 0.7/0.7 V
    Blank level equals black level
    Sync: Separate Composite
    Maximum image size: 41 cm x 26 cm
    Gamma: 2.20
    DPMS levels: Standby Suspend Off
    RGB color display
    Default (sRGB) color space is primary color space
    First detailed timing is the preferred timing
  Color Characteristics:
    Red  : 0.6396, 0.3339
    Green: 0.2861, 0.5986
    Blue : 0.1542, 0.0771
    White: 0.3134, 0.3291
  Established Timings I & II:
    IBM     :   720x400    70.082 Hz   9:5    31.467 kHz  28.320 MHz
    DMT 0x04:   640x480    59.940 Hz   4:3    31.469 kHz  25.175 MHz
    DMT 0x05:   640x480    72.809 Hz   4:3    37.861 kHz  31.500 MHz
    DMT 0x06:   640x480    75.000 Hz   4:3    37.500 kHz  31.500 MHz
    DMT 0x08:   800x600    56.250 Hz   4:3    35.156 kHz  36.000 MHz
    DMT 0x09:   800x600    60.317 Hz   4:3    37.879 kHz  40.000 MHz
    DMT 0x0a:   800x600    72.188 Hz   4:3    48.077 kHz  50.000 MHz
    DMT 0x0b:   800x600    75.000 Hz   4:3    46.875 kHz  49.500 MHz
    DMT 0x10:  1024x768    60.004 Hz   4:3    48.363 kHz  65.000 MHz
    DMT 0x11:  1024x768    70.069 Hz   4:3    56.476 kHz  75.000 MHz
    DMT 0x12:  1024x768    75.029 Hz   4:3    60.023 kHz  78.750 MHz
    DMT 0x24:  1280x1024   75.025 Hz   5:4    79.976 kHz 135.000 MHz
  Standard Timings:
    GTF     :   640x480    66.000 Hz   4:3    32.934 kHz  26.874 MHz
    DMT 0x55:  1280x720    60.000 Hz  16:9    45.000 kHz  74.250 MHz
    GTF     :  1280x1024   70.000 Hz   5:4    74.620 kHz 128.943 MHz
    GTF     :  1280x1024   72.000 Hz   5:4    76.824 kHz 132.752 MHz
    GTF     :  1280x1024   76.000 Hz   5:4    81.320 kHz 141.822 MHz
    DMT 0x2f:  1440x900    59.887 Hz  16:10   55.935 kHz 106.500 MHz
    DMT 0x30:  1440x900    74.984 Hz  16:10   70.635 kHz 136.750 MHz
    DMT 0x15:  1152x864    75.000 Hz   4:3    67.500 kHz 108.000 MHz
  Detailed Timing Descriptors:
    DTD 1:  1440x900    59.887 Hz   8:5    55.935 kHz 106.500 MHz (410 mm x 257 mm)
                 Hfront   80 Hsync 152 Hback 232 Hpol N
                 Vfront    3 Vsync   6 Vback  25 Vpol P
    Display Product Name: 'L194 Wide'
  Display Range Limits:
    Monitor ranges (GTF): 50-76 Hz V, 30-81 kHz H, max dotclock 140 MHz
    Display Product Serial Number: ...
Checksum: 0x7e

----------------

Warnings:

EDID:
  Base EDID: Some timings are out of range of the Monitor Ranges:
    Maximum Clock: 141.822 MHz (Monitor: 140.000 MHz)
    Could be due to a Monitor Range off-by-one rounding issue

Failures:

Block 0, Base EDID:
  Basic Display Parameters & Features: sRGB is signaled, but the chromaticities do not match.

EDID conformity: FAIL
