edid-decode (hex):

00 ff ff ff ff ff ff 00 26 cd 01 76 01 01 01 01
2b 1b 01 03 80 40 28 78 2a 1d f5 ae 4f 35 b3 25
0d 50 54 bf ef 80 81 80 95 00 a9 c0 a9 40 b3 00
d1 c0 d1 00 e1 c0 e2 68 00 a0 a0 40 2e 60 30 20
36 00 81 91 21 00 00 1a 00 00 00 ff 00 31 31 33
32 38 37 34 33 30 30 34 33 33 00 00 00 fd 00 37
4c 1e 67 1f 00 0a 20 20 20 20 20 20 00 00 00 fc
00 50 4c 33 30 37 30 57 51 0a 20 20 20 20 01 e7

02 01 04 00 b4 76 40 a0 b0 54 2e 60 30 20 35 00
81 91 21 00 00 1a 56 5e 00 a0 a0 a0 29 50 30 20
35 00 81 91 21 00 00 1a 00 00 00 00 00 00 00 00
00 00 00 00 00 00 00 00 00 00 00 00 00 00 00 00
00 00 00 00 00 00 00 00 00 00 00 00 00 00 00 00
00 00 00 00 00 00 00 00 00 00 00 00 00 00 00 00
00 00 00 00 00 00 00 00 00 00 00 00 00 00 00 00
00 00 00 00 00 00 00 00 00 00 00 00 00 00 00 ac

00 ff ff ff ff ff ff 00 26 cd 01 76 01 01 01 01
2b 1b 01 03 80 40 28 78 2a 1d f5 ae 4f 35 b3 25
0d 50 54 bf ef 80 81 80 95 00 a9 c0 a9 40 b3 00
d1 c0 d1 00 e1 c0 e2 68 00 a0 a0 40 2e 60 30 20
36 00 81 91 21 00 00 1a 00 00 00 ff 00 31 31 33
32 38 37 34 33 30 30 34 33 33 00 00 00 fd 00 37
4c 1e 67 1f 00 0a 20 20 20 20 20 20 00 00 00 fc
00 50 4c 33 30 37 30 57 51 0a 20 20 20 20 01 e7

02 01 04 00 b4 76 40 a0 b0 54 2e 60 30 20 35 00
81 91 21 00 00 1a 56 5e 00 a0 a0 a0 29 50 30 20
35 00 81 91 21 00 00 1a 00 00 00 00 00 00 00 00
00 00 00 00 00 00 00 00 00 00 00 00 00 00 00 00
00 00 00 00 00 00 00 00 00 00 00 00 00 00 00 00
00 00 00 00 00 00 00 00 00 00 00 00 00 00 00 00
00 00 00 00 00 00 00 00 00 00 00 00 00 00 00 00
00 00 00 00 00 00 00 00 00 00 00 00 00 00 00 ac

----------------

Block 0, Base EDID:
  EDID Structure Version & Revision: 1.3
  Vendor & Product Identification:
    Manufacturer: IVM
    Model: 30209
    Serial Number: ...
    Made in: week 43 of 2017
  Basic Display Parameters & Features:
    Digital display
    Maximum image size: 64 cm x 40 cm
    Gamma: 2.20
    DPMS levels: Off
    RGB color display
    First detailed timing is the preferred timing
  Color Characteristics:
    Red  : 0.6796, 0.3095
    Green: 0.2099, 0.7001
    Blue : 0.1474, 0.0537
    White: 0.3134, 0.3291
  Established Timings I & II:
    IBM     :   720x400    70.081663 Hz   9:5     31.467 kHz     28.320000 MHz
    DMT 0x04:   640x480    59.940476 Hz   4:3     31.469 kHz     25.175000 MHz
    Apple   :   640x480    66.666667 Hz   4:3     35.000 kHz     30.240000 MHz
    DMT 0x05:   640x480    72.808802 Hz   4:3     37.861 kHz     31.500000 MHz
    DMT 0x06:   640x480    75.000000 Hz   4:3     37.500 kHz     31.500000 MHz
    DMT 0x08:   800x600    56.250000 Hz   4:3     35.156 kHz     36.000000 MHz
    DMT 0x09:   800x600    60.316541 Hz   4:3     37.879 kHz     40.000000 MHz
    DMT 0x0a:   800x600    72.187572 Hz   4:3     48.077 kHz     50.000000 MHz
    DMT 0x0b:   800x600    75.000000 Hz   4:3     46.875 kHz     49.500000 MHz
    Apple   :   832x624    74.551266 Hz   4:3     49.726 kHz     57.284000 MHz
    DMT 0x10:  1024x768    60.003840 Hz   4:3     48.363 kHz     65.000000 MHz
    DMT 0x11:  1024x768    70.069359 Hz   4:3     56.476 kHz     75.000000 MHz
    DMT 0x12:  1024x768    75.028582 Hz   4:3     60.023 kHz     78.750000 MHz
    DMT 0x24:  1280x1024   75.024675 Hz   5:4     79.976 kHz    135.000000 MHz
    Apple   :  1152x870    75.061550 Hz 192:145   68.681 kHz    100.000000 MHz
  Standard Timings:
    DMT 0x23:  1280x1024   60.019740 Hz   5:4     63.981 kHz    108.000000 MHz
    DMT 0x2f:  1440x900    59.887445 Hz  16:10    55.935 kHz    106.500000 MHz
    DMT 0x53:  1600x900    60.000000 Hz  16:9     60.000 kHz    108.000000 MHz (RB)
    DMT 0x33:  1600x1200   60.000000 Hz   4:3     75.000 kHz    162.000000 MHz
    DMT 0x3a:  1680x1050   59.954250 Hz  16:10    65.290 kHz    146.250000 MHz
    DMT 0x52:  1920x1080   60.000000 Hz  16:9     67.500 kHz    148.500000 MHz
    DMT 0x45:  1920x1200   59.884600 Hz  16:10    74.556 kHz    193.250000 MHz
    DMT 0x54:  2048x1152   60.000000 Hz  16:9     72.000 kHz    162.000000 MHz (RB)
  Detailed Timing Descriptors:
    DTD 1:  2560x1600   59.971589 Hz  16:10    98.713 kHz    268.500000 MHz (641 mm x 401 mm)
                 Hfront   48 Hsync  32 Hback   80 Hpol P
                 Vfront    3 Vsync   6 Vback   37 Vpol N
    Display Product Serial Number: ...
    Display Range Limits:
      Monitor ranges (GTF): 55-76 Hz V, 30-103 kHz H, max dotclock 310 MHz
    Display Product Name: 'PL3070WQ'
  Extension blocks: 1
Checksum: 0xe7

----------------

Block 1, CTA-861 Extension Block:
  Revision: 1
  Detailed Timing Descriptors:
    DTD 2:  2880x1620   60.000316 Hz  16:9     99.961 kHz    303.880000 MHz (641 mm x 401 mm)
                 Hfront   48 Hsync  32 Hback   80 Hpol P
                 Vfront    3 Vsync   5 Vback   38 Vpol N
    DTD 3:  2560x1440   59.950550 Hz  16:9     88.787 kHz    241.500000 MHz (641 mm x 401 mm)
                 Hfront   48 Hsync  32 Hback   80 Hpol P
                 Vfront    3 Vsync   5 Vback   33 Vpol N
Checksum: 0xac  Unused space in Extension Block: 87 bytes

----------------

Block 2, Unknown EDID Extension Block 0x00:
  00 ff ff ff ff ff ff 00 26 cd 01 76 01 01 01 01 '........&..v....'
  2b 1b 01 03 80 40 28 78 2a 1d f5 ae 4f 35 b3 25 '+....@(x*...O5.%'
  0d 50 54 bf ef 80 81 80 95 00 a9 c0 a9 40 b3 00 '.PT..........@..'
  d1 c0 d1 00 e1 c0 e2 68 00 a0 a0 40 2e 60 30 20 '.......h...@.`0 '
  36 00 81 91 21 00 00 1a 00 00 00 ff 00 31 31 33 '6...!........113'
  32 38 37 34 33 30 30 34 33 33 00 00 00 fd 00 37 '2874300433.....7'
  4c 1e 67 1f 00 0a 20 20 20 20 20 20 00 00 00 fc 'L.g...      ....'
  00 50 4c 33 30 37 30 57 51 0a 20 20 20 20 01 e7 '.PL3070WQ.    ..'
Checksum: 0xe7

----------------

Block 3, CTA-861 Extension Block:
  Revision: 1
  Detailed Timing Descriptors:
    DTD 4:  2880x1620   60.000316 Hz  16:9     99.961 kHz    303.880000 MHz (641 mm x 401 mm)
                 Hfront   48 Hsync  32 Hback   80 Hpol P
                 Vfront    3 Vsync   5 Vback   38 Vpol N
    DTD 5:  2560x1440   59.950550 Hz  16:9     88.787 kHz    241.500000 MHz (641 mm x 401 mm)
                 Hfront   48 Hsync  32 Hback   80 Hpol P
                 Vfront    3 Vsync   5 Vback   33 Vpol N
Checksum: 0xac  Unused space in Extension Block: 87 bytes

----------------

Warnings:

Block 1, CTA-861 Extension Block:
  Display Product Serial Number is set, so the Serial Number in the Base EDID should be 0.
  Add a Colorimetry Data Block with the sRGB colorimetry bit set to avoid interop issues.
Block 3, CTA-861 Extension Block:
  Display Product Serial Number is set, so the Serial Number in the Base EDID should be 0.
  Add a Colorimetry Data Block with the sRGB colorimetry bit set to avoid interop issues.

Failures:

Block 1, CTA-861 Extension Block:
  Missing VCDB, needed for Set Selectable RGB Quantization to avoid interop issues.
Block 2, Base EDID:
  Unknown Extension Block.
Block 3, CTA-861 Extension Block:
  Missing VCDB, needed for Set Selectable RGB Quantization to avoid interop issues.
EDID:
  Base EDID: EDID specified 1 extension block(s), but found 3 extension block(s).
  Base EDID: EDID 1.3 requires a Block Map Extension in Block 1 if there are more than 2 blocks in the EDID.

EDID conformity: FAIL
