edid-decode (hex):

00 ff ff ff ff ff ff 00 30 64 80 f9 ba 74 01 00
0d 13 01 03 68 28 19 78 2a 4c 70 a6 57 49 9c 26
11 50 54 bf ef 00 71 4f 81 40 81 80 95 00 b3 00
81 00 01 01 01 01 21 39 90 30 62 1a 27 40 68 b0
36 00 c2 2c 11 00 00 1c 00 00 00 ff 00 4b 37 31
39 33 4a 41 30 39 35 34 31 38 00 00 00 fd 00 37
4b 1e 55 0f 00 0a 20 20 20 20 20 20 00 00 00 fc
00 4c 43 44 2d 4d 4f 4e 49 54 4f 52 0a 20 00 82

----------------

Block 0, Base EDID:
  EDID Structure Version & Revision: 1.3
  Vendor & Product Identification:
    Manufacturer: LCD
    Model: 63872
    Serial Number: ...
    Made in: week 13 of 2009
  Basic Display Parameters & Features:
    Analog display
    Input voltage level: 0.7/0.7 V
    Blank level equals black level
    Sync: Separate
    Maximum image size: 40 cm x 25 cm
    Gamma: 2.20
    DPMS levels: Off
    RGB color display
    First detailed timing is the preferred timing
  Color Characteristics:
    Red  : 0.6494, 0.3398
    Green: 0.2880, 0.6093
    Blue : 0.1494, 0.0693
    White: 0.3125, 0.3281
  Established Timings I & II:
    IBM     :   720x400    70.081663 Hz   9:5     31.467 kHz     28.320000 MHz
    DMT 0x04:   640x480    59.940476 Hz   4:3     31.469 kHz     25.175000 MHz
    Apple   :   640x480    66.666667 Hz   4:3     35.000 kHz     30.240000 MHz
    DMT 0x05:   640x480    72.808802 Hz   4:3     37.861 kHz     31.500000 MHz
    DMT 0x06:   640x480    75.000000 Hz   4:3     37.500 kHz     31.500000 MHz
    DMT 0x08:   800x600    56.250000 Hz   4:3     35.156 kHz     36.000000 MHz
    DMT 0x09:   800x600    60.316541 Hz   4:3     37.879 kHz     40.000000 MHz
    DMT 0x0a:   800x600    72.187572 Hz   4:3     48.077 kHz     50.000000 MHz
    DMT 0x0b:   800x600    75.000000 Hz   4:3     46.875 kHz     49.500000 MHz
    Apple   :   832x624    74.551266 Hz   4:3     49.726 kHz     57.284000 MHz
    DMT 0x10:  1024x768    60.003840 Hz   4:3     48.363 kHz     65.000000 MHz
    DMT 0x11:  1024x768    70.069359 Hz   4:3     56.476 kHz     75.000000 MHz
    DMT 0x12:  1024x768    75.028582 Hz   4:3     60.023 kHz     78.750000 MHz
    DMT 0x24:  1280x1024   75.024675 Hz   5:4     79.976 kHz    135.000000 MHz
  Standard Timings:
    DMT 0x15:  1152x864    75.000000 Hz   4:3     67.500 kHz    108.000000 MHz
    DMT 0x20:  1280x960    60.000000 Hz   4:3     60.000 kHz    108.000000 MHz
    DMT 0x23:  1280x1024   60.019740 Hz   5:4     63.981 kHz    108.000000 MHz
    DMT 0x2f:  1440x900    59.887445 Hz  16:10    55.935 kHz    106.500000 MHz
    DMT 0x3a:  1680x1050   59.954250 Hz  16:10    65.290 kHz    146.250000 MHz
    DMT 0x1c:  1280x800    59.810326 Hz  16:10    49.702 kHz     83.500000 MHz
  Detailed Timing Descriptors:
    DTD 1:  1680x1050   59.954250 Hz   8:5     65.290 kHz    146.250000 MHz (450 mm x 300 mm)
                 Hfront  104 Hsync 176 Hback  280 Hpol N
                 Vfront    3 Vsync   6 Vback   30 Vpol P
    Display Product Serial Number: ...
    Display Range Limits:
      Monitor ranges (GTF): 55-75 Hz V, 30-85 kHz H, max dotclock 150 MHz
    Display Product Name: 'LCD-MONITOR'
Checksum: 0x82

----------------

Failures:

Block 0, Base EDID:
  Detailed Timing Descriptor #1: Mismatch of image size 450x300 mm vs display size 400x250 mm.

EDID conformity: FAIL
