edid-decode (hex):

00 ff ff ff ff ff ff 00 1e 6d 63 77 12 70 00 00
08 1f 01 04 b5 46 28 78 9e ed d5 ae 51 39 b8 23
0e 50 54 21 08 00 d1 c0 61 40 45 40 01 01 01 01
01 01 01 01 01 01 4d d0 00 a0 f0 70 3e 80 30 20
65 0c bc 8b 21 00 00 1a 00 00 00 fd 00 2e 3d 1e
87 3c 00 0a 20 20 20 20 20 20 00 00 00 fc 00 33
32 45 50 39 35 30 0a 20 20 20 20 20 00 00 00 ff
00 31 30 38 4e 54 58 52 30 55 36 39 30 0a 02 c6

02 03 1f 72 23 09 07 07 44 01 03 04 10 83 01 00
00 e2 00 6a e3 05 c0 00 e6 06 05 01 6d 4a 02 a0
a5 00 a0 f0 70 31 80 30 20 3a 00 bc 8b 21 00 00
1a 56 5e 00 a0 a0 a0 29 50 30 20 35 00 bc 8b 21
00 00 1a a8 16 00 a0 80 38 13 40 30 20 3a 00 bc
8b 21 00 00 1a ef 51 00 a0 f0 70 19 80 30 20 3a
00 bc 8b 21 00 00 1a 00 00 00 00 00 00 00 00 00
00 00 00 00 00 00 00 00 00 00 00 00 00 00 00 41

70 12 79 03 00 01 00 0c 58 1b 6e 0f 00 0f 70 08
90 78 4e 99 03 00 28 4c d0 00 86 ff 0e 9f 00 2f
80 1f 00 6f 08 3d 00 02 00 09 00 1b 57 00 06 ff
0f 9f 00 2f 80 1f 00 6f 08 18 00 02 00 09 00 00
00 00 00 00 00 00 00 00 00 00 00 00 00 00 00 00
00 00 00 00 00 00 00 00 00 00 00 00 00 00 00 00
00 00 00 00 00 00 00 00 00 00 00 00 00 00 00 00
00 00 00 00 00 00 00 00 00 00 00 00 00 00 6c 90

----------------

Block 0, Base EDID:
  EDID Structure Version & Revision: 1.4
  Vendor & Product Identification:
    Manufacturer: GSM
    Model: 30563
    Serial Number: ...
    Made in: week 8 of 2021
  Basic Display Parameters & Features:
    Digital display
    Bits per primary color channel: 10
    DisplayPort interface
    Maximum image size: 70 cm x 40 cm
    Gamma: 2.20
    DPMS levels: Standby
    Supported color formats: RGB 4:4:4, YCrCb 4:4:4, YCrCb 4:2:2
    Default (sRGB) color space is primary color space
    First detailed timing includes the native pixel format and preferred refresh rate
  Color Characteristics:
    Red  : 0.6826, 0.3183
    Green: 0.2255, 0.7197
    Blue : 0.1396, 0.0556
    White: 0.3134, 0.3291
  Established Timings I & II:
    DMT 0x04:   640x480    59.940476 Hz   4:3     31.469 kHz     25.175000 MHz
    DMT 0x09:   800x600    60.316541 Hz   4:3     37.879 kHz     40.000000 MHz
    DMT 0x10:  1024x768    60.003840 Hz   4:3     48.363 kHz     65.000000 MHz
  Standard Timings:
    DMT 0x52:  1920x1080   60.000000 Hz  16:9     67.500 kHz    148.500000 MHz
    DMT 0x10:  1024x768    60.003840 Hz   4:3     48.363 kHz     65.000000 MHz
    DMT 0x09:   800x600    60.316541 Hz   4:3     37.879 kHz     40.000000 MHz
  Detailed Timing Descriptors:
    DTD 1:  3840x2160   59.996625 Hz  16:9    133.312 kHz    533.250000 MHz (700 mm x 395 mm)
                 Hfront   48 Hsync  32 Hback   80 Hpol P
                 Vfront   54 Vsync   5 Vback    3 Vpol N
    Display Range Limits:
      Monitor ranges (GTF): 46-61 Hz V, 30-135 kHz H, max dotclock 600 MHz
    Display Product Name: '32EP950'
    Display Product Serial Number: ...
  Extension blocks: 2
Checksum: 0xc6

----------------

Block 1, CTA-861 Extension Block:
  Revision: 3
  Basic audio support
  Supports YCbCr 4:4:4
  Supports YCbCr 4:2:2
  Native detailed modes: 2
  Audio Data Block:
    Linear PCM:
      Max channels: 2
      Supported sample rates (kHz): 48 44.1 32
      Supported sample sizes (bits): 24 20 16
  Video Data Block:
    VIC   1:   640x480    59.940476 Hz   4:3     31.469 kHz     25.175000 MHz
    VIC   3:   720x480    59.940060 Hz  16:9     31.469 kHz     27.000000 MHz
    VIC   4:  1280x720    60.000000 Hz  16:9     45.000 kHz     74.250000 MHz
    VIC  16:  1920x1080   60.000000 Hz  16:9     67.500 kHz    148.500000 MHz
  Speaker Allocation Data Block:
    FL/FR - Front Left/Right
  Video Capability Data Block:
    YCbCr quantization: No Data
    RGB quantization: Selectable (via AVI Q)
    PT scan behavior: Always Underscanned
    IT scan behavior: Always Underscanned
    CE scan behavior: Always Underscanned
  Colorimetry Data Block:
    BT2020YCC
    BT2020RGB
  HDR Static Metadata Data Block:
    Electro optical transfer functions:
      Traditional gamma - SDR luminance range
      SMPTE ST2084
    Supported static metadata descriptors:
      Static metadata type 1
    Desired content max luminance: 109 (530.095 cd/m^2)
    Desired content max frame-average luminance: 74 (248.372 cd/m^2)
    Desired content min luminance: 2 (0.000 cd/m^2)
  Detailed Timing Descriptors:
    DTD 2:  3840x2160   47.985514 Hz  16:9    106.000 kHz    424.000000 MHz (700 mm x 395 mm)
                 Hfront   48 Hsync  32 Hback   80 Hpol P
                 Vfront    3 Vsync  10 Vback   36 Vpol N
    DTD 3:  2560x1440   59.950550 Hz  16:9     88.787 kHz    241.500000 MHz (700 mm x 395 mm)
                 Hfront   48 Hsync  32 Hback   80 Hpol P
                 Vfront    3 Vsync   5 Vback   33 Vpol N
    DTD 4:  2048x1080   23.901834 Hz 256:135   26.268 kHz     58.000000 MHz (700 mm x 395 mm)
                 Hfront   48 Hsync  32 Hback   80 Hpol P
                 Vfront    3 Vsync  10 Vback    6 Vpol N
    DTD 5:  3840x2160   23.998856 Hz  16:9     52.438 kHz    209.750000 MHz (700 mm x 395 mm)
                 Hfront   48 Hsync  32 Hback   80 Hpol P
                 Vfront    3 Vsync  10 Vback   12 Vpol N
Checksum: 0x41  Unused space in Extension Block: 24 bytes

----------------

Block 2, DisplayID Extension Block:
  Version: 1.2
  Extension Count: 0
  Display Product Type: Standalone display device
  Display Parameters Data Block (0x01):
    Image size: 700.0 mm x 395.0 mm
    Display native pixel format: 3840x2160
    Feature support flags:
      Power management (DPM)
      Audio support on video interface
    Gamma: 2.20
    Aspect ratio: 1.78
    Dynamic bpc native: 10
    Dynamic bpc overall: 10
  Video Timing Modes Type 1 - Detailed Timings Data Block:
    DTD:  3840x2160   59.996625 Hz  64:27   133.312 kHz    533.250000 MHz (aspect 64:27, no 3D stereo, preferred)
               Hfront   48 Hsync  32 Hback   80 Hpol P
               Vfront    3 Vsync  10 Vback   49 Vpol N
    DTD:  4096x2160   23.980145 Hz  64:27    52.397 kHz    223.000000 MHz (aspect 64:27, no 3D stereo)
               Hfront   48 Hsync  32 Hback   80 Hpol P
               Vfront    3 Vsync  10 Vback   12 Vpol N
  Checksum: 0x6c
Checksum: 0x90

----------------

Warnings:

Block 0, Base EDID:
  Display Range Limits: GTF support is deprecated in EDID 1.4.
Block 1, CTA-861 Extension Block:
  IT Video Formats are overscanned by default, but normally this should be underscanned.
  Video Capability Data Block: Set Selectable YCbCr Quantization to avoid interop issues.
  Video Capability Data Block: S_PT is equal to S_IT and S_CE, so should be set to 0 instead.
  Display Product Serial Number is set, so the Serial Number in the Base EDID should be 0.
EDID:
  Base EDID: Some timings are out of range of the Monitor Ranges:
    Vertical Freq: 23.902 - 60.317 Hz (Monitor: 46.000 - 61.000 Hz)
    Horizontal Freq: 26.268 - 133.312 kHz (Monitor: 30.000 - 135.000 kHz)
  CTA-861: Multiple native progressive timings are defined.

Failures:

Block 0, Base EDID:
  Basic Display Parameters & Features: sRGB is signaled, but the chromaticities do not match.
  Display Range Limits: GTF can't be combined with non-continuous frequencies.
Block 1, CTA-861 Extension Block:
  Video Capability Data Block: IT video formats are always underscanned, but bit 7 of Byte 3 of the CTA-861 Extension header is set to overscanned.
EDID:
  DisplayID: Missing DisplayID Product Identification Data Block.
  DisplayID: Missing DisplayID Display Interface Features Data Block.

EDID conformity: FAIL
