
EDID (hex):
00ffffffffffff0004720508762c0011
0a1f0104a54627783b2c91a654519e26
125054bfef80d1cf714f8140818081c0
9500b3008100023a801871382d40582c
4500615c2100001e000000fd0030a5c1
c129010a202020202020000000fc0045
44333230515220530a202020000000ff
003231313030324337363357303101af
02032ff4480103041011131f3f230907
07830100006d1a0000020130a5000000
00000067030c0000003852e305030186
6f80a07038404030203500ba89210000
1eb49980787038594030203500ba8921
00001efc7e80887038124018203500ba
892100001e0000000000000000000000
000000000000000000000000000000b1

Extracted contents:
header:          00 ff ff ff ff ff ff 00
serial number:   04 72 05 08 76 2c 00 11 0a 1f
version:         01 04
basic params:    a5 46 27 78 3b
chroma info:     2c 91 a6 54 51 9e 26 12 50 54
established:     bf ef 80
standard:        d1 cf 71 4f 81 40 81 80 81 c0 95 00 b3 00 81 00
descriptor 1:    02 3a 80 18 71 38 2d 40 58 2c 45 00 61 5c 21 00 00 1e
descriptor 2:    00 00 00 fd 00 30 a5 c1 c1 29 01 0a 20 20 20 20 20 20
descriptor 3:    00 00 00 fc 00 45 44 33 32 30 51 52 20 53 0a 20 20 20
descriptor 4:    00 00 00 ff 00 32 31 31 30 30 32 43 37 36 33 57 30 31
extensions:      01
checksum:        af

EDID version: 1.4
Manufacturer: ACR Model 805 Serial Number --
Made in week 10 of 2021
Digital display
8 bits per primary color channel
DisplayPort interface
Maximum image size: 70 cm x 39 cm
Gamma: 2.20
DPMS levels: Off
Supported color formats: RGB 4:4:4, YCrCb 4:4:4, YCrCb 4:2:2
First detailed timing includes the native pixel format and preferred refresh rate
Display is continuous frequency
Display x,y Chromaticity:
  Red:   0.6484, 0.3300
  Green: 0.3193, 0.6171
  Blue:  0.1503, 0.0712
  White: 0.3125, 0.3291
Established timings supported:
  720x400@70Hz 9:5 HorFreq: 31469 Hz Clock: 28.320 MHz
  640x480@60Hz 4:3 HorFreq: 31469 Hz Clock: 25.175 MHz
  640x480@67Hz 4:3 HorFreq: 35000 Hz Clock: 30.240 MHz
  640x480@72Hz 4:3 HorFreq: 37900 Hz Clock: 31.500 MHz
  640x480@75Hz 4:3 HorFreq: 37500 Hz Clock: 31.500 MHz
  800x600@56Hz 4:3 HorFreq: 35200 Hz Clock: 36.000 MHz
  800x600@60Hz 4:3 HorFreq: 37900 Hz Clock: 40.000 MHz
  800x600@72Hz 4:3 HorFreq: 48100 Hz Clock: 50.000 MHz
  800x600@75Hz 4:3 HorFreq: 46900 Hz Clock: 49.500 MHz
  832x624@75Hz 4:3 HorFreq: 49726 Hz Clock: 57.284 MHz
  1024x768@60Hz 4:3 HorFreq: 48400 Hz Clock: 65.000 MHz
  1024x768@70Hz 4:3 HorFreq: 56500 Hz Clock: 75.000 MHz
  1024x768@75Hz 4:3 HorFreq: 60000 Hz Clock: 78.750 MHz
  1280x1024@75Hz 5:4 HorFreq: 80000 Hz Clock: 135.000 MHz
  1152x870@75Hz 192:145 HorFreq: 67500 Hz Clock: 108.000 MHz
Standard timings supported:
  1920x1080@75Hz 16:9
  1152x864@75Hz 4:3 HorFreq: 67500 Hz Clock: 108.000 MHz
  1280x960@60Hz 4:3 HorFreq: 60000 Hz Clock: 108.000 MHz
  1280x1024@60Hz 5:4 HorFreq: 64000 Hz Clock: 108.000 MHz
  1280x720@60Hz 16:9
  1440x900@60Hz 16:10 HorFreq: 55500 Hz Clock: 88.750 MHz
  1680x1050@60Hz 16:10 HorFreq: 64700 Hz Clock: 119.000 MHz
  1280x800@60Hz 16:10
Detailed mode: Clock 148.500 MHz, 609 mm x 348 mm
               1920 2008 2052 2200 hborder 0
               1080 1084 1089 1125 vborder 0
               +hsync +vsync 
               VertFreq: 60 Hz, HorFreq: 67500 Hz
Monitor ranges (bare limits): 48-165Hz V, 193-193kHz H, max dotclock 410MHz
Monitor name: ED320QR S
Serial number: --
Has 1 extension blocks
Checksum: 0xaf (valid)

CTA extension block
Extension version: 3
43 bytes of CTA data
  Video data block
    VIC   1 640x480@60Hz 4:3  HorFreq: 31469 Hz Clock: 25.175 MHz
    VIC   3 720x480@60Hz 16:9  HorFreq: 31469 Hz Clock: 27.000 MHz
    VIC   4 1280x720@60Hz 16:9  HorFreq: 45000 Hz Clock: 74.250 MHz
    VIC  16 1920x1080@60Hz 16:9  HorFreq: 67500 Hz Clock: 148.500 MHz
    VIC  17 720x576@50Hz 4:3  HorFreq: 31250 Hz Clock: 27.000 MHz
    VIC  19 1280x720@50Hz 16:9  HorFreq: 37500 Hz Clock: 74.250 MHz
    VIC  31 1920x1080@50Hz 16:9  HorFreq: 56250 Hz Clock: 148.500 MHz
    VIC  63 1920x1080@120Hz 16:9  HorFreq: 135000 Hz Clock: 297.000 MHz
  Audio data block
    Linear PCM, max channels 2
      Supported sample rates (kHz): 48 44.1 32
      Supported sample sizes (bits): 24 20 16
  Speaker allocation data block
    Speaker map:
      FL/FR - Front Left/Right
  Vendor-specific data block, OUI 00001a
  Vendor-specific data block, OUI 000c03 (HDMI)
    Source physical address 0.0.0.0
    DC_36bit
    DC_30bit
    DC_Y444
    Maximum TMDS clock: 410MHz
  Extended tag: Colorimetry data block
    xvYCC601
    xvYCC709
Underscans PC formats by default
Basic audio support
Supports YCbCr 4:4:4
Supports YCbCr 4:2:2
4 native detailed modes
Detailed mode: Clock 285.500 MHz, 698 mm x 393 mm
               1920 1968 2000 2080 hborder 0
               1080 1083 1088 1144 vborder 0
               +hsync +vsync 
               VertFreq: 119 Hz, HorFreq: 137259 Hz
Detailed mode: Clock 393.480 MHz, 698 mm x 393 mm
               1920 1968 2000 2040 hborder 0
               1080 1083 1088 1169 vborder 0
               +hsync +vsync 
               VertFreq: 164 Hz, HorFreq: 192882 Hz
Detailed mode: Clock 325.080 MHz, 698 mm x 393 mm
               1920 1944 1976 2056 hborder 0
               1080 1083 1088 1098 vborder 0
               +hsync +vsync 
               VertFreq: 144 Hz, HorFreq: 158112 Hz
Checksum: 0xb1 (valid)

EDID block does NOT conform to EDID 1.4!
	HDMI VSDB Max TMDS rate is > 340
Warning: One or more of the timings is out of range of the Monitor Ranges:
  Vertical Freq: 50 - 164 Hz
  Horizontal Freq: 31250 - 192882 Hz
  Maximum Clock: 393.480 MHz
EDID block does not conform at all!
	Both the serial number and the serial string are set


