
EDID (hex):
00ffffffffffff004c2d200d594d5a5a
341b010380341d782a9315a655519c27
115054bb8c00b30081c0810081809500
a9c001010101023a801871382d40582c
450009252100001e000000fd0030481e
5216000a202020202020000000fc0053
3234463335300a2020202020000000ff
0048345a4a4330383633310a20200144
02031c814690041f13131367030c0010
00002b681a00000101004800011d00bc
52d01e20b828554009252100001e011d
007251d01e206e285500092521000018
011d007251d01e206e28550009252100
0018215280a07238304088c835000925
2100001c000000000000000000000000
00000000000000000000000000000074

edid-decode (hex):

00 ff ff ff ff ff ff 00 4c 2d 20 0d 59 4d 5a 5a
34 1b 01 03 80 34 1d 78 2a 93 15 a6 55 51 9c 27
11 50 54 bb 8c 00 b3 00 81 c0 81 00 81 80 95 00
a9 c0 01 01 01 01 02 3a 80 18 71 38 2d 40 58 2c
45 00 09 25 21 00 00 1e 00 00 00 fd 00 30 48 1e
52 16 00 0a 20 20 20 20 20 20 00 00 00 fc 00 53
32 34 46 33 35 30 0a 20 20 20 20 20 00 00 00 ff
00 48 34 5a 4a 43 30 38 36 33 31 0a 20 20 01 44

02 03 1c 81 46 90 04 1f 13 13 13 67 03 0c 00 10
00 00 2b 68 1a 00 00 01 01 00 48 00 01 1d 00 bc
52 d0 1e 20 b8 28 55 40 09 25 21 00 00 1e 01 1d
00 72 51 d0 1e 20 6e 28 55 00 09 25 21 00 00 18
01 1d 00 72 51 d0 1e 20 6e 28 55 00 09 25 21 00
00 18 21 52 80 a0 72 38 30 40 88 c8 35 00 09 25
21 00 00 1c 00 00 00 00 00 00 00 00 00 00 00 00
00 00 00 00 00 00 00 00 00 00 00 00 00 00 00 74

----------------

Block 0, Base EDID:
  EDID Structure Version & Revision: 1.3
  Vendor & Product Identification:
    Manufacturer: SAM
    Model: 3360
    Serial Number: 1515867481
    Made in: week 52 of 2017
  Basic Display Parameters & Features:
    Digital display
    Maximum image size: 52 cm x 29 cm
    Gamma: 2.20
    DPMS levels: Off
    RGB color display
    First detailed timing is the preferred timing
  Color Characteristics:
    Red  : 0.6503, 0.3330
    Green: 0.3164, 0.6123
    Blue : 0.1523, 0.0673
    White: 0.3134, 0.3291
  Established Timings I & II:
    IBM     :   720x400    70.081663 Hz   9:5     31.467 kHz     28.320000 MHz
    DMT 0x04:   640x480    59.940476 Hz   4:3     31.469 kHz     25.175000 MHz
    Apple   :   640x480    66.666667 Hz   4:3     35.000 kHz     30.240000 MHz
    DMT 0x05:   640x480    72.808802 Hz   4:3     37.861 kHz     31.500000 MHz
    DMT 0x08:   800x600    56.250000 Hz   4:3     35.156 kHz     36.000000 MHz
    DMT 0x09:   800x600    60.316541 Hz   4:3     37.879 kHz     40.000000 MHz
    DMT 0x0a:   800x600    72.187572 Hz   4:3     48.077 kHz     50.000000 MHz
    DMT 0x10:  1024x768    60.003840 Hz   4:3     48.363 kHz     65.000000 MHz
    DMT 0x11:  1024x768    70.069359 Hz   4:3     56.476 kHz     75.000000 MHz
  Standard Timings:
    DMT 0x3a:  1680x1050   59.954250 Hz  16:10    65.290 kHz    146.250000 MHz
    DMT 0x55:  1280x720    60.000000 Hz  16:9     45.000 kHz     74.250000 MHz
    DMT 0x1c:  1280x800    59.810326 Hz  16:10    49.702 kHz     83.500000 MHz
    DMT 0x23:  1280x1024   60.019740 Hz   5:4     63.981 kHz    108.000000 MHz
    DMT 0x2f:  1440x900    59.887445 Hz  16:10    55.935 kHz    106.500000 MHz
    DMT 0x53:  1600x900    60.000000 Hz  16:9     60.000 kHz    108.000000 MHz (RB)
  Detailed Timing Descriptors:
    DTD 1:  1920x1080   60.000000 Hz  16:9     67.500 kHz    148.500000 MHz (521 mm x 293 mm)
                 Hfront   88 Hsync  44 Hback  148 Hpol P
                 Vfront    4 Vsync   5 Vback   36 Vpol P
    Display Range Limits:
      Monitor ranges (GTF): 48-72 Hz V, 30-82 kHz H, max dotclock 220 MHz
    Display Product Name: 'S24F350'
    Display Product Serial Number: 'H4ZJC08631'
  Extension blocks: 1
Checksum: 0x44

----------------

Block 1, CTA-861 Extension Block:
  Revision: 3
  Underscans IT Video Formats by default
  Native detailed modes: 1
  Video Data Block:
    VIC  16:  1920x1080   60.000000 Hz  16:9     67.500 kHz    148.500000 MHz (native)
    VIC   4:  1280x720    60.000000 Hz  16:9     45.000 kHz     74.250000 MHz
    VIC  31:  1920x1080   50.000000 Hz  16:9     56.250 kHz    148.500000 MHz
    VIC  19:  1280x720    50.000000 Hz  16:9     37.500 kHz     74.250000 MHz
    VIC  19:  1280x720    50.000000 Hz  16:9     37.500 kHz     74.250000 MHz
    VIC  19:  1280x720    50.000000 Hz  16:9     37.500 kHz     74.250000 MHz
  Vendor-Specific Data Block (HDMI), OUI 00-0C-03:
    Source physical address: 1.0.0.0
    Maximum TMDS clock: 215 MHz
  Vendor-Specific Data Block (AMD), OUI 00-00-1A:
    Version: 1.1
    Minimum Refresh Rate: 0 Hz
    Maximum Refresh Rate: 72 Hz
    Flags 1.x: 0x00
  Detailed Timing Descriptors:
    DTD 2:  1280x720    50.000000 Hz  16:9     37.500 kHz     74.250000 MHz (521 mm x 293 mm)
                 Hfront  440 Hsync  40 Hback  220 Hpol P
                 Vfront    5 Vsync   5 Vback   20 Vpol P
    DTD 3:  1280x720    60.000000 Hz  16:9     45.000 kHz     74.250000 MHz (521 mm x 293 mm)
                 Hfront  110 Hsync  40 Hback  220 Hpol N
                 Vfront    5 Vsync   5 Vback   20 Vpol N
    DTD 4:  1280x720    60.000000 Hz  16:9     45.000 kHz     74.250000 MHz (521 mm x 293 mm)
                 Hfront  110 Hsync  40 Hback  220 Hpol N
                 Vfront    5 Vsync   5 Vback   20 Vpol N
    DTD 5:  1920x1080   71.910434 Hz  16:9     81.115 kHz    210.250000 MHz (521 mm x 293 mm)
                 Hfront  136 Hsync 200 Hback  336 Hpol N
                 Vfront    3 Vsync   5 Vback   40 Vpol P
Checksum: 0x74  Unused space in Extension Block: 27 bytes


