edid-decode (hex):

00 ff ff ff ff ff ff 00 30 e4 3b 03 00 00 00 00
00 16 01 03 80 22 13 78 0a 61 d5 9e 5e 5b 9a 26
1a 50 54 00 00 00 01 01 01 01 01 01 01 01 01 01
01 01 01 01 01 01 e2 1d 56 c4 50 00 30 30 24 30
35 00 58 c2 10 00 00 19 00 00 00 00 00 00 00 00
00 00 00 00 00 00 00 00 00 00 00 00 00 fe 00 4c
47 20 44 69 73 70 6c 61 79 0a 20 20 00 00 00 fe
00 4c 50 31 35 36 57 48 34 2d 54 4c 50 31 00 8b

----------------

Block 0, Base EDID:
  EDID Structure Version & Revision: 1.3
  Vendor & Product Identification:
    Manufacturer: LGD
    Model: 827
    Made in: 2012
  Basic Display Parameters & Features:
    Digital display
    Maximum image size: 34 cm x 19 cm
    Gamma: 2.20
    RGB color display
    First detailed timing is the preferred timing
  Color Characteristics:
    Red  : 0.6181, 0.3691
    Green: 0.3554, 0.6025
    Blue : 0.1513, 0.1025
    White: 0.3134, 0.3291
  Established Timings I & II: none
  Standard Timings: none
  Detailed Timing Descriptors:
    DTD 1:  1366x768    60.019206 Hz 683:384   48.976 kHz     76.500000 MHz (344 mm x 194 mm)
                 Hfront   36 Hsync  48 Hback  112 Hpol N
                 Vfront    3 Vsync   5 Vback   40 Vpol N
    Empty Descriptor
    Alphanumeric Data String: 'LG Display'
    Alphanumeric Data String: 'LP156WH4-TLP1'
Checksum: 0x8b

----------------

Failures:

Block 0, Base EDID:
  Empty Descriptor: Use Dummy Descriptor instead of all zeroes.
  Missing Display Product Name.
  Missing Display Range Limits Descriptor.

EDID conformity: FAIL
