
EDID (hex):
00ffffffffffff0015c391269957f901
2c190104b53c2278e212e5b14e37b625
0c5054a10800a94081808140d1c00101
010101010101565e00a0a0a029503020
350055502100001a283c80a070b02340
3020360055502100001a000000fd003b
3d1f5919000a202020202020000000fc
0043533237300a20202020202020006d

Extracted contents:
header:          00 ff ff ff ff ff ff 00
serial number:   15 c3 91 26 99 57 f9 01 2c 19
version:         01 04
basic params:    b5 3c 22 78 e2
chroma info:     12 e5 b1 4e 37 b6 25 0c 50 54
established:     a1 08 00
standard:        a9 40 81 80 81 40 d1 c0 01 01 01 01 01 01 01 01
descriptor 1:    56 5e 00 a0 a0 a0 29 50 30 20 35 00 55 50 21 00 00 1a
descriptor 2:    28 3c 80 a0 70 b0 23 40 30 20 36 00 55 50 21 00 00 1a
descriptor 3:    00 00 00 fd 00 3b 3d 1f 59 19 00 0a 20 20 20 20 20 20
descriptor 4:    00 00 00 fc 00 43 53 32 37 30 0a 20 20 20 20 20 20 20
extensions:      00
checksum:        6d

EDID version: 1.4
Manufacturer: ENC Model 2691 Serial Number --
Made in week 44 of 2015
Digital display
10 bits per primary color channel
DisplayPort interface
Maximum image size: 60 cm x 34 cm
Gamma: 2.20
DPMS levels: Standby Suspend Off
Supported color formats: RGB 4:4:4
First detailed timing includes the native pixel format and preferred refresh rate
Display x,y Chromaticity:
  Red:   0.6914, 0.3056
  Green: 0.2148, 0.7128
  Blue:  0.1474, 0.0488
  White: 0.3134, 0.3291
Established timings supported:
  720x400@70Hz 9:5 HorFreq: 31469 Hz Clock: 28.320 MHz
  640x480@60Hz 4:3 HorFreq: 31469 Hz Clock: 25.175 MHz
  800x600@60Hz 4:3 HorFreq: 37900 Hz Clock: 40.000 MHz
  1024x768@60Hz 4:3 HorFreq: 48400 Hz Clock: 65.000 MHz
Standard timings supported:
  1600x1200@60Hz 4:3 HorFreq: 75000 Hz Clock: 162.000 MHz
  1280x1024@60Hz 5:4 HorFreq: 64000 Hz Clock: 108.000 MHz
  1280x960@60Hz 4:3 HorFreq: 60000 Hz Clock: 108.000 MHz
  1920x1080@60Hz 16:9
Detailed mode: Clock 241.500 MHz, 597 mm x 336 mm
               2560 2608 2640 2720 hborder 0
               1440 1443 1448 1481 vborder 0
               +hsync -vsync 
               VertFreq: 59 Hz, HorFreq: 88786 Hz
Detailed mode: Clock 154.000 MHz, 597 mm x 336 mm
               1920 1968 2000 2080 hborder 0
               1200 1203 1209 1235 vborder 0
               +hsync -vsync 
               VertFreq: 59 Hz, HorFreq: 74038 Hz
Monitor ranges (GTF): 59-61Hz V, 31-89kHz H, max dotclock 250MHz
Monitor name: CS270
Checksum: 0x6d (valid)
Warning: One or more of the timings is out of range of the Monitor Ranges:
  Vertical Freq: 59 - 70 Hz
  Horizontal Freq: 31469 - 88786 Hz
  Maximum Clock: 241.500 MHz


