
EDID (hex):
00ffffffffffff000469aa190e070000
02120103682819782a4c70a657499c26
115054bfef00714f814081809500b300
81000101010121399030621a274018b0
3640c22c1100001c000000ff0038314c
4d544e3030313830360a000000fd0037
4b1e550f000a202020202020000000fc
00415355532056573139380a202000fa

Extracted contents:
header:          00 ff ff ff ff ff ff 00
serial number:   04 69 aa 19 0e 07 00 00 02 12
version:         01 03
basic params:    68 28 19 78 2a
chroma info:     4c 70 a6 57 49 9c 26 11 50 54
established:     bf ef 00
standard:        71 4f 81 40 81 80 95 00 b3 00 81 00 01 01 01 01
descriptor 1:    21 39 90 30 62 1a 27 40 18 b0 36 40 c2 2c 11 00 00 1c
descriptor 2:    00 00 00 ff 00 38 31 4c 4d 54 4e 30 30 31 38 30 36 0a
descriptor 3:    00 00 00 fd 00 37 4b 1e 55 0f 00 0a 20 20 20 20 20 20
descriptor 4:    00 00 00 fc 00 41 53 55 53 20 56 57 31 39 38 0a 20 20
extensions:      00
checksum:        fa

EDID version: 1.3
Manufacturer: ACI Model 19aa Serial Number --
Made in week 2 of 2008
Analog display, Input voltage level: 0.7/0.7 V
Sync: Separate 
Maximum image size: 40 cm x 25 cm
Gamma: 2.20
DPMS levels: Off
RGB color display
First detailed timing is preferred timing
Display x,y Chromaticity:
  Red:   0.6494, 0.3398
  Green: 0.2880, 0.6093
  Blue:  0.1494, 0.0693
  White: 0.3125, 0.3281
Established timings supported:
  720x400@70Hz 9:5 HorFreq: 31469 Hz Clock: 28.320 MHz
  640x480@60Hz 4:3 HorFreq: 31469 Hz Clock: 25.175 MHz
  640x480@67Hz 4:3 HorFreq: 35000 Hz Clock: 30.240 MHz
  640x480@72Hz 4:3 HorFreq: 37900 Hz Clock: 31.500 MHz
  640x480@75Hz 4:3 HorFreq: 37500 Hz Clock: 31.500 MHz
  800x600@56Hz 4:3 HorFreq: 35200 Hz Clock: 36.000 MHz
  800x600@60Hz 4:3 HorFreq: 37900 Hz Clock: 40.000 MHz
  800x600@72Hz 4:3 HorFreq: 48100 Hz Clock: 50.000 MHz
  800x600@75Hz 4:3 HorFreq: 46900 Hz Clock: 49.500 MHz
  832x624@75Hz 4:3 HorFreq: 49726 Hz Clock: 57.284 MHz
  1024x768@60Hz 4:3 HorFreq: 48400 Hz Clock: 65.000 MHz
  1024x768@70Hz 4:3 HorFreq: 56500 Hz Clock: 75.000 MHz
  1024x768@75Hz 4:3 HorFreq: 60000 Hz Clock: 78.750 MHz
  1280x1024@75Hz 5:4 HorFreq: 80000 Hz Clock: 135.000 MHz
Standard timings supported:
  1152x864@75Hz 4:3 HorFreq: 67500 Hz Clock: 108.000 MHz
  1280x960@60Hz 4:3 HorFreq: 60000 Hz Clock: 108.000 MHz
  1280x1024@60Hz 5:4 HorFreq: 64000 Hz Clock: 108.000 MHz
  1440x900@60Hz 16:10 HorFreq: 55500 Hz Clock: 88.750 MHz
  1680x1050@60Hz 16:10 HorFreq: 64700 Hz Clock: 119.000 MHz
  1280x800@60Hz 16:10
Detailed mode: Clock 146.250 MHz, 450 mm x 300 mm
               1680 1960 2136 2240 hborder 0
               1050 1053 1059 1089 vborder 0
               -hsync +vsync 
               VertFreq: 59 Hz, HorFreq: 65290 Hz
Serial number: --
Monitor ranges (GTF): 55-75Hz V, 30-85kHz H, max dotclock 150MHz
Monitor name: ASUS VW198
Checksum: 0xfa (valid)
