edid-decode (hex):

00 ff ff ff ff ff ff 00 05 e3 31 24 01 01 01 01
01 19 01 04 a5 33 1d 78 26 62 b5 a1 59 57 a2 26
0c 50 54 21 08 00 81 c0 81 80 01 01 01 01 01 01
01 01 01 01 01 01 02 3a 80 18 71 38 2d 40 58 2c
45 00 fd 1e 11 00 00 1e 66 21 50 b0 51 00 1b 30
40 70 36 00 fd 1e 11 00 00 18 00 00 00 fc 00 41
4f 43 20 54 56 0a 20 20 20 20 20 20 00 00 00 fd
00 38 4c 1e 53 0f 00 0a 20 20 20 20 20 20 00 44

00 ff ff ff ff ff ff 00 05 e3 31 24 01 01 01 01
01 19 01 04 a5 33 1d 78 26 62 b5 a1 59 57 a2 26
0c 50 54 21 08 00 81 c0 81 80 01 01 01 01 01 01
01 01 01 01 01 01 02 3a 80 18 71 38 2d 40 58 2c
45 00 fd 1e 11 00 00 1e 66 21 50 b0 51 00 1b 30
40 70 36 00 fd 1e 11 00 00 18 00 00 00 fc 00 41
4f 43 20 54 56 0a 20 20 20 20 20 20 00 00 00 fd
00 38 4c 1e 53 0f 00 0a 20 20 20 20 20 20 00 44

----------------

Block 0, Base EDID:
  EDID Structure Version & Revision: 1.4
  Vendor & Product Identification:
    Manufacturer: AOC
    Model: 9265
    Serial Number: ...
    Made in: week 1 of 2015
  Basic Display Parameters & Features:
    Digital display
    Bits per primary color channel: 8
    DisplayPort interface
    Maximum image size: 51 cm x 29 cm
    Gamma: 2.20
    DPMS levels: Off
    Supported color formats: RGB 4:4:4
    Default (sRGB) color space is primary color space
    First detailed timing includes the native pixel format and preferred refresh rate
  Color Characteristics:
    Red  : 0.6298, 0.3496
    Green: 0.3398, 0.6347
    Blue : 0.1503, 0.0498
    White: 0.3134, 0.3291
  Established Timings I & II:
    DMT 0x04:   640x480    59.940476 Hz   4:3     31.469 kHz     25.175000 MHz
    DMT 0x09:   800x600    60.316541 Hz   4:3     37.879 kHz     40.000000 MHz
    DMT 0x10:  1024x768    60.003840 Hz   4:3     48.363 kHz     65.000000 MHz
  Standard Timings:
    DMT 0x55:  1280x720    60.000000 Hz  16:9     45.000 kHz     74.250000 MHz
    DMT 0x23:  1280x1024   60.019740 Hz   5:4     63.981 kHz    108.000000 MHz
  Detailed Timing Descriptors:
    DTD 1:  1920x1080   60.000000 Hz  16:9     67.500 kHz    148.500000 MHz (509 mm x 286 mm)
                 Hfront   88 Hsync  44 Hback  148 Hpol P
                 Vfront    4 Vsync   5 Vback   36 Vpol P
    DTD 2:  1360x768    60.015162 Hz  85:48    47.712 kHz     85.500000 MHz (509 mm x 286 mm)
                 Hfront   64 Hsync 112 Hback  256 Hpol N
                 Vfront    3 Vsync   6 Vback   18 Vpol N
    Display Product Name: 'AOC TV'
    Display Range Limits:
      Monitor ranges (GTF): 56-76 Hz V, 30-83 kHz H, max dotclock 150 MHz
Checksum: 0x44

----------------

Block 1, Unknown EDID Extension Block 0x00:
  00 ff ff ff ff ff ff 00 05 e3 31 24 01 01 01 01 '..........1$....'
  01 19 01 04 a5 33 1d 78 26 62 b5 a1 59 57 a2 26 '.....3.x&b..YW.&'
  0c 50 54 21 08 00 81 c0 81 80 01 01 01 01 01 01 '.PT!............'
  01 01 01 01 01 01 02 3a 80 18 71 38 2d 40 58 2c '.......:..q8-@X,'
  45 00 fd 1e 11 00 00 1e 66 21 50 b0 51 00 1b 30 'E.......f!P.Q..0'
  40 70 36 00 fd 1e 11 00 00 18 00 00 00 fc 00 41 '@p6............A'
  4f 43 20 54 56 0a 20 20 20 20 20 20 00 00 00 fd 'OC TV.      ....'
  00 38 4c 1e 53 0f 00 0a 20 20 20 20 20 20 00 44 '.8L.S...      .D'
Checksum: 0x44

----------------

Warnings:

Block 0, Base EDID:
  Detailed Timing Descriptor #2: DTD is similar but not identical to DMT 0x27.
  Display Range Limits: GTF support is deprecated in EDID 1.4.

Failures:

Block 0, Base EDID:
  Basic Display Parameters & Features: sRGB is signaled, but the chromaticities do not match.
  Display Range Limits: GTF can't be combined with non-continuous frequencies.
Block 1, Base EDID:
  Unknown Extension Block.
EDID:
  Base EDID: EDID specified 0 extension block(s), but found 1 extension block(s).

EDID conformity: FAIL
