
EDID (hex):
00ffffffffffff00410c81c06b020100
2c1601036e301b782a0a45a7544a9925
115054bd4b00d1c08180950f9500b300
010101010101023a801871382d40582c
4500e00c1100001e000000ff00554b30
31323434303636313535000000fc0050
68696c69707320323236564c000000fd
00384c1e5311000a2020202020200039

Extracted contents:
header:          00 ff ff ff ff ff ff 00
serial number:   41 0c 81 c0 6b 02 01 00 2c 16
version:         01 03
basic params:    6e 30 1b 78 2a
chroma info:     0a 45 a7 54 4a 99 25 11 50 54
established:     bd 4b 00
standard:        d1 c0 81 80 95 0f 95 00 b3 00 01 01 01 01 01 01
descriptor 1:    02 3a 80 18 71 38 2d 40 58 2c 45 00 e0 0c 11 00 00 1e
descriptor 2:    00 00 00 ff 00 55 4b 30 31 32 34 34 30 36 36 31 35 35
descriptor 3:    00 00 00 fc 00 50 68 69 6c 69 70 73 20 32 32 36 56 4c
descriptor 4:    00 00 00 fd 00 38 4c 1e 53 11 00 0a 20 20 20 20 20 20
extensions:      00
checksum:        39

EDID version: 1.3
Manufacturer: PHL Model c081 Serial Number --
Made in week 44 of 2012
Analog display, Input voltage level: 0.7/0.7 V
Sync: Separate Composite SyncOnGreen 
Maximum image size: 48 cm x 27 cm
Gamma: 2.20
DPMS levels: Off
RGB color display
First detailed timing is preferred timing
Display x,y Chromaticity:
  Red:   0.6523, 0.3281
  Green: 0.2910, 0.5996
  Blue:  0.1455, 0.0664
  White: 0.3134, 0.3291
Established timings supported:
  720x400@70Hz 9:5 HorFreq: 31469 Hz Clock: 28.320 MHz
  640x480@60Hz 4:3 HorFreq: 31469 Hz Clock: 25.175 MHz
  640x480@67Hz 4:3 HorFreq: 35000 Hz Clock: 30.240 MHz
  640x480@72Hz 4:3 HorFreq: 37900 Hz Clock: 31.500 MHz
  640x480@75Hz 4:3 HorFreq: 37500 Hz Clock: 31.500 MHz
  800x600@60Hz 4:3 HorFreq: 37900 Hz Clock: 40.000 MHz
  800x600@75Hz 4:3 HorFreq: 46900 Hz Clock: 49.500 MHz
  1024x768@60Hz 4:3 HorFreq: 48400 Hz Clock: 65.000 MHz
  1024x768@75Hz 4:3 HorFreq: 60000 Hz Clock: 78.750 MHz
  1280x1024@75Hz 5:4 HorFreq: 80000 Hz Clock: 135.000 MHz
Standard timings supported:
  1920x1080@60Hz 16:9
  1280x1024@60Hz 5:4 HorFreq: 64000 Hz Clock: 108.000 MHz
  1440x900@75Hz 16:10 HorFreq: 82300 Hz Clock: 156.000 MHz
  1440x900@60Hz 16:10 HorFreq: 55500 Hz Clock: 88.750 MHz
  1680x1050@60Hz 16:10 HorFreq: 64700 Hz Clock: 119.000 MHz
Detailed mode: Clock 148.500 MHz, 480 mm x 268 mm
               1920 2008 2052 2200 hborder 0
               1080 1084 1089 1125 vborder 0
               +hsync +vsync 
               VertFreq: 60 Hz, HorFreq: 67500 Hz
Serial number: --
Monitor ranges (GTF): 56-76Hz V, 30-83kHz H, max dotclock 170MHz
Checksum: 0x39 (valid)
EDID block does NOT conform to EDID 1.3!
	Name descriptor not terminated with a newline
