
EDID (hex):
00ffffffffffff002264ec030f060000
0716010380160e780a88659258518a28
1b505400000001010101010101010101
010101010101c61b00a0502017300e20
3600d98800000019000000fe00000000
00000000000000000000000000fc0048
534431303150575731410a2000000010
000a20202020202020202020202000d7

Extracted contents:
header:          00 ff ff ff ff ff ff 00
serial number:   22 64 ec 03 0f 06 00 00 07 16
version:         01 03
basic params:    80 16 0e 78 0a
chroma info:     88 65 92 58 51 8a 28 1b 50 54
established:     00 00 00
standard:        01 01 01 01 01 01 01 01 01 01 01 01 01 01 01 01
descriptor 1:    c6 1b 00 a0 50 20 17 30 0e 20 36 00 d9 88 00 00 00 19
descriptor 2:    00 00 00 fe 00 00 00 00 00 00 00 00 00 00 00 00 00 00
descriptor 3:    00 00 00 fc 00 48 53 44 31 30 31 50 57 57 31 41 0a 20
descriptor 4:    00 00 00 10 00 0a 20 20 20 20 20 20 20 20 20 20 20 20
extensions:      00
checksum:        d7

EDID version: 1.3
Manufacturer: HSD Model 3ec Serial Number --
Made in week 7 of 2012
Digital display
Maximum image size: 22 cm x 14 cm
Gamma: 2.20
RGB color display
First detailed timing is preferred timing
Display x,y Chromaticity:
  Red:   0.5722, 0.3437
  Green: 0.3183, 0.5390
  Blue:  0.1572, 0.1074
  White: 0.3134, 0.3291
Established timings supported:
Standard timings supported:
Detailed mode: Clock 71.100 MHz, 217 mm x 136 mm
               1280 1294 1326 1440 hborder 0
                800  803  809  823 vborder 0
               -hsync -vsync 
               VertFreq: 59 Hz, HorFreq: 49375 Hz
ASCII string: 
Monitor name: HSD101PWW1A
Dummy block
Checksum: 0xd7 (valid)
EDID block does NOT conform to EDID 1.3!
	Missing monitor ranges
	Detailed block string not properly terminated
EDID block does not conform at all!
	Dummy block filled with garbage
