edid-decode (hex):

00 ff ff ff ff ff ff 00 26 cf 45 8c 00 00 00 00
01 1f 01 04 b5 1e 13 78 0e de 50 a3 54 4c 99 26
0f 50 54 00 00 00 01 01 01 01 01 01 01 01 01 01
01 01 01 01 01 01 8d 50 c0 a0 80 78 20 50 18 30
3c 00 2e bc 10 00 00 18 71 40 c0 a0 80 78 20 50
18 30 3c 00 2e bc 10 00 00 18 00 00 00 fe 00 44
47 4a 32 34 80 31 34 30 4e 57 48 45 00 00 00 00
00 03 41 21 1e 00 11 00 00 0b 41 0a 20 20 00 c8

----------------

Block 0, Base EDID:
  EDID Structure Version & Revision: 1.4
  Vendor & Product Identification:
    Manufacturer: IVO
    Model: 35909
    Made in: week 1 of 2021
  Basic Display Parameters & Features:
    Digital display
    Bits per primary color channel: 10
    DisplayPort interface
    Maximum image size: 30 cm x 19 cm
    Gamma: 2.20
    Supported color formats: RGB 4:4:4, YCrCb 4:4:4
    Default (sRGB) color space is primary color space
    First detailed timing includes the native pixel format and preferred refresh rate
  Color Characteristics:
    Red  : 0.6396, 0.3291
    Green: 0.2998, 0.5996
    Blue : 0.1494, 0.0595
    White: 0.3125, 0.3281
  Established Timings I & II: none
  Standard Timings: none
  Detailed Timing Descriptors:
    DTD 1:  2240x1400   60.000582 Hz  16:10    85.921 kHz    206.210000 MHz (302 mm x 188 mm)
                 Hfront   24 Hsync  48 Hback   88 Hpol N
                 Vfront    3 Vsync  12 Vback   17 Vpol N
    DTD 2:  2240x1400   48.001047 Hz  16:10    68.737 kHz    164.970000 MHz (302 mm x 188 mm)
                 Hfront   24 Hsync  48 Hback   88 Hpol N
                 Vfront    3 Vsync  12 Vback   17 Vpol N
    Alphanumeric Data String: 'DGJ24'
    Manufacturer-Specified Display Descriptor (0x00): 00 00 00 03 41 21 1e 00 11 00 00 0b 41 0a 20 20 '....A!......A.  '
Checksum: 0xc8

----------------

Warnings:

Block 0, Base EDID:
  Missing Display Product Name.

Failures:

Block 0, Base EDID:
  Basic Display Parameters & Features: sRGB is signaled, but the chromaticities do not match.
  Alphanumeric Data String: Non-printable character.

EDID conformity: FAIL
