
EDID (hex):
00ffffffffffff004c2d76714e575843
0d200103804024782a6115ad5045a426
0e5054bfef80714f810081c081809500
a9c0b300010108e80030f2705a80b058
8a0078682100001e000000fd0030901e
ff8f000a202020202020000000fc004c
53323841473730304e0a2020000000ff
0048345a543330313339370a2020036e
f0027000000000000000000000000000
00000000000000000000000000000000
00000000000000000000000000000000
00000000000000000000000000000000
00000000000000000000000000000000
00000000000000000000000000000000
00000000000000000000000000000000
0000000000000000000000000000009e
02034bf14761103f04035f7623090707
83010000e305c0006b030c001000b83c
200020016dd85dc401788053003090c3
54056d1a0000020f3090000461045a04
e6060501615a00e30f4100565e00a0a0
a029503020350078682100001a6fc200
a0a0a055503020350078682100001a00
00000000000000000000000000000037
701279000003013c512c0288ff0e2f02
f7801f006f0859004b00070097e20008
ff099f0007803f009f05280002000400
6f7e00087f074f0007801f0037042c00
1e000700000000000000000000000000
00000000000000000000000000000000
00000000000000000000000000000000
00000000000000000000000000007c90

Extracted contents:
header:          00 ff ff ff ff ff ff 00
serial number:   4c 2d 76 71 4e 57 58 43 0d 20
version:         01 03
basic params:    80 40 24 78 2a
chroma info:     61 15 ad 50 45 a4 26 0e 50 54
established:     bf ef 80
standard:        71 4f 81 00 81 c0 81 80 95 00 a9 c0 b3 00 01 01
descriptor 1:    08 e8 00 30 f2 70 5a 80 b0 58 8a 00 78 68 21 00 00 1e
descriptor 2:    00 00 00 fd 00 30 90 1e ff 8f 00 0a 20 20 20 20 20 20
descriptor 3:    00 00 00 fc 00 4c 53 32 38 41 47 37 30 30 4e 0a 20 20
descriptor 4:    00 00 00 ff 00 48 34 5a 54 33 30 31 33 39 37 0a 20 20
extensions:      03
checksum:        6e

EDID version: 1.3
Manufacturer: SAM Model 7176 Serial Number --
Made in week 13 of 2022
Digital display
Maximum image size: 64 cm x 36 cm
Gamma: 2.20
DPMS levels: Off
RGB color display
First detailed timing is preferred timing
Display x,y Chromaticity:
  Red:   0.6767, 0.3144
  Green: 0.2695, 0.6416
  Blue:  0.1484, 0.0556
  White: 0.3134, 0.3291
Established timings supported:
  720x400@70Hz 9:5 HorFreq: 31469 Hz Clock: 28.320 MHz
  640x480@60Hz 4:3 HorFreq: 31469 Hz Clock: 25.175 MHz
  640x480@67Hz 4:3 HorFreq: 35000 Hz Clock: 30.240 MHz
  640x480@72Hz 4:3 HorFreq: 37900 Hz Clock: 31.500 MHz
  640x480@75Hz 4:3 HorFreq: 37500 Hz Clock: 31.500 MHz
  800x600@56Hz 4:3 HorFreq: 35200 Hz Clock: 36.000 MHz
  800x600@60Hz 4:3 HorFreq: 37900 Hz Clock: 40.000 MHz
  800x600@72Hz 4:3 HorFreq: 48100 Hz Clock: 50.000 MHz
  800x600@75Hz 4:3 HorFreq: 46900 Hz Clock: 49.500 MHz
  832x624@75Hz 4:3 HorFreq: 49726 Hz Clock: 57.284 MHz
  1024x768@60Hz 4:3 HorFreq: 48400 Hz Clock: 65.000 MHz
  1024x768@70Hz 4:3 HorFreq: 56500 Hz Clock: 75.000 MHz
  1024x768@75Hz 4:3 HorFreq: 60000 Hz Clock: 78.750 MHz
  1280x1024@75Hz 5:4 HorFreq: 80000 Hz Clock: 135.000 MHz
  1152x870@75Hz 192:145 HorFreq: 67500 Hz Clock: 108.000 MHz
Standard timings supported:
  1152x864@75Hz 4:3 HorFreq: 67500 Hz Clock: 108.000 MHz
  1280x800@60Hz 16:10
  1280x720@60Hz 16:9
  1280x1024@60Hz 5:4 HorFreq: 64000 Hz Clock: 108.000 MHz
  1440x900@60Hz 16:10 HorFreq: 55500 Hz Clock: 88.750 MHz
  1600x900@60Hz 16:9
  1680x1050@60Hz 16:10 HorFreq: 64700 Hz Clock: 119.000 MHz
Detailed mode: Clock 594.000 MHz, 632 mm x 360 mm
               3840 4016 4104 4400 hborder 0
               2160 2168 2178 2250 vborder 0
               +hsync +vsync 
               VertFreq: 60 Hz, HorFreq: 135000 Hz
Monitor ranges (GTF): 48-144Hz V, 30-255kHz H, max dotclock 1430MHz
Monitor name: LS28AG700N
Serial number: --
Has 3 extension blocks
Checksum: 0x6e (valid)

Block map


CTA extension block
Extension version: 3
71 bytes of CTA data
  Video data block
    VIC  97 3840x2160@60Hz 16:9  HorFreq: 135000 Hz Clock: 594.000 MHz
    VIC  16 1920x1080@60Hz 16:9  HorFreq: 67500 Hz Clock: 148.500 MHz
    VIC  63 1920x1080@120Hz 16:9  HorFreq: 135000 Hz Clock: 297.000 MHz
    VIC   4 1280x720@60Hz 16:9  HorFreq: 45000 Hz Clock: 74.250 MHz
    VIC   3 720x480@60Hz 16:9  HorFreq: 31469 Hz Clock: 27.000 MHz
    VIC  95 3840x2160@30Hz 16:9  HorFreq: 67500 Hz Clock: 297.000 MHz
    VIC 118 3840x2160@120Hz 16:9  HorFreq: 270000 Hz Clock: 1188.000 MHz
  Audio data block
    Linear PCM, max channels 2
      Supported sample rates (kHz): 48 44.1 32
      Supported sample sizes (bits): 24 20 16
  Speaker allocation data block
    Speaker map:
      FL/FR - Front Left/Right
  Extended tag: Colorimetry data block
    BT2020YCC
    BT2020RGB
  Vendor-specific data block, OUI 000c03 (HDMI)
    Source physical address 1.0.0.0
    Supports_AI
    DC_36bit
    DC_30bit
    DC_Y444
    Maximum TMDS clock: 300MHz
    Extended HDMI video details:
      HDMI VIC 1 3840x2160@30Hz 16:9 HorFreq: 67500 Hz Clock: 297.000 MHz
  Vendor-specific data block, OUI c45dd8 (HDMI Forum)
    Version: 1
    Maximum TMDS Character Rate: 600MHz
    SCDC Present
    Supports 12-bits/component Deep Color 4:2:0 Pixel Encoding
    Supports 10-bits/component Deep Color 4:2:0 Pixel Encoding
  Vendor-specific data block, OUI 00001a
  Extended tag: HDR static metadata data block
    Electro optical transfer functions:
      Traditional gamma - SDR luminance range
      SMPTE ST2084
    Supported static metadata descriptors:
      Static metadata type 1
    Desired content max luminance: 97 (408.759 cd/m^2)
    Desired content max frame-average luminance: 90 (351.250 cd/m^2)
    Desired content min luminance: 0 (0.000 cd/m^2)
  Extended tag: YCbCr 4:2:0 capability map data block
    VSD Index 0
    VSD Index 6
Underscans PC formats by default
Basic audio support
Supports YCbCr 4:4:4
Supports YCbCr 4:2:2
1 native detailed modes
Detailed mode: Clock 241.500 MHz, 632 mm x 360 mm
               2560 2608 2640 2720 hborder 0
               1440 1443 1448 1481 vborder 0
               +hsync -vsync 
               VertFreq: 59 Hz, HorFreq: 88786 Hz
Detailed mode: Clock 497.750 MHz, 632 mm x 360 mm
               2560 2608 2640 2720 hborder 0
               1440 1443 1448 1525 vborder 0
               +hsync -vsync 
               VertFreq: 119 Hz, HorFreq: 182996 Hz
Checksum: 0x37 (valid)


DisplayID extension block
Extension version: 18
Length 121, version 18, extension count 0
Checksum: 0x7c (valid)
Type 1 detailed timing: aspect: undefined, Preferred  
Detailed mode: Clock 1424.170 MHz, 0 mm x 0 mm
               3839 4086 4117 4398
               2159 2234 2241 2248
               +hsync -vsync
Type 1 detailed timing: aspect: undefined,  
Detailed mode: Clock 580.070 MHz, 0 mm x 0 mm
               2559 2566 2629 2718
               1439 1441 1445 1479
               +hsync -vsync
Type 1 detailed timing: aspect: undefined,  
Detailed mode: Clock 323.670 MHz, 0 mm x 0 mm
               1919 1926 1957 1998
               1079 1109 1116 1123
               +hsync -vsync

One or more of the timings is out of range of the Monitor Ranges:
  Vertical Freq: 30 - 120 Hz
  Horizontal Freq: 31469 - 270000 Hz
  Maximum Clock: 1188.000 MHz
EDID block does not conform at all!
	Has -1845493760 nonconformant extension block(s)
	Both the serial number and the serial string are set
