edid-decode (hex):

00 ff ff ff ff ff ff 00 52 d7 90 01 01 00 00 00
20 11 01 03 80 29 1a 78 2a d6 a5 a2 59 4a 95 24
14 50 54 a1 08 00 45 40 61 40 81 80 95 00 01 01
01 01 01 01 01 01 fa 1c 80 18 71 1c 16 20 58 2c
25 00 c4 8e 21 00 00 9e fa 1c 00 72 51 d0 1e 20
6e 28 55 00 c4 8e 21 00 00 1e 00 00 00 fd 00 3b
3d 1e 50 0a 00 0a 20 20 20 20 20 20 00 00 00 fc
00 4c 43 44 20 4d 4f 4e 49 54 4f 52 0a 20 01 8c

02 03 1c 72 48 03 84 85 07 12 13 14 16 23 0f 57
07 83 4f 00 00 66 03 0c 00 10 00 80 8f 0a d0 8a
20 e0 2d 10 10 3e 96 00 c4 8e 21 00 00 18 01 1d
80 d0 72 1c 16 20 10 2c 25 80 c4 8e 21 00 00 9e
01 1d 00 bc 52 d0 1e 20 b8 28 55 40 c4 8e 21 00
00 1e 8c 0a d0 90 20 40 31 20 0c 40 55 00 c4 8e
21 00 00 18 01 1d 80 18 71 1c 16 20 58 2c 25 00
c4 8e 21 00 00 9e 00 00 00 00 00 00 00 00 00 53

----------------

Block 0, Base EDID:
  EDID Structure Version & Revision: 1.3
  Vendor & Product Identification:
    Manufacturer: TVW
    Model: 400
    Serial Number: ...
    Made in: week 32 of 2007
  Basic Display Parameters & Features:
    Digital display
    Maximum image size: 41 cm x 26 cm
    Gamma: 2.20
    DPMS levels: Off
    RGB color display
    First detailed timing is preferred timing
  Color Characteristics:
    Red  : 0.6357, 0.3486
    Green: 0.2900, 0.5839
    Blue : 0.1425, 0.0800
    White: 0.3134, 0.3291
  Established Timings I & II:
    IBM     :   720x400    70.082 Hz   9:5    31.467 kHz  28.320 MHz
    DMT 0x04:   640x480    59.940 Hz   4:3    31.469 kHz  25.175 MHz
    DMT 0x09:   800x600    60.317 Hz   4:3    37.879 kHz  40.000 MHz
    DMT 0x10:  1024x768    60.004 Hz   4:3    48.363 kHz  65.000 MHz
  Standard Timings:
    DMT 0x09:   800x600    60.317 Hz   4:3    37.879 kHz  40.000 MHz
    DMT 0x10:  1024x768    60.004 Hz   4:3    48.363 kHz  65.000 MHz
    DMT 0x23:  1280x1024   60.020 Hz   5:4    63.981 kHz 108.000 MHz
    DMT 0x2f:  1440x900    59.887 Hz  16:10   55.935 kHz 106.500 MHz
  Detailed Timing Descriptors:
    DTD 1:  1920x1080i  59.943 Hz  16:9    33.718 kHz  74.180 MHz (708 mm x 398 mm)
                 Hfront   88 Hsync  44 Hback 148 Hpol P
                 Vfront    2 Vsync   5 Vback  15 Vpol P Vfront +0.5 Odd Field
                 Vfront    2 Vsync   5 Vback  15 Vpol P Vback  +0.5 Even Field
    DTD 2:  1280x720    59.943 Hz  16:9    44.958 kHz  74.180 MHz (708 mm x 398 mm)
                 Hfront  110 Hsync  40 Hback 220 Hpol P
                 Vfront    5 Vsync   5 Vback  20 Vpol P
  Display Range Limits:
    Monitor ranges (GTF): 59-61 Hz V, 30-80 kHz H, max dotclock 100 MHz
    Display Product Name: 'LCD MONITOR'
  Extension blocks: 1
Checksum: 0x8c

----------------

Block 1, CTA-861 Extension Block:
  Revision: 3
  Basic audio support
  Supports YCbCr 4:4:4
  Supports YCbCr 4:2:2
  Native detailed modes: 2
  Video Data Block:
    VIC   3:   720x480    59.940 Hz  16:9    31.469 kHz  27.000 MHz
    VIC   4:  1280x720    60.000 Hz  16:9    45.000 kHz  74.250 MHz (native)
    VIC   5:  1920x1080i  60.000 Hz  16:9    33.750 kHz  74.250 MHz (native)
    VIC   7:  1440x480i   59.940 Hz  16:9    15.734 kHz  27.000 MHz
    VIC  18:   720x576    50.000 Hz  16:9    31.250 kHz  27.000 MHz
    VIC  19:  1280x720    50.000 Hz  16:9    37.500 kHz  74.250 MHz
    VIC  20:  1920x1080i  50.000 Hz  16:9    28.125 kHz  74.250 MHz
    VIC  22:  1440x576i   50.000 Hz  16:9    15.625 kHz  27.000 MHz
  Audio Data Block:
    Linear PCM:
      Max channels: 8
      Supported sample rates (kHz): 192 96 48 44.1 32
      Supported sample sizes (bits): 24 20 16
  Speaker Allocation Data Block:
    FL/FR - Front Left/Right
    LFE1 - Low Frequency Effects 1
    FC - Front Center
    BL/BR - Back Left/Right
    RLC/RRC - Rear Left/Right of Center (Deprecated)
  Vendor-Specific Data Block (HDMI), OUI 00-0C-03:
    Source physical address: 1.0.0.0
    Supports_AI
  Detailed Timing Descriptors:
    DTD 3:   720x480    60.007 Hz   3:2    31.503 kHz  27.030 MHz (708 mm x 398 mm)
                 Hfront   16 Hsync  62 Hback  60 Hpol N
                 Vfront    9 Vsync   6 Vback  30 Vpol N
    DTD 4:  1920x1080i  50.000 Hz  16:9    28.125 kHz  74.250 MHz (708 mm x 398 mm)
                 Hfront  528 Hsync  44 Hback 148 Hpol P
                 Vfront    2 Vsync   5 Vback  15 Vpol P Vfront +0.5 Odd Field
                 Vfront    2 Vsync   5 Vback  15 Vpol P Vback  +0.5 Even Field
    DTD 5:  1280x720    50.000 Hz  16:9    37.500 kHz  74.250 MHz (708 mm x 398 mm)
                 Hfront  440 Hsync  40 Hback 220 Hpol P
                 Vfront    5 Vsync   5 Vback  20 Vpol P
    DTD 6:   720x576    50.000 Hz   5:4    31.250 kHz  27.000 MHz (708 mm x 398 mm)
                 Hfront   12 Hsync  64 Hback  68 Hpol N
                 Vfront    5 Vsync   5 Vback  39 Vpol N
    DTD 7:  1920x1080i  60.000 Hz  16:9    33.750 kHz  74.250 MHz (708 mm x 398 mm)
                 Hfront   88 Hsync  44 Hback 148 Hpol P
                 Vfront    2 Vsync   5 Vback  15 Vpol P Vfront +0.5 Odd Field
                 Vfront    2 Vsync   5 Vback  15 Vpol P Vback  +0.5 Even Field
Checksum: 0x53

----------------

Failures:

Block 0, Base EDID:
  Detailed Timing Descriptor #1: Mismatch of image size 708x398 mm vs display size 410x260 mm.
  Detailed Timing Descriptor #2: Mismatch of image size 708x398 mm vs display size 410x260 mm.
Block 1, CTA-861 Extension Block:
  Detailed Timing Descriptor #3: Mismatch of image size 708x398 mm vs display size 410x260 mm.
  Detailed Timing Descriptor #4: Mismatch of image size 708x398 mm vs display size 410x260 mm.
  Detailed Timing Descriptor #5: Mismatch of image size 708x398 mm vs display size 410x260 mm.
  Detailed Timing Descriptor #6: Mismatch of image size 708x398 mm vs display size 410x260 mm.
  Detailed Timing Descriptor #7: Mismatch of image size 708x398 mm vs display size 410x260 mm.
All Blocks:
  Some timings are out of range of the Monitor Ranges:
    Vertical Freq: 50.000 - 70.082 Hz (Monitor: 59.000 - 61.000 Hz)
    Horizontal Freq: 15.625 - 63.981 kHz (Monitor: 30.000 - 80.000 kHz)
    Maximum Clock: 108.000 MHz (Monitor: 100.000 MHz)

EDID conformity: FAIL
