
EDID (hex):
00ffffffffffff00410c8dc0f80f0000
1916010380301b782afca5a0544ea027
125054bd4b00d1c08180950f9500b300
010101010101023a801871382d40582c
4500e00c1100001e000000ff00415533
31323235303034303838000000fc0050
68696c697073203232374551000000fd
00384c1e5311000a2020202020200052

Extracted contents:
header:          00 ff ff ff ff ff ff 00
serial number:   41 0c 8d c0 f8 0f 00 00 19 16
version:         01 03
basic params:    80 30 1b 78 2a
chroma info:     fc a5 a0 54 4e a0 27 12 50 54
established:     bd 4b 00
standard:        d1 c0 81 80 95 0f 95 00 b3 00 01 01 01 01 01 01
descriptor 1:    02 3a 80 18 71 38 2d 40 58 2c 45 00 e0 0c 11 00 00 1e
descriptor 2:    00 00 00 ff 00 41 55 33 31 32 32 35 30 30 34 30 38 38
descriptor 3:    00 00 00 fc 00 50 68 69 6c 69 70 73 20 32 32 37 45 51
descriptor 4:    00 00 00 fd 00 38 4c 1e 53 11 00 0a 20 20 20 20 20 20
extensions:      00
checksum:        52

EDID version: 1.3
Manufacturer: PHL Model c08d Serial Number --
Made in week 25 of 2012
Digital display
Maximum image size: 48 cm x 27 cm
Gamma: 2.20
DPMS levels: Off
RGB color display
First detailed timing is preferred timing
Display x,y Chromaticity:
  Red:   0.6279, 0.3310
  Green: 0.3076, 0.6250
  Blue:  0.1542, 0.0722
  White: 0.3134, 0.3291
Established timings supported:
  720x400@70Hz 9:5 HorFreq: 31469 Hz Clock: 28.320 MHz
  640x480@60Hz 4:3 HorFreq: 31469 Hz Clock: 25.175 MHz
  640x480@67Hz 4:3 HorFreq: 35000 Hz Clock: 30.240 MHz
  640x480@72Hz 4:3 HorFreq: 37900 Hz Clock: 31.500 MHz
  640x480@75Hz 4:3 HorFreq: 37500 Hz Clock: 31.500 MHz
  800x600@60Hz 4:3 HorFreq: 37900 Hz Clock: 40.000 MHz
  800x600@75Hz 4:3 HorFreq: 46900 Hz Clock: 49.500 MHz
  1024x768@60Hz 4:3 HorFreq: 48400 Hz Clock: 65.000 MHz
  1024x768@75Hz 4:3 HorFreq: 60000 Hz Clock: 78.750 MHz
  1280x1024@75Hz 5:4 HorFreq: 80000 Hz Clock: 135.000 MHz
Standard timings supported:
  1920x1080@60Hz 16:9
  1280x1024@60Hz 5:4 HorFreq: 64000 Hz Clock: 108.000 MHz
  1440x900@75Hz 16:10 HorFreq: 82300 Hz Clock: 156.000 MHz
  1440x900@60Hz 16:10 HorFreq: 55500 Hz Clock: 88.750 MHz
  1680x1050@60Hz 16:10 HorFreq: 64700 Hz Clock: 119.000 MHz
Detailed mode: Clock 148.500 MHz, 480 mm x 268 mm
               1920 2008 2052 2200 hborder 0
               1080 1084 1089 1125 vborder 0
               +hsync +vsync 
               VertFreq: 60 Hz, HorFreq: 67500 Hz
Serial number: --
Monitor ranges (GTF): 56-76Hz V, 30-83kHz H, max dotclock 170MHz
Checksum: 0x52 (valid)
EDID block does NOT conform to EDID 1.3!
	Name descriptor not terminated with a newline
