
EDID (hex):
00ffffffffffff0009d16876e6060000
260e010380221b78eac4f6a3574a9c23
114f54bdef80714f8180818c01010101
010101010101302a009851002a403070
1300520e1100001e000000fc0042656e
512046503738330a2020000000ff0000
00000000000000000a202020000000fd
00384c1f530e0a20202020202020004f

Extracted contents:
header:          00 ff ff ff ff ff ff 00
serial number:   09 d1 68 76 e6 06 00 00 26 0e
version:         01 03
basic params:    80 22 1b 78 ea
chroma info:     c4 f6 a3 57 4a 9c 23 11 4f 54
established:     bd ef 80
standard:        71 4f 81 80 81 8c 01 01 01 01 01 01 01 01 01 01
descriptor 1:    30 2a 00 98 51 00 2a 40 30 70 13 00 52 0e 11 00 00 1e
descriptor 2:    00 00 00 fc 00 42 65 6e 51 20 46 50 37 38 33 0a 20 20
descriptor 3:    00 00 00 ff 00 00 00 00 00 00 00 00 00 00 0a 20 20 20
descriptor 4:    00 00 00 fd 00 38 4c 1f 53 0e 0a 20 20 20 20 20 20 20
extensions:      00
checksum:        4f

EDID version: 1.3
Manufacturer: BNQ Model 7668 Serial Number --
Digital display
Maximum image size: 34 cm x 27 cm
Gamma: 2.20
DPMS levels: Standby Suspend Off
RGB color display
First detailed timing is preferred timing
Display x,y Chromaticity:
  Red:   0.6396, 0.3398
  Green: 0.2900, 0.6093
  Blue:  0.1396, 0.0693
  White: 0.3095, 0.3300
Established timings supported:
  720x400@70Hz 9:5 HorFreq: 31469 Hz Clock: 28.320 MHz
  640x480@60Hz 4:3 HorFreq: 31469 Hz Clock: 25.175 MHz
  640x480@67Hz 4:3 HorFreq: 35000 Hz Clock: 30.240 MHz
  640x480@72Hz 4:3 HorFreq: 37900 Hz Clock: 31.500 MHz
  640x480@75Hz 4:3 HorFreq: 37500 Hz Clock: 31.500 MHz
  800x600@60Hz 4:3 HorFreq: 37900 Hz Clock: 40.000 MHz
  800x600@72Hz 4:3 HorFreq: 48100 Hz Clock: 50.000 MHz
  800x600@75Hz 4:3 HorFreq: 46900 Hz Clock: 49.500 MHz
  832x624@75Hz 4:3 HorFreq: 49726 Hz Clock: 57.284 MHz
  1024x768@60Hz 4:3 HorFreq: 48400 Hz Clock: 65.000 MHz
  1024x768@70Hz 4:3 HorFreq: 56500 Hz Clock: 75.000 MHz
  1024x768@75Hz 4:3 HorFreq: 60000 Hz Clock: 78.750 MHz
  1280x1024@75Hz 5:4 HorFreq: 80000 Hz Clock: 135.000 MHz
  1152x870@75Hz 192:145 HorFreq: 67500 Hz Clock: 108.000 MHz
Standard timings supported:
  1152x864@75Hz 4:3 HorFreq: 67500 Hz Clock: 108.000 MHz
  1280x1024@60Hz 5:4 HorFreq: 64000 Hz Clock: 108.000 MHz
  1280x1024@72Hz 5:4
Detailed mode: Clock 108.000 MHz, 338 mm x 270 mm
               1280 1328 1440 1688 hborder 0
               1024 1025 1028 1066 vborder 0
               +hsync +vsync 
               VertFreq: 60 Hz, HorFreq: 63981 Hz
Monitor name: BenQ FP783
Serial number: 
-- ranges (invalid): 56-76Hz V, 31-83kHz H, max dotclock 140MHz
Checksum: 0x4f (valid)
EDID block does NOT conform to EDID 1.3!
	Detailed block string not properly terminated
EDID block does not conform at all!
	Bad year of manufacture
	Detailed blocks filled with garbage
	Range descriptor contains garbage
