
EDID (hex):
00ffffffffffff0006af2c1000000000
00160103801d10780abbf59455549027
23505400000001010101010101010101
010101010101d01b5680500019303020
360025a4100000180000000f00000000
00000000000000000020000000fe0041
554f0a202020202020202020000000fe
004231333358544e30312e30200a008a

Extracted contents:
header:          00 ff ff ff ff ff ff 00
serial number:   06 af 2c 10 00 00 00 00 00 16
version:         01 03
basic params:    80 1d 10 78 0a
chroma info:     bb f5 94 55 54 90 27 23 50 54
established:     00 00 00
standard:        01 01 01 01 01 01 01 01 01 01 01 01 01 01 01 01
descriptor 1:    d0 1b 56 80 50 00 19 30 30 20 36 00 25 a4 10 00 00 18
descriptor 2:    00 00 00 0f 00 00 00 00 00 00 00 00 00 00 00 00 00 20
descriptor 3:    00 00 00 fe 00 41 55 4f 0a 20 20 20 20 20 20 20 20 20
descriptor 4:    00 00 00 fe 00 42 31 33 33 58 54 4e 30 31 2e 30 20 0a
extensions:      00
checksum:        8a

EDID version: 1.3
Manufacturer: AUO Model 102c Serial Number --
Made in year 2012
Digital display
Maximum image size: 29 cm x 16 cm
Gamma: 2.20
RGB color display
First detailed timing is preferred timing
Display x,y Chromaticity:
  Red:   0.5800, 0.3349
  Green: 0.3300, 0.5654
  Blue:  0.1552, 0.1396
  White: 0.3134, 0.3291
Established timings supported:
Standard timings supported:
Detailed mode: Clock 71.200 MHz, 293 mm x 164 mm
               1366 1414 1446 1494 hborder 0
                768  771  777  793 vborder 0
               -hsync -vsync 
               VertFreq: 60 Hz, HorFreq: 47657 Hz
Manufacturer-specified data, tag 15
ASCII string: AUO
ASCII string: B133XTN01.0 
Checksum: 0x8a (valid)
EDID block does NOT conform to EDID 1.3!
	Missing name descriptor
	Missing monitor ranges
