
EDID (hex):
00ffffffffffff002163010101010101
2417010308a05a780a01c1a057479827
124c4ca1080031404540614001010101
010101010101982150b051001b304070
360040846300001e401f008051001e30
4080370040846300001c000000fd0039
3f1e3109000a202020202020000000fc
00484b43202054560a202020202000d1

Extracted contents:
header:          00 ff ff ff ff ff ff 00
serial number:   21 63 01 01 01 01 01 01 24 17
version:         01 03
basic params:    08 a0 5a 78 0a
chroma info:     01 c1 a0 57 47 98 27 12 4c 4c
established:     a1 08 00
standard:        31 40 45 40 61 40 01 01 01 01 01 01 01 01 01 01
descriptor 1:    98 21 50 b0 51 00 1b 30 40 70 36 00 40 84 63 00 00 1e
descriptor 2:    40 1f 00 80 51 00 1e 30 40 80 37 00 40 84 63 00 00 1c
descriptor 3:    00 00 00 fd 00 39 3f 1e 31 09 00 0a 20 20 20 20 20 20
descriptor 4:    00 00 00 fc 00 48 4b 43 20 20 54 56 0a 20 20 20 20 20
extensions:      00
checksum:        d1

EDID version: 1.3
Manufacturer: HKC Model 101 Serial Number --
Made in week 36 of 2013
Analog display, Input voltage level: 0.7/0.3 V
Sync: Separate 
Maximum image size: 160 cm x 90 cm
Gamma: 2.20
RGB color display
First detailed timing is preferred timing
Display x,y Chromaticity:
  Red:   0.6250, 0.3398
  Green: 0.2773, 0.5947
  Blue:  0.1552, 0.0703
  White: 0.2968, 0.2978
Established timings supported:
  720x400@70Hz 9:5 HorFreq: 31469 Hz Clock: 28.320 MHz
  640x480@60Hz 4:3 HorFreq: 31469 Hz Clock: 25.175 MHz
  800x600@60Hz 4:3 HorFreq: 37900 Hz Clock: 40.000 MHz
  1024x768@60Hz 4:3 HorFreq: 48400 Hz Clock: 65.000 MHz
Standard timings supported:
  640x480@60Hz 4:3 HorFreq: 31469 Hz Clock: 25.175 MHz
  800x600@60Hz 4:3 HorFreq: 37900 Hz Clock: 40.000 MHz
  1024x768@60Hz 4:3 HorFreq: 48400 Hz Clock: 65.000 MHz
Detailed mode: Clock 86.000 MHz, 1600 mm x 900 mm
               1360 1424 1536 1792 hborder 0
                768  771  777  795 vborder 0
               +hsync +vsync 
               VertFreq: 60 Hz, HorFreq: 47991 Hz
Detailed mode: Clock 80.000 MHz, 1600 mm x 900 mm
               1280 1344 1472 1664 hborder 0
                768  771  778  798 vborder 0
               -hsync +vsync 
               VertFreq: 60 Hz, HorFreq: 48076 Hz
Monitor ranges (GTF): 57-63Hz V, 30-49kHz H, max dotclock 90MHz
Monitor name: HKC  TV
Checksum: 0xd1 (valid)
One or more of the timings is out of range of the Monitor Ranges:
  Vertical Freq: 60 - 70 Hz
  Horizontal Freq: 31469 - 48400 Hz
  Maximum Clock: 86.000 MHz
