
EDID (hex):
00ffffffffffff004d10c91400000000
091d0104a522137807de50a3544c9926
0f505400000001010101010101010101
01010101010150d0805070381f401828
350058c21000001850d0805070383146
1828350058c210000018000000000000
00000000000000000000000000000002
000432ff063c960b0b1c96000000000a

Extracted contents:
header:          00 ff ff ff ff ff ff 00
serial number:   4d 10 c9 14 00 00 00 00 09 1d
version:         01 04
basic params:    a5 22 13 78 07
chroma info:     de 50 a3 54 4c 99 26 0f 50 54
established:     00 00 00
standard:        01 01 01 01 01 01 01 01 01 01 01 01 01 01 01 01
descriptor 1:    50 d0 80 50 70 38 1f 40 18 28 35 00 58 c2 10 00 00 18
descriptor 2:    50 d0 80 50 70 38 31 46 18 28 35 00 58 c2 10 00 00 18
descriptor 3:    00 00 00 00 00 00 00 00 00 00 00 00 00 00 00 00 00 00
descriptor 4:    00 00 00 02 00 04 32 ff 06 3c 96 0b 0b 1c 96 00 00 00
extensions:      00
checksum:        0a

EDID version: 1.4
Manufacturer: SHP Model 14c9 Serial Number --
Made in week 9 of 2019
Digital display
8 bits per primary color channel
DisplayPort interface
Maximum image size: 34 cm x 19 cm
Gamma: 2.20
Supported color formats: RGB 4:4:4
Default (sRGB) color space is primary color space
First detailed timing includes the native pixel format and preferred refresh rate
Display is continuous frequency
Display x,y Chromaticity:
  Red:   0.6396, 0.3291
  Green: 0.2998, 0.5996
  Blue:  0.1494, 0.0595
  White: 0.3125, 0.3281
Established timings supported:
Standard timings supported:
Detailed mode: Clock 533.280 MHz, 344 mm x 194 mm
               1920 1944 1984 2000 hborder 0
               1080 1083 1088 1111 vborder 0
               -hsync -vsync 
               VertFreq: 240 Hz, HorFreq: 266640 Hz
Detailed mode: Clock 533.280 MHz, 344 mm x 194 mm
               1920 1944 1984 2000 hborder 0
               1080 1083 1088 2665 vborder 0
               -hsync -vsync 
               VertFreq: 100 Hz, HorFreq: 266640 Hz
Manufacturer-specified data, tag 0
Manufacturer-specified data, tag 2
Checksum: 0xa (valid)
EDID block does NOT conform to EDID 1.4!
	sRGB is signaled, but the chromaticities do not match
	Missing name descriptor
	Missing monitor ranges
