
EDID (hex):
00ffffffffffff000e6f001500000000
001d0104b5221378032b23a45832b524
0f4e5700000001010101010101010101
01010101010140ce00a0f07028803020
350058c2100000180000000000000000
00000000000000000018000000fe0043
534f542054330a2020202020000000fe
004d4e463630314541312d310a200101
02030f00e3058000e606050173732100
00000000000000000000000000000000
00000000000000000000000000000000
00000000000000000000000000000000
00000000000000000000000000000000
00000000000000000000000000000000
00000000000000000000000000000000
0000000000000000000000000000008b

Extracted contents:
header:          00 ff ff ff ff ff ff 00
serial number:   0e 6f 00 15 00 00 00 00 00 1d
version:         01 04
basic params:    b5 22 13 78 03
chroma info:     2b 23 a4 58 32 b5 24 0f 4e 57
established:     00 00 00
standard:        01 01 01 01 01 01 01 01 01 01 01 01 01 01 01 01
descriptor 1:    40 ce 00 a0 f0 70 28 80 30 20 35 00 58 c2 10 00 00 18
descriptor 2:    00 00 00 00 00 00 00 00 00 00 00 00 00 00 00 00 00 18
descriptor 3:    00 00 00 fe 00 43 53 4f 54 20 54 33 0a 20 20 20 20 20
descriptor 4:    00 00 00 fe 00 4d 4e 46 36 30 31 45 41 31 2d 31 0a 20
extensions:      01
checksum:        01

EDID version: 1.4
Manufacturer: CSO Model 1500 Serial Number --
Made in year 2019
Digital display
10 bits per primary color channel
DisplayPort interface
Maximum image size: 34 cm x 19 cm
Gamma: 2.20
Supported color formats: RGB 4:4:4
First detailed timing includes the native pixel format and preferred refresh rate
Display is continuous frequency
Display x,y Chromaticity:
  Red:   0.6406, 0.3457
  Green: 0.1972, 0.7099
  Blue:  0.1406, 0.0605
  White: 0.3046, 0.3427
Established timings supported:
Standard timings supported:
Detailed mode: Clock 528.000 MHz, 344 mm x 194 mm
               3840 3888 3920 4000 hborder 0
               2160 2163 2168 2200 vborder 0
               -hsync -vsync 
               VertFreq: 60 Hz, HorFreq: 132000 Hz
Manufacturer-specified data, tag 0
ASCII string: CSOT T3
ASCII string: MNF601EA1-1
Has 1 extension blocks
Checksum: 0x1 (valid)

CTA extension block
Extension version: 3
11 bytes of CTA data
  Extended tag: Colorimetry data block
    BT2020RGB
  Extended tag: HDR static metadata data block
    Electro optical transfer functions:
      Traditional gamma - SDR luminance range
      SMPTE ST2084
    Supported static metadata descriptors:
      Static metadata type 1
    Desired content max luminance: 115 (603.666 cd/m^2)
    Desired content max frame-average luminance: 115 (603.666 cd/m^2)
    Desired content min luminance: 33 (0.101 cd/m^2)
0 native detailed modes
Checksum: 0x8b (valid)

EDID block does NOT conform to EDID 1.4!
	Required 640x480p60 timings are missing in the established timings
	and/or in the SVD list (VIC 1)
	Missing name descriptor
	Missing monitor ranges


