edid-decode (hex):

00 ff ff ff ff ff ff 00 1e 6d ff 76 91 92 03 00
09 1d 01 03 68 46 27 78 ea f3 53 a5 54 51 93 26
12 48 49 21 08 00 71 40 81 c0 81 00 81 80 95 00
90 40 a9 c0 b3 00 02 3a 80 18 71 38 2d 40 58 2c
45 00 ba 88 21 00 00 1a 00 00 00 fd 00 2f 3f 1e
53 0f 00 0a 20 20 20 20 20 20 00 00 00 fc 00 4c
47 20 33 32 20 46 48 44 0a 20 20 20 00 00 00 ff
00 39 30 39 4e 54 57 47 36 57 31 32 39 0a 00 0c

----------------

Block 0, Base EDID:
  EDID Structure Version & Revision: 1.3
  Vendor & Product Identification:
    Manufacturer: GSM
    Model: 30463
    Serial Number: ...
    Made in: week 9 of 2019
  Basic Display Parameters & Features:
    Analog display
    Input voltage level: 0.7/0.7 V
    Blank level equals black level
    Sync: Separate
    Maximum image size: 70 cm x 39 cm
    Gamma: 2.20
    DPMS levels: Standby Suspend Off
    RGB color display
    First detailed timing is the preferred timing
  Color Characteristics:
    Red  : 0.6474, 0.3310
    Green: 0.3164, 0.5771
    Blue : 0.1494, 0.0712
    White: 0.2812, 0.2880
  Established Timings I & II:
    DMT 0x04:   640x480    59.940 Hz   4:3    31.469 kHz  25.175 MHz
    DMT 0x09:   800x600    60.317 Hz   4:3    37.879 kHz  40.000 MHz
    DMT 0x10:  1024x768    60.004 Hz   4:3    48.363 kHz  65.000 MHz
  Standard Timings:
    GTF     :  1152x864    60.000 Hz   4:3    53.700 kHz  81.624 MHz
    DMT 0x55:  1280x720    60.000 Hz  16:9    45.000 kHz  74.250 MHz
    DMT 0x1c:  1280x800    59.810 Hz  16:10   49.702 kHz  83.500 MHz
    DMT 0x23:  1280x1024   60.020 Hz   5:4    63.981 kHz 108.000 MHz
    DMT 0x2f:  1440x900    59.887 Hz  16:10   55.935 kHz 106.500 MHz
    DMT 0x2a:  1400x1050   59.978 Hz   4:3    65.317 kHz 121.750 MHz
    DMT 0x53:  1600x900    60.000 Hz  16:9    60.000 kHz 108.000 MHz (RB)
    DMT 0x3a:  1680x1050   59.954 Hz  16:10   65.290 kHz 146.250 MHz
  Detailed Timing Descriptors:
    DTD 1:  1920x1080   60.000 Hz  16:9    67.500 kHz 148.500 MHz (698 mm x 392 mm)
                 Hfront   88 Hsync  44 Hback 148 Hpol P
                 Vfront    4 Vsync   5 Vback  36 Vpol N
  Display Range Limits:
    Monitor ranges (GTF): 47-63 Hz V, 30-83 kHz H, max dotclock 150 MHz
    Display Product Name: 'LG 32 FHD'
    Display Product Serial Number: ...
Checksum: 0x0c

----------------

EDID conformity: PASS
