
EDID (hex):
00ffffffffffff002134086007000000
1e11010308291a78eab565a458499924
115054bfef80950f8180814081c0810f
7190904f0101c422a0a050841a303020
36009a011100001e000000fc00583930
5720442d7375620a2020000000fd0038
4c1f5410000a202020202020000000ff
00583930574937374c3030303037009e

Extracted contents:
header:          00 ff ff ff ff ff ff 00
serial number:   21 34 08 60 07 00 00 00 1e 11
version:         01 03
basic params:    08 29 1a 78 ea
chroma info:     b5 65 a4 58 49 99 24 11 50 54
established:     bf ef 80
standard:        95 0f 81 80 81 40 81 c0 81 0f 71 90 90 4f 01 01
descriptor 1:    c4 22 a0 a0 50 84 1a 30 30 20 36 00 9a 01 11 00 00 1e
descriptor 2:    00 00 00 fc 00 58 39 30 57 20 44 2d 73 75 62 0a 20 20
descriptor 3:    00 00 00 fd 00 38 4c 1f 54 10 00 0a 20 20 20 20 20 20
descriptor 4:    00 00 00 ff 00 58 39 30 57 49 37 37 4c 30 30 30 30 37
extensions:      00
checksum:        9e

EDID version: 1.3
Manufacturer: HIT Model 6008 Serial Number --
Made in week 30 of 2007
Analog display, Input voltage level: 0.7/0.3 V
Sync: Separate 
Maximum image size: 41 cm x 26 cm
Gamma: 2.20
DPMS levels: Standby Suspend Off
RGB color display
First detailed timing is preferred timing
Display x,y Chromaticity:
  Red:   0.6425, 0.3466
  Green: 0.2861, 0.5986
  Blue:  0.1416, 0.0683
  White: 0.3134, 0.3291
Established timings supported:
  720x400@70Hz 9:5 HorFreq: 31469 Hz Clock: 28.320 MHz
  640x480@60Hz 4:3 HorFreq: 31469 Hz Clock: 25.175 MHz
  640x480@67Hz 4:3 HorFreq: 35000 Hz Clock: 30.240 MHz
  640x480@72Hz 4:3 HorFreq: 37900 Hz Clock: 31.500 MHz
  640x480@75Hz 4:3 HorFreq: 37500 Hz Clock: 31.500 MHz
  800x600@56Hz 4:3 HorFreq: 35200 Hz Clock: 36.000 MHz
  800x600@60Hz 4:3 HorFreq: 37900 Hz Clock: 40.000 MHz
  800x600@72Hz 4:3 HorFreq: 48100 Hz Clock: 50.000 MHz
  800x600@75Hz 4:3 HorFreq: 46900 Hz Clock: 49.500 MHz
  832x624@75Hz 4:3 HorFreq: 49726 Hz Clock: 57.284 MHz
  1024x768@60Hz 4:3 HorFreq: 48400 Hz Clock: 65.000 MHz
  1024x768@70Hz 4:3 HorFreq: 56500 Hz Clock: 75.000 MHz
  1024x768@75Hz 4:3 HorFreq: 60000 Hz Clock: 78.750 MHz
  1280x1024@75Hz 5:4 HorFreq: 80000 Hz Clock: 135.000 MHz
  1152x870@75Hz 192:145 HorFreq: 67500 Hz Clock: 108.000 MHz
Standard timings supported:
  1440x900@75Hz 16:10 HorFreq: 82300 Hz Clock: 156.000 MHz
  1280x1024@60Hz 5:4 HorFreq: 64000 Hz Clock: 108.000 MHz
  1280x960@60Hz 4:3 HorFreq: 60000 Hz Clock: 108.000 MHz
  1280x720@60Hz 16:9
  1280x800@75Hz 16:10
  1152x921@76Hz 5:4
  1400x1050@75Hz 4:3 HorFreq: 82300 Hz Clock: 156.000 MHz
Detailed mode: Clock 89.000 MHz, 410 mm x 257 mm
               1440 1488 1520 1600 hborder 0
                900  903  909  926 vborder 0
               +hsync +vsync 
               VertFreq: 60 Hz, HorFreq: 55625 Hz
Monitor name: X90W D-sub
Monitor ranges (GTF): 56-76Hz V, 31-84kHz H, max dotclock 160MHz
Serial number: --
Checksum: 0x9e (valid)
