
EDID (hex):
00ffffffffffff004c83564400000000
00180104a52615780a5935a3564b9c25
10505400000001010101010101010101
010101010101623980dc703840403020
25007ed7100000190000000f00000000
00000000001e82105200000000fe0053
414d53554e470a204c83484c000000fe
004c544e313733484c303134303100ea

Extracted contents:
header:          00 ff ff ff ff ff ff 00
serial number:   4c 83 56 44 00 00 00 00 00 18
version:         01 04
basic params:    a5 26 15 78 0a
chroma info:     59 35 a3 56 4b 9c 25 10 50 54
established:     00 00 00
standard:        01 01 01 01 01 01 01 01 01 01 01 01 01 01 01 01
descriptor 1:    62 39 80 dc 70 38 40 40 30 20 25 00 7e d7 10 00 00 19
descriptor 2:    00 00 00 0f 00 00 00 00 00 00 00 00 00 1e 82 10 52 00
descriptor 3:    00 00 00 fe 00 53 41 4d 53 55 4e 47 0a 20 4c 83 48 4c
descriptor 4:    00 00 00 fe 00 4c 54 4e 31 37 33 48 4c 30 31 34 30 31
extensions:      00
checksum:        ea

EDID version: 1.4
Manufacturer: SDC Model 4456 Serial Number --
Made in year 2014
Digital display
8 bits per primary color channel
DisplayPort interface
Maximum image size: 38 cm x 21 cm
Gamma: 2.20
Supported color formats: RGB 4:4:4, YCrCb 4:4:4
First detailed timing includes the native pixel format and preferred refresh rate
Display x,y Chromaticity:
  Red:   0.6376, 0.3369
  Green: 0.2949, 0.6103
  Blue:  0.1445, 0.0654
  White: 0.3134, 0.3291
Established timings supported:
Standard timings supported:
Detailed mode: Clock 146.900 MHz, 382 mm x 215 mm
               1920 1968 2000 2140 hborder 0
               1080 1082 1087 1144 vborder 0
               -hsync -vsync 
               VertFreq: 60 Hz, HorFreq: 68644 Hz
Manufacturer-specified data, tag 15
ASCII string: SAMSUNG
ASCII string: LTN173HL01401
Checksum: 0xea (valid)
EDID block does NOT conform to EDID 1.4!
	Missing name descriptor
	Missing monitor ranges
	Detailed block string not properly terminated
