edid-decode (hex):

00 ff ff ff ff ff ff 00 09 d1 59 76 49 23 00 00
23 0e 01 04 a5 22 1b 78 e2 00 a5 a3 58 4f 95 24
19 50 54 bf ef 80 71 4f 81 90 81 80 81 8c 01 01
01 01 01 01 01 01 30 2a 00 98 51 00 2a 40 30 70
13 00 52 0e 11 00 00 1e d5 09 80 a0 20 5e 63 10
10 60 52 08 30 e4 10 00 00 1a 00 00 00 fd 00 38
4b 1f 51 0e 00 0a 20 20 20 20 20 20 00 00 00 fc
00 42 65 6e 51 20 46 50 37 33 31 a0 20 20 00 c4

----------------

Block 0, Base EDID:
  EDID Structure Version & Revision: 1.4
  Vendor & Product Identification:
    Manufacturer: BNQ
    Model: 30297
    Serial Number: ...
    Made in: week 35 of 2004
  Basic Display Parameters & Features:
    Digital display
    Bits per primary color channel: 8
    DisplayPort interface
    Maximum image size: 34 cm x 27 cm
    Gamma: 2.20
    DPMS levels: Standby Suspend Off
    Supported color formats: RGB 4:4:4
    First detailed timing includes the native pixel format and preferred refresh rate
  Color Characteristics:
    Red  : 0.6367, 0.3437
    Green: 0.3085, 0.5820
    Blue : 0.1425, 0.0996
    White: 0.3134, 0.3291
  Established Timings I & II:
    IBM     :   720x400    70.082 Hz   9:5    31.467 kHz  28.320 MHz
    DMT 0x04:   640x480    59.940 Hz   4:3    31.469 kHz  25.175 MHz
    Apple   :   640x480    66.667 Hz   4:3    35.000 kHz  30.240 MHz
    DMT 0x05:   640x480    72.809 Hz   4:3    37.861 kHz  31.500 MHz
    DMT 0x06:   640x480    75.000 Hz   4:3    37.500 kHz  31.500 MHz
    DMT 0x08:   800x600    56.250 Hz   4:3    35.156 kHz  36.000 MHz
    DMT 0x09:   800x600    60.317 Hz   4:3    37.879 kHz  40.000 MHz
    DMT 0x0a:   800x600    72.188 Hz   4:3    48.077 kHz  50.000 MHz
    DMT 0x0b:   800x600    75.000 Hz   4:3    46.875 kHz  49.500 MHz
    Apple   :   832x624    74.551 Hz   4:3    49.726 kHz  57.284 MHz
    DMT 0x10:  1024x768    60.004 Hz   4:3    48.363 kHz  65.000 MHz
    DMT 0x11:  1024x768    70.069 Hz   4:3    56.476 kHz  75.000 MHz
    DMT 0x12:  1024x768    75.029 Hz   4:3    60.023 kHz  78.750 MHz
    DMT 0x24:  1280x1024   75.025 Hz   5:4    79.976 kHz 135.000 MHz
    Apple   :  1152x870    75.062 Hz 192:145  68.681 kHz 100.000 MHz
  Standard Timings:
    DMT 0x15:  1152x864    75.000 Hz   4:3    67.500 kHz 108.000 MHz
    CVT     :  1280x1024   75.982 Hz   5:4    81.453 kHz 140.750 MHz (EDID 1.4 source)
    GTF     :  1280x1024   76.000 Hz   5:4    81.320 kHz 141.822 MHz (EDID 1.3 source)
    DMT 0x23:  1280x1024   60.020 Hz   5:4    63.981 kHz 108.000 MHz
    CVT     :  1280x1024   71.932 Hz   5:4    76.968 kHz 133.000 MHz (EDID 1.4 source)
    GTF     :  1280x1024   72.000 Hz   5:4    76.824 kHz 132.752 MHz (EDID 1.3 source)
  Detailed Timing Descriptors:
    DTD 1:  1280x1024   60.020 Hz   5:4    63.981 kHz 108.000 MHz (338 mm x 270 mm)
                 Hfront   48 Hsync 112 Hback 248 Hpol P
                 Vfront    1 Vsync   3 Vback  38 Vpol P
    DTD 2:   640x350    70.072 Hz  64:35   31.462 kHz  25.170 MHz (304 mm x 228 mm)
                 Hfront   16 Hsync  96 Hback  48 Hpol P
                 Vfront   37 Vsync   2 Vback  60 Vpol N
  Display Range Limits:
    Monitor ranges (GTF): 56-75 Hz V, 31-81 kHz H, max dotclock 140 MHz
    Display Product Name: 'BenQ FP731'
Checksum: 0xc4
