
EDID (hex):
00ffffffffffff0009e5f80700000000
011d0104951a0e780a81c096595a9a29
1f505400000001010101010101010101
0101010101016b1b566450001e302616
440000901000001a0000000000000000
00000000000000000000000000fe0042
4f452048460a202020202020000000fe
004e5631313657484d2d5430300a0022

Extracted contents:
header:          00 ff ff ff ff ff ff 00
serial number:   09 e5 f8 07 00 00 00 00 01 1d
version:         01 04
basic params:    95 1a 0e 78 0a
chroma info:     81 c0 96 59 5a 9a 29 1f 50 54
established:     00 00 00
standard:        01 01 01 01 01 01 01 01 01 01 01 01 01 01 01 01
descriptor 1:    6b 1b 56 64 50 00 1e 30 26 16 44 00 00 90 10 00 00 1a
descriptor 2:    00 00 00 00 00 00 00 00 00 00 00 00 00 00 00 00 00 00
descriptor 3:    00 00 00 fe 00 42 4f 45 20 48 46 0a 20 20 20 20 20 20
descriptor 4:    00 00 00 fe 00 4e 56 31 31 36 57 48 4d 2d 54 30 30 0a
extensions:      00
checksum:        22

EDID version: 1.4
Manufacturer: BOE Model 7f8 Serial Number --
Made in week 1 of 2019
Digital display
6 bits per primary color channel
DisplayPort interface
Maximum image size: 26 cm x 14 cm
Gamma: 2.20
Supported color formats: RGB 4:4:4, YCrCb 4:4:4
First detailed timing includes the native pixel format and preferred refresh rate
Display x,y Chromaticity:
  Red:   0.5878, 0.3476
  Green: 0.3515, 0.6025
  Blue:  0.1630, 0.1210
  White: 0.3125, 0.3281
Established timings supported:
Standard timings supported:
Detailed mode: Clock 70.190 MHz, 256 mm x 144 mm
               1366 1404 1426 1466 hborder 0
                768  772  776  798 vborder 0
               +hsync -vsync 
               VertFreq: 59 Hz, HorFreq: 47878 Hz
Manufacturer-specified data, tag 0
ASCII string: BOE HF
ASCII string: NV116WHM-T00
Checksum: 0x22 (valid)
EDID block does NOT conform to EDID 1.4!
	Missing name descriptor
	Missing monitor ranges
