
EDID (hex):
00ffffffffffff000e6f151600000000
001f0104b522167803fea3a3544c9926
0f515500000001010101010101010101
010101010101ffd700a0a0405e603020
360058d710000018ff6b00a0a0405e60
3020360058d710000018000000fd0030
78cccc38010a202020202020000000fe
004d4e473030374441312d4a0a2000e6

Extracted contents:
header:          00 ff ff ff ff ff ff 00
serial number:   0e 6f 15 16 00 00 00 00 00 1f
version:         01 04
basic params:    b5 22 16 78 03
chroma info:     fe a3 a3 54 4c 99 26 0f 51 55
established:     00 00 00
standard:        01 01 01 01 01 01 01 01 01 01 01 01 01 01 01 01
descriptor 1:    ff d7 00 a0 a0 40 5e 60 30 20 36 00 58 d7 10 00 00 18
descriptor 2:    ff 6b 00 a0 a0 40 5e 60 30 20 36 00 58 d7 10 00 00 18
descriptor 3:    00 00 00 fd 00 30 78 cc cc 38 01 0a 20 20 20 20 20 20
descriptor 4:    00 00 00 fe 00 4d 4e 47 30 30 37 44 41 31 2d 4a 0a 20
extensions:      00
checksum:        e6

EDID version: 1.4
Manufacturer: CSO Model 1615 Serial Number --
Made in year 2021
Digital display
10 bits per primary color channel
DisplayPort interface
Maximum image size: 34 cm x 22 cm
Gamma: 2.20
Supported color formats: RGB 4:4:4
First detailed timing includes the native pixel format and preferred refresh rate
Display is continuous frequency
Display x,y Chromaticity:
  Red:   0.6396, 0.3310
  Green: 0.2998, 0.5996
  Blue:  0.1503, 0.0605
  White: 0.3164, 0.3349
Established timings supported:
Standard timings supported:
Detailed mode: Clock 552.950 MHz, 344 mm x 215 mm
               2560 2608 2640 2720 hborder 0
               1600 1603 1609 1694 vborder 0
               -hsync -vsync 
               VertFreq: 120 Hz, HorFreq: 203290 Hz
Detailed mode: Clock 276.470 MHz, 344 mm x 215 mm
               2560 2608 2640 2720 hborder 0
               1600 1603 1609 1694 vborder 0
               -hsync -vsync 
               VertFreq: 60 Hz, HorFreq: 101643 Hz
Monitor ranges (bare limits): 48-120Hz V, 204-204kHz H, max dotclock 560MHz
ASCII string: MNG007DA1-J
Checksum: 0xe6 (valid)
EDID block does NOT conform to EDID 1.4!
	Missing name descriptor
Warning: One or more of the timings is out of range of the Monitor Ranges:
  Vertical Freq: 60 - 120 Hz
  Horizontal Freq: 101643 - 203290 Hz
  Maximum Clock: 552.950 MHz
