
EDID (hex):
00ffffffffffff00412f000001010101
00140103808048780adaffa3584aa229
17494b21080031404540614081800101
010101010101023a80d072382d40102c
4580ba882100001e023a801871382d40
582c4500ba882100001e000000fd0017
3d0f440f000a202020202020000000fc
005653582d3932310a2020202020010c
020357f2539f90140520212213041203
16071e260f241a0b38097f070f7f0715
07503e1ec04d02005706005f7e01677e
00834f00007a030c002400b8262fc010
0141019c06160800180096a69800a800
e2004be3051f01011d80d0721c162010
2c2580ba882100009e011d8018711c16
20582c2500ba882100009e000000001d

Extracted contents:
header:          00 ff ff ff ff ff ff 00
serial number:   41 2f 00 00 01 01 01 01 00 14
version:         01 03
basic params:    80 80 48 78 0a
chroma info:     da ff a3 58 4a a2 29 17 49 4b
established:     21 08 00
standard:        31 40 45 40 61 40 81 80 01 01 01 01 01 01 01 01
descriptor 1:    02 3a 80 d0 72 38 2d 40 10 2c 45 80 ba 88 21 00 00 1e
descriptor 2:    02 3a 80 18 71 38 2d 40 58 2c 45 00 ba 88 21 00 00 1e
descriptor 3:    00 00 00 fd 00 17 3d 0f 44 0f 00 0a 20 20 20 20 20 20
descriptor 4:    00 00 00 fc 00 56 53 58 2d 39 32 31 0a 20 20 20 20 20
extensions:      01
checksum:        0c

EDID version: 1.3
Manufacturer: PIO Model 0 Serial Number --
Made in year 2010
Digital display
Maximum image size: 128 cm x 72 cm
Gamma: 2.20
RGB color display
First detailed timing is preferred timing
Display x,y Chromaticity:
  Red:   0.6396, 0.3447
  Green: 0.2910, 0.6347
  Blue:  0.1630, 0.0927
  White: 0.2880, 0.2958
Established timings supported:
  640x480@60Hz 4:3 HorFreq: 31469 Hz Clock: 25.175 MHz
  800x600@60Hz 4:3 HorFreq: 37900 Hz Clock: 40.000 MHz
  1024x768@60Hz 4:3 HorFreq: 48400 Hz Clock: 65.000 MHz
Standard timings supported:
  640x480@60Hz 4:3 HorFreq: 31469 Hz Clock: 25.175 MHz
  800x600@60Hz 4:3 HorFreq: 37900 Hz Clock: 40.000 MHz
  1024x768@60Hz 4:3 HorFreq: 48400 Hz Clock: 65.000 MHz
  1280x1024@60Hz 5:4 HorFreq: 64000 Hz Clock: 108.000 MHz
Detailed mode: Clock 148.500 MHz, 698 mm x 392 mm
               1920 2448 2492 2640 hborder 0
               1080 1084 1089 1125 vborder 0
               +hsync +vsync 
               VertFreq: 50 Hz, HorFreq: 56250 Hz
Detailed mode: Clock 148.500 MHz, 698 mm x 392 mm
               1920 2008 2052 2200 hborder 0
               1080 1084 1089 1125 vborder 0
               +hsync +vsync 
               VertFreq: 60 Hz, HorFreq: 67500 Hz
Monitor ranges (GTF): 23-61Hz V, 15-68kHz H, max dotclock 150MHz
Monitor name: VSX-921
Has 1 extension blocks
Checksum: 0xc (valid)

CTA extension block
Extension version: 3
83 bytes of CTA data
  Video data block
    VIC  31 1920x1080@50Hz 16:9 (native) HorFreq: 56250 Hz Clock: 148.500 MHz
    VIC  16 1920x1080@60Hz 16:9 (native) HorFreq: 67500 Hz Clock: 148.500 MHz
    VIC  20 1920x1080i@50Hz 16:9  HorFreq: 28125 Hz Clock: 74.250 MHz
    VIC   5 1920x1080i@60Hz 16:9  HorFreq: 33750 Hz Clock: 74.250 MHz
    VIC  32 1920x1080@24Hz 16:9  HorFreq: 27000 Hz Clock: 74.250 MHz
    VIC  33 1920x1080@25Hz 16:9  HorFreq: 28125 Hz Clock: 74.250 MHz
    VIC  34 1920x1080@30Hz 16:9  HorFreq: 33750 Hz Clock: 74.250 MHz
    VIC  19 1280x720@50Hz 16:9  HorFreq: 37500 Hz Clock: 74.250 MHz
    VIC   4 1280x720@60Hz 16:9  HorFreq: 45000 Hz Clock: 74.250 MHz
    VIC  18 720x576@50Hz 16:9  HorFreq: 31250 Hz Clock: 27.000 MHz
    VIC   3 720x480@60Hz 16:9  HorFreq: 31469 Hz Clock: 27.000 MHz
    VIC  22 1440x576i@50Hz 16:9  HorFreq: 15625 Hz Clock: 27.000 MHz
    VIC   7 1440x480i@60Hz 16:9  HorFreq: 15734 Hz Clock: 27.000 MHz
    VIC  30 1440x576@50Hz 16:9  HorFreq: 31250 Hz Clock: 54.000 MHz
    VIC  38 2880x576@50Hz 16:9  HorFreq: 31250 Hz Clock: 108.000 MHz
    VIC  15 1440x480@60Hz 16:9  HorFreq: 31469 Hz Clock: 54.000 MHz
    VIC  36 2880x480@60Hz 16:9  HorFreq: 31469 Hz Clock: 108.000 MHz
    VIC  26 2880x576i@50Hz 16:9  HorFreq: 15625 Hz Clock: 54.000 MHz
    VIC  11 2880x480i@60Hz 16:9  HorFreq: 15734 Hz Clock: 54.000 MHz
  Audio data block
    Linear PCM, max channels 2
      Supported sample rates (kHz): 192 176.4 96 88.2 48 44.1 32
      Supported sample sizes (bits): 24 20 16
    Linear PCM, max channels 8
      Supported sample rates (kHz): 192 176.4 96 88.2 48 44.1 32
      Supported sample sizes (bits): 24 20 16
    AC-3, max channels 6
      Supported sample rates (kHz): 48 44.1 32
      Maximum bit rate: 640 kHz
    DTS, max channels 7
      Supported sample rates (kHz): 96 88.2 48 44.1
      Maximum bit rate: 1536 kHz
    One Bit Audio, max channels 6
      Supported sample rates (kHz): 44.1
    Dolby Digital+, max channels 8
      Supported sample rates (kHz): 48 44.1
    DTS-HD, max channels 8
      Supported sample rates (kHz): 192 176.4 96 88.2 48 44.1
    MAT (MLP), max channels 8
      Supported sample rates (kHz): 192 176.4 96 88.2 48 44.1
  Speaker allocation data block
    Speaker map:
      FL/FR - Front Left/Right
      LFE - Low Frequency Effects
      FC - Front Center
      BL/BR - Back Left/Right
      RLC/RRC - Rear Left/Right of Center
  Vendor-specific data block, OUI 000c03 (HDMI)
    Source physical address 2.4.0.0
    Supports_AI
    DC_36bit
    DC_30bit
    DC_Y444
    Maximum TMDS clock: 190MHz
    Extended HDMI video details:
      3D present
      3D-capable-VIC mask present
      3D: Side-by-side (half, horizontal)
      3D: Top-and-bottom
      3D: Frame-packing
      3D VIC indices: 2 3 4 7 8
      VIC index 0 supports top-and-bottom
      VIC index 1 supports top-and-bottom
      VIC index 0 supports unknown
      VIC index 1 supports unknown
      VIC index 9 supports top-and-bottom
      VIC index 10 supports top-and-bottom
      VIC index 9 supports unknown
      VIC index 10 supports unknown
  Extended tag: Video capability data block
    YCbCr quantization: No Data (0)
    RGB quantization: Selectable (via AVI Q) (1)
    PT scan behaviour: No Data (0)
    IT scan behaviour: Always Underscanned (2)
    CE scan behaviour: Support both over- and underscan (3)
  Extended tag: Colorimetry data block
    xvYCC601
    xvYCC709
    sYCC601
    AdobeYCC601
    AdobeRGB
Underscans PC formats by default
Basic audio support
Supports YCbCr 4:4:4
Supports YCbCr 4:2:2
2 native detailed modes
Detailed mode: Clock 74.250 MHz, 698 mm x 392 mm
               1920 2448 2492 2640 hborder 0
                540  542  547  562 vborder 0
               +hsync +vsync interlaced 
               VertFreq: 50 Hz, HorFreq: 28125 Hz
Detailed mode: Clock 74.250 MHz, 698 mm x 392 mm
               1920 2008 2052 2200 hborder 0
                540  542  547  562 vborder 0
               +hsync +vsync interlaced 
               VertFreq: 60 Hz, HorFreq: 33750 Hz
Checksum: 0x1d (valid)
