edid-decode (hex):

00 ff ff ff ff ff ff 00 41 2f 00 00 01 01 01 01
00 16 01 03 80 a0 5a 78 0a ee 91 a3 54 4c 99 26
0f 50 54 a1 08 00 31 40 45 40 61 40 71 40 81 80
01 01 01 01 01 01 02 3a 80 18 71 38 2d 40 58 2c
45 00 a0 5a 00 00 00 1e 02 3a 80 18 71 38 2d 40
58 2c 45 00 a0 5a 00 00 00 1e 00 00 00 fd 00 3a
3e 1e 53 10 00 0a 20 20 20 20 20 20 00 00 00 fc
00 56 53 58 2d 38 32 37 0a 20 20 20 20 20 01 84

02 03 4d f1 4e 10 9f 04 13 05 14 03 02 12 20 21
22 15 01 38 09 7f 07 0f 7f 07 15 07 50 3e 1e c0
49 2a 00 57 06 00 5f 7e 01 67 7f 00 83 4f 00 00
78 03 0c 00 13 00 80 2d 20 c0 0e 01 4f 3f fc 08
10 18 10 06 06 06 06 28 10 e3 05 00 00 01 1d 80
18 71 1c 16 20 58 2c 25 00 a0 5a 00 00 00 9e 01
1d 00 72 51 d0 1e 20 6e 28 55 00 a0 5a 00 00 00
1e 00 00 00 00 00 00 00 00 00 00 00 00 00 00 d2

----------------

Block 0, Base EDID:
  EDID Structure Version & Revision: 1.3
  Vendor & Product Identification:
    Manufacturer: PIO
    Model: 0
    Serial Number: ...
    Made in: 2012
  Basic Display Parameters & Features:
    Digital display
    Maximum image size: 160 cm x 90 cm
    Gamma: 2.20
    RGB color display
    First detailed timing is preferred timing
  Color Characteristics:
    Red  : 0.6396, 0.3300
    Green: 0.2998, 0.5996
    Blue : 0.1503, 0.0595
    White: 0.3125, 0.3291
  Established Timings I & II:
    IBM     :   720x400    70.082 Hz   9:5    31.467 kHz  28.320 MHz
    DMT 0x04:   640x480    59.940 Hz   4:3    31.469 kHz  25.175 MHz
    DMT 0x09:   800x600    60.317 Hz   4:3    37.879 kHz  40.000 MHz
    DMT 0x10:  1024x768    60.004 Hz   4:3    48.363 kHz  65.000 MHz
  Standard Timings:
    DMT 0x04:   640x480    59.940 Hz   4:3    31.469 kHz  25.175 MHz
    DMT 0x09:   800x600    60.317 Hz   4:3    37.879 kHz  40.000 MHz
    DMT 0x10:  1024x768    60.004 Hz   4:3    48.363 kHz  65.000 MHz
    GTF     :  1152x864    60.000 Hz   4:3    53.700 kHz  81.624 MHz
    DMT 0x23:  1280x1024   60.020 Hz   5:4    63.981 kHz 108.000 MHz
  Detailed Timing Descriptors:
    DTD 1:  1920x1080   60.000 Hz  16:9    67.500 kHz 148.500 MHz (160 mm x 90 mm)
                 Hfront   88 Hsync  44 Hback 148 Hpol P
                 Vfront    4 Vsync   5 Vback  36 Vpol P
    DTD 2:  1920x1080   60.000 Hz  16:9    67.500 kHz 148.500 MHz (160 mm x 90 mm)
                 Hfront   88 Hsync  44 Hback 148 Hpol P
                 Vfront    4 Vsync   5 Vback  36 Vpol P
  Display Range Limits:
    Monitor ranges (GTF): 58-62 Hz V, 30-83 kHz H, max dotclock 160 MHz
    Display Product Name: 'VSX-827'
  Extension blocks: 1
Checksum: 0x84

----------------

Block 1, CTA-861 Extension Block:
  Revision: 3
  Underscans PC formats by default
  Basic audio support
  Supports YCbCr 4:4:4
  Supports YCbCr 4:2:2
  Native detailed modes: 1
  Video Data Block:
    VIC  16:  1920x1080   60.000 Hz  16:9    67.500 kHz 148.500 MHz
    VIC  31:  1920x1080   50.000 Hz  16:9    56.250 kHz 148.500 MHz (native)
    VIC   4:  1280x720    60.000 Hz  16:9    45.000 kHz  74.250 MHz
    VIC  19:  1280x720    50.000 Hz  16:9    37.500 kHz  74.250 MHz
    VIC   5:  1920x1080i  60.000 Hz  16:9    33.750 kHz  74.250 MHz
    VIC  20:  1920x1080i  50.000 Hz  16:9    28.125 kHz  74.250 MHz
    VIC   3:   720x480    59.940 Hz  16:9    31.469 kHz  27.000 MHz
    VIC   2:   720x480    59.940 Hz   4:3    31.469 kHz  27.000 MHz
    VIC  18:   720x576    50.000 Hz  16:9    31.250 kHz  27.000 MHz
    VIC  32:  1920x1080   24.000 Hz  16:9    27.000 kHz  74.250 MHz
    VIC  33:  1920x1080   25.000 Hz  16:9    28.125 kHz  74.250 MHz
    VIC  34:  1920x1080   30.000 Hz  16:9    33.750 kHz  74.250 MHz
    VIC  21:  1440x576i   50.000 Hz   4:3    15.625 kHz  27.000 MHz
    VIC   1:   640x480    59.940 Hz   4:3    31.469 kHz  25.175 MHz
  Audio Data Block:
    Linear PCM:
      Max channels: 2
      Supported sample rates (kHz): 192 176.4 96 88.2 48 44.1 32
      Supported sample sizes (bits): 24 20 16
    Linear PCM:
      Max channels: 8
      Supported sample rates (kHz): 192 176.4 96 88.2 48 44.1 32
      Supported sample sizes (bits): 24 20 16
    AC-3:
      Max channels: 6
      Supported sample rates (kHz): 48 44.1 32
      Maximum bit rate: 640 kb/s
    DTS:
      Max channels: 7
      Supported sample rates (kHz): 96 88.2 48 44.1
      Maximum bit rate: 1536 kb/s
    One Bit Audio:
      Max channels: 2
      Supported sample rates (kHz): 176.4 88.2 44.1
    Dolby Digital+:
      Max channels: 8
      Supported sample rates (kHz): 48 44.1
    DTS-HD:
      Max channels: 8
      Supported sample rates (kHz): 192 176.4 96 88.2 48 44.1
    MAT (MLP):
      Max channels: 8
      Supported sample rates (kHz): 192 176.4 96 88.2 48 44.1 32
  Speaker Allocation Data Block:
    FL/FR - Front Left/Right
    LFE1 - Low Frequency Effects 1
    FC - Front Center
    BL/BR - Back Left/Right
    RLC/RRC - Rear Left/Right of Center (Deprecated)
  Vendor-Specific Data Block (HDMI), OUI 00-0C-03:
    Source physical address: 1.3.0.0
    Supports_AI
    Maximum TMDS clock: 225 MHz
    Extended HDMI video details:
      3D present
      3D-capable-VIC mask present
      3D: Side-by-side (half, horizontal)
      3D: Top-and-bottom
      3D: Side-by-side (full)
      3D: Line-alternative
      3D: Field-alternative
      3D: Frame-packing
      3D VIC indices that support these capabilities:
        VIC   4:  1280x720    60.000 Hz  16:9    45.000 kHz  74.250 MHz
        VIC  19:  1280x720    50.000 Hz  16:9    37.500 kHz  74.250 MHz
        VIC   5:  1920x1080i  60.000 Hz  16:9    33.750 kHz  74.250 MHz
        VIC  20:  1920x1080i  50.000 Hz  16:9    28.125 kHz  74.250 MHz
        VIC   3:   720x480    59.940 Hz  16:9    31.469 kHz  27.000 MHz
        VIC   2:   720x480    59.940 Hz   4:3    31.469 kHz  27.000 MHz
        VIC  18:   720x576    50.000 Hz  16:9    31.250 kHz  27.000 MHz
        VIC  32:  1920x1080   24.000 Hz  16:9    27.000 kHz  74.250 MHz
        VIC  33:  1920x1080   25.000 Hz  16:9    28.125 kHz  74.250 MHz
        VIC  34:  1920x1080   30.000 Hz  16:9    33.750 kHz  74.250 MHz
        VIC  21:  1440x576i   50.000 Hz   4:3    15.625 kHz  27.000 MHz
        VIC   1:   640x480    59.940 Hz   4:3    31.469 kHz  25.175 MHz
      3D VIC indices with specific capabilities:
        VIC  16:  1920x1080   60.000 Hz  16:9    67.500 kHz 148.500 MHz (side-by-side, horizontal)
        VIC  31:  1920x1080   50.000 Hz  16:9    56.250 kHz 148.500 MHz (side-by-side, horizontal)
        VIC  16:  1920x1080   60.000 Hz  16:9    67.500 kHz 148.500 MHz (top-and-bottom)
        VIC  16:  1920x1080   60.000 Hz  16:9    67.500 kHz 148.500 MHz (top-and-bottom)
        VIC  16:  1920x1080   60.000 Hz  16:9    67.500 kHz 148.500 MHz (top-and-bottom)
        VIC  16:  1920x1080   60.000 Hz  16:9    67.500 kHz 148.500 MHz (top-and-bottom)
        VIC   4:  1280x720    60.000 Hz  16:9    45.000 kHz  74.250 MHz (side-by-side, horizontal)
  Colorimetry Data Block:
  Detailed Timing Descriptors:
    DTD 3:  1920x1080i  60.000 Hz  16:9    33.750 kHz  74.250 MHz (160 mm x 90 mm)
                 Hfront   88 Hsync  44 Hback 148 Hpol P
                 Vfront    2 Vsync   5 Vback  15 Vpol P Vfront +0.5 Odd Field
                 Vfront    2 Vsync   5 Vback  15 Vpol P Vback  +0.5 Even Field
    DTD 4:  1280x720    60.000 Hz  16:9    45.000 kHz  74.250 MHz (160 mm x 90 mm)
                 Hfront  110 Hsync  40 Hback 220 Hpol P
                 Vfront    5 Vsync   5 Vback  20 Vpol P
Checksum: 0xd2
