
EDID (hex):
00ffffffffffff0009d10e7845540000
2f120103802f1e782ec4f6a3574a9c23
114f54a56b80710081009500950f8180
8140b30001017c2e90a0601a1e403020
3600d92911000018000000ff004c4238
30313537375a4c300a20000000fd0037
4c1f5311000a202020202020000000fc
0042656e51204732323030570a2000ab

Extracted contents:
header:          00 ff ff ff ff ff ff 00
serial number:   09 d1 0e 78 45 54 00 00 2f 12
version:         01 03
basic params:    80 2f 1e 78 2e
chroma info:     c4 f6 a3 57 4a 9c 23 11 4f 54
established:     a5 6b 80
standard:        71 00 81 00 95 00 95 0f 81 80 81 40 b3 00 01 01
descriptor 1:    7c 2e 90 a0 60 1a 1e 40 30 20 36 00 d9 29 11 00 00 18
descriptor 2:    00 00 00 ff 00 4c 42 38 30 31 35 37 37 5a 4c 30 0a 20
descriptor 3:    00 00 00 fd 00 37 4c 1f 53 11 00 0a 20 20 20 20 20 20
descriptor 4:    00 00 00 fc 00 42 65 6e 51 20 47 32 32 30 30 57 0a 20
extensions:      00
checksum:        ab

EDID version: 1.3
Manufacturer: BNQ Model 780e Serial Number --
Made in week 47 of 2008
Digital display
Maximum image size: 47 cm x 30 cm
Gamma: 2.20
DPMS levels: Off
RGB color display
Default (sRGB) color space is primary color space
First detailed timing is preferred timing
Display x,y Chromaticity:
  Red:   0.6396, 0.3398
  Green: 0.2900, 0.6093
  Blue:  0.1396, 0.0693
  White: 0.3095, 0.3300
Established timings supported:
  720x400@70Hz 9:5 HorFreq: 31469 Hz Clock: 28.320 MHz
  640x480@60Hz 4:3 HorFreq: 31469 Hz Clock: 25.175 MHz
  640x480@75Hz 4:3 HorFreq: 37500 Hz Clock: 31.500 MHz
  800x600@60Hz 4:3 HorFreq: 37900 Hz Clock: 40.000 MHz
  800x600@75Hz 4:3 HorFreq: 46900 Hz Clock: 49.500 MHz
  832x624@75Hz 4:3 HorFreq: 49726 Hz Clock: 57.284 MHz
  1024x768@60Hz 4:3 HorFreq: 48400 Hz Clock: 65.000 MHz
  1024x768@75Hz 4:3 HorFreq: 60000 Hz Clock: 78.750 MHz
  1280x1024@75Hz 5:4 HorFreq: 80000 Hz Clock: 135.000 MHz
  1152x870@75Hz 192:145 HorFreq: 67500 Hz Clock: 108.000 MHz
Standard timings supported:
  1152x720@60Hz 16:10
  1280x800@60Hz 16:10
  1440x900@60Hz 16:10 HorFreq: 55500 Hz Clock: 88.750 MHz
  1440x900@75Hz 16:10 HorFreq: 82300 Hz Clock: 156.000 MHz
  1280x1024@60Hz 5:4 HorFreq: 64000 Hz Clock: 108.000 MHz
  1280x960@60Hz 4:3 HorFreq: 60000 Hz Clock: 108.000 MHz
  1680x1050@60Hz 16:10 HorFreq: 64700 Hz Clock: 119.000 MHz
Detailed mode: Clock 119.000 MHz, 473 mm x 297 mm
               1680 1728 1760 1840 hborder 0
               1050 1053 1059 1080 vborder 0
               -hsync -vsync 
               VertFreq: 59 Hz, HorFreq: 64673 Hz
Serial number: --
Monitor ranges (GTF): 55-76Hz V, 31-83kHz H, max dotclock 170MHz
Monitor name: BenQ G2200W
Checksum: 0xab (valid)
EDID block does NOT conform to EDID 1.3!
	sRGB is signaled, but the chromaticities do not match
