edid-decode (hex):

00 ff ff ff ff ff ff 00 4c 23 66 27 00 00 00 00
12 22 01 04 b5 3c 21 78 3b 1f 51 ae 4e 33 a4 22
12 50 54 bf ef 80 71 4f 81 40 81 80 81 c0 95 00
b3 00 d1 c0 d1 fc 4d d0 00 a0 f0 70 3e 80 30 20
35 00 55 50 21 00 00 1a 00 00 00 ff 00 30 30 30
31 0a 20 20 20 20 20 20 20 20 00 00 00 fd 00 30
a0 ff ff 82 01 0a 20 20 20 20 20 20 00 00 00 fc
00 47 37 75 20 50 72 6f 0a 20 20 20 20 20 02 4c

02 03 45 f2 55 5d 5e 5f 60 61 01 40 03 11 12 13
04 0e 0f 1d 1e 1f 90 3f 75 76 23 09 07 07 83 01
00 00 e3 05 c3 01 e2 0f 18 e3 0e 75 76 e2 00 d5
e6 06 05 01 69 69 00 6d 1a 00 00 02 01 30 a0 00
00 69 55 00 00 6a 5e 00 a0 a0 a0 29 50 30 20 35
00 55 50 21 00 00 1e 98 e2 00 a0 a0 a0 29 50 30
20 54 00 55 50 21 00 00 1e 00 00 00 00 00 00 00
00 00 00 00 00 00 00 00 00 00 00 00 00 00 00 1e

70 12 67 00 00 03 00 64 8c ee 01 04 ff 0e 9f 00
2f 00 1f 00 6f 08 25 00 02 00 04 00 1f 9c 01 04
ff 0e 9f 00 2f 00 1f 00 6f 08 25 00 02 00 04 00
e5 1e 02 04 ff 0e 81 00 2f 00 1f 00 6f 08 1b 00
02 00 04 00 d3 bc 00 04 ff 09 9f 00 2f 00 1f 00
9f 05 28 00 02 00 04 00 37 8b 00 04 7f 07 17 01
57 00 2b 00 37 04 2c 00 03 00 04 00 7e 00 00 00
00 00 00 00 00 00 00 00 00 00 00 00 00 00 00 90

00 ff ff ff ff ff ff 00 4c 23 66 27 00 00 00 00
12 22 01 04 b5 3c 21 78 3b 1f 51 ae 4e 33 a4 22
12 50 54 bf ef 80 71 4f 81 40 81 80 81 c0 95 00
b3 00 d1 c0 d1 fc 4d d0 00 a0 f0 70 3e 80 30 20
35 00 55 50 21 00 00 1a 00 00 00 ff 00 30 30 30
31 0a 20 20 20 20 20 20 20 20 00 00 00 fd 00 30
a0 ff ff 82 01 0a 20 20 20 20 20 20 00 00 00 fc
00 47 37 75 20 50 72 6f 0a 20 20 20 20 20 02 4c

02 03 45 f2 55 5d 5e 5f 60 61 01 40 03 11 12 13
04 0e 0f 1d 1e 1f 90 3f 75 76 23 09 07 07 83 01
00 00 e3 05 c3 01 e2 0f 18 e3 0e 75 76 e2 00 d5
e6 06 05 01 69 69 00 6d 1a 00 00 02 01 30 a0 00
00 69 55 00 00 6a 5e 00 a0 a0 a0 29 50 30 20 35
00 55 50 21 00 00 1e 98 e2 00 a0 a0 a0 29 50 30
20 54 00 55 50 21 00 00 1e 00 00 00 00 00 00 00
00 00 00 00 00 00 00 00 00 00 00 00 00 00 00 1e

70 12 67 00 00 03 00 64 8c ee 01 04 ff 0e 9f 00
2f 00 1f 00 6f 08 25 00 02 00 04 00 1f 9c 01 04
ff 0e 9f 00 2f 00 1f 00 6f 08 25 00 02 00 04 00
e5 1e 02 04 ff 0e 81 00 2f 00 1f 00 6f 08 1b 00
02 00 04 00 d3 bc 00 04 ff 09 9f 00 2f 00 1f 00
9f 05 28 00 02 00 04 00 37 8b 00 04 7f 07 17 01
57 00 2b 00 37 04 2c 00 03 00 04 00 7e 00 00 00
00 00 00 00 00 00 00 00 00 00 00 00 00 00 00 90

----------------

Block 0, Base EDID:
  EDID Structure Version & Revision: 1.4
  Vendor & Product Identification:
    Manufacturer: SAC
    Model: 10086
    Made in: week 18 of 2024
  Basic Display Parameters & Features:
    Digital display
    Bits per primary color channel: 10
    DisplayPort interface
    Maximum image size: 60 cm x 33 cm
    Gamma: 2.20
    DPMS levels: Off
    Supported color formats: RGB 4:4:4, YCrCb 4:4:4, YCrCb 4:2:2
    First detailed timing includes the native pixel format and preferred refresh rate
    Display is continuous frequency
  Color Characteristics:
    Red  : 0.6796, 0.3056
    Green: 0.2021, 0.6435
    Blue : 0.1337, 0.0712
    White: 0.3125, 0.3291
  Established Timings I & II:
    IBM     :   720x400    70.081663 Hz   9:5     31.467 kHz     28.320000 MHz
    DMT 0x04:   640x480    59.940476 Hz   4:3     31.469 kHz     25.175000 MHz
    Apple   :   640x480    66.666667 Hz   4:3     35.000 kHz     30.240000 MHz
    DMT 0x05:   640x480    72.808802 Hz   4:3     37.861 kHz     31.500000 MHz
    DMT 0x06:   640x480    75.000000 Hz   4:3     37.500 kHz     31.500000 MHz
    DMT 0x08:   800x600    56.250000 Hz   4:3     35.156 kHz     36.000000 MHz
    DMT 0x09:   800x600    60.316541 Hz   4:3     37.879 kHz     40.000000 MHz
    DMT 0x0a:   800x600    72.187572 Hz   4:3     48.077 kHz     50.000000 MHz
    DMT 0x0b:   800x600    75.000000 Hz   4:3     46.875 kHz     49.500000 MHz
    Apple   :   832x624    74.551266 Hz   4:3     49.726 kHz     57.284000 MHz
    DMT 0x10:  1024x768    60.003840 Hz   4:3     48.363 kHz     65.000000 MHz
    DMT 0x11:  1024x768    70.069359 Hz   4:3     56.476 kHz     75.000000 MHz
    DMT 0x12:  1024x768    75.028582 Hz   4:3     60.023 kHz     78.750000 MHz
    DMT 0x24:  1280x1024   75.024675 Hz   5:4     79.976 kHz    135.000000 MHz
    Apple   :  1152x870    75.061550 Hz 192:145   68.681 kHz    100.000000 MHz
  Standard Timings:
    DMT 0x15:  1152x864    75.000000 Hz   4:3     67.500 kHz    108.000000 MHz
    DMT 0x20:  1280x960    60.000000 Hz   4:3     60.000 kHz    108.000000 MHz
    DMT 0x23:  1280x1024   60.019740 Hz   5:4     63.981 kHz    108.000000 MHz
    DMT 0x55:  1280x720    60.000000 Hz  16:9     45.000 kHz     74.250000 MHz
    DMT 0x2f:  1440x900    59.887445 Hz  16:10    55.935 kHz    106.500000 MHz
    DMT 0x3a:  1680x1050   59.954250 Hz  16:10    65.290 kHz    146.250000 MHz
    DMT 0x52:  1920x1080   60.000000 Hz  16:9     67.500 kHz    148.500000 MHz
    GTF     :  1920x1080  119.999987 Hz  16:9    138.840 kHz    368.759000 MHz
  Detailed Timing Descriptors:
    DTD 1:  3840x2160   59.996625 Hz  16:9    133.312 kHz    533.250000 MHz (597 mm x 336 mm)
                 Hfront   48 Hsync  32 Hback   80 Hpol P
                 Vfront    3 Vsync   5 Vback   54 Vpol N
    Display Product Serial Number: ...
    Display Range Limits:
      Monitor ranges (Bare Limits): 48-160 Hz V, 255-255 kHz H, max dotclock 1300 MHz
    Display Product Name: 'G7u Pro'
  Extension blocks: 2
Checksum: 0x4c

----------------

Block 1, CTA-861 Extension Block:
  Revision: 3
  Underscans IT Video Formats by default
  Basic audio support
  Supports YCbCr 4:4:4
  Supports YCbCr 4:2:2
  Native detailed modes: 2
  Video Data Block:
    VIC  93:  3840x2160   24.000000 Hz  16:9     54.000 kHz    297.000000 MHz
    VIC  94:  3840x2160   25.000000 Hz  16:9     56.250 kHz    297.000000 MHz
    VIC  95:  3840x2160   30.000000 Hz  16:9     67.500 kHz    297.000000 MHz
    VIC  96:  3840x2160   50.000000 Hz  16:9    112.500 kHz    594.000000 MHz
    VIC  97:  3840x2160   60.000000 Hz  16:9    135.000 kHz    594.000000 MHz
    VIC   1:   640x480    59.940476 Hz   4:3     31.469 kHz     25.175000 MHz
    VIC  64:  1920x1080  100.000000 Hz  16:9    112.500 kHz    297.000000 MHz
    VIC   3:   720x480    59.940060 Hz  16:9     31.469 kHz     27.000000 MHz
    VIC  17:   720x576    50.000000 Hz   4:3     31.250 kHz     27.000000 MHz
    VIC  18:   720x576    50.000000 Hz  16:9     31.250 kHz     27.000000 MHz
    VIC  19:  1280x720    50.000000 Hz  16:9     37.500 kHz     74.250000 MHz
    VIC   4:  1280x720    60.000000 Hz  16:9     45.000 kHz     74.250000 MHz
    VIC  14:  1440x480    59.940060 Hz   4:3     31.469 kHz     54.000000 MHz
    VIC  15:  1440x480    59.940060 Hz  16:9     31.469 kHz     54.000000 MHz
    VIC  29:  1440x576    50.000000 Hz   4:3     31.250 kHz     54.000000 MHz
    VIC  30:  1440x576    50.000000 Hz  16:9     31.250 kHz     54.000000 MHz
    VIC  31:  1920x1080   50.000000 Hz  16:9     56.250 kHz    148.500000 MHz
    VIC  16:  1920x1080   60.000000 Hz  16:9     67.500 kHz    148.500000 MHz (native)
    VIC  63:  1920x1080  120.000000 Hz  16:9    135.000 kHz    297.000000 MHz
    VIC 117:  3840x2160  100.000000 Hz  16:9    225.000 kHz   1188.000000 MHz
    VIC 118:  3840x2160  120.000000 Hz  16:9    270.000 kHz   1188.000000 MHz
  Audio Data Block:
    Linear PCM:
      Max channels: 2
      Supported sample rates (kHz): 48 44.1 32
      Supported sample sizes (bits): 24 20 16
  Speaker Allocation Data Block:
    FL/FR - Front Left/Right
  Colorimetry Data Block:
    xvYCC601
    xvYCC709
    BT2020YCC
    BT2020RGB
    Gamut Boundary Description Metadata Profile P0
  YCbCr 4:2:0 Capability Map Data Block:
    VIC  96:  3840x2160   50.000000 Hz  16:9    112.500 kHz    594.000000 MHz
    VIC  97:  3840x2160   60.000000 Hz  16:9    135.000 kHz    594.000000 MHz
  YCbCr 4:2:0 Video Data Block:
    VIC 117:  3840x2160  100.000000 Hz  16:9    225.000 kHz   1188.000000 MHz
    VIC 118:  3840x2160  120.000000 Hz  16:9    270.000 kHz   1188.000000 MHz
  Video Capability Data Block:
    YCbCr quantization: Selectable (via AVI YQ)
    RGB quantization: Selectable (via AVI Q)
    PT scan behavior: Always Overscanned
    IT scan behavior: Always Overscanned
    CE scan behavior: Always Overscanned
  HDR Static Metadata Data Block:
    Electro optical transfer functions:
      Traditional gamma - SDR luminance range
      SMPTE ST2084
    Supported static metadata descriptors:
      Static metadata type 1
    Desired content max luminance: 105 (486.099 cd/m^2)
    Desired content max frame-average luminance: 105 (486.099 cd/m^2)
    Desired content min luminance: 0 (0.000 cd/m^2)
  Vendor-Specific Data Block (AMD), OUI 00-00-1A:
    Version: 2.1
    Minimum Refresh Rate: 48 Hz
    Maximum Refresh Rate: 160 Hz
    Flags 1.x: 0x00
    Flags 2.x: 0x00
    Maximum luminance: 105 (486.099 cd/m^2)
    Minimum luminance: 85 (0.540 cd/m^2)
    Unknown: 0x00 0x00
  Detailed Timing Descriptors:
    DTD 2:  2560x1440   60.000199 Hz  16:9     88.860 kHz    241.700000 MHz (597 mm x 336 mm)
                 Hfront   48 Hsync  32 Hback   80 Hpol P
                 Vfront    3 Vsync   5 Vback   33 Vpol P
    DTD 3:  2560x1440  144.000477 Hz  16:9    213.265 kHz    580.080000 MHz (597 mm x 336 mm)
                 Hfront   48 Hsync  32 Hback   80 Hpol P
                 Vfront    5 Vsync   4 Vback   32 Vpol P
Checksum: 0x1e  Unused space in Extension Block: 22 bytes

----------------

Block 2, DisplayID Extension Block:
  Version: 1.2
  Extension Count: 0
  Display Product Type: Extension Section
  Video Timing Modes Type 1 - Detailed Timings Data Block:
    DTD:  3840x2160  144.000227 Hz  16:9    316.512 kHz   1266.050000 MHz (aspect 16:9, no 3D stereo)
               Hfront   48 Hsync  32 Hback   80 Hpol N
               Vfront    3 Vsync   5 Vback   30 Vpol N
    DTD:  3840x2160  120.000000 Hz  16:9    263.760 kHz   1055.040000 MHz (aspect 16:9, no 3D stereo)
               Hfront   48 Hsync  32 Hback   80 Hpol N
               Vfront    3 Vsync   5 Vback   30 Vpol N
    DTD:  3840x2160  160.000276 Hz  16:9    350.081 kHz   1389.820000 MHz (aspect 16:9, no 3D stereo)
               Hfront   48 Hsync  32 Hback   50 Hpol N
               Vfront    3 Vsync   5 Vback   20 Vpol N
    DTD:  2560x1440  120.000397 Hz  16:9    177.721 kHz    483.400000 MHz (aspect 16:9, no 3D stereo)
               Hfront   48 Hsync  32 Hback   80 Hpol N
               Vfront    3 Vsync   5 Vback   33 Vpol N
    DTD:  1920x1080  144.000000 Hz  16:9    162.000 kHz    356.400000 MHz (aspect 16:9, no 3D stereo)
               Hfront   88 Hsync  44 Hback  148 Hpol N
               Vfront    4 Vsync   5 Vback   36 Vpol N
  Checksum: 0x7e
Checksum: 0x90  Unused space in Extension Block: 18 bytes

----------------

Block 3, Unknown EDID Extension Block 0x00:
  00 ff ff ff ff ff ff 00 4c 23 66 27 00 00 00 00 '........L#f'....'
  12 22 01 04 b5 3c 21 78 3b 1f 51 ae 4e 33 a4 22 '."...<!x;.Q.N3."'
  12 50 54 bf ef 80 71 4f 81 40 81 80 81 c0 95 00 '.PT...qO.@......'
  b3 00 d1 c0 d1 fc 4d d0 00 a0 f0 70 3e 80 30 20 '......M....p>.0 '
  35 00 55 50 21 00 00 1a 00 00 00 ff 00 30 30 30 '5.UP!........000'
  31 0a 20 20 20 20 20 20 20 20 00 00 00 fd 00 30 '1.        .....0'
  a0 ff ff 82 01 0a 20 20 20 20 20 20 00 00 00 fc '......      ....'
  00 47 37 75 20 50 72 6f 0a 20 20 20 20 20 02 4c '.G7u Pro.     .L'
Checksum: 0x4c

----------------

Block 4, CTA-861 Extension Block:
  Revision: 3
  Underscans IT Video Formats by default
  Basic audio support
  Supports YCbCr 4:4:4
  Supports YCbCr 4:2:2
  Native detailed modes: 2
  Video Data Block:
    VIC  93:  3840x2160   24.000000 Hz  16:9     54.000 kHz    297.000000 MHz
    VIC  94:  3840x2160   25.000000 Hz  16:9     56.250 kHz    297.000000 MHz
    VIC  95:  3840x2160   30.000000 Hz  16:9     67.500 kHz    297.000000 MHz
    VIC  96:  3840x2160   50.000000 Hz  16:9    112.500 kHz    594.000000 MHz
    VIC  97:  3840x2160   60.000000 Hz  16:9    135.000 kHz    594.000000 MHz
    VIC   1:   640x480    59.940476 Hz   4:3     31.469 kHz     25.175000 MHz
    VIC  64:  1920x1080  100.000000 Hz  16:9    112.500 kHz    297.000000 MHz
    VIC   3:   720x480    59.940060 Hz  16:9     31.469 kHz     27.000000 MHz
    VIC  17:   720x576    50.000000 Hz   4:3     31.250 kHz     27.000000 MHz
    VIC  18:   720x576    50.000000 Hz  16:9     31.250 kHz     27.000000 MHz
    VIC  19:  1280x720    50.000000 Hz  16:9     37.500 kHz     74.250000 MHz
    VIC   4:  1280x720    60.000000 Hz  16:9     45.000 kHz     74.250000 MHz
    VIC  14:  1440x480    59.940060 Hz   4:3     31.469 kHz     54.000000 MHz
    VIC  15:  1440x480    59.940060 Hz  16:9     31.469 kHz     54.000000 MHz
    VIC  29:  1440x576    50.000000 Hz   4:3     31.250 kHz     54.000000 MHz
    VIC  30:  1440x576    50.000000 Hz  16:9     31.250 kHz     54.000000 MHz
    VIC  31:  1920x1080   50.000000 Hz  16:9     56.250 kHz    148.500000 MHz
    VIC  16:  1920x1080   60.000000 Hz  16:9     67.500 kHz    148.500000 MHz (native)
    VIC  63:  1920x1080  120.000000 Hz  16:9    135.000 kHz    297.000000 MHz
    VIC 117:  3840x2160  100.000000 Hz  16:9    225.000 kHz   1188.000000 MHz
    VIC 118:  3840x2160  120.000000 Hz  16:9    270.000 kHz   1188.000000 MHz
  Audio Data Block:
    Linear PCM:
      Max channels: 2
      Supported sample rates (kHz): 48 44.1 32
      Supported sample sizes (bits): 24 20 16
  Speaker Allocation Data Block:
    FL/FR - Front Left/Right
  Colorimetry Data Block:
    xvYCC601
    xvYCC709
    BT2020YCC
    BT2020RGB
    Gamut Boundary Description Metadata Profile P0
  YCbCr 4:2:0 Capability Map Data Block:
    VIC  96:  3840x2160   50.000000 Hz  16:9    112.500 kHz    594.000000 MHz
    VIC  97:  3840x2160   60.000000 Hz  16:9    135.000 kHz    594.000000 MHz
  YCbCr 4:2:0 Video Data Block:
    VIC 117:  3840x2160  100.000000 Hz  16:9    225.000 kHz   1188.000000 MHz
    VIC 118:  3840x2160  120.000000 Hz  16:9    270.000 kHz   1188.000000 MHz
  Video Capability Data Block:
    YCbCr quantization: Selectable (via AVI YQ)
    RGB quantization: Selectable (via AVI Q)
    PT scan behavior: Always Overscanned
    IT scan behavior: Always Overscanned
    CE scan behavior: Always Overscanned
  HDR Static Metadata Data Block:
    Electro optical transfer functions:
      Traditional gamma - SDR luminance range
      SMPTE ST2084
    Supported static metadata descriptors:
      Static metadata type 1
    Desired content max luminance: 105 (486.099 cd/m^2)
    Desired content max frame-average luminance: 105 (486.099 cd/m^2)
    Desired content min luminance: 0 (0.000 cd/m^2)
  Vendor-Specific Data Block (AMD), OUI 00-00-1A:
    Version: 2.1
    Minimum Refresh Rate: 48 Hz
    Maximum Refresh Rate: 160 Hz
    Flags 1.x: 0x00
    Flags 2.x: 0x00
    Maximum luminance: 105 (486.099 cd/m^2)
    Minimum luminance: 85 (0.540 cd/m^2)
    Unknown: 0x00 0x00
  Detailed Timing Descriptors:
    DTD 4:  2560x1440   60.000199 Hz  16:9     88.860 kHz    241.700000 MHz (597 mm x 336 mm)
                 Hfront   48 Hsync  32 Hback   80 Hpol P
                 Vfront    3 Vsync   5 Vback   33 Vpol P
    DTD 5:  2560x1440  144.000477 Hz  16:9    213.265 kHz    580.080000 MHz (597 mm x 336 mm)
                 Hfront   48 Hsync  32 Hback   80 Hpol P
                 Vfront    5 Vsync   4 Vback   32 Vpol P
Checksum: 0x1e  Unused space in Extension Block: 22 bytes

----------------

Block 5, DisplayID Extension Block:
  Version: 1.2
  Extension Count: 0
  Video Timing Modes Type 1 - Detailed Timings Data Block:
    DTD:  3840x2160  144.000227 Hz  16:9    316.512 kHz   1266.050000 MHz (aspect 16:9, no 3D stereo)
               Hfront   48 Hsync  32 Hback   80 Hpol N
               Vfront    3 Vsync   5 Vback   30 Vpol N
    DTD:  3840x2160  120.000000 Hz  16:9    263.760 kHz   1055.040000 MHz (aspect 16:9, no 3D stereo)
               Hfront   48 Hsync  32 Hback   80 Hpol N
               Vfront    3 Vsync   5 Vback   30 Vpol N
    DTD:  3840x2160  160.000276 Hz  16:9    350.081 kHz   1389.820000 MHz (aspect 16:9, no 3D stereo)
               Hfront   48 Hsync  32 Hback   50 Hpol N
               Vfront    3 Vsync   5 Vback   20 Vpol N
    DTD:  2560x1440  120.000397 Hz  16:9    177.721 kHz    483.400000 MHz (aspect 16:9, no 3D stereo)
               Hfront   48 Hsync  32 Hback   80 Hpol N
               Vfront    3 Vsync   5 Vback   33 Vpol N
    DTD:  1920x1080  144.000000 Hz  16:9    162.000 kHz    356.400000 MHz (aspect 16:9, no 3D stereo)
               Hfront   88 Hsync  44 Hback  148 Hpol N
               Vfront    4 Vsync   5 Vback   36 Vpol N
  Checksum: 0x7e
Checksum: 0x90  Unused space in Extension Block: 18 bytes

----------------

Warnings:

Block 1, CTA-861 Extension Block:
  Colorimetry Data Block: Set the sRGB colorimetry bit to avoid interop issues.
  Video Capability Data Block: IT scan behavior is expected to support underscanned.
  Video Capability Data Block: S_PT is equal to S_IT and S_CE, so should be set to 0 instead.
Block 4, CTA-861 Extension Block:
  Colorimetry Data Block: Set the sRGB colorimetry bit to avoid interop issues.
  Video Capability Data Block: IT scan behavior is expected to support underscanned.
  Video Capability Data Block: S_PT is equal to S_IT and S_CE, so should be set to 0 instead.
EDID:
  Base EDID: Some timings are out of range of the Monitor Ranges:
    Vertical Freq: 24.000 - 160.000 Hz (Monitor: 48.000 - 160.000 Hz)
    Horizontal Freq: 31.250 - 350.080 kHz (Monitor: 255.000 - 255.000 kHz)
    Maximum Clock: 1389.820 MHz (Monitor: 1300.000 MHz)

Failures:

Block 1, CTA-861 Extension Block:
  YCbCr 4:2:0 Video Data Block: YCbCr 4:2:0-only VIC 117 is also a regular VIC.
  YCbCr 4:2:0 Video Data Block: YCbCr 4:2:0-only VIC 118 is also a regular VIC.
  Video Capability Data Block: IT video formats are always overscanned, but bit 7 of Byte 3 of the CTA-861 Extension header is set to underscanned.
Block 2, DisplayID Extension Block:
  DisplayID Base Block has no product type.
  Expected 0 DisplayID Extension Block, but got 1.
Block 3, Base EDID:
  Unknown Extension Block.
Block 4, CTA-861 Extension Block:
  Video Data Block: Duplicate VIC 93.
  Video Data Block: Duplicate VIC 94.
  Video Data Block: Duplicate VIC 95.
  Video Data Block: Duplicate VIC 96.
  Video Data Block: Duplicate VIC 97.
  Video Data Block: Duplicate VIC 1.
  Video Data Block: Duplicate VIC 64.
  Video Data Block: Duplicate VIC 3.
  Video Data Block: Duplicate VIC 17.
  Video Data Block: Duplicate VIC 18.
  Video Data Block: Duplicate VIC 19.
  Video Data Block: Duplicate VIC 4.
  Video Data Block: Duplicate VIC 14.
  Video Data Block: Duplicate VIC 15.
  Video Data Block: Duplicate VIC 29.
  Video Data Block: Duplicate VIC 30.
  Video Data Block: Duplicate VIC 31.
  Video Data Block: Duplicate VIC 16.
  Video Data Block: Duplicate VIC 63.
  Video Data Block: Duplicate VIC 117.
  Video Data Block: Duplicate VIC 118.
  Speaker Allocation Data Block: Only one instance of this Data Block is allowed.
  Colorimetry Data Block: Only one instance of this Data Block is allowed.
  YCbCr 4:2:0 Capability Map Data Block: Only one instance of this Data Block is allowed.
  YCbCr 4:2:0 Video Data Block: Duplicate YCbCr 4:2:0 VIC 117.
  YCbCr 4:2:0 Video Data Block: YCbCr 4:2:0-only VIC 117 is also a regular VIC.
  YCbCr 4:2:0 Video Data Block: Duplicate YCbCr 4:2:0 VIC 118.
  YCbCr 4:2:0 Video Data Block: YCbCr 4:2:0-only VIC 118 is also a regular VIC.
  Video Capability Data Block: Only one instance of this Data Block is allowed.
  Video Capability Data Block: IT video formats are always overscanned, but bit 7 of Byte 3 of the CTA-861 Extension header is set to underscanned.
  HDR Static Metadata Data Block: Only one instance of this Data Block is allowed.
EDID:
  Base EDID: EDID specified 2 extension block(s), but found 5 extension block(s).
  CTA-861: Native progressive timings are a mix of several resolutions.
  DisplayID: Missing DisplayID Product Identification Data Block.
  DisplayID: DisplayID expects at least one preferred timing.

EDID conformity: FAIL
