edid-decode (hex):

00 ff ff ff ff ff ff 00 10 ac 55 a0 4c 38 46 31
29 15 01 03 80 3c 22 78 ea 8e 05 ad 4f 33 b0 26
0d 50 54 a5 4b 00 81 00 b3 00 d1 00 71 4f a9 40
81 80 01 01 01 01 56 5e 00 a0 a0 a0 29 50 30 20
35 00 55 50 21 00 00 1a 00 00 00 ff 00 44 39 37
31 54 31 41 37 31 46 38 4c 0a 00 00 00 fc 00 44
45 4c 4c 20 55 32 37 31 31 0a 20 20 00 00 00 fd
00 31 56 1d 71 1c 00 0a 20 20 20 20 20 20 00 f5

00 ff ff ff ff ff ff 00 10 ac 55 a0 4c 38 46 31
29 15 01 03 80 3c 22 78 ea 8e 05 ad 4f 33 b0 26
0d 50 54 a5 4b 00 81 00 b3 00 d1 00 71 4f a9 40
81 80 01 01 01 01 56 5e 00 a0 a0 a0 29 50 30 20
35 00 55 50 21 00 00 1a 00 00 00 ff 00 44 39 37
31 54 31 41 37 31 46 38 4c 0a 00 00 00 fc 00 44
45 4c 4c 20 55 32 37 31 31 0a 20 20 00 00 00 fd
00 31 56 1d 71 1c 00 0a 20 20 20 20 20 20 00 f5

----------------

Block 0, Base EDID:
  EDID Structure Version & Revision: 1.3
  Vendor & Product Identification:
    Manufacturer: DEL
    Model: 41045
    Serial Number: ...
    Made in: week 41 of 2011
  Basic Display Parameters & Features:
    Digital display
    Maximum image size: 60 cm x 34 cm
    Gamma: 2.20
    DPMS levels: Standby Suspend Off
    RGB color display
    First detailed timing is the preferred timing
  Color Characteristics:
    Red  : 0.6777, 0.3085
    Green: 0.2021, 0.6894
    Blue : 0.1484, 0.0507
    White: 0.3134, 0.3291
  Established Timings I & II:
    IBM     :   720x400    70.081663 Hz   9:5     31.467 kHz     28.320000 MHz
    DMT 0x04:   640x480    59.940476 Hz   4:3     31.469 kHz     25.175000 MHz
    DMT 0x06:   640x480    75.000000 Hz   4:3     37.500 kHz     31.500000 MHz
    DMT 0x09:   800x600    60.316541 Hz   4:3     37.879 kHz     40.000000 MHz
    DMT 0x0b:   800x600    75.000000 Hz   4:3     46.875 kHz     49.500000 MHz
    DMT 0x10:  1024x768    60.003840 Hz   4:3     48.363 kHz     65.000000 MHz
    DMT 0x12:  1024x768    75.028582 Hz   4:3     60.023 kHz     78.750000 MHz
    DMT 0x24:  1280x1024   75.024675 Hz   5:4     79.976 kHz    135.000000 MHz
  Standard Timings:
    DMT 0x1c:  1280x800    59.810326 Hz  16:10    49.702 kHz     83.500000 MHz
    DMT 0x3a:  1680x1050   59.954250 Hz  16:10    65.290 kHz    146.250000 MHz
    DMT 0x45:  1920x1200   59.884600 Hz  16:10    74.556 kHz    193.250000 MHz
    DMT 0x15:  1152x864    75.000000 Hz   4:3     67.500 kHz    108.000000 MHz
    DMT 0x33:  1600x1200   60.000000 Hz   4:3     75.000 kHz    162.000000 MHz
    DMT 0x23:  1280x1024   60.019740 Hz   5:4     63.981 kHz    108.000000 MHz
  Detailed Timing Descriptors:
    DTD 1:  2560x1440   59.950550 Hz  16:9     88.787 kHz    241.500000 MHz (597 mm x 336 mm)
                 Hfront   48 Hsync  32 Hback   80 Hpol P
                 Vfront    3 Vsync   5 Vback   33 Vpol N
    Display Product Serial Number: ...
    Display Product Name: 'DELL U2711'
    Display Range Limits:
      Monitor ranges (GTF): 49-86 Hz V, 29-113 kHz H, max dotclock 280 MHz
Checksum: 0xf5

----------------

Block 1, Unknown EDID Extension Block 0x00:
  00 ff ff ff ff ff ff 00 10 ac 55 a0 4c 38 46 31 '..........U.L8F1'
  29 15 01 03 80 3c 22 78 ea 8e 05 ad 4f 33 b0 26 ')....<"x....O3.&'
  0d 50 54 a5 4b 00 81 00 b3 00 d1 00 71 4f a9 40 '.PT.K.......qO.@'
  81 80 01 01 01 01 56 5e 00 a0 a0 a0 29 50 30 20 '......V^....)P0 '
  35 00 55 50 21 00 00 1a 00 00 00 ff 00 44 39 37 '5.UP!........D97'
  31 54 31 41 37 31 46 38 4c 0a 00 00 00 fc 00 44 '1T1A71F8L......D'
  45 4c 4c 20 55 32 37 31 31 0a 20 20 00 00 00 fd 'ELL U2711.  ....'
  00 31 56 1d 71 1c 00 0a 20 20 20 20 20 20 00 f5 '.1V.q...      ..'
Checksum: 0xf5

----------------

Failures:

Block 1, Base EDID:
  Unknown Extension Block.
EDID:
  Base EDID: EDID specified 0 extension block(s), but found 1 extension block(s).

EDID conformity: FAIL
