
EDID (hex):
00ffffffffffff0010ac55a04c394b30
2b150103803c2278ea8e05ad4f33b026
0d5054a54b008100b300d100714fa940
818001010101565e00a0a0a029503020
350055502100001a000000ff00473630
365431414b304b394c0a000000fc0044
454c4c2055323731310a2020000000fd
0031561d711c000a20202020202000d7

Extracted contents:
header:          00 ff ff ff ff ff ff 00
serial number:   10 ac 55 a0 4c 39 4b 30 2b 15
version:         01 03
basic params:    80 3c 22 78 ea
chroma info:     8e 05 ad 4f 33 b0 26 0d 50 54
established:     a5 4b 00
standard:        81 00 b3 00 d1 00 71 4f a9 40 81 80 01 01 01 01
descriptor 1:    56 5e 00 a0 a0 a0 29 50 30 20 35 00 55 50 21 00 00 1a
descriptor 2:    00 00 00 ff 00 47 36 30 36 54 31 41 4b 30 4b 39 4c 0a
descriptor 3:    00 00 00 fc 00 44 45 4c 4c 20 55 32 37 31 31 0a 20 20
descriptor 4:    00 00 00 fd 00 31 56 1d 71 1c 00 0a 20 20 20 20 20 20
extensions:      00
checksum:        d7

EDID version: 1.3
Manufacturer: DEL Model a055 Serial Number --
Made in week 43 of 2011
Digital display
Maximum image size: 60 cm x 34 cm
Gamma: 2.20
DPMS levels: Standby Suspend Off
RGB color display
First detailed timing is preferred timing
Display x,y Chromaticity:
  Red:   0.6777, 0.3085
  Green: 0.2021, 0.6894
  Blue:  0.1484, 0.0507
  White: 0.3134, 0.3291
Established timings supported:
  720x400@70Hz 9:5 HorFreq: 31469 Hz Clock: 28.320 MHz
  640x480@60Hz 4:3 HorFreq: 31469 Hz Clock: 25.175 MHz
  640x480@75Hz 4:3 HorFreq: 37500 Hz Clock: 31.500 MHz
  800x600@60Hz 4:3 HorFreq: 37900 Hz Clock: 40.000 MHz
  800x600@75Hz 4:3 HorFreq: 46900 Hz Clock: 49.500 MHz
  1024x768@60Hz 4:3 HorFreq: 48400 Hz Clock: 65.000 MHz
  1024x768@75Hz 4:3 HorFreq: 60000 Hz Clock: 78.750 MHz
  1280x1024@75Hz 5:4 HorFreq: 80000 Hz Clock: 135.000 MHz
Standard timings supported:
  1280x800@60Hz 16:10
  1680x1050@60Hz 16:10 HorFreq: 64700 Hz Clock: 119.000 MHz
  1920x1200@60Hz 16:10 HorFreq: 74000 Hz Clock: 154.000 MHz
  1152x864@75Hz 4:3 HorFreq: 67500 Hz Clock: 108.000 MHz
  1600x1200@60Hz 4:3 HorFreq: 75000 Hz Clock: 162.000 MHz
  1280x1024@60Hz 5:4 HorFreq: 64000 Hz Clock: 108.000 MHz
Detailed mode: Clock 241.500 MHz, 597 mm x 336 mm
               2560 2608 2640 2720 hborder 0
               1440 1443 1448 1481 vborder 0
               +hsync -vsync 
               VertFreq: 59 Hz, HorFreq: 88786 Hz
Serial number: --
Monitor name: DELL U2711
Monitor ranges (GTF): 49-86Hz V, 29-113kHz H, max dotclock 280MHz
Checksum: 0xd7 (valid)
