
EDID (hex):
00ffffffffffff003ad3150201000000
0720010380301a782a2d36a75438ae26
0d4f54afcf0081c0b30095008180a9c0
810071408140023a801871382d40582c
4500dc0c1100001e342150b051001b30
4070360099e61000001e000000fd0037
4b1e530f000a202020202020000000fc
00503231354648440a20202020200055

edid-decode (hex):

00 ff ff ff ff ff ff 00 3a d3 15 02 01 00 00 00
07 20 01 03 80 30 1a 78 2a 2d 36 a7 54 38 ae 26
0d 4f 54 af cf 00 81 c0 b3 00 95 00 81 80 a9 c0
81 00 71 40 81 40 02 3a 80 18 71 38 2d 40 58 2c
45 00 dc 0c 11 00 00 1e 34 21 50 b0 51 00 1b 30
40 70 36 00 99 e6 10 00 00 1e 00 00 00 fd 00 37
4b 1e 53 0f 00 0a 20 20 20 20 20 20 00 00 00 fc
00 50 32 31 35 46 48 44 0a 20 20 20 20 20 00 55

----------------

Block 0, Base EDID:
  EDID Structure Version & Revision: 1.3
  Vendor & Product Identification:
    Manufacturer: NVS
    Model: 533
    Serial Number: 1
    Made in: week 7 of 2022
  Basic Display Parameters & Features:
    Digital display
    Maximum image size: 48 cm x 26 cm
    Gamma: 2.20
    DPMS levels: Off
    RGB color display
    First detailed timing is the preferred timing
  Color Characteristics:
    Red  : 0.6523, 0.3300
    Green: 0.2216, 0.6806
    Blue : 0.1484, 0.0537
    White: 0.3095, 0.3300
  Established Timings I & II:
    IBM     :   720x400    70.081663 Hz   9:5     31.467 kHz     28.320000 MHz
    DMT 0x04:   640x480    59.940476 Hz   4:3     31.469 kHz     25.175000 MHz
    DMT 0x05:   640x480    72.808802 Hz   4:3     37.861 kHz     31.500000 MHz
    DMT 0x06:   640x480    75.000000 Hz   4:3     37.500 kHz     31.500000 MHz
    DMT 0x08:   800x600    56.250000 Hz   4:3     35.156 kHz     36.000000 MHz
    DMT 0x09:   800x600    60.316541 Hz   4:3     37.879 kHz     40.000000 MHz
    DMT 0x0a:   800x600    72.187572 Hz   4:3     48.077 kHz     50.000000 MHz
    DMT 0x0b:   800x600    75.000000 Hz   4:3     46.875 kHz     49.500000 MHz
    DMT 0x10:  1024x768    60.003840 Hz   4:3     48.363 kHz     65.000000 MHz
    DMT 0x11:  1024x768    70.069359 Hz   4:3     56.476 kHz     75.000000 MHz
    DMT 0x12:  1024x768    75.028582 Hz   4:3     60.023 kHz     78.750000 MHz
    DMT 0x24:  1280x1024   75.024675 Hz   5:4     79.976 kHz    135.000000 MHz
  Standard Timings:
    DMT 0x55:  1280x720    60.000000 Hz  16:9     45.000 kHz     74.250000 MHz
    DMT 0x3a:  1680x1050   59.954250 Hz  16:10    65.290 kHz    146.250000 MHz
    DMT 0x2f:  1440x900    59.887445 Hz  16:10    55.935 kHz    106.500000 MHz
    DMT 0x23:  1280x1024   60.019740 Hz   5:4     63.981 kHz    108.000000 MHz
    DMT 0x53:  1600x900    60.000000 Hz  16:9     60.000 kHz    108.000000 MHz (RB)
    DMT 0x1c:  1280x800    59.810326 Hz  16:10    49.702 kHz     83.500000 MHz
    GTF     :  1152x864    60.000000 Hz   4:3     53.700 kHz     81.624000 MHz
    DMT 0x20:  1280x960    60.000000 Hz   4:3     60.000 kHz    108.000000 MHz
  Detailed Timing Descriptors:
    DTD 1:  1920x1080   60.000000 Hz  16:9     67.500 kHz    148.500000 MHz (476 mm x 268 mm)
                 Hfront   88 Hsync  44 Hback  148 Hpol P
                 Vfront    4 Vsync   5 Vback   36 Vpol P
    DTD 2:  1360x768    59.664196 Hz  85:48    47.433 kHz     85.000000 MHz (409 mm x 230 mm)
                 Hfront   64 Hsync 112 Hback  256 Hpol P
                 Vfront    3 Vsync   6 Vback   18 Vpol P
    Display Range Limits:
      Monitor ranges (GTF): 55-75 Hz V, 30-83 kHz H, max dotclock 150 MHz
    Display Product Name: 'P215FHD'
Checksum: 0x55
