edid-decode (hex):

00 ff ff ff ff ff ff 00 05 e3 80 15 01 26 00 00
28 11 01 03 68 22 16 78 2a 9c 5d 99 58 4c 93 26
21 4c 54 23 08 00 81 c0 01 01 01 01 01 01 01 01
01 01 01 01 01 01 bc 1b 00 a0 50 20 17 30 30 20
36 00 58 de 10 00 00 1a 00 00 00 ff 00 33 32 36
37 39 44 41 30 30 39 37 32 39 00 00 00 fd 00 37
3c 1e 3f 08 00 0a 20 20 20 20 20 20 00 00 00 fc
00 35 31 31 56 77 0a 20 20 20 20 20 20 20 00 f2

----------------

Block 0, Base EDID:
  EDID Structure Version & Revision: 1.3
  Vendor & Product Identification:
    Manufacturer: AOC
    Model: 5504
    Serial Number: ...
    Made in: week 40 of 2007
  Basic Display Parameters & Features:
    Analog display
    Input voltage level: 0.7/0.7 V
    Blank level equals black level
    Sync: Separate
    Maximum image size: 34 cm x 22 cm
    Gamma: 2.20
    DPMS levels: Off
    RGB color display
    First detailed timing is the preferred timing
  Color Characteristics:
    Red  : 0.5996, 0.3447
    Green: 0.2998, 0.5742
    Blue : 0.1494, 0.1298
    White: 0.2998, 0.3291
  Established Timings I & II:
    DMT 0x04:   640x480    59.940476 Hz   4:3     31.469 kHz     25.175000 MHz
    DMT 0x08:   800x600    56.250000 Hz   4:3     35.156 kHz     36.000000 MHz
    DMT 0x09:   800x600    60.316541 Hz   4:3     37.879 kHz     40.000000 MHz
    DMT 0x10:  1024x768    60.003840 Hz   4:3     48.363 kHz     65.000000 MHz
  Standard Timings:
    DMT 0x55:  1280x720    60.000000 Hz  16:9     45.000 kHz     74.250000 MHz
  Detailed Timing Descriptors:
    DTD 1:  1280x800    59.909545 Hz   8:5     49.306 kHz     71.000000 MHz (344 mm x 222 mm)
                 Hfront   48 Hsync  32 Hback   80 Hpol P
                 Vfront    3 Vsync   6 Vback   14 Vpol N
    Display Product Serial Number: ...
    Display Range Limits:
      Monitor ranges (GTF): 55-60 Hz V, 30-63 kHz H, max dotclock 80 MHz
    Display Product Name: '511Vw'
Checksum: 0xf2

----------------

EDID conformity: PASS
