
EDID (hex):
00ffffffffffff001e6d1b77dd6f0900
071e0104b54627789f9495ab4f41ae26
135054256b807140818081c0a9c0b300
d1c08100d1cf28de0050a0a038500830
0804b9882100001ab8bc0050a0a05550
0838f80cb9882100001a000000fd0030
90e6e63c010a202020202020000000fc
004c4720484452205148440a202001c5
02031e71230906076d1a000002073090
00046a2f6a2fe305c000e3060501d976
00a0a0a0345030203500b9882100001a
565e00a0a0a0295030203500b9882100
001a0000000000000000000000000000
00000000000000000000000000000000
00000000000000000000000000000000
00000000000000000000000000000054

Extracted contents:
header:          00 ff ff ff ff ff ff 00
serial number:   1e 6d 1b 77 dd 6f 09 00 07 1e
version:         01 04
basic params:    b5 46 27 78 9f
chroma info:     94 95 ab 4f 41 ae 26 13 50 54
established:     25 6b 80
standard:        71 40 81 80 81 c0 a9 c0 b3 00 d1 c0 81 00 d1 cf
descriptor 1:    28 de 00 50 a0 a0 38 50 08 30 08 04 b9 88 21 00 00 1a
descriptor 2:    b8 bc 00 50 a0 a0 55 50 08 38 f8 0c b9 88 21 00 00 1a
descriptor 3:    00 00 00 fd 00 30 90 e6 e6 3c 01 0a 20 20 20 20 20 20
descriptor 4:    00 00 00 fc 00 4c 47 20 48 44 52 20 51 48 44 0a 20 20
extensions:      01
checksum:        c5

EDID version: 1.4
Manufacturer: GSM Model 771b Serial Number --
Made in week 7 of 2020
Digital display
10 bits per primary color channel
DisplayPort interface
Maximum image size: 70 cm x 39 cm
Gamma: 2.20
DPMS levels: Standby
Supported color formats: RGB 4:4:4, YCrCb 4:4:4, YCrCb 4:2:2
Default (sRGB) color space is primary color space
First detailed timing includes the native pixel format and preferred refresh rate
Display is continuous frequency
Display x,y Chromaticity:
  Red:   0.6699, 0.3095
  Green: 0.2548, 0.6796
  Blue:  0.1503, 0.0751
  White: 0.3134, 0.3291
Established timings supported:
  640x480@60Hz 4:3 HorFreq: 31469 Hz Clock: 25.175 MHz
  640x480@75Hz 4:3 HorFreq: 37500 Hz Clock: 31.500 MHz
  800x600@60Hz 4:3 HorFreq: 37900 Hz Clock: 40.000 MHz
  800x600@75Hz 4:3 HorFreq: 46900 Hz Clock: 49.500 MHz
  832x624@75Hz 4:3 HorFreq: 49726 Hz Clock: 57.284 MHz
  1024x768@60Hz 4:3 HorFreq: 48400 Hz Clock: 65.000 MHz
  1024x768@75Hz 4:3 HorFreq: 60000 Hz Clock: 78.750 MHz
  1280x1024@75Hz 5:4 HorFreq: 80000 Hz Clock: 135.000 MHz
  1152x870@75Hz 192:145 HorFreq: 67500 Hz Clock: 108.000 MHz
Standard timings supported:
  1152x864@60Hz 4:3
  1280x1024@60Hz 5:4 HorFreq: 64000 Hz Clock: 108.000 MHz
  1280x720@60Hz 16:9
  1600x900@60Hz 16:9
  1680x1050@60Hz 16:10 HorFreq: 64700 Hz Clock: 119.000 MHz
  1920x1080@60Hz 16:9
  1280x800@60Hz 16:10
  1920x1080@75Hz 16:9
Detailed mode: Clock 568.720 MHz, 697 mm x 392 mm
               2560 2568 2616 2640 hborder 0
               1440 1456 1464 1496 vborder 0
               +hsync -vsync 
               VertFreq: 144 Hz, HorFreq: 215424 Hz
Detailed mode: Clock 483.120 MHz, 697 mm x 392 mm
               2560 2568 2624 2640 hborder 0
               1440 1503 1511 1525 vborder 0
               +hsync -vsync 
               VertFreq: 120 Hz, HorFreq: 183000 Hz
Monitor ranges (bare limits): 48-144Hz V, 230-230kHz H, max dotclock 600MHz
Monitor name: LG HDR QHD
Has 1 extension blocks
Checksum: 0xc5 (valid)

CTA extension block
Extension version: 3
26 bytes of CTA data
  Audio data block
    Linear PCM, max channels 2
      Supported sample rates (kHz): 48 44.1
      Supported sample sizes (bits): 24 20 16
  Vendor-specific data block, OUI 00001a
  Extended tag: Colorimetry data block
    BT2020YCC
    BT2020RGB
  Extended tag: HDR static metadata data block
    Electro optical transfer functions:
      Traditional gamma - SDR luminance range
      SMPTE ST2084
    Supported static metadata descriptors:
      Static metadata type 1
Basic audio support
Supports YCbCr 4:4:4
Supports YCbCr 4:2:2
1 native detailed modes
Detailed mode: Clock 304.250 MHz, 697 mm x 392 mm
               2560 2608 2640 2720 hborder 0
               1440 1443 1448 1492 vborder 0
               +hsync -vsync 
               VertFreq: 74 Hz, HorFreq: 111856 Hz
Detailed mode: Clock 241.500 MHz, 697 mm x 392 mm
               2560 2608 2640 2720 hborder 0
               1440 1443 1448 1481 vborder 0
               +hsync -vsync 
               VertFreq: 59 Hz, HorFreq: 88786 Hz
Checksum: 0x54 (valid)

EDID block does NOT conform to EDID 1.4!
	sRGB is signaled, but the chromaticities do not match
Warning: One or more of the timings is out of range of the Monitor Ranges:
  Vertical Freq: 59 - 144 Hz
  Horizontal Freq: 31469 - 215424 Hz
  Maximum Clock: 568.720 MHz


