edid-decode (hex):

00 ff ff ff ff ff ff 00 1c 88 01 90 00 00 00 97
2f 15 01 03 68 3c 22 61 2a 4e 60 a5 55 44 99 24
12 49 4b 21 08 40 81 80 01 01 01 01 01 01 01 01
01 01 01 01 01 01 4c 1f 00 90 51 00 1b 30 40 86
13 00 5c 54 21 00 00 1a 00 00 00 fc 00 43 48 48
57 4a 54 0a 20 20 20 20 20 20 00 00 00 00 00 00
00 00 00 00 00 00 00 00 00 00 00 18 00 00 00 00
00 00 00 00 00 00 00 00 00 00 00 00 00 18 00 c1

----------------

Block 0, Base EDID:
  EDID Structure Version & Revision: 1.3
  Vendor & Product Identification:
    Manufacturer: GDH
    Model: 36865
    Serial Number: ...
    Made in: week 47 of 2011
  Basic Display Parameters & Features:
    Analog display
    Input voltage level: 0.7/0.7 V
    Sync: Separate
    Maximum image size: 60 cm x 34 cm
    Gamma: 1.97
    DPMS levels: Off
    RGB color display
    First detailed timing is preferred timing
  Color Characteristics:
    Red  : 0.6455, 0.3320
    Green: 0.2685, 0.5996
    Blue : 0.1416, 0.0722
    White: 0.2851, 0.2929
  Established Timings I & II:
    DMT 0x04:   640x480    59.940 Hz   4:3    31.469 kHz  25.175 MHz
    DMT 0x09:   800x600    60.317 Hz   4:3    37.879 kHz  40.000 MHz
    DMT 0x10:  1024x768    60.004 Hz   4:3    48.363 kHz  65.000 MHz
  Standard Timings:
    DMT 0x23:  1280x1024   60.020 Hz   5:4    63.981 kHz 108.000 MHz
  Detailed Timing Descriptors:
    DTD 1:  1280x768    59.988 Hz   5:3    47.690 kHz  80.120 MHz (604 mm x 340 mm)
                 Hfront   64 Hsync 134 Hback 202 Hpol P
                 Vfront    1 Vsync   3 Vback  23 Vpol N
    Display Product Name: 'CHHWJT'
    Manufacturer-Specified Display Descriptor (0x00): 00 00 00 00 00 00 00 00 00 00 00 00 00 00 00 18 '................'
    Manufacturer-Specified Display Descriptor (0x00): 00 00 00 00 00 00 00 00 00 00 00 00 00 00 00 18 '................'
Checksum: 0xc1
