
EDID (hex):
00ffffffffffff004c2d700f50385530
251c0104a55021783b46c5a5564f9b25
0f5054bfef80714f810081c081809500
a9c0b3000101539d70a0d0a034503020
3a001d4d3100001a000000fd003a4b70
7029010a202020202020000000fc0053
33344a3535780a2020202020000000ff
004854524b3930303138330a202001f9
020314f147901f041303125a23090707
83010000e77c70a0d0a0295030203a00
1d4d3100001a584d00b8a1381440f82c
45001d4d3100001e565e00a0a0a02950
302035001d4d3100001a023a80187138
2d40582c45001d4d3100001e00000000
00000000000000000000000000000000
000000000000000000000000000000c2

Extracted contents:
header:          00 ff ff ff ff ff ff 00
serial number:   4c 2d 70 0f 50 38 55 30 25 1c
version:         01 04
basic params:    a5 50 21 78 3b
chroma info:     46 c5 a5 56 4f 9b 25 0f 50 54
established:     bf ef 80
standard:        71 4f 81 00 81 c0 81 80 95 00 a9 c0 b3 00 01 01
descriptor 1:    53 9d 70 a0 d0 a0 34 50 30 20 3a 00 1d 4d 31 00 00 1a
descriptor 2:    00 00 00 fd 00 3a 4b 70 70 29 01 0a 20 20 20 20 20 20
descriptor 3:    00 00 00 fc 00 53 33 34 4a 35 35 78 0a 20 20 20 20 20
descriptor 4:    00 00 00 ff 00 48 54 52 4b 39 30 30 31 38 33 0a 20 20
extensions:      01
checksum:        f9

EDID version: 1.4
Manufacturer: SAM Model f70 Serial Number --
Made in week 37 of 2018
Digital display
8 bits per primary color channel
DisplayPort interface
Maximum image size: 80 cm x 33 cm
Gamma: 2.20
DPMS levels: Off
Supported color formats: RGB 4:4:4, YCrCb 4:4:4, YCrCb 4:2:2
First detailed timing includes the native pixel format and preferred refresh rate
Display is continuous frequency
Display x,y Chromaticity:
  Red:   0.6455, 0.3359
  Green: 0.3095, 0.6074
  Blue:  0.1474, 0.0585
  White: 0.3134, 0.3291
Established timings supported:
  720x400@70Hz 9:5 HorFreq: 31469 Hz Clock: 28.320 MHz
  640x480@60Hz 4:3 HorFreq: 31469 Hz Clock: 25.175 MHz
  640x480@67Hz 4:3 HorFreq: 35000 Hz Clock: 30.240 MHz
  640x480@72Hz 4:3 HorFreq: 37900 Hz Clock: 31.500 MHz
  640x480@75Hz 4:3 HorFreq: 37500 Hz Clock: 31.500 MHz
  800x600@56Hz 4:3 HorFreq: 35200 Hz Clock: 36.000 MHz
  800x600@60Hz 4:3 HorFreq: 37900 Hz Clock: 40.000 MHz
  800x600@72Hz 4:3 HorFreq: 48100 Hz Clock: 50.000 MHz
  800x600@75Hz 4:3 HorFreq: 46900 Hz Clock: 49.500 MHz
  832x624@75Hz 4:3 HorFreq: 49726 Hz Clock: 57.284 MHz
  1024x768@60Hz 4:3 HorFreq: 48400 Hz Clock: 65.000 MHz
  1024x768@70Hz 4:3 HorFreq: 56500 Hz Clock: 75.000 MHz
  1024x768@75Hz 4:3 HorFreq: 60000 Hz Clock: 78.750 MHz
  1280x1024@75Hz 5:4 HorFreq: 80000 Hz Clock: 135.000 MHz
  1152x870@75Hz 192:145 HorFreq: 67500 Hz Clock: 108.000 MHz
Standard timings supported:
  1152x864@75Hz 4:3 HorFreq: 67500 Hz Clock: 108.000 MHz
  1280x800@60Hz 16:10
  1280x720@60Hz 16:9
  1280x1024@60Hz 5:4 HorFreq: 64000 Hz Clock: 108.000 MHz
  1440x900@60Hz 16:10 HorFreq: 55500 Hz Clock: 88.750 MHz
  1600x900@60Hz 16:9
  1680x1050@60Hz 16:10 HorFreq: 64700 Hz Clock: 119.000 MHz
Detailed mode: Clock 402.750 MHz, 797 mm x 333 mm
               3440 3488 3520 3600 hborder 0
               1440 1443 1453 1492 vborder 0
               +hsync -vsync 
               VertFreq: 74 Hz, HorFreq: 111875 Hz
Monitor ranges (bare limits): 58-75Hz V, 112-112kHz H, max dotclock 410MHz
Monitor name: S34J55x
Serial number: --
Has 1 extension blocks
Checksum: 0xf9 (valid)

CTA extension block
Extension version: 3
16 bytes of CTA data
  Video data block
    VIC  16 1920x1080@60Hz 16:9 (native) HorFreq: 67500 Hz Clock: 148.500 MHz
    VIC  31 1920x1080@50Hz 16:9  HorFreq: 56250 Hz Clock: 148.500 MHz
    VIC   4 1280x720@60Hz 16:9  HorFreq: 45000 Hz Clock: 74.250 MHz
    VIC  19 1280x720@50Hz 16:9  HorFreq: 37500 Hz Clock: 74.250 MHz
    VIC   3 720x480@60Hz 16:9  HorFreq: 31469 Hz Clock: 27.000 MHz
    VIC  18 720x576@50Hz 16:9  HorFreq: 31250 Hz Clock: 27.000 MHz
    VIC  90 2560x1080@60Hz 64:27  HorFreq: 66000 Hz Clock: 198.000 MHz
  Audio data block
    Linear PCM, max channels 2
      Supported sample rates (kHz): 48 44.1 32
      Supported sample sizes (bits): 24 20 16
  Speaker allocation data block
    Speaker map:
      FL/FR - Front Left/Right
Underscans PC formats by default
Basic audio support
Supports YCbCr 4:4:4
Supports YCbCr 4:2:2
1 native detailed modes
Detailed mode: Clock 319.750 MHz, 797 mm x 333 mm
               3440 3488 3520 3600 hborder 0
               1440 1443 1453 1481 vborder 0
               +hsync -vsync 
               VertFreq: 59 Hz, HorFreq: 88819 Hz
Detailed mode: Clock 198.000 MHz, 797 mm x 333 mm
               2560 2808 2852 3000 hborder 0
               1080 1084 1089 1100 vborder 0
               +hsync +vsync 
               VertFreq: 60 Hz, HorFreq: 66000 Hz
Detailed mode: Clock 241.500 MHz, 797 mm x 333 mm
               2560 2608 2640 2720 hborder 0
               1440 1443 1448 1481 vborder 0
               +hsync -vsync 
               VertFreq: 59 Hz, HorFreq: 88786 Hz
Detailed mode: Clock 148.500 MHz, 797 mm x 333 mm
               1920 2008 2052 2200 hborder 0
               1080 1084 1089 1125 vborder 0
               +hsync +vsync 
               VertFreq: 60 Hz, HorFreq: 67500 Hz
Checksum: 0xc2 (valid)

Warning: One or more of the timings is out of range of the Monitor Ranges:
  Vertical Freq: 50 - 75 Hz
  Horizontal Freq: 31250 - 111875 Hz
  Maximum Clock: 402.750 MHz
EDID block does not conform at all!
	Both the serial number and the serial string are set
