edid-decode (hex):

00 ff ff ff ff ff ff 00 4c a3 49 42 00 00 00 00
00 15 01 03 80 1f 11 78 0a 85 75 94 5b 58 8f 2a
1e 50 54 00 00 00 01 01 01 01 01 01 01 01 01 01
01 01 01 01 01 01 9e 1b 56 78 50 00 18 30 30 20
25 00 35 ae 10 00 00 19 00 00 00 0f 00 00 00 00
00 00 00 00 00 25 d9 06 6a 00 00 00 00 fe 00 53
41 4d 53 55 4e 47 0a 20 20 20 20 20 00 00 00 fe
00 4c 54 4e 31 34 30 41 54 32 36 38 0a 20 00 b2

----------------

Block 0, Base EDID:
  EDID Structure Version & Revision: 1.3
  Vendor & Product Identification:
    Manufacturer: SEC
    Model: 16969
    Made in: 2011
  Basic Display Parameters & Features:
    Digital display
    Maximum image size: 31 cm x 17 cm
    Gamma: 2.20
    RGB color display
    First detailed timing is preferred timing
  Color Characteristics:
    Red  : 0.5800, 0.3554
    Green: 0.3447, 0.5595
    Blue : 0.1650, 0.1201
    White: 0.3134, 0.3291
  Established Timings I & II: none
  Standard Timings: none
  Detailed Timing Descriptors:
    DTD 1:  1366x768    60.072 Hz 683:384  47.577 kHz  70.700 MHz (309 mm x 174 mm)
                 Hfront   48 Hsync  32 Hback  40 Hpol N
                 Vfront    2 Vsync   5 Vback  17 Vpol N
    Manufacturer-Specified Display Descriptor (0x0f): 00 0f 00 00 00 00 00 00 00 00 00 25 d9 06 6a 00 '...........%..j.'
    Alphanumeric Data String: 'SAMSUNG'
    Alphanumeric Data String: 'LTN140AT268'
Checksum: 0xb2
