edid-decode (hex):

00 ff ff ff ff ff ff 00 2c 83 00 00 00 00 00 00
00 18 01 04 a5 1a 0e 78 0a 69 65 96 57 52 8f 27
22 50 54 00 00 00 01 01 01 01 01 01 01 01 01 01
01 01 01 01 01 01 86 1a 56 46 50 00 14 30 29 1b
34 00 00 90 10 00 00 18 00 00 00 fe 00 00 00 00
00 00 00 00 00 00 00 00 00 00 00 00 00 fe 00 4b
44 43 2a 20 20 20 20 20 20 20 20 20 00 00 00 fe
00 4b 44 00 00 00 00 00 00 00 00 00 00 00 00 ad

----------------

Block 0, Base EDID:
  EDID Structure Version & Revision: 1.4
  Vendor & Product Identification:
    Manufacturer: KDC
    Model: 0
    Made in: 2014
  Basic Display Parameters & Features:
    Digital display
    Bits per primary color channel: 8
    DisplayPort interface
    Maximum image size: 26 cm x 14 cm
    Gamma: 2.20
    Supported color formats: RGB 4:4:4, YCrCb 4:4:4
    First detailed timing includes the native pixel format and preferred refresh rate
  Color Characteristics:
    Red  : 0.5869, 0.3417
    Green: 0.3222, 0.5595
    Blue : 0.1533, 0.1347
    White: 0.3134, 0.3291
  Established Timings I & II: none
  Standard Timings: none
  Detailed Timing Descriptors:
    DTD 1:  1366x768    60.005 Hz 683:384  47.284 kHz  67.900 MHz (256 mm x 144 mm)
                 Hfront   41 Hsync  27 Hback   2 Hpol N
                 Vfront    3 Vsync   4 Vback  13 Vpol N
    Alphanumeric Data String: ''
    Alphanumeric Data String: 'KDC*         '
    Alphanumeric Data String: 'KD'
Checksum: 0xad
