edid-decode (hex):

00 ff ff ff ff ff ff 00 2c 83 00 00 00 00 00 00
14 19 01 04 a5 1a 10 78 0a 1f b5 a0 5d 50 9d 25
0f 50 54 00 00 00 01 01 01 01 01 01 01 01 01 01
01 01 01 01 01 01 6c 39 80 40 70 b0 23 40 10 10
f2 00 07 a4 10 00 00 1a 00 00 00 10 00 00 00 00
00 00 00 00 00 00 00 00 00 00 00 00 00 10 00 00
00 00 00 00 00 00 00 00 00 00 00 00 00 00 00 10
00 00 00 00 00 00 00 00 00 00 00 00 00 00 00 2f

----------------

Block 0, Base EDID:
  EDID Structure Version & Revision: 1.4
  Vendor & Product Identification:
    Manufacturer: KDC
    Model: 0
    Made in: week 20 of 2015
  Basic Display Parameters & Features:
    Digital display
    Bits per primary color channel: 8
    DisplayPort interface
    Maximum image size: 26 cm x 16 cm
    Gamma: 2.20
    Supported color formats: RGB 4:4:4, YCrCb 4:4:4
    First detailed timing includes the native pixel format and preferred refresh rate
  Color Characteristics:
    Red  : 0.6250, 0.3642
    Green: 0.3154, 0.6162
    Blue : 0.1464, 0.0615
    White: 0.3134, 0.3291
  Established Timings I & II: none
  Standard Timings: none
  Detailed Timing Descriptors:
    DTD 1:  1920x1200   59.994123 Hz  16:10    74.093 kHz    147.000000 MHz (263 mm x 164 mm)
                 Hfront   16 Hsync  16 Hback   32 Hpol P
                 Vfront   15 Vsync   2 Vback   18 Vpol N
    Dummy Descriptor:
    Dummy Descriptor:
    Dummy Descriptor:
Checksum: 0x2f

----------------

Warnings:

Block 0, Base EDID:
  Missing Display Product Name.

EDID conformity: PASS
