
EDID (hex):
00ffffffffffff002c83000000000000
2e1a010495160e780200000000000000
00000000000001010101010101010101
010101010101a33a807c70b018402519
2400d887000000180000000000000000
00000000000000000000000000000000
000000000000000000000000000000fe
004b443130314e36393330504131009c

edid-decode (hex):

00 ff ff ff ff ff ff 00 2c 83 00 00 00 00 00 00
2e 1a 01 04 95 16 0e 78 02 00 00 00 00 00 00 00
00 00 00 00 00 00 01 01 01 01 01 01 01 01 01 01
01 01 01 01 01 01 a3 3a 80 7c 70 b0 18 40 25 19
24 00 d8 87 00 00 00 18 00 00 00 00 00 00 00 00
00 00 00 00 00 00 00 00 00 00 00 00 00 00 00 00
00 00 00 00 00 00 00 00 00 00 00 00 00 00 00 fe
00 4b 44 31 30 31 4e 36 39 33 30 50 41 31 00 9c

----------------

Block 0, Base EDID:
  EDID Structure Version & Revision: 1.4
  Vendor & Product Identification:
    Manufacturer: KDC
    Model: 0
    Made in: week 46 of 2016
  Basic Display Parameters & Features:
    Digital display
    Bits per primary color channel: 6
    DisplayPort interface
    Maximum image size: 22 cm x 14 cm
    Gamma: 2.20
    Supported color formats: RGB 4:4:4
    First detailed timing includes the native pixel format and preferred refresh rate
  Color Characteristics:
    Red  : 0.0000, 0.0000
    Green: 0.0000, 0.0000
    Blue : 0.0000, 0.0000
    White: 0.0000, 0.0000
  Established Timings I & II: none
  Standard Timings: none
  Detailed Timing Descriptors:
    DTD 1:  1920x1200   59.999456 Hz  16:10    73.439 kHz    150.110000 MHz (216 mm x 135 mm)
                 Hfront   37 Hsync  25 Hback   62 Hpol N
                 Vfront    2 Vsync   4 Vback   18 Vpol N
    Empty Descriptor
    Empty Descriptor
    Alphanumeric Data String: 'KD101N6930PA1'
Checksum: 0x9c
