
EDID (hex):
00ffffffffffff004c2d64053931594d
2c130103802917782aac21a555489a27
135054bfee0001010101010101010101
010101010101662150b051001b304070
36009ae61000001e000000fd00384b1e
3d09000a202020202020000000fc0053
796e634d61737465720a2020000000ff
00484c4a534132313035300a202001c3
02031b61439084022309070783010000
67030c0020008028e2000f8c0ad08a20
e02d10103e9600a05a00000000000000
00000000000000000000000000000000
00000000000000000000000000000000
00000000000000000000000000000000
00000000000000000000000000000000
0000000000000000000000000000002e

Extracted contents:
header:          00 ff ff ff ff ff ff 00
serial number:   4c 2d 64 05 39 31 59 4d 2c 13
version:         01 03
basic params:    80 29 17 78 2a
chroma info:     ac 21 a5 55 48 9a 27 13 50 54
established:     bf ee 00
standard:        01 01 01 01 01 01 01 01 01 01 01 01 01 01 01 01
descriptor 1:    66 21 50 b0 51 00 1b 30 40 70 36 00 9a e6 10 00 00 1e
descriptor 2:    00 00 00 fd 00 38 4b 1e 3d 09 00 0a 20 20 20 20 20 20
descriptor 3:    00 00 00 fc 00 53 79 6e 63 4d 61 73 74 65 72 0a 20 20
descriptor 4:    00 00 00 ff 00 48 4c 4a 53 41 32 31 30 35 30 0a 20 20
extensions:      01
checksum:        c3

EDID version: 1.3
Manufacturer: SAM Model 564 Serial Number --
Made in week 44 of 2009
Digital display
Maximum image size: 41 cm x 23 cm
Gamma: 2.20
DPMS levels: Off
RGB color display
First detailed timing is preferred timing
Display x,y Chromaticity:
  Red:   0.6464, 0.3339
  Green: 0.2841, 0.6015
  Blue:  0.1523, 0.0761
  White: 0.3125, 0.3291
Established timings supported:
  720x400@70Hz 9:5 HorFreq: 31469 Hz Clock: 28.320 MHz
  640x480@60Hz 4:3 HorFreq: 31469 Hz Clock: 25.175 MHz
  640x480@67Hz 4:3 HorFreq: 35000 Hz Clock: 30.240 MHz
  640x480@72Hz 4:3 HorFreq: 37900 Hz Clock: 31.500 MHz
  640x480@75Hz 4:3 HorFreq: 37500 Hz Clock: 31.500 MHz
  800x600@56Hz 4:3 HorFreq: 35200 Hz Clock: 36.000 MHz
  800x600@60Hz 4:3 HorFreq: 37900 Hz Clock: 40.000 MHz
  800x600@72Hz 4:3 HorFreq: 48100 Hz Clock: 50.000 MHz
  800x600@75Hz 4:3 HorFreq: 46900 Hz Clock: 49.500 MHz
  832x624@75Hz 4:3 HorFreq: 49726 Hz Clock: 57.284 MHz
  1024x768@60Hz 4:3 HorFreq: 48400 Hz Clock: 65.000 MHz
  1024x768@70Hz 4:3 HorFreq: 56500 Hz Clock: 75.000 MHz
  1024x768@75Hz 4:3 HorFreq: 60000 Hz Clock: 78.750 MHz
Standard timings supported:
Detailed mode: Clock 85.500 MHz, 410 mm x 230 mm
               1360 1424 1536 1792 hborder 0
                768  771  777  795 vborder 0
               +hsync +vsync 
               VertFreq: 60 Hz, HorFreq: 47712 Hz
Monitor ranges (GTF): 56-75Hz V, 30-61kHz H, max dotclock 90MHz
Monitor name: SyncMaster
Serial number: --
Has 1 extension blocks
Checksum: 0xc3 (valid)

CTA extension block
Extension version: 3
23 bytes of CTA data
  Video data block
    VIC  16 1920x1080@60Hz 16:9 (native) HorFreq: 67500 Hz Clock: 148.500 MHz
    VIC   4 1280x720@60Hz 16:9 (native) HorFreq: 45000 Hz Clock: 74.250 MHz
    VIC   2 720x480@60Hz 4:3  HorFreq: 31469 Hz Clock: 27.000 MHz
  Audio data block
    Linear PCM, max channels 2
      Supported sample rates (kHz): 48 44.1 32
      Supported sample sizes (bits): 24 20 16
  Speaker allocation data block
    Speaker map:
      FL/FR - Front Left/Right
  Vendor-specific data block, OUI 000c03 (HDMI)
    Source physical address 2.0.0.0
    Supports_AI
    Maximum TMDS clock: 200MHz
  Extended tag: Video capability data block
    YCbCr quantization: No Data (0)
    RGB quantization: No Data (0)
    PT scan behaviour: No Data (0)
    IT scan behaviour: Support both over- and underscan (3)
    CE scan behaviour: Support both over- and underscan (3)
Basic audio support
Supports YCbCr 4:4:4
1 native detailed modes
Detailed mode: Clock 27.000 MHz, 160 mm x 90 mm
                720  736  798  858 hborder 0
                480  489  495  525 vborder 0
               -hsync -vsync analog composite 
               VertFreq: 59 Hz, HorFreq: 31468 Hz
Checksum: 0x2e (valid)

One or more of the timings is out of range of the Monitor Ranges:
  Vertical Freq: 56 - 75 Hz
  Horizontal Freq: 31468 - 67500 Hz
  Maximum Clock: 148.500 MHz
EDID block does not conform at all!
	Both the serial number and the serial string are set
