edid-decode (hex):

00 ff ff ff ff ff ff 00 09 e5 03 09 00 00 00 00
31 1d 01 04 a5 22 13 78 02 bd d5 92 5b 59 94 2a
20 50 54 00 00 00 01 01 01 01 01 01 01 01 01 01
01 01 01 01 01 01 04 3a 80 36 71 38 1e 40 30 20
36 00 58 c2 10 00 00 1a 00 00 00 00 00 00 00 00
00 00 00 00 00 00 00 00 00 00 00 00 00 fe 00 42
4f 45 20 43 51 0a 20 20 20 20 20 20 00 00 00 fe
00 4e 54 31 35 36 46 48 4d 2d 4e 36 32 0a 00 e0

----------------

Block 0, Base EDID:
  EDID Structure Version & Revision: 1.4
  Vendor & Product Identification:
    Manufacturer: BOE
    Model: 2307
    Made in: week 49 of 2019
  Basic Display Parameters & Features:
    Digital display
    Bits per primary color channel: 8
    DisplayPort interface
    Maximum image size: 34 cm x 19 cm
    Gamma: 2.20
    Supported color formats: RGB 4:4:4
    First detailed timing includes the native pixel format and preferred refresh rate
  Color Characteristics:
    Red  : 0.5722, 0.3583
    Green: 0.3505, 0.5791
    Blue : 0.1669, 0.1259
    White: 0.3134, 0.3291
  Established Timings I & II: none
  Standard Timings: none
  Detailed Timing Descriptors:
    DTD 1:  1920x1080   60.000808 Hz  16:9     66.601 kHz    148.520000 MHz (344 mm x 194 mm)
                 Hfront   48 Hsync  32 Hback  230 Hpol P
                 Vfront    3 Vsync   6 Vback   21 Vpol N
    Empty Descriptor
    Alphanumeric Data String: 'BOE CQ'
    Alphanumeric Data String: 'NT156FHM-N62'
Checksum: 0xe0

----------------

Failures:

Block 0, Base EDID:
  Empty Descriptor: Use Dummy Descriptor instead of all zeroes.
  Missing Display Product Name.

EDID conformity: FAIL
