
EDID (hex):
00ffffffffffff001e6d51753f7a0100
081001036e462778eafc31a357479b25
10494ba56b80a9408180714061594559
3159010101011b2150a051001e304888
3500bc882100001c000000fd0038551e
5311000a202020202020000000fc004d
33373031430a202020202020000000fc
000a20202020202020202020202000f1

Extracted contents:
header:          00 ff ff ff ff ff ff 00
serial number:   1e 6d 51 75 3f 7a 01 00 08 10
version:         01 03
basic params:    6e 46 27 78 ea
chroma info:     fc 31 a3 57 47 9b 25 10 49 4b
established:     a5 6b 80
standard:        a9 40 81 80 71 40 61 59 45 59 31 59 01 01 01 01
descriptor 1:    1b 21 50 a0 51 00 1e 30 48 88 35 00 bc 88 21 00 00 1c
descriptor 2:    00 00 00 fd 00 38 55 1e 53 11 00 0a 20 20 20 20 20 20
descriptor 3:    00 00 00 fc 00 4d 33 37 30 31 43 0a 20 20 20 20 20 20
descriptor 4:    00 00 00 fc 00 0a 20 20 20 20 20 20 20 20 20 20 20 20
extensions:      00
checksum:        f1

EDID version: 1.3
Manufacturer: GSM Model 7551 Serial Number --
Made in week 8 of 2006
Analog display, Input voltage level: 0.7/0.7 V
Sync: Separate Composite SyncOnGreen 
Maximum image size: 70 cm x 39 cm
Gamma: 2.20
DPMS levels: Standby Suspend Off
RGB color display
First detailed timing is preferred timing
Display x,y Chromaticity:
  Red:   0.6396, 0.3427
  Green: 0.2802, 0.6054
  Blue:  0.1445, 0.0654
  White: 0.2851, 0.2939
Established timings supported:
  720x400@70Hz 9:5 HorFreq: 31469 Hz Clock: 28.320 MHz
  640x480@60Hz 4:3 HorFreq: 31469 Hz Clock: 25.175 MHz
  640x480@75Hz 4:3 HorFreq: 37500 Hz Clock: 31.500 MHz
  800x600@60Hz 4:3 HorFreq: 37900 Hz Clock: 40.000 MHz
  800x600@75Hz 4:3 HorFreq: 46900 Hz Clock: 49.500 MHz
  832x624@75Hz 4:3 HorFreq: 49726 Hz Clock: 57.284 MHz
  1024x768@60Hz 4:3 HorFreq: 48400 Hz Clock: 65.000 MHz
  1024x768@75Hz 4:3 HorFreq: 60000 Hz Clock: 78.750 MHz
  1280x1024@75Hz 5:4 HorFreq: 80000 Hz Clock: 135.000 MHz
  1152x870@75Hz 192:145 HorFreq: 67500 Hz Clock: 108.000 MHz
Standard timings supported:
  1600x1200@60Hz 4:3 HorFreq: 75000 Hz Clock: 162.000 MHz
  1280x1024@60Hz 5:4 HorFreq: 64000 Hz Clock: 108.000 MHz
  1152x864@60Hz 4:3
  1024x768@85Hz 4:3 HorFreq: 68700 Hz Clock: 94.500 MHz
  800x600@85Hz 4:3 HorFreq: 53700 Hz Clock: 56.250 MHz
  640x480@85Hz 4:3 HorFreq: 43300 Hz Clock: 36.000 MHz
Detailed mode: Clock 84.750 MHz, 700 mm x 392 mm
               1360 1432 1568 1776 hborder 0
                768  771  776  798 vborder 0
               -hsync +vsync 
               VertFreq: 59 Hz, HorFreq: 47719 Hz
Monitor ranges (GTF): 56-85Hz V, 30-83kHz H, max dotclock 170MHz
Monitor name: M3701C
Checksum: 0xf1 (valid)
