edid-decode (hex):

00 ff ff ff ff ff ff 00 22 f0 18 42 01 01 00 00
1e 13 01 03 80 2c 19 78 0a b8 15 a6 55 4b 9b 25
13 50 54 00 00 00 01 01 01 01 01 01 01 01 01 01
01 01 01 01 01 01 30 2a 40 c8 60 84 64 30 b4 50
a3 00 b8 fa 10 00 00 18 9a 29 a0 c8 50 84 64 30
b4 50 a3 00 b8 fa 10 00 00 7e 66 21 50 c8 50 00
64 30 b4 3c a3 00 b8 fa 10 00 00 1e 00 00 00 fc
00 48 50 20 4f 6d 6e 69 20 2f 20 50 72 6f 00 d0

----------------

Block 0, Base EDID:
  EDID Structure Version & Revision: 1.3
  Vendor & Product Identification:
    Manufacturer: HWP
    Model: 16920
    Serial Number: ...
    Made in: week 30 of 2009
  Basic Display Parameters & Features:
    Digital display
    Maximum image size: 44 cm x 25 cm
    Gamma: 2.20
    RGB color display
    First detailed timing is preferred timing
  Color Characteristics:
    Red  : 0.6503, 0.3349
    Green: 0.2949, 0.6054
    Blue : 0.1445, 0.0751
    White: 0.3134, 0.3291
  Established Timings I & II: none
  Standard Timings: none
  Detailed Timing Descriptors:
    DTD 1:  1600x900    60.000 Hz  16:9    60.000 kHz 108.000 MHz (440 mm x 250 mm)
                 Hfront  180 Hsync  80 Hback -60 Hpol N
                 Vfront   10 Vsync   3 Vback  87 Vpol N
    DTD 2:  1440x900    64.939 Hz   8:5    64.939 kHz 106.500 MHz (four way interleaved, 440 mm x 250 mm)
                 Hfront  180 Hsync  80 Hback -60 Hpol P
                 Vfront   10 Vsync   3 Vback  87 Vpol P
    DTD 3:  1360x768    63.143 Hz  85:48   54.808 kHz  85.500 MHz (440 mm x 250 mm)
                 Hfront  180 Hsync  60 Hback -40 Hpol P
                 Vfront   10 Vsync   3 Vback  87 Vpol P
    Display Product Name: 'HP Omni / Pro'
Checksum: 0xd0
