edid-decode (hex):

00 ff ff ff ff ff ff 00 0e 14 9c 13 00 00 00 00
0b 10 01 03 80 21 15 78 0a 80 6d 99 57 4f 8f 26
21 50 54 00 00 00 01 01 01 01 01 01 01 01 01 01
01 01 01 01 01 01 bc 1b 00 b0 50 20 14 30 20 20
13 00 4b cf 10 00 00 19 00 00 00 0f 00 20 20 20
20 20 20 20 20 a0 ff 02 32 00 00 00 00 fe 00 43
50 54 0a 20 20 20 20 20 20 20 20 20 00 00 00 fe
00 43 4c 41 41 31 35 34 57 41 30 33 0a 20 00 98

----------------

Block 0, Base EDID:
  EDID Structure Version & Revision: 1.3
  Vendor & Product Identification:
    Manufacturer: CPT
    Model: 5020
    Made in: week 11 of 2006
  Basic Display Parameters & Features:
    Digital display
    Maximum image size: 33 cm x 21 cm
    Gamma: 2.20
    RGB color display
    First detailed timing is the preferred timing
  Color Characteristics:
    Red  : 0.5996, 0.3398
    Green: 0.3085, 0.5585
    Blue : 0.1494, 0.1308
    White: 0.3154, 0.3291
  Established Timings I & II: none
  Standard Timings: none
  Detailed Timing Descriptors:
    DTD 1:  1280x800    59.467971 Hz   8:5     48.764 kHz     71.000000 MHz (331 mm x 207 mm)
                 Hfront   32 Hsync  32 Hback  112 Hpol N
                 Vfront    1 Vsync   3 Vback   16 Vpol N
    Manufacturer-Specified Display Descriptor (0x0f): 00 0f 00 20 20 20 20 20 20 20 20 a0 ff 02 32 00 '...        ...2.'
    Alphanumeric Data String: 'CPT'
    Alphanumeric Data String: 'CLAA154WA03'
Checksum: 0x98

----------------

Failures:

Block 0, Base EDID:
  Missing Display Product Name.
  Missing Display Range Limits Descriptor.

EDID conformity: FAIL
