edid-decode (hex):

00 ff ff ff ff ff ff 00 06 10 bc 9c 01 01 01 01
1a 13 01 04 a0 30 1b 78 26 6f b1 a7 55 4c 9e 25
0c 50 54 00 00 10 01 01 01 01 01 01 01 01 01 01
01 01 01 01 01 01 1a 36 80 a0 70 38 1f 40 30 20
35 00 db 0b 11 00 00 1a 00 00 00 01 00 06 10 30
11 00 00 00 00 00 00 00 0a 20 00 00 00 fe 00 4c
4d 32 31 35 57 46 33 2d 53 4c 41 31 00 00 00 fc
00 43 6f 6c 6f 72 20 4c 43 44 0a 20 20 20 00 ba

----------------

Block 0, Base EDID:
  EDID Structure Version & Revision: 1.4
  Vendor & Product Identification:
    Manufacturer: APP
    Model: 40124
    Serial Number: ...
    Made in: week 26 of 2009
  Basic Display Parameters & Features:
    Digital display
    Bits per primary color channel: 8
    Digital interface is not defined
    Maximum image size: 48 cm x 27 cm
    Gamma: 2.20
    DPMS levels: Off
    Supported color formats: RGB 4:4:4
    Default (sRGB) color space is primary color space
    First detailed timing includes the native pixel format and preferred refresh rate
  Color Characteristics:
    Red  : 0.6533, 0.3339
    Green: 0.2998, 0.6201
    Blue : 0.1464, 0.0498
    White: 0.3125, 0.3291
  Established Timings I & II:
  Standard Timings: none
  Detailed Timing Descriptors:
    DTD 1:  1920x1080   59.934 Hz  16:9    66.587 kHz 138.500 MHz (475 mm x 267 mm)
                 Hfront   48 Hsync  32 Hback  80 Hpol P
                 Vfront    3 Vsync   5 Vback  23 Vpol N
    Manufacturer-Specified Display Descriptor (0x01): 00 01 00 06 10 30 11 00 00 00 00 00 00 00 0a 20 '.....0......... '
    Alphanumeric Data String: 'LM215WF3-SLA1'
    Display Product Name: 'Color LCD'
Checksum: 0xba

----------------

Failures:

Block 0, Base EDID:
  Basic Display Parameters & Features: sRGB is signaled, but the chromaticities do not match.

EDID conformity: FAIL
