
EDID (hex):
00ffffffffffff0026cd64614d090000
121f0104b5361e783b4620a25a50a223
0a5054a56b80710081408180a940b300
9500950fd1c0023a801871382d40582c
45001f2e2100001e000000ff00313138
33313131383032333831000000fd0028
a5b8b828010a202020202020000000fc
00504c3235373048530a20202020012b
020339f1509005040302011112131406
0715161f3f2309070783010000e305c3
01e60605015f5f286d1a0000020128a5
000000000000e200ea5a8780a070384d
40302035001f2e2100001ad09480a070
381e40082035001f2e2100001a866f80
a070384040302035001f2e2100001a00
000000000000000000000000000000a1

edid-decode (hex):

00 ff ff ff ff ff ff 00 26 cd 64 61 4d 09 00 00
12 1f 01 04 b5 36 1e 78 3b 46 20 a2 5a 50 a2 23
0a 50 54 a5 6b 80 71 00 81 40 81 80 a9 40 b3 00
95 00 95 0f d1 c0 02 3a 80 18 71 38 2d 40 58 2c
45 00 1f 2e 21 00 00 1e 00 00 00 ff 00 31 31 38
33 31 31 31 38 30 32 33 38 31 00 00 00 fd 00 28
a5 b8 b8 28 01 0a 20 20 20 20 20 20 00 00 00 fc
00 50 4c 32 35 37 30 48 53 0a 20 20 20 20 01 2b

02 03 39 f1 50 90 05 04 03 02 01 11 12 13 14 06
07 15 16 1f 3f 23 09 07 07 83 01 00 00 e3 05 c3
01 e6 06 05 01 5f 5f 28 6d 1a 00 00 02 01 28 a5
00 00 00 00 00 00 e2 00 ea 5a 87 80 a0 70 38 4d
40 30 20 35 00 1f 2e 21 00 00 1a d0 94 80 a0 70
38 1e 40 08 20 35 00 1f 2e 21 00 00 1a 86 6f 80
a0 70 38 40 40 30 20 35 00 1f 2e 21 00 00 1a 00
00 00 00 00 00 00 00 00 00 00 00 00 00 00 00 a1

----------------

Block 0, Base EDID:
  EDID Structure Version & Revision: 1.4
  Vendor & Product Identification:
    Manufacturer: IVM
    Model: 24932
    Serial Number: 2381
    Made in: week 18 of 2021
  Basic Display Parameters & Features:
    Digital display
    Bits per primary color channel: 10
    DisplayPort interface
    Maximum image size: 54 cm x 30 cm
    Gamma: 2.20
    DPMS levels: Off
    Supported color formats: RGB 4:4:4, YCrCb 4:4:4, YCrCb 4:2:2
    First detailed timing includes the native pixel format and preferred refresh rate
    Display is continuous frequency
  Color Characteristics:
    Red  : 0.6337, 0.3515
    Green: 0.3134, 0.6347
    Blue : 0.1367, 0.0410
    White: 0.3125, 0.3281
  Established Timings I & II:
    IBM     :   720x400    70.081663 Hz   9:5     31.467 kHz     28.320000 MHz
    DMT 0x04:   640x480    59.940476 Hz   4:3     31.469 kHz     25.175000 MHz
    DMT 0x06:   640x480    75.000000 Hz   4:3     37.500 kHz     31.500000 MHz
    DMT 0x09:   800x600    60.316541 Hz   4:3     37.879 kHz     40.000000 MHz
    DMT 0x0b:   800x600    75.000000 Hz   4:3     46.875 kHz     49.500000 MHz
    Apple   :   832x624    74.551266 Hz   4:3     49.726 kHz     57.284000 MHz
    DMT 0x10:  1024x768    60.003840 Hz   4:3     48.363 kHz     65.000000 MHz
    DMT 0x12:  1024x768    75.028582 Hz   4:3     60.023 kHz     78.750000 MHz
    DMT 0x24:  1280x1024   75.024675 Hz   5:4     79.976 kHz    135.000000 MHz
    Apple   :  1152x870    75.061550 Hz 192:145   68.681 kHz    100.000000 MHz
  Standard Timings:
    GTF     :  1152x720    59.999964 Hz  16:10    44.760 kHz     67.319000 MHz
    DMT 0x20:  1280x960    60.000000 Hz   4:3     60.000 kHz    108.000000 MHz
    DMT 0x23:  1280x1024   60.019740 Hz   5:4     63.981 kHz    108.000000 MHz
    DMT 0x33:  1600x1200   60.000000 Hz   4:3     75.000 kHz    162.000000 MHz
    DMT 0x3a:  1680x1050   59.954250 Hz  16:10    65.290 kHz    146.250000 MHz
    DMT 0x2f:  1440x900    59.887445 Hz  16:10    55.935 kHz    106.500000 MHz
    DMT 0x30:  1440x900    74.984427 Hz  16:10    70.635 kHz    136.750000 MHz
    DMT 0x52:  1920x1080   60.000000 Hz  16:9     67.500 kHz    148.500000 MHz
  Detailed Timing Descriptors:
    DTD 1:  1920x1080   60.000000 Hz  16:9     67.500 kHz    148.500000 MHz (543 mm x 302 mm)
                 Hfront   88 Hsync  44 Hback  148 Hpol P
                 Vfront    4 Vsync   5 Vback   36 Vpol P
    Display Product Serial Number: '1183111802381'
    Display Range Limits:
      Monitor ranges (Bare Limits): 40-165 Hz V, 184-184 kHz H, max dotclock 400 MHz
    Display Product Name: 'PL2570HS'
  Extension blocks: 1
Checksum: 0x2b

----------------

Block 1, CTA-861 Extension Block:
  Revision: 3
  Underscans IT Video Formats by default
  Basic audio support
  Supports YCbCr 4:4:4
  Supports YCbCr 4:2:2
  Native detailed modes: 1
  Video Data Block:
    VIC  16:  1920x1080   60.000000 Hz  16:9     67.500 kHz    148.500000 MHz (native)
    VIC   5:  1920x1080i  60.000000 Hz  16:9     33.750 kHz     74.250000 MHz
    VIC   4:  1280x720    60.000000 Hz  16:9     45.000 kHz     74.250000 MHz
    VIC   3:   720x480    59.940060 Hz  16:9     31.469 kHz     27.000000 MHz
    VIC   2:   720x480    59.940060 Hz   4:3     31.469 kHz     27.000000 MHz
    VIC   1:   640x480    59.940476 Hz   4:3     31.469 kHz     25.175000 MHz
    VIC  17:   720x576    50.000000 Hz   4:3     31.250 kHz     27.000000 MHz
    VIC  18:   720x576    50.000000 Hz  16:9     31.250 kHz     27.000000 MHz
    VIC  19:  1280x720    50.000000 Hz  16:9     37.500 kHz     74.250000 MHz
    VIC  20:  1920x1080i  50.000000 Hz  16:9     28.125 kHz     74.250000 MHz
    VIC   6:  1440x480i   59.940060 Hz   4:3     15.734 kHz     27.000000 MHz
    VIC   7:  1440x480i   59.940060 Hz  16:9     15.734 kHz     27.000000 MHz
    VIC  21:  1440x576i   50.000000 Hz   4:3     15.625 kHz     27.000000 MHz
    VIC  22:  1440x576i   50.000000 Hz  16:9     15.625 kHz     27.000000 MHz
    VIC  31:  1920x1080   50.000000 Hz  16:9     56.250 kHz    148.500000 MHz
    VIC  63:  1920x1080  120.000000 Hz  16:9    135.000 kHz    297.000000 MHz
  Audio Data Block:
    Linear PCM:
      Max channels: 2
      Supported sample rates (kHz): 48 44.1 32
      Supported sample sizes (bits): 24 20 16
  Speaker Allocation Data Block:
    FL/FR - Front Left/Right
  Colorimetry Data Block:
    xvYCC601
    xvYCC709
    BT2020YCC
    BT2020RGB
    Gamut Boundary Description Metadata Profile P0
  HDR Static Metadata Data Block:
    Electro optical transfer functions:
      Traditional gamma - SDR luminance range
      SMPTE ST2084
    Supported static metadata descriptors:
      Static metadata type 1
    Desired content max luminance: 95 (391.429 cd/m^2)
    Desired content max frame-average luminance: 95 (391.429 cd/m^2)
    Desired content min luminance: 40 (0.096 cd/m^2)
  Vendor-Specific Data Block (AMD), OUI 00-00-1A:
    Version: 2.1
    Minimum Refresh Rate: 40 Hz
    Maximum Refresh Rate: 165 Hz
    Flags 1.x: 0x00
    Flags 2.x: 0x00
    Maximum luminance: 0 (50.000 cd/m^2)
    Minimum luminance: 0 (0.000 cd/m^2)
    Unknown: 0x00 0x00
  Video Capability Data Block:
    YCbCr quantization: Selectable (via AVI YQ)
    RGB quantization: Selectable (via AVI Q)
    PT scan behavior: Always Underscanned
    IT scan behavior: Always Underscanned
    CE scan behavior: Always Underscanned
  Detailed Timing Descriptors:
    DTD 2:  1920x1080  143.981451 Hz  16:9    166.587 kHz    346.500000 MHz (543 mm x 302 mm)
                 Hfront   48 Hsync  32 Hback   80 Hpol P
                 Vfront    3 Vsync   5 Vback   69 Vpol N
    DTD 3:  1920x1080  165.003465 Hz  16:9    183.154 kHz    380.960000 MHz (543 mm x 302 mm)
                 Hfront    8 Hsync  32 Hback  120 Hpol P
                 Vfront    3 Vsync   5 Vback   22 Vpol N
    DTD 4:  1920x1080  119.982181 Hz  16:9    137.260 kHz    285.500000 MHz (543 mm x 302 mm)
                 Hfront   48 Hsync  32 Hback   80 Hpol P
                 Vfront    3 Vsync   5 Vback   56 Vpol N
Checksum: 0xa1  Unused space in Extension Block: 16 bytes


