edid-decode (hex):

00 ff ff ff ff ff ff 00 06 af 9e 14 00 00 00 00
00 15 01 04 90 26 15 78 02 c4 95 9e 57 53 92 26
0f 50 54 00 00 00 01 01 01 01 01 01 01 01 01 01
01 01 01 01 01 01 10 27 40 c6 60 84 1a 30 30 20
36 00 7e d6 10 00 00 1a 10 27 40 c6 60 84 1a 30
30 20 36 00 7e d6 10 00 00 1a 00 00 00 fe 00 4e
52 46 58 33 80 42 31 37 33 52 57 31 00 00 00 00
00 00 41 01 96 00 01 00 00 02 01 0a 20 20 00 7a

----------------

Block 0, Base EDID:
  EDID Structure Version & Revision: 1.4
  Vendor & Product Identification:
    Manufacturer: AUO
    Model: 5278
    Made in: 2011
  Basic Display Parameters & Features:
    Digital display
    Bits per primary color channel: 6
    Digital interface is not defined
    Maximum image size: 38 cm x 21 cm
    Gamma: 2.20
    Supported color formats: RGB 4:4:4
    First detailed timing includes the native pixel format and preferred refresh rate
  Color Characteristics:
    Red  : 0.6201, 0.3398
    Green: 0.3251, 0.5703
    Blue : 0.1503, 0.0595
    White: 0.3134, 0.3291
  Established Timings I & II: none
  Standard Timings: none
  Detailed Timing Descriptors:
    DTD 1:  1600x900    60.061936 Hz  16:9     55.617 kHz    100.000000 MHz (382 mm x 214 mm)
                 Hfront   48 Hsync  32 Hback  118 Hpol P
                 Vfront    3 Vsync   6 Vback   17 Vpol N
    DTD 2:  1600x900    60.061936 Hz  16:9     55.617 kHz    100.000000 MHz (382 mm x 214 mm)
                 Hfront   48 Hsync  32 Hback  118 Hpol P
                 Vfront    3 Vsync   6 Vback   17 Vpol N
    Alphanumeric Data String: 'NRFX3'
    Manufacturer-Specified Display Descriptor (0x00): 00 00 00 00 41 01 96 00 01 00 00 02 01 0a 20 20 '....A.........  '
Checksum: 0x7a

----------------

Warnings:

Block 0, Base EDID:
  Missing Display Product Name.

Failures:

Block 0, Base EDID:
  Alphanumeric Data String: Non-printable character.

EDID conformity: FAIL
