edid-decode (hex):

00 ff ff ff ff ff ff 00 06 af 9e 14 00 00 00 00
00 16 01 04 90 26 15 78 02 c4 95 9e 57 53 92 26
0f 50 54 00 00 00 01 01 01 01 01 01 01 01 01 01
01 01 01 01 01 01 1c 2a 40 4a 61 84 1c 30 30 20
36 00 7e d6 10 00 00 18 13 1c 40 4a 61 84 1c 30
30 20 36 00 7e d6 10 00 00 18 00 00 00 00 00 00
00 00 00 00 00 00 00 00 00 00 00 00 00 00 00 02
00 0c 49 ff 0c 3c 6e 1e 1e 37 6e 20 20 20 00 e7

----------------

Block 0, Base EDID:
  EDID Structure Version & Revision: 1.4
  Vendor & Product Identification:
    Manufacturer: AUO
    Model: 5278
    Made in: 2012
  Basic Display Parameters & Features:
    Digital display
    Bits per primary color channel: 6
    Digital interface is not defined
    Maximum image size: 38 cm x 21 cm
    Gamma: 2.20
    Supported color formats: RGB 4:4:4
    First detailed timing includes the native pixel format and preferred refresh rate
  Color Characteristics:
    Red  : 0.6201, 0.3398
    Green: 0.3251, 0.5703
    Blue : 0.1503, 0.0595
    White: 0.3134, 0.3291
  Established Timings I & II: none
  Standard Timings: none
  Detailed Timing Descriptors:
    DTD 1:  1600x900    60.188494 Hz  16:9     55.855 kHz    107.800000 MHz (382 mm x 214 mm)
                 Hfront   48 Hsync  32 Hback  250 Hpol N
                 Vfront    3 Vsync   6 Vback   19 Vpol N
    DTD 2:  1600x900    40.127524 Hz  16:9     37.238 kHz     71.870000 MHz (382 mm x 214 mm)
                 Hfront   48 Hsync  32 Hback  250 Hpol N
                 Vfront    3 Vsync   6 Vback   19 Vpol N
    Empty Descriptor
    Manufacturer-Specified Display Descriptor (0x02): 00 02 00 0c 49 ff 0c 3c 6e 1e 1e 37 6e 20 20 20 '....I..<n..7n   '
Checksum: 0xe7

----------------

Failures:

Block 0, Base EDID:
  Empty Descriptor: Use Dummy Descriptor instead of all zeroes.
  Missing Display Product Name.

EDID conformity: FAIL
