
EDID (hex):
00ffffffffffff0022f0762601010101
0211010380342178eeef95a3544c9b26
0f5054a56b808140818081997100a900
a940b300d100283c80a070b023403020
360007442100001a000000fd0030551e
5e11000a202020202020000000fc0048
50204c50323436350a202020000000ff
00434e4b373032303235580a202000b0

Extracted contents:
header:          00 ff ff ff ff ff ff 00
serial number:   22 f0 76 26 01 01 01 01 02 11
version:         01 03
basic params:    80 34 21 78 ee
chroma info:     ef 95 a3 54 4c 9b 26 0f 50 54
established:     a5 6b 80
standard:        81 40 81 80 81 99 71 00 a9 00 a9 40 b3 00 d1 00
descriptor 1:    28 3c 80 a0 70 b0 23 40 30 20 36 00 07 44 21 00 00 1a
descriptor 2:    00 00 00 fd 00 30 55 1e 5e 11 00 0a 20 20 20 20 20 20
descriptor 3:    00 00 00 fc 00 48 50 20 4c 50 32 34 36 35 0a 20 20 20
descriptor 4:    00 00 00 ff 00 43 4e 4b 37 30 32 30 32 35 58 0a 20 20
extensions:      00
checksum:        b0

EDID version: 1.3
Manufacturer: HWP Model 2676 Serial Number --
Made in week 2 of 2007
Digital display
Maximum image size: 52 cm x 33 cm
Gamma: 2.20
DPMS levels: Standby Suspend Off
RGB color display
Default (sRGB) color space is primary color space
First detailed timing is preferred timing
Display x,y Chromaticity:
  Red:   0.6396, 0.3300
  Green: 0.2998, 0.6083
  Blue:  0.1503, 0.0595
  White: 0.3134, 0.3291
Established timings supported:
  720x400@70Hz 9:5 HorFreq: 31469 Hz Clock: 28.320 MHz
  640x480@60Hz 4:3 HorFreq: 31469 Hz Clock: 25.175 MHz
  640x480@75Hz 4:3 HorFreq: 37500 Hz Clock: 31.500 MHz
  800x600@60Hz 4:3 HorFreq: 37900 Hz Clock: 40.000 MHz
  800x600@75Hz 4:3 HorFreq: 46900 Hz Clock: 49.500 MHz
  832x624@75Hz 4:3 HorFreq: 49726 Hz Clock: 57.284 MHz
  1024x768@60Hz 4:3 HorFreq: 48400 Hz Clock: 65.000 MHz
  1024x768@75Hz 4:3 HorFreq: 60000 Hz Clock: 78.750 MHz
  1280x1024@75Hz 5:4 HorFreq: 80000 Hz Clock: 135.000 MHz
  1152x870@75Hz 192:145 HorFreq: 67500 Hz Clock: 108.000 MHz
Standard timings supported:
  1280x960@60Hz 4:3 HorFreq: 60000 Hz Clock: 108.000 MHz
  1280x1024@60Hz 5:4 HorFreq: 64000 Hz Clock: 108.000 MHz
  1280x1024@85Hz 5:4 HorFreq: 91100 Hz Clock: 157.500 MHz
  1152x720@60Hz 16:10
  1600x1000@60Hz 16:10
  1600x1200@60Hz 4:3 HorFreq: 75000 Hz Clock: 162.000 MHz
  1680x1050@60Hz 16:10 HorFreq: 64700 Hz Clock: 119.000 MHz
  1920x1200@60Hz 16:10 HorFreq: 74000 Hz Clock: 154.000 MHz
Detailed mode: Clock 154.000 MHz, 519 mm x 324 mm
               1920 1968 2000 2080 hborder 0
               1200 1203 1209 1235 vborder 0
               +hsync -vsync 
               VertFreq: 59 Hz, HorFreq: 74038 Hz
Monitor ranges (GTF): 48-85Hz V, 30-94kHz H, max dotclock 170MHz
Monitor name: HP LP2465
Serial number: --
Checksum: 0xb0 (valid)
EDID block does NOT conform to EDID 1.3!
	sRGB is signaled, but the chromaticities do not match


