edid-decode (hex):

00 ff ff ff ff ff ff 00 41 0c 00 00 79 00 00 00
04 0f 01 03 6c 45 27 78 ce dd 28 a3 53 43 a0 25
0f 48 4c 23 08 00 81 c0 01 01 01 01 01 01 01 01
01 01 01 01 01 01 0e 1f 00 80 51 00 1e 30 40 80
37 00 b9 88 21 00 00 1c 00 00 00 ff 00 31 32 33
34 35 0a 20 20 20 20 20 20 20 00 00 00 fc 00 33
32 4d 46 36 30 35 57 2f 31 37 0a 20 00 00 00 fd
00 38 3f 1e 32 08 00 0a 20 20 20 20 20 20 00 05

----------------

Block 0, Base EDID:
  EDID Structure Version & Revision: 1.3
  Vendor & Product Identification:
    Manufacturer: PHL
    Model: 0
    Serial Number: ...
    Made in: week 4 of 2005
  Basic Display Parameters & Features:
    Analog display
    Signal Level Standard: 0.700 : 0.000 : 0.700 V p-p
    Blank level equals black level
    Sync: Separate Composite
    Maximum image size: 69 cm x 39 cm
    Gamma: 2.20
    DPMS levels: Standby Suspend
    RGB color display
    Default (sRGB) color space is primary color space
    First detailed timing is the preferred timing
  Color Characteristics:
    Red  : 0.6396, 0.3251
    Green: 0.2646, 0.6259
    Blue : 0.1445, 0.0605
    White: 0.2832, 0.2968
  Established Timings I & II:
    DMT 0x04:   640x480    59.940476 Hz   4:3     31.469 kHz     25.175000 MHz
    DMT 0x08:   800x600    56.250000 Hz   4:3     35.156 kHz     36.000000 MHz
    DMT 0x09:   800x600    60.316541 Hz   4:3     37.879 kHz     40.000000 MHz
    DMT 0x10:  1024x768    60.003840 Hz   4:3     48.363 kHz     65.000000 MHz
  Standard Timings:
    DMT 0x55:  1280x720    60.000000 Hz  16:9     45.000 kHz     74.250000 MHz
  Detailed Timing Descriptors:
    DTD 1:  1280x768    59.870228 Hz   5:3     47.776 kHz     79.500000 MHz (697 mm x 392 mm)
                 Hfront   64 Hsync 128 Hback  192 Hpol N
                 Vfront    3 Vsync   7 Vback   20 Vpol P
    Display Product Serial Number: ...
    Display Product Name: '32MF605W/17'
    Display Range Limits:
      Monitor ranges (GTF): 56-63 Hz V, 30-50 kHz H, max dotclock 80 MHz
Checksum: 0x05

----------------

Failures:

Block 0, Base EDID:
  Basic Display Parameters & Features: sRGB is signaled, but the chromaticities do not match.

EDID conformity: FAIL
