
EDID (hex):
00ffffffffffff00410c000001010101
2d120103088048782aa981a3544c9926
0f4a4c2108008180a940010101010101
010101010101023a801871382d40582c
450000d05200001e662150b051001b30
4070360076f23100001e000000fd003c
4b1e5111000a202020202020000000fc
005048494c4950535f4654560a200001

Extracted contents:
header:          00 ff ff ff ff ff ff 00
serial number:   41 0c 00 00 01 01 01 01 2d 12
version:         01 03
basic params:    08 80 48 78 2a
chroma info:     a9 81 a3 54 4c 99 26 0f 4a 4c
established:     21 08 00
standard:        81 80 a9 40 01 01 01 01 01 01 01 01 01 01 01 01
descriptor 1:    02 3a 80 18 71 38 2d 40 58 2c 45 00 00 d0 52 00 00 1e
descriptor 2:    66 21 50 b0 51 00 1b 30 40 70 36 00 76 f2 31 00 00 1e
descriptor 3:    00 00 00 fd 00 3c 4b 1e 51 11 00 0a 20 20 20 20 20 20
descriptor 4:    00 00 00 fc 00 50 48 49 4c 49 50 53 5f 46 54 56 0a 20
extensions:      00
checksum:        01

EDID version: 1.3
Manufacturer: PHL Model 0 Serial Number --
Made in week 45 of 2008
Analog display, Input voltage level: 0.7/0.3 V
Sync: Separate 
Maximum image size: 128 cm x 72 cm
Gamma: 2.20
DPMS levels: Off
RGB color display
First detailed timing is preferred timing
Display x,y Chromaticity:
  Red:   0.6386, 0.3300
  Green: 0.2988, 0.5986
  Blue:  0.1503, 0.0585
  White: 0.2890, 0.2978
Established timings supported:
  640x480@60Hz 4:3 HorFreq: 31469 Hz Clock: 25.175 MHz
  800x600@60Hz 4:3 HorFreq: 37900 Hz Clock: 40.000 MHz
  1024x768@60Hz 4:3 HorFreq: 48400 Hz Clock: 65.000 MHz
Standard timings supported:
  1280x1024@60Hz 5:4 HorFreq: 64000 Hz Clock: 108.000 MHz
  1600x1200@60Hz 4:3 HorFreq: 75000 Hz Clock: 162.000 MHz
Detailed mode: Clock 148.500 MHz, 1280 mm x 720 mm
               1920 2008 2052 2200 hborder 0
               1080 1084 1089 1125 vborder 0
               +hsync +vsync 
               VertFreq: 60 Hz, HorFreq: 67500 Hz
Detailed mode: Clock 85.500 MHz, 886 mm x 498 mm
               1360 1424 1536 1792 hborder 0
                768  771  777  795 vborder 0
               +hsync +vsync 
               VertFreq: 60 Hz, HorFreq: 47712 Hz
Monitor ranges (GTF): 60-75Hz V, 30-81kHz H, max dotclock 170MHz
Monitor name: PHILIPS_FTV
Checksum: 0x1 (valid)
