edid-decode (hex):

00 ff ff ff ff ff ff 00 4c 2d 99 0f 32 37 39 30
32 1e 01 03 80 77 22 78 2a a2 a1 ad 4f 46 a7 24
0e 50 54 bf ef 80 71 4f 81 00 81 c0 81 80 a9 c0
b3 00 95 00 d1 c0 1a 68 00 a0 f0 38 1f 40 30 20
3a 00 a9 50 41 00 00 1a 00 00 00 fd 00 18 78 1e
a0 3c 00 0a 20 20 20 20 20 20 00 00 00 fc 00 43
34 39 52 47 39 78 0a 20 20 20 20 20 00 00 00 ff
00 48 4e 4b 4e 43 30 30 35 34 39 0a 20 20 03 d7

f0 02 70 00 00 00 00 00 00 00 00 00 00 00 00 00
00 00 00 00 00 00 00 00 00 00 00 00 00 00 00 00
00 00 00 00 00 00 00 00 00 00 00 00 00 00 00 00
00 00 00 00 00 00 00 00 00 00 00 00 00 00 00 00
00 00 00 00 00 00 00 00 00 00 00 00 00 00 00 00
00 00 00 00 00 00 00 00 00 00 00 00 00 00 00 00
00 00 00 00 00 00 00 00 00 00 00 00 00 00 00 00
00 00 00 00 00 00 00 00 00 00 00 00 00 00 00 9e

3a 9d ef e5 72 63 5a 0f e8 b7 f5 b9 d8 ba b1 ae
b7 fb 8a 3f 96 93 7c 4f 44 9f 6a bd db 42 ea 1e
55 57 30 cb 65 90 ab 4d c4 8b 2d 9e 38 94 0e 39
39 af 73 a7 95 dd 60 52 d8 97 9a c3 cf 9d 94 ce
46 17 aa 44 ab 46 d8 0b 42 01 67 4f 83 36 cc 68
d0 ef 0d a6 07 0e 7e 34 e1 07 44 26 b7 ae 78 bd
db a4 e9 0e 19 dd 60 99 85 cb e4 4e 12 d6 d4 0c
50 11 3a 3e 69 8d be 9b ae aa 0e 31 db b6 59 38

cc b4 ae 80 5e c6 e5 42 81 73 af 03 73 c7 ea 4c
71 87 aa a1 75 e4 4e 2d ac 4f 90 62 97 04 28 7b
e9 7b d1 4f fd 3f 71 9b 06 6b 0e 24 39 0a 92 0f
7d ef 5b 73 48 5f 77 09 f8 0b 1a 71 d0 df ce 12
8f 4b bb 81 9d df 2a 6f 4d e7 b9 a7 02 06 cb 09
ea 2f ff 3d 67 d5 b4 c8 47 cb 36 39 c1 94 fc ce
44 69 60 9e fb f7 41 26 f0 2d 4f 7e 61 8e 1e 86
ec 7f 13 ab 78 06 98 c7 a8 06 30 39 de 25 1a db

----------------

Block 0, Base EDID:
  EDID Structure Version & Revision: 1.3
  Vendor & Product Identification:
    Manufacturer: SAM
    Model: 3993
    Serial Number: ...
    Made in: week 50 of 2020
  Basic Display Parameters & Features:
    Digital display
    Maximum image size: 119 cm x 34 cm
    Gamma: 2.20
    DPMS levels: Off
    RGB color display
    First detailed timing is the preferred timing
  Color Characteristics:
    Red  : 0.6777, 0.3105
    Green: 0.2734, 0.6542
    Blue : 0.1425, 0.0566
    White: 0.3125, 0.3291
  Established Timings I & II:
    IBM     :   720x400    70.081663 Hz   9:5     31.467 kHz     28.320000 MHz
    DMT 0x04:   640x480    59.940476 Hz   4:3     31.469 kHz     25.175000 MHz
    Apple   :   640x480    66.666667 Hz   4:3     35.000 kHz     30.240000 MHz
    DMT 0x05:   640x480    72.808802 Hz   4:3     37.861 kHz     31.500000 MHz
    DMT 0x06:   640x480    75.000000 Hz   4:3     37.500 kHz     31.500000 MHz
    DMT 0x08:   800x600    56.250000 Hz   4:3     35.156 kHz     36.000000 MHz
    DMT 0x09:   800x600    60.316541 Hz   4:3     37.879 kHz     40.000000 MHz
    DMT 0x0a:   800x600    72.187572 Hz   4:3     48.077 kHz     50.000000 MHz
    DMT 0x0b:   800x600    75.000000 Hz   4:3     46.875 kHz     49.500000 MHz
    Apple   :   832x624    74.551266 Hz   4:3     49.726 kHz     57.284000 MHz
    DMT 0x10:  1024x768    60.003840 Hz   4:3     48.363 kHz     65.000000 MHz
    DMT 0x11:  1024x768    70.069359 Hz   4:3     56.476 kHz     75.000000 MHz
    DMT 0x12:  1024x768    75.028582 Hz   4:3     60.023 kHz     78.750000 MHz
    DMT 0x24:  1280x1024   75.024675 Hz   5:4     79.976 kHz    135.000000 MHz
    Apple   :  1152x870    75.061550 Hz 192:145   68.681 kHz    100.000000 MHz
  Standard Timings:
    DMT 0x15:  1152x864    75.000000 Hz   4:3     67.500 kHz    108.000000 MHz
    DMT 0x1c:  1280x800    59.810326 Hz  16:10    49.702 kHz     83.500000 MHz
    DMT 0x55:  1280x720    60.000000 Hz  16:9     45.000 kHz     74.250000 MHz
    DMT 0x23:  1280x1024   60.019740 Hz   5:4     63.981 kHz    108.000000 MHz
    DMT 0x53:  1600x900    60.000000 Hz  16:9     60.000 kHz    108.000000 MHz (RB)
    DMT 0x3a:  1680x1050   59.954250 Hz  16:10    65.290 kHz    146.250000 MHz
    DMT 0x2f:  1440x900    59.887445 Hz  16:10    55.935 kHz    106.500000 MHz
    DMT 0x52:  1920x1080   60.000000 Hz  16:9     67.500 kHz    148.500000 MHz
  Detailed Timing Descriptors:
    DTD 1:  3840x1080   59.968497 Hz  32:9     66.625 kHz    266.500000 MHz (1193 mm x 336 mm)
                 Hfront   48 Hsync  32 Hback   80 Hpol P
                 Vfront    3 Vsync  10 Vback   18 Vpol N
    Display Range Limits:
      Monitor ranges (GTF): 24-120 Hz V, 30-160 kHz H, max dotclock 600 MHz
    Display Product Name: 'C49RG9x'
    Display Product Serial Number: ...
  Extension blocks: 3
Checksum: 0xd7

----------------

Block 1, Block Map Extension Block:
  Block   2: CTA-861 Extension Block
  Block   3: DisplayID Extension Block
Checksum: 0x9e

----------------

Block 2, Unknown EDID Extension Block 0x3a:
  3a 9d ef e5 72 63 5a 0f e8 b7 f5 b9 d8 ba b1 ae ':...rcZ.........'
  b7 fb 8a 3f 96 93 7c 4f 44 9f 6a bd db 42 ea 1e '...?..|OD.j..B..'
  55 57 30 cb 65 90 ab 4d c4 8b 2d 9e 38 94 0e 39 'UW0.e..M..-.8..9'
  39 af 73 a7 95 dd 60 52 d8 97 9a c3 cf 9d 94 ce '9.s...`R........'
  46 17 aa 44 ab 46 d8 0b 42 01 67 4f 83 36 cc 68 'F..D.F..B.gO.6.h'
  d0 ef 0d a6 07 0e 7e 34 e1 07 44 26 b7 ae 78 bd '......~4..D&..x.'
  db a4 e9 0e 19 dd 60 99 85 cb e4 4e 12 d6 d4 0c '......`....N....'
  50 11 3a 3e 69 8d be 9b ae aa 0e 31 db b6 59 38 'P.:>i......1..Y8'
Checksum: 0x38

----------------

Block 3, Unknown EDID Extension Block 0xcc:
  cc b4 ae 80 5e c6 e5 42 81 73 af 03 73 c7 ea 4c '....^..B.s..s..L'
  71 87 aa a1 75 e4 4e 2d ac 4f 90 62 97 04 28 7b 'q...u.N-.O.b..({'
  e9 7b d1 4f fd 3f 71 9b 06 6b 0e 24 39 0a 92 0f '.{.O.?q..k.$9...'
  7d ef 5b 73 48 5f 77 09 f8 0b 1a 71 d0 df ce 12 '}.[sH_w....q....'
  8f 4b bb 81 9d df 2a 6f 4d e7 b9 a7 02 06 cb 09 '.K....*oM.......'
  ea 2f ff 3d 67 d5 b4 c8 47 cb 36 39 c1 94 fc ce './.=g...G.69....'
  44 69 60 9e fb f7 41 26 f0 2d 4f 7e 61 8e 1e 86 'Di`...A&.-O~a...'
  ec 7f 13 ab 78 06 98 c7 a8 06 30 39 de 25 1a db '....x.....09.%..'
Checksum: 0xdb

----------------

Failures:

Block 1, Block Map Extension Block:
  Block 2 tag mismatch: expected 0x3a, but got 0x02.
  Block 3 tag mismatch: expected 0xcc, but got 0x70.
Block 2, Unknown EDID Extension Block 0x3a:
  Unknown Extension Block.
Block 3, Unknown EDID Extension Block 0xcc:
  Unknown Extension Block.

EDID conformity: FAIL
