
EDID (hex):
00ffffffffffff004c2d990f59575743
32300103807722782aa2a1ad4f46a724
0e5054bfef80714f810081c08180a9c0
b3009500d1c01a6800a0f0381f403020
3a00a9504100001a000000fd0018781e
a03c000a202020202020000000fc0043
3439524739780a2020202020000000ff
0048345a4e3130303030340a20200378
f0027000000000000000000000000000
00000000000000000000000000000000
00000000000000000000000000000000
00000000000000000000000000000000
00000000000000000000000000000000
00000000000000000000000000000000
00000000000000000000000000000000
0000000000000000000000000000009e
02033df14c9061601f041312035a5d5e
5f2309070783010000e305c0006d030c
001000b83c20006001020367d85dc401
788003e60605018b7312e20f06565e00
a0a0a0295030203500a9504100001a58
4d00b8a1381440f82c4500a950410000
1e000000000000000000000000000000
0000000000000000000000000000007f
701279000003012833b70088ff139f00
2f801f009f05280002000900545a0008
ff139f002f801f009f05140002000900
00000000000000000000000000000000
00000000000000000000000000000000
00000000000000000000000000000000
00000000000000000000000000000000
00000000000000000000000000008990

Extracted contents:
header:          00 ff ff ff ff ff ff 00
serial number:   4c 2d 99 0f 59 57 57 43 32 30
version:         01 03
basic params:    80 77 22 78 2a
chroma info:     a2 a1 ad 4f 46 a7 24 0e 50 54
established:     bf ef 80
standard:        71 4f 81 00 81 c0 81 80 a9 c0 b3 00 95 00 d1 c0
descriptor 1:    1a 68 00 a0 f0 38 1f 40 30 20 3a 00 a9 50 41 00 00 1a
descriptor 2:    00 00 00 fd 00 18 78 1e a0 3c 00 0a 20 20 20 20 20 20
descriptor 3:    00 00 00 fc 00 43 34 39 52 47 39 78 0a 20 20 20 20 20
descriptor 4:    00 00 00 ff 00 48 34 5a 4e 31 30 30 30 30 34 0a 20 20
extensions:      03
checksum:        78

EDID version: 1.3
Manufacturer: SAM Model f99 Serial Number --
Digital display
Maximum image size: 119 cm x 34 cm
Gamma: 2.20
DPMS levels: Off
RGB color display
First detailed timing is preferred timing
Display x,y Chromaticity:
  Red:   0.6777, 0.3105
  Green: 0.2734, 0.6542
  Blue:  0.1425, 0.0566
  White: 0.3125, 0.3291
Established timings supported:
  720x400@70Hz 9:5 HorFreq: 31469 Hz Clock: 28.320 MHz
  640x480@60Hz 4:3 HorFreq: 31469 Hz Clock: 25.175 MHz
  640x480@67Hz 4:3 HorFreq: 35000 Hz Clock: 30.240 MHz
  640x480@72Hz 4:3 HorFreq: 37900 Hz Clock: 31.500 MHz
  640x480@75Hz 4:3 HorFreq: 37500 Hz Clock: 31.500 MHz
  800x600@56Hz 4:3 HorFreq: 35200 Hz Clock: 36.000 MHz
  800x600@60Hz 4:3 HorFreq: 37900 Hz Clock: 40.000 MHz
  800x600@72Hz 4:3 HorFreq: 48100 Hz Clock: 50.000 MHz
  800x600@75Hz 4:3 HorFreq: 46900 Hz Clock: 49.500 MHz
  832x624@75Hz 4:3 HorFreq: 49726 Hz Clock: 57.284 MHz
  1024x768@60Hz 4:3 HorFreq: 48400 Hz Clock: 65.000 MHz
  1024x768@70Hz 4:3 HorFreq: 56500 Hz Clock: 75.000 MHz
  1024x768@75Hz 4:3 HorFreq: 60000 Hz Clock: 78.750 MHz
  1280x1024@75Hz 5:4 HorFreq: 80000 Hz Clock: 135.000 MHz
  1152x870@75Hz 192:145 HorFreq: 67500 Hz Clock: 108.000 MHz
Standard timings supported:
  1152x864@75Hz 4:3 HorFreq: 67500 Hz Clock: 108.000 MHz
  1280x800@60Hz 16:10
  1280x720@60Hz 16:9
  1280x1024@60Hz 5:4 HorFreq: 64000 Hz Clock: 108.000 MHz
  1600x900@60Hz 16:9
  1680x1050@60Hz 16:10 HorFreq: 64700 Hz Clock: 119.000 MHz
  1440x900@60Hz 16:10 HorFreq: 55500 Hz Clock: 88.750 MHz
  1920x1080@60Hz 16:9
Detailed mode: Clock 266.500 MHz, 1193 mm x 336 mm
               3840 3888 3920 4000 hborder 0
               1080 1083 1093 1111 vborder 0
               +hsync -vsync 
               VertFreq: 59 Hz, HorFreq: 66625 Hz
Monitor ranges (GTF): 24-120Hz V, 30-160kHz H, max dotclock 600MHz
Monitor name: C49RG9x
Serial number: --
Has 3 extension blocks
Checksum: 0x78 (valid)

Block map


CTA extension block
Extension version: 3
57 bytes of CTA data
  Video data block
    VIC  16 1920x1080@60Hz 16:9 (native) HorFreq: 67500 Hz Clock: 148.500 MHz
    VIC  97 3840x2160@60Hz 16:9  HorFreq: 135000 Hz Clock: 594.000 MHz
    VIC  96 3840x2160@50Hz 16:9  HorFreq: 112500 Hz Clock: 594.000 MHz
    VIC  31 1920x1080@50Hz 16:9  HorFreq: 56250 Hz Clock: 148.500 MHz
    VIC   4 1280x720@60Hz 16:9  HorFreq: 45000 Hz Clock: 74.250 MHz
    VIC  19 1280x720@50Hz 16:9  HorFreq: 37500 Hz Clock: 74.250 MHz
    VIC  18 720x576@50Hz 16:9  HorFreq: 31250 Hz Clock: 27.000 MHz
    VIC   3 720x480@60Hz 16:9  HorFreq: 31469 Hz Clock: 27.000 MHz
    VIC  90 2560x1080@60Hz 64:27  HorFreq: 66000 Hz Clock: 198.000 MHz
    VIC  93 3840x2160@24Hz 16:9  HorFreq: 54000 Hz Clock: 297.000 MHz
    VIC  94 3840x2160@25Hz 16:9  HorFreq: 56250 Hz Clock: 297.000 MHz
    VIC  95 3840x2160@30Hz 16:9  HorFreq: 67500 Hz Clock: 297.000 MHz
  Audio data block
    Linear PCM, max channels 2
      Supported sample rates (kHz): 48 44.1 32
      Supported sample sizes (bits): 24 20 16
  Speaker allocation data block
    Speaker map:
      FL/FR - Front Left/Right
  Extended tag: Colorimetry data block
    BT2020YCC
    BT2020RGB
  Vendor-specific data block, OUI 000c03 (HDMI)
    Source physical address 1.0.0.0
    Supports_AI
    DC_36bit
    DC_30bit
    DC_Y444
    Maximum TMDS clock: 300MHz
    Extended HDMI video details:
      HDMI VIC 1 3840x2160@30Hz 16:9 HorFreq: 67500 Hz Clock: 297.000 MHz
      HDMI VIC 2 3840x2160@25Hz 16:9 HorFreq: 56250 Hz Clock: 297.000 MHz
      HDMI VIC 3 3840x2160@24Hz 16:9 HorFreq: 54000 Hz Clock: 297.000 MHz
  Vendor-specific data block, OUI c45dd8 (HDMI Forum)
    Version: 1
    Maximum TMDS Character Rate: 600MHz
    SCDC Present
    Supports 12-bits/component Deep Color 4:2:0 Pixel Encoding
    Supports 10-bits/component Deep Color 4:2:0 Pixel Encoding
  Extended tag: HDR static metadata data block
    Electro optical transfer functions:
      Traditional gamma - SDR luminance range
      SMPTE ST2084
    Supported static metadata descriptors:
      Static metadata type 1
    Desired content max luminance: 139 (1015.241 cd/m^2)
    Desired content max frame-average luminance: 115 (603.666 cd/m^2)
    Desired content min luminance: 18 (0.051 cd/m^2)
  Extended tag: YCbCr 4:2:0 capability map data block
    VSD Index 1
    VSD Index 2
Underscans PC formats by default
Basic audio support
Supports YCbCr 4:4:4
Supports YCbCr 4:2:2
1 native detailed modes
Detailed mode: Clock 241.500 MHz, 1193 mm x 336 mm
               2560 2608 2640 2720 hborder 0
               1440 1443 1448 1481 vborder 0
               +hsync -vsync 
               VertFreq: 59 Hz, HorFreq: 88786 Hz
Detailed mode: Clock 198.000 MHz, 1193 mm x 336 mm
               2560 2808 2852 3000 hborder 0
               1080 1084 1089 1100 vborder 0
               +hsync +vsync 
               VertFreq: 60 Hz, HorFreq: 66000 Hz
Checksum: 0x7f (valid)


DisplayID extension block
Extension version: 18
Length 121, version 18, extension count 0
Checksum: 0x89 (valid)
Type 1 detailed timing: aspect: undefined, Preferred  
Detailed mode: Clock 468.990 MHz, 0 mm x 0 mm
               5119 5166 5197 5278
               1439 1441 1450 1479
               +hsync -vsync
Type 1 detailed timing: aspect: undefined,  
Detailed mode: Clock 231.240 MHz, 0 mm x 0 mm
               5119 5166 5197 5278
               1439 1441 1450 1459
               +hsync -vsync

EDID block does not conform at all!
	Has -2013265920 nonconformant extension block(s)
	Bad year of manufacture
	Both the serial number and the serial string are set
