edid-decode (hex):

00 ff ff ff ff ff ff 00 4c a3 42 53 00 00 00 00
00 11 01 03 80 1e 13 78 0a 87 f5 94 57 4f 8c 27
27 50 54 00 00 00 01 01 01 01 01 01 01 01 01 01
01 01 01 01 01 01 1c 2a a0 12 52 84 0c 30 30 80
63 00 2f be 10 00 00 19 00 00 00 0f 00 00 00 00
00 00 00 00 00 e6 fa 02 23 00 00 00 00 fe 00 53
41 4d 53 55 4e 47 0a 20 20 20 20 20 00 00 00 fe
00 31 34 31 42 54 30 36 2d 30 30 31 0a 20 00 71

----------------

Block 0, Base EDID:
  EDID Structure Version & Revision: 1.3
  Vendor & Product Identification:
    Manufacturer: SEC
    Model: 21314
    Made in: 2007
  Basic Display Parameters & Features:
    Digital display
    Maximum image size: 30 cm x 19 cm
    Gamma: 2.20
    RGB color display
    First detailed timing is the preferred timing
  Color Characteristics:
    Red  : 0.5800, 0.3398
    Green: 0.3095, 0.5498
    Blue : 0.1552, 0.1552
    White: 0.3134, 0.3291
  Established Timings I & II: none
  Standard Timings: none
  Detailed Timing Descriptors:
    DTD 1:  1440x900    60.000891 Hz  16:10    54.721 kHz    107.800000 MHz (303 mm x 190 mm)
                 Hfront   48 Hsync 128 Hback  354 Hpol N
                 Vfront    6 Vsync   3 Vback    3 Vpol N
    Manufacturer-Specified Display Descriptor (0x0f): 00 0f 00 00 00 00 00 00 00 00 00 e6 fa 02 23 00 '..............#.'
    Alphanumeric Data String: 'SAMSUNG'
    Alphanumeric Data String: '141BT06-001'
Checksum: 0x71

----------------

Failures:

Block 0, Base EDID:
  Missing Display Product Name.
  Missing Display Range Limits Descriptor.

EDID conformity: FAIL
