edid-decode (hex):

00 ff ff ff ff ff ff 00 30 e4 f7 05 00 00 00 00
00 1c 01 04 95 22 13 78 06 2e a5 a5 54 4c 9d 26
0b 50 54 00 00 00 01 01 01 01 01 01 01 01 01 01
01 01 01 01 01 01 29 36 80 a0 70 38 1f 40 30 20
35 00 58 c2 10 00 00 19 00 00 00 00 00 00 00 00
00 00 00 00 00 00 00 00 00 00 00 00 00 fe 00 4c
47 20 44 69 73 70 6c 61 79 0a 20 20 00 00 00 fe
00 4c 50 31 35 36 57 46 41 2d 53 50 47 32 00 77

----------------

Block 0, Base EDID:
  EDID Structure Version & Revision: 1.4
  Vendor & Product Identification:
    Manufacturer: LGD
    Model: 1527
    Made in: 2018
  Basic Display Parameters & Features:
    Digital display
    Bits per primary color channel: 6
    DisplayPort interface
    Maximum image size: 34 cm x 19 cm
    Gamma: 2.20
    Supported color formats: RGB 4:4:4
    Default (sRGB) color space is primary color space
    First detailed timing includes the native pixel format and preferred refresh rate
  Color Characteristics:
    Red  : 0.6445, 0.3300
    Green: 0.2998, 0.6152
    Blue : 0.1503, 0.0449
    White: 0.3134, 0.3291
  Established Timings I & II: none
  Standard Timings: none
  Detailed Timing Descriptors:
    DTD 1:  1920x1080   59.999 Hz  16:9    66.659 kHz 138.650 MHz (344 mm x 194 mm)
                 Hfront   48 Hsync  32 Hback  80 Hpol N
                 Vfront    3 Vsync   5 Vback  23 Vpol N
    Empty Descriptor
    Alphanumeric Data String: 'LG Display'
    Alphanumeric Data String: 'LP156WFA-SPG2'
Checksum: 0x77

----------------

Failures:

Block 0, Base EDID:
  Basic Display Parameters & Features: sRGB is signaled, but the chromaticities do not match.
  Empty Descriptor: Use Dummy Descriptor instead of all zeroes.
  Missing Display Product Name.

EDID conformity: FAIL
