
EDID (hex):
00ffffffffffff002264ee0327a90000
2b15010380160d780a80369a5e5d9128
204f5400000001010101010101010101
0101010101012c15004c415842203523
4500dc8100000019000000fe00000000
00000000000000000000000000fc0048
534431303049465734410a2000000010
000a202020202020202020202020009b

Extracted contents:
header:          00 ff ff ff ff ff ff 00
serial number:   22 64 ee 03 27 a9 00 00 2b 15
version:         01 03
basic params:    80 16 0d 78 0a
chroma info:     80 36 9a 5e 5d 91 28 20 4f 54
established:     00 00 00
standard:        01 01 01 01 01 01 01 01 01 01 01 01 01 01 01 01
descriptor 1:    2c 15 00 4c 41 58 42 20 35 23 45 00 dc 81 00 00 00 19
descriptor 2:    00 00 00 fe 00 00 00 00 00 00 00 00 00 00 00 00 00 00
descriptor 3:    00 00 00 fc 00 48 53 44 31 30 30 49 46 57 34 41 0a 20
descriptor 4:    00 00 00 10 00 0a 20 20 20 20 20 20 20 20 20 20 20 20
extensions:      00
checksum:        9b

EDID version: 1.3
Manufacturer: HSD Model 3ee Serial Number --
Made in week 43 of 2011
Digital display
Maximum image size: 22 cm x 13 cm
Gamma: 2.20
RGB color display
First detailed timing is preferred timing
Display x,y Chromaticity:
  Red:   0.6035, 0.3671
  Green: 0.3632, 0.5664
  Blue:  0.1562, 0.1279
  White: 0.3095, 0.3300
Established timings supported:
Standard timings supported:
Detailed mode: Clock 54.200 MHz, 220 mm x 129 mm
               1024 1077 1112 1356 hborder 0
                600  604  609  666 vborder 0
               -hsync -vsync 
               VertFreq: 60 Hz, HorFreq: 39970 Hz
ASCII string: 
Monitor name: HSD100IFW4A
Dummy block
Checksum: 0x9b (valid)
EDID block does NOT conform to EDID 1.3!
	Missing monitor ranges
	Detailed block string not properly terminated
EDID block does not conform at all!
	Dummy block filled with garbage
