
EDID (hex):
00ffffffffffff002264ee0320c10000
1016010380160d780a80369a5e5d9128
204f5400000001010101010101010101
0101010101012c15004c415842203523
4500dc8100000019000000fe00000000
00000000000000000000000000fc0048
534431303049465734410a2000000010
000a20202020202020202020202000a4

edid-decode (hex):

00 ff ff ff ff ff ff 00 22 64 ee 03 20 c1 00 00
10 16 01 03 80 16 0d 78 0a 80 36 9a 5e 5d 91 28
20 4f 54 00 00 00 01 01 01 01 01 01 01 01 01 01
01 01 01 01 01 01 2c 15 00 4c 41 58 42 20 35 23
45 00 dc 81 00 00 00 19 00 00 00 fe 00 00 00 00
00 00 00 00 00 00 00 00 00 00 00 00 00 fc 00 48
53 44 31 30 30 49 46 57 34 41 0a 20 00 00 00 10
00 0a 20 20 20 20 20 20 20 20 20 20 20 20 00 a4

----------------

Block 0, Base EDID:
  EDID Structure Version & Revision: 1.3
  Vendor & Product Identification:
    Manufacturer: HSD
    Model: 1006
    Serial Number: 49440
    Made in: week 16 of 2012
  Basic Display Parameters & Features:
    Digital display
    Maximum image size: 22 cm x 13 cm
    Gamma: 2.20
    RGB color display
    First detailed timing is the preferred timing
  Color Characteristics:
    Red  : 0.6035, 0.3671
    Green: 0.3632, 0.5664
    Blue : 0.1562, 0.1279
    White: 0.3095, 0.3300
  Established Timings I & II: none
  Standard Timings: none
  Detailed Timing Descriptors:
    DTD 1:  1024x600    60.015768 Hz 128:75    39.971 kHz     54.200000 MHz (220 mm x 129 mm)
                 Hfront   53 Hsync  35 Hback  244 Hpol N
                 Vfront    4 Vsync   5 Vback   57 Vpol N
    Alphanumeric Data String: ''
    Display Product Name: 'HSD100IFW4A'
    Dummy Descriptor:
Checksum: 0xa4
