
EDID (hex):
00ffffffffffff0009d1307f45540000
0b1b0104a5351e78269de1a654549f26
0d5054a56b80d1c0457c617c818081bc
953c317c0101023a801871382d40582c
4500132a2100001e000000ff00483348
3035393131534c300a20000000fd0018
780f8715000a202020202020000000fc
005a4f57494520584c204c43440a002d

Extracted contents:
header:          00 ff ff ff ff ff ff 00
serial number:   09 d1 30 7f 45 54 00 00 0b 1b
version:         01 04
basic params:    a5 35 1e 78 26
chroma info:     9d e1 a6 54 54 9f 26 0d 50 54
established:     a5 6b 80
standard:        d1 c0 45 7c 61 7c 81 80 81 bc 95 3c 31 7c 01 01
descriptor 1:    02 3a 80 18 71 38 2d 40 58 2c 45 00 13 2a 21 00 00 1e
descriptor 2:    00 00 00 ff 00 48 33 48 30 35 39 31 31 53 4c 30 0a 20
descriptor 3:    00 00 00 fd 00 18 78 0f 87 15 00 0a 20 20 20 20 20 20
descriptor 4:    00 00 00 fc 00 5a 4f 57 49 45 20 58 4c 20 4c 43 44 0a
extensions:      00
checksum:        2d

EDID version: 1.4
Manufacturer: BNQ Model 7f30 Serial Number --
Made in week 11 of 2017
Digital display
8 bits per primary color channel
DisplayPort interface
Maximum image size: 53 cm x 30 cm
Gamma: 2.20
DPMS levels: Off
Supported color formats: RGB 4:4:4
Default (sRGB) color space is primary color space
First detailed timing includes the native pixel format and preferred refresh rate
Display x,y Chromaticity:
  Red:   0.6503, 0.3291
  Green: 0.3310, 0.6220
  Blue:  0.1513, 0.0527
  White: 0.3125, 0.3291
Established timings supported:
  720x400@70Hz 9:5 HorFreq: 31469 Hz Clock: 28.320 MHz
  640x480@60Hz 4:3 HorFreq: 31469 Hz Clock: 25.175 MHz
  640x480@75Hz 4:3 HorFreq: 37500 Hz Clock: 31.500 MHz
  800x600@60Hz 4:3 HorFreq: 37900 Hz Clock: 40.000 MHz
  800x600@75Hz 4:3 HorFreq: 46900 Hz Clock: 49.500 MHz
  832x624@75Hz 4:3 HorFreq: 49726 Hz Clock: 57.284 MHz
  1024x768@60Hz 4:3 HorFreq: 48400 Hz Clock: 65.000 MHz
  1024x768@75Hz 4:3 HorFreq: 60000 Hz Clock: 78.750 MHz
  1280x1024@75Hz 5:4 HorFreq: 80000 Hz Clock: 135.000 MHz
  1152x870@75Hz 192:145 HorFreq: 67500 Hz Clock: 108.000 MHz
Standard timings supported:
  1920x1080@60Hz 16:9
  800x600@120Hz 4:3
  1024x768@120Hz 4:3
  1280x1024@60Hz 5:4 HorFreq: 64000 Hz Clock: 108.000 MHz
  1280x1024@120Hz 5:4
  1440x900@120Hz 16:10
  640x480@120Hz 4:3
Detailed mode: Clock 148.500 MHz, 531 mm x 298 mm
               1920 2008 2052 2200 hborder 0
               1080 1084 1089 1125 vborder 0
               +hsync +vsync 
               VertFreq: 60 Hz, HorFreq: 67500 Hz
Serial number: --
Monitor ranges (GTF): 24-120Hz V, 15-135kHz H, max dotclock 210MHz
Monitor name: ZOWIE XL LCD
Checksum: 0x2d (valid)
EDID block does NOT conform to EDID 1.4!
	sRGB is signaled, but the chromaticities do not match
