
EDID (hex):
00ffffffffffff0030aeb04000000000
0014010380221378eac8959e57549226
0f505400000001010101010101010101
0101010101017a1e5618510016303020
250058c2100000190000000f00000000
000000000025d9066a00000000fe0053
414d53554e470a2020202020000000fe
004c544e313536415431364c3031001f

Extracted contents:
header:          00 ff ff ff ff ff ff 00
serial number:   30 ae b0 40 00 00 00 00 00 14
version:         01 03
basic params:    80 22 13 78 ea
chroma info:     c8 95 9e 57 54 92 26 0f 50 54
established:     00 00 00
standard:        01 01 01 01 01 01 01 01 01 01 01 01 01 01 01 01
descriptor 1:    7a 1e 56 18 51 00 16 30 30 20 25 00 58 c2 10 00 00 19
descriptor 2:    00 00 00 0f 00 00 00 00 00 00 00 00 00 25 d9 06 6a 00
descriptor 3:    00 00 00 fe 00 53 41 4d 53 55 4e 47 0a 20 20 20 20 20
descriptor 4:    00 00 00 fe 00 4c 54 4e 31 35 36 41 54 31 36 4c 30 31
extensions:      00
checksum:        1f

EDID version: 1.3
Manufacturer: LEN Model 40b0 Serial Number --
Made in year 2010
Digital display
Maximum image size: 34 cm x 19 cm
Gamma: 2.20
DPMS levels: Standby Suspend Off
RGB color display
First detailed timing is preferred timing
Display x,y Chromaticity:
  Red:   0.6201, 0.3398
  Green: 0.3300, 0.5703
  Blue:  0.1503, 0.0595
  White: 0.3134, 0.3291
Established timings supported:
Standard timings supported:
Detailed mode: Clock 78.020 MHz, 344 mm x 194 mm
               1366 1414 1446 1646 hborder 0
                768  770  775  790 vborder 0
               -hsync -vsync 
               VertFreq: 59 Hz, HorFreq: 47399 Hz
Manufacturer-specified data, tag 15
ASCII string: SAMSUNG
ASCII string: LTN156AT16L01
Checksum: 0x1f (valid)
EDID block does NOT conform to EDID 1.3!
	Missing name descriptor
	Missing monitor ranges
