edid-decode (hex):

00 ff ff ff ff ff ff 00 30 ae b0 40 00 00 00 00
00 14 01 03 80 23 13 78 ea 62 25 9f 5d 57 9b 25
19 50 54 00 00 00 01 01 01 01 01 01 01 01 01 01
01 01 01 01 01 01 ee 1b 56 8e 50 00 16 30 30 20
35 00 59 c2 10 00 00 19 4d 17 56 90 50 00 16 30
30 20 35 00 59 c2 10 00 00 19 00 00 00 0f 00 8c
09 32 8c 09 28 16 09 00 30 e4 6c 02 00 00 00 fe
00 4c 50 31 35 36 57 48 32 2d 54 4c 42 41 00 21

----------------

Block 0, Base EDID:
  EDID Structure Version & Revision: 1.3
  Vendor & Product Identification:
    Manufacturer: LEN
    Model: 16560
    Made in: 2010
  Basic Display Parameters & Features:
    Digital display
    Maximum image size: 35 cm x 19 cm
    Gamma: 2.20
    DPMS levels: Standby Suspend Off
    RGB color display
    First detailed timing is preferred timing
  Color Characteristics:
    Red  : 0.6220, 0.3652
    Green: 0.3398, 0.6074
    Blue : 0.1445, 0.0996
    White: 0.3134, 0.3291
  Established Timings I & II: none
  Standard Timings: none
  Detailed Timing Descriptors:
    DTD 1:  1366x768    60.017 Hz 683:384  47.414 kHz  71.500 MHz (345 mm x 194 mm)
                 Hfront   48 Hsync  32 Hback  62 Hpol N
                 Vfront    3 Vsync   5 Vback  14 Vpol N
    DTD 2:  1366x768    50.004 Hz 683:384  39.503 kHz  59.650 MHz (345 mm x 194 mm)
                 Hfront   48 Hsync  32 Hback  64 Hpol N
                 Vfront    3 Vsync   5 Vback  14 Vpol N
    Manufacturer-Specified Display Descriptor (0x0f): 00 0f 00 8c 09 32 8c 09 28 16 09 00 30 e4 6c 02 '.....2..(...0.l.'
    Alphanumeric Data String: 'LP156WH2-TLBA'
Checksum: 0x21

----------------

Failures:

Block 0, Base EDID:
  Missing Display Product Name.
  Missing Display Range Limits Descriptor.

EDID conformity: FAIL
