
EDID (hex):
00ffffffffffff0030aeb04000000000
0012010380231378ea4e859e5b559526
1a505400000001010101010101010101
0101010101013e1c56a0500016303020
350059c2100000198c1756a050001630
3020350059c2100000190000000f008c
09328c092816090030e4c701000000fe
004c503135365748322d544c413100e5

Extracted contents:
header:          00 ff ff ff ff ff ff 00
serial number:   30 ae b0 40 00 00 00 00 00 12
version:         01 03
basic params:    80 23 13 78 ea
chroma info:     4e 85 9e 5b 55 95 26 1a 50 54
established:     00 00 00
standard:        01 01 01 01 01 01 01 01 01 01 01 01 01 01 01 01
descriptor 1:    3e 1c 56 a0 50 00 16 30 30 20 35 00 59 c2 10 00 00 19
descriptor 2:    8c 17 56 a0 50 00 16 30 30 20 35 00 59 c2 10 00 00 19
descriptor 3:    00 00 00 0f 00 8c 09 32 8c 09 28 16 09 00 30 e4 c7 01
descriptor 4:    00 00 00 fe 00 4c 50 31 35 36 57 48 32 2d 54 4c 41 31
extensions:      00
checksum:        e5

EDID version: 1.3
Manufacturer: LEN Model 40b0 Serial Number --
Made in year 2008
Digital display
Maximum image size: 35 cm x 19 cm
Gamma: 2.20
DPMS levels: Standby Suspend Off
RGB color display
First detailed timing is preferred timing
Display x,y Chromaticity:
  Red:   0.6181, 0.3554
  Green: 0.3349, 0.5839
  Blue:  0.1503, 0.1015
  White: 0.3134, 0.3291
Established timings supported:
Standard timings supported:
Detailed mode: Clock 72.300 MHz, 345 mm x 194 mm
               1366 1414 1446 1526 hborder 0
                768  771  776  790 vborder 0
               -hsync -vsync 
               VertFreq: 59 Hz, HorFreq: 47378 Hz
Detailed mode: Clock 60.280 MHz, 345 mm x 194 mm
               1366 1414 1446 1526 hborder 0
                768  771  776  790 vborder 0
               -hsync -vsync 
               VertFreq: 50 Hz, HorFreq: 39501 Hz
Manufacturer-specified data, tag 15
ASCII string: LP156WH2-TLA1
Checksum: 0xe5 (valid)
EDID block does NOT conform to EDID 1.3!
	Missing name descriptor
	Missing monitor ranges
