edid-decode (hex):

00 ff ff ff ff ff ff 00 30 ae b0 40 00 00 00 00
00 13 01 03 80 23 13 78 ea 62 25 9f 5d 57 9b 25
19 50 54 00 00 00 01 01 01 01 01 01 01 01 01 01
01 01 01 01 01 01 12 1b 56 78 50 00 0e 30 20 20
24 00 59 c2 10 00 00 19 b2 16 56 78 50 00 0e 30
20 20 24 00 59 c2 10 00 00 19 00 00 00 0f 00 8c
09 32 8c 09 28 16 09 00 30 e4 30 02 00 00 00 fe
00 4c 50 31 35 36 57 48 32 2d 54 4c 41 41 00 57

----------------

Block 0, Base EDID:
  EDID Structure Version & Revision: 1.3
  Vendor & Product Identification:
    Manufacturer: LEN
    Model: 16560
    Made in: 2009
  Basic Display Parameters & Features:
    Digital display
    Maximum image size: 35 cm x 19 cm
    Gamma: 2.20
    DPMS levels: Standby Suspend Off
    RGB color display
    First detailed timing is the preferred timing
  Color Characteristics:
    Red  : 0.6220, 0.3652
    Green: 0.3398, 0.6074
    Blue : 0.1445, 0.0996
    White: 0.3134, 0.3291
  Established Timings I & II: none
  Standard Timings: none
  Detailed Timing Descriptors:
    DTD 1:  1366x768    59.635885 Hz 683:384   46.635 kHz     69.300000 MHz (345 mm x 194 mm)
                 Hfront   32 Hsync  32 Hback   56 Hpol N
                 Vfront    2 Vsync   4 Vback    8 Vpol N
    DTD 2:  1366x768    49.997763 Hz 683:384   39.098 kHz     58.100000 MHz (345 mm x 194 mm)
                 Hfront   32 Hsync  32 Hback   56 Hpol N
                 Vfront    2 Vsync   4 Vback    8 Vpol N
    Manufacturer-Specified Display Descriptor (0x0f): 00 0f 00 8c 09 32 8c 09 28 16 09 00 30 e4 30 02 '.....2..(...0.0.'
    Alphanumeric Data String: 'LP156WH2-TLAA'
Checksum: 0x57

----------------

Failures:

Block 0, Base EDID:
  Missing Display Product Name.
  Missing Display Range Limits Descriptor.

EDID conformity: FAIL
