
EDID (hex):
00ffffffffffff0030aeb04000000000
0013010380221378eac8959e57549226
0f505400000001010101010101010101
0101010101011b1c5698500016303020
250058c210000019ca16566f50001630
3020250058c2100000190000000f008c
09328c09281609004ca34154000000fe
004c544e313536415430353430310036

Extracted contents:
header:          00 ff ff ff ff ff ff 00
serial number:   30 ae b0 40 00 00 00 00 00 13
version:         01 03
basic params:    80 22 13 78 ea
chroma info:     c8 95 9e 57 54 92 26 0f 50 54
established:     00 00 00
standard:        01 01 01 01 01 01 01 01 01 01 01 01 01 01 01 01
descriptor 1:    1b 1c 56 98 50 00 16 30 30 20 25 00 58 c2 10 00 00 19
descriptor 2:    ca 16 56 6f 50 00 16 30 30 20 25 00 58 c2 10 00 00 19
descriptor 3:    00 00 00 0f 00 8c 09 32 8c 09 28 16 09 00 4c a3 41 54
descriptor 4:    00 00 00 fe 00 4c 54 4e 31 35 36 41 54 30 35 34 30 31
extensions:      00
checksum:        36

EDID version: 1.3
Manufacturer: LEN Model 40b0 Serial Number --
Made in year 2009
Digital display
Maximum image size: 34 cm x 19 cm
Gamma: 2.20
DPMS levels: Standby Suspend Off
RGB color display
First detailed timing is preferred timing
Display x,y Chromaticity:
  Red:   0.6201, 0.3398
  Green: 0.3300, 0.5703
  Blue:  0.1503, 0.0595
  White: 0.3134, 0.3291
Established timings supported:
Standard timings supported:
Detailed mode: Clock 71.950 MHz, 344 mm x 194 mm
               1366 1414 1446 1518 hborder 0
                768  770  775  790 vborder 0
               -hsync -vsync 
               VertFreq: 59 Hz, HorFreq: 47397 Hz
Detailed mode: Clock 58.340 MHz, 344 mm x 194 mm
               1366 1414 1446 1477 hborder 0
                768  770  775  790 vborder 0
               -hsync -vsync 
               VertFreq: 49 Hz, HorFreq: 39498 Hz
Manufacturer-specified data, tag 15
ASCII string: LTN156AT05401
Checksum: 0x36 (valid)
EDID block does NOT conform to EDID 1.3!
	Missing name descriptor
	Missing monitor ranges
