
EDID (hex):
00ffffffffffff0030aeb04000000000
3513010380231378ea7b959c57579429
15505400000001010101010101010101
010101010101451d56bb500024303825
460058c1100000189c1756a850001430
3322350058c1100000180000000f008c
09328c09281609000daf5014000000fe
004e31353642362d4c30410a20200083

Extracted contents:
header:          00 ff ff ff ff ff ff 00
serial number:   30 ae b0 40 00 00 00 00 35 13
version:         01 03
basic params:    80 23 13 78 ea
chroma info:     7b 95 9c 57 57 94 29 15 50 54
established:     00 00 00
standard:        01 01 01 01 01 01 01 01 01 01 01 01 01 01 01 01
descriptor 1:    45 1d 56 bb 50 00 24 30 38 25 46 00 58 c1 10 00 00 18
descriptor 2:    9c 17 56 a8 50 00 14 30 33 22 35 00 58 c1 10 00 00 18
descriptor 3:    00 00 00 0f 00 8c 09 32 8c 09 28 16 09 00 0d af 50 14
descriptor 4:    00 00 00 fe 00 4e 31 35 36 42 36 2d 4c 30 41 0a 20 20
extensions:      00
checksum:        83

EDID version: 1.3
Manufacturer: LEN Model 40b0 Serial Number --
Made in week 53 of 2009
Digital display
Maximum image size: 35 cm x 19 cm
Gamma: 2.20
DPMS levels: Standby Suspend Off
RGB color display
First detailed timing is preferred timing
Display x,y Chromaticity:
  Red:   0.6103, 0.3427
  Green: 0.3417, 0.5810
  Blue:  0.1621, 0.0830
  White: 0.3134, 0.3291
Established timings supported:
Standard timings supported:
Detailed mode: Clock 74.930 MHz, 344 mm x 193 mm
               1366 1422 1459 1553 hborder 0
                768  772  778  804 vborder 0
               -hsync -vsync 
               VertFreq: 60 Hz, HorFreq: 48248 Hz
Detailed mode: Clock 60.440 MHz, 344 mm x 193 mm
               1366 1417 1451 1534 hborder 0
                768  771  776  788 vborder 0
               -hsync -vsync 
               VertFreq: 50 Hz, HorFreq: 39400 Hz
Manufacturer-specified data, tag 15
ASCII string: N156B6-L0A
Checksum: 0x83 (valid)
EDID block does NOT conform to EDID 1.3!
	Missing name descriptor
	Missing monitor ranges
