edid-decode (hex):

00 ff ff ff ff ff ff 00 4c 2e 13 22 cd 33 22 06
11 16 01 03 68 2c 19 78 2a c9 05 a3 57 4b 9c 25
12 50 54 af cf 00 81 40 81 80 a9 c0 95 00 95 0f
95 0a 95 0c 01 01 79 2e 40 10 62 84 20 30 70 98
13 00 bb f9 10 00 00 1c 66 21 50 00 51 00 1b 30
40 70 36 00 30 e4 10 00 00 1a 00 00 00 fd 00 38
4c 1f 53 11 00 0a 20 20 20 20 20 20 00 00 00 fc
00 4c 45 44 20 4d 4f 4e 49 54 4f 52 0a 20 00 37

00 ff ff ff ff ff ff 00 4c 2e 13 22 cd 33 22 06
11 16 01 03 68 2c 19 78 2a c9 05 a3 57 4b 9c 25
12 50 54 af cf 00 81 40 81 80 a9 c0 95 00 95 0f
95 0a 95 0c 01 01 79 2e 40 10 62 84 20 30 70 98
13 00 bb f9 10 00 00 1c 66 21 50 00 51 00 1b 30
40 70 36 00 30 e4 10 00 00 1a 00 00 00 fd 00 38
4c 1f 53 11 00 0a 20 20 20 20 20 20 00 00 00 fc
00 4c 45 44 20 4d 4f 4e 49 54 4f 52 0a 20 00 37

----------------

Block 0, Base EDID:
  EDID Structure Version & Revision: 1.3
  Vendor & Product Identification:
    Manufacturer: SAN
    Model: 8723
    Serial Number: ...
    Made in: week 17 of 2012
  Basic Display Parameters & Features:
    Analog display
    Signal Level Standard: 0.700 : 0.000 : 0.700 V p-p
    Blank level equals black level
    Sync: Separate
    Maximum image size: 44 cm x 25 cm
    Gamma: 2.20
    DPMS levels: Off
    RGB color display
    First detailed timing is the preferred timing
  Color Characteristics:
    Red  : 0.6396, 0.3398
    Green: 0.2949, 0.6103
    Blue : 0.1445, 0.0703
    White: 0.3134, 0.3291
  Established Timings I & II:
    IBM     :   720x400    70.081663 Hz   9:5     31.467 kHz     28.320000 MHz
    DMT 0x04:   640x480    59.940476 Hz   4:3     31.469 kHz     25.175000 MHz
    DMT 0x05:   640x480    72.808802 Hz   4:3     37.861 kHz     31.500000 MHz
    DMT 0x06:   640x480    75.000000 Hz   4:3     37.500 kHz     31.500000 MHz
    DMT 0x08:   800x600    56.250000 Hz   4:3     35.156 kHz     36.000000 MHz
    DMT 0x09:   800x600    60.316541 Hz   4:3     37.879 kHz     40.000000 MHz
    DMT 0x0a:   800x600    72.187572 Hz   4:3     48.077 kHz     50.000000 MHz
    DMT 0x0b:   800x600    75.000000 Hz   4:3     46.875 kHz     49.500000 MHz
    DMT 0x10:  1024x768    60.003840 Hz   4:3     48.363 kHz     65.000000 MHz
    DMT 0x11:  1024x768    70.069359 Hz   4:3     56.476 kHz     75.000000 MHz
    DMT 0x12:  1024x768    75.028582 Hz   4:3     60.023 kHz     78.750000 MHz
    DMT 0x24:  1280x1024   75.024675 Hz   5:4     79.976 kHz    135.000000 MHz
  Standard Timings:
    DMT 0x20:  1280x960    60.000000 Hz   4:3     60.000 kHz    108.000000 MHz
    DMT 0x23:  1280x1024   60.019740 Hz   5:4     63.981 kHz    108.000000 MHz
    DMT 0x53:  1600x900    60.000000 Hz  16:9     60.000 kHz    108.000000 MHz (RB)
    DMT 0x2f:  1440x900    59.887445 Hz  16:10    55.935 kHz    106.500000 MHz
    DMT 0x30:  1440x900    74.984427 Hz  16:10    70.635 kHz    136.750000 MHz
    GTF     :  1440x900    69.999868 Hz  16:10    65.590 kHz    126.982000 MHz
    GTF     :  1440x900    72.000167 Hz  16:10    67.536 kHz    130.750000 MHz
  Detailed Timing Descriptors:
    DTD 1:  1600x900    59.986003 Hz  16:9     55.907 kHz    118.970000 MHz (443 mm x 249 mm)
                 Hfront  112 Hsync 152 Hback  264 Hpol N
                 Vfront    1 Vsync   3 Vback   28 Vpol P
    DTD 2:  1360x768    66.551466 Hz  85:48    52.908 kHz     85.500000 MHz (304 mm x 228 mm)
                 Hfront   64 Hsync 112 Hback   80 Hpol P
                 Vfront    3 Vsync   6 Vback   18 Vpol N
    Display Range Limits:
      Monitor ranges (GTF): 56-76 Hz V, 31-83 kHz H, max dotclock 170 MHz
    Display Product Name: 'LED MONITOR'
Checksum: 0x37

----------------

Block 1, Unknown EDID Extension Block 0x00:
  00 ff ff ff ff ff ff 00 4c 2e 13 22 cd 33 22 06 '........L..".3".'
  11 16 01 03 68 2c 19 78 2a c9 05 a3 57 4b 9c 25 '....h,.x*...WK.%'
  12 50 54 af cf 00 81 40 81 80 a9 c0 95 00 95 0f '.PT....@........'
  95 0a 95 0c 01 01 79 2e 40 10 62 84 20 30 70 98 '......y.@.b. 0p.'
  13 00 bb f9 10 00 00 1c 66 21 50 00 51 00 1b 30 '........f!P.Q..0'
  40 70 36 00 30 e4 10 00 00 1a 00 00 00 fd 00 38 '@p6.0..........8'
  4c 1f 53 11 00 0a 20 20 20 20 20 20 00 00 00 fc 'L.S...      ....'
  00 4c 45 44 20 4d 4f 4e 49 54 4f 52 0a 20 00 37 '.LED MONITOR. .7'
Checksum: 0x37

----------------

Failures:

Block 0, Base EDID:
  Detailed Timing Descriptor #2: Mismatch of image size 304x228 mm vs display size 440x250 mm.
Block 1, Base EDID:
  Unknown Extension Block.
EDID:
  Base EDID: EDID specified 0 extension block(s), but found 1 extension block(s).

EDID conformity: FAIL
