edid-decode (hex):

00 ff ff ff ff ff ff 00 4a 84 00 11 01 00 00 00
0a 21 01 04 b5 22 0a 78 02 86 e5 ae 4f 44 ab 24
0f 50 54 00 00 00 01 01 01 01 01 01 01 01 01 01
01 01 01 01 01 01 a8 6b 00 a0 f0 4c 30 40 30 20
35 00 58 63 10 00 00 1a 00 00 00 fc 00 48 59 54
45 20 59 37 30 54 6f 75 63 68 00 00 00 ff 00 0a
20 20 20 20 20 20 20 20 20 20 20 20 23 1d 80 a0
70 26 30 20 30 20 35 00 58 63 10 00 00 1a 00 42

00 ff ff ff ff ff ff 00 4a 84 00 11 01 00 00 00
0a 21 01 04 b5 22 0a 78 02 86 e5 ae 4f 44 ab 24
0f 50 54 00 00 00 01 01 01 01 01 01 01 01 01 01
01 01 01 01 01 01 a8 6b 00 a0 f0 4c 30 40 30 20
35 00 58 63 10 00 00 1a 00 00 00 fc 00 48 59 54
45 20 59 37 30 54 6f 75 63 68 00 00 00 ff 00 0a
20 20 20 20 20 20 20 20 20 20 20 20 23 1d 80 a0
70 26 30 20 30 20 35 00 58 63 10 00 00 1a 00 42

----------------

Block 0, Base EDID:
  EDID Structure Version & Revision: 1.4
  Vendor & Product Identification:
    Manufacturer: RTD
    Model: 4352
    Serial Number: ...
    Made in: week 10 of 2023
  Basic Display Parameters & Features:
    Digital display
    Bits per primary color channel: 10
    DisplayPort interface
    Maximum image size: 34 cm x 10 cm
    Gamma: 2.20
    Supported color formats: RGB 4:4:4
    First detailed timing includes the native pixel format and preferred refresh rate
  Color Characteristics:
    Red  : 0.6816, 0.3085
    Green: 0.2666, 0.6699
    Blue : 0.1435, 0.0605
    White: 0.3134, 0.3291
  Established Timings I & II: none
  Standard Timings: none
  Detailed Timing Descriptors:
    DTD 1:  3840x1100   60.017422 Hz 192:55    68.900 kHz    275.600000 MHz (344 mm x 99 mm)
                 Hfront   48 Hsync  32 Hback   80 Hpol P
                 Vfront    3 Vsync   5 Vback   40 Vpol N
    Display Product Name: 'HYTE Y70Touch'
    Display Product Serial Number: ...
    DTD 2:  1920x550    59.967520 Hz 192:55    35.861 kHz     74.590000 MHz (344 mm x 99 mm)
                 Hfront   48 Hsync  32 Hback   80 Hpol P
                 Vfront    3 Vsync   5 Vback   40 Vpol N
Checksum: 0x42

----------------

Block 1, Unknown EDID Extension Block 0x00:
  00 ff ff ff ff ff ff 00 4a 84 00 11 01 00 00 00 '........J.......'
  0a 21 01 04 b5 22 0a 78 02 86 e5 ae 4f 44 ab 24 '.!...".x....OD.$'
  0f 50 54 00 00 00 01 01 01 01 01 01 01 01 01 01 '.PT.............'
  01 01 01 01 01 01 a8 6b 00 a0 f0 4c 30 40 30 20 '.......k...L0@0 '
  35 00 58 63 10 00 00 1a 00 00 00 fc 00 48 59 54 '5.Xc.........HYT'
  45 20 59 37 30 54 6f 75 63 68 00 00 00 ff 00 0a 'E Y70Touch......'
  20 20 20 20 20 20 20 20 20 20 20 20 23 1d 80 a0 '            #...'
  70 26 30 20 30 20 35 00 58 63 10 00 00 1a 00 42 'p&0 0 5.Xc.....B'
Checksum: 0x42

----------------

Failures:

Block 0, Base EDID:
  Display Product Serial Number: ...
  Detailed Timing Descriptor #2: Invalid detailed timing descriptor ordering.
Block 1, Base EDID:
  Unknown Extension Block.
EDID:
  Base EDID: EDID specified 0 extension block(s), but found 1 extension block(s).

EDID conformity: FAIL
