
EDID (hex):
00ffffffffffff0049330907d2029649
2615010308291778ea72b4a655489d25
155054a54a0001010101010101010101
010101010101662150b051001b304070
36009ae61000001e000000fc00484439
31354c0a202020202020000000fd0038
4b1e5009000a202020202020000000ff
0030303030594442394e31393236004f

Extracted contents:
header:          00 ff ff ff ff ff ff 00
serial number:   49 33 09 07 d2 02 96 49 26 15
version:         01 03
basic params:    08 29 17 78 ea
chroma info:     72 b4 a6 55 48 9d 25 15 50 54
established:     a5 4a 00
standard:        01 01 01 01 01 01 01 01 01 01 01 01 01 01 01 01
descriptor 1:    66 21 50 b0 51 00 1b 30 40 70 36 00 9a e6 10 00 00 1e
descriptor 2:    00 00 00 fc 00 48 44 39 31 35 4c 0a 20 20 20 20 20 20
descriptor 3:    00 00 00 fd 00 38 4b 1e 50 09 00 0a 20 20 20 20 20 20
descriptor 4:    00 00 00 ff 00 30 30 30 30 59 44 42 39 4e 31 39 32 36
extensions:      00
checksum:        4f

EDID version: 1.3
Manufacturer: RIS Model 709 Serial Number --
Made in week 38 of 2011
Analog display, Input voltage level: 0.7/0.3 V
Sync: Separate 
Maximum image size: 41 cm x 23 cm
Gamma: 2.20
DPMS levels: Standby Suspend Off
RGB color display
First detailed timing is preferred timing
Display x,y Chromaticity:
  Red:   0.6494, 0.3349
  Green: 0.2812, 0.6152
  Blue:  0.1464, 0.0849
  White: 0.3134, 0.3281
Established timings supported:
  720x400@70Hz 9:5 HorFreq: 31469 Hz Clock: 28.320 MHz
  640x480@60Hz 4:3 HorFreq: 31469 Hz Clock: 25.175 MHz
  640x480@75Hz 4:3 HorFreq: 37500 Hz Clock: 31.500 MHz
  800x600@60Hz 4:3 HorFreq: 37900 Hz Clock: 40.000 MHz
  800x600@75Hz 4:3 HorFreq: 46900 Hz Clock: 49.500 MHz
  1024x768@60Hz 4:3 HorFreq: 48400 Hz Clock: 65.000 MHz
  1024x768@75Hz 4:3 HorFreq: 60000 Hz Clock: 78.750 MHz
Standard timings supported:
Detailed mode: Clock 85.500 MHz, 410 mm x 230 mm
               1360 1424 1536 1792 hborder 0
                768  771  777  795 vborder 0
               +hsync +vsync 
               VertFreq: 60 Hz, HorFreq: 47712 Hz
Monitor name: HD915L
Monitor ranges (GTF): 56-75Hz V, 30-80kHz H, max dotclock 90MHz
Serial number: --
Checksum: 0x4f (valid)


