edid-decode (hex):

00 ff ff ff ff ff ff 00 10 ac 35 40 4c 38 35 30
12 14 01 03 80 41 29 78 ea 8d 85 ad 4f 35 b1 25
0e 50 54 a5 4b 00 81 80 a9 40 d1 00 d1 40 71 4f
81 00 b3 00 01 01 b0 68 00 a0 a0 40 2e 60 30 20
36 00 81 90 21 00 00 1e 00 00 00 ff 00 47 35 30
31 48 30 35 37 30 35 38 4c 0a 28 3c 80 a0 70 b0
23 40 30 20 36 00 81 91 21 00 00 1c 00 00 00 fd
00 31 56 1d 71 1c 00 0a 20 20 20 20 20 20 00 76

----------------

Block 0, Base EDID:
  EDID Structure Version & Revision: 1.3
  Vendor & Product Identification:
    Manufacturer: DEL
    Model: 16437
    Serial Number: ...
    Made in: week 18 of 2010
  Basic Display Parameters & Features:
    Digital display
    Maximum image size: 65 cm x 41 cm
    Gamma: 2.20
    DPMS levels: Standby Suspend Off
    RGB color display
    First detailed timing is the preferred timing
  Color Characteristics:
    Red  : 0.6777, 0.3085
    Green: 0.2099, 0.6923
    Blue : 0.1464, 0.0546
    White: 0.3134, 0.3291
  Established Timings I & II:
    IBM     :   720x400    70.082 Hz   9:5    31.467 kHz  28.320 MHz
    DMT 0x04:   640x480    59.940 Hz   4:3    31.469 kHz  25.175 MHz
    DMT 0x06:   640x480    75.000 Hz   4:3    37.500 kHz  31.500 MHz
    DMT 0x09:   800x600    60.317 Hz   4:3    37.879 kHz  40.000 MHz
    DMT 0x0b:   800x600    75.000 Hz   4:3    46.875 kHz  49.500 MHz
    DMT 0x10:  1024x768    60.004 Hz   4:3    48.363 kHz  65.000 MHz
    DMT 0x12:  1024x768    75.029 Hz   4:3    60.023 kHz  78.750 MHz
    DMT 0x24:  1280x1024   75.025 Hz   5:4    79.976 kHz 135.000 MHz
  Standard Timings:
    DMT 0x23:  1280x1024   60.020 Hz   5:4    63.981 kHz 108.000 MHz
    DMT 0x33:  1600x1200   60.000 Hz   4:3    75.000 kHz 162.000 MHz
    DMT 0x45:  1920x1200   59.885 Hz  16:10   74.556 kHz 193.250 MHz
    DMT 0x49:  1920x1440   60.000 Hz   4:3    90.000 kHz 234.000 MHz
    DMT 0x15:  1152x864    75.000 Hz   4:3    67.500 kHz 108.000 MHz
    DMT 0x1c:  1280x800    59.810 Hz  16:10   49.702 kHz  83.500 MHz
    DMT 0x3a:  1680x1050   59.954 Hz  16:10   65.290 kHz 146.250 MHz
  Detailed Timing Descriptors:
    DTD 1:  2560x1600   59.860 Hz   8:5    98.529 kHz 268.000 MHz (641 mm x 400 mm)
                 Hfront   48 Hsync  32 Hback  80 Hpol P
                 Vfront    3 Vsync   6 Vback  37 Vpol P
    Display Product Serial Number: ...
    DTD 2:  1920x1200   59.950 Hz   8:5    74.038 kHz 154.000 MHz (641 mm x 401 mm)
                 Hfront   48 Hsync  32 Hback  80 Hpol N
                 Vfront    3 Vsync   6 Vback  26 Vpol P
  Display Range Limits:
    Monitor ranges (GTF): 49-86 Hz V, 29-113 kHz H, max dotclock 280 MHz
Checksum: 0x76

----------------

Failures:

Block 0, Base EDID:
  Detailed Timing Descriptor #2: Invalid detailed timing descriptor ordering.
  Missing Display Product Name.

EDID conformity: FAIL
