
EDID (hex):
00ffffffffffff0022f0720a01010101
3013010380291f78eea6a5a3574a9d25
125054a52b8031594559615981408180
8199a9400101483f403062b0324040c0
130098321100001e000000fd0030551e
5c11000a202020202020000000fc0048
50204c50323036350a202020000000ff
00434e47393438303035510a2020006e

Extracted contents:
header:          00 ff ff ff ff ff ff 00
serial number:   22 f0 72 0a 01 01 01 01 30 13
version:         01 03
basic params:    80 29 1f 78 ee
chroma info:     a6 a5 a3 57 4a 9d 25 12 50 54
established:     a5 2b 80
standard:        31 59 45 59 61 59 81 40 81 80 81 99 a9 40 01 01
descriptor 1:    48 3f 40 30 62 b0 32 40 40 c0 13 00 98 32 11 00 00 1e
descriptor 2:    00 00 00 fd 00 30 55 1e 5c 11 00 0a 20 20 20 20 20 20
descriptor 3:    00 00 00 fc 00 48 50 20 4c 50 32 30 36 35 0a 20 20 20
descriptor 4:    00 00 00 ff 00 43 4e 47 39 34 38 30 30 35 51 0a 20 20
extensions:      00
checksum:        6e

EDID version: 1.3
Manufacturer: HWP Model a72 Serial Number --
Made in week 48 of 2009
Digital display
Maximum image size: 41 cm x 31 cm
Gamma: 2.20
DPMS levels: Standby Suspend Off
RGB color display
Default (sRGB) color space is primary color space
First detailed timing is preferred timing
Display x,y Chromaticity:
  Red:   0.6386, 0.3417
  Green: 0.2900, 0.6152
  Blue:  0.1464, 0.0722
  White: 0.3134, 0.3291
Established timings supported:
  720x400@70Hz 9:5 HorFreq: 31469 Hz Clock: 28.320 MHz
  640x480@60Hz 4:3 HorFreq: 31469 Hz Clock: 25.175 MHz
  640x480@75Hz 4:3 HorFreq: 37500 Hz Clock: 31.500 MHz
  800x600@60Hz 4:3 HorFreq: 37900 Hz Clock: 40.000 MHz
  832x624@75Hz 4:3 HorFreq: 49726 Hz Clock: 57.284 MHz
  1024x768@60Hz 4:3 HorFreq: 48400 Hz Clock: 65.000 MHz
  1024x768@75Hz 4:3 HorFreq: 60000 Hz Clock: 78.750 MHz
  1280x1024@75Hz 5:4 HorFreq: 80000 Hz Clock: 135.000 MHz
  1152x870@75Hz 192:145 HorFreq: 67500 Hz Clock: 108.000 MHz
Standard timings supported:
  640x480@85Hz 4:3 HorFreq: 43300 Hz Clock: 36.000 MHz
  800x600@85Hz 4:3 HorFreq: 53700 Hz Clock: 56.250 MHz
  1024x768@85Hz 4:3 HorFreq: 68700 Hz Clock: 94.500 MHz
  1280x960@60Hz 4:3 HorFreq: 60000 Hz Clock: 108.000 MHz
  1280x1024@60Hz 5:4 HorFreq: 64000 Hz Clock: 108.000 MHz
  1280x1024@85Hz 5:4 HorFreq: 91100 Hz Clock: 157.500 MHz
  1600x1200@60Hz 4:3 HorFreq: 75000 Hz Clock: 162.000 MHz
Detailed mode: Clock 162.000 MHz, 408 mm x 306 mm
               1600 1664 1856 2160 hborder 0
               1200 1201 1204 1250 vborder 0
               +hsync +vsync 
               VertFreq: 60 Hz, HorFreq: 75000 Hz
Monitor ranges (GTF): 48-85Hz V, 30-92kHz H, max dotclock 170MHz
Monitor name: HP LP2065
Serial number: --
Checksum: 0x6e (valid)
EDID block does NOT conform to EDID 1.3!
	sRGB is signaled, but the chromaticities do not match


