
EDID (hex):
00ffffffffffff00410cd1c09a1f0000
271901046e341d782a2ac5a4564f9e28
0f5054bd4b00d1c0b300950081c0950f
818001010101023a801871382d40582c
450009252100001e000000ff005a5630
31353339303038303930000000fc0050
484c2032343356350a202020000000fd
00384c1e5311000a20202020202000f0

Extracted contents:
header:          00 ff ff ff ff ff ff 00
serial number:   41 0c d1 c0 9a 1f 00 00 27 19
version:         01 04
basic params:    6e 34 1d 78 2a
chroma info:     2a c5 a4 56 4f 9e 28 0f 50 54
established:     bd 4b 00
standard:        d1 c0 b3 00 95 00 81 c0 95 0f 81 80 01 01 01 01
descriptor 1:    02 3a 80 18 71 38 2d 40 58 2c 45 00 09 25 21 00 00 1e
descriptor 2:    00 00 00 ff 00 5a 56 30 31 35 33 39 30 30 38 30 39 30
descriptor 3:    00 00 00 fc 00 50 48 4c 20 32 34 33 56 35 0a 20 20 20
descriptor 4:    00 00 00 fd 00 38 4c 1e 53 11 00 0a 20 20 20 20 20 20
extensions:      00
checksum:        f0

EDID version: 1.4
Manufacturer: PHL Model c0d1 Serial Number --
Made in week 39 of 2015
Analog display, Input voltage level: 0.7/0.7 V
Blank level equals black level
Sync: Separate Composite SyncOnGreen 
Maximum image size: 52 cm x 29 cm
Gamma: 2.20
DPMS levels: Off
RGB color display
First detailed timing includes the native pixel format and preferred refresh rate
Display x,y Chromaticity:
  Red:   0.6406, 0.3378
  Green: 0.3105, 0.6191
  Blue:  0.1591, 0.0585
  White: 0.3134, 0.3291
Established timings supported:
  720x400@70Hz 9:5 HorFreq: 31469 Hz Clock: 28.320 MHz
  640x480@60Hz 4:3 HorFreq: 31469 Hz Clock: 25.175 MHz
  640x480@67Hz 4:3 HorFreq: 35000 Hz Clock: 30.240 MHz
  640x480@72Hz 4:3 HorFreq: 37900 Hz Clock: 31.500 MHz
  640x480@75Hz 4:3 HorFreq: 37500 Hz Clock: 31.500 MHz
  800x600@60Hz 4:3 HorFreq: 37900 Hz Clock: 40.000 MHz
  800x600@75Hz 4:3 HorFreq: 46900 Hz Clock: 49.500 MHz
  1024x768@60Hz 4:3 HorFreq: 48400 Hz Clock: 65.000 MHz
  1024x768@75Hz 4:3 HorFreq: 60000 Hz Clock: 78.750 MHz
  1280x1024@75Hz 5:4 HorFreq: 80000 Hz Clock: 135.000 MHz
Standard timings supported:
  1920x1080@60Hz 16:9
  1680x1050@60Hz 16:10 HorFreq: 64700 Hz Clock: 119.000 MHz
  1440x900@60Hz 16:10 HorFreq: 55500 Hz Clock: 88.750 MHz
  1280x720@60Hz 16:9
  1440x900@75Hz 16:10 HorFreq: 82300 Hz Clock: 156.000 MHz
  1280x1024@60Hz 5:4 HorFreq: 64000 Hz Clock: 108.000 MHz
Detailed mode: Clock 148.500 MHz, 521 mm x 293 mm
               1920 2008 2052 2200 hborder 0
               1080 1084 1089 1125 vborder 0
               +hsync +vsync 
               VertFreq: 60 Hz, HorFreq: 67500 Hz
Serial number: --
Monitor name: PHL 243V5
Monitor ranges (GTF): 56-76Hz V, 30-83kHz H, max dotclock 170MHz
Checksum: 0xf0 (valid)
