
EDID (hex):
00ffffffffffff004dd9021a01010101
0115010308a05a780a0dc9a057479827
12484c21080081c08180010101010101
010101010101023a801871382d40582c
450040846300001e662150b051001b30
4070360040846300001e000000fd0039
3f1e500f000a202020202020000000fc
00534f4e592054560a20202020200077

Extracted contents:
header:          00 ff ff ff ff ff ff 00
serial number:   4d d9 02 1a 01 01 01 01 01 15
version:         01 03
basic params:    08 a0 5a 78 0a
chroma info:     0d c9 a0 57 47 98 27 12 48 4c
established:     21 08 00
standard:        81 c0 81 80 01 01 01 01 01 01 01 01 01 01 01 01
descriptor 1:    02 3a 80 18 71 38 2d 40 58 2c 45 00 40 84 63 00 00 1e
descriptor 2:    66 21 50 b0 51 00 1b 30 40 70 36 00 40 84 63 00 00 1e
descriptor 3:    00 00 00 fd 00 39 3f 1e 50 0f 00 0a 20 20 20 20 20 20
descriptor 4:    00 00 00 fc 00 53 4f 4e 59 20 54 56 0a 20 20 20 20 20
extensions:      00
checksum:        77

EDID version: 1.3
Manufacturer: SNY Model 1a02 Serial Number --
Made in week 1 of 2011
Analog display, Input voltage level: 0.7/0.3 V
Sync: Separate 
Maximum image size: 160 cm x 90 cm
Gamma: 2.20
RGB color display
First detailed timing is preferred timing
Display x,y Chromaticity:
  Red:   0.6250, 0.3398
  Green: 0.2802, 0.5947
  Blue:  0.1552, 0.0703
  White: 0.2832, 0.2978
Established timings supported:
  640x480@60Hz 4:3 HorFreq: 31469 Hz Clock: 25.175 MHz
  800x600@60Hz 4:3 HorFreq: 37900 Hz Clock: 40.000 MHz
  1024x768@60Hz 4:3 HorFreq: 48400 Hz Clock: 65.000 MHz
Standard timings supported:
  1280x720@60Hz 16:9
  1280x1024@60Hz 5:4 HorFreq: 64000 Hz Clock: 108.000 MHz
Detailed mode: Clock 148.500 MHz, 1600 mm x 900 mm
               1920 2008 2052 2200 hborder 0
               1080 1084 1089 1125 vborder 0
               +hsync +vsync 
               VertFreq: 60 Hz, HorFreq: 67500 Hz
Detailed mode: Clock 85.500 MHz, 1600 mm x 900 mm
               1360 1424 1536 1792 hborder 0
                768  771  777  795 vborder 0
               +hsync +vsync 
               VertFreq: 60 Hz, HorFreq: 47712 Hz
Monitor ranges (GTF): 57-63Hz V, 30-80kHz H, max dotclock 150MHz
Monitor name: SONY TV
Checksum: 0x77 (valid)
