
EDID (hex):
00ffffffffffff00244d51a101010101
1c0f0103681e1778ea71f59f554b9924
1c4f54afee0031404540614001010101
01010101010164190040410026301888
360030e410000018000000fd00374b1e
3f08000a202020202020000000ff0056
3141313631310a2020202020000000fc
0049424d4c3135302f4c31353070008d

Extracted contents:
header:          00 ff ff ff ff ff ff 00
serial number:   24 4d 51 a1 01 01 01 01 1c 0f
version:         01 03
basic params:    68 1e 17 78 ea
chroma info:     71 f5 9f 55 4b 99 24 1c 4f 54
established:     af ee 00
standard:        31 40 45 40 61 40 01 01 01 01 01 01 01 01 01 01
descriptor 1:    64 19 00 40 41 00 26 30 18 88 36 00 30 e4 10 00 00 18
descriptor 2:    00 00 00 fd 00 37 4b 1e 3f 08 00 0a 20 20 20 20 20 20
descriptor 3:    00 00 00 ff 00 56 31 41 31 36 31 31 0a 20 20 20 20 20
descriptor 4:    00 00 00 fc 00 49 42 4d 4c 31 35 30 2f 4c 31 35 30 70
extensions:      00
checksum:        8d

EDID version: 1.3
Manufacturer: IBM Model a151 Serial Number --
Analog display, Input voltage level: 0.7/0.7 V
Sync: Separate 
Maximum image size: 30 cm x 23 cm
Gamma: 2.20
DPMS levels: Standby Suspend Off
RGB color display
First detailed timing is preferred timing
Display x,y Chromaticity:
  Red:   0.6220, 0.3349
  Green: 0.2929, 0.5986
  Blue:  0.1435, 0.1123
  White: 0.3095, 0.3291
Established timings supported:
  720x400@70Hz 9:5 HorFreq: 31469 Hz Clock: 28.320 MHz
  640x480@60Hz 4:3 HorFreq: 31469 Hz Clock: 25.175 MHz
  640x480@72Hz 4:3 HorFreq: 37900 Hz Clock: 31.500 MHz
  640x480@75Hz 4:3 HorFreq: 37500 Hz Clock: 31.500 MHz
  800x600@56Hz 4:3 HorFreq: 35200 Hz Clock: 36.000 MHz
  800x600@60Hz 4:3 HorFreq: 37900 Hz Clock: 40.000 MHz
  800x600@72Hz 4:3 HorFreq: 48100 Hz Clock: 50.000 MHz
  800x600@75Hz 4:3 HorFreq: 46900 Hz Clock: 49.500 MHz
  832x624@75Hz 4:3 HorFreq: 49726 Hz Clock: 57.284 MHz
  1024x768@60Hz 4:3 HorFreq: 48400 Hz Clock: 65.000 MHz
  1024x768@70Hz 4:3 HorFreq: 56500 Hz Clock: 75.000 MHz
  1024x768@75Hz 4:3 HorFreq: 60000 Hz Clock: 78.750 MHz
Standard timings supported:
  640x480@60Hz 4:3 HorFreq: 31469 Hz Clock: 25.175 MHz
  800x600@60Hz 4:3 HorFreq: 37900 Hz Clock: 40.000 MHz
  1024x768@60Hz 4:3 HorFreq: 48400 Hz Clock: 65.000 MHz
Detailed mode: Clock 65.000 MHz, 304 mm x 228 mm
               1024 1048 1184 1344 hborder 0
                768  771  777  806 vborder 0
               -hsync -vsync 
               VertFreq: 60 Hz, HorFreq: 48363 Hz
Monitor ranges (GTF): 55-75Hz V, 30-63kHz H, max dotclock 80MHz
Serial number: --
Checksum: 0x8d (valid)
EDID block does NOT conform to EDID 1.3!
	Name descriptor not terminated with a newline
EDID block does not conform at all!
	Bad year of manufacture
