edid-decode (hex):

00 ff ff ff ff ff ff 00 06 af 8b 4e 00 00 00 00
00 1e 01 04 95 1d 11 78 03 93 05 92 58 59 90 29
1d 50 54 00 00 00 01 01 01 01 01 01 01 01 01 01
01 01 01 01 01 01 b0 36 80 b2 70 38 20 40 10 10
3e 00 25 a5 10 00 00 18 75 24 80 b2 70 38 20 40
10 10 3e 00 25 a5 10 00 00 18 00 00 00 00 00 00
00 00 00 00 00 00 00 00 00 00 00 00 00 00 00 02
00 10 48 ff 0f 3c 7d 14 0e 1d 7d 20 20 20 00 e2

----------------

Block 0, Base EDID:
  EDID Structure Version & Revision: 1.4
  Vendor & Product Identification:
    Manufacturer: AUO
    Model: 20107
    Made in: 2020
  Basic Display Parameters & Features:
    Digital display
    Bits per primary color channel: 6
    DisplayPort interface
    Maximum image size: 29 cm x 17 cm
    Gamma: 2.20
    Supported color formats: RGB 4:4:4
    First detailed timing includes the native pixel format and preferred refresh rate
    Display is continuous frequency
  Color Characteristics:
    Red  : 0.5722, 0.3447
    Green: 0.3476, 0.5654
    Blue : 0.1601, 0.1132
    White: 0.3134, 0.3291
  Established Timings I & II: none
  Standard Timings: none
  Detailed Timing Descriptors:
    DTD 1:  1920x1080   60.009190 Hz  16:9     66.730 kHz    140.000000 MHz (293 mm x 165 mm)
                 Hfront   16 Hsync  16 Hback  146 Hpol N
                 Vfront    3 Vsync  14 Vback   15 Vpol N
    DTD 2:  1920x1080   40.004698 Hz  16:9     44.485 kHz     93.330000 MHz (293 mm x 165 mm)
                 Hfront   16 Hsync  16 Hback  146 Hpol N
                 Vfront    3 Vsync  14 Vback   15 Vpol N
    Empty Descriptor
    Manufacturer-Specified Display Descriptor (0x02): 00 02 00 10 48 ff 0f 3c 7d 14 0e 1d 7d 20 20 20 '....H..<}...}   '
Checksum: 0xe2

----------------

Warnings:

Block 0, Base EDID:
  Missing Display Product Name.

Failures:

Block 0, Base EDID:
  Empty Descriptor: Use Dummy Descriptor instead of all zeroes.
  Missing Display Range Limits Descriptor.

EDID conformity: FAIL
