edid-decode (hex):

00 ff ff ff ff ff ff 00 04 69 00 19 01 01 01 01
1a 13 01 03 80 30 1b 78 2e e6 15 a6 55 49 99 27
13 50 54 a1 08 00 d1 c0 01 01 01 01 01 01 01 01
01 01 01 01 01 01 02 3a 80 18 71 38 2d 40 58 2c
45 00 e2 11 11 00 00 1e 00 00 00 ff 00 52 31 37
30 39 32 36 30 30 30 30 31 0a 00 00 00 fd 00 3b
3d 1e 50 10 00 0a 20 20 20 20 20 20 00 00 00 fc
00 41 53 55 53 20 45 54 32 32 30 33 0a 20 01 e2

02 03 19 f1 45 90 02 03 04 0f 83 01 00 00 23 09
07 07 66 03 0c 00 10 00 80 8c 0a d0 8a 20 e0 2d
10 10 3e 96 00 e2 11 11 00 00 18 01 1d 00 72 51
d0 1e 20 6e 28 55 00 e2 11 11 00 00 1e f3 39 80
18 71 38 2d 40 58 2c 45 00 e2 11 11 00 00 1e 00
00 00 00 00 00 00 00 00 00 00 00 00 00 00 00 00
00 00 00 00 00 00 00 00 00 00 00 00 00 00 00 00
00 00 00 00 00 00 00 00 00 00 00 00 00 00 00 53

----------------

Block 0, Base EDID:
  EDID Structure Version & Revision: 1.3
  Vendor & Product Identification:
    Manufacturer: ACI
    Model: 6400
    Serial Number: ...
    Made in: week 26 of 2009
  Basic Display Parameters & Features:
    Digital display
    Maximum image size: 48 cm x 27 cm
    Gamma: 2.20
    DPMS levels: Off
    RGB color display
    Default (sRGB) color space is primary color space
    First detailed timing is preferred timing
  Color Characteristics:
    Red  : 0.6513, 0.3339
    Green: 0.2861, 0.5996
    Blue : 0.1523, 0.0751
    White: 0.3134, 0.3291
  Established Timings I & II:
    IBM     :   720x400    70.082 Hz   9:5    31.467 kHz  28.320 MHz
    DMT 0x04:   640x480    59.940 Hz   4:3    31.469 kHz  25.175 MHz
    DMT 0x09:   800x600    60.317 Hz   4:3    37.879 kHz  40.000 MHz
    DMT 0x10:  1024x768    60.004 Hz   4:3    48.363 kHz  65.000 MHz
  Standard Timings:
    DMT 0x52:  1920x1080   60.000 Hz  16:9    67.500 kHz 148.500 MHz
  Detailed Timing Descriptors:
    DTD 1:  1920x1080   60.000 Hz  16:9    67.500 kHz 148.500 MHz (482 mm x 273 mm)
                 Hfront   88 Hsync  44 Hback 148 Hpol P
                 Vfront    4 Vsync   5 Vback  36 Vpol P
    Display Product Serial Number: ...
  Display Range Limits:
    Monitor ranges (GTF): 59-61 Hz V, 30-80 kHz H, max dotclock 160 MHz
    Display Product Name: 'ASUS ET2203'
  Extension blocks: 1
Checksum: 0xe2

----------------

Block 1, CTA-861 Extension Block:
  Revision: 3
  Underscans PC formats by default
  Basic audio support
  Supports YCbCr 4:4:4
  Supports YCbCr 4:2:2
  Native detailed modes: 1
  Video Data Block:
    VIC  16:  1920x1080   60.000 Hz  16:9    67.500 kHz 148.500 MHz (native)
    VIC   2:   720x480    59.940 Hz   4:3    31.469 kHz  27.000 MHz
    VIC   3:   720x480    59.940 Hz  16:9    31.469 kHz  27.000 MHz
    VIC   4:  1280x720    60.000 Hz  16:9    45.000 kHz  74.250 MHz
    VIC  15:  1440x480    59.940 Hz  16:9    31.469 kHz  54.000 MHz
  Speaker Allocation Data Block:
    FL/FR - Front Left/Right
  Audio Data Block:
    Linear PCM:
      Max channels: 2
      Supported sample rates (kHz): 48 44.1 32
      Supported sample sizes (bits): 24 20 16
  Vendor-Specific Data Block (HDMI), OUI 00-0C-03:
    Source physical address: 1.0.0.0
    Supports_AI
  Detailed Timing Descriptors:
    DTD 2:   720x480    59.940 Hz   3:2    31.469 kHz  27.000 MHz (482 mm x 273 mm)
                 Hfront   16 Hsync  62 Hback  60 Hpol N
                 Vfront    9 Vsync   6 Vback  30 Vpol N
    DTD 3:  1280x720    60.000 Hz  16:9    45.000 kHz  74.250 MHz (482 mm x 273 mm)
                 Hfront  110 Hsync  40 Hback 220 Hpol P
                 Vfront    5 Vsync   5 Vback  20 Vpol P
    DTD 4:  1920x1080   59.939 Hz  16:9    67.432 kHz 148.350 MHz (482 mm x 273 mm)
                 Hfront   88 Hsync  44 Hback 148 Hpol P
                 Vfront    4 Vsync   5 Vback  36 Vpol P
Checksum: 0x53
