edid-decode (hex):

00 ff ff ff ff ff ff 00 06 af ed 24 00 00 00 00
00 1a 01 04 95 22 13 78 02 da 85 a5 56 52 9b 26
0c 50 54 00 00 00 01 01 01 01 01 01 01 01 01 01
01 01 01 01 01 01 14 37 80 a6 70 38 2e 40 6c 30
aa 00 58 c1 10 00 00 18 b8 24 80 a6 70 38 2e 40
6c 30 aa 00 58 c1 10 00 00 18 00 00 00 00 00 00
00 00 00 00 00 00 00 00 00 00 00 00 00 00 00 02
00 14 30 ff 12 3c c8 14 12 3d c8 20 20 20 00 1d

----------------

Block 0, Base EDID:
  EDID Structure Version & Revision: 1.4
  Vendor & Product Identification:
    Manufacturer: AUO
    Model: 9453
    Made in: 2016
  Basic Display Parameters & Features:
    Digital display
    Bits per primary color channel: 6
    DisplayPort interface
    Maximum image size: 34 cm x 19 cm
    Gamma: 2.20
    Supported color formats: RGB 4:4:4
    First detailed timing includes the native pixel format and preferred refresh rate
  Color Characteristics:
    Red  : 0.6474, 0.3369
    Green: 0.3222, 0.6074
    Blue : 0.1503, 0.0468
    White: 0.3134, 0.3291
  Established Timings I & II: none
  Standard Timings: none
  Detailed Timing Descriptors:
    DTD 1:  1920x1080   60.030 Hz  16:9    67.593 kHz 141.000 MHz (344 mm x 193 mm)
                 Hfront  108 Hsync  48 Hback  10 Hpol N
                 Vfront   10 Vsync  10 Vback  26 Vpol N
    DTD 2:  1920x1080   40.020 Hz  16:9    45.062 kHz  94.000 MHz (344 mm x 193 mm)
                 Hfront  108 Hsync  48 Hback  10 Hpol N
                 Vfront   10 Vsync  10 Vback  26 Vpol N
    Empty Descriptor
    Manufacturer-Specified Display Descriptor (0x02): 00 02 00 14 30 ff 12 3c c8 14 12 3d c8 20 20 20 '....0..<...=.   '
Checksum: 0x1d

----------------

Failures:

Block 0, Base EDID:
  Empty Descriptor: Use Dummy Descriptor instead of all zeroes.
  Missing Display Product Name.

EDID conformity: FAIL
