
EDID (hex):
00ffffffffffff0006b3b425aad00100
0b1f010380361e782eee91a3544c9926
0f505421080001010101010101010101
010101010101023a801871382d40582c
45001f2e2100001e000000ff0023484c
41594d78677741425441000000fd0818
f01e243c010a202020202020000000fc
00524f47205047323539514e0a20013f
020338f149101f04130312013f202309
07018301000068030c001000383c006a
d85dc4017880000002f0e305c000e200
6ae6060501605a285a8780a070384d40
302035001f2e2100001a82e980827038
8740082035001f2e2100001a00000000
00000000000000000000000000000000
00000000000000000000000000000001

Extracted contents:
header:          00 ff ff ff ff ff ff 00
serial number:   06 b3 b4 25 aa d0 01 00 0b 1f
version:         01 03
basic params:    80 36 1e 78 2e
chroma info:     ee 91 a3 54 4c 99 26 0f 50 54
established:     21 08 00
standard:        01 01 01 01 01 01 01 01 01 01 01 01 01 01 01 01
descriptor 1:    02 3a 80 18 71 38 2d 40 58 2c 45 00 1f 2e 21 00 00 1e
descriptor 2:    00 00 00 ff 00 23 48 4c 41 59 4d 78 67 77 41 42 54 41
descriptor 3:    00 00 00 fd 08 18 f0 1e 24 3c 01 0a 20 20 20 20 20 20
descriptor 4:    00 00 00 fc 00 52 4f 47 20 50 47 32 35 39 51 4e 0a 20
extensions:      01
checksum:        3f

EDID version: 1.3
Manufacturer: AUS Model 25b4 Serial Number --
Made in week 11 of 2021
Digital display
Maximum image size: 54 cm x 30 cm
Gamma: 2.20
DPMS levels: Off
RGB color display
Default (sRGB) color space is primary color space
First detailed timing is preferred timing
Display x,y Chromaticity:
  Red:   0.6396, 0.3300
  Green: 0.2998, 0.5996
  Blue:  0.1503, 0.0595
  White: 0.3125, 0.3291
Established timings supported:
  640x480@60Hz 4:3 HorFreq: 31469 Hz Clock: 25.175 MHz
  800x600@60Hz 4:3 HorFreq: 37900 Hz Clock: 40.000 MHz
  1024x768@60Hz 4:3 HorFreq: 48400 Hz Clock: 65.000 MHz
Standard timings supported:
Detailed mode: Clock 148.500 MHz, 543 mm x 302 mm
               1920 2008 2052 2200 hborder 0
               1080 1084 1089 1125 vborder 0
               +hsync +vsync 
               VertFreq: 60 Hz, HorFreq: 67500 Hz
Serial number: --
Monitor ranges (bare limits): 24-240Hz V, 30-36kHz H, max dotclock 600MHz
Monitor name: ROG PG259QN
Has 1 extension blocks
Checksum: 0x3f (valid)

CTA extension block
Extension version: 3
52 bytes of CTA data
  Video data block
    VIC  16 1920x1080@60Hz 16:9  HorFreq: 67500 Hz Clock: 148.500 MHz
    VIC  31 1920x1080@50Hz 16:9  HorFreq: 56250 Hz Clock: 148.500 MHz
    VIC   4 1280x720@60Hz 16:9  HorFreq: 45000 Hz Clock: 74.250 MHz
    VIC  19 1280x720@50Hz 16:9  HorFreq: 37500 Hz Clock: 74.250 MHz
    VIC   3 720x480@60Hz 16:9  HorFreq: 31469 Hz Clock: 27.000 MHz
    VIC  18 720x576@50Hz 16:9  HorFreq: 31250 Hz Clock: 27.000 MHz
    VIC   1 640x480@60Hz 4:3  HorFreq: 31469 Hz Clock: 25.175 MHz
    VIC  63 1920x1080@120Hz 16:9  HorFreq: 135000 Hz Clock: 297.000 MHz
    VIC  32 1920x1080@24Hz 16:9  HorFreq: 27000 Hz Clock: 74.250 MHz
  Audio data block
    Linear PCM, max channels 2
      Supported sample rates (kHz): 48 44.1 32
      Supported sample sizes (bits): 16
  Speaker allocation data block
    Speaker map:
      FL/FR - Front Left/Right
  Vendor-specific data block, OUI 000c03 (HDMI)
    Source physical address 1.0.0.0
    DC_36bit
    DC_30bit
    DC_Y444
    Maximum TMDS clock: 300MHz
  Vendor-specific data block, OUI c45dd8 (HDMI Forum)
    Version: 1
    Maximum TMDS Character Rate: 600MHz
    SCDC Present
  Extended tag: Colorimetry data block
    BT2020YCC
    BT2020RGB
  Extended tag: Video capability data block
    YCbCr quantization: No Data (0)
    RGB quantization: Selectable (via AVI Q) (1)
    PT scan behaviour: Always Underscanned (2)
    IT scan behaviour: Always Underscanned (2)
    CE scan behaviour: Always Underscanned (2)
  Extended tag: HDR static metadata data block
    Electro optical transfer functions:
      Traditional gamma - SDR luminance range
      SMPTE ST2084
    Supported static metadata descriptors:
      Static metadata type 1
    Desired content max luminance: 96 (400.000 cd/m^2)
    Desired content max frame-average luminance: 90 (351.250 cd/m^2)
    Desired content min luminance: 40 (0.098 cd/m^2)
Underscans PC formats by default
Basic audio support
Supports YCbCr 4:4:4
Supports YCbCr 4:2:2
1 native detailed modes
Detailed mode: Clock 346.500 MHz, 543 mm x 302 mm
               1920 1968 2000 2080 hborder 0
               1080 1083 1088 1157 vborder 0
               +hsync -vsync 
               VertFreq: 143 Hz, HorFreq: 166586 Hz
Detailed mode: Clock 597.780 MHz, 543 mm x 302 mm
               1920 1928 1960 2050 hborder 0
               1080 1083 1088 1215 vborder 0
               +hsync -vsync 
               VertFreq: 240 Hz, HorFreq: 291600 Hz
Checksum: 0x1 (valid)

EDID block does not conform at all!
	Both the serial number and the serial string are set
	Detailed blocks filled with garbage
	Range descriptor contains garbage
