edid-decode (hex):

00 ff ff ff ff ff ff 00 06 72 a0 ab 2c 01 00 00
19 20 01 04 b5 3c 22 78 3b e5 95 aa 4f 44 a5 27
0e 50 54 bf cf 00 81 40 81 80 95 00 71 4f 81 c0
b3 00 d1 c0 01 01 02 3a 80 18 71 38 2d 40 58 2c
45 00 56 50 21 00 00 1e d0 94 80 a0 70 38 1e 40
30 40 35 00 56 50 21 00 00 1a 00 00 00 fd 00 30
a5 b9 b9 27 01 0a 20 20 20 20 20 20 00 00 00 fc
00 50 47 32 37 46 46 31 41 0a 20 20 20 20 01 4e

02 03 33 f1 47 01 03 04 90 12 13 3f 23 09 07 07
83 01 00 00 65 03 0c 00 10 00 6d 1a 00 00 02 01
30 a5 00 00 00 00 00 00 e3 05 e0 00 e6 06 07 01
4b 4b 1c 86 6f 80 a0 70 38 40 40 30 20 35 00 56
50 21 00 00 1a 3c 82 80 a6 70 38 1e 40 18 20 35
00 56 50 21 00 00 1e 00 00 00 00 00 00 00 00 00
00 00 00 00 00 00 00 00 00 00 00 00 00 00 00 00
00 00 00 00 00 00 00 00 00 00 00 00 00 00 00 a6

00 ff ff ff ff ff ff 00 06 72 a0 ab 2c 01 00 00
19 20 01 04 b5 3c 22 78 3b e5 95 aa 4f 44 a5 27
0e 50 54 bf cf 00 81 40 81 80 95 00 71 4f 81 c0
b3 00 d1 c0 01 01 02 3a 80 18 71 38 2d 40 58 2c
45 00 56 50 21 00 00 1e d0 94 80 a0 70 38 1e 40
30 40 35 00 56 50 21 00 00 1a 00 00 00 fd 00 30
a5 b9 b9 27 01 0a 20 20 20 20 20 20 00 00 00 fc
00 50 47 32 37 46 46 31 41 0a 20 20 20 20 01 4e

02 03 33 f1 47 01 03 04 90 12 13 3f 23 09 07 07
83 01 00 00 65 03 0c 00 10 00 6d 1a 00 00 02 01
30 a5 00 00 00 00 00 00 e3 05 e0 00 e6 06 07 01
4b 4b 1c 86 6f 80 a0 70 38 40 40 30 20 35 00 56
50 21 00 00 1a 3c 82 80 a6 70 38 1e 40 18 20 35
00 56 50 21 00 00 1e 00 00 00 00 00 00 00 00 00
00 00 00 00 00 00 00 00 00 00 00 00 00 00 00 00
00 00 00 00 00 00 00 00 00 00 00 00 00 00 00 a6

----------------

Block 0, Base EDID:
  EDID Structure Version & Revision: 1.4
  Vendor & Product Identification:
    Manufacturer: ASR
    Model: 43936
    Serial Number: ...
    Made in: week 25 of 2022
  Basic Display Parameters & Features:
    Digital display
    Bits per primary color channel: 10
    DisplayPort interface
    Maximum image size: 60 cm x 34 cm
    Gamma: 2.20
    DPMS levels: Off
    Supported color formats: RGB 4:4:4, YCrCb 4:4:4, YCrCb 4:2:2
    First detailed timing includes the native pixel format and preferred refresh rate
    Display is continuous frequency
  Color Characteristics:
    Red  : 0.6669, 0.3105
    Green: 0.2666, 0.6455
    Blue : 0.1542, 0.0556
    White: 0.3134, 0.3291
  Established Timings I & II:
    IBM     :   720x400    70.081663 Hz   9:5     31.467 kHz     28.320000 MHz
    DMT 0x04:   640x480    59.940476 Hz   4:3     31.469 kHz     25.175000 MHz
    Apple   :   640x480    66.666667 Hz   4:3     35.000 kHz     30.240000 MHz
    DMT 0x05:   640x480    72.808802 Hz   4:3     37.861 kHz     31.500000 MHz
    DMT 0x06:   640x480    75.000000 Hz   4:3     37.500 kHz     31.500000 MHz
    DMT 0x08:   800x600    56.250000 Hz   4:3     35.156 kHz     36.000000 MHz
    DMT 0x09:   800x600    60.316541 Hz   4:3     37.879 kHz     40.000000 MHz
    DMT 0x0a:   800x600    72.187572 Hz   4:3     48.077 kHz     50.000000 MHz
    DMT 0x0b:   800x600    75.000000 Hz   4:3     46.875 kHz     49.500000 MHz
    DMT 0x10:  1024x768    60.003840 Hz   4:3     48.363 kHz     65.000000 MHz
    DMT 0x11:  1024x768    70.069359 Hz   4:3     56.476 kHz     75.000000 MHz
    DMT 0x12:  1024x768    75.028582 Hz   4:3     60.023 kHz     78.750000 MHz
    DMT 0x24:  1280x1024   75.024675 Hz   5:4     79.976 kHz    135.000000 MHz
  Standard Timings:
    DMT 0x20:  1280x960    60.000000 Hz   4:3     60.000 kHz    108.000000 MHz
    DMT 0x23:  1280x1024   60.019740 Hz   5:4     63.981 kHz    108.000000 MHz
    DMT 0x2f:  1440x900    59.887445 Hz  16:10    55.935 kHz    106.500000 MHz
    DMT 0x15:  1152x864    75.000000 Hz   4:3     67.500 kHz    108.000000 MHz
    DMT 0x55:  1280x720    60.000000 Hz  16:9     45.000 kHz     74.250000 MHz
    DMT 0x3a:  1680x1050   59.954250 Hz  16:10    65.290 kHz    146.250000 MHz
    DMT 0x52:  1920x1080   60.000000 Hz  16:9     67.500 kHz    148.500000 MHz
  Detailed Timing Descriptors:
    DTD 1:  1920x1080   60.000000 Hz  16:9     67.500 kHz    148.500000 MHz (598 mm x 336 mm)
                 Hfront   88 Hsync  44 Hback  148 Hpol P
                 Vfront    4 Vsync   5 Vback   36 Vpol P
    DTD 2:  1920x1080  165.003465 Hz  16:9    183.154 kHz    380.960000 MHz (598 mm x 336 mm)
                 Hfront   48 Hsync  64 Hback   48 Hpol P
                 Vfront    3 Vsync   5 Vback   22 Vpol N
    Display Range Limits:
      Monitor ranges (Bare Limits): 48-165 Hz V, 185-185 kHz H, max dotclock 390 MHz
    Display Product Name: 'PG27FF1A'
  Extension blocks: 1
Checksum: 0x4e

----------------

Block 1, CTA-861 Extension Block:
  Revision: 3
  Underscans IT Video Formats by default
  Basic audio support
  Supports YCbCr 4:4:4
  Supports YCbCr 4:2:2
  Native detailed modes: 1
  Video Data Block:
    VIC   1:   640x480    59.940476 Hz   4:3     31.469 kHz     25.175000 MHz
    VIC   3:   720x480    59.940060 Hz  16:9     31.469 kHz     27.000000 MHz
    VIC   4:  1280x720    60.000000 Hz  16:9     45.000 kHz     74.250000 MHz
    VIC  16:  1920x1080   60.000000 Hz  16:9     67.500 kHz    148.500000 MHz (native)
    VIC  18:   720x576    50.000000 Hz  16:9     31.250 kHz     27.000000 MHz
    VIC  19:  1280x720    50.000000 Hz  16:9     37.500 kHz     74.250000 MHz
    VIC  63:  1920x1080  120.000000 Hz  16:9    135.000 kHz    297.000000 MHz
  Audio Data Block:
    Linear PCM:
      Max channels: 2
      Supported sample rates (kHz): 48 44.1 32
      Supported sample sizes (bits): 24 20 16
  Speaker Allocation Data Block:
    FL/FR - Front Left/Right
  Vendor-Specific Data Block (HDMI), OUI 00-0C-03:
    Source physical address: 1.0.0.0
  Vendor-Specific Data Block (AMD), OUI 00-00-1A:
    Version: 2.1
    Minimum Refresh Rate: 48 Hz
    Maximum Refresh Rate: 165 Hz
    Flags 1.x: 0x00
    Flags 2.x: 0x00
    Maximum luminance: 0 (50.000 cd/m^2)
    Minimum luminance: 0 (0.000 cd/m^2)
    Unknown: 0x00 0x00
  Colorimetry Data Block:
    BT2020cYCC
    BT2020YCC
    BT2020RGB
  HDR Static Metadata Data Block:
    Electro optical transfer functions:
      Traditional gamma - SDR luminance range
      Traditional gamma - HDR luminance range
      SMPTE ST2084
    Supported static metadata descriptors:
      Static metadata type 1
    Desired content max luminance: 75 (253.810 cd/m^2)
    Desired content max frame-average luminance: 75 (253.810 cd/m^2)
    Desired content min luminance: 28 (0.031 cd/m^2)
  Detailed Timing Descriptors:
    DTD 3:  1920x1080  119.982181 Hz  16:9    137.260 kHz    285.500000 MHz (598 mm x 336 mm)
                 Hfront   48 Hsync  32 Hback   80 Hpol P
                 Vfront    3 Vsync   5 Vback   56 Vpol N
    DTD 4:  1920x1080  143.988667 Hz  16:9    159.827 kHz    333.400000 MHz (598 mm x 336 mm)
                 Hfront   24 Hsync  32 Hback  110 Hpol P
                 Vfront    3 Vsync   5 Vback   22 Vpol P
Checksum: 0xa6  Unused space in Extension Block: 40 bytes

----------------

Block 2, Unknown EDID Extension Block 0x00:
  00 ff ff ff ff ff ff 00 06 72 a0 ab 2c 01 00 00 '.........r..,...'
  19 20 01 04 b5 3c 22 78 3b e5 95 aa 4f 44 a5 27 '. ...<"x;...OD.''
  0e 50 54 bf cf 00 81 40 81 80 95 00 71 4f 81 c0 '.PT....@....qO..'
  b3 00 d1 c0 01 01 02 3a 80 18 71 38 2d 40 58 2c '.......:..q8-@X,'
  45 00 56 50 21 00 00 1e d0 94 80 a0 70 38 1e 40 'E.VP!.......p8.@'
  30 40 35 00 56 50 21 00 00 1a 00 00 00 fd 00 30 '0@5.VP!........0'
  a5 b9 b9 27 01 0a 20 20 20 20 20 20 00 00 00 fc '...'..      ....'
  00 50 47 32 37 46 46 31 41 0a 20 20 20 20 01 4e '.PG27FF1A.    .N'
Checksum: 0x4e

----------------

Block 3, CTA-861 Extension Block:
  Revision: 3
  Underscans IT Video Formats by default
  Basic audio support
  Supports YCbCr 4:4:4
  Supports YCbCr 4:2:2
  Native detailed modes: 1
  Video Data Block:
    VIC   1:   640x480    59.940476 Hz   4:3     31.469 kHz     25.175000 MHz
    VIC   3:   720x480    59.940060 Hz  16:9     31.469 kHz     27.000000 MHz
    VIC   4:  1280x720    60.000000 Hz  16:9     45.000 kHz     74.250000 MHz
    VIC  16:  1920x1080   60.000000 Hz  16:9     67.500 kHz    148.500000 MHz (native)
    VIC  18:   720x576    50.000000 Hz  16:9     31.250 kHz     27.000000 MHz
    VIC  19:  1280x720    50.000000 Hz  16:9     37.500 kHz     74.250000 MHz
    VIC  63:  1920x1080  120.000000 Hz  16:9    135.000 kHz    297.000000 MHz
  Audio Data Block:
    Linear PCM:
      Max channels: 2
      Supported sample rates (kHz): 48 44.1 32
      Supported sample sizes (bits): 24 20 16
  Speaker Allocation Data Block:
    FL/FR - Front Left/Right
  Vendor-Specific Data Block (HDMI), OUI 00-0C-03:
    Source physical address: 1.0.0.0
  Vendor-Specific Data Block (AMD), OUI 00-00-1A:
    Version: 2.1
    Minimum Refresh Rate: 48 Hz
    Maximum Refresh Rate: 165 Hz
    Flags 1.x: 0x00
    Flags 2.x: 0x00
    Maximum luminance: 0 (50.000 cd/m^2)
    Minimum luminance: 0 (0.000 cd/m^2)
    Unknown: 0x00 0x00
  Colorimetry Data Block:
    BT2020cYCC
    BT2020YCC
    BT2020RGB
  HDR Static Metadata Data Block:
    Electro optical transfer functions:
      Traditional gamma - SDR luminance range
      Traditional gamma - HDR luminance range
      SMPTE ST2084
    Supported static metadata descriptors:
      Static metadata type 1
    Desired content max luminance: 75 (253.810 cd/m^2)
    Desired content max frame-average luminance: 75 (253.810 cd/m^2)
    Desired content min luminance: 28 (0.031 cd/m^2)
  Detailed Timing Descriptors:
    DTD 5:  1920x1080  119.982181 Hz  16:9    137.260 kHz    285.500000 MHz (598 mm x 336 mm)
                 Hfront   48 Hsync  32 Hback   80 Hpol P
                 Vfront    3 Vsync   5 Vback   56 Vpol N
    DTD 6:  1920x1080  143.988667 Hz  16:9    159.827 kHz    333.400000 MHz (598 mm x 336 mm)
                 Hfront   24 Hsync  32 Hback  110 Hpol P
                 Vfront    3 Vsync   5 Vback   22 Vpol P
Checksum: 0xa6  Unused space in Extension Block: 40 bytes

----------------

Warnings:

Block 1, CTA-861 Extension Block:
  Colorimetry Data Block: Set the sRGB colorimetry bit to avoid interop issues.
Block 3, CTA-861 Extension Block:
  Colorimetry Data Block: Set the sRGB colorimetry bit to avoid interop issues.
EDID:
  Base EDID: Some timings are out of range of the Monitor Ranges:
    Horizontal Freq: 31.250 - 183.153 kHz (Monitor: 185.000 - 185.000 kHz)
  CTA-861: Multiple native progressive timings are defined.

Failures:

Block 1, CTA-861 Extension Block:
  Vendor-Specific Data Block (HDMI), OUI 00-0C-03: The HDMI Specification requires EDID 1.3 instead of 1.4.
  Missing VCDB, needed for Set Selectable RGB Quantization to avoid interop issues.
Block 2, Base EDID:
  Unknown Extension Block.
Block 3, CTA-861 Extension Block:
  Video Data Block: Duplicate VIC 1.
  Video Data Block: Duplicate VIC 3.
  Video Data Block: Duplicate VIC 4.
  Video Data Block: Duplicate VIC 16.
  Video Data Block: Duplicate VIC 18.
  Video Data Block: Duplicate VIC 19.
  Video Data Block: Duplicate VIC 63.
  Speaker Allocation Data Block: Only one instance of this Data Block is allowed.
  Vendor-Specific Data Block (HDMI), OUI 00-0C-03: The HDMI Specification requires EDID 1.3 instead of 1.4.
  Colorimetry Data Block: Only one instance of this Data Block is allowed.
  HDR Static Metadata Data Block: Only one instance of this Data Block is allowed.
  Missing VCDB, needed for Set Selectable RGB Quantization to avoid interop issues.
EDID:
  Base EDID: EDID specified 1 extension block(s), but found 3 extension block(s).

EDID conformity: FAIL
