
EDID (hex):
00ffffffffffff000469a22200160000
15120104a52f1e78e6c4f6a3574a9c23
114f54bfef00714f818081409500a940
b3000101010121399030621a274068b0
3600d9281100001c000000fd00384b1f
5111000a202020202020000000fc0056
573232320a20202020202020000000ff
0038354c4d5143303035363332200017

Extracted contents:
header:          00 ff ff ff ff ff ff 00
serial number:   04 69 a2 22 00 16 00 00 15 12
version:         01 04
basic params:    a5 2f 1e 78 e6
chroma info:     c4 f6 a3 57 4a 9c 23 11 4f 54
established:     bf ef 00
standard:        71 4f 81 80 81 40 95 00 a9 40 b3 00 01 01 01 01
descriptor 1:    21 39 90 30 62 1a 27 40 68 b0 36 00 d9 28 11 00 00 1c
descriptor 2:    00 00 00 fd 00 38 4b 1f 51 11 00 0a 20 20 20 20 20 20
descriptor 3:    00 00 00 fc 00 56 57 32 32 32 0a 20 20 20 20 20 20 20
descriptor 4:    00 00 00 ff 00 38 35 4c 4d 51 43 30 30 35 36 33 32 20
extensions:      00
checksum:        17

EDID version: 1.4
Manufacturer: ACI Model 22a2 Serial Number --
Made in week 21 of 2008
Digital display
8 bits per primary color channel
DisplayPort interface
Maximum image size: 47 cm x 30 cm
Gamma: 2.20
DPMS levels: Standby Suspend Off
Supported color formats: RGB 4:4:4
Default (sRGB) color space is primary color space
First detailed timing includes the native pixel format and preferred refresh rate
Display x,y Chromaticity:
  Red:   0.6396, 0.3398
  Green: 0.2900, 0.6093
  Blue:  0.1396, 0.0693
  White: 0.3095, 0.3300
Established timings supported:
  720x400@70Hz 9:5 HorFreq: 31469 Hz Clock: 28.320 MHz
  640x480@60Hz 4:3 HorFreq: 31469 Hz Clock: 25.175 MHz
  640x480@67Hz 4:3 HorFreq: 35000 Hz Clock: 30.240 MHz
  640x480@72Hz 4:3 HorFreq: 37900 Hz Clock: 31.500 MHz
  640x480@75Hz 4:3 HorFreq: 37500 Hz Clock: 31.500 MHz
  800x600@56Hz 4:3 HorFreq: 35200 Hz Clock: 36.000 MHz
  800x600@60Hz 4:3 HorFreq: 37900 Hz Clock: 40.000 MHz
  800x600@72Hz 4:3 HorFreq: 48100 Hz Clock: 50.000 MHz
  800x600@75Hz 4:3 HorFreq: 46900 Hz Clock: 49.500 MHz
  832x624@75Hz 4:3 HorFreq: 49726 Hz Clock: 57.284 MHz
  1024x768@60Hz 4:3 HorFreq: 48400 Hz Clock: 65.000 MHz
  1024x768@70Hz 4:3 HorFreq: 56500 Hz Clock: 75.000 MHz
  1024x768@75Hz 4:3 HorFreq: 60000 Hz Clock: 78.750 MHz
  1280x1024@75Hz 5:4 HorFreq: 80000 Hz Clock: 135.000 MHz
Standard timings supported:
  1152x864@75Hz 4:3 HorFreq: 67500 Hz Clock: 108.000 MHz
  1280x1024@60Hz 5:4 HorFreq: 64000 Hz Clock: 108.000 MHz
  1280x960@60Hz 4:3 HorFreq: 60000 Hz Clock: 108.000 MHz
  1440x900@60Hz 16:10 HorFreq: 55500 Hz Clock: 88.750 MHz
  1600x1200@60Hz 4:3 HorFreq: 75000 Hz Clock: 162.000 MHz
  1680x1050@60Hz 16:10 HorFreq: 64700 Hz Clock: 119.000 MHz
Detailed mode: Clock 146.250 MHz, 473 mm x 296 mm
               1680 1784 1960 2240 hborder 0
               1050 1053 1059 1089 vborder 0
               -hsync +vsync 
               VertFreq: 59 Hz, HorFreq: 65290 Hz
Monitor ranges (GTF): 56-75Hz V, 31-81kHz H, max dotclock 170MHz
Monitor name: VW222
Serial number: -- 
Checksum: 0x17 (valid)
EDID block does NOT conform to EDID 1.4!
	sRGB is signaled, but the chromaticities do not match
