
EDID (hex):
00ffffffffffff002e83002701000000
1d1c0103803c2178ee03f0a5544c9e25
0e5054a54f0081c081408180a940d1c0
d1cf01010101565e00a0a0a029503020
350055502100001ed3800068a1a04250
3020250055502100001e000000fc0051
32373032530a202020202020000000fd
00384c1e7122000a202020202020015c
020328f14f1005040302071601141f12
13202122230907078301000067030c00
10003844e3050301662150b051001b30
4070360055502100001e011d8018711c
1620582c250054502100009e011d0072
51d01e206e28550055502100001e8c0a
d08a20e02d10103e9600555021000018
000000000000000000000000000000d1

Extracted contents:
header:          00 ff ff ff ff ff ff 00
serial number:   2e 83 00 27 01 00 00 00 1d 1c
version:         01 03
basic params:    80 3c 21 78 ee
chroma info:     03 f0 a5 54 4c 9e 25 0e 50 54
established:     a5 4f 00
standard:        81 c0 81 40 81 80 a9 40 d1 c0 d1 cf 01 01 01 01
descriptor 1:    56 5e 00 a0 a0 a0 29 50 30 20 35 00 55 50 21 00 00 1e
descriptor 2:    d3 80 00 68 a1 a0 42 50 30 20 25 00 55 50 21 00 00 1e
descriptor 3:    00 00 00 fc 00 51 32 37 30 32 53 0a 20 20 20 20 20 20
descriptor 4:    00 00 00 fd 00 38 4c 1e 71 22 00 0a 20 20 20 20 20 20
extensions:      01
checksum:        5c

EDID version: 1.3
Manufacturer: KTC Model 2700 Serial Number --
Made in week 29 of 2018
Digital display
Maximum image size: 60 cm x 33 cm
Gamma: 2.20
DPMS levels: Standby Suspend Off
RGB color display
Default (sRGB) color space is primary color space
First detailed timing is preferred timing
Display x,y Chromaticity:
  Red:   0.6445, 0.3281
  Green: 0.2968, 0.6201
  Blue:  0.1474, 0.0576
  White: 0.3125, 0.3281
Established timings supported:
  720x400@70Hz 9:5 HorFreq: 31469 Hz Clock: 28.320 MHz
  640x480@60Hz 4:3 HorFreq: 31469 Hz Clock: 25.175 MHz
  640x480@75Hz 4:3 HorFreq: 37500 Hz Clock: 31.500 MHz
  800x600@60Hz 4:3 HorFreq: 37900 Hz Clock: 40.000 MHz
  800x600@75Hz 4:3 HorFreq: 46900 Hz Clock: 49.500 MHz
  1024x768@60Hz 4:3 HorFreq: 48400 Hz Clock: 65.000 MHz
  1024x768@70Hz 4:3 HorFreq: 56500 Hz Clock: 75.000 MHz
  1024x768@75Hz 4:3 HorFreq: 60000 Hz Clock: 78.750 MHz
  1280x1024@75Hz 5:4 HorFreq: 80000 Hz Clock: 135.000 MHz
Standard timings supported:
  1280x720@60Hz 16:9
  1280x960@60Hz 4:3 HorFreq: 60000 Hz Clock: 108.000 MHz
  1280x1024@60Hz 5:4 HorFreq: 64000 Hz Clock: 108.000 MHz
  1600x1200@60Hz 4:3 HorFreq: 75000 Hz Clock: 162.000 MHz
  1920x1080@60Hz 16:9
  1920x1080@75Hz 16:9
Detailed mode: Clock 241.500 MHz, 597 mm x 336 mm
               2560 2608 2640 2720 hborder 0
               1440 1443 1448 1481 vborder 0
               +hsync +vsync 
               VertFreq: 59 Hz, HorFreq: 88786 Hz
Detailed mode: Clock 329.790 MHz, 597 mm x 336 mm
               2560 2608 2640 2920 hborder 0
               1440 1442 1447 1506 vborder 0
               +hsync +vsync 
               VertFreq: 74 Hz, HorFreq: 112941 Hz
Monitor name: Q2702S
Monitor ranges (GTF): 56-76Hz V, 30-113kHz H, max dotclock 340MHz
Has 1 extension blocks
Checksum: 0x5c (valid)

CTA extension block
Extension version: 3
36 bytes of CTA data
  Video data block
    VIC  16 1920x1080@60Hz 16:9  HorFreq: 67500 Hz Clock: 148.500 MHz
    VIC   5 1920x1080i@60Hz 16:9  HorFreq: 33750 Hz Clock: 74.250 MHz
    VIC   4 1280x720@60Hz 16:9  HorFreq: 45000 Hz Clock: 74.250 MHz
    VIC   3 720x480@60Hz 16:9  HorFreq: 31469 Hz Clock: 27.000 MHz
    VIC   2 720x480@60Hz 4:3  HorFreq: 31469 Hz Clock: 27.000 MHz
    VIC   7 1440x480i@60Hz 16:9  HorFreq: 15734 Hz Clock: 27.000 MHz
    VIC  22 1440x576i@50Hz 16:9  HorFreq: 15625 Hz Clock: 27.000 MHz
    VIC   1 640x480@60Hz 4:3  HorFreq: 31469 Hz Clock: 25.175 MHz
    VIC  20 1920x1080i@50Hz 16:9  HorFreq: 28125 Hz Clock: 74.250 MHz
    VIC  31 1920x1080@50Hz 16:9  HorFreq: 56250 Hz Clock: 148.500 MHz
    VIC  18 720x576@50Hz 16:9  HorFreq: 31250 Hz Clock: 27.000 MHz
    VIC  19 1280x720@50Hz 16:9  HorFreq: 37500 Hz Clock: 74.250 MHz
    VIC  32 1920x1080@24Hz 16:9  HorFreq: 27000 Hz Clock: 74.250 MHz
    VIC  33 1920x1080@25Hz 16:9  HorFreq: 28125 Hz Clock: 74.250 MHz
    VIC  34 1920x1080@30Hz 16:9  HorFreq: 33750 Hz Clock: 74.250 MHz
  Audio data block
    Linear PCM, max channels 2
      Supported sample rates (kHz): 48 44.1 32
      Supported sample sizes (bits): 24 20 16
  Speaker allocation data block
    Speaker map:
      FL/FR - Front Left/Right
  Vendor-specific data block, OUI 000c03 (HDMI)
    Source physical address 1.0.0.0
    DC_36bit
    DC_30bit
    DC_Y444
    Maximum TMDS clock: 340MHz
  Extended tag: Colorimetry data block
    xvYCC601
    xvYCC709
Underscans PC formats by default
Basic audio support
Supports YCbCr 4:4:4
Supports YCbCr 4:2:2
1 native detailed modes
Detailed mode: Clock 85.500 MHz, 597 mm x 336 mm
               1360 1424 1536 1792 hborder 0
                768  771  777  795 vborder 0
               +hsync +vsync 
               VertFreq: 60 Hz, HorFreq: 47712 Hz
Detailed mode: Clock 74.250 MHz, 596 mm x 336 mm
               1920 2008 2052 2200 hborder 0
                540  542  547  562 vborder 0
               +hsync +vsync interlaced 
               VertFreq: 60 Hz, HorFreq: 33750 Hz
Detailed mode: Clock 74.250 MHz, 597 mm x 336 mm
               1280 1390 1430 1650 hborder 0
                720  725  730  750 vborder 0
               +hsync +vsync 
               VertFreq: 60 Hz, HorFreq: 45000 Hz
Detailed mode: Clock 27.000 MHz, 597 mm x 336 mm
                720  736  798  858 hborder 0
                480  489  495  525 vborder 0
               -hsync -vsync 
               VertFreq: 59 Hz, HorFreq: 31468 Hz
Checksum: 0xd1 (valid)

EDID block does NOT conform to EDID 1.3!
	sRGB is signaled, but the chromaticities do not match
One or more of the timings is out of range of the Monitor Ranges:
  Vertical Freq: 24 - 75 Hz
  Horizontal Freq: 15625 - 112941 Hz
  Maximum Clock: 329.790 MHz
