
EDID (hex):
00ffffffffffff0030e41b0700000000
001f0104a5221378ebe185a3544e9c26
0e505400000001010101010101010101
0101010101012e3680a070381f403020
350058c21000001a1f2480a070381f40
3020350058c21000001a000000000000
00000000000000000000000000000002
000c26ff143cc80a0817c8000000007d

Extracted contents:
header:          00 ff ff ff ff ff ff 00
serial number:   30 e4 1b 07 00 00 00 00 00 1f
version:         01 04
basic params:    a5 22 13 78 eb
chroma info:     e1 85 a3 54 4e 9c 26 0e 50 54
established:     00 00 00
standard:        01 01 01 01 01 01 01 01 01 01 01 01 01 01 01 01
descriptor 1:    2e 36 80 a0 70 38 1f 40 30 20 35 00 58 c2 10 00 00 1a
descriptor 2:    1f 24 80 a0 70 38 1f 40 30 20 35 00 58 c2 10 00 00 1a
descriptor 3:    00 00 00 00 00 00 00 00 00 00 00 00 00 00 00 00 00 00
descriptor 4:    00 00 00 02 00 0c 26 ff 14 3c c8 0a 08 17 c8 00 00 00
extensions:      00
checksum:        7d

EDID version: 1.4
Manufacturer: LGD Model 71b Serial Number --
Made in year 2021
Digital display
8 bits per primary color channel
DisplayPort interface
Maximum image size: 34 cm x 19 cm
Gamma: 2.20
DPMS levels: Standby Suspend Off
Supported color formats: RGB 4:4:4, YCrCb 4:4:4
First detailed timing includes the native pixel format and preferred refresh rate
Display is continuous frequency
Display x,y Chromaticity:
  Red:   0.6396, 0.3300
  Green: 0.3046, 0.6103
  Blue:  0.1503, 0.0546
  White: 0.3134, 0.3291
Established timings supported:
Standard timings supported:
Detailed mode: Clock 138.700 MHz, 344 mm x 194 mm
               1920 1968 2000 2080 hborder 0
               1080 1083 1088 1111 vborder 0
               +hsync -vsync 
               VertFreq: 60 Hz, HorFreq: 66682 Hz
Detailed mode: Clock 92.470 MHz, 344 mm x 194 mm
               1920 1968 2000 2080 hborder 0
               1080 1083 1088 1111 vborder 0
               +hsync -vsync 
               VertFreq: 40 Hz, HorFreq: 44456 Hz
Manufacturer-specified data, tag 0
Manufacturer-specified data, tag 2
Checksum: 0x7d (valid)
EDID block does NOT conform to EDID 1.4!
	Missing name descriptor
	Missing monitor ranges
