
EDID (hex):
00ffffffffffff0004729b0d4e0f1041
0b220103804f2178ab2ea5ad4f46a525
125054a54300714f81c0814081809500
a9c0b300d1c0597e70c8d0a029503020
35001d4e3100001a000000ff00323431
31303046344532583030000000fd0030
64a0a03c000a202020202020000000fc
0045444133343343555220480a2001bd
02033ef14a0102030405901112131f23
090707830100006a030c001000387820
000067d85dc401788000681a00000101
3064ede305e301e606070165650d94d2
70c8d0a02950302035009e833100001a
9c45b81861a02d50302035009e833100
001a936970c8d0a02d50302035001d4e
3100001a00000000000000000000008e

edid-decode (hex):

00 ff ff ff ff ff ff 00 04 72 9b 0d 4e 0f 10 41
0b 22 01 03 80 4f 21 78 ab 2e a5 ad 4f 46 a5 25
12 50 54 a5 43 00 71 4f 81 c0 81 40 81 80 95 00
a9 c0 b3 00 d1 c0 59 7e 70 c8 d0 a0 29 50 30 20
35 00 1d 4e 31 00 00 1a 00 00 00 ff 00 32 34 31
31 30 30 46 34 45 32 58 30 30 00 00 00 fd 00 30
64 a0 a0 3c 00 0a 20 20 20 20 20 20 00 00 00 fc
00 45 44 41 33 34 33 43 55 52 20 48 0a 20 01 bd

02 03 3e f1 4a 01 02 03 04 05 90 11 12 13 1f 23
09 07 07 83 01 00 00 6a 03 0c 00 10 00 38 78 20
00 00 67 d8 5d c4 01 78 80 00 68 1a 00 00 01 01
30 64 ed e3 05 e3 01 e6 06 07 01 65 65 0d 94 d2
70 c8 d0 a0 29 50 30 20 35 00 9e 83 31 00 00 1a
9c 45 b8 18 61 a0 2d 50 30 20 35 00 9e 83 31 00
00 1a 93 69 70 c8 d0 a0 2d 50 30 20 35 00 1d 4e
31 00 00 1a 00 00 00 00 00 00 00 00 00 00 00 8e

----------------

Block 0, Base EDID:
  EDID Structure Version & Revision: 1.3
  Vendor & Product Identification:
    Manufacturer: ACR
    Model: 3483
    Serial Number: 1091571534
    Made in: week 11 of 2024
  Basic Display Parameters & Features:
    Digital display
    Maximum image size: 79 cm x 33 cm
    Gamma: 2.20
    DPMS levels: Standby Off
    RGB color display
    First detailed timing is the preferred timing
    Supports GTF timings within operating range
  Color Characteristics:
    Red  : 0.6757, 0.3105
    Green: 0.2763, 0.6464
    Blue : 0.1464, 0.0722
    White: 0.3134, 0.3291
  Established Timings I & II:
    IBM     :   720x400    70.081663 Hz   9:5     31.467 kHz     28.320000 MHz
    DMT 0x04:   640x480    59.940476 Hz   4:3     31.469 kHz     25.175000 MHz
    DMT 0x06:   640x480    75.000000 Hz   4:3     37.500 kHz     31.500000 MHz
    DMT 0x09:   800x600    60.316541 Hz   4:3     37.879 kHz     40.000000 MHz
    DMT 0x0b:   800x600    75.000000 Hz   4:3     46.875 kHz     49.500000 MHz
    DMT 0x12:  1024x768    75.028582 Hz   4:3     60.023 kHz     78.750000 MHz
    DMT 0x24:  1280x1024   75.024675 Hz   5:4     79.976 kHz    135.000000 MHz
  Standard Timings:
    DMT 0x15:  1152x864    75.000000 Hz   4:3     67.500 kHz    108.000000 MHz
    DMT 0x55:  1280x720    60.000000 Hz  16:9     45.000 kHz     74.250000 MHz
    DMT 0x20:  1280x960    60.000000 Hz   4:3     60.000 kHz    108.000000 MHz
    DMT 0x23:  1280x1024   60.019740 Hz   5:4     63.981 kHz    108.000000 MHz
    DMT 0x2f:  1440x900    59.887445 Hz  16:10    55.935 kHz    106.500000 MHz
    DMT 0x53:  1600x900    60.000000 Hz  16:9     60.000 kHz    108.000000 MHz (RB)
    DMT 0x3a:  1680x1050   59.954250 Hz  16:10    65.290 kHz    146.250000 MHz
    DMT 0x52:  1920x1080   60.000000 Hz  16:9     67.500 kHz    148.500000 MHz
  Detailed Timing Descriptors:
    DTD 1:  3440x1440   59.999926 Hz  43:18    88.860 kHz    323.450000 MHz (797 mm x 334 mm)
                 Hfront   48 Hsync  32 Hback  120 Hpol P
                 Vfront    3 Vsync   5 Vback   33 Vpol N
    Display Product Serial Number: '241100F4E2X00'
    Display Range Limits:
      Monitor ranges (GTF): 48-100 Hz V, 160-160 kHz H, max dotclock 600 MHz
    Display Product Name: 'EDA343CUR H'
  Extension blocks: 1
Checksum: 0xbd

----------------

Block 1, CTA-861 Extension Block:
  Revision: 3
  Underscans IT Video Formats by default
  Basic audio support
  Supports YCbCr 4:4:4
  Supports YCbCr 4:2:2
  Native detailed modes: 1
  Video Data Block:
    VIC   1:   640x480    59.940476 Hz   4:3     31.469 kHz     25.175000 MHz
    VIC   2:   720x480    59.940060 Hz   4:3     31.469 kHz     27.000000 MHz
    VIC   3:   720x480    59.940060 Hz  16:9     31.469 kHz     27.000000 MHz
    VIC   4:  1280x720    60.000000 Hz  16:9     45.000 kHz     74.250000 MHz
    VIC   5:  1920x1080i  60.000000 Hz  16:9     33.750 kHz     74.250000 MHz
    VIC  16:  1920x1080   60.000000 Hz  16:9     67.500 kHz    148.500000 MHz (native)
    VIC  17:   720x576    50.000000 Hz   4:3     31.250 kHz     27.000000 MHz
    VIC  18:   720x576    50.000000 Hz  16:9     31.250 kHz     27.000000 MHz
    VIC  19:  1280x720    50.000000 Hz  16:9     37.500 kHz     74.250000 MHz
    VIC  31:  1920x1080   50.000000 Hz  16:9     56.250 kHz    148.500000 MHz
  Audio Data Block:
    Linear PCM:
      Max channels: 2
      Supported sample rates (kHz): 48 44.1 32
      Supported sample sizes (bits): 24 20 16
  Speaker Allocation Data Block:
    FL/FR - Front Left/Right
  Vendor-Specific Data Block (HDMI), OUI 00-0C-03:
    Source physical address: 1.0.0.0
    DC_36bit
    DC_30bit
    DC_Y444
    Maximum TMDS clock: 600 MHz
    Extended HDMI video details:
  Vendor-Specific Data Block (HDMI Forum), OUI C4-5D-D8:
    Version: 1
    Maximum TMDS Character Rate: 600 MHz
    SCDC Present
  Vendor-Specific Data Block (AMD), OUI 00-00-1A:
    Version: 1.1
    Minimum Refresh Rate: 48 Hz
    Maximum Refresh Rate: 100 Hz
    Flags 1.x: 0xed (MCCS)
  Colorimetry Data Block:
    xvYCC601
    xvYCC709
    BT2020cYCC
    BT2020YCC
    BT2020RGB
    Gamut Boundary Description Metadata Profile P0
  HDR Static Metadata Data Block:
    Electro optical transfer functions:
      Traditional gamma - SDR luminance range
      Traditional gamma - HDR luminance range
      SMPTE ST2084
    Supported static metadata descriptors:
      Static metadata type 1
    Desired content max luminance: 101 (445.755 cd/m^2)
    Desired content max frame-average luminance: 101 (445.755 cd/m^2)
    Desired content min luminance: 13 (0.012 cd/m^2)
  Detailed Timing Descriptors:
    DTD 2:  3440x1440   99.999258 Hz  43:18   148.099 kHz    539.080000 MHz (926 mm x 387 mm)
                 Hfront   48 Hsync  32 Hback  120 Hpol P
                 Vfront    3 Vsync   5 Vback   33 Vpol N
    DTD 3:  1720x1440   60.000000 Hz  43:36    89.100 kHz    178.200000 MHz (926 mm x 387 mm)
                 Hfront   48 Hsync  32 Hback  200 Hpol P
                 Vfront    3 Vsync   5 Vback   37 Vpol N
    DTD 4:  3440x1440   50.000000 Hz  43:18    74.250 kHz    270.270000 MHz (797 mm x 334 mm)
                 Hfront   48 Hsync  32 Hback  120 Hpol P
                 Vfront    3 Vsync   5 Vback   37 Vpol N
Checksum: 0x8e  Unused space in Extension Block: 11 bytes
