
EDID (hex):
00ffffffffffff0009e59c0600000000
011901049522137802b0909758549226
1d505400000001010101010101010101
0101010101013c3780de703814403020
360058c11000001a0000000000000000
00000000000000000000000000fe0042
4f452043510a202020202020000000fe
004e5431353646484d2d4e34310a001e

Extracted contents:
header:          00 ff ff ff ff ff ff 00
serial number:   09 e5 9c 06 00 00 00 00 01 19
version:         01 04
basic params:    95 22 13 78 02
chroma info:     b0 90 97 58 54 92 26 1d 50 54
established:     00 00 00
standard:        01 01 01 01 01 01 01 01 01 01 01 01 01 01 01 01
descriptor 1:    3c 37 80 de 70 38 14 40 30 20 36 00 58 c1 10 00 00 1a
descriptor 2:    00 00 00 00 00 00 00 00 00 00 00 00 00 00 00 00 00 00
descriptor 3:    00 00 00 fe 00 42 4f 45 20 43 51 0a 20 20 20 20 20 20
descriptor 4:    00 00 00 fe 00 4e 54 31 35 36 46 48 4d 2d 4e 34 31 0a
extensions:      00
checksum:        1e

EDID version: 1.4
Manufacturer: BOE Model 69c Serial Number --
Made in week 1 of 2015
Digital display
6 bits per primary color channel
DisplayPort interface
Maximum image size: 34 cm x 19 cm
Gamma: 2.20
Supported color formats: RGB 4:4:4
First detailed timing includes the native pixel format and preferred refresh rate
Display x,y Chromaticity:
  Red:   0.5917, 0.3466
  Green: 0.3281, 0.5703
  Blue:  0.1503, 0.1142
  White: 0.3125, 0.3281
Established timings supported:
Standard timings supported:
Detailed mode: Clock 141.400 MHz, 344 mm x 193 mm
               1920 1968 2000 2142 hborder 0
               1080 1083 1089 1100 vborder 0
               +hsync -vsync 
               VertFreq: 60 Hz, HorFreq: 66013 Hz
Manufacturer-specified data, tag 0
ASCII string: BOE CQ
ASCII string: NT156FHM-N41
Checksum: 0x1e (valid)
EDID block does NOT conform to EDID 1.4!
	Missing name descriptor
	Missing monitor ranges
