
EDID (hex):
00ffffffffffff0004725b0622150083
1e1c010368351e782ace65a657519f27
0f5054b30c00b30095008180810081c0
714f01010101023a801871382d40582c
45000f282100001e000000fd00304c1e
5612000a202020202020000000ff0054
35334545303039343230330a000000fc
004163657220434232343148590a0051

Extracted contents:
header:          00 ff ff ff ff ff ff 00
serial number:   04 72 5b 06 22 15 00 83 1e 1c
version:         01 03
basic params:    68 35 1e 78 2a
chroma info:     ce 65 a6 57 51 9f 27 0f 50 54
established:     b3 0c 00
standard:        b3 00 95 00 81 80 81 00 81 c0 71 4f 01 01 01 01
descriptor 1:    02 3a 80 18 71 38 2d 40 58 2c 45 00 0f 28 21 00 00 1e
descriptor 2:    00 00 00 fd 00 30 4c 1e 56 12 00 0a 20 20 20 20 20 20
descriptor 3:    00 00 00 ff 00 54 35 33 45 45 30 30 39 34 32 30 33 0a
descriptor 4:    00 00 00 fc 00 41 63 65 72 20 43 42 32 34 31 48 59 0a
extensions:      00
checksum:        51

EDID version: 1.3
Manufacturer: ACR Model 65b Serial Number --
Made in week 30 of 2018
Analog display, Input voltage level: 0.7/0.7 V
Sync: Separate 
Maximum image size: 53 cm x 30 cm
Gamma: 2.20
DPMS levels: Off
RGB color display
First detailed timing is preferred timing
Display x,y Chromaticity:
  Red:   0.6513, 0.3398
  Green: 0.3193, 0.6230
  Blue:  0.1533, 0.0605
  White: 0.3134, 0.3291
Established timings supported:
  720x400@70Hz 9:5 HorFreq: 31469 Hz Clock: 28.320 MHz
  640x480@60Hz 4:3 HorFreq: 31469 Hz Clock: 25.175 MHz
  640x480@67Hz 4:3 HorFreq: 35000 Hz Clock: 30.240 MHz
  800x600@56Hz 4:3 HorFreq: 35200 Hz Clock: 36.000 MHz
  800x600@60Hz 4:3 HorFreq: 37900 Hz Clock: 40.000 MHz
  1024x768@60Hz 4:3 HorFreq: 48400 Hz Clock: 65.000 MHz
  1024x768@70Hz 4:3 HorFreq: 56500 Hz Clock: 75.000 MHz
Standard timings supported:
  1680x1050@60Hz 16:10 HorFreq: 64700 Hz Clock: 119.000 MHz
  1440x900@60Hz 16:10 HorFreq: 55500 Hz Clock: 88.750 MHz
  1280x1024@60Hz 5:4 HorFreq: 64000 Hz Clock: 108.000 MHz
  1280x800@60Hz 16:10
  1280x720@60Hz 16:9
  1152x864@75Hz 4:3 HorFreq: 67500 Hz Clock: 108.000 MHz
Detailed mode: Clock 148.500 MHz, 527 mm x 296 mm
               1920 2008 2052 2200 hborder 0
               1080 1084 1089 1125 vborder 0
               +hsync +vsync 
               VertFreq: 60 Hz, HorFreq: 67500 Hz
Monitor ranges (GTF): 48-76Hz V, 30-86kHz H, max dotclock 180MHz
Serial number: --
Monitor name: Acer CB241HY
Checksum: 0x51 (valid)
