edid-decode (hex):

00 ff ff ff ff ff ff 00 05 e3 10 22 90 bd 00 00
15 11 01 03 e8 2f 1e 78 2a c3 d0 a4 55 49 9a 26
13 50 54 bf ef 00 61 4c 81 80 81 8a 81 8c 81 40
b3 00 01 01 01 01 08 39 90 30 62 1a 27 40 68 b0
36 00 d6 2c 11 00 00 1a 00 00 00 fd 00 38 4b 1f
50 11 00 0a 20 20 20 20 20 20 00 00 00 fc 00 41
4f 43 20 32 31 30 56 0a 20 20 20 20 00 00 00 ff
00 41 33 32 37 35 4a 41 30 34 38 35 32 38 00 04

00 ff ff ff ff ff ff 00 05 e3 10 22 90 bd 00 00
15 11 01 03 e8 2f 1e 78 2a c3 d0 a4 55 49 9a 26
13 50 54 bf ef 00 61 4c 81 80 81 8a 81 8c 81 40
b3 00 01 01 01 01 08 39 90 30 62 1a 27 40 68 b0
36 00 d6 2c 11 00 00 1a 00 00 00 fd 00 38 4b 1f
50 11 00 0a 20 20 20 20 20 20 00 00 00 fc 00 41
4f 43 20 32 31 30 56 0a 20 20 20 20 00 00 00 ff
00 41 33 32 37 35 4a 41 30 34 38 35 32 38 00 04

----------------

Block 0, Base EDID:
  EDID Structure Version & Revision: 1.3
  Vendor & Product Identification:
    Manufacturer: AOC
    Model: 8720
    Serial Number: ...
    Made in: week 21 of 2007
  Basic Display Parameters & Features:
    Digital display
    Maximum image size: 47 cm x 30 cm
    Gamma: 2.20
    DPMS levels: Off
    RGB color display
    First detailed timing is the preferred timing
  Color Characteristics:
    Red  : 0.6435, 0.3320
    Green: 0.2851, 0.6044
    Blue : 0.1513, 0.0751
    White: 0.3125, 0.3281
  Established Timings I & II:
    IBM     :   720x400    70.081663 Hz   9:5     31.467 kHz     28.320000 MHz
    DMT 0x04:   640x480    59.940476 Hz   4:3     31.469 kHz     25.175000 MHz
    Apple   :   640x480    66.666667 Hz   4:3     35.000 kHz     30.240000 MHz
    DMT 0x05:   640x480    72.808802 Hz   4:3     37.861 kHz     31.500000 MHz
    DMT 0x06:   640x480    75.000000 Hz   4:3     37.500 kHz     31.500000 MHz
    DMT 0x08:   800x600    56.250000 Hz   4:3     35.156 kHz     36.000000 MHz
    DMT 0x09:   800x600    60.316541 Hz   4:3     37.879 kHz     40.000000 MHz
    DMT 0x0a:   800x600    72.187572 Hz   4:3     48.077 kHz     50.000000 MHz
    DMT 0x0b:   800x600    75.000000 Hz   4:3     46.875 kHz     49.500000 MHz
    Apple   :   832x624    74.551266 Hz   4:3     49.726 kHz     57.284000 MHz
    DMT 0x10:  1024x768    60.003840 Hz   4:3     48.363 kHz     65.000000 MHz
    DMT 0x11:  1024x768    70.069359 Hz   4:3     56.476 kHz     75.000000 MHz
    DMT 0x12:  1024x768    75.028582 Hz   4:3     60.023 kHz     78.750000 MHz
    DMT 0x24:  1280x1024   75.024675 Hz   5:4     79.976 kHz    135.000000 MHz
  Standard Timings:
    DMT 0x11:  1024x768    70.069359 Hz   4:3     56.476 kHz     75.000000 MHz
    DMT 0x23:  1280x1024   60.019740 Hz   5:4     63.981 kHz    108.000000 MHz
    GTF     :  1280x1024   69.999805 Hz   5:4     74.620 kHz    128.943000 MHz
    GTF     :  1280x1024   72.000069 Hz   5:4     76.824 kHz    132.752000 MHz
    DMT 0x20:  1280x960    60.000000 Hz   4:3     60.000 kHz    108.000000 MHz
    DMT 0x3a:  1680x1050   59.954250 Hz  16:10    65.290 kHz    146.250000 MHz
  Detailed Timing Descriptors:
    DTD 1:  1680x1050   59.851764 Hz  16:10    65.179 kHz    146.000000 MHz (470 mm x 300 mm)
                 Hfront  104 Hsync 176 Hback  280 Hpol P
                 Vfront    3 Vsync   6 Vback   30 Vpol N
    Display Range Limits:
      Monitor ranges (GTF): 56-75 Hz V, 31-80 kHz H, max dotclock 170 MHz
    Display Product Name: 'AOC 210V'
    Display Product Serial Number: ...
Checksum: 0x04

----------------

Block 1, Unknown EDID Extension Block 0x00:
  00 ff ff ff ff ff ff 00 05 e3 10 22 90 bd 00 00 '..........."....'
  15 11 01 03 e8 2f 1e 78 2a c3 d0 a4 55 49 9a 26 '...../.x*...UI.&'
  13 50 54 bf ef 00 61 4c 81 80 81 8a 81 8c 81 40 '.PT...aL.......@'
  b3 00 01 01 01 01 08 39 90 30 62 1a 27 40 68 b0 '.......9.0b.'@h.'
  36 00 d6 2c 11 00 00 1a 00 00 00 fd 00 38 4b 1f '6..,.........8K.'
  50 11 00 0a 20 20 20 20 20 20 00 00 00 fc 00 41 'P...      .....A'
  4f 43 20 32 31 30 56 0a 20 20 20 20 00 00 00 ff 'OC 210V.    ....'
  00 41 33 32 37 35 4a 41 30 34 38 35 32 38 00 04 '.A3275JA048528..'
Checksum: 0x04

----------------

Failures:

Block 0, Base EDID:
  Basic Display Parameters & Features: Digital Video Interface Standard set to reserved value 0x68.
Block 1, Base EDID:
  Unknown Extension Block.
EDID:
  Base EDID: EDID specified 0 extension block(s), but found 1 extension block(s).

EDID conformity: FAIL
