edid-decode (hex):

00 ff ff ff ff ff ff 00 5c b4 15 00 15 00 00 00
25 19 01 03 08 35 1d 78 0a 01 c1 a0 57 47 98 27
12 4c 4c a1 08 00 31 40 45 40 61 40 81 80 a9 40
01 01 01 01 01 01 02 3a 80 18 71 38 2d 40 58 2c
46 00 40 84 63 00 00 1e 00 00 00 ff 00 30 30 32
31 4e 35 33 37 30 33 32 36 39 00 00 00 fd 00 39
3f 1e 50 0f 00 0a 20 20 20 20 20 20 00 00 00 fc
00 57 44 32 34 46 54 31 33 36 30 0a 20 20 00 02

----------------

Block 0, Base EDID:
  EDID Structure Version & Revision: 1.3
  Vendor & Product Identification:
    Manufacturer: WET
    Model: 21
    Serial Number: ...
    Made in: week 37 of 2015
  Basic Display Parameters & Features:
    Analog display
    Signal Level Standard: 0.700 : 0.300 : 1.000 V p-p
    Blank level equals black level
    Sync: Separate
    Maximum image size: 53 cm x 29 cm
    Gamma: 2.20
    RGB color display
    First detailed timing is the preferred timing
  Color Characteristics:
    Red  : 0.6250, 0.3398
    Green: 0.2773, 0.5947
    Blue : 0.1552, 0.0703
    White: 0.2968, 0.2978
  Established Timings I & II:
    IBM     :   720x400    70.081663 Hz   9:5     31.467 kHz     28.320000 MHz
    DMT 0x04:   640x480    59.940476 Hz   4:3     31.469 kHz     25.175000 MHz
    DMT 0x09:   800x600    60.316541 Hz   4:3     37.879 kHz     40.000000 MHz
    DMT 0x10:  1024x768    60.003840 Hz   4:3     48.363 kHz     65.000000 MHz
  Standard Timings:
    DMT 0x04:   640x480    59.940476 Hz   4:3     31.469 kHz     25.175000 MHz
    DMT 0x09:   800x600    60.316541 Hz   4:3     37.879 kHz     40.000000 MHz
    DMT 0x10:  1024x768    60.003840 Hz   4:3     48.363 kHz     65.000000 MHz
    DMT 0x23:  1280x1024   60.019740 Hz   5:4     63.981 kHz    108.000000 MHz
    DMT 0x33:  1600x1200   60.000000 Hz   4:3     75.000 kHz    162.000000 MHz
  Detailed Timing Descriptors:
    DTD 1:  1920x1080   60.000000 Hz  16:9     67.500 kHz    148.500000 MHz (1600 mm x 900 mm)
                 Hfront   88 Hsync  44 Hback  148 Hpol P
                 Vfront    4 Vsync   6 Vback   35 Vpol P
    Display Product Serial Number: ...
    Display Range Limits:
      Monitor ranges (GTF): 57-63 Hz V, 30-80 kHz H, max dotclock 150 MHz
    Display Product Name: 'WD24FT1360'
Checksum: 0x02

----------------

Warnings:

Block 0, Base EDID:
  Detailed Timing Descriptor #1: DTD is similar but not identical to VIC 16.

Failures:

Block 0, Base EDID:
  Detailed Timing Descriptor #1: Mismatch of image size 1600x900 mm vs display size 530x290 mm.
EDID:
  Base EDID: Some timings are out of range of the Monitor Ranges:
    Vertical Freq: 59.940 - 70.082 Hz (Monitor: 57.000 - 63.000 Hz)
    Maximum Clock: 162.000 MHz (Monitor: 150.000 MHz)
  Base EDID: The DTD max image size is 1600x900mm, which is larger than the display size 530.0x290.0mm.

EDID conformity: FAIL
