edid-decode (hex):

00 ff ff ff ff ff ff 00 43 0f 53 27 00 00 00 00
04 22 01 04 b5 3c 21 78 3f 64 f5 ad 50 49 aa 22
13 50 54 a5 cf 00 71 4f 81 c0 81 40 81 80 95 00
a9 c0 b3 00 d1 c0 6a 5e 00 a0 a0 a0 29 50 30 20
35 00 58 4a 21 00 00 1a 00 00 00 ff 00 0a 20 20
20 20 20 20 20 20 20 20 20 20 00 00 00 fd 00 3c
f0 de de 6c 01 0a 20 20 20 20 20 20 00 00 00 fc
00 50 58 32 37 37 4f 4c 45 44 4d 41 58 0a 02 29

02 03 3d f4 4c 01 02 03 04 05 90 11 12 13 14 1f
3f 23 09 06 07 83 01 00 00 6d 1a 00 00 02 01 3c
f0 00 00 68 00 00 00 e3 05 e3 01 e2 00 c0 e6 06
05 01 84 84 00 67 03 0c 00 20 00 38 ff 98 e2 00
a0 a0 a0 29 50 30 20 35 00 58 4a 21 00 00 1a cc
fb 00 5e a0 a0 20 50 20 18 35 00 58 4a 21 00 00
1a 00 00 00 00 00 00 00 00 00 00 00 00 00 00 00
00 00 00 00 00 00 00 00 00 00 00 00 00 00 00 d3

70 12 79 00 00 03 00 50 bf 3e 01 04 ff 09 9f 00
2f 00 1f 00 9f 05 3b 00 02 00 04 00 01 7f 01 04
ff 09 9f 00 2f 00 1f 00 9f 05 3d 00 02 00 04 00
6e c2 00 04 ff 09 9f 00 2f 00 1f 00 9f 05 54 00
04 00 02 00 1f 48 01 04 3f 09 83 00 2f 00 1f 00
33 05 43 00 04 00 02 00 00 00 00 00 00 00 00 00
00 00 00 00 00 00 00 00 00 00 00 00 00 00 00 00
00 00 00 00 00 00 00 00 00 00 00 00 00 00 b8 90

00 ff ff ff ff ff ff 00 43 0f 53 27 00 00 00 00
04 22 01 04 b5 3c 21 78 3f 64 f5 ad 50 49 aa 22
13 50 54 a5 cf 00 71 4f 81 c0 81 40 81 80 95 00
a9 c0 b3 00 d1 c0 6a 5e 00 a0 a0 a0 29 50 30 20
35 00 58 4a 21 00 00 1a 00 00 00 ff 00 0a 20 20
20 20 20 20 20 20 20 20 20 20 00 00 00 fd 00 3c
f0 de de 6c 01 0a 20 20 20 20 20 20 00 00 00 fc
00 50 58 32 37 37 4f 4c 45 44 4d 41 58 0a 02 29

02 03 3d f4 4c 01 02 03 04 05 90 11 12 13 14 1f
3f 23 09 06 07 83 01 00 00 6d 1a 00 00 02 01 3c
f0 00 00 68 00 00 00 e3 05 e3 01 e2 00 c0 e6 06
05 01 84 84 00 67 03 0c 00 20 00 38 ff 98 e2 00
a0 a0 a0 29 50 30 20 35 00 58 4a 21 00 00 1a cc
fb 00 5e a0 a0 20 50 20 18 35 00 58 4a 21 00 00
1a 00 00 00 00 00 00 00 00 00 00 00 00 00 00 00
00 00 00 00 00 00 00 00 00 00 00 00 00 00 00 d3

70 12 79 00 00 03 00 50 bf 3e 01 04 ff 09 9f 00
2f 00 1f 00 9f 05 3b 00 02 00 04 00 01 7f 01 04
ff 09 9f 00 2f 00 1f 00 9f 05 3d 00 02 00 04 00
6e c2 00 04 ff 09 9f 00 2f 00 1f 00 9f 05 54 00
04 00 02 00 1f 48 01 04 3f 09 83 00 2f 00 1f 00
33 05 43 00 04 00 02 00 00 00 00 00 00 00 00 00
00 00 00 00 00 00 00 00 00 00 00 00 00 00 00 00
00 00 00 00 00 00 00 00 00 00 00 00 00 00 b8 90

----------------

Block 0, Base EDID:
  EDID Structure Version & Revision: 1.4
  Vendor & Product Identification:
    Manufacturer: PXO
    Model: 10067
    Made in: week 4 of 2024
  Basic Display Parameters & Features:
    Digital display
    Bits per primary color channel: 10
    DisplayPort interface
    Maximum image size: 60 cm x 33 cm
    Gamma: 2.20
    DPMS levels: Off
    Supported color formats: RGB 4:4:4, YCrCb 4:4:4, YCrCb 4:2:2
    Default (sRGB) color space is primary color space
    First detailed timing includes the native pixel format and preferred refresh rate
    Display is continuous frequency
  Color Characteristics:
    Red  : 0.6767, 0.3144
    Green: 0.2861, 0.6640
    Blue : 0.1357, 0.0771
    White: 0.3134, 0.3291
  Established Timings I & II:
    IBM     :   720x400    70.081663 Hz   9:5     31.467 kHz     28.320000 MHz
    DMT 0x04:   640x480    59.940476 Hz   4:3     31.469 kHz     25.175000 MHz
    DMT 0x06:   640x480    75.000000 Hz   4:3     37.500 kHz     31.500000 MHz
    DMT 0x09:   800x600    60.316541 Hz   4:3     37.879 kHz     40.000000 MHz
    DMT 0x0a:   800x600    72.187572 Hz   4:3     48.077 kHz     50.000000 MHz
    DMT 0x0b:   800x600    75.000000 Hz   4:3     46.875 kHz     49.500000 MHz
    DMT 0x10:  1024x768    60.003840 Hz   4:3     48.363 kHz     65.000000 MHz
    DMT 0x11:  1024x768    70.069359 Hz   4:3     56.476 kHz     75.000000 MHz
    DMT 0x12:  1024x768    75.028582 Hz   4:3     60.023 kHz     78.750000 MHz
    DMT 0x24:  1280x1024   75.024675 Hz   5:4     79.976 kHz    135.000000 MHz
  Standard Timings:
    DMT 0x15:  1152x864    75.000000 Hz   4:3     67.500 kHz    108.000000 MHz
    DMT 0x55:  1280x720    60.000000 Hz  16:9     45.000 kHz     74.250000 MHz
    DMT 0x20:  1280x960    60.000000 Hz   4:3     60.000 kHz    108.000000 MHz
    DMT 0x23:  1280x1024   60.019740 Hz   5:4     63.981 kHz    108.000000 MHz
    DMT 0x2f:  1440x900    59.887445 Hz  16:10    55.935 kHz    106.500000 MHz
    DMT 0x53:  1600x900    60.000000 Hz  16:9     60.000 kHz    108.000000 MHz (RB)
    DMT 0x3a:  1680x1050   59.954250 Hz  16:10    65.290 kHz    146.250000 MHz
    DMT 0x52:  1920x1080   60.000000 Hz  16:9     67.500 kHz    148.500000 MHz
  Detailed Timing Descriptors:
    DTD 1:  2560x1440   60.000199 Hz  16:9     88.860 kHz    241.700000 MHz (600 mm x 330 mm)
                 Hfront   48 Hsync  32 Hback   80 Hpol P
                 Vfront    3 Vsync   5 Vback   33 Vpol N
    Display Product Serial Number: ...
    Display Range Limits:
      Monitor ranges (Bare Limits): 60-240 Hz V, 222-222 kHz H, max dotclock 1080 MHz
    Display Product Name: 'PX277OLEDMAX'
  Extension blocks: 2
Checksum: 0x29

----------------

Block 1, CTA-861 Extension Block:
  Revision: 3
  Underscans IT Video Formats by default
  Basic audio support
  Supports YCbCr 4:4:4
  Supports YCbCr 4:2:2
  Native detailed modes: 4
  Video Data Block:
    VIC   1:   640x480    59.940476 Hz   4:3     31.469 kHz     25.175000 MHz
    VIC   2:   720x480    59.940060 Hz   4:3     31.469 kHz     27.000000 MHz
    VIC   3:   720x480    59.940060 Hz  16:9     31.469 kHz     27.000000 MHz
    VIC   4:  1280x720    60.000000 Hz  16:9     45.000 kHz     74.250000 MHz
    VIC   5:  1920x1080i  60.000000 Hz  16:9     33.750 kHz     74.250000 MHz
    VIC  16:  1920x1080   60.000000 Hz  16:9     67.500 kHz    148.500000 MHz (native)
    VIC  17:   720x576    50.000000 Hz   4:3     31.250 kHz     27.000000 MHz
    VIC  18:   720x576    50.000000 Hz  16:9     31.250 kHz     27.000000 MHz
    VIC  19:  1280x720    50.000000 Hz  16:9     37.500 kHz     74.250000 MHz
    VIC  20:  1920x1080i  50.000000 Hz  16:9     28.125 kHz     74.250000 MHz
    VIC  31:  1920x1080   50.000000 Hz  16:9     56.250 kHz    148.500000 MHz
    VIC  63:  1920x1080  120.000000 Hz  16:9    135.000 kHz    297.000000 MHz
  Audio Data Block:
    Linear PCM:
      Max channels: 2
      Supported sample rates (kHz): 48 44.1
      Supported sample sizes (bits): 24 20 16
  Speaker Allocation Data Block:
    FL/FR - Front Left/Right
  Vendor-Specific Data Block (AMD), OUI 00-00-1A:
    Version: 2.1
    Minimum Refresh Rate: 60 Hz
    Maximum Refresh Rate: 240 Hz
    Flags 1.x: 0x00
    Flags 2.x: 0x00
    Maximum luminance: 104 (475.683 cd/m^2)
    Minimum luminance: 0 (0.000 cd/m^2)
    Unknown: 0x00 0x00
  Colorimetry Data Block:
    xvYCC601
    xvYCC709
    BT2020cYCC
    BT2020YCC
    BT2020RGB
    Gamut Boundary Description Metadata Profile P0
  Video Capability Data Block:
    YCbCr quantization: Selectable (via AVI YQ)
    RGB quantization: Selectable (via AVI Q)
    PT scan behavior: No Data
    IT scan behavior: IT video formats not supported
    CE scan behavior: CE video formats not supported
  HDR Static Metadata Data Block:
    Electro optical transfer functions:
      Traditional gamma - SDR luminance range
      SMPTE ST2084
    Supported static metadata descriptors:
      Static metadata type 1
    Desired content max luminance: 132 (872.406 cd/m^2)
    Desired content max frame-average luminance: 132 (872.406 cd/m^2)
    Desired content min luminance: 0 (0.000 cd/m^2)
  Vendor-Specific Data Block (HDMI), OUI 00-0C-03:
    Source physical address: 2.0.0.0
    DC_36bit
    DC_30bit
    DC_Y444
    Maximum TMDS clock: 1275 MHz
  Detailed Timing Descriptors:
    DTD 2:  2560x1440  144.000477 Hz  16:9    213.265 kHz    580.080000 MHz (600 mm x 330 mm)
                 Hfront   48 Hsync  32 Hback   80 Hpol P
                 Vfront    3 Vsync   5 Vback   33 Vpol N
    DTD 3:  2560x1440  164.999099 Hz  16:9    242.879 kHz    644.600000 MHz (600 mm x 330 mm)
                 Hfront   32 Hsync  24 Hback   38 Hpol P
                 Vfront    3 Vsync   5 Vback   24 Vpol N
Checksum: 0xd3  Unused space in Extension Block: 30 bytes

----------------

Block 2, DisplayID Extension Block:
  Version: 1.2
  Extension Count: 0
  Display Product Type: Extension Section
  Video Timing Modes Type 1 - Detailed Timings Data Block:
    DTD:  2560x1440  200.000000 Hz  16:9    300.000 kHz    816.000000 MHz (aspect 16:9, no 3D stereo)
               Hfront   48 Hsync  32 Hback   80 Hpol N
               Vfront    3 Vsync   5 Vback   52 Vpol N
    DTD:  2560x1440  239.998629 Hz  16:9    360.478 kHz    980.500000 MHz (aspect 16:9, no 3D stereo)
               Hfront   48 Hsync  32 Hback   80 Hpol N
               Vfront    3 Vsync   5 Vback   54 Vpol N
    DTD:  2560x1440  119.997589 Hz  16:9    182.996 kHz    497.750000 MHz (aspect 16:9, no 3D stereo)
               Hfront   48 Hsync  32 Hback   80 Hpol N
               Vfront    5 Vsync   3 Vback   77 Vpol N
    DTD:  2368x1332  240.000000 Hz  16:9    336.000 kHz    840.000000 MHz (aspect 16:9, no 3D stereo)
               Hfront   48 Hsync  32 Hback   52 Hpol N
               Vfront    5 Vsync   3 Vback   60 Vpol N
  Checksum: 0xb8
Checksum: 0x90

----------------

Block 3, Unknown EDID Extension Block 0x00:
  00 ff ff ff ff ff ff 00 43 0f 53 27 00 00 00 00 '........C.S'....'
  04 22 01 04 b5 3c 21 78 3f 64 f5 ad 50 49 aa 22 '."...<!x?d..PI."'
  13 50 54 a5 cf 00 71 4f 81 c0 81 40 81 80 95 00 '.PT...qO...@....'
  a9 c0 b3 00 d1 c0 6a 5e 00 a0 a0 a0 29 50 30 20 '......j^....)P0 '
  35 00 58 4a 21 00 00 1a 00 00 00 ff 00 0a 20 20 '5.XJ!.........  '
  20 20 20 20 20 20 20 20 20 20 00 00 00 fd 00 3c '          .....<'
  f0 de de 6c 01 0a 20 20 20 20 20 20 00 00 00 fc '...l..      ....'
  00 50 58 32 37 37 4f 4c 45 44 4d 41 58 0a 02 29 '.PX277OLEDMAX..)'
Checksum: 0x29

----------------

Block 4, CTA-861 Extension Block:
  Revision: 3
  Underscans IT Video Formats by default
  Basic audio support
  Supports YCbCr 4:4:4
  Supports YCbCr 4:2:2
  Native detailed modes: 4
  Video Data Block:
    VIC   1:   640x480    59.940476 Hz   4:3     31.469 kHz     25.175000 MHz
    VIC   2:   720x480    59.940060 Hz   4:3     31.469 kHz     27.000000 MHz
    VIC   3:   720x480    59.940060 Hz  16:9     31.469 kHz     27.000000 MHz
    VIC   4:  1280x720    60.000000 Hz  16:9     45.000 kHz     74.250000 MHz
    VIC   5:  1920x1080i  60.000000 Hz  16:9     33.750 kHz     74.250000 MHz
    VIC  16:  1920x1080   60.000000 Hz  16:9     67.500 kHz    148.500000 MHz (native)
    VIC  17:   720x576    50.000000 Hz   4:3     31.250 kHz     27.000000 MHz
    VIC  18:   720x576    50.000000 Hz  16:9     31.250 kHz     27.000000 MHz
    VIC  19:  1280x720    50.000000 Hz  16:9     37.500 kHz     74.250000 MHz
    VIC  20:  1920x1080i  50.000000 Hz  16:9     28.125 kHz     74.250000 MHz
    VIC  31:  1920x1080   50.000000 Hz  16:9     56.250 kHz    148.500000 MHz
    VIC  63:  1920x1080  120.000000 Hz  16:9    135.000 kHz    297.000000 MHz
  Audio Data Block:
    Linear PCM:
      Max channels: 2
      Supported sample rates (kHz): 48 44.1
      Supported sample sizes (bits): 24 20 16
  Speaker Allocation Data Block:
    FL/FR - Front Left/Right
  Vendor-Specific Data Block (AMD), OUI 00-00-1A:
    Version: 2.1
    Minimum Refresh Rate: 60 Hz
    Maximum Refresh Rate: 240 Hz
    Flags 1.x: 0x00
    Flags 2.x: 0x00
    Maximum luminance: 104 (475.683 cd/m^2)
    Minimum luminance: 0 (0.000 cd/m^2)
    Unknown: 0x00 0x00
  Colorimetry Data Block:
    xvYCC601
    xvYCC709
    BT2020cYCC
    BT2020YCC
    BT2020RGB
    Gamut Boundary Description Metadata Profile P0
  Video Capability Data Block:
    YCbCr quantization: Selectable (via AVI YQ)
    RGB quantization: Selectable (via AVI Q)
    PT scan behavior: No Data
    IT scan behavior: IT video formats not supported
    CE scan behavior: CE video formats not supported
  HDR Static Metadata Data Block:
    Electro optical transfer functions:
      Traditional gamma - SDR luminance range
      SMPTE ST2084
    Supported static metadata descriptors:
      Static metadata type 1
    Desired content max luminance: 132 (872.406 cd/m^2)
    Desired content max frame-average luminance: 132 (872.406 cd/m^2)
    Desired content min luminance: 0 (0.000 cd/m^2)
  Vendor-Specific Data Block (HDMI), OUI 00-0C-03:
    Source physical address: 2.0.0.0
    DC_36bit
    DC_30bit
    DC_Y444
    Maximum TMDS clock: 1275 MHz
  Detailed Timing Descriptors:
    DTD 4:  2560x1440  144.000477 Hz  16:9    213.265 kHz    580.080000 MHz (600 mm x 330 mm)
                 Hfront   48 Hsync  32 Hback   80 Hpol P
                 Vfront    3 Vsync   5 Vback   33 Vpol N
    DTD 5:  2560x1440  164.999099 Hz  16:9    242.879 kHz    644.600000 MHz (600 mm x 330 mm)
                 Hfront   32 Hsync  24 Hback   38 Hpol P
                 Vfront    3 Vsync   5 Vback   24 Vpol N
Checksum: 0xd3  Unused space in Extension Block: 30 bytes

----------------

Block 5, DisplayID Extension Block:
  Version: 1.2
  Extension Count: 0
  Video Timing Modes Type 1 - Detailed Timings Data Block:
    DTD:  2560x1440  200.000000 Hz  16:9    300.000 kHz    816.000000 MHz (aspect 16:9, no 3D stereo)
               Hfront   48 Hsync  32 Hback   80 Hpol N
               Vfront    3 Vsync   5 Vback   52 Vpol N
    DTD:  2560x1440  239.998629 Hz  16:9    360.478 kHz    980.500000 MHz (aspect 16:9, no 3D stereo)
               Hfront   48 Hsync  32 Hback   80 Hpol N
               Vfront    3 Vsync   5 Vback   54 Vpol N
    DTD:  2560x1440  119.997589 Hz  16:9    182.996 kHz    497.750000 MHz (aspect 16:9, no 3D stereo)
               Hfront   48 Hsync  32 Hback   80 Hpol N
               Vfront    5 Vsync   3 Vback   77 Vpol N
    DTD:  2368x1332  240.000000 Hz  16:9    336.000 kHz    840.000000 MHz (aspect 16:9, no 3D stereo)
               Hfront   48 Hsync  32 Hback   52 Hpol N
               Vfront    5 Vsync   3 Vback   60 Vpol N
  Checksum: 0xb8
Checksum: 0x90

----------------

Warnings:

Block 1, CTA-861 Extension Block:
  Video Capability Data Block: IT scan behavior is expected to support underscanned.
  Video Capability Data Block: 'CE video formats not supported' makes no sense.
Block 4, CTA-861 Extension Block:
  Video Capability Data Block: IT scan behavior is expected to support underscanned.
  Video Capability Data Block: 'CE video formats not supported' makes no sense.
EDID:
  Base EDID: Some timings are out of range of the Monitor Ranges:
    Vertical Freq: 50.000 - 240.000 Hz (Monitor: 60.000 - 240.000 Hz)
    Horizontal Freq: 28.125 - 360.477 kHz (Monitor: 222.000 - 222.000 kHz)

Failures:

Block 0, Base EDID:
  Basic Display Parameters & Features: sRGB is signaled, but the chromaticities do not match.
  Display Product Serial Number: ...
Block 1, CTA-861 Extension Block:
  Vendor-Specific Data Block (HDMI), OUI 00-0C-03: HDMI VSDB Max TMDS rate is > 340.
  Vendor-Specific Data Block (HDMI), OUI 00-0C-03: The HDMI Specification requires EDID 1.3 instead of 1.4.
Block 2, DisplayID Extension Block:
  DisplayID Base Block has no product type.
  Expected 0 DisplayID Extension Block, but got 1.
Block 3, Base EDID:
  Unknown Extension Block.
Block 4, CTA-861 Extension Block:
  Video Data Block: Duplicate VIC 1.
  Video Data Block: Duplicate VIC 2.
  Video Data Block: Duplicate VIC 3.
  Video Data Block: Duplicate VIC 4.
  Video Data Block: Duplicate VIC 5.
  Video Data Block: Duplicate VIC 16.
  Video Data Block: Duplicate VIC 17.
  Video Data Block: Duplicate VIC 18.
  Video Data Block: Duplicate VIC 19.
  Video Data Block: Duplicate VIC 20.
  Video Data Block: Duplicate VIC 31.
  Video Data Block: Duplicate VIC 63.
  Speaker Allocation Data Block: Only one instance of this Data Block is allowed.
  Colorimetry Data Block: Only one instance of this Data Block is allowed.
  Video Capability Data Block: Only one instance of this Data Block is allowed.
  HDR Static Metadata Data Block: Only one instance of this Data Block is allowed.
  Vendor-Specific Data Block (HDMI), OUI 00-0C-03: HDMI VSDB Max TMDS rate is > 340.
  Vendor-Specific Data Block (HDMI), OUI 00-0C-03: The HDMI Specification requires EDID 1.3 instead of 1.4.
EDID:
  Base EDID: EDID specified 2 extension block(s), but found 5 extension block(s).
  CTA-861: Native progressive timings are a mix of several resolutions.
  DisplayID: Missing DisplayID Product Identification Data Block.
  DisplayID: DisplayID expects at least one preferred timing.

EDID conformity: FAIL
