edid-decode (hex):

00 ff ff ff ff ff ff 00 59 3a 00 20 01 01 01 01
2d 10 01 03 80 46 27 78 0a e6 98 a3 54 4a 99 26
0f 4b 4e 25 4f 00 01 01 01 01 01 01 01 01 01 01
01 01 01 01 01 c1 01 1d 00 72 51 d0 1e 20 6e 28
55 00 bc f9 10 00 00 1e 00 00 00 fd 00 32 55 1f
46 0b 00 0a 20 20 20 20 20 20 00 00 00 ff 00 53
41 41 41 41 47 34 35 30 36 37 34 38 00 00 00 fc
00 56 49 5a 49 4f 20 56 58 32 30 4c 0a 20 01 77

02 03 1b 71 48 84 01 03 13 05 12 15 14 23 09 07
03 83 01 00 00 65 03 0c 00 10 00 01 1d 00 bc 52
d0 1e 20 b8 28 55 40 bc f9 10 00 00 1e 01 1d 80
d0 72 1c 16 20 10 2c 25 80 bc f9 10 00 00 9e 8c
0a d0 8a 20 e0 2d 10 10 3e 96 00 bc f9 10 00 00
18 01 1d 80 18 71 1c 16 20 58 2c 25 00 bc f9 10
00 00 9e 8c 0a d0 90 20 40 31 20 0c 40 55 00 bc
f9 10 00 00 18 00 00 00 00 00 00 00 00 00 00 6e

00 ff ff ff ff ff ff 00 59 3a 00 20 01 01 01 01
2d 10 01 03 80 46 27 78 0a e6 98 a3 54 4a 99 26
0f 4b 4e 25 4f 00 01 01 01 01 01 01 01 01 01 01
01 01 01 01 01 c1 01 1d 00 72 51 d0 1e 20 6e 28
55 00 bc f9 10 00 00 1e 00 00 00 fd 00 32 55 1f
46 0b 00 0a 20 20 20 20 20 20 00 00 00 ff 00 53
41 41 41 41 47 34 35 30 36 37 34 38 00 00 00 fc
00 56 49 5a 49 4f 20 56 58 32 30 4c 0a 20 01 77

02 03 1b 71 48 84 01 03 13 05 12 15 14 23 09 07
03 83 01 00 00 65 03 0c 00 10 00 01 1d 00 bc 52
d0 1e 20 b8 28 55 40 bc f9 10 00 00 1e 01 1d 80
d0 72 1c 16 20 10 2c 25 80 bc f9 10 00 00 9e 8c
0a d0 8a 20 e0 2d 10 10 3e 96 00 bc f9 10 00 00
18 01 1d 80 18 71 1c 16 20 58 2c 25 00 bc f9 10
00 00 9e 8c 0a d0 90 20 40 31 20 0c 40 55 00 bc
f9 10 00 00 18 00 00 00 00 00 00 00 00 00 00 6e

----------------

Block 0, Base EDID:
  EDID Structure Version & Revision: 1.3
  Vendor & Product Identification:
    Manufacturer: VIZ
    Model: 8192
    Serial Number: ...
    Made in: week 45 of 2006
  Basic Display Parameters & Features:
    Digital display
    Maximum image size: 70 cm x 39 cm
    Gamma: 2.20
    RGB color display
    First detailed timing is the preferred timing
  Color Characteristics:
    Red  : 0.6396, 0.3300
    Green: 0.2900, 0.5996
    Blue : 0.1503, 0.0595
    White: 0.2949, 0.3046
  Established Timings I & II:
    DMT 0x04:   640x480    59.940476 Hz   4:3     31.469 kHz     25.175000 MHz
    DMT 0x06:   640x480    75.000000 Hz   4:3     37.500 kHz     31.500000 MHz
    DMT 0x09:   800x600    60.316541 Hz   4:3     37.879 kHz     40.000000 MHz
    DMT 0x0b:   800x600    75.000000 Hz   4:3     46.875 kHz     49.500000 MHz
    DMT 0x10:  1024x768    60.003840 Hz   4:3     48.363 kHz     65.000000 MHz
    DMT 0x11:  1024x768    70.069359 Hz   4:3     56.476 kHz     75.000000 MHz
    DMT 0x12:  1024x768    75.028582 Hz   4:3     60.023 kHz     78.750000 MHz
    DMT 0x24:  1280x1024   75.024675 Hz   5:4     79.976 kHz    135.000000 MHz
  Standard Timings:
  Detailed Timing Descriptors:
    DTD  1:  1280x720    60.000000 Hz  16:9     45.000 kHz     74.250000 MHz (444 mm x 249 mm)
                  Hfront  110 Hsync  40 Hback  220 Hpol P
                  Vfront    5 Vsync   5 Vback   20 Vpol P
    Display Range Limits:
      Monitor ranges (GTF): 50-85 Hz V, 31-70 kHz H, max dotclock 110 MHz
    Display Product Serial Number: ...
    Display Product Name: 'VIZIO VX20L'
  Extension blocks: 1
Checksum: 0x77

----------------

Block 1, CTA-861 Extension Block:
  Revision: 3
  Basic audio support
  Supports YCbCr 4:4:4
  Supports YCbCr 4:2:2
  Native detailed modes: 1
  Video Data Block:
    VIC   4:  1280x720    60.000000 Hz  16:9     45.000 kHz     74.250000 MHz (native)
    VIC   1:   640x480    59.940476 Hz   4:3     31.469 kHz     25.175000 MHz
    VIC   3:   720x480    59.940060 Hz  16:9     31.469 kHz     27.000000 MHz
    VIC  19:  1280x720    50.000000 Hz  16:9     37.500 kHz     74.250000 MHz
    VIC   5:  1920x1080i  60.000000 Hz  16:9     33.750 kHz     74.250000 MHz
    VIC  18:   720x576    50.000000 Hz  16:9     31.250 kHz     27.000000 MHz
    VIC  21:  1440x576i   50.000000 Hz   4:3     15.625 kHz     27.000000 MHz
    VIC  20:  1920x1080i  50.000000 Hz  16:9     28.125 kHz     74.250000 MHz
  Audio Data Block:
    Linear PCM:
      Max channels: 2
      Supported sample rates (kHz): 48 44.1 32
      Supported sample sizes (bits): 20 16
  Speaker Allocation Data Block:
    FL/FR - Front Left/Right
  Vendor-Specific Data Block (HDMI), OUI 00-0C-03:
    Source physical address: 1.0.0.0
  Detailed Timing Descriptors:
    DTD  2:  1280x720    50.000000 Hz  16:9     37.500 kHz     74.250000 MHz (444 mm x 249 mm)
                  Hfront  440 Hsync  40 Hback  220 Hpol P
                  Vfront    5 Vsync   5 Vback   20 Vpol P
    DTD  3:  1920x1080i  50.000000 Hz  16:9     28.125 kHz     74.250000 MHz (444 mm x 249 mm)
                  Hfront  528 Hsync  44 Hback  148 Hpol P
                  Vfront    2 Vsync   5 Vback   15 Vpol P Vfront +0.5 Odd Field
                  Vfront    2 Vsync   5 Vback   15 Vpol P Vback  +0.5 Even Field
    DTD  4:   720x480    59.940060 Hz   3:2     31.469 kHz     27.000000 MHz (444 mm x 249 mm)
                  Hfront   16 Hsync  62 Hback   60 Hpol N
                  Vfront    9 Vsync   6 Vback   30 Vpol N
    DTD  5:  1920x1080i  60.000000 Hz  16:9     33.750 kHz     74.250000 MHz (444 mm x 249 mm)
                  Hfront   88 Hsync  44 Hback  148 Hpol P
                  Vfront    2 Vsync   5 Vback   15 Vpol P Vfront +0.5 Odd Field
                  Vfront    2 Vsync   5 Vback   15 Vpol P Vback  +0.5 Even Field
    DTD  6:   720x576    50.000000 Hz   5:4     31.250 kHz     27.000000 MHz (444 mm x 249 mm)
                  Hfront   12 Hsync  64 Hback   68 Hpol N
                  Vfront    5 Vsync   5 Vback   39 Vpol N
Checksum: 0x6e  Unused space in Extension Block: 10 bytes

----------------

Block 2, Unknown EDID Extension Block 0x00:
  00 ff ff ff ff ff ff 00 59 3a 00 20 01 01 01 01 '........Y:. ....'
  2d 10 01 03 80 46 27 78 0a e6 98 a3 54 4a 99 26 '-....F'x....TJ.&'
  0f 4b 4e 25 4f 00 01 01 01 01 01 01 01 01 01 01 '.KN%O...........'
  01 01 01 01 01 c1 01 1d 00 72 51 d0 1e 20 6e 28 '.........rQ.. n('
  55 00 bc f9 10 00 00 1e 00 00 00 fd 00 32 55 1f 'U............2U.'
  46 0b 00 0a 20 20 20 20 20 20 00 00 00 ff 00 53 'F...      .....S'
  41 41 41 41 47 34 35 30 36 37 34 38 00 00 00 fc 'AAAAG4506748....'
  00 56 49 5a 49 4f 20 56 58 32 30 4c 0a 20 01 77 '.VIZIO VX20L. .w'
Checksum: 0x77

----------------

Block 3, CTA-861 Extension Block:
  Revision: 3
  Basic audio support
  Supports YCbCr 4:4:4
  Supports YCbCr 4:2:2
  Native detailed modes: 1
  Video Data Block:
    VIC   4:  1280x720    60.000000 Hz  16:9     45.000 kHz     74.250000 MHz (native)
    VIC   1:   640x480    59.940476 Hz   4:3     31.469 kHz     25.175000 MHz
    VIC   3:   720x480    59.940060 Hz  16:9     31.469 kHz     27.000000 MHz
    VIC  19:  1280x720    50.000000 Hz  16:9     37.500 kHz     74.250000 MHz
    VIC   5:  1920x1080i  60.000000 Hz  16:9     33.750 kHz     74.250000 MHz
    VIC  18:   720x576    50.000000 Hz  16:9     31.250 kHz     27.000000 MHz
    VIC  21:  1440x576i   50.000000 Hz   4:3     15.625 kHz     27.000000 MHz
    VIC  20:  1920x1080i  50.000000 Hz  16:9     28.125 kHz     74.250000 MHz
  Audio Data Block:
    Linear PCM:
      Max channels: 2
      Supported sample rates (kHz): 48 44.1 32
      Supported sample sizes (bits): 20 16
  Speaker Allocation Data Block:
    FL/FR - Front Left/Right
  Vendor-Specific Data Block (HDMI), OUI 00-0C-03:
    Source physical address: 1.0.0.0
  Detailed Timing Descriptors:
    DTD  7:  1280x720    50.000000 Hz  16:9     37.500 kHz     74.250000 MHz (444 mm x 249 mm)
                  Hfront  440 Hsync  40 Hback  220 Hpol P
                  Vfront    5 Vsync   5 Vback   20 Vpol P
    DTD  8:  1920x1080i  50.000000 Hz  16:9     28.125 kHz     74.250000 MHz (444 mm x 249 mm)
                  Hfront  528 Hsync  44 Hback  148 Hpol P
                  Vfront    2 Vsync   5 Vback   15 Vpol P Vfront +0.5 Odd Field
                  Vfront    2 Vsync   5 Vback   15 Vpol P Vback  +0.5 Even Field
    DTD  9:   720x480    59.940060 Hz   3:2     31.469 kHz     27.000000 MHz (444 mm x 249 mm)
                  Hfront   16 Hsync  62 Hback   60 Hpol N
                  Vfront    9 Vsync   6 Vback   30 Vpol N
    DTD 10:  1920x1080i  60.000000 Hz  16:9     33.750 kHz     74.250000 MHz (444 mm x 249 mm)
                  Hfront   88 Hsync  44 Hback  148 Hpol P
                  Vfront    2 Vsync   5 Vback   15 Vpol P Vfront +0.5 Odd Field
                  Vfront    2 Vsync   5 Vback   15 Vpol P Vback  +0.5 Even Field
    DTD 11:   720x576    50.000000 Hz   5:4     31.250 kHz     27.000000 MHz (444 mm x 249 mm)
                  Hfront   12 Hsync  64 Hback   68 Hpol N
                  Vfront    5 Vsync   5 Vback   39 Vpol N
Checksum: 0x6e  Unused space in Extension Block: 10 bytes

----------------

Warnings:

Block 1, CTA-861 Extension Block:
  IT Video Formats are overscanned by default, but normally this should be underscanned.
  Display Product Serial Number is set, so the Serial Number in the Base EDID should be 0.
  Add a Colorimetry Data Block with the sRGB colorimetry bit set to avoid interop issues.
Block 3, CTA-861 Extension Block:
  IT Video Formats are overscanned by default, but normally this should be underscanned.
  Display Product Serial Number is set, so the Serial Number in the Base EDID should be 0.
  Add a Colorimetry Data Block with the sRGB colorimetry bit set to avoid interop issues.
EDID:
  CTA-861: Multiple native progressive timings are defined.

Failures:

Block 0, Base EDID:
  Standard Timings: Use 0x0101 as the invalid Standard Timings code, not 0x01c1.
  Detailed Timing Descriptor #1: Mismatch of image size 444x249 mm vs display size 700x390 mm.
Block 1, CTA-861 Extension Block:
  Detailed Timing Descriptor #2: Mismatch of image size 444x249 mm vs display size 700x390 mm.
  Detailed Timing Descriptor #3: Mismatch of image size 444x249 mm vs display size 700x390 mm.
  Detailed Timing Descriptor #4: Mismatch of image size 444x249 mm vs display size 700x390 mm.
  Detailed Timing Descriptor #5: Mismatch of image size 444x249 mm vs display size 700x390 mm.
  Detailed Timing Descriptor #6: Mismatch of image size 444x249 mm vs display size 700x390 mm.
  Missing VCDB, needed for Set Selectable RGB Quantization to avoid interop issues.
Block 2, Base EDID:
  Unknown Extension Block.
Block 3, CTA-861 Extension Block:
  Video Data Block: Duplicate VIC 4.
  Video Data Block: Duplicate VIC 1.
  Video Data Block: Duplicate VIC 3.
  Video Data Block: Duplicate VIC 19.
  Video Data Block: Duplicate VIC 5.
  Video Data Block: Duplicate VIC 18.
  Video Data Block: Duplicate VIC 21.
  Video Data Block: Duplicate VIC 20.
  Speaker Allocation Data Block: Only one instance of this Data Block is allowed.
  Detailed Timing Descriptor #7: Mismatch of image size 444x249 mm vs display size 700x390 mm.
  Detailed Timing Descriptor #8: Mismatch of image size 444x249 mm vs display size 700x390 mm.
  Detailed Timing Descriptor #9: Mismatch of image size 444x249 mm vs display size 700x390 mm.
  Detailed Timing Descriptor #10: Mismatch of image size 444x249 mm vs display size 700x390 mm.
  Detailed Timing Descriptor #11: Mismatch of image size 444x249 mm vs display size 700x390 mm.
  Missing VCDB, needed for Set Selectable RGB Quantization to avoid interop issues.
EDID:
  Base EDID: Some timings are out of range of the Monitor Ranges:
    Horizontal Freq: 15.625 - 79.976 kHz (Monitor: 31.000 - 70.000 kHz)
    Maximum Clock: 135.000 MHz (Monitor: 110.000 MHz)
  Base EDID: EDID specified 1 extension block(s), but found 3 extension block(s).
  Base EDID: EDID 1.3 requires a Block Map Extension in Block 1 if there are more than 2 blocks in the EDID.

EDID conformity: FAIL
