
EDID (hex):
00ffffffffffff0006af2c3400000000
00140103801d10780a1315a058529025
0f505400000001010101010101010101
010101010101121b565a500019303020
360025a4100000180000000f00000000
00000000000000000020000000fe0041
554f0a202020202020202020000000fe
004231333358573033205634200a00da

Extracted contents:
header:          00 ff ff ff ff ff ff 00
serial number:   06 af 2c 34 00 00 00 00 00 14
version:         01 03
basic params:    80 1d 10 78 0a
chroma info:     13 15 a0 58 52 90 25 0f 50 54
established:     00 00 00
standard:        01 01 01 01 01 01 01 01 01 01 01 01 01 01 01 01
descriptor 1:    12 1b 56 5a 50 00 19 30 30 20 36 00 25 a4 10 00 00 18
descriptor 2:    00 00 00 0f 00 00 00 00 00 00 00 00 00 00 00 00 00 20
descriptor 3:    00 00 00 fe 00 41 55 4f 0a 20 20 20 20 20 20 20 20 20
descriptor 4:    00 00 00 fe 00 42 31 33 33 58 57 30 33 20 56 34 20 0a
extensions:      00
checksum:        da

EDID version: 1.3
Manufacturer: AUO Model 342c Serial Number --
Made in year 2010
Digital display
Maximum image size: 29 cm x 16 cm
Gamma: 2.20
RGB color display
First detailed timing is preferred timing
Display x,y Chromaticity:
  Red:   0.6250, 0.3447
  Green: 0.3203, 0.5654
  Blue:  0.1445, 0.0595
  White: 0.3134, 0.3291
Established timings supported:
Standard timings supported:
Detailed mode: Clock 69.300 MHz, 293 mm x 164 mm
               1366 1414 1446 1456 hborder 0
                768  771  777  793 vborder 0
               -hsync -vsync 
               VertFreq: 60 Hz, HorFreq: 47596 Hz
Manufacturer-specified data, tag 15
ASCII string: AUO
ASCII string: B133XW03 V4 
Checksum: 0xda (valid)
EDID block does NOT conform to EDID 1.3!
	Missing name descriptor
	Missing monitor ranges
