
EDID (hex):
00ffffffffffff0059f2501900000000
171b0104a52c1778e2b1a5a1584f9526
165054afcf0081404540614c81008100
81c101010101662156aa51001e30468f
3300c4fe1000001e662150b051001b30
40703600c4fe1000001e0e1f00805100
1e303020370070cf1000001e000000fc
004c454431393230310a20202020005e

Extracted contents:
header:          00 ff ff ff ff ff ff 00
serial number:   59 f2 50 19 00 00 00 00 17 1b
version:         01 04
basic params:    a5 2c 17 78 e2
chroma info:     b1 a5 a1 58 4f 95 26 16 50 54
established:     af cf 00
standard:        81 40 45 40 61 4c 81 00 81 00 81 c1 01 01 01 01
descriptor 1:    66 21 56 aa 51 00 1e 30 46 8f 33 00 c4 fe 10 00 00 1e
descriptor 2:    66 21 50 b0 51 00 1b 30 40 70 36 00 c4 fe 10 00 00 1e
descriptor 3:    0e 1f 00 80 51 00 1e 30 30 20 37 00 70 cf 10 00 00 1e
descriptor 4:    00 00 00 fc 00 4c 45 44 31 39 32 30 31 0a 20 20 20 20
extensions:      00
checksum:        5e

EDID version: 1.4
Manufacturer: VOR Model 1950 Serial Number --
Made in week 23 of 2017
Digital display
8 bits per primary color channel
DisplayPort interface
Maximum image size: 44 cm x 23 cm
Gamma: 2.20
DPMS levels: Standby Suspend Off
Supported color formats: RGB 4:4:4
First detailed timing includes the native pixel format and preferred refresh rate
Display x,y Chromaticity:
  Red:   0.6308, 0.3466
  Green: 0.3085, 0.5830
  Blue:  0.1503, 0.0878
  White: 0.3134, 0.3291
Established timings supported:
  720x400@70Hz 9:5 HorFreq: 31469 Hz Clock: 28.320 MHz
  640x480@60Hz 4:3 HorFreq: 31469 Hz Clock: 25.175 MHz
  640x480@72Hz 4:3 HorFreq: 37900 Hz Clock: 31.500 MHz
  640x480@75Hz 4:3 HorFreq: 37500 Hz Clock: 31.500 MHz
  800x600@56Hz 4:3 HorFreq: 35200 Hz Clock: 36.000 MHz
  800x600@60Hz 4:3 HorFreq: 37900 Hz Clock: 40.000 MHz
  800x600@72Hz 4:3 HorFreq: 48100 Hz Clock: 50.000 MHz
  800x600@75Hz 4:3 HorFreq: 46900 Hz Clock: 49.500 MHz
  1024x768@60Hz 4:3 HorFreq: 48400 Hz Clock: 65.000 MHz
  1024x768@70Hz 4:3 HorFreq: 56500 Hz Clock: 75.000 MHz
  1024x768@75Hz 4:3 HorFreq: 60000 Hz Clock: 78.750 MHz
  1280x1024@75Hz 5:4 HorFreq: 80000 Hz Clock: 135.000 MHz
Standard timings supported:
  1280x960@60Hz 4:3 HorFreq: 60000 Hz Clock: 108.000 MHz
  800x600@60Hz 4:3 HorFreq: 37900 Hz Clock: 40.000 MHz
  1024x768@72Hz 4:3
  1280x800@60Hz 16:10
  1280x800@60Hz 16:10
  1280x720@61Hz 16:9
Detailed mode: Clock 85.500 MHz, 452 mm x 254 mm
               1366 1436 1579 1792 hborder 0
                768  771  774  798 vborder 0
               +hsync +vsync 
               VertFreq: 59 Hz, HorFreq: 47712 Hz
Detailed mode: Clock 85.500 MHz, 452 mm x 254 mm
               1360 1424 1536 1792 hborder 0
                768  771  777  795 vborder 0
               +hsync +vsync 
               VertFreq: 60 Hz, HorFreq: 47712 Hz
Detailed mode: Clock 79.500 MHz, 368 mm x 207 mm
               1280 1328 1360 1664 hborder 0
                768  771  778  798 vborder 0
               +hsync +vsync 
               VertFreq: 59 Hz, HorFreq: 47776 Hz
Monitor name: LED19201
Checksum: 0x5e (valid)
	Missing monitor ranges


