
EDID (hex):
00ffffffffffff001e6d69566fab0000
06110103ea2b1b78eacfc5a35a49a025
125054a76b80950081808140714f0101
0101010101017c2e90a0601a1e403020
3600b20e1100001a21399030621a2740
68b03600b20e1100001c000000fd0038
4b1e530f000a202020202020000000fc
004c323036570a2020202020202000a9

Extracted contents:
header:          00 ff ff ff ff ff ff 00
serial number:   1e 6d 69 56 6f ab 00 00 06 11
version:         01 03
basic params:    ea 2b 1b 78 ea
chroma info:     cf c5 a3 5a 49 a0 25 12 50 54
established:     a7 6b 80
standard:        95 00 81 80 81 40 71 4f 01 01 01 01 01 01 01 01
descriptor 1:    7c 2e 90 a0 60 1a 1e 40 30 20 36 00 b2 0e 11 00 00 1a
descriptor 2:    21 39 90 30 62 1a 27 40 68 b0 36 00 b2 0e 11 00 00 1c
descriptor 3:    00 00 00 fd 00 38 4b 1e 53 0f 00 0a 20 20 20 20 20 20
descriptor 4:    00 00 00 fc 00 4c 32 30 36 57 0a 20 20 20 20 20 20 20
extensions:      00
checksum:        a9

EDID version: 1.3
Manufacturer: GSM Model 5669 Serial Number --
Made in week 6 of 2007
Digital display
Maximum image size: 43 cm x 27 cm
Gamma: 2.20
DPMS levels: Standby Suspend Off
RGB color display
First detailed timing is preferred timing
Display x,y Chromaticity:
  Red:   0.6396, 0.3515
  Green: 0.2880, 0.6279
  Blue:  0.1474, 0.0703
  White: 0.3134, 0.3291
Established timings supported:
  720x400@70Hz 9:5 HorFreq: 31469 Hz Clock: 28.320 MHz
  640x480@60Hz 4:3 HorFreq: 31469 Hz Clock: 25.175 MHz
  640x480@75Hz 4:3 HorFreq: 37500 Hz Clock: 31.500 MHz
  800x600@56Hz 4:3 HorFreq: 35200 Hz Clock: 36.000 MHz
  800x600@60Hz 4:3 HorFreq: 37900 Hz Clock: 40.000 MHz
  800x600@75Hz 4:3 HorFreq: 46900 Hz Clock: 49.500 MHz
  832x624@75Hz 4:3 HorFreq: 49726 Hz Clock: 57.284 MHz
  1024x768@60Hz 4:3 HorFreq: 48400 Hz Clock: 65.000 MHz
  1024x768@75Hz 4:3 HorFreq: 60000 Hz Clock: 78.750 MHz
  1280x1024@75Hz 5:4 HorFreq: 80000 Hz Clock: 135.000 MHz
  1152x870@75Hz 192:145 HorFreq: 67500 Hz Clock: 108.000 MHz
Standard timings supported:
  1440x900@60Hz 16:10 HorFreq: 55500 Hz Clock: 88.750 MHz
  1280x1024@60Hz 5:4 HorFreq: 64000 Hz Clock: 108.000 MHz
  1280x960@60Hz 4:3 HorFreq: 60000 Hz Clock: 108.000 MHz
  1152x864@75Hz 4:3 HorFreq: 67500 Hz Clock: 108.000 MHz
Detailed mode: Clock 119.000 MHz, 434 mm x 270 mm
               1680 1728 1760 1840 hborder 0
               1050 1053 1059 1080 vborder 0
               +hsync -vsync 
               VertFreq: 59 Hz, HorFreq: 64673 Hz
Detailed mode: Clock 146.250 MHz, 434 mm x 270 mm
               1680 1784 1960 2240 hborder 0
               1050 1053 1059 1089 vborder 0
               -hsync +vsync 
               VertFreq: 59 Hz, HorFreq: 65290 Hz
Monitor ranges (GTF): 56-75Hz V, 30-83kHz H, max dotclock 150MHz
Monitor name: L206W
Checksum: 0xa9 (valid)
EDID block does NOT conform to EDID 1.3!
	Digital display field contains garbage: 6a
