edid-decode (hex):

00 ff ff ff ff ff ff 00 54 e4 02 22 11 11 21 20
29 1d 01 03 80 30 1b 78 aa d6 a5 a2 59 4a 95 24
14 50 54 21 08 00 71 c0 81 80 81 c0 8b c0 95 00
01 40 b3 01 01 01 02 3a 80 18 71 38 2d 40 58 2c
45 00 dc 0c 11 00 00 1e 00 00 00 fc 00 41 72 74
69 73 74 32 32 52 20 50 72 6f 00 00 00 10 00 34
47 43 48 30 30 30 30 36 33 0a 20 20 00 00 00 fd
00 3b 3d 1f 46 ab 00 0a 20 20 20 20 20 20 00 50

00 ff ff ff ff ff ff 00 54 e4 02 22 11 11 21 20
29 1d 01 03 80 30 1b 78 aa d6 a5 a2 59 4a 95 24
14 50 54 21 08 00 71 c0 81 80 81 c0 8b c0 95 00
01 40 b3 01 01 01 02 3a 80 18 71 38 2d 40 58 2c
45 00 dc 0c 11 00 00 1e 00 00 00 fc 00 41 72 74
69 73 74 32 32 52 20 50 72 6f 00 00 00 10 00 34
47 43 48 30 30 30 30 36 33 0a 20 20 00 00 00 fd
00 3b 3d 1f 46 ab 00 0a 20 20 20 20 20 20 00 50

----------------

Block 0, Base EDID:
  EDID Structure Version & Revision: 1.3
  Vendor & Product Identification:
    Manufacturer: UGD
    Model: 8706
    Serial Number: ...
    Made in: week 41 of 2019
  Basic Display Parameters & Features:
    Digital display
    Maximum image size: 48 cm x 27 cm
    Gamma: 2.20
    DPMS levels: Standby Off
    RGB color display
    First detailed timing is the preferred timing
  Color Characteristics:
    Red  : 0.6357, 0.3486
    Green: 0.2900, 0.5839
    Blue : 0.1425, 0.0800
    White: 0.3134, 0.3291
  Established Timings I & II:
    DMT 0x04:   640x480    59.940476 Hz   4:3     31.469 kHz     25.175000 MHz
    DMT 0x09:   800x600    60.316541 Hz   4:3     37.879 kHz     40.000000 MHz
    DMT 0x10:  1024x768    60.003840 Hz   4:3     48.363 kHz     65.000000 MHz
  Standard Timings:
    GTF     :  1152x648    60.000120 Hz  16:9     40.260 kHz     59.907000 MHz
    DMT 0x23:  1280x1024   60.019740 Hz   5:4     63.981 kHz    108.000000 MHz
    DMT 0x55:  1280x720    60.000000 Hz  16:9     45.000 kHz     74.250000 MHz
    GTF     :  1360x765    60.000341 Hz  16:9     47.520 kHz     84.396000 MHz
    DMT 0x2f:  1440x900    59.887445 Hz  16:10    55.935 kHz    106.500000 MHz
    GTF     :  1680x1050   61.000166 Hz  16:10    66.307 kHz    149.589000 MHz
  Detailed Timing Descriptors:
    DTD 1:  1920x1080   60.000000 Hz  16:9     67.500 kHz    148.500000 MHz (476 mm x 268 mm)
                 Hfront   88 Hsync  44 Hback  148 Hpol P
                 Vfront    4 Vsync   5 Vback   36 Vpol P
    Display Product Name: 'Artist22R Pro'
    Dummy Descriptor:
    Display Range Limits:
      Monitor ranges (GTF): 59-61 Hz V, 31-70 kHz H, max dotclock 1710 MHz
Checksum: 0x50

----------------

Block 1, Unknown EDID Extension Block 0x00:
  00 ff ff ff ff ff ff 00 54 e4 02 22 11 11 21 20 '........T.."..! '
  29 1d 01 03 80 30 1b 78 aa d6 a5 a2 59 4a 95 24 ')....0.x....YJ.$'
  14 50 54 21 08 00 71 c0 81 80 81 c0 8b c0 95 00 '.PT!..q.........'
  01 40 b3 01 01 01 02 3a 80 18 71 38 2d 40 58 2c '.@.....:..q8-@X,'
  45 00 dc 0c 11 00 00 1e 00 00 00 fc 00 41 72 74 'E............Art'
  69 73 74 32 32 52 20 50 72 6f 00 00 00 10 00 34 'ist22R Pro.....4'
  47 43 48 30 30 30 30 36 33 0a 20 20 00 00 00 fd 'GCH000063.  ....'
  00 3b 3d 1f 46 ab 00 0a 20 20 20 20 20 20 00 50 '.;=.F...      .P'
Checksum: 0x50

----------------

Warnings:

Block 0, Base EDID:
  Standard Timings: Standard Timing 1360x765 has a dubious odd vertical resolution.

Failures:

Block 0, Base EDID:
  Standard Timings: Use 0x0101 as the invalid Standard Timings code, not 0x0140.
  Dummy Descriptor: Dummy block filled with garbage.
Block 1, Base EDID:
  Unknown Extension Block.
EDID:
  Base EDID: EDID specified 0 extension block(s), but found 1 extension block(s).

EDID conformity: FAIL
