
EDID (hex):
00ffffffffffff0005e3192287040000
1d150103802f1e782a37a0a655489a26
125054bfef00310a81408180714f9500
950f0101010121399030621a274068b0
3600da281100001c000000ff00414c4e
42374a41303031313539000000fd0038
4b1e5311000a202020202020000000fc
00323231390a20202020202020200053

Extracted contents:
header:          00 ff ff ff ff ff ff 00
serial number:   05 e3 19 22 87 04 00 00 1d 15
version:         01 03
basic params:    80 2f 1e 78 2a
chroma info:     37 a0 a6 55 48 9a 26 12 50 54
established:     bf ef 00
standard:        31 0a 81 40 81 80 71 4f 95 00 95 0f 01 01 01 01
descriptor 1:    21 39 90 30 62 1a 27 40 68 b0 36 00 da 28 11 00 00 1c
descriptor 2:    00 00 00 ff 00 41 4c 4e 42 37 4a 41 30 30 31 31 35 39
descriptor 3:    00 00 00 fd 00 38 4b 1e 53 11 00 0a 20 20 20 20 20 20
descriptor 4:    00 00 00 fc 00 32 32 31 39 0a 20 20 20 20 20 20 20 20
extensions:      00
checksum:        53

EDID version: 1.3
Manufacturer: AOC Model 2219 Serial Number --
Made in week 29 of 2011
Digital display
Maximum image size: 47 cm x 30 cm
Gamma: 2.20
DPMS levels: Off
RGB color display
First detailed timing is preferred timing
Display x,y Chromaticity:
  Red:   0.6484, 0.3349
  Green: 0.2822, 0.6044
  Blue:  0.1503, 0.0722
  White: 0.3125, 0.3281
Established timings supported:
  720x400@70Hz 9:5 HorFreq: 31469 Hz Clock: 28.320 MHz
  640x480@60Hz 4:3 HorFreq: 31469 Hz Clock: 25.175 MHz
  640x480@67Hz 4:3 HorFreq: 35000 Hz Clock: 30.240 MHz
  640x480@72Hz 4:3 HorFreq: 37900 Hz Clock: 31.500 MHz
  640x480@75Hz 4:3 HorFreq: 37500 Hz Clock: 31.500 MHz
  800x600@56Hz 4:3 HorFreq: 35200 Hz Clock: 36.000 MHz
  800x600@60Hz 4:3 HorFreq: 37900 Hz Clock: 40.000 MHz
  800x600@72Hz 4:3 HorFreq: 48100 Hz Clock: 50.000 MHz
  800x600@75Hz 4:3 HorFreq: 46900 Hz Clock: 49.500 MHz
  832x624@75Hz 4:3 HorFreq: 49726 Hz Clock: 57.284 MHz
  1024x768@60Hz 4:3 HorFreq: 48400 Hz Clock: 65.000 MHz
  1024x768@70Hz 4:3 HorFreq: 56500 Hz Clock: 75.000 MHz
  1024x768@75Hz 4:3 HorFreq: 60000 Hz Clock: 78.750 MHz
  1280x1024@75Hz 5:4 HorFreq: 80000 Hz Clock: 135.000 MHz
Standard timings supported:
  640x400@70Hz 16:10
  1280x960@60Hz 4:3 HorFreq: 60000 Hz Clock: 108.000 MHz
  1280x1024@60Hz 5:4 HorFreq: 64000 Hz Clock: 108.000 MHz
  1152x864@75Hz 4:3 HorFreq: 67500 Hz Clock: 108.000 MHz
  1440x900@60Hz 16:10 HorFreq: 55500 Hz Clock: 88.750 MHz
  1440x900@75Hz 16:10 HorFreq: 82300 Hz Clock: 156.000 MHz
Detailed mode: Clock 146.250 MHz, 474 mm x 296 mm
               1680 1784 1960 2240 hborder 0
               1050 1053 1059 1089 vborder 0
               -hsync +vsync 
               VertFreq: 59 Hz, HorFreq: 65290 Hz
Serial number: --
Monitor ranges (GTF): 56-75Hz V, 30-83kHz H, max dotclock 170MHz
Monitor name: 2219
Checksum: 0x53 (valid)
