
EDID (hex):
00ffffffffffff0005e3192254010000
17160103802f1e782a23c5a5574f9e26
0f5054bfef00b30095008180814081c0
01010101010121399030621a274068b0
3600d62c1100001c000000fd00324c1e
5311000a202020202020000000fc0045
323231390a20202020202020000000ff
0044564c43364a4130303033343000fb

Extracted contents:
header:          00 ff ff ff ff ff ff 00
serial number:   05 e3 19 22 54 01 00 00 17 16
version:         01 03
basic params:    80 2f 1e 78 2a
chroma info:     23 c5 a5 57 4f 9e 26 0f 50 54
established:     bf ef 00
standard:        b3 00 95 00 81 80 81 40 81 c0 01 01 01 01 01 01
descriptor 1:    21 39 90 30 62 1a 27 40 68 b0 36 00 d6 2c 11 00 00 1c
descriptor 2:    00 00 00 fd 00 32 4c 1e 53 11 00 0a 20 20 20 20 20 20
descriptor 3:    00 00 00 fc 00 45 32 32 31 39 0a 20 20 20 20 20 20 20
descriptor 4:    00 00 00 ff 00 44 56 4c 43 36 4a 41 30 30 30 33 34 30
extensions:      00
checksum:        fb

EDID version: 1.3
Manufacturer: AOC Model 2219 Serial Number --
Made in week 23 of 2012
Digital display
Maximum image size: 47 cm x 30 cm
Gamma: 2.20
DPMS levels: Off
RGB color display
First detailed timing is preferred timing
Display x,y Chromaticity:
  Red:   0.6445, 0.3417
  Green: 0.3085, 0.6201
  Blue:  0.1513, 0.0585
  White: 0.3134, 0.3291
Established timings supported:
  720x400@70Hz 9:5 HorFreq: 31469 Hz Clock: 28.320 MHz
  640x480@60Hz 4:3 HorFreq: 31469 Hz Clock: 25.175 MHz
  640x480@67Hz 4:3 HorFreq: 35000 Hz Clock: 30.240 MHz
  640x480@72Hz 4:3 HorFreq: 37900 Hz Clock: 31.500 MHz
  640x480@75Hz 4:3 HorFreq: 37500 Hz Clock: 31.500 MHz
  800x600@56Hz 4:3 HorFreq: 35200 Hz Clock: 36.000 MHz
  800x600@60Hz 4:3 HorFreq: 37900 Hz Clock: 40.000 MHz
  800x600@72Hz 4:3 HorFreq: 48100 Hz Clock: 50.000 MHz
  800x600@75Hz 4:3 HorFreq: 46900 Hz Clock: 49.500 MHz
  832x624@75Hz 4:3 HorFreq: 49726 Hz Clock: 57.284 MHz
  1024x768@60Hz 4:3 HorFreq: 48400 Hz Clock: 65.000 MHz
  1024x768@70Hz 4:3 HorFreq: 56500 Hz Clock: 75.000 MHz
  1024x768@75Hz 4:3 HorFreq: 60000 Hz Clock: 78.750 MHz
  1280x1024@75Hz 5:4 HorFreq: 80000 Hz Clock: 135.000 MHz
Standard timings supported:
  1680x1050@60Hz 16:10 HorFreq: 64700 Hz Clock: 119.000 MHz
  1440x900@60Hz 16:10 HorFreq: 55500 Hz Clock: 88.750 MHz
  1280x1024@60Hz 5:4 HorFreq: 64000 Hz Clock: 108.000 MHz
  1280x960@60Hz 4:3 HorFreq: 60000 Hz Clock: 108.000 MHz
  1280x720@60Hz 16:9
Detailed mode: Clock 146.250 MHz, 470 mm x 300 mm
               1680 1784 1960 2240 hborder 0
               1050 1053 1059 1089 vborder 0
               -hsync +vsync 
               VertFreq: 59 Hz, HorFreq: 65290 Hz
Monitor ranges (GTF): 50-76Hz V, 30-83kHz H, max dotclock 170MHz
Monitor name: E2219
Serial number: --
Checksum: 0xfb (valid)
