
EDID (hex):
00ffffffffffff0030e4db0600000000
001f0104a526157807e085a3544e9b26
0e505400000001010101010101010101
0101010101012e3680a070381f403020
35007ed71000001a1f2480a070381f40
302035007ed71000001a000000000000
00000000000000000000000000000002
000c33ff0f3c9616183c960000000043

edid-decode (hex):

00 ff ff ff ff ff ff 00 30 e4 db 06 00 00 00 00
00 1f 01 04 a5 26 15 78 07 e0 85 a3 54 4e 9b 26
0e 50 54 00 00 00 01 01 01 01 01 01 01 01 01 01
01 01 01 01 01 01 2e 36 80 a0 70 38 1f 40 30 20
35 00 7e d7 10 00 00 1a 1f 24 80 a0 70 38 1f 40
30 20 35 00 7e d7 10 00 00 1a 00 00 00 00 00 00
00 00 00 00 00 00 00 00 00 00 00 00 00 00 00 02
00 0c 33 ff 0f 3c 96 16 18 3c 96 00 00 00 00 43

----------------

Block 0, Base EDID:
  EDID Structure Version & Revision: 1.4
  Vendor & Product Identification:
    Manufacturer: LGD
    Model: 1755
    Made in: 2021
  Basic Display Parameters & Features:
    Digital display
    Bits per primary color channel: 8
    DisplayPort interface
    Maximum image size: 38 cm x 21 cm
    Gamma: 2.20
    Supported color formats: RGB 4:4:4
    Default (sRGB) color space is primary color space
    First detailed timing includes the native pixel format and preferred refresh rate
    Display is continuous frequency
  Color Characteristics:
    Red  : 0.6396, 0.3300
    Green: 0.3046, 0.6054
    Blue : 0.1503, 0.0546
    White: 0.3134, 0.3291
  Established Timings I & II: none
  Standard Timings: none
  Detailed Timing Descriptors:
    DTD 1:  1920x1080   60.020425 Hz  16:9     66.683 kHz    138.700000 MHz (382 mm x 215 mm)
                 Hfront   48 Hsync  32 Hback   80 Hpol P
                 Vfront    3 Vsync   5 Vback   23 Vpol N
    DTD 2:  1920x1080   40.015059 Hz  16:9     44.457 kHz     92.470000 MHz (382 mm x 215 mm)
                 Hfront   48 Hsync  32 Hback   80 Hpol P
                 Vfront    3 Vsync   5 Vback   23 Vpol N
    Empty Descriptor
    Manufacturer-Specified Display Descriptor (0x02): 00 02 00 0c 33 ff 0f 3c 96 16 18 3c 96 00 00 00 '....3..<...<....'
Checksum: 0x43
