
EDID (hex):
00ffffffffffff004c2d1a7133565843
0d200104b55022783b0a7da6564f9f27
114e54bfef80714f810081c081809500
a9c0b30001014ed470a0d0a046503020
3a001e4e3100001a000000fd0c3ca503
0358010a202020202020000000fc004c
433334473535540a20202020000000ff
0048345a543330323233320a20200275
02032bf148901f04130312403f230907
0783010000e305c0006d1a000002013c
a5000000000000e3060501565e00a0a0
a02950302035001e4e3100001a6fc200
a0a0a05550302035001e4e3100001a48
9680a0703829403020b8041e4e310000
1a023a801871382d40582c4500ba8921
00001e0000000000000000000000003b
7012790000030164a25701886f0d9f00
2f801f009f0528001a000700e67c0008
6f0d9f002f801f009f05280002000900
59a00008ff099f002f801f009f054500
02000400a2030108ff099f002f801f00
9f0528001a000700eaf900086f0d9f00
2f801f009f0528001a00070000000000
00000000000000000000000000005590

edid-decode (hex):

00 ff ff ff ff ff ff 00 4c 2d 1a 71 33 56 58 43
0d 20 01 04 b5 50 22 78 3b 0a 7d a6 56 4f 9f 27
11 4e 54 bf ef 80 71 4f 81 00 81 c0 81 80 95 00
a9 c0 b3 00 01 01 4e d4 70 a0 d0 a0 46 50 30 20
3a 00 1e 4e 31 00 00 1a 00 00 00 fd 0c 3c a5 03
03 58 01 0a 20 20 20 20 20 20 00 00 00 fc 00 4c
43 33 34 47 35 35 54 0a 20 20 20 20 00 00 00 ff
00 48 34 5a 54 33 30 32 32 33 32 0a 20 20 02 75

02 03 2b f1 48 90 1f 04 13 03 12 40 3f 23 09 07
07 83 01 00 00 e3 05 c0 00 6d 1a 00 00 02 01 3c
a5 00 00 00 00 00 00 e3 06 05 01 56 5e 00 a0 a0
a0 29 50 30 20 35 00 1e 4e 31 00 00 1a 6f c2 00
a0 a0 a0 55 50 30 20 35 00 1e 4e 31 00 00 1a 48
96 80 a0 70 38 29 40 30 20 b8 04 1e 4e 31 00 00
1a 02 3a 80 18 71 38 2d 40 58 2c 45 00 ba 89 21
00 00 1e 00 00 00 00 00 00 00 00 00 00 00 00 3b

70 12 79 00 00 03 01 64 a2 57 01 88 6f 0d 9f 00
2f 80 1f 00 9f 05 28 00 1a 00 07 00 e6 7c 00 08
6f 0d 9f 00 2f 80 1f 00 9f 05 28 00 02 00 09 00
59 a0 00 08 ff 09 9f 00 2f 80 1f 00 9f 05 45 00
02 00 04 00 a2 03 01 08 ff 09 9f 00 2f 80 1f 00
9f 05 28 00 1a 00 07 00 ea f9 00 08 6f 0d 9f 00
2f 80 1f 00 9f 05 28 00 1a 00 07 00 00 00 00 00
00 00 00 00 00 00 00 00 00 00 00 00 00 00 55 90

----------------

Block 0, Base EDID:
  EDID Structure Version & Revision: 1.4
  Vendor & Product Identification:
    Manufacturer: SAM
    Model: 28954
    Serial Number: 1129862707
    Made in: week 13 of 2022
  Basic Display Parameters & Features:
    Digital display
    Bits per primary color channel: 10
    DisplayPort interface
    Maximum image size: 80 cm x 34 cm
    Gamma: 2.20
    DPMS levels: Off
    Supported color formats: RGB 4:4:4, YCrCb 4:4:4, YCrCb 4:2:2
    First detailed timing includes the native pixel format and preferred refresh rate
    Display is continuous frequency
  Color Characteristics:
    Red  : 0.6484, 0.3359
    Green: 0.3105, 0.6230
    Blue : 0.1533, 0.0693
    White: 0.3076, 0.3291
  Established Timings I & II:
    IBM     :   720x400    70.081663 Hz   9:5     31.467 kHz     28.320000 MHz
    DMT 0x04:   640x480    59.940476 Hz   4:3     31.469 kHz     25.175000 MHz
    Apple   :   640x480    66.666667 Hz   4:3     35.000 kHz     30.240000 MHz
    DMT 0x05:   640x480    72.808802 Hz   4:3     37.861 kHz     31.500000 MHz
    DMT 0x06:   640x480    75.000000 Hz   4:3     37.500 kHz     31.500000 MHz
    DMT 0x08:   800x600    56.250000 Hz   4:3     35.156 kHz     36.000000 MHz
    DMT 0x09:   800x600    60.316541 Hz   4:3     37.879 kHz     40.000000 MHz
    DMT 0x0a:   800x600    72.187572 Hz   4:3     48.077 kHz     50.000000 MHz
    DMT 0x0b:   800x600    75.000000 Hz   4:3     46.875 kHz     49.500000 MHz
    Apple   :   832x624    74.551266 Hz   4:3     49.726 kHz     57.284000 MHz
    DMT 0x10:  1024x768    60.003840 Hz   4:3     48.363 kHz     65.000000 MHz
    DMT 0x11:  1024x768    70.069359 Hz   4:3     56.476 kHz     75.000000 MHz
    DMT 0x12:  1024x768    75.028582 Hz   4:3     60.023 kHz     78.750000 MHz
    DMT 0x24:  1280x1024   75.024675 Hz   5:4     79.976 kHz    135.000000 MHz
    Apple   :  1152x870    75.061550 Hz 192:145   68.681 kHz    100.000000 MHz
  Standard Timings:
    DMT 0x15:  1152x864    75.000000 Hz   4:3     67.500 kHz    108.000000 MHz
    DMT 0x1c:  1280x800    59.810326 Hz  16:10    49.702 kHz     83.500000 MHz
    DMT 0x55:  1280x720    60.000000 Hz  16:9     45.000 kHz     74.250000 MHz
    DMT 0x23:  1280x1024   60.019740 Hz   5:4     63.981 kHz    108.000000 MHz
    DMT 0x2f:  1440x900    59.887445 Hz  16:10    55.935 kHz    106.500000 MHz
    DMT 0x53:  1600x900    60.000000 Hz  16:9     60.000 kHz    108.000000 MHz (RB)
    DMT 0x3a:  1680x1050   59.954250 Hz  16:10    65.290 kHz    146.250000 MHz
  Detailed Timing Descriptors:
    DTD 1:  3440x1440   99.981604 Hz  43:18   150.972 kHz    543.500000 MHz (798 mm x 334 mm)
                 Hfront   48 Hsync  32 Hback   80 Hpol P
                 Vfront    3 Vsync  10 Vback   57 Vpol N
    Display Range Limits:
      Monitor ranges (Bare Limits): 60-165 Hz V, 258-258 kHz H, max dotclock 880 MHz
    Display Product Name: 'LC34G55T'
    Display Product Serial Number: 'H4ZT302232'
  Extension blocks: 2
Checksum: 0x75

----------------

Block 1, CTA-861 Extension Block:
  Revision: 3
  Underscans IT Video Formats by default
  Basic audio support
  Supports YCbCr 4:4:4
  Supports YCbCr 4:2:2
  Native detailed modes: 1
  Video Data Block:
    VIC  16:  1920x1080   60.000000 Hz  16:9     67.500 kHz    148.500000 MHz (native)
    VIC  31:  1920x1080   50.000000 Hz  16:9     56.250 kHz    148.500000 MHz
    VIC   4:  1280x720    60.000000 Hz  16:9     45.000 kHz     74.250000 MHz
    VIC  19:  1280x720    50.000000 Hz  16:9     37.500 kHz     74.250000 MHz
    VIC   3:   720x480    59.940060 Hz  16:9     31.469 kHz     27.000000 MHz
    VIC  18:   720x576    50.000000 Hz  16:9     31.250 kHz     27.000000 MHz
    VIC  64:  1920x1080  100.000000 Hz  16:9    112.500 kHz    297.000000 MHz
    VIC  63:  1920x1080  120.000000 Hz  16:9    135.000 kHz    297.000000 MHz
  Audio Data Block:
    Linear PCM:
      Max channels: 2
      Supported sample rates (kHz): 48 44.1 32
      Supported sample sizes (bits): 24 20 16
  Speaker Allocation Data Block:
    FL/FR - Front Left/Right
  Colorimetry Data Block:
    BT2020YCC
    BT2020RGB
  Vendor-Specific Data Block (AMD), OUI 00-00-1A:
    Version: 2.1
    Minimum Refresh Rate: 60 Hz
    Maximum Refresh Rate: 165 Hz
    Flags 1.x: 0x00
    Flags 2.x: 0x00
    Maximum luminance: 0 (50.000 cd/m^2)
    Minimum luminance: 0 (0.000 cd/m^2)
    Unknown: 0x00 0x00
  HDR Static Metadata Data Block:
    Electro optical transfer functions:
      Traditional gamma - SDR luminance range
      SMPTE ST2084
    Supported static metadata descriptors:
      Static metadata type 1
  Detailed Timing Descriptors:
    DTD 2:  2560x1440   59.950550 Hz  16:9     88.787 kHz    241.500000 MHz (798 mm x 334 mm)
                 Hfront   48 Hsync  32 Hback   80 Hpol P
                 Vfront    3 Vsync   5 Vback   33 Vpol N
    DTD 3:  2560x1440  119.997589 Hz  16:9    182.996 kHz    497.750000 MHz (798 mm x 334 mm)
                 Hfront   48 Hsync  32 Hback   80 Hpol P
                 Vfront    3 Vsync   5 Vback   77 Vpol N
    DTD 4:  1920x1080  164.996912 Hz  16:9    184.962 kHz    384.720000 MHz (798 mm x 334 mm)
                 Hfront   48 Hsync  32 Hback   80 Hpol P
                 Vfront   27 Vsync   8 Vback    6 Vpol N
    DTD 5:  1920x1080   60.000000 Hz  16:9     67.500 kHz    148.500000 MHz (698 mm x 393 mm)
                 Hfront   88 Hsync  44 Hback  148 Hpol P
                 Vfront    4 Vsync   5 Vback   36 Vpol P
Checksum: 0x3b  Unused space in Extension Block: 12 bytes

----------------

Block 2, DisplayID Extension Block:
  Version: 1.2
  Extension Count: 0
  Display Product Type: Extension Section
  Video Timing Modes Type 1 - Detailed Timings Data Block:
    DTD:  3440x1440  164.999250 Hz   0:0    244.364 kHz    879.710000 MHz (aspect undefined, no 3D stereo, preferred)
               Hfront   48 Hsync  32 Hback   80 Hpol P
               Vfront   27 Vsync   8 Vback    6 Vpol N
    DTD:  3440x1440   59.972616 Hz   0:0     88.819 kHz    319.750000 MHz (aspect undefined, no 3D stereo)
               Hfront   48 Hsync  32 Hback   80 Hpol P
               Vfront    3 Vsync  10 Vback   28 Vpol N
    DTD:  2560x1440   99.946436 Hz   0:0    150.919 kHz    410.500000 MHz (aspect undefined, no 3D stereo)
               Hfront   48 Hsync  32 Hback   80 Hpol P
               Vfront    3 Vsync   5 Vback   62 Vpol N
    DTD:  2560x1440  164.999305 Hz   0:0    244.364 kHz    664.670000 MHz (aspect undefined, no 3D stereo)
               Hfront   48 Hsync  32 Hback   80 Hpol P
               Vfront   27 Vsync   8 Vback    6 Vpol N
    DTD:  3440x1440  119.999625 Hz   0:0    177.719 kHz    639.790000 MHz (aspect undefined, no 3D stereo)
               Hfront   48 Hsync  32 Hback   80 Hpol P
               Vfront   27 Vsync   8 Vback    6 Vpol N
  Checksum: 0x55
Checksum: 0x90


