
EDID (hex):
00ffffffffffff004c2d1a7155555843
0c200104b55022783b0a7da6564f9f27
114e54bfef80714f810081c081809500
a9c0b30001014ed470a0d0a046503020
3a001e4e3100001a000000fd0c3ca503
0358010a202020202020000000fc004c
433334473535540a20202020000000ff
0048345a543330333239350a2020024b
02032bf148901f04130312403f230907
0783010000e305c0006d1a000002013c
a5000000000000e3060501565e00a0a0
a02950302035001e4e3100001a6fc200
a0a0a05550302035001e4e3100001a48
9680a0703829403020b8041e4e310000
1a023a801871382d40582c4500ba8921
00001e0000000000000000000000003b
7012790000030164a25701886f0d9f00
2f801f009f0528001a000700e67c0008
6f0d9f002f801f009f05280002000900
59a00008ff099f002f801f009f054500
02000400a2030108ff099f002f801f00
9f0528001a000700eaf900086f0d9f00
2f801f009f0528001a00070000000000
00000000000000000000000000005590

Extracted contents:
header:          00 ff ff ff ff ff ff 00
serial number:   4c 2d 1a 71 55 55 58 43 0c 20
version:         01 04
basic params:    b5 50 22 78 3b
chroma info:     0a 7d a6 56 4f 9f 27 11 4e 54
established:     bf ef 80
standard:        71 4f 81 00 81 c0 81 80 95 00 a9 c0 b3 00 01 01
descriptor 1:    4e d4 70 a0 d0 a0 46 50 30 20 3a 00 1e 4e 31 00 00 1a
descriptor 2:    00 00 00 fd 0c 3c a5 03 03 58 01 0a 20 20 20 20 20 20
descriptor 3:    00 00 00 fc 00 4c 43 33 34 47 35 35 54 0a 20 20 20 20
descriptor 4:    00 00 00 ff 00 48 34 5a 54 33 30 33 32 39 35 0a 20 20
extensions:      02
checksum:        4b

EDID version: 1.4
Manufacturer: SAM Model 711a Serial Number --
Made in week 12 of 2022
Digital display
10 bits per primary color channel
DisplayPort interface
Maximum image size: 80 cm x 34 cm
Gamma: 2.20
DPMS levels: Off
Supported color formats: RGB 4:4:4, YCrCb 4:4:4, YCrCb 4:2:2
First detailed timing includes the native pixel format and preferred refresh rate
Display is continuous frequency
Display x,y Chromaticity:
  Red:   0.6484, 0.3359
  Green: 0.3105, 0.6230
  Blue:  0.1533, 0.0693
  White: 0.3076, 0.3291
Established timings supported:
  720x400@70Hz 9:5 HorFreq: 31469 Hz Clock: 28.320 MHz
  640x480@60Hz 4:3 HorFreq: 31469 Hz Clock: 25.175 MHz
  640x480@67Hz 4:3 HorFreq: 35000 Hz Clock: 30.240 MHz
  640x480@72Hz 4:3 HorFreq: 37900 Hz Clock: 31.500 MHz
  640x480@75Hz 4:3 HorFreq: 37500 Hz Clock: 31.500 MHz
  800x600@56Hz 4:3 HorFreq: 35200 Hz Clock: 36.000 MHz
  800x600@60Hz 4:3 HorFreq: 37900 Hz Clock: 40.000 MHz
  800x600@72Hz 4:3 HorFreq: 48100 Hz Clock: 50.000 MHz
  800x600@75Hz 4:3 HorFreq: 46900 Hz Clock: 49.500 MHz
  832x624@75Hz 4:3 HorFreq: 49726 Hz Clock: 57.284 MHz
  1024x768@60Hz 4:3 HorFreq: 48400 Hz Clock: 65.000 MHz
  1024x768@70Hz 4:3 HorFreq: 56500 Hz Clock: 75.000 MHz
  1024x768@75Hz 4:3 HorFreq: 60000 Hz Clock: 78.750 MHz
  1280x1024@75Hz 5:4 HorFreq: 80000 Hz Clock: 135.000 MHz
  1152x870@75Hz 192:145 HorFreq: 67500 Hz Clock: 108.000 MHz
Standard timings supported:
  1152x864@75Hz 4:3 HorFreq: 67500 Hz Clock: 108.000 MHz
  1280x800@60Hz 16:10
  1280x720@60Hz 16:9
  1280x1024@60Hz 5:4 HorFreq: 64000 Hz Clock: 108.000 MHz
  1440x900@60Hz 16:10 HorFreq: 55500 Hz Clock: 88.750 MHz
  1600x900@60Hz 16:9
  1680x1050@60Hz 16:10 HorFreq: 64700 Hz Clock: 119.000 MHz
Detailed mode: Clock 543.500 MHz, 798 mm x 334 mm
               3440 3488 3520 3600 hborder 0
               1440 1443 1453 1510 vborder 0
               +hsync -vsync 
               VertFreq: 99 Hz, HorFreq: 150972 Hz
Monitor ranges (bare limits): 60-165Hz V, 3-258kHz H, max dotclock 880MHz
Monitor name: LC34G55T
Serial number: --
Has 2 extension blocks
Checksum: 0x4b (valid)

CTA extension block
Extension version: 3
39 bytes of CTA data
  Video data block
    VIC  16 1920x1080@60Hz 16:9 (native) HorFreq: 67500 Hz Clock: 148.500 MHz
    VIC  31 1920x1080@50Hz 16:9  HorFreq: 56250 Hz Clock: 148.500 MHz
    VIC   4 1280x720@60Hz 16:9  HorFreq: 45000 Hz Clock: 74.250 MHz
    VIC  19 1280x720@50Hz 16:9  HorFreq: 37500 Hz Clock: 74.250 MHz
    VIC   3 720x480@60Hz 16:9  HorFreq: 31469 Hz Clock: 27.000 MHz
    VIC  18 720x576@50Hz 16:9  HorFreq: 31250 Hz Clock: 27.000 MHz
    VIC  64 1920x1080@100Hz 16:9  HorFreq: 112500 Hz Clock: 297.000 MHz
    VIC  63 1920x1080@120Hz 16:9  HorFreq: 135000 Hz Clock: 297.000 MHz
  Audio data block
    Linear PCM, max channels 2
      Supported sample rates (kHz): 48 44.1 32
      Supported sample sizes (bits): 24 20 16
  Speaker allocation data block
    Speaker map:
      FL/FR - Front Left/Right
  Extended tag: Colorimetry data block
    BT2020YCC
    BT2020RGB
  Vendor-specific data block, OUI 00001a
  Extended tag: HDR static metadata data block
    Electro optical transfer functions:
      Traditional gamma - SDR luminance range
      SMPTE ST2084
    Supported static metadata descriptors:
      Static metadata type 1
Underscans PC formats by default
Basic audio support
Supports YCbCr 4:4:4
Supports YCbCr 4:2:2
1 native detailed modes
Detailed mode: Clock 241.500 MHz, 798 mm x 334 mm
               2560 2608 2640 2720 hborder 0
               1440 1443 1448 1481 vborder 0
               +hsync -vsync 
               VertFreq: 59 Hz, HorFreq: 88786 Hz
Detailed mode: Clock 497.750 MHz, 798 mm x 334 mm
               2560 2608 2640 2720 hborder 0
               1440 1443 1448 1525 vborder 0
               +hsync -vsync 
               VertFreq: 119 Hz, HorFreq: 182996 Hz
Detailed mode: Clock 384.720 MHz, 798 mm x 334 mm
               1920 1968 2000 2080 hborder 0
               1080 1107 1115 1121 vborder 0
               +hsync -vsync 
               VertFreq: 164 Hz, HorFreq: 184961 Hz
Detailed mode: Clock 148.500 MHz, 698 mm x 393 mm
               1920 2008 2052 2200 hborder 0
               1080 1084 1089 1125 vborder 0
               +hsync +vsync 
               VertFreq: 60 Hz, HorFreq: 67500 Hz
Checksum: 0x3b (valid)


DisplayID extension block
Extension version: 18
Length 121, version 18, extension count 0
Checksum: 0x55 (valid)
Type 1 detailed timing: aspect: undefined, Preferred  
Detailed mode: Clock 879.700 MHz, 0 mm x 0 mm
               3439 3486 3517 3598
               1439 1465 1472 1479
               +hsync -vsync
Type 1 detailed timing: aspect: undefined,  
Detailed mode: Clock 319.740 MHz, 0 mm x 0 mm
               3439 3486 3517 3598
               1439 1441 1450 1479
               +hsync -vsync
Type 1 detailed timing: aspect: undefined,  
Detailed mode: Clock 410.490 MHz, 0 mm x 0 mm
               2559 2606 2637 2718
               1439 1441 1445 1508
               +hsync -vsync
Type 1 detailed timing: aspect: undefined,  
Detailed mode: Clock 664.660 MHz, 0 mm x 0 mm
               2559 2606 2637 2718
               1439 1465 1472 1479
               +hsync -vsync
Type 1 detailed timing: aspect: undefined,  
Detailed mode: Clock 639.780 MHz, 0 mm x 0 mm
               3439 3486 3517 3598
               1439 1465 1472 1479
               +hsync -vsync

Warning: One or more of the timings is out of range of the Monitor Ranges:
  Vertical Freq: 50 - 164 Hz
  Horizontal Freq: 31250 - 184961 Hz
  Maximum Clock: 543.500 MHz
EDID block does not conform at all!
	Both the serial number and the serial string are set


