
EDID (hex):
00ffffffffffff0010acc0a042565930
2d1d010380351e78eae245a8554da326
0b5054a54b00714f8180a9c0a940d1c0
e10001010101a36600a0f0701f803020
35000f282100001a000000ff00443856
5846394237305956420a000000fc0044
454c4c205032343135510a20000000fd
001d4c1e8c1e000a202020202020012c
02032ef15390050402071601141f1213
272021220306111523091f0783010000
6d030c001000003c200060030201023a
801871382d40582c25000f282100001e
011d8018711c1620582c25000f282100
009e04740030f2705a80b0588a000f28
2100001e565e00a0a0a0295030203500
0f282100001a0000000000000000008a

edid-decode (hex):

00 ff ff ff ff ff ff 00 10 ac c0 a0 42 56 59 30
2d 1d 01 03 80 35 1e 78 ea e2 45 a8 55 4d a3 26
0b 50 54 a5 4b 00 71 4f 81 80 a9 c0 a9 40 d1 c0
e1 00 01 01 01 01 a3 66 00 a0 f0 70 1f 80 30 20
35 00 0f 28 21 00 00 1a 00 00 00 ff 00 44 38 56
58 46 39 42 37 30 59 56 42 0a 00 00 00 fc 00 44
45 4c 4c 20 50 32 34 31 35 51 0a 20 00 00 00 fd
00 1d 4c 1e 8c 1e 00 0a 20 20 20 20 20 20 01 2c

02 03 2e f1 53 90 05 04 02 07 16 01 14 1f 12 13
27 20 21 22 03 06 11 15 23 09 1f 07 83 01 00 00
6d 03 0c 00 10 00 00 3c 20 00 60 03 02 01 02 3a
80 18 71 38 2d 40 58 2c 25 00 0f 28 21 00 00 1e
01 1d 80 18 71 1c 16 20 58 2c 25 00 0f 28 21 00
00 9e 04 74 00 30 f2 70 5a 80 b0 58 8a 00 0f 28
21 00 00 1e 56 5e 00 a0 a0 a0 29 50 30 20 35 00
0f 28 21 00 00 1a 00 00 00 00 00 00 00 00 00 8a

----------------

Block 0, Base EDID:
  EDID Structure Version & Revision: 1.3
  Vendor & Product Identification:
    Manufacturer: DEL
    Model: 41152
    Serial Number: 811161154
    Made in: week 45 of 2019
  Basic Display Parameters & Features:
    Digital display
    Maximum image size: 53 cm x 30 cm
    Gamma: 2.20
    DPMS levels: Standby Suspend Off
    RGB color display
    First detailed timing is the preferred timing
  Color Characteristics:
    Red  : 0.6591, 0.3339
    Green: 0.3007, 0.6386
    Blue : 0.1494, 0.0429
    White: 0.3134, 0.3291
  Established Timings I & II:
    IBM     :   720x400    70.081663 Hz   9:5     31.467 kHz     28.320000 MHz
    DMT 0x04:   640x480    59.940476 Hz   4:3     31.469 kHz     25.175000 MHz
    DMT 0x06:   640x480    75.000000 Hz   4:3     37.500 kHz     31.500000 MHz
    DMT 0x09:   800x600    60.316541 Hz   4:3     37.879 kHz     40.000000 MHz
    DMT 0x0b:   800x600    75.000000 Hz   4:3     46.875 kHz     49.500000 MHz
    DMT 0x10:  1024x768    60.003840 Hz   4:3     48.363 kHz     65.000000 MHz
    DMT 0x12:  1024x768    75.028582 Hz   4:3     60.023 kHz     78.750000 MHz
    DMT 0x24:  1280x1024   75.024675 Hz   5:4     79.976 kHz    135.000000 MHz
  Standard Timings:
    DMT 0x15:  1152x864    75.000000 Hz   4:3     67.500 kHz    108.000000 MHz
    DMT 0x23:  1280x1024   60.019740 Hz   5:4     63.981 kHz    108.000000 MHz
    DMT 0x53:  1600x900    60.000000 Hz  16:9     60.000 kHz    108.000000 MHz (RB)
    DMT 0x33:  1600x1200   60.000000 Hz   4:3     75.000 kHz    162.000000 MHz
    DMT 0x52:  1920x1080   60.000000 Hz  16:9     67.500 kHz    148.500000 MHz
    GTF     :  2048x1280   60.000000 Hz  16:10    79.500 kHz    221.328000 MHz
  Detailed Timing Descriptors:
    DTD 1:  3840x2160   29.980602 Hz  16:9     65.688 kHz    262.750000 MHz (527 mm x 296 mm)
                 Hfront   48 Hsync  32 Hback   80 Hpol P
                 Vfront    3 Vsync   5 Vback   23 Vpol N
    Display Product Serial Number: 'D8VXF9B70YVB'
    Display Product Name: 'DELL P2415Q'
    Display Range Limits:
      Monitor ranges (GTF): 29-76 Hz V, 30-140 kHz H, max dotclock 300 MHz
  Extension blocks: 1
Checksum: 0x2c

----------------

Block 1, CTA-861 Extension Block:
  Revision: 3
  Underscans IT Video Formats by default
  Basic audio support
  Supports YCbCr 4:4:4
  Supports YCbCr 4:2:2
  Native detailed modes: 1
  Video Data Block:
    VIC  16:  1920x1080   60.000000 Hz  16:9     67.500 kHz    148.500000 MHz (native)
    VIC   5:  1920x1080i  60.000000 Hz  16:9     33.750 kHz     74.250000 MHz
    VIC   4:  1280x720    60.000000 Hz  16:9     45.000 kHz     74.250000 MHz
    VIC   2:   720x480    59.940060 Hz   4:3     31.469 kHz     27.000000 MHz
    VIC   7:  1440x480i   59.940060 Hz  16:9     15.734 kHz     27.000000 MHz
    VIC  22:  1440x576i   50.000000 Hz  16:9     15.625 kHz     27.000000 MHz
    VIC   1:   640x480    59.940476 Hz   4:3     31.469 kHz     25.175000 MHz
    VIC  20:  1920x1080i  50.000000 Hz  16:9     28.125 kHz     74.250000 MHz
    VIC  31:  1920x1080   50.000000 Hz  16:9     56.250 kHz    148.500000 MHz
    VIC  18:   720x576    50.000000 Hz  16:9     31.250 kHz     27.000000 MHz
    VIC  19:  1280x720    50.000000 Hz  16:9     37.500 kHz     74.250000 MHz
    VIC  39:  1920x1080i  50.000000 Hz  16:9     31.250 kHz     72.000000 MHz
    VIC  32:  1920x1080   24.000000 Hz  16:9     27.000 kHz     74.250000 MHz
    VIC  33:  1920x1080   25.000000 Hz  16:9     28.125 kHz     74.250000 MHz
    VIC  34:  1920x1080   30.000000 Hz  16:9     33.750 kHz     74.250000 MHz
    VIC   3:   720x480    59.940060 Hz  16:9     31.469 kHz     27.000000 MHz
    VIC   6:  1440x480i   59.940060 Hz   4:3     15.734 kHz     27.000000 MHz
    VIC  17:   720x576    50.000000 Hz   4:3     31.250 kHz     27.000000 MHz
    VIC  21:  1440x576i   50.000000 Hz   4:3     15.625 kHz     27.000000 MHz
  Audio Data Block:
    Linear PCM:
      Max channels: 2
      Supported sample rates (kHz): 96 88.2 48 44.1 32
      Supported sample sizes (bits): 24 20 16
  Speaker Allocation Data Block:
    FL/FR - Front Left/Right
  Vendor-Specific Data Block (HDMI), OUI 00-0C-03:
    Source physical address: 1.0.0.0
    Maximum TMDS clock: 300 MHz
    Extended HDMI video details:
      HDMI VICs:
        HDMI VIC 3:  3840x2160   24.000000 Hz  16:9     54.000 kHz    297.000000 MHz
        HDMI VIC 2:  3840x2160   25.000000 Hz  16:9     56.250 kHz    297.000000 MHz
        HDMI VIC 1:  3840x2160   30.000000 Hz  16:9     67.500 kHz    297.000000 MHz
  Detailed Timing Descriptors:
    DTD 2:  1920x1080   60.000000 Hz  16:9     67.500 kHz    148.500000 MHz (527 mm x 296 mm)
                 Hfront   88 Hsync  44 Hback  148 Hpol P
                 Vfront    2 Vsync   5 Vback   38 Vpol P
    DTD 3:  1920x1080i  60.000000 Hz  16:9     33.750 kHz     74.250000 MHz (527 mm x 296 mm)
                 Hfront   88 Hsync  44 Hback  148 Hpol P
                 Vfront    2 Vsync   5 Vback   15 Vpol P Vfront +0.5 Odd Field
                 Vfront    2 Vsync   5 Vback   15 Vpol P Vback  +0.5 Even Field
    DTD 4:  3840x2160   30.000000 Hz  16:9     67.500 kHz    297.000000 MHz (527 mm x 296 mm)
                 Hfront  176 Hsync  88 Hback  296 Hpol P
                 Vfront    8 Vsync  10 Vback   72 Vpol P
    DTD 5:  2560x1440   59.950550 Hz  16:9     88.787 kHz    241.500000 MHz (527 mm x 296 mm)
                 Hfront   48 Hsync  32 Hback   80 Hpol P
                 Vfront    3 Vsync   5 Vback   33 Vpol N
Checksum: 0x8a  Unused space in Extension Block: 9 bytes
