edid-decode (hex):

00 ff ff ff ff ff ff 00 4c a3 46 47 00 00 00 00
00 13 01 03 80 21 15 78 0a 87 f5 94 57 4f 8c 27
27 50 54 00 00 00 01 01 01 01 01 01 01 01 01 01
01 01 01 01 01 01 90 40 80 5a 71 b0 10 40 30 20
33 00 4b cf 10 00 00 19 00 00 00 0f 00 00 00 00
00 00 00 00 00 46 d2 02 64 00 00 00 00 fe 00 53
41 4d 53 55 4e 47 0a 20 20 20 20 20 00 00 00 fe
00 31 35 34 43 54 30 31 2d 30 30 32 0a 20 00 4a

----------------

Block 0, Base EDID:
  EDID Structure Version & Revision: 1.3
  Vendor & Product Identification:
    Manufacturer: SEC
    Model: 18246
    Made in: 2009
  Basic Display Parameters & Features:
    Digital display
    Maximum image size: 33 cm x 21 cm
    Gamma: 2.20
    RGB color display
    First detailed timing is the preferred timing
  Color Characteristics:
    Red  : 0.5800, 0.3398
    Green: 0.3095, 0.5498
    Blue : 0.1552, 0.1552
    White: 0.3134, 0.3291
  Established Timings I & II: none
  Standard Timings: none
  Detailed Timing Descriptors:
    DTD 1:  1920x1200   59.982812 Hz   8:5     72.939 kHz    165.280000 MHz (331 mm x 207 mm)
                 Hfront   48 Hsync  32 Hback  266 Hpol N
                 Vfront    3 Vsync   3 Vback   10 Vpol N
    Manufacturer-Specified Display Descriptor (0x0f): 00 0f 00 00 00 00 00 00 00 00 00 46 d2 02 64 00 '...........F..d.'
    Alphanumeric Data String: 'SAMSUNG'
    Alphanumeric Data String: '154CT01-002'
Checksum: 0x4a

----------------

Failures:

Block 0, Base EDID:
  Missing Display Product Name.
  Missing Display Range Limits Descriptor.

EDID conformity: FAIL
