edid-decode (hex):

00 ff ff ff ff ff ff 00 04 72 2e 04 5b a4 20 91
0c 1d 01 03 80 34 1d 78 2a 0b d5 a2 57 50 a1 28
0f 50 54 bf ef 00 d1 c0 81 80 81 c0 81 40 95 00
b3 00 01 01 01 01 02 3a 80 18 71 38 2d 40 58 2c
45 00 09 25 21 00 00 1e 00 00 00 fd 00 32 4c 1e
53 11 00 0a 20 20 20 20 20 20 00 00 00 ff 00 54
32 4a 45 45 30 30 38 34 32 30 38 0a 00 00 00 fc
00 41 63 65 72 20 4b 32 34 32 48 51 4c 0a 00 c2

00 ff ff ff ff ff ff 00 04 72 2e 04 5b a4 20 91
0c 1d 01 03 80 34 1d 78 2a 0b d5 a2 57 50 a1 28
0f 50 54 bf ef 00 d1 c0 81 80 81 c0 81 40 95 00
b3 00 01 01 01 01 02 3a 80 18 71 38 2d 40 58 2c
45 00 09 25 21 00 00 1e 00 00 00 fd 00 32 4c 1e
53 11 00 0a 20 20 20 20 20 20 00 00 00 ff 00 54
32 4a 45 45 30 30 38 34 32 30 38 0a 00 00 00 fc
00 41 63 65 72 20 4b 32 34 32 48 51 4c 0a 00 c2

----------------

Block 0, Base EDID:
  EDID Structure Version & Revision: 1.3
  Vendor & Product Identification:
    Manufacturer: ACR
    Model: 1070
    Serial Number: ...
    Made in: week 12 of 2019
  Basic Display Parameters & Features:
    Digital display
    Maximum image size: 52 cm x 29 cm
    Gamma: 2.20
    DPMS levels: Off
    RGB color display
    First detailed timing is the preferred timing
  Color Characteristics:
    Red  : 0.6328, 0.3398
    Green: 0.3144, 0.6318
    Blue : 0.1591, 0.0595
    White: 0.3134, 0.3291
  Established Timings I & II:
    IBM     :   720x400    70.081663 Hz   9:5     31.467 kHz     28.320000 MHz
    DMT 0x04:   640x480    59.940476 Hz   4:3     31.469 kHz     25.175000 MHz
    Apple   :   640x480    66.666667 Hz   4:3     35.000 kHz     30.240000 MHz
    DMT 0x05:   640x480    72.808802 Hz   4:3     37.861 kHz     31.500000 MHz
    DMT 0x06:   640x480    75.000000 Hz   4:3     37.500 kHz     31.500000 MHz
    DMT 0x08:   800x600    56.250000 Hz   4:3     35.156 kHz     36.000000 MHz
    DMT 0x09:   800x600    60.316541 Hz   4:3     37.879 kHz     40.000000 MHz
    DMT 0x0a:   800x600    72.187572 Hz   4:3     48.077 kHz     50.000000 MHz
    DMT 0x0b:   800x600    75.000000 Hz   4:3     46.875 kHz     49.500000 MHz
    Apple   :   832x624    74.551266 Hz   4:3     49.726 kHz     57.284000 MHz
    DMT 0x10:  1024x768    60.003840 Hz   4:3     48.363 kHz     65.000000 MHz
    DMT 0x11:  1024x768    70.069359 Hz   4:3     56.476 kHz     75.000000 MHz
    DMT 0x12:  1024x768    75.028582 Hz   4:3     60.023 kHz     78.750000 MHz
    DMT 0x24:  1280x1024   75.024675 Hz   5:4     79.976 kHz    135.000000 MHz
  Standard Timings:
    DMT 0x52:  1920x1080   60.000000 Hz  16:9     67.500 kHz    148.500000 MHz
    DMT 0x23:  1280x1024   60.019740 Hz   5:4     63.981 kHz    108.000000 MHz
    DMT 0x55:  1280x720    60.000000 Hz  16:9     45.000 kHz     74.250000 MHz
    DMT 0x20:  1280x960    60.000000 Hz   4:3     60.000 kHz    108.000000 MHz
    DMT 0x2f:  1440x900    59.887445 Hz  16:10    55.935 kHz    106.500000 MHz
    DMT 0x3a:  1680x1050   59.954250 Hz  16:10    65.290 kHz    146.250000 MHz
  Detailed Timing Descriptors:
    DTD 1:  1920x1080   60.000000 Hz  16:9     67.500 kHz    148.500000 MHz (521 mm x 293 mm)
                 Hfront   88 Hsync  44 Hback  148 Hpol P
                 Vfront    4 Vsync   5 Vback   36 Vpol P
    Display Range Limits:
      Monitor ranges (GTF): 50-76 Hz V, 30-83 kHz H, max dotclock 170 MHz
    Display Product Serial Number: ...
    Display Product Name: 'Acer K242HQL'
Checksum: 0xc2

----------------

Block 1, Unknown EDID Extension Block 0x00:
  00 ff ff ff ff ff ff 00 04 72 2e 04 5b a4 20 91 '.........r..[. .'
  0c 1d 01 03 80 34 1d 78 2a 0b d5 a2 57 50 a1 28 '.....4.x*...WP.('
  0f 50 54 bf ef 00 d1 c0 81 80 81 c0 81 40 95 00 '.PT..........@..'
  b3 00 01 01 01 01 02 3a 80 18 71 38 2d 40 58 2c '.......:..q8-@X,'
  45 00 09 25 21 00 00 1e 00 00 00 fd 00 32 4c 1e 'E..%!........2L.'
  53 11 00 0a 20 20 20 20 20 20 00 00 00 ff 00 54 'S...      .....T'
  32 4a 45 45 30 30 38 34 32 30 38 0a 00 00 00 fc '2JEE0084208.....'
  00 41 63 65 72 20 4b 32 34 32 48 51 4c 0a 00 c2 '.Acer K242HQL...'
Checksum: 0xc2

----------------

Failures:

Block 1, Base EDID:
  Unknown Extension Block.
EDID:
  Base EDID: EDID specified 0 extension block(s), but found 1 extension block(s).

EDID conformity: FAIL
