edid-decode (hex):

00 ff ff ff ff ff ff 00 22 f0 43 29 00 00 00 00
2e 15 01 04 a5 2c 19 78 26 81 f5 a3 57 53 9f 27
0a 50 54 a1 08 00 81 c0 81 80 95 00 a9 c0 01 01
01 01 01 01 01 01 30 2a 40 c8 60 84 64 30 18 50
13 00 bb f9 10 00 00 1e 00 00 00 fd 00 32 4c 18
53 0b 01 0a 20 20 20 20 20 20 00 00 00 fc 00 48
50 20 4c 41 32 30 30 36 0a 20 20 20 00 00 00 ff
00 43 4e 43 31 34 36 31 35 59 47 0a 20 20 00 6c

00 ff ff ff ff ff ff 00 22 f0 43 29 00 00 00 00
2e 15 01 04 a5 2c 19 78 26 81 f5 a3 57 53 9f 27
0a 50 54 a1 08 00 81 c0 81 80 95 00 a9 c0 01 01
01 01 01 01 01 01 30 2a 40 c8 60 84 64 30 18 50
13 00 bb f9 10 00 00 1e 00 00 00 fd 00 32 4c 18
53 0b 01 0a 20 20 20 20 20 20 00 00 00 fc 00 48
50 20 4c 41 32 30 30 36 0a 20 20 20 00 00 00 ff
00 43 4e 43 31 34 36 31 35 59 47 0a 20 20 00 6c

----------------

Block 0, Base EDID:
  EDID Structure Version & Revision: 1.4
  Vendor & Product Identification:
    Manufacturer: HWP
    Model: 10563
    Made in: week 46 of 2011
  Basic Display Parameters & Features:
    Digital display
    Bits per primary color channel: 8
    DisplayPort interface
    Maximum image size: 44 cm x 25 cm
    Gamma: 2.20
    DPMS levels: Off
    Supported color formats: RGB 4:4:4
    Default (sRGB) color space is primary color space
    First detailed timing includes the native pixel format and preferred refresh rate
  Color Characteristics:
    Red  : 0.6386, 0.3398
    Green: 0.3242, 0.6220
    Blue : 0.1552, 0.0419
    White: 0.3134, 0.3291
  Established Timings I & II:
    IBM     :   720x400    70.081663 Hz   9:5     31.467 kHz     28.320000 MHz
    DMT 0x04:   640x480    59.940476 Hz   4:3     31.469 kHz     25.175000 MHz
    DMT 0x09:   800x600    60.316541 Hz   4:3     37.879 kHz     40.000000 MHz
    DMT 0x10:  1024x768    60.003840 Hz   4:3     48.363 kHz     65.000000 MHz
  Standard Timings:
    DMT 0x55:  1280x720    60.000000 Hz  16:9     45.000 kHz     74.250000 MHz
    DMT 0x23:  1280x1024   60.019740 Hz   5:4     63.981 kHz    108.000000 MHz
    DMT 0x2f:  1440x900    59.887445 Hz  16:10    55.935 kHz    106.500000 MHz
    DMT 0x53:  1600x900    60.000000 Hz  16:9     60.000 kHz    108.000000 MHz (RB)
  Detailed Timing Descriptors:
    DTD 1:  1600x900    60.000000 Hz  16:9     60.000 kHz    108.000000 MHz (443 mm x 249 mm)
                 Hfront   24 Hsync  80 Hback   96 Hpol P
                 Vfront    1 Vsync   3 Vback   96 Vpol P
    Display Range Limits:
      Monitor ranges (Bare Limits): 50-76 Hz V, 24-83 kHz H, max dotclock 110 MHz
    Display Product Name: 'HP LA2006'
    Display Product Serial Number: ...
Checksum: 0x6c

----------------

Block 1, Unknown EDID Extension Block 0x00:
  00 ff ff ff ff ff ff 00 22 f0 43 29 00 00 00 00 '........".C)....'
  2e 15 01 04 a5 2c 19 78 26 81 f5 a3 57 53 9f 27 '.....,.x&...WS.''
  0a 50 54 a1 08 00 81 c0 81 80 95 00 a9 c0 01 01 '.PT.............'
  01 01 01 01 01 01 30 2a 40 c8 60 84 64 30 18 50 '......0*@.`.d0.P'
  13 00 bb f9 10 00 00 1e 00 00 00 fd 00 32 4c 18 '.............2L.'
  53 0b 01 0a 20 20 20 20 20 20 00 00 00 fc 00 48 'S...      .....H'
  50 20 4c 41 32 30 30 36 0a 20 20 20 00 00 00 ff 'P LA2006.   ....'
  00 43 4e 43 31 34 36 31 35 59 47 0a 20 20 00 6c '.CNC14615YG.  .l'
Checksum: 0x6c

----------------

Failures:

Block 0, Base EDID:
  Basic Display Parameters & Features: sRGB is signaled, but the chromaticities do not match.
Block 1, Base EDID:
  Unknown Extension Block.
EDID:
  Base EDID: EDID specified 0 extension block(s), but found 1 extension block(s).

EDID conformity: FAIL
