edid-decode (hex):

00 ff ff ff ff ff ff 00 22 f0 55 26 01 01 01 01
22 10 01 03 80 2d 1c 78 ee cf b5 a3 55 49 99 25
10 50 54 a5 6f 80 45 59 61 59 81 c0 81 40 81 80
81 99 b3 00 01 01 7c 2e 90 a0 60 1a 1e 40 30 20
36 00 b1 0f 11 00 00 1a 00 00 00 fd 00 30 55 1e
5e 11 00 0a 20 20 20 20 20 20 00 00 00 fc 00 48
50 20 66 32 31 30 35 0a 20 20 20 20 00 00 00 ff
00 43 4e 4b 36 33 34 31 30 52 53 0a 20 20 00 eb

00 ff ff ff ff ff ff 00 22 f0 55 26 01 01 01 01
22 10 01 03 80 2d 1c 78 ee cf b5 a3 55 49 99 25
10 50 54 a5 6f 80 45 59 61 59 81 c0 81 40 81 80
81 99 b3 00 01 01 7c 2e 90 a0 60 1a 1e 40 30 20
36 00 b1 0f 11 00 00 1a 00 00 00 fd 00 30 55 1e
5e 11 00 0a 20 20 20 20 20 20 00 00 00 fc 00 48
50 20 66 32 31 30 35 0a 20 20 20 20 00 00 00 ff
00 43 4e 4b 36 33 34 31 30 52 53 0a 20 20 00 eb

----------------

Block 0, Base EDID:
  EDID Structure Version & Revision: 1.3
  Vendor & Product Identification:
    Manufacturer: HWP
    Model: 9813
    Serial Number: ...
    Made in: week 34 of 2006
  Basic Display Parameters & Features:
    Digital display
    Maximum image size: 45 cm x 28 cm
    Gamma: 2.20
    DPMS levels: Standby Suspend Off
    RGB color display
    Default (sRGB) color space is primary color space
    First detailed timing is the preferred timing
  Color Characteristics:
    Red  : 0.6396, 0.3320
    Green: 0.2880, 0.6005
    Blue : 0.1464, 0.0654
    White: 0.3134, 0.3291
  Established Timings I & II:
    IBM     :   720x400    70.081663 Hz   9:5     31.467 kHz     28.320000 MHz
    DMT 0x04:   640x480    59.940476 Hz   4:3     31.469 kHz     25.175000 MHz
    DMT 0x06:   640x480    75.000000 Hz   4:3     37.500 kHz     31.500000 MHz
    DMT 0x09:   800x600    60.316541 Hz   4:3     37.879 kHz     40.000000 MHz
    DMT 0x0b:   800x600    75.000000 Hz   4:3     46.875 kHz     49.500000 MHz
    Apple   :   832x624    74.551266 Hz   4:3     49.726 kHz     57.284000 MHz
    DMT 0x10:  1024x768    60.003840 Hz   4:3     48.363 kHz     65.000000 MHz
    DMT 0x11:  1024x768    70.069359 Hz   4:3     56.476 kHz     75.000000 MHz
    DMT 0x12:  1024x768    75.028582 Hz   4:3     60.023 kHz     78.750000 MHz
    DMT 0x24:  1280x1024   75.024675 Hz   5:4     79.976 kHz    135.000000 MHz
    Apple   :  1152x870    75.061550 Hz 192:145   68.681 kHz    100.000000 MHz
  Standard Timings:
    DMT 0x0c:   800x600    85.061274 Hz   4:3     53.674 kHz     56.250000 MHz
    DMT 0x13:  1024x768    84.996690 Hz   4:3     68.677 kHz     94.500000 MHz
    DMT 0x55:  1280x720    60.000000 Hz  16:9     45.000 kHz     74.250000 MHz
    DMT 0x20:  1280x960    60.000000 Hz   4:3     60.000 kHz    108.000000 MHz
    DMT 0x23:  1280x1024   60.019740 Hz   5:4     63.981 kHz    108.000000 MHz
    DMT 0x25:  1280x1024   85.024098 Hz   5:4     91.146 kHz    157.500000 MHz
    DMT 0x3a:  1680x1050   59.954250 Hz  16:10    65.290 kHz    146.250000 MHz
  Detailed Timing Descriptors:
    DTD 1:  1680x1050   59.883253 Hz  16:10    64.674 kHz    119.000000 MHz (433 mm x 271 mm)
                 Hfront   48 Hsync  32 Hback   80 Hpol P
                 Vfront    3 Vsync   6 Vback   21 Vpol N
    Display Range Limits:
      Monitor ranges (GTF): 48-85 Hz V, 30-94 kHz H, max dotclock 170 MHz
    Display Product Name: 'HP f2105'
    Display Product Serial Number: ...
Checksum: 0xeb

----------------

Block 1, Unknown EDID Extension Block 0x00:
  00 ff ff ff ff ff ff 00 22 f0 55 26 01 01 01 01 '........".U&....'
  22 10 01 03 80 2d 1c 78 ee cf b5 a3 55 49 99 25 '"....-.x....UI.%'
  10 50 54 a5 6f 80 45 59 61 59 81 c0 81 40 81 80 '.PT.o.EYaY...@..'
  81 99 b3 00 01 01 7c 2e 90 a0 60 1a 1e 40 30 20 '......|...`..@0 '
  36 00 b1 0f 11 00 00 1a 00 00 00 fd 00 30 55 1e '6............0U.'
  5e 11 00 0a 20 20 20 20 20 20 00 00 00 fc 00 48 '^...      .....H'
  50 20 66 32 31 30 35 0a 20 20 20 20 00 00 00 ff 'P f2105.    ....'
  00 43 4e 4b 36 33 34 31 30 52 53 0a 20 20 00 eb '.CNK63410RS.  ..'
Checksum: 0xeb

----------------

Failures:

Block 0, Base EDID:
  Basic Display Parameters & Features: sRGB is signaled, but the chromaticities do not match.
Block 1, Base EDID:
  Unknown Extension Block.
EDID:
  Base EDID: EDID specified 0 extension block(s), but found 1 extension block(s).

EDID conformity: FAIL
