
EDID (hex):
00ffffffffffff0038a3756601010101
17100103806639782a1a0da655459724
11474a20000001010101010101010101
010101010101011d8018711c1620582c
2500fa3d3200009e011d80d0721c1620
102c2580fa3d3200009e000000fd0031
3d1b460f000a202020202020000000fc
004c4344343631300a2020202020013f
02010400011d007251d01e206e285500
fa3d3200001e011d00bc52d01e20b828
5540fa3d3200001e8c0ad08a20e02d10
103e9600fa3d320000188c0ad0902040
31200c405500fa3d3200001800000000
00000000000000000000000000000000
00000000000000000000000000000000
00000000000000000000000000000007

Extracted contents:
header:          00 ff ff ff ff ff ff 00
serial number:   38 a3 75 66 01 01 01 01 17 10
version:         01 03
basic params:    80 66 39 78 2a
chroma info:     1a 0d a6 55 45 97 24 11 47 4a
established:     20 00 00
standard:        01 01 01 01 01 01 01 01 01 01 01 01 01 01 01 01
descriptor 1:    01 1d 80 18 71 1c 16 20 58 2c 25 00 fa 3d 32 00 00 9e
descriptor 2:    01 1d 80 d0 72 1c 16 20 10 2c 25 80 fa 3d 32 00 00 9e
descriptor 3:    00 00 00 fd 00 31 3d 1b 46 0f 00 0a 20 20 20 20 20 20
descriptor 4:    00 00 00 fc 00 4c 43 44 34 36 31 30 0a 20 20 20 20 20
extensions:      01
checksum:        3f

EDID version: 1.3
Manufacturer: NEC Model 6675 Serial Number --
Made in week 23 of 2006
Digital display
Maximum image size: 102 cm x 57 cm
Gamma: 2.20
DPMS levels: Off
RGB color display
First detailed timing is preferred timing
Display x,y Chromaticity:
  Red:   0.6484, 0.3330
  Green: 0.2714, 0.5917
  Blue:  0.1406, 0.0664
  White: 0.2802, 0.2900
Established timings supported:
  640x480@60Hz 4:3 HorFreq: 31469 Hz Clock: 25.175 MHz
Standard timings supported:
Detailed mode: Clock 74.250 MHz, 1018 mm x 573 mm
               1920 2008 2052 2200 hborder 0
                540  542  547  562 vborder 0
               +hsync +vsync interlaced 
               VertFreq: 60 Hz, HorFreq: 33750 Hz
Detailed mode: Clock 74.250 MHz, 1018 mm x 573 mm
               1920 2448 2492 2640 hborder 0
                540  542  547  562 vborder 0
               +hsync +vsync interlaced 
               VertFreq: 50 Hz, HorFreq: 28125 Hz
Monitor ranges (GTF): 49-61Hz V, 27-70kHz H, max dotclock 150MHz
Monitor name: LCD4610
Has 1 extension blocks
Checksum: 0x3f (valid)

CTA extension block
Extension version: 1
0 8-byte timing descriptors
Detailed mode: Clock 74.250 MHz, 1018 mm x 573 mm
               1280 1390 1430 1650 hborder 0
                720  725  730  750 vborder 0
               +hsync +vsync 
               VertFreq: 60 Hz, HorFreq: 45000 Hz
Detailed mode: Clock 74.250 MHz, 1018 mm x 573 mm
               1280 1720 1760 1980 hborder 0
                720  725  730  750 vborder 0
               +hsync +vsync 
               VertFreq: 50 Hz, HorFreq: 37500 Hz
Detailed mode: Clock 27.000 MHz, 1018 mm x 573 mm
                720  736  798  858 hborder 0
                480  489  495  525 vborder 0
               -hsync -vsync 
               VertFreq: 59 Hz, HorFreq: 31468 Hz
Detailed mode: Clock 27.000 MHz, 1018 mm x 573 mm
                720  732  796  864 hborder 0
                576  581  586  625 vborder 0
               -hsync -vsync 
               VertFreq: 50 Hz, HorFreq: 31250 Hz
Checksum: 0x7 (valid)
