
EDID (hex):
00ffffffffffff001d6bff0100000000
11160103684627782a0dc9a057479827
12484cadea808180714f010101010101
010101010101662156aa51001e30288f
3300ba882100001e662150b051001b30
40703600ba882100001e000000fd003c
4b1e3d09000a202020202020000000fc
004d4f4e49544f520a202020202000e4

Extracted contents:
header:          00 ff ff ff ff ff ff 00
serial number:   1d 6b ff 01 00 00 00 00 11 16
version:         01 03
basic params:    68 46 27 78 2a
chroma info:     0d c9 a0 57 47 98 27 12 48 4c
established:     ad ea 80
standard:        81 80 71 4f 01 01 01 01 01 01 01 01 01 01 01 01
descriptor 1:    66 21 56 aa 51 00 1e 30 28 8f 33 00 ba 88 21 00 00 1e
descriptor 2:    66 21 50 b0 51 00 1b 30 40 70 36 00 ba 88 21 00 00 1e
descriptor 3:    00 00 00 fd 00 3c 4b 1e 3d 09 00 0a 20 20 20 20 20 20
descriptor 4:    00 00 00 fc 00 4d 4f 4e 49 54 4f 52 0a 20 20 20 20 20
extensions:      00
checksum:        e4

EDID version: 1.3
Manufacturer: GKK Model 1ff Serial Number --
Made in week 17 of 2012
Analog display, Input voltage level: 0.7/0.7 V
Sync: Separate 
Maximum image size: 70 cm x 39 cm
Gamma: 2.20
DPMS levels: Off
RGB color display
First detailed timing is preferred timing
Display x,y Chromaticity:
  Red:   0.6250, 0.3398
  Green: 0.2802, 0.5947
  Blue:  0.1552, 0.0703
  White: 0.2832, 0.2978
Established timings supported:
  720x400@70Hz 9:5 HorFreq: 31469 Hz Clock: 28.320 MHz
  640x480@60Hz 4:3 HorFreq: 31469 Hz Clock: 25.175 MHz
  640x480@72Hz 4:3 HorFreq: 37900 Hz Clock: 31.500 MHz
  640x480@75Hz 4:3 HorFreq: 37500 Hz Clock: 31.500 MHz
  800x600@60Hz 4:3 HorFreq: 37900 Hz Clock: 40.000 MHz
  800x600@72Hz 4:3 HorFreq: 48100 Hz Clock: 50.000 MHz
  800x600@75Hz 4:3 HorFreq: 46900 Hz Clock: 49.500 MHz
  832x624@75Hz 4:3 HorFreq: 49726 Hz Clock: 57.284 MHz
  1024x768@60Hz 4:3 HorFreq: 48400 Hz Clock: 65.000 MHz
  1024x768@75Hz 4:3 HorFreq: 60000 Hz Clock: 78.750 MHz
  1152x870@75Hz 192:145 HorFreq: 67500 Hz Clock: 108.000 MHz
Standard timings supported:
  1280x1024@60Hz 5:4 HorFreq: 64000 Hz Clock: 108.000 MHz
  1152x864@75Hz 4:3 HorFreq: 67500 Hz Clock: 108.000 MHz
Detailed mode: Clock 85.500 MHz, 698 mm x 392 mm
               1366 1406 1549 1792 hborder 0
                768  771  774  798 vborder 0
               +hsync +vsync 
               VertFreq: 59 Hz, HorFreq: 47712 Hz
Detailed mode: Clock 85.500 MHz, 698 mm x 392 mm
               1360 1424 1536 1792 hborder 0
                768  771  777  795 vborder 0
               +hsync +vsync 
               VertFreq: 60 Hz, HorFreq: 47712 Hz
Monitor ranges (GTF): 60-75Hz V, 30-61kHz H, max dotclock 90MHz
Monitor name: MONITOR
Checksum: 0xe4 (valid)
One or more of the timings is out of range of the Monitor Ranges:
  Vertical Freq: 59 - 75 Hz
  Horizontal Freq: 31469 - 67500 Hz
  Maximum Clock: 108.000 MHz
