
EDID (hex):
00ffffffffffff000d04700201000000
241e0104b53c217829ee91a3544c9926
0f505421080031404540614081c08180
9500b300a9c0023a801871382d40582c
4500584a2100001e000000fd00304b55
5514010a202020202020000000ff0030
303030303030303030303031000000fc
00504d4f20533237312d4946430a019d
020314f147901f041303120123090707
83010000504480a07038294030203500
582c2100001e00000000000000000000
00000000000000000000000000000000
00000000000000000000000000000000
00000000000000000000000000000000
00000000000000000000000000000000
00000000000000000000000000000008

Extracted contents:
header:          00 ff ff ff ff ff ff 00
serial number:   0d 04 70 02 01 00 00 00 24 1e
version:         01 04
basic params:    b5 3c 21 78 29
chroma info:     ee 91 a3 54 4c 99 26 0f 50 54
established:     21 08 00
standard:        31 40 45 40 61 40 81 c0 81 80 95 00 b3 00 a9 c0
descriptor 1:    02 3a 80 18 71 38 2d 40 58 2c 45 00 58 4a 21 00 00 1e
descriptor 2:    00 00 00 fd 00 30 4b 55 55 14 01 0a 20 20 20 20 20 20
descriptor 3:    00 00 00 ff 00 30 30 30 30 30 30 30 30 30 30 30 30 31
descriptor 4:    00 00 00 fc 00 50 4d 4f 20 53 32 37 31 2d 49 46 43 0a
extensions:      01
checksum:        9d

EDID version: 1.4
Manufacturer: CHD Model 270 Serial Number --
Made in week 36 of 2020
Digital display
10 bits per primary color channel
DisplayPort interface
Maximum image size: 60 cm x 33 cm
Gamma: 2.20
DPMS levels: Off
Supported color formats: RGB 4:4:4, YCrCb 4:4:4
Display is continuous frequency
Display x,y Chromaticity:
  Red:   0.6396, 0.3300
  Green: 0.2998, 0.5996
  Blue:  0.1503, 0.0595
  White: 0.3125, 0.3291
Established timings supported:
  640x480@60Hz 4:3 HorFreq: 31469 Hz Clock: 25.175 MHz
  800x600@60Hz 4:3 HorFreq: 37900 Hz Clock: 40.000 MHz
  1024x768@60Hz 4:3 HorFreq: 48400 Hz Clock: 65.000 MHz
Standard timings supported:
  640x480@60Hz 4:3 HorFreq: 31469 Hz Clock: 25.175 MHz
  800x600@60Hz 4:3 HorFreq: 37900 Hz Clock: 40.000 MHz
  1024x768@60Hz 4:3 HorFreq: 48400 Hz Clock: 65.000 MHz
  1280x720@60Hz 16:9
  1280x1024@60Hz 5:4 HorFreq: 64000 Hz Clock: 108.000 MHz
  1440x900@60Hz 16:10 HorFreq: 55500 Hz Clock: 88.750 MHz
  1680x1050@60Hz 16:10 HorFreq: 64700 Hz Clock: 119.000 MHz
  1600x900@60Hz 16:9
Detailed mode: Clock 148.500 MHz, 600 mm x 330 mm
               1920 2008 2052 2200 hborder 0
               1080 1084 1089 1125 vborder 0
               +hsync +vsync 
               VertFreq: 60 Hz, HorFreq: 67500 Hz
Monitor ranges (bare limits): 48-75Hz V, 85-85kHz H, max dotclock 200MHz
Serial number: --
Monitor name: PMO S271-IFC
Has 1 extension blocks
Checksum: 0x9d (valid)

CTA extension block
Extension version: 3
16 bytes of CTA data
  Video data block
    VIC  16 1920x1080@60Hz 16:9 (native) HorFreq: 67500 Hz Clock: 148.500 MHz
    VIC  31 1920x1080@50Hz 16:9  HorFreq: 56250 Hz Clock: 148.500 MHz
    VIC   4 1280x720@60Hz 16:9  HorFreq: 45000 Hz Clock: 74.250 MHz
    VIC  19 1280x720@50Hz 16:9  HorFreq: 37500 Hz Clock: 74.250 MHz
    VIC   3 720x480@60Hz 16:9  HorFreq: 31469 Hz Clock: 27.000 MHz
    VIC  18 720x576@50Hz 16:9  HorFreq: 31250 Hz Clock: 27.000 MHz
    VIC   1 640x480@60Hz 4:3  HorFreq: 31469 Hz Clock: 25.175 MHz
  Audio data block
    Linear PCM, max channels 2
      Supported sample rates (kHz): 48 44.1 32
      Supported sample sizes (bits): 24 20 16
  Speaker allocation data block
    Speaker map:
      FL/FR - Front Left/Right
Underscans PC formats by default
Basic audio support
Supports YCbCr 4:4:4
Supports YCbCr 4:2:2
1 native detailed modes
Detailed mode: Clock 174.880 MHz, 600 mm x 300 mm
               1920 1968 2000 2080 hborder 0
               1080 1083 1088 1121 vborder 0
               +hsync +vsync 
               VertFreq: 75 Hz, HorFreq: 84076 Hz
Checksum: 0x8 (valid)

Warning: One or more of the timings is out of range of the Monitor Ranges:
  Vertical Freq: 50 - 75 Hz
  Horizontal Freq: 31250 - 84076 Hz
  Maximum Clock: 174.880 MHz
EDID block does not conform at all!
	Both the serial number and the serial string are set


