edid-decode (hex):

00 ff ff ff ff ff ff 00 09 e5 ad 07 00 00 00 00
01 1c 01 04 95 1d 11 78 02 24 10 97 59 54 8e 27
1e 50 54 00 00 00 01 01 01 01 01 01 01 01 01 01
01 01 01 01 01 01 c6 1d 56 e2 50 00 1e 30 30 20
36 00 26 a5 10 00 00 1a d9 13 56 e2 50 00 1e 30
30 20 36 00 26 a5 10 00 00 1a 00 00 00 00 00 00
00 00 00 00 00 00 00 00 00 00 00 00 00 00 00 02
00 0d 49 ff 0a 3c 6e 10 0c 15 6e 00 00 00 00 eb

----------------

Block 0, Base EDID:
  EDID Structure Version & Revision: 1.4
  Vendor & Product Identification:
    Manufacturer: BOE
    Model: 1965
    Made in: week 1 of 2018
  Basic Display Parameters & Features:
    Digital display
    Bits per primary color channel: 6
    DisplayPort interface
    Maximum image size: 29 cm x 17 cm
    Gamma: 2.20
    Supported color formats: RGB 4:4:4
    First detailed timing includes the native pixel format and preferred refresh rate
  Color Characteristics:
    Red  : 0.5898, 0.3496
    Green: 0.3291, 0.5546
    Blue : 0.1523, 0.1181
    White: 0.3125, 0.3281
  Established Timings I & II: none
  Standard Timings: none
  Detailed Timing Descriptors:
    DTD 1:  1366x768    59.996 Hz 683:384  47.877 kHz  76.220 MHz (294 mm x 165 mm)
                 Hfront   48 Hsync  32 Hback 146 Hpol P
                 Vfront    3 Vsync   6 Vback  21 Vpol N
    DTD 2:  1366x768    39.995 Hz 683:384  31.916 kHz  50.810 MHz (294 mm x 165 mm)
                 Hfront   48 Hsync  32 Hback 146 Hpol P
                 Vfront    3 Vsync   6 Vback  21 Vpol N
    Empty Descriptor
    Manufacturer-Specified Display Descriptor (0x02): 00 02 00 0d 49 ff 0a 3c 6e 10 0c 15 6e 00 00 00 '....I..<n...n...'
Checksum: 0xeb

----------------

Failures:

Block 0, Base EDID:
  Empty Descriptor: Use Dummy Descriptor instead of all zeroes.
  Missing Display Product Name.

EDID conformity: FAIL
