edid-decode (hex):

00 ff ff ff ff ff ff 00 0d ae 31 11 00 00 00 00
0f 17 01 04 95 1a 0e 78 02 ad a5 96 57 54 92 28
23 50 54 00 00 00 01 01 01 01 01 01 01 01 01 01
01 01 01 01 01 01 da 1d 56 e2 50 00 20 30 88 1e
8c 00 00 90 10 00 00 18 00 00 00 fe 00 4e 31 31
36 42 47 45 2d 45 33 32 0a 20 00 00 00 fe 00 43
4d 4e 0a 20 20 20 20 20 20 20 20 20 00 00 00 fe
00 4e 31 31 36 42 47 45 2d 45 33 32 0a 20 00 5e

----------------

Block 0, Base EDID:
  EDID Structure Version & Revision: 1.4
  Vendor & Product Identification:
    Manufacturer: CMN
    Model: 4401
    Made in: week 15 of 2013
  Basic Display Parameters & Features:
    Digital display
    Bits per primary color channel: 6
    DisplayPort interface
    Maximum image size: 26 cm x 14 cm
    Gamma: 2.20
    Supported color formats: RGB 4:4:4
    First detailed timing includes the native pixel format and preferred refresh rate
  Color Characteristics:
    Red  : 0.5878, 0.3417
    Green: 0.3310, 0.5712
    Blue : 0.1582, 0.1386
    White: 0.3134, 0.3291
  Established Timings I & II: none
  Standard Timings: none
  Detailed Timing Descriptors:
    DTD 1:  1366x768    60.003141 Hz 683:384   48.003 kHz     76.420000 MHz (256 mm x 144 mm)
                 Hfront  136 Hsync  30 Hback   60 Hpol N
                 Vfront    8 Vsync  12 Vback   12 Vpol N
    Alphanumeric Data String: 'N116BGE-E32'
    Alphanumeric Data String: 'CMN'
    Alphanumeric Data String: 'N116BGE-E32'
Checksum: 0x5e

----------------

Warnings:

Block 0, Base EDID:
  Missing Display Product Name.

EDID conformity: PASS
