edid-decode (hex):

00 ff ff ff ff ff ff 00 1a b3 c4 07 01 00 00 00
29 14 01 03 80 2f 1e 78 2a 36 c5 a4 55 4c 9c 25
12 50 54 a5 4b 00 95 00 95 0f 81 00 81 0f 81 c0
81 80 b3 00 01 01 21 39 90 30 62 1a 27 40 68 b0
36 00 da 28 11 00 00 1c 7c 2e 90 a0 60 1a 1e 40
30 20 36 00 da 28 11 00 00 1a 00 00 00 fc 00 42
32 32 57 2d 35 20 45 43 4f 0a 20 20 00 00 00 ff
00 59 56 31 44 32 35 36 39 38 32 0a 20 20 00 ad

00 ff ff ff ff ff ff 00 1a b3 c4 07 01 00 00 00
29 14 01 03 80 2f 1e 78 2a 36 c5 a4 55 4c 9c 25
12 50 54 a5 4b 00 95 00 95 0f 81 00 81 0f 81 c0
81 80 b3 00 01 01 21 39 90 30 62 1a 27 40 68 b0
36 00 da 28 11 00 00 1c 7c 2e 90 a0 60 1a 1e 40
30 20 36 00 da 28 11 00 00 1a 00 00 00 fc 00 42
32 32 57 2d 35 20 45 43 4f 0a 20 20 00 00 00 ff
00 59 56 31 44 32 35 36 39 38 32 0a 20 20 00 ad

----------------

Block 0, Base EDID:
  EDID Structure Version & Revision: 1.3
  Vendor & Product Identification:
    Manufacturer: FUS
    Model: 1988
    Serial Number: ...
    Made in: week 41 of 2010
  Basic Display Parameters & Features:
    Digital display
    Maximum image size: 47 cm x 30 cm
    Gamma: 2.20
    DPMS levels: Off
    RGB color display
    First detailed timing is the preferred timing
  Color Characteristics:
    Red  : 0.6406, 0.3349
    Green: 0.2978, 0.6113
    Blue : 0.1474, 0.0703
    White: 0.3134, 0.3291
  Established Timings I & II:
    IBM     :   720x400    70.081663 Hz   9:5     31.467 kHz     28.320000 MHz
    DMT 0x04:   640x480    59.940476 Hz   4:3     31.469 kHz     25.175000 MHz
    DMT 0x06:   640x480    75.000000 Hz   4:3     37.500 kHz     31.500000 MHz
    DMT 0x09:   800x600    60.316541 Hz   4:3     37.879 kHz     40.000000 MHz
    DMT 0x0b:   800x600    75.000000 Hz   4:3     46.875 kHz     49.500000 MHz
    DMT 0x10:  1024x768    60.003840 Hz   4:3     48.363 kHz     65.000000 MHz
    DMT 0x12:  1024x768    75.028582 Hz   4:3     60.023 kHz     78.750000 MHz
    DMT 0x24:  1280x1024   75.024675 Hz   5:4     79.976 kHz    135.000000 MHz
  Standard Timings:
    DMT 0x2f:  1440x900    59.887445 Hz  16:10    55.935 kHz    106.500000 MHz
    DMT 0x30:  1440x900    74.984427 Hz  16:10    70.635 kHz    136.750000 MHz
    DMT 0x1c:  1280x800    59.810326 Hz  16:10    49.702 kHz     83.500000 MHz
    DMT 0x1d:  1280x800    74.934142 Hz  16:10    62.795 kHz    106.500000 MHz
    DMT 0x55:  1280x720    60.000000 Hz  16:9     45.000 kHz     74.250000 MHz
    DMT 0x23:  1280x1024   60.019740 Hz   5:4     63.981 kHz    108.000000 MHz
    DMT 0x3a:  1680x1050   59.954250 Hz  16:10    65.290 kHz    146.250000 MHz
  Detailed Timing Descriptors:
    DTD 1:  1680x1050   59.954250 Hz  16:10    65.290 kHz    146.250000 MHz (474 mm x 296 mm)
                 Hfront  104 Hsync 176 Hback  280 Hpol N
                 Vfront    3 Vsync   6 Vback   30 Vpol P
    DTD 2:  1680x1050   59.883253 Hz  16:10    64.674 kHz    119.000000 MHz (474 mm x 296 mm)
                 Hfront   48 Hsync  32 Hback   80 Hpol P
                 Vfront    3 Vsync   6 Vback   21 Vpol N
    Display Product Name: 'B22W-5 ECO'
    Display Product Serial Number: ...
Checksum: 0xad

----------------

Block 1, Unknown EDID Extension Block 0x00:
  00 ff ff ff ff ff ff 00 1a b3 c4 07 01 00 00 00 '................'
  29 14 01 03 80 2f 1e 78 2a 36 c5 a4 55 4c 9c 25 ')..../.x*6..UL.%'
  12 50 54 a5 4b 00 95 00 95 0f 81 00 81 0f 81 c0 '.PT.K...........'
  81 80 b3 00 01 01 21 39 90 30 62 1a 27 40 68 b0 '......!9.0b.'@h.'
  36 00 da 28 11 00 00 1c 7c 2e 90 a0 60 1a 1e 40 '6..(....|...`..@'
  30 20 36 00 da 28 11 00 00 1a 00 00 00 fc 00 42 '0 6..(.........B'
  32 32 57 2d 35 20 45 43 4f 0a 20 20 00 00 00 ff '22W-5 ECO.  ....'
  00 59 56 31 44 32 35 36 39 38 32 0a 20 20 00 ad '.YV1D256982.  ..'
Checksum: 0xad

----------------

Failures:

Block 0, Base EDID:
  Missing Display Range Limits Descriptor.
Block 1, Base EDID:
  Unknown Extension Block.
EDID:
  Base EDID: EDID specified 0 extension block(s), but found 1 extension block(s).

EDID conformity: FAIL
