edid-decode (hex):

00 ff ff ff ff ff ff 00 09 e5 39 0a 00 00 00 00
00 1f 01 04 a5 22 13 78 03 6c 35 94 5d 58 93 2a
21 50 54 00 00 00 01 01 01 01 01 01 01 01 01 01
01 01 01 01 01 01 04 3a 80 36 71 38 1e 40 30 20
36 00 58 c2 10 00 00 18 00 00 00 fd 00 28 3c 43
43 0f 01 0a 20 20 20 20 20 20 00 00 00 fe 00 42
4f 45 20 43 51 0a 20 20 20 20 20 20 00 00 00 fe
00 4e 54 31 35 36 46 48 4d 2d 54 53 30 0a 00 e5

----------------

Block 0, Base EDID:
  EDID Structure Version & Revision: 1.4
  Vendor & Product Identification:
    Manufacturer: BOE
    Model: 2617
    Made in: 2021
  Basic Display Parameters & Features:
    Digital display
    Bits per primary color channel: 8
    DisplayPort interface
    Maximum image size: 34 cm x 19 cm
    Gamma: 2.20
    Supported color formats: RGB 4:4:4
    First detailed timing includes the native pixel format and preferred refresh rate
    Display is continuous frequency
  Color Characteristics:
    Red  : 0.5791, 0.3652
    Green: 0.3466, 0.5742
    Blue : 0.1640, 0.1318
    White: 0.3134, 0.3291
  Established Timings I & II: none
  Standard Timings: none
  Detailed Timing Descriptors:
    DTD 1:  1920x1080   60.000808 Hz  16:9     66.601 kHz    148.520000 MHz (344 mm x 194 mm)
                 Hfront   48 Hsync  32 Hback  230 Hpol N
                 Vfront    3 Vsync   6 Vback   21 Vpol N
    Display Range Limits:
      Monitor ranges (Bare Limits): 40-60 Hz V, 67-67 kHz H, max dotclock 150 MHz
    Alphanumeric Data String: 'BOE CQ'
    Alphanumeric Data String: 'NT156FHM-TS0'
Checksum: 0xe5

----------------

Failures:

Block 0, Base EDID:
  Missing Display Product Name.

EDID conformity: FAIL
