
EDID (hex):
00ffffffffffff005a6325ac01010101
2d140103182917782edc55a359489e24
115054bfef8081808140810f8100714f
010101010101662156aa51001e30468f
33009ae61000001e000000ff00534130
3130343530303933310a000000fd0032
4b185211000a202020202020000000fc
00564131393331205365726965730063

Extracted contents:
header:          00 ff ff ff ff ff ff 00
serial number:   5a 63 25 ac 01 01 01 01 2d 14
version:         01 03
basic params:    18 29 17 78 2e
chroma info:     dc 55 a3 59 48 9e 24 11 50 54
established:     bf ef 80
standard:        81 80 81 40 81 0f 81 00 71 4f 01 01 01 01 01 01
descriptor 1:    66 21 56 aa 51 00 1e 30 46 8f 33 00 9a e6 10 00 00 1e
descriptor 2:    00 00 00 ff 00 53 41 30 31 30 34 35 30 30 39 33 31 0a
descriptor 3:    00 00 00 fd 00 32 4b 18 52 11 00 0a 20 20 20 20 20 20
descriptor 4:    00 00 00 fc 00 56 41 31 39 33 31 20 53 65 72 69 65 73
extensions:      00
checksum:        63

EDID version: 1.3
Manufacturer: VSC Model ac25 Serial Number --
Made in week 45 of 2010
Analog display, Input voltage level: 0.7/0.3 V
Configurable signal levels
Sync: Separate 
Maximum image size: 41 cm x 23 cm
Gamma: 2.20
DPMS levels: Off
RGB color display
Default (sRGB) color space is primary color space
First detailed timing is preferred timing
Display x,y Chromaticity:
  Red:   0.6396, 0.3486
  Green: 0.2841, 0.6171
  Blue:  0.1416, 0.0673
  White: 0.3134, 0.3291
Established timings supported:
  720x400@70Hz 9:5 HorFreq: 31469 Hz Clock: 28.320 MHz
  640x480@60Hz 4:3 HorFreq: 31469 Hz Clock: 25.175 MHz
  640x480@67Hz 4:3 HorFreq: 35000 Hz Clock: 30.240 MHz
  640x480@72Hz 4:3 HorFreq: 37900 Hz Clock: 31.500 MHz
  640x480@75Hz 4:3 HorFreq: 37500 Hz Clock: 31.500 MHz
  800x600@56Hz 4:3 HorFreq: 35200 Hz Clock: 36.000 MHz
  800x600@60Hz 4:3 HorFreq: 37900 Hz Clock: 40.000 MHz
  800x600@72Hz 4:3 HorFreq: 48100 Hz Clock: 50.000 MHz
  800x600@75Hz 4:3 HorFreq: 46900 Hz Clock: 49.500 MHz
  832x624@75Hz 4:3 HorFreq: 49726 Hz Clock: 57.284 MHz
  1024x768@60Hz 4:3 HorFreq: 48400 Hz Clock: 65.000 MHz
  1024x768@70Hz 4:3 HorFreq: 56500 Hz Clock: 75.000 MHz
  1024x768@75Hz 4:3 HorFreq: 60000 Hz Clock: 78.750 MHz
  1280x1024@75Hz 5:4 HorFreq: 80000 Hz Clock: 135.000 MHz
  1152x870@75Hz 192:145 HorFreq: 67500 Hz Clock: 108.000 MHz
Standard timings supported:
  1280x1024@60Hz 5:4 HorFreq: 64000 Hz Clock: 108.000 MHz
  1280x960@60Hz 4:3 HorFreq: 60000 Hz Clock: 108.000 MHz
  1280x800@75Hz 16:10
  1280x800@60Hz 16:10
  1152x864@75Hz 4:3 HorFreq: 67500 Hz Clock: 108.000 MHz
Detailed mode: Clock 85.500 MHz, 410 mm x 230 mm
               1366 1436 1579 1792 hborder 0
                768  771  774  798 vborder 0
               +hsync +vsync 
               VertFreq: 59 Hz, HorFreq: 47712 Hz
Serial number: --
Monitor ranges (GTF): 50-75Hz V, 24-82kHz H, max dotclock 170MHz
Checksum: 0x63 (valid)
EDID block does NOT conform to EDID 1.3!
	sRGB is signaled, but the chromaticities do not match
	Name descriptor not terminated with a newline
