edid-decode (hex):

00 ff ff ff ff ff ff 00 30 e4 13 02 00 00 00 00
00 13 01 04 95 1f 11 78 02 05 85 9a 5b 53 94 26
0d 50 54 00 00 00 01 01 01 01 01 01 01 01 01 01
01 01 01 01 01 01 1c 2a 40 40 61 84 24 30 30 20
35 00 36 ae 10 00 00 1b 13 1c 40 40 61 84 24 30
30 20 35 00 36 ae 10 00 00 1b 00 00 00 00 00 00
00 00 00 00 00 00 00 00 00 00 00 00 00 00 00 02
00 0c 47 ea 0a 3c 64 24 1a 28 64 00 00 00 00 77

----------------

Block 0, Base EDID:
  EDID Structure Version & Revision: 1.4
  Vendor & Product Identification:
    Manufacturer: LGD
    Model: 531
    Made in: 2009
  Basic Display Parameters & Features:
    Digital display
    Bits per primary color channel: 6
    DisplayPort interface
    Maximum image size: 31 cm x 17 cm
    Gamma: 2.20
    Supported color formats: RGB 4:4:4
    First detailed timing includes the native pixel format and preferred refresh rate
  Color Characteristics:
    Red  : 0.6015, 0.3554
    Green: 0.3251, 0.5791
    Blue : 0.1503, 0.0507
    White: 0.3134, 0.3291
  Established Timings I & II: none
  Standard Timings: none
  Detailed Timing Descriptors:
    DTD 1:  1600x900    59.984865 Hz  16:9     56.146 kHz    107.800000 MHz (310 mm x 174 mm)
                 Hfront   48 Hsync  32 Hback  240 Hpol P
                 Vfront    3 Vsync   5 Vback   28 Vpol N
    DTD 2:  1600x900    39.991765 Hz  16:9     37.432 kHz     71.870000 MHz (310 mm x 174 mm)
                 Hfront   48 Hsync  32 Hback  240 Hpol P
                 Vfront    3 Vsync   5 Vback   28 Vpol N
    Empty Descriptor
    Manufacturer-Specified Display Descriptor (0x02): 00 02 00 0c 47 ea 0a 3c 64 24 1a 28 64 00 00 00 '....G..<d$.(d...'
Checksum: 0x77

----------------

Failures:

Block 0, Base EDID:
  Empty Descriptor: Use Dummy Descriptor instead of all zeroes.
  Missing Display Product Name.

EDID conformity: FAIL
