edid-decode (hex):

00 ff ff ff ff ff ff 00 06 af 36 11 00 00 00 00
00 18 01 04 a5 1f 11 78 02 99 85 95 55 56 92 28
22 50 54 00 00 00 01 01 01 01 01 01 01 01 01 01
01 01 01 01 01 01 1c 61 00 c8 a0 a0 3c 50 28 20
aa 00 35 ae 10 00 00 18 bd 40 00 c8 a0 a0 3c 50
28 20 aa 00 35 ae 10 00 00 18 00 00 00 00 00 00
00 00 00 00 00 00 00 00 00 00 00 00 00 00 00 02
00 14 30 ff 12 3c aa 19 14 0c aa 20 20 20 00 94

----------------

Block 0, Base EDID:
  EDID Structure Version & Revision: 1.4
  Vendor & Product Identification:
    Manufacturer: AUO
    Model: 4406
    Made in: 2014
  Basic Display Parameters & Features:
    Digital display
    Bits per primary color channel: 8
    DisplayPort interface
    Maximum image size: 31 cm x 17 cm
    Gamma: 2.20
    Supported color formats: RGB 4:4:4
    First detailed timing includes the native pixel format and preferred refresh rate
  Color Characteristics:
    Red  : 0.5839, 0.3330
    Green: 0.3378, 0.5712
    Blue : 0.1582, 0.1328
    White: 0.3134, 0.3291
  Established Timings I & II: none
  Standard Timings: none
  Detailed Timing Descriptors:
    DTD 1:  2560x1440   60.048 Hz  16:9    90.072 kHz 248.600 MHz (309 mm x 174 mm)
                 Hfront   40 Hsync  32 Hback 128 Hpol N
                 Vfront   10 Vsync  10 Vback  40 Vpol N
    DTD 2:  2560x1440   40.031 Hz  16:9    60.047 kHz 165.730 MHz (309 mm x 174 mm)
                 Hfront   40 Hsync  32 Hback 128 Hpol N
                 Vfront   10 Vsync  10 Vback  40 Vpol N
    Empty Descriptor
    Manufacturer-Specified Display Descriptor (0x02): 00 02 00 14 30 ff 12 3c aa 19 14 0c aa 20 20 20 '....0..<.....   '
Checksum: 0x94
