edid-decode (hex):

00 ff ff ff ff ff ff 00 30 e4 7a 07 a1 21 01 1a
00 21 01 04 a5 1b 12 78 03 f0 70 aa 50 4e a8 26
0e 4f 53 00 00 00 01 01 01 01 01 01 01 01 01 01
01 01 01 01 01 01 de 8a 40 78 b0 80 37 70 30 20
55 00 12 b7 10 00 00 1a 00 00 00 fd 00 1e 78 f0
f0 48 01 0a 20 20 20 20 20 20 00 00 00 fe 00 4c
47 44 5f 4d 50 31 2e 32 5f 0a 20 20 00 00 00 fe
00 4c 50 31 32 39 57 54 33 31 32 31 36 36 01 b6

70 20 79 02 00 20 00 19 3c e6 24 7a 07 a1 21 01
1a 00 17 0d 4c 50 31 32 39 57 54 33 31 32 31 36
36 22 00 28 c0 e9 0a 04 3f 0b 63 00 07 80 1f 00
7f 07 4f 00 41 00 07 00 ac 6c 05 04 3f 0b 77 00
2f 80 1f 00 7f 07 36 00 04 00 04 00 00 00 00 00
00 00 00 00 00 00 00 00 00 00 00 00 00 00 00 00
00 00 00 00 00 00 00 00 00 00 00 00 00 00 00 00
00 00 00 00 00 00 00 00 00 00 00 00 00 00 69 90

00 ff ff ff ff ff ff 00 30 e4 7a 07 a1 21 01 1a
00 21 01 04 a5 1b 12 78 03 f0 70 aa 50 4e a8 26
0e 4f 53 00 00 00 01 01 01 01 01 01 01 01 01 01
01 01 01 01 01 01 de 8a 40 78 b0 80 37 70 30 20
55 00 12 b7 10 00 00 1a 00 00 00 fd 00 1e 78 f0
f0 48 01 0a 20 20 20 20 20 20 00 00 00 fe 00 4c
47 44 5f 4d 50 31 2e 32 5f 0a 20 20 00 00 00 fe
00 4c 50 31 32 39 57 54 33 31 32 31 36 36 01 b6

70 20 79 02 00 20 00 19 3c e6 24 7a 07 a1 21 01
1a 00 17 0d 4c 50 31 32 39 57 54 33 31 32 31 36
36 22 00 28 c0 e9 0a 04 3f 0b 63 00 07 80 1f 00
7f 07 4f 00 41 00 07 00 ac 6c 05 04 3f 0b 77 00
2f 80 1f 00 7f 07 36 00 04 00 04 00 00 00 00 00
00 00 00 00 00 00 00 00 00 00 00 00 00 00 00 00
00 00 00 00 00 00 00 00 00 00 00 00 00 00 00 00
00 00 00 00 00 00 00 00 00 00 00 00 00 00 69 90

----------------

Block 0, Base EDID:
  EDID Structure Version & Revision: 1.4
  Vendor & Product Identification:
    Manufacturer: LGD
    Model: 1914
    Serial Number: ...
    Made in: 2023
  Basic Display Parameters & Features:
    Digital display
    Bits per primary color channel: 8
    DisplayPort interface
    Maximum image size: 27 cm x 18 cm
    Gamma: 2.20
    Supported color formats: RGB 4:4:4
    First detailed timing includes the native pixel format and preferred refresh rate
    Display is continuous frequency
  Color Characteristics:
    Red  : 0.6669, 0.3154
    Green: 0.3046, 0.6562
    Blue : 0.1494, 0.0576
    White: 0.3085, 0.3242
  Established Timings I & II: none
  Standard Timings: none
  Detailed Timing Descriptors:
    DTD 1:  2880x1920   60.000000 Hz   3:2    118.500 kHz    355.500000 MHz (274 mm x 183 mm)
                 Hfront   48 Hsync  32 Hback   40 Hpol P
                 Vfront    5 Vsync   5 Vback   45 Vpol N
    Display Range Limits:
      Monitor ranges (Bare Limits): 30-120 Hz V, 240-240 kHz H, max dotclock 720 MHz
    Alphanumeric Data String: 'LGD_MP1.2_'
    Alphanumeric Data String: 'LP129WT312166'
  Extension blocks: 1
Checksum: 0xb6

----------------

Block 1, DisplayID Extension Block:
  Version: 2.0
  Extension Count: 0
  Display Product Primary Use Case: None of the listed primary use cases; generic display
  Product Identification Data Block (0x20), OUI 3C-E6-24:
    Product Code: 1914
    Serial Number: ...
    Year of Manufacture: 2023
    Product ID: LP129WT312166
  Video Timing Modes Type 7 - Detailed Timings Data Block:
    DTD:  2880x1920  120.000168 Hz  16:9    240.000 kHz    715.201000 MHz (aspect 16:9, no 3D stereo)
               Hfront    8 Hsync  32 Hback   60 Hpol P
               Vfront   66 Vsync   8 Vback    6 Vpol N
    DTD:  2880x1920   60.000169 Hz  16:9    118.500 kHz    355.501000 MHz (aspect 16:9, no 3D stereo)
               Hfront   48 Hsync  32 Hback   40 Hpol P
               Vfront    5 Vsync   5 Vback   45 Vpol N
  Checksum: 0x69
Checksum: 0x90

----------------

Block 2, Unknown EDID Extension Block 0x00:
  00 ff ff ff ff ff ff 00 30 e4 7a 07 a1 21 01 1a '........0.z..!..'
  00 21 01 04 a5 1b 12 78 03 f0 70 aa 50 4e a8 26 '.!.....x..p.PN.&'
  0e 4f 53 00 00 00 01 01 01 01 01 01 01 01 01 01 '.OS.............'
  01 01 01 01 01 01 de 8a 40 78 b0 80 37 70 30 20 '........@x..7p0 '
  55 00 12 b7 10 00 00 1a 00 00 00 fd 00 1e 78 f0 'U.............x.'
  f0 48 01 0a 20 20 20 20 20 20 00 00 00 fe 00 4c '.H..      .....L'
  47 44 5f 4d 50 31 2e 32 5f 0a 20 20 00 00 00 fe 'GD_MP1.2_.  ....'
  00 4c 50 31 32 39 57 54 33 31 32 31 36 36 01 b6 '.LP129WT312166..'
Checksum: 0xb6

----------------

Block 3, DisplayID Extension Block:
  Version: 2.0
  Extension Count: 0
  Product Identification Data Block (0x20), OUI 3C-E6-24:
    Product Code: 1914
    Serial Number: ...
    Year of Manufacture: 2023
    Product ID: LP129WT312166
  Video Timing Modes Type 7 - Detailed Timings Data Block:
    DTD:  2880x1920  120.000168 Hz  16:9    240.000 kHz    715.201000 MHz (aspect 16:9, no 3D stereo)
               Hfront    8 Hsync  32 Hback   60 Hpol P
               Vfront   66 Vsync   8 Vback    6 Vpol N
    DTD:  2880x1920   60.000169 Hz  16:9    118.500 kHz    355.501000 MHz (aspect 16:9, no 3D stereo)
               Hfront   48 Hsync  32 Hback   40 Hpol P
               Vfront    5 Vsync   5 Vback   45 Vpol N
  Checksum: 0x69
Checksum: 0x90

----------------

Warnings:

Block 0, Base EDID:
  Missing Display Product Name.
Block 1, DisplayID Extension Block:
  Product Identification Data Block (0x20), OUI 3C-E6-24: Unknown OUI 3C-E6-24.
Block 3, DisplayID Extension Block:
  Product Identification Data Block (0x20), OUI 3C-E6-24: Unknown OUI 3C-E6-24.
EDID:
  Base EDID: Some timings are out of range of the Monitor Ranges:
    Horizontal Freq: 118.500 - 240.000 kHz (Monitor: 240.000 - 240.000 kHz)

Failures:

Block 1, DisplayID Extension Block:
  Expected 0 DisplayID Extension Block, but got 1.
Block 2, Base EDID:
  Unknown Extension Block.
Block 3, DisplayID Extension Block:
  Product Type should be 0 in extension block.
  Product Identification Data Block (0x20), OUI 3C-E6-24: Product Identification Data Block (0x20), OUI 3C-E6-24 is required to be the first DisplayID Data Block.
EDID:
  Base EDID: EDID specified 1 extension block(s), but found 3 extension block(s).
  DisplayID: Missing DisplayID Display Parameters Data Block.
  DisplayID: Missing DisplayID Display Interface Features Data Block.
  DisplayID: DisplayID expects at least one preferred timing.

EDID conformity: FAIL
