edid-decode (hex):

00 ff ff ff ff ff ff 00 30 e4 80 03 00 00 00 00
00 16 01 03 80 1d 11 78 0a 8f 15 98 5b 55 8f 27
21 50 54 00 00 00 01 01 01 01 01 01 01 01 01 01
01 01 01 01 01 01 24 27 40 c8 60 84 1c 30 30 20
35 00 26 a6 10 00 00 19 00 00 00 00 00 00 00 00
00 00 00 00 00 00 00 00 00 00 00 00 00 fe 00 4c
47 20 44 69 73 70 6c 61 79 0a 20 20 00 00 00 fe
00 4c 50 31 33 33 57 44 32 2d 53 4c 42 32 00 a2

----------------

Block 0, Base EDID:
  EDID Structure Version & Revision: 1.3
  Vendor & Product Identification:
    Manufacturer: LGD
    Model: 896
    Made in: 2012
  Basic Display Parameters & Features:
    Digital display
    Maximum image size: 29 cm x 17 cm
    Gamma: 2.20
    RGB color display
    First detailed timing is the preferred timing
  Color Characteristics:
    Red  : 0.5957, 0.3554
    Green: 0.3349, 0.5615
    Blue : 0.1523, 0.1298
    White: 0.3134, 0.3291
  Established Timings I & II: none
  Standard Timings: none
  Detailed Timing Descriptors:
    DTD 1:  1600x900    59.986 Hz  16:9    55.667 kHz 100.200 MHz (294 mm x 166 mm)
                 Hfront   48 Hsync  32 Hback 120 Hpol N
                 Vfront    3 Vsync   5 Vback  20 Vpol N
    Empty Descriptor
    Alphanumeric Data String: 'LG Display'
    Alphanumeric Data String: 'LP133WD2-SLB2'
Checksum: 0xa2

----------------

Failures:

Block 0, Base EDID:
  Empty Descriptor: Use Dummy Descriptor instead of all zeroes.
  Missing Display Product Name.
  Missing Display Range Limits Descriptor.

EDID conformity: FAIL
