edid-decode (hex):

00 ff ff ff ff ff ff 00 63 18 80 01 02 00 00 00
31 11 01 03 08 5d 35 78 e8 d9 b0 a3 57 49 9c 25
11 49 4b a1 08 00 d1 c0 01 01 01 01 01 01 01 01
01 01 01 01 01 01 94 43 80 90 72 38 28 40 80 c8
35 00 52 be 10 00 00 1c 00 00 00 ff 00 30 30 30
31 0a 20 20 20 20 20 20 20 20 00 00 00 fc 00 48
44 54 56 0a 20 20 20 20 20 20 20 20 00 00 00 fd
00 38 78 1f 5a 12 00 0a 20 20 20 20 20 20 00 94

----------------

Block 0, Base EDID:
  EDID Structure Version & Revision: 1.3
  Vendor & Product Identification:
    Manufacturer: XXX
    Model: 384
    Serial Number: ...
    Made in: week 49 of 2007
  Basic Display Parameters & Features:
    Analog display
    Input voltage level: 0.7/0.3 V
    Blank level equals black level
    Sync: Separate
    Maximum image size: 93 cm x 53 cm
    Gamma: 2.20
    DPMS levels: Standby Suspend Off
    RGB color display
  Color Characteristics:
    Red  : 0.6396, 0.3408
    Green: 0.2871, 0.6103
    Blue : 0.1464, 0.0693
    White: 0.2851, 0.2929
  Established Timings I & II:
    IBM     :   720x400    70.082 Hz   9:5    31.467 kHz  28.320 MHz
    DMT 0x04:   640x480    59.940 Hz   4:3    31.469 kHz  25.175 MHz
    DMT 0x09:   800x600    60.317 Hz   4:3    37.879 kHz  40.000 MHz
    DMT 0x10:  1024x768    60.004 Hz   4:3    48.363 kHz  65.000 MHz
  Standard Timings:
    DMT 0x52:  1920x1080   60.000 Hz  16:9    67.500 kHz 148.500 MHz
  Detailed Timing Descriptors:
    DTD 1:  1920x1080   59.963 Hz  16:9    67.158 kHz 173.000 MHz (338 mm x 190 mm)
                 Hfront  128 Hsync 200 Hback 328 Hpol N
                 Vfront    3 Vsync   5 Vback  32 Vpol P
    Display Product Serial Number: ...
    Display Product Name: 'HDTV'
  Display Range Limits:
    Monitor ranges (GTF): 56-120 Hz V, 31-90 kHz H, max dotclock 180 MHz
Checksum: 0x94

----------------

Failures:

Block 0, Base EDID:
  Basic Display Parameters & Features: EDID 1.3 requires that the first detailed timing is the preferred timing.
  Detailed Timing Descriptor #1: Mismatch of image size 338x190 mm vs display size 930x530 mm.

EDID conformity: FAIL
