edid-decode (hex):

00 ff ff ff ff ff ff 00 1e f9 7e 07 67 1c 00 00
0a 11 01 03 80 28 19 78 2a 8a a5 a4 53 4b 9d 24
14 4f 54 af cf 00 31 ca 81 80 95 00 95 0f 01 01
01 01 01 01 01 01 9a 29 a0 d0 51 84 22 30 50 98
36 00 98 ff 10 00 00 1c 00 00 00 ff 00 4d 57 54
37 33 30 37 32 37 31 0a 20 20 00 00 00 fd 00 38
4b 1f 51 0e 00 0a 20 20 20 20 20 20 00 00 00 fc
00 46 50 44 31 39 37 35 57 0a 20 20 20 20 00 85

00 ff ff ff ff ff ff 00 1e f9 7e 07 67 1c 00 00
0a 11 01 03 80 28 19 78 2a 8a a5 a4 53 4b 9d 24
14 4f 54 af cf 00 31 ca 81 80 95 00 95 0f 01 01
01 01 01 01 01 01 9a 29 a0 d0 51 84 22 30 50 98
36 00 98 ff 10 00 00 1c 00 00 00 ff 00 4d 57 54
37 33 30 37 32 37 31 0a 20 20 00 00 00 fd 00 38
4b 1f 51 0e 00 0a 20 20 20 20 20 20 00 00 00 fc
00 46 50 44 31 39 37 35 57 0a 20 20 20 20 00 85

----------------

Block 0, Base EDID:
  EDID Structure Version & Revision: 1.3
  Vendor & Product Identification:
    Manufacturer: GWY
    Model: 1918
    Serial Number: ...
    Made in: week 10 of 2007
  Basic Display Parameters & Features:
    Digital display
    Maximum image size: 40 cm x 25 cm
    Gamma: 2.20
    DPMS levels: Off
    RGB color display
    First detailed timing is the preferred timing
  Color Characteristics:
    Red  : 0.6425, 0.3242
    Green: 0.2949, 0.6152
    Blue : 0.1425, 0.0800
    White: 0.3095, 0.3291
  Established Timings I & II:
    IBM     :   720x400    70.081663 Hz   9:5     31.467 kHz     28.320000 MHz
    DMT 0x04:   640x480    59.940476 Hz   4:3     31.469 kHz     25.175000 MHz
    DMT 0x05:   640x480    72.808802 Hz   4:3     37.861 kHz     31.500000 MHz
    DMT 0x06:   640x480    75.000000 Hz   4:3     37.500 kHz     31.500000 MHz
    DMT 0x08:   800x600    56.250000 Hz   4:3     35.156 kHz     36.000000 MHz
    DMT 0x09:   800x600    60.316541 Hz   4:3     37.879 kHz     40.000000 MHz
    DMT 0x0a:   800x600    72.187572 Hz   4:3     48.077 kHz     50.000000 MHz
    DMT 0x0b:   800x600    75.000000 Hz   4:3     46.875 kHz     49.500000 MHz
    DMT 0x10:  1024x768    60.003840 Hz   4:3     48.363 kHz     65.000000 MHz
    DMT 0x11:  1024x768    70.069359 Hz   4:3     56.476 kHz     75.000000 MHz
    DMT 0x12:  1024x768    75.028582 Hz   4:3     60.023 kHz     78.750000 MHz
    DMT 0x24:  1280x1024   75.024675 Hz   5:4     79.976 kHz    135.000000 MHz
  Standard Timings:
    GTF     :   640x360    70.000000 Hz  16:9     26.250 kHz     20.580000 MHz
    DMT 0x23:  1280x1024   60.019740 Hz   5:4     63.981 kHz    108.000000 MHz
    DMT 0x2f:  1440x900    59.887445 Hz  16:10    55.935 kHz    106.500000 MHz
    DMT 0x30:  1440x900    74.984427 Hz  16:10    70.635 kHz    136.750000 MHz
  Detailed Timing Descriptors:
    DTD 1:  1440x900    59.887445 Hz  16:10    55.935 kHz    106.500000 MHz (408 mm x 255 mm)
                 Hfront   80 Hsync 152 Hback  232 Hpol N
                 Vfront    3 Vsync   6 Vback   25 Vpol P
    Display Product Serial Number: ...
    Display Range Limits:
      Monitor ranges (GTF): 56-75 Hz V, 31-81 kHz H, max dotclock 140 MHz
    Display Product Name: 'FPD1975W'
Checksum: 0x85

----------------

Block 1, Unknown EDID Extension Block 0x00:
  00 ff ff ff ff ff ff 00 1e f9 7e 07 67 1c 00 00 '..........~.g...'
  0a 11 01 03 80 28 19 78 2a 8a a5 a4 53 4b 9d 24 '.....(.x*...SK.$'
  14 4f 54 af cf 00 31 ca 81 80 95 00 95 0f 01 01 '.OT...1.........'
  01 01 01 01 01 01 9a 29 a0 d0 51 84 22 30 50 98 '.......)..Q."0P.'
  36 00 98 ff 10 00 00 1c 00 00 00 ff 00 4d 57 54 '6............MWT'
  37 33 30 37 32 37 31 0a 20 20 00 00 00 fd 00 38 '7307271.  .....8'
  4b 1f 51 0e 00 0a 20 20 20 20 20 20 00 00 00 fc 'K.Q...      ....'
  00 46 50 44 31 39 37 35 57 0a 20 20 20 20 00 85 '.FPD1975W.    ..'
Checksum: 0x85

----------------

Failures:

Block 1, Base EDID:
  Unknown Extension Block.
EDID:
  Base EDID: Some timings are out of range of the Monitor Ranges:
    Horizontal Freq: 26.250 - 79.976 kHz (Monitor: 31.000 - 81.000 kHz)
  Base EDID: EDID specified 0 extension block(s), but found 1 extension block(s).

EDID conformity: FAIL
