
EDID (hex):
00ffffffffffff0020a3290001000000
30170103807341780af330a75442aa26
0f505421080081c08140818001010101
010101010101023a801871382d40582c
450080884200001e1b2150a051001e30
48883500444a2100001c000000fc0048
444d49202020200a20202020000000fd
00324b0f450f000a2020202020200179
02032072260907071107064790050403
11141f8301000068030c003000382d00
011d8018711c1620582c2500c48e2100
009e011d007251d01e206e285500c48e
21000018011d80d0721c1620102c2580
c48e2100009e00000000000000000000
00000000000000000000000000000000
0000000000000000000000000000009b

Extracted contents:
header:          00 ff ff ff ff ff ff 00
serial number:   20 a3 29 00 01 00 00 00 30 17
version:         01 03
basic params:    80 73 41 78 0a
chroma info:     f3 30 a7 54 42 aa 26 0f 50 54
established:     21 08 00
standard:        81 c0 81 40 81 80 01 01 01 01 01 01 01 01 01 01
descriptor 1:    02 3a 80 18 71 38 2d 40 58 2c 45 00 80 88 42 00 00 1e
descriptor 2:    1b 21 50 a0 51 00 1e 30 48 88 35 00 44 4a 21 00 00 1c
descriptor 3:    00 00 00 fc 00 48 44 4d 49 20 20 20 20 0a 20 20 20 20
descriptor 4:    00 00 00 fd 00 32 4b 0f 45 0f 00 0a 20 20 20 20 20 20
extensions:      01
checksum:        79

EDID version: 1.3
Manufacturer: HEC Model 29 Serial Number --
Made in week 48 of 2013
Digital display
Maximum image size: 115 cm x 65 cm
Gamma: 2.20
RGB color display
First detailed timing is preferred timing
Display x,y Chromaticity:
  Red:   0.6552, 0.3310
  Green: 0.2578, 0.6669
  Blue:  0.1484, 0.0615
  White: 0.3125, 0.3281
Established timings supported:
  640x480@60Hz 4:3 HorFreq: 31469 Hz Clock: 25.175 MHz
  800x600@60Hz 4:3 HorFreq: 37900 Hz Clock: 40.000 MHz
  1024x768@60Hz 4:3 HorFreq: 48400 Hz Clock: 65.000 MHz
Standard timings supported:
  1280x720@60Hz 16:9
  1280x960@60Hz 4:3 HorFreq: 60000 Hz Clock: 108.000 MHz
  1280x1024@60Hz 5:4 HorFreq: 64000 Hz Clock: 108.000 MHz
Detailed mode: Clock 148.500 MHz, 1152 mm x 648 mm
               1920 2008 2052 2200 hborder 0
               1080 1084 1089 1125 vborder 0
               +hsync +vsync 
               VertFreq: 60 Hz, HorFreq: 67500 Hz
Detailed mode: Clock 84.750 MHz, 580 mm x 330 mm
               1360 1432 1568 1776 hborder 0
                768  771  776  798 vborder 0
               -hsync +vsync 
               VertFreq: 59 Hz, HorFreq: 47719 Hz
Monitor name: HDMI    
Monitor ranges (GTF): 50-75Hz V, 15-69kHz H, max dotclock 150MHz
Has 1 extension blocks
Checksum: 0x79 (valid)

CTA extension block
Extension version: 3
28 bytes of CTA data
  Audio data block
    Linear PCM, max channels 2
      Supported sample rates (kHz): 48 44.1 32
      Supported sample sizes (bits): 24 20 16
    AC-3, max channels 2
      Supported sample rates (kHz): 48 44.1 32
      Maximum bit rate: 48 kHz
  Video data block
    VIC  16 1920x1080@60Hz 16:9 (native) HorFreq: 67500 Hz Clock: 148.500 MHz
    VIC   5 1920x1080i@60Hz 16:9  HorFreq: 33750 Hz Clock: 74.250 MHz
    VIC   4 1280x720@60Hz 16:9  HorFreq: 45000 Hz Clock: 74.250 MHz
    VIC   3 720x480@60Hz 16:9  HorFreq: 31469 Hz Clock: 27.000 MHz
    VIC  17 720x576@50Hz 4:3  HorFreq: 31250 Hz Clock: 27.000 MHz
    VIC  20 1920x1080i@50Hz 16:9  HorFreq: 28125 Hz Clock: 74.250 MHz
    VIC  31 1920x1080@50Hz 16:9  HorFreq: 56250 Hz Clock: 148.500 MHz
  Speaker allocation data block
    Speaker map:
      FL/FR - Front Left/Right
  Vendor-specific data block, OUI 000c03 (HDMI)
    Source physical address 3.0.0.0
    DC_36bit
    DC_30bit
    DC_Y444
    Maximum TMDS clock: 225MHz
Basic audio support
Supports YCbCr 4:4:4
Supports YCbCr 4:2:2
2 native detailed modes
Detailed mode: Clock 74.250 MHz, 708 mm x 398 mm
               1920 2008 2052 2200 hborder 0
                540  542  547  562 vborder 0
               +hsync +vsync interlaced 
               VertFreq: 60 Hz, HorFreq: 33750 Hz
Detailed mode: Clock 74.250 MHz, 708 mm x 398 mm
               1280 1390 1430 1650 hborder 0
                720  725  730  750 vborder 0
               -hsync -vsync 
               VertFreq: 60 Hz, HorFreq: 45000 Hz
Detailed mode: Clock 74.250 MHz, 708 mm x 398 mm
               1920 2448 2492 2640 hborder 0
                540  542  547  562 vborder 0
               +hsync +vsync interlaced 
               VertFreq: 50 Hz, HorFreq: 28125 Hz
Checksum: 0x9b (valid)
