edid-decode (hex):

00 ff ff ff ff ff ff 00 20 a3 29 00 01 00 00 00
08 11 01 03 80 5d 34 78 2a 05 84 8a 5a 4d 94 28
21 50 54 25 4a 00 81 c0 61 40 01 01 01 01 01 01
01 01 01 01 81 c0 1a 36 80 a0 70 38 1f 40 30 20
35 00 a2 0b 32 00 00 1a 64 19 00 40 41 00 26 30
18 88 36 00 c4 8e 21 00 00 1e 00 00 00 fc 00 56
47 41 20 20 20 20 0a 20 20 20 20 20 00 00 00 fd
00 31 4b 0e 5b 11 00 0a 20 20 20 20 20 20 00 01

----------------

Block 0, Base EDID:
  EDID Structure Version & Revision: 1.3
  Vendor & Product Identification:
    Manufacturer: HEC
    Model: 41
    Serial Number: ...
    Made in: week 8 of 2007
  Basic Display Parameters & Features:
    Digital display
    Maximum image size: 93 cm x 52 cm
    Gamma: 2.20
    DPMS levels: Off
    RGB color display
    First detailed timing is the preferred timing
  Color Characteristics:
    Red  : 0.5390, 0.3515
    Green: 0.3017, 0.5791
    Blue : 0.1582, 0.1289
    White: 0.3134, 0.3281
  Established Timings I & II:
    DMT 0x04:   640x480    59.940476 Hz   4:3     31.469 kHz     25.175000 MHz
    DMT 0x06:   640x480    75.000000 Hz   4:3     37.500 kHz     31.500000 MHz
    DMT 0x09:   800x600    60.316541 Hz   4:3     37.879 kHz     40.000000 MHz
    DMT 0x0b:   800x600    75.000000 Hz   4:3     46.875 kHz     49.500000 MHz
    DMT 0x10:  1024x768    60.003840 Hz   4:3     48.363 kHz     65.000000 MHz
    DMT 0x12:  1024x768    75.028582 Hz   4:3     60.023 kHz     78.750000 MHz
  Standard Timings:
    DMT 0x55:  1280x720    60.000000 Hz  16:9     45.000 kHz     74.250000 MHz
    DMT 0x10:  1024x768    60.003840 Hz   4:3     48.363 kHz     65.000000 MHz
    DMT 0x55:  1280x720    60.000000 Hz  16:9     45.000 kHz     74.250000 MHz
  Detailed Timing Descriptors:
    DTD 1:  1920x1080   59.933878 Hz  16:9     66.587 kHz    138.500000 MHz (930 mm x 523 mm)
                 Hfront   48 Hsync  32 Hback   80 Hpol P
                 Vfront    3 Vsync   5 Vback   23 Vpol N
    DTD 2:  1024x768    60.003840 Hz   4:3     48.363 kHz     65.000000 MHz (708 mm x 398 mm)
                 Hfront   24 Hsync 136 Hback  160 Hpol P
                 Vfront    3 Vsync   6 Vback   29 Vpol P
    Display Product Name: 'VGA    '
    Display Range Limits:
      Monitor ranges (GTF): 49-75 Hz V, 14-91 kHz H, max dotclock 170 MHz
Checksum: 0x01

----------------

Warnings:

Block 0, Base EDID:
  Detailed Timing Descriptor #2: DTD is similar but not identical to DMT 0x10.

Failures:

Block 0, Base EDID:
  Detailed Timing Descriptor #2: Mismatch of image size 708x398 mm vs display size 930x520 mm.
  Display Product Name: One or more trailing spaces.

EDID conformity: FAIL
