edid-decode (hex):

00 ff ff ff ff ff ff 00 32 0c 01 08 00 00 00 00
00 11 01 02 80 25 17 78 0a b3 d3 97 58 56 89 27
21 50 4d 00 00 00 01 01 01 01 01 01 01 01 01 01
01 01 01 01 01 01 28 3c 80 a0 70 b0 23 40 30 20
36 00 6f e6 10 00 00 19 00 00 00 00 00 00 00 00
00 00 00 00 00 00 00 00 00 00 00 00 00 fe 00 4c
47 50 68 69 6c 69 70 73 4c 43 44 0a 00 00 fe 4c
50 31 37 31 57 55 33 2d 54 4c 41 33 0a 20 00 55

----------------

Block 0, Base EDID:
  EDID Structure Version & Revision: 1.2
  Vendor & Product Identification:
    Manufacturer: LPL
    Model: 2049
    Made in: 2007
  Basic Display Parameters & Features:
    Digital display
    Maximum image size: 37 cm x 23 cm
    Gamma: 2.20
    RGB color display
    First detailed timing is the preferred timing
  Color Characteristics:
    Red  : 0.5917, 0.3466
    Green: 0.3359, 0.5380
    Blue : 0.1552, 0.1298
    White: 0.3125, 0.3037
  Established Timings I & II: none
  Standard Timings: none
  Detailed Timing Descriptors:
    DTD 1:  1920x1200   59.950171 Hz   8:5     74.038 kHz    154.000000 MHz (367 mm x 230 mm)
                 Hfront   48 Hsync  32 Hback   80 Hpol N
                 Vfront    3 Vsync   6 Vback   26 Vpol N
    Empty Descriptor
    Alphanumeric Data String: 'LGPhilipsLCD'
    Unknown Display Descriptor (0x4c): fe 4c 50 31 37 31 57 55 33 2d 54 4c 41 33 0a 20 '.LP171WU3-TLA3. '
Checksum: 0x55

----------------

Warnings:

Block 0, Base EDID:
  EDID Structure Version & Revision: EDID 1.2 is deprecated, do not use.
  Detailed Timing Descriptor #1: DTD is similar but not identical to DMT 0x44.

Failures:

Block 0, Base EDID:
  Empty Descriptor: Use Dummy Descriptor instead of all zeroes.
  Display Descriptor #4: Monitor descriptor block has byte 2 nonzero (0xfe).
  Display Descriptor #4: Monitor descriptor block has byte 4 nonzero (0x50).
  Display Descriptor #4: Unknown Type 0x4c.

EDID conformity: FAIL
