
EDID (hex):
00ffffffffffff0022f0392901010101
1016010380331d782ad945a2554da027
125054a1080081c081809500b300d1c0
010101010101023a801871382d40582c
4500fe1f1100001e000000fd00324c18
5e11000a202020202020000000fc0048
502032333131780a20202020000000ff
0033435132313630364e4a0a2020005a

Extracted contents:
header:          00 ff ff ff ff ff ff 00
serial number:   22 f0 39 29 01 01 01 01 10 16
version:         01 03
basic params:    80 33 1d 78 2a
chroma info:     d9 45 a2 55 4d a0 27 12 50 54
established:     a1 08 00
standard:        81 c0 81 80 95 00 b3 00 d1 c0 01 01 01 01 01 01
descriptor 1:    02 3a 80 18 71 38 2d 40 58 2c 45 00 fe 1f 11 00 00 1e
descriptor 2:    00 00 00 fd 00 32 4c 18 5e 11 00 0a 20 20 20 20 20 20
descriptor 3:    00 00 00 fc 00 48 50 20 32 33 31 31 78 0a 20 20 20 20
descriptor 4:    00 00 00 ff 00 33 43 51 32 31 36 30 36 4e 4a 0a 20 20
extensions:      00
checksum:        5a

EDID version: 1.3
Manufacturer: HWP Model 2939 Serial Number --
Made in week 16 of 2012
Digital display
Maximum image size: 51 cm x 29 cm
Gamma: 2.20
DPMS levels: Off
RGB color display
First detailed timing is preferred timing
Display x,y Chromaticity:
  Red:   0.6357, 0.3330
  Green: 0.3027, 0.6259
  Blue:  0.1533, 0.0703
  White: 0.3134, 0.3291
Established timings supported:
  720x400@70Hz 9:5 HorFreq: 31469 Hz Clock: 28.320 MHz
  640x480@60Hz 4:3 HorFreq: 31469 Hz Clock: 25.175 MHz
  800x600@60Hz 4:3 HorFreq: 37900 Hz Clock: 40.000 MHz
  1024x768@60Hz 4:3 HorFreq: 48400 Hz Clock: 65.000 MHz
Standard timings supported:
  1280x720@60Hz 16:9
  1280x1024@60Hz 5:4 HorFreq: 64000 Hz Clock: 108.000 MHz
  1440x900@60Hz 16:10 HorFreq: 55500 Hz Clock: 88.750 MHz
  1680x1050@60Hz 16:10 HorFreq: 64700 Hz Clock: 119.000 MHz
  1920x1080@60Hz 16:9
Detailed mode: Clock 148.500 MHz, 510 mm x 287 mm
               1920 2008 2052 2200 hborder 0
               1080 1084 1089 1125 vborder 0
               +hsync +vsync 
               VertFreq: 60 Hz, HorFreq: 67500 Hz
Monitor ranges (GTF): 50-76Hz V, 24-94kHz H, max dotclock 170MHz
Monitor name: HP 2311x
Serial number: --
Checksum: 0x5a (valid)
