edid-decode (hex):

00 ff ff ff ff ff ff 00 22 70 39 31 00 00 00 00
2d 15 01 03 08 29 17 78 2b c9 08 a5 54 47 96 25
0d 48 4c a1 0c 00 81 c0 31 40 45 40 61 40 01 01
01 01 01 01 01 01 63 21 50 b0 51 00 1b 30 40 70
36 00 ac 08 32 00 00 1e 00 00 00 fd 00 18 55 0f
50 10 00 0a 20 20 20 20 20 20 00 00 00 fc 00 48
53 47 31 32 33 31 0a 20 20 20 20 20 00 00 00 00
00 18 55 0f 50 10 00 00 00 00 00 00 00 00 00 07

----------------

Block 0, Base EDID:
  EDID Structure Version & Revision: 1.3
  Vendor & Product Identification:
    Manufacturer: HSP
    Model: 12601
    Made in: week 45 of 2011
  Basic Display Parameters & Features:
    Analog display
    Input voltage level: 0.7/0.3 V
    Blank level equals black level
    Sync: Separate
    Maximum image size: 41 cm x 23 cm
    Gamma: 2.20
    DPMS levels: Off
    RGB color display
    First detailed timing is the preferred timing
    Supports GTF timings within operating range
  Color Characteristics:
    Red  : 0.6474, 0.3281
    Green: 0.2792, 0.5869
    Blue : 0.1445, 0.0507
    White: 0.2832, 0.2968
  Established Timings I & II:
    IBM     :   720x400    70.081663 Hz   9:5     31.467 kHz     28.320000 MHz
    DMT 0x04:   640x480    59.940476 Hz   4:3     31.469 kHz     25.175000 MHz
    DMT 0x09:   800x600    60.316541 Hz   4:3     37.879 kHz     40.000000 MHz
    DMT 0x10:  1024x768    60.003840 Hz   4:3     48.363 kHz     65.000000 MHz
    DMT 0x11:  1024x768    70.069359 Hz   4:3     56.476 kHz     75.000000 MHz
  Standard Timings:
    DMT 0x55:  1280x720    60.000000 Hz  16:9     45.000 kHz     74.250000 MHz
    DMT 0x04:   640x480    59.940476 Hz   4:3     31.469 kHz     25.175000 MHz
    DMT 0x09:   800x600    60.316541 Hz   4:3     37.879 kHz     40.000000 MHz
    DMT 0x10:  1024x768    60.003840 Hz   4:3     48.363 kHz     65.000000 MHz
  Detailed Timing Descriptors:
    DTD 1:  1360x768    59.994104 Hz  85:48    47.695 kHz     85.470000 MHz (940 mm x 520 mm)
                 Hfront   64 Hsync 112 Hback  256 Hpol P
                 Vfront    3 Vsync   6 Vback   18 Vpol P
    Display Range Limits:
      Monitor ranges (GTF): 24-85 Hz V, 15-80 kHz H, max dotclock 160 MHz
    Display Product Name: 'HSG1231'
    Manufacturer-Specified Display Descriptor (0x00): 00 00 00 18 55 0f 50 10 00 00 00 00 00 00 00 00 '....U.P.........'
Checksum: 0x07

----------------

Failures:

Block 0, Base EDID:
  Detailed Timing Descriptor #1: Mismatch of image size 940x520 mm vs display size 410x230 mm.

EDID conformity: FAIL
