edid-decode (hex):

00 ff ff ff ff ff ff 00 4d 10 50 14 00 00 00 00
24 19 01 04 a5 23 13 78 0e de 50 a3 54 4c 99 26
0f 50 54 00 00 00 01 01 01 01 01 01 01 01 01 01
01 01 01 01 01 01 4d d0 00 a0 f0 70 3e 80 30 20
35 00 5a c2 10 00 00 18 4d d0 00 a0 f0 70 68 82
30 20 35 00 00 00 00 00 00 00 00 00 00 fe 00 4b
59 39 4a 48 80 4c 51 31 35 36 44 31 00 00 00 00
00 02 01 03 23 00 11 00 00 0b 01 0a 20 20 00 54

----------------

Block 0, Base EDID:
  EDID Structure Version & Revision: 1.4
  Vendor & Product Identification:
    Manufacturer: SHP
    Model: 5200
    Made in: week 36 of 2015
  Basic Display Parameters & Features:
    Digital display
    Bits per primary color channel: 8
    DisplayPort interface
    Maximum image size: 35 cm x 19 cm
    Gamma: 2.20
    Supported color formats: RGB 4:4:4, YCrCb 4:4:4
    Default (sRGB) color space is primary color space
    First detailed timing includes the native pixel format and preferred refresh rate
  Color Characteristics:
    Red  : 0.6396, 0.3291
    Green: 0.2998, 0.5996
    Blue : 0.1494, 0.0595
    White: 0.3125, 0.3281
  Established Timings I & II: none
  Standard Timings: none
  Detailed Timing Descriptors:
    DTD 1:  3840x2160   59.996625 Hz  16:9    133.312 kHz    533.250000 MHz (346 mm x 194 mm)
                 Hfront   48 Hsync  32 Hback   80 Hpol N
                 Vfront    3 Vsync   5 Vback   54 Vpol N
    DTD 2:  3840x2160   48.023235 Hz  16:9    133.312 kHz    533.250000 MHz (analog composite, sync-on-green)
                 Hfront   48 Hsync  32 Hback   80 Hpol N
                 Vfront    3 Vsync   5 Vback  608 Vpol N
    Alphanumeric Data String: 'KY9JH'
    Manufacturer-Specified Display Descriptor (0x00): 00 00 00 02 01 03 23 00 11 00 00 0b 01 0a 20 20 '......#.......  '
Checksum: 0x54

----------------

Warnings:

Block 0, Base EDID:
  Missing Display Product Name.

Failures:

Block 0, Base EDID:
  Basic Display Parameters & Features: sRGB is signaled, but the chromaticities do not match.
  Detailed Timing Descriptor #2: Mismatch of image size vs display size: image size is not set, but display size is.
  Alphanumeric Data String: Non-printable character.

EDID conformity: FAIL
