edid-decode (hex):

00 ff ff ff ff ff ff 00 41 62 75 03 ef 1b 21 45
34 18 01 03 68 29 17 78 2a 54 a5 a5 55 51 a0 27
0f 50 54 bf ee 00 81 c0 81 00 01 01 01 01 01 01
01 01 01 01 01 01 66 21 56 aa 51 00 1e 30 46 8f
33 00 9a e6 10 00 00 1e 00 00 00 fd 00 37 4c 1e
50 09 00 0a 20 20 20 20 20 20 00 00 00 ff 00 44
32 55 45 45 30 30 32 34 32 30 32 0a 00 00 00 fc
00 56 69 73 65 6f 31 39 33 44 58 0a 20 20 00 ce

00 ff ff ff ff ff ff 00 41 62 75 03 ef 1b 21 45
34 18 01 03 68 29 17 78 2a 54 a5 a5 55 51 a0 27
0f 50 54 bf ee 00 81 c0 81 00 01 01 01 01 01 01
01 01 01 01 01 01 66 21 56 aa 51 00 1e 30 46 8f
33 00 9a e6 10 00 00 1e 00 00 00 fd 00 37 4c 1e
50 09 00 0a 20 20 20 20 20 20 00 00 00 ff 00 44
32 55 45 45 30 30 32 34 32 30 32 0a 00 00 00 fc
00 56 69 73 65 6f 31 39 33 44 58 0a 20 20 00 ce

----------------

Block 0, Base EDID:
  EDID Structure Version & Revision: 1.3
  Vendor & Product Identification:
    Manufacturer: PKB
    Model: 885
    Serial Number: ...
    Made in: week 52 of 2014
  Basic Display Parameters & Features:
    Analog display
    Signal Level Standard: 0.700 : 0.000 : 0.700 V p-p
    Blank level equals black level
    Sync: Separate
    Maximum image size: 41 cm x 23 cm
    Gamma: 2.20
    DPMS levels: Off
    RGB color display
    First detailed timing is the preferred timing
  Color Characteristics:
    Red  : 0.6455, 0.3330
    Green: 0.3173, 0.6250
    Blue : 0.1542, 0.0605
    White: 0.3134, 0.3291
  Established Timings I & II:
    IBM     :   720x400    70.081663 Hz   9:5     31.467 kHz     28.320000 MHz
    DMT 0x04:   640x480    59.940476 Hz   4:3     31.469 kHz     25.175000 MHz
    Apple   :   640x480    66.666667 Hz   4:3     35.000 kHz     30.240000 MHz
    DMT 0x05:   640x480    72.808802 Hz   4:3     37.861 kHz     31.500000 MHz
    DMT 0x06:   640x480    75.000000 Hz   4:3     37.500 kHz     31.500000 MHz
    DMT 0x08:   800x600    56.250000 Hz   4:3     35.156 kHz     36.000000 MHz
    DMT 0x09:   800x600    60.316541 Hz   4:3     37.879 kHz     40.000000 MHz
    DMT 0x0a:   800x600    72.187572 Hz   4:3     48.077 kHz     50.000000 MHz
    DMT 0x0b:   800x600    75.000000 Hz   4:3     46.875 kHz     49.500000 MHz
    Apple   :   832x624    74.551266 Hz   4:3     49.726 kHz     57.284000 MHz
    DMT 0x10:  1024x768    60.003840 Hz   4:3     48.363 kHz     65.000000 MHz
    DMT 0x11:  1024x768    70.069359 Hz   4:3     56.476 kHz     75.000000 MHz
    DMT 0x12:  1024x768    75.028582 Hz   4:3     60.023 kHz     78.750000 MHz
  Standard Timings:
    DMT 0x55:  1280x720    60.000000 Hz  16:9     45.000 kHz     74.250000 MHz
    DMT 0x1c:  1280x800    59.810326 Hz  16:10    49.702 kHz     83.500000 MHz
  Detailed Timing Descriptors:
    DTD 1:  1366x768    59.789541 Hz 683:384   47.712 kHz     85.500000 MHz (410 mm x 230 mm)
                 Hfront   70 Hsync 143 Hback  213 Hpol P
                 Vfront    3 Vsync   3 Vback   24 Vpol P
    Display Range Limits:
      Monitor ranges (GTF): 55-76 Hz V, 30-80 kHz H, max dotclock 90 MHz
    Display Product Serial Number: ...
    Display Product Name: 'Viseo193DX'
Checksum: 0xce

----------------

Block 1, Unknown EDID Extension Block 0x00:
  00 ff ff ff ff ff ff 00 41 62 75 03 ef 1b 21 45 '........Abu...!E'
  34 18 01 03 68 29 17 78 2a 54 a5 a5 55 51 a0 27 '4...h).x*T..UQ.''
  0f 50 54 bf ee 00 81 c0 81 00 01 01 01 01 01 01 '.PT.............'
  01 01 01 01 01 01 66 21 56 aa 51 00 1e 30 46 8f '......f!V.Q..0F.'
  33 00 9a e6 10 00 00 1e 00 00 00 fd 00 37 4c 1e '3............7L.'
  50 09 00 0a 20 20 20 20 20 20 00 00 00 ff 00 44 'P...      .....D'
  32 55 45 45 30 30 32 34 32 30 32 0a 00 00 00 fc '2UEE0024202.....'
  00 56 69 73 65 6f 31 39 33 44 58 0a 20 20 00 ce '.Viseo193DX.  ..'
Checksum: 0xce

----------------

Failures:

Block 1, Base EDID:
  Unknown Extension Block.
EDID:
  Base EDID: EDID specified 0 extension block(s), but found 1 extension block(s).

EDID conformity: FAIL
