edid-decode (hex):

00 ff ff ff ff ff ff 00 06 b3 c1 24 01 01 01 01
2c 1c 01 03 80 35 1e 78 ea a1 a5 a7 55 52 9f 27
12 50 54 bf ef 00 71 4f 81 80 81 40 81 c0 81 00
95 00 b3 01 d1 c0 02 3a 80 18 71 38 2d 40 58 2c
45 00 0f 28 21 00 00 1e 00 00 00 fd 00 31 4c 1e
53 11 00 0a 20 20 20 20 20 20 00 00 00 fc 00 56
41 32 34 39 0a 20 20 20 20 20 20 20 00 00 00 ff
00 4a 42 4c 4d 51 53 30 30 34 33 38 34 0a 00 f7

00 ff ff ff ff ff ff 00 06 b3 c1 24 01 01 01 01
2c 1c 01 03 80 35 1e 78 ea a1 a5 a7 55 52 9f 27
12 50 54 bf ef 00 71 4f 81 80 81 40 81 c0 81 00
95 00 b3 01 d1 c0 02 3a 80 18 71 38 2d 40 58 2c
45 00 0f 28 21 00 00 1e 00 00 00 fd 00 31 4c 1e
53 11 00 0a 20 20 20 20 20 20 00 00 00 fc 00 56
41 32 34 39 0a 20 20 20 20 20 20 20 00 00 00 ff
00 4a 42 4c 4d 51 53 30 30 34 33 38 34 0a 00 f7

----------------

Block 0, Base EDID:
  EDID Structure Version & Revision: 1.3
  Vendor & Product Identification:
    Manufacturer: AUS
    Model: 9409
    Serial Number: ...
    Made in: week 44 of 2018
  Basic Display Parameters & Features:
    Digital display
    Maximum image size: 53 cm x 30 cm
    Gamma: 2.20
    DPMS levels: Standby Suspend Off
    RGB color display
    First detailed timing is the preferred timing
  Color Characteristics:
    Red  : 0.6542, 0.3339
    Green: 0.3203, 0.6220
    Blue : 0.1542, 0.0722
    White: 0.3134, 0.3291
  Established Timings I & II:
    IBM     :   720x400    70.081663 Hz   9:5     31.467 kHz     28.320000 MHz
    DMT 0x04:   640x480    59.940476 Hz   4:3     31.469 kHz     25.175000 MHz
    Apple   :   640x480    66.666667 Hz   4:3     35.000 kHz     30.240000 MHz
    DMT 0x05:   640x480    72.808802 Hz   4:3     37.861 kHz     31.500000 MHz
    DMT 0x06:   640x480    75.000000 Hz   4:3     37.500 kHz     31.500000 MHz
    DMT 0x08:   800x600    56.250000 Hz   4:3     35.156 kHz     36.000000 MHz
    DMT 0x09:   800x600    60.316541 Hz   4:3     37.879 kHz     40.000000 MHz
    DMT 0x0a:   800x600    72.187572 Hz   4:3     48.077 kHz     50.000000 MHz
    DMT 0x0b:   800x600    75.000000 Hz   4:3     46.875 kHz     49.500000 MHz
    Apple   :   832x624    74.551266 Hz   4:3     49.726 kHz     57.284000 MHz
    DMT 0x10:  1024x768    60.003840 Hz   4:3     48.363 kHz     65.000000 MHz
    DMT 0x11:  1024x768    70.069359 Hz   4:3     56.476 kHz     75.000000 MHz
    DMT 0x12:  1024x768    75.028582 Hz   4:3     60.023 kHz     78.750000 MHz
    DMT 0x24:  1280x1024   75.024675 Hz   5:4     79.976 kHz    135.000000 MHz
  Standard Timings:
    DMT 0x15:  1152x864    75.000000 Hz   4:3     67.500 kHz    108.000000 MHz
    DMT 0x23:  1280x1024   60.019740 Hz   5:4     63.981 kHz    108.000000 MHz
    DMT 0x20:  1280x960    60.000000 Hz   4:3     60.000 kHz    108.000000 MHz
    DMT 0x55:  1280x720    60.000000 Hz  16:9     45.000 kHz     74.250000 MHz
    DMT 0x1c:  1280x800    59.810326 Hz  16:10    49.702 kHz     83.500000 MHz
    DMT 0x2f:  1440x900    59.887445 Hz  16:10    55.935 kHz    106.500000 MHz
    GTF     :  1680x1050   61.000166 Hz  16:10    66.307 kHz    149.589000 MHz
    DMT 0x52:  1920x1080   60.000000 Hz  16:9     67.500 kHz    148.500000 MHz
  Detailed Timing Descriptors:
    DTD 1:  1920x1080   60.000000 Hz  16:9     67.500 kHz    148.500000 MHz (527 mm x 296 mm)
                 Hfront   88 Hsync  44 Hback  148 Hpol P
                 Vfront    4 Vsync   5 Vback   36 Vpol P
    Display Range Limits:
      Monitor ranges (GTF): 49-76 Hz V, 30-83 kHz H, max dotclock 170 MHz
    Display Product Name: 'VA249'
    Display Product Serial Number: ...
Checksum: 0xf7

----------------

Block 1, Unknown EDID Extension Block 0x00:
  00 ff ff ff ff ff ff 00 06 b3 c1 24 01 01 01 01 '...........$....'
  2c 1c 01 03 80 35 1e 78 ea a1 a5 a7 55 52 9f 27 ',....5.x....UR.''
  12 50 54 bf ef 00 71 4f 81 80 81 40 81 c0 81 00 '.PT...qO...@....'
  95 00 b3 01 d1 c0 02 3a 80 18 71 38 2d 40 58 2c '.......:..q8-@X,'
  45 00 0f 28 21 00 00 1e 00 00 00 fd 00 31 4c 1e 'E..(!........1L.'
  53 11 00 0a 20 20 20 20 20 20 00 00 00 fc 00 56 'S...      .....V'
  41 32 34 39 0a 20 20 20 20 20 20 20 00 00 00 ff 'A249.       ....'
  00 4a 42 4c 4d 51 53 30 30 34 33 38 34 0a 00 f7 '.JBLMQS004384...'
Checksum: 0xf7

----------------

Failures:

Block 1, Base EDID:
  Unknown Extension Block.
EDID:
  Base EDID: EDID specified 0 extension block(s), but found 1 extension block(s).

EDID conformity: FAIL
