edid-decode (hex):

00 ff ff ff ff ff ff 00 0d af 16 13 00 00 00 00
08 13 01 03 80 1d 10 78 0a db 35 94 56 55 96 29
23 50 54 00 00 00 01 01 01 01 01 01 01 01 01 01
01 01 01 01 01 01 78 1d 56 c2 50 00 26 30 1f 41
4c 00 28 a6 10 00 00 18 00 00 00 fe 00 4e 31 33
34 42 36 2d 4c 30 34 0a 20 20 00 00 00 fe 00 43
4d 4f 0a 20 20 20 20 20 20 20 20 20 00 00 00 fe
00 4e 31 33 34 42 36 2d 4c 30 34 0a 20 20 00 ec

----------------

Block 0, Base EDID:
  EDID Structure Version & Revision: 1.3
  Vendor & Product Identification:
    Manufacturer: CMO
    Model: 4886
    Made in: week 8 of 2009
  Basic Display Parameters & Features:
    Digital display
    Maximum image size: 29 cm x 16 cm
    Gamma: 2.20
    RGB color display
    First detailed timing is preferred timing
  Color Characteristics:
    Red  : 0.5810, 0.3369
    Green: 0.3339, 0.5888
    Blue : 0.1601, 0.1396
    White: 0.3134, 0.3291
  Established Timings I & II: none
  Standard Timings: none
  Detailed Timing Descriptors:
    DTD 1:  1366x768    59.999 Hz 683:384  48.359 kHz  75.440 MHz (296 mm x 166 mm)
                 Hfront   31 Hsync  65 Hback  98 Hpol N
                 Vfront    4 Vsync  12 Vback  22 Vpol N
    Alphanumeric Data String: 'N134B6-L04'
    Alphanumeric Data String: 'CMO'
    Alphanumeric Data String: 'N134B6-L04'
Checksum: 0xec
