edid-decode (hex):

00 ff ff ff ff ff ff 00 22 f0 08 41 01 01 00 00
1a 14 01 00 80 2f 1b 78 0a 14 25 a3 59 55 9b 26
0f 50 54 00 00 00 01 01 01 01 01 01 01 01 01 01
01 01 01 01 01 01 20 35 80 8c 70 38 14 40 3c 3c
a8 00 d6 0e 11 00 00 18 00 00 00 fe 00 52 68 69
6e 65 0a 20 20 20 20 20 20 20 00 00 00 fc 00 48
50 20 4f 6d 6e 69 2f 50 72 6f 0a 20 00 00 00 fe
00 4c 54 4d 32 31 35 48 54 30 33 0a 20 20 00 1b

----------------

Block 0, Base EDID:
  EDID Structure Version & Revision: 1.0
  Vendor & Product Identification:
    Manufacturer: HWP
    Model: 16648
    Serial Number: ...
    Made in: week 26 of 2010
  Basic Display Parameters & Features:
    Digital display
    Maximum image size: 47 cm x 27 cm
    Gamma: 2.20
    RGB color display
    First detailed timing is the preferred timing
  Color Characteristics:
    Red  : 0.6367, 0.3486
    Green: 0.3330, 0.6054
    Blue : 0.1484, 0.0605
    White: 0.3134, 0.3291
  Established Timings I & II: none
  Standard Timings: none
  Detailed Timing Descriptors:
    DTD 1:  1920x1080   60.018 Hz  16:9    66.019 kHz 136.000 MHz (470 mm x 270 mm)
                 Hfront   60 Hsync  60 Hback  20 Hpol N
                 Vfront   10 Vsync   8 Vback   2 Vpol N
    Alphanumeric Data String: 'Rhine'
    Display Product Name: 'HP Omni/Pro'
    Alphanumeric Data String: 'LTM215HT03'
Checksum: 0x1b

----------------

Warnings:

Block 0, Base EDID:
  EDID Structure Version & Revision: EDID 1.0 is deprecated, do not use.

Failures:

Block 0, Base EDID:
  Display Descriptor #2: Has descriptor blocks other than detailed timings.
  Display Descriptor #3: Has descriptor blocks other than detailed timings.
  Display Descriptor #4: Has descriptor blocks other than detailed timings.

EDID conformity: FAIL
