
EDID (hex):
00ffffffffffff0009d1d8760a2f0000
141101036c281978eac4f6a3574a9c23
114f54bdef80714f8180818c950f8190
0101010101019a29a0d0518422305098
430098ff1000001ad50980a0205e6310
1060520898ff1000001a000000fd0038
4c1e530e000a202020202020000000fc
0042656e512046503932570a20200099

Extracted contents:
header:          00 ff ff ff ff ff ff 00
serial number:   09 d1 d8 76 0a 2f 00 00 14 11
version:         01 03
basic params:    6c 28 19 78 ea
chroma info:     c4 f6 a3 57 4a 9c 23 11 4f 54
established:     bd ef 80
standard:        71 4f 81 80 81 8c 95 0f 81 90 01 01 01 01 01 01
descriptor 1:    9a 29 a0 d0 51 84 22 30 50 98 43 00 98 ff 10 00 00 1a
descriptor 2:    d5 09 80 a0 20 5e 63 10 10 60 52 08 98 ff 10 00 00 1a
descriptor 3:    00 00 00 fd 00 38 4c 1e 53 0e 00 0a 20 20 20 20 20 20
descriptor 4:    00 00 00 fc 00 42 65 6e 51 20 46 50 39 32 57 0a 20 20
extensions:      00
checksum:        99

EDID version: 1.3
Manufacturer: BNQ Model 76d8 Serial Number --
Made in week 20 of 2007
Analog display, Input voltage level: 0.7/0.7 V
Sync: Separate Composite 
Maximum image size: 40 cm x 25 cm
Gamma: 2.20
DPMS levels: Standby Suspend Off
RGB color display
First detailed timing is preferred timing
Display x,y Chromaticity:
  Red:   0.6396, 0.3398
  Green: 0.2900, 0.6093
  Blue:  0.1396, 0.0693
  White: 0.3095, 0.3300
Established timings supported:
  720x400@70Hz 9:5 HorFreq: 31469 Hz Clock: 28.320 MHz
  640x480@60Hz 4:3 HorFreq: 31469 Hz Clock: 25.175 MHz
  640x480@67Hz 4:3 HorFreq: 35000 Hz Clock: 30.240 MHz
  640x480@72Hz 4:3 HorFreq: 37900 Hz Clock: 31.500 MHz
  640x480@75Hz 4:3 HorFreq: 37500 Hz Clock: 31.500 MHz
  800x600@60Hz 4:3 HorFreq: 37900 Hz Clock: 40.000 MHz
  800x600@72Hz 4:3 HorFreq: 48100 Hz Clock: 50.000 MHz
  800x600@75Hz 4:3 HorFreq: 46900 Hz Clock: 49.500 MHz
  832x624@75Hz 4:3 HorFreq: 49726 Hz Clock: 57.284 MHz
  1024x768@60Hz 4:3 HorFreq: 48400 Hz Clock: 65.000 MHz
  1024x768@70Hz 4:3 HorFreq: 56500 Hz Clock: 75.000 MHz
  1024x768@75Hz 4:3 HorFreq: 60000 Hz Clock: 78.750 MHz
  1280x1024@75Hz 5:4 HorFreq: 80000 Hz Clock: 135.000 MHz
  1152x870@75Hz 192:145 HorFreq: 67500 Hz Clock: 108.000 MHz
Standard timings supported:
  1152x864@75Hz 4:3 HorFreq: 67500 Hz Clock: 108.000 MHz
  1280x1024@60Hz 5:4 HorFreq: 64000 Hz Clock: 108.000 MHz
  1280x1024@72Hz 5:4
  1440x900@75Hz 16:10 HorFreq: 82300 Hz Clock: 156.000 MHz
  1280x1024@76Hz 5:4
Detailed mode: Clock 106.500 MHz, 408 mm x 255 mm
               1440 1520 1672 1904 hborder 0
                900  904  907  934 vborder 0
               +hsync -vsync 
               VertFreq: 59 Hz, HorFreq: 55934 Hz
Detailed mode: Clock 25.170 MHz, 408 mm x 255 mm
                640  656  752  800 hborder 0
                350  387  389  449 vborder 0
               +hsync -vsync 
               VertFreq: 70 Hz, HorFreq: 31462 Hz
Monitor ranges (GTF): 56-76Hz V, 30-83kHz H, max dotclock 140MHz
Monitor name: BenQ FP92W
Checksum: 0x99 (valid)
One or more of the timings is out of range of the Monitor Ranges:
  Vertical Freq: 59 - 76 Hz
  Horizontal Freq: 31462 - 82300 Hz
  Maximum Clock: 156.000 MHz
