edid-decode (hex):

00 ff ff ff ff ff ff 00 22 0e 50 36 00 00 00 00
0c 1e 01 04 a5 35 1e 78 3a 9a c5 a3 5b 4d a1 25
0d 50 54 a1 08 00 d1 c0 a9 c0 81 c0 b3 00 95 00
81 00 81 80 01 01 02 3a 80 18 71 38 2d 40 58 2c
45 00 0f 28 21 00 00 1e 00 00 00 fd 00 32 3c 1e
50 11 01 0a 20 20 20 20 20 20 00 00 00 fc 00 48
50 20 45 32 34 64 20 47 34 0a 20 20 00 00 00 ff
00 33 43 51 30 31 32 30 33 54 46 0a 20 20 01 7f

00 ff ff ff ff ff ff 00 22 0e 50 36 00 00 00 00
0c 1e 01 04 a5 35 1e 78 3a 9a c5 a3 5b 4d a1 25
0d 50 54 a1 08 00 d1 c0 a9 c0 81 c0 b3 00 95 00
81 00 81 80 01 01 02 3a 80 18 71 38 2d 40 58 2c
45 00 0f 28 21 00 00 1e 00 00 00 fd 00 32 3c 1e
50 11 01 0a 20 20 20 20 20 20 00 00 00 fc 00 48
50 20 45 32 34 64 20 47 34 0a 20 20 00 00 00 ff
00 33 43 51 30 31 32 30 33 54 46 0a 20 20 01 7f

00 ff ff ff ff ff ff 00 22 0e 50 36 00 00 00 00
0c 1e 01 04 a5 35 1e 78 3a 9a c5 a3 5b 4d a1 25
0d 50 54 a1 08 00 d1 c0 a9 c0 81 c0 b3 00 95 00
81 00 81 80 01 01 02 3a 80 18 71 38 2d 40 58 2c
45 00 0f 28 21 00 00 1e 00 00 00 fd 00 32 3c 1e
50 11 01 0a 20 20 20 20 20 20 00 00 00 fc 00 48
50 20 45 32 34 64 20 47 34 0a 20 20 00 00 00 ff
00 33 43 51 30 31 32 30 33 54 46 0a 20 20 01 7f

00 ff ff ff ff ff ff 00 22 0e 50 36 00 00 00 00
0c 1e 01 04 a5 35 1e 78 3a 9a c5 a3 5b 4d a1 25
0d 50 54 a1 08 00 d1 c0 a9 c0 81 c0 b3 00 95 00
81 00 81 80 01 01 02 3a 80 18 71 38 2d 40 58 2c
45 00 0f 28 21 00 00 1e 00 00 00 fd 00 32 3c 1e
50 11 01 0a 20 20 20 20 20 20 00 00 00 fc 00 48
50 20 45 32 34 64 20 47 34 0a 20 20 00 00 00 ff
00 33 43 51 30 31 32 30 33 54 46 0a 20 20 01 7f

----------------

Block 0, Base EDID:
  EDID Structure Version & Revision: 1.4
  Vendor & Product Identification:
    Manufacturer: HPN
    Model: 13904
    Made in: week 12 of 2020
  Basic Display Parameters & Features:
    Digital display
    Bits per primary color channel: 8
    DisplayPort interface
    Maximum image size: 53 cm x 30 cm
    Gamma: 2.20
    DPMS levels: Off
    Supported color formats: RGB 4:4:4, YCrCb 4:4:4, YCrCb 4:2:2
    First detailed timing includes the native pixel format and preferred refresh rate
  Color Characteristics:
    Red  : 0.6386, 0.3564
    Green: 0.3027, 0.6308
    Blue : 0.1474, 0.0507
    White: 0.3134, 0.3291
  Established Timings I & II:
    IBM     :   720x400    70.081663 Hz   9:5     31.467 kHz     28.320000 MHz
    DMT 0x04:   640x480    59.940476 Hz   4:3     31.469 kHz     25.175000 MHz
    DMT 0x09:   800x600    60.316541 Hz   4:3     37.879 kHz     40.000000 MHz
    DMT 0x10:  1024x768    60.003840 Hz   4:3     48.363 kHz     65.000000 MHz
  Standard Timings:
    DMT 0x52:  1920x1080   60.000000 Hz  16:9     67.500 kHz    148.500000 MHz
    DMT 0x53:  1600x900    60.000000 Hz  16:9     60.000 kHz    108.000000 MHz (RB)
    DMT 0x55:  1280x720    60.000000 Hz  16:9     45.000 kHz     74.250000 MHz
    DMT 0x3a:  1680x1050   59.954250 Hz  16:10    65.290 kHz    146.250000 MHz
    DMT 0x2f:  1440x900    59.887445 Hz  16:10    55.935 kHz    106.500000 MHz
    DMT 0x1c:  1280x800    59.810326 Hz  16:10    49.702 kHz     83.500000 MHz
    DMT 0x23:  1280x1024   60.019740 Hz   5:4     63.981 kHz    108.000000 MHz
  Detailed Timing Descriptors:
    DTD 1:  1920x1080   60.000000 Hz  16:9     67.500 kHz    148.500000 MHz (527 mm x 296 mm)
                 Hfront   88 Hsync  44 Hback  148 Hpol P
                 Vfront    4 Vsync   5 Vback   36 Vpol P
    Display Range Limits:
      Monitor ranges (Bare Limits): 50-60 Hz V, 30-80 kHz H, max dotclock 170 MHz
    Display Product Name: 'HP E24d G4'
    Display Product Serial Number: ...
  Extension blocks: 1
Checksum: 0x7f

----------------

Block 1, Unknown EDID Extension Block 0x00:
  00 ff ff ff ff ff ff 00 22 0e 50 36 00 00 00 00 '........".P6....'
  0c 1e 01 04 a5 35 1e 78 3a 9a c5 a3 5b 4d a1 25 '.....5.x:...[M.%'
  0d 50 54 a1 08 00 d1 c0 a9 c0 81 c0 b3 00 95 00 '.PT.............'
  81 00 81 80 01 01 02 3a 80 18 71 38 2d 40 58 2c '.......:..q8-@X,'
  45 00 0f 28 21 00 00 1e 00 00 00 fd 00 32 3c 1e 'E..(!........2<.'
  50 11 01 0a 20 20 20 20 20 20 00 00 00 fc 00 48 'P...      .....H'
  50 20 45 32 34 64 20 47 34 0a 20 20 00 00 00 ff 'P E24d G4.  ....'
  00 33 43 51 30 31 32 30 33 54 46 0a 20 20 01 7f '.3CQ01203TF.  ..'
Checksum: 0x7f

----------------

Block 2, Unknown EDID Extension Block 0x00:
  00 ff ff ff ff ff ff 00 22 0e 50 36 00 00 00 00 '........".P6....'
  0c 1e 01 04 a5 35 1e 78 3a 9a c5 a3 5b 4d a1 25 '.....5.x:...[M.%'
  0d 50 54 a1 08 00 d1 c0 a9 c0 81 c0 b3 00 95 00 '.PT.............'
  81 00 81 80 01 01 02 3a 80 18 71 38 2d 40 58 2c '.......:..q8-@X,'
  45 00 0f 28 21 00 00 1e 00 00 00 fd 00 32 3c 1e 'E..(!........2<.'
  50 11 01 0a 20 20 20 20 20 20 00 00 00 fc 00 48 'P...      .....H'
  50 20 45 32 34 64 20 47 34 0a 20 20 00 00 00 ff 'P E24d G4.  ....'
  00 33 43 51 30 31 32 30 33 54 46 0a 20 20 01 7f '.3CQ01203TF.  ..'
Checksum: 0x7f

----------------

Block 3, Unknown EDID Extension Block 0x00:
  00 ff ff ff ff ff ff 00 22 0e 50 36 00 00 00 00 '........".P6....'
  0c 1e 01 04 a5 35 1e 78 3a 9a c5 a3 5b 4d a1 25 '.....5.x:...[M.%'
  0d 50 54 a1 08 00 d1 c0 a9 c0 81 c0 b3 00 95 00 '.PT.............'
  81 00 81 80 01 01 02 3a 80 18 71 38 2d 40 58 2c '.......:..q8-@X,'
  45 00 0f 28 21 00 00 1e 00 00 00 fd 00 32 3c 1e 'E..(!........2<.'
  50 11 01 0a 20 20 20 20 20 20 00 00 00 fc 00 48 'P...      .....H'
  50 20 45 32 34 64 20 47 34 0a 20 20 00 00 00 ff 'P E24d G4.  ....'
  00 33 43 51 30 31 32 30 33 54 46 0a 20 20 01 7f '.3CQ01203TF.  ..'
Checksum: 0x7f

----------------

Warnings:

EDID:
  Base EDID: Some timings are out of range of the Monitor Ranges:
    Vertical Freq: 59.810 - 70.082 Hz (Monitor: 50.000 - 60.000 Hz)

Failures:

Block 1, Base EDID:
  Unknown Extension Block.
Block 2, Base EDID:
  Unknown Extension Block.
Block 3, Base EDID:
  Unknown Extension Block.
EDID:
  Base EDID: EDID specified 1 extension block(s), but found 3 extension block(s).

EDID conformity: FAIL
