edid-decode (hex):

00 ff ff ff ff ff ff 00 4d d9 a0 0a 01 01 01 01
06 0d 01 03 80 29 1f 78 ea 4e 99 a1 57 4c 94 26
1c 48 4c a1 08 00 a9 40 81 80 81 40 01 01 01 01
01 01 01 01 01 01 48 3f 40 30 62 b0 32 40 40 c0
13 00 98 32 11 00 00 1e 00 00 00 fd 00 37 41 1e
5c 11 00 0a 20 20 20 20 20 20 00 00 00 fc 00 53
44 4d 2d 58 32 30 32 0a 20 20 20 20 00 00 00 ff
00 37 37 30 31 35 34 35 0a 20 20 20 20 20 00 14

----------------

Block 0, Base EDID:
  EDID Structure Version & Revision: 1.3
  Vendor & Product Identification:
    Manufacturer: SNY
    Model: 2720
    Serial Number: ...
    Made in: week 6 of 2003
  Basic Display Parameters & Features:
    Digital display
    Maximum image size: 41 cm x 31 cm
    Gamma: 2.20
    DPMS levels: Standby Suspend Off
    RGB color display
    First detailed timing is the preferred timing
  Color Characteristics:
    Red  : 0.6298, 0.3398
    Green: 0.2998, 0.5800
    Blue : 0.1503, 0.1103
    White: 0.2832, 0.2978
  Established Timings I & II:
    IBM     :   720x400    70.081663 Hz   9:5     31.467 kHz     28.320000 MHz
    DMT 0x04:   640x480    59.940476 Hz   4:3     31.469 kHz     25.175000 MHz
    DMT 0x09:   800x600    60.316541 Hz   4:3     37.879 kHz     40.000000 MHz
    DMT 0x10:  1024x768    60.003840 Hz   4:3     48.363 kHz     65.000000 MHz
  Standard Timings:
    DMT 0x33:  1600x1200   60.000000 Hz   4:3     75.000 kHz    162.000000 MHz
    DMT 0x23:  1280x1024   60.019740 Hz   5:4     63.981 kHz    108.000000 MHz
    DMT 0x20:  1280x960    60.000000 Hz   4:3     60.000 kHz    108.000000 MHz
  Detailed Timing Descriptors:
    DTD 1:  1600x1200   60.000000 Hz   4:3     75.000 kHz    162.000000 MHz (408 mm x 306 mm)
                 Hfront   64 Hsync 192 Hback  304 Hpol P
                 Vfront    1 Vsync   3 Vback   46 Vpol P
    Display Range Limits:
      Monitor ranges (GTF): 55-65 Hz V, 30-92 kHz H, max dotclock 170 MHz
    Display Product Name: 'SDM-X202'
    Display Product Serial Number: ...
Checksum: 0x14

----------------

Failures:

EDID:
  Base EDID: Some timings are out of range of the Monitor Ranges:
    Vertical Freq: 59.940 - 70.082 Hz (Monitor: 55.000 - 65.000 Hz)

EDID conformity: FAIL
