edid-decode (hex):

00 ff ff ff ff ff ff 00 30 e4 7e 03 00 00 00 00
00 15 01 03 80 23 13 78 0a 25 b5 a1 59 59 9d 27
1c 50 54 00 00 00 01 01 01 01 01 01 01 01 01 01
01 01 01 01 01 01 34 3a 80 20 71 38 2c 40 30 48
35 00 59 c2 10 00 00 19 00 00 00 00 00 00 00 00
00 00 00 00 00 00 00 00 00 00 00 00 00 fe 00 4c
47 20 44 69 73 70 6c 61 79 0a 20 20 00 00 00 fe
00 4c 50 31 35 36 57 46 34 2d 53 4c 42 35 00 30

----------------

Block 0, Base EDID:
  EDID Structure Version & Revision: 1.3
  Vendor & Product Identification:
    Manufacturer: LGD
    Model: 894
    Made in: 2011
  Basic Display Parameters & Features:
    Digital display
    Maximum image size: 35 cm x 19 cm
    Gamma: 2.20
    RGB color display
    First detailed timing is the preferred timing
  Color Characteristics:
    Red  : 0.6289, 0.3496
    Green: 0.3486, 0.6142
    Blue : 0.1542, 0.1123
    White: 0.3134, 0.3291
  Established Timings I & II: none
  Standard Timings: none
  Detailed Timing Descriptors:
    DTD 1:  1920x1080   60.037 Hz  16:9    67.482 kHz 149.000 MHz (345 mm x 194 mm)
                 Hfront   48 Hsync  72 Hback 168 Hpol N
                 Vfront    3 Vsync   5 Vback  36 Vpol N
    Empty Descriptor
    Alphanumeric Data String: 'LG Display'
    Alphanumeric Data String: 'LP156WF4-SLB5'
Checksum: 0x30

----------------

Failures:

Block 0, Base EDID:
  Empty Descriptor: Use Dummy Descriptor instead of all zeroes.
  Missing Display Product Name.
  Missing Display Range Limits Descriptor.

EDID conformity: FAIL
