
EDID (hex):
00ffffffffffff0009e5250000000000
01160104951f117802b0909758549226
1d505400000001010101010101010101
010101010101662156aa51001e30468f
330035ad1000001a662156aa51001e30
468f330035ad1000001a000000fe0048
494d2041580a202020202020000000fe
7048423134305758312d3530310a007f

Extracted contents:
header:          00 ff ff ff ff ff ff 00
serial number:   09 e5 25 00 00 00 00 00 01 16
version:         01 04
basic params:    95 1f 11 78 02
chroma info:     b0 90 97 58 54 92 26 1d 50 54
established:     00 00 00
standard:        01 01 01 01 01 01 01 01 01 01 01 01 01 01 01 01
descriptor 1:    66 21 56 aa 51 00 1e 30 46 8f 33 00 35 ad 10 00 00 1a
descriptor 2:    66 21 56 aa 51 00 1e 30 46 8f 33 00 35 ad 10 00 00 1a
descriptor 3:    00 00 00 fe 00 48 49 4d 20 41 58 0a 20 20 20 20 20 20
descriptor 4:    00 00 00 fe 70 48 42 31 34 30 57 58 31 2d 35 30 31 0a
extensions:      00
checksum:        7f

EDID version: 1.4
Manufacturer: BOE Model 25 Serial Number --
Made in week 1 of 2012
Digital display
6 bits per primary color channel
DisplayPort interface
Maximum image size: 31 cm x 17 cm
Gamma: 2.20
Supported color formats: RGB 4:4:4
First detailed timing includes the native pixel format and preferred refresh rate
Display x,y Chromaticity:
  Red:   0.5917, 0.3466
  Green: 0.3281, 0.5703
  Blue:  0.1503, 0.1142
  White: 0.3125, 0.3281
Established timings supported:
Standard timings supported:
Detailed mode: Clock 85.500 MHz, 309 mm x 173 mm
               1366 1436 1579 1792 hborder 0
                768  771  774  798 vborder 0
               +hsync -vsync 
               VertFreq: 59 Hz, HorFreq: 47712 Hz
Detailed mode: Clock 85.500 MHz, 309 mm x 173 mm
               1366 1436 1579 1792 hborder 0
                768  771  774  798 vborder 0
               +hsync -vsync 
               VertFreq: 59 Hz, HorFreq: 47712 Hz
ASCII string: HIM AX
Monitor descriptor block has byte 4 nonzero (0x70)
ASCII string: HB140WX1-501
Checksum: 0x7f (valid)
EDID block does NOT conform to EDID 1.4!
	Missing name descriptor
	Missing monitor ranges
	Invalid descriptor block padding
