edid-decode (hex):

00 ff ff ff ff ff ff 00 34 38 17 0c cb 0f 03 00
30 0c 01 03 0c 20 18 7d e8 c0 98 9f 57 48 98 26
10 48 4c a4 43 00 31 59 45 59 61 59 01 01 01 01
01 01 01 01 01 01 f9 15 20 f8 30 58 1f 20 20 40
13 00 32 e6 10 00 00 1e ea 24 00 60 41 00 28 30
30 60 13 00 32 e6 10 00 00 1e bc 34 00 98 51 00
2a 40 10 90 13 00 32 e6 10 00 00 1e 00 00 00 fd
00 32 a0 1e 55 0f 00 0a 20 20 20 20 20 20 00 f9

----------------

Block 0, Base EDID:
  EDID Structure Version & Revision: 1.3
  Vendor & Product Identification:
    Manufacturer: MAX
    Model: 3095
    Serial Number: ...
    Made in: week 48 of 2002
  Basic Display Parameters & Features:
    Analog display
    Signal Level Standard: 0.700 : 0.300 : 1.000 V p-p
    Blank level equals black level
    Sync: Separate Composite
    Maximum image size: 32 cm x 24 cm
    Gamma: 2.25
    DPMS levels: Standby Suspend Off
    RGB color display
  Color Characteristics:
    Red  : 0.6240, 0.3398
    Green: 0.2812, 0.5937
    Blue : 0.1503, 0.0634
    White: 0.2832, 0.2968
  Established Timings I & II:
    IBM     :   720x400    70.081663 Hz   9:5     31.467 kHz     28.320000 MHz
    DMT 0x04:   640x480    59.940476 Hz   4:3     31.469 kHz     25.175000 MHz
    DMT 0x06:   640x480    75.000000 Hz   4:3     37.500 kHz     31.500000 MHz
    DMT 0x0b:   800x600    75.000000 Hz   4:3     46.875 kHz     49.500000 MHz
    DMT 0x12:  1024x768    75.028582 Hz   4:3     60.023 kHz     78.750000 MHz
    DMT 0x24:  1280x1024   75.024675 Hz   5:4     79.976 kHz    135.000000 MHz
  Standard Timings:
    DMT 0x07:   640x480    85.008312 Hz   4:3     43.269 kHz     36.000000 MHz
    DMT 0x0c:   800x600    85.061274 Hz   4:3     53.674 kHz     56.250000 MHz
    DMT 0x13:  1024x768    84.996690 Hz   4:3     68.677 kHz     94.500000 MHz
  Detailed Timing Descriptors:
    DTD 1:   800x600    85.061274 Hz   4:3     53.674 kHz     56.250000 MHz (306 mm x 230 mm)
                 Hfront   32 Hsync  64 Hback  152 Hpol P
                 Vfront    1 Vsync   3 Vback   27 Vpol P
    DTD 2:  1024x768    84.996690 Hz   4:3     68.677 kHz     94.500000 MHz (306 mm x 230 mm)
                 Hfront   48 Hsync  96 Hback  208 Hpol P
                 Vfront    1 Vsync   3 Vback   36 Vpol P
    DTD 3:  1280x1024   75.024675 Hz   5:4     79.976 kHz    135.000000 MHz (306 mm x 230 mm)
                 Hfront   16 Hsync 144 Hback  248 Hpol P
                 Vfront    1 Vsync   3 Vback   38 Vpol P
    Display Range Limits:
      Monitor ranges (GTF): 50-160 Hz V, 30-85 kHz H, max dotclock 150 MHz
Checksum: 0xf9

----------------

Failures:

Block 0, Base EDID:
  Basic Display Parameters & Features: EDID 1.3 requires that the first detailed timing is the preferred timing.
  Detailed Timing Descriptor #1: Mismatch of image size 306x230 mm vs display size 320x240 mm.
  Detailed Timing Descriptor #2: Mismatch of image size 306x230 mm vs display size 320x240 mm.
  Detailed Timing Descriptor #3: Mismatch of image size 306x230 mm vs display size 320x240 mm.
  Missing Display Product Name.

EDID conformity: FAIL
