
EDID (hex):
00ffffffffffff002267000000000000
221901030e3420782a3581a656489a24
125054afcf008100814081809500a940
b30001010101023a801871382d40582c
4500dd0c1100001e792e401062842030
70981300bbf91000001c000000fd0038
4b1e5f12000a202020202020000000fc
0048533234354850420a202020200074

Extracted contents:
header:          00 ff ff ff ff ff ff 00
serial number:   22 67 00 00 00 00 00 00 22 19
version:         01 03
basic params:    0e 34 20 78 2a
chroma info:     35 81 a6 56 48 9a 24 12 50 54
established:     af cf 00
standard:        81 00 81 40 81 80 95 00 a9 40 b3 00 01 01 01 01
descriptor 1:    02 3a 80 18 71 38 2d 40 58 2c 45 00 dd 0c 11 00 00 1e
descriptor 2:    79 2e 40 10 62 84 20 30 70 98 13 00 bb f9 10 00 00 1c
descriptor 3:    00 00 00 fd 00 38 4b 1e 5f 12 00 0a 20 20 20 20 20 20
descriptor 4:    00 00 00 fc 00 48 53 32 34 35 48 50 42 0a 20 20 20 20
extensions:      00
checksum:        74

EDID version: 1.3
Manufacturer: HSG Model 0 Serial Number --
Made in week 34 of 2015
Analog display, Input voltage level: 0.7/0.3 V
Sync: Separate Composite SyncOnGreen 
Maximum image size: 52 cm x 32 cm
Gamma: 2.20
DPMS levels: Off
RGB color display
First detailed timing is preferred timing
Display x,y Chromaticity:
  Red:   0.6484, 0.3388
  Green: 0.2822, 0.6025
  Blue:  0.1425, 0.0703
  White: 0.3125, 0.3291
Established timings supported:
  720x400@70Hz 9:5 HorFreq: 31469 Hz Clock: 28.320 MHz
  640x480@60Hz 4:3 HorFreq: 31469 Hz Clock: 25.175 MHz
  640x480@72Hz 4:3 HorFreq: 37900 Hz Clock: 31.500 MHz
  640x480@75Hz 4:3 HorFreq: 37500 Hz Clock: 31.500 MHz
  800x600@56Hz 4:3 HorFreq: 35200 Hz Clock: 36.000 MHz
  800x600@60Hz 4:3 HorFreq: 37900 Hz Clock: 40.000 MHz
  800x600@72Hz 4:3 HorFreq: 48100 Hz Clock: 50.000 MHz
  800x600@75Hz 4:3 HorFreq: 46900 Hz Clock: 49.500 MHz
  1024x768@60Hz 4:3 HorFreq: 48400 Hz Clock: 65.000 MHz
  1024x768@70Hz 4:3 HorFreq: 56500 Hz Clock: 75.000 MHz
  1024x768@75Hz 4:3 HorFreq: 60000 Hz Clock: 78.750 MHz
  1280x1024@75Hz 5:4 HorFreq: 80000 Hz Clock: 135.000 MHz
Standard timings supported:
  1280x800@60Hz 16:10
  1280x960@60Hz 4:3 HorFreq: 60000 Hz Clock: 108.000 MHz
  1280x1024@60Hz 5:4 HorFreq: 64000 Hz Clock: 108.000 MHz
  1440x900@60Hz 16:10 HorFreq: 55500 Hz Clock: 88.750 MHz
  1600x1200@60Hz 4:3 HorFreq: 75000 Hz Clock: 162.000 MHz
  1680x1050@60Hz 16:10 HorFreq: 64700 Hz Clock: 119.000 MHz
Detailed mode: Clock 148.500 MHz, 477 mm x 268 mm
               1920 2008 2052 2200 hborder 0
               1080 1084 1089 1125 vborder 0
               +hsync +vsync 
               VertFreq: 60 Hz, HorFreq: 67500 Hz
Detailed mode: Clock 118.970 MHz, 443 mm x 249 mm
               1600 1712 1864 2128 hborder 0
                900  901  904  932 vborder 0
               -hsync +vsync 
               VertFreq: 59 Hz, HorFreq: 55906 Hz
Monitor ranges (GTF): 56-75Hz V, 30-95kHz H, max dotclock 180MHz
Monitor name: HS245HPB
Checksum: 0x74 (valid)
