
EDID (hex):
00ffffffffffff00593a210001010101
0a1201033f462778eaf77ba0574a9c25
0f474aa5ca0081800101010101010101
010101010101662156b051001b308082
2600bc862100001a000000fd0032551f
460b000a202020202020000000ff0053
504142454a31303837353732000000fc
00565833324c2048445456313041008d

Extracted contents:
header:          00 ff ff ff ff ff ff 00
serial number:   59 3a 21 00 01 01 01 01 0a 12
version:         01 03
basic params:    3f 46 27 78 ea
chroma info:     f7 7b a0 57 4a 9c 25 0f 47 4a
established:     a5 ca 00
standard:        81 80 01 01 01 01 01 01 01 01 01 01 01 01 01 01
descriptor 1:    66 21 56 b0 51 00 1b 30 80 82 26 00 bc 86 21 00 00 1a
descriptor 2:    00 00 00 fd 00 32 55 1f 46 0b 00 0a 20 20 20 20 20 20
descriptor 3:    00 00 00 ff 00 53 50 41 42 45 4a 31 30 38 37 35 37 32
descriptor 4:    00 00 00 fc 00 56 58 33 32 4c 20 48 44 54 56 31 30 41
extensions:      00
checksum:        8d

EDID version: 1.3
Manufacturer: VIZ Model 21 Serial Number --
Made in week 10 of 2008
Analog display, Input voltage level: 0.714/0.286 V
Configurable signal levels
Sync: Separate Composite SyncOnGreen Serration 
Maximum image size: 70 cm x 39 cm
Gamma: 2.20
DPMS levels: Standby Suspend Off
RGB color display
First detailed timing is preferred timing
Display x,y Chromaticity:
  Red:   0.6279, 0.3427
  Green: 0.2900, 0.6123
  Blue:  0.1455, 0.0615
  White: 0.2792, 0.2919
Established timings supported:
  720x400@70Hz 9:5 HorFreq: 31469 Hz Clock: 28.320 MHz
  640x480@60Hz 4:3 HorFreq: 31469 Hz Clock: 25.175 MHz
  640x480@75Hz 4:3 HorFreq: 37500 Hz Clock: 31.500 MHz
  800x600@60Hz 4:3 HorFreq: 37900 Hz Clock: 40.000 MHz
  800x600@72Hz 4:3 HorFreq: 48100 Hz Clock: 50.000 MHz
  800x600@75Hz 4:3 HorFreq: 46900 Hz Clock: 49.500 MHz
  1024x768@60Hz 4:3 HorFreq: 48400 Hz Clock: 65.000 MHz
  1024x768@75Hz 4:3 HorFreq: 60000 Hz Clock: 78.750 MHz
Standard timings supported:
  1280x1024@60Hz 5:4 HorFreq: 64000 Hz Clock: 108.000 MHz
Detailed mode: Clock 85.500 MHz, 700 mm x 390 mm
               1366 1494 1624 1798 hborder 0
                768  770  776  795 vborder 0
               +hsync -vsync 
               VertFreq: 59 Hz, HorFreq: 47552 Hz
Monitor ranges (GTF): 50-85Hz V, 31-70kHz H, max dotclock 110MHz
Serial number: --
Checksum: 0x8d (valid)
EDID block does NOT conform to EDID 1.3!
	Name descriptor not terminated with a newline
