edid-decode (hex):

00 ff ff ff ff ff ff 00 59 3a 21 00 01 01 01 01
21 11 01 03 3f 46 27 78 ea e6 9d a3 54 4a 99 26
0f 47 4a a5 ca 00 81 80 01 01 01 01 01 01 01 01
01 01 01 01 01 01 66 21 56 b0 51 00 1b 30 80 82
26 00 bc 86 21 00 00 1a 00 00 00 fd 00 32 55 1f
46 0b 00 0a 20 20 20 20 20 20 00 00 00 ff 00 53
41 41 42 42 48 33 33 37 33 39 36 39 00 00 00 fc
00 56 58 33 32 4c 20 48 44 54 56 31 30 41 00 72

----------------

Block 0, Base EDID:
  EDID Structure Version & Revision: 1.3
  Vendor & Product Identification:
    Manufacturer: VIZ
    Model: 33
    Serial Number: ...
    Made in: week 33 of 2007
  Basic Display Parameters & Features:
    Analog display
    Input voltage level: 0.714/0.286 V
    Blank-to-black setup/pedestal
    Sync: Separate Composite SyncOnGreen Serration
    Maximum image size: 70 cm x 39 cm
    Gamma: 2.20
    DPMS levels: Standby Suspend Off
    RGB color display
    First detailed timing is the preferred timing
  Color Characteristics:
    Red  : 0.6396, 0.3300
    Green: 0.2900, 0.5996
    Blue : 0.1503, 0.0595
    White: 0.2802, 0.2900
  Established Timings I & II:
    IBM     :   720x400    70.082 Hz   9:5    31.467 kHz  28.320 MHz
    DMT 0x04:   640x480    59.940 Hz   4:3    31.469 kHz  25.175 MHz
    DMT 0x06:   640x480    75.000 Hz   4:3    37.500 kHz  31.500 MHz
    DMT 0x09:   800x600    60.317 Hz   4:3    37.879 kHz  40.000 MHz
    DMT 0x0a:   800x600    72.188 Hz   4:3    48.077 kHz  50.000 MHz
    DMT 0x0b:   800x600    75.000 Hz   4:3    46.875 kHz  49.500 MHz
    DMT 0x10:  1024x768    60.004 Hz   4:3    48.363 kHz  65.000 MHz
    DMT 0x12:  1024x768    75.029 Hz   4:3    60.023 kHz  78.750 MHz
  Standard Timings:
    DMT 0x23:  1280x1024   60.020 Hz   5:4    63.981 kHz 108.000 MHz
  Detailed Timing Descriptors:
    DTD 1:  1366x768    59.815 Hz 683:384  47.553 kHz  85.500 MHz (700 mm x 390 mm)
                 Hfront  128 Hsync 130 Hback 174 Hpol P
                 Vfront    2 Vsync   6 Vback  19 Vpol N
  Display Range Limits:
    Monitor ranges (GTF): 50-85 Hz V, 31-70 kHz H, max dotclock 110 MHz
    Display Product Serial Number: ...
    Display Product Name: 'VX32L HDTV10A'
Checksum: 0x72

----------------

EDID conformity: PASS
