
EDID (hex):
00ffffffffffff000a83a32200000000
16120103082f1d78eade95a3544c9926
0f5054bfef80904f714f010101019500
950fb300010108399030621a274068b0
3600d92811000019000000fd00384c1f
5310000a202020202020000000ff0038
323230333032380a20202020000000fc
004c45323241330a2020202020200070

Extracted contents:
header:          00 ff ff ff ff ff ff 00
serial number:   0a 83 a3 22 00 00 00 00 16 12
version:         01 03
basic params:    08 2f 1d 78 ea
chroma info:     de 95 a3 54 4c 99 26 0f 50 54
established:     bf ef 80
standard:        90 4f 71 4f 01 01 01 01 95 00 95 0f b3 00 01 01
descriptor 1:    08 39 90 30 62 1a 27 40 68 b0 36 00 d9 28 11 00 00 19
descriptor 2:    00 00 00 fd 00 38 4c 1f 53 10 00 0a 20 20 20 20 20 20
descriptor 3:    00 00 00 ff 00 38 32 32 30 33 30 32 38 0a 20 20 20 20
descriptor 4:    00 00 00 fc 00 4c 45 32 32 41 33 0a 20 20 20 20 20 20
extensions:      00
checksum:        70

EDID version: 1.3
Manufacturer: BTC Model 22a3 Serial Number --
Made in week 22 of 2008
Analog display, Input voltage level: 0.7/0.3 V
Sync: Separate 
Maximum image size: 47 cm x 29 cm
Gamma: 2.20
DPMS levels: Standby Suspend Off
RGB color display
First detailed timing is preferred timing
Display x,y Chromaticity:
  Red:   0.6396, 0.3291
  Green: 0.2998, 0.5996
  Blue:  0.1503, 0.0595
  White: 0.3134, 0.3291
Established timings supported:
  720x400@70Hz 9:5 HorFreq: 31469 Hz Clock: 28.320 MHz
  640x480@60Hz 4:3 HorFreq: 31469 Hz Clock: 25.175 MHz
  640x480@67Hz 4:3 HorFreq: 35000 Hz Clock: 30.240 MHz
  640x480@72Hz 4:3 HorFreq: 37900 Hz Clock: 31.500 MHz
  640x480@75Hz 4:3 HorFreq: 37500 Hz Clock: 31.500 MHz
  800x600@56Hz 4:3 HorFreq: 35200 Hz Clock: 36.000 MHz
  800x600@60Hz 4:3 HorFreq: 37900 Hz Clock: 40.000 MHz
  800x600@72Hz 4:3 HorFreq: 48100 Hz Clock: 50.000 MHz
  800x600@75Hz 4:3 HorFreq: 46900 Hz Clock: 49.500 MHz
  832x624@75Hz 4:3 HorFreq: 49726 Hz Clock: 57.284 MHz
  1024x768@60Hz 4:3 HorFreq: 48400 Hz Clock: 65.000 MHz
  1024x768@70Hz 4:3 HorFreq: 56500 Hz Clock: 75.000 MHz
  1024x768@75Hz 4:3 HorFreq: 60000 Hz Clock: 78.750 MHz
  1280x1024@75Hz 5:4 HorFreq: 80000 Hz Clock: 135.000 MHz
  1152x870@75Hz 192:145 HorFreq: 67500 Hz Clock: 108.000 MHz
Standard timings supported:
  1400x1050@75Hz 4:3 HorFreq: 82300 Hz Clock: 156.000 MHz
  1152x864@75Hz 4:3 HorFreq: 67500 Hz Clock: 108.000 MHz
  1440x900@60Hz 16:10 HorFreq: 55500 Hz Clock: 88.750 MHz
  1440x900@75Hz 16:10 HorFreq: 82300 Hz Clock: 156.000 MHz
  1680x1050@60Hz 16:10 HorFreq: 64700 Hz Clock: 119.000 MHz
Detailed mode: Clock 146.000 MHz, 473 mm x 296 mm
               1680 1784 1960 2240 hborder 0
               1050 1053 1059 1089 vborder 0
               -hsync -vsync 
               VertFreq: 59 Hz, HorFreq: 65178 Hz
Monitor ranges (GTF): 56-76Hz V, 31-83kHz H, max dotclock 160MHz
Serial number: --
Monitor name: LE22A3
Checksum: 0x70 (valid)


