
EDID (hex):
00ffffffffffff0022f00b4101000000
1e140103802c19780aa7d5a5554e9d25
11505400000001010101010101010101
010101010101302a40c860846430b428
a400b8fa10000018000000fe004c470a
20202020202020202020000000fc0048
5020546f756368536d617274000000fe
004c4d3230305744310a202020200093

Extracted contents:
header:          00 ff ff ff ff ff ff 00
serial number:   22 f0 0b 41 01 00 00 00 1e 14
version:         01 03
basic params:    80 2c 19 78 0a
chroma info:     a7 d5 a5 55 4e 9d 25 11 50 54
established:     00 00 00
standard:        01 01 01 01 01 01 01 01 01 01 01 01 01 01 01 01
descriptor 1:    30 2a 40 c8 60 84 64 30 b4 28 a4 00 b8 fa 10 00 00 18
descriptor 2:    00 00 00 fe 00 4c 47 0a 20 20 20 20 20 20 20 20 20 20
descriptor 3:    00 00 00 fc 00 48 50 20 54 6f 75 63 68 53 6d 61 72 74
descriptor 4:    00 00 00 fe 00 4c 4d 32 30 30 57 44 31 0a 20 20 20 20
extensions:      00
checksum:        93

EDID version: 1.3
Manufacturer: HWP Model 410b Serial Number --
Made in week 30 of 2010
Digital display
Maximum image size: 44 cm x 25 cm
Gamma: 2.20
RGB color display
First detailed timing is preferred timing
Display x,y Chromaticity:
  Red:   0.6464, 0.3339
  Green: 0.3056, 0.6162
  Blue:  0.1474, 0.0673
  White: 0.3134, 0.3291
Established timings supported:
Standard timings supported:
Detailed mode: Clock 108.000 MHz, 440 mm x 250 mm
               1600 1780 1820 1800 hborder 0
                900  910  914 1000 vborder 0
               -hsync -vsync 
               VertFreq: 60 Hz, HorFreq: 60000 Hz
ASCII string: LG
ASCII string: LM200WD1
Checksum: 0x93 (valid)
EDID block does NOT conform to EDID 1.3!
	Name descriptor not terminated with a newline
	Missing monitor ranges
