
EDID (hex):
00ffffffffffff004162635001010101
28110103802b1b78e2cfe5a35a49a024
135054a54b008180b3009500950f81c0
01010101010121399030621a274068b0
3600b10f1100001c000000fc00504b42
204d4145323030570a20000000fd0038
4c1f500f000a202020202020000000ff
003131333231303036333138320a0071

edid-decode (hex):

00 ff ff ff ff ff ff 00 41 62 63 50 01 01 01 01
28 11 01 03 80 2b 1b 78 e2 cf e5 a3 5a 49 a0 24
13 50 54 a5 4b 00 81 80 b3 00 95 00 95 0f 81 c0
01 01 01 01 01 01 21 39 90 30 62 1a 27 40 68 b0
36 00 b1 0f 11 00 00 1c 00 00 00 fc 00 50 4b 42
20 4d 41 45 32 30 30 57 0a 20 00 00 00 fd 00 38
4c 1f 50 0f 00 0a 20 20 20 20 20 20 00 00 00 ff
00 31 31 33 32 31 30 30 36 33 31 38 32 0a 00 71

----------------

Block 0, Base EDID:
  EDID Structure Version & Revision: 1.3
  Vendor & Product Identification:
    Manufacturer: PKB
    Model: 20579
    Serial Number: 16843009
    Made in: week 40 of 2007
  Basic Display Parameters & Features:
    Digital display
    Maximum image size: 43 cm x 27 cm
    Gamma: 2.20
    DPMS levels: Standby Suspend Off
    Monochrome or grayscale display
    First detailed timing is the preferred timing
  Color Characteristics:
    Red  : 0.6396, 0.3515
    Green: 0.2880, 0.6279
    Blue : 0.1435, 0.0761
    White: 0.3134, 0.3291
  Established Timings I & II:
    IBM     :   720x400    70.081663 Hz   9:5     31.467 kHz     28.320000 MHz
    DMT 0x04:   640x480    59.940476 Hz   4:3     31.469 kHz     25.175000 MHz
    DMT 0x06:   640x480    75.000000 Hz   4:3     37.500 kHz     31.500000 MHz
    DMT 0x09:   800x600    60.316541 Hz   4:3     37.879 kHz     40.000000 MHz
    DMT 0x0b:   800x600    75.000000 Hz   4:3     46.875 kHz     49.500000 MHz
    DMT 0x10:  1024x768    60.003840 Hz   4:3     48.363 kHz     65.000000 MHz
    DMT 0x12:  1024x768    75.028582 Hz   4:3     60.023 kHz     78.750000 MHz
    DMT 0x24:  1280x1024   75.024675 Hz   5:4     79.976 kHz    135.000000 MHz
  Standard Timings:
    DMT 0x23:  1280x1024   60.019740 Hz   5:4     63.981 kHz    108.000000 MHz
    DMT 0x3a:  1680x1050   59.954250 Hz  16:10    65.290 kHz    146.250000 MHz
    DMT 0x2f:  1440x900    59.887445 Hz  16:10    55.935 kHz    106.500000 MHz
    DMT 0x30:  1440x900    74.984427 Hz  16:10    70.635 kHz    136.750000 MHz
    DMT 0x55:  1280x720    60.000000 Hz  16:9     45.000 kHz     74.250000 MHz
  Detailed Timing Descriptors:
    DTD 1:  1680x1050   59.954250 Hz  16:10    65.290 kHz    146.250000 MHz (433 mm x 271 mm)
                 Hfront  104 Hsync 176 Hback  280 Hpol N
                 Vfront    3 Vsync   6 Vback   30 Vpol P
    Display Product Name: 'PKB MAE200W'
    Display Range Limits:
      Monitor ranges (GTF): 56-76 Hz V, 31-80 kHz H, max dotclock 150 MHz
    Display Product Serial Number: '113210063182'
Checksum: 0x71
