
EDID (hex):
00ffffffffffff0030aea16333304332
0c220104b53c22783e3825af4f46a525
0f5054b54f008180818a9500b300d1c0
d100714f8100565e00a0a0a029503020
350055502100001a000000ff00563330
43324330330a20202020000000fd0032
4b1e721e010a202020202020000000fc
00503237682d33300a2020202020011d
020327f1490103020413901f12112309
07078301000065030c001000e305c000
e606050161561ccc7400a0a0a01e5030
20350055502100001a662156aa51001e
30468f330055502100001e483f403062
b0324040c0130055502100001e000000
00000000000000000000000000000000
00000000000000000000000000000085

edid-decode (hex):

00 ff ff ff ff ff ff 00 30 ae a1 63 33 30 43 32
0c 22 01 04 b5 3c 22 78 3e 38 25 af 4f 46 a5 25
0f 50 54 b5 4f 00 81 80 81 8a 95 00 b3 00 d1 c0
d1 00 71 4f 81 00 56 5e 00 a0 a0 a0 29 50 30 20
35 00 55 50 21 00 00 1a 00 00 00 ff 00 56 33 30
43 32 43 30 33 0a 20 20 20 20 00 00 00 fd 00 32
4b 1e 72 1e 01 0a 20 20 20 20 20 20 00 00 00 fc
00 50 32 37 68 2d 33 30 0a 20 20 20 20 20 01 1d

02 03 27 f1 49 01 03 02 04 13 90 1f 12 11 23 09
07 07 83 01 00 00 65 03 0c 00 10 00 e3 05 c0 00
e6 06 05 01 61 56 1c cc 74 00 a0 a0 a0 1e 50 30
20 35 00 55 50 21 00 00 1a 66 21 56 aa 51 00 1e
30 46 8f 33 00 55 50 21 00 00 1e 48 3f 40 30 62
b0 32 40 40 c0 13 00 55 50 21 00 00 1e 00 00 00
00 00 00 00 00 00 00 00 00 00 00 00 00 00 00 00
00 00 00 00 00 00 00 00 00 00 00 00 00 00 00 85

----------------

Block 0, Base EDID:
  EDID Structure Version & Revision: 1.4
  Vendor & Product Identification:
    Manufacturer: LEN
    Model: 25505
    Serial Number: 843264051
    Made in: week 12 of 2024
  Basic Display Parameters & Features:
    Digital display
    Bits per primary color channel: 10
    DisplayPort interface
    Maximum image size: 60 cm x 34 cm
    Gamma: 2.20
    DPMS levels: Off
    Supported color formats: RGB 4:4:4, YCrCb 4:4:4, YCrCb 4:2:2
    Default (sRGB) color space is primary color space
    First detailed timing includes the native pixel format and preferred refresh rate
  Color Characteristics:
    Red  : 0.6835, 0.3115
    Green: 0.2753, 0.6445
    Blue : 0.1445, 0.0605
    White: 0.3134, 0.3291
  Established Timings I & II:
    IBM     :   720x400    70.081663 Hz   9:5     31.467 kHz     28.320000 MHz
    DMT 0x04:   640x480    59.940476 Hz   4:3     31.469 kHz     25.175000 MHz
    Apple   :   640x480    66.666667 Hz   4:3     35.000 kHz     30.240000 MHz
    DMT 0x06:   640x480    75.000000 Hz   4:3     37.500 kHz     31.500000 MHz
    DMT 0x09:   800x600    60.316541 Hz   4:3     37.879 kHz     40.000000 MHz
    DMT 0x0b:   800x600    75.000000 Hz   4:3     46.875 kHz     49.500000 MHz
    DMT 0x10:  1024x768    60.003840 Hz   4:3     48.363 kHz     65.000000 MHz
    DMT 0x11:  1024x768    70.069359 Hz   4:3     56.476 kHz     75.000000 MHz
    DMT 0x12:  1024x768    75.028582 Hz   4:3     60.023 kHz     78.750000 MHz
    DMT 0x24:  1280x1024   75.024675 Hz   5:4     79.976 kHz    135.000000 MHz
  Standard Timings:
    DMT 0x23:  1280x1024   60.019740 Hz   5:4     63.981 kHz    108.000000 MHz
    GTF     :  1280x1024   69.999805 Hz   5:4     74.620 kHz    128.943000 MHz
    DMT 0x2f:  1440x900    59.887445 Hz  16:10    55.935 kHz    106.500000 MHz
    DMT 0x3a:  1680x1050   59.954250 Hz  16:10    65.290 kHz    146.250000 MHz
    DMT 0x52:  1920x1080   60.000000 Hz  16:9     67.500 kHz    148.500000 MHz
    DMT 0x45:  1920x1200   59.884600 Hz  16:10    74.556 kHz    193.250000 MHz
    DMT 0x15:  1152x864    75.000000 Hz   4:3     67.500 kHz    108.000000 MHz
    DMT 0x1c:  1280x800    59.810326 Hz  16:10    49.702 kHz     83.500000 MHz
  Detailed Timing Descriptors:
    DTD 1:  2560x1440   59.950550 Hz  16:9     88.787 kHz    241.500000 MHz (597 mm x 336 mm)
                 Hfront   48 Hsync  32 Hback   80 Hpol P
                 Vfront    3 Vsync   5 Vback   33 Vpol N
    Display Product Serial Number: 'V30C2C03'
    Display Range Limits:
      Monitor ranges (Bare Limits): 50-75 Hz V, 30-114 kHz H, max dotclock 300 MHz
    Display Product Name: 'P27h-30'
  Extension blocks: 1
Checksum: 0x1d

----------------

Block 1, CTA-861 Extension Block:
  Revision: 3
  Underscans IT Video Formats by default
  Basic audio support
  Supports YCbCr 4:4:4
  Supports YCbCr 4:2:2
  Native detailed modes: 1
  Video Data Block:
    VIC   1:   640x480    59.940476 Hz   4:3     31.469 kHz     25.175000 MHz
    VIC   3:   720x480    59.940060 Hz  16:9     31.469 kHz     27.000000 MHz
    VIC   2:   720x480    59.940060 Hz   4:3     31.469 kHz     27.000000 MHz
    VIC   4:  1280x720    60.000000 Hz  16:9     45.000 kHz     74.250000 MHz
    VIC  19:  1280x720    50.000000 Hz  16:9     37.500 kHz     74.250000 MHz
    VIC  16:  1920x1080   60.000000 Hz  16:9     67.500 kHz    148.500000 MHz (native)
    VIC  31:  1920x1080   50.000000 Hz  16:9     56.250 kHz    148.500000 MHz
    VIC  18:   720x576    50.000000 Hz  16:9     31.250 kHz     27.000000 MHz
    VIC  17:   720x576    50.000000 Hz   4:3     31.250 kHz     27.000000 MHz
  Audio Data Block:
    Linear PCM:
      Max channels: 2
      Supported sample rates (kHz): 48 44.1 32
      Supported sample sizes (bits): 24 20 16
  Speaker Allocation Data Block:
    FL/FR - Front Left/Right
  Vendor-Specific Data Block (HDMI), OUI 00-0C-03:
    Source physical address: 1.0.0.0
  Colorimetry Data Block:
    BT2020YCC
    BT2020RGB
  HDR Static Metadata Data Block:
    Electro optical transfer functions:
      Traditional gamma - SDR luminance range
      SMPTE ST2084
    Supported static metadata descriptors:
      Static metadata type 1
    Desired content max luminance: 97 (408.759 cd/m^2)
    Desired content max frame-average luminance: 86 (322.098 cd/m^2)
    Desired content min luminance: 28 (0.049 cd/m^2)
  Detailed Timing Descriptors:
    DTD 2:  2560x1440   74.779912 Hz  16:9    109.926 kHz    299.000000 MHz (597 mm x 336 mm)
                 Hfront   48 Hsync  32 Hback   80 Hpol P
                 Vfront    3 Vsync   5 Vback   22 Vpol N
    DTD 3:  1366x768    59.789541 Hz 683:384   47.712 kHz     85.500000 MHz (597 mm x 336 mm)
                 Hfront   70 Hsync 143 Hback  213 Hpol P
                 Vfront    3 Vsync   3 Vback   24 Vpol P
    DTD 4:  1600x1200   60.000000 Hz   4:3     75.000 kHz    162.000000 MHz (597 mm x 336 mm)
                 Hfront   64 Hsync 192 Hback  304 Hpol P
                 Vfront    1 Vsync   3 Vback   46 Vpol P
Checksum: 0x85  Unused space in Extension Block: 34 bytes


