edid-decode (hex):

00 ff ff ff ff ff ff 00 4c 2d 60 0c 4b 52 42 30
2d 19 01 03 0e 34 1e 78 2a 52 95 a5 56 54 9d 25
0e 50 54 23 08 00 81 c0 81 00 81 80 95 00 a9 c0
b3 00 01 01 01 01 02 3a 80 18 71 38 2d 40 58 2c
45 00 00 25 21 00 00 1e 00 00 00 fd 00 38 3c 1e
51 11 00 0a 20 20 20 20 20 20 00 00 00 fc 00 53
32 34 45 35 31 30 43 0a 20 20 20 20 00 00 00 ff
00 48 48 4a 47 42 30 30 34 35 37 0a 20 20 00 9e

----------------

Block 0, Base EDID:
  EDID Structure Version & Revision: 1.3
  Vendor & Product Identification:
    Manufacturer: SAM
    Model: 3168
    Serial Number: ...
    Made in: week 45 of 2015
  Basic Display Parameters & Features:
    Analog display
    Input voltage level: 0.7/0.3 V
    Sync: Separate Composite SyncOnGreen
    Maximum image size: 52 cm x 30 cm
    Gamma: 2.20
    DPMS levels: Off
    RGB color display
    First detailed timing is preferred timing
  Color Characteristics:
    Red  : 0.6455, 0.3369
    Green: 0.3281, 0.6152
    Blue : 0.1464, 0.0556
    White: 0.3134, 0.3291
  Established Timings I & II:
    DMT 0x04:   640x480    59.940 Hz   4:3    31.469 kHz  25.175 MHz
    DMT 0x08:   800x600    56.250 Hz   4:3    35.156 kHz  36.000 MHz
    DMT 0x09:   800x600    60.317 Hz   4:3    37.879 kHz  40.000 MHz
    DMT 0x10:  1024x768    60.004 Hz   4:3    48.363 kHz  65.000 MHz
  Standard Timings:
    DMT 0x55:  1280x720    60.000 Hz  16:9    45.000 kHz  74.250 MHz
    DMT 0x1c:  1280x800    59.810 Hz  16:10   49.702 kHz  83.500 MHz
    DMT 0x23:  1280x1024   60.020 Hz   5:4    63.981 kHz 108.000 MHz
    DMT 0x2f:  1440x900    59.887 Hz  16:10   55.935 kHz 106.500 MHz
    DMT 0x53:  1600x900    60.000 Hz  16:9    60.000 kHz 108.000 MHz (RB)
    DMT 0x3a:  1680x1050   59.954 Hz  16:10   65.290 kHz 146.250 MHz
  Detailed Timing Descriptors:
    DTD 1:  1920x1080   60.000 Hz  16:9    67.500 kHz 148.500 MHz (512 mm x 293 mm)
                 Hfront   88 Hsync  44 Hback 148 Hpol P
                 Vfront    4 Vsync   5 Vback  36 Vpol P
  Display Range Limits:
    Monitor ranges (GTF): 56-60 Hz V, 30-81 kHz H, max dotclock 170 MHz
    Display Product Name: 'S24E510C'
    Display Product Serial Number: ...
Checksum: 0x9e

----------------

EDID conformity: PASS
