
EDID (hex):
00ffffffffffff0022f0574200000000
01180104a5351d78fe2fd0a7544b9e25
0d505401080001010101010101010101
010101010101565e009aa0a029503020
35000e282100001a000000ff004d3233
3844414e30312e330a20000000fc0048
5020416c6c2d696e2d4f6e65000000fd
0038561e711e010a2020202020200036

Extracted contents:
header:          00 ff ff ff ff ff ff 00
serial number:   22 f0 57 42 00 00 00 00 01 18
version:         01 04
basic params:    a5 35 1d 78 fe
chroma info:     2f d0 a7 54 4b 9e 25 0d 50 54
established:     01 08 00
standard:        01 01 01 01 01 01 01 01 01 01 01 01 01 01 01 01
descriptor 1:    56 5e 00 9a a0 a0 29 50 30 20 35 00 0e 28 21 00 00 1a
descriptor 2:    00 00 00 ff 00 4d 32 33 38 44 41 4e 30 31 2e 33 0a 20
descriptor 3:    00 00 00 fc 00 48 50 20 41 6c 6c 2d 69 6e 2d 4f 6e 65
descriptor 4:    00 00 00 fd 00 38 56 1e 71 1e 01 0a 20 20 20 20 20 20
extensions:      00
checksum:        36

EDID version: 1.4
Manufacturer: HWP Model 4257 Serial Number --
Made in week 1 of 2014
Digital display
8 bits per primary color channel
DisplayPort interface
Maximum image size: 53 cm x 29 cm
Gamma: 2.20
DPMS levels: Standby Suspend Off
Supported color formats: RGB 4:4:4, YCrCb 4:4:4, YCrCb 4:2:2
Default (sRGB) color space is primary color space
First detailed timing includes the native pixel format and preferred refresh rate
Display x,y Chromaticity:
  Red:   0.6523, 0.3300
  Green: 0.2958, 0.6201
  Blue:  0.1474, 0.0517
  White: 0.3125, 0.3281
Established timings supported:
  800x600@60Hz 4:3 HorFreq: 37900 Hz Clock: 40.000 MHz
  1024x768@60Hz 4:3 HorFreq: 48400 Hz Clock: 65.000 MHz
Standard timings supported:
Detailed mode: Clock 241.500 MHz, 526 mm x 296 mm
               2560 2608 2640 2714 hborder 0
               1440 1443 1448 1481 vborder 0
               +hsync -vsync 
               VertFreq: 60 Hz, HorFreq: 88983 Hz
Serial number: --
Monitor ranges (bare limits): 56-86Hz V, 30-113kHz H, max dotclock 300MHz
Checksum: 0x36 (valid)
EDID block does NOT conform to EDID 1.4!
	sRGB is signaled, but the chromaticities do not match
	Name descriptor not terminated with a newline
