edid-decode (hex):

00 ff ff ff ff ff ff 00 09 e5 cf 09 00 00 00 00
2f 1e 01 04 a5 22 16 78 07 c1 15 a4 55 4d 9f 27
0d 50 54 00 00 00 01 01 01 01 01 01 01 01 01 01
01 01 01 01 01 01 5b 99 80 c8 70 b0 56 40 30 20
36 00 59 d7 10 00 00 1a e6 3f 80 c8 70 b0 56 40
30 20 36 00 59 d7 10 00 00 1a 00 00 00 fd 00 30
90 b9 b9 27 01 0a 20 20 20 20 20 20 00 00 00 fe
00 4e 56 31 36 30 57 55 4d 2d 4e 58 31 0a 00 b9

----------------

Block 0, Base EDID:
  EDID Structure Version & Revision: 1.4
  Vendor & Product Identification:
    Manufacturer: BOE
    Model: 2511
    Made in: week 47 of 2020
  Basic Display Parameters & Features:
    Digital display
    Bits per primary color channel: 8
    DisplayPort interface
    Maximum image size: 34 cm x 22 cm
    Gamma: 2.20
    Supported color formats: RGB 4:4:4
    Default (sRGB) color space is primary color space
    First detailed timing includes the native pixel format and preferred refresh rate
    Display is continuous frequency
  Color Characteristics:
    Red  : 0.6435, 0.3320
    Green: 0.3007, 0.6220
    Blue : 0.1523, 0.0517
    White: 0.3134, 0.3291
  Established Timings I & II: none
  Standard Timings: none
  Detailed Timing Descriptors:
    DTD 1:  1920x1200  143.999971 Hz   8:5    185.184 kHz    392.590000 MHz (345 mm x 215 mm)
                 Hfront   48 Hsync  32 Hback  120 Hpol P
                 Vfront    3 Vsync   6 Vback   77 Vpol N
    DTD 2:  1920x1200   60.000293 Hz   8:5     77.160 kHz    163.580000 MHz (345 mm x 215 mm)
                 Hfront   48 Hsync  32 Hback  120 Hpol P
                 Vfront    3 Vsync   6 Vback   77 Vpol N
    Display Range Limits:
      Monitor ranges (Bare Limits): 48-144 Hz V, 185-185 kHz H, max dotclock 390 MHz
    Alphanumeric Data String: 'NV160WUM-NX1'
Checksum: 0xb9

----------------

Warnings:

EDID:
  Base EDID: Some timings are out of range of the Monitor Ranges:
    Horizontal Freq: 77.160 - 185.183 kHz (Monitor: 185.000 - 185.000 kHz)
    Maximum Clock: 392.590 MHz (Monitor: 390.000 MHz)

Failures:

Block 0, Base EDID:
  Basic Display Parameters & Features: sRGB is signaled, but the chromaticities do not match.
  Missing Display Product Name.

EDID conformity: FAIL
