edid-decode (hex):

00 ff ff ff ff ff ff 00 1e 6d 6a 56 a9 7d 02 00
0b 11 01 03 80 31 20 78 ea ae c5 a2 57 4a 9c 25
12 50 54 a7 6b 80 95 0f 95 00 81 80 81 40 71 4f
01 01 01 01 01 01 7c 2e 90 a0 60 1a 1e 40 30 20
36 00 da 28 11 00 00 1a 21 39 90 30 62 1a 27 40
68 b0 36 00 da 28 11 00 00 1c 00 00 00 fd 00 38
4b 1c 53 0f 00 0a 20 20 20 20 20 20 00 00 00 fc
00 4c 32 32 36 57 0a 20 20 20 20 20 20 20 01 f5

02 03 1b 61 23 09 07 07 83 01 00 00 67 03 0c 00
20 00 80 2d 43 90 84 02 e2 00 0f 8c 0a d0 8a 20
e0 2d 10 10 3e 96 00 a0 5a 00 00 00 00 00 00 00
00 00 00 00 00 00 00 00 00 00 00 00 00 00 00 00
00 00 00 00 00 00 00 00 00 00 00 00 00 00 00 00
00 00 00 00 00 00 00 00 00 00 00 00 00 00 00 00
00 00 00 00 00 00 00 00 00 00 00 00 00 00 00 00
00 00 00 00 00 00 00 00 00 00 00 00 00 00 00 29

----------------

Block 0, Base EDID:
  EDID Structure Version & Revision: 1.3
  Vendor & Product Identification:
    Manufacturer: GSM
    Model: 22122
    Serial Number: ...
    Made in: week 11 of 2007
  Basic Display Parameters & Features:
    Digital display
    Maximum image size: 49 cm x 32 cm
    Gamma: 2.20
    DPMS levels: Standby Suspend Off
    RGB color display
    First detailed timing is the preferred timing
  Color Characteristics:
    Red  : 0.6347, 0.3417
    Green: 0.2919, 0.6113
    Blue : 0.1474, 0.0703
    White: 0.3134, 0.3291
  Established Timings I & II:
    IBM     :   720x400    70.082 Hz   9:5    31.467 kHz  28.320 MHz
    DMT 0x04:   640x480    59.940 Hz   4:3    31.469 kHz  25.175 MHz
    DMT 0x06:   640x480    75.000 Hz   4:3    37.500 kHz  31.500 MHz
    DMT 0x08:   800x600    56.250 Hz   4:3    35.156 kHz  36.000 MHz
    DMT 0x09:   800x600    60.317 Hz   4:3    37.879 kHz  40.000 MHz
    DMT 0x0b:   800x600    75.000 Hz   4:3    46.875 kHz  49.500 MHz
    Apple   :   832x624    74.551 Hz   4:3    49.726 kHz  57.284 MHz
    DMT 0x10:  1024x768    60.004 Hz   4:3    48.363 kHz  65.000 MHz
    DMT 0x12:  1024x768    75.029 Hz   4:3    60.023 kHz  78.750 MHz
    DMT 0x24:  1280x1024   75.025 Hz   5:4    79.976 kHz 135.000 MHz
    Apple   :  1152x870    75.062 Hz 192:145  68.681 kHz 100.000 MHz
  Standard Timings:
    DMT 0x30:  1440x900    74.984 Hz  16:10   70.635 kHz 136.750 MHz
    DMT 0x2f:  1440x900    59.887 Hz  16:10   55.935 kHz 106.500 MHz
    DMT 0x23:  1280x1024   60.020 Hz   5:4    63.981 kHz 108.000 MHz
    DMT 0x20:  1280x960    60.000 Hz   4:3    60.000 kHz 108.000 MHz
    DMT 0x15:  1152x864    75.000 Hz   4:3    67.500 kHz 108.000 MHz
  Detailed Timing Descriptors:
    DTD 1:  1680x1050   59.883 Hz   8:5    64.674 kHz 119.000 MHz (474 mm x 296 mm)
                 Hfront   48 Hsync  32 Hback  80 Hpol P
                 Vfront    3 Vsync   6 Vback  21 Vpol N
    DTD 2:  1680x1050   59.954 Hz   8:5    65.290 kHz 146.250 MHz (474 mm x 296 mm)
                 Hfront  104 Hsync 176 Hback 280 Hpol N
                 Vfront    3 Vsync   6 Vback  30 Vpol P
  Display Range Limits:
    Monitor ranges (GTF): 56-75 Hz V, 28-83 kHz H, max dotclock 150 MHz
    Display Product Name: 'L226W'
  Extension blocks: 1
Checksum: 0xf5

----------------

Block 1, CTA-861 Extension Block:
  Revision: 3
  Basic audio support
  Supports YCbCr 4:4:4
  Native detailed modes: 1
  Audio Data Block:
    Linear PCM:
      Max channels: 2
      Supported sample rates (kHz): 48 44.1 32
      Supported sample sizes (bits): 24 20 16
  Speaker Allocation Data Block:
    FL/FR - Front Left/Right
  Vendor-Specific Data Block (HDMI), OUI 00-0C-03:
    Source physical address: 2.0.0.0
    Supports_AI
    Maximum TMDS clock: 225 MHz
  Video Data Block:
    VIC  16:  1920x1080   60.000 Hz  16:9    67.500 kHz 148.500 MHz (native)
    VIC   4:  1280x720    60.000 Hz  16:9    45.000 kHz  74.250 MHz (native)
    VIC   2:   720x480    59.940 Hz   4:3    31.469 kHz  27.000 MHz
  Video Capability Data Block:
    YCbCr quantization: No Data
    RGB quantization: No Data
    PT scan behavior: No Data
    IT scan behavior: Supports both over- and underscan
    CE scan behavior: Supports both over- and underscan
  Detailed Timing Descriptors:
    DTD 3:   720x480    59.940 Hz   3:2    31.469 kHz  27.000 MHz (analog composite, sync-on-green, 160 mm x 90 mm)
                 Hfront   16 Hsync  62 Hback  60 Hpol N
                 Vfront    9 Vsync   6 Vback  30 Vpol N
Checksum: 0x29

----------------

Warnings:

Block 1, CTA-861 Extension Block:
  IT Video Formats are overscanned by default, but normally this should be underscanned.
  Video Capability Data Block: Set Selectable RGB Quantization to avoid interop issues.

Failures:

Block 0, Base EDID:
  Detailed Timing Descriptor #1: Mismatch of image size 474x296 mm vs display size 490x320 mm.
  Detailed Timing Descriptor #2: Mismatch of image size 474x296 mm vs display size 490x320 mm.
Block 1, CTA-861 Extension Block:
  Detailed Timing Descriptor #3: Mismatch of image size 160x90 mm vs display size 490x320 mm.
EDID:
  CTA-861: Native progressive timings are a mix of several resolutions.

EDID conformity: FAIL
