edid-decode (hex):

00 ff ff ff ff ff ff 00 09 e5 84 06 00 00 00 00
01 19 01 04 95 26 15 78 02 d4 f0 a1 5a 56 9c 27
19 50 54 00 00 00 01 01 01 01 01 01 01 01 01 01
01 01 01 01 01 01 f0 28 40 f2 60 84 30 30 30 20
36 00 7e d7 10 00 00 1a 00 00 00 00 00 00 00 00
00 00 00 00 00 00 00 00 00 1a 00 00 00 00 00 00
00 00 00 00 00 00 00 00 00 00 00 00 00 00 00 02
00 0c 43 f9 0b 3c 6e 1e 16 28 6f 00 00 00 00 09

----------------

Block 0, Base EDID:
  EDID Structure Version & Revision: 1.4
  Vendor & Product Identification:
    Manufacturer: BOE
    Model: 1668
    Made in: week 1 of 2015
  Basic Display Parameters & Features:
    Digital display
    Bits per primary color channel: 6
    DisplayPort interface
    Maximum image size: 38 cm x 21 cm
    Gamma: 2.20
    Supported color formats: RGB 4:4:4
    First detailed timing includes the native pixel format and preferred refresh rate
  Color Characteristics:
    Red  : 0.6318, 0.3525
    Green: 0.3369, 0.6093
    Blue : 0.1552, 0.1005
    White: 0.3125, 0.3281
  Established Timings I & II: none
  Standard Timings: none
  Detailed Timing Descriptors:
    DTD 1:  1600x900    60.015 Hz  16:9    56.895 kHz 104.800 MHz (382 mm x 215 mm)
                 Hfront   48 Hsync  32 Hback 162 Hpol P
                 Vfront    3 Vsync   6 Vback  39 Vpol N
    Manufacturer-Specified Display Descriptor (0x00): 00 00 00 00 00 00 00 00 00 00 00 00 00 00 00 1a '................'
    Empty Descriptor
    Manufacturer-Specified Display Descriptor (0x02): 00 02 00 0c 43 f9 0b 3c 6e 1e 16 28 6f 00 00 00 '....C..<n..(o...'
Checksum: 0x9
