
EDID (hex):
00ffffffffffff004493170000000000
000e0103801d15780a47a994574f8c27
27505400000001010101010101010101
010101010101302a7820511a10402c70
03001dd61000001828237820511a1040
2c7003001dd610000000000000fe004a
343233370100000000000000000000fe
00f8e6dfcfaf89590002010a202000f2

Extracted contents:
header:          00 ff ff ff ff ff ff 00
serial number:   44 93 17 00 00 00 00 00 00 0e
version:         01 03
basic params:    80 1d 15 78 0a
chroma info:     47 a9 94 57 4f 8c 27 27 50 54
established:     00 00 00
standard:        01 01 01 01 01 01 01 01 01 01 01 01 01 01 01 01
descriptor 1:    30 2a 78 20 51 1a 10 40 2c 70 03 00 1d d6 10 00 00 18
descriptor 2:    28 23 78 20 51 1a 10 40 2c 70 03 00 1d d6 10 00 00 00
descriptor 3:    00 00 00 fe 00 4a 34 32 33 37 01 00 00 00 00 00 00 00
descriptor 4:    00 00 00 fe 00 f8 e6 df cf af 89 59 00 02 01 0a 20 20
extensions:      00
checksum:        f2

EDID version: 1.3
Manufacturer: QDS Model 17 Serial Number --
Digital display
Maximum image size: 29 cm x 21 cm
Gamma: 2.20
RGB color display
First detailed timing is preferred timing
Display x,y Chromaticity:
  Red:   0.5791, 0.3398
  Green: 0.3095, 0.5498
  Blue:  0.1542, 0.1542
  White: 0.3144, 0.3291
Established timings supported:
Standard timings supported:
Detailed mode: Clock 108.000 MHz, 285 mm x 214 mm
               1400 1444 1556 1688 hborder 0
               1050 1050 1053 1066 vborder 0
               -hsync -vsync 
               VertFreq: 60 Hz, HorFreq: 63981 Hz
Detailed mode: Clock 90.000 MHz, 285 mm x 214 mm
               1400 1444 1556 1688 hborder 0
               1050 1050 1053 1066 vborder 0
               -hsync -vsync analog composite 
               VertFreq: 50 Hz, HorFreq: 53317 Hz
ASCII string: J4237
ASCII string: 
Checksum: 0xf2 (valid)
EDID block does NOT conform to EDID 1.3!
	Missing name descriptor
	Missing monitor ranges
	Detailed block string not properly terminated
EDID block does not conform at all!
	Bad year of manufacture
