edid-decode (hex):

00 ff ff ff ff ff ff 00 32 0c 00 00 00 00 00 00
00 11 01 03 90 25 17 78 0a 3b 60 9a 59 52 8d 28
25 50 54 00 00 00 01 01 01 01 01 01 01 01 01 01
01 01 01 01 01 01 c6 2a a0 16 52 84 0c 30 46 28
13 00 6f e6 10 00 00 19 00 00 00 00 00 00 00 00
00 00 00 00 00 00 00 00 00 00 00 00 00 fe 00 52
4d 32 34 37 00 31 37 31 57 50 34 0a 00 00 00 fe
00 2e 3e 49 53 74 97 c6 ff 02 01 0a 20 20 00 65

----------------

Block 0, Base EDID:
  EDID Structure Version & Revision: 1.3
  Vendor & Product Identification:
    Manufacturer: LPL
    Model: 0
    Made in: 2007
  Basic Display Parameters & Features:
    Digital display
    Maximum image size: 37 cm x 23 cm
    Gamma: 2.20
    RGB color display
    First detailed timing is preferred timing
  Color Characteristics:
    Red  : 0.6015, 0.3505
    Green: 0.3222, 0.5537
    Blue : 0.1572, 0.1464
    White: 0.3125, 0.3281
  Established Timings I & II: none
  Standard Timings: none
  Detailed Timing Descriptors:
    DTD 1:  1440x900    60.824 Hz   8:5    55.471 kHz 109.500 MHz (367 mm x 230 mm)
                 Hfront   70 Hsync  40 Hback 424 Hpol N
                 Vfront    1 Vsync   3 Vback   8 Vpol N
    Empty Descriptor
    Alphanumeric Data String: 'RM247'
    Alphanumeric Data String: '.>ISt'
Checksum: 0x65
