edid-decode (hex):

00 ff ff ff ff ff ff 00 32 0c 00 00 00 00 00 00
00 0f 01 03 80 21 15 78 0a bc a5 95 54 52 8c 27
23 50 54 00 00 00 01 01 01 01 01 01 01 01 01 01
01 01 01 01 01 01 a8 2f 90 e0 60 1a 10 40 20 40
13 00 4b cf 10 00 00 19 a8 2f 90 e0 60 1a 10 40
20 40 13 00 4b cf 10 00 00 00 00 00 00 fe 00 58
44 35 37 30 01 31 35 34 57 30 32 0a 00 00 00 fe
00 28 3f 4e 58 80 af d2 f6 02 01 0a 20 20 00 ff

----------------

Block 0, Base EDID:
  EDID Structure Version & Revision: 1.3
  Vendor & Product Identification:
    Manufacturer: LPL
    Model: 0
    Made in: 2005
  Basic Display Parameters & Features:
    Digital display
    Maximum image size: 33 cm x 21 cm
    Gamma: 2.20
    RGB color display
    First detailed timing is preferred timing
  Color Characteristics:
    Red  : 0.5839, 0.3310
    Green: 0.3232, 0.5468
    Blue : 0.1542, 0.1386
    White: 0.3134, 0.3291
  Established Timings I & II: none
  Standard Timings: none
  Detailed Timing Descriptors:
    DTD 1:  1680x1050   60.108 Hz   8:5    64.076 kHz 122.000 MHz (DE timing only, 331 mm x 207 mm)
                 Hfront   32 Hsync  64 Hback 128 Hpol N
                 Vfront    1 Vsync   3 Vback  12 Vpol N
    DTD 2:  1680x1050   60.108 Hz   8:5    64.076 kHz 122.000 MHz (DE timing only, 331 mm x 207 mm)
                 Hfront   32 Hsync  64 Hback 128 Hpol N
                 Vfront    1 Vsync   3 Vback  12 Vpol N
    SPWG Module Revision: 0
    SPWG Descriptor #3:
      SPWG PC Maker P/N: 'XD570'
      SPWG LCD Supplier EEDID Revision: 1
      SPWG Manufacturer P/N: '154W02'
    SPWG Descriptor #4:
      SMBUS Values: 0x28 0x3f 0x4e 0x58 0x80 0xaf 0xd2 0xf6
      LVDS Channels: 2
      Panel Self Test Present
Checksum: 0xff

----------------

Failures:

Block 0, Base EDID:
  Missing Display Product Name.
  Missing Display Range Limits Descriptor.

EDID conformity: FAIL
