edid-decode (hex):

00 ff ff ff ff ff ff 00 32 0c 00 00 00 00 00 00
00 0f 01 03 80 1e 13 78 0a c4 40 94 58 53 8c 28
23 50 54 00 00 00 01 01 01 01 01 01 01 01 01 01
01 01 01 01 01 01 bc 1b 00 a0 50 20 17 30 30 20
36 00 30 be 10 00 00 18 bc 1b 00 a0 50 20 17 30
30 20 36 00 30 be 10 00 00 00 00 00 00 fe 00 47
39 36 35 33 01 31 34 31 57 58 31 0a 00 00 00 fe
00 2f 3f 4f 57 7f 9f b7 df 01 01 0a 20 20 00 89

----------------

Block 0, Base EDID:
  EDID Structure Version & Revision: 1.3
  Vendor & Product Identification:
    Manufacturer: LPL
    Model: 0
    Made in: 2005
  Basic Display Parameters & Features:
    Digital display
    Maximum image size: 30 cm x 19 cm
    Gamma: 2.20
    RGB color display
    First detailed timing is the preferred timing
  Color Characteristics:
    Red  : 0.5810, 0.3437
    Green: 0.3251, 0.5468
    Blue : 0.1572, 0.1367
    White: 0.3125, 0.3281
  Established Timings I & II: none
  Standard Timings: none
  Detailed Timing Descriptors:
    DTD 1:  1280x800    59.910 Hz   8:5    49.306 kHz  71.000 MHz (304 mm x 190 mm)
                 Hfront   48 Hsync  32 Hback  80 Hpol N
                 Vfront    3 Vsync   6 Vback  14 Vpol N
    DTD 2:  1280x800    59.910 Hz   8:5    49.306 kHz  71.000 MHz (304 mm x 190 mm)
                 Hfront   48 Hsync  32 Hback  80 Hpol N
                 Vfront    3 Vsync   6 Vback  14 Vpol N
    SPWG Module Revision: 0
    SPWG Descriptor #3:
      SPWG PC Maker P/N: 'G9653'
      SPWG LCD Supplier EEDID Revision: 1
      SPWG Manufacturer P/N: '141WX1'
    SPWG Descriptor #4:
      SMBUS Values: 0x2f 0x3f 0x4f 0x57 0x7f 0x9f 0xb7 0xdf
      LVDS Channels: 1
      Panel Self Test Present
Checksum: 0x89

----------------

Failures:

Block 0, Base EDID:
  Missing Display Product Name.
  Missing Display Range Limits Descriptor.

EDID conformity: FAIL
