edid-decode (hex):

00 ff ff ff ff ff ff 00 32 0c 00 00 00 00 00 00
00 0f 01 02 80 25 17 78 0a 8e f0 97 58 51 8d 28
24 50 54 00 00 00 01 01 01 01 01 01 01 01 01 01
01 01 01 01 01 01 95 25 a0 40 51 84 0c 30 40 20
33 00 6f e6 10 00 00 18 00 00 00 00 00 00 00 00
00 00 00 00 00 00 00 00 00 00 00 00 00 fe 00 4c
47 50 68 69 6c 69 70 73 4c 43 44 0a 00 00 00 fe
00 4c 50 31 37 31 57 58 32 2d 41 34 4b 37 00 f3

----------------

Block 0, Base EDID:
  EDID Structure Version & Revision: 1.2
  Vendor & Product Identification:
    Manufacturer: LPL
    Model: 0
    Made in: 2005
  Basic Display Parameters & Features:
    Digital display
    Maximum image size: 37 cm x 23 cm
    Gamma: 2.20
    RGB color display
    First detailed timing is preferred timing
  Color Characteristics:
    Red  : 0.5917, 0.3437
    Green: 0.3193, 0.5527
    Blue : 0.1591, 0.1435
    White: 0.3125, 0.3281
  Established Timings I & II: none
  Standard Timings: none
  Detailed Timing Descriptors:
    DTD 1:  1440x900    59.939 Hz   8:5    54.665 kHz  96.210 MHz (367 mm x 230 mm)
                 Hfront   64 Hsync  32 Hback 224 Hpol N
                 Vfront    3 Vsync   3 Vback   6 Vpol N
    Empty Descriptor
    Alphanumeric Data String: 'LGPhilipsLCD'
    Alphanumeric Data String: 'LP171WX2-A4K7'
Checksum: 0xf3
