edid-decode (hex):

00 ff ff ff ff ff ff 00 32 0c 00 00 00 00 00 00
00 0f 01 03 80 1e 13 78 0a ae 10 96 58 53 8c 28
24 50 54 00 00 00 01 01 01 01 01 01 01 01 01 01
01 01 01 01 01 01 b9 22 a0 a0 50 84 1a 30 30 20
36 00 30 be 10 00 00 18 b9 22 a0 a0 50 84 1a 30
30 20 36 00 30 be 10 00 00 00 00 00 00 fe 00 48
43 39 34 38 03 31 34 31 57 50 31 0a 00 00 00 fe
00 1f 2f 37 3f 6f 87 9f d7 02 01 0a 20 20 00 41

----------------

Block 0, Base EDID:
  EDID Structure Version & Revision: 1.3
  Vendor & Product Identification:
    Manufacturer: LPL
    Model: 0
    Made in: 2005
  Basic Display Parameters & Features:
    Digital display
    Maximum image size: 30 cm x 19 cm
    Gamma: 2.20
    RGB color display
    First detailed timing is the preferred timing
  Color Characteristics:
    Red  : 0.5878, 0.3457
    Green: 0.3271, 0.5488
    Blue : 0.1562, 0.1416
    White: 0.3125, 0.3281
  Established Timings I & II: none
  Standard Timings: none
  Detailed Timing Descriptors:
    DTD 1:  1440x900    59.996 Hz   8:5    55.556 kHz  88.890 MHz (304 mm x 190 mm)
                 Hfront   48 Hsync  32 Hback  80 Hpol N
                 Vfront    3 Vsync   6 Vback  17 Vpol N
    DTD 2:  1440x900    59.996 Hz   8:5    55.556 kHz  88.890 MHz (304 mm x 190 mm)
                 Hfront   48 Hsync  32 Hback  80 Hpol N
                 Vfront    3 Vsync   6 Vback  17 Vpol N
    SPWG Module Revision: 0
    SPWG Descriptor #3:
      SPWG PC Maker P/N: 'HC948'
      SPWG LCD Supplier EEDID Revision: 3
      SPWG Manufacturer P/N: '141WP1'
    SPWG Descriptor #4:
      SMBUS Values: 0x1f 0x2f 0x37 0x3f 0x6f 0x87 0x9f 0xd7
      LVDS Channels: 2
      Panel Self Test Present
Checksum: 0x41

----------------

Failures:

Block 0, Base EDID:
  Missing Display Product Name.
  Missing Display Range Limits Descriptor.

EDID conformity: FAIL
