
EDID (hex):
00ffffffffffff0009e5fe0600000000
011a0104a51f1178028631a3544e9b25
0e505400000001010101010101010101
0101010101013c3780de703814403c20
360035ad1000001a302c80de70381440
3020360035ad1000001a000000fe0042
4f452043510a202020202020000000fe
00485631343046484d2d4e35310a002b

Extracted contents:
header:          00 ff ff ff ff ff ff 00
serial number:   09 e5 fe 06 00 00 00 00 01 1a
version:         01 04
basic params:    a5 1f 11 78 02
chroma info:     86 31 a3 54 4e 9b 25 0e 50 54
established:     00 00 00
standard:        01 01 01 01 01 01 01 01 01 01 01 01 01 01 01 01
descriptor 1:    3c 37 80 de 70 38 14 40 3c 20 36 00 35 ad 10 00 00 1a
descriptor 2:    30 2c 80 de 70 38 14 40 30 20 36 00 35 ad 10 00 00 1a
descriptor 3:    00 00 00 fe 00 42 4f 45 20 43 51 0a 20 20 20 20 20 20
descriptor 4:    00 00 00 fe 00 48 56 31 34 30 46 48 4d 2d 4e 35 31 0a
extensions:      00
checksum:        2b

EDID version: 1.4
Manufacturer: BOE Model 6fe Serial Number --
Made in week 1 of 2016
Digital display
8 bits per primary color channel
DisplayPort interface
Maximum image size: 31 cm x 17 cm
Gamma: 2.20
Supported color formats: RGB 4:4:4
First detailed timing includes the native pixel format and preferred refresh rate
Display x,y Chromaticity:
  Red:   0.6386, 0.3281
  Green: 0.3056, 0.6074
  Blue:  0.1445, 0.0576
  White: 0.3125, 0.3291
Established timings supported:
Standard timings supported:
Detailed mode: Clock 141.400 MHz, 309 mm x 173 mm
               1920 1980 2012 2142 hborder 0
               1080 1083 1089 1100 vborder 0
               +hsync -vsync 
               VertFreq: 60 Hz, HorFreq: 66013 Hz
Detailed mode: Clock 113.120 MHz, 309 mm x 173 mm
               1920 1968 2000 2142 hborder 0
               1080 1083 1089 1100 vborder 0
               +hsync -vsync 
               VertFreq: 48 Hz, HorFreq: 52810 Hz
ASCII string: BOE CQ
ASCII string: HV140FHM-N51
Checksum: 0x2b (valid)
EDID block does NOT conform to EDID 1.4!
	Missing name descriptor
	Missing monitor ranges
