edid-decode (hex):

00 ff ff ff ff ff ff 00 0d ae 37 17 00 00 00 00
11 18 01 04 95 26 15 78 02 d4 95 a3 55 50 9d 27
0f 50 54 00 00 00 01 01 01 01 01 01 01 01 01 01
01 01 01 01 01 01 b4 3b 80 4a 71 38 34 40 30 20
35 00 7d d6 10 00 00 18 00 00 00 fe 00 4e 31 37
33 48 47 45 2d 45 32 31 0a 20 00 00 00 fe 00 43
4d 4e 0a 20 20 20 20 20 20 20 20 20 00 00 00 fe
00 4e 31 37 33 48 47 45 2d 45 32 31 0a 20 00 fd

----------------

Block 0, Base EDID:
  EDID Structure Version & Revision: 1.4
  Vendor & Product Identification:
    Manufacturer: CMN
    Model: 5943
    Made in: week 17 of 2014
  Basic Display Parameters & Features:
    Digital display
    Bits per primary color channel: 6
    DisplayPort interface
    Maximum image size: 38 cm x 21 cm
    Gamma: 2.20
    Supported color formats: RGB 4:4:4
    First detailed timing includes the native pixel format and preferred refresh rate
  Color Characteristics:
    Red  : 0.6396, 0.3330
    Green: 0.3134, 0.6132
    Blue : 0.1542, 0.0595
    White: 0.3134, 0.3291
  Established Timings I & II: none
  Standard Timings: none
  Detailed Timing Descriptors:
    DTD 1:  1920x1080   60.007852 Hz  16:9     67.929 kHz    152.840000 MHz (381 mm x 214 mm)
                 Hfront   48 Hsync  32 Hback  250 Hpol N
                 Vfront    3 Vsync   5 Vback   44 Vpol N
    Alphanumeric Data String: 'N173HGE-E21'
    Alphanumeric Data String: 'CMN'
    Alphanumeric Data String: 'N173HGE-E21'
Checksum: 0xfd

----------------

Warnings:

Block 0, Base EDID:
  Missing Display Product Name.

EDID conformity: PASS
