
EDID (hex):
00ffffffffffff000e14c71400000000
1d150103802213780a4e4d9e57549126
0f505400000001010101010101010101
010101010101781d56c2500026303b27
360058c210000018781d56c250002630
3b27360058c210000018000000fe0043
50540a20202020202020202000000000
00434c414131353657423131412000cc

Extracted contents:
header:          00 ff ff ff ff ff ff 00
serial number:   0e 14 c7 14 00 00 00 00 1d 15
version:         01 03
basic params:    80 22 13 78 0a
chroma info:     4e 4d 9e 57 54 91 26 0f 50 54
established:     00 00 00
standard:        01 01 01 01 01 01 01 01 01 01 01 01 01 01 01 01
descriptor 1:    78 1d 56 c2 50 00 26 30 3b 27 36 00 58 c2 10 00 00 18
descriptor 2:    78 1d 56 c2 50 00 26 30 3b 27 36 00 58 c2 10 00 00 18
descriptor 3:    00 00 00 fe 00 43 50 54 0a 20 20 20 20 20 20 20 20 20
descriptor 4:    00 00 00 00 00 43 4c 41 41 31 35 36 57 42 31 31 41 20
extensions:      00
checksum:        cc

EDID version: 1.3
Manufacturer: CPT Model 14c7 Serial Number --
Made in week 29 of 2011
Digital display
Maximum image size: 34 cm x 19 cm
Gamma: 2.20
RGB color display
First detailed timing is preferred timing
Display x,y Chromaticity:
  Red:   0.6181, 0.3398
  Green: 0.3310, 0.5683
  Blue:  0.1494, 0.0585
  White: 0.3154, 0.3291
Established timings supported:
Standard timings supported:
Detailed mode: Clock 75.440 MHz, 344 mm x 194 mm
               1366 1425 1464 1560 hborder 0
                768  771  777  806 vborder 0
               -hsync -vsync 
               VertFreq: 59 Hz, HorFreq: 48358 Hz
Detailed mode: Clock 75.440 MHz, 344 mm x 194 mm
               1366 1425 1464 1560 hborder 0
                768  771  777  806 vborder 0
               -hsync -vsync 
               VertFreq: 59 Hz, HorFreq: 48358 Hz
ASCII string: CPT
Manufacturer-specified data, tag 0
Checksum: 0xcc (valid)
EDID block does NOT conform to EDID 1.3!
	Missing name descriptor
	Missing monitor ranges
