
EDID (hex):
00ffffffffffff005ef72c2801010101
131b010380301b78eefff5a556499d24
16505400000001010101010101010101
010101010101023a801871382d40582c
4500df0d1100001e000000fc005a4e32
343249460a2020202020000000fc000a
202020202020202020202020000000fc
000a20202020202020202020202000e4

Extracted contents:
header:          00 ff ff ff ff ff ff 00
serial number:   5e f7 2c 28 01 01 01 01 13 1b
version:         01 03
basic params:    80 30 1b 78 ee
chroma info:     ff f5 a5 56 49 9d 24 16 50 54
established:     00 00 00
standard:        01 01 01 01 01 01 01 01 01 01 01 01 01 01 01 01
descriptor 1:    02 3a 80 18 71 38 2d 40 58 2c 45 00 df 0d 11 00 00 1e
descriptor 2:    00 00 00 fc 00 5a 4e 32 34 32 49 46 0a 20 20 20 20 20
descriptor 3:    00 00 00 fc 00 0a 20 20 20 20 20 20 20 20 20 20 20 20
descriptor 4:    00 00 00 fc 00 0a 20 20 20 20 20 20 20 20 20 20 20 20
extensions:      00
checksum:        e4

EDID version: 1.3
Manufacturer: WWW Model 282c Serial Number --
Made in week 19 of 2017
Digital display
Maximum image size: 48 cm x 27 cm
Gamma: 2.20
DPMS levels: Standby Suspend Off
RGB color display
Default (sRGB) color space is primary color space
First detailed timing is preferred timing
Display x,y Chromaticity:
  Red:   0.6474, 0.3388
  Green: 0.2880, 0.6162
  Blue:  0.1435, 0.0888
  White: 0.3134, 0.3291
Established timings supported:
Standard timings supported:
Detailed mode: Clock 148.500 MHz, 479 mm x 269 mm
               1920 2008 2052 2200 hborder 0
               1080 1084 1089 1125 vborder 0
               +hsync +vsync 
               VertFreq: 60 Hz, HorFreq: 67500 Hz
Monitor name: ZN242IF
Checksum: 0xe4 (valid)
EDID block does NOT conform to EDID 1.3!
	sRGB is signaled, but the chromaticities do not match
	Missing monitor ranges


