
EDID (hex):
00ffffffffffff004c2d350d33475230
1f1c0104a54627783a64a5a4544d9a26
0f5054230800b30081c0810081809500
a9c001010101023a801871382d40582c
4500ba892100001e000000fd00383c1e
5111000a202020202020000000fc0043
3332463339310a2020202020000000ff
004854484b3730303231340a2020011f
02030ff1429004230907078301000001
1d007251d01e206e285500ba89210000
1e000000000000000000000000000000
00000000000000000000000000000000
00000000000000000000000000000000
00000000000000000000000000000000
00000000000000000000000000000000
0000000000000000000000000000000b

Extracted contents:
header:          00 ff ff ff ff ff ff 00
serial number:   4c 2d 35 0d 33 47 52 30 1f 1c
version:         01 04
basic params:    a5 46 27 78 3a
chroma info:     64 a5 a4 54 4d 9a 26 0f 50 54
established:     23 08 00
standard:        b3 00 81 c0 81 00 81 80 95 00 a9 c0 01 01 01 01
descriptor 1:    02 3a 80 18 71 38 2d 40 58 2c 45 00 ba 89 21 00 00 1e
descriptor 2:    00 00 00 fd 00 38 3c 1e 51 11 00 0a 20 20 20 20 20 20
descriptor 3:    00 00 00 fc 00 43 33 32 46 33 39 31 0a 20 20 20 20 20
descriptor 4:    00 00 00 ff 00 48 54 48 4b 37 30 30 32 31 34 0a 20 20
extensions:      01
checksum:        1f

EDID version: 1.4
Manufacturer: SAM Model d35 Serial Number --
Made in week 31 of 2018
Digital display
8 bits per primary color channel
DisplayPort interface
Maximum image size: 70 cm x 39 cm
Gamma: 2.20
DPMS levels: Off
Supported color formats: RGB 4:4:4, YCrCb 4:4:4, YCrCb 4:2:2
First detailed timing includes the native pixel format and preferred refresh rate
Display x,y Chromaticity:
  Red:   0.6416, 0.3300
  Green: 0.3017, 0.6015
  Blue:  0.1503, 0.0605
  White: 0.3134, 0.3291
Established timings supported:
  640x480@60Hz 4:3 HorFreq: 31469 Hz Clock: 25.175 MHz
  800x600@56Hz 4:3 HorFreq: 35200 Hz Clock: 36.000 MHz
  800x600@60Hz 4:3 HorFreq: 37900 Hz Clock: 40.000 MHz
  1024x768@60Hz 4:3 HorFreq: 48400 Hz Clock: 65.000 MHz
Standard timings supported:
  1680x1050@60Hz 16:10 HorFreq: 64700 Hz Clock: 119.000 MHz
  1280x720@60Hz 16:9
  1280x800@60Hz 16:10
  1280x1024@60Hz 5:4 HorFreq: 64000 Hz Clock: 108.000 MHz
  1440x900@60Hz 16:10 HorFreq: 55500 Hz Clock: 88.750 MHz
  1600x900@60Hz 16:9
Detailed mode: Clock 148.500 MHz, 698 mm x 393 mm
               1920 2008 2052 2200 hborder 0
               1080 1084 1089 1125 vborder 0
               +hsync +vsync 
               VertFreq: 60 Hz, HorFreq: 67500 Hz
Monitor ranges (GTF): 56-60Hz V, 30-81kHz H, max dotclock 170MHz
Monitor name: C32F391
Serial number: --
Has 1 extension blocks
Checksum: 0x1f (valid)

CTA extension block
Extension version: 3
11 bytes of CTA data
  Video data block
    VIC  16 1920x1080@60Hz 16:9 (native) HorFreq: 67500 Hz Clock: 148.500 MHz
    VIC   4 1280x720@60Hz 16:9  HorFreq: 45000 Hz Clock: 74.250 MHz
  Audio data block
    Linear PCM, max channels 2
      Supported sample rates (kHz): 48 44.1 32
      Supported sample sizes (bits): 24 20 16
  Speaker allocation data block
    Speaker map:
      FL/FR - Front Left/Right
Underscans PC formats by default
Basic audio support
Supports YCbCr 4:4:4
Supports YCbCr 4:2:2
1 native detailed modes
Detailed mode: Clock 74.250 MHz, 698 mm x 393 mm
               1280 1390 1430 1650 hborder 0
                720  725  730  750 vborder 0
               +hsync +vsync 
               VertFreq: 60 Hz, HorFreq: 45000 Hz
Checksum: 0xb (valid)

EDID block does not conform at all!
	Both the serial number and the serial string are set


