
EDID (hex):
00ffffffffffff00410c0cc21b650000
181e0103683c22782ae445a554529e26
0d5054bfef00d1c0b300950081808140
81c001010101023a801871382d40582c
450055502100001e000000ff00554b30
32303234303235383833000000fc0050
484c2032373545310a202020000000fd
00304b1e7215000a2020202020200085

Extracted contents:
header:          00 ff ff ff ff ff ff 00
serial number:   41 0c 0c c2 1b 65 00 00 18 1e
version:         01 03
basic params:    68 3c 22 78 2a
chroma info:     e4 45 a5 54 52 9e 26 0d 50 54
established:     bf ef 00
standard:        d1 c0 b3 00 95 00 81 80 81 40 81 c0 01 01 01 01
descriptor 1:    02 3a 80 18 71 38 2d 40 58 2c 45 00 55 50 21 00 00 1e
descriptor 2:    00 00 00 ff 00 55 4b 30 32 30 32 34 30 32 35 38 38 33
descriptor 3:    00 00 00 fc 00 50 48 4c 20 32 37 35 45 31 0a 20 20 20
descriptor 4:    00 00 00 fd 00 30 4b 1e 72 15 00 0a 20 20 20 20 20 20
extensions:      00
checksum:        85

EDID version: 1.3
Manufacturer: PHL Model c20c Serial Number --
Made in week 24 of 2020
Analog display, Input voltage level: 0.7/0.7 V
Sync: Separate 
Maximum image size: 60 cm x 34 cm
Gamma: 2.20
DPMS levels: Off
RGB color display
First detailed timing is preferred timing
Display x,y Chromaticity:
  Red:   0.6474, 0.3300
  Green: 0.3212, 0.6171
  Blue:  0.1494, 0.0507
  White: 0.3134, 0.3291
Established timings supported:
  720x400@70Hz 9:5 HorFreq: 31469 Hz Clock: 28.320 MHz
  640x480@60Hz 4:3 HorFreq: 31469 Hz Clock: 25.175 MHz
  640x480@67Hz 4:3 HorFreq: 35000 Hz Clock: 30.240 MHz
  640x480@72Hz 4:3 HorFreq: 37900 Hz Clock: 31.500 MHz
  640x480@75Hz 4:3 HorFreq: 37500 Hz Clock: 31.500 MHz
  800x600@56Hz 4:3 HorFreq: 35200 Hz Clock: 36.000 MHz
  800x600@60Hz 4:3 HorFreq: 37900 Hz Clock: 40.000 MHz
  800x600@72Hz 4:3 HorFreq: 48100 Hz Clock: 50.000 MHz
  800x600@75Hz 4:3 HorFreq: 46900 Hz Clock: 49.500 MHz
  832x624@75Hz 4:3 HorFreq: 49726 Hz Clock: 57.284 MHz
  1024x768@60Hz 4:3 HorFreq: 48400 Hz Clock: 65.000 MHz
  1024x768@70Hz 4:3 HorFreq: 56500 Hz Clock: 75.000 MHz
  1024x768@75Hz 4:3 HorFreq: 60000 Hz Clock: 78.750 MHz
  1280x1024@75Hz 5:4 HorFreq: 80000 Hz Clock: 135.000 MHz
Standard timings supported:
  1920x1080@60Hz 16:9
  1680x1050@60Hz 16:10 HorFreq: 64700 Hz Clock: 119.000 MHz
  1440x900@60Hz 16:10 HorFreq: 55500 Hz Clock: 88.750 MHz
  1280x1024@60Hz 5:4 HorFreq: 64000 Hz Clock: 108.000 MHz
  1280x960@60Hz 4:3 HorFreq: 60000 Hz Clock: 108.000 MHz
  1280x720@60Hz 16:9
Detailed mode: Clock 148.500 MHz, 597 mm x 336 mm
               1920 2008 2052 2200 hborder 0
               1080 1084 1089 1125 vborder 0
               +hsync +vsync 
               VertFreq: 60 Hz, HorFreq: 67500 Hz
Serial number: --
Monitor name: PHL 275E1
Monitor ranges (GTF): 48-75Hz V, 30-114kHz H, max dotclock 210MHz
Checksum: 0x85 (valid)
