edid-decode (hex):

00 ff ff ff ff ff ff 00 09 e5 97 08 00 00 00 00
01 1d 01 04 95 22 13 78 03 7f 99 94 5d 59 93 29
1f 4f 54 00 00 00 01 01 01 01 01 01 01 01 01 01
01 01 01 01 01 01 ce 1d 56 e2 50 00 1e 30 30 20
36 00 58 c2 10 00 00 1a d8 13 56 e2 50 00 1e 30
30 20 36 00 58 c2 10 00 00 1a 00 00 00 00 00 00
00 00 00 00 00 00 00 00 00 00 00 00 00 00 00 02
00 0c 49 ff 0a 3c 6e 0b 0c 19 6e 00 00 00 00 63

----------------

Block 0, Base EDID:
  EDID Structure Version & Revision: 1.4
  Vendor & Product Identification:
    Manufacturer: BOE
    Model: 2199
    Made in: week 1 of 2019
  Basic Display Parameters & Features:
    Digital display
    Bits per primary color channel: 6
    DisplayPort interface
    Maximum image size: 34 cm x 19 cm
    Gamma: 2.20
    Supported color formats: RGB 4:4:4
    First detailed timing includes the native pixel format and preferred refresh rate
    Display is continuous frequency
  Color Characteristics:
    Red  : 0.5791, 0.3662
    Green: 0.3505, 0.5771
    Blue : 0.1621, 0.1220
    White: 0.3105, 0.3291
  Established Timings I & II: none
  Standard Timings: none
  Detailed Timing Descriptors:
    DTD 1:  1366x768    60.059067 Hz 683:384   47.927 kHz     76.300000 MHz (344 mm x 194 mm)
                 Hfront   48 Hsync  32 Hback  146 Hpol P
                 Vfront    3 Vsync   6 Vback   21 Vpol N
    DTD 2:  1366x768    39.986902 Hz 683:384   31.910 kHz     50.800000 MHz (344 mm x 194 mm)
                 Hfront   48 Hsync  32 Hback  146 Hpol P
                 Vfront    3 Vsync   6 Vback   21 Vpol N
    Empty Descriptor
    Manufacturer-Specified Display Descriptor (0x02): 00 02 00 0c 49 ff 0a 3c 6e 0b 0c 19 6e 00 00 00 '....I..<n...n...'
Checksum: 0x63

----------------

Warnings:

Block 0, Base EDID:
  Missing Display Product Name.

Failures:

Block 0, Base EDID:
  Empty Descriptor: Use Dummy Descriptor instead of all zeroes.
  Missing Display Range Limits Descriptor.

EDID conformity: FAIL
