
EDID (hex):
00ffffffffffff0009e5510600000000
01190104951f1178028fa0925c569528
1a505400000001010101010101010101
0101010101019e1b567e500016303020
360035ad1000001a0000000000000000
0000000000000000001a000000fe0042
4f452044540a202020202020000000fe
0048423134305758312d3431310a0076

Extracted contents:
header:          00 ff ff ff ff ff ff 00
serial number:   09 e5 51 06 00 00 00 00 01 19
version:         01 04
basic params:    95 1f 11 78 02
chroma info:     8f a0 92 5c 56 95 28 1a 50 54
established:     00 00 00
standard:        01 01 01 01 01 01 01 01 01 01 01 01 01 01 01 01
descriptor 1:    9e 1b 56 7e 50 00 16 30 30 20 36 00 35 ad 10 00 00 1a
descriptor 2:    00 00 00 00 00 00 00 00 00 00 00 00 00 00 00 00 00 1a
descriptor 3:    00 00 00 fe 00 42 4f 45 20 44 54 0a 20 20 20 20 20 20
descriptor 4:    00 00 00 fe 00 48 42 31 34 30 57 58 31 2d 34 31 31 0a
extensions:      00
checksum:        76

EDID version: 1.4
Manufacturer: BOE Model 651 Serial Number --
Made in week 1 of 2015
Digital display
6 bits per primary color channel
DisplayPort interface
Maximum image size: 31 cm x 17 cm
Gamma: 2.20
Supported color formats: RGB 4:4:4
First detailed timing includes the native pixel format and preferred refresh rate
Display x,y Chromaticity:
  Red:   0.5722, 0.3593
  Green: 0.3388, 0.5849
  Blue:  0.1582, 0.1035
  White: 0.3125, 0.3281
Established timings supported:
Standard timings supported:
Detailed mode: Clock 70.700 MHz, 309 mm x 173 mm
               1366 1414 1446 1492 hborder 0
                768  771  777  790 vborder 0
               +hsync -vsync 
               VertFreq: 59 Hz, HorFreq: 47386 Hz
Manufacturer-specified data, tag 0
ASCII string: BOE DT
ASCII string: HB140WX1-411
Checksum: 0x76 (valid)
EDID block does NOT conform to EDID 1.4!
	Missing name descriptor
	Missing monitor ranges
