edid-decode (hex):

00 ff ff ff ff ff ff 00 06 af 6c 10 00 00 00 00
00 17 01 04 95 1c 10 78 02 bb f5 94 55 54 90 27
23 50 54 00 00 00 01 01 01 01 01 01 01 01 01 01
01 01 01 01 01 01 c4 1d 56 e0 50 00 1e 30 26 16
36 00 15 9c 10 00 00 1a c4 1d 56 6e 52 00 1e 30
26 16 36 00 15 9c 10 00 00 1a 00 00 00 fe 00 56
30 32 32 50 80 42 31 32 35 58 54 4e 00 00 00 00
00 01 41 21 94 00 01 00 00 09 01 0a 20 20 00 97

----------------

Block 0, Base EDID:
  EDID Structure Version & Revision: 1.4
  Vendor & Product Identification:
    Manufacturer: AUO
    Model: 4204
    Made in: 2013
  Basic Display Parameters & Features:
    Digital display
    Bits per primary color channel: 6
    DisplayPort interface
    Maximum image size: 28 cm x 16 cm
    Gamma: 2.20
    Supported color formats: RGB 4:4:4
    First detailed timing includes the native pixel format and preferred refresh rate
  Color Characteristics:
    Red  : 0.5800, 0.3349
    Green: 0.3300, 0.5654
    Blue : 0.1552, 0.1396
    White: 0.3134, 0.3291
  Established Timings I & II: none
  Standard Timings: none
  Detailed Timing Descriptors:
    DTD 1:  1366x768    60.055800 Hz 683:384   47.925 kHz     76.200000 MHz (277 mm x 156 mm)
                 Hfront   38 Hsync  22 Hback  164 Hpol P
                 Vfront    3 Vsync   6 Vback   21 Vpol N
    DTD 2:  1366x768    48.032556 Hz 683:384   38.330 kHz     76.200000 MHz (277 mm x 156 mm)
                 Hfront   38 Hsync  22 Hback  562 Hpol P
                 Vfront    3 Vsync   6 Vback   21 Vpol N
    Alphanumeric Data String: 'V022P'
    Manufacturer-Specified Display Descriptor (0x00): 00 00 00 01 41 21 94 00 01 00 00 09 01 0a 20 20 '....A!........  '
Checksum: 0x97

----------------

Failures:

Block 0, Base EDID:
  Alphanumeric Data String: Non-printable character.
  Missing Display Product Name.

EDID conformity: FAIL
