edid-decode (hex):

00 ff ff ff ff ff ff 00 22 f0 f0 26 01 01 01 01
19 13 01 03 6e 29 1a 78 ee dc 55 a3 59 48 9e 24
11 50 54 a5 6b 80 95 00 71 00 81 40 81 80 01 01
01 01 01 01 01 01 9a 29 a0 d0 51 84 22 30 50 98
36 00 9a 00 11 00 00 1c 00 00 00 fd 00 32 4c 18
53 0e 00 0a 20 20 20 20 20 20 00 00 00 fc 00 48
50 20 4c 31 39 30 38 77 0a 20 20 20 00 00 00 ff
00 33 43 51 39 32 35 31 48 4b 31 0a 20 20 00 f2

00 ff ff ff ff ff ff 00 22 f0 f0 26 01 01 01 01
19 13 01 03 6e 29 1a 78 ee dc 55 a3 59 48 9e 24
11 50 54 a5 6b 80 95 00 71 00 81 40 81 80 01 01
01 01 01 01 01 01 9a 29 a0 d0 51 84 22 30 50 98
36 00 9a 00 11 00 00 1c 00 00 00 fd 00 32 4c 18
53 0e 00 0a 20 20 20 20 20 20 00 00 00 fc 00 48
50 20 4c 31 39 30 38 77 0a 20 20 20 00 00 00 ff
00 33 43 51 39 32 35 31 48 4b 31 0a 20 20 00 f2

----------------

Block 0, Base EDID:
  EDID Structure Version & Revision: 1.3
  Vendor & Product Identification:
    Manufacturer: HWP
    Model: 9968
    Serial Number: ...
    Made in: week 25 of 2009
  Basic Display Parameters & Features:
    Analog display
    Signal Level Standard: 0.700 : 0.000 : 0.700 V p-p
    Blank level equals black level
    Sync: Separate Composite SyncOnGreen
    Maximum image size: 41 cm x 26 cm
    Gamma: 2.20
    DPMS levels: Standby Suspend Off
    RGB color display
    Default (sRGB) color space is primary color space
    First detailed timing is the preferred timing
  Color Characteristics:
    Red  : 0.6396, 0.3486
    Green: 0.2841, 0.6171
    Blue : 0.1416, 0.0673
    White: 0.3134, 0.3291
  Established Timings I & II:
    IBM     :   720x400    70.081663 Hz   9:5     31.467 kHz     28.320000 MHz
    DMT 0x04:   640x480    59.940476 Hz   4:3     31.469 kHz     25.175000 MHz
    DMT 0x06:   640x480    75.000000 Hz   4:3     37.500 kHz     31.500000 MHz
    DMT 0x09:   800x600    60.316541 Hz   4:3     37.879 kHz     40.000000 MHz
    DMT 0x0b:   800x600    75.000000 Hz   4:3     46.875 kHz     49.500000 MHz
    Apple   :   832x624    74.551266 Hz   4:3     49.726 kHz     57.284000 MHz
    DMT 0x10:  1024x768    60.003840 Hz   4:3     48.363 kHz     65.000000 MHz
    DMT 0x12:  1024x768    75.028582 Hz   4:3     60.023 kHz     78.750000 MHz
    DMT 0x24:  1280x1024   75.024675 Hz   5:4     79.976 kHz    135.000000 MHz
    Apple   :  1152x870    75.061550 Hz 192:145   68.681 kHz    100.000000 MHz
  Standard Timings:
    DMT 0x2f:  1440x900    59.887445 Hz  16:10    55.935 kHz    106.500000 MHz
    GTF     :  1152x720    59.999964 Hz  16:10    44.760 kHz     67.319000 MHz
    DMT 0x20:  1280x960    60.000000 Hz   4:3     60.000 kHz    108.000000 MHz
    DMT 0x23:  1280x1024   60.019740 Hz   5:4     63.981 kHz    108.000000 MHz
  Detailed Timing Descriptors:
    DTD 1:  1440x900    59.887445 Hz  16:10    55.935 kHz    106.500000 MHz (410 mm x 256 mm)
                 Hfront   80 Hsync 152 Hback  232 Hpol N
                 Vfront    3 Vsync   6 Vback   25 Vpol P
    Display Range Limits:
      Monitor ranges (GTF): 50-76 Hz V, 24-83 kHz H, max dotclock 140 MHz
    Display Product Name: 'HP L1908w'
    Display Product Serial Number: ...
Checksum: 0xf2

----------------

Block 1, Unknown EDID Extension Block 0x00:
  00 ff ff ff ff ff ff 00 22 f0 f0 26 01 01 01 01 '........"..&....'
  19 13 01 03 6e 29 1a 78 ee dc 55 a3 59 48 9e 24 '....n).x..U.YH.$'
  11 50 54 a5 6b 80 95 00 71 00 81 40 81 80 01 01 '.PT.k...q..@....'
  01 01 01 01 01 01 9a 29 a0 d0 51 84 22 30 50 98 '.......)..Q."0P.'
  36 00 9a 00 11 00 00 1c 00 00 00 fd 00 32 4c 18 '6............2L.'
  53 0e 00 0a 20 20 20 20 20 20 00 00 00 fc 00 48 'S...      .....H'
  50 20 4c 31 39 30 38 77 0a 20 20 20 00 00 00 ff 'P L1908w.   ....'
  00 33 43 51 39 32 35 31 48 4b 31 0a 20 20 00 f2 '.3CQ9251HK1.  ..'
Checksum: 0xf2

----------------

Failures:

Block 0, Base EDID:
  Basic Display Parameters & Features: sRGB is signaled, but the chromaticities do not match.
Block 1, Base EDID:
  Unknown Extension Block.
EDID:
  Base EDID: EDID specified 0 extension block(s), but found 1 extension block(s).

EDID conformity: FAIL
