edid-decode (hex):

00 ff ff ff ff ff ff 00 34 38 04 06 30 00 00 00
05 0a 01 03 81 1e 17 78 ea 4e e0 a1 57 4c 99 23
19 52 57 bf ee 00 31 40 31 4f 45 4f 61 40 61 4f
01 01 01 01 01 01 64 19 00 40 41 00 26 30 18 88
36 00 33 e6 10 00 00 18 00 00 00 ff 00 30 30 30
34 38 0a 20 20 20 20 20 20 20 00 00 00 fc 00 42
65 6c 69 6e 65 61 31 30 31 35 34 30 00 00 00 fd
00 38 4b 1e 3d 08 00 0a 20 20 20 20 20 20 00 e8

00 ff ff ff ff ff ff 00 34 38 04 06 30 00 00 00
05 0a 01 03 81 1e 17 78 ea 4e e0 a1 57 4c 99 23
19 52 57 bf ee 00 31 40 31 4f 45 4f 61 40 61 4f
01 01 01 01 01 01 64 19 00 40 41 00 26 30 18 88
36 00 33 e6 10 00 00 18 00 00 00 ff 00 30 30 30
34 38 0a 20 20 20 20 20 20 20 00 00 00 fc 00 42
65 6c 69 6e 65 61 31 30 31 35 34 30 00 00 00 fd
00 38 4b 1e 3d 08 00 0a 20 20 20 20 20 20 00 e8

----------------

Block 0, Base EDID:
  EDID Structure Version & Revision: 1.3
  Vendor & Product Identification:
    Manufacturer: MAX
    Model: 1540
    Serial Number: ...
    Made in: week 5 of 2000
  Basic Display Parameters & Features:
    Digital display
    DFP 1.x compatible TMDS
    Maximum image size: 30 cm x 23 cm
    Gamma: 2.20
    DPMS levels: Standby Suspend Off
    RGB color display
    First detailed timing is the preferred timing
  Color Characteristics:
    Red  : 0.6298, 0.3398
    Green: 0.2998, 0.5996
    Blue : 0.1396, 0.0996
    White: 0.3203, 0.3398
  Established Timings I & II:
    IBM     :   720x400    70.081663 Hz   9:5     31.467 kHz     28.320000 MHz
    DMT 0x04:   640x480    59.940476 Hz   4:3     31.469 kHz     25.175000 MHz
    Apple   :   640x480    66.666667 Hz   4:3     35.000 kHz     30.240000 MHz
    DMT 0x05:   640x480    72.808802 Hz   4:3     37.861 kHz     31.500000 MHz
    DMT 0x06:   640x480    75.000000 Hz   4:3     37.500 kHz     31.500000 MHz
    DMT 0x08:   800x600    56.250000 Hz   4:3     35.156 kHz     36.000000 MHz
    DMT 0x09:   800x600    60.316541 Hz   4:3     37.879 kHz     40.000000 MHz
    DMT 0x0a:   800x600    72.187572 Hz   4:3     48.077 kHz     50.000000 MHz
    DMT 0x0b:   800x600    75.000000 Hz   4:3     46.875 kHz     49.500000 MHz
    Apple   :   832x624    74.551266 Hz   4:3     49.726 kHz     57.284000 MHz
    DMT 0x10:  1024x768    60.003840 Hz   4:3     48.363 kHz     65.000000 MHz
    DMT 0x11:  1024x768    70.069359 Hz   4:3     56.476 kHz     75.000000 MHz
    DMT 0x12:  1024x768    75.028582 Hz   4:3     60.023 kHz     78.750000 MHz
  Standard Timings:
    DMT 0x04:   640x480    59.940476 Hz   4:3     31.469 kHz     25.175000 MHz
    DMT 0x06:   640x480    75.000000 Hz   4:3     37.500 kHz     31.500000 MHz
    DMT 0x0b:   800x600    75.000000 Hz   4:3     46.875 kHz     49.500000 MHz
    DMT 0x10:  1024x768    60.003840 Hz   4:3     48.363 kHz     65.000000 MHz
    DMT 0x12:  1024x768    75.028582 Hz   4:3     60.023 kHz     78.750000 MHz
  Detailed Timing Descriptors:
    DTD 1:  1024x768    60.003840 Hz   4:3     48.363 kHz     65.000000 MHz (307 mm x 230 mm)
                 Hfront   24 Hsync 136 Hback  160 Hpol N
                 Vfront    3 Vsync   6 Vback   29 Vpol N
    Display Product Serial Number: ...
    Display Product Name: 'Belinea101540'
    Display Range Limits:
      Monitor ranges (GTF): 56-75 Hz V, 30-61 kHz H, max dotclock 80 MHz
Checksum: 0xe8

----------------

Block 1, Unknown EDID Extension Block 0x00:
  00 ff ff ff ff ff ff 00 34 38 04 06 30 00 00 00 '........48..0...'
  05 0a 01 03 81 1e 17 78 ea 4e e0 a1 57 4c 99 23 '.......x.N..WL.#'
  19 52 57 bf ee 00 31 40 31 4f 45 4f 61 40 61 4f '.RW...1@1OEOa@aO'
  01 01 01 01 01 01 64 19 00 40 41 00 26 30 18 88 '......d..@A.&0..'
  36 00 33 e6 10 00 00 18 00 00 00 ff 00 30 30 30 '6.3..........000'
  34 38 0a 20 20 20 20 20 20 20 00 00 00 fc 00 42 '48.       .....B'
  65 6c 69 6e 65 61 31 30 31 35 34 30 00 00 00 fd 'elinea101540....'
  00 38 4b 1e 3d 08 00 0a 20 20 20 20 20 20 00 e8 '.8K.=...      ..'
Checksum: 0xe8

----------------

Failures:

Block 1, Base EDID:
  Unknown Extension Block.
EDID:
  Base EDID: EDID specified 0 extension block(s), but found 1 extension block(s).

EDID conformity: FAIL
