edid-decode (hex):

00 ff ff ff ff ff ff 00 4c a3 25 a8 01 01 01 01
1b 21 01 03 80 dd 7d 78 0e de 50 a3 54 4c 99 26
0f 50 54 21 08 00 81 40 81 80 90 40 95 00 a9 c0
a9 40 b3 00 e1 40 04 74 00 30 f2 70 5a 80 b0 58
8a 00 40 84 63 00 00 1e 02 3a 80 18 71 38 2d 40
58 2c 45 00 40 84 63 00 00 1e 00 00 00 fd 00 18
3c 0f 87 1e 00 0a 20 20 20 20 20 20 00 00 00 fc
00 45 50 53 4f 4e 20 50 4a 0a 20 20 20 20 01 05

02 03 43 f1 52 5f 5e 5d 62 5a 10 1f 22 20 05 14
04 13 12 11 03 02 01 23 09 07 07 72 03 0c 00 10
00 b8 3c e0 4c 4c 4c 4c 00 80 01 02 03 04 83 01
00 00 e2 00 fb e3 05 c0 00 e3 06 0d 01 e5 0e 60
61 65 66 66 21 56 aa 51 00 1e 30 46 8f 33 00 40
84 63 00 00 1e 9e 20 00 90 51 20 1f 30 48 80 36
00 40 84 63 00 00 1c 28 3c 80 a0 70 b0 23 40 30
20 36 00 40 84 63 00 00 1a 00 00 00 00 00 00 6d

00 ff ff ff ff ff ff 00 4c a3 25 a8 01 01 01 01
1b 21 01 03 80 dd 7d 78 0e de 50 a3 54 4c 99 26
0f 50 54 21 08 00 81 40 81 80 90 40 95 00 a9 c0
a9 40 b3 00 e1 40 04 74 00 30 f2 70 5a 80 b0 58
8a 00 40 84 63 00 00 1e 02 3a 80 18 71 38 2d 40
58 2c 45 00 40 84 63 00 00 1e 00 00 00 fd 00 18
3c 0f 87 1e 00 0a 20 20 20 20 20 20 00 00 00 fc
00 45 50 53 4f 4e 20 50 4a 0a 20 20 20 20 01 05

02 03 43 f1 52 5f 5e 5d 62 5a 10 1f 22 20 05 14
04 13 12 11 03 02 01 23 09 07 07 72 03 0c 00 10
00 b8 3c e0 4c 4c 4c 4c 00 80 01 02 03 04 83 01
00 00 e2 00 fb e3 05 c0 00 e3 06 0d 01 e5 0e 60
61 65 66 66 21 56 aa 51 00 1e 30 46 8f 33 00 40
84 63 00 00 1e 9e 20 00 90 51 20 1f 30 48 80 36
00 40 84 63 00 00 1c 28 3c 80 a0 70 b0 23 40 30
20 36 00 40 84 63 00 00 1a 00 00 00 00 00 00 6d

----------------

Block 0, Base EDID:
  EDID Structure Version & Revision: 1.3
  Vendor & Product Identification:
    Manufacturer: SEC
    Model: 43045
    Serial Number: ...
    Made in: week 27 of 2023
  Basic Display Parameters & Features:
    Digital display
    Maximum image size: 221 cm x 125 cm
    Gamma: 2.20
    RGB color display
    Default (sRGB) color space is primary color space
    First detailed timing is the preferred timing
  Color Characteristics:
    Red  : 0.6396, 0.3291
    Green: 0.2998, 0.5996
    Blue : 0.1494, 0.0595
    White: 0.3125, 0.3281
  Established Timings I & II:
    DMT 0x04:   640x480    59.940476 Hz   4:3     31.469 kHz     25.175000 MHz
    DMT 0x09:   800x600    60.316541 Hz   4:3     37.879 kHz     40.000000 MHz
    DMT 0x10:  1024x768    60.003840 Hz   4:3     48.363 kHz     65.000000 MHz
  Standard Timings:
    DMT 0x20:  1280x960    60.000000 Hz   4:3     60.000 kHz    108.000000 MHz
    DMT 0x23:  1280x1024   60.019740 Hz   5:4     63.981 kHz    108.000000 MHz
    DMT 0x2a:  1400x1050   59.978442 Hz   4:3     65.317 kHz    121.750000 MHz
    DMT 0x2f:  1440x900    59.887445 Hz  16:10    55.935 kHz    106.500000 MHz
    DMT 0x53:  1600x900    60.000000 Hz  16:9     60.000 kHz    108.000000 MHz (RB)
    DMT 0x33:  1600x1200   60.000000 Hz   4:3     75.000 kHz    162.000000 MHz
    DMT 0x3a:  1680x1050   59.954250 Hz  16:10    65.290 kHz    146.250000 MHz
    GTF     :  2048x1536   60.000000 Hz   4:3     95.340 kHz    266.952000 MHz
  Detailed Timing Descriptors:
    DTD 1:  3840x2160   30.000000 Hz  16:9     67.500 kHz    297.000000 MHz (1600 mm x 900 mm)
                 Hfront  176 Hsync  88 Hback  296 Hpol P
                 Vfront    8 Vsync  10 Vback   72 Vpol P
    DTD 2:  1920x1080   60.000000 Hz  16:9     67.500 kHz    148.500000 MHz (1600 mm x 900 mm)
                 Hfront   88 Hsync  44 Hback  148 Hpol P
                 Vfront    4 Vsync   5 Vback   36 Vpol P
    Display Range Limits:
      Monitor ranges (GTF): 24-60 Hz V, 15-135 kHz H, max dotclock 300 MHz
    Display Product Name: 'EPSON PJ'
  Extension blocks: 1
Checksum: 0x05

----------------

Block 1, CTA-861 Extension Block:
  Revision: 3
  Underscans IT Video Formats by default
  Basic audio support
  Supports YCbCr 4:4:4
  Supports YCbCr 4:2:2
  Native detailed modes: 1
  Video Data Block:
    VIC  95:  3840x2160   30.000000 Hz  16:9     67.500 kHz    297.000000 MHz
    VIC  94:  3840x2160   25.000000 Hz  16:9     56.250 kHz    297.000000 MHz
    VIC  93:  3840x2160   24.000000 Hz  16:9     54.000 kHz    297.000000 MHz
    VIC  98:  4096x2160   24.000000 Hz 256:135   54.000 kHz    297.000000 MHz
    VIC  90:  2560x1080   60.000000 Hz  64:27    66.000 kHz    198.000000 MHz
    VIC  16:  1920x1080   60.000000 Hz  16:9     67.500 kHz    148.500000 MHz
    VIC  31:  1920x1080   50.000000 Hz  16:9     56.250 kHz    148.500000 MHz
    VIC  34:  1920x1080   30.000000 Hz  16:9     33.750 kHz     74.250000 MHz
    VIC  32:  1920x1080   24.000000 Hz  16:9     27.000 kHz     74.250000 MHz
    VIC   5:  1920x1080i  60.000000 Hz  16:9     33.750 kHz     74.250000 MHz
    VIC  20:  1920x1080i  50.000000 Hz  16:9     28.125 kHz     74.250000 MHz
    VIC   4:  1280x720    60.000000 Hz  16:9     45.000 kHz     74.250000 MHz
    VIC  19:  1280x720    50.000000 Hz  16:9     37.500 kHz     74.250000 MHz
    VIC  18:   720x576    50.000000 Hz  16:9     31.250 kHz     27.000000 MHz
    VIC  17:   720x576    50.000000 Hz   4:3     31.250 kHz     27.000000 MHz
    VIC   3:   720x480    59.940060 Hz  16:9     31.469 kHz     27.000000 MHz
    VIC   2:   720x480    59.940060 Hz   4:3     31.469 kHz     27.000000 MHz
    VIC   1:   640x480    59.940476 Hz   4:3     31.469 kHz     25.175000 MHz
  Audio Data Block:
    Linear PCM:
      Max channels: 2
      Supported sample rates (kHz): 48 44.1 32
      Supported sample sizes (bits): 24 20 16
  Vendor-Specific Data Block (HDMI), OUI 00-0C-03:
    Source physical address: 1.0.0.0
    Supports_AI
    DC_36bit
    DC_30bit
    DC_Y444
    Maximum TMDS clock: 300 MHz
    Video latency: 150 ms
    Audio latency: 150 ms
    Interlaced video latency: 150 ms
    Interlaced audio latency: 150 ms
    Extended HDMI video details:
      HDMI VICs:
        HDMI VIC 1:  3840x2160   30.000000 Hz  16:9     67.500 kHz    297.000000 MHz
        HDMI VIC 2:  3840x2160   25.000000 Hz  16:9     56.250 kHz    297.000000 MHz
        HDMI VIC 3:  3840x2160   24.000000 Hz  16:9     54.000 kHz    297.000000 MHz
        HDMI VIC 4:  4096x2160   24.000000 Hz 256:135   54.000 kHz    297.000000 MHz
  Speaker Allocation Data Block:
    FL/FR - Front Left/Right
  Video Capability Data Block:
    YCbCr quantization: Selectable (via AVI YQ)
    RGB quantization: Selectable (via AVI Q)
    PT scan behavior: Supports both over- and underscan
    IT scan behavior: Always Underscanned
    CE scan behavior: Supports both over- and underscan
  Colorimetry Data Block:
    BT2020YCC
    BT2020RGB
  HDR Static Metadata Data Block:
    Electro optical transfer functions:
      Traditional gamma - SDR luminance range
      SMPTE ST2084
      Hybrid Log-Gamma
    Supported static metadata descriptors:
      Static metadata type 1
  YCbCr 4:2:0 Video Data Block:
    VIC  96:  3840x2160   50.000000 Hz  16:9    112.500 kHz    594.000000 MHz
    VIC  97:  3840x2160   60.000000 Hz  16:9    135.000 kHz    594.000000 MHz
    VIC 101:  4096x2160   50.000000 Hz 256:135  112.500 kHz    594.000000 MHz
    VIC 102:  4096x2160   60.000000 Hz 256:135  135.000 kHz    594.000000 MHz
  Detailed Timing Descriptors:
    DTD 3:  1366x768    59.789541 Hz 683:384   47.712 kHz     85.500000 MHz (1600 mm x 900 mm)
                 Hfront   70 Hsync 143 Hback  213 Hpol P
                 Vfront    3 Vsync   3 Vback   24 Vpol P
    DTD 4:  1280x800    59.810326 Hz  16:10    49.702 kHz     83.500000 MHz (1600 mm x 900 mm)
                 Hfront   72 Hsync 128 Hback  200 Hpol N
                 Vfront    3 Vsync   6 Vback   22 Vpol P
    DTD 5:  1920x1200   59.950171 Hz  16:10    74.038 kHz    154.000000 MHz (1600 mm x 900 mm)
                 Hfront   48 Hsync  32 Hback   80 Hpol P
                 Vfront    3 Vsync   6 Vback   26 Vpol N
Checksum: 0x6d  Unused space in Extension Block: 6 bytes

----------------

Block 2, Unknown EDID Extension Block 0x00:
  00 ff ff ff ff ff ff 00 4c a3 25 a8 01 01 01 01 '........L.%.....'
  1b 21 01 03 80 dd 7d 78 0e de 50 a3 54 4c 99 26 '.!....}x..P.TL.&'
  0f 50 54 21 08 00 81 40 81 80 90 40 95 00 a9 c0 '.PT!...@...@....'
  a9 40 b3 00 e1 40 04 74 00 30 f2 70 5a 80 b0 58 '.@...@.t.0.pZ..X'
  8a 00 40 84 63 00 00 1e 02 3a 80 18 71 38 2d 40 '..@.c....:..q8-@'
  58 2c 45 00 40 84 63 00 00 1e 00 00 00 fd 00 18 'X,E.@.c.........'
  3c 0f 87 1e 00 0a 20 20 20 20 20 20 00 00 00 fc '<.....      ....'
  00 45 50 53 4f 4e 20 50 4a 0a 20 20 20 20 01 05 '.EPSON PJ.    ..'
Checksum: 0x05

----------------

Block 3, CTA-861 Extension Block:
  Revision: 3
  Underscans IT Video Formats by default
  Basic audio support
  Supports YCbCr 4:4:4
  Supports YCbCr 4:2:2
  Native detailed modes: 1
  Video Data Block:
    VIC  95:  3840x2160   30.000000 Hz  16:9     67.500 kHz    297.000000 MHz
    VIC  94:  3840x2160   25.000000 Hz  16:9     56.250 kHz    297.000000 MHz
    VIC  93:  3840x2160   24.000000 Hz  16:9     54.000 kHz    297.000000 MHz
    VIC  98:  4096x2160   24.000000 Hz 256:135   54.000 kHz    297.000000 MHz
    VIC  90:  2560x1080   60.000000 Hz  64:27    66.000 kHz    198.000000 MHz
    VIC  16:  1920x1080   60.000000 Hz  16:9     67.500 kHz    148.500000 MHz
    VIC  31:  1920x1080   50.000000 Hz  16:9     56.250 kHz    148.500000 MHz
    VIC  34:  1920x1080   30.000000 Hz  16:9     33.750 kHz     74.250000 MHz
    VIC  32:  1920x1080   24.000000 Hz  16:9     27.000 kHz     74.250000 MHz
    VIC   5:  1920x1080i  60.000000 Hz  16:9     33.750 kHz     74.250000 MHz
    VIC  20:  1920x1080i  50.000000 Hz  16:9     28.125 kHz     74.250000 MHz
    VIC   4:  1280x720    60.000000 Hz  16:9     45.000 kHz     74.250000 MHz
    VIC  19:  1280x720    50.000000 Hz  16:9     37.500 kHz     74.250000 MHz
    VIC  18:   720x576    50.000000 Hz  16:9     31.250 kHz     27.000000 MHz
    VIC  17:   720x576    50.000000 Hz   4:3     31.250 kHz     27.000000 MHz
    VIC   3:   720x480    59.940060 Hz  16:9     31.469 kHz     27.000000 MHz
    VIC   2:   720x480    59.940060 Hz   4:3     31.469 kHz     27.000000 MHz
    VIC   1:   640x480    59.940476 Hz   4:3     31.469 kHz     25.175000 MHz
  Audio Data Block:
    Linear PCM:
      Max channels: 2
      Supported sample rates (kHz): 48 44.1 32
      Supported sample sizes (bits): 24 20 16
  Vendor-Specific Data Block (HDMI), OUI 00-0C-03:
    Source physical address: 1.0.0.0
    Supports_AI
    DC_36bit
    DC_30bit
    DC_Y444
    Maximum TMDS clock: 300 MHz
    Video latency: 150 ms
    Audio latency: 150 ms
    Interlaced video latency: 150 ms
    Interlaced audio latency: 150 ms
    Extended HDMI video details:
      HDMI VICs:
        HDMI VIC 1:  3840x2160   30.000000 Hz  16:9     67.500 kHz    297.000000 MHz
        HDMI VIC 2:  3840x2160   25.000000 Hz  16:9     56.250 kHz    297.000000 MHz
        HDMI VIC 3:  3840x2160   24.000000 Hz  16:9     54.000 kHz    297.000000 MHz
        HDMI VIC 4:  4096x2160   24.000000 Hz 256:135   54.000 kHz    297.000000 MHz
  Speaker Allocation Data Block:
    FL/FR - Front Left/Right
  Video Capability Data Block:
    YCbCr quantization: Selectable (via AVI YQ)
    RGB quantization: Selectable (via AVI Q)
    PT scan behavior: Supports both over- and underscan
    IT scan behavior: Always Underscanned
    CE scan behavior: Supports both over- and underscan
  Colorimetry Data Block:
    BT2020YCC
    BT2020RGB
  HDR Static Metadata Data Block:
    Electro optical transfer functions:
      Traditional gamma - SDR luminance range
      SMPTE ST2084
      Hybrid Log-Gamma
    Supported static metadata descriptors:
      Static metadata type 1
  YCbCr 4:2:0 Video Data Block:
    VIC  96:  3840x2160   50.000000 Hz  16:9    112.500 kHz    594.000000 MHz
    VIC  97:  3840x2160   60.000000 Hz  16:9    135.000 kHz    594.000000 MHz
    VIC 101:  4096x2160   50.000000 Hz 256:135  112.500 kHz    594.000000 MHz
    VIC 102:  4096x2160   60.000000 Hz 256:135  135.000 kHz    594.000000 MHz
  Detailed Timing Descriptors:
    DTD 6:  1366x768    59.789541 Hz 683:384   47.712 kHz     85.500000 MHz (1600 mm x 900 mm)
                 Hfront   70 Hsync 143 Hback  213 Hpol P
                 Vfront    3 Vsync   3 Vback   24 Vpol P
    DTD 7:  1280x800    59.810326 Hz  16:10    49.702 kHz     83.500000 MHz (1600 mm x 900 mm)
                 Hfront   72 Hsync 128 Hback  200 Hpol N
                 Vfront    3 Vsync   6 Vback   22 Vpol P
    DTD 8:  1920x1200   59.950171 Hz  16:10    74.038 kHz    154.000000 MHz (1600 mm x 900 mm)
                 Hfront   48 Hsync  32 Hback   80 Hpol P
                 Vfront    3 Vsync   6 Vback   26 Vpol N
Checksum: 0x6d  Unused space in Extension Block: 6 bytes

----------------

Warnings:

Block 1, CTA-861 Extension Block:
  Vendor-Specific Data Block (HDMI), OUI 00-0C-03: Progressive and Interlaced latency values are identical, no need for both.
Block 3, CTA-861 Extension Block:
  Vendor-Specific Data Block (HDMI), OUI 00-0C-03: Progressive and Interlaced latency values are identical, no need for both.

Failures:

Block 0, Base EDID:
  Basic Display Parameters & Features: sRGB is signaled, but the chromaticities do not match.
  Detailed Timing Descriptor #1: Mismatch of image size 1600x900 mm vs display size 2210x1250 mm.
  Detailed Timing Descriptor #2: Mismatch of image size 1600x900 mm vs display size 2210x1250 mm.
Block 1, CTA-861 Extension Block:
  Detailed Timing Descriptor #3: Mismatch of image size 1600x900 mm vs display size 2210x1250 mm.
  Detailed Timing Descriptor #4: Mismatch of image size 1600x900 mm vs display size 2210x1250 mm.
  Detailed Timing Descriptor #5: Mismatch of image size 1600x900 mm vs display size 2210x1250 mm.
Block 2, Base EDID:
  Unknown Extension Block.
Block 3, CTA-861 Extension Block:
  Video Data Block: Duplicate VIC 95.
  Video Data Block: Duplicate VIC 94.
  Video Data Block: Duplicate VIC 93.
  Video Data Block: Duplicate VIC 98.
  Video Data Block: Duplicate VIC 90.
  Video Data Block: Duplicate VIC 16.
  Video Data Block: Duplicate VIC 31.
  Video Data Block: Duplicate VIC 34.
  Video Data Block: Duplicate VIC 32.
  Video Data Block: Duplicate VIC 5.
  Video Data Block: Duplicate VIC 20.
  Video Data Block: Duplicate VIC 4.
  Video Data Block: Duplicate VIC 19.
  Video Data Block: Duplicate VIC 18.
  Video Data Block: Duplicate VIC 17.
  Video Data Block: Duplicate VIC 3.
  Video Data Block: Duplicate VIC 2.
  Video Data Block: Duplicate VIC 1.
  Speaker Allocation Data Block: Only one instance of this Data Block is allowed.
  Video Capability Data Block: Only one instance of this Data Block is allowed.
  Colorimetry Data Block: Only one instance of this Data Block is allowed.
  HDR Static Metadata Data Block: Only one instance of this Data Block is allowed.
  YCbCr 4:2:0 Video Data Block: Duplicate YCbCr 4:2:0 VIC 96.
  YCbCr 4:2:0 Video Data Block: Duplicate YCbCr 4:2:0 VIC 97.
  YCbCr 4:2:0 Video Data Block: Duplicate YCbCr 4:2:0 VIC 101.
  YCbCr 4:2:0 Video Data Block: Duplicate YCbCr 4:2:0 VIC 102.
  Detailed Timing Descriptor #6: Mismatch of image size 1600x900 mm vs display size 2210x1250 mm.
  Detailed Timing Descriptor #7: Mismatch of image size 1600x900 mm vs display size 2210x1250 mm.
  Detailed Timing Descriptor #8: Mismatch of image size 1600x900 mm vs display size 2210x1250 mm.
EDID:
  Base EDID: EDID specified 1 extension block(s), but found 3 extension block(s).
  Base EDID: EDID 1.3 requires a Block Map Extension in Block 1 if there are more than 2 blocks in the EDID.

EDID conformity: FAIL
