
EDID (hex):
00ffffffffffff000469b21901010101
0b11010380261e782fc5c5a3574a9c23
125054bfef008180818f010101010101
010101010101302a009851002a403070
1300782d1100001e000000fd00374b18
500e0200205058028028000000ff0037
334c393031333130330a2020000000fc
0041535553204d42313954550a200010

Extracted contents:
header:          00 ff ff ff ff ff ff 00
serial number:   04 69 b2 19 01 01 01 01 0b 11
version:         01 03
basic params:    80 26 1e 78 2f
chroma info:     c5 c5 a3 57 4a 9c 23 12 50 54
established:     bf ef 00
standard:        81 80 81 8f 01 01 01 01 01 01 01 01 01 01 01 01
descriptor 1:    30 2a 00 98 51 00 2a 40 30 70 13 00 78 2d 11 00 00 1e
descriptor 2:    00 00 00 fd 00 37 4b 18 50 0e 02 00 20 50 58 02 80 28
descriptor 3:    00 00 00 ff 00 37 33 4c 39 30 31 33 31 30 33 0a 20 20
descriptor 4:    00 00 00 fc 00 41 53 55 53 20 4d 42 31 39 54 55 0a 20
extensions:      00
checksum:        10

EDID version: 1.3
Manufacturer: ACI Model 19b2 Serial Number --
Made in week 11 of 2007
Digital display
Maximum image size: 38 cm x 30 cm
Gamma: 2.20
DPMS levels: Off
RGB color display
Default (sRGB) color space is primary color space
First detailed timing is preferred timing
Supports GTF timings within operating range
Display x,y Chromaticity:
  Red:   0.6396, 0.3398
  Green: 0.2900, 0.6103
  Blue:  0.1396, 0.0703
  White: 0.3134, 0.3291
Established timings supported:
  720x400@70Hz 9:5 HorFreq: 31469 Hz Clock: 28.320 MHz
  640x480@60Hz 4:3 HorFreq: 31469 Hz Clock: 25.175 MHz
  640x480@67Hz 4:3 HorFreq: 35000 Hz Clock: 30.240 MHz
  640x480@72Hz 4:3 HorFreq: 37900 Hz Clock: 31.500 MHz
  640x480@75Hz 4:3 HorFreq: 37500 Hz Clock: 31.500 MHz
  800x600@56Hz 4:3 HorFreq: 35200 Hz Clock: 36.000 MHz
  800x600@60Hz 4:3 HorFreq: 37900 Hz Clock: 40.000 MHz
  800x600@72Hz 4:3 HorFreq: 48100 Hz Clock: 50.000 MHz
  800x600@75Hz 4:3 HorFreq: 46900 Hz Clock: 49.500 MHz
  832x624@75Hz 4:3 HorFreq: 49726 Hz Clock: 57.284 MHz
  1024x768@60Hz 4:3 HorFreq: 48400 Hz Clock: 65.000 MHz
  1024x768@70Hz 4:3 HorFreq: 56500 Hz Clock: 75.000 MHz
  1024x768@75Hz 4:3 HorFreq: 60000 Hz Clock: 78.750 MHz
  1280x1024@75Hz 5:4 HorFreq: 80000 Hz Clock: 135.000 MHz
Standard timings supported:
  1280x1024@60Hz 5:4 HorFreq: 64000 Hz Clock: 108.000 MHz
  1280x1024@75Hz 5:4 HorFreq: 80000 Hz Clock: 135.000 MHz
Detailed mode: Clock 108.000 MHz, 376 mm x 301 mm
               1280 1328 1440 1688 hborder 0
               1024 1025 1028 1066 vborder 0
               +hsync +vsync 
               VertFreq: 60 Hz, HorFreq: 63981 Hz
Monitor ranges (GTF with icing): 55-75Hz V, 24-80kHz H, max dotclock 140MHz
Serial number: --
Monitor name: ASUS MB19TU
Checksum: 0x10 (valid)
EDID block does NOT conform to EDID 1.3!
	sRGB is signaled, but the chromaticities do not match
