edid-decode (hex):

00 ff ff ff ff ff ff 00 10 ac 36 a2 4c 57 42 31
2c 21 01 03 80 35 1e 78 ea 1c b5 aa 53 4d a5 24
0e 50 54 a5 4b 00 71 4f 81 80 a9 c0 d1 c0 81 c0
81 cf 01 01 01 01 02 3a 80 18 71 38 2d 40 58 2c
45 00 0f 28 21 00 00 1e 00 00 00 ff 00 33 59 50
50 33 58 33 0a 20 20 20 20 20 00 00 00 fc 00 44
45 4c 4c 20 55 32 34 32 34 48 45 0a 00 00 00 fd
00 30 78 1f 87 1e 00 0a 20 20 20 20 20 20 01 1b

02 03 25 f1 4d 90 05 04 03 02 01 14 1f 12 13 11
3f 40 23 09 7f 07 83 01 00 00 67 03 0c 00 10 00
00 44 e2 00 6a 04 74 80 18 71 38 2d 40 58 2c 45
00 0f 28 21 00 00 1e 01 1d 80 18 71 1c 16 20 58
2c 25 00 0f 28 21 00 00 9e 8c 0a d0 8a 20 e0 2d
10 10 3e 96 00 0f 28 21 00 00 18 01 1d 00 72 51
d0 1e 20 46 28 55 00 0f 28 21 00 00 1e 00 00 00
00 00 00 00 00 00 00 00 00 00 00 00 00 00 00 9f

00 ff ff ff ff ff ff 00 10 ac 36 a2 4c 57 42 31
2c 21 01 03 80 35 1e 78 ea 1c b5 aa 53 4d a5 24
0e 50 54 a5 4b 00 71 4f 81 80 a9 c0 d1 c0 81 c0
81 cf 01 01 01 01 02 3a 80 18 71 38 2d 40 58 2c
45 00 0f 28 21 00 00 1e 00 00 00 ff 00 33 59 50
50 33 58 33 0a 20 20 20 20 20 00 00 00 fc 00 44
45 4c 4c 20 55 32 34 32 34 48 45 0a 00 00 00 fd
00 30 78 1f 87 1e 00 0a 20 20 20 20 20 20 01 1b

02 03 25 f1 4d 90 05 04 03 02 01 14 1f 12 13 11
3f 40 23 09 7f 07 83 01 00 00 67 03 0c 00 10 00
00 44 e2 00 6a 04 74 80 18 71 38 2d 40 58 2c 45
00 0f 28 21 00 00 1e 01 1d 80 18 71 1c 16 20 58
2c 25 00 0f 28 21 00 00 9e 8c 0a d0 8a 20 e0 2d
10 10 3e 96 00 0f 28 21 00 00 18 01 1d 00 72 51
d0 1e 20 46 28 55 00 0f 28 21 00 00 1e 00 00 00
00 00 00 00 00 00 00 00 00 00 00 00 00 00 00 9f

----------------

Block 0, Base EDID:
  EDID Structure Version & Revision: 1.3
  Vendor & Product Identification:
    Manufacturer: DEL
    Model: 41526
    Serial Number: ...
    Made in: week 44 of 2023
  Basic Display Parameters & Features:
    Digital display
    Maximum image size: 53 cm x 30 cm
    Gamma: 2.20
    DPMS levels: Standby Suspend Off
    RGB color display
    First detailed timing is the preferred timing
  Color Characteristics:
    Red  : 0.6640, 0.3251
    Green: 0.3037, 0.6445
    Blue : 0.1425, 0.0576
    White: 0.3134, 0.3291
  Established Timings I & II:
    IBM     :   720x400    70.081663 Hz   9:5     31.467 kHz     28.320000 MHz
    DMT 0x04:   640x480    59.940476 Hz   4:3     31.469 kHz     25.175000 MHz
    DMT 0x06:   640x480    75.000000 Hz   4:3     37.500 kHz     31.500000 MHz
    DMT 0x09:   800x600    60.316541 Hz   4:3     37.879 kHz     40.000000 MHz
    DMT 0x0b:   800x600    75.000000 Hz   4:3     46.875 kHz     49.500000 MHz
    DMT 0x10:  1024x768    60.003840 Hz   4:3     48.363 kHz     65.000000 MHz
    DMT 0x12:  1024x768    75.028582 Hz   4:3     60.023 kHz     78.750000 MHz
    DMT 0x24:  1280x1024   75.024675 Hz   5:4     79.976 kHz    135.000000 MHz
  Standard Timings:
    DMT 0x15:  1152x864    75.000000 Hz   4:3     67.500 kHz    108.000000 MHz
    DMT 0x23:  1280x1024   60.019740 Hz   5:4     63.981 kHz    108.000000 MHz
    DMT 0x53:  1600x900    60.000000 Hz  16:9     60.000 kHz    108.000000 MHz (RB)
    DMT 0x52:  1920x1080   60.000000 Hz  16:9     67.500 kHz    148.500000 MHz
    DMT 0x55:  1280x720    60.000000 Hz  16:9     45.000 kHz     74.250000 MHz
    GTF     :  1280x720    74.999686 Hz  16:9     56.400 kHz     95.654000 MHz
  Detailed Timing Descriptors:
    DTD 1:  1920x1080   60.000000 Hz  16:9     67.500 kHz    148.500000 MHz (527 mm x 296 mm)
                 Hfront   88 Hsync  44 Hback  148 Hpol P
                 Vfront    4 Vsync   5 Vback   36 Vpol P
    Display Product Serial Number: ...
    Display Product Name: 'DELL U2424HE'
    Display Range Limits:
      Monitor ranges (GTF): 48-120 Hz V, 31-135 kHz H, max dotclock 300 MHz
  Extension blocks: 1
Checksum: 0x1b

----------------

Block 1, CTA-861 Extension Block:
  Revision: 3
  Underscans IT Video Formats by default
  Basic audio support
  Supports YCbCr 4:4:4
  Supports YCbCr 4:2:2
  Native detailed modes: 1
  Video Data Block:
    VIC  16:  1920x1080   60.000000 Hz  16:9     67.500 kHz    148.500000 MHz (native)
    VIC   5:  1920x1080i  60.000000 Hz  16:9     33.750 kHz     74.250000 MHz
    VIC   4:  1280x720    60.000000 Hz  16:9     45.000 kHz     74.250000 MHz
    VIC   3:   720x480    59.940060 Hz  16:9     31.469 kHz     27.000000 MHz
    VIC   2:   720x480    59.940060 Hz   4:3     31.469 kHz     27.000000 MHz
    VIC   1:   640x480    59.940476 Hz   4:3     31.469 kHz     25.175000 MHz
    VIC  20:  1920x1080i  50.000000 Hz  16:9     28.125 kHz     74.250000 MHz
    VIC  31:  1920x1080   50.000000 Hz  16:9     56.250 kHz    148.500000 MHz
    VIC  18:   720x576    50.000000 Hz  16:9     31.250 kHz     27.000000 MHz
    VIC  19:  1280x720    50.000000 Hz  16:9     37.500 kHz     74.250000 MHz
    VIC  17:   720x576    50.000000 Hz   4:3     31.250 kHz     27.000000 MHz
    VIC  63:  1920x1080  120.000000 Hz  16:9    135.000 kHz    297.000000 MHz
    VIC  64:  1920x1080  100.000000 Hz  16:9    112.500 kHz    297.000000 MHz
  Audio Data Block:
    Linear PCM:
      Max channels: 2
      Supported sample rates (kHz): 192 176.4 96 88.2 48 44.1 32
      Supported sample sizes (bits): 24 20 16
  Speaker Allocation Data Block:
    FL/FR - Front Left/Right
  Vendor-Specific Data Block (HDMI), OUI 00-0C-03:
    Source physical address: 1.0.0.0
    Maximum TMDS clock: 340 MHz
  Video Capability Data Block:
    YCbCr quantization: No Data
    RGB quantization: Selectable (via AVI Q)
    PT scan behavior: Always Underscanned
    IT scan behavior: Always Underscanned
    CE scan behavior: Always Underscanned
  Detailed Timing Descriptors:
    DTD 2:  1920x1080  120.000000 Hz  16:9    135.000 kHz    297.000000 MHz (527 mm x 296 mm)
                 Hfront   88 Hsync  44 Hback  148 Hpol P
                 Vfront    4 Vsync   5 Vback   36 Vpol P
    DTD 3:  1920x1080i  60.000000 Hz  16:9     33.750 kHz     74.250000 MHz (527 mm x 296 mm)
                 Hfront   88 Hsync  44 Hback  148 Hpol P
                 Vfront    2 Vsync   5 Vback   15 Vpol P Vfront +0.5 Odd Field
                 Vfront    2 Vsync   5 Vback   15 Vpol P Vback  +0.5 Even Field
    DTD 4:   720x480    59.940060 Hz   3:2     31.469 kHz     27.000000 MHz (527 mm x 296 mm)
                 Hfront   16 Hsync  62 Hback   60 Hpol N
                 Vfront    9 Vsync   6 Vback   30 Vpol N
    DTD 5:  1280x720    60.000000 Hz  16:9     45.000 kHz     74.250000 MHz (527 mm x 296 mm)
                 Hfront   70 Hsync  40 Hback  260 Hpol P
                 Vfront    5 Vsync   5 Vback   20 Vpol P
Checksum: 0x9f  Unused space in Extension Block: 18 bytes

----------------

Block 2, Unknown EDID Extension Block 0x00:
  00 ff ff ff ff ff ff 00 10 ac 36 a2 4c 57 42 31 '..........6.LWB1'
  2c 21 01 03 80 35 1e 78 ea 1c b5 aa 53 4d a5 24 ',!...5.x....SM.$'
  0e 50 54 a5 4b 00 71 4f 81 80 a9 c0 d1 c0 81 c0 '.PT.K.qO........'
  81 cf 01 01 01 01 02 3a 80 18 71 38 2d 40 58 2c '.......:..q8-@X,'
  45 00 0f 28 21 00 00 1e 00 00 00 ff 00 33 59 50 'E..(!........3YP'
  50 33 58 33 0a 20 20 20 20 20 00 00 00 fc 00 44 'P3X3.     .....D'
  45 4c 4c 20 55 32 34 32 34 48 45 0a 00 00 00 fd 'ELL U2424HE.....'
  00 30 78 1f 87 1e 00 0a 20 20 20 20 20 20 01 1b '.0x.....      ..'
Checksum: 0x1b

----------------

Block 3, CTA-861 Extension Block:
  Revision: 3
  Underscans IT Video Formats by default
  Basic audio support
  Supports YCbCr 4:4:4
  Supports YCbCr 4:2:2
  Native detailed modes: 1
  Video Data Block:
    VIC  16:  1920x1080   60.000000 Hz  16:9     67.500 kHz    148.500000 MHz (native)
    VIC   5:  1920x1080i  60.000000 Hz  16:9     33.750 kHz     74.250000 MHz
    VIC   4:  1280x720    60.000000 Hz  16:9     45.000 kHz     74.250000 MHz
    VIC   3:   720x480    59.940060 Hz  16:9     31.469 kHz     27.000000 MHz
    VIC   2:   720x480    59.940060 Hz   4:3     31.469 kHz     27.000000 MHz
    VIC   1:   640x480    59.940476 Hz   4:3     31.469 kHz     25.175000 MHz
    VIC  20:  1920x1080i  50.000000 Hz  16:9     28.125 kHz     74.250000 MHz
    VIC  31:  1920x1080   50.000000 Hz  16:9     56.250 kHz    148.500000 MHz
    VIC  18:   720x576    50.000000 Hz  16:9     31.250 kHz     27.000000 MHz
    VIC  19:  1280x720    50.000000 Hz  16:9     37.500 kHz     74.250000 MHz
    VIC  17:   720x576    50.000000 Hz   4:3     31.250 kHz     27.000000 MHz
    VIC  63:  1920x1080  120.000000 Hz  16:9    135.000 kHz    297.000000 MHz
    VIC  64:  1920x1080  100.000000 Hz  16:9    112.500 kHz    297.000000 MHz
  Audio Data Block:
    Linear PCM:
      Max channels: 2
      Supported sample rates (kHz): 192 176.4 96 88.2 48 44.1 32
      Supported sample sizes (bits): 24 20 16
  Speaker Allocation Data Block:
    FL/FR - Front Left/Right
  Vendor-Specific Data Block (HDMI), OUI 00-0C-03:
    Source physical address: 1.0.0.0
    Maximum TMDS clock: 340 MHz
  Video Capability Data Block:
    YCbCr quantization: No Data
    RGB quantization: Selectable (via AVI Q)
    PT scan behavior: Always Underscanned
    IT scan behavior: Always Underscanned
    CE scan behavior: Always Underscanned
  Detailed Timing Descriptors:
    DTD 6:  1920x1080  120.000000 Hz  16:9    135.000 kHz    297.000000 MHz (527 mm x 296 mm)
                 Hfront   88 Hsync  44 Hback  148 Hpol P
                 Vfront    4 Vsync   5 Vback   36 Vpol P
    DTD 7:  1920x1080i  60.000000 Hz  16:9     33.750 kHz     74.250000 MHz (527 mm x 296 mm)
                 Hfront   88 Hsync  44 Hback  148 Hpol P
                 Vfront    2 Vsync   5 Vback   15 Vpol P Vfront +0.5 Odd Field
                 Vfront    2 Vsync   5 Vback   15 Vpol P Vback  +0.5 Even Field
    DTD 8:   720x480    59.940060 Hz   3:2     31.469 kHz     27.000000 MHz (527 mm x 296 mm)
                 Hfront   16 Hsync  62 Hback   60 Hpol N
                 Vfront    9 Vsync   6 Vback   30 Vpol N
    DTD 9:  1280x720    60.000000 Hz  16:9     45.000 kHz     74.250000 MHz (527 mm x 296 mm)
                 Hfront   70 Hsync  40 Hback  260 Hpol P
                 Vfront    5 Vsync   5 Vback   20 Vpol P
Checksum: 0x9f  Unused space in Extension Block: 18 bytes

----------------

Warnings:

Block 1, CTA-861 Extension Block:
  Video Capability Data Block: Set Selectable YCbCr Quantization to avoid interop issues.
  Video Capability Data Block: S_PT is equal to S_IT and S_CE, so should be set to 0 instead.
  Detailed Timing Descriptor #5: DTD is similar but not identical to VIC 4.
  Display Product Serial Number is set, so the Serial Number in the Base EDID should be 0.
  Add a Colorimetry Data Block with the sRGB colorimetry bit set to avoid interop issues.
Block 3, CTA-861 Extension Block:
  Video Capability Data Block: Set Selectable YCbCr Quantization to avoid interop issues.
  Video Capability Data Block: S_PT is equal to S_IT and S_CE, so should be set to 0 instead.
  Detailed Timing Descriptor #9: DTD is similar but not identical to VIC 4.
  Display Product Serial Number is set, so the Serial Number in the Base EDID should be 0.
  Add a Colorimetry Data Block with the sRGB colorimetry bit set to avoid interop issues.
EDID:
  CTA-861: Multiple native progressive timings are defined.

Failures:

Block 2, Base EDID:
  Unknown Extension Block.
Block 3, CTA-861 Extension Block:
  Video Data Block: Duplicate VIC 16.
  Video Data Block: Duplicate VIC 5.
  Video Data Block: Duplicate VIC 4.
  Video Data Block: Duplicate VIC 3.
  Video Data Block: Duplicate VIC 2.
  Video Data Block: Duplicate VIC 1.
  Video Data Block: Duplicate VIC 20.
  Video Data Block: Duplicate VIC 31.
  Video Data Block: Duplicate VIC 18.
  Video Data Block: Duplicate VIC 19.
  Video Data Block: Duplicate VIC 17.
  Video Data Block: Duplicate VIC 63.
  Video Data Block: Duplicate VIC 64.
  Speaker Allocation Data Block: Only one instance of this Data Block is allowed.
  Video Capability Data Block: Only one instance of this Data Block is allowed.
EDID:
  Base EDID: Some timings are out of range of the Monitor Ranges:
    Horizontal Freq: 28.125 - 135.000 kHz (Monitor: 31.000 - 135.000 kHz)
  Base EDID: EDID specified 1 extension block(s), but found 3 extension block(s).
  Base EDID: EDID 1.3 requires a Block Map Extension in Block 1 if there are more than 2 blocks in the EDID.

EDID conformity: FAIL
