edid-decode (hex):

00 ff ff ff ff ff ff 00 09 e5 ec 07 00 00 00 00
01 1c 01 04 a5 1f 11 78 02 fb a0 95 5d 59 94 29
1b 50 54 00 00 00 01 01 01 01 01 01 01 01 01 01
01 01 01 01 01 01 c0 39 80 18 71 38 28 40 30 20
36 00 35 ae 10 00 00 1a 33 2e 80 18 71 38 28 40
30 20 36 00 35 ae 10 00 00 1a 00 00 00 fe 00 42
4f 45 20 43 51 0a 20 20 20 20 20 20 00 00 00 fe
00 4e 56 31 34 30 46 48 4d 2d 4e 34 39 0a 00 1a

----------------

Block 0, Base EDID:
  EDID Structure Version & Revision: 1.4
  Vendor & Product Identification:
    Manufacturer: BOE
    Model: 2028
    Made in: week 1 of 2018
  Basic Display Parameters & Features:
    Digital display
    Bits per primary color channel: 8
    DisplayPort interface
    Maximum image size: 31 cm x 17 cm
    Gamma: 2.20
    Supported color formats: RGB 4:4:4
    First detailed timing includes the native pixel format and preferred refresh rate
  Color Characteristics:
    Red  : 0.5849, 0.3662
    Green: 0.3496, 0.5810
    Blue : 0.1621, 0.1074
    White: 0.3125, 0.3281
  Established Timings I & II: none
  Standard Timings: none
  Detailed Timing Descriptors:
    DTD 1:  1920x1080   60.000 Hz  16:9    67.200 kHz 147.840 MHz (309 mm x 174 mm)
                 Hfront   48 Hsync  32 Hback 200 Hpol P
                 Vfront    3 Vsync   6 Vback  31 Vpol N
    DTD 2:  1920x1080   47.999 Hz  16:9    53.759 kHz 118.270 MHz (309 mm x 174 mm)
                 Hfront   48 Hsync  32 Hback 200 Hpol P
                 Vfront    3 Vsync   6 Vback  31 Vpol N
    Alphanumeric Data String: 'BOE CQ'
    Alphanumeric Data String: 'NV140FHM-N49'
Checksum: 0x1a
