
EDID (hex):
00ffffffffffff003ed3092701000000
271e0104b53c21783ba661a953459822
1e4d5d85470031404540614081c08140
8180a9c0a9fc023a801871382d403020
350055502100001a000000ff000a2020
20202020202020202020000000fd0030
a5dede3c010a202020202020000000fc
004b525950544f3237460a202020010b
02031c744b909f859404130312010211
2309070783010000e305e3017b7f8078
70381f4030204500092521000018866f
80a07038404030203500ba8921000018
369580a07038214030403500ba892100
001e023a50a050002d3030203500ba89
2100001e302a40c86084643018501300
ba89210000180000000000000000000f

edid-decode (hex):

00 ff ff ff ff ff ff 00 3e d3 09 27 01 00 00 00
27 1e 01 04 b5 3c 21 78 3b a6 61 a9 53 45 98 22
1e 4d 5d 85 47 00 31 40 45 40 61 40 81 c0 81 40
81 80 a9 c0 a9 fc 02 3a 80 18 71 38 2d 40 30 20
35 00 55 50 21 00 00 1a 00 00 00 ff 00 0a 20 20
20 20 20 20 20 20 20 20 20 20 00 00 00 fd 00 30
a5 de de 3c 01 0a 20 20 20 20 20 20 00 00 00 fc
00 4b 52 59 50 54 4f 32 37 46 0a 20 20 20 01 0b

02 03 1c 74 4b 90 9f 85 94 04 13 03 12 01 02 11
23 09 07 07 83 01 00 00 e3 05 e3 01 7b 7f 80 78
70 38 1f 40 30 20 45 00 09 25 21 00 00 18 86 6f
80 a0 70 38 40 40 30 20 35 00 ba 89 21 00 00 18
36 95 80 a0 70 38 21 40 30 40 35 00 ba 89 21 00
00 1e 02 3a 50 a0 50 00 2d 30 30 20 35 00 ba 89
21 00 00 1e 30 2a 40 c8 60 84 64 30 18 50 13 00
ba 89 21 00 00 18 00 00 00 00 00 00 00 00 00 0f

----------------

Block 0, Base EDID:
  EDID Structure Version & Revision: 1.4
  Vendor & Product Identification:
    Manufacturer: OVS
    Model: 9993
    Serial Number: 1
    Made in: week 39 of 2020
  Basic Display Parameters & Features:
    Digital display
    Bits per primary color channel: 10
    DisplayPort interface
    Maximum image size: 60 cm x 33 cm
    Gamma: 2.20
    DPMS levels: Off
    Supported color formats: RGB 4:4:4, YCrCb 4:4:4, YCrCb 4:2:2
    First detailed timing includes the native pixel format and preferred refresh rate
    Display is continuous frequency
  Color Characteristics:
    Red  : 0.6621, 0.3261
    Green: 0.2705, 0.5957
    Blue : 0.1337, 0.1191
    White: 0.3007, 0.3642
  Established Timings I & II:
    IBM     :   720x400    70.081663 Hz   9:5     31.467 kHz     28.320000 MHz
    DMT 0x06:   640x480    75.000000 Hz   4:3     37.500 kHz     31.500000 MHz
    DMT 0x09:   800x600    60.316541 Hz   4:3     37.879 kHz     40.000000 MHz
    DMT 0x0b:   800x600    75.000000 Hz   4:3     46.875 kHz     49.500000 MHz
    DMT 0x11:  1024x768    70.069359 Hz   4:3     56.476 kHz     75.000000 MHz
    DMT 0x12:  1024x768    75.028582 Hz   4:3     60.023 kHz     78.750000 MHz
    DMT 0x24:  1280x1024   75.024675 Hz   5:4     79.976 kHz    135.000000 MHz
  Standard Timings:
    DMT 0x04:   640x480    59.940476 Hz   4:3     31.469 kHz     25.175000 MHz
    DMT 0x09:   800x600    60.316541 Hz   4:3     37.879 kHz     40.000000 MHz
    DMT 0x10:  1024x768    60.003840 Hz   4:3     48.363 kHz     65.000000 MHz
    DMT 0x55:  1280x720    60.000000 Hz  16:9     45.000 kHz     74.250000 MHz
    DMT 0x20:  1280x960    60.000000 Hz   4:3     60.000 kHz    108.000000 MHz
    DMT 0x23:  1280x1024   60.019740 Hz   5:4     63.981 kHz    108.000000 MHz
    DMT 0x53:  1600x900    60.000000 Hz  16:9     60.000 kHz    108.000000 MHz (RB)
    GTF     :  1600x900   119.999812 Hz  16:9    115.800 kHz    255.686000 MHz
  Detailed Timing Descriptors:
    DTD 1:  1920x1080   60.000000 Hz  16:9     67.500 kHz    148.500000 MHz (597 mm x 336 mm)
                 Hfront   48 Hsync  32 Hback  200 Hpol P
                 Vfront    3 Vsync   5 Vback   37 Vpol N
    Display Product Serial Number: ''
    Display Range Limits:
      Monitor ranges (Bare Limits): 48-165 Hz V, 222-222 kHz H, max dotclock 600 MHz
    Display Product Name: 'KRYPTO27F'
  Extension blocks: 1
Checksum: 0x0b

----------------

Block 1, CTA-861 Extension Block:
  Revision: 3
  Basic audio support
  Supports YCbCr 4:4:4
  Supports YCbCr 4:2:2
  Native detailed modes: 4
  Video Data Block:
    VIC  16:  1920x1080   60.000000 Hz  16:9     67.500 kHz    148.500000 MHz (native)
    VIC  31:  1920x1080   50.000000 Hz  16:9     56.250 kHz    148.500000 MHz (native)
    VIC   5:  1920x1080i  60.000000 Hz  16:9     33.750 kHz     74.250000 MHz (native)
    VIC  20:  1920x1080i  50.000000 Hz  16:9     28.125 kHz     74.250000 MHz (native)
    VIC   4:  1280x720    60.000000 Hz  16:9     45.000 kHz     74.250000 MHz
    VIC  19:  1280x720    50.000000 Hz  16:9     37.500 kHz     74.250000 MHz
    VIC   3:   720x480    59.940060 Hz  16:9     31.469 kHz     27.000000 MHz
    VIC  18:   720x576    50.000000 Hz  16:9     31.250 kHz     27.000000 MHz
    VIC   1:   640x480    59.940476 Hz   4:3     31.469 kHz     25.175000 MHz
    VIC   2:   720x480    59.940060 Hz   4:3     31.469 kHz     27.000000 MHz
    VIC  17:   720x576    50.000000 Hz   4:3     31.250 kHz     27.000000 MHz
  Audio Data Block:
    Linear PCM:
      Max channels: 2
      Supported sample rates (kHz): 48 44.1 32
      Supported sample sizes (bits): 24 20 16
  Speaker Allocation Data Block:
    FL/FR - Front Left/Right
  Colorimetry Data Block:
    xvYCC601
    xvYCC709
    BT2020cYCC
    BT2020YCC
    BT2020RGB
  Detailed Timing Descriptors:
    DTD 2:  1920x1080  143.992340 Hz  16:9    159.975 kHz    326.350000 MHz (521 mm x 293 mm)
                 Hfront   48 Hsync  32 Hback   40 Hpol N
                 Vfront    4 Vsync   5 Vback   22 Vpol N
    DTD 3:  1920x1080  119.982181 Hz  16:9    137.260 kHz    285.500000 MHz (698 mm x 393 mm)
                 Hfront   48 Hsync  32 Hback   80 Hpol N
                 Vfront    3 Vsync   5 Vback   56 Vpol N
    DTD 4:  1920x1080  164.999309 Hz  16:9    183.644 kHz    381.980000 MHz (698 mm x 393 mm)
                 Hfront   48 Hsync  64 Hback   48 Hpol P
                 Vfront    3 Vsync   5 Vback   25 Vpol P
    DTD 5:  1360x768   120.168965 Hz  85:48    97.697 kHz    148.500000 MHz (698 mm x 393 mm)
                 Hfront   48 Hsync  32 Hback   80 Hpol P
                 Vfront    3 Vsync   5 Vback   37 Vpol P
    DTD 6:  1600x900    60.000000 Hz  16:9     60.000 kHz    108.000000 MHz (698 mm x 393 mm)
                 Hfront   24 Hsync  80 Hback   96 Hpol N
                 Vfront    1 Vsync   3 Vback   96 Vpol N
Checksum: 0x0f
