
EDID (hex):
00ffffffffffff000472df035e896054
2e19010468331d78eee595a656529d27
105054b30c00714f818081c081009500
b300d1c00101023a801871382d40582c
4500fd1e1100001e000000fd00384b1f
4b11000a202020202020000000fc0047
323337484c0a202020202020000000ff
0054304d5353303130323433310a0072

Extracted contents:
header:          00 ff ff ff ff ff ff 00
serial number:   04 72 df 03 5e 89 60 54 2e 19
version:         01 04
basic params:    68 33 1d 78 ee
chroma info:     e5 95 a6 56 52 9d 27 10 50 54
established:     b3 0c 00
standard:        71 4f 81 80 81 c0 81 00 95 00 b3 00 d1 c0 01 01
descriptor 1:    02 3a 80 18 71 38 2d 40 58 2c 45 00 fd 1e 11 00 00 1e
descriptor 2:    00 00 00 fd 00 38 4b 1f 4b 11 00 0a 20 20 20 20 20 20
descriptor 3:    00 00 00 fc 00 47 32 33 37 48 4c 0a 20 20 20 20 20 20
descriptor 4:    00 00 00 ff 00 54 30 4d 53 53 30 31 30 32 34 33 31 0a
extensions:      00
checksum:        72

EDID version: 1.4
Manufacturer: ACR Model 3df Serial Number --
Made in week 46 of 2015
Analog display, Input voltage level: 0.7/0.7 V
Blank level equals black level
Sync: Separate 
Maximum image size: 51 cm x 29 cm
Gamma: 2.20
DPMS levels: Standby Suspend Off
RGB color display
Default (sRGB) color space is primary color space
First detailed timing includes the native pixel format and preferred refresh rate
Display x,y Chromaticity:
  Red:   0.6513, 0.3378
  Green: 0.3212, 0.6142
  Blue:  0.1542, 0.0634
  White: 0.3134, 0.3291
Established timings supported:
  720x400@70Hz 9:5 HorFreq: 31469 Hz Clock: 28.320 MHz
  640x480@60Hz 4:3 HorFreq: 31469 Hz Clock: 25.175 MHz
  640x480@67Hz 4:3 HorFreq: 35000 Hz Clock: 30.240 MHz
  800x600@56Hz 4:3 HorFreq: 35200 Hz Clock: 36.000 MHz
  800x600@60Hz 4:3 HorFreq: 37900 Hz Clock: 40.000 MHz
  1024x768@60Hz 4:3 HorFreq: 48400 Hz Clock: 65.000 MHz
  1024x768@70Hz 4:3 HorFreq: 56500 Hz Clock: 75.000 MHz
Standard timings supported:
  1152x864@75Hz 4:3 HorFreq: 67500 Hz Clock: 108.000 MHz
  1280x1024@60Hz 5:4 HorFreq: 64000 Hz Clock: 108.000 MHz
  1280x720@60Hz 16:9
  1280x800@60Hz 16:10
  1440x900@60Hz 16:10 HorFreq: 55500 Hz Clock: 88.750 MHz
  1680x1050@60Hz 16:10 HorFreq: 64700 Hz Clock: 119.000 MHz
  1920x1080@60Hz 16:9
Detailed mode: Clock 148.500 MHz, 509 mm x 286 mm
               1920 2008 2052 2200 hborder 0
               1080 1084 1089 1125 vborder 0
               +hsync +vsync 
               VertFreq: 60 Hz, HorFreq: 67500 Hz
Monitor ranges (GTF): 56-75Hz V, 31-75kHz H, max dotclock 170MHz
Monitor name: G237HL
Serial number: --
Checksum: 0x72 (valid)
EDID block does NOT conform to EDID 1.4!
	sRGB is signaled, but the chromaticities do not match


