
EDID (hex):
00ffffffffffff0038a34a6701010101
24140103082f1e78ea0eb5aa5137ab25
145054bfef8081c0814081808bc09500
9040b300714f21399030621a274018b0
3640da281100001c000000fd00384b1f
5311000a202020202020000000fc0050
323231570a20202020202020000000ff
0030393131343736314e420a202000e3

Extracted contents:
header:          00 ff ff ff ff ff ff 00
serial number:   38 a3 4a 67 01 01 01 01 24 14
version:         01 03
basic params:    08 2f 1e 78 ea
chroma info:     0e b5 aa 51 37 ab 25 14 50 54
established:     bf ef 80
standard:        81 c0 81 40 81 80 8b c0 95 00 90 40 b3 00 71 4f
descriptor 1:    21 39 90 30 62 1a 27 40 18 b0 36 40 da 28 11 00 00 1c
descriptor 2:    00 00 00 fd 00 38 4b 1f 53 11 00 0a 20 20 20 20 20 20
descriptor 3:    00 00 00 fc 00 50 32 32 31 57 0a 20 20 20 20 20 20 20
descriptor 4:    00 00 00 ff 00 30 39 31 31 34 37 36 31 4e 42 0a 20 20
extensions:      00
checksum:        e3

EDID version: 1.3
Manufacturer: NEC Model 674a Serial Number --
Made in week 36 of 2010
Analog display, Input voltage level: 0.7/0.3 V
Sync: Separate 
Maximum image size: 47 cm x 30 cm
Gamma: 2.20
DPMS levels: Standby Suspend Off
RGB color display
First detailed timing is preferred timing
Display x,y Chromaticity:
  Red:   0.6640, 0.3164
  Green: 0.2177, 0.6699
  Blue:  0.1464, 0.0810
  White: 0.3134, 0.3291
Established timings supported:
  720x400@70Hz 9:5 HorFreq: 31469 Hz Clock: 28.320 MHz
  640x480@60Hz 4:3 HorFreq: 31469 Hz Clock: 25.175 MHz
  640x480@67Hz 4:3 HorFreq: 35000 Hz Clock: 30.240 MHz
  640x480@72Hz 4:3 HorFreq: 37900 Hz Clock: 31.500 MHz
  640x480@75Hz 4:3 HorFreq: 37500 Hz Clock: 31.500 MHz
  800x600@56Hz 4:3 HorFreq: 35200 Hz Clock: 36.000 MHz
  800x600@60Hz 4:3 HorFreq: 37900 Hz Clock: 40.000 MHz
  800x600@72Hz 4:3 HorFreq: 48100 Hz Clock: 50.000 MHz
  800x600@75Hz 4:3 HorFreq: 46900 Hz Clock: 49.500 MHz
  832x624@75Hz 4:3 HorFreq: 49726 Hz Clock: 57.284 MHz
  1024x768@60Hz 4:3 HorFreq: 48400 Hz Clock: 65.000 MHz
  1024x768@70Hz 4:3 HorFreq: 56500 Hz Clock: 75.000 MHz
  1024x768@75Hz 4:3 HorFreq: 60000 Hz Clock: 78.750 MHz
  1280x1024@75Hz 5:4 HorFreq: 80000 Hz Clock: 135.000 MHz
  1152x870@75Hz 192:145 HorFreq: 67500 Hz Clock: 108.000 MHz
Standard timings supported:
  1280x720@60Hz 16:9
  1280x960@60Hz 4:3 HorFreq: 60000 Hz Clock: 108.000 MHz
  1280x1024@60Hz 5:4 HorFreq: 64000 Hz Clock: 108.000 MHz
  1360x765@60Hz 16:9
  1440x900@60Hz 16:10 HorFreq: 55500 Hz Clock: 88.750 MHz
  1400x1050@60Hz 4:3 HorFreq: 64700 Hz Clock: 101.000 MHz
  1680x1050@60Hz 16:10 HorFreq: 64700 Hz Clock: 119.000 MHz
  1152x864@75Hz 4:3 HorFreq: 67500 Hz Clock: 108.000 MHz
Detailed mode: Clock 146.250 MHz, 474 mm x 296 mm
               1680 1960 2136 2240 hborder 0
               1050 1053 1059 1089 vborder 0
               -hsync +vsync 
               VertFreq: 59 Hz, HorFreq: 65290 Hz
Monitor ranges (GTF): 56-75Hz V, 31-83kHz H, max dotclock 170MHz
Monitor name: P221W
Serial number: --
Checksum: 0xe3 (valid)
