
EDID (hex):
00ffffffffffff0051b8981300000000
2a1f0104a51f1178039b52a9513c9323
1a525b00000001010101010101010101
010101010101683680a0703824403020
750435ae100000180000001000382440
3020750435ae10000018000000fc0054
4c3134305644585030342d30000000fc
000521e00a3cc8040a1fe10000000094

Extracted contents:
header:          00 ff ff ff ff ff ff 00
serial number:   51 b8 98 13 00 00 00 00 2a 1f
version:         01 04
basic params:    a5 1f 11 78 03
chroma info:     9b 52 a9 51 3c 93 23 1a 52 5b
established:     00 00 00
standard:        01 01 01 01 01 01 01 01 01 01 01 01 01 01 01 01
descriptor 1:    68 36 80 a0 70 38 24 40 30 20 75 04 35 ae 10 00 00 18
descriptor 2:    00 00 00 10 00 38 24 40 30 20 75 04 35 ae 10 00 00 18
descriptor 3:    00 00 00 fc 00 54 4c 31 34 30 56 44 58 50 30 34 2d 30
descriptor 4:    00 00 00 fc 00 05 21 e0 0a 3c c8 04 0a 1f e1 00 00 00
extensions:      00
checksum:        94

EDID version: 1.4
Manufacturer: TMX Model 1398 Serial Number --
Made in week 42 of 2021
Digital display
8 bits per primary color channel
DisplayPort interface
Maximum image size: 31 cm x 17 cm
Gamma: 2.20
Supported color formats: RGB 4:4:4
First detailed timing includes the native pixel format and preferred refresh rate
Display is continuous frequency
Display x,y Chromaticity:
  Red:   0.6621, 0.3173
  Green: 0.2363, 0.5771
  Blue:  0.1376, 0.1025
  White: 0.3203, 0.3574
Established timings supported:
Standard timings supported:
Detailed mode: Clock 139.280 MHz, 309 mm x 174 mm
               1920 1968 2000 2080 hborder 0
               1080 1103 1108 1116 vborder 0
               -hsync -vsync 
               VertFreq: 60 Hz, HorFreq: 66961 Hz
Dummy block
Monitor name: TL140VDXP04-0
Checksum: 0x94 (valid)
EDID block does NOT conform to EDID 1.4!
	Missing monitor ranges
	Detailed block string not properly terminated
EDID block does not conform at all!
	Dummy block filled with garbage
