
EDID (hex):
00ffffffffffff004d10761400000000
311a0104a52313780e97c3a65535bb25
0d4d5800000001010101010101010101
0101010101014dd000a0f0703e803020
35005ac2100000180000000000000000
00000000000000000000000000fe0059
32584e44804c51313536443100000000
0002410328001200000b010a20200027

Extracted contents:
header:          00 ff ff ff ff ff ff 00
serial number:   4d 10 76 14 00 00 00 00 31 1a
version:         01 04
basic params:    a5 23 13 78 0e
chroma info:     97 c3 a6 55 35 bb 25 0d 4d 58
established:     00 00 00
standard:        01 01 01 01 01 01 01 01 01 01 01 01 01 01 01 01
descriptor 1:    4d d0 00 a0 f0 70 3e 80 30 20 35 00 5a c2 10 00 00 18
descriptor 2:    00 00 00 00 00 00 00 00 00 00 00 00 00 00 00 00 00 00
descriptor 3:    00 00 00 fe 00 59 32 58 4e 44 80 4c 51 31 35 36 44 31
descriptor 4:    00 00 00 00 00 02 41 03 28 00 12 00 00 0b 01 0a 20 20
extensions:      00
checksum:        27

EDID version: 1.4
Manufacturer: SHP Model 1476 Serial Number --
Made in week 49 of 2016
Digital display
8 bits per primary color channel
DisplayPort interface
Maximum image size: 35 cm x 19 cm
Gamma: 2.20
Supported color formats: RGB 4:4:4, YCrCb 4:4:4
Default (sRGB) color space is primary color space
First detailed timing includes the native pixel format and preferred refresh rate
Display x,y Chromaticity:
  Red:   0.6503, 0.3330
  Green: 0.2080, 0.7333
  Blue:  0.1474, 0.0507
  White: 0.3007, 0.3466
Established timings supported:
Standard timings supported:
Detailed mode: Clock 533.250 MHz, 346 mm x 194 mm
               3840 3888 3920 4000 hborder 0
               2160 2163 2168 2222 vborder 0
               -hsync -vsync 
               VertFreq: 59 Hz, HorFreq: 133312 Hz
Manufacturer-specified data, tag 0
ASCII string: Y2XND
Manufacturer-specified data, tag 0
Checksum: 0x27 (valid)
EDID block does NOT conform to EDID 1.4!
	sRGB is signaled, but the chromaticities do not match
	Missing name descriptor
	Missing monitor ranges
	Detailed block string not properly terminated
