edid-decode (hex):

00 ff ff ff ff ff ff 00 5a 63 8e 32 01 01 01 01
2e 1a 01 03 80 46 27 78 2e d5 55 a2 5b 4f a2 27
11 50 54 bf ef 80 d1 c0 b3 00 a9 40 a9 c0 95 00
90 40 81 80 81 c0 56 5e 00 a0 a0 a0 29 50 30 20
35 00 ba 89 21 00 00 1c 00 00 00 ff 00 55 52 58
31 36 34 36 30 31 33 35 30 0a 00 00 00 fd 00 18
4b 0f 65 20 00 0a 20 20 20 20 20 20 00 00 00 fc
00 56 58 33 32 30 39 2d 32 4b 0a 20 20 20 01 18

02 03 20 c1 4b 10 1f 1f 1f 04 13 03 13 02 13 01
23 09 07 07 83 01 00 00 67 03 0c 00 10 00 00 3c
02 3a 80 18 71 38 2d 40 58 2c 45 00 ba 89 21 00
00 1e 01 1d 00 72 51 d0 1e 20 6e 28 55 00 ba 89
21 00 00 1e 01 1d 00 72 51 d0 1e 20 6e 28 55 00
ba 89 21 00 00 18 01 1d 00 72 51 d0 1e 20 6e 28
55 00 ba 89 21 00 00 18 f0 3c 00 d0 51 a0 35 50
60 88 3a 00 ba 89 21 00 00 1c 00 00 00 00 00 4e

00 ff ff ff ff ff ff 00 5a 63 8e 32 01 01 01 01
2e 1a 01 03 80 46 27 78 2e d5 55 a2 5b 4f a2 27
11 50 54 bf ef 80 d1 c0 b3 00 a9 40 a9 c0 95 00
90 40 81 80 81 c0 56 5e 00 a0 a0 a0 29 50 30 20
35 00 ba 89 21 00 00 1c 00 00 00 ff 00 55 52 58
31 36 34 36 30 31 33 35 30 0a 00 00 00 fd 00 18
4b 0f 65 20 00 0a 20 20 20 20 20 20 00 00 00 fc
00 56 58 33 32 30 39 2d 32 4b 0a 20 20 20 01 18

02 03 20 c1 4b 10 1f 1f 1f 04 13 03 13 02 13 01
23 09 07 07 83 01 00 00 67 03 0c 00 10 00 00 3c
02 3a 80 18 71 38 2d 40 58 2c 45 00 ba 89 21 00
00 1e 01 1d 00 72 51 d0 1e 20 6e 28 55 00 ba 89
21 00 00 1e 01 1d 00 72 51 d0 1e 20 6e 28 55 00
ba 89 21 00 00 18 01 1d 00 72 51 d0 1e 20 6e 28
55 00 ba 89 21 00 00 18 f0 3c 00 d0 51 a0 35 50
60 88 3a 00 ba 89 21 00 00 1c 00 00 00 00 00 4e

----------------

Block 0, Base EDID:
  EDID Structure Version & Revision: 1.3
  Vendor & Product Identification:
    Manufacturer: VSC
    Model: 12942
    Serial Number: ...
    Made in: week 46 of 2016
  Basic Display Parameters & Features:
    Digital display
    Maximum image size: 70 cm x 39 cm
    Gamma: 2.20
    DPMS levels: Off
    RGB color display
    Default (sRGB) color space is primary color space
    First detailed timing is the preferred timing
  Color Characteristics:
    Red  : 0.6357, 0.3564
    Green: 0.3095, 0.6337
    Blue : 0.1533, 0.0673
    White: 0.3134, 0.3291
  Established Timings I & II:
    IBM     :   720x400    70.081663 Hz   9:5     31.467 kHz     28.320000 MHz
    DMT 0x04:   640x480    59.940476 Hz   4:3     31.469 kHz     25.175000 MHz
    Apple   :   640x480    66.666667 Hz   4:3     35.000 kHz     30.240000 MHz
    DMT 0x05:   640x480    72.808802 Hz   4:3     37.861 kHz     31.500000 MHz
    DMT 0x06:   640x480    75.000000 Hz   4:3     37.500 kHz     31.500000 MHz
    DMT 0x08:   800x600    56.250000 Hz   4:3     35.156 kHz     36.000000 MHz
    DMT 0x09:   800x600    60.316541 Hz   4:3     37.879 kHz     40.000000 MHz
    DMT 0x0a:   800x600    72.187572 Hz   4:3     48.077 kHz     50.000000 MHz
    DMT 0x0b:   800x600    75.000000 Hz   4:3     46.875 kHz     49.500000 MHz
    Apple   :   832x624    74.551266 Hz   4:3     49.726 kHz     57.284000 MHz
    DMT 0x10:  1024x768    60.003840 Hz   4:3     48.363 kHz     65.000000 MHz
    DMT 0x11:  1024x768    70.069359 Hz   4:3     56.476 kHz     75.000000 MHz
    DMT 0x12:  1024x768    75.028582 Hz   4:3     60.023 kHz     78.750000 MHz
    DMT 0x24:  1280x1024   75.024675 Hz   5:4     79.976 kHz    135.000000 MHz
    Apple   :  1152x870    75.061550 Hz 192:145   68.681 kHz    100.000000 MHz
  Standard Timings:
    DMT 0x52:  1920x1080   60.000000 Hz  16:9     67.500 kHz    148.500000 MHz
    DMT 0x3a:  1680x1050   59.954250 Hz  16:10    65.290 kHz    146.250000 MHz
    DMT 0x33:  1600x1200   60.000000 Hz   4:3     75.000 kHz    162.000000 MHz
    DMT 0x53:  1600x900    60.000000 Hz  16:9     60.000 kHz    108.000000 MHz (RB)
    DMT 0x2f:  1440x900    59.887445 Hz  16:10    55.935 kHz    106.500000 MHz
    DMT 0x2a:  1400x1050   59.978442 Hz   4:3     65.317 kHz    121.750000 MHz
    DMT 0x23:  1280x1024   60.019740 Hz   5:4     63.981 kHz    108.000000 MHz
    DMT 0x55:  1280x720    60.000000 Hz  16:9     45.000 kHz     74.250000 MHz
  Detailed Timing Descriptors:
    DTD  1:  2560x1440   59.950550 Hz  16:9     88.787 kHz    241.500000 MHz (698 mm x 393 mm)
                  Hfront   48 Hsync  32 Hback   80 Hpol N
                  Vfront    3 Vsync   5 Vback   33 Vpol P
    Display Product Serial Number: ...
    Display Range Limits:
      Monitor ranges (GTF): 24-75 Hz V, 15-101 kHz H, max dotclock 320 MHz
    Display Product Name: 'VX3209-2K'
  Extension blocks: 1
Checksum: 0x18

----------------

Block 1, CTA-861 Extension Block:
  Revision: 3
  Underscans IT Video Formats by default
  Basic audio support
  Native detailed modes: 1
  Video Data Block:
    VIC  16:  1920x1080   60.000000 Hz  16:9     67.500 kHz    148.500000 MHz
    VIC  31:  1920x1080   50.000000 Hz  16:9     56.250 kHz    148.500000 MHz
    VIC  31:  1920x1080   50.000000 Hz  16:9     56.250 kHz    148.500000 MHz
    VIC  31:  1920x1080   50.000000 Hz  16:9     56.250 kHz    148.500000 MHz
    VIC   4:  1280x720    60.000000 Hz  16:9     45.000 kHz     74.250000 MHz
    VIC  19:  1280x720    50.000000 Hz  16:9     37.500 kHz     74.250000 MHz
    VIC   3:   720x480    59.940060 Hz  16:9     31.469 kHz     27.000000 MHz
    VIC  19:  1280x720    50.000000 Hz  16:9     37.500 kHz     74.250000 MHz
    VIC   2:   720x480    59.940060 Hz   4:3     31.469 kHz     27.000000 MHz
    VIC  19:  1280x720    50.000000 Hz  16:9     37.500 kHz     74.250000 MHz
    VIC   1:   640x480    59.940476 Hz   4:3     31.469 kHz     25.175000 MHz
  Audio Data Block:
    Linear PCM:
      Max channels: 2
      Supported sample rates (kHz): 48 44.1 32
      Supported sample sizes (bits): 24 20 16
  Speaker Allocation Data Block:
    FL/FR - Front Left/Right
  Vendor-Specific Data Block (HDMI), OUI 00-0C-03:
    Source physical address: 1.0.0.0
    Maximum TMDS clock: 300 MHz
  Detailed Timing Descriptors:
    DTD  2:  1920x1080   60.000000 Hz  16:9     67.500 kHz    148.500000 MHz (698 mm x 393 mm)
                  Hfront   88 Hsync  44 Hback  148 Hpol P
                  Vfront    4 Vsync   5 Vback   36 Vpol P
    DTD  3:  1280x720    60.000000 Hz  16:9     45.000 kHz     74.250000 MHz (698 mm x 393 mm)
                  Hfront  110 Hsync  40 Hback  220 Hpol P
                  Vfront    5 Vsync   5 Vback   20 Vpol P
    DTD  4:  1280x720    60.000000 Hz  16:9     45.000 kHz     74.250000 MHz (698 mm x 393 mm)
                  Hfront  110 Hsync  40 Hback  220 Hpol N
                  Vfront    5 Vsync   5 Vback   20 Vpol N
    DTD  5:  1280x720    60.000000 Hz  16:9     45.000 kHz     74.250000 MHz (698 mm x 393 mm)
                  Hfront  110 Hsync  40 Hback  220 Hpol N
                  Vfront    5 Vsync   5 Vback   20 Vpol N
    DTD  6:  1280x1440   59.912620 Hz   8:9     89.450 kHz    156.000000 MHz (698 mm x 393 mm)
                  Hfront   96 Hsync 136 Hback  232 Hpol N
                  Vfront    3 Vsync  10 Vback   40 Vpol P
Checksum: 0x4e  Unused space in Extension Block: 5 bytes

----------------

Block 2, Unknown EDID Extension Block 0x00:
  00 ff ff ff ff ff ff 00 5a 63 8e 32 01 01 01 01 '........Zc.2....'
  2e 1a 01 03 80 46 27 78 2e d5 55 a2 5b 4f a2 27 '.....F'x..U.[O.''
  11 50 54 bf ef 80 d1 c0 b3 00 a9 40 a9 c0 95 00 '.PT........@....'
  90 40 81 80 81 c0 56 5e 00 a0 a0 a0 29 50 30 20 '.@....V^....)P0 '
  35 00 ba 89 21 00 00 1c 00 00 00 ff 00 55 52 58 '5...!........URX'
  31 36 34 36 30 31 33 35 30 0a 00 00 00 fd 00 18 '164601350.......'
  4b 0f 65 20 00 0a 20 20 20 20 20 20 00 00 00 fc 'K.e ..      ....'
  00 56 58 33 32 30 39 2d 32 4b 0a 20 20 20 01 18 '.VX3209-2K.   ..'
Checksum: 0x18

----------------

Block 3, CTA-861 Extension Block:
  Revision: 3
  Underscans IT Video Formats by default
  Basic audio support
  Native detailed modes: 1
  Video Data Block:
    VIC  16:  1920x1080   60.000000 Hz  16:9     67.500 kHz    148.500000 MHz
    VIC  31:  1920x1080   50.000000 Hz  16:9     56.250 kHz    148.500000 MHz
    VIC  31:  1920x1080   50.000000 Hz  16:9     56.250 kHz    148.500000 MHz
    VIC  31:  1920x1080   50.000000 Hz  16:9     56.250 kHz    148.500000 MHz
    VIC   4:  1280x720    60.000000 Hz  16:9     45.000 kHz     74.250000 MHz
    VIC  19:  1280x720    50.000000 Hz  16:9     37.500 kHz     74.250000 MHz
    VIC   3:   720x480    59.940060 Hz  16:9     31.469 kHz     27.000000 MHz
    VIC  19:  1280x720    50.000000 Hz  16:9     37.500 kHz     74.250000 MHz
    VIC   2:   720x480    59.940060 Hz   4:3     31.469 kHz     27.000000 MHz
    VIC  19:  1280x720    50.000000 Hz  16:9     37.500 kHz     74.250000 MHz
    VIC   1:   640x480    59.940476 Hz   4:3     31.469 kHz     25.175000 MHz
  Audio Data Block:
    Linear PCM:
      Max channels: 2
      Supported sample rates (kHz): 48 44.1 32
      Supported sample sizes (bits): 24 20 16
  Speaker Allocation Data Block:
    FL/FR - Front Left/Right
  Vendor-Specific Data Block (HDMI), OUI 00-0C-03:
    Source physical address: 1.0.0.0
    Maximum TMDS clock: 300 MHz
  Detailed Timing Descriptors:
    DTD  7:  1920x1080   60.000000 Hz  16:9     67.500 kHz    148.500000 MHz (698 mm x 393 mm)
                  Hfront   88 Hsync  44 Hback  148 Hpol P
                  Vfront    4 Vsync   5 Vback   36 Vpol P
    DTD  8:  1280x720    60.000000 Hz  16:9     45.000 kHz     74.250000 MHz (698 mm x 393 mm)
                  Hfront  110 Hsync  40 Hback  220 Hpol P
                  Vfront    5 Vsync   5 Vback   20 Vpol P
    DTD  9:  1280x720    60.000000 Hz  16:9     45.000 kHz     74.250000 MHz (698 mm x 393 mm)
                  Hfront  110 Hsync  40 Hback  220 Hpol N
                  Vfront    5 Vsync   5 Vback   20 Vpol N
    DTD 10:  1280x720    60.000000 Hz  16:9     45.000 kHz     74.250000 MHz (698 mm x 393 mm)
                  Hfront  110 Hsync  40 Hback  220 Hpol N
                  Vfront    5 Vsync   5 Vback   20 Vpol N
    DTD 11:  1280x1440   59.912620 Hz   8:9     89.450 kHz    156.000000 MHz (698 mm x 393 mm)
                  Hfront   96 Hsync 136 Hback  232 Hpol N
                  Vfront    3 Vsync  10 Vback   40 Vpol P
Checksum: 0x4e  Unused space in Extension Block: 5 bytes

----------------

Warnings:

Block 1, CTA-861 Extension Block:
  Detailed Timing Descriptor #4: DTD is similar but not identical to VIC 4.
  Detailed Timing Descriptor #5: DTD is similar but not identical to VIC 4.
  Display Product Serial Number is set, so the Serial Number in the Base EDID should be 0.
Block 3, CTA-861 Extension Block:
  Detailed Timing Descriptor #9: DTD is similar but not identical to VIC 4.
  Detailed Timing Descriptor #10: DTD is similar but not identical to VIC 4.
  Display Product Serial Number is set, so the Serial Number in the Base EDID should be 0.

Failures:

Block 0, Base EDID:
  Basic Display Parameters & Features: sRGB is signaled, but the chromaticities do not match.
Block 1, CTA-861 Extension Block:
  Video Data Block: Duplicate VIC 31.
  Video Data Block: Duplicate VIC 19.
  Missing VCDB, needed for Set Selectable RGB Quantization to avoid interop issues.
Block 2, Base EDID:
  Unknown Extension Block.
Block 3, CTA-861 Extension Block:
  Video Data Block: Duplicate VIC 16.
  Video Data Block: Duplicate VIC 4.
  Video Data Block: Duplicate VIC 3.
  Video Data Block: Duplicate VIC 2.
  Video Data Block: Duplicate VIC 1.
  Speaker Allocation Data Block: Only one instance of this Data Block is allowed.
  Missing VCDB, needed for Set Selectable RGB Quantization to avoid interop issues.
EDID:
  Base EDID: EDID specified 1 extension block(s), but found 3 extension block(s).
  Base EDID: EDID 1.3 requires a Block Map Extension in Block 1 if there are more than 2 blocks in the EDID.

EDID conformity: FAIL
