edid-decode (hex):

00 ff ff ff ff ff ff 00 41 0c f3 08 11 54 00 00
02 1a 01 03 80 50 22 78 2a ca 95 a6 55 4e a1 26
0f 50 54 bd 4b 00 d1 c0 81 80 81 40 95 0f 95 00
b3 00 81 c0 01 01 de a3 70 e0 d4 a0 35 50 00 70
3a 50 1e 4f 31 00 00 1c ef 51 70 e0 d4 a0 35 50
00 70 3a 50 1e 4f 31 00 00 1c 00 00 00 fc 00 50
48 4c 20 42 44 4d 33 34 39 30 0a 20 00 00 00 fd
00 17 50 1e 63 2d 00 0a 20 20 20 20 20 20 01 94

----------------

Block 0, Base EDID:
  EDID Structure Version & Revision: 1.3
  Vendor & Product Identification:
    Manufacturer: PHL
    Model: 2291
    Serial Number: ...
    Made in: week 2 of 2016
  Basic Display Parameters & Features:
    Digital display
    Maximum image size: 80 cm x 34 cm
    Gamma: 2.20
    DPMS levels: Off
    RGB color display
    First detailed timing is preferred timing
  Color Characteristics:
    Red  : 0.6513, 0.3320
    Green: 0.3066, 0.6308
    Blue : 0.1503, 0.0595
    White: 0.3134, 0.3291
  Established Timings I & II:
    IBM     :   720x400    70.082 Hz   9:5    31.467 kHz  28.320 MHz
    DMT 0x04:   640x480    59.940 Hz   4:3    31.469 kHz  25.175 MHz
    Apple   :   640x480    66.667 Hz   4:3    35.000 kHz  30.240 MHz
    DMT 0x05:   640x480    72.809 Hz   4:3    37.861 kHz  31.500 MHz
    DMT 0x06:   640x480    75.000 Hz   4:3    37.500 kHz  31.500 MHz
    DMT 0x09:   800x600    60.317 Hz   4:3    37.879 kHz  40.000 MHz
    DMT 0x0b:   800x600    75.000 Hz   4:3    46.875 kHz  49.500 MHz
    DMT 0x10:  1024x768    60.004 Hz   4:3    48.363 kHz  65.000 MHz
    DMT 0x12:  1024x768    75.029 Hz   4:3    60.023 kHz  78.750 MHz
    DMT 0x24:  1280x1024   75.025 Hz   5:4    79.976 kHz 135.000 MHz
  Standard Timings:
    DMT 0x52:  1920x1080   60.000 Hz  16:9    67.500 kHz 148.500 MHz
    DMT 0x23:  1280x1024   60.020 Hz   5:4    63.981 kHz 108.000 MHz
    DMT 0x20:  1280x960    60.000 Hz   4:3    60.000 kHz 108.000 MHz
    DMT 0x30:  1440x900    74.984 Hz  16:10   70.635 kHz 136.750 MHz
    DMT 0x2f:  1440x900    59.887 Hz  16:10   55.935 kHz 106.500 MHz
    DMT 0x3a:  1680x1050   59.954 Hz  16:10   65.290 kHz 146.250 MHz
    DMT 0x55:  1280x720    60.000 Hz  16:9    45.000 kHz  74.250 MHz
  Detailed Timing Descriptors:
    DTD 1:  3440x1440   59.936 Hz  43:18   89.484 kHz 419.500 MHz (798 mm x 335 mm)
                 Hfront  256 Hsync 368 Hback 624 Hpol N
                 Vfront    3 Vsync  10 Vback  40 Vpol P
    DTD 2:  3440x1440   29.968 Hz  43:18   44.742 kHz 209.750 MHz (798 mm x 335 mm)
                 Hfront  256 Hsync 368 Hback 624 Hpol N
                 Vfront    3 Vsync  10 Vback  40 Vpol P
    Display Product Name: 'PHL BDM3490'
  Display Range Limits:
    Monitor ranges (GTF): 23-80 Hz V, 30-99 kHz H, max dotclock 450 MHz
  Extension blocks: 1
Checksum: 0x94

----------------

Failures:

Block 0, Base EDID:
  Base EDID: EDID specified 1 extension block(s), but found 0 extension block(s).

EDID conformity: FAIL
