edid-decode (hex):

00 ff ff ff ff ff ff 00 08 59 32 00 01 00 00 00
01 15 01 03 00 2b 1a 78 0a d0 dd a9 53 49 9d 23
11 47 4a af 4e 00 01 01 01 01 01 01 01 01 01 01
01 01 01 01 01 01 66 21 50 b0 51 00 1b 30 40 70
36 00 e4 10 11 00 00 1e f1 27 00 a0 51 00 25 30
50 80 37 00 80 80 21 00 00 1c 00 00 00 fc 00 44
58 2d 31 39 45 32 32 30 41 31 32 0a 00 00 00 fd
00 37 4c 1e 50 11 00 0a 20 20 20 20 20 20 00 e3

----------------

Block 0, Base EDID:
  EDID Structure Version & Revision: 1.3
  Vendor & Product Identification:
    Manufacturer: BBY
    Model: 50
    Serial Number: ...
    Made in: week 1 of 2011
  Basic Display Parameters & Features:
    Analog display
    Input voltage level: 0.7/0.3 V
    Blank level equals black level
    Maximum image size: 43 cm x 26 cm
    Gamma: 2.20
    RGB color display
    First detailed timing is the preferred timing
  Color Characteristics:
    Red  : 0.6630, 0.3251
    Green: 0.2851, 0.6132
    Blue : 0.1396, 0.0673
    White: 0.2802, 0.2900
  Established Timings I & II:
    IBM     :   720x400    70.082 Hz   9:5    31.467 kHz  28.320 MHz
    DMT 0x04:   640x480    59.940 Hz   4:3    31.469 kHz  25.175 MHz
    DMT 0x05:   640x480    72.809 Hz   4:3    37.861 kHz  31.500 MHz
    DMT 0x06:   640x480    75.000 Hz   4:3    37.500 kHz  31.500 MHz
    DMT 0x08:   800x600    56.250 Hz   4:3    35.156 kHz  36.000 MHz
    DMT 0x09:   800x600    60.317 Hz   4:3    37.879 kHz  40.000 MHz
    DMT 0x0b:   800x600    75.000 Hz   4:3    46.875 kHz  49.500 MHz
    DMT 0x10:  1024x768    60.004 Hz   4:3    48.363 kHz  65.000 MHz
    DMT 0x11:  1024x768    70.069 Hz   4:3    56.476 kHz  75.000 MHz
    DMT 0x12:  1024x768    75.029 Hz   4:3    60.023 kHz  78.750 MHz
  Standard Timings: none
  Detailed Timing Descriptors:
    DTD 1:  1360x768    60.015 Hz  85:48   47.712 kHz  85.500 MHz (484 mm x 272 mm)
                 Hfront   64 Hsync 112 Hback 256 Hpol P
                 Vfront    3 Vsync   6 Vback  18 Vpol P
    DTD 2:  1280x768    74.893 Hz   5:3    60.289 kHz 102.250 MHz (640 mm x 384 mm)
                 Hfront   80 Hsync 128 Hback 208 Hpol N
                 Vfront    3 Vsync   7 Vback  27 Vpol P
    Display Product Name: 'DX-19E220A12'
  Display Range Limits:
    Monitor ranges (GTF): 55-76 Hz V, 30-80 kHz H, max dotclock 170 MHz
Checksum: 0xe3

----------------

Failures:

Block 0, Base EDID:
  Detailed Timing Descriptor #1: Mismatch of image size 484x272 mm vs display size 430x260 mm.
  Detailed Timing Descriptor #2: Mismatch of image size 640x384 mm vs display size 430x260 mm.

EDID conformity: FAIL
