
EDID (hex):
00ffffffffffff001e6dfe56a4620100
011401046a301b78eaaec5a2574a9c25
125054a54b00b3008180714f81cf814f
0101010101011a3680a070381f403020
2500dd0d1100001a023a801871382d40
582c4500dd0d1100001e000000fd0038
4b1e530f000a202020202020000000fc
0057323234330a202020202020200099

Extracted contents:
header:          00 ff ff ff ff ff ff 00
serial number:   1e 6d fe 56 a4 62 01 00 01 14
version:         01 04
basic params:    6a 30 1b 78 ea
chroma info:     ae c5 a2 57 4a 9c 25 12 50 54
established:     a5 4b 00
standard:        b3 00 81 80 71 4f 81 cf 81 4f 01 01 01 01 01 01
descriptor 1:    1a 36 80 a0 70 38 1f 40 30 20 25 00 dd 0d 11 00 00 1a
descriptor 2:    02 3a 80 18 71 38 2d 40 58 2c 45 00 dd 0d 11 00 00 1e
descriptor 3:    00 00 00 fd 00 38 4b 1e 53 0f 00 0a 20 20 20 20 20 20
descriptor 4:    00 00 00 fc 00 57 32 32 34 33 0a 20 20 20 20 20 20 20
extensions:      00
checksum:        99

EDID version: 1.4
Manufacturer: GSM Model 56fe Serial Number --
Made in week 1 of 2010
Analog display, Input voltage level: 0.7/0.7 V
Blank level equals black level
Sync: Separate SyncOnGreen 
Maximum image size: 48 cm x 27 cm
Gamma: 2.20
DPMS levels: Standby Suspend Off
RGB color display
First detailed timing includes the native pixel format and preferred refresh rate
Display x,y Chromaticity:
  Red:   0.6347, 0.3417
  Green: 0.2919, 0.6113
  Blue:  0.1474, 0.0703
  White: 0.3134, 0.3291
Established timings supported:
  720x400@70Hz 9:5 HorFreq: 31469 Hz Clock: 28.320 MHz
  640x480@60Hz 4:3 HorFreq: 31469 Hz Clock: 25.175 MHz
  640x480@75Hz 4:3 HorFreq: 37500 Hz Clock: 31.500 MHz
  800x600@60Hz 4:3 HorFreq: 37900 Hz Clock: 40.000 MHz
  800x600@75Hz 4:3 HorFreq: 46900 Hz Clock: 49.500 MHz
  1024x768@60Hz 4:3 HorFreq: 48400 Hz Clock: 65.000 MHz
  1024x768@75Hz 4:3 HorFreq: 60000 Hz Clock: 78.750 MHz
  1280x1024@75Hz 5:4 HorFreq: 80000 Hz Clock: 135.000 MHz
Standard timings supported:
  1680x1050@60Hz 16:10 HorFreq: 64700 Hz Clock: 119.000 MHz
  1280x1024@60Hz 5:4 HorFreq: 64000 Hz Clock: 108.000 MHz
  1152x864@75Hz 4:3 HorFreq: 67500 Hz Clock: 108.000 MHz
  1280x720@75Hz 16:9
  1280x960@75Hz 4:3
Detailed mode: Clock 138.500 MHz, 477 mm x 269 mm
               1920 1968 2000 2080 hborder 0
               1080 1082 1087 1111 vborder 0
               +hsync -vsync 
               VertFreq: 59 Hz, HorFreq: 66586 Hz
Detailed mode: Clock 148.500 MHz, 477 mm x 269 mm
               1920 2008 2052 2200 hborder 0
               1080 1084 1089 1125 vborder 0
               +hsync +vsync 
               VertFreq: 60 Hz, HorFreq: 67500 Hz
Monitor ranges (GTF): 56-75Hz V, 30-83kHz H, max dotclock 150MHz
Monitor name: W2243
Checksum: 0x99 (valid)
