
EDID (hex):
00ffffffffffff005a63385101010101
111f0104b54627783f3f3ba95047b025
105155bfef80e1c0d140d100d1c0b300
9500818081c04dd000a0f0703e803020
3500b9882100001e000000ff00565359
3231313730303639320a000000fd0032
4b188c3c000a202020202020000000fc
005658333237362d5548440a202001ed
02032bf150e1601005040203131f145a
591d1e111223097f0783010000e305e0
01e20f03e6060701616011565e00a0a0
a029503020350055502100001a1a6800
a0f0381f4030203a0055502100001a08
e80030f2705a80b0588a005550210000
1ee77c70a0d0a0295030203a00555021
00001a00000000000000000000000003

Extracted contents:
header:          00 ff ff ff ff ff ff 00
serial number:   5a 63 38 51 01 01 01 01 11 1f
version:         01 04
basic params:    b5 46 27 78 3f
chroma info:     3f 3b a9 50 47 b0 25 10 51 55
established:     bf ef 80
standard:        e1 c0 d1 40 d1 00 d1 c0 b3 00 95 00 81 80 81 c0
descriptor 1:    4d d0 00 a0 f0 70 3e 80 30 20 35 00 b9 88 21 00 00 1e
descriptor 2:    00 00 00 ff 00 56 53 59 32 31 31 37 30 30 36 39 32 0a
descriptor 3:    00 00 00 fd 00 32 4b 18 8c 3c 00 0a 20 20 20 20 20 20
descriptor 4:    00 00 00 fc 00 56 58 33 32 37 36 2d 55 48 44 0a 20 20
extensions:      01
checksum:        ed

EDID version: 1.4
Manufacturer: VSC Model 5138 Serial Number --
Made in week 17 of 2021
Digital display
10 bits per primary color channel
DisplayPort interface
Maximum image size: 70 cm x 39 cm
Gamma: 2.20
DPMS levels: Off
Supported color formats: RGB 4:4:4, YCrCb 4:4:4, YCrCb 4:2:2
Default (sRGB) color space is primary color space
First detailed timing includes the native pixel format and preferred refresh rate
Display is continuous frequency
Display x,y Chromaticity:
  Red:   0.6601, 0.3154
  Green: 0.2802, 0.6904
  Blue:  0.1445, 0.0654
  White: 0.3183, 0.3349
Established timings supported:
  720x400@70Hz 9:5 HorFreq: 31469 Hz Clock: 28.320 MHz
  640x480@60Hz 4:3 HorFreq: 31469 Hz Clock: 25.175 MHz
  640x480@67Hz 4:3 HorFreq: 35000 Hz Clock: 30.240 MHz
  640x480@72Hz 4:3 HorFreq: 37900 Hz Clock: 31.500 MHz
  640x480@75Hz 4:3 HorFreq: 37500 Hz Clock: 31.500 MHz
  800x600@56Hz 4:3 HorFreq: 35200 Hz Clock: 36.000 MHz
  800x600@60Hz 4:3 HorFreq: 37900 Hz Clock: 40.000 MHz
  800x600@72Hz 4:3 HorFreq: 48100 Hz Clock: 50.000 MHz
  800x600@75Hz 4:3 HorFreq: 46900 Hz Clock: 49.500 MHz
  832x624@75Hz 4:3 HorFreq: 49726 Hz Clock: 57.284 MHz
  1024x768@60Hz 4:3 HorFreq: 48400 Hz Clock: 65.000 MHz
  1024x768@70Hz 4:3 HorFreq: 56500 Hz Clock: 75.000 MHz
  1024x768@75Hz 4:3 HorFreq: 60000 Hz Clock: 78.750 MHz
  1280x1024@75Hz 5:4 HorFreq: 80000 Hz Clock: 135.000 MHz
  1152x870@75Hz 192:145 HorFreq: 67500 Hz Clock: 108.000 MHz
Standard timings supported:
  2048x1152@60Hz 16:9
  1920x1440@60Hz 4:3 HorFreq: 90000 Hz Clock: 234.000 MHz
  1920x1200@60Hz 16:10 HorFreq: 74000 Hz Clock: 154.000 MHz
  1920x1080@60Hz 16:9
  1680x1050@60Hz 16:10 HorFreq: 64700 Hz Clock: 119.000 MHz
  1440x900@60Hz 16:10 HorFreq: 55500 Hz Clock: 88.750 MHz
  1280x1024@60Hz 5:4 HorFreq: 64000 Hz Clock: 108.000 MHz
  1280x720@60Hz 16:9
Detailed mode: Clock 533.250 MHz, 697 mm x 392 mm
               3840 3888 3920 4000 hborder 0
               2160 2163 2168 2222 vborder 0
               +hsync +vsync 
               VertFreq: 59 Hz, HorFreq: 133312 Hz
Serial number: --
Monitor ranges (GTF): 50-75Hz V, 24-140kHz H, max dotclock 600MHz
Monitor name: VX3276-UHD
Has 1 extension blocks
Checksum: 0xed (valid)

CTA extension block
Extension version: 3
39 bytes of CTA data
  Video data block
    VIC 225 Unknown mode  HorFreq: 0 Hz Clock: 0.000 MHz
    VIC  96 3840x2160@50Hz 16:9  HorFreq: 112500 Hz Clock: 594.000 MHz
    VIC  16 1920x1080@60Hz 16:9  HorFreq: 67500 Hz Clock: 148.500 MHz
    VIC   5 1920x1080i@60Hz 16:9  HorFreq: 33750 Hz Clock: 74.250 MHz
    VIC   4 1280x720@60Hz 16:9  HorFreq: 45000 Hz Clock: 74.250 MHz
    VIC   2 720x480@60Hz 4:3  HorFreq: 31469 Hz Clock: 27.000 MHz
    VIC   3 720x480@60Hz 16:9  HorFreq: 31469 Hz Clock: 27.000 MHz
    VIC  19 1280x720@50Hz 16:9  HorFreq: 37500 Hz Clock: 74.250 MHz
    VIC  31 1920x1080@50Hz 16:9  HorFreq: 56250 Hz Clock: 148.500 MHz
    VIC  20 1920x1080i@50Hz 16:9  HorFreq: 28125 Hz Clock: 74.250 MHz
    VIC  90 2560x1080@60Hz 64:27  HorFreq: 66000 Hz Clock: 198.000 MHz
    VIC  89 2560x1080@50Hz 64:27  HorFreq: 56250 Hz Clock: 185.625 MHz
    VIC  29 1440x576@50Hz 4:3  HorFreq: 31250 Hz Clock: 54.000 MHz
    VIC  30 1440x576@50Hz 16:9  HorFreq: 31250 Hz Clock: 54.000 MHz
    VIC  17 720x576@50Hz 4:3  HorFreq: 31250 Hz Clock: 27.000 MHz
    VIC  18 720x576@50Hz 16:9  HorFreq: 31250 Hz Clock: 27.000 MHz
  Audio data block
    Linear PCM, max channels 2
      Supported sample rates (kHz): 192 176.4 96 88.2 48 44.1 32
      Supported sample sizes (bits): 24 20 16
  Speaker allocation data block
    Speaker map:
      FL/FR - Front Left/Right
  Extended tag: Colorimetry data block
    BT2020cYCC
    BT2020YCC
    BT2020RGB
  Extended tag: YCbCr 4:2:0 capability map data block
    VSD Index 0
    VSD Index 1
  Extended tag: HDR static metadata data block
    Electro optical transfer functions:
      Traditional gamma - SDR luminance range
      Traditional gamma - HDR luminance range
      SMPTE ST2084
    Supported static metadata descriptors:
      Static metadata type 1
    Desired content max luminance: 97 (408.759 cd/m^2)
    Desired content max frame-average luminance: 96 (400.000 cd/m^2)
    Desired content min luminance: 17 (0.018 cd/m^2)
Underscans PC formats by default
Basic audio support
Supports YCbCr 4:4:4
Supports YCbCr 4:2:2
1 native detailed modes
Detailed mode: Clock 241.500 MHz, 597 mm x 336 mm
               2560 2608 2640 2720 hborder 0
               1440 1443 1448 1481 vborder 0
               +hsync -vsync 
               VertFreq: 59 Hz, HorFreq: 88786 Hz
Detailed mode: Clock 266.500 MHz, 597 mm x 336 mm
               3840 3888 3920 4000 hborder 0
               1080 1083 1093 1111 vborder 0
               +hsync -vsync 
               VertFreq: 59 Hz, HorFreq: 66625 Hz
Detailed mode: Clock 594.000 MHz, 597 mm x 336 mm
               3840 4016 4104 4400 hborder 0
               2160 2168 2178 2250 vborder 0
               +hsync +vsync 
               VertFreq: 60 Hz, HorFreq: 135000 Hz
Detailed mode: Clock 319.750 MHz, 597 mm x 336 mm
               3440 3488 3520 3600 hborder 0
               1440 1443 1453 1481 vborder 0
               +hsync -vsync 
               VertFreq: 59 Hz, HorFreq: 88819 Hz
Checksum: 0x3 (valid)

EDID block does NOT conform to EDID 1.4!
	sRGB is signaled, but the chromaticities do not match
EDID block does not conform at all!
	Both the serial number and the serial string are set
