edid-decode (hex):

00 ff ff ff ff ff ff 00 4c 2d 0a 71 42 32 4a 34
31 1f 01 03 80 35 1d 78 ea b6 e0 a3 56 50 a0 27
0e 50 54 bf ef 00 81 80 81 bc 95 00 95 3c b3 00
b3 3c d1 c0 d1 fc 02 3a 80 18 71 38 2d 40 58 2c
45 00 0f 28 21 00 00 1e 00 00 00 fd 00 30 90 1e
b4 24 00 0a 20 20 20 20 20 20 00 00 00 ff 00 48
34 43 52 43 30 31 31 37 33 44 00 20 00 00 00 fc
00 46 32 34 47 33 78 54 46 0a 20 20 20 20 01 d6

02 03 37 f1 4c 90 1f 05 14 04 13 03 12 02 11 01
3f 23 09 07 07 83 01 00 00 67 03 0c 00 20 00 38
42 67 d8 5d c4 01 5c 80 00 6d 1a 00 00 02 05 30
90 ed 00 00 00 00 00 27 83 80 a0 70 38 29 40 30
20 35 00 0f 28 21 00 00 1e 86 6f 80 a0 70 38 40
40 30 20 35 00 0f 28 21 00 00 1e 00 00 00 00 00
00 00 00 00 00 00 00 00 00 00 00 00 00 00 00 00
00 00 00 00 00 00 00 00 00 00 00 00 00 00 00 ec

00 ff ff ff ff ff ff 00 4c 2d 0a 71 42 32 4a 34
31 1f 01 03 80 35 1d 78 ea b6 e0 a3 56 50 a0 27
0e 50 54 bf ef 00 81 80 81 bc 95 00 95 3c b3 00
b3 3c d1 c0 d1 fc 02 3a 80 18 71 38 2d 40 58 2c
45 00 0f 28 21 00 00 1e 00 00 00 fd 00 30 90 1e
b4 24 00 0a 20 20 20 20 20 20 00 00 00 ff 00 48
34 43 52 43 30 31 31 37 33 44 00 20 00 00 00 fc
00 46 32 34 47 33 78 54 46 0a 20 20 20 20 01 d6

02 03 37 f1 4c 90 1f 05 14 04 13 03 12 02 11 01
3f 23 09 07 07 83 01 00 00 67 03 0c 00 20 00 38
42 67 d8 5d c4 01 5c 80 00 6d 1a 00 00 02 05 30
90 ed 00 00 00 00 00 27 83 80 a0 70 38 29 40 30
20 35 00 0f 28 21 00 00 1e 86 6f 80 a0 70 38 40
40 30 20 35 00 0f 28 21 00 00 1e 00 00 00 00 00
00 00 00 00 00 00 00 00 00 00 00 00 00 00 00 00
00 00 00 00 00 00 00 00 00 00 00 00 00 00 00 ec

----------------

Block 0, Base EDID:
  EDID Structure Version & Revision: 1.3
  Vendor & Product Identification:
    Manufacturer: SAM
    Model: 28938
    Serial Number: ...
    Made in: week 49 of 2021
  Basic Display Parameters & Features:
    Digital display
    Maximum image size: 53 cm x 29 cm
    Gamma: 2.20
    DPMS levels: Standby Suspend Off
    RGB color display
    First detailed timing is the preferred timing
  Color Characteristics:
    Red  : 0.6386, 0.3388
    Green: 0.3134, 0.6269
    Blue : 0.1552, 0.0566
    White: 0.3125, 0.3281
  Established Timings I & II:
    IBM     :   720x400    70.081663 Hz   9:5     31.467 kHz     28.320000 MHz
    DMT 0x04:   640x480    59.940476 Hz   4:3     31.469 kHz     25.175000 MHz
    Apple   :   640x480    66.666667 Hz   4:3     35.000 kHz     30.240000 MHz
    DMT 0x05:   640x480    72.808802 Hz   4:3     37.861 kHz     31.500000 MHz
    DMT 0x06:   640x480    75.000000 Hz   4:3     37.500 kHz     31.500000 MHz
    DMT 0x08:   800x600    56.250000 Hz   4:3     35.156 kHz     36.000000 MHz
    DMT 0x09:   800x600    60.316541 Hz   4:3     37.879 kHz     40.000000 MHz
    DMT 0x0a:   800x600    72.187572 Hz   4:3     48.077 kHz     50.000000 MHz
    DMT 0x0b:   800x600    75.000000 Hz   4:3     46.875 kHz     49.500000 MHz
    Apple   :   832x624    74.551266 Hz   4:3     49.726 kHz     57.284000 MHz
    DMT 0x10:  1024x768    60.003840 Hz   4:3     48.363 kHz     65.000000 MHz
    DMT 0x11:  1024x768    70.069359 Hz   4:3     56.476 kHz     75.000000 MHz
    DMT 0x12:  1024x768    75.028582 Hz   4:3     60.023 kHz     78.750000 MHz
    DMT 0x24:  1280x1024   75.024675 Hz   5:4     79.976 kHz    135.000000 MHz
  Standard Timings:
    DMT 0x23:  1280x1024   60.019740 Hz   5:4     63.981 kHz    108.000000 MHz
    GTF     :  1280x1024  120.000185 Hz   5:4    131.640 kHz    233.793000 MHz
    DMT 0x2f:  1440x900    59.887445 Hz  16:10    55.935 kHz    106.500000 MHz
    GTF     :  1440x900   119.999896 Hz  16:10   115.800 kHz    229.747000 MHz
    DMT 0x3a:  1680x1050   59.954250 Hz  16:10    65.290 kHz    146.250000 MHz
    GTF     :  1680x1050  120.000000 Hz  16:10   135.000 kHz    313.200000 MHz
    DMT 0x52:  1920x1080   60.000000 Hz  16:9     67.500 kHz    148.500000 MHz
    GTF     :  1920x1080  119.999987 Hz  16:9    138.840 kHz    368.759000 MHz
  Detailed Timing Descriptors:
    DTD 1:  1920x1080   60.000000 Hz  16:9     67.500 kHz    148.500000 MHz (527 mm x 296 mm)
                 Hfront   88 Hsync  44 Hback  148 Hpol P
                 Vfront    4 Vsync   5 Vback   36 Vpol P
    Display Range Limits:
      Monitor ranges (GTF): 48-144 Hz V, 30-180 kHz H, max dotclock 360 MHz
    Display Product Serial Number: ...
    Display Product Name: 'F24G3xTF'
  Extension blocks: 1
Checksum: 0xd6

----------------

Block 1, CTA-861 Extension Block:
  Revision: 3
  Underscans IT Video Formats by default
  Basic audio support
  Supports YCbCr 4:4:4
  Supports YCbCr 4:2:2
  Native detailed modes: 1
  Video Data Block:
    VIC  16:  1920x1080   60.000000 Hz  16:9     67.500 kHz    148.500000 MHz (native)
    VIC  31:  1920x1080   50.000000 Hz  16:9     56.250 kHz    148.500000 MHz
    VIC   5:  1920x1080i  60.000000 Hz  16:9     33.750 kHz     74.250000 MHz
    VIC  20:  1920x1080i  50.000000 Hz  16:9     28.125 kHz     74.250000 MHz
    VIC   4:  1280x720    60.000000 Hz  16:9     45.000 kHz     74.250000 MHz
    VIC  19:  1280x720    50.000000 Hz  16:9     37.500 kHz     74.250000 MHz
    VIC   3:   720x480    59.940060 Hz  16:9     31.469 kHz     27.000000 MHz
    VIC  18:   720x576    50.000000 Hz  16:9     31.250 kHz     27.000000 MHz
    VIC   2:   720x480    59.940060 Hz   4:3     31.469 kHz     27.000000 MHz
    VIC  17:   720x576    50.000000 Hz   4:3     31.250 kHz     27.000000 MHz
    VIC   1:   640x480    59.940476 Hz   4:3     31.469 kHz     25.175000 MHz
    VIC  63:  1920x1080  120.000000 Hz  16:9    135.000 kHz    297.000000 MHz
  Audio Data Block:
    Linear PCM:
      Max channels: 2
      Supported sample rates (kHz): 48 44.1 32
      Supported sample sizes (bits): 24 20 16
  Speaker Allocation Data Block:
    FL/FR - Front Left/Right
  Vendor-Specific Data Block (HDMI), OUI 00-0C-03:
    Source physical address: 2.0.0.0
    DC_36bit
    DC_30bit
    DC_Y444
    Maximum TMDS clock: 330 MHz
  Vendor-Specific Data Block (HDMI Forum), OUI C4-5D-D8:
    Version: 1
    Maximum TMDS Character Rate: 460 MHz
    SCDC Present
  Vendor-Specific Data Block (AMD), OUI 00-00-1A:
    Version: 2.5
    Minimum Refresh Rate: 48 Hz
    Maximum Refresh Rate: 144 Hz
    Flags 1.x: 0xed (MCCS)
    Flags 2.x: 0x00
    Maximum luminance: 0 (50.000 cd/m^2)
    Minimum luminance: 0 (0.000 cd/m^2)
    Unknown: 0x00 0x00
  Detailed Timing Descriptors:
    DTD 2:  1920x1080  143.994888 Hz  16:9    161.418 kHz    335.750000 MHz (527 mm x 296 mm)
                 Hfront   48 Hsync  32 Hback   80 Hpol P
                 Vfront    3 Vsync   5 Vback   33 Vpol P
    DTD 3:  1920x1080  119.982181 Hz  16:9    137.260 kHz    285.500000 MHz (527 mm x 296 mm)
                 Hfront   48 Hsync  32 Hback   80 Hpol P
                 Vfront    3 Vsync   5 Vback   56 Vpol P
Checksum: 0xec  Unused space in Extension Block: 36 bytes

----------------

Block 2, Unknown EDID Extension Block 0x00:
  00 ff ff ff ff ff ff 00 4c 2d 0a 71 42 32 4a 34 '........L-.qB2J4'
  31 1f 01 03 80 35 1d 78 ea b6 e0 a3 56 50 a0 27 '1....5.x....VP.''
  0e 50 54 bf ef 00 81 80 81 bc 95 00 95 3c b3 00 '.PT..........<..'
  b3 3c d1 c0 d1 fc 02 3a 80 18 71 38 2d 40 58 2c '.<.....:..q8-@X,'
  45 00 0f 28 21 00 00 1e 00 00 00 fd 00 30 90 1e 'E..(!........0..'
  b4 24 00 0a 20 20 20 20 20 20 00 00 00 ff 00 48 '.$..      .....H'
  34 43 52 43 30 31 31 37 33 44 00 20 00 00 00 fc '4CRC01173D. ....'
  00 46 32 34 47 33 78 54 46 0a 20 20 20 20 01 d6 '.F24G3xTF.    ..'
Checksum: 0xd6

----------------

Block 3, CTA-861 Extension Block:
  Revision: 3
  Underscans IT Video Formats by default
  Basic audio support
  Supports YCbCr 4:4:4
  Supports YCbCr 4:2:2
  Native detailed modes: 1
  Video Data Block:
    VIC  16:  1920x1080   60.000000 Hz  16:9     67.500 kHz    148.500000 MHz (native)
    VIC  31:  1920x1080   50.000000 Hz  16:9     56.250 kHz    148.500000 MHz
    VIC   5:  1920x1080i  60.000000 Hz  16:9     33.750 kHz     74.250000 MHz
    VIC  20:  1920x1080i  50.000000 Hz  16:9     28.125 kHz     74.250000 MHz
    VIC   4:  1280x720    60.000000 Hz  16:9     45.000 kHz     74.250000 MHz
    VIC  19:  1280x720    50.000000 Hz  16:9     37.500 kHz     74.250000 MHz
    VIC   3:   720x480    59.940060 Hz  16:9     31.469 kHz     27.000000 MHz
    VIC  18:   720x576    50.000000 Hz  16:9     31.250 kHz     27.000000 MHz
    VIC   2:   720x480    59.940060 Hz   4:3     31.469 kHz     27.000000 MHz
    VIC  17:   720x576    50.000000 Hz   4:3     31.250 kHz     27.000000 MHz
    VIC   1:   640x480    59.940476 Hz   4:3     31.469 kHz     25.175000 MHz
    VIC  63:  1920x1080  120.000000 Hz  16:9    135.000 kHz    297.000000 MHz
  Audio Data Block:
    Linear PCM:
      Max channels: 2
      Supported sample rates (kHz): 48 44.1 32
      Supported sample sizes (bits): 24 20 16
  Speaker Allocation Data Block:
    FL/FR - Front Left/Right
  Vendor-Specific Data Block (HDMI), OUI 00-0C-03:
    Source physical address: 2.0.0.0
    DC_36bit
    DC_30bit
    DC_Y444
    Maximum TMDS clock: 330 MHz
  Vendor-Specific Data Block (HDMI Forum), OUI C4-5D-D8:
    Version: 1
    Maximum TMDS Character Rate: 460 MHz
    SCDC Present
  Vendor-Specific Data Block (AMD), OUI 00-00-1A:
    Version: 2.5
    Minimum Refresh Rate: 48 Hz
    Maximum Refresh Rate: 144 Hz
    Flags 1.x: 0xed (MCCS)
    Flags 2.x: 0x00
    Maximum luminance: 0 (50.000 cd/m^2)
    Minimum luminance: 0 (0.000 cd/m^2)
    Unknown: 0x00 0x00
  Detailed Timing Descriptors:
    DTD 4:  1920x1080  143.994888 Hz  16:9    161.418 kHz    335.750000 MHz (527 mm x 296 mm)
                 Hfront   48 Hsync  32 Hback   80 Hpol P
                 Vfront    3 Vsync   5 Vback   33 Vpol P
    DTD 5:  1920x1080  119.982181 Hz  16:9    137.260 kHz    285.500000 MHz (527 mm x 296 mm)
                 Hfront   48 Hsync  32 Hback   80 Hpol P
                 Vfront    3 Vsync   5 Vback   56 Vpol P
Checksum: 0xec  Unused space in Extension Block: 36 bytes

----------------

Warnings:

Block 1, CTA-861 Extension Block:
  Display Product Serial Number is set, so the Serial Number in the Base EDID should be 0.
  Add a Colorimetry Data Block with the sRGB colorimetry bit set to avoid interop issues.
Block 3, CTA-861 Extension Block:
  Display Product Serial Number is set, so the Serial Number in the Base EDID should be 0.
  Add a Colorimetry Data Block with the sRGB colorimetry bit set to avoid interop issues.
EDID:
  CTA-861: Multiple native progressive timings are defined.

Failures:

Block 0, Base EDID:
  Display Product Serial Number: ...
Block 1, CTA-861 Extension Block:
  Missing VCDB, needed for Set Selectable RGB Quantization to avoid interop issues.
Block 2, Base EDID:
  Unknown Extension Block.
Block 3, CTA-861 Extension Block:
  Video Data Block: Duplicate VIC 16.
  Video Data Block: Duplicate VIC 31.
  Video Data Block: Duplicate VIC 5.
  Video Data Block: Duplicate VIC 20.
  Video Data Block: Duplicate VIC 4.
  Video Data Block: Duplicate VIC 19.
  Video Data Block: Duplicate VIC 3.
  Video Data Block: Duplicate VIC 18.
  Video Data Block: Duplicate VIC 2.
  Video Data Block: Duplicate VIC 17.
  Video Data Block: Duplicate VIC 1.
  Video Data Block: Duplicate VIC 63.
  Speaker Allocation Data Block: Only one instance of this Data Block is allowed.
  Vendor-Specific Data Block (HDMI Forum), OUI C4-5D-D8: Duplicate HDMI Forum VSDB/SCDB.
  Missing VCDB, needed for Set Selectable RGB Quantization to avoid interop issues.
EDID:
  Base EDID: Some timings are out of range of the Monitor Ranges:
    Horizontal Freq: 28.125 - 161.418 kHz (Monitor: 30.000 - 180.000 kHz)
    Maximum Clock: 368.759 MHz (Monitor: 360.000 MHz)
  Base EDID: EDID specified 1 extension block(s), but found 3 extension block(s).
  Base EDID: EDID 1.3 requires a Block Map Extension in Block 1 if there are more than 2 blocks in the EDID.

EDID conformity: FAIL
