
EDID (hex):
00ffffffffffff002462594d00000000
0d1d010380361f782a9055a75553a028
135054b36c00714f818081c081009500
b300d1c00101023a801871382d40582c
45001f2e2100001e7cdd80c870382140
304035001f2e2100001e000000fd0030
f21eff3c000a202020202020000000fc
005058352048617961627573610a0177
02032ff14b010304121305141f07903f
230907078301000065030c00100067d8
5dc401788000681a0000010130f0ed7c
2e90a0601a1e4030203600202f210000
1a866f80a07038404030203500202f21
00001efe7e807270381e401820350020
2f2100001e0000000000000000000000
000000000000000000000000000000a8

Extracted contents:
header:          00 ff ff ff ff ff ff 00
serial number:   24 62 59 4d 00 00 00 00 0d 1d
version:         01 03
basic params:    80 36 1f 78 2a
chroma info:     90 55 a7 55 53 a0 28 13 50 54
established:     b3 6c 00
standard:        71 4f 81 80 81 c0 81 00 95 00 b3 00 d1 c0 01 01
descriptor 1:    02 3a 80 18 71 38 2d 40 58 2c 45 00 1f 2e 21 00 00 1e
descriptor 2:    7c dd 80 c8 70 38 21 40 30 40 35 00 1f 2e 21 00 00 1e
descriptor 3:    00 00 00 fd 00 30 f2 1e ff 3c 00 0a 20 20 20 20 20 20
descriptor 4:    00 00 00 fc 00 50 58 35 20 48 61 79 61 62 75 73 61 0a
extensions:      01
checksum:        77

EDID version: 1.3
Manufacturer: ICB Model 4d59 Serial Number --
Made in week 13 of 2019
Digital display
Maximum image size: 54 cm x 31 cm
Gamma: 2.20
DPMS levels: Off
RGB color display
First detailed timing is preferred timing
Display x,y Chromaticity:
  Red:   0.6542, 0.3330
  Green: 0.3242, 0.6250
  Blue:  0.1572, 0.0751
  White: 0.3134, 0.3291
Established timings supported:
  720x400@70Hz 9:5 HorFreq: 31469 Hz Clock: 28.320 MHz
  640x480@60Hz 4:3 HorFreq: 31469 Hz Clock: 25.175 MHz
  640x480@67Hz 4:3 HorFreq: 35000 Hz Clock: 30.240 MHz
  800x600@56Hz 4:3 HorFreq: 35200 Hz Clock: 36.000 MHz
  800x600@60Hz 4:3 HorFreq: 37900 Hz Clock: 40.000 MHz
  800x600@75Hz 4:3 HorFreq: 46900 Hz Clock: 49.500 MHz
  832x624@75Hz 4:3 HorFreq: 49726 Hz Clock: 57.284 MHz
  1024x768@60Hz 4:3 HorFreq: 48400 Hz Clock: 65.000 MHz
  1024x768@70Hz 4:3 HorFreq: 56500 Hz Clock: 75.000 MHz
Standard timings supported:
  1152x864@75Hz 4:3 HorFreq: 67500 Hz Clock: 108.000 MHz
  1280x1024@60Hz 5:4 HorFreq: 64000 Hz Clock: 108.000 MHz
  1280x720@60Hz 16:9
  1280x800@60Hz 16:10
  1440x900@60Hz 16:10 HorFreq: 55500 Hz Clock: 88.750 MHz
  1680x1050@60Hz 16:10 HorFreq: 64700 Hz Clock: 119.000 MHz
  1920x1080@60Hz 16:9
Detailed mode: Clock 148.500 MHz, 543 mm x 302 mm
               1920 2008 2052 2200 hborder 0
               1080 1084 1089 1125 vborder 0
               +hsync +vsync 
               VertFreq: 60 Hz, HorFreq: 67500 Hz
Detailed mode: Clock 567.000 MHz, 543 mm x 302 mm
               1920 1968 2032 2120 hborder 0
               1080 1083 1088 1113 vborder 0
               +hsync +vsync 
               VertFreq: 240 Hz, HorFreq: 267452 Hz
Monitor ranges (GTF): 48-242Hz V, 30-255kHz H, max dotclock 600MHz
Monitor name: PX5 Hayabusa
Has 1 extension blocks
Checksum: 0x77 (valid)

CTA extension block
Extension version: 3
43 bytes of CTA data
  Video data block
    VIC   1 640x480@60Hz 4:3  HorFreq: 31469 Hz Clock: 25.175 MHz
    VIC   3 720x480@60Hz 16:9  HorFreq: 31469 Hz Clock: 27.000 MHz
    VIC   4 1280x720@60Hz 16:9  HorFreq: 45000 Hz Clock: 74.250 MHz
    VIC  18 720x576@50Hz 16:9  HorFreq: 31250 Hz Clock: 27.000 MHz
    VIC  19 1280x720@50Hz 16:9  HorFreq: 37500 Hz Clock: 74.250 MHz
    VIC   5 1920x1080i@60Hz 16:9  HorFreq: 33750 Hz Clock: 74.250 MHz
    VIC  20 1920x1080i@50Hz 16:9  HorFreq: 28125 Hz Clock: 74.250 MHz
    VIC  31 1920x1080@50Hz 16:9  HorFreq: 56250 Hz Clock: 148.500 MHz
    VIC   7 1440x480i@60Hz 16:9  HorFreq: 15734 Hz Clock: 27.000 MHz
    VIC  16 1920x1080@60Hz 16:9 (native) HorFreq: 67500 Hz Clock: 148.500 MHz
    VIC  63 1920x1080@120Hz 16:9  HorFreq: 135000 Hz Clock: 297.000 MHz
  Audio data block
    Linear PCM, max channels 2
      Supported sample rates (kHz): 48 44.1 32
      Supported sample sizes (bits): 24 20 16
  Speaker allocation data block
    Speaker map:
      FL/FR - Front Left/Right
  Vendor-specific data block, OUI 000c03 (HDMI)
    Source physical address 1.0.0.0
  Vendor-specific data block, OUI c45dd8 (HDMI Forum)
    Version: 1
    Maximum TMDS Character Rate: 600MHz
    SCDC Present
  Vendor-specific data block, OUI 00001a
Underscans PC formats by default
Basic audio support
Supports YCbCr 4:4:4
Supports YCbCr 4:2:2
1 native detailed modes
Detailed mode: Clock 119.000 MHz, 544 mm x 303 mm
               1680 1728 1760 1840 hborder 0
               1050 1053 1059 1080 vborder 0
               +hsync -vsync 
               VertFreq: 59 Hz, HorFreq: 64673 Hz
Detailed mode: Clock 285.500 MHz, 544 mm x 303 mm
               1920 1968 2000 2080 hborder 0
               1080 1083 1088 1144 vborder 0
               +hsync +vsync 
               VertFreq: 119 Hz, HorFreq: 137259 Hz
Detailed mode: Clock 325.100 MHz, 544 mm x 303 mm
               1920 1944 1976 2034 hborder 0
               1080 1083 1088 1110 vborder 0
               +hsync +vsync 
               VertFreq: 143 Hz, HorFreq: 159832 Hz
Checksum: 0xa8 (valid)

One or more of the timings is out of range of the Monitor Ranges:
  Vertical Freq: 50 - 240 Hz
  Horizontal Freq: 15734 - 267452 Hz
  Maximum Clock: 567.000 MHz
