edid-decode (hex):

00 ff ff ff ff ff ff 00 4c 2d 90 0f 57 35 46 30
06 1f 01 03 80 35 1e 78 2a 2f ad a4 54 47 99 26
0f 47 4a bf ef 80 81 c0 81 00 81 80 95 00 a9 c0
b3 00 71 4f 01 01 02 3a 80 18 71 38 2d 40 58 2c
45 00 14 30 21 00 00 1e 00 00 00 fd 00 30 90 1e
aa 23 00 0a 20 20 20 20 20 20 00 00 00 fc 00 4c
43 32 34 52 47 35 30 0a 20 20 20 20 00 00 00 ff
00 48 4e 41 52 32 30 31 33 34 35 0a 20 20 01 ad

00 ff ff ff ff ff ff 00 4c 2d 90 0f 57 35 46 30
06 1f 01 03 80 35 1e 78 2a 2f ad a4 54 47 99 26
0f 47 4a bf ef 80 81 c0 81 00 81 80 95 00 a9 c0
b3 00 71 4f 01 01 02 3a 80 18 71 38 2d 40 58 2c
45 00 14 30 21 00 00 1e 00 00 00 fd 00 30 90 1e
aa 23 00 0a 20 20 20 20 20 20 00 00 00 fc 00 4c
43 32 34 52 47 35 30 0a 20 20 20 20 00 00 00 ff
00 48 4e 41 52 32 30 31 33 34 35 0a 20 20 01 ad

----------------

Block 0, Base EDID:
  EDID Structure Version & Revision: 1.3
  Vendor & Product Identification:
    Manufacturer: SAM
    Model: 3984
    Serial Number: ...
    Made in: week 6 of 2021
  Basic Display Parameters & Features:
    Digital display
    Maximum image size: 53 cm x 30 cm
    Gamma: 2.20
    DPMS levels: Off
    RGB color display
    First detailed timing is the preferred timing
  Color Characteristics:
    Red  : 0.6406, 0.3300
    Green: 0.2802, 0.6005
    Blue : 0.1503, 0.0605
    White: 0.2802, 0.2900
  Established Timings I & II:
    IBM     :   720x400    70.081663 Hz   9:5     31.467 kHz     28.320000 MHz
    DMT 0x04:   640x480    59.940476 Hz   4:3     31.469 kHz     25.175000 MHz
    Apple   :   640x480    66.666667 Hz   4:3     35.000 kHz     30.240000 MHz
    DMT 0x05:   640x480    72.808802 Hz   4:3     37.861 kHz     31.500000 MHz
    DMT 0x06:   640x480    75.000000 Hz   4:3     37.500 kHz     31.500000 MHz
    DMT 0x08:   800x600    56.250000 Hz   4:3     35.156 kHz     36.000000 MHz
    DMT 0x09:   800x600    60.316541 Hz   4:3     37.879 kHz     40.000000 MHz
    DMT 0x0a:   800x600    72.187572 Hz   4:3     48.077 kHz     50.000000 MHz
    DMT 0x0b:   800x600    75.000000 Hz   4:3     46.875 kHz     49.500000 MHz
    Apple   :   832x624    74.551266 Hz   4:3     49.726 kHz     57.284000 MHz
    DMT 0x10:  1024x768    60.003840 Hz   4:3     48.363 kHz     65.000000 MHz
    DMT 0x11:  1024x768    70.069359 Hz   4:3     56.476 kHz     75.000000 MHz
    DMT 0x12:  1024x768    75.028582 Hz   4:3     60.023 kHz     78.750000 MHz
    DMT 0x24:  1280x1024   75.024675 Hz   5:4     79.976 kHz    135.000000 MHz
    Apple   :  1152x870    75.061550 Hz 192:145   68.681 kHz    100.000000 MHz
  Standard Timings:
    DMT 0x55:  1280x720    60.000000 Hz  16:9     45.000 kHz     74.250000 MHz
    DMT 0x1c:  1280x800    59.810326 Hz  16:10    49.702 kHz     83.500000 MHz
    DMT 0x23:  1280x1024   60.019740 Hz   5:4     63.981 kHz    108.000000 MHz
    DMT 0x2f:  1440x900    59.887445 Hz  16:10    55.935 kHz    106.500000 MHz
    DMT 0x53:  1600x900    60.000000 Hz  16:9     60.000 kHz    108.000000 MHz (RB)
    DMT 0x3a:  1680x1050   59.954250 Hz  16:10    65.290 kHz    146.250000 MHz
    DMT 0x15:  1152x864    75.000000 Hz   4:3     67.500 kHz    108.000000 MHz
  Detailed Timing Descriptors:
    DTD 1:  1920x1080   60.000000 Hz  16:9     67.500 kHz    148.500000 MHz (532 mm x 304 mm)
                 Hfront   88 Hsync  44 Hback  148 Hpol P
                 Vfront    4 Vsync   5 Vback   36 Vpol P
    Display Range Limits:
      Monitor ranges (GTF): 48-144 Hz V, 30-170 kHz H, max dotclock 350 MHz
    Display Product Name: 'LC24RG50'
    Display Product Serial Number: ...
  Extension blocks: 1
Checksum: 0xad

----------------

Block 1, Unknown EDID Extension Block 0x00:
  00 ff ff ff ff ff ff 00 4c 2d 90 0f 57 35 46 30 '........L-..W5F0'
  06 1f 01 03 80 35 1e 78 2a 2f ad a4 54 47 99 26 '.....5.x*/..TG.&'
  0f 47 4a bf ef 80 81 c0 81 00 81 80 95 00 a9 c0 '.GJ.............'
  b3 00 71 4f 01 01 02 3a 80 18 71 38 2d 40 58 2c '..qO...:..q8-@X,'
  45 00 14 30 21 00 00 1e 00 00 00 fd 00 30 90 1e 'E..0!........0..'
  aa 23 00 0a 20 20 20 20 20 20 00 00 00 fc 00 4c '.#..      .....L'
  43 32 34 52 47 35 30 0a 20 20 20 20 00 00 00 ff 'C24RG50.    ....'
  00 48 4e 41 52 32 30 31 33 34 35 0a 20 20 01 ad '.HNAR201345.  ..'
Checksum: 0xad

----------------

Failures:

Block 1, Base EDID:
  Unknown Extension Block.

EDID conformity: FAIL
