edid-decode (hex):

00 ff ff ff ff ff ff 00 06 10 cb 9c 01 01 01 01
01 13 01 03 80 1d 12 78 0a c5 95 a3 57 4f 9c 26
0f 50 54 00 00 00 01 01 01 01 01 01 01 01 01 01
01 01 01 01 01 01 52 1c 00 8f 50 20 2e 30 30 20
36 00 1e b3 10 00 00 18 00 00 00 01 00 06 10 20
00 00 00 00 00 00 00 00 0a 20 00 00 00 fe 00 42
31 33 33 45 57 30 37 20 56 32 0a 20 00 00 00 fe
00 43 6f 6c 6f 72 20 4c 43 44 0a 20 20 20 00 63

----------------

Block 0, Base EDID:
  EDID Structure Version & Revision: 1.3
  Vendor & Product Identification:
    Manufacturer: APP
    Model: 40139
    Serial Number: ...
    Made in: week 1 of 2009
  Basic Display Parameters & Features:
    Digital display
    Maximum image size: 29 cm x 18 cm
    Gamma: 2.20
    RGB color display
    First detailed timing is preferred timing
  Color Characteristics:
    Red  : 0.6396, 0.3398
    Green: 0.3095, 0.6103
    Blue : 0.1503, 0.0595
    White: 0.3134, 0.3291
  Established Timings I & II: none
  Standard Timings: none
  Detailed Timing Descriptors:
    DTD 1:  1280x800    60.223 Hz   8:5    50.949 kHz  72.500 MHz (286 mm x 179 mm)
                 Hfront   48 Hsync  32 Hback  63 Hpol N
                 Vfront    3 Vsync   6 Vback  37 Vpol N
    Manufacturer-Specified Display Descriptor (0x01): 00 01 00 06 10 20 00 00 00 00 00 00 00 00 0a 20 '..... ......... '
    Alphanumeric Data String: 'B133EW07 V2'
    Alphanumeric Data String: 'Color LCD'
Checksum: 0x63
