
EDID (hex):
00ffffffffffff0026cf1c0600000000
001b0104a52213780a1d39a750479727
134f5400000001010101010101010101
010101010101706c80a0703820401830
3c0058c210000019000000fe004d3135
364e564634205230200a000000030004
35ff053c902920449000000000000003
00061aff0f3c24281044240101000063

Extracted contents:
header:          00 ff ff ff ff ff ff 00
serial number:   26 cf 1c 06 00 00 00 00 00 1b
version:         01 04
basic params:    a5 22 13 78 0a
chroma info:     1d 39 a7 50 47 97 27 13 4f 54
established:     00 00 00
standard:        01 01 01 01 01 01 01 01 01 01 01 01 01 01 01 01
descriptor 1:    70 6c 80 a0 70 38 20 40 18 30 3c 00 58 c2 10 00 00 19
descriptor 2:    00 00 00 fe 00 4d 31 35 36 4e 56 46 34 20 52 30 20 0a
descriptor 3:    00 00 00 03 00 04 35 ff 05 3c 90 29 20 44 90 00 00 00
descriptor 4:    00 00 00 03 00 06 1a ff 0f 3c 24 28 10 44 24 01 01 00
extensions:      00
checksum:        63

EDID version: 1.4
Manufacturer: IVO Model 61c Serial Number --
Made in year 2017
Digital display
8 bits per primary color channel
DisplayPort interface
Maximum image size: 34 cm x 19 cm
Gamma: 2.20
Supported color formats: RGB 4:4:4, YCrCb 4:4:4
First detailed timing includes the native pixel format and preferred refresh rate
Display x,y Chromaticity:
  Red:   0.6523, 0.3134
  Green: 0.2802, 0.5908
  Blue:  0.1523, 0.0771
  White: 0.3105, 0.3291
Established timings supported:
Standard timings supported:
Detailed mode: Clock 277.600 MHz, 344 mm x 194 mm
               1920 1944 1992 2080 hborder 0
               1080 1083 1095 1112 vborder 0
               -hsync -vsync 
               VertFreq: 120 Hz, HorFreq: 133461 Hz
ASCII string: M156NVF4 R0 
Manufacturer-specified data, tag 3
Manufacturer-specified data, tag 3
Checksum: 0x63 (valid)
EDID block does NOT conform to EDID 1.4!
	Missing name descriptor
	Missing monitor ranges
