edid-decode (hex):

00 ff ff ff ff ff ff 00 30 e4 8f 01 00 00 00 00
00 12 01 03 80 21 15 78 0a be 85 98 59 52 8c 28
26 50 54 00 00 00 01 01 01 01 01 01 01 01 01 01
01 01 01 01 01 01 42 3b 80 5e 70 b0 38 40 1e 1e
36 00 4b cf 10 00 00 1a 42 3b 80 5e 70 b0 ac 42
1e 1e 36 00 4b cf 10 00 00 19 00 00 00 fe 00 48
54 30 30 39 80 31 35 34 57 55 32 0a 00 00 00 00
00 00 00 00 00 00 00 00 00 02 01 0a 20 20 00 b7

----------------

Block 0, Base EDID:
  EDID Structure Version & Revision: 1.3
  Vendor & Product Identification:
    Manufacturer: LGD
    Model: 399
    Made in: 2008
  Basic Display Parameters & Features:
    Digital display
    Maximum image size: 33 cm x 21 cm
    Gamma: 2.20
    RGB color display
    First detailed timing is preferred timing
  Color Characteristics:
    Red  : 0.5957, 0.3505
    Green: 0.3232, 0.5488
    Blue : 0.1582, 0.1484
    White: 0.3134, 0.3291
  Established Timings I & II: none
  Standard Timings: none
  Detailed Timing Descriptors:
    DTD 1:  1920x1200   59.970 Hz   8:5    75.323 kHz 151.700 MHz (331 mm x 207 mm)
                 Hfront   30 Hsync  30 Hback  34 Hpol P
                 Vfront    3 Vsync   6 Vback  47 Vpol N
    DTD 2:  1920x1200   39.980 Hz   8:5    75.323 kHz 151.700 MHz (331 mm x 207 mm)
                 Hfront   30 Hsync  30 Hback  34 Hpol N
                 Vfront    3 Vsync   6 Vback 675 Vpol N
    Alphanumeric Data String: 'HT009'
    Manufacturer-Specified Display Descriptor (0x00): 00 00 00 00 00 00 00 00 00 00 00 02 01 0a 20 20 '..............  '
Checksum: 0xb7
