edid-decode (hex):

00 ff ff ff ff ff ff 00 0d af 93 15 00 00 00 00
08 14 01 03 80 22 13 78 0a d1 f5 93 5d 59 90 26
1d 50 54 00 00 00 01 01 01 01 01 01 01 01 01 01
01 01 01 01 01 01 12 1b 56 64 50 00 14 30 10 22
26 00 58 c1 10 00 00 18 00 00 00 fe 00 4e 31 35
36 42 33 2d 4c 30 42 0a 20 20 00 00 00 fe 00 43
4d 4f 0a 20 20 20 20 20 20 20 20 20 00 00 00 fe
00 4e 31 35 36 42 33 2d 4c 30 42 0a 20 20 00 76

----------------

Block 0, Base EDID:
  EDID Structure Version & Revision: 1.3
  Vendor & Product Identification:
    Manufacturer: CMO
    Model: 5523
    Made in: week 8 of 2010
  Basic Display Parameters & Features:
    Digital display
    Maximum image size: 34 cm x 19 cm
    Gamma: 2.20
    RGB color display
    First detailed timing is the preferred timing
  Color Characteristics:
    Red  : 0.5771, 0.3642
    Green: 0.3476, 0.5634
    Blue : 0.1513, 0.1162
    White: 0.3134, 0.3291
  Established Timings I & II: none
  Standard Timings: none
  Detailed Timing Descriptors:
    DTD 1:  1366x768    59.989197 Hz 683:384   47.271 kHz     69.300000 MHz (344 mm x 193 mm)
                 Hfront   16 Hsync  34 Hback   50 Hpol N
                 Vfront    2 Vsync   6 Vback   12 Vpol N
    Alphanumeric Data String: 'N156B3-L0B'
    Alphanumeric Data String: 'CMO'
    Alphanumeric Data String: 'N156B3-L0B'
Checksum: 0x76

----------------

Failures:

Block 0, Base EDID:
  Missing Display Product Name.
  Missing Display Range Limits Descriptor.

EDID conformity: FAIL
