
EDID (hex):
00ffffffffffff0030e4e90200000000
00150104901f11780aaab59558568d28
1f505400000001010101010101010101
010101010101ce1d56f4500016302428
350035ae10000019df1356f450001630
2428350035ae10000019000000000000
00000000000000000000000000000002
000c4cff0a3c64191422640000000014

Extracted contents:
header:          00 ff ff ff ff ff ff 00
serial number:   30 e4 e9 02 00 00 00 00 00 15
version:         01 04
basic params:    90 1f 11 78 0a
chroma info:     aa b5 95 58 56 8d 28 1f 50 54
established:     00 00 00
standard:        01 01 01 01 01 01 01 01 01 01 01 01 01 01 01 01
descriptor 1:    ce 1d 56 f4 50 00 16 30 24 28 35 00 35 ae 10 00 00 19
descriptor 2:    df 13 56 f4 50 00 16 30 24 28 35 00 35 ae 10 00 00 19
descriptor 3:    00 00 00 00 00 00 00 00 00 00 00 00 00 00 00 00 00 00
descriptor 4:    00 00 00 02 00 0c 4c ff 0a 3c 64 19 14 22 64 00 00 00
extensions:      00
checksum:        14

EDID version: 1.4
Manufacturer: LGD Model 2e9 Serial Number --
Made in year 2011
Digital display
6 bits per primary color channel
Digital interface is not defined
Maximum image size: 31 cm x 17 cm
Gamma: 2.20
Supported color formats: RGB 4:4:4, YCrCb 4:4:4
First detailed timing includes the native pixel format and preferred refresh rate
Display x,y Chromaticity:
  Red:   0.5839, 0.3457
  Green: 0.3378, 0.5527
  Blue:  0.1582, 0.1240
  White: 0.3134, 0.3291
Established timings supported:
Standard timings supported:
Detailed mode: Clock 76.300 MHz, 309 mm x 174 mm
               1366 1402 1442 1610 hborder 0
                768  771  776  790 vborder 0
               -hsync -vsync 
               VertFreq: 59 Hz, HorFreq: 47391 Hz
Detailed mode: Clock 50.870 MHz, 309 mm x 174 mm
               1366 1402 1442 1610 hborder 0
                768  771  776  790 vborder 0
               -hsync -vsync 
               VertFreq: 39 Hz, HorFreq: 31596 Hz
Manufacturer-specified data, tag 0
Manufacturer-specified data, tag 2
Checksum: 0x14 (valid)
EDID block does NOT conform to EDID 1.4!
	Missing name descriptor
	Missing monitor ranges
