edid-decode (hex):

00 ff ff ff ff ff ff 00 1e f9 ed 08 00 00 00 00
0c 11 01 03 68 30 1e 78 2a d5 15 a4 55 49 9a 27
14 50 54 af cf 00 81 80 71 4f 90 40 95 00 95 0f
b3 00 b3 0f 01 01 21 39 90 30 62 1a 27 40 68 b0
36 00 d9 28 11 00 00 1c 00 00 00 fc 00 46 50 44
32 32 37 35 57 0a 20 20 20 20 00 00 00 fd 00 38
4c 1f 53 13 00 0a 20 20 20 20 20 20 00 00 00 ff
00 4d 58 4c 37 33 44 30 43 30 37 35 39 30 00 37

00 ff ff ff ff ff ff 00 1e f9 ed 08 00 00 00 00
0c 11 01 03 68 30 1e 78 2a d5 15 a4 55 49 9a 27
14 50 54 af cf 00 81 80 71 4f 90 40 95 00 95 0f
b3 00 b3 0f 01 01 21 39 90 30 62 1a 27 40 68 b0
36 00 d9 28 11 00 00 1c 00 00 00 fc 00 46 50 44
32 32 37 35 57 0a 20 20 20 20 00 00 00 fd 00 38
4c 1f 53 13 00 0a 20 20 20 20 20 20 00 00 00 ff
00 4d 58 4c 37 33 44 30 43 30 37 35 39 30 00 37

----------------

Block 0, Base EDID:
  EDID Structure Version & Revision: 1.3
  Vendor & Product Identification:
    Manufacturer: GWY
    Model: 2285
    Made in: week 12 of 2007
  Basic Display Parameters & Features:
    Analog display
    Signal Level Standard: 0.700 : 0.000 : 0.700 V p-p
    Blank level equals black level
    Sync: Separate
    Maximum image size: 48 cm x 30 cm
    Gamma: 2.20
    DPMS levels: Off
    RGB color display
    First detailed timing is the preferred timing
  Color Characteristics:
    Red  : 0.6435, 0.3330
    Green: 0.2861, 0.6025
    Blue : 0.1523, 0.0791
    White: 0.3134, 0.3291
  Established Timings I & II:
    IBM     :   720x400    70.081663 Hz   9:5     31.467 kHz     28.320000 MHz
    DMT 0x04:   640x480    59.940476 Hz   4:3     31.469 kHz     25.175000 MHz
    DMT 0x05:   640x480    72.808802 Hz   4:3     37.861 kHz     31.500000 MHz
    DMT 0x06:   640x480    75.000000 Hz   4:3     37.500 kHz     31.500000 MHz
    DMT 0x08:   800x600    56.250000 Hz   4:3     35.156 kHz     36.000000 MHz
    DMT 0x09:   800x600    60.316541 Hz   4:3     37.879 kHz     40.000000 MHz
    DMT 0x0a:   800x600    72.187572 Hz   4:3     48.077 kHz     50.000000 MHz
    DMT 0x0b:   800x600    75.000000 Hz   4:3     46.875 kHz     49.500000 MHz
    DMT 0x10:  1024x768    60.003840 Hz   4:3     48.363 kHz     65.000000 MHz
    DMT 0x11:  1024x768    70.069359 Hz   4:3     56.476 kHz     75.000000 MHz
    DMT 0x12:  1024x768    75.028582 Hz   4:3     60.023 kHz     78.750000 MHz
    DMT 0x24:  1280x1024   75.024675 Hz   5:4     79.976 kHz    135.000000 MHz
  Standard Timings:
    DMT 0x23:  1280x1024   60.019740 Hz   5:4     63.981 kHz    108.000000 MHz
    DMT 0x15:  1152x864    75.000000 Hz   4:3     67.500 kHz    108.000000 MHz
    DMT 0x2a:  1400x1050   59.978442 Hz   4:3     65.317 kHz    121.750000 MHz
    DMT 0x2f:  1440x900    59.887445 Hz  16:10    55.935 kHz    106.500000 MHz
    DMT 0x30:  1440x900    74.984427 Hz  16:10    70.635 kHz    136.750000 MHz
    DMT 0x3a:  1680x1050   59.954250 Hz  16:10    65.290 kHz    146.250000 MHz
    DMT 0x3b:  1680x1050   74.892027 Hz  16:10    82.306 kHz    187.000000 MHz
  Detailed Timing Descriptors:
    DTD 1:  1680x1050   59.954250 Hz  16:10    65.290 kHz    146.250000 MHz (473 mm x 296 mm)
                 Hfront  104 Hsync 176 Hback  280 Hpol N
                 Vfront    3 Vsync   6 Vback   30 Vpol P
    Display Product Name: 'FPD2275W'
    Display Range Limits:
      Monitor ranges (GTF): 56-76 Hz V, 31-83 kHz H, max dotclock 190 MHz
    Display Product Serial Number: ...
Checksum: 0x37

----------------

Block 1, Unknown EDID Extension Block 0x00:
  00 ff ff ff ff ff ff 00 1e f9 ed 08 00 00 00 00 '................'
  0c 11 01 03 68 30 1e 78 2a d5 15 a4 55 49 9a 27 '....h0.x*...UI.''
  14 50 54 af cf 00 81 80 71 4f 90 40 95 00 95 0f '.PT.....qO.@....'
  b3 00 b3 0f 01 01 21 39 90 30 62 1a 27 40 68 b0 '......!9.0b.'@h.'
  36 00 d9 28 11 00 00 1c 00 00 00 fc 00 46 50 44 '6..(.........FPD'
  32 32 37 35 57 0a 20 20 20 20 00 00 00 fd 00 38 '2275W.    .....8'
  4c 1f 53 13 00 0a 20 20 20 20 20 20 00 00 00 ff 'L.S...      ....'
  00 4d 58 4c 37 33 44 30 43 30 37 35 39 30 00 37 '.MXL73D0C07590.7'
Checksum: 0x37

----------------

Failures:

Block 1, Base EDID:
  Unknown Extension Block.
EDID:
  Base EDID: EDID specified 0 extension block(s), but found 1 extension block(s).

EDID conformity: FAIL
