
EDID (hex):
00ffffffffffff00410c0a1559fd0300
0b0b01020e1e1778eaeddd9e544c9c23
1c5058bfee003140314f454f6140614f
01010101010164190040410026301888
360030e410000018000000ff00205459
20203236313436350a20000000fc0050
48494c495053202031353050000000fd
00384b1f3c08000a20202020202000b3

Extracted contents:
header:          00 ff ff ff ff ff ff 00
serial number:   41 0c 0a 15 59 fd 03 00 0b 0b
version:         01 02
basic params:    0e 1e 17 78 ea
chroma info:     ed dd 9e 54 4c 9c 23 1c 50 58
established:     bf ee 00
standard:        31 40 31 4f 45 4f 61 40 61 4f 01 01 01 01 01 01
descriptor 1:    64 19 00 40 41 00 26 30 18 88 36 00 30 e4 10 00 00 18
descriptor 2:    00 00 00 ff 00 20 54 59 20 20 32 36 31 34 36 35 0a 20
descriptor 3:    00 00 00 fc 00 50 48 49 4c 49 50 53 20 20 31 35 30 50
descriptor 4:    00 00 00 fd 00 38 4b 1f 3c 08 00 0a 20 20 20 20 20 20
extensions:      00
checksum:        b3

EDID version: 1.2
Manufacturer: PHL Model 150a Serial Number --
Analog display, Input voltage level: 0.7/0.3 V
Sync: Separate Composite SyncOnGreen 
Maximum image size: 30 cm x 23 cm
Gamma: 2.20
DPMS levels: Standby Suspend Off
RGB color display
First detailed timing is preferred timing
Display x,y Chromaticity:
  Red:   0.6201, 0.3300
  Green: 0.2998, 0.6103
  Blue:  0.1396, 0.1103
  White: 0.3154, 0.3447
Established timings supported:
  720x400@70Hz 9:5 HorFreq: 31469 Hz Clock: 28.320 MHz
  640x480@60Hz 4:3 HorFreq: 31469 Hz Clock: 25.175 MHz
  640x480@67Hz 4:3 HorFreq: 35000 Hz Clock: 30.240 MHz
  640x480@72Hz 4:3 HorFreq: 37900 Hz Clock: 31.500 MHz
  640x480@75Hz 4:3 HorFreq: 37500 Hz Clock: 31.500 MHz
  800x600@56Hz 4:3 HorFreq: 35200 Hz Clock: 36.000 MHz
  800x600@60Hz 4:3 HorFreq: 37900 Hz Clock: 40.000 MHz
  800x600@72Hz 4:3 HorFreq: 48100 Hz Clock: 50.000 MHz
  800x600@75Hz 4:3 HorFreq: 46900 Hz Clock: 49.500 MHz
  832x624@75Hz 4:3 HorFreq: 49726 Hz Clock: 57.284 MHz
  1024x768@60Hz 4:3 HorFreq: 48400 Hz Clock: 65.000 MHz
  1024x768@70Hz 4:3 HorFreq: 56500 Hz Clock: 75.000 MHz
  1024x768@75Hz 4:3 HorFreq: 60000 Hz Clock: 78.750 MHz
Standard timings supported:
  640x480@60Hz 4:3 HorFreq: 31469 Hz Clock: 25.175 MHz
  640x480@75Hz 4:3 HorFreq: 37500 Hz Clock: 31.500 MHz
  800x600@75Hz 4:3 HorFreq: 46900 Hz Clock: 49.500 MHz
  1024x768@60Hz 4:3 HorFreq: 48400 Hz Clock: 65.000 MHz
  1024x768@75Hz 4:3 HorFreq: 60000 Hz Clock: 78.750 MHz
Detailed mode: Clock 65.000 MHz, 304 mm x 228 mm
               1024 1048 1184 1344 hborder 0
                768  771  777  806 vborder 0
               -hsync -vsync 
               VertFreq: 60 Hz, HorFreq: 48363 Hz
Serial number:  --  261465
Monitor ranges (GTF): 56-75Hz V, 31-60kHz H, max dotclock 80MHz
Checksum: 0xb3 (valid)
EDID block does NOT conform to EDID 1.2!
	Name descriptor not terminated with a newline
EDID block does not conform at all!
	Bad year of manufacture
