edid-decode (hex):

00 ff ff ff ff ff ff 00 10 ac 5c 40 4c 38 33 32
22 14 01 03 80 33 1d 78 ee ef 91 a3 54 4c 9b 26
0f 50 54 a5 4b 00 71 4f 81 80 a9 40 b3 00 01 01
01 01 01 01 01 01 02 3a 80 18 71 38 2d 40 58 2c
45 00 fd 1e 11 00 00 1e 00 00 00 ff 00 47 57 4b
47 33 30 38 52 32 33 38 4c 0a 00 00 00 fc 00 41
6c 69 65 6e 77 61 72 65 32 33 31 30 00 00 00 fd
00 38 78 1e 8c 1d 00 0a 20 20 20 20 20 20 01 24

02 01 04 00 fe 5b 80 a0 70 38 35 40 30 20 35 00
fd 1e 11 00 00 1a a9 65 80 a0 70 38 3a 40 30 20
35 00 fd 1e 11 00 00 1a 86 6f 80 a0 70 38 40 40
30 20 35 00 fd 1e 11 00 00 1a 00 00 00 00 00 00
00 00 00 00 00 00 00 00 00 00 00 00 00 00 00 00
00 00 00 00 00 00 00 00 00 00 00 00 00 00 00 00
00 00 00 00 00 00 00 00 00 00 00 00 00 00 00 00
00 00 00 00 00 00 00 00 00 00 00 00 00 00 00 75

00 ff ff ff ff ff ff 00 10 ac 5c 40 4c 38 33 32
22 14 01 03 80 33 1d 78 ee ef 91 a3 54 4c 9b 26
0f 50 54 a5 4b 00 71 4f 81 80 a9 40 b3 00 01 01
01 01 01 01 01 01 02 3a 80 18 71 38 2d 40 58 2c
45 00 fd 1e 11 00 00 1e 00 00 00 ff 00 47 57 4b
47 33 30 38 52 32 33 38 4c 0a 00 00 00 fc 00 41
6c 69 65 6e 77 61 72 65 32 33 31 30 00 00 00 fd
00 38 78 1e 8c 1d 00 0a 20 20 20 20 20 20 01 24

02 01 04 00 fe 5b 80 a0 70 38 35 40 30 20 35 00
fd 1e 11 00 00 1a a9 65 80 a0 70 38 3a 40 30 20
35 00 fd 1e 11 00 00 1a 86 6f 80 a0 70 38 40 40
30 20 35 00 fd 1e 11 00 00 1a 00 00 00 00 00 00
00 00 00 00 00 00 00 00 00 00 00 00 00 00 00 00
00 00 00 00 00 00 00 00 00 00 00 00 00 00 00 00
00 00 00 00 00 00 00 00 00 00 00 00 00 00 00 00
00 00 00 00 00 00 00 00 00 00 00 00 00 00 00 75

----------------

Block 0, Base EDID:
  EDID Structure Version & Revision: 1.3
  Vendor & Product Identification:
    Manufacturer: DEL
    Model: 16476
    Serial Number: ...
    Made in: week 34 of 2010
  Basic Display Parameters & Features:
    Digital display
    Maximum image size: 51 cm x 29 cm
    Gamma: 2.20
    DPMS levels: Standby Suspend Off
    RGB color display
    Default (sRGB) color space is primary color space
    First detailed timing is the preferred timing
  Color Characteristics:
    Red  : 0.6396, 0.3300
    Green: 0.2998, 0.6083
    Blue : 0.1503, 0.0595
    White: 0.3125, 0.3291
  Established Timings I & II:
    IBM     :   720x400    70.081663 Hz   9:5     31.467 kHz     28.320000 MHz
    DMT 0x04:   640x480    59.940476 Hz   4:3     31.469 kHz     25.175000 MHz
    DMT 0x06:   640x480    75.000000 Hz   4:3     37.500 kHz     31.500000 MHz
    DMT 0x09:   800x600    60.316541 Hz   4:3     37.879 kHz     40.000000 MHz
    DMT 0x0b:   800x600    75.000000 Hz   4:3     46.875 kHz     49.500000 MHz
    DMT 0x10:  1024x768    60.003840 Hz   4:3     48.363 kHz     65.000000 MHz
    DMT 0x12:  1024x768    75.028582 Hz   4:3     60.023 kHz     78.750000 MHz
    DMT 0x24:  1280x1024   75.024675 Hz   5:4     79.976 kHz    135.000000 MHz
  Standard Timings:
    DMT 0x15:  1152x864    75.000000 Hz   4:3     67.500 kHz    108.000000 MHz
    DMT 0x23:  1280x1024   60.019740 Hz   5:4     63.981 kHz    108.000000 MHz
    DMT 0x33:  1600x1200   60.000000 Hz   4:3     75.000 kHz    162.000000 MHz
    DMT 0x3a:  1680x1050   59.954250 Hz  16:10    65.290 kHz    146.250000 MHz
  Detailed Timing Descriptors:
    DTD 1:  1920x1080   60.000000 Hz  16:9     67.500 kHz    148.500000 MHz (509 mm x 286 mm)
                 Hfront   88 Hsync  44 Hback  148 Hpol P
                 Vfront    4 Vsync   5 Vback   36 Vpol P
    Display Product Serial Number: ...
    Display Product Name: 'Alienware2310'
    Display Range Limits:
      Monitor ranges (GTF): 56-120 Hz V, 30-140 kHz H, max dotclock 290 MHz
  Extension blocks: 1
Checksum: 0x24

----------------

Block 1, CTA-861 Extension Block:
  Revision: 1
  Detailed Timing Descriptors:
    DTD 2:  1920x1080   99.930409 Hz  16:9    113.221 kHz    235.500000 MHz (509 mm x 286 mm)
                 Hfront   48 Hsync  32 Hback   80 Hpol P
                 Vfront    3 Vsync   5 Vback   45 Vpol N
    DTD 3:  1920x1080  109.947445 Hz  16:9    125.120 kHz    260.250000 MHz (509 mm x 286 mm)
                 Hfront   48 Hsync  32 Hback   80 Hpol P
                 Vfront    3 Vsync   5 Vback   50 Vpol N
    DTD 4:  1920x1080  119.982181 Hz  16:9    137.260 kHz    285.500000 MHz (509 mm x 286 mm)
                 Hfront   48 Hsync  32 Hback   80 Hpol P
                 Vfront    3 Vsync   5 Vback   56 Vpol N
Checksum: 0x75  Unused space in Extension Block: 69 bytes

----------------

Block 2, Unknown EDID Extension Block 0x00:
  00 ff ff ff ff ff ff 00 10 ac 5c 40 4c 38 33 32 '..........\@L832'
  22 14 01 03 80 33 1d 78 ee ef 91 a3 54 4c 9b 26 '"....3.x....TL.&'
  0f 50 54 a5 4b 00 71 4f 81 80 a9 40 b3 00 01 01 '.PT.K.qO...@....'
  01 01 01 01 01 01 02 3a 80 18 71 38 2d 40 58 2c '.......:..q8-@X,'
  45 00 fd 1e 11 00 00 1e 00 00 00 ff 00 47 57 4b 'E............GWK'
  47 33 30 38 52 32 33 38 4c 0a 00 00 00 fc 00 41 'G308R238L......A'
  6c 69 65 6e 77 61 72 65 32 33 31 30 00 00 00 fd 'lienware2310....'
  00 38 78 1e 8c 1d 00 0a 20 20 20 20 20 20 01 24 '.8x.....      .$'
Checksum: 0x24

----------------

Block 3, CTA-861 Extension Block:
  Revision: 1
  Detailed Timing Descriptors:
    DTD 5:  1920x1080   99.930409 Hz  16:9    113.221 kHz    235.500000 MHz (509 mm x 286 mm)
                 Hfront   48 Hsync  32 Hback   80 Hpol P
                 Vfront    3 Vsync   5 Vback   45 Vpol N
    DTD 6:  1920x1080  109.947445 Hz  16:9    125.120 kHz    260.250000 MHz (509 mm x 286 mm)
                 Hfront   48 Hsync  32 Hback   80 Hpol P
                 Vfront    3 Vsync   5 Vback   50 Vpol N
    DTD 7:  1920x1080  119.982181 Hz  16:9    137.260 kHz    285.500000 MHz (509 mm x 286 mm)
                 Hfront   48 Hsync  32 Hback   80 Hpol P
                 Vfront    3 Vsync   5 Vback   56 Vpol N
Checksum: 0x75  Unused space in Extension Block: 69 bytes

----------------

Warnings:

Block 1, CTA-861 Extension Block:
  Display Product Serial Number is set, so the Serial Number in the Base EDID should be 0.
Block 3, CTA-861 Extension Block:
  Display Product Serial Number is set, so the Serial Number in the Base EDID should be 0.

Failures:

Block 0, Base EDID:
  Basic Display Parameters & Features: sRGB is signaled, but the chromaticities do not match.
Block 1, CTA-861 Extension Block:
  Missing VCDB, needed for Set Selectable RGB Quantization to avoid interop issues.
Block 2, Base EDID:
  Unknown Extension Block.
Block 3, CTA-861 Extension Block:
  Missing VCDB, needed for Set Selectable RGB Quantization to avoid interop issues.
EDID:
  Base EDID: EDID specified 1 extension block(s), but found 3 extension block(s).
  Base EDID: EDID 1.3 requires a Block Map Extension in Block 1 if there are more than 2 blocks in the EDID.

EDID conformity: FAIL
