edid-decode (hex):

00 ff ff ff ff ff ff 00 0d ae 31 17 00 00 00 00
01 16 01 04 90 27 16 78 0a 1a 05 9e 56 57 96 28
13 50 54 00 00 00 01 01 01 01 01 01 01 01 01 01
01 01 01 01 01 01 c8 2b 40 66 61 84 36 30 6c 48
6c 00 7e d7 10 00 00 1a 30 1d 40 66 61 84 36 30
6c 48 6c 00 7e d7 10 00 00 1a 00 00 00 00 00 00
00 00 00 00 00 00 00 00 00 00 00 00 00 00 00 02
00 0c 44 e8 0a 3c 64 20 19 29 6e 00 00 00 00 95

----------------

Block 0, Base EDID:
  EDID Structure Version & Revision: 1.4
  Vendor & Product Identification:
    Manufacturer: CMN
    Model: 5937
    Made in: week 1 of 2012
  Basic Display Parameters & Features:
    Digital display
    Bits per primary color channel: 6
    Digital interface is not defined
    Maximum image size: 39 cm x 22 cm
    Gamma: 2.20
    Supported color formats: RGB 4:4:4, YCrCb 4:4:4
    First detailed timing includes the native pixel format and preferred refresh rate
  Color Characteristics:
    Red  : 0.6171, 0.3369
    Green: 0.3417, 0.5878
    Blue : 0.1562, 0.0742
    White: 0.3134, 0.3291
  Established Timings I & II: none
  Standard Timings: none
  Detailed Timing Descriptors:
    DTD 1:  1600x900    60.002184 Hz  16:9     57.242 kHz    112.080000 MHz (382 mm x 215 mm)
                 Hfront  108 Hsync  72 Hback  178 Hpol P
                 Vfront    6 Vsync  12 Vback   36 Vpol N
    DTD 2:  1600x900    40.001456 Hz  16:9     38.161 kHz     74.720000 MHz (382 mm x 215 mm)
                 Hfront  108 Hsync  72 Hback  178 Hpol P
                 Vfront    6 Vsync  12 Vback   36 Vpol N
    Empty Descriptor
    Manufacturer-Specified Display Descriptor (0x02): 00 02 00 0c 44 e8 0a 3c 64 20 19 29 6e 00 00 00 '....D..<d .)n...'
Checksum: 0x95

----------------

Failures:

Block 0, Base EDID:
  Empty Descriptor: Use Dummy Descriptor instead of all zeroes.
  Missing Display Product Name.

EDID conformity: FAIL
