
EDID (hex):
00ffffffffffff00158f031056330000
101f010380160e782a85bc97574f9426
204e53a10800d1c0d100010101010101
010101010101bc1b00a0502017303020
3600d9880000001a000000fc00454c4f
204554313030324c0a20000000fd003c
4b1f5011000a202020202020000000ff
00443231483031333134320a2020010e
020317f1440102038423090707830100
0065030c001000bc1b00a05020173030
203600d9880000001a8c0ad08a20e02d
10103e9600d98800000018011d007251
d01e206e285500d9880000001e000000
00000000000000000000000000000000
00000000000000000000000000000000
000000000000000000000000000000d1

edid-decode (hex):

00 ff ff ff ff ff ff 00 15 8f 03 10 56 33 00 00
10 1f 01 03 80 16 0e 78 2a 85 bc 97 57 4f 94 26
20 4e 53 a1 08 00 d1 c0 d1 00 01 01 01 01 01 01
01 01 01 01 01 01 bc 1b 00 a0 50 20 17 30 30 20
36 00 d9 88 00 00 00 1a 00 00 00 fc 00 45 4c 4f
20 45 54 31 30 30 32 4c 0a 20 00 00 00 fd 00 3c
4b 1f 50 11 00 0a 20 20 20 20 20 20 00 00 00 ff
00 44 32 31 48 30 31 33 31 34 32 0a 20 20 01 0e

02 03 17 f1 44 01 02 03 84 23 09 07 07 83 01 00
00 65 03 0c 00 10 00 bc 1b 00 a0 50 20 17 30 30
20 36 00 d9 88 00 00 00 1a 8c 0a d0 8a 20 e0 2d
10 10 3e 96 00 d9 88 00 00 00 18 01 1d 00 72 51
d0 1e 20 6e 28 55 00 d9 88 00 00 00 1e 00 00 00
00 00 00 00 00 00 00 00 00 00 00 00 00 00 00 00
00 00 00 00 00 00 00 00 00 00 00 00 00 00 00 00
00 00 00 00 00 00 00 00 00 00 00 00 00 00 00 d1

----------------

Block 0, Base EDID:
  EDID Structure Version & Revision: 1.3
  Vendor & Product Identification:
    Manufacturer: ELO
    Model: 4099
    Serial Number: 13142
    Made in: week 16 of 2021
  Basic Display Parameters & Features:
    Digital display
    Maximum image size: 22 cm x 14 cm
    Gamma: 2.20
    DPMS levels: Off
    RGB color display
    First detailed timing is the preferred timing
  Color Characteristics:
    Red  : 0.5917, 0.3398
    Green: 0.3095, 0.5791
    Blue : 0.1503, 0.1279
    White: 0.3076, 0.3242
  Established Timings I & II:
    IBM     :   720x400    70.081663 Hz   9:5     31.467 kHz     28.320000 MHz
    DMT 0x04:   640x480    59.940476 Hz   4:3     31.469 kHz     25.175000 MHz
    DMT 0x09:   800x600    60.316541 Hz   4:3     37.879 kHz     40.000000 MHz
    DMT 0x10:  1024x768    60.003840 Hz   4:3     48.363 kHz     65.000000 MHz
  Standard Timings:
    DMT 0x52:  1920x1080   60.000000 Hz  16:9     67.500 kHz    148.500000 MHz
    DMT 0x45:  1920x1200   59.884600 Hz  16:10    74.556 kHz    193.250000 MHz
  Detailed Timing Descriptors:
    DTD 1:  1280x800    59.909545 Hz  16:10    49.306 kHz     71.000000 MHz (217 mm x 136 mm)
                 Hfront   48 Hsync  32 Hback   80 Hpol P
                 Vfront    3 Vsync   6 Vback   14 Vpol N
    Display Product Name: 'ELO ET1002L'
    Display Range Limits:
      Monitor ranges (GTF): 60-75 Hz V, 31-80 kHz H, max dotclock 170 MHz
    Display Product Serial Number: 'D21H013142'
  Extension blocks: 1
Checksum: 0x0e

----------------

Block 1, CTA-861 Extension Block:
  Revision: 3
  Underscans IT Video Formats by default
  Basic audio support
  Supports YCbCr 4:4:4
  Supports YCbCr 4:2:2
  Native detailed modes: 1
  Video Data Block:
    VIC   1:   640x480    59.940476 Hz   4:3     31.469 kHz     25.175000 MHz
    VIC   2:   720x480    59.940060 Hz   4:3     31.469 kHz     27.000000 MHz
    VIC   3:   720x480    59.940060 Hz  16:9     31.469 kHz     27.000000 MHz
    VIC   4:  1280x720    60.000000 Hz  16:9     45.000 kHz     74.250000 MHz (native)
  Audio Data Block:
    Linear PCM:
      Max channels: 2
      Supported sample rates (kHz): 48 44.1 32
      Supported sample sizes (bits): 24 20 16
  Speaker Allocation Data Block:
    FL/FR - Front Left/Right
  Vendor-Specific Data Block (HDMI), OUI 00-0C-03:
    Source physical address: 1.0.0.0
  Detailed Timing Descriptors:
    DTD 2:  1280x800    59.909545 Hz  16:10    49.306 kHz     71.000000 MHz (217 mm x 136 mm)
                 Hfront   48 Hsync  32 Hback   80 Hpol P
                 Vfront    3 Vsync   6 Vback   14 Vpol N
    DTD 3:   720x480    59.940060 Hz   3:2     31.469 kHz     27.000000 MHz (217 mm x 136 mm)
                 Hfront   16 Hsync  62 Hback   60 Hpol N
                 Vfront    9 Vsync   6 Vback   30 Vpol N
    DTD 4:  1280x720    60.000000 Hz  16:9     45.000 kHz     74.250000 MHz (217 mm x 136 mm)
                 Hfront  110 Hsync  40 Hback  220 Hpol P
                 Vfront    5 Vsync   5 Vback   20 Vpol P
Checksum: 0xd1  Unused space in Extension Block: 50 bytes
