
EDID (hex):
00ffffffffffff0010ac24a048373930
0e11010368261e78eecaf6a357479e23
114f54a54b00714f8180010101010101
010101010101302a009851002a403070
13007c311100001e000000fd00384b1f
500e000a202020202020000000ff0057
48333139373436303937480a000000fc
0044454c4c204531393746500a200082

Extracted contents:
header:          00 ff ff ff ff ff ff 00
serial number:   10 ac 24 a0 48 37 39 30 0e 11
version:         01 03
basic params:    68 26 1e 78 ee
chroma info:     ca f6 a3 57 47 9e 23 11 4f 54
established:     a5 4b 00
standard:        71 4f 81 80 01 01 01 01 01 01 01 01 01 01 01 01
descriptor 1:    30 2a 00 98 51 00 2a 40 30 70 13 00 7c 31 11 00 00 1e
descriptor 2:    00 00 00 fd 00 38 4b 1f 50 0e 00 0a 20 20 20 20 20 20
descriptor 3:    00 00 00 ff 00 57 48 33 31 39 37 34 36 30 39 37 48 0a
descriptor 4:    00 00 00 fc 00 44 45 4c 4c 20 45 31 39 37 46 50 0a 20
extensions:      00
checksum:        82

EDID version: 1.3
Manufacturer: DEL Model a024 Serial Number --
Made in week 14 of 2007
Analog display, Input voltage level: 0.7/0.7 V
Sync: Separate 
Maximum image size: 38 cm x 30 cm
Gamma: 2.20
DPMS levels: Standby Suspend Off
RGB color display
Default (sRGB) color space is primary color space
First detailed timing is preferred timing
Display x,y Chromaticity:
  Red:   0.6396, 0.3398
  Green: 0.2792, 0.6191
  Blue:  0.1396, 0.0693
  White: 0.3095, 0.3300
Established timings supported:
  720x400@70Hz 9:5 HorFreq: 31469 Hz Clock: 28.320 MHz
  640x480@60Hz 4:3 HorFreq: 31469 Hz Clock: 25.175 MHz
  640x480@75Hz 4:3 HorFreq: 37500 Hz Clock: 31.500 MHz
  800x600@60Hz 4:3 HorFreq: 37900 Hz Clock: 40.000 MHz
  800x600@75Hz 4:3 HorFreq: 46900 Hz Clock: 49.500 MHz
  1024x768@60Hz 4:3 HorFreq: 48400 Hz Clock: 65.000 MHz
  1024x768@75Hz 4:3 HorFreq: 60000 Hz Clock: 78.750 MHz
  1280x1024@75Hz 5:4 HorFreq: 80000 Hz Clock: 135.000 MHz
Standard timings supported:
  1152x864@75Hz 4:3 HorFreq: 67500 Hz Clock: 108.000 MHz
  1280x1024@60Hz 5:4 HorFreq: 64000 Hz Clock: 108.000 MHz
Detailed mode: Clock 108.000 MHz, 380 mm x 305 mm
               1280 1328 1440 1688 hborder 0
               1024 1025 1028 1066 vborder 0
               +hsync +vsync 
               VertFreq: 60 Hz, HorFreq: 63981 Hz
Monitor ranges (GTF): 56-75Hz V, 31-80kHz H, max dotclock 140MHz
Serial number: --
Monitor name: DELL E197FP
Checksum: 0x82 (valid)
EDID block does NOT conform to EDID 1.3!
	sRGB is signaled, but the chromaticities do not match
