edid-decode (hex):

00 ff ff ff ff ff ff 00 4e 14 0d 08 cd 33 22 06
20 1a 01 03 80 2c 19 78 2a c8 30 a3 57 4b 9c 25
11 50 54 af cf 00 81 40 81 80 a9 c0 95 00 95 0f
95 0a 95 0c 01 01 2f 26 40 a0 60 84 1a 30 30 20
35 00 b2 ec 10 00 00 1c a9 1a 00 00 50 00 16 30
30 20 37 00 dd 0c 11 00 00 1a 00 00 00 fd 00 38
4c 1f 53 11 00 0a 20 20 20 20 20 20 00 00 00 fc
00 45 32 30 35 57 2d 31 36 30 30 0a 20 20 01 09

02 03 1c f1 48 90 1f 05 14 04 13 03 12 23 09 07
07 83 01 00 00 66 03 0c 00 10 00 80 01 1d 00 72
51 d0 1e 20 6e 28 55 00 a0 5a 00 00 00 1e 01 1d
00 bc 52 d0 1e 20 b8 28 55 40 a0 5a 00 00 00 1e
01 1d 80 18 71 1c 16 20 58 2c 25 00 a0 5a 00 00
00 9e 01 1d 80 d0 72 1c 16 20 10 2c 25 80 a0 5a
00 00 00 9e 8c 0a d0 8a 20 e0 2d 10 10 3e 96 00
a0 5a 00 00 00 18 00 00 00 00 00 00 00 00 00 ae

----------------

Block 0, Base EDID:
  EDID Structure Version & Revision: 1.3
  Vendor & Product Identification:
    Manufacturer: SPT
    Model: 2061
    Serial Number: ...
    Made in: week 32 of 2016
  Basic Display Parameters & Features:
    Digital display
    Maximum image size: 44 cm x 25 cm
    Gamma: 2.20
    DPMS levels: Off
    RGB color display
    First detailed timing is the preferred timing
  Color Characteristics:
    Red  : 0.6396, 0.3398
    Green: 0.2949, 0.6093
    Blue : 0.1445, 0.0693
    White: 0.3125, 0.3281
  Established Timings I & II:
    IBM     :   720x400    70.082 Hz   9:5    31.467 kHz  28.320 MHz
    DMT 0x04:   640x480    59.940 Hz   4:3    31.469 kHz  25.175 MHz
    DMT 0x05:   640x480    72.809 Hz   4:3    37.861 kHz  31.500 MHz
    DMT 0x06:   640x480    75.000 Hz   4:3    37.500 kHz  31.500 MHz
    DMT 0x08:   800x600    56.250 Hz   4:3    35.156 kHz  36.000 MHz
    DMT 0x09:   800x600    60.317 Hz   4:3    37.879 kHz  40.000 MHz
    DMT 0x0a:   800x600    72.188 Hz   4:3    48.077 kHz  50.000 MHz
    DMT 0x0b:   800x600    75.000 Hz   4:3    46.875 kHz  49.500 MHz
    DMT 0x10:  1024x768    60.004 Hz   4:3    48.363 kHz  65.000 MHz
    DMT 0x11:  1024x768    70.069 Hz   4:3    56.476 kHz  75.000 MHz
    DMT 0x12:  1024x768    75.029 Hz   4:3    60.023 kHz  78.750 MHz
    DMT 0x24:  1280x1024   75.025 Hz   5:4    79.976 kHz 135.000 MHz
  Standard Timings:
    DMT 0x20:  1280x960    60.000 Hz   4:3    60.000 kHz 108.000 MHz
    DMT 0x23:  1280x1024   60.020 Hz   5:4    63.981 kHz 108.000 MHz
    DMT 0x53:  1600x900    60.000 Hz  16:9    60.000 kHz 108.000 MHz (RB)
    DMT 0x2f:  1440x900    59.887 Hz  16:10   55.935 kHz 106.500 MHz
    DMT 0x30:  1440x900    74.984 Hz  16:10   70.635 kHz 136.750 MHz
    GTF     :  1440x904    70.000 Hz  16:10   65.870 kHz 127.524 MHz
    GTF     :  1440x904    72.000 Hz  16:10   67.824 kHz 131.307 MHz
  Detailed Timing Descriptors:
    DTD 1:  1600x900    59.978 Hz  16:9    55.540 kHz  97.750 MHz (434 mm x 236 mm)
                 Hfront   48 Hsync  32 Hback  80 Hpol N
                 Vfront    3 Vsync   5 Vback  18 Vpol P
    DTD 2:  1280x768    67.494 Hz   5:3    53.320 kHz  68.250 MHz (477 mm x 268 mm)
                 Hfront   48 Hsync  32 Hback -80 Hpol P
                 Vfront    3 Vsync   7 Vback  12 Vpol N
                   a9 1a 00 00 50 00 16 30 30 20 37 00 dd 0c 11 00 00 1a '....P..00 7.......'
  Display Range Limits:
    Monitor ranges (GTF): 56-76 Hz V, 31-83 kHz H, max dotclock 170 MHz
    Display Product Name: 'E205W-1600'
  Extension blocks: 1
Checksum: 0x09

----------------

Block 1, CTA-861 Extension Block:
  Revision: 3
  Underscans IT Video Formats by default
  Basic audio support
  Supports YCbCr 4:4:4
  Supports YCbCr 4:2:2
  Native detailed modes: 1
  Video Data Block:
    VIC  16:  1920x1080   60.000 Hz  16:9    67.500 kHz 148.500 MHz (native)
    VIC  31:  1920x1080   50.000 Hz  16:9    56.250 kHz 148.500 MHz
    VIC   5:  1920x1080i  60.000 Hz  16:9    33.750 kHz  74.250 MHz
    VIC  20:  1920x1080i  50.000 Hz  16:9    28.125 kHz  74.250 MHz
    VIC   4:  1280x720    60.000 Hz  16:9    45.000 kHz  74.250 MHz
    VIC  19:  1280x720    50.000 Hz  16:9    37.500 kHz  74.250 MHz
    VIC   3:   720x480    59.940 Hz  16:9    31.469 kHz  27.000 MHz
    VIC  18:   720x576    50.000 Hz  16:9    31.250 kHz  27.000 MHz
  Audio Data Block:
    Linear PCM:
      Max channels: 2
      Supported sample rates (kHz): 48 44.1 32
      Supported sample sizes (bits): 24 20 16
  Speaker Allocation Data Block:
    FL/FR - Front Left/Right
  Vendor-Specific Data Block (HDMI), OUI 00-0C-03:
    Source physical address: 1.0.0.0
    Supports_AI
  Detailed Timing Descriptors:
    DTD 3:  1280x720    60.000 Hz  16:9    45.000 kHz  74.250 MHz (160 mm x 90 mm)
                 Hfront  110 Hsync  40 Hback 220 Hpol P
                 Vfront    5 Vsync   5 Vback  20 Vpol P
    DTD 4:  1280x720    50.000 Hz  16:9    37.500 kHz  74.250 MHz (160 mm x 90 mm)
                 Hfront  440 Hsync  40 Hback 220 Hpol P
                 Vfront    5 Vsync   5 Vback  20 Vpol P
    DTD 5:  1920x1080i  60.000 Hz  16:9    33.750 kHz  74.250 MHz (160 mm x 90 mm)
                 Hfront   88 Hsync  44 Hback 148 Hpol P
                 Vfront    2 Vsync   5 Vback  15 Vpol P Vfront +0.5 Odd Field
                 Vfront    2 Vsync   5 Vback  15 Vpol P Vback  +0.5 Even Field
    DTD 6:  1920x1080i  50.000 Hz  16:9    28.125 kHz  74.250 MHz (160 mm x 90 mm)
                 Hfront  528 Hsync  44 Hback 148 Hpol P
                 Vfront    2 Vsync   5 Vback  15 Vpol P Vfront +0.5 Odd Field
                 Vfront    2 Vsync   5 Vback  15 Vpol P Vback  +0.5 Even Field
    DTD 7:   720x480    59.940 Hz   3:2    31.469 kHz  27.000 MHz (160 mm x 90 mm)
                 Hfront   16 Hsync  62 Hback  60 Hpol N
                 Vfront    9 Vsync   6 Vback  30 Vpol N
Checksum: 0xae

----------------

Warnings:

Block 1, CTA-861 Extension Block:
  Missing VCDB, needed for Set Selectable RGB Quantization to avoid interop issues.

Failures:

Block 0, Base EDID:
  Detailed Timing Descriptor #2: 0 values in the video timing:
    Horizontal Active/Blanking 1280/0
    Horizontal Frontporch/Sync Width 48/32
    Vertical Active/Blanking 768/22
    Vertical Frontporch/Sync Width 3/7
  Detailed Timing Descriptor #2: 0 or negative horizontal back porch.
  Detailed Timing Descriptor #2: Mismatch of image size 477x268 mm vs display size 440x250 mm.
Block 1, CTA-861 Extension Block:
  Detailed Timing Descriptor #3: Mismatch of image size 160x90 mm vs display size 440x250 mm.
  Detailed Timing Descriptor #4: Mismatch of image size 160x90 mm vs display size 440x250 mm.
  Detailed Timing Descriptor #5: Mismatch of image size 160x90 mm vs display size 440x250 mm.
  Detailed Timing Descriptor #6: Mismatch of image size 160x90 mm vs display size 440x250 mm.
  Detailed Timing Descriptor #7: Mismatch of image size 160x90 mm vs display size 440x250 mm.
EDID:
  Base EDID: Some timings are out of range of the Monitor Ranges:
    Vertical Freq: 50.000 - 75.029 Hz (Monitor: 56.000 - 76.000 Hz)
    Horizontal Freq: 28.125 - 79.976 kHz (Monitor: 31.000 - 83.000 kHz)
  CTA-861: Native progressive timings are a mix of several resolutions.

EDID conformity: FAIL
