
EDID (hex):
00ffffffffffff004e140d08cd332206
28190103802c19782ac905a3574b9c25
125054afcf0081408180a9c09500950f
950a950c01012f2640a060841a303020
3500b2ec1000001ca91a000050001630
30203700dd0c1100001a000000fd0038
4c1f5311000a202020202020000000fc
0045323035572d313630300a2020012b
02031cf148901f051404130312230907
078301000066030c00100080011d0072
51d01e206e285500a05a0000001e011d
00bc52d01e20b8285540a05a0000001e
011d8018711c1620582c2500a05a0000
009e011d80d0721c1620102c2580a05a
0000009e8c0ad08a20e02d10103e9600
a05a00000018000000000000000000ae

Extracted contents:
header:          00 ff ff ff ff ff ff 00
serial number:   4e 14 0d 08 cd 33 22 06 28 19
version:         01 03
basic params:    80 2c 19 78 2a
chroma info:     c9 05 a3 57 4b 9c 25 12 50 54
established:     af cf 00
standard:        81 40 81 80 a9 c0 95 00 95 0f 95 0a 95 0c 01 01
descriptor 1:    2f 26 40 a0 60 84 1a 30 30 20 35 00 b2 ec 10 00 00 1c
descriptor 2:    a9 1a 00 00 50 00 16 30 30 20 37 00 dd 0c 11 00 00 1a
descriptor 3:    00 00 00 fd 00 38 4c 1f 53 11 00 0a 20 20 20 20 20 20
descriptor 4:    00 00 00 fc 00 45 32 30 35 57 2d 31 36 30 30 0a 20 20
extensions:      01
checksum:        2b

EDID version: 1.3
Manufacturer: SPT Model 80d Serial Number --
Made in week 40 of 2015
Digital display
Maximum image size: 44 cm x 25 cm
Gamma: 2.20
DPMS levels: Off
RGB color display
First detailed timing is preferred timing
Display x,y Chromaticity:
  Red:   0.6396, 0.3398
  Green: 0.2949, 0.6103
  Blue:  0.1445, 0.0703
  White: 0.3134, 0.3291
Established timings supported:
  720x400@70Hz 9:5 HorFreq: 31469 Hz Clock: 28.320 MHz
  640x480@60Hz 4:3 HorFreq: 31469 Hz Clock: 25.175 MHz
  640x480@72Hz 4:3 HorFreq: 37900 Hz Clock: 31.500 MHz
  640x480@75Hz 4:3 HorFreq: 37500 Hz Clock: 31.500 MHz
  800x600@56Hz 4:3 HorFreq: 35200 Hz Clock: 36.000 MHz
  800x600@60Hz 4:3 HorFreq: 37900 Hz Clock: 40.000 MHz
  800x600@72Hz 4:3 HorFreq: 48100 Hz Clock: 50.000 MHz
  800x600@75Hz 4:3 HorFreq: 46900 Hz Clock: 49.500 MHz
  1024x768@60Hz 4:3 HorFreq: 48400 Hz Clock: 65.000 MHz
  1024x768@70Hz 4:3 HorFreq: 56500 Hz Clock: 75.000 MHz
  1024x768@75Hz 4:3 HorFreq: 60000 Hz Clock: 78.750 MHz
  1280x1024@75Hz 5:4 HorFreq: 80000 Hz Clock: 135.000 MHz
Standard timings supported:
  1280x960@60Hz 4:3 HorFreq: 60000 Hz Clock: 108.000 MHz
  1280x1024@60Hz 5:4 HorFreq: 64000 Hz Clock: 108.000 MHz
  1600x900@60Hz 16:9
  1440x900@60Hz 16:10 HorFreq: 55500 Hz Clock: 88.750 MHz
  1440x900@75Hz 16:10 HorFreq: 82300 Hz Clock: 156.000 MHz
  1440x900@70Hz 16:10
  1440x900@72Hz 16:10
Detailed mode: Clock 97.750 MHz, 434 mm x 236 mm
               1600 1648 1680 1760 hborder 0
                900  903  908  926 vborder 0
               -hsync +vsync 
               VertFreq: 59 Hz, HorFreq: 55539 Hz
Detailed mode: Clock 68.250 MHz, 477 mm x 268 mm
               1280 1328 1360 1280 hborder 0
                768  771  778  790 vborder 0
               +hsync -vsync 
               VertFreq: 67 Hz, HorFreq: 53320 Hz
Monitor ranges (GTF): 56-76Hz V, 31-83kHz H, max dotclock 170MHz
Monitor name: E205W-1600
Has 1 extension blocks
Checksum: 0x2b (valid)

CTA extension block
Extension version: 3
24 bytes of CTA data
  Video data block
    VIC  16 1920x1080@60Hz 16:9 (native) HorFreq: 67500 Hz Clock: 148.500 MHz
    VIC  31 1920x1080@50Hz 16:9  HorFreq: 56250 Hz Clock: 148.500 MHz
    VIC   5 1920x1080i@60Hz 16:9  HorFreq: 33750 Hz Clock: 74.250 MHz
    VIC  20 1920x1080i@50Hz 16:9  HorFreq: 28125 Hz Clock: 74.250 MHz
    VIC   4 1280x720@60Hz 16:9  HorFreq: 45000 Hz Clock: 74.250 MHz
    VIC  19 1280x720@50Hz 16:9  HorFreq: 37500 Hz Clock: 74.250 MHz
    VIC   3 720x480@60Hz 16:9  HorFreq: 31469 Hz Clock: 27.000 MHz
    VIC  18 720x576@50Hz 16:9  HorFreq: 31250 Hz Clock: 27.000 MHz
  Audio data block
    Linear PCM, max channels 2
      Supported sample rates (kHz): 48 44.1 32
      Supported sample sizes (bits): 24 20 16
  Speaker allocation data block
    Speaker map:
      FL/FR - Front Left/Right
  Vendor-specific data block, OUI 000c03 (HDMI)
    Source physical address 1.0.0.0
    Supports_AI
Underscans PC formats by default
Basic audio support
Supports YCbCr 4:4:4
Supports YCbCr 4:2:2
1 native detailed modes
Detailed mode: Clock 74.250 MHz, 160 mm x 90 mm
               1280 1390 1430 1650 hborder 0
                720  725  730  750 vborder 0
               +hsync +vsync 
               VertFreq: 60 Hz, HorFreq: 45000 Hz
Detailed mode: Clock 74.250 MHz, 160 mm x 90 mm
               1280 1720 1760 1980 hborder 0
                720  725  730  750 vborder 0
               +hsync +vsync 
               VertFreq: 50 Hz, HorFreq: 37500 Hz
Detailed mode: Clock 74.250 MHz, 160 mm x 90 mm
               1920 2008 2052 2200 hborder 0
                540  542  547  562 vborder 0
               +hsync +vsync interlaced 
               VertFreq: 60 Hz, HorFreq: 33750 Hz
Detailed mode: Clock 74.250 MHz, 160 mm x 90 mm
               1920 2448 2492 2640 hborder 0
                540  542  547  562 vborder 0
               +hsync +vsync interlaced 
               VertFreq: 50 Hz, HorFreq: 28125 Hz
Detailed mode: Clock 27.000 MHz, 160 mm x 90 mm
                720  736  798  858 hborder 0
                480  489  495  525 vborder 0
               -hsync -vsync 
               VertFreq: 59 Hz, HorFreq: 31468 Hz
Checksum: 0xae (valid)

One or more of the timings is out of range of the Monitor Ranges:
  Vertical Freq: 50 - 75 Hz
  Horizontal Freq: 28125 - 82300 Hz
  Maximum Clock: 156.000 MHz
