edid-decode (hex):

00 ff ff ff ff ff ff 00 4e 14 0d 08 cd 33 22 06
13 1a 01 04 a5 2c 19 78 22 c9 05 a3 57 4b 9c 25
12 50 54 af cf 00 81 40 81 80 a9 c0 95 00 95 0f
95 0a 95 0c 01 01 2f 26 40 a0 60 84 1a 30 30 20
35 00 b2 ec 10 00 00 1c a9 1a 00 00 50 00 16 30
30 20 37 00 dd 0c 11 00 00 1a 00 00 00 fd 00 38
4c 1f 53 11 00 0a 20 20 20 20 20 20 00 00 00 fc
00 45 32 30 35 57 2d 31 36 30 30 0a 20 20 00 22

00 ff ff ff ff ff ff 00 4e 14 0d 08 cd 33 22 06
13 1a 01 04 a5 2c 19 78 22 c9 05 a3 57 4b 9c 25
12 50 54 af cf 00 81 40 81 80 a9 c0 95 00 95 0f
95 0a 95 0c 01 01 2f 26 40 a0 60 84 1a 30 30 20
35 00 b2 ec 10 00 00 1c a9 1a 00 00 50 00 16 30
30 20 37 00 dd 0c 11 00 00 1a 00 00 00 fd 00 38
4c 1f 53 11 00 0a 20 20 20 20 20 20 00 00 00 fc
00 45 32 30 35 57 2d 31 36 30 30 0a 20 20 00 22

----------------

Block 0, Base EDID:
  EDID Structure Version & Revision: 1.4
  Vendor & Product Identification:
    Manufacturer: SPT
    Model: 2061
    Serial Number: ...
    Made in: week 19 of 2016
  Basic Display Parameters & Features:
    Digital display
    Bits per primary color channel: 8
    DisplayPort interface
    Maximum image size: 44 cm x 25 cm
    Gamma: 2.20
    DPMS levels: Off
    Supported color formats: RGB 4:4:4
    First detailed timing includes the native pixel format and preferred refresh rate
  Color Characteristics:
    Red  : 0.6396, 0.3398
    Green: 0.2949, 0.6103
    Blue : 0.1445, 0.0703
    White: 0.3134, 0.3291
  Established Timings I & II:
    IBM     :   720x400    70.081663 Hz   9:5     31.467 kHz     28.320000 MHz
    DMT 0x04:   640x480    59.940476 Hz   4:3     31.469 kHz     25.175000 MHz
    DMT 0x05:   640x480    72.808802 Hz   4:3     37.861 kHz     31.500000 MHz
    DMT 0x06:   640x480    75.000000 Hz   4:3     37.500 kHz     31.500000 MHz
    DMT 0x08:   800x600    56.250000 Hz   4:3     35.156 kHz     36.000000 MHz
    DMT 0x09:   800x600    60.316541 Hz   4:3     37.879 kHz     40.000000 MHz
    DMT 0x0a:   800x600    72.187572 Hz   4:3     48.077 kHz     50.000000 MHz
    DMT 0x0b:   800x600    75.000000 Hz   4:3     46.875 kHz     49.500000 MHz
    DMT 0x10:  1024x768    60.003840 Hz   4:3     48.363 kHz     65.000000 MHz
    DMT 0x11:  1024x768    70.069359 Hz   4:3     56.476 kHz     75.000000 MHz
    DMT 0x12:  1024x768    75.028582 Hz   4:3     60.023 kHz     78.750000 MHz
    DMT 0x24:  1280x1024   75.024675 Hz   5:4     79.976 kHz    135.000000 MHz
  Standard Timings:
    DMT 0x20:  1280x960    60.000000 Hz   4:3     60.000 kHz    108.000000 MHz
    DMT 0x23:  1280x1024   60.019740 Hz   5:4     63.981 kHz    108.000000 MHz
    DMT 0x53:  1600x900    60.000000 Hz  16:9     60.000 kHz    108.000000 MHz (RB)
    DMT 0x2f:  1440x900    59.887445 Hz  16:10    55.935 kHz    106.500000 MHz
    DMT 0x30:  1440x900    74.984427 Hz  16:10    70.635 kHz    136.750000 MHz
    GTF     :  1440x900    69.999868 Hz  16:10    65.590 kHz    126.982000 MHz
    GTF     :  1440x900    72.000167 Hz  16:10    67.536 kHz    130.750000 MHz
  Detailed Timing Descriptors:
    DTD 1:  1600x900    59.978156 Hz  16:9     55.540 kHz     97.750000 MHz (434 mm x 236 mm)
                 Hfront   48 Hsync  32 Hback   80 Hpol N
                 Vfront    3 Vsync   5 Vback   18 Vpol P
    DTD 2:  1280x768    67.494066 Hz   5:3     53.320 kHz     68.250000 MHz (477 mm x 268 mm)
                 Hfront   48 Hsync  32 Hback  -80 Hpol P
                 Vfront    3 Vsync   7 Vback   12 Vpol N
                   a9 1a 00 00 50 00 16 30 30 20 37 00 dd 0c 11 00 00 1a '....P..00 7.......'
    Display Range Limits:
      Monitor ranges (GTF): 56-76 Hz V, 31-83 kHz H, max dotclock 170 MHz
    Display Product Name: 'E205W-1600'
Checksum: 0x22

----------------

Block 1, Unknown EDID Extension Block 0x00:
  00 ff ff ff ff ff ff 00 4e 14 0d 08 cd 33 22 06 '........N....3".'
  13 1a 01 04 a5 2c 19 78 22 c9 05 a3 57 4b 9c 25 '.....,.x"...WK.%'
  12 50 54 af cf 00 81 40 81 80 a9 c0 95 00 95 0f '.PT....@........'
  95 0a 95 0c 01 01 2f 26 40 a0 60 84 1a 30 30 20 '....../&@.`..00 '
  35 00 b2 ec 10 00 00 1c a9 1a 00 00 50 00 16 30 '5...........P..0'
  30 20 37 00 dd 0c 11 00 00 1a 00 00 00 fd 00 38 '0 7............8'
  4c 1f 53 11 00 0a 20 20 20 20 20 20 00 00 00 fc 'L.S...      ....'
  00 45 32 30 35 57 2d 31 36 30 30 0a 20 20 00 22 '.E205W-1600.  ."'
Checksum: 0x22

----------------

Warnings:

Block 0, Base EDID:
  Display Range Limits: GTF support is deprecated in EDID 1.4.

Failures:

Block 0, Base EDID:
  Detailed Timing Descriptor #2: 0 values in the video timing:
    Horizontal Active/Blanking 1280/0
    Horizontal Frontporch/Sync Width 48/32
    Vertical Active/Blanking 768/22
    Vertical Frontporch/Sync Width 3/7
  Detailed Timing Descriptor #2: 0 or negative horizontal back porch.
  Detailed Timing Descriptor #2: Mismatch of image size 477x268 mm vs display size 440x250 mm.
  Display Range Limits: GTF can't be combined with non-continuous frequencies.
Block 1, Base EDID:
  Unknown Extension Block.
EDID:
  Base EDID: The DTD max image size is 477x268mm, which is larger than the display size 440.0x250.0mm.
  Base EDID: EDID specified 0 extension block(s), but found 1 extension block(s).

EDID conformity: FAIL
