
EDID (hex):
00ffffffffffff001e6da14e10101000
081401036a2c1978eaa680a5554d9d25
115054a54a80a9c0714f010101010101
010101010101302a40c8608464301850
1300b8fa1000001a302a40c860846d30
18501300b8fa1000001a000000fd0038
4b1e530f000a202020202020000000fc
0057323036310a202020202020200068

Extracted contents:
header:          00 ff ff ff ff ff ff 00
serial number:   1e 6d a1 4e 10 10 10 00 08 14
version:         01 03
basic params:    6a 2c 19 78 ea
chroma info:     a6 80 a5 55 4d 9d 25 11 50 54
established:     a5 4a 80
standard:        a9 c0 71 4f 01 01 01 01 01 01 01 01 01 01 01 01
descriptor 1:    30 2a 40 c8 60 84 64 30 18 50 13 00 b8 fa 10 00 00 1a
descriptor 2:    30 2a 40 c8 60 84 6d 30 18 50 13 00 b8 fa 10 00 00 1a
descriptor 3:    00 00 00 fd 00 38 4b 1e 53 0f 00 0a 20 20 20 20 20 20
descriptor 4:    00 00 00 fc 00 57 32 30 36 31 0a 20 20 20 20 20 20 20
extensions:      00
checksum:        68

EDID version: 1.3
Manufacturer: GSM Model 4ea1 Serial Number --
Made in week 8 of 2010
Analog display, Input voltage level: 0.7/0.7 V
Sync: Separate SyncOnGreen 
Maximum image size: 44 cm x 25 cm
Gamma: 2.20
DPMS levels: Standby Suspend Off
RGB color display
First detailed timing is preferred timing
Display x,y Chromaticity:
  Red:   0.6464, 0.3339
  Green: 0.3017, 0.6152
  Blue:  0.1464, 0.0664
  White: 0.3125, 0.3281
Established timings supported:
  720x400@70Hz 9:5 HorFreq: 31469 Hz Clock: 28.320 MHz
  640x480@60Hz 4:3 HorFreq: 31469 Hz Clock: 25.175 MHz
  640x480@75Hz 4:3 HorFreq: 37500 Hz Clock: 31.500 MHz
  800x600@60Hz 4:3 HorFreq: 37900 Hz Clock: 40.000 MHz
  800x600@75Hz 4:3 HorFreq: 46900 Hz Clock: 49.500 MHz
  1024x768@60Hz 4:3 HorFreq: 48400 Hz Clock: 65.000 MHz
  1024x768@75Hz 4:3 HorFreq: 60000 Hz Clock: 78.750 MHz
  1152x870@75Hz 192:145 HorFreq: 67500 Hz Clock: 108.000 MHz
Standard timings supported:
  1600x900@60Hz 16:9
  1152x864@75Hz 4:3 HorFreq: 67500 Hz Clock: 108.000 MHz
Detailed mode: Clock 108.000 MHz, 440 mm x 250 mm
               1600 1624 1704 1800 hborder 0
                900  901  904 1000 vborder 0
               +hsync -vsync 
               VertFreq: 60 Hz, HorFreq: 60000 Hz
Detailed mode: Clock 108.000 MHz, 440 mm x 250 mm
               1600 1624 1704 1800 hborder 0
                900  901  904 1009 vborder 0
               +hsync -vsync 
               VertFreq: 59 Hz, HorFreq: 60000 Hz
Monitor ranges (GTF): 56-75Hz V, 30-83kHz H, max dotclock 150MHz
Monitor name: W2061
Checksum: 0x68 (valid)
