edid-decode (hex):

00 ff ff ff ff ff ff 00 10 ac 30 f1 57 47 4c 42
23 1f 01 04 a5 30 1a 78 3a cf b5 a3 58 50 9d 24
0f 50 54 a5 4b 00 71 4f 81 80 a9 c0 d1 c0 01 01
01 01 01 01 01 01 02 3a 80 18 71 38 2d 40 58 2c
45 00 de 04 11 00 00 1e 00 00 00 ff 00 37 37 4b
5a 5a 38 33 0a 20 20 20 20 20 00 00 00 fc 00 44
45 4c 4c 20 45 32 32 32 32 48 0a 20 00 00 00 fd
00 32 4b 1e 53 11 01 0a 20 20 20 20 20 20 00 57

00 ff ff ff ff ff ff 00 10 ac 30 f1 57 47 4c 42
23 1f 01 04 a5 30 1a 78 3a cf b5 a3 58 50 9d 24
0f 50 54 a5 4b 00 71 4f 81 80 a9 c0 d1 c0 01 01
01 01 01 01 01 01 02 3a 80 18 71 38 2d 40 58 2c
45 00 de 04 11 00 00 1e 00 00 00 ff 00 37 37 4b
5a 5a 38 33 0a 20 20 20 20 20 00 00 00 fc 00 44
45 4c 4c 20 45 32 32 32 32 48 0a 20 00 00 00 fd
00 32 4b 1e 53 11 01 0a 20 20 20 20 20 20 00 57

----------------

Block 0, Base EDID:
  EDID Structure Version & Revision: 1.4
  Vendor & Product Identification:
    Manufacturer: DEL
    Model: 61744
    Serial Number: ...
    Made in: week 35 of 2021
  Basic Display Parameters & Features:
    Digital display
    Bits per primary color channel: 8
    DisplayPort interface
    Maximum image size: 48 cm x 26 cm
    Gamma: 2.20
    DPMS levels: Off
    Supported color formats: RGB 4:4:4, YCrCb 4:4:4, YCrCb 4:2:2
    First detailed timing includes the native pixel format and preferred refresh rate
  Color Characteristics:
    Red  : 0.6396, 0.3437
    Green: 0.3154, 0.6162
    Blue : 0.1425, 0.0615
    White: 0.3134, 0.3291
  Established Timings I & II:
    IBM     :   720x400    70.081663 Hz   9:5     31.467 kHz     28.320000 MHz
    DMT 0x04:   640x480    59.940476 Hz   4:3     31.469 kHz     25.175000 MHz
    DMT 0x06:   640x480    75.000000 Hz   4:3     37.500 kHz     31.500000 MHz
    DMT 0x09:   800x600    60.316541 Hz   4:3     37.879 kHz     40.000000 MHz
    DMT 0x0b:   800x600    75.000000 Hz   4:3     46.875 kHz     49.500000 MHz
    DMT 0x10:  1024x768    60.003840 Hz   4:3     48.363 kHz     65.000000 MHz
    DMT 0x12:  1024x768    75.028582 Hz   4:3     60.023 kHz     78.750000 MHz
    DMT 0x24:  1280x1024   75.024675 Hz   5:4     79.976 kHz    135.000000 MHz
  Standard Timings:
    DMT 0x15:  1152x864    75.000000 Hz   4:3     67.500 kHz    108.000000 MHz
    DMT 0x23:  1280x1024   60.019740 Hz   5:4     63.981 kHz    108.000000 MHz
    DMT 0x53:  1600x900    60.000000 Hz  16:9     60.000 kHz    108.000000 MHz (RB)
    DMT 0x52:  1920x1080   60.000000 Hz  16:9     67.500 kHz    148.500000 MHz
  Detailed Timing Descriptors:
    DTD 1:  1920x1080   60.000000 Hz  16:9     67.500 kHz    148.500000 MHz (478 mm x 260 mm)
                 Hfront   88 Hsync  44 Hback  148 Hpol P
                 Vfront    4 Vsync   5 Vback   36 Vpol P
    Display Product Serial Number: ...
    Display Product Name: 'DELL E2222H'
    Display Range Limits:
      Monitor ranges (Bare Limits): 50-75 Hz V, 30-83 kHz H, max dotclock 170 MHz
Checksum: 0x57

----------------

Block 1, Unknown EDID Extension Block 0x00:
  00 ff ff ff ff ff ff 00 10 ac 30 f1 57 47 4c 42 '..........0.WGLB'
  23 1f 01 04 a5 30 1a 78 3a cf b5 a3 58 50 9d 24 '#....0.x:...XP.$'
  0f 50 54 a5 4b 00 71 4f 81 80 a9 c0 d1 c0 01 01 '.PT.K.qO........'
  01 01 01 01 01 01 02 3a 80 18 71 38 2d 40 58 2c '.......:..q8-@X,'
  45 00 de 04 11 00 00 1e 00 00 00 ff 00 37 37 4b 'E............77K'
  5a 5a 38 33 0a 20 20 20 20 20 00 00 00 fc 00 44 'ZZ83.     .....D'
  45 4c 4c 20 45 32 32 32 32 48 0a 20 00 00 00 fd 'ELL E2222H. ....'
  00 32 4b 1e 53 11 01 0a 20 20 20 20 20 20 00 57 '.2K.S...      .W'
Checksum: 0x57

----------------

Failures:

Block 1, Base EDID:
  Unknown Extension Block.
EDID:
  Base EDID: EDID specified 0 extension block(s), but found 1 extension block(s).

EDID conformity: FAIL
