
EDID (hex):
00ffffffffffff0022f6022401010101
2c1f010368351e782a1dd5a75650a026
105054a54b00a9c08180714fd1c00101
0101010101012a4480a0703827403020
35000f282100001a000000ff00202020
20202020202020202020000000fd0037
4c1e5512000a202020202020000000fc
0048554157454920414438304857003f

Extracted contents:
header:          00 ff ff ff ff ff ff 00
serial number:   22 f6 02 24 01 01 01 01 2c 1f
version:         01 03
basic params:    68 35 1e 78 2a
chroma info:     1d d5 a7 56 50 a0 26 10 50 54
established:     a5 4b 00
standard:        a9 c0 81 80 71 4f d1 c0 01 01 01 01 01 01 01 01
descriptor 1:    2a 44 80 a0 70 38 27 40 30 20 35 00 0f 28 21 00 00 1a
descriptor 2:    00 00 00 ff 00 20 20 20 20 20 20 20 20 20 20 20 20 20
descriptor 3:    00 00 00 fd 00 37 4c 1e 55 12 00 0a 20 20 20 20 20 20
descriptor 4:    00 00 00 fc 00 48 55 41 57 45 49 20 41 44 38 30 48 57
extensions:      00
checksum:        3f

EDID version: 1.3
Manufacturer: HWV Model 2402 Serial Number --
Made in week 44 of 2021
Analog display, Input voltage level: 0.7/0.7 V
Sync: Separate 
Maximum image size: 53 cm x 30 cm
Gamma: 2.20
DPMS levels: Off
RGB color display
First detailed timing is preferred timing
Display x,y Chromaticity:
  Red:   0.6523, 0.3369
  Green: 0.3154, 0.6259
  Blue:  0.1513, 0.0634
  White: 0.3134, 0.3291
Established timings supported:
  720x400@70Hz 9:5 HorFreq: 31469 Hz Clock: 28.320 MHz
  640x480@60Hz 4:3 HorFreq: 31469 Hz Clock: 25.175 MHz
  640x480@75Hz 4:3 HorFreq: 37500 Hz Clock: 31.500 MHz
  800x600@60Hz 4:3 HorFreq: 37900 Hz Clock: 40.000 MHz
  800x600@75Hz 4:3 HorFreq: 46900 Hz Clock: 49.500 MHz
  1024x768@60Hz 4:3 HorFreq: 48400 Hz Clock: 65.000 MHz
  1024x768@75Hz 4:3 HorFreq: 60000 Hz Clock: 78.750 MHz
  1280x1024@75Hz 5:4 HorFreq: 80000 Hz Clock: 135.000 MHz
Standard timings supported:
  1600x900@60Hz 16:9
  1280x1024@60Hz 5:4 HorFreq: 64000 Hz Clock: 108.000 MHz
  1152x864@75Hz 4:3 HorFreq: 67500 Hz Clock: 108.000 MHz
  1920x1080@60Hz 16:9
Detailed mode: Clock 174.500 MHz, 527 mm x 296 mm
               1920 1968 2000 2080 hborder 0
               1080 1083 1088 1119 vborder 0
               +hsync -vsync 
               VertFreq: 74 Hz, HorFreq: 83894 Hz
Serial number:              
-- ranges (GTF): 55-76Hz V, 30-85kHz H, max dotclock 180MHz
Checksum: 0x3f (valid)
EDID block does NOT conform to EDID 1.3!
	Name descriptor not terminated with a newline
