
EDID (hex):
00ffffffffffff0010ac3e424c395730
161f010380301b78ea5c25ac524e9e25
115054a54b00714f8180a9c0d1c081c0
81cf01010101023a801871382d40582c
4500dc0c1100001e000000ff00475236
543243330a2020202020000000fc0044
454c4c205032323232480a20000000fd
00384c1e5311000a2020202020200100
020315b14a900504030201141f121365
030c001000023a801871382d40582c45
00dc0c1100001e011d8018711c162058
2c2500dc0c1100009e011d007251d01e
206e285500dc0c1100001e8c0ad08a20
e02d10103e9600dc0c11000018000000
00000000000000000000000000000000
000000000000000000000000000000da

Extracted contents:
header:          00 ff ff ff ff ff ff 00
serial number:   10 ac 3e 42 4c 39 57 30 16 1f
version:         01 03
basic params:    80 30 1b 78 ea
chroma info:     5c 25 ac 52 4e 9e 25 11 50 54
established:     a5 4b 00
standard:        71 4f 81 80 a9 c0 d1 c0 81 c0 81 cf 01 01 01 01
descriptor 1:    02 3a 80 18 71 38 2d 40 58 2c 45 00 dc 0c 11 00 00 1e
descriptor 2:    00 00 00 ff 00 47 52 36 54 32 43 33 0a 20 20 20 20 20
descriptor 3:    00 00 00 fc 00 44 45 4c 4c 20 50 32 32 32 32 48 0a 20
descriptor 4:    00 00 00 fd 00 38 4c 1e 53 11 00 0a 20 20 20 20 20 20
extensions:      01
checksum:        00

EDID version: 1.3
Manufacturer: DEL Model 423e Serial Number --
Made in week 22 of 2021
Digital display
Maximum image size: 48 cm x 27 cm
Gamma: 2.20
DPMS levels: Standby Suspend Off
RGB color display
First detailed timing is preferred timing
Display x,y Chromaticity:
  Red:   0.6728, 0.3212
  Green: 0.3076, 0.6171
  Blue:  0.1445, 0.0683
  White: 0.3134, 0.3291
Established timings supported:
  720x400@70Hz 9:5 HorFreq: 31469 Hz Clock: 28.320 MHz
  640x480@60Hz 4:3 HorFreq: 31469 Hz Clock: 25.175 MHz
  640x480@75Hz 4:3 HorFreq: 37500 Hz Clock: 31.500 MHz
  800x600@60Hz 4:3 HorFreq: 37900 Hz Clock: 40.000 MHz
  800x600@75Hz 4:3 HorFreq: 46900 Hz Clock: 49.500 MHz
  1024x768@60Hz 4:3 HorFreq: 48400 Hz Clock: 65.000 MHz
  1024x768@75Hz 4:3 HorFreq: 60000 Hz Clock: 78.750 MHz
  1280x1024@75Hz 5:4 HorFreq: 80000 Hz Clock: 135.000 MHz
Standard timings supported:
  1152x864@75Hz 4:3 HorFreq: 67500 Hz Clock: 108.000 MHz
  1280x1024@60Hz 5:4 HorFreq: 64000 Hz Clock: 108.000 MHz
  1600x900@60Hz 16:9
  1920x1080@60Hz 16:9
  1280x720@60Hz 16:9
  1280x720@75Hz 16:9
Detailed mode: Clock 148.500 MHz, 476 mm x 268 mm
               1920 2008 2052 2200 hborder 0
               1080 1084 1089 1125 vborder 0
               +hsync +vsync 
               VertFreq: 60 Hz, HorFreq: 67500 Hz
Serial number: --
Monitor name: DELL P2222H
Monitor ranges (GTF): 56-76Hz V, 30-83kHz H, max dotclock 170MHz
Has 1 extension blocks
Checksum: 0x0 (valid)

CTA extension block
Extension version: 3
17 bytes of CTA data
  Video data block
    VIC  16 1920x1080@60Hz 16:9 (native) HorFreq: 67500 Hz Clock: 148.500 MHz
    VIC   5 1920x1080i@60Hz 16:9  HorFreq: 33750 Hz Clock: 74.250 MHz
    VIC   4 1280x720@60Hz 16:9  HorFreq: 45000 Hz Clock: 74.250 MHz
    VIC   3 720x480@60Hz 16:9  HorFreq: 31469 Hz Clock: 27.000 MHz
    VIC   2 720x480@60Hz 4:3  HorFreq: 31469 Hz Clock: 27.000 MHz
    VIC   1 640x480@60Hz 4:3  HorFreq: 31469 Hz Clock: 25.175 MHz
    VIC  20 1920x1080i@50Hz 16:9  HorFreq: 28125 Hz Clock: 74.250 MHz
    VIC  31 1920x1080@50Hz 16:9  HorFreq: 56250 Hz Clock: 148.500 MHz
    VIC  18 720x576@50Hz 16:9  HorFreq: 31250 Hz Clock: 27.000 MHz
    VIC  19 1280x720@50Hz 16:9  HorFreq: 37500 Hz Clock: 74.250 MHz
  Vendor-specific data block, OUI 000c03 (HDMI)
    Source physical address 1.0.0.0
Underscans PC formats by default
Supports YCbCr 4:4:4
Supports YCbCr 4:2:2
1 native detailed modes
Detailed mode: Clock 148.500 MHz, 476 mm x 268 mm
               1920 2008 2052 2200 hborder 0
               1080 1084 1089 1125 vborder 0
               +hsync +vsync 
               VertFreq: 60 Hz, HorFreq: 67500 Hz
Detailed mode: Clock 74.250 MHz, 476 mm x 268 mm
               1920 2008 2052 2200 hborder 0
                540  542  547  562 vborder 0
               +hsync +vsync interlaced 
               VertFreq: 60 Hz, HorFreq: 33750 Hz
Detailed mode: Clock 74.250 MHz, 476 mm x 268 mm
               1280 1390 1430 1650 hborder 0
                720  725  730  750 vborder 0
               +hsync +vsync 
               VertFreq: 60 Hz, HorFreq: 45000 Hz
Detailed mode: Clock 27.000 MHz, 476 mm x 268 mm
                720  736  798  858 hborder 0
                480  489  495  525 vborder 0
               -hsync -vsync 
               VertFreq: 59 Hz, HorFreq: 31468 Hz
Checksum: 0xda (valid)

One or more of the timings is out of range of the Monitor Ranges:
  Vertical Freq: 50 - 75 Hz
  Horizontal Freq: 28125 - 80000 Hz
  Maximum Clock: 148.500 MHz
EDID block does not conform at all!
	Both the serial number and the serial string are set
