edid-decode (hex):

00 ff ff ff ff ff ff 00 4c 2d 3a 07 45 4d 45 59
12 15 01 03 a0 34 20 78 22 9f c1 a6 56 4b 9a 25
13 50 54 bf ef 80 71 4f 81 00 81 40 81 80 95 00
95 0f a9 40 b3 00 02 3a 80 18 71 38 2d 40 58 2c
45 00 a0 5a 00 00 00 1e 00 00 00 fd 00 38 4b 1e
50 11 00 0a 20 20 20 20 20 20 00 00 00 fc 00 53
4d 32 34 34 33 44 57 0a 20 20 20 20 00 00 00 ff
00 48 4d 4a 42 35 30 30 37 31 39 0a 20 20 01 7d

02 03 23 c1 4b 10 1f 84 13 00 00 02 03 00 00 00
23 09 07 07 83 01 00 00 e2 00 0f 67 03 0c 00 20
00 80 2d 01 1d 00 72 51 d0 1e 20 6e 28 55 00 10
09 00 00 00 1e 00 00 00 00 00 00 00 00 00 00 00
00 00 00 00 00 00 00 00 00 00 00 00 00 00 00 00
00 00 00 00 00 00 00 00 00 00 00 00 00 00 00 00
00 00 00 00 00 00 00 00 00 00 00 00 00 00 00 00
00 00 00 00 00 00 00 00 00 00 00 00 00 00 00 fe

00 ff ff ff ff ff ff 00 4c 2d 3a 07 45 4d 45 59
12 15 01 03 a0 34 20 78 22 9f c1 a6 56 4b 9a 25
13 50 54 bf ef 80 71 4f 81 00 81 40 81 80 95 00
95 0f a9 40 b3 00 02 3a 80 18 71 38 2d 40 58 2c
45 00 a0 5a 00 00 00 1e 00 00 00 fd 00 38 4b 1e
50 11 00 0a 20 20 20 20 20 20 00 00 00 fc 00 53
4d 32 34 34 33 44 57 0a 20 20 20 20 00 00 00 ff
00 48 4d 4a 42 35 30 30 37 31 39 0a 20 20 01 7d

02 03 23 c1 4b 10 1f 84 13 00 00 02 03 00 00 00
23 09 07 07 83 01 00 00 e2 00 0f 67 03 0c 00 20
00 80 2d 01 1d 00 72 51 d0 1e 20 6e 28 55 00 10
09 00 00 00 1e 00 00 00 00 00 00 00 00 00 00 00
00 00 00 00 00 00 00 00 00 00 00 00 00 00 00 00
00 00 00 00 00 00 00 00 00 00 00 00 00 00 00 00
00 00 00 00 00 00 00 00 00 00 00 00 00 00 00 00
00 00 00 00 00 00 00 00 00 00 00 00 00 00 00 fe

----------------

Block 0, Base EDID:
  EDID Structure Version & Revision: 1.3
  Vendor & Product Identification:
    Manufacturer: SAM
    Model: 1850
    Serial Number: ...
    Made in: week 18 of 2011
  Basic Display Parameters & Features:
    Digital display
    Maximum image size: 52 cm x 32 cm
    Gamma: 2.20
    DPMS levels: Off
    Monochrome or grayscale display
    First detailed timing is the preferred timing
  Color Characteristics:
    Red  : 0.6503, 0.3369
    Green: 0.2958, 0.6044
    Blue : 0.1474, 0.0742
    White: 0.3125, 0.3291
  Established Timings I & II:
    IBM     :   720x400    70.081663 Hz   9:5     31.467 kHz     28.320000 MHz
    DMT 0x04:   640x480    59.940476 Hz   4:3     31.469 kHz     25.175000 MHz
    Apple   :   640x480    66.666667 Hz   4:3     35.000 kHz     30.240000 MHz
    DMT 0x05:   640x480    72.808802 Hz   4:3     37.861 kHz     31.500000 MHz
    DMT 0x06:   640x480    75.000000 Hz   4:3     37.500 kHz     31.500000 MHz
    DMT 0x08:   800x600    56.250000 Hz   4:3     35.156 kHz     36.000000 MHz
    DMT 0x09:   800x600    60.316541 Hz   4:3     37.879 kHz     40.000000 MHz
    DMT 0x0a:   800x600    72.187572 Hz   4:3     48.077 kHz     50.000000 MHz
    DMT 0x0b:   800x600    75.000000 Hz   4:3     46.875 kHz     49.500000 MHz
    Apple   :   832x624    74.551266 Hz   4:3     49.726 kHz     57.284000 MHz
    DMT 0x10:  1024x768    60.003840 Hz   4:3     48.363 kHz     65.000000 MHz
    DMT 0x11:  1024x768    70.069359 Hz   4:3     56.476 kHz     75.000000 MHz
    DMT 0x12:  1024x768    75.028582 Hz   4:3     60.023 kHz     78.750000 MHz
    DMT 0x24:  1280x1024   75.024675 Hz   5:4     79.976 kHz    135.000000 MHz
    Apple   :  1152x870    75.061550 Hz 192:145   68.681 kHz    100.000000 MHz
  Standard Timings:
    DMT 0x15:  1152x864    75.000000 Hz   4:3     67.500 kHz    108.000000 MHz
    DMT 0x1c:  1280x800    59.810326 Hz  16:10    49.702 kHz     83.500000 MHz
    DMT 0x20:  1280x960    60.000000 Hz   4:3     60.000 kHz    108.000000 MHz
    DMT 0x23:  1280x1024   60.019740 Hz   5:4     63.981 kHz    108.000000 MHz
    DMT 0x2f:  1440x900    59.887445 Hz  16:10    55.935 kHz    106.500000 MHz
    DMT 0x30:  1440x900    74.984427 Hz  16:10    70.635 kHz    136.750000 MHz
    DMT 0x33:  1600x1200   60.000000 Hz   4:3     75.000 kHz    162.000000 MHz
    DMT 0x3a:  1680x1050   59.954250 Hz  16:10    65.290 kHz    146.250000 MHz
  Detailed Timing Descriptors:
    DTD 1:  1920x1080   60.000000 Hz  16:9     67.500 kHz    148.500000 MHz (160 mm x 90 mm)
                 Hfront   88 Hsync  44 Hback  148 Hpol P
                 Vfront    4 Vsync   5 Vback   36 Vpol P
    Display Range Limits:
      Monitor ranges (GTF): 56-75 Hz V, 30-80 kHz H, max dotclock 170 MHz
    Display Product Name: 'SM2443DW'
    Display Product Serial Number: ...
  Extension blocks: 1
Checksum: 0x7d

----------------

Block 1, CTA-861 Extension Block:
  Revision: 3
  Underscans IT Video Formats by default
  Basic audio support
  Native detailed modes: 1
  Video Data Block:
    VIC  16:  1920x1080   60.000000 Hz  16:9     67.500 kHz    148.500000 MHz
    VIC  31:  1920x1080   50.000000 Hz  16:9     56.250 kHz    148.500000 MHz
    VIC   4:  1280x720    60.000000 Hz  16:9     45.000 kHz     74.250000 MHz (native)
    VIC  19:  1280x720    50.000000 Hz  16:9     37.500 kHz     74.250000 MHz
    VIC   2:   720x480    59.940060 Hz   4:3     31.469 kHz     27.000000 MHz
    VIC   3:   720x480    59.940060 Hz  16:9     31.469 kHz     27.000000 MHz
  Audio Data Block:
    Linear PCM:
      Max channels: 2
      Supported sample rates (kHz): 48 44.1 32
      Supported sample sizes (bits): 24 20 16
  Speaker Allocation Data Block:
    FL/FR - Front Left/Right
  Video Capability Data Block:
    YCbCr quantization: No Data
    RGB quantization: No Data
    PT scan behavior: No Data
    IT scan behavior: Supports both over- and underscan
    CE scan behavior: Supports both over- and underscan
  Vendor-Specific Data Block (HDMI), OUI 00-0C-03:
    Source physical address: 2.0.0.0
    Supports_AI
    Maximum TMDS clock: 225 MHz
  Detailed Timing Descriptors:
    DTD 2:  1280x720    60.000000 Hz  16:9     45.000 kHz     74.250000 MHz (16 mm x 9 mm)
                 Hfront  110 Hsync  40 Hback  220 Hpol P
                 Vfront    5 Vsync   5 Vback   20 Vpol P
Checksum: 0xfe  Unused space in Extension Block: 74 bytes

----------------

Block 2, Unknown EDID Extension Block 0x00:
  00 ff ff ff ff ff ff 00 4c 2d 3a 07 45 4d 45 59 '........L-:.EMEY'
  12 15 01 03 a0 34 20 78 22 9f c1 a6 56 4b 9a 25 '.....4 x"...VK.%'
  13 50 54 bf ef 80 71 4f 81 00 81 40 81 80 95 00 '.PT...qO...@....'
  95 0f a9 40 b3 00 02 3a 80 18 71 38 2d 40 58 2c '...@...:..q8-@X,'
  45 00 a0 5a 00 00 00 1e 00 00 00 fd 00 38 4b 1e 'E..Z.........8K.'
  50 11 00 0a 20 20 20 20 20 20 00 00 00 fc 00 53 'P...      .....S'
  4d 32 34 34 33 44 57 0a 20 20 20 20 00 00 00 ff 'M2443DW.    ....'
  00 48 4d 4a 42 35 30 30 37 31 39 0a 20 20 01 7d '.HMJB500719.  .}'
Checksum: 0x7d

----------------

Block 3, CTA-861 Extension Block:
  Revision: 3
  Underscans IT Video Formats by default
  Basic audio support
  Native detailed modes: 1
  Video Data Block:
    VIC  16:  1920x1080   60.000000 Hz  16:9     67.500 kHz    148.500000 MHz
    VIC  31:  1920x1080   50.000000 Hz  16:9     56.250 kHz    148.500000 MHz
    VIC   4:  1280x720    60.000000 Hz  16:9     45.000 kHz     74.250000 MHz (native)
    VIC  19:  1280x720    50.000000 Hz  16:9     37.500 kHz     74.250000 MHz
    VIC   2:   720x480    59.940060 Hz   4:3     31.469 kHz     27.000000 MHz
    VIC   3:   720x480    59.940060 Hz  16:9     31.469 kHz     27.000000 MHz
  Audio Data Block:
    Linear PCM:
      Max channels: 2
      Supported sample rates (kHz): 48 44.1 32
      Supported sample sizes (bits): 24 20 16
  Speaker Allocation Data Block:
    FL/FR - Front Left/Right
  Video Capability Data Block:
    YCbCr quantization: No Data
    RGB quantization: No Data
    PT scan behavior: No Data
    IT scan behavior: Supports both over- and underscan
    CE scan behavior: Supports both over- and underscan
  Vendor-Specific Data Block (HDMI), OUI 00-0C-03:
    Source physical address: 2.0.0.0
    Supports_AI
    Maximum TMDS clock: 225 MHz
  Detailed Timing Descriptors:
    DTD 3:  1280x720    60.000000 Hz  16:9     45.000 kHz     74.250000 MHz (16 mm x 9 mm)
                 Hfront  110 Hsync  40 Hback  220 Hpol P
                 Vfront    5 Vsync   5 Vback   20 Vpol P
Checksum: 0xfe  Unused space in Extension Block: 74 bytes

----------------

Warnings:

Block 1, CTA-861 Extension Block:
  Display Product Serial Number is set, so the Serial Number in the Base EDID should be 0.
  Add a Colorimetry Data Block with the sRGB colorimetry bit set to avoid interop issues.
Block 3, CTA-861 Extension Block:
  Display Product Serial Number is set, so the Serial Number in the Base EDID should be 0.
  Add a Colorimetry Data Block with the sRGB colorimetry bit set to avoid interop issues.

Failures:

Block 0, Base EDID:
  Basic Display Parameters & Features: Digital Video Interface Standard set to reserved value 0x20.
  Detailed Timing Descriptor #1: Mismatch of image size 160x90 mm vs display size 520x320 mm.
Block 1, CTA-861 Extension Block:
  Video Capability Data Block: Set Selectable RGB Quantization to avoid interop issues.
  Detailed Timing Descriptor #2: Mismatch of image size 16x9 mm vs display size 520x320 mm.
Block 2, Base EDID:
  Unknown Extension Block.
Block 3, CTA-861 Extension Block:
  Video Data Block: Duplicate VIC 16.
  Video Data Block: Duplicate VIC 31.
  Video Data Block: Duplicate VIC 4.
  Video Data Block: Duplicate VIC 19.
  Video Data Block: Duplicate VIC 2.
  Video Data Block: Duplicate VIC 3.
  Speaker Allocation Data Block: Only one instance of this Data Block is allowed.
  Video Capability Data Block: Only one instance of this Data Block is allowed.
  Video Capability Data Block: Set Selectable RGB Quantization to avoid interop issues.
  Detailed Timing Descriptor #3: Mismatch of image size 16x9 mm vs display size 520x320 mm.
EDID:
  Base EDID: Some timings are out of range of the Monitor Ranges:
    Vertical Freq: 50.000 - 75.062 Hz (Monitor: 56.000 - 75.000 Hz)
  Base EDID: EDID specified 1 extension block(s), but found 3 extension block(s).
  Base EDID: EDID 1.3 requires a Block Map Extension in Block 1 if there are more than 2 blocks in the EDID.
  CTA-861: Native progressive timings are a mix of several resolutions.

EDID conformity: FAIL
