edid-decode (hex):

00 ff ff ff ff ff ff 00 0e 98 74 53 00 00 00 00
00 0c 01 01 1d 21 19 6e e8 0e c8 a0 57 47 99 26
12 48 4c bf ff 80 31 a4 45 9d 61 7c 71 68 81 5e
a9 51 01 01 01 01 10 0e 80 c0 20 e0 1d 10 20 30
13 00 36 e8 10 00 00 18 f9 15 20 f8 30 58 1f 20
20 40 13 00 36 e8 10 00 00 1e ea 24 00 60 41 00
28 30 30 60 13 00 36 e8 10 00 00 1e 00 00 00 fd
00 32 a0 1e 61 14 00 0a 20 20 20 20 20 20 00 db

----------------

Block 0, Base EDID:
  EDID Structure Version & Revision: 1.1
  Vendor & Product Identification:
    Manufacturer: CTX
    Model: 21364
    Made in: 2002
  Basic Display Parameters & Features:
    Analog display
    Input voltage level: 0.7/0.3 V
    Configurable signal levels
    Sync: Separate Composite Serration
    Maximum image size: 33 cm x 25 cm
    Gamma: 2.10
    DPMS levels: Standby Suspend Off
    RGB color display
  Color Characteristics:
    Red  : 0.6250, 0.3398
    Green: 0.2802, 0.5996
    Blue : 0.1513, 0.0703
    White: 0.2832, 0.2968
  Established Timings I & II:
    IBM     :   720x400    70.082 Hz   9:5    31.467 kHz  28.320 MHz
    DMT 0x04:   640x480    59.940 Hz   4:3    31.469 kHz  25.175 MHz
    Apple   :   640x480    66.667 Hz   4:3    35.000 kHz  30.240 MHz
    DMT 0x05:   640x480    72.809 Hz   4:3    37.861 kHz  31.500 MHz
    DMT 0x06:   640x480    75.000 Hz   4:3    37.500 kHz  31.500 MHz
    DMT 0x08:   800x600    56.250 Hz   4:3    35.156 kHz  36.000 MHz
    DMT 0x09:   800x600    60.317 Hz   4:3    37.879 kHz  40.000 MHz
    DMT 0x0a:   800x600    72.188 Hz   4:3    48.077 kHz  50.000 MHz
    DMT 0x0b:   800x600    75.000 Hz   4:3    46.875 kHz  49.500 MHz
    Apple   :   832x624    74.551 Hz   4:3    49.726 kHz  57.284 MHz
    DMT 0x0f:  1024x768i   86.958 Hz   4:3    35.522 kHz  44.900 MHz
    DMT 0x10:  1024x768    60.004 Hz   4:3    48.363 kHz  65.000 MHz
    DMT 0x11:  1024x768    70.069 Hz   4:3    56.476 kHz  75.000 MHz
    DMT 0x12:  1024x768    75.029 Hz   4:3    60.023 kHz  78.750 MHz
    DMT 0x24:  1280x1024   75.025 Hz   5:4    79.976 kHz 135.000 MHz
    Apple   :  1152x870    75.062 Hz 192:145  68.681 kHz 100.000 MHz
  Standard Timings:
    Unknown :   640x512    96.000 Hz   5:4
    Unknown :   800x640    89.000 Hz   5:4
    Unknown :  1024x768   120.000 Hz   4:3
    Unknown :  1152x864   100.000 Hz   4:3
    Unknown :  1280x960    90.000 Hz   4:3
    Unknown :  1600x1200   77.000 Hz   4:3
  Detailed Timing Descriptors:
    DTD 1:   640x480    85.008 Hz   4:3    43.269 kHz  36.000 MHz (310 mm x 232 mm)
                 Hfront   32 Hsync  48 Hback 112 Hpol N
                 Vfront    1 Vsync   3 Vback  25 Vpol N
    DTD 2:   800x600    85.061 Hz   4:3    53.674 kHz  56.250 MHz (310 mm x 232 mm)
                 Hfront   32 Hsync  64 Hback 152 Hpol P
                 Vfront    1 Vsync   3 Vback  27 Vpol P
    DTD 3:  1024x768    84.997 Hz   4:3    68.677 kHz  94.500 MHz (310 mm x 232 mm)
                 Hfront   48 Hsync  96 Hback 208 Hpol P
                 Vfront    1 Vsync   3 Vback  36 Vpol P
  Display Range Limits:
    Monitor ranges (GTF): 50-160 Hz V, 30-97 kHz H, max dotclock 200 MHz
Checksum: 0xdb
