edid-decode (hex):

00 ff ff ff ff ff ff 00 4d 10 b2 21 01 01 01 01
00 14 01 04 a5 68 3a 78 e2 89 3a a2 55 48 9b 25
0f 49 4b bf ef 80 8b c0 90 40 81 c0 81 00 81 87
a9 40 81 40 b3 00 02 3a 80 18 71 38 2d 40 58 2c
45 00 10 49 42 00 00 1e 28 3c 80 a0 70 b0 23 40
30 20 36 00 10 49 42 00 00 1a 00 00 00 fd 00 37
4d 18 54 11 00 0a 20 20 20 20 20 20 00 00 00 fc
00 50 4e 2d 45 34 37 31 0a 20 20 20 20 20 00 7b

----------------

Block 0, Base EDID:
  EDID Structure Version & Revision: 1.4
  Vendor & Product Identification:
    Manufacturer: SHP
    Model: 8626
    Serial Number: ...
    Made in: 2010
  Basic Display Parameters & Features:
    Digital display
    Bits per primary color channel: 8
    DisplayPort interface
    Maximum image size: 104 cm x 58 cm
    Gamma: 2.20
    DPMS levels: Standby Suspend Off
    Supported color formats: RGB 4:4:4
    First detailed timing includes the native pixel format and preferred refresh rate
  Color Characteristics:
    Red  : 0.6347, 0.3320
    Green: 0.2832, 0.6064
    Blue : 0.1445, 0.0615
    White: 0.2871, 0.2949
  Established Timings I & II:
    IBM     :   720x400    70.082 Hz   9:5    31.467 kHz  28.320 MHz
    DMT 0x04:   640x480    59.940 Hz   4:3    31.469 kHz  25.175 MHz
    Apple   :   640x480    66.667 Hz   4:3    35.000 kHz  30.240 MHz
    DMT 0x05:   640x480    72.809 Hz   4:3    37.861 kHz  31.500 MHz
    DMT 0x06:   640x480    75.000 Hz   4:3    37.500 kHz  31.500 MHz
    DMT 0x08:   800x600    56.250 Hz   4:3    35.156 kHz  36.000 MHz
    DMT 0x09:   800x600    60.317 Hz   4:3    37.879 kHz  40.000 MHz
    DMT 0x0a:   800x600    72.188 Hz   4:3    48.077 kHz  50.000 MHz
    DMT 0x0b:   800x600    75.000 Hz   4:3    46.875 kHz  49.500 MHz
    Apple   :   832x624    74.551 Hz   4:3    49.726 kHz  57.284 MHz
    DMT 0x10:  1024x768    60.004 Hz   4:3    48.363 kHz  65.000 MHz
    DMT 0x11:  1024x768    70.069 Hz   4:3    56.476 kHz  75.000 MHz
    DMT 0x12:  1024x768    75.029 Hz   4:3    60.023 kHz  78.750 MHz
    DMT 0x24:  1280x1024   75.025 Hz   5:4    79.976 kHz 135.000 MHz
    Apple   :  1152x870    75.062 Hz 192:145  68.681 kHz 100.000 MHz
  Standard Timings:
    CVT     :  1360x768    59.799 Hz  16:9    47.720 kHz  84.750 MHz (EDID 1.4 source)
    GTF     :  1360x768    60.000 Hz  16:9    47.700 kHz  84.715 MHz (EDID 1.3 source)
    DMT 0x2a:  1400x1050   59.978 Hz   4:3    65.317 kHz 121.750 MHz
    DMT 0x55:  1280x720    60.000 Hz  16:9    45.000 kHz  74.250 MHz
    DMT 0x1c:  1280x800    59.810 Hz  16:10   49.702 kHz  83.500 MHz
    CVT     :  1280x1024   66.924 Hz   5:4    71.408 kHz 122.250 MHz (EDID 1.4 source)
    GTF     :  1280x1024   67.000 Hz   5:4    71.288 kHz 123.186 MHz (EDID 1.3 source)
    DMT 0x33:  1600x1200   60.000 Hz   4:3    75.000 kHz 162.000 MHz
    DMT 0x20:  1280x960    60.000 Hz   4:3    60.000 kHz 108.000 MHz
    DMT 0x3a:  1680x1050   59.954 Hz  16:10   65.290 kHz 146.250 MHz
  Detailed Timing Descriptors:
    DTD 1:  1920x1080   60.000 Hz  16:9    67.500 kHz 148.500 MHz (1040 mm x 585 mm)
                 Hfront   88 Hsync  44 Hback 148 Hpol P
                 Vfront    4 Vsync   5 Vback  36 Vpol P
    DTD 2:  1920x1200   59.950 Hz   8:5    74.038 kHz 154.000 MHz (1040 mm x 585 mm)
                 Hfront   48 Hsync  32 Hback  80 Hpol P
                 Vfront    3 Vsync   6 Vback  26 Vpol N
  Display Range Limits:
    Monitor ranges (GTF): 55-77 Hz V, 24-84 kHz H, max dotclock 170 MHz
    Display Product Name: 'PN-E471'
Checksum: 0x7b

----------------

Failures:

Block 0, Base EDID:
  Display Range Limits: GTF can't be combined with non-continuous frequencies.
EDID:
  Base EDID: CVT timings are used, but the EDID does not signal CVT support.

EDID conformity: FAIL
