edid-decode (hex):

00 ff ff ff ff ff ff 00 38 70 42 00 00 00 00 00
01 1c 01 04 a5 22 13 78 03 68 50 98 5c 58 8e 28
1b 50 54 00 00 00 01 01 01 01 01 01 01 01 01 01
01 01 01 01 01 01 0b 83 80 04 71 38 ca 40 30 20
35 00 58 c2 10 00 00 1a 6a 34 80 04 71 38 ca 40
30 20 35 00 58 c2 10 00 00 1a 00 00 00 fd 00 00
00 00 00 00 00 00 20 20 20 20 20 20 00 00 00 fe
00 4c 4d 31 35 36 4c 46 2d 47 4c 30 32 0a 00 42

----------------

Block 0, Base EDID:
  EDID Structure Version & Revision: 1.4
  Vendor & Product Identification:
    Manufacturer: NCP
    Model: 66
    Made in: week 1 of 2018
  Basic Display Parameters & Features:
    Digital display
    Bits per primary color channel: 8
    DisplayPort interface
    Maximum image size: 34 cm x 19 cm
    Gamma: 2.20
    Supported color formats: RGB 4:4:4
    First detailed timing includes the native pixel format and preferred refresh rate
    Display is continuous frequency
  Color Characteristics:
    Red  : 0.5947, 0.3613
    Green: 0.3457, 0.5546
    Blue : 0.1572, 0.1064
    White: 0.3125, 0.3281
  Established Timings I & II: none
  Standard Timings: none
  Detailed Timing Descriptors:
    DTD 1:  1920x1080  120.035352 Hz  16:9    153.885 kHz    335.470000 MHz (344 mm x 194 mm)
                 Hfront   48 Hsync  32 Hback  180 Hpol P
                 Vfront    3 Vsync   5 Vback  194 Vpol N
    DTD 2:  1920x1080   48.011278 Hz  16:9     61.550 kHz    134.180000 MHz (344 mm x 194 mm)
                 Hfront   48 Hsync  32 Hback  180 Hpol P
                 Vfront    3 Vsync   5 Vback  194 Vpol N
    Display Range Limits:
      Monitor ranges (GTF): 0-0 Hz V, 0-0 kHz H
    Alphanumeric Data String: 'LM156LF-GL02'
Checksum: 0x42

----------------

Warnings:

Block 0, Base EDID:
  Display Range Limits: GTF support is deprecated in EDID 1.4.

Failures:

Block 0, Base EDID:
  Display Range Limits: EDID 1.4 block does not set max dotclock.
  Display Range Limits: Byte 11 is 0x00 instead of 0x0a.
  Missing Display Product Name.

EDID conformity: FAIL
