edid-decode (hex):

00 ff ff ff ff ff ff 00 38 70 0d 00 00 00 00 00
00 1a 01 04 95 22 13 78 06 5f 60 98 5d 55 8b 27
1b 4e 53 00 00 00 01 01 01 01 01 01 01 01 01 01
01 01 01 01 01 01 02 3a 80 18 71 38 2d 40 58 2c
45 00 58 c2 10 00 00 18 00 00 00 10 00 00 00 00
00 00 00 00 00 00 00 00 00 00 00 00 00 10 00 00
00 00 00 00 00 00 00 00 00 00 00 00 00 00 00 fe
00 4c 4d 31 35 36 4c 46 33 4c 30 31 0a 20 00 7f

----------------

Block 0, Base EDID:
  EDID Structure Version & Revision: 1.4
  Vendor & Product Identification:
    Manufacturer: NCP
    Model: 13
    Made in: 2016
  Basic Display Parameters & Features:
    Digital display
    Bits per primary color channel: 6
    DisplayPort interface
    Maximum image size: 34 cm x 19 cm
    Gamma: 2.20
    Supported color formats: RGB 4:4:4
    Default (sRGB) color space is primary color space
    First detailed timing includes the native pixel format and preferred refresh rate
  Color Characteristics:
    Red  : 0.5947, 0.3642
    Green: 0.3349, 0.5458
    Blue : 0.1533, 0.1074
    White: 0.3046, 0.3242
  Established Timings I & II: none
  Standard Timings: none
  Detailed Timing Descriptors:
    DTD 1:  1920x1080   60.000 Hz  16:9    67.500 kHz 148.500 MHz (344 mm x 194 mm)
                 Hfront   88 Hsync  44 Hback 148 Hpol N
                 Vfront    4 Vsync   5 Vback  36 Vpol N
    Dummy Descriptor:
    Dummy Descriptor:
    Alphanumeric Data String: 'LM156LF3L01'
Checksum: 0x7f

----------------

Failures:

Block 0, Base EDID:
  Basic Display Parameters & Features: sRGB is signaled, but the chromaticities do not match.
  Missing Display Product Name.

EDID conformity: FAIL
