
EDID (hex):
00ffffffffffff0009e5cb0600000000
011a0104952213780af9a0955d599429
24505400000001010101010101010101
0101010101019c3b803671383c403020
360058c21000001afd2d800e71382840
3020360058c21000001a000000fe0052
4d4a43590b4e5631354e343200000000
0000412296001000000a010a202000a9

Extracted contents:
header:          00 ff ff ff ff ff ff 00
serial number:   09 e5 cb 06 00 00 00 00 01 1a
version:         01 04
basic params:    95 22 13 78 0a
chroma info:     f9 a0 95 5d 59 94 29 24 50 54
established:     00 00 00
standard:        01 01 01 01 01 01 01 01 01 01 01 01 01 01 01 01
descriptor 1:    9c 3b 80 36 71 38 3c 40 30 20 36 00 58 c2 10 00 00 1a
descriptor 2:    fd 2d 80 0e 71 38 28 40 30 20 36 00 58 c2 10 00 00 1a
descriptor 3:    00 00 00 fe 00 52 4d 4a 43 59 0b 4e 56 31 35 4e 34 32
descriptor 4:    00 00 00 00 00 00 41 22 96 00 10 00 00 0a 01 0a 20 20
extensions:      00
checksum:        a9

EDID version: 1.4
Manufacturer: BOE Model 6cb Serial Number --
Made in week 1 of 2016
Digital display
6 bits per primary color channel
DisplayPort interface
Maximum image size: 34 cm x 19 cm
Gamma: 2.20
Supported color formats: RGB 4:4:4, YCrCb 4:4:4
First detailed timing includes the native pixel format and preferred refresh rate
Display x,y Chromaticity:
  Red:   0.5849, 0.3662
  Green: 0.3496, 0.5791
  Blue:  0.1621, 0.1425
  White: 0.3125, 0.3281
Established timings supported:
Standard timings supported:
Detailed mode: Clock 152.600 MHz, 344 mm x 194 mm
               1920 1968 2000 2230 hborder 0
               1080 1083 1089 1140 vborder 0
               +hsync -vsync 
               VertFreq: 60 Hz, HorFreq: 68430 Hz
Detailed mode: Clock 117.730 MHz, 344 mm x 194 mm
               1920 1968 2000 2190 hborder 0
               1080 1083 1089 1120 vborder 0
               +hsync -vsync 
               VertFreq: 47 Hz, HorFreq: 53757 Hz
ASCII string: RMJCY
Manufacturer-specified data, tag 0
Checksum: 0xa9 (valid)
EDID block does NOT conform to EDID 1.4!
	Missing name descriptor
	Missing monitor ranges
	Detailed block string not properly terminated
