
EDID (hex):
00ffffffffffff0034a93aa006320339
131001010e522e7888daffa3584aa229
17494bffff808bc0a94f815971596159
455931590101df2156aa5126263020b5
030634cc31000018490d54dc30e03110
1c880c0334cc31000018000000fd0030
780f6eff000a202020202020000000fc
0054482d3337502a2a380a2020200024

Extracted contents:
header:          00 ff ff ff ff ff ff 00
serial number:   34 a9 3a a0 06 32 03 39 13 10
version:         01 01
basic params:    0e 52 2e 78 88
chroma info:     da ff a3 58 4a a2 29 17 49 4b
established:     ff ff 80
standard:        8b c0 a9 4f 81 59 71 59 61 59 45 59 31 59 01 01
descriptor 1:    df 21 56 aa 51 26 26 30 20 b5 03 06 34 cc 31 00 00 18
descriptor 2:    49 0d 54 dc 30 e0 31 10 1c 88 0c 03 34 cc 31 00 00 18
descriptor 3:    00 00 00 fd 00 30 78 0f 6e ff 00 0a 20 20 20 20 20 20
descriptor 4:    00 00 00 fc 00 54 48 2d 33 37 50 2a 2a 38 0a 20 20 20
extensions:      00
checksum:        24

EDID version: 1.1
Manufacturer: MEI Model a03a Serial Number --
Made in week 19 of 2006
Analog display, Input voltage level: 0.7/0.3 V
Sync: Separate Composite SyncOnGreen 
Maximum image size: 82 cm x 46 cm
Gamma: 2.20
DPMS levels: Standby
RGB color display
Display x,y Chromaticity:
  Red:   0.6396, 0.3447
  Green: 0.2910, 0.6347
  Blue:  0.1630, 0.0927
  White: 0.2880, 0.2958
Established timings supported:
  720x400@70Hz 9:5 HorFreq: 31469 Hz Clock: 28.320 MHz
  720x400@88Hz 9:5 HorFreq: 39500 Hz Clock: 35.500 MHz
  640x480@60Hz 4:3 HorFreq: 31469 Hz Clock: 25.175 MHz
  640x480@67Hz 4:3 HorFreq: 35000 Hz Clock: 30.240 MHz
  640x480@72Hz 4:3 HorFreq: 37900 Hz Clock: 31.500 MHz
  640x480@75Hz 4:3 HorFreq: 37500 Hz Clock: 31.500 MHz
  800x600@56Hz 4:3 HorFreq: 35200 Hz Clock: 36.000 MHz
  800x600@60Hz 4:3 HorFreq: 37900 Hz Clock: 40.000 MHz
  800x600@72Hz 4:3 HorFreq: 48100 Hz Clock: 50.000 MHz
  800x600@75Hz 4:3 HorFreq: 46900 Hz Clock: 49.500 MHz
  832x624@75Hz 4:3 HorFreq: 49726 Hz Clock: 57.284 MHz
  1280x768i@87Hz 5:3 HorFreq: 35522 Hz Clock: 44.900 MHz
  1024x768@60Hz 4:3 HorFreq: 48400 Hz Clock: 65.000 MHz
  1024x768@70Hz 4:3 HorFreq: 56500 Hz Clock: 75.000 MHz
  1024x768@75Hz 4:3 HorFreq: 60000 Hz Clock: 78.750 MHz
  1280x1024@75Hz 5:4 HorFreq: 80000 Hz Clock: 135.000 MHz
  1152x870@75Hz 192:145 HorFreq: 67500 Hz Clock: 108.000 MHz
Standard timings supported:
  1360x765@60Hz 16:9
  1600x1200@75Hz 4:3 HorFreq: 93800 Hz Clock: 202.500 MHz
  1280x960@85Hz 4:3 HorFreq: 85900 Hz Clock: 148.500 MHz
  1152x864@85Hz 4:3
  1024x768@85Hz 4:3 HorFreq: 68700 Hz Clock: 94.500 MHz
  800x600@85Hz 4:3 HorFreq: 53700 Hz Clock: 56.250 MHz
  640x480@85Hz 4:3 HorFreq: 43300 Hz Clock: 36.000 MHz
Detailed mode: Clock 86.710 MHz, 820 mm x 460 mm
               1366 1398 1579 1792 hborder 0
                806  822  857  844 vborder 0
               -hsync -vsync 
               VertFreq: 57 Hz, HorFreq: 48387 Hz
Detailed mode: Clock 34.010 MHz, 820 mm x 460 mm
                852  880 1016 1072 hborder 0
                480  480  540  529 vborder 0
               -hsync -vsync 
               VertFreq: 59 Hz, HorFreq: 31725 Hz
Monitor ranges (GTF): 48-120Hz V, 15-110kHz H, max dotclock 2550MHz
Monitor name: TH-37P**8
Checksum: 0x24 (valid)
EDID block does NOT conform to EDID 1.0!
	Has descriptor blocks other than detailed timings
