
EDID (hex):
00ffffffffffff00220eda3601010101
271e010380351e782a33d5a8554c9b25
0f5054a10800d1c0a9c081c0b3009500
810081800101023a801871382d40582c
45000f292100001e000000fd0030901e
a723010a202020202020000000fc0048
5020583234690a2020202020000000ff
00314352303339323243430a202001db
02033bf14d3f40101f04131211030201
0514230907078301000067030c001000
004467d85dc4017880006d1a00000201
3090ed0000000000e2006b5a8780a070
384d40302035000f292100001a047480
1871382d40582c45000f292100001e04
7480d072382d40102c45800f29210000
1e00000000000000000000000000002b

Extracted contents:
header:          00 ff ff ff ff ff ff 00
serial number:   22 0e da 36 01 01 01 01 27 1e
version:         01 03
basic params:    80 35 1e 78 2a
chroma info:     33 d5 a8 55 4c 9b 25 0f 50 54
established:     a1 08 00
standard:        d1 c0 a9 c0 81 c0 b3 00 95 00 81 00 81 80 01 01
descriptor 1:    02 3a 80 18 71 38 2d 40 58 2c 45 00 0f 29 21 00 00 1e
descriptor 2:    00 00 00 fd 00 30 90 1e a7 23 01 0a 20 20 20 20 20 20
descriptor 3:    00 00 00 fc 00 48 50 20 58 32 34 69 0a 20 20 20 20 20
descriptor 4:    00 00 00 ff 00 31 43 52 30 33 39 32 32 43 43 0a 20 20
extensions:      01
checksum:        db

EDID version: 1.3
Manufacturer: HPN Model 36da Serial Number --
Made in week 39 of 2020
Digital display
Maximum image size: 53 cm x 30 cm
Gamma: 2.20
DPMS levels: Off
RGB color display
First detailed timing is preferred timing
Display x,y Chromaticity:
  Red:   0.6562, 0.3349
  Green: 0.2968, 0.6083
  Blue:  0.1474, 0.0595
  White: 0.3134, 0.3291
Established timings supported:
  720x400@70Hz 9:5 HorFreq: 31469 Hz Clock: 28.320 MHz
  640x480@60Hz 4:3 HorFreq: 31469 Hz Clock: 25.175 MHz
  800x600@60Hz 4:3 HorFreq: 37900 Hz Clock: 40.000 MHz
  1024x768@60Hz 4:3 HorFreq: 48400 Hz Clock: 65.000 MHz
Standard timings supported:
  1920x1080@60Hz 16:9
  1600x900@60Hz 16:9
  1280x720@60Hz 16:9
  1680x1050@60Hz 16:10 HorFreq: 64700 Hz Clock: 119.000 MHz
  1440x900@60Hz 16:10 HorFreq: 55500 Hz Clock: 88.750 MHz
  1280x800@60Hz 16:10
  1280x1024@60Hz 5:4 HorFreq: 64000 Hz Clock: 108.000 MHz
Detailed mode: Clock 148.500 MHz, 527 mm x 297 mm
               1920 2008 2052 2200 hborder 0
               1080 1084 1089 1125 vborder 0
               +hsync +vsync 
               VertFreq: 60 Hz, HorFreq: 67500 Hz
Monitor ranges (bare limits): 48-144Hz V, 30-167kHz H, max dotclock 350MHz
Monitor name: HP X24i
Serial number: --
Has 1 extension blocks
Checksum: 0xdb (valid)

CTA extension block
Extension version: 3
55 bytes of CTA data
  Video data block
    VIC  63 1920x1080@120Hz 16:9  HorFreq: 135000 Hz Clock: 297.000 MHz
    VIC  64 1920x1080@100Hz 16:9  HorFreq: 112500 Hz Clock: 297.000 MHz
    VIC  16 1920x1080@60Hz 16:9  HorFreq: 67500 Hz Clock: 148.500 MHz
    VIC  31 1920x1080@50Hz 16:9  HorFreq: 56250 Hz Clock: 148.500 MHz
    VIC   4 1280x720@60Hz 16:9  HorFreq: 45000 Hz Clock: 74.250 MHz
    VIC  19 1280x720@50Hz 16:9  HorFreq: 37500 Hz Clock: 74.250 MHz
    VIC  18 720x576@50Hz 16:9  HorFreq: 31250 Hz Clock: 27.000 MHz
    VIC  17 720x576@50Hz 4:3  HorFreq: 31250 Hz Clock: 27.000 MHz
    VIC   3 720x480@60Hz 16:9  HorFreq: 31469 Hz Clock: 27.000 MHz
    VIC   2 720x480@60Hz 4:3  HorFreq: 31469 Hz Clock: 27.000 MHz
    VIC   1 640x480@60Hz 4:3  HorFreq: 31469 Hz Clock: 25.175 MHz
    VIC   5 1920x1080i@60Hz 16:9  HorFreq: 33750 Hz Clock: 74.250 MHz
    VIC  20 1920x1080i@50Hz 16:9  HorFreq: 28125 Hz Clock: 74.250 MHz
  Audio data block
    Linear PCM, max channels 2
      Supported sample rates (kHz): 48 44.1 32
      Supported sample sizes (bits): 24 20 16
  Speaker allocation data block
    Speaker map:
      FL/FR - Front Left/Right
  Vendor-specific data block, OUI 000c03 (HDMI)
    Source physical address 1.0.0.0
    Maximum TMDS clock: 340MHz
  Vendor-specific data block, OUI c45dd8 (HDMI Forum)
    Version: 1
    Maximum TMDS Character Rate: 600MHz
    SCDC Present
  Vendor-specific data block, OUI 00001a
  Extended tag: Video capability data block
    YCbCr quantization: No Data (0)
    RGB quantization: Selectable (via AVI Q) (1)
    PT scan behaviour: Always Underscanned (2)
    IT scan behaviour: Always Underscanned (2)
    CE scan behaviour: Support both over- and underscan (3)
Underscans PC formats by default
Basic audio support
Supports YCbCr 4:4:4
Supports YCbCr 4:2:2
1 native detailed modes
Detailed mode: Clock 346.500 MHz, 527 mm x 297 mm
               1920 1968 2000 2080 hborder 0
               1080 1083 1088 1157 vborder 0
               +hsync -vsync 
               VertFreq: 143 Hz, HorFreq: 166586 Hz
Detailed mode: Clock 297.000 MHz, 527 mm x 297 mm
               1920 2008 2052 2200 hborder 0
               1080 1084 1089 1125 vborder 0
               +hsync +vsync 
               VertFreq: 120 Hz, HorFreq: 135000 Hz
Detailed mode: Clock 297.000 MHz, 527 mm x 297 mm
               1920 2448 2492 2640 hborder 0
               1080 1084 1089 1125 vborder 0
               +hsync +vsync 
               VertFreq: 100 Hz, HorFreq: 112500 Hz
Checksum: 0x2b (valid)

EDID block does not conform at all!
	Both the serial number and the serial string are set
	Detailed blocks filled with garbage
	Range descriptor contains garbage


