edid-decode (hex):

00 ff ff ff ff ff ff 00 04 69 a3 24 01 01 01 01
1a 18 01 03 80 34 20 78 ea 4c a5 a7 55 4d a2 26
10 50 54 23 08 00 81 80 81 40 95 00 a9 40 b3 00
d1 c0 01 01 01 01 28 3c 80 a0 70 b0 23 40 30 20
36 00 06 44 21 00 00 1a 00 00 00 fd 00 32 3d 1e
53 11 00 0a 20 20 20 20 20 20 00 00 00 fc 00 50
42 32 34 38 0a 20 20 20 20 20 20 20 00 00 00 ff
00 45 36 4c 4d 51 53 31 31 39 37 38 34 0a 01 19

02 03 1e f1 4b 90 05 04 03 02 01 11 12 13 14 1f
23 09 07 07 83 01 00 00 65 03 0c 00 10 00 1a 36
80 a0 70 38 1e 40 30 20 35 00 06 44 21 00 00 1a
66 21 56 aa 51 00 1e 30 46 8f 33 00 06 44 21 00
00 1e 01 1d 00 72 51 d0 1e 20 6e 28 55 00 06 44
21 00 00 1e 8c 0a d0 8a 20 e0 2d 10 10 3e 96 00
06 44 21 00 00 18 01 1d 80 18 71 1c 16 20 58 2c
25 00 06 44 21 00 00 9e 00 00 00 00 00 00 00 fe

----------------

Block 0, Base EDID:
  EDID Structure Version & Revision: 1.3
  Vendor & Product Identification:
    Manufacturer: ACI
    Model: 9379
    Serial Number: ...
    Made in: week 26 of 2014
  Basic Display Parameters & Features:
    Digital display
    Maximum image size: 52 cm x 32 cm
    Gamma: 2.20
    DPMS levels: Standby Suspend Off
    RGB color display
    First detailed timing is preferred timing
  Color Characteristics:
    Red  : 0.6533, 0.3320
    Green: 0.3037, 0.6328
    Blue : 0.1503, 0.0644
    White: 0.3134, 0.3291
  Established Timings I & II:
    DMT 0x04:   640x480    59.940 Hz   4:3    31.469 kHz  25.175 MHz
    DMT 0x08:   800x600    56.250 Hz   4:3    35.156 kHz  36.000 MHz
    DMT 0x09:   800x600    60.317 Hz   4:3    37.879 kHz  40.000 MHz
    DMT 0x10:  1024x768    60.004 Hz   4:3    48.363 kHz  65.000 MHz
  Standard Timings:
    DMT 0x23:  1280x1024   60.020 Hz   5:4    63.981 kHz 108.000 MHz
    DMT 0x20:  1280x960    60.000 Hz   4:3    60.000 kHz 108.000 MHz
    DMT 0x2f:  1440x900    59.887 Hz  16:10   55.935 kHz 106.500 MHz
    DMT 0x33:  1600x1200   60.000 Hz   4:3    75.000 kHz 162.000 MHz
    DMT 0x3a:  1680x1050   59.954 Hz  16:10   65.290 kHz 146.250 MHz
    DMT 0x52:  1920x1080   60.000 Hz  16:9    67.500 kHz 148.500 MHz
  Detailed Timing Descriptors:
    DTD 1:  1920x1200   59.950 Hz   8:5    74.038 kHz 154.000 MHz (518 mm x 324 mm)
                 Hfront   48 Hsync  32 Hback  80 Hpol P
                 Vfront    3 Vsync   6 Vback  26 Vpol N
  Display Range Limits:
    Monitor ranges (GTF): 50-61 Hz V, 30-83 kHz H, max dotclock 170 MHz
    Display Product Name: 'PB248'
    Display Product Serial Number: ...
  Extension blocks: 1
Checksum: 0x19

----------------

Block 1, CTA-861 Extension Block:
  Revision: 3
  Underscans PC formats by default
  Basic audio support
  Supports YCbCr 4:4:4
  Supports YCbCr 4:2:2
  Native detailed modes: 1
  Video Data Block:
    VIC  16:  1920x1080   60.000 Hz  16:9    67.500 kHz 148.500 MHz (native)
    VIC   5:  1920x1080i  60.000 Hz  16:9    33.750 kHz  74.250 MHz
    VIC   4:  1280x720    60.000 Hz  16:9    45.000 kHz  74.250 MHz
    VIC   3:   720x480    59.940 Hz  16:9    31.469 kHz  27.000 MHz
    VIC   2:   720x480    59.940 Hz   4:3    31.469 kHz  27.000 MHz
    VIC   1:   640x480    59.940 Hz   4:3    31.469 kHz  25.175 MHz
    VIC  17:   720x576    50.000 Hz   4:3    31.250 kHz  27.000 MHz
    VIC  18:   720x576    50.000 Hz  16:9    31.250 kHz  27.000 MHz
    VIC  19:  1280x720    50.000 Hz  16:9    37.500 kHz  74.250 MHz
    VIC  20:  1920x1080i  50.000 Hz  16:9    28.125 kHz  74.250 MHz
    VIC  31:  1920x1080   50.000 Hz  16:9    56.250 kHz 148.500 MHz
  Audio Data Block:
    Linear PCM:
      Max channels: 2
      Supported sample rates (kHz): 48 44.1 32
      Supported sample sizes (bits): 24 20 16
  Speaker Allocation Data Block:
    FL/FR - Front Left/Right
  Vendor-Specific Data Block (HDMI), OUI 00-0C-03:
    Source physical address: 1.0.0.0
  Detailed Timing Descriptors:
    DTD 2:  1920x1080   59.988 Hz  16:9    66.587 kHz 138.500 MHz (518 mm x 324 mm)
                 Hfront   48 Hsync  32 Hback  80 Hpol P
                 Vfront    3 Vsync   5 Vback  22 Vpol N
    DTD 3:  1366x768    59.790 Hz 683:384  47.712 kHz  85.500 MHz (518 mm x 324 mm)
                 Hfront   70 Hsync 143 Hback 213 Hpol P
                 Vfront    3 Vsync   3 Vback  24 Vpol P
    DTD 4:  1280x720    60.000 Hz  16:9    45.000 kHz  74.250 MHz (518 mm x 324 mm)
                 Hfront  110 Hsync  40 Hback 220 Hpol P
                 Vfront    5 Vsync   5 Vback  20 Vpol P
    DTD 5:   720x480    59.940 Hz   3:2    31.469 kHz  27.000 MHz (518 mm x 324 mm)
                 Hfront   16 Hsync  62 Hback  60 Hpol N
                 Vfront    9 Vsync   6 Vback  30 Vpol N
    DTD 6:  1920x1080i  60.000 Hz  16:9    33.750 kHz  74.250 MHz (518 mm x 324 mm)
                 Hfront   88 Hsync  44 Hback 148 Hpol P
                 Vfront    2 Vsync   5 Vback  15 Vpol P Vfront +0.5 Odd Field
                 Vfront    2 Vsync   5 Vback  15 Vpol P Vback  +0.5 Even Field
Checksum: 0xfe
