
EDID (hex):
00ffffffffffff000469a32401010101
2518010380342078ea4ca5a7554da226
105054230800818081409500a940b300
d1c001010101283c80a070b023403020
360006442100001a000000fd00323d1e
5311000a202020202020000000fc0050
423234380a20202020202020000000ff
0045394c4d51533033343439300a0115
02031ef14b900504030201111213141f
230907078301000065030c0010001a36
80a070381e403020350006442100001a
662156aa51001e30468f330006442100
001e011d007251d01e206e2855000644
2100001e8c0ad08a20e02d10103e9600
064421000018011d8018711c1620582c
250006442100009e00000000000000fe

Extracted contents:
header:          00 ff ff ff ff ff ff 00
serial number:   04 69 a3 24 01 01 01 01 25 18
version:         01 03
basic params:    80 34 20 78 ea
chroma info:     4c a5 a7 55 4d a2 26 10 50 54
established:     23 08 00
standard:        81 80 81 40 95 00 a9 40 b3 00 d1 c0 01 01 01 01
descriptor 1:    28 3c 80 a0 70 b0 23 40 30 20 36 00 06 44 21 00 00 1a
descriptor 2:    00 00 00 fd 00 32 3d 1e 53 11 00 0a 20 20 20 20 20 20
descriptor 3:    00 00 00 fc 00 50 42 32 34 38 0a 20 20 20 20 20 20 20
descriptor 4:    00 00 00 ff 00 45 39 4c 4d 51 53 30 33 34 34 39 30 0a
extensions:      01
checksum:        15

EDID version: 1.3
Manufacturer: ACI Model 24a3 Serial Number --
Made in week 37 of 2014
Digital display
Maximum image size: 52 cm x 32 cm
Gamma: 2.20
DPMS levels: Standby Suspend Off
RGB color display
First detailed timing is preferred timing
Display x,y Chromaticity:
  Red:   0.6533, 0.3320
  Green: 0.3037, 0.6328
  Blue:  0.1503, 0.0644
  White: 0.3134, 0.3291
Established timings supported:
  640x480@60Hz 4:3 HorFreq: 31469 Hz Clock: 25.175 MHz
  800x600@56Hz 4:3 HorFreq: 35200 Hz Clock: 36.000 MHz
  800x600@60Hz 4:3 HorFreq: 37900 Hz Clock: 40.000 MHz
  1024x768@60Hz 4:3 HorFreq: 48400 Hz Clock: 65.000 MHz
Standard timings supported:
  1280x1024@60Hz 5:4 HorFreq: 64000 Hz Clock: 108.000 MHz
  1280x960@60Hz 4:3 HorFreq: 60000 Hz Clock: 108.000 MHz
  1440x900@60Hz 16:10 HorFreq: 55500 Hz Clock: 88.750 MHz
  1600x1200@60Hz 4:3 HorFreq: 75000 Hz Clock: 162.000 MHz
  1680x1050@60Hz 16:10 HorFreq: 64700 Hz Clock: 119.000 MHz
  1920x1080@60Hz 16:9
Detailed mode: Clock 154.000 MHz, 518 mm x 324 mm
               1920 1968 2000 2080 hborder 0
               1200 1203 1209 1235 vborder 0
               +hsync -vsync 
               VertFreq: 59 Hz, HorFreq: 74038 Hz
Monitor ranges (GTF): 50-61Hz V, 30-83kHz H, max dotclock 170MHz
Monitor name: PB248
Serial number: --
Has 1 extension blocks
Checksum: 0x15 (valid)

CTA extension block
Extension version: 3
26 bytes of CTA data
  Video data block
    VIC  16 1920x1080@60Hz 16:9 (native) HorFreq: 67500 Hz Clock: 148.500 MHz
    VIC   5 1920x1080i@60Hz 16:9  HorFreq: 33750 Hz Clock: 74.250 MHz
    VIC   4 1280x720@60Hz 16:9  HorFreq: 45000 Hz Clock: 74.250 MHz
    VIC   3 720x480@60Hz 16:9  HorFreq: 31469 Hz Clock: 27.000 MHz
    VIC   2 720x480@60Hz 4:3  HorFreq: 31469 Hz Clock: 27.000 MHz
    VIC   1 640x480@60Hz 4:3  HorFreq: 31469 Hz Clock: 25.175 MHz
    VIC  17 720x576@50Hz 4:3  HorFreq: 31250 Hz Clock: 27.000 MHz
    VIC  18 720x576@50Hz 16:9  HorFreq: 31250 Hz Clock: 27.000 MHz
    VIC  19 1280x720@50Hz 16:9  HorFreq: 37500 Hz Clock: 74.250 MHz
    VIC  20 1920x1080i@50Hz 16:9  HorFreq: 28125 Hz Clock: 74.250 MHz
    VIC  31 1920x1080@50Hz 16:9  HorFreq: 56250 Hz Clock: 148.500 MHz
  Audio data block
    Linear PCM, max channels 2
      Supported sample rates (kHz): 48 44.1 32
      Supported sample sizes (bits): 24 20 16
  Speaker allocation data block
    Speaker map:
      FL/FR - Front Left/Right
  Vendor-specific data block, OUI 000c03 (HDMI)
    Source physical address 1.0.0.0
Underscans PC formats by default
Basic audio support
Supports YCbCr 4:4:4
Supports YCbCr 4:2:2
1 native detailed modes
Detailed mode: Clock 138.500 MHz, 518 mm x 324 mm
               1920 1968 2000 2080 hborder 0
               1080 1083 1088 1110 vborder 0
               +hsync -vsync 
               VertFreq: 59 Hz, HorFreq: 66586 Hz
Detailed mode: Clock 85.500 MHz, 518 mm x 324 mm
               1366 1436 1579 1792 hborder 0
                768  771  774  798 vborder 0
               +hsync +vsync 
               VertFreq: 59 Hz, HorFreq: 47712 Hz
Detailed mode: Clock 74.250 MHz, 518 mm x 324 mm
               1280 1390 1430 1650 hborder 0
                720  725  730  750 vborder 0
               +hsync +vsync 
               VertFreq: 60 Hz, HorFreq: 45000 Hz
Detailed mode: Clock 27.000 MHz, 518 mm x 324 mm
                720  736  798  858 hborder 0
                480  489  495  525 vborder 0
               -hsync -vsync 
               VertFreq: 59 Hz, HorFreq: 31468 Hz
Detailed mode: Clock 74.250 MHz, 518 mm x 324 mm
               1920 2008 2052 2200 hborder 0
                540  542  547  562 vborder 0
               +hsync +vsync interlaced 
               VertFreq: 60 Hz, HorFreq: 33750 Hz
Checksum: 0xfe (valid)

One or more of the timings is out of range of the Monitor Ranges:
  Vertical Freq: 50 - 60 Hz
  Horizontal Freq: 28125 - 75000 Hz
  Maximum Clock: 162.000 MHz
EDID block does not conform at all!
	Both the serial number and the serial string are set


