edid-decode (hex):

00 ff ff ff ff ff ff 00 32 0c 01 2d 00 00 00 00
00 12 01 03 90 21 15 78 0a ba 70 98 59 52 8c 28
25 50 54 00 00 00 01 01 01 01 01 01 01 01 01 01
01 01 01 01 01 01 6a 40 80 f4 70 b0 46 40 64 2c
a4 00 4b cf 10 00 00 19 00 00 00 00 00 00 00 00
00 00 00 00 00 00 00 00 00 00 00 00 00 fe 00 59
50 30 32 34 14 31 35 34 57 55 31 0a 00 00 00 00
00 28 3e 4c 53 73 9b ba ff 02 01 0a 20 20 00 1c

----------------

Block 0, Base EDID:
  EDID Structure Version & Revision: 1.3
  Vendor & Product Identification:
    Manufacturer: LPL
    Model: 11521
    Made in: 2008
  Basic Display Parameters & Features:
    Digital display
    Maximum image size: 33 cm x 21 cm
    Gamma: 2.20
    RGB color display
    First detailed timing is preferred timing
  Color Characteristics:
    Red  : 0.5957, 0.3505
    Green: 0.3222, 0.5488
    Blue : 0.1572, 0.1474
    White: 0.3125, 0.3281
  Established Timings I & II: none
  Standard Timings: none
  Detailed Timing Descriptors:
    DTD 1:  1920x1200   60.001 Hz   8:5    76.201 kHz 164.900 MHz (331 mm x 207 mm)
                 Hfront  100 Hsync  44 Hback 100 Hpol N
                 Vfront   10 Vsync   4 Vback  56 Vpol N
    Empty Descriptor
    Alphanumeric Data String: 'YP024'
    Manufacturer-Specified Display Descriptor (0x00): 00 00 00 28 3e 4c 53 73 9b ba ff 02 01 0a 20 20 '...(>LSs......  '
Checksum: 0x1c
