
EDID (hex):
00ffffffffffff004ca3513100000000
00120103802213780abba59f5b4d9625
19505400000001010101010101010101
010101010101121b567250000c303020
250058c2100000190000000f00000000
00000000001eb4027400000000fe0053
414d53554e470a2020202020000000fe
00313536415430312d4c30310a20002f

Extracted contents:
header:          00 ff ff ff ff ff ff 00
serial number:   4c a3 51 31 00 00 00 00 00 12
version:         01 03
basic params:    80 22 13 78 0a
chroma info:     bb a5 9f 5b 4d 96 25 19 50 54
established:     00 00 00
standard:        01 01 01 01 01 01 01 01 01 01 01 01 01 01 01 01
descriptor 1:    12 1b 56 72 50 00 0c 30 30 20 25 00 58 c2 10 00 00 19
descriptor 2:    00 00 00 0f 00 00 00 00 00 00 00 00 00 1e b4 02 74 00
descriptor 3:    00 00 00 fe 00 53 41 4d 53 55 4e 47 0a 20 20 20 20 20
descriptor 4:    00 00 00 fe 00 31 35 36 41 54 30 31 2d 4c 30 31 0a 20
extensions:      00
checksum:        2f

EDID version: 1.3
Manufacturer: SEC Model 3151 Serial Number --
Made in year 2008
Digital display
Maximum image size: 34 cm x 19 cm
Gamma: 2.20
RGB color display
First detailed timing is preferred timing
Display x,y Chromaticity:
  Red:   0.6230, 0.3583
  Green: 0.3027, 0.5888
  Blue:  0.1464, 0.0996
  White: 0.3134, 0.3291
Established timings supported:
Standard timings supported:
Detailed mode: Clock 69.300 MHz, 344 mm x 194 mm
               1366 1414 1446 1480 hborder 0
                768  770  775  780 vborder 0
               -hsync -vsync 
               VertFreq: 60 Hz, HorFreq: 46824 Hz
Manufacturer-specified data, tag 15
ASCII string: SAMSUNG
ASCII string: 156AT01-L01
Checksum: 0x2f (valid)
EDID block does NOT conform to EDID 1.3!
	Missing name descriptor
	Missing monitor ranges
