edid-decode (hex):

00 ff ff ff ff ff ff 00 30 e4 c7 02 00 00 00 00
00 14 01 03 80 1d 11 78 0a fa e5 93 58 56 8f 28
20 50 54 00 00 00 01 01 01 01 01 01 01 01 01 01
01 01 01 01 01 01 12 1b 56 68 50 00 12 30 20 20
35 00 25 a5 10 00 00 19 0e 12 56 68 50 00 12 30
20 20 35 00 25 a5 10 00 00 19 00 00 00 fe 00 4c
47 20 44 69 73 70 6c 61 79 0a 20 20 00 00 00 fe
00 4c 50 31 33 33 57 48 32 2d 54 4c 4c 34 00 59

----------------

Block 0, Base EDID:
  EDID Structure Version & Revision: 1.3
  Vendor & Product Identification:
    Manufacturer: LGD
    Model: 711
    Made in: 2010
  Basic Display Parameters & Features:
    Digital display
    Maximum image size: 29 cm x 17 cm
    Gamma: 2.20
    RGB color display
    First detailed timing is the preferred timing
  Color Characteristics:
    Red  : 0.5771, 0.3466
    Green: 0.3378, 0.5605
    Blue : 0.1591, 0.1269
    White: 0.3134, 0.3291
  Established Timings I & II: none
  Standard Timings: none
  Detailed Timing Descriptors:
    DTD 1:  1366x768    59.978190 Hz 683:384   47.143 kHz     69.300000 MHz (293 mm x 165 mm)
                 Hfront   32 Hsync  32 Hback   40 Hpol N
                 Vfront    3 Vsync   5 Vback   10 Vpol N
    DTD 2:  1366x768    40.002770 Hz 683:384   31.442 kHz     46.220000 MHz (293 mm x 165 mm)
                 Hfront   32 Hsync  32 Hback   40 Hpol N
                 Vfront    3 Vsync   5 Vback   10 Vpol N
    Alphanumeric Data String: 'LG Display'
    Alphanumeric Data String: 'LP133WH2-TLL4'
Checksum: 0x59

----------------

Failures:

Block 0, Base EDID:
  Missing Display Product Name.
  Missing Display Range Limits Descriptor.

EDID conformity: FAIL
