
EDID (hex):
00ffffffffffff0038a3dc6700000000
27140104b53c2278e2d875ae4e30b526
0b5054bfef8081c0818090408bc09500
a9c0a940d1c0565e00a0a0a029503020
350055502100001a000000fd0032571f
5e18000a202020202020000000fc0050
41323731570a202020202020000000ff
00303931303131373055420a20200023

Extracted contents:
header:          00 ff ff ff ff ff ff 00
serial number:   38 a3 dc 67 00 00 00 00 27 14
version:         01 04
basic params:    b5 3c 22 78 e2
chroma info:     d8 75 ae 4e 30 b5 26 0b 50 54
established:     bf ef 80
standard:        81 c0 81 80 90 40 8b c0 95 00 a9 c0 a9 40 d1 c0
descriptor 1:    56 5e 00 a0 a0 a0 29 50 30 20 35 00 55 50 21 00 00 1a
descriptor 2:    00 00 00 fd 00 32 57 1f 5e 18 00 0a 20 20 20 20 20 20
descriptor 3:    00 00 00 fc 00 50 41 32 37 31 57 0a 20 20 20 20 20 20
descriptor 4:    00 00 00 ff 00 30 39 31 30 31 31 37 30 55 42 0a 20 20
extensions:      00
checksum:        23

EDID version: 1.4
Manufacturer: NEC Model 67dc Serial Number --
Made in week 39 of 2010
Digital display
10 bits per primary color channel
DisplayPort interface
Maximum image size: 60 cm x 34 cm
Gamma: 2.20
DPMS levels: Standby Suspend Off
Supported color formats: RGB 4:4:4
First detailed timing includes the native pixel format and preferred refresh rate
Display x,y Chromaticity:
  Red:   0.6826, 0.3056
  Green: 0.1894, 0.7070
  Blue:  0.1494, 0.0458
  White: 0.3134, 0.3291
Established timings supported:
  720x400@70Hz 9:5 HorFreq: 31469 Hz Clock: 28.320 MHz
  640x480@60Hz 4:3 HorFreq: 31469 Hz Clock: 25.175 MHz
  640x480@67Hz 4:3 HorFreq: 35000 Hz Clock: 30.240 MHz
  640x480@72Hz 4:3 HorFreq: 37900 Hz Clock: 31.500 MHz
  640x480@75Hz 4:3 HorFreq: 37500 Hz Clock: 31.500 MHz
  800x600@56Hz 4:3 HorFreq: 35200 Hz Clock: 36.000 MHz
  800x600@60Hz 4:3 HorFreq: 37900 Hz Clock: 40.000 MHz
  800x600@72Hz 4:3 HorFreq: 48100 Hz Clock: 50.000 MHz
  800x600@75Hz 4:3 HorFreq: 46900 Hz Clock: 49.500 MHz
  832x624@75Hz 4:3 HorFreq: 49726 Hz Clock: 57.284 MHz
  1024x768@60Hz 4:3 HorFreq: 48400 Hz Clock: 65.000 MHz
  1024x768@70Hz 4:3 HorFreq: 56500 Hz Clock: 75.000 MHz
  1024x768@75Hz 4:3 HorFreq: 60000 Hz Clock: 78.750 MHz
  1280x1024@75Hz 5:4 HorFreq: 80000 Hz Clock: 135.000 MHz
  1152x870@75Hz 192:145 HorFreq: 67500 Hz Clock: 108.000 MHz
Standard timings supported:
  1280x720@60Hz 16:9
  1280x1024@60Hz 5:4 HorFreq: 64000 Hz Clock: 108.000 MHz
  1400x1050@60Hz 4:3 HorFreq: 64700 Hz Clock: 101.000 MHz
  1360x765@60Hz 16:9
  1440x900@60Hz 16:10 HorFreq: 55500 Hz Clock: 88.750 MHz
  1600x900@60Hz 16:9
  1600x1200@60Hz 4:3 HorFreq: 75000 Hz Clock: 162.000 MHz
  1920x1080@60Hz 16:9
Detailed mode: Clock 241.500 MHz, 597 mm x 336 mm
               2560 2608 2640 2720 hborder 0
               1440 1443 1448 1481 vborder 0
               +hsync -vsync 
               VertFreq: 59 Hz, HorFreq: 88786 Hz
Monitor ranges (GTF): 50-87Hz V, 31-94kHz H, max dotclock 240MHz
Monitor name: PA271W
Serial number: --
Checksum: 0x23 (valid)
Warning: One or more of the timings is out of range of the Monitor Ranges:
  Vertical Freq: 56 - 75 Hz
  Horizontal Freq: 31469 - 88786 Hz
  Maximum Clock: 241.500 MHz


