edid-decode (hex):

00 ff ff ff ff ff ff 00 1e 6d 2b 77 87 18 01 00
0c 1e 01 04 b5 50 22 78 9e ca 95 a6 55 4e a1 26
0f 50 54 21 08 00 71 40 81 80 81 c0 a9 c0 b3 00
d1 c0 81 00 01 01 e7 7c 70 a0 d0 a0 29 50 30 20
3a 00 20 4f 31 00 00 1a 9d 67 70 a0 d0 a0 22 50
30 20 3a 00 20 4f 31 00 00 1a 00 00 00 fd 00 38
3d 1e 5a 20 00 0a 20 20 20 20 20 20 00 00 00 fc
00 4c 47 20 48 44 52 20 57 51 48 44 0a 20 01 a5

02 03 1c 71 23 09 06 07 47 01 03 04 10 12 13 1f
83 01 00 00 e3 05 c0 00 e3 06 05 01 9f 3d 70 a0
d0 a0 15 50 30 20 3a 00 20 4f 31 00 00 1a 7e 48
00 e0 a0 38 1f 40 40 40 3a 00 20 4f 31 00 00 18
00 00 00 00 00 00 00 00 00 00 00 00 00 00 00 00
00 00 00 00 00 00 00 00 00 00 00 00 00 00 00 00
00 00 00 00 00 00 00 00 00 00 00 00 00 00 00 00
00 00 00 00 00 00 00 00 00 00 00 00 00 00 00 23

00 ff ff ff ff ff ff 00 1e 6d 2b 77 87 18 01 00
0c 1e 01 04 b5 50 22 78 9e ca 95 a6 55 4e a1 26
0f 50 54 21 08 00 71 40 81 80 81 c0 a9 c0 b3 00
d1 c0 81 00 01 01 e7 7c 70 a0 d0 a0 29 50 30 20
3a 00 20 4f 31 00 00 1a 9d 67 70 a0 d0 a0 22 50
30 20 3a 00 20 4f 31 00 00 1a 00 00 00 fd 00 38
3d 1e 5a 20 00 0a 20 20 20 20 20 20 00 00 00 fc
00 4c 47 20 48 44 52 20 57 51 48 44 0a 20 01 a5

02 03 1c 71 23 09 06 07 47 01 03 04 10 12 13 1f
83 01 00 00 e3 05 c0 00 e3 06 05 01 9f 3d 70 a0
d0 a0 15 50 30 20 3a 00 20 4f 31 00 00 1a 7e 48
00 e0 a0 38 1f 40 40 40 3a 00 20 4f 31 00 00 18
00 00 00 00 00 00 00 00 00 00 00 00 00 00 00 00
00 00 00 00 00 00 00 00 00 00 00 00 00 00 00 00
00 00 00 00 00 00 00 00 00 00 00 00 00 00 00 00
00 00 00 00 00 00 00 00 00 00 00 00 00 00 00 23

----------------

Block 0, Base EDID:
  EDID Structure Version & Revision: 1.4
  Vendor & Product Identification:
    Manufacturer: GSM
    Model: 30507
    Serial Number: ...
    Made in: week 12 of 2020
  Basic Display Parameters & Features:
    Digital display
    Bits per primary color channel: 10
    DisplayPort interface
    Maximum image size: 80 cm x 34 cm
    Gamma: 2.20
    DPMS levels: Standby
    Supported color formats: RGB 4:4:4, YCrCb 4:4:4, YCrCb 4:2:2
    Default (sRGB) color space is primary color space
    First detailed timing includes the native pixel format and preferred refresh rate
  Color Characteristics:
    Red  : 0.6513, 0.3320
    Green: 0.3066, 0.6308
    Blue : 0.1503, 0.0595
    White: 0.3134, 0.3291
  Established Timings I & II:
    DMT 0x04:   640x480    59.940476 Hz   4:3     31.469 kHz     25.175000 MHz
    DMT 0x09:   800x600    60.316541 Hz   4:3     37.879 kHz     40.000000 MHz
    DMT 0x10:  1024x768    60.003840 Hz   4:3     48.363 kHz     65.000000 MHz
  Standard Timings:
    GTF     :  1152x864    60.000000 Hz   4:3     53.700 kHz     81.624000 MHz
    DMT 0x23:  1280x1024   60.019740 Hz   5:4     63.981 kHz    108.000000 MHz
    DMT 0x55:  1280x720    60.000000 Hz  16:9     45.000 kHz     74.250000 MHz
    DMT 0x53:  1600x900    60.000000 Hz  16:9     60.000 kHz    108.000000 MHz (RB)
    DMT 0x3a:  1680x1050   59.954250 Hz  16:10    65.290 kHz    146.250000 MHz
    DMT 0x52:  1920x1080   60.000000 Hz  16:9     67.500 kHz    148.500000 MHz
    DMT 0x1c:  1280x800    59.810326 Hz  16:10    49.702 kHz     83.500000 MHz
  Detailed Timing Descriptors:
    DTD 1:  3440x1440   59.972616 Hz  43:18    88.819 kHz    319.750000 MHz (800 mm x 335 mm)
                 Hfront   48 Hsync  32 Hback   80 Hpol P
                 Vfront    3 Vsync  10 Vback   28 Vpol N
    DTD 2:  3440x1440   49.986808 Hz  43:18    73.681 kHz    265.250000 MHz (800 mm x 335 mm)
                 Hfront   48 Hsync  32 Hback   80 Hpol P
                 Vfront    3 Vsync  10 Vback   21 Vpol N
    Display Range Limits:
      Monitor ranges (GTF): 56-61 Hz V, 30-90 kHz H, max dotclock 320 MHz
    Display Product Name: 'LG HDR WQHD'
  Extension blocks: 1
Checksum: 0xa5

----------------

Block 1, CTA-861 Extension Block:
  Revision: 3
  Basic audio support
  Supports YCbCr 4:4:4
  Supports YCbCr 4:2:2
  Native detailed modes: 1
  Audio Data Block:
    Linear PCM:
      Max channels: 2
      Supported sample rates (kHz): 48 44.1
      Supported sample sizes (bits): 24 20 16
  Video Data Block:
    VIC   1:   640x480    59.940476 Hz   4:3     31.469 kHz     25.175000 MHz
    VIC   3:   720x480    59.940060 Hz  16:9     31.469 kHz     27.000000 MHz
    VIC   4:  1280x720    60.000000 Hz  16:9     45.000 kHz     74.250000 MHz
    VIC  16:  1920x1080   60.000000 Hz  16:9     67.500 kHz    148.500000 MHz
    VIC  18:   720x576    50.000000 Hz  16:9     31.250 kHz     27.000000 MHz
    VIC  19:  1280x720    50.000000 Hz  16:9     37.500 kHz     74.250000 MHz
    VIC  31:  1920x1080   50.000000 Hz  16:9     56.250 kHz    148.500000 MHz
  Speaker Allocation Data Block:
    FL/FR - Front Left/Right
  Colorimetry Data Block:
    BT2020YCC
    BT2020RGB
  HDR Static Metadata Data Block:
    Electro optical transfer functions:
      Traditional gamma - SDR luminance range
      SMPTE ST2084
    Supported static metadata descriptors:
      Static metadata type 1
  Detailed Timing Descriptors:
    DTD 3:  3440x1440   29.992775 Hz  43:18    43.819 kHz    157.750000 MHz (800 mm x 335 mm)
                 Hfront   48 Hsync  32 Hback   80 Hpol P
                 Vfront    3 Vsync  10 Vback    8 Vpol N
    DTD 4:  2560x1080   59.999534 Hz  64:27    66.659 kHz    185.580000 MHz (800 mm x 335 mm)
                 Hfront   64 Hsync  64 Hback   96 Hpol N
                 Vfront    3 Vsync  10 Vback   18 Vpol N
Checksum: 0x23  Unused space in Extension Block: 63 bytes

----------------

Block 2, Unknown EDID Extension Block 0x00:
  00 ff ff ff ff ff ff 00 1e 6d 2b 77 87 18 01 00 '.........m+w....'
  0c 1e 01 04 b5 50 22 78 9e ca 95 a6 55 4e a1 26 '.....P"x....UN.&'
  0f 50 54 21 08 00 71 40 81 80 81 c0 a9 c0 b3 00 '.PT!..q@........'
  d1 c0 81 00 01 01 e7 7c 70 a0 d0 a0 29 50 30 20 '.......|p...)P0 '
  3a 00 20 4f 31 00 00 1a 9d 67 70 a0 d0 a0 22 50 ':. O1....gp..."P'
  30 20 3a 00 20 4f 31 00 00 1a 00 00 00 fd 00 38 '0 :. O1........8'
  3d 1e 5a 20 00 0a 20 20 20 20 20 20 00 00 00 fc '=.Z ..      ....'
  00 4c 47 20 48 44 52 20 57 51 48 44 0a 20 01 a5 '.LG HDR WQHD. ..'
Checksum: 0xa5

----------------

Block 3, CTA-861 Extension Block:
  Revision: 3
  Basic audio support
  Supports YCbCr 4:4:4
  Supports YCbCr 4:2:2
  Native detailed modes: 1
  Audio Data Block:
    Linear PCM:
      Max channels: 2
      Supported sample rates (kHz): 48 44.1
      Supported sample sizes (bits): 24 20 16
  Video Data Block:
    VIC   1:   640x480    59.940476 Hz   4:3     31.469 kHz     25.175000 MHz
    VIC   3:   720x480    59.940060 Hz  16:9     31.469 kHz     27.000000 MHz
    VIC   4:  1280x720    60.000000 Hz  16:9     45.000 kHz     74.250000 MHz
    VIC  16:  1920x1080   60.000000 Hz  16:9     67.500 kHz    148.500000 MHz
    VIC  18:   720x576    50.000000 Hz  16:9     31.250 kHz     27.000000 MHz
    VIC  19:  1280x720    50.000000 Hz  16:9     37.500 kHz     74.250000 MHz
    VIC  31:  1920x1080   50.000000 Hz  16:9     56.250 kHz    148.500000 MHz
  Speaker Allocation Data Block:
    FL/FR - Front Left/Right
  Colorimetry Data Block:
    BT2020YCC
    BT2020RGB
  HDR Static Metadata Data Block:
    Electro optical transfer functions:
      Traditional gamma - SDR luminance range
      SMPTE ST2084
    Supported static metadata descriptors:
      Static metadata type 1
  Detailed Timing Descriptors:
    DTD 5:  3440x1440   29.992775 Hz  43:18    43.819 kHz    157.750000 MHz (800 mm x 335 mm)
                 Hfront   48 Hsync  32 Hback   80 Hpol P
                 Vfront    3 Vsync  10 Vback    8 Vpol N
    DTD 6:  2560x1080   59.999534 Hz  64:27    66.659 kHz    185.580000 MHz (800 mm x 335 mm)
                 Hfront   64 Hsync  64 Hback   96 Hpol N
                 Vfront    3 Vsync  10 Vback   18 Vpol N
Checksum: 0x23  Unused space in Extension Block: 63 bytes

----------------

Warnings:

Block 0, Base EDID:
  Display Range Limits: GTF support is deprecated in EDID 1.4.
Block 1, CTA-861 Extension Block:
  IT Video Formats are overscanned by default, but normally this should be underscanned.
Block 3, CTA-861 Extension Block:
  IT Video Formats are overscanned by default, but normally this should be underscanned.
EDID:
  Base EDID: Some timings are out of range of the Monitor Ranges:
    Vertical Freq: 29.993 - 60.317 Hz (Monitor: 56.000 - 61.000 Hz)

Failures:

Block 0, Base EDID:
  Basic Display Parameters & Features: sRGB is signaled, but the chromaticities do not match.
  Display Range Limits: GTF can't be combined with non-continuous frequencies.
Block 1, CTA-861 Extension Block:
  Missing VCDB, needed for Set Selectable RGB Quantization to avoid interop issues.
Block 2, Base EDID:
  Unknown Extension Block.
Block 3, CTA-861 Extension Block:
  Video Data Block: Duplicate VIC 1.
  Video Data Block: Duplicate VIC 3.
  Video Data Block: Duplicate VIC 4.
  Video Data Block: Duplicate VIC 16.
  Video Data Block: Duplicate VIC 18.
  Video Data Block: Duplicate VIC 19.
  Video Data Block: Duplicate VIC 31.
  Speaker Allocation Data Block: Only one instance of this Data Block is allowed.
  Colorimetry Data Block: Only one instance of this Data Block is allowed.
  HDR Static Metadata Data Block: Only one instance of this Data Block is allowed.
  Missing VCDB, needed for Set Selectable RGB Quantization to avoid interop issues.
EDID:
  Base EDID: EDID specified 1 extension block(s), but found 3 extension block(s).

EDID conformity: FAIL
