
EDID (hex):
00ffffffffffff001e6d2b778cc50200
081f0104b55022789eca95a6554ea126
0f50542108007140818081c0a9c0b300
d1c081000101e77c70a0d0a029503020
3a00204f3100001a9d6770a0d0a02250
30203a00204f3100001a000000fd0038
4b1e732b010a202020202020000000fc
004c472048445220575148440a2001c2
02031f7123090607470103041012131f
83010000e305c000e60605015252569f
3d70a0d0a0155030203a00204f310000
1a7e4800e0a0381f4040403a00204f31
00001800000000000000000000000000
00000000000000000000000000000000
00000000000000000000000000000000
00000000000000000000000000000023

Extracted contents:
header:          00 ff ff ff ff ff ff 00
serial number:   1e 6d 2b 77 8c c5 02 00 08 1f
version:         01 04
basic params:    b5 50 22 78 9e
chroma info:     ca 95 a6 55 4e a1 26 0f 50 54
established:     21 08 00
standard:        71 40 81 80 81 c0 a9 c0 b3 00 d1 c0 81 00 01 01
descriptor 1:    e7 7c 70 a0 d0 a0 29 50 30 20 3a 00 20 4f 31 00 00 1a
descriptor 2:    9d 67 70 a0 d0 a0 22 50 30 20 3a 00 20 4f 31 00 00 1a
descriptor 3:    00 00 00 fd 00 38 4b 1e 73 2b 01 0a 20 20 20 20 20 20
descriptor 4:    00 00 00 fc 00 4c 47 20 48 44 52 20 57 51 48 44 0a 20
extensions:      01
checksum:        c2

EDID version: 1.4
Manufacturer: GSM Model 772b Serial Number --
Made in week 8 of 2021
Digital display
10 bits per primary color channel
DisplayPort interface
Maximum image size: 80 cm x 34 cm
Gamma: 2.20
DPMS levels: Standby
Supported color formats: RGB 4:4:4, YCrCb 4:4:4, YCrCb 4:2:2
Default (sRGB) color space is primary color space
First detailed timing includes the native pixel format and preferred refresh rate
Display x,y Chromaticity:
  Red:   0.6513, 0.3320
  Green: 0.3066, 0.6308
  Blue:  0.1503, 0.0595
  White: 0.3134, 0.3291
Established timings supported:
  640x480@60Hz 4:3 HorFreq: 31469 Hz Clock: 25.175 MHz
  800x600@60Hz 4:3 HorFreq: 37900 Hz Clock: 40.000 MHz
  1024x768@60Hz 4:3 HorFreq: 48400 Hz Clock: 65.000 MHz
Standard timings supported:
  1152x864@60Hz 4:3
  1280x1024@60Hz 5:4 HorFreq: 64000 Hz Clock: 108.000 MHz
  1280x720@60Hz 16:9
  1600x900@60Hz 16:9
  1680x1050@60Hz 16:10 HorFreq: 64700 Hz Clock: 119.000 MHz
  1920x1080@60Hz 16:9
  1280x800@60Hz 16:10
Detailed mode: Clock 319.750 MHz, 800 mm x 335 mm
               3440 3488 3520 3600 hborder 0
               1440 1443 1453 1481 vborder 0
               +hsync -vsync 
               VertFreq: 59 Hz, HorFreq: 88819 Hz
Detailed mode: Clock 265.250 MHz, 800 mm x 335 mm
               3440 3488 3520 3600 hborder 0
               1440 1443 1453 1474 vborder 0
               +hsync -vsync 
               VertFreq: 49 Hz, HorFreq: 73680 Hz
Monitor ranges (bare limits): 56-75Hz V, 30-115kHz H, max dotclock 430MHz
Monitor name: LG HDR WQHD
Has 1 extension blocks
Checksum: 0xc2 (valid)

CTA extension block
Extension version: 3
27 bytes of CTA data
  Audio data block
    Linear PCM, max channels 2
      Supported sample rates (kHz): 48 44.1
      Supported sample sizes (bits): 24 20 16
  Video data block
    VIC   1 640x480@60Hz 4:3  HorFreq: 31469 Hz Clock: 25.175 MHz
    VIC   3 720x480@60Hz 16:9  HorFreq: 31469 Hz Clock: 27.000 MHz
    VIC   4 1280x720@60Hz 16:9  HorFreq: 45000 Hz Clock: 74.250 MHz
    VIC  16 1920x1080@60Hz 16:9  HorFreq: 67500 Hz Clock: 148.500 MHz
    VIC  18 720x576@50Hz 16:9  HorFreq: 31250 Hz Clock: 27.000 MHz
    VIC  19 1280x720@50Hz 16:9  HorFreq: 37500 Hz Clock: 74.250 MHz
    VIC  31 1920x1080@50Hz 16:9  HorFreq: 56250 Hz Clock: 148.500 MHz
  Speaker allocation data block
    Speaker map:
      FL/FR - Front Left/Right
  Extended tag: Colorimetry data block
    BT2020YCC
    BT2020RGB
  Extended tag: HDR static metadata data block
    Electro optical transfer functions:
      Traditional gamma - SDR luminance range
      SMPTE ST2084
    Supported static metadata descriptors:
      Static metadata type 1
    Desired content max luminance: 82 (295.365 cd/m^2)
    Desired content max frame-average luminance: 82 (295.365 cd/m^2)
    Desired content min luminance: 86 (0.336 cd/m^2)
Basic audio support
Supports YCbCr 4:4:4
Supports YCbCr 4:2:2
1 native detailed modes
Detailed mode: Clock 157.750 MHz, 800 mm x 335 mm
               3440 3488 3520 3600 hborder 0
               1440 1443 1453 1461 vborder 0
               +hsync -vsync 
               VertFreq: 29 Hz, HorFreq: 43819 Hz
Detailed mode: Clock 185.580 MHz, 800 mm x 335 mm
               2560 2624 2688 2784 hborder 0
               1080 1083 1093 1111 vborder 0
               -hsync -vsync 
               VertFreq: 59 Hz, HorFreq: 66659 Hz
Checksum: 0x23 (valid)

EDID block does NOT conform to EDID 1.4!
	sRGB is signaled, but the chromaticities do not match
Warning: One or more of the timings is out of range of the Monitor Ranges:
  Vertical Freq: 29 - 60 Hz
  Horizontal Freq: 31250 - 88819 Hz
  Maximum Clock: 319.750 MHz


