
EDID (hex):
00ffffffffffff004162b90097455191
0f130103682917782a3d81a6564a9a24
125054bfee0081c08100010101010101
010101010101662156aa51001e30468f
33009ae61000001e000000fd00374b1e
3c09000a202020202020000000ff0044
31303038303035343231310a000000fc
00566973656f2031393020570a200031

Extracted contents:
header:          00 ff ff ff ff ff ff 00
serial number:   41 62 b9 00 97 45 51 91 0f 13
version:         01 03
basic params:    68 29 17 78 2a
chroma info:     3d 81 a6 56 4a 9a 24 12 50 54
established:     bf ee 00
standard:        81 c0 81 00 01 01 01 01 01 01 01 01 01 01 01 01
descriptor 1:    66 21 56 aa 51 00 1e 30 46 8f 33 00 9a e6 10 00 00 1e
descriptor 2:    00 00 00 fd 00 37 4b 1e 3c 09 00 0a 20 20 20 20 20 20
descriptor 3:    00 00 00 ff 00 44 31 30 30 38 30 30 35 34 32 31 31 0a
descriptor 4:    00 00 00 fc 00 56 69 73 65 6f 20 31 39 30 20 57 0a 20
extensions:      00
checksum:        31

EDID version: 1.3
Manufacturer: PKB Model b9 Serial Number --
Made in week 15 of 2009
Analog display, Input voltage level: 0.7/0.7 V
Sync: Separate 
Maximum image size: 41 cm x 23 cm
Gamma: 2.20
DPMS levels: Off
RGB color display
First detailed timing is preferred timing
Display x,y Chromaticity:
  Red:   0.6484, 0.3388
  Green: 0.2919, 0.6025
  Blue:  0.1425, 0.0703
  White: 0.3125, 0.3291
Established timings supported:
  720x400@70Hz 9:5 HorFreq: 31469 Hz Clock: 28.320 MHz
  640x480@60Hz 4:3 HorFreq: 31469 Hz Clock: 25.175 MHz
  640x480@67Hz 4:3 HorFreq: 35000 Hz Clock: 30.240 MHz
  640x480@72Hz 4:3 HorFreq: 37900 Hz Clock: 31.500 MHz
  640x480@75Hz 4:3 HorFreq: 37500 Hz Clock: 31.500 MHz
  800x600@56Hz 4:3 HorFreq: 35200 Hz Clock: 36.000 MHz
  800x600@60Hz 4:3 HorFreq: 37900 Hz Clock: 40.000 MHz
  800x600@72Hz 4:3 HorFreq: 48100 Hz Clock: 50.000 MHz
  800x600@75Hz 4:3 HorFreq: 46900 Hz Clock: 49.500 MHz
  832x624@75Hz 4:3 HorFreq: 49726 Hz Clock: 57.284 MHz
  1024x768@60Hz 4:3 HorFreq: 48400 Hz Clock: 65.000 MHz
  1024x768@70Hz 4:3 HorFreq: 56500 Hz Clock: 75.000 MHz
  1024x768@75Hz 4:3 HorFreq: 60000 Hz Clock: 78.750 MHz
Standard timings supported:
  1280x720@60Hz 16:9
  1280x800@60Hz 16:10
Detailed mode: Clock 85.500 MHz, 410 mm x 230 mm
               1366 1436 1579 1792 hborder 0
                768  771  774  798 vborder 0
               +hsync +vsync 
               VertFreq: 59 Hz, HorFreq: 47712 Hz
Monitor ranges (GTF): 55-75Hz V, 30-60kHz H, max dotclock 90MHz
Serial number: --
Monitor name: Viseo 190 W
Checksum: 0x31 (valid)
