
EDID (hex):
00ffffffffffff0004897d21d4430000
0c0e010380211b7828c5c6a3574a9c23
124f5421080031404540614081800101
010101010101302a009851002a403070
13004a0e1100001ea00f200031581c20
288014004a0e1100001e000000fd0038
4b1f50ff000a202020202020000000fc
00414449204d5320413731350a200016

Extracted contents:
header:          00 ff ff ff ff ff ff 00
serial number:   04 89 7d 21 d4 43 00 00 0c 0e
version:         01 03
basic params:    80 21 1b 78 28
chroma info:     c5 c6 a3 57 4a 9c 23 12 4f 54
established:     21 08 00
standard:        31 40 45 40 61 40 81 80 01 01 01 01 01 01 01 01
descriptor 1:    30 2a 00 98 51 00 2a 40 30 70 13 00 4a 0e 11 00 00 1e
descriptor 2:    a0 0f 20 00 31 58 1c 20 28 80 14 00 4a 0e 11 00 00 1e
descriptor 3:    00 00 00 fd 00 38 4b 1f 50 ff 00 0a 20 20 20 20 20 20
descriptor 4:    00 00 00 fc 00 41 44 49 20 4d 53 20 41 37 31 35 0a 20
extensions:      00
checksum:        16

EDID version: 1.3
Manufacturer: ADI Model 217d Serial Number --
Digital display
Maximum image size: 33 cm x 27 cm
Gamma: 2.20
DPMS levels: Off
RGB color display
Display x,y Chromaticity:
  Red:   0.6396, 0.3398
  Green: 0.2900, 0.6103
  Blue:  0.1396, 0.0703
  White: 0.3095, 0.3300
Established timings supported:
  640x480@60Hz 4:3 HorFreq: 31469 Hz Clock: 25.175 MHz
  800x600@60Hz 4:3 HorFreq: 37900 Hz Clock: 40.000 MHz
  1024x768@60Hz 4:3 HorFreq: 48400 Hz Clock: 65.000 MHz
Standard timings supported:
  640x480@60Hz 4:3 HorFreq: 31469 Hz Clock: 25.175 MHz
  800x600@60Hz 4:3 HorFreq: 37900 Hz Clock: 40.000 MHz
  1024x768@60Hz 4:3 HorFreq: 48400 Hz Clock: 65.000 MHz
  1280x1024@60Hz 5:4 HorFreq: 64000 Hz Clock: 108.000 MHz
Detailed mode: Clock 108.000 MHz, 330 mm x 270 mm
               1280 1328 1440 1688 hborder 0
               1024 1025 1028 1066 vborder 0
               +hsync +vsync 
               VertFreq: 60 Hz, HorFreq: 63981 Hz
Detailed mode: Clock 40.000 MHz, 330 mm x 270 mm
                800  840  968 1056 hborder 0
                600  601  605  628 vborder 0
               +hsync +vsync 
               VertFreq: 60 Hz, HorFreq: 37878 Hz
Monitor ranges (GTF): 56-75Hz V, 31-80kHz H, max dotclock 2550MHz
Monitor name: ADI MS A715
Checksum: 0x16 (valid)
EDID block does NOT conform to EDID 1.3!
	Missing preferred timing
EDID block does not conform at all!
	Bad year of manufacture
