edid-decode (hex):

00 ff ff ff ff ff ff 00 30 ae 31 40 00 00 00 00
01 10 01 03 80 1e 13 78 ea 87 c5 94 57 4f 8c 27
25 50 54 00 00 00 01 01 01 01 01 01 01 01 01 01
01 01 01 01 01 01 0d 1b 00 7c 50 20 16 30 30 20
36 00 30 be 10 00 00 18 8b 16 00 7c 50 20 16 30
30 20 36 00 30 be 10 00 00 18 00 00 00 0f 00 81
0a 32 81 0a 28 12 01 00 06 af 44 24 00 00 00 fe
00 42 31 34 31 45 57 30 32 20 56 34 20 0a 00 c1

----------------

Block 0, Base EDID:
  EDID Structure Version & Revision: 1.3
  Vendor & Product Identification:
    Manufacturer: LEN
    Model: 16433
    Made in: week 1 of 2006
  Basic Display Parameters & Features:
    Digital display
    Maximum image size: 30 cm x 19 cm
    Gamma: 2.20
    DPMS levels: Standby Suspend Off
    RGB color display
    First detailed timing is the preferred timing
  Color Characteristics:
    Red  : 0.5800, 0.3398
    Green: 0.3095, 0.5498
    Blue : 0.1552, 0.1445
    White: 0.3134, 0.3291
  Established Timings I & II: none
  Standard Timings: none
  Detailed Timing Descriptors:
    DTD 1:  1280x800    60.004090 Hz  16:10    49.323 kHz     69.250000 MHz (304 mm x 190 mm)
                 Hfront   48 Hsync  32 Hback   44 Hpol N
                 Vfront    3 Vsync   6 Vback   13 Vpol N
    DTD 2:  1280x800    50.004852 Hz  16:10    41.104 kHz     57.710000 MHz (304 mm x 190 mm)
                 Hfront   48 Hsync  32 Hback   44 Hpol N
                 Vfront    3 Vsync   6 Vback   13 Vpol N
    Manufacturer-Specified Display Descriptor (0x0f): 00 0f 00 81 0a 32 81 0a 28 12 01 00 06 af 44 24 '.....2..(.....D$'
    Alphanumeric Data String: 'B141EW02 V4 '
Checksum: 0xc1

----------------

Failures:

Block 0, Base EDID:
  Alphanumeric Data String: One or more trailing spaces.
  Missing Display Product Name.
  Missing Display Range Limits Descriptor.

EDID conformity: FAIL
