edid-decode (hex):

00 ff ff ff ff ff ff 00 30 ae 31 40 00 00 00 00
00 11 01 03 80 1e 13 78 ea b3 85 95 58 53 8a 28
25 50 54 00 00 00 01 01 01 01 01 01 01 01 01 01
01 01 01 01 01 01 8b 1b 00 88 50 20 1e 30 20 20
68 00 30 be 10 00 00 18 f4 16 00 88 50 20 1e 30
20 20 68 00 30 be 10 00 00 18 00 00 00 0f 00 81
0a 32 81 0a 28 14 01 00 32 0c 29 01 00 00 00 fe
00 4c 50 31 34 31 57 58 33 2d 54 4c 4e 31 00 7a

----------------

Block 0, Base EDID:
  EDID Structure Version & Revision: 1.3
  Vendor & Product Identification:
    Manufacturer: LEN
    Model: 16433
    Made in: 2007
  Basic Display Parameters & Features:
    Digital display
    Maximum image size: 30 cm x 19 cm
    Gamma: 2.20
    DPMS levels: Standby Suspend Off
    RGB color display
    First detailed timing is preferred timing
  Color Characteristics:
    Red  : 0.5839, 0.3466
    Green: 0.3242, 0.5419
    Blue : 0.1582, 0.1445
    White: 0.3134, 0.3291
  Established Timings I & II: none
  Standard Timings: none
  Detailed Timing Descriptors:
    DTD 1:  1280x800    59.994 Hz   8:5    49.795 kHz  70.510 MHz (304 mm x 190 mm)
                 Hfront   32 Hsync  32 Hback  72 Hpol N
                 Vfront    6 Vsync   8 Vback  16 Vpol N
    DTD 2:  1280x800    49.997 Hz   8:5    41.497 kHz  58.760 MHz (304 mm x 190 mm)
                 Hfront   32 Hsync  32 Hback  72 Hpol N
                 Vfront    6 Vsync   8 Vback  16 Vpol N
    Manufacturer-Specified Display Descriptor (0x0f): 00 0f 00 81 0a 32 81 0a 28 14 01 00 32 0c 29 01 '.....2..(...2.).'
    Alphanumeric Data String: 'LP141WX3-TLN1'
Checksum: 0x7a
