
EDID (hex):
00ffffffffffff0030ae314000000000
00110103801e1378eacd7591554f8b26
21505400000001010101010101010101
010101010101261b0088502012303440
33002fbe100000198b16006850202230
344033002fbe100000190000000f0081
0a32810a281201004ca35731000000fe
004c544e31343157312d4c30350a00d7

Extracted contents:
header:          00 ff ff ff ff ff ff 00
serial number:   30 ae 31 40 00 00 00 00 00 11
version:         01 03
basic params:    80 1e 13 78 ea
chroma info:     cd 75 91 55 4f 8b 26 21 50 54
established:     00 00 00
standard:        01 01 01 01 01 01 01 01 01 01 01 01 01 01 01 01
descriptor 1:    26 1b 00 88 50 20 12 30 34 40 33 00 2f be 10 00 00 19
descriptor 2:    8b 16 00 68 50 20 22 30 34 40 33 00 2f be 10 00 00 19
descriptor 3:    00 00 00 0f 00 81 0a 32 81 0a 28 12 01 00 4c a3 57 31
descriptor 4:    00 00 00 fe 00 4c 54 4e 31 34 31 57 31 2d 4c 30 35 0a
extensions:      00
checksum:        d7

EDID version: 1.3
Manufacturer: LEN Model 4031 Serial Number --
Made in year 2007
Digital display
Maximum image size: 30 cm x 19 cm
Gamma: 2.20
DPMS levels: Standby Suspend Off
RGB color display
First detailed timing is preferred timing
Display x,y Chromaticity:
  Red:   0.5693, 0.3320
  Green: 0.3115, 0.5439
  Blue:  0.1494, 0.1318
  White: 0.3134, 0.3291
Established timings supported:
Standard timings supported:
Detailed mode: Clock 69.500 MHz, 303 mm x 190 mm
               1280 1332 1396 1416 hborder 0
                800  803  806  818 vborder 0
               -hsync -vsync 
               VertFreq: 60 Hz, HorFreq: 49081 Hz
Detailed mode: Clock 57.710 MHz, 303 mm x 190 mm
               1280 1332 1396 1384 hborder 0
                800  803  806  834 vborder 0
               -hsync -vsync 
               VertFreq: 49 Hz, HorFreq: 41697 Hz
Manufacturer-specified data, tag 15
ASCII string: LTN141W1-L05
Checksum: 0xd7 (valid)
EDID block does NOT conform to EDID 1.3!
	Missing name descriptor
	Missing monitor ranges
