edid-decode (hex):

00 ff ff ff ff ff ff 00 30 ae 31 40 00 00 00 00
2d 10 01 03 80 1e 13 78 ea 06 15 93 56 50 8d 29
26 50 54 00 00 00 01 01 01 01 01 01 01 01 01 01
01 01 01 01 01 01 bc 1b 00 a0 50 20 17 30 30 20
36 00 2f be 10 00 00 18 d4 17 00 c8 50 20 1c 30
30 20 36 00 2f be 10 00 00 18 00 00 00 0f 00 81
0a 32 81 0a 28 12 01 00 0d af 37 14 00 00 00 fe
00 4e 31 34 31 49 33 2d 4c 30 33 0a 20 20 00 8f

----------------

Block 0, Base EDID:
  EDID Structure Version & Revision: 1.3
  Vendor & Product Identification:
    Manufacturer: LEN
    Model: 16433
    Made in: week 45 of 2006
  Basic Display Parameters & Features:
    Digital display
    Maximum image size: 30 cm x 19 cm
    Gamma: 2.20
    DPMS levels: Standby Suspend Off
    RGB color display
    First detailed timing is the preferred timing
  Color Characteristics:
    Red  : 0.5742, 0.3359
    Green: 0.3134, 0.5527
    Blue : 0.1601, 0.1494
    White: 0.3134, 0.3291
  Established Timings I & II: none
  Standard Timings: none
  Detailed Timing Descriptors:
    DTD 1:  1280x800    59.910 Hz   8:5    49.306 kHz  71.000 MHz (303 mm x 190 mm)
                 Hfront   48 Hsync  32 Hback  80 Hpol N
                 Vfront    3 Vsync   6 Vback  14 Vpol N
    DTD 2:  1280x800    49.778 Hz   8:5    41.216 kHz  61.000 MHz (303 mm x 190 mm)
                 Hfront   48 Hsync  32 Hback 120 Hpol N
                 Vfront    3 Vsync   6 Vback  19 Vpol N
    Manufacturer-Specified Display Descriptor (0x0f): 00 0f 00 81 0a 32 81 0a 28 12 01 00 0d af 37 14 '.....2..(.....7.'
    Alphanumeric Data String: 'N141I3-L03'
Checksum: 0x8f

----------------

Failures:

Block 0, Base EDID:
  Missing Display Product Name.
  Missing Display Range Limits Descriptor.

EDID conformity: FAIL
