edid-decode (hex):

00 ff ff ff ff ff ff 00 30 ae 31 40 00 00 00 00
00 11 01 03 80 1e 13 78 ea cd 75 91 55 4f 8b 26
21 50 54 21 08 00 01 01 01 01 01 01 01 01 01 01
01 01 01 01 01 01 26 1b 00 88 50 20 12 30 34 40
33 00 2f be 10 00 00 19 8b 16 00 68 50 20 22 30
34 40 33 00 2f be 10 00 00 19 00 00 00 0f 00 81
0a 32 81 0a 28 12 01 00 4c a3 57 31 00 00 00 fe
00 4c 54 4e 31 34 31 41 54 31 30 2d 47 0a 00 aa

----------------

Block 0, Base EDID:
  EDID Structure Version & Revision: 1.3
  Vendor & Product Identification:
    Manufacturer: LEN
    Model: 16433
    Made in: 2007
  Basic Display Parameters & Features:
    Digital display
    Maximum image size: 30 cm x 19 cm
    Gamma: 2.20
    DPMS levels: Standby Suspend Off
    RGB color display
    First detailed timing is the preferred timing
  Color Characteristics:
    Red  : 0.5693, 0.3320
    Green: 0.3115, 0.5439
    Blue : 0.1494, 0.1318
    White: 0.3134, 0.3291
  Established Timings I & II:
    DMT 0x04:   640x480    59.940476 Hz   4:3     31.469 kHz     25.175000 MHz
    DMT 0x09:   800x600    60.316541 Hz   4:3     37.879 kHz     40.000000 MHz
    DMT 0x10:  1024x768    60.003840 Hz   4:3     48.363 kHz     65.000000 MHz
  Standard Timings: none
  Detailed Timing Descriptors:
    DTD 1:  1280x800    60.002348 Hz   8:5     49.082 kHz     69.500000 MHz (303 mm x 190 mm)
                 Hfront   52 Hsync  64 Hback   20 Hpol N
                 Vfront    3 Vsync   3 Vback   12 Vpol N
    DTD 2:  1280x800    49.997574 Hz   8:5     41.698 kHz     57.710000 MHz (303 mm x 190 mm)
                 Hfront   52 Hsync  64 Hback  -12 Hpol N
                 Vfront    3 Vsync   3 Vback   28 Vpol N
    Manufacturer-Specified Display Descriptor (0x0f): 00 0f 00 81 0a 32 81 0a 28 12 01 00 4c a3 57 31 '.....2..(...L.W1'
    Alphanumeric Data String: 'LTN141AT10-G'
Checksum: 0xaa

----------------

Failures:

Block 0, Base EDID:
  Detailed Timing Descriptor #2: 0 or negative horizontal back porch.
  Missing Display Product Name.
  Missing Display Range Limits Descriptor.

EDID conformity: FAIL
