
EDID (hex):
00ffffffffffff0025b0111949020000
3410010308291a78eaf955a355489927
145054bfef80950f8180814081c0810f
7190904f0101c422a0a050841a303020
36009a011100001e000000fc00523139
5731310a202020202020000000fd0038
4c1f5410000a202020202020000000ff
0036353230303538350a2020202000b5

edid-decode (hex):

00 ff ff ff ff ff ff 00 25 b0 11 19 49 02 00 00
34 10 01 03 08 29 1a 78 ea f9 55 a3 55 48 99 27
14 50 54 bf ef 80 95 0f 81 80 81 40 81 c0 81 0f
71 90 90 4f 01 01 c4 22 a0 a0 50 84 1a 30 30 20
36 00 9a 01 11 00 00 1e 00 00 00 fc 00 52 31 39
57 31 31 0a 20 20 20 20 20 20 00 00 00 fd 00 38
4c 1f 54 10 00 0a 20 20 20 20 20 20 00 00 00 ff
00 36 35 32 30 30 35 38 35 0a 20 20 20 20 00 b5

----------------

Block 0, Base EDID:
  EDID Structure Version & Revision: 1.3
  Vendor & Product Identification:
    Manufacturer: IMP
    Model: 6417
    Serial Number: 585
    Made in: week 52 of 2006
  Basic Display Parameters & Features:
    Analog display
    Signal Level Standard: 0.700 : 0.300 : 1.000 V p-p
    Blank level equals black level
    Sync: Separate
    Maximum image size: 41 cm x 26 cm
    Gamma: 2.20
    DPMS levels: Standby Suspend Off
    RGB color display
    First detailed timing is the preferred timing
  Color Characteristics:
    Red  : 0.6396, 0.3349
    Green: 0.2832, 0.5986
    Blue : 0.1533, 0.0791
    White: 0.3134, 0.3291
  Established Timings I & II:
    IBM     :   720x400    70.081663 Hz   9:5     31.467 kHz     28.320000 MHz
    DMT 0x04:   640x480    59.940476 Hz   4:3     31.469 kHz     25.175000 MHz
    Apple   :   640x480    66.666667 Hz   4:3     35.000 kHz     30.240000 MHz
    DMT 0x05:   640x480    72.808802 Hz   4:3     37.861 kHz     31.500000 MHz
    DMT 0x06:   640x480    75.000000 Hz   4:3     37.500 kHz     31.500000 MHz
    DMT 0x08:   800x600    56.250000 Hz   4:3     35.156 kHz     36.000000 MHz
    DMT 0x09:   800x600    60.316541 Hz   4:3     37.879 kHz     40.000000 MHz
    DMT 0x0a:   800x600    72.187572 Hz   4:3     48.077 kHz     50.000000 MHz
    DMT 0x0b:   800x600    75.000000 Hz   4:3     46.875 kHz     49.500000 MHz
    Apple   :   832x624    74.551266 Hz   4:3     49.726 kHz     57.284000 MHz
    DMT 0x10:  1024x768    60.003840 Hz   4:3     48.363 kHz     65.000000 MHz
    DMT 0x11:  1024x768    70.069359 Hz   4:3     56.476 kHz     75.000000 MHz
    DMT 0x12:  1024x768    75.028582 Hz   4:3     60.023 kHz     78.750000 MHz
    DMT 0x24:  1280x1024   75.024675 Hz   5:4     79.976 kHz    135.000000 MHz
    Apple   :  1152x870    75.061550 Hz 192:145   68.681 kHz    100.000000 MHz
  Standard Timings:
    DMT 0x30:  1440x900    74.984427 Hz  16:10    70.635 kHz    136.750000 MHz
    DMT 0x23:  1280x1024   60.019740 Hz   5:4     63.981 kHz    108.000000 MHz
    DMT 0x20:  1280x960    60.000000 Hz   4:3     60.000 kHz    108.000000 MHz
    DMT 0x55:  1280x720    60.000000 Hz  16:9     45.000 kHz     74.250000 MHz
    DMT 0x1d:  1280x800    74.934142 Hz  16:10    62.795 kHz    106.500000 MHz
    GTF     :  1152x921    76.000118 Hz   5:4     73.112 kHz    113.470000 MHz
    DMT 0x2b:  1400x1050   74.866680 Hz   4:3     82.278 kHz    156.000000 MHz
  Detailed Timing Descriptors:
    DTD 1:  1440x900    60.070194 Hz  16:10    55.625 kHz     89.000000 MHz (410 mm x 257 mm)
                 Hfront   48 Hsync  32 Hback   80 Hpol P
                 Vfront    3 Vsync   6 Vback   17 Vpol P
    Display Product Name: 'R19W11'
    Display Range Limits:
      Monitor ranges (GTF): 56-76 Hz V, 31-84 kHz H, max dotclock 160 MHz
    Display Product Serial Number: '65200585'
Checksum: 0xb5
