
EDID (hex):
00ffffffffffff0009e5e20600000000
011a0104951f11780ae7b0955c599429
22505400000001010101010101010101
0101010101013c3780de703814403020
360035ad1000001a302c80de70381440
3020360035ad1000001a000000fe0043
4a354a4d804e5631344e343600000000
0000411196000000000a010a202000d9

Extracted contents:
header:          00 ff ff ff ff ff ff 00
serial number:   09 e5 e2 06 00 00 00 00 01 1a
version:         01 04
basic params:    95 1f 11 78 0a
chroma info:     e7 b0 95 5c 59 94 29 22 50 54
established:     00 00 00
standard:        01 01 01 01 01 01 01 01 01 01 01 01 01 01 01 01
descriptor 1:    3c 37 80 de 70 38 14 40 30 20 36 00 35 ad 10 00 00 1a
descriptor 2:    30 2c 80 de 70 38 14 40 30 20 36 00 35 ad 10 00 00 1a
descriptor 3:    00 00 00 fe 00 43 4a 35 4a 4d 80 4e 56 31 34 4e 34 36
descriptor 4:    00 00 00 00 00 00 41 11 96 00 00 00 00 0a 01 0a 20 20
extensions:      00
checksum:        d9

EDID version: 1.4
Manufacturer: BOE Model 6e2 Serial Number --
Made in week 1 of 2016
Digital display
6 bits per primary color channel
DisplayPort interface
Maximum image size: 31 cm x 17 cm
Gamma: 2.20
Supported color formats: RGB 4:4:4, YCrCb 4:4:4
First detailed timing includes the native pixel format and preferred refresh rate
Display x,y Chromaticity:
  Red:   0.5849, 0.3613
  Green: 0.3486, 0.5810
  Blue:  0.1621, 0.1357
  White: 0.3125, 0.3281
Established timings supported:
Standard timings supported:
Detailed mode: Clock 141.400 MHz, 309 mm x 173 mm
               1920 1968 2000 2142 hborder 0
               1080 1083 1089 1100 vborder 0
               +hsync -vsync 
               VertFreq: 60 Hz, HorFreq: 66013 Hz
Detailed mode: Clock 113.120 MHz, 309 mm x 173 mm
               1920 1968 2000 2142 hborder 0
               1080 1083 1089 1100 vborder 0
               +hsync -vsync 
               VertFreq: 48 Hz, HorFreq: 52810 Hz
ASCII string: CJ5JM
Manufacturer-specified data, tag 0
Checksum: 0xd9 (valid)
EDID block does NOT conform to EDID 1.4!
	Missing name descriptor
	Missing monitor ranges
	Detailed block string not properly terminated
