edid-decode (hex):

00 ff ff ff ff ff ff 00 0e 6f 00 14 00 00 00 00
00 1d 01 04 b5 1f 11 78 02 e6 25 ae 50 43 b1 27
10 52 57 00 00 00 01 01 01 01 01 01 01 01 01 01
01 01 01 01 01 01 40 ce 00 a0 f0 70 28 80 30 20
35 00 35 ae 10 00 00 18 00 00 00 00 00 00 00 00
00 00 00 00 00 00 00 00 00 18 00 00 00 fe 00 43
53 4f 54 20 54 33 0a 20 20 20 20 20 00 00 00 fe
00 4d 4e 45 30 30 31 45 41 31 2d 31 0a 20 01 72

02 03 0f 00 e3 05 80 00 e6 06 05 01 6a 6a 24 00
00 00 00 00 00 00 00 00 00 00 00 00 00 00 00 00
00 00 00 00 00 00 00 00 00 00 00 00 00 00 00 00
00 00 00 00 00 00 00 00 00 00 00 00 00 00 00 00
00 00 00 00 00 00 00 00 00 00 00 00 00 00 00 00
00 00 00 00 00 00 00 00 00 00 00 00 00 00 00 00
00 00 00 00 00 00 00 00 00 00 00 00 00 00 00 00
00 00 00 00 00 00 00 00 00 00 00 00 00 00 00 9a

00 ff ff ff ff ff ff 00 0e 6f 00 14 00 00 00 00
00 1d 01 04 b5 1f 11 78 02 e6 25 ae 50 43 b1 27
10 52 57 00 00 00 01 01 01 01 01 01 01 01 01 01
01 01 01 01 01 01 40 ce 00 a0 f0 70 28 80 30 20
35 00 35 ae 10 00 00 18 00 00 00 00 00 00 00 00
00 00 00 00 00 00 00 00 00 18 00 00 00 fe 00 43
53 4f 54 20 54 33 0a 20 20 20 20 20 00 00 00 fe
00 4d 4e 45 30 30 31 45 41 31 2d 31 0a 20 01 72

02 03 0f 00 e3 05 80 00 e6 06 05 01 6a 6a 24 00
00 00 00 00 00 00 00 00 00 00 00 00 00 00 00 00
00 00 00 00 00 00 00 00 00 00 00 00 00 00 00 00
00 00 00 00 00 00 00 00 00 00 00 00 00 00 00 00
00 00 00 00 00 00 00 00 00 00 00 00 00 00 00 00
00 00 00 00 00 00 00 00 00 00 00 00 00 00 00 00
00 00 00 00 00 00 00 00 00 00 00 00 00 00 00 00
00 00 00 00 00 00 00 00 00 00 00 00 00 00 00 9a

----------------

Block 0, Base EDID:
  EDID Structure Version & Revision: 1.4
  Vendor & Product Identification:
    Manufacturer: CSO
    Model: 5120
    Made in: 2019
  Basic Display Parameters & Features:
    Digital display
    Bits per primary color channel: 10
    DisplayPort interface
    Maximum image size: 31 cm x 17 cm
    Gamma: 2.20
    Supported color formats: RGB 4:4:4
    First detailed timing includes the native pixel format and preferred refresh rate
  Color Characteristics:
    Red  : 0.6826, 0.3144
    Green: 0.2626, 0.6933
    Blue : 0.1523, 0.0644
    White: 0.3212, 0.3408
  Established Timings I & II: none
  Standard Timings: none
  Detailed Timing Descriptors:
    DTD 1:  3840x2160   60.000000 Hz  16:9    132.000 kHz    528.000000 MHz (309 mm x 174 mm)
                 Hfront   48 Hsync  32 Hback   80 Hpol N
                 Vfront    3 Vsync   5 Vback   32 Vpol N
    Manufacturer-Specified Display Descriptor (0x00): 00 00 00 00 00 00 00 00 00 00 00 00 00 00 00 18 '................'
    Alphanumeric Data String: 'CSOT T3'
    Alphanumeric Data String: 'MNE001EA1-1'
  Extension blocks: 1
Checksum: 0x72

----------------

Block 1, CTA-861 Extension Block:
  Revision: 3
  Native detailed modes: 0
  Colorimetry Data Block:
    BT2020RGB
  HDR Static Metadata Data Block:
    Electro optical transfer functions:
      Traditional gamma - SDR luminance range
      SMPTE ST2084
    Supported static metadata descriptors:
      Static metadata type 1
    Desired content max luminance: 106 (496.743 cd/m^2)
    Desired content max frame-average luminance: 106 (496.743 cd/m^2)
    Desired content min luminance: 36 (0.099 cd/m^2)
Checksum: 0x9a  Unused space in Extension Block: 112 bytes

----------------

Block 2, Unknown EDID Extension Block 0x00:
  00 ff ff ff ff ff ff 00 0e 6f 00 14 00 00 00 00 '.........o......'
  00 1d 01 04 b5 1f 11 78 02 e6 25 ae 50 43 b1 27 '.......x..%.PC.''
  10 52 57 00 00 00 01 01 01 01 01 01 01 01 01 01 '.RW.............'
  01 01 01 01 01 01 40 ce 00 a0 f0 70 28 80 30 20 '......@....p(.0 '
  35 00 35 ae 10 00 00 18 00 00 00 00 00 00 00 00 '5.5.............'
  00 00 00 00 00 00 00 00 00 18 00 00 00 fe 00 43 '...............C'
  53 4f 54 20 54 33 0a 20 20 20 20 20 00 00 00 fe 'SOT T3.     ....'
  00 4d 4e 45 30 30 31 45 41 31 2d 31 0a 20 01 72 '.MNE001EA1-1. .r'
Checksum: 0x72

----------------

Block 3, CTA-861 Extension Block:
  Revision: 3
  Native detailed modes: 0
  Colorimetry Data Block:
    BT2020RGB
  HDR Static Metadata Data Block:
    Electro optical transfer functions:
      Traditional gamma - SDR luminance range
      SMPTE ST2084
    Supported static metadata descriptors:
      Static metadata type 1
    Desired content max luminance: 106 (496.743 cd/m^2)
    Desired content max frame-average luminance: 106 (496.743 cd/m^2)
    Desired content min luminance: 36 (0.099 cd/m^2)
Checksum: 0x9a  Unused space in Extension Block: 112 bytes

----------------

Warnings:

Block 0, Base EDID:
  Missing Display Product Name.
Block 1, CTA-861 Extension Block:
  IT Video Formats are overscanned by default, but normally this should be underscanned.
  Colorimetry Data Block: Set the sRGB colorimetry bit to avoid interop issues.
Block 3, CTA-861 Extension Block:
  IT Video Formats are overscanned by default, but normally this should be underscanned.
  Colorimetry Data Block: Set the sRGB colorimetry bit to avoid interop issues.

Failures:

Block 1, CTA-861 Extension Block:
  Required 640x480p60 timings are missing in the established timings and the SVD list (VIC 1).
  Missing VCDB, needed for Set Selectable RGB Quantization to avoid interop issues.
Block 2, Base EDID:
  Unknown Extension Block.
Block 3, CTA-861 Extension Block:
  Colorimetry Data Block: Only one instance of this Data Block is allowed.
  HDR Static Metadata Data Block: Only one instance of this Data Block is allowed.
  Required 640x480p60 timings are missing in the established timings and the SVD list (VIC 1).
  Missing VCDB, needed for Set Selectable RGB Quantization to avoid interop issues.
EDID:
  Base EDID: EDID specified 1 extension block(s), but found 3 extension block(s).

EDID conformity: FAIL
