
EDID (hex):
00ffffffffffff000e6f001400000000
001d0104b51f117802c616b04f43b026
0f505100000001010101010101010101
01010101010140ce00a0f07028803020
350035ae100000180000000000000000
00000000000000000018000000fe0043
534f542054330a2020202020000000fe
004d4e453030314541312d310a2001ab
02030f00e3058000e60605016a6a2400
00000000000000000000000000000000
00000000000000000000000000000000
00000000000000000000000000000000
00000000000000000000000000000000
00000000000000000000000000000000
00000000000000000000000000000000
0000000000000000000000000000009a

edid-decode (hex):

00 ff ff ff ff ff ff 00 0e 6f 00 14 00 00 00 00
00 1d 01 04 b5 1f 11 78 02 c6 16 b0 4f 43 b0 26
0f 50 51 00 00 00 01 01 01 01 01 01 01 01 01 01
01 01 01 01 01 01 40 ce 00 a0 f0 70 28 80 30 20
35 00 35 ae 10 00 00 18 00 00 00 00 00 00 00 00
00 00 00 00 00 00 00 00 00 18 00 00 00 fe 00 43
53 4f 54 20 54 33 0a 20 20 20 20 20 00 00 00 fe
00 4d 4e 45 30 30 31 45 41 31 2d 31 0a 20 01 ab

02 03 0f 00 e3 05 80 00 e6 06 05 01 6a 6a 24 00
00 00 00 00 00 00 00 00 00 00 00 00 00 00 00 00
00 00 00 00 00 00 00 00 00 00 00 00 00 00 00 00
00 00 00 00 00 00 00 00 00 00 00 00 00 00 00 00
00 00 00 00 00 00 00 00 00 00 00 00 00 00 00 00
00 00 00 00 00 00 00 00 00 00 00 00 00 00 00 00
00 00 00 00 00 00 00 00 00 00 00 00 00 00 00 00
00 00 00 00 00 00 00 00 00 00 00 00 00 00 00 9a

----------------

Block 0, Base EDID:
  EDID Structure Version & Revision: 1.4
  Vendor & Product Identification:
    Manufacturer: CSO
    Model: 5120
    Made in: 2019
  Basic Display Parameters & Features:
    Digital display
    Bits per primary color channel: 10
    DisplayPort interface
    Maximum image size: 31 cm x 17 cm
    Gamma: 2.20
    Supported color formats: RGB 4:4:4
    First detailed timing includes the native pixel format and preferred refresh rate
  Color Characteristics:
    Red  : 0.6904, 0.3085
    Green: 0.2626, 0.6894
    Blue : 0.1484, 0.0595
    White: 0.3134, 0.3183
  Established Timings I & II: none
  Standard Timings: none
  Detailed Timing Descriptors:
    DTD 1:  3840x2160   60.000000 Hz  16:9    132.000 kHz    528.000000 MHz (309 mm x 174 mm)
                 Hfront   48 Hsync  32 Hback   80 Hpol N
                 Vfront    3 Vsync   5 Vback   32 Vpol N
    Manufacturer-Specified Display Descriptor (0x00): 00 00 00 00 00 00 00 00 00 00 00 00 00 00 00 18 '................'
    Alphanumeric Data String: 'CSOT T3'
    Alphanumeric Data String: 'MNE001EA1-1'
  Extension blocks: 1
Checksum: 0xab

----------------

Block 1, CTA-861 Extension Block:
  Revision: 3
  Native detailed modes: 0
  Colorimetry Data Block:
    BT2020RGB
  HDR Static Metadata Data Block:
    Electro optical transfer functions:
      Traditional gamma - SDR luminance range
      SMPTE ST2084
    Supported static metadata descriptors:
      Static metadata type 1
    Desired content max luminance: 106 (496.743 cd/m^2)
    Desired content max frame-average luminance: 106 (496.743 cd/m^2)
    Desired content min luminance: 36 (0.099 cd/m^2)
Checksum: 0x9a  Unused space in Extension Block: 112 bytes
