edid-decode (hex):

00 ff ff ff ff ff ff 00 0e 14 1e 14 00 00 00 00
21 11 01 03 80 21 15 78 0a 09 2d 9d 56 4f 90 27
21 50 54 00 00 00 01 01 01 01 01 01 01 01 01 01
01 01 01 01 01 01 ea 1a 00 80 50 20 10 30 15 20
13 00 4b cf 10 00 00 19 00 00 00 0f 00 00 00 00
00 00 00 00 00 20 6e 05 0f 00 00 00 00 fe 00 47
52 35 35 34 30 31 35 34 57 42 38 20 00 00 00 fe
00 2c 3c 47 51 6e 8e b9 ff 01 01 20 20 20 00 cc

----------------

Block 0, Base EDID:
  EDID Structure Version & Revision: 1.3
  Vendor & Product Identification:
    Manufacturer: CPT
    Model: 5150
    Made in: week 33 of 2007
  Basic Display Parameters & Features:
    Digital display
    Maximum image size: 33 cm x 21 cm
    Gamma: 2.20
    RGB color display
    First detailed timing is the preferred timing
  Color Characteristics:
    Red  : 0.6132, 0.3359
    Green: 0.3105, 0.5634
    Blue : 0.1523, 0.1308
    White: 0.3154, 0.3291
  Established Timings I & II: none
  Standard Timings: none
  Detailed Timing Descriptors:
    DTD 1:  1280x800    59.969 Hz   8:5    48.935 kHz  68.900 MHz (331 mm x 207 mm)
                 Hfront   21 Hsync  32 Hback  75 Hpol N
                 Vfront    1 Vsync   3 Vback  12 Vpol N
    Manufacturer-Specified Display Descriptor (0x0f): 00 0f 00 00 00 00 00 00 00 00 00 20 6e 05 0f 00 '........... n...'
    Alphanumeric Data String: 'GR5540154WB8 '
    Alphanumeric Data String: ',<GQn'
Checksum: 0xcc

----------------

Failures:

Block 0, Base EDID:
  Alphanumeric Data String: One or more trailing spaces.
  Alphanumeric Data String: Non-printable character.
  Missing Display Product Name.
  Missing Display Range Limits Descriptor.

EDID conformity: FAIL
