
EDID (hex):
00ffffffffffff0026cd3d612e040000
271d010380361e782a9055a75553a028
135054a56b80710081408180a940b300
9500950fd1c0023a801871382d40582c
4500202f2100001e000000ff00313136
32393933393031303730000000fd0038
901ea723000a202020202020000000fc
00504c32353630480a202020202001fa
020336f1509005040302011112131406
0715161f53230907078301000067030c
001000004467d85dc401788000681a00
0001011e90e62a4480a0703827403020
3500202f2100001afe5b80a070383540
30203500202f2100001a866f80a07038
404030203500202f2100001a5a8780a0
70384d4030203500202f2100001a0016

Extracted contents:
header:          00 ff ff ff ff ff ff 00
serial number:   26 cd 3d 61 2e 04 00 00 27 1d
version:         01 03
basic params:    80 36 1e 78 2a
chroma info:     90 55 a7 55 53 a0 28 13 50 54
established:     a5 6b 80
standard:        71 00 81 40 81 80 a9 40 b3 00 95 00 95 0f d1 c0
descriptor 1:    02 3a 80 18 71 38 2d 40 58 2c 45 00 20 2f 21 00 00 1e
descriptor 2:    00 00 00 ff 00 31 31 36 32 39 39 33 39 30 31 30 37 30
descriptor 3:    00 00 00 fd 00 38 90 1e a7 23 00 0a 20 20 20 20 20 20
descriptor 4:    00 00 00 fc 00 50 4c 32 35 36 30 48 0a 20 20 20 20 20
extensions:      01
checksum:        fa

EDID version: 1.3
Manufacturer: IVM Model 613d Serial Number --
Made in week 39 of 2019
Digital display
Maximum image size: 54 cm x 30 cm
Gamma: 2.20
DPMS levels: Off
RGB color display
First detailed timing is preferred timing
Display x,y Chromaticity:
  Red:   0.6542, 0.3330
  Green: 0.3242, 0.6250
  Blue:  0.1572, 0.0751
  White: 0.3134, 0.3291
Established timings supported:
  720x400@70Hz 9:5 HorFreq: 31469 Hz Clock: 28.320 MHz
  640x480@60Hz 4:3 HorFreq: 31469 Hz Clock: 25.175 MHz
  640x480@75Hz 4:3 HorFreq: 37500 Hz Clock: 31.500 MHz
  800x600@60Hz 4:3 HorFreq: 37900 Hz Clock: 40.000 MHz
  800x600@75Hz 4:3 HorFreq: 46900 Hz Clock: 49.500 MHz
  832x624@75Hz 4:3 HorFreq: 49726 Hz Clock: 57.284 MHz
  1024x768@60Hz 4:3 HorFreq: 48400 Hz Clock: 65.000 MHz
  1024x768@75Hz 4:3 HorFreq: 60000 Hz Clock: 78.750 MHz
  1280x1024@75Hz 5:4 HorFreq: 80000 Hz Clock: 135.000 MHz
  1152x870@75Hz 192:145 HorFreq: 67500 Hz Clock: 108.000 MHz
Standard timings supported:
  1152x720@60Hz 16:10
  1280x960@60Hz 4:3 HorFreq: 60000 Hz Clock: 108.000 MHz
  1280x1024@60Hz 5:4 HorFreq: 64000 Hz Clock: 108.000 MHz
  1600x1200@60Hz 4:3 HorFreq: 75000 Hz Clock: 162.000 MHz
  1680x1050@60Hz 16:10 HorFreq: 64700 Hz Clock: 119.000 MHz
  1440x900@60Hz 16:10 HorFreq: 55500 Hz Clock: 88.750 MHz
  1440x900@75Hz 16:10 HorFreq: 82300 Hz Clock: 156.000 MHz
  1920x1080@60Hz 16:9
Detailed mode: Clock 148.500 MHz, 544 mm x 303 mm
               1920 2008 2052 2200 hborder 0
               1080 1084 1089 1125 vborder 0
               +hsync +vsync 
               VertFreq: 60 Hz, HorFreq: 67500 Hz
Serial number: --
Monitor ranges (GTF): 56-144Hz V, 30-167kHz H, max dotclock 350MHz
Monitor name: PL2560H
Has 1 extension blocks
Checksum: 0xfa (valid)

CTA extension block
Extension version: 3
50 bytes of CTA data
  Video data block
    VIC  16 1920x1080@60Hz 16:9 (native) HorFreq: 67500 Hz Clock: 148.500 MHz
    VIC   5 1920x1080i@60Hz 16:9  HorFreq: 33750 Hz Clock: 74.250 MHz
    VIC   4 1280x720@60Hz 16:9  HorFreq: 45000 Hz Clock: 74.250 MHz
    VIC   3 720x480@60Hz 16:9  HorFreq: 31469 Hz Clock: 27.000 MHz
    VIC   2 720x480@60Hz 4:3  HorFreq: 31469 Hz Clock: 27.000 MHz
    VIC   1 640x480@60Hz 4:3  HorFreq: 31469 Hz Clock: 25.175 MHz
    VIC  17 720x576@50Hz 4:3  HorFreq: 31250 Hz Clock: 27.000 MHz
    VIC  18 720x576@50Hz 16:9  HorFreq: 31250 Hz Clock: 27.000 MHz
    VIC  19 1280x720@50Hz 16:9  HorFreq: 37500 Hz Clock: 74.250 MHz
    VIC  20 1920x1080i@50Hz 16:9  HorFreq: 28125 Hz Clock: 74.250 MHz
    VIC   6 1440x480i@60Hz 4:3  HorFreq: 15734 Hz Clock: 27.000 MHz
    VIC   7 1440x480i@60Hz 16:9  HorFreq: 15734 Hz Clock: 27.000 MHz
    VIC  21 1440x576i@50Hz 4:3  HorFreq: 15625 Hz Clock: 27.000 MHz
    VIC  22 1440x576i@50Hz 16:9  HorFreq: 15625 Hz Clock: 27.000 MHz
    VIC  31 1920x1080@50Hz 16:9  HorFreq: 56250 Hz Clock: 148.500 MHz
    VIC  83 1680x720@60Hz 64:27  HorFreq: 45000 Hz Clock: 99.000 MHz
  Audio data block
    Linear PCM, max channels 2
      Supported sample rates (kHz): 48 44.1 32
      Supported sample sizes (bits): 24 20 16
  Speaker allocation data block
    Speaker map:
      FL/FR - Front Left/Right
  Vendor-specific data block, OUI 000c03 (HDMI)
    Source physical address 1.0.0.0
    Maximum TMDS clock: 340MHz
  Vendor-specific data block, OUI c45dd8 (HDMI Forum)
    Version: 1
    Maximum TMDS Character Rate: 600MHz
    SCDC Present
  Vendor-specific data block, OUI 00001a
Underscans PC formats by default
Basic audio support
Supports YCbCr 4:4:4
Supports YCbCr 4:2:2
1 native detailed modes
Detailed mode: Clock 174.500 MHz, 544 mm x 303 mm
               1920 1968 2000 2080 hborder 0
               1080 1083 1088 1119 vborder 0
               +hsync -vsync 
               VertFreq: 74 Hz, HorFreq: 83894 Hz
Detailed mode: Clock 235.500 MHz, 544 mm x 303 mm
               1920 1968 2000 2080 hborder 0
               1080 1083 1088 1133 vborder 0
               +hsync -vsync 
               VertFreq: 99 Hz, HorFreq: 113221 Hz
Detailed mode: Clock 285.500 MHz, 544 mm x 303 mm
               1920 1968 2000 2080 hborder 0
               1080 1083 1088 1144 vborder 0
               +hsync -vsync 
               VertFreq: 119 Hz, HorFreq: 137259 Hz
Detailed mode: Clock 346.500 MHz, 544 mm x 303 mm
               1920 1968 2000 2080 hborder 0
               1080 1083 1088 1157 vborder 0
               +hsync -vsync 
               VertFreq: 143 Hz, HorFreq: 166586 Hz
Checksum: 0x16 (valid)

One or more of the timings is out of range of the Monitor Ranges:
  Vertical Freq: 50 - 143 Hz
  Horizontal Freq: 15625 - 166586 Hz
  Maximum Clock: 346.500 MHz
EDID block does not conform at all!
	Both the serial number and the serial string are set


