edid-decode (hex):

00 ff ff ff ff ff ff 00 15 85 00 00 01 01 01 01
0e 1a 01 03 08 29 17 78 0a d7 a5 a2 59 4a 96 24
14 50 54 ad ce 00 01 01 01 01 01 01 01 01 01 01
01 01 01 01 01 01 66 21 50 b0 51 00 1b 30 40 70
36 00 f8 c2 21 00 00 1e 66 21 56 aa 51 00 1e 30
46 8f 33 00 40 84 63 00 00 1e 00 00 00 fc 00 45
4c 45 46 57 32 34 38 0a 20 20 20 20 00 00 00 fd
00 32 4c 1e 41 0b 00 0a 20 20 20 20 20 20 00 f9

----------------

Block 0, Base EDID:
  EDID Structure Version & Revision: 1.3
  Vendor & Product Identification:
    Manufacturer: ELE
    Model: 0
    Serial Number: ...
    Made in: week 14 of 2016
  Basic Display Parameters & Features:
    Analog display
    Input voltage level: 0.7/0.3 V
    Sync: Separate
    Maximum image size: 41 cm x 23 cm
    Gamma: 2.20
    RGB color display
    First detailed timing is the preferred timing
  Color Characteristics:
    Red  : 0.6357, 0.3486
    Green: 0.2900, 0.5888
    Blue : 0.1425, 0.0800
    White: 0.3134, 0.3291
  Established Timings I & II:
    IBM     :   720x400    70.082 Hz   9:5    31.467 kHz  28.320 MHz
    DMT 0x04:   640x480    59.940 Hz   4:3    31.469 kHz  25.175 MHz
    DMT 0x05:   640x480    72.809 Hz   4:3    37.861 kHz  31.500 MHz
    DMT 0x06:   640x480    75.000 Hz   4:3    37.500 kHz  31.500 MHz
    DMT 0x09:   800x600    60.317 Hz   4:3    37.879 kHz  40.000 MHz
    DMT 0x0a:   800x600    72.188 Hz   4:3    48.077 kHz  50.000 MHz
    DMT 0x0b:   800x600    75.000 Hz   4:3    46.875 kHz  49.500 MHz
    DMT 0x10:  1024x768    60.004 Hz   4:3    48.363 kHz  65.000 MHz
    DMT 0x11:  1024x768    70.069 Hz   4:3    56.476 kHz  75.000 MHz
    DMT 0x12:  1024x768    75.029 Hz   4:3    60.023 kHz  78.750 MHz
  Standard Timings: none
  Detailed Timing Descriptors:
    DTD 1:  1360x768    60.015 Hz  85:48   47.712 kHz  85.500 MHz (760 mm x 450 mm)
                 Hfront   64 Hsync 112 Hback 256 Hpol P
                 Vfront    3 Vsync   6 Vback  18 Vpol P
    DTD 2:  1366x768    59.790 Hz 683:384  47.712 kHz  85.500 MHz (1600 mm x 900 mm)
                 Hfront   70 Hsync 143 Hback 213 Hpol P
                 Vfront    3 Vsync   3 Vback  24 Vpol P
    Display Product Name: 'ELEFW248'
  Display Range Limits:
    Monitor ranges (GTF): 50-76 Hz V, 30-65 kHz H, max dotclock 110 MHz
Checksum: 0xf9

----------------

Failures:

Block 0, Base EDID:
  Detailed Timing Descriptor #1: Mismatch of image size 760x450 mm vs display size 410x230 mm.
  Detailed Timing Descriptor #2: Mismatch of image size 1600x900 mm vs display size 410x230 mm.

EDID conformity: FAIL
