
EDID (hex):
00ffffffffffff0022f0072801010101
30120103802f1e78eece50a3544c9926
0f5054a56b80814081809500b300a900
01010101010121399030621a274068b0
3600d62c1100001c000000fd0030551e
5d11000a202020202020000000fc0048
50204c5032323735770a2020000000ff
00435a43383438303531520a20200044

Extracted contents:
header:          00 ff ff ff ff ff ff 00
serial number:   22 f0 07 28 01 01 01 01 30 12
version:         01 03
basic params:    80 2f 1e 78 ee
chroma info:     ce 50 a3 54 4c 99 26 0f 50 54
established:     a5 6b 80
standard:        81 40 81 80 95 00 b3 00 a9 00 01 01 01 01 01 01
descriptor 1:    21 39 90 30 62 1a 27 40 68 b0 36 00 d6 2c 11 00 00 1c
descriptor 2:    00 00 00 fd 00 30 55 1e 5d 11 00 0a 20 20 20 20 20 20
descriptor 3:    00 00 00 fc 00 48 50 20 4c 50 32 32 37 35 77 0a 20 20
descriptor 4:    00 00 00 ff 00 43 5a 43 38 34 38 30 35 31 52 0a 20 20
extensions:      00
checksum:        44

EDID version: 1.3
Manufacturer: HWP Model 2807 Serial Number --
Made in week 48 of 2008
Digital display
Maximum image size: 47 cm x 30 cm
Gamma: 2.20
DPMS levels: Standby Suspend Off
RGB color display
Default (sRGB) color space is primary color space
First detailed timing is preferred timing
Display x,y Chromaticity:
  Red:   0.6396, 0.3281
  Green: 0.2998, 0.5996
  Blue:  0.1494, 0.0595
  White: 0.3125, 0.3281
Established timings supported:
  720x400@70Hz 9:5 HorFreq: 31469 Hz Clock: 28.320 MHz
  640x480@60Hz 4:3 HorFreq: 31469 Hz Clock: 25.175 MHz
  640x480@75Hz 4:3 HorFreq: 37500 Hz Clock: 31.500 MHz
  800x600@60Hz 4:3 HorFreq: 37900 Hz Clock: 40.000 MHz
  800x600@75Hz 4:3 HorFreq: 46900 Hz Clock: 49.500 MHz
  832x624@75Hz 4:3 HorFreq: 49726 Hz Clock: 57.284 MHz
  1024x768@60Hz 4:3 HorFreq: 48400 Hz Clock: 65.000 MHz
  1024x768@75Hz 4:3 HorFreq: 60000 Hz Clock: 78.750 MHz
  1280x1024@75Hz 5:4 HorFreq: 80000 Hz Clock: 135.000 MHz
  1152x870@75Hz 192:145 HorFreq: 67500 Hz Clock: 108.000 MHz
Standard timings supported:
  1280x960@60Hz 4:3 HorFreq: 60000 Hz Clock: 108.000 MHz
  1280x1024@60Hz 5:4 HorFreq: 64000 Hz Clock: 108.000 MHz
  1440x900@60Hz 16:10 HorFreq: 55500 Hz Clock: 88.750 MHz
  1680x1050@60Hz 16:10 HorFreq: 64700 Hz Clock: 119.000 MHz
  1600x1000@60Hz 16:10
Detailed mode: Clock 146.250 MHz, 470 mm x 300 mm
               1680 1784 1960 2240 hborder 0
               1050 1053 1059 1089 vborder 0
               -hsync +vsync 
               VertFreq: 59 Hz, HorFreq: 65290 Hz
Monitor ranges (GTF): 48-85Hz V, 30-93kHz H, max dotclock 170MHz
Monitor name: HP LP2275w
Serial number: --
Checksum: 0x44 (valid)
EDID block does NOT conform to EDID 1.3!
	sRGB is signaled, but the chromaticities do not match
