
EDID (hex):
00ffffffffffff0009d1437845540000
21140103802917782e3d85a6564a9a24
125054a56a8071000101010101010101
010101010101662156aa51001e30468f
33009ae61000001e000000ff00483841
30383233313031390a20000000fd0032
4c1e3f0e000a202020202020000000fc
0042656e5120473932354844410a0160
02031b71230907078301000067030c00
2000802d43100403e2000f8c0ad08a20
e02d10103e9600a05a00000000000000
00000000000000000000000000000000
00000000000000000000000000000000
00000000000000000000000000000000
00000000000000000000000000000000
00000000000000000000000000000018

Extracted contents:
header:          00 ff ff ff ff ff ff 00
serial number:   09 d1 43 78 45 54 00 00 21 14
version:         01 03
basic params:    80 29 17 78 2e
chroma info:     3d 85 a6 56 4a 9a 24 12 50 54
established:     a5 6a 80
standard:        71 00 01 01 01 01 01 01 01 01 01 01 01 01 01 01
descriptor 1:    66 21 56 aa 51 00 1e 30 46 8f 33 00 9a e6 10 00 00 1e
descriptor 2:    00 00 00 ff 00 48 38 41 30 38 32 33 31 30 31 39 0a 20
descriptor 3:    00 00 00 fd 00 32 4c 1e 3f 0e 00 0a 20 20 20 20 20 20
descriptor 4:    00 00 00 fc 00 42 65 6e 51 20 47 39 32 35 48 44 41 0a
extensions:      01
checksum:        60

EDID version: 1.3
Manufacturer: BNQ Model 7843 Serial Number --
Made in week 33 of 2010
Digital display
Maximum image size: 41 cm x 23 cm
Gamma: 2.20
DPMS levels: Off
RGB color display
Default (sRGB) color space is primary color space
First detailed timing is preferred timing
Display x,y Chromaticity:
  Red:   0.6484, 0.3388
  Green: 0.2919, 0.6025
  Blue:  0.1425, 0.0703
  White: 0.3134, 0.3291
Established timings supported:
  720x400@70Hz 9:5 HorFreq: 31469 Hz Clock: 28.320 MHz
  640x480@60Hz 4:3 HorFreq: 31469 Hz Clock: 25.175 MHz
  640x480@75Hz 4:3 HorFreq: 37500 Hz Clock: 31.500 MHz
  800x600@60Hz 4:3 HorFreq: 37900 Hz Clock: 40.000 MHz
  800x600@75Hz 4:3 HorFreq: 46900 Hz Clock: 49.500 MHz
  832x624@75Hz 4:3 HorFreq: 49726 Hz Clock: 57.284 MHz
  1024x768@60Hz 4:3 HorFreq: 48400 Hz Clock: 65.000 MHz
  1024x768@75Hz 4:3 HorFreq: 60000 Hz Clock: 78.750 MHz
  1152x870@75Hz 192:145 HorFreq: 67500 Hz Clock: 108.000 MHz
Standard timings supported:
  1152x720@60Hz 16:10
Detailed mode: Clock 85.500 MHz, 410 mm x 230 mm
               1366 1436 1579 1792 hborder 0
                768  771  774  798 vborder 0
               +hsync +vsync 
               VertFreq: 59 Hz, HorFreq: 47712 Hz
Serial number: --
Monitor ranges (GTF): 50-76Hz V, 30-63kHz H, max dotclock 140MHz
Monitor name: BenQ G925HDA
Has 1 extension blocks
Checksum: 0x60 (valid)

CTA extension block
Extension version: 3
23 bytes of CTA data
  Audio data block
    Linear PCM, max channels 2
      Supported sample rates (kHz): 48 44.1 32
      Supported sample sizes (bits): 24 20 16
  Speaker allocation data block
    Speaker map:
      FL/FR - Front Left/Right
  Vendor-specific data block, OUI 000c03 (HDMI)
    Source physical address 2.0.0.0
    Supports_AI
    Maximum TMDS clock: 225MHz
  Video data block
    VIC  16 1920x1080@60Hz 16:9  HorFreq: 67500 Hz Clock: 148.500 MHz
    VIC   4 1280x720@60Hz 16:9  HorFreq: 45000 Hz Clock: 74.250 MHz
    VIC   3 720x480@60Hz 16:9  HorFreq: 31469 Hz Clock: 27.000 MHz
  Extended tag: Video capability data block
    YCbCr quantization: No Data (0)
    RGB quantization: No Data (0)
    PT scan behaviour: No Data (0)
    IT scan behaviour: Support both over- and underscan (3)
    CE scan behaviour: Support both over- and underscan (3)
Basic audio support
Supports YCbCr 4:4:4
Supports YCbCr 4:2:2
1 native detailed modes
Detailed mode: Clock 27.000 MHz, 160 mm x 90 mm
                720  736  798  858 hborder 0
                480  489  495  525 vborder 0
               -hsync -vsync analog composite 
               VertFreq: 59 Hz, HorFreq: 31468 Hz
Checksum: 0x18 (valid)

EDID block does NOT conform to EDID 1.3!
	sRGB is signaled, but the chromaticities do not match
One or more of the timings is out of range of the Monitor Ranges:
  Vertical Freq: 59 - 75 Hz
  Horizontal Freq: 31468 - 67500 Hz
  Maximum Clock: 148.500 MHz
EDID block does not conform at all!
	Both the serial number and the serial string are set


