
EDID (hex):
00ffffffffffff0004720406a1f73082
171c010380341d782afc35a3564fa228
0c5054b30c00b30095008180810081c0
714f01010101023a801871382d40582c
450009252100001e6842806a70382740
0820980409252100001a000000fd0030
4b1e5512000a202020202020000000fc
0041636572204b47323431510a20011e

Extracted contents:
header:          00 ff ff ff ff ff ff 00
serial number:   04 72 04 06 a1 f7 30 82 17 1c
version:         01 03
basic params:    80 34 1d 78 2a
chroma info:     fc 35 a3 56 4f a2 28 0c 50 54
established:     b3 0c 00
standard:        b3 00 95 00 81 80 81 00 81 c0 71 4f 01 01 01 01
descriptor 1:    02 3a 80 18 71 38 2d 40 58 2c 45 00 09 25 21 00 00 1e
descriptor 2:    68 42 80 6a 70 38 27 40 08 20 98 04 09 25 21 00 00 1a
descriptor 3:    00 00 00 fd 00 30 4b 1e 55 12 00 0a 20 20 20 20 20 20
descriptor 4:    00 00 00 fc 00 41 63 65 72 20 4b 47 32 34 31 51 0a 20
extensions:      01
checksum:        1e

EDID version: 1.3
Manufacturer: ACR Model 604 Serial Number --
Made in week 23 of 2018
Digital display
Maximum image size: 52 cm x 29 cm
Gamma: 2.20
DPMS levels: Off
RGB color display
First detailed timing is preferred timing
Display x,y Chromaticity:
  Red:   0.6396, 0.3388
  Green: 0.3115, 0.6328
  Blue:  0.1562, 0.0498
  White: 0.3134, 0.3291
Established timings supported:
  720x400@70Hz 9:5 HorFreq: 31469 Hz Clock: 28.320 MHz
  640x480@60Hz 4:3 HorFreq: 31469 Hz Clock: 25.175 MHz
  640x480@67Hz 4:3 HorFreq: 35000 Hz Clock: 30.240 MHz
  800x600@56Hz 4:3 HorFreq: 35200 Hz Clock: 36.000 MHz
  800x600@60Hz 4:3 HorFreq: 37900 Hz Clock: 40.000 MHz
  1024x768@60Hz 4:3 HorFreq: 48400 Hz Clock: 65.000 MHz
  1024x768@70Hz 4:3 HorFreq: 56500 Hz Clock: 75.000 MHz
Standard timings supported:
  1680x1050@60Hz 16:10 HorFreq: 64700 Hz Clock: 119.000 MHz
  1440x900@60Hz 16:10 HorFreq: 55500 Hz Clock: 88.750 MHz
  1280x1024@60Hz 5:4 HorFreq: 64000 Hz Clock: 108.000 MHz
  1280x800@60Hz 16:10
  1280x720@60Hz 16:9
  1152x864@75Hz 4:3 HorFreq: 67500 Hz Clock: 108.000 MHz
Detailed mode: Clock 148.500 MHz, 521 mm x 293 mm
               1920 2008 2052 2200 hborder 0
               1080 1084 1089 1125 vborder 0
               +hsync +vsync 
               VertFreq: 60 Hz, HorFreq: 67500 Hz
Detailed mode: Clock 170.000 MHz, 521 mm x 293 mm
               1920 1928 1960 2026 hborder 0
               1080 1105 1113 1119 vborder 0
               +hsync -vsync 
               VertFreq: 74 Hz, HorFreq: 83909 Hz
Monitor ranges (GTF): 48-75Hz V, 30-85kHz H, max dotclock 180MHz
Monitor name: Acer KG241Q
Has 1 extension blocks
Checksum: 0x1e (valid)
