edid-decode (hex):

00 ff ff ff ff ff ff 00 09 e5 f6 08 00 00 00 00
2e 1d 01 04 a5 24 14 78 03 8e 45 95 58 55 8d 29
21 50 54 00 00 00 01 01 01 01 01 01 01 01 01 01
01 01 01 01 01 01 c4 36 80 cc 70 38 14 40 30 20
36 00 63 c8 10 00 00 1a 86 24 80 cc 70 38 14 40
30 20 36 00 63 c8 10 00 00 1a 00 00 00 00 00 00
00 00 00 00 00 00 00 00 00 00 00 00 00 00 00 02
00 0b 40 ff 0a 3c 7d 14 16 2b 7d 00 00 00 00 07

----------------

Block 0, Base EDID:
  EDID Structure Version & Revision: 1.4
  Vendor & Product Identification:
    Manufacturer: BOE
    Model: 2294
    Made in: week 46 of 2019
  Basic Display Parameters & Features:
    Digital display
    Bits per primary color channel: 8
    DisplayPort interface
    Maximum image size: 36 cm x 20 cm
    Gamma: 2.20
    Supported color formats: RGB 4:4:4
    First detailed timing includes the native pixel format and preferred refresh rate
    Display is continuous frequency
  Color Characteristics:
    Red  : 0.5839, 0.3437
    Green: 0.3349, 0.5527
    Blue : 0.1611, 0.1289
    White: 0.3134, 0.3291
  Established Timings I & II: none
  Standard Timings: none
  Detailed Timing Descriptors:
    DTD 1:  1920x1080   60.006848 Hz  16:9     66.008 kHz    140.200000 MHz (355 mm x 200 mm)
                 Hfront   48 Hsync  32 Hback  124 Hpol P
                 Vfront    3 Vsync   6 Vback   11 Vpol N
    DTD 2:  1920x1080   40.018832 Hz  16:9     44.021 kHz     93.500000 MHz (355 mm x 200 mm)
                 Hfront   48 Hsync  32 Hback  124 Hpol P
                 Vfront    3 Vsync   6 Vback   11 Vpol N
    Empty Descriptor
    Manufacturer-Specified Display Descriptor (0x02): 00 02 00 0b 40 ff 0a 3c 7d 14 16 2b 7d 00 00 00 '....@..<}..+}...'
Checksum: 0x07

----------------

Failures:

Block 0, Base EDID:
  Empty Descriptor: Use Dummy Descriptor instead of all zeroes.
  Missing Display Product Name.
  Missing Display Range Limits Descriptor.

EDID conformity: FAIL
