
EDID (hex):
00ffffffffffff001609f21cbe410000
050f01030c1f17b92e0cb5a057499b26
105054bfef8081808140714f00000000
000000000000302a009851002a403070
1300520e1100001e000000fe000a2020
20202020202020202020000000fd0038
4b1f530e000a202020202020000000fc
00454e373431300a202020202020000d

Extracted contents:
header:          00 ff ff ff ff ff ff 00
serial number:   16 09 f2 1c be 41 00 00 05 0f
version:         01 03
basic params:    0c 1f 17 b9 2e
chroma info:     0c b5 a0 57 49 9b 26 10 50 54
established:     bf ef 80
standard:        81 80 81 40 71 4f 00 00 00 00 00 00 00 00 00 00
descriptor 1:    30 2a 00 98 51 00 2a 40 30 70 13 00 52 0e 11 00 00 1e
descriptor 2:    00 00 00 fe 00 0a 20 20 20 20 20 20 20 20 20 20 20 20
descriptor 3:    00 00 00 fd 00 38 4b 1f 53 0e 00 0a 20 20 20 20 20 20
descriptor 4:    00 00 00 fc 00 45 4e 37 34 31 30 0a 20 20 20 20 20 20
extensions:      00
checksum:        0d

EDID version: 1.3
Manufacturer: EPI Model 1cf2 Serial Number --
Analog display, Input voltage level: 0.7/0.3 V
Sync: Separate Composite 
Maximum image size: 31 cm x 23 cm
Gamma: 2.85
DPMS levels: Off
RGB color display
Default (sRGB) color space is primary color space
First detailed timing is preferred timing
Display x,y Chromaticity:
  Red:   0.6250, 0.3398
  Green: 0.2880, 0.6054
  Blue:  0.1503, 0.0654
  White: 0.3134, 0.3291
Established timings supported:
  720x400@70Hz 9:5 HorFreq: 31469 Hz Clock: 28.320 MHz
  640x480@60Hz 4:3 HorFreq: 31469 Hz Clock: 25.175 MHz
  640x480@67Hz 4:3 HorFreq: 35000 Hz Clock: 30.240 MHz
  640x480@72Hz 4:3 HorFreq: 37900 Hz Clock: 31.500 MHz
  640x480@75Hz 4:3 HorFreq: 37500 Hz Clock: 31.500 MHz
  800x600@56Hz 4:3 HorFreq: 35200 Hz Clock: 36.000 MHz
  800x600@60Hz 4:3 HorFreq: 37900 Hz Clock: 40.000 MHz
  800x600@72Hz 4:3 HorFreq: 48100 Hz Clock: 50.000 MHz
  800x600@75Hz 4:3 HorFreq: 46900 Hz Clock: 49.500 MHz
  832x624@75Hz 4:3 HorFreq: 49726 Hz Clock: 57.284 MHz
  1024x768@60Hz 4:3 HorFreq: 48400 Hz Clock: 65.000 MHz
  1024x768@70Hz 4:3 HorFreq: 56500 Hz Clock: 75.000 MHz
  1024x768@75Hz 4:3 HorFreq: 60000 Hz Clock: 78.750 MHz
  1280x1024@75Hz 5:4 HorFreq: 80000 Hz Clock: 135.000 MHz
  1152x870@75Hz 192:145 HorFreq: 67500 Hz Clock: 108.000 MHz
Standard timings supported:
  1280x1024@60Hz 5:4 HorFreq: 64000 Hz Clock: 108.000 MHz
  1280x960@60Hz 4:3 HorFreq: 60000 Hz Clock: 108.000 MHz
  1152x864@75Hz 4:3 HorFreq: 67500 Hz Clock: 108.000 MHz
non-conformant standard timing (0 horiz)
non-conformant standard timing (0 horiz)
non-conformant standard timing (0 horiz)
non-conformant standard timing (0 horiz)
non-conformant standard timing (0 horiz)
Detailed mode: Clock 108.000 MHz, 338 mm x 270 mm
               1280 1328 1440 1688 hborder 0
               1024 1025 1028 1066 vborder 0
               +hsync +vsync 
               VertFreq: 60 Hz, HorFreq: 63981 Hz
ASCII string: 
Monitor ranges (GTF): 56-75Hz V, 31-83kHz H, max dotclock 140MHz
Monitor name: EN7410
Checksum: 0xd (valid)
EDID block does NOT conform to EDID 1.3!
	sRGB is signaled, but the chromaticities do not match
EDID block does not conform at all!
	Bad year of manufacture
