edid-decode (hex):

00 ff ff ff ff ff ff 00 40 89 30 00 01 00 00 00
05 16 01 04 81 33 1d 78 0a d2 b5 a3 58 53 9c 25
0f 50 54 21 08 00 01 01 01 01 01 01 01 01 01 01
01 01 01 01 01 01 02 3a 80 18 71 38 2d 40 58 2c
45 00 fd 1e 11 00 00 1e 00 00 00 fd 00 32 3e 1e
5a 14 55 00 c4 8e 21 00 00 1e 00 00 00 10 00 a0
29 50 30 20 35 00 55 50 21 00 00 1a 00 00 00 fc
00 54 46 2d 44 56 49 0a 20 20 20 20 20 20 00 3d

----------------

Block 0, Base EDID:
  EDID Structure Version & Revision: 1.4
  Vendor & Product Identification:
    Manufacturer: PDI
    Model: 48
    Serial Number: ...
    Made in: week 5 of 2012
  Basic Display Parameters & Features:
    Digital display
    Color depth is undefined
    DVI interface
    Maximum image size: 51 cm x 29 cm
    Gamma: 2.20
    Supported color formats: RGB 4:4:4, YCrCb 4:4:4
    First detailed timing includes the native pixel format and preferred refresh rate
  Color Characteristics:
    Red  : 0.6396, 0.3447
    Green: 0.3242, 0.6113
    Blue : 0.1464, 0.0615
    White: 0.3134, 0.3291
  Established Timings I & II:
    DMT 0x04:   640x480    59.940 Hz   4:3    31.469 kHz  25.175 MHz
    DMT 0x09:   800x600    60.317 Hz   4:3    37.879 kHz  40.000 MHz
    DMT 0x10:  1024x768    60.004 Hz   4:3    48.363 kHz  65.000 MHz
  Standard Timings: none
  Detailed Timing Descriptors:
    DTD 1:  1920x1080   60.000 Hz  16:9    67.500 kHz 148.500 MHz (509 mm x 286 mm)
                 Hfront   88 Hsync  44 Hback 148 Hpol P
                 Vfront    4 Vsync   5 Vback  36 Vpol P
  Display Range Limits:
    Monitor ranges (Unknown (0x55)): 50-62 Hz V, 30-90 kHz H, max dotclock 200 MHz
    Dummy Descriptor:
    Display Product Name: 'TF-DVI'
Checksum: 0x3d
