edid-decode (hex):

00 ff ff ff ff ff ff 00 09 e5 d3 08 00 00 00 00
01 1c 01 04 a5 26 15 78 03 de 50 a3 54 4c 99 26
0f 50 54 00 00 00 01 01 01 01 01 01 01 01 01 01
01 01 01 01 01 01 c4 36 80 cc 70 38 14 40 6c 30
aa 00 7e d7 10 00 00 1a 86 24 80 cc 70 38 14 40
6c 30 aa 00 7e d7 10 00 00 1a 00 00 00 00 00 00
00 00 00 00 00 00 00 00 00 00 00 00 00 00 00 02
00 09 33 ff 0a 3c 96 15 1b 44 96 00 00 00 00 ec

----------------

Block 0, Base EDID:
  EDID Structure Version & Revision: 1.4
  Vendor & Product Identification:
    Manufacturer: BOE
    Model: 2259
    Made in: week 1 of 2018
  Basic Display Parameters & Features:
    Digital display
    Bits per primary color channel: 8
    DisplayPort interface
    Maximum image size: 38 cm x 21 cm
    Gamma: 2.20
    Supported color formats: RGB 4:4:4
    First detailed timing includes the native pixel format and preferred refresh rate
    Display is continuous frequency
  Color Characteristics:
    Red  : 0.6396, 0.3291
    Green: 0.2998, 0.5996
    Blue : 0.1494, 0.0595
    White: 0.3125, 0.3281
  Established Timings I & II: none
  Standard Timings: none
  Detailed Timing Descriptors:
    DTD 1:  1920x1080   60.006848 Hz  16:9     66.008 kHz    140.200000 MHz (382 mm x 215 mm)
                 Hfront  108 Hsync  48 Hback   48 Hpol P
                 Vfront   10 Vsync  10 Vback    0 Vpol N
    DTD 2:  1920x1080   40.018832 Hz  16:9     44.021 kHz     93.500000 MHz (382 mm x 215 mm)
                 Hfront  108 Hsync  48 Hback   48 Hpol P
                 Vfront   10 Vsync  10 Vback    0 Vpol N
    Empty Descriptor
    Manufacturer-Specified Display Descriptor (0x02): 00 02 00 09 33 ff 0a 3c 96 15 1b 44 96 00 00 00 '....3..<...D....'
Checksum: 0xec

----------------

Failures:

Block 0, Base EDID:
  Detailed Timing Descriptor #1: 0 or negative vertical back porch.
  Detailed Timing Descriptor #2: 0 or negative vertical back porch.
  Empty Descriptor: Use Dummy Descriptor instead of all zeroes.
  Missing Display Product Name.
  Missing Display Range Limits Descriptor.

EDID conformity: FAIL
