edid-decode (hex):

00 ff ff ff ff ff ff 00 31 8c 00 00 00 00 00 00
14 15 01 03 68 30 1e 78 2a 58 20 97 53 50 90 26
1e 50 54 af cf 00 71 40 81 80 81 40 81 c0 01 01
01 01 01 01 01 01 d4 21 56 b0 51 00 23 30 40 70
36 00 30 e4 11 00 00 1e 66 21 50 b0 51 00 1b 30
00 70 26 44 30 e4 11 00 00 1e 64 19 00 40 41 00
26 30 a0 88 d6 04 30 e4 11 00 00 18 00 00 00 fd
00 38 4c 1e 53 14 00 0a 20 20 20 20 20 20 00 f5

----------------

Block 0, Base EDID:
  EDID Structure Version & Revision: 1.3
  Vendor & Product Identification:
    Manufacturer: LLL
    Model: 0
    Made in: week 20 of 2011
  Basic Display Parameters & Features:
    Analog display
    Input voltage level: 0.7/0.7 V
    Sync: Separate
    Maximum image size: 48 cm x 30 cm
    Gamma: 2.20
    DPMS levels: Off
    RGB color display
    First detailed timing is preferred timing
  Color Characteristics:
    Red  : 0.5908, 0.3251
    Green: 0.3144, 0.5625
    Blue : 0.1484, 0.1191
    White: 0.3125, 0.3281
  Established Timings I & II:
    IBM     :   720x400    70.082 Hz   9:5    31.467 kHz  28.320 MHz
    DMT 0x04:   640x480    59.940 Hz   4:3    31.469 kHz  25.175 MHz
    DMT 0x05:   640x480    72.809 Hz   4:3    37.861 kHz  31.500 MHz
    DMT 0x06:   640x480    75.000 Hz   4:3    37.500 kHz  31.500 MHz
    DMT 0x08:   800x600    56.250 Hz   4:3    35.156 kHz  36.000 MHz
    DMT 0x09:   800x600    60.317 Hz   4:3    37.879 kHz  40.000 MHz
    DMT 0x0a:   800x600    72.188 Hz   4:3    48.077 kHz  50.000 MHz
    DMT 0x0b:   800x600    75.000 Hz   4:3    46.875 kHz  49.500 MHz
    DMT 0x10:  1024x768    60.004 Hz   4:3    48.363 kHz  65.000 MHz
    DMT 0x11:  1024x768    70.069 Hz   4:3    56.476 kHz  75.000 MHz
    DMT 0x12:  1024x768    75.029 Hz   4:3    60.023 kHz  78.750 MHz
    DMT 0x24:  1280x1024   75.025 Hz   5:4    79.976 kHz 135.000 MHz
  Standard Timings:
    GTF     :  1152x864    60.000 Hz   4:3    53.700 kHz  81.624 MHz
    DMT 0x23:  1280x1024   60.020 Hz   5:4    63.981 kHz 108.000 MHz
    DMT 0x20:  1280x960    60.000 Hz   4:3    60.000 kHz 108.000 MHz
    DMT 0x55:  1280x720    60.000 Hz  16:9    45.000 kHz  74.250 MHz
  Detailed Timing Descriptors:
    DTD 1:  1366x768    59.981 Hz 683:384  48.165 kHz  86.600 MHz (304 mm x 484 mm)
                 Hfront   64 Hsync 112 Hback 256 Hpol P
                 Vfront    3 Vsync   6 Vback  26 Vpol P
    DTD 2:  1360x768    60.015 Hz  85:48   47.712 kHz  85.500 MHz (304 mm x 484 mm)
                 Hfront  256 Hsync 112 Hback  64 Hpol P
                 Vfront   18 Vsync   6 Vback   3 Vpol P
    DTD 3:  1024x768    60.004 Hz   4:3    48.363 kHz  65.000 MHz (304 mm x 484 mm)
                 Hfront  160 Hsync 136 Hback  24 Hpol N
                 Vfront   29 Vsync   6 Vback   3 Vpol N
  Display Range Limits:
    Monitor ranges (GTF): 56-76 Hz V, 30-83 kHz H, max dotclock 200 MHz
Checksum: 0xf5
