edid-decode (hex):

00 ff ff ff ff ff ff 00 30 ae 21 14 4e 61 bc 00
2b 16 01 03 81 1f 11 78 2a 9f e5 96 58 53 8a 26
24 50 54 00 00 00 01 01 01 01 01 01 01 01 01 01
01 01 01 01 01 01 20 1c 56 86 50 00 20 30 0e 38
13 00 35 ae 10 00 00 1e 00 00 00 ff 00 36 56 44
4b 31 39 30 32 0a 20 20 20 20 00 00 00 fd 00 32
4b 1e 53 09 00 0a 20 20 20 20 20 20 00 00 00 fc
00 4c 65 6e 6f 76 6f 20 4c 54 31 34 32 31 00 5c

----------------

Block 0, Base EDID:
  EDID Structure Version & Revision: 1.3
  Vendor & Product Identification:
    Manufacturer: LEN
    Model: 5153
    Serial Number: ...
    Made in: week 43 of 2012
  Basic Display Parameters & Features:
    Digital display
    DFP 1.x compatible TMDS
    Maximum image size: 31 cm x 17 cm
    Gamma: 2.20
    DPMS levels: Off
    RGB color display
    First detailed timing is the preferred timing
  Color Characteristics:
    Red  : 0.5878, 0.3447
    Green: 0.3271, 0.5419
    Blue : 0.1513, 0.1425
    White: 0.3134, 0.3291
  Established Timings I & II: none
  Standard Timings: none
  Detailed Timing Descriptors:
    DTD 1:  1366x768    60.000000 Hz 683:384   48.000 kHz     72.000000 MHz (309 mm x 174 mm)
                 Hfront   14 Hsync  56 Hback   64 Hpol P
                 Vfront    1 Vsync   3 Vback   28 Vpol P
    Display Product Serial Number: ...
    Display Range Limits:
      Monitor ranges (GTF): 50-75 Hz V, 30-83 kHz H, max dotclock 90 MHz
    Display Product Name: 'Lenovo LT1421'
Checksum: 0x5c

----------------

EDID conformity: PASS
