
EDID (hex):
00ffffffffffff004c2df502aa0b0000
21120103803a24a02a9875a95434af25
135054bfef80a94081808140714f0101
010101010101283c80a070b023403020
360006442100001ab225c05031b02d40
48603a0003441100001c000000fd0038
4b1e5111000a202020202020000000fc
0053796e634d61737465720a202000e2

Extracted contents:
header:          00 ff ff ff ff ff ff 00
serial number:   4c 2d f5 02 aa 0b 00 00 21 12
version:         01 03
basic params:    80 3a 24 a0 2a
chroma info:     98 75 a9 54 34 af 25 13 50 54
established:     bf ef 80
standard:        a9 40 81 80 81 40 71 4f 01 01 01 01 01 01 01 01
descriptor 1:    28 3c 80 a0 70 b0 23 40 30 20 36 00 06 44 21 00 00 1a
descriptor 2:    b2 25 c0 50 31 b0 2d 40 48 60 3a 00 03 44 11 00 00 1c
descriptor 3:    00 00 00 fd 00 38 4b 1e 51 11 00 0a 20 20 20 20 20 20
descriptor 4:    00 00 00 fc 00 53 79 6e 63 4d 61 73 74 65 72 0a 20 20
extensions:      00
checksum:        e2

EDID version: 1.3
Manufacturer: SAM Model 2f5 Serial Number --
Made in week 33 of 2008
Digital display
Maximum image size: 58 cm x 36 cm
Gamma: 2.60
DPMS levels: Off
RGB color display
First detailed timing is preferred timing
Display x,y Chromaticity:
  Red:   0.6621, 0.3291
  Green: 0.2050, 0.6835
  Blue:  0.1455, 0.0771
  White: 0.3134, 0.3291
Established timings supported:
  720x400@70Hz 9:5 HorFreq: 31469 Hz Clock: 28.320 MHz
  640x480@60Hz 4:3 HorFreq: 31469 Hz Clock: 25.175 MHz
  640x480@67Hz 4:3 HorFreq: 35000 Hz Clock: 30.240 MHz
  640x480@72Hz 4:3 HorFreq: 37900 Hz Clock: 31.500 MHz
  640x480@75Hz 4:3 HorFreq: 37500 Hz Clock: 31.500 MHz
  800x600@56Hz 4:3 HorFreq: 35200 Hz Clock: 36.000 MHz
  800x600@60Hz 4:3 HorFreq: 37900 Hz Clock: 40.000 MHz
  800x600@72Hz 4:3 HorFreq: 48100 Hz Clock: 50.000 MHz
  800x600@75Hz 4:3 HorFreq: 46900 Hz Clock: 49.500 MHz
  832x624@75Hz 4:3 HorFreq: 49726 Hz Clock: 57.284 MHz
  1024x768@60Hz 4:3 HorFreq: 48400 Hz Clock: 65.000 MHz
  1024x768@70Hz 4:3 HorFreq: 56500 Hz Clock: 75.000 MHz
  1024x768@75Hz 4:3 HorFreq: 60000 Hz Clock: 78.750 MHz
  1280x1024@75Hz 5:4 HorFreq: 80000 Hz Clock: 135.000 MHz
  1152x870@75Hz 192:145 HorFreq: 67500 Hz Clock: 108.000 MHz
Standard timings supported:
  1600x1200@60Hz 4:3 HorFreq: 75000 Hz Clock: 162.000 MHz
  1280x1024@60Hz 5:4 HorFreq: 64000 Hz Clock: 108.000 MHz
  1280x960@60Hz 4:3 HorFreq: 60000 Hz Clock: 108.000 MHz
  1152x864@75Hz 4:3 HorFreq: 67500 Hz Clock: 108.000 MHz
Detailed mode: Clock 154.000 MHz, 518 mm x 324 mm
               1920 1968 2000 2080 hborder 0
               1200 1203 1209 1235 vborder 0
               +hsync -vsync 
               VertFreq: 59 Hz, HorFreq: 74038 Hz
Detailed mode: Clock 96.500 MHz, 259 mm x 324 mm
                960 1032 1128 1296 hborder 0
               1200 1203 1213 1245 vborder 0
               -hsync +vsync 
               VertFreq: 59 Hz, HorFreq: 74459 Hz
Monitor ranges (GTF): 56-75Hz V, 30-81kHz H, max dotclock 170MHz
Monitor name: SyncMaster
Checksum: 0xe2 (valid)
