edid-decode (hex):

00 ff ff ff ff ff ff 00 4c 2d 1c 02 30 32 41 48
01 12 01 03 80 29 1e 78 2a ee 95 a3 54 4c 99 26
0f 50 54 bf ef 80 90 40 81 40 71 4f 81 80 01 01
01 01 01 01 01 01 8f 2f 78 d0 51 1a 27 40 58 90
34 00 98 2c 11 00 00 1d 00 00 00 fd 00 38 4b 1e
51 10 00 0a 20 20 20 20 20 20 00 00 00 fc 00 53
79 6e 63 4d 61 73 74 65 72 0a 20 20 00 00 00 ff
00 48 53 33 51 31 30 33 30 32 38 0a 20 20 00 b0

00 ff ff ff ff ff ff 00 4c 2d 1c 02 30 32 41 48
01 12 01 03 80 29 1e 78 2a ee 95 a3 54 4c 99 26
0f 50 54 bf ef 80 90 40 81 40 71 4f 81 80 01 01
01 01 01 01 01 01 8f 2f 78 d0 51 1a 27 40 58 90
34 00 98 2c 11 00 00 1d 00 00 00 fd 00 38 4b 1e
51 10 00 0a 20 20 20 20 20 20 00 00 00 fc 00 53
79 6e 63 4d 61 73 74 65 72 0a 20 20 00 00 00 ff
00 48 53 33 51 31 30 33 30 32 38 0a 20 20 00 b0

----------------

Block 0, Base EDID:
  EDID Structure Version & Revision: 1.3
  Vendor & Product Identification:
    Manufacturer: SAM
    Model: 540
    Serial Number: ...
    Made in: week 1 of 2008
  Basic Display Parameters & Features:
    Digital display
    Maximum image size: 41 cm x 30 cm
    Gamma: 2.20
    DPMS levels: Off
    RGB color display
    First detailed timing is the preferred timing
  Color Characteristics:
    Red  : 0.6396, 0.3300
    Green: 0.2998, 0.5996
    Blue : 0.1503, 0.0595
    White: 0.3134, 0.3291
  Established Timings I & II:
    IBM     :   720x400    70.081663 Hz   9:5     31.467 kHz     28.320000 MHz
    DMT 0x04:   640x480    59.940476 Hz   4:3     31.469 kHz     25.175000 MHz
    Apple   :   640x480    66.666667 Hz   4:3     35.000 kHz     30.240000 MHz
    DMT 0x05:   640x480    72.808802 Hz   4:3     37.861 kHz     31.500000 MHz
    DMT 0x06:   640x480    75.000000 Hz   4:3     37.500 kHz     31.500000 MHz
    DMT 0x08:   800x600    56.250000 Hz   4:3     35.156 kHz     36.000000 MHz
    DMT 0x09:   800x600    60.316541 Hz   4:3     37.879 kHz     40.000000 MHz
    DMT 0x0a:   800x600    72.187572 Hz   4:3     48.077 kHz     50.000000 MHz
    DMT 0x0b:   800x600    75.000000 Hz   4:3     46.875 kHz     49.500000 MHz
    Apple   :   832x624    74.551266 Hz   4:3     49.726 kHz     57.284000 MHz
    DMT 0x10:  1024x768    60.003840 Hz   4:3     48.363 kHz     65.000000 MHz
    DMT 0x11:  1024x768    70.069359 Hz   4:3     56.476 kHz     75.000000 MHz
    DMT 0x12:  1024x768    75.028582 Hz   4:3     60.023 kHz     78.750000 MHz
    DMT 0x24:  1280x1024   75.024675 Hz   5:4     79.976 kHz    135.000000 MHz
    Apple   :  1152x870    75.061550 Hz 192:145   68.681 kHz    100.000000 MHz
  Standard Timings:
    DMT 0x2a:  1400x1050   59.978442 Hz   4:3     65.317 kHz    121.750000 MHz
    DMT 0x20:  1280x960    60.000000 Hz   4:3     60.000 kHz    108.000000 MHz
    DMT 0x15:  1152x864    75.000000 Hz   4:3     67.500 kHz    108.000000 MHz
    DMT 0x23:  1280x1024   60.019740 Hz   5:4     63.981 kHz    108.000000 MHz
  Detailed Timing Descriptors:
    DTD 1:  1400x1050   59.978442 Hz   4:3     65.317 kHz    121.750000 MHz (408 mm x 300 mm)
                 Hfront   88 Hsync 144 Hback  232 Hpol N
                 Vfront    3 Vsync   4 Vback   32 Vpol P
    Display Range Limits:
      Monitor ranges (GTF): 56-75 Hz V, 30-81 kHz H, max dotclock 160 MHz
    Display Product Name: 'SyncMaster'
    Display Product Serial Number: ...
Checksum: 0xb0

----------------

Block 1, Unknown EDID Extension Block 0x00:
  00 ff ff ff ff ff ff 00 4c 2d 1c 02 30 32 41 48 '........L-..02AH'
  01 12 01 03 80 29 1e 78 2a ee 95 a3 54 4c 99 26 '.....).x*...TL.&'
  0f 50 54 bf ef 80 90 40 81 40 71 4f 81 80 01 01 '.PT....@.@qO....'
  01 01 01 01 01 01 8f 2f 78 d0 51 1a 27 40 58 90 '......./x.Q.'@X.'
  34 00 98 2c 11 00 00 1d 00 00 00 fd 00 38 4b 1e '4..,.........8K.'
  51 10 00 0a 20 20 20 20 20 20 00 00 00 fc 00 53 'Q...      .....S'
  79 6e 63 4d 61 73 74 65 72 0a 20 20 00 00 00 ff 'yncMaster.  ....'
  00 48 53 33 51 31 30 33 30 32 38 0a 20 20 00 b0 '.HS3Q103028.  ..'
Checksum: 0xb0

----------------

Failures:

Block 1, Base EDID:
  Unknown Extension Block.
EDID:
  Base EDID: EDID specified 0 extension block(s), but found 1 extension block(s).

EDID conformity: FAIL
