
EDID (hex):
00ffffffffffff0009e51f0700000000
011a0104a522137802a707a55954a227
134f5500000001010101010101010101
0101010101014dd000a0f0703e803020
350059c21000001a0000000000000000
00000000000000000000000000fe0042
4f452048460a202020202020000000fe
004e5631353651554d2d4e33320a00e2

Extracted contents:
header:          00 ff ff ff ff ff ff 00
serial number:   09 e5 1f 07 00 00 00 00 01 1a
version:         01 04
basic params:    a5 22 13 78 02
chroma info:     a7 07 a5 59 54 a2 27 13 4f 55
established:     00 00 00
standard:        01 01 01 01 01 01 01 01 01 01 01 01 01 01 01 01
descriptor 1:    4d d0 00 a0 f0 70 3e 80 30 20 35 00 59 c2 10 00 00 1a
descriptor 2:    00 00 00 00 00 00 00 00 00 00 00 00 00 00 00 00 00 00
descriptor 3:    00 00 00 fe 00 42 4f 45 20 48 46 0a 20 20 20 20 20 20
descriptor 4:    00 00 00 fe 00 4e 56 31 35 36 51 55 4d 2d 4e 33 32 0a
extensions:      00
checksum:        e2

EDID version: 1.4
Manufacturer: BOE Model 71f Serial Number --
Made in week 1 of 2016
Digital display
8 bits per primary color channel
DisplayPort interface
Maximum image size: 34 cm x 19 cm
Gamma: 2.20
Supported color formats: RGB 4:4:4
First detailed timing includes the native pixel format and preferred refresh rate
Display x,y Chromaticity:
  Red:   0.6464, 0.3496
  Green: 0.3291, 0.6357
  Blue:  0.1523, 0.0742
  White: 0.3095, 0.3349
Established timings supported:
Standard timings supported:
Detailed mode: Clock 533.250 MHz, 345 mm x 194 mm
               3840 3888 3920 4000 hborder 0
               2160 2163 2168 2222 vborder 0
               +hsync -vsync 
               VertFreq: 59 Hz, HorFreq: 133312 Hz
Manufacturer-specified data, tag 0
ASCII string: BOE HF
ASCII string: NV156QUM-N32
Checksum: 0xe2 (valid)
EDID block does NOT conform to EDID 1.4!
	Missing name descriptor
	Missing monitor ranges
