edid-decode (hex):

00 ff ff ff ff ff ff 00 4e 14 cc 0b 00 00 00 00
34 20 01 04 b5 45 1d 78 2b d7 55 a6 56 50 a1 26
0f 50 54 bf ef 80 81 c0 81 00 81 40 81 80 95 00
a9 c0 b3 00 d1 c0 b8 47 00 a0 a0 38 2d 40 30 20
35 00 b2 23 21 00 00 1a 00 00 00 fd 00 30 c8 e6
e6 42 01 0a 20 20 20 20 20 20 00 00 00 fc 00 53
63 65 70 74 72 65 20 50 33 30 0a 20 00 00 00 ff
00 30 30 0a 20 20 20 20 20 20 20 20 20 20 01 14

02 03 2b f1 45 01 02 03 04 90 23 08 1f 07 83 01
00 00 6d 1a 00 00 02 01 30 c8 00 00 00 00 00 00
e3 05 e3 01 e6 06 07 01 60 60 00 ff f4 00 04 a1
38 20 40 30 40 35 00 b2 23 21 00 00 1a 3a c5 00
a0 a0 38 2d 40 30 40 35 00 b2 23 21 00 00 1a 70
8f 00 a0 a0 38 2d 40 30 40 35 00 b2 23 21 00 00
1a 20 ac 00 a0 a0 38 2d 40 30 40 35 00 b2 23 21
00 00 1a 00 00 00 00 00 00 00 00 00 00 00 00 ac

00 ff ff ff ff ff ff 00 4e 14 cc 0b 00 00 00 00
34 20 01 04 b5 45 1d 78 2b d7 55 a6 56 50 a1 26
0f 50 54 bf ef 80 81 c0 81 00 81 40 81 80 95 00
a9 c0 b3 00 d1 c0 b8 47 00 a0 a0 38 2d 40 30 20
35 00 b2 23 21 00 00 1a 00 00 00 fd 00 30 c8 e6
e6 42 01 0a 20 20 20 20 20 20 00 00 00 fc 00 53
63 65 70 74 72 65 20 50 33 30 0a 20 00 00 00 ff
00 30 30 0a 20 20 20 20 20 20 20 20 20 20 01 14

02 03 2b f1 45 01 02 03 04 90 23 08 1f 07 83 01
00 00 6d 1a 00 00 02 01 30 c8 00 00 00 00 00 00
e3 05 e3 01 e6 06 07 01 60 60 00 ff f4 00 04 a1
38 20 40 30 40 35 00 b2 23 21 00 00 1a 3a c5 00
a0 a0 38 2d 40 30 40 35 00 b2 23 21 00 00 1a 70
8f 00 a0 a0 38 2d 40 30 40 35 00 b2 23 21 00 00
1a 20 ac 00 a0 a0 38 2d 40 30 40 35 00 b2 23 21
00 00 1a 00 00 00 00 00 00 00 00 00 00 00 00 ac

----------------

Block 0, Base EDID:
  EDID Structure Version & Revision: 1.4
  Vendor & Product Identification:
    Manufacturer: SPT
    Model: 3020
    Made in: week 52 of 2022
  Basic Display Parameters & Features:
    Digital display
    Bits per primary color channel: 10
    DisplayPort interface
    Maximum image size: 69 cm x 29 cm
    Gamma: 2.20
    DPMS levels: Off
    Supported color formats: RGB 4:4:4, YCrCb 4:4:4
    First detailed timing includes the native pixel format and preferred refresh rate
    Display is continuous frequency
  Color Characteristics:
    Red  : 0.6513, 0.3369
    Green: 0.3134, 0.6318
    Blue : 0.1494, 0.0595
    White: 0.3134, 0.3291
  Established Timings I & II:
    IBM     :   720x400    70.081663 Hz   9:5     31.467 kHz     28.320000 MHz
    DMT 0x04:   640x480    59.940476 Hz   4:3     31.469 kHz     25.175000 MHz
    Apple   :   640x480    66.666667 Hz   4:3     35.000 kHz     30.240000 MHz
    DMT 0x05:   640x480    72.808802 Hz   4:3     37.861 kHz     31.500000 MHz
    DMT 0x06:   640x480    75.000000 Hz   4:3     37.500 kHz     31.500000 MHz
    DMT 0x08:   800x600    56.250000 Hz   4:3     35.156 kHz     36.000000 MHz
    DMT 0x09:   800x600    60.316541 Hz   4:3     37.879 kHz     40.000000 MHz
    DMT 0x0a:   800x600    72.187572 Hz   4:3     48.077 kHz     50.000000 MHz
    DMT 0x0b:   800x600    75.000000 Hz   4:3     46.875 kHz     49.500000 MHz
    Apple   :   832x624    74.551266 Hz   4:3     49.726 kHz     57.284000 MHz
    DMT 0x10:  1024x768    60.003840 Hz   4:3     48.363 kHz     65.000000 MHz
    DMT 0x11:  1024x768    70.069359 Hz   4:3     56.476 kHz     75.000000 MHz
    DMT 0x12:  1024x768    75.028582 Hz   4:3     60.023 kHz     78.750000 MHz
    DMT 0x24:  1280x1024   75.024675 Hz   5:4     79.976 kHz    135.000000 MHz
    Apple   :  1152x870    75.061550 Hz 192:145   68.681 kHz    100.000000 MHz
  Standard Timings:
    DMT 0x55:  1280x720    60.000000 Hz  16:9     45.000 kHz     74.250000 MHz
    DMT 0x1c:  1280x800    59.810326 Hz  16:10    49.702 kHz     83.500000 MHz
    DMT 0x20:  1280x960    60.000000 Hz   4:3     60.000 kHz    108.000000 MHz
    DMT 0x23:  1280x1024   60.019740 Hz   5:4     63.981 kHz    108.000000 MHz
    DMT 0x2f:  1440x900    59.887445 Hz  16:10    55.935 kHz    106.500000 MHz
    DMT 0x53:  1600x900    60.000000 Hz  16:9     60.000 kHz    108.000000 MHz (RB)
    DMT 0x3a:  1680x1050   59.954250 Hz  16:10    65.290 kHz    146.250000 MHz
    DMT 0x52:  1920x1080   60.000000 Hz  16:9     67.500 kHz    148.500000 MHz
  Detailed Timing Descriptors:
    DTD 1:  2560x1080   60.000000 Hz  64:27    67.500 kHz    183.600000 MHz (690 mm x 291 mm)
                 Hfront   48 Hsync  32 Hback   80 Hpol P
                 Vfront    3 Vsync   5 Vback   37 Vpol N
    Display Range Limits:
      Monitor ranges (Bare Limits): 48-200 Hz V, 230-230 kHz H, max dotclock 660 MHz
    Display Product Name: 'Sceptre P30'
    Display Product Serial Number: ...
  Extension blocks: 1
Checksum: 0x14

----------------

Block 1, CTA-861 Extension Block:
  Revision: 3
  Underscans IT Video Formats by default
  Basic audio support
  Supports YCbCr 4:4:4
  Supports YCbCr 4:2:2
  Native detailed modes: 1
  Video Data Block:
    VIC   1:   640x480    59.940476 Hz   4:3     31.469 kHz     25.175000 MHz
    VIC   2:   720x480    59.940060 Hz   4:3     31.469 kHz     27.000000 MHz
    VIC   3:   720x480    59.940060 Hz  16:9     31.469 kHz     27.000000 MHz
    VIC   4:  1280x720    60.000000 Hz  16:9     45.000 kHz     74.250000 MHz
    VIC  16:  1920x1080   60.000000 Hz  16:9     67.500 kHz    148.500000 MHz (native)
  Audio Data Block:
    Linear PCM:
      Max channels: 1
      Supported sample rates (kHz): 96 88.2 48 44.1 32
      Supported sample sizes (bits): 24 20 16
  Speaker Allocation Data Block:
    FL/FR - Front Left/Right
  Vendor-Specific Data Block (AMD), OUI 00-00-1A:
    Version: 2.1
    Minimum Refresh Rate: 48 Hz
    Maximum Refresh Rate: 200 Hz
    Flags 1.x: 0x00
    Flags 2.x: 0x00
    Maximum luminance: 0 (50.000 cd/m^2)
    Minimum luminance: 0 (0.000 cd/m^2)
    Unknown: 0x00 0x00
  Colorimetry Data Block:
    xvYCC601
    xvYCC709
    BT2020cYCC
    BT2020YCC
    BT2020RGB
    Gamut Boundary Description Metadata Profile P0
  HDR Static Metadata Data Block:
    Electro optical transfer functions:
      Traditional gamma - SDR luminance range
      Traditional gamma - HDR luminance range
      SMPTE ST2084
    Supported static metadata descriptors:
      Static metadata type 1
    Desired content max luminance: 96 (400.000 cd/m^2)
    Desired content max frame-average luminance: 96 (400.000 cd/m^2)
    Desired content min luminance: 0 (0.000 cd/m^2)
  Detailed Timing Descriptors:
    DTD 2:  2560x1080  200.007016 Hz  64:27   222.408 kHz    627.190000 MHz (690 mm x 291 mm)
                 Hfront   48 Hsync  64 Hback  148 Hpol P
                 Vfront    3 Vsync   5 Vback   24 Vpol N
    DTD 3:  2560x1080  165.000000 Hz  64:27   185.625 kHz    504.900000 MHz (690 mm x 291 mm)
                 Hfront   48 Hsync  64 Hback   48 Hpol P
                 Vfront    3 Vsync   5 Vback   37 Vpol N
    DTD 4:  2560x1080  120.000000 Hz  64:27   135.000 kHz    367.200000 MHz (690 mm x 291 mm)
                 Hfront   48 Hsync  64 Hback   48 Hpol P
                 Vfront    3 Vsync   5 Vback   37 Vpol N
    DTD 5:  2560x1080  144.000000 Hz  64:27   162.000 kHz    440.640000 MHz (690 mm x 291 mm)
                 Hfront   48 Hsync  64 Hback   48 Hpol P
                 Vfront    3 Vsync   5 Vback   37 Vpol N
Checksum: 0xac  Unused space in Extension Block: 12 bytes

----------------

Block 2, Unknown EDID Extension Block 0x00:
  00 ff ff ff ff ff ff 00 4e 14 cc 0b 00 00 00 00 '........N.......'
  34 20 01 04 b5 45 1d 78 2b d7 55 a6 56 50 a1 26 '4 ...E.x+.U.VP.&'
  0f 50 54 bf ef 80 81 c0 81 00 81 40 81 80 95 00 '.PT........@....'
  a9 c0 b3 00 d1 c0 b8 47 00 a0 a0 38 2d 40 30 20 '.......G...8-@0 '
  35 00 b2 23 21 00 00 1a 00 00 00 fd 00 30 c8 e6 '5..#!........0..'
  e6 42 01 0a 20 20 20 20 20 20 00 00 00 fc 00 53 '.B..      .....S'
  63 65 70 74 72 65 20 50 33 30 0a 20 00 00 00 ff 'ceptre P30. ....'
  00 30 30 0a 20 20 20 20 20 20 20 20 20 20 01 14 '.00.          ..'
Checksum: 0x14

----------------

Block 3, CTA-861 Extension Block:
  Revision: 3
  Underscans IT Video Formats by default
  Basic audio support
  Supports YCbCr 4:4:4
  Supports YCbCr 4:2:2
  Native detailed modes: 1
  Video Data Block:
    VIC   1:   640x480    59.940476 Hz   4:3     31.469 kHz     25.175000 MHz
    VIC   2:   720x480    59.940060 Hz   4:3     31.469 kHz     27.000000 MHz
    VIC   3:   720x480    59.940060 Hz  16:9     31.469 kHz     27.000000 MHz
    VIC   4:  1280x720    60.000000 Hz  16:9     45.000 kHz     74.250000 MHz
    VIC  16:  1920x1080   60.000000 Hz  16:9     67.500 kHz    148.500000 MHz (native)
  Audio Data Block:
    Linear PCM:
      Max channels: 1
      Supported sample rates (kHz): 96 88.2 48 44.1 32
      Supported sample sizes (bits): 24 20 16
  Speaker Allocation Data Block:
    FL/FR - Front Left/Right
  Vendor-Specific Data Block (AMD), OUI 00-00-1A:
    Version: 2.1
    Minimum Refresh Rate: 48 Hz
    Maximum Refresh Rate: 200 Hz
    Flags 1.x: 0x00
    Flags 2.x: 0x00
    Maximum luminance: 0 (50.000 cd/m^2)
    Minimum luminance: 0 (0.000 cd/m^2)
    Unknown: 0x00 0x00
  Colorimetry Data Block:
    xvYCC601
    xvYCC709
    BT2020cYCC
    BT2020YCC
    BT2020RGB
    Gamut Boundary Description Metadata Profile P0
  HDR Static Metadata Data Block:
    Electro optical transfer functions:
      Traditional gamma - SDR luminance range
      Traditional gamma - HDR luminance range
      SMPTE ST2084
    Supported static metadata descriptors:
      Static metadata type 1
    Desired content max luminance: 96 (400.000 cd/m^2)
    Desired content max frame-average luminance: 96 (400.000 cd/m^2)
    Desired content min luminance: 0 (0.000 cd/m^2)
  Detailed Timing Descriptors:
    DTD 6:  2560x1080  200.007016 Hz  64:27   222.408 kHz    627.190000 MHz (690 mm x 291 mm)
                 Hfront   48 Hsync  64 Hback  148 Hpol P
                 Vfront    3 Vsync   5 Vback   24 Vpol N
    DTD 7:  2560x1080  165.000000 Hz  64:27   185.625 kHz    504.900000 MHz (690 mm x 291 mm)
                 Hfront   48 Hsync  64 Hback   48 Hpol P
                 Vfront    3 Vsync   5 Vback   37 Vpol N
    DTD 8:  2560x1080  120.000000 Hz  64:27   135.000 kHz    367.200000 MHz (690 mm x 291 mm)
                 Hfront   48 Hsync  64 Hback   48 Hpol P
                 Vfront    3 Vsync   5 Vback   37 Vpol N
    DTD 9:  2560x1080  144.000000 Hz  64:27   162.000 kHz    440.640000 MHz (690 mm x 291 mm)
                 Hfront   48 Hsync  64 Hback   48 Hpol P
                 Vfront    3 Vsync   5 Vback   37 Vpol N
Checksum: 0xac  Unused space in Extension Block: 12 bytes

----------------

Warnings:

Block 1, CTA-861 Extension Block:
  Colorimetry Data Block: Set the sRGB colorimetry bit to avoid interop issues.
Block 3, CTA-861 Extension Block:
  Colorimetry Data Block: Set the sRGB colorimetry bit to avoid interop issues.
EDID:
  Base EDID: Some timings are out of range of the Monitor Ranges:
    Horizontal Freq: 31.466 - 222.407 kHz (Monitor: 230.000 - 230.000 kHz)

Failures:

Block 1, CTA-861 Extension Block:
  Missing VCDB, needed for Set Selectable RGB Quantization to avoid interop issues.
Block 2, Base EDID:
  Unknown Extension Block.
Block 3, CTA-861 Extension Block:
  Video Data Block: Duplicate VIC 1.
  Video Data Block: Duplicate VIC 2.
  Video Data Block: Duplicate VIC 3.
  Video Data Block: Duplicate VIC 4.
  Video Data Block: Duplicate VIC 16.
  Speaker Allocation Data Block: Only one instance of this Data Block is allowed.
  Colorimetry Data Block: Only one instance of this Data Block is allowed.
  HDR Static Metadata Data Block: Only one instance of this Data Block is allowed.
  Missing VCDB, needed for Set Selectable RGB Quantization to avoid interop issues.
EDID:
  Base EDID: EDID specified 1 extension block(s), but found 3 extension block(s).
  CTA-861: Native progressive timings are a mix of several resolutions.

EDID conformity: FAIL
