edid-decode (hex):

00 ff ff ff ff ff ff 00 4e 14 cc 0b 00 00 00 00
18 1d 01 04 a5 45 1d 78 3f ee d5 a3 54 4c 99 23
0f 50 54 a5 4b 00 71 4f 81 c0 81 80 8b c0 95 00
a9 c0 b3 00 d1 c0 b8 47 00 a0 a0 38 2d 40 30 20
35 00 b2 23 21 00 00 1a 00 00 00 fd 00 30 c8 f5
f5 40 01 0a 20 20 20 20 20 20 00 00 00 fc 00 53
63 65 70 74 72 65 20 50 33 30 0a 20 00 00 00 ff
00 30 30 30 30 30 30 30 30 30 30 30 30 30 01 3f

02 03 22 f1 4c 01 02 03 04 05 90 11 12 13 14 1f
3f 23 09 07 07 83 01 00 00 68 1a 00 00 01 01 30
c8 00 fc f4 00 04 a1 38 20 40 30 40 35 00 b2 23
21 00 00 1e d4 29 00 18 51 38 40 40 b0 58 8a 00
b2 23 21 00 00 1e 13 90 00 a0 a0 38 32 40 30 40
35 00 b2 23 21 00 00 1e 4a aa 00 a0 a0 38 21 40
30 40 35 00 b2 23 21 00 00 1a 00 00 00 00 00 00
00 00 00 00 00 00 00 00 00 00 00 00 00 00 00 a9

----------------

Block 0, Base EDID:
  EDID Structure Version & Revision: 1.4
  Vendor & Product Identification:
    Manufacturer: SPT
    Model: 3020
    Made in: week 24 of 2019
  Basic Display Parameters & Features:
    Digital display
    Bits per primary color channel: 8
    DisplayPort interface
    Maximum image size: 69 cm x 29 cm
    Gamma: 2.20
    DPMS levels: Off
    Supported color formats: RGB 4:4:4, YCrCb 4:4:4, YCrCb 4:2:2
    Default (sRGB) color space is primary color space
    First detailed timing includes the native pixel format and preferred refresh rate
    Display is continuous frequency
  Color Characteristics:
    Red  : 0.6396, 0.3300
    Green: 0.2998, 0.5996
    Blue : 0.1396, 0.0595
    White: 0.3134, 0.3291
  Established Timings I & II:
    IBM     :   720x400    70.082 Hz   9:5    31.467 kHz  28.320 MHz
    DMT 0x04:   640x480    59.940 Hz   4:3    31.469 kHz  25.175 MHz
    DMT 0x06:   640x480    75.000 Hz   4:3    37.500 kHz  31.500 MHz
    DMT 0x09:   800x600    60.317 Hz   4:3    37.879 kHz  40.000 MHz
    DMT 0x0b:   800x600    75.000 Hz   4:3    46.875 kHz  49.500 MHz
    DMT 0x10:  1024x768    60.004 Hz   4:3    48.363 kHz  65.000 MHz
    DMT 0x12:  1024x768    75.029 Hz   4:3    60.023 kHz  78.750 MHz
    DMT 0x24:  1280x1024   75.025 Hz   5:4    79.976 kHz 135.000 MHz
  Standard Timings:
    DMT 0x15:  1152x864    75.000 Hz   4:3    67.500 kHz 108.000 MHz
    DMT 0x55:  1280x720    60.000 Hz  16:9    45.000 kHz  74.250 MHz
    DMT 0x23:  1280x1024   60.020 Hz   5:4    63.981 kHz 108.000 MHz
    CVT     :  1360x768    59.799 Hz  16:9    47.720 kHz  84.750 MHz (EDID 1.4 source)
    GTF     :  1360x768    60.000 Hz  16:9    47.700 kHz  84.715 MHz (EDID 1.3 source)
    DMT 0x2f:  1440x900    59.887 Hz  16:10   55.935 kHz 106.500 MHz
    DMT 0x53:  1600x900    60.000 Hz  16:9    60.000 kHz 108.000 MHz (RB)
    DMT 0x3a:  1680x1050   59.954 Hz  16:10   65.290 kHz 146.250 MHz
    DMT 0x52:  1920x1080   60.000 Hz  16:9    67.500 kHz 148.500 MHz
  Detailed Timing Descriptors:
    DTD 1:  2560x1080   60.000 Hz  64:27   67.500 kHz 183.600 MHz (690 mm x 291 mm)
                 Hfront   48 Hsync  32 Hback  80 Hpol P
                 Vfront    3 Vsync   5 Vback  37 Vpol N
  Display Range Limits:
    Monitor ranges (Bare Limits): 48-200 Hz V, 245-245 kHz H, max dotclock 640 MHz
    Display Product Name: 'Sceptre P30'
    Display Product Serial Number: ...
  Extension blocks: 1
Checksum: 0x3f

----------------

Block 1, CTA-861 Extension Block:
  Revision: 3
  Underscans IT Video Formats by default
  Basic audio support
  Supports YCbCr 4:4:4
  Supports YCbCr 4:2:2
  Native detailed modes: 1
  Video Data Block:
    VIC   1:   640x480    59.940 Hz   4:3    31.469 kHz  25.175 MHz
    VIC   2:   720x480    59.940 Hz   4:3    31.469 kHz  27.000 MHz
    VIC   3:   720x480    59.940 Hz  16:9    31.469 kHz  27.000 MHz
    VIC   4:  1280x720    60.000 Hz  16:9    45.000 kHz  74.250 MHz
    VIC   5:  1920x1080i  60.000 Hz  16:9    33.750 kHz  74.250 MHz
    VIC  16:  1920x1080   60.000 Hz  16:9    67.500 kHz 148.500 MHz (native)
    VIC  17:   720x576    50.000 Hz   4:3    31.250 kHz  27.000 MHz
    VIC  18:   720x576    50.000 Hz  16:9    31.250 kHz  27.000 MHz
    VIC  19:  1280x720    50.000 Hz  16:9    37.500 kHz  74.250 MHz
    VIC  20:  1920x1080i  50.000 Hz  16:9    28.125 kHz  74.250 MHz
    VIC  31:  1920x1080   50.000 Hz  16:9    56.250 kHz 148.500 MHz
    VIC  63:  1920x1080  120.000 Hz  16:9   135.000 kHz 297.000 MHz
  Audio Data Block:
    Linear PCM:
      Max channels: 2
      Supported sample rates (kHz): 48 44.1 32
      Supported sample sizes (bits): 24 20 16
  Speaker Allocation Data Block:
    FL/FR - Front Left/Right
  Vendor-Specific Data Block (AMD), OUI 00-00-1A:
    Version: 1.1
    Minimum Refresh Rate: 48 Hz
    Maximum Refresh Rate: 200 Hz
    Flags 1.x: 0x00
  Detailed Timing Descriptors:
    DTD 2:  2560x1080  199.997 Hz  64:27  222.397 kHz 627.160 MHz (690 mm x 291 mm)
                 Hfront   48 Hsync  64 Hback 148 Hpol P
                 Vfront    3 Vsync   5 Vback  24 Vpol P
    DTD 3:  1280x1080   60.001 Hz  32:27   68.641 kHz 107.080 MHz (690 mm x 291 mm)
                 Hfront  176 Hsync  88 Hback  16 Hpol P
                 Vfront    8 Vsync  10 Vback  46 Vpol P
    DTD 4:  2560x1080  119.999 Hz  64:27  135.599 kHz 368.830 MHz (690 mm x 291 mm)
                 Hfront   48 Hsync  64 Hback  48 Hpol P
                 Vfront    3 Vsync   5 Vback  42 Vpol P
    DTD 5:  2560x1080  144.000 Hz  64:27  160.272 kHz 435.940 MHz (690 mm x 291 mm)
                 Hfront   48 Hsync  64 Hback  48 Hpol P
                 Vfront    3 Vsync   5 Vback  25 Vpol N
Checksum: 0xa9

----------------

Warnings:

Block 1, CTA-861 Extension Block:
  Missing VCDB, needed for Set Selectable RGB Quantization to avoid interop issues.
EDID:
  Base EDID: Some timings are out of range of the Monitor Ranges:
    Horizontal Freq: 28.125 - 222.397 kHz (Monitor: 245.000 - 245.000 kHz)

Failures:

Block 0, Base EDID:
  Basic Display Parameters & Features: sRGB is signaled, but the chromaticities do not match.
EDID:
  Base EDID: GTF timings are used, but the EDID does not signal GTF support.
  Base EDID: CVT timings are used, but the EDID does not signal CVT support.
  CTA-861: Native progressive timings are a mix of several resolutions.

EDID conformity: FAIL
