
EDID (hex):
00ffffffffffff005a6318f601010101
170f010318221b782e8a15a358499d24
165054bfef8081808140714f01010101
010101010101302a009851002a403070
1300520e1100001e000000ff00413334
3035323330323037380a000000fd0032
4b1e500e000a202020202020000000fc
005645373130620a2020202020200074

Extracted contents:
header:          00 ff ff ff ff ff ff 00
serial number:   5a 63 18 f6 01 01 01 01 17 0f
version:         01 03
basic params:    18 22 1b 78 2e
chroma info:     8a 15 a3 58 49 9d 24 16 50 54
established:     bf ef 80
standard:        81 80 81 40 71 4f 01 01 01 01 01 01 01 01 01 01
descriptor 1:    30 2a 00 98 51 00 2a 40 30 70 13 00 52 0e 11 00 00 1e
descriptor 2:    00 00 00 ff 00 41 33 34 30 35 32 33 30 32 30 37 38 0a
descriptor 3:    00 00 00 fd 00 32 4b 1e 50 0e 00 0a 20 20 20 20 20 20
descriptor 4:    00 00 00 fc 00 56 45 37 31 30 62 0a 20 20 20 20 20 20
extensions:      00
checksum:        74

EDID version: 1.3
Manufacturer: VSC Model f618 Serial Number --
Analog display, Input voltage level: 0.7/0.3 V
Configurable signal levels
Sync: Separate 
Maximum image size: 34 cm x 27 cm
Gamma: 2.20
DPMS levels: Off
RGB color display
Default (sRGB) color space is primary color space
First detailed timing is preferred timing
Display x,y Chromaticity:
  Red:   0.6386, 0.3437
  Green: 0.2871, 0.6152
  Blue:  0.1406, 0.0869
  White: 0.3134, 0.3291
Established timings supported:
  720x400@70Hz 9:5 HorFreq: 31469 Hz Clock: 28.320 MHz
  640x480@60Hz 4:3 HorFreq: 31469 Hz Clock: 25.175 MHz
  640x480@67Hz 4:3 HorFreq: 35000 Hz Clock: 30.240 MHz
  640x480@72Hz 4:3 HorFreq: 37900 Hz Clock: 31.500 MHz
  640x480@75Hz 4:3 HorFreq: 37500 Hz Clock: 31.500 MHz
  800x600@56Hz 4:3 HorFreq: 35200 Hz Clock: 36.000 MHz
  800x600@60Hz 4:3 HorFreq: 37900 Hz Clock: 40.000 MHz
  800x600@72Hz 4:3 HorFreq: 48100 Hz Clock: 50.000 MHz
  800x600@75Hz 4:3 HorFreq: 46900 Hz Clock: 49.500 MHz
  832x624@75Hz 4:3 HorFreq: 49726 Hz Clock: 57.284 MHz
  1024x768@60Hz 4:3 HorFreq: 48400 Hz Clock: 65.000 MHz
  1024x768@70Hz 4:3 HorFreq: 56500 Hz Clock: 75.000 MHz
  1024x768@75Hz 4:3 HorFreq: 60000 Hz Clock: 78.750 MHz
  1280x1024@75Hz 5:4 HorFreq: 80000 Hz Clock: 135.000 MHz
  1152x870@75Hz 192:145 HorFreq: 67500 Hz Clock: 108.000 MHz
Standard timings supported:
  1280x1024@60Hz 5:4 HorFreq: 64000 Hz Clock: 108.000 MHz
  1280x960@60Hz 4:3 HorFreq: 60000 Hz Clock: 108.000 MHz
  1152x864@75Hz 4:3 HorFreq: 67500 Hz Clock: 108.000 MHz
Detailed mode: Clock 108.000 MHz, 338 mm x 270 mm
               1280 1328 1440 1688 hborder 0
               1024 1025 1028 1066 vborder 0
               +hsync +vsync 
               VertFreq: 60 Hz, HorFreq: 63981 Hz
Serial number: --
Monitor ranges (GTF): 50-75Hz V, 30-80kHz H, max dotclock 140MHz
Monitor name: VE710b
Checksum: 0x74 (valid)
EDID block does NOT conform to EDID 1.3!
	sRGB is signaled, but the chromaticities do not match
EDID block does not conform at all!
	Bad year of manufacture
