
EDID (hex):
00ffffffffffff001e977d03b7332035
3417010380331d7822dd45a3554fa027
125054b30c00d1c0b300950081808100
81c0714f81c0023a801871382d40582c
4500fd1e1100001e000000fd00374c1e
5311000a202020202020000000ff0043
33484141303036343230360a000000fc
00475457204b58323330330a20200060

Extracted contents:
header:          00 ff ff ff ff ff ff 00
serial number:   1e 97 7d 03 b7 33 20 35 34 17
version:         01 03
basic params:    80 33 1d 78 22
chroma info:     dd 45 a3 55 4f a0 27 12 50 54
established:     b3 0c 00
standard:        d1 c0 b3 00 95 00 81 80 81 00 81 c0 71 4f 81 c0
descriptor 1:    02 3a 80 18 71 38 2d 40 58 2c 45 00 fd 1e 11 00 00 1e
descriptor 2:    00 00 00 fd 00 37 4c 1e 53 11 00 0a 20 20 20 20 20 20
descriptor 3:    00 00 00 ff 00 43 33 48 41 41 30 30 36 34 32 30 36 0a
descriptor 4:    00 00 00 fc 00 47 54 57 20 4b 58 32 33 30 33 0a 20 20
extensions:      00
checksum:        60

EDID version: 1.3
Manufacturer: GTW Model 37d Serial Number --
Made in week 52 of 2013
Digital display
Maximum image size: 51 cm x 29 cm
Gamma: 2.20
DPMS levels: Off
Monochrome or grayscale display
First detailed timing is preferred timing
Display x,y Chromaticity:
  Red:   0.6396, 0.3330
  Green: 0.3115, 0.6259
  Blue:  0.1533, 0.0703
  White: 0.3134, 0.3291
Established timings supported:
  720x400@70Hz 9:5 HorFreq: 31469 Hz Clock: 28.320 MHz
  640x480@60Hz 4:3 HorFreq: 31469 Hz Clock: 25.175 MHz
  640x480@67Hz 4:3 HorFreq: 35000 Hz Clock: 30.240 MHz
  800x600@56Hz 4:3 HorFreq: 35200 Hz Clock: 36.000 MHz
  800x600@60Hz 4:3 HorFreq: 37900 Hz Clock: 40.000 MHz
  1024x768@60Hz 4:3 HorFreq: 48400 Hz Clock: 65.000 MHz
  1024x768@70Hz 4:3 HorFreq: 56500 Hz Clock: 75.000 MHz
Standard timings supported:
  1920x1080@60Hz 16:9
  1680x1050@60Hz 16:10 HorFreq: 64700 Hz Clock: 119.000 MHz
  1440x900@60Hz 16:10 HorFreq: 55500 Hz Clock: 88.750 MHz
  1280x1024@60Hz 5:4 HorFreq: 64000 Hz Clock: 108.000 MHz
  1280x800@60Hz 16:10
  1280x720@60Hz 16:9
  1152x864@75Hz 4:3 HorFreq: 67500 Hz Clock: 108.000 MHz
  1280x720@60Hz 16:9
Detailed mode: Clock 148.500 MHz, 509 mm x 286 mm
               1920 2008 2052 2200 hborder 0
               1080 1084 1089 1125 vborder 0
               +hsync +vsync 
               VertFreq: 60 Hz, HorFreq: 67500 Hz
Monitor ranges (GTF): 55-76Hz V, 30-83kHz H, max dotclock 170MHz
Serial number: --
Monitor name: GTW KX2303
Checksum: 0x60 (valid)


