edid-decode (hex):

00 ff ff ff ff ff ff 00 4e 14 bf 0a 00 00 00 00
01 1c 01 04 a5 3c 21 78 3b ba 25 a3 56 50 a0 28
0e 50 54 bf ef 00 d1 c0 b3 00 95 00 81 80 81 40
81 c0 01 01 01 01 02 3a 80 18 71 38 2d 40 58 2c
45 00 20 2f 21 00 00 1e 2a 44 80 a0 70 38 27 40
30 20 35 00 20 2f 21 00 00 1e 00 00 00 fd 00 1e
4c 53 53 13 01 0a 20 20 20 20 20 20 00 00 00 fc
00 43 32 37 0a 20 20 20 20 20 20 20 20 20 01 25

02 03 18 f1 4b 01 03 05 14 04 13 1f 12 02 11 90
23 09 07 07 83 01 00 00 02 3a 80 18 71 38 2d 40
58 2c 45 00 20 2f 21 00 00 1e 01 1d 00 72 51 d0
1e 20 6e 28 55 00 20 2f 21 00 00 1e 8c 0a d0 8a
20 e0 2d 10 10 3e 96 00 20 2f 21 00 00 18 8c 0a
d0 90 20 40 31 20 0c 40 55 00 20 2f 21 00 00 18
f0 3c 00 d0 51 a0 35 50 60 88 3a 00 20 2f 21 00
00 1c 00 00 00 00 00 00 00 00 00 00 00 00 00 af

----------------

Block 0, Base EDID:
  EDID Structure Version & Revision: 1.4
  Vendor & Product Identification:
    Manufacturer: SPT
    Model: 2751
    Made in: week 1 of 2018
  Basic Display Parameters & Features:
    Digital display
    Bits per primary color channel: 8
    DisplayPort interface
    Maximum image size: 60 cm x 33 cm
    Gamma: 2.20
    DPMS levels: Off
    Supported color formats: RGB 4:4:4, YCrCb 4:4:4, YCrCb 4:2:2
    First detailed timing includes the native pixel format and preferred refresh rate
    Display is continuous frequency
  Color Characteristics:
    Red  : 0.6386, 0.3388
    Green: 0.3144, 0.6269
    Blue : 0.1562, 0.0566
    White: 0.3134, 0.3291
  Established Timings I & II:
    IBM     :   720x400    70.082 Hz   9:5    31.467 kHz  28.320 MHz
    DMT 0x04:   640x480    59.940 Hz   4:3    31.469 kHz  25.175 MHz
    Apple   :   640x480    66.667 Hz   4:3    35.000 kHz  30.240 MHz
    DMT 0x05:   640x480    72.809 Hz   4:3    37.861 kHz  31.500 MHz
    DMT 0x06:   640x480    75.000 Hz   4:3    37.500 kHz  31.500 MHz
    DMT 0x08:   800x600    56.250 Hz   4:3    35.156 kHz  36.000 MHz
    DMT 0x09:   800x600    60.317 Hz   4:3    37.879 kHz  40.000 MHz
    DMT 0x0a:   800x600    72.188 Hz   4:3    48.077 kHz  50.000 MHz
    DMT 0x0b:   800x600    75.000 Hz   4:3    46.875 kHz  49.500 MHz
    Apple   :   832x624    74.551 Hz   4:3    49.726 kHz  57.284 MHz
    DMT 0x10:  1024x768    60.004 Hz   4:3    48.363 kHz  65.000 MHz
    DMT 0x11:  1024x768    70.069 Hz   4:3    56.476 kHz  75.000 MHz
    DMT 0x12:  1024x768    75.029 Hz   4:3    60.023 kHz  78.750 MHz
    DMT 0x24:  1280x1024   75.025 Hz   5:4    79.976 kHz 135.000 MHz
  Standard Timings:
    DMT 0x52:  1920x1080   60.000 Hz  16:9    67.500 kHz 148.500 MHz
    DMT 0x3a:  1680x1050   59.954 Hz  16:10   65.290 kHz 146.250 MHz
    DMT 0x2f:  1440x900    59.887 Hz  16:10   55.935 kHz 106.500 MHz
    DMT 0x23:  1280x1024   60.020 Hz   5:4    63.981 kHz 108.000 MHz
    DMT 0x20:  1280x960    60.000 Hz   4:3    60.000 kHz 108.000 MHz
    DMT 0x55:  1280x720    60.000 Hz  16:9    45.000 kHz  74.250 MHz
  Detailed Timing Descriptors:
    DTD 1:  1920x1080   60.000 Hz  16:9    67.500 kHz 148.500 MHz (544 mm x 303 mm)
                 Hfront   88 Hsync  44 Hback 148 Hpol P
                 Vfront    4 Vsync   5 Vback  36 Vpol P
    DTD 2:  1920x1080   74.973 Hz  16:9    83.894 kHz 174.500 MHz (544 mm x 303 mm)
                 Hfront   48 Hsync  32 Hback  80 Hpol P
                 Vfront    3 Vsync   5 Vback  31 Vpol P
  Display Range Limits:
    Monitor ranges (Bare Limits): 30-76 Hz V, 83-83 kHz H, max dotclock 190 MHz
    Display Product Name: 'C27'
  Extension blocks: 1
Checksum: 0x25

----------------

Block 1, CTA-861 Extension Block:
  Revision: 3
  Underscans PC formats by default
  Basic audio support
  Supports YCbCr 4:4:4
  Supports YCbCr 4:2:2
  Native detailed modes: 1
  Video Data Block:
    VIC   1:   640x480    59.940 Hz   4:3    31.469 kHz  25.175 MHz
    VIC   3:   720x480    59.940 Hz  16:9    31.469 kHz  27.000 MHz
    VIC   5:  1920x1080i  60.000 Hz  16:9    33.750 kHz  74.250 MHz
    VIC  20:  1920x1080i  50.000 Hz  16:9    28.125 kHz  74.250 MHz
    VIC   4:  1280x720    60.000 Hz  16:9    45.000 kHz  74.250 MHz
    VIC  19:  1280x720    50.000 Hz  16:9    37.500 kHz  74.250 MHz
    VIC  31:  1920x1080   50.000 Hz  16:9    56.250 kHz 148.500 MHz
    VIC  18:   720x576    50.000 Hz  16:9    31.250 kHz  27.000 MHz
    VIC   2:   720x480    59.940 Hz   4:3    31.469 kHz  27.000 MHz
    VIC  17:   720x576    50.000 Hz   4:3    31.250 kHz  27.000 MHz
    VIC  16:  1920x1080   60.000 Hz  16:9    67.500 kHz 148.500 MHz (native)
  Audio Data Block:
    Linear PCM:
      Max channels: 2
      Supported sample rates (kHz): 48 44.1 32
      Supported sample sizes (bits): 24 20 16
  Speaker Allocation Data Block:
    FL/FR - Front Left/Right
  Detailed Timing Descriptors:
    DTD 3:  1920x1080   60.000 Hz  16:9    67.500 kHz 148.500 MHz (544 mm x 303 mm)
                 Hfront   88 Hsync  44 Hback 148 Hpol P
                 Vfront    4 Vsync   5 Vback  36 Vpol P
    DTD 4:  1280x720    60.000 Hz  16:9    45.000 kHz  74.250 MHz (544 mm x 303 mm)
                 Hfront  110 Hsync  40 Hback 220 Hpol P
                 Vfront    5 Vsync   5 Vback  20 Vpol P
    DTD 5:   720x480    59.940 Hz   3:2    31.469 kHz  27.000 MHz (544 mm x 303 mm)
                 Hfront   16 Hsync  62 Hback  60 Hpol N
                 Vfront    9 Vsync   6 Vback  30 Vpol N
    DTD 6:   720x576    50.000 Hz   5:4    31.250 kHz  27.000 MHz (544 mm x 303 mm)
                 Hfront   12 Hsync  64 Hback  68 Hpol N
                 Vfront    5 Vsync   5 Vback  39 Vpol N
    DTD 7:  1280x1440   59.913 Hz   8:9    89.450 kHz 156.000 MHz (544 mm x 303 mm)
                 Hfront   96 Hsync 136 Hback 232 Hpol N
                 Vfront    3 Vsync  10 Vback  40 Vpol P
Checksum: 0xaf

----------------

Warnings:

All Blocks:
  Some timings are out of range of the Monitor Ranges:
    Horizontal Freq: 28.125 - 89.449 kHz (Monitor: 83.000 - 83.000 kHz)

Failures:

Block 0, Base EDID:
  Detailed Timing Descriptor #1: Mismatch of image size 544x303 mm vs display size 600x330 mm.
  Detailed Timing Descriptor #2: Mismatch of image size 544x303 mm vs display size 600x330 mm.
Block 1, CTA-861 Extension Block:
  Detailed Timing Descriptor #3: Mismatch of image size 544x303 mm vs display size 600x330 mm.
  Detailed Timing Descriptor #4: Mismatch of image size 544x303 mm vs display size 600x330 mm.
  Detailed Timing Descriptor #5: Mismatch of image size 544x303 mm vs display size 600x330 mm.
  Detailed Timing Descriptor #6: Mismatch of image size 544x303 mm vs display size 600x330 mm.
  Detailed Timing Descriptor #7: Mismatch of image size 544x303 mm vs display size 600x330 mm.

EDID conformity: FAIL
