
EDID (hex):
00ffffffffffff0010ac95404c394c42
081a0104a52c18783a8dd5a25752a127
0e5054a54b00714f8180a9c001010101
0101010101012f2640a060841a303020
3500b2ec1000001a000000ff004e4436
4e4336324e424c394c0a000000fc0044
454c4c205032303134480a20000000fd
00384c1e5311010a20202020202000e6

edid-decode (hex):

00 ff ff ff ff ff ff 00 10 ac 95 40 4c 39 4c 42
08 1a 01 04 a5 2c 18 78 3a 8d d5 a2 57 52 a1 27
0e 50 54 a5 4b 00 71 4f 81 80 a9 c0 01 01 01 01
01 01 01 01 01 01 2f 26 40 a0 60 84 1a 30 30 20
35 00 b2 ec 10 00 00 1a 00 00 00 ff 00 4e 44 36
4e 43 36 32 4e 42 4c 39 4c 0a 00 00 00 fc 00 44
45 4c 4c 20 50 32 30 31 34 48 0a 20 00 00 00 fd
00 38 4c 1e 53 11 01 0a 20 20 20 20 20 20 00 e6

----------------

Block 0, Base EDID:
  EDID Structure Version & Revision: 1.4
  Vendor & Product Identification:
    Manufacturer: DEL
    Model: 16533
    Serial Number: 1112291660
    Made in: week 8 of 2016
  Basic Display Parameters & Features:
    Digital display
    Bits per primary color channel: 8
    DisplayPort interface
    Maximum image size: 44 cm x 24 cm
    Gamma: 2.20
    DPMS levels: Off
    Supported color formats: RGB 4:4:4, YCrCb 4:4:4, YCrCb 4:2:2
    First detailed timing includes the native pixel format and preferred refresh rate
  Color Characteristics:
    Red  : 0.6347, 0.3398
    Green: 0.3232, 0.6298
    Blue : 0.1552, 0.0556
    White: 0.3134, 0.3291
  Established Timings I & II:
    IBM     :   720x400    70.081663 Hz   9:5     31.467 kHz     28.320000 MHz
    DMT 0x04:   640x480    59.940476 Hz   4:3     31.469 kHz     25.175000 MHz
    DMT 0x06:   640x480    75.000000 Hz   4:3     37.500 kHz     31.500000 MHz
    DMT 0x09:   800x600    60.316541 Hz   4:3     37.879 kHz     40.000000 MHz
    DMT 0x0b:   800x600    75.000000 Hz   4:3     46.875 kHz     49.500000 MHz
    DMT 0x10:  1024x768    60.003840 Hz   4:3     48.363 kHz     65.000000 MHz
    DMT 0x12:  1024x768    75.028582 Hz   4:3     60.023 kHz     78.750000 MHz
    DMT 0x24:  1280x1024   75.024675 Hz   5:4     79.976 kHz    135.000000 MHz
  Standard Timings:
    DMT 0x15:  1152x864    75.000000 Hz   4:3     67.500 kHz    108.000000 MHz
    DMT 0x23:  1280x1024   60.019740 Hz   5:4     63.981 kHz    108.000000 MHz
    DMT 0x53:  1600x900    60.000000 Hz  16:9     60.000 kHz    108.000000 MHz (RB)
  Detailed Timing Descriptors:
    DTD 1:  1600x900    59.978156 Hz  16:9     55.540 kHz     97.750000 MHz (434 mm x 236 mm)
                 Hfront   48 Hsync  32 Hback   80 Hpol P
                 Vfront    3 Vsync   5 Vback   18 Vpol N
    Display Product Serial Number: 'ND6NC62NBL9L'
    Display Product Name: 'DELL P2014H'
    Display Range Limits:
      Monitor ranges (Bare Limits): 56-76 Hz V, 30-83 kHz H, max dotclock 170 MHz
Checksum: 0xe6
