edid-decode (hex):

00 ff ff ff ff ff ff 00 06 10 f2 9c 00 00 00 00
1a 15 01 04 95 1a 0e 78 02 ef 05 97 57 54 92 27
22 50 54 00 00 00 01 01 01 01 01 01 01 01 01 01
01 01 01 01 01 01 20 1c 56 86 50 00 20 30 0e 38
13 00 00 90 10 00 00 18 00 00 00 10 00 00 00 00
00 00 00 00 00 00 00 00 00 00 00 00 00 fe 00 4c
50 31 31 36 57 48 34 2d 54 4a 41 33 00 00 00 fc
00 43 6f 6c 6f 72 20 4c 43 44 0a 20 20 20 00 bd

----------------

Block 0, Base EDID:
  EDID Structure Version & Revision: 1.4
  Vendor & Product Identification:
    Manufacturer: APP
    Model: 40178
    Made in: week 26 of 2011
  Basic Display Parameters & Features:
    Digital display
    Bits per primary color channel: 6
    DisplayPort interface
    Maximum image size: 26 cm x 14 cm
    Gamma: 2.20
    Supported color formats: RGB 4:4:4
    First detailed timing includes the native pixel format and preferred refresh rate
  Color Characteristics:
    Red  : 0.5927, 0.3417
    Green: 0.3310, 0.5732
    Blue : 0.1523, 0.1328
    White: 0.3134, 0.3291
  Established Timings I & II: none
  Standard Timings: none
  Detailed Timing Descriptors:
    DTD 1:  1366x768    60.000000 Hz 683:384   48.000 kHz     72.000000 MHz (256 mm x 144 mm)
                 Hfront   14 Hsync  56 Hback   64 Hpol N
                 Vfront    1 Vsync   3 Vback   28 Vpol N
    Dummy Descriptor:
    Alphanumeric Data String: 'LP116WH4-TJA3'
    Display Product Name: 'Color LCD'
Checksum: 0xbd

----------------

Warnings:

Block 0, Base EDID:
  Detailed Timing Descriptor #1: DTD is similar but not identical to DMT 0x56.

EDID conformity: PASS
