
EDID (hex):
00ffffffffffff00052322006e040000
22110103682f1e78e837a0a655489a26
125054bfef808140818081c09500950f
b300010101017c2e90a0601a1e403020
3600d62c1100001a000000ff00303131
33340a20202020202020000000fd0037
4b18530f000a202020202020000000fc
00482d5732320a20202020202020002d

Extracted contents:
header:          00 ff ff ff ff ff ff 00
serial number:   05 23 22 00 6e 04 00 00 22 11
version:         01 03
basic params:    68 2f 1e 78 e8
chroma info:     37 a0 a6 55 48 9a 26 12 50 54
established:     bf ef 80
standard:        81 40 81 80 81 c0 95 00 95 0f b3 00 01 01 01 01
descriptor 1:    7c 2e 90 a0 60 1a 1e 40 30 20 36 00 d6 2c 11 00 00 1a
descriptor 2:    00 00 00 ff 00 30 31 31 33 34 0a 20 20 20 20 20 20 20
descriptor 3:    00 00 00 fd 00 37 4b 18 53 0f 00 0a 20 20 20 20 20 20
descriptor 4:    00 00 00 fc 00 48 2d 57 32 32 0a 20 20 20 20 20 20 20
extensions:      00
checksum:        2d

EDID version: 1.3
Manufacturer: AIC Model 22 Serial Number --
Made in week 34 of 2007
Analog display, Input voltage level: 0.7/0.7 V
Sync: Separate 
Maximum image size: 47 cm x 30 cm
Gamma: 2.20
DPMS levels: Standby Suspend Off
RGB color display
Display x,y Chromaticity:
  Red:   0.6484, 0.3349
  Green: 0.2822, 0.6044
  Blue:  0.1503, 0.0722
  White: 0.3125, 0.3281
Established timings supported:
  720x400@70Hz 9:5 HorFreq: 31469 Hz Clock: 28.320 MHz
  640x480@60Hz 4:3 HorFreq: 31469 Hz Clock: 25.175 MHz
  640x480@67Hz 4:3 HorFreq: 35000 Hz Clock: 30.240 MHz
  640x480@72Hz 4:3 HorFreq: 37900 Hz Clock: 31.500 MHz
  640x480@75Hz 4:3 HorFreq: 37500 Hz Clock: 31.500 MHz
  800x600@56Hz 4:3 HorFreq: 35200 Hz Clock: 36.000 MHz
  800x600@60Hz 4:3 HorFreq: 37900 Hz Clock: 40.000 MHz
  800x600@72Hz 4:3 HorFreq: 48100 Hz Clock: 50.000 MHz
  800x600@75Hz 4:3 HorFreq: 46900 Hz Clock: 49.500 MHz
  832x624@75Hz 4:3 HorFreq: 49726 Hz Clock: 57.284 MHz
  1024x768@60Hz 4:3 HorFreq: 48400 Hz Clock: 65.000 MHz
  1024x768@70Hz 4:3 HorFreq: 56500 Hz Clock: 75.000 MHz
  1024x768@75Hz 4:3 HorFreq: 60000 Hz Clock: 78.750 MHz
  1280x1024@75Hz 5:4 HorFreq: 80000 Hz Clock: 135.000 MHz
  1152x870@75Hz 192:145 HorFreq: 67500 Hz Clock: 108.000 MHz
Standard timings supported:
  1280x960@60Hz 4:3 HorFreq: 60000 Hz Clock: 108.000 MHz
  1280x1024@60Hz 5:4 HorFreq: 64000 Hz Clock: 108.000 MHz
  1280x720@60Hz 16:9
  1440x900@60Hz 16:10 HorFreq: 55500 Hz Clock: 88.750 MHz
  1440x900@75Hz 16:10 HorFreq: 82300 Hz Clock: 156.000 MHz
  1680x1050@60Hz 16:10 HorFreq: 64700 Hz Clock: 119.000 MHz
Detailed mode: Clock 119.000 MHz, 470 mm x 300 mm
               1680 1728 1760 1840 hborder 0
               1050 1053 1059 1080 vborder 0
               +hsync -vsync 
               VertFreq: 59 Hz, HorFreq: 64673 Hz
Serial number: --
Monitor ranges (GTF): 55-75Hz V, 24-83kHz H, max dotclock 150MHz
Monitor name: H-W22
Checksum: 0x2d (valid)
EDID block does NOT conform to EDID 1.3!
	Missing preferred timing
One or more of the timings is out of range of the Monitor Ranges:
  Vertical Freq: 56 - 75 Hz
  Horizontal Freq: 31469 - 82300 Hz
  Maximum Clock: 156.000 MHz
