
EDID (hex):
00ffffffffffff002134ff6d01010101
0b110103802f1e78ead515a455499a27
145054adcf008180b3009500950f0101
01010101010121399030621a274068b0
3600da281100001c000000fc004e3232
3057204456490a202020000000fd0038
4c1f500f000a202020202020000000ff
00305744503042373330323331340007

Extracted contents:
header:          00 ff ff ff ff ff ff 00
serial number:   21 34 ff 6d 01 01 01 01 0b 11
version:         01 03
basic params:    80 2f 1e 78 ea
chroma info:     d5 15 a4 55 49 9a 27 14 50 54
established:     ad cf 00
standard:        81 80 b3 00 95 00 95 0f 01 01 01 01 01 01 01 01
descriptor 1:    21 39 90 30 62 1a 27 40 68 b0 36 00 da 28 11 00 00 1c
descriptor 2:    00 00 00 fc 00 4e 32 32 30 57 20 44 56 49 0a 20 20 20
descriptor 3:    00 00 00 fd 00 38 4c 1f 50 0f 00 0a 20 20 20 20 20 20
descriptor 4:    00 00 00 ff 00 30 57 44 50 30 42 37 33 30 32 33 31 34
extensions:      00
checksum:        07

EDID version: 1.3
Manufacturer: HIT Model 6dff Serial Number --
Made in week 11 of 2007
Digital display
Maximum image size: 47 cm x 30 cm
Gamma: 2.20
DPMS levels: Standby Suspend Off
RGB color display
First detailed timing is preferred timing
Display x,y Chromaticity:
  Red:   0.6435, 0.3330
  Green: 0.2861, 0.6025
  Blue:  0.1523, 0.0791
  White: 0.3134, 0.3291
Established timings supported:
  720x400@70Hz 9:5 HorFreq: 31469 Hz Clock: 28.320 MHz
  640x480@60Hz 4:3 HorFreq: 31469 Hz Clock: 25.175 MHz
  640x480@72Hz 4:3 HorFreq: 37900 Hz Clock: 31.500 MHz
  640x480@75Hz 4:3 HorFreq: 37500 Hz Clock: 31.500 MHz
  800x600@60Hz 4:3 HorFreq: 37900 Hz Clock: 40.000 MHz
  800x600@72Hz 4:3 HorFreq: 48100 Hz Clock: 50.000 MHz
  800x600@75Hz 4:3 HorFreq: 46900 Hz Clock: 49.500 MHz
  1024x768@60Hz 4:3 HorFreq: 48400 Hz Clock: 65.000 MHz
  1024x768@70Hz 4:3 HorFreq: 56500 Hz Clock: 75.000 MHz
  1024x768@75Hz 4:3 HorFreq: 60000 Hz Clock: 78.750 MHz
  1280x1024@75Hz 5:4 HorFreq: 80000 Hz Clock: 135.000 MHz
Standard timings supported:
  1280x1024@60Hz 5:4 HorFreq: 64000 Hz Clock: 108.000 MHz
  1680x1050@60Hz 16:10 HorFreq: 64700 Hz Clock: 119.000 MHz
  1440x900@60Hz 16:10 HorFreq: 55500 Hz Clock: 88.750 MHz
  1440x900@75Hz 16:10 HorFreq: 82300 Hz Clock: 156.000 MHz
Detailed mode: Clock 146.250 MHz, 474 mm x 296 mm
               1680 1784 1960 2240 hborder 0
               1050 1053 1059 1089 vborder 0
               -hsync +vsync 
               VertFreq: 59 Hz, HorFreq: 65290 Hz
Monitor name: N220W DVI
Monitor ranges (GTF): 56-76Hz V, 31-80kHz H, max dotclock 150MHz
Serial number: --
Checksum: 0x7 (valid)
One or more of the timings is out of range of the Monitor Ranges:
  Vertical Freq: 59 - 75 Hz
  Horizontal Freq: 31469 - 82300 Hz
  Maximum Clock: 156.000 MHz


