
EDID (hex):
00ffffffffffff000ed4201900000000
2a12010308241d780e0dc2a057479827
12484f2dce0081806140010101010101
0101010101015235808070381f402020
1300dd0c1100001a6c399030621a2740
68b03600dd0c1100001c000000fc0043
5654452054560a0a0a0a0a0a00000010
002e4c0e500f000a2020202020200028

Extracted contents:
header:          00 ff ff ff ff ff ff 00
serial number:   0e d4 20 19 00 00 00 00 2a 12
version:         01 03
basic params:    08 24 1d 78 0e
chroma info:     0d c2 a0 57 47 98 27 12 48 4f
established:     2d ce 00
standard:        81 80 61 40 01 01 01 01 01 01 01 01 01 01 01 01
descriptor 1:    52 35 80 80 70 38 1f 40 20 20 13 00 dd 0c 11 00 00 1a
descriptor 2:    6c 39 90 30 62 1a 27 40 68 b0 36 00 dd 0c 11 00 00 1c
descriptor 3:    00 00 00 fc 00 43 56 54 45 20 54 56 0a 0a 0a 0a 0a 0a
descriptor 4:    00 00 00 10 00 2e 4c 0e 50 0f 00 0a 20 20 20 20 20 20
extensions:      00
checksum:        28

EDID version: 1.3
Manufacturer: CVT Model 1920 Serial Number --
Made in week 42 of 2008
Analog display, Input voltage level: 0.7/0.3 V
Sync: Separate 
Maximum image size: 36 cm x 29 cm
Gamma: 2.20
RGB color display
Default (sRGB) color space is primary color space
First detailed timing is preferred timing
Display x,y Chromaticity:
  Red:   0.6250, 0.3398
  Green: 0.2802, 0.5947
  Blue:  0.1552, 0.0703
  White: 0.2812, 0.3105
Established timings supported:
  640x480@60Hz 4:3 HorFreq: 31469 Hz Clock: 25.175 MHz
  640x480@72Hz 4:3 HorFreq: 37900 Hz Clock: 31.500 MHz
  640x480@75Hz 4:3 HorFreq: 37500 Hz Clock: 31.500 MHz
  800x600@60Hz 4:3 HorFreq: 37900 Hz Clock: 40.000 MHz
  800x600@72Hz 4:3 HorFreq: 48100 Hz Clock: 50.000 MHz
  800x600@75Hz 4:3 HorFreq: 46900 Hz Clock: 49.500 MHz
  1024x768@60Hz 4:3 HorFreq: 48400 Hz Clock: 65.000 MHz
  1024x768@70Hz 4:3 HorFreq: 56500 Hz Clock: 75.000 MHz
  1024x768@75Hz 4:3 HorFreq: 60000 Hz Clock: 78.750 MHz
Standard timings supported:
  1280x1024@60Hz 5:4 HorFreq: 64000 Hz Clock: 108.000 MHz
  1024x768@60Hz 4:3 HorFreq: 48400 Hz Clock: 65.000 MHz
Detailed mode: Clock 136.500 MHz, 477 mm x 268 mm
               1920 1952 1984 2048 hborder 0
               1080 1081 1084 1111 vborder 0
               +hsync -vsync 
               VertFreq: 59 Hz, HorFreq: 66650 Hz
Detailed mode: Clock 147.000 MHz, 477 mm x 268 mm
               1680 1784 1960 2240 hborder 0
               1050 1053 1059 1089 vborder 0
               -hsync +vsync 
               VertFreq: 60 Hz, HorFreq: 65625 Hz
Monitor name: CVTE TV
Dummy block
Checksum: 0x28 (valid)
EDID block does NOT conform to EDID 1.3!
	sRGB is signaled, but the chromaticities do not match
	Missing monitor ranges
	Detailed block string not properly terminated
EDID block does not conform at all!
	Dummy block filled with garbage
