
EDID (hex):
00ffffffffffff004c2d7a0a00000000
2e160103805932780aee91a3544c9926
0f5054bdef80714f81c0810081809500
a9c0b3000101023a801871382d40582c
450024724200001e662156aa51001e30
468f330024724200001e000000fd0018
4b0f5117000a202020202020000000fc
0053414d53554e470a2020202020016b

Extracted contents:
header:          00 ff ff ff ff ff ff 00
serial number:   4c 2d 7a 0a 00 00 00 00 2e 16
version:         01 03
basic params:    80 59 32 78 0a
chroma info:     ee 91 a3 54 4c 99 26 0f 50 54
established:     bd ef 80
standard:        71 4f 81 c0 81 00 81 80 95 00 a9 c0 b3 00 01 01
descriptor 1:    02 3a 80 18 71 38 2d 40 58 2c 45 00 24 72 42 00 00 1e
descriptor 2:    66 21 56 aa 51 00 1e 30 46 8f 33 00 24 72 42 00 00 1e
descriptor 3:    00 00 00 fd 00 18 4b 0f 51 17 00 0a 20 20 20 20 20 20
descriptor 4:    00 00 00 fc 00 53 41 4d 53 55 4e 47 0a 20 20 20 20 20
extensions:      01
checksum:        6b

EDID version: 1.3
Manufacturer: SAM Model a7a Serial Number --
Made in week 46 of 2012
Digital display
Maximum image size: 89 cm x 50 cm
Gamma: 2.20
RGB color display
First detailed timing is preferred timing
Display x,y Chromaticity:
  Red:   0.6396, 0.3300
  Green: 0.2998, 0.5996
  Blue:  0.1503, 0.0595
  White: 0.3125, 0.3291
Established timings supported:
  720x400@70Hz 9:5 HorFreq: 31469 Hz Clock: 28.320 MHz
  640x480@60Hz 4:3 HorFreq: 31469 Hz Clock: 25.175 MHz
  640x480@67Hz 4:3 HorFreq: 35000 Hz Clock: 30.240 MHz
  640x480@72Hz 4:3 HorFreq: 37900 Hz Clock: 31.500 MHz
  640x480@75Hz 4:3 HorFreq: 37500 Hz Clock: 31.500 MHz
  800x600@60Hz 4:3 HorFreq: 37900 Hz Clock: 40.000 MHz
  800x600@72Hz 4:3 HorFreq: 48100 Hz Clock: 50.000 MHz
  800x600@75Hz 4:3 HorFreq: 46900 Hz Clock: 49.500 MHz
  832x624@75Hz 4:3 HorFreq: 49726 Hz Clock: 57.284 MHz
  1024x768@60Hz 4:3 HorFreq: 48400 Hz Clock: 65.000 MHz
  1024x768@70Hz 4:3 HorFreq: 56500 Hz Clock: 75.000 MHz
  1024x768@75Hz 4:3 HorFreq: 60000 Hz Clock: 78.750 MHz
  1280x1024@75Hz 5:4 HorFreq: 80000 Hz Clock: 135.000 MHz
  1152x870@75Hz 192:145 HorFreq: 67500 Hz Clock: 108.000 MHz
Standard timings supported:
  1152x864@75Hz 4:3 HorFreq: 67500 Hz Clock: 108.000 MHz
  1280x720@60Hz 16:9
  1280x800@60Hz 16:10
  1280x1024@60Hz 5:4 HorFreq: 64000 Hz Clock: 108.000 MHz
  1440x900@60Hz 16:10 HorFreq: 55500 Hz Clock: 88.750 MHz
  1600x900@60Hz 16:9
  1680x1050@60Hz 16:10 HorFreq: 64700 Hz Clock: 119.000 MHz
Detailed mode: Clock 148.500 MHz, 1060 mm x 626 mm
               1920 2008 2052 2200 hborder 0
               1080 1084 1089 1125 vborder 0
               +hsync +vsync 
               VertFreq: 60 Hz, HorFreq: 67500 Hz
Detailed mode: Clock 85.500 MHz, 1060 mm x 626 mm
               1366 1436 1579 1792 hborder 0
                768  771  774  798 vborder 0
               +hsync +vsync 
               VertFreq: 59 Hz, HorFreq: 47712 Hz
Monitor ranges (GTF): 24-75Hz V, 15-81kHz H, max dotclock 230MHz
Monitor name: SAMSUNG
Has 1 extension blocks
Checksum: 0x6b (valid)
