
EDID (hex):
00ffffffffffff001e977b03376b9032
1d17010368301b782a3935a25952a127
0c5054b30c00d1c0b300950081808100
81c0714f0101023a801871382d40582c
4500dd0c1100001e000000fd00324c1e
5312000a202020202020000000ff0043
33474141303032343230360a000000fc
00475457204b58323135330a20200093

Extracted contents:
header:          00 ff ff ff ff ff ff 00
serial number:   1e 97 7b 03 37 6b 90 32 1d 17
version:         01 03
basic params:    68 30 1b 78 2a
chroma info:     39 35 a2 59 52 a1 27 0c 50 54
established:     b3 0c 00
standard:        d1 c0 b3 00 95 00 81 80 81 00 81 c0 71 4f 01 01
descriptor 1:    02 3a 80 18 71 38 2d 40 58 2c 45 00 dd 0c 11 00 00 1e
descriptor 2:    00 00 00 fd 00 32 4c 1e 53 12 00 0a 20 20 20 20 20 20
descriptor 3:    00 00 00 ff 00 43 33 47 41 41 30 30 32 34 32 30 36 0a
descriptor 4:    00 00 00 fc 00 47 54 57 20 4b 58 32 31 35 33 0a 20 20
extensions:      00
checksum:        93

EDID version: 1.3
Manufacturer: GTW Model 37b Serial Number --
Made in week 29 of 2013
Analog display, Input voltage level: 0.7/0.7 V
Sync: Separate 
Maximum image size: 48 cm x 27 cm
Gamma: 2.20
DPMS levels: Off
RGB color display
First detailed timing is preferred timing
Display x,y Chromaticity:
  Red:   0.6328, 0.3505
  Green: 0.3222, 0.6298
  Blue:  0.1523, 0.0498
  White: 0.3134, 0.3291
Established timings supported:
  720x400@70Hz 9:5 HorFreq: 31469 Hz Clock: 28.320 MHz
  640x480@60Hz 4:3 HorFreq: 31469 Hz Clock: 25.175 MHz
  640x480@67Hz 4:3 HorFreq: 35000 Hz Clock: 30.240 MHz
  800x600@56Hz 4:3 HorFreq: 35200 Hz Clock: 36.000 MHz
  800x600@60Hz 4:3 HorFreq: 37900 Hz Clock: 40.000 MHz
  1024x768@60Hz 4:3 HorFreq: 48400 Hz Clock: 65.000 MHz
  1024x768@70Hz 4:3 HorFreq: 56500 Hz Clock: 75.000 MHz
Standard timings supported:
  1920x1080@60Hz 16:9
  1680x1050@60Hz 16:10 HorFreq: 64700 Hz Clock: 119.000 MHz
  1440x900@60Hz 16:10 HorFreq: 55500 Hz Clock: 88.750 MHz
  1280x1024@60Hz 5:4 HorFreq: 64000 Hz Clock: 108.000 MHz
  1280x800@60Hz 16:10
  1280x720@60Hz 16:9
  1152x864@75Hz 4:3 HorFreq: 67500 Hz Clock: 108.000 MHz
Detailed mode: Clock 148.500 MHz, 477 mm x 268 mm
               1920 2008 2052 2200 hborder 0
               1080 1084 1089 1125 vborder 0
               +hsync +vsync 
               VertFreq: 60 Hz, HorFreq: 67500 Hz
Monitor ranges (GTF): 50-76Hz V, 30-83kHz H, max dotclock 180MHz
Serial number: --
Monitor name: GTW KX2153
Checksum: 0x93 (valid)
