
EDID (hex):
00ffffffffffff000859420001000000
01160103806d3d780ad0dda953499d23
11474aa3080081c08100810f81408180
9500b30001015235808070381f402020
1300c48e2100001e462000a451002a30
5080370020462100001a000000fc004e
532d35304c3234304131330a000000fd
00374c1e5011000a20202020202001e5
02032073480504030201060790260907
071507508301000067030c003000b82d
011d007251d01e206e285500c48e2100
001e8c0ad08a20e02d10103e9600138e
21000018011d8018711c1620582c2500
c48e2100009e00000000000000000000
00000000000000000000000000000000
00000000000000000000000000000033

Extracted contents:
header:          00 ff ff ff ff ff ff 00
serial number:   08 59 42 00 01 00 00 00 01 16
version:         01 03
basic params:    80 6d 3d 78 0a
chroma info:     d0 dd a9 53 49 9d 23 11 47 4a
established:     a3 08 00
standard:        81 c0 81 00 81 0f 81 40 81 80 95 00 b3 00 01 01
descriptor 1:    52 35 80 80 70 38 1f 40 20 20 13 00 c4 8e 21 00 00 1e
descriptor 2:    46 20 00 a4 51 00 2a 30 50 80 37 00 20 46 21 00 00 1a
descriptor 3:    00 00 00 fc 00 4e 53 2d 35 30 4c 32 34 30 41 31 33 0a
descriptor 4:    00 00 00 fd 00 37 4c 1e 50 11 00 0a 20 20 20 20 20 20
extensions:      01
checksum:        e5

EDID version: 1.3
Manufacturer: BBY Model 42 Serial Number --
Made in week 1 of 2012
Digital display
Maximum image size: 109 cm x 61 cm
Gamma: 2.20
RGB color display
First detailed timing is preferred timing
Display x,y Chromaticity:
  Red:   0.6630, 0.3251
  Green: 0.2851, 0.6132
  Blue:  0.1396, 0.0673
  White: 0.2802, 0.2900
Established timings supported:
  720x400@70Hz 9:5 HorFreq: 31469 Hz Clock: 28.320 MHz
  640x480@60Hz 4:3 HorFreq: 31469 Hz Clock: 25.175 MHz
  800x600@56Hz 4:3 HorFreq: 35200 Hz Clock: 36.000 MHz
  800x600@60Hz 4:3 HorFreq: 37900 Hz Clock: 40.000 MHz
  1024x768@60Hz 4:3 HorFreq: 48400 Hz Clock: 65.000 MHz
Standard timings supported:
  1280x720@60Hz 16:9
  1280x800@60Hz 16:10
  1280x800@75Hz 16:10
  1280x960@60Hz 4:3 HorFreq: 60000 Hz Clock: 108.000 MHz
  1280x1024@60Hz 5:4 HorFreq: 64000 Hz Clock: 108.000 MHz
  1440x900@60Hz 16:10 HorFreq: 55500 Hz Clock: 88.750 MHz
  1680x1050@60Hz 16:10 HorFreq: 64700 Hz Clock: 119.000 MHz
Detailed mode: Clock 136.500 MHz, 708 mm x 398 mm
               1920 1952 1984 2048 hborder 0
               1080 1081 1084 1111 vborder 0
               +hsync +vsync 
               VertFreq: 59 Hz, HorFreq: 66650 Hz
Detailed mode: Clock 82.620 MHz, 544 mm x 326 mm
               1280 1360 1488 1700 hborder 0
                768  771  778  810 vborder 0
               +hsync -vsync 
               VertFreq: 60 Hz, HorFreq: 48600 Hz
Monitor name: NS-50L240A13
Monitor ranges (GTF): 55-76Hz V, 30-80kHz H, max dotclock 170MHz
Has 1 extension blocks
Checksum: 0xe5 (valid)

CTA extension block
Extension version: 3
28 bytes of CTA data
  Video data block
    VIC   5 1920x1080i@60Hz 16:9  HorFreq: 33750 Hz Clock: 74.250 MHz
    VIC   4 1280x720@60Hz 16:9  HorFreq: 45000 Hz Clock: 74.250 MHz
    VIC   3 720x480@60Hz 16:9  HorFreq: 31469 Hz Clock: 27.000 MHz
    VIC   2 720x480@60Hz 4:3  HorFreq: 31469 Hz Clock: 27.000 MHz
    VIC   1 640x480@60Hz 4:3  HorFreq: 31469 Hz Clock: 25.175 MHz
    VIC   6 1440x480i@60Hz 4:3  HorFreq: 15734 Hz Clock: 27.000 MHz
    VIC   7 1440x480i@60Hz 16:9  HorFreq: 15734 Hz Clock: 27.000 MHz
    VIC  16 1920x1080@60Hz 16:9 (native) HorFreq: 67500 Hz Clock: 148.500 MHz
  Audio data block
    Linear PCM, max channels 2
      Supported sample rates (kHz): 48 44.1 32
      Supported sample sizes (bits): 24 20 16
    AC-3, max channels 6
      Supported sample rates (kHz): 48 44.1 32
      Maximum bit rate: 640 kHz
  Speaker allocation data block
    Speaker map:
      FL/FR - Front Left/Right
  Vendor-specific data block, OUI 000c03 (HDMI)
    Source physical address 3.0.0.0
    Supports_AI
    DC_36bit
    DC_30bit
    DC_Y444
    Maximum TMDS clock: 225MHz
Basic audio support
Supports YCbCr 4:4:4
Supports YCbCr 4:2:2
3 native detailed modes
Detailed mode: Clock 74.250 MHz, 708 mm x 398 mm
               1280 1390 1430 1650 hborder 0
                720  725  730  750 vborder 0
               +hsync +vsync 
               VertFreq: 60 Hz, HorFreq: 45000 Hz
Detailed mode: Clock 27.000 MHz, 531 mm x 398 mm
                720  736  798  858 hborder 0
                480  489  495  525 vborder 0
               -hsync -vsync 
               VertFreq: 59 Hz, HorFreq: 31468 Hz
Detailed mode: Clock 74.250 MHz, 708 mm x 398 mm
               1920 2008 2052 2200 hborder 0
                540  542  547  562 vborder 0
               +hsync +vsync interlaced 
               VertFreq: 60 Hz, HorFreq: 33750 Hz
Checksum: 0x33 (valid)

One or more of the timings is out of range of the Monitor Ranges:
  Vertical Freq: 56 - 75 Hz
  Horizontal Freq: 15734 - 67500 Hz
  Maximum Clock: 148.500 MHz


