edid-decode (hex):

00 ff ff ff ff ff ff 00 1e 6d 8a 59 63 5d 04 00
04 17 01 03 80 3c 22 78 ea ee d5 a3 56 50 9f 26
10 50 54 a7 6b 80 71 4f 81 c0 81 00 81 80 95 00
90 40 a9 c0 b3 00 02 3a 80 18 71 38 2d 40 58 2c
45 00 58 54 21 00 00 1e 00 00 00 fd 00 38 4b 1e
53 0f 00 0a 20 20 20 20 20 20 00 00 00 fc 00 32
37 45 41 36 33 0a 20 20 20 20 20 20 00 00 00 ff
00 33 30 34 4e 44 43 52 38 45 30 35 31 0a 00 fa

00 ff ff ff ff ff ff 00 1e 6d 8a 59 63 5d 04 00
04 17 01 03 80 3c 22 78 ea ee d5 a3 56 50 9f 26
10 50 54 a7 6b 80 71 4f 81 c0 81 00 81 80 95 00
90 40 a9 c0 b3 00 02 3a 80 18 71 38 2d 40 58 2c
45 00 58 54 21 00 00 1e 00 00 00 fd 00 38 4b 1e
53 0f 00 0a 20 20 20 20 20 20 00 00 00 fc 00 32
37 45 41 36 33 0a 20 20 20 20 20 20 00 00 00 ff
00 33 30 34 4e 44 43 52 38 45 30 35 31 0a 00 fa

----------------

Block 0, Base EDID:
  EDID Structure Version & Revision: 1.3
  Vendor & Product Identification:
    Manufacturer: GSM
    Model: 22922
    Serial Number: ...
    Made in: week 4 of 2013
  Basic Display Parameters & Features:
    Digital display
    Maximum image size: 60 cm x 34 cm
    Gamma: 2.20
    DPMS levels: Standby Suspend Off
    RGB color display
    First detailed timing is the preferred timing
  Color Characteristics:
    Red  : 0.6396, 0.3378
    Green: 0.3154, 0.6230
    Blue : 0.1513, 0.0634
    White: 0.3134, 0.3291
  Established Timings I & II:
    IBM     :   720x400    70.081663 Hz   9:5     31.467 kHz     28.320000 MHz
    DMT 0x04:   640x480    59.940476 Hz   4:3     31.469 kHz     25.175000 MHz
    DMT 0x06:   640x480    75.000000 Hz   4:3     37.500 kHz     31.500000 MHz
    DMT 0x08:   800x600    56.250000 Hz   4:3     35.156 kHz     36.000000 MHz
    DMT 0x09:   800x600    60.316541 Hz   4:3     37.879 kHz     40.000000 MHz
    DMT 0x0b:   800x600    75.000000 Hz   4:3     46.875 kHz     49.500000 MHz
    Apple   :   832x624    74.551266 Hz   4:3     49.726 kHz     57.284000 MHz
    DMT 0x10:  1024x768    60.003840 Hz   4:3     48.363 kHz     65.000000 MHz
    DMT 0x12:  1024x768    75.028582 Hz   4:3     60.023 kHz     78.750000 MHz
    DMT 0x24:  1280x1024   75.024675 Hz   5:4     79.976 kHz    135.000000 MHz
    Apple   :  1152x870    75.061550 Hz 192:145   68.681 kHz    100.000000 MHz
  Standard Timings:
    DMT 0x15:  1152x864    75.000000 Hz   4:3     67.500 kHz    108.000000 MHz
    DMT 0x55:  1280x720    60.000000 Hz  16:9     45.000 kHz     74.250000 MHz
    DMT 0x1c:  1280x800    59.810326 Hz  16:10    49.702 kHz     83.500000 MHz
    DMT 0x23:  1280x1024   60.019740 Hz   5:4     63.981 kHz    108.000000 MHz
    DMT 0x2f:  1440x900    59.887445 Hz  16:10    55.935 kHz    106.500000 MHz
    DMT 0x2a:  1400x1050   59.978442 Hz   4:3     65.317 kHz    121.750000 MHz
    DMT 0x53:  1600x900    60.000000 Hz  16:9     60.000 kHz    108.000000 MHz (RB)
    DMT 0x3a:  1680x1050   59.954250 Hz  16:10    65.290 kHz    146.250000 MHz
  Detailed Timing Descriptors:
    DTD 1:  1920x1080   60.000000 Hz  16:9     67.500 kHz    148.500000 MHz (600 mm x 340 mm)
                 Hfront   88 Hsync  44 Hback  148 Hpol P
                 Vfront    4 Vsync   5 Vback   36 Vpol P
    Display Range Limits:
      Monitor ranges (GTF): 56-75 Hz V, 30-83 kHz H, max dotclock 150 MHz
    Display Product Name: '27EA63'
    Display Product Serial Number: ...
Checksum: 0xfa

----------------

Block 1, Unknown EDID Extension Block 0x00:
  00 ff ff ff ff ff ff 00 1e 6d 8a 59 63 5d 04 00 '.........m.Yc]..'
  04 17 01 03 80 3c 22 78 ea ee d5 a3 56 50 9f 26 '.....<"x....VP.&'
  10 50 54 a7 6b 80 71 4f 81 c0 81 00 81 80 95 00 '.PT.k.qO........'
  90 40 a9 c0 b3 00 02 3a 80 18 71 38 2d 40 58 2c '.@.....:..q8-@X,'
  45 00 58 54 21 00 00 1e 00 00 00 fd 00 38 4b 1e 'E.XT!........8K.'
  53 0f 00 0a 20 20 20 20 20 20 00 00 00 fc 00 32 'S...      .....2'
  37 45 41 36 33 0a 20 20 20 20 20 20 00 00 00 ff '7EA63.      ....'
  00 33 30 34 4e 44 43 52 38 45 30 35 31 0a 00 fa '.304NDCR8E051...'
Checksum: 0xfa

----------------

Failures:

Block 1, Base EDID:
  Unknown Extension Block.
EDID:
  Base EDID: EDID specified 0 extension block(s), but found 1 extension block(s).

EDID conformity: FAIL
