edid-decode (hex):

00 ff ff ff ff ff ff 00 34 a9 02 13 01 01 01 01
01 1a 01 03 80 59 32 78 0a ee 9f a3 54 4c 99 26
0f 47 4c a7 cf 00 31 40 45 40 61 40 81 00 81 80
d1 c0 01 01 01 01 02 3a 80 18 71 38 2d 40 58 2c
45 00 75 f2 31 00 00 1e 66 21 50 b0 51 00 1b 30
40 70 36 00 75 f2 31 00 00 1e 00 00 00 fc 00 50
61 6e 61 73 6f 6e 69 63 2d 54 56 0a 00 00 00 fd
00 31 50 0f 50 12 00 0a 20 20 20 20 20 20 01 b4

02 03 31 70 51 02 03 04 05 06 07 10 11 12 13 14
15 16 1f 20 21 22 29 09 1f 07 11 17 50 57 07 00
83 01 00 00 6c 03 0c 00 20 00 b8 2d c0 0c 0c 0c
0c 01 1d 00 bc 52 d0 1e 20 b8 28 55 40 75 f2 31
00 00 1e 01 1d 80 d0 72 1c 16 20 10 2c 25 80 75
f2 31 00 00 9e 8c 0a d0 8a 20 e0 2d 10 10 3e 96
00 75 f2 31 00 00 1e 02 3a 80 18 71 38 2d 40 58
2c 45 00 75 f2 31 00 00 1e 00 00 00 00 00 00 e7

----------------

Block 0, Base EDID:
  EDID Structure Version & Revision: 1.3
  Vendor & Product Identification:
    Manufacturer: MEI
    Model: 4866
    Serial Number: ...
    Made in: week 1 of 2016
  Basic Display Parameters & Features:
    Digital display
    Maximum image size: 89 cm x 50 cm
    Gamma: 2.20
    RGB color display
    First detailed timing is preferred timing
  Color Characteristics:
    Red  : 0.6396, 0.3300
    Green: 0.2998, 0.5996
    Blue : 0.1503, 0.0595
    White: 0.2802, 0.2998
  Established Timings I & II:
    IBM     :   720x400    70.082 Hz   9:5    31.467 kHz  28.320 MHz
    DMT 0x04:   640x480    59.940 Hz   4:3    31.469 kHz  25.175 MHz
    DMT 0x06:   640x480    75.000 Hz   4:3    37.500 kHz  31.500 MHz
    DMT 0x08:   800x600    56.250 Hz   4:3    35.156 kHz  36.000 MHz
    DMT 0x09:   800x600    60.317 Hz   4:3    37.879 kHz  40.000 MHz
    DMT 0x0a:   800x600    72.188 Hz   4:3    48.077 kHz  50.000 MHz
    DMT 0x0b:   800x600    75.000 Hz   4:3    46.875 kHz  49.500 MHz
    DMT 0x10:  1024x768    60.004 Hz   4:3    48.363 kHz  65.000 MHz
    DMT 0x11:  1024x768    70.069 Hz   4:3    56.476 kHz  75.000 MHz
    DMT 0x12:  1024x768    75.029 Hz   4:3    60.023 kHz  78.750 MHz
    DMT 0x24:  1280x1024   75.025 Hz   5:4    79.976 kHz 135.000 MHz
  Standard Timings:
    DMT 0x04:   640x480    59.940 Hz   4:3    31.469 kHz  25.175 MHz
    DMT 0x09:   800x600    60.317 Hz   4:3    37.879 kHz  40.000 MHz
    DMT 0x10:  1024x768    60.004 Hz   4:3    48.363 kHz  65.000 MHz
    DMT 0x1c:  1280x800    59.810 Hz  16:10   49.702 kHz  83.500 MHz
    DMT 0x23:  1280x1024   60.020 Hz   5:4    63.981 kHz 108.000 MHz
    DMT 0x52:  1920x1080   60.000 Hz  16:9    67.500 kHz 148.500 MHz
  Detailed Timing Descriptors:
    DTD 1:  1920x1080   60.000 Hz  16:9    67.500 kHz 148.500 MHz (885 mm x 498 mm)
                 Hfront   88 Hsync  44 Hback 148 Hpol P
                 Vfront    4 Vsync   5 Vback  36 Vpol P
    DTD 2:  1360x768    60.015 Hz  85:48   47.712 kHz  85.500 MHz (885 mm x 498 mm)
                 Hfront   64 Hsync 112 Hback 256 Hpol P
                 Vfront    3 Vsync   6 Vback  18 Vpol P
    Display Product Name: 'Panasonic-TV'
  Display Range Limits:
    Monitor ranges (GTF): 49-80 Hz V, 15-80 kHz H, max dotclock 180 MHz
  Extension blocks: 1
Checksum: 0xb4

----------------

Block 1, CTA-861 Extension Block:
  Revision: 3
  Basic audio support
  Supports YCbCr 4:4:4
  Supports YCbCr 4:2:2
  Native detailed modes: 0
  Video Data Block:
    VIC   2:   720x480    59.940 Hz   4:3    31.469 kHz  27.000 MHz
    VIC   3:   720x480    59.940 Hz  16:9    31.469 kHz  27.000 MHz
    VIC   4:  1280x720    60.000 Hz  16:9    45.000 kHz  74.250 MHz
    VIC   5:  1920x1080i  60.000 Hz  16:9    33.750 kHz  74.250 MHz
    VIC   6:  1440x480i   59.940 Hz   4:3    15.734 kHz  27.000 MHz
    VIC   7:  1440x480i   59.940 Hz  16:9    15.734 kHz  27.000 MHz
    VIC  16:  1920x1080   60.000 Hz  16:9    67.500 kHz 148.500 MHz
    VIC  17:   720x576    50.000 Hz   4:3    31.250 kHz  27.000 MHz
    VIC  18:   720x576    50.000 Hz  16:9    31.250 kHz  27.000 MHz
    VIC  19:  1280x720    50.000 Hz  16:9    37.500 kHz  74.250 MHz
    VIC  20:  1920x1080i  50.000 Hz  16:9    28.125 kHz  74.250 MHz
    VIC  21:  1440x576i   50.000 Hz   4:3    15.625 kHz  27.000 MHz
    VIC  22:  1440x576i   50.000 Hz  16:9    15.625 kHz  27.000 MHz
    VIC  31:  1920x1080   50.000 Hz  16:9    56.250 kHz 148.500 MHz
    VIC  32:  1920x1080   24.000 Hz  16:9    27.000 kHz  74.250 MHz
    VIC  33:  1920x1080   25.000 Hz  16:9    28.125 kHz  74.250 MHz
    VIC  34:  1920x1080   30.000 Hz  16:9    33.750 kHz  74.250 MHz
  Audio Data Block:
    Linear PCM:
      Max channels: 2
      Supported sample rates (kHz): 96 88.2 48 44.1 32
      Supported sample sizes (bits): 24 20 16
    AC-3:
      Max channels: 2
      Supported sample rates (kHz): 96 48 44.1 32
      Maximum bit rate: 640 kb/s
    Dolby Digital+:
      Max channels: 8
      Supported sample rates (kHz): 48 44.1 32
  Speaker Allocation Data Block:
    FL/FR - Front Left/Right
  Vendor-Specific Data Block (HDMI), OUI 00-0C-03:
    Source physical address: 2.0.0.0
    Supports_AI
    DC_36bit
    DC_30bit
    DC_Y444
    Maximum TMDS clock: 225 MHz
    Video latency: 25 ms
    Audio latency: 25 ms
    Interlaced video latency: 25 ms
    Interlaced audio latency: 25 ms
  Detailed Timing Descriptors:
    DTD 3:  1280x720    50.000 Hz  16:9    37.500 kHz  74.250 MHz (885 mm x 498 mm)
                 Hfront  440 Hsync  40 Hback 220 Hpol P
                 Vfront    5 Vsync   5 Vback  20 Vpol P
    DTD 4:  1920x1080i  50.000 Hz  16:9    28.125 kHz  74.250 MHz (885 mm x 498 mm)
                 Hfront  528 Hsync  44 Hback 148 Hpol P
                 Vfront    2 Vsync   5 Vback  15 Vpol P Vfront +0.5 Odd Field
                 Vfront    2 Vsync   5 Vback  15 Vpol P Vback  +0.5 Even Field
    DTD 5:   720x480    59.940 Hz   3:2    31.469 kHz  27.000 MHz (885 mm x 498 mm)
                 Hfront   16 Hsync  62 Hback  60 Hpol P
                 Vfront    9 Vsync   6 Vback  30 Vpol P
    DTD 6:  1920x1080   60.000 Hz  16:9    67.500 kHz 148.500 MHz (885 mm x 498 mm)
                 Hfront   88 Hsync  44 Hback 148 Hpol P
                 Vfront    4 Vsync   5 Vback  36 Vpol P
Checksum: 0xe7

----------------

Warnings:

Block 1, CTA-861 Extension Block:
  Video Data Block: VIC 2 is the preferred timing, overriding the first detailed timings. Is this intended?

Failures:

All Blocks:
  Some timings are out of range of the Monitor Ranges:
    Vertical Freq: 24.000 - 75.029 Hz (Monitor: 49.000 - 80.000 Hz)

EDID conformity: FAIL
