edid-decode (hex):

00 ff ff ff ff ff ff 00 06 af 90 dc 00 00 00 00
00 1e 01 04 95 1f 11 78 03 2a f5 92 56 58 92 29
20 50 54 00 00 00 01 01 01 01 01 01 01 01 01 01
01 01 01 01 01 01 14 37 80 b8 70 38 24 40 6c 30
aa 00 35 ae 10 00 00 18 b8 24 80 b8 70 38 24 40
6c 30 aa 00 35 ae 10 00 00 18 00 00 00 00 00 00
00 00 00 00 00 00 00 00 00 00 00 00 00 00 00 02
00 10 48 ff 0f 3c 7d 11 25 1f 7d 20 20 20 00 f0

----------------

Block 0, Base EDID:
  EDID Structure Version & Revision: 1.4
  Vendor & Product Identification:
    Manufacturer: AUO
    Model: 56464
    Made in: 2020
  Basic Display Parameters & Features:
    Digital display
    Bits per primary color channel: 6
    DisplayPort interface
    Maximum image size: 31 cm x 17 cm
    Gamma: 2.20
    Supported color formats: RGB 4:4:4
    First detailed timing includes the native pixel format and preferred refresh rate
    Display is continuous frequency
  Color Characteristics:
    Red  : 0.5703, 0.3378
    Green: 0.3457, 0.5722
    Blue : 0.1630, 0.1279
    White: 0.3134, 0.3291
  Established Timings I & II: none
  Standard Timings: none
  Detailed Timing Descriptors:
    DTD 1:  1920x1080   60.049471 Hz  16:9     67.015 kHz    141.000000 MHz (309 mm x 174 mm)
                 Hfront  108 Hsync  48 Hback   28 Hpol N
                 Vfront   10 Vsync  10 Vback   16 Vpol N
    DTD 2:  1920x1080   40.032980 Hz  16:9     44.677 kHz     94.000000 MHz (309 mm x 174 mm)
                 Hfront  108 Hsync  48 Hback   28 Hpol N
                 Vfront   10 Vsync  10 Vback   16 Vpol N
    Empty Descriptor
    Manufacturer-Specified Display Descriptor (0x02): 00 02 00 10 48 ff 0f 3c 7d 11 25 1f 7d 20 20 20 '....H..<}.%.}   '
Checksum: 0xf0

----------------

Failures:

Block 0, Base EDID:
  Empty Descriptor: Use Dummy Descriptor instead of all zeroes.
  Missing Display Product Name.
  Missing Display Range Limits Descriptor.

EDID conformity: FAIL
