edid-decode (hex):

00 ff ff ff ff ff ff 00 06 af ec 30 00 00 00 00
01 13 01 03 80 22 13 78 0a 6b 2a 9d 4c 42 84 1c
0d 48 4c 00 00 00 01 01 01 01 01 01 01 01 01 01
01 01 01 01 01 01 58 1b 56 67 50 00 1a 30 30 20
36 00 58 c1 10 00 00 18 00 00 00 0f 00 00 00 00
00 00 00 00 00 00 00 00 00 20 00 00 00 fe 00 41
55 4f 0a 20 20 20 20 20 20 20 20 20 00 00 00 fe
00 42 31 35 36 58 57 30 33 20 56 30 20 0a 00 4a

----------------

Block 0, Base EDID:
  EDID Structure Version & Revision: 1.3
  Vendor & Product Identification:
    Manufacturer: AUO
    Model: 12524
    Made in: week 1 of 2009
  Basic Display Parameters & Features:
    Digital display
    Maximum image size: 34 cm x 19 cm
    Gamma: 2.20
    RGB color display
    First detailed timing is preferred timing
  Color Characteristics:
    Red  : 0.6142, 0.2988
    Green: 0.2597, 0.5185
    Blue : 0.1093, 0.0527
    White: 0.2832, 0.2988
  Established Timings I & II: none
  Standard Timings: none
  Detailed Timing Descriptors:
    DTD 1:  1366x768    60.014 Hz 683:384  47.651 kHz  70.000 MHz (344 mm x 193 mm)
                 Hfront   48 Hsync  32 Hback  23 Hpol N
                 Vfront    3 Vsync   6 Vback  17 Vpol N
    Manufacturer-Specified Display Descriptor (0x0f): 00 0f 00 00 00 00 00 00 00 00 00 00 00 00 00 20 '............... '
    Alphanumeric Data String: 'AUO'
    Alphanumeric Data String: 'B156XW03 V0 '
Checksum: 0x4a
