
EDID (hex):
00ffffffffffff0026cd095670020000
2012010381301e782a0405a556479e25
155054bfef808180714f8140b3009500
01010101010121399030621a274068b0
3600d1231100001c000000ff00303539
39383833323030363234000000fd0037
4c1d510f000a202020202020000000fc
00504c453232303757530a2020200040

Extracted contents:
header:          00 ff ff ff ff ff ff 00
serial number:   26 cd 09 56 70 02 00 00 20 12
version:         01 03
basic params:    81 30 1e 78 2a
chroma info:     04 05 a5 56 47 9e 25 15 50 54
established:     bf ef 80
standard:        81 80 71 4f 81 40 b3 00 95 00 01 01 01 01 01 01
descriptor 1:    21 39 90 30 62 1a 27 40 68 b0 36 00 d1 23 11 00 00 1c
descriptor 2:    00 00 00 ff 00 30 35 39 39 38 38 33 32 30 30 36 32 34
descriptor 3:    00 00 00 fd 00 37 4c 1d 51 0f 00 0a 20 20 20 20 20 20
descriptor 4:    00 00 00 fc 00 50 4c 45 32 32 30 37 57 53 0a 20 20 20
extensions:      00
checksum:        40

EDID version: 1.3
Manufacturer: IVM Model 5609 Serial Number --
Made in week 32 of 2008
Digital display
DFP 1.x compatible TMDS
Maximum image size: 48 cm x 30 cm
Gamma: 2.20
DPMS levels: Off
RGB color display
First detailed timing is preferred timing
Display x,y Chromaticity:
  Red:   0.6445, 0.3359
  Green: 0.2783, 0.6171
  Blue:  0.1445, 0.0820
  White: 0.3134, 0.3291
Established timings supported:
  720x400@70Hz 9:5 HorFreq: 31469 Hz Clock: 28.320 MHz
  640x480@60Hz 4:3 HorFreq: 31469 Hz Clock: 25.175 MHz
  640x480@67Hz 4:3 HorFreq: 35000 Hz Clock: 30.240 MHz
  640x480@72Hz 4:3 HorFreq: 37900 Hz Clock: 31.500 MHz
  640x480@75Hz 4:3 HorFreq: 37500 Hz Clock: 31.500 MHz
  800x600@56Hz 4:3 HorFreq: 35200 Hz Clock: 36.000 MHz
  800x600@60Hz 4:3 HorFreq: 37900 Hz Clock: 40.000 MHz
  800x600@72Hz 4:3 HorFreq: 48100 Hz Clock: 50.000 MHz
  800x600@75Hz 4:3 HorFreq: 46900 Hz Clock: 49.500 MHz
  832x624@75Hz 4:3 HorFreq: 49726 Hz Clock: 57.284 MHz
  1024x768@60Hz 4:3 HorFreq: 48400 Hz Clock: 65.000 MHz
  1024x768@70Hz 4:3 HorFreq: 56500 Hz Clock: 75.000 MHz
  1024x768@75Hz 4:3 HorFreq: 60000 Hz Clock: 78.750 MHz
  1280x1024@75Hz 5:4 HorFreq: 80000 Hz Clock: 135.000 MHz
  1152x870@75Hz 192:145 HorFreq: 67500 Hz Clock: 108.000 MHz
Standard timings supported:
  1280x1024@60Hz 5:4 HorFreq: 64000 Hz Clock: 108.000 MHz
  1152x864@75Hz 4:3 HorFreq: 67500 Hz Clock: 108.000 MHz
  1280x960@60Hz 4:3 HorFreq: 60000 Hz Clock: 108.000 MHz
  1680x1050@60Hz 16:10 HorFreq: 64700 Hz Clock: 119.000 MHz
  1440x900@60Hz 16:10 HorFreq: 55500 Hz Clock: 88.750 MHz
Detailed mode: Clock 146.250 MHz, 465 mm x 291 mm
               1680 1784 1960 2240 hborder 0
               1050 1053 1059 1089 vborder 0
               -hsync +vsync 
               VertFreq: 59 Hz, HorFreq: 65290 Hz
Serial number: --
Monitor ranges (GTF): 55-76Hz V, 29-81kHz H, max dotclock 150MHz
Monitor name: PLE2207WS
Checksum: 0x40 (valid)


