
EDID (hex):
00ffffffffffff0006af3c2200000000
00140104901f11780297f59b59548c25
22505400000001010101010101010101
010101010101121b5646500023302616
360035ad100000180c12564650002330
2616360035ad10000018000000000000
00000000000000000000000000000002
000c33f90a3c641f14226e202020007d

Extracted contents:
header:          00 ff ff ff ff ff ff 00
serial number:   06 af 3c 22 00 00 00 00 00 14
version:         01 04
basic params:    90 1f 11 78 02
chroma info:     97 f5 9b 59 54 8c 25 22 50 54
established:     00 00 00
standard:        01 01 01 01 01 01 01 01 01 01 01 01 01 01 01 01
descriptor 1:    12 1b 56 46 50 00 23 30 26 16 36 00 35 ad 10 00 00 18
descriptor 2:    0c 12 56 46 50 00 23 30 26 16 36 00 35 ad 10 00 00 18
descriptor 3:    00 00 00 00 00 00 00 00 00 00 00 00 00 00 00 00 00 00
descriptor 4:    00 00 00 02 00 0c 33 f9 0a 3c 64 1f 14 22 6e 20 20 20
extensions:      00
checksum:        7d

EDID version: 1.4
Manufacturer: AUO Model 223c Serial Number --
Made in year 2010
Digital display
6 bits per primary color channel
Digital interface is not defined
Maximum image size: 31 cm x 17 cm
Gamma: 2.20
Supported color formats: RGB 4:4:4
First detailed timing includes the native pixel format and preferred refresh rate
Display x,y Chromaticity:
  Red:   0.6074, 0.3486
  Green: 0.3291, 0.5498
  Blue:  0.1474, 0.1357
  White: 0.3134, 0.3291
Established timings supported:
Standard timings supported:
Detailed mode: Clock 69.300 MHz, 309 mm x 173 mm
               1366 1404 1426 1436 hborder 0
                768  771  777  803 vborder 0
               -hsync -vsync 
               VertFreq: 60 Hz, HorFreq: 48259 Hz
Detailed mode: Clock 46.200 MHz, 309 mm x 173 mm
               1366 1404 1426 1436 hborder 0
                768  771  777  803 vborder 0
               -hsync -vsync 
               VertFreq: 40 Hz, HorFreq: 32172 Hz
Manufacturer-specified data, tag 0
Manufacturer-specified data, tag 2
Checksum: 0x7d (valid)
EDID block does NOT conform to EDID 1.4!
	Missing name descriptor
	Missing monitor ranges
