edid-decode (hex):

00 ff ff ff ff ff ff 00 22 70 1c 00 07 0a 00 00
06 13 01 03 08 3b 25 78 2a af f6 a6 54 4c 9e 23
10 4f 54 21 08 00 81 80 95 00 b3 00 01 01 01 01
01 01 01 01 01 01 21 39 90 30 62 1a 27 40 68 b0
36 00 51 72 21 00 00 1c 00 00 00 ff 00 32 35 36
37 0a 20 20 20 20 20 20 20 20 00 00 00 fd 00 3b
3d 1f 42 0f 00 0a 20 20 20 20 20 20 00 00 00 fc
00 54 32 38 30 48 0a 20 20 20 20 20 20 20 00 52

00 ff ff ff ff ff ff 00 22 70 1c 00 07 0a 00 00
06 13 01 03 08 3b 25 78 2a af f6 a6 54 4c 9e 23
10 4f 54 21 08 00 81 80 95 00 b3 00 01 01 01 01
01 01 01 01 01 01 21 39 90 30 62 1a 27 40 68 b0
36 00 51 72 21 00 00 1c 00 00 00 ff 00 32 35 36
37 0a 20 20 20 20 20 20 20 20 00 00 00 fd 00 3b
3d 1f 42 0f 00 0a 20 20 20 20 20 20 00 00 00 fc
00 54 32 38 30 48 0a 20 20 20 20 20 20 20 00 52

----------------

Block 0, Base EDID:
  EDID Structure Version & Revision: 1.3
  Vendor & Product Identification:
    Manufacturer: HSP
    Model: 28
    Serial Number: ...
    Made in: week 6 of 2009
  Basic Display Parameters & Features:
    Analog display
    Signal Level Standard: 0.700 : 0.300 : 1.000 V p-p
    Blank level equals black level
    Sync: Separate
    Maximum image size: 59 cm x 37 cm
    Gamma: 2.20
    DPMS levels: Off
    RGB color display
    First detailed timing is the preferred timing
  Color Characteristics:
    Red  : 0.6503, 0.3300
    Green: 0.2998, 0.6201
    Blue : 0.1396, 0.0654
    White: 0.3095, 0.3300
  Established Timings I & II:
    DMT 0x04:   640x480    59.940476 Hz   4:3     31.469 kHz     25.175000 MHz
    DMT 0x09:   800x600    60.316541 Hz   4:3     37.879 kHz     40.000000 MHz
    DMT 0x10:  1024x768    60.003840 Hz   4:3     48.363 kHz     65.000000 MHz
  Standard Timings:
    DMT 0x23:  1280x1024   60.019740 Hz   5:4     63.981 kHz    108.000000 MHz
    DMT 0x2f:  1440x900    59.887445 Hz  16:10    55.935 kHz    106.500000 MHz
    DMT 0x3a:  1680x1050   59.954250 Hz  16:10    65.290 kHz    146.250000 MHz
  Detailed Timing Descriptors:
    DTD 1:  1680x1050   59.954250 Hz  16:10    65.290 kHz    146.250000 MHz (593 mm x 370 mm)
                 Hfront  104 Hsync 176 Hback  280 Hpol N
                 Vfront    3 Vsync   6 Vback   30 Vpol P
    Display Product Serial Number: ...
    Display Range Limits:
      Monitor ranges (GTF): 59-61 Hz V, 31-66 kHz H, max dotclock 150 MHz
    Display Product Name: 'T280H'
Checksum: 0x52

----------------

Block 1, Unknown EDID Extension Block 0x00:
  00 ff ff ff ff ff ff 00 22 70 1c 00 07 0a 00 00 '........"p......'
  06 13 01 03 08 3b 25 78 2a af f6 a6 54 4c 9e 23 '.....;%x*...TL.#'
  10 4f 54 21 08 00 81 80 95 00 b3 00 01 01 01 01 '.OT!............'
  01 01 01 01 01 01 21 39 90 30 62 1a 27 40 68 b0 '......!9.0b.'@h.'
  36 00 51 72 21 00 00 1c 00 00 00 ff 00 32 35 36 '6.Qr!........256'
  37 0a 20 20 20 20 20 20 20 20 00 00 00 fd 00 3b '7.        .....;'
  3d 1f 42 0f 00 0a 20 20 20 20 20 20 00 00 00 fc '=.B...      ....'
  00 54 32 38 30 48 0a 20 20 20 20 20 20 20 00 52 '.T280H.       .R'
Checksum: 0x52

----------------

Failures:

Block 1, Base EDID:
  Unknown Extension Block.
EDID:
  Base EDID: EDID specified 0 extension block(s), but found 1 extension block(s).

EDID conformity: FAIL
