
EDID (hex):
00ffffffffffff0030ae008001000000
14180103802f1a780aebf5a656519c26
10505400000001010101010101010101
010101010101fe33805470381b40201c
8400dd0c1100001e000000fc004c4247
2041494f2050430a2020000000fe004c
4d3231355746332d534c4b31000000ff
004c544d323135485430350a202000bc

Extracted contents:
header:          00 ff ff ff ff ff ff 00
serial number:   30 ae 00 80 01 00 00 00 14 18
version:         01 03
basic params:    80 2f 1a 78 0a
chroma info:     eb f5 a6 56 51 9c 26 10 50 54
established:     00 00 00
standard:        01 01 01 01 01 01 01 01 01 01 01 01 01 01 01 01
descriptor 1:    fe 33 80 54 70 38 1b 40 20 1c 84 00 dd 0c 11 00 00 1e
descriptor 2:    00 00 00 fc 00 4c 42 47 20 41 49 4f 20 50 43 0a 20 20
descriptor 3:    00 00 00 fe 00 4c 4d 32 31 35 57 46 33 2d 53 4c 4b 31
descriptor 4:    00 00 00 ff 00 4c 54 4d 32 31 35 48 54 30 35 0a 20 20
extensions:      00
checksum:        bc

EDID version: 1.3
Manufacturer: LEN Model 8000 Serial Number --
Made in week 20 of 2014
Digital display
Maximum image size: 47 cm x 26 cm
Gamma: 2.20
RGB color display
First detailed timing is preferred timing
Display x,y Chromaticity:
  Red:   0.6513, 0.3378
  Green: 0.3183, 0.6123
  Blue:  0.1513, 0.0654
  White: 0.3134, 0.3291
Established timings supported:
Standard timings supported:
Detailed mode: Clock 133.100 MHz, 477 mm x 268 mm
               1920 1952 1980 2004 hborder 0
               1080 1088 1092 1107 vborder 0
               +hsync +vsync 
               VertFreq: 59 Hz, HorFreq: 66417 Hz
Monitor name: LBG AIO PC
ASCII string: LM215WF3-SLK1
Serial number: --
Checksum: 0xbc (valid)
EDID block does NOT conform to EDID 1.3!
	Missing monitor ranges
