edid-decode (hex):

00 ff ff ff ff ff ff 00 30 ae 00 80 01 00 00 00
15 18 01 04 a5 34 1d 78 0b 2c c5 a4 56 50 a1 28
0f 50 54 00 00 00 01 01 01 01 01 01 01 01 01 01
01 01 01 01 01 01 02 3a 80 18 71 38 2d 40 58 2c
45 00 09 25 21 00 00 1e 00 00 00 10 00 0a 20 20
20 20 20 20 20 20 20 20 20 20 00 00 00 fd 00 39
3e 1e 5a 14 35 00 55 50 21 00 00 1a 00 00 00 fc
00 4c 42 47 20 41 49 4f 20 50 43 0a 20 20 00 9f

----------------

Block 0, Base EDID:
  EDID Structure Version & Revision: 1.4
  Vendor & Product Identification:
    Manufacturer: LEN
    Model: 32768
    Serial Number: ...
    Made in: week 21 of 2014
  Basic Display Parameters & Features:
    Digital display
    Bits per primary color channel: 8
    DisplayPort interface
    Maximum image size: 52 cm x 29 cm
    Gamma: 2.20
    Supported color formats: RGB 4:4:4, YCrCb 4:4:4
    First detailed timing includes the native pixel format and preferred refresh rate
    Display is continuous frequency
  Color Characteristics:
    Red  : 0.6406, 0.3378
    Green: 0.3154, 0.6289
    Blue : 0.1591, 0.0585
    White: 0.3134, 0.3291
  Established Timings I & II: none
  Standard Timings: none
  Detailed Timing Descriptors:
    DTD 1:  1920x1080   60.000 Hz  16:9    67.500 kHz 148.500 MHz (521 mm x 293 mm)
                 Hfront   88 Hsync  44 Hback 148 Hpol P
                 Vfront    4 Vsync   5 Vback  36 Vpol P
    Dummy Descriptor:
  Display Range Limits:
    Monitor ranges (Unknown (0x35)): 57-62 Hz V, 30-90 kHz H, max dotclock 200 MHz
    Display Product Name: 'LBG AIO PC'
Checksum: 0x9f
