
EDID (hex):
00ffffffffffff004c2dfc0633324d43
0c1501030e331d782aee91a3544c9926
0f50542308008100814081809500b300
a94001010101023a801871382d40582c
4500dd0c1100001e000000fd00383d1e
4b11000a202020202020000000fc0053
4d32333333544e0a20202020000000ff
00485653423330303136340a202000dc

Extracted contents:
header:          00 ff ff ff ff ff ff 00
serial number:   4c 2d fc 06 33 32 4d 43 0c 15
version:         01 03
basic params:    0e 33 1d 78 2a
chroma info:     ee 91 a3 54 4c 99 26 0f 50 54
established:     23 08 00
standard:        81 00 81 40 81 80 95 00 b3 00 a9 40 01 01 01 01
descriptor 1:    02 3a 80 18 71 38 2d 40 58 2c 45 00 dd 0c 11 00 00 1e
descriptor 2:    00 00 00 fd 00 38 3d 1e 4b 11 00 0a 20 20 20 20 20 20
descriptor 3:    00 00 00 fc 00 53 4d 32 33 33 33 54 4e 0a 20 20 20 20
descriptor 4:    00 00 00 ff 00 48 56 53 42 33 30 30 31 36 34 0a 20 20
extensions:      00
checksum:        dc

EDID version: 1.3
Manufacturer: SAM Model 6fc Serial Number --
Made in week 12 of 2011
Analog display, Input voltage level: 0.7/0.3 V
Sync: Separate Composite SyncOnGreen 
Maximum image size: 51 cm x 29 cm
Gamma: 2.20
DPMS levels: Off
RGB color display
First detailed timing is preferred timing
Display x,y Chromaticity:
  Red:   0.6396, 0.3300
  Green: 0.2998, 0.5996
  Blue:  0.1503, 0.0595
  White: 0.3125, 0.3291
Established timings supported:
  640x480@60Hz 4:3 HorFreq: 31469 Hz Clock: 25.175 MHz
  800x600@56Hz 4:3 HorFreq: 35200 Hz Clock: 36.000 MHz
  800x600@60Hz 4:3 HorFreq: 37900 Hz Clock: 40.000 MHz
  1024x768@60Hz 4:3 HorFreq: 48400 Hz Clock: 65.000 MHz
Standard timings supported:
  1280x800@60Hz 16:10
  1280x960@60Hz 4:3 HorFreq: 60000 Hz Clock: 108.000 MHz
  1280x1024@60Hz 5:4 HorFreq: 64000 Hz Clock: 108.000 MHz
  1440x900@60Hz 16:10 HorFreq: 55500 Hz Clock: 88.750 MHz
  1680x1050@60Hz 16:10 HorFreq: 64700 Hz Clock: 119.000 MHz
  1600x1200@60Hz 4:3 HorFreq: 75000 Hz Clock: 162.000 MHz
Detailed mode: Clock 148.500 MHz, 477 mm x 268 mm
               1920 2008 2052 2200 hborder 0
               1080 1084 1089 1125 vborder 0
               +hsync +vsync 
               VertFreq: 60 Hz, HorFreq: 67500 Hz
Monitor ranges (GTF): 56-61Hz V, 30-75kHz H, max dotclock 170MHz
Monitor name: SM2333TN
Serial number: --
Checksum: 0xdc (valid)
