edid-decode (hex):

00 ff ff ff ff ff ff 00 44 93 3f 00 00 00 00 00
00 0f 01 03 80 21 14 78 0a 2e a0 91 54 4e 8d 28
24 50 54 00 00 00 01 01 01 01 01 01 01 01 01 01
01 01 01 01 01 01 7c 2e 90 a0 60 1a 1e 40 30 20
36 00 4b cf 10 00 00 18 00 00 00 0f 00 06 32 0c
78 01 14 02 14 1e 8c 02 19 00 00 00 00 fe 00 51
55 41 4e 54 41 44 49 53 50 4c 41 59 00 00 00 fe
00 51 44 31 35 41 4c 30 31 33 0a 20 20 20 00 81

00 ff ff ff ff ff ff 00 44 93 3f 00 00 00 00 00
00 0f 01 03 80 21 14 78 0a 2e a0 91 54 4e 8d 28
24 50 54 00 00 00 01 01 01 01 01 01 01 01 01 01
01 01 01 01 01 01 7c 2e 90 a0 60 1a 1e 40 30 20
36 00 4b cf 10 00 00 18 00 00 00 0f 00 06 32 0c
78 01 14 02 14 1e 8c 02 19 00 00 00 00 fe 00 51
55 41 4e 54 41 44 49 53 50 4c 41 59 00 00 00 fe
00 51 44 31 35 41 4c 30 31 33 0a 20 20 20 00 81

----------------

Block 0, Base EDID:
  EDID Structure Version & Revision: 1.3
  Vendor & Product Identification:
    Manufacturer: QDS
    Model: 63
    Made in: 2005
  Basic Display Parameters & Features:
    Digital display
    Maximum image size: 33 cm x 20 cm
    Gamma: 2.20
    RGB color display
    First detailed timing is the preferred timing
  Color Characteristics:
    Red  : 0.5664, 0.3300
    Green: 0.3076, 0.5527
    Blue : 0.1582, 0.1425
    White: 0.3125, 0.3281
  Established Timings I & II: none
  Standard Timings: none
  Detailed Timing Descriptors:
    DTD 1:  1680x1050   59.883253 Hz  16:10    64.674 kHz    119.000000 MHz (331 mm x 207 mm)
                 Hfront   48 Hsync  32 Hback   80 Hpol N
                 Vfront    3 Vsync   6 Vback   21 Vpol N
    Manufacturer-Specified Display Descriptor (0x0f): 00 0f 00 06 32 0c 78 01 14 02 14 1e 8c 02 19 00 '....2.x.........'
    Alphanumeric Data String: 'QUANTADISPLAY'
    Alphanumeric Data String: 'QD15AL013'
Checksum: 0x81

----------------

Block 1, Unknown EDID Extension Block 0x00:
  00 ff ff ff ff ff ff 00 44 93 3f 00 00 00 00 00 '........D.?.....'
  00 0f 01 03 80 21 14 78 0a 2e a0 91 54 4e 8d 28 '.....!.x....TN.('
  24 50 54 00 00 00 01 01 01 01 01 01 01 01 01 01 '$PT.............'
  01 01 01 01 01 01 7c 2e 90 a0 60 1a 1e 40 30 20 '......|...`..@0 '
  36 00 4b cf 10 00 00 18 00 00 00 0f 00 06 32 0c '6.K...........2.'
  78 01 14 02 14 1e 8c 02 19 00 00 00 00 fe 00 51 'x..............Q'
  55 41 4e 54 41 44 49 53 50 4c 41 59 00 00 00 fe 'UANTADISPLAY....'
  00 51 44 31 35 41 4c 30 31 33 0a 20 20 20 00 81 '.QD15AL013.   ..'
Checksum: 0x81

----------------

Warnings:

Block 0, Base EDID:
  Detailed Timing Descriptor #1: DTD is similar but not identical to DMT 0x39.

Failures:

Block 0, Base EDID:
  Missing Display Product Name.
  Missing Display Range Limits Descriptor.
Block 1, Base EDID:
  Unknown Extension Block.
EDID:
  Base EDID: EDID specified 0 extension block(s), but found 1 extension block(s).

EDID conformity: FAIL
