
EDID (hex):
00ffffffffffff0006b3ef2701010101
0a220104b53c2278eba255ac5046ab26
0c5054bfcf00d1c0b300950081408180
81c0714001016a5e00a0a0a029503020
350055502100001a000000fd0030b4df
df48010a202020202020000000fc0056
473237415133410a20202020000000ff
0053334c4d41533030383532340a02fa
020334614b01030204901211131f3f40
23090707830100006d1a0000020130b4
000000000000e305c001e60605815050
44e200ea23e50050a0a067500820f80c
55502100001c70c200a0a0a055503020
350055502100001a70a000a0a0a04650
3020350055502100001a000000000000
00000000000000000000000000000052
701279030003013cb8080104ff099f00
2f801f009f05450002000400520b0104
ff099f002f801f009f05270002000400
6b110104ff09610027800f009f051600
02000400000000000000000000000000
00000000000000000000000000000000
00000000000000000000000000000000
00000000000000000000000000000190

edid-decode (hex):

00 ff ff ff ff ff ff 00 06 b3 ef 27 01 01 01 01
0a 22 01 04 b5 3c 22 78 eb a2 55 ac 50 46 ab 26
0c 50 54 bf cf 00 d1 c0 b3 00 95 00 81 40 81 80
81 c0 71 40 01 01 6a 5e 00 a0 a0 a0 29 50 30 20
35 00 55 50 21 00 00 1a 00 00 00 fd 00 30 b4 df
df 48 01 0a 20 20 20 20 20 20 00 00 00 fc 00 56
47 32 37 41 51 33 41 0a 20 20 20 20 00 00 00 ff
00 53 33 4c 4d 41 53 30 30 38 35 32 34 0a 02 fa

02 03 34 61 4b 01 03 02 04 90 12 11 13 1f 3f 40
23 09 07 07 83 01 00 00 6d 1a 00 00 02 01 30 b4
00 00 00 00 00 00 e3 05 c0 01 e6 06 05 81 50 50
44 e2 00 ea 23 e5 00 50 a0 a0 67 50 08 20 f8 0c
55 50 21 00 00 1c 70 c2 00 a0 a0 a0 55 50 30 20
35 00 55 50 21 00 00 1a 70 a0 00 a0 a0 a0 46 50
30 20 35 00 55 50 21 00 00 1a 00 00 00 00 00 00
00 00 00 00 00 00 00 00 00 00 00 00 00 00 00 52

70 12 79 03 00 03 01 3c b8 08 01 04 ff 09 9f 00
2f 80 1f 00 9f 05 45 00 02 00 04 00 52 0b 01 04
ff 09 9f 00 2f 80 1f 00 9f 05 27 00 02 00 04 00
6b 11 01 04 ff 09 61 00 27 80 0f 00 9f 05 16 00
02 00 04 00 00 00 00 00 00 00 00 00 00 00 00 00
00 00 00 00 00 00 00 00 00 00 00 00 00 00 00 00
00 00 00 00 00 00 00 00 00 00 00 00 00 00 00 00
00 00 00 00 00 00 00 00 00 00 00 00 00 00 01 90

----------------

Block 0, Base EDID:
  EDID Structure Version & Revision: 1.4
  Vendor & Product Identification:
    Manufacturer: AUS
    Model: 10223
    Serial Number: 16843009
    Made in: week 10 of 2024
  Basic Display Parameters & Features:
    Digital display
    Bits per primary color channel: 10
    DisplayPort interface
    Maximum image size: 60 cm x 34 cm
    Gamma: 2.20
    DPMS levels: Standby Suspend Off
    Supported color formats: RGB 4:4:4, YCrCb 4:4:4
    First detailed timing includes the native pixel format and preferred refresh rate
    Display is continuous frequency
  Color Characteristics:
    Red  : 0.6738, 0.3144
    Green: 0.2734, 0.6699
    Blue : 0.1494, 0.0478
    White: 0.3134, 0.3291
  Established Timings I & II:
    IBM     :   720x400    70.081663 Hz   9:5     31.467 kHz     28.320000 MHz
    DMT 0x04:   640x480    59.940476 Hz   4:3     31.469 kHz     25.175000 MHz
    Apple   :   640x480    66.666667 Hz   4:3     35.000 kHz     30.240000 MHz
    DMT 0x05:   640x480    72.808802 Hz   4:3     37.861 kHz     31.500000 MHz
    DMT 0x06:   640x480    75.000000 Hz   4:3     37.500 kHz     31.500000 MHz
    DMT 0x08:   800x600    56.250000 Hz   4:3     35.156 kHz     36.000000 MHz
    DMT 0x09:   800x600    60.316541 Hz   4:3     37.879 kHz     40.000000 MHz
    DMT 0x0a:   800x600    72.187572 Hz   4:3     48.077 kHz     50.000000 MHz
    DMT 0x0b:   800x600    75.000000 Hz   4:3     46.875 kHz     49.500000 MHz
    DMT 0x10:  1024x768    60.003840 Hz   4:3     48.363 kHz     65.000000 MHz
    DMT 0x11:  1024x768    70.069359 Hz   4:3     56.476 kHz     75.000000 MHz
    DMT 0x12:  1024x768    75.028582 Hz   4:3     60.023 kHz     78.750000 MHz
    DMT 0x24:  1280x1024   75.024675 Hz   5:4     79.976 kHz    135.000000 MHz
  Standard Timings:
    DMT 0x52:  1920x1080   60.000000 Hz  16:9     67.500 kHz    148.500000 MHz
    DMT 0x3a:  1680x1050   59.954250 Hz  16:10    65.290 kHz    146.250000 MHz
    DMT 0x2f:  1440x900    59.887445 Hz  16:10    55.935 kHz    106.500000 MHz
    DMT 0x20:  1280x960    60.000000 Hz   4:3     60.000 kHz    108.000000 MHz
    DMT 0x23:  1280x1024   60.019740 Hz   5:4     63.981 kHz    108.000000 MHz
    DMT 0x55:  1280x720    60.000000 Hz  16:9     45.000 kHz     74.250000 MHz
    GTF     :  1152x864    60.000000 Hz   4:3     53.700 kHz     81.624000 MHz
  Detailed Timing Descriptors:
    DTD 1:  2560x1440   60.000199 Hz  16:9     88.860 kHz    241.700000 MHz (597 mm x 336 mm)
                 Hfront   48 Hsync  32 Hback   80 Hpol P
                 Vfront    3 Vsync   5 Vback   33 Vpol N
    Display Range Limits:
      Monitor ranges (Bare Limits): 48-180 Hz V, 223-223 kHz H, max dotclock 720 MHz
    Display Product Name: 'VG27AQ3A'
    Display Product Serial Number: 'S3LMAS008524'
  Extension blocks: 2
Checksum: 0xfa

----------------

Block 1, CTA-861 Extension Block:
  Revision: 3
  Basic audio support
  Supports YCbCr 4:4:4
  Native detailed modes: 1
  Video Data Block:
    VIC   1:   640x480    59.940476 Hz   4:3     31.469 kHz     25.175000 MHz
    VIC   3:   720x480    59.940060 Hz  16:9     31.469 kHz     27.000000 MHz
    VIC   2:   720x480    59.940060 Hz   4:3     31.469 kHz     27.000000 MHz
    VIC   4:  1280x720    60.000000 Hz  16:9     45.000 kHz     74.250000 MHz
    VIC  16:  1920x1080   60.000000 Hz  16:9     67.500 kHz    148.500000 MHz (native)
    VIC  18:   720x576    50.000000 Hz  16:9     31.250 kHz     27.000000 MHz
    VIC  17:   720x576    50.000000 Hz   4:3     31.250 kHz     27.000000 MHz
    VIC  19:  1280x720    50.000000 Hz  16:9     37.500 kHz     74.250000 MHz
    VIC  31:  1920x1080   50.000000 Hz  16:9     56.250 kHz    148.500000 MHz
    VIC  63:  1920x1080  120.000000 Hz  16:9    135.000 kHz    297.000000 MHz
    VIC  64:  1920x1080  100.000000 Hz  16:9    112.500 kHz    297.000000 MHz
  Audio Data Block:
    Linear PCM:
      Max channels: 2
      Supported sample rates (kHz): 48 44.1 32
      Supported sample sizes (bits): 24 20 16
  Speaker Allocation Data Block:
    FL/FR - Front Left/Right
  Vendor-Specific Data Block (AMD), OUI 00-00-1A:
    Version: 2.1
    Minimum Refresh Rate: 48 Hz
    Maximum Refresh Rate: 180 Hz
    Flags 1.x: 0x00
    Flags 2.x: 0x00
    Maximum luminance: 0 (50.000 cd/m^2)
    Minimum luminance: 0 (0.000 cd/m^2)
    Unknown: 0x00 0x00
  Colorimetry Data Block:
    BT2020YCC
    BT2020RGB
    Gamut Boundary Description Metadata Profile P0
  HDR Static Metadata Data Block:
    Electro optical transfer functions:
      Traditional gamma - SDR luminance range
      SMPTE ST2084
    Supported static metadata descriptors:
      Static metadata type 1
      Static metadata type 8
    Desired content max luminance: 80 (282.843 cd/m^2)
    Desired content max frame-average luminance: 80 (282.843 cd/m^2)
    Desired content min luminance: 68 (0.201 cd/m^2)
  Video Capability Data Block:
    YCbCr quantization: Selectable (via AVI YQ)
    RGB quantization: Selectable (via AVI Q)
    PT scan behavior: Always Underscanned
    IT scan behavior: Always Underscanned
    CE scan behavior: Always Underscanned
  Detailed Timing Descriptors:
    DTD 2:  2560x1440  144.000766 Hz  16:9    222.193 kHz    586.590000 MHz (597 mm x 336 mm)
                 Hfront    8 Hsync  32 Hback   40 Hpol N
                 Vfront   63 Vsync   8 Vback   32 Vpol P
    DTD 3:  2560x1440  120.000000 Hz  16:9    183.000 kHz    497.760000 MHz (597 mm x 336 mm)
                 Hfront   48 Hsync  32 Hback   80 Hpol P
                 Vfront    3 Vsync   5 Vback   77 Vpol N
    DTD 4:  2560x1440  100.000000 Hz  16:9    151.000 kHz    410.720000 MHz (597 mm x 336 mm)
                 Hfront   48 Hsync  32 Hback   80 Hpol P
                 Vfront    3 Vsync   5 Vback   62 Vpol N
Checksum: 0x52  Unused space in Extension Block: 21 bytes

----------------

Block 2, DisplayID Extension Block:
  Version: 1.2
  Extension Count: 0
  Display Product Type: Standalone display device
  Video Timing Modes Type 1 - Detailed Timings Data Block:
    DTD:  2560x1440  165.000487 Hz  16:9    249.151 kHz    677.690000 MHz (aspect 16:9, no 3D stereo)
               Hfront   48 Hsync  32 Hback   80 Hpol P
               Vfront    3 Vsync   5 Vback   62 Vpol N
    DTD:  2560x1440  169.999503 Hz  16:9    251.599 kHz    684.350000 MHz (aspect 16:9, no 3D stereo)
               Hfront   48 Hsync  32 Hback   80 Hpol P
               Vfront    3 Vsync   5 Vback   32 Vpol N
    DTD:  2560x1440  180.000586 Hz  16:9    263.341 kHz    699.960000 MHz (aspect 16:9, no 3D stereo)
               Hfront   40 Hsync  16 Hback   42 Hpol P
               Vfront    3 Vsync   5 Vback   15 Vpol N
  Checksum: 0x01
Checksum: 0x90
