
EDID (hex):
00ffffffffffff0061a9473400000000
15200103805021782a3f75ad4f3eab26
135054adcf00714f81c0814081809500
a9c0b300d1c0216870a0d0a029503020
35001d4e3100001a000000fd0030791e
aa3c000a202020202020000000fc004d
69204d6f6e69746f720a2020000000ff
d0303030303030303030303030300149
020335f14c010203040590111213141f
3f23090707830100006a030c00200038
3c20000067d85dc401788003681a0000
01013079ed58d470a0d0a0465030403a
001d4e3100001ea348b86861a0325030
4035001d4e3100001ef57c70a0d0a029
50302035001d4e3100001a565e00a0a0
a02950302035001d4d3100001a000062

Extracted contents:
header:          00 ff ff ff ff ff ff 00
serial number:   61 a9 47 34 00 00 00 00 15 20
version:         01 03
basic params:    80 50 21 78 2a
chroma info:     3f 75 ad 4f 3e ab 26 13 50 54
established:     ad cf 00
standard:        71 4f 81 c0 81 40 81 80 95 00 a9 c0 b3 00 d1 c0
descriptor 1:    21 68 70 a0 d0 a0 29 50 30 20 35 00 1d 4e 31 00 00 1a
descriptor 2:    00 00 00 fd 00 30 79 1e aa 3c 00 0a 20 20 20 20 20 20
descriptor 3:    00 00 00 fc 00 4d 69 20 4d 6f 6e 69 74 6f 72 0a 20 20
descriptor 4:    00 00 00 ff d0 30 30 30 30 30 30 30 30 30 30 30 30 30
extensions:      01
checksum:        49

EDID version: 1.3
Manufacturer: XMI Model 3447 Serial Number --
Made in week 21 of 2022
Digital display
Maximum image size: 80 cm x 33 cm
Gamma: 2.20
DPMS levels: Off
RGB color display
First detailed timing is preferred timing
Display x,y Chromaticity:
  Red:   0.6757, 0.3115
  Green: 0.2451, 0.6708
  Blue:  0.1494, 0.0771
  White: 0.3134, 0.3291
Established timings supported:
  720x400@70Hz 9:5 HorFreq: 31469 Hz Clock: 28.320 MHz
  640x480@60Hz 4:3 HorFreq: 31469 Hz Clock: 25.175 MHz
  640x480@72Hz 4:3 HorFreq: 37900 Hz Clock: 31.500 MHz
  640x480@75Hz 4:3 HorFreq: 37500 Hz Clock: 31.500 MHz
  800x600@60Hz 4:3 HorFreq: 37900 Hz Clock: 40.000 MHz
  800x600@72Hz 4:3 HorFreq: 48100 Hz Clock: 50.000 MHz
  800x600@75Hz 4:3 HorFreq: 46900 Hz Clock: 49.500 MHz
  1024x768@60Hz 4:3 HorFreq: 48400 Hz Clock: 65.000 MHz
  1024x768@70Hz 4:3 HorFreq: 56500 Hz Clock: 75.000 MHz
  1024x768@75Hz 4:3 HorFreq: 60000 Hz Clock: 78.750 MHz
  1280x1024@75Hz 5:4 HorFreq: 80000 Hz Clock: 135.000 MHz
Standard timings supported:
  1152x864@75Hz 4:3 HorFreq: 67500 Hz Clock: 108.000 MHz
  1280x720@60Hz 16:9
  1280x960@60Hz 4:3 HorFreq: 60000 Hz Clock: 108.000 MHz
  1280x1024@60Hz 5:4 HorFreq: 64000 Hz Clock: 108.000 MHz
  1440x900@60Hz 16:10 HorFreq: 55500 Hz Clock: 88.750 MHz
  1600x900@60Hz 16:9
  1680x1050@60Hz 16:10 HorFreq: 64700 Hz Clock: 119.000 MHz
  1920x1080@60Hz 16:9
Detailed mode: Clock 266.570 MHz, 797 mm x 334 mm
               3440 3488 3520 3600 hborder 0
               1440 1443 1448 1481 vborder 0
               +hsync -vsync 
               VertFreq: 49 Hz, HorFreq: 74047 Hz
Monitor ranges (GTF): 48-121Hz V, 30-170kHz H, max dotclock 600MHz
Monitor name: Mi Monitor
Monitor descriptor block has byte 4 nonzero (0xd0)
Serial number: --
Has 1 extension blocks
Checksum: 0x49 (valid)

CTA extension block
Extension version: 3
49 bytes of CTA data
  Video data block
    VIC   1 640x480@60Hz 4:3  HorFreq: 31469 Hz Clock: 25.175 MHz
    VIC   2 720x480@60Hz 4:3  HorFreq: 31469 Hz Clock: 27.000 MHz
    VIC   3 720x480@60Hz 16:9  HorFreq: 31469 Hz Clock: 27.000 MHz
    VIC   4 1280x720@60Hz 16:9  HorFreq: 45000 Hz Clock: 74.250 MHz
    VIC   5 1920x1080i@60Hz 16:9  HorFreq: 33750 Hz Clock: 74.250 MHz
    VIC  16 1920x1080@60Hz 16:9 (native) HorFreq: 67500 Hz Clock: 148.500 MHz
    VIC  17 720x576@50Hz 4:3  HorFreq: 31250 Hz Clock: 27.000 MHz
    VIC  18 720x576@50Hz 16:9  HorFreq: 31250 Hz Clock: 27.000 MHz
    VIC  19 1280x720@50Hz 16:9  HorFreq: 37500 Hz Clock: 74.250 MHz
    VIC  20 1920x1080i@50Hz 16:9  HorFreq: 28125 Hz Clock: 74.250 MHz
    VIC  31 1920x1080@50Hz 16:9  HorFreq: 56250 Hz Clock: 148.500 MHz
    VIC  63 1920x1080@120Hz 16:9  HorFreq: 135000 Hz Clock: 297.000 MHz
  Audio data block
    Linear PCM, max channels 2
      Supported sample rates (kHz): 48 44.1 32
      Supported sample sizes (bits): 24 20 16
  Speaker allocation data block
    Speaker map:
      FL/FR - Front Left/Right
  Vendor-specific data block, OUI 000c03 (HDMI)
    Source physical address 2.0.0.0
    DC_36bit
    DC_30bit
    DC_Y444
    Maximum TMDS clock: 300MHz
    Extended HDMI video details:
  Vendor-specific data block, OUI c45dd8 (HDMI Forum)
    Version: 1
    Maximum TMDS Character Rate: 600MHz
    SCDC Present
    Supports 12-bits/component Deep Color 4:2:0 Pixel Encoding
    Supports 10-bits/component Deep Color 4:2:0 Pixel Encoding
  Vendor-specific data block, OUI 00001a
Underscans PC formats by default
Basic audio support
Supports YCbCr 4:4:4
Supports YCbCr 4:2:2
1 native detailed modes
Detailed mode: Clock 543.600 MHz, 797 mm x 334 mm
               3440 3488 3552 3600 hborder 0
               1440 1443 1453 1510 vborder 0
               +hsync +vsync 
               VertFreq: 100 Hz, HorFreq: 151000 Hz
Detailed mode: Clock 185.950 MHz, 797 mm x 334 mm
               1720 1768 1832 2080 hborder 0
               1440 1443 1448 1490 vborder 0
               +hsync +vsync 
               VertFreq: 59 Hz, HorFreq: 89399 Hz
Detailed mode: Clock 319.890 MHz, 797 mm x 334 mm
               3440 3488 3520 3600 hborder 0
               1440 1443 1448 1481 vborder 0
               +hsync -vsync 
               VertFreq: 59 Hz, HorFreq: 88858 Hz
Detailed mode: Clock 241.500 MHz, 797 mm x 333 mm
               2560 2608 2640 2720 hborder 0
               1440 1443 1448 1481 vborder 0
               +hsync -vsync 
               VertFreq: 59 Hz, HorFreq: 88786 Hz
Checksum: 0x62 (valid)

EDID block does NOT conform to EDID 1.3!
	Invalid descriptor block padding
One or more of the timings is out of range of the Monitor Ranges:
  Vertical Freq: 49 - 120 Hz
  Horizontal Freq: 28125 - 151000 Hz
  Maximum Clock: 543.600 MHz


