edid-decode (hex):

00 ff ff ff ff ff ff 00 42 93 17 09 83 88 02 00
15 0e 01 03 68 22 1b 96 2a 6e 06 a1 54 4c 99 26
19 4f 54 bf ef 00 31 ca 31 0a 3b ca 61 4f 81 80
00 00 00 00 00 00 30 2a 00 98 51 00 2a 40 30 70
13 00 51 0e 11 00 00 1e 00 00 00 fd 00 3c 4b 1e
50 0e 00 00 00 00 00 00 00 00 00 00 00 fc 00 37
37 36 0a 20 20 20 20 20 20 20 20 20 00 00 00 ff
00 46 48 55 4a 34 35 30 31 36 36 30 31 39 00 fa

----------------

Block 0, Base EDID:
  EDID Structure Version & Revision: 1.3
  Vendor & Product Identification:
    Manufacturer: PTS
    Model: 2327
    Serial Number: ...
    Made in: week 21 of 2004
  Basic Display Parameters & Features:
    Analog display
    Input voltage level: 0.7/0.7 V
    Sync: Separate
    Maximum image size: 34 cm x 27 cm
    Gamma: 2.50
    DPMS levels: Off
    RGB color display
    First detailed timing is preferred timing
  Color Characteristics:
    Red  : 0.6298, 0.3300
    Green: 0.2998, 0.5996
    Blue : 0.1484, 0.0976
    White: 0.3095, 0.3300
  Established Timings I & II:
    IBM     :   720x400    70.082 Hz   9:5    31.467 kHz  28.320 MHz
    DMT 0x04:   640x480    59.940 Hz   4:3    31.469 kHz  25.175 MHz
    Apple   :   640x480    66.667 Hz   4:3    35.000 kHz  30.240 MHz
    DMT 0x05:   640x480    72.809 Hz   4:3    37.861 kHz  31.500 MHz
    DMT 0x06:   640x480    75.000 Hz   4:3    37.500 kHz  31.500 MHz
    DMT 0x08:   800x600    56.250 Hz   4:3    35.156 kHz  36.000 MHz
    DMT 0x09:   800x600    60.317 Hz   4:3    37.879 kHz  40.000 MHz
    DMT 0x0a:   800x600    72.188 Hz   4:3    48.077 kHz  50.000 MHz
    DMT 0x0b:   800x600    75.000 Hz   4:3    46.875 kHz  49.500 MHz
    Apple   :   832x624    74.551 Hz   4:3    49.726 kHz  57.284 MHz
    DMT 0x10:  1024x768    60.004 Hz   4:3    48.363 kHz  65.000 MHz
    DMT 0x11:  1024x768    70.069 Hz   4:3    56.476 kHz  75.000 MHz
    DMT 0x12:  1024x768    75.029 Hz   4:3    60.023 kHz  78.750 MHz
    DMT 0x24:  1280x1024   75.025 Hz   5:4    79.976 kHz 135.000 MHz
  Standard Timings:
    GTF     :   640x360    70.000 Hz  16:9    26.250 kHz  20.580 MHz
    GTF     :   640x400    70.000 Hz  16:10   29.190 kHz  23.352 MHz
    GTF     :   720x408    70.000 Hz  16:9    29.750 kHz  26.656 MHz
    DMT 0x12:  1024x768    75.029 Hz   4:3    60.023 kHz  78.750 MHz
    DMT 0x23:  1280x1024   60.020 Hz   5:4    63.981 kHz 108.000 MHz
  Detailed Timing Descriptors:
    DTD 1:  1280x1024   60.020 Hz   5:4    63.981 kHz 108.000 MHz (337 mm x 270 mm)
                 Hfront   48 Hsync 112 Hback 248 Hpol P
                 Vfront    1 Vsync   3 Vback  38 Vpol P
  Display Range Limits:
    Monitor ranges (GTF): 60-75 Hz V, 30-80 kHz H, max dotclock 140 MHz
    Display Product Name: '776'
    Display Product Serial Number: ...
Checksum: 0xfa

----------------

Failures:

Block 0, Base EDID:
  Standard Timings: Use 0x0101 as the invalid Standard Timings code, not 0x0000.
  Standard Timings: Use 0x0101 as the invalid Standard Timings code, not 0x0000.
  Standard Timings: Use 0x0101 as the invalid Standard Timings code, not 0x0000.
  Display Range Limits: Byte 11 is 0x00 instead of 0x0a.
  Display Range Limits: Byte 12 is 0x00 instead of 0x20.
All Blocks:
  Some timings are out of range of the Monitor Ranges:
    Vertical Freq: 56.250 - 75.029 Hz (Monitor: 60.000 - 75.000 Hz)
    Horizontal Freq: 26.250 - 79.976 kHz (Monitor: 30.000 - 80.000 kHz)

EDID conformity: FAIL
