edid-decode (hex):

00 ff ff ff ff ff ff 00 21 63 30 34 01 00 00 00
13 18 01 03 68 68 3b 78 2a 81 fd a2 57 4e a1 27
0c 47 4a ad eb 80 81 00 81 40 81 80 95 00 b3 00
bf 4f 11 01 01 18 02 3a 80 18 71 38 2d 40 58 2c
45 00 75 f2 31 00 00 1e 66 21 50 b0 51 00 1b 30
40 70 36 00 76 f2 31 00 00 1e 00 00 00 fd 00 3c
4b 1e 51 0f 00 0a 20 20 20 20 20 20 00 00 00 fc
00 4c 45 44 20 54 56 0a 20 20 20 20 20 20 00 e1

----------------

Block 0, Base EDID:
  EDID Structure Version & Revision: 1.3
  Vendor & Product Identification:
    Manufacturer: HKC
    Model: 13360
    Serial Number: ...
    Made in: week 19 of 2014
  Basic Display Parameters & Features:
    Analog display
    Input voltage level: 0.7/0.7 V
    Blank level equals black level
    Sync: Separate
    Maximum image size: 104 cm x 59 cm
    Gamma: 2.20
    DPMS levels: Off
    RGB color display
    First detailed timing is the preferred timing
  Color Characteristics:
    Red  : 0.6347, 0.3398
    Green: 0.3046, 0.6298
    Blue : 0.1552, 0.0498
    White: 0.2802, 0.2900
  Established Timings I & II:
    IBM     :   720x400    70.081663 Hz   9:5     31.467 kHz     28.320000 MHz
    DMT 0x04:   640x480    59.940476 Hz   4:3     31.469 kHz     25.175000 MHz
    DMT 0x05:   640x480    72.808802 Hz   4:3     37.861 kHz     31.500000 MHz
    DMT 0x06:   640x480    75.000000 Hz   4:3     37.500 kHz     31.500000 MHz
    DMT 0x09:   800x600    60.316541 Hz   4:3     37.879 kHz     40.000000 MHz
    DMT 0x0a:   800x600    72.187572 Hz   4:3     48.077 kHz     50.000000 MHz
    DMT 0x0b:   800x600    75.000000 Hz   4:3     46.875 kHz     49.500000 MHz
    Apple   :   832x624    74.551266 Hz   4:3     49.726 kHz     57.284000 MHz
    DMT 0x10:  1024x768    60.003840 Hz   4:3     48.363 kHz     65.000000 MHz
    DMT 0x12:  1024x768    75.028582 Hz   4:3     60.023 kHz     78.750000 MHz
    DMT 0x24:  1280x1024   75.024675 Hz   5:4     79.976 kHz    135.000000 MHz
    Apple   :  1152x870    75.061550 Hz 192:145   68.681 kHz    100.000000 MHz
  Standard Timings:
    DMT 0x1c:  1280x800    59.810326 Hz  16:10    49.702 kHz     83.500000 MHz
    DMT 0x20:  1280x960    60.000000 Hz   4:3     60.000 kHz    108.000000 MHz
    DMT 0x23:  1280x1024   60.019740 Hz   5:4     63.981 kHz    108.000000 MHz
    DMT 0x2f:  1440x900    59.887445 Hz  16:10    55.935 kHz    106.500000 MHz
    DMT 0x3a:  1680x1050   59.954250 Hz  16:10    65.290 kHz    146.250000 MHz
    GTF     :  1776x1332   75.000000 Hz   4:3    104.250 kHz    253.536000 MHz
    GTF     :   384x240    61.003272 Hz  16:10    15.190 kHz      6.562000 MHz
  Detailed Timing Descriptors:
    DTD 1:  1920x1080   60.000000 Hz  16:9     67.500 kHz    148.500000 MHz (885 mm x 498 mm)
                 Hfront   88 Hsync  44 Hback  148 Hpol P
                 Vfront    4 Vsync   5 Vback   36 Vpol P
    DTD 2:  1360x768    60.015162 Hz  85:48    47.712 kHz     85.500000 MHz (886 mm x 498 mm)
                 Hfront   64 Hsync 112 Hback  256 Hpol P
                 Vfront    3 Vsync   6 Vback   18 Vpol P
    Display Range Limits:
      Monitor ranges (GTF): 60-75 Hz V, 30-81 kHz H, max dotclock 150 MHz
    Display Product Name: 'LED TV'
Checksum: 0xe1

----------------

Failures:

Block 0, Base EDID:
  Standard Timings: 0 or negative horizontal front porch.
  Standard Timings: Use 0x0101 as the invalid Standard Timings code, not 0x0118.
  Detailed Timing Descriptor #1: Mismatch of image size 885x498 mm vs display size 1040x590 mm.
  Detailed Timing Descriptor #2: Mismatch of image size 886x498 mm vs display size 1040x590 mm.
EDID:
  Base EDID: Some timings are out of range of the Monitor Ranges:
    Horizontal Freq: 15.189 - 104.250 kHz (Monitor: 30.000 - 81.000 kHz)
    Maximum Clock: 253.536 MHz (Monitor: 150.000 MHz)

EDID conformity: FAIL
