edid-decode (hex):

00 ff ff ff ff ff ff 00 06 10 2f a0 00 00 00 00
04 19 01 04 a5 21 15 78 02 6f b1 a7 55 4c 9e 25
0c 50 54 00 00 00 01 01 01 01 01 01 01 01 01 01
01 01 01 01 01 01 ef 83 40 a0 b0 08 34 70 30 20
36 00 4b cf 10 00 00 1a 00 00 00 fc 00 43 6f 6c
6f 72 20 4c 43 44 0a 20 20 20 00 00 00 10 00 00
00 00 00 00 00 00 00 00 00 00 00 00 00 00 00 10
00 00 00 00 00 00 00 00 00 00 00 00 00 00 00 cf

----------------

Block 0, Base EDID:
  EDID Structure Version & Revision: 1.4
  Vendor & Product Identification:
    Manufacturer: APP
    Model: 41007
    Made in: week 4 of 2015
  Basic Display Parameters & Features:
    Digital display
    Bits per primary color channel: 8
    DisplayPort interface
    Maximum image size: 33 cm x 21 cm
    Gamma: 2.20
    Supported color formats: RGB 4:4:4
    First detailed timing includes the native pixel format and preferred refresh rate
  Color Characteristics:
    Red  : 0.6533, 0.3339
    Green: 0.2998, 0.6201
    Blue : 0.1464, 0.0498
    White: 0.3125, 0.3291
  Established Timings I & II: none
  Standard Timings: none
  Detailed Timing Descriptors:
    DTD 1:  2880x1800   59.990267 Hz  16:10   111.102 kHz    337.750000 MHz (331 mm x 207 mm)
                 Hfront   48 Hsync  32 Hback   80 Hpol P
                 Vfront    3 Vsync   6 Vback   43 Vpol N
    Display Product Name: 'Color LCD'
    Dummy Descriptor:
    Dummy Descriptor:
Checksum: 0xcf

----------------

EDID conformity: PASS
