edid-decode (hex):

00 ff ff ff ff ff ff 00 04 72 f9 02 00 00 00 00
31 1b 01 04 80 35 1e 78 ca 57 e0 a5 54 4f 9d 26
12 50 54 00 00 00 01 01 01 01 01 01 01 01 01 01
01 01 01 01 01 01 08 70 80 a0 70 38 45 40 30 20
35 00 e0 0e 11 00 00 1e 77 5c 80 a0 70 38 3a 40
30 20 35 00 e0 0e 11 00 00 1e 05 7c 80 58 70 38
12 40 18 20 35 00 e0 0e 11 00 00 1e 02 3a 80 18
71 38 2d 40 58 2c 45 00 e0 0e 11 00 00 1e 01 5b

02 03 0c 40 23 09 07 07 83 01 00 00 00 00 00 00
00 00 00 00 00 00 00 00 00 00 00 00 00 00 00 00
00 00 00 00 00 00 00 00 00 00 00 00 00 00 00 00
00 00 00 00 00 00 00 00 00 00 00 00 00 00 00 00
00 00 00 00 00 00 00 00 00 00 00 00 00 00 00 00
00 00 00 00 00 00 00 00 00 00 00 00 00 00 00 00
00 00 00 00 00 00 00 00 00 00 00 00 00 00 00 00
00 00 00 00 00 00 00 00 00 00 00 00 00 00 00 f1

----------------

Block 0, Base EDID:
  EDID Structure Version & Revision: 1.4
  Vendor & Product Identification:
    Manufacturer: ACR
    Model: 761
    Made in: week 49 of 2017
  Basic Display Parameters & Features:
    Digital display
    Color depth is undefined
    Digital interface is not defined
    Maximum image size: 53 cm x 30 cm
    Gamma: 2.20
    DPMS levels: Standby Suspend
    Supported color formats: RGB 4:4:4, YCrCb 4:4:4
    First detailed timing includes the native pixel format and preferred refresh rate
  Color Characteristics:
    Red  : 0.6455, 0.3291
    Green: 0.3095, 0.6162
    Blue : 0.1513, 0.0722
    White: 0.3125, 0.3281
  Established Timings I & II: none
  Standard Timings: none
  Detailed Timing Descriptors:
    DTD 1:  1920x1080  120.004017 Hz  16:9    137.885 kHz    286.800000 MHz (480 mm x 270 mm)
                 Hfront   48 Hsync  32 Hback   80 Hpol P
                 Vfront    3 Vsync   5 Vback   61 Vpol P
    DTD 2:  1920x1080  100.002535 Hz  16:9    113.803 kHz    236.710000 MHz (480 mm x 270 mm)
                 Hfront   48 Hsync  32 Hback   80 Hpol P
                 Vfront    3 Vsync   5 Vback   50 Vpol P
    DTD 3:  1920x1080  144.000501 Hz  16:9    158.113 kHz    317.490000 MHz (480 mm x 270 mm)
                 Hfront   24 Hsync  32 Hback   32 Hpol P
                 Vfront    3 Vsync   5 Vback   10 Vpol P
    DTD 4:  1920x1080   60.000000 Hz  16:9     67.500 kHz    148.500000 MHz (480 mm x 270 mm)
                 Hfront   88 Hsync  44 Hback  148 Hpol P
                 Vfront    4 Vsync   5 Vback   36 Vpol P
  Extension blocks: 1
Checksum: 0x5b

----------------

Block 1, CTA-861 Extension Block:
  Revision: 3
  Basic audio support
  Native detailed modes: 0
  Audio Data Block:
    Linear PCM:
      Max channels: 2
      Supported sample rates (kHz): 48 44.1 32
      Supported sample sizes (bits): 24 20 16
  Speaker Allocation Data Block:
    FL/FR - Front Left/Right
Checksum: 0xf1  Unused space in Extension Block: 115 bytes

----------------

Warnings:

Block 0, Base EDID:
  Missing Display Product Name.
Block 1, CTA-861 Extension Block:
  IT Video Formats are overscanned by default, but normally this should be underscanned.
  Add a Colorimetry Data Block with the sRGB colorimetry bit set to avoid interop issues.

Failures:

Block 0, Base EDID:
  Detailed Timing Descriptor #1: Mismatch of image size 480x270 mm vs display size 530x300 mm.
  Detailed Timing Descriptor #2: Mismatch of image size 480x270 mm vs display size 530x300 mm.
  Detailed Timing Descriptor #3: Mismatch of image size 480x270 mm vs display size 530x300 mm.
  Detailed Timing Descriptor #4: Mismatch of image size 480x270 mm vs display size 530x300 mm.
Block 1, CTA-861 Extension Block:
  Required 640x480p60 timings are missing in the established timings and the SVD list (VIC 1).
  Missing VCDB, needed for Set Selectable RGB Quantization to avoid interop issues.

EDID conformity: FAIL
