
EDID (hex):
00ffffffffffff000e77311400000000
00210104b51e1378032f55a6544c9b24
0d505400000001010101010101010101
010101010101178840a0b0086e703020
36002dbc10000018000000fd001e78e6
e646010a202020202020000000fe0043
534f542054330a2020202020000000fc
004d4e453030375a41332d320a2001fc
7020790000220028bfa10a853f0b9f00
2f001f0007076d0002000500b3400405
3f0b9f002f001f0007076d0002000500
810007e6060101606028000000000000
00000000000000000000000000000000
00000000000000000000000000000000
00000000000000000000000000000000
00000000000000000000000000006290

edid-decode (hex):

00 ff ff ff ff ff ff 00 0e 77 31 14 00 00 00 00
00 21 01 04 b5 1e 13 78 03 2f 55 a6 54 4c 9b 24
0d 50 54 00 00 00 01 01 01 01 01 01 01 01 01 01
01 01 01 01 01 01 17 88 40 a0 b0 08 6e 70 30 20
36 00 2d bc 10 00 00 18 00 00 00 fd 00 1e 78 e6
e6 46 01 0a 20 20 20 20 20 20 00 00 00 fe 00 43
53 4f 54 20 54 33 0a 20 20 20 20 20 00 00 00 fc
00 4d 4e 45 30 30 37 5a 41 33 2d 32 0a 20 01 fc

70 20 79 00 00 22 00 28 bf a1 0a 85 3f 0b 9f 00
2f 00 1f 00 07 07 6d 00 02 00 05 00 b3 40 04 05
3f 0b 9f 00 2f 00 1f 00 07 07 6d 00 02 00 05 00
81 00 07 e6 06 01 01 60 60 28 00 00 00 00 00 00
00 00 00 00 00 00 00 00 00 00 00 00 00 00 00 00
00 00 00 00 00 00 00 00 00 00 00 00 00 00 00 00
00 00 00 00 00 00 00 00 00 00 00 00 00 00 00 00
00 00 00 00 00 00 00 00 00 00 00 00 00 00 62 90

----------------

Block 0, Base EDID:
  EDID Structure Version & Revision: 1.4
  Vendor & Product Identification:
    Manufacturer: CSW
    Model: 5169
    Made in: 2023
  Basic Display Parameters & Features:
    Digital display
    Bits per primary color channel: 10
    DisplayPort interface
    Maximum image size: 30 cm x 19 cm
    Gamma: 2.20
    Supported color formats: RGB 4:4:4
    First detailed timing includes the native pixel format and preferred refresh rate
    Display is continuous frequency
  Color Characteristics:
    Red  : 0.6484, 0.3300
    Green: 0.2998, 0.6083
    Blue : 0.1416, 0.0517
    White: 0.3134, 0.3291
  Established Timings I & II: none
  Standard Timings: none
  Detailed Timing Descriptors:
    DTD 1:  2880x1800   60.001033 Hz  16:10   114.602 kHz    348.390000 MHz (301 mm x 188 mm)
                 Hfront   48 Hsync  32 Hback   80 Hpol N
                 Vfront    3 Vsync   6 Vback  101 Vpol N
    Display Range Limits:
      Monitor ranges (Bare Limits): 30-120 Hz V, 230-230 kHz H, max dotclock 700 MHz
    Alphanumeric Data String: 'CSOT T3'
    Display Product Name: 'MNE007ZA3-2'
  Extension blocks: 1
Checksum: 0xfc

----------------

Block 1, DisplayID Extension Block:
  Version: 2.0
  Extension Count: 0
  Display Product Primary Use Case: Same primary use case as the base section
  Video Timing Modes Type 7 - Detailed Timings Data Block:
    DTD:  2880x1800  120.000000 Hz  16:10   229.200 kHz    696.768000 MHz (aspect 16:10, no 3D stereo, preferred)
               Hfront   48 Hsync  32 Hback   80 Hpol N
               Vfront    3 Vsync   6 Vback  101 Vpol N
    DTD:  2880x1800   48.000138 Hz  16:10    91.680 kHz    278.708000 MHz (aspect 16:10, no 3D stereo)
               Hfront   48 Hsync  32 Hback   80 Hpol N
               Vfront    3 Vsync   6 Vback  101 Vpol N
  CTA-861 DisplayID Data Block:
  HDR Static Metadata Data Block:
    Electro optical transfer functions:
      Traditional gamma - SDR luminance range
    Supported static metadata descriptors:
      Static metadata type 1
    Desired content max luminance: 96 (400.000 cd/m^2)
    Desired content max frame-average luminance: 96 (400.000 cd/m^2)
    Desired content min luminance: 40 (0.098 cd/m^2)
  Checksum: 0x62
Checksum: 0x90
