
EDID (hex):
00ffffffffffff004e83160791020000
0c0c0101081e17b5e8a07d9e564c9c26
195055bfee00614c0101010101010101
010101010101000000fc0053616d706f
2054656368200a20000000fc0050442d
373046413136200a2020000000fd0038
4b1f3c08000a202020202020000000ff
0030323132464130303635370a2000c2

Extracted contents:
header:          00 ff ff ff ff ff ff 00
serial number:   4e 83 16 07 91 02 00 00 0c 0c
version:         01 01
basic params:    08 1e 17 b5 e8
chroma info:     a0 7d 9e 56 4c 9c 26 19 50 55
established:     bf ee 00
standard:        61 4c 01 01 01 01 01 01 01 01 01 01 01 01 01 01
descriptor 1:    00 00 00 fc 00 53 61 6d 70 6f 20 54 65 63 68 20 0a 20
descriptor 2:    00 00 00 fc 00 50 44 2d 37 30 46 41 31 36 20 0a 20 20
descriptor 3:    00 00 00 fd 00 38 4b 1f 3c 08 00 0a 20 20 20 20 20 20
descriptor 4:    00 00 00 ff 00 30 32 31 32 46 41 30 30 36 35 37 0a 20
extensions:      00
checksum:        c2

EDID version: 1.1
Manufacturer: STC Model 716 Serial Number --
Analog display, Input voltage level: 0.7/0.3 V
Sync: Separate 
Maximum image size: 30 cm x 23 cm
Gamma: 2.81
DPMS levels: Standby Suspend Off
RGB color display
Display x,y Chromaticity:
  Red:   0.6191, 0.3378
  Green: 0.2968, 0.6093
  Blue:  0.1494, 0.1005
  White: 0.3154, 0.3330
Established timings supported:
  720x400@70Hz 9:5 HorFreq: 31469 Hz Clock: 28.320 MHz
  640x480@60Hz 4:3 HorFreq: 31469 Hz Clock: 25.175 MHz
  640x480@67Hz 4:3 HorFreq: 35000 Hz Clock: 30.240 MHz
  640x480@72Hz 4:3 HorFreq: 37900 Hz Clock: 31.500 MHz
  640x480@75Hz 4:3 HorFreq: 37500 Hz Clock: 31.500 MHz
  800x600@56Hz 4:3 HorFreq: 35200 Hz Clock: 36.000 MHz
  800x600@60Hz 4:3 HorFreq: 37900 Hz Clock: 40.000 MHz
  800x600@72Hz 4:3 HorFreq: 48100 Hz Clock: 50.000 MHz
  800x600@75Hz 4:3 HorFreq: 46900 Hz Clock: 49.500 MHz
  832x624@75Hz 4:3 HorFreq: 49726 Hz Clock: 57.284 MHz
  1024x768@60Hz 4:3 HorFreq: 48400 Hz Clock: 65.000 MHz
  1024x768@70Hz 4:3 HorFreq: 56500 Hz Clock: 75.000 MHz
  1024x768@75Hz 4:3 HorFreq: 60000 Hz Clock: 78.750 MHz
Standard timings supported:
  1024x768@72Hz 4:3
Monitor name: Sampo Tech 
Monitor ranges (GTF): 56-75Hz V, 31-60kHz H, max dotclock 80MHz
Serial number: --
Checksum: 0xc2 (valid)
EDID block does NOT conform to EDID 1.0!
	Has descriptor blocks other than detailed timings
EDID block does not conform at all!
	Bad year of manufacture
