edid-decode (hex):

00 ff ff ff ff ff ff 00 30 ae 55 40 00 00 00 00
00 11 01 03 80 21 15 78 ea 87 f5 94 57 4f 8c 27
27 50 54 21 08 00 81 80 a9 40 01 01 01 01 01 01
01 01 01 01 01 01 70 41 80 78 71 b0 10 40 30 20
33 00 4b cf 10 00 00 19 74 34 80 20 71 b0 14 40
30 20 26 00 4b cf 10 00 00 19 00 00 00 0f 00 d1
0a 32 d1 0a 28 11 01 00 4c a3 55 32 00 00 00 fe
00 4c 54 4e 31 35 34 55 32 2d 4c 30 35 0a 00 21

----------------

Block 0, Base EDID:
  EDID Structure Version & Revision: 1.3
  Vendor & Product Identification:
    Manufacturer: LEN
    Model: 16469
    Made in: 2007
  Basic Display Parameters & Features:
    Digital display
    Maximum image size: 33 cm x 21 cm
    Gamma: 2.20
    DPMS levels: Standby Suspend Off
    RGB color display
    First detailed timing is preferred timing
  Color Characteristics:
    Red  : 0.5800, 0.3398
    Green: 0.3095, 0.5498
    Blue : 0.1552, 0.1552
    White: 0.3134, 0.3291
  Established Timings I & II:
    DMT 0x04:   640x480    59.940 Hz   4:3    31.469 kHz  25.175 MHz
    DMT 0x09:   800x600    60.317 Hz   4:3    37.879 kHz  40.000 MHz
    DMT 0x10:  1024x768    60.004 Hz   4:3    48.363 kHz  65.000 MHz
  Standard Timings:
    DMT 0x23:  1280x1024   60.020 Hz   5:4    63.981 kHz 108.000 MHz
    DMT 0x33:  1600x1200   60.000 Hz   4:3    75.000 kHz 162.000 MHz
  Detailed Timing Descriptors:
    DTD 1:  1920x1200   60.001 Hz   8:5    72.962 kHz 167.520 MHz (331 mm x 207 mm)
                 Hfront   48 Hsync  32 Hback 296 Hpol N
                 Vfront    3 Vsync   3 Vback  10 Vpol N
    DTD 2:  1920x1200   49.849 Hz   8:5    60.815 kHz 134.280 MHz (331 mm x 207 mm)
                 Hfront   48 Hsync  32 Hback 208 Hpol N
                 Vfront    2 Vsync   6 Vback  12 Vpol N
    Manufacturer-Specified Display Descriptor (0x0f): 00 0f 00 d1 0a 32 d1 0a 28 11 01 00 4c a3 55 32 '.....2..(...L.U2'
    Alphanumeric Data String: 'LTN154U2-L05'
Checksum: 0x21

----------------

Failures:

Block 0, Base EDID:
  Missing Display Product Name.
  Missing Display Range Limits Descriptor.

EDID conformity: FAIL
