edid-decode (hex):

00 ff ff ff ff ff ff 00 06 af 74 22 00 00 00 00
01 10 01 03 80 21 15 78 0a 1c f5 97 58 50 8e 27
27 50 54 00 00 00 01 01 01 01 01 01 01 01 01 01
01 01 01 01 01 01 d6 1b 00 b1 50 20 10 30 10 30
13 00 4b cf 10 00 00 19 d6 1b 00 b1 50 20 10 30
10 30 13 00 4b cf 10 00 00 00 00 00 00 fe 00 50
59 35 39 39 00 42 31 35 34 45 57 32 00 00 00 fe
00 2c 3b 47 50 6e 8e c1 ff 01 01 0a 20 20 00 db

----------------

Block 0, Base EDID:
  EDID Structure Version & Revision: 1.3
  Vendor & Product Identification:
    Manufacturer: AUO
    Model: 8820
    Made in: week 1 of 2006
  Basic Display Parameters & Features:
    Digital display
    Maximum image size: 33 cm x 21 cm
    Gamma: 2.20
    RGB color display
    First detailed timing is the preferred timing
  Color Characteristics:
    Red  : 0.5898, 0.3447
    Green: 0.3154, 0.5546
    Blue : 0.1552, 0.1552
    White: 0.3134, 0.3291
  Established Timings I & II: none
  Standard Timings: none
  Detailed Timing Descriptors:
    DTD 1:  1280x800    59.937153 Hz  16:10    48.909 kHz     71.260000 MHz (DE timing only, 331 mm x 207 mm)
                 Hfront   16 Hsync  48 Hback  113 Hpol N
                 Vfront    1 Vsync   3 Vback   12 Vpol N
    DTD 2:  1280x800    59.937153 Hz  16:10    48.909 kHz     71.260000 MHz (DE timing only, 331 mm x 207 mm)
                 Hfront   16 Hsync  48 Hback  113 Hpol N
                 Vfront    1 Vsync   3 Vback   12 Vpol N
    SPWG Module Revision: 0
    SPWG Descriptor #3:
      SPWG PC Maker P/N: 'PY599'
      SPWG LCD Supplier EEDID Revision: 0
      SPWG Manufacturer P/N: 'B154EW2'
    SPWG Descriptor #4:
      SMBUS Values: 0x2c 0x3b 0x47 0x50 0x6e 0x8e 0xc1 0xff
      LVDS Channels: 1
      Panel Self Test Present
Checksum: 0xdb

----------------

Failures:

Block 0, Base EDID:
  Missing Display Product Name.
  Missing Display Range Limits Descriptor.

EDID conformity: FAIL
