edid-decode (hex):

00 ff ff ff ff ff ff 00 06 af 74 22 00 00 00 00
01 12 01 03 90 21 15 78 0a 1c f5 97 58 50 8e 27
27 50 54 00 00 00 01 01 01 01 01 01 01 01 01 01
01 01 01 01 01 01 c7 1b 00 a5 50 20 14 30 30 20
36 00 4b cf 10 00 00 1a c7 1b 00 a5 50 20 14 30
30 20 36 00 4b cf 10 00 00 1a 00 00 00 fe 00 57
36 35 31 47 80 42 31 35 34 45 57 32 00 00 00 00
00 31 41 4d 55 74 95 c8 ff 01 01 0a 20 20 00 e0

----------------

Block 0, Base EDID:
  EDID Structure Version & Revision: 1.3
  Vendor & Product Identification:
    Manufacturer: AUO
    Model: 8820
    Made in: week 1 of 2008
  Basic Display Parameters & Features:
    Digital display
    Maximum image size: 33 cm x 21 cm
    Gamma: 2.20
    RGB color display
    First detailed timing is the preferred timing
  Color Characteristics:
    Red  : 0.5898, 0.3447
    Green: 0.3154, 0.5546
    Blue : 0.1552, 0.1552
    White: 0.3134, 0.3291
  Established Timings I & II: none
  Standard Timings: none
  Detailed Timing Descriptors:
    DTD 1:  1280x800    60.013503 Hz   8:5     49.211 kHz     71.110000 MHz (331 mm x 207 mm)
                 Hfront   48 Hsync  32 Hback   85 Hpol P
                 Vfront    3 Vsync   6 Vback   11 Vpol N
    DTD 2:  1280x800    60.013503 Hz   8:5     49.211 kHz     71.110000 MHz (331 mm x 207 mm)
                 Hfront   48 Hsync  32 Hback   85 Hpol P
                 Vfront    3 Vsync   6 Vback   11 Vpol N
    Alphanumeric Data String: 'W651G'
    Manufacturer-Specified Display Descriptor (0x00): 00 00 00 31 41 4d 55 74 95 c8 ff 01 01 0a 20 20 '...1AMUt......  '
Checksum: 0xe0

----------------

Failures:

Block 0, Base EDID:
  Basic Display Parameters & Features: Digital Video Interface Standard set to reserved value 0x10.
  Alphanumeric Data String: Non-printable character.
  Missing Display Product Name.
  Missing Display Range Limits Descriptor.

EDID conformity: FAIL
