edid-decode (hex):

00 ff ff ff ff ff ff 00 06 af 3d 33 00 00 00 00
2c 1c 01 04 95 1f 11 78 03 3e 85 91 56 59 91 28
1f 50 54 00 00 00 01 01 01 01 01 01 01 01 01 01
01 01 01 01 01 01 60 3b 80 04 71 38 52 40 10 10
3e 00 35 ae 10 00 00 18 95 27 80 04 71 38 52 40
10 10 3e 00 35 ae 10 00 00 18 00 00 00 00 00 00
00 00 00 00 00 00 00 00 00 00 00 00 00 00 00 02
00 10 40 ff 0f 3c 7d 16 21 22 7d 20 20 20 00 cf

----------------

Block 0, Base EDID:
  EDID Structure Version & Revision: 1.4
  Vendor & Product Identification:
    Manufacturer: AUO
    Model: 13117
    Made in: week 44 of 2018
  Basic Display Parameters & Features:
    Digital display
    Bits per primary color channel: 6
    DisplayPort interface
    Maximum image size: 31 cm x 17 cm
    Gamma: 2.20
    Supported color formats: RGB 4:4:4
    First detailed timing includes the native pixel format and preferred refresh rate
    Display is continuous frequency
  Color Characteristics:
    Red  : 0.5664, 0.3388
    Green: 0.3505, 0.5683
    Blue : 0.1582, 0.1210
    White: 0.3134, 0.3291
  Established Timings I & II: none
  Standard Timings: none
  Detailed Timing Descriptors:
    DTD 1:  1920x1080   60.004106 Hz  16:9     69.725 kHz    152.000000 MHz (309 mm x 174 mm)
                 Hfront   16 Hsync  16 Hback  228 Hpol N
                 Vfront    3 Vsync  14 Vback   65 Vpol N
    DTD 2:  1920x1080   40.001421 Hz  16:9     46.482 kHz    101.330000 MHz (309 mm x 174 mm)
                 Hfront   16 Hsync  16 Hback  228 Hpol N
                 Vfront    3 Vsync  14 Vback   65 Vpol N
    Empty Descriptor
    Manufacturer-Specified Display Descriptor (0x02): 00 02 00 10 40 ff 0f 3c 7d 16 21 22 7d 20 20 20 '....@..<}.!"}   '
Checksum: 0xcf

----------------

Failures:

Block 0, Base EDID:
  Empty Descriptor: Use Dummy Descriptor instead of all zeroes.
  Missing Display Product Name.
  Missing Display Range Limits Descriptor.

EDID conformity: FAIL
