edid-decode (hex):

00 ff ff ff ff ff ff 00 06 b3 bc 27 8d ea 0f ff
80 33 01 04 b5 3c 22 78 3b d3 c1 ad 50 43 ab 24
0d 50 54 21 08 00 01 01 01 01 01 01 01 01 01 01
01 01 01 01 01 01 56 5e 00 a0 a0 a0 29 50 30 20
15 08 54 4f 21 00 00 1a 00 00 00 ff 00 23 73 78
6f 7a 47 44 41 59 47 41 73 45 00 00 00 fd 0e 01
69 3a 3a 97 01 0a 20 20 20 20 20 20 00 00 00 fc
00 52 4f 47 20 50 47 32 37 41 51 4e 0a 20 02 cc

02 03 20 f6 23 09 07 01 83 01 00 00 65 4b 04 00
01 01 e3 05 c0 00 e2 00 6a e6 06 05 01 78 60 1f
6f c2 00 a0 a0 a0 55 50 30 20 f5 0c 54 4f 21 00
00 1a 79 e9 00 82 a0 a0 67 50 08 20 f5 0c 54 4f
21 00 00 1a 86 6f 80 a0 70 38 40 40 30 20 85 0c
54 4f 21 00 00 1a 82 e9 80 82 70 38 87 40 08 20
f5 0c 54 4f 21 00 00 1a 5a a0 00 a0 a0 a0 46 50
30 20 e5 0c 54 4f 21 00 00 1a 00 00 00 00 00 65

70 12 79 03 00 0f 00 0a a4 14 0e 0e 07 01 20 45
00 00 03 01 64 ca 9c 01 04 ff 09 9f 00 2f 80 1f
00 9f 05 b2 00 aa 00 04 00 a7 4b 02 04 ff 09 4f
00 07 80 1f 00 9f 05 8e 00 86 00 04 00 e7 7a 01
04 7f 07 9f 00 2f 80 1f 00 37 04 d6 00 ce 00 04
00 fa 62 01 04 3f 09 9f 00 2f 80 1f 00 33 05 a5
00 9d 00 04 00 ac 37 02 04 3f 09 9f 00 2f 80 1f
00 33 05 08 01 00 01 04 00 00 00 00 00 00 67 90

00 ff ff ff ff ff ff 00 06 b3 bc 27 8d ea 0f ff
80 33 01 04 b5 3c 22 78 3b d3 c1 ad 50 43 ab 24
0d 50 54 21 08 00 01 01 01 01 01 01 01 01 01 01
01 01 01 01 01 01 56 5e 00 a0 a0 a0 29 50 30 20
15 08 54 4f 21 00 00 1a 00 00 00 ff 00 23 73 78
6f 7a 47 44 41 59 47 41 73 45 00 00 00 fd 0e 01
69 3a 3a 97 01 0a 20 20 20 20 20 20 00 00 00 fc
00 52 4f 47 20 50 47 32 37 41 51 4e 0a 20 02 cc

02 03 20 f6 23 09 07 01 83 01 00 00 65 4b 04 00
01 01 e3 05 c0 00 e2 00 6a e6 06 05 01 78 60 1f
6f c2 00 a0 a0 a0 55 50 30 20 f5 0c 54 4f 21 00
00 1a 79 e9 00 82 a0 a0 67 50 08 20 f5 0c 54 4f
21 00 00 1a 86 6f 80 a0 70 38 40 40 30 20 85 0c
54 4f 21 00 00 1a 82 e9 80 82 70 38 87 40 08 20
f5 0c 54 4f 21 00 00 1a 5a a0 00 a0 a0 a0 46 50
30 20 e5 0c 54 4f 21 00 00 1a 00 00 00 00 00 65

70 12 79 03 00 0f 00 0a a4 14 0e 0e 07 01 20 45
00 00 03 01 64 ca 9c 01 04 ff 09 9f 00 2f 80 1f
00 9f 05 b2 00 aa 00 04 00 a7 4b 02 04 ff 09 4f
00 07 80 1f 00 9f 05 8e 00 86 00 04 00 e7 7a 01
04 7f 07 9f 00 2f 80 1f 00 37 04 d6 00 ce 00 04
00 fa 62 01 04 3f 09 9f 00 2f 80 1f 00 33 05 a5
00 9d 00 04 00 ac 37 02 04 3f 09 9f 00 2f 80 1f
00 33 05 08 01 00 01 04 00 00 00 00 00 00 67 90

----------------

Block 0, Base EDID:
  EDID Structure Version & Revision: 1.4
  Vendor & Product Identification:
    Manufacturer: AUS
    Model: 10172
    Serial Number: ...
    Made in: week 128 of 2041
  Basic Display Parameters & Features:
    Digital display
    Bits per primary color channel: 10
    DisplayPort interface
    Maximum image size: 60 cm x 34 cm
    Gamma: 2.20
    DPMS levels: Off
    Supported color formats: RGB 4:4:4, YCrCb 4:4:4, YCrCb 4:2:2
    First detailed timing includes the native pixel format and preferred refresh rate
    Display is continuous frequency
  Color Characteristics:
    Red  : 0.6787, 0.3134
    Green: 0.2617, 0.6708
    Blue : 0.1435, 0.0507
    White: 0.3125, 0.3291
  Established Timings I & II:
    DMT 0x04:   640x480    59.940476 Hz   4:3     31.469 kHz     25.175000 MHz
    DMT 0x09:   800x600    60.316541 Hz   4:3     37.879 kHz     40.000000 MHz
    DMT 0x10:  1024x768    60.003840 Hz   4:3     48.363 kHz     65.000000 MHz
  Standard Timings: none
  Detailed Timing Descriptors:
    DTD  1:  2560x1440   59.950550 Hz  16:9     88.787 kHz    241.500000 MHz (596 mm x 335 mm)
                  Hfront   48 Hsync  32 Hback   80 Hpol P
                  Vfront   33 Vsync   5 Vback    3 Vpol N
    Display Product Serial Number: ...
    Display Range Limits:
      Monitor ranges (Bare Limits): 1-360 Hz V, 313-313 kHz H, max dotclock 1510 MHz
    Display Product Name: 'ROG PG27AQN'
  Extension blocks: 2
Checksum: 0xcc

----------------

Block 1, CTA-861 Extension Block:
  Revision: 3
  Underscans IT Video Formats by default
  Basic audio support
  Supports YCbCr 4:4:4
  Supports YCbCr 4:2:2
  Native detailed modes: 6
  Audio Data Block:
    Linear PCM:
      Max channels: 2
      Supported sample rates (kHz): 48 44.1 32
      Supported sample sizes (bits): 16
  Speaker Allocation Data Block:
    FL/FR - Front Left/Right
  Vendor-Specific Data Block (NVIDIA), OUI 00-04-4B:
    01 01                                           '..'
  Colorimetry Data Block:
    BT2020YCC
    BT2020RGB
  Video Capability Data Block:
    YCbCr quantization: No Data
    RGB quantization: Selectable (via AVI Q)
    PT scan behavior: Always Underscanned
    IT scan behavior: Always Underscanned
    CE scan behavior: Always Underscanned
  HDR Static Metadata Data Block:
    Electro optical transfer functions:
      Traditional gamma - SDR luminance range
      SMPTE ST2084
    Supported static metadata descriptors:
      Static metadata type 1
    Desired content max luminance: 120 (672.717 cd/m^2)
    Desired content max frame-average luminance: 96 (400.000 cd/m^2)
    Desired content min luminance: 31 (0.099 cd/m^2)
  Detailed Timing Descriptors:
    DTD  2:  2560x1440  119.997589 Hz  16:9    182.996 kHz    497.750000 MHz (596 mm x 335 mm)
                  Hfront   48 Hsync  32 Hback   80 Hpol P
                  Vfront   63 Vsync   5 Vback   17 Vpol N
    DTD  3:  2560x1440  143.998439 Hz  16:9    222.190 kHz    597.690000 MHz (596 mm x 335 mm)
                  Hfront    8 Hsync  32 Hback   90 Hpol P
                  Vfront   63 Vsync   5 Vback   35 Vpol N
    DTD  4:  1920x1080  119.982181 Hz  16:9    137.260 kHz    285.500000 MHz (596 mm x 335 mm)
                  Hfront   48 Hsync  32 Hback   80 Hpol P
                  Vfront   56 Vsync   5 Vback    3 Vpol N
    DTD  5:  1920x1080  240.000000 Hz  16:9    291.600 kHz    597.780000 MHz (596 mm x 335 mm)
                  Hfront    8 Hsync  32 Hback   90 Hpol P
                  Vfront   63 Vsync   5 Vback   67 Vpol N
    DTD  6:  2560x1440   99.946436 Hz  16:9    150.919 kHz    410.500000 MHz (596 mm x 335 mm)
                  Hfront   48 Hsync  32 Hback   80 Hpol P
                  Vfront   62 Vsync   5 Vback    3 Vpol N
Checksum: 0x65  Unused space in Extension Block: 5 bytes

----------------

Block 2, DisplayID Extension Block:
  Version: 1.2
  Extension Count: 0
  Display Product Type: Standalone display device
  Display Interface Data Block:
    Interface Type: DisplayPort
    Number of Links: 4
    Interface Standard Version: 1.4
    Supported bpc for RGB encoding: 8, 10, 12
    Supported bpc for YCbCr 4:4:4 encoding: 8, 10, 12
    Supported bpc for YCbCr 4:2:2 encoding: 8, 10, 12
    Supported Content Protection: HDCP 2.0
    Spread Spectrum: Down Spread 0.5%
  Video Timing Modes Type 1 - Detailed Timings Data Block:
    DTD:  2560x1440  239.969753 Hz  16:9    388.511 kHz   1056.750000 MHz (aspect 16:9, no 3D stereo)
               Hfront   48 Hsync  32 Hback   80 Hpol P
               Vfront  171 Vsync   5 Vback    3 Vpol N
    DTD:  2560x1440  359.980092 Hz  16:9    569.848 kHz   1504.400000 MHz (aspect 16:9, no 3D stereo)
               Hfront    8 Hsync  32 Hback   40 Hpol P
               Vfront  135 Vsync   5 Vback    3 Vpol N
    DTD:  1920x1080  360.112860 Hz  16:9    466.346 kHz    970.000000 MHz (aspect 16:9, no 3D stereo)
               Hfront   48 Hsync  32 Hback   80 Hpol P
               Vfront  207 Vsync   5 Vback    3 Vpol N
    DTD:  2368x1332  239.969221 Hz  16:9    359.474 kHz    908.750000 MHz (aspect 16:9, no 3D stereo)
               Hfront   48 Hsync  32 Hback   80 Hpol P
               Vfront  158 Vsync   5 Vback    3 Vpol N
    DTD:  2368x1332  359.963401 Hz  16:9    574.862 kHz   1453.250000 MHz (aspect 16:9, no 3D stereo)
               Hfront   48 Hsync  32 Hback   80 Hpol P
               Vfront  257 Vsync   5 Vback    3 Vpol N
  Checksum: 0x67
Checksum: 0x90

----------------

Block 3, Unknown EDID Extension Block 0x00:
  00 ff ff ff ff ff ff 00 06 b3 bc 27 8d ea 0f ff '...........'....'
  80 33 01 04 b5 3c 22 78 3b d3 c1 ad 50 43 ab 24 '.3...<"x;...PC.$'
  0d 50 54 21 08 00 01 01 01 01 01 01 01 01 01 01 '.PT!............'
  01 01 01 01 01 01 56 5e 00 a0 a0 a0 29 50 30 20 '......V^....)P0 '
  15 08 54 4f 21 00 00 1a 00 00 00 ff 00 23 73 78 '..TO!........#sx'
  6f 7a 47 44 41 59 47 41 73 45 00 00 00 fd 0e 01 'ozGDAYGAsE......'
  69 3a 3a 97 01 0a 20 20 20 20 20 20 00 00 00 fc 'i::...      ....'
  00 52 4f 47 20 50 47 32 37 41 51 4e 0a 20 02 cc '.ROG PG27AQN. ..'
Checksum: 0xcc

----------------

Block 4, CTA-861 Extension Block:
  Revision: 3
  Underscans IT Video Formats by default
  Basic audio support
  Supports YCbCr 4:4:4
  Supports YCbCr 4:2:2
  Native detailed modes: 6
  Audio Data Block:
    Linear PCM:
      Max channels: 2
      Supported sample rates (kHz): 48 44.1 32
      Supported sample sizes (bits): 16
  Speaker Allocation Data Block:
    FL/FR - Front Left/Right
  Vendor-Specific Data Block (NVIDIA), OUI 00-04-4B:
    01 01                                           '..'
  Colorimetry Data Block:
    BT2020YCC
    BT2020RGB
  Video Capability Data Block:
    YCbCr quantization: No Data
    RGB quantization: Selectable (via AVI Q)
    PT scan behavior: Always Underscanned
    IT scan behavior: Always Underscanned
    CE scan behavior: Always Underscanned
  HDR Static Metadata Data Block:
    Electro optical transfer functions:
      Traditional gamma - SDR luminance range
      SMPTE ST2084
    Supported static metadata descriptors:
      Static metadata type 1
    Desired content max luminance: 120 (672.717 cd/m^2)
    Desired content max frame-average luminance: 96 (400.000 cd/m^2)
    Desired content min luminance: 31 (0.099 cd/m^2)
  Detailed Timing Descriptors:
    DTD  7:  2560x1440  119.997589 Hz  16:9    182.996 kHz    497.750000 MHz (596 mm x 335 mm)
                  Hfront   48 Hsync  32 Hback   80 Hpol P
                  Vfront   63 Vsync   5 Vback   17 Vpol N
    DTD  8:  2560x1440  143.998439 Hz  16:9    222.190 kHz    597.690000 MHz (596 mm x 335 mm)
                  Hfront    8 Hsync  32 Hback   90 Hpol P
                  Vfront   63 Vsync   5 Vback   35 Vpol N
    DTD  9:  1920x1080  119.982181 Hz  16:9    137.260 kHz    285.500000 MHz (596 mm x 335 mm)
                  Hfront   48 Hsync  32 Hback   80 Hpol P
                  Vfront   56 Vsync   5 Vback    3 Vpol N
    DTD 10:  1920x1080  240.000000 Hz  16:9    291.600 kHz    597.780000 MHz (596 mm x 335 mm)
                  Hfront    8 Hsync  32 Hback   90 Hpol P
                  Vfront   63 Vsync   5 Vback   67 Vpol N
    DTD 11:  2560x1440   99.946436 Hz  16:9    150.919 kHz    410.500000 MHz (596 mm x 335 mm)
                  Hfront   48 Hsync  32 Hback   80 Hpol P
                  Vfront   62 Vsync   5 Vback    3 Vpol N
Checksum: 0x65  Unused space in Extension Block: 5 bytes

----------------

Block 5, DisplayID Extension Block:
  Version: 1.2
  Extension Count: 0
  Display Interface Data Block:
    Interface Type: DisplayPort
    Number of Links: 4
    Interface Standard Version: 1.4
    Supported bpc for RGB encoding: 8, 10, 12
    Supported bpc for YCbCr 4:4:4 encoding: 8, 10, 12
    Supported bpc for YCbCr 4:2:2 encoding: 8, 10, 12
    Supported Content Protection: HDCP 2.0
    Spread Spectrum: Down Spread 0.5%
  Video Timing Modes Type 1 - Detailed Timings Data Block:
    DTD:  2560x1440  239.969753 Hz  16:9    388.511 kHz   1056.750000 MHz (aspect 16:9, no 3D stereo)
               Hfront   48 Hsync  32 Hback   80 Hpol P
               Vfront  171 Vsync   5 Vback    3 Vpol N
    DTD:  2560x1440  359.980092 Hz  16:9    569.848 kHz   1504.400000 MHz (aspect 16:9, no 3D stereo)
               Hfront    8 Hsync  32 Hback   40 Hpol P
               Vfront  135 Vsync   5 Vback    3 Vpol N
    DTD:  1920x1080  360.112860 Hz  16:9    466.346 kHz    970.000000 MHz (aspect 16:9, no 3D stereo)
               Hfront   48 Hsync  32 Hback   80 Hpol P
               Vfront  207 Vsync   5 Vback    3 Vpol N
    DTD:  2368x1332  239.969221 Hz  16:9    359.474 kHz    908.750000 MHz (aspect 16:9, no 3D stereo)
               Hfront   48 Hsync  32 Hback   80 Hpol P
               Vfront  158 Vsync   5 Vback    3 Vpol N
    DTD:  2368x1332  359.963401 Hz  16:9    574.862 kHz   1453.250000 MHz (aspect 16:9, no 3D stereo)
               Hfront   48 Hsync  32 Hback   80 Hpol P
               Vfront  257 Vsync   5 Vback    3 Vpol N
  Checksum: 0x67
Checksum: 0x90

----------------

Warnings:

Block 1, CTA-861 Extension Block:
  Colorimetry Data Block: Set the sRGB colorimetry bit to avoid interop issues.
  Video Capability Data Block: Set Selectable YCbCr Quantization to avoid interop issues.
  Video Capability Data Block: S_PT is equal to S_IT and S_CE, so should be set to 0 instead.
  Display Product Serial Number is set, so the Serial Number in the Base EDID should be 0.
Block 4, CTA-861 Extension Block:
  Colorimetry Data Block: Set the sRGB colorimetry bit to avoid interop issues.
  Video Capability Data Block: Set Selectable YCbCr Quantization to avoid interop issues.
  Video Capability Data Block: S_PT is equal to S_IT and S_CE, so should be set to 0 instead.
  Display Product Serial Number is set, so the Serial Number in the Base EDID should be 0.
EDID:
  Base EDID: Some timings are out of range of the Monitor Ranges:
    Horizontal Freq: 31.468 - 574.861 kHz (Monitor: 313.000 - 313.000 kHz)

Failures:

Block 0, Base EDID:
  Vendor & Product Identification: Invalid week 128 of manufacture.
  Vendor & Product Identification: The year 2041 is more than one year in the future.
Block 2, DisplayID Extension Block:
  Expected 0 DisplayID Extension Block, but got 1.
Block 3, Base EDID:
  Unknown Extension Block.
Block 4, CTA-861 Extension Block:
  Speaker Allocation Data Block: Only one instance of this Data Block is allowed.
  Colorimetry Data Block: Only one instance of this Data Block is allowed.
  Video Capability Data Block: Only one instance of this Data Block is allowed.
  HDR Static Metadata Data Block: Only one instance of this Data Block is allowed.
Block 5, DisplayID Extension Block:
  Product Type should be 0 in extension block.
EDID:
  Base EDID: EDID specified 2 extension block(s), but found 5 extension block(s).
  CTA-861: Native progressive timings are a mix of several resolutions.
  DisplayID: Missing DisplayID Product Identification Data Block.
  DisplayID: Missing DisplayID Display Parameters Data Block.
  DisplayID: DisplayID expects at least one preferred timing.

EDID conformity: FAIL
