
EDID (hex):
00ffffffffffff0005b2071000000000
0c180103804627780a2285a954459922
204a5ca5ce0001010101010101010101
010101010101023a801871382d40582c
4500bc862100001e000000fd00324d1f
460f000a202020202020000000ff0054
4d3130454d32595757303030000000fc
00454d3332464c0a202020202020011a
020326714b010384051020151213141f
29090705155750000700830100006703
0c001000282d023a801871382d40582c
5500bc862100001e011d007251d01e20
6e285500bc862100001e000000000000
00000000000000000000000000000000
00000000000000000000000000000000
000000000000000000000000000000f0

Extracted contents:
header:          00 ff ff ff ff ff ff 00
serial number:   05 b2 07 10 00 00 00 00 0c 18
version:         01 03
basic params:    80 46 27 78 0a
chroma info:     22 85 a9 54 45 99 22 20 4a 5c
established:     a5 ce 00
standard:        01 01 01 01 01 01 01 01 01 01 01 01 01 01 01 01
descriptor 1:    02 3a 80 18 71 38 2d 40 58 2c 45 00 bc 86 21 00 00 1e
descriptor 2:    00 00 00 fd 00 32 4d 1f 46 0f 00 0a 20 20 20 20 20 20
descriptor 3:    00 00 00 ff 00 54 4d 31 30 45 4d 32 59 57 57 30 30 30
descriptor 4:    00 00 00 fc 00 45 4d 33 32 46 4c 0a 20 20 20 20 20 20
extensions:      01
checksum:        1a

EDID version: 1.3
Manufacturer: AMR Model 1007 Serial Number --
Made in week 12 of 2014
Digital display
Maximum image size: 70 cm x 39 cm
Gamma: 2.20
RGB color display
First detailed timing is preferred timing
Display x,y Chromaticity:
  Red:   0.6601, 0.3300
  Green: 0.2695, 0.5996
  Blue:  0.1347, 0.1250
  White: 0.2900, 0.3603
Established timings supported:
  720x400@70Hz 9:5 HorFreq: 31469 Hz Clock: 28.320 MHz
  640x480@60Hz 4:3 HorFreq: 31469 Hz Clock: 25.175 MHz
  640x480@75Hz 4:3 HorFreq: 37500 Hz Clock: 31.500 MHz
  800x600@60Hz 4:3 HorFreq: 37900 Hz Clock: 40.000 MHz
  800x600@72Hz 4:3 HorFreq: 48100 Hz Clock: 50.000 MHz
  800x600@75Hz 4:3 HorFreq: 46900 Hz Clock: 49.500 MHz
  1024x768@60Hz 4:3 HorFreq: 48400 Hz Clock: 65.000 MHz
  1024x768@70Hz 4:3 HorFreq: 56500 Hz Clock: 75.000 MHz
  1024x768@75Hz 4:3 HorFreq: 60000 Hz Clock: 78.750 MHz
Standard timings supported:
Detailed mode: Clock 148.500 MHz, 700 mm x 390 mm
               1920 2008 2052 2200 hborder 0
               1080 1084 1089 1125 vborder 0
               +hsync +vsync 
               VertFreq: 60 Hz, HorFreq: 67500 Hz
Monitor ranges (GTF): 50-77Hz V, 31-70kHz H, max dotclock 150MHz
Serial number: --
Monitor name: EM32FL
Has 1 extension blocks
Checksum: 0x1a (valid)

CTA extension block
Extension version: 3
34 bytes of CTA data
  Video data block
    VIC   1 640x480@60Hz 4:3  HorFreq: 31469 Hz Clock: 25.175 MHz
    VIC   3 720x480@60Hz 16:9  HorFreq: 31469 Hz Clock: 27.000 MHz
    VIC   4 1280x720@60Hz 16:9 (native) HorFreq: 45000 Hz Clock: 74.250 MHz
    VIC   5 1920x1080i@60Hz 16:9  HorFreq: 33750 Hz Clock: 74.250 MHz
    VIC  16 1920x1080@60Hz 16:9  HorFreq: 67500 Hz Clock: 148.500 MHz
    VIC  32 1920x1080@24Hz 16:9  HorFreq: 27000 Hz Clock: 74.250 MHz
    VIC  21 1440x576i@50Hz 4:3  HorFreq: 15625 Hz Clock: 27.000 MHz
    VIC  18 720x576@50Hz 16:9  HorFreq: 31250 Hz Clock: 27.000 MHz
    VIC  19 1280x720@50Hz 16:9  HorFreq: 37500 Hz Clock: 74.250 MHz
    VIC  20 1920x1080i@50Hz 16:9  HorFreq: 28125 Hz Clock: 74.250 MHz
    VIC  31 1920x1080@50Hz 16:9  HorFreq: 56250 Hz Clock: 148.500 MHz
  Audio data block
    Linear PCM, max channels 2
      Supported sample rates (kHz): 48 44.1 32
      Supported sample sizes (bits): 24 16
    AC-3, max channels 6
      Supported sample rates (kHz): 192 96 48 44.1 32
      Maximum bit rate: 640 kHz
    RESERVED, max channels 1
      Supported sample rates (kHz): 48 44.1 32
      Maximum bit rate: 0 kHz
  Speaker allocation data block
    Speaker map:
      FL/FR - Front Left/Right
  Vendor-specific data block, OUI 000c03 (HDMI)
    Source physical address 1.0.0.0
    DC_36bit
    DC_Y444
    Maximum TMDS clock: 225MHz
Basic audio support
Supports YCbCr 4:4:4
Supports YCbCr 4:2:2
1 native detailed modes
Detailed mode: Clock 148.500 MHz, 700 mm x 390 mm
               1920 2008 2052 2200 hborder 0
               1080 1085 1090 1125 vborder 0
               +hsync +vsync 
               VertFreq: 60 Hz, HorFreq: 67500 Hz
Detailed mode: Clock 74.250 MHz, 700 mm x 390 mm
               1280 1390 1430 1650 hborder 0
                720  725  730  750 vborder 0
               +hsync +vsync 
               VertFreq: 60 Hz, HorFreq: 45000 Hz
Checksum: 0xf0 (valid)

One or more of the timings is out of range of the Monitor Ranges:
  Vertical Freq: 24 - 75 Hz
  Horizontal Freq: 15625 - 67500 Hz
  Maximum Clock: 148.500 MHz
