edid-decode (hex):

00 ff ff ff ff ff ff 00 1e 6d dc 56 56 23 01 00
07 14 01 03 80 31 20 78 ea ee 91 a3 54 4c 99 26
0f 50 54 a7 6b 80 b3 00 81 80 81 8f 71 4f 01 01
01 01 01 01 01 01 1a 36 80 a0 70 38 1f 40 30 20
35 00 fe 22 11 00 00 1e 02 3a 80 18 71 38 2d 40
58 2c 45 00 fe 22 11 00 00 1c 00 00 00 fd 00 38
4b 1e 53 0f 00 0a 20 20 20 20 20 20 00 00 00 fc
00 57 32 32 35 33 0a 20 20 20 20 20 20 20 00 0d

00 ff ff ff ff ff ff 00 1e 6d dc 56 56 23 01 00
07 14 01 03 80 31 20 78 ea ee 91 a3 54 4c 99 26
0f 50 54 a7 6b 80 b3 00 81 80 81 8f 71 4f 01 01
01 01 01 01 01 01 1a 36 80 a0 70 38 1f 40 30 20
35 00 fe 22 11 00 00 1e 02 3a 80 18 71 38 2d 40
58 2c 45 00 fe 22 11 00 00 1c 00 00 00 fd 00 38
4b 1e 53 0f 00 0a 20 20 20 20 20 20 00 00 00 fc
00 57 32 32 35 33 0a 20 20 20 20 20 20 20 00 0d

----------------

Block 0, Base EDID:
  EDID Structure Version & Revision: 1.3
  Vendor & Product Identification:
    Manufacturer: GSM
    Model: 22236
    Serial Number: ...
    Made in: week 7 of 2010
  Basic Display Parameters & Features:
    Digital display
    Maximum image size: 49 cm x 32 cm
    Gamma: 2.20
    DPMS levels: Standby Suspend Off
    RGB color display
    First detailed timing is the preferred timing
  Color Characteristics:
    Red  : 0.6396, 0.3300
    Green: 0.2998, 0.5996
    Blue : 0.1503, 0.0595
    White: 0.3125, 0.3291
  Established Timings I & II:
    IBM     :   720x400    70.081663 Hz   9:5     31.467 kHz     28.320000 MHz
    DMT 0x04:   640x480    59.940476 Hz   4:3     31.469 kHz     25.175000 MHz
    DMT 0x06:   640x480    75.000000 Hz   4:3     37.500 kHz     31.500000 MHz
    DMT 0x08:   800x600    56.250000 Hz   4:3     35.156 kHz     36.000000 MHz
    DMT 0x09:   800x600    60.316541 Hz   4:3     37.879 kHz     40.000000 MHz
    DMT 0x0b:   800x600    75.000000 Hz   4:3     46.875 kHz     49.500000 MHz
    Apple   :   832x624    74.551266 Hz   4:3     49.726 kHz     57.284000 MHz
    DMT 0x10:  1024x768    60.003840 Hz   4:3     48.363 kHz     65.000000 MHz
    DMT 0x12:  1024x768    75.028582 Hz   4:3     60.023 kHz     78.750000 MHz
    DMT 0x24:  1280x1024   75.024675 Hz   5:4     79.976 kHz    135.000000 MHz
    Apple   :  1152x870    75.061550 Hz 192:145   68.681 kHz    100.000000 MHz
  Standard Timings:
    DMT 0x3a:  1680x1050   59.954250 Hz  16:10    65.290 kHz    146.250000 MHz
    DMT 0x23:  1280x1024   60.019740 Hz   5:4     63.981 kHz    108.000000 MHz
    DMT 0x24:  1280x1024   75.024675 Hz   5:4     79.976 kHz    135.000000 MHz
    DMT 0x15:  1152x864    75.000000 Hz   4:3     67.500 kHz    108.000000 MHz
  Detailed Timing Descriptors:
    DTD 1:  1920x1080   59.933878 Hz  16:9     66.587 kHz    138.500000 MHz (510 mm x 290 mm)
                 Hfront   48 Hsync  32 Hback   80 Hpol P
                 Vfront    3 Vsync   5 Vback   23 Vpol P
    DTD 2:  1920x1080   60.000000 Hz  16:9     67.500 kHz    148.500000 MHz (510 mm x 290 mm)
                 Hfront   88 Hsync  44 Hback  148 Hpol N
                 Vfront    4 Vsync   5 Vback   36 Vpol P
    Display Range Limits:
      Monitor ranges (GTF): 56-75 Hz V, 30-83 kHz H, max dotclock 150 MHz
    Display Product Name: 'W2253'
Checksum: 0x0d

----------------

Block 1, Unknown EDID Extension Block 0x00:
  00 ff ff ff ff ff ff 00 1e 6d dc 56 56 23 01 00 '.........m.VV#..'
  07 14 01 03 80 31 20 78 ea ee 91 a3 54 4c 99 26 '.....1 x....TL.&'
  0f 50 54 a7 6b 80 b3 00 81 80 81 8f 71 4f 01 01 '.PT.k.......qO..'
  01 01 01 01 01 01 1a 36 80 a0 70 38 1f 40 30 20 '.......6..p8.@0 '
  35 00 fe 22 11 00 00 1e 02 3a 80 18 71 38 2d 40 '5..".....:..q8-@'
  58 2c 45 00 fe 22 11 00 00 1c 00 00 00 fd 00 38 'X,E..".........8'
  4b 1e 53 0f 00 0a 20 20 20 20 20 20 00 00 00 fc 'K.S...      ....'
  00 57 32 32 35 33 0a 20 20 20 20 20 20 20 00 0d '.W2253.       ..'
Checksum: 0x0d

----------------

Warnings:

Block 0, Base EDID:
  Detailed Timing Descriptor #2: DTD is similar but not identical to VIC 16.

Failures:

Block 0, Base EDID:
  Basic Display Parameters & Features: The chromaticities match sRGB, but sRGB is not signaled.
  Detailed Timing Descriptor #1: Mismatch of image size 510x290 mm vs display size 490x320 mm.
  Detailed Timing Descriptor #2: Mismatch of image size 510x290 mm vs display size 490x320 mm.
Block 1, Base EDID:
  Unknown Extension Block.
EDID:
  Base EDID: The DTD max image size is 510x290mm, which is larger than the display size 490.0x320.0mm.
  Base EDID: EDID specified 0 extension block(s), but found 1 extension block(s).

EDID conformity: FAIL
