edid-decode (hex):

00 ff ff ff ff ff ff 00 09 d1 b8 78 45 54 00 00
07 17 01 03 0e 2c 19 78 2e 82 40 a2 54 55 9f 28
0b 50 54 a5 6a 80 71 00 81 c0 81 40 81 80 a9 c0
01 01 01 01 01 01 30 2a 40 c8 60 84 64 30 18 50
13 00 bb f9 10 00 00 1a 00 00 00 ff 00 45 32 44
30 31 30 34 36 53 4c 30 0a 0a 00 00 00 fd 00 32
4c 18 53 11 00 0a 20 20 20 20 20 20 00 00 00 fc
00 42 65 6e 51 20 47 4c 32 30 35 35 0a 20 00 bc

----------------

Block 0, Base EDID:
  EDID Structure Version & Revision: 1.3
  Vendor & Product Identification:
    Manufacturer: BNQ
    Model: 30904
    Serial Number: ...
    Made in: week 7 of 2013
  Basic Display Parameters & Features:
    Analog display
    Input voltage level: 0.7/0.3 V
    Sync: Separate Composite SyncOnGreen
    Maximum image size: 44 cm x 25 cm
    Gamma: 2.20
    DPMS levels: Off
    RGB color display
    Default (sRGB) color space is primary color space
    First detailed timing is preferred timing
  Color Characteristics:
    Red  : 0.6347, 0.3281
    Green: 0.3320, 0.6230
    Blue : 0.1572, 0.0429
    White: 0.3125, 0.3281
  Established Timings I & II:
    IBM     :   720x400    70.082 Hz   9:5    31.467 kHz  28.320 MHz
    DMT 0x04:   640x480    59.940 Hz   4:3    31.469 kHz  25.175 MHz
    DMT 0x06:   640x480    75.000 Hz   4:3    37.500 kHz  31.500 MHz
    DMT 0x09:   800x600    60.317 Hz   4:3    37.879 kHz  40.000 MHz
    DMT 0x0b:   800x600    75.000 Hz   4:3    46.875 kHz  49.500 MHz
    Apple   :   832x624    74.551 Hz   4:3    49.726 kHz  57.284 MHz
    DMT 0x10:  1024x768    60.004 Hz   4:3    48.363 kHz  65.000 MHz
    DMT 0x12:  1024x768    75.029 Hz   4:3    60.023 kHz  78.750 MHz
    Apple   :  1152x870    75.062 Hz 192:145  68.681 kHz 100.000 MHz
  Standard Timings:
    GTF     :  1152x720    60.000 Hz  16:10   44.760 kHz  67.319 MHz
    DMT 0x55:  1280x720    60.000 Hz  16:9    45.000 kHz  74.250 MHz
    DMT 0x20:  1280x960    60.000 Hz   4:3    60.000 kHz 108.000 MHz
    DMT 0x23:  1280x1024   60.020 Hz   5:4    63.981 kHz 108.000 MHz
    DMT 0x53:  1600x900    60.000 Hz  16:9    60.000 kHz 108.000 MHz (RB)
  Detailed Timing Descriptors:
    DTD 1:  1600x900    60.000 Hz  16:9    60.000 kHz 108.000 MHz (443 mm x 249 mm)
                 Hfront   24 Hsync  80 Hback  96 Hpol P
                 Vfront    1 Vsync   3 Vback  96 Vpol N
    Display Product Serial Number: ...
  Display Range Limits:
    Monitor ranges (GTF): 50-76 Hz V, 24-83 kHz H, max dotclock 170 MHz
    Display Product Name: 'BenQ GL2055'
Checksum: 0xbc
