edid-decode (hex):

00 ff ff ff ff ff ff 00 4c a3 33 d0 00 00 00 00
0c 15 01 04 95 26 16 78 0a a0 55 8d 51 5a 96 2a
1c 50 54 00 00 00 01 01 01 01 01 01 01 01 01 01
01 01 01 01 01 01 6a 4d 80 a0 70 38 fc 41 30 20
36 00 7e d7 10 00 00 18 d4 9a 80 a0 70 38 fc 41
30 20 36 00 7e d7 10 00 00 38 00 00 00 fc 00 53
41 4d 53 55 4e 47 0a 20 20 20 20 20 00 00 00 fc
00 31 37 33 48 54 30 32 2d 43 30 31 0a 20 00 35

----------------

Block 0, Base EDID:
  EDID Structure Version & Revision: 1.4
  Vendor & Product Identification:
    Manufacturer: SEC
    Model: 53299
    Made in: week 12 of 2011
  Basic Display Parameters & Features:
    Digital display
    Bits per primary color channel: 6
    DisplayPort interface
    Maximum image size: 38 cm x 22 cm
    Gamma: 2.20
    Supported color formats: RGB 4:4:4, YCrCb 4:4:4
    First detailed timing includes the native pixel format and preferred refresh rate
  Color Characteristics:
    Red  : 0.5527, 0.3183
    Green: 0.3515, 0.5859
    Blue : 0.1650, 0.1103
    White: 0.3134, 0.3291
  Established Timings I & II: none
  Standard Timings: none
  Detailed Timing Descriptors:
    DTD 1:  1920x1080   59.999 Hz  16:9    95.279 kHz 198.180 MHz (382 mm x 215 mm)
                 Hfront   48 Hsync  32 Hback  80 Hpol N
                 Vfront    3 Vsync   6 Vback 499 Vpol N
    DTD 2:  1920x1080  119.999 Hz  16:9   190.558 kHz 396.360 MHz (field sequential L/R, 382 mm x 215 mm)
                 Hfront   48 Hsync  32 Hback  80 Hpol N
                 Vfront    3 Vsync   6 Vback 499 Vpol N
    Display Product Name: 'SAMSUNG'
    Display Product Name: '173HT02-C01'
Checksum: 0x35

----------------

EDID conformity: PASS
