
EDID (hex):
00ffffffffffff001ab3f60701010101
0b15010380261e782ab7f5a058569f28
0b5054a54b0081800101010101010101
010101010101302a009851002a403070
1300782d1100001e000000fd00384c1f
510e000a202020202020000000fc0045
31392d36204c45440a202020000000ff
00595633563030393932320a2020001e

Extracted contents:
header:          00 ff ff ff ff ff ff 00
serial number:   1a b3 f6 07 01 01 01 01 0b 15
version:         01 03
basic params:    80 26 1e 78 2a
chroma info:     b7 f5 a0 58 56 9f 28 0b 50 54
established:     a5 4b 00
standard:        81 80 01 01 01 01 01 01 01 01 01 01 01 01 01 01
descriptor 1:    30 2a 00 98 51 00 2a 40 30 70 13 00 78 2d 11 00 00 1e
descriptor 2:    00 00 00 fd 00 38 4c 1f 51 0e 00 0a 20 20 20 20 20 20
descriptor 3:    00 00 00 fc 00 45 31 39 2d 36 20 4c 45 44 0a 20 20 20
descriptor 4:    00 00 00 ff 00 59 56 33 56 30 30 39 39 32 32 0a 20 20
extensions:      00
checksum:        1e

EDID version: 1.3
Manufacturer: FUS Model 7f6 Serial Number --
Made in week 11 of 2011
Digital display
Maximum image size: 38 cm x 30 cm
Gamma: 2.20
DPMS levels: Off
RGB color display
First detailed timing is preferred timing
Display x,y Chromaticity:
  Red:   0.6269, 0.3466
  Green: 0.3369, 0.6240
  Blue:  0.1591, 0.0458
  White: 0.3134, 0.3291
Established timings supported:
  720x400@70Hz 9:5 HorFreq: 31469 Hz Clock: 28.320 MHz
  640x480@60Hz 4:3 HorFreq: 31469 Hz Clock: 25.175 MHz
  640x480@75Hz 4:3 HorFreq: 37500 Hz Clock: 31.500 MHz
  800x600@60Hz 4:3 HorFreq: 37900 Hz Clock: 40.000 MHz
  800x600@75Hz 4:3 HorFreq: 46900 Hz Clock: 49.500 MHz
  1024x768@60Hz 4:3 HorFreq: 48400 Hz Clock: 65.000 MHz
  1024x768@75Hz 4:3 HorFreq: 60000 Hz Clock: 78.750 MHz
  1280x1024@75Hz 5:4 HorFreq: 80000 Hz Clock: 135.000 MHz
Standard timings supported:
  1280x1024@60Hz 5:4 HorFreq: 64000 Hz Clock: 108.000 MHz
Detailed mode: Clock 108.000 MHz, 376 mm x 301 mm
               1280 1328 1440 1688 hborder 0
               1024 1025 1028 1066 vborder 0
               +hsync +vsync 
               VertFreq: 60 Hz, HorFreq: 63981 Hz
Monitor ranges (GTF): 56-76Hz V, 31-81kHz H, max dotclock 140MHz
Monitor name: E19-6 LED
Serial number: --
Checksum: 0x1e (valid)


