
EDID (hex):
00ffffffffffff0010ac6c40535a4842
30150103802c1978eaec85a2544da127
125054a54b00714f8180a9c001010101
0101010101012f2640a060841a303020
3500bbf91000001a000000ff00433258
4d3831425342485a530a000000fc0044
454c4c204532303131480a20000000fd
00384c1e5311000a20202020202000fe

Extracted contents:
header:          00 ff ff ff ff ff ff 00
serial number:   10 ac 6c 40 53 5a 48 42 30 15
version:         01 03
basic params:    80 2c 19 78 ea
chroma info:     ec 85 a2 54 4d a1 27 12 50 54
established:     a5 4b 00
standard:        71 4f 81 80 a9 c0 01 01 01 01 01 01 01 01 01 01
descriptor 1:    2f 26 40 a0 60 84 1a 30 30 20 35 00 bb f9 10 00 00 1a
descriptor 2:    00 00 00 ff 00 43 32 58 4d 38 31 42 53 42 48 5a 53 0a
descriptor 3:    00 00 00 fc 00 44 45 4c 4c 20 45 32 30 31 31 48 0a 20
descriptor 4:    00 00 00 fd 00 38 4c 1e 53 11 00 0a 20 20 20 20 20 20
extensions:      00
checksum:        fe

EDID version: 1.3
Manufacturer: DEL Model 406c Serial Number --
Made in week 48 of 2011
Digital display
Maximum image size: 44 cm x 25 cm
Gamma: 2.20
DPMS levels: Standby Suspend Off
RGB color display
First detailed timing is preferred timing
Display x,y Chromaticity:
  Red:   0.6357, 0.3300
  Green: 0.3037, 0.6289
  Blue:  0.1542, 0.0703
  White: 0.3134, 0.3291
Established timings supported:
  720x400@70Hz 9:5 HorFreq: 31469 Hz Clock: 28.320 MHz
  640x480@60Hz 4:3 HorFreq: 31469 Hz Clock: 25.175 MHz
  640x480@75Hz 4:3 HorFreq: 37500 Hz Clock: 31.500 MHz
  800x600@60Hz 4:3 HorFreq: 37900 Hz Clock: 40.000 MHz
  800x600@75Hz 4:3 HorFreq: 46900 Hz Clock: 49.500 MHz
  1024x768@60Hz 4:3 HorFreq: 48400 Hz Clock: 65.000 MHz
  1024x768@75Hz 4:3 HorFreq: 60000 Hz Clock: 78.750 MHz
  1280x1024@75Hz 5:4 HorFreq: 80000 Hz Clock: 135.000 MHz
Standard timings supported:
  1152x864@75Hz 4:3 HorFreq: 67500 Hz Clock: 108.000 MHz
  1280x1024@60Hz 5:4 HorFreq: 64000 Hz Clock: 108.000 MHz
  1600x900@60Hz 16:9
Detailed mode: Clock 97.750 MHz, 443 mm x 249 mm
               1600 1648 1680 1760 hborder 0
                900  903  908  926 vborder 0
               +hsync -vsync 
               VertFreq: 59 Hz, HorFreq: 55539 Hz
Serial number: --
Monitor name: DELL E2011H
Monitor ranges (GTF): 56-76Hz V, 30-83kHz H, max dotclock 170MHz
Checksum: 0xfe (valid)
