edid-decode (hex):

00 ff ff ff ff ff ff 00 3b 10 60 34 00 00 00 00
26 15 01 03 68 1e 16 78 ee 37 25 9e 58 4a 97 26
19 50 54 ad ee 00 01 01 01 01 01 01 01 01 01 01
01 01 01 01 01 01 64 19 00 40 41 00 26 30 18 88
36 00 00 00 00 00 00 18 00 00 00 fd 00 32 4c 1e
3f 0b 00 0a 20 20 20 20 20 20 00 00 00 fc 00 41
49 4f 20 50 43 0a 20 20 20 20 20 20 00 00 00 ff
00 4e 58 50 20 50 54 4e 33 34 36 30 20 20 00 d0

00 ff ff ff ff ff ff 00 3b 10 60 34 00 00 00 00
26 15 01 03 68 1e 16 78 ee 37 25 9e 58 4a 97 26
19 50 54 ad ee 00 01 01 01 01 01 01 01 01 01 01
01 01 01 01 01 01 64 19 00 40 41 00 26 30 18 88
36 00 00 00 00 00 00 18 00 00 00 fd 00 32 4c 1e
3f 0b 00 0a 20 20 20 20 20 20 00 00 00 fc 00 41
49 4f 20 50 43 0a 20 20 20 20 20 20 00 00 00 ff
00 4e 58 50 20 50 54 4e 33 34 36 30 20 20 00 d0

----------------

Block 0, Base EDID:
  EDID Structure Version & Revision: 1.3
  Vendor & Product Identification:
    Manufacturer: NXP
    Model: 13408
    Made in: week 38 of 2011
  Basic Display Parameters & Features:
    Analog display
    Signal Level Standard: 0.700 : 0.000 : 0.700 V p-p
    Blank level equals black level
    Sync: Separate
    Maximum image size: 30 cm x 22 cm
    Gamma: 2.20
    DPMS levels: Standby Suspend Off
    RGB color display
    Default (sRGB) color space is primary color space
    First detailed timing is the preferred timing
  Color Characteristics:
    Red  : 0.6171, 0.3466
    Green: 0.2900, 0.5927
    Blue : 0.1484, 0.0996
    White: 0.3134, 0.3291
  Established Timings I & II:
    IBM     :   720x400    70.081663 Hz   9:5     31.467 kHz     28.320000 MHz
    DMT 0x04:   640x480    59.940476 Hz   4:3     31.469 kHz     25.175000 MHz
    DMT 0x05:   640x480    72.808802 Hz   4:3     37.861 kHz     31.500000 MHz
    DMT 0x06:   640x480    75.000000 Hz   4:3     37.500 kHz     31.500000 MHz
    DMT 0x09:   800x600    60.316541 Hz   4:3     37.879 kHz     40.000000 MHz
    DMT 0x0a:   800x600    72.187572 Hz   4:3     48.077 kHz     50.000000 MHz
    DMT 0x0b:   800x600    75.000000 Hz   4:3     46.875 kHz     49.500000 MHz
    Apple   :   832x624    74.551266 Hz   4:3     49.726 kHz     57.284000 MHz
    DMT 0x10:  1024x768    60.003840 Hz   4:3     48.363 kHz     65.000000 MHz
    DMT 0x11:  1024x768    70.069359 Hz   4:3     56.476 kHz     75.000000 MHz
    DMT 0x12:  1024x768    75.028582 Hz   4:3     60.023 kHz     78.750000 MHz
  Standard Timings: none
  Detailed Timing Descriptors:
    DTD 1:  1024x768    60.003840 Hz   4:3     48.363 kHz     65.000000 MHz
                 Hfront   24 Hsync 136 Hback  160 Hpol N
                 Vfront    3 Vsync   6 Vback   29 Vpol N
    Display Range Limits:
      Monitor ranges (GTF): 50-76 Hz V, 30-63 kHz H, max dotclock 110 MHz
    Display Product Name: 'AIO PC'
    Display Product Serial Number: ...
Checksum: 0xd0

----------------

Block 1, Unknown EDID Extension Block 0x00:
  00 ff ff ff ff ff ff 00 3b 10 60 34 00 00 00 00 '........;.`4....'
  26 15 01 03 68 1e 16 78 ee 37 25 9e 58 4a 97 26 '&...h..x.7%.XJ.&'
  19 50 54 ad ee 00 01 01 01 01 01 01 01 01 01 01 '.PT.............'
  01 01 01 01 01 01 64 19 00 40 41 00 26 30 18 88 '......d..@A.&0..'
  36 00 00 00 00 00 00 18 00 00 00 fd 00 32 4c 1e '6............2L.'
  3f 0b 00 0a 20 20 20 20 20 20 00 00 00 fc 00 41 '?...      .....A'
  49 4f 20 50 43 0a 20 20 20 20 20 20 00 00 00 ff 'IO PC.      ....'
  00 4e 58 50 20 50 54 4e 33 34 36 30 20 20 00 d0 '.NXP PTN3460  ..'
Checksum: 0xd0

----------------

Failures:

Block 0, Base EDID:
  Basic Display Parameters & Features: sRGB is signaled, but the chromaticities do not match.
  Detailed Timing Descriptor #1: Mismatch of image size vs display size: image size is not set, but display size is.
  Display Product Serial Number: ...
Block 1, Base EDID:
  Unknown Extension Block.
EDID:
  Base EDID: EDID specified 0 extension block(s), but found 1 extension block(s).

EDID conformity: FAIL
