
EDID (hex):
00ffffffffffff0010ace74157353832
271e0103803c22782aee95a3544c9926
0f5054a54b00d1c0b30081808100714f
010101010101c484807870384d401c20
350055502100001e000000ff00334256
335731330a2020202020000000fc0044
454c4c205332373231484746000000fd
0030901eaa22000a20202020202001e0
02032bf14a3f101f0413121103020123
097f078301000065030c0010006d1a00
0002013090e60000000000c484807870
384d401c20350055502100001e866f80
a0703840403020350055502100001a66
2156aa51001e30468f33005550210000
1e000000000000000000000000000000
0000000000000000000000000000007f

Extracted contents:
header:          00 ff ff ff ff ff ff 00
serial number:   10 ac e7 41 57 35 38 32 27 1e
version:         01 03
basic params:    80 3c 22 78 2a
chroma info:     ee 95 a3 54 4c 99 26 0f 50 54
established:     a5 4b 00
standard:        d1 c0 b3 00 81 80 81 00 71 4f 01 01 01 01 01 01
descriptor 1:    c4 84 80 78 70 38 4d 40 1c 20 35 00 55 50 21 00 00 1e
descriptor 2:    00 00 00 ff 00 33 42 56 33 57 31 33 0a 20 20 20 20 20
descriptor 3:    00 00 00 fc 00 44 45 4c 4c 20 53 32 37 32 31 48 47 46
descriptor 4:    00 00 00 fd 00 30 90 1e aa 22 00 0a 20 20 20 20 20 20
extensions:      01
checksum:        e0

EDID version: 1.3
Manufacturer: DEL Model 41e7 Serial Number --
Made in week 39 of 2020
Digital display
Maximum image size: 60 cm x 34 cm
Gamma: 2.20
DPMS levels: Off
RGB color display
First detailed timing is preferred timing
Display x,y Chromaticity:
  Red:   0.6396, 0.3300
  Green: 0.2998, 0.5996
  Blue:  0.1503, 0.0595
  White: 0.3134, 0.3291
Established timings supported:
  720x400@70Hz 9:5 HorFreq: 31469 Hz Clock: 28.320 MHz
  640x480@60Hz 4:3 HorFreq: 31469 Hz Clock: 25.175 MHz
  640x480@75Hz 4:3 HorFreq: 37500 Hz Clock: 31.500 MHz
  800x600@60Hz 4:3 HorFreq: 37900 Hz Clock: 40.000 MHz
  800x600@75Hz 4:3 HorFreq: 46900 Hz Clock: 49.500 MHz
  1024x768@60Hz 4:3 HorFreq: 48400 Hz Clock: 65.000 MHz
  1024x768@75Hz 4:3 HorFreq: 60000 Hz Clock: 78.750 MHz
  1280x1024@75Hz 5:4 HorFreq: 80000 Hz Clock: 135.000 MHz
Standard timings supported:
  1920x1080@60Hz 16:9
  1680x1050@60Hz 16:10 HorFreq: 64700 Hz Clock: 119.000 MHz
  1280x1024@60Hz 5:4 HorFreq: 64000 Hz Clock: 108.000 MHz
  1280x800@60Hz 16:10
  1152x864@75Hz 4:3 HorFreq: 67500 Hz Clock: 108.000 MHz
Detailed mode: Clock 339.880 MHz, 597 mm x 336 mm
               1920 1948 1980 2040 hborder 0
               1080 1083 1088 1157 vborder 0
               +hsync +vsync 
               VertFreq: 143 Hz, HorFreq: 166607 Hz
Serial number: --
Monitor ranges (GTF): 48-144Hz V, 30-170kHz H, max dotclock 340MHz
Has 1 extension blocks
Checksum: 0xe0 (valid)

CTA extension block
Extension version: 3
39 bytes of CTA data
  Video data block
    VIC  63 1920x1080@120Hz 16:9  HorFreq: 135000 Hz Clock: 297.000 MHz
    VIC  16 1920x1080@60Hz 16:9  HorFreq: 67500 Hz Clock: 148.500 MHz
    VIC  31 1920x1080@50Hz 16:9  HorFreq: 56250 Hz Clock: 148.500 MHz
    VIC   4 1280x720@60Hz 16:9  HorFreq: 45000 Hz Clock: 74.250 MHz
    VIC  19 1280x720@50Hz 16:9  HorFreq: 37500 Hz Clock: 74.250 MHz
    VIC  18 720x576@50Hz 16:9  HorFreq: 31250 Hz Clock: 27.000 MHz
    VIC  17 720x576@50Hz 4:3  HorFreq: 31250 Hz Clock: 27.000 MHz
    VIC   3 720x480@60Hz 16:9  HorFreq: 31469 Hz Clock: 27.000 MHz
    VIC   2 720x480@60Hz 4:3  HorFreq: 31469 Hz Clock: 27.000 MHz
    VIC   1 640x480@60Hz 4:3  HorFreq: 31469 Hz Clock: 25.175 MHz
  Audio data block
    Linear PCM, max channels 2
      Supported sample rates (kHz): 192 176.4 96 88.2 48 44.1 32
      Supported sample sizes (bits): 24 20 16
  Speaker allocation data block
    Speaker map:
      FL/FR - Front Left/Right
  Vendor-specific data block, OUI 000c03 (HDMI)
    Source physical address 1.0.0.0
  Vendor-specific data block, OUI 00001a
Underscans PC formats by default
Basic audio support
Supports YCbCr 4:4:4
Supports YCbCr 4:2:2
1 native detailed modes
Detailed mode: Clock 339.880 MHz, 597 mm x 336 mm
               1920 1948 1980 2040 hborder 0
               1080 1083 1088 1157 vborder 0
               +hsync +vsync 
               VertFreq: 143 Hz, HorFreq: 166607 Hz
Detailed mode: Clock 285.500 MHz, 597 mm x 336 mm
               1920 1968 2000 2080 hborder 0
               1080 1083 1088 1144 vborder 0
               +hsync -vsync 
               VertFreq: 119 Hz, HorFreq: 137259 Hz
Detailed mode: Clock 85.500 MHz, 597 mm x 336 mm
               1366 1436 1579 1792 hborder 0
                768  771  774  798 vborder 0
               +hsync +vsync 
               VertFreq: 59 Hz, HorFreq: 47712 Hz
Checksum: 0x7f (valid)

EDID block does NOT conform to EDID 1.3!
	Name descriptor not terminated with a newline
EDID block does not conform at all!
	Both the serial number and the serial string are set
