edid-decode (hex):

00 ff ff ff ff ff ff 00 4c 2d 5c 10 43 4c 4e 30
09 21 01 04 b5 3c 22 78 3a 2e b5 ae 4f 46 a6 26
11 50 54 bf ef 80 81 c0 81 00 81 80 95 00 a9 c0
b3 00 71 4f 01 01 56 5e 00 a0 a0 a0 29 50 30 20
35 00 55 50 21 00 00 1a 00 00 00 fd 08 32 f0 1e
67 62 00 0a 20 20 20 20 20 20 00 00 00 fc 00 4c
43 32 37 47 37 78 54 0a 20 20 20 20 00 00 00 ff
00 48 4e 42 57 32 30 33 33 31 31 0a 20 20 02 5f

02 03 1c f1 47 90 3f 1f 04 13 12 03 23 09 07 07
83 01 00 00 e3 05 c0 00 e3 06 05 01 5a 87 80 a0
70 38 4d 40 30 20 35 00 55 50 21 00 00 1a 23 e8
80 78 70 38 87 40 1c 20 98 0c 55 50 21 00 00 1a
6f c2 00 a0 a0 a0 55 50 30 20 35 00 55 50 21 00
00 1a 98 e2 00 a0 a0 a0 29 50 08 40 35 00 55 50
21 00 00 1a 02 3a 80 18 71 38 2d 40 58 2c 45 00
56 50 21 00 00 1e 00 00 00 00 00 00 00 00 00 88

70 12 17 00 00 03 01 14 e1 7b 01 88 ff 09 9f 00
2f 80 1f 00 9f 05 31 00 02 00 04 00 8a 00 00 00
00 00 00 00 00 00 00 00 00 00 00 00 00 00 00 00
00 00 00 00 00 00 00 00 00 00 00 00 00 00 00 00
00 00 00 00 00 00 00 00 00 00 00 00 00 00 00 00
00 00 00 00 00 00 00 00 00 00 00 00 00 00 00 00
00 00 00 00 00 00 00 00 00 00 00 00 00 00 00 00
00 00 00 00 00 00 00 00 00 00 00 00 00 00 00 90

00 ff ff ff ff ff ff 00 4c 2d 5c 10 43 4c 4e 30
09 21 01 04 b5 3c 22 78 3a 2e b5 ae 4f 46 a6 26
11 50 54 bf ef 80 81 c0 81 00 81 80 95 00 a9 c0
b3 00 71 4f 01 01 56 5e 00 a0 a0 a0 29 50 30 20
35 00 55 50 21 00 00 1a 00 00 00 fd 08 32 f0 1e
67 62 00 0a 20 20 20 20 20 20 00 00 00 fc 00 4c
43 32 37 47 37 78 54 0a 20 20 20 20 00 00 00 ff
00 48 4e 42 57 32 30 33 33 31 31 0a 20 20 02 5f

02 03 1c f1 47 90 3f 1f 04 13 12 03 23 09 07 07
83 01 00 00 e3 05 c0 00 e3 06 05 01 5a 87 80 a0
70 38 4d 40 30 20 35 00 55 50 21 00 00 1a 23 e8
80 78 70 38 87 40 1c 20 98 0c 55 50 21 00 00 1a
6f c2 00 a0 a0 a0 55 50 30 20 35 00 55 50 21 00
00 1a 98 e2 00 a0 a0 a0 29 50 08 40 35 00 55 50
21 00 00 1a 02 3a 80 18 71 38 2d 40 58 2c 45 00
56 50 21 00 00 1e 00 00 00 00 00 00 00 00 00 88

70 12 17 00 00 03 01 14 e1 7b 01 88 ff 09 9f 00
2f 80 1f 00 9f 05 31 00 02 00 04 00 8a 00 00 00
00 00 00 00 00 00 00 00 00 00 00 00 00 00 00 00
00 00 00 00 00 00 00 00 00 00 00 00 00 00 00 00
00 00 00 00 00 00 00 00 00 00 00 00 00 00 00 00
00 00 00 00 00 00 00 00 00 00 00 00 00 00 00 00
00 00 00 00 00 00 00 00 00 00 00 00 00 00 00 00
00 00 00 00 00 00 00 00 00 00 00 00 00 00 00 90

----------------

Block 0, Base EDID:
  EDID Structure Version & Revision: 1.4
  Vendor & Product Identification:
    Manufacturer: SAM
    Model: 4188
    Serial Number: ...
    Made in: week 9 of 2023
  Basic Display Parameters & Features:
    Digital display
    Bits per primary color channel: 10
    DisplayPort interface
    Maximum image size: 60 cm x 34 cm
    Gamma: 2.20
    DPMS levels: Off
    Supported color formats: RGB 4:4:4, YCrCb 4:4:4, YCrCb 4:2:2
    First detailed timing includes the native pixel format and preferred refresh rate
  Color Characteristics:
    Red  : 0.6796, 0.3105
    Green: 0.2763, 0.6503
    Blue : 0.1503, 0.0693
    White: 0.3134, 0.3291
  Established Timings I & II:
    IBM     :   720x400    70.081663 Hz   9:5     31.467 kHz     28.320000 MHz
    DMT 0x04:   640x480    59.940476 Hz   4:3     31.469 kHz     25.175000 MHz
    Apple   :   640x480    66.666667 Hz   4:3     35.000 kHz     30.240000 MHz
    DMT 0x05:   640x480    72.808802 Hz   4:3     37.861 kHz     31.500000 MHz
    DMT 0x06:   640x480    75.000000 Hz   4:3     37.500 kHz     31.500000 MHz
    DMT 0x08:   800x600    56.250000 Hz   4:3     35.156 kHz     36.000000 MHz
    DMT 0x09:   800x600    60.316541 Hz   4:3     37.879 kHz     40.000000 MHz
    DMT 0x0a:   800x600    72.187572 Hz   4:3     48.077 kHz     50.000000 MHz
    DMT 0x0b:   800x600    75.000000 Hz   4:3     46.875 kHz     49.500000 MHz
    Apple   :   832x624    74.551266 Hz   4:3     49.726 kHz     57.284000 MHz
    DMT 0x10:  1024x768    60.003840 Hz   4:3     48.363 kHz     65.000000 MHz
    DMT 0x11:  1024x768    70.069359 Hz   4:3     56.476 kHz     75.000000 MHz
    DMT 0x12:  1024x768    75.028582 Hz   4:3     60.023 kHz     78.750000 MHz
    DMT 0x24:  1280x1024   75.024675 Hz   5:4     79.976 kHz    135.000000 MHz
    Apple   :  1152x870    75.061550 Hz 192:145   68.681 kHz    100.000000 MHz
  Standard Timings:
    DMT 0x55:  1280x720    60.000000 Hz  16:9     45.000 kHz     74.250000 MHz
    DMT 0x1c:  1280x800    59.810326 Hz  16:10    49.702 kHz     83.500000 MHz
    DMT 0x23:  1280x1024   60.019740 Hz   5:4     63.981 kHz    108.000000 MHz
    DMT 0x2f:  1440x900    59.887445 Hz  16:10    55.935 kHz    106.500000 MHz
    DMT 0x53:  1600x900    60.000000 Hz  16:9     60.000 kHz    108.000000 MHz (RB)
    DMT 0x3a:  1680x1050   59.954250 Hz  16:10    65.290 kHz    146.250000 MHz
    DMT 0x15:  1152x864    75.000000 Hz   4:3     67.500 kHz    108.000000 MHz
  Detailed Timing Descriptors:
    DTD  1:  2560x1440   59.950550 Hz  16:9     88.787 kHz    241.500000 MHz (597 mm x 336 mm)
                  Hfront   48 Hsync  32 Hback   80 Hpol P
                  Vfront    3 Vsync   5 Vback   33 Vpol N
    Display Range Limits:
      Monitor ranges (GTF): 50-240 Hz V, 30-358 kHz H, max dotclock 980 MHz
    Display Product Name: 'LC27G7xT'
    Display Product Serial Number: ...
  Extension blocks: 2
Checksum: 0x5f

----------------

Block 1, CTA-861 Extension Block:
  Revision: 3
  Underscans IT Video Formats by default
  Basic audio support
  Supports YCbCr 4:4:4
  Supports YCbCr 4:2:2
  Native detailed modes: 1
  Video Data Block:
    VIC  16:  1920x1080   60.000000 Hz  16:9     67.500 kHz    148.500000 MHz (native)
    VIC  63:  1920x1080  120.000000 Hz  16:9    135.000 kHz    297.000000 MHz
    VIC  31:  1920x1080   50.000000 Hz  16:9     56.250 kHz    148.500000 MHz
    VIC   4:  1280x720    60.000000 Hz  16:9     45.000 kHz     74.250000 MHz
    VIC  19:  1280x720    50.000000 Hz  16:9     37.500 kHz     74.250000 MHz
    VIC  18:   720x576    50.000000 Hz  16:9     31.250 kHz     27.000000 MHz
    VIC   3:   720x480    59.940060 Hz  16:9     31.469 kHz     27.000000 MHz
  Audio Data Block:
    Linear PCM:
      Max channels: 2
      Supported sample rates (kHz): 48 44.1 32
      Supported sample sizes (bits): 24 20 16
  Speaker Allocation Data Block:
    FL/FR - Front Left/Right
  Colorimetry Data Block:
    BT2020YCC
    BT2020RGB
  HDR Static Metadata Data Block:
    Electro optical transfer functions:
      Traditional gamma - SDR luminance range
      SMPTE ST2084
    Supported static metadata descriptors:
      Static metadata type 1
  Detailed Timing Descriptors:
    DTD  2:  1920x1080  143.981451 Hz  16:9    166.587 kHz    346.500000 MHz (597 mm x 336 mm)
                  Hfront   48 Hsync  32 Hback   80 Hpol P
                  Vfront    3 Vsync   5 Vback   69 Vpol N
    DTD  3:  1920x1080  239.760349 Hz  16:9    291.309 kHz    594.270000 MHz (597 mm x 336 mm)
                  Hfront   28 Hsync  32 Hback   60 Hpol P
                  Vfront   57 Vsync   8 Vback   70 Vpol N
    DTD  4:  2560x1440  119.997589 Hz  16:9    182.996 kHz    497.750000 MHz (597 mm x 336 mm)
                  Hfront   48 Hsync  32 Hback   80 Hpol P
                  Vfront    3 Vsync   5 Vback   77 Vpol N
    DTD  5:  2560x1440  144.000477 Hz  16:9    213.265 kHz    580.080000 MHz (597 mm x 336 mm)
                  Hfront    8 Hsync  64 Hback   88 Hpol P
                  Vfront    3 Vsync   5 Vback   33 Vpol N
    DTD  6:  1920x1080   60.000000 Hz  16:9     67.500 kHz    148.500000 MHz (598 mm x 336 mm)
                  Hfront   88 Hsync  44 Hback  148 Hpol P
                  Vfront    4 Vsync   5 Vback   36 Vpol P
Checksum: 0x88  Unused space in Extension Block: 9 bytes

----------------

Block 2, DisplayID Extension Block:
  Version: 1.2
  Extension Count: 0
  Display Product Type: Extension Section
  Video Timing Modes Type 1 - Detailed Timings Data Block:
    DTD:  2560x1440  239.957560 Hz   0:0    357.537 kHz    972.500000 MHz (aspect undefined, no 3D stereo, preferred)
               Hfront   48 Hsync  32 Hback   80 Hpol P
               Vfront    3 Vsync   5 Vback   42 Vpol N
  Checksum: 0x8a
Checksum: 0x90  Unused space in Extension Block: 98 bytes

----------------

Block 3, Unknown EDID Extension Block 0x00:
  00 ff ff ff ff ff ff 00 4c 2d 5c 10 43 4c 4e 30 '........L-\.CLN0'
  09 21 01 04 b5 3c 22 78 3a 2e b5 ae 4f 46 a6 26 '.!...<"x:...OF.&'
  11 50 54 bf ef 80 81 c0 81 00 81 80 95 00 a9 c0 '.PT.............'
  b3 00 71 4f 01 01 56 5e 00 a0 a0 a0 29 50 30 20 '..qO..V^....)P0 '
  35 00 55 50 21 00 00 1a 00 00 00 fd 08 32 f0 1e '5.UP!........2..'
  67 62 00 0a 20 20 20 20 20 20 00 00 00 fc 00 4c 'gb..      .....L'
  43 32 37 47 37 78 54 0a 20 20 20 20 00 00 00 ff 'C27G7xT.    ....'
  00 48 4e 42 57 32 30 33 33 31 31 0a 20 20 02 5f '.HNBW203311.  ._'
Checksum: 0x5f

----------------

Block 4, CTA-861 Extension Block:
  Revision: 3
  Underscans IT Video Formats by default
  Basic audio support
  Supports YCbCr 4:4:4
  Supports YCbCr 4:2:2
  Native detailed modes: 1
  Video Data Block:
    VIC  16:  1920x1080   60.000000 Hz  16:9     67.500 kHz    148.500000 MHz (native)
    VIC  63:  1920x1080  120.000000 Hz  16:9    135.000 kHz    297.000000 MHz
    VIC  31:  1920x1080   50.000000 Hz  16:9     56.250 kHz    148.500000 MHz
    VIC   4:  1280x720    60.000000 Hz  16:9     45.000 kHz     74.250000 MHz
    VIC  19:  1280x720    50.000000 Hz  16:9     37.500 kHz     74.250000 MHz
    VIC  18:   720x576    50.000000 Hz  16:9     31.250 kHz     27.000000 MHz
    VIC   3:   720x480    59.940060 Hz  16:9     31.469 kHz     27.000000 MHz
  Audio Data Block:
    Linear PCM:
      Max channels: 2
      Supported sample rates (kHz): 48 44.1 32
      Supported sample sizes (bits): 24 20 16
  Speaker Allocation Data Block:
    FL/FR - Front Left/Right
  Colorimetry Data Block:
    BT2020YCC
    BT2020RGB
  HDR Static Metadata Data Block:
    Electro optical transfer functions:
      Traditional gamma - SDR luminance range
      SMPTE ST2084
    Supported static metadata descriptors:
      Static metadata type 1
  Detailed Timing Descriptors:
    DTD  7:  1920x1080  143.981451 Hz  16:9    166.587 kHz    346.500000 MHz (597 mm x 336 mm)
                  Hfront   48 Hsync  32 Hback   80 Hpol P
                  Vfront    3 Vsync   5 Vback   69 Vpol N
    DTD  8:  1920x1080  239.760349 Hz  16:9    291.309 kHz    594.270000 MHz (597 mm x 336 mm)
                  Hfront   28 Hsync  32 Hback   60 Hpol P
                  Vfront   57 Vsync   8 Vback   70 Vpol N
    DTD  9:  2560x1440  119.997589 Hz  16:9    182.996 kHz    497.750000 MHz (597 mm x 336 mm)
                  Hfront   48 Hsync  32 Hback   80 Hpol P
                  Vfront    3 Vsync   5 Vback   77 Vpol N
    DTD 10:  2560x1440  144.000477 Hz  16:9    213.265 kHz    580.080000 MHz (597 mm x 336 mm)
                  Hfront    8 Hsync  64 Hback   88 Hpol P
                  Vfront    3 Vsync   5 Vback   33 Vpol N
    DTD 11:  1920x1080   60.000000 Hz  16:9     67.500 kHz    148.500000 MHz (598 mm x 336 mm)
                  Hfront   88 Hsync  44 Hback  148 Hpol P
                  Vfront    4 Vsync   5 Vback   36 Vpol P
Checksum: 0x88  Unused space in Extension Block: 9 bytes

----------------

Block 5, DisplayID Extension Block:
  Version: 1.2
  Extension Count: 0
  Video Timing Modes Type 1 - Detailed Timings Data Block:
    DTD:  2560x1440  239.957560 Hz   0:0    357.537 kHz    972.500000 MHz (aspect undefined, no 3D stereo, preferred)
               Hfront   48 Hsync  32 Hback   80 Hpol P
               Vfront    3 Vsync   5 Vback   42 Vpol N
  Checksum: 0x8a
Checksum: 0x90  Unused space in Extension Block: 98 bytes

----------------

Warnings:

Block 0, Base EDID:
  Display Range Limits: GTF support is deprecated in EDID 1.4.
Block 1, CTA-861 Extension Block:
  Colorimetry Data Block: Set the sRGB colorimetry bit to avoid interop issues.
  Display Product Serial Number is set, so the Serial Number in the Base EDID should be 0.
Block 4, CTA-861 Extension Block:
  Colorimetry Data Block: Set the sRGB colorimetry bit to avoid interop issues.
  Display Product Serial Number is set, so the Serial Number in the Base EDID should be 0.

Failures:

Block 0, Base EDID:
  Display Range Limits: GTF can't be combined with non-continuous frequencies.
Block 1, CTA-861 Extension Block:
  Missing VCDB, needed for Set Selectable RGB Quantization to avoid interop issues.
Block 2, DisplayID Extension Block:
  DisplayID Base Block has no product type.
  Expected 0 DisplayID Extension Block, but got 1.
Block 3, Base EDID:
  Unknown Extension Block.
Block 4, CTA-861 Extension Block:
  Video Data Block: Duplicate VIC 16.
  Video Data Block: Duplicate VIC 63.
  Video Data Block: Duplicate VIC 31.
  Video Data Block: Duplicate VIC 4.
  Video Data Block: Duplicate VIC 19.
  Video Data Block: Duplicate VIC 18.
  Video Data Block: Duplicate VIC 3.
  Speaker Allocation Data Block: Only one instance of this Data Block is allowed.
  Colorimetry Data Block: Only one instance of this Data Block is allowed.
  HDR Static Metadata Data Block: Only one instance of this Data Block is allowed.
  Missing VCDB, needed for Set Selectable RGB Quantization to avoid interop issues.
EDID:
  Base EDID: EDID specified 2 extension block(s), but found 5 extension block(s).
  CTA-861: Native progressive timings are a mix of several resolutions.
  DisplayID: Missing DisplayID Product Identification Data Block.

EDID conformity: FAIL
