edid-decode (hex):

00 ff ff ff ff ff ff 00 10 ac 30 a0 53 50 4b 4a
23 12 01 03 80 3a 24 78 ea e9 f5 ac 51 30 b4 25
11 50 54 a5 4b 00 81 80 a9 40 71 4f b3 00 01 01
01 01 01 01 01 01 28 3c 80 a0 70 b0 23 40 30 20
36 00 46 6c 21 00 00 1a 00 00 00 ff 00 54 52 30
37 30 38 38 51 4a 4b 50 53 0a 00 00 00 fc 00 44
45 4c 4c 20 32 37 30 39 57 0a 20 20 00 00 00 fd
00 38 4c 1e 53 11 00 0a 20 20 20 20 20 20 00 a5

----------------

Block 0, Base EDID:
  EDID Structure Version & Revision: 1.3
  Vendor & Product Identification:
    Manufacturer: DEL
    Model: 41008
    Serial Number: ...
    Made in: week 35 of 2008
  Basic Display Parameters & Features:
    Digital display
    Maximum image size: 58 cm x 36 cm
    Gamma: 2.20
    DPMS levels: Standby Suspend Off
    RGB color display
    First detailed timing is the preferred timing
  Color Characteristics:
    Red  : 0.6748, 0.3183
    Green: 0.1894, 0.7041
    Blue : 0.1474, 0.0693
    White: 0.3134, 0.3291
  Established Timings I & II:
    IBM     :   720x400    70.082 Hz   9:5    31.467 kHz  28.320 MHz
    DMT 0x04:   640x480    59.940 Hz   4:3    31.469 kHz  25.175 MHz
    DMT 0x06:   640x480    75.000 Hz   4:3    37.500 kHz  31.500 MHz
    DMT 0x09:   800x600    60.317 Hz   4:3    37.879 kHz  40.000 MHz
    DMT 0x0b:   800x600    75.000 Hz   4:3    46.875 kHz  49.500 MHz
    DMT 0x10:  1024x768    60.004 Hz   4:3    48.363 kHz  65.000 MHz
    DMT 0x12:  1024x768    75.029 Hz   4:3    60.023 kHz  78.750 MHz
    DMT 0x24:  1280x1024   75.025 Hz   5:4    79.976 kHz 135.000 MHz
  Standard Timings:
    DMT 0x23:  1280x1024   60.020 Hz   5:4    63.981 kHz 108.000 MHz
    DMT 0x33:  1600x1200   60.000 Hz   4:3    75.000 kHz 162.000 MHz
    DMT 0x15:  1152x864    75.000 Hz   4:3    67.500 kHz 108.000 MHz
    DMT 0x3a:  1680x1050   59.954 Hz  16:10   65.290 kHz 146.250 MHz
  Detailed Timing Descriptors:
    DTD 1:  1920x1200   59.950 Hz   8:5    74.038 kHz 154.000 MHz (582 mm x 364 mm)
                 Hfront   48 Hsync  32 Hback  80 Hpol P
                 Vfront    3 Vsync   6 Vback  26 Vpol N
    Display Product Serial Number: ...
    Display Product Name: 'DELL 2709W'
  Display Range Limits:
    Monitor ranges (GTF): 56-76 Hz V, 30-83 kHz H, max dotclock 170 MHz
Checksum: 0xa5

----------------

EDID conformity: PASS
