edid-decode (hex):

00 ff ff ff ff ff ff 00 32 0c 01 02 00 00 00 00
00 11 01 03 80 21 15 78 0a b3 40 99 59 53 8d 27
25 50 54 00 00 00 01 01 01 01 01 01 01 01 01 01
01 01 01 01 01 01 7e 1d 00 e8 50 20 20 30 40 30
36 00 4b cf 10 00 00 19 7e 1d 00 e8 50 20 20 30
40 30 36 00 4b cf 10 00 00 00 00 00 00 fe 00 43
33 36 32 43 80 31 35 34 57 30 31 0a 00 00 00 fe
00 26 34 3e 44 64 89 a4 ff 01 01 0a 20 20 00 c3

----------------

Block 0, Base EDID:
  EDID Structure Version & Revision: 1.3
  Vendor & Product Identification:
    Manufacturer: LPL
    Model: 513
    Made in: 2007
  Basic Display Parameters & Features:
    Digital display
    Maximum image size: 33 cm x 21 cm
    Gamma: 2.20
    RGB color display
    First detailed timing is preferred timing
  Color Characteristics:
    Red  : 0.5996, 0.3505
    Green: 0.3242, 0.5537
    Blue : 0.1533, 0.1445
    White: 0.3125, 0.3281
  Established Timings I & II: none
  Standard Timings: none
  Detailed Timing Descriptors:
    DTD 1:  1280x800    60.017 Hz   8:5    49.934 kHz  75.500 MHz (DE timing only, 331 mm x 207 mm)
                 Hfront   64 Hsync  48 Hback 120 Hpol N
                 Vfront    3 Vsync   6 Vback  23 Vpol N
    DTD 2:  1280x800    60.017 Hz   8:5    49.934 kHz  75.500 MHz (DE timing only, 331 mm x 207 mm)
                 Hfront   64 Hsync  48 Hback 120 Hpol N
                 Vfront    3 Vsync   6 Vback  23 Vpol N
    SPWG Module Revision: 0
    SPWG Descriptor #3:
      SPWG PC Maker P/N: 'C362C'
      SPWG LCD Supplier EEDID Revision: 128
      SPWG Manufacturer P/N: '154W01'
    SPWG Descriptor #4:
      SMBUS Values: 0x26 0x34 0x3e 0x44 0x64 0x89 0xa4 0xff
      LVDS Channels: 1
      Panel Self Test Present
Checksum: 0xc3

----------------

Failures:

Block 0, Base EDID:
  Missing Display Product Name.
  Missing Display Range Limits Descriptor.

EDID conformity: FAIL
