
EDID (hex):
00ffffffffffff001e6d667732480a00
02200104b54627789fcdb5a55650a127
135054210800d1c06140010101010101
0101010101016fc200a0a0a055503020
3500b9882100001a000000fd0c30a505
0550010a202020202020000000fc004c
4720554c545241474541520a000000ff
003230324e5458524b543834320a02c5
020331712309070748100403011f1312
3f83010000e305c000e2006ae6060500
5a5a506d1a0000020530a500045a505a
50565e00a0a0a0295030203500b98821
00001a09ec00a0a0a0675030203500b9
882100001a0000000000000000000000
00000000000000000000000000000000
00000000000000000000000000000079
701279000003011459090104ff099f00
2f801f009f0549000200040000000000
00000000000000000000000000000000
00000000000000000000000000000000
00000000000000000000000000000000
00000000000000000000000000000000
00000000000000000000000000000000
00000000000000000000000000008e90

edid-decode (hex):

00 ff ff ff ff ff ff 00 1e 6d 66 77 32 48 0a 00
02 20 01 04 b5 46 27 78 9f cd b5 a5 56 50 a1 27
13 50 54 21 08 00 d1 c0 61 40 01 01 01 01 01 01
01 01 01 01 01 01 6f c2 00 a0 a0 a0 55 50 30 20
35 00 b9 88 21 00 00 1a 00 00 00 fd 0c 30 a5 05
05 50 01 0a 20 20 20 20 20 20 00 00 00 fc 00 4c
47 20 55 4c 54 52 41 47 45 41 52 0a 00 00 00 ff
00 32 30 32 4e 54 58 52 4b 54 38 34 32 0a 02 c5

02 03 31 71 23 09 07 07 48 10 04 03 01 1f 13 12
3f 83 01 00 00 e3 05 c0 00 e2 00 6a e6 06 05 00
5a 5a 50 6d 1a 00 00 02 05 30 a5 00 04 5a 50 5a
50 56 5e 00 a0 a0 a0 29 50 30 20 35 00 b9 88 21
00 00 1a 09 ec 00 a0 a0 a0 67 50 30 20 35 00 b9
88 21 00 00 1a 00 00 00 00 00 00 00 00 00 00 00
00 00 00 00 00 00 00 00 00 00 00 00 00 00 00 00
00 00 00 00 00 00 00 00 00 00 00 00 00 00 00 79

70 12 79 00 00 03 01 14 59 09 01 04 ff 09 9f 00
2f 80 1f 00 9f 05 49 00 02 00 04 00 00 00 00 00
00 00 00 00 00 00 00 00 00 00 00 00 00 00 00 00
00 00 00 00 00 00 00 00 00 00 00 00 00 00 00 00
00 00 00 00 00 00 00 00 00 00 00 00 00 00 00 00
00 00 00 00 00 00 00 00 00 00 00 00 00 00 00 00
00 00 00 00 00 00 00 00 00 00 00 00 00 00 00 00
00 00 00 00 00 00 00 00 00 00 00 00 00 00 8e 90

----------------

Block 0, Base EDID:
  EDID Structure Version & Revision: 1.4
  Vendor & Product Identification:
    Manufacturer: GSM
    Model: 30566
    Serial Number: 673842
    Made in: week 2 of 2022
  Basic Display Parameters & Features:
    Digital display
    Bits per primary color channel: 10
    DisplayPort interface
    Maximum image size: 70 cm x 39 cm
    Gamma: 2.20
    DPMS levels: Standby
    Supported color formats: RGB 4:4:4, YCrCb 4:4:4, YCrCb 4:2:2
    Default (sRGB) color space is primary color space
    First detailed timing includes the native pixel format and preferred refresh rate
    Display is continuous frequency
  Color Characteristics:
    Red  : 0.6474, 0.3359
    Green: 0.3154, 0.6298
    Blue : 0.1542, 0.0771
    White: 0.3134, 0.3291
  Established Timings I & II:
    DMT 0x04:   640x480    59.940476 Hz   4:3     31.469 kHz     25.175000 MHz
    DMT 0x09:   800x600    60.316541 Hz   4:3     37.879 kHz     40.000000 MHz
    DMT 0x10:  1024x768    60.003840 Hz   4:3     48.363 kHz     65.000000 MHz
  Standard Timings:
    DMT 0x52:  1920x1080   60.000000 Hz  16:9     67.500 kHz    148.500000 MHz
    DMT 0x10:  1024x768    60.003840 Hz   4:3     48.363 kHz     65.000000 MHz
  Detailed Timing Descriptors:
    DTD 1:  2560x1440  119.997589 Hz  16:9    182.996 kHz    497.750000 MHz (697 mm x 392 mm)
                 Hfront   48 Hsync  32 Hback   80 Hpol P
                 Vfront    3 Vsync   5 Vback   77 Vpol N
    Display Range Limits:
      Monitor ranges (Bare Limits): 48-165 Hz V, 260-260 kHz H, max dotclock 800 MHz
    Display Product Name: 'LG ULTRAGEAR'
    Display Product Serial Number: '202NTXRKT842'
  Extension blocks: 2
Checksum: 0xc5

----------------

Block 1, CTA-861 Extension Block:
  Revision: 3
  Basic audio support
  Supports YCbCr 4:4:4
  Supports YCbCr 4:2:2
  Native detailed modes: 1
  Audio Data Block:
    Linear PCM:
      Max channels: 2
      Supported sample rates (kHz): 48 44.1 32
      Supported sample sizes (bits): 24 20 16
  Video Data Block:
    VIC  16:  1920x1080   60.000000 Hz  16:9     67.500 kHz    148.500000 MHz
    VIC   4:  1280x720    60.000000 Hz  16:9     45.000 kHz     74.250000 MHz
    VIC   3:   720x480    59.940060 Hz  16:9     31.469 kHz     27.000000 MHz
    VIC   1:   640x480    59.940476 Hz   4:3     31.469 kHz     25.175000 MHz
    VIC  31:  1920x1080   50.000000 Hz  16:9     56.250 kHz    148.500000 MHz
    VIC  19:  1280x720    50.000000 Hz  16:9     37.500 kHz     74.250000 MHz
    VIC  18:   720x576    50.000000 Hz  16:9     31.250 kHz     27.000000 MHz
    VIC  63:  1920x1080  120.000000 Hz  16:9    135.000 kHz    297.000000 MHz
  Speaker Allocation Data Block:
    FL/FR - Front Left/Right
  Colorimetry Data Block:
    BT2020YCC
    BT2020RGB
  Video Capability Data Block:
    YCbCr quantization: No Data
    RGB quantization: Selectable (via AVI Q)
    PT scan behavior: Always Underscanned
    IT scan behavior: Always Underscanned
    CE scan behavior: Always Underscanned
  HDR Static Metadata Data Block:
    Electro optical transfer functions:
      Traditional gamma - SDR luminance range
      SMPTE ST2084
    Supported static metadata descriptors:
    Desired content max luminance: 90 (351.250 cd/m^2)
    Desired content max frame-average luminance: 90 (351.250 cd/m^2)
    Desired content min luminance: 80 (0.346 cd/m^2)
  Vendor-Specific Data Block (AMD), OUI 00-00-1A:
    Version: 2.5
    Minimum Refresh Rate: 48 Hz
    Maximum Refresh Rate: 165 Hz
    Flags 1.x: 0x00
    Flags 2.x: 0x04
    Maximum luminance: 90 (351.250 cd/m^2)
    Minimum luminance: 80 (0.346 cd/m^2)
    Maximum luminance (without local dimming): 90 (351.250 cd/m^2)
    Minimum luminance (without local dimming): 80 (0.346 cd/m^2)
  Detailed Timing Descriptors:
    DTD 2:  2560x1440   59.950550 Hz  16:9     88.787 kHz    241.500000 MHz (697 mm x 392 mm)
                 Hfront   48 Hsync  32 Hback   80 Hpol P
                 Vfront    3 Vsync   5 Vback   33 Vpol N
    DTD 3:  2560x1440  143.973257 Hz  16:9    222.151 kHz    604.250000 MHz (697 mm x 392 mm)
                 Hfront   48 Hsync  32 Hback   80 Hpol P
                 Vfront    3 Vsync   5 Vback   95 Vpol N
Checksum: 0x79  Unused space in Extension Block: 42 bytes

----------------

Block 2, DisplayID Extension Block:
  Version: 1.2
  Extension Count: 0
  Display Product Type: Extension Section
  Video Timing Modes Type 1 - Detailed Timings Data Block:
    DTD:  2560x1440  164.955513 Hz  16:9    249.743 kHz    679.300000 MHz (aspect 16:9, no 3D stereo)
               Hfront   48 Hsync  32 Hback   80 Hpol P
               Vfront    3 Vsync   5 Vback   66 Vpol N
  Checksum: 0x8e
Checksum: 0x90


