
EDID (hex):
00ffffffffffff0050c3380200000000
2d1e010308351e78ea2d36a75438ae26
0d4f54230800d1c0b3009500818081c0
810001010101023a801871382d40582c
4500132c2100001e000000fc00544632
3431350a202020202020000000fd0032
3f1e5012000a202020202020000000ff
003233454147485031303530323400be

edid-decode (hex):

00 ff ff ff ff ff ff 00 50 c3 38 02 00 00 00 00
2d 1e 01 03 08 35 1e 78 ea 2d 36 a7 54 38 ae 26
0d 4f 54 23 08 00 d1 c0 b3 00 95 00 81 80 81 c0
81 00 01 01 01 01 02 3a 80 18 71 38 2d 40 58 2c
45 00 13 2c 21 00 00 1e 00 00 00 fc 00 54 46 32
34 31 35 0a 20 20 20 20 20 20 00 00 00 fd 00 32
3f 1e 50 12 00 0a 20 20 20 20 20 20 00 00 00 ff
00 32 33 45 41 47 48 50 31 30 35 30 32 34 00 be

----------------

Block 0, Base EDID:
  EDID Structure Version & Revision: 1.3
  Vendor & Product Identification:
    Manufacturer: TFC
    Model: 568
    Made in: week 45 of 2020
  Basic Display Parameters & Features:
    Analog display
    Signal Level Standard: 0.700 : 0.300 : 1.000 V p-p
    Blank level equals black level
    Sync: Separate
    Maximum image size: 53 cm x 30 cm
    Gamma: 2.20
    DPMS levels: Standby Suspend Off
    RGB color display
    First detailed timing is the preferred timing
  Color Characteristics:
    Red  : 0.6523, 0.3300
    Green: 0.2216, 0.6806
    Blue : 0.1484, 0.0537
    White: 0.3095, 0.3300
  Established Timings I & II:
    DMT 0x04:   640x480    59.940476 Hz   4:3     31.469 kHz     25.175000 MHz
    DMT 0x08:   800x600    56.250000 Hz   4:3     35.156 kHz     36.000000 MHz
    DMT 0x09:   800x600    60.316541 Hz   4:3     37.879 kHz     40.000000 MHz
    DMT 0x10:  1024x768    60.003840 Hz   4:3     48.363 kHz     65.000000 MHz
  Standard Timings:
    DMT 0x52:  1920x1080   60.000000 Hz  16:9     67.500 kHz    148.500000 MHz
    DMT 0x3a:  1680x1050   59.954250 Hz  16:10    65.290 kHz    146.250000 MHz
    DMT 0x2f:  1440x900    59.887445 Hz  16:10    55.935 kHz    106.500000 MHz
    DMT 0x23:  1280x1024   60.019740 Hz   5:4     63.981 kHz    108.000000 MHz
    DMT 0x55:  1280x720    60.000000 Hz  16:9     45.000 kHz     74.250000 MHz
    DMT 0x1c:  1280x800    59.810326 Hz  16:10    49.702 kHz     83.500000 MHz
  Detailed Timing Descriptors:
    DTD 1:  1920x1080   60.000000 Hz  16:9     67.500 kHz    148.500000 MHz (531 mm x 300 mm)
                 Hfront   88 Hsync  44 Hback  148 Hpol P
                 Vfront    4 Vsync   5 Vback   36 Vpol P
    Display Product Name: 'TF2415'
    Display Range Limits:
      Monitor ranges (GTF): 50-63 Hz V, 30-80 kHz H, max dotclock 180 MHz
    Display Product Serial Number: '23EAGHP105024'
Checksum: 0xbe
