edid-decode (hex):

00 ff ff ff ff ff ff 00 30 ae ba 40 00 00 00 00
2a 1d 01 04 a5 22 13 78 e3 00 f5 97 5e 5b 93 29
1f 50 54 00 00 00 01 01 01 01 01 01 01 01 01 01
01 01 01 01 01 01 99 3b 80 10 71 38 50 40 30 20
36 00 58 c2 10 00 00 1a 00 00 00 fd 00 28 3c 46
46 0f 01 0a 20 20 20 20 20 20 00 00 00 0f 00 d1
09 3c d1 09 28 1e 0a 00 09 e5 d5 08 00 00 00 fe
00 4e 56 31 35 36 46 48 4d 2d 4e 34 53 0a 00 6c

00 ff ff ff ff ff ff 00 30 ae ba 40 00 00 00 00
2a 1d 01 04 a5 22 13 78 e3 00 f5 97 5e 5b 93 29
1f 50 54 00 00 00 01 01 01 01 01 01 01 01 01 01
01 01 01 01 01 01 99 3b 80 10 71 38 50 40 30 20
36 00 58 c2 10 00 00 1a 00 00 00 fd 00 28 3c 46
46 0f 01 0a 20 20 20 20 20 20 00 00 00 0f 00 d1
09 3c d1 09 28 1e 0a 00 09 e5 d5 08 00 00 00 fe
00 4e 56 31 35 36 46 48 4d 2d 4e 34 53 0a 00 6c

----------------

Block 0, Base EDID:
  EDID Structure Version & Revision: 1.4
  Vendor & Product Identification:
    Manufacturer: LEN
    Model: 16570
    Made in: week 42 of 2019
  Basic Display Parameters & Features:
    Digital display
    Bits per primary color channel: 8
    DisplayPort interface
    Maximum image size: 34 cm x 19 cm
    Gamma: 2.20
    DPMS levels: Standby Suspend Off
    Supported color formats: RGB 4:4:4
    First detailed timing includes the native pixel format and preferred refresh rate
    Display is continuous frequency
  Color Characteristics:
    Red  : 0.5898, 0.3671
    Green: 0.3554, 0.5742
    Blue : 0.1630, 0.1240
    White: 0.3134, 0.3291
  Established Timings I & II: none
  Standard Timings: none
  Detailed Timing Descriptors:
    DTD 1:  1920x1080   60.002674 Hz  16:9     69.603 kHz    152.570000 MHz (344 mm x 194 mm)
                 Hfront   48 Hsync  32 Hback  192 Hpol P
                 Vfront    3 Vsync   6 Vback   71 Vpol N
    Display Range Limits:
      Monitor ranges (Bare Limits): 40-60 Hz V, 70-70 kHz H, max dotclock 150 MHz
    Manufacturer-Specified Display Descriptor (0x0f): 00 0f 00 d1 09 3c d1 09 28 1e 0a 00 09 e5 d5 08 '.....<..(.......'
    Alphanumeric Data String: 'NV156FHM-N4S'
Checksum: 0x6c

----------------

Block 1, Unknown EDID Extension Block 0x00:
  00 ff ff ff ff ff ff 00 30 ae ba 40 00 00 00 00 '........0..@....'
  2a 1d 01 04 a5 22 13 78 e3 00 f5 97 5e 5b 93 29 '*....".x....^[.)'
  1f 50 54 00 00 00 01 01 01 01 01 01 01 01 01 01 '.PT.............'
  01 01 01 01 01 01 99 3b 80 10 71 38 50 40 30 20 '.......;..q8P@0 '
  36 00 58 c2 10 00 00 1a 00 00 00 fd 00 28 3c 46 '6.X..........(<F'
  46 0f 01 0a 20 20 20 20 20 20 00 00 00 0f 00 d1 'F...      ......'
  09 3c d1 09 28 1e 0a 00 09 e5 d5 08 00 00 00 fe '.<..(...........'
  00 4e 56 31 35 36 46 48 4d 2d 4e 34 53 0a 00 6c '.NV156FHM-N4S..l'
Checksum: 0x6c

----------------

Warnings:

Block 0, Base EDID:
  Missing Display Product Name.
EDID:
  Base EDID: Some timings are out of range of the Monitor Ranges:
    Maximum Clock: 152.570 MHz (Monitor: 150.000 MHz)
    Could be due to a Monitor Range off-by-one rounding issue

Failures:

Block 1, Base EDID:
  Unknown Extension Block.
EDID:
  Base EDID: EDID specified 0 extension block(s), but found 1 extension block(s).

EDID conformity: FAIL
