edid-decode (hex):

00 ff ff ff ff ff ff 00 4c a3 51 30 00 00 00 00
00 12 01 03 80 27 17 78 0a 85 95 99 57 4f 8f 26
21 50 54 00 00 00 01 01 01 01 01 01 01 01 01 01
01 01 01 01 01 01 20 2a 40 24 61 84 32 30 30 20
26 00 8e e8 10 00 00 19 00 00 00 0f 00 00 00 00
00 00 00 00 00 1e b4 02 74 00 00 00 00 fe 00 53
41 4d 53 55 4e 47 0a 20 20 20 20 20 00 00 00 fe
00 31 37 33 4b 54 30 31 2d 41 30 31 0a 20 00 a4

----------------

Block 0, Base EDID:
  EDID Structure Version & Revision: 1.3
  Vendor & Product Identification:
    Manufacturer: SEC
    Model: 12369
    Made in: 2008
  Basic Display Parameters & Features:
    Digital display
    Maximum image size: 39 cm x 23 cm
    Gamma: 2.20
    RGB color display
    First detailed timing is preferred timing
  Color Characteristics:
    Red  : 0.5996, 0.3398
    Green: 0.3095, 0.5595
    Blue : 0.1503, 0.1298
    White: 0.3134, 0.3291
  Established Timings I & II: none
  Standard Timings: none
  Detailed Timing Descriptors:
    DTD 1:  1600x900    59.998 Hz  16:9    56.998 kHz 107.840 MHz (398 mm x 232 mm)
                 Hfront   48 Hsync  32 Hback 212 Hpol N
                 Vfront    2 Vsync   6 Vback  42 Vpol N
    Manufacturer-Specified Display Descriptor (0x0f): 00 0f 00 00 00 00 00 00 00 00 00 1e b4 02 74 00 '..............t.'
    Alphanumeric Data String: 'SAMSUNG'
    Alphanumeric Data String: '173KT01-A01'
Checksum: 0xa4

----------------

Failures:

Block 0, Base EDID:
  Missing Display Product Name.
  Missing Display Range Limits Descriptor.

EDID conformity: FAIL
