
EDID (hex):
00ffffffffffff003064010001000000
21150103080000008e00000000000000
000000a10800818081c0010101010101
010101010101023a801871382d40582c
46009a001100001e58389030621a2740
509836009a001100001e9a29a0d05184
22305098360098ff1000001e000000fc
004372797374616c20566965770a0032

Extracted contents:
header:          00 ff ff ff ff ff ff 00
serial number:   30 64 01 00 01 00 00 00 21 15
version:         01 03
basic params:    08 00 00 00 8e
chroma info:     00 00 00 00 00 00 00 00 00 00
established:     a1 08 00
standard:        81 80 81 c0 01 01 01 01 01 01 01 01 01 01 01 01
descriptor 1:    02 3a 80 18 71 38 2d 40 58 2c 46 00 9a 00 11 00 00 1e
descriptor 2:    58 38 90 30 62 1a 27 40 50 98 36 00 9a 00 11 00 00 1e
descriptor 3:    9a 29 a0 d0 51 84 22 30 50 98 36 00 98 ff 10 00 00 1e
descriptor 4:    00 00 00 fc 00 43 72 79 73 74 61 6c 20 56 69 65 77 0a
extensions:      00
checksum:        32

EDID version: 1.3
Manufacturer: LCD Model 1 Serial Number --
Made in week 33 of 2011
Analog display, Input voltage level: 0.7/0.3 V
Sync: Separate 
Image size is variable
Gamma: 1.00
DPMS levels: Standby
RGB color display
Default (sRGB) color space is primary color space
First detailed timing is preferred timing
Display x,y Chromaticity:
  Red:   0.0000, 0.0000
  Green: 0.0000, 0.0000
  Blue:  0.0000, 0.0000
  White: 0.0000, 0.0000
Established timings supported:
  720x400@70Hz 9:5 HorFreq: 31469 Hz Clock: 28.320 MHz
  640x480@60Hz 4:3 HorFreq: 31469 Hz Clock: 25.175 MHz
  800x600@60Hz 4:3 HorFreq: 37900 Hz Clock: 40.000 MHz
  1024x768@60Hz 4:3 HorFreq: 48400 Hz Clock: 65.000 MHz
Standard timings supported:
  1280x1024@60Hz 5:4 HorFreq: 64000 Hz Clock: 108.000 MHz
  1280x720@60Hz 16:9
Detailed mode: Clock 148.500 MHz, 410 mm x 256 mm
               1920 2008 2052 2200 hborder 0
               1080 1084 1090 1125 vborder 0
               +hsync +vsync 
               VertFreq: 60 Hz, HorFreq: 67500 Hz
Detailed mode: Clock 144.240 MHz, 410 mm x 256 mm
               1680 1760 1912 2240 hborder 0
               1050 1053 1059 1089 vborder 0
               +hsync +vsync 
               VertFreq: 59 Hz, HorFreq: 64392 Hz
Detailed mode: Clock 106.500 MHz, 408 mm x 255 mm
               1440 1520 1672 1904 hborder 0
                900  903  909  934 vborder 0
               +hsync +vsync 
               VertFreq: 59 Hz, HorFreq: 55934 Hz
Monitor name: Crystal View
Checksum: 0x32 (valid)
EDID block does NOT conform to EDID 1.3!
	sRGB is signaled, but the chromaticities do not match
	Missing monitor ranges
