edid-decode (hex):

00 ff ff ff ff ff ff 00 41 0c 05 08 bd 73 02 00
0e 0c 01 03 0e 1e 17 96 e8 4e e0 a1 57 4c 99 23
19 52 57 bf ee 00 31 40 31 4f 45 4f 61 40 61 4f
01 01 01 01 01 01 4e 0c 80 c0 20 e0 28 10 10 28
13 00 33 e6 10 10 10 1a 00 00 00 ff 00 20 42 5a
20 20 31 36 30 37 30 31 0a 20 00 00 00 fc 00 50
48 49 4c 49 50 53 20 20 31 35 30 53 00 00 00 fd
00 38 4b 1e 3d 08 00 0a 20 20 20 20 20 20 00 63

----------------

Block 0, Base EDID:
  EDID Structure Version & Revision: 1.3
  Vendor & Product Identification:
    Manufacturer: PHL
    Model: 2053
    Serial Number: ...
    Made in: week 14 of 2002
  Basic Display Parameters & Features:
    Analog display
    Signal Level Standard: 0.700 : 0.300 : 1.000 V p-p
    Blank level equals black level
    Sync: Separate Composite SyncOnGreen
    Maximum image size: 30 cm x 23 cm
    Gamma: 2.50
    DPMS levels: Standby Suspend Off
    RGB color display
  Color Characteristics:
    Red  : 0.6298, 0.3398
    Green: 0.2998, 0.5996
    Blue : 0.1396, 0.0996
    White: 0.3203, 0.3398
  Established Timings I & II:
    IBM     :   720x400    70.081663 Hz   9:5     31.467 kHz     28.320000 MHz
    DMT 0x04:   640x480    59.940476 Hz   4:3     31.469 kHz     25.175000 MHz
    Apple   :   640x480    66.666667 Hz   4:3     35.000 kHz     30.240000 MHz
    DMT 0x05:   640x480    72.808802 Hz   4:3     37.861 kHz     31.500000 MHz
    DMT 0x06:   640x480    75.000000 Hz   4:3     37.500 kHz     31.500000 MHz
    DMT 0x08:   800x600    56.250000 Hz   4:3     35.156 kHz     36.000000 MHz
    DMT 0x09:   800x600    60.316541 Hz   4:3     37.879 kHz     40.000000 MHz
    DMT 0x0a:   800x600    72.187572 Hz   4:3     48.077 kHz     50.000000 MHz
    DMT 0x0b:   800x600    75.000000 Hz   4:3     46.875 kHz     49.500000 MHz
    Apple   :   832x624    74.551266 Hz   4:3     49.726 kHz     57.284000 MHz
    DMT 0x10:  1024x768    60.003840 Hz   4:3     48.363 kHz     65.000000 MHz
    DMT 0x11:  1024x768    70.069359 Hz   4:3     56.476 kHz     75.000000 MHz
    DMT 0x12:  1024x768    75.028582 Hz   4:3     60.023 kHz     78.750000 MHz
  Standard Timings:
    DMT 0x04:   640x480    59.940476 Hz   4:3     31.469 kHz     25.175000 MHz
    DMT 0x06:   640x480    75.000000 Hz   4:3     37.500 kHz     31.500000 MHz
    DMT 0x0b:   800x600    75.000000 Hz   4:3     46.875 kHz     49.500000 MHz
    DMT 0x10:  1024x768    60.003840 Hz   4:3     48.363 kHz     65.000000 MHz
    DMT 0x12:  1024x768    75.028582 Hz   4:3     60.023 kHz     78.750000 MHz
  Detailed Timing Descriptors:
    DTD 1:   640x480    72.808802 Hz   4:3     37.861 kHz     31.500000 MHz (307 mm x 230 mm)
                 Hfront   16 Hsync  40 Hback  104 Hpol P Hborder 16
                 Vfront    1 Vsync   3 Vback    4 Vpol N Vborder 16
    Display Product Serial Number: ...
    Display Product Name: 'PHILIPS  150S'
    Display Range Limits:
      Monitor ranges (GTF): 56-75 Hz V, 30-61 kHz H, max dotclock 80 MHz
Checksum: 0x63

----------------

Warnings:

Block 0, Base EDID:
  Detailed Timing Descriptor #1: The use of non-zero borders in a DTD is not recommended.

Failures:

Block 0, Base EDID:
  Basic Display Parameters & Features: EDID 1.3 requires that the first detailed timing is the preferred timing.

EDID conformity: FAIL
