
EDID (hex):
00ffffffffffff0015c3682501010101
1a1c010380351e78ea7e75a755529c27
0f5054a108008180b300a9c081c08100
010101010101023a801871382d40582c
450010292100001e000000ff00323339
36333036380a20202020000000fd003b
3d1f440f000a202020202020000000fc
004556323435300a20202020202000b3

Extracted contents:
header:          00 ff ff ff ff ff ff 00
serial number:   15 c3 68 25 01 01 01 01 1a 1c
version:         01 03
basic params:    80 35 1e 78 ea
chroma info:     7e 75 a7 55 52 9c 27 0f 50 54
established:     a1 08 00
standard:        81 80 b3 00 a9 c0 81 c0 81 00 01 01 01 01 01 01
descriptor 1:    02 3a 80 18 71 38 2d 40 58 2c 45 00 10 29 21 00 00 1e
descriptor 2:    00 00 00 ff 00 32 33 39 36 33 30 36 38 0a 20 20 20 20
descriptor 3:    00 00 00 fd 00 3b 3d 1f 44 0f 00 0a 20 20 20 20 20 20
descriptor 4:    00 00 00 fc 00 45 56 32 34 35 30 0a 20 20 20 20 20 20
extensions:      00
checksum:        b3

EDID version: 1.3
Manufacturer: ENC Model 2568 Serial Number --
Made in week 26 of 2018
Digital display
Maximum image size: 53 cm x 30 cm
Gamma: 2.20
DPMS levels: Standby Suspend Off
RGB color display
First detailed timing is preferred timing
Display x,y Chromaticity:
  Red:   0.6533, 0.3349
  Green: 0.3232, 0.6113
  Blue:  0.1533, 0.0615
  White: 0.3134, 0.3291
Established timings supported:
  720x400@70Hz 9:5 HorFreq: 31469 Hz Clock: 28.320 MHz
  640x480@60Hz 4:3 HorFreq: 31469 Hz Clock: 25.175 MHz
  800x600@60Hz 4:3 HorFreq: 37900 Hz Clock: 40.000 MHz
  1024x768@60Hz 4:3 HorFreq: 48400 Hz Clock: 65.000 MHz
Standard timings supported:
  1280x1024@60Hz 5:4 HorFreq: 64000 Hz Clock: 108.000 MHz
  1680x1050@60Hz 16:10 HorFreq: 64700 Hz Clock: 119.000 MHz
  1600x900@60Hz 16:9
  1280x720@60Hz 16:9
  1280x800@60Hz 16:10
Detailed mode: Clock 148.500 MHz, 528 mm x 297 mm
               1920 2008 2052 2200 hborder 0
               1080 1084 1089 1125 vborder 0
               +hsync +vsync 
               VertFreq: 60 Hz, HorFreq: 67500 Hz
Serial number: --
Monitor ranges (GTF): 59-61Hz V, 31-68kHz H, max dotclock 150MHz
Monitor name: EV2450
Checksum: 0xb3 (valid)
One or more of the timings is out of range of the Monitor Ranges:
  Vertical Freq: 60 - 70 Hz
  Horizontal Freq: 31469 - 67500 Hz
  Maximum Clock: 148.500 MHz
