edid-decode (hex):

00 ff ff ff ff ff ff 00 0d ae 2d 15 00 00 00 00
19 1e 01 04 a5 22 13 78 02 ee 95 a3 54 4c 99 26
0f 50 54 00 00 00 01 01 01 01 01 01 01 01 01 01
01 01 01 01 01 01 36 36 80 a0 70 38 20 40 30 20
a6 00 58 c1 10 00 00 18 00 00 00 fe 00 4e 31 35
36 48 43 45 2d 45 4e 31 0a 20 00 00 00 fe 00 43
4d 4e 0a 20 20 20 20 20 20 20 20 20 00 00 00 fe
00 4e 31 35 36 48 43 45 2d 45 4e 31 0a 20 00 ba

----------------

Block 0, Base EDID:
  EDID Structure Version & Revision: 1.4
  Vendor & Product Identification:
    Manufacturer: CMN
    Model: 5421
    Made in: week 25 of 2020
  Basic Display Parameters & Features:
    Digital display
    Bits per primary color channel: 8
    DisplayPort interface
    Maximum image size: 34 cm x 19 cm
    Gamma: 2.20
    Supported color formats: RGB 4:4:4
    First detailed timing includes the native pixel format and preferred refresh rate
  Color Characteristics:
    Red  : 0.6396, 0.3300
    Green: 0.2998, 0.5996
    Blue : 0.1503, 0.0595
    White: 0.3134, 0.3291
  Established Timings I & II: none
  Standard Timings: none
  Detailed Timing Descriptors:
    DTD 1:  1920x1080   60.001038 Hz  16:9     66.721 kHz    138.780000 MHz (344 mm x 193 mm)
                 Hfront   48 Hsync  32 Hback   80 Hpol N
                 Vfront   10 Vsync   6 Vback   16 Vpol N
    Alphanumeric Data String: 'N156HCE-EN1'
    Alphanumeric Data String: 'CMN'
    Alphanumeric Data String: 'N156HCE-EN1'
Checksum: 0xba

----------------

Warnings:

Block 0, Base EDID:
  Missing Display Product Name.

EDID conformity: PASS
