edid-decode (hex):

00 ff ff ff ff ff ff 00 61 a9 c3 23 01 00 00 00
14 1e 01 03 08 35 1d 78 ea 1f 61 a4 55 50 9f 26
0c 50 54 bd cf 00 71 40 81 00 81 40 81 80 81 c0
95 00 a9 c0 b3 00 02 3a 80 18 71 38 2d 40 58 2c
45 00 0f 25 21 00 00 1e 00 00 00 ff 00 32 39 32
30 30 30 30 30 31 38 32 35 36 00 00 00 10 00 00
00 00 00 00 00 00 00 00 00 00 00 00 00 00 00 fc
00 4d 69 20 4d 6f 6e 69 74 6f 72 0a 20 20 00 a7

00 ff ff ff ff ff ff 00 61 a9 c3 23 01 00 00 00
14 1e 01 03 08 35 1d 78 ea 1f 61 a4 55 50 9f 26
0c 50 54 bd cf 00 71 40 81 00 81 40 81 80 81 c0
95 00 a9 c0 b3 00 02 3a 80 18 71 38 2d 40 58 2c
45 00 0f 25 21 00 00 1e 00 00 00 ff 00 32 39 32
30 30 30 30 30 31 38 32 35 36 00 00 00 10 00 00
00 00 00 00 00 00 00 00 00 00 00 00 00 00 00 fc
00 4d 69 20 4d 6f 6e 69 74 6f 72 0a 20 20 00 a7

----------------

Block 0, Base EDID:
  EDID Structure Version & Revision: 1.3
  Vendor & Product Identification:
    Manufacturer: XMI
    Model: 9155
    Serial Number: ...
    Made in: week 20 of 2020
  Basic Display Parameters & Features:
    Analog display
    Signal Level Standard: 0.700 : 0.300 : 1.000 V p-p
    Blank level equals black level
    Sync: Separate
    Maximum image size: 53 cm x 29 cm
    Gamma: 2.20
    DPMS levels: Standby Suspend Off
    RGB color display
    First detailed timing is the preferred timing
  Color Characteristics:
    Red  : 0.6406, 0.3330
    Green: 0.3154, 0.6240
    Blue : 0.1494, 0.0488
    White: 0.3125, 0.3291
  Established Timings I & II:
    IBM     :   720x400    70.081663 Hz   9:5     31.467 kHz     28.320000 MHz
    DMT 0x04:   640x480    59.940476 Hz   4:3     31.469 kHz     25.175000 MHz
    Apple   :   640x480    66.666667 Hz   4:3     35.000 kHz     30.240000 MHz
    DMT 0x05:   640x480    72.808802 Hz   4:3     37.861 kHz     31.500000 MHz
    DMT 0x06:   640x480    75.000000 Hz   4:3     37.500 kHz     31.500000 MHz
    DMT 0x09:   800x600    60.316541 Hz   4:3     37.879 kHz     40.000000 MHz
    DMT 0x0a:   800x600    72.187572 Hz   4:3     48.077 kHz     50.000000 MHz
    DMT 0x0b:   800x600    75.000000 Hz   4:3     46.875 kHz     49.500000 MHz
    DMT 0x10:  1024x768    60.003840 Hz   4:3     48.363 kHz     65.000000 MHz
    DMT 0x11:  1024x768    70.069359 Hz   4:3     56.476 kHz     75.000000 MHz
    DMT 0x12:  1024x768    75.028582 Hz   4:3     60.023 kHz     78.750000 MHz
    DMT 0x24:  1280x1024   75.024675 Hz   5:4     79.976 kHz    135.000000 MHz
  Standard Timings:
    GTF     :  1152x864    60.000000 Hz   4:3     53.700 kHz     81.624000 MHz
    DMT 0x1c:  1280x800    59.810326 Hz  16:10    49.702 kHz     83.500000 MHz
    DMT 0x20:  1280x960    60.000000 Hz   4:3     60.000 kHz    108.000000 MHz
    DMT 0x23:  1280x1024   60.019740 Hz   5:4     63.981 kHz    108.000000 MHz
    DMT 0x55:  1280x720    60.000000 Hz  16:9     45.000 kHz     74.250000 MHz
    DMT 0x2f:  1440x900    59.887445 Hz  16:10    55.935 kHz    106.500000 MHz
    DMT 0x53:  1600x900    60.000000 Hz  16:9     60.000 kHz    108.000000 MHz (RB)
    DMT 0x3a:  1680x1050   59.954250 Hz  16:10    65.290 kHz    146.250000 MHz
  Detailed Timing Descriptors:
    DTD 1:  1920x1080   60.000000 Hz  16:9     67.500 kHz    148.500000 MHz (527 mm x 293 mm)
                 Hfront   88 Hsync  44 Hback  148 Hpol P
                 Vfront    4 Vsync   5 Vback   36 Vpol P
    Display Product Serial Number: ...
    Dummy Descriptor:
    Display Product Name: 'Mi Monitor'
Checksum: 0xa7

----------------

Block 1, Unknown EDID Extension Block 0x00:
  00 ff ff ff ff ff ff 00 61 a9 c3 23 01 00 00 00 '........a..#....'
  14 1e 01 03 08 35 1d 78 ea 1f 61 a4 55 50 9f 26 '.....5.x..a.UP.&'
  0c 50 54 bd cf 00 71 40 81 00 81 40 81 80 81 c0 '.PT...q@...@....'
  95 00 a9 c0 b3 00 02 3a 80 18 71 38 2d 40 58 2c '.......:..q8-@X,'
  45 00 0f 25 21 00 00 1e 00 00 00 ff 00 32 39 32 'E..%!........292'
  30 30 30 30 30 31 38 32 35 36 00 00 00 10 00 00 '0000018256......'
  00 00 00 00 00 00 00 00 00 00 00 00 00 00 00 fc '................'
  00 4d 69 20 4d 6f 6e 69 74 6f 72 0a 20 20 00 a7 '.Mi Monitor.  ..'
Checksum: 0xa7

----------------

Failures:

Block 0, Base EDID:
  Missing Display Range Limits Descriptor.
Block 1, Base EDID:
  Unknown Extension Block.
EDID:
  Base EDID: EDID specified 0 extension block(s), but found 1 extension block(s).

EDID conformity: FAIL
