
EDID (hex):
00ffffffffffff0061a9c32301000000
271f010308351d78ea1f61a455509f26
0c5054bdcf00714081008140818081c0
9500a9c0b300023a801871382d40582c
45000f252100001e000000ff00323932
30303030333136383637000000100000
000000000000000000000000000000fc
004d69204d6f6e69746f720a2020008a

Extracted contents:
header:          00 ff ff ff ff ff ff 00
serial number:   61 a9 c3 23 01 00 00 00 27 1f
version:         01 03
basic params:    08 35 1d 78 ea
chroma info:     1f 61 a4 55 50 9f 26 0c 50 54
established:     bd cf 00
standard:        71 40 81 00 81 40 81 80 81 c0 95 00 a9 c0 b3 00
descriptor 1:    02 3a 80 18 71 38 2d 40 58 2c 45 00 0f 25 21 00 00 1e
descriptor 2:    00 00 00 ff 00 32 39 32 30 30 30 30 33 31 36 38 36 37
descriptor 3:    00 00 00 10 00 00 00 00 00 00 00 00 00 00 00 00 00 00
descriptor 4:    00 00 00 fc 00 4d 69 20 4d 6f 6e 69 74 6f 72 0a 20 20
extensions:      00
checksum:        8a

EDID version: 1.3
Manufacturer: XMI Model 23c3 Serial Number --
Made in week 39 of 2021
Analog display, Input voltage level: 0.7/0.3 V
Sync: Separate 
Maximum image size: 53 cm x 29 cm
Gamma: 2.20
DPMS levels: Standby Suspend Off
RGB color display
First detailed timing is preferred timing
Display x,y Chromaticity:
  Red:   0.6406, 0.3330
  Green: 0.3154, 0.6240
  Blue:  0.1494, 0.0488
  White: 0.3125, 0.3291
Established timings supported:
  720x400@70Hz 9:5 HorFreq: 31469 Hz Clock: 28.320 MHz
  640x480@60Hz 4:3 HorFreq: 31469 Hz Clock: 25.175 MHz
  640x480@67Hz 4:3 HorFreq: 35000 Hz Clock: 30.240 MHz
  640x480@72Hz 4:3 HorFreq: 37900 Hz Clock: 31.500 MHz
  640x480@75Hz 4:3 HorFreq: 37500 Hz Clock: 31.500 MHz
  800x600@60Hz 4:3 HorFreq: 37900 Hz Clock: 40.000 MHz
  800x600@72Hz 4:3 HorFreq: 48100 Hz Clock: 50.000 MHz
  800x600@75Hz 4:3 HorFreq: 46900 Hz Clock: 49.500 MHz
  1024x768@60Hz 4:3 HorFreq: 48400 Hz Clock: 65.000 MHz
  1024x768@70Hz 4:3 HorFreq: 56500 Hz Clock: 75.000 MHz
  1024x768@75Hz 4:3 HorFreq: 60000 Hz Clock: 78.750 MHz
  1280x1024@75Hz 5:4 HorFreq: 80000 Hz Clock: 135.000 MHz
Standard timings supported:
  1152x864@60Hz 4:3
  1280x800@60Hz 16:10
  1280x960@60Hz 4:3 HorFreq: 60000 Hz Clock: 108.000 MHz
  1280x1024@60Hz 5:4 HorFreq: 64000 Hz Clock: 108.000 MHz
  1280x720@60Hz 16:9
  1440x900@60Hz 16:10 HorFreq: 55500 Hz Clock: 88.750 MHz
  1600x900@60Hz 16:9
  1680x1050@60Hz 16:10 HorFreq: 64700 Hz Clock: 119.000 MHz
Detailed mode: Clock 148.500 MHz, 527 mm x 293 mm
               1920 2008 2052 2200 hborder 0
               1080 1084 1089 1125 vborder 0
               +hsync +vsync 
               VertFreq: 60 Hz, HorFreq: 67500 Hz
Serial number: --
Dummy block
Monitor name: Mi Monitor
Checksum: 0x8a (valid)
EDID block does NOT conform to EDID 1.3!
	Missing monitor ranges
