edid-decode (hex):

00 ff ff ff ff ff ff 00 38 a3 b2 a4 01 01 01 01
1b 0e 01 03 80 5c 34 78 2a 00 e5 a0 5a 27 ba 25
17 42 4e af cf 00 81 80 a9 40 01 01 01 01 01 01
01 01 01 01 01 01 2f 0d 50 f0 30 e0 25 10 10 70
68 00 94 06 32 00 00 1e 66 21 50 b0 51 00 1b 30
40 70 36 00 99 06 32 00 00 1e 00 00 00 fd 00 32
78 18 5b 10 00 0a 20 20 20 20 20 20 00 00 00 fc
00 50 58 2d 34 32 56 4d 35 2f 56 50 35 0a 00 50

00 ff ff ff ff ff ff 00 38 a3 b2 a4 01 01 01 01
1b 0e 01 03 80 5c 34 78 2a 00 e5 a0 5a 27 ba 25
17 42 4e af cf 00 81 80 a9 40 01 01 01 01 01 01
01 01 01 01 01 01 2f 0d 50 f0 30 e0 25 10 10 70
68 00 94 06 32 00 00 1e 66 21 50 b0 51 00 1b 30
40 70 36 00 99 06 32 00 00 1e 00 00 00 fd 00 32
78 18 5b 10 00 0a 20 20 20 20 20 20 00 00 00 fc
00 50 58 2d 34 32 56 4d 35 2f 56 50 35 0a 00 50

----------------

Block 0, Base EDID:
  EDID Structure Version & Revision: 1.3
  Vendor & Product Identification:
    Manufacturer: NEC
    Model: 42162
    Serial Number: ...
    Made in: week 27 of 2004
  Basic Display Parameters & Features:
    Digital display
    Maximum image size: 92 cm x 52 cm
    Gamma: 2.20
    DPMS levels: Off
    RGB color display
    First detailed timing is the preferred timing
  Color Characteristics:
    Red  : 0.6250, 0.3515
    Green: 0.1523, 0.7265
    Blue : 0.1474, 0.0917
    White: 0.2587, 0.3056
  Established Timings I & II:
    IBM     :   720x400    70.081663 Hz   9:5     31.467 kHz     28.320000 MHz
    DMT 0x04:   640x480    59.940476 Hz   4:3     31.469 kHz     25.175000 MHz
    DMT 0x05:   640x480    72.808802 Hz   4:3     37.861 kHz     31.500000 MHz
    DMT 0x06:   640x480    75.000000 Hz   4:3     37.500 kHz     31.500000 MHz
    DMT 0x08:   800x600    56.250000 Hz   4:3     35.156 kHz     36.000000 MHz
    DMT 0x09:   800x600    60.316541 Hz   4:3     37.879 kHz     40.000000 MHz
    DMT 0x0a:   800x600    72.187572 Hz   4:3     48.077 kHz     50.000000 MHz
    DMT 0x0b:   800x600    75.000000 Hz   4:3     46.875 kHz     49.500000 MHz
    DMT 0x10:  1024x768    60.003840 Hz   4:3     48.363 kHz     65.000000 MHz
    DMT 0x11:  1024x768    70.069359 Hz   4:3     56.476 kHz     75.000000 MHz
    DMT 0x12:  1024x768    75.028582 Hz   4:3     60.023 kHz     78.750000 MHz
    DMT 0x24:  1280x1024   75.024675 Hz   5:4     79.976 kHz    135.000000 MHz
  Standard Timings:
    DMT 0x23:  1280x1024   60.019740 Hz   5:4     63.981 kHz    108.000000 MHz
    DMT 0x33:  1600x1200   60.000000 Hz   4:3     75.000 kHz    162.000000 MHz
  Detailed Timing Descriptors:
    DTD 1:   848x480    60.000427 Hz  53:30    31.020 kHz     33.750000 MHz (916 mm x 518 mm)
                 Hfront   16 Hsync 112 Hback  112 Hpol P
                 Vfront    6 Vsync   8 Vback   23 Vpol P
    DTD 2:  1360x768    60.015162 Hz  85:48    47.712 kHz     85.500000 MHz (921 mm x 518 mm)
                 Hfront   64 Hsync 112 Hback  256 Hpol P
                 Vfront    3 Vsync   6 Vback   18 Vpol P
    Display Range Limits:
      Monitor ranges (GTF): 50-120 Hz V, 24-91 kHz H, max dotclock 160 MHz
    Display Product Name: 'PX-42VM5/VP5'
Checksum: 0x50

----------------

Block 1, Unknown EDID Extension Block 0x00:
  00 ff ff ff ff ff ff 00 38 a3 b2 a4 01 01 01 01 '........8.......'
  1b 0e 01 03 80 5c 34 78 2a 00 e5 a0 5a 27 ba 25 '.....\4x*...Z'.%'
  17 42 4e af cf 00 81 80 a9 40 01 01 01 01 01 01 '.BN......@......'
  01 01 01 01 01 01 2f 0d 50 f0 30 e0 25 10 10 70 '....../.P.0.%..p'
  68 00 94 06 32 00 00 1e 66 21 50 b0 51 00 1b 30 'h...2...f!P.Q..0'
  40 70 36 00 99 06 32 00 00 1e 00 00 00 fd 00 32 '@p6...2........2'
  78 18 5b 10 00 0a 20 20 20 20 20 20 00 00 00 fc 'x.[...      ....'
  00 50 58 2d 34 32 56 4d 35 2f 56 50 35 0a 00 50 '.PX-42VM5/VP5..P'
Checksum: 0x50

----------------

Warnings:

EDID:
  Base EDID: Some timings are out of range of the Monitor Ranges:
    Maximum Clock: 162.000 MHz (Monitor: 160.000 MHz)
    Could be due to a Monitor Range off-by-one rounding issue

Failures:

Block 1, Base EDID:
  Unknown Extension Block.
EDID:
  Base EDID: EDID specified 0 extension block(s), but found 1 extension block(s).

EDID conformity: FAIL
