edid-decode (hex):

00 ff ff ff ff ff ff 00 41 d2 8d 88 01 01 01 01
24 11 01 03 80 37 22 78 2a 8d b5 a8 53 35 aa 25
10 50 54 bf ef 80 71 4f 81 4f 81 80 8b c0 95 00
90 4f b3 00 a9 40 01 1d 80 18 71 1c 16 20 58 2c
25 00 26 58 21 00 00 9e 28 3c 80 a0 70 b0 23 40
30 20 36 00 26 58 21 00 00 1a 00 00 00 fd 00 31
4b 1e 53 10 00 0a 20 20 20 20 20 20 00 00 00 fc
00 50 6c 61 6e 61 72 50 58 32 36 31 31 57 01 8a

02 01 04 00 01 1d 00 72 51 d0 1e 20 6e 28 55 00
26 58 21 00 00 1e 8c 0a d0 8a 20 e0 2d 10 10 3e
96 00 26 58 21 00 00 18 8c 0a a0 14 51 f0 16 00
26 7c 43 00 26 58 21 00 00 98 01 1d 80 d0 72 1c
16 20 10 2c 25 80 26 58 21 00 00 9e 8c 0a d0 90
20 40 31 20 0c 40 55 00 26 58 21 00 00 18 01 1d
00 bc 52 d0 1e 20 b8 28 55 40 26 58 21 00 00 1e
00 00 00 00 00 00 00 00 00 00 00 00 00 00 00 22

00 ff ff ff ff ff ff 00 41 d2 8d 88 01 01 01 01
24 11 01 03 80 37 22 78 2a 8d b5 a8 53 35 aa 25
10 50 54 bf ef 80 71 4f 81 4f 81 80 8b c0 95 00
90 4f b3 00 a9 40 01 1d 80 18 71 1c 16 20 58 2c
25 00 26 58 21 00 00 9e 28 3c 80 a0 70 b0 23 40
30 20 36 00 26 58 21 00 00 1a 00 00 00 fd 00 31
4b 1e 53 10 00 0a 20 20 20 20 20 20 00 00 00 fc
00 50 6c 61 6e 61 72 50 58 32 36 31 31 57 01 8a

02 01 04 00 01 1d 00 72 51 d0 1e 20 6e 28 55 00
26 58 21 00 00 1e 8c 0a d0 8a 20 e0 2d 10 10 3e
96 00 26 58 21 00 00 18 8c 0a a0 14 51 f0 16 00
26 7c 43 00 26 58 21 00 00 98 01 1d 80 d0 72 1c
16 20 10 2c 25 80 26 58 21 00 00 9e 8c 0a d0 90
20 40 31 20 0c 40 55 00 26 58 21 00 00 18 01 1d
00 bc 52 d0 1e 20 b8 28 55 40 26 58 21 00 00 1e
00 00 00 00 00 00 00 00 00 00 00 00 00 00 00 22

----------------

Block 0, Base EDID:
  EDID Structure Version & Revision: 1.3
  Vendor & Product Identification:
    Manufacturer: PNR
    Model: 34957
    Serial Number: ...
    Made in: week 36 of 2007
  Basic Display Parameters & Features:
    Digital display
    Maximum image size: 55 cm x 34 cm
    Gamma: 2.20
    DPMS levels: Off
    RGB color display
    First detailed timing is the preferred timing
  Color Characteristics:
    Red  : 0.6582, 0.3242
    Green: 0.2099, 0.6650
    Blue : 0.1464, 0.0654
    White: 0.3134, 0.3291
  Established Timings I & II:
    IBM     :   720x400    70.081663 Hz   9:5     31.467 kHz     28.320000 MHz
    DMT 0x04:   640x480    59.940476 Hz   4:3     31.469 kHz     25.175000 MHz
    Apple   :   640x480    66.666667 Hz   4:3     35.000 kHz     30.240000 MHz
    DMT 0x05:   640x480    72.808802 Hz   4:3     37.861 kHz     31.500000 MHz
    DMT 0x06:   640x480    75.000000 Hz   4:3     37.500 kHz     31.500000 MHz
    DMT 0x08:   800x600    56.250000 Hz   4:3     35.156 kHz     36.000000 MHz
    DMT 0x09:   800x600    60.316541 Hz   4:3     37.879 kHz     40.000000 MHz
    DMT 0x0a:   800x600    72.187572 Hz   4:3     48.077 kHz     50.000000 MHz
    DMT 0x0b:   800x600    75.000000 Hz   4:3     46.875 kHz     49.500000 MHz
    Apple   :   832x624    74.551266 Hz   4:3     49.726 kHz     57.284000 MHz
    DMT 0x10:  1024x768    60.003840 Hz   4:3     48.363 kHz     65.000000 MHz
    DMT 0x11:  1024x768    70.069359 Hz   4:3     56.476 kHz     75.000000 MHz
    DMT 0x12:  1024x768    75.028582 Hz   4:3     60.023 kHz     78.750000 MHz
    DMT 0x24:  1280x1024   75.024675 Hz   5:4     79.976 kHz    135.000000 MHz
    Apple   :  1152x870    75.061550 Hz 192:145   68.681 kHz    100.000000 MHz
  Standard Timings:
    DMT 0x15:  1152x864    75.000000 Hz   4:3     67.500 kHz    108.000000 MHz
    GTF     :  1280x960    74.999884 Hz   4:3     75.150 kHz    129.859000 MHz
    DMT 0x23:  1280x1024   60.019740 Hz   5:4     63.981 kHz    108.000000 MHz
    GTF     :  1360x765    60.000341 Hz  16:9     47.520 kHz     84.396000 MHz
    DMT 0x2f:  1440x900    59.887445 Hz  16:10    55.935 kHz    106.500000 MHz
    DMT 0x2b:  1400x1050   74.866680 Hz   4:3     82.278 kHz    156.000000 MHz
    DMT 0x3a:  1680x1050   59.954250 Hz  16:10    65.290 kHz    146.250000 MHz
    DMT 0x33:  1600x1200   60.000000 Hz   4:3     75.000 kHz    162.000000 MHz
  Detailed Timing Descriptors:
    DTD  1:  1920x1080i  60.000000 Hz  16:9     33.750 kHz     74.250000 MHz (550 mm x 344 mm)
                  Hfront   88 Hsync  44 Hback  148 Hpol P
                  Vfront    2 Vsync   5 Vback   15 Vpol P Vfront +0.5 Odd Field
                  Vfront    2 Vsync   5 Vback   15 Vpol P Vback  +0.5 Even Field
    DTD  2:  1920x1200   59.950171 Hz  16:10    74.038 kHz    154.000000 MHz (550 mm x 344 mm)
                  Hfront   48 Hsync  32 Hback   80 Hpol P
                  Vfront    3 Vsync   6 Vback   26 Vpol N
    Display Range Limits:
      Monitor ranges (GTF): 49-75 Hz V, 30-83 kHz H, max dotclock 160 MHz
    Display Product Name: 'PlanarPX2611W'
  Extension blocks: 1
Checksum: 0x8a

----------------

Block 1, CTA-861 Extension Block:
  Revision: 1
  Detailed Timing Descriptors:
    DTD  3:  1280x720    60.000000 Hz  16:9     45.000 kHz     74.250000 MHz (550 mm x 344 mm)
                  Hfront  110 Hsync  40 Hback  220 Hpol P
                  Vfront    5 Vsync   5 Vback   20 Vpol P
    DTD  4:   720x480    59.940060 Hz   3:2     31.469 kHz     27.000000 MHz (550 mm x 344 mm)
                  Hfront   16 Hsync  62 Hback   60 Hpol N
                  Vfront    9 Vsync   6 Vback   30 Vpol N
    DTD  5:  1440x480i   59.940060 Hz   3:1     15.734 kHz     27.000000 MHz (550 mm x 344 mm)
                  Hfront   38 Hsync 124 Hback  114 Hpol N
                  Vfront    4 Vsync   3 Vback   15 Vpol N Vfront +0.5 Odd Field
                  Vfront    4 Vsync   3 Vback   15 Vpol N Vback  +0.5 Even Field
    DTD  6:  1920x1080i  50.000000 Hz  16:9     28.125 kHz     74.250000 MHz (550 mm x 344 mm)
                  Hfront  528 Hsync  44 Hback  148 Hpol P
                  Vfront    2 Vsync   5 Vback   15 Vpol P Vfront +0.5 Odd Field
                  Vfront    2 Vsync   5 Vback   15 Vpol P Vback  +0.5 Even Field
    DTD  7:   720x576    50.000000 Hz   5:4     31.250 kHz     27.000000 MHz (550 mm x 344 mm)
                  Hfront   12 Hsync  64 Hback   68 Hpol N
                  Vfront    5 Vsync   5 Vback   39 Vpol N
    DTD  8:  1280x720    50.000000 Hz  16:9     37.500 kHz     74.250000 MHz (550 mm x 344 mm)
                  Hfront  440 Hsync  40 Hback  220 Hpol P
                  Vfront    5 Vsync   5 Vback   20 Vpol P
Checksum: 0x22  Unused space in Extension Block: 15 bytes

----------------

Block 2, Unknown EDID Extension Block 0x00:
  00 ff ff ff ff ff ff 00 41 d2 8d 88 01 01 01 01 '........A.......'
  24 11 01 03 80 37 22 78 2a 8d b5 a8 53 35 aa 25 '$....7"x*...S5.%'
  10 50 54 bf ef 80 71 4f 81 4f 81 80 8b c0 95 00 '.PT...qO.O......'
  90 4f b3 00 a9 40 01 1d 80 18 71 1c 16 20 58 2c '.O...@....q.. X,'
  25 00 26 58 21 00 00 9e 28 3c 80 a0 70 b0 23 40 '%.&X!...(<..p.#@'
  30 20 36 00 26 58 21 00 00 1a 00 00 00 fd 00 31 '0 6.&X!........1'
  4b 1e 53 10 00 0a 20 20 20 20 20 20 00 00 00 fc 'K.S...      ....'
  00 50 6c 61 6e 61 72 50 58 32 36 31 31 57 01 8a '.PlanarPX2611W..'
Checksum: 0x8a

----------------

Block 3, CTA-861 Extension Block:
  Revision: 1
  Detailed Timing Descriptors:
    DTD  9:  1280x720    60.000000 Hz  16:9     45.000 kHz     74.250000 MHz (550 mm x 344 mm)
                  Hfront  110 Hsync  40 Hback  220 Hpol P
                  Vfront    5 Vsync   5 Vback   20 Vpol P
    DTD 10:   720x480    59.940060 Hz   3:2     31.469 kHz     27.000000 MHz (550 mm x 344 mm)
                  Hfront   16 Hsync  62 Hback   60 Hpol N
                  Vfront    9 Vsync   6 Vback   30 Vpol N
    DTD 11:  1440x480i   59.940060 Hz   3:1     15.734 kHz     27.000000 MHz (550 mm x 344 mm)
                  Hfront   38 Hsync 124 Hback  114 Hpol N
                  Vfront    4 Vsync   3 Vback   15 Vpol N Vfront +0.5 Odd Field
                  Vfront    4 Vsync   3 Vback   15 Vpol N Vback  +0.5 Even Field
    DTD 12:  1920x1080i  50.000000 Hz  16:9     28.125 kHz     74.250000 MHz (550 mm x 344 mm)
                  Hfront  528 Hsync  44 Hback  148 Hpol P
                  Vfront    2 Vsync   5 Vback   15 Vpol P Vfront +0.5 Odd Field
                  Vfront    2 Vsync   5 Vback   15 Vpol P Vback  +0.5 Even Field
    DTD 13:   720x576    50.000000 Hz   5:4     31.250 kHz     27.000000 MHz (550 mm x 344 mm)
                  Hfront   12 Hsync  64 Hback   68 Hpol N
                  Vfront    5 Vsync   5 Vback   39 Vpol N
    DTD 14:  1280x720    50.000000 Hz  16:9     37.500 kHz     74.250000 MHz (550 mm x 344 mm)
                  Hfront  440 Hsync  40 Hback  220 Hpol P
                  Vfront    5 Vsync   5 Vback   20 Vpol P
Checksum: 0x22  Unused space in Extension Block: 15 bytes

----------------

Warnings:

Block 0, Base EDID:
  Standard Timings: Standard Timing 1360x765 has a dubious odd vertical resolution.
Block 1, CTA-861 Extension Block:
  Add a Colorimetry Data Block with the sRGB colorimetry bit set to avoid interop issues.
Block 3, CTA-861 Extension Block:
  Add a Colorimetry Data Block with the sRGB colorimetry bit set to avoid interop issues.

Failures:

Block 1, CTA-861 Extension Block:
  Missing VCDB, needed for Set Selectable RGB Quantization to avoid interop issues.
Block 2, Base EDID:
  Unknown Extension Block.
Block 3, CTA-861 Extension Block:
  Missing VCDB, needed for Set Selectable RGB Quantization to avoid interop issues.
EDID:
  Base EDID: Some timings are out of range of the Monitor Ranges:
    Horizontal Freq: 15.734 - 82.278 kHz (Monitor: 30.000 - 83.000 kHz)
    Maximum Clock: 162.000 MHz (Monitor: 160.000 MHz)
  Base EDID: EDID specified 1 extension block(s), but found 3 extension block(s).
  Base EDID: EDID 1.3 requires a Block Map Extension in Block 1 if there are more than 2 blocks in the EDID.
  CTA-861: A native interlaced timing is present, but not a native progressive timing.

EDID conformity: FAIL
