edid-decode (hex):

00 ff ff ff ff ff ff 00 06 af 8c f3 00 00 00 00
00 1d 01 04 95 1d 11 78 03 ee 95 a3 54 4c 99 26
0f 50 54 00 00 00 01 01 01 01 01 01 01 01 01 01
01 01 01 01 01 01 b4 37 80 a0 70 38 3e 40 3a 2a
35 00 25 a5 10 00 00 18 23 25 80 a0 70 38 3e 40
3a 2a 35 00 25 a5 10 00 00 18 00 00 00 00 00 00
00 00 00 00 00 00 00 00 00 00 00 00 00 00 00 02
00 10 48 ff 0f 3c 7d 4e 0c 1f 7d 20 20 20 00 de

----------------

Block 0, Base EDID:
  EDID Structure Version & Revision: 1.4
  Vendor & Product Identification:
    Manufacturer: AUO
    Model: 62348
    Made in: 2019
  Basic Display Parameters & Features:
    Digital display
    Bits per primary color channel: 6
    DisplayPort interface
    Maximum image size: 29 cm x 17 cm
    Gamma: 2.20
    Supported color formats: RGB 4:4:4
    First detailed timing includes the native pixel format and preferred refresh rate
    Display is continuous frequency
  Color Characteristics:
    Red  : 0.6396, 0.3300
    Green: 0.2998, 0.5996
    Blue : 0.1503, 0.0595
    White: 0.3134, 0.3291
  Established Timings I & II: none
  Standard Timings: none
  Detailed Timing Descriptors:
    DTD 1:  1920x1080   60.033 Hz  16:9    68.558 kHz 142.600 MHz (293 mm x 165 mm)
                 Hfront   58 Hsync  42 Hback  60 Hpol N
                 Vfront    3 Vsync   5 Vback  54 Vpol N
    DTD 2:  1920x1080   40.023 Hz  16:9    45.707 kHz  95.070 MHz (293 mm x 165 mm)
                 Hfront   58 Hsync  42 Hback  60 Hpol N
                 Vfront    3 Vsync   5 Vback  54 Vpol N
    Empty Descriptor
    Manufacturer-Specified Display Descriptor (0x02): 00 02 00 10 48 ff 0f 3c 7d 4e 0c 1f 7d 20 20 20 '....H..<}N..}   '
Checksum: 0xde

----------------

Failures:

Block 0, Base EDID:
  Empty Descriptor: Use Dummy Descriptor instead of all zeroes.
  Missing Display Product Name.
  Missing Display Range Limits Descriptor.

EDID conformity: FAIL
