edid-decode (hex):

00 ff ff ff ff ff ff 00 30 e4 01 02 00 00 00 00
00 14 01 04 80 1f 11 78 0a 88 45 95 5a 56 8d 28
23 50 54 00 00 00 01 01 01 01 01 01 01 01 01 01
01 01 01 01 01 01 56 1d 56 c6 50 00 20 30 30 20
35 00 36 ae 10 00 00 19 8f 13 56 c6 50 00 20 30
30 20 35 00 36 ae 10 00 00 19 00 00 00 00 00 00
00 00 00 00 00 00 00 00 00 00 00 00 00 00 00 02
00 0f 44 ff 0c 3c 64 16 11 1d 64 00 00 00 00 ad

----------------

Block 0, Base EDID:
  EDID Structure Version & Revision: 1.4
  Vendor & Product Identification:
    Manufacturer: LGD
    Model: 513
    Made in: 2010
  Basic Display Parameters & Features:
    Digital display
    Color depth is undefined
    Digital interface is not defined
    Maximum image size: 31 cm x 17 cm
    Gamma: 2.20
    Supported color formats: RGB 4:4:4, YCrCb 4:4:4
    First detailed timing includes the native pixel format and preferred refresh rate
  Color Characteristics:
    Red  : 0.5839, 0.3515
    Green: 0.3378, 0.5507
    Blue : 0.1572, 0.1367
    White: 0.3134, 0.3291
  Established Timings I & II: none
  Standard Timings: none
  Detailed Timing Descriptors:
    DTD 1:  1366x768    60.022379 Hz 683:384   48.018 kHz     75.100000 MHz (310 mm x 174 mm)
                 Hfront   48 Hsync  32 Hback  118 Hpol N
                 Vfront    3 Vsync   5 Vback   24 Vpol N
    DTD 2:  1366x768    40.017583 Hz 683:384   32.014 kHz     50.070000 MHz (310 mm x 174 mm)
                 Hfront   48 Hsync  32 Hback  118 Hpol N
                 Vfront    3 Vsync   5 Vback   24 Vpol N
    Empty Descriptor
    Manufacturer-Specified Display Descriptor (0x02): 00 02 00 0f 44 ff 0c 3c 64 16 11 1d 64 00 00 00 '....D..<d...d...'
Checksum: 0xad

----------------

Failures:

Block 0, Base EDID:
  Empty Descriptor: Use Dummy Descriptor instead of all zeroes.
  Missing Display Product Name.

EDID conformity: FAIL
