edid-decode (hex):

00 ff ff ff ff ff ff 00 15 85 70 23 00 00 00 00
1c 17 01 03 80 33 1d 78 0a 01 c1 a0 57 47 98 27
12 4c 4c ad ce 00 81 00 81 c0 01 01 01 01 01 01
01 01 01 01 01 01 66 21 50 b0 51 00 1b 30 40 70
36 00 40 84 63 00 00 1e 66 21 56 aa 51 00 1e 30
46 8f 33 00 40 84 63 00 00 1e 00 00 00 fc 00 45
4c 45 46 57 32 33 31 0a 20 20 20 20 00 00 00 fd
00 30 3e 0e 44 0f 00 0a 20 20 20 20 20 20 01 b7

02 03 23 70 50 01 02 03 04 05 06 07 10 11 12 13
14 1f 20 21 22 23 09 1f 07 83 01 00 00 65 03 0c
00 10 00 01 1d 80 d0 72 1c 16 20 10 2c 25 80 40
84 63 00 00 9f 01 1d 80 18 71 1c 16 20 58 2c 25
00 40 84 63 00 00 99 01 1d 00 bc 52 d0 1e 20 b8
28 55 40 40 84 63 00 00 1e 02 3a 80 d0 72 38 2d
40 10 2c 45 80 40 84 63 00 00 1e 00 00 00 00 00
00 00 00 00 00 00 00 00 00 00 00 00 00 00 00 2e

00 ff ff ff ff ff ff 00 15 85 70 23 00 00 00 00
1c 17 01 03 80 33 1d 78 0a 01 c1 a0 57 47 98 27
12 4c 4c ad ce 00 81 00 81 c0 01 01 01 01 01 01
01 01 01 01 01 01 66 21 50 b0 51 00 1b 30 40 70
36 00 40 84 63 00 00 1e 66 21 56 aa 51 00 1e 30
46 8f 33 00 40 84 63 00 00 1e 00 00 00 fc 00 45
4c 45 46 57 32 33 31 0a 20 20 20 20 00 00 00 fd
00 30 3e 0e 44 0f 00 0a 20 20 20 20 20 20 01 b7

02 03 23 70 50 01 02 03 04 05 06 07 10 11 12 13
14 1f 20 21 22 23 09 1f 07 83 01 00 00 65 03 0c
00 10 00 01 1d 80 d0 72 1c 16 20 10 2c 25 80 40
84 63 00 00 9f 01 1d 80 18 71 1c 16 20 58 2c 25
00 40 84 63 00 00 99 01 1d 00 bc 52 d0 1e 20 b8
28 55 40 40 84 63 00 00 1e 02 3a 80 d0 72 38 2d
40 10 2c 45 80 40 84 63 00 00 1e 00 00 00 00 00
00 00 00 00 00 00 00 00 00 00 00 00 00 00 00 2e

----------------

Block 0, Base EDID:
  EDID Structure Version & Revision: 1.3
  Vendor & Product Identification:
    Manufacturer: ELE
    Model: 9072
    Made in: week 28 of 2013
  Basic Display Parameters & Features:
    Digital display
    Maximum image size: 51 cm x 29 cm
    Gamma: 2.20
    RGB color display
    First detailed timing is the preferred timing
  Color Characteristics:
    Red  : 0.6250, 0.3398
    Green: 0.2773, 0.5947
    Blue : 0.1552, 0.0703
    White: 0.2968, 0.2978
  Established Timings I & II:
    IBM     :   720x400    70.081663 Hz   9:5     31.467 kHz     28.320000 MHz
    DMT 0x04:   640x480    59.940476 Hz   4:3     31.469 kHz     25.175000 MHz
    DMT 0x05:   640x480    72.808802 Hz   4:3     37.861 kHz     31.500000 MHz
    DMT 0x06:   640x480    75.000000 Hz   4:3     37.500 kHz     31.500000 MHz
    DMT 0x09:   800x600    60.316541 Hz   4:3     37.879 kHz     40.000000 MHz
    DMT 0x0a:   800x600    72.187572 Hz   4:3     48.077 kHz     50.000000 MHz
    DMT 0x0b:   800x600    75.000000 Hz   4:3     46.875 kHz     49.500000 MHz
    DMT 0x10:  1024x768    60.003840 Hz   4:3     48.363 kHz     65.000000 MHz
    DMT 0x11:  1024x768    70.069359 Hz   4:3     56.476 kHz     75.000000 MHz
    DMT 0x12:  1024x768    75.028582 Hz   4:3     60.023 kHz     78.750000 MHz
  Standard Timings:
    DMT 0x1c:  1280x800    59.810326 Hz  16:10    49.702 kHz     83.500000 MHz
    DMT 0x55:  1280x720    60.000000 Hz  16:9     45.000 kHz     74.250000 MHz
  Detailed Timing Descriptors:
    DTD  1:  1360x768    60.015162 Hz  85:48    47.712 kHz     85.500000 MHz (1600 mm x 900 mm)
                  Hfront   64 Hsync 112 Hback  256 Hpol P
                  Vfront    3 Vsync   6 Vback   18 Vpol P
    DTD  2:  1366x768    59.789541 Hz 683:384   47.712 kHz     85.500000 MHz (1600 mm x 900 mm)
                  Hfront   70 Hsync 143 Hback  213 Hpol P
                  Vfront    3 Vsync   3 Vback   24 Vpol P
    Display Product Name: 'ELEFW231'
    Display Range Limits:
      Monitor ranges (GTF): 48-62 Hz V, 14-68 kHz H, max dotclock 150 MHz
  Extension blocks: 1
Checksum: 0xb7

----------------

Block 1, CTA-861 Extension Block:
  Revision: 3
  Basic audio support
  Supports YCbCr 4:4:4
  Supports YCbCr 4:2:2
  Native detailed modes: 0
  Video Data Block:
    VIC   1:   640x480    59.940476 Hz   4:3     31.469 kHz     25.175000 MHz
    VIC   2:   720x480    59.940060 Hz   4:3     31.469 kHz     27.000000 MHz
    VIC   3:   720x480    59.940060 Hz  16:9     31.469 kHz     27.000000 MHz
    VIC   4:  1280x720    60.000000 Hz  16:9     45.000 kHz     74.250000 MHz
    VIC   5:  1920x1080i  60.000000 Hz  16:9     33.750 kHz     74.250000 MHz
    VIC   6:  1440x480i   59.940060 Hz   4:3     15.734 kHz     27.000000 MHz
    VIC   7:  1440x480i   59.940060 Hz  16:9     15.734 kHz     27.000000 MHz
    VIC  16:  1920x1080   60.000000 Hz  16:9     67.500 kHz    148.500000 MHz
    VIC  17:   720x576    50.000000 Hz   4:3     31.250 kHz     27.000000 MHz
    VIC  18:   720x576    50.000000 Hz  16:9     31.250 kHz     27.000000 MHz
    VIC  19:  1280x720    50.000000 Hz  16:9     37.500 kHz     74.250000 MHz
    VIC  20:  1920x1080i  50.000000 Hz  16:9     28.125 kHz     74.250000 MHz
    VIC  31:  1920x1080   50.000000 Hz  16:9     56.250 kHz    148.500000 MHz
    VIC  32:  1920x1080   24.000000 Hz  16:9     27.000 kHz     74.250000 MHz
    VIC  33:  1920x1080   25.000000 Hz  16:9     28.125 kHz     74.250000 MHz
    VIC  34:  1920x1080   30.000000 Hz  16:9     33.750 kHz     74.250000 MHz
  Audio Data Block:
    Linear PCM:
      Max channels: 2
      Supported sample rates (kHz): 96 88.2 48 44.1 32
      Supported sample sizes (bits): 24 20 16
  Speaker Allocation Data Block:
    FL/FR - Front Left/Right
  Vendor-Specific Data Block (HDMI), OUI 00-0C-03:
    Source physical address: 1.0.0.0
  Detailed Timing Descriptors:
    DTD  3:  1920x1080i  50.000000 Hz  16:9     28.125 kHz     74.250000 MHz (1600 mm x 900 mm)
                  Hfront  528 Hsync  44 Hback  148 Hpol P
                  Vfront    2 Vsync   5 Vback   15 Vpol P Vfront +0.5 Odd Field
                  Vfront    2 Vsync   5 Vback   15 Vpol P Vback  +0.5 Even Field
    DTD  4:  1920x1080i  60.000000 Hz  16:9     33.750 kHz     74.250000 MHz (1600 mm x 900 mm)
                  Hfront   88 Hsync  44 Hback  148 Hpol N
                  Vfront    2 Vsync   5 Vback   15 Vpol N Vfront +0.5 Odd Field
                  Vfront    2 Vsync   5 Vback   15 Vpol N Vback  +0.5 Even Field
    DTD  5:  1280x720    50.000000 Hz  16:9     37.500 kHz     74.250000 MHz (1600 mm x 900 mm)
                  Hfront  440 Hsync  40 Hback  220 Hpol P
                  Vfront    5 Vsync   5 Vback   20 Vpol P
    DTD  6:  1920x1080   50.000000 Hz  16:9     56.250 kHz    148.500000 MHz (1600 mm x 900 mm)
                  Hfront  528 Hsync  44 Hback  148 Hpol P
                  Vfront    4 Vsync   5 Vback   36 Vpol P
Checksum: 0x2e  Unused space in Extension Block: 20 bytes

----------------

Block 2, Unknown EDID Extension Block 0x00:
  00 ff ff ff ff ff ff 00 15 85 70 23 00 00 00 00 '..........p#....'
  1c 17 01 03 80 33 1d 78 0a 01 c1 a0 57 47 98 27 '.....3.x....WG.''
  12 4c 4c ad ce 00 81 00 81 c0 01 01 01 01 01 01 '.LL.............'
  01 01 01 01 01 01 66 21 50 b0 51 00 1b 30 40 70 '......f!P.Q..0@p'
  36 00 40 84 63 00 00 1e 66 21 56 aa 51 00 1e 30 '6.@.c...f!V.Q..0'
  46 8f 33 00 40 84 63 00 00 1e 00 00 00 fc 00 45 'F.3.@.c........E'
  4c 45 46 57 32 33 31 0a 20 20 20 20 00 00 00 fd 'LEFW231.    ....'
  00 30 3e 0e 44 0f 00 0a 20 20 20 20 20 20 01 b7 '.0>.D...      ..'
Checksum: 0xb7

----------------

Block 3, CTA-861 Extension Block:
  Revision: 3
  Basic audio support
  Supports YCbCr 4:4:4
  Supports YCbCr 4:2:2
  Native detailed modes: 0
  Video Data Block:
    VIC   1:   640x480    59.940476 Hz   4:3     31.469 kHz     25.175000 MHz
    VIC   2:   720x480    59.940060 Hz   4:3     31.469 kHz     27.000000 MHz
    VIC   3:   720x480    59.940060 Hz  16:9     31.469 kHz     27.000000 MHz
    VIC   4:  1280x720    60.000000 Hz  16:9     45.000 kHz     74.250000 MHz
    VIC   5:  1920x1080i  60.000000 Hz  16:9     33.750 kHz     74.250000 MHz
    VIC   6:  1440x480i   59.940060 Hz   4:3     15.734 kHz     27.000000 MHz
    VIC   7:  1440x480i   59.940060 Hz  16:9     15.734 kHz     27.000000 MHz
    VIC  16:  1920x1080   60.000000 Hz  16:9     67.500 kHz    148.500000 MHz
    VIC  17:   720x576    50.000000 Hz   4:3     31.250 kHz     27.000000 MHz
    VIC  18:   720x576    50.000000 Hz  16:9     31.250 kHz     27.000000 MHz
    VIC  19:  1280x720    50.000000 Hz  16:9     37.500 kHz     74.250000 MHz
    VIC  20:  1920x1080i  50.000000 Hz  16:9     28.125 kHz     74.250000 MHz
    VIC  31:  1920x1080   50.000000 Hz  16:9     56.250 kHz    148.500000 MHz
    VIC  32:  1920x1080   24.000000 Hz  16:9     27.000 kHz     74.250000 MHz
    VIC  33:  1920x1080   25.000000 Hz  16:9     28.125 kHz     74.250000 MHz
    VIC  34:  1920x1080   30.000000 Hz  16:9     33.750 kHz     74.250000 MHz
  Audio Data Block:
    Linear PCM:
      Max channels: 2
      Supported sample rates (kHz): 96 88.2 48 44.1 32
      Supported sample sizes (bits): 24 20 16
  Speaker Allocation Data Block:
    FL/FR - Front Left/Right
  Vendor-Specific Data Block (HDMI), OUI 00-0C-03:
    Source physical address: 1.0.0.0
  Detailed Timing Descriptors:
    DTD  7:  1920x1080i  50.000000 Hz  16:9     28.125 kHz     74.250000 MHz (1600 mm x 900 mm)
                  Hfront  528 Hsync  44 Hback  148 Hpol P
                  Vfront    2 Vsync   5 Vback   15 Vpol P Vfront +0.5 Odd Field
                  Vfront    2 Vsync   5 Vback   15 Vpol P Vback  +0.5 Even Field
    DTD  8:  1920x1080i  60.000000 Hz  16:9     33.750 kHz     74.250000 MHz (1600 mm x 900 mm)
                  Hfront   88 Hsync  44 Hback  148 Hpol N
                  Vfront    2 Vsync   5 Vback   15 Vpol N Vfront +0.5 Odd Field
                  Vfront    2 Vsync   5 Vback   15 Vpol N Vback  +0.5 Even Field
    DTD  9:  1280x720    50.000000 Hz  16:9     37.500 kHz     74.250000 MHz (1600 mm x 900 mm)
                  Hfront  440 Hsync  40 Hback  220 Hpol P
                  Vfront    5 Vsync   5 Vback   20 Vpol P
    DTD 10:  1920x1080   50.000000 Hz  16:9     56.250 kHz    148.500000 MHz (1600 mm x 900 mm)
                  Hfront  528 Hsync  44 Hback  148 Hpol P
                  Vfront    4 Vsync   5 Vback   36 Vpol P
Checksum: 0x2e  Unused space in Extension Block: 20 bytes

----------------

Warnings:

Block 1, CTA-861 Extension Block:
  IT Video Formats are overscanned by default, but normally this should be underscanned.
  Video Data Block: VIC 1 is the preferred timing, overriding the first detailed timings. Is this intended?
  Detailed Timing Descriptor #4: DTD is similar but not identical to VIC 5.
  Add a Colorimetry Data Block with the sRGB colorimetry bit set to avoid interop issues.
Block 3, CTA-861 Extension Block:
  IT Video Formats are overscanned by default, but normally this should be underscanned.
  Detailed Timing Descriptor #8: DTD is similar but not identical to VIC 5.
  Add a Colorimetry Data Block with the sRGB colorimetry bit set to avoid interop issues.

Failures:

Block 0, Base EDID:
  Detailed Timing Descriptor #1: Mismatch of image size 1600x900 mm vs display size 510x290 mm.
  Detailed Timing Descriptor #2: Mismatch of image size 1600x900 mm vs display size 510x290 mm.
Block 1, CTA-861 Extension Block:
  Detailed Timing Descriptor #3: Mismatch of image size 1600x900 mm vs display size 510x290 mm.
  Detailed Timing Descriptor #4: Mismatch of image size 1600x900 mm vs display size 510x290 mm.
  Detailed Timing Descriptor #5: Mismatch of image size 1600x900 mm vs display size 510x290 mm.
  Detailed Timing Descriptor #6: Mismatch of image size 1600x900 mm vs display size 510x290 mm.
  Missing VCDB, needed for Set Selectable RGB Quantization to avoid interop issues.
Block 2, Base EDID:
  Unknown Extension Block.
Block 3, CTA-861 Extension Block:
  Video Data Block: Duplicate VIC 1.
  Video Data Block: Duplicate VIC 2.
  Video Data Block: Duplicate VIC 3.
  Video Data Block: Duplicate VIC 4.
  Video Data Block: Duplicate VIC 5.
  Video Data Block: Duplicate VIC 6.
  Video Data Block: Duplicate VIC 7.
  Video Data Block: Duplicate VIC 16.
  Video Data Block: Duplicate VIC 17.
  Video Data Block: Duplicate VIC 18.
  Video Data Block: Duplicate VIC 19.
  Video Data Block: Duplicate VIC 20.
  Video Data Block: Duplicate VIC 31.
  Video Data Block: Duplicate VIC 32.
  Video Data Block: Duplicate VIC 33.
  Video Data Block: Duplicate VIC 34.
  Speaker Allocation Data Block: Only one instance of this Data Block is allowed.
  Detailed Timing Descriptor #7: Mismatch of image size 1600x900 mm vs display size 510x290 mm.
  Detailed Timing Descriptor #8: Mismatch of image size 1600x900 mm vs display size 510x290 mm.
  Detailed Timing Descriptor #9: Mismatch of image size 1600x900 mm vs display size 510x290 mm.
  Detailed Timing Descriptor #10: Mismatch of image size 1600x900 mm vs display size 510x290 mm.
  Missing VCDB, needed for Set Selectable RGB Quantization to avoid interop issues.
EDID:
  Base EDID: Some timings are out of range of the Monitor Ranges:
    Vertical Freq: 24.000 - 75.029 Hz (Monitor: 48.000 - 62.000 Hz)
  Base EDID: The DTD max image size is 1600x900mm, which is larger than the display size 510.0x290.0mm.
  Base EDID: EDID specified 1 extension block(s), but found 3 extension block(s).
  Base EDID: EDID 1.3 requires a Block Map Extension in Block 1 if there are more than 2 blocks in the EDID.

EDID conformity: FAIL
