edid-decode (hex):

00 ff ff ff ff ff ff 00 4e 81 ca 5d 00 00 00 00
04 1f 01 04 95 1a 0e 78 0a 7a 80 93 58 5d 92 26
1c 50 54 00 00 00 01 01 01 01 01 01 01 01 01 01
01 01 01 01 01 01 a4 1f 56 86 50 00 84 30 28 20
55 00 00 90 10 00 00 18 00 00 00 fe 00 00 00 00
00 00 00 00 00 00 00 00 00 00 00 00 00 fe 00 53
54 41 52 52 20 20 20 20 20 20 20 20 00 00 00 fe
00 58 52 31 31 36 45 44 32 54 20 20 20 0a 00 a6

----------------

Block 0, Base EDID:
  EDID Structure Version & Revision: 1.4
  Vendor & Product Identification:
    Manufacturer: STA
    Model: 24010
    Made in: week 4 of 2021
  Basic Display Parameters & Features:
    Digital display
    Bits per primary color channel: 6
    DisplayPort interface
    Maximum image size: 26 cm x 14 cm
    Gamma: 2.20
    Supported color formats: RGB 4:4:4, YCrCb 4:4:4
    First detailed timing includes the native pixel format and preferred refresh rate
  Color Characteristics:
    Red  : 0.5751, 0.3466
    Green: 0.3652, 0.5722
    Blue : 0.1503, 0.1093
    White: 0.3125, 0.3281
  Established Timings I & II: none
  Standard Timings: none
  Detailed Timing Descriptors:
    DTD 1:  1366x768    60.000000 Hz 683:384   54.000 kHz     81.000000 MHz (256 mm x 144 mm)
                 Hfront   40 Hsync  32 Hback   62 Hpol N
                 Vfront    5 Vsync   5 Vback  122 Vpol N
    Alphanumeric Data String: ''
    Alphanumeric Data String: 'STARR        '
    Alphanumeric Data String: 'XR116ED2T   '
Checksum: 0xa6

----------------

Warnings:

Block 0, Base EDID:
  Missing Display Product Name.

Failures:

Block 0, Base EDID:
  Alphanumeric Data String: Non-printable character.
  Alphanumeric Data String: One or more trailing spaces.
  Alphanumeric Data String: One or more trailing spaces.

EDID conformity: FAIL
