edid-decode (hex):

00 ff ff ff ff ff ff 00 4c a3 58 42 00 00 00 00
00 0e 01 03 80 1d 15 78 0a 87 f5 94 57 4f 8c 27
27 50 54 00 00 00 01 01 01 01 01 01 01 01 01 01
01 01 01 01 01 01 64 19 00 40 41 00 26 30 18 88
36 00 1e d6 10 00 00 19 28 15 00 40 41 00 26 30
18 88 36 00 1e d6 10 00 00 19 00 00 00 fe 00 48
34 34 30 30 03 31 34 31 58 42 0a 20 00 00 00 fe
00 e8 d0 c0 b8 90 60 30 00 01 01 0a 20 20 00 a0

----------------

Block 0, Base EDID:
  EDID Structure Version & Revision: 1.3
  Vendor & Product Identification:
    Manufacturer: SEC
    Model: 16984
    Made in: 2004
  Basic Display Parameters & Features:
    Digital display
    Maximum image size: 29 cm x 21 cm
    Gamma: 2.20
    RGB color display
    First detailed timing is preferred timing
  Color Characteristics:
    Red  : 0.5800, 0.3398
    Green: 0.3095, 0.5498
    Blue : 0.1552, 0.1552
    White: 0.3134, 0.3291
  Established Timings I & II: none
  Standard Timings: none
  Detailed Timing Descriptors:
    DTD 1:  1024x768    60.004 Hz   4:3    48.363 kHz  65.000 MHz (DE timing only, 286 mm x 214 mm)
                 Hfront   24 Hsync 136 Hback 160 Hpol N
                 Vfront    3 Vsync   6 Vback  29 Vpol N
    DTD 2:  1024x768    49.997 Hz   4:3    40.298 kHz  54.160 MHz (DE timing only, 286 mm x 214 mm)
                 Hfront   24 Hsync 136 Hback 160 Hpol N
                 Vfront    3 Vsync   6 Vback  29 Vpol N
    SPWG Module Revision: 25
    SPWG Descriptor #3:
      SPWG PC Maker P/N: 'H4400'
      SPWG LCD Supplier EEDID Revision: 3
      SPWG Manufacturer P/N: '141XB'
    SPWG Descriptor #4:
      SMBUS Values: 0xe8 0xd0 0xc0 0xb8 0x90 0x60 0x30 0x00
      LVDS Channels: 1
      Panel Self Test Present
Checksum: 0xa0

----------------

Failures:

Block 0, Base EDID:
  Missing Display Product Name.
  Missing Display Range Limits Descriptor.

EDID conformity: FAIL
