
EDID (hex):
00ffffffffffff00220e783301010101
221b0104b54728783f9145a7554ea025
0c5054a10800d1c081c081809500a9c0
a940b300d100565e00a0a0a029503020
3500c48f2100001a000000fc004f4d45
4e206279204850203332000000fd0030
4b73731e010a202020202020000000ff
00434e43373334313432480a20200129
02030eb149101f04130302121101023a
801871382d40582c4500c48f2100001e
023a80d072382d40102c4580c48f2100
001e48730050a0a0345008206808c48f
2100001a000000000000000000000000
00000000000000000000000000000000
00000000000000000000000000000000
00000000000000000000000000000014

Extracted contents:
header:          00 ff ff ff ff ff ff 00
serial number:   22 0e 78 33 01 01 01 01 22 1b
version:         01 04
basic params:    b5 47 28 78 3f
chroma info:     91 45 a7 55 4e a0 25 0c 50 54
established:     a1 08 00
standard:        d1 c0 81 c0 81 80 95 00 a9 c0 a9 40 b3 00 d1 00
descriptor 1:    56 5e 00 a0 a0 a0 29 50 30 20 35 00 c4 8f 21 00 00 1a
descriptor 2:    00 00 00 fc 00 4f 4d 45 4e 20 62 79 20 48 50 20 33 32
descriptor 3:    00 00 00 fd 00 30 4b 73 73 1e 01 0a 20 20 20 20 20 20
descriptor 4:    00 00 00 ff 00 43 4e 43 37 33 34 31 34 32 48 0a 20 20
extensions:      01
checksum:        29

EDID version: 1.4
Manufacturer: HPN Model 3378 Serial Number --
Made in week 34 of 2017
Digital display
10 bits per primary color channel
DisplayPort interface
Maximum image size: 71 cm x 40 cm
Gamma: 2.20
DPMS levels: Off
Supported color formats: RGB 4:4:4, YCrCb 4:4:4, YCrCb 4:2:2
Default (sRGB) color space is primary color space
First detailed timing includes the native pixel format and preferred refresh rate
Display is continuous frequency
Display x,y Chromaticity:
  Red:   0.6542, 0.3330
  Green: 0.3046, 0.6259
  Blue:  0.1455, 0.0468
  White: 0.3134, 0.3291
Established timings supported:
  720x400@70Hz 9:5 HorFreq: 31469 Hz Clock: 28.320 MHz
  640x480@60Hz 4:3 HorFreq: 31469 Hz Clock: 25.175 MHz
  800x600@60Hz 4:3 HorFreq: 37900 Hz Clock: 40.000 MHz
  1024x768@60Hz 4:3 HorFreq: 48400 Hz Clock: 65.000 MHz
Standard timings supported:
  1920x1080@60Hz 16:9
  1280x720@60Hz 16:9
  1280x1024@60Hz 5:4 HorFreq: 64000 Hz Clock: 108.000 MHz
  1440x900@60Hz 16:10 HorFreq: 55500 Hz Clock: 88.750 MHz
  1600x900@60Hz 16:9
  1600x1200@60Hz 4:3 HorFreq: 75000 Hz Clock: 162.000 MHz
  1680x1050@60Hz 16:10 HorFreq: 64700 Hz Clock: 119.000 MHz
  1920x1200@60Hz 16:10 HorFreq: 74000 Hz Clock: 154.000 MHz
Detailed mode: Clock 241.500 MHz, 708 mm x 399 mm
               2560 2608 2640 2720 hborder 0
               1440 1443 1448 1481 vborder 0
               +hsync -vsync 
               VertFreq: 59 Hz, HorFreq: 88786 Hz
Monitor ranges (bare limits): 48-75Hz V, 115-115kHz H, max dotclock 300MHz
Serial number: --
Has 1 extension blocks
Checksum: 0x29 (valid)

CTA extension block
Extension version: 3
10 bytes of CTA data
  Video data block
    VIC  16 1920x1080@60Hz 16:9  HorFreq: 67500 Hz Clock: 148.500 MHz
    VIC  31 1920x1080@50Hz 16:9  HorFreq: 56250 Hz Clock: 148.500 MHz
    VIC   4 1280x720@60Hz 16:9  HorFreq: 45000 Hz Clock: 74.250 MHz
    VIC  19 1280x720@50Hz 16:9  HorFreq: 37500 Hz Clock: 74.250 MHz
    VIC   3 720x480@60Hz 16:9  HorFreq: 31469 Hz Clock: 27.000 MHz
    VIC   2 720x480@60Hz 4:3  HorFreq: 31469 Hz Clock: 27.000 MHz
    VIC  18 720x576@50Hz 16:9  HorFreq: 31250 Hz Clock: 27.000 MHz
    VIC  17 720x576@50Hz 4:3  HorFreq: 31250 Hz Clock: 27.000 MHz
    VIC   1 640x480@60Hz 4:3  HorFreq: 31469 Hz Clock: 25.175 MHz
Underscans PC formats by default
Supports YCbCr 4:4:4
Supports YCbCr 4:2:2
1 native detailed modes
Detailed mode: Clock 148.500 MHz, 708 mm x 399 mm
               1920 2008 2052 2200 hborder 0
               1080 1084 1089 1125 vborder 0
               +hsync +vsync 
               VertFreq: 60 Hz, HorFreq: 67500 Hz
Detailed mode: Clock 148.500 MHz, 708 mm x 399 mm
               1920 2448 2492 2640 hborder 0
               1080 1084 1089 1125 vborder 0
               +hsync +vsync 
               VertFreq: 50 Hz, HorFreq: 56250 Hz
Detailed mode: Clock 295.120 MHz, 708 mm x 399 mm
               2560 2568 2600 2640 hborder 0
               1440 1478 1486 1492 vborder 0
               +hsync -vsync 
               VertFreq: 74 Hz, HorFreq: 111787 Hz
Checksum: 0x14 (valid)

EDID block does NOT conform to EDID 1.4!
	sRGB is signaled, but the chromaticities do not match
	Name descriptor not terminated with a newline
Warning: One or more of the timings is out of range of the Monitor Ranges:
  Vertical Freq: 50 - 74 Hz
  Horizontal Freq: 31250 - 111787 Hz
  Maximum Clock: 295.120 MHz
EDID block does not conform at all!
	Both the serial number and the serial string are set


