
EDID (hex):
00ffffffffffff004c2d150e56505130
0b1d0103803c22782a4935ad5146a927
0f5054bfef80714f810081c081809500
a9c0b300010121e9007ea0a067501f20
f80c56502100001a000000fd0018901e
e13c000a202020202020000000fc0043
3237484737780a2020202020000000ff
004854484d3330303233310a2020016d
02033ff14e90611f0413605d5e202122
5f03122309070783010000e305c0006d
030c001000b83c20006001020367d85d
c401788003e6060501735a17e20f2202
3a801871382d40582c45005650210000
1e565e00a0a0a0295030203500565021
00001a00000000000000000000000000
000000000000000000000000000000a8

Extracted contents:
header:          00 ff ff ff ff ff ff 00
serial number:   4c 2d 15 0e 56 50 51 30 0b 1d
version:         01 03
basic params:    80 3c 22 78 2a
chroma info:     49 35 ad 51 46 a9 27 0f 50 54
established:     bf ef 80
standard:        71 4f 81 00 81 c0 81 80 95 00 a9 c0 b3 00 01 01
descriptor 1:    21 e9 00 7e a0 a0 67 50 1f 20 f8 0c 56 50 21 00 00 1a
descriptor 2:    00 00 00 fd 00 18 90 1e e1 3c 00 0a 20 20 20 20 20 20
descriptor 3:    00 00 00 fc 00 43 32 37 48 47 37 78 0a 20 20 20 20 20
descriptor 4:    00 00 00 ff 00 48 54 48 4d 33 30 30 32 33 31 0a 20 20
extensions:      01
checksum:        6d

EDID version: 1.3
Manufacturer: SAM Model e15 Serial Number --
Made in week 11 of 2019
Digital display
Maximum image size: 60 cm x 34 cm
Gamma: 2.20
DPMS levels: Off
RGB color display
First detailed timing is preferred timing
Display x,y Chromaticity:
  Red:   0.6767, 0.3164
  Green: 0.2753, 0.6611
  Blue:  0.1523, 0.0615
  White: 0.3134, 0.3291
Established timings supported:
  720x400@70Hz 9:5 HorFreq: 31469 Hz Clock: 28.320 MHz
  640x480@60Hz 4:3 HorFreq: 31469 Hz Clock: 25.175 MHz
  640x480@67Hz 4:3 HorFreq: 35000 Hz Clock: 30.240 MHz
  640x480@72Hz 4:3 HorFreq: 37900 Hz Clock: 31.500 MHz
  640x480@75Hz 4:3 HorFreq: 37500 Hz Clock: 31.500 MHz
  800x600@56Hz 4:3 HorFreq: 35200 Hz Clock: 36.000 MHz
  800x600@60Hz 4:3 HorFreq: 37900 Hz Clock: 40.000 MHz
  800x600@72Hz 4:3 HorFreq: 48100 Hz Clock: 50.000 MHz
  800x600@75Hz 4:3 HorFreq: 46900 Hz Clock: 49.500 MHz
  832x624@75Hz 4:3 HorFreq: 49726 Hz Clock: 57.284 MHz
  1024x768@60Hz 4:3 HorFreq: 48400 Hz Clock: 65.000 MHz
  1024x768@70Hz 4:3 HorFreq: 56500 Hz Clock: 75.000 MHz
  1024x768@75Hz 4:3 HorFreq: 60000 Hz Clock: 78.750 MHz
  1280x1024@75Hz 5:4 HorFreq: 80000 Hz Clock: 135.000 MHz
  1152x870@75Hz 192:145 HorFreq: 67500 Hz Clock: 108.000 MHz
Standard timings supported:
  1152x864@75Hz 4:3 HorFreq: 67500 Hz Clock: 108.000 MHz
  1280x800@60Hz 16:10
  1280x720@60Hz 16:9
  1280x1024@60Hz 5:4 HorFreq: 64000 Hz Clock: 108.000 MHz
  1440x900@60Hz 16:10 HorFreq: 55500 Hz Clock: 88.750 MHz
  1600x900@60Hz 16:9
  1680x1050@60Hz 16:10 HorFreq: 64700 Hz Clock: 119.000 MHz
Detailed mode: Clock 596.810 MHz, 598 mm x 336 mm
               2560 2591 2623 2686 hborder 0
               1440 1503 1511 1543 vborder 0
               +hsync -vsync 
               VertFreq: 144 Hz, HorFreq: 222192 Hz
Monitor ranges (GTF): 24-144Hz V, 30-225kHz H, max dotclock 600MHz
Monitor name: C27HG7x
Serial number: --
Has 1 extension blocks
Checksum: 0x6d (valid)

CTA extension block
Extension version: 3
59 bytes of CTA data
  Video data block
    VIC  16 1920x1080@60Hz 16:9 (native) HorFreq: 67500 Hz Clock: 148.500 MHz
    VIC  97 3840x2160@60Hz 16:9  HorFreq: 135000 Hz Clock: 594.000 MHz
    VIC  31 1920x1080@50Hz 16:9  HorFreq: 56250 Hz Clock: 148.500 MHz
    VIC   4 1280x720@60Hz 16:9  HorFreq: 45000 Hz Clock: 74.250 MHz
    VIC  19 1280x720@50Hz 16:9  HorFreq: 37500 Hz Clock: 74.250 MHz
    VIC  96 3840x2160@50Hz 16:9  HorFreq: 112500 Hz Clock: 594.000 MHz
    VIC  93 3840x2160@24Hz 16:9  HorFreq: 54000 Hz Clock: 297.000 MHz
    VIC  94 3840x2160@25Hz 16:9  HorFreq: 56250 Hz Clock: 297.000 MHz
    VIC  32 1920x1080@24Hz 16:9  HorFreq: 27000 Hz Clock: 74.250 MHz
    VIC  33 1920x1080@25Hz 16:9  HorFreq: 28125 Hz Clock: 74.250 MHz
    VIC  34 1920x1080@30Hz 16:9  HorFreq: 33750 Hz Clock: 74.250 MHz
    VIC  95 3840x2160@30Hz 16:9  HorFreq: 67500 Hz Clock: 297.000 MHz
    VIC   3 720x480@60Hz 16:9  HorFreq: 31469 Hz Clock: 27.000 MHz
    VIC  18 720x576@50Hz 16:9  HorFreq: 31250 Hz Clock: 27.000 MHz
  Audio data block
    Linear PCM, max channels 2
      Supported sample rates (kHz): 48 44.1 32
      Supported sample sizes (bits): 24 20 16
  Speaker allocation data block
    Speaker map:
      FL/FR - Front Left/Right
  Extended tag: Colorimetry data block
    BT2020YCC
    BT2020RGB
  Vendor-specific data block, OUI 000c03 (HDMI)
    Source physical address 1.0.0.0
    Supports_AI
    DC_36bit
    DC_30bit
    DC_Y444
    Maximum TMDS clock: 300MHz
    Extended HDMI video details:
      HDMI VIC 1 3840x2160@30Hz 16:9 HorFreq: 67500 Hz Clock: 297.000 MHz
      HDMI VIC 2 3840x2160@25Hz 16:9 HorFreq: 56250 Hz Clock: 297.000 MHz
      HDMI VIC 3 3840x2160@24Hz 16:9 HorFreq: 54000 Hz Clock: 297.000 MHz
  Vendor-specific data block, OUI c45dd8 (HDMI Forum)
    Version: 1
    Maximum TMDS Character Rate: 600MHz
    SCDC Present
    Supports 12-bits/component Deep Color 4:2:0 Pixel Encoding
    Supports 10-bits/component Deep Color 4:2:0 Pixel Encoding
  Extended tag: HDR static metadata data block
    Electro optical transfer functions:
      Traditional gamma - SDR luminance range
      SMPTE ST2084
    Supported static metadata descriptors:
      Static metadata type 1
    Desired content max luminance: 115 (603.666 cd/m^2)
    Desired content max frame-average luminance: 90 (351.250 cd/m^2)
    Desired content min luminance: 23 (0.049 cd/m^2)
  Extended tag: YCbCr 4:2:0 capability map data block
    VSD Index 1
    VSD Index 5
Underscans PC formats by default
Basic audio support
Supports YCbCr 4:4:4
Supports YCbCr 4:2:2
1 native detailed modes
Detailed mode: Clock 148.500 MHz, 598 mm x 336 mm
               1920 2008 2052 2200 hborder 0
               1080 1084 1089 1125 vborder 0
               +hsync +vsync 
               VertFreq: 60 Hz, HorFreq: 67500 Hz
Detailed mode: Clock 241.500 MHz, 598 mm x 336 mm
               2560 2608 2640 2720 hborder 0
               1440 1443 1448 1481 vborder 0
               +hsync -vsync 
               VertFreq: 59 Hz, HorFreq: 88786 Hz
Checksum: 0xa8 (valid)

One or more of the timings is out of range of the Monitor Ranges:
  Vertical Freq: 24 - 144 Hz
  Horizontal Freq: 27000 - 222192 Hz
  Maximum Clock: 596.810 MHz
EDID block does not conform at all!
	Both the serial number and the serial string are set
