
EDID (hex):
00ffffffffffff0020a3000027010000
0a200103807a44780ab081a65046a526
0e5054adcf00714f8140818081009500
b300d1c081c004740030f2705a80b058
8a0020c23100001e023a801871382d40
582c450020c23100001e000000fc0035
3555360a2020202020202020000000fd
00174c0f5122000a2020202020200177
020348714e5f5d646210222005043e3c
0201062c090707150750570701670403
6d030c004000b83c200060010304e200
cfe30e6166e61146d0007000eb0146d0
00481f5a8c4a5774011d007251d01e20
6e28550020c23100001e662150b05100
1b304070360000000000001800000000
0000000000000000000000000000006a

edid-decode (hex):

00 ff ff ff ff ff ff 00 20 a3 00 00 27 01 00 00
0a 20 01 03 80 7a 44 78 0a b0 81 a6 50 46 a5 26
0e 50 54 ad cf 00 71 4f 81 40 81 80 81 00 95 00
b3 00 d1 c0 81 c0 04 74 00 30 f2 70 5a 80 b0 58
8a 00 20 c2 31 00 00 1e 02 3a 80 18 71 38 2d 40
58 2c 45 00 20 c2 31 00 00 1e 00 00 00 fc 00 35
35 55 36 0a 20 20 20 20 20 20 20 20 00 00 00 fd
00 17 4c 0f 51 22 00 0a 20 20 20 20 20 20 01 77

02 03 48 71 4e 5f 5d 64 62 10 22 20 05 04 3e 3c
02 01 06 2c 09 07 07 15 07 50 57 07 01 67 04 03
6d 03 0c 00 40 00 b8 3c 20 00 60 01 03 04 e2 00
cf e3 0e 61 66 e6 11 46 d0 00 70 00 eb 01 46 d0
00 48 1f 5a 8c 4a 57 74 01 1d 00 72 51 d0 1e 20
6e 28 55 00 20 c2 31 00 00 1e 66 21 50 b0 51 00
1b 30 40 70 36 00 00 00 00 00 00 18 00 00 00 00
00 00 00 00 00 00 00 00 00 00 00 00 00 00 00 6a

----------------

Block 0, Base EDID:
  EDID Structure Version & Revision: 1.3
  Vendor & Product Identification:
    Manufacturer: HEC
    Model: 0
    Serial Number: 295
    Made in: week 10 of 2022
  Basic Display Parameters & Features:
    Digital display
    Maximum image size: 122 cm x 68 cm
    Gamma: 2.20
    RGB color display
    First detailed timing is the preferred timing
  Color Characteristics:
    Red  : 0.6503, 0.3154
    Green: 0.2734, 0.6445
    Blue : 0.1503, 0.0546
    White: 0.3125, 0.3291
  Established Timings I & II:
    IBM     :   720x400    70.081663 Hz   9:5     31.467 kHz     28.320000 MHz
    DMT 0x04:   640x480    59.940476 Hz   4:3     31.469 kHz     25.175000 MHz
    DMT 0x05:   640x480    72.808802 Hz   4:3     37.861 kHz     31.500000 MHz
    DMT 0x06:   640x480    75.000000 Hz   4:3     37.500 kHz     31.500000 MHz
    DMT 0x09:   800x600    60.316541 Hz   4:3     37.879 kHz     40.000000 MHz
    DMT 0x0a:   800x600    72.187572 Hz   4:3     48.077 kHz     50.000000 MHz
    DMT 0x0b:   800x600    75.000000 Hz   4:3     46.875 kHz     49.500000 MHz
    DMT 0x10:  1024x768    60.003840 Hz   4:3     48.363 kHz     65.000000 MHz
    DMT 0x11:  1024x768    70.069359 Hz   4:3     56.476 kHz     75.000000 MHz
    DMT 0x12:  1024x768    75.028582 Hz   4:3     60.023 kHz     78.750000 MHz
    DMT 0x24:  1280x1024   75.024675 Hz   5:4     79.976 kHz    135.000000 MHz
  Standard Timings:
    DMT 0x15:  1152x864    75.000000 Hz   4:3     67.500 kHz    108.000000 MHz
    DMT 0x20:  1280x960    60.000000 Hz   4:3     60.000 kHz    108.000000 MHz
    DMT 0x23:  1280x1024   60.019740 Hz   5:4     63.981 kHz    108.000000 MHz
    DMT 0x1c:  1280x800    59.810326 Hz  16:10    49.702 kHz     83.500000 MHz
    DMT 0x2f:  1440x900    59.887445 Hz  16:10    55.935 kHz    106.500000 MHz
    DMT 0x3a:  1680x1050   59.954250 Hz  16:10    65.290 kHz    146.250000 MHz
    DMT 0x52:  1920x1080   60.000000 Hz  16:9     67.500 kHz    148.500000 MHz
    DMT 0x55:  1280x720    60.000000 Hz  16:9     45.000 kHz     74.250000 MHz
  Detailed Timing Descriptors:
    DTD 1:  3840x2160   30.000000 Hz  16:9     67.500 kHz    297.000000 MHz (800 mm x 450 mm)
                 Hfront  176 Hsync  88 Hback  296 Hpol P
                 Vfront    8 Vsync  10 Vback   72 Vpol P
    DTD 2:  1920x1080   60.000000 Hz  16:9     67.500 kHz    148.500000 MHz (800 mm x 450 mm)
                 Hfront   88 Hsync  44 Hback  148 Hpol P
                 Vfront    4 Vsync   5 Vback   36 Vpol P
    Display Product Name: '55U6'
    Display Range Limits:
      Monitor ranges (GTF): 23-76 Hz V, 15-81 kHz H, max dotclock 340 MHz
  Extension blocks: 1
Checksum: 0x77

----------------

Block 1, CTA-861 Extension Block:
  Revision: 3
  Basic audio support
  Supports YCbCr 4:4:4
  Supports YCbCr 4:2:2
  Native detailed modes: 1
  Video Data Block:
    VIC  95:  3840x2160   30.000000 Hz  16:9     67.500 kHz    297.000000 MHz
    VIC  93:  3840x2160   24.000000 Hz  16:9     54.000 kHz    297.000000 MHz
    VIC 100:  4096x2160   30.000000 Hz 256:135   67.500 kHz    297.000000 MHz
    VIC  98:  4096x2160   24.000000 Hz 256:135   54.000 kHz    297.000000 MHz
    VIC  16:  1920x1080   60.000000 Hz  16:9     67.500 kHz    148.500000 MHz
    VIC  34:  1920x1080   30.000000 Hz  16:9     33.750 kHz     74.250000 MHz
    VIC  32:  1920x1080   24.000000 Hz  16:9     27.000 kHz     74.250000 MHz
    VIC   5:  1920x1080i  60.000000 Hz  16:9     33.750 kHz     74.250000 MHz
    VIC   4:  1280x720    60.000000 Hz  16:9     45.000 kHz     74.250000 MHz
    VIC  62:  1280x720    30.000000 Hz  16:9     22.500 kHz     74.250000 MHz
    VIC  60:  1280x720    24.000000 Hz  16:9     18.000 kHz     59.400000 MHz
    VIC   2:   720x480    59.940060 Hz   4:3     31.469 kHz     27.000000 MHz
    VIC   1:   640x480    59.940476 Hz   4:3     31.469 kHz     25.175000 MHz
    VIC   6:  1440x480i   59.940060 Hz   4:3     15.734 kHz     27.000000 MHz
  Audio Data Block:
    Linear PCM:
      Max channels: 2
      Supported sample rates (kHz): 48 44.1 32
      Supported sample sizes (bits): 24 20 16
    AC-3:
      Max channels: 6
      Supported sample rates (kHz): 48 44.1 32
      Maximum bit rate: 640 kb/s
    Enhanced AC-3 (DD+):
      Max channels: 8
      Supported sample rates (kHz): 48 44.1 32
      Supports Joint Object Coding
    MAT (MLP):
      Max channels: 8
      Supported sample rates (kHz): 48
      Supports Dolby TrueHD, object audio PCM and channel-based PCM
      Hash calculation not required for object audio PCM or channel-based PCM
  Vendor-Specific Data Block (HDMI), OUI 00-0C-03:
    Source physical address: 4.0.0.0
    Supports_AI
    DC_36bit
    DC_30bit
    DC_Y444
    Maximum TMDS clock: 300 MHz
    Extended HDMI video details:
      HDMI VICs:
        HDMI VIC 1:  3840x2160   30.000000 Hz  16:9     67.500 kHz    297.000000 MHz
        HDMI VIC 3:  3840x2160   24.000000 Hz  16:9     54.000 kHz    297.000000 MHz
        HDMI VIC 4:  4096x2160   24.000000 Hz 256:135   54.000 kHz    297.000000 MHz
  Video Capability Data Block:
    YCbCr quantization: Selectable (via AVI YQ)
    RGB quantization: Selectable (via AVI Q)
    PT scan behavior: No Data
    IT scan behavior: Supports both over- and underscan
    CE scan behavior: Supports both over- and underscan
  YCbCr 4:2:0 Video Data Block:
    VIC  97:  3840x2160   60.000000 Hz  16:9    135.000 kHz    594.000000 MHz
    VIC 102:  4096x2160   60.000000 Hz 256:135  135.000 kHz    594.000000 MHz
  Vendor-Specific Audio Data Block (Dolby), OUI 00-D0-46:
    Version: 1 (7 bytes)
    Height speaker zone present
    Surround speaker zone present
    Center speaker zone present
  Vendor-Specific Video Data Block (Dolby), OUI 00-D0-46:
    Version: 2 (12 bytes)
    Supports global dimming
    DM Version: 4.x
    Backlt Min Luma: 100 cd/m^2
    Interface: Standard + Low-Latency
    Supports 10b 12b 444: Not supported
    Target Min PQ v2: 60 (0.00478965 cd/m^2)
    Target Max PQ v2: 2770 (518 cd/m^2)
    Unique Rx, Ry: 0.66406250, 0.30468750
    Unique Gx, Gy: 0.27343750, 0.64453125
    Unique Bx, By: 0.15234375, 0.04687500
  Detailed Timing Descriptors:
    DTD 3:  1280x720    60.000000 Hz  16:9     45.000 kHz     74.250000 MHz (800 mm x 450 mm)
                 Hfront  110 Hsync  40 Hback  220 Hpol P
                 Vfront    5 Vsync   5 Vback   20 Vpol P
    DTD 4:  1360x768    60.015162 Hz  85:48    47.712 kHz     85.500000 MHz
                 Hfront   64 Hsync 112 Hback  256 Hpol N
                 Vfront    3 Vsync   6 Vback   18 Vpol N
Checksum: 0x6a  Unused space in Extension Block: 19 bytes
