
EDID (hex):
00ffffffffffff0004729a00da4d1091
0b13010380331d78ea6085a6564a9c25
125054b30c008180714f81009500a940
010101010101023a801871382d40582c
4500fe1f1100001a000000fc00583233
33480a20202020202020000000fd0038
4c1f5312000a202020202020000000ff
004c464d3043303233343034310a0012

Extracted contents:
header:          00 ff ff ff ff ff ff 00
serial number:   04 72 9a 00 da 4d 10 91 0b 13
version:         01 03
basic params:    80 33 1d 78 ea
chroma info:     60 85 a6 56 4a 9c 25 12 50 54
established:     b3 0c 00
standard:        81 80 71 4f 81 00 95 00 a9 40 01 01 01 01 01 01
descriptor 1:    02 3a 80 18 71 38 2d 40 58 2c 45 00 fe 1f 11 00 00 1a
descriptor 2:    00 00 00 fc 00 58 32 33 33 48 0a 20 20 20 20 20 20 20
descriptor 3:    00 00 00 fd 00 38 4c 1f 53 12 00 0a 20 20 20 20 20 20
descriptor 4:    00 00 00 ff 00 4c 46 4d 30 43 30 32 33 34 30 34 31 0a
extensions:      00
checksum:        12

EDID version: 1.3
Manufacturer: ACR Model 9a Serial Number --
Made in week 11 of 2009
Digital display
Maximum image size: 51 cm x 29 cm
Gamma: 2.20
DPMS levels: Standby Suspend Off
RGB color display
First detailed timing is preferred timing
Display x,y Chromaticity:
  Red:   0.6494, 0.3378
  Green: 0.2890, 0.6093
  Blue:  0.1464, 0.0703
  White: 0.3134, 0.3291
Established timings supported:
  720x400@70Hz 9:5 HorFreq: 31469 Hz Clock: 28.320 MHz
  640x480@60Hz 4:3 HorFreq: 31469 Hz Clock: 25.175 MHz
  640x480@67Hz 4:3 HorFreq: 35000 Hz Clock: 30.240 MHz
  800x600@56Hz 4:3 HorFreq: 35200 Hz Clock: 36.000 MHz
  800x600@60Hz 4:3 HorFreq: 37900 Hz Clock: 40.000 MHz
  1024x768@60Hz 4:3 HorFreq: 48400 Hz Clock: 65.000 MHz
  1024x768@70Hz 4:3 HorFreq: 56500 Hz Clock: 75.000 MHz
Standard timings supported:
  1280x1024@60Hz 5:4 HorFreq: 64000 Hz Clock: 108.000 MHz
  1152x864@75Hz 4:3 HorFreq: 67500 Hz Clock: 108.000 MHz
  1280x800@60Hz 16:10
  1440x900@60Hz 16:10 HorFreq: 55500 Hz Clock: 88.750 MHz
  1600x1200@60Hz 4:3 HorFreq: 75000 Hz Clock: 162.000 MHz
Detailed mode: Clock 148.500 MHz, 510 mm x 287 mm
               1920 2008 2052 2200 hborder 0
               1080 1084 1089 1125 vborder 0
               +hsync -vsync 
               VertFreq: 60 Hz, HorFreq: 67500 Hz
Monitor name: X233H
Monitor ranges (GTF): 56-76Hz V, 31-83kHz H, max dotclock 180MHz
Serial number: --
Checksum: 0x12 (valid)
