edid-decode (hex):

00 ff ff ff ff ff ff 00 4d d9 02 81 01 01 01 01
01 16 01 03 80 a0 5a 78 0a 83 ad a2 56 49 9b 25
0f 47 4a 21 08 00 01 01 01 01 01 01 01 01 01 01
01 01 01 01 01 01 66 21 50 b0 51 00 1b 30 40 70
36 00 40 84 63 00 00 1e 01 1d 00 72 51 d0 1e 20
6e 28 55 00 40 84 63 00 00 1e 00 00 00 fd 00 3a
3e 0f 44 0f 00 0a 20 20 20 20 20 20 00 00 00 fc
00 53 4f 4e 59 20 54 56 0a 20 20 20 20 20 01 70

02 03 25 f0 49 10 04 05 03 02 07 06 20 01 26 09
07 07 15 07 50 83 01 00 00 68 03 0c 00 20 00 80
1e 0f e2 00 7b 01 1d 80 18 71 1c 16 20 58 2c 25
00 40 84 63 00 00 9e 02 3a 80 18 71 38 2d 40 58
2c 45 00 40 84 63 00 00 1e 8c 0a d0 8a 20 e0 2d
10 10 3e 96 00 40 84 63 00 00 18 8c 0a d0 8a 20
e0 2d 10 10 3e 96 00 b0 84 43 00 00 18 8c 0a a0
14 51 f0 16 00 26 7c 43 00 b0 84 43 00 00 98 1f

00 ff ff ff ff ff ff 00 4d d9 02 81 01 01 01 01
01 16 01 03 80 a0 5a 78 0a 83 ad a2 56 49 9b 25
0f 47 4a 21 08 00 01 01 01 01 01 01 01 01 01 01
01 01 01 01 01 01 66 21 50 b0 51 00 1b 30 40 70
36 00 40 84 63 00 00 1e 01 1d 00 72 51 d0 1e 20
6e 28 55 00 40 84 63 00 00 1e 00 00 00 fd 00 3a
3e 0f 44 0f 00 0a 20 20 20 20 20 20 00 00 00 fc
00 53 4f 4e 59 20 54 56 0a 20 20 20 20 20 01 70

02 03 25 f0 49 10 04 05 03 02 07 06 20 01 26 09
07 07 15 07 50 83 01 00 00 68 03 0c 00 20 00 80
1e 0f e2 00 7b 01 1d 80 18 71 1c 16 20 58 2c 25
00 40 84 63 00 00 9e 02 3a 80 18 71 38 2d 40 58
2c 45 00 40 84 63 00 00 1e 8c 0a d0 8a 20 e0 2d
10 10 3e 96 00 40 84 63 00 00 18 8c 0a d0 8a 20
e0 2d 10 10 3e 96 00 b0 84 43 00 00 18 8c 0a a0
14 51 f0 16 00 26 7c 43 00 b0 84 43 00 00 98 1f

----------------

Block 0, Base EDID:
  EDID Structure Version & Revision: 1.3
  Vendor & Product Identification:
    Manufacturer: SNY
    Model: 33026
    Serial Number: ...
    Made in: week 1 of 2012
  Basic Display Parameters & Features:
    Digital display
    Maximum image size: 160 cm x 90 cm
    Gamma: 2.20
    RGB color display
    First detailed timing is the preferred timing
  Color Characteristics:
    Red  : 0.6347, 0.3359
    Green: 0.2851, 0.6083
    Blue : 0.1464, 0.0605
    White: 0.2802, 0.2900
  Established Timings I & II:
    DMT 0x04:   640x480    59.940476 Hz   4:3     31.469 kHz     25.175000 MHz
    DMT 0x09:   800x600    60.316541 Hz   4:3     37.879 kHz     40.000000 MHz
    DMT 0x10:  1024x768    60.003840 Hz   4:3     48.363 kHz     65.000000 MHz
  Standard Timings: none
  Detailed Timing Descriptors:
    DTD  1:  1360x768    60.015162 Hz  85:48    47.712 kHz     85.500000 MHz (1600 mm x 900 mm)
                  Hfront   64 Hsync 112 Hback  256 Hpol P
                  Vfront    3 Vsync   6 Vback   18 Vpol P
    DTD  2:  1280x720    60.000000 Hz  16:9     45.000 kHz     74.250000 MHz (1600 mm x 900 mm)
                  Hfront  110 Hsync  40 Hback  220 Hpol P
                  Vfront    5 Vsync   5 Vback   20 Vpol P
    Display Range Limits:
      Monitor ranges (GTF): 58-62 Hz V, 15-68 kHz H, max dotclock 150 MHz
    Display Product Name: 'SONY TV'
  Extension blocks: 1
Checksum: 0x70

----------------

Block 1, CTA-861 Extension Block:
  Revision: 3
  Underscans IT Video Formats by default
  Basic audio support
  Supports YCbCr 4:4:4
  Supports YCbCr 4:2:2
  Native detailed modes: 0
  Video Data Block:
    VIC  16:  1920x1080   60.000000 Hz  16:9     67.500 kHz    148.500000 MHz
    VIC   4:  1280x720    60.000000 Hz  16:9     45.000 kHz     74.250000 MHz
    VIC   5:  1920x1080i  60.000000 Hz  16:9     33.750 kHz     74.250000 MHz
    VIC   3:   720x480    59.940060 Hz  16:9     31.469 kHz     27.000000 MHz
    VIC   2:   720x480    59.940060 Hz   4:3     31.469 kHz     27.000000 MHz
    VIC   7:  1440x480i   59.940060 Hz  16:9     15.734 kHz     27.000000 MHz
    VIC   6:  1440x480i   59.940060 Hz   4:3     15.734 kHz     27.000000 MHz
    VIC  32:  1920x1080   24.000000 Hz  16:9     27.000 kHz     74.250000 MHz
    VIC   1:   640x480    59.940476 Hz   4:3     31.469 kHz     25.175000 MHz
  Audio Data Block:
    Linear PCM:
      Max channels: 2
      Supported sample rates (kHz): 48 44.1 32
      Supported sample sizes (bits): 24 20 16
    AC-3:
      Max channels: 6
      Supported sample rates (kHz): 48 44.1 32
      Maximum bit rate: 640 kb/s
  Speaker Allocation Data Block:
    FL/FR - Front Left/Right
  Vendor-Specific Data Block (HDMI), OUI 00-0C-03:
    Source physical address: 2.0.0.0
    Supports_AI
    Maximum TMDS clock: 150 MHz
    Supported Content Types:
      Graphics
      Photo
      Cinema
      Game
  Video Capability Data Block:
    YCbCr quantization: No Data
    RGB quantization: Selectable (via AVI Q)
    PT scan behavior: Supports both over- and underscan
    IT scan behavior: Always Underscanned
    CE scan behavior: Supports both over- and underscan
  Detailed Timing Descriptors:
    DTD  3:  1920x1080i  60.000000 Hz  16:9     33.750 kHz     74.250000 MHz (1600 mm x 900 mm)
                  Hfront   88 Hsync  44 Hback  148 Hpol P
                  Vfront    2 Vsync   5 Vback   15 Vpol P Vfront +0.5 Odd Field
                  Vfront    2 Vsync   5 Vback   15 Vpol P Vback  +0.5 Even Field
    DTD  4:  1920x1080   60.000000 Hz  16:9     67.500 kHz    148.500000 MHz (1600 mm x 900 mm)
                  Hfront   88 Hsync  44 Hback  148 Hpol P
                  Vfront    4 Vsync   5 Vback   36 Vpol P
    DTD  5:   720x480    59.940060 Hz   3:2     31.469 kHz     27.000000 MHz (1600 mm x 900 mm)
                  Hfront   16 Hsync  62 Hback   60 Hpol N
                  Vfront    9 Vsync   6 Vback   30 Vpol N
    DTD  6:   720x480    59.940060 Hz   3:2     31.469 kHz     27.000000 MHz (1200 mm x 900 mm)
                  Hfront   16 Hsync  62 Hback   60 Hpol N
                  Vfront    9 Vsync   6 Vback   30 Vpol N
    DTD  7:  1440x480i   59.940060 Hz   3:1     15.734 kHz     27.000000 MHz (1200 mm x 900 mm)
                  Hfront   38 Hsync 124 Hback  114 Hpol N
                  Vfront    4 Vsync   3 Vback   15 Vpol N Vfront +0.5 Odd Field
                  Vfront    4 Vsync   3 Vback   15 Vpol N Vback  +0.5 Even Field
Checksum: 0x1f

----------------

Block 2, Unknown EDID Extension Block 0x00:
  00 ff ff ff ff ff ff 00 4d d9 02 81 01 01 01 01 '........M.......'
  01 16 01 03 80 a0 5a 78 0a 83 ad a2 56 49 9b 25 '......Zx....VI.%'
  0f 47 4a 21 08 00 01 01 01 01 01 01 01 01 01 01 '.GJ!............'
  01 01 01 01 01 01 66 21 50 b0 51 00 1b 30 40 70 '......f!P.Q..0@p'
  36 00 40 84 63 00 00 1e 01 1d 00 72 51 d0 1e 20 '6.@.c......rQ.. '
  6e 28 55 00 40 84 63 00 00 1e 00 00 00 fd 00 3a 'n(U.@.c........:'
  3e 0f 44 0f 00 0a 20 20 20 20 20 20 00 00 00 fc '>.D...      ....'
  00 53 4f 4e 59 20 54 56 0a 20 20 20 20 20 01 70 '.SONY TV.     .p'
Checksum: 0x70

----------------

Block 3, CTA-861 Extension Block:
  Revision: 3
  Underscans IT Video Formats by default
  Basic audio support
  Supports YCbCr 4:4:4
  Supports YCbCr 4:2:2
  Native detailed modes: 0
  Video Data Block:
    VIC  16:  1920x1080   60.000000 Hz  16:9     67.500 kHz    148.500000 MHz
    VIC   4:  1280x720    60.000000 Hz  16:9     45.000 kHz     74.250000 MHz
    VIC   5:  1920x1080i  60.000000 Hz  16:9     33.750 kHz     74.250000 MHz
    VIC   3:   720x480    59.940060 Hz  16:9     31.469 kHz     27.000000 MHz
    VIC   2:   720x480    59.940060 Hz   4:3     31.469 kHz     27.000000 MHz
    VIC   7:  1440x480i   59.940060 Hz  16:9     15.734 kHz     27.000000 MHz
    VIC   6:  1440x480i   59.940060 Hz   4:3     15.734 kHz     27.000000 MHz
    VIC  32:  1920x1080   24.000000 Hz  16:9     27.000 kHz     74.250000 MHz
    VIC   1:   640x480    59.940476 Hz   4:3     31.469 kHz     25.175000 MHz
  Audio Data Block:
    Linear PCM:
      Max channels: 2
      Supported sample rates (kHz): 48 44.1 32
      Supported sample sizes (bits): 24 20 16
    AC-3:
      Max channels: 6
      Supported sample rates (kHz): 48 44.1 32
      Maximum bit rate: 640 kb/s
  Speaker Allocation Data Block:
    FL/FR - Front Left/Right
  Vendor-Specific Data Block (HDMI), OUI 00-0C-03:
    Source physical address: 2.0.0.0
    Supports_AI
    Maximum TMDS clock: 150 MHz
    Supported Content Types:
      Graphics
      Photo
      Cinema
      Game
  Video Capability Data Block:
    YCbCr quantization: No Data
    RGB quantization: Selectable (via AVI Q)
    PT scan behavior: Supports both over- and underscan
    IT scan behavior: Always Underscanned
    CE scan behavior: Supports both over- and underscan
  Detailed Timing Descriptors:
    DTD  8:  1920x1080i  60.000000 Hz  16:9     33.750 kHz     74.250000 MHz (1600 mm x 900 mm)
                  Hfront   88 Hsync  44 Hback  148 Hpol P
                  Vfront    2 Vsync   5 Vback   15 Vpol P Vfront +0.5 Odd Field
                  Vfront    2 Vsync   5 Vback   15 Vpol P Vback  +0.5 Even Field
    DTD  9:  1920x1080   60.000000 Hz  16:9     67.500 kHz    148.500000 MHz (1600 mm x 900 mm)
                  Hfront   88 Hsync  44 Hback  148 Hpol P
                  Vfront    4 Vsync   5 Vback   36 Vpol P
    DTD 10:   720x480    59.940060 Hz   3:2     31.469 kHz     27.000000 MHz (1600 mm x 900 mm)
                  Hfront   16 Hsync  62 Hback   60 Hpol N
                  Vfront    9 Vsync   6 Vback   30 Vpol N
    DTD 11:   720x480    59.940060 Hz   3:2     31.469 kHz     27.000000 MHz (1200 mm x 900 mm)
                  Hfront   16 Hsync  62 Hback   60 Hpol N
                  Vfront    9 Vsync   6 Vback   30 Vpol N
    DTD 12:  1440x480i   59.940060 Hz   3:1     15.734 kHz     27.000000 MHz (1200 mm x 900 mm)
                  Hfront   38 Hsync 124 Hback  114 Hpol N
                  Vfront    4 Vsync   3 Vback   15 Vpol N Vfront +0.5 Odd Field
                  Vfront    4 Vsync   3 Vback   15 Vpol N Vback  +0.5 Even Field
Checksum: 0x1f

----------------

Warnings:

Block 1, CTA-861 Extension Block:
  Video Data Block: VIC 16 is the preferred timing, overriding the first detailed timings. Is this intended?
  Video Capability Data Block: Set Selectable YCbCr Quantization to avoid interop issues.
  Add a Colorimetry Data Block with the sRGB colorimetry bit set to avoid interop issues.
Block 3, CTA-861 Extension Block:
  Video Capability Data Block: Set Selectable YCbCr Quantization to avoid interop issues.
  Add a Colorimetry Data Block with the sRGB colorimetry bit set to avoid interop issues.

Failures:

Block 2, Base EDID:
  Unknown Extension Block.
Block 3, CTA-861 Extension Block:
  Video Data Block: Duplicate VIC 16.
  Video Data Block: Duplicate VIC 4.
  Video Data Block: Duplicate VIC 5.
  Video Data Block: Duplicate VIC 3.
  Video Data Block: Duplicate VIC 2.
  Video Data Block: Duplicate VIC 7.
  Video Data Block: Duplicate VIC 6.
  Video Data Block: Duplicate VIC 32.
  Video Data Block: Duplicate VIC 1.
  Speaker Allocation Data Block: Only one instance of this Data Block is allowed.
  Video Capability Data Block: Only one instance of this Data Block is allowed.
EDID:
  Base EDID: Some timings are out of range of the Monitor Ranges:
    Vertical Freq: 24.000 - 60.317 Hz (Monitor: 58.000 - 62.000 Hz)
  Base EDID: EDID specified 1 extension block(s), but found 3 extension block(s).
  Base EDID: EDID 1.3 requires a Block Map Extension in Block 1 if there are more than 2 blocks in the EDID.

EDID conformity: FAIL
