
EDID (hex):
00ffffffffffff005a63021201010101
0b0b0103182018a0eb9119a255499827
10484cfffe00615945593159714f8140
818001010101ea240060410028303060
130036e61000001e000000ff00323241
3031313130313131390a000000fd0032
781e460b000a202020202020000000fc
004537312d320a202020202020200057

Extracted contents:
header:          00 ff ff ff ff ff ff 00
serial number:   5a 63 02 12 01 01 01 01 0b 0b
version:         01 03
basic params:    18 20 18 a0 eb
chroma info:     91 19 a2 55 49 98 27 10 48 4c
established:     ff fe 00
standard:        61 59 45 59 31 59 71 4f 81 40 81 80 01 01 01 01
descriptor 1:    ea 24 00 60 41 00 28 30 30 60 13 00 36 e6 10 00 00 1e
descriptor 2:    00 00 00 ff 00 32 32 41 30 31 31 31 30 31 31 31 39 0a
descriptor 3:    00 00 00 fd 00 32 78 1e 46 0b 00 0a 20 20 20 20 20 20
descriptor 4:    00 00 00 fc 00 45 37 31 2d 32 0a 20 20 20 20 20 20 20
extensions:      00
checksum:        57

EDID version: 1.3
Manufacturer: VSC Model 1202 Serial Number --
Analog display, Input voltage level: 0.7/0.3 V
Configurable signal levels
Sync: Separate 
Maximum image size: 32 cm x 24 cm
Gamma: 2.60
DPMS levels: Standby Suspend Off
RGB color display
First detailed timing is preferred timing
Supports GTF timings within operating range
Display x,y Chromaticity:
  Red:   0.6347, 0.3330
  Green: 0.2851, 0.5947
  Blue:  0.1523, 0.0634
  White: 0.2832, 0.2978
Established timings supported:
  720x400@70Hz 9:5 HorFreq: 31469 Hz Clock: 28.320 MHz
  720x400@88Hz 9:5 HorFreq: 39500 Hz Clock: 35.500 MHz
  640x480@60Hz 4:3 HorFreq: 31469 Hz Clock: 25.175 MHz
  640x480@67Hz 4:3 HorFreq: 35000 Hz Clock: 30.240 MHz
  640x480@72Hz 4:3 HorFreq: 37900 Hz Clock: 31.500 MHz
  640x480@75Hz 4:3 HorFreq: 37500 Hz Clock: 31.500 MHz
  800x600@56Hz 4:3 HorFreq: 35200 Hz Clock: 36.000 MHz
  800x600@60Hz 4:3 HorFreq: 37900 Hz Clock: 40.000 MHz
  800x600@72Hz 4:3 HorFreq: 48100 Hz Clock: 50.000 MHz
  800x600@75Hz 4:3 HorFreq: 46900 Hz Clock: 49.500 MHz
  832x624@75Hz 4:3 HorFreq: 49726 Hz Clock: 57.284 MHz
  1280x768i@87Hz 5:3 HorFreq: 35522 Hz Clock: 44.900 MHz
  1024x768@60Hz 4:3 HorFreq: 48400 Hz Clock: 65.000 MHz
  1024x768@70Hz 4:3 HorFreq: 56500 Hz Clock: 75.000 MHz
  1024x768@75Hz 4:3 HorFreq: 60000 Hz Clock: 78.750 MHz
Standard timings supported:
  1024x768@85Hz 4:3 HorFreq: 68700 Hz Clock: 94.500 MHz
  800x600@85Hz 4:3 HorFreq: 53700 Hz Clock: 56.250 MHz
  640x480@85Hz 4:3 HorFreq: 43300 Hz Clock: 36.000 MHz
  1152x864@75Hz 4:3 HorFreq: 67500 Hz Clock: 108.000 MHz
  1280x960@60Hz 4:3 HorFreq: 60000 Hz Clock: 108.000 MHz
  1280x1024@60Hz 5:4 HorFreq: 64000 Hz Clock: 108.000 MHz
Detailed mode: Clock 94.500 MHz, 310 mm x 230 mm
               1024 1072 1168 1376 hborder 0
                768  769  772  808 vborder 0
               +hsync +vsync 
               VertFreq: 84 Hz, HorFreq: 68677 Hz
Serial number: --
Monitor ranges (GTF): 50-120Hz V, 30-70kHz H, max dotclock 110MHz
Monitor name: E71-2
Checksum: 0x57 (valid)
EDID block does not conform at all!
	Bad year of manufacture
