edid-decode (hex):

00 ff ff ff ff ff ff 00 5f 34 02 00 01 00 00 00
34 10 01 03 00 2c 1c 78 2a c9 05 a3 57 4b 9c 25
12 50 54 bf cf 00 31 4a 45 4a 81 80 81 8a 01 01
01 01 01 01 01 01 21 39 90 30 62 1a 27 40 68 b0
36 00 98 32 11 00 00 18 00 00 00 fd 00 38 4b 1e
50 0e 00 0a 20 20 20 20 20 20 00 00 00 fc 00 41
4e 41 4c 4f 47 0a 0a 0a 0a 0a 0a 0a 00 00 00 ff
00 0a 00 00 00 00 00 00 00 00 00 00 00 00 00 07

----------------

Block 0, Base EDID:
  EDID Structure Version & Revision: 1.3
  Vendor & Product Identification:
    Manufacturer: WYT
    Model: 2
    Serial Number: ...
    Made in: week 52 of 2006
  Basic Display Parameters & Features:
    Analog display
    Input voltage level: 0.7/0.3 V
    Maximum image size: 44 cm x 28 cm
    Gamma: 2.20
    DPMS levels: Off
    RGB color display
    First detailed timing is preferred timing
  Color Characteristics:
    Red  : 0.6396, 0.3398
    Green: 0.2949, 0.6103
    Blue : 0.1445, 0.0703
    White: 0.3134, 0.3291
  Established Timings I & II:
    IBM     :   720x400    70.082 Hz   9:5    31.467 kHz  28.320 MHz
    DMT 0x04:   640x480    59.940 Hz   4:3    31.469 kHz  25.175 MHz
    Apple   :   640x480    66.667 Hz   4:3    35.000 kHz  30.240 MHz
    DMT 0x05:   640x480    72.809 Hz   4:3    37.861 kHz  31.500 MHz
    DMT 0x06:   640x480    75.000 Hz   4:3    37.500 kHz  31.500 MHz
    DMT 0x08:   800x600    56.250 Hz   4:3    35.156 kHz  36.000 MHz
    DMT 0x09:   800x600    60.317 Hz   4:3    37.879 kHz  40.000 MHz
    DMT 0x0a:   800x600    72.188 Hz   4:3    48.077 kHz  50.000 MHz
    DMT 0x0b:   800x600    75.000 Hz   4:3    46.875 kHz  49.500 MHz
    DMT 0x10:  1024x768    60.004 Hz   4:3    48.363 kHz  65.000 MHz
    DMT 0x11:  1024x768    70.069 Hz   4:3    56.476 kHz  75.000 MHz
    DMT 0x12:  1024x768    75.029 Hz   4:3    60.023 kHz  78.750 MHz
    DMT 0x24:  1280x1024   75.025 Hz   5:4    79.976 kHz 135.000 MHz
  Standard Timings:
    GTF     :   640x480    70.000 Hz   4:3    35.000 kHz  28.560 MHz
    GTF     :   800x600    70.000 Hz   4:3    43.750 kHz  45.500 MHz
    DMT 0x23:  1280x1024   60.020 Hz   5:4    63.981 kHz 108.000 MHz
    GTF     :  1280x1024   70.000 Hz   5:4    74.620 kHz 128.943 MHz
  Detailed Timing Descriptors:
    DTD 1:  1680x1050   59.954 Hz   8:5    65.290 kHz 146.250 MHz (408 mm x 306 mm)
                 Hfront  104 Hsync 176 Hback 280 Hpol N
                 Vfront    3 Vsync   6 Vback  30 Vpol N
  Display Range Limits:
    Monitor ranges (GTF): 56-75 Hz V, 30-80 kHz H, max dotclock 140 MHz
    Display Product Name: 'ANALOG'
    Display Product Serial Number: ...
Checksum: 0x7

----------------

Warnings:

All Blocks:
  Some timings are out of range of the Monitor Ranges:
    Maximum Clock: 146.250 MHz (Monitor: 140.000 MHz)
    Could be due to a Monitor Range off-by-one rounding issue

Failures:

Block 0, Base EDID:
  Detailed Timing Descriptor #1: Mismatch of image size 408x306 mm vs display size 440x280 mm.
  Display Product Name: Non-space after newline.
  Display Product Serial Number: Empty string.
  Display Product Serial Number: Non-space after newline.

EDID conformity: FAIL
