edid-decode (hex):

00 ff ff ff ff ff ff 00 30 ae 90 09 01 01 01 01
2b 16 01 03 80 29 1a 78 ee 7c 55 a2 57 4e 9e 28
10 50 54 bd cf 00 71 4f 81 80 81 8c 95 00 95 0f
01 01 01 01 01 01 9a 29 a0 d0 51 84 22 30 50 98
36 00 98 ff 10 00 00 1c 00 00 00 fd 00 32 4c 1e
51 0e 00 0a 20 20 20 20 20 20 00 00 00 fc 00 4c
54 31 39 35 32 70 20 57 69 64 65 0a 00 00 00 ff
00 36 56 44 4e 4d 44 35 31 0a 20 20 20 20 00 c7

00 ff ff ff ff ff ff 00 30 ae 90 09 01 01 01 01
2b 16 01 03 80 29 1a 78 ee 7c 55 a2 57 4e 9e 28
10 50 54 bd cf 00 71 4f 81 80 81 8c 95 00 95 0f
01 01 01 01 01 01 9a 29 a0 d0 51 84 22 30 50 98
36 00 98 ff 10 00 00 1c 00 00 00 fd 00 32 4c 1e
51 0e 00 0a 20 20 20 20 20 20 00 00 00 fc 00 4c
54 31 39 35 32 70 20 57 69 64 65 0a 00 00 00 ff
00 36 56 44 4e 4d 44 35 31 0a 20 20 20 20 00 c7

----------------

Block 0, Base EDID:
  EDID Structure Version & Revision: 1.3
  Vendor & Product Identification:
    Manufacturer: LEN
    Model: 2448
    Serial Number: ...
    Made in: week 43 of 2012
  Basic Display Parameters & Features:
    Digital display
    Maximum image size: 41 cm x 26 cm
    Gamma: 2.20
    DPMS levels: Standby Suspend Off
    RGB color display
    Default (sRGB) color space is primary color space
    First detailed timing is the preferred timing
  Color Characteristics:
    Red  : 0.6337, 0.3427
    Green: 0.3076, 0.6171
    Blue : 0.1572, 0.0634
    White: 0.3134, 0.3291
  Established Timings I & II:
    IBM     :   720x400    70.081663 Hz   9:5     31.467 kHz     28.320000 MHz
    DMT 0x04:   640x480    59.940476 Hz   4:3     31.469 kHz     25.175000 MHz
    Apple   :   640x480    66.666667 Hz   4:3     35.000 kHz     30.240000 MHz
    DMT 0x05:   640x480    72.808802 Hz   4:3     37.861 kHz     31.500000 MHz
    DMT 0x06:   640x480    75.000000 Hz   4:3     37.500 kHz     31.500000 MHz
    DMT 0x09:   800x600    60.316541 Hz   4:3     37.879 kHz     40.000000 MHz
    DMT 0x0a:   800x600    72.187572 Hz   4:3     48.077 kHz     50.000000 MHz
    DMT 0x0b:   800x600    75.000000 Hz   4:3     46.875 kHz     49.500000 MHz
    DMT 0x10:  1024x768    60.003840 Hz   4:3     48.363 kHz     65.000000 MHz
    DMT 0x11:  1024x768    70.069359 Hz   4:3     56.476 kHz     75.000000 MHz
    DMT 0x12:  1024x768    75.028582 Hz   4:3     60.023 kHz     78.750000 MHz
    DMT 0x24:  1280x1024   75.024675 Hz   5:4     79.976 kHz    135.000000 MHz
  Standard Timings:
    DMT 0x15:  1152x864    75.000000 Hz   4:3     67.500 kHz    108.000000 MHz
    DMT 0x23:  1280x1024   60.019740 Hz   5:4     63.981 kHz    108.000000 MHz
    GTF     :  1280x1024   72.000069 Hz   5:4     76.824 kHz    132.752000 MHz
    DMT 0x2f:  1440x900    59.887445 Hz  16:10    55.935 kHz    106.500000 MHz
    DMT 0x30:  1440x900    74.984427 Hz  16:10    70.635 kHz    136.750000 MHz
  Detailed Timing Descriptors:
    DTD 1:  1440x900    59.887445 Hz  16:10    55.935 kHz    106.500000 MHz (408 mm x 255 mm)
                 Hfront   80 Hsync 152 Hback  232 Hpol N
                 Vfront    3 Vsync   6 Vback   25 Vpol P
    Display Range Limits:
      Monitor ranges (GTF): 50-76 Hz V, 30-81 kHz H, max dotclock 140 MHz
    Display Product Name: 'LT1952p Wide'
    Display Product Serial Number: ...
Checksum: 0xc7

----------------

Block 1, Unknown EDID Extension Block 0x00:
  00 ff ff ff ff ff ff 00 30 ae 90 09 01 01 01 01 '........0.......'
  2b 16 01 03 80 29 1a 78 ee 7c 55 a2 57 4e 9e 28 '+....).x.|U.WN.('
  10 50 54 bd cf 00 71 4f 81 80 81 8c 95 00 95 0f '.PT...qO........'
  01 01 01 01 01 01 9a 29 a0 d0 51 84 22 30 50 98 '.......)..Q."0P.'
  36 00 98 ff 10 00 00 1c 00 00 00 fd 00 32 4c 1e '6............2L.'
  51 0e 00 0a 20 20 20 20 20 20 00 00 00 fc 00 4c 'Q...      .....L'
  54 31 39 35 32 70 20 57 69 64 65 0a 00 00 00 ff 'T1952p Wide.....'
  00 36 56 44 4e 4d 44 35 31 0a 20 20 20 20 00 c7 '.6VDNMD51.    ..'
Checksum: 0xc7

----------------

Failures:

Block 0, Base EDID:
  Basic Display Parameters & Features: sRGB is signaled, but the chromaticities do not match.
Block 1, Base EDID:
  Unknown Extension Block.
EDID:
  Base EDID: EDID specified 0 extension block(s), but found 1 extension block(s).

EDID conformity: FAIL
