
EDID (hex):
00ffffffffffff0010ac1cd053574e30
1a14010380331d78ea1855a95337ad25
135054a54b00714f8180b30001010101
0101010101013b3d00a0808021403020
3500fe221100001a000000ff00553738
3346303655304e57530a000000fd0038
551e5c11000a202020202020000000fc
0044454c4c20535032333039570a00db

Extracted contents:
header:          00 ff ff ff ff ff ff 00
serial number:   10 ac 1c d0 53 57 4e 30 1a 14
version:         01 03
basic params:    80 33 1d 78 ea
chroma info:     18 55 a9 53 37 ad 25 13 50 54
established:     a5 4b 00
standard:        71 4f 81 80 b3 00 01 01 01 01 01 01 01 01 01 01
descriptor 1:    3b 3d 00 a0 80 80 21 40 30 20 35 00 fe 22 11 00 00 1a
descriptor 2:    00 00 00 ff 00 55 37 38 33 46 30 36 55 30 4e 57 53 0a
descriptor 3:    00 00 00 fd 00 38 55 1e 5c 11 00 0a 20 20 20 20 20 20
descriptor 4:    00 00 00 fc 00 44 45 4c 4c 20 53 50 32 33 30 39 57 0a
extensions:      00
checksum:        db

EDID version: 1.3
Manufacturer: DEL Model d01c Serial Number --
Made in week 26 of 2010
Digital display
Maximum image size: 51 cm x 29 cm
Gamma: 2.20
DPMS levels: Standby Suspend Off
RGB color display
First detailed timing is preferred timing
Display x,y Chromaticity:
  Red:   0.6601, 0.3251
  Green: 0.2167, 0.6757
  Blue:  0.1455, 0.0751
  White: 0.3134, 0.3291
Established timings supported:
  720x400@70Hz 9:5 HorFreq: 31469 Hz Clock: 28.320 MHz
  640x480@60Hz 4:3 HorFreq: 31469 Hz Clock: 25.175 MHz
  640x480@75Hz 4:3 HorFreq: 37500 Hz Clock: 31.500 MHz
  800x600@60Hz 4:3 HorFreq: 37900 Hz Clock: 40.000 MHz
  800x600@75Hz 4:3 HorFreq: 46900 Hz Clock: 49.500 MHz
  1024x768@60Hz 4:3 HorFreq: 48400 Hz Clock: 65.000 MHz
  1024x768@75Hz 4:3 HorFreq: 60000 Hz Clock: 78.750 MHz
  1280x1024@75Hz 5:4 HorFreq: 80000 Hz Clock: 135.000 MHz
Standard timings supported:
  1152x864@75Hz 4:3 HorFreq: 67500 Hz Clock: 108.000 MHz
  1280x1024@60Hz 5:4 HorFreq: 64000 Hz Clock: 108.000 MHz
  1680x1050@60Hz 16:10 HorFreq: 64700 Hz Clock: 119.000 MHz
Detailed mode: Clock 156.750 MHz, 510 mm x 290 mm
               2048 2096 2128 2208 hborder 0
               1152 1155 1160 1185 vborder 0
               +hsync -vsync 
               VertFreq: 59 Hz, HorFreq: 70991 Hz
Serial number: --
Monitor ranges (GTF): 56-85Hz V, 30-92kHz H, max dotclock 170MHz
Monitor name: DELL SP2309W
Checksum: 0xdb (valid)
