
EDID (hex):
00ffffffffffff005c23641000000000
141e0103802213782a77f5a1554a9e27
105054a10800d1c0a940818001010101
010101010101023a801871382d40582c
450058c11000001e000000fd00384c1e
5011000a202020202020000000fc0043
696e7469712031360a202020000000ff
00304551303058313030333632370139
020311804310020465030c001000e200
6a000000000000000000000000000000
00000000000000000000000000000000
00000000000000000000000000000000
00000000000000000000000000000000
00000000000000000000000000000000
00000000000000000000000000000000
00000000000000000000000000000041

Extracted contents:
header:          00 ff ff ff ff ff ff 00
serial number:   5c 23 64 10 00 00 00 00 14 1e
version:         01 03
basic params:    80 22 13 78 2a
chroma info:     77 f5 a1 55 4a 9e 27 10 50 54
established:     a1 08 00
standard:        d1 c0 a9 40 81 80 01 01 01 01 01 01 01 01 01 01
descriptor 1:    02 3a 80 18 71 38 2d 40 58 2c 45 00 58 c1 10 00 00 1e
descriptor 2:    00 00 00 fd 00 38 4c 1e 50 11 00 0a 20 20 20 20 20 20
descriptor 3:    00 00 00 fc 00 43 69 6e 74 69 71 20 31 36 0a 20 20 20
descriptor 4:    00 00 00 ff 00 30 45 51 30 30 58 31 30 30 33 36 32 37
extensions:      01
checksum:        39

EDID version: 1.3
Manufacturer: WAC Model 1064 Serial Number --
Made in week 20 of 2020
Digital display
Maximum image size: 34 cm x 19 cm
Gamma: 2.20
DPMS levels: Off
RGB color display
First detailed timing is preferred timing
Display x,y Chromaticity:
  Red:   0.6298, 0.3349
  Green: 0.2900, 0.6201
  Blue:  0.1552, 0.0654
  White: 0.3134, 0.3291
Established timings supported:
  720x400@70Hz 9:5 HorFreq: 31469 Hz Clock: 28.320 MHz
  640x480@60Hz 4:3 HorFreq: 31469 Hz Clock: 25.175 MHz
  800x600@60Hz 4:3 HorFreq: 37900 Hz Clock: 40.000 MHz
  1024x768@60Hz 4:3 HorFreq: 48400 Hz Clock: 65.000 MHz
Standard timings supported:
  1920x1080@60Hz 16:9
  1600x1200@60Hz 4:3 HorFreq: 75000 Hz Clock: 162.000 MHz
  1280x1024@60Hz 5:4 HorFreq: 64000 Hz Clock: 108.000 MHz
Detailed mode: Clock 148.500 MHz, 344 mm x 193 mm
               1920 2008 2052 2200 hborder 0
               1080 1084 1089 1125 vborder 0
               +hsync +vsync 
               VertFreq: 60 Hz, HorFreq: 67500 Hz
Monitor ranges (GTF): 56-76Hz V, 30-80kHz H, max dotclock 170MHz
Monitor name: Cintiq 16
Serial number: --
Has 1 extension blocks
Checksum: 0x39 (valid)

CTA extension block
Extension version: 3
13 bytes of CTA data
  Video data block
    VIC  16 1920x1080@60Hz 16:9  HorFreq: 67500 Hz Clock: 148.500 MHz
    VIC   2 720x480@60Hz 4:3  HorFreq: 31469 Hz Clock: 27.000 MHz
    VIC   4 1280x720@60Hz 16:9  HorFreq: 45000 Hz Clock: 74.250 MHz
  Vendor-specific data block, OUI 000c03 (HDMI)
    Source physical address 1.0.0.0
  Extended tag: Video capability data block
    YCbCr quantization: No Data (0)
    RGB quantization: Selectable (via AVI Q) (1)
    PT scan behaviour: Always Underscanned (2)
    IT scan behaviour: Always Underscanned (2)
    CE scan behaviour: Always Underscanned (2)
Underscans PC formats by default
0 native detailed modes
Checksum: 0x41 (valid)
