edid-decode (hex):

00 ff ff ff ff ff ff 00 5c 23 64 10 00 00 00 00
34 1c 01 03 80 22 13 78 2a 77 f5 a1 55 4a 9e 27
10 50 54 a1 08 00 d1 c0 a9 40 81 80 01 01 01 01
01 01 01 01 01 01 02 3a 80 18 71 38 2d 40 58 2c
45 00 58 c1 10 00 00 1e 00 00 00 fd 00 38 4c 1e
50 11 00 0a 20 20 20 20 20 20 00 00 00 fc 00 43
69 6e 74 69 71 20 31 36 0a 20 20 20 00 00 00 ff
00 38 4c 51 30 30 58 31 30 30 38 32 38 35 01 07

02 03 11 80 43 10 02 04 65 03 0c 00 10 00 e2 00
6a 00 00 00 00 00 00 00 00 00 00 00 00 00 00 00
00 00 00 00 00 00 00 00 00 00 00 00 00 00 00 00
00 00 00 00 00 00 00 00 00 00 00 00 00 00 00 00
00 00 00 00 00 00 00 00 00 00 00 00 00 00 00 00
00 00 00 00 00 00 00 00 00 00 00 00 00 00 00 00
00 00 00 00 00 00 00 00 00 00 00 00 00 00 00 00
00 00 00 00 00 00 00 00 00 00 00 00 00 00 00 41

00 ff ff ff ff ff ff 00 5c 23 64 10 00 00 00 00
34 1c 01 03 80 22 13 78 2a 77 f5 a1 55 4a 9e 27
10 50 54 a1 08 00 d1 c0 a9 40 81 80 01 01 01 01
01 01 01 01 01 01 02 3a 80 18 71 38 2d 40 58 2c
45 00 58 c1 10 00 00 1e 00 00 00 fd 00 38 4c 1e
50 11 00 0a 20 20 20 20 20 20 00 00 00 fc 00 43
69 6e 74 69 71 20 31 36 0a 20 20 20 00 00 00 ff
00 38 4c 51 30 30 58 31 30 30 38 32 38 35 01 07

02 03 11 80 43 10 02 04 65 03 0c 00 10 00 e2 00
6a 00 00 00 00 00 00 00 00 00 00 00 00 00 00 00
00 00 00 00 00 00 00 00 00 00 00 00 00 00 00 00
00 00 00 00 00 00 00 00 00 00 00 00 00 00 00 00
00 00 00 00 00 00 00 00 00 00 00 00 00 00 00 00
00 00 00 00 00 00 00 00 00 00 00 00 00 00 00 00
00 00 00 00 00 00 00 00 00 00 00 00 00 00 00 00
00 00 00 00 00 00 00 00 00 00 00 00 00 00 00 41

----------------

Block 0, Base EDID:
  EDID Structure Version & Revision: 1.3
  Vendor & Product Identification:
    Manufacturer: WAC
    Model: 4196
    Made in: week 52 of 2018
  Basic Display Parameters & Features:
    Digital display
    Maximum image size: 34 cm x 19 cm
    Gamma: 2.20
    DPMS levels: Off
    RGB color display
    First detailed timing is the preferred timing
  Color Characteristics:
    Red  : 0.6298, 0.3349
    Green: 0.2900, 0.6201
    Blue : 0.1552, 0.0654
    White: 0.3134, 0.3291
  Established Timings I & II:
    IBM     :   720x400    70.081663 Hz   9:5     31.467 kHz     28.320000 MHz
    DMT 0x04:   640x480    59.940476 Hz   4:3     31.469 kHz     25.175000 MHz
    DMT 0x09:   800x600    60.316541 Hz   4:3     37.879 kHz     40.000000 MHz
    DMT 0x10:  1024x768    60.003840 Hz   4:3     48.363 kHz     65.000000 MHz
  Standard Timings:
    DMT 0x52:  1920x1080   60.000000 Hz  16:9     67.500 kHz    148.500000 MHz
    DMT 0x33:  1600x1200   60.000000 Hz   4:3     75.000 kHz    162.000000 MHz
    DMT 0x23:  1280x1024   60.019740 Hz   5:4     63.981 kHz    108.000000 MHz
  Detailed Timing Descriptors:
    DTD 1:  1920x1080   60.000000 Hz  16:9     67.500 kHz    148.500000 MHz (344 mm x 193 mm)
                 Hfront   88 Hsync  44 Hback  148 Hpol P
                 Vfront    4 Vsync   5 Vback   36 Vpol P
    Display Range Limits:
      Monitor ranges (GTF): 56-76 Hz V, 30-80 kHz H, max dotclock 170 MHz
    Display Product Name: 'Cintiq 16'
    Display Product Serial Number: ...
  Extension blocks: 1
Checksum: 0x07

----------------

Block 1, CTA-861 Extension Block:
  Revision: 3
  Underscans IT Video Formats by default
  Native detailed modes: 0
  Video Data Block:
    VIC  16:  1920x1080   60.000000 Hz  16:9     67.500 kHz    148.500000 MHz
    VIC   2:   720x480    59.940060 Hz   4:3     31.469 kHz     27.000000 MHz
    VIC   4:  1280x720    60.000000 Hz  16:9     45.000 kHz     74.250000 MHz
  Vendor-Specific Data Block (HDMI), OUI 00-0C-03:
    Source physical address: 1.0.0.0
  Video Capability Data Block:
    YCbCr quantization: No Data
    RGB quantization: Selectable (via AVI Q)
    PT scan behavior: Always Underscanned
    IT scan behavior: Always Underscanned
    CE scan behavior: Always Underscanned
Checksum: 0x41  Unused space in Extension Block: 110 bytes

----------------

Block 2, Unknown EDID Extension Block 0x00:
  00 ff ff ff ff ff ff 00 5c 23 64 10 00 00 00 00 '........\#d.....'
  34 1c 01 03 80 22 13 78 2a 77 f5 a1 55 4a 9e 27 '4....".x*w..UJ.''
  10 50 54 a1 08 00 d1 c0 a9 40 81 80 01 01 01 01 '.PT......@......'
  01 01 01 01 01 01 02 3a 80 18 71 38 2d 40 58 2c '.......:..q8-@X,'
  45 00 58 c1 10 00 00 1e 00 00 00 fd 00 38 4c 1e 'E.X..........8L.'
  50 11 00 0a 20 20 20 20 20 20 00 00 00 fc 00 43 'P...      .....C'
  69 6e 74 69 71 20 31 36 0a 20 20 20 00 00 00 ff 'intiq 16.   ....'
  00 38 4c 51 30 30 58 31 30 30 38 32 38 35 01 07 '.8LQ00X1008285..'
Checksum: 0x07

----------------

Block 3, CTA-861 Extension Block:
  Revision: 3
  Underscans IT Video Formats by default
  Native detailed modes: 0
  Video Data Block:
    VIC  16:  1920x1080   60.000000 Hz  16:9     67.500 kHz    148.500000 MHz
    VIC   2:   720x480    59.940060 Hz   4:3     31.469 kHz     27.000000 MHz
    VIC   4:  1280x720    60.000000 Hz  16:9     45.000 kHz     74.250000 MHz
  Vendor-Specific Data Block (HDMI), OUI 00-0C-03:
    Source physical address: 1.0.0.0
  Video Capability Data Block:
    YCbCr quantization: No Data
    RGB quantization: Selectable (via AVI Q)
    PT scan behavior: Always Underscanned
    IT scan behavior: Always Underscanned
    CE scan behavior: Always Underscanned
Checksum: 0x41  Unused space in Extension Block: 110 bytes

----------------

Warnings:

Block 1, CTA-861 Extension Block:
  Video Data Block: For improved preferred timing interoperability, set 'Native detailed modes' to 1.
  Video Capability Data Block: S_PT is equal to S_IT and S_CE, so should be set to 0 instead.
  Add a Colorimetry Data Block with the sRGB colorimetry bit set to avoid interop issues.
Block 3, CTA-861 Extension Block:
  Video Capability Data Block: S_PT is equal to S_IT and S_CE, so should be set to 0 instead.
  Add a Colorimetry Data Block with the sRGB colorimetry bit set to avoid interop issues.

Failures:

Block 2, Base EDID:
  Unknown Extension Block.
Block 3, CTA-861 Extension Block:
  Video Data Block: Duplicate VIC 16.
  Video Data Block: Duplicate VIC 2.
  Video Data Block: Duplicate VIC 4.
  Video Capability Data Block: Only one instance of this Data Block is allowed.
EDID:
  Base EDID: EDID specified 1 extension block(s), but found 3 extension block(s).
  Base EDID: EDID 1.3 requires a Block Map Extension in Block 1 if there are more than 2 blocks in the EDID.

EDID conformity: FAIL
