edid-decode (hex):

00 ff ff ff ff ff ff 00 0d af 03 09 00 00 00 00
2d 12 01 03 80 15 0c 78 0a 5f 15 92 5c 59 92 28
1e 50 54 00 00 00 01 01 01 01 01 01 01 01 01 01
01 01 01 01 01 01 2c 15 00 b0 40 58 99 20 35 23
7d 00 c3 71 00 00 00 18 00 00 00 fe 00 4e 30 38
39 4c 36 2d 4c 30 33 0a 20 20 00 00 00 fe 00 43
4d 4f 0a 20 20 20 20 20 20 20 20 20 00 00 00 fe
00 4e 30 38 39 4c 36 2d 4c 30 33 0a 20 20 00 fd

----------------

Block 0, Base EDID:
  EDID Structure Version & Revision: 1.3
  Vendor & Product Identification:
    Manufacturer: CMO
    Model: 2307
    Made in: week 45 of 2008
  Basic Display Parameters & Features:
    Digital display
    Maximum image size: 21 cm x 12 cm
    Gamma: 2.20
    RGB color display
    First detailed timing is the preferred timing
  Color Characteristics:
    Red  : 0.5712, 0.3603
    Green: 0.3505, 0.5732
    Blue : 0.1562, 0.1181
    White: 0.3134, 0.3291
  Established Timings I & II: none
  Standard Timings: none
  Detailed Timing Descriptors:
    DTD 1:  1024x600    59.982293 Hz 128:75    45.167 kHz     54.200000 MHz (195 mm x 113 mm)
                 Hfront   53 Hsync  35 Hback   88 Hpol N
                 Vfront    7 Vsync  13 Vback  133 Vpol N
    Alphanumeric Data String: 'N089L6-L03'
    Alphanumeric Data String: 'CMO'
    Alphanumeric Data String: 'N089L6-L03'
Checksum: 0xfd

----------------

Failures:

Block 0, Base EDID:
  Missing Display Product Name.
  Missing Display Range Limits Descriptor.

EDID conformity: FAIL
