
EDID (hex):
00ffffffffffff005a6335e601010101
1b1c0104b54627783f1545a6544a9d23
0e5054bfef80e1c0d140d100d1c0b300
9500818081c0565e00a0a0a029503020
3500ba892100001a000000ff00563957
3138323730303435300a000000fd0032
4b18711e000a202020202020000000fc
005658333237362d5148440a202001b3
020322f155010203040506070e0f9011
12131415161d1e1f595a23097f078301
0000023a801871382d40582c4500ba89
2100001e011d8018711c1620582c2500
ba892100009e023a80d072382d40102c
4580ba892100001e011d007251d01e20
6e285500ba892100001e011d00bc52d0
1e20b8285540ba892100001e00000006

Extracted contents:
header:          00 ff ff ff ff ff ff 00
serial number:   5a 63 35 e6 01 01 01 01 1b 1c
version:         01 04
basic params:    b5 46 27 78 3f
chroma info:     15 45 a6 54 4a 9d 23 0e 50 54
established:     bf ef 80
standard:        e1 c0 d1 40 d1 00 d1 c0 b3 00 95 00 81 80 81 c0
descriptor 1:    56 5e 00 a0 a0 a0 29 50 30 20 35 00 ba 89 21 00 00 1a
descriptor 2:    00 00 00 ff 00 56 39 57 31 38 32 37 30 30 34 35 30 0a
descriptor 3:    00 00 00 fd 00 32 4b 18 71 1e 00 0a 20 20 20 20 20 20
descriptor 4:    00 00 00 fc 00 56 58 33 32 37 36 2d 51 48 44 0a 20 20
extensions:      01
checksum:        b3

EDID version: 1.4
Manufacturer: VSC Model e635 Serial Number --
Made in week 27 of 2018
Digital display
10 bits per primary color channel
DisplayPort interface
Maximum image size: 70 cm x 39 cm
Gamma: 2.20
DPMS levels: Off
Supported color formats: RGB 4:4:4, YCrCb 4:4:4, YCrCb 4:2:2
Default (sRGB) color space is primary color space
First detailed timing includes the native pixel format and preferred refresh rate
Display is continuous frequency
Display x,y Chromaticity:
  Red:   0.6484, 0.3291
  Green: 0.2900, 0.6142
  Blue:  0.1376, 0.0546
  White: 0.3134, 0.3291
Established timings supported:
  720x400@70Hz 9:5 HorFreq: 31469 Hz Clock: 28.320 MHz
  640x480@60Hz 4:3 HorFreq: 31469 Hz Clock: 25.175 MHz
  640x480@67Hz 4:3 HorFreq: 35000 Hz Clock: 30.240 MHz
  640x480@72Hz 4:3 HorFreq: 37900 Hz Clock: 31.500 MHz
  640x480@75Hz 4:3 HorFreq: 37500 Hz Clock: 31.500 MHz
  800x600@56Hz 4:3 HorFreq: 35200 Hz Clock: 36.000 MHz
  800x600@60Hz 4:3 HorFreq: 37900 Hz Clock: 40.000 MHz
  800x600@72Hz 4:3 HorFreq: 48100 Hz Clock: 50.000 MHz
  800x600@75Hz 4:3 HorFreq: 46900 Hz Clock: 49.500 MHz
  832x624@75Hz 4:3 HorFreq: 49726 Hz Clock: 57.284 MHz
  1024x768@60Hz 4:3 HorFreq: 48400 Hz Clock: 65.000 MHz
  1024x768@70Hz 4:3 HorFreq: 56500 Hz Clock: 75.000 MHz
  1024x768@75Hz 4:3 HorFreq: 60000 Hz Clock: 78.750 MHz
  1280x1024@75Hz 5:4 HorFreq: 80000 Hz Clock: 135.000 MHz
  1152x870@75Hz 192:145 HorFreq: 67500 Hz Clock: 108.000 MHz
Standard timings supported:
  2048x1152@60Hz 16:9
  1920x1440@60Hz 4:3 HorFreq: 90000 Hz Clock: 234.000 MHz
  1920x1200@60Hz 16:10 HorFreq: 74000 Hz Clock: 154.000 MHz
  1920x1080@60Hz 16:9
  1680x1050@60Hz 16:10 HorFreq: 64700 Hz Clock: 119.000 MHz
  1440x900@60Hz 16:10 HorFreq: 55500 Hz Clock: 88.750 MHz
  1280x1024@60Hz 5:4 HorFreq: 64000 Hz Clock: 108.000 MHz
  1280x720@60Hz 16:9
Detailed mode: Clock 241.500 MHz, 698 mm x 393 mm
               2560 2608 2640 2720 hborder 0
               1440 1443 1448 1481 vborder 0
               +hsync -vsync 
               VertFreq: 59 Hz, HorFreq: 88786 Hz
Serial number: --
Monitor ranges (GTF): 50-75Hz V, 24-113kHz H, max dotclock 300MHz
Monitor name: VX3276-QHD
Has 1 extension blocks
Checksum: 0xb3 (valid)

CTA extension block
Extension version: 3
30 bytes of CTA data
  Video data block
    VIC   1 640x480@60Hz 4:3  HorFreq: 31469 Hz Clock: 25.175 MHz
    VIC   2 720x480@60Hz 4:3  HorFreq: 31469 Hz Clock: 27.000 MHz
    VIC   3 720x480@60Hz 16:9  HorFreq: 31469 Hz Clock: 27.000 MHz
    VIC   4 1280x720@60Hz 16:9  HorFreq: 45000 Hz Clock: 74.250 MHz
    VIC   5 1920x1080i@60Hz 16:9  HorFreq: 33750 Hz Clock: 74.250 MHz
    VIC   6 1440x480i@60Hz 4:3  HorFreq: 15734 Hz Clock: 27.000 MHz
    VIC   7 1440x480i@60Hz 16:9  HorFreq: 15734 Hz Clock: 27.000 MHz
    VIC  14 1440x480@60Hz 4:3  HorFreq: 31469 Hz Clock: 54.000 MHz
    VIC  15 1440x480@60Hz 16:9  HorFreq: 31469 Hz Clock: 54.000 MHz
    VIC  16 1920x1080@60Hz 16:9 (native) HorFreq: 67500 Hz Clock: 148.500 MHz
    VIC  17 720x576@50Hz 4:3  HorFreq: 31250 Hz Clock: 27.000 MHz
    VIC  18 720x576@50Hz 16:9  HorFreq: 31250 Hz Clock: 27.000 MHz
    VIC  19 1280x720@50Hz 16:9  HorFreq: 37500 Hz Clock: 74.250 MHz
    VIC  20 1920x1080i@50Hz 16:9  HorFreq: 28125 Hz Clock: 74.250 MHz
    VIC  21 1440x576i@50Hz 4:3  HorFreq: 15625 Hz Clock: 27.000 MHz
    VIC  22 1440x576i@50Hz 16:9  HorFreq: 15625 Hz Clock: 27.000 MHz
    VIC  29 1440x576@50Hz 4:3  HorFreq: 31250 Hz Clock: 54.000 MHz
    VIC  30 1440x576@50Hz 16:9  HorFreq: 31250 Hz Clock: 54.000 MHz
    VIC  31 1920x1080@50Hz 16:9  HorFreq: 56250 Hz Clock: 148.500 MHz
    VIC  89 2560x1080@50Hz 64:27  HorFreq: 56250 Hz Clock: 185.625 MHz
    VIC  90 2560x1080@60Hz 64:27  HorFreq: 66000 Hz Clock: 198.000 MHz
  Audio data block
    Linear PCM, max channels 2
      Supported sample rates (kHz): 192 176.4 96 88.2 48 44.1 32
      Supported sample sizes (bits): 24 20 16
  Speaker allocation data block
    Speaker map:
      FL/FR - Front Left/Right
Underscans PC formats by default
Basic audio support
Supports YCbCr 4:4:4
Supports YCbCr 4:2:2
1 native detailed modes
Detailed mode: Clock 148.500 MHz, 698 mm x 393 mm
               1920 2008 2052 2200 hborder 0
               1080 1084 1089 1125 vborder 0
               +hsync +vsync 
               VertFreq: 60 Hz, HorFreq: 67500 Hz
Detailed mode: Clock 74.250 MHz, 698 mm x 393 mm
               1920 2008 2052 2200 hborder 0
                540  542  547  562 vborder 0
               +hsync +vsync interlaced 
               VertFreq: 60 Hz, HorFreq: 33750 Hz
Detailed mode: Clock 148.500 MHz, 698 mm x 393 mm
               1920 2448 2492 2640 hborder 0
               1080 1084 1089 1125 vborder 0
               +hsync +vsync 
               VertFreq: 50 Hz, HorFreq: 56250 Hz
Detailed mode: Clock 74.250 MHz, 698 mm x 393 mm
               1280 1390 1430 1650 hborder 0
                720  725  730  750 vborder 0
               +hsync +vsync 
               VertFreq: 60 Hz, HorFreq: 45000 Hz
Detailed mode: Clock 74.250 MHz, 698 mm x 393 mm
               1280 1720 1760 1980 hborder 0
                720  725  730  750 vborder 0
               +hsync +vsync 
               VertFreq: 50 Hz, HorFreq: 37500 Hz
Checksum: 0x6 (valid)

EDID block does NOT conform to EDID 1.4!
	sRGB is signaled, but the chromaticities do not match
Warning: One or more of the timings is out of range of the Monitor Ranges:
  Vertical Freq: 50 - 75 Hz
  Horizontal Freq: 15625 - 90000 Hz
  Maximum Clock: 241.500 MHz
EDID block does not conform at all!
	Both the serial number and the serial string are set


