edid-decode (hex):

00 ff ff ff ff ff ff 00 22 f0 30 29 01 01 01 01
23 15 01 03 68 29 17 78 2a ac 25 a5 55 48 9a 27
13 50 54 a1 08 00 81 c0 81 80 81 40 01 01 01 01
01 01 01 01 01 01 66 21 56 aa 51 00 1e 30 46 8f
33 00 9a e6 10 00 00 1e 00 00 00 fd 00 32 4c 18
53 0e 00 0a 20 20 20 20 20 20 00 00 00 fc 00 48
50 20 53 31 39 33 32 0a 20 20 20 20 00 00 00 ff
00 43 4e 34 31 33 35 30 5a 59 46 0a 20 20 00 06

----------------

Block 0, Base EDID:
  EDID Structure Version & Revision: 1.3
  Vendor & Product Identification:
    Manufacturer: HWP
    Model: 10544
    Serial Number: ...
    Made in: week 35 of 2011
  Basic Display Parameters & Features:
    Analog display
    Input voltage level: 0.7/0.7 V
    Blank level equals black level
    Sync: Separate
    Maximum image size: 41 cm x 23 cm
    Gamma: 2.20
    DPMS levels: Off
    RGB color display
    First detailed timing is the preferred timing
  Color Characteristics:
    Red  : 0.6464, 0.3339
    Green: 0.2841, 0.6015
    Blue : 0.1523, 0.0761
    White: 0.3134, 0.3291
  Established Timings I & II:
    IBM     :   720x400    70.082 Hz   9:5    31.467 kHz  28.320 MHz
    DMT 0x04:   640x480    59.940 Hz   4:3    31.469 kHz  25.175 MHz
    DMT 0x09:   800x600    60.317 Hz   4:3    37.879 kHz  40.000 MHz
    DMT 0x10:  1024x768    60.004 Hz   4:3    48.363 kHz  65.000 MHz
  Standard Timings:
    DMT 0x55:  1280x720    60.000 Hz  16:9    45.000 kHz  74.250 MHz
    DMT 0x23:  1280x1024   60.020 Hz   5:4    63.981 kHz 108.000 MHz
    DMT 0x20:  1280x960    60.000 Hz   4:3    60.000 kHz 108.000 MHz
  Detailed Timing Descriptors:
    DTD 1:  1366x768    59.790 Hz 683:384  47.712 kHz  85.500 MHz (410 mm x 230 mm)
                 Hfront   70 Hsync 143 Hback 213 Hpol P
                 Vfront    3 Vsync   3 Vback  24 Vpol P
  Display Range Limits:
    Monitor ranges (GTF): 50-76 Hz V, 24-83 kHz H, max dotclock 140 MHz
    Display Product Name: 'HP S1932'
    Display Product Serial Number: ...
Checksum: 0x06

----------------

EDID conformity: PASS
