
EDID (hex):
00ffffffffffff002634dd905da53101
210d010380251e78286f86a25a4d9424
1a4f5421080031404540614071408180
010101010101302a009851002a403070
1300782d1100001ea00f200031581c20
28801400782d1100001e000000fd0038
4b1f50ff000a202020202020000000fc
004c393044204469676974616c0a005e

Extracted contents:
header:          00 ff ff ff ff ff ff 00
serial number:   26 34 dd 90 5d a5 31 01 21 0d
version:         01 03
basic params:    80 25 1e 78 28
chroma info:     6f 86 a2 5a 4d 94 24 1a 4f 54
established:     21 08 00
standard:        31 40 45 40 61 40 71 40 81 80 01 01 01 01 01 01
descriptor 1:    30 2a 00 98 51 00 2a 40 30 70 13 00 78 2d 11 00 00 1e
descriptor 2:    a0 0f 20 00 31 58 1c 20 28 80 14 00 78 2d 11 00 00 1e
descriptor 3:    00 00 00 fd 00 38 4b 1f 50 ff 00 0a 20 20 20 20 20 20
descriptor 4:    00 00 00 fc 00 4c 39 30 44 20 44 69 67 69 74 61 6c 0a
extensions:      00
checksum:        5e

EDID version: 1.3
Manufacturer: IQT Model 90dd Serial Number --
Digital display
Maximum image size: 37 cm x 30 cm
Gamma: 2.20
DPMS levels: Off
RGB color display
Display x,y Chromaticity:
  Red:   0.6337, 0.3535
  Green: 0.3037, 0.5810
  Blue:  0.1425, 0.1015
  White: 0.3095, 0.3300
Established timings supported:
  640x480@60Hz 4:3 HorFreq: 31469 Hz Clock: 25.175 MHz
  800x600@60Hz 4:3 HorFreq: 37900 Hz Clock: 40.000 MHz
  1024x768@60Hz 4:3 HorFreq: 48400 Hz Clock: 65.000 MHz
Standard timings supported:
  640x480@60Hz 4:3 HorFreq: 31469 Hz Clock: 25.175 MHz
  800x600@60Hz 4:3 HorFreq: 37900 Hz Clock: 40.000 MHz
  1024x768@60Hz 4:3 HorFreq: 48400 Hz Clock: 65.000 MHz
  1152x864@60Hz 4:3
  1280x1024@60Hz 5:4 HorFreq: 64000 Hz Clock: 108.000 MHz
Detailed mode: Clock 108.000 MHz, 376 mm x 301 mm
               1280 1328 1440 1688 hborder 0
               1024 1025 1028 1066 vborder 0
               +hsync +vsync 
               VertFreq: 60 Hz, HorFreq: 63981 Hz
Detailed mode: Clock 40.000 MHz, 376 mm x 301 mm
                800  840  968 1056 hborder 0
                600  601  605  628 vborder 0
               +hsync +vsync 
               VertFreq: 60 Hz, HorFreq: 37878 Hz
Monitor ranges (GTF): 56-75Hz V, 31-80kHz H, max dotclock 2550MHz
Monitor name: L90D Digital
Checksum: 0x5e (valid)
EDID block does NOT conform to EDID 1.3!
	Missing preferred timing
EDID block does not conform at all!
	Bad year of manufacture
