
EDID (hex):
00ffffffffffff002a59602300000000
2120010380341e782aca75a954459822
1f5054a54b00714081c081809500a9c0
b30090400101023a801871382d40582c
4500082c2100001e000000fd0030911f
ed24000a202020202020000000fc0032
374748512d4c45440a202020662156aa
51001e30468f3300aeff1000001e014a
020323f1444e02041023090707830100
0068030c001000384200681a00000101
3091edcf698088703812402c16450070
cf1000001eff7e807270381e40182035
00ba892100001e000000000000000000
00000000000000000000000000000000
00000000000000000000000000000000
000000000000000000000000000000bc

edid-decode (hex):

00 ff ff ff ff ff ff 00 2a 59 60 23 00 00 00 00
21 20 01 03 80 34 1e 78 2a ca 75 a9 54 45 98 22
1f 50 54 a5 4b 00 71 40 81 c0 81 80 95 00 a9 c0
b3 00 90 40 01 01 02 3a 80 18 71 38 2d 40 58 2c
45 00 08 2c 21 00 00 1e 00 00 00 fd 00 30 91 1f
ed 24 00 0a 20 20 20 20 20 20 00 00 00 fc 00 32
37 47 48 51 2d 4c 45 44 0a 20 20 20 66 21 56 aa
51 00 1e 30 46 8f 33 00 ae ff 10 00 00 1e 01 4a

02 03 23 f1 44 4e 02 04 10 23 09 07 07 83 01 00
00 68 03 0c 00 10 00 38 42 00 68 1a 00 00 01 01
30 91 ed cf 69 80 88 70 38 12 40 2c 16 45 00 70
cf 10 00 00 1e ff 7e 80 72 70 38 1e 40 18 20 35
00 ba 89 21 00 00 1e 00 00 00 00 00 00 00 00 00
00 00 00 00 00 00 00 00 00 00 00 00 00 00 00 00
00 00 00 00 00 00 00 00 00 00 00 00 00 00 00 00
00 00 00 00 00 00 00 00 00 00 00 00 00 00 00 bc

----------------

Block 0, Base EDID:
  EDID Structure Version & Revision: 1.3
  Vendor & Product Identification:
    Manufacturer: JRY
    Model: 9056
    Made in: week 33 of 2022
  Basic Display Parameters & Features:
    Digital display
    Maximum image size: 52 cm x 30 cm
    Gamma: 2.20
    DPMS levels: Off
    RGB color display
    First detailed timing is the preferred timing
  Color Characteristics:
    Red  : 0.6630, 0.3281
    Green: 0.2714, 0.5957
    Blue : 0.1337, 0.1240
    White: 0.3134, 0.3291
  Established Timings I & II:
    IBM     :   720x400    70.081663 Hz   9:5     31.467 kHz     28.320000 MHz
    DMT 0x04:   640x480    59.940476 Hz   4:3     31.469 kHz     25.175000 MHz
    DMT 0x06:   640x480    75.000000 Hz   4:3     37.500 kHz     31.500000 MHz
    DMT 0x09:   800x600    60.316541 Hz   4:3     37.879 kHz     40.000000 MHz
    DMT 0x0b:   800x600    75.000000 Hz   4:3     46.875 kHz     49.500000 MHz
    DMT 0x10:  1024x768    60.003840 Hz   4:3     48.363 kHz     65.000000 MHz
    DMT 0x12:  1024x768    75.028582 Hz   4:3     60.023 kHz     78.750000 MHz
    DMT 0x24:  1280x1024   75.024675 Hz   5:4     79.976 kHz    135.000000 MHz
  Standard Timings:
    GTF     :  1152x864    60.000000 Hz   4:3     53.700 kHz     81.624000 MHz
    DMT 0x55:  1280x720    60.000000 Hz  16:9     45.000 kHz     74.250000 MHz
    DMT 0x23:  1280x1024   60.019740 Hz   5:4     63.981 kHz    108.000000 MHz
    DMT 0x2f:  1440x900    59.887445 Hz  16:10    55.935 kHz    106.500000 MHz
    DMT 0x53:  1600x900    60.000000 Hz  16:9     60.000 kHz    108.000000 MHz (RB)
    DMT 0x3a:  1680x1050   59.954250 Hz  16:10    65.290 kHz    146.250000 MHz
    DMT 0x2a:  1400x1050   59.978442 Hz   4:3     65.317 kHz    121.750000 MHz
  Detailed Timing Descriptors:
    DTD 1:  1920x1080   60.000000 Hz  16:9     67.500 kHz    148.500000 MHz (520 mm x 300 mm)
                 Hfront   88 Hsync  44 Hback  148 Hpol P
                 Vfront    4 Vsync   5 Vback   36 Vpol P
    Display Range Limits:
      Monitor ranges (GTF): 48-145 Hz V, 31-237 kHz H, max dotclock 360 MHz
    Display Product Name: '27GHQ-LED'
    DTD 2:  1366x768    59.789541 Hz 683:384   47.712 kHz     85.500000 MHz (430 mm x 255 mm)
                 Hfront   70 Hsync 143 Hback  213 Hpol P
                 Vfront    3 Vsync   3 Vback   24 Vpol P
  Extension blocks: 1
Checksum: 0x4a

----------------

Block 1, CTA-861 Extension Block:
  Revision: 3
  Underscans IT Video Formats by default
  Basic audio support
  Supports YCbCr 4:4:4
  Supports YCbCr 4:2:2
  Native detailed modes: 1
  Video Data Block:
    VIC  78:  1920x1080  120.000000 Hz  64:27   135.000 kHz    297.000000 MHz
    VIC   2:   720x480    59.940060 Hz   4:3     31.469 kHz     27.000000 MHz
    VIC   4:  1280x720    60.000000 Hz  16:9     45.000 kHz     74.250000 MHz
    VIC  16:  1920x1080   60.000000 Hz  16:9     67.500 kHz    148.500000 MHz
  Audio Data Block:
    Linear PCM:
      Max channels: 2
      Supported sample rates (kHz): 48 44.1 32
      Supported sample sizes (bits): 24 20 16
  Speaker Allocation Data Block:
    FL/FR - Front Left/Right
  Vendor-Specific Data Block (HDMI), OUI 00-0C-03:
    Source physical address: 1.0.0.0
    DC_36bit
    DC_30bit
    DC_Y444
    Maximum TMDS clock: 330 MHz
  Vendor-Specific Data Block (AMD), OUI 00-00-1A:
    Version: 1.1
    Minimum Refresh Rate: 48 Hz
    Maximum Refresh Rate: 145 Hz
    Flags 1.x: 0xed (MCCS)
  Detailed Timing Descriptors:
    DTD 3:  1920x1080  119.987349 Hz  16:9    131.746 kHz    270.870000 MHz (368 mm x 207 mm)
                 Hfront   44 Hsync  22 Hback   70 Hpol P
                 Vfront    4 Vsync   5 Vback    9 Vpol P
    DTD 4:  1920x1080  143.997980 Hz  16:9    159.838 kHz    325.110000 MHz (698 mm x 393 mm)
                 Hfront   24 Hsync  32 Hback   58 Hpol P
                 Vfront    3 Vsync   5 Vback   22 Vpol P
Checksum: 0xbc  Unused space in Extension Block: 56 bytes


