
EDID (hex):
00ffffffffffff004dd9fa0601010101
24140104951d1078020f159a564b8b26
205054000000a9c00101010101010101
0101010101012f2a407161840f304040
330023a410000018b91d40df61840f30
4040330023a410000018000000fc0053
6f6e79204c43440a20202020000000fd
00273d24370b000a20202020202000da

Extracted contents:
header:          00 ff ff ff ff ff ff 00
serial number:   4d d9 fa 06 01 01 01 01 24 14
version:         01 04
basic params:    95 1d 10 78 02
chroma info:     0f 15 9a 56 4b 8b 26 20 50 54
established:     00 00 00
standard:        a9 c0 01 01 01 01 01 01 01 01 01 01 01 01 01 01
descriptor 1:    2f 2a 40 71 61 84 0f 30 40 40 33 00 23 a4 10 00 00 18
descriptor 2:    b9 1d 40 df 61 84 0f 30 40 40 33 00 23 a4 10 00 00 18
descriptor 3:    00 00 00 fc 00 53 6f 6e 79 20 4c 43 44 0a 20 20 20 20
descriptor 4:    00 00 00 fd 00 27 3d 24 37 0b 00 0a 20 20 20 20 20 20
extensions:      00
checksum:        da

EDID version: 1.4
Manufacturer: SNY Model 6fa Serial Number --
Made in week 36 of 2010
Digital display
6 bits per primary color channel
DisplayPort interface
Maximum image size: 29 cm x 16 cm
Gamma: 2.20
Supported color formats: RGB 4:4:4
First detailed timing includes the native pixel format and preferred refresh rate
Display x,y Chromaticity:
  Red:   0.6015, 0.3359
  Green: 0.2958, 0.5458
  Blue:  0.1484, 0.1259
  White: 0.3134, 0.3291
Established timings supported:
Standard timings supported:
  1600x900@60Hz 16:9
Detailed mode: Clock 107.990 MHz, 291 mm x 164 mm
               1600 1664 1728 1969 hborder 0
                900  903  906  915 vborder 0
               -hsync -vsync 
               VertFreq: 59 Hz, HorFreq: 54845 Hz
Detailed mode: Clock 76.090 MHz, 291 mm x 164 mm
               1600 1664 1728 2079 hborder 0
                900  903  906  915 vborder 0
               -hsync -vsync 
               VertFreq: 39 Hz, HorFreq: 36599 Hz
Monitor name: Sony LCD
Monitor ranges (GTF): 39-61Hz V, 36-55kHz H, max dotclock 110MHz
Checksum: 0xda (valid)
