
EDID (hex):
00ffffffffffff004dd9fa0600000000
0413010380261578f2ce50a3574c9926
0f505400000001010101010101010101
010101010101d02640c2608418302040
48007cd210000000602040c260841830
204048007cd210000000000000000000
00000000000000000000000000000000
000000000000000000000000000000dc

Extracted contents:
header:          00 ff ff ff ff ff ff 00
serial number:   4d d9 fa 06 00 00 00 00 04 13
version:         01 03
basic params:    80 26 15 78 f2
chroma info:     ce 50 a3 57 4c 99 26 0f 50 54
established:     00 00 00
standard:        01 01 01 01 01 01 01 01 01 01 01 01 01 01 01 01
descriptor 1:    d0 26 40 c2 60 84 18 30 20 40 48 00 7c d2 10 00 00 00
descriptor 2:    60 20 40 c2 60 84 18 30 20 40 48 00 7c d2 10 00 00 00
descriptor 3:    00 00 00 00 00 00 00 00 00 00 00 00 00 00 00 00 00 00
descriptor 4:    00 00 00 00 00 00 00 00 00 00 00 00 00 00 00 00 00 00
extensions:      00
checksum:        dc

EDID version: 1.3
Manufacturer: SNY Model 6fa Serial Number --
Made in week 4 of 2009
Digital display
Maximum image size: 38 cm x 21 cm
Gamma: 2.20
DPMS levels: Standby Suspend Off
Non-RGB color display
First detailed timing is preferred timing
Display x,y Chromaticity:
  Red:   0.6396, 0.3398
  Green: 0.2998, 0.5996
  Blue:  0.1494, 0.0595
  White: 0.3125, 0.3281
Established timings supported:
Standard timings supported:
Detailed mode: Clock 99.360 MHz, 380 mm x 210 mm
               1600 1632 1696 1794 hborder 0
                900  904  912  924 vborder 0
               -hsync -vsync analog composite 
               VertFreq: 59 Hz, HorFreq: 55384 Hz
Detailed mode: Clock 82.880 MHz, 380 mm x 210 mm
               1600 1632 1696 1794 hborder 0
                900  904  912  924 vborder 0
               -hsync -vsync analog composite 
               VertFreq: 49 Hz, HorFreq: 46198 Hz
Manufacturer-specified data, tag 0
Manufacturer-specified data, tag 0
Checksum: 0xdc (valid)
EDID block does NOT conform to EDID 1.3!
	Missing name descriptor
	Missing monitor ranges
