edid-decode (hex):

00 ff ff ff ff ff ff 00 4d d9 fa 06 01 01 01 01
30 16 01 04 95 1d 10 78 02 0f 15 9a 56 4b 8b 26
20 50 54 00 00 00 a9 c0 01 01 01 01 01 01 01 01
01 01 01 01 01 01 2f 2a 40 71 61 84 0f 30 40 40
33 00 23 a4 10 00 00 18 b9 1d 40 df 61 84 0f 30
40 40 33 00 23 a4 10 00 00 18 00 00 00 fc 00 53
6f 6e 79 20 4c 43 44 0a 20 20 20 20 00 00 00 fd
00 27 3d 24 37 0b 00 0a 20 20 20 20 20 20 00 cc

00 ff ff ff ff ff ff 00 4d d9 fa 06 01 01 01 01
30 16 01 04 95 1d 10 78 02 0f 15 9a 56 4b 8b 26
20 50 54 00 00 00 a9 c0 01 01 01 01 01 01 01 01
01 01 01 01 01 01 2f 2a 40 71 61 84 0f 30 40 40
33 00 23 a4 10 00 00 18 b9 1d 40 df 61 84 0f 30
40 40 33 00 23 a4 10 00 00 18 00 00 00 fc 00 53
6f 6e 79 20 4c 43 44 0a 20 20 20 20 00 00 00 fd
00 27 3d 24 37 0b 00 0a 20 20 20 20 20 20 00 cc

----------------

Block 0, Base EDID:
  EDID Structure Version & Revision: 1.4
  Vendor & Product Identification:
    Manufacturer: SNY
    Model: 1786
    Serial Number: ...
    Made in: week 48 of 2012
  Basic Display Parameters & Features:
    Digital display
    Bits per primary color channel: 6
    DisplayPort interface
    Maximum image size: 29 cm x 16 cm
    Gamma: 2.20
    Supported color formats: RGB 4:4:4
    First detailed timing includes the native pixel format and preferred refresh rate
  Color Characteristics:
    Red  : 0.6015, 0.3359
    Green: 0.2958, 0.5458
    Blue : 0.1484, 0.1259
    White: 0.3134, 0.3291
  Established Timings I & II: none
  Standard Timings:
    DMT 0x53:  1600x900    60.000000 Hz  16:9     60.000 kHz    108.000000 MHz (RB)
  Detailed Timing Descriptors:
    DTD 1:  1600x900    59.939999 Hz  16:9     54.845 kHz    107.990000 MHz (291 mm x 164 mm)
                 Hfront   64 Hsync  64 Hback  241 Hpol N
                 Vfront    3 Vsync   3 Vback    9 Vpol N
    DTD 2:  1600x900    39.999264 Hz  16:9     36.599 kHz     76.090000 MHz (291 mm x 164 mm)
                 Hfront   64 Hsync  64 Hback  351 Hpol N
                 Vfront    3 Vsync   3 Vback    9 Vpol N
    Display Product Name: 'Sony LCD'
    Display Range Limits:
      Monitor ranges (GTF): 39-61 Hz V, 36-55 kHz H, max dotclock 110 MHz
Checksum: 0xcc

----------------

Block 1, Unknown EDID Extension Block 0x00:
  00 ff ff ff ff ff ff 00 4d d9 fa 06 01 01 01 01 '........M.......'
  30 16 01 04 95 1d 10 78 02 0f 15 9a 56 4b 8b 26 '0......x....VK.&'
  20 50 54 00 00 00 a9 c0 01 01 01 01 01 01 01 01 ' PT.............'
  01 01 01 01 01 01 2f 2a 40 71 61 84 0f 30 40 40 '....../*@qa..0@@'
  33 00 23 a4 10 00 00 18 b9 1d 40 df 61 84 0f 30 '3.#.......@.a..0'
  40 40 33 00 23 a4 10 00 00 18 00 00 00 fc 00 53 '@@3.#..........S'
  6f 6e 79 20 4c 43 44 0a 20 20 20 20 00 00 00 fd 'ony LCD.    ....'
  00 27 3d 24 37 0b 00 0a 20 20 20 20 20 20 00 cc '.'=$7...      ..'
Checksum: 0xcc

----------------

Warnings:

Block 0, Base EDID:
  Display Range Limits: GTF support is deprecated in EDID 1.4.
EDID:
  Base EDID: Some timings are out of range of the Monitor Ranges:
    Horizontal Freq: 36.599 - 60.000 kHz (Monitor: 36.000 - 55.000 kHz)

Failures:

Block 0, Base EDID:
  Display Range Limits: GTF can't be combined with non-continuous frequencies.
Block 1, Base EDID:
  Unknown Extension Block.
EDID:
  Base EDID: EDID specified 0 extension block(s), but found 1 extension block(s).

EDID conformity: FAIL
