edid-decode (hex):

00 ff ff ff ff ff ff 00 4d d9 fa 06 00 00 00 00
04 13 01 03 80 1f 11 78 f2 ce 50 a3 57 4c 99 26
0f 50 54 00 00 00 01 01 01 01 01 01 01 01 01 01
01 01 01 01 01 01 e4 2a 40 e6 60 84 65 30 26 4c
01 06 36 aa 10 00 00 00 f8 2a 40 fc 62 84 1e 30
7f fe 5a 00 36 aa 10 00 00 00 00 00 00 00 00 00
00 00 00 00 00 00 00 00 00 00 00 00 00 00 00 00
00 00 00 00 00 00 00 00 00 00 00 00 00 00 00 56

----------------

Block 0, Base EDID:
  EDID Structure Version & Revision: 1.3
  Vendor & Product Identification:
    Manufacturer: SNY
    Model: 1786
    Made in: week 4 of 2009
  Basic Display Parameters & Features:
    Digital display
    Maximum image size: 31 cm x 17 cm
    Gamma: 2.20
    DPMS levels: Standby Suspend Off
    Non-RGB color display
    First detailed timing is the preferred timing
  Color Characteristics:
    Red  : 0.6396, 0.3398
    Green: 0.2998, 0.5996
    Blue : 0.1494, 0.0595
    White: 0.3125, 0.3281
  Established Timings I & II: none
  Standard Timings: none
  Detailed Timing Descriptors:
    DTD 1:  1600x900    59.940060 Hz  16:9     60.000 kHz    109.800000 MHz (analog composite, sync-on-green, 310 mm x 170 mm)
                 Hfront   38 Hsync  76 Hback  116 Hpol N
                 Vfront   16 Vsync  33 Vback   52 Vpol N
    DTD 2:  1600x900    50.033659 Hz  16:9     46.531 kHz    110.000000 MHz (analog composite, sync-on-green, 310 mm x 170 mm)
                 Hfront  127 Hsync 254 Hback  383 Hpol N
                 Vfront    5 Vsync  10 Vback   15 Vpol N
    Empty Descriptor
    Empty Descriptor
Checksum: 0x56

----------------

Failures:

Block 0, Base EDID:
  Empty Descriptor: Use Dummy Descriptor instead of all zeroes.
  Empty Descriptor: Use Dummy Descriptor instead of all zeroes.
  Missing Display Product Name.
  Missing Display Range Limits Descriptor.

EDID conformity: FAIL
