edid-decode (hex):

00 ff ff ff ff ff ff 00 1e 6d 0d 78 c5 71 05 00
07 22 01 04 c5 50 21 78 f8 59 a5 ad 52 40 ae 25
0e 50 54 21 09 00 d1 c0 61 40 45 40 01 01 01 01
01 01 01 01 01 01 4e d4 70 a0 d0 a0 46 50 30 20
3a 00 1b 4d 31 00 00 1a 00 00 00 fd 08 30 f0 1e
91 8c 00 0a 20 20 20 20 20 20 00 00 00 fc 00 4c
47 20 55 4c 54 52 41 47 45 41 52 2b 00 00 00 ff
00 34 30 37 4e 54 5a 4e 41 47 38 30 35 0a 02 05

02 03 1a 73 23 0f 57 07 83 4f 00 00 e3 05 c0 00
e6 06 05 01 73 4f 01 e2 00 6a e7 7c 70 a0 d0 a0
29 50 30 20 3a 00 1b 4d 31 00 00 1a 9d 67 70 a0
d0 a0 22 50 30 20 3a 00 1b 4d 31 00 00 1a 00 00
00 00 00 00 00 00 00 00 00 00 00 00 00 00 00 00
00 00 00 00 00 00 00 00 00 00 00 00 00 00 00 00
00 00 00 00 00 00 00 00 00 00 00 00 00 00 00 00
00 00 00 00 00 00 00 00 00 00 00 00 00 00 00 97

70 12 79 03 00 01 00 0c 0e 1f 02 0d 70 0d a0 05
90 78 ff bb 0f 00 0a a4 14 0e 0e 07 01 23 00 00
00 03 01 50 9a 22 02 88 6f 0d 9f 00 07 80 1f 00
9f 05 b2 00 51 00 07 00 90 38 01 08 6f 0d 9f 00
07 80 1f 00 9f 05 66 00 2b 00 07 00 6e 01 01 08
6f 0d 9f 00 07 80 1f 00 9f 05 54 00 22 00 07 00
93 6f 00 08 7f 07 9f 00 07 80 1f 00 37 04 3f 00
17 00 07 00 00 00 00 00 00 00 00 00 00 00 8f 90

00 ff ff ff ff ff ff 00 1e 6d 0d 78 c5 71 05 00
07 22 01 04 c5 50 21 78 f8 59 a5 ad 52 40 ae 25
0e 50 54 21 09 00 d1 c0 61 40 45 40 01 01 01 01
01 01 01 01 01 01 4e d4 70 a0 d0 a0 46 50 30 20
3a 00 1b 4d 31 00 00 1a 00 00 00 fd 08 30 f0 1e
91 8c 00 0a 20 20 20 20 20 20 00 00 00 fc 00 4c
47 20 55 4c 54 52 41 47 45 41 52 2b 00 00 00 ff
00 34 30 37 4e 54 5a 4e 41 47 38 30 35 0a 02 05

02 03 1a 73 23 0f 57 07 83 4f 00 00 e3 05 c0 00
e6 06 05 01 73 4f 01 e2 00 6a e7 7c 70 a0 d0 a0
29 50 30 20 3a 00 1b 4d 31 00 00 1a 9d 67 70 a0
d0 a0 22 50 30 20 3a 00 1b 4d 31 00 00 1a 00 00
00 00 00 00 00 00 00 00 00 00 00 00 00 00 00 00
00 00 00 00 00 00 00 00 00 00 00 00 00 00 00 00
00 00 00 00 00 00 00 00 00 00 00 00 00 00 00 00
00 00 00 00 00 00 00 00 00 00 00 00 00 00 00 97

70 12 79 03 00 01 00 0c 0e 1f 02 0d 70 0d a0 05
90 78 ff bb 0f 00 0a a4 14 0e 0e 07 01 23 00 00
00 03 01 50 9a 22 02 88 6f 0d 9f 00 07 80 1f 00
9f 05 b2 00 51 00 07 00 90 38 01 08 6f 0d 9f 00
07 80 1f 00 9f 05 66 00 2b 00 07 00 6e 01 01 08
6f 0d 9f 00 07 80 1f 00 9f 05 54 00 22 00 07 00
93 6f 00 08 7f 07 9f 00 07 80 1f 00 37 04 3f 00
17 00 07 00 00 00 00 00 00 00 00 00 00 00 8f 90

----------------

Block 0, Base EDID:
  EDID Structure Version & Revision: 1.4
  Vendor & Product Identification:
    Manufacturer: GSM
    Model: 30733
    Serial Number: ...
    Made in: week 7 of 2024
  Basic Display Parameters & Features:
    Digital display
    Bits per primary color channel: 12
    DisplayPort interface
    Maximum image size: 80 cm x 33 cm
    Gamma: 2.20
    DPMS levels: Standby Suspend Off
    Supported color formats: RGB 4:4:4, YCrCb 4:4:4, YCrCb 4:2:2
    First detailed timing does not include the native pixel format and preferred refresh rate
  Color Characteristics:
    Red  : 0.6767, 0.3212
    Green: 0.2519, 0.6806
    Blue : 0.1464, 0.0566
    White: 0.3134, 0.3291
  Established Timings I & II:
    DMT 0x04:   640x480    59.940476 Hz   4:3     31.469 kHz     25.175000 MHz
    DMT 0x09:   800x600    60.316541 Hz   4:3     37.879 kHz     40.000000 MHz
    DMT 0x10:  1024x768    60.003840 Hz   4:3     48.363 kHz     65.000000 MHz
    DMT 0x24:  1280x1024   75.024675 Hz   5:4     79.976 kHz    135.000000 MHz
  Standard Timings:
    DMT 0x52:  1920x1080   60.000000 Hz  16:9     67.500 kHz    148.500000 MHz
    DMT 0x10:  1024x768    60.003840 Hz   4:3     48.363 kHz     65.000000 MHz
    DMT 0x09:   800x600    60.316541 Hz   4:3     37.879 kHz     40.000000 MHz
  Detailed Timing Descriptors:
    DTD 1:  3440x1440   99.981604 Hz  43:18   150.972 kHz    543.500000 MHz (795 mm x 333 mm)
                 Hfront   48 Hsync  32 Hback   80 Hpol P
                 Vfront    3 Vsync  10 Vback   57 Vpol N
    Display Range Limits:
      Monitor ranges (GTF): 48-240 Hz V, 30-400 kHz H, max dotclock 1400 MHz
    Display Product Name: 'LG ULTRAGEAR+'
    Display Product Serial Number: ...
  Extension blocks: 2
Checksum: 0x05

----------------

Block 1, CTA-861 Extension Block:
  Revision: 3
  Basic audio support
  Supports YCbCr 4:4:4
  Supports YCbCr 4:2:2
  Native detailed modes: 3
  Audio Data Block:
    Linear PCM:
      Max channels: 8
      Supported sample rates (kHz): 192 96 48 44.1 32
      Supported sample sizes (bits): 24 20 16
  Speaker Allocation Data Block:
    FL/FR - Front Left/Right
    LFE1 - Low Frequency Effects 1
    FC - Front Center
    BL/BR - Back Left/Right
    RLC/RRC - Rear Left/Right of Center (Deprecated)
  Colorimetry Data Block:
    BT2020YCC
    BT2020RGB
  HDR Static Metadata Data Block:
    Electro optical transfer functions:
      Traditional gamma - SDR luminance range
      SMPTE ST2084
    Supported static metadata descriptors:
      Static metadata type 1
    Desired content max luminance: 115 (603.666 cd/m^2)
    Desired content max frame-average luminance: 79 (276.782 cd/m^2)
    Desired content min luminance: 1 (0.000 cd/m^2)
  Video Capability Data Block:
    YCbCr quantization: No Data
    RGB quantization: Selectable (via AVI Q)
    PT scan behavior: Always Underscanned
    IT scan behavior: Always Underscanned
    CE scan behavior: Always Underscanned
  Detailed Timing Descriptors:
    DTD 2:  3440x1440   59.972616 Hz  43:18    88.819 kHz    319.750000 MHz (795 mm x 333 mm)
                 Hfront   48 Hsync  32 Hback   80 Hpol P
                 Vfront    3 Vsync  10 Vback   28 Vpol N
    DTD 3:  3440x1440   49.986808 Hz  43:18    73.681 kHz    265.250000 MHz (795 mm x 333 mm)
                 Hfront   48 Hsync  32 Hback   80 Hpol P
                 Vfront    3 Vsync  10 Vback   21 Vpol N
Checksum: 0x97  Unused space in Extension Block: 65 bytes

----------------

Block 2, DisplayID Extension Block:
  Version: 1.2
  Extension Count: 0
  Display Product Type: Standalone display device
  Display Parameters Data Block (0x01):
    Image size: 795.0 mm x 333.0 mm
    Display native pixel format: 3440x1440
    Feature support flags:
      Power management (DPM)
      Audio support on video interface
    Gamma: 2.20
    Aspect ratio: 3.55
    Dynamic bpc native: 12
    Dynamic bpc overall: 12
  Display Interface Data Block:
    Interface Type: DisplayPort
    Number of Links: 4
    Interface Standard Version: 1.4
    Supported bpc for RGB encoding: 8, 10, 12
    Supported bpc for YCbCr 4:4:4 encoding: 8, 10, 12
    Supported bpc for YCbCr 4:2:2 encoding: 8, 10, 12
    Supported Content Protection: HDCP 2.3
    Spread Spectrum: None
  Video Timing Modes Type 1 - Detailed Timings Data Block:
    DTD:  3440x1440  240.084757 Hz   0:0    388.697 kHz   1399.310000 MHz (aspect undefined, no 3D stereo, preferred)
               Hfront    8 Hsync  32 Hback  120 Hpol P
               Vfront   82 Vsync   8 Vback   89 Vpol N
    DTD:  3440x1440  144.050191 Hz   0:0    222.269 kHz    800.170000 MHz (aspect undefined, no 3D stereo)
               Hfront    8 Hsync  32 Hback  120 Hpol P
               Vfront   44 Vsync   8 Vback   51 Vpol N
    DTD:  3440x1440  120.041894 Hz   0:0    183.064 kHz    659.030000 MHz (aspect undefined, no 3D stereo)
               Hfront    8 Hsync  32 Hback  120 Hpol P
               Vfront   35 Vsync   8 Vback   42 Vpol N
    DTD:  1920x1080  120.041017 Hz   0:0    137.327 kHz    285.640000 MHz (aspect undefined, no 3D stereo)
               Hfront    8 Hsync  32 Hback  120 Hpol P
               Vfront   24 Vsync   8 Vback   32 Vpol N
  Checksum: 0x8f
Checksum: 0x90

----------------

Block 3, Unknown EDID Extension Block 0x00:
  00 ff ff ff ff ff ff 00 1e 6d 0d 78 c5 71 05 00 '.........m.x.q..'
  07 22 01 04 c5 50 21 78 f8 59 a5 ad 52 40 ae 25 '."...P!x.Y..R@.%'
  0e 50 54 21 09 00 d1 c0 61 40 45 40 01 01 01 01 '.PT!....a@E@....'
  01 01 01 01 01 01 4e d4 70 a0 d0 a0 46 50 30 20 '......N.p...FP0 '
  3a 00 1b 4d 31 00 00 1a 00 00 00 fd 08 30 f0 1e ':..M1........0..'
  91 8c 00 0a 20 20 20 20 20 20 00 00 00 fc 00 4c '....      .....L'
  47 20 55 4c 54 52 41 47 45 41 52 2b 00 00 00 ff 'G ULTRAGEAR+....'
  00 34 30 37 4e 54 5a 4e 41 47 38 30 35 0a 02 05 '.407NTZNAG805...'
Checksum: 0x05

----------------

Block 4, CTA-861 Extension Block:
  Revision: 3
  Basic audio support
  Supports YCbCr 4:4:4
  Supports YCbCr 4:2:2
  Native detailed modes: 3
  Audio Data Block:
    Linear PCM:
      Max channels: 8
      Supported sample rates (kHz): 192 96 48 44.1 32
      Supported sample sizes (bits): 24 20 16
  Speaker Allocation Data Block:
    FL/FR - Front Left/Right
    LFE1 - Low Frequency Effects 1
    FC - Front Center
    BL/BR - Back Left/Right
    RLC/RRC - Rear Left/Right of Center (Deprecated)
  Colorimetry Data Block:
    BT2020YCC
    BT2020RGB
  HDR Static Metadata Data Block:
    Electro optical transfer functions:
      Traditional gamma - SDR luminance range
      SMPTE ST2084
    Supported static metadata descriptors:
      Static metadata type 1
    Desired content max luminance: 115 (603.666 cd/m^2)
    Desired content max frame-average luminance: 79 (276.782 cd/m^2)
    Desired content min luminance: 1 (0.000 cd/m^2)
  Video Capability Data Block:
    YCbCr quantization: No Data
    RGB quantization: Selectable (via AVI Q)
    PT scan behavior: Always Underscanned
    IT scan behavior: Always Underscanned
    CE scan behavior: Always Underscanned
  Detailed Timing Descriptors:
    DTD 4:  3440x1440   59.972616 Hz  43:18    88.819 kHz    319.750000 MHz (795 mm x 333 mm)
                 Hfront   48 Hsync  32 Hback   80 Hpol P
                 Vfront    3 Vsync  10 Vback   28 Vpol N
    DTD 5:  3440x1440   49.986808 Hz  43:18    73.681 kHz    265.250000 MHz (795 mm x 333 mm)
                 Hfront   48 Hsync  32 Hback   80 Hpol P
                 Vfront    3 Vsync  10 Vback   21 Vpol N
Checksum: 0x97  Unused space in Extension Block: 65 bytes

----------------

Block 5, DisplayID Extension Block:
  Version: 1.2
  Extension Count: 0
  Display Parameters Data Block (0x01):
    Image size: 795.0 mm x 333.0 mm
    Display native pixel format: 3440x1440
    Feature support flags:
      Power management (DPM)
      Audio support on video interface
    Gamma: 2.20
    Aspect ratio: 3.55
    Dynamic bpc native: 12
    Dynamic bpc overall: 12
  Display Interface Data Block:
    Interface Type: DisplayPort
    Number of Links: 4
    Interface Standard Version: 1.4
    Supported bpc for RGB encoding: 8, 10, 12
    Supported bpc for YCbCr 4:4:4 encoding: 8, 10, 12
    Supported bpc for YCbCr 4:2:2 encoding: 8, 10, 12
    Supported Content Protection: HDCP 2.3
    Spread Spectrum: None
  Video Timing Modes Type 1 - Detailed Timings Data Block:
    DTD:  3440x1440  240.084757 Hz   0:0    388.697 kHz   1399.310000 MHz (aspect undefined, no 3D stereo, preferred)
               Hfront    8 Hsync  32 Hback  120 Hpol P
               Vfront   82 Vsync   8 Vback   89 Vpol N
    DTD:  3440x1440  144.050191 Hz   0:0    222.269 kHz    800.170000 MHz (aspect undefined, no 3D stereo)
               Hfront    8 Hsync  32 Hback  120 Hpol P
               Vfront   44 Vsync   8 Vback   51 Vpol N
    DTD:  3440x1440  120.041894 Hz   0:0    183.064 kHz    659.030000 MHz (aspect undefined, no 3D stereo)
               Hfront    8 Hsync  32 Hback  120 Hpol P
               Vfront   35 Vsync   8 Vback   42 Vpol N
    DTD:  1920x1080  120.041017 Hz   0:0    137.327 kHz    285.640000 MHz (aspect undefined, no 3D stereo)
               Hfront    8 Hsync  32 Hback  120 Hpol P
               Vfront   24 Vsync   8 Vback   32 Vpol N
  Checksum: 0x8f
Checksum: 0x90

----------------

Warnings:

Block 0, Base EDID:
  Display Range Limits: GTF support is deprecated in EDID 1.4.
Block 1, CTA-861 Extension Block:
  IT Video Formats are overscanned by default, but normally this should be underscanned.
  Colorimetry Data Block: Set the sRGB colorimetry bit to avoid interop issues.
  Video Capability Data Block: Set Selectable YCbCr Quantization to avoid interop issues.
  Video Capability Data Block: S_PT is equal to S_IT and S_CE, so should be set to 0 instead.
  Display Product Serial Number is set, so the Serial Number in the Base EDID should be 0.
Block 4, CTA-861 Extension Block:
  IT Video Formats are overscanned by default, but normally this should be underscanned.
  Colorimetry Data Block: Set the sRGB colorimetry bit to avoid interop issues.
  Video Capability Data Block: Set Selectable YCbCr Quantization to avoid interop issues.
  Video Capability Data Block: S_PT is equal to S_IT and S_CE, so should be set to 0 instead.
  Display Product Serial Number is set, so the Serial Number in the Base EDID should be 0.
EDID:
  CTA-861: Multiple native progressive timings are defined.

Failures:

Block 0, Base EDID:
  Display Range Limits: GTF can't be combined with non-continuous frequencies.
Block 1, CTA-861 Extension Block:
  Video Capability Data Block: IT video formats are always underscanned, but bit 7 of Byte 3 of the CTA-861 Extension header is set to overscanned.
Block 2, DisplayID Extension Block:
  Expected 0 DisplayID Extension Block, but got 1.
Block 3, Base EDID:
  Unknown Extension Block.
Block 4, CTA-861 Extension Block:
  Speaker Allocation Data Block: Only one instance of this Data Block is allowed.
  Colorimetry Data Block: Only one instance of this Data Block is allowed.
  HDR Static Metadata Data Block: Only one instance of this Data Block is allowed.
  Video Capability Data Block: Only one instance of this Data Block is allowed.
  Video Capability Data Block: IT video formats are always underscanned, but bit 7 of Byte 3 of the CTA-861 Extension header is set to overscanned.
Block 5, DisplayID Extension Block:
  Product Type should be 0 in extension block.
  Display Parameters Data Block (0x01): Duplicate Display Parameters Data Block.
EDID:
  Base EDID: EDID specified 2 extension block(s), but found 5 extension block(s).
  DisplayID: Missing DisplayID Product Identification Data Block.

EDID conformity: FAIL
