edid-decode (hex):

00 ff ff ff ff ff ff 00 3e 83 20 01 00 00 00 00
05 11 01 03 28 25 1e 64 ca fd 7c a4 57 49 9a 25
12 47 4f a5 6e 80 81 80 01 01 01 01 01 01 01 01
01 01 01 01 01 01 94 2a 00 b0 51 00 24 40 50 88
17 00 52 0e 11 00 00 1c 00 00 00 ff 00 30 30 30
30 30 30 30 30 30 30 30 30 0a 00 00 00 fd 00 37
4b 1e 40 0b 00 0a 20 20 20 20 20 20 00 00 00 fc
00 31 39 52 54 56 28 4e 45 57 29 0a 20 20 00 2a

----------------

Block 0, Base EDID:
  EDID Structure Version & Revision: 1.3
  Vendor & Product Identification:
    Manufacturer: OTC
    Model: 288
    Made in: week 5 of 2007
  Basic Display Parameters & Features:
    Analog display
    Input voltage level: 0.714/0.286 V
    Sync: Separate
    Maximum image size: 37 cm x 30 cm
    Gamma: 2.00
    DPMS levels: Standby Suspend
    RGB color display
    First detailed timing is preferred timing
  Color Characteristics:
    Red  : 0.6435, 0.3427
    Green: 0.2880, 0.6025
    Blue : 0.1455, 0.0732
    White: 0.2802, 0.3085
  Established Timings I & II:
    IBM     :   720x400    70.082 Hz   9:5    31.467 kHz  28.320 MHz
    DMT 0x04:   640x480    59.940 Hz   4:3    31.469 kHz  25.175 MHz
    DMT 0x06:   640x480    75.000 Hz   4:3    37.500 kHz  31.500 MHz
    DMT 0x09:   800x600    60.317 Hz   4:3    37.879 kHz  40.000 MHz
    DMT 0x0b:   800x600    75.000 Hz   4:3    46.875 kHz  49.500 MHz
    Apple   :   832x624    74.551 Hz   4:3    49.726 kHz  57.284 MHz
    DMT 0x10:  1024x768    60.004 Hz   4:3    48.363 kHz  65.000 MHz
    DMT 0x11:  1024x768    70.069 Hz   4:3    56.476 kHz  75.000 MHz
    DMT 0x12:  1024x768    75.029 Hz   4:3    60.023 kHz  78.750 MHz
    Apple   :  1152x870    75.062 Hz 192:145  68.681 kHz 100.000 MHz
  Standard Timings:
    DMT 0x23:  1280x1024   60.020 Hz   5:4    63.981 kHz 108.000 MHz
  Detailed Timing Descriptors:
    DTD 1:  1280x1024   60.064 Hz   5:4    63.668 kHz 109.000 MHz (338 mm x 270 mm)
                 Hfront   80 Hsync 136 Hback 216 Hpol N
                 Vfront    1 Vsync   7 Vback  28 Vpol P
    Display Product Serial Number: ...
  Display Range Limits:
    Monitor ranges (GTF): 55-75 Hz V, 30-64 kHz H, max dotclock 110 MHz
    Display Product Name: '19RTV(NEW)'
Checksum: 0x2a
