edid-decode (hex):

00 ff ff ff ff ff ff 00 26 cf fa 03 00 00 00 00
00 17 01 03 80 16 0d 78 0a 21 d0 94 58 56 8f 27
1f 50 54 00 00 00 01 01 01 01 01 01 01 01 01 01
01 01 01 01 01 01 05 1e 56 c2 50 00 35 30 30 20
3c 00 df 7d 00 00 00 19 00 00 00 00 00 00 00 00
00 00 00 00 00 00 00 00 00 00 00 00 00 fe 00 49
6e 66 6f 56 69 73 69 6f 6e 0a 20 20 00 00 00 fe
00 4d 31 30 31 4e 57 4e 38 20 52 30 20 0a 00 07

----------------

Block 0, Base EDID:
  EDID Structure Version & Revision: 1.3
  Vendor & Product Identification:
    Manufacturer: IVO
    Model: 1018
    Made in: 2013
  Basic Display Parameters & Features:
    Digital display
    Maximum image size: 22 cm x 13 cm
    Gamma: 2.20
    RGB color display
    First detailed timing is preferred timing
  Color Characteristics:
    Red  : 0.5781, 0.3457
    Green: 0.3359, 0.5595
    Blue : 0.1552, 0.1220
    White: 0.3125, 0.3281
  Established Timings I & II: none
  Standard Timings: none
  Detailed Timing Descriptors:
    DTD 1:  1366x768    60.003 Hz 683:384  49.263 kHz  76.850 MHz (223 mm x 125 mm)
                 Hfront   48 Hsync  32 Hback 114 Hpol N
                 Vfront    3 Vsync  12 Vback  38 Vpol N
    Empty Descriptor
    Alphanumeric Data String: 'InfoVision'
    Alphanumeric Data String: 'M101NWN8 R0 '
Checksum: 0x7
