
EDID (hex):
00ffffffffffff001e6df05678730400
0515010380331d780aaec5a2574a9c25
125054a76b80b300818f8180714f0101
0101010101011a3680a070381f403020
3500fe221100001e023a801871382d40
532c4500fe221100001e000000fd0038
3d1e530f000a202020202020000000fc
0057323335330a20202020202020017c
020321f14e900403011412051f101300
000000230907078301000065030c0010
00023a801871382d40582c4500fe2211
00001e011d8018711c1620582c2500fe
221100009e011d007251d01e206e2855
00fe221100001e8c0ad08a20e02d1010
3e9600fe221100001800000000000000
000000000000000000000000000000de

Extracted contents:
header:          00 ff ff ff ff ff ff 00
serial number:   1e 6d f0 56 78 73 04 00 05 15
version:         01 03
basic params:    80 33 1d 78 0a
chroma info:     ae c5 a2 57 4a 9c 25 12 50 54
established:     a7 6b 80
standard:        b3 00 81 8f 81 80 71 4f 01 01 01 01 01 01 01 01
descriptor 1:    1a 36 80 a0 70 38 1f 40 30 20 35 00 fe 22 11 00 00 1e
descriptor 2:    02 3a 80 18 71 38 2d 40 53 2c 45 00 fe 22 11 00 00 1e
descriptor 3:    00 00 00 fd 00 38 3d 1e 53 0f 00 0a 20 20 20 20 20 20
descriptor 4:    00 00 00 fc 00 57 32 33 35 33 0a 20 20 20 20 20 20 20
extensions:      01
checksum:        7c

EDID version: 1.3
Manufacturer: GSM Model 56f0 Serial Number --
Made in week 5 of 2011
Digital display
Maximum image size: 51 cm x 29 cm
Gamma: 2.20
RGB color display
First detailed timing is preferred timing
Display x,y Chromaticity:
  Red:   0.6347, 0.3417
  Green: 0.2919, 0.6113
  Blue:  0.1474, 0.0703
  White: 0.3134, 0.3291
Established timings supported:
  720x400@70Hz 9:5 HorFreq: 31469 Hz Clock: 28.320 MHz
  640x480@60Hz 4:3 HorFreq: 31469 Hz Clock: 25.175 MHz
  640x480@75Hz 4:3 HorFreq: 37500 Hz Clock: 31.500 MHz
  800x600@56Hz 4:3 HorFreq: 35200 Hz Clock: 36.000 MHz
  800x600@60Hz 4:3 HorFreq: 37900 Hz Clock: 40.000 MHz
  800x600@75Hz 4:3 HorFreq: 46900 Hz Clock: 49.500 MHz
  832x624@75Hz 4:3 HorFreq: 49726 Hz Clock: 57.284 MHz
  1024x768@60Hz 4:3 HorFreq: 48400 Hz Clock: 65.000 MHz
  1024x768@75Hz 4:3 HorFreq: 60000 Hz Clock: 78.750 MHz
  1280x1024@75Hz 5:4 HorFreq: 80000 Hz Clock: 135.000 MHz
  1152x870@75Hz 192:145 HorFreq: 67500 Hz Clock: 108.000 MHz
Standard timings supported:
  1680x1050@60Hz 16:10 HorFreq: 64700 Hz Clock: 119.000 MHz
  1280x1024@75Hz 5:4 HorFreq: 80000 Hz Clock: 135.000 MHz
  1280x1024@60Hz 5:4 HorFreq: 64000 Hz Clock: 108.000 MHz
  1152x864@75Hz 4:3 HorFreq: 67500 Hz Clock: 108.000 MHz
Detailed mode: Clock 138.500 MHz, 510 mm x 290 mm
               1920 1968 2000 2080 hborder 0
               1080 1083 1088 1111 vborder 0
               +hsync +vsync 
               VertFreq: 59 Hz, HorFreq: 66586 Hz
Detailed mode: Clock 148.500 MHz, 510 mm x 290 mm
               1920 2003 2047 2200 hborder 0
               1080 1084 1089 1125 vborder 0
               +hsync +vsync 
               VertFreq: 60 Hz, HorFreq: 67500 Hz
Monitor ranges (GTF): 56-61Hz V, 30-83kHz H, max dotclock 150MHz
Monitor name: W2353
Has 1 extension blocks
Checksum: 0x7c (valid)

CTA extension block
Extension version: 3
29 bytes of CTA data
  Video data block
    VIC  16 1920x1080@60Hz 16:9 (native) HorFreq: 67500 Hz Clock: 148.500 MHz
    VIC   4 1280x720@60Hz 16:9  HorFreq: 45000 Hz Clock: 74.250 MHz
    VIC   3 720x480@60Hz 16:9  HorFreq: 31469 Hz Clock: 27.000 MHz
    VIC   1 640x480@60Hz 4:3  HorFreq: 31469 Hz Clock: 25.175 MHz
    VIC  20 1920x1080i@50Hz 16:9  HorFreq: 28125 Hz Clock: 74.250 MHz
    VIC  18 720x576@50Hz 16:9  HorFreq: 31250 Hz Clock: 27.000 MHz
    VIC   5 1920x1080i@60Hz 16:9  HorFreq: 33750 Hz Clock: 74.250 MHz
    VIC  31 1920x1080@50Hz 16:9  HorFreq: 56250 Hz Clock: 148.500 MHz
    VIC  16 1920x1080@60Hz 16:9  HorFreq: 67500 Hz Clock: 148.500 MHz
    VIC  19 1280x720@50Hz 16:9  HorFreq: 37500 Hz Clock: 74.250 MHz
  Audio data block
    Linear PCM, max channels 2
      Supported sample rates (kHz): 48 44.1 32
      Supported sample sizes (bits): 24 20 16
  Speaker allocation data block
    Speaker map:
      FL/FR - Front Left/Right
  Vendor-specific data block, OUI 000c03 (HDMI)
    Source physical address 1.0.0.0
Underscans PC formats by default
Basic audio support
Supports YCbCr 4:4:4
Supports YCbCr 4:2:2
1 native detailed modes
Detailed mode: Clock 148.500 MHz, 510 mm x 290 mm
               1920 2008 2052 2200 hborder 0
               1080 1084 1089 1125 vborder 0
               +hsync +vsync 
               VertFreq: 60 Hz, HorFreq: 67500 Hz
Detailed mode: Clock 74.250 MHz, 510 mm x 290 mm
               1920 2008 2052 2200 hborder 0
                540  542  547  562 vborder 0
               +hsync +vsync interlaced 
               VertFreq: 60 Hz, HorFreq: 33750 Hz
Detailed mode: Clock 74.250 MHz, 510 mm x 290 mm
               1280 1390 1430 1650 hborder 0
                720  725  730  750 vborder 0
               +hsync +vsync 
               VertFreq: 60 Hz, HorFreq: 45000 Hz
Detailed mode: Clock 27.000 MHz, 510 mm x 290 mm
                720  736  798  858 hborder 0
                480  489  495  525 vborder 0
               -hsync -vsync 
               VertFreq: 59 Hz, HorFreq: 31468 Hz
Checksum: 0xde (valid)

One or more of the timings is out of range of the Monitor Ranges:
  Vertical Freq: 50 - 75 Hz
  Horizontal Freq: 28125 - 80000 Hz
  Maximum Clock: 148.500 MHz


