
EDID (hex):
00ffffffffffff004dd9032301010101
03170103807a44780a0dc9a057479827
12484c20000001010101010101010101
010101010101023a801871382d40582c
4500c2ad4200001e011d007251d01e20
6e285500c2ad4200001e000000fc0053
4f4e5920545620202a30310a000000fd
00303e0e460f000a2020202020200187
02034af44f1f101405130420223c3e12
03110201350f7f071507553d1fc05707
006754005f7e014d0200835f00007403
0c001800b82d2fd00a0140007f203070
768090e200fbe3051f01023a80d07238
2d40102c4580c2ad4200001e011d00bc
52d01e20b8285540c2ad4200001e0000
00000000000000000000000000000046

Extracted contents:
header:          00 ff ff ff ff ff ff 00
serial number:   4d d9 03 23 01 01 01 01 03 17
version:         01 03
basic params:    80 7a 44 78 0a
chroma info:     0d c9 a0 57 47 98 27 12 48 4c
established:     20 00 00
standard:        01 01 01 01 01 01 01 01 01 01 01 01 01 01 01 01
descriptor 1:    02 3a 80 18 71 38 2d 40 58 2c 45 00 c2 ad 42 00 00 1e
descriptor 2:    01 1d 00 72 51 d0 1e 20 6e 28 55 00 c2 ad 42 00 00 1e
descriptor 3:    00 00 00 fc 00 53 4f 4e 59 20 54 56 20 20 2a 30 31 0a
descriptor 4:    00 00 00 fd 00 30 3e 0e 46 0f 00 0a 20 20 20 20 20 20
extensions:      01
checksum:        87

EDID version: 1.3
Manufacturer: SNY Model 2303 Serial Number --
Made in week 3 of 2013
Digital display
Maximum image size: 122 cm x 68 cm
Gamma: 2.20
RGB color display
First detailed timing is preferred timing
Display x,y Chromaticity:
  Red:   0.6250, 0.3398
  Green: 0.2802, 0.5947
  Blue:  0.1552, 0.0703
  White: 0.2832, 0.2978
Established timings supported:
  640x480@60Hz 4:3 HorFreq: 31469 Hz Clock: 25.175 MHz
Standard timings supported:
Detailed mode: Clock 148.500 MHz, 1218 mm x 685 mm
               1920 2008 2052 2200 hborder 0
               1080 1084 1089 1125 vborder 0
               +hsync +vsync 
               VertFreq: 60 Hz, HorFreq: 67500 Hz
Detailed mode: Clock 74.250 MHz, 1218 mm x 685 mm
               1280 1390 1430 1650 hborder 0
                720  725  730  750 vborder 0
               +hsync +vsync 
               VertFreq: 60 Hz, HorFreq: 45000 Hz
Monitor name: SONY TV  *01
Monitor ranges (GTF): 48-62Hz V, 14-70kHz H, max dotclock 150MHz
Has 1 extension blocks
Checksum: 0x87 (valid)

CTA extension block
Extension version: 3
70 bytes of CTA data
  Video data block
    VIC  31 1920x1080@50Hz 16:9  HorFreq: 56250 Hz Clock: 148.500 MHz
    VIC  16 1920x1080@60Hz 16:9  HorFreq: 67500 Hz Clock: 148.500 MHz
    VIC  20 1920x1080i@50Hz 16:9  HorFreq: 28125 Hz Clock: 74.250 MHz
    VIC   5 1920x1080i@60Hz 16:9  HorFreq: 33750 Hz Clock: 74.250 MHz
    VIC  19 1280x720@50Hz 16:9  HorFreq: 37500 Hz Clock: 74.250 MHz
    VIC   4 1280x720@60Hz 16:9  HorFreq: 45000 Hz Clock: 74.250 MHz
    VIC  32 1920x1080@24Hz 16:9  HorFreq: 27000 Hz Clock: 74.250 MHz
    VIC  34 1920x1080@30Hz 16:9  HorFreq: 33750 Hz Clock: 74.250 MHz
    VIC  60 1280x720@24Hz 16:9  HorFreq: 18000 Hz Clock: 59.400 MHz
    VIC  62 1280x720@30Hz 16:9  HorFreq: 22500 Hz Clock: 74.250 MHz
    VIC  18 720x576@50Hz 16:9  HorFreq: 31250 Hz Clock: 27.000 MHz
    VIC   3 720x480@60Hz 16:9  HorFreq: 31469 Hz Clock: 27.000 MHz
    VIC  17 720x576@50Hz 4:3  HorFreq: 31250 Hz Clock: 27.000 MHz
    VIC   2 720x480@60Hz 4:3  HorFreq: 31469 Hz Clock: 27.000 MHz
    VIC   1 640x480@60Hz 4:3  HorFreq: 31469 Hz Clock: 25.175 MHz
  Audio data block
    Linear PCM, max channels 8
      Supported sample rates (kHz): 192 176.4 96 88.2 48 44.1 32
      Supported sample sizes (bits): 24 20 16
    AC-3, max channels 6
      Supported sample rates (kHz): 48 44.1 32
      Maximum bit rate: 680 kHz
    DTS, max channels 6
      Supported sample rates (kHz): 96 88.2 48 44.1 32
      Maximum bit rate: 1536 kHz
    Dolby Digital+, max channels 8
      Supported sample rates (kHz): 48 44.1 32
    MAT (MLP), max channels 8
      Supported sample rates (kHz): 192 96 48
    DTS-HD, max channels 8
      Supported sample rates (kHz): 192 176.4 96 88.2 48 44.1
    One Bit Audio, max channels 6
      Supported sample rates (kHz): 44.1
  Speaker allocation data block
    Speaker map:
      FL/FR - Front Left/Right
      LFE - Low Frequency Effects
      FC - Front Center
      BL/BR - Back Left/Right
      BC - Back Center
      RLC/RRC - Rear Left/Right of Center
  Vendor-specific data block, OUI 000c03 (HDMI)
    Source physical address 1.8.0.0
    Supports_AI
    DC_36bit
    DC_30bit
    DC_Y444
    Maximum TMDS clock: 225MHz
    Extended HDMI video details:
      3D present
      3D-capable-VIC mask present
      Base EDID image size is in units of 1cm
      3D: Side-by-side (half, horizontal)
      3D: Top-and-bottom
      3D VIC indices: 0 1 2 3 4 5 6
      VIC index 2 supports frame packing
      VIC index 3 supports frame packing
      VIC index 7 supports frame packing
      VIC index 7 supports top-and-bottom
      VIC index 8 supports frame packing
      VIC index 9 supports frame packing
  Extended tag: Video capability data block
    YCbCr quantization: Selectable (via AVI YQ) (1)
    RGB quantization: Selectable (via AVI Q) (1)
    PT scan behaviour: Support both over- and underscan (3)
    IT scan behaviour: Always Underscanned (2)
    CE scan behaviour: Support both over- and underscan (3)
  Extended tag: Colorimetry data block
    xvYCC601
    xvYCC709
    sYCC601
    AdobeYCC601
    AdobeRGB
Underscans PC formats by default
Basic audio support
Supports YCbCr 4:4:4
Supports YCbCr 4:2:2
4 native detailed modes
Detailed mode: Clock 148.500 MHz, 1218 mm x 685 mm
               1920 2448 2492 2640 hborder 0
               1080 1084 1089 1125 vborder 0
               +hsync +vsync 
               VertFreq: 50 Hz, HorFreq: 56250 Hz
Detailed mode: Clock 74.250 MHz, 1218 mm x 685 mm
               1280 1720 1760 1980 hborder 0
                720  725  730  750 vborder 0
               +hsync +vsync 
               VertFreq: 50 Hz, HorFreq: 37500 Hz
Checksum: 0x46 (valid)

One or more of the timings is out of range of the Monitor Ranges:
  Vertical Freq: 24 - 60 Hz
  Horizontal Freq: 18000 - 67500 Hz
  Maximum Clock: 148.500 MHz
