edid-decode (hex):

00 ff ff ff ff ff ff 00 4c 2d 96 0a 30 33 43 54
30 16 01 04 a5 29 17 78 22 d6 c1 a3 57 53 9f 27
0b 50 54 bd ee 00 81 c0 01 01 01 01 01 01 01 01
01 01 01 01 01 01 66 21 56 aa 51 00 1e 30 46 8f
33 00 9a e6 10 00 00 1e 64 19 00 40 41 00 26 30
18 88 36 00 9a e6 10 00 00 18 00 00 00 fd 00 3c
4b 1e 3d 0a 00 0a 20 20 20 20 20 20 00 00 00 fc
00 54 31 39 43 33 30 30 0a 20 20 20 20 20 00 3b

00 ff ff ff ff ff ff 00 4c 2d 96 0a 30 33 43 54
30 16 01 04 a5 29 17 78 22 d6 c1 a3 57 53 9f 27
0b 50 54 bd ee 00 81 c0 01 01 01 01 01 01 01 01
01 01 01 01 01 01 66 21 56 aa 51 00 1e 30 46 8f
33 00 9a e6 10 00 00 1e 64 19 00 40 41 00 26 30
18 88 36 00 9a e6 10 00 00 18 00 00 00 fd 00 3c
4b 1e 3d 0a 00 0a 20 20 20 20 20 20 00 00 00 fc
00 54 31 39 43 33 30 30 0a 20 20 20 20 20 00 3b

----------------

Block 0, Base EDID:
  EDID Structure Version & Revision: 1.4
  Vendor & Product Identification:
    Manufacturer: SAM
    Model: 2710
    Serial Number: ...
    Made in: week 48 of 2012
  Basic Display Parameters & Features:
    Digital display
    Bits per primary color channel: 8
    DisplayPort interface
    Maximum image size: 41 cm x 23 cm
    Gamma: 2.20
    DPMS levels: Off
    Supported color formats: RGB 4:4:4
    First detailed timing includes the native pixel format and preferred refresh rate
  Color Characteristics:
    Red  : 0.6396, 0.3408
    Green: 0.3251, 0.6230
    Blue : 0.1552, 0.0429
    White: 0.3125, 0.3291
  Established Timings I & II:
    IBM     :   720x400    70.081663 Hz   9:5     31.467 kHz     28.320000 MHz
    DMT 0x04:   640x480    59.940476 Hz   4:3     31.469 kHz     25.175000 MHz
    Apple   :   640x480    66.666667 Hz   4:3     35.000 kHz     30.240000 MHz
    DMT 0x05:   640x480    72.808802 Hz   4:3     37.861 kHz     31.500000 MHz
    DMT 0x06:   640x480    75.000000 Hz   4:3     37.500 kHz     31.500000 MHz
    DMT 0x09:   800x600    60.316541 Hz   4:3     37.879 kHz     40.000000 MHz
    DMT 0x0a:   800x600    72.187572 Hz   4:3     48.077 kHz     50.000000 MHz
    DMT 0x0b:   800x600    75.000000 Hz   4:3     46.875 kHz     49.500000 MHz
    Apple   :   832x624    74.551266 Hz   4:3     49.726 kHz     57.284000 MHz
    DMT 0x10:  1024x768    60.003840 Hz   4:3     48.363 kHz     65.000000 MHz
    DMT 0x11:  1024x768    70.069359 Hz   4:3     56.476 kHz     75.000000 MHz
    DMT 0x12:  1024x768    75.028582 Hz   4:3     60.023 kHz     78.750000 MHz
  Standard Timings:
    DMT 0x55:  1280x720    60.000000 Hz  16:9     45.000 kHz     74.250000 MHz
  Detailed Timing Descriptors:
    DTD 1:  1366x768    59.789541 Hz 683:384   47.712 kHz     85.500000 MHz (410 mm x 230 mm)
                 Hfront   70 Hsync 143 Hback  213 Hpol P
                 Vfront    3 Vsync   3 Vback   24 Vpol P
    DTD 2:  1024x768    60.003840 Hz   4:3     48.363 kHz     65.000000 MHz (410 mm x 230 mm)
                 Hfront   24 Hsync 136 Hback  160 Hpol N
                 Vfront    3 Vsync   6 Vback   29 Vpol N
    Display Range Limits:
      Monitor ranges (GTF): 60-75 Hz V, 30-61 kHz H, max dotclock 100 MHz
    Display Product Name: 'T19C300'
Checksum: 0x3b

----------------

Block 1, Unknown EDID Extension Block 0x00:
  00 ff ff ff ff ff ff 00 4c 2d 96 0a 30 33 43 54 '........L-..03CT'
  30 16 01 04 a5 29 17 78 22 d6 c1 a3 57 53 9f 27 '0....).x"...WS.''
  0b 50 54 bd ee 00 81 c0 01 01 01 01 01 01 01 01 '.PT.............'
  01 01 01 01 01 01 66 21 56 aa 51 00 1e 30 46 8f '......f!V.Q..0F.'
  33 00 9a e6 10 00 00 1e 64 19 00 40 41 00 26 30 '3.......d..@A.&0'
  18 88 36 00 9a e6 10 00 00 18 00 00 00 fd 00 3c '..6............<'
  4b 1e 3d 0a 00 0a 20 20 20 20 20 20 00 00 00 fc 'K.=...      ....'
  00 54 31 39 43 33 30 30 0a 20 20 20 20 20 00 3b '.T19C300.     .;'
Checksum: 0x3b

----------------

Warnings:

Block 0, Base EDID:
  Display Range Limits: GTF support is deprecated in EDID 1.4.

Failures:

Block 0, Base EDID:
  Display Range Limits: GTF can't be combined with non-continuous frequencies.
Block 1, Base EDID:
  Unknown Extension Block.
EDID:
  Base EDID: EDID specified 0 extension block(s), but found 1 extension block(s).

EDID conformity: FAIL
