edid-decode (hex):

00 ff ff ff ff ff ff 00 22 64 43 18 33 46 37 32
26 12 01 03 80 2d 1a 78 2a a9 80 a5 55 48 9b 26
12 50 54 bf ef 00 71 4f 81 80 95 00 95 0f 61 4c
01 01 01 01 01 01 9a 29 a0 d0 51 84 22 30 50 98
36 00 c5 ff 10 00 00 1c 00 00 00 ff 00 4f 48 4d
30 32 30 30 30 31 32 37 46 33 00 00 00 fd 00 37
4b 1e 53 0e 00 0a 20 20 20 20 20 20 00 00 00 fc
00 48 46 31 39 39 48 0a 20 20 20 20 20 20 01 09

02 03 21 71 4e 10 1f 05 14 04 13 03 12 02 11 06
15 07 16 23 09 7f 07 83 01 00 00 65 03 0c 00 10
00 8c 0a d0 8a 20 e0 2d 10 10 3e 96 00 c4 8e 21
00 00 18 01 1d 00 72 51 d0 1e 20 6e 28 55 00 c4
8e 21 00 00 1e 8c 0a a0 14 51 f0 16 00 26 7c 43
00 13 8e 21 00 00 98 8c 0a a0 20 51 20 18 10 18
7e 23 00 c4 8e 21 00 00 98 01 1d 00 bc 52 d0 1e
20 b8 28 55 40 c4 8e 21 00 00 1e 00 00 00 00 c8

00 ff ff ff ff ff ff 00 22 64 43 18 33 46 37 32
26 12 01 03 80 2d 1a 78 2a a9 80 a5 55 48 9b 26
12 50 54 bf ef 00 71 4f 81 80 95 00 95 0f 61 4c
01 01 01 01 01 01 9a 29 a0 d0 51 84 22 30 50 98
36 00 c5 ff 10 00 00 1c 00 00 00 ff 00 4f 48 4d
30 32 30 30 30 31 32 37 46 33 00 00 00 fd 00 37
4b 1e 53 0e 00 0a 20 20 20 20 20 20 00 00 00 fc
00 48 46 31 39 39 48 0a 20 20 20 20 20 20 01 09

02 03 21 71 4e 10 1f 05 14 04 13 03 12 02 11 06
15 07 16 23 09 7f 07 83 01 00 00 65 03 0c 00 10
00 8c 0a d0 8a 20 e0 2d 10 10 3e 96 00 c4 8e 21
00 00 18 01 1d 00 72 51 d0 1e 20 6e 28 55 00 c4
8e 21 00 00 1e 8c 0a a0 14 51 f0 16 00 26 7c 43
00 13 8e 21 00 00 98 8c 0a a0 20 51 20 18 10 18
7e 23 00 c4 8e 21 00 00 98 01 1d 00 bc 52 d0 1e
20 b8 28 55 40 c4 8e 21 00 00 1e 00 00 00 00 c8

----------------

Block 0, Base EDID:
  EDID Structure Version & Revision: 1.3
  Vendor & Product Identification:
    Manufacturer: HSD
    Model: 6211
    Serial Number: ...
    Made in: week 38 of 2008
  Basic Display Parameters & Features:
    Digital display
    Maximum image size: 45 cm x 26 cm
    Gamma: 2.20
    DPMS levels: Off
    RGB color display
    First detailed timing is the preferred timing
  Color Characteristics:
    Red  : 0.6464, 0.3339
    Green: 0.2832, 0.6064
    Blue : 0.1503, 0.0703
    White: 0.3125, 0.3281
  Established Timings I & II:
    IBM     :   720x400    70.081663 Hz   9:5     31.467 kHz     28.320000 MHz
    DMT 0x04:   640x480    59.940476 Hz   4:3     31.469 kHz     25.175000 MHz
    Apple   :   640x480    66.666667 Hz   4:3     35.000 kHz     30.240000 MHz
    DMT 0x05:   640x480    72.808802 Hz   4:3     37.861 kHz     31.500000 MHz
    DMT 0x06:   640x480    75.000000 Hz   4:3     37.500 kHz     31.500000 MHz
    DMT 0x08:   800x600    56.250000 Hz   4:3     35.156 kHz     36.000000 MHz
    DMT 0x09:   800x600    60.316541 Hz   4:3     37.879 kHz     40.000000 MHz
    DMT 0x0a:   800x600    72.187572 Hz   4:3     48.077 kHz     50.000000 MHz
    DMT 0x0b:   800x600    75.000000 Hz   4:3     46.875 kHz     49.500000 MHz
    Apple   :   832x624    74.551266 Hz   4:3     49.726 kHz     57.284000 MHz
    DMT 0x10:  1024x768    60.003840 Hz   4:3     48.363 kHz     65.000000 MHz
    DMT 0x11:  1024x768    70.069359 Hz   4:3     56.476 kHz     75.000000 MHz
    DMT 0x12:  1024x768    75.028582 Hz   4:3     60.023 kHz     78.750000 MHz
    DMT 0x24:  1280x1024   75.024675 Hz   5:4     79.976 kHz    135.000000 MHz
  Standard Timings:
    DMT 0x15:  1152x864    75.000000 Hz   4:3     67.500 kHz    108.000000 MHz
    DMT 0x23:  1280x1024   60.019740 Hz   5:4     63.981 kHz    108.000000 MHz
    DMT 0x2f:  1440x900    59.887445 Hz  16:10    55.935 kHz    106.500000 MHz
    DMT 0x30:  1440x900    74.984427 Hz  16:10    70.635 kHz    136.750000 MHz
    DMT 0x11:  1024x768    70.069359 Hz   4:3     56.476 kHz     75.000000 MHz
  Detailed Timing Descriptors:
    DTD  1:  1440x900    59.887445 Hz  16:10    55.935 kHz    106.500000 MHz (453 mm x 255 mm)
                  Hfront   80 Hsync 152 Hback  232 Hpol N
                  Vfront    3 Vsync   6 Vback   25 Vpol P
    Display Product Serial Number: ...
    Display Range Limits:
      Monitor ranges (GTF): 55-75 Hz V, 30-83 kHz H, max dotclock 140 MHz
    Display Product Name: 'HF199H'
  Extension blocks: 1
Checksum: 0x09

----------------

Block 1, CTA-861 Extension Block:
  Revision: 3
  Basic audio support
  Supports YCbCr 4:4:4
  Supports YCbCr 4:2:2
  Native detailed modes: 1
  Video Data Block:
    VIC  16:  1920x1080   60.000000 Hz  16:9     67.500 kHz    148.500000 MHz
    VIC  31:  1920x1080   50.000000 Hz  16:9     56.250 kHz    148.500000 MHz
    VIC   5:  1920x1080i  60.000000 Hz  16:9     33.750 kHz     74.250000 MHz
    VIC  20:  1920x1080i  50.000000 Hz  16:9     28.125 kHz     74.250000 MHz
    VIC   4:  1280x720    60.000000 Hz  16:9     45.000 kHz     74.250000 MHz
    VIC  19:  1280x720    50.000000 Hz  16:9     37.500 kHz     74.250000 MHz
    VIC   3:   720x480    59.940060 Hz  16:9     31.469 kHz     27.000000 MHz
    VIC  18:   720x576    50.000000 Hz  16:9     31.250 kHz     27.000000 MHz
    VIC   2:   720x480    59.940060 Hz   4:3     31.469 kHz     27.000000 MHz
    VIC  17:   720x576    50.000000 Hz   4:3     31.250 kHz     27.000000 MHz
    VIC   6:  1440x480i   59.940060 Hz   4:3     15.734 kHz     27.000000 MHz
    VIC  21:  1440x576i   50.000000 Hz   4:3     15.625 kHz     27.000000 MHz
    VIC   7:  1440x480i   59.940060 Hz  16:9     15.734 kHz     27.000000 MHz
    VIC  22:  1440x576i   50.000000 Hz  16:9     15.625 kHz     27.000000 MHz
  Audio Data Block:
    Linear PCM:
      Max channels: 2
      Supported sample rates (kHz): 192 176.4 96 88.2 48 44.1 32
      Supported sample sizes (bits): 24 20 16
  Speaker Allocation Data Block:
    FL/FR - Front Left/Right
  Vendor-Specific Data Block (HDMI), OUI 00-0C-03:
    Source physical address: 1.0.0.0
  Detailed Timing Descriptors:
    DTD  2:   720x480    59.940060 Hz   3:2     31.469 kHz     27.000000 MHz (708 mm x 398 mm)
                  Hfront   16 Hsync  62 Hback   60 Hpol N
                  Vfront    9 Vsync   6 Vback   30 Vpol N
    DTD  3:  1280x720    60.000000 Hz  16:9     45.000 kHz     74.250000 MHz (708 mm x 398 mm)
                  Hfront  110 Hsync  40 Hback  220 Hpol P
                  Vfront    5 Vsync   5 Vback   20 Vpol P
    DTD  4:  1440x480i   59.940060 Hz   3:1     15.734 kHz     27.000000 MHz (531 mm x 398 mm)
                  Hfront   38 Hsync 124 Hback  114 Hpol N
                  Vfront    4 Vsync   3 Vback   15 Vpol N Vfront +0.5 Odd Field
                  Vfront    4 Vsync   3 Vback   15 Vpol N Vback  +0.5 Even Field
    DTD  5:  1440x576i   50.000000 Hz   5:2     15.625 kHz     27.000000 MHz (708 mm x 398 mm)
                  Hfront   24 Hsync 126 Hback  138 Hpol N
                  Vfront    2 Vsync   3 Vback   19 Vpol N Vfront +0.5 Odd Field
                  Vfront    2 Vsync   3 Vback   19 Vpol N Vback  +0.5 Even Field
    DTD  6:  1280x720    50.000000 Hz  16:9     37.500 kHz     74.250000 MHz (708 mm x 398 mm)
                  Hfront  440 Hsync  40 Hback  220 Hpol P
                  Vfront    5 Vsync   5 Vback   20 Vpol P
Checksum: 0xc8  Unused space in Extension Block: 4 bytes

----------------

Block 2, Unknown EDID Extension Block 0x00:
  00 ff ff ff ff ff ff 00 22 64 43 18 33 46 37 32 '........"dC.3F72'
  26 12 01 03 80 2d 1a 78 2a a9 80 a5 55 48 9b 26 '&....-.x*...UH.&'
  12 50 54 bf ef 00 71 4f 81 80 95 00 95 0f 61 4c '.PT...qO......aL'
  01 01 01 01 01 01 9a 29 a0 d0 51 84 22 30 50 98 '.......)..Q."0P.'
  36 00 c5 ff 10 00 00 1c 00 00 00 ff 00 4f 48 4d '6............OHM'
  30 32 30 30 30 31 32 37 46 33 00 00 00 fd 00 37 '02000127F3.....7'
  4b 1e 53 0e 00 0a 20 20 20 20 20 20 00 00 00 fc 'K.S...      ....'
  00 48 46 31 39 39 48 0a 20 20 20 20 20 20 01 09 '.HF199H.      ..'
Checksum: 0x09

----------------

Block 3, CTA-861 Extension Block:
  Revision: 3
  Basic audio support
  Supports YCbCr 4:4:4
  Supports YCbCr 4:2:2
  Native detailed modes: 1
  Video Data Block:
    VIC  16:  1920x1080   60.000000 Hz  16:9     67.500 kHz    148.500000 MHz
    VIC  31:  1920x1080   50.000000 Hz  16:9     56.250 kHz    148.500000 MHz
    VIC   5:  1920x1080i  60.000000 Hz  16:9     33.750 kHz     74.250000 MHz
    VIC  20:  1920x1080i  50.000000 Hz  16:9     28.125 kHz     74.250000 MHz
    VIC   4:  1280x720    60.000000 Hz  16:9     45.000 kHz     74.250000 MHz
    VIC  19:  1280x720    50.000000 Hz  16:9     37.500 kHz     74.250000 MHz
    VIC   3:   720x480    59.940060 Hz  16:9     31.469 kHz     27.000000 MHz
    VIC  18:   720x576    50.000000 Hz  16:9     31.250 kHz     27.000000 MHz
    VIC   2:   720x480    59.940060 Hz   4:3     31.469 kHz     27.000000 MHz
    VIC  17:   720x576    50.000000 Hz   4:3     31.250 kHz     27.000000 MHz
    VIC   6:  1440x480i   59.940060 Hz   4:3     15.734 kHz     27.000000 MHz
    VIC  21:  1440x576i   50.000000 Hz   4:3     15.625 kHz     27.000000 MHz
    VIC   7:  1440x480i   59.940060 Hz  16:9     15.734 kHz     27.000000 MHz
    VIC  22:  1440x576i   50.000000 Hz  16:9     15.625 kHz     27.000000 MHz
  Audio Data Block:
    Linear PCM:
      Max channels: 2
      Supported sample rates (kHz): 192 176.4 96 88.2 48 44.1 32
      Supported sample sizes (bits): 24 20 16
  Speaker Allocation Data Block:
    FL/FR - Front Left/Right
  Vendor-Specific Data Block (HDMI), OUI 00-0C-03:
    Source physical address: 1.0.0.0
  Detailed Timing Descriptors:
    DTD  7:   720x480    59.940060 Hz   3:2     31.469 kHz     27.000000 MHz (708 mm x 398 mm)
                  Hfront   16 Hsync  62 Hback   60 Hpol N
                  Vfront    9 Vsync   6 Vback   30 Vpol N
    DTD  8:  1280x720    60.000000 Hz  16:9     45.000 kHz     74.250000 MHz (708 mm x 398 mm)
                  Hfront  110 Hsync  40 Hback  220 Hpol P
                  Vfront    5 Vsync   5 Vback   20 Vpol P
    DTD  9:  1440x480i   59.940060 Hz   3:1     15.734 kHz     27.000000 MHz (531 mm x 398 mm)
                  Hfront   38 Hsync 124 Hback  114 Hpol N
                  Vfront    4 Vsync   3 Vback   15 Vpol N Vfront +0.5 Odd Field
                  Vfront    4 Vsync   3 Vback   15 Vpol N Vback  +0.5 Even Field
    DTD 10:  1440x576i   50.000000 Hz   5:2     15.625 kHz     27.000000 MHz (708 mm x 398 mm)
                  Hfront   24 Hsync 126 Hback  138 Hpol N
                  Vfront    2 Vsync   3 Vback   19 Vpol N Vfront +0.5 Odd Field
                  Vfront    2 Vsync   3 Vback   19 Vpol N Vback  +0.5 Even Field
    DTD 11:  1280x720    50.000000 Hz  16:9     37.500 kHz     74.250000 MHz (708 mm x 398 mm)
                  Hfront  440 Hsync  40 Hback  220 Hpol P
                  Vfront    5 Vsync   5 Vback   20 Vpol P
Checksum: 0xc8  Unused space in Extension Block: 4 bytes

----------------

Warnings:

Block 1, CTA-861 Extension Block:
  IT Video Formats are overscanned by default, but normally this should be underscanned.
  Display Product Serial Number is set, so the Serial Number in the Base EDID should be 0.
  Add a Colorimetry Data Block with the sRGB colorimetry bit set to avoid interop issues.
Block 3, CTA-861 Extension Block:
  IT Video Formats are overscanned by default, but normally this should be underscanned.
  Display Product Serial Number is set, so the Serial Number in the Base EDID should be 0.
  Add a Colorimetry Data Block with the sRGB colorimetry bit set to avoid interop issues.
EDID:
  CTA-861: Native progressive resolution of 1440x900 is smaller than the max preferred progressive resolution 1920x1080.

Failures:

Block 1, CTA-861 Extension Block:
  Detailed Timing Descriptor #2: Mismatch of image size 708x398 mm vs display size 450x260 mm.
  Detailed Timing Descriptor #3: Mismatch of image size 708x398 mm vs display size 450x260 mm.
  Detailed Timing Descriptor #4: Mismatch of image size 531x398 mm vs display size 450x260 mm.
  Detailed Timing Descriptor #5: Mismatch of image size 708x398 mm vs display size 450x260 mm.
  Detailed Timing Descriptor #6: Mismatch of image size 708x398 mm vs display size 450x260 mm.
  Missing VCDB, needed for Set Selectable RGB Quantization to avoid interop issues.
Block 2, Base EDID:
  Unknown Extension Block.
Block 3, CTA-861 Extension Block:
  Video Data Block: Duplicate VIC 16.
  Video Data Block: Duplicate VIC 31.
  Video Data Block: Duplicate VIC 5.
  Video Data Block: Duplicate VIC 20.
  Video Data Block: Duplicate VIC 4.
  Video Data Block: Duplicate VIC 19.
  Video Data Block: Duplicate VIC 3.
  Video Data Block: Duplicate VIC 18.
  Video Data Block: Duplicate VIC 2.
  Video Data Block: Duplicate VIC 17.
  Video Data Block: Duplicate VIC 6.
  Video Data Block: Duplicate VIC 21.
  Video Data Block: Duplicate VIC 7.
  Video Data Block: Duplicate VIC 22.
  Speaker Allocation Data Block: Only one instance of this Data Block is allowed.
  Detailed Timing Descriptor #7: Mismatch of image size 708x398 mm vs display size 450x260 mm.
  Detailed Timing Descriptor #8: Mismatch of image size 708x398 mm vs display size 450x260 mm.
  Detailed Timing Descriptor #9: Mismatch of image size 531x398 mm vs display size 450x260 mm.
  Detailed Timing Descriptor #10: Mismatch of image size 708x398 mm vs display size 450x260 mm.
  Detailed Timing Descriptor #11: Mismatch of image size 708x398 mm vs display size 450x260 mm.
  Missing VCDB, needed for Set Selectable RGB Quantization to avoid interop issues.
EDID:
  Base EDID: Some timings are out of range of the Monitor Ranges:
    Vertical Freq: 50.000 - 75.029 Hz (Monitor: 55.000 - 75.000 Hz)
    Horizontal Freq: 15.625 - 79.976 kHz (Monitor: 30.000 - 83.000 kHz)
    Maximum Clock: 148.500 MHz (Monitor: 140.000 MHz)
  Base EDID: The DTD max image size is 708x398mm, which is larger than the display size 450.0x260.0mm.
  Base EDID: EDID specified 1 extension block(s), but found 3 extension block(s).
  Base EDID: EDID 1.3 requires a Block Map Extension in Block 1 if there are more than 2 blocks in the EDID.

EDID conformity: FAIL
