edid-decode (hex):

00 ff ff ff ff ff ff 00 30 e4 9a 03 00 00 00 00
00 16 01 04 90 22 13 78 02 25 b5 a1 59 59 9d 27
1c 50 54 00 00 00 01 01 01 01 01 01 01 01 01 01
01 01 01 01 01 01 34 3a 80 20 71 38 2c 40 30 48
35 00 58 c2 10 00 00 18 cd 26 80 20 71 38 2c 40
30 48 35 00 58 c2 10 00 00 18 00 00 00 00 00 00
00 00 00 00 00 00 00 00 00 00 00 00 00 00 00 02
00 0a 3d ff 0a 3c 96 26 1d 38 96 00 00 00 00 5c

----------------

Block 0, Base EDID:
  EDID Structure Version & Revision: 1.4
  Vendor & Product Identification:
    Manufacturer: LGD
    Model: 922
    Made in: 2012
  Basic Display Parameters & Features:
    Digital display
    Bits per primary color channel: 6
    Digital interface is not defined
    Maximum image size: 34 cm x 19 cm
    Gamma: 2.20
    Supported color formats: RGB 4:4:4
    First detailed timing includes the native pixel format and preferred refresh rate
  Color Characteristics:
    Red  : 0.6289, 0.3496
    Green: 0.3486, 0.6142
    Blue : 0.1542, 0.1123
    White: 0.3134, 0.3291
  Established Timings I & II: none
  Standard Timings: none
  Detailed Timing Descriptors:
    DTD 1:  1920x1080   60.037263 Hz  16:9     67.482 kHz    149.000000 MHz (344 mm x 194 mm)
                 Hfront   48 Hsync  72 Hback  168 Hpol N
                 Vfront    3 Vsync   5 Vback   36 Vpol N
    DTD 2:  1920x1080   40.023499 Hz  16:9     44.986 kHz     99.330000 MHz (344 mm x 194 mm)
                 Hfront   48 Hsync  72 Hback  168 Hpol N
                 Vfront    3 Vsync   5 Vback   36 Vpol N
    Empty Descriptor
    Manufacturer-Specified Display Descriptor (0x02): 00 02 00 0a 3d ff 0a 3c 96 26 1d 38 96 00 00 00 '....=..<.&.8....'
Checksum: 0x5c

----------------

Failures:

Block 0, Base EDID:
  Empty Descriptor: Use Dummy Descriptor instead of all zeroes.
  Missing Display Product Name.

EDID conformity: FAIL
