
EDID (hex):
00ffffffffffff0004720716790c0000
1c1701036a0000780ad776b24a25c524
05515b3fcf80317c457c617c81c09500
b300904001019e20009051201f304880
360000000000001c000000fd0032781e
640f000a202020202020000000fc0041
636572204b3333350a202020000000ff
004a47373131303032353930300a01ea
02030400662156aa51001e30468f3300
00000000001e00000000000000000000
00000000000000000000000000000000
00000000000000000000000000000000
00000000000000000000000000000000
00000000000000000000000000000000
00000000000000000000000000000000
000000000000000000000000000000ab

Extracted contents:
header:          00 ff ff ff ff ff ff 00
serial number:   04 72 07 16 79 0c 00 00 1c 17
version:         01 03
basic params:    6a 00 00 78 0a
chroma info:     d7 76 b2 4a 25 c5 24 05 51 5b
established:     3f cf 80
standard:        31 7c 45 7c 61 7c 81 c0 95 00 b3 00 90 40 01 01
descriptor 1:    9e 20 00 90 51 20 1f 30 48 80 36 00 00 00 00 00 00 1c
descriptor 2:    00 00 00 fd 00 32 78 1e 64 0f 00 0a 20 20 20 20 20 20
descriptor 3:    00 00 00 fc 00 41 63 65 72 20 4b 33 33 35 0a 20 20 20
descriptor 4:    00 00 00 ff 00 4a 47 37 31 31 30 30 32 35 39 30 30 0a
extensions:      01
checksum:        ea

EDID version: 1.3
Manufacturer: ACR Model 1607 Serial Number --
Made in week 28 of 2013
Analog display, Input voltage level: 0.7/0.7 V
Sync: Separate SyncOnGreen 
Image size is variable
Gamma: 2.20
RGB color display
First detailed timing is preferred timing
Display x,y Chromaticity:
  Red:   0.6982, 0.2900
  Green: 0.1455, 0.7724
  Blue:  0.1416, 0.0224
  White: 0.3173, 0.3574
Established timings supported:
  640x480@60Hz 4:3 HorFreq: 31469 Hz Clock: 25.175 MHz
  640x480@67Hz 4:3 HorFreq: 35000 Hz Clock: 30.240 MHz
  640x480@72Hz 4:3 HorFreq: 37900 Hz Clock: 31.500 MHz
  640x480@75Hz 4:3 HorFreq: 37500 Hz Clock: 31.500 MHz
  800x600@56Hz 4:3 HorFreq: 35200 Hz Clock: 36.000 MHz
  800x600@60Hz 4:3 HorFreq: 37900 Hz Clock: 40.000 MHz
  800x600@72Hz 4:3 HorFreq: 48100 Hz Clock: 50.000 MHz
  800x600@75Hz 4:3 HorFreq: 46900 Hz Clock: 49.500 MHz
  1024x768@60Hz 4:3 HorFreq: 48400 Hz Clock: 65.000 MHz
  1024x768@70Hz 4:3 HorFreq: 56500 Hz Clock: 75.000 MHz
  1024x768@75Hz 4:3 HorFreq: 60000 Hz Clock: 78.750 MHz
  1280x1024@75Hz 5:4 HorFreq: 80000 Hz Clock: 135.000 MHz
  1152x870@75Hz 192:145 HorFreq: 67500 Hz Clock: 108.000 MHz
Standard timings supported:
  640x480@120Hz 4:3
  800x600@120Hz 4:3
  1024x768@120Hz 4:3
  1280x720@60Hz 16:9
  1440x900@60Hz 16:10 HorFreq: 55500 Hz Clock: 88.750 MHz
  1680x1050@60Hz 16:10 HorFreq: 64700 Hz Clock: 119.000 MHz
  1400x1050@60Hz 4:3 HorFreq: 64700 Hz Clock: 101.000 MHz
Detailed mode: Clock 83.500 MHz, 0 mm x 0 mm
               1280 1352 1480 1680 hborder 0
                800  803  809  831 vborder 0
               -hsync +vsync 
               VertFreq: 59 Hz, HorFreq: 49702 Hz
Monitor ranges (GTF): 50-120Hz V, 30-100kHz H, max dotclock 150MHz
Monitor name: Acer K335
Serial number: --
Has 1 extension blocks
Checksum: 0xea (valid)

CTA extension block
Extension version: 3
0 bytes of CTA data
0 native detailed modes
Detailed mode: Clock 85.500 MHz, 0 mm x 0 mm
               1366 1436 1579 1792 hborder 0
                768  771  774  798 vborder 0
               +hsync +vsync 
               VertFreq: 59 Hz, HorFreq: 47712 Hz
Checksum: 0xab (valid)

EDID block does not conform at all!
	Both the serial number and the serial string are set
