edid-decode (hex):

00 ff ff ff ff ff ff 00 0e 14 b9 0b 00 00 00 00
26 0e 01 02 80 1e 17 78 0a f2 10 98 54 4f 93 27
22 4f 53 00 00 00 01 01 01 01 01 01 01 01 01 01
01 01 01 01 01 01 64 19 00 28 41 00 23 30 18 88
36 00 30 e4 10 00 00 18 00 00 00 0f 00 00 44 02
94 00 03 00 11 26 a0 02 13 00 00 00 00 fe 00 43
50 54 0a 20 20 20 20 20 20 20 20 20 00 00 00 fe
00 43 4c 41 41 31 35 30 58 48 30 31 0a 20 00 e5

----------------

Block 0, Base EDID:
  EDID Structure Version & Revision: 1.2
  Vendor & Product Identification:
    Manufacturer: CPT
    Model: 3001
    Made in: week 38 of 2004
  Basic Display Parameters & Features:
    Digital display
    Maximum image size: 30 cm x 23 cm
    Gamma: 2.20
    RGB color display
    First detailed timing is preferred timing
  Color Characteristics:
    Red  : 0.5966, 0.3310
    Green: 0.3085, 0.5761
    Blue : 0.1523, 0.1337
    White: 0.3085, 0.3242
  Established Timings I & II: none
  Standard Timings: none
  Detailed Timing Descriptors:
    DTD 1:  1024x768    61.323 Hz   4:3    49.242 kHz  65.000 MHz (304 mm x 228 mm)
                 Hfront   24 Hsync 136 Hback 136 Hpol N
                 Vfront    3 Vsync   6 Vback  26 Vpol N
    Manufacturer-Specified Display Descriptor (0x0f): 00 0f 00 00 44 02 94 00 03 00 11 26 a0 02 13 00 '....D......&....'
    Alphanumeric Data String: 'CPT'
    Alphanumeric Data String: 'CLAA150XH01'
Checksum: 0xe5
