
EDID (hex):
00ffffffffffff001ef92d23820f0000
140c01031c241bb0e87c59a353479a24
10484ce56b000101010101016140314f
3bca0101a94f1a4f403062b0324040c0
10005e061100001e000000fd0032a01e
6115000a202020202020000000fc0047
617465776179205658393330000000fc
000a2020202020202020202020200022

Extracted contents:
header:          00 ff ff ff ff ff ff 00
serial number:   1e f9 2d 23 82 0f 00 00 14 0c
version:         01 03
basic params:    1c 24 1b b0 e8
chroma info:     7c 59 a3 53 47 9a 24 10 48 4c
established:     e5 6b 00
standard:        01 01 01 01 01 01 61 40 31 4f 3b ca 01 01 a9 4f
descriptor 1:    1a 4f 40 30 62 b0 32 40 40 c0 10 00 5e 06 11 00 00 1e
descriptor 2:    00 00 00 fd 00 32 a0 1e 61 15 00 0a 20 20 20 20 20 20
descriptor 3:    00 00 00 fc 00 47 61 74 65 77 61 79 20 56 58 39 33 30
descriptor 4:    00 00 00 fc 00 0a 20 20 20 20 20 20 20 20 20 20 20 20
extensions:      00
checksum:        22

EDID version: 1.3
Manufacturer: GWY Model 232d Serial Number --
Analog display, Input voltage level: 0.7/0.3 V
Configurable signal levels
Sync: Separate Composite 
Maximum image size: 36 cm x 27 cm
Gamma: 2.76
DPMS levels: Standby Suspend Off
RGB color display
Display x,y Chromaticity:
  Red:   0.6376, 0.3271
  Green: 0.2802, 0.6015
  Blue:  0.1416, 0.0634
  White: 0.2832, 0.2978
Established timings supported:
  720x400@70Hz 9:5 HorFreq: 31469 Hz Clock: 28.320 MHz
  720x400@88Hz 9:5 HorFreq: 39500 Hz Clock: 35.500 MHz
  640x480@60Hz 4:3 HorFreq: 31469 Hz Clock: 25.175 MHz
  640x480@75Hz 4:3 HorFreq: 37500 Hz Clock: 31.500 MHz
  800x600@60Hz 4:3 HorFreq: 37900 Hz Clock: 40.000 MHz
  800x600@75Hz 4:3 HorFreq: 46900 Hz Clock: 49.500 MHz
  832x624@75Hz 4:3 HorFreq: 49726 Hz Clock: 57.284 MHz
  1024x768@60Hz 4:3 HorFreq: 48400 Hz Clock: 65.000 MHz
  1024x768@75Hz 4:3 HorFreq: 60000 Hz Clock: 78.750 MHz
  1280x1024@75Hz 5:4 HorFreq: 80000 Hz Clock: 135.000 MHz
Standard timings supported:
  1024x768@60Hz 4:3 HorFreq: 48400 Hz Clock: 65.000 MHz
  640x480@75Hz 4:3 HorFreq: 37500 Hz Clock: 31.500 MHz
  720x405@70Hz 16:9
  1600x1200@75Hz 4:3 HorFreq: 93800 Hz Clock: 202.500 MHz
Detailed mode: Clock 202.500 MHz, 350 mm x 262 mm
               1600 1664 1856 2160 hborder 0
               1200 1201 1201 1250 vborder 0
               +hsync +vsync 
               VertFreq: 75 Hz, HorFreq: 93750 Hz
Monitor ranges (GTF): 50-160Hz V, 30-97kHz H, max dotclock 210MHz
Monitor name: Gateway VX930
Checksum: 0x22 (valid)
EDID block does NOT conform to EDID 1.3!
	Missing preferred timing
EDID block does not conform at all!
	Bad year of manufacture
