edid-decode (hex):

00 ff ff ff ff ff ff 00 38 a3 70 67 01 01 01 01
0f 14 01 03 08 29 17 78 ea 6f b5 a4 55 4d 9b 25
12 50 54 bf ee 00 8b c0 81 c0 01 01 01 01 01 01
01 01 01 01 01 01 66 21 56 aa 51 00 1e 30 46 8f
33 00 9a e6 10 00 00 1e 00 00 00 fd 00 37 4c 1f
3d 09 00 0a 20 20 20 20 20 20 00 00 00 fc 00 56
31 39 31 57 0a 20 20 20 20 20 20 20 00 00 00 ff
00 30 34 33 30 37 30 33 39 4e 42 0a 20 20 00 2e

00 ff ff ff ff ff ff 00 38 a3 70 67 01 01 01 01
0f 14 01 03 08 29 17 78 ea 6f b5 a4 55 4d 9b 25
12 50 54 bf ee 00 8b c0 81 c0 01 01 01 01 01 01
01 01 01 01 01 01 66 21 56 aa 51 00 1e 30 46 8f
33 00 9a e6 10 00 00 1e 00 00 00 fd 00 37 4c 1f
3d 09 00 0a 20 20 20 20 20 20 00 00 00 fc 00 56
31 39 31 57 0a 20 20 20 20 20 20 20 00 00 00 ff
00 30 34 33 30 37 30 33 39 4e 42 0a 20 20 00 2e

----------------

Block 0, Base EDID:
  EDID Structure Version & Revision: 1.3
  Vendor & Product Identification:
    Manufacturer: NEC
    Model: 26480
    Serial Number: ...
    Made in: week 15 of 2010
  Basic Display Parameters & Features:
    Analog display
    Signal Level Standard: 0.700 : 0.300 : 1.000 V p-p
    Blank level equals black level
    Sync: Separate
    Maximum image size: 41 cm x 23 cm
    Gamma: 2.20
    DPMS levels: Standby Suspend Off
    RGB color display
    First detailed timing is the preferred timing
  Color Characteristics:
    Red  : 0.6416, 0.3339
    Green: 0.3037, 0.6083
    Blue : 0.1464, 0.0732
    White: 0.3134, 0.3291
  Established Timings I & II:
    IBM     :   720x400    70.081663 Hz   9:5     31.467 kHz     28.320000 MHz
    DMT 0x04:   640x480    59.940476 Hz   4:3     31.469 kHz     25.175000 MHz
    Apple   :   640x480    66.666667 Hz   4:3     35.000 kHz     30.240000 MHz
    DMT 0x05:   640x480    72.808802 Hz   4:3     37.861 kHz     31.500000 MHz
    DMT 0x06:   640x480    75.000000 Hz   4:3     37.500 kHz     31.500000 MHz
    DMT 0x08:   800x600    56.250000 Hz   4:3     35.156 kHz     36.000000 MHz
    DMT 0x09:   800x600    60.316541 Hz   4:3     37.879 kHz     40.000000 MHz
    DMT 0x0a:   800x600    72.187572 Hz   4:3     48.077 kHz     50.000000 MHz
    DMT 0x0b:   800x600    75.000000 Hz   4:3     46.875 kHz     49.500000 MHz
    Apple   :   832x624    74.551266 Hz   4:3     49.726 kHz     57.284000 MHz
    DMT 0x10:  1024x768    60.003840 Hz   4:3     48.363 kHz     65.000000 MHz
    DMT 0x11:  1024x768    70.069359 Hz   4:3     56.476 kHz     75.000000 MHz
    DMT 0x12:  1024x768    75.028582 Hz   4:3     60.023 kHz     78.750000 MHz
  Standard Timings:
    GTF     :  1360x765    60.000341 Hz  16:9     47.520 kHz     84.396000 MHz
    DMT 0x55:  1280x720    60.000000 Hz  16:9     45.000 kHz     74.250000 MHz
  Detailed Timing Descriptors:
    DTD 1:  1366x768    59.789541 Hz 683:384   47.712 kHz     85.500000 MHz (410 mm x 230 mm)
                 Hfront   70 Hsync 143 Hback  213 Hpol P
                 Vfront    3 Vsync   3 Vback   24 Vpol P
    Display Range Limits:
      Monitor ranges (GTF): 55-76 Hz V, 31-61 kHz H, max dotclock 90 MHz
    Display Product Name: 'V191W'
    Display Product Serial Number: ...
Checksum: 0x2e

----------------

Block 1, Unknown EDID Extension Block 0x00:
  00 ff ff ff ff ff ff 00 38 a3 70 67 01 01 01 01 '........8.pg....'
  0f 14 01 03 08 29 17 78 ea 6f b5 a4 55 4d 9b 25 '.....).x.o..UM.%'
  12 50 54 bf ee 00 8b c0 81 c0 01 01 01 01 01 01 '.PT.............'
  01 01 01 01 01 01 66 21 56 aa 51 00 1e 30 46 8f '......f!V.Q..0F.'
  33 00 9a e6 10 00 00 1e 00 00 00 fd 00 37 4c 1f '3............7L.'
  3d 09 00 0a 20 20 20 20 20 20 00 00 00 fc 00 56 '=...      .....V'
  31 39 31 57 0a 20 20 20 20 20 20 20 00 00 00 ff '191W.       ....'
  00 30 34 33 30 37 30 33 39 4e 42 0a 20 20 00 2e '.04307039NB.  ..'
Checksum: 0x2e

----------------

Warnings:

Block 0, Base EDID:
  Standard Timings: Standard Timing 1360x765 has a dubious odd vertical resolution.

Failures:

Block 1, Base EDID:
  Unknown Extension Block.
EDID:
  Base EDID: EDID specified 0 extension block(s), but found 1 extension block(s).

EDID conformity: FAIL
