edid-decode (hex):

00 ff ff ff ff ff ff 00 10 ac 06 70 00 00 00 00
2f 0c 01 03 68 1e 17 78 2a b1 c6 9f 55 4b 99 24
1d 4f 54 a5 4a 00 01 01 01 01 01 01 01 01 01 01
01 01 01 01 01 01 64 19 00 40 41 00 26 30 18 88
36 00 30 e4 10 00 00 18 00 00 00 ff 00 34 52 38
36 39 32 42 4c 4e 37 33 4d 0a 00 00 00 fc 00 44
65 6c 6c 20 45 31 35 31 46 50 70 0a 00 00 00 fd
00 38 4c 1e 3d 08 00 0a 20 20 20 20 20 20 00 8c

----------------

Block 0, Base EDID:
  EDID Structure Version & Revision: 1.3
  Vendor & Product Identification:
    Manufacturer: DEL
    Model: 28678
    Made in: week 47 of 2002
  Basic Display Parameters & Features:
    Analog display
    Input voltage level: 0.7/0.7 V
    Blank level equals black level
    Sync: Separate
    Maximum image size: 30 cm x 23 cm
    Gamma: 2.20
    DPMS levels: Off
    RGB color display
    First detailed timing is the preferred timing
  Color Characteristics:
    Red  : 0.6230, 0.3349
    Green: 0.2929, 0.5986
    Blue : 0.1435, 0.1132
    White: 0.3095, 0.3300
  Established Timings I & II:
    IBM     :   720x400    70.081663 Hz   9:5     31.467 kHz     28.320000 MHz
    DMT 0x04:   640x480    59.940476 Hz   4:3     31.469 kHz     25.175000 MHz
    DMT 0x06:   640x480    75.000000 Hz   4:3     37.500 kHz     31.500000 MHz
    DMT 0x09:   800x600    60.316541 Hz   4:3     37.879 kHz     40.000000 MHz
    DMT 0x0b:   800x600    75.000000 Hz   4:3     46.875 kHz     49.500000 MHz
    DMT 0x10:  1024x768    60.003840 Hz   4:3     48.363 kHz     65.000000 MHz
    DMT 0x12:  1024x768    75.028582 Hz   4:3     60.023 kHz     78.750000 MHz
  Standard Timings: none
  Detailed Timing Descriptors:
    DTD 1:  1024x768    60.003840 Hz   4:3     48.363 kHz     65.000000 MHz (304 mm x 228 mm)
                 Hfront   24 Hsync 136 Hback  160 Hpol N
                 Vfront    3 Vsync   6 Vback   29 Vpol N
    Display Product Serial Number: ...
    Display Product Name: 'Dell E151FPp'
    Display Range Limits:
      Monitor ranges (GTF): 56-76 Hz V, 30-61 kHz H, max dotclock 80 MHz
Checksum: 0x8c

----------------

EDID conformity: PASS
