edid-decode (hex):

00 ff ff ff ff ff ff 00 49 f7 00 00 00 00 00 00
01 1a 01 03 08 00 00 00 0a d7 a5 a2 59 4a 96 24
14 50 54 af ce 00 95 00 01 01 81 00 81 40 81 c0
01 01 01 01 01 01 9a 29 a0 d0 51 84 22 30 50 98
36 00 3f 43 21 00 00 1c 66 21 50 b0 51 00 1b 30
40 70 36 00 3f 43 21 00 00 1e 00 00 00 fd 00 32
4c 1e 50 10 00 0a 20 20 20 20 20 20 00 00 00 fc
00 41 41 41 0a 20 20 20 20 20 20 20 20 0a 00 2e

----------------

Block 0, Base EDID:
  EDID Structure Version & Revision: 1.3
  Vendor & Product Identification:
    Manufacturer: ROW
    Model: 0
    Made in: week 1 of 2016
  Basic Display Parameters & Features:
    Analog display
    Input voltage level: 0.7/0.3 V
    Blank level equals black level
    Sync: Separate
    Image size is variable
    Gamma: 1.00
    RGB color display
    First detailed timing is the preferred timing
  Color Characteristics:
    Red  : 0.6357, 0.3486
    Green: 0.2900, 0.5888
    Blue : 0.1425, 0.0800
    White: 0.3134, 0.3291
  Established Timings I & II:
    IBM     :   720x400    70.082 Hz   9:5    31.467 kHz  28.320 MHz
    DMT 0x04:   640x480    59.940 Hz   4:3    31.469 kHz  25.175 MHz
    DMT 0x05:   640x480    72.809 Hz   4:3    37.861 kHz  31.500 MHz
    DMT 0x06:   640x480    75.000 Hz   4:3    37.500 kHz  31.500 MHz
    DMT 0x08:   800x600    56.250 Hz   4:3    35.156 kHz  36.000 MHz
    DMT 0x09:   800x600    60.317 Hz   4:3    37.879 kHz  40.000 MHz
    DMT 0x0a:   800x600    72.188 Hz   4:3    48.077 kHz  50.000 MHz
    DMT 0x0b:   800x600    75.000 Hz   4:3    46.875 kHz  49.500 MHz
    DMT 0x10:  1024x768    60.004 Hz   4:3    48.363 kHz  65.000 MHz
    DMT 0x11:  1024x768    70.069 Hz   4:3    56.476 kHz  75.000 MHz
    DMT 0x12:  1024x768    75.029 Hz   4:3    60.023 kHz  78.750 MHz
  Standard Timings:
    DMT 0x2f:  1440x900    59.887 Hz  16:10   55.935 kHz 106.500 MHz
    DMT 0x1c:  1280x800    59.810 Hz  16:10   49.702 kHz  83.500 MHz
    DMT 0x20:  1280x960    60.000 Hz   4:3    60.000 kHz 108.000 MHz
    DMT 0x55:  1280x720    60.000 Hz  16:9    45.000 kHz  74.250 MHz
  Detailed Timing Descriptors:
    DTD 1:  1440x900    59.887 Hz   8:5    55.935 kHz 106.500 MHz (575 mm x 323 mm)
                 Hfront   80 Hsync 152 Hback 232 Hpol N
                 Vfront    3 Vsync   6 Vback  25 Vpol P
    DTD 2:  1360x768    60.015 Hz  85:48   47.712 kHz  85.500 MHz (575 mm x 323 mm)
                 Hfront   64 Hsync 112 Hback 256 Hpol P
                 Vfront    3 Vsync   6 Vback  18 Vpol P
  Display Range Limits:
    Monitor ranges (GTF): 50-76 Hz V, 30-80 kHz H, max dotclock 160 MHz
    Display Product Name: 'AAA'
Checksum: 0x2e

----------------

Failures:

Block 0, Base EDID:
  Detailed Timing Descriptor #1: Mismatch of image size vs display size: image size is set, but not display size.
  Detailed Timing Descriptor #2: Mismatch of image size vs display size: image size is set, but not display size.
  Display Product Name: Non-space after newline.

EDID conformity: FAIL
