edid-decode (hex):

00 ff ff ff ff ff ff 00 12 96 00 00 01 01 01 01
05 17 01 03 80 00 00 78 0a de bd a3 55 47 99 26
0c 47 4a a1 08 00 81 c0 01 01 01 01 01 01 01 01
01 01 01 01 01 01 66 21 50 b0 51 00 1b 30 40 70
36 00 f8 ae 21 00 00 1e a9 1a 00 a0 50 00 16 30
30 20 37 00 3f 43 21 00 00 1a 00 00 00 fd 00 32
4c 1f 4b 10 00 0a 20 20 20 20 20 20 00 00 00 fc
00 48 49 53 45 4e 53 45 0a 20 20 20 20 20 01 6a

02 03 24 74 4f 90 05 04 03 07 02 06 01 1f 14 13
12 16 11 15 23 09 07 03 83 01 00 00 67 03 0c 00
10 00 b8 2d 01 1d 00 bc 52 d0 1e 20 b8 28 55 40
c4 8e 21 00 00 1e 01 1d 80 d0 72 1c 16 20 10 2c
25 80 c4 8e 21 00 00 9e 8c 0a d0 8a 20 e0 2d 10
10 3e 96 00 13 8e 21 00 00 18 8c 0a d0 90 20 40
31 20 0c 40 55 00 13 8e 21 00 00 18 00 00 00 00
00 00 00 00 00 00 00 00 00 00 00 00 00 00 00 3e

----------------

Block 0, Base EDID:
  EDID Structure Version & Revision: 1.3
  Vendor & Product Identification:
    Manufacturer: DTV
    Model: 0
    Serial Number: ...
    Made in: week 5 of 2013
  Basic Display Parameters & Features:
    Digital display
    Image size is variable
    Gamma: 2.20
    RGB color display
    First detailed timing is preferred timing
  Color Characteristics:
    Red  : 0.6396, 0.3330
    Green: 0.2802, 0.5996
    Blue : 0.1503, 0.0498
    White: 0.2802, 0.2900
  Established Timings I & II:
    IBM     :   720x400    70.082 Hz   9:5    31.467 kHz  28.320 MHz
    DMT 0x04:   640x480    59.940 Hz   4:3    31.469 kHz  25.175 MHz
    DMT 0x09:   800x600    60.317 Hz   4:3    37.879 kHz  40.000 MHz
    DMT 0x10:  1024x768    60.004 Hz   4:3    48.363 kHz  65.000 MHz
  Standard Timings:
    DMT 0x55:  1280x720    60.000 Hz  16:9    45.000 kHz  74.250 MHz
  Detailed Timing Descriptors:
    DTD 1:  1360x768    60.015 Hz  85:48   47.712 kHz  85.500 MHz (760 mm x 430 mm)
                 Hfront   64 Hsync 112 Hback 256 Hpol P
                 Vfront    3 Vsync   6 Vback  18 Vpol P
    DTD 2:  1280x768    59.995 Hz   5:3    47.396 kHz  68.250 MHz (575 mm x 323 mm)
                 Hfront   48 Hsync  32 Hback  80 Hpol P
                 Vfront    3 Vsync   7 Vback  12 Vpol N
  Display Range Limits:
    Monitor ranges (GTF): 50-76 Hz V, 31-75 kHz H, max dotclock 160 MHz
    Display Product Name: 'HISENSE'
  Extension blocks: 1
Checksum: 0x6a

----------------

Block 1, CTA-861 Extension Block:
  Revision: 3
  Basic audio support
  Supports YCbCr 4:4:4
  Supports YCbCr 4:2:2
  Native detailed modes: 4
  Video Data Block:
    VIC  16:  1920x1080   60.000 Hz  16:9    67.500 kHz 148.500 MHz (native)
    VIC   5:  1920x1080i  60.000 Hz  16:9    33.750 kHz  74.250 MHz
    VIC   4:  1280x720    60.000 Hz  16:9    45.000 kHz  74.250 MHz
    VIC   3:   720x480    59.940 Hz  16:9    31.469 kHz  27.000 MHz
    VIC   7:  1440x480i   59.940 Hz  16:9    15.734 kHz  27.000 MHz
    VIC   2:   720x480    59.940 Hz   4:3    31.469 kHz  27.000 MHz
    VIC   6:  1440x480i   59.940 Hz   4:3    15.734 kHz  27.000 MHz
    VIC   1:   640x480    59.940 Hz   4:3    31.469 kHz  25.175 MHz
    VIC  31:  1920x1080   50.000 Hz  16:9    56.250 kHz 148.500 MHz
    VIC  20:  1920x1080i  50.000 Hz  16:9    28.125 kHz  74.250 MHz
    VIC  19:  1280x720    50.000 Hz  16:9    37.500 kHz  74.250 MHz
    VIC  18:   720x576    50.000 Hz  16:9    31.250 kHz  27.000 MHz
    VIC  22:  1440x576i   50.000 Hz  16:9    15.625 kHz  27.000 MHz
    VIC  17:   720x576    50.000 Hz   4:3    31.250 kHz  27.000 MHz
    VIC  21:  1440x576i   50.000 Hz   4:3    15.625 kHz  27.000 MHz
  Audio Data Block:
    Linear PCM:
      Max channels: 2
      Supported sample rates (kHz): 48 44.1 32
      Supported sample sizes (bits): 20 16
  Speaker Allocation Data Block:
    FL/FR - Front Left/Right
  Vendor-Specific Data Block (HDMI), OUI 00-0C-03:
    Source physical address: 1.0.0.0
    Supports_AI
    DC_36bit
    DC_30bit
    DC_Y444
    Maximum TMDS clock: 225 MHz
  Detailed Timing Descriptors:
    DTD 3:  1280x720    50.000 Hz  16:9    37.500 kHz  74.250 MHz (708 mm x 398 mm)
                 Hfront  440 Hsync  40 Hback 220 Hpol P
                 Vfront    5 Vsync   5 Vback  20 Vpol P
    DTD 4:  1920x1080i  50.000 Hz  16:9    28.125 kHz  74.250 MHz (708 mm x 398 mm)
                 Hfront  528 Hsync  44 Hback 148 Hpol P
                 Vfront    2 Vsync   5 Vback  15 Vpol P Vfront +0.5 Odd Field
                 Vfront    2 Vsync   5 Vback  15 Vpol P Vback  +0.5 Even Field
    DTD 5:   720x480    59.940 Hz   3:2    31.469 kHz  27.000 MHz (531 mm x 398 mm)
                 Hfront   16 Hsync  62 Hback  60 Hpol N
                 Vfront    9 Vsync   6 Vback  30 Vpol N
    DTD 6:   720x576    50.000 Hz   5:4    31.250 kHz  27.000 MHz (531 mm x 398 mm)
                 Hfront   12 Hsync  64 Hback  68 Hpol N
                 Vfront    5 Vsync   5 Vback  39 Vpol N
Checksum: 0x3e

----------------

Failures:

Block 0, Base EDID:
  Detailed Timing Descriptor #1: Mismatch of image size vs display size: image size is set, but not display size.
  Detailed Timing Descriptor #2: Mismatch of image size vs display size: image size is set, but not display size.
Block 1, CTA-861 Extension Block:
  Detailed Timing Descriptor #3: Mismatch of image size vs display size: image size is set, but not display size.
  Detailed Timing Descriptor #4: Mismatch of image size vs display size: image size is set, but not display size.
  Detailed Timing Descriptor #5: Mismatch of image size vs display size: image size is set, but not display size.
  Detailed Timing Descriptor #6: Mismatch of image size vs display size: image size is set, but not display size.
All Blocks:
  Some timings are out of range of the Monitor Ranges:
    Horizontal Freq: 15.625 - 67.500 kHz (Monitor: 31.000 - 75.000 kHz)

EDID conformity: FAIL
