edid-decode (hex):

00 ff ff ff ff ff ff 00 25 e4 d0 1b 01 01 01 01
1c 1c 01 03 18 3c 22 78 2a 22 35 a3 59 4d 9c 28
13 50 54 bf ef 00 81 80 81 40 b3 00 95 00 81 c0
a9 c0 01 01 01 01 1a 36 80 a0 70 38 1f 40 30 20
35 00 56 50 21 00 00 1a 00 00 00 fd 00 37 4c 18
53 10 00 0a 20 20 20 20 20 20 00 00 00 ff 00 47
44 4c 30 30 31 32 31 36 34 45 30 0a 00 00 00 fc
00 4b 48 32 37 35 56 0a 20 20 20 20 20 20 00 97

----------------

Block 0, Base EDID:
  EDID Structure Version & Revision: 1.3
  Vendor & Product Identification:
    Manufacturer: IOD
    Model: 7120
    Serial Number: ...
    Made in: week 28 of 2018
  Basic Display Parameters & Features:
    Analog display
    Input voltage level: 0.7/0.3 V
    Configurable signal levels
    Sync: Separate
    Maximum image size: 60 cm x 34 cm
    Gamma: 2.20
    DPMS levels: Off
    RGB color display
    First detailed timing is preferred timing
  Color Characteristics:
    Red  : 0.6367, 0.3496
    Green: 0.3007, 0.6113
    Blue : 0.1562, 0.0771
    White: 0.3134, 0.3291
  Established Timings I & II:
    IBM     :   720x400    70.082 Hz   9:5    31.467 kHz  28.320 MHz
    DMT 0x04:   640x480    59.940 Hz   4:3    31.469 kHz  25.175 MHz
    Apple   :   640x480    66.667 Hz   4:3    35.000 kHz  30.240 MHz
    DMT 0x05:   640x480    72.809 Hz   4:3    37.861 kHz  31.500 MHz
    DMT 0x06:   640x480    75.000 Hz   4:3    37.500 kHz  31.500 MHz
    DMT 0x08:   800x600    56.250 Hz   4:3    35.156 kHz  36.000 MHz
    DMT 0x09:   800x600    60.317 Hz   4:3    37.879 kHz  40.000 MHz
    DMT 0x0a:   800x600    72.188 Hz   4:3    48.077 kHz  50.000 MHz
    DMT 0x0b:   800x600    75.000 Hz   4:3    46.875 kHz  49.500 MHz
    Apple   :   832x624    74.551 Hz   4:3    49.726 kHz  57.284 MHz
    DMT 0x10:  1024x768    60.004 Hz   4:3    48.363 kHz  65.000 MHz
    DMT 0x11:  1024x768    70.069 Hz   4:3    56.476 kHz  75.000 MHz
    DMT 0x12:  1024x768    75.029 Hz   4:3    60.023 kHz  78.750 MHz
    DMT 0x24:  1280x1024   75.025 Hz   5:4    79.976 kHz 135.000 MHz
  Standard Timings:
    DMT 0x23:  1280x1024   60.020 Hz   5:4    63.981 kHz 108.000 MHz
    DMT 0x20:  1280x960    60.000 Hz   4:3    60.000 kHz 108.000 MHz
    DMT 0x3a:  1680x1050   59.954 Hz  16:10   65.290 kHz 146.250 MHz
    DMT 0x2f:  1440x900    59.887 Hz  16:10   55.935 kHz 106.500 MHz
    DMT 0x55:  1280x720    60.000 Hz  16:9    45.000 kHz  74.250 MHz
    DMT 0x53:  1600x900    60.000 Hz  16:9    60.000 kHz 108.000 MHz (RB)
  Detailed Timing Descriptors:
    DTD 1:  1920x1080   59.934 Hz  16:9    66.587 kHz 138.500 MHz (598 mm x 336 mm)
                 Hfront   48 Hsync  32 Hback  80 Hpol P
                 Vfront    3 Vsync   5 Vback  23 Vpol N
  Display Range Limits:
    Monitor ranges (GTF): 55-76 Hz V, 24-83 kHz H, max dotclock 160 MHz
    Display Product Serial Number: ...
    Display Product Name: 'KH275V'
Checksum: 0x97

----------------

EDID conformity: PASS
