
EDID (hex):
00ffffffffffff004d10ff1300000000
00170104a51d117806de50a3544c9926
0f505400000001010101010101010101
010101010101565e00a0a0a029503020
350026a5100000180000001000000000
00000000000000000000000000100000
000000000000000000000000000000fc
004c5131333354314a5730320a2000b0

Extracted contents:
header:          00 ff ff ff ff ff ff 00
serial number:   4d 10 ff 13 00 00 00 00 00 17
version:         01 04
basic params:    a5 1d 11 78 06
chroma info:     de 50 a3 54 4c 99 26 0f 50 54
established:     00 00 00
standard:        01 01 01 01 01 01 01 01 01 01 01 01 01 01 01 01
descriptor 1:    56 5e 00 a0 a0 a0 29 50 30 20 35 00 26 a5 10 00 00 18
descriptor 2:    00 00 00 10 00 00 00 00 00 00 00 00 00 00 00 00 00 00
descriptor 3:    00 00 00 10 00 00 00 00 00 00 00 00 00 00 00 00 00 00
descriptor 4:    00 00 00 fc 00 4c 51 31 33 33 54 31 4a 57 30 32 0a 20
extensions:      00
checksum:        b0

EDID version: 1.4
Manufacturer: SHP Model 13ff Serial Number --
Made in year 2013
Digital display
8 bits per primary color channel
DisplayPort interface
Maximum image size: 29 cm x 17 cm
Gamma: 2.20
Supported color formats: RGB 4:4:4
Default (sRGB) color space is primary color space
First detailed timing includes the native pixel format and preferred refresh rate
Display x,y Chromaticity:
  Red:   0.6396, 0.3291
  Green: 0.2998, 0.5996
  Blue:  0.1494, 0.0595
  White: 0.3125, 0.3281
Established timings supported:
Standard timings supported:
Detailed mode: Clock 241.500 MHz, 294 mm x 165 mm
               2560 2608 2640 2720 hborder 0
               1440 1443 1448 1481 vborder 0
               -hsync -vsync 
               VertFreq: 59 Hz, HorFreq: 88786 Hz
Dummy block
Dummy block
Monitor name: LQ133T1JW02
Checksum: 0xb0 (valid)
EDID block does NOT conform to EDID 1.4!
	sRGB is signaled, but the chromaticities do not match
	Missing monitor ranges
