
EDID (hex):
00ffffffffffff0006af9d1500000000
001501049026157802c8959e57549226
0f505400000001010101010101010101
010101010101a03780ae703834406c30
aa007dd61000001a152580ae70383440
6c30aa007dd61000001a000000fe0048
3844334b804231373348573100000000
00004129960101000002010a20200038

Extracted contents:
header:          00 ff ff ff ff ff ff 00
serial number:   06 af 9d 15 00 00 00 00 00 15
version:         01 04
basic params:    90 26 15 78 02
chroma info:     c8 95 9e 57 54 92 26 0f 50 54
established:     00 00 00
standard:        01 01 01 01 01 01 01 01 01 01 01 01 01 01 01 01
descriptor 1:    a0 37 80 ae 70 38 34 40 6c 30 aa 00 7d d6 10 00 00 1a
descriptor 2:    15 25 80 ae 70 38 34 40 6c 30 aa 00 7d d6 10 00 00 1a
descriptor 3:    00 00 00 fe 00 48 38 44 33 4b 80 42 31 37 33 48 57 31
descriptor 4:    00 00 00 00 00 00 41 29 96 01 01 00 00 02 01 0a 20 20
extensions:      00
checksum:        38

EDID version: 1.4
Manufacturer: AUO Model 159d Serial Number --
Made in year 2011
Digital display
6 bits per primary color channel
Digital interface is not defined
Maximum image size: 38 cm x 21 cm
Gamma: 2.20
Supported color formats: RGB 4:4:4
First detailed timing includes the native pixel format and preferred refresh rate
Display x,y Chromaticity:
  Red:   0.6201, 0.3398
  Green: 0.3300, 0.5703
  Blue:  0.1503, 0.0595
  White: 0.3134, 0.3291
Established timings supported:
Standard timings supported:
Detailed mode: Clock 142.400 MHz, 381 mm x 214 mm
               1920 2028 2076 2094 hborder 0
               1080 1090 1100 1132 vborder 0
               +hsync -vsync 
               VertFreq: 60 Hz, HorFreq: 68003 Hz
Detailed mode: Clock 94.930 MHz, 381 mm x 214 mm
               1920 2028 2076 2094 hborder 0
               1080 1090 1100 1132 vborder 0
               +hsync -vsync 
               VertFreq: 40 Hz, HorFreq: 45334 Hz
ASCII string: H8D3K
Manufacturer-specified data, tag 0
Checksum: 0x38 (valid)
EDID block does NOT conform to EDID 1.4!
	Missing name descriptor
	Missing monitor ranges
	Detailed block string not properly terminated
