
EDID (hex):
00ffffffffffff0030ae000201010101
0115010380331c78eeef91a3544c9b26
0f505420000001010101010101010101
010101010101023a801871382d40582c
450040846300001e000000fc004c656e
6f766f2041494f205043000000fd003b
3d1e440f000a202020202020000000ff
003030303030310a20202020202001be
02031e70441004030123090707830100
006c030c0010000000c015151f1f011d
007251d01e206e28550040846300001e
8c0ad08a20e02d10103e960040846300
00180000000000000000000000000000
00000000000000000000000000000000
00000000000000000000000000000000
00000000000000000000000000000031

Extracted contents:
header:          00 ff ff ff ff ff ff 00
serial number:   30 ae 00 02 01 01 01 01 01 15
version:         01 03
basic params:    80 33 1c 78 ee
chroma info:     ef 91 a3 54 4c 9b 26 0f 50 54
established:     20 00 00
standard:        01 01 01 01 01 01 01 01 01 01 01 01 01 01 01 01
descriptor 1:    02 3a 80 18 71 38 2d 40 58 2c 45 00 40 84 63 00 00 1e
descriptor 2:    00 00 00 fc 00 4c 65 6e 6f 76 6f 20 41 49 4f 20 50 43
descriptor 3:    00 00 00 fd 00 3b 3d 1e 44 0f 00 0a 20 20 20 20 20 20
descriptor 4:    00 00 00 ff 00 30 30 30 30 30 31 0a 20 20 20 20 20 20
extensions:      01
checksum:        be

EDID version: 1.3
Manufacturer: LEN Model 200 Serial Number --
Made in week 1 of 2011
Digital display
Maximum image size: 51 cm x 28 cm
Gamma: 2.20
DPMS levels: Standby Suspend Off
RGB color display
Default (sRGB) color space is primary color space
First detailed timing is preferred timing
Display x,y Chromaticity:
  Red:   0.6396, 0.3300
  Green: 0.2998, 0.6083
  Blue:  0.1503, 0.0595
  White: 0.3125, 0.3291
Established timings supported:
  640x480@60Hz 4:3 HorFreq: 31469 Hz Clock: 25.175 MHz
Standard timings supported:
Detailed mode: Clock 148.500 MHz, 1600 mm x 900 mm
               1920 2008 2052 2200 hborder 0
               1080 1084 1089 1125 vborder 0
               +hsync +vsync 
               VertFreq: 60 Hz, HorFreq: 67500 Hz
Monitor ranges (GTF): 59-61Hz V, 30-68kHz H, max dotclock 150MHz
Serial number: --
Has 1 extension blocks
Checksum: 0xbe (valid)

CTA extension block
Extension version: 3
26 bytes of CTA data
  Video data block
    VIC  16 1920x1080@60Hz 16:9  HorFreq: 67500 Hz Clock: 148.500 MHz
    VIC   4 1280x720@60Hz 16:9  HorFreq: 45000 Hz Clock: 74.250 MHz
    VIC   3 720x480@60Hz 16:9  HorFreq: 31469 Hz Clock: 27.000 MHz
    VIC   1 640x480@60Hz 4:3  HorFreq: 31469 Hz Clock: 25.175 MHz
  Audio data block
    Linear PCM, max channels 2
      Supported sample rates (kHz): 48 44.1 32
      Supported sample sizes (bits): 24 20 16
  Speaker allocation data block
    Speaker map:
      FL/FR - Front Left/Right
  Vendor-specific data block, OUI 000c03 (HDMI)
    Source physical address 1.0.0.0
    Maximum TMDS clock: 0MHz
    Video latency: 21
    Audio latency: 21
    Interlaced video latency: 31
    Interlaced audio latency: 31
Basic audio support
Supports YCbCr 4:4:4
Supports YCbCr 4:2:2
0 native detailed modes
Detailed mode: Clock 74.250 MHz, 1600 mm x 900 mm
               1280 1390 1430 1650 hborder 0
                720  725  730  750 vborder 0
               +hsync +vsync 
               VertFreq: 60 Hz, HorFreq: 45000 Hz
Detailed mode: Clock 27.000 MHz, 1600 mm x 900 mm
                720  736  798  858 hborder 0
                480  489  495  525 vborder 0
               -hsync -vsync 
               VertFreq: 59 Hz, HorFreq: 31468 Hz
Checksum: 0x31 (valid)

EDID block does NOT conform to EDID 1.3!
	sRGB is signaled, but the chromaticities do not match
	Name descriptor not terminated with a newline
EDID block does not conform at all!
	Both the serial number and the serial string are set
