
EDID (hex):
00ffffffffffff000469d51701010101
271101031c221b782fcf55a555489b26
115054bfef008180818f010101010101
010101010101302a009851002a403070
1300520e1100001e000000fd00374b18
530e0200205058028028000000ff0037
394c4d4d533030373831380a000000fc
0041535553204d42313753450a200070

Extracted contents:
header:          00 ff ff ff ff ff ff 00
serial number:   04 69 d5 17 01 01 01 01 27 11
version:         01 03
basic params:    1c 22 1b 78 2f
chroma info:     cf 55 a5 55 48 9b 26 11 50 54
established:     bf ef 00
standard:        81 80 81 8f 01 01 01 01 01 01 01 01 01 01 01 01
descriptor 1:    30 2a 00 98 51 00 2a 40 30 70 13 00 52 0e 11 00 00 1e
descriptor 2:    00 00 00 fd 00 37 4b 18 53 0e 02 00 20 50 58 02 80 28
descriptor 3:    00 00 00 ff 00 37 39 4c 4d 4d 53 30 30 37 38 31 38 0a
descriptor 4:    00 00 00 fc 00 41 53 55 53 20 4d 42 31 37 53 45 0a 20
extensions:      00
checksum:        70

EDID version: 1.3
Manufacturer: ACI Model 17d5 Serial Number --
Made in week 39 of 2007
Analog display, Input voltage level: 0.7/0.3 V
Configurable signal levels
Sync: Separate Composite 
Maximum image size: 34 cm x 27 cm
Gamma: 2.20
DPMS levels: Off
RGB color display
Default (sRGB) color space is primary color space
First detailed timing is preferred timing
Supports GTF timings within operating range
Display x,y Chromaticity:
  Red:   0.6474, 0.3320
  Green: 0.2841, 0.6083
  Blue:  0.1494, 0.0673
  White: 0.3134, 0.3291
Established timings supported:
  720x400@70Hz 9:5 HorFreq: 31469 Hz Clock: 28.320 MHz
  640x480@60Hz 4:3 HorFreq: 31469 Hz Clock: 25.175 MHz
  640x480@67Hz 4:3 HorFreq: 35000 Hz Clock: 30.240 MHz
  640x480@72Hz 4:3 HorFreq: 37900 Hz Clock: 31.500 MHz
  640x480@75Hz 4:3 HorFreq: 37500 Hz Clock: 31.500 MHz
  800x600@56Hz 4:3 HorFreq: 35200 Hz Clock: 36.000 MHz
  800x600@60Hz 4:3 HorFreq: 37900 Hz Clock: 40.000 MHz
  800x600@72Hz 4:3 HorFreq: 48100 Hz Clock: 50.000 MHz
  800x600@75Hz 4:3 HorFreq: 46900 Hz Clock: 49.500 MHz
  832x624@75Hz 4:3 HorFreq: 49726 Hz Clock: 57.284 MHz
  1024x768@60Hz 4:3 HorFreq: 48400 Hz Clock: 65.000 MHz
  1024x768@70Hz 4:3 HorFreq: 56500 Hz Clock: 75.000 MHz
  1024x768@75Hz 4:3 HorFreq: 60000 Hz Clock: 78.750 MHz
  1280x1024@75Hz 5:4 HorFreq: 80000 Hz Clock: 135.000 MHz
Standard timings supported:
  1280x1024@60Hz 5:4 HorFreq: 64000 Hz Clock: 108.000 MHz
  1280x1024@75Hz 5:4 HorFreq: 80000 Hz Clock: 135.000 MHz
Detailed mode: Clock 108.000 MHz, 338 mm x 270 mm
               1280 1328 1440 1688 hborder 0
               1024 1025 1028 1066 vborder 0
               +hsync +vsync 
               VertFreq: 60 Hz, HorFreq: 63981 Hz
Monitor ranges (GTF with icing): 55-75Hz V, 24-83kHz H, max dotclock 140MHz
Serial number: --
Monitor name: ASUS MB17SE
Checksum: 0x70 (valid)
EDID block does NOT conform to EDID 1.3!
	sRGB is signaled, but the chromaticities do not match
