edid-decode (hex):

00 ff ff ff ff ff ff 00 4c a3 4a 49 00 00 00 00
00 14 01 03 80 22 13 78 0a 8d a5 9d 5b 55 9c 26
19 50 54 00 00 00 01 01 01 01 01 01 01 01 01 01
01 01 01 01 01 01 7b 1e 56 18 51 00 16 30 30 20
25 00 58 c1 10 00 00 19 00 00 00 0f 00 00 00 00
00 00 00 00 00 1e b4 02 74 00 00 00 00 fe 00 53
41 4d 53 55 4e 47 0a 20 20 20 20 20 00 00 00 fe
00 31 35 36 41 54 30 32 2d 41 31 31 0a 20 00 2a

----------------

Block 0, Base EDID:
  EDID Structure Version & Revision: 1.3
  Vendor & Product Identification:
    Manufacturer: SEC
    Model: 18762
    Made in: 2010
  Basic Display Parameters & Features:
    Digital display
    Maximum image size: 34 cm x 19 cm
    Gamma: 2.20
    RGB color display
    First detailed timing is the preferred timing
  Color Characteristics:
    Red  : 0.6152, 0.3554
    Green: 0.3349, 0.6103
    Blue : 0.1503, 0.0996
    White: 0.3134, 0.3291
  Established Timings I & II: none
  Standard Timings: none
  Detailed Timing Descriptors:
    DTD 1:  1366x768    60.007383 Hz 683:384   47.406 kHz     78.030000 MHz (344 mm x 193 mm)
                 Hfront   48 Hsync  32 Hback  200 Hpol N
                 Vfront    2 Vsync   5 Vback   15 Vpol N
    Manufacturer-Specified Display Descriptor (0x0f): 00 0f 00 00 00 00 00 00 00 00 00 1e b4 02 74 00 '..............t.'
    Alphanumeric Data String: 'SAMSUNG'
    Alphanumeric Data String: '156AT02-A11'
Checksum: 0x2a

----------------

Failures:

Block 0, Base EDID:
  Missing Display Product Name.
  Missing Display Range Limits Descriptor.

EDID conformity: FAIL
