
EDID (hex):
00ffffffffffff0026cd3d483c090000
0114010368291a782aa980a555489b26
125054bfef0081808140714f9500950f
b3000101010121399030621a274068b0
360098ff1000001c000000ff00313130
33354d30313032333634000000fd0037
4c1e530f000a202020202020000000fc
00504c31393038570a202020202000f8

Extracted contents:
header:          00 ff ff ff ff ff ff 00
serial number:   26 cd 3d 48 3c 09 00 00 01 14
version:         01 03
basic params:    68 29 1a 78 2a
chroma info:     a9 80 a5 55 48 9b 26 12 50 54
established:     bf ef 00
standard:        81 80 81 40 71 4f 95 00 95 0f b3 00 01 01 01 01
descriptor 1:    21 39 90 30 62 1a 27 40 68 b0 36 00 98 ff 10 00 00 1c
descriptor 2:    00 00 00 ff 00 31 31 30 33 35 4d 30 31 30 32 33 36 34
descriptor 3:    00 00 00 fd 00 37 4c 1e 53 0f 00 0a 20 20 20 20 20 20
descriptor 4:    00 00 00 fc 00 50 4c 31 39 30 38 57 0a 20 20 20 20 20
extensions:      00
checksum:        f8

EDID version: 1.3
Manufacturer: IVM Model 483d Serial Number --
Made in week 1 of 2010
Analog display, Input voltage level: 0.7/0.7 V
Sync: Separate 
Maximum image size: 41 cm x 26 cm
Gamma: 2.20
DPMS levels: Off
RGB color display
First detailed timing is preferred timing
Display x,y Chromaticity:
  Red:   0.6464, 0.3339
  Green: 0.2832, 0.6064
  Blue:  0.1503, 0.0703
  White: 0.3125, 0.3281
Established timings supported:
  720x400@70Hz 9:5 HorFreq: 31469 Hz Clock: 28.320 MHz
  640x480@60Hz 4:3 HorFreq: 31469 Hz Clock: 25.175 MHz
  640x480@67Hz 4:3 HorFreq: 35000 Hz Clock: 30.240 MHz
  640x480@72Hz 4:3 HorFreq: 37900 Hz Clock: 31.500 MHz
  640x480@75Hz 4:3 HorFreq: 37500 Hz Clock: 31.500 MHz
  800x600@56Hz 4:3 HorFreq: 35200 Hz Clock: 36.000 MHz
  800x600@60Hz 4:3 HorFreq: 37900 Hz Clock: 40.000 MHz
  800x600@72Hz 4:3 HorFreq: 48100 Hz Clock: 50.000 MHz
  800x600@75Hz 4:3 HorFreq: 46900 Hz Clock: 49.500 MHz
  832x624@75Hz 4:3 HorFreq: 49726 Hz Clock: 57.284 MHz
  1024x768@60Hz 4:3 HorFreq: 48400 Hz Clock: 65.000 MHz
  1024x768@70Hz 4:3 HorFreq: 56500 Hz Clock: 75.000 MHz
  1024x768@75Hz 4:3 HorFreq: 60000 Hz Clock: 78.750 MHz
  1280x1024@75Hz 5:4 HorFreq: 80000 Hz Clock: 135.000 MHz
Standard timings supported:
  1280x1024@60Hz 5:4 HorFreq: 64000 Hz Clock: 108.000 MHz
  1280x960@60Hz 4:3 HorFreq: 60000 Hz Clock: 108.000 MHz
  1152x864@75Hz 4:3 HorFreq: 67500 Hz Clock: 108.000 MHz
  1440x900@60Hz 16:10 HorFreq: 55500 Hz Clock: 88.750 MHz
  1440x900@75Hz 16:10 HorFreq: 82300 Hz Clock: 156.000 MHz
  1680x1050@60Hz 16:10 HorFreq: 64700 Hz Clock: 119.000 MHz
Detailed mode: Clock 146.250 MHz, 408 mm x 255 mm
               1680 1784 1960 2240 hborder 0
               1050 1053 1059 1089 vborder 0
               -hsync +vsync 
               VertFreq: 59 Hz, HorFreq: 65290 Hz
Serial number: --
Monitor ranges (GTF): 55-76Hz V, 30-83kHz H, max dotclock 150MHz
Monitor name: PL1908W
Checksum: 0xf8 (valid)
One or more of the timings is out of range of the Monitor Ranges:
  Vertical Freq: 56 - 75 Hz
  Horizontal Freq: 31469 - 82300 Hz
  Maximum Clock: 156.000 MHz
