
EDID (hex):
00ffffffffffff004e8e060037315641
310d01030820186c2bbbb9a352469824
0f484ca4420031403159455961598180
010101010101ea240060410028303060
130038ea1000001e000000fd0032a01e
470b000a202020202020000000fc0053
414d54524f4e0a2020202020000000ff
00485642574331303234350a20200032

Extracted contents:
header:          00 ff ff ff ff ff ff 00
serial number:   4e 8e 06 00 37 31 56 41 31 0d
version:         01 03
basic params:    08 20 18 6c 2b
chroma info:     bb b9 a3 52 46 98 24 0f 48 4c
established:     a4 42 00
standard:        31 40 31 59 45 59 61 59 81 80 01 01 01 01 01 01
descriptor 1:    ea 24 00 60 41 00 28 30 30 60 13 00 38 ea 10 00 00 1e
descriptor 2:    00 00 00 fd 00 32 a0 1e 47 0b 00 0a 20 20 20 20 20 20
descriptor 3:    00 00 00 fc 00 53 41 4d 54 52 4f 4e 0a 20 20 20 20 20
descriptor 4:    00 00 00 ff 00 48 56 42 57 43 31 30 32 34 35 0a 20 20
extensions:      00
checksum:        32

EDID version: 1.3
Manufacturer: STN Model 6 Serial Number --
Analog display, Input voltage level: 0.7/0.3 V
Sync: Separate 
Maximum image size: 32 cm x 24 cm
Gamma: 2.08
DPMS levels: Off
RGB color display
First detailed timing is preferred timing
Supports GTF timings within operating range
Display x,y Chromaticity:
  Red:   0.6386, 0.3232
  Green: 0.2753, 0.5966
  Blue:  0.1425, 0.0615
  White: 0.2832, 0.2978
Established timings supported:
  720x400@70Hz 9:5 HorFreq: 31469 Hz Clock: 28.320 MHz
  640x480@60Hz 4:3 HorFreq: 31469 Hz Clock: 25.175 MHz
  640x480@75Hz 4:3 HorFreq: 37500 Hz Clock: 31.500 MHz
  800x600@75Hz 4:3 HorFreq: 46900 Hz Clock: 49.500 MHz
  1024x768@75Hz 4:3 HorFreq: 60000 Hz Clock: 78.750 MHz
Standard timings supported:
  640x480@60Hz 4:3 HorFreq: 31469 Hz Clock: 25.175 MHz
  640x480@85Hz 4:3 HorFreq: 43300 Hz Clock: 36.000 MHz
  800x600@85Hz 4:3 HorFreq: 53700 Hz Clock: 56.250 MHz
  1024x768@85Hz 4:3 HorFreq: 68700 Hz Clock: 94.500 MHz
  1280x1024@60Hz 5:4 HorFreq: 64000 Hz Clock: 108.000 MHz
Detailed mode: Clock 94.500 MHz, 312 mm x 234 mm
               1024 1072 1168 1376 hborder 0
                768  769  772  808 vborder 0
               +hsync +vsync 
               VertFreq: 84 Hz, HorFreq: 68677 Hz
Monitor ranges (GTF): 50-160Hz V, 30-71kHz H, max dotclock 110MHz
Monitor name: SAMTRON
Serial number: --
Checksum: 0x32 (valid)
EDID block does not conform at all!
	Bad year of manufacture
