
EDID (hex):
00ffffffffffff0015d66024ec0b0000
0c15010368341d782aeed1a555489b26
125054bfef0001018180818a818c8140
b300010101011a3680a070381f403020
35000d292100001a000000fd00384b18
5011000a202020202020000000fc004c
4344323436300a2020202020000000ff
0051333742334a41303033303532000e

Extracted contents:
header:          00 ff ff ff ff ff ff 00
serial number:   15 d6 60 24 ec 0b 00 00 0c 15
version:         01 03
basic params:    68 34 1d 78 2a
chroma info:     ee d1 a5 55 48 9b 26 12 50 54
established:     bf ef 00
standard:        01 01 81 80 81 8a 81 8c 81 40 b3 00 01 01 01 01
descriptor 1:    1a 36 80 a0 70 38 1f 40 30 20 35 00 0d 29 21 00 00 1a
descriptor 2:    00 00 00 fd 00 38 4b 18 50 11 00 0a 20 20 20 20 20 20
descriptor 3:    00 00 00 fc 00 4c 43 44 32 34 36 30 0a 20 20 20 20 20
descriptor 4:    00 00 00 ff 00 51 33 37 42 33 4a 41 30 30 33 30 35 32
extensions:      00
checksum:        0e

EDID version: 1.3
Manufacturer: ENV Model 2460 Serial Number --
Made in week 12 of 2011
Analog display, Input voltage level: 0.7/0.7 V
Sync: Separate 
Maximum image size: 52 cm x 29 cm
Gamma: 2.20
DPMS levels: Off
RGB color display
First detailed timing is preferred timing
Display x,y Chromaticity:
  Red:   0.6474, 0.3339
  Green: 0.2841, 0.6074
  Blue:  0.1513, 0.0712
  White: 0.3125, 0.3291
Established timings supported:
  720x400@70Hz 9:5 HorFreq: 31469 Hz Clock: 28.320 MHz
  640x480@60Hz 4:3 HorFreq: 31469 Hz Clock: 25.175 MHz
  640x480@67Hz 4:3 HorFreq: 35000 Hz Clock: 30.240 MHz
  640x480@72Hz 4:3 HorFreq: 37900 Hz Clock: 31.500 MHz
  640x480@75Hz 4:3 HorFreq: 37500 Hz Clock: 31.500 MHz
  800x600@56Hz 4:3 HorFreq: 35200 Hz Clock: 36.000 MHz
  800x600@60Hz 4:3 HorFreq: 37900 Hz Clock: 40.000 MHz
  800x600@72Hz 4:3 HorFreq: 48100 Hz Clock: 50.000 MHz
  800x600@75Hz 4:3 HorFreq: 46900 Hz Clock: 49.500 MHz
  832x624@75Hz 4:3 HorFreq: 49726 Hz Clock: 57.284 MHz
  1024x768@60Hz 4:3 HorFreq: 48400 Hz Clock: 65.000 MHz
  1024x768@70Hz 4:3 HorFreq: 56500 Hz Clock: 75.000 MHz
  1024x768@75Hz 4:3 HorFreq: 60000 Hz Clock: 78.750 MHz
  1280x1024@75Hz 5:4 HorFreq: 80000 Hz Clock: 135.000 MHz
Standard timings supported:
  1280x1024@60Hz 5:4 HorFreq: 64000 Hz Clock: 108.000 MHz
  1280x1024@70Hz 5:4
  1280x1024@72Hz 5:4
  1280x960@60Hz 4:3 HorFreq: 60000 Hz Clock: 108.000 MHz
  1680x1050@60Hz 16:10 HorFreq: 64700 Hz Clock: 119.000 MHz
Detailed mode: Clock 138.500 MHz, 525 mm x 297 mm
               1920 1968 2000 2080 hborder 0
               1080 1083 1088 1111 vborder 0
               +hsync -vsync 
               VertFreq: 59 Hz, HorFreq: 66586 Hz
Monitor ranges (GTF): 56-75Hz V, 24-80kHz H, max dotclock 170MHz
Monitor name: LCD2460
Serial number: --
Checksum: 0xe (valid)
