
EDID (hex):
00ffffffffffff00061034a000000000
25190104b51d1278020f91ae5243b026
0d505400000001010101010101010101
010101010101d9650050a0402e600820
08081eb31000001a7c804050b0083470
082068081eb31000001a000000fc0043
6f6c6f72204c43440a20202000000010
000000000000000000000000000000ef

edid-decode (hex):

00 ff ff ff ff ff ff 00 06 10 34 a0 00 00 00 00
25 19 01 04 b5 1d 12 78 02 0f 91 ae 52 43 b0 26
0d 50 54 00 00 00 01 01 01 01 01 01 01 01 01 01
01 01 01 01 01 01 d9 65 00 50 a0 40 2e 60 08 20
08 08 1e b3 10 00 00 1a 7c 80 40 50 b0 08 34 70
08 20 68 08 1e b3 10 00 00 1a 00 00 00 fc 00 43
6f 6c 6f 72 20 4c 43 44 0a 20 20 20 00 00 00 10
00 00 00 00 00 00 00 00 00 00 00 00 00 00 00 ef

----------------

Block 0, Base EDID:
  EDID Structure Version & Revision: 1.4
  Vendor & Product Identification:
    Manufacturer: APP
    Model: 41012
    Made in: week 37 of 2015
  Basic Display Parameters & Features:
    Digital display
    Bits per primary color channel: 10
    DisplayPort interface
    Maximum image size: 29 cm x 18 cm
    Gamma: 2.20
    Supported color formats: RGB 4:4:4
    First detailed timing includes the native pixel format and preferred refresh rate
  Color Characteristics:
    Red  : 0.6796, 0.3203
    Green: 0.2646, 0.6904
    Blue : 0.1503, 0.0517
    White: 0.3125, 0.3291
  Established Timings I & II: none
  Standard Timings: none
  Detailed Timing Descriptors:
    DTD 1:  2560x1600   60.000828 Hz  16:10    98.761 kHz    260.730000 MHz (286 mm x 179 mm)
                 Hfront    8 Hsync  32 Hback   40 Hpol P
                 Vfront   32 Vsync   8 Vback    6 Vpol N
    DTD 2:  2880x1800   60.000876 Hz  16:10   111.122 kHz    328.920000 MHz (286 mm x 179 mm)
                 Hfront    8 Hsync  32 Hback   40 Hpol P
                 Vfront   38 Vsync   8 Vback    6 Vpol N
    Display Product Name: 'Color LCD'
    Dummy Descriptor:
Checksum: 0xef
