edid-decode (hex):

00 ff ff ff ff ff ff 00 0d ae 4a 12 00 00 00 00
2b 1e 01 04 a5 1c 10 78 03 ee 95 a3 54 4c 99 26
0f 50 54 00 00 00 01 01 01 01 01 01 01 01 01 01
01 01 01 01 01 01 36 36 80 a0 70 38 20 40 30 20
a6 00 14 9b 10 00 00 18 36 36 80 a0 70 38 4c 42
30 20 a6 00 14 9b 10 00 00 18 00 00 00 fe 00 43
4d 4e 0a 20 20 20 20 20 20 20 20 20 00 00 00 fe
00 4e 31 32 35 48 43 47 2d 47 51 31 0a 20 00 41

00 ff ff ff ff ff ff 00 0d ae 4a 12 00 00 00 00
2b 1e 01 04 a5 1c 10 78 03 ee 95 a3 54 4c 99 26
0f 50 54 00 00 00 01 01 01 01 01 01 01 01 01 01
01 01 01 01 01 01 36 36 80 a0 70 38 20 40 30 20
a6 00 14 9b 10 00 00 18 36 36 80 a0 70 38 4c 42
30 20 a6 00 14 9b 10 00 00 18 00 00 00 fe 00 43
4d 4e 0a 20 20 20 20 20 20 20 20 20 00 00 00 fe
00 4e 31 32 35 48 43 47 2d 47 51 31 0a 20 00 41

----------------

Block 0, Base EDID:
  EDID Structure Version & Revision: 1.4
  Vendor & Product Identification:
    Manufacturer: CMN
    Model: 4682
    Made in: week 43 of 2020
  Basic Display Parameters & Features:
    Digital display
    Bits per primary color channel: 8
    DisplayPort interface
    Maximum image size: 28 cm x 16 cm
    Gamma: 2.20
    Supported color formats: RGB 4:4:4
    First detailed timing includes the native pixel format and preferred refresh rate
    Display is continuous frequency
  Color Characteristics:
    Red  : 0.6396, 0.3300
    Green: 0.2998, 0.5996
    Blue : 0.1503, 0.0595
    White: 0.3134, 0.3291
  Established Timings I & II: none
  Standard Timings: none
  Detailed Timing Descriptors:
    DTD 1:  1920x1080   60.001038 Hz  16:9     66.721 kHz    138.780000 MHz (276 mm x 155 mm)
                 Hfront   48 Hsync  32 Hback   80 Hpol N
                 Vfront   10 Vsync   6 Vback   16 Vpol N
    DTD 2:  1920x1080   40.000692 Hz  16:9     66.721 kHz    138.780000 MHz (276 mm x 155 mm)
                 Hfront   48 Hsync  32 Hback   80 Hpol N
                 Vfront   10 Vsync   6 Vback  572 Vpol N
    Alphanumeric Data String: 'CMN'
    Alphanumeric Data String: 'N125HCG-GQ1'
Checksum: 0x41

----------------

Block 1, Unknown EDID Extension Block 0x00:
  00 ff ff ff ff ff ff 00 0d ae 4a 12 00 00 00 00 '..........J.....'
  2b 1e 01 04 a5 1c 10 78 03 ee 95 a3 54 4c 99 26 '+......x....TL.&'
  0f 50 54 00 00 00 01 01 01 01 01 01 01 01 01 01 '.PT.............'
  01 01 01 01 01 01 36 36 80 a0 70 38 20 40 30 20 '......66..p8 @0 '
  a6 00 14 9b 10 00 00 18 36 36 80 a0 70 38 4c 42 '........66..p8LB'
  30 20 a6 00 14 9b 10 00 00 18 00 00 00 fe 00 43 '0 .............C'
  4d 4e 0a 20 20 20 20 20 20 20 20 20 00 00 00 fe 'MN.         ....'
  00 4e 31 32 35 48 43 47 2d 47 51 31 0a 20 00 41 '.N125HCG-GQ1. .A'
Checksum: 0x41

----------------

Warnings:

Block 0, Base EDID:
  Missing Display Product Name.

Failures:

Block 0, Base EDID:
  Missing Display Range Limits Descriptor.
Block 1, Base EDID:
  Unknown Extension Block.
EDID:
  Base EDID: EDID specified 0 extension block(s), but found 1 extension block(s).

EDID conformity: FAIL
