edid-decode (hex):

00 ff ff ff ff ff ff 00 31 6d fb 18 d0 c1 02 00
12 1b 01 03 0e 35 1e 78 2a 6b 35 a4 55 55 9f 27
0c 50 54 21 08 00 71 40 81 00 81 40 81 80 95 00
a9 40 b3 00 8b c0 02 3a 80 18 71 38 2d 40 58 2c
45 00 13 2b 21 00 00 1e 00 00 00 fd 00 3c 4c 1e
53 14 00 0a 20 20 20 20 20 20 00 00 00 fc 00 4c
4e 4b 47 20 56 32 48 41 30 31 0a 20 00 00 00 fa
00 d1 00 d1 40 01 00 01 00 01 00 01 00 0a 00 bf

----------------

Block 0, Base EDID:
  EDID Structure Version & Revision: 1.3
  Vendor & Product Identification:
    Manufacturer: LKM
    Model: 6395
    Serial Number: ...
    Made in: week 18 of 2017
  Basic Display Parameters & Features:
    Analog display
    Input voltage level: 0.7/0.3 V
    Blank level equals black level
    Sync: Separate Composite SyncOnGreen
    Maximum image size: 53 cm x 30 cm
    Gamma: 2.20
    DPMS levels: Off
    RGB color display
    First detailed timing is the preferred timing
  Color Characteristics:
    Red  : 0.6416, 0.3339
    Green: 0.3339, 0.6240
    Blue : 0.1523, 0.0498
    White: 0.3134, 0.3291
  Established Timings I & II:
    DMT 0x04:   640x480    59.940476 Hz   4:3     31.469 kHz     25.175000 MHz
    DMT 0x09:   800x600    60.316541 Hz   4:3     37.879 kHz     40.000000 MHz
    DMT 0x10:  1024x768    60.003840 Hz   4:3     48.363 kHz     65.000000 MHz
  Standard Timings:
    GTF     :  1152x864    60.000000 Hz   4:3     53.700 kHz     81.624000 MHz
    DMT 0x1c:  1280x800    59.810326 Hz  16:10    49.702 kHz     83.500000 MHz
    DMT 0x20:  1280x960    60.000000 Hz   4:3     60.000 kHz    108.000000 MHz
    DMT 0x23:  1280x1024   60.019740 Hz   5:4     63.981 kHz    108.000000 MHz
    DMT 0x2f:  1440x900    59.887445 Hz  16:10    55.935 kHz    106.500000 MHz
    DMT 0x33:  1600x1200   60.000000 Hz   4:3     75.000 kHz    162.000000 MHz
    DMT 0x3a:  1680x1050   59.954250 Hz  16:10    65.290 kHz    146.250000 MHz
    GTF     :  1360x765    60.000341 Hz  16:9     47.520 kHz     84.396000 MHz
  Detailed Timing Descriptors:
    DTD 1:  1920x1080   60.000000 Hz  16:9     67.500 kHz    148.500000 MHz (531 mm x 299 mm)
                 Hfront   88 Hsync  44 Hback  148 Hpol P
                 Vfront    4 Vsync   5 Vback   36 Vpol P
    Display Range Limits:
      Monitor ranges (GTF): 60-76 Hz V, 30-83 kHz H, max dotclock 200 MHz
    Display Product Name: 'LNKG V2HA01'
    Standard Timing Identifications:
      DMT 0x45:  1920x1200   59.884600 Hz  16:10    74.556 kHz    193.250000 MHz
      DMT 0x49:  1920x1440   60.000000 Hz   4:3     90.000 kHz    234.000000 MHz
Checksum: 0xbf

----------------

Warnings:

Block 0, Base EDID:
  Standard Timings: Standard Timing 1360x765 has a dubious odd vertical resolution.

Failures:

Block 0, Base EDID:
  Standard Timing Identifications: Use 0x0101 as the invalid Standard Timings code, not 0x0100.
  Standard Timing Identifications: Use 0x0101 as the invalid Standard Timings code, not 0x0100.
  Standard Timing Identifications: Use 0x0101 as the invalid Standard Timings code, not 0x0100.
  Standard Timing Identifications: Use 0x0101 as the invalid Standard Timings code, not 0x0100.
EDID:
  Base EDID: Some timings are out of range of the Monitor Ranges:
    Horizontal Freq: 31.468 - 90.000 kHz (Monitor: 30.000 - 83.000 kHz)
    Maximum Clock: 234.000 MHz (Monitor: 200.000 MHz)

EDID conformity: FAIL
