
EDID (hex):
00ffffffffffff001e6da59c01010101
0911010301462778ead9b0a357499c25
11494ba56e00314045406140d1c00101
0101010101011b2150a051001e304888
3500bc862100001c263680a070381f40
50208500bc8621000018000000fc0034
324c4334360a202020202020000000fd
003c4b1d430e000a20202020202000b0

Extracted contents:
header:          00 ff ff ff ff ff ff 00
serial number:   1e 6d a5 9c 01 01 01 01 09 11
version:         01 03
basic params:    01 46 27 78 ea
chroma info:     d9 b0 a3 57 49 9c 25 11 49 4b
established:     a5 6e 00
standard:        31 40 45 40 61 40 d1 c0 01 01 01 01 01 01 01 01
descriptor 1:    1b 21 50 a0 51 00 1e 30 48 88 35 00 bc 86 21 00 00 1c
descriptor 2:    26 36 80 a0 70 38 1f 40 50 20 85 00 bc 86 21 00 00 18
descriptor 3:    00 00 00 fc 00 34 32 4c 43 34 36 0a 20 20 20 20 20 20
descriptor 4:    00 00 00 fd 00 3c 4b 1d 43 0e 00 0a 20 20 20 20 20 20
extensions:      00
checksum:        b0

EDID version: 1.3
Manufacturer: GSM Model 9ca5 Serial Number --
Made in week 9 of 2007
Analog display, Input voltage level: 0.7/0.3 V
Sync: Serration 
Maximum image size: 70 cm x 39 cm
Gamma: 2.20
DPMS levels: Standby Suspend Off
RGB color display
First detailed timing is preferred timing
Display x,y Chromaticity:
  Red:   0.6396, 0.3408
  Green: 0.2871, 0.6103
  Blue:  0.1464, 0.0693
  White: 0.2851, 0.2929
Established timings supported:
  720x400@70Hz 9:5 HorFreq: 31469 Hz Clock: 28.320 MHz
  640x480@60Hz 4:3 HorFreq: 31469 Hz Clock: 25.175 MHz
  640x480@75Hz 4:3 HorFreq: 37500 Hz Clock: 31.500 MHz
  800x600@60Hz 4:3 HorFreq: 37900 Hz Clock: 40.000 MHz
  800x600@75Hz 4:3 HorFreq: 46900 Hz Clock: 49.500 MHz
  832x624@75Hz 4:3 HorFreq: 49726 Hz Clock: 57.284 MHz
  1024x768@60Hz 4:3 HorFreq: 48400 Hz Clock: 65.000 MHz
  1024x768@70Hz 4:3 HorFreq: 56500 Hz Clock: 75.000 MHz
  1024x768@75Hz 4:3 HorFreq: 60000 Hz Clock: 78.750 MHz
Standard timings supported:
  640x480@60Hz 4:3 HorFreq: 31469 Hz Clock: 25.175 MHz
  800x600@60Hz 4:3 HorFreq: 37900 Hz Clock: 40.000 MHz
  1024x768@60Hz 4:3 HorFreq: 48400 Hz Clock: 65.000 MHz
  1920x1080@60Hz 16:9
Detailed mode: Clock 84.750 MHz, 700 mm x 390 mm
               1360 1432 1568 1776 hborder 0
                768  771  776  798 vborder 0
               -hsync +vsync 
               VertFreq: 59 Hz, HorFreq: 47719 Hz
Detailed mode: Clock 138.620 MHz, 700 mm x 390 mm
               1920 2000 2032 2080 hborder 0
               1080 1088 1093 1111 vborder 0
               -hsync -vsync 
               VertFreq: 59 Hz, HorFreq: 66644 Hz
Monitor name: 42LC46
Monitor ranges (GTF): 60-75Hz V, 29-67kHz H, max dotclock 140MHz
Checksum: 0xb0 (valid)
One or more of the timings is out of range of the Monitor Ranges:
  Vertical Freq: 59 - 75 Hz
  Horizontal Freq: 31469 - 66644 Hz
  Maximum Clock: 138.620 MHz
