
EDID (hex):
00ffffffffffff0009e53e0900000000
101e0104a5221378061a05a6544b9e25
0f505400000001010101010101010101
010101010101283880cc703830403020
360058c21000001aed2c80cc70383040
3020360058c21000001a000000fe0056
334e504d804e5631354e364200000000
00024121a8001100000a010a20200053

Extracted contents:
header:          00 ff ff ff ff ff ff 00
serial number:   09 e5 3e 09 00 00 00 00 10 1e
version:         01 04
basic params:    a5 22 13 78 06
chroma info:     1a 05 a6 54 4b 9e 25 0f 50 54
established:     00 00 00
standard:        01 01 01 01 01 01 01 01 01 01 01 01 01 01 01 01
descriptor 1:    28 38 80 cc 70 38 30 40 30 20 36 00 58 c2 10 00 00 1a
descriptor 2:    ed 2c 80 cc 70 38 30 40 30 20 36 00 58 c2 10 00 00 1a
descriptor 3:    00 00 00 fe 00 56 33 4e 50 4d 80 4e 56 31 35 4e 36 42
descriptor 4:    00 00 00 00 00 02 41 21 a8 00 11 00 00 0a 01 0a 20 20
extensions:      00
checksum:        53

EDID version: 1.4
Manufacturer: BOE Model 93e Serial Number --
Made in week 16 of 2020
Digital display
8 bits per primary color channel
DisplayPort interface
Maximum image size: 34 cm x 19 cm
Gamma: 2.20
Supported color formats: RGB 4:4:4
Default (sRGB) color space is primary color space
First detailed timing includes the native pixel format and preferred refresh rate
Display x,y Chromaticity:
  Red:   0.6484, 0.3291
  Green: 0.2949, 0.6191
  Blue:  0.1445, 0.0585
  White: 0.3134, 0.3291
Established timings supported:
Standard timings supported:
Detailed mode: Clock 143.760 MHz, 344 mm x 194 mm
               1920 1968 2000 2124 hborder 0
               1080 1083 1089 1128 vborder 0
               +hsync -vsync 
               VertFreq: 60 Hz, HorFreq: 67683 Hz
Detailed mode: Clock 115.010 MHz, 344 mm x 194 mm
               1920 1968 2000 2124 hborder 0
               1080 1083 1089 1128 vborder 0
               +hsync -vsync 
               VertFreq: 48 Hz, HorFreq: 54147 Hz
ASCII string: V3NPM
Manufacturer-specified data, tag 0
Checksum: 0x53 (valid)
EDID block does NOT conform to EDID 1.4!
	sRGB is signaled, but the chromaticities do not match
	Missing name descriptor
	Missing monitor ranges
	Detailed block string not properly terminated
