
EDID (hex):
00ffffffffffff0010ac12f101000000
07150103802c1978ea7b00a6554b9a25
135054010800818081c0010101010101
010101010101302a40c8608464301850
1300bbf91000001e000000fd003c4b2f
460e000a202020202020000000fc0044
454c4c2032300a2020202020662150b0
51001b3040703600bbf91000001e0035

Extracted contents:
header:          00 ff ff ff ff ff ff 00
serial number:   10 ac 12 f1 01 00 00 00 07 15
version:         01 03
basic params:    80 2c 19 78 ea
chroma info:     7b 00 a6 55 4b 9a 25 13 50 54
established:     01 08 00
standard:        81 80 81 c0 01 01 01 01 01 01 01 01 01 01 01 01
descriptor 1:    30 2a 40 c8 60 84 64 30 18 50 13 00 bb f9 10 00 00 1e
descriptor 2:    00 00 00 fd 00 3c 4b 2f 46 0e 00 0a 20 20 20 20 20 20
descriptor 3:    00 00 00 fc 00 44 45 4c 4c 20 32 30 0a 20 20 20 20 20
descriptor 4:    66 21 50 b0 51 00 1b 30 40 70 36 00 bb f9 10 00 00 1e
extensions:      00
checksum:        35

EDID version: 1.3
Manufacturer: DEL Model f112 Serial Number --
Made in week 7 of 2011
Digital display
Maximum image size: 44 cm x 25 cm
Gamma: 2.20
DPMS levels: Standby Suspend Off
RGB color display
First detailed timing is preferred timing
Display x,y Chromaticity:
  Red:   0.6494, 0.3349
  Green: 0.2949, 0.6044
  Blue:  0.1445, 0.0742
  White: 0.3125, 0.3281
Established timings supported:
  800x600@60Hz 4:3 HorFreq: 37900 Hz Clock: 40.000 MHz
  1024x768@60Hz 4:3 HorFreq: 48400 Hz Clock: 65.000 MHz
Standard timings supported:
  1280x1024@60Hz 5:4 HorFreq: 64000 Hz Clock: 108.000 MHz
  1280x720@60Hz 16:9
Detailed mode: Clock 108.000 MHz, 443 mm x 249 mm
               1600 1624 1704 1800 hborder 0
                900  901  904 1000 vborder 0
               +hsync +vsync 
               VertFreq: 60 Hz, HorFreq: 60000 Hz
Monitor ranges (GTF): 60-75Hz V, 47-70kHz H, max dotclock 140MHz
Monitor name: DELL 20
Detailed mode: Clock 85.500 MHz, 443 mm x 249 mm
               1360 1424 1536 1792 hborder 0
                768  771  777  795 vborder 0
               +hsync +vsync 
               VertFreq: 60 Hz, HorFreq: 47712 Hz
Checksum: 0x35 (valid)
One or more of the timings is out of range of the Monitor Ranges:
  Vertical Freq: 60 - 60 Hz
  Horizontal Freq: 37900 - 64000 Hz
  Maximum Clock: 108.000 MHz
EDID block does not conform at all!
	Invalid detailed timing descriptor ordering
