
EDID (hex):
00ffffffffffff00410c49c01b030200
2f1301036e2f1a78ca3585a656489a24
125054bfef80d1c081c0810081800101
010101010101023a801871382d40582c
4500dc0c1100001e000000ff00444c31
30393437313331383637000000fc0050
68696c69707320323233450a000000fd
00384c1e5315000a2020202020200011

Extracted contents:
header:          00 ff ff ff ff ff ff 00
serial number:   41 0c 49 c0 1b 03 02 00 2f 13
version:         01 03
basic params:    6e 2f 1a 78 ca
chroma info:     35 85 a6 56 48 9a 24 12 50 54
established:     bf ef 80
standard:        d1 c0 81 c0 81 00 81 80 01 01 01 01 01 01 01 01
descriptor 1:    02 3a 80 18 71 38 2d 40 58 2c 45 00 dc 0c 11 00 00 1e
descriptor 2:    00 00 00 ff 00 44 4c 31 30 39 34 37 31 33 31 38 36 37
descriptor 3:    00 00 00 fc 00 50 68 69 6c 69 70 73 20 32 32 33 45 0a
descriptor 4:    00 00 00 fd 00 38 4c 1e 53 15 00 0a 20 20 20 20 20 20
extensions:      00
checksum:        11

EDID version: 1.3
Manufacturer: PHL Model c049 Serial Number --
Made in week 47 of 2009
Analog display, Input voltage level: 0.7/0.7 V
Sync: Separate Composite SyncOnGreen 
Maximum image size: 47 cm x 26 cm
Gamma: 2.20
DPMS levels: Standby Suspend
RGB color display
First detailed timing is preferred timing
Display x,y Chromaticity:
  Red:   0.6484, 0.3388
  Green: 0.2822, 0.6025
  Blue:  0.1425, 0.0703
  White: 0.3134, 0.3291
Established timings supported:
  720x400@70Hz 9:5 HorFreq: 31469 Hz Clock: 28.320 MHz
  640x480@60Hz 4:3 HorFreq: 31469 Hz Clock: 25.175 MHz
  640x480@67Hz 4:3 HorFreq: 35000 Hz Clock: 30.240 MHz
  640x480@72Hz 4:3 HorFreq: 37900 Hz Clock: 31.500 MHz
  640x480@75Hz 4:3 HorFreq: 37500 Hz Clock: 31.500 MHz
  800x600@56Hz 4:3 HorFreq: 35200 Hz Clock: 36.000 MHz
  800x600@60Hz 4:3 HorFreq: 37900 Hz Clock: 40.000 MHz
  800x600@72Hz 4:3 HorFreq: 48100 Hz Clock: 50.000 MHz
  800x600@75Hz 4:3 HorFreq: 46900 Hz Clock: 49.500 MHz
  832x624@75Hz 4:3 HorFreq: 49726 Hz Clock: 57.284 MHz
  1024x768@60Hz 4:3 HorFreq: 48400 Hz Clock: 65.000 MHz
  1024x768@70Hz 4:3 HorFreq: 56500 Hz Clock: 75.000 MHz
  1024x768@75Hz 4:3 HorFreq: 60000 Hz Clock: 78.750 MHz
  1280x1024@75Hz 5:4 HorFreq: 80000 Hz Clock: 135.000 MHz
  1152x870@75Hz 192:145 HorFreq: 67500 Hz Clock: 108.000 MHz
Standard timings supported:
  1920x1080@60Hz 16:9
  1280x720@60Hz 16:9
  1280x800@60Hz 16:10
  1280x1024@60Hz 5:4 HorFreq: 64000 Hz Clock: 108.000 MHz
Detailed mode: Clock 148.500 MHz, 476 mm x 268 mm
               1920 2008 2052 2200 hborder 0
               1080 1084 1089 1125 vborder 0
               +hsync +vsync 
               VertFreq: 60 Hz, HorFreq: 67500 Hz
Serial number: --
Monitor name: Philips 223E
Monitor ranges (GTF): 56-76Hz V, 30-83kHz H, max dotclock 210MHz
Checksum: 0x11 (valid)
