
EDID (hex):
00ffffffffffff001ab3ee07ba0e0000
30150103803c22782a8e05ad4f33b026
0d5054a54b00a940b300950081008180
010101010101565e00a0a0a029503020
350055502100001e000000fd00324c1e
6321000a202020202020000000fc0050
3237542d36204950530a2020000000ff
00595635573030333737300a202001ec
02030400283c80a070b0234030203600
55502100001a023a801871382d40582c
9600555021000018011d007251d01e20
6e28550055502100001e023a80d07238
2d40102c968055502100001800000000
00000000000000000000000000000000
00000000000000000000000000000000
00000000000000000000000000000017

edid-decode (hex):

00 ff ff ff ff ff ff 00 1a b3 ee 07 ba 0e 00 00
30 15 01 03 80 3c 22 78 2a 8e 05 ad 4f 33 b0 26
0d 50 54 a5 4b 00 a9 40 b3 00 95 00 81 00 81 80
01 01 01 01 01 01 56 5e 00 a0 a0 a0 29 50 30 20
35 00 55 50 21 00 00 1e 00 00 00 fd 00 32 4c 1e
63 21 00 0a 20 20 20 20 20 20 00 00 00 fc 00 50
32 37 54 2d 36 20 49 50 53 0a 20 20 00 00 00 ff
00 59 56 35 57 30 30 33 37 37 30 0a 20 20 01 ec

02 03 04 00 28 3c 80 a0 70 b0 23 40 30 20 36 00
55 50 21 00 00 1a 02 3a 80 18 71 38 2d 40 58 2c
96 00 55 50 21 00 00 18 01 1d 00 72 51 d0 1e 20
6e 28 55 00 55 50 21 00 00 1e 02 3a 80 d0 72 38
2d 40 10 2c 96 80 55 50 21 00 00 18 00 00 00 00
00 00 00 00 00 00 00 00 00 00 00 00 00 00 00 00
00 00 00 00 00 00 00 00 00 00 00 00 00 00 00 00
00 00 00 00 00 00 00 00 00 00 00 00 00 00 00 17

----------------

Block 0, Base EDID:
  EDID Structure Version & Revision: 1.3
  Vendor & Product Identification:
    Manufacturer: FUS
    Model: 2030
    Serial Number: 3770
    Made in: week 48 of 2011
  Basic Display Parameters & Features:
    Digital display
    Maximum image size: 60 cm x 34 cm
    Gamma: 2.20
    DPMS levels: Off
    RGB color display
    First detailed timing is the preferred timing
  Color Characteristics:
    Red  : 0.6777, 0.3085
    Green: 0.2021, 0.6894
    Blue : 0.1484, 0.0507
    White: 0.3134, 0.3291
  Established Timings I & II:
    IBM     :   720x400    70.081663 Hz   9:5     31.467 kHz     28.320000 MHz
    DMT 0x04:   640x480    59.940476 Hz   4:3     31.469 kHz     25.175000 MHz
    DMT 0x06:   640x480    75.000000 Hz   4:3     37.500 kHz     31.500000 MHz
    DMT 0x09:   800x600    60.316541 Hz   4:3     37.879 kHz     40.000000 MHz
    DMT 0x0b:   800x600    75.000000 Hz   4:3     46.875 kHz     49.500000 MHz
    DMT 0x10:  1024x768    60.003840 Hz   4:3     48.363 kHz     65.000000 MHz
    DMT 0x12:  1024x768    75.028582 Hz   4:3     60.023 kHz     78.750000 MHz
    DMT 0x24:  1280x1024   75.024675 Hz   5:4     79.976 kHz    135.000000 MHz
  Standard Timings:
    DMT 0x33:  1600x1200   60.000000 Hz   4:3     75.000 kHz    162.000000 MHz
    DMT 0x3a:  1680x1050   59.954250 Hz  16:10    65.290 kHz    146.250000 MHz
    DMT 0x2f:  1440x900    59.887445 Hz  16:10    55.935 kHz    106.500000 MHz
    DMT 0x1c:  1280x800    59.810326 Hz  16:10    49.702 kHz     83.500000 MHz
    DMT 0x23:  1280x1024   60.019740 Hz   5:4     63.981 kHz    108.000000 MHz
  Detailed Timing Descriptors:
    DTD 1:  2560x1440   59.950550 Hz  16:9     88.787 kHz    241.500000 MHz (597 mm x 336 mm)
                 Hfront   48 Hsync  32 Hback   80 Hpol P
                 Vfront    3 Vsync   5 Vback   33 Vpol P
    Display Range Limits:
      Monitor ranges (GTF): 50-76 Hz V, 30-99 kHz H, max dotclock 330 MHz
    Display Product Name: 'P27T-6 IPS'
    Display Product Serial Number: 'YV5W003770'
  Extension blocks: 1
Checksum: 0xec

----------------

Block 1, CTA-861 Extension Block:
  Revision: 3
  Native detailed modes: 0
  Detailed Timing Descriptors:
    DTD 2:  1920x1200   59.950171 Hz  16:10    74.038 kHz    154.000000 MHz (597 mm x 336 mm)
                 Hfront   48 Hsync  32 Hback   80 Hpol P
                 Vfront    3 Vsync   6 Vback   26 Vpol N
    DTD 3:  1920x1080   60.000000 Hz  16:9     67.500 kHz    148.500000 MHz (597 mm x 336 mm)
                 Hfront   88 Hsync  44 Hback  148 Hpol N
                 Vfront    9 Vsync   6 Vback   30 Vpol N
    DTD 4:  1280x720    60.000000 Hz  16:9     45.000 kHz     74.250000 MHz (597 mm x 336 mm)
                 Hfront  110 Hsync  40 Hback  220 Hpol P
                 Vfront    5 Vsync   5 Vback   20 Vpol P
    DTD 5:  1920x1080   50.000000 Hz  16:9     56.250 kHz    148.500000 MHz (597 mm x 336 mm)
                 Hfront  528 Hsync  44 Hback  148 Hpol N
                 Vfront    9 Vsync   6 Vback   30 Vpol N
Checksum: 0x17  Unused space in Extension Block: 51 bytes


