
EDID (hex):
00ffffffffffff0030e4340500000000
001a010495221378ea1fc5955a559127
1c505400000001010101010101010101
010101010101293680a070381f403020
350058c21000001a542b80a070381f40
3020350058c21000001a000000fe0032
524d5250803135365746370a00000000
0000413196011000001a010a20200017

Extracted contents:
header:          00 ff ff ff ff ff ff 00
serial number:   30 e4 34 05 00 00 00 00 00 1a
version:         01 04
basic params:    95 22 13 78 ea
chroma info:     1f c5 95 5a 55 91 27 1c 50 54
established:     00 00 00
standard:        01 01 01 01 01 01 01 01 01 01 01 01 01 01 01 01
descriptor 1:    29 36 80 a0 70 38 1f 40 30 20 35 00 58 c2 10 00 00 1a
descriptor 2:    54 2b 80 a0 70 38 1f 40 30 20 35 00 58 c2 10 00 00 1a
descriptor 3:    00 00 00 fe 00 32 52 4d 52 50 80 31 35 36 57 46 37 0a
descriptor 4:    00 00 00 00 00 00 41 31 96 01 10 00 00 1a 01 0a 20 20
extensions:      00
checksum:        17

EDID version: 1.4
Manufacturer: LGD Model 534 Serial Number --
Made in year 2016
Digital display
6 bits per primary color channel
DisplayPort interface
Maximum image size: 34 cm x 19 cm
Gamma: 2.20
DPMS levels: Standby Suspend Off
Supported color formats: RGB 4:4:4, YCrCb 4:4:4
First detailed timing includes the native pixel format and preferred refresh rate
Display x,y Chromaticity:
  Red:   0.5820, 0.3525
  Green: 0.3349, 0.5693
  Blue:  0.1552, 0.1093
  White: 0.3134, 0.3291
Established timings supported:
Standard timings supported:
Detailed mode: Clock 138.650 MHz, 344 mm x 194 mm
               1920 1968 2000 2080 hborder 0
               1080 1083 1088 1111 vborder 0
               +hsync -vsync 
               VertFreq: 59 Hz, HorFreq: 66658 Hz
Detailed mode: Clock 110.920 MHz, 344 mm x 194 mm
               1920 1968 2000 2080 hborder 0
               1080 1083 1088 1111 vborder 0
               +hsync -vsync 
               VertFreq: 47 Hz, HorFreq: 53326 Hz
ASCII string: 2RMRP
Manufacturer-specified data, tag 0
Checksum: 0x17 (valid)
EDID block does NOT conform to EDID 1.4!
	Missing name descriptor
	Missing monitor ranges
	Detailed block string not properly terminated
