
EDID (hex):
00ffffffffffff0009e5e10600000000
011a0104a51d11780a5a53ab53469723
184e5500000001010101010101010101
010101010101bc398018713828403020
360026a51000001a362e801871382840
3020360026a51000001a000000fe0042
4f452043510a202020202020000000fe
004e563133334648422d4e33310a0061

Extracted contents:
header:          00 ff ff ff ff ff ff 00
serial number:   09 e5 e1 06 00 00 00 00 01 1a
version:         01 04
basic params:    a5 1d 11 78 0a
chroma info:     5a 53 ab 53 46 97 23 18 4e 55
established:     00 00 00
standard:        01 01 01 01 01 01 01 01 01 01 01 01 01 01 01 01
descriptor 1:    bc 39 80 18 71 38 28 40 30 20 36 00 26 a5 10 00 00 1a
descriptor 2:    36 2e 80 18 71 38 28 40 30 20 36 00 26 a5 10 00 00 1a
descriptor 3:    00 00 00 fe 00 42 4f 45 20 43 51 0a 20 20 20 20 20 20
descriptor 4:    00 00 00 fe 00 4e 56 31 33 33 46 48 42 2d 4e 33 31 0a
extensions:      00
checksum:        61

EDID version: 1.4
Manufacturer: BOE Model 6e1 Serial Number --
Made in week 1 of 2016
Digital display
8 bits per primary color channel
DisplayPort interface
Maximum image size: 29 cm x 17 cm
Gamma: 2.20
Supported color formats: RGB 4:4:4, YCrCb 4:4:4
First detailed timing includes the native pixel format and preferred refresh rate
Display x,y Chromaticity:
  Red:   0.6689, 0.3251
  Green: 0.2753, 0.5917
  Blue:  0.1376, 0.0947
  White: 0.3046, 0.3349
Established timings supported:
Standard timings supported:
Detailed mode: Clock 147.800 MHz, 294 mm x 165 mm
               1920 1968 2000 2200 hborder 0
               1080 1083 1089 1120 vborder 0
               +hsync -vsync 
               VertFreq: 59 Hz, HorFreq: 67181 Hz
Detailed mode: Clock 118.300 MHz, 294 mm x 165 mm
               1920 1968 2000 2200 hborder 0
               1080 1083 1089 1120 vborder 0
               +hsync -vsync 
               VertFreq: 48 Hz, HorFreq: 53772 Hz
ASCII string: BOE CQ
ASCII string: NV133FHB-N31
Checksum: 0x61 (valid)
EDID block does NOT conform to EDID 1.4!
	Missing name descriptor
	Missing monitor ranges
