edid-decode (hex):

00 ff ff ff ff ff ff 00 4a 8b 82 24 00 00 00 00
15 15 01 03 80 33 1c 78 ea b4 b0 a5 55 48 9a 26
12 50 54 21 08 00 a9 c0 95 c0 81 c0 01 01 01 01
01 01 01 01 01 01 1a 36 80 a0 70 38 1f 40 30 20
35 00 fd 1e 11 00 00 1e 00 00 00 ff 00 30 30 30
30 30 31 0a 0a 0a 0a 0a 0a 0a 00 00 00 fd 00 32
4b 1e 55 0f 00 0a 20 20 20 20 20 20 00 00 00 fc
00 43 50 4c 20 41 49 4f 20 50 43 0a 20 20 00 9b

----------------

Block 0, Base EDID:
  EDID Structure Version & Revision: 1.3
  Vendor & Product Identification:
    Manufacturer: RTK
    Model: 9346
    Made in: week 21 of 2011
  Basic Display Parameters & Features:
    Digital display
    Maximum image size: 51 cm x 28 cm
    Gamma: 2.20
    DPMS levels: Standby Suspend Off
    RGB color display
    First detailed timing is the preferred timing
  Color Characteristics:
    Red  : 0.6464, 0.3349
    Green: 0.2822, 0.6015
    Blue : 0.1503, 0.0732
    White: 0.3125, 0.3281
  Established Timings I & II:
    DMT 0x04:   640x480    59.940476 Hz   4:3     31.469 kHz     25.175000 MHz
    DMT 0x09:   800x600    60.316541 Hz   4:3     37.879 kHz     40.000000 MHz
    DMT 0x10:  1024x768    60.003840 Hz   4:3     48.363 kHz     65.000000 MHz
  Standard Timings:
    DMT 0x53:  1600x900    60.000000 Hz  16:9     60.000 kHz    108.000000 MHz (RB)
    GTF     :  1440x810    60.000051 Hz  16:9     50.340 kHz     95.042000 MHz
    DMT 0x55:  1280x720    60.000000 Hz  16:9     45.000 kHz     74.250000 MHz
  Detailed Timing Descriptors:
    DTD 1:  1920x1080   59.933878 Hz  16:9     66.587 kHz    138.500000 MHz (509 mm x 286 mm)
                 Hfront   48 Hsync  32 Hback   80 Hpol P
                 Vfront    3 Vsync   5 Vback   23 Vpol P
    Display Product Serial Number: ...
    Display Range Limits:
      Monitor ranges (GTF): 50-75 Hz V, 30-85 kHz H, max dotclock 150 MHz
    Display Product Name: 'CPL AIO PC'
Checksum: 0x9b

----------------

Failures:

Block 0, Base EDID:
  Display Product Serial Number: ...

EDID conformity: FAIL
