
EDID (hex):
00ffffffffffff0019f82d953e593f1e
231e010380291a78ead6a5a2594a9524
145054afcf0081809500950f950a950c
0101010101016b35a0f051842a306098
36009a001100001a9a29a0d051842230
509836009a001100001c000000fd0038
4b1e510e000a202020202020000000fc
004c4544204d4f4e49544f520a20000b

Extracted contents:
header:          00 ff ff ff ff ff ff 00
serial number:   19 f8 2d 95 3e 59 3f 1e 23 1e
version:         01 03
basic params:    80 29 1a 78 ea
chroma info:     d6 a5 a2 59 4a 95 24 14 50 54
established:     af cf 00
standard:        81 80 95 00 95 0f 95 0a 95 0c 01 01 01 01 01 01
descriptor 1:    6b 35 a0 f0 51 84 2a 30 60 98 36 00 9a 00 11 00 00 1a
descriptor 2:    9a 29 a0 d0 51 84 22 30 50 98 36 00 9a 00 11 00 00 1c
descriptor 3:    00 00 00 fd 00 38 4b 1e 51 0e 00 0a 20 20 20 20 20 20
descriptor 4:    00 00 00 fc 00 4c 45 44 20 4d 4f 4e 49 54 4f 52 0a 20
extensions:      00
checksum:        0b

EDID version: 1.3
Manufacturer: FOX Model 952d Serial Number --
Made in week 35 of 2020
Digital display
Maximum image size: 41 cm x 26 cm
Gamma: 2.20
DPMS levels: Standby Suspend Off
RGB color display
First detailed timing is preferred timing
Display x,y Chromaticity:
  Red:   0.6357, 0.3486
  Green: 0.2900, 0.5839
  Blue:  0.1425, 0.0800
  White: 0.3134, 0.3291
Established timings supported:
  720x400@70Hz 9:5 HorFreq: 31469 Hz Clock: 28.320 MHz
  640x480@60Hz 4:3 HorFreq: 31469 Hz Clock: 25.175 MHz
  640x480@72Hz 4:3 HorFreq: 37900 Hz Clock: 31.500 MHz
  640x480@75Hz 4:3 HorFreq: 37500 Hz Clock: 31.500 MHz
  800x600@56Hz 4:3 HorFreq: 35200 Hz Clock: 36.000 MHz
  800x600@60Hz 4:3 HorFreq: 37900 Hz Clock: 40.000 MHz
  800x600@72Hz 4:3 HorFreq: 48100 Hz Clock: 50.000 MHz
  800x600@75Hz 4:3 HorFreq: 46900 Hz Clock: 49.500 MHz
  1024x768@60Hz 4:3 HorFreq: 48400 Hz Clock: 65.000 MHz
  1024x768@70Hz 4:3 HorFreq: 56500 Hz Clock: 75.000 MHz
  1024x768@75Hz 4:3 HorFreq: 60000 Hz Clock: 78.750 MHz
  1280x1024@75Hz 5:4 HorFreq: 80000 Hz Clock: 135.000 MHz
Standard timings supported:
  1280x1024@60Hz 5:4 HorFreq: 64000 Hz Clock: 108.000 MHz
  1440x900@60Hz 16:10 HorFreq: 55500 Hz Clock: 88.750 MHz
  1440x900@75Hz 16:10 HorFreq: 82300 Hz Clock: 156.000 MHz
  1440x900@70Hz 16:10
  1440x900@72Hz 16:10
Detailed mode: Clock 136.750 MHz, 410 mm x 256 mm
               1440 1536 1688 1936 hborder 0
                900  903  909  942 vborder 0
               +hsync -vsync 
               VertFreq: 74 Hz, HorFreq: 70635 Hz
Detailed mode: Clock 106.500 MHz, 410 mm x 256 mm
               1440 1520 1672 1904 hborder 0
                900  903  909  934 vborder 0
               -hsync +vsync 
               VertFreq: 59 Hz, HorFreq: 55934 Hz
Monitor ranges (GTF): 56-75Hz V, 30-81kHz H, max dotclock 140MHz
Monitor name: LED MONITOR
Checksum: 0xb (valid)
One or more of the timings is out of range of the Monitor Ranges:
  Vertical Freq: 56 - 75 Hz
  Horizontal Freq: 31469 - 82300 Hz
  Maximum Clock: 156.000 MHz
