edid-decode (hex):

00 ff ff ff ff ff ff 00 09 d1 1d 77 45 54 00 00
03 12 01 03 0c 21 15 78 2a 18 a5 97 58 50 8e 27
27 50 54 af ce 00 01 01 01 01 01 01 01 01 01 01
01 01 01 01 01 01 9e 20 00 90 51 20 1f 30 48 80
36 00 4b cf 10 00 00 1c 00 00 00 ff 00 37 31 38
30 33 35 36 30 53 4c 30 0a 20 00 00 00 fd 00 38
4c 1f 3f 0e 00 0a 20 20 20 20 20 20 00 00 00 fc
00 42 65 6e 51 20 54 35 31 57 0a 0a 0a 0a 00 9f

00 ff ff ff ff ff ff 00 09 d1 1d 77 45 54 00 00
03 12 01 03 0c 21 15 78 2a 18 a5 97 58 50 8e 27
27 50 54 af ce 00 01 01 01 01 01 01 01 01 01 01
01 01 01 01 01 01 9e 20 00 90 51 20 1f 30 48 80
36 00 4b cf 10 00 00 1c 00 00 00 ff 00 37 31 38
30 33 35 36 30 53 4c 30 0a 20 00 00 00 fd 00 38
4c 1f 3f 0e 00 0a 20 20 20 20 20 20 00 00 00 fc
00 42 65 6e 51 20 54 35 31 57 0a 0a 0a 0a 00 9f

----------------

Block 0, Base EDID:
  EDID Structure Version & Revision: 1.3
  Vendor & Product Identification:
    Manufacturer: BNQ
    Model: 30493
    Serial Number: ...
    Made in: week 3 of 2008
  Basic Display Parameters & Features:
    Analog display
    Signal Level Standard: 0.700 : 0.300 : 1.000 V p-p
    Blank level equals black level
    Sync: Separate Composite
    Maximum image size: 33 cm x 21 cm
    Gamma: 2.20
    DPMS levels: Off
    RGB color display
    First detailed timing is the preferred timing
  Color Characteristics:
    Red  : 0.5898, 0.3447
    Green: 0.3144, 0.5546
    Blue : 0.1542, 0.1542
    White: 0.3134, 0.3291
  Established Timings I & II:
    IBM     :   720x400    70.081663 Hz   9:5     31.467 kHz     28.320000 MHz
    DMT 0x04:   640x480    59.940476 Hz   4:3     31.469 kHz     25.175000 MHz
    DMT 0x05:   640x480    72.808802 Hz   4:3     37.861 kHz     31.500000 MHz
    DMT 0x06:   640x480    75.000000 Hz   4:3     37.500 kHz     31.500000 MHz
    DMT 0x08:   800x600    56.250000 Hz   4:3     35.156 kHz     36.000000 MHz
    DMT 0x09:   800x600    60.316541 Hz   4:3     37.879 kHz     40.000000 MHz
    DMT 0x0a:   800x600    72.187572 Hz   4:3     48.077 kHz     50.000000 MHz
    DMT 0x0b:   800x600    75.000000 Hz   4:3     46.875 kHz     49.500000 MHz
    DMT 0x10:  1024x768    60.003840 Hz   4:3     48.363 kHz     65.000000 MHz
    DMT 0x11:  1024x768    70.069359 Hz   4:3     56.476 kHz     75.000000 MHz
    DMT 0x12:  1024x768    75.028582 Hz   4:3     60.023 kHz     78.750000 MHz
  Standard Timings: none
  Detailed Timing Descriptors:
    DTD 1:  1280x800    59.810326 Hz  16:10    49.702 kHz     83.500000 MHz (331 mm x 207 mm)
                 Hfront   72 Hsync 128 Hback  200 Hpol N
                 Vfront    3 Vsync   6 Vback   22 Vpol P
    Display Product Serial Number: ...
    Display Range Limits:
      Monitor ranges (GTF): 56-76 Hz V, 31-63 kHz H, max dotclock 140 MHz
    Display Product Name: 'BenQ T51W'
Checksum: 0x9f

----------------

Block 1, Unknown EDID Extension Block 0x00:
  00 ff ff ff ff ff ff 00 09 d1 1d 77 45 54 00 00 '...........wET..'
  03 12 01 03 0c 21 15 78 2a 18 a5 97 58 50 8e 27 '.....!.x*...XP.''
  27 50 54 af ce 00 01 01 01 01 01 01 01 01 01 01 ''PT.............'
  01 01 01 01 01 01 9e 20 00 90 51 20 1f 30 48 80 '....... ..Q .0H.'
  36 00 4b cf 10 00 00 1c 00 00 00 ff 00 37 31 38 '6.K..........718'
  30 33 35 36 30 53 4c 30 0a 20 00 00 00 fd 00 38 '03560SL0. .....8'
  4c 1f 3f 0e 00 0a 20 20 20 20 20 20 00 00 00 fc 'L.?...      ....'
  00 42 65 6e 51 20 54 35 31 57 0a 0a 0a 0a 00 9f '.BenQ T51W......'
Checksum: 0x9f

----------------

Failures:

Block 0, Base EDID:
  Display Product Name: Non-space after newline.
Block 1, Base EDID:
  Unknown Extension Block.
EDID:
  Base EDID: EDID specified 0 extension block(s), but found 1 extension block(s).

EDID conformity: FAIL
