edid-decode (hex):

00 ff ff ff ff ff ff 00 06 af ee 11 00 00 00 00
00 12 01 04 90 22 13 78 02 e4 e5 a0 59 57 92 26
0d 50 54 00 00 00 01 01 01 01 01 01 01 01 01 01
01 01 01 01 01 01 64 32 40 96 62 84 32 30 40 2a
a4 00 58 c1 10 00 00 18 98 21 40 96 62 84 32 30
40 2a a4 00 58 c1 10 00 00 18 00 00 00 00 00 00
00 00 00 00 00 00 00 00 00 00 00 00 00 00 00 02
00 0c 49 f9 0a 3c 66 1b 2a 39 66 20 20 20 00 01

----------------

Block 0, Base EDID:
  EDID Structure Version & Revision: 1.4
  Vendor & Product Identification:
    Manufacturer: AUO
    Model: 4590
    Made in: 2008
  Basic Display Parameters & Features:
    Digital display
    Bits per primary color channel: 6
    Digital interface is not defined
    Maximum image size: 34 cm x 19 cm
    Gamma: 2.20
    Supported color formats: RGB 4:4:4
    First detailed timing includes the native pixel format and preferred refresh rate
  Color Characteristics:
    Red  : 0.6279, 0.3496
    Green: 0.3408, 0.5703
    Blue : 0.1513, 0.0527
    White: 0.3134, 0.3291
  Established Timings I & II: none
  Standard Timings: none
  Detailed Timing Descriptors:
    DTD 1:  1600x900    60.030713 Hz  16:9     57.029 kHz    129.000000 MHz (344 mm x 193 mm)
                 Hfront   64 Hsync  42 Hback  556 Hpol N
                 Vfront   10 Vsync   4 Vback   36 Vpol N
    DTD 2:  1600x900    40.020476 Hz  16:9     38.019 kHz     86.000000 MHz (344 mm x 193 mm)
                 Hfront   64 Hsync  42 Hback  556 Hpol N
                 Vfront   10 Vsync   4 Vback   36 Vpol N
    Empty Descriptor
    Manufacturer-Specified Display Descriptor (0x02): 00 02 00 0c 49 f9 0a 3c 66 1b 2a 39 66 20 20 20 '....I..<f.*9f   '
Checksum: 0x01

----------------

Warnings:

Block 0, Base EDID:
  Missing Display Product Name.

Failures:

Block 0, Base EDID:
  Empty Descriptor: Use Dummy Descriptor instead of all zeroes.

EDID conformity: FAIL
