edid-decode (hex):

00 ff ff ff ff ff ff 00 19 c9 00 00 00 00 00 00
00 14 01 03 80 00 00 78 0a 2f cd a3 54 45 97 24
11 46 47 21 08 00 01 01 01 01 01 01 01 01 01 01
01 01 01 01 01 01 02 3a 80 18 71 38 2d 40 58 2c
45 00 10 09 00 00 00 1e 8c 0a d0 8a 20 e0 2d 10
10 3e 96 00 10 09 00 00 00 18 00 00 00 fc 00 4c
43 44 20 54 56 0a 20 20 20 20 20 20 00 00 00 fd
00 17 3f 0f 45 0f 00 0a 20 20 20 20 20 20 01 30

02 03 27 70 4a 10 03 20 04 02 05 06 07 22 01 26
09 07 07 15 07 50 83 01 00 00 6c 03 0c 00 30 00
00 1e c0 16 16 26 26 01 1d 80 3e 73 38 2d 40 7e
2c 45 80 10 09 00 00 00 1e 01 1d 00 72 51 d0 1e
20 6e 28 55 00 10 09 00 00 00 1e 66 21 50 b0 51
00 1b 30 40 70 36 00 10 09 00 00 00 1e a9 1a 00
a0 50 00 16 30 30 20 37 00 05 03 00 00 00 1a 00
00 00 00 00 00 00 00 00 00 00 00 00 00 00 00 f1

00 ff ff ff ff ff ff 00 19 c9 00 00 00 00 00 00
00 14 01 03 80 00 00 78 0a 2f cd a3 54 45 97 24
11 46 47 21 08 00 01 01 01 01 01 01 01 01 01 01
01 01 01 01 01 01 02 3a 80 18 71 38 2d 40 58 2c
45 00 10 09 00 00 00 1e 8c 0a d0 8a 20 e0 2d 10
10 3e 96 00 10 09 00 00 00 18 00 00 00 fc 00 4c
43 44 20 54 56 0a 20 20 20 20 20 20 00 00 00 fd
00 17 3f 0f 45 0f 00 0a 20 20 20 20 20 20 01 30

02 03 27 70 4a 10 03 20 04 02 05 06 07 22 01 26
09 07 07 15 07 50 83 01 00 00 6c 03 0c 00 30 00
00 1e c0 16 16 26 26 01 1d 80 3e 73 38 2d 40 7e
2c 45 80 10 09 00 00 00 1e 01 1d 00 72 51 d0 1e
20 6e 28 55 00 10 09 00 00 00 1e 66 21 50 b0 51
00 1b 30 40 70 36 00 10 09 00 00 00 1e a9 1a 00
a0 50 00 16 30 30 20 37 00 05 03 00 00 00 1a 00
00 00 00 00 00 00 00 00 00 00 00 00 00 00 00 f1

----------------

Block 0, Base EDID:
  EDID Structure Version & Revision: 1.3
  Vendor & Product Identification:
    Manufacturer: FNI
    Model: 0
    Made in: 2010
  Basic Display Parameters & Features:
    Digital display
    Image size is variable
    Gamma: 2.20
    RGB color display
    First detailed timing is the preferred timing
  Color Characteristics:
    Red  : 0.6367, 0.3300
    Green: 0.2724, 0.5927
    Blue : 0.1435, 0.0664
    White: 0.2763, 0.2783
  Established Timings I & II:
    DMT 0x04:   640x480    59.940476 Hz   4:3     31.469 kHz     25.175000 MHz
    DMT 0x09:   800x600    60.316541 Hz   4:3     37.879 kHz     40.000000 MHz
    DMT 0x10:  1024x768    60.003840 Hz   4:3     48.363 kHz     65.000000 MHz
  Standard Timings: none
  Detailed Timing Descriptors:
    DTD  1:  1920x1080   60.000000 Hz  16:9     67.500 kHz    148.500000 MHz (16 mm x 9 mm)
                  Hfront   88 Hsync  44 Hback  148 Hpol P
                  Vfront    4 Vsync   5 Vback   36 Vpol P
    DTD  2:   720x480    59.940060 Hz   3:2     31.469 kHz     27.000000 MHz (16 mm x 9 mm)
                  Hfront   16 Hsync  62 Hback   60 Hpol N
                  Vfront    9 Vsync   6 Vback   30 Vpol N
    Display Product Name: 'LCD TV'
    Display Range Limits:
      Monitor ranges (GTF): 23-63 Hz V, 15-69 kHz H, max dotclock 150 MHz
  Extension blocks: 1
Checksum: 0x30

----------------

Block 1, CTA-861 Extension Block:
  Revision: 3
  Basic audio support
  Supports YCbCr 4:4:4
  Supports YCbCr 4:2:2
  Native detailed modes: 0
  Video Data Block:
    VIC  16:  1920x1080   60.000000 Hz  16:9     67.500 kHz    148.500000 MHz
    VIC   3:   720x480    59.940060 Hz  16:9     31.469 kHz     27.000000 MHz
    VIC  32:  1920x1080   24.000000 Hz  16:9     27.000 kHz     74.250000 MHz
    VIC   4:  1280x720    60.000000 Hz  16:9     45.000 kHz     74.250000 MHz
    VIC   2:   720x480    59.940060 Hz   4:3     31.469 kHz     27.000000 MHz
    VIC   5:  1920x1080i  60.000000 Hz  16:9     33.750 kHz     74.250000 MHz
    VIC   6:  1440x480i   59.940060 Hz   4:3     15.734 kHz     27.000000 MHz
    VIC   7:  1440x480i   59.940060 Hz  16:9     15.734 kHz     27.000000 MHz
    VIC  34:  1920x1080   30.000000 Hz  16:9     33.750 kHz     74.250000 MHz
    VIC   1:   640x480    59.940476 Hz   4:3     31.469 kHz     25.175000 MHz
  Audio Data Block:
    Linear PCM:
      Max channels: 2
      Supported sample rates (kHz): 48 44.1 32
      Supported sample sizes (bits): 24 20 16
    AC-3:
      Max channels: 6
      Supported sample rates (kHz): 48 44.1 32
      Maximum bit rate: 640 kb/s
  Speaker Allocation Data Block:
    FL/FR - Front Left/Right
  Vendor-Specific Data Block (HDMI), OUI 00-0C-03:
    Source physical address: 3.0.0.0
    Maximum TMDS clock: 150 MHz
    Video latency: 42 ms
    Audio latency: 42 ms
    Interlaced video latency: 74 ms
    Interlaced audio latency: 74 ms
  Detailed Timing Descriptors:
    DTD  3:  1920x1080   24.000000 Hz  16:9     27.000 kHz     74.250000 MHz (16 mm x 9 mm)
                  Hfront  638 Hsync  44 Hback  148 Hpol P
                  Vfront    4 Vsync   5 Vback   36 Vpol P
    DTD  4:  1280x720    60.000000 Hz  16:9     45.000 kHz     74.250000 MHz (16 mm x 9 mm)
                  Hfront  110 Hsync  40 Hback  220 Hpol P
                  Vfront    5 Vsync   5 Vback   20 Vpol P
    DTD  5:  1360x768    60.015162 Hz  85:48    47.712 kHz     85.500000 MHz (16 mm x 9 mm)
                  Hfront   64 Hsync 112 Hback  256 Hpol P
                  Vfront    3 Vsync   6 Vback   18 Vpol P
    DTD  6:  1280x768    59.994726 Hz   5:3     47.396 kHz     68.250000 MHz (5 mm x 3 mm)
                  Hfront   48 Hsync  32 Hback   80 Hpol P
                  Vfront    3 Vsync   7 Vback   12 Vpol N
Checksum: 0xf1  Unused space in Extension Block: 16 bytes

----------------

Block 2, Unknown EDID Extension Block 0x00:
  00 ff ff ff ff ff ff 00 19 c9 00 00 00 00 00 00 '................'
  00 14 01 03 80 00 00 78 0a 2f cd a3 54 45 97 24 '.......x./..TE.$'
  11 46 47 21 08 00 01 01 01 01 01 01 01 01 01 01 '.FG!............'
  01 01 01 01 01 01 02 3a 80 18 71 38 2d 40 58 2c '.......:..q8-@X,'
  45 00 10 09 00 00 00 1e 8c 0a d0 8a 20 e0 2d 10 'E........... .-.'
  10 3e 96 00 10 09 00 00 00 18 00 00 00 fc 00 4c '.>.............L'
  43 44 20 54 56 0a 20 20 20 20 20 20 00 00 00 fd 'CD TV.      ....'
  00 17 3f 0f 45 0f 00 0a 20 20 20 20 20 20 01 30 '..?.E...      .0'
Checksum: 0x30

----------------

Block 3, CTA-861 Extension Block:
  Revision: 3
  Basic audio support
  Supports YCbCr 4:4:4
  Supports YCbCr 4:2:2
  Native detailed modes: 0
  Video Data Block:
    VIC  16:  1920x1080   60.000000 Hz  16:9     67.500 kHz    148.500000 MHz
    VIC   3:   720x480    59.940060 Hz  16:9     31.469 kHz     27.000000 MHz
    VIC  32:  1920x1080   24.000000 Hz  16:9     27.000 kHz     74.250000 MHz
    VIC   4:  1280x720    60.000000 Hz  16:9     45.000 kHz     74.250000 MHz
    VIC   2:   720x480    59.940060 Hz   4:3     31.469 kHz     27.000000 MHz
    VIC   5:  1920x1080i  60.000000 Hz  16:9     33.750 kHz     74.250000 MHz
    VIC   6:  1440x480i   59.940060 Hz   4:3     15.734 kHz     27.000000 MHz
    VIC   7:  1440x480i   59.940060 Hz  16:9     15.734 kHz     27.000000 MHz
    VIC  34:  1920x1080   30.000000 Hz  16:9     33.750 kHz     74.250000 MHz
    VIC   1:   640x480    59.940476 Hz   4:3     31.469 kHz     25.175000 MHz
  Audio Data Block:
    Linear PCM:
      Max channels: 2
      Supported sample rates (kHz): 48 44.1 32
      Supported sample sizes (bits): 24 20 16
    AC-3:
      Max channels: 6
      Supported sample rates (kHz): 48 44.1 32
      Maximum bit rate: 640 kb/s
  Speaker Allocation Data Block:
    FL/FR - Front Left/Right
  Vendor-Specific Data Block (HDMI), OUI 00-0C-03:
    Source physical address: 3.0.0.0
    Maximum TMDS clock: 150 MHz
    Video latency: 42 ms
    Audio latency: 42 ms
    Interlaced video latency: 74 ms
    Interlaced audio latency: 74 ms
  Detailed Timing Descriptors:
    DTD  7:  1920x1080   24.000000 Hz  16:9     27.000 kHz     74.250000 MHz (16 mm x 9 mm)
                  Hfront  638 Hsync  44 Hback  148 Hpol P
                  Vfront    4 Vsync   5 Vback   36 Vpol P
    DTD  8:  1280x720    60.000000 Hz  16:9     45.000 kHz     74.250000 MHz (16 mm x 9 mm)
                  Hfront  110 Hsync  40 Hback  220 Hpol P
                  Vfront    5 Vsync   5 Vback   20 Vpol P
    DTD  9:  1360x768    60.015162 Hz  85:48    47.712 kHz     85.500000 MHz (16 mm x 9 mm)
                  Hfront   64 Hsync 112 Hback  256 Hpol P
                  Vfront    3 Vsync   6 Vback   18 Vpol P
    DTD 10:  1280x768    59.994726 Hz   5:3     47.396 kHz     68.250000 MHz (5 mm x 3 mm)
                  Hfront   48 Hsync  32 Hback   80 Hpol P
                  Vfront    3 Vsync   7 Vback   12 Vpol N
Checksum: 0xf1  Unused space in Extension Block: 16 bytes

----------------

Warnings:

Block 1, CTA-861 Extension Block:
  IT Video Formats are overscanned by default, but normally this should be underscanned.
  Video Data Block: For improved preferred timing interoperability, set 'Native detailed modes' to 1.
  Add a Colorimetry Data Block with the sRGB colorimetry bit set to avoid interop issues.
Block 3, CTA-861 Extension Block:
  IT Video Formats are overscanned by default, but normally this should be underscanned.
  Add a Colorimetry Data Block with the sRGB colorimetry bit set to avoid interop issues.

Failures:

Block 1, CTA-861 Extension Block:
  Missing VCDB, needed for Set Selectable RGB Quantization to avoid interop issues.
Block 2, Base EDID:
  Unknown Extension Block.
Block 3, CTA-861 Extension Block:
  Video Data Block: Duplicate VIC 16.
  Video Data Block: Duplicate VIC 3.
  Video Data Block: Duplicate VIC 32.
  Video Data Block: Duplicate VIC 4.
  Video Data Block: Duplicate VIC 2.
  Video Data Block: Duplicate VIC 5.
  Video Data Block: Duplicate VIC 6.
  Video Data Block: Duplicate VIC 7.
  Video Data Block: Duplicate VIC 34.
  Video Data Block: Duplicate VIC 1.
  Speaker Allocation Data Block: Only one instance of this Data Block is allowed.
  Missing VCDB, needed for Set Selectable RGB Quantization to avoid interop issues.
EDID:
  Base EDID: The DTD max image size is 16x9mm, but the display size is not specified anywhere.
  Base EDID: EDID specified 1 extension block(s), but found 3 extension block(s).
  Base EDID: EDID 1.3 requires a Block Map Extension in Block 1 if there are more than 2 blocks in the EDID.

EDID conformity: FAIL
