
EDID (hex):
00ffffffffffff0006af522000000000
01130103801a0e780a2b659757559629
21505400000001010101010101010101
0101010101014b14004c415826203020
36000090100000180000000f00000000
00000000000000000020000000fe0041
554f0a202020202020202020000000fe
004231313641573032205630200a0090

Extracted contents:
header:          00 ff ff ff ff ff ff 00
serial number:   06 af 52 20 00 00 00 00 01 13
version:         01 03
basic params:    80 1a 0e 78 0a
chroma info:     2b 65 97 57 55 96 29 21 50 54
established:     00 00 00
standard:        01 01 01 01 01 01 01 01 01 01 01 01 01 01 01 01
descriptor 1:    4b 14 00 4c 41 58 26 20 30 20 36 00 00 90 10 00 00 18
descriptor 2:    00 00 00 0f 00 00 00 00 00 00 00 00 00 00 00 00 00 20
descriptor 3:    00 00 00 fe 00 41 55 4f 0a 20 20 20 20 20 20 20 20 20
descriptor 4:    00 00 00 fe 00 42 31 31 36 41 57 30 32 20 56 30 20 0a
extensions:      00
checksum:        90

EDID version: 1.3
Manufacturer: AUO Model 2052 Serial Number --
Made in week 1 of 2009
Digital display
Maximum image size: 26 cm x 14 cm
Gamma: 2.20
RGB color display
First detailed timing is preferred timing
Display x,y Chromaticity:
  Red:   0.5898, 0.3417
  Green: 0.3339, 0.5888
  Blue:  0.1611, 0.1308
  White: 0.3134, 0.3291
Established timings supported:
Standard timings supported:
Detailed mode: Clock 51.950 MHz, 256 mm x 144 mm
               1024 1072 1104 1356 hborder 0
                600  603  609  638 vborder 0
               -hsync -vsync 
               VertFreq: 60 Hz, HorFreq: 38311 Hz
Manufacturer-specified data, tag 15
ASCII string: AUO
ASCII string: B116AW02 V0 
Checksum: 0x90 (valid)
EDID block does NOT conform to EDID 1.3!
	Missing name descriptor
	Missing monitor ranges
