edid-decode (hex):

00 ff ff ff ff ff ff 00 05 e3 30 23 76 0a 00 00
26 13 01 03 80 2f 1a 78 2a 35 85 a6 56 48 9a 24
12 50 54 bf ef 00 61 4c 81 80 81 8a 81 8c 95 00
81 40 71 4f b3 00 02 3a 80 18 71 38 2d 40 58 2c
45 00 dc 0c 11 00 00 1e 00 00 00 fd 00 38 4b 18
50 11 00 0a 20 20 20 20 20 20 00 00 00 fc 00 32
33 33 30 56 0a 20 20 20 20 20 20 20 00 00 00 ff
00 52 34 32 39 39 4a 41 30 30 32 36 37 38 00 78

00 ff ff ff ff ff ff 00 05 e3 30 23 76 0a 00 00
26 13 01 03 80 2f 1a 78 2a 35 85 a6 56 48 9a 24
12 50 54 bf ef 00 61 4c 81 80 81 8a 81 8c 95 00
81 40 71 4f b3 00 02 3a 80 18 71 38 2d 40 58 2c
45 00 dc 0c 11 00 00 1e 00 00 00 fd 00 38 4b 18
50 11 00 0a 20 20 20 20 20 20 00 00 00 fc 00 32
33 33 30 56 0a 20 20 20 20 20 20 20 00 00 00 ff
00 52 34 32 39 39 4a 41 30 30 32 36 37 38 00 78

----------------

Block 0, Base EDID:
  EDID Structure Version & Revision: 1.3
  Vendor & Product Identification:
    Manufacturer: AOC
    Model: 9008
    Serial Number: ...
    Made in: week 38 of 2009
  Basic Display Parameters & Features:
    Digital display
    Maximum image size: 47 cm x 26 cm
    Gamma: 2.20
    DPMS levels: Off
    RGB color display
    First detailed timing is the preferred timing
  Color Characteristics:
    Red  : 0.6484, 0.3388
    Green: 0.2822, 0.6025
    Blue : 0.1425, 0.0703
    White: 0.3134, 0.3291
  Established Timings I & II:
    IBM     :   720x400    70.081663 Hz   9:5     31.467 kHz     28.320000 MHz
    DMT 0x04:   640x480    59.940476 Hz   4:3     31.469 kHz     25.175000 MHz
    Apple   :   640x480    66.666667 Hz   4:3     35.000 kHz     30.240000 MHz
    DMT 0x05:   640x480    72.808802 Hz   4:3     37.861 kHz     31.500000 MHz
    DMT 0x06:   640x480    75.000000 Hz   4:3     37.500 kHz     31.500000 MHz
    DMT 0x08:   800x600    56.250000 Hz   4:3     35.156 kHz     36.000000 MHz
    DMT 0x09:   800x600    60.316541 Hz   4:3     37.879 kHz     40.000000 MHz
    DMT 0x0a:   800x600    72.187572 Hz   4:3     48.077 kHz     50.000000 MHz
    DMT 0x0b:   800x600    75.000000 Hz   4:3     46.875 kHz     49.500000 MHz
    Apple   :   832x624    74.551266 Hz   4:3     49.726 kHz     57.284000 MHz
    DMT 0x10:  1024x768    60.003840 Hz   4:3     48.363 kHz     65.000000 MHz
    DMT 0x11:  1024x768    70.069359 Hz   4:3     56.476 kHz     75.000000 MHz
    DMT 0x12:  1024x768    75.028582 Hz   4:3     60.023 kHz     78.750000 MHz
    DMT 0x24:  1280x1024   75.024675 Hz   5:4     79.976 kHz    135.000000 MHz
  Standard Timings:
    DMT 0x11:  1024x768    70.069359 Hz   4:3     56.476 kHz     75.000000 MHz
    DMT 0x23:  1280x1024   60.019740 Hz   5:4     63.981 kHz    108.000000 MHz
    GTF     :  1280x1024   69.999805 Hz   5:4     74.620 kHz    128.943000 MHz
    GTF     :  1280x1024   72.000069 Hz   5:4     76.824 kHz    132.752000 MHz
    DMT 0x2f:  1440x900    59.887445 Hz  16:10    55.935 kHz    106.500000 MHz
    DMT 0x20:  1280x960    60.000000 Hz   4:3     60.000 kHz    108.000000 MHz
    DMT 0x15:  1152x864    75.000000 Hz   4:3     67.500 kHz    108.000000 MHz
    DMT 0x3a:  1680x1050   59.954250 Hz  16:10    65.290 kHz    146.250000 MHz
  Detailed Timing Descriptors:
    DTD 1:  1920x1080   60.000000 Hz  16:9     67.500 kHz    148.500000 MHz (476 mm x 268 mm)
                 Hfront   88 Hsync  44 Hback  148 Hpol P
                 Vfront    4 Vsync   5 Vback   36 Vpol P
    Display Range Limits:
      Monitor ranges (GTF): 56-75 Hz V, 24-80 kHz H, max dotclock 170 MHz
    Display Product Name: '2330V'
    Display Product Serial Number: ...
Checksum: 0x78

----------------

Block 1, Unknown EDID Extension Block 0x00:
  00 ff ff ff ff ff ff 00 05 e3 30 23 76 0a 00 00 '..........0#v...'
  26 13 01 03 80 2f 1a 78 2a 35 85 a6 56 48 9a 24 '&..../.x*5..VH.$'
  12 50 54 bf ef 00 61 4c 81 80 81 8a 81 8c 95 00 '.PT...aL........'
  81 40 71 4f b3 00 02 3a 80 18 71 38 2d 40 58 2c '.@qO...:..q8-@X,'
  45 00 dc 0c 11 00 00 1e 00 00 00 fd 00 38 4b 18 'E............8K.'
  50 11 00 0a 20 20 20 20 20 20 00 00 00 fc 00 32 'P...      .....2'
  33 33 30 56 0a 20 20 20 20 20 20 20 00 00 00 ff '330V.       ....'
  00 52 34 32 39 39 4a 41 30 30 32 36 37 38 00 78 '.R4299JA002678.x'
Checksum: 0x78

----------------

Failures:

Block 1, Base EDID:
  Unknown Extension Block.
EDID:
  Base EDID: EDID specified 0 extension block(s), but found 1 extension block(s).

EDID conformity: FAIL
