edid-decode (hex):

00 ff ff ff ff ff ff 00 06 af ec 22 00 00 00 00
01 13 01 03 80 22 13 78 0a c8 95 9e 57 54 92 26
0f 50 54 00 00 00 01 01 01 01 01 01 01 01 01 01
01 01 01 01 01 01 12 1b 56 42 50 00 26 30 20 18
34 00 58 c1 10 00 00 18 00 00 00 0f 00 00 00 00
00 00 00 00 00 00 00 00 00 20 00 00 00 fe 00 41
55 4f 0a 20 20 20 20 20 20 20 20 20 00 00 00 fe
00 42 31 35 36 58 57 30 32 20 56 32 20 0a 00 c0

----------------

Block 0, Base EDID:
  EDID Structure Version & Revision: 1.3
  Vendor & Product Identification:
    Manufacturer: AUO
    Model: 8940
    Made in: week 1 of 2009
  Basic Display Parameters & Features:
    Digital display
    Maximum image size: 34 cm x 19 cm
    Gamma: 2.20
    RGB color display
    First detailed timing is preferred timing
  Color Characteristics:
    Red  : 0.6201, 0.3398
    Green: 0.3300, 0.5703
    Blue : 0.1503, 0.0595
    White: 0.3134, 0.3291
  Established Timings I & II: none
  Standard Timings: none
  Detailed Timing Descriptors:
    DTD 1:  1366x768    60.042 Hz 683:384  48.394 kHz  69.300 MHz (344 mm x 193 mm)
                 Hfront   32 Hsync  24 Hback  10 Hpol N
                 Vfront    3 Vsync   4 Vback  31 Vpol N
    Manufacturer-Specified Display Descriptor (0x0f): 00 0f 00 00 00 00 00 00 00 00 00 00 00 00 00 20 '............... '
    Alphanumeric Data String: 'AUO'
    Alphanumeric Data String: 'B156XW02 V2 '
Checksum: 0xc0
