edid-decode (hex):

00 ff ff ff ff ff ff 00 06 af ec 22 00 00 00 00
0f 15 01 04 90 22 13 78 02 c8 95 9e 57 54 92 26
0f 50 54 00 00 00 01 01 01 01 01 01 01 01 01 01
01 01 01 01 01 01 ce 1d 56 e2 50 00 1e 30 26 16
36 00 58 c1 10 00 00 18 df 13 56 e2 50 00 1e 30
26 16 36 00 58 c1 10 00 00 18 00 00 00 00 00 00
00 00 00 00 00 00 00 00 00 00 00 00 00 00 00 02
00 0c 3f ff 0a 3c 64 11 19 2f 6e 20 20 20 00 ae

----------------

Block 0, Base EDID:
  EDID Structure Version & Revision: 1.4
  Vendor & Product Identification:
    Manufacturer: AUO
    Model: 8940
    Made in: week 15 of 2011
  Basic Display Parameters & Features:
    Digital display
    Bits per primary color channel: 6
    Digital interface is not defined
    Maximum image size: 34 cm x 19 cm
    Gamma: 2.20
    Supported color formats: RGB 4:4:4
    First detailed timing includes the native pixel format and preferred refresh rate
  Color Characteristics:
    Red  : 0.6201, 0.3398
    Green: 0.3300, 0.5703
    Blue : 0.1503, 0.0595
    White: 0.3134, 0.3291
  Established Timings I & II: none
  Standard Timings: none
  Detailed Timing Descriptors:
    DTD 1:  1366x768    60.059067 Hz 683:384   47.927 kHz     76.300000 MHz (344 mm x 193 mm)
                 Hfront   38 Hsync  22 Hback  166 Hpol N
                 Vfront    3 Vsync   6 Vback   21 Vpol N
    DTD 2:  1366x768    40.042002 Hz 683:384   31.954 kHz     50.870000 MHz (344 mm x 193 mm)
                 Hfront   38 Hsync  22 Hback  166 Hpol N
                 Vfront    3 Vsync   6 Vback   21 Vpol N
    Empty Descriptor
    Manufacturer-Specified Display Descriptor (0x02): 00 02 00 0c 3f ff 0a 3c 64 11 19 2f 6e 20 20 20 '....?..<d../n   '
Checksum: 0xae

----------------

Warnings:

Block 0, Base EDID:
  Missing Display Product Name.

Failures:

Block 0, Base EDID:
  Empty Descriptor: Use Dummy Descriptor instead of all zeroes.

EDID conformity: FAIL
