
EDID (hex):
00ffffffffffff0005e30224770b0000
1b1e010368351e782afb55a355509d26
0e5054bfef00d1c0b300950081808140
81c001010101023a801871382d40582c
45000f282100001e000000ff0041544f
4c373141303032393335000000fc0032
344732573147350a20202020000000fd
00304b1e5512000a20202020202000dd

Extracted contents:
header:          00 ff ff ff ff ff ff 00
serial number:   05 e3 02 24 77 0b 00 00 1b 1e
version:         01 03
basic params:    68 35 1e 78 2a
chroma info:     fb 55 a3 55 50 9d 26 0e 50 54
established:     bf ef 00
standard:        d1 c0 b3 00 95 00 81 80 81 40 81 c0 01 01 01 01
descriptor 1:    02 3a 80 18 71 38 2d 40 58 2c 45 00 0f 28 21 00 00 1e
descriptor 2:    00 00 00 ff 00 41 54 4f 4c 37 31 41 30 30 32 39 33 35
descriptor 3:    00 00 00 fc 00 32 34 47 32 57 31 47 35 0a 20 20 20 20
descriptor 4:    00 00 00 fd 00 30 4b 1e 55 12 00 0a 20 20 20 20 20 20
extensions:      00
checksum:        dd

EDID version: 1.3
Manufacturer: AOC Model 2402 Serial Number --
Made in week 27 of 2020
Analog display, Input voltage level: 0.7/0.7 V
Sync: Separate 
Maximum image size: 53 cm x 30 cm
Gamma: 2.20
DPMS levels: Off
RGB color display
First detailed timing is preferred timing
Display x,y Chromaticity:
  Red:   0.6396, 0.3349
  Green: 0.3144, 0.6162
  Blue:  0.1494, 0.0556
  White: 0.3134, 0.3291
Established timings supported:
  720x400@70Hz 9:5 HorFreq: 31469 Hz Clock: 28.320 MHz
  640x480@60Hz 4:3 HorFreq: 31469 Hz Clock: 25.175 MHz
  640x480@67Hz 4:3 HorFreq: 35000 Hz Clock: 30.240 MHz
  640x480@72Hz 4:3 HorFreq: 37900 Hz Clock: 31.500 MHz
  640x480@75Hz 4:3 HorFreq: 37500 Hz Clock: 31.500 MHz
  800x600@56Hz 4:3 HorFreq: 35200 Hz Clock: 36.000 MHz
  800x600@60Hz 4:3 HorFreq: 37900 Hz Clock: 40.000 MHz
  800x600@72Hz 4:3 HorFreq: 48100 Hz Clock: 50.000 MHz
  800x600@75Hz 4:3 HorFreq: 46900 Hz Clock: 49.500 MHz
  832x624@75Hz 4:3 HorFreq: 49726 Hz Clock: 57.284 MHz
  1024x768@60Hz 4:3 HorFreq: 48400 Hz Clock: 65.000 MHz
  1024x768@70Hz 4:3 HorFreq: 56500 Hz Clock: 75.000 MHz
  1024x768@75Hz 4:3 HorFreq: 60000 Hz Clock: 78.750 MHz
  1280x1024@75Hz 5:4 HorFreq: 80000 Hz Clock: 135.000 MHz
Standard timings supported:
  1920x1080@60Hz 16:9
  1680x1050@60Hz 16:10 HorFreq: 64700 Hz Clock: 119.000 MHz
  1440x900@60Hz 16:10 HorFreq: 55500 Hz Clock: 88.750 MHz
  1280x1024@60Hz 5:4 HorFreq: 64000 Hz Clock: 108.000 MHz
  1280x960@60Hz 4:3 HorFreq: 60000 Hz Clock: 108.000 MHz
  1280x720@60Hz 16:9
Detailed mode: Clock 148.500 MHz, 527 mm x 296 mm
               1920 2008 2052 2200 hborder 0
               1080 1084 1089 1125 vborder 0
               +hsync +vsync 
               VertFreq: 60 Hz, HorFreq: 67500 Hz
Serial number: --
Monitor name: 24G2W1G5
Monitor ranges (GTF): 48-75Hz V, 30-85kHz H, max dotclock 180MHz
Checksum: 0xdd (valid)
