edid-decode (hex):

00 ff ff ff ff ff ff 00 30 ae 21 91 00 00 00 00
00 1e 01 04 a5 1e 13 78 03 ee 95 a3 54 4c 99 26
0f 50 54 00 00 00 01 01 01 01 01 01 01 01 01 01
01 01 01 01 01 01 44 52 c0 a0 80 78 3e 50 30 20
35 00 2c bc 10 00 00 18 00 00 00 fe 00 0a 20 20
20 20 20 20 20 20 20 20 20 20 00 00 00 fe 00 4c
45 4e 4f 56 4f 0a 20 20 20 20 20 20 00 00 00 fe
00 4c 45 4e 31 34 30 57 55 58 47 41 2b 20 00 3d

00 ff ff ff ff ff ff 00 30 ae 21 91 00 00 00 00
00 1e 01 04 a5 1e 13 78 03 ee 95 a3 54 4c 99 26
0f 50 54 00 00 00 01 01 01 01 01 01 01 01 01 01
01 01 01 01 01 01 44 52 c0 a0 80 78 3e 50 30 20
35 00 2c bc 10 00 00 18 00 00 00 fe 00 0a 20 20
20 20 20 20 20 20 20 20 20 20 00 00 00 fe 00 4c
45 4e 4f 56 4f 0a 20 20 20 20 20 20 00 00 00 fe
00 4c 45 4e 31 34 30 57 55 58 47 41 2b 20 00 3d

----------------

Block 0, Base EDID:
  EDID Structure Version & Revision: 1.4
  Vendor & Product Identification:
    Manufacturer: LEN
    Model: 37153
    Made in: 2020
  Basic Display Parameters & Features:
    Digital display
    Bits per primary color channel: 8
    DisplayPort interface
    Maximum image size: 30 cm x 19 cm
    Gamma: 2.20
    Supported color formats: RGB 4:4:4
    First detailed timing includes the native pixel format and preferred refresh rate
    Display is continuous frequency
  Color Characteristics:
    Red  : 0.6396, 0.3300
    Green: 0.2998, 0.5996
    Blue : 0.1503, 0.0595
    White: 0.3134, 0.3291
  Established Timings I & II: none
  Standard Timings: none
  Detailed Timing Descriptors:
    DTD 1:  2240x1400   60.020520 Hz  16:10    87.750 kHz    210.600000 MHz (300 mm x 188 mm)
                 Hfront   48 Hsync  32 Hback   80 Hpol N
                 Vfront    3 Vsync   5 Vback   54 Vpol N
    Alphanumeric Data String: ''
    Alphanumeric Data String: 'LENOVO'
    Alphanumeric Data String: 'LEN140WUXGA+ '
Checksum: 0x3d

----------------

Block 1, Unknown EDID Extension Block 0x00:
  00 ff ff ff ff ff ff 00 30 ae 21 91 00 00 00 00 '........0.!.....'
  00 1e 01 04 a5 1e 13 78 03 ee 95 a3 54 4c 99 26 '.......x....TL.&'
  0f 50 54 00 00 00 01 01 01 01 01 01 01 01 01 01 '.PT.............'
  01 01 01 01 01 01 44 52 c0 a0 80 78 3e 50 30 20 '......DR...x>P0 '
  35 00 2c bc 10 00 00 18 00 00 00 fe 00 0a 20 20 '5.,...........  '
  20 20 20 20 20 20 20 20 20 20 00 00 00 fe 00 4c '          .....L'
  45 4e 4f 56 4f 0a 20 20 20 20 20 20 00 00 00 fe 'ENOVO.      ....'
  00 4c 45 4e 31 34 30 57 55 58 47 41 2b 20 00 3d '.LEN140WUXGA+ .='
Checksum: 0x3d

----------------

Warnings:

Block 0, Base EDID:
  Missing Display Product Name.

Failures:

Block 0, Base EDID:
  Alphanumeric Data String: Empty string.
  Alphanumeric Data String: One or more trailing spaces.
  Missing Display Range Limits Descriptor.
Block 1, Base EDID:
  Unknown Extension Block.
EDID:
  Base EDID: EDID specified 0 extension block(s), but found 1 extension block(s).

EDID conformity: FAIL
