edid-decode (hex):

00 ff ff ff ff ff ff 00 26 cd 17 61 01 01 01 01
00 18 01 03 80 35 1e 78 2a 64 35 a5 54 4f 9e 27
12 50 54 bf ef 80 b3 00 a9 40 a9 c0 95 00 95 0f
81 40 81 80 71 4f 02 3a 80 18 71 38 2d 40 58 2c
45 00 13 2b 21 00 00 1e 00 00 00 ff 00 30 0a 20
20 20 20 20 20 20 20 20 20 20 00 00 00 fd 00 37
4c 1e 53 11 00 0a 20 20 20 20 20 20 00 00 00 fc
00 50 4c 47 32 34 38 38 48 0a 20 20 20 20 01 9f

02 03 23 f2 50 9f 14 13 12 11 16 15 90 05 04 03
02 07 06 20 01 23 09 07 01 83 01 00 00 65 03 0c
00 10 00 02 3a 80 d0 72 38 2d 40 10 2c 45 80 13
2b 21 00 00 1f 01 1d 80 d0 72 1c 16 20 10 2c 25
00 13 2b 21 00 00 9f 01 1d 00 bc 52 d0 1e 20 b8
28 55 40 13 2b 21 00 00 1e 8c 0a d0 90 20 40 31
20 0c 40 55 00 13 2b 21 00 00 18 02 3a 80 18 71
38 2d 40 58 2c 45 00 13 2b 21 00 00 1e 00 00 ac

----------------

Block 0, Base EDID:
  EDID Structure Version & Revision: 1.3
  Vendor & Product Identification:
    Manufacturer: IVM
    Model: 24855
    Serial Number: ...
    Made in: 2014
  Basic Display Parameters & Features:
    Digital display
    Maximum image size: 53 cm x 30 cm
    Gamma: 2.20
    DPMS levels: Off
    RGB color display
    First detailed timing is the preferred timing
  Color Characteristics:
    Red  : 0.6455, 0.3300
    Green: 0.3095, 0.6171
    Blue : 0.1523, 0.0732
    White: 0.3134, 0.3291
  Established Timings I & II:
    IBM     :   720x400    70.082 Hz   9:5    31.467 kHz  28.320 MHz
    DMT 0x04:   640x480    59.940 Hz   4:3    31.469 kHz  25.175 MHz
    Apple   :   640x480    66.667 Hz   4:3    35.000 kHz  30.240 MHz
    DMT 0x05:   640x480    72.809 Hz   4:3    37.861 kHz  31.500 MHz
    DMT 0x06:   640x480    75.000 Hz   4:3    37.500 kHz  31.500 MHz
    DMT 0x08:   800x600    56.250 Hz   4:3    35.156 kHz  36.000 MHz
    DMT 0x09:   800x600    60.317 Hz   4:3    37.879 kHz  40.000 MHz
    DMT 0x0a:   800x600    72.188 Hz   4:3    48.077 kHz  50.000 MHz
    DMT 0x0b:   800x600    75.000 Hz   4:3    46.875 kHz  49.500 MHz
    Apple   :   832x624    74.551 Hz   4:3    49.726 kHz  57.284 MHz
    DMT 0x10:  1024x768    60.004 Hz   4:3    48.363 kHz  65.000 MHz
    DMT 0x11:  1024x768    70.069 Hz   4:3    56.476 kHz  75.000 MHz
    DMT 0x12:  1024x768    75.029 Hz   4:3    60.023 kHz  78.750 MHz
    DMT 0x24:  1280x1024   75.025 Hz   5:4    79.976 kHz 135.000 MHz
    Apple   :  1152x870    75.062 Hz 192:145  68.681 kHz 100.000 MHz
  Standard Timings:
    DMT 0x3a:  1680x1050   59.954 Hz  16:10   65.290 kHz 146.250 MHz
    DMT 0x33:  1600x1200   60.000 Hz   4:3    75.000 kHz 162.000 MHz
    DMT 0x53:  1600x900    60.000 Hz  16:9    60.000 kHz 108.000 MHz (RB)
    DMT 0x2f:  1440x900    59.887 Hz  16:10   55.935 kHz 106.500 MHz
    DMT 0x30:  1440x900    74.984 Hz  16:10   70.635 kHz 136.750 MHz
    DMT 0x20:  1280x960    60.000 Hz   4:3    60.000 kHz 108.000 MHz
    DMT 0x23:  1280x1024   60.020 Hz   5:4    63.981 kHz 108.000 MHz
    DMT 0x15:  1152x864    75.000 Hz   4:3    67.500 kHz 108.000 MHz
  Detailed Timing Descriptors:
    DTD 1:  1920x1080   60.000 Hz  16:9    67.500 kHz 148.500 MHz (531 mm x 299 mm)
                 Hfront   88 Hsync  44 Hback 148 Hpol P
                 Vfront    4 Vsync   5 Vback  36 Vpol P
    Display Product Serial Number: ...
  Display Range Limits:
    Monitor ranges (GTF): 55-76 Hz V, 30-83 kHz H, max dotclock 170 MHz
    Display Product Name: 'PLG2488H'
  Extension blocks: 1
Checksum: 0x9f

----------------

Block 1, CTA-861 Extension Block:
  Revision: 3
  Underscans IT Video Formats by default
  Basic audio support
  Supports YCbCr 4:4:4
  Supports YCbCr 4:2:2
  Native detailed modes: 2
  Video Data Block:
    VIC  31:  1920x1080   50.000 Hz  16:9    56.250 kHz 148.500 MHz (native)
    VIC  20:  1920x1080i  50.000 Hz  16:9    28.125 kHz  74.250 MHz
    VIC  19:  1280x720    50.000 Hz  16:9    37.500 kHz  74.250 MHz
    VIC  18:   720x576    50.000 Hz  16:9    31.250 kHz  27.000 MHz
    VIC  17:   720x576    50.000 Hz   4:3    31.250 kHz  27.000 MHz
    VIC  22:  1440x576i   50.000 Hz  16:9    15.625 kHz  27.000 MHz
    VIC  21:  1440x576i   50.000 Hz   4:3    15.625 kHz  27.000 MHz
    VIC  16:  1920x1080   60.000 Hz  16:9    67.500 kHz 148.500 MHz (native)
    VIC   5:  1920x1080i  60.000 Hz  16:9    33.750 kHz  74.250 MHz
    VIC   4:  1280x720    60.000 Hz  16:9    45.000 kHz  74.250 MHz
    VIC   3:   720x480    59.940 Hz  16:9    31.469 kHz  27.000 MHz
    VIC   2:   720x480    59.940 Hz   4:3    31.469 kHz  27.000 MHz
    VIC   7:  1440x480i   59.940 Hz  16:9    15.734 kHz  27.000 MHz
    VIC   6:  1440x480i   59.940 Hz   4:3    15.734 kHz  27.000 MHz
    VIC  32:  1920x1080   24.000 Hz  16:9    27.000 kHz  74.250 MHz
    VIC   1:   640x480    59.940 Hz   4:3    31.469 kHz  25.175 MHz
  Audio Data Block:
    Linear PCM:
      Max channels: 2
      Supported sample rates (kHz): 48 44.1 32
      Supported sample sizes (bits): 16
  Speaker Allocation Data Block:
    FL/FR - Front Left/Right
  Vendor-Specific Data Block (HDMI), OUI 00-0C-03:
    Source physical address: 1.0.0.0
  Detailed Timing Descriptors:
    DTD 2:  1920x1080   50.000 Hz  16:9    56.250 kHz 148.500 MHz (531 mm x 299 mm)
                 Hfront  528 Hsync  44 Hback 148 Hpol P
                 Vfront    4 Vsync   5 Vback  36 Vpol P
    DTD 3:  1920x1080i  50.000 Hz  16:9    28.125 kHz  74.250 MHz (531 mm x 299 mm)
                 Hfront   16 Hsync  44 Hback 660 Hpol P
                 Vfront    2 Vsync   5 Vback  15 Vpol P Vfront +0.5 Odd Field
                 Vfront    2 Vsync   5 Vback  15 Vpol P Vback  +0.5 Even Field
    DTD 4:  1280x720    50.000 Hz  16:9    37.500 kHz  74.250 MHz (531 mm x 299 mm)
                 Hfront  440 Hsync  40 Hback 220 Hpol P
                 Vfront    5 Vsync   5 Vback  20 Vpol P
    DTD 5:   720x576    50.000 Hz   5:4    31.250 kHz  27.000 MHz (531 mm x 299 mm)
                 Hfront   12 Hsync  64 Hback  68 Hpol N
                 Vfront    5 Vsync   5 Vback  39 Vpol N
    DTD 6:  1920x1080   60.000 Hz  16:9    67.500 kHz 148.500 MHz (531 mm x 299 mm)
                 Hfront   88 Hsync  44 Hback 148 Hpol P
                 Vfront    4 Vsync   5 Vback  36 Vpol P
Checksum: 0xac

----------------

Warnings:

Block 1, CTA-861 Extension Block:
  Display Product Serial Number is set, so the Serial Number in the Base EDID should be 0.
  Missing VCDB, needed for Set Selectable RGB Quantization to avoid interop issues.
EDID:
  CTA-861: Multiple native progressive timings are defined.

Failures:

EDID:
  Base EDID: Some timings are out of range of the Monitor Ranges:
    Vertical Freq: 24.000 - 75.062 Hz (Monitor: 55.000 - 76.000 Hz)
    Horizontal Freq: 15.625 - 79.976 kHz (Monitor: 30.000 - 83.000 kHz)

EDID conformity: FAIL
