
EDID (hex):
00ffffffffffff0030e46b0400000000
00180104902213780a05f59458569228
1e505400000001010101010101010101
010101010101d01d56f4500016303020
350058c21000001be01356f450001630
3020350058c21000001b000000000000
00000000000000000000000000000002
000c47ea0a3c6412161c6e0000000088

Extracted contents:
header:          00 ff ff ff ff ff ff 00
serial number:   30 e4 6b 04 00 00 00 00 00 18
version:         01 04
basic params:    90 22 13 78 0a
chroma info:     05 f5 94 58 56 92 28 1e 50 54
established:     00 00 00
standard:        01 01 01 01 01 01 01 01 01 01 01 01 01 01 01 01
descriptor 1:    d0 1d 56 f4 50 00 16 30 30 20 35 00 58 c2 10 00 00 1b
descriptor 2:    e0 13 56 f4 50 00 16 30 30 20 35 00 58 c2 10 00 00 1b
descriptor 3:    00 00 00 00 00 00 00 00 00 00 00 00 00 00 00 00 00 00
descriptor 4:    00 00 00 02 00 0c 47 ea 0a 3c 64 12 16 1c 6e 00 00 00
extensions:      00
checksum:        88

EDID version: 1.4
Manufacturer: LGD Model 46b Serial Number --
Made in year 2014
Digital display
6 bits per primary color channel
Digital interface is not defined
Maximum image size: 34 cm x 19 cm
Gamma: 2.20
Supported color formats: RGB 4:4:4, YCrCb 4:4:4
First detailed timing includes the native pixel format and preferred refresh rate
Display x,y Chromaticity:
  Red:   0.5781, 0.3437
  Green: 0.3369, 0.5712
  Blue:  0.1591, 0.1201
  White: 0.3134, 0.3291
Established timings supported:
Standard timings supported:
Detailed mode: Clock 76.320 MHz, 344 mm x 194 mm
               1366 1414 1446 1610 hborder 0
                768  771  776  790 vborder 0
               +hsync -vsync 
               VertFreq: 60 Hz, HorFreq: 47403 Hz
Detailed mode: Clock 50.880 MHz, 344 mm x 194 mm
               1366 1414 1446 1610 hborder 0
                768  771  776  790 vborder 0
               +hsync -vsync 
               VertFreq: 40 Hz, HorFreq: 31602 Hz
Manufacturer-specified data, tag 0
Manufacturer-specified data, tag 2
Checksum: 0x88 (valid)
EDID block does NOT conform to EDID 1.4!
	Missing name descriptor
	Missing monitor ranges
