edid-decode (hex):

00 ff ff ff ff ff ff 00 30 e4 53 03 00 00 00 00
00 16 01 03 80 23 13 78 0a 05 f5 94 58 56 92 28
1e 50 54 00 00 00 01 01 01 01 01 01 01 01 01 01
01 01 01 01 01 01 12 1b 56 70 50 00 0e 30 20 20
24 00 59 c2 10 00 00 19 00 00 00 00 00 00 00 00
00 00 00 00 00 00 00 00 00 00 00 00 00 fe 00 4c
47 20 44 69 73 70 6c 61 79 0a 20 20 00 00 00 fe
00 4c 50 31 35 36 57 48 33 2d 54 4c 54 31 00 2e

----------------

Block 0, Base EDID:
  EDID Structure Version & Revision: 1.3
  Vendor & Product Identification:
    Manufacturer: LGD
    Model: 851
    Made in: 2012
  Basic Display Parameters & Features:
    Digital display
    Maximum image size: 35 cm x 19 cm
    Gamma: 2.20
    RGB color display
    First detailed timing is the preferred timing
  Color Characteristics:
    Red  : 0.5781, 0.3437
    Green: 0.3369, 0.5712
    Blue : 0.1591, 0.1201
    White: 0.3134, 0.3291
  Established Timings I & II: none
  Standard Timings: none
  Detailed Timing Descriptors:
    DTD 1:  1366x768    59.959 Hz 683:384  46.888 kHz  69.300 MHz (345 mm x 194 mm)
                 Hfront   32 Hsync  32 Hback  48 Hpol N
                 Vfront    2 Vsync   4 Vback   8 Vpol N
    Empty Descriptor
    Alphanumeric Data String: 'LG Display'
    Alphanumeric Data String: 'LP156WH3-TLT1'
Checksum: 0x2e

----------------

Failures:

Block 0, Base EDID:
  Empty Descriptor: Use Dummy Descriptor instead of all zeroes.
  Missing Display Product Name.
  Missing Display Range Limits Descriptor.

EDID conformity: FAIL
