edid-decode (hex):

00 ff ff ff ff ff ff 00 09 e5 8b 0a 00 00 00 00
1c 1d 01 04 a5 22 13 78 02 83 20 97 59 54 8e 27
1e 50 54 00 00 00 01 01 01 01 01 01 01 01 01 01
01 01 01 01 01 01 20 37 80 b4 70 38 28 40 30 20
36 00 58 c1 10 00 00 1a 00 00 00 00 00 00 00 00
00 00 00 00 00 00 00 00 00 1a 00 00 00 fe 00 42
4f 45 20 43 51 0a 20 20 20 20 20 20 00 00 00 fe
00 50 56 31 35 36 46 48 4d 2d 4e 32 30 0a 00 b1

00 ff ff ff ff ff ff 00 09 e5 8b 0a 00 00 00 00
1c 1d 01 04 a5 22 13 78 02 83 20 97 59 54 8e 27
1e 50 54 00 00 00 01 01 01 01 01 01 01 01 01 01
01 01 01 01 01 01 20 37 80 b4 70 38 28 40 30 20
36 00 58 c1 10 00 00 1a 00 00 00 00 00 00 00 00
00 00 00 00 00 00 00 00 00 1a 00 00 00 fe 00 42
4f 45 20 43 51 0a 20 20 20 20 20 20 00 00 00 fe
00 50 56 31 35 36 46 48 4d 2d 4e 32 30 0a 00 b1

----------------

Block 0, Base EDID:
  EDID Structure Version & Revision: 1.4
  Vendor & Product Identification:
    Manufacturer: BOE
    Model: 2699
    Made in: week 28 of 2019
  Basic Display Parameters & Features:
    Digital display
    Bits per primary color channel: 8
    DisplayPort interface
    Maximum image size: 34 cm x 19 cm
    Gamma: 2.20
    Supported color formats: RGB 4:4:4
    First detailed timing includes the native pixel format and preferred refresh rate
  Color Characteristics:
    Red  : 0.5917, 0.3476
    Green: 0.3281, 0.5576
    Blue : 0.1523, 0.1191
    White: 0.3125, 0.3281
  Established Timings I & II: none
  Standard Timings: none
  Detailed Timing Descriptors:
    DTD 1:  1920x1080   60.000000 Hz  16:9     67.200 kHz    141.120000 MHz (344 mm x 193 mm)
                 Hfront   48 Hsync  32 Hback  100 Hpol P
                 Vfront    3 Vsync   6 Vback   31 Vpol N
    Manufacturer-Specified Display Descriptor (0x00): 00 00 00 00 00 00 00 00 00 00 00 00 00 00 00 1a '................'
    Alphanumeric Data String: 'BOE CQ'
    Alphanumeric Data String: 'PV156FHM-N20'
Checksum: 0xb1

----------------

Block 1, Unknown EDID Extension Block 0x00:
  00 ff ff ff ff ff ff 00 09 e5 8b 0a 00 00 00 00 '................'
  1c 1d 01 04 a5 22 13 78 02 83 20 97 59 54 8e 27 '.....".x.. .YT.''
  1e 50 54 00 00 00 01 01 01 01 01 01 01 01 01 01 '.PT.............'
  01 01 01 01 01 01 20 37 80 b4 70 38 28 40 30 20 '...... 7..p8(@0 '
  36 00 58 c1 10 00 00 1a 00 00 00 00 00 00 00 00 '6.X.............'
  00 00 00 00 00 00 00 00 00 1a 00 00 00 fe 00 42 '...............B'
  4f 45 20 43 51 0a 20 20 20 20 20 20 00 00 00 fe 'OE CQ.      ....'
  00 50 56 31 35 36 46 48 4d 2d 4e 32 30 0a 00 b1 '.PV156FHM-N20...'
Checksum: 0xb1

----------------

Warnings:

Block 0, Base EDID:
  Missing Display Product Name.

Failures:

Block 1, Base EDID:
  Unknown Extension Block.
EDID:
  Base EDID: EDID specified 0 extension block(s), but found 1 extension block(s).

EDID conformity: FAIL
