edid-decode (hex):

00 ff ff ff ff ff ff 00 06 af 3c 32 00 00 00 00
00 17 01 04 95 1f 11 78 02 af e5 96 58 53 8a 26
24 50 54 00 00 00 01 01 01 01 01 01 01 01 01 01
01 01 01 01 01 01 52 1c 56 a2 50 00 16 30 26 16
36 00 35 ad 10 00 00 18 e1 12 56 a2 50 00 16 30
26 16 36 00 35 ad 10 00 00 18 00 00 00 00 00 00
00 00 00 00 00 00 00 00 00 00 00 00 00 00 00 02
00 10 48 ff 0f 3c 6e 10 0e 1a 69 20 20 20 00 a3

----------------

Block 0, Base EDID:
  EDID Structure Version & Revision: 1.4
  Vendor & Product Identification:
    Manufacturer: AUO
    Model: 12860
    Made in: 2013
  Basic Display Parameters & Features:
    Digital display
    Bits per primary color channel: 6
    DisplayPort interface
    Maximum image size: 31 cm x 17 cm
    Gamma: 2.20
    Supported color formats: RGB 4:4:4
    First detailed timing includes the native pixel format and preferred refresh rate
  Color Characteristics:
    Red  : 0.5878, 0.3457
    Green: 0.3271, 0.5419
    Blue : 0.1513, 0.1425
    White: 0.3134, 0.3291
  Established Timings I & II: none
  Standard Timings: none
  Detailed Timing Descriptors:
    DTD 1:  1366x768    60.060309 Hz 683:384   47.448 kHz     72.500000 MHz (309 mm x 173 mm)
                 Hfront   38 Hsync  22 Hback  102 Hpol N
                 Vfront    3 Vsync   6 Vback   13 Vpol N
    DTD 2:  1366x768    40.037444 Hz 683:384   31.630 kHz     48.330000 MHz (309 mm x 173 mm)
                 Hfront   38 Hsync  22 Hback  102 Hpol N
                 Vfront    3 Vsync   6 Vback   13 Vpol N
    Empty Descriptor
    Manufacturer-Specified Display Descriptor (0x02): 00 02 00 10 48 ff 0f 3c 6e 10 0e 1a 69 20 20 20 '....H..<n...i   '
Checksum: 0xa3

----------------

Warnings:

Block 0, Base EDID:
  Missing Display Product Name.

Failures:

Block 0, Base EDID:
  Empty Descriptor: Use Dummy Descriptor instead of all zeroes.

EDID conformity: FAIL
