edid-decode (hex):

00 ff ff ff ff ff ff 00 25 e4 d7 11 01 01 01 01
1a 1a 01 03 18 22 1b 78 2e 11 65 a5 55 52 a0 27
0e 50 54 bf ef 00 81 80 01 01 01 01 01 01 01 01
01 01 01 01 01 01 bc 34 00 98 51 00 2a 40 10 90
13 00 51 0e 11 00 00 1e 00 00 00 fd 00 37 4b 18
53 10 00 0a 20 20 20 20 20 20 00 00 00 ff 00 47
43 42 30 30 31 39 31 35 35 59 4e 0a 00 00 00 fc
00 4c 43 44 2d 41 44 31 37 33 53 45 0a 20 00 df

00 ff ff ff ff ff ff 00 25 e4 d7 11 01 01 01 01
1a 1a 01 03 18 22 1b 78 2e 11 65 a5 55 52 a0 27
0e 50 54 bf ef 00 81 80 01 01 01 01 01 01 01 01
01 01 01 01 01 01 bc 34 00 98 51 00 2a 40 10 90
13 00 51 0e 11 00 00 1e 00 00 00 fd 00 37 4b 18
53 10 00 0a 20 20 20 20 20 20 00 00 00 ff 00 47
43 42 30 30 31 39 31 35 35 59 4e 0a 00 00 00 fc
00 4c 43 44 2d 41 44 31 37 33 53 45 0a 20 00 df

----------------

Block 0, Base EDID:
  EDID Structure Version & Revision: 1.3
  Vendor & Product Identification:
    Manufacturer: IOD
    Model: 4567
    Serial Number: ...
    Made in: week 26 of 2016
  Basic Display Parameters & Features:
    Analog display
    Signal Level Standard: 0.700 : 0.300 : 1.000 V p-p
    Blank-to-black setup/pedestal
    Sync: Separate
    Maximum image size: 34 cm x 27 cm
    Gamma: 2.20
    DPMS levels: Off
    RGB color display
    Default (sRGB) color space is primary color space
    First detailed timing is the preferred timing
  Color Characteristics:
    Red  : 0.6445, 0.3330
    Green: 0.3203, 0.6259
    Blue : 0.1533, 0.0566
    White: 0.3134, 0.3291
  Established Timings I & II:
    IBM     :   720x400    70.081663 Hz   9:5     31.467 kHz     28.320000 MHz
    DMT 0x04:   640x480    59.940476 Hz   4:3     31.469 kHz     25.175000 MHz
    Apple   :   640x480    66.666667 Hz   4:3     35.000 kHz     30.240000 MHz
    DMT 0x05:   640x480    72.808802 Hz   4:3     37.861 kHz     31.500000 MHz
    DMT 0x06:   640x480    75.000000 Hz   4:3     37.500 kHz     31.500000 MHz
    DMT 0x08:   800x600    56.250000 Hz   4:3     35.156 kHz     36.000000 MHz
    DMT 0x09:   800x600    60.316541 Hz   4:3     37.879 kHz     40.000000 MHz
    DMT 0x0a:   800x600    72.187572 Hz   4:3     48.077 kHz     50.000000 MHz
    DMT 0x0b:   800x600    75.000000 Hz   4:3     46.875 kHz     49.500000 MHz
    Apple   :   832x624    74.551266 Hz   4:3     49.726 kHz     57.284000 MHz
    DMT 0x10:  1024x768    60.003840 Hz   4:3     48.363 kHz     65.000000 MHz
    DMT 0x11:  1024x768    70.069359 Hz   4:3     56.476 kHz     75.000000 MHz
    DMT 0x12:  1024x768    75.028582 Hz   4:3     60.023 kHz     78.750000 MHz
    DMT 0x24:  1280x1024   75.024675 Hz   5:4     79.976 kHz    135.000000 MHz
  Standard Timings:
    DMT 0x23:  1280x1024   60.019740 Hz   5:4     63.981 kHz    108.000000 MHz
  Detailed Timing Descriptors:
    DTD 1:  1280x1024   75.024675 Hz   5:4     79.976 kHz    135.000000 MHz (337 mm x 270 mm)
                 Hfront   16 Hsync 144 Hback  248 Hpol P
                 Vfront    1 Vsync   3 Vback   38 Vpol P
    Display Range Limits:
      Monitor ranges (GTF): 55-75 Hz V, 24-83 kHz H, max dotclock 160 MHz
    Display Product Serial Number: ...
    Display Product Name: 'LCD-AD173SE'
Checksum: 0xdf

----------------

Block 1, Unknown EDID Extension Block 0x00:
  00 ff ff ff ff ff ff 00 25 e4 d7 11 01 01 01 01 '........%.......'
  1a 1a 01 03 18 22 1b 78 2e 11 65 a5 55 52 a0 27 '.....".x..e.UR.''
  0e 50 54 bf ef 00 81 80 01 01 01 01 01 01 01 01 '.PT.............'
  01 01 01 01 01 01 bc 34 00 98 51 00 2a 40 10 90 '.......4..Q.*@..'
  13 00 51 0e 11 00 00 1e 00 00 00 fd 00 37 4b 18 '..Q..........7K.'
  53 10 00 0a 20 20 20 20 20 20 00 00 00 ff 00 47 'S...      .....G'
  43 42 30 30 31 39 31 35 35 59 4e 0a 00 00 00 fc 'CB0019155YN.....'
  00 4c 43 44 2d 41 44 31 37 33 53 45 0a 20 00 df '.LCD-AD173SE. ..'
Checksum: 0xdf

----------------

Failures:

Block 0, Base EDID:
  Basic Display Parameters & Features: sRGB is signaled, but the chromaticities do not match.
Block 1, Base EDID:
  Unknown Extension Block.
EDID:
  Base EDID: EDID specified 0 extension block(s), but found 1 extension block(s).

EDID conformity: FAIL
