edid-decode (hex):

00 ff ff ff ff ff ff 00 30 ae 37 40 00 00 00 00
00 12 01 03 80 1e 13 78 ea 44 c5 9c 57 58 97 27
12 50 54 00 00 00 01 01 01 01 01 01 01 01 01 01
01 01 01 01 01 01 26 1b 00 88 50 20 12 30 34 40
33 00 2f be 10 00 00 19 8b 16 00 68 50 20 22 30
34 40 33 00 2f be 10 00 00 19 00 00 00 0f 00 81
0a 32 81 0a 28 44 09 00 4c a3 41 54 00 00 00 fe
00 4c 54 4e 31 34 31 41 54 30 39 32 30 31 00 8d

----------------

Block 0, Base EDID:
  EDID Structure Version & Revision: 1.3
  Vendor & Product Identification:
    Manufacturer: LEN
    Model: 16439
    Made in: 2008
  Basic Display Parameters & Features:
    Digital display
    Maximum image size: 30 cm x 19 cm
    Gamma: 2.20
    DPMS levels: Standby Suspend Off
    RGB color display
    First detailed timing is preferred timing
  Color Characteristics:
    Red  : 0.6103, 0.3398
    Green: 0.3447, 0.5898
    Blue : 0.1552, 0.0703
    White: 0.3134, 0.3291
  Established Timings I & II: none
  Standard Timings: none
  Detailed Timing Descriptors:
    DTD 1:  1280x800    60.002 Hz   8:5    49.082 kHz  69.500 MHz (303 mm x 190 mm)
                 Hfront   52 Hsync  64 Hback  20 Hpol N
                 Vfront    3 Vsync   3 Vback  12 Vpol N
    DTD 2:  1280x800    49.998 Hz   8:5    41.698 kHz  57.710 MHz (303 mm x 190 mm)
                 Hfront   52 Hsync  64 Hback -12 Hpol N
                 Vfront    3 Vsync   3 Vback  28 Vpol N
    Manufacturer-Specified Display Descriptor (0x0f): 00 0f 00 81 0a 32 81 0a 28 44 09 00 4c a3 41 54 '.....2..(D..L.AT'
    Alphanumeric Data String: 'LTN141AT09201'
Checksum: 0x8d
