
EDID (hex):
00ffffffffffff000daf041000000000
0313010380160c780acf459059579529
1f505400000001010101010101010101
010101010101c81200f040582220412c
4500de7d00000018000000fe004e3130
314c362d4c30320a2020000000fe0043
4d4f0a202020202020202020000000fe
004e3130314c362d4c30320a20200039

Extracted contents:
header:          00 ff ff ff ff ff ff 00
serial number:   0d af 04 10 00 00 00 00 03 13
version:         01 03
basic params:    80 16 0c 78 0a
chroma info:     cf 45 90 59 57 95 29 1f 50 54
established:     00 00 00
standard:        01 01 01 01 01 01 01 01 01 01 01 01 01 01 01 01
descriptor 1:    c8 12 00 f0 40 58 22 20 41 2c 45 00 de 7d 00 00 00 18
descriptor 2:    00 00 00 fe 00 4e 31 30 31 4c 36 2d 4c 30 32 0a 20 20
descriptor 3:    00 00 00 fe 00 43 4d 4f 0a 20 20 20 20 20 20 20 20 20
descriptor 4:    00 00 00 fe 00 4e 31 30 31 4c 36 2d 4c 30 32 0a 20 20
extensions:      00
checksum:        39

EDID version: 1.3
Manufacturer: CMO Model 1004 Serial Number --
Made in week 3 of 2009
Digital display
Maximum image size: 22 cm x 12 cm
Gamma: 2.20
RGB color display
First detailed timing is preferred timing
Display x,y Chromaticity:
  Red:   0.5654, 0.3476
  Green: 0.3427, 0.5849
  Blue:  0.1611, 0.1210
  White: 0.3134, 0.3291
Established timings supported:
Standard timings supported:
Detailed mode: Clock 48.080 MHz, 222 mm x 125 mm
               1024 1089 1133 1264 hborder 0
                600  604  609  634 vborder 0
               -hsync -vsync 
               VertFreq: 59 Hz, HorFreq: 38037 Hz
ASCII string: N101L6-L02
ASCII string: CMO
ASCII string: N101L6-L02
Checksum: 0x39 (valid)
EDID block does NOT conform to EDID 1.3!
	Missing name descriptor
	Missing monitor ranges
