edid-decode (hex):

00 ff ff ff ff ff ff 00 0d af 21 12 00 00 00 00
01 10 01 03 80 1a 10 78 0a 0d 62 8e 5a 5c 93 27
1e 50 5b 00 00 00 01 01 01 01 01 01 01 01 01 01
01 01 01 01 01 01 1b 1b 00 84 50 20 13 30 28 1a
25 00 05 a3 10 00 00 18 00 00 00 fe 00 4e 31 32
31 49 36 2d 4c 30 31 0a 20 20 00 00 00 fe 00 43
4d 4f 0a 20 20 20 20 20 20 20 20 20 00 00 00 fe
00 4e 31 32 31 49 36 2d 4c 30 31 0a 20 20 00 df

----------------

Block 0, Base EDID:
  EDID Structure Version & Revision: 1.3
  Vendor & Product Identification:
    Manufacturer: CMO
    Model: 4641
    Made in: week 1 of 2006
  Basic Display Parameters & Features:
    Digital display
    Maximum image size: 26 cm x 16 cm
    Gamma: 2.20
    RGB color display
    First detailed timing is the preferred timing
  Color Characteristics:
    Red  : 0.5546, 0.3515
    Green: 0.3623, 0.5751
    Blue : 0.1533, 0.1191
    White: 0.3125, 0.3574
  Established Timings I & II: none
  Standard Timings: none
  Detailed Timing Descriptors:
    DTD 1:  1280x800    60.004 Hz   8:5    49.143 kHz  69.390 MHz (261 mm x 163 mm)
                 Hfront   40 Hsync  26 Hback  66 Hpol N
                 Vfront    2 Vsync   5 Vback  12 Vpol N
    Alphanumeric Data String: 'N121I6-L01'
    Alphanumeric Data String: 'CMO'
    Alphanumeric Data String: 'N121I6-L01'
Checksum: 0xdf

----------------

Failures:

Block 0, Base EDID:
  Missing Display Product Name.
  Missing Display Range Limits Descriptor.

EDID conformity: FAIL
