
EDID (hex):
00ffffffffffff0030e4fd0300000000
00160104951c107802d9f5985c549327
1e505400000001010101010101010101
0101010101011a3680a070381f403020
3500149c1000001a1a3680a070381f40
30203500149c1000001a000000fe0057
56353031813132355746310a00000000
00004121a4010000000a010a202000c0

Extracted contents:
header:          00 ff ff ff ff ff ff 00
serial number:   30 e4 fd 03 00 00 00 00 00 16
version:         01 04
basic params:    95 1c 10 78 02
chroma info:     d9 f5 98 5c 54 93 27 1e 50 54
established:     00 00 00
standard:        01 01 01 01 01 01 01 01 01 01 01 01 01 01 01 01
descriptor 1:    1a 36 80 a0 70 38 1f 40 30 20 35 00 14 9c 10 00 00 1a
descriptor 2:    1a 36 80 a0 70 38 1f 40 30 20 35 00 14 9c 10 00 00 1a
descriptor 3:    00 00 00 fe 00 57 56 35 30 31 81 31 32 35 57 46 31 0a
descriptor 4:    00 00 00 00 00 00 41 21 a4 01 00 00 00 0a 01 0a 20 20
extensions:      00
checksum:        c0

EDID version: 1.4
Manufacturer: LGD Model 3fd Serial Number --
Made in year 2012
Digital display
6 bits per primary color channel
DisplayPort interface
Maximum image size: 28 cm x 16 cm
Gamma: 2.20
Supported color formats: RGB 4:4:4
First detailed timing includes the native pixel format and preferred refresh rate
Display x,y Chromaticity:
  Red:   0.5966, 0.3603
  Green: 0.3300, 0.5751
  Blue:  0.1552, 0.1201
  White: 0.3134, 0.3291
Established timings supported:
Standard timings supported:
Detailed mode: Clock 138.500 MHz, 276 mm x 156 mm
               1920 1968 2000 2080 hborder 0
               1080 1083 1088 1111 vborder 0
               +hsync -vsync 
               VertFreq: 59 Hz, HorFreq: 66586 Hz
Detailed mode: Clock 138.500 MHz, 276 mm x 156 mm
               1920 1968 2000 2080 hborder 0
               1080 1083 1088 1111 vborder 0
               +hsync -vsync 
               VertFreq: 59 Hz, HorFreq: 66586 Hz
ASCII string: WV501
Manufacturer-specified data, tag 0
Checksum: 0xc0 (valid)
EDID block does NOT conform to EDID 1.4!
	Missing name descriptor
	Missing monitor ranges
	Detailed block string not properly terminated
