edid-decode (hex):

00 ff ff ff ff ff ff 00 4c 23 2d 95 39 59 3f 1e
25 1c 01 03 80 34 20 78 2a 35 81 a6 56 48 9a 24
12 50 54 af cf 00 81 00 81 40 81 80 95 00 a9 40
b3 00 d1 cf 01 01 aa 37 80 c8 70 38 28 40 58 2c
45 00 dd 0c 11 00 00 1e 2f 26 40 a0 60 84 1a 30
30 20 35 00 bb f9 10 00 00 1c 00 00 00 fd 00 38
4c 1f 53 11 00 0a 20 20 20 20 20 20 00 00 00 fc
00 4c 45 44 20 4d 4f 4e 49 54 4f 52 0a 20 01 35

02 03 10 f0 41 01 23 08 1f 07 65 03 0c 00 00 00
00 00 00 00 00 00 00 00 00 00 00 00 00 00 00 00
00 00 00 00 00 00 00 00 00 00 00 00 00 00 00 00
00 00 00 00 00 00 00 00 00 00 00 00 00 00 00 00
00 00 00 00 00 00 00 00 00 00 00 00 00 00 00 00
00 00 00 00 00 00 00 00 00 00 00 00 00 00 00 00
00 00 00 00 00 00 00 00 00 00 00 00 00 00 00 00
00 00 00 00 00 00 00 00 00 00 00 00 00 00 00 f4

00 ff ff ff ff ff ff 00 4c 23 2d 95 39 59 3f 1e
25 1c 01 03 80 34 20 78 2a 35 81 a6 56 48 9a 24
12 50 54 af cf 00 81 00 81 40 81 80 95 00 a9 40
b3 00 d1 cf 01 01 aa 37 80 c8 70 38 28 40 58 2c
45 00 dd 0c 11 00 00 1e 2f 26 40 a0 60 84 1a 30
30 20 35 00 bb f9 10 00 00 1c 00 00 00 fd 00 38
4c 1f 53 11 00 0a 20 20 20 20 20 20 00 00 00 fc
00 4c 45 44 20 4d 4f 4e 49 54 4f 52 0a 20 01 35

02 03 10 f0 41 01 23 08 1f 07 65 03 0c 00 00 00
00 00 00 00 00 00 00 00 00 00 00 00 00 00 00 00
00 00 00 00 00 00 00 00 00 00 00 00 00 00 00 00
00 00 00 00 00 00 00 00 00 00 00 00 00 00 00 00
00 00 00 00 00 00 00 00 00 00 00 00 00 00 00 00
00 00 00 00 00 00 00 00 00 00 00 00 00 00 00 00
00 00 00 00 00 00 00 00 00 00 00 00 00 00 00 00
00 00 00 00 00 00 00 00 00 00 00 00 00 00 00 f4

----------------

Block 0, Base EDID:
  EDID Structure Version & Revision: 1.3
  Vendor & Product Identification:
    Manufacturer: SAC
    Model: 38189
    Serial Number: ...
    Made in: week 37 of 2018
  Basic Display Parameters & Features:
    Digital display
    Maximum image size: 52 cm x 32 cm
    Gamma: 2.20
    DPMS levels: Off
    RGB color display
    First detailed timing is the preferred timing
  Color Characteristics:
    Red  : 0.6484, 0.3388
    Green: 0.2822, 0.6025
    Blue : 0.1425, 0.0703
    White: 0.3125, 0.3291
  Established Timings I & II:
    IBM     :   720x400    70.081663 Hz   9:5     31.467 kHz     28.320000 MHz
    DMT 0x04:   640x480    59.940476 Hz   4:3     31.469 kHz     25.175000 MHz
    DMT 0x05:   640x480    72.808802 Hz   4:3     37.861 kHz     31.500000 MHz
    DMT 0x06:   640x480    75.000000 Hz   4:3     37.500 kHz     31.500000 MHz
    DMT 0x08:   800x600    56.250000 Hz   4:3     35.156 kHz     36.000000 MHz
    DMT 0x09:   800x600    60.316541 Hz   4:3     37.879 kHz     40.000000 MHz
    DMT 0x0a:   800x600    72.187572 Hz   4:3     48.077 kHz     50.000000 MHz
    DMT 0x0b:   800x600    75.000000 Hz   4:3     46.875 kHz     49.500000 MHz
    DMT 0x10:  1024x768    60.003840 Hz   4:3     48.363 kHz     65.000000 MHz
    DMT 0x11:  1024x768    70.069359 Hz   4:3     56.476 kHz     75.000000 MHz
    DMT 0x12:  1024x768    75.028582 Hz   4:3     60.023 kHz     78.750000 MHz
    DMT 0x24:  1280x1024   75.024675 Hz   5:4     79.976 kHz    135.000000 MHz
  Standard Timings:
    DMT 0x1c:  1280x800    59.810326 Hz  16:10    49.702 kHz     83.500000 MHz
    DMT 0x20:  1280x960    60.000000 Hz   4:3     60.000 kHz    108.000000 MHz
    DMT 0x23:  1280x1024   60.019740 Hz   5:4     63.981 kHz    108.000000 MHz
    DMT 0x2f:  1440x900    59.887445 Hz  16:10    55.935 kHz    106.500000 MHz
    DMT 0x33:  1600x1200   60.000000 Hz   4:3     75.000 kHz    162.000000 MHz
    DMT 0x3a:  1680x1050   59.954250 Hz  16:10    65.290 kHz    146.250000 MHz
    GTF     :  1920x1080   75.000068 Hz  16:9     84.600 kHz    220.637000 MHz
  Detailed Timing Descriptors:
    DTD 1:  1920x1080   60.015162 Hz  16:9     67.217 kHz    142.500000 MHz (477 mm x 268 mm)
                 Hfront   88 Hsync  44 Hback   68 Hpol P
                 Vfront    4 Vsync   5 Vback   31 Vpol P
    DTD 2:  1600x900    59.978156 Hz  16:9     55.540 kHz     97.750000 MHz (443 mm x 249 mm)
                 Hfront   48 Hsync  32 Hback   80 Hpol N
                 Vfront    3 Vsync   5 Vback   18 Vpol P
    Display Range Limits:
      Monitor ranges (GTF): 56-76 Hz V, 31-83 kHz H, max dotclock 170 MHz
    Display Product Name: 'LED MONITOR'
  Extension blocks: 1
Checksum: 0x35

----------------

Block 1, CTA-861 Extension Block:
  Revision: 3
  Underscans IT Video Formats by default
  Basic audio support
  Supports YCbCr 4:4:4
  Supports YCbCr 4:2:2
  Native detailed modes: 0
  Video Data Block:
    VIC   1:   640x480    59.940476 Hz   4:3     31.469 kHz     25.175000 MHz
  Audio Data Block:
    Linear PCM:
      Max channels: 1
      Supported sample rates (kHz): 96 88.2 48 44.1 32
      Supported sample sizes (bits): 24 20 16
  Vendor-Specific Data Block (HDMI), OUI 00-0C-03:
    Source physical address: 0.0.0.0
Checksum: 0xf4  Unused space in Extension Block: 111 bytes

----------------

Block 2, Unknown EDID Extension Block 0x00:
  00 ff ff ff ff ff ff 00 4c 23 2d 95 39 59 3f 1e '........L#-.9Y?.'
  25 1c 01 03 80 34 20 78 2a 35 81 a6 56 48 9a 24 '%....4 x*5..VH.$'
  12 50 54 af cf 00 81 00 81 40 81 80 95 00 a9 40 '.PT......@.....@'
  b3 00 d1 cf 01 01 aa 37 80 c8 70 38 28 40 58 2c '.......7..p8(@X,'
  45 00 dd 0c 11 00 00 1e 2f 26 40 a0 60 84 1a 30 'E......./&@.`..0'
  30 20 35 00 bb f9 10 00 00 1c 00 00 00 fd 00 38 '0 5............8'
  4c 1f 53 11 00 0a 20 20 20 20 20 20 00 00 00 fc 'L.S...      ....'
  00 4c 45 44 20 4d 4f 4e 49 54 4f 52 0a 20 01 35 '.LED MONITOR. .5'
Checksum: 0x35

----------------

Block 3, CTA-861 Extension Block:
  Revision: 3
  Underscans IT Video Formats by default
  Basic audio support
  Supports YCbCr 4:4:4
  Supports YCbCr 4:2:2
  Native detailed modes: 0
  Video Data Block:
    VIC   1:   640x480    59.940476 Hz   4:3     31.469 kHz     25.175000 MHz
  Audio Data Block:
    Linear PCM:
      Max channels: 1
      Supported sample rates (kHz): 96 88.2 48 44.1 32
      Supported sample sizes (bits): 24 20 16
  Vendor-Specific Data Block (HDMI), OUI 00-0C-03:
    Source physical address: 0.0.0.0
Checksum: 0xf4  Unused space in Extension Block: 111 bytes

----------------

Warnings:

Block 1, CTA-861 Extension Block:
  Video Data Block: VIC 1 is the preferred timing, overriding the first detailed timings. Is this intended?
  Add a Colorimetry Data Block with the sRGB colorimetry bit set to avoid interop issues.
Block 3, CTA-861 Extension Block:
  Add a Colorimetry Data Block with the sRGB colorimetry bit set to avoid interop issues.

Failures:

Block 0, Base EDID:
  Detailed Timing Descriptor #1: Mismatch of image size 477x268 mm vs display size 520x320 mm.
  Detailed Timing Descriptor #2: Mismatch of image size 443x249 mm vs display size 520x320 mm.
Block 1, CTA-861 Extension Block:
  Missing VCDB, needed for Set Selectable RGB Quantization to avoid interop issues.
Block 2, Base EDID:
  Unknown Extension Block.
Block 3, CTA-861 Extension Block:
  Video Data Block: Duplicate VIC 1.
  Missing VCDB, needed for Set Selectable RGB Quantization to avoid interop issues.
EDID:
  Base EDID: Some timings are out of range of the Monitor Ranges:
    Horizontal Freq: 31.466 - 84.600 kHz (Monitor: 31.000 - 83.000 kHz)
    Maximum Clock: 220.637 MHz (Monitor: 170.000 MHz)
  Base EDID: EDID specified 1 extension block(s), but found 3 extension block(s).
  Base EDID: EDID 1.3 requires a Block Map Extension in Block 1 if there are more than 2 blocks in the EDID.

EDID conformity: FAIL
