edid-decode (hex):

00 ff ff ff ff ff ff 00 04 72 4c 08 4f ee 31 21
0d 20 01 04 b5 46 27 78 3b e1 75 ad 50 45 a0 25
0d 50 54 bf ef 80 71 4f 81 40 81 80 81 c0 61 7c
95 00 b3 00 d1 c0 4d d0 00 a0 f0 70 3e 80 30 20
35 00 b9 88 21 00 00 1a 00 00 00 ff 00 35 32 31
33 31 45 45 34 46 34 32 30 30 00 00 00 fd 0c 30
90 53 53 88 01 0a 20 20 20 20 20 20 00 00 00 fc
00 58 56 33 32 32 51 4b 20 4b 56 0a 20 20 02 a4

02 03 3a f1 4b 01 02 03 04 90 11 13 1f 3f 61 76
23 09 07 07 83 01 00 00 e2 00 c0 65 03 0c 00 10
00 6d 1a 00 00 02 01 30 90 00 00 00 00 00 00 e3
05 c3 01 e6 06 05 01 62 62 1b 40 e7 00 6a a0 a0
67 50 08 20 98 04 b9 88 21 00 00 1a 6f c2 00 a0
a0 a0 55 50 30 20 35 00 b9 88 21 00 00 1e 00 00
00 00 00 00 00 00 00 00 00 00 00 00 00 00 00 00
00 00 00 00 00 00 00 00 00 00 00 00 00 00 00 64

70 12 79 00 00 03 01 3c 4b f8 01 04 ff 0e 4f 00
07 00 1f 00 6f 08 7e 00 70 00 07 00 eb a3 01 04
ff 0e 4f 00 07 00 1f 00 6f 08 7e 00 70 00 07 00
55 5e 00 04 ff 09 9f 00 2e 80 1f 00 9f 05 28 00
02 00 04 00 00 00 00 00 00 00 00 00 00 00 00 00
00 00 00 00 00 00 00 00 00 00 00 00 00 00 00 00
00 00 00 00 00 00 00 00 00 00 00 00 00 00 00 00
00 00 00 00 00 00 00 00 00 00 00 00 00 00 81 90

00 ff ff ff ff ff ff 00 04 72 4c 08 4f ee 31 21
0d 20 01 04 b5 46 27 78 3b e1 75 ad 50 45 a0 25
0d 50 54 bf ef 80 71 4f 81 40 81 80 81 c0 61 7c
95 00 b3 00 d1 c0 4d d0 00 a0 f0 70 3e 80 30 20
35 00 b9 88 21 00 00 1a 00 00 00 ff 00 35 32 31
33 31 45 45 34 46 34 32 30 30 00 00 00 fd 0c 30
90 53 53 88 01 0a 20 20 20 20 20 20 00 00 00 fc
00 58 56 33 32 32 51 4b 20 4b 56 0a 20 20 02 a4

02 03 3a f1 4b 01 02 03 04 90 11 13 1f 3f 61 76
23 09 07 07 83 01 00 00 e2 00 c0 65 03 0c 00 10
00 6d 1a 00 00 02 01 30 90 00 00 00 00 00 00 e3
05 c3 01 e6 06 05 01 62 62 1b 40 e7 00 6a a0 a0
67 50 08 20 98 04 b9 88 21 00 00 1a 6f c2 00 a0
a0 a0 55 50 30 20 35 00 b9 88 21 00 00 1e 00 00
00 00 00 00 00 00 00 00 00 00 00 00 00 00 00 00
00 00 00 00 00 00 00 00 00 00 00 00 00 00 00 64

70 12 79 00 00 03 01 3c 4b f8 01 04 ff 0e 4f 00
07 00 1f 00 6f 08 7e 00 70 00 07 00 eb a3 01 04
ff 0e 4f 00 07 00 1f 00 6f 08 7e 00 70 00 07 00
55 5e 00 04 ff 09 9f 00 2e 80 1f 00 9f 05 28 00
02 00 04 00 00 00 00 00 00 00 00 00 00 00 00 00
00 00 00 00 00 00 00 00 00 00 00 00 00 00 00 00
00 00 00 00 00 00 00 00 00 00 00 00 00 00 00 00
00 00 00 00 00 00 00 00 00 00 00 00 00 00 81 90

----------------

Block 0, Base EDID:
  EDID Structure Version & Revision: 1.4
  Vendor & Product Identification:
    Manufacturer: ACR
    Model: 2124
    Serial Number: ...
    Made in: week 13 of 2022
  Basic Display Parameters & Features:
    Digital display
    Bits per primary color channel: 10
    DisplayPort interface
    Maximum image size: 70 cm x 39 cm
    Gamma: 2.20
    DPMS levels: Off
    Supported color formats: RGB 4:4:4, YCrCb 4:4:4, YCrCb 4:2:2
    First detailed timing includes the native pixel format and preferred refresh rate
    Display is continuous frequency
  Color Characteristics:
    Red  : 0.6787, 0.3144
    Green: 0.2695, 0.6259
    Blue : 0.1455, 0.0537
    White: 0.3134, 0.3291
  Established Timings I & II:
    IBM     :   720x400    70.081663 Hz   9:5     31.467 kHz     28.320000 MHz
    DMT 0x04:   640x480    59.940476 Hz   4:3     31.469 kHz     25.175000 MHz
    Apple   :   640x480    66.666667 Hz   4:3     35.000 kHz     30.240000 MHz
    DMT 0x05:   640x480    72.808802 Hz   4:3     37.861 kHz     31.500000 MHz
    DMT 0x06:   640x480    75.000000 Hz   4:3     37.500 kHz     31.500000 MHz
    DMT 0x08:   800x600    56.250000 Hz   4:3     35.156 kHz     36.000000 MHz
    DMT 0x09:   800x600    60.316541 Hz   4:3     37.879 kHz     40.000000 MHz
    DMT 0x0a:   800x600    72.187572 Hz   4:3     48.077 kHz     50.000000 MHz
    DMT 0x0b:   800x600    75.000000 Hz   4:3     46.875 kHz     49.500000 MHz
    Apple   :   832x624    74.551266 Hz   4:3     49.726 kHz     57.284000 MHz
    DMT 0x10:  1024x768    60.003840 Hz   4:3     48.363 kHz     65.000000 MHz
    DMT 0x11:  1024x768    70.069359 Hz   4:3     56.476 kHz     75.000000 MHz
    DMT 0x12:  1024x768    75.028582 Hz   4:3     60.023 kHz     78.750000 MHz
    DMT 0x24:  1280x1024   75.024675 Hz   5:4     79.976 kHz    135.000000 MHz
    Apple   :  1152x870    75.061550 Hz 192:145   68.681 kHz    100.000000 MHz
  Standard Timings:
    DMT 0x15:  1152x864    75.000000 Hz   4:3     67.500 kHz    108.000000 MHz
    DMT 0x20:  1280x960    60.000000 Hz   4:3     60.000 kHz    108.000000 MHz
    DMT 0x23:  1280x1024   60.019740 Hz   5:4     63.981 kHz    108.000000 MHz
    DMT 0x55:  1280x720    60.000000 Hz  16:9     45.000 kHz     74.250000 MHz
    GTF     :  1024x768   119.999931 Hz   4:3     98.760 kHz    139.054000 MHz
    DMT 0x2f:  1440x900    59.887445 Hz  16:10    55.935 kHz    106.500000 MHz
    DMT 0x3a:  1680x1050   59.954250 Hz  16:10    65.290 kHz    146.250000 MHz
    DMT 0x52:  1920x1080   60.000000 Hz  16:9     67.500 kHz    148.500000 MHz
  Detailed Timing Descriptors:
    DTD 1:  3840x2160   59.996625 Hz  16:9    133.312 kHz    533.250000 MHz (697 mm x 392 mm)
                 Hfront   48 Hsync  32 Hback   80 Hpol P
                 Vfront    3 Vsync   5 Vback   54 Vpol N
    Display Product Serial Number: ...
    Display Range Limits:
      Monitor ranges (Bare Limits): 48-144 Hz V, 338-338 kHz H, max dotclock 1360 MHz
    Display Product Name: 'XV322QK KV'
  Extension blocks: 2
Checksum: 0xa4

----------------

Block 1, CTA-861 Extension Block:
  Revision: 3
  Underscans IT Video Formats by default
  Basic audio support
  Supports YCbCr 4:4:4
  Supports YCbCr 4:2:2
  Native detailed modes: 1
  Video Data Block:
    VIC   1:   640x480    59.940476 Hz   4:3     31.469 kHz     25.175000 MHz
    VIC   2:   720x480    59.940060 Hz   4:3     31.469 kHz     27.000000 MHz
    VIC   3:   720x480    59.940060 Hz  16:9     31.469 kHz     27.000000 MHz
    VIC   4:  1280x720    60.000000 Hz  16:9     45.000 kHz     74.250000 MHz
    VIC  16:  1920x1080   60.000000 Hz  16:9     67.500 kHz    148.500000 MHz (native)
    VIC  17:   720x576    50.000000 Hz   4:3     31.250 kHz     27.000000 MHz
    VIC  19:  1280x720    50.000000 Hz  16:9     37.500 kHz     74.250000 MHz
    VIC  31:  1920x1080   50.000000 Hz  16:9     56.250 kHz    148.500000 MHz
    VIC  63:  1920x1080  120.000000 Hz  16:9    135.000 kHz    297.000000 MHz
    VIC  97:  3840x2160   60.000000 Hz  16:9    135.000 kHz    594.000000 MHz
    VIC 118:  3840x2160  120.000000 Hz  16:9    270.000 kHz   1188.000000 MHz
  Audio Data Block:
    Linear PCM:
      Max channels: 2
      Supported sample rates (kHz): 48 44.1 32
      Supported sample sizes (bits): 24 20 16
  Speaker Allocation Data Block:
    FL/FR - Front Left/Right
  Video Capability Data Block:
    YCbCr quantization: Selectable (via AVI YQ)
    RGB quantization: Selectable (via AVI Q)
    PT scan behavior: No Data
    IT scan behavior: IT video formats not supported
    CE scan behavior: CE video formats not supported
  Vendor-Specific Data Block (HDMI), OUI 00-0C-03:
    Source physical address: 1.0.0.0
  Vendor-Specific Data Block (AMD), OUI 00-00-1A:
    Version: 2.1
    Minimum Refresh Rate: 48 Hz
    Maximum Refresh Rate: 144 Hz
    Flags 1.x: 0x00
    Flags 2.x: 0x00
    Maximum luminance: 0 (50.000 cd/m^2)
    Minimum luminance: 0 (0.000 cd/m^2)
    Unknown: 0x00 0x00
  Colorimetry Data Block:
    xvYCC601
    xvYCC709
    BT2020YCC
    BT2020RGB
    Gamut Boundary Description Metadata Profile P0
  HDR Static Metadata Data Block:
    Electro optical transfer functions:
      Traditional gamma - SDR luminance range
      SMPTE ST2084
    Supported static metadata descriptors:
      Static metadata type 1
    Desired content max luminance: 98 (417.710 cd/m^2)
    Desired content max frame-average luminance: 98 (417.710 cd/m^2)
    Desired content min luminance: 27 (0.047 cd/m^2)
  Detailed Timing Descriptors:
    DTD 2:  2560x1440  143.911545 Hz  16:9    222.056 kHz    592.000000 MHz (697 mm x 392 mm)
                 Hfront    8 Hsync  32 Hback   66 Hpol P
                 Vfront   25 Vsync   8 Vback   70 Vpol N
    DTD 3:  2560x1440  119.997589 Hz  16:9    182.996 kHz    497.750000 MHz (697 mm x 392 mm)
                 Hfront   48 Hsync  32 Hback   80 Hpol P
                 Vfront    3 Vsync   5 Vback   77 Vpol P
Checksum: 0x64  Unused space in Extension Block: 33 bytes

----------------

Block 2, DisplayID Extension Block:
  Version: 1.2
  Extension Count: 0
  Display Product Type: Extension Section
  Video Timing Modes Type 1 - Detailed Timings Data Block:
    DTD:  3840x2160  144.003819 Hz  16:9    329.337 kHz   1291.000000 MHz (aspect 16:9, no 3D stereo)
               Hfront    8 Hsync  32 Hback   40 Hpol N
               Vfront  113 Vsync   8 Vback    6 Vpol N
    DTD:  3840x2160  119.910229 Hz  16:9    274.235 kHz   1075.000000 MHz (aspect 16:9, no 3D stereo)
               Hfront    8 Hsync  32 Hback   40 Hpol N
               Vfront  113 Vsync   8 Vback    6 Vpol N
    DTD:  2560x1440   59.950550 Hz  16:9     88.787 kHz    241.500000 MHz (aspect 16:9, no 3D stereo)
               Hfront   47 Hsync  32 Hback   81 Hpol P
               Vfront    3 Vsync   5 Vback   33 Vpol N
  Checksum: 0x81
Checksum: 0x90

----------------

Block 3, Unknown EDID Extension Block 0x00:
  00 ff ff ff ff ff ff 00 04 72 4c 08 4f ee 31 21 '.........rL.O.1!'
  0d 20 01 04 b5 46 27 78 3b e1 75 ad 50 45 a0 25 '. ...F'x;.u.PE.%'
  0d 50 54 bf ef 80 71 4f 81 40 81 80 81 c0 61 7c '.PT...qO.@....a|'
  95 00 b3 00 d1 c0 4d d0 00 a0 f0 70 3e 80 30 20 '......M....p>.0 '
  35 00 b9 88 21 00 00 1a 00 00 00 ff 00 35 32 31 '5...!........521'
  33 31 45 45 34 46 34 32 30 30 00 00 00 fd 0c 30 '31EE4F4200.....0'
  90 53 53 88 01 0a 20 20 20 20 20 20 00 00 00 fc '.SS...      ....'
  00 58 56 33 32 32 51 4b 20 4b 56 0a 20 20 02 a4 '.XV322QK KV.  ..'
Checksum: 0xa4

----------------

Block 4, CTA-861 Extension Block:
  Revision: 3
  Underscans IT Video Formats by default
  Basic audio support
  Supports YCbCr 4:4:4
  Supports YCbCr 4:2:2
  Native detailed modes: 1
  Video Data Block:
    VIC   1:   640x480    59.940476 Hz   4:3     31.469 kHz     25.175000 MHz
    VIC   2:   720x480    59.940060 Hz   4:3     31.469 kHz     27.000000 MHz
    VIC   3:   720x480    59.940060 Hz  16:9     31.469 kHz     27.000000 MHz
    VIC   4:  1280x720    60.000000 Hz  16:9     45.000 kHz     74.250000 MHz
    VIC  16:  1920x1080   60.000000 Hz  16:9     67.500 kHz    148.500000 MHz (native)
    VIC  17:   720x576    50.000000 Hz   4:3     31.250 kHz     27.000000 MHz
    VIC  19:  1280x720    50.000000 Hz  16:9     37.500 kHz     74.250000 MHz
    VIC  31:  1920x1080   50.000000 Hz  16:9     56.250 kHz    148.500000 MHz
    VIC  63:  1920x1080  120.000000 Hz  16:9    135.000 kHz    297.000000 MHz
    VIC  97:  3840x2160   60.000000 Hz  16:9    135.000 kHz    594.000000 MHz
    VIC 118:  3840x2160  120.000000 Hz  16:9    270.000 kHz   1188.000000 MHz
  Audio Data Block:
    Linear PCM:
      Max channels: 2
      Supported sample rates (kHz): 48 44.1 32
      Supported sample sizes (bits): 24 20 16
  Speaker Allocation Data Block:
    FL/FR - Front Left/Right
  Video Capability Data Block:
    YCbCr quantization: Selectable (via AVI YQ)
    RGB quantization: Selectable (via AVI Q)
    PT scan behavior: No Data
    IT scan behavior: IT video formats not supported
    CE scan behavior: CE video formats not supported
  Vendor-Specific Data Block (HDMI), OUI 00-0C-03:
    Source physical address: 1.0.0.0
  Vendor-Specific Data Block (AMD), OUI 00-00-1A:
    Version: 2.1
    Minimum Refresh Rate: 48 Hz
    Maximum Refresh Rate: 144 Hz
    Flags 1.x: 0x00
    Flags 2.x: 0x00
    Maximum luminance: 0 (50.000 cd/m^2)
    Minimum luminance: 0 (0.000 cd/m^2)
    Unknown: 0x00 0x00
  Colorimetry Data Block:
    xvYCC601
    xvYCC709
    BT2020YCC
    BT2020RGB
    Gamut Boundary Description Metadata Profile P0
  HDR Static Metadata Data Block:
    Electro optical transfer functions:
      Traditional gamma - SDR luminance range
      SMPTE ST2084
    Supported static metadata descriptors:
      Static metadata type 1
    Desired content max luminance: 98 (417.710 cd/m^2)
    Desired content max frame-average luminance: 98 (417.710 cd/m^2)
    Desired content min luminance: 27 (0.047 cd/m^2)
  Detailed Timing Descriptors:
    DTD 4:  2560x1440  143.911545 Hz  16:9    222.056 kHz    592.000000 MHz (697 mm x 392 mm)
                 Hfront    8 Hsync  32 Hback   66 Hpol P
                 Vfront   25 Vsync   8 Vback   70 Vpol N
    DTD 5:  2560x1440  119.997589 Hz  16:9    182.996 kHz    497.750000 MHz (697 mm x 392 mm)
                 Hfront   48 Hsync  32 Hback   80 Hpol P
                 Vfront    3 Vsync   5 Vback   77 Vpol P
Checksum: 0x64  Unused space in Extension Block: 33 bytes

----------------

Block 5, DisplayID Extension Block:
  Version: 1.2
  Extension Count: 0
  Video Timing Modes Type 1 - Detailed Timings Data Block:
    DTD:  3840x2160  144.003819 Hz  16:9    329.337 kHz   1291.000000 MHz (aspect 16:9, no 3D stereo)
               Hfront    8 Hsync  32 Hback   40 Hpol N
               Vfront  113 Vsync   8 Vback    6 Vpol N
    DTD:  3840x2160  119.910229 Hz  16:9    274.235 kHz   1075.000000 MHz (aspect 16:9, no 3D stereo)
               Hfront    8 Hsync  32 Hback   40 Hpol N
               Vfront  113 Vsync   8 Vback    6 Vpol N
    DTD:  2560x1440   59.950550 Hz  16:9     88.787 kHz    241.500000 MHz (aspect 16:9, no 3D stereo)
               Hfront   47 Hsync  32 Hback   81 Hpol P
               Vfront    3 Vsync   5 Vback   33 Vpol N
  Checksum: 0x81
Checksum: 0x90

----------------

Warnings:

Block 1, CTA-861 Extension Block:
  Video Capability Data Block: IT scan behavior is expected to support underscanned.
  Video Capability Data Block: 'CE video formats not supported' makes no sense.
  Colorimetry Data Block: Set the sRGB colorimetry bit to avoid interop issues.
  Display Product Serial Number is set, so the Serial Number in the Base EDID should be 0.
Block 4, CTA-861 Extension Block:
  Video Capability Data Block: IT scan behavior is expected to support underscanned.
  Video Capability Data Block: 'CE video formats not supported' makes no sense.
  Colorimetry Data Block: Set the sRGB colorimetry bit to avoid interop issues.
  Display Product Serial Number is set, so the Serial Number in the Base EDID should be 0.
EDID:
  Base EDID: Some timings are out of range of the Monitor Ranges:
    Horizontal Freq: 31.250 - 329.336 kHz (Monitor: 338.000 - 338.000 kHz)

Failures:

Block 1, CTA-861 Extension Block:
  Vendor-Specific Data Block (HDMI), OUI 00-0C-03: The HDMI Specification requires EDID 1.3 instead of 1.4.
Block 2, DisplayID Extension Block:
  DisplayID Base Block has no product type.
  Expected 0 DisplayID Extension Block, but got 1.
Block 3, Base EDID:
  Unknown Extension Block.
Block 4, CTA-861 Extension Block:
  Video Data Block: Duplicate VIC 1.
  Video Data Block: Duplicate VIC 2.
  Video Data Block: Duplicate VIC 3.
  Video Data Block: Duplicate VIC 4.
  Video Data Block: Duplicate VIC 16.
  Video Data Block: Duplicate VIC 17.
  Video Data Block: Duplicate VIC 19.
  Video Data Block: Duplicate VIC 31.
  Video Data Block: Duplicate VIC 63.
  Video Data Block: Duplicate VIC 97.
  Video Data Block: Duplicate VIC 118.
  Speaker Allocation Data Block: Only one instance of this Data Block is allowed.
  Video Capability Data Block: Only one instance of this Data Block is allowed.
  Vendor-Specific Data Block (HDMI), OUI 00-0C-03: The HDMI Specification requires EDID 1.3 instead of 1.4.
  Colorimetry Data Block: Only one instance of this Data Block is allowed.
  HDR Static Metadata Data Block: Only one instance of this Data Block is allowed.
EDID:
  Base EDID: EDID specified 2 extension block(s), but found 5 extension block(s).
  CTA-861: Native progressive timings are a mix of several resolutions.
  DisplayID: Missing DisplayID Product Identification Data Block.
  DisplayID: DisplayID expects at least one preferred timing.

EDID conformity: FAIL
