edid-decode (hex):

00 ff ff ff ff ff ff 00 15 93 00 24 01 00 00 00
28 1d 01 03 08 35 1d 78 ea 2d 36 a7 54 38 ae 26
0d 4f 54 bf cf 00 61 40 81 80 81 c0 8b c0 a9 c0
d1 c0 01 01 01 01 02 3a 80 18 71 38 2d 40 58 2c
45 00 0f 28 21 00 00 1a 2a 44 80 a0 70 38 27 40
30 2c 45 00 70 cf 10 00 00 1c 66 21 56 aa 51 00
1e 30 46 8f 33 00 99 e6 10 00 00 1c 00 00 00 fc
00 45 32 34 42 33 32 30 0a 20 20 20 20 20 00 91

----------------

Block 0, Base EDID:
  EDID Structure Version & Revision: 1.3
  Vendor & Product Identification:
    Manufacturer: ELS
    Model: 9216
    Serial Number: ...
    Made in: week 40 of 2019
  Basic Display Parameters & Features:
    Analog display
    Signal Level Standard: 0.700 : 0.300 : 1.000 V p-p
    Blank level equals black level
    Sync: Separate
    Maximum image size: 53 cm x 29 cm
    Gamma: 2.20
    DPMS levels: Standby Suspend Off
    RGB color display
    First detailed timing is the preferred timing
  Color Characteristics:
    Red  : 0.6523, 0.3300
    Green: 0.2216, 0.6806
    Blue : 0.1484, 0.0537
    White: 0.3095, 0.3300
  Established Timings I & II:
    IBM     :   720x400    70.081663 Hz   9:5     31.467 kHz     28.320000 MHz
    DMT 0x04:   640x480    59.940476 Hz   4:3     31.469 kHz     25.175000 MHz
    Apple   :   640x480    66.666667 Hz   4:3     35.000 kHz     30.240000 MHz
    DMT 0x05:   640x480    72.808802 Hz   4:3     37.861 kHz     31.500000 MHz
    DMT 0x06:   640x480    75.000000 Hz   4:3     37.500 kHz     31.500000 MHz
    DMT 0x08:   800x600    56.250000 Hz   4:3     35.156 kHz     36.000000 MHz
    DMT 0x09:   800x600    60.316541 Hz   4:3     37.879 kHz     40.000000 MHz
    DMT 0x0a:   800x600    72.187572 Hz   4:3     48.077 kHz     50.000000 MHz
    DMT 0x0b:   800x600    75.000000 Hz   4:3     46.875 kHz     49.500000 MHz
    DMT 0x10:  1024x768    60.003840 Hz   4:3     48.363 kHz     65.000000 MHz
    DMT 0x11:  1024x768    70.069359 Hz   4:3     56.476 kHz     75.000000 MHz
    DMT 0x12:  1024x768    75.028582 Hz   4:3     60.023 kHz     78.750000 MHz
    DMT 0x24:  1280x1024   75.024675 Hz   5:4     79.976 kHz    135.000000 MHz
  Standard Timings:
    DMT 0x10:  1024x768    60.003840 Hz   4:3     48.363 kHz     65.000000 MHz
    DMT 0x23:  1280x1024   60.019740 Hz   5:4     63.981 kHz    108.000000 MHz
    DMT 0x55:  1280x720    60.000000 Hz  16:9     45.000 kHz     74.250000 MHz
    GTF     :  1360x765    60.000341 Hz  16:9     47.520 kHz     84.396000 MHz
    DMT 0x53:  1600x900    60.000000 Hz  16:9     60.000 kHz    108.000000 MHz (RB)
    DMT 0x52:  1920x1080   60.000000 Hz  16:9     67.500 kHz    148.500000 MHz
  Detailed Timing Descriptors:
    DTD 1:  1920x1080   60.000000 Hz  16:9     67.500 kHz    148.500000 MHz (527 mm x 296 mm)
                 Hfront   88 Hsync  44 Hback  148 Hpol P
                 Vfront    4 Vsync   5 Vback   36 Vpol N
    DTD 2:  1920x1080   74.972503 Hz  16:9     83.894 kHz    174.500000 MHz (368 mm x 207 mm)
                 Hfront   48 Hsync  44 Hback   68 Hpol N
                 Vfront    4 Vsync   5 Vback   30 Vpol P
    DTD 3:  1366x768    59.789541 Hz 683:384   47.712 kHz     85.500000 MHz (409 mm x 230 mm)
                 Hfront   70 Hsync 143 Hback  213 Hpol N
                 Vfront    3 Vsync   3 Vback   24 Vpol P
    Display Product Name: 'E24B320'
Checksum: 0x91

----------------

Warnings:

Block 0, Base EDID:
  Standard Timings: Standard Timing 1360x765 has a dubious odd vertical resolution.
  Detailed Timing Descriptor #1: DTD is similar but not identical to VIC 16.
  Detailed Timing Descriptor #3: DTD is similar but not identical to DMT 0x51.

Failures:

Block 0, Base EDID:
  Detailed Timing Descriptor #2: Mismatch of image size 368x207 mm vs display size 530x290 mm.
  Detailed Timing Descriptor #3: Mismatch of image size 409x230 mm vs display size 530x290 mm.
  Missing Display Range Limits Descriptor.

EDID conformity: FAIL
