edid-decode (hex):

00 ff ff ff ff ff ff 00 30 e4 1d 03 00 00 00 00
00 14 01 03 80 1a 0e 78 0a d4 e5 95 59 57 8b 28
20 50 54 00 00 00 01 01 01 01 01 01 01 01 01 01
01 01 01 01 01 01 88 1d 56 e0 50 00 18 30 30 40
47 00 00 90 10 00 00 1b 00 00 00 00 00 00 00 00
00 00 00 00 00 00 00 00 00 00 00 00 00 fe 00 4c
47 20 44 69 73 70 6c 61 79 0a 20 20 00 00 00 fe
00 4c 50 31 31 36 57 48 31 2d 54 4c 4e 31 00 07

----------------

Block 0, Base EDID:
  EDID Structure Version & Revision: 1.3
  Vendor & Product Identification:
    Manufacturer: LGD
    Model: 797
    Made in: 2010
  Basic Display Parameters & Features:
    Digital display
    Maximum image size: 26 cm x 14 cm
    Gamma: 2.20
    RGB color display
    First detailed timing is preferred timing
  Color Characteristics:
    Red  : 0.5849, 0.3486
    Green: 0.3408, 0.5429
    Blue : 0.1591, 0.1269
    White: 0.3134, 0.3291
  Established Timings I & II: none
  Standard Timings: none
  Detailed Timing Descriptors:
    DTD 1:  1366x768    60.034 Hz 683:384  47.547 kHz  75.600 MHz (256 mm x 144 mm)
                 Hfront   48 Hsync  64 Hback 112 Hpol P
                 Vfront    4 Vsync   7 Vback  13 Vpol N
    Empty Descriptor
    Alphanumeric Data String: 'LG Display'
    Alphanumeric Data String: 'LP116WH1-TLN1'
Checksum: 0x7
