edid-decode (hex):

00 ff ff ff ff ff ff 00 41 62 f8 00 01 01 40 03
22 14 01 04 08 2c 19 78 2e ee 95 a3 54 4c 99 26
0f 50 54 bf ee 80 a9 c0 71 4f 81 c0 81 00 01 01
01 01 01 01 01 01 31 2e 40 00 62 84 22 30 58 a8
35 00 bb f9 10 00 00 04 00 00 00 fd 00 37 4b 1e
50 10 00 0a 20 20 20 20 20 20 00 00 00 fc 00 56
69 73 65 6f 32 30 30 54 0a 20 20 20 00 00 00 ff
00 44 32 32 30 42 30 30 31 37 35 31 30 20 00 1c

----------------

Block 0, Base EDID:
  EDID Structure Version & Revision: 1.4
  Vendor & Product Identification:
    Manufacturer: PKB
    Model: 248
    Serial Number: ...
    Made in: week 34 of 2010
  Basic Display Parameters & Features:
    Analog display
    Input voltage level: 0.7/0.3 V
    Blank level equals black level
    Sync: Separate
    Maximum image size: 44 cm x 25 cm
    Gamma: 2.20
    DPMS levels: Off
    RGB color display
    Default (sRGB) color space is primary color space
    First detailed timing includes the native pixel format and preferred refresh rate
  Color Characteristics:
    Red  : 0.6396, 0.3300
    Green: 0.2998, 0.5996
    Blue : 0.1503, 0.0595
    White: 0.3134, 0.3291
  Established Timings I & II:
    IBM     :   720x400    70.082 Hz   9:5    31.467 kHz  28.320 MHz
    DMT 0x04:   640x480    59.940 Hz   4:3    31.469 kHz  25.175 MHz
    Apple   :   640x480    66.667 Hz   4:3    35.000 kHz  30.240 MHz
    DMT 0x05:   640x480    72.809 Hz   4:3    37.861 kHz  31.500 MHz
    DMT 0x06:   640x480    75.000 Hz   4:3    37.500 kHz  31.500 MHz
    DMT 0x08:   800x600    56.250 Hz   4:3    35.156 kHz  36.000 MHz
    DMT 0x09:   800x600    60.317 Hz   4:3    37.879 kHz  40.000 MHz
    DMT 0x0a:   800x600    72.188 Hz   4:3    48.077 kHz  50.000 MHz
    DMT 0x0b:   800x600    75.000 Hz   4:3    46.875 kHz  49.500 MHz
    Apple   :   832x624    74.551 Hz   4:3    49.726 kHz  57.284 MHz
    DMT 0x10:  1024x768    60.004 Hz   4:3    48.363 kHz  65.000 MHz
    DMT 0x11:  1024x768    70.069 Hz   4:3    56.476 kHz  75.000 MHz
    DMT 0x12:  1024x768    75.029 Hz   4:3    60.023 kHz  78.750 MHz
    Apple   :  1152x870    75.062 Hz 192:145  68.681 kHz 100.000 MHz
  Standard Timings:
    DMT 0x53:  1600x900    60.000 Hz  16:9    60.000 kHz 108.000 MHz (RB)
    DMT 0x15:  1152x864    75.000 Hz   4:3    67.500 kHz 108.000 MHz
    DMT 0x55:  1280x720    60.000 Hz  16:9    45.000 kHz  74.250 MHz
    DMT 0x1c:  1280x800    59.810 Hz  16:10   49.702 kHz  83.500 MHz
  Detailed Timing Descriptors:
    DTD 1:  1600x900    59.946 Hz  16:9    55.990 kHz 118.250 MHz (analog composite, serrate, sync-on-green, 443 mm x 249 mm)
                 Hfront   88 Hsync 168 Hback 256 Hpol N
                 Vfront    3 Vsync   5 Vback  26 Vpol N
  Display Range Limits:
    Monitor ranges (GTF): 55-75 Hz V, 30-80 kHz H, max dotclock 160 MHz
    Display Product Name: 'Viseo200T'
    Display Product Serial Number: ...
Checksum: 0x1c

----------------

Failures:

Block 0, Base EDID:
  Basic Display Parameters & Features: sRGB is signaled, but the chromaticities do not match.
  Display Range Limits: GTF can't be combined with non-continuous frequencies.
  Display Product Serial Number: One or more trailing spaces.

EDID conformity: FAIL
