edid-decode (hex):

00 ff ff ff ff ff ff 00 06 af 92 9c 00 00 00 00
12 1e 01 04 95 26 16 78 03 92 65 9f 56 59 98 28
0d 50 54 00 00 00 01 01 01 01 01 01 01 01 01 01
01 01 01 01 01 01 1c 2a 40 52 61 84 1a 30 30 20
36 00 7e d7 10 00 00 18 13 1c 40 52 61 84 1a 30
30 20 36 00 7e d7 10 00 00 18 00 00 00 00 00 00
00 00 00 00 00 00 00 00 00 00 00 00 00 00 00 02
00 10 48 ff 0f 3c 7d 12 14 31 7d 20 20 20 00 8a

----------------

Block 0, Base EDID:
  EDID Structure Version & Revision: 1.4
  Vendor & Product Identification:
    Manufacturer: AUO
    Model: 40082
    Made in: week 18 of 2020
  Basic Display Parameters & Features:
    Digital display
    Bits per primary color channel: 6
    DisplayPort interface
    Maximum image size: 38 cm x 22 cm
    Gamma: 2.20
    Supported color formats: RGB 4:4:4
    First detailed timing includes the native pixel format and preferred refresh rate
    Display is continuous frequency
  Color Characteristics:
    Red  : 0.6230, 0.3369
    Green: 0.3476, 0.5957
    Blue : 0.1572, 0.0527
    White: 0.3134, 0.3291
  Established Timings I & II: none
  Standard Timings: none
  Detailed Timing Descriptors:
    DTD 1:  1600x900    60.069 Hz  16:9    55.624 kHz 107.800 MHz (382 mm x 215 mm)
                 Hfront   48 Hsync  32 Hback 258 Hpol N
                 Vfront    3 Vsync   6 Vback  17 Vpol N
    DTD 2:  1600x900    40.048 Hz  16:9    37.085 kHz  71.870 MHz (382 mm x 215 mm)
                 Hfront   48 Hsync  32 Hback 258 Hpol N
                 Vfront    3 Vsync   6 Vback  17 Vpol N
    Empty Descriptor
    Manufacturer-Specified Display Descriptor (0x02): 00 02 00 10 48 ff 0f 3c 7d 12 14 31 7d 20 20 20 '....H..<}..1}   '
Checksum: 0x8a

----------------

Failures:

Block 0, Base EDID:
  Empty Descriptor: Use Dummy Descriptor instead of all zeroes.
  Missing Display Product Name.
  Missing Display Range Limits Descriptor.

EDID conformity: FAIL
