
EDID (hex):
00ffffffffffff0026cd876616070000
2f200103803c2278ea2a25a7564f9e25
015054254b00a9c0e100a940b3009500
d100d1c00101565e00a0a0a029503020
350055502100001a000000ff00313231
36373234373131383134000000fd0037
4c1e781e000a202020202020000000fc
00504c32373932510a202020202001b0
02032df14f9005040302011112131406
0715161f230907078301000067030c00
1000383c681a00000101304be6023a80
1871382d40582c450055502100001ed8
4c0070a0a02250182048045550210000
1a9774006ea0a0345017206808555021
00001e00000000000000000000000000
000000000000000000000000000000a8

edid-decode (hex):

00 ff ff ff ff ff ff 00 26 cd 87 66 16 07 00 00
2f 20 01 03 80 3c 22 78 ea 2a 25 a7 56 4f 9e 25
01 50 54 25 4b 00 a9 c0 e1 00 a9 40 b3 00 95 00
d1 00 d1 c0 01 01 56 5e 00 a0 a0 a0 29 50 30 20
35 00 55 50 21 00 00 1a 00 00 00 ff 00 31 32 31
36 37 32 34 37 31 31 38 31 34 00 00 00 fd 00 37
4c 1e 78 1e 00 0a 20 20 20 20 20 20 00 00 00 fc
00 50 4c 32 37 39 32 51 0a 20 20 20 20 20 01 b0

02 03 2d f1 4f 90 05 04 03 02 01 11 12 13 14 06
07 15 16 1f 23 09 07 07 83 01 00 00 67 03 0c 00
10 00 38 3c 68 1a 00 00 01 01 30 4b e6 02 3a 80
18 71 38 2d 40 58 2c 45 00 55 50 21 00 00 1e d8
4c 00 70 a0 a0 22 50 18 20 48 04 55 50 21 00 00
1a 97 74 00 6e a0 a0 34 50 17 20 68 08 55 50 21
00 00 1e 00 00 00 00 00 00 00 00 00 00 00 00 00
00 00 00 00 00 00 00 00 00 00 00 00 00 00 00 a8

----------------

Block 0, Base EDID:
  EDID Structure Version & Revision: 1.3
  Vendor & Product Identification:
    Manufacturer: IVM
    Model: 26247
    Serial Number: 1814
    Made in: week 47 of 2022
  Basic Display Parameters & Features:
    Digital display
    Maximum image size: 60 cm x 34 cm
    Gamma: 2.20
    DPMS levels: Standby Suspend Off
    RGB color display
    First detailed timing is the preferred timing
  Color Characteristics:
    Red  : 0.6523, 0.3378
    Green: 0.3105, 0.6191
    Blue : 0.1445, 0.0058
    White: 0.3134, 0.3291
  Established Timings I & II:
    DMT 0x04:   640x480    59.940476 Hz   4:3     31.469 kHz     25.175000 MHz
    DMT 0x06:   640x480    75.000000 Hz   4:3     37.500 kHz     31.500000 MHz
    DMT 0x09:   800x600    60.316541 Hz   4:3     37.879 kHz     40.000000 MHz
    DMT 0x0b:   800x600    75.000000 Hz   4:3     46.875 kHz     49.500000 MHz
    DMT 0x10:  1024x768    60.003840 Hz   4:3     48.363 kHz     65.000000 MHz
    DMT 0x12:  1024x768    75.028582 Hz   4:3     60.023 kHz     78.750000 MHz
    DMT 0x24:  1280x1024   75.024675 Hz   5:4     79.976 kHz    135.000000 MHz
  Standard Timings:
    DMT 0x53:  1600x900    60.000000 Hz  16:9     60.000 kHz    108.000000 MHz (RB)
    GTF     :  2048x1280   60.000000 Hz  16:10    79.500 kHz    221.328000 MHz
    DMT 0x33:  1600x1200   60.000000 Hz   4:3     75.000 kHz    162.000000 MHz
    DMT 0x3a:  1680x1050   59.954250 Hz  16:10    65.290 kHz    146.250000 MHz
    DMT 0x2f:  1440x900    59.887445 Hz  16:10    55.935 kHz    106.500000 MHz
    DMT 0x45:  1920x1200   59.884600 Hz  16:10    74.556 kHz    193.250000 MHz
    DMT 0x52:  1920x1080   60.000000 Hz  16:9     67.500 kHz    148.500000 MHz
  Detailed Timing Descriptors:
    DTD 1:  2560x1440   59.950550 Hz  16:9     88.787 kHz    241.500000 MHz (597 mm x 336 mm)
                 Hfront   48 Hsync  32 Hback   80 Hpol P
                 Vfront    3 Vsync   5 Vback   33 Vpol N
    Display Product Serial Number: '1216724711814'
    Display Range Limits:
      Monitor ranges (GTF): 55-76 Hz V, 30-120 kHz H, max dotclock 300 MHz
    Display Product Name: 'PL2792Q'
  Extension blocks: 1
Checksum: 0xb0

----------------

Block 1, CTA-861 Extension Block:
  Revision: 3
  Underscans IT Video Formats by default
  Basic audio support
  Supports YCbCr 4:4:4
  Supports YCbCr 4:2:2
  Native detailed modes: 1
  Video Data Block:
    VIC  16:  1920x1080   60.000000 Hz  16:9     67.500 kHz    148.500000 MHz (native)
    VIC   5:  1920x1080i  60.000000 Hz  16:9     33.750 kHz     74.250000 MHz
    VIC   4:  1280x720    60.000000 Hz  16:9     45.000 kHz     74.250000 MHz
    VIC   3:   720x480    59.940060 Hz  16:9     31.469 kHz     27.000000 MHz
    VIC   2:   720x480    59.940060 Hz   4:3     31.469 kHz     27.000000 MHz
    VIC   1:   640x480    59.940476 Hz   4:3     31.469 kHz     25.175000 MHz
    VIC  17:   720x576    50.000000 Hz   4:3     31.250 kHz     27.000000 MHz
    VIC  18:   720x576    50.000000 Hz  16:9     31.250 kHz     27.000000 MHz
    VIC  19:  1280x720    50.000000 Hz  16:9     37.500 kHz     74.250000 MHz
    VIC  20:  1920x1080i  50.000000 Hz  16:9     28.125 kHz     74.250000 MHz
    VIC   6:  1440x480i   59.940060 Hz   4:3     15.734 kHz     27.000000 MHz
    VIC   7:  1440x480i   59.940060 Hz  16:9     15.734 kHz     27.000000 MHz
    VIC  21:  1440x576i   50.000000 Hz   4:3     15.625 kHz     27.000000 MHz
    VIC  22:  1440x576i   50.000000 Hz  16:9     15.625 kHz     27.000000 MHz
    VIC  31:  1920x1080   50.000000 Hz  16:9     56.250 kHz    148.500000 MHz
  Audio Data Block:
    Linear PCM:
      Max channels: 2
      Supported sample rates (kHz): 48 44.1 32
      Supported sample sizes (bits): 24 20 16
  Speaker Allocation Data Block:
    FL/FR - Front Left/Right
  Vendor-Specific Data Block (HDMI), OUI 00-0C-03:
    Source physical address: 1.0.0.0
    DC_36bit
    DC_30bit
    DC_Y444
    Maximum TMDS clock: 300 MHz
  Vendor-Specific Data Block (AMD), OUI 00-00-1A:
    Version: 1.1
    Minimum Refresh Rate: 48 Hz
    Maximum Refresh Rate: 75 Hz
    Flags 1.x: 0xe6 (MCCS)
  Detailed Timing Descriptors:
    DTD 2:  1920x1080   60.000000 Hz  16:9     67.500 kHz    148.500000 MHz (597 mm x 336 mm)
                 Hfront   88 Hsync  44 Hback  148 Hpol P
                 Vfront    4 Vsync   5 Vback   36 Vpol P
    DTD 3:  2560x1440   49.947595 Hz  16:9     73.623 kHz    196.720000 MHz (597 mm x 336 mm)
                 Hfront   24 Hsync  32 Hback   56 Hpol P
                 Vfront   20 Vsync   8 Vback    6 Vpol N
    DTD 4:  2560x1440   74.923939 Hz  16:9    111.787 kHz    298.470000 MHz (597 mm x 336 mm)
                 Hfront   23 Hsync  32 Hback   55 Hpol P
                 Vfront   38 Vsync   8 Vback    6 Vpol P
Checksum: 0xa8  Unused space in Extension Block: 28 bytes
