edid-decode (hex):

00 ff ff ff ff ff ff 00 4d 10 8e 13 00 00 00 00
00 00 01 03 80 1e 17 78 ca 71 80 99 55 50 8d 26
25 50 54 00 00 00 a9 40 01 01 01 01 01 01 01 01
01 01 01 01 01 01 80 3e 40 00 62 b0 32 40 40 c0
13 00 30 e4 10 00 00 18 00 00 00 10 00 00 00 00
00 00 00 00 00 00 00 00 0a 20 00 00 00 10 00 00
00 00 00 00 00 00 00 00 00 00 0a 20 00 00 00 10
00 00 00 00 00 00 00 00 00 00 00 00 0a 20 00 ec

----------------

Block 0, Base EDID:
  EDID Structure Version & Revision: 1.3
  Vendor & Product Identification:
    Manufacturer: SHP
    Model: 5006
    Made in: 1990
  Basic Display Parameters & Features:
    Digital display
    Maximum image size: 30 cm x 23 cm
    Gamma: 2.20
    DPMS levels: Standby Suspend
    RGB color display
    First detailed timing is preferred timing
  Color Characteristics:
    Red  : 0.5986, 0.3349
    Green: 0.3125, 0.5517
    Blue : 0.1503, 0.1445
    White: 0.3125, 0.3281
  Established Timings I & II: none
  Standard Timings:
    DMT 0x33:  1600x1200   60.000 Hz   4:3    75.000 kHz 162.000 MHz
  Detailed Timing Descriptors:
    DTD 1:  1600x1200   60.606 Hz   4:3    75.758 kHz 160.000 MHz (304 mm x 228 mm)
                 Hfront   64 Hsync 192 Hback 256 Hpol N
                 Vfront    1 Vsync   3 Vback  46 Vpol N
    Dummy Descriptor:
    Dummy Descriptor:
    Dummy Descriptor:
Checksum: 0xec

----------------

Failures:

Block 0, Base EDID:
  Dummy Descriptor: Dummy block filled with garbage.
  Dummy Descriptor: Dummy block filled with garbage.
  Dummy Descriptor: Dummy block filled with garbage.
  Missing Display Product Name.
  Missing Display Range Limits Descriptor.

EDID conformity: FAIL
