edid-decode (hex):

00 ff ff ff ff ff ff 00 31 8c 01 00 01 00 00 00
1b 14 01 04 68 00 00 ff ea bb b9 a3 52 46 98 24
0f 48 4c af ce 01 01 01 01 01 01 01 01 01 01 01
01 01 01 01 01 01 9e 20 00 90 51 20 1f 30 48 80
36 00 d8 87 00 00 00 18 2c 26 00 90 51 20 1f 30
48 80 36 00 d8 87 00 00 00 18 e6 28 00 90 51 20
1f 30 48 80 36 00 d8 87 00 00 00 18 00 00 00 fc
00 4c 43 44 20 20 20 20 20 20 20 20 20 20 00 aa

00 ff ff ff ff ff ff 00 31 8c 01 00 01 00 00 00
1b 14 01 04 68 00 00 ff ea bb b9 a3 52 46 98 24
0f 48 4c af ce 01 01 01 01 01 01 01 01 01 01 01
01 01 01 01 01 01 9e 20 00 90 51 20 1f 30 48 80
36 00 d8 87 00 00 00 18 2c 26 00 90 51 20 1f 30
48 80 36 00 d8 87 00 00 00 18 e6 28 00 90 51 20
1f 30 48 80 36 00 d8 87 00 00 00 18 00 00 00 fc
00 4c 43 44 20 20 20 20 20 20 20 20 20 20 00 aa

----------------

Block 0, Base EDID:
  EDID Structure Version & Revision: 1.4
  Vendor & Product Identification:
    Manufacturer: LLL
    Model: 1
    Serial Number: ...
    Made in: week 27 of 2010
  Basic Display Parameters & Features:
    Analog display
    Signal Level Standard: 0.700 : 0.000 : 0.700 V p-p
    Blank level equals black level
    Sync: Separate
    Image size is variable
    Gamma is defined in an extension block
    DPMS levels: Standby Suspend Off
    RGB color display
    First detailed timing includes the native pixel format and preferred refresh rate
  Color Characteristics:
    Red  : 0.6386, 0.3232
    Green: 0.2753, 0.5966
    Blue : 0.1425, 0.0615
    White: 0.2832, 0.2978
  Established Timings I & II:
    IBM     :   720x400    70.081663 Hz   9:5     31.467 kHz     28.320000 MHz
    DMT 0x04:   640x480    59.940476 Hz   4:3     31.469 kHz     25.175000 MHz
    DMT 0x05:   640x480    72.808802 Hz   4:3     37.861 kHz     31.500000 MHz
    DMT 0x06:   640x480    75.000000 Hz   4:3     37.500 kHz     31.500000 MHz
    DMT 0x08:   800x600    56.250000 Hz   4:3     35.156 kHz     36.000000 MHz
    DMT 0x09:   800x600    60.316541 Hz   4:3     37.879 kHz     40.000000 MHz
    DMT 0x0a:   800x600    72.187572 Hz   4:3     48.077 kHz     50.000000 MHz
    DMT 0x0b:   800x600    75.000000 Hz   4:3     46.875 kHz     49.500000 MHz
    DMT 0x10:  1024x768    60.003840 Hz   4:3     48.363 kHz     65.000000 MHz
    DMT 0x11:  1024x768    70.069359 Hz   4:3     56.476 kHz     75.000000 MHz
    DMT 0x12:  1024x768    75.028582 Hz   4:3     60.023 kHz     78.750000 MHz
  Standard Timings: none
  Detailed Timing Descriptors:
    DTD 1:  1280x800    59.810326 Hz  16:10    49.702 kHz     83.500000 MHz (216 mm x 135 mm)
                 Hfront   72 Hsync 128 Hback  200 Hpol N
                 Vfront    3 Vsync   6 Vback   22 Vpol N
    DTD 2:  1280x800    69.995989 Hz  16:10    58.167 kHz     97.720000 MHz (216 mm x 135 mm)
                 Hfront   72 Hsync 128 Hback  200 Hpol N
                 Vfront    3 Vsync   6 Vback   22 Vpol N
    DTD 3:  1280x800    74.995702 Hz  16:10    62.321 kHz    104.700000 MHz (216 mm x 135 mm)
                 Hfront   72 Hsync 128 Hback  200 Hpol N
                 Vfront    3 Vsync   6 Vback   22 Vpol N
    Display Product Name: 'LCD          '
Checksum: 0xaa

----------------

Block 1, Unknown EDID Extension Block 0x00:
  00 ff ff ff ff ff ff 00 31 8c 01 00 01 00 00 00 '........1.......'
  1b 14 01 04 68 00 00 ff ea bb b9 a3 52 46 98 24 '....h.......RF.$'
  0f 48 4c af ce 01 01 01 01 01 01 01 01 01 01 01 '.HL.............'
  01 01 01 01 01 01 9e 20 00 90 51 20 1f 30 48 80 '....... ..Q .0H.'
  36 00 d8 87 00 00 00 18 2c 26 00 90 51 20 1f 30 '6.......,&..Q .0'
  48 80 36 00 d8 87 00 00 00 18 e6 28 00 90 51 20 'H.6........(..Q '
  1f 30 48 80 36 00 d8 87 00 00 00 18 00 00 00 fc '.0H.6...........'
  00 4c 43 44 20 20 20 20 20 20 20 20 20 20 00 aa '.LCD          ..'
Checksum: 0xaa

----------------

Warnings:

Block 0, Base EDID:
  Detailed Timing Descriptor #1: DTD is similar but not identical to DMT 0x1c.

Failures:

Block 0, Base EDID:
  Display Product Name: One or more trailing spaces.
Block 1, Base EDID:
  Unknown Extension Block.
EDID:
  Base EDID: The DTD max image size is 216x135mm, but the display size is not specified anywhere.
  Base EDID: EDID specified 0 extension block(s), but found 1 extension block(s).

EDID conformity: FAIL
