edid-decode (hex):

00 ff ff ff ff ff ff 00 31 8c 01 00 00 00 00 00
0c 15 01 03 08 58 31 78 0a ee 9d a3 54 4c 99 26
0f 4f 54 ab 08 00 81 c0 81 80 81 40 01 01 01 01
01 01 01 01 01 01 29 36 80 a0 70 38 1f 40 20 20
13 00 c4 8e 21 00 00 1e 66 21 50 b0 51 00 1b 30
40 70 36 00 70 ea 31 00 00 1e 54 2e 40 10 62 84
20 30 70 a0 36 00 20 46 21 00 00 1a d4 21 56 b0
51 00 23 30 40 70 36 00 70 ea 31 00 00 1e 00 d8

----------------

Block 0, Base EDID:
  EDID Structure Version & Revision: 1.3
  Vendor & Product Identification:
    Manufacturer: LLL
    Model: 1
    Made in: week 12 of 2011
  Basic Display Parameters & Features:
    Analog display
    Input voltage level: 0.7/0.3 V
    Blank level equals black level
    Sync: Separate
    Maximum image size: 88 cm x 49 cm
    Gamma: 2.20
    RGB color display
    First detailed timing is the preferred timing
  Color Characteristics:
    Red  : 0.6396, 0.3300
    Green: 0.2998, 0.5996
    Blue : 0.1503, 0.0595
    White: 0.3115, 0.3291
  Established Timings I & II:
    IBM     :   720x400    70.081663 Hz   9:5     31.467 kHz     28.320000 MHz
    DMT 0x04:   640x480    59.940476 Hz   4:3     31.469 kHz     25.175000 MHz
    DMT 0x05:   640x480    72.808802 Hz   4:3     37.861 kHz     31.500000 MHz
    DMT 0x08:   800x600    56.250000 Hz   4:3     35.156 kHz     36.000000 MHz
    DMT 0x09:   800x600    60.316541 Hz   4:3     37.879 kHz     40.000000 MHz
    DMT 0x10:  1024x768    60.003840 Hz   4:3     48.363 kHz     65.000000 MHz
  Standard Timings:
    DMT 0x55:  1280x720    60.000000 Hz  16:9     45.000 kHz     74.250000 MHz
    DMT 0x23:  1280x1024   60.019740 Hz   5:4     63.981 kHz    108.000000 MHz
    DMT 0x20:  1280x960    60.000000 Hz   4:3     60.000 kHz    108.000000 MHz
  Detailed Timing Descriptors:
    DTD 1:  1920x1080   59.998788 Hz  16:9     66.659 kHz    138.650000 MHz (708 mm x 398 mm)
                 Hfront   32 Hsync  32 Hback   96 Hpol P
                 Vfront    1 Vsync   3 Vback   27 Vpol P
    DTD 2:  1360x768    60.015162 Hz  85:48    47.712 kHz     85.500000 MHz (880 mm x 490 mm)
                 Hfront   64 Hsync 112 Hback  256 Hpol P
                 Vfront    3 Vsync   6 Vback   18 Vpol P
    DTD 3:  1600x900    59.799445 Hz  16:9     55.733 kHz    118.600000 MHz (544 mm x 326 mm)
                 Hfront  112 Hsync 160 Hback  256 Hpol P
                 Vfront    3 Vsync   6 Vback   23 Vpol N
    DTD 4:  1366x768    59.980856 Hz 683:384   48.165 kHz     86.600000 MHz (880 mm x 490 mm)
                 Hfront   64 Hsync 112 Hback  256 Hpol P
                 Vfront    3 Vsync   6 Vback   26 Vpol P
Checksum: 0xd8

----------------

Failures:

Block 0, Base EDID:
  Detailed Timing Descriptor #1: Mismatch of image size 708x398 mm vs display size 880x490 mm.
  Detailed Timing Descriptor #3: Mismatch of image size 544x326 mm vs display size 880x490 mm.
  Missing Display Product Name.
  Missing Display Range Limits Descriptor.

EDID conformity: FAIL
