edid-decode (hex):

00 ff ff ff ff ff ff 00 0d ae 14 16 00 00 00 00
10 1f 01 04 a5 22 16 78 03 28 65 97 59 54 8e 27
1e 50 54 00 00 00 01 01 01 01 01 01 01 01 01 01
01 01 01 01 01 01 42 3c 80 a0 70 b0 24 40 30 20
a6 00 58 d7 10 00 00 18 00 00 00 fd 00 28 3c 4b
4b 10 01 0a 20 20 20 20 20 20 00 00 00 fe 00 43
4d 4e 0a 20 20 20 20 20 20 20 20 20 00 00 00 fe
00 4e 31 36 30 4a 43 41 2d 45 45 4c 0a 20 00 18

----------------

Block 0, Base EDID:
  EDID Structure Version & Revision: 1.4
  Vendor & Product Identification:
    Manufacturer: CMN
    Model: 5652
    Made in: week 16 of 2021
  Basic Display Parameters & Features:
    Digital display
    Bits per primary color channel: 8
    DisplayPort interface
    Maximum image size: 34 cm x 22 cm
    Gamma: 2.20
    Supported color formats: RGB 4:4:4
    First detailed timing includes the native pixel format and preferred refresh rate
    Display is continuous frequency
  Color Characteristics:
    Red  : 0.5898, 0.3496
    Green: 0.3300, 0.5546
    Blue : 0.1533, 0.1191
    White: 0.3134, 0.3291
  Established Timings I & II: none
  Standard Timings: none
  Detailed Timing Descriptors:
    DTD 1:  1920x1200   60.002801 Hz   8:5     74.163 kHz    154.260000 MHz (344 mm x 215 mm)
                 Hfront   48 Hsync  32 Hback   80 Hpol N
                 Vfront   10 Vsync   6 Vback   20 Vpol N
    Display Range Limits:
      Monitor ranges (Bare Limits): 40-60 Hz V, 75-75 kHz H, max dotclock 160 MHz
    Alphanumeric Data String: 'CMN'
    Alphanumeric Data String: 'N160JCA-EEL'
Checksum: 0x18

----------------

Warnings:

EDID:
  Base EDID: Some timings are out of range of the Monitor Ranges:
    Horizontal Freq: 74.163 - 74.163 kHz (Monitor: 75.000 - 75.000 kHz)
    Could be due to a Monitor Range off-by-one rounding issue

Failures:

Block 0, Base EDID:
  Missing Display Product Name.

EDID conformity: FAIL
