edid-decode (hex):

00 ff ff ff ff ff ff 00 50 34 da 23 16 01 00 00
2b 11 01 03 81 46 28 78 2a 4c a4 a8 50 48 9b 24
14 48 4c 20 00 00 01 01 01 01 01 01 01 01 01 01
01 01 01 01 01 01 01 1d 00 bc 52 d0 1e 20 b8 28
55 40 c4 8e 21 00 00 1e 00 00 00 fd 00 38 4c 1f
3d 0a 00 0a 20 20 20 20 20 20 00 00 00 ff 00 47
58 4b 37 34 33 32 41 30 32 37 38 0a 00 00 00 fc
00 56 33 32 4d 43 41 4b 0a 20 20 20 20 20 01 92

02 03 19 71 46 01 11 12 93 14 15 23 09 7f 07 83
01 00 00 65 03 0c 00 10 00 01 1d 80 d0 72 1c 16
20 10 2c 25 80 c4 8e 21 00 00 9e 01 1d 00 bc 52
d0 1e 20 b8 28 55 40 c4 8e 21 00 00 1e 8c 0a d0
90 20 40 31 20 0c 40 55 00 13 8e 21 00 00 18 8c
0a a0 20 51 20 18 10 18 7e 23 00 13 8e 21 00 00
98 8c 0a d0 90 20 40 31 20 0c 40 55 00 c4 81 21
00 00 18 00 00 00 00 00 00 00 00 00 00 00 00 43

----------------

Block 0, Base EDID:
  EDID Structure Version & Revision: 1.3
  Vendor & Product Identification:
    Manufacturer: TAT
    Model: 9178
    Serial Number: ...
    Made in: week 43 of 2007
  Basic Display Parameters & Features:
    Digital display
    DFP 1.x compatible TMDS
    Maximum image size: 70 cm x 40 cm
    Gamma: 2.20
    DPMS levels: Off
    RGB color display
    First detailed timing is preferred timing
  Color Characteristics:
    Red  : 0.6572, 0.3125
    Green: 0.2841, 0.6054
    Blue : 0.1425, 0.0800
    White: 0.2822, 0.2968
  Established Timings I & II:
    DMT 0x04:   640x480    59.940 Hz   4:3    31.469 kHz  25.175 MHz
  Standard Timings: none
  Detailed Timing Descriptors:
    DTD 1:  1280x720    50.000 Hz  16:9    37.500 kHz  74.250 MHz (708 mm x 398 mm)
                 Hfront  440 Hsync  40 Hback 220 Hpol P
                 Vfront    5 Vsync   5 Vback  20 Vpol P
  Display Range Limits:
    Monitor ranges (GTF): 56-76 Hz V, 31-61 kHz H, max dotclock 100 MHz
    Display Product Serial Number: ...
    Display Product Name: 'V32MCAK'
  Extension blocks: 1
Checksum: 0x92

----------------

Block 1, CTA-861 Extension Block:
  Revision: 3
  Basic audio support
  Supports YCbCr 4:4:4
  Supports YCbCr 4:2:2
  Native detailed modes: 1
  Video Data Block:
    VIC   1:   640x480    59.940 Hz   4:3    31.469 kHz  25.175 MHz
    VIC  17:   720x576    50.000 Hz   4:3    31.250 kHz  27.000 MHz
    VIC  18:   720x576    50.000 Hz  16:9    31.250 kHz  27.000 MHz
    VIC  19:  1280x720    50.000 Hz  16:9    37.500 kHz  74.250 MHz (native)
    VIC  20:  1920x1080i  50.000 Hz  16:9    28.125 kHz  74.250 MHz
    VIC  21:  1440x576i   50.000 Hz   4:3    15.625 kHz  27.000 MHz
  Audio Data Block:
    Linear PCM:
      Max channels: 2
      Supported sample rates (kHz): 192 176.4 96 88.2 48 44.1 32
      Supported sample sizes (bits): 24 20 16
  Speaker Allocation Data Block:
    FL/FR - Front Left/Right
  Vendor-Specific Data Block (HDMI), OUI 00-0C-03:
    Source physical address: 1.0.0.0
  Detailed Timing Descriptors:
    DTD 2:  1920x1080i  50.000 Hz  16:9    28.125 kHz  74.250 MHz (708 mm x 398 mm)
                 Hfront  528 Hsync  44 Hback 148 Hpol P
                 Vfront    2 Vsync   5 Vback  15 Vpol P Vfront +0.5 Odd Field
                 Vfront    2 Vsync   5 Vback  15 Vpol P Vback  +0.5 Even Field
    DTD 3:  1280x720    50.000 Hz  16:9    37.500 kHz  74.250 MHz (708 mm x 398 mm)
                 Hfront  440 Hsync  40 Hback 220 Hpol P
                 Vfront    5 Vsync   5 Vback  20 Vpol P
    DTD 4:   720x576    50.000 Hz   5:4    31.250 kHz  27.000 MHz (531 mm x 398 mm)
                 Hfront   12 Hsync  64 Hback  68 Hpol N
                 Vfront    5 Vsync   5 Vback  39 Vpol N
    DTD 5:  1440x576i   50.000 Hz   5:2    15.625 kHz  27.000 MHz (531 mm x 398 mm)
                 Hfront   24 Hsync 126 Hback 138 Hpol N
                 Vfront    2 Vsync   3 Vback  19 Vpol N Vfront +0.5 Odd Field
                 Vfront    2 Vsync   3 Vback  19 Vpol N Vback  +0.5 Even Field
    DTD 6:   720x576    50.000 Hz   5:4    31.250 kHz  27.000 MHz (708 mm x 385 mm)
                 Hfront   12 Hsync  64 Hback  68 Hpol N
                 Vfront    5 Vsync   5 Vback  39 Vpol N
Checksum: 0x43

----------------

Warnings:

Block 1, CTA-861 Extension Block:
  Display Product Serial Number is set, so the Serial Number in the Base EDID should be 0.

Failures:

All Blocks:
  Some timings are out of range of the Monitor Ranges:
    Vertical Freq: 50.000 - 59.940 Hz (Monitor: 56.000 - 76.000 Hz)
    Horizontal Freq: 15.625 - 37.500 kHz (Monitor: 31.000 - 61.000 kHz)

EDID conformity: FAIL
