edid-decode (hex):

00 ff ff ff ff ff ff 00 06 10 9f 9c 00 00 00 00
03 13 01 03 80 1d 12 78 0a 00 00 00 00 00 00 00
00 50 54 00 00 00 01 01 01 01 01 01 01 01 01 01
01 01 01 01 01 01 52 1c 00 8f 50 20 2e 30 30 20
36 00 1e b3 10 00 00 18 00 00 00 01 00 06 10 20
00 00 00 00 00 00 00 00 0a 20 00 00 00 fe 00 4c
50 31 33 33 57 58 33 2d 54 4c 41 31 00 00 00 fe
00 43 6f 6c 6f 72 20 4c 43 44 0a 20 20 20 00 5f

----------------

Block 0, Base EDID:
  EDID Structure Version & Revision: 1.3
  Vendor & Product Identification:
    Manufacturer: APP
    Model: 40095
    Made in: week 3 of 2009
  Basic Display Parameters & Features:
    Digital display
    Maximum image size: 29 cm x 18 cm
    Gamma: 2.20
    RGB color display
    First detailed timing is the preferred timing
  Color Characteristics:
    Red  : 0.0000, 0.0000
    Green: 0.0000, 0.0000
    Blue : 0.0000, 0.0000
    White: 0.3125, 0.3281
  Established Timings I & II: none
  Standard Timings: none
  Detailed Timing Descriptors:
    DTD 1:  1280x800    60.223 Hz   8:5    50.949 kHz  72.500 MHz (286 mm x 179 mm)
                 Hfront   48 Hsync  32 Hback  63 Hpol N
                 Vfront    3 Vsync   6 Vback  37 Vpol N
    Manufacturer-Specified Display Descriptor (0x01): 00 01 00 06 10 20 00 00 00 00 00 00 00 00 0a 20 '..... ......... '
    Alphanumeric Data String: 'LP133WX3-TLA1'
    Alphanumeric Data String: 'Color LCD'
Checksum: 0x5f

----------------

Failures:

Block 0, Base EDID:
  Missing Display Product Name.
  Missing Display Range Limits Descriptor.

EDID conformity: FAIL
