
EDID (hex):
00ffffffffffff0026cd3d6611070000
1c1e0104a53c2278fb8ce5a55850a023
0b5054254b009500a9c0a900a940b300
d1c0d100e100565e00a0a0a029503020
350055502100001a000000ff00313135
34313032383031383039000000fd0028
90dede3c010a202020202020000000fc
00504c32373630510a20202020200199
020318f14b100504030201111213141f
2309070783010000e8e40050a0a06750
082098040f282100001a88bc0050a0a0
5550082078000f282100001a4c6b0050
a0a030500820280855502100001a023a
801871382d40582c45000f282100001e
0882805070384d400820f80c0f282100
001a0000000000000000000000000038

edid-decode (hex):

00 ff ff ff ff ff ff 00 26 cd 3d 66 11 07 00 00
1c 1e 01 04 a5 3c 22 78 fb 8c e5 a5 58 50 a0 23
0b 50 54 25 4b 00 95 00 a9 c0 a9 00 a9 40 b3 00
d1 c0 d1 00 e1 00 56 5e 00 a0 a0 a0 29 50 30 20
35 00 55 50 21 00 00 1a 00 00 00 ff 00 31 31 35
34 31 30 32 38 30 31 38 30 39 00 00 00 fd 00 28
90 de de 3c 01 0a 20 20 20 20 20 20 00 00 00 fc
00 50 4c 32 37 36 30 51 0a 20 20 20 20 20 01 99

02 03 18 f1 4b 10 05 04 03 02 01 11 12 13 14 1f
23 09 07 07 83 01 00 00 e8 e4 00 50 a0 a0 67 50
08 20 98 04 0f 28 21 00 00 1a 88 bc 00 50 a0 a0
55 50 08 20 78 00 0f 28 21 00 00 1a 4c 6b 00 50
a0 a0 30 50 08 20 28 08 55 50 21 00 00 1a 02 3a
80 18 71 38 2d 40 58 2c 45 00 0f 28 21 00 00 1e
08 82 80 50 70 38 4d 40 08 20 f8 0c 0f 28 21 00
00 1a 00 00 00 00 00 00 00 00 00 00 00 00 00 38

----------------

Block 0, Base EDID:
  EDID Structure Version & Revision: 1.4
  Vendor & Product Identification:
    Manufacturer: IVM
    Model: 26173
    Serial Number: 1809
    Made in: week 28 of 2020
  Basic Display Parameters & Features:
    Digital display
    Bits per primary color channel: 8
    DisplayPort interface
    Maximum image size: 60 cm x 34 cm
    Gamma: 2.20
    DPMS levels: Standby Suspend Off
    Supported color formats: RGB 4:4:4, YCrCb 4:4:4, YCrCb 4:2:2
    First detailed timing includes the native pixel format and preferred refresh rate
    Display is continuous frequency
  Color Characteristics:
    Red  : 0.6464, 0.3437
    Green: 0.3154, 0.6250
    Blue : 0.1396, 0.0449
    White: 0.3134, 0.3291
  Established Timings I & II:
    DMT 0x04:   640x480    59.940476 Hz   4:3     31.469 kHz     25.175000 MHz
    DMT 0x06:   640x480    75.000000 Hz   4:3     37.500 kHz     31.500000 MHz
    DMT 0x09:   800x600    60.316541 Hz   4:3     37.879 kHz     40.000000 MHz
    DMT 0x0b:   800x600    75.000000 Hz   4:3     46.875 kHz     49.500000 MHz
    DMT 0x10:  1024x768    60.003840 Hz   4:3     48.363 kHz     65.000000 MHz
    DMT 0x12:  1024x768    75.028582 Hz   4:3     60.023 kHz     78.750000 MHz
    DMT 0x24:  1280x1024   75.024675 Hz   5:4     79.976 kHz    135.000000 MHz
  Standard Timings:
    DMT 0x2f:  1440x900    59.887445 Hz  16:10    55.935 kHz    106.500000 MHz
    DMT 0x53:  1600x900    60.000000 Hz  16:9     60.000 kHz    108.000000 MHz (RB)
    GTF     :  1600x1000   59.999820 Hz  16:10    62.100 kHz    133.142000 MHz
    DMT 0x33:  1600x1200   60.000000 Hz   4:3     75.000 kHz    162.000000 MHz
    DMT 0x3a:  1680x1050   59.954250 Hz  16:10    65.290 kHz    146.250000 MHz
    DMT 0x52:  1920x1080   60.000000 Hz  16:9     67.500 kHz    148.500000 MHz
    DMT 0x45:  1920x1200   59.884600 Hz  16:10    74.556 kHz    193.250000 MHz
    GTF     :  2048x1280   60.000000 Hz  16:10    79.500 kHz    221.328000 MHz
  Detailed Timing Descriptors:
    DTD 1:  2560x1440   59.950550 Hz  16:9     88.787 kHz    241.500000 MHz (597 mm x 336 mm)
                 Hfront   48 Hsync  32 Hback   80 Hpol P
                 Vfront    3 Vsync   5 Vback   33 Vpol N
    Display Product Serial Number: '1154102801809'
    Display Range Limits:
      Monitor ranges (Bare Limits): 40-144 Hz V, 222-222 kHz H, max dotclock 600 MHz
    Display Product Name: 'PL2760Q'
  Extension blocks: 1
Checksum: 0x99

----------------

Block 1, CTA-861 Extension Block:
  Revision: 3
  Underscans IT Video Formats by default
  Basic audio support
  Supports YCbCr 4:4:4
  Supports YCbCr 4:2:2
  Native detailed modes: 1
  Video Data Block:
    VIC  16:  1920x1080   60.000000 Hz  16:9     67.500 kHz    148.500000 MHz
    VIC   5:  1920x1080i  60.000000 Hz  16:9     33.750 kHz     74.250000 MHz
    VIC   4:  1280x720    60.000000 Hz  16:9     45.000 kHz     74.250000 MHz
    VIC   3:   720x480    59.940060 Hz  16:9     31.469 kHz     27.000000 MHz
    VIC   2:   720x480    59.940060 Hz   4:3     31.469 kHz     27.000000 MHz
    VIC   1:   640x480    59.940476 Hz   4:3     31.469 kHz     25.175000 MHz
    VIC  17:   720x576    50.000000 Hz   4:3     31.250 kHz     27.000000 MHz
    VIC  18:   720x576    50.000000 Hz  16:9     31.250 kHz     27.000000 MHz
    VIC  19:  1280x720    50.000000 Hz  16:9     37.500 kHz     74.250000 MHz
    VIC  20:  1920x1080i  50.000000 Hz  16:9     28.125 kHz     74.250000 MHz
    VIC  31:  1920x1080   50.000000 Hz  16:9     56.250 kHz    148.500000 MHz
  Audio Data Block:
    Linear PCM:
      Max channels: 2
      Supported sample rates (kHz): 48 44.1 32
      Supported sample sizes (bits): 24 20 16
  Speaker Allocation Data Block:
    FL/FR - Front Left/Right
  Detailed Timing Descriptors:
    DTD 2:  2560x1440  143.855928 Hz  16:9    221.970 kHz    586.000000 MHz (527 mm x 296 mm)
                 Hfront    8 Hsync  32 Hback   40 Hpol P
                 Vfront   25 Vsync   8 Vback   70 Vpol N
    DTD 3:  2560x1440  119.880775 Hz  16:9    182.818 kHz    482.640000 MHz (527 mm x 296 mm)
                 Hfront    8 Hsync  32 Hback   40 Hpol P
                 Vfront    7 Vsync   8 Vback   70 Vpol N
    DTD 4:  2560x1440   69.923021 Hz  16:9    104.045 kHz    274.680000 MHz (597 mm x 336 mm)
                 Hfront    8 Hsync  32 Hback   40 Hpol P
                 Vfront   34 Vsync   8 Vback    6 Vpol N
    DTD 5:  1920x1080   60.000000 Hz  16:9     67.500 kHz    148.500000 MHz (527 mm x 296 mm)
                 Hfront   88 Hsync  44 Hback  148 Hpol P
                 Vfront    4 Vsync   5 Vback   36 Vpol P
    DTD 6:  1920x1080  143.854797 Hz  16:9    166.440 kHz    332.880000 MHz (527 mm x 296 mm)
                 Hfront    8 Hsync  32 Hback   40 Hpol P
                 Vfront   63 Vsync   8 Vback    6 Vpol N
Checksum: 0x38  Unused space in Extension Block: 13 bytes


