
EDID (hex):
00ffffffffffff0022f0193101010101
1c19010368261e782eb6f5a755529b26
0f5054a1080081808100010101010101
010101010101302a009851002a403070
1300762b1100001e000000fd00324c18
5311000a202020202020000000fc0048
502045313930690a20202020000000ff
00434e3435323830374d4d0a20200052

Extracted contents:
header:          00 ff ff ff ff ff ff 00
serial number:   22 f0 19 31 01 01 01 01 1c 19
version:         01 03
basic params:    68 26 1e 78 2e
chroma info:     b6 f5 a7 55 52 9b 26 0f 50 54
established:     a1 08 00
standard:        81 80 81 00 01 01 01 01 01 01 01 01 01 01 01 01
descriptor 1:    30 2a 00 98 51 00 2a 40 30 70 13 00 76 2b 11 00 00 1e
descriptor 2:    00 00 00 fd 00 32 4c 18 53 11 00 0a 20 20 20 20 20 20
descriptor 3:    00 00 00 fc 00 48 50 20 45 31 39 30 69 0a 20 20 20 20
descriptor 4:    00 00 00 ff 00 43 4e 34 35 32 38 30 37 4d 4d 0a 20 20
extensions:      00
checksum:        52

EDID version: 1.3
Manufacturer: HWP Model 3119 Serial Number --
Made in week 28 of 2015
Analog display, Input voltage level: 0.7/0.7 V
Sync: Separate 
Maximum image size: 38 cm x 30 cm
Gamma: 2.20
DPMS levels: Off
RGB color display
Default (sRGB) color space is primary color space
First detailed timing is preferred timing
Display x,y Chromaticity:
  Red:   0.6542, 0.3349
  Green: 0.3212, 0.6074
  Blue:  0.1513, 0.0615
  White: 0.3134, 0.3291
Established timings supported:
  720x400@70Hz 9:5 HorFreq: 31469 Hz Clock: 28.320 MHz
  640x480@60Hz 4:3 HorFreq: 31469 Hz Clock: 25.175 MHz
  800x600@60Hz 4:3 HorFreq: 37900 Hz Clock: 40.000 MHz
  1024x768@60Hz 4:3 HorFreq: 48400 Hz Clock: 65.000 MHz
Standard timings supported:
  1280x1024@60Hz 5:4 HorFreq: 64000 Hz Clock: 108.000 MHz
  1280x800@60Hz 16:10
Detailed mode: Clock 108.000 MHz, 374 mm x 299 mm
               1280 1328 1440 1688 hborder 0
               1024 1025 1028 1066 vborder 0
               +hsync +vsync 
               VertFreq: 60 Hz, HorFreq: 63981 Hz
Monitor ranges (GTF): 50-76Hz V, 24-83kHz H, max dotclock 170MHz
Monitor name: HP E190i
Serial number: --
Checksum: 0x52 (valid)
EDID block does NOT conform to EDID 1.3!
	sRGB is signaled, but the chromaticities do not match
