edid-decode (hex):

00 ff ff ff ff ff ff 00 1a b3 37 08 00 00 00 00
2b 19 01 03 80 2f 1e 78 2a a8 15 a2 56 55 a0 28
0b 50 54 a5 4b 00 81 c0 81 80 95 00 a9 c0 01 01
01 01 01 01 01 01 21 39 90 30 62 1a 27 40 68 b0
36 00 da 28 11 00 00 1c 00 00 00 fd 00 38 4c 1e
52 11 00 0a 20 20 20 20 20 20 00 00 00 fc 00 42
32 32 57 2d 37 20 4c 45 44 0a 20 20 00 00 00 ff
00 59 56 36 57 35 31 39 33 38 32 0a 20 20 00 e7

00 ff ff ff ff ff ff 00 1a b3 37 08 00 00 00 00
2b 19 01 03 80 2f 1e 78 2a a8 15 a2 56 55 a0 28
0b 50 54 a5 4b 00 81 c0 81 80 95 00 a9 c0 01 01
01 01 01 01 01 01 21 39 90 30 62 1a 27 40 68 b0
36 00 da 28 11 00 00 1c 00 00 00 fd 00 38 4c 1e
52 11 00 0a 20 20 20 20 20 20 00 00 00 fc 00 42
32 32 57 2d 37 20 4c 45 44 0a 20 20 00 00 00 ff
00 59 56 36 57 35 31 39 33 38 32 0a 20 20 00 e7

----------------

Block 0, Base EDID:
  EDID Structure Version & Revision: 1.3
  Vendor & Product Identification:
    Manufacturer: FUS
    Model: 2103
    Made in: week 43 of 2015
  Basic Display Parameters & Features:
    Digital display
    Maximum image size: 47 cm x 30 cm
    Gamma: 2.20
    DPMS levels: Off
    RGB color display
    First detailed timing is the preferred timing
  Color Characteristics:
    Red  : 0.6347, 0.3378
    Green: 0.3339, 0.6250
    Blue : 0.1562, 0.0439
    White: 0.3134, 0.3291
  Established Timings I & II:
    IBM     :   720x400    70.081663 Hz   9:5     31.467 kHz     28.320000 MHz
    DMT 0x04:   640x480    59.940476 Hz   4:3     31.469 kHz     25.175000 MHz
    DMT 0x06:   640x480    75.000000 Hz   4:3     37.500 kHz     31.500000 MHz
    DMT 0x09:   800x600    60.316541 Hz   4:3     37.879 kHz     40.000000 MHz
    DMT 0x0b:   800x600    75.000000 Hz   4:3     46.875 kHz     49.500000 MHz
    DMT 0x10:  1024x768    60.003840 Hz   4:3     48.363 kHz     65.000000 MHz
    DMT 0x12:  1024x768    75.028582 Hz   4:3     60.023 kHz     78.750000 MHz
    DMT 0x24:  1280x1024   75.024675 Hz   5:4     79.976 kHz    135.000000 MHz
  Standard Timings:
    DMT 0x55:  1280x720    60.000000 Hz  16:9     45.000 kHz     74.250000 MHz
    DMT 0x23:  1280x1024   60.019740 Hz   5:4     63.981 kHz    108.000000 MHz
    DMT 0x2f:  1440x900    59.887445 Hz  16:10    55.935 kHz    106.500000 MHz
    DMT 0x53:  1600x900    60.000000 Hz  16:9     60.000 kHz    108.000000 MHz (RB)
  Detailed Timing Descriptors:
    DTD 1:  1680x1050   59.954250 Hz  16:10    65.290 kHz    146.250000 MHz (474 mm x 296 mm)
                 Hfront  104 Hsync 176 Hback  280 Hpol N
                 Vfront    3 Vsync   6 Vback   30 Vpol P
    Display Range Limits:
      Monitor ranges (GTF): 56-76 Hz V, 30-82 kHz H, max dotclock 170 MHz
    Display Product Name: 'B22W-7 LED'
    Display Product Serial Number: ...
Checksum: 0xe7

----------------

Block 1, Unknown EDID Extension Block 0x00:
  00 ff ff ff ff ff ff 00 1a b3 37 08 00 00 00 00 '..........7.....'
  2b 19 01 03 80 2f 1e 78 2a a8 15 a2 56 55 a0 28 '+..../.x*...VU.('
  0b 50 54 a5 4b 00 81 c0 81 80 95 00 a9 c0 01 01 '.PT.K...........'
  01 01 01 01 01 01 21 39 90 30 62 1a 27 40 68 b0 '......!9.0b.'@h.'
  36 00 da 28 11 00 00 1c 00 00 00 fd 00 38 4c 1e '6..(.........8L.'
  52 11 00 0a 20 20 20 20 20 20 00 00 00 fc 00 42 'R...      .....B'
  32 32 57 2d 37 20 4c 45 44 0a 20 20 00 00 00 ff '22W-7 LED.  ....'
  00 59 56 36 57 35 31 39 33 38 32 0a 20 20 00 e7 '.YV6W519382.  ..'
Checksum: 0xe7

----------------

Failures:

Block 1, Base EDID:
  Unknown Extension Block.
EDID:
  Base EDID: EDID specified 0 extension block(s), but found 1 extension block(s).

EDID conformity: FAIL
