
EDID (hex):
00ffffffffffff00220e5b3601000000
261e0103684628782a6da5a3554f9827
0f5054210800d1c0a9c081c0b3009500
810081800101023a801871382d40582c
4500bb892100001e000000fd003c3c1e
460f000a202020202020000000fc0048
50203332660a202020202020000000ff
0033434d3033383038544d0a202000a8

Extracted contents:
header:          00 ff ff ff ff ff ff 00
serial number:   22 0e 5b 36 01 00 00 00 26 1e
version:         01 03
basic params:    68 46 28 78 2a
chroma info:     6d a5 a3 55 4f 98 27 0f 50 54
established:     21 08 00
standard:        d1 c0 a9 c0 81 c0 b3 00 95 00 81 00 81 80 01 01
descriptor 1:    02 3a 80 18 71 38 2d 40 58 2c 45 00 bb 89 21 00 00 1e
descriptor 2:    00 00 00 fd 00 3c 3c 1e 46 0f 00 0a 20 20 20 20 20 20
descriptor 3:    00 00 00 fc 00 48 50 20 33 32 66 0a 20 20 20 20 20 20
descriptor 4:    00 00 00 ff 00 33 43 4d 30 33 38 30 38 54 4d 0a 20 20
extensions:      00
checksum:        a8

EDID version: 1.3
Manufacturer: HPN Model 365b Serial Number --
Made in week 38 of 2020
Analog display, Input voltage level: 0.7/0.7 V
Sync: Separate 
Maximum image size: 70 cm x 40 cm
Gamma: 2.20
DPMS levels: Off
RGB color display
First detailed timing is preferred timing
Display x,y Chromaticity:
  Red:   0.6376, 0.3339
  Green: 0.3115, 0.5947
  Blue:  0.1542, 0.0605
  White: 0.3134, 0.3291
Established timings supported:
  640x480@60Hz 4:3 HorFreq: 31469 Hz Clock: 25.175 MHz
  800x600@60Hz 4:3 HorFreq: 37900 Hz Clock: 40.000 MHz
  1024x768@60Hz 4:3 HorFreq: 48400 Hz Clock: 65.000 MHz
Standard timings supported:
  1920x1080@60Hz 16:9
  1600x900@60Hz 16:9
  1280x720@60Hz 16:9
  1680x1050@60Hz 16:10 HorFreq: 64700 Hz Clock: 119.000 MHz
  1440x900@60Hz 16:10 HorFreq: 55500 Hz Clock: 88.750 MHz
  1280x800@60Hz 16:10
  1280x1024@60Hz 5:4 HorFreq: 64000 Hz Clock: 108.000 MHz
Detailed mode: Clock 148.500 MHz, 699 mm x 393 mm
               1920 2008 2052 2200 hborder 0
               1080 1084 1089 1125 vborder 0
               +hsync +vsync 
               VertFreq: 60 Hz, HorFreq: 67500 Hz
Monitor ranges (GTF): 60-60Hz V, 30-70kHz H, max dotclock 150MHz
Monitor name: HP 32f
Serial number: --
Checksum: 0xa8 (valid)
