
EDID (hex):
00ffffffffffff004c2d6b033632494b
28120104a53722a022fe21a85337ae24
115054bfef80a94081808140714f0101
010101010101283c80a070b023403020
360026572100001a000000fd00384b1e
5111000a202020202020000000fc0053
796e634d61737465720a2020000000ff
00485333513930303035310a202000b6

Extracted contents:
header:          00 ff ff ff ff ff ff 00
serial number:   4c 2d 6b 03 36 32 49 4b 28 12
version:         01 04
basic params:    a5 37 22 a0 22
chroma info:     fe 21 a8 53 37 ae 24 11 50 54
established:     bf ef 80
standard:        a9 40 81 80 81 40 71 4f 01 01 01 01 01 01 01 01
descriptor 1:    28 3c 80 a0 70 b0 23 40 30 20 36 00 26 57 21 00 00 1a
descriptor 2:    00 00 00 fd 00 38 4b 1e 51 11 00 0a 20 20 20 20 20 20
descriptor 3:    00 00 00 fc 00 53 79 6e 63 4d 61 73 74 65 72 0a 20 20
descriptor 4:    00 00 00 ff 00 48 53 33 51 39 30 30 30 35 31 0a 20 20
extensions:      00
checksum:        b6

EDID version: 1.4
Manufacturer: SAM Model 36b Serial Number --
Made in week 40 of 2008
Digital display
8 bits per primary color channel
DisplayPort interface
Maximum image size: 55 cm x 34 cm
Gamma: 2.60
DPMS levels: Off
Supported color formats: RGB 4:4:4
First detailed timing includes the native pixel format and preferred refresh rate
Display x,y Chromaticity:
  Red:   0.6591, 0.3271
  Green: 0.2177, 0.6816
  Blue:  0.1406, 0.0683
  White: 0.3125, 0.3291
Established timings supported:
  720x400@70Hz 9:5 HorFreq: 31469 Hz Clock: 28.320 MHz
  640x480@60Hz 4:3 HorFreq: 31469 Hz Clock: 25.175 MHz
  640x480@67Hz 4:3 HorFreq: 35000 Hz Clock: 30.240 MHz
  640x480@72Hz 4:3 HorFreq: 37900 Hz Clock: 31.500 MHz
  640x480@75Hz 4:3 HorFreq: 37500 Hz Clock: 31.500 MHz
  800x600@56Hz 4:3 HorFreq: 35200 Hz Clock: 36.000 MHz
  800x600@60Hz 4:3 HorFreq: 37900 Hz Clock: 40.000 MHz
  800x600@72Hz 4:3 HorFreq: 48100 Hz Clock: 50.000 MHz
  800x600@75Hz 4:3 HorFreq: 46900 Hz Clock: 49.500 MHz
  832x624@75Hz 4:3 HorFreq: 49726 Hz Clock: 57.284 MHz
  1024x768@60Hz 4:3 HorFreq: 48400 Hz Clock: 65.000 MHz
  1024x768@70Hz 4:3 HorFreq: 56500 Hz Clock: 75.000 MHz
  1024x768@75Hz 4:3 HorFreq: 60000 Hz Clock: 78.750 MHz
  1280x1024@75Hz 5:4 HorFreq: 80000 Hz Clock: 135.000 MHz
  1152x870@75Hz 192:145 HorFreq: 67500 Hz Clock: 108.000 MHz
Standard timings supported:
  1600x1200@60Hz 4:3 HorFreq: 75000 Hz Clock: 162.000 MHz
  1280x1024@60Hz 5:4 HorFreq: 64000 Hz Clock: 108.000 MHz
  1280x960@60Hz 4:3 HorFreq: 60000 Hz Clock: 108.000 MHz
  1152x864@75Hz 4:3 HorFreq: 67500 Hz Clock: 108.000 MHz
Detailed mode: Clock 154.000 MHz, 550 mm x 343 mm
               1920 1968 2000 2080 hborder 0
               1200 1203 1209 1235 vborder 0
               +hsync -vsync 
               VertFreq: 59 Hz, HorFreq: 74038 Hz
Monitor ranges (GTF): 56-75Hz V, 30-81kHz H, max dotclock 170MHz
Monitor name: SyncMaster
Serial number: --
Checksum: 0xb6 (valid)
