edid-decode (hex):

00 ff ff ff ff ff ff 00 4c 2d 35 10 35 31 50 44
31 09 01 01 68 1c 15 70 e8 fb 89 a1 55 4b 97 24
11 48 4c ff fe 00 31 59 45 59 61 4f 01 01 01 01
01 01 01 01 01 01 10 0e 80 c0 20 e0 1d 10 38 38
13 00 0b c8 10 00 00 18 f9 15 20 f8 30 58 1f 20
20 40 13 00 0b c8 10 00 00 1e 00 00 00 fd 00 32
78 1e 3d 08 00 0a 20 20 20 20 20 20 00 00 00 ff
00 48 4d 45 4b 43 30 31 30 35 37 0a 20 20 00 31

----------------

Block 0, Base EDID:
  EDID Structure Version & Revision: 1.1
  Vendor & Product Identification:
    Manufacturer: SAM
    Model: 4149
    Serial Number: ...
    Made in: week 49 of 1999
  Basic Display Parameters & Features:
    Analog display
    Signal Level Standard: 0.700 : 0.000 : 0.700 V p-p
    Blank level equals black level
    Sync: Separate
    Maximum image size: 28 cm x 21 cm
    Gamma: 2.12
    DPMS levels: Standby Suspend Off
    RGB color display
  Color Characteristics:
    Red  : 0.6318, 0.3349
    Green: 0.2949, 0.5927
    Blue : 0.1425, 0.0664
    White: 0.2832, 0.2978
  Established Timings I & II:
    IBM     :   720x400    70.081663 Hz   9:5     31.467 kHz     28.320000 MHz
    IBM     :   720x400    87.849542 Hz   9:5     39.444 kHz     35.500000 MHz
    DMT 0x04:   640x480    59.940476 Hz   4:3     31.469 kHz     25.175000 MHz
    Apple   :   640x480    66.666667 Hz   4:3     35.000 kHz     30.240000 MHz
    DMT 0x05:   640x480    72.808802 Hz   4:3     37.861 kHz     31.500000 MHz
    DMT 0x06:   640x480    75.000000 Hz   4:3     37.500 kHz     31.500000 MHz
    DMT 0x08:   800x600    56.250000 Hz   4:3     35.156 kHz     36.000000 MHz
    DMT 0x09:   800x600    60.316541 Hz   4:3     37.879 kHz     40.000000 MHz
    DMT 0x0a:   800x600    72.187572 Hz   4:3     48.077 kHz     50.000000 MHz
    DMT 0x0b:   800x600    75.000000 Hz   4:3     46.875 kHz     49.500000 MHz
    Apple   :   832x624    74.551266 Hz   4:3     49.726 kHz     57.284000 MHz
    DMT 0x0f:  1024x768i   86.957532 Hz   4:3     35.522 kHz     44.900000 MHz
    DMT 0x10:  1024x768    60.003840 Hz   4:3     48.363 kHz     65.000000 MHz
    DMT 0x11:  1024x768    70.069359 Hz   4:3     56.476 kHz     75.000000 MHz
    DMT 0x12:  1024x768    75.028582 Hz   4:3     60.023 kHz     78.750000 MHz
  Standard Timings:
    DMT 0x07:   640x480    85.008312 Hz   4:3     43.269 kHz     36.000000 MHz
    DMT 0x0c:   800x600    85.061274 Hz   4:3     53.674 kHz     56.250000 MHz
    DMT 0x12:  1024x768    75.028582 Hz   4:3     60.023 kHz     78.750000 MHz
  Detailed Timing Descriptors:
    DTD 1:   640x480    85.008312 Hz   4:3     43.269 kHz     36.000000 MHz (267 mm x 200 mm)
                 Hfront   56 Hsync  56 Hback   80 Hpol N
                 Vfront    1 Vsync   3 Vback   25 Vpol N
    DTD 2:   800x600    85.061274 Hz   4:3     53.674 kHz     56.250000 MHz (267 mm x 200 mm)
                 Hfront   32 Hsync  64 Hback  152 Hpol P
                 Vfront    1 Vsync   3 Vback   27 Vpol P
    Display Range Limits:
      Monitor ranges (GTF): 50-120 Hz V, 30-61 kHz H, max dotclock 80 MHz
    Display Product Serial Number: ...
Checksum: 0x31

----------------

Warnings:

Block 0, Base EDID:
  EDID Structure Version & Revision: EDID 1.1 is deprecated, do not use.

Failures:

Block 0, Base EDID:
  Detailed Timing Descriptor #1: Mismatch of image size 267x200 mm vs display size 280x210 mm.
  Detailed Timing Descriptor #2: Mismatch of image size 267x200 mm vs display size 280x210 mm.

EDID conformity: FAIL
