
EDID (hex):
00ffffffffffff004c2d351035315444
210b0101681c1570e8fb89a1554b9724
11484cfffe0031594559614f01010101
010101010101100e80c020e01d103838
13000bc810000018f91520f830581f20
204013000bc81000001e000000fd0032
781e3d08000a202020202020000000ff
00484a41523830363937350a20200038

Extracted contents:
header:          00 ff ff ff ff ff ff 00
serial number:   4c 2d 35 10 35 31 54 44 21 0b
version:         01 01
basic params:    68 1c 15 70 e8
chroma info:     fb 89 a1 55 4b 97 24 11 48 4c
established:     ff fe 00
standard:        31 59 45 59 61 4f 01 01 01 01 01 01 01 01 01 01
descriptor 1:    10 0e 80 c0 20 e0 1d 10 38 38 13 00 0b c8 10 00 00 18
descriptor 2:    f9 15 20 f8 30 58 1f 20 20 40 13 00 0b c8 10 00 00 1e
descriptor 3:    00 00 00 fd 00 32 78 1e 3d 08 00 0a 20 20 20 20 20 20
descriptor 4:    00 00 00 ff 00 48 4a 41 52 38 30 36 39 37 35 0a 20 20
extensions:      00
checksum:        38

EDID version: 1.1
Manufacturer: SAM Model 1035 Serial Number --
Analog display, Input voltage level: 0.7/0.7 V
Sync: Separate 
Maximum image size: 28 cm x 21 cm
Gamma: 2.12
DPMS levels: Standby Suspend Off
RGB color display
Display x,y Chromaticity:
  Red:   0.6318, 0.3349
  Green: 0.2949, 0.5927
  Blue:  0.1425, 0.0664
  White: 0.2832, 0.2978
Established timings supported:
  720x400@70Hz 9:5 HorFreq: 31469 Hz Clock: 28.320 MHz
  720x400@88Hz 9:5 HorFreq: 39500 Hz Clock: 35.500 MHz
  640x480@60Hz 4:3 HorFreq: 31469 Hz Clock: 25.175 MHz
  640x480@67Hz 4:3 HorFreq: 35000 Hz Clock: 30.240 MHz
  640x480@72Hz 4:3 HorFreq: 37900 Hz Clock: 31.500 MHz
  640x480@75Hz 4:3 HorFreq: 37500 Hz Clock: 31.500 MHz
  800x600@56Hz 4:3 HorFreq: 35200 Hz Clock: 36.000 MHz
  800x600@60Hz 4:3 HorFreq: 37900 Hz Clock: 40.000 MHz
  800x600@72Hz 4:3 HorFreq: 48100 Hz Clock: 50.000 MHz
  800x600@75Hz 4:3 HorFreq: 46900 Hz Clock: 49.500 MHz
  832x624@75Hz 4:3 HorFreq: 49726 Hz Clock: 57.284 MHz
  1280x768i@87Hz 5:3 HorFreq: 35522 Hz Clock: 44.900 MHz
  1024x768@60Hz 4:3 HorFreq: 48400 Hz Clock: 65.000 MHz
  1024x768@70Hz 4:3 HorFreq: 56500 Hz Clock: 75.000 MHz
  1024x768@75Hz 4:3 HorFreq: 60000 Hz Clock: 78.750 MHz
Standard timings supported:
  640x480@85Hz 4:3 HorFreq: 43300 Hz Clock: 36.000 MHz
  800x600@85Hz 4:3 HorFreq: 53700 Hz Clock: 56.250 MHz
  1024x768@75Hz 4:3 HorFreq: 60000 Hz Clock: 78.750 MHz
Detailed mode: Clock 36.000 MHz, 267 mm x 200 mm
                640  696  752  832 hborder 0
                480  481  484  509 vborder 0
               -hsync -vsync 
               VertFreq: 85 Hz, HorFreq: 43269 Hz
Detailed mode: Clock 56.250 MHz, 267 mm x 200 mm
                800  832  896 1048 hborder 0
                600  601  604  631 vborder 0
               +hsync +vsync 
               VertFreq: 85 Hz, HorFreq: 53673 Hz
Monitor ranges (GTF): 50-120Hz V, 30-61kHz H, max dotclock 80MHz
Serial number: --
Checksum: 0x38 (valid)
EDID block does NOT conform to EDID 1.0!
	Has descriptor blocks other than detailed timings
EDID block does not conform at all!
	Bad year of manufacture
