edid-decode (hex):

00 ff ff ff ff ff ff 00 38 a3 94 66 01 01 01 01
2e 10 01 03 80 2b 1b 78 ea c5 05 a3 57 4a 9c 25
12 50 54 23 08 00 81 c0 81 40 81 80 95 00 b3 00
01 01 01 01 01 01 21 39 90 30 62 1a 27 40 18 b0
36 40 b1 0e 11 00 00 1c 00 00 00 fd 00 38 3c 1f
51 0f 00 0a 20 20 20 20 20 20 00 00 00 fc 00 32
30 57 4d 47 58 32 0a 20 20 20 20 20 00 00 00 ff
00 36 59 31 30 34 34 39 34 47 41 0a 20 20 00 ce

00 ff ff ff ff ff ff 00 38 a3 94 66 01 01 01 01
2e 10 01 03 80 2b 1b 78 ea c5 05 a3 57 4a 9c 25
12 50 54 23 08 00 81 c0 81 40 81 80 95 00 b3 00
01 01 01 01 01 01 21 39 90 30 62 1a 27 40 18 b0
36 40 b1 0e 11 00 00 1c 00 00 00 fd 00 38 3c 1f
51 0f 00 0a 20 20 20 20 20 20 00 00 00 fc 00 32
30 57 4d 47 58 32 0a 20 20 20 20 20 00 00 00 ff
00 36 59 31 30 34 34 39 34 47 41 0a 20 20 00 ce

----------------

Block 0, Base EDID:
  EDID Structure Version & Revision: 1.3
  Vendor & Product Identification:
    Manufacturer: NEC
    Model: 26260
    Serial Number: ...
    Made in: week 46 of 2006
  Basic Display Parameters & Features:
    Digital display
    Maximum image size: 43 cm x 27 cm
    Gamma: 2.20
    DPMS levels: Standby Suspend Off
    RGB color display
    First detailed timing is the preferred timing
  Color Characteristics:
    Red  : 0.6396, 0.3398
    Green: 0.2900, 0.6103
    Blue : 0.1445, 0.0703
    White: 0.3134, 0.3291
  Established Timings I & II:
    DMT 0x04:   640x480    59.940476 Hz   4:3     31.469 kHz     25.175000 MHz
    DMT 0x08:   800x600    56.250000 Hz   4:3     35.156 kHz     36.000000 MHz
    DMT 0x09:   800x600    60.316541 Hz   4:3     37.879 kHz     40.000000 MHz
    DMT 0x10:  1024x768    60.003840 Hz   4:3     48.363 kHz     65.000000 MHz
  Standard Timings:
    DMT 0x55:  1280x720    60.000000 Hz  16:9     45.000 kHz     74.250000 MHz
    DMT 0x20:  1280x960    60.000000 Hz   4:3     60.000 kHz    108.000000 MHz
    DMT 0x23:  1280x1024   60.019740 Hz   5:4     63.981 kHz    108.000000 MHz
    DMT 0x2f:  1440x900    59.887445 Hz  16:10    55.935 kHz    106.500000 MHz
    DMT 0x3a:  1680x1050   59.954250 Hz  16:10    65.290 kHz    146.250000 MHz
  Detailed Timing Descriptors:
    DTD 1:  1680x1050   59.954250 Hz  16:10    65.290 kHz    146.250000 MHz (433 mm x 270 mm)
                 Hfront  280 Hsync 176 Hback  104 Hpol N
                 Vfront    3 Vsync   6 Vback   30 Vpol P
    Display Range Limits:
      Monitor ranges (GTF): 56-60 Hz V, 31-81 kHz H, max dotclock 150 MHz
    Display Product Name: '20WMGX2'
    Display Product Serial Number: ...
Checksum: 0xce

----------------

Block 1, Unknown EDID Extension Block 0x00:
  00 ff ff ff ff ff ff 00 38 a3 94 66 01 01 01 01 '........8..f....'
  2e 10 01 03 80 2b 1b 78 ea c5 05 a3 57 4a 9c 25 '.....+.x....WJ.%'
  12 50 54 23 08 00 81 c0 81 40 81 80 95 00 b3 00 '.PT#.....@......'
  01 01 01 01 01 01 21 39 90 30 62 1a 27 40 18 b0 '......!9.0b.'@..'
  36 40 b1 0e 11 00 00 1c 00 00 00 fd 00 38 3c 1f '6@...........8<.'
  51 0f 00 0a 20 20 20 20 20 20 00 00 00 fc 00 32 'Q...      .....2'
  30 57 4d 47 58 32 0a 20 20 20 20 20 00 00 00 ff '0WMGX2.     ....'
  00 36 59 31 30 34 34 39 34 47 41 0a 20 20 00 ce '.6Y104494GA.  ..'
Checksum: 0xce

----------------

Warnings:

Block 0, Base EDID:
  Detailed Timing Descriptor #1: DTD is similar but not identical to DMT 0x3a.

Failures:

Block 1, Base EDID:
  Unknown Extension Block.
EDID:
  Base EDID: EDID specified 0 extension block(s), but found 1 extension block(s).

EDID conformity: FAIL
