edid-decode (hex):

00 ff ff ff ff ff ff 00 06 af 74 14 00 00 00 00
01 0f 01 03 80 21 15 78 0a a7 e5 99 59 4f 8c 27
1d 50 54 00 00 00 01 01 01 01 01 01 01 01 01 01
01 01 01 01 01 01 c7 1b 00 a0 50 20 17 30 15 20
44 00 4b cf 10 00 00 18 26 17 00 a0 50 20 17 30
15 20 44 00 4b cf 10 00 00 00 00 00 00 fe 00 43
44 35 31 34 00 42 31 35 34 45 57 31 00 00 00 fe
00 30 41 4d 57 78 a4 cc f8 01 01 0a 20 20 00 fa

----------------

Block 0, Base EDID:
  EDID Structure Version & Revision: 1.3
  Vendor & Product Identification:
    Manufacturer: AUO
    Model: 5236
    Made in: week 1 of 2005
  Basic Display Parameters & Features:
    Digital display
    Maximum image size: 33 cm x 21 cm
    Gamma: 2.20
    RGB color display
    First detailed timing is preferred timing
  Color Characteristics:
    Red  : 0.5996, 0.3496
    Green: 0.3095, 0.5498
    Blue : 0.1552, 0.1152
    White: 0.3134, 0.3291
  Established Timings I & II: none
  Standard Timings: none
  Detailed Timing Descriptors:
    DTD 1:  1280x800    60.002 Hz   8:5    49.382 kHz  71.110 MHz (331 mm x 207 mm)
                 Hfront   21 Hsync  32 Hback 107 Hpol N
                 Vfront    4 Vsync   4 Vback  15 Vpol N
    DTD 2:  1280x800    50.003 Hz   8:5    41.153 kHz  59.260 MHz (331 mm x 207 mm)
                 Hfront   21 Hsync  32 Hback 107 Hpol N
                 Vfront    4 Vsync   4 Vback  15 Vpol N
    SPWG Module Revision: 0
    SPWG Descriptor #3:
      SPWG PC Maker P/N: 'CD514'
      SPWG LCD Supplier EEDID Revision: 0
      SPWG Manufacturer P/N: 'B154EW1'
    SPWG Descriptor #4:
      SMBUS Values: 0x30 0x41 0x4d 0x57 0x78 0xa4 0xcc 0xf8
      LVDS Channels: 1
      Panel Self Test Present
Checksum: 0xfa
