
EDID (hex):
00ffffffffffff00410c5fd040e20100
2d120103803920782a22fca354469826
104749bfee0081c08100818001010101
010101010101a91a00a0500016303020
37003f4321000018662150b051001b30
407036003f4321000018000000fd0037
4c0f440f000a202020202020000000fc
00323650464c333430342045550a01f5
020329f14f93041405020311121f1006
0715160123097f07830100006c030c00
2000001ec0080b080b8c0ad08a20e02d
10103e96003f4321000018023a801871
382d40582c25003f432100001e011d80
18711c2d20582c25003f432100009e8c
0aa01451f01600267c43003f43210000
98000000000000000000000000000022

Extracted contents:
header:          00 ff ff ff ff ff ff 00
serial number:   41 0c 5f d0 40 e2 01 00 2d 12
version:         01 03
basic params:    80 39 20 78 2a
chroma info:     22 fc a3 54 46 98 26 10 47 49
established:     bf ee 00
standard:        81 c0 81 00 81 80 01 01 01 01 01 01 01 01 01 01
descriptor 1:    a9 1a 00 a0 50 00 16 30 30 20 37 00 3f 43 21 00 00 18
descriptor 2:    66 21 50 b0 51 00 1b 30 40 70 36 00 3f 43 21 00 00 18
descriptor 3:    00 00 00 fd 00 37 4c 0f 44 0f 00 0a 20 20 20 20 20 20
descriptor 4:    00 00 00 fc 00 32 36 50 46 4c 33 34 30 34 20 45 55 0a
extensions:      01
checksum:        f5

EDID version: 1.3
Manufacturer: PHL Model d05f Serial Number --
Made in week 45 of 2008
Digital display
Maximum image size: 57 cm x 32 cm
Gamma: 2.20
DPMS levels: Off
RGB color display
First detailed timing is preferred timing
Display x,y Chromaticity:
  Red:   0.6367, 0.3300
  Green: 0.2734, 0.5957
  Blue:  0.1513, 0.0654
  White: 0.2802, 0.2851
Established timings supported:
  720x400@70Hz 9:5 HorFreq: 31469 Hz Clock: 28.320 MHz
  640x480@60Hz 4:3 HorFreq: 31469 Hz Clock: 25.175 MHz
  640x480@67Hz 4:3 HorFreq: 35000 Hz Clock: 30.240 MHz
  640x480@72Hz 4:3 HorFreq: 37900 Hz Clock: 31.500 MHz
  640x480@75Hz 4:3 HorFreq: 37500 Hz Clock: 31.500 MHz
  800x600@56Hz 4:3 HorFreq: 35200 Hz Clock: 36.000 MHz
  800x600@60Hz 4:3 HorFreq: 37900 Hz Clock: 40.000 MHz
  800x600@72Hz 4:3 HorFreq: 48100 Hz Clock: 50.000 MHz
  800x600@75Hz 4:3 HorFreq: 46900 Hz Clock: 49.500 MHz
  832x624@75Hz 4:3 HorFreq: 49726 Hz Clock: 57.284 MHz
  1024x768@60Hz 4:3 HorFreq: 48400 Hz Clock: 65.000 MHz
  1024x768@70Hz 4:3 HorFreq: 56500 Hz Clock: 75.000 MHz
  1024x768@75Hz 4:3 HorFreq: 60000 Hz Clock: 78.750 MHz
Standard timings supported:
  1280x720@60Hz 16:9
  1280x800@60Hz 16:10
  1280x1024@60Hz 5:4 HorFreq: 64000 Hz Clock: 108.000 MHz
Detailed mode: Clock 68.250 MHz, 575 mm x 323 mm
               1280 1328 1360 1440 hborder 0
                768  771  778  790 vborder 0
               -hsync -vsync 
               VertFreq: 59 Hz, HorFreq: 47395 Hz
Detailed mode: Clock 85.500 MHz, 575 mm x 323 mm
               1360 1424 1536 1792 hborder 0
                768  771  777  795 vborder 0
               -hsync -vsync 
               VertFreq: 60 Hz, HorFreq: 47712 Hz
Monitor ranges (GTF): 55-76Hz V, 15-68kHz H, max dotclock 150MHz
Monitor name: 26PFL3404 EU
Has 1 extension blocks
Checksum: 0xf5 (valid)

CTA extension block
Extension version: 3
37 bytes of CTA data
  Video data block
    VIC  19 1280x720@50Hz 16:9 (native) HorFreq: 37500 Hz Clock: 74.250 MHz
    VIC   4 1280x720@60Hz 16:9  HorFreq: 45000 Hz Clock: 74.250 MHz
    VIC  20 1920x1080i@50Hz 16:9  HorFreq: 28125 Hz Clock: 74.250 MHz
    VIC   5 1920x1080i@60Hz 16:9  HorFreq: 33750 Hz Clock: 74.250 MHz
    VIC   2 720x480@60Hz 4:3  HorFreq: 31469 Hz Clock: 27.000 MHz
    VIC   3 720x480@60Hz 16:9  HorFreq: 31469 Hz Clock: 27.000 MHz
    VIC  17 720x576@50Hz 4:3  HorFreq: 31250 Hz Clock: 27.000 MHz
    VIC  18 720x576@50Hz 16:9  HorFreq: 31250 Hz Clock: 27.000 MHz
    VIC  31 1920x1080@50Hz 16:9  HorFreq: 56250 Hz Clock: 148.500 MHz
    VIC  16 1920x1080@60Hz 16:9  HorFreq: 67500 Hz Clock: 148.500 MHz
    VIC   6 1440x480i@60Hz 4:3  HorFreq: 15734 Hz Clock: 27.000 MHz
    VIC   7 1440x480i@60Hz 16:9  HorFreq: 15734 Hz Clock: 27.000 MHz
    VIC  21 1440x576i@50Hz 4:3  HorFreq: 15625 Hz Clock: 27.000 MHz
    VIC  22 1440x576i@50Hz 16:9  HorFreq: 15625 Hz Clock: 27.000 MHz
    VIC   1 640x480@60Hz 4:3  HorFreq: 31469 Hz Clock: 25.175 MHz
  Audio data block
    Linear PCM, max channels 2
      Supported sample rates (kHz): 192 176.4 96 88.2 48 44.1 32
      Supported sample sizes (bits): 24 20 16
  Speaker allocation data block
    Speaker map:
      FL/FR - Front Left/Right
  Vendor-specific data block, OUI 000c03 (HDMI)
    Source physical address 2.0.0.0
    Maximum TMDS clock: 150MHz
    Video latency: 8
    Audio latency: 11
    Interlaced video latency: 8
    Interlaced audio latency: 11
Underscans PC formats by default
Basic audio support
Supports YCbCr 4:4:4
Supports YCbCr 4:2:2
1 native detailed modes
Detailed mode: Clock 27.000 MHz, 575 mm x 323 mm
                720  736  798  858 hborder 0
                480  489  495  525 vborder 0
               -hsync -vsync 
               VertFreq: 59 Hz, HorFreq: 31468 Hz
Detailed mode: Clock 148.500 MHz, 575 mm x 323 mm
               1920 2008 2052 2200 hborder 0
               1080 1082 1087 1125 vborder 0
               +hsync +vsync 
               VertFreq: 60 Hz, HorFreq: 67500 Hz
Detailed mode: Clock 74.250 MHz, 575 mm x 323 mm
               1920 2008 2052 2200 hborder 0
                540  542  547  585 vborder 0
               +hsync +vsync interlaced 
               VertFreq: 57 Hz, HorFreq: 33750 Hz
Detailed mode: Clock 27.000 MHz, 575 mm x 323 mm
               1440 1478 1602 1716 hborder 0
                240  244  247  262 vborder 0
               -hsync -vsync interlaced 
               VertFreq: 60 Hz, HorFreq: 15734 Hz
Checksum: 0x22 (valid)

One or more of the timings is out of range of the Monitor Ranges:
  Vertical Freq: 50 - 75 Hz
  Horizontal Freq: 15625 - 67500 Hz
  Maximum Clock: 148.500 MHz
