edid-decode (hex):

00 ff ff ff ff ff ff 00 30 e4 01 46 00 00 00 00
00 12 01 13 90 1d 12 78 0a 1e 85 96 5a 55 8c 26
1f 50 54 00 00 00 01 01 01 01 01 01 01 01 01 01
01 01 01 01 01 01 f4 1a 00 82 50 20 10 30 30 20
36 00 1e b3 10 00 00 18 84 12 00 a0 50 20 17 30
30 20 36 00 1e b3 10 00 00 18 00 00 00 fe 00 57
55 39 37 33 80 31 33 33 57 58 32 0a 00 00 00 fe
00 08 0e 14 19 33 5d 7f ff 01 01 0a 20 20 00 c2

----------------

Block 0, Base EDID:
  EDID Structure Version & Revision: 1.19
  Vendor & Product Identification:
    Manufacturer: LGD
    Model: 17921
    Made in: 2008
  Basic Display Parameters & Features:
    Digital display
    Bits per primary color channel: 6
    Digital interface is not defined
    Maximum image size: 29 cm x 18 cm
    Gamma: 2.20
    Supported color formats: RGB 4:4:4, YCrCb 4:4:4
    First detailed timing includes the native pixel format and preferred refresh rate
  Color Characteristics:
    Red  : 0.5859, 0.3525
    Green: 0.3349, 0.5488
    Blue : 0.1503, 0.1210
    White: 0.3134, 0.3291
  Established Timings I & II: none
  Standard Timings: none
  Detailed Timing Descriptors:
    DTD 1:  1280x800    59.971 Hz   8:5    48.936 kHz  69.000 MHz (286 mm x 179 mm)
                 Hfront   48 Hsync  32 Hback  50 Hpol N
                 Vfront    3 Vsync   6 Vback   7 Vpol N
    DTD 2:  1280x800    39.996 Hz   8:5    32.917 kHz  47.400 MHz (286 mm x 179 mm)
                 Hfront   48 Hsync  32 Hback  80 Hpol N
                 Vfront    3 Vsync   6 Vback  14 Vpol N
    SPWG Module Revision: 24
    SPWG Descriptor #3:
      SPWG PC Maker P/N: 'WU973'
      SPWG LCD Supplier EEDID Revision: 128
      SPWG Manufacturer P/N: '133WX2'
    SPWG Descriptor #4:
      SMBUS Values: 0x08 0x0e 0x14 0x19 0x33 0x5d 0x7f 0xff
      LVDS Channels: 1
      Panel Self Test Present
Checksum: 0xc2

----------------

Warnings:

Block 0, Base EDID:
  EDID Structure Version & Revision: Unknown EDID minor version 19, assuming 1.4 conformance.

Failures:

Block 0, Base EDID:
  Missing Display Product Name.

EDID conformity: FAIL
