edid-decode (hex):

00 ff ff ff ff ff ff 00 30 ae d1 40 00 00 00 00
01 15 01 03 80 1a 0e 78 ea 99 85 95 55 56 92 28
22 50 54 00 00 00 01 01 01 01 01 01 01 01 01 01
01 01 01 01 01 01 58 1b 56 3c 50 00 32 30 18 10
24 00 00 90 10 00 00 18 c9 16 56 3c 50 00 32 30
18 10 24 00 00 90 10 00 00 18 00 00 00 0f 00 8c
09 3c 8c 09 32 14 09 00 06 af 56 31 00 00 00 fe
00 42 31 31 36 58 57 30 32 20 56 31 20 0a 00 69

----------------

Block 0, Base EDID:
  EDID Structure Version & Revision: 1.3
  Vendor & Product Identification:
    Manufacturer: LEN
    Model: 16593
    Made in: week 1 of 2011
  Basic Display Parameters & Features:
    Digital display
    Maximum image size: 26 cm x 14 cm
    Gamma: 2.20
    DPMS levels: Standby Suspend Off
    RGB color display
    First detailed timing is preferred timing
  Color Characteristics:
    Red  : 0.5839, 0.3330
    Green: 0.3378, 0.5712
    Blue : 0.1582, 0.1328
    White: 0.3134, 0.3291
  Established Timings I & II: none
  Standard Timings: none
  Detailed Timing Descriptors:
    DTD 1:  1366x768    60.010 Hz 683:384  49.088 kHz  70.000 MHz (256 mm x 144 mm)
                 Hfront   24 Hsync  16 Hback  20 Hpol N
                 Vfront    2 Vsync   4 Vback  44 Vpol N
    DTD 2:  1366x768    50.006 Hz 683:384  40.905 kHz  58.330 MHz (256 mm x 144 mm)
                 Hfront   24 Hsync  16 Hback  20 Hpol N
                 Vfront    2 Vsync   4 Vback  44 Vpol N
    Manufacturer-Specified Display Descriptor (0x0f): 00 0f 00 8c 09 3c 8c 09 32 14 09 00 06 af 56 31 '.....<..2.....V1'
    Alphanumeric Data String: 'B116XW02 V1 '
Checksum: 0x69
