edid-decode (hex):

00 ff ff ff ff ff ff 00 30 ae d1 40 00 00 00 00
00 14 01 03 80 1a 0e 78 ea 99 85 95 55 56 92 28
22 50 54 00 00 00 01 01 01 01 01 01 01 01 01 01
01 01 01 01 01 01 12 1b 56 5a 50 00 19 30 30 20
36 00 00 90 10 00 00 18 8f 16 56 5a 50 00 19 30
30 20 36 00 00 90 10 00 00 18 00 00 00 0f 00 8c
09 32 8c 09 28 14 09 00 06 af 56 31 00 00 00 fe
00 42 31 31 36 58 57 30 33 20 56 31 20 0a 00 80

----------------

Block 0, Base EDID:
  EDID Structure Version & Revision: 1.3
  Vendor & Product Identification:
    Manufacturer: LEN
    Model: 16593
    Made in: 2010
  Basic Display Parameters & Features:
    Digital display
    Maximum image size: 26 cm x 14 cm
    Gamma: 2.20
    DPMS levels: Standby Suspend Off
    RGB color display
    First detailed timing is the preferred timing
  Color Characteristics:
    Red  : 0.5839, 0.3330
    Green: 0.3378, 0.5712
    Blue : 0.1582, 0.1328
    White: 0.3134, 0.3291
  Established Timings I & II: none
  Standard Timings: none
  Detailed Timing Descriptors:
    DTD 1:  1366x768    60.020 Hz 683:384  47.596 kHz  69.300 MHz (256 mm x 144 mm)
                 Hfront   48 Hsync  32 Hback  10 Hpol N
                 Vfront    3 Vsync   6 Vback  16 Vpol N
    DTD 2:  1366x768    50.017 Hz 683:384  39.663 kHz  57.750 MHz (256 mm x 144 mm)
                 Hfront   48 Hsync  32 Hback  10 Hpol N
                 Vfront    3 Vsync   6 Vback  16 Vpol N
    Manufacturer-Specified Display Descriptor (0x0f): 00 0f 00 8c 09 32 8c 09 28 14 09 00 06 af 56 31 '.....2..(.....V1'
    Alphanumeric Data String: 'B116XW03 V1 '
Checksum: 0x80

----------------

Failures:

Block 0, Base EDID:
  Alphanumeric Data String: One or more trailing spaces.
  Missing Display Product Name.
  Missing Display Range Limits Descriptor.

EDID conformity: FAIL
