edid-decode (hex):

00 ff ff ff ff ff ff 00 30 ae d1 40 00 00 00 00
00 13 01 03 80 1a 0e 78 ea 35 25 93 56 55 8e 29
1d 50 54 00 00 00 01 01 01 01 01 01 01 01 01 01
01 01 01 01 01 01 ef 1f 56 62 51 00 18 30 30 20
25 00 00 90 10 00 00 19 0d 17 56 80 50 00 16 30
30 20 25 00 00 90 10 00 00 19 00 00 00 0f 00 8c
09 3c 8c 09 32 14 09 00 4c a3 41 54 00 00 00 fe
00 4c 54 4e 31 31 36 41 54 30 31 34 30 31 00 34

----------------

Block 0, Base EDID:
  EDID Structure Version & Revision: 1.3
  Vendor & Product Identification:
    Manufacturer: LEN
    Model: 16593
    Made in: 2009
  Basic Display Parameters & Features:
    Digital display
    Maximum image size: 26 cm x 14 cm
    Gamma: 2.20
    DPMS levels: Standby Suspend Off
    RGB color display
    First detailed timing is preferred timing
  Color Characteristics:
    Red  : 0.5742, 0.3388
    Green: 0.3330, 0.5556
    Blue : 0.1601, 0.1152
    White: 0.3134, 0.3291
  Established Timings I & II: none
  Standard Timings: none
  Detailed Timing Descriptors:
    DTD 1:  1366x768    60.011 Hz 683:384  47.529 kHz  81.750 MHz (256 mm x 144 mm)
                 Hfront   48 Hsync  32 Hback 274 Hpol N
                 Vfront    2 Vsync   5 Vback  17 Vpol N
    DTD 2:  1366x768    49.997 Hz 683:384  39.498 kHz  59.010 MHz (256 mm x 144 mm)
                 Hfront   48 Hsync  32 Hback  48 Hpol N
                 Vfront    2 Vsync   5 Vback  15 Vpol N
    Manufacturer-Specified Display Descriptor (0x0f): 00 0f 00 8c 09 3c 8c 09 32 14 09 00 4c a3 41 54 '.....<..2...L.AT'
    Alphanumeric Data String: 'LTN116AT01401'
Checksum: 0x34
