
EDID (hex):
00ffffffffffff003a93000000000000
1b110103802819782a8585a6574a9c26
125054bfee009500818081c081408100
0101010101019a29a0d0518422305098
360098ff1000001c000000fc004d3139
570a2020202020202020000000fd0037
4b1e410b000a202020202020000000ff
000a2020202020202020202020200086

Extracted contents:
header:          00 ff ff ff ff ff ff 00
serial number:   3a 93 00 00 00 00 00 00 1b 11
version:         01 03
basic params:    80 28 19 78 2a
chroma info:     85 85 a6 57 4a 9c 26 12 50 54
established:     bf ee 00
standard:        95 00 81 80 81 c0 81 40 81 00 01 01 01 01 01 01
descriptor 1:    9a 29 a0 d0 51 84 22 30 50 98 36 00 98 ff 10 00 00 1c
descriptor 2:    00 00 00 fc 00 4d 31 39 57 0a 20 20 20 20 20 20 20 20
descriptor 3:    00 00 00 fd 00 37 4b 1e 41 0b 00 0a 20 20 20 20 20 20
descriptor 4:    00 00 00 ff 00 0a 20 20 20 20 20 20 20 20 20 20 20 20
extensions:      00
checksum:        86

EDID version: 1.3
Manufacturer: NTS Model 0 Serial Number --
Made in week 27 of 2007
Digital display
Maximum image size: 40 cm x 25 cm
Gamma: 2.20
DPMS levels: Off
RGB color display
First detailed timing is preferred timing
Display x,y Chromaticity:
  Red:   0.6503, 0.3398
  Green: 0.2900, 0.6103
  Blue:  0.1503, 0.0703
  White: 0.3134, 0.3291
Established timings supported:
  720x400@70Hz 9:5 HorFreq: 31469 Hz Clock: 28.320 MHz
  640x480@60Hz 4:3 HorFreq: 31469 Hz Clock: 25.175 MHz
  640x480@67Hz 4:3 HorFreq: 35000 Hz Clock: 30.240 MHz
  640x480@72Hz 4:3 HorFreq: 37900 Hz Clock: 31.500 MHz
  640x480@75Hz 4:3 HorFreq: 37500 Hz Clock: 31.500 MHz
  800x600@56Hz 4:3 HorFreq: 35200 Hz Clock: 36.000 MHz
  800x600@60Hz 4:3 HorFreq: 37900 Hz Clock: 40.000 MHz
  800x600@72Hz 4:3 HorFreq: 48100 Hz Clock: 50.000 MHz
  800x600@75Hz 4:3 HorFreq: 46900 Hz Clock: 49.500 MHz
  832x624@75Hz 4:3 HorFreq: 49726 Hz Clock: 57.284 MHz
  1024x768@60Hz 4:3 HorFreq: 48400 Hz Clock: 65.000 MHz
  1024x768@70Hz 4:3 HorFreq: 56500 Hz Clock: 75.000 MHz
  1024x768@75Hz 4:3 HorFreq: 60000 Hz Clock: 78.750 MHz
Standard timings supported:
  1440x900@60Hz 16:10 HorFreq: 55500 Hz Clock: 88.750 MHz
  1280x1024@60Hz 5:4 HorFreq: 64000 Hz Clock: 108.000 MHz
  1280x720@60Hz 16:9
  1280x960@60Hz 4:3 HorFreq: 60000 Hz Clock: 108.000 MHz
  1280x800@60Hz 16:10
Detailed mode: Clock 106.500 MHz, 408 mm x 255 mm
               1440 1520 1672 1904 hborder 0
                900  903  909  934 vborder 0
               -hsync +vsync 
               VertFreq: 59 Hz, HorFreq: 55934 Hz
Monitor name: M19W
Monitor ranges (GTF): 55-75Hz V, 30-65kHz H, max dotclock 110MHz
Serial number: 
-- 0x86 (valid)
