
EDID (hex):
00ffffffffffff0020a3573201000000
10120103806e38780a0dc9a057479827
12484cbfcf0001410141014101410141
014101410141401f56a0500016302010
4400566c4200000a401f567251001e30
6e285500c48e2100001e000000fc004c
48444e33325036394441550a000000fd
0032553c5b10000a2020202020200105
02031d764a06021511041314051f1023
0917078301000065030c0010008c0ad0
8a20e02d10103e9600138e2100001801
1d8018711c1620582c2500c48e210000
9e4b0c809020e01d1008602200721611
0000188c0aa01451f01600267c430013
8e210000980000000000000000000000
00000000000000000000000000000072

edid-decode (hex):

00 ff ff ff ff ff ff 00 20 a3 57 32 01 00 00 00
10 12 01 03 80 6e 38 78 0a 0d c9 a0 57 47 98 27
12 48 4c bf cf 00 01 41 01 41 01 41 01 41 01 41
01 41 01 41 01 41 40 1f 56 a0 50 00 16 30 20 10
44 00 56 6c 42 00 00 0a 40 1f 56 72 51 00 1e 30
6e 28 55 00 c4 8e 21 00 00 1e 00 00 00 fc 00 4c
48 44 4e 33 32 50 36 39 44 41 55 0a 00 00 00 fd
00 32 55 3c 5b 10 00 0a 20 20 20 20 20 20 01 05

02 03 1d 76 4a 06 02 15 11 04 13 14 05 1f 10 23
09 17 07 83 01 00 00 65 03 0c 00 10 00 8c 0a d0
8a 20 e0 2d 10 10 3e 96 00 13 8e 21 00 00 18 01
1d 80 18 71 1c 16 20 58 2c 25 00 c4 8e 21 00 00
9e 4b 0c 80 90 20 e0 1d 10 08 60 22 00 72 16 11
00 00 18 8c 0a a0 14 51 f0 16 00 26 7c 43 00 13
8e 21 00 00 98 00 00 00 00 00 00 00 00 00 00 00
00 00 00 00 00 00 00 00 00 00 00 00 00 00 00 72

----------------

Block 0, Base EDID:
  EDID Structure Version & Revision: 1.3
  Vendor & Product Identification:
    Manufacturer: HEC
    Model: 12887
    Serial Number: 1
    Made in: week 16 of 2008
  Basic Display Parameters & Features:
    Digital display
    Maximum image size: 110 cm x 56 cm
    Gamma: 2.20
    RGB color display
    First detailed timing is the preferred timing
  Color Characteristics:
    Red  : 0.6250, 0.3398
    Green: 0.2802, 0.5947
    Blue : 0.1552, 0.0703
    White: 0.2832, 0.2978
  Established Timings I & II:
    IBM     :   720x400    70.081663 Hz   9:5     31.467 kHz     28.320000 MHz
    DMT 0x04:   640x480    59.940476 Hz   4:3     31.469 kHz     25.175000 MHz
    Apple   :   640x480    66.666667 Hz   4:3     35.000 kHz     30.240000 MHz
    DMT 0x05:   640x480    72.808802 Hz   4:3     37.861 kHz     31.500000 MHz
    DMT 0x06:   640x480    75.000000 Hz   4:3     37.500 kHz     31.500000 MHz
    DMT 0x08:   800x600    56.250000 Hz   4:3     35.156 kHz     36.000000 MHz
    DMT 0x09:   800x600    60.316541 Hz   4:3     37.879 kHz     40.000000 MHz
    DMT 0x0a:   800x600    72.187572 Hz   4:3     48.077 kHz     50.000000 MHz
    DMT 0x0b:   800x600    75.000000 Hz   4:3     46.875 kHz     49.500000 MHz
    DMT 0x10:  1024x768    60.003840 Hz   4:3     48.363 kHz     65.000000 MHz
    DMT 0x11:  1024x768    70.069359 Hz   4:3     56.476 kHz     75.000000 MHz
    DMT 0x12:  1024x768    75.028582 Hz   4:3     60.023 kHz     78.750000 MHz
    DMT 0x24:  1280x1024   75.024675 Hz   5:4     79.976 kHz    135.000000 MHz
  Standard Timings:
  Detailed Timing Descriptors:
    DTD 1:  1366x768    66.360303 Hz 683:384   52.425 kHz     80.000000 MHz (bipolar analog composite, 1110 mm x 620 mm)
                 Hfront   32 Hsync  16 Hback  112 Hpol N
                 Vfront    4 Vsync   4 Vback   14 Vpol N
    DTD 2:  1366x768    57.748057 Hz 683:384   46.083 kHz     80.000000 MHz (708 mm x 398 mm)
                 Hfront  110 Hsync  40 Hback  220 Hpol P
                 Vfront    5 Vsync   5 Vback   20 Vpol P
    Display Product Name: 'LHDN32P69DAU'
    Display Range Limits:
      Monitor ranges (GTF): 50-85 Hz V, 60-91 kHz H, max dotclock 160 MHz
  Extension blocks: 1
Checksum: 0x05

----------------

Block 1, CTA-861 Extension Block:
  Revision: 3
  Basic audio support
  Supports YCbCr 4:4:4
  Supports YCbCr 4:2:2
  Native detailed modes: 6
  Video Data Block:
    VIC   6:  1440x480i   59.940060 Hz   4:3     15.734 kHz     27.000000 MHz
    VIC   2:   720x480    59.940060 Hz   4:3     31.469 kHz     27.000000 MHz
    VIC  21:  1440x576i   50.000000 Hz   4:3     15.625 kHz     27.000000 MHz
    VIC  17:   720x576    50.000000 Hz   4:3     31.250 kHz     27.000000 MHz
    VIC   4:  1280x720    60.000000 Hz  16:9     45.000 kHz     74.250000 MHz
    VIC  19:  1280x720    50.000000 Hz  16:9     37.500 kHz     74.250000 MHz
    VIC  20:  1920x1080i  50.000000 Hz  16:9     28.125 kHz     74.250000 MHz
    VIC   5:  1920x1080i  60.000000 Hz  16:9     33.750 kHz     74.250000 MHz
    VIC  31:  1920x1080   50.000000 Hz  16:9     56.250 kHz    148.500000 MHz
    VIC  16:  1920x1080   60.000000 Hz  16:9     67.500 kHz    148.500000 MHz
  Audio Data Block:
    Linear PCM:
      Max channels: 2
      Supported sample rates (kHz): 96 48 44.1 32
      Supported sample sizes (bits): 24 20 16
  Speaker Allocation Data Block:
    FL/FR - Front Left/Right
  Vendor-Specific Data Block (HDMI), OUI 00-0C-03:
    Source physical address: 1.0.0.0
  Detailed Timing Descriptors:
    DTD 3:   720x480    59.940060 Hz   3:2     31.469 kHz     27.000000 MHz (531 mm x 398 mm)
                 Hfront   16 Hsync  62 Hback   60 Hpol N
                 Vfront    9 Vsync   6 Vback   30 Vpol N
    DTD 4:  1920x1080i  60.000000 Hz  16:9     33.750 kHz     74.250000 MHz (708 mm x 398 mm)
                 Hfront   88 Hsync  44 Hback  148 Hpol P
                 Vfront    2 Vsync   5 Vback   15 Vpol P Vfront +0.5 Odd Field
                 Vfront    2 Vsync   5 Vback   15 Vpol P Vback  +0.5 Even Field
    DTD 5:   640x480    78.861112 Hz   4:3     40.140 kHz     31.470000 MHz (370 mm x 278 mm)
                 Hfront    8 Hsync  96 Hback   40 Hpol N
                 Vfront    2 Vsync   2 Vback   25 Vpol N
    DTD 6:  1440x480i   59.940060 Hz   3:1     15.734 kHz     27.000000 MHz (531 mm x 398 mm)
                 Hfront   38 Hsync 124 Hback  114 Hpol N
                 Vfront    4 Vsync   3 Vback   15 Vpol N Vfront +0.5 Odd Field
                 Vfront    4 Vsync   3 Vback   15 Vpol N Vback  +0.5 Even Field
Checksum: 0x72  Unused space in Extension Block: 26 bytes


