
EDID (hex):
00ffffffffffff00410c8bc04a990700
3015010380291778ee263caa615da22d
16575cbfef8081c08bc081ca81cf0101
010101010101662156aa51001e30468f
33009ae61000001e000000ff00444c41
31313438343937393934000000fc0050
68696c69707320313937454c000000fd
00384c1e530e000a20202020202000a1

Extracted contents:
header:          00 ff ff ff ff ff ff 00
serial number:   41 0c 8b c0 4a 99 07 00 30 15
version:         01 03
basic params:    80 29 17 78 ee
chroma info:     26 3c aa 61 5d a2 2d 16 57 5c
established:     bf ef 80
standard:        81 c0 8b c0 81 ca 81 cf 01 01 01 01 01 01 01 01
descriptor 1:    66 21 56 aa 51 00 1e 30 46 8f 33 00 9a e6 10 00 00 1e
descriptor 2:    00 00 00 ff 00 44 4c 41 31 31 34 38 34 39 37 39 39 34
descriptor 3:    00 00 00 fc 00 50 68 69 6c 69 70 73 20 31 39 37 45 4c
descriptor 4:    00 00 00 fd 00 38 4c 1e 53 0e 00 0a 20 20 20 20 20 20
extensions:      00
checksum:        a1

EDID version: 1.3
Manufacturer: PHL Model c08b Serial Number --
Made in week 48 of 2011
Digital display
Maximum image size: 41 cm x 23 cm
Gamma: 2.20
DPMS levels: Standby Suspend Off
RGB color display
Default (sRGB) color space is primary color space
First detailed timing is preferred timing
Display x,y Chromaticity:
  Red:   0.6640, 0.3808
  Green: 0.3642, 0.6347
  Blue:  0.1757, 0.0888
  White: 0.3427, 0.3593
Established timings supported:
  720x400@70Hz 9:5 HorFreq: 31469 Hz Clock: 28.320 MHz
  640x480@60Hz 4:3 HorFreq: 31469 Hz Clock: 25.175 MHz
  640x480@67Hz 4:3 HorFreq: 35000 Hz Clock: 30.240 MHz
  640x480@72Hz 4:3 HorFreq: 37900 Hz Clock: 31.500 MHz
  640x480@75Hz 4:3 HorFreq: 37500 Hz Clock: 31.500 MHz
  800x600@56Hz 4:3 HorFreq: 35200 Hz Clock: 36.000 MHz
  800x600@60Hz 4:3 HorFreq: 37900 Hz Clock: 40.000 MHz
  800x600@72Hz 4:3 HorFreq: 48100 Hz Clock: 50.000 MHz
  800x600@75Hz 4:3 HorFreq: 46900 Hz Clock: 49.500 MHz
  832x624@75Hz 4:3 HorFreq: 49726 Hz Clock: 57.284 MHz
  1024x768@60Hz 4:3 HorFreq: 48400 Hz Clock: 65.000 MHz
  1024x768@70Hz 4:3 HorFreq: 56500 Hz Clock: 75.000 MHz
  1024x768@75Hz 4:3 HorFreq: 60000 Hz Clock: 78.750 MHz
  1280x1024@75Hz 5:4 HorFreq: 80000 Hz Clock: 135.000 MHz
  1152x870@75Hz 192:145 HorFreq: 67500 Hz Clock: 108.000 MHz
Standard timings supported:
  1280x720@60Hz 16:9
  1360x765@60Hz 16:9
  1280x720@70Hz 16:9
  1280x720@75Hz 16:9
Detailed mode: Clock 85.500 MHz, 410 mm x 230 mm
               1366 1436 1579 1792 hborder 0
                768  771  774  798 vborder 0
               +hsync +vsync 
               VertFreq: 59 Hz, HorFreq: 47712 Hz
Serial number: --
Monitor ranges (GTF): 56-76Hz V, 30-83kHz H, max dotclock 140MHz
Checksum: 0xa1 (valid)
EDID block does NOT conform to EDID 1.3!
	sRGB is signaled, but the chromaticities do not match
	Name descriptor not terminated with a newline
