
EDID (hex):
00ffffffffffff00220e313601010101
241d0103802c18782ae8f5a2564fa128
105054a10800a9c095008180810081c0
010101010101302a40c8608464301850
1300b0f01000001e000000fd00323c1e
4611000a202020202020000000fc0048
5020503230340a2020202020000000ff
00334351393336315448350a202001e9
020315b145011203130467030c001000
0022e2002b011d007251d01e206e2855
00b0f01000001e011d00bc52d01e20b8
285540b0f01000001e00000000000000
00000000000000000000000000000000
00000000000000000000000000000000
00000000000000000000000000000000
000000000000000000000000000000e9

Extracted contents:
header:          00 ff ff ff ff ff ff 00
serial number:   22 0e 31 36 01 01 01 01 24 1d
version:         01 03
basic params:    80 2c 18 78 2a
chroma info:     e8 f5 a2 56 4f a1 28 10 50 54
established:     a1 08 00
standard:        a9 c0 95 00 81 80 81 00 81 c0 01 01 01 01 01 01
descriptor 1:    30 2a 40 c8 60 84 64 30 18 50 13 00 b0 f0 10 00 00 1e
descriptor 2:    00 00 00 fd 00 32 3c 1e 46 11 00 0a 20 20 20 20 20 20
descriptor 3:    00 00 00 fc 00 48 50 20 50 32 30 34 0a 20 20 20 20 20
descriptor 4:    00 00 00 ff 00 33 43 51 39 33 36 31 54 48 35 0a 20 20
extensions:      01
checksum:        e9

EDID version: 1.3
Manufacturer: HPN Model 3631 Serial Number --
Made in week 36 of 2019
Digital display
Maximum image size: 44 cm x 24 cm
Gamma: 2.20
DPMS levels: Off
RGB color display
First detailed timing is preferred timing
Display x,y Chromaticity:
  Red:   0.6357, 0.3378
  Green: 0.3105, 0.6289
  Blue:  0.1591, 0.0654
  White: 0.3134, 0.3291
Established timings supported:
  720x400@70Hz 9:5 HorFreq: 31469 Hz Clock: 28.320 MHz
  640x480@60Hz 4:3 HorFreq: 31469 Hz Clock: 25.175 MHz
  800x600@60Hz 4:3 HorFreq: 37900 Hz Clock: 40.000 MHz
  1024x768@60Hz 4:3 HorFreq: 48400 Hz Clock: 65.000 MHz
Standard timings supported:
  1600x900@60Hz 16:9
  1440x900@60Hz 16:10 HorFreq: 55500 Hz Clock: 88.750 MHz
  1280x1024@60Hz 5:4 HorFreq: 64000 Hz Clock: 108.000 MHz
  1280x800@60Hz 16:10
  1280x720@60Hz 16:9
Detailed mode: Clock 108.000 MHz, 432 mm x 240 mm
               1600 1624 1704 1800 hborder 0
                900  901  904 1000 vborder 0
               +hsync +vsync 
               VertFreq: 60 Hz, HorFreq: 60000 Hz
Monitor ranges (GTF): 50-60Hz V, 30-70kHz H, max dotclock 170MHz
Monitor name: HP P204
Serial number: --
Has 1 extension blocks
Checksum: 0xe9 (valid)

CTA extension block
Extension version: 3
17 bytes of CTA data
  Video data block
    VIC   1 640x480@60Hz 4:3  HorFreq: 31469 Hz Clock: 25.175 MHz
    VIC  18 720x576@50Hz 16:9  HorFreq: 31250 Hz Clock: 27.000 MHz
    VIC   3 720x480@60Hz 16:9  HorFreq: 31469 Hz Clock: 27.000 MHz
    VIC  19 1280x720@50Hz 16:9  HorFreq: 37500 Hz Clock: 74.250 MHz
    VIC   4 1280x720@60Hz 16:9  HorFreq: 45000 Hz Clock: 74.250 MHz
  Vendor-specific data block, OUI 000c03 (HDMI)
    Source physical address 1.0.0.0
    Maximum TMDS clock: 170MHz
  Extended tag: Video capability data block
    YCbCr quantization: No Data (0)
    RGB quantization: No Data (0)
    PT scan behaviour: Always Underscanned (2)
    IT scan behaviour: Always Underscanned (2)
    CE scan behaviour: Support both over- and underscan (3)
Underscans PC formats by default
Supports YCbCr 4:4:4
Supports YCbCr 4:2:2
1 native detailed modes
Detailed mode: Clock 74.250 MHz, 432 mm x 240 mm
               1280 1390 1430 1650 hborder 0
                720  725  730  750 vborder 0
               +hsync +vsync 
               VertFreq: 60 Hz, HorFreq: 45000 Hz
Detailed mode: Clock 74.250 MHz, 432 mm x 240 mm
               1280 1720 1760 1980 hborder 0
                720  725  730  750 vborder 0
               +hsync +vsync 
               VertFreq: 50 Hz, HorFreq: 37500 Hz
Checksum: 0xe9 (valid)

One or more of the timings is out of range of the Monitor Ranges:
  Vertical Freq: 50 - 70 Hz
  Horizontal Freq: 31250 - 64000 Hz
  Maximum Clock: 108.000 MHz
EDID block does not conform at all!
	Both the serial number and the serial string are set
