
EDID (hex):
00ffffffffffff0006afed1000000000
1f1a01049522137802cc459358588e29
20505400000001010101010101010101
010101010101783780b470382e406c0a
aa0058c11000001a602c80b470382e40
6c0aaa0058c11000001a000000fe0046
4e444336804231353648544b00000000
0000410296011000000a010a2020008b

Extracted contents:
header:          00 ff ff ff ff ff ff 00
serial number:   06 af ed 10 00 00 00 00 1f 1a
version:         01 04
basic params:    95 22 13 78 02
chroma info:     cc 45 93 58 58 8e 29 20 50 54
established:     00 00 00
standard:        01 01 01 01 01 01 01 01 01 01 01 01 01 01 01 01
descriptor 1:    78 37 80 b4 70 38 2e 40 6c 0a aa 00 58 c1 10 00 00 1a
descriptor 2:    60 2c 80 b4 70 38 2e 40 6c 0a aa 00 58 c1 10 00 00 1a
descriptor 3:    00 00 00 fe 00 46 4e 44 43 36 80 42 31 35 36 48 54 4b
descriptor 4:    00 00 00 00 00 00 41 02 96 01 10 00 00 0a 01 0a 20 20
extensions:      00
checksum:        8b

EDID version: 1.4
Manufacturer: AUO Model 10ed Serial Number --
Made in week 31 of 2016
Digital display
6 bits per primary color channel
DisplayPort interface
Maximum image size: 34 cm x 19 cm
Gamma: 2.20
Supported color formats: RGB 4:4:4
First detailed timing includes the native pixel format and preferred refresh rate
Display x,y Chromaticity:
  Red:   0.5771, 0.3437
  Green: 0.3466, 0.5546
  Blue:  0.1611, 0.1250
  White: 0.3134, 0.3291
Established timings supported:
Standard timings supported:
Detailed mode: Clock 142.000 MHz, 344 mm x 193 mm
               1920 2028 2038 2100 hborder 0
               1080 1090 1100 1126 vborder 0
               +hsync -vsync 
               VertFreq: 60 Hz, HorFreq: 67619 Hz
Detailed mode: Clock 113.600 MHz, 344 mm x 193 mm
               1920 2028 2038 2100 hborder 0
               1080 1090 1100 1126 vborder 0
               +hsync -vsync 
               VertFreq: 48 Hz, HorFreq: 54095 Hz
ASCII string: FNDC6
Manufacturer-specified data, tag 0
Checksum: 0x8b (valid)
EDID block does NOT conform to EDID 1.4!
	Missing name descriptor
	Missing monitor ranges
	Detailed block string not properly terminated
