
EDID (hex):
00ffffffffffff0006afed1000000000
01120103802213780ac8959e57549226
0f505400000001010101010101010101
0101010101018034803e703832401e14
aa0058c1100000180000000f00000000
00000000000000000020000000fe0041
554f0a202020202020202020000000fe
004231353648573031205630200a0054

Extracted contents:
header:          00 ff ff ff ff ff ff 00
serial number:   06 af ed 10 00 00 00 00 01 12
version:         01 03
basic params:    80 22 13 78 0a
chroma info:     c8 95 9e 57 54 92 26 0f 50 54
established:     00 00 00
standard:        01 01 01 01 01 01 01 01 01 01 01 01 01 01 01 01
descriptor 1:    80 34 80 3e 70 38 32 40 1e 14 aa 00 58 c1 10 00 00 18
descriptor 2:    00 00 00 0f 00 00 00 00 00 00 00 00 00 00 00 00 00 20
descriptor 3:    00 00 00 fe 00 41 55 4f 0a 20 20 20 20 20 20 20 20 20
descriptor 4:    00 00 00 fe 00 42 31 35 36 48 57 30 31 20 56 30 20 0a
extensions:      00
checksum:        54

EDID version: 1.3
Manufacturer: AUO Model 10ed Serial Number --
Made in week 1 of 2008
Digital display
Maximum image size: 34 cm x 19 cm
Gamma: 2.20
RGB color display
First detailed timing is preferred timing
Display x,y Chromaticity:
  Red:   0.6201, 0.3398
  Green: 0.3300, 0.5703
  Blue:  0.1503, 0.0595
  White: 0.3134, 0.3291
Established timings supported:
Standard timings supported:
Detailed mode: Clock 134.400 MHz, 344 mm x 193 mm
               1920 1950 1970 1982 hborder 0
               1080 1090 1100 1130 vborder 0
               -hsync -vsync 
               VertFreq: 60 Hz, HorFreq: 67810 Hz
Manufacturer-specified data, tag 15
ASCII string: AUO
ASCII string: B156HW01 V0 
Checksum: 0x54 (valid)
EDID block does NOT conform to EDID 1.3!
	Missing name descriptor
	Missing monitor ranges
