edid-decode (hex):

00 ff ff ff ff ff ff 00 04 72 61 ad ef 3a 40 73
22 11 01 03 80 34 20 78 2a ef 95 a3 54 4c 9b 26
0f 50 54 bf ef 00 61 46 71 40 71 4f 81 4f 81 80
a9 40 b3 00 d1 00 28 3c 80 a0 70 b0 23 40 30 20
36 00 06 44 21 00 00 1a 01 1d 80 18 71 1c 16 20
58 2c 25 00 06 44 21 00 00 9e 00 00 00 fd 00 31
4b 18 50 11 00 0a 20 20 20 20 20 20 00 00 00 fc
00 41 63 65 72 20 41 4c 32 34 31 36 57 0a 01 6e

02 01 04 00 01 1d 00 72 51 d0 1e 20 6e 28 55 00
06 44 21 00 00 1e 8c 0a d0 8a 20 e0 2d 10 10 3e
96 00 06 44 21 00 00 18 8c 0a a0 14 51 f0 16 00
26 7c 43 00 06 44 21 00 00 98 01 1d 80 d0 72 1c
16 20 10 2c 25 80 06 44 21 00 00 9e 8c 0a d0 90
20 40 31 20 0c 40 55 00 06 44 21 00 00 18 01 1d
00 bc 52 d0 1e 20 b8 28 55 40 06 44 21 00 00 1e
00 00 00 00 00 00 00 00 00 00 00 00 00 00 00 5a

00 ff ff ff ff ff ff 00 04 72 61 ad ef 3a 40 73
22 11 01 03 80 34 20 78 2a ef 95 a3 54 4c 9b 26
0f 50 54 bf ef 00 61 46 71 40 71 4f 81 4f 81 80
a9 40 b3 00 d1 00 28 3c 80 a0 70 b0 23 40 30 20
36 00 06 44 21 00 00 1a 01 1d 80 18 71 1c 16 20
58 2c 25 00 06 44 21 00 00 9e 00 00 00 fd 00 31
4b 18 50 11 00 0a 20 20 20 20 20 20 00 00 00 fc
00 41 63 65 72 20 41 4c 32 34 31 36 57 0a 01 6e

02 01 04 00 01 1d 00 72 51 d0 1e 20 6e 28 55 00
06 44 21 00 00 1e 8c 0a d0 8a 20 e0 2d 10 10 3e
96 00 06 44 21 00 00 18 8c 0a a0 14 51 f0 16 00
26 7c 43 00 06 44 21 00 00 98 01 1d 80 d0 72 1c
16 20 10 2c 25 80 06 44 21 00 00 9e 8c 0a d0 90
20 40 31 20 0c 40 55 00 06 44 21 00 00 18 01 1d
00 bc 52 d0 1e 20 b8 28 55 40 06 44 21 00 00 1e
00 00 00 00 00 00 00 00 00 00 00 00 00 00 00 5a

----------------

Block 0, Base EDID:
  EDID Structure Version & Revision: 1.3
  Vendor & Product Identification:
    Manufacturer: ACR
    Model: 44385
    Serial Number: ...
    Made in: week 34 of 2007
  Basic Display Parameters & Features:
    Digital display
    Maximum image size: 52 cm x 32 cm
    Gamma: 2.20
    DPMS levels: Off
    RGB color display
    First detailed timing is the preferred timing
  Color Characteristics:
    Red  : 0.6396, 0.3300
    Green: 0.2998, 0.6083
    Blue : 0.1503, 0.0595
    White: 0.3134, 0.3291
  Established Timings I & II:
    IBM     :   720x400    70.081663 Hz   9:5     31.467 kHz     28.320000 MHz
    DMT 0x04:   640x480    59.940476 Hz   4:3     31.469 kHz     25.175000 MHz
    Apple   :   640x480    66.666667 Hz   4:3     35.000 kHz     30.240000 MHz
    DMT 0x05:   640x480    72.808802 Hz   4:3     37.861 kHz     31.500000 MHz
    DMT 0x06:   640x480    75.000000 Hz   4:3     37.500 kHz     31.500000 MHz
    DMT 0x08:   800x600    56.250000 Hz   4:3     35.156 kHz     36.000000 MHz
    DMT 0x09:   800x600    60.316541 Hz   4:3     37.879 kHz     40.000000 MHz
    DMT 0x0a:   800x600    72.187572 Hz   4:3     48.077 kHz     50.000000 MHz
    DMT 0x0b:   800x600    75.000000 Hz   4:3     46.875 kHz     49.500000 MHz
    Apple   :   832x624    74.551266 Hz   4:3     49.726 kHz     57.284000 MHz
    DMT 0x10:  1024x768    60.003840 Hz   4:3     48.363 kHz     65.000000 MHz
    DMT 0x11:  1024x768    70.069359 Hz   4:3     56.476 kHz     75.000000 MHz
    DMT 0x12:  1024x768    75.028582 Hz   4:3     60.023 kHz     78.750000 MHz
    DMT 0x24:  1280x1024   75.024675 Hz   5:4     79.976 kHz    135.000000 MHz
  Standard Timings:
    GTF     :  1024x768    65.999558 Hz   4:3     52.668 kHz     71.628000 MHz
    GTF     :  1152x864    60.000000 Hz   4:3     53.700 kHz     81.624000 MHz
    DMT 0x15:  1152x864    75.000000 Hz   4:3     67.500 kHz    108.000000 MHz
    GTF     :  1280x960    74.999884 Hz   4:3     75.150 kHz    129.859000 MHz
    DMT 0x23:  1280x1024   60.019740 Hz   5:4     63.981 kHz    108.000000 MHz
    DMT 0x33:  1600x1200   60.000000 Hz   4:3     75.000 kHz    162.000000 MHz
    DMT 0x3a:  1680x1050   59.954250 Hz  16:10    65.290 kHz    146.250000 MHz
    DMT 0x45:  1920x1200   59.884600 Hz  16:10    74.556 kHz    193.250000 MHz
  Detailed Timing Descriptors:
    DTD  1:  1920x1200   59.950171 Hz  16:10    74.038 kHz    154.000000 MHz (518 mm x 324 mm)
                  Hfront   48 Hsync  32 Hback   80 Hpol P
                  Vfront    3 Vsync   6 Vback   26 Vpol N
    DTD  2:  1920x1080i  60.000000 Hz  16:9     33.750 kHz     74.250000 MHz (518 mm x 324 mm)
                  Hfront   88 Hsync  44 Hback  148 Hpol P
                  Vfront    2 Vsync   5 Vback   15 Vpol P Vfront +0.5 Odd Field
                  Vfront    2 Vsync   5 Vback   15 Vpol P Vback  +0.5 Even Field
    Display Range Limits:
      Monitor ranges (GTF): 49-75 Hz V, 24-80 kHz H, max dotclock 170 MHz
    Display Product Name: 'Acer AL2416W'
  Extension blocks: 1
Checksum: 0x6e

----------------

Block 1, CTA-861 Extension Block:
  Revision: 1
  Detailed Timing Descriptors:
    DTD  3:  1280x720    60.000000 Hz  16:9     45.000 kHz     74.250000 MHz (518 mm x 324 mm)
                  Hfront  110 Hsync  40 Hback  220 Hpol P
                  Vfront    5 Vsync   5 Vback   20 Vpol P
    DTD  4:   720x480    59.940060 Hz   3:2     31.469 kHz     27.000000 MHz (518 mm x 324 mm)
                  Hfront   16 Hsync  62 Hback   60 Hpol N
                  Vfront    9 Vsync   6 Vback   30 Vpol N
    DTD  5:  1440x480i   59.940060 Hz   3:1     15.734 kHz     27.000000 MHz (518 mm x 324 mm)
                  Hfront   38 Hsync 124 Hback  114 Hpol N
                  Vfront    4 Vsync   3 Vback   15 Vpol N Vfront +0.5 Odd Field
                  Vfront    4 Vsync   3 Vback   15 Vpol N Vback  +0.5 Even Field
    DTD  6:  1920x1080i  50.000000 Hz  16:9     28.125 kHz     74.250000 MHz (518 mm x 324 mm)
                  Hfront  528 Hsync  44 Hback  148 Hpol P
                  Vfront    2 Vsync   5 Vback   15 Vpol P Vfront +0.5 Odd Field
                  Vfront    2 Vsync   5 Vback   15 Vpol P Vback  +0.5 Even Field
    DTD  7:   720x576    50.000000 Hz   5:4     31.250 kHz     27.000000 MHz (518 mm x 324 mm)
                  Hfront   12 Hsync  64 Hback   68 Hpol N
                  Vfront    5 Vsync   5 Vback   39 Vpol N
    DTD  8:  1280x720    50.000000 Hz  16:9     37.500 kHz     74.250000 MHz (518 mm x 324 mm)
                  Hfront  440 Hsync  40 Hback  220 Hpol P
                  Vfront    5 Vsync   5 Vback   20 Vpol P
Checksum: 0x5a  Unused space in Extension Block: 15 bytes

----------------

Block 2, Unknown EDID Extension Block 0x00:
  00 ff ff ff ff ff ff 00 04 72 61 ad ef 3a 40 73 '.........ra..:@s'
  22 11 01 03 80 34 20 78 2a ef 95 a3 54 4c 9b 26 '"....4 x*...TL.&'
  0f 50 54 bf ef 00 61 46 71 40 71 4f 81 4f 81 80 '.PT...aFq@qO.O..'
  a9 40 b3 00 d1 00 28 3c 80 a0 70 b0 23 40 30 20 '.@....(<..p.#@0 '
  36 00 06 44 21 00 00 1a 01 1d 80 18 71 1c 16 20 '6..D!.......q.. '
  58 2c 25 00 06 44 21 00 00 9e 00 00 00 fd 00 31 'X,%..D!........1'
  4b 18 50 11 00 0a 20 20 20 20 20 20 00 00 00 fc 'K.P...      ....'
  00 41 63 65 72 20 41 4c 32 34 31 36 57 0a 01 6e '.Acer AL2416W..n'
Checksum: 0x6e

----------------

Block 3, CTA-861 Extension Block:
  Revision: 1
  Detailed Timing Descriptors:
    DTD  9:  1280x720    60.000000 Hz  16:9     45.000 kHz     74.250000 MHz (518 mm x 324 mm)
                  Hfront  110 Hsync  40 Hback  220 Hpol P
                  Vfront    5 Vsync   5 Vback   20 Vpol P
    DTD 10:   720x480    59.940060 Hz   3:2     31.469 kHz     27.000000 MHz (518 mm x 324 mm)
                  Hfront   16 Hsync  62 Hback   60 Hpol N
                  Vfront    9 Vsync   6 Vback   30 Vpol N
    DTD 11:  1440x480i   59.940060 Hz   3:1     15.734 kHz     27.000000 MHz (518 mm x 324 mm)
                  Hfront   38 Hsync 124 Hback  114 Hpol N
                  Vfront    4 Vsync   3 Vback   15 Vpol N Vfront +0.5 Odd Field
                  Vfront    4 Vsync   3 Vback   15 Vpol N Vback  +0.5 Even Field
    DTD 12:  1920x1080i  50.000000 Hz  16:9     28.125 kHz     74.250000 MHz (518 mm x 324 mm)
                  Hfront  528 Hsync  44 Hback  148 Hpol P
                  Vfront    2 Vsync   5 Vback   15 Vpol P Vfront +0.5 Odd Field
                  Vfront    2 Vsync   5 Vback   15 Vpol P Vback  +0.5 Even Field
    DTD 13:   720x576    50.000000 Hz   5:4     31.250 kHz     27.000000 MHz (518 mm x 324 mm)
                  Hfront   12 Hsync  64 Hback   68 Hpol N
                  Vfront    5 Vsync   5 Vback   39 Vpol N
    DTD 14:  1280x720    50.000000 Hz  16:9     37.500 kHz     74.250000 MHz (518 mm x 324 mm)
                  Hfront  440 Hsync  40 Hback  220 Hpol P
                  Vfront    5 Vsync   5 Vback   20 Vpol P
Checksum: 0x5a  Unused space in Extension Block: 15 bytes

----------------

Warnings:

Block 1, CTA-861 Extension Block:
  Add a Colorimetry Data Block with the sRGB colorimetry bit set to avoid interop issues.
Block 3, CTA-861 Extension Block:
  Add a Colorimetry Data Block with the sRGB colorimetry bit set to avoid interop issues.

Failures:

Block 1, CTA-861 Extension Block:
  Missing VCDB, needed for Set Selectable RGB Quantization to avoid interop issues.
Block 2, Base EDID:
  Unknown Extension Block.
Block 3, CTA-861 Extension Block:
  Missing VCDB, needed for Set Selectable RGB Quantization to avoid interop issues.
EDID:
  Base EDID: Some timings are out of range of the Monitor Ranges:
    Horizontal Freq: 15.734 - 79.976 kHz (Monitor: 24.000 - 80.000 kHz)
    Maximum Clock: 193.250 MHz (Monitor: 170.000 MHz)
  Base EDID: EDID specified 1 extension block(s), but found 3 extension block(s).
  Base EDID: EDID 1.3 requires a Block Map Extension in Block 1 if there are more than 2 blocks in the EDID.

EDID conformity: FAIL
