
EDID (hex):
00ffffffffffff001ab38a0601000000
15120103682b1b782aaec5a2574a9c25
125054a54b009500950f8100810f81c0
8180b300010121399030621a274068b0
3600b10f1100001c7c2e90a0601a1e40
30203600b10f1100001a000000fc0041
3230572d33410a2020202020000000ff
00594537543030333930310a20200094

Extracted contents:
header:          00 ff ff ff ff ff ff 00
serial number:   1a b3 8a 06 01 00 00 00 15 12
version:         01 03
basic params:    68 2b 1b 78 2a
chroma info:     ae c5 a2 57 4a 9c 25 12 50 54
established:     a5 4b 00
standard:        95 00 95 0f 81 00 81 0f 81 c0 81 80 b3 00 01 01
descriptor 1:    21 39 90 30 62 1a 27 40 68 b0 36 00 b1 0f 11 00 00 1c
descriptor 2:    7c 2e 90 a0 60 1a 1e 40 30 20 36 00 b1 0f 11 00 00 1a
descriptor 3:    00 00 00 fc 00 41 32 30 57 2d 33 41 0a 20 20 20 20 20
descriptor 4:    00 00 00 ff 00 59 45 37 54 30 30 33 39 30 31 0a 20 20
extensions:      00
checksum:        94

EDID version: 1.3
Manufacturer: FUS Model 68a Serial Number --
Made in week 21 of 2008
Analog display, Input voltage level: 0.7/0.7 V
Sync: Separate 
Maximum image size: 43 cm x 27 cm
Gamma: 2.20
DPMS levels: Off
RGB color display
First detailed timing is preferred timing
Display x,y Chromaticity:
  Red:   0.6347, 0.3417
  Green: 0.2919, 0.6113
  Blue:  0.1474, 0.0703
  White: 0.3134, 0.3291
Established timings supported:
  720x400@70Hz 9:5 HorFreq: 31469 Hz Clock: 28.320 MHz
  640x480@60Hz 4:3 HorFreq: 31469 Hz Clock: 25.175 MHz
  640x480@75Hz 4:3 HorFreq: 37500 Hz Clock: 31.500 MHz
  800x600@60Hz 4:3 HorFreq: 37900 Hz Clock: 40.000 MHz
  800x600@75Hz 4:3 HorFreq: 46900 Hz Clock: 49.500 MHz
  1024x768@60Hz 4:3 HorFreq: 48400 Hz Clock: 65.000 MHz
  1024x768@75Hz 4:3 HorFreq: 60000 Hz Clock: 78.750 MHz
  1280x1024@75Hz 5:4 HorFreq: 80000 Hz Clock: 135.000 MHz
Standard timings supported:
  1440x900@60Hz 16:10 HorFreq: 55500 Hz Clock: 88.750 MHz
  1440x900@75Hz 16:10 HorFreq: 82300 Hz Clock: 156.000 MHz
  1280x800@60Hz 16:10
  1280x800@75Hz 16:10
  1280x720@60Hz 16:9
  1280x1024@60Hz 5:4 HorFreq: 64000 Hz Clock: 108.000 MHz
  1680x1050@60Hz 16:10 HorFreq: 64700 Hz Clock: 119.000 MHz
Detailed mode: Clock 146.250 MHz, 433 mm x 271 mm
               1680 1784 1960 2240 hborder 0
               1050 1053 1059 1089 vborder 0
               -hsync +vsync 
               VertFreq: 59 Hz, HorFreq: 65290 Hz
Detailed mode: Clock 119.000 MHz, 433 mm x 271 mm
               1680 1728 1760 1840 hborder 0
               1050 1053 1059 1080 vborder 0
               +hsync -vsync 
               VertFreq: 59 Hz, HorFreq: 64673 Hz
Monitor name: A20W-3A
Serial number: --
Checksum: 0x94 (valid)
EDID block does NOT conform to EDID 1.3!
	Missing monitor ranges
