
EDID (hex):
00ffffffffffff000dafa31500000000
0a150104902213780200259e57529929
15505400000001010101010101010101
010101010101541b566e500016300e1d
270058c21000001abb12568c50001c30
1225390058c21000001a000000fe0035
464e4a58803135364247450a00000000
00004131960000000001010a20200029

Extracted contents:
header:          00 ff ff ff ff ff ff 00
serial number:   0d af a3 15 00 00 00 00 0a 15
version:         01 04
basic params:    90 22 13 78 02
chroma info:     00 25 9e 57 52 99 29 15 50 54
established:     00 00 00
standard:        01 01 01 01 01 01 01 01 01 01 01 01 01 01 01 01
descriptor 1:    54 1b 56 6e 50 00 16 30 0e 1d 27 00 58 c2 10 00 00 1a
descriptor 2:    bb 12 56 8c 50 00 1c 30 12 25 39 00 58 c2 10 00 00 1a
descriptor 3:    00 00 00 fe 00 35 46 4e 4a 58 80 31 35 36 42 47 45 0a
descriptor 4:    00 00 00 00 00 00 41 31 96 00 00 00 00 01 01 0a 20 20
extensions:      00
checksum:        29

EDID version: 1.4
Manufacturer: CMO Model 15a3 Serial Number --
Made in week 10 of 2011
Digital display
6 bits per primary color channel
Digital interface is not defined
Maximum image size: 34 cm x 19 cm
Gamma: 2.20
Supported color formats: RGB 4:4:4
First detailed timing includes the native pixel format and preferred refresh rate
Display x,y Chromaticity:
  Red:   0.6171, 0.3398
  Green: 0.3203, 0.5976
  Blue:  0.1601, 0.0839
  White: 0.3134, 0.3291
Established timings supported:
Standard timings supported:
Detailed mode: Clock 69.960 MHz, 344 mm x 194 mm
               1366 1380 1409 1476 hborder 0
                768  770  777  790 vborder 0
               +hsync -vsync 
               VertFreq: 59 Hz, HorFreq: 47398 Hz
Detailed mode: Clock 47.950 MHz, 344 mm x 194 mm
               1366 1384 1421 1506 hborder 0
                768  771  780  796 vborder 0
               +hsync -vsync 
               VertFreq: 39 Hz, HorFreq: 31839 Hz
ASCII string: 5FNJX
Manufacturer-specified data, tag 0
Checksum: 0x29 (valid)
EDID block does NOT conform to EDID 1.4!
	Missing name descriptor
	Missing monitor ranges
	Detailed block string not properly terminated
