edid-decode (hex):

00 ff ff ff ff ff ff 00 09 e5 1d 08 00 00 00 00
21 1c 01 04 a5 1f 11 78 02 fb 90 95 5d 59 94 29
23 50 54 00 00 00 01 01 01 01 01 01 01 01 01 01
01 01 01 01 01 01 39 37 80 de 70 38 14 40 30 20
36 00 35 ae 10 00 00 1a 00 00 00 00 00 00 00 00
00 00 00 00 00 00 00 00 00 00 00 00 00 fe 00 42
4f 45 20 43 51 0a 20 20 20 20 20 20 00 00 00 fe
00 4e 56 31 34 30 46 48 4d 2d 4e 34 38 0a 00 46

----------------

Block 0, Base EDID:
  EDID Structure Version & Revision: 1.4
  Vendor & Product Identification:
    Manufacturer: BOE
    Model: 2077
    Made in: week 33 of 2018
  Basic Display Parameters & Features:
    Digital display
    Bits per primary color channel: 8
    DisplayPort interface
    Maximum image size: 31 cm x 17 cm
    Gamma: 2.20
    Supported color formats: RGB 4:4:4
    First detailed timing includes the native pixel format and preferred refresh rate
  Color Characteristics:
    Red  : 0.5849, 0.3662
    Green: 0.3496, 0.5810
    Blue : 0.1621, 0.1376
    White: 0.3125, 0.3281
  Established Timings I & II: none
  Standard Timings: none
  Detailed Timing Descriptors:
    DTD 1:  1920x1080   59.999 Hz  16:9    65.999 kHz 141.370 MHz (309 mm x 174 mm)
                 Hfront   48 Hsync  32 Hback 142 Hpol P
                 Vfront    3 Vsync   6 Vback  11 Vpol N
    Empty Descriptor
    Alphanumeric Data String: 'BOE CQ'
    Alphanumeric Data String: 'NV140FHM-N48'
Checksum: 0x46

----------------

Failures:

Block 0, Base EDID:
  Empty Descriptor: Use Dummy Descriptor instead of all zeroes.
  Missing Display Product Name.

EDID conformity: FAIL
