edid-decode (hex):

00 ff ff ff ff ff ff 00 41 0c 75 d0 01 01 01 01
00 13 01 03 1c 46 27 78 2e ee bd a3 54 47 99 26
0c 47 4a 2d cc 00 81 c0 95 00 b3 00 81 80 01 01
01 01 01 01 01 01 f5 1e 00 80 51 00 1e 30 40 80
37 00 ba 88 21 00 00 18 66 21 50 b0 51 00 1b 30
40 70 36 00 ba 88 21 00 00 1c 00 00 00 fc 00 50
48 49 33 32 50 46 4c 35 34 30 34 0a 00 00 00 fd
00 38 4c 1e 53 0f 00 0a 20 20 20 20 20 20 00 68

----------------

Block 0, Base EDID:
  EDID Structure Version & Revision: 1.3
  Vendor & Product Identification:
    Manufacturer: PHL
    Model: 53365
    Serial Number: ...
    Made in: 2009
  Basic Display Parameters & Features:
    Analog display
    Input voltage level: 0.7/0.3 V
    Configurable signal levels
    Sync: Separate Composite
    Maximum image size: 70 cm x 39 cm
    Gamma: 2.20
    DPMS levels: Off
    RGB color display
    Default (sRGB) color space is primary color space
    First detailed timing is preferred timing
  Color Characteristics:
    Red  : 0.6396, 0.3300
    Green: 0.2802, 0.5996
    Blue : 0.1503, 0.0498
    White: 0.2802, 0.2900
  Established Timings I & II:
    DMT 0x04:   640x480    59.940 Hz   4:3    31.469 kHz  25.175 MHz
    DMT 0x05:   640x480    72.809 Hz   4:3    37.861 kHz  31.500 MHz
    DMT 0x06:   640x480    75.000 Hz   4:3    37.500 kHz  31.500 MHz
    DMT 0x09:   800x600    60.317 Hz   4:3    37.879 kHz  40.000 MHz
    DMT 0x0a:   800x600    72.188 Hz   4:3    48.077 kHz  50.000 MHz
    DMT 0x0b:   800x600    75.000 Hz   4:3    46.875 kHz  49.500 MHz
    DMT 0x10:  1024x768    60.004 Hz   4:3    48.363 kHz  65.000 MHz
    DMT 0x11:  1024x768    70.069 Hz   4:3    56.476 kHz  75.000 MHz
  Standard Timings:
    DMT 0x55:  1280x720    60.000 Hz  16:9    45.000 kHz  74.250 MHz
    DMT 0x2f:  1440x900    59.887 Hz  16:10   55.935 kHz 106.500 MHz
    DMT 0x3a:  1680x1050   59.954 Hz  16:10   65.290 kHz 146.250 MHz
    DMT 0x23:  1280x1024   60.020 Hz   5:4    63.981 kHz 108.000 MHz
  Detailed Timing Descriptors:
    DTD 1:  1280x768    59.682 Hz   5:3    47.626 kHz  79.250 MHz (698 mm x 392 mm)
                 Hfront   64 Hsync 128 Hback 192 Hpol N
                 Vfront    3 Vsync   7 Vback  20 Vpol N
    DTD 2:  1360x768    60.015 Hz  85:48   47.712 kHz  85.500 MHz (698 mm x 392 mm)
                 Hfront   64 Hsync 112 Hback 256 Hpol N
                 Vfront    3 Vsync   6 Vback  18 Vpol P
    Display Product Name: 'PHI32PFL5404'
  Display Range Limits:
    Monitor ranges (GTF): 56-76 Hz V, 30-83 kHz H, max dotclock 150 MHz
Checksum: 0x68

----------------

Failures:

Block 0, Base EDID:
  Basic Display Parameters & Features: sRGB is signaled, but the chromaticities do not match.

EDID conformity: FAIL
