edid-decode (hex):

00 ff ff ff ff ff ff 00 08 59 10 46 01 01 01 01
00 13 01 03 80 66 39 78 0a e6 9d a3 54 4a 99 26
0f 47 4a a1 08 00 81 c0 81 80 95 00 b3 00 01 01
01 01 01 01 01 01 02 3a 80 18 71 38 2d 40 58 2c
45 00 a2 0b 32 00 00 1e a9 1a 00 a0 50 00 16 30
30 20 37 00 a2 0b 32 00 00 1a 00 00 00 fc 00 4e
53 2d 4c 34 36 58 2d 31 30 41 0a 20 00 00 00 fd
00 3a 47 1e 44 0f 00 0a 20 20 20 20 20 20 01 81

02 03 18 71 48 05 84 03 02 01 10 07 06 23 09 07
07 66 03 0c 00 40 00 80 01 1d 00 72 51 d0 1e 20
6e 28 55 00 a2 0b 32 00 00 1e 8c 0a d0 8a 20 e0
2d 10 10 3e 96 00 a2 0b 32 00 00 18 01 1d 80 18
71 1c 16 20 58 2c 25 00 a2 0b 32 00 00 9e 8c 0a
a0 14 51 f0 16 00 26 7c 43 00 a2 0b 32 00 00 98
00 00 00 00 00 00 00 00 00 00 00 00 00 00 00 00
00 00 00 00 00 00 00 00 00 00 00 00 00 00 00 94

----------------

Block 0, Base EDID:
  EDID Structure Version & Revision: 1.3
  Vendor & Product Identification:
    Manufacturer: BBY
    Model: 17936
    Serial Number: ...
    Made in: 2009
  Basic Display Parameters & Features:
    Digital display
    Maximum image size: 102 cm x 57 cm
    Gamma: 2.20
    RGB color display
    First detailed timing is the preferred timing
  Color Characteristics:
    Red  : 0.6396, 0.3300
    Green: 0.2900, 0.5996
    Blue : 0.1503, 0.0595
    White: 0.2802, 0.2900
  Established Timings I & II:
    IBM     :   720x400    70.082 Hz   9:5    31.467 kHz  28.320 MHz
    DMT 0x04:   640x480    59.940 Hz   4:3    31.469 kHz  25.175 MHz
    DMT 0x09:   800x600    60.317 Hz   4:3    37.879 kHz  40.000 MHz
    DMT 0x10:  1024x768    60.004 Hz   4:3    48.363 kHz  65.000 MHz
  Standard Timings:
    DMT 0x55:  1280x720    60.000 Hz  16:9    45.000 kHz  74.250 MHz
    DMT 0x23:  1280x1024   60.020 Hz   5:4    63.981 kHz 108.000 MHz
    DMT 0x2f:  1440x900    59.887 Hz  16:10   55.935 kHz 106.500 MHz
    DMT 0x3a:  1680x1050   59.954 Hz  16:10   65.290 kHz 146.250 MHz
  Detailed Timing Descriptors:
    DTD 1:  1920x1080   60.000 Hz  16:9    67.500 kHz 148.500 MHz (930 mm x 523 mm)
                 Hfront   88 Hsync  44 Hback 148 Hpol P
                 Vfront    4 Vsync   5 Vback  36 Vpol P
    DTD 2:  1280x768    59.995 Hz   5:3    47.396 kHz  68.250 MHz (930 mm x 523 mm)
                 Hfront   48 Hsync  32 Hback  80 Hpol P
                 Vfront    3 Vsync   7 Vback  12 Vpol N
    Display Product Name: 'NS-L46X-10A'
  Display Range Limits:
    Monitor ranges (GTF): 58-71 Hz V, 30-68 kHz H, max dotclock 150 MHz
  Extension blocks: 1
Checksum: 0x81

----------------

Block 1, CTA-861 Extension Block:
  Revision: 3
  Basic audio support
  Supports YCbCr 4:4:4
  Supports YCbCr 4:2:2
  Native detailed modes: 1
  Video Data Block:
    VIC   5:  1920x1080i  60.000 Hz  16:9    33.750 kHz  74.250 MHz
    VIC   4:  1280x720    60.000 Hz  16:9    45.000 kHz  74.250 MHz (native)
    VIC   3:   720x480    59.940 Hz  16:9    31.469 kHz  27.000 MHz
    VIC   2:   720x480    59.940 Hz   4:3    31.469 kHz  27.000 MHz
    VIC   1:   640x480    59.940 Hz   4:3    31.469 kHz  25.175 MHz
    VIC  16:  1920x1080   60.000 Hz  16:9    67.500 kHz 148.500 MHz
    VIC   7:  1440x480i   59.940 Hz  16:9    15.734 kHz  27.000 MHz
    VIC   6:  1440x480i   59.940 Hz   4:3    15.734 kHz  27.000 MHz
  Audio Data Block:
    Linear PCM:
      Max channels: 2
      Supported sample rates (kHz): 48 44.1 32
      Supported sample sizes (bits): 24 20 16
  Vendor-Specific Data Block (HDMI), OUI 00-0C-03:
    Source physical address: 4.0.0.0
    Supports_AI
  Detailed Timing Descriptors:
    DTD 3:  1280x720    60.000 Hz  16:9    45.000 kHz  74.250 MHz (930 mm x 523 mm)
                 Hfront  110 Hsync  40 Hback 220 Hpol P
                 Vfront    5 Vsync   5 Vback  20 Vpol P
    DTD 4:   720x480    59.940 Hz   3:2    31.469 kHz  27.000 MHz (930 mm x 523 mm)
                 Hfront   16 Hsync  62 Hback  60 Hpol N
                 Vfront    9 Vsync   6 Vback  30 Vpol N
    DTD 5:  1920x1080i  60.000 Hz  16:9    33.750 kHz  74.250 MHz (930 mm x 523 mm)
                 Hfront   88 Hsync  44 Hback 148 Hpol P
                 Vfront    2 Vsync   5 Vback  15 Vpol P Vfront +0.5 Odd Field
                 Vfront    2 Vsync   5 Vback  15 Vpol P Vback  +0.5 Even Field
    DTD 6:  1440x480i   59.940 Hz   3:1    15.734 kHz  27.000 MHz (930 mm x 523 mm)
                 Hfront   38 Hsync 124 Hback 114 Hpol N
                 Vfront    4 Vsync   3 Vback  15 Vpol N Vfront +0.5 Odd Field
                 Vfront    4 Vsync   3 Vback  15 Vpol N Vback  +0.5 Even Field
Checksum: 0x94

----------------

Warnings:

Block 1, CTA-861 Extension Block:
  IT Video Formats are overscanned by default, but normally this should be underscanned.
  Missing VCDB, needed for Set Selectable RGB Quantization to avoid interop issues.

Failures:

Block 0, Base EDID:
  Detailed Timing Descriptor #1: Mismatch of image size 930x523 mm vs display size 1020x570 mm.
  Detailed Timing Descriptor #2: Mismatch of image size 930x523 mm vs display size 1020x570 mm.
Block 1, CTA-861 Extension Block:
  Detailed Timing Descriptor #3: Mismatch of image size 930x523 mm vs display size 1020x570 mm.
  Detailed Timing Descriptor #4: Mismatch of image size 930x523 mm vs display size 1020x570 mm.
  Detailed Timing Descriptor #5: Mismatch of image size 930x523 mm vs display size 1020x570 mm.
  Detailed Timing Descriptor #6: Mismatch of image size 930x523 mm vs display size 1020x570 mm.
EDID:
  Base EDID: Some timings are out of range of the Monitor Ranges:
    Horizontal Freq: 15.734 - 67.500 kHz (Monitor: 30.000 - 68.000 kHz)
  CTA-861: Native progressive timings are a mix of several resolutions.

EDID conformity: FAIL
