edid-decode (hex):

00 ff ff ff ff ff ff 00 21 31 02 50 30 18 32 01
06 10 01 03 a0 21 1b 78 ba ae a5 a6 54 4c 99 26
14 50 54 a7 ef 80 81 80 01 01 01 01 01 01 01 01
01 01 01 01 01 01 30 2a 00 98 51 00 2a 40 30 70
13 00 4a 0e 11 00 00 1e a0 0f 20 00 31 58 1c 20
28 80 14 00 4a 0e 11 00 00 1e 00 00 00 fd 00 38
4b 1f 53 ff 00 0a 20 20 20 20 20 20 00 00 00 fc
00 4c 37 32 44 20 44 2d 73 75 62 0a 20 20 01 f6

02 03 1b 71 23 09 07 07 83 01 00 00 67 03 0c 00
10 00 80 21 43 01 10 84 e2 00 0f 01 1d 00 72 51
d0 1e 20 6e 28 55 00 81 49 00 00 00 1e 00 00 00
10 00 00 00 00 00 00 00 00 00 00 00 00 00 00 00
00 00 10 00 00 00 00 00 00 00 00 00 00 00 00 00
00 00 00 00 10 00 00 00 00 00 00 00 00 00 00 00
00 00 00 00 00 00 10 00 00 00 00 00 00 00 00 00
00 00 00 00 00 00 00 00 00 00 00 00 00 00 00 bf

----------------

Block 0, Base EDID:
  EDID Structure Version & Revision: 1.3
  Vendor & Product Identification:
    Manufacturer: HIQ
    Model: 20482
    Serial Number: ...
    Made in: week 6 of 2006
  Basic Display Parameters & Features:
    Digital display
    Maximum image size: 33 cm x 27 cm
    Gamma: 2.20
    DPMS levels: Standby Off
    Undefined display color type
    First detailed timing is the preferred timing
  Color Characteristics:
    Red  : 0.6503, 0.3300
    Green: 0.2998, 0.5996
    Blue : 0.1503, 0.0800
    White: 0.3134, 0.3291
  Established Timings I & II:
    IBM     :   720x400    70.081663 Hz   9:5     31.467 kHz     28.320000 MHz
    DMT 0x04:   640x480    59.940476 Hz   4:3     31.469 kHz     25.175000 MHz
    DMT 0x06:   640x480    75.000000 Hz   4:3     37.500 kHz     31.500000 MHz
    DMT 0x08:   800x600    56.250000 Hz   4:3     35.156 kHz     36.000000 MHz
    DMT 0x09:   800x600    60.316541 Hz   4:3     37.879 kHz     40.000000 MHz
    DMT 0x0a:   800x600    72.187572 Hz   4:3     48.077 kHz     50.000000 MHz
    DMT 0x0b:   800x600    75.000000 Hz   4:3     46.875 kHz     49.500000 MHz
    Apple   :   832x624    74.551266 Hz   4:3     49.726 kHz     57.284000 MHz
    DMT 0x10:  1024x768    60.003840 Hz   4:3     48.363 kHz     65.000000 MHz
    DMT 0x11:  1024x768    70.069359 Hz   4:3     56.476 kHz     75.000000 MHz
    DMT 0x12:  1024x768    75.028582 Hz   4:3     60.023 kHz     78.750000 MHz
    DMT 0x24:  1280x1024   75.024675 Hz   5:4     79.976 kHz    135.000000 MHz
    Apple   :  1152x870    75.061550 Hz 192:145   68.681 kHz    100.000000 MHz
  Standard Timings:
    DMT 0x23:  1280x1024   60.019740 Hz   5:4     63.981 kHz    108.000000 MHz
  Detailed Timing Descriptors:
    DTD 1:  1280x1024   60.019740 Hz   5:4     63.981 kHz    108.000000 MHz (330 mm x 270 mm)
                 Hfront   48 Hsync 112 Hback  248 Hpol P
                 Vfront    1 Vsync   3 Vback   38 Vpol P
    DTD 2:   800x600    60.316541 Hz   4:3     37.879 kHz     40.000000 MHz (330 mm x 270 mm)
                 Hfront   40 Hsync 128 Hback   88 Hpol P
                 Vfront    1 Vsync   4 Vback   23 Vpol P
    Display Range Limits:
      Monitor ranges (GTF): 56-75 Hz V, 31-83 kHz H, max dotclock 2550 MHz
    Display Product Name: 'L72D D-sub'
  Extension blocks: 1
Checksum: 0xf6

----------------

Block 1, CTA-861 Extension Block:
  Revision: 3
  Basic audio support
  Supports YCbCr 4:4:4
  Supports YCbCr 4:2:2
  Native detailed modes: 1
  Audio Data Block:
    Linear PCM:
      Max channels: 2
      Supported sample rates (kHz): 48 44.1 32
      Supported sample sizes (bits): 24 20 16
  Speaker Allocation Data Block:
    FL/FR - Front Left/Right
  Vendor-Specific Data Block (HDMI), OUI 00-0C-03:
    Source physical address: 1.0.0.0
    Supports_AI
    Maximum TMDS clock: 165 MHz
  Video Data Block:
    VIC   1:   640x480    59.940476 Hz   4:3     31.469 kHz     25.175000 MHz
    VIC  16:  1920x1080   60.000000 Hz  16:9     67.500 kHz    148.500000 MHz
    VIC   4:  1280x720    60.000000 Hz  16:9     45.000 kHz     74.250000 MHz (native)
  Video Capability Data Block:
    YCbCr quantization: No Data
    RGB quantization: No Data
    PT scan behavior: No Data
    IT scan behavior: Supports both over- and underscan
    CE scan behavior: Supports both over- and underscan
  Detailed Timing Descriptors:
    DTD 3:  1280x720    60.000000 Hz  16:9     45.000 kHz     74.250000 MHz (129 mm x 73 mm)
                 Hfront  110 Hsync  40 Hback  220 Hpol P
                 Vfront    5 Vsync   5 Vback   20 Vpol P
    Dummy Descriptor:
    Dummy Descriptor:
    Dummy Descriptor:
    Dummy Descriptor:
Checksum: 0xbf

----------------

Warnings:

Block 1, CTA-861 Extension Block:
  IT Video Formats are overscanned by default, but normally this should be underscanned.
  Video Capability Data Block: Set Selectable YCbCr Quantization to avoid interop issues.

Failures:

Block 0, Base EDID:
  Basic Display Parameters & Features: Digital Video Interface Standard set to reserved value 0x20.
Block 1, CTA-861 Extension Block:
  Video Capability Data Block: Set Selectable RGB Quantization to avoid interop issues.
  Detailed Timing Descriptor #3: Mismatch of image size 129x73 mm vs display size 330x270 mm.
EDID:
  CTA-861: Native progressive timings are a mix of several resolutions.

EDID conformity: FAIL
