
EDID (hex):
00ffffffffffff00061019a000000000
30160104a5211578026fb1a7554c9e25
0c505400000001010101010101010101
010101010101ef8340a0b00834703020
36004bcf1000001a000000fc00436f6c
6f72204c43440a202020000000100000
00000000000000000000000000000010
000000000000000000000000000000bc

Extracted contents:
header:          00 ff ff ff ff ff ff 00
serial number:   06 10 19 a0 00 00 00 00 30 16
version:         01 04
basic params:    a5 21 15 78 02
chroma info:     6f b1 a7 55 4c 9e 25 0c 50 54
established:     00 00 00
standard:        01 01 01 01 01 01 01 01 01 01 01 01 01 01 01 01
descriptor 1:    ef 83 40 a0 b0 08 34 70 30 20 36 00 4b cf 10 00 00 1a
descriptor 2:    00 00 00 fc 00 43 6f 6c 6f 72 20 4c 43 44 0a 20 20 20
descriptor 3:    00 00 00 10 00 00 00 00 00 00 00 00 00 00 00 00 00 00
descriptor 4:    00 00 00 10 00 00 00 00 00 00 00 00 00 00 00 00 00 00
extensions:      00
checksum:        bc

EDID version: 1.4
Manufacturer: APP Model a019 Serial Number --
Made in week 48 of 2012
Digital display
8 bits per primary color channel
DisplayPort interface
Maximum image size: 33 cm x 21 cm
Gamma: 2.20
Supported color formats: RGB 4:4:4
First detailed timing includes the native pixel format and preferred refresh rate
Display x,y Chromaticity:
  Red:   0.6533, 0.3339
  Green: 0.2998, 0.6201
  Blue:  0.1464, 0.0498
  White: 0.3125, 0.3291
Established timings supported:
Standard timings supported:
Detailed mode: Clock 337.750 MHz, 331 mm x 207 mm
               2880 2928 2960 3040 hborder 0
               1800 1803 1809 1852 vborder 0
               +hsync -vsync 
               VertFreq: 59 Hz, HorFreq: 111101 Hz
Monitor name: Color LCD
Dummy block
Dummy block
Checksum: 0xbc (valid)
	Missing monitor ranges
