
EDID (hex):
00ffffffffffff0030e4c20200000000
0014010380160d780a4fb5975a558c27
1e505400000001010101010101010101
0101010101013c14005a41581e203020
3600e07e000000190000000000000000
00000000000000000000000000fe004c
4720446973706c61790a2020000000fe
004c503130315753412d544c4e32006f

Extracted contents:
header:          00 ff ff ff ff ff ff 00
serial number:   30 e4 c2 02 00 00 00 00 00 14
version:         01 03
basic params:    80 16 0d 78 0a
chroma info:     4f b5 97 5a 55 8c 27 1e 50 54
established:     00 00 00
standard:        01 01 01 01 01 01 01 01 01 01 01 01 01 01 01 01
descriptor 1:    3c 14 00 5a 41 58 1e 20 30 20 36 00 e0 7e 00 00 00 19
descriptor 2:    00 00 00 00 00 00 00 00 00 00 00 00 00 00 00 00 00 00
descriptor 3:    00 00 00 fe 00 4c 47 20 44 69 73 70 6c 61 79 0a 20 20
descriptor 4:    00 00 00 fe 00 4c 50 31 30 31 57 53 41 2d 54 4c 4e 32
extensions:      00
checksum:        6f

EDID version: 1.3
Manufacturer: LGD Model 2c2 Serial Number --
Made in year 2010
Digital display
Maximum image size: 22 cm x 13 cm
Gamma: 2.20
RGB color display
First detailed timing is preferred timing
Display x,y Chromaticity:
  Red:   0.5908, 0.3515
  Green: 0.3349, 0.5498
  Blue:  0.1542, 0.1201
  White: 0.3134, 0.3291
Established timings supported:
Standard timings supported:
Detailed mode: Clock 51.800 MHz, 224 mm x 126 mm
               1024 1072 1104 1370 hborder 0
                600  603  609  630 vborder 0
               -hsync -vsync 
               VertFreq: 60 Hz, HorFreq: 37810 Hz
Manufacturer-specified data, tag 0
ASCII string: LG Display
ASCII string: LP101WSA-TLN2
Checksum: 0x6f (valid)
EDID block does NOT conform to EDID 1.3!
	Missing name descriptor
	Missing monitor ranges
