
EDID (hex):
00ffffffffffff000dae351100000000
07180104a51a0e78023505a656559f28
0e515800000001010101010101010101
010101010101363680a0703820403020
3500009010000018000000fe004e3131
364853452d4441320a20000000fe0043
4d4e0a202020202020202020000000fe
004e3131364853452d4441320a200006

Extracted contents:
header:          00 ff ff ff ff ff ff 00
serial number:   0d ae 35 11 00 00 00 00 07 18
version:         01 04
basic params:    a5 1a 0e 78 02
chroma info:     35 05 a6 56 55 9f 28 0e 51 58
established:     00 00 00
standard:        01 01 01 01 01 01 01 01 01 01 01 01 01 01 01 01
descriptor 1:    36 36 80 a0 70 38 20 40 30 20 35 00 00 90 10 00 00 18
descriptor 2:    00 00 00 fe 00 4e 31 31 36 48 53 45 2d 44 41 32 0a 20
descriptor 3:    00 00 00 fe 00 43 4d 4e 0a 20 20 20 20 20 20 20 20 20
descriptor 4:    00 00 00 fe 00 4e 31 31 36 48 53 45 2d 44 41 32 0a 20
extensions:      00
checksum:        06

EDID version: 1.4
Manufacturer: CMN Model 1135 Serial Number --
Made in week 7 of 2014
Digital display
8 bits per primary color channel
DisplayPort interface
Maximum image size: 26 cm x 14 cm
Gamma: 2.20
Supported color formats: RGB 4:4:4
First detailed timing includes the native pixel format and preferred refresh rate
Display x,y Chromaticity:
  Red:   0.6484, 0.3388
  Green: 0.3330, 0.6220
  Blue:  0.1562, 0.0546
  White: 0.3173, 0.3447
Established timings supported:
Standard timings supported:
Detailed mode: Clock 138.780 MHz, 256 mm x 144 mm
               1920 1968 2000 2080 hborder 0
               1080 1083 1088 1112 vborder 0
               -hsync -vsync 
               VertFreq: 60 Hz, HorFreq: 66721 Hz
ASCII string: N116HSE-DA2
ASCII string: CMN
ASCII string: N116HSE-DA2
Checksum: 0x6 (valid)
EDID block does NOT conform to EDID 1.4!
	Missing name descriptor
	Missing monitor ranges
