
EDID (hex):
00ffffffffffff0005e302294e100000
1f1e010380441d782a21d5ad5048a526
135054bfef00d1c0b300950081808140
81c001010101d8590060a3382840a010
3a10a91f2100001a000000ff00504151
4c374a41303034313734000000fc0051
3239473247350a2020202020000000fd
00304b1e631e000a202020202020015d
02032bf14d101f051404130312021101
595a230907078301000067030c001000
003c681a00000101304be6295900a0a0
38274030203a00a91f2100001a023a80
1871382d40582c4500a91f2100001e01
1d007251d01e206e285500a91f210000
1eec2c00b05138284050883a00a91f21
00001c00000000000000000000000099

edid-decode (hex):

00 ff ff ff ff ff ff 00 05 e3 02 29 4e 10 00 00
1f 1e 01 03 80 44 1d 78 2a 21 d5 ad 50 48 a5 26
13 50 54 bf ef 00 d1 c0 b3 00 95 00 81 80 81 40
81 c0 01 01 01 01 d8 59 00 60 a3 38 28 40 a0 10
3a 10 a9 1f 21 00 00 1a 00 00 00 ff 00 50 41 51
4c 37 4a 41 30 30 34 31 37 34 00 00 00 fc 00 51
32 39 47 32 47 35 0a 20 20 20 20 20 00 00 00 fd
00 30 4b 1e 63 1e 00 0a 20 20 20 20 20 20 01 5d

02 03 2b f1 4d 10 1f 05 14 04 13 03 12 02 11 01
59 5a 23 09 07 07 83 01 00 00 67 03 0c 00 10 00
00 3c 68 1a 00 00 01 01 30 4b e6 29 59 00 a0 a0
38 27 40 30 20 3a 00 a9 1f 21 00 00 1a 02 3a 80
18 71 38 2d 40 58 2c 45 00 a9 1f 21 00 00 1e 01
1d 00 72 51 d0 1e 20 6e 28 55 00 a9 1f 21 00 00
1e ec 2c 00 b0 51 38 28 40 50 88 3a 00 a9 1f 21
00 00 1c 00 00 00 00 00 00 00 00 00 00 00 00 99

----------------

Block 0, Base EDID:
  EDID Structure Version & Revision: 1.3
  Vendor & Product Identification:
    Manufacturer: AOC
    Model: 10498
    Serial Number: 4174
    Made in: week 31 of 2020
  Basic Display Parameters & Features:
    Digital display
    Maximum image size: 68 cm x 29 cm
    Gamma: 2.20
    DPMS levels: Off
    RGB color display
    First detailed timing is the preferred timing
  Color Characteristics:
    Red  : 0.6757, 0.3144
    Green: 0.2812, 0.6455
    Blue : 0.1513, 0.0751
    White: 0.3134, 0.3291
  Established Timings I & II:
    IBM     :   720x400    70.081663 Hz   9:5     31.467 kHz     28.320000 MHz
    DMT 0x04:   640x480    59.940476 Hz   4:3     31.469 kHz     25.175000 MHz
    Apple   :   640x480    66.666667 Hz   4:3     35.000 kHz     30.240000 MHz
    DMT 0x05:   640x480    72.808802 Hz   4:3     37.861 kHz     31.500000 MHz
    DMT 0x06:   640x480    75.000000 Hz   4:3     37.500 kHz     31.500000 MHz
    DMT 0x08:   800x600    56.250000 Hz   4:3     35.156 kHz     36.000000 MHz
    DMT 0x09:   800x600    60.316541 Hz   4:3     37.879 kHz     40.000000 MHz
    DMT 0x0a:   800x600    72.187572 Hz   4:3     48.077 kHz     50.000000 MHz
    DMT 0x0b:   800x600    75.000000 Hz   4:3     46.875 kHz     49.500000 MHz
    Apple   :   832x624    74.551266 Hz   4:3     49.726 kHz     57.284000 MHz
    DMT 0x10:  1024x768    60.003840 Hz   4:3     48.363 kHz     65.000000 MHz
    DMT 0x11:  1024x768    70.069359 Hz   4:3     56.476 kHz     75.000000 MHz
    DMT 0x12:  1024x768    75.028582 Hz   4:3     60.023 kHz     78.750000 MHz
    DMT 0x24:  1280x1024   75.024675 Hz   5:4     79.976 kHz    135.000000 MHz
  Standard Timings:
    DMT 0x52:  1920x1080   60.000000 Hz  16:9     67.500 kHz    148.500000 MHz
    DMT 0x3a:  1680x1050   59.954250 Hz  16:10    65.290 kHz    146.250000 MHz
    DMT 0x2f:  1440x900    59.887445 Hz  16:10    55.935 kHz    106.500000 MHz
    DMT 0x23:  1280x1024   60.019740 Hz   5:4     63.981 kHz    108.000000 MHz
    DMT 0x20:  1280x960    60.000000 Hz   4:3     60.000 kHz    108.000000 MHz
    DMT 0x55:  1280x720    60.000000 Hz  16:9     45.000 kHz     74.250000 MHz
  Detailed Timing Descriptors:
    DTD 1:  2560x1080   59.975801 Hz  64:27    67.173 kHz    230.000000 MHz (681 mm x 287 mm)
                 Hfront  160 Hsync 272 Hback  432 Hpol P
                 Vfront    3 Vsync  10 Vback   27 Vpol N
    Display Product Serial Number: 'PAQL7JA004174'
    Display Product Name: 'Q29G2G5'
    Display Range Limits:
      Monitor ranges (GTF): 48-75 Hz V, 30-99 kHz H, max dotclock 300 MHz
  Extension blocks: 1
Checksum: 0x5d

----------------

Block 1, CTA-861 Extension Block:
  Revision: 3
  Underscans IT Video Formats by default
  Basic audio support
  Supports YCbCr 4:4:4
  Supports YCbCr 4:2:2
  Native detailed modes: 1
  Video Data Block:
    VIC  16:  1920x1080   60.000000 Hz  16:9     67.500 kHz    148.500000 MHz
    VIC  31:  1920x1080   50.000000 Hz  16:9     56.250 kHz    148.500000 MHz
    VIC   5:  1920x1080i  60.000000 Hz  16:9     33.750 kHz     74.250000 MHz
    VIC  20:  1920x1080i  50.000000 Hz  16:9     28.125 kHz     74.250000 MHz
    VIC   4:  1280x720    60.000000 Hz  16:9     45.000 kHz     74.250000 MHz
    VIC  19:  1280x720    50.000000 Hz  16:9     37.500 kHz     74.250000 MHz
    VIC   3:   720x480    59.940060 Hz  16:9     31.469 kHz     27.000000 MHz
    VIC  18:   720x576    50.000000 Hz  16:9     31.250 kHz     27.000000 MHz
    VIC   2:   720x480    59.940060 Hz   4:3     31.469 kHz     27.000000 MHz
    VIC  17:   720x576    50.000000 Hz   4:3     31.250 kHz     27.000000 MHz
    VIC   1:   640x480    59.940476 Hz   4:3     31.469 kHz     25.175000 MHz
    VIC  89:  2560x1080   50.000000 Hz  64:27    56.250 kHz    185.625000 MHz
    VIC  90:  2560x1080   60.000000 Hz  64:27    66.000 kHz    198.000000 MHz
  Audio Data Block:
    Linear PCM:
      Max channels: 2
      Supported sample rates (kHz): 48 44.1 32
      Supported sample sizes (bits): 24 20 16
  Speaker Allocation Data Block:
    FL/FR - Front Left/Right
  Vendor-Specific Data Block (HDMI), OUI 00-0C-03:
    Source physical address: 1.0.0.0
    Maximum TMDS clock: 300 MHz
  Vendor-Specific Data Block (AMD), OUI 00-00-1A:
    Version: 1.1
    Minimum Refresh Rate: 48 Hz
    Maximum Refresh Rate: 75 Hz
    Flags 1.x: 0xe6 (MCCS)
  Detailed Timing Descriptors:
    DTD 2:  2560x1080   74.991458 Hz  64:27    83.915 kHz    228.250000 MHz (681 mm x 287 mm)
                 Hfront   48 Hsync  32 Hback   80 Hpol P
                 Vfront    3 Vsync  10 Vback   26 Vpol N
    DTD 3:  1920x1080   60.000000 Hz  16:9     67.500 kHz    148.500000 MHz (681 mm x 287 mm)
                 Hfront   88 Hsync  44 Hback  148 Hpol P
                 Vfront    4 Vsync   5 Vback   36 Vpol P
    DTD 4:  1280x720    60.000000 Hz  16:9     45.000 kHz     74.250000 MHz (681 mm x 287 mm)
                 Hfront  110 Hsync  40 Hback  220 Hpol P
                 Vfront    5 Vsync   5 Vback   20 Vpol P
    DTD 5:  1280x1080   59.975801 Hz  32:27    67.173 kHz    115.000000 MHz (681 mm x 287 mm)
                 Hfront   80 Hsync 136 Hback  216 Hpol N
                 Vfront    3 Vsync  10 Vback   27 Vpol P
Checksum: 0x99  Unused space in Extension Block: 12 bytes


