edid-decode (hex):

00 ff ff ff ff ff ff 00 06 af 6d 22 00 00 00 00
00 19 01 04 95 1c 10 78 02 16 85 95 59 58 96 28
1d 50 54 00 00 00 01 01 01 01 01 01 01 01 01 01
01 01 01 01 01 01 14 37 80 b8 70 38 24 40 10 10
3e 00 14 9b 10 00 00 18 10 27 80 dc 70 38 58 40
10 10 3e 00 58 c1 10 00 00 18 00 00 00 00 00 00
00 00 00 00 00 00 00 00 00 00 00 00 00 00 00 02
00 10 39 ff 0f 3c 96 47 09 17 96 20 20 20 00 3b

----------------

Block 0, Base EDID:
  EDID Structure Version & Revision: 1.4
  Vendor & Product Identification:
    Manufacturer: AUO
    Model: 8813
    Made in: 2015
  Basic Display Parameters & Features:
    Digital display
    Bits per primary color channel: 6
    DisplayPort interface
    Maximum image size: 28 cm x 16 cm
    Gamma: 2.20
    Supported color formats: RGB 4:4:4
    First detailed timing includes the native pixel format and preferred refresh rate
  Color Characteristics:
    Red  : 0.5820, 0.3486
    Green: 0.3447, 0.5878
    Blue : 0.1582, 0.1132
    White: 0.3134, 0.3291
  Established Timings I & II: none
  Standard Timings: none
  Detailed Timing Descriptors:
    DTD 1:  1920x1080   60.049 Hz  16:9    67.015 kHz 141.000 MHz (276 mm x 155 mm)
                 Hfront   16 Hsync  16 Hback 152 Hpol N
                 Vfront    3 Vsync  14 Vback  19 Vpol N
    DTD 2:  1920x1080   40.008 Hz  16:9    46.729 kHz 100.000 MHz (344 mm x 193 mm)
                 Hfront   16 Hsync  16 Hback 188 Hpol N
                 Vfront    3 Vsync  14 Vback  71 Vpol N
    Empty Descriptor
    Manufacturer-Specified Display Descriptor (0x02): 00 02 00 10 39 ff 0f 3c 96 47 09 17 96 20 20 20 '....9..<.G...   '
Checksum: 0x3b

----------------

Failures:

Block 0, Base EDID:
  Detailed Timing Descriptor #2: Mismatch of image size 344x193 mm vs display size 280x160 mm.
  Empty Descriptor: Use Dummy Descriptor instead of all zeroes.
  Missing Display Product Name.

EDID conformity: FAIL
