
EDID (hex):
00ffffffffffff0006af6d2200000000
34190104a51c1078026ba79659579527
1d4e5300000001010101010101010101
010101010101143780b8703824401010
3e00149b100000180000000f00000000
00000000000000000020000000fe0041
554f0a202020202020202020000000fe
004231323548414e30322e32200a00a8

Extracted contents:
header:          00 ff ff ff ff ff ff 00
serial number:   06 af 6d 22 00 00 00 00 34 19
version:         01 04
basic params:    a5 1c 10 78 02
chroma info:     6b a7 96 59 57 95 27 1d 4e 53
established:     00 00 00
standard:        01 01 01 01 01 01 01 01 01 01 01 01 01 01 01 01
descriptor 1:    14 37 80 b8 70 38 24 40 10 10 3e 00 14 9b 10 00 00 18
descriptor 2:    00 00 00 0f 00 00 00 00 00 00 00 00 00 00 00 00 00 20
descriptor 3:    00 00 00 fe 00 41 55 4f 0a 20 20 20 20 20 20 20 20 20
descriptor 4:    00 00 00 fe 00 42 31 32 35 48 41 4e 30 32 2e 32 20 0a
extensions:      00
checksum:        a8

EDID version: 1.4
Manufacturer: AUO Model 226d Serial Number --
Made in week 52 of 2015
Digital display
8 bits per primary color channel
DisplayPort interface
Maximum image size: 28 cm x 16 cm
Gamma: 2.20
Supported color formats: RGB 4:4:4
First detailed timing includes the native pixel format and preferred refresh rate
Display x,y Chromaticity:
  Red:   0.5869, 0.3496
  Green: 0.3417, 0.5849
  Blue:  0.1542, 0.1152
  White: 0.3056, 0.3271
Established timings supported:
Standard timings supported:
Detailed mode: Clock 141.000 MHz, 276 mm x 155 mm
               1920 1936 1952 2104 hborder 0
               1080 1083 1097 1116 vborder 0
               -hsync -vsync 
               VertFreq: 60 Hz, HorFreq: 67015 Hz
Manufacturer-specified data, tag 15
ASCII string: AUO
ASCII string: B125HAN02.2 
Checksum: 0xa8 (valid)
EDID block does NOT conform to EDID 1.4!
	Missing name descriptor
	Missing monitor ranges


