edid-decode (hex):

00 ff ff ff ff ff ff 00 1e 6d 1d 77 01 01 01 01
1e 1e 01 03 80 46 27 78 ea 9f d1 a2 57 4c 9c 24
0c 50 54 25 6b 80 71 40 81 80 81 c0 a9 c0 b3 00
d1 c0 81 00 d1 cf 56 5e 00 a0 a0 a0 29 50 30 20
35 00 ba 88 21 00 00 1a 00 00 00 fd 00 38 4b 1e
70 1f 00 0a 20 20 20 20 20 20 00 00 00 fc 00 4c
47 20 51 48 44 0a 20 20 20 20 20 20 00 00 00 ff
00 30 30 37 4b 4d 46 45 59 33 34 37 35 0a 01 12

02 03 1d f1 48 01 03 04 90 12 13 1f 22 23 09 07
07 83 01 00 00 67 03 0c 00 10 00 b8 3e 02 3a 80
18 71 38 2d 40 58 2c 45 00 ba 88 21 00 00 1e 01
1d 00 72 51 d0 1e 20 6e 28 55 00 ba 88 21 00 00
1e 30 75 00 90 a0 a0 28 50 30 20 35 00 ba 88 21
00 00 1a 00 00 00 00 00 00 00 00 00 00 00 00 00
00 00 00 00 00 00 00 00 00 00 00 00 00 00 00 00
00 00 00 00 00 00 00 00 00 00 00 00 00 00 00 ef

00 ff ff ff ff ff ff 00 1e 6d 1d 77 01 01 01 01
1e 1e 01 03 80 46 27 78 ea 9f d1 a2 57 4c 9c 24
0c 50 54 25 6b 80 71 40 81 80 81 c0 a9 c0 b3 00
d1 c0 81 00 d1 cf 56 5e 00 a0 a0 a0 29 50 30 20
35 00 ba 88 21 00 00 1a 00 00 00 fd 00 38 4b 1e
70 1f 00 0a 20 20 20 20 20 20 00 00 00 fc 00 4c
47 20 51 48 44 0a 20 20 20 20 20 20 00 00 00 ff
00 30 30 37 4b 4d 46 45 59 33 34 37 35 0a 01 12

02 03 1d f1 48 01 03 04 90 12 13 1f 22 23 09 07
07 83 01 00 00 67 03 0c 00 10 00 b8 3e 02 3a 80
18 71 38 2d 40 58 2c 45 00 ba 88 21 00 00 1e 01
1d 00 72 51 d0 1e 20 6e 28 55 00 ba 88 21 00 00
1e 30 75 00 90 a0 a0 28 50 30 20 35 00 ba 88 21
00 00 1a 00 00 00 00 00 00 00 00 00 00 00 00 00
00 00 00 00 00 00 00 00 00 00 00 00 00 00 00 00
00 00 00 00 00 00 00 00 00 00 00 00 00 00 00 ef

----------------

Block 0, Base EDID:
  EDID Structure Version & Revision: 1.3
  Vendor & Product Identification:
    Manufacturer: GSM
    Model: 30493
    Serial Number: ...
    Made in: week 30 of 2020
  Basic Display Parameters & Features:
    Digital display
    Maximum image size: 70 cm x 39 cm
    Gamma: 2.20
    DPMS levels: Standby Suspend Off
    RGB color display
    First detailed timing is the preferred timing
  Color Characteristics:
    Red  : 0.6347, 0.3408
    Green: 0.2998, 0.6123
    Blue : 0.1435, 0.0478
    White: 0.3125, 0.3291
  Established Timings I & II:
    DMT 0x04:   640x480    59.940476 Hz   4:3     31.469 kHz     25.175000 MHz
    DMT 0x06:   640x480    75.000000 Hz   4:3     37.500 kHz     31.500000 MHz
    DMT 0x09:   800x600    60.316541 Hz   4:3     37.879 kHz     40.000000 MHz
    DMT 0x0b:   800x600    75.000000 Hz   4:3     46.875 kHz     49.500000 MHz
    Apple   :   832x624    74.551266 Hz   4:3     49.726 kHz     57.284000 MHz
    DMT 0x10:  1024x768    60.003840 Hz   4:3     48.363 kHz     65.000000 MHz
    DMT 0x12:  1024x768    75.028582 Hz   4:3     60.023 kHz     78.750000 MHz
    DMT 0x24:  1280x1024   75.024675 Hz   5:4     79.976 kHz    135.000000 MHz
    Apple   :  1152x870    75.061550 Hz 192:145   68.681 kHz    100.000000 MHz
  Standard Timings:
    GTF     :  1152x864    60.000000 Hz   4:3     53.700 kHz     81.624000 MHz
    DMT 0x23:  1280x1024   60.019740 Hz   5:4     63.981 kHz    108.000000 MHz
    DMT 0x55:  1280x720    60.000000 Hz  16:9     45.000 kHz     74.250000 MHz
    DMT 0x53:  1600x900    60.000000 Hz  16:9     60.000 kHz    108.000000 MHz (RB)
    DMT 0x3a:  1680x1050   59.954250 Hz  16:10    65.290 kHz    146.250000 MHz
    DMT 0x52:  1920x1080   60.000000 Hz  16:9     67.500 kHz    148.500000 MHz
    DMT 0x1c:  1280x800    59.810326 Hz  16:10    49.702 kHz     83.500000 MHz
    GTF     :  1920x1080   75.000068 Hz  16:9     84.600 kHz    220.637000 MHz
  Detailed Timing Descriptors:
    DTD 1:  2560x1440   59.950550 Hz  16:9     88.787 kHz    241.500000 MHz (698 mm x 392 mm)
                 Hfront   48 Hsync  32 Hback   80 Hpol P
                 Vfront    3 Vsync   5 Vback   33 Vpol N
    Display Range Limits:
      Monitor ranges (GTF): 56-75 Hz V, 30-112 kHz H, max dotclock 310 MHz
    Display Product Name: 'LG QHD'
    Display Product Serial Number: ...
  Extension blocks: 1
Checksum: 0x12

----------------

Block 1, CTA-861 Extension Block:
  Revision: 3
  Underscans IT Video Formats by default
  Basic audio support
  Supports YCbCr 4:4:4
  Supports YCbCr 4:2:2
  Native detailed modes: 1
  Video Data Block:
    VIC   1:   640x480    59.940476 Hz   4:3     31.469 kHz     25.175000 MHz
    VIC   3:   720x480    59.940060 Hz  16:9     31.469 kHz     27.000000 MHz
    VIC   4:  1280x720    60.000000 Hz  16:9     45.000 kHz     74.250000 MHz
    VIC  16:  1920x1080   60.000000 Hz  16:9     67.500 kHz    148.500000 MHz (native)
    VIC  18:   720x576    50.000000 Hz  16:9     31.250 kHz     27.000000 MHz
    VIC  19:  1280x720    50.000000 Hz  16:9     37.500 kHz     74.250000 MHz
    VIC  31:  1920x1080   50.000000 Hz  16:9     56.250 kHz    148.500000 MHz
    VIC  34:  1920x1080   30.000000 Hz  16:9     33.750 kHz     74.250000 MHz
  Audio Data Block:
    Linear PCM:
      Max channels: 2
      Supported sample rates (kHz): 48 44.1 32
      Supported sample sizes (bits): 24 20 16
  Speaker Allocation Data Block:
    FL/FR - Front Left/Right
  Vendor-Specific Data Block (HDMI), OUI 00-0C-03:
    Source physical address: 1.0.0.0
    Supports_AI
    DC_36bit
    DC_30bit
    DC_Y444
    Maximum TMDS clock: 310 MHz
  Detailed Timing Descriptors:
    DTD 2:  1920x1080   60.000000 Hz  16:9     67.500 kHz    148.500000 MHz (698 mm x 392 mm)
                 Hfront   88 Hsync  44 Hback  148 Hpol P
                 Vfront    4 Vsync   5 Vback   36 Vpol P
    DTD 3:  1280x720    60.000000 Hz  16:9     45.000 kHz     74.250000 MHz (698 mm x 392 mm)
                 Hfront  110 Hsync  40 Hback  220 Hpol P
                 Vfront    5 Vsync   5 Vback   20 Vpol P
    DTD 4:  2560x1440   74.964017 Hz  16:9    110.947 kHz    300.000000 MHz (698 mm x 392 mm)
                 Hfront   48 Hsync  32 Hback   64 Hpol P
                 Vfront    3 Vsync   5 Vback   32 Vpol N
Checksum: 0xef  Unused space in Extension Block: 44 bytes

----------------

Block 2, Unknown EDID Extension Block 0x00:
  00 ff ff ff ff ff ff 00 1e 6d 1d 77 01 01 01 01 '.........m.w....'
  1e 1e 01 03 80 46 27 78 ea 9f d1 a2 57 4c 9c 24 '.....F'x....WL.$'
  0c 50 54 25 6b 80 71 40 81 80 81 c0 a9 c0 b3 00 '.PT%k.q@........'
  d1 c0 81 00 d1 cf 56 5e 00 a0 a0 a0 29 50 30 20 '......V^....)P0 '
  35 00 ba 88 21 00 00 1a 00 00 00 fd 00 38 4b 1e '5...!........8K.'
  70 1f 00 0a 20 20 20 20 20 20 00 00 00 fc 00 4c 'p...      .....L'
  47 20 51 48 44 0a 20 20 20 20 20 20 00 00 00 ff 'G QHD.      ....'
  00 30 30 37 4b 4d 46 45 59 33 34 37 35 0a 01 12 '.007KMFEY3475...'
Checksum: 0x12

----------------

Block 3, CTA-861 Extension Block:
  Revision: 3
  Underscans IT Video Formats by default
  Basic audio support
  Supports YCbCr 4:4:4
  Supports YCbCr 4:2:2
  Native detailed modes: 1
  Video Data Block:
    VIC   1:   640x480    59.940476 Hz   4:3     31.469 kHz     25.175000 MHz
    VIC   3:   720x480    59.940060 Hz  16:9     31.469 kHz     27.000000 MHz
    VIC   4:  1280x720    60.000000 Hz  16:9     45.000 kHz     74.250000 MHz
    VIC  16:  1920x1080   60.000000 Hz  16:9     67.500 kHz    148.500000 MHz (native)
    VIC  18:   720x576    50.000000 Hz  16:9     31.250 kHz     27.000000 MHz
    VIC  19:  1280x720    50.000000 Hz  16:9     37.500 kHz     74.250000 MHz
    VIC  31:  1920x1080   50.000000 Hz  16:9     56.250 kHz    148.500000 MHz
    VIC  34:  1920x1080   30.000000 Hz  16:9     33.750 kHz     74.250000 MHz
  Audio Data Block:
    Linear PCM:
      Max channels: 2
      Supported sample rates (kHz): 48 44.1 32
      Supported sample sizes (bits): 24 20 16
  Speaker Allocation Data Block:
    FL/FR - Front Left/Right
  Vendor-Specific Data Block (HDMI), OUI 00-0C-03:
    Source physical address: 1.0.0.0
    Supports_AI
    DC_36bit
    DC_30bit
    DC_Y444
    Maximum TMDS clock: 310 MHz
  Detailed Timing Descriptors:
    DTD 5:  1920x1080   60.000000 Hz  16:9     67.500 kHz    148.500000 MHz (698 mm x 392 mm)
                 Hfront   88 Hsync  44 Hback  148 Hpol P
                 Vfront    4 Vsync   5 Vback   36 Vpol P
    DTD 6:  1280x720    60.000000 Hz  16:9     45.000 kHz     74.250000 MHz (698 mm x 392 mm)
                 Hfront  110 Hsync  40 Hback  220 Hpol P
                 Vfront    5 Vsync   5 Vback   20 Vpol P
    DTD 7:  2560x1440   74.964017 Hz  16:9    110.947 kHz    300.000000 MHz (698 mm x 392 mm)
                 Hfront   48 Hsync  32 Hback   64 Hpol P
                 Vfront    3 Vsync   5 Vback   32 Vpol N
Checksum: 0xef  Unused space in Extension Block: 44 bytes

----------------

Warnings:

Block 1, CTA-861 Extension Block:
  Display Product Serial Number is set, so the Serial Number in the Base EDID should be 0.
  Add a Colorimetry Data Block with the sRGB colorimetry bit set to avoid interop issues.
Block 3, CTA-861 Extension Block:
  Display Product Serial Number is set, so the Serial Number in the Base EDID should be 0.
  Add a Colorimetry Data Block with the sRGB colorimetry bit set to avoid interop issues.

Failures:

Block 1, CTA-861 Extension Block:
  Missing VCDB, needed for Set Selectable RGB Quantization to avoid interop issues.
Block 2, Base EDID:
  Unknown Extension Block.
Block 3, CTA-861 Extension Block:
  Video Data Block: Duplicate VIC 1.
  Video Data Block: Duplicate VIC 3.
  Video Data Block: Duplicate VIC 4.
  Video Data Block: Duplicate VIC 16.
  Video Data Block: Duplicate VIC 18.
  Video Data Block: Duplicate VIC 19.
  Video Data Block: Duplicate VIC 31.
  Video Data Block: Duplicate VIC 34.
  Speaker Allocation Data Block: Only one instance of this Data Block is allowed.
  Missing VCDB, needed for Set Selectable RGB Quantization to avoid interop issues.
EDID:
  Base EDID: Some timings are out of range of the Monitor Ranges:
    Vertical Freq: 30.000 - 75.062 Hz (Monitor: 56.000 - 75.000 Hz)
  Base EDID: EDID specified 1 extension block(s), but found 3 extension block(s).
  Base EDID: EDID 1.3 requires a Block Map Extension in Block 1 if there are more than 2 blocks in the EDID.
  CTA-861: Native progressive timings are a mix of several resolutions.

EDID conformity: FAIL
