edid-decode (hex):

00 ff ff ff ff ff ff 00 4d 10 dc 14 00 00 00 00
2c 1d 01 04 a5 26 15 78 07 de 50 a3 54 4c 99 26
0f 50 54 00 00 00 01 01 01 01 01 01 01 01 01 01
01 01 01 01 01 01 15 34 80 50 70 38 1f 40 18 10
35 00 7e d7 10 00 00 18 00 00 00 fd 0e 30 2d 4f
4f 43 01 0a 20 20 20 20 20 20 00 00 00 10 00 00
00 00 00 00 00 00 00 00 00 00 00 00 00 00 00 fc
00 4c 51 31 37 33 4d 31 4a 57 30 33 0a 20 01 1a

70 13 79 00 00 03 01 14 65 04 01 04 7f 07 4f 00
17 00 0f 00 37 04 1e 00 02 00 04 00 00 00 00 00
00 00 00 00 00 00 00 00 00 00 00 00 00 00 00 00
00 00 00 00 00 00 00 00 00 00 00 00 00 00 00 00
00 00 00 00 00 00 00 00 00 00 00 00 00 00 00 00
00 00 00 00 00 00 00 00 00 00 00 00 00 00 00 00
00 00 00 00 00 00 00 00 00 00 00 00 00 00 00 00
00 00 00 00 00 00 00 00 00 00 00 00 00 00 94 90

----------------

Block 0, Base EDID:
  EDID Structure Version & Revision: 1.4
  Vendor & Product Identification:
    Manufacturer: SHP
    Model: 5340
    Made in: week 44 of 2019
  Basic Display Parameters & Features:
    Digital display
    Bits per primary color channel: 8
    DisplayPort interface
    Maximum image size: 38 cm x 21 cm
    Gamma: 2.20
    Supported color formats: RGB 4:4:4
    Default (sRGB) color space is primary color space
    First detailed timing includes the native pixel format and preferred refresh rate
    Display is continuous frequency
  Color Characteristics:
    Red  : 0.6396, 0.3291
    Green: 0.2998, 0.5996
    Blue : 0.1494, 0.0595
    White: 0.3125, 0.3281
  Established Timings I & II: none
  Standard Timings: none
  Detailed Timing Descriptors:
    DTD 1:  1920x1080   60.004500 Hz  16:9     66.665 kHz    133.330000 MHz (382 mm x 215 mm)
                 Hfront   24 Hsync  16 Hback   40 Hpol N
                 Vfront    3 Vsync   5 Vback   23 Vpol N
    Display Range Limits:
      Monitor ranges (Bare Limits): 48-300 Hz V, 334-334 kHz H, max dotclock 670 MHz
    Dummy Descriptor:
    Display Product Name: 'LQ173M1JW03'
  Extension blocks: 1
Checksum: 0x1a

----------------

Block 1, DisplayID Extension Block:
  Version: 1.3
  Extension Count: 0
  Display Product Type: Extension Section
  Video Timing Modes Type 1 - Detailed Timings Data Block:
    DTD:  1920x1080  300.009001 Hz  16:9    333.310 kHz    666.620000 MHz (aspect 16:9, no 3D stereo)
               Hfront   24 Hsync  16 Hback   40 Hpol N
               Vfront    3 Vsync   5 Vback   23 Vpol N
  Checksum: 0x94
Checksum: 0x90

----------------

Warnings:

EDID:
  Base EDID: Some timings are out of range of the Monitor Ranges:
    Horizontal Freq: 66.665 - 333.310 kHz (Monitor: 334.000 - 334.000 kHz)

Failures:

Block 0, Base EDID:
  Basic Display Parameters & Features: sRGB is signaled, but the chromaticities do not match.
Block 1, DisplayID Extension Block:
  DisplayID Base Block has no product type.
EDID:
  DisplayID: Missing DisplayID Product Identification Data Block.
  DisplayID: DisplayID expects at least one preferred timing.

EDID conformity: FAIL
