
EDID (hex):
00ffffffffffff004c2dfe72354b5534
2c200104b54627783b58c6a853449522
1c4b59bfef80714f810081c081809500
a9c0b300010198e200a0a0a029500840
3500b9882100001a000000fd0030a5f5
f543010a202020202020000000fc004c
53333243473531780a202020000000ff
0048394a5739303833343600000002ed
02032af144903f1f0423090707830100
00e305c0006d1a0000020130a5000000
000000e6060501534900565e00a0a0a0
295030203500b9882100001a6fc200a0
a0a0555030203500b9882100001a5a87
80a070384d4030203500b9882100001a
023a801871382d40582c4500b9882100
001e0000000000000000000000000028
00ffffffffffff004c2dfe72354b5534
2c200104b54627783b58c6a853449522
1c4b59bfef80714f810081c081809500
a9c0b300010198e200a0a0a029500840
3500b9882100001a000000fd0030a5f5
f543010a202020202020000000fc004c
53333243473531780a202020000000ff
0048394a5739303833343600000002ed

edid-decode (hex):

00 ff ff ff ff ff ff 00 4c 2d fe 72 35 4b 55 34
2c 20 01 04 b5 46 27 78 3b 58 c6 a8 53 44 95 22
1c 4b 59 bf ef 80 71 4f 81 00 81 c0 81 80 95 00
a9 c0 b3 00 01 01 98 e2 00 a0 a0 a0 29 50 08 40
35 00 b9 88 21 00 00 1a 00 00 00 fd 00 30 a5 f5
f5 43 01 0a 20 20 20 20 20 20 00 00 00 fc 00 4c
53 33 32 43 47 35 31 78 0a 20 20 20 00 00 00 ff
00 48 39 4a 57 39 30 38 33 34 36 00 00 00 02 ed

02 03 2a f1 44 90 3f 1f 04 23 09 07 07 83 01 00
00 e3 05 c0 00 6d 1a 00 00 02 01 30 a5 00 00 00
00 00 00 e6 06 05 01 53 49 00 56 5e 00 a0 a0 a0
29 50 30 20 35 00 b9 88 21 00 00 1a 6f c2 00 a0
a0 a0 55 50 30 20 35 00 b9 88 21 00 00 1a 5a 87
80 a0 70 38 4d 40 30 20 35 00 b9 88 21 00 00 1a
02 3a 80 18 71 38 2d 40 58 2c 45 00 b9 88 21 00
00 1e 00 00 00 00 00 00 00 00 00 00 00 00 00 28

00 ff ff ff ff ff ff 00 4c 2d fe 72 35 4b 55 34
2c 20 01 04 b5 46 27 78 3b 58 c6 a8 53 44 95 22
1c 4b 59 bf ef 80 71 4f 81 00 81 c0 81 80 95 00
a9 c0 b3 00 01 01 98 e2 00 a0 a0 a0 29 50 08 40
35 00 b9 88 21 00 00 1a 00 00 00 fd 00 30 a5 f5
f5 43 01 0a 20 20 20 20 20 20 00 00 00 fc 00 4c
53 33 32 43 47 35 31 78 0a 20 20 20 00 00 00 ff
00 48 39 4a 57 39 30 38 33 34 36 00 00 00 02 ed

----------------

Block 0, Base EDID:
  EDID Structure Version & Revision: 1.4
  Vendor & Product Identification:
    Manufacturer: SAM
    Model: 29438
    Serial Number: 878005045
    Made in: week 44 of 2022
  Basic Display Parameters & Features:
    Digital display
    Bits per primary color channel: 10
    DisplayPort interface
    Maximum image size: 70 cm x 39 cm
    Gamma: 2.20
    DPMS levels: Off
    Supported color formats: RGB 4:4:4, YCrCb 4:4:4, YCrCb 4:2:2
    First detailed timing includes the native pixel format and preferred refresh rate
    Display is continuous frequency
  Color Characteristics:
    Red  : 0.6572, 0.3251
    Green: 0.2675, 0.5820
    Blue : 0.1357, 0.1093
    White: 0.2939, 0.3496
  Established Timings I & II:
    IBM     :   720x400    70.081663 Hz   9:5     31.467 kHz     28.320000 MHz
    DMT 0x04:   640x480    59.940476 Hz   4:3     31.469 kHz     25.175000 MHz
    Apple   :   640x480    66.666667 Hz   4:3     35.000 kHz     30.240000 MHz
    DMT 0x05:   640x480    72.808802 Hz   4:3     37.861 kHz     31.500000 MHz
    DMT 0x06:   640x480    75.000000 Hz   4:3     37.500 kHz     31.500000 MHz
    DMT 0x08:   800x600    56.250000 Hz   4:3     35.156 kHz     36.000000 MHz
    DMT 0x09:   800x600    60.316541 Hz   4:3     37.879 kHz     40.000000 MHz
    DMT 0x0a:   800x600    72.187572 Hz   4:3     48.077 kHz     50.000000 MHz
    DMT 0x0b:   800x600    75.000000 Hz   4:3     46.875 kHz     49.500000 MHz
    Apple   :   832x624    74.551266 Hz   4:3     49.726 kHz     57.284000 MHz
    DMT 0x10:  1024x768    60.003840 Hz   4:3     48.363 kHz     65.000000 MHz
    DMT 0x11:  1024x768    70.069359 Hz   4:3     56.476 kHz     75.000000 MHz
    DMT 0x12:  1024x768    75.028582 Hz   4:3     60.023 kHz     78.750000 MHz
    DMT 0x24:  1280x1024   75.024675 Hz   5:4     79.976 kHz    135.000000 MHz
    Apple   :  1152x870    75.061550 Hz 192:145   68.681 kHz    100.000000 MHz
  Standard Timings:
    DMT 0x15:  1152x864    75.000000 Hz   4:3     67.500 kHz    108.000000 MHz
    DMT 0x1c:  1280x800    59.810326 Hz  16:10    49.702 kHz     83.500000 MHz
    DMT 0x55:  1280x720    60.000000 Hz  16:9     45.000 kHz     74.250000 MHz
    DMT 0x23:  1280x1024   60.019740 Hz   5:4     63.981 kHz    108.000000 MHz
    DMT 0x2f:  1440x900    59.887445 Hz  16:10    55.935 kHz    106.500000 MHz
    DMT 0x53:  1600x900    60.000000 Hz  16:9     60.000 kHz    108.000000 MHz (RB)
    DMT 0x3a:  1680x1050   59.954250 Hz  16:10    65.290 kHz    146.250000 MHz
  Detailed Timing Descriptors:
    DTD 1:  2560x1440  144.000477 Hz  16:9    213.265 kHz    580.080000 MHz (697 mm x 392 mm)
                 Hfront    8 Hsync  64 Hback   88 Hpol P
                 Vfront    3 Vsync   5 Vback   33 Vpol N
    Display Range Limits:
      Monitor ranges (Bare Limits): 48-165 Hz V, 245-245 kHz H, max dotclock 670 MHz
    Display Product Name: 'LS32CG51x'
    Display Product Serial Number: 'H9JW908346'
  Extension blocks: 2
Checksum: 0xed

----------------

Block 1, CTA-861 Extension Block:
  Revision: 3
  Underscans IT Video Formats by default
  Basic audio support
  Supports YCbCr 4:4:4
  Supports YCbCr 4:2:2
  Native detailed modes: 1
  Video Data Block:
    VIC  16:  1920x1080   60.000000 Hz  16:9     67.500 kHz    148.500000 MHz (native)
    VIC  63:  1920x1080  120.000000 Hz  16:9    135.000 kHz    297.000000 MHz
    VIC  31:  1920x1080   50.000000 Hz  16:9     56.250 kHz    148.500000 MHz
    VIC   4:  1280x720    60.000000 Hz  16:9     45.000 kHz     74.250000 MHz
  Audio Data Block:
    Linear PCM:
      Max channels: 2
      Supported sample rates (kHz): 48 44.1 32
      Supported sample sizes (bits): 24 20 16
  Speaker Allocation Data Block:
    FL/FR - Front Left/Right
  Colorimetry Data Block:
    BT2020YCC
    BT2020RGB
  Vendor-Specific Data Block (AMD), OUI 00-00-1A:
    Version: 2.1
    Minimum Refresh Rate: 48 Hz
    Maximum Refresh Rate: 165 Hz
    Flags 1.x: 0x00
    Flags 2.x: 0x00
    Maximum luminance: 0 (50.000 cd/m^2)
    Minimum luminance: 0 (0.000 cd/m^2)
    Unknown: 0x00 0x00
  HDR Static Metadata Data Block:
    Electro optical transfer functions:
      Traditional gamma - SDR luminance range
      SMPTE ST2084
    Supported static metadata descriptors:
      Static metadata type 1
    Desired content max luminance: 83 (301.833 cd/m^2)
    Desired content max frame-average luminance: 73 (243.049 cd/m^2)
    Desired content min luminance: 0 (0.000 cd/m^2)
  Detailed Timing Descriptors:
    DTD 2:  2560x1440   59.950550 Hz  16:9     88.787 kHz    241.500000 MHz (697 mm x 392 mm)
                 Hfront   48 Hsync  32 Hback   80 Hpol P
                 Vfront    3 Vsync   5 Vback   33 Vpol N
    DTD 3:  2560x1440  119.997589 Hz  16:9    182.996 kHz    497.750000 MHz (697 mm x 392 mm)
                 Hfront   48 Hsync  32 Hback   80 Hpol P
                 Vfront    3 Vsync   5 Vback   77 Vpol N
    DTD 4:  1920x1080  143.981451 Hz  16:9    166.587 kHz    346.500000 MHz (697 mm x 392 mm)
                 Hfront   48 Hsync  32 Hback   80 Hpol P
                 Vfront    3 Vsync   5 Vback   69 Vpol N
    DTD 5:  1920x1080   60.000000 Hz  16:9     67.500 kHz    148.500000 MHz (697 mm x 392 mm)
                 Hfront   88 Hsync  44 Hback  148 Hpol P
                 Vfront    4 Vsync   5 Vback   36 Vpol P
Checksum: 0x28  Unused space in Extension Block: 13 bytes

----------------

Block 2, Unknown EDID Extension Block 0x00:
  00 ff ff ff ff ff ff 00 4c 2d fe 72 35 4b 55 34 '........L-.r5KU4'
  2c 20 01 04 b5 46 27 78 3b 58 c6 a8 53 44 95 22 ', ...F'x;X..SD."'
  1c 4b 59 bf ef 80 71 4f 81 00 81 c0 81 80 95 00 '.KY...qO........'
  a9 c0 b3 00 01 01 98 e2 00 a0 a0 a0 29 50 08 40 '............)P.@'
  35 00 b9 88 21 00 00 1a 00 00 00 fd 00 30 a5 f5 '5...!........0..'
  f5 43 01 0a 20 20 20 20 20 20 00 00 00 fc 00 4c '.C..      .....L'
  53 33 32 43 47 35 31 78 0a 20 20 20 00 00 00 ff 'S32CG51x.   ....'
  00 48 39 4a 57 39 30 38 33 34 36 00 00 00 02 ed '.H9JW908346.....'
Checksum: 0xed


