
EDID (hex):
00ffffffffffff000e11262801010101
1f13010380291778eeee95a3544c9926
0f5054a1080081408180010101010101
010101010101662156aa51001e30468f
33009ae61000001f000000fd00304c18
530e000a202020202020000000fc0043
6f6d7061712051313835390a000000ff
00334351393331333944430a202001a1
02031b71230907078301000067030c00
2000802d43100403e2000f8c0ad08a20
e02d10103e9600a05a00000000000000
00000000000000000000000000000000
00000000000000000000000000000000
00000000000000000000000000000000
00000000000000000000000000000000
00000000000000000000000000000018

Extracted contents:
header:          00 ff ff ff ff ff ff 00
serial number:   0e 11 26 28 01 01 01 01 1f 13
version:         01 03
basic params:    80 29 17 78 ee
chroma info:     ee 95 a3 54 4c 99 26 0f 50 54
established:     a1 08 00
standard:        81 40 81 80 01 01 01 01 01 01 01 01 01 01 01 01
descriptor 1:    66 21 56 aa 51 00 1e 30 46 8f 33 00 9a e6 10 00 00 1f
descriptor 2:    00 00 00 fd 00 30 4c 18 53 0e 00 0a 20 20 20 20 20 20
descriptor 3:    00 00 00 fc 00 43 6f 6d 70 61 71 20 51 31 38 35 39 0a
descriptor 4:    00 00 00 ff 00 33 43 51 39 33 31 33 39 44 43 0a 20 20
extensions:      01
checksum:        a1

EDID version: 1.3
Manufacturer: CPQ Model 2826 Serial Number --
Made in week 31 of 2009
Digital display
Maximum image size: 41 cm x 23 cm
Gamma: 2.20
DPMS levels: Standby Suspend Off
RGB color display
Default (sRGB) color space is primary color space
First detailed timing is preferred timing
Display x,y Chromaticity:
  Red:   0.6396, 0.3300
  Green: 0.2998, 0.5996
  Blue:  0.1503, 0.0595
  White: 0.3134, 0.3291
Established timings supported:
  720x400@70Hz 9:5 HorFreq: 31469 Hz Clock: 28.320 MHz
  640x480@60Hz 4:3 HorFreq: 31469 Hz Clock: 25.175 MHz
  800x600@60Hz 4:3 HorFreq: 37900 Hz Clock: 40.000 MHz
  1024x768@60Hz 4:3 HorFreq: 48400 Hz Clock: 65.000 MHz
Standard timings supported:
  1280x960@60Hz 4:3 HorFreq: 60000 Hz Clock: 108.000 MHz
  1280x1024@60Hz 5:4 HorFreq: 64000 Hz Clock: 108.000 MHz
Detailed mode: Clock 85.500 MHz, 410 mm x 230 mm
               1366 1436 1579 1792 hborder 0
                768  771  774  798 vborder 0
               +hsync +vsync 
               VertFreq: 59 Hz, HorFreq: 47712 Hz
Monitor ranges (GTF): 48-76Hz V, 24-83kHz H, max dotclock 140MHz
Monitor name: Compaq Q1859
Serial number: --
Has 1 extension blocks
Checksum: 0xa1 (valid)

CTA extension block
Extension version: 3
23 bytes of CTA data
  Audio data block
    Linear PCM, max channels 2
      Supported sample rates (kHz): 48 44.1 32
      Supported sample sizes (bits): 24 20 16
  Speaker allocation data block
    Speaker map:
      FL/FR - Front Left/Right
  Vendor-specific data block, OUI 000c03 (HDMI)
    Source physical address 2.0.0.0
    Supports_AI
    Maximum TMDS clock: 225MHz
  Video data block
    VIC  16 1920x1080@60Hz 16:9  HorFreq: 67500 Hz Clock: 148.500 MHz
    VIC   4 1280x720@60Hz 16:9  HorFreq: 45000 Hz Clock: 74.250 MHz
    VIC   3 720x480@60Hz 16:9  HorFreq: 31469 Hz Clock: 27.000 MHz
  Extended tag: Video capability data block
    YCbCr quantization: No Data (0)
    RGB quantization: No Data (0)
    PT scan behaviour: No Data (0)
    IT scan behaviour: Support both over- and underscan (3)
    CE scan behaviour: Support both over- and underscan (3)
Basic audio support
Supports YCbCr 4:4:4
Supports YCbCr 4:2:2
1 native detailed modes
Detailed mode: Clock 27.000 MHz, 160 mm x 90 mm
                720  736  798  858 hborder 0
                480  489  495  525 vborder 0
               -hsync -vsync analog composite 
               VertFreq: 59 Hz, HorFreq: 31468 Hz
Checksum: 0x18 (valid)

EDID block does NOT conform to EDID 1.3!
	sRGB is signaled, but the chromaticities do not match
One or more of the timings is out of range of the Monitor Ranges:
  Vertical Freq: 59 - 70 Hz
  Horizontal Freq: 31468 - 67500 Hz
  Maximum Clock: 148.500 MHz
EDID block does not conform at all!
	Both the serial number and the serial string are set
