
EDID (hex):
00ffffffffffff002ac3be2101010101
00100103801609782a7c119e59479b27
10505400000001010101010101010101
010101010101011d80d0721c1620102c
258010090000009e011d8018711c1620
582c250010090000009e000000fc0046
504445554654330a20202020000000fd
00313d0f2e08000a20202020202001ab
020320724c9405130412110301060715
16230907078301000066030c00100000
011d00bc52d01e20b828554010090000
001e011d007251d01e206e2855001009
0000001e8c0ad090204031200c405500
1009000000188c0ad090204031200c40
55000403000000188c0ad08a20e02d10
103e96001009000000180000000000b2

Extracted contents:
header:          00 ff ff ff ff ff ff 00
serial number:   2a c3 be 21 01 01 01 01 00 10
version:         01 03
basic params:    80 16 09 78 2a
chroma info:     7c 11 9e 59 47 9b 27 10 50 54
established:     00 00 00
standard:        01 01 01 01 01 01 01 01 01 01 01 01 01 01 01 01
descriptor 1:    01 1d 80 d0 72 1c 16 20 10 2c 25 80 10 09 00 00 00 9e
descriptor 2:    01 1d 80 18 71 1c 16 20 58 2c 25 00 10 09 00 00 00 9e
descriptor 3:    00 00 00 fc 00 46 50 44 45 55 46 54 33 0a 20 20 20 20
descriptor 4:    00 00 00 fd 00 31 3d 0f 2e 08 00 0a 20 20 20 20 20 20
extensions:      01
checksum:        ab

EDID version: 1.3
Manufacturer: JVC Model 21be Serial Number --
Made in year 2006
Digital display
Maximum image size: 22 cm x 9 cm
Gamma: 2.20
DPMS levels: Off
RGB color display
First detailed timing is preferred timing
Display x,y Chromaticity:
  Red:   0.6181, 0.3505
  Green: 0.2802, 0.6054
  Blue:  0.1523, 0.0634
  White: 0.3125, 0.3291
Established timings supported:
Standard timings supported:
Detailed mode: Clock 74.250 MHz, 16 mm x 9 mm
               1920 2448 2492 2640 hborder 0
                540  542  547  562 vborder 0
               +hsync +vsync interlaced 
               VertFreq: 50 Hz, HorFreq: 28125 Hz
Detailed mode: Clock 74.250 MHz, 16 mm x 9 mm
               1920 2008 2052 2200 hborder 0
                540  542  547  562 vborder 0
               +hsync +vsync interlaced 
               VertFreq: 60 Hz, HorFreq: 33750 Hz
Monitor name: FPDEUFT3
Monitor ranges (GTF): 49-61Hz V, 15-46kHz H, max dotclock 80MHz
Has 1 extension blocks
Checksum: 0xab (valid)

CTA extension block
Extension version: 3
28 bytes of CTA data
  Video data block
    VIC  20 1920x1080i@50Hz 16:9 (native) HorFreq: 28125 Hz Clock: 74.250 MHz
    VIC   5 1920x1080i@60Hz 16:9  HorFreq: 33750 Hz Clock: 74.250 MHz
    VIC  19 1280x720@50Hz 16:9  HorFreq: 37500 Hz Clock: 74.250 MHz
    VIC   4 1280x720@60Hz 16:9  HorFreq: 45000 Hz Clock: 74.250 MHz
    VIC  18 720x576@50Hz 16:9  HorFreq: 31250 Hz Clock: 27.000 MHz
    VIC  17 720x576@50Hz 4:3  HorFreq: 31250 Hz Clock: 27.000 MHz
    VIC   3 720x480@60Hz 16:9  HorFreq: 31469 Hz Clock: 27.000 MHz
    VIC   1 640x480@60Hz 4:3  HorFreq: 31469 Hz Clock: 25.175 MHz
    VIC   6 1440x480i@60Hz 4:3  HorFreq: 15734 Hz Clock: 27.000 MHz
    VIC   7 1440x480i@60Hz 16:9  HorFreq: 15734 Hz Clock: 27.000 MHz
    VIC  21 1440x576i@50Hz 4:3  HorFreq: 15625 Hz Clock: 27.000 MHz
    VIC  22 1440x576i@50Hz 16:9  HorFreq: 15625 Hz Clock: 27.000 MHz
  Audio data block
    Linear PCM, max channels 2
      Supported sample rates (kHz): 48 44.1 32
      Supported sample sizes (bits): 24 20 16
  Speaker allocation data block
    Speaker map:
      FL/FR - Front Left/Right
  Vendor-specific data block, OUI 000c03 (HDMI)
    Source physical address 1.0.0.0
Basic audio support
Supports YCbCr 4:4:4
Supports YCbCr 4:2:2
2 native detailed modes
Detailed mode: Clock 74.250 MHz, 16 mm x 9 mm
               1280 1720 1760 1980 hborder 0
                720  725  730  750 vborder 0
               +hsync +vsync 
               VertFreq: 50 Hz, HorFreq: 37500 Hz
Detailed mode: Clock 74.250 MHz, 16 mm x 9 mm
               1280 1390 1430 1650 hborder 0
                720  725  730  750 vborder 0
               +hsync +vsync 
               VertFreq: 60 Hz, HorFreq: 45000 Hz
Detailed mode: Clock 27.000 MHz, 16 mm x 9 mm
                720  732  796  864 hborder 0
                576  581  586  625 vborder 0
               -hsync -vsync 
               VertFreq: 50 Hz, HorFreq: 31250 Hz
Detailed mode: Clock 27.000 MHz, 4 mm x 3 mm
                720  732  796  864 hborder 0
                576  581  586  625 vborder 0
               -hsync -vsync 
               VertFreq: 50 Hz, HorFreq: 31250 Hz
Detailed mode: Clock 27.000 MHz, 16 mm x 9 mm
                720  736  798  858 hborder 0
                480  489  495  525 vborder 0
               -hsync -vsync 
               VertFreq: 59 Hz, HorFreq: 31468 Hz
Checksum: 0xb2 (valid)
