
EDID (hex):
00ffffffffffff0042930c0353320000
1c0f010380221b96ea6755a55b479c25
1e4f54adce0081800101010101010101
010101010101302a009851002c403070
1300510e1100001e000000ff00313238
38330a20202020202020000000fc0058
41372d3137690a2020202020000000fd
00384c1f410b000a2020202020200019

Extracted contents:
header:          00 ff ff ff ff ff ff 00
serial number:   42 93 0c 03 53 32 00 00 1c 0f
version:         01 03
basic params:    80 22 1b 96 ea
chroma info:     67 55 a5 5b 47 9c 25 1e 4f 54
established:     ad ce 00
standard:        81 80 01 01 01 01 01 01 01 01 01 01 01 01 01 01
descriptor 1:    30 2a 00 98 51 00 2c 40 30 70 13 00 51 0e 11 00 00 1e
descriptor 2:    00 00 00 ff 00 31 32 38 38 33 0a 20 20 20 20 20 20 20
descriptor 3:    00 00 00 fc 00 58 41 37 2d 31 37 69 0a 20 20 20 20 20
descriptor 4:    00 00 00 fd 00 38 4c 1f 41 0b 00 0a 20 20 20 20 20 20
extensions:      00
checksum:        19

EDID version: 1.3
Manufacturer: PTS Model 30c Serial Number --
Digital display
Maximum image size: 34 cm x 27 cm
Gamma: 2.50
DPMS levels: Standby Suspend Off
RGB color display
First detailed timing is preferred timing
Display x,y Chromaticity:
  Red:   0.6455, 0.3574
  Green: 0.2783, 0.6123
  Blue:  0.1455, 0.1181
  White: 0.3095, 0.3291
Established timings supported:
  720x400@70Hz 9:5 HorFreq: 31469 Hz Clock: 28.320 MHz
  640x480@60Hz 4:3 HorFreq: 31469 Hz Clock: 25.175 MHz
  640x480@72Hz 4:3 HorFreq: 37900 Hz Clock: 31.500 MHz
  640x480@75Hz 4:3 HorFreq: 37500 Hz Clock: 31.500 MHz
  800x600@60Hz 4:3 HorFreq: 37900 Hz Clock: 40.000 MHz
  800x600@72Hz 4:3 HorFreq: 48100 Hz Clock: 50.000 MHz
  800x600@75Hz 4:3 HorFreq: 46900 Hz Clock: 49.500 MHz
  1024x768@60Hz 4:3 HorFreq: 48400 Hz Clock: 65.000 MHz
  1024x768@70Hz 4:3 HorFreq: 56500 Hz Clock: 75.000 MHz
  1024x768@75Hz 4:3 HorFreq: 60000 Hz Clock: 78.750 MHz
Standard timings supported:
  1280x1024@60Hz 5:4 HorFreq: 64000 Hz Clock: 108.000 MHz
Detailed mode: Clock 108.000 MHz, 337 mm x 270 mm
               1280 1328 1440 1688 hborder 0
               1024 1025 1028 1068 vborder 0
               +hsync +vsync 
               VertFreq: 59 Hz, HorFreq: 63981 Hz
Serial number: --
Monitor name: XA7-17i
Monitor ranges (GTF): 56-76Hz V, 31-65kHz H, max dotclock 110MHz
Checksum: 0x19 (valid)
EDID block does not conform at all!
	Bad year of manufacture
