
EDID (hex):
00ffffffffffff0054e4031527032019
0a1d0103802213780ade95b34a519c26
0b505421080071c0818081c08bc09500
0140b3010101023a801871382d40582c
450058c11000001e000000fc00417274
69737431352e3650726f000000100034
4743483030303036330a2020000000fd
003b3d1f460f000a20202020202000a8

Extracted contents:
header:          00 ff ff ff ff ff ff 00
serial number:   54 e4 03 15 27 03 20 19 0a 1d
version:         01 03
basic params:    80 22 13 78 0a
chroma info:     de 95 b3 4a 51 9c 26 0b 50 54
established:     21 08 00
standard:        71 c0 81 80 81 c0 8b c0 95 00 01 40 b3 01 01 01
descriptor 1:    02 3a 80 18 71 38 2d 40 58 2c 45 00 58 c1 10 00 00 1e
descriptor 2:    00 00 00 fc 00 41 72 74 69 73 74 31 35 2e 36 50 72 6f
descriptor 3:    00 00 00 10 00 34 47 43 48 30 30 30 30 36 33 0a 20 20
descriptor 4:    00 00 00 fd 00 3b 3d 1f 46 0f 00 0a 20 20 20 20 20 20
extensions:      00
checksum:        a8

EDID version: 1.3
Manufacturer: UGD Model 1503 Serial Number --
Made in week 10 of 2019
Digital display
Maximum image size: 34 cm x 19 cm
Gamma: 2.20
RGB color display
First detailed timing is preferred timing
Display x,y Chromaticity:
  Red:   0.7021, 0.2900
  Green: 0.3193, 0.6113
  Blue:  0.1503, 0.0439
  White: 0.3134, 0.3291
Established timings supported:
  640x480@60Hz 4:3 HorFreq: 31469 Hz Clock: 25.175 MHz
  800x600@60Hz 4:3 HorFreq: 37900 Hz Clock: 40.000 MHz
  1024x768@60Hz 4:3 HorFreq: 48400 Hz Clock: 65.000 MHz
Standard timings supported:
  1152x648@60Hz 16:9
  1280x1024@60Hz 5:4 HorFreq: 64000 Hz Clock: 108.000 MHz
  1280x720@60Hz 16:9
  1360x765@60Hz 16:9
  1440x900@60Hz 16:10 HorFreq: 55500 Hz Clock: 88.750 MHz
  256x192@60Hz 4:3
  1680x1050@61Hz 16:10
Detailed mode: Clock 148.500 MHz, 344 mm x 193 mm
               1920 2008 2052 2200 hborder 0
               1080 1084 1089 1125 vborder 0
               +hsync +vsync 
               VertFreq: 60 Hz, HorFreq: 67500 Hz
Dummy block
Monitor ranges (GTF): 59-61Hz V, 31-70kHz H, max dotclock 150MHz
Checksum: 0xa8 (valid)
EDID block does NOT conform to EDID 1.3!
	Name descriptor not terminated with a newline
EDID block does not conform at all!
	Dummy block filled with garbage
