edid-decode (hex):

00 ff ff ff ff ff ff 00 08 59 22 cd fb a6 00 00
1d 12 01 04 68 2f 1e 78 2a 37 a0 a6 55 48 9a 26
12 50 54 af ce 00 01 01 01 01 01 01 01 01 01 01
01 01 01 01 01 01 21 39 90 30 62 1a 27 40 68 b0
36 00 da 28 11 00 00 1c 00 00 00 ff 00 49 38 30
38 37 4a 41 30 34 32 37 34 37 00 00 00 fd 00 38
4b 1f 3d 0b 00 0a 20 20 20 20 20 20 00 00 00 fc
00 4e 53 2d 4c 43 44 32 32 2d 30 39 0a 20 00 9f

00 ff ff ff ff ff ff 00 08 59 22 cd fb a6 00 00
1d 12 01 04 68 2f 1e 78 2a 37 a0 a6 55 48 9a 26
12 50 54 af ce 00 01 01 01 01 01 01 01 01 01 01
01 01 01 01 01 01 21 39 90 30 62 1a 27 40 68 b0
36 00 da 28 11 00 00 1c 00 00 00 ff 00 49 38 30
38 37 4a 41 30 34 32 37 34 37 00 00 00 fd 00 38
4b 1f 3d 0b 00 0a 20 20 20 20 20 20 00 00 00 fc
00 4e 53 2d 4c 43 44 32 32 2d 30 39 0a 20 00 9f

----------------

Block 0, Base EDID:
  EDID Structure Version & Revision: 1.4
  Vendor & Product Identification:
    Manufacturer: BBY
    Model: 52514
    Serial Number: ...
    Made in: week 29 of 2008
  Basic Display Parameters & Features:
    Analog display
    Signal Level Standard: 0.700 : 0.000 : 0.700 V p-p
    Blank level equals black level
    Sync: Separate
    Maximum image size: 47 cm x 30 cm
    Gamma: 2.20
    DPMS levels: Off
    RGB color display
    First detailed timing includes the native pixel format and preferred refresh rate
  Color Characteristics:
    Red  : 0.6484, 0.3349
    Green: 0.2822, 0.6044
    Blue : 0.1503, 0.0722
    White: 0.3125, 0.3281
  Established Timings I & II:
    IBM     :   720x400    70.081663 Hz   9:5     31.467 kHz     28.320000 MHz
    DMT 0x04:   640x480    59.940476 Hz   4:3     31.469 kHz     25.175000 MHz
    DMT 0x05:   640x480    72.808802 Hz   4:3     37.861 kHz     31.500000 MHz
    DMT 0x06:   640x480    75.000000 Hz   4:3     37.500 kHz     31.500000 MHz
    DMT 0x08:   800x600    56.250000 Hz   4:3     35.156 kHz     36.000000 MHz
    DMT 0x09:   800x600    60.316541 Hz   4:3     37.879 kHz     40.000000 MHz
    DMT 0x0a:   800x600    72.187572 Hz   4:3     48.077 kHz     50.000000 MHz
    DMT 0x0b:   800x600    75.000000 Hz   4:3     46.875 kHz     49.500000 MHz
    DMT 0x10:  1024x768    60.003840 Hz   4:3     48.363 kHz     65.000000 MHz
    DMT 0x11:  1024x768    70.069359 Hz   4:3     56.476 kHz     75.000000 MHz
    DMT 0x12:  1024x768    75.028582 Hz   4:3     60.023 kHz     78.750000 MHz
  Standard Timings: none
  Detailed Timing Descriptors:
    DTD 1:  1680x1050   59.954250 Hz  16:10    65.290 kHz    146.250000 MHz (474 mm x 296 mm)
                 Hfront  104 Hsync 176 Hback  280 Hpol N
                 Vfront    3 Vsync   6 Vback   30 Vpol P
    Display Product Serial Number: ...
    Display Range Limits:
      Monitor ranges (GTF): 56-75 Hz V, 31-61 kHz H, max dotclock 110 MHz
    Display Product Name: 'NS-LCD22-09'
Checksum: 0x9f

----------------

Block 1, Unknown EDID Extension Block 0x00:
  00 ff ff ff ff ff ff 00 08 59 22 cd fb a6 00 00 '.........Y".....'
  1d 12 01 04 68 2f 1e 78 2a 37 a0 a6 55 48 9a 26 '....h/.x*7..UH.&'
  12 50 54 af ce 00 01 01 01 01 01 01 01 01 01 01 '.PT.............'
  01 01 01 01 01 01 21 39 90 30 62 1a 27 40 68 b0 '......!9.0b.'@h.'
  36 00 da 28 11 00 00 1c 00 00 00 ff 00 49 38 30 '6..(.........I80'
  38 37 4a 41 30 34 32 37 34 37 00 00 00 fd 00 38 '87JA042747.....8'
  4b 1f 3d 0b 00 0a 20 20 20 20 20 20 00 00 00 fc 'K.=...      ....'
  00 4e 53 2d 4c 43 44 32 32 2d 30 39 0a 20 00 9f '.NS-LCD22-09. ..'
Checksum: 0x9f

----------------

Warnings:

Block 0, Base EDID:
  Display Range Limits: GTF support is deprecated in EDID 1.4.
EDID:
  Base EDID: Some timings are out of range of the Monitor Ranges:
    Horizontal Freq: 31.466 - 65.290 kHz (Monitor: 31.000 - 61.000 kHz)
    Maximum Clock: 146.250 MHz (Monitor: 110.000 MHz)

Failures:

Block 0, Base EDID:
  Display Range Limits: GTF can't be combined with non-continuous frequencies.
Block 1, Base EDID:
  Unknown Extension Block.
EDID:
  Base EDID: EDID specified 0 extension block(s), but found 1 extension block(s).

EDID conformity: FAIL
