
EDID (hex):
00ffffffffffff001609444001000000
181b0103805932780af0659857519127
2150542108008180a9c0010101010101
010101010101023a801871382d40582c
4500c48e2100001e662150b051001b30
4070360075f23100001e000000fc004c
45343046313436352f32350a000000fd
00313d0f440f000a20202020202001ab

Extracted contents:
header:          00 ff ff ff ff ff ff 00
serial number:   16 09 44 40 01 00 00 00 18 1b
version:         01 03
basic params:    80 59 32 78 0a
chroma info:     f0 65 98 57 51 91 27 21 50 54
established:     21 08 00
standard:        81 80 a9 c0 01 01 01 01 01 01 01 01 01 01 01 01
descriptor 1:    02 3a 80 18 71 38 2d 40 58 2c 45 00 c4 8e 21 00 00 1e
descriptor 2:    66 21 50 b0 51 00 1b 30 40 70 36 00 75 f2 31 00 00 1e
descriptor 3:    00 00 00 fc 00 4c 45 34 30 46 31 34 36 35 2f 32 35 0a
descriptor 4:    00 00 00 fd 00 31 3d 0f 44 0f 00 0a 20 20 20 20 20 20
extensions:      01
checksum:        ab

EDID version: 1.3
Manufacturer: EPI Model 4044 Serial Number --
Made in week 24 of 2017
Digital display
Maximum image size: 89 cm x 50 cm
Gamma: 2.20
RGB color display
First detailed timing is preferred timing
Display x,y Chromaticity:
  Red:   0.5966, 0.3427
  Green: 0.3164, 0.5664
  Blue:  0.1533, 0.1308
  White: 0.3134, 0.3291
Established timings supported:
  640x480@60Hz 4:3 HorFreq: 31469 Hz Clock: 25.175 MHz
  800x600@60Hz 4:3 HorFreq: 37900 Hz Clock: 40.000 MHz
  1024x768@60Hz 4:3 HorFreq: 48400 Hz Clock: 65.000 MHz
Standard timings supported:
  1280x1024@60Hz 5:4 HorFreq: 64000 Hz Clock: 108.000 MHz
  1600x900@60Hz 16:9
Detailed mode: Clock 148.500 MHz, 708 mm x 398 mm
               1920 2008 2052 2200 hborder 0
               1080 1084 1089 1125 vborder 0
               +hsync +vsync 
               VertFreq: 60 Hz, HorFreq: 67500 Hz
Detailed mode: Clock 85.500 MHz, 885 mm x 498 mm
               1360 1424 1536 1792 hborder 0
                768  771  777  795 vborder 0
               +hsync +vsync 
               VertFreq: 60 Hz, HorFreq: 47712 Hz
Monitor name: LE40F1465/25
Monitor ranges (GTF): 49-61Hz V, 15-68kHz H, max dotclock 150MHz
Has 1 extension blocks
Checksum: 0xab (valid)
