edid-decode (hex):

00 ff ff ff ff ff ff 00 30 e4 fe 05 00 00 00 00
00 1c 01 04 a5 22 13 78 ea e0 85 a3 54 4e 9b 26
0e 50 54 00 00 00 01 01 01 01 01 01 01 01 01 01
01 01 01 01 01 01 5e 87 80 a0 70 38 4d 40 30 20
35 00 58 c2 10 00 00 1b 68 38 80 a0 70 38 4d 40
30 20 35 00 58 c2 10 00 00 1b 00 00 00 00 00 00
00 00 00 00 00 00 00 00 00 00 00 00 00 00 00 02
00 0c 30 f2 0f 3c 96 2e 12 30 9e 00 00 00 00 83

----------------

Block 0, Base EDID:
  EDID Structure Version & Revision: 1.4
  Vendor & Product Identification:
    Manufacturer: LGD
    Model: 1534
    Made in: 2018
  Basic Display Parameters & Features:
    Digital display
    Bits per primary color channel: 8
    DisplayPort interface
    Maximum image size: 34 cm x 19 cm
    Gamma: 2.20
    DPMS levels: Standby Suspend Off
    Supported color formats: RGB 4:4:4, YCrCb 4:4:4
    First detailed timing includes the native pixel format and preferred refresh rate
  Color Characteristics:
    Red  : 0.6396, 0.3300
    Green: 0.3046, 0.6054
    Blue : 0.1503, 0.0546
    White: 0.3134, 0.3291
  Established Timings I & II: none
  Standard Timings: none
  Detailed Timing Descriptors:
    DTD 1:  1920x1080  143.998072 Hz  16:9    166.606 kHz    346.540000 MHz (344 mm x 194 mm)
                 Hfront   48 Hsync  32 Hback   80 Hpol P
                 Vfront    3 Vsync   5 Vback   69 Vpol N
    DTD 2:  1920x1080   60.002659 Hz  16:9     69.423 kHz    144.400000 MHz (344 mm x 194 mm)
                 Hfront   48 Hsync  32 Hback   80 Hpol P
                 Vfront    3 Vsync   5 Vback   69 Vpol N
    Empty Descriptor
    Manufacturer-Specified Display Descriptor (0x02): 00 02 00 0c 30 f2 0f 3c 96 2e 12 30 9e 00 00 00 '....0..<...0....'
Checksum: 0x83

----------------

Failures:

Block 0, Base EDID:
  Empty Descriptor: Use Dummy Descriptor instead of all zeroes.
  Missing Display Product Name.

EDID conformity: FAIL
