
EDID (hex):
00ffffffffffff0049f7000000000000
011a0103800000000ad7a5a2594a9624
145054afce00d1c0b300810081808140
81c001010101023a801871382d40582c
45003f432100001a7f2156aa51001e30
468f33003f432100001e000000fd0032
4c1e5010000a202020202020000000fc
004141410a20202020202020200a0093

Extracted contents:
header:          00 ff ff ff ff ff ff 00
serial number:   49 f7 00 00 00 00 00 00 01 1a
version:         01 03
basic params:    80 00 00 00 0a
chroma info:     d7 a5 a2 59 4a 96 24 14 50 54
established:     af ce 00
standard:        d1 c0 b3 00 81 00 81 80 81 40 81 c0 01 01 01 01
descriptor 1:    02 3a 80 18 71 38 2d 40 58 2c 45 00 3f 43 21 00 00 1a
descriptor 2:    7f 21 56 aa 51 00 1e 30 46 8f 33 00 3f 43 21 00 00 1e
descriptor 3:    00 00 00 fd 00 32 4c 1e 50 10 00 0a 20 20 20 20 20 20
descriptor 4:    00 00 00 fc 00 41 41 41 0a 20 20 20 20 20 20 20 20 0a
extensions:      00
checksum:        93

EDID version: 1.3
Manufacturer: ROW Model 0 Serial Number --
Made in week 1 of 2016
Digital display
Image size is variable
Gamma: 1.00
RGB color display
First detailed timing is preferred timing
Display x,y Chromaticity:
  Red:   0.6357, 0.3486
  Green: 0.2900, 0.5888
  Blue:  0.1425, 0.0800
  White: 0.3134, 0.3291
Established timings supported:
  720x400@70Hz 9:5 HorFreq: 31469 Hz Clock: 28.320 MHz
  640x480@60Hz 4:3 HorFreq: 31469 Hz Clock: 25.175 MHz
  640x480@72Hz 4:3 HorFreq: 37900 Hz Clock: 31.500 MHz
  640x480@75Hz 4:3 HorFreq: 37500 Hz Clock: 31.500 MHz
  800x600@56Hz 4:3 HorFreq: 35200 Hz Clock: 36.000 MHz
  800x600@60Hz 4:3 HorFreq: 37900 Hz Clock: 40.000 MHz
  800x600@72Hz 4:3 HorFreq: 48100 Hz Clock: 50.000 MHz
  800x600@75Hz 4:3 HorFreq: 46900 Hz Clock: 49.500 MHz
  1024x768@60Hz 4:3 HorFreq: 48400 Hz Clock: 65.000 MHz
  1024x768@70Hz 4:3 HorFreq: 56500 Hz Clock: 75.000 MHz
  1024x768@75Hz 4:3 HorFreq: 60000 Hz Clock: 78.750 MHz
Standard timings supported:
  1920x1080@60Hz 16:9
  1680x1050@60Hz 16:10 HorFreq: 64700 Hz Clock: 119.000 MHz
  1280x800@60Hz 16:10
  1280x1024@60Hz 5:4 HorFreq: 64000 Hz Clock: 108.000 MHz
  1280x960@60Hz 4:3 HorFreq: 60000 Hz Clock: 108.000 MHz
  1280x720@60Hz 16:9
Detailed mode: Clock 148.500 MHz, 575 mm x 323 mm
               1920 2008 2052 2200 hborder 0
               1080 1084 1089 1125 vborder 0
               +hsync -vsync 
               VertFreq: 60 Hz, HorFreq: 67500 Hz
Detailed mode: Clock 85.750 MHz, 575 mm x 323 mm
               1366 1436 1579 1792 hborder 0
                768  771  774  798 vborder 0
               +hsync +vsync 
               VertFreq: 59 Hz, HorFreq: 47851 Hz
Monitor ranges (GTF): 50-76Hz V, 30-80kHz H, max dotclock 160MHz
Monitor name: AAA
Checksum: 0x93 (valid)
EDID block does NOT conform to EDID 1.3!
	Detailed block string not properly terminated
