edid-decode (hex):

00 ff ff ff ff ff ff 00 04 69 a7 28 4f f7 01 00
2b 1c 01 03 80 3e 22 78 3a 08 a5 a2 57 4f a2 28
0f 50 54 bf ef 00 d1 c0 81 40 81 80 95 00 b3 00
81 c0 81 00 71 4f 08 e8 00 30 f2 70 5a 80 b0 58
8a 00 6d 55 21 00 00 1e 04 74 00 30 f2 70 5a 80
b0 58 8a 00 6d 55 21 00 00 1a 00 00 00 fd 00 17
50 18 a0 3c 00 0a 20 20 20 20 20 20 00 00 00 fc
00 41 53 55 53 20 4d 47 32 38 55 0a 20 20 01 ef

02 03 3d f1 56 90 04 03 1f 13 01 12 5e 5f 60 61
0e 0f 1d 1e 02 11 14 05 22 20 21 23 09 07 07 83
01 00 00 6d 03 0c 00 10 00 38 78 20 00 60 01 02
03 67 d8 5d c4 01 78 80 03 e3 0f 00 0c 56 5e 00
a0 a0 a0 29 50 30 20 35 00 6d 55 21 00 00 1e e2
68 00 a0 a0 40 2e 60 30 20 36 00 6d 55 21 00 00
1a d6 09 80 a0 20 5e 63 10 30 60 b2 0c 6d 55 21
00 00 1a 00 00 00 00 00 00 00 00 00 00 00 00 b3

----------------

Block 0, Base EDID:
  EDID Structure Version & Revision: 1.3
  Vendor & Product Identification:
    Manufacturer: ACI
    Model: 10407
    Serial Number: ...
    Made in: week 43 of 2018
  Basic Display Parameters & Features:
    Digital display
    Maximum image size: 62 cm x 34 cm
    Gamma: 2.20
    DPMS levels: Off
    Undefined display color type
    First detailed timing is the preferred timing
  Color Characteristics:
    Red  : 0.6328, 0.3398
    Green: 0.3105, 0.6328
    Blue : 0.1582, 0.0605
    White: 0.3134, 0.3291
  Established Timings I & II:
    IBM     :   720x400    70.082 Hz   9:5    31.467 kHz  28.320 MHz
    DMT 0x04:   640x480    59.940 Hz   4:3    31.469 kHz  25.175 MHz
    Apple   :   640x480    66.667 Hz   4:3    35.000 kHz  30.240 MHz
    DMT 0x05:   640x480    72.809 Hz   4:3    37.861 kHz  31.500 MHz
    DMT 0x06:   640x480    75.000 Hz   4:3    37.500 kHz  31.500 MHz
    DMT 0x08:   800x600    56.250 Hz   4:3    35.156 kHz  36.000 MHz
    DMT 0x09:   800x600    60.317 Hz   4:3    37.879 kHz  40.000 MHz
    DMT 0x0a:   800x600    72.188 Hz   4:3    48.077 kHz  50.000 MHz
    DMT 0x0b:   800x600    75.000 Hz   4:3    46.875 kHz  49.500 MHz
    Apple   :   832x624    74.551 Hz   4:3    49.726 kHz  57.284 MHz
    DMT 0x10:  1024x768    60.004 Hz   4:3    48.363 kHz  65.000 MHz
    DMT 0x11:  1024x768    70.069 Hz   4:3    56.476 kHz  75.000 MHz
    DMT 0x12:  1024x768    75.029 Hz   4:3    60.023 kHz  78.750 MHz
    DMT 0x24:  1280x1024   75.025 Hz   5:4    79.976 kHz 135.000 MHz
  Standard Timings:
    DMT 0x52:  1920x1080   60.000 Hz  16:9    67.500 kHz 148.500 MHz
    DMT 0x20:  1280x960    60.000 Hz   4:3    60.000 kHz 108.000 MHz
    DMT 0x23:  1280x1024   60.020 Hz   5:4    63.981 kHz 108.000 MHz
    DMT 0x2f:  1440x900    59.887 Hz  16:10   55.935 kHz 106.500 MHz
    DMT 0x3a:  1680x1050   59.954 Hz  16:10   65.290 kHz 146.250 MHz
    DMT 0x55:  1280x720    60.000 Hz  16:9    45.000 kHz  74.250 MHz
    DMT 0x1c:  1280x800    59.810 Hz  16:10   49.702 kHz  83.500 MHz
    DMT 0x15:  1152x864    75.000 Hz   4:3    67.500 kHz 108.000 MHz
  Detailed Timing Descriptors:
    DTD 1:  3840x2160   60.000 Hz  16:9   135.000 kHz 594.000 MHz (621 mm x 341 mm)
                 Hfront  176 Hsync  88 Hback 296 Hpol P
                 Vfront    8 Vsync  10 Vback  72 Vpol P
    DTD 2:  3840x2160   30.000 Hz  16:9    67.500 kHz 297.000 MHz (621 mm x 341 mm)
                 Hfront  176 Hsync  88 Hback 296 Hpol P
                 Vfront    8 Vsync  10 Vback  72 Vpol N
  Display Range Limits:
    Monitor ranges (GTF): 23-80 Hz V, 24-160 kHz H, max dotclock 600 MHz
    Display Product Name: 'ASUS MG28U'
  Extension blocks: 1
Checksum: 0xef

----------------

Block 1, CTA-861 Extension Block:
  Revision: 3
  Underscans IT Video Formats by default
  Basic audio support
  Supports YCbCr 4:4:4
  Supports YCbCr 4:2:2
  Native detailed modes: 1
  Video Data Block:
    VIC  16:  1920x1080   60.000 Hz  16:9    67.500 kHz 148.500 MHz (native)
    VIC   4:  1280x720    60.000 Hz  16:9    45.000 kHz  74.250 MHz
    VIC   3:   720x480    59.940 Hz  16:9    31.469 kHz  27.000 MHz
    VIC  31:  1920x1080   50.000 Hz  16:9    56.250 kHz 148.500 MHz
    VIC  19:  1280x720    50.000 Hz  16:9    37.500 kHz  74.250 MHz
    VIC   1:   640x480    59.940 Hz   4:3    31.469 kHz  25.175 MHz
    VIC  18:   720x576    50.000 Hz  16:9    31.250 kHz  27.000 MHz
    VIC  94:  3840x2160   25.000 Hz  16:9    56.250 kHz 297.000 MHz
    VIC  95:  3840x2160   30.000 Hz  16:9    67.500 kHz 297.000 MHz
    VIC  96:  3840x2160   50.000 Hz  16:9   112.500 kHz 594.000 MHz
    VIC  97:  3840x2160   60.000 Hz  16:9   135.000 kHz 594.000 MHz
    VIC  14:  1440x480    59.940 Hz   4:3    31.469 kHz  54.000 MHz
    VIC  15:  1440x480    59.940 Hz  16:9    31.469 kHz  54.000 MHz
    VIC  29:  1440x576    50.000 Hz   4:3    31.250 kHz  54.000 MHz
    VIC  30:  1440x576    50.000 Hz  16:9    31.250 kHz  54.000 MHz
    VIC   2:   720x480    59.940 Hz   4:3    31.469 kHz  27.000 MHz
    VIC  17:   720x576    50.000 Hz   4:3    31.250 kHz  27.000 MHz
    VIC  20:  1920x1080i  50.000 Hz  16:9    28.125 kHz  74.250 MHz
    VIC   5:  1920x1080i  60.000 Hz  16:9    33.750 kHz  74.250 MHz
    VIC  34:  1920x1080   30.000 Hz  16:9    33.750 kHz  74.250 MHz
    VIC  32:  1920x1080   24.000 Hz  16:9    27.000 kHz  74.250 MHz
    VIC  33:  1920x1080   25.000 Hz  16:9    28.125 kHz  74.250 MHz
  Audio Data Block:
    Linear PCM:
      Max channels: 2
      Supported sample rates (kHz): 48 44.1 32
      Supported sample sizes (bits): 24 20 16
  Speaker Allocation Data Block:
    FL/FR - Front Left/Right
  Vendor-Specific Data Block (HDMI), OUI 00-0C-03:
    Source physical address: 1.0.0.0
    DC_36bit
    DC_30bit
    DC_Y444
    Maximum TMDS clock: 600 MHz
    Extended HDMI video details:
      HDMI VICs:
        HDMI VIC 1:  3840x2160   30.000 Hz  16:9    67.500 kHz 297.000 MHz
        HDMI VIC 2:  3840x2160   25.000 Hz  16:9    56.250 kHz 297.000 MHz
        HDMI VIC 3:  3840x2160   24.000 Hz  16:9    54.000 kHz 297.000 MHz
  Vendor-Specific Data Block (HDMI Forum), OUI C4-5D-D8:
    Version: 1
    Maximum TMDS Character Rate: 600 MHz
    SCDC Present
    Supports 12-bits/component Deep Color 4:2:0 Pixel Encoding
    Supports 10-bits/component Deep Color 4:2:0 Pixel Encoding
  YCbCr 4:2:0 Capability Map Data Block:
    VIC  97:  3840x2160   60.000 Hz  16:9    67.500 kHz 297.000 MHz
    VIC  14:  1440x480    59.940 Hz   4:3    15.734 kHz  27.000 MHz
  Detailed Timing Descriptors:
    DTD 3:  2560x1440   59.951 Hz  16:9    88.787 kHz 241.500 MHz (621 mm x 341 mm)
                 Hfront   48 Hsync  32 Hback  80 Hpol P
                 Vfront    3 Vsync   5 Vback  33 Vpol P
    DTD 4:  2560x1600   59.972 Hz   8:5    98.713 kHz 268.500 MHz (621 mm x 341 mm)
                 Hfront   48 Hsync  32 Hback  80 Hpol P
                 Vfront    3 Vsync   6 Vback  37 Vpol N
    DTD 5:   640x350    70.100 Hz  64:35   31.475 kHz  25.180 MHz (621 mm x 341 mm)
                 Hfront   48 Hsync  96 Hback  16 Hpol P
                 Vfront   59 Vsync   2 Vback  38 Vpol N
Checksum: 0xb3

----------------

Warnings:

Block 1, CTA-861 Extension Block:
  YCbCr 4:2:0 Capability Map Data Block: Some YCbCr 4:2:0 timings are invalid for HDMI (which requires an RGB timings pixel rate >= 590 MHz).
  Missing VCDB, needed for Set Selectable RGB Quantization to avoid interop issues.

Failures:

Block 1, CTA-861 Extension Block:
  Vendor-Specific Data Block (HDMI): HDMI VSDB Max TMDS rate is > 340.
  HDMI VIC Codes must have their CTA-861 VIC equivalents in the VSB.
EDID:
  Base EDID: Some timings are out of range of the Monitor Ranges:
    Horizontal Freq: 15.734 - 135.000 kHz (Monitor: 24.000 - 160.000 kHz)
  CTA-861: Native progressive timings are a mix of several resolutions.

EDID conformity: FAIL
