edid-decode (hex):

00 ff ff ff ff ff ff 00 58 b3 00 00 00 00 00 00
01 16 01 03 1f 2f 1d 78 ca ba 55 a5 54 49 9b 26
13 50 54 af cf 00 01 01 01 01 01 01 01 01 01 01
01 01 01 01 01 01 66 21 50 b0 51 00 1b 30 40 70
36 00 50 00 53 00 00 1e 30 2a 00 98 51 00 2a 40
30 70 13 00 00 00 54 00 00 1e 0e 1f 00 80 51 00
1e 30 40 80 37 00 00 00 53 00 00 1c 00 00 00 fc
00 32 34 57 20 4c 43 44 2d 54 56 0a 0a 0a 00 ed

----------------

Block 0, Base EDID:
  EDID Structure Version & Revision: 1.3
  Vendor & Product Identification:
    Manufacturer: VES
    Model: 0
    Made in: week 1 of 2012
  Basic Display Parameters & Features:
    Analog display
    Input voltage level: 0.7/0.3 V
    Configurable signal levels
    Sync: Separate Composite SyncOnGreen Serration
    Maximum image size: 47 cm x 29 cm
    Gamma: 2.20
    DPMS levels: Standby Suspend
    RGB color display
    First detailed timing is preferred timing
  Color Characteristics:
    Red  : 0.6464, 0.3310
    Green: 0.2871, 0.6074
    Blue : 0.1494, 0.0751
    White: 0.3134, 0.3291
  Established Timings I & II:
    IBM     :   720x400    70.082 Hz   9:5    31.467 kHz  28.320 MHz
    DMT 0x04:   640x480    59.940 Hz   4:3    31.469 kHz  25.175 MHz
    DMT 0x05:   640x480    72.809 Hz   4:3    37.861 kHz  31.500 MHz
    DMT 0x06:   640x480    75.000 Hz   4:3    37.500 kHz  31.500 MHz
    DMT 0x08:   800x600    56.250 Hz   4:3    35.156 kHz  36.000 MHz
    DMT 0x09:   800x600    60.317 Hz   4:3    37.879 kHz  40.000 MHz
    DMT 0x0a:   800x600    72.188 Hz   4:3    48.077 kHz  50.000 MHz
    DMT 0x0b:   800x600    75.000 Hz   4:3    46.875 kHz  49.500 MHz
    DMT 0x10:  1024x768    60.004 Hz   4:3    48.363 kHz  65.000 MHz
    DMT 0x11:  1024x768    70.069 Hz   4:3    56.476 kHz  75.000 MHz
    DMT 0x12:  1024x768    75.029 Hz   4:3    60.023 kHz  78.750 MHz
    DMT 0x24:  1280x1024   75.025 Hz   5:4    79.976 kHz 135.000 MHz
  Standard Timings: none
  Detailed Timing Descriptors:
    DTD 1:  1360x768    60.015 Hz  85:48   47.712 kHz  85.500 MHz (1360 mm x 768 mm)
                 Hfront   64 Hsync 112 Hback 256 Hpol P
                 Vfront    3 Vsync   6 Vback  18 Vpol P
    DTD 2:  1280x1024   60.020 Hz   5:4    63.981 kHz 108.000 MHz (1280 mm x 1024 mm)
                 Hfront   48 Hsync 112 Hback 248 Hpol P
                 Vfront    1 Vsync   3 Vback  38 Vpol P
    DTD 3:  1280x768    59.870 Hz   5:3    47.776 kHz  79.500 MHz (1280 mm x 768 mm)
                 Hfront   64 Hsync 128 Hback 192 Hpol N
                 Vfront    3 Vsync   7 Vback  20 Vpol P
    Display Product Name: '24W LCD-TV'
Checksum: 0xed

----------------

Failures:

Block 0, Base EDID:
  Detailed Timing Descriptor #1: Mismatch of image size 1360x768 mm vs display size 470x290 mm.
  Detailed Timing Descriptor #2: Mismatch of image size 1280x1024 mm vs display size 470x290 mm.
  Detailed Timing Descriptor #3: Mismatch of image size 1280x768 mm vs display size 470x290 mm.
  Display Product Name: Non-space after newline.
  Missing Display Range Limits Descriptor.

EDID conformity: FAIL
