edid-decode (hex):

00 ff ff ff ff ff ff 00 58 b3 00 00 00 00 00 00
01 19 01 03 08 6e 3e 00 0a c6 9c 96 4e 42 8d 22
10 41 44 3f ef 00 d1 c0 01 01 01 01 01 01 01 01
01 01 01 01 01 01 6c 3a 80 b0 72 38 43 40 10 58
45 80 80 38 74 00 00 18 30 2a 00 98 51 00 2a 40
30 70 13 00 00 00 54 00 00 1e 00 00 00 fd 00 31
3d 0f 2e 08 00 0a 20 20 20 20 20 20 00 00 00 fc
00 35 30 46 48 44 5f 4c 43 44 5f 54 56 0a 00 4e

----------------

Block 0, Base EDID:
  EDID Structure Version & Revision: 1.3
  Vendor & Product Identification:
    Manufacturer: VES
    Model: 0
    Made in: week 1 of 2015
  Basic Display Parameters & Features:
    Analog display
    Input voltage level: 0.7/0.3 V
    Sync: Separate
    Maximum image size: 110 cm x 62 cm
    Gamma: 1.00
    RGB color display
    First detailed timing is preferred timing
  Color Characteristics:
    Red  : 0.5888, 0.3046
    Green: 0.2587, 0.5527
    Blue : 0.1347, 0.0634
    White: 0.2568, 0.2656
  Established Timings I & II:
    DMT 0x04:   640x480    59.940 Hz   4:3    31.469 kHz  25.175 MHz
    Apple   :   640x480    66.667 Hz   4:3    35.000 kHz  30.240 MHz
    DMT 0x05:   640x480    72.809 Hz   4:3    37.861 kHz  31.500 MHz
    DMT 0x06:   640x480    75.000 Hz   4:3    37.500 kHz  31.500 MHz
    DMT 0x08:   800x600    56.250 Hz   4:3    35.156 kHz  36.000 MHz
    DMT 0x09:   800x600    60.317 Hz   4:3    37.879 kHz  40.000 MHz
    DMT 0x0a:   800x600    72.188 Hz   4:3    48.077 kHz  50.000 MHz
    DMT 0x0b:   800x600    75.000 Hz   4:3    46.875 kHz  49.500 MHz
    Apple   :   832x624    74.551 Hz   4:3    49.726 kHz  57.284 MHz
    DMT 0x10:  1024x768    60.004 Hz   4:3    48.363 kHz  65.000 MHz
    DMT 0x11:  1024x768    70.069 Hz   4:3    56.476 kHz  75.000 MHz
    DMT 0x12:  1024x768    75.029 Hz   4:3    60.023 kHz  78.750 MHz
    DMT 0x24:  1280x1024   75.025 Hz   5:4    79.976 kHz 135.000 MHz
  Standard Timings:
    DMT 0x52:  1920x1080   60.000 Hz  16:9    67.500 kHz 148.500 MHz
  Detailed Timing Descriptors:
    DTD 1:  1920x1080   49.997 Hz  16:9    57.347 kHz 149.560 MHz (1920 mm x 1080 mm)
                 Hfront  528 Hsync  88 Hback  72 Hpol N
                 Vfront    4 Vsync   5 Vback  58 Vpol N
    DTD 2:  1280x1024   60.020 Hz   5:4    63.981 kHz 108.000 MHz (1280 mm x 1024 mm)
                 Hfront   48 Hsync 112 Hback 248 Hpol P
                 Vfront    1 Vsync   3 Vback  38 Vpol P
  Display Range Limits:
    Monitor ranges (GTF): 49-61 Hz V, 15-46 kHz H, max dotclock 80 MHz
    Display Product Name: '50FHD_LCD_TV'
Checksum: 0x4e
