edid-decode (hex):

00 ff ff ff ff ff ff 00 12 96 01 0b e9 03 00 00
25 16 01 03 68 46 27 78 0a 19 90 a7 55 46 98 24
10 49 4b af cf 00 31 19 81 8f 81 99 a9 40 81 40
81 59 61 59 71 4f 30 2a 00 98 51 00 2a 40 30 70
13 00 4b ba 10 00 00 1c f9 15 20 f8 30 58 1f 20
20 40 13 00 4b ba 10 00 00 1e 00 00 00 fc 00 50
68 69 6c 63 6f 0a 20 20 20 20 20 20 00 00 00 fd
00 38 46 0e 5b 0d 00 0a 20 20 20 20 20 20 00 91

----------------

Block 0, Base EDID:
  EDID Structure Version & Revision: 1.3
  Vendor & Product Identification:
    Manufacturer: DTV
    Model: 2817
    Serial Number: ...
    Made in: week 37 of 2012
  Basic Display Parameters & Features:
    Analog display
    Input voltage level: 0.7/0.7 V
    Blank level equals black level
    Sync: Separate
    Maximum image size: 70 cm x 39 cm
    Gamma: 2.20
    RGB color display
    First detailed timing is the preferred timing
  Color Characteristics:
    Red  : 0.6523, 0.3330
    Green: 0.2753, 0.5947
    Blue : 0.1425, 0.0634
    White: 0.2851, 0.2929
  Established Timings I & II:
    IBM     :   720x400    70.081663 Hz   9:5     31.467 kHz     28.320000 MHz
    DMT 0x04:   640x480    59.940476 Hz   4:3     31.469 kHz     25.175000 MHz
    DMT 0x05:   640x480    72.808802 Hz   4:3     37.861 kHz     31.500000 MHz
    DMT 0x06:   640x480    75.000000 Hz   4:3     37.500 kHz     31.500000 MHz
    DMT 0x08:   800x600    56.250000 Hz   4:3     35.156 kHz     36.000000 MHz
    DMT 0x09:   800x600    60.316541 Hz   4:3     37.879 kHz     40.000000 MHz
    DMT 0x0a:   800x600    72.187572 Hz   4:3     48.077 kHz     50.000000 MHz
    DMT 0x0b:   800x600    75.000000 Hz   4:3     46.875 kHz     49.500000 MHz
    DMT 0x10:  1024x768    60.003840 Hz   4:3     48.363 kHz     65.000000 MHz
    DMT 0x11:  1024x768    70.069359 Hz   4:3     56.476 kHz     75.000000 MHz
    DMT 0x12:  1024x768    75.028582 Hz   4:3     60.023 kHz     78.750000 MHz
    DMT 0x24:  1280x1024   75.024675 Hz   5:4     79.976 kHz    135.000000 MHz
  Standard Timings:
    DMT 0x02:   640x400    85.079948 Hz  16:10    37.861 kHz     31.500000 MHz
    DMT 0x24:  1280x1024   75.024675 Hz   5:4     79.976 kHz    135.000000 MHz
    DMT 0x25:  1280x1024   85.024098 Hz   5:4     91.146 kHz    157.500000 MHz
    DMT 0x33:  1600x1200   60.000000 Hz   4:3     75.000 kHz    162.000000 MHz
    DMT 0x20:  1280x960    60.000000 Hz   4:3     60.000 kHz    108.000000 MHz
    DMT 0x21:  1280x960    85.002473 Hz   4:3     85.938 kHz    148.500000 MHz
    DMT 0x13:  1024x768    84.996690 Hz   4:3     68.677 kHz     94.500000 MHz
    DMT 0x15:  1152x864    75.000000 Hz   4:3     67.500 kHz    108.000000 MHz
  Detailed Timing Descriptors:
    DTD 1:  1280x1024   60.019740 Hz   5:4     63.981 kHz    108.000000 MHz (331 mm x 186 mm)
                 Hfront   48 Hsync 112 Hback  248 Hpol N
                 Vfront    1 Vsync   3 Vback   38 Vpol P
    DTD 2:   800x600    85.061274 Hz   4:3     53.674 kHz     56.250000 MHz (331 mm x 186 mm)
                 Hfront   32 Hsync  64 Hback  152 Hpol P
                 Vfront    1 Vsync   3 Vback   27 Vpol P
    Display Product Name: 'Philco'
    Display Range Limits:
      Monitor ranges (GTF): 56-70 Hz V, 14-91 kHz H, max dotclock 130 MHz
Checksum: 0x91

----------------

Warnings:

Block 0, Base EDID:
  Detailed Timing Descriptor #1: DTD is similar but not identical to DMT 0x23.

Failures:

Block 0, Base EDID:
  Detailed Timing Descriptor #1: Mismatch of image size 331x186 mm vs display size 700x390 mm.
  Detailed Timing Descriptor #2: Mismatch of image size 331x186 mm vs display size 700x390 mm.
EDID:
  Base EDID: Some timings are out of range of the Monitor Ranges:
    Vertical Freq: 56.250 - 85.080 Hz (Monitor: 56.000 - 70.000 Hz)
    Maximum Clock: 162.000 MHz (Monitor: 130.000 MHz)

EDID conformity: FAIL
