
EDID (hex):
00ffffffffffff003438c0177f000000
170b01026c241ba7e97a689f56479926
12484cadef80d140c140a94f81998180
615945593159a659403062b0324040c0
130063091100001e000000ff00303031
32370a20202020202020000000fc0031
30363038300a202020202020000000fd
0032a01e6e1a000a2020202020200086

edid-decode (hex):

00 ff ff ff ff ff ff 00 34 38 c0 17 7f 00 00 00
17 0b 01 02 6c 24 1b a7 e9 7a 68 9f 56 47 99 26
12 48 4c ad ef 80 d1 40 c1 40 a9 4f 81 99 81 80
61 59 45 59 31 59 a6 59 40 30 62 b0 32 40 40 c0
13 00 63 09 11 00 00 1e 00 00 00 ff 00 30 30 31
32 37 0a 20 20 20 20 20 20 20 00 00 00 fc 00 31
30 36 30 38 30 0a 20 20 20 20 20 20 00 00 00 fd
00 32 a0 1e 6e 1a 00 0a 20 20 20 20 20 20 00 86

----------------

Block 0, Base EDID:
  EDID Structure Version & Revision: 1.2
  Vendor & Product Identification:
    Manufacturer: MAX
    Model: 6080
    Serial Number: 127
    Made in: week 23 of 2001
  Basic Display Parameters & Features:
    Analog display
    Signal Level Standard: 0.700 : 0.000 : 0.700 V p-p
    Blank level equals black level
    Sync: Separate Composite
    Maximum image size: 36 cm x 27 cm
    Gamma: 2.67
    DPMS levels: Standby Suspend Off
    RGB color display
    Supports GTF timings within operating range
  Color Characteristics:
    Red  : 0.6220, 0.3388
    Green: 0.2792, 0.5996
    Blue : 0.1494, 0.0722
    White: 0.2832, 0.2968
  Established Timings I & II:
    IBM     :   720x400    70.081663 Hz   9:5     31.467 kHz     28.320000 MHz
    DMT 0x04:   640x480    59.940476 Hz   4:3     31.469 kHz     25.175000 MHz
    DMT 0x05:   640x480    72.808802 Hz   4:3     37.861 kHz     31.500000 MHz
    DMT 0x06:   640x480    75.000000 Hz   4:3     37.500 kHz     31.500000 MHz
    DMT 0x09:   800x600    60.316541 Hz   4:3     37.879 kHz     40.000000 MHz
    DMT 0x0a:   800x600    72.187572 Hz   4:3     48.077 kHz     50.000000 MHz
    DMT 0x0b:   800x600    75.000000 Hz   4:3     46.875 kHz     49.500000 MHz
    Apple   :   832x624    74.551266 Hz   4:3     49.726 kHz     57.284000 MHz
    DMT 0x10:  1024x768    60.003840 Hz   4:3     48.363 kHz     65.000000 MHz
    DMT 0x11:  1024x768    70.069359 Hz   4:3     56.476 kHz     75.000000 MHz
    DMT 0x12:  1024x768    75.028582 Hz   4:3     60.023 kHz     78.750000 MHz
    DMT 0x24:  1280x1024   75.024675 Hz   5:4     79.976 kHz    135.000000 MHz
    Apple   :  1152x870    75.061550 Hz 192:145   68.681 kHz    100.000000 MHz
  Standard Timings:
    DMT 0x49:  1920x1440   60.000000 Hz   4:3     90.000 kHz    234.000000 MHz
    DMT 0x3e:  1792x1344   59.999789 Hz   4:3     83.640 kHz    204.750000 MHz
    DMT 0x36:  1600x1200   75.000000 Hz   4:3     93.750 kHz    202.500000 MHz
    DMT 0x25:  1280x1024   85.024098 Hz   5:4     91.146 kHz    157.500000 MHz
    DMT 0x23:  1280x1024   60.019740 Hz   5:4     63.981 kHz    108.000000 MHz
    DMT 0x13:  1024x768    84.996690 Hz   4:3     68.677 kHz     94.500000 MHz
    DMT 0x0c:   800x600    85.061274 Hz   4:3     53.674 kHz     56.250000 MHz
    DMT 0x07:   640x480    85.008312 Hz   4:3     43.269 kHz     36.000000 MHz
  Detailed Timing Descriptors:
    DTD 1:  1600x1200   85.000000 Hz   4:3    106.250 kHz    229.500000 MHz (355 mm x 265 mm)
                 Hfront   64 Hsync 192 Hback  304 Hpol P
                 Vfront    1 Vsync   3 Vback   46 Vpol P
    Display Product Serial Number: '00127'
    Display Product Name: '106080'
    Display Range Limits:
      Monitor ranges (GTF): 50-160 Hz V, 30-110 kHz H, max dotclock 260 MHz
Checksum: 0x86
