
EDID (hex):
00ffffffffffff0030ae0c0a01010101
131701036c2f1e782e01f5a257529f27
0a5054bdcf00714f8180818c9500950f
b300010101017c2e90a0601a1e403020
3600da281100001a000000ff00563146
313439390a2020202020000000fd0032
4c1e5315000a202020202020000000fc
004c454e204c54323235327077410077

Extracted contents:
header:          00 ff ff ff ff ff ff 00
serial number:   30 ae 0c 0a 01 01 01 01 13 17
version:         01 03
basic params:    6c 2f 1e 78 2e
chroma info:     01 f5 a2 57 52 9f 27 0a 50 54
established:     bd cf 00
standard:        71 4f 81 80 81 8c 95 00 95 0f b3 00 01 01 01 01
descriptor 1:    7c 2e 90 a0 60 1a 1e 40 30 20 36 00 da 28 11 00 00 1a
descriptor 2:    00 00 00 ff 00 56 31 46 31 34 39 39 0a 20 20 20 20 20
descriptor 3:    00 00 00 fd 00 32 4c 1e 53 15 00 0a 20 20 20 20 20 20
descriptor 4:    00 00 00 fc 00 4c 45 4e 20 4c 54 32 32 35 32 70 77 41
extensions:      00
checksum:        77

EDID version: 1.3
Manufacturer: LEN Model a0c Serial Number --
Made in week 19 of 2013
Analog display, Input voltage level: 0.7/0.7 V
Sync: Separate Composite 
Maximum image size: 47 cm x 30 cm
Gamma: 2.20
DPMS levels: Off
RGB color display
Default (sRGB) color space is primary color space
First detailed timing is preferred timing
Display x,y Chromaticity:
  Red:   0.6328, 0.3398
  Green: 0.3203, 0.6220
  Blue:  0.1552, 0.0419
  White: 0.3134, 0.3291
Established timings supported:
  720x400@70Hz 9:5 HorFreq: 31469 Hz Clock: 28.320 MHz
  640x480@60Hz 4:3 HorFreq: 31469 Hz Clock: 25.175 MHz
  640x480@67Hz 4:3 HorFreq: 35000 Hz Clock: 30.240 MHz
  640x480@72Hz 4:3 HorFreq: 37900 Hz Clock: 31.500 MHz
  640x480@75Hz 4:3 HorFreq: 37500 Hz Clock: 31.500 MHz
  800x600@60Hz 4:3 HorFreq: 37900 Hz Clock: 40.000 MHz
  800x600@72Hz 4:3 HorFreq: 48100 Hz Clock: 50.000 MHz
  800x600@75Hz 4:3 HorFreq: 46900 Hz Clock: 49.500 MHz
  1024x768@60Hz 4:3 HorFreq: 48400 Hz Clock: 65.000 MHz
  1024x768@70Hz 4:3 HorFreq: 56500 Hz Clock: 75.000 MHz
  1024x768@75Hz 4:3 HorFreq: 60000 Hz Clock: 78.750 MHz
  1280x1024@75Hz 5:4 HorFreq: 80000 Hz Clock: 135.000 MHz
Standard timings supported:
  1152x864@75Hz 4:3 HorFreq: 67500 Hz Clock: 108.000 MHz
  1280x1024@60Hz 5:4 HorFreq: 64000 Hz Clock: 108.000 MHz
  1280x1024@72Hz 5:4
  1440x900@60Hz 16:10 HorFreq: 55500 Hz Clock: 88.750 MHz
  1440x900@75Hz 16:10 HorFreq: 82300 Hz Clock: 156.000 MHz
  1680x1050@60Hz 16:10 HorFreq: 64700 Hz Clock: 119.000 MHz
Detailed mode: Clock 119.000 MHz, 474 mm x 296 mm
               1680 1728 1760 1840 hborder 0
               1050 1053 1059 1080 vborder 0
               +hsync -vsync 
               VertFreq: 59 Hz, HorFreq: 64673 Hz
Serial number: --
Monitor ranges (GTF): 50-76Hz V, 30-83kHz H, max dotclock 210MHz
Checksum: 0x77 (valid)
EDID block does NOT conform to EDID 1.3!
	sRGB is signaled, but the chromaticities do not match
	Name descriptor not terminated with a newline


