edid-decode (hex):

00 ff ff ff ff ff ff 00 30 ae 0c 0a 01 01 01 01
11 14 01 03 6c 2f 1e 78 ee dc 55 a3 59 48 9e 24
11 50 54 bd cf 00 71 4f 81 80 81 8c 95 00 95 0f
a9 00 b3 00 b3 0f 26 39 90 30 62 1a 27 40 68 b0
36 00 da 28 11 00 00 1c 00 00 00 fd 00 32 4b 1e
53 15 00 0a 20 20 20 20 20 20 00 00 00 fc 00 4c
32 32 35 30 70 20 57 69 64 65 20 20 00 00 00 ff
00 36 56 36 45 38 39 30 38 0a 20 20 20 20 00 0d

----------------

Block 0, Base EDID:
  EDID Structure Version & Revision: 1.3
  Vendor & Product Identification:
    Manufacturer: LEN
    Model: 2572
    Serial Number: ...
    Made in: week 17 of 2010
  Basic Display Parameters & Features:
    Analog display
    Input voltage level: 0.7/0.7 V
    Sync: Separate Composite
    Maximum image size: 47 cm x 30 cm
    Gamma: 2.20
    DPMS levels: Standby Suspend Off
    RGB color display
    Default (sRGB) color space is primary color space
    First detailed timing is preferred timing
  Color Characteristics:
    Red  : 0.6396, 0.3486
    Green: 0.2841, 0.6171
    Blue : 0.1416, 0.0673
    White: 0.3134, 0.3291
  Established Timings I & II:
    IBM     :   720x400    70.082 Hz   9:5    31.467 kHz  28.320 MHz
    DMT 0x04:   640x480    59.940 Hz   4:3    31.469 kHz  25.175 MHz
    Apple   :   640x480    66.667 Hz   4:3    35.000 kHz  30.240 MHz
    DMT 0x05:   640x480    72.809 Hz   4:3    37.861 kHz  31.500 MHz
    DMT 0x06:   640x480    75.000 Hz   4:3    37.500 kHz  31.500 MHz
    DMT 0x09:   800x600    60.317 Hz   4:3    37.879 kHz  40.000 MHz
    DMT 0x0a:   800x600    72.188 Hz   4:3    48.077 kHz  50.000 MHz
    DMT 0x0b:   800x600    75.000 Hz   4:3    46.875 kHz  49.500 MHz
    DMT 0x10:  1024x768    60.004 Hz   4:3    48.363 kHz  65.000 MHz
    DMT 0x11:  1024x768    70.069 Hz   4:3    56.476 kHz  75.000 MHz
    DMT 0x12:  1024x768    75.029 Hz   4:3    60.023 kHz  78.750 MHz
    DMT 0x24:  1280x1024   75.025 Hz   5:4    79.976 kHz 135.000 MHz
  Standard Timings:
    DMT 0x15:  1152x864    75.000 Hz   4:3    67.500 kHz 108.000 MHz
    DMT 0x23:  1280x1024   60.020 Hz   5:4    63.981 kHz 108.000 MHz
    GTF     :  1280x1024   72.000 Hz   5:4    76.824 kHz 132.752 MHz
    DMT 0x2f:  1440x900    59.887 Hz  16:10   55.935 kHz 106.500 MHz
    DMT 0x30:  1440x900    74.984 Hz  16:10   70.635 kHz 136.750 MHz
    GTF     :  1600x1000   60.000 Hz  16:10   62.100 kHz 133.142 MHz
    DMT 0x3a:  1680x1050   59.954 Hz  16:10   65.290 kHz 146.250 MHz
    DMT 0x3b:  1680x1050   74.892 Hz  16:10   82.306 kHz 187.000 MHz
  Detailed Timing Descriptors:
    DTD 1:  1680x1050   59.975 Hz   8:5    65.312 kHz 146.300 MHz (474 mm x 296 mm)
                 Hfront  104 Hsync 176 Hback 280 Hpol N
                 Vfront    3 Vsync   6 Vback  30 Vpol P
  Display Range Limits:
    Monitor ranges (GTF): 50-75 Hz V, 30-83 kHz H, max dotclock 210 MHz
    Display Product Name: 'L2250p Wide  '
    Display Product Serial Number: ...
Checksum: 0xd

----------------

Failures:

Block 0, Base EDID:
  Basic Display Parameters & Features: sRGB is signaled, but the chromaticities do not match.
  Display Product Name: One or more trailing spaces.

EDID conformity: FAIL
