
EDID (hex):
00ffffffffffff0030ae0c0a01010101
241601036c2f1e78eedc55a359489e24
115054bdcf00714f8180818c9500950f
a900b300b30f26399030621a274068b0
3600da281100001c000000fd00324b1e
5315000a202020202020000000fc004c
323235307020576964652020000000ff
00365638424b4c39300a2020202000d2

Extracted contents:
header:          00 ff ff ff ff ff ff 00
serial number:   30 ae 0c 0a 01 01 01 01 24 16
version:         01 03
basic params:    6c 2f 1e 78 ee
chroma info:     dc 55 a3 59 48 9e 24 11 50 54
established:     bd cf 00
standard:        71 4f 81 80 81 8c 95 00 95 0f a9 00 b3 00 b3 0f
descriptor 1:    26 39 90 30 62 1a 27 40 68 b0 36 00 da 28 11 00 00 1c
descriptor 2:    00 00 00 fd 00 32 4b 1e 53 15 00 0a 20 20 20 20 20 20
descriptor 3:    00 00 00 fc 00 4c 32 32 35 30 70 20 57 69 64 65 20 20
descriptor 4:    00 00 00 ff 00 36 56 38 42 4b 4c 39 30 0a 20 20 20 20
extensions:      00
checksum:        d2

EDID version: 1.3
Manufacturer: LEN Model a0c Serial Number --
Made in week 36 of 2012
Analog display, Input voltage level: 0.7/0.7 V
Sync: Separate Composite 
Maximum image size: 47 cm x 30 cm
Gamma: 2.20
DPMS levels: Standby Suspend Off
RGB color display
Default (sRGB) color space is primary color space
First detailed timing is preferred timing
Display x,y Chromaticity:
  Red:   0.6396, 0.3486
  Green: 0.2841, 0.6171
  Blue:  0.1416, 0.0673
  White: 0.3134, 0.3291
Established timings supported:
  720x400@70Hz 9:5 HorFreq: 31469 Hz Clock: 28.320 MHz
  640x480@60Hz 4:3 HorFreq: 31469 Hz Clock: 25.175 MHz
  640x480@67Hz 4:3 HorFreq: 35000 Hz Clock: 30.240 MHz
  640x480@72Hz 4:3 HorFreq: 37900 Hz Clock: 31.500 MHz
  640x480@75Hz 4:3 HorFreq: 37500 Hz Clock: 31.500 MHz
  800x600@60Hz 4:3 HorFreq: 37900 Hz Clock: 40.000 MHz
  800x600@72Hz 4:3 HorFreq: 48100 Hz Clock: 50.000 MHz
  800x600@75Hz 4:3 HorFreq: 46900 Hz Clock: 49.500 MHz
  1024x768@60Hz 4:3 HorFreq: 48400 Hz Clock: 65.000 MHz
  1024x768@70Hz 4:3 HorFreq: 56500 Hz Clock: 75.000 MHz
  1024x768@75Hz 4:3 HorFreq: 60000 Hz Clock: 78.750 MHz
  1280x1024@75Hz 5:4 HorFreq: 80000 Hz Clock: 135.000 MHz
Standard timings supported:
  1152x864@75Hz 4:3 HorFreq: 67500 Hz Clock: 108.000 MHz
  1280x1024@60Hz 5:4 HorFreq: 64000 Hz Clock: 108.000 MHz
  1280x1024@72Hz 5:4
  1440x900@60Hz 16:10 HorFreq: 55500 Hz Clock: 88.750 MHz
  1440x900@75Hz 16:10 HorFreq: 82300 Hz Clock: 156.000 MHz
  1600x1000@60Hz 16:10
  1680x1050@60Hz 16:10 HorFreq: 64700 Hz Clock: 119.000 MHz
  1680x1050@75Hz 16:10 HorFreq: 82300 Hz Clock: 187.000 MHz
Detailed mode: Clock 146.300 MHz, 474 mm x 296 mm
               1680 1784 1960 2240 hborder 0
               1050 1053 1059 1089 vborder 0
               -hsync +vsync 
               VertFreq: 59 Hz, HorFreq: 65312 Hz
Monitor ranges (GTF): 50-75Hz V, 30-83kHz H, max dotclock 210MHz
Serial number: --
Checksum: 0xd2 (valid)
EDID block does NOT conform to EDID 1.3!
	sRGB is signaled, but the chromaticities do not match
	Name descriptor not terminated with a newline
