edid-decode (hex):

00 ff ff ff ff ff ff 00 09 e5 67 0a 00 00 00 00
1a 1f 01 04 a5 22 13 78 07 01 25 a5 53 4b a0 27
0e 50 54 00 00 00 01 01 01 01 01 01 01 01 01 01
01 01 01 01 01 01 ce 68 00 ca a0 a0 b3 50 30 20
36 00 58 c2 10 00 00 18 00 00 00 fd 0c 3c f0 86
86 6b 01 0a 20 20 20 20 20 20 00 00 00 fe 00 42
4f 45 20 43 51 0a 20 20 20 20 20 20 00 00 00 fe
00 4e 45 31 35 36 51 48 4d 2d 4e 5a 31 0a 01 26

70 13 79 00 00 03 01 14 85 a3 01 84 ff 09 cb 00
2f 00 1f 00 9f 05 b2 00 02 00 05 00 00 00 00 00
00 00 00 00 00 00 00 00 00 00 00 00 00 00 00 00
00 00 00 00 00 00 00 00 00 00 00 00 00 00 00 00
00 00 00 00 00 00 00 00 00 00 00 00 00 00 00 00
00 00 00 00 00 00 00 00 00 00 00 00 00 00 00 00
00 00 00 00 00 00 00 00 00 00 00 00 00 00 00 00
00 00 00 00 00 00 00 00 00 00 00 00 00 00 31 90

----------------

Block 0, Base EDID:
  EDID Structure Version & Revision: 1.4
  Vendor & Product Identification:
    Manufacturer: BOE
    Model: 2663
    Made in: week 26 of 2021
  Basic Display Parameters & Features:
    Digital display
    Bits per primary color channel: 8
    DisplayPort interface
    Maximum image size: 34 cm x 19 cm
    Gamma: 2.20
    Supported color formats: RGB 4:4:4
    Default (sRGB) color space is primary color space
    First detailed timing includes the native pixel format and preferred refresh rate
    Display is continuous frequency
  Color Characteristics:
    Red  : 0.6445, 0.3242
    Green: 0.2929, 0.6259
    Blue : 0.1523, 0.0566
    White: 0.3134, 0.3291
  Established Timings I & II: none
  Standard Timings: none
  Detailed Timing Descriptors:
    DTD 1:  2560x1440   59.999848 Hz  16:9     97.140 kHz    268.300000 MHz (344 mm x 194 mm)
                 Hfront   48 Hsync  32 Hback  122 Hpol N
                 Vfront    3 Vsync   6 Vback  170 Vpol N
    Display Range Limits:
      Monitor ranges (Bare Limits): 60-240 Hz V, 389-389 kHz H, max dotclock 1070 MHz
    Alphanumeric Data String: 'BOE CQ'
    Alphanumeric Data String: 'NE156QHM-NZ1'
  Extension blocks: 1
Checksum: 0x26

----------------

Block 1, DisplayID Extension Block:
  Version: 1.3
  Extension Count: 0
  Display Product Type: Extension Section
  Video Timing Modes Type 1 - Detailed Timings Data Block:
    DTD:  2560x1440  240.000036 Hz  16:9    388.560 kHz   1073.980000 MHz (aspect 16:9, no 3D stereo, preferred)
               Hfront   48 Hsync  32 Hback  124 Hpol N
               Vfront    3 Vsync   6 Vback  170 Vpol N
  Checksum: 0x31
Checksum: 0x90

----------------

Warnings:

EDID:
  Base EDID: Some timings are out of range of the Monitor Ranges:
    Horizontal Freq: 97.139 - 388.560 kHz (Monitor: 389.000 - 389.000 kHz)
    Maximum Clock: 1073.980 MHz (Monitor: 1070.000 MHz)

Failures:

Block 0, Base EDID:
  Basic Display Parameters & Features: sRGB is signaled, but the chromaticities do not match.
  Missing Display Product Name.
Block 1, DisplayID Extension Block:
  DisplayID Base Block has no product type.
EDID:
  DisplayID: Missing DisplayID Product Identification Data Block.

EDID conformity: FAIL
