
EDID (hex):
00ffffffffffff001e6d2f5a2b620700
0518010380301e78ea23c5a5574f9e26
0f5054a54b80714f818f81806140614f
0101010101017c2e90a0601a1e403020
3600e02c1100001a000000fd00384b1e
530f000a202020202020000000fc0032
324d4236350a202020202020000000ff
003430354e444d5445373838330a007a

Extracted contents:
header:          00 ff ff ff ff ff ff 00
serial number:   1e 6d 2f 5a 2b 62 07 00 05 18
version:         01 03
basic params:    80 30 1e 78 ea
chroma info:     23 c5 a5 57 4f 9e 26 0f 50 54
established:     a5 4b 80
standard:        71 4f 81 8f 81 80 61 40 61 4f 01 01 01 01 01 01
descriptor 1:    7c 2e 90 a0 60 1a 1e 40 30 20 36 00 e0 2c 11 00 00 1a
descriptor 2:    00 00 00 fd 00 38 4b 1e 53 0f 00 0a 20 20 20 20 20 20
descriptor 3:    00 00 00 fc 00 32 32 4d 42 36 35 0a 20 20 20 20 20 20
descriptor 4:    00 00 00 ff 00 34 30 35 4e 44 4d 54 45 37 38 38 33 0a
extensions:      00
checksum:        7a

EDID version: 1.3
Manufacturer: GSM Model 5a2f Serial Number --
Made in week 5 of 2014
Digital display
Maximum image size: 48 cm x 30 cm
Gamma: 2.20
DPMS levels: Standby Suspend Off
RGB color display
First detailed timing is preferred timing
Display x,y Chromaticity:
  Red:   0.6445, 0.3417
  Green: 0.3085, 0.6201
  Blue:  0.1513, 0.0585
  White: 0.3134, 0.3291
Established timings supported:
  720x400@70Hz 9:5 HorFreq: 31469 Hz Clock: 28.320 MHz
  640x480@60Hz 4:3 HorFreq: 31469 Hz Clock: 25.175 MHz
  640x480@75Hz 4:3 HorFreq: 37500 Hz Clock: 31.500 MHz
  800x600@60Hz 4:3 HorFreq: 37900 Hz Clock: 40.000 MHz
  800x600@75Hz 4:3 HorFreq: 46900 Hz Clock: 49.500 MHz
  1024x768@60Hz 4:3 HorFreq: 48400 Hz Clock: 65.000 MHz
  1024x768@75Hz 4:3 HorFreq: 60000 Hz Clock: 78.750 MHz
  1280x1024@75Hz 5:4 HorFreq: 80000 Hz Clock: 135.000 MHz
  1152x870@75Hz 192:145 HorFreq: 67500 Hz Clock: 108.000 MHz
Standard timings supported:
  1152x864@75Hz 4:3 HorFreq: 67500 Hz Clock: 108.000 MHz
  1280x1024@75Hz 5:4 HorFreq: 80000 Hz Clock: 135.000 MHz
  1280x1024@60Hz 5:4 HorFreq: 64000 Hz Clock: 108.000 MHz
  1024x768@60Hz 4:3 HorFreq: 48400 Hz Clock: 65.000 MHz
  1024x768@75Hz 4:3 HorFreq: 60000 Hz Clock: 78.750 MHz
Detailed mode: Clock 119.000 MHz, 480 mm x 300 mm
               1680 1728 1760 1840 hborder 0
               1050 1053 1059 1080 vborder 0
               +hsync -vsync 
               VertFreq: 59 Hz, HorFreq: 64673 Hz
Monitor ranges (GTF): 56-75Hz V, 30-83kHz H, max dotclock 150MHz
Monitor name: 22MB65
Serial number: --
Checksum: 0x7a (valid)
