edid-decode (hex):

00 ff ff ff ff ff ff 00 30 e4 19 04 00 00 00 00
00 17 01 03 a0 1f 11 78 02 42 95 a1 5a 57 94 27
0d 50 54 00 00 00 01 01 01 01 01 01 01 01 01 01
01 01 01 01 01 01 e4 5c 00 a0 a0 a0 11 50 30 20
23 00 36 ae 10 00 00 1a 00 00 00 00 00 00 00 00
00 00 00 00 00 00 00 00 00 00 00 00 00 fe 00 4c
47 20 44 69 73 70 6c 61 79 0a 20 20 00 00 00 fe
00 4c 50 31 34 30 51 48 31 2d 53 50 42 31 00 bc

----------------

Block 0, Base EDID:
  EDID Structure Version & Revision: 1.3
  Vendor & Product Identification:
    Manufacturer: LGD
    Model: 1049
    Made in: 2013
  Basic Display Parameters & Features:
    Digital display
    Maximum image size: 31 cm x 17 cm
    Gamma: 2.20
    Monochrome or grayscale display
    First detailed timing is the preferred timing
  Color Characteristics:
    Red  : 0.6298, 0.3515
    Green: 0.3398, 0.5800
    Blue : 0.1542, 0.0517
    White: 0.3134, 0.3291
  Established Timings I & II: none
  Standard Timings: none
  Detailed Timing Descriptors:
    DTD 1:  2560x1440   60.004441 Hz  16:9     87.426 kHz    237.800000 MHz (310 mm x 174 mm)
                 Hfront   48 Hsync  32 Hback   80 Hpol P
                 Vfront    2 Vsync   3 Vback   12 Vpol N
    Empty Descriptor
    Alphanumeric Data String: 'LG Display'
    Alphanumeric Data String: 'LP140QH1-SPB1'
Checksum: 0xbc

----------------

Failures:

Block 0, Base EDID:
  Basic Display Parameters & Features: Digital Video Interface Standard set to reserved value 0x20.
  Empty Descriptor: Use Dummy Descriptor instead of all zeroes.
  Missing Display Product Name.
  Missing Display Range Limits Descriptor.

EDID conformity: FAIL
