edid-decode (hex):

00 ff ff ff ff ff ff 00 09 e5 48 09 00 00 00 00
12 1e 01 04 95 1f 11 78 06 eb 25 a5 54 4a 9f 25
0e 50 54 00 00 00 01 01 01 01 01 01 01 01 01 01
01 01 01 01 01 01 c0 39 80 18 71 38 28 40 30 20
36 00 35 ae 10 00 00 1a 34 2e 80 18 71 38 28 40
30 20 36 00 35 ae 10 00 00 1a 00 00 00 fe 00 47
58 48 43 4d 80 00 00 00 00 00 00 00 00 00 00 00
00 01 41 20 9e 00 11 00 00 09 01 0a 20 20 00 49

----------------

Block 0, Base EDID:
  EDID Structure Version & Revision: 1.4
  Vendor & Product Identification:
    Manufacturer: BOE
    Model: 2376
    Made in: week 18 of 2020
  Basic Display Parameters & Features:
    Digital display
    Bits per primary color channel: 6
    DisplayPort interface
    Maximum image size: 31 cm x 17 cm
    Gamma: 2.20
    Supported color formats: RGB 4:4:4
    Default (sRGB) color space is primary color space
    First detailed timing includes the native pixel format and preferred refresh rate
  Color Characteristics:
    Red  : 0.6474, 0.3300
    Green: 0.2910, 0.6240
    Blue : 0.1445, 0.0566
    White: 0.3134, 0.3291
  Established Timings I & II: none
  Standard Timings: none
  Detailed Timing Descriptors:
    DTD 1:  1920x1080   60.000000 Hz  16:9     67.200 kHz    147.840000 MHz (309 mm x 174 mm)
                 Hfront   48 Hsync  32 Hback  200 Hpol P
                 Vfront    3 Vsync   6 Vback   31 Vpol N
    DTD 2:  1920x1080   48.003247 Hz  16:9     53.764 kHz    118.280000 MHz (309 mm x 174 mm)
                 Hfront   48 Hsync  32 Hback  200 Hpol P
                 Vfront    3 Vsync   6 Vback   31 Vpol N
    Alphanumeric Data String: 'GXHCM'
    Manufacturer-Specified Display Descriptor (0x00): 00 00 00 01 41 20 9e 00 11 00 00 09 01 0a 20 20 '....A ........  '
Checksum: 0x49

----------------

Failures:

Block 0, Base EDID:
  Basic Display Parameters & Features: sRGB is signaled, but the chromaticities do not match.
  Alphanumeric Data String: Non-printable character.
  Missing Display Product Name.

EDID conformity: FAIL
