edid-decode (hex):

00 ff ff ff ff ff ff 00 0d ae 41 14 00 00 00 00
28 1f 01 04 a5 1e 13 78 03 28 65 97 59 54 8e 27
1e 50 54 00 00 00 01 01 01 01 01 01 01 01 01 01
01 01 01 01 01 01 42 3c 80 a0 70 b0 24 40 30 20
a6 00 2d bc 10 00 00 18 35 30 80 a0 70 b0 24 40
30 20 a6 00 2d bc 10 00 00 18 00 00 00 fd 00 28
3c 4b 4b 10 01 0a 20 20 20 20 20 20 00 00 00 fe
00 4e 31 34 30 4a 43 41 2d 45 4c 4b 0a 20 01 13

02 03 0d 00 68 1a 00 00 01 01 28 3c 00 00 00 00
00 00 00 00 00 00 00 00 00 00 00 00 00 00 00 00
00 00 00 00 00 00 00 00 00 00 00 00 00 00 00 00
00 00 00 00 00 00 00 00 00 00 00 00 00 00 00 00
00 00 00 00 00 00 00 00 00 00 00 00 00 00 00 00
00 00 00 00 00 00 00 00 00 00 00 00 00 00 00 00
00 00 00 00 00 00 00 00 00 00 00 00 00 00 00 00
00 00 00 00 00 00 00 00 00 00 00 00 00 00 00 06

----------------

Block 0, Base EDID:
  EDID Structure Version & Revision: 1.4
  Vendor & Product Identification:
    Manufacturer: CMN
    Model: 5185
    Made in: week 40 of 2021
  Basic Display Parameters & Features:
    Digital display
    Bits per primary color channel: 8
    DisplayPort interface
    Maximum image size: 30 cm x 19 cm
    Gamma: 2.20
    Supported color formats: RGB 4:4:4
    First detailed timing includes the native pixel format and preferred refresh rate
    Display is continuous frequency
  Color Characteristics:
    Red  : 0.5898, 0.3496
    Green: 0.3300, 0.5546
    Blue : 0.1533, 0.1191
    White: 0.3134, 0.3291
  Established Timings I & II: none
  Standard Timings: none
  Detailed Timing Descriptors:
    DTD 1:  1920x1200   60.002801 Hz   8:5     74.163 kHz    154.260000 MHz (301 mm x 188 mm)
                 Hfront   48 Hsync  32 Hback   80 Hpol N
                 Vfront   10 Vsync   6 Vback   20 Vpol N
    DTD 2:  1920x1200   48.003018 Hz   8:5     59.332 kHz    123.410000 MHz (301 mm x 188 mm)
                 Hfront   48 Hsync  32 Hback   80 Hpol N
                 Vfront   10 Vsync   6 Vback   20 Vpol N
    Display Range Limits:
      Monitor ranges (Bare Limits): 40-60 Hz V, 75-75 kHz H, max dotclock 160 MHz
    Alphanumeric Data String: 'N140JCA-ELK'
  Extension blocks: 1
Checksum: 0x13

----------------

Block 1, CTA-861 Extension Block:
  Revision: 3
  Native detailed modes: 0
  Vendor-Specific Data Block (AMD), OUI 00-00-1A:
    Version: 1.1
    Minimum Refresh Rate: 40 Hz
    Maximum Refresh Rate: 60 Hz
    Flags 1.x: 0x00
Checksum: 0x06

----------------

Warnings:

Block 1, CTA-861 Extension Block:
  IT Video Formats are overscanned by default, but normally this should be underscanned.
EDID:
  Base EDID: Some timings are out of range of the Monitor Ranges:
    Horizontal Freq: 59.331 - 74.163 kHz (Monitor: 75.000 - 75.000 kHz)

Failures:

Block 0, Base EDID:
  Missing Display Product Name.
Block 1, CTA-861 Extension Block:
  Required 640x480p60 timings are missing in the established timings and the SVD list (VIC 1).
  Missing VCDB, needed for Set Selectable RGB Quantization to avoid interop issues.

EDID conformity: FAIL
