edid-decode (hex):

00 ff ff ff ff ff ff 00 59 3a 06 10 01 01 01 01
00 18 01 03 80 5d 34 78 2a 94 0d a2 56 54 96 25
0d 47 4a a5 ce 00 d1 c0 01 01 01 01 01 01 01 01
01 01 01 01 01 01 04 74 80 18 71 38 2d 40 58 2c
45 00 a2 0b 32 00 00 1e 02 3a 80 18 71 38 2d 40
58 2c 45 00 a2 0b 32 00 00 1e 00 00 00 fc 00 4d
34 32 32 69 2d 42 31 0a 20 20 20 20 00 00 00 fd
00 38 78 1f 87 1e 00 0a 20 20 20 20 20 20 01 e6

02 03 2a 71 4d 01 06 07 02 03 05 90 04 20 2f 30
31 3f 26 09 07 07 15 07 50 83 01 00 00 6c 03 0c
00 40 00 00 3c c0 01 01 01 01 04 74 80 18 71 38
2d 40 58 2c 45 00 a2 0b 32 00 00 1e 02 3a 80 18
71 38 2d 40 58 2c 45 00 a2 0b 32 00 00 1e 01 1d
00 72 51 d0 1e 20 6e 28 55 00 a2 0b 32 00 00 1e
8c 0a a0 14 51 f0 16 00 26 7c 43 00 a2 0b 32 00
00 98 00 00 00 00 00 00 00 00 00 00 00 00 00 20

----------------

Block 0, Base EDID:
  EDID Structure Version & Revision: 1.3
  Vendor & Product Identification:
    Manufacturer: VIZ
    Model: 4102
    Serial Number: ...
    Made in: 2014
  Basic Display Parameters & Features:
    Digital display
    Maximum image size: 93 cm x 52 cm
    Gamma: 2.20
    DPMS levels: Off
    RGB color display
    First detailed timing is the preferred timing
  Color Characteristics:
    Red  : 0.6347, 0.3369
    Green: 0.3291, 0.5859
    Blue : 0.1445, 0.0507
    White: 0.2802, 0.2900
  Established Timings I & II:
    IBM     :   720x400    70.082 Hz   9:5    31.467 kHz  28.320 MHz
    DMT 0x04:   640x480    59.940 Hz   4:3    31.469 kHz  25.175 MHz
    DMT 0x06:   640x480    75.000 Hz   4:3    37.500 kHz  31.500 MHz
    DMT 0x09:   800x600    60.317 Hz   4:3    37.879 kHz  40.000 MHz
    DMT 0x0a:   800x600    72.188 Hz   4:3    48.077 kHz  50.000 MHz
    DMT 0x0b:   800x600    75.000 Hz   4:3    46.875 kHz  49.500 MHz
    DMT 0x10:  1024x768    60.004 Hz   4:3    48.363 kHz  65.000 MHz
    DMT 0x11:  1024x768    70.069 Hz   4:3    56.476 kHz  75.000 MHz
    DMT 0x12:  1024x768    75.029 Hz   4:3    60.023 kHz  78.750 MHz
  Standard Timings:
    DMT 0x52:  1920x1080   60.000 Hz  16:9    67.500 kHz 148.500 MHz
  Detailed Timing Descriptors:
    DTD 1:  1920x1080  120.000 Hz  16:9   135.000 kHz 297.000 MHz (930 mm x 523 mm)
                 Hfront   88 Hsync  44 Hback 148 Hpol P
                 Vfront    4 Vsync   5 Vback  36 Vpol P
    DTD 2:  1920x1080   60.000 Hz  16:9    67.500 kHz 148.500 MHz (930 mm x 523 mm)
                 Hfront   88 Hsync  44 Hback 148 Hpol P
                 Vfront    4 Vsync   5 Vback  36 Vpol P
    Display Product Name: 'M422i-B1'
  Display Range Limits:
    Monitor ranges (GTF): 56-120 Hz V, 31-135 kHz H, max dotclock 300 MHz
  Extension blocks: 1
Checksum: 0xe6

----------------

Block 1, CTA-861 Extension Block:
  Revision: 3
  Basic audio support
  Supports YCbCr 4:4:4
  Supports YCbCr 4:2:2
  Native detailed modes: 1
  Video Data Block:
    VIC   1:   640x480    59.940 Hz   4:3    31.469 kHz  25.175 MHz
    VIC   6:  1440x480i   59.940 Hz   4:3    15.734 kHz  27.000 MHz
    VIC   7:  1440x480i   59.940 Hz  16:9    15.734 kHz  27.000 MHz
    VIC   2:   720x480    59.940 Hz   4:3    31.469 kHz  27.000 MHz
    VIC   3:   720x480    59.940 Hz  16:9    31.469 kHz  27.000 MHz
    VIC   5:  1920x1080i  60.000 Hz  16:9    33.750 kHz  74.250 MHz
    VIC  16:  1920x1080   60.000 Hz  16:9    67.500 kHz 148.500 MHz (native)
    VIC   4:  1280x720    60.000 Hz  16:9    45.000 kHz  74.250 MHz
    VIC  32:  1920x1080   24.000 Hz  16:9    27.000 kHz  74.250 MHz
    VIC  47:  1280x720   120.000 Hz  16:9    90.000 kHz 148.500 MHz
    VIC  48:   720x480   119.880 Hz   4:3    62.937 kHz  54.000 MHz
    VIC  49:   720x480   119.880 Hz  16:9    62.937 kHz  54.000 MHz
    VIC  63:  1920x1080  120.000 Hz  16:9   135.000 kHz 297.000 MHz
  Audio Data Block:
    Linear PCM:
      Max channels: 2
      Supported sample rates (kHz): 48 44.1 32
      Supported sample sizes (bits): 24 20 16
    AC-3:
      Max channels: 6
      Supported sample rates (kHz): 48 44.1 32
      Maximum bit rate: 640 kb/s
  Speaker Allocation Data Block:
    FL/FR - Front Left/Right
  Vendor-Specific Data Block (HDMI), OUI 00-0C-03:
    Source physical address: 4.0.0.0
    Maximum TMDS clock: 300 MHz
    Video latency: 3 ms
    Audio latency: 3 ms
    Interlaced video latency: 3 ms
    Interlaced audio latency: 3 ms
  Detailed Timing Descriptors:
    DTD 3:  1920x1080  120.000 Hz  16:9   135.000 kHz 297.000 MHz (930 mm x 523 mm)
                 Hfront   88 Hsync  44 Hback 148 Hpol P
                 Vfront    4 Vsync   5 Vback  36 Vpol P
    DTD 4:  1920x1080   60.000 Hz  16:9    67.500 kHz 148.500 MHz (930 mm x 523 mm)
                 Hfront   88 Hsync  44 Hback 148 Hpol P
                 Vfront    4 Vsync   5 Vback  36 Vpol P
    DTD 5:  1280x720    60.000 Hz  16:9    45.000 kHz  74.250 MHz (930 mm x 523 mm)
                 Hfront  110 Hsync  40 Hback 220 Hpol P
                 Vfront    5 Vsync   5 Vback  20 Vpol P
    DTD 6:  1440x480i   59.940 Hz   3:1    15.734 kHz  27.000 MHz (930 mm x 523 mm)
                 Hfront   38 Hsync 124 Hback 114 Hpol N
                 Vfront    4 Vsync   3 Vback  15 Vpol N Vfront +0.5 Odd Field
                 Vfront    4 Vsync   3 Vback  15 Vpol N Vback  +0.5 Even Field
Checksum: 0x20

----------------

Warnings:

Block 1, CTA-861 Extension Block:
  IT Video Formats are overscanned by default, but normally this should be underscanned.
  Missing VCDB, needed for Set Selectable RGB Quantization to avoid interop issues.
EDID:
  CTA-861: Multiple native progressive timings are defined.

Failures:

EDID:
  Base EDID: Some timings are out of range of the Monitor Ranges:
    Vertical Freq: 24.000 - 120.000 Hz (Monitor: 56.000 - 120.000 Hz)
    Horizontal Freq: 15.734 - 135.000 kHz (Monitor: 31.000 - 135.000 kHz)

EDID conformity: FAIL
