
EDID (hex):
00ffffffffffff003dc2260001000000
0115010485000078813d85a6564a9a24
12505400000001010101010101010101
010101010101861b5666500020302820
3c00a05a0000001e0000000000000000
00000000000000000000000000000000
00000000000000000000000000000000
00000000000000000000000000000022

Extracted contents:
header:          00 ff ff ff ff ff ff 00
serial number:   3d c2 26 00 01 00 00 00 01 15
version:         01 04
basic params:    85 00 00 78 81
chroma info:     3d 85 a6 56 4a 9a 24 12 50 54
established:     00 00 00
standard:        01 01 01 01 01 01 01 01 01 01 01 01 01 01 01 01
descriptor 1:    86 1b 56 66 50 00 20 30 28 20 3c 00 a0 5a 00 00 00 1e
descriptor 2:    00 00 00 00 00 00 00 00 00 00 00 00 00 00 00 00 00 00
descriptor 3:    00 00 00 00 00 00 00 00 00 00 00 00 00 00 00 00 00 00
descriptor 4:    00 00 00 00 00 00 00 00 00 00 00 00 00 00 00 00 00 00
extensions:      00
checksum:        22

EDID version: 1.4
Manufacturer: ONB Model 26 Serial Number --
Made in week 1 of 2011
Digital display
Color depth is undefined
DisplayPort interface
Image size is variable
Gamma: 2.20
DPMS levels: Standby
Supported color formats: RGB 4:4:4
Display is continuous frequency
Display x,y Chromaticity:
  Red:   0.6484, 0.3388
  Green: 0.2919, 0.6025
  Blue:  0.1425, 0.0703
  White: 0.3134, 0.3291
Established timings supported:
Standard timings supported:
Detailed mode: Clock 70.460 MHz, 160 mm x 90 mm
               1366 1406 1438 1468 hborder 0
                768  771  783  800 vborder 0
               +hsync +vsync 
               VertFreq: 59 Hz, HorFreq: 47997 Hz
Manufacturer-specified data, tag 0
Manufacturer-specified data, tag 0
Manufacturer-specified data, tag 0
Checksum: 0x22 (valid)
EDID block does NOT conform to EDID 1.4!
	Missing name descriptor
	Missing monitor ranges
