edid-decode (hex):

00 ff ff ff ff ff ff 00 04 72 4c 05 0f b3 30 64
2b 1a 01 04 a5 45 1d 78 06 ee 91 a3 54 4c 99 26
0f 50 54 21 08 00 01 01 01 01 01 01 01 01 01 01
01 01 01 01 01 01 cd 46 00 a0 a0 38 1f 40 30 20
3a 00 b2 23 21 00 00 1a 00 00 00 ff 00 23 41 53
4f 4d 51 73 67 30 6b 45 72 64 00 00 00 fd 00 1e
90 42 a6 2e 01 0a 20 20 20 20 20 20 00 00 00 fc
00 5a 33 30 31 43 0a 20 20 20 20 20 20 20 01 52

02 03 12 41 23 09 07 01 83 01 00 00 65 4b 04 00
01 01 77 65 00 a0 a0 38 2c 40 30 20 3a 00 b2 23
21 00 00 1a 50 78 00 a0 a0 38 35 40 30 20 3a 00
b2 23 21 00 00 1a cd 91 00 a0 a0 38 40 40 30 20
3a 00 b2 23 21 00 00 1a f4 b0 00 a0 a0 38 4d 40
30 20 3a 00 b2 23 21 00 00 1a 00 00 00 00 00 00
00 00 00 00 00 00 00 00 00 00 00 00 00 00 00 00
00 00 00 00 00 00 00 00 00 00 00 00 00 00 00 5e

00 ff ff ff ff ff ff 00 04 72 4c 05 0f b3 30 64
2b 1a 01 04 a5 45 1d 78 06 ee 91 a3 54 4c 99 26
0f 50 54 21 08 00 01 01 01 01 01 01 01 01 01 01
01 01 01 01 01 01 cd 46 00 a0 a0 38 1f 40 30 20
3a 00 b2 23 21 00 00 1a 00 00 00 ff 00 23 41 53
4f 4d 51 73 67 30 6b 45 72 64 00 00 00 fd 00 1e
90 42 a6 2e 01 0a 20 20 20 20 20 20 00 00 00 fc
00 5a 33 30 31 43 0a 20 20 20 20 20 20 20 01 52

02 03 12 41 23 09 07 01 83 01 00 00 65 4b 04 00
01 01 77 65 00 a0 a0 38 2c 40 30 20 3a 00 b2 23
21 00 00 1a 50 78 00 a0 a0 38 35 40 30 20 3a 00
b2 23 21 00 00 1a cd 91 00 a0 a0 38 40 40 30 20
3a 00 b2 23 21 00 00 1a f4 b0 00 a0 a0 38 4d 40
30 20 3a 00 b2 23 21 00 00 1a 00 00 00 00 00 00
00 00 00 00 00 00 00 00 00 00 00 00 00 00 00 00
00 00 00 00 00 00 00 00 00 00 00 00 00 00 00 5e

----------------

Block 0, Base EDID:
  EDID Structure Version & Revision: 1.4
  Vendor & Product Identification:
    Manufacturer: ACR
    Model: 1356
    Serial Number: ...
    Made in: week 43 of 2016
  Basic Display Parameters & Features:
    Digital display
    Bits per primary color channel: 8
    DisplayPort interface
    Maximum image size: 69 cm x 29 cm
    Gamma: 2.20
    Supported color formats: RGB 4:4:4
    Default (sRGB) color space is primary color space
    First detailed timing includes the native pixel format and preferred refresh rate
  Color Characteristics:
    Red  : 0.6396, 0.3300
    Green: 0.2998, 0.5996
    Blue : 0.1503, 0.0595
    White: 0.3125, 0.3291
  Established Timings I & II:
    DMT 0x04:   640x480    59.940476 Hz   4:3     31.469 kHz     25.175000 MHz
    DMT 0x09:   800x600    60.316541 Hz   4:3     37.879 kHz     40.000000 MHz
    DMT 0x10:  1024x768    60.003840 Hz   4:3     48.363 kHz     65.000000 MHz
  Standard Timings: none
  Detailed Timing Descriptors:
    DTD 1:  2560x1080   59.978424 Hz  64:27    66.636 kHz    181.250000 MHz (690 mm x 291 mm)
                 Hfront   48 Hsync  32 Hback   80 Hpol P
                 Vfront    3 Vsync  10 Vback   18 Vpol N
    Display Product Serial Number: ...
    Display Range Limits:
      Monitor ranges (Bare Limits): 30-144 Hz V, 66-166 kHz H, max dotclock 460 MHz
    Display Product Name: 'Z301C'
  Extension blocks: 1
Checksum: 0x52

----------------

Block 1, CTA-861 Extension Block:
  Revision: 3
  Basic audio support
  Native detailed modes: 1
  Audio Data Block:
    Linear PCM:
      Max channels: 2
      Supported sample rates (kHz): 48 44.1 32
      Supported sample sizes (bits): 16
  Speaker Allocation Data Block:
    FL/FR - Front Left/Right
  Vendor-Specific Data Block (NVIDIA), OUI 00-04-4B:
    01 01                                           '..'
  Detailed Timing Descriptors:
    DTD 2:  2560x1080   84.961142 Hz  64:27    95.496 kHz    259.750000 MHz (690 mm x 291 mm)
                 Hfront   48 Hsync  32 Hback   80 Hpol P
                 Vfront    3 Vsync  10 Vback   31 Vpol N
    DTD 3:  2560x1080   99.942890 Hz  64:27   113.235 kHz    308.000000 MHz (690 mm x 291 mm)
                 Hfront   48 Hsync  32 Hback   80 Hpol P
                 Vfront    3 Vsync  10 Vback   40 Vpol N
    DTD 4:  2560x1080  119.951280 Hz  64:27   137.224 kHz    373.250000 MHz (690 mm x 291 mm)
                 Hfront   48 Hsync  32 Hback   80 Hpol P
                 Vfront    3 Vsync  10 Vback   51 Vpol N
    DTD 5:  2560x1080  143.944786 Hz  64:27   166.544 kHz    453.000000 MHz (690 mm x 291 mm)
                 Hfront   48 Hsync  32 Hback   80 Hpol P
                 Vfront    3 Vsync  10 Vback   64 Vpol N
Checksum: 0x5e  Unused space in Extension Block: 37 bytes

----------------

Block 2, Unknown EDID Extension Block 0x00:
  00 ff ff ff ff ff ff 00 04 72 4c 05 0f b3 30 64 '.........rL...0d'
  2b 1a 01 04 a5 45 1d 78 06 ee 91 a3 54 4c 99 26 '+....E.x....TL.&'
  0f 50 54 21 08 00 01 01 01 01 01 01 01 01 01 01 '.PT!............'
  01 01 01 01 01 01 cd 46 00 a0 a0 38 1f 40 30 20 '.......F...8.@0 '
  3a 00 b2 23 21 00 00 1a 00 00 00 ff 00 23 41 53 ':..#!........#AS'
  4f 4d 51 73 67 30 6b 45 72 64 00 00 00 fd 00 1e 'OMQsg0kErd......'
  90 42 a6 2e 01 0a 20 20 20 20 20 20 00 00 00 fc '.B....      ....'
  00 5a 33 30 31 43 0a 20 20 20 20 20 20 20 01 52 '.Z301C.       .R'
Checksum: 0x52

----------------

Block 3, CTA-861 Extension Block:
  Revision: 3
  Basic audio support
  Native detailed modes: 1
  Audio Data Block:
    Linear PCM:
      Max channels: 2
      Supported sample rates (kHz): 48 44.1 32
      Supported sample sizes (bits): 16
  Speaker Allocation Data Block:
    FL/FR - Front Left/Right
  Vendor-Specific Data Block (NVIDIA), OUI 00-04-4B:
    01 01                                           '..'
  Detailed Timing Descriptors:
    DTD 6:  2560x1080   84.961142 Hz  64:27    95.496 kHz    259.750000 MHz (690 mm x 291 mm)
                 Hfront   48 Hsync  32 Hback   80 Hpol P
                 Vfront    3 Vsync  10 Vback   31 Vpol N
    DTD 7:  2560x1080   99.942890 Hz  64:27   113.235 kHz    308.000000 MHz (690 mm x 291 mm)
                 Hfront   48 Hsync  32 Hback   80 Hpol P
                 Vfront    3 Vsync  10 Vback   40 Vpol N
    DTD 8:  2560x1080  119.951280 Hz  64:27   137.224 kHz    373.250000 MHz (690 mm x 291 mm)
                 Hfront   48 Hsync  32 Hback   80 Hpol P
                 Vfront    3 Vsync  10 Vback   51 Vpol N
    DTD 9:  2560x1080  143.944786 Hz  64:27   166.544 kHz    453.000000 MHz (690 mm x 291 mm)
                 Hfront   48 Hsync  32 Hback   80 Hpol P
                 Vfront    3 Vsync  10 Vback   64 Vpol N
Checksum: 0x5e  Unused space in Extension Block: 37 bytes

----------------

Warnings:

Block 1, CTA-861 Extension Block:
  IT Video Formats are overscanned by default, but normally this should be underscanned.
  Display Product Serial Number is set, so the Serial Number in the Base EDID should be 0.
Block 3, CTA-861 Extension Block:
  IT Video Formats are overscanned by default, but normally this should be underscanned.
  Display Product Serial Number is set, so the Serial Number in the Base EDID should be 0.
EDID:
  Base EDID: Some timings are out of range of the Monitor Ranges:
    Horizontal Freq: 31.468 - 166.544 kHz (Monitor: 66.000 - 166.000 kHz)

Failures:

Block 1, CTA-861 Extension Block:
  Missing VCDB, needed for Set Selectable RGB Quantization to avoid interop issues.
Block 2, Base EDID:
  Unknown Extension Block.
Block 3, CTA-861 Extension Block:
  Speaker Allocation Data Block: Only one instance of this Data Block is allowed.
  Missing VCDB, needed for Set Selectable RGB Quantization to avoid interop issues.
EDID:
  Base EDID: EDID specified 1 extension block(s), but found 3 extension block(s).

EDID conformity: FAIL
