edid-decode (hex):

00 ff ff ff ff ff ff 00 4c a3 47 31 00 00 00 00
00 15 01 03 80 21 12 78 0a 09 e5 97 57 54 8a 27
22 50 54 00 00 00 01 01 01 01 01 01 01 01 01 01
01 01 01 01 01 01 38 27 40 c0 60 84 20 30 30 20
25 00 4c bb 10 00 00 19 00 00 00 0f 00 00 00 00
00 00 00 00 00 40 80 09 16 00 00 00 00 fe 00 53
41 4d 53 55 4e 47 0a 20 20 20 20 20 00 00 00 fe
00 4c 54 4e 31 35 30 4b 54 30 32 38 0a 20 00 c9

----------------

Block 0, Base EDID:
  EDID Structure Version & Revision: 1.3
  Vendor & Product Identification:
    Manufacturer: SEC
    Model: 12615
    Made in: 2011
  Basic Display Parameters & Features:
    Digital display
    Maximum image size: 33 cm x 18 cm
    Gamma: 2.20
    RGB color display
    First detailed timing is the preferred timing
  Color Characteristics:
    Red  : 0.5898, 0.3398
    Green: 0.3300, 0.5400
    Blue : 0.1552, 0.1347
    White: 0.3134, 0.3291
  Established Timings I & II: none
  Standard Timings: none
  Detailed Timing Descriptors:
    DTD 1:  1600x900    60.114577 Hz  16:9     56.027 kHz    100.400000 MHz (332 mm x 187 mm)
                 Hfront   48 Hsync  32 Hback  112 Hpol N
                 Vfront    2 Vsync   5 Vback   25 Vpol N
    Manufacturer-Specified Display Descriptor (0x0f): 00 0f 00 00 00 00 00 00 00 00 00 40 80 09 16 00 '...........@....'
    Alphanumeric Data String: 'SAMSUNG'
    Alphanumeric Data String: 'LTN150KT028'
Checksum: 0xc9

----------------

Failures:

Block 0, Base EDID:
  Missing Display Product Name.
  Missing Display Range Limits Descriptor.

EDID conformity: FAIL
