edid-decode (hex):

00 ff ff ff ff ff ff 00 15 c3 88 23 01 01 01 01
2c 18 01 03 80 34 21 78 ea 01 f5 a2 57 52 9f 27
0a 50 54 21 08 00 a9 40 81 80 81 40 b3 00 81 c0
01 01 01 01 01 01 28 3c 80 a0 70 b0 23 40 30 20
36 00 07 44 21 00 00 1a 00 00 00 ff 00 39 35 35
33 34 31 30 34 0a 20 20 20 20 00 00 00 fd 00 3b
3d 1f 4c 10 00 0a 20 20 20 20 20 20 00 00 00 fc
00 45 56 32 34 31 36 57 0a 20 20 20 20 20 00 23

00 ff ff ff ff ff ff 00 15 c3 88 23 01 01 01 01
2c 18 01 03 80 34 21 78 ea 01 f5 a2 57 52 9f 27
0a 50 54 21 08 00 a9 40 81 80 81 40 b3 00 81 c0
01 01 01 01 01 01 28 3c 80 a0 70 b0 23 40 30 20
36 00 07 44 21 00 00 1a 00 00 00 ff 00 39 35 35
33 34 31 30 34 0a 20 20 20 20 00 00 00 fd 00 3b
3d 1f 4c 10 00 0a 20 20 20 20 20 20 00 00 00 fc
00 45 56 32 34 31 36 57 0a 20 20 20 20 20 00 23

----------------

Block 0, Base EDID:
  EDID Structure Version & Revision: 1.3
  Vendor & Product Identification:
    Manufacturer: ENC
    Model: 9096
    Serial Number: ...
    Made in: week 44 of 2014
  Basic Display Parameters & Features:
    Digital display
    Maximum image size: 52 cm x 33 cm
    Gamma: 2.20
    DPMS levels: Standby Suspend Off
    RGB color display
    First detailed timing is the preferred timing
  Color Characteristics:
    Red  : 0.6328, 0.3398
    Green: 0.3203, 0.6220
    Blue : 0.1552, 0.0419
    White: 0.3134, 0.3291
  Established Timings I & II:
    DMT 0x04:   640x480    59.940476 Hz   4:3     31.469 kHz     25.175000 MHz
    DMT 0x09:   800x600    60.316541 Hz   4:3     37.879 kHz     40.000000 MHz
    DMT 0x10:  1024x768    60.003840 Hz   4:3     48.363 kHz     65.000000 MHz
  Standard Timings:
    DMT 0x33:  1600x1200   60.000000 Hz   4:3     75.000 kHz    162.000000 MHz
    DMT 0x23:  1280x1024   60.019740 Hz   5:4     63.981 kHz    108.000000 MHz
    DMT 0x20:  1280x960    60.000000 Hz   4:3     60.000 kHz    108.000000 MHz
    DMT 0x3a:  1680x1050   59.954250 Hz  16:10    65.290 kHz    146.250000 MHz
    DMT 0x55:  1280x720    60.000000 Hz  16:9     45.000 kHz     74.250000 MHz
  Detailed Timing Descriptors:
    DTD 1:  1920x1200   59.950171 Hz  16:10    74.038 kHz    154.000000 MHz (519 mm x 324 mm)
                 Hfront   48 Hsync  32 Hback   80 Hpol P
                 Vfront    3 Vsync   6 Vback   26 Vpol N
    Display Product Serial Number: ...
    Display Range Limits:
      Monitor ranges (GTF): 59-61 Hz V, 31-76 kHz H, max dotclock 160 MHz
    Display Product Name: 'EV2416W'
Checksum: 0x23

----------------

Block 1, Unknown EDID Extension Block 0x00:
  00 ff ff ff ff ff ff 00 15 c3 88 23 01 01 01 01 '...........#....'
  2c 18 01 03 80 34 21 78 ea 01 f5 a2 57 52 9f 27 ',....4!x....WR.''
  0a 50 54 21 08 00 a9 40 81 80 81 40 b3 00 81 c0 '.PT!...@...@....'
  01 01 01 01 01 01 28 3c 80 a0 70 b0 23 40 30 20 '......(<..p.#@0 '
  36 00 07 44 21 00 00 1a 00 00 00 ff 00 39 35 35 '6..D!........955'
  33 34 31 30 34 0a 20 20 20 20 00 00 00 fd 00 3b '34104.    .....;'
  3d 1f 4c 10 00 0a 20 20 20 20 20 20 00 00 00 fc '=.L...      ....'
  00 45 56 32 34 31 36 57 0a 20 20 20 20 20 00 23 '.EV2416W.     .#'
Checksum: 0x23

----------------

Warnings:

EDID:
  Base EDID: Some timings are out of range of the Monitor Ranges:
    Maximum Clock: 162.000 MHz (Monitor: 160.000 MHz)
    Could be due to a Monitor Range off-by-one rounding issue

Failures:

Block 1, Base EDID:
  Unknown Extension Block.
EDID:
  Base EDID: EDID specified 0 extension block(s), but found 1 extension block(s).

EDID conformity: FAIL
