edid-decode (hex):

00 ff ff ff ff ff ff 00 0d ae 49 12 00 00 00 00
07 1e 01 04 a5 1a 11 78 03 ee 95 a3 54 4c 99 26
0f 50 54 00 00 00 01 01 01 01 01 01 01 01 01 01
01 01 01 01 01 01 41 40 80 a0 70 00 26 50 30 20
a6 00 03 ac 10 00 00 18 00 00 00 fe 00 4e 31 32
33 4e 43 41 2d 47 53 31 0a 20 00 00 00 fe 00 43
4d 4e 0a 20 20 20 20 20 20 20 20 20 00 00 00 fe
00 4e 31 32 33 4e 43 41 2d 47 53 31 0a 20 00 2d

----------------

Block 0, Base EDID:
  EDID Structure Version & Revision: 1.4
  Vendor & Product Identification:
    Manufacturer: CMN
    Model: 4681
    Made in: week 7 of 2020
  Basic Display Parameters & Features:
    Digital display
    Bits per primary color channel: 8
    DisplayPort interface
    Maximum image size: 26 cm x 17 cm
    Gamma: 2.20
    Supported color formats: RGB 4:4:4
    First detailed timing includes the native pixel format and preferred refresh rate
    Display is continuous frequency
  Color Characteristics:
    Red  : 0.6396, 0.3300
    Green: 0.2998, 0.5996
    Blue : 0.1503, 0.0595
    White: 0.3134, 0.3291
  Established Timings I & II: none
  Standard Timings: none
  Detailed Timing Descriptors:
    DTD 1:  1920x1280   60.001313 Hz   3:2     79.082 kHz    164.490000 MHz (259 mm x 172 mm)
                 Hfront   48 Hsync  32 Hback   80 Hpol N
                 Vfront   10 Vsync   6 Vback   22 Vpol N
    Alphanumeric Data String: 'N123NCA-GS1'
    Alphanumeric Data String: 'CMN'
    Alphanumeric Data String: 'N123NCA-GS1'
Checksum: 0x2d

----------------

Failures:

Block 0, Base EDID:
  Missing Display Product Name.
  Missing Display Range Limits Descriptor.

EDID conformity: FAIL
