edid-decode (hex):

00 ff ff ff ff ff ff 00 30 e4 14 04 00 00 00 00
00 17 01 04 95 1c 10 78 02 b5 45 99 59 57 91 27
1f 50 54 00 00 00 01 01 01 01 01 01 01 01 01 01
01 01 01 01 01 01 16 36 80 ba 70 38 0f 40 30 20
35 00 14 9c 10 00 00 1a 00 00 00 00 00 00 00 00
00 00 00 00 00 00 00 00 00 00 00 00 00 fe 00 4c
47 20 44 69 73 70 6c 61 79 0a 20 20 00 00 00 fe
00 4c 50 31 32 35 57 46 32 2d 53 50 42 31 00 c4

----------------

Block 0, Base EDID:
  EDID Structure Version & Revision: 1.4
  Vendor & Product Identification:
    Manufacturer: LGD
    Model: 1044
    Made in: 2013
  Basic Display Parameters & Features:
    Digital display
    Bits per primary color channel: 6
    DisplayPort interface
    Maximum image size: 28 cm x 16 cm
    Gamma: 2.20
    Supported color formats: RGB 4:4:4
    First detailed timing includes the native pixel format and preferred refresh rate
  Color Characteristics:
    Red  : 0.5996, 0.3505
    Green: 0.3408, 0.5673
    Blue : 0.1533, 0.1210
    White: 0.3134, 0.3291
  Established Timings I & II: none
  Standard Timings: none
  Detailed Timing Descriptors:
    DTD 1:  1920x1080   60.042 Hz  16:9    65.745 kHz 138.460 MHz (276 mm x 156 mm)
                 Hfront   48 Hsync  32 Hback 106 Hpol P
                 Vfront    3 Vsync   5 Vback   7 Vpol N
    Empty Descriptor
    Alphanumeric Data String: 'LG Display'
    Alphanumeric Data String: 'LP125WF2-SPB1'
Checksum: 0xc4

----------------

Failures:

Block 0, Base EDID:
  Empty Descriptor: Use Dummy Descriptor instead of all zeroes.
  Missing Display Product Name.

EDID conformity: FAIL
