
EDID (hex):
00ffffffffffff0009e5e00700000000
041c0104a51c1078028d909a5a579128
1e505400000001010101010101010101
010101010101413780cc70381e403020
3600149c1000001a0000000000000000
00000000000000000000000000fc0042
4f452048460a202020202020000000fc
004e5631323546484d2d4e38340a0056

edid-decode (hex):

00 ff ff ff ff ff ff 00 09 e5 e0 07 00 00 00 00
04 1c 01 04 a5 1c 10 78 02 8d 90 9a 5a 57 91 28
1e 50 54 00 00 00 01 01 01 01 01 01 01 01 01 01
01 01 01 01 01 01 41 37 80 cc 70 38 1e 40 30 20
36 00 14 9c 10 00 00 1a 00 00 00 00 00 00 00 00
00 00 00 00 00 00 00 00 00 00 00 00 00 fc 00 42
4f 45 20 48 46 0a 20 20 20 20 20 20 00 00 00 fc
00 4e 56 31 32 35 46 48 4d 2d 4e 38 34 0a 00 56

----------------

Block 0, Base EDID:
  EDID Structure Version & Revision: 1.4
  Vendor & Product Identification:
    Manufacturer: BOE
    Model: 2016
    Made in: week 4 of 2018
  Basic Display Parameters & Features:
    Digital display
    Bits per primary color channel: 8
    DisplayPort interface
    Maximum image size: 28 cm x 16 cm
    Gamma: 2.20
    Supported color formats: RGB 4:4:4
    First detailed timing includes the native pixel format and preferred refresh rate
  Color Characteristics:
    Red  : 0.6035, 0.3515
    Green: 0.3427, 0.5673
    Blue : 0.1582, 0.1181
    White: 0.3125, 0.3281
  Established Timings I & II: none
  Standard Timings: none
  Detailed Timing Descriptors:
    DTD 1:  1920x1080   59.996437 Hz  16:9     66.596 kHz    141.450000 MHz (276 mm x 156 mm)
                 Hfront   48 Hsync  32 Hback  124 Hpol P
                 Vfront    3 Vsync   6 Vback   21 Vpol N
    Empty Descriptor
    Display Product Name: 'BOE HF'
    Display Product Name: 'NV125FHM-N84'
Checksum: 0x56
