edid-decode (hex):

00 ff ff ff ff ff ff 00 30 e4 62 03 00 00 00 00
00 15 01 03 80 1f 11 78 02 a3 e5 96 59 55 8e 27
1f 50 54 00 00 00 01 01 01 01 01 01 01 01 01 01
01 01 01 01 01 01 1c 2a 40 40 61 84 24 30 30 20
35 00 35 ae 10 00 00 19 00 00 00 00 00 00 00 00
00 00 00 00 00 00 00 00 00 00 00 00 00 fe 00 4c
47 20 44 69 73 70 6c 61 79 0a 20 20 00 00 00 fe
00 4c 50 31 34 30 57 44 32 2d 54 4c 44 32 00 56

----------------

Block 0, Base EDID:
  EDID Structure Version & Revision: 1.3
  Vendor & Product Identification:
    Manufacturer: LGD
    Model: 866
    Made in: 2011
  Basic Display Parameters & Features:
    Digital display
    Maximum image size: 31 cm x 17 cm
    Gamma: 2.20
    Monochrome or grayscale display
    First detailed timing is preferred timing
  Color Characteristics:
    Red  : 0.5878, 0.3496
    Green: 0.3320, 0.5576
    Blue : 0.1552, 0.1230
    White: 0.3134, 0.3291
  Established Timings I & II: none
  Standard Timings: none
  Detailed Timing Descriptors:
    DTD 1:  1600x900    59.985 Hz  16:9    56.146 kHz 107.800 MHz (309 mm x 174 mm)
                 Hfront   48 Hsync  32 Hback 240 Hpol N
                 Vfront    3 Vsync   5 Vback  28 Vpol N
    Empty Descriptor
    Alphanumeric Data String: 'LG Display'
    Alphanumeric Data String: 'LP140WD2-TLD2'
Checksum: 0x56

----------------

Failures:

Block 0, Base EDID:
  Empty Descriptor: Use Dummy Descriptor instead of all zeroes.
  Missing Display Product Name.
  Missing Display Range Limits Descriptor.

EDID conformity: FAIL
