
EDID (hex):
00ffffffffffff0026cd6361b8040000
1a1f010380361e782a4620a25a50a223
0a5054a56b80710081408180a940b300
9500950fd1c0023a801871382d40582c
45001f2e2100001e000000ff00313138
33313132363031323038000000fd0028
a51eb828000a202020202020000000fc
00504c3235373048530a2020202001a4
020349f1509005040302011112131406
0715161f3f230907078301000067030c
001000383c67d85dc4015080006d1a00
00020128a5e60000000000e305c301e6
0605015f5f28e200ea5a8780a070384d
40302035001f2e2100001ad09480a070
381e40082035001f2e2100001a866f80
a070384040302035001f2e2100001a80

Extracted contents:
header:          00 ff ff ff ff ff ff 00
serial number:   26 cd 63 61 b8 04 00 00 1a 1f
version:         01 03
basic params:    80 36 1e 78 2a
chroma info:     46 20 a2 5a 50 a2 23 0a 50 54
established:     a5 6b 80
standard:        71 00 81 40 81 80 a9 40 b3 00 95 00 95 0f d1 c0
descriptor 1:    02 3a 80 18 71 38 2d 40 58 2c 45 00 1f 2e 21 00 00 1e
descriptor 2:    00 00 00 ff 00 31 31 38 33 31 31 32 36 30 31 32 30 38
descriptor 3:    00 00 00 fd 00 28 a5 1e b8 28 00 0a 20 20 20 20 20 20
descriptor 4:    00 00 00 fc 00 50 4c 32 35 37 30 48 53 0a 20 20 20 20
extensions:      01
checksum:        a4

EDID version: 1.3
Manufacturer: IVM Model 6163 Serial Number --
Made in week 26 of 2021
Digital display
Maximum image size: 54 cm x 30 cm
Gamma: 2.20
DPMS levels: Off
RGB color display
First detailed timing is preferred timing
Display x,y Chromaticity:
  Red:   0.6337, 0.3515
  Green: 0.3134, 0.6347
  Blue:  0.1367, 0.0410
  White: 0.3125, 0.3281
Established timings supported:
  720x400@70Hz 9:5 HorFreq: 31469 Hz Clock: 28.320 MHz
  640x480@60Hz 4:3 HorFreq: 31469 Hz Clock: 25.175 MHz
  640x480@75Hz 4:3 HorFreq: 37500 Hz Clock: 31.500 MHz
  800x600@60Hz 4:3 HorFreq: 37900 Hz Clock: 40.000 MHz
  800x600@75Hz 4:3 HorFreq: 46900 Hz Clock: 49.500 MHz
  832x624@75Hz 4:3 HorFreq: 49726 Hz Clock: 57.284 MHz
  1024x768@60Hz 4:3 HorFreq: 48400 Hz Clock: 65.000 MHz
  1024x768@75Hz 4:3 HorFreq: 60000 Hz Clock: 78.750 MHz
  1280x1024@75Hz 5:4 HorFreq: 80000 Hz Clock: 135.000 MHz
  1152x870@75Hz 192:145 HorFreq: 67500 Hz Clock: 108.000 MHz
Standard timings supported:
  1152x720@60Hz 16:10
  1280x960@60Hz 4:3 HorFreq: 60000 Hz Clock: 108.000 MHz
  1280x1024@60Hz 5:4 HorFreq: 64000 Hz Clock: 108.000 MHz
  1600x1200@60Hz 4:3 HorFreq: 75000 Hz Clock: 162.000 MHz
  1680x1050@60Hz 16:10 HorFreq: 64700 Hz Clock: 119.000 MHz
  1440x900@60Hz 16:10 HorFreq: 55500 Hz Clock: 88.750 MHz
  1440x900@75Hz 16:10 HorFreq: 82300 Hz Clock: 156.000 MHz
  1920x1080@60Hz 16:9
Detailed mode: Clock 148.500 MHz, 543 mm x 302 mm
               1920 2008 2052 2200 hborder 0
               1080 1084 1089 1125 vborder 0
               +hsync +vsync 
               VertFreq: 60 Hz, HorFreq: 67500 Hz
Serial number: --
Monitor ranges (GTF): 40-165Hz V, 30-184kHz H, max dotclock 400MHz
Monitor name: PL2570HS
Has 1 extension blocks
Checksum: 0xa4 (valid)

CTA extension block
Extension version: 3
69 bytes of CTA data
  Video data block
    VIC  16 1920x1080@60Hz 16:9 (native) HorFreq: 67500 Hz Clock: 148.500 MHz
    VIC   5 1920x1080i@60Hz 16:9  HorFreq: 33750 Hz Clock: 74.250 MHz
    VIC   4 1280x720@60Hz 16:9  HorFreq: 45000 Hz Clock: 74.250 MHz
    VIC   3 720x480@60Hz 16:9  HorFreq: 31469 Hz Clock: 27.000 MHz
    VIC   2 720x480@60Hz 4:3  HorFreq: 31469 Hz Clock: 27.000 MHz
    VIC   1 640x480@60Hz 4:3  HorFreq: 31469 Hz Clock: 25.175 MHz
    VIC  17 720x576@50Hz 4:3  HorFreq: 31250 Hz Clock: 27.000 MHz
    VIC  18 720x576@50Hz 16:9  HorFreq: 31250 Hz Clock: 27.000 MHz
    VIC  19 1280x720@50Hz 16:9  HorFreq: 37500 Hz Clock: 74.250 MHz
    VIC  20 1920x1080i@50Hz 16:9  HorFreq: 28125 Hz Clock: 74.250 MHz
    VIC   6 1440x480i@60Hz 4:3  HorFreq: 15734 Hz Clock: 27.000 MHz
    VIC   7 1440x480i@60Hz 16:9  HorFreq: 15734 Hz Clock: 27.000 MHz
    VIC  21 1440x576i@50Hz 4:3  HorFreq: 15625 Hz Clock: 27.000 MHz
    VIC  22 1440x576i@50Hz 16:9  HorFreq: 15625 Hz Clock: 27.000 MHz
    VIC  31 1920x1080@50Hz 16:9  HorFreq: 56250 Hz Clock: 148.500 MHz
    VIC  63 1920x1080@120Hz 16:9  HorFreq: 135000 Hz Clock: 297.000 MHz
  Audio data block
    Linear PCM, max channels 2
      Supported sample rates (kHz): 48 44.1 32
      Supported sample sizes (bits): 24 20 16
  Speaker allocation data block
    Speaker map:
      FL/FR - Front Left/Right
  Vendor-specific data block, OUI 000c03 (HDMI)
    Source physical address 1.0.0.0
    DC_36bit
    DC_30bit
    DC_Y444
    Maximum TMDS clock: 300MHz
  Vendor-specific data block, OUI c45dd8 (HDMI Forum)
    Version: 1
    Maximum TMDS Character Rate: 400MHz
    SCDC Present
  Vendor-specific data block, OUI 00001a
  Extended tag: Colorimetry data block
    xvYCC601
    xvYCC709
    BT2020YCC
    BT2020RGB
  Extended tag: HDR static metadata data block
    Electro optical transfer functions:
      Traditional gamma - SDR luminance range
      SMPTE ST2084
    Supported static metadata descriptors:
      Static metadata type 1
    Desired content max luminance: 95 (391.429 cd/m^2)
    Desired content max frame-average luminance: 95 (391.429 cd/m^2)
    Desired content min luminance: 40 (0.096 cd/m^2)
  Extended tag: Video capability data block
    YCbCr quantization: Selectable (via AVI YQ) (1)
    RGB quantization: Selectable (via AVI Q) (1)
    PT scan behaviour: Always Underscanned (2)
    IT scan behaviour: Always Underscanned (2)
    CE scan behaviour: Always Underscanned (2)
Underscans PC formats by default
Basic audio support
Supports YCbCr 4:4:4
Supports YCbCr 4:2:2
1 native detailed modes
Detailed mode: Clock 346.500 MHz, 543 mm x 302 mm
               1920 1968 2000 2080 hborder 0
               1080 1083 1088 1157 vborder 0
               +hsync -vsync 
               VertFreq: 143 Hz, HorFreq: 166586 Hz
Detailed mode: Clock 380.960 MHz, 543 mm x 302 mm
               1920 1928 1960 2080 hborder 0
               1080 1083 1088 1110 vborder 0
               +hsync -vsync 
               VertFreq: 165 Hz, HorFreq: 183153 Hz
Checksum: 0x80 (valid)

One or more of the timings is out of range of the Monitor Ranges:
  Vertical Freq: 50 - 165 Hz
  Horizontal Freq: 15625 - 183153 Hz
  Maximum Clock: 380.960 MHz
EDID block does not conform at all!
	Both the serial number and the serial string are set
