edid-decode (hex):

00 ff ff ff ff ff ff 00 4d 10 d4 14 00 00 00 00
0e 1d 01 04 a5 22 13 78 07 de 50 a3 54 4c 99 26
0f 50 54 00 00 00 01 01 01 01 01 01 01 01 01 01
01 01 01 01 01 01 50 d0 80 50 70 38 1f 40 18 28
35 00 58 c2 10 00 00 18 14 34 80 50 70 38 1f 40
18 28 35 00 58 c2 10 00 00 18 00 00 00 10 00 00
00 00 00 00 00 00 00 00 00 00 00 00 00 00 00 fc
00 4c 51 31 35 36 4d 31 4a 57 30 38 0a 20 00 cb

----------------

Block 0, Base EDID:
  EDID Structure Version & Revision: 1.4
  Vendor & Product Identification:
    Manufacturer: SHP
    Model: 5332
    Made in: week 14 of 2019
  Basic Display Parameters & Features:
    Digital display
    Bits per primary color channel: 8
    DisplayPort interface
    Maximum image size: 34 cm x 19 cm
    Gamma: 2.20
    Supported color formats: RGB 4:4:4
    Default (sRGB) color space is primary color space
    First detailed timing includes the native pixel format and preferred refresh rate
    Display is continuous frequency
  Color Characteristics:
    Red  : 0.6396, 0.3291
    Green: 0.2998, 0.5996
    Blue : 0.1494, 0.0595
    White: 0.3125, 0.3281
  Established Timings I & II: none
  Standard Timings: none
  Detailed Timing Descriptors:
    DTD 1:  1920x1080  240.000 Hz  16:9   266.640 kHz 533.280 MHz (344 mm x 194 mm)
                 Hfront   24 Hsync  40 Hback  16 Hpol N
                 Vfront    3 Vsync   5 Vback  23 Vpol N
    DTD 2:  1920x1080   60.000 Hz  16:9    66.660 kHz 133.320 MHz (344 mm x 194 mm)
                 Hfront   24 Hsync  40 Hback  16 Hpol N
                 Vfront    3 Vsync   5 Vback  23 Vpol N
    Dummy Descriptor:
    Display Product Name: 'LQ156M1JW08'
Checksum: 0xcb

----------------

Failures:

Block 0, Base EDID:
  Basic Display Parameters & Features: sRGB is signaled, but the chromaticities do not match.
  Missing Display Range Limits Descriptor.

EDID conformity: FAIL
