
EDID (hex):
00ffffffffffff0006103aaec296b582
07200104c53c2178000f91ae5243b026
0f505400000001010101010101010101
01010101010100000010000000000000
00000000000000000000001000000000
00000000000000000000000000100000
000000000000000000000000000000fc
0053747564696f446973706c617902bb
02030f80e3050000e606010173730070
bc0078a04078b00820a8080000000000
1a000000000000000000000000000000
00000000000000000000000000000000
00000000000000000000000000000000
00000000000000000000000000000000
00000000000000000000000000000000
00000000000000000000000000000012
70127900002900106e023d3b3dcd4a35
adb93b0acc3510c901000c4017140d00
14400b10784ebb7f81070010fa040100
0012001680101000ff093f0b00000000
004150503baec296b5827e00053a0292
81007e00100010fa0501010060c0d2ff
55001000100000000000000000000000
00000000000000000000000000007190

edid-decode (hex):

00 ff ff ff ff ff ff 00 06 10 3a ae c2 96 b5 82
07 20 01 04 c5 3c 21 78 00 0f 91 ae 52 43 b0 26
0f 50 54 00 00 00 01 01 01 01 01 01 01 01 01 01
01 01 01 01 01 01 00 00 00 10 00 00 00 00 00 00
00 00 00 00 00 00 00 00 00 00 00 10 00 00 00 00
00 00 00 00 00 00 00 00 00 00 00 00 00 10 00 00
00 00 00 00 00 00 00 00 00 00 00 00 00 00 00 fc
00 53 74 75 64 69 6f 44 69 73 70 6c 61 79 02 bb

02 03 0f 80 e3 05 00 00 e6 06 01 01 73 73 00 70
bc 00 78 a0 40 78 b0 08 20 a8 08 00 00 00 00 00
1a 00 00 00 00 00 00 00 00 00 00 00 00 00 00 00
00 00 00 00 00 00 00 00 00 00 00 00 00 00 00 00
00 00 00 00 00 00 00 00 00 00 00 00 00 00 00 00
00 00 00 00 00 00 00 00 00 00 00 00 00 00 00 00
00 00 00 00 00 00 00 00 00 00 00 00 00 00 00 00
00 00 00 00 00 00 00 00 00 00 00 00 00 00 00 12

70 12 79 00 00 29 00 10 6e 02 3d 3b 3d cd 4a 35
ad b9 3b 0a cc 35 10 c9 01 00 0c 40 17 14 0d 00
14 40 0b 10 78 4e bb 7f 81 07 00 10 fa 04 01 00
00 12 00 16 80 10 10 00 ff 09 3f 0b 00 00 00 00
00 41 50 50 3b ae c2 96 b5 82 7e 00 05 3a 02 92
81 00 7e 00 10 00 10 fa 05 01 01 00 60 c0 d2 ff
55 00 10 00 10 00 00 00 00 00 00 00 00 00 00 00
00 00 00 00 00 00 00 00 00 00 00 00 00 00 71 90

----------------

Block 0, Base EDID:
  EDID Structure Version & Revision: 1.4
  Vendor & Product Identification:
    Manufacturer: APP
    Model: 44602
    Serial Number: 2192938690
    Made in: week 7 of 2022
  Basic Display Parameters & Features:
    Digital display
    Bits per primary color channel: 12
    DisplayPort interface
    Maximum image size: 60 cm x 33 cm
    Gamma: 2.20
    Supported color formats: RGB 4:4:4
    First detailed timing does not include the native pixel format and preferred refresh rate
  Color Characteristics:
    Red  : 0.6796, 0.3203
    Green: 0.2646, 0.6904
    Blue : 0.1503, 0.0595
    White: 0.3125, 0.3291
  Established Timings I & II: none
  Standard Timings: none
  Detailed Timing Descriptors:
    Dummy Descriptor:
    Dummy Descriptor:
    Dummy Descriptor:
    Display Product Name: 'StudioDisplay'
  Extension blocks: 2
Checksum: 0xbb

----------------

Block 1, CTA-861 Extension Block:
  Revision: 3
  Underscans IT Video Formats by default
  Native detailed modes: 0
  Colorimetry Data Block:
  HDR Static Metadata Data Block:
    Electro optical transfer functions:
      Traditional gamma - SDR luminance range
    Supported static metadata descriptors:
      Static metadata type 1
    Desired content max luminance: 115 (603.666 cd/m^2)
    Desired content max frame-average luminance: 115 (603.666 cd/m^2)
    Desired content min luminance: 0 (0.000 cd/m^2)
  Detailed Timing Descriptors:
    DTD 1:  2560x2880   60.000000 Hz   8:9    180.000 kHz    482.400000 MHz
                 Hfront    8 Hsync  32 Hback   80 Hpol P
                 Vfront   42 Vsync   8 Vback   70 Vpol N
Checksum: 0x12  Unused space in Extension Block: 94 bytes

----------------

Block 2, DisplayID Extension Block:
  Version: 1.2
  Extension Count: 0
  Display Product Type: Extension Section
  ContainerID Data Block:
    Container ID: 6e023d3b-3dcd-4a35-adb9-3b0acc3510c9
  Display Parameters Data Block (0x01):
    Image size: 595.2 mm x 334.8 mm
    Display native pixel format: 5120x2880
    Feature support flags:
      Power management (DPM)
    Gamma: 2.20
    Aspect ratio: 1.78
    Dynamic bpc native: 12
    Dynamic bpc overall: 12
  Vendor-Specific Data Block (0x7f) (Apple), OUI 00-10-FA:
    Type: 4, Version: 1
    00 00                                           '..'
  Tiled Display Topology Data Block (0x12):
    Capabilities:
      Behavior if it is the only tile: Undefined
      Behavior if more than one tile and fewer than total number of tiles: Undefined
    Tiled display consists of a single physical display enclosure
    Num horizontal tiles: 2 Num vertical tiles: 1
    Tile location: 1, 0
    Tile resolution: 2560x2880
    Tiled Display Manufacturer/Vendor ID: APP
    Tiled Display Product ID Code: 44603
    Tiled Display Serial Number: 2192938690
  Vendor-Specific Data Block (0x7e) (VESA), OUI 3A-02-92:
    Data Structure Type: DP
    Default Colorspace and EOTF Handling: Native as specified in the Display Parameters DB
    Number of Pixels in Hor Pix Cnt Overlapping an Adjacent Panel: 0
    Multi-SST Operation: Not Supported
  Vendor-Specific Data Block (0x7e) (Apple), OUI 00-10-FA:
    05 01 01 00 60 c0 d2 ff 55 00 10 00 10          '....`...U....'
  Checksum: 0x71
Checksum: 0x90
