
EDID (hex):
00ffffffffffff0006103aaec128c9f8
07200104c53c2178000f91ae5243b026
0f505400000001010101010101010101
010101010101b7ce0050f0705a800820
c800534f2100001ad05c0050a0a03c50
0820e808534f2100001abc3480507038
2d400820f804534f2100001a000000fc
0053747564696f446973706c617903e0
02030f80e3050000e606010173730070
bc0078a04078b00820a8080000000000
1a000000000000000000000000000000
00000000000000000000000000000000
00000000000000000000000000000000
00000000000000000000000000000000
00000000000000000000000000000000
00000000000000000000000000000012
7012790000290010fc85962509614a82
88c0b211ba95738301000c4017140d00
14400b10784ebb7f81070010fa040100
0012001682100000ff093f0b00000000
004150503baec128c9f87e00053a0292
81007e00100010fa0501010060c0d2ff
55001000100000000000000000000000
00000000000000000000000000009890
70127900000300149f6d0184ff134f00
07801f003f0b77006900070000000000
00000000000000000000000000000000
00000000000000000000000000000000
00000000000000000000000000000000
00000000000000000000000000000000
00000000000000000000000000000000
00000000000000000000000000009590

edid-decode (hex):

00 ff ff ff ff ff ff 00 06 10 3a ae c1 28 c9 f8
07 20 01 04 c5 3c 21 78 00 0f 91 ae 52 43 b0 26
0f 50 54 00 00 00 01 01 01 01 01 01 01 01 01 01
01 01 01 01 01 01 b7 ce 00 50 f0 70 5a 80 08 20
c8 00 53 4f 21 00 00 1a d0 5c 00 50 a0 a0 3c 50
08 20 e8 08 53 4f 21 00 00 1a bc 34 80 50 70 38
2d 40 08 20 f8 04 53 4f 21 00 00 1a 00 00 00 fc
00 53 74 75 64 69 6f 44 69 73 70 6c 61 79 03 e0

02 03 0f 80 e3 05 00 00 e6 06 01 01 73 73 00 70
bc 00 78 a0 40 78 b0 08 20 a8 08 00 00 00 00 00
1a 00 00 00 00 00 00 00 00 00 00 00 00 00 00 00
00 00 00 00 00 00 00 00 00 00 00 00 00 00 00 00
00 00 00 00 00 00 00 00 00 00 00 00 00 00 00 00
00 00 00 00 00 00 00 00 00 00 00 00 00 00 00 00
00 00 00 00 00 00 00 00 00 00 00 00 00 00 00 00
00 00 00 00 00 00 00 00 00 00 00 00 00 00 00 12

70 12 79 00 00 29 00 10 fc 85 96 25 09 61 4a 82
88 c0 b2 11 ba 95 73 83 01 00 0c 40 17 14 0d 00
14 40 0b 10 78 4e bb 7f 81 07 00 10 fa 04 01 00
00 12 00 16 82 10 00 00 ff 09 3f 0b 00 00 00 00
00 41 50 50 3b ae c1 28 c9 f8 7e 00 05 3a 02 92
81 00 7e 00 10 00 10 fa 05 01 01 00 60 c0 d2 ff
55 00 10 00 10 00 00 00 00 00 00 00 00 00 00 00
00 00 00 00 00 00 00 00 00 00 00 00 00 00 98 90

70 12 79 00 00 03 00 14 9f 6d 01 84 ff 13 4f 00
07 80 1f 00 3f 0b 77 00 69 00 07 00 00 00 00 00
00 00 00 00 00 00 00 00 00 00 00 00 00 00 00 00
00 00 00 00 00 00 00 00 00 00 00 00 00 00 00 00
00 00 00 00 00 00 00 00 00 00 00 00 00 00 00 00
00 00 00 00 00 00 00 00 00 00 00 00 00 00 00 00
00 00 00 00 00 00 00 00 00 00 00 00 00 00 00 00
00 00 00 00 00 00 00 00 00 00 00 00 00 00 95 90

----------------

Block 0, Base EDID:
  EDID Structure Version & Revision: 1.4
  Vendor & Product Identification:
    Manufacturer: APP
    Model: 44602
    Serial Number: 4173932737
    Made in: week 7 of 2022
  Basic Display Parameters & Features:
    Digital display
    Bits per primary color channel: 12
    DisplayPort interface
    Maximum image size: 60 cm x 33 cm
    Gamma: 2.20
    Supported color formats: RGB 4:4:4
    First detailed timing does not include the native pixel format and preferred refresh rate
  Color Characteristics:
    Red  : 0.6796, 0.3203
    Green: 0.2646, 0.6904
    Blue : 0.1503, 0.0595
    White: 0.3125, 0.3291
  Established Timings I & II: none
  Standard Timings: none
  Detailed Timing Descriptors:
    DTD 1:  3840x2160   59.998866 Hz  16:9    134.997 kHz    529.190000 MHz (595 mm x 335 mm)
                 Hfront    8 Hsync  32 Hback   40 Hpol P
                 Vfront   12 Vsync   8 Vback   70 Vpol N
    DTD 2:  2560x1440   60.000000 Hz  16:9     90.000 kHz    237.600000 MHz (595 mm x 335 mm)
                 Hfront    8 Hsync  32 Hback   40 Hpol P
                 Vfront   46 Vsync   8 Vback    6 Vpol N
    DTD 3:  1920x1080   60.000000 Hz  16:9     67.500 kHz    135.000000 MHz (595 mm x 335 mm)
                 Hfront    8 Hsync  32 Hback   40 Hpol P
                 Vfront   31 Vsync   8 Vback    6 Vpol N
    Display Product Name: 'StudioDisplay'
  Extension blocks: 3
Checksum: 0xe0

----------------

Block 1, CTA-861 Extension Block:
  Revision: 3
  Underscans IT Video Formats by default
  Native detailed modes: 0
  Colorimetry Data Block:
  HDR Static Metadata Data Block:
    Electro optical transfer functions:
      Traditional gamma - SDR luminance range
    Supported static metadata descriptors:
      Static metadata type 1
    Desired content max luminance: 115 (603.666 cd/m^2)
    Desired content max frame-average luminance: 115 (603.666 cd/m^2)
    Desired content min luminance: 0 (0.000 cd/m^2)
  Detailed Timing Descriptors:
    DTD 4:  2560x2880   60.000000 Hz   8:9    180.000 kHz    482.400000 MHz
                 Hfront    8 Hsync  32 Hback   80 Hpol P
                 Vfront   42 Vsync   8 Vback   70 Vpol N
Checksum: 0x12  Unused space in Extension Block: 94 bytes

----------------

Block 2, DisplayID Extension Block:
  Version: 1.2
  Extension Count: 0
  Display Product Type: Extension Section
  ContainerID Data Block:
    Container ID: fc859625-0961-4a82-88c0-b211ba957383
  Display Parameters Data Block (0x01):
    Image size: 595.2 mm x 334.8 mm
    Display native pixel format: 5120x2880
    Feature support flags:
      Power management (DPM)
    Gamma: 2.20
    Aspect ratio: 1.78
    Dynamic bpc native: 12
    Dynamic bpc overall: 12
  Vendor-Specific Data Block (0x7f) (Apple), OUI 00-10-FA:
    Type: 4, Version: 1
    00 00                                           '..'
  Tiled Display Topology Data Block (0x12):
    Capabilities:
      Behavior if it is the only tile: Image is scaled to fit the entire tiled display
      Behavior if more than one tile and fewer than total number of tiles: Undefined
    Tiled display consists of a single physical display enclosure
    Num horizontal tiles: 2 Num vertical tiles: 1
    Tile location: 0, 0
    Tile resolution: 2560x2880
    Tiled Display Manufacturer/Vendor ID: APP
    Tiled Display Product ID Code: 44603
    Tiled Display Serial Number: 4173932737
  Vendor-Specific Data Block (0x7e) (VESA), OUI 3A-02-92:
    Data Structure Type: DP
    Default Colorspace and EOTF Handling: Native as specified in the Display Parameters DB
    Number of Pixels in Hor Pix Cnt Overlapping an Adjacent Panel: 0
    Multi-SST Operation: Not Supported
  Vendor-Specific Data Block (0x7e) (Apple), OUI 00-10-FA:
    05 01 01 00 60 c0 d2 ff 55 00 10 00 10          '....`...U....'
  Checksum: 0x98
Checksum: 0x90

----------------

Block 3, DisplayID Extension Block:
  Version: 1.2
  Extension Count: 0
  Video Timing Modes Type 1 - Detailed Timings Data Block:
    DTD:  5120x2880   60.000000 Hz  16:9    180.000 kHz    936.000000 MHz (aspect 16:9, no 3D stereo, preferred)
               Hfront    8 Hsync  32 Hback   40 Hpol P
               Vfront  106 Vsync   8 Vback    6 Vpol N
  Checksum: 0x95
Checksum: 0x90
