edid-decode (hex):

00 ff ff ff ff ff ff 00 4c 83 4a 35 00 00 00 00
00 15 01 03 80 22 13 78 0a ce 85 9e 5b 4c 94 26
17 50 54 00 00 00 01 01 01 01 01 01 01 01 01 01
01 01 01 01 01 01 1b 1b 56 62 50 00 16 30 30 20
25 00 58 c2 10 00 00 19 00 00 00 0f 00 00 00 00
00 00 00 00 00 1e b4 02 74 00 00 00 00 fe 00 53
41 4d 53 55 4e 47 0a 20 20 20 20 20 00 00 00 fe
00 31 35 36 41 54 33 35 2d 50 30 31 0a 20 00 53

----------------

Block 0, Base EDID:
  EDID Structure Version & Revision: 1.3
  Vendor & Product Identification:
    Manufacturer: SDC
    Model: 13642
    Made in: 2011
  Basic Display Parameters & Features:
    Digital display
    Maximum image size: 34 cm x 19 cm
    Gamma: 2.20
    RGB color display
    First detailed timing is the preferred timing
  Color Characteristics:
    Red  : 0.6201, 0.3554
    Green: 0.2998, 0.5800
    Blue : 0.1503, 0.0898
    White: 0.3134, 0.3291
  Established Timings I & II: none
  Standard Timings: none
  Detailed Timing Descriptors:
    DTD 1:  1366x768    59.997 Hz 683:384  47.398 kHz  69.390 MHz (344 mm x 194 mm)
                 Hfront   48 Hsync  32 Hback  18 Hpol N
                 Vfront    2 Vsync   5 Vback  15 Vpol N
    Manufacturer-Specified Display Descriptor (0x0f): 00 0f 00 00 00 00 00 00 00 00 00 1e b4 02 74 00 '..............t.'
    Alphanumeric Data String: 'SAMSUNG'
    Alphanumeric Data String: '156AT35-P01'
Checksum: 0x53

----------------

Failures:

Block 0, Base EDID:
  Missing Display Product Name.
  Missing Display Range Limits Descriptor.

EDID conformity: FAIL
