
EDID (hex):
00ffffffffffff0022f0124201000000
3014010380331d78eec520a059589d27
0e505400000001010101010101010101
01010101010118388000713814406040
8400fd1e11000000000000fc00485020
546f756368536d617274000000fc000a
202020202020202020202020000000fc
000a202020202020202020202020007e

Extracted contents:
header:          00 ff ff ff ff ff ff 00
serial number:   22 f0 12 42 01 00 00 00 30 14
version:         01 03
basic params:    80 33 1d 78 ee
chroma info:     c5 20 a0 59 58 9d 27 0e 50 54
established:     00 00 00
standard:        01 01 01 01 01 01 01 01 01 01 01 01 01 01 01 01
descriptor 1:    18 38 80 00 71 38 14 40 60 40 84 00 fd 1e 11 00 00 00
descriptor 2:    00 00 00 fc 00 48 50 20 54 6f 75 63 68 53 6d 61 72 74
descriptor 3:    00 00 00 fc 00 0a 20 20 20 20 20 20 20 20 20 20 20 20
descriptor 4:    00 00 00 fc 00 0a 20 20 20 20 20 20 20 20 20 20 20 20
extensions:      00
checksum:        7e

EDID version: 1.3
Manufacturer: HWP Model 4212 Serial Number --
Made in week 48 of 2010
Digital display
Maximum image size: 51 cm x 29 cm
Gamma: 2.20
DPMS levels: Standby Suspend Off
RGB color display
Default (sRGB) color space is primary color space
First detailed timing is preferred timing
Display x,y Chromaticity:
  Red:   0.6279, 0.3476
  Green: 0.3447, 0.6142
  Blue:  0.1523, 0.0566
  White: 0.3125, 0.3281
Established timings supported:
Standard timings supported:
Detailed mode: Clock 143.600 MHz, 509 mm x 286 mm
               1920 2016 2080 2176 hborder 0
               1080 1088 1092 1100 vborder 0
               -hsync -vsync analog composite 
               VertFreq: 59 Hz, HorFreq: 65992 Hz
Monitor name: HP TouchSmart
Checksum: 0x7e (valid)
EDID block does NOT conform to EDID 1.3!
	sRGB is signaled, but the chromaticities do not match
	Missing monitor ranges
