
EDID (hex):
00ffffffffffff0022f0124201000000
1916010380331d780ae990a2544da026
11505400000001010101010101010101
01010101010121388000713814406040
8400fe1f11000018000000fe00563036
0a202020202020202020000000fc0048
505120383330302041694f0a000000fe
004c4d3233305746352d544c46320079

Extracted contents:
header:          00 ff ff ff ff ff ff 00
serial number:   22 f0 12 42 01 00 00 00 19 16
version:         01 03
basic params:    80 33 1d 78 0a
chroma info:     e9 90 a2 54 4d a0 26 11 50 54
established:     00 00 00
standard:        01 01 01 01 01 01 01 01 01 01 01 01 01 01 01 01
descriptor 1:    21 38 80 00 71 38 14 40 60 40 84 00 fe 1f 11 00 00 18
descriptor 2:    00 00 00 fe 00 56 30 36 0a 20 20 20 20 20 20 20 20 20
descriptor 3:    00 00 00 fc 00 48 50 51 20 38 33 30 30 20 41 69 4f 0a
descriptor 4:    00 00 00 fe 00 4c 4d 32 33 30 57 46 35 2d 54 4c 46 32
extensions:      00
checksum:        79

EDID version: 1.3
Manufacturer: HWP Model 4212 Serial Number --
Made in week 25 of 2012
Digital display
Maximum image size: 51 cm x 29 cm
Gamma: 2.20
RGB color display
First detailed timing is preferred timing
Display x,y Chromaticity:
  Red:   0.6357, 0.3300
  Green: 0.3027, 0.6259
  Blue:  0.1503, 0.0673
  White: 0.3125, 0.3281
Established timings supported:
Standard timings supported:
Detailed mode: Clock 143.690 MHz, 510 mm x 287 mm
               1920 2016 2080 2176 hborder 0
               1080 1088 1092 1100 vborder 0
               -hsync -vsync 
               VertFreq: 60 Hz, HorFreq: 66034 Hz
ASCII string: V06
Monitor name: HPQ 8300 AiO
ASCII string: LM230WF5-TLF2
Checksum: 0x79 (valid)
EDID block does NOT conform to EDID 1.3!
	Missing monitor ranges
