edid-decode (hex):

00 ff ff ff ff ff ff 00 4c a3 44 50 00 00 00 00
01 14 01 04 95 26 15 78 02 a0 55 8d 51 5a 96 2a
1c 50 54 00 00 00 01 01 01 01 01 01 01 01 01 01
01 01 01 01 01 01 5f 39 80 dc 70 38 40 40 30 20
35 00 7e d7 10 00 00 1b 00 00 00 0f 00 00 00 00
00 00 00 00 00 3c 96 10 fe 00 00 00 00 fe 00 53
41 4d 53 55 4e 47 0a 20 20 20 20 20 00 00 00 fc
00 31 37 33 48 54 30 32 2d 54 30 31 0a 20 01 ea

02 01 04 00 f2 5c 80 a0 70 38 40 40 30 20 35 00
7e d7 10 00 00 1b 3d 66 80 a0 70 38 40 40 30 20
35 00 7e d7 10 00 00 1b 89 6f 80 a0 70 38 40 40
30 20 35 00 7e d7 10 00 00 1b 00 00 00 00 00 00
00 00 00 00 00 00 00 00 00 00 00 00 00 00 00 00
00 00 00 00 00 00 00 00 00 00 00 00 00 00 00 00
00 00 00 00 00 00 00 00 00 00 00 00 00 00 00 00
00 00 00 00 00 00 00 00 00 00 00 00 00 00 00 29

----------------

Block 0, Base EDID:
  EDID Structure Version & Revision: 1.4
  Vendor & Product Identification:
    Manufacturer: SEC
    Model: 20548
    Made in: week 1 of 2010
  Basic Display Parameters & Features:
    Digital display
    Bits per primary color channel: 6
    DisplayPort interface
    Maximum image size: 38 cm x 21 cm
    Gamma: 2.20
    Supported color formats: RGB 4:4:4
    First detailed timing includes the native pixel format and preferred refresh rate
  Color Characteristics:
    Red  : 0.5527, 0.3183
    Green: 0.3515, 0.5859
    Blue : 0.1650, 0.1103
    White: 0.3134, 0.3291
  Established Timings I & II: none
  Standard Timings: none
  Detailed Timing Descriptors:
    DTD 1:  1920x1080   59.992 Hz  16:9    68.631 kHz 146.870 MHz (382 mm x 215 mm)
                 Hfront   48 Hsync  32 Hback 140 Hpol P
                 Vfront    3 Vsync   5 Vback  56 Vpol N
    Manufacturer-Specified Display Descriptor (0x0f): 00 0f 00 00 00 00 00 00 00 00 00 3c 96 10 fe 00 '...........<....'
    Alphanumeric Data String: 'SAMSUNG'
    Display Product Name: '173HT02-T01'
  Extension blocks: 1
Checksum: 0xea

----------------

Block 1, CTA-861 Extension Block:
  Revision: 1
  Detailed Timing Descriptors:
    DTD 2:  1920x1080   99.995 Hz  16:9   114.394 kHz 237.940 MHz (382 mm x 215 mm)
                 Hfront   48 Hsync  32 Hback  80 Hpol P
                 Vfront    3 Vsync   5 Vback  56 Vpol N
    DTD 3:  1920x1080  109.993 Hz  16:9   125.832 kHz 261.730 MHz (382 mm x 215 mm)
                 Hfront   48 Hsync  32 Hback  80 Hpol P
                 Vfront    3 Vsync   5 Vback  56 Vpol N
    DTD 4:  1920x1080  119.995 Hz  16:9   137.274 kHz 285.530 MHz (382 mm x 215 mm)
                 Hfront   48 Hsync  32 Hback  80 Hpol P
                 Vfront    3 Vsync   5 Vback  56 Vpol N
Checksum: 0x29

----------------

Failures:

Block 1, CTA-861 Extension Block:
  Required 640x480p60 timings are missing in the established timings and the SVD list (VIC 1).

EDID conformity: FAIL
