edid-decode (hex):

00 ff ff ff ff ff ff 00 4c a3 44 50 00 00 00 00
01 16 01 04 95 26 15 78 02 a0 55 8d 51 5a 96 2a
1c 50 54 00 00 00 01 01 01 01 01 01 01 01 01 01
01 01 01 01 01 01 5f 39 80 dc 70 38 40 40 30 20
35 00 7e d7 10 00 00 1b 00 00 00 0f 00 00 00 00
00 00 00 00 00 3c 96 10 fe 00 00 00 00 fe 00 47
4e 33 36 54 80 31 37 33 48 54 0a 20 00 00 00 00
00 00 41 21 9e 00 00 00 00 02 01 0a 20 20 01 d1

02 01 04 00 f2 5c 80 a0 70 38 40 40 30 20 35 00
7e d7 10 00 00 1b 3d 66 80 a0 70 38 40 40 30 20
35 00 7e d7 10 00 00 1b 89 6f 80 a0 70 38 40 40
30 20 35 00 7e d7 10 00 00 1b 00 00 00 00 00 00
00 00 00 00 00 00 00 00 00 00 00 00 00 00 00 00
00 00 00 00 00 00 00 00 00 00 00 00 00 00 00 00
00 00 00 00 00 00 00 00 00 00 00 00 00 00 00 00
00 00 00 00 00 00 00 00 00 00 00 00 00 00 00 29

----------------

Block 0, Base EDID:
  EDID Structure Version & Revision: 1.4
  Vendor & Product Identification:
    Manufacturer: SEC
    Model: 20548
    Made in: week 1 of 2012
  Basic Display Parameters & Features:
    Digital display
    Bits per primary color channel: 6
    DisplayPort interface
    Maximum image size: 38 cm x 21 cm
    Gamma: 2.20
    Supported color formats: RGB 4:4:4
    First detailed timing includes the native pixel format and preferred refresh rate
  Color Characteristics:
    Red  : 0.5527, 0.3183
    Green: 0.3515, 0.5859
    Blue : 0.1650, 0.1103
    White: 0.3134, 0.3291
  Established Timings I & II: none
  Standard Timings: none
  Detailed Timing Descriptors:
    DTD 1:  1920x1080   59.991994 Hz  16:9     68.631 kHz    146.870000 MHz (382 mm x 215 mm)
                 Hfront   48 Hsync  32 Hback  140 Hpol P
                 Vfront    3 Vsync   5 Vback   56 Vpol N
    Manufacturer-Specified Display Descriptor (0x0f): 00 0f 00 00 00 00 00 00 00 00 00 3c 96 10 fe 00 '...........<....'
    Alphanumeric Data String: 'GN36T'
    Manufacturer-Specified Display Descriptor (0x00): 00 00 00 00 41 21 9e 00 00 00 00 02 01 0a 20 20 '....A!........  '
  Extension blocks: 1
Checksum: 0xd1

----------------

Block 1, CTA-861 Extension Block:
  Revision: 1
  Detailed Timing Descriptors:
    DTD 2:  1920x1080   99.994957 Hz  16:9    114.394 kHz    237.940000 MHz (382 mm x 215 mm)
                 Hfront   48 Hsync  32 Hback   80 Hpol P
                 Vfront    3 Vsync   5 Vback   56 Vpol N
    DTD 3:  1920x1080  109.992772 Hz  16:9    125.832 kHz    261.730000 MHz (382 mm x 215 mm)
                 Hfront   48 Hsync  32 Hback   80 Hpol P
                 Vfront    3 Vsync   5 Vback   56 Vpol N
    DTD 4:  1920x1080  119.994789 Hz  16:9    137.274 kHz    285.530000 MHz (382 mm x 215 mm)
                 Hfront   48 Hsync  32 Hback   80 Hpol P
                 Vfront    3 Vsync   5 Vback   56 Vpol N
Checksum: 0x29  Unused space in Extension Block: 69 bytes

----------------

Warnings:

Block 0, Base EDID:
  Missing Display Product Name.
Block 1, CTA-861 Extension Block:
  Add a Colorimetry Data Block with the sRGB colorimetry bit set to avoid interop issues.

Failures:

Block 0, Base EDID:
  Alphanumeric Data String: Non-printable character.
Block 1, CTA-861 Extension Block:
  Required 640x480p60 timings are missing in the established timings and the SVD list (VIC 1).
  Missing VCDB, needed for Set Selectable RGB Quantization to avoid interop issues.

EDID conformity: FAIL
