edid-decode (hex):

00 ff ff ff ff ff ff 00 30 e4 50 02 00 00 00 00
00 14 01 03 80 23 13 78 0a c2 d5 9c 60 55 9e 26
19 50 54 00 00 00 01 01 01 01 01 01 01 01 01 01
01 01 01 01 01 01 3e 1c 56 a0 50 00 16 30 30 20
35 00 59 c2 10 00 00 19 00 00 00 00 00 00 00 00
00 00 00 00 00 00 00 00 00 00 00 00 00 fe 00 4c
47 20 44 69 73 70 6c 61 79 0a 20 20 00 00 00 fe
00 4c 50 31 35 36 57 48 32 2d 54 4c 45 41 00 fd

----------------

Block 0, Base EDID:
  EDID Structure Version & Revision: 1.3
  Vendor & Product Identification:
    Manufacturer: LGD
    Model: 592
    Made in: 2010
  Basic Display Parameters & Features:
    Digital display
    Maximum image size: 35 cm x 19 cm
    Gamma: 2.20
    RGB color display
    First detailed timing is the preferred timing
  Color Characteristics:
    Red  : 0.6123, 0.3750
    Green: 0.3320, 0.6191
    Blue : 0.1513, 0.0986
    White: 0.3134, 0.3291
  Established Timings I & II: none
  Standard Timings: none
  Detailed Timing Descriptors:
    DTD 1:  1366x768    59.973124 Hz 683:384   47.379 kHz     72.300000 MHz (345 mm x 194 mm)
                 Hfront   48 Hsync  32 Hback   80 Hpol N
                 Vfront    3 Vsync   5 Vback   14 Vpol N
    Empty Descriptor
    Alphanumeric Data String: 'LG Display'
    Alphanumeric Data String: 'LP156WH2-TLEA'
Checksum: 0xfd

----------------

Failures:

Block 0, Base EDID:
  Empty Descriptor: Use Dummy Descriptor instead of all zeroes.
  Missing Display Product Name.
  Missing Display Range Limits Descriptor.

EDID conformity: FAIL
