edid-decode (hex):

00 ff ff ff ff ff ff 00 30 ae f5 65 01 01 01 01
26 1d 01 04 a5 3c 22 78 26 47 ae a7 54 47 98 22
19 53 5e 21 08 00 81 80 01 01 01 01 01 01 01 01
01 01 01 01 01 01 02 3a 80 18 71 38 2d 40 58 2c
45 00 76 f2 31 00 00 1e 01 1d 00 72 51 d0 1e 20
6e 28 55 00 76 f2 31 00 00 1e 00 00 00 fd 00 2f
4c 32 5a 15 00 0a 20 20 20 20 20 20 00 00 00 fc
00 4c 45 4e 20 44 32 37 2d 32 30 42 0a 20 00 6d

----------------

Block 0, Base EDID:
  EDID Structure Version & Revision: 1.4
  Vendor & Product Identification:
    Manufacturer: LEN
    Model: 26101
    Serial Number: ...
    Made in: week 38 of 2019
  Basic Display Parameters & Features:
    Digital display
    Bits per primary color channel: 8
    DisplayPort interface
    Maximum image size: 60 cm x 34 cm
    Gamma: 2.20
    DPMS levels: Off
    Supported color formats: RGB 4:4:4
    Default (sRGB) color space is primary color space
    First detailed timing includes the native pixel format and preferred refresh rate
  Color Characteristics:
    Red  : 0.6533, 0.3281
    Green: 0.2783, 0.5966
    Blue : 0.1347, 0.0996
    White: 0.3271, 0.3691
  Established Timings I & II:
    DMT 0x04:   640x480    59.940476 Hz   4:3     31.469 kHz     25.175000 MHz
    DMT 0x09:   800x600    60.316541 Hz   4:3     37.879 kHz     40.000000 MHz
    DMT 0x10:  1024x768    60.003840 Hz   4:3     48.363 kHz     65.000000 MHz
  Standard Timings:
    DMT 0x23:  1280x1024   60.019740 Hz   5:4     63.981 kHz    108.000000 MHz
  Detailed Timing Descriptors:
    DTD 1:  1920x1080   60.000000 Hz  16:9     67.500 kHz    148.500000 MHz (886 mm x 498 mm)
                 Hfront   88 Hsync  44 Hback  148 Hpol P
                 Vfront    4 Vsync   5 Vback   36 Vpol P
    DTD 2:  1280x720    60.000000 Hz  16:9     45.000 kHz     74.250000 MHz (886 mm x 498 mm)
                 Hfront  110 Hsync  40 Hback  220 Hpol P
                 Vfront    5 Vsync   5 Vback   20 Vpol P
    Display Range Limits:
      Monitor ranges (GTF): 47-76 Hz V, 50-90 kHz H, max dotclock 210 MHz
    Display Product Name: 'LEN D27-20B'
Checksum: 0x6d

----------------

Warnings:

Block 0, Base EDID:
  Display Range Limits: GTF support is deprecated in EDID 1.4.
EDID:
  Base EDID: Some timings are out of range of the Monitor Ranges:
    Horizontal Freq: 31.468 - 67.500 kHz (Monitor: 50.000 - 90.000 kHz)

Failures:

Block 0, Base EDID:
  Basic Display Parameters & Features: sRGB is signaled, but the chromaticities do not match.
  Detailed Timing Descriptor #1: Mismatch of image size 886x498 mm vs display size 600x340 mm.
  Detailed Timing Descriptor #2: Mismatch of image size 886x498 mm vs display size 600x340 mm.
  Display Range Limits: GTF can't be combined with non-continuous frequencies.

EDID conformity: FAIL
