edid-decode (hex):

00 ff ff ff ff ff ff 00 50 6c 20 05 00 00 00 00
00 12 01 03 80 66 39 78 2a d2 55 a3 54 45 99 26
0f 48 4c 21 08 00 01 01 01 01 01 01 01 01 01 01
01 01 01 01 01 01 02 3a 80 18 71 38 2d 40 58 2c
45 00 7f 88 42 00 00 1e 01 1d 00 72 51 d0 1e 20
6e 28 55 00 7f 88 42 00 00 1e 00 00 00 fd 00 2f
3f 27 31 0f 00 0a 20 20 20 20 20 20 00 00 00 fc
00 52 43 41 0a 20 20 20 20 20 20 20 20 20 01 5c

02 03 1d f1 4a 90 05 04 03 02 06 07 08 09 01 23
09 07 07 83 01 00 00 65 03 0c 00 30 00 8c 0a d0
8a 20 e0 2d 10 10 3e 96 00 7f 88 42 00 00 18 8c
0a d0 8a 20 e0 2d 10 10 3e 96 00 60 88 32 00 00
18 00 00 00 00 00 00 00 00 00 00 00 00 00 00 00
00 00 00 00 00 00 00 00 00 00 00 00 00 00 00 00
00 00 00 00 00 00 00 00 00 00 00 00 00 00 00 00
00 00 00 00 00 00 00 00 00 00 00 00 00 00 00 cf

----------------

Block 0, Base EDID:
  EDID Structure Version & Revision: 1.3
  Vendor & Product Identification:
    Manufacturer: TCL
    Model: 1312
    Made in: 2008
  Basic Display Parameters & Features:
    Digital display
    Maximum image size: 102 cm x 57 cm
    Gamma: 2.20
    DPMS levels: Off
    RGB color display
    First detailed timing is the preferred timing
  Color Characteristics:
    Red  : 0.6396, 0.3291
    Green: 0.2695, 0.5996
    Blue : 0.1494, 0.0595
    White: 0.2822, 0.2978
  Established Timings I & II:
    DMT 0x04:   640x480    59.940476 Hz   4:3     31.469 kHz     25.175000 MHz
    DMT 0x09:   800x600    60.316541 Hz   4:3     37.879 kHz     40.000000 MHz
    DMT 0x10:  1024x768    60.003840 Hz   4:3     48.363 kHz     65.000000 MHz
  Standard Timings: none
  Detailed Timing Descriptors:
    DTD 1:  1920x1080   60.000000 Hz  16:9     67.500 kHz    148.500000 MHz (1151 mm x 648 mm)
                 Hfront   88 Hsync  44 Hback  148 Hpol P
                 Vfront    4 Vsync   5 Vback   36 Vpol P
    DTD 2:  1280x720    60.000000 Hz  16:9     45.000 kHz     74.250000 MHz (1151 mm x 648 mm)
                 Hfront  110 Hsync  40 Hback  220 Hpol P
                 Vfront    5 Vsync   5 Vback   20 Vpol P
    Display Range Limits:
      Monitor ranges (GTF): 47-63 Hz V, 39-49 kHz H, max dotclock 150 MHz
    Display Product Name: 'RCA'
  Extension blocks: 1
Checksum: 0x5c

----------------

Block 1, CTA-861 Extension Block:
  Revision: 3
  Underscans IT Video Formats by default
  Basic audio support
  Supports YCbCr 4:4:4
  Supports YCbCr 4:2:2
  Native detailed modes: 1
  Video Data Block:
    VIC  16:  1920x1080   60.000000 Hz  16:9     67.500 kHz    148.500000 MHz (native)
    VIC   5:  1920x1080i  60.000000 Hz  16:9     33.750 kHz     74.250000 MHz
    VIC   4:  1280x720    60.000000 Hz  16:9     45.000 kHz     74.250000 MHz
    VIC   3:   720x480    59.940060 Hz  16:9     31.469 kHz     27.000000 MHz
    VIC   2:   720x480    59.940060 Hz   4:3     31.469 kHz     27.000000 MHz
    VIC   6:  1440x480i   59.940060 Hz   4:3     15.734 kHz     27.000000 MHz
    VIC   7:  1440x480i   59.940060 Hz  16:9     15.734 kHz     27.000000 MHz
    VIC   8:  1440x240    60.054449 Hz   4:3     15.734 kHz     27.000000 MHz
    VIC   9:  1440x240    60.054449 Hz  16:9     15.734 kHz     27.000000 MHz
    VIC   1:   640x480    59.940476 Hz   4:3     31.469 kHz     25.175000 MHz
  Audio Data Block:
    Linear PCM:
      Max channels: 2
      Supported sample rates (kHz): 48 44.1 32
      Supported sample sizes (bits): 24 20 16
  Speaker Allocation Data Block:
    FL/FR - Front Left/Right
  Vendor-Specific Data Block (HDMI), OUI 00-0C-03:
    Source physical address: 3.0.0.0
  Detailed Timing Descriptors:
    DTD 3:   720x480    59.940060 Hz   3:2     31.469 kHz     27.000000 MHz (1151 mm x 648 mm)
                 Hfront   16 Hsync  62 Hback   60 Hpol N
                 Vfront    9 Vsync   6 Vback   30 Vpol N
    DTD 4:   720x480    59.940060 Hz   3:2     31.469 kHz     27.000000 MHz (864 mm x 648 mm)
                 Hfront   16 Hsync  62 Hback   60 Hpol N
                 Vfront    9 Vsync   6 Vback   30 Vpol N
Checksum: 0xcf

----------------

Warnings:

EDID:
  CTA-861: Multiple native progressive timings are defined.

Failures:

Block 0, Base EDID:
  Detailed Timing Descriptor #1: Mismatch of image size 1151x648 mm vs display size 1020x570 mm.
  Detailed Timing Descriptor #2: Mismatch of image size 1151x648 mm vs display size 1020x570 mm.
Block 1, CTA-861 Extension Block:
  Detailed Timing Descriptor #3: Mismatch of image size 1151x648 mm vs display size 1020x570 mm.
  Detailed Timing Descriptor #4: Mismatch of image size 864x648 mm vs display size 1020x570 mm.
  Missing VCDB, needed for Set Selectable RGB Quantization to avoid interop issues.
EDID:
  Base EDID: Some timings are out of range of the Monitor Ranges:
    Horizontal Freq: 15.734 - 67.500 kHz (Monitor: 39.000 - 49.000 kHz)
  Base EDID: The DTD max image size is 1151x648mm, which is larger than the display size 1020.0x570.0mm.

EDID conformity: FAIL
