
EDID (hex):
00ffffffffffff000472c702722d0024
28160103803420782af8c5a554509f26
125054bfef80714f8180814081c08100
b30001010101283c80a070b023403020
360006442100001a000000fd00384b1e
5312000a202020202020000000ff004c
56383038303033343233330a000000fc
0041636572205632343350574c0a0096

Extracted contents:
header:          00 ff ff ff ff ff ff 00
serial number:   04 72 c7 02 72 2d 00 24 28 16
version:         01 03
basic params:    80 34 20 78 2a
chroma info:     f8 c5 a5 54 50 9f 26 12 50 54
established:     bf ef 80
standard:        71 4f 81 80 81 40 81 c0 81 00 b3 00 01 01 01 01
descriptor 1:    28 3c 80 a0 70 b0 23 40 30 20 36 00 06 44 21 00 00 1a
descriptor 2:    00 00 00 fd 00 38 4b 1e 53 12 00 0a 20 20 20 20 20 20
descriptor 3:    00 00 00 ff 00 4c 56 38 30 38 30 30 33 34 32 33 33 0a
descriptor 4:    00 00 00 fc 00 41 63 65 72 20 56 32 34 33 50 57 4c 0a
extensions:      00
checksum:        96

EDID version: 1.3
Manufacturer: ACR Model 2c7 Serial Number --
Made in week 40 of 2012
Digital display
Maximum image size: 52 cm x 32 cm
Gamma: 2.20
DPMS levels: Off
RGB color display
First detailed timing is preferred timing
Display x,y Chromaticity:
  Red:   0.6474, 0.3310
  Green: 0.3144, 0.6210
  Blue:  0.1513, 0.0703
  White: 0.3134, 0.3291
Established timings supported:
  720x400@70Hz 9:5 HorFreq: 31469 Hz Clock: 28.320 MHz
  640x480@60Hz 4:3 HorFreq: 31469 Hz Clock: 25.175 MHz
  640x480@67Hz 4:3 HorFreq: 35000 Hz Clock: 30.240 MHz
  640x480@72Hz 4:3 HorFreq: 37900 Hz Clock: 31.500 MHz
  640x480@75Hz 4:3 HorFreq: 37500 Hz Clock: 31.500 MHz
  800x600@56Hz 4:3 HorFreq: 35200 Hz Clock: 36.000 MHz
  800x600@60Hz 4:3 HorFreq: 37900 Hz Clock: 40.000 MHz
  800x600@72Hz 4:3 HorFreq: 48100 Hz Clock: 50.000 MHz
  800x600@75Hz 4:3 HorFreq: 46900 Hz Clock: 49.500 MHz
  832x624@75Hz 4:3 HorFreq: 49726 Hz Clock: 57.284 MHz
  1024x768@60Hz 4:3 HorFreq: 48400 Hz Clock: 65.000 MHz
  1024x768@70Hz 4:3 HorFreq: 56500 Hz Clock: 75.000 MHz
  1024x768@75Hz 4:3 HorFreq: 60000 Hz Clock: 78.750 MHz
  1280x1024@75Hz 5:4 HorFreq: 80000 Hz Clock: 135.000 MHz
  1152x870@75Hz 192:145 HorFreq: 67500 Hz Clock: 108.000 MHz
Standard timings supported:
  1152x864@75Hz 4:3 HorFreq: 67500 Hz Clock: 108.000 MHz
  1280x1024@60Hz 5:4 HorFreq: 64000 Hz Clock: 108.000 MHz
  1280x960@60Hz 4:3 HorFreq: 60000 Hz Clock: 108.000 MHz
  1280x720@60Hz 16:9
  1280x800@60Hz 16:10
  1680x1050@60Hz 16:10 HorFreq: 64700 Hz Clock: 119.000 MHz
Detailed mode: Clock 154.000 MHz, 518 mm x 324 mm
               1920 1968 2000 2080 hborder 0
               1200 1203 1209 1235 vborder 0
               +hsync -vsync 
               VertFreq: 59 Hz, HorFreq: 74038 Hz
Monitor ranges (GTF): 56-75Hz V, 30-83kHz H, max dotclock 180MHz
Serial number: --
Monitor name: Acer V243PWL
Checksum: 0x96 (valid)
