
EDID (hex):
00ffffffffffff0026cd045601010101
1712010380342178ea5ad5a7564b9b24
135054bdef80714f81908180818ca940
b300950f9500283c80a070b023403020
360007442100001a000000ff00303539
33373832333531333234000000fd0038
4c1e5311000a202020202020000000fc
00504c453234303357530a2020200146
02031cf1490490030185070002066503
0c0010008301000023090704011d0072
51d01e206e285500c48e2100001e011d
8018711c1620582c2500c48e2100009e
8c0ad08a20e02d10103e9600c48e2100
00188c0ad08a20e02d10103e9600138e
210000188c0aa01451f01600267c4300
c48e2100009800000000000000000084

Extracted contents:
header:          00 ff ff ff ff ff ff 00
serial number:   26 cd 04 56 01 01 01 01 17 12
version:         01 03
basic params:    80 34 21 78 ea
chroma info:     5a d5 a7 56 4b 9b 24 13 50 54
established:     bd ef 80
standard:        71 4f 81 90 81 80 81 8c a9 40 b3 00 95 0f 95 00
descriptor 1:    28 3c 80 a0 70 b0 23 40 30 20 36 00 07 44 21 00 00 1a
descriptor 2:    00 00 00 ff 00 30 35 39 33 37 38 32 33 35 31 33 32 34
descriptor 3:    00 00 00 fd 00 38 4c 1e 53 11 00 0a 20 20 20 20 20 20
descriptor 4:    00 00 00 fc 00 50 4c 45 32 34 30 33 57 53 0a 20 20 20
extensions:      01
checksum:        46

EDID version: 1.3
Manufacturer: IVM Model 5604 Serial Number --
Made in week 23 of 2008
Digital display
Maximum image size: 52 cm x 33 cm
Gamma: 2.20
DPMS levels: Standby Suspend Off
RGB color display
First detailed timing is preferred timing
Display x,y Chromaticity:
  Red:   0.6533, 0.3369
  Green: 0.2949, 0.6074
  Blue:  0.1435, 0.0751
  White: 0.3134, 0.3291
Established timings supported:
  720x400@70Hz 9:5 HorFreq: 31469 Hz Clock: 28.320 MHz
  640x480@60Hz 4:3 HorFreq: 31469 Hz Clock: 25.175 MHz
  640x480@67Hz 4:3 HorFreq: 35000 Hz Clock: 30.240 MHz
  640x480@72Hz 4:3 HorFreq: 37900 Hz Clock: 31.500 MHz
  640x480@75Hz 4:3 HorFreq: 37500 Hz Clock: 31.500 MHz
  800x600@60Hz 4:3 HorFreq: 37900 Hz Clock: 40.000 MHz
  800x600@72Hz 4:3 HorFreq: 48100 Hz Clock: 50.000 MHz
  800x600@75Hz 4:3 HorFreq: 46900 Hz Clock: 49.500 MHz
  832x624@75Hz 4:3 HorFreq: 49726 Hz Clock: 57.284 MHz
  1024x768@60Hz 4:3 HorFreq: 48400 Hz Clock: 65.000 MHz
  1024x768@70Hz 4:3 HorFreq: 56500 Hz Clock: 75.000 MHz
  1024x768@75Hz 4:3 HorFreq: 60000 Hz Clock: 78.750 MHz
  1280x1024@75Hz 5:4 HorFreq: 80000 Hz Clock: 135.000 MHz
  1152x870@75Hz 192:145 HorFreq: 67500 Hz Clock: 108.000 MHz
Standard timings supported:
  1152x864@75Hz 4:3 HorFreq: 67500 Hz Clock: 108.000 MHz
  1280x1024@76Hz 5:4
  1280x1024@60Hz 5:4 HorFreq: 64000 Hz Clock: 108.000 MHz
  1280x1024@72Hz 5:4
  1600x1200@60Hz 4:3 HorFreq: 75000 Hz Clock: 162.000 MHz
  1680x1050@60Hz 16:10 HorFreq: 64700 Hz Clock: 119.000 MHz
  1440x900@75Hz 16:10 HorFreq: 82300 Hz Clock: 156.000 MHz
  1440x900@60Hz 16:10 HorFreq: 55500 Hz Clock: 88.750 MHz
Detailed mode: Clock 154.000 MHz, 519 mm x 324 mm
               1920 1968 2000 2080 hborder 0
               1200 1203 1209 1235 vborder 0
               +hsync -vsync 
               VertFreq: 59 Hz, HorFreq: 74038 Hz
Serial number: --
Monitor ranges (GTF): 56-76Hz V, 30-83kHz H, max dotclock 170MHz
Monitor name: PLE2403WS
Has 1 extension blocks
Checksum: 0x46 (valid)

CTA extension block
Extension version: 3
24 bytes of CTA data
  Video data block
    VIC   4 1280x720@60Hz 16:9  HorFreq: 45000 Hz Clock: 74.250 MHz
    VIC  16 1920x1080@60Hz 16:9 (native) HorFreq: 67500 Hz Clock: 148.500 MHz
    VIC   3 720x480@60Hz 16:9  HorFreq: 31469 Hz Clock: 27.000 MHz
    VIC   1 640x480@60Hz 4:3  HorFreq: 31469 Hz Clock: 25.175 MHz
    VIC   5 1920x1080i@60Hz 16:9 (native) HorFreq: 33750 Hz Clock: 74.250 MHz
    VIC   7 1440x480i@60Hz 16:9  HorFreq: 15734 Hz Clock: 27.000 MHz
    VIC   2 720x480@60Hz 4:3  HorFreq: 31469 Hz Clock: 27.000 MHz
    VIC   6 1440x480i@60Hz 4:3  HorFreq: 15734 Hz Clock: 27.000 MHz
  Vendor-specific data block, OUI 000c03 (HDMI)
    Source physical address 1.0.0.0
  Speaker allocation data block
    Speaker map:
      FL/FR - Front Left/Right
  Audio data block
    Linear PCM, max channels 2
      Supported sample rates (kHz): 48 44.1 32
      Supported sample sizes (bits): 24
Underscans PC formats by default
Basic audio support
Supports YCbCr 4:4:4
Supports YCbCr 4:2:2
1 native detailed modes
Detailed mode: Clock 74.250 MHz, 708 mm x 398 mm
               1280 1390 1430 1650 hborder 0
                720  725  730  750 vborder 0
               +hsync +vsync 
               VertFreq: 60 Hz, HorFreq: 45000 Hz
Detailed mode: Clock 74.250 MHz, 708 mm x 398 mm
               1920 2008 2052 2200 hborder 0
                540  542  547  562 vborder 0
               +hsync +vsync interlaced 
               VertFreq: 60 Hz, HorFreq: 33750 Hz
Detailed mode: Clock 27.000 MHz, 708 mm x 398 mm
                720  736  798  858 hborder 0
                480  489  495  525 vborder 0
               -hsync -vsync 
               VertFreq: 59 Hz, HorFreq: 31468 Hz
Detailed mode: Clock 27.000 MHz, 531 mm x 398 mm
                720  736  798  858 hborder 0
                480  489  495  525 vborder 0
               -hsync -vsync 
               VertFreq: 59 Hz, HorFreq: 31468 Hz
Detailed mode: Clock 27.000 MHz, 708 mm x 398 mm
               1440 1478 1602 1716 hborder 0
                240  244  247  262 vborder 0
               -hsync -vsync interlaced 
               VertFreq: 60 Hz, HorFreq: 15734 Hz
Checksum: 0x84 (valid)

One or more of the timings is out of range of the Monitor Ranges:
  Vertical Freq: 59 - 76 Hz
  Horizontal Freq: 15734 - 82300 Hz
  Maximum Clock: 162.000 MHz
EDID block does not conform at all!
	Both the serial number and the serial string are set
