
EDID (hex):
00ffffffffffff0015c3961901010101
1514010380342178ea9ef5a6564b9a25
125054a10800a94081808140b3000101
010101010101283c80a070b023403020
360007442100001a000000ff00343537
32363035300a20202020000000fd003b
3d1f4c11000a202020202020000000fc
005332343032570a202020202020008d

Extracted contents:
header:          00 ff ff ff ff ff ff 00
serial number:   15 c3 96 19 01 01 01 01 15 14
version:         01 03
basic params:    80 34 21 78 ea
chroma info:     9e f5 a6 56 4b 9a 25 12 50 54
established:     a1 08 00
standard:        a9 40 81 80 81 40 b3 00 01 01 01 01 01 01 01 01
descriptor 1:    28 3c 80 a0 70 b0 23 40 30 20 36 00 07 44 21 00 00 1a
descriptor 2:    00 00 00 ff 00 34 35 37 32 36 30 35 30 0a 20 20 20 20
descriptor 3:    00 00 00 fd 00 3b 3d 1f 4c 11 00 0a 20 20 20 20 20 20
descriptor 4:    00 00 00 fc 00 53 32 34 30 32 57 0a 20 20 20 20 20 20
extensions:      00
checksum:        8d

EDID version: 1.3
Manufacturer: ENC Model 1996 Serial Number --
Made in week 21 of 2010
Digital display
Maximum image size: 52 cm x 33 cm
Gamma: 2.20
DPMS levels: Standby Suspend Off
RGB color display
First detailed timing is preferred timing
Display x,y Chromaticity:
  Red:   0.6503, 0.3369
  Green: 0.2958, 0.6035
  Blue:  0.1474, 0.0732
  White: 0.3134, 0.3291
Established timings supported:
  720x400@70Hz 9:5 HorFreq: 31469 Hz Clock: 28.320 MHz
  640x480@60Hz 4:3 HorFreq: 31469 Hz Clock: 25.175 MHz
  800x600@60Hz 4:3 HorFreq: 37900 Hz Clock: 40.000 MHz
  1024x768@60Hz 4:3 HorFreq: 48400 Hz Clock: 65.000 MHz
Standard timings supported:
  1600x1200@60Hz 4:3 HorFreq: 75000 Hz Clock: 162.000 MHz
  1280x1024@60Hz 5:4 HorFreq: 64000 Hz Clock: 108.000 MHz
  1280x960@60Hz 4:3 HorFreq: 60000 Hz Clock: 108.000 MHz
  1680x1050@60Hz 16:10 HorFreq: 64700 Hz Clock: 119.000 MHz
Detailed mode: Clock 154.000 MHz, 519 mm x 324 mm
               1920 1968 2000 2080 hborder 0
               1200 1203 1209 1235 vborder 0
               +hsync -vsync 
               VertFreq: 59 Hz, HorFreq: 74038 Hz
Serial number: --
Monitor ranges (GTF): 59-61Hz V, 31-76kHz H, max dotclock 170MHz
Monitor name: S2402W
Checksum: 0x8d (valid)
One or more of the timings is out of range of the Monitor Ranges:
  Vertical Freq: 59 - 70 Hz
  Horizontal Freq: 31469 - 75000 Hz
  Maximum Clock: 162.000 MHz
