
EDID (hex):
00ffffffffffff0010ac12a253423831
2a200104b55022783b3da0b5483eb725
0d5054a54b00714f8180a9c0d1c00101
010101010101e77c70a0d0a029503020
3a0020513100001a000000ff00374e58
333253330a2020202020000000fc0041
57333432334457460a202020000000fd
0c30a51e1e66010a202020202020020c
02033af14c3f2221201f131210040302
012309070783010000e305c301e60605
01674f02721a0000030330a500846702
4f03a500000000e200ea6fc200a0a0a0
55503020350020513100001a09ec00a0
a0a067503020350020513100001a4dd2
707ed0a046500e203a0020513100001a
0000000000000000000000000000005e
701279030003013cd58300047f079f00
2f801f0037042f0002000400555e0004
ff099f002f801f009f05280002000400
278e01046f0d9f002f801f009f051401
02000900000000000000000000000000
00000000000000000000000000000000
00000000000000000000000000000000
00000000000000000000000000000e90

edid-decode (hex):

00 ff ff ff ff ff ff 00 10 ac 12 a2 53 42 38 31
2a 20 01 04 b5 50 22 78 3b 3d a0 b5 48 3e b7 25
0d 50 54 a5 4b 00 71 4f 81 80 a9 c0 d1 c0 01 01
01 01 01 01 01 01 e7 7c 70 a0 d0 a0 29 50 30 20
3a 00 20 51 31 00 00 1a 00 00 00 ff 00 37 4e 58
33 32 53 33 0a 20 20 20 20 20 00 00 00 fc 00 41
57 33 34 32 33 44 57 46 0a 20 20 20 00 00 00 fd
0c 30 a5 1e 1e 66 01 0a 20 20 20 20 20 20 02 0c

02 03 3a f1 4c 3f 22 21 20 1f 13 12 10 04 03 02
01 23 09 07 07 83 01 00 00 e3 05 c3 01 e6 06 05
01 67 4f 02 72 1a 00 00 03 03 30 a5 00 84 67 02
4f 03 a5 00 00 00 00 e2 00 ea 6f c2 00 a0 a0 a0
55 50 30 20 35 00 20 51 31 00 00 1a 09 ec 00 a0
a0 a0 67 50 30 20 35 00 20 51 31 00 00 1a 4d d2
70 7e d0 a0 46 50 0e 20 3a 00 20 51 31 00 00 1a
00 00 00 00 00 00 00 00 00 00 00 00 00 00 00 5e

70 12 79 03 00 03 01 3c d5 83 00 04 7f 07 9f 00
2f 80 1f 00 37 04 2f 00 02 00 04 00 55 5e 00 04
ff 09 9f 00 2f 80 1f 00 9f 05 28 00 02 00 04 00
27 8e 01 04 6f 0d 9f 00 2f 80 1f 00 9f 05 14 01
02 00 09 00 00 00 00 00 00 00 00 00 00 00 00 00
00 00 00 00 00 00 00 00 00 00 00 00 00 00 00 00
00 00 00 00 00 00 00 00 00 00 00 00 00 00 00 00
00 00 00 00 00 00 00 00 00 00 00 00 00 00 0e 90

----------------

Block 0, Base EDID:
  EDID Structure Version & Revision: 1.4
  Vendor & Product Identification:
    Manufacturer: DEL
    Model: 41490
    Serial Number: 825770579
    Made in: week 42 of 2022
  Basic Display Parameters & Features:
    Digital display
    Bits per primary color channel: 10
    DisplayPort interface
    Maximum image size: 80 cm x 34 cm
    Gamma: 2.20
    DPMS levels: Off
    Supported color formats: RGB 4:4:4, YCrCb 4:4:4, YCrCb 4:2:2
    First detailed timing includes the native pixel format and preferred refresh rate
    Display is continuous frequency
  Color Characteristics:
    Red  : 0.7070, 0.2841
    Green: 0.2451, 0.7158
    Blue : 0.1464, 0.0527
    White: 0.3125, 0.3281
  Established Timings I & II:
    IBM     :   720x400    70.081663 Hz   9:5     31.467 kHz     28.320000 MHz
    DMT 0x04:   640x480    59.940476 Hz   4:3     31.469 kHz     25.175000 MHz
    DMT 0x06:   640x480    75.000000 Hz   4:3     37.500 kHz     31.500000 MHz
    DMT 0x09:   800x600    60.316541 Hz   4:3     37.879 kHz     40.000000 MHz
    DMT 0x0b:   800x600    75.000000 Hz   4:3     46.875 kHz     49.500000 MHz
    DMT 0x10:  1024x768    60.003840 Hz   4:3     48.363 kHz     65.000000 MHz
    DMT 0x12:  1024x768    75.028582 Hz   4:3     60.023 kHz     78.750000 MHz
    DMT 0x24:  1280x1024   75.024675 Hz   5:4     79.976 kHz    135.000000 MHz
  Standard Timings:
    DMT 0x15:  1152x864    75.000000 Hz   4:3     67.500 kHz    108.000000 MHz
    DMT 0x23:  1280x1024   60.019740 Hz   5:4     63.981 kHz    108.000000 MHz
    DMT 0x53:  1600x900    60.000000 Hz  16:9     60.000 kHz    108.000000 MHz (RB)
    DMT 0x52:  1920x1080   60.000000 Hz  16:9     67.500 kHz    148.500000 MHz
  Detailed Timing Descriptors:
    DTD 1:  3440x1440   59.972616 Hz  43:18    88.819 kHz    319.750000 MHz (800 mm x 337 mm)
                 Hfront   48 Hsync  32 Hback   80 Hpol P
                 Vfront    3 Vsync  10 Vback   28 Vpol N
    Display Product Serial Number: '7NX32S3'
    Display Product Name: 'AW3423DWF'
    Display Range Limits:
      Monitor ranges (Bare Limits): 48-165 Hz V, 285-285 kHz H, max dotclock 1020 MHz
  Extension blocks: 2
Checksum: 0x0c

----------------

Block 1, CTA-861 Extension Block:
  Revision: 3
  Underscans IT Video Formats by default
  Basic audio support
  Supports YCbCr 4:4:4
  Supports YCbCr 4:2:2
  Native detailed modes: 1
  Video Data Block:
    VIC  63:  1920x1080  120.000000 Hz  16:9    135.000 kHz    297.000000 MHz
    VIC  34:  1920x1080   30.000000 Hz  16:9     33.750 kHz     74.250000 MHz
    VIC  33:  1920x1080   25.000000 Hz  16:9     28.125 kHz     74.250000 MHz
    VIC  32:  1920x1080   24.000000 Hz  16:9     27.000 kHz     74.250000 MHz
    VIC  31:  1920x1080   50.000000 Hz  16:9     56.250 kHz    148.500000 MHz
    VIC  19:  1280x720    50.000000 Hz  16:9     37.500 kHz     74.250000 MHz
    VIC  18:   720x576    50.000000 Hz  16:9     31.250 kHz     27.000000 MHz
    VIC  16:  1920x1080   60.000000 Hz  16:9     67.500 kHz    148.500000 MHz
    VIC   4:  1280x720    60.000000 Hz  16:9     45.000 kHz     74.250000 MHz
    VIC   3:   720x480    59.940060 Hz  16:9     31.469 kHz     27.000000 MHz
    VIC   2:   720x480    59.940060 Hz   4:3     31.469 kHz     27.000000 MHz
    VIC   1:   640x480    59.940476 Hz   4:3     31.469 kHz     25.175000 MHz
  Audio Data Block:
    Linear PCM:
      Max channels: 2
      Supported sample rates (kHz): 48 44.1 32
      Supported sample sizes (bits): 24 20 16
  Speaker Allocation Data Block:
    FL/FR - Front Left/Right
  Colorimetry Data Block:
    xvYCC601
    xvYCC709
    BT2020YCC
    BT2020RGB
    Gamut Boundary Description Metadata Profile P0
  HDR Static Metadata Data Block:
    Electro optical transfer functions:
      Traditional gamma - SDR luminance range
      SMPTE ST2084
    Supported static metadata descriptors:
      Static metadata type 1
    Desired content max luminance: 103 (465.490 cd/m^2)
    Desired content max frame-average luminance: 79 (276.782 cd/m^2)
    Desired content min luminance: 2 (0.000 cd/m^2)
  Vendor-Specific Data Block (AMD), OUI 00-00-1A:
    Version: 3.3
    Minimum Refresh Rate: 48 Hz
    Maximum Refresh Rate: 165 Hz
    Flags 1.x: 0x00
    Flags 2.x: 0x84
    Maximum luminance: 103 (465.490 cd/m^2)
    Minimum luminance: 2 (0.000 cd/m^2)
    Maximum luminance (without local dimming): 79 (276.782 cd/m^2)
    Minimum luminance (without local dimming): 3 (0.000 cd/m^2)
  Video Capability Data Block:
    YCbCr quantization: Selectable (via AVI YQ)
    RGB quantization: Selectable (via AVI Q)
    PT scan behavior: Always Underscanned
    IT scan behavior: Always Underscanned
    CE scan behavior: Always Underscanned
  Detailed Timing Descriptors:
    DTD 2:  2560x1440  119.997589 Hz  16:9    182.996 kHz    497.750000 MHz (800 mm x 337 mm)
                 Hfront   48 Hsync  32 Hback   80 Hpol P
                 Vfront    3 Vsync   5 Vback   77 Vpol N
    DTD 3:  2560x1440  143.973257 Hz  16:9    222.151 kHz    604.250000 MHz (800 mm x 337 mm)
                 Hfront   48 Hsync  32 Hback   80 Hpol P
                 Vfront    3 Vsync   5 Vback   95 Vpol N
    DTD 4:  3440x1440   99.982172 Hz  43:18   150.973 kHz    538.370000 MHz (800 mm x 337 mm)
                 Hfront   14 Hsync  32 Hback   80 Hpol P
                 Vfront    3 Vsync  10 Vback   57 Vpol N
Checksum: 0x5e  Unused space in Extension Block: 15 bytes

----------------

Block 2, DisplayID Extension Block:
  Version: 1.2
  Extension Count: 0
  Display Product Type: Standalone display device
  Video Timing Modes Type 1 - Detailed Timings Data Block:
    DTD:  1920x1080  143.847177 Hz  16:9    162.260 kHz    337.500000 MHz (aspect 16:9, no 3D stereo)
               Hfront   48 Hsync  32 Hback   80 Hpol P
               Vfront    3 Vsync   5 Vback   40 Vpol N
    DTD:  2560x1440   59.950550 Hz  16:9     88.787 kHz    241.500000 MHz (aspect 16:9, no 3D stereo)
               Hfront   48 Hsync  32 Hback   80 Hpol P
               Vfront    3 Vsync   5 Vback   33 Vpol N
    DTD:  3440x1440  164.900019 Hz  16:9    283.133 kHz   1019.280000 MHz (aspect 16:9, no 3D stereo)
               Hfront   48 Hsync  32 Hback   80 Hpol P
               Vfront    3 Vsync  10 Vback  264 Vpol N
  Checksum: 0x0e
Checksum: 0x90
