edid-decode (hex):

00 ff ff ff ff ff ff 00 25 cc 07 00 00 00 00 00
00 13 01 03 80 22 13 78 0a c8 85 9e 57 54 9b 26
12 50 54 00 00 00 01 01 01 01 01 01 01 01 01 01
01 01 01 01 01 01 12 1b 56 66 50 00 13 30 19 11
33 00 58 c2 10 00 00 19 00 00 00 00 00 00 00 00
00 00 00 00 00 00 00 00 00 00 00 00 00 fe 00 49
4e 4c 44 69 73 70 6c 61 79 0a 20 20 00 00 00 fc
00 42 54 31 35 36 47 57 30 31 00 56 2e 33 00 a2

----------------

Block 0, Base EDID:
  EDID Structure Version & Revision: 1.3
  Vendor & Product Identification:
    Manufacturer: INL
    Model: 7
    Made in: 2009
  Basic Display Parameters & Features:
    Digital display
    Maximum image size: 34 cm x 19 cm
    Gamma: 2.20
    RGB color display
    First detailed timing is preferred timing
  Color Characteristics:
    Red  : 0.6201, 0.3398
    Green: 0.3300, 0.6054
    Blue : 0.1503, 0.0703
    White: 0.3134, 0.3291
  Established Timings I & II: none
  Standard Timings: none
  Detailed Timing Descriptors:
    DTD 1:  1366x768    59.984 Hz 683:384  47.207 kHz  69.300 MHz (344 mm x 194 mm)
                 Hfront   25 Hsync  17 Hback  60 Hpol N
                 Vfront    3 Vsync   3 Vback  13 Vpol N
    Empty Descriptor
    Alphanumeric Data String: 'INLDisplay'
    Display Product Name: 'BT156GW01'
Checksum: 0xa2
