edid-decode (hex):

00 ff ff ff ff ff ff 00 0e 6c 21 04 10 42 00 00
19 1b 01 04 82 46 27 78 ea d9 b0 a3 57 49 9c 25
11 49 4b 21 08 00 31 40 45 40 61 40 81 80 81 c0
8c c0 d1 c0 01 01 1a 36 80 a0 70 38 1f 40 30 20
35 00 e8 26 32 00 00 1a 1b 21 50 a0 51 00 1e 30
48 88 35 00 bc 86 21 00 00 1c 00 00 00 fc 00 43
53 4c 34 32 31 0a 20 20 20 20 20 20 00 00 00 f7
00 0a 00 42 c4 44 02 00 00 00 00 00 00 00 01 46

02 03 22 f0 4d 06 03 15 12 13 04 14 05 20 1f 10
21 22 23 09 07 07 83 01 00 00 67 03 0c 00 10 00
b8 2d 01 1d 00 80 51 d0 1c 20 40 80 35 00 bc 88
21 00 00 1e 8c 0a d0 8a 20 e0 2d 10 10 3e 96 00
13 8e 21 00 00 18 02 3a 80 18 71 38 2d 40 58 2c
45 00 06 44 21 00 00 1e 01 1d 80 18 71 1c 16 20
58 2c 25 00 c4 8e 21 00 00 9e 4e 1f 00 80 51 00
1e 30 40 80 37 00 bc 88 21 00 00 18 00 00 00 b4

----------------

Block 0, Base EDID:
  EDID Structure Version & Revision: 1.4
  Vendor & Product Identification:
    Manufacturer: CSL
    Model: 1057
    Serial Number: ...
    Made in: week 25 of 2017
  Basic Display Parameters & Features:
    Digital display
    Color depth is undefined
    HDMI-a interface
    Maximum image size: 70 cm x 39 cm
    Gamma: 2.20
    DPMS levels: Standby Suspend Off
    Supported color formats: RGB 4:4:4, YCrCb 4:4:4
    First detailed timing includes the native pixel format and preferred refresh rate
  Color Characteristics:
    Red  : 0.6396, 0.3408
    Green: 0.2871, 0.6103
    Blue : 0.1464, 0.0693
    White: 0.2851, 0.2929
  Established Timings I & II:
    DMT 0x04:   640x480    59.940 Hz   4:3    31.469 kHz  25.175 MHz
    DMT 0x09:   800x600    60.317 Hz   4:3    37.879 kHz  40.000 MHz
    DMT 0x10:  1024x768    60.004 Hz   4:3    48.363 kHz  65.000 MHz
  Standard Timings:
    DMT 0x04:   640x480    59.940 Hz   4:3    31.469 kHz  25.175 MHz
    DMT 0x09:   800x600    60.317 Hz   4:3    37.879 kHz  40.000 MHz
    DMT 0x10:  1024x768    60.004 Hz   4:3    48.363 kHz  65.000 MHz
    DMT 0x23:  1280x1024   60.020 Hz   5:4    63.981 kHz 108.000 MHz
    DMT 0x55:  1280x720    60.000 Hz  16:9    45.000 kHz  74.250 MHz
    CVT     :  1368x776    59.809 Hz  16:9    48.206 kHz  86.000 MHz (EDID 1.4 source)
    GTF     :  1368x776    60.000 Hz  16:9    48.240 kHz  86.832 MHz (EDID 1.3 source)
    DMT 0x52:  1920x1080   60.000 Hz  16:9    67.500 kHz 148.500 MHz
  Detailed Timing Descriptors:
    DTD 1:  1920x1080   59.934 Hz  16:9    66.587 kHz 138.500 MHz (1000 mm x 550 mm)
                 Hfront   48 Hsync  32 Hback  80 Hpol P
                 Vfront    3 Vsync   5 Vback  23 Vpol N
    DTD 2:  1360x768    59.799 Hz  85:48   47.720 kHz  84.750 MHz (700 mm x 390 mm)
                 Hfront   72 Hsync 136 Hback 208 Hpol N
                 Vfront    3 Vsync   5 Vback  22 Vpol P
    Display Product Name: 'CSL421'
    Established timings III:
      DMT 0x17:  1280x768    59.870 Hz   5:3    47.776 kHz  79.500 MHz
      DMT 0x23:  1280x1024   60.020 Hz   5:4    63.981 kHz 108.000 MHz
      DMT 0x27:  1360x768    60.015 Hz  85:48   47.712 kHz  85.500 MHz
      DMT 0x2e:  1440x900    59.901 Hz  16:10   55.469 kHz  88.750 MHz (RB)
      DMT 0x29:  1400x1050   59.948 Hz   4:3    64.744 kHz 101.000 MHz (RB)
      DMT 0x39:  1680x1050   59.883 Hz  16:10   64.674 kHz 119.000 MHz (RB)
      DMT 0x33:  1600x1200   60.000 Hz   4:3    75.000 kHz 162.000 MHz
      DMT 0x44:  1920x1200   59.950 Hz  16:10   74.038 kHz 154.000 MHz (RB)
  Extension blocks: 1
Checksum: 0x46

----------------

Block 1, CTA-861 Extension Block:
  Revision: 3
  Underscans PC formats by default
  Basic audio support
  Supports YCbCr 4:4:4
  Supports YCbCr 4:2:2
  Native detailed modes: 0
  Video Data Block:
    VIC   6:  1440x480i   59.940 Hz   4:3    15.734 kHz  27.000 MHz
    VIC   3:   720x480    59.940 Hz  16:9    31.469 kHz  27.000 MHz
    VIC  21:  1440x576i   50.000 Hz   4:3    15.625 kHz  27.000 MHz
    VIC  18:   720x576    50.000 Hz  16:9    31.250 kHz  27.000 MHz
    VIC  19:  1280x720    50.000 Hz  16:9    37.500 kHz  74.250 MHz
    VIC   4:  1280x720    60.000 Hz  16:9    45.000 kHz  74.250 MHz
    VIC  20:  1920x1080i  50.000 Hz  16:9    28.125 kHz  74.250 MHz
    VIC   5:  1920x1080i  60.000 Hz  16:9    33.750 kHz  74.250 MHz
    VIC  32:  1920x1080   24.000 Hz  16:9    27.000 kHz  74.250 MHz
    VIC  31:  1920x1080   50.000 Hz  16:9    56.250 kHz 148.500 MHz
    VIC  16:  1920x1080   60.000 Hz  16:9    67.500 kHz 148.500 MHz
    VIC  33:  1920x1080   25.000 Hz  16:9    28.125 kHz  74.250 MHz
    VIC  34:  1920x1080   30.000 Hz  16:9    33.750 kHz  74.250 MHz
  Audio Data Block:
    Linear PCM:
      Max channels: 2
      Supported sample rates (kHz): 48 44.1 32
      Supported sample sizes (bits): 24 20 16
  Speaker Allocation Data Block:
    FL/FR - Front Left/Right
  Vendor-Specific Data Block (HDMI), OUI 00-0C-03:
    Source physical address: 1.0.0.0
    Supports_AI
    DC_36bit
    DC_30bit
    DC_Y444
    Maximum TMDS clock: 225 MHz
  Detailed Timing Descriptors:
    DTD 3:  1280x720    59.654 Hz  16:9    44.621 kHz  74.250 MHz (700 mm x 392 mm)
                 Hfront   64 Hsync 128 Hback 192 Hpol P
                 Vfront    3 Vsync   5 Vback  20 Vpol P
    DTD 4:   720x480    59.940 Hz   3:2    31.469 kHz  27.000 MHz (531 mm x 398 mm)
                 Hfront   16 Hsync  62 Hback  60 Hpol N
                 Vfront    9 Vsync   6 Vback  30 Vpol N
    DTD 5:  1920x1080   60.000 Hz  16:9    67.500 kHz 148.500 MHz (518 mm x 324 mm)
                 Hfront   88 Hsync  44 Hback 148 Hpol P
                 Vfront    4 Vsync   5 Vback  36 Vpol P
    DTD 6:  1920x1080i  60.000 Hz  16:9    33.750 kHz  74.250 MHz (708 mm x 398 mm)
                 Hfront   88 Hsync  44 Hback 148 Hpol P
                 Vfront    2 Vsync   5 Vback  15 Vpol P Vfront +0.5 Odd Field
                 Vfront    2 Vsync   5 Vback  15 Vpol P Vback  +0.5 Even Field
    DTD 7:  1280x768    60.352 Hz   5:3    48.161 kHz  80.140 MHz (700 mm x 392 mm)
                 Hfront   64 Hsync 128 Hback 192 Hpol N
                 Vfront    3 Vsync   7 Vback  20 Vpol N
Checksum: 0xb4

----------------

Warnings:

Block 1, CTA-861 Extension Block:
  Video Data Block: VIC 6 is the preferred timing, overriding the first detailed timings. Is this intended?

Failures:

Block 0, Base EDID:
  Detailed Timing Descriptor #1: Mismatch of image size 1000x550 mm vs display size 700x390 mm.
Block 1, CTA-861 Extension Block:
  Vendor-Specific Data Block (HDMI): The HDMI Specification uses EDID 1.3, not 1.4.
  Detailed Timing Descriptor #5: Mismatch of image size 518x324 mm vs display size 700x390 mm.
All Blocks:
  GTF timings are used, but the EDID does not signal GTF support.
  CVT timings are used, but the EDID does not signal CVT support.

EDID conformity: FAIL
