edid-decode (hex):

00 ff ff ff ff ff ff 00 25 cc 11 00 00 00 00 00
00 13 01 03 80 16 0c 78 0a 40 85 93 59 56 93 27
1b 50 54 00 00 00 01 01 01 01 01 01 01 01 01 01
01 01 01 01 01 01 2c 15 00 78 41 58 1c 20 30 20
14 00 de 7d 00 00 00 18 00 00 00 00 00 00 00 00
00 00 00 00 00 00 00 00 00 00 00 00 00 fe 00 49
4e 4c 44 69 73 70 6c 61 79 0a 20 20 00 00 00 fc
00 42 54 31 30 31 49 57 30 33 20 56 2e 30 00 d8

----------------

Block 0, Base EDID:
  EDID Structure Version & Revision: 1.3
  Vendor & Product Identification:
    Manufacturer: INL
    Model: 17
    Made in: 2009
  Basic Display Parameters & Features:
    Digital display
    Maximum image size: 22 cm x 12 cm
    Gamma: 2.20
    RGB color display
    First detailed timing is the preferred timing
  Color Characteristics:
    Red  : 0.5751, 0.3476
    Green: 0.3359, 0.5742
    Blue : 0.1542, 0.1054
    White: 0.3134, 0.3291
  Established Timings I & II: none
  Standard Timings: none
  Detailed Timing Descriptors:
    DTD 1:  1024x600    61.646952 Hz 128:75    38.714 kHz     54.200000 MHz (222 mm x 125 mm)
                 Hfront   48 Hsync  32 Hback  296 Hpol N
                 Vfront    1 Vsync   4 Vback   23 Vpol N
    Empty Descriptor
    Alphanumeric Data String: 'INLDisplay'
    Display Product Name: 'BT101IW03 V.0'
Checksum: 0xd8

----------------

Failures:

Block 0, Base EDID:
  Empty Descriptor: Use Dummy Descriptor instead of all zeroes.
  Missing Display Range Limits Descriptor.

EDID conformity: FAIL
