edid-decode (hex):

00 ff ff ff ff ff ff 00 1e 6d e1 4e 01 01 01 01
07 18 01 03 6c 2c 19 78 ea 95 35 a1 59 57 9f 27
0e 50 54 a7 6a 80 71 4f 81 c0 a9 c0 81 00 95 00
01 01 01 01 01 01 30 2a 40 c8 60 84 64 30 18 50
13 00 bb f9 10 00 00 1e 00 00 00 fd 00 38 4b 1e
53 0d 00 0a 20 20 20 20 20 20 00 00 00 fc 00 32
30 45 4e 33 33 0a 20 20 20 20 20 20 00 00 00 ff
00 53 65 72 69 61 6c 4e 75 6d 62 65 72 0a 00 76

00 ff ff ff ff ff ff 00 1e 6d e1 4e 01 01 01 01
07 18 01 03 6c 2c 19 78 ea 95 35 a1 59 57 9f 27
0e 50 54 a7 6a 80 71 4f 81 c0 a9 c0 81 00 95 00
01 01 01 01 01 01 30 2a 40 c8 60 84 64 30 18 50
13 00 bb f9 10 00 00 1e 00 00 00 fd 00 38 4b 1e
53 0d 00 0a 20 20 20 20 20 20 00 00 00 fc 00 32
30 45 4e 33 33 0a 20 20 20 20 20 20 00 00 00 ff
00 53 65 72 69 61 6c 4e 75 6d 62 65 72 0a 00 76

----------------

Block 0, Base EDID:
  EDID Structure Version & Revision: 1.3
  Vendor & Product Identification:
    Manufacturer: GSM
    Model: 20193
    Serial Number: ...
    Made in: week 7 of 2014
  Basic Display Parameters & Features:
    Analog display
    Signal Level Standard: 0.700 : 0.000 : 0.700 V p-p
    Blank level equals black level
    Sync: Separate Composite
    Maximum image size: 44 cm x 25 cm
    Gamma: 2.20
    DPMS levels: Standby Suspend Off
    RGB color display
    First detailed timing is the preferred timing
  Color Characteristics:
    Red  : 0.6308, 0.3486
    Green: 0.3408, 0.6220
    Blue : 0.1523, 0.0576
    White: 0.3134, 0.3291
  Established Timings I & II:
    IBM     :   720x400    70.081663 Hz   9:5     31.467 kHz     28.320000 MHz
    DMT 0x04:   640x480    59.940476 Hz   4:3     31.469 kHz     25.175000 MHz
    DMT 0x06:   640x480    75.000000 Hz   4:3     37.500 kHz     31.500000 MHz
    DMT 0x08:   800x600    56.250000 Hz   4:3     35.156 kHz     36.000000 MHz
    DMT 0x09:   800x600    60.316541 Hz   4:3     37.879 kHz     40.000000 MHz
    DMT 0x0b:   800x600    75.000000 Hz   4:3     46.875 kHz     49.500000 MHz
    Apple   :   832x624    74.551266 Hz   4:3     49.726 kHz     57.284000 MHz
    DMT 0x10:  1024x768    60.003840 Hz   4:3     48.363 kHz     65.000000 MHz
    DMT 0x12:  1024x768    75.028582 Hz   4:3     60.023 kHz     78.750000 MHz
    Apple   :  1152x870    75.061550 Hz 192:145   68.681 kHz    100.000000 MHz
  Standard Timings:
    DMT 0x15:  1152x864    75.000000 Hz   4:3     67.500 kHz    108.000000 MHz
    DMT 0x55:  1280x720    60.000000 Hz  16:9     45.000 kHz     74.250000 MHz
    DMT 0x53:  1600x900    60.000000 Hz  16:9     60.000 kHz    108.000000 MHz (RB)
    DMT 0x1c:  1280x800    59.810326 Hz  16:10    49.702 kHz     83.500000 MHz
    DMT 0x2f:  1440x900    59.887445 Hz  16:10    55.935 kHz    106.500000 MHz
  Detailed Timing Descriptors:
    DTD 1:  1600x900    60.000000 Hz  16:9     60.000 kHz    108.000000 MHz (443 mm x 249 mm)
                 Hfront   24 Hsync  80 Hback   96 Hpol P
                 Vfront    1 Vsync   3 Vback   96 Vpol P
    Display Range Limits:
      Monitor ranges (GTF): 56-75 Hz V, 30-83 kHz H, max dotclock 130 MHz
    Display Product Name: '20EN33'
    Display Product Serial Number: ...
Checksum: 0x76

----------------

Block 1, Unknown EDID Extension Block 0x00:
  00 ff ff ff ff ff ff 00 1e 6d e1 4e 01 01 01 01 '.........m.N....'
  07 18 01 03 6c 2c 19 78 ea 95 35 a1 59 57 9f 27 '....l,.x..5.YW.''
  0e 50 54 a7 6a 80 71 4f 81 c0 a9 c0 81 00 95 00 '.PT.j.qO........'
  01 01 01 01 01 01 30 2a 40 c8 60 84 64 30 18 50 '......0*@.`.d0.P'
  13 00 bb f9 10 00 00 1e 00 00 00 fd 00 38 4b 1e '.............8K.'
  53 0d 00 0a 20 20 20 20 20 20 00 00 00 fc 00 32 'S...      .....2'
  30 45 4e 33 33 0a 20 20 20 20 20 20 00 00 00 ff '0EN33.      ....'
  00 53 65 72 69 61 6c 4e 75 6d 62 65 72 0a 00 76 '.SerialNumber..v'
Checksum: 0x76

----------------

Failures:

Block 1, Base EDID:
  Unknown Extension Block.
EDID:
  Base EDID: EDID specified 0 extension block(s), but found 1 extension block(s).

EDID conformity: FAIL
