
EDID (hex):
00ffffffffffff0005e3191601010101
33130103682213782ab370a255489827
155054bfee00310a614c010101010101
010101010101662156a851001e30458f
3a0058c21000001c662150b051001b30
4070360022130000001e000000fd0037
4b1e3c08000a202020202020000000fc
0031363139770a20202020202020003a

Extracted contents:
header:          00 ff ff ff ff ff ff 00
serial number:   05 e3 19 16 01 01 01 01 33 13
version:         01 03
basic params:    68 22 13 78 2a
chroma info:     b3 70 a2 55 48 98 27 15 50 54
established:     bf ee 00
standard:        31 0a 61 4c 01 01 01 01 01 01 01 01 01 01 01 01
descriptor 1:    66 21 56 a8 51 00 1e 30 45 8f 3a 00 58 c2 10 00 00 1c
descriptor 2:    66 21 50 b0 51 00 1b 30 40 70 36 00 22 13 00 00 00 1e
descriptor 3:    00 00 00 fd 00 37 4b 1e 3c 08 00 0a 20 20 20 20 20 20
descriptor 4:    00 00 00 fc 00 31 36 31 39 77 0a 20 20 20 20 20 20 20
extensions:      00
checksum:        3a

EDID version: 1.3
Manufacturer: AOC Model 1619 Serial Number --
Made in week 51 of 2009
Analog display, Input voltage level: 0.7/0.7 V
Sync: Separate 
Maximum image size: 34 cm x 19 cm
Gamma: 2.20
DPMS levels: Off
RGB color display
First detailed timing is preferred timing
Display x,y Chromaticity:
  Red:   0.6347, 0.3349
  Green: 0.2812, 0.5966
  Blue:  0.1533, 0.0849
  White: 0.3125, 0.3281
Established timings supported:
  720x400@70Hz 9:5 HorFreq: 31469 Hz Clock: 28.320 MHz
  640x480@60Hz 4:3 HorFreq: 31469 Hz Clock: 25.175 MHz
  640x480@67Hz 4:3 HorFreq: 35000 Hz Clock: 30.240 MHz
  640x480@72Hz 4:3 HorFreq: 37900 Hz Clock: 31.500 MHz
  640x480@75Hz 4:3 HorFreq: 37500 Hz Clock: 31.500 MHz
  800x600@56Hz 4:3 HorFreq: 35200 Hz Clock: 36.000 MHz
  800x600@60Hz 4:3 HorFreq: 37900 Hz Clock: 40.000 MHz
  800x600@72Hz 4:3 HorFreq: 48100 Hz Clock: 50.000 MHz
  800x600@75Hz 4:3 HorFreq: 46900 Hz Clock: 49.500 MHz
  832x624@75Hz 4:3 HorFreq: 49726 Hz Clock: 57.284 MHz
  1024x768@60Hz 4:3 HorFreq: 48400 Hz Clock: 65.000 MHz
  1024x768@70Hz 4:3 HorFreq: 56500 Hz Clock: 75.000 MHz
  1024x768@75Hz 4:3 HorFreq: 60000 Hz Clock: 78.750 MHz
Standard timings supported:
  640x400@70Hz 16:10
  1024x768@72Hz 4:3
Detailed mode: Clock 85.500 MHz, 344 mm x 194 mm
               1366 1435 1578 1790 hborder 0
                768  771  781  798 vborder 0
               -hsync +vsync 
               VertFreq: 59 Hz, HorFreq: 47765 Hz
Detailed mode: Clock 85.500 MHz, 34 mm x 19 mm
               1360 1424 1536 1792 hborder 0
                768  771  777  795 vborder 0
               +hsync +vsync 
               VertFreq: 60 Hz, HorFreq: 47712 Hz
Monitor ranges (GTF): 55-75Hz V, 30-60kHz H, max dotclock 80MHz
Monitor name: 1619w
Checksum: 0x3a (valid)
One or more of the timings is out of range of the Monitor Ranges:
  Vertical Freq: 56 - 75 Hz
  Horizontal Freq: 31469 - 60000 Hz
  Maximum Clock: 85.500 MHz
