edid-decode (hex):

00 ff ff ff ff ff ff 00 34 a9 a2 96 00 00 00 00
ff 17 01 04 a5 1d 11 78 02 95 21 a6 53 53 98 25
0b 50 54 00 00 00 01 01 01 01 01 01 01 01 01 01
01 01 01 01 01 01 02 3a 80 58 71 38 0d 40 2c 06
92 00 58 c1 10 00 00 1e 02 3a 80 58 71 38 30 42
2c 06 92 00 58 c1 10 00 00 1e 00 00 00 fd 00 26
3e 40 43 0f 01 0a 20 20 20 20 20 20 00 00 00 fc
00 56 56 59 31 33 46 30 30 31 47 31 30 0a 00 10

----------------

Block 0, Base EDID:
  EDID Structure Version & Revision: 1.4
  Vendor & Product Identification:
    Manufacturer: MEI
    Model: 38562
    Model year: 2013
  Basic Display Parameters & Features:
    Digital display
    Bits per primary color channel: 8
    DisplayPort interface
    Maximum image size: 29 cm x 17 cm
    Gamma: 2.20
    Supported color formats: RGB 4:4:4
    First detailed timing includes the native pixel format and preferred refresh rate
  Color Characteristics:
    Red  : 0.6503, 0.3251
    Green: 0.3251, 0.5947
    Blue : 0.1445, 0.0449
    White: 0.3125, 0.3291
  Established Timings I & II: none
  Standard Timings: none
  Detailed Timing Descriptors:
    DTD 1:  1920x1080   60.011 Hz  16:9    65.592 kHz 148.500 MHz (344 mm x 193 mm)
                 Hfront   44 Hsync   6 Hback 294 Hpol P
                 Vfront    9 Vsync   2 Vback   2 Vpol P
    DTD 2:  1920x1080   39.995 Hz  16:9    65.592 kHz 148.500 MHz (344 mm x 193 mm)
                 Hfront   44 Hsync   6 Hback 294 Hpol P
                 Vfront    9 Vsync   2 Vback 549 Vpol P
  Display Range Limits:
    Monitor ranges (Bare Limits): 38-62 Hz V, 64-67 kHz H, max dotclock 150 MHz
    Display Product Name: 'VVY13F001G10'
Checksum: 0x10
