edid-decode (hex):

00 ff ff ff ff ff ff 00 34 a9 a2 96 00 06 21 89
00 1a 01 04 a0 1d 13 78 02 ee 91 a3 54 4c 99 26
0f 50 54 00 00 00 01 01 01 01 01 01 01 01 01 01
01 01 01 01 01 01 74 59 d0 c8 80 e0 32 50 32 28
44 00 1d be 10 00 00 1e 74 59 d0 c8 80 e0 b6 51
32 28 44 00 1d be 10 00 00 1e 00 00 00 fd 00 2e
3e 5d 5e 18 01 0a 20 20 20 20 20 20 00 00 00 fc
00 56 56 58 31 34 54 30 39 32 4e 30 30 0a 00 20

----------------

Block 0, Base EDID:
  EDID Structure Version & Revision: 1.4
  Vendor & Product Identification:
    Manufacturer: MEI
    Model: 38562
    Serial Number: ...
    Made in: 2016
  Basic Display Parameters & Features:
    Digital display
    Bits per primary color channel: 8
    Digital interface is not defined
    Maximum image size: 29 cm x 19 cm
    Gamma: 2.20
    Supported color formats: RGB 4:4:4
    First detailed timing includes the native pixel format and preferred refresh rate
  Color Characteristics:
    Red  : 0.6396, 0.3300
    Green: 0.2998, 0.5996
    Blue : 0.1503, 0.0595
    White: 0.3125, 0.3291
  Established Timings I & II: none
  Standard Timings: none
  Detailed Timing Descriptors:
    DTD 1:  2256x1504   60.001 Hz   3:2    93.241 kHz 229.000 MHz (285 mm x 190 mm)
                 Hfront   50 Hsync  40 Hback 110 Hpol P
                 Vfront    4 Vsync   4 Vback  42 Vpol P
    DTD 2:  2256x1504   48.013 Hz   3:2    93.241 kHz 229.000 MHz (285 mm x 190 mm)
                 Hfront   50 Hsync  40 Hback 110 Hpol P
                 Vfront    4 Vsync   4 Vback 430 Vpol P
  Display Range Limits:
    Monitor ranges (Bare Limits): 46-62 Hz V, 93-94 kHz H, max dotclock 240 MHz
    Display Product Name: 'VVX14T092N00'
Checksum: 0x20

----------------

EDID conformity: PASS
