
EDID (hex):
00ffffffffffff0034a9a29600000000
ff170104a51d1178029521a653539825
0b505400000001010101010101010101
010101010101023a805871380d402c06
920026a61000001e023a805871383042
2c06920026a61000001e000000fd0026
3e40430f010a202020202020000000fc
005656583133463030394731300a00a3

Extracted contents:
header:          00 ff ff ff ff ff ff 00
serial number:   34 a9 a2 96 00 00 00 00 ff 17
version:         01 04
basic params:    a5 1d 11 78 02
chroma info:     95 21 a6 53 53 98 25 0b 50 54
established:     00 00 00
standard:        01 01 01 01 01 01 01 01 01 01 01 01 01 01 01 01
descriptor 1:    02 3a 80 58 71 38 0d 40 2c 06 92 00 26 a6 10 00 00 1e
descriptor 2:    02 3a 80 58 71 38 30 42 2c 06 92 00 26 a6 10 00 00 1e
descriptor 3:    00 00 00 fd 00 26 3e 40 43 0f 01 0a 20 20 20 20 20 20
descriptor 4:    00 00 00 fc 00 56 56 58 31 33 46 30 30 39 47 31 30 0a
extensions:      00
checksum:        a3

EDID version: 1.4
Manufacturer: MEI Model 96a2 Serial Number --
Model year 2013
Digital display
8 bits per primary color channel
DisplayPort interface
Maximum image size: 29 cm x 17 cm
Gamma: 2.20
Supported color formats: RGB 4:4:4
First detailed timing includes the native pixel format and preferred refresh rate
Display x,y Chromaticity:
  Red:   0.6503, 0.3251
  Green: 0.3251, 0.5947
  Blue:  0.1445, 0.0449
  White: 0.3125, 0.3291
Established timings supported:
Standard timings supported:
Detailed mode: Clock 148.500 MHz, 294 mm x 166 mm
               1920 1964 1970 2264 hborder 0
               1080 1089 1091 1093 vborder 0
               +hsync +vsync 
               VertFreq: 60 Hz, HorFreq: 65591 Hz
Detailed mode: Clock 148.500 MHz, 294 mm x 166 mm
               1920 1964 1970 2264 hborder 0
               1080 1089 1091 1640 vborder 0
               +hsync +vsync 
               VertFreq: 39 Hz, HorFreq: 65591 Hz
Monitor ranges (bare limits): 38-62Hz V, 64-67kHz H, max dotclock 150MHz
Monitor name: VVX13F009G10
Checksum: 0xa3 (valid)
