edid-decode (hex):

00 ff ff ff ff ff ff 00 34 a9 a2 96 00 00 00 00
ff 18 01 04 a5 1e 11 78 02 97 25 a6 53 53 9c 25
0b 50 54 00 00 00 01 01 01 01 01 01 01 01 01 01
01 01 01 01 01 01 9a 64 00 f0 a0 a0 5d 50 58 20
c5 04 26 a5 10 00 00 1e 97 64 00 f0 a0 a0 dc 51
58 20 c5 04 26 a5 10 00 00 1e 00 00 00 fd 00 28
3e 59 5e 1a 01 0a 20 20 20 20 20 20 00 00 00 fc
00 56 56 58 31 33 54 30 34 33 4e 30 30 0a 00 52

----------------

Block 0, Base EDID:
  EDID Structure Version & Revision: 1.4
  Vendor & Product Identification:
    Manufacturer: MEI
    Model: 38562
    Model year: 2014
  Basic Display Parameters & Features:
    Digital display
    Bits per primary color channel: 8
    DisplayPort interface
    Maximum image size: 30 cm x 17 cm
    Gamma: 2.20
    Supported color formats: RGB 4:4:4
    First detailed timing includes the native pixel format and preferred refresh rate
  Color Characteristics:
    Red  : 0.6503, 0.3251
    Green: 0.3251, 0.6123
    Blue : 0.1445, 0.0449
    White: 0.3134, 0.3291
  Established Timings I & II: none
  Standard Timings: none
  Detailed Timing Descriptors:
    DTD 1:  2560x1440   59.999068 Hz  16:9     91.979 kHz    257.540000 MHz (294 mm x 165 mm)
                 Hfront   88 Hsync  32 Hback  120 Hpol P
                 Vfront   28 Vsync   5 Vback   60 Vpol P
    DTD 2:  2560x1440   47.999925 Hz  16:9     91.968 kHz    257.510000 MHz (294 mm x 165 mm)
                 Hfront   88 Hsync  32 Hback  120 Hpol P
                 Vfront   28 Vsync   5 Vback  443 Vpol P
    Display Range Limits:
      Monitor ranges (Bare Limits): 40-62 Hz V, 89-94 kHz H, max dotclock 260 MHz
    Display Product Name: 'VVX13T043N00'
Checksum: 0x52

----------------

EDID conformity: PASS
