
EDID (hex):
00ffffffffffff0034a9a29600000000
ff190104a526157802b651a85242ac27
09505400000001010101010101010101
010101010101c3d100baf0703f80a208
88007ed71000001ec3d100baf0703f80
a20888007ed71000001e000000fd003a
3e818a38010a202020202020000000fe
005656583137503035314a30300a00dc

Extracted contents:
header:          00 ff ff ff ff ff ff 00
serial number:   34 a9 a2 96 00 00 00 00 ff 19
version:         01 04
basic params:    a5 26 15 78 02
chroma info:     b6 51 a8 52 42 ac 27 09 50 54
established:     00 00 00
standard:        01 01 01 01 01 01 01 01 01 01 01 01 01 01 01 01
descriptor 1:    c3 d1 00 ba f0 70 3f 80 a2 08 88 00 7e d7 10 00 00 1e
descriptor 2:    c3 d1 00 ba f0 70 3f 80 a2 08 88 00 7e d7 10 00 00 1e
descriptor 3:    00 00 00 fd 00 3a 3e 81 8a 38 01 0a 20 20 20 20 20 20
descriptor 4:    00 00 00 fe 00 56 56 58 31 37 50 30 35 31 4a 30 30 0a
extensions:      00
checksum:        dc

EDID version: 1.4
Manufacturer: MEI Model 96a2 Serial Number --
Model year 2015
Digital display
8 bits per primary color channel
DisplayPort interface
Maximum image size: 38 cm x 21 cm
Gamma: 2.20
Supported color formats: RGB 4:4:4
First detailed timing includes the native pixel format and preferred refresh rate
Display x,y Chromaticity:
  Red:   0.6582, 0.3232
  Green: 0.2587, 0.6738
  Blue:  0.1533, 0.0361
  White: 0.3125, 0.3291
Established timings supported:
Standard timings supported:
Detailed mode: Clock 536.990 MHz, 382 mm x 215 mm
               3840 4002 4010 4026 hborder 0
               2160 2168 2176 2223 vborder 0
               +hsync +vsync 
               VertFreq: 60 Hz, HorFreq: 133380 Hz
Detailed mode: Clock 536.990 MHz, 382 mm x 215 mm
               3840 4002 4010 4026 hborder 0
               2160 2168 2176 2223 vborder 0
               +hsync +vsync 
               VertFreq: 60 Hz, HorFreq: 133380 Hz
Monitor ranges (bare limits): 58-62Hz V, 129-138kHz H, max dotclock 560MHz
ASCII string: VVX17P051J00
Checksum: 0xdc (valid)
EDID block does NOT conform to EDID 1.4!
	Missing name descriptor
