
EDID (hex):
00ffffffffffff002267c51801010101
0a1301030a2d1978eab815a6554b9b25
135054a56a0081809040010101010101
0101010101012f2640a060841a303020
3500bbf91000001a000000fc00484632
30370a20202020202020000000fd0038
4c155310000a202020202020000000ff
00393130434e335859303334383100af

Extracted contents:
header:          00 ff ff ff ff ff ff 00
serial number:   22 67 c5 18 01 01 01 01 0a 13
version:         01 03
basic params:    0a 2d 19 78 ea
chroma info:     b8 15 a6 55 4b 9b 25 13 50 54
established:     a5 6a 00
standard:        81 80 90 40 01 01 01 01 01 01 01 01 01 01 01 01
descriptor 1:    2f 26 40 a0 60 84 1a 30 30 20 35 00 bb f9 10 00 00 1a
descriptor 2:    00 00 00 fc 00 48 46 32 30 37 0a 20 20 20 20 20 20 20
descriptor 3:    00 00 00 fd 00 38 4c 15 53 10 00 0a 20 20 20 20 20 20
descriptor 4:    00 00 00 ff 00 39 31 30 43 4e 33 58 59 30 33 34 38 31
extensions:      00
checksum:        af

EDID version: 1.3
Manufacturer: HSG Model 18c5 Serial Number --
Made in week 10 of 2009
Analog display, Input voltage level: 0.7/0.3 V
Sync: Separate SyncOnGreen 
Maximum image size: 45 cm x 25 cm
Gamma: 2.20
DPMS levels: Standby Suspend Off
RGB color display
First detailed timing is preferred timing
Display x,y Chromaticity:
  Red:   0.6503, 0.3349
  Green: 0.2949, 0.6054
  Blue:  0.1445, 0.0751
  White: 0.3134, 0.3291
Established timings supported:
  720x400@70Hz 9:5 HorFreq: 31469 Hz Clock: 28.320 MHz
  640x480@60Hz 4:3 HorFreq: 31469 Hz Clock: 25.175 MHz
  640x480@75Hz 4:3 HorFreq: 37500 Hz Clock: 31.500 MHz
  800x600@60Hz 4:3 HorFreq: 37900 Hz Clock: 40.000 MHz
  800x600@75Hz 4:3 HorFreq: 46900 Hz Clock: 49.500 MHz
  832x624@75Hz 4:3 HorFreq: 49726 Hz Clock: 57.284 MHz
  1024x768@60Hz 4:3 HorFreq: 48400 Hz Clock: 65.000 MHz
  1024x768@75Hz 4:3 HorFreq: 60000 Hz Clock: 78.750 MHz
Standard timings supported:
  1280x1024@60Hz 5:4 HorFreq: 64000 Hz Clock: 108.000 MHz
  1400x1050@60Hz 4:3 HorFreq: 64700 Hz Clock: 101.000 MHz
Detailed mode: Clock 97.750 MHz, 443 mm x 249 mm
               1600 1648 1680 1760 hborder 0
                900  903  908  926 vborder 0
               +hsync -vsync 
               VertFreq: 59 Hz, HorFreq: 55539 Hz
Monitor name: HF207
Monitor ranges (GTF): 56-76Hz V, 21-83kHz H, max dotclock 160MHz
Serial number: --
Checksum: 0xaf (valid)


