edid-decode (hex):

00 ff ff ff ff ff ff 00 4c a3 49 41 00 00 00 00
00 15 01 04 90 1c 11 78 0a 85 95 99 57 4f 8f 26
21 50 54 00 00 00 01 01 01 01 01 01 01 01 01 01
01 01 01 01 01 01 ed 1d 56 d8 50 00 27 30 0e 38
13 00 24 ae 10 00 00 19 f3 13 56 d8 50 00 27 30
0e 38 13 00 24 ae 10 00 00 19 00 00 00 00 00 00
00 00 00 00 00 00 00 00 00 00 00 00 00 00 00 02
00 0c 42 f2 0b 3c 69 14 11 1e 6e 00 00 00 00 4c

----------------

Block 0, Base EDID:
  EDID Structure Version & Revision: 1.4
  Vendor & Product Identification:
    Manufacturer: SEC
    Model: 16713
    Made in: 2011
  Basic Display Parameters & Features:
    Digital display
    Bits per primary color channel: 6
    Digital interface is not defined
    Maximum image size: 28 cm x 17 cm
    Gamma: 2.20
    Supported color formats: RGB 4:4:4, YCrCb 4:4:4
    First detailed timing includes the native pixel format and preferred refresh rate
  Color Characteristics:
    Red  : 0.5996, 0.3398
    Green: 0.3095, 0.5595
    Blue : 0.1503, 0.1298
    White: 0.3134, 0.3291
  Established Timings I & II: none
  Standard Timings: none
  Detailed Timing Descriptors:
    DTD 1:  1366x768    60.007 Hz 683:384  48.426 kHz  76.610 MHz (292 mm x 174 mm)
                 Hfront   14 Hsync  56 Hback 146 Hpol N
                 Vfront    1 Vsync   3 Vback  35 Vpol N
    DTD 2:  1366x768    40.002 Hz 683:384  32.282 kHz  51.070 MHz (292 mm x 174 mm)
                 Hfront   14 Hsync  56 Hback 146 Hpol N
                 Vfront    1 Vsync   3 Vback  35 Vpol N
    Empty Descriptor
    Manufacturer-Specified Display Descriptor (0x02): 00 02 00 0c 42 f2 0b 3c 69 14 11 1e 6e 00 00 00 '....B..<i...n...'
Checksum: 0x4c
