edid-decode (hex):

00 ff ff ff ff ff ff 00 06 10 98 9c 00 00 00 00
18 12 01 03 80 25 17 78 0a e5 95 a3 54 4f 9c 26
01 50 54 00 00 00 01 01 01 01 01 01 01 01 01 01
01 01 01 01 01 01 28 3c 80 a0 70 b0 23 40 30 20
36 00 6f e6 10 00 00 18 00 00 00 01 00 06 10 30
00 00 00 00 00 00 00 00 0a 20 00 00 00 fe 00 4c
50 31 37 31 57 55 36 2d 54 4c 41 31 00 00 00 fe
00 43 6f 6c 6f 72 20 4c 43 44 0a 20 20 20 00 f0

----------------

Block 0, Base EDID:
  EDID Structure Version & Revision: 1.3
  Vendor & Product Identification:
    Manufacturer: APP
    Model: 40088
    Made in: week 24 of 2008
  Basic Display Parameters & Features:
    Digital display
    Maximum image size: 37 cm x 23 cm
    Gamma: 2.20
    RGB color display
    First detailed timing is preferred timing
  Color Characteristics:
    Red  : 0.6396, 0.3300
    Green: 0.3095, 0.6103
    Blue : 0.1503, 0.0048
    White: 0.3134, 0.3291
  Established Timings I & II: none
  Standard Timings: none
  Detailed Timing Descriptors:
    DTD 1:  1920x1200   59.950 Hz   8:5    74.038 kHz 154.000 MHz (367 mm x 230 mm)
                 Hfront   48 Hsync  32 Hback  80 Hpol N
                 Vfront    3 Vsync   6 Vback  26 Vpol N
    Manufacturer-Specified Display Descriptor (0x01): 00 01 00 06 10 30 00 00 00 00 00 00 00 00 0a 20 '.....0......... '
    Alphanumeric Data String: 'LP171WU6-TLA1'
    Alphanumeric Data String: 'Color LCD'
Checksum: 0xf0
