edid-decode (hex):

00 ff ff ff ff ff ff 00 10 ac f9 93 f2 06 22 00
1c 1b 01 03 80 35 1e 78 0a fe 40 a5 55 52 9a 26
12 50 54 00 00 00 01 01 01 01 01 01 01 01 01 01
01 01 01 01 01 01 94 34 80 64 70 38 1f 40 1e 14
35 00 0f 29 21 00 00 1e 00 00 00 fc 00 49 6e 73
70 69 72 6f 6e 20 33 34 37 37 00 00 00 10 00 00
0a 20 20 20 20 20 20 20 20 20 20 20 00 00 00 10
00 00 0a 20 20 20 20 20 20 20 21 20 20 20 00 3b

----------------

Block 0, Base EDID:
  EDID Structure Version & Revision: 1.3
  Vendor & Product Identification:
    Manufacturer: DEL
    Model: 37881
    Serial Number: ...
    Made in: week 28 of 2017
  Basic Display Parameters & Features:
    Digital display
    Maximum image size: 53 cm x 30 cm
    Gamma: 2.20
    RGB color display
    First detailed timing is preferred timing
  Color Characteristics:
    Red  : 0.6474, 0.3349
    Green: 0.3232, 0.6035
    Blue : 0.1494, 0.0703
    White: 0.3125, 0.3281
  Established Timings I & II: none
  Standard Timings: none
  Detailed Timing Descriptors:
    DTD 1:  1920x1080   59.976 Hz  16:9    66.634 kHz 134.600 MHz (527 mm x 297 mm)
                 Hfront   30 Hsync  20 Hback  50 Hpol P
                 Vfront    3 Vsync   5 Vback  23 Vpol P
    Display Product Name: 'Inspiron 3477'
    Dummy Descriptor:
    Dummy Descriptor:
Checksum: 0x3b
