
EDID (hex):
00ffffffffffff0006b3012400000000
2a1f0104a5341d78ff3205a3544d9c27
0d5054254b00457c617c818081bca9c0
a9fcb300b33c023a801871382d40582c
450055502100001e000000fd0030a5ba
ba29010a202020202020000000ff004d
414c4d44573030333235340a000000fc
0056473234395131520a202020200121
020333f150101f010204050611131415
2021223f40230907078301000067030c
00300038526d1a0000020130a5000000
000000d15a80a0703828403020350055
502100001e046d80a070382840302035
0055502100001ead8280a07038284030
20350055502100001ec99580a0703828
403020350055502100001e000000003d

Extracted contents:
header:          00 ff ff ff ff ff ff 00
serial number:   06 b3 01 24 00 00 00 00 2a 1f
version:         01 04
basic params:    a5 34 1d 78 ff
chroma info:     32 05 a3 54 4d 9c 27 0d 50 54
established:     25 4b 00
standard:        45 7c 61 7c 81 80 81 bc a9 c0 a9 fc b3 00 b3 3c
descriptor 1:    02 3a 80 18 71 38 2d 40 58 2c 45 00 55 50 21 00 00 1e
descriptor 2:    00 00 00 fd 00 30 a5 ba ba 29 01 0a 20 20 20 20 20 20
descriptor 3:    00 00 00 ff 00 4d 41 4c 4d 44 57 30 30 33 32 35 34 0a
descriptor 4:    00 00 00 fc 00 56 47 32 34 39 51 31 52 0a 20 20 20 20
extensions:      01
checksum:        21

EDID version: 1.4
Manufacturer: AUS Model 2401 Serial Number --
Made in week 42 of 2021
Digital display
8 bits per primary color channel
DisplayPort interface
Maximum image size: 52 cm x 29 cm
Gamma: 2.20
DPMS levels: Standby Suspend Off
Supported color formats: RGB 4:4:4, YCrCb 4:4:4, YCrCb 4:2:2
Default (sRGB) color space is primary color space
First detailed timing includes the native pixel format and preferred refresh rate
Display is continuous frequency
Display x,y Chromaticity:
  Red:   0.6367, 0.3310
  Green: 0.3007, 0.6113
  Blue:  0.1523, 0.0507
  White: 0.3134, 0.3291
Established timings supported:
  640x480@60Hz 4:3 HorFreq: 31469 Hz Clock: 25.175 MHz
  640x480@75Hz 4:3 HorFreq: 37500 Hz Clock: 31.500 MHz
  800x600@60Hz 4:3 HorFreq: 37900 Hz Clock: 40.000 MHz
  800x600@75Hz 4:3 HorFreq: 46900 Hz Clock: 49.500 MHz
  1024x768@60Hz 4:3 HorFreq: 48400 Hz Clock: 65.000 MHz
  1024x768@75Hz 4:3 HorFreq: 60000 Hz Clock: 78.750 MHz
  1280x1024@75Hz 5:4 HorFreq: 80000 Hz Clock: 135.000 MHz
Standard timings supported:
  800x600@120Hz 4:3
  1024x768@120Hz 4:3
  1280x1024@60Hz 5:4 HorFreq: 64000 Hz Clock: 108.000 MHz
  1280x1024@120Hz 5:4
  1600x900@60Hz 16:9
  1600x900@120Hz 16:9
  1680x1050@60Hz 16:10 HorFreq: 64700 Hz Clock: 119.000 MHz
  1680x1050@120Hz 16:10
Detailed mode: Clock 148.500 MHz, 597 mm x 336 mm
               1920 2008 2052 2200 hborder 0
               1080 1084 1089 1125 vborder 0
               +hsync +vsync 
               VertFreq: 60 Hz, HorFreq: 67500 Hz
Monitor ranges (bare limits): 48-165Hz V, 186-186kHz H, max dotclock 410MHz
Serial number: --
Monitor name: VG249Q1R
Has 1 extension blocks
Checksum: 0x21 (valid)

CTA extension block
Extension version: 3
47 bytes of CTA data
  Video data block
    VIC  16 1920x1080@60Hz 16:9  HorFreq: 67500 Hz Clock: 148.500 MHz
    VIC  31 1920x1080@50Hz 16:9  HorFreq: 56250 Hz Clock: 148.500 MHz
    VIC   1 640x480@60Hz 4:3  HorFreq: 31469 Hz Clock: 25.175 MHz
    VIC   2 720x480@60Hz 4:3  HorFreq: 31469 Hz Clock: 27.000 MHz
    VIC   4 1280x720@60Hz 16:9  HorFreq: 45000 Hz Clock: 74.250 MHz
    VIC   5 1920x1080i@60Hz 16:9  HorFreq: 33750 Hz Clock: 74.250 MHz
    VIC   6 1440x480i@60Hz 4:3  HorFreq: 15734 Hz Clock: 27.000 MHz
    VIC  17 720x576@50Hz 4:3  HorFreq: 31250 Hz Clock: 27.000 MHz
    VIC  19 1280x720@50Hz 16:9  HorFreq: 37500 Hz Clock: 74.250 MHz
    VIC  20 1920x1080i@50Hz 16:9  HorFreq: 28125 Hz Clock: 74.250 MHz
    VIC  21 1440x576i@50Hz 4:3  HorFreq: 15625 Hz Clock: 27.000 MHz
    VIC  32 1920x1080@24Hz 16:9  HorFreq: 27000 Hz Clock: 74.250 MHz
    VIC  33 1920x1080@25Hz 16:9  HorFreq: 28125 Hz Clock: 74.250 MHz
    VIC  34 1920x1080@30Hz 16:9  HorFreq: 33750 Hz Clock: 74.250 MHz
    VIC  63 1920x1080@120Hz 16:9  HorFreq: 135000 Hz Clock: 297.000 MHz
    VIC  64 1920x1080@100Hz 16:9  HorFreq: 112500 Hz Clock: 297.000 MHz
  Audio data block
    Linear PCM, max channels 2
      Supported sample rates (kHz): 48 44.1 32
      Supported sample sizes (bits): 24 20 16
  Speaker allocation data block
    Speaker map:
      FL/FR - Front Left/Right
  Vendor-specific data block, OUI 000c03 (HDMI)
    Source physical address 3.0.0.0
    DC_36bit
    DC_30bit
    DC_Y444
    Maximum TMDS clock: 410MHz
  Vendor-specific data block, OUI 00001a
Underscans PC formats by default
Basic audio support
Supports YCbCr 4:4:4
Supports YCbCr 4:2:2
1 native detailed modes
Detailed mode: Clock 232.490 MHz, 597 mm x 336 mm
               1920 1968 2000 2080 hborder 0
               1080 1083 1088 1120 vborder 0
               +hsync +vsync 
               VertFreq: 99 Hz, HorFreq: 111774 Hz
Detailed mode: Clock 279.080 MHz, 597 mm x 336 mm
               1920 1968 2000 2080 hborder 0
               1080 1083 1088 1120 vborder 0
               +hsync +vsync 
               VertFreq: 119 Hz, HorFreq: 134173 Hz
Detailed mode: Clock 334.530 MHz, 597 mm x 336 mm
               1920 1968 2000 2080 hborder 0
               1080 1083 1088 1120 vborder 0
               +hsync +vsync 
               VertFreq: 143 Hz, HorFreq: 160831 Hz
Detailed mode: Clock 383.450 MHz, 597 mm x 336 mm
               1920 1968 2000 2080 hborder 0
               1080 1083 1088 1120 vborder 0
               +hsync +vsync 
               VertFreq: 164 Hz, HorFreq: 184350 Hz
Checksum: 0x3d (valid)

EDID block does NOT conform to EDID 1.4!
	sRGB is signaled, but the chromaticities do not match
	HDMI VSDB Max TMDS rate is > 340
Warning: One or more of the timings is out of range of the Monitor Ranges:
  Vertical Freq: 24 - 164 Hz
  Horizontal Freq: 15625 - 184350 Hz
  Maximum Clock: 383.450 MHz
