edid-decode (hex):

00 ff ff ff ff ff ff 00 2a 59 95 01 00 00 00 00
2d 19 01 03 80 29 1f 78 8a 00 13 a0 57 49 9b 26
10 48 4e ad cf 00 81 80 81 8c 45 4a 81 8a 61 4a
61 4c 45 4c 01 01 30 2a 40 c8 60 84 64 30 18 50
13 00 c7 00 11 00 00 1c 30 2a 40 c8 60 84 64 30
18 50 13 00 c7 00 11 00 00 1c 00 00 00 ff 00 30
30 30 30 30 30 31 0a 20 20 20 20 20 00 00 00 fc
00 44 56 49 0a 20 20 20 20 20 20 20 20 20 00 7b

----------------

Block 0, Base EDID:
  EDID Structure Version & Revision: 1.3
  Vendor & Product Identification:
    Manufacturer: JRY
    Model: 405
    Made in: week 45 of 2015
  Basic Display Parameters & Features:
    Digital display
    Maximum image size: 41 cm x 31 cm
    Gamma: 2.20
    DPMS levels: Standby
    RGB color display
    First detailed timing is the preferred timing
  Color Characteristics:
    Red  : 0.6250, 0.3398
    Green: 0.2851, 0.6054
    Blue : 0.1484, 0.0634
    White: 0.2812, 0.3076
  Established Timings I & II:
    IBM     :   720x400    70.082 Hz   9:5    31.467 kHz  28.320 MHz
    DMT 0x04:   640x480    59.940 Hz   4:3    31.469 kHz  25.175 MHz
    DMT 0x05:   640x480    72.809 Hz   4:3    37.861 kHz  31.500 MHz
    DMT 0x06:   640x480    75.000 Hz   4:3    37.500 kHz  31.500 MHz
    DMT 0x09:   800x600    60.317 Hz   4:3    37.879 kHz  40.000 MHz
    DMT 0x0a:   800x600    72.188 Hz   4:3    48.077 kHz  50.000 MHz
    DMT 0x0b:   800x600    75.000 Hz   4:3    46.875 kHz  49.500 MHz
    DMT 0x10:  1024x768    60.004 Hz   4:3    48.363 kHz  65.000 MHz
    DMT 0x11:  1024x768    70.069 Hz   4:3    56.476 kHz  75.000 MHz
    DMT 0x12:  1024x768    75.029 Hz   4:3    60.023 kHz  78.750 MHz
    DMT 0x24:  1280x1024   75.025 Hz   5:4    79.976 kHz 135.000 MHz
  Standard Timings:
    DMT 0x23:  1280x1024   60.020 Hz   5:4    63.981 kHz 108.000 MHz
    GTF     :  1280x1024   72.000 Hz   5:4    76.824 kHz 132.752 MHz
    GTF     :   800x600    70.000 Hz   4:3    43.750 kHz  45.500 MHz
    GTF     :  1280x1024   70.000 Hz   5:4    74.620 kHz 128.943 MHz
    GTF     :  1024x768    70.000 Hz   4:3    56.000 kHz  76.160 MHz
    DMT 0x11:  1024x768    70.069 Hz   4:3    56.476 kHz  75.000 MHz
    DMT 0x0a:   800x600    72.188 Hz   4:3    48.077 kHz  50.000 MHz
  Detailed Timing Descriptors:
    DTD 1:  1600x900    60.000 Hz  16:9    60.000 kHz 108.000 MHz (455 mm x 256 mm)
                 Hfront   24 Hsync  80 Hback  96 Hpol N
                 Vfront    1 Vsync   3 Vback  96 Vpol P
    DTD 2:  1600x900    60.000 Hz  16:9    60.000 kHz 108.000 MHz (455 mm x 256 mm)
                 Hfront   24 Hsync  80 Hback  96 Hpol N
                 Vfront    1 Vsync   3 Vback  96 Vpol P
    Display Product Serial Number: ...
    Display Product Name: 'DVI'
Checksum: 0x7b

----------------

Failures:

Block 0, Base EDID:
  Detailed Timing Descriptor #1: Mismatch of image size 455x256 mm vs display size 410x310 mm.
  Detailed Timing Descriptor #2: Mismatch of image size 455x256 mm vs display size 410x310 mm.
  Missing Display Range Limits Descriptor.
EDID:
  Base EDID: GTF timings are used, but the EDID does not signal GTF support.

EDID conformity: FAIL
