edid-decode (hex):

00 ff ff ff ff ff ff 00 04 43 00 00 00 00 00 00
1a 16 01 04 a5 0f 14 78 06 ef 05 a3 54 4c 99 26
0f 50 54 00 00 00 01 01 01 01 01 01 01 01 01 01
01 01 01 01 01 01 20 4e 00 53 60 00 0b 80 10 0f
71 00 94 c5 00 00 00 18 00 00 00 fa 00 00 00 00
00 00 00 00 00 00 00 00 00 00 00 00 00 ff 4c 41
42 43 30 39 37 41 42 30 32 0a 20 20 00 00 00 ff
00 54 46 54 20 4c 43 44 0a 20 20 20 20 20 00 7a

----------------

Block 0, Base EDID:
  EDID Structure Version & Revision: 1.4
  Vendor & Product Identification:
    Manufacturer: ABC
    Model: 0
    Made in: week 26 of 2012
  Basic Display Parameters & Features:
    Digital display
    Bits per primary color channel: 8
    DisplayPort interface
    Maximum image size: 15 cm x 20 cm
    Gamma: 2.20
    Supported color formats: RGB 4:4:4
    Default (sRGB) color space is primary color space
    First detailed timing includes the native pixel format and preferred refresh rate
  Color Characteristics:
    Red  : 0.6396, 0.3300
    Green: 0.2998, 0.6005
    Blue : 0.1484, 0.0585
    White: 0.3134, 0.3291
  Established Timings I & II: none
  Standard Timings: none
  Detailed Timing Descriptors:
    DTD 1:  1536x2048   59.997 Hz   3:4   123.533 kHz 200.000 MHz (148 mm x 197 mm)
                 Hfront   16 Hsync  15 Hback  52 Hpol N
                 Vfront    7 Vsync   1 Vback   3 Vpol N
    Standard Timing Identifications:
    Display Product Serial Number: ...
    Display Product Serial Number: 'TFT LCD'
Checksum: 0x7a

----------------

Failures:

Block 0, Base EDID:
  Basic Display Parameters & Features: sRGB is signaled, but the chromaticities do not match.
  Standard Timing Identifications: Use 0x0101 as the invalid Standard Timings code, not 0x0000.
  Standard Timing Identifications: Use 0x0101 as the invalid Standard Timings code, not 0x0000.
  Standard Timing Identifications: Use 0x0101 as the invalid Standard Timings code, not 0x0000.
  Standard Timing Identifications: Use 0x0101 as the invalid Standard Timings code, not 0x0000.
  Standard Timing Identifications: Use 0x0101 as the invalid Standard Timings code, not 0x0000.
  Standard Timing Identifications: Use 0x0101 as the invalid Standard Timings code, not 0x0000.
  Display Descriptor #3: Monitor descriptor block has byte 4 nonzero (0x4c).
  Missing Display Product Name.

EDID conformity: FAIL
