
EDID (hex):
00ffffffffffff0010acf193f2062200
35180103802b18780ac5b0a455529f27
0e505400000001010101010101010101
010101010101442f4030628422301850
1300b2ec1000001e000000fc004f7074
69506c65782033303530000000100000
0a202020202020202020202000000010
00000a2020202020202021202020005e

Extracted contents:
header:          00 ff ff ff ff ff ff 00
serial number:   10 ac f1 93 f2 06 22 00 35 18
version:         01 03
basic params:    80 2b 18 78 0a
chroma info:     c5 b0 a4 55 52 9f 27 0e 50 54
established:     00 00 00
standard:        01 01 01 01 01 01 01 01 01 01 01 01 01 01 01 01
descriptor 1:    44 2f 40 30 62 84 22 30 18 50 13 00 b2 ec 10 00 00 1e
descriptor 2:    00 00 00 fc 00 4f 70 74 69 50 6c 65 78 20 33 30 35 30
descriptor 3:    00 00 00 10 00 00 0a 20 20 20 20 20 20 20 20 20 20 20
descriptor 4:    00 00 00 10 00 00 0a 20 20 20 20 20 20 20 21 20 20 20
extensions:      00
checksum:        5e

EDID version: 1.3
Manufacturer: DEL Model 93f1 Serial Number --
Made in week 53 of 2014
Digital display
Maximum image size: 43 cm x 24 cm
Gamma: 2.20
RGB color display
First detailed timing is preferred timing
Display x,y Chromaticity:
  Red:   0.6435, 0.3320
  Green: 0.3212, 0.6220
  Blue:  0.1542, 0.0576
  White: 0.3125, 0.3281
Established timings supported:
Standard timings supported:
Detailed mode: Clock 121.000 MHz, 434 mm x 236 mm
               1600 1624 1704 2160 hborder 0
                900  901  904  934 vborder 0
               +hsync +vsync 
               VertFreq: 59 Hz, HorFreq: 56018 Hz
Dummy block
Dummy block
Checksum: 0x5e (valid)
EDID block does NOT conform to EDID 1.3!
	Name descriptor not terminated with a newline
	Missing monitor ranges
EDID block does not conform at all!
	Dummy block filled with garbage
