
EDID (hex):
00ffffffffffff004c2d4e0c46584d30
201c0103803d23782a5fb1a2574fa228
0f5054bfef80714f810081c081809500
a9c0b300010104740030f2705a80b058
8a0060592100001e000000fd00184b1e
5a1e000a202020202020000000fc0055
3238453539300a2020202020000000ff
004854504b3830303637390a202001e8

Extracted contents:
header:          00 ff ff ff ff ff ff 00
serial number:   4c 2d 4e 0c 46 58 4d 30 20 1c
version:         01 03
basic params:    80 3d 23 78 2a
chroma info:     5f b1 a2 57 4f a2 28 0f 50 54
established:     bf ef 80
standard:        71 4f 81 00 81 c0 81 80 95 00 a9 c0 b3 00 01 01
descriptor 1:    04 74 00 30 f2 70 5a 80 b0 58 8a 00 60 59 21 00 00 1e
descriptor 2:    00 00 00 fd 00 18 4b 1e 5a 1e 00 0a 20 20 20 20 20 20
descriptor 3:    00 00 00 fc 00 55 32 38 45 35 39 30 0a 20 20 20 20 20
descriptor 4:    00 00 00 ff 00 48 54 50 4b 38 30 30 36 37 39 0a 20 20
extensions:      01
checksum:        e8

EDID version: 1.3
Manufacturer: SAM Model c4e Serial Number --
Made in week 32 of 2018
Digital display
Maximum image size: 61 cm x 35 cm
Gamma: 2.20
DPMS levels: Off
RGB color display
First detailed timing is preferred timing
Display x,y Chromaticity:
  Red:   0.6337, 0.3408
  Green: 0.3115, 0.6357
  Blue:  0.1582, 0.0615
  White: 0.3125, 0.3291
Established timings supported:
  720x400@70Hz 9:5 HorFreq: 31469 Hz Clock: 28.320 MHz
  640x480@60Hz 4:3 HorFreq: 31469 Hz Clock: 25.175 MHz
  640x480@67Hz 4:3 HorFreq: 35000 Hz Clock: 30.240 MHz
  640x480@72Hz 4:3 HorFreq: 37900 Hz Clock: 31.500 MHz
  640x480@75Hz 4:3 HorFreq: 37500 Hz Clock: 31.500 MHz
  800x600@56Hz 4:3 HorFreq: 35200 Hz Clock: 36.000 MHz
  800x600@60Hz 4:3 HorFreq: 37900 Hz Clock: 40.000 MHz
  800x600@72Hz 4:3 HorFreq: 48100 Hz Clock: 50.000 MHz
  800x600@75Hz 4:3 HorFreq: 46900 Hz Clock: 49.500 MHz
  832x624@75Hz 4:3 HorFreq: 49726 Hz Clock: 57.284 MHz
  1024x768@60Hz 4:3 HorFreq: 48400 Hz Clock: 65.000 MHz
  1024x768@70Hz 4:3 HorFreq: 56500 Hz Clock: 75.000 MHz
  1024x768@75Hz 4:3 HorFreq: 60000 Hz Clock: 78.750 MHz
  1280x1024@75Hz 5:4 HorFreq: 80000 Hz Clock: 135.000 MHz
  1152x870@75Hz 192:145 HorFreq: 67500 Hz Clock: 108.000 MHz
Standard timings supported:
  1152x864@75Hz 4:3 HorFreq: 67500 Hz Clock: 108.000 MHz
  1280x800@60Hz 16:10
  1280x720@60Hz 16:9
  1280x1024@60Hz 5:4 HorFreq: 64000 Hz Clock: 108.000 MHz
  1440x900@60Hz 16:10 HorFreq: 55500 Hz Clock: 88.750 MHz
  1600x900@60Hz 16:9
  1680x1050@60Hz 16:10 HorFreq: 64700 Hz Clock: 119.000 MHz
Detailed mode: Clock 297.000 MHz, 608 mm x 345 mm
               3840 4016 4104 4400 hborder 0
               2160 2168 2178 2250 vborder 0
               +hsync +vsync 
               VertFreq: 30 Hz, HorFreq: 67500 Hz
Monitor ranges (GTF): 24-75Hz V, 30-90kHz H, max dotclock 300MHz
Monitor name: U28E590
Serial number: --
Has 1 extension blocks
Checksum: 0xe8 (valid)
