edid-decode (hex):

00 ff ff ff ff ff ff 00 09 e5 9a 05 00 00 00 00
01 14 01 03 80 22 13 78 0a ed 80 9d 5a 55 9c 25
19 50 54 00 00 00 01 01 01 01 01 01 01 01 01 01
01 01 01 01 01 01 41 1c 56 a0 50 00 16 30 30 20
36 00 58 c1 10 00 00 19 00 00 00 0f 00 0a 00 00
00 00 00 00 00 00 00 00 00 20 00 00 00 fe 00 42
4f 45 20 4f 54 0a 20 20 20 20 20 20 00 00 00 fe
00 48 54 31 35 36 57 58 42 2d 35 30 30 0a 00 a4

----------------

Block 0, Base EDID:
  EDID Structure Version & Revision: 1.3
  Vendor & Product Identification:
    Manufacturer: BOE
    Model: 1434
    Made in: week 1 of 2010
  Basic Display Parameters & Features:
    Digital display
    Maximum image size: 34 cm x 19 cm
    Gamma: 2.20
    RGB color display
    First detailed timing is the preferred timing
  Color Characteristics:
    Red  : 0.6162, 0.3535
    Green: 0.3349, 0.6103
    Blue : 0.1464, 0.0976
    White: 0.3125, 0.3281
  Established Timings I & II: none
  Standard Timings: none
  Detailed Timing Descriptors:
    DTD 1:  1366x768    59.998009 Hz 683:384   47.398 kHz     72.330000 MHz (344 mm x 193 mm)
                 Hfront   48 Hsync  32 Hback   80 Hpol N
                 Vfront    3 Vsync   6 Vback   13 Vpol N
    Manufacturer-Specified Display Descriptor (0x0f): 00 0f 00 0a 00 00 00 00 00 00 00 00 00 00 00 20 '............... '
    Alphanumeric Data String: 'BOE OT'
    Alphanumeric Data String: 'HT156WXB-500'
Checksum: 0xa4

----------------

Failures:

Block 0, Base EDID:
  Missing Display Product Name.
  Missing Display Range Limits Descriptor.

EDID conformity: FAIL
