edid-decode (hex):

00 ff ff ff ff ff ff 00 22 f0 22 31 00 00 00 00
31 18 01 04 a5 34 20 78 22 4c a5 a7 55 4d a2 26
10 50 54 21 08 00 b3 00 95 00 81 00 d1 c0 a9 c0
81 c0 a9 40 81 80 28 3c 80 a0 70 b0 23 40 30 20
36 00 06 44 21 00 00 1a 00 00 00 fd 00 32 3c 1f
50 11 00 0a 20 20 20 20 20 20 00 00 00 fc 00 48
50 20 45 32 34 31 69 0a 20 20 20 20 00 00 00 ff
00 43 4e 34 34 34 39 30 51 4a 35 0a 20 20 00 fa

00 ff ff ff ff ff ff 00 22 f0 22 31 00 00 00 00
31 18 01 04 a5 34 20 78 22 4c a5 a7 55 4d a2 26
10 50 54 21 08 00 b3 00 95 00 81 00 d1 c0 a9 c0
81 c0 a9 40 81 80 28 3c 80 a0 70 b0 23 40 30 20
36 00 06 44 21 00 00 1a 00 00 00 fd 00 32 3c 1f
50 11 00 0a 20 20 20 20 20 20 00 00 00 fc 00 48
50 20 45 32 34 31 69 0a 20 20 20 20 00 00 00 ff
00 43 4e 34 34 34 39 30 51 4a 35 0a 20 20 00 fa

----------------

Block 0, Base EDID:
  EDID Structure Version & Revision: 1.4
  Vendor & Product Identification:
    Manufacturer: HWP
    Model: 12578
    Made in: week 49 of 2014
  Basic Display Parameters & Features:
    Digital display
    Bits per primary color channel: 8
    DisplayPort interface
    Maximum image size: 52 cm x 32 cm
    Gamma: 2.20
    DPMS levels: Off
    Supported color formats: RGB 4:4:4
    First detailed timing includes the native pixel format and preferred refresh rate
  Color Characteristics:
    Red  : 0.6533, 0.3320
    Green: 0.3037, 0.6328
    Blue : 0.1503, 0.0644
    White: 0.3134, 0.3291
  Established Timings I & II:
    DMT 0x04:   640x480    59.940476 Hz   4:3     31.469 kHz     25.175000 MHz
    DMT 0x09:   800x600    60.316541 Hz   4:3     37.879 kHz     40.000000 MHz
    DMT 0x10:  1024x768    60.003840 Hz   4:3     48.363 kHz     65.000000 MHz
  Standard Timings:
    DMT 0x3a:  1680x1050   59.954250 Hz  16:10    65.290 kHz    146.250000 MHz
    DMT 0x2f:  1440x900    59.887445 Hz  16:10    55.935 kHz    106.500000 MHz
    DMT 0x1c:  1280x800    59.810326 Hz  16:10    49.702 kHz     83.500000 MHz
    DMT 0x52:  1920x1080   60.000000 Hz  16:9     67.500 kHz    148.500000 MHz
    DMT 0x53:  1600x900    60.000000 Hz  16:9     60.000 kHz    108.000000 MHz (RB)
    DMT 0x55:  1280x720    60.000000 Hz  16:9     45.000 kHz     74.250000 MHz
    DMT 0x33:  1600x1200   60.000000 Hz   4:3     75.000 kHz    162.000000 MHz
    DMT 0x23:  1280x1024   60.019740 Hz   5:4     63.981 kHz    108.000000 MHz
  Detailed Timing Descriptors:
    DTD 1:  1920x1200   59.950171 Hz  16:10    74.038 kHz    154.000000 MHz (518 mm x 324 mm)
                 Hfront   48 Hsync  32 Hback   80 Hpol P
                 Vfront    3 Vsync   6 Vback   26 Vpol N
    Display Range Limits:
      Monitor ranges (GTF): 50-60 Hz V, 31-80 kHz H, max dotclock 170 MHz
    Display Product Name: 'HP E241i'
    Display Product Serial Number: ...
Checksum: 0xfa

----------------

Block 1, Unknown EDID Extension Block 0x00:
  00 ff ff ff ff ff ff 00 22 f0 22 31 00 00 00 00 '........"."1....'
  31 18 01 04 a5 34 20 78 22 4c a5 a7 55 4d a2 26 '1....4 x"L..UM.&'
  10 50 54 21 08 00 b3 00 95 00 81 00 d1 c0 a9 c0 '.PT!............'
  81 c0 a9 40 81 80 28 3c 80 a0 70 b0 23 40 30 20 '...@..(<..p.#@0 '
  36 00 06 44 21 00 00 1a 00 00 00 fd 00 32 3c 1f '6..D!........2<.'
  50 11 00 0a 20 20 20 20 20 20 00 00 00 fc 00 48 'P...      .....H'
  50 20 45 32 34 31 69 0a 20 20 20 20 00 00 00 ff 'P E241i.    ....'
  00 43 4e 34 34 34 39 30 51 4a 35 0a 20 20 00 fa '.CN44490QJ5.  ..'
Checksum: 0xfa

----------------

Warnings:

Block 0, Base EDID:
  Display Range Limits: GTF support is deprecated in EDID 1.4.

Failures:

Block 0, Base EDID:
  Display Range Limits: GTF can't be combined with non-continuous frequencies.
Block 1, Base EDID:
  Unknown Extension Block.
EDID:
  Base EDID: EDID specified 0 extension block(s), but found 1 extension block(s).

EDID conformity: FAIL
