edid-decode (hex):

00 ff ff ff ff ff ff 00 30 ae b2 40 00 00 00 00
01 13 01 03 80 22 13 78 ea 21 35 ad 50 37 aa 24
11 50 54 00 00 00 01 01 01 01 01 01 01 01 01 01
01 01 01 01 01 01 4c 36 80 82 70 38 32 40 3c 30
aa 00 58 c1 10 00 00 18 3f 2d 80 82 70 38 32 40
3c 30 aa 00 58 c1 10 00 00 18 00 00 00 0f 00 d1
09 32 d1 09 28 1b 19 00 06 af 56 34 00 00 00 fe
00 42 31 35 36 48 57 30 31 20 56 34 20 0a 00 d6

----------------

Block 0, Base EDID:
  EDID Structure Version & Revision: 1.3
  Vendor & Product Identification:
    Manufacturer: LEN
    Model: 16562
    Made in: week 1 of 2009
  Basic Display Parameters & Features:
    Digital display
    Maximum image size: 34 cm x 19 cm
    Gamma: 2.20
    DPMS levels: Standby Suspend Off
    RGB color display
    First detailed timing is the preferred timing
  Color Characteristics:
    Red  : 0.6757, 0.3144
    Green: 0.2148, 0.6650
    Blue : 0.1406, 0.0693
    White: 0.3134, 0.3291
  Established Timings I & II: none
  Standard Timings: none
  Detailed Timing Descriptors:
    DTD 1:  1920x1080   60.004317 Hz  16:9     67.805 kHz    139.000000 MHz (344 mm x 193 mm)
                 Hfront   60 Hsync  48 Hback   22 Hpol N
                 Vfront   10 Vsync  10 Vback   30 Vpol N
    DTD 2:  1920x1080   50.002158 Hz  16:9     56.502 kHz    115.830000 MHz (344 mm x 193 mm)
                 Hfront   60 Hsync  48 Hback   22 Hpol N
                 Vfront   10 Vsync  10 Vback   30 Vpol N
    Manufacturer-Specified Display Descriptor (0x0f): 00 0f 00 d1 09 32 d1 09 28 1b 19 00 06 af 56 34 '.....2..(.....V4'
    Alphanumeric Data String: 'B156HW01 V4 '
Checksum: 0xd6

----------------

Failures:

Block 0, Base EDID:
  Alphanumeric Data String: One or more trailing spaces.
  Missing Display Product Name.
  Missing Display Range Limits Descriptor.

EDID conformity: FAIL
