
EDID (hex):
00ffffffffffff005a63380912010101
341d0103805021782a6645aa524ba227
125054bfef80d100d1c0b300a9c09500
8180810081c0e77c70a0d0a029503020
3a001d4d3100001a000000ff00565235
3139353230303031380a000000fd0018
4b0f9620000a202020202020000000fc
005650333438310a202020202020011f
020330f1535a5958575610051f142221
20041312160307012309070783010000
67030c002000003c67d85dc401788000
9f3d70a0d0a0155030203a001d4d3100
001a803e70a0d0d0152030203a001d4d
3100001a3c41b8a060a0295030203a00
1d4d3100001a9e20b8a060d015203020
3a001d4d3100001a00000000000000c8

edid-decode (hex):

00 ff ff ff ff ff ff 00 5a 63 38 09 12 01 01 01
34 1d 01 03 80 50 21 78 2a 66 45 aa 52 4b a2 27
12 50 54 bf ef 80 d1 00 d1 c0 b3 00 a9 c0 95 00
81 80 81 00 81 c0 e7 7c 70 a0 d0 a0 29 50 30 20
3a 00 1d 4d 31 00 00 1a 00 00 00 ff 00 56 52 35
31 39 35 32 30 30 30 31 38 0a 00 00 00 fd 00 18
4b 0f 96 20 00 0a 20 20 20 20 20 20 00 00 00 fc
00 56 50 33 34 38 31 0a 20 20 20 20 20 20 01 1f

02 03 30 f1 53 5a 59 58 57 56 10 05 1f 14 22 21
20 04 13 12 16 03 07 01 23 09 07 07 83 01 00 00
67 03 0c 00 20 00 00 3c 67 d8 5d c4 01 78 80 00
9f 3d 70 a0 d0 a0 15 50 30 20 3a 00 1d 4d 31 00
00 1a 80 3e 70 a0 d0 d0 15 20 30 20 3a 00 1d 4d
31 00 00 1a 3c 41 b8 a0 60 a0 29 50 30 20 3a 00
1d 4d 31 00 00 1a 9e 20 b8 a0 60 d0 15 20 30 20
3a 00 1d 4d 31 00 00 1a 00 00 00 00 00 00 00 c8

----------------

Block 0, Base EDID:
  EDID Structure Version & Revision: 1.3
  Vendor & Product Identification:
    Manufacturer: VSC
    Model: 2360
    Serial Number: 16843026
    Made in: week 52 of 2019
  Basic Display Parameters & Features:
    Digital display
    Maximum image size: 80 cm x 33 cm
    Gamma: 2.20
    DPMS levels: Off
    RGB color display
    First detailed timing is the preferred timing
  Color Characteristics:
    Red  : 0.6650, 0.3222
    Green: 0.2939, 0.6347
    Blue : 0.1533, 0.0703
    White: 0.3134, 0.3291
  Established Timings I & II:
    IBM     :   720x400    70.081663 Hz   9:5     31.467 kHz     28.320000 MHz
    DMT 0x04:   640x480    59.940476 Hz   4:3     31.469 kHz     25.175000 MHz
    Apple   :   640x480    66.666667 Hz   4:3     35.000 kHz     30.240000 MHz
    DMT 0x05:   640x480    72.808802 Hz   4:3     37.861 kHz     31.500000 MHz
    DMT 0x06:   640x480    75.000000 Hz   4:3     37.500 kHz     31.500000 MHz
    DMT 0x08:   800x600    56.250000 Hz   4:3     35.156 kHz     36.000000 MHz
    DMT 0x09:   800x600    60.316541 Hz   4:3     37.879 kHz     40.000000 MHz
    DMT 0x0a:   800x600    72.187572 Hz   4:3     48.077 kHz     50.000000 MHz
    DMT 0x0b:   800x600    75.000000 Hz   4:3     46.875 kHz     49.500000 MHz
    Apple   :   832x624    74.551266 Hz   4:3     49.726 kHz     57.284000 MHz
    DMT 0x10:  1024x768    60.003840 Hz   4:3     48.363 kHz     65.000000 MHz
    DMT 0x11:  1024x768    70.069359 Hz   4:3     56.476 kHz     75.000000 MHz
    DMT 0x12:  1024x768    75.028582 Hz   4:3     60.023 kHz     78.750000 MHz
    DMT 0x24:  1280x1024   75.024675 Hz   5:4     79.976 kHz    135.000000 MHz
    Apple   :  1152x870    75.061550 Hz 192:145   68.681 kHz    100.000000 MHz
  Standard Timings:
    DMT 0x45:  1920x1200   59.884600 Hz  16:10    74.556 kHz    193.250000 MHz
    DMT 0x52:  1920x1080   60.000000 Hz  16:9     67.500 kHz    148.500000 MHz
    DMT 0x3a:  1680x1050   59.954250 Hz  16:10    65.290 kHz    146.250000 MHz
    DMT 0x53:  1600x900    60.000000 Hz  16:9     60.000 kHz    108.000000 MHz (RB)
    DMT 0x2f:  1440x900    59.887445 Hz  16:10    55.935 kHz    106.500000 MHz
    DMT 0x23:  1280x1024   60.019740 Hz   5:4     63.981 kHz    108.000000 MHz
    DMT 0x1c:  1280x800    59.810326 Hz  16:10    49.702 kHz     83.500000 MHz
    DMT 0x55:  1280x720    60.000000 Hz  16:9     45.000 kHz     74.250000 MHz
  Detailed Timing Descriptors:
    DTD 1:  3440x1440   59.972616 Hz  43:18    88.819 kHz    319.750000 MHz (797 mm x 333 mm)
                 Hfront   48 Hsync  32 Hback   80 Hpol P
                 Vfront    3 Vsync  10 Vback   28 Vpol N
    Display Product Serial Number: 'VR5195200018'
    Display Range Limits:
      Monitor ranges (GTF): 24-75 Hz V, 15-150 kHz H, max dotclock 320 MHz
    Display Product Name: 'VP3481'
  Extension blocks: 1
Checksum: 0x1f

----------------

Block 1, CTA-861 Extension Block:
  Revision: 3
  Underscans IT Video Formats by default
  Basic audio support
  Supports YCbCr 4:4:4
  Supports YCbCr 4:2:2
  Native detailed modes: 1
  Video Data Block:
    VIC  90:  2560x1080   60.000000 Hz  64:27    66.000 kHz    198.000000 MHz
    VIC  89:  2560x1080   50.000000 Hz  64:27    56.250 kHz    185.625000 MHz
    VIC  88:  2560x1080   30.000000 Hz  64:27    33.750 kHz    118.800000 MHz
    VIC  87:  2560x1080   25.000000 Hz  64:27    28.125 kHz     90.000000 MHz
    VIC  86:  2560x1080   24.000000 Hz  64:27    26.400 kHz     99.000000 MHz
    VIC  16:  1920x1080   60.000000 Hz  16:9     67.500 kHz    148.500000 MHz
    VIC   5:  1920x1080i  60.000000 Hz  16:9     33.750 kHz     74.250000 MHz
    VIC  31:  1920x1080   50.000000 Hz  16:9     56.250 kHz    148.500000 MHz
    VIC  20:  1920x1080i  50.000000 Hz  16:9     28.125 kHz     74.250000 MHz
    VIC  34:  1920x1080   30.000000 Hz  16:9     33.750 kHz     74.250000 MHz
    VIC  33:  1920x1080   25.000000 Hz  16:9     28.125 kHz     74.250000 MHz
    VIC  32:  1920x1080   24.000000 Hz  16:9     27.000 kHz     74.250000 MHz
    VIC   4:  1280x720    60.000000 Hz  16:9     45.000 kHz     74.250000 MHz
    VIC  19:  1280x720    50.000000 Hz  16:9     37.500 kHz     74.250000 MHz
    VIC  18:   720x576    50.000000 Hz  16:9     31.250 kHz     27.000000 MHz
    VIC  22:  1440x576i   50.000000 Hz  16:9     15.625 kHz     27.000000 MHz
    VIC   3:   720x480    59.940060 Hz  16:9     31.469 kHz     27.000000 MHz
    VIC   7:  1440x480i   59.940060 Hz  16:9     15.734 kHz     27.000000 MHz
    VIC   1:   640x480    59.940476 Hz   4:3     31.469 kHz     25.175000 MHz
  Audio Data Block:
    Linear PCM:
      Max channels: 2
      Supported sample rates (kHz): 48 44.1 32
      Supported sample sizes (bits): 24 20 16
  Speaker Allocation Data Block:
    FL/FR - Front Left/Right
  Vendor-Specific Data Block (HDMI), OUI 00-0C-03:
    Source physical address: 2.0.0.0
    Maximum TMDS clock: 300 MHz
  Vendor-Specific Data Block (HDMI Forum), OUI C4-5D-D8:
    Version: 1
    Maximum TMDS Character Rate: 600 MHz
    SCDC Present
  Detailed Timing Descriptors:
    DTD 2:  3440x1440   29.992775 Hz  43:18    43.819 kHz    157.750000 MHz (797 mm x 333 mm)
                 Hfront   48 Hsync  32 Hback   80 Hpol P
                 Vfront    3 Vsync  10 Vback    8 Vpol N
    DTD 3:  3440x720    59.979007 Hz  43:9     44.444 kHz    160.000000 MHz (797 mm x 333 mm)
                 Hfront   48 Hsync  32 Hback   80 Hpol P
                 Vfront    3 Vsync  10 Vback    8 Vpol N
    DTD 4:  1720x1440   59.979600 Hz  43:36    88.830 kHz    167.000000 MHz (797 mm x 333 mm)
                 Hfront   48 Hsync  32 Hback   80 Hpol P
                 Vfront    3 Vsync  10 Vback   28 Vpol N
    DTD 5:  1720x720    59.939128 Hz  43:18    44.415 kHz     83.500000 MHz (797 mm x 333 mm)
                 Hfront   48 Hsync  32 Hback   80 Hpol P
                 Vfront    3 Vsync  10 Vback    8 Vpol N
Checksum: 0xc8  Unused space in Extension Block: 7 bytes
