
EDID (hex):
00ffffffffffff0022f0793200000000
0a1a0104a5331d7822c075a756529b26
0f5054210800d1c0a9c081c0b3009500
810081800101023a801871382d40582c
4500fd1e1100001e000000fd00323c1e
5011010a202020202020000000fc0048
5020453233320a2020202020000000ff
00434e34363130313830380a20200007

Extracted contents:
header:          00 ff ff ff ff ff ff 00
serial number:   22 f0 79 32 00 00 00 00 0a 1a
version:         01 04
basic params:    a5 33 1d 78 22
chroma info:     c0 75 a7 56 52 9b 26 0f 50 54
established:     21 08 00
standard:        d1 c0 a9 c0 81 c0 b3 00 95 00 81 00 81 80 01 01
descriptor 1:    02 3a 80 18 71 38 2d 40 58 2c 45 00 fd 1e 11 00 00 1e
descriptor 2:    00 00 00 fd 00 32 3c 1e 50 11 01 0a 20 20 20 20 20 20
descriptor 3:    00 00 00 fc 00 48 50 20 45 32 33 32 0a 20 20 20 20 20
descriptor 4:    00 00 00 ff 00 43 4e 34 36 31 30 31 38 30 38 0a 20 20
extensions:      00
checksum:        07

EDID version: 1.4
Manufacturer: HWP Model 3279 Serial Number --
Made in week 10 of 2016
Digital display
8 bits per primary color channel
DisplayPort interface
Maximum image size: 51 cm x 29 cm
Gamma: 2.20
DPMS levels: Off
Supported color formats: RGB 4:4:4
First detailed timing includes the native pixel format and preferred refresh rate
Display x,y Chromaticity:
  Red:   0.6552, 0.3359
  Green: 0.3203, 0.6054
  Blue:  0.1494, 0.0615
  White: 0.3134, 0.3291
Established timings supported:
  640x480@60Hz 4:3 HorFreq: 31469 Hz Clock: 25.175 MHz
  800x600@60Hz 4:3 HorFreq: 37900 Hz Clock: 40.000 MHz
  1024x768@60Hz 4:3 HorFreq: 48400 Hz Clock: 65.000 MHz
Standard timings supported:
  1920x1080@60Hz 16:9
  1600x900@60Hz 16:9
  1280x720@60Hz 16:9
  1680x1050@60Hz 16:10 HorFreq: 64700 Hz Clock: 119.000 MHz
  1440x900@60Hz 16:10 HorFreq: 55500 Hz Clock: 88.750 MHz
  1280x800@60Hz 16:10
  1280x1024@60Hz 5:4 HorFreq: 64000 Hz Clock: 108.000 MHz
Detailed mode: Clock 148.500 MHz, 509 mm x 286 mm
               1920 2008 2052 2200 hborder 0
               1080 1084 1089 1125 vborder 0
               +hsync +vsync 
               VertFreq: 60 Hz, HorFreq: 67500 Hz
Monitor ranges (bare limits): 50-60Hz V, 30-80kHz H, max dotclock 170MHz
Monitor name: HP E232
Serial number: --
Checksum: 0x7 (valid)
