edid-decode (hex):

00 ff ff ff ff ff ff 00 4c 2d 26 75 00 0e 00 01
01 22 01 03 80 79 44 78 0a c7 f1 b2 4c 3a bb 24
0b 50 54 bd ef 80 71 4f 81 c0 81 00 81 80 95 00
a9 c0 b3 00 d1 c0 04 74 00 30 f2 70 5a 80 b0 58
8a 00 50 1d 74 00 00 1e 40 d1 00 80 f0 70 5a 80
20 18 8a 00 98 1d 64 00 00 1a 00 00 00 fd 00 18
78 0f ff 3c 00 0a 20 20 20 20 20 20 00 00 00 fc
00 53 39 35 44 0a 20 20 20 20 20 20 20 20 01 ac

02 03 3f f4 53 60 65 90 1f 04 13 20 21 22 5d 5e
5f 62 64 03 12 3f 40 4e 23 09 57 07 83 01 00 00
e2 00 4f e3 05 c3 01 e3 06 0d 01 67 03 0c 00 10
00 98 3c 67 d8 5d c4 01 78 80 00 e3 0e 61 66 40
d1 00 80 f0 70 5a 80 20 18 8a 00 98 1d 64 00 00
1a 02 3a 80 18 71 38 2d 40 58 2c 45 00 50 1d 74
00 00 1e 56 5e 00 a0 a0 a0 29 50 30 20 35 00 50
1d 74 00 00 1a 00 00 00 00 00 00 00 00 00 00 79

00 ff ff ff ff ff ff 00 4c 2d 26 75 00 0e 00 01
01 22 01 03 80 79 44 78 0a c7 f1 b2 4c 3a bb 24
0b 50 54 bd ef 80 71 4f 81 c0 81 00 81 80 95 00
a9 c0 b3 00 d1 c0 04 74 00 30 f2 70 5a 80 b0 58
8a 00 50 1d 74 00 00 1e 40 d1 00 80 f0 70 5a 80
20 18 8a 00 98 1d 64 00 00 1a 00 00 00 fd 00 18
78 0f ff 3c 00 0a 20 20 20 20 20 20 00 00 00 fc
00 53 39 35 44 0a 20 20 20 20 20 20 20 20 01 ac

02 03 3f f4 53 60 65 90 1f 04 13 20 21 22 5d 5e
5f 62 64 03 12 3f 40 4e 23 09 57 07 83 01 00 00
e2 00 4f e3 05 c3 01 e3 06 0d 01 67 03 0c 00 10
00 98 3c 67 d8 5d c4 01 78 80 00 e3 0e 61 66 40
d1 00 80 f0 70 5a 80 20 18 8a 00 98 1d 64 00 00
1a 02 3a 80 18 71 38 2d 40 58 2c 45 00 50 1d 74
00 00 1e 56 5e 00 a0 a0 a0 29 50 30 20 35 00 50
1d 74 00 00 1a 00 00 00 00 00 00 00 00 00 00 79

----------------

Block 0, Base EDID:
  EDID Structure Version & Revision: 1.3
  Vendor & Product Identification:
    Manufacturer: SAM
    Model: 29990
    Serial Number: ...
    Made in: week 1 of 2024
  Basic Display Parameters & Features:
    Digital display
    Maximum image size: 121 cm x 68 cm
    Gamma: 2.20
    RGB color display
    First detailed timing is the preferred timing
  Color Characteristics:
    Red  : 0.6982, 0.2968
    Green: 0.2275, 0.7333
    Blue : 0.1435, 0.0458
    White: 0.3125, 0.3291
  Established Timings I & II:
    IBM     :   720x400    70.081663 Hz   9:5     31.467 kHz     28.320000 MHz
    DMT 0x04:   640x480    59.940476 Hz   4:3     31.469 kHz     25.175000 MHz
    Apple   :   640x480    66.666667 Hz   4:3     35.000 kHz     30.240000 MHz
    DMT 0x05:   640x480    72.808802 Hz   4:3     37.861 kHz     31.500000 MHz
    DMT 0x06:   640x480    75.000000 Hz   4:3     37.500 kHz     31.500000 MHz
    DMT 0x09:   800x600    60.316541 Hz   4:3     37.879 kHz     40.000000 MHz
    DMT 0x0a:   800x600    72.187572 Hz   4:3     48.077 kHz     50.000000 MHz
    DMT 0x0b:   800x600    75.000000 Hz   4:3     46.875 kHz     49.500000 MHz
    Apple   :   832x624    74.551266 Hz   4:3     49.726 kHz     57.284000 MHz
    DMT 0x10:  1024x768    60.003840 Hz   4:3     48.363 kHz     65.000000 MHz
    DMT 0x11:  1024x768    70.069359 Hz   4:3     56.476 kHz     75.000000 MHz
    DMT 0x12:  1024x768    75.028582 Hz   4:3     60.023 kHz     78.750000 MHz
    DMT 0x24:  1280x1024   75.024675 Hz   5:4     79.976 kHz    135.000000 MHz
    Apple   :  1152x870    75.061550 Hz 192:145   68.681 kHz    100.000000 MHz
  Standard Timings:
    DMT 0x15:  1152x864    75.000000 Hz   4:3     67.500 kHz    108.000000 MHz
    DMT 0x55:  1280x720    60.000000 Hz  16:9     45.000 kHz     74.250000 MHz
    DMT 0x1c:  1280x800    59.810326 Hz  16:10    49.702 kHz     83.500000 MHz
    DMT 0x23:  1280x1024   60.019740 Hz   5:4     63.981 kHz    108.000000 MHz
    DMT 0x2f:  1440x900    59.887445 Hz  16:10    55.935 kHz    106.500000 MHz
    DMT 0x53:  1600x900    60.000000 Hz  16:9     60.000 kHz    108.000000 MHz (RB)
    DMT 0x3a:  1680x1050   59.954250 Hz  16:10    65.290 kHz    146.250000 MHz
    DMT 0x52:  1920x1080   60.000000 Hz  16:9     67.500 kHz    148.500000 MHz
  Detailed Timing Descriptors:
    DTD 1:  3840x2160   30.000000 Hz  16:9     67.500 kHz    297.000000 MHz (1872 mm x 1053 mm)
                 Hfront  176 Hsync  88 Hback  296 Hpol P
                 Vfront    8 Vsync  10 Vback   72 Vpol P
    DTD 2:  3840x2160   60.000000 Hz  16:9    135.000 kHz    535.680000 MHz (1688 mm x 1053 mm)
                 Hfront   32 Hsync  24 Hback   72 Hpol P
                 Vfront    8 Vsync  10 Vback   72 Vpol N
    Display Range Limits:
      Monitor ranges (GTF): 24-120 Hz V, 15-255 kHz H, max dotclock 600 MHz
    Display Product Name: 'S95D'
  Extension blocks: 1
Checksum: 0xac

----------------

Block 1, CTA-861 Extension Block:
  Revision: 3
  Underscans IT Video Formats by default
  Basic audio support
  Supports YCbCr 4:4:4
  Supports YCbCr 4:2:2
  Native detailed modes: 4
  Video Data Block:
    VIC  96:  3840x2160   50.000000 Hz  16:9    112.500 kHz    594.000000 MHz
    VIC 101:  4096x2160   50.000000 Hz 256:135  112.500 kHz    594.000000 MHz
    VIC  16:  1920x1080   60.000000 Hz  16:9     67.500 kHz    148.500000 MHz (native)
    VIC  31:  1920x1080   50.000000 Hz  16:9     56.250 kHz    148.500000 MHz
    VIC   4:  1280x720    60.000000 Hz  16:9     45.000 kHz     74.250000 MHz
    VIC  19:  1280x720    50.000000 Hz  16:9     37.500 kHz     74.250000 MHz
    VIC  32:  1920x1080   24.000000 Hz  16:9     27.000 kHz     74.250000 MHz
    VIC  33:  1920x1080   25.000000 Hz  16:9     28.125 kHz     74.250000 MHz
    VIC  34:  1920x1080   30.000000 Hz  16:9     33.750 kHz     74.250000 MHz
    VIC  93:  3840x2160   24.000000 Hz  16:9     54.000 kHz    297.000000 MHz
    VIC  94:  3840x2160   25.000000 Hz  16:9     56.250 kHz    297.000000 MHz
    VIC  95:  3840x2160   30.000000 Hz  16:9     67.500 kHz    297.000000 MHz
    VIC  98:  4096x2160   24.000000 Hz 256:135   54.000 kHz    297.000000 MHz
    VIC 100:  4096x2160   30.000000 Hz 256:135   67.500 kHz    297.000000 MHz
    VIC   3:   720x480    59.940060 Hz  16:9     31.469 kHz     27.000000 MHz
    VIC  18:   720x576    50.000000 Hz  16:9     31.250 kHz     27.000000 MHz
    VIC  63:  1920x1080  120.000000 Hz  16:9    135.000 kHz    297.000000 MHz
    VIC  64:  1920x1080  100.000000 Hz  16:9    112.500 kHz    297.000000 MHz
    VIC  78:  1920x1080  120.000000 Hz  64:27   135.000 kHz    297.000000 MHz
  Audio Data Block:
    Linear PCM:
      Max channels: 2
      Supported sample rates (kHz): 192 96 48 44.1 32
      Supported sample sizes (bits): 24 20 16
  Speaker Allocation Data Block:
    FL/FR - Front Left/Right
  Video Capability Data Block:
    YCbCr quantization: No Data
    RGB quantization: Selectable (via AVI Q)
    PT scan behavior: No Data
    IT scan behavior: Supports both over- and underscan
    CE scan behavior: Supports both over- and underscan
  Colorimetry Data Block:
    xvYCC601
    xvYCC709
    BT2020YCC
    BT2020RGB
    Gamut Boundary Description Metadata Profile P0
  HDR Static Metadata Data Block:
    Electro optical transfer functions:
      Traditional gamma - SDR luminance range
      SMPTE ST2084
      Hybrid Log-Gamma
    Supported static metadata descriptors:
      Static metadata type 1
  Vendor-Specific Data Block (HDMI), OUI 00-0C-03:
    Source physical address: 1.0.0.0
    Supports_AI
    DC_30bit
    DC_Y444
    Maximum TMDS clock: 300 MHz
  Vendor-Specific Data Block (HDMI Forum), OUI C4-5D-D8:
    Version: 1
    Maximum TMDS Character Rate: 600 MHz
    SCDC Present
  YCbCr 4:2:0 Video Data Block:
    VIC  97:  3840x2160   60.000000 Hz  16:9    135.000 kHz    594.000000 MHz
    VIC 102:  4096x2160   60.000000 Hz 256:135  135.000 kHz    594.000000 MHz
  Detailed Timing Descriptors:
    DTD 3:  3840x2160   60.000000 Hz  16:9    135.000 kHz    535.680000 MHz (1688 mm x 1053 mm)
                 Hfront   32 Hsync  24 Hback   72 Hpol P
                 Vfront    8 Vsync  10 Vback   72 Vpol N
    DTD 4:  1920x1080   60.000000 Hz  16:9     67.500 kHz    148.500000 MHz (1872 mm x 1053 mm)
                 Hfront   88 Hsync  44 Hback  148 Hpol P
                 Vfront    4 Vsync   5 Vback   36 Vpol P
    DTD 5:  2560x1440   59.950550 Hz  16:9     88.787 kHz    241.500000 MHz (1872 mm x 1053 mm)
                 Hfront   48 Hsync  32 Hback   80 Hpol P
                 Vfront    3 Vsync   5 Vback   33 Vpol N
Checksum: 0x79  Unused space in Extension Block: 10 bytes

----------------

Block 2, Unknown EDID Extension Block 0x00:
  00 ff ff ff ff ff ff 00 4c 2d 26 75 00 0e 00 01 '........L-&u....'
  01 22 01 03 80 79 44 78 0a c7 f1 b2 4c 3a bb 24 '."...yDx....L:.$'
  0b 50 54 bd ef 80 71 4f 81 c0 81 00 81 80 95 00 '.PT...qO........'
  a9 c0 b3 00 d1 c0 04 74 00 30 f2 70 5a 80 b0 58 '.......t.0.pZ..X'
  8a 00 50 1d 74 00 00 1e 40 d1 00 80 f0 70 5a 80 '..P.t...@....pZ.'
  20 18 8a 00 98 1d 64 00 00 1a 00 00 00 fd 00 18 ' .....d.........'
  78 0f ff 3c 00 0a 20 20 20 20 20 20 00 00 00 fc 'x..<..      ....'
  00 53 39 35 44 0a 20 20 20 20 20 20 20 20 01 ac '.S95D.        ..'
Checksum: 0xac

----------------

Block 3, CTA-861 Extension Block:
  Revision: 3
  Underscans IT Video Formats by default
  Basic audio support
  Supports YCbCr 4:4:4
  Supports YCbCr 4:2:2
  Native detailed modes: 4
  Video Data Block:
    VIC  96:  3840x2160   50.000000 Hz  16:9    112.500 kHz    594.000000 MHz
    VIC 101:  4096x2160   50.000000 Hz 256:135  112.500 kHz    594.000000 MHz
    VIC  16:  1920x1080   60.000000 Hz  16:9     67.500 kHz    148.500000 MHz (native)
    VIC  31:  1920x1080   50.000000 Hz  16:9     56.250 kHz    148.500000 MHz
    VIC   4:  1280x720    60.000000 Hz  16:9     45.000 kHz     74.250000 MHz
    VIC  19:  1280x720    50.000000 Hz  16:9     37.500 kHz     74.250000 MHz
    VIC  32:  1920x1080   24.000000 Hz  16:9     27.000 kHz     74.250000 MHz
    VIC  33:  1920x1080   25.000000 Hz  16:9     28.125 kHz     74.250000 MHz
    VIC  34:  1920x1080   30.000000 Hz  16:9     33.750 kHz     74.250000 MHz
    VIC  93:  3840x2160   24.000000 Hz  16:9     54.000 kHz    297.000000 MHz
    VIC  94:  3840x2160   25.000000 Hz  16:9     56.250 kHz    297.000000 MHz
    VIC  95:  3840x2160   30.000000 Hz  16:9     67.500 kHz    297.000000 MHz
    VIC  98:  4096x2160   24.000000 Hz 256:135   54.000 kHz    297.000000 MHz
    VIC 100:  4096x2160   30.000000 Hz 256:135   67.500 kHz    297.000000 MHz
    VIC   3:   720x480    59.940060 Hz  16:9     31.469 kHz     27.000000 MHz
    VIC  18:   720x576    50.000000 Hz  16:9     31.250 kHz     27.000000 MHz
    VIC  63:  1920x1080  120.000000 Hz  16:9    135.000 kHz    297.000000 MHz
    VIC  64:  1920x1080  100.000000 Hz  16:9    112.500 kHz    297.000000 MHz
    VIC  78:  1920x1080  120.000000 Hz  64:27   135.000 kHz    297.000000 MHz
  Audio Data Block:
    Linear PCM:
      Max channels: 2
      Supported sample rates (kHz): 192 96 48 44.1 32
      Supported sample sizes (bits): 24 20 16
  Speaker Allocation Data Block:
    FL/FR - Front Left/Right
  Video Capability Data Block:
    YCbCr quantization: No Data
    RGB quantization: Selectable (via AVI Q)
    PT scan behavior: No Data
    IT scan behavior: Supports both over- and underscan
    CE scan behavior: Supports both over- and underscan
  Colorimetry Data Block:
    xvYCC601
    xvYCC709
    BT2020YCC
    BT2020RGB
    Gamut Boundary Description Metadata Profile P0
  HDR Static Metadata Data Block:
    Electro optical transfer functions:
      Traditional gamma - SDR luminance range
      SMPTE ST2084
      Hybrid Log-Gamma
    Supported static metadata descriptors:
      Static metadata type 1
  Vendor-Specific Data Block (HDMI), OUI 00-0C-03:
    Source physical address: 1.0.0.0
    Supports_AI
    DC_30bit
    DC_Y444
    Maximum TMDS clock: 300 MHz
  Vendor-Specific Data Block (HDMI Forum), OUI C4-5D-D8:
    Version: 1
    Maximum TMDS Character Rate: 600 MHz
    SCDC Present
  YCbCr 4:2:0 Video Data Block:
    VIC  97:  3840x2160   60.000000 Hz  16:9    135.000 kHz    594.000000 MHz
    VIC 102:  4096x2160   60.000000 Hz 256:135  135.000 kHz    594.000000 MHz
  Detailed Timing Descriptors:
    DTD 6:  3840x2160   60.000000 Hz  16:9    135.000 kHz    535.680000 MHz (1688 mm x 1053 mm)
                 Hfront   32 Hsync  24 Hback   72 Hpol P
                 Vfront    8 Vsync  10 Vback   72 Vpol N
    DTD 7:  1920x1080   60.000000 Hz  16:9     67.500 kHz    148.500000 MHz (1872 mm x 1053 mm)
                 Hfront   88 Hsync  44 Hback  148 Hpol P
                 Vfront    4 Vsync   5 Vback   36 Vpol P
    DTD 8:  2560x1440   59.950550 Hz  16:9     88.787 kHz    241.500000 MHz (1872 mm x 1053 mm)
                 Hfront   48 Hsync  32 Hback   80 Hpol P
                 Vfront    3 Vsync   5 Vback   33 Vpol N
Checksum: 0x79  Unused space in Extension Block: 10 bytes

----------------

Warnings:

Block 1, CTA-861 Extension Block:
  Video Capability Data Block: Set Selectable YCbCr Quantization to avoid interop issues.
  Colorimetry Data Block: Set the sRGB colorimetry bit to avoid interop issues.
Block 3, CTA-861 Extension Block:
  Video Capability Data Block: Set Selectable YCbCr Quantization to avoid interop issues.
  Colorimetry Data Block: Set the sRGB colorimetry bit to avoid interop issues.

Failures:

Block 0, Base EDID:
  Detailed Timing Descriptor #1: Mismatch of image size 1872x1053 mm vs display size 1210x680 mm.
  Detailed Timing Descriptor #2: Mismatch of image size 1688x1053 mm vs display size 1210x680 mm.
Block 1, CTA-861 Extension Block:
  Detailed Timing Descriptor #3: Mismatch of image size 1688x1053 mm vs display size 1210x680 mm.
  Detailed Timing Descriptor #4: Mismatch of image size 1872x1053 mm vs display size 1210x680 mm.
  Detailed Timing Descriptor #5: Mismatch of image size 1872x1053 mm vs display size 1210x680 mm.
Block 2, Base EDID:
  Unknown Extension Block.
Block 3, CTA-861 Extension Block:
  Video Data Block: Duplicate VIC 96.
  Video Data Block: Duplicate VIC 101.
  Video Data Block: Duplicate VIC 16.
  Video Data Block: Duplicate VIC 31.
  Video Data Block: Duplicate VIC 4.
  Video Data Block: Duplicate VIC 19.
  Video Data Block: Duplicate VIC 32.
  Video Data Block: Duplicate VIC 33.
  Video Data Block: Duplicate VIC 34.
  Video Data Block: Duplicate VIC 93.
  Video Data Block: Duplicate VIC 94.
  Video Data Block: Duplicate VIC 95.
  Video Data Block: Duplicate VIC 98.
  Video Data Block: Duplicate VIC 100.
  Video Data Block: Duplicate VIC 3.
  Video Data Block: Duplicate VIC 18.
  Video Data Block: Duplicate VIC 63.
  Video Data Block: Duplicate VIC 64.
  Video Data Block: Duplicate VIC 78.
  Speaker Allocation Data Block: Only one instance of this Data Block is allowed.
  Video Capability Data Block: Only one instance of this Data Block is allowed.
  Colorimetry Data Block: Only one instance of this Data Block is allowed.
  HDR Static Metadata Data Block: Only one instance of this Data Block is allowed.
  Vendor-Specific Data Block (HDMI Forum), OUI C4-5D-D8: Duplicate HDMI Forum VSDB/SCDB.
  YCbCr 4:2:0 Video Data Block: Duplicate YCbCr 4:2:0 VIC 97.
  YCbCr 4:2:0 Video Data Block: Duplicate YCbCr 4:2:0 VIC 102.
  Detailed Timing Descriptor #6: Mismatch of image size 1688x1053 mm vs display size 1210x680 mm.
  Detailed Timing Descriptor #7: Mismatch of image size 1872x1053 mm vs display size 1210x680 mm.
  Detailed Timing Descriptor #8: Mismatch of image size 1872x1053 mm vs display size 1210x680 mm.
EDID:
  Base EDID: The DTD max image size is 1872x1053mm, which is larger than the display size 1210.0x680.0mm.
  Base EDID: EDID specified 1 extension block(s), but found 3 extension block(s).
  Base EDID: EDID 1.3 requires a Block Map Extension in Block 1 if there are more than 2 blocks in the EDID.
  CTA-861: Native progressive timings are a mix of several resolutions.

EDID conformity: FAIL
