edid-decode (hex):

00 ff ff ff ff ff ff 00 09 e5 f0 09 00 00 00 00
23 1d 01 04 95 1f 11 78 03 1e f5 96 5d 5b 91 29
1c 50 54 00 00 00 01 01 01 01 01 01 01 01 01 01
01 01 01 01 01 01 72 39 80 e6 70 38 3c 40 30 20
36 00 35 ae 10 00 00 1a 4c 26 80 e6 70 38 3c 40
30 20 36 00 35 ae 10 00 00 1a 00 00 00 00 00 00
00 00 00 00 00 00 00 00 00 00 00 00 00 00 00 02
00 0d 40 ff 0a 3c 7d 11 0b 17 7d 00 00 00 00 97

----------------

Block 0, Base EDID:
  EDID Structure Version & Revision: 1.4
  Vendor & Product Identification:
    Manufacturer: BOE
    Model: 2544
    Made in: week 35 of 2019
  Basic Display Parameters & Features:
    Digital display
    Bits per primary color channel: 6
    DisplayPort interface
    Maximum image size: 31 cm x 17 cm
    Gamma: 2.20
    Supported color formats: RGB 4:4:4
    First detailed timing includes the native pixel format and preferred refresh rate
    Display is continuous frequency
  Color Characteristics:
    Red  : 0.5859, 0.3642
    Green: 0.3583, 0.5683
    Blue : 0.1630, 0.1123
    White: 0.3134, 0.3291
  Established Timings I & II: none
  Standard Timings: none
  Detailed Timing Descriptors:
    DTD 1:  1920x1080   60.000000 Hz  16:9     68.400 kHz    147.060000 MHz (309 mm x 174 mm)
                 Hfront   48 Hsync  32 Hback  150 Hpol P
                 Vfront    3 Vsync   6 Vback   51 Vpol N
    DTD 2:  1920x1080   40.000000 Hz  16:9     45.600 kHz     98.040000 MHz (309 mm x 174 mm)
                 Hfront   48 Hsync  32 Hback  150 Hpol P
                 Vfront    3 Vsync   6 Vback   51 Vpol N
    Empty Descriptor
    Manufacturer-Specified Display Descriptor (0x02): 00 02 00 0d 40 ff 0a 3c 7d 11 0b 17 7d 00 00 00 '....@..<}...}...'
Checksum: 0x97

----------------

Failures:

Block 0, Base EDID:
  Empty Descriptor: Use Dummy Descriptor instead of all zeroes.
  Missing Display Product Name.
  Missing Display Range Limits Descriptor.

EDID conformity: FAIL
