
EDID (hex):
00ffffffffffff0004723c05b9b67064
2f1a010380351e782a2ef5a557509e26
105054b30c00d1c0b300950081808100
81c0714f0101023a801871382d40582c
4500132b2100001e000000fd00374c1e
5311000a202020202020000000ff0054
36524545303031343230300a000000fc
0041636572204b413234310a20200080

Extracted contents:
header:          00 ff ff ff ff ff ff 00
serial number:   04 72 3c 05 b9 b6 70 64 2f 1a
version:         01 03
basic params:    80 35 1e 78 2a
chroma info:     2e f5 a5 57 50 9e 26 10 50 54
established:     b3 0c 00
standard:        d1 c0 b3 00 95 00 81 80 81 00 81 c0 71 4f 01 01
descriptor 1:    02 3a 80 18 71 38 2d 40 58 2c 45 00 13 2b 21 00 00 1e
descriptor 2:    00 00 00 fd 00 37 4c 1e 53 11 00 0a 20 20 20 20 20 20
descriptor 3:    00 00 00 ff 00 54 36 52 45 45 30 30 31 34 32 30 30 0a
descriptor 4:    00 00 00 fc 00 41 63 65 72 20 4b 41 32 34 31 0a 20 20
extensions:      00
checksum:        80

EDID version: 1.3
Manufacturer: ACR Model 53c Serial Number --
Made in week 47 of 2016
Digital display
Maximum image size: 53 cm x 30 cm
Gamma: 2.20
DPMS levels: Off
RGB color display
First detailed timing is preferred timing
Display x,y Chromaticity:
  Red:   0.6445, 0.3417
  Green: 0.3154, 0.6191
  Blue:  0.1513, 0.0654
  White: 0.3134, 0.3291
Established timings supported:
  720x400@70Hz 9:5 HorFreq: 31469 Hz Clock: 28.320 MHz
  640x480@60Hz 4:3 HorFreq: 31469 Hz Clock: 25.175 MHz
  640x480@67Hz 4:3 HorFreq: 35000 Hz Clock: 30.240 MHz
  800x600@56Hz 4:3 HorFreq: 35200 Hz Clock: 36.000 MHz
  800x600@60Hz 4:3 HorFreq: 37900 Hz Clock: 40.000 MHz
  1024x768@60Hz 4:3 HorFreq: 48400 Hz Clock: 65.000 MHz
  1024x768@70Hz 4:3 HorFreq: 56500 Hz Clock: 75.000 MHz
Standard timings supported:
  1920x1080@60Hz 16:9
  1680x1050@60Hz 16:10 HorFreq: 64700 Hz Clock: 119.000 MHz
  1440x900@60Hz 16:10 HorFreq: 55500 Hz Clock: 88.750 MHz
  1280x1024@60Hz 5:4 HorFreq: 64000 Hz Clock: 108.000 MHz
  1280x800@60Hz 16:10
  1280x720@60Hz 16:9
  1152x864@75Hz 4:3 HorFreq: 67500 Hz Clock: 108.000 MHz
Detailed mode: Clock 148.500 MHz, 531 mm x 299 mm
               1920 2008 2052 2200 hborder 0
               1080 1084 1089 1125 vborder 0
               +hsync +vsync 
               VertFreq: 60 Hz, HorFreq: 67500 Hz
Monitor ranges (GTF): 55-76Hz V, 30-83kHz H, max dotclock 170MHz
Serial number: --
Monitor name: Acer KA241
Checksum: 0x80 (valid)
