edid-decode (hex):

00 ff ff ff ff ff ff 00 06 af 87 33 00 00 00 00
01 0f 01 03 80 25 17 78 0a 6d f2 9c 59 4c 8f 23
23 52 54 00 00 00 01 01 01 01 01 01 01 01 01 01
01 01 01 01 01 01 9e 25 a0 40 51 84 0c 30 40 20
33 00 6f e6 10 00 00 18 00 00 00 0f 00 00 00 00
00 00 00 00 00 00 00 00 00 20 00 00 00 fe 00 41
55 4f 0a 20 20 20 20 20 20 20 20 20 00 00 00 fe
00 42 31 37 30 50 57 30 33 20 56 33 20 0a 00 65

----------------

Block 0, Base EDID:
  EDID Structure Version & Revision: 1.3
  Vendor & Product Identification:
    Manufacturer: AUO
    Model: 13191
    Made in: week 1 of 2005
  Basic Display Parameters & Features:
    Digital display
    Maximum image size: 37 cm x 23 cm
    Gamma: 2.20
    RGB color display
    First detailed timing is the preferred timing
  Color Characteristics:
    Red  : 0.6103, 0.3496
    Green: 0.2998, 0.5595
    Blue : 0.1396, 0.1396
    White: 0.3203, 0.3300
  Established Timings I & II: none
  Standard Timings: none
  Detailed Timing Descriptors:
    DTD 1:  1440x900    59.996 Hz   8:5    54.716 kHz  96.300 MHz (367 mm x 230 mm)
                 Hfront   64 Hsync  32 Hback 224 Hpol N
                 Vfront    3 Vsync   3 Vback   6 Vpol N
    Manufacturer-Specified Display Descriptor (0x0f): 00 0f 00 00 00 00 00 00 00 00 00 00 00 00 00 20 '............... '
    Alphanumeric Data String: 'AUO'
    Alphanumeric Data String: 'B170PW03 V3 '
Checksum: 0x65

----------------

Failures:

Block 0, Base EDID:
  Alphanumeric Data String: One or more trailing spaces.
  Missing Display Product Name.
  Missing Display Range Limits Descriptor.

EDID conformity: FAIL
