edid-decode (hex):

00 ff ff ff ff ff ff 00 04 72 e3 02 b3 eb 00 25
32 16 01 03 68 2f 1e 78 2e cf 75 a4 57 4e 9e 27
10 50 54 bf ee 80 71 4f 81 40 81 c0 81 00 95 00
b3 00 01 01 01 01 21 39 90 30 62 1a 27 40 68 b0
36 00 da 28 11 00 00 1c 00 00 00 fd 00 32 4c 1e
53 10 00 0a 20 20 20 20 20 20 00 00 00 ff 00 4c
57 35 41 41 30 30 31 34 32 30 34 0a 00 00 00 fc
00 41 63 65 72 20 56 32 32 35 57 4c 0a 20 00 2e

00 ff ff ff ff ff ff 00 04 72 e3 02 b3 eb 00 25
32 16 01 03 68 2f 1e 78 2e cf 75 a4 57 4e 9e 27
10 50 54 bf ee 80 71 4f 81 40 81 c0 81 00 95 00
b3 00 01 01 01 01 21 39 90 30 62 1a 27 40 68 b0
36 00 da 28 11 00 00 1c 00 00 00 fd 00 32 4c 1e
53 10 00 0a 20 20 20 20 20 20 00 00 00 ff 00 4c
57 35 41 41 30 30 31 34 32 30 34 0a 00 00 00 fc
00 41 63 65 72 20 56 32 32 35 57 4c 0a 20 00 2e

----------------

Block 0, Base EDID:
  EDID Structure Version & Revision: 1.3
  Vendor & Product Identification:
    Manufacturer: ACR
    Model: 739
    Serial Number: ...
    Made in: week 50 of 2012
  Basic Display Parameters & Features:
    Analog display
    Signal Level Standard: 0.700 : 0.000 : 0.700 V p-p
    Blank level equals black level
    Sync: Separate
    Maximum image size: 47 cm x 30 cm
    Gamma: 2.20
    DPMS levels: Off
    RGB color display
    Default (sRGB) color space is primary color space
    First detailed timing is the preferred timing
  Color Characteristics:
    Red  : 0.6435, 0.3398
    Green: 0.3076, 0.6201
    Blue : 0.1533, 0.0654
    White: 0.3134, 0.3291
  Established Timings I & II:
    IBM     :   720x400    70.081663 Hz   9:5     31.467 kHz     28.320000 MHz
    DMT 0x04:   640x480    59.940476 Hz   4:3     31.469 kHz     25.175000 MHz
    Apple   :   640x480    66.666667 Hz   4:3     35.000 kHz     30.240000 MHz
    DMT 0x05:   640x480    72.808802 Hz   4:3     37.861 kHz     31.500000 MHz
    DMT 0x06:   640x480    75.000000 Hz   4:3     37.500 kHz     31.500000 MHz
    DMT 0x08:   800x600    56.250000 Hz   4:3     35.156 kHz     36.000000 MHz
    DMT 0x09:   800x600    60.316541 Hz   4:3     37.879 kHz     40.000000 MHz
    DMT 0x0a:   800x600    72.187572 Hz   4:3     48.077 kHz     50.000000 MHz
    DMT 0x0b:   800x600    75.000000 Hz   4:3     46.875 kHz     49.500000 MHz
    Apple   :   832x624    74.551266 Hz   4:3     49.726 kHz     57.284000 MHz
    DMT 0x10:  1024x768    60.003840 Hz   4:3     48.363 kHz     65.000000 MHz
    DMT 0x11:  1024x768    70.069359 Hz   4:3     56.476 kHz     75.000000 MHz
    DMT 0x12:  1024x768    75.028582 Hz   4:3     60.023 kHz     78.750000 MHz
    Apple   :  1152x870    75.061550 Hz 192:145   68.681 kHz    100.000000 MHz
  Standard Timings:
    DMT 0x15:  1152x864    75.000000 Hz   4:3     67.500 kHz    108.000000 MHz
    DMT 0x20:  1280x960    60.000000 Hz   4:3     60.000 kHz    108.000000 MHz
    DMT 0x55:  1280x720    60.000000 Hz  16:9     45.000 kHz     74.250000 MHz
    DMT 0x1c:  1280x800    59.810326 Hz  16:10    49.702 kHz     83.500000 MHz
    DMT 0x2f:  1440x900    59.887445 Hz  16:10    55.935 kHz    106.500000 MHz
    DMT 0x3a:  1680x1050   59.954250 Hz  16:10    65.290 kHz    146.250000 MHz
  Detailed Timing Descriptors:
    DTD 1:  1680x1050   59.954250 Hz  16:10    65.290 kHz    146.250000 MHz (474 mm x 296 mm)
                 Hfront  104 Hsync 176 Hback  280 Hpol N
                 Vfront    3 Vsync   6 Vback   30 Vpol P
    Display Range Limits:
      Monitor ranges (GTF): 50-76 Hz V, 30-83 kHz H, max dotclock 160 MHz
    Display Product Serial Number: ...
    Display Product Name: 'Acer V225WL'
Checksum: 0x2e

----------------

Block 1, Unknown EDID Extension Block 0x00:
  00 ff ff ff ff ff ff 00 04 72 e3 02 b3 eb 00 25 '.........r.....%'
  32 16 01 03 68 2f 1e 78 2e cf 75 a4 57 4e 9e 27 '2...h/.x..u.WN.''
  10 50 54 bf ee 80 71 4f 81 40 81 c0 81 00 95 00 '.PT...qO.@......'
  b3 00 01 01 01 01 21 39 90 30 62 1a 27 40 68 b0 '......!9.0b.'@h.'
  36 00 da 28 11 00 00 1c 00 00 00 fd 00 32 4c 1e '6..(.........2L.'
  53 10 00 0a 20 20 20 20 20 20 00 00 00 ff 00 4c 'S...      .....L'
  57 35 41 41 30 30 31 34 32 30 34 0a 00 00 00 fc 'W5AA0014204.....'
  00 41 63 65 72 20 56 32 32 35 57 4c 0a 20 00 2e '.Acer V225WL. ..'
Checksum: 0x2e

----------------

Failures:

Block 0, Base EDID:
  Basic Display Parameters & Features: sRGB is signaled, but the chromaticities do not match.
Block 1, Base EDID:
  Unknown Extension Block.
EDID:
  Base EDID: EDID specified 0 extension block(s), but found 1 extension block(s).

EDID conformity: FAIL
