
EDID (hex):
00ffffffffffff00410c17c20e020000
301e0103803c22782a67a5a5554da227
0e5054bfef00d1c0b300950081808140
81c0010101014dd000a0f0703e803020
350055502100001aa36600a0f0701f80
3020350055502100001a000000fc0050
484c2032373845310a202020000000fd
00174b1ea03c000a20202020202001b0
020333f14c9004031f1301125d5e5f60
6123090707830100006d030c00100038
7820006001020367d85dc401788003e3
0f000c565e00a0a0a029503020350055
502100001e023a801871382d40582c45
0055502100001e011d007251d01e206e
28550055502100001e4d6c80a070703e
8030203a0055502100001a000000004e

Extracted contents:
header:          00 ff ff ff ff ff ff 00
serial number:   41 0c 17 c2 0e 02 00 00 30 1e
version:         01 03
basic params:    80 3c 22 78 2a
chroma info:     67 a5 a5 55 4d a2 27 0e 50 54
established:     bf ef 00
standard:        d1 c0 b3 00 95 00 81 80 81 40 81 c0 01 01 01 01
descriptor 1:    4d d0 00 a0 f0 70 3e 80 30 20 35 00 55 50 21 00 00 1a
descriptor 2:    a3 66 00 a0 f0 70 1f 80 30 20 35 00 55 50 21 00 00 1a
descriptor 3:    00 00 00 fc 00 50 48 4c 20 32 37 38 45 31 0a 20 20 20
descriptor 4:    00 00 00 fd 00 17 4b 1e a0 3c 00 0a 20 20 20 20 20 20
extensions:      01
checksum:        b0

EDID version: 1.3
Manufacturer: PHL Model c217 Serial Number --
Made in week 48 of 2020
Digital display
Maximum image size: 60 cm x 34 cm
Gamma: 2.20
DPMS levels: Off
RGB color display
First detailed timing is preferred timing
Display x,y Chromaticity:
  Red:   0.6455, 0.3339
  Green: 0.3017, 0.6357
  Blue:  0.1542, 0.0566
  White: 0.3134, 0.3291
Established timings supported:
  720x400@70Hz 9:5 HorFreq: 31469 Hz Clock: 28.320 MHz
  640x480@60Hz 4:3 HorFreq: 31469 Hz Clock: 25.175 MHz
  640x480@67Hz 4:3 HorFreq: 35000 Hz Clock: 30.240 MHz
  640x480@72Hz 4:3 HorFreq: 37900 Hz Clock: 31.500 MHz
  640x480@75Hz 4:3 HorFreq: 37500 Hz Clock: 31.500 MHz
  800x600@56Hz 4:3 HorFreq: 35200 Hz Clock: 36.000 MHz
  800x600@60Hz 4:3 HorFreq: 37900 Hz Clock: 40.000 MHz
  800x600@72Hz 4:3 HorFreq: 48100 Hz Clock: 50.000 MHz
  800x600@75Hz 4:3 HorFreq: 46900 Hz Clock: 49.500 MHz
  832x624@75Hz 4:3 HorFreq: 49726 Hz Clock: 57.284 MHz
  1024x768@60Hz 4:3 HorFreq: 48400 Hz Clock: 65.000 MHz
  1024x768@70Hz 4:3 HorFreq: 56500 Hz Clock: 75.000 MHz
  1024x768@75Hz 4:3 HorFreq: 60000 Hz Clock: 78.750 MHz
  1280x1024@75Hz 5:4 HorFreq: 80000 Hz Clock: 135.000 MHz
Standard timings supported:
  1920x1080@60Hz 16:9
  1680x1050@60Hz 16:10 HorFreq: 64700 Hz Clock: 119.000 MHz
  1440x900@60Hz 16:10 HorFreq: 55500 Hz Clock: 88.750 MHz
  1280x1024@60Hz 5:4 HorFreq: 64000 Hz Clock: 108.000 MHz
  1280x960@60Hz 4:3 HorFreq: 60000 Hz Clock: 108.000 MHz
  1280x720@60Hz 16:9
Detailed mode: Clock 533.250 MHz, 597 mm x 336 mm
               3840 3888 3920 4000 hborder 0
               2160 2163 2168 2222 vborder 0
               +hsync -vsync 
               VertFreq: 59 Hz, HorFreq: 133312 Hz
Detailed mode: Clock 262.750 MHz, 597 mm x 336 mm
               3840 3888 3920 4000 hborder 0
               2160 2163 2168 2191 vborder 0
               +hsync -vsync 
               VertFreq: 29 Hz, HorFreq: 65687 Hz
Monitor name: PHL 278E1
Monitor ranges (GTF): 23-75Hz V, 30-160kHz H, max dotclock 600MHz
Has 1 extension blocks
Checksum: 0xb0 (valid)

CTA extension block
Extension version: 3
47 bytes of CTA data
  Video data block
    VIC  16 1920x1080@60Hz 16:9 (native) HorFreq: 67500 Hz Clock: 148.500 MHz
    VIC   4 1280x720@60Hz 16:9  HorFreq: 45000 Hz Clock: 74.250 MHz
    VIC   3 720x480@60Hz 16:9  HorFreq: 31469 Hz Clock: 27.000 MHz
    VIC  31 1920x1080@50Hz 16:9  HorFreq: 56250 Hz Clock: 148.500 MHz
    VIC  19 1280x720@50Hz 16:9  HorFreq: 37500 Hz Clock: 74.250 MHz
    VIC   1 640x480@60Hz 4:3  HorFreq: 31469 Hz Clock: 25.175 MHz
    VIC  18 720x576@50Hz 16:9  HorFreq: 31250 Hz Clock: 27.000 MHz
    VIC  93 3840x2160@24Hz 16:9  HorFreq: 54000 Hz Clock: 297.000 MHz
    VIC  94 3840x2160@25Hz 16:9  HorFreq: 56250 Hz Clock: 297.000 MHz
    VIC  95 3840x2160@30Hz 16:9  HorFreq: 67500 Hz Clock: 297.000 MHz
    VIC  96 3840x2160@50Hz 16:9  HorFreq: 112500 Hz Clock: 594.000 MHz
    VIC  97 3840x2160@60Hz 16:9  HorFreq: 135000 Hz Clock: 594.000 MHz
  Audio data block
    Linear PCM, max channels 2
      Supported sample rates (kHz): 48 44.1 32
      Supported sample sizes (bits): 24 20 16
  Speaker allocation data block
    Speaker map:
      FL/FR - Front Left/Right
  Vendor-specific data block, OUI 000c03 (HDMI)
    Source physical address 1.0.0.0
    DC_36bit
    DC_30bit
    DC_Y444
    Maximum TMDS clock: 600MHz
    Extended HDMI video details:
      HDMI VIC 1 3840x2160@30Hz 16:9 HorFreq: 67500 Hz Clock: 297.000 MHz
      HDMI VIC 2 3840x2160@25Hz 16:9 HorFreq: 56250 Hz Clock: 297.000 MHz
      HDMI VIC 3 3840x2160@24Hz 16:9 HorFreq: 54000 Hz Clock: 297.000 MHz
  Vendor-specific data block, OUI c45dd8 (HDMI Forum)
    Version: 1
    Maximum TMDS Character Rate: 600MHz
    SCDC Present
    Supports 12-bits/component Deep Color 4:2:0 Pixel Encoding
    Supports 10-bits/component Deep Color 4:2:0 Pixel Encoding
  Extended tag: YCbCr 4:2:0 capability map data block
    VSD Index 10
    VSD Index 11
Underscans PC formats by default
Basic audio support
Supports YCbCr 4:4:4
Supports YCbCr 4:2:2
1 native detailed modes
Detailed mode: Clock 241.500 MHz, 597 mm x 336 mm
               2560 2608 2640 2720 hborder 0
               1440 1443 1448 1481 vborder 0
               +hsync +vsync 
               VertFreq: 59 Hz, HorFreq: 88786 Hz
Detailed mode: Clock 148.500 MHz, 597 mm x 336 mm
               1920 2008 2052 2200 hborder 0
               1080 1084 1089 1125 vborder 0
               +hsync +vsync 
               VertFreq: 60 Hz, HorFreq: 67500 Hz
Detailed mode: Clock 74.250 MHz, 597 mm x 336 mm
               1280 1390 1430 1650 hborder 0
                720  725  730  750 vborder 0
               +hsync +vsync 
               VertFreq: 60 Hz, HorFreq: 45000 Hz
Detailed mode: Clock 277.250 MHz, 597 mm x 336 mm
               1920 1968 2000 2080 hborder 0
               2160 2163 2173 2222 vborder 0
               +hsync -vsync 
               VertFreq: 59 Hz, HorFreq: 133293 Hz
Checksum: 0x4e (valid)

EDID block does NOT conform to EDID 1.3!
	HDMI VSDB Max TMDS rate is > 340


