
EDID (hex):
00ffffffffffff0006102192da020002
281101038040287828fe85a3574a9c25
13505400000001010101010101010101
010101010101bc1b00a0502017303020
360081912100001ab06800a0a0402e60
3020360081912100001a000000ff0043
59373430304d47584d500a00000000fc
0043696e656d612048440a0000000158
40010300000000c84801a500a5000102
031919a8000000000000400000000000
00000000000000000000000000000000
00000000000000000000000000000000
00000000000000000000000000000000
00000000000000000000000000000000
00000000000000000000000000000000
00000000000000000000000000000041

Extracted contents:
header:          00 ff ff ff ff ff ff 00
serial number:   06 10 21 92 da 02 00 02 28 11
version:         01 03
basic params:    80 40 28 78 28
chroma info:     fe 85 a3 57 4a 9c 25 13 50 54
established:     00 00 00
standard:        01 01 01 01 01 01 01 01 01 01 01 01 01 01 01 01
descriptor 1:    bc 1b 00 a0 50 20 17 30 30 20 36 00 81 91 21 00 00 1a
descriptor 2:    b0 68 00 a0 a0 40 2e 60 30 20 36 00 81 91 21 00 00 1a
descriptor 3:    00 00 00 ff 00 43 59 37 34 30 30 4d 47 58 4d 50 0a 00
descriptor 4:    00 00 00 fc 00 43 69 6e 65 6d 61 20 48 44 0a 00 00 00
extensions:      01
checksum:        58

EDID version: 1.3
Manufacturer: APP Model 9221 Serial Number --
Made in week 40 of 2007
Digital display
Maximum image size: 64 cm x 40 cm
Gamma: 2.20
DPMS levels: Off
RGB color display
Display x,y Chromaticity:
  Red:   0.6396, 0.3427
  Green: 0.2919, 0.6113
  Blue:  0.1464, 0.0742
  White: 0.3134, 0.3291
Established timings supported:
Standard timings supported:
Detailed mode: Clock 71.000 MHz, 641 mm x 401 mm
               1280 1328 1360 1440 hborder 0
                800  803  809  823 vborder 0
               +hsync -vsync 
               VertFreq: 59 Hz, HorFreq: 49305 Hz
Detailed mode: Clock 268.000 MHz, 641 mm x 401 mm
               2560 2608 2640 2720 hborder 0
               1600 1603 1609 1646 vborder 0
               +hsync -vsync 
               VertFreq: 59 Hz, HorFreq: 98529 Hz
Serial number: --
Monitor name: Cinema HD
Has 1 extension blocks
Checksum: 0x58 (valid)

DI extension block

EDID block does NOT conform to EDID 1.3!
	Missing preferred timing
	Missing monitor ranges
	Detailed block string not properly terminated
EDID block does not conform at all!
	Has -1476395008 nonconformant extension block(s)
