
EDID (hex):
00ffffffffffff004a8b562514000000
13200103802214782aee91a3544c9926
0f5054210800714081c081809500a9c0
b300d1c00101023a801871382d40582c
250058c41000001e000000fc0048444d
490a2020202020202020000000ff000a
202020202020202020202020000000fd
00303f1e5414000a2020202020200134
020333f2479001020304131fe200d5e3
05c00023097f078301000067030c0010
001848e6060501626200681a00000101
303ce6023a801871382d40582c450058
c41000001e0000000000000000000000
00000000000000000000000000000000
00000000000000000000000000000000
000000000000000000000000000000bf

Extracted contents:
header:          00 ff ff ff ff ff ff 00
serial number:   4a 8b 56 25 14 00 00 00 13 20
version:         01 03
basic params:    80 22 14 78 2a
chroma info:     ee 91 a3 54 4c 99 26 0f 50 54
established:     21 08 00
standard:        71 40 81 c0 81 80 95 00 a9 c0 b3 00 d1 c0 01 01
descriptor 1:    02 3a 80 18 71 38 2d 40 58 2c 25 00 58 c4 10 00 00 1e
descriptor 2:    00 00 00 fc 00 48 44 4d 49 0a 20 20 20 20 20 20 20 20
descriptor 3:    00 00 00 ff 00 0a 20 20 20 20 20 20 20 20 20 20 20 20
descriptor 4:    00 00 00 fd 00 30 3f 1e 54 14 00 0a 20 20 20 20 20 20
extensions:      01
checksum:        34

EDID version: 1.3
Manufacturer: RTK Model 2556 Serial Number --
Made in week 19 of 2022
Digital display
Maximum image size: 34 cm x 20 cm
Gamma: 2.20
DPMS levels: Off
RGB color display
First detailed timing is preferred timing
Display x,y Chromaticity:
  Red:   0.6396, 0.3300
  Green: 0.2998, 0.5996
  Blue:  0.1503, 0.0595
  White: 0.3125, 0.3291
Established timings supported:
  640x480@60Hz 4:3 HorFreq: 31469 Hz Clock: 25.175 MHz
  800x600@60Hz 4:3 HorFreq: 37900 Hz Clock: 40.000 MHz
  1024x768@60Hz 4:3 HorFreq: 48400 Hz Clock: 65.000 MHz
Standard timings supported:
  1152x864@60Hz 4:3
  1280x720@60Hz 16:9
  1280x1024@60Hz 5:4 HorFreq: 64000 Hz Clock: 108.000 MHz
  1440x900@60Hz 16:10 HorFreq: 55500 Hz Clock: 88.750 MHz
  1600x900@60Hz 16:9
  1680x1050@60Hz 16:10 HorFreq: 64700 Hz Clock: 119.000 MHz
  1920x1080@60Hz 16:9
Detailed mode: Clock 148.500 MHz, 344 mm x 196 mm
               1920 2008 2052 2200 hborder 0
               1080 1082 1087 1125 vborder 0
               +hsync +vsync 
               VertFreq: 60 Hz, HorFreq: 67500 Hz
Monitor name: HDMI
Serial number: 
-- ranges (GTF): 48-63Hz V, 30-84kHz H, max dotclock 200MHz
Has 1 extension blocks
Checksum: 0x34 (valid)

CTA extension block
Extension version: 3
47 bytes of CTA data
  Video data block
    VIC  16 1920x1080@60Hz 16:9 (native) HorFreq: 67500 Hz Clock: 148.500 MHz
    VIC   1 640x480@60Hz 4:3  HorFreq: 31469 Hz Clock: 25.175 MHz
    VIC   2 720x480@60Hz 4:3  HorFreq: 31469 Hz Clock: 27.000 MHz
    VIC   3 720x480@60Hz 16:9  HorFreq: 31469 Hz Clock: 27.000 MHz
    VIC   4 1280x720@60Hz 16:9  HorFreq: 45000 Hz Clock: 74.250 MHz
    VIC  19 1280x720@50Hz 16:9  HorFreq: 37500 Hz Clock: 74.250 MHz
    VIC  31 1920x1080@50Hz 16:9  HorFreq: 56250 Hz Clock: 148.500 MHz
  Extended tag: Video capability data block
    YCbCr quantization: Selectable (via AVI YQ) (1)
    RGB quantization: Selectable (via AVI Q) (1)
    PT scan behaviour: Always Overscannned (1)
    IT scan behaviour: Always Overscannned (1)
    CE scan behaviour: Always Overscannned (1)
  Extended tag: Colorimetry data block
    BT2020YCC
    BT2020RGB
  Audio data block
    Linear PCM, max channels 2
      Supported sample rates (kHz): 192 176.4 96 88.2 48 44.1 32
      Supported sample sizes (bits): 24 20 16
  Speaker allocation data block
    Speaker map:
      FL/FR - Front Left/Right
  Vendor-specific data block, OUI 000c03 (HDMI)
    Source physical address 1.0.0.0
    DC_30bit
    DC_Y444
    Maximum TMDS clock: 360MHz
  Extended tag: HDR static metadata data block
    Electro optical transfer functions:
      Traditional gamma - SDR luminance range
      SMPTE ST2084
    Supported static metadata descriptors:
      Static metadata type 1
    Desired content max luminance: 98 (417.710 cd/m^2)
    Desired content max frame-average luminance: 98 (417.710 cd/m^2)
    Desired content min luminance: 0 (0.000 cd/m^2)
  Vendor-specific data block, OUI 00001a
Underscans PC formats by default
Basic audio support
Supports YCbCr 4:4:4
Supports YCbCr 4:2:2
2 native detailed modes
Detailed mode: Clock 148.500 MHz, 344 mm x 196 mm
               1920 2008 2052 2200 hborder 0
               1080 1084 1089 1125 vborder 0
               +hsync +vsync 
               VertFreq: 60 Hz, HorFreq: 67500 Hz
Checksum: 0xbf (valid)

EDID block does NOT conform to EDID 1.3!
	HDMI VSDB Max TMDS rate is > 340
EDID block does not conform at all!
	Both the serial number and the serial string are set
