edid-decode (hex):

00 ff ff ff ff ff ff 00 10 ac ea a1 42 57 5a 30
28 20 01 04 a5 34 20 78 3a e9 05 ab 52 4f 9d 25
0f 50 54 a5 4b 00 71 4f 81 80 a9 40 d1 c0 d1 00
81 c0 81 cf 01 01 28 3c 80 a0 70 b0 23 40 30 20
36 00 06 44 21 00 00 1a 00 00 00 ff 00 39 48 36
51 56 4a 33 0a 20 20 20 20 20 00 00 00 fc 00 44
45 4c 4c 20 50 32 34 32 33 0a 20 20 00 00 00 fd
00 38 4c 1e 53 11 01 0a 20 20 20 20 20 20 00 60

00 ff ff ff ff ff ff 00 10 ac ea a1 42 57 5a 30
28 20 01 04 a5 34 20 78 3a e9 05 ab 52 4f 9d 25
0f 50 54 a5 4b 00 71 4f 81 80 a9 40 d1 c0 d1 00
81 c0 81 cf 01 01 28 3c 80 a0 70 b0 23 40 30 20
36 00 06 44 21 00 00 1a 00 00 00 ff 00 39 48 36
51 56 4a 33 0a 20 20 20 20 20 00 00 00 fc 00 44
45 4c 4c 20 50 32 34 32 33 0a 20 20 00 00 00 fd
00 38 4c 1e 53 11 01 0a 20 20 20 20 20 20 00 60

----------------

Block 0, Base EDID:
  EDID Structure Version & Revision: 1.4
  Vendor & Product Identification:
    Manufacturer: DEL
    Model: 41450
    Serial Number: ...
    Made in: week 40 of 2022
  Basic Display Parameters & Features:
    Digital display
    Bits per primary color channel: 8
    DisplayPort interface
    Maximum image size: 52 cm x 32 cm
    Gamma: 2.20
    DPMS levels: Off
    Supported color formats: RGB 4:4:4, YCrCb 4:4:4, YCrCb 4:2:2
    First detailed timing includes the native pixel format and preferred refresh rate
  Color Characteristics:
    Red  : 0.6708, 0.3222
    Green: 0.3105, 0.6142
    Blue : 0.1445, 0.0585
    White: 0.3134, 0.3291
  Established Timings I & II:
    IBM     :   720x400    70.081663 Hz   9:5     31.467 kHz     28.320000 MHz
    DMT 0x04:   640x480    59.940476 Hz   4:3     31.469 kHz     25.175000 MHz
    DMT 0x06:   640x480    75.000000 Hz   4:3     37.500 kHz     31.500000 MHz
    DMT 0x09:   800x600    60.316541 Hz   4:3     37.879 kHz     40.000000 MHz
    DMT 0x0b:   800x600    75.000000 Hz   4:3     46.875 kHz     49.500000 MHz
    DMT 0x10:  1024x768    60.003840 Hz   4:3     48.363 kHz     65.000000 MHz
    DMT 0x12:  1024x768    75.028582 Hz   4:3     60.023 kHz     78.750000 MHz
    DMT 0x24:  1280x1024   75.024675 Hz   5:4     79.976 kHz    135.000000 MHz
  Standard Timings:
    DMT 0x15:  1152x864    75.000000 Hz   4:3     67.500 kHz    108.000000 MHz
    DMT 0x23:  1280x1024   60.019740 Hz   5:4     63.981 kHz    108.000000 MHz
    DMT 0x33:  1600x1200   60.000000 Hz   4:3     75.000 kHz    162.000000 MHz
    DMT 0x52:  1920x1080   60.000000 Hz  16:9     67.500 kHz    148.500000 MHz
    DMT 0x45:  1920x1200   59.884600 Hz  16:10    74.556 kHz    193.250000 MHz
    DMT 0x55:  1280x720    60.000000 Hz  16:9     45.000 kHz     74.250000 MHz
    GTF     :  1280x720    74.999686 Hz  16:9     56.400 kHz     95.654000 MHz
  Detailed Timing Descriptors:
    DTD 1:  1920x1200   59.950171 Hz  16:10    74.038 kHz    154.000000 MHz (518 mm x 324 mm)
                 Hfront   48 Hsync  32 Hback   80 Hpol P
                 Vfront    3 Vsync   6 Vback   26 Vpol N
    Display Product Serial Number: ...
    Display Product Name: 'DELL P2423'
    Display Range Limits:
      Monitor ranges (Bare Limits): 56-76 Hz V, 30-83 kHz H, max dotclock 170 MHz
Checksum: 0x60

----------------

Block 1, Unknown EDID Extension Block 0x00:
  00 ff ff ff ff ff ff 00 10 ac ea a1 42 57 5a 30 '............BWZ0'
  28 20 01 04 a5 34 20 78 3a e9 05 ab 52 4f 9d 25 '( ...4 x:...RO.%'
  0f 50 54 a5 4b 00 71 4f 81 80 a9 40 d1 c0 d1 00 '.PT.K.qO...@....'
  81 c0 81 cf 01 01 28 3c 80 a0 70 b0 23 40 30 20 '......(<..p.#@0 '
  36 00 06 44 21 00 00 1a 00 00 00 ff 00 39 48 36 '6..D!........9H6'
  51 56 4a 33 0a 20 20 20 20 20 00 00 00 fc 00 44 'QVJ3.     .....D'
  45 4c 4c 20 50 32 34 32 33 0a 20 20 00 00 00 fd 'ELL P2423.  ....'
  00 38 4c 1e 53 11 01 0a 20 20 20 20 20 20 00 60 '.8L.S...      .`'
Checksum: 0x60

----------------

Warnings:

EDID:
  Base EDID: Some timings are out of range of the Monitor Ranges:
    Maximum Clock: 193.250 MHz (Monitor: 170.000 MHz)

Failures:

Block 1, Base EDID:
  Unknown Extension Block.
EDID:
  Base EDID: EDID specified 0 extension block(s), but found 1 extension block(s).

EDID conformity: FAIL
