
EDID (hex):
00ffffffffffff000dae991400000000
33170104901f1178027e459355539428
23505400000001010101010101010101
010101010101da1d56e250002030442d
470035ae1000001ae71356e250002030
442d470035ae1000001a000000000000
00000000000000000000000000000002
000c42ff0b3c6e0f0e1a7100000000ad

Extracted contents:
header:          00 ff ff ff ff ff ff 00
serial number:   0d ae 99 14 00 00 00 00 33 17
version:         01 04
basic params:    90 1f 11 78 02
chroma info:     7e 45 93 55 53 94 28 23 50 54
established:     00 00 00
standard:        01 01 01 01 01 01 01 01 01 01 01 01 01 01 01 01
descriptor 1:    da 1d 56 e2 50 00 20 30 44 2d 47 00 35 ae 10 00 00 1a
descriptor 2:    e7 13 56 e2 50 00 20 30 44 2d 47 00 35 ae 10 00 00 1a
descriptor 3:    00 00 00 00 00 00 00 00 00 00 00 00 00 00 00 00 00 00
descriptor 4:    00 00 00 02 00 0c 42 ff 0b 3c 6e 0f 0e 1a 71 00 00 00
extensions:      00
checksum:        ad

EDID version: 1.4
Manufacturer: CMN Model 1499 Serial Number --
Made in week 51 of 2013
Digital display
6 bits per primary color channel
Digital interface is not defined
Maximum image size: 31 cm x 17 cm
Gamma: 2.20
Supported color formats: RGB 4:4:4
First detailed timing includes the native pixel format and preferred refresh rate
Display x,y Chromaticity:
  Red:   0.5751, 0.3349
  Green: 0.3271, 0.5800
  Blue:  0.1572, 0.1367
  White: 0.3134, 0.3291
Established timings supported:
Standard timings supported:
Detailed mode: Clock 76.420 MHz, 309 mm x 174 mm
               1366 1434 1479 1592 hborder 0
                768  772  779  800 vborder 0
               +hsync -vsync 
               VertFreq: 60 Hz, HorFreq: 48002 Hz
Detailed mode: Clock 50.950 MHz, 309 mm x 174 mm
               1366 1434 1479 1592 hborder 0
                768  772  779  800 vborder 0
               +hsync -vsync 
               VertFreq: 40 Hz, HorFreq: 32003 Hz
Manufacturer-specified data, tag 0
Manufacturer-specified data, tag 2
Checksum: 0xad (valid)
EDID block does NOT conform to EDID 1.4!
	Missing name descriptor
	Missing monitor ranges
