edid-decode (hex):

00 ff ff ff ff ff ff 00 09 e5 b6 08 00 00 00 00
1d 1d 01 04 a5 22 13 78 03 aa 26 a5 55 4d 9c 27
10 4e 51 00 00 00 01 01 01 01 01 01 01 01 01 01
01 01 01 01 01 01 c0 39 80 18 71 38 28 40 30 20
36 00 58 c2 10 00 00 1a 33 2e 80 18 71 38 28 40
30 20 36 00 58 c2 10 00 00 00 00 00 00 fe 00 42
4f 45 20 43 51 0a 20 20 20 20 20 20 00 00 00 fe
00 4e 56 31 35 36 46 48 4d 2d 4e 36 38 0a 00 a9

----------------

Block 0, Base EDID:
  EDID Structure Version & Revision: 1.4
  Vendor & Product Identification:
    Manufacturer: BOE
    Model: 2230
    Made in: week 29 of 2019
  Basic Display Parameters & Features:
    Digital display
    Bits per primary color channel: 8
    DisplayPort interface
    Maximum image size: 34 cm x 19 cm
    Gamma: 2.20
    Supported color formats: RGB 4:4:4
    First detailed timing includes the native pixel format and preferred refresh rate
    Display is continuous frequency
  Color Characteristics:
    Red  : 0.6464, 0.3339
    Green: 0.3027, 0.6113
    Blue : 0.1523, 0.0644
    White: 0.3056, 0.3183
  Established Timings I & II: none
  Standard Timings: none
  Detailed Timing Descriptors:
    DTD 1:  1920x1080   60.000000 Hz  16:9     67.200 kHz    147.840000 MHz (344 mm x 194 mm)
                 Hfront   48 Hsync  32 Hback  200 Hpol P
                 Vfront    3 Vsync   6 Vback   31 Vpol N
    DTD 2:  1920x1080   47.999188 Hz  16:9     53.759 kHz    118.270000 MHz (analog composite, sync-on-green, 344 mm x 194 mm)
                 Hfront   48 Hsync  32 Hback  200 Hpol N
                 Vfront    3 Vsync   6 Vback   31 Vpol N
    Alphanumeric Data String: 'BOE CQ'
    Alphanumeric Data String: 'NV156FHM-N68'
Checksum: 0xa9

----------------

Warnings:

Block 0, Base EDID:
  Missing Display Product Name.

Failures:

Block 0, Base EDID:
  Missing Display Range Limits Descriptor.

EDID conformity: FAIL
