edid-decode (hex):

00 ff ff ff ff ff ff 00 0d ae e6 15 00 00 00 00
20 1d 01 04 95 22 13 78 02 c3 c5 91 55 54 94 29
22 50 54 00 00 00 01 01 01 01 01 01 01 01 01 01
01 01 01 01 01 01 da 1d 56 e2 50 00 20 30 44 2d
47 00 58 c1 10 00 00 1a e2 17 56 e2 50 00 20 30
44 2d 47 00 58 c1 10 00 00 1a 00 00 00 fe 00 47
32 37 47 56 80 31 35 36 42 47 41 0a 00 00 00 00
00 00 41 31 96 00 10 00 00 09 01 0a 20 20 00 38

----------------

Block 0, Base EDID:
  EDID Structure Version & Revision: 1.4
  Vendor & Product Identification:
    Manufacturer: CMN
    Model: 5606
    Made in: week 32 of 2019
  Basic Display Parameters & Features:
    Digital display
    Bits per primary color channel: 6
    DisplayPort interface
    Maximum image size: 34 cm x 19 cm
    Gamma: 2.20
    Supported color formats: RGB 4:4:4
    First detailed timing includes the native pixel format and preferred refresh rate
  Color Characteristics:
    Red  : 0.5693, 0.3320
    Green: 0.3281, 0.5810
    Blue : 0.1630, 0.1328
    White: 0.3134, 0.3291
  Established Timings I & II: none
  Standard Timings: none
  Detailed Timing Descriptors:
    DTD 1:  1366x768    60.003141 Hz 683:384   48.003 kHz     76.420000 MHz (344 mm x 193 mm)
                 Hfront   68 Hsync  45 Hback  113 Hpol P
                 Vfront    4 Vsync   7 Vback   21 Vpol N
    DTD 2:  1366x768    48.005653 Hz 683:384   38.405 kHz     61.140000 MHz (344 mm x 193 mm)
                 Hfront   68 Hsync  45 Hback  113 Hpol P
                 Vfront    4 Vsync   7 Vback   21 Vpol N
    Alphanumeric Data String: 'G27GV'
    Manufacturer-Specified Display Descriptor (0x00): 00 00 00 00 41 31 96 00 10 00 00 09 01 0a 20 20 '....A1........  '
Checksum: 0x38

----------------

Warnings:

Block 0, Base EDID:
  Missing Display Product Name.

Failures:

Block 0, Base EDID:
  Alphanumeric Data String: Non-printable character.

EDID conformity: FAIL
