
EDID (hex):
00ffffffffffff003b078e0001000000
1d0f0103284728780abf44a654469924
13484b2fce0031594559615901010101
010101010101ea240060410028303060
1300c58f210000001b2150a051001e30
48883500c58f21000000000000fc004d
524944544c36333256323030f41a5080
5100193038883500c58f2100002000ac

edid-decode (hex):

00 ff ff ff ff ff ff 00 3b 07 8e 00 01 00 00 00
1d 0f 01 03 28 47 28 78 0a bf 44 a6 54 46 99 24
13 48 4b 2f ce 00 31 59 45 59 61 59 01 01 01 01
01 01 01 01 01 01 ea 24 00 60 41 00 28 30 30 60
13 00 c5 8f 21 00 00 00 1b 21 50 a0 51 00 1e 30
48 88 35 00 c5 8f 21 00 00 00 00 00 00 fc 00 4d
52 49 44 54 4c 36 33 32 56 32 30 30 f4 1a 50 80
51 00 19 30 38 88 35 00 c5 8f 21 00 00 20 00 ac

----------------

Block 0, Base EDID:
  EDID Structure Version & Revision: 1.3
  Vendor & Product Identification:
    Manufacturer: NXG
    Model: 142
    Serial Number: 1
    Made in: week 29 of 2005
  Basic Display Parameters & Features:
    Analog display
    Signal Level Standard: 0.714 : 0.286 : 1.000 V p-p
    Blank level equals black level
    Sync: Separate
    Maximum image size: 71 cm x 40 cm
    Gamma: 2.20
    RGB color display
    First detailed timing is the preferred timing
  Color Characteristics:
    Red  : 0.6503, 0.3310
    Green: 0.2763, 0.6005
    Blue : 0.1416, 0.0742
    White: 0.2822, 0.2929
  Established Timings I & II:
    DMT 0x04:   640x480    59.940476 Hz   4:3     31.469 kHz     25.175000 MHz
    DMT 0x05:   640x480    72.808802 Hz   4:3     37.861 kHz     31.500000 MHz
    DMT 0x06:   640x480    75.000000 Hz   4:3     37.500 kHz     31.500000 MHz
    DMT 0x08:   800x600    56.250000 Hz   4:3     35.156 kHz     36.000000 MHz
    DMT 0x09:   800x600    60.316541 Hz   4:3     37.879 kHz     40.000000 MHz
    DMT 0x0a:   800x600    72.187572 Hz   4:3     48.077 kHz     50.000000 MHz
    DMT 0x0b:   800x600    75.000000 Hz   4:3     46.875 kHz     49.500000 MHz
    DMT 0x10:  1024x768    60.003840 Hz   4:3     48.363 kHz     65.000000 MHz
    DMT 0x11:  1024x768    70.069359 Hz   4:3     56.476 kHz     75.000000 MHz
    DMT 0x12:  1024x768    75.028582 Hz   4:3     60.023 kHz     78.750000 MHz
  Standard Timings:
    DMT 0x07:   640x480    85.008312 Hz   4:3     43.269 kHz     36.000000 MHz
    DMT 0x0c:   800x600    85.061274 Hz   4:3     53.674 kHz     56.250000 MHz
    DMT 0x13:  1024x768    84.996690 Hz   4:3     68.677 kHz     94.500000 MHz
  Detailed Timing Descriptors:
    DTD 1:  1024x768    84.996690 Hz   4:3     68.677 kHz     94.500000 MHz (analog composite, sync-on-green, 709 mm x 399 mm)
                 Hfront   48 Hsync  96 Hback  208 Hpol N
                 Vfront    1 Vsync   3 Vback   36 Vpol N
    DTD 2:  1360x768    59.798991 Hz  85:48    47.720 kHz     84.750000 MHz (analog composite, sync-on-green, 709 mm x 399 mm)
                 Hfront   72 Hsync 136 Hback  208 Hpol N
                 Vfront    3 Vsync   5 Vback   22 Vpol N
    Display Product Name: 'MRIDTL632V200'
    DTD 3:  1360x768    49.891829 Hz  85:48    39.564 kHz     69.000000 MHz (analog composite, sync-on-green, field sequential L/R, 709 mm x 399 mm)
                 Hfront   56 Hsync 136 Hback  192 Hpol N
                 Vfront    3 Vsync   5 Vback   17 Vpol N
Checksum: 0xac
