
EDID (hex):
00ffffffffffff0010ac10f04c444c33
20130104a52f1e7826ee95a3544c9926
0f5054a54b00714f8180b30001010101
01010101010121399030621a274068b0
3600da281100001c000000ff00483733
3648393837334c444c0a000000fc0044
454c4c203232303957410a20000000fd
00384b1e5310000a20202020202000cc

Extracted contents:
header:          00 ff ff ff ff ff ff 00
serial number:   10 ac 10 f0 4c 44 4c 33 20 13
version:         01 04
basic params:    a5 2f 1e 78 26
chroma info:     ee 95 a3 54 4c 99 26 0f 50 54
established:     a5 4b 00
standard:        71 4f 81 80 b3 00 01 01 01 01 01 01 01 01 01 01
descriptor 1:    21 39 90 30 62 1a 27 40 68 b0 36 00 da 28 11 00 00 1c
descriptor 2:    00 00 00 ff 00 48 37 33 36 48 39 38 37 33 4c 44 4c 0a
descriptor 3:    00 00 00 fc 00 44 45 4c 4c 20 32 32 30 39 57 41 0a 20
descriptor 4:    00 00 00 fd 00 38 4b 1e 53 10 00 0a 20 20 20 20 20 20
extensions:      00
checksum:        cc

EDID version: 1.4
Manufacturer: DEL Model f010 Serial Number --
Made in week 32 of 2009
Digital display
8 bits per primary color channel
DisplayPort interface
Maximum image size: 47 cm x 30 cm
Gamma: 2.20
DPMS levels: Off
Supported color formats: RGB 4:4:4
Default (sRGB) color space is primary color space
First detailed timing includes the native pixel format and preferred refresh rate
Display x,y Chromaticity:
  Red:   0.6396, 0.3300
  Green: 0.2998, 0.5996
  Blue:  0.1503, 0.0595
  White: 0.3134, 0.3291
Established timings supported:
  720x400@70Hz 9:5 HorFreq: 31469 Hz Clock: 28.320 MHz
  640x480@60Hz 4:3 HorFreq: 31469 Hz Clock: 25.175 MHz
  640x480@75Hz 4:3 HorFreq: 37500 Hz Clock: 31.500 MHz
  800x600@60Hz 4:3 HorFreq: 37900 Hz Clock: 40.000 MHz
  800x600@75Hz 4:3 HorFreq: 46900 Hz Clock: 49.500 MHz
  1024x768@60Hz 4:3 HorFreq: 48400 Hz Clock: 65.000 MHz
  1024x768@75Hz 4:3 HorFreq: 60000 Hz Clock: 78.750 MHz
  1280x1024@75Hz 5:4 HorFreq: 80000 Hz Clock: 135.000 MHz
Standard timings supported:
  1152x864@75Hz 4:3 HorFreq: 67500 Hz Clock: 108.000 MHz
  1280x1024@60Hz 5:4 HorFreq: 64000 Hz Clock: 108.000 MHz
  1680x1050@60Hz 16:10 HorFreq: 64700 Hz Clock: 119.000 MHz
Detailed mode: Clock 146.250 MHz, 474 mm x 296 mm
               1680 1784 1960 2240 hborder 0
               1050 1053 1059 1089 vborder 0
               -hsync +vsync 
               VertFreq: 59 Hz, HorFreq: 65290 Hz
Serial number: --
Monitor name: DELL 2209WA
Monitor ranges (GTF): 56-75Hz V, 30-83kHz H, max dotclock 160MHz
Checksum: 0xcc (valid)
EDID block does NOT conform to EDID 1.4!
	sRGB is signaled, but the chromaticities do not match


