edid-decode (hex):

00 ff ff ff ff ff ff 00 15 c3 43 16 00 00 00 00
10 0d 01 02 68 20 19 78 ea 8c 9b a3 57 47 9a 24
16 4d 51 bf ef 80 81 80 81 40 81 4f 71 4f 01 01
01 01 01 01 01 01 30 2a 00 98 51 00 2a 40 30 70
13 00 3d fe 10 00 00 1e 00 00 00 ff 00 46 31 34
35 37 30 34 33 0a 20 20 20 20 00 00 00 fd 00 31
4c 18 51 0e 00 0a 20 20 20 20 20 20 00 00 00 fc
00 4c 34 36 35 0a 20 20 20 20 20 20 20 20 00 a4

00 ff ff ff ff ff ff 00 15 c3 43 16 00 00 00 00
10 0d 01 02 68 20 19 78 ea 8c 9b a3 57 47 9a 24
16 4d 51 bf ef 80 81 80 81 40 81 4f 71 4f 01 01
01 01 01 01 01 01 30 2a 00 98 51 00 2a 40 30 70
13 00 3d fe 10 00 00 1e 00 00 00 ff 00 46 31 34
35 37 30 34 33 0a 20 20 20 20 00 00 00 fd 00 31
4c 18 51 0e 00 0a 20 20 20 20 20 20 00 00 00 fc
00 4c 34 36 35 0a 20 20 20 20 20 20 20 20 00 a4

----------------

Block 0, Base EDID:
  EDID Structure Version & Revision: 1.2
  Vendor & Product Identification:
    Manufacturer: ENC
    Model: 5699
    Made in: week 16 of 2003
  Basic Display Parameters & Features:
    Analog display
    Signal Level Standard: 0.700 : 0.000 : 0.700 V p-p
    Blank level equals black level
    Sync: Separate
    Maximum image size: 32 cm x 25 cm
    Gamma: 2.20
    DPMS levels: Standby Suspend Off
    RGB color display
    First detailed timing is the preferred timing
  Color Characteristics:
    Red  : 0.6386, 0.3398
    Green: 0.2802, 0.6015
    Blue : 0.1425, 0.0869
    White: 0.3027, 0.3193
  Established Timings I & II:
    IBM     :   720x400    70.081663 Hz   9:5     31.467 kHz     28.320000 MHz
    DMT 0x04:   640x480    59.940476 Hz   4:3     31.469 kHz     25.175000 MHz
    Apple   :   640x480    66.666667 Hz   4:3     35.000 kHz     30.240000 MHz
    DMT 0x05:   640x480    72.808802 Hz   4:3     37.861 kHz     31.500000 MHz
    DMT 0x06:   640x480    75.000000 Hz   4:3     37.500 kHz     31.500000 MHz
    DMT 0x08:   800x600    56.250000 Hz   4:3     35.156 kHz     36.000000 MHz
    DMT 0x09:   800x600    60.316541 Hz   4:3     37.879 kHz     40.000000 MHz
    DMT 0x0a:   800x600    72.187572 Hz   4:3     48.077 kHz     50.000000 MHz
    DMT 0x0b:   800x600    75.000000 Hz   4:3     46.875 kHz     49.500000 MHz
    Apple   :   832x624    74.551266 Hz   4:3     49.726 kHz     57.284000 MHz
    DMT 0x10:  1024x768    60.003840 Hz   4:3     48.363 kHz     65.000000 MHz
    DMT 0x11:  1024x768    70.069359 Hz   4:3     56.476 kHz     75.000000 MHz
    DMT 0x12:  1024x768    75.028582 Hz   4:3     60.023 kHz     78.750000 MHz
    DMT 0x24:  1280x1024   75.024675 Hz   5:4     79.976 kHz    135.000000 MHz
    Apple   :  1152x870    75.061550 Hz 192:145   68.681 kHz    100.000000 MHz
  Standard Timings:
    DMT 0x23:  1280x1024   60.019740 Hz   5:4     63.981 kHz    108.000000 MHz
    DMT 0x20:  1280x960    60.000000 Hz   4:3     60.000 kHz    108.000000 MHz
    GTF     :  1280x960    74.999884 Hz   4:3     75.150 kHz    129.859000 MHz
    DMT 0x15:  1152x864    75.000000 Hz   4:3     67.500 kHz    108.000000 MHz
  Detailed Timing Descriptors:
    DTD 1:  1280x1024   60.019740 Hz   5:4     63.981 kHz    108.000000 MHz (317 mm x 254 mm)
                 Hfront   48 Hsync 112 Hback  248 Hpol P
                 Vfront    1 Vsync   3 Vback   38 Vpol P
    Display Product Serial Number: ...
    Display Range Limits:
      Monitor ranges (GTF): 49-76 Hz V, 24-81 kHz H, max dotclock 140 MHz
    Display Product Name: 'L465'
Checksum: 0xa4

----------------

Block 1, Unknown EDID Extension Block 0x00:
  00 ff ff ff ff ff ff 00 15 c3 43 16 00 00 00 00 '..........C.....'
  10 0d 01 02 68 20 19 78 ea 8c 9b a3 57 47 9a 24 '....h .x....WG.$'
  16 4d 51 bf ef 80 81 80 81 40 81 4f 71 4f 01 01 '.MQ......@.OqO..'
  01 01 01 01 01 01 30 2a 00 98 51 00 2a 40 30 70 '......0*..Q.*@0p'
  13 00 3d fe 10 00 00 1e 00 00 00 ff 00 46 31 34 '..=..........F14'
  35 37 30 34 33 0a 20 20 20 20 00 00 00 fd 00 31 '57043.    .....1'
  4c 18 51 0e 00 0a 20 20 20 20 20 20 00 00 00 fc 'L.Q...      ....'
  00 4c 34 36 35 0a 20 20 20 20 20 20 20 20 00 a4 '.L465.        ..'
Checksum: 0xa4

----------------

Warnings:

Block 0, Base EDID:
  EDID Structure Version & Revision: EDID 1.2 is deprecated, do not use.

Failures:

Block 1, Base EDID:
  Unknown Extension Block.
EDID:
  Base EDID: EDID specified 0 extension block(s), but found 1 extension block(s).

EDID conformity: FAIL
