
EDID (hex):
00ffffffffffff003ac4000800000000
2d0c010380201200eaa8e099574b9225
1c505400000001010101010101010101
010101010101ea3780d2703828403e2a
360042b510000018000000fc004e7669
6469612044656661756c000000fc0074
20466c61742050616e656c00000000fd
00003d1d440f00002020202020000064

Extracted contents:
header:          00 ff ff ff ff ff ff 00
serial number:   3a c4 00 08 00 00 00 00 2d 0c
version:         01 03
basic params:    80 20 12 00 ea
chroma info:     a8 e0 99 57 4b 92 25 1c 50 54
established:     00 00 00
standard:        01 01 01 01 01 01 01 01 01 01 01 01 01 01 01 01
descriptor 1:    ea 37 80 d2 70 38 28 40 3e 2a 36 00 42 b5 10 00 00 18
descriptor 2:    00 00 00 fc 00 4e 76 69 64 69 61 20 44 65 66 61 75 6c
descriptor 3:    00 00 00 fc 00 74 20 46 6c 61 74 20 50 61 6e 65 6c 00
descriptor 4:    00 00 00 fd 00 00 3d 1d 44 0f 00 00 20 20 20 20 20 00
extensions:      00
checksum:        64

EDID version: 1.3
Manufacturer: NVD Model 800 Serial Number --
Digital display
Maximum image size: 32 cm x 18 cm
Gamma: 1.00
DPMS levels: Standby Suspend Off
RGB color display
First detailed timing is preferred timing
Display x,y Chromaticity:
  Red:   0.5996, 0.3417
  Green: 0.2949, 0.5703
  Blue:  0.1474, 0.1113
  White: 0.3125, 0.3281
Established timings supported:
Standard timings supported:
Detailed mode: Clock 143.140 MHz, 322 mm x 181 mm
               1920 1982 2024 2130 hborder 0
               1080 1083 1089 1120 vborder 0
               -hsync -vsync 
               VertFreq: 60 Hz, HorFreq: 67201 Hz
Monitor ranges (GTF): 0-61Hz V, 29-68kHz H, max dotclock 150MHz
Checksum: 0x64 (valid)
EDID block does NOT conform to EDID 1.3!
	Name descriptor not terminated with a newline
EDID block does not conform at all!
	Bad year of manufacture
