edid-decode (hex):

00 ff ff ff ff ff ff 00 30 ae 10 40 00 00 00 00
29 12 01 03 80 1a 10 78 ea e5 95 93 56 4f 90 28
28 50 54 00 00 00 01 01 01 01 01 01 01 01 01 01
01 01 01 01 01 01 6a 1d 00 e8 50 20 1e 30 10 30
22 00 05 a3 10 00 00 18 26 17 00 a0 50 20 17 30
30 20 36 00 05 a3 10 00 00 18 00 00 00 0f 00 81
0a 3c 81 0a 32 16 01 00 30 64 00 55 00 00 00 fe
00 4c 54 44 31 32 31 45 57 56 42 0a 20 20 00 77

00 ff ff ff ff ff ff 00 30 ae 10 40 00 00 00 00
29 12 01 03 80 1a 10 78 ea e5 95 93 56 4f 90 28
28 50 54 00 00 00 01 01 01 01 01 01 01 01 01 01
01 01 01 01 01 01 6a 1d 00 e8 50 20 1e 30 10 30
22 00 05 a3 10 00 00 18 26 17 00 a0 50 20 17 30
30 20 36 00 05 a3 10 00 00 18 00 00 00 0f 00 81
0a 3c 81 0a 32 16 01 00 30 64 00 55 00 00 00 fe
00 4c 54 44 31 32 31 45 57 56 42 0a 20 20 00 77

----------------

Block 0, Base EDID:
  EDID Structure Version & Revision: 1.3
  Vendor & Product Identification:
    Manufacturer: LEN
    Model: 16400
    Made in: week 41 of 2008
  Basic Display Parameters & Features:
    Digital display
    Maximum image size: 26 cm x 16 cm
    Gamma: 2.20
    DPMS levels: Standby Suspend Off
    RGB color display
    First detailed timing is the preferred timing
  Color Characteristics:
    Red  : 0.5771, 0.3378
    Green: 0.3095, 0.5634
    Blue : 0.1582, 0.1572
    White: 0.3134, 0.3291
  Established Timings I & II: none
  Standard Timings: none
  Detailed Timing Descriptors:
    DTD 1:  1280x800    60.001912 Hz  16:10    49.802 kHz     75.300000 MHz (261 mm x 163 mm)
                 Hfront   16 Hsync  48 Hback  168 Hpol N
                 Vfront    2 Vsync   2 Vback   26 Vpol N
    DTD 2:  1280x800    50.003375 Hz  16:10    41.153 kHz     59.260000 MHz (261 mm x 163 mm)
                 Hfront   48 Hsync  32 Hback   80 Hpol N
                 Vfront    3 Vsync   6 Vback   14 Vpol N
    Manufacturer-Specified Display Descriptor (0x0f): 00 0f 00 81 0a 3c 81 0a 32 16 01 00 30 64 00 55 '.....<..2...0d.U'
    Alphanumeric Data String: 'LTD121EWVB'
Checksum: 0x77

----------------

Block 1, Unknown EDID Extension Block 0x00:
  00 ff ff ff ff ff ff 00 30 ae 10 40 00 00 00 00 '........0..@....'
  29 12 01 03 80 1a 10 78 ea e5 95 93 56 4f 90 28 ')......x....VO.('
  28 50 54 00 00 00 01 01 01 01 01 01 01 01 01 01 '(PT.............'
  01 01 01 01 01 01 6a 1d 00 e8 50 20 1e 30 10 30 '......j...P .0.0'
  22 00 05 a3 10 00 00 18 26 17 00 a0 50 20 17 30 '".......&...P .0'
  30 20 36 00 05 a3 10 00 00 18 00 00 00 0f 00 81 '0 6.............'
  0a 3c 81 0a 32 16 01 00 30 64 00 55 00 00 00 fe '.<..2...0d.U....'
  00 4c 54 44 31 32 31 45 57 56 42 0a 20 20 00 77 '.LTD121EWVB.  .w'
Checksum: 0x77

----------------

Failures:

Block 0, Base EDID:
  Missing Display Product Name.
  Missing Display Range Limits Descriptor.
Block 1, Base EDID:
  Unknown Extension Block.
EDID:
  Base EDID: EDID specified 0 extension block(s), but found 1 extension block(s).

EDID conformity: FAIL
