edid-decode (hex):

00 ff ff ff ff ff ff 00 30 ae 10 40 00 00 00 00
2d 12 01 03 80 1a 10 78 ea 18 55 9a 56 54 8b 27
20 50 54 00 00 00 01 01 01 01 01 01 01 01 01 01
01 01 01 01 01 01 60 1d 00 00 51 20 10 30 10 30
33 00 05 a3 10 00 00 19 60 1d 00 00 51 20 10 30
10 30 33 00 05 a3 10 00 00 19 00 00 00 0f 00 81
0a 3c 81 0a 3c 15 00 00 4c a3 57 31 00 00 00 fe
00 4c 54 4e 31 32 31 41 50 30 32 30 30 31 00 41

----------------

Block 0, Base EDID:
  EDID Structure Version & Revision: 1.3
  Vendor & Product Identification:
    Manufacturer: LEN
    Model: 16400
    Made in: week 45 of 2008
  Basic Display Parameters & Features:
    Digital display
    Maximum image size: 26 cm x 16 cm
    Gamma: 2.20
    DPMS levels: Standby Suspend Off
    RGB color display
    First detailed timing is preferred timing
  Color Characteristics:
    Red  : 0.6015, 0.3369
    Green: 0.3300, 0.5429
    Blue : 0.1533, 0.1259
    White: 0.3134, 0.3291
  Established Timings I & II: none
  Standard Timings: none
  Detailed Timing Descriptors:
    DTD 1:  1280x800    59.998 Hz   8:5    48.958 kHz  75.200 MHz (261 mm x 163 mm)
                 Hfront   16 Hsync  48 Hback 192 Hpol N
                 Vfront    3 Vsync   3 Vback  10 Vpol N
    DTD 2:  1280x800    59.998 Hz   8:5    48.958 kHz  75.200 MHz (261 mm x 163 mm)
                 Hfront   16 Hsync  48 Hback 192 Hpol N
                 Vfront    3 Vsync   3 Vback  10 Vpol N
    Manufacturer-Specified Display Descriptor (0x0f): 00 0f 00 81 0a 3c 81 0a 3c 15 00 00 4c a3 57 31 '.....<..<...L.W1'
    Alphanumeric Data String: 'LTN121AP02001'
Checksum: 0x41

----------------

Failures:

Block 0, Base EDID:
  Missing Display Product Name.
  Missing Display Range Limits Descriptor.

EDID conformity: FAIL
