edid-decode (hex):

00 ff ff ff ff ff ff 00 30 ae 10 40 00 00 00 00
01 11 01 03 80 1a 10 78 ea 87 f5 94 57 4f 8c 27
27 50 54 00 00 00 01 01 01 01 01 01 01 01 01 01
01 01 01 01 01 01 c6 1b 00 a0 50 20 17 30 30 20
36 00 05 a3 10 00 00 18 26 17 00 a0 50 20 17 30
30 20 36 00 05 a3 10 00 00 18 00 00 00 0f 00 81
0a 3c 81 0a 32 14 01 00 06 af 14 36 00 00 00 fe
00 42 31 32 31 45 57 30 33 20 56 36 20 0a 00 aa

----------------

Block 0, Base EDID:
  EDID Structure Version & Revision: 1.3
  Vendor & Product Identification:
    Manufacturer: LEN
    Model: 16400
    Made in: week 1 of 2007
  Basic Display Parameters & Features:
    Digital display
    Maximum image size: 26 cm x 16 cm
    Gamma: 2.20
    DPMS levels: Standby Suspend Off
    RGB color display
    First detailed timing is preferred timing
  Color Characteristics:
    Red  : 0.5800, 0.3398
    Green: 0.3095, 0.5498
    Blue : 0.1552, 0.1552
    White: 0.3134, 0.3291
  Established Timings I & II: none
  Standard Timings: none
  Detailed Timing Descriptors:
    DTD 1:  1280x800    59.994 Hz   8:5    49.375 kHz  71.100 MHz (261 mm x 163 mm)
                 Hfront   48 Hsync  32 Hback  80 Hpol N
                 Vfront    3 Vsync   6 Vback  14 Vpol N
    DTD 2:  1280x800    50.003 Hz   8:5    41.153 kHz  59.260 MHz (261 mm x 163 mm)
                 Hfront   48 Hsync  32 Hback  80 Hpol N
                 Vfront    3 Vsync   6 Vback  14 Vpol N
    Manufacturer-Specified Display Descriptor (0x0f): 00 0f 00 81 0a 3c 81 0a 32 14 01 00 06 af 14 36 '.....<..2......6'
    Alphanumeric Data String: 'B121EW03 V6 '
Checksum: 0xaa

----------------

Failures:

Block 0, Base EDID:
  Alphanumeric Data String: One or more trailing spaces.
  Missing Display Product Name.
  Missing Display Range Limits Descriptor.

EDID conformity: FAIL
