edid-decode (hex):

00 ff ff ff ff ff ff 00 22 58 00 00 e7 05 00 00
29 1d 01 03 80 5f 36 78 0a 8a 9d a4 55 52 9f 25
0e 47 4a ad cf 00 71 4f 81 40 81 80 81 00 95 00
b3 00 d1 c0 81 c0 02 3a 80 18 71 38 2d 40 58 2c
45 00 ba 88 21 00 00 1e 01 1d 00 72 51 d0 1e 20
6e 28 55 00 ba 88 21 00 00 1e 00 00 00 fc 00 34
33 48 34 30 33 30 0a 20 20 20 20 20 00 00 00 fd
00 17 4c 0f 51 0f 00 0a 20 20 20 20 20 20 01 0c

02 03 26 71 4a 90 22 20 05 04 3e 3c 02 01 06 2c
09 07 07 15 07 50 57 07 00 3d 07 c0 66 03 0c 00
10 00 80 e2 00 0f 02 3a 80 18 71 38 2d 40 58 2c
45 00 ba 88 21 00 00 1e 01 1d 80 18 71 1c 16 20
58 2c 25 00 ba 88 21 00 00 9e 01 1d 00 72 51 d0
1e 20 6e 28 55 00 ba 88 21 00 00 00 66 21 50 b0
51 00 1b 30 40 70 36 00 00 00 00 00 00 18 00 00
00 00 00 00 00 00 00 00 00 00 00 00 00 00 00 00

----------------

Block 0, Base EDID:
  EDID Structure Version & Revision: 1.3
  Vendor & Product Identification:
    Manufacturer: HRX
    Model: 0
    Serial Number: ...
    Made in: week 41 of 2019
  Basic Display Parameters & Features:
    Digital display
    Maximum image size: 95 cm x 54 cm
    Gamma: 2.20
    RGB color display
    First detailed timing is preferred timing
  Color Characteristics:
    Red  : 0.6425, 0.3320
    Green: 0.3222, 0.6230
    Blue : 0.1464, 0.0556
    White: 0.2802, 0.2900
  Established Timings I & II:
    IBM     :   720x400    70.082 Hz   9:5    31.467 kHz  28.320 MHz
    DMT 0x04:   640x480    59.940 Hz   4:3    31.469 kHz  25.175 MHz
    DMT 0x05:   640x480    72.809 Hz   4:3    37.861 kHz  31.500 MHz
    DMT 0x06:   640x480    75.000 Hz   4:3    37.500 kHz  31.500 MHz
    DMT 0x09:   800x600    60.317 Hz   4:3    37.879 kHz  40.000 MHz
    DMT 0x0a:   800x600    72.188 Hz   4:3    48.077 kHz  50.000 MHz
    DMT 0x0b:   800x600    75.000 Hz   4:3    46.875 kHz  49.500 MHz
    DMT 0x10:  1024x768    60.004 Hz   4:3    48.363 kHz  65.000 MHz
    DMT 0x11:  1024x768    70.069 Hz   4:3    56.476 kHz  75.000 MHz
    DMT 0x12:  1024x768    75.029 Hz   4:3    60.023 kHz  78.750 MHz
    DMT 0x24:  1280x1024   75.025 Hz   5:4    79.976 kHz 135.000 MHz
  Standard Timings:
    DMT 0x15:  1152x864    75.000 Hz   4:3    67.500 kHz 108.000 MHz
    DMT 0x20:  1280x960    60.000 Hz   4:3    60.000 kHz 108.000 MHz
    DMT 0x23:  1280x1024   60.020 Hz   5:4    63.981 kHz 108.000 MHz
    DMT 0x1c:  1280x800    59.810 Hz  16:10   49.702 kHz  83.500 MHz
    DMT 0x2f:  1440x900    59.887 Hz  16:10   55.935 kHz 106.500 MHz
    DMT 0x3a:  1680x1050   59.954 Hz  16:10   65.290 kHz 146.250 MHz
    DMT 0x52:  1920x1080   60.000 Hz  16:9    67.500 kHz 148.500 MHz
    DMT 0x55:  1280x720    60.000 Hz  16:9    45.000 kHz  74.250 MHz
  Detailed Timing Descriptors:
    DTD 1:  1920x1080   60.000 Hz  16:9    67.500 kHz 148.500 MHz (698 mm x 392 mm)
                 Hfront   88 Hsync  44 Hback 148 Hpol P
                 Vfront    4 Vsync   5 Vback  36 Vpol P
    DTD 2:  1280x720    60.000 Hz  16:9    45.000 kHz  74.250 MHz (698 mm x 392 mm)
                 Hfront  110 Hsync  40 Hback 220 Hpol P
                 Vfront    5 Vsync   5 Vback  20 Vpol P
    Display Product Name: '43H4030'
  Display Range Limits:
    Monitor ranges (GTF): 23-76 Hz V, 15-81 kHz H, max dotclock 150 MHz
  Extension blocks: 1
Checksum: 0xc

----------------

Block 1, CTA-861 Extension Block:
  Revision: 3
  Basic audio support
  Supports YCbCr 4:4:4
  Supports YCbCr 4:2:2
  Native detailed modes: 1
  Video Data Block:
    VIC  16:  1920x1080   60.000 Hz  16:9    67.500 kHz 148.500 MHz (native)
    VIC  34:  1920x1080   30.000 Hz  16:9    33.750 kHz  74.250 MHz
    VIC  32:  1920x1080   24.000 Hz  16:9    27.000 kHz  74.250 MHz
    VIC   5:  1920x1080i  60.000 Hz  16:9    33.750 kHz  74.250 MHz
    VIC   4:  1280x720    60.000 Hz  16:9    45.000 kHz  74.250 MHz
    VIC  62:  1280x720    30.000 Hz  16:9    22.500 kHz  74.250 MHz
    VIC  60:  1280x720    24.000 Hz  16:9    18.000 kHz  59.400 MHz
    VIC   2:   720x480    59.940 Hz   4:3    31.469 kHz  27.000 MHz
    VIC   1:   640x480    59.940 Hz   4:3    31.469 kHz  25.175 MHz
    VIC   6:  1440x480i   59.940 Hz   4:3    15.734 kHz  27.000 MHz
  Audio Data Block:
    Linear PCM:
      Max channels: 2
      Supported sample rates (kHz): 48 44.1 32
      Supported sample sizes (bits): 24 20 16
    AC-3:
      Max channels: 6
      Supported sample rates (kHz): 48 44.1 32
      Maximum bit rate: 640 kb/s
    Dolby Digital+:
      Max channels: 8
      Supported sample rates (kHz): 48 44.1 32
    DTS:
      Max channels: 6
      Supported sample rates (kHz): 48 44.1 32
      Maximum bit rate: 1536 kb/s
  Vendor-Specific Data Block (HDMI), OUI 00-0C-03:
    Source physical address: 1.0.0.0
    Supports_AI
  Video Capability Data Block:
    YCbCr quantization: No Data
    RGB quantization: No Data
    PT scan behavior: No Data
    IT scan behavior: IT video formats not supported
    CE scan behavior: Supports both over- and underscan
  Detailed Timing Descriptors:
    DTD 3:  1920x1080   60.000 Hz  16:9    67.500 kHz 148.500 MHz (698 mm x 392 mm)
                 Hfront   88 Hsync  44 Hback 148 Hpol P
                 Vfront    4 Vsync   5 Vback  36 Vpol P
    DTD 4:  1920x1080i  60.000 Hz  16:9    33.750 kHz  74.250 MHz (698 mm x 392 mm)
                 Hfront   88 Hsync  44 Hback 148 Hpol P
                 Vfront    2 Vsync   5 Vback  15 Vpol P Vfront +0.5 Odd Field
                 Vfront    2 Vsync   5 Vback  15 Vpol P Vback  +0.5 Even Field
    DTD 5:  1280x720    60.000 Hz  16:9    45.000 kHz  74.250 MHz (analog composite, sync-on-green, 698 mm x 392 mm)
                 Hfront  110 Hsync  40 Hback 220 Hpol N
                 Vfront    5 Vsync   5 Vback  20 Vpol N
    DTD 6:  1360x768    60.015 Hz  85:48   47.712 kHz  85.500 MHz
                 Hfront   64 Hsync 112 Hback 256 Hpol N
                 Vfront    3 Vsync   6 Vback  18 Vpol N
Checksum: 0x0

----------------

Warnings:

Block 1, CTA-861 Extension Block:
  Video Capability Data Block: Set Selectable RGB Quantization to avoid interop issues.

Failures:

Block 0, Base EDID:
  Detailed Timing Descriptor #1: Mismatch of image size 698x392 mm vs display size 950x540 mm.
  Detailed Timing Descriptor #2: Mismatch of image size 698x392 mm vs display size 950x540 mm.
Block 1, CTA-861 Extension Block:
  Detailed Timing Descriptor #3: Mismatch of image size 698x392 mm vs display size 950x540 mm.
  Detailed Timing Descriptor #4: Mismatch of image size 698x392 mm vs display size 950x540 mm.
  Detailed Timing Descriptor #5: Mismatch of image size 698x392 mm vs display size 950x540 mm.
  Detailed Timing Descriptor #6: Mismatch of image size vs display size: image size is not set, but display size is.

EDID conformity: FAIL
