edid-decode (hex):

00 ff ff ff ff ff ff 00 38 a3 48 69 00 00 00 00
15 18 01 04 b5 3c 22 78 e2 ef 95 a3 54 35 b5 26
0f 50 54 bf ef 80 81 c0 81 80 90 40 8b c0 95 00
a9 c0 a9 40 d1 c0 56 5e 00 a0 a0 a0 29 50 30 20
35 00 54 4f 21 00 00 1a 00 00 00 fd 00 32 55 1f
a0 19 00 0a 20 20 20 20 20 20 00 00 00 fc 00 50
41 32 37 32 57 0a 20 20 20 20 20 20 00 00 00 ff
00 34 35 31 30 35 38 32 32 54 57 0a 20 20 01 2b

10 01 05 00 00 e7 31 00 a0 50 a0 29 50 30 20 3a
00 2a 4f 11 00 00 1c 51 31 a0 a0 50 00 25 50 30
20 3a 00 4f 2a 11 00 00 1c f3 39 80 18 71 38 2d
40 58 2c 45 00 54 4f 21 00 00 1e 02 3a 80 d0 72
38 2d 40 10 2c 45 80 54 4f 21 00 00 1e 28 3c 80
a0 70 b0 23 40 30 20 36 00 54 4f 21 00 00 1c 00
00 00 00 00 00 00 00 00 00 00 00 00 00 00 00 00
00 00 00 00 00 00 00 00 00 00 00 00 00 00 00 6a

00 ff ff ff ff ff ff 00 38 a3 48 69 00 00 00 00
15 18 01 04 b5 3c 22 78 e2 ef 95 a3 54 35 b5 26
0f 50 54 bf ef 80 81 c0 81 80 90 40 8b c0 95 00
a9 c0 a9 40 d1 c0 56 5e 00 a0 a0 a0 29 50 30 20
35 00 54 4f 21 00 00 1a 00 00 00 fd 00 32 55 1f
a0 19 00 0a 20 20 20 20 20 20 00 00 00 fc 00 50
41 32 37 32 57 0a 20 20 20 20 20 20 00 00 00 ff
00 34 35 31 30 35 38 32 32 54 57 0a 20 20 01 2b

10 01 05 00 00 e7 31 00 a0 50 a0 29 50 30 20 3a
00 2a 4f 11 00 00 1c 51 31 a0 a0 50 00 25 50 30
20 3a 00 4f 2a 11 00 00 1c f3 39 80 18 71 38 2d
40 58 2c 45 00 54 4f 21 00 00 1e 02 3a 80 d0 72
38 2d 40 10 2c 45 80 54 4f 21 00 00 1e 28 3c 80
a0 70 b0 23 40 30 20 36 00 54 4f 21 00 00 1c 00
00 00 00 00 00 00 00 00 00 00 00 00 00 00 00 00
00 00 00 00 00 00 00 00 00 00 00 00 00 00 00 6a

----------------

Block 0, Base EDID:
  EDID Structure Version & Revision: 1.4
  Vendor & Product Identification:
    Manufacturer: NEC
    Model: 26952
    Made in: week 21 of 2014
  Basic Display Parameters & Features:
    Digital display
    Bits per primary color channel: 10
    DisplayPort interface
    Maximum image size: 60 cm x 34 cm
    Gamma: 2.20
    DPMS levels: Standby Suspend Off
    Supported color formats: RGB 4:4:4
    First detailed timing includes the native pixel format and preferred refresh rate
  Color Characteristics:
    Red  : 0.6396, 0.3300
    Green: 0.2099, 0.7099
    Blue : 0.1503, 0.0595
    White: 0.3134, 0.3291
  Established Timings I & II:
    IBM     :   720x400    70.081663 Hz   9:5     31.467 kHz     28.320000 MHz
    DMT 0x04:   640x480    59.940476 Hz   4:3     31.469 kHz     25.175000 MHz
    Apple   :   640x480    66.666667 Hz   4:3     35.000 kHz     30.240000 MHz
    DMT 0x05:   640x480    72.808802 Hz   4:3     37.861 kHz     31.500000 MHz
    DMT 0x06:   640x480    75.000000 Hz   4:3     37.500 kHz     31.500000 MHz
    DMT 0x08:   800x600    56.250000 Hz   4:3     35.156 kHz     36.000000 MHz
    DMT 0x09:   800x600    60.316541 Hz   4:3     37.879 kHz     40.000000 MHz
    DMT 0x0a:   800x600    72.187572 Hz   4:3     48.077 kHz     50.000000 MHz
    DMT 0x0b:   800x600    75.000000 Hz   4:3     46.875 kHz     49.500000 MHz
    Apple   :   832x624    74.551266 Hz   4:3     49.726 kHz     57.284000 MHz
    DMT 0x10:  1024x768    60.003840 Hz   4:3     48.363 kHz     65.000000 MHz
    DMT 0x11:  1024x768    70.069359 Hz   4:3     56.476 kHz     75.000000 MHz
    DMT 0x12:  1024x768    75.028582 Hz   4:3     60.023 kHz     78.750000 MHz
    DMT 0x24:  1280x1024   75.024675 Hz   5:4     79.976 kHz    135.000000 MHz
    Apple   :  1152x870    75.061550 Hz 192:145   68.681 kHz    100.000000 MHz
  Standard Timings:
    DMT 0x55:  1280x720    60.000000 Hz  16:9     45.000 kHz     74.250000 MHz
    DMT 0x23:  1280x1024   60.019740 Hz   5:4     63.981 kHz    108.000000 MHz
    DMT 0x2a:  1400x1050   59.978442 Hz   4:3     65.317 kHz    121.750000 MHz
    GTF     :  1360x765    60.000341 Hz  16:9     47.520 kHz     84.396000 MHz
    DMT 0x2f:  1440x900    59.887445 Hz  16:10    55.935 kHz    106.500000 MHz
    DMT 0x53:  1600x900    60.000000 Hz  16:9     60.000 kHz    108.000000 MHz (RB)
    DMT 0x33:  1600x1200   60.000000 Hz   4:3     75.000 kHz    162.000000 MHz
    DMT 0x52:  1920x1080   60.000000 Hz  16:9     67.500 kHz    148.500000 MHz
  Detailed Timing Descriptors:
    DTD 1:  2560x1440   59.950550 Hz  16:9     88.787 kHz    241.500000 MHz (596 mm x 335 mm)
                 Hfront   48 Hsync  32 Hback   80 Hpol P
                 Vfront    3 Vsync   5 Vback   33 Vpol N
    Display Range Limits:
      Monitor ranges (GTF): 50-85 Hz V, 31-160 kHz H, max dotclock 250 MHz
    Display Product Name: 'PA272W'
    Display Product Serial Number: ...
  Extension blocks: 1
Checksum: 0x2b

----------------

Block 1, Video Timing Extension Block:
  Version: 1
  Detailed Timing Descriptors:
    DTD:  1280x1440   59.902281 Hz   8:9     88.715 kHz    127.750000 MHz (298 mm x 335 mm)
               Hfront   48 Hsync  32 Hback   80 Hpol N
               Vfront    3 Vsync  10 Vback   28 Vpol P
    DTD:  1440x1280   59.913629 Hz   9:8     78.906 kHz    126.250000 MHz (335 mm x 298 mm)
               Hfront   48 Hsync  32 Hback   80 Hpol N
               Vfront    3 Vsync  10 Vback   24 Vpol P
    DTD:  1920x1080   59.939394 Hz  16:9     67.432 kHz    148.350000 MHz (596 mm x 335 mm)
               Hfront   88 Hsync  44 Hback  148 Hpol P
               Vfront    4 Vsync   5 Vback   36 Vpol P
    DTD:  1920x1080   50.000000 Hz  16:9     56.250 kHz    148.500000 MHz (596 mm x 335 mm)
               Hfront  528 Hsync  44 Hback  148 Hpol P
               Vfront    4 Vsync   5 Vback   36 Vpol P
    DTD:  1920x1200   59.950171 Hz  16:10    74.038 kHz    154.000000 MHz (596 mm x 335 mm)
               Hfront   48 Hsync  32 Hback   80 Hpol N
               Vfront    3 Vsync   6 Vback   26 Vpol P
Checksum: 0x6a  Unused space in Extension Block: 32 bytes

----------------

Block 2, Unknown EDID Extension Block 0x00:
  00 ff ff ff ff ff ff 00 38 a3 48 69 00 00 00 00 '........8.Hi....'
  15 18 01 04 b5 3c 22 78 e2 ef 95 a3 54 35 b5 26 '.....<"x....T5.&'
  0f 50 54 bf ef 80 81 c0 81 80 90 40 8b c0 95 00 '.PT........@....'
  a9 c0 a9 40 d1 c0 56 5e 00 a0 a0 a0 29 50 30 20 '...@..V^....)P0 '
  35 00 54 4f 21 00 00 1a 00 00 00 fd 00 32 55 1f '5.TO!........2U.'
  a0 19 00 0a 20 20 20 20 20 20 00 00 00 fc 00 50 '....      .....P'
  41 32 37 32 57 0a 20 20 20 20 20 20 00 00 00 ff 'A272W.      ....'
  00 34 35 31 30 35 38 32 32 54 57 0a 20 20 01 2b '.45105822TW.  .+'
Checksum: 0x2b

----------------

Block 3, Video Timing Extension Block:
  Version: 1
  Detailed Timing Descriptors:
    DTD:  1280x1440   59.902281 Hz   8:9     88.715 kHz    127.750000 MHz (298 mm x 335 mm)
               Hfront   48 Hsync  32 Hback   80 Hpol N
               Vfront    3 Vsync  10 Vback   28 Vpol P
    DTD:  1440x1280   59.913629 Hz   9:8     78.906 kHz    126.250000 MHz (335 mm x 298 mm)
               Hfront   48 Hsync  32 Hback   80 Hpol N
               Vfront    3 Vsync  10 Vback   24 Vpol P
    DTD:  1920x1080   59.939394 Hz  16:9     67.432 kHz    148.350000 MHz (596 mm x 335 mm)
               Hfront   88 Hsync  44 Hback  148 Hpol P
               Vfront    4 Vsync   5 Vback   36 Vpol P
    DTD:  1920x1080   50.000000 Hz  16:9     56.250 kHz    148.500000 MHz (596 mm x 335 mm)
               Hfront  528 Hsync  44 Hback  148 Hpol P
               Vfront    4 Vsync   5 Vback   36 Vpol P
    DTD:  1920x1200   59.950171 Hz  16:10    74.038 kHz    154.000000 MHz (596 mm x 335 mm)
               Hfront   48 Hsync  32 Hback   80 Hpol N
               Vfront    3 Vsync   6 Vback   26 Vpol P
Checksum: 0x6a  Unused space in Extension Block: 32 bytes

----------------

Warnings:

Block 0, Base EDID:
  Standard Timings: Standard Timing 1360x765 has a dubious odd vertical resolution.
  Display Range Limits: GTF support is deprecated in EDID 1.4.
Block 1, Video Timing Extension Block:
  Detailed Timing Descriptor #1: DTD is similar but not identical to DMT 0x44.
Block 3, Video Timing Extension Block:
  Detailed Timing Descriptor #1: DTD is similar but not identical to DMT 0x44.

Failures:

Block 0, Base EDID:
  Display Range Limits: GTF can't be combined with non-continuous frequencies.
Block 1, Video Timing Extension Block:
  Detailed Timing Descriptor #1: Mismatch of image size 335x298 mm vs display size 600x340 mm.
Block 2, Base EDID:
  Unknown Extension Block.
Block 3, Video Timing Extension Block:
  Detailed Timing Descriptor #1: Mismatch of image size 335x298 mm vs display size 600x340 mm.
EDID:
  Base EDID: EDID specified 1 extension block(s), but found 3 extension block(s).

EDID conformity: FAIL
