edid-decode (hex):

00 ff ff ff ff ff ff 00 06 af 2d 58 00 00 00 00
00 1c 01 04 a5 1d 11 78 02 ee 95 a3 54 4c 99 26
0f 50 54 00 00 00 01 01 01 01 01 01 01 01 01 01
01 01 01 01 01 01 b4 37 80 a0 70 38 3e 40 3a 2a
35 00 25 a5 10 00 00 18 b4 37 80 a0 70 38 5c 41
3a 2a 35 00 25 a5 10 00 00 18 00 00 00 fe 00 41
55 4f 0a 20 20 20 20 20 20 20 20 20 00 00 00 fe
00 42 31 33 33 48 41 4e 30 35 2e 38 20 0a 00 cf

----------------

Block 0, Base EDID:
  EDID Structure Version & Revision: 1.4
  Vendor & Product Identification:
    Manufacturer: AUO
    Model: 22573
    Made in: 2018
  Basic Display Parameters & Features:
    Digital display
    Bits per primary color channel: 8
    DisplayPort interface
    Maximum image size: 29 cm x 17 cm
    Gamma: 2.20
    Supported color formats: RGB 4:4:4
    First detailed timing includes the native pixel format and preferred refresh rate
  Color Characteristics:
    Red  : 0.6396, 0.3300
    Green: 0.2998, 0.5996
    Blue : 0.1503, 0.0595
    White: 0.3134, 0.3291
  Established Timings I & II: none
  Standard Timings: none
  Detailed Timing Descriptors:
    DTD 1:  1920x1080   60.033 Hz  16:9    68.558 kHz 142.600 MHz (293 mm x 165 mm)
                 Hfront   58 Hsync  42 Hback  60 Hpol N
                 Vfront    3 Vsync   5 Vback  54 Vpol N
    DTD 2:  1920x1080   48.010 Hz  16:9    68.558 kHz 142.600 MHz (293 mm x 165 mm)
                 Hfront   58 Hsync  42 Hback  60 Hpol N
                 Vfront    3 Vsync   5 Vback 340 Vpol N
    Alphanumeric Data String: 'AUO'
    Alphanumeric Data String: 'B133HAN05.8 '
Checksum: 0xcf

----------------

Failures:

Block 0, Base EDID:
  Alphanumeric Data String: One or more trailing spaces.
  Missing Display Product Name.

EDID conformity: FAIL
