edid-decode (hex):

00 ff ff ff ff ff ff 00 04 69 33 34 01 01 01 01
25 1a 01 03 80 50 21 78 0e ee 91 a3 54 4c 99 26
0f 50 54 21 08 00 01 01 01 01 01 01 01 01 01 01
01 01 01 01 01 01 9d 67 70 a0 d0 a0 22 50 30 20
3a 00 1d 4d 31 00 00 1a 00 00 00 ff 00 47 39 4c
4d 51 53 30 34 31 30 32 35 0a 00 00 00 fd 00 18
3c 1e 8c 1e 01 0a 20 20 20 20 20 20 00 00 00 fc
00 52 4f 47 20 50 47 33 34 38 51 0a 20 20 01 26

02 03 1a c1 47 90 1f 04 13 03 12 01 23 09 07 01
83 01 00 00 65 03 0c 00 10 00 00 00 00 00 00 00
00 00 00 00 00 00 00 00 00 00 00 00 00 00 00 00
00 00 00 00 00 00 00 00 00 00 00 00 00 00 00 00
00 00 00 00 00 00 00 00 00 00 00 00 00 00 00 00
00 00 00 00 00 00 00 00 00 00 00 00 00 00 00 00
00 00 00 00 00 00 00 00 00 00 00 00 00 00 00 00
00 00 00 00 00 00 00 00 00 00 00 00 00 00 00 c1

----------------

Block 0, Base EDID:
  EDID Structure Version & Revision: 1.3
  Vendor & Product Identification:
    Manufacturer: ACI
    Model: 13363
    Serial Number: ...
    Made in: week 37 of 2016
  Basic Display Parameters & Features:
    Digital display
    Maximum image size: 80 cm x 33 cm
    Gamma: 2.20
    RGB color display
    Default (sRGB) color space is primary color space
    First detailed timing is preferred timing
  Color Characteristics:
    Red  : 0.6396, 0.3300
    Green: 0.2998, 0.5996
    Blue : 0.1503, 0.0595
    White: 0.3125, 0.3291
  Established Timings I & II:
    DMT 0x04:   640x480    59.940 Hz   4:3    31.469 kHz  25.175 MHz
    DMT 0x09:   800x600    60.317 Hz   4:3    37.879 kHz  40.000 MHz
    DMT 0x10:  1024x768    60.004 Hz   4:3    48.363 kHz  65.000 MHz
  Standard Timings: none
  Detailed Timing Descriptors:
    DTD 1:  3440x1440   49.987 Hz  43:18   73.681 kHz 265.250 MHz (797 mm x 333 mm)
                 Hfront   48 Hsync  32 Hback  80 Hpol P
                 Vfront    3 Vsync  10 Vback  21 Vpol N
    Display Product Serial Number: ...
  Display Range Limits:
    Monitor ranges (Bare Limits): 24-60 Hz V, 30-140 kHz H, max dotclock 300 MHz
    Display Product Name: 'ROG PG348Q'
  Extension blocks: 1
Checksum: 0x26

----------------

Block 1, CTA-861 Extension Block:
  Revision: 3
  Underscans PC formats by default
  Basic audio support
  Native detailed modes: 1
  Video Data Block:
    VIC  16:  1920x1080   60.000 Hz  16:9    67.500 kHz 148.500 MHz (native)
    VIC  31:  1920x1080   50.000 Hz  16:9    56.250 kHz 148.500 MHz
    VIC   4:  1280x720    60.000 Hz  16:9    45.000 kHz  74.250 MHz
    VIC  19:  1280x720    50.000 Hz  16:9    37.500 kHz  74.250 MHz
    VIC   3:   720x480    59.940 Hz  16:9    31.469 kHz  27.000 MHz
    VIC  18:   720x576    50.000 Hz  16:9    31.250 kHz  27.000 MHz
    VIC   1:   640x480    59.940 Hz   4:3    31.469 kHz  25.175 MHz
  Audio Data Block:
    Linear PCM:
      Max channels: 2
      Supported sample rates (kHz): 48 44.1 32
      Supported sample sizes (bits): 16
  Speaker Allocation Data Block:
    FL/FR - Front Left/Right
  Vendor-Specific Data Block (HDMI), OUI 00-0C-03:
    Source physical address: 1.0.0.0
Checksum: 0xc1

----------------

Warnings:

Block 1, CTA-861 Extension Block:
  Display Product Serial Number is set, so the Serial Number in the Base EDID should be 0.

Failures:

Block 0, Base EDID:
  Display Range Limits: 'Bare Limits' is not allowed for EDID < 1.4.

EDID conformity: FAIL
