edid-decode (hex):

00 ff ff ff ff ff ff 00 0d ae 67 13 00 00 00 00
24 19 01 04 a5 1d 11 78 02 87 85 a4 57 50 9b 27
0d 50 54 00 00 00 01 01 01 01 01 01 01 01 01 01
01 01 01 01 01 01 36 36 80 a0 70 38 20 40 2e 1e
24 00 25 a5 10 00 00 18 00 00 00 fe 00 4e 31 33
33 48 43 45 2d 47 50 31 0a 20 00 00 00 fe 00 43
4d 4e 0a 20 20 20 20 20 20 20 20 20 00 00 00 fe
00 4e 31 33 33 48 43 45 2d 47 50 31 0a 20 00 c8

----------------

Block 0, Base EDID:
  EDID Structure Version & Revision: 1.4
  Vendor & Product Identification:
    Manufacturer: CMN
    Model: 4967
    Made in: week 36 of 2015
  Basic Display Parameters & Features:
    Digital display
    Bits per primary color channel: 8
    DisplayPort interface
    Maximum image size: 29 cm x 17 cm
    Gamma: 2.20
    Supported color formats: RGB 4:4:4
    First detailed timing includes the native pixel format and preferred refresh rate
  Color Characteristics:
    Red  : 0.6425, 0.3398
    Green: 0.3134, 0.6083
    Blue : 0.1542, 0.0507
    White: 0.3134, 0.3291
  Established Timings I & II: none
  Standard Timings: none
  Detailed Timing Descriptors:
    DTD 1:  1920x1080   60.001 Hz  16:9    66.721 kHz 138.780 MHz (293 mm x 165 mm)
                 Hfront   46 Hsync  30 Hback  84 Hpol N
                 Vfront    2 Vsync   4 Vback  26 Vpol N
    Alphanumeric Data String: 'N133HCE-GP1'
    Alphanumeric Data String: 'CMN'
    Alphanumeric Data String: 'N133HCE-GP1'
Checksum: 0xc8

----------------

Failures:

Block 0, Base EDID:
  Missing Display Product Name.

EDID conformity: FAIL
