
EDID (hex):
00ffffffffffff000daf281000000000
3014010490160c7802e6c19557539127
25505400000001010101010101010101
0101010101019e1b5681500014301730
3800de7d0000001a9e1b568150001430
17303800de7d0000001a000000fe0032
33344652803130314247450a00000000
00004101970000000001010a202000b8

Extracted contents:
header:          00 ff ff ff ff ff ff 00
serial number:   0d af 28 10 00 00 00 00 30 14
version:         01 04
basic params:    90 16 0c 78 02
chroma info:     e6 c1 95 57 53 91 27 25 50 54
established:     00 00 00
standard:        01 01 01 01 01 01 01 01 01 01 01 01 01 01 01 01
descriptor 1:    9e 1b 56 81 50 00 14 30 17 30 38 00 de 7d 00 00 00 1a
descriptor 2:    9e 1b 56 81 50 00 14 30 17 30 38 00 de 7d 00 00 00 1a
descriptor 3:    00 00 00 fe 00 32 33 34 46 52 80 31 30 31 42 47 45 0a
descriptor 4:    00 00 00 00 00 00 41 01 97 00 00 00 00 01 01 0a 20 20
extensions:      00
checksum:        b8

EDID version: 1.4
Manufacturer: CMO Model 1028 Serial Number --
Made in week 48 of 2010
Digital display
6 bits per primary color channel
Digital interface is not defined
Maximum image size: 22 cm x 12 cm
Gamma: 2.20
Supported color formats: RGB 4:4:4
First detailed timing includes the native pixel format and preferred refresh rate
Display x,y Chromaticity:
  Red:   0.5849, 0.3417
  Green: 0.3251, 0.5683
  Blue:  0.1552, 0.1445
  White: 0.3125, 0.3291
Established timings supported:
Standard timings supported:
Detailed mode: Clock 70.700 MHz, 222 mm x 125 mm
               1366 1389 1437 1495 hborder 0
                768  771  779  788 vborder 0
               +hsync -vsync 
               VertFreq: 60 Hz, HorFreq: 47290 Hz
Detailed mode: Clock 70.700 MHz, 222 mm x 125 mm
               1366 1389 1437 1495 hborder 0
                768  771  779  788 vborder 0
               +hsync -vsync 
               VertFreq: 60 Hz, HorFreq: 47290 Hz
ASCII string: 234FR
Manufacturer-specified data, tag 0
Checksum: 0xb8 (valid)
EDID block does NOT conform to EDID 1.4!
	Missing name descriptor
	Missing monitor ranges
	Detailed block string not properly terminated
