
EDID (hex):
00ffffffffffff001e6d945678490300
0b120103e0342078ea5ad5a7564b9b24
135054a54b00a940818fb300814f8180
010101010101283c80a070b023403020
360006442100001a483f403062b03240
40c0130006442100001e000000fd0038
4b1e5311000a202020202020000000fc
0057323435320a2020202020202000b7

Extracted contents:
header:          00 ff ff ff ff ff ff 00
serial number:   1e 6d 94 56 78 49 03 00 0b 12
version:         01 03
basic params:    e0 34 20 78 ea
chroma info:     5a d5 a7 56 4b 9b 24 13 50 54
established:     a5 4b 00
standard:        a9 40 81 8f b3 00 81 4f 81 80 01 01 01 01 01 01
descriptor 1:    28 3c 80 a0 70 b0 23 40 30 20 36 00 06 44 21 00 00 1a
descriptor 2:    48 3f 40 30 62 b0 32 40 40 c0 13 00 06 44 21 00 00 1e
descriptor 3:    00 00 00 fd 00 38 4b 1e 53 11 00 0a 20 20 20 20 20 20
descriptor 4:    00 00 00 fc 00 57 32 34 35 32 0a 20 20 20 20 20 20 20
extensions:      00
checksum:        b7

EDID version: 1.3
Manufacturer: GSM Model 5694 Serial Number --
Made in week 11 of 2008
Digital display
Maximum image size: 52 cm x 32 cm
Gamma: 2.20
DPMS levels: Standby Suspend Off
RGB color display
First detailed timing is preferred timing
Display x,y Chromaticity:
  Red:   0.6533, 0.3369
  Green: 0.2949, 0.6074
  Blue:  0.1435, 0.0751
  White: 0.3134, 0.3291
Established timings supported:
  720x400@70Hz 9:5 HorFreq: 31469 Hz Clock: 28.320 MHz
  640x480@60Hz 4:3 HorFreq: 31469 Hz Clock: 25.175 MHz
  640x480@75Hz 4:3 HorFreq: 37500 Hz Clock: 31.500 MHz
  800x600@60Hz 4:3 HorFreq: 37900 Hz Clock: 40.000 MHz
  800x600@75Hz 4:3 HorFreq: 46900 Hz Clock: 49.500 MHz
  1024x768@60Hz 4:3 HorFreq: 48400 Hz Clock: 65.000 MHz
  1024x768@75Hz 4:3 HorFreq: 60000 Hz Clock: 78.750 MHz
  1280x1024@75Hz 5:4 HorFreq: 80000 Hz Clock: 135.000 MHz
Standard timings supported:
  1600x1200@60Hz 4:3 HorFreq: 75000 Hz Clock: 162.000 MHz
  1280x1024@75Hz 5:4 HorFreq: 80000 Hz Clock: 135.000 MHz
  1680x1050@60Hz 16:10 HorFreq: 64700 Hz Clock: 119.000 MHz
  1280x960@75Hz 4:3
  1280x1024@60Hz 5:4 HorFreq: 64000 Hz Clock: 108.000 MHz
Detailed mode: Clock 154.000 MHz, 518 mm x 324 mm
               1920 1968 2000 2080 hborder 0
               1200 1203 1209 1235 vborder 0
               +hsync -vsync 
               VertFreq: 59 Hz, HorFreq: 74038 Hz
Detailed mode: Clock 162.000 MHz, 518 mm x 324 mm
               1600 1664 1856 2160 hborder 0
               1200 1201 1204 1250 vborder 0
               +hsync +vsync 
               VertFreq: 60 Hz, HorFreq: 75000 Hz
Monitor ranges (GTF): 56-75Hz V, 30-83kHz H, max dotclock 170MHz
Monitor name: W2452
Checksum: 0xb7 (valid)
EDID block does NOT conform to EDID 1.3!
	Digital display field contains garbage: 60
