edid-decode (hex):

00 ff ff ff ff ff ff 00 1e 6d 94 56 11 e7 01 00
06 12 01 03 e0 34 20 78 ea 5a d5 a7 56 4b 9b 24
13 50 54 a5 4b 00 a9 40 81 8f b3 00 81 4f 81 80
01 01 01 01 01 01 28 3c 80 a0 70 b0 23 40 30 20
36 00 06 44 21 00 00 1a 48 3f 40 30 62 b0 32 40
40 c0 13 00 06 44 21 00 00 1e 00 00 00 fd 00 38
4b 1e 53 11 00 0a 20 20 20 20 20 20 00 00 00 fc
00 57 32 34 35 32 0a 20 20 20 20 20 20 20 00 87

----------------

Block 0, Base EDID:
  EDID Structure Version & Revision: 1.3
  Vendor & Product Identification:
    Manufacturer: GSM
    Model: 22164
    Serial Number: ...
    Made in: week 6 of 2008
  Basic Display Parameters & Features:
    Digital display
    Maximum image size: 52 cm x 32 cm
    Gamma: 2.20
    DPMS levels: Standby Suspend Off
    RGB color display
    First detailed timing is the preferred timing
  Color Characteristics:
    Red  : 0.6533, 0.3369
    Green: 0.2949, 0.6074
    Blue : 0.1435, 0.0751
    White: 0.3134, 0.3291
  Established Timings I & II:
    IBM     :   720x400    70.082 Hz   9:5    31.467 kHz  28.320 MHz
    DMT 0x04:   640x480    59.940 Hz   4:3    31.469 kHz  25.175 MHz
    DMT 0x06:   640x480    75.000 Hz   4:3    37.500 kHz  31.500 MHz
    DMT 0x09:   800x600    60.317 Hz   4:3    37.879 kHz  40.000 MHz
    DMT 0x0b:   800x600    75.000 Hz   4:3    46.875 kHz  49.500 MHz
    DMT 0x10:  1024x768    60.004 Hz   4:3    48.363 kHz  65.000 MHz
    DMT 0x12:  1024x768    75.029 Hz   4:3    60.023 kHz  78.750 MHz
    DMT 0x24:  1280x1024   75.025 Hz   5:4    79.976 kHz 135.000 MHz
  Standard Timings:
    DMT 0x33:  1600x1200   60.000 Hz   4:3    75.000 kHz 162.000 MHz
    DMT 0x24:  1280x1024   75.025 Hz   5:4    79.976 kHz 135.000 MHz
    DMT 0x3a:  1680x1050   59.954 Hz  16:10   65.290 kHz 146.250 MHz
    GTF     :  1280x960    75.000 Hz   4:3    75.150 kHz 129.859 MHz
    DMT 0x23:  1280x1024   60.020 Hz   5:4    63.981 kHz 108.000 MHz
  Detailed Timing Descriptors:
    DTD 1:  1920x1200   59.950 Hz   8:5    74.038 kHz 154.000 MHz (518 mm x 324 mm)
                 Hfront   48 Hsync  32 Hback  80 Hpol P
                 Vfront    3 Vsync   6 Vback  26 Vpol N
    DTD 2:  1600x1200   60.000 Hz   4:3    75.000 kHz 162.000 MHz (518 mm x 324 mm)
                 Hfront   64 Hsync 192 Hback 304 Hpol P
                 Vfront    1 Vsync   3 Vback  46 Vpol P
  Display Range Limits:
    Monitor ranges (GTF): 56-75 Hz V, 30-83 kHz H, max dotclock 170 MHz
    Display Product Name: 'W2452'
Checksum: 0x87

----------------

Failures:

Block 0, Base EDID:
  Basic Display Parameters & Features: Digital Video Interface Standard set to reserved value 0x60.

EDID conformity: FAIL
