edid-decode (hex):

00 ff ff ff ff ff ff 00 30 e4 04 04 00 00 00 00
00 17 01 04 95 1c 10 78 0a 10 a5 96 58 57 8f 28
20 50 54 00 00 00 01 01 01 01 01 01 01 01 01 01
01 01 01 01 01 01 ce 1d 56 d4 50 00 26 30 30 20
25 00 15 9c 10 00 00 1b df 13 56 d4 50 00 26 30
30 20 25 00 15 9c 10 00 00 1b 00 00 00 00 00 00
00 00 00 00 00 00 00 00 00 00 00 00 00 00 00 02
00 0a 38 ff 0a 3c 96 0f 11 1d 96 00 00 00 00 f5

----------------

Block 0, Base EDID:
  EDID Structure Version & Revision: 1.4
  Vendor & Product Identification:
    Manufacturer: LGD
    Model: 1028
    Made in: 2013
  Basic Display Parameters & Features:
    Digital display
    Bits per primary color channel: 6
    DisplayPort interface
    Maximum image size: 28 cm x 16 cm
    Gamma: 2.20
    Supported color formats: RGB 4:4:4, YCrCb 4:4:4
    First detailed timing includes the native pixel format and preferred refresh rate
  Color Characteristics:
    Red  : 0.5859, 0.3447
    Green: 0.3398, 0.5585
    Blue : 0.1582, 0.1269
    White: 0.3134, 0.3291
  Established Timings I & II: none
  Standard Timings: none
  Detailed Timing Descriptors:
    DTD 1:  1366x768    59.991 Hz 683:384  48.352 kHz  76.300 MHz (277 mm x 156 mm)
                 Hfront   48 Hsync  32 Hback 132 Hpol P
                 Vfront    2 Vsync   5 Vback  31 Vpol N
    DTD 2:  1366x768    39.996 Hz 683:384  32.237 kHz  50.870 MHz (277 mm x 156 mm)
                 Hfront   48 Hsync  32 Hback 132 Hpol P
                 Vfront    2 Vsync   5 Vback  31 Vpol N
    Empty Descriptor
    Manufacturer-Specified Display Descriptor (0x02): 00 02 00 0a 38 ff 0a 3c 96 0f 11 1d 96 00 00 00 '....8..<........'
Checksum: 0xf5

----------------

Failures:

Block 0, Base EDID:
  Empty Descriptor: Use Dummy Descriptor instead of all zeroes.
  Missing Display Product Name.

EDID conformity: FAIL
