edid-decode (hex):

00 ff ff ff ff ff ff 00 04 72 2b 06 01 00 00 00
07 1b 01 04 b5 79 44 78 3a 27 70 a3 55 4d 9b 25
0e 49 4b bf ef 80 d1 c0 b3 00 95 00 81 80 81 40
81 00 81 c0 71 4f 4d d0 00 a0 f0 70 3e 80 30 20
35 00 ba a8 42 00 00 1e 28 68 00 a0 f0 70 3e 80
08 90 65 0c ba a8 42 00 00 1a 00 00 00 fd 00 17
4c 0f 88 3c 00 0a 20 20 20 20 20 20 00 00 00 fc
00 45 42 35 35 30 4b 0a 20 20 20 20 20 20 01 23

02 03 21 71 4c 61 5f 5e 5d 10 05 04 03 02 01 07
06 23 09 07 07 83 01 00 00 67 b9 14 00 04 00 38
78 08 e8 00 30 f2 70 5a 80 b0 58 8a 00 ba a8 42
00 00 1e 04 74 00 30 f2 70 5a 80 b0 58 8a 00 ba
a8 42 00 00 1e 02 3a 80 18 71 38 2d 40 58 2c 45
00 ba a8 42 00 00 1e 00 00 00 00 00 00 00 00 00
00 00 00 00 00 00 00 00 00 00 00 00 00 00 00 00
00 00 00 00 00 00 00 00 00 00 00 00 00 00 00 73

----------------

Block 0, Base EDID:
  EDID Structure Version & Revision: 1.4
  Vendor & Product Identification:
    Manufacturer: ACR
    Model: 1579
    Serial Number: ...
    Made in: week 7 of 2017
  Basic Display Parameters & Features:
    Digital display
    Bits per primary color channel: 10
    DisplayPort interface
    Maximum image size: 121 cm x 68 cm
    Gamma: 2.20
    DPMS levels: Off
    Supported color formats: RGB 4:4:4, YCrCb 4:4:4, YCrCb 4:2:2
    First detailed timing includes the native pixel format and preferred refresh rate
  Color Characteristics:
    Red  : 0.6367, 0.3339
    Green: 0.3017, 0.6083
    Blue : 0.1455, 0.0576
    White: 0.2851, 0.2929
  Established Timings I & II:
    IBM     :   720x400    70.082 Hz   9:5    31.467 kHz  28.320 MHz
    DMT 0x04:   640x480    59.940 Hz   4:3    31.469 kHz  25.175 MHz
    Apple   :   640x480    66.667 Hz   4:3    35.000 kHz  30.240 MHz
    DMT 0x05:   640x480    72.809 Hz   4:3    37.861 kHz  31.500 MHz
    DMT 0x06:   640x480    75.000 Hz   4:3    37.500 kHz  31.500 MHz
    DMT 0x08:   800x600    56.250 Hz   4:3    35.156 kHz  36.000 MHz
    DMT 0x09:   800x600    60.317 Hz   4:3    37.879 kHz  40.000 MHz
    DMT 0x0a:   800x600    72.188 Hz   4:3    48.077 kHz  50.000 MHz
    DMT 0x0b:   800x600    75.000 Hz   4:3    46.875 kHz  49.500 MHz
    Apple   :   832x624    74.551 Hz   4:3    49.726 kHz  57.284 MHz
    DMT 0x10:  1024x768    60.004 Hz   4:3    48.363 kHz  65.000 MHz
    DMT 0x11:  1024x768    70.069 Hz   4:3    56.476 kHz  75.000 MHz
    DMT 0x12:  1024x768    75.029 Hz   4:3    60.023 kHz  78.750 MHz
    DMT 0x24:  1280x1024   75.025 Hz   5:4    79.976 kHz 135.000 MHz
    Apple   :  1152x870    75.062 Hz 192:145  68.681 kHz 100.000 MHz
  Standard Timings:
    DMT 0x52:  1920x1080   60.000 Hz  16:9    67.500 kHz 148.500 MHz
    DMT 0x3a:  1680x1050   59.954 Hz  16:10   65.290 kHz 146.250 MHz
    DMT 0x2f:  1440x900    59.887 Hz  16:10   55.935 kHz 106.500 MHz
    DMT 0x23:  1280x1024   60.020 Hz   5:4    63.981 kHz 108.000 MHz
    DMT 0x20:  1280x960    60.000 Hz   4:3    60.000 kHz 108.000 MHz
    DMT 0x1c:  1280x800    59.810 Hz  16:10   49.702 kHz  83.500 MHz
    DMT 0x55:  1280x720    60.000 Hz  16:9    45.000 kHz  74.250 MHz
    DMT 0x15:  1152x864    75.000 Hz   4:3    67.500 kHz 108.000 MHz
  Detailed Timing Descriptors:
    DTD 1:  3840x2160   59.997 Hz  16:9   133.312 kHz 533.250 MHz (1210 mm x 680 mm)
                 Hfront   48 Hsync  32 Hback  80 Hpol P
                 Vfront    3 Vsync   5 Vback  54 Vpol P
    DTD 2:  3840x2160   30.000 Hz  16:9    66.660 kHz 266.640 MHz (1210 mm x 680 mm)
                 Hfront    8 Hsync 144 Hback   8 Hpol P
                 Vfront   54 Vsync   5 Vback   3 Vpol N
  Display Range Limits:
    Monitor ranges (GTF): 23-76 Hz V, 15-136 kHz H, max dotclock 600 MHz
    Display Product Name: 'EB550K'
  Extension blocks: 1
Checksum: 0x23

----------------

Block 1, CTA-861 Extension Block:
  Revision: 3
  Basic audio support
  Supports YCbCr 4:4:4
  Supports YCbCr 4:2:2
  Native detailed modes: 1
  Video Data Block:
    VIC  97:  3840x2160   60.000 Hz  16:9   135.000 kHz 594.000 MHz
    VIC  95:  3840x2160   30.000 Hz  16:9    67.500 kHz 297.000 MHz
    VIC  94:  3840x2160   25.000 Hz  16:9    56.250 kHz 297.000 MHz
    VIC  93:  3840x2160   24.000 Hz  16:9    54.000 kHz 297.000 MHz
    VIC  16:  1920x1080   60.000 Hz  16:9    67.500 kHz 148.500 MHz
    VIC   5:  1920x1080i  60.000 Hz  16:9    33.750 kHz  74.250 MHz
    VIC   4:  1280x720    60.000 Hz  16:9    45.000 kHz  74.250 MHz
    VIC   3:   720x480    59.940 Hz  16:9    31.469 kHz  27.000 MHz
    VIC   2:   720x480    59.940 Hz   4:3    31.469 kHz  27.000 MHz
    VIC   1:   640x480    59.940 Hz   4:3    31.469 kHz  25.175 MHz
    VIC   7:  1440x480i   59.940 Hz  16:9    15.734 kHz  27.000 MHz
    VIC   6:  1440x480i   59.940 Hz   4:3    15.734 kHz  27.000 MHz
  Audio Data Block:
    Linear PCM:
      Max channels: 2
      Supported sample rates (kHz): 48 44.1 32
      Supported sample sizes (bits): 24 20 16
  Speaker Allocation Data Block:
    FL/FR - Front Left/Right
  Vendor-Specific Data Block (MSTAR), OUI 00-14-B9:
    04 00 38 78                                     '..8x'
  Detailed Timing Descriptors:
    DTD 3:  3840x2160   60.000 Hz  16:9   135.000 kHz 594.000 MHz (1210 mm x 680 mm)
                 Hfront  176 Hsync  88 Hback 296 Hpol P
                 Vfront    8 Vsync  10 Vback  72 Vpol P
    DTD 4:  3840x2160   30.000 Hz  16:9    67.500 kHz 297.000 MHz (1210 mm x 680 mm)
                 Hfront  176 Hsync  88 Hback 296 Hpol P
                 Vfront    8 Vsync  10 Vback  72 Vpol P
    DTD 5:  1920x1080   60.000 Hz  16:9    67.500 kHz 148.500 MHz (1210 mm x 680 mm)
                 Hfront   88 Hsync  44 Hback 148 Hpol P
                 Vfront    4 Vsync   5 Vback  36 Vpol P
Checksum: 0x73
