
EDID (hex):
00ffffffffffff000daf901500000000
1f130103802213780ad1f5935d599026
1d505400000001010101010101010101
010101010101601d56bc500026301e3f
4c0058c210000018000000fe004e3135
3642362d4c30440a2020000000fe0043
4d4f0a202020202020202020000000fe
004e31353642362d4c30440a2020004d

Extracted contents:
header:          00 ff ff ff ff ff ff 00
serial number:   0d af 90 15 00 00 00 00 1f 13
version:         01 03
basic params:    80 22 13 78 0a
chroma info:     d1 f5 93 5d 59 90 26 1d 50 54
established:     00 00 00
standard:        01 01 01 01 01 01 01 01 01 01 01 01 01 01 01 01
descriptor 1:    60 1d 56 bc 50 00 26 30 1e 3f 4c 00 58 c2 10 00 00 18
descriptor 2:    00 00 00 fe 00 4e 31 35 36 42 36 2d 4c 30 44 0a 20 20
descriptor 3:    00 00 00 fe 00 43 4d 4f 0a 20 20 20 20 20 20 20 20 20
descriptor 4:    00 00 00 fe 00 4e 31 35 36 42 36 2d 4c 30 44 0a 20 20
extensions:      00
checksum:        4d

EDID version: 1.3
Manufacturer: CMO Model 1590 Serial Number --
Made in week 31 of 2009
Digital display
Maximum image size: 34 cm x 19 cm
Gamma: 2.20
RGB color display
First detailed timing is preferred timing
Display x,y Chromaticity:
  Red:   0.5771, 0.3642
  Green: 0.3476, 0.5634
  Blue:  0.1513, 0.1162
  White: 0.3134, 0.3291
Established timings supported:
Standard timings supported:
Detailed mode: Clock 75.200 MHz, 344 mm x 194 mm
               1366 1396 1459 1554 hborder 0
                768  772  784  806 vborder 0
               -hsync -vsync 
               VertFreq: 60 Hz, HorFreq: 48391 Hz
ASCII string: N156B6-L0D
ASCII string: CMO
ASCII string: N156B6-L0D
Checksum: 0x4d (valid)
EDID block does NOT conform to EDID 1.3!
	Missing name descriptor
	Missing monitor ranges
