edid-decode (hex):

00 ff ff ff ff ff ff 00 63 18 01 00 00 00 00 00
01 19 01 03 80 00 00 00 0a d7 a5 a2 59 4a 96 24
14 50 54 a3 08 00 81 c0 01 01 01 01 01 01 01 01
01 01 01 01 01 01 7f 21 56 aa 51 00 1e 30 46 8f
33 00 3f 43 21 00 00 1e a9 1a 00 a0 50 00 16 30
30 20 37 00 3f 43 21 00 00 1a 00 00 00 fd 00 32
4c 1e 50 10 00 0a 20 20 20 20 20 20 00 00 00 fc
00 4c 45 44 54 56 0a 20 20 20 20 20 20 20 01 47

02 03 24 c4 50 90 10 04 03 04 02 04 01 1f 1f 13
13 13 13 13 20 23 09 07 07 66 03 0c 00 10 00 00
83 01 00 00 01 1d 00 bc 52 d0 1e 20 b8 28 55 40
c4 8e 21 00 00 1e 01 1d 00 72 51 d0 1e 20 6e 28
55 00 c4 8e 21 00 00 1e 01 1d 00 72 51 d0 1e 20
6e 28 55 00 13 8e 21 00 00 18 01 1d 00 72 51 d0
1e 20 6e 28 55 00 13 8e 21 00 00 18 00 00 00 00
00 00 00 00 00 00 00 00 00 00 00 00 00 00 00 fe

----------------

Block 0, Base EDID:
  EDID Structure Version & Revision: 1.3
  Vendor & Product Identification:
    Manufacturer: XXX
    Model: 1
    Made in: week 1 of 2015
  Basic Display Parameters & Features:
    Digital display
    Image size is variable
    Gamma: 1.00
    RGB color display
    First detailed timing is the preferred timing
  Color Characteristics:
    Red  : 0.6357, 0.3486
    Green: 0.2900, 0.5888
    Blue : 0.1425, 0.0800
    White: 0.3134, 0.3291
  Established Timings I & II:
    IBM     :   720x400    70.081663 Hz   9:5     31.467 kHz     28.320000 MHz
    DMT 0x04:   640x480    59.940476 Hz   4:3     31.469 kHz     25.175000 MHz
    DMT 0x08:   800x600    56.250000 Hz   4:3     35.156 kHz     36.000000 MHz
    DMT 0x09:   800x600    60.316541 Hz   4:3     37.879 kHz     40.000000 MHz
    DMT 0x10:  1024x768    60.003840 Hz   4:3     48.363 kHz     65.000000 MHz
  Standard Timings:
    DMT 0x55:  1280x720    60.000000 Hz  16:9     45.000 kHz     74.250000 MHz
  Detailed Timing Descriptors:
    DTD 1:  1366x768    59.964364 Hz 683:384   47.852 kHz     85.750000 MHz (575 mm x 323 mm)
                 Hfront   70 Hsync 143 Hback  213 Hpol P
                 Vfront    3 Vsync   3 Vback   24 Vpol P
    DTD 2:  1280x768    59.994726 Hz   5:3     47.396 kHz     68.250000 MHz (575 mm x 323 mm)
                 Hfront   48 Hsync  32 Hback   80 Hpol P
                 Vfront    3 Vsync   7 Vback   12 Vpol N
    Display Range Limits:
      Monitor ranges (GTF): 50-76 Hz V, 30-80 kHz H, max dotclock 160 MHz
    Display Product Name: 'LEDTV'
  Extension blocks: 1
Checksum: 0x47

----------------

Block 1, CTA-861 Extension Block:
  Revision: 3
  Underscans IT Video Formats by default
  Basic audio support
  Native detailed modes: 4
  Video Data Block:
    VIC  16:  1920x1080   60.000000 Hz  16:9     67.500 kHz    148.500000 MHz (native)
    VIC  16:  1920x1080   60.000000 Hz  16:9     67.500 kHz    148.500000 MHz
    VIC   4:  1280x720    60.000000 Hz  16:9     45.000 kHz     74.250000 MHz
    VIC   3:   720x480    59.940060 Hz  16:9     31.469 kHz     27.000000 MHz
    VIC   4:  1280x720    60.000000 Hz  16:9     45.000 kHz     74.250000 MHz
    VIC   2:   720x480    59.940060 Hz   4:3     31.469 kHz     27.000000 MHz
    VIC   4:  1280x720    60.000000 Hz  16:9     45.000 kHz     74.250000 MHz
    VIC   1:   640x480    59.940476 Hz   4:3     31.469 kHz     25.175000 MHz
    VIC  31:  1920x1080   50.000000 Hz  16:9     56.250 kHz    148.500000 MHz
    VIC  31:  1920x1080   50.000000 Hz  16:9     56.250 kHz    148.500000 MHz
    VIC  19:  1280x720    50.000000 Hz  16:9     37.500 kHz     74.250000 MHz
    VIC  19:  1280x720    50.000000 Hz  16:9     37.500 kHz     74.250000 MHz
    VIC  19:  1280x720    50.000000 Hz  16:9     37.500 kHz     74.250000 MHz
    VIC  19:  1280x720    50.000000 Hz  16:9     37.500 kHz     74.250000 MHz
    VIC  19:  1280x720    50.000000 Hz  16:9     37.500 kHz     74.250000 MHz
    VIC  32:  1920x1080   24.000000 Hz  16:9     27.000 kHz     74.250000 MHz
  Audio Data Block:
    Linear PCM:
      Max channels: 2
      Supported sample rates (kHz): 48 44.1 32
      Supported sample sizes (bits): 24 20 16
  Vendor-Specific Data Block (HDMI), OUI 00-0C-03:
    Source physical address: 1.0.0.0
  Speaker Allocation Data Block:
    FL/FR - Front Left/Right
  Detailed Timing Descriptors:
    DTD 3:  1280x720    50.000000 Hz  16:9     37.500 kHz     74.250000 MHz (708 mm x 398 mm)
                 Hfront  440 Hsync  40 Hback  220 Hpol P
                 Vfront    5 Vsync   5 Vback   20 Vpol P
    DTD 4:  1280x720    60.000000 Hz  16:9     45.000 kHz     74.250000 MHz (708 mm x 398 mm)
                 Hfront  110 Hsync  40 Hback  220 Hpol P
                 Vfront    5 Vsync   5 Vback   20 Vpol P
    DTD 5:  1280x720    60.000000 Hz  16:9     45.000 kHz     74.250000 MHz (531 mm x 398 mm)
                 Hfront  110 Hsync  40 Hback  220 Hpol N
                 Vfront    5 Vsync   5 Vback   20 Vpol N
    DTD 6:  1280x720    60.000000 Hz  16:9     45.000 kHz     74.250000 MHz (531 mm x 398 mm)
                 Hfront  110 Hsync  40 Hback  220 Hpol N
                 Vfront    5 Vsync   5 Vback   20 Vpol N
Checksum: 0xfe  Unused space in Extension Block: 19 bytes

----------------

Warnings:

Block 1, CTA-861 Extension Block:
  Detailed Timing Descriptor #5: DTD is similar but not identical to VIC 4.
  Detailed Timing Descriptor #6: DTD is similar but not identical to VIC 4.
  Add a Colorimetry Data Block with the sRGB colorimetry bit set to avoid interop issues.

Failures:

Block 1, CTA-861 Extension Block:
  Video Data Block: Duplicate VIC 16.
  Video Data Block: Duplicate VIC 4.
  Video Data Block: Duplicate VIC 31.
  Video Data Block: Duplicate VIC 19.
  Missing VCDB, needed for Set Selectable RGB Quantization to avoid interop issues.
EDID:
  Base EDID: Some timings are out of range of the Monitor Ranges:
    Vertical Freq: 24.000 - 70.082 Hz (Monitor: 50.000 - 76.000 Hz)
    Horizontal Freq: 27.000 - 67.500 kHz (Monitor: 30.000 - 80.000 kHz)
  Base EDID: The DTD max image size is 708x398mm, but the display size is not specified anywhere.
  CTA-861: Native progressive timings are a mix of several resolutions.

EDID conformity: FAIL
