edid-decode (hex):

00 ff ff ff ff ff ff 00 06 af 03 0f 00 00 00 00
11 0e 01 03 80 1e 17 78 0a 84 85 90 52 4f 89 28
24 50 54 00 00 00 01 01 01 01 01 01 01 01 01 01
01 01 01 01 01 01 30 2a 78 20 51 1a 10 40 18 38
13 00 31 e4 10 00 00 18 00 00 00 0f 00 42 31 35
30 50 47 30 33 20 56 20 30 01 00 00 00 fe 00 41
55 4f 0a 20 20 20 20 20 20 20 20 20 00 00 00 0f
00 42 31 35 30 50 47 30 33 20 56 20 30 0a 00 6f

----------------

Block 0, Base EDID:
  EDID Structure Version & Revision: 1.3
  Vendor & Product Identification:
    Manufacturer: AUO
    Model: 3843
    Made in: week 17 of 2004
  Basic Display Parameters & Features:
    Digital display
    Maximum image size: 30 cm x 23 cm
    Gamma: 2.20
    RGB color display
    First detailed timing is the preferred timing
  Color Characteristics:
    Red  : 0.5644, 0.3203
    Green: 0.3095, 0.5351
    Blue : 0.1582, 0.1406
    White: 0.3134, 0.3291
  Established Timings I & II: none
  Standard Timings: none
  Detailed Timing Descriptors:
    DTD 1:  1400x1050   60.019740 Hz   4:3     63.981 kHz    108.000000 MHz (305 mm x 228 mm)
                 Hfront   24 Hsync  56 Hback  208 Hpol N
                 Vfront    1 Vsync   3 Vback   12 Vpol N
    Manufacturer-Specified Display Descriptor (0x0f): 00 0f 00 42 31 35 30 50 47 30 33 20 56 20 30 01 '...B150PG03 V 0.'
    Alphanumeric Data String: 'AUO'
    Manufacturer-Specified Display Descriptor (0x0f): 00 0f 00 42 31 35 30 50 47 30 33 20 56 20 30 0a '...B150PG03 V 0.'
Checksum: 0x6f

----------------

Failures:

Block 0, Base EDID:
  Missing Display Product Name.
  Missing Display Range Limits Descriptor.

EDID conformity: FAIL
