
EDID (hex):
00ffffffffffff003438e3062a040000
2f11010380221b782a5e50a6544c9926
145054bfef008180714f010101010101
010101010101302a009851002a403070
1300520e1100001e000000ff00373437
41533130343031303636000000fd0037
4b1d530e000a202020202020000000fc
003137333053320a2020202020200067

Extracted contents:
header:          00 ff ff ff ff ff ff 00
serial number:   34 38 e3 06 2a 04 00 00 2f 11
version:         01 03
basic params:    80 22 1b 78 2a
chroma info:     5e 50 a6 54 4c 99 26 14 50 54
established:     bf ef 00
standard:        81 80 71 4f 01 01 01 01 01 01 01 01 01 01 01 01
descriptor 1:    30 2a 00 98 51 00 2a 40 30 70 13 00 52 0e 11 00 00 1e
descriptor 2:    00 00 00 ff 00 37 34 37 41 53 31 30 34 30 31 30 36 36
descriptor 3:    00 00 00 fd 00 37 4b 1d 53 0e 00 0a 20 20 20 20 20 20
descriptor 4:    00 00 00 fc 00 31 37 33 30 53 32 0a 20 20 20 20 20 20
extensions:      00
checksum:        67

EDID version: 1.3
Manufacturer: MAX Model 6e3 Serial Number --
Made in week 47 of 2007
Digital display
Maximum image size: 34 cm x 27 cm
Gamma: 2.20
DPMS levels: Off
RGB color display
First detailed timing is preferred timing
Display x,y Chromaticity:
  Red:   0.6494, 0.3291
  Green: 0.2998, 0.5996
  Blue:  0.1494, 0.0791
  White: 0.3125, 0.3281
Established timings supported:
  720x400@70Hz 9:5 HorFreq: 31469 Hz Clock: 28.320 MHz
  640x480@60Hz 4:3 HorFreq: 31469 Hz Clock: 25.175 MHz
  640x480@67Hz 4:3 HorFreq: 35000 Hz Clock: 30.240 MHz
  640x480@72Hz 4:3 HorFreq: 37900 Hz Clock: 31.500 MHz
  640x480@75Hz 4:3 HorFreq: 37500 Hz Clock: 31.500 MHz
  800x600@56Hz 4:3 HorFreq: 35200 Hz Clock: 36.000 MHz
  800x600@60Hz 4:3 HorFreq: 37900 Hz Clock: 40.000 MHz
  800x600@72Hz 4:3 HorFreq: 48100 Hz Clock: 50.000 MHz
  800x600@75Hz 4:3 HorFreq: 46900 Hz Clock: 49.500 MHz
  832x624@75Hz 4:3 HorFreq: 49726 Hz Clock: 57.284 MHz
  1024x768@60Hz 4:3 HorFreq: 48400 Hz Clock: 65.000 MHz
  1024x768@70Hz 4:3 HorFreq: 56500 Hz Clock: 75.000 MHz
  1024x768@75Hz 4:3 HorFreq: 60000 Hz Clock: 78.750 MHz
  1280x1024@75Hz 5:4 HorFreq: 80000 Hz Clock: 135.000 MHz
Standard timings supported:
  1280x1024@60Hz 5:4 HorFreq: 64000 Hz Clock: 108.000 MHz
  1152x864@75Hz 4:3 HorFreq: 67500 Hz Clock: 108.000 MHz
Detailed mode: Clock 108.000 MHz, 338 mm x 270 mm
               1280 1328 1440 1688 hborder 0
               1024 1025 1028 1066 vborder 0
               +hsync +vsync 
               VertFreq: 60 Hz, HorFreq: 63981 Hz
Serial number: --
Monitor ranges (GTF): 55-75Hz V, 29-83kHz H, max dotclock 140MHz
Monitor name: 1730S2
Checksum: 0x67 (valid)
