edid-decode (hex):

00 ff ff ff ff ff ff 00 26 cf f4 03 00 00 00 00
21 14 01 03 80 16 0d 78 0a 21 d0 94 58 56 8f 27
1f 50 54 00 00 00 01 01 01 01 01 01 01 01 01 01
01 01 01 01 01 01 b0 13 00 40 41 58 19 20 30 20
3a 00 df 7d 00 00 00 19 00 00 00 0f 00 00 00 00
00 00 00 00 00 00 00 00 00 01 00 00 00 fe 00 49
6e 66 6f 56 69 73 69 6f 6e 0a 20 20 00 00 00 fe
00 4d 31 30 31 4e 57 54 32 20 52 32 20 0a 00 fa

00 ff ff ff ff ff ff 00 26 cf f4 03 00 00 00 00
21 14 01 03 80 16 0d 78 0a 21 d0 94 58 56 8f 27
1f 50 54 00 00 00 01 01 01 01 01 01 01 01 01 01
01 01 01 01 01 01 b0 13 00 40 41 58 19 20 30 20
3a 00 df 7d 00 00 00 19 00 00 00 0f 00 00 00 00
00 00 00 00 00 00 00 00 00 01 00 00 00 fe 00 49
6e 66 6f 56 69 73 69 6f 6e 0a 20 20 00 00 00 fe
00 4d 31 30 31 4e 57 54 32 20 52 32 20 0a 00 fa

----------------

Block 0, Base EDID:
  EDID Structure Version & Revision: 1.3
  Vendor & Product Identification:
    Manufacturer: IVO
    Model: 1012
    Made in: week 33 of 2010
  Basic Display Parameters & Features:
    Digital display
    Maximum image size: 22 cm x 13 cm
    Gamma: 2.20
    RGB color display
    First detailed timing is the preferred timing
  Color Characteristics:
    Red  : 0.5781, 0.3457
    Green: 0.3359, 0.5595
    Blue : 0.1552, 0.1220
    White: 0.3125, 0.3281
  Established Timings I & II: none
  Standard Timings: none
  Detailed Timing Descriptors:
    DTD 1:  1024x600    60.000000 Hz 128:75    37.500 kHz     50.400000 MHz (223 mm x 125 mm)
                 Hfront   48 Hsync  32 Hback  240 Hpol N
                 Vfront    3 Vsync  10 Vback   12 Vpol N
    Manufacturer-Specified Display Descriptor (0x0f): 00 0f 00 00 00 00 00 00 00 00 00 00 00 00 00 01 '................'
    Alphanumeric Data String: 'InfoVision'
    Alphanumeric Data String: 'M101NWT2 R2 '
Checksum: 0xfa

----------------

Block 1, Unknown EDID Extension Block 0x00:
  00 ff ff ff ff ff ff 00 26 cf f4 03 00 00 00 00 '........&.......'
  21 14 01 03 80 16 0d 78 0a 21 d0 94 58 56 8f 27 '!......x.!..XV.''
  1f 50 54 00 00 00 01 01 01 01 01 01 01 01 01 01 '.PT.............'
  01 01 01 01 01 01 b0 13 00 40 41 58 19 20 30 20 '.........@AX. 0 '
  3a 00 df 7d 00 00 00 19 00 00 00 0f 00 00 00 00 ':..}............'
  00 00 00 00 00 00 00 00 00 01 00 00 00 fe 00 49 '...............I'
  6e 66 6f 56 69 73 69 6f 6e 0a 20 20 00 00 00 fe 'nfoVision.  ....'
  00 4d 31 30 31 4e 57 54 32 20 52 32 20 0a 00 fa '.M101NWT2 R2 ...'
Checksum: 0xfa

----------------

Failures:

Block 0, Base EDID:
  Alphanumeric Data String: One or more trailing spaces.
  Missing Display Product Name.
  Missing Display Range Limits Descriptor.
Block 1, Base EDID:
  Unknown Extension Block.
EDID:
  Base EDID: EDID specified 0 extension block(s), but found 1 extension block(s).

EDID conformity: FAIL
