edid-decode (hex):

00 ff ff ff ff ff ff 00 09 e5 d9 09 00 00 00 00
30 1e 01 04 a5 26 15 78 03 7c e5 a4 55 4c 9f 26
0f 50 54 00 00 00 01 01 01 01 01 01 01 01 01 01
01 01 01 01 01 01 09 64 00 b0 a0 a0 78 50 30 20
36 00 7d d6 10 00 00 18 00 00 00 fd 0c 30 a5 02
02 46 01 0a 20 20 20 20 20 20 00 00 00 fe 00 42
4f 45 20 43 51 0a 20 20 20 20 20 20 00 00 00 fe
00 4e 45 31 37 33 51 48 4d 2d 4e 59 32 0a 01 cc

70 13 79 00 00 03 01 14 19 13 01 84 ff 09 af 00
2f 00 1f 00 9f 05 77 00 02 00 05 00 00 00 00 00
00 00 00 00 00 00 00 00 00 00 00 00 00 00 00 00
00 00 00 00 00 00 00 00 00 00 00 00 00 00 00 00
00 00 00 00 00 00 00 00 00 00 00 00 00 00 00 00
00 00 00 00 00 00 00 00 00 00 00 00 00 00 00 00
00 00 00 00 00 00 00 00 00 00 00 00 00 00 00 00
00 00 00 00 00 00 00 00 00 00 00 00 00 00 84 90

----------------

Block 0, Base EDID:
  EDID Structure Version & Revision: 1.4
  Vendor & Product Identification:
    Manufacturer: BOE
    Model: 2521
    Made in: week 48 of 2020
  Basic Display Parameters & Features:
    Digital display
    Bits per primary color channel: 8
    DisplayPort interface
    Maximum image size: 38 cm x 21 cm
    Gamma: 2.20
    Supported color formats: RGB 4:4:4
    First detailed timing includes the native pixel format and preferred refresh rate
    Display is continuous frequency
  Color Characteristics:
    Red  : 0.6416, 0.3349
    Green: 0.2998, 0.6210
    Blue : 0.1513, 0.0605
    White: 0.3134, 0.3291
  Established Timings I & II: none
  Standard Timings: none
  Detailed Timing Descriptors:
    DTD 1:  2560x1440   60.000094 Hz  16:9     93.600 kHz    256.090000 MHz (381 mm x 214 mm)
                 Hfront   48 Hsync  32 Hback   96 Hpol N
                 Vfront    3 Vsync   6 Vback  111 Vpol N
    Display Range Limits:
      Monitor ranges (Bare Limits): 48-165 Hz V, 257-257 kHz H, max dotclock 700 MHz
    Alphanumeric Data String: 'BOE CQ'
    Alphanumeric Data String: 'NE173QHM-NY2'
  Extension blocks: 1
Checksum: 0xcc

----------------

Block 1, DisplayID Extension Block:
  Version: 1.3
  Extension Count: 0
  Display Product Type: Extension Section
  Video Timing Modes Type 1 - Detailed Timings Data Block:
    DTD:  2560x1440  165.003186 Hz  16:9    257.405 kHz    704.260000 MHz (aspect 16:9, no 3D stereo, preferred)
               Hfront   48 Hsync  32 Hback   96 Hpol N
               Vfront    3 Vsync   6 Vback  111 Vpol N
  Checksum: 0x84
Checksum: 0x90

----------------

Warnings:

EDID:
  Base EDID: Some timings are out of range of the Monitor Ranges:
    Horizontal Freq: 93.600 - 257.404 kHz (Monitor: 257.000 - 257.000 kHz)
    Maximum Clock: 704.260 MHz (Monitor: 700.000 MHz)

Failures:

Block 0, Base EDID:
  Missing Display Product Name.
Block 1, DisplayID Extension Block:
  DisplayID Base Block has no product type.
EDID:
  DisplayID: Missing DisplayID Product Identification Data Block.

EDID conformity: FAIL
