edid-decode (hex):

00 ff ff ff ff ff ff 00 0d ae 38 17 00 00 00 00
2f 18 01 04 95 26 15 78 02 a1 55 a5 56 51 9d 28
0b 50 54 00 00 00 01 01 01 01 01 01 01 01 01 01
01 01 01 01 01 01 b4 3b 80 4a 71 38 34 40 30 20
35 00 7d d6 10 00 00 18 00 00 00 fe 00 4e 31 37
33 48 43 45 2d 45 33 31 0a 20 00 00 00 fe 00 43
4d 4e 0a 20 20 20 20 20 20 20 20 20 00 00 00 fe
00 4e 31 37 33 48 43 45 2d 45 33 31 0a 20 00 56

----------------

Block 0, Base EDID:
  EDID Structure Version & Revision: 1.4
  Vendor & Product Identification:
    Manufacturer: CMN
    Model: 5944
    Made in: week 47 of 2014
  Basic Display Parameters & Features:
    Digital display
    Bits per primary color channel: 6
    DisplayPort interface
    Maximum image size: 38 cm x 21 cm
    Gamma: 2.20
    Supported color formats: RGB 4:4:4
    First detailed timing includes the native pixel format and preferred refresh rate
  Color Characteristics:
    Red  : 0.6464, 0.3378
    Green: 0.3164, 0.6142
    Blue : 0.1572, 0.0439
    White: 0.3134, 0.3291
  Established Timings I & II: none
  Standard Timings: none
  Detailed Timing Descriptors:
    DTD 1:  1920x1080   60.008 Hz  16:9    67.929 kHz 152.840 MHz (381 mm x 214 mm)
                 Hfront   48 Hsync  32 Hback 250 Hpol N
                 Vfront    3 Vsync   5 Vback  44 Vpol N
    Alphanumeric Data String: 'N173HCE-E31'
    Alphanumeric Data String: 'CMN'
    Alphanumeric Data String: 'N173HCE-E31'
Checksum: 0x56
