
EDID (hex):
00ffffffffffff003dcb510e00000000
00180103806e3e782abd0da554509d25
0e474a200000d1c0d1fc010101010101
01010101010104740030f2705a80b058
8a0047684200001e023a801871382d40
582c450047684200001e000000fc0054
582d4e523533350a20202020000000fd
00194c0f8c1e000a20202020202001ee
02033e714a0203059004203f5d5f6438
097f070f7f071707503f06c04d020057
06005f7e01675400834f00006d030c00
5500b83c200060010304e30e6166023a
801871382d40582c450047684200001e
011d007251d01e206e28550047684200
001e0000000000000000000000000000
0000000000000000000000000000004f

Extracted contents:
header:          00 ff ff ff ff ff ff 00
serial number:   3d cb 51 0e 00 00 00 00 00 18
version:         01 03
basic params:    80 6e 3e 78 2a
chroma info:     bd 0d a5 54 50 9d 25 0e 47 4a
established:     20 00 00
standard:        d1 c0 d1 fc 01 01 01 01 01 01 01 01 01 01 01 01
descriptor 1:    04 74 00 30 f2 70 5a 80 b0 58 8a 00 47 68 42 00 00 1e
descriptor 2:    02 3a 80 18 71 38 2d 40 58 2c 45 00 47 68 42 00 00 1e
descriptor 3:    00 00 00 fc 00 54 58 2d 4e 52 35 33 35 0a 20 20 20 20
descriptor 4:    00 00 00 fd 00 19 4c 0f 8c 1e 00 0a 20 20 20 20 20 20
extensions:      01
checksum:        ee

EDID version: 1.3
Manufacturer: ONK Model e51 Serial Number --
Made in year 2014
Digital display
Maximum image size: 110 cm x 62 cm
Gamma: 2.20
DPMS levels: Off
RGB color display
First detailed timing is preferred timing
Display x,y Chromaticity:
  Red:   0.6464, 0.3310
  Green: 0.3154, 0.6142
  Blue:  0.1445, 0.0546
  White: 0.2802, 0.2900
Established timings supported:
  640x480@60Hz 4:3 HorFreq: 31469 Hz Clock: 25.175 MHz
Standard timings supported:
  1920x1080@60Hz 16:9
  1920x1080@120Hz 16:9
Detailed mode: Clock 297.000 MHz, 1095 mm x 616 mm
               3840 4016 4104 4400 hborder 0
               2160 2168 2178 2250 vborder 0
               +hsync +vsync 
               VertFreq: 30 Hz, HorFreq: 67500 Hz
Detailed mode: Clock 148.500 MHz, 1095 mm x 616 mm
               1920 2008 2052 2200 hborder 0
               1080 1084 1089 1125 vborder 0
               +hsync +vsync 
               VertFreq: 60 Hz, HorFreq: 67500 Hz
Monitor name: TX-NR535
Monitor ranges (GTF): 25-76Hz V, 15-140kHz H, max dotclock 300MHz
Has 1 extension blocks
Checksum: 0xee (valid)

CTA extension block
Extension version: 3
58 bytes of CTA data
  Video data block
    VIC   2 720x480@60Hz 4:3  HorFreq: 31469 Hz Clock: 27.000 MHz
    VIC   3 720x480@60Hz 16:9  HorFreq: 31469 Hz Clock: 27.000 MHz
    VIC   5 1920x1080i@60Hz 16:9  HorFreq: 33750 Hz Clock: 74.250 MHz
    VIC  16 1920x1080@60Hz 16:9 (native) HorFreq: 67500 Hz Clock: 148.500 MHz
    VIC   4 1280x720@60Hz 16:9  HorFreq: 45000 Hz Clock: 74.250 MHz
    VIC  32 1920x1080@24Hz 16:9  HorFreq: 27000 Hz Clock: 74.250 MHz
    VIC  63 1920x1080@120Hz 16:9  HorFreq: 135000 Hz Clock: 297.000 MHz
    VIC  93 3840x2160@24Hz 16:9  HorFreq: 54000 Hz Clock: 297.000 MHz
    VIC  95 3840x2160@30Hz 16:9  HorFreq: 67500 Hz Clock: 297.000 MHz
    VIC 100 4096x2160@30Hz 256:135  HorFreq: 67500 Hz Clock: 297.000 MHz
  Audio data block
    Linear PCM, max channels 2
      Supported sample rates (kHz): 192 176.4 96 88.2 48 44.1 32
      Supported sample sizes (bits): 24 20 16
    Linear PCM, max channels 8
      Supported sample rates (kHz): 192 176.4 96 88.2 48 44.1 32
      Supported sample sizes (bits): 24 20 16
    AC-3, max channels 8
      Supported sample rates (kHz): 48 44.1 32
      Maximum bit rate: 640 kHz
    DTS, max channels 8
      Supported sample rates (kHz): 48 44.1
      Maximum bit rate: 1536 kHz
    One Bit Audio, max channels 6
      Supported sample rates (kHz): 44.1
    Dolby Digital+, max channels 8
      Supported sample rates (kHz): 48 44.1
    DTS-HD, max channels 8
      Supported sample rates (kHz): 192 176.4 96 88.2 48 44.1
    MAT (MLP), max channels 8
      Supported sample rates (kHz): 192 96 48
  Speaker allocation data block
    Speaker map:
      FL/FR - Front Left/Right
      LFE - Low Frequency Effects
      FC - Front Center
      BL/BR - Back Left/Right
      RLC/RRC - Rear Left/Right of Center
  Vendor-specific data block, OUI 000c03 (HDMI)
    Source physical address 5.5.0.0
    Supports_AI
    DC_36bit
    DC_30bit
    DC_Y444
    Maximum TMDS clock: 300MHz
    Extended HDMI video details:
      HDMI VIC 1 3840x2160@30Hz 16:9 HorFreq: 67500 Hz Clock: 297.000 MHz
      HDMI VIC 3 3840x2160@24Hz 16:9 HorFreq: 54000 Hz Clock: 297.000 MHz
      HDMI VIC 4 4096x2160@24Hz 256:135 HorFreq: 54000 Hz Clock: 297.000 MHz
  Extended tag: YCbCr 4:2:0 video data block
    VIC  97 3840x2160@60Hz 16:9  HorFreq: 135000 Hz Clock: 297.000 MHz
    VIC 102 4096x2160@60Hz 256:135  HorFreq: 135000 Hz Clock: 297.000 MHz
Basic audio support
Supports YCbCr 4:4:4
Supports YCbCr 4:2:2
1 native detailed modes
Detailed mode: Clock 148.500 MHz, 1095 mm x 616 mm
               1920 2008 2052 2200 hborder 0
               1080 1084 1089 1125 vborder 0
               +hsync +vsync 
               VertFreq: 60 Hz, HorFreq: 67500 Hz
Detailed mode: Clock 74.250 MHz, 1095 mm x 616 mm
               1280 1390 1430 1650 hborder 0
                720  725  730  750 vborder 0
               +hsync +vsync 
               VertFreq: 60 Hz, HorFreq: 45000 Hz
Checksum: 0x4f (valid)

One or more of the timings is out of range of the Monitor Ranges:
  Vertical Freq: 24 - 120 Hz
  Horizontal Freq: 27000 - 135000 Hz
  Maximum Clock: 297.000 MHz
Warning: HDMI VIC Codes must have their CTA-861 VIC equivalents in the VSB
