
EDID (hex):
00ffffffffffff005996a8916796e8dd
ff1c0103800000780a4897a15b54a026
134a5000000001010101010101010101
01010101010100000010000000000000
0000000000000000000000fc00496e64
657820484d440a202020000000100000
00000000000000000000000000000010
000000000000000000000000000001c1
70125a0000030150f70b01803f0b4f00
07001f003f06ce03c4030500f70b0100
3f0b4f0007001f003f06100506050500
f70b01003f0b4f0007001f003f064a01
40010500650c01003f0b4f0007001f00
3f060b00020005008103042309040117
00000000000000000000000000000000
00000000000000000000000000000090

edid-decode (hex):

00 ff ff ff ff ff ff 00 59 96 a8 91 67 96 e8 dd
ff 1c 01 03 80 00 00 78 0a 48 97 a1 5b 54 a0 26
13 4a 50 00 00 00 01 01 01 01 01 01 01 01 01 01
01 01 01 01 01 01 00 00 00 10 00 00 00 00 00 00
00 00 00 00 00 00 00 00 00 00 00 fc 00 49 6e 64
65 78 20 48 4d 44 0a 20 20 20 00 00 00 10 00 00
00 00 00 00 00 00 00 00 00 00 00 00 00 00 00 10
00 00 00 00 00 00 00 00 00 00 00 00 00 00 01 c1

70 12 5a 00 00 03 01 50 f7 0b 01 80 3f 0b 4f 00
07 00 1f 00 3f 06 ce 03 c4 03 05 00 f7 0b 01 00
3f 0b 4f 00 07 00 1f 00 3f 06 10 05 06 05 05 00
f7 0b 01 00 3f 0b 4f 00 07 00 1f 00 3f 06 4a 01
40 01 05 00 65 0c 01 00 3f 0b 4f 00 07 00 1f 00
3f 06 0b 00 02 00 05 00 81 03 04 23 09 04 01 17
00 00 00 00 00 00 00 00 00 00 00 00 00 00 00 00
00 00 00 00 00 00 00 00 00 00 00 00 00 00 00 90

----------------

Block 0, Base EDID:
  EDID Structure Version & Revision: 1.3
  Vendor & Product Identification:
    Manufacturer: VLV
    Model: 37288
    Serial Number: 3723007591
    Model year: 2018
  Basic Display Parameters & Features:
    Digital display
    Image size is variable
    Gamma: 2.20
    RGB color display
    First detailed timing is the preferred timing
  Color Characteristics:
    Red  : 0.6298, 0.3554
    Green: 0.3300, 0.6250
    Blue : 0.1503, 0.0751
    White: 0.2900, 0.3154
  Established Timings I & II: none
  Standard Timings: none
  Detailed Timing Descriptors:
    Dummy Descriptor:
    Display Product Name: 'Index HMD'
    Dummy Descriptor:
    Dummy Descriptor:
  Extension blocks: 1
Checksum: 0xc1

----------------

Block 1, DisplayID Extension Block:
  Version: 1.2
  Extension Count: 0
  Display Product Type: Extension Section
  Video Timing Modes Type 1 - Detailed Timings Data Block:
    DTD:  2880x1600   90.002624 Hz   1:1    231.757 kHz    686.000000 MHz (aspect 1:1, no 3D stereo, preferred)
               Hfront    8 Hsync  32 Hback   40 Hpol N
               Vfront  965 Vsync   6 Vback    4 Vpol N
    DTD:  2880x1600   79.998880 Hz   1:1    231.757 kHz    686.000000 MHz (aspect 1:1, no 3D stereo)
               Hfront    8 Hsync  32 Hback   40 Hpol N
               Vfront 1287 Vsync   6 Vback    4 Vpol N
    DTD:  2880x1600  120.019035 Hz   1:1    231.757 kHz    686.000000 MHz (aspect 1:1, no 3D stereo)
               Hfront    8 Hsync  32 Hback   40 Hpol N
               Vfront  321 Vsync   6 Vback    4 Vpol N
    DTD:  2880x1600  144.000235 Hz   1:1    232.128 kHz    687.100000 MHz (aspect 1:1, no 3D stereo)
               Hfront    8 Hsync  32 Hback   40 Hpol N
               Vfront    3 Vsync   6 Vback    3 Vpol N
  CTA-861 DisplayID Data Block:
  Audio Data Block:
    Linear PCM:
      Max channels: 2
      Supported sample rates (kHz): 48
      Supported sample sizes (bits): 16
  Checksum: 0x17
Checksum: 0x90  Unused space in Extension Block: 31 bytes


