
EDID (hex):
00ffffffffffff005996a891d60efb2a
ff1c0103800000780a4897a15b54a026
134a5000000001010101010101010101
01010101010100000010000000000000
0000000000000000000000fc00496e64
657820484d440a202020000000100000
00000000000000000000000000000010
0000000000000000000000000000017a
70125a0000030150f70b01803f0b4f00
07001f003f06ce03c4030500f70b0100
3f0b4f0007001f003f06100506050500
f70b01003f0b4f0007001f003f064a01
40010500650c01003f0b4f0007001f00
3f060b00020005008103042309040117
00000000000000000000000000000000
00000000000000000000000000000090

Extracted contents:
header:          00 ff ff ff ff ff ff 00
serial number:   59 96 a8 91 d6 0e fb 2a ff 1c
version:         01 03
basic params:    80 00 00 78 0a
chroma info:     48 97 a1 5b 54 a0 26 13 4a 50
established:     00 00 00
standard:        01 01 01 01 01 01 01 01 01 01 01 01 01 01 01 01
descriptor 1:    00 00 00 10 00 00 00 00 00 00 00 00 00 00 00 00 00 00
descriptor 2:    00 00 00 fc 00 49 6e 64 65 78 20 48 4d 44 0a 20 20 20
descriptor 3:    00 00 00 10 00 00 00 00 00 00 00 00 00 00 00 00 00 00
descriptor 4:    00 00 00 10 00 00 00 00 00 00 00 00 00 00 00 00 00 00
extensions:      01
checksum:        7a

EDID version: 1.3
Manufacturer: VLV Model 91a8 Serial Number --
Digital display
Image size is variable
Gamma: 2.20
RGB color display
First detailed timing is preferred timing
Display x,y Chromaticity:
  Red:   0.6298, 0.3554
  Green: 0.3300, 0.6250
  Blue:  0.1503, 0.0751
  White: 0.2900, 0.3154
Established timings supported:
Standard timings supported:
Dummy block
Monitor name: Index HMD
Dummy block
Dummy block
Has 1 extension blocks
Checksum: 0x7a (valid)

DisplayID extension block
Extension version: 18
Length 90, version 18, extension count 0
Checksum: 0x17 (valid)
Type 1 detailed timing: aspect: 1:1, Preferred  
Detailed mode: Clock 685.990 MHz, 0 mm x 0 mm
               2879 2886 2917 2958
               1599 2563 2568 2573
               -hsync -vsync
Type 1 detailed timing: aspect: 1:1,  
Detailed mode: Clock 685.990 MHz, 0 mm x 0 mm
               2879 2886 2917 2958
               1599 2885 2890 2895
               -hsync -vsync
Type 1 detailed timing: aspect: 1:1,  
Detailed mode: Clock 685.990 MHz, 0 mm x 0 mm
               2879 2886 2917 2958
               1599 1919 1924 1929
               -hsync -vsync
Type 1 detailed timing: aspect: 1:1,  
Detailed mode: Clock 687.090 MHz, 0 mm x 0 mm
               2879 2886 2917 2958
               1599 1601 1606 1610
               -hsync -vsync
Unknown displayid data block 0x81

EDID block does NOT conform to EDID 1.3!
	Missing preferred timing
	Missing monitor ranges
EDID block does not conform at all!
	Has -2046820352 nonconformant extension block(s)
	Bad year of manufacture
	Bad week of manufacture


