edid-decode (hex):

00 ff ff ff ff ff ff 00 09 d1 0c 79 45 54 00 00
1e 13 01 03 80 2f 1a 78 2e 35 85 a6 56 48 9a 24
12 50 54 a5 6b ba 71 00 81 40 81 00 95 0f 81 80
95 00 b3 00 01 01 02 3a 80 18 71 38 2d 40 58 2c
45 00 dd 0c 11 00 00 1e 00 00 00 ff 00 50 37 39
30 32 39 39 31 30 32 36 0a 20 00 00 00 fd 00 32
4c 1e 5e 15 00 0a 20 20 20 20 20 20 00 00 00 fc
00 42 65 6e 51 20 45 32 32 30 30 48 44 0a 00 44

00 ff ff ff ff ff ff 00 09 d1 0c 79 45 54 00 00
1e 13 01 03 80 2f 1a 78 2e 35 85 a6 56 48 9a 24
12 50 54 a5 6b ba 71 00 81 40 81 00 95 0f 81 80
95 00 b3 00 01 01 02 3a 80 18 71 38 2d 40 58 2c
45 00 dd 0c 11 00 00 1e 00 00 00 ff 00 50 37 39
30 32 39 39 31 30 32 36 0a 20 00 00 00 fd 00 32
4c 1e 5e 15 00 0a 20 20 20 20 20 20 00 00 00 fc
00 42 65 6e 51 20 45 32 32 30 30 48 44 0a 00 44

----------------

Block 0, Base EDID:
  EDID Structure Version & Revision: 1.3
  Vendor & Product Identification:
    Manufacturer: BNQ
    Model: 30988
    Serial Number: ...
    Made in: week 30 of 2009
  Basic Display Parameters & Features:
    Digital display
    Maximum image size: 47 cm x 26 cm
    Gamma: 2.20
    DPMS levels: Off
    RGB color display
    Default (sRGB) color space is primary color space
    First detailed timing is the preferred timing
  Color Characteristics:
    Red  : 0.6484, 0.3388
    Green: 0.2822, 0.6025
    Blue : 0.1425, 0.0703
    White: 0.3134, 0.3291
  Established Timings I & II:
    IBM     :   720x400    70.081663 Hz   9:5     31.467 kHz     28.320000 MHz
    DMT 0x04:   640x480    59.940476 Hz   4:3     31.469 kHz     25.175000 MHz
    DMT 0x06:   640x480    75.000000 Hz   4:3     37.500 kHz     31.500000 MHz
    DMT 0x09:   800x600    60.316541 Hz   4:3     37.879 kHz     40.000000 MHz
    DMT 0x0b:   800x600    75.000000 Hz   4:3     46.875 kHz     49.500000 MHz
    Apple   :   832x624    74.551266 Hz   4:3     49.726 kHz     57.284000 MHz
    DMT 0x10:  1024x768    60.003840 Hz   4:3     48.363 kHz     65.000000 MHz
    DMT 0x12:  1024x768    75.028582 Hz   4:3     60.023 kHz     78.750000 MHz
    DMT 0x24:  1280x1024   75.024675 Hz   5:4     79.976 kHz    135.000000 MHz
    Apple   :  1152x870    75.061550 Hz 192:145   68.681 kHz    100.000000 MHz
  Standard Timings:
    GTF     :  1152x720    59.999964 Hz  16:10    44.760 kHz     67.319000 MHz
    DMT 0x20:  1280x960    60.000000 Hz   4:3     60.000 kHz    108.000000 MHz
    DMT 0x1c:  1280x800    59.810326 Hz  16:10    49.702 kHz     83.500000 MHz
    DMT 0x30:  1440x900    74.984427 Hz  16:10    70.635 kHz    136.750000 MHz
    DMT 0x23:  1280x1024   60.019740 Hz   5:4     63.981 kHz    108.000000 MHz
    DMT 0x2f:  1440x900    59.887445 Hz  16:10    55.935 kHz    106.500000 MHz
    DMT 0x3a:  1680x1050   59.954250 Hz  16:10    65.290 kHz    146.250000 MHz
  Detailed Timing Descriptors:
    DTD 1:  1920x1080   60.000000 Hz  16:9     67.500 kHz    148.500000 MHz (477 mm x 268 mm)
                 Hfront   88 Hsync  44 Hback  148 Hpol P
                 Vfront    4 Vsync   5 Vback   36 Vpol P
    Display Product Serial Number: ...
    Display Range Limits:
      Monitor ranges (GTF): 50-76 Hz V, 30-94 kHz H, max dotclock 210 MHz
    Display Product Name: 'BenQ E2200HD'
Checksum: 0x44

----------------

Block 1, Unknown EDID Extension Block 0x00:
  00 ff ff ff ff ff ff 00 09 d1 0c 79 45 54 00 00 '...........yET..'
  1e 13 01 03 80 2f 1a 78 2e 35 85 a6 56 48 9a 24 '...../.x.5..VH.$'
  12 50 54 a5 6b ba 71 00 81 40 81 00 95 0f 81 80 '.PT.k.q..@......'
  95 00 b3 00 01 01 02 3a 80 18 71 38 2d 40 58 2c '.......:..q8-@X,'
  45 00 dd 0c 11 00 00 1e 00 00 00 ff 00 50 37 39 'E............P79'
  30 32 39 39 31 30 32 36 0a 20 00 00 00 fd 00 32 '02991026. .....2'
  4c 1e 5e 15 00 0a 20 20 20 20 20 20 00 00 00 fc 'L.^...      ....'
  00 42 65 6e 51 20 45 32 32 30 30 48 44 0a 00 44 '.BenQ E2200HD..D'
Checksum: 0x44

----------------

Failures:

Block 0, Base EDID:
  Basic Display Parameters & Features: sRGB is signaled, but the chromaticities do not match.
Block 1, Base EDID:
  Unknown Extension Block.
EDID:
  Base EDID: EDID specified 0 extension block(s), but found 1 extension block(s).

EDID conformity: FAIL
