
EDID (hex):
00ffffffffffff000dae0b1600000000
251e0104a524147802ee95a3544c9926
0f505400000001010101010101010101
010101010101363680a0703820403020
350063c71000001a000000fe004e3136
314843412d4541330a20000000fe0043
4d4e0a202020202020202020000000fe
004e3136314843412d4541330a200050

Extracted contents:
header:          00 ff ff ff ff ff ff 00
serial number:   0d ae 0b 16 00 00 00 00 25 1e
version:         01 04
basic params:    a5 24 14 78 02
chroma info:     ee 95 a3 54 4c 99 26 0f 50 54
established:     00 00 00
standard:        01 01 01 01 01 01 01 01 01 01 01 01 01 01 01 01
descriptor 1:    36 36 80 a0 70 38 20 40 30 20 35 00 63 c7 10 00 00 1a
descriptor 2:    00 00 00 fe 00 4e 31 36 31 48 43 41 2d 45 41 33 0a 20
descriptor 3:    00 00 00 fe 00 43 4d 4e 0a 20 20 20 20 20 20 20 20 20
descriptor 4:    00 00 00 fe 00 4e 31 36 31 48 43 41 2d 45 41 33 0a 20
extensions:      00
checksum:        50

EDID version: 1.4
Manufacturer: CMN Model 160b Serial Number --
Made in week 37 of 2020
Digital display
8 bits per primary color channel
DisplayPort interface
Maximum image size: 36 cm x 20 cm
Gamma: 2.20
Supported color formats: RGB 4:4:4
First detailed timing includes the native pixel format and preferred refresh rate
Display x,y Chromaticity:
  Red:   0.6396, 0.3300
  Green: 0.2998, 0.5996
  Blue:  0.1503, 0.0595
  White: 0.3134, 0.3291
Established timings supported:
Standard timings supported:
Detailed mode: Clock 138.780 MHz, 355 mm x 199 mm
               1920 1968 2000 2080 hborder 0
               1080 1083 1088 1112 vborder 0
               +hsync -vsync 
               VertFreq: 60 Hz, HorFreq: 66721 Hz
ASCII string: N161HCA-EA3
ASCII string: CMN
ASCII string: N161HCA-EA3
Checksum: 0x50 (valid)
EDID block does NOT conform to EDID 1.4!
	Missing name descriptor
	Missing monitor ranges
