edid-decode (hex):

00 ff ff ff ff ff ff 00 0d ae 41 10 00 00 00 00
1d 17 01 03 80 16 0e 78 0a 85 bc 97 57 4f 94 26
20 4e 53 00 00 00 01 01 01 01 01 01 01 01 01 01
01 01 01 01 01 01 c7 1b 00 a0 50 20 17 30 30 20
36 00 d8 87 00 00 00 18 00 00 00 fe 00 4e 31 30
31 49 43 47 2d 4c 31 31 0a 20 00 00 00 fe 00 43
4d 4e 0a 20 20 20 20 20 20 20 20 20 00 00 00 fe
00 4e 31 30 31 49 43 47 2d 4c 31 31 0a 20 00 eb

----------------

Block 0, Base EDID:
  EDID Structure Version & Revision: 1.3
  Vendor & Product Identification:
    Manufacturer: CMN
    Model: 4161
    Made in: week 29 of 2013
  Basic Display Parameters & Features:
    Digital display
    Maximum image size: 22 cm x 14 cm
    Gamma: 2.20
    RGB color display
    First detailed timing is the preferred timing
  Color Characteristics:
    Red  : 0.5917, 0.3398
    Green: 0.3095, 0.5791
    Blue : 0.1503, 0.1279
    White: 0.3076, 0.3242
  Established Timings I & II: none
  Standard Timings: none
  Detailed Timing Descriptors:
    DTD 1:  1280x800    60.002363 Hz  16:10    49.382 kHz     71.110000 MHz (216 mm x 135 mm)
                 Hfront   48 Hsync  32 Hback   80 Hpol N
                 Vfront    3 Vsync   6 Vback   14 Vpol N
    Alphanumeric Data String: 'N101ICG-L11'
    Alphanumeric Data String: 'CMN'
    Alphanumeric Data String: 'N101ICG-L11'
Checksum: 0xeb

----------------

Failures:

Block 0, Base EDID:
  Missing Display Product Name.
  Missing Display Range Limits Descriptor.

EDID conformity: FAIL
