
EDID (hex):
00ffffffffffff00220e0f3401010101
281f0104b55825783aa195a9544d9c26
0f5054a10800d1c081c081809500a9c0
a940b300d1004c9a00a0f0402e603020
3a00706f3100001a000000fd00183c1b
823c010a202020202020000000fc0048
50205a3338630a2020202020000000ff
0036434d3134303047304e0a20200176
020316f149101f041303021211012309
070783010000584d00b8a1381440f82c
4500706f3100001e2d5080a070402e60
30203a00706f3100001ae26800a0a040
2e6030203600706f3100001a8e4a0050
f040176008209800706f3100001a0000
00000000000000000000000000000000
0000000000000000000000000000000d

edid-decode (hex):

00 ff ff ff ff ff ff 00 22 0e 0f 34 01 01 01 01
28 1f 01 04 b5 58 25 78 3a a1 95 a9 54 4d 9c 26
0f 50 54 a1 08 00 d1 c0 81 c0 81 80 95 00 a9 c0
a9 40 b3 00 d1 00 4c 9a 00 a0 f0 40 2e 60 30 20
3a 00 70 6f 31 00 00 1a 00 00 00 fd 00 18 3c 1b
82 3c 01 0a 20 20 20 20 20 20 00 00 00 fc 00 48
50 20 5a 33 38 63 0a 20 20 20 20 20 00 00 00 ff
00 36 43 4d 31 34 30 30 47 30 4e 0a 20 20 01 76

02 03 16 f1 49 10 1f 04 13 03 02 12 11 01 23 09
07 07 83 01 00 00 58 4d 00 b8 a1 38 14 40 f8 2c
45 00 70 6f 31 00 00 1e 2d 50 80 a0 70 40 2e 60
30 20 3a 00 70 6f 31 00 00 1a e2 68 00 a0 a0 40
2e 60 30 20 36 00 70 6f 31 00 00 1a 8e 4a 00 50
f0 40 17 60 08 20 98 00 70 6f 31 00 00 1a 00 00
00 00 00 00 00 00 00 00 00 00 00 00 00 00 00 00
00 00 00 00 00 00 00 00 00 00 00 00 00 00 00 0d

----------------

Block 0, Base EDID:
  EDID Structure Version & Revision: 1.4
  Vendor & Product Identification:
    Manufacturer: HPN
    Model: 13327
    Serial Number: 16843009
    Made in: week 40 of 2021
  Basic Display Parameters & Features:
    Digital display
    Bits per primary color channel: 10
    DisplayPort interface
    Maximum image size: 88 cm x 37 cm
    Gamma: 2.20
    DPMS levels: Off
    Supported color formats: RGB 4:4:4, YCrCb 4:4:4, YCrCb 4:2:2
    First detailed timing includes the native pixel format and preferred refresh rate
  Color Characteristics:
    Red  : 0.6621, 0.3300
    Green: 0.3007, 0.6103
    Blue : 0.1503, 0.0595
    White: 0.3134, 0.3291
  Established Timings I & II:
    IBM     :   720x400    70.081663 Hz   9:5     31.467 kHz     28.320000 MHz
    DMT 0x04:   640x480    59.940476 Hz   4:3     31.469 kHz     25.175000 MHz
    DMT 0x09:   800x600    60.316541 Hz   4:3     37.879 kHz     40.000000 MHz
    DMT 0x10:  1024x768    60.003840 Hz   4:3     48.363 kHz     65.000000 MHz
  Standard Timings:
    DMT 0x52:  1920x1080   60.000000 Hz  16:9     67.500 kHz    148.500000 MHz
    DMT 0x55:  1280x720    60.000000 Hz  16:9     45.000 kHz     74.250000 MHz
    DMT 0x23:  1280x1024   60.019740 Hz   5:4     63.981 kHz    108.000000 MHz
    DMT 0x2f:  1440x900    59.887445 Hz  16:10    55.935 kHz    106.500000 MHz
    DMT 0x53:  1600x900    60.000000 Hz  16:9     60.000 kHz    108.000000 MHz (RB)
    DMT 0x33:  1600x1200   60.000000 Hz   4:3     75.000 kHz    162.000000 MHz
    DMT 0x3a:  1680x1050   59.954250 Hz  16:10    65.290 kHz    146.250000 MHz
    DMT 0x45:  1920x1200   59.884600 Hz  16:10    74.556 kHz    193.250000 MHz
  Detailed Timing Descriptors:
    DTD 1:  3840x1600   59.993925 Hz  12:5     98.750 kHz    395.000000 MHz (880 mm x 367 mm)
                 Hfront   48 Hsync  32 Hback   80 Hpol P
                 Vfront    3 Vsync  10 Vback   33 Vpol N
    Display Range Limits:
      Monitor ranges (Bare Limits): 24-60 Hz V, 27-130 kHz H, max dotclock 600 MHz
    Display Product Name: 'HP Z38c'
    Display Product Serial Number: '6CM1400G0N'
  Extension blocks: 1
Checksum: 0x76

----------------

Block 1, CTA-861 Extension Block:
  Revision: 3
  Underscans IT Video Formats by default
  Basic audio support
  Supports YCbCr 4:4:4
  Supports YCbCr 4:2:2
  Native detailed modes: 1
  Video Data Block:
    VIC  16:  1920x1080   60.000000 Hz  16:9     67.500 kHz    148.500000 MHz
    VIC  31:  1920x1080   50.000000 Hz  16:9     56.250 kHz    148.500000 MHz
    VIC   4:  1280x720    60.000000 Hz  16:9     45.000 kHz     74.250000 MHz
    VIC  19:  1280x720    50.000000 Hz  16:9     37.500 kHz     74.250000 MHz
    VIC   3:   720x480    59.940060 Hz  16:9     31.469 kHz     27.000000 MHz
    VIC   2:   720x480    59.940060 Hz   4:3     31.469 kHz     27.000000 MHz
    VIC  18:   720x576    50.000000 Hz  16:9     31.250 kHz     27.000000 MHz
    VIC  17:   720x576    50.000000 Hz   4:3     31.250 kHz     27.000000 MHz
    VIC   1:   640x480    59.940476 Hz   4:3     31.469 kHz     25.175000 MHz
  Audio Data Block:
    Linear PCM:
      Max channels: 2
      Supported sample rates (kHz): 48 44.1 32
      Supported sample sizes (bits): 24 20 16
  Speaker Allocation Data Block:
    FL/FR - Front Left/Right
  Detailed Timing Descriptors:
    DTD 2:  2560x1080   60.000000 Hz  64:27    66.000 kHz    198.000000 MHz (880 mm x 367 mm)
                 Hfront  248 Hsync  44 Hback  148 Hpol P
                 Vfront    4 Vsync   5 Vback   11 Vpol P
    DTD 3:  1920x1600   59.950112 Hz   6:5     98.678 kHz    205.250000 MHz (880 mm x 367 mm)
                 Hfront   48 Hsync  32 Hback   80 Hpol P
                 Vfront    3 Vsync  10 Vback   33 Vpol N
    DTD 4:  2560x1600   59.971589 Hz  16:10    98.713 kHz    268.500000 MHz (880 mm x 367 mm)
                 Hfront   48 Hsync  32 Hback   80 Hpol P
                 Vfront    3 Vsync   6 Vback   37 Vpol N
    DTD 5:  3840x1600   29.999246 Hz  12:5     48.689 kHz    190.860000 MHz (880 mm x 367 mm)
                 Hfront    8 Hsync  32 Hback   40 Hpol P
                 Vfront    9 Vsync   8 Vback    6 Vpol N
Checksum: 0x0d  Unused space in Extension Block: 33 bytes


