
EDID (hex):
00ffffffffffff0009e5790700000000
011b0104a51f11780ae7b0955c599429
22505400000001010101010101010101
010101010101c83680cc703814403020
360035ad1000001a0000000000000000
0000000000000000001a000000fe0042
4f452043510a202020202020000000fe
004e5631343046484d2d4e34310a006c

Extracted contents:
header:          00 ff ff ff ff ff ff 00
serial number:   09 e5 79 07 00 00 00 00 01 1b
version:         01 04
basic params:    a5 1f 11 78 0a
chroma info:     e7 b0 95 5c 59 94 29 22 50 54
established:     00 00 00
standard:        01 01 01 01 01 01 01 01 01 01 01 01 01 01 01 01
descriptor 1:    c8 36 80 cc 70 38 14 40 30 20 36 00 35 ad 10 00 00 1a
descriptor 2:    00 00 00 00 00 00 00 00 00 00 00 00 00 00 00 00 00 1a
descriptor 3:    00 00 00 fe 00 42 4f 45 20 43 51 0a 20 20 20 20 20 20
descriptor 4:    00 00 00 fe 00 4e 56 31 34 30 46 48 4d 2d 4e 34 31 0a
extensions:      00
checksum:        6c

EDID version: 1.4
Manufacturer: BOE Model 779 Serial Number --
Made in week 1 of 2017
Digital display
8 bits per primary color channel
DisplayPort interface
Maximum image size: 31 cm x 17 cm
Gamma: 2.20
Supported color formats: RGB 4:4:4, YCrCb 4:4:4
First detailed timing includes the native pixel format and preferred refresh rate
Display x,y Chromaticity:
  Red:   0.5849, 0.3613
  Green: 0.3486, 0.5810
  Blue:  0.1621, 0.1357
  White: 0.3125, 0.3281
Established timings supported:
Standard timings supported:
Detailed mode: Clock 140.240 MHz, 309 mm x 173 mm
               1920 1968 2000 2124 hborder 0
               1080 1083 1089 1100 vborder 0
               +hsync -vsync 
               VertFreq: 60 Hz, HorFreq: 66026 Hz
Manufacturer-specified data, tag 0
ASCII string: BOE CQ
ASCII string: NV140FHM-N41
Checksum: 0x6c (valid)
EDID block does NOT conform to EDID 1.4!
	Missing name descriptor
	Missing monitor ranges
