
EDID (hex):
00ffffffffffff004245130001000000
2010010368261e962a6e06a1544c9926
194f54bfef0001010101010101018180
000000000000302a009851002c403070
1300782d1100001ebc34009851002a40
10901300782d1100001e000000fd003c
4b1e500e000a202020202020000000fc
0050313931300a202020202020200019

Extracted contents:
header:          00 ff ff ff ff ff ff 00
serial number:   42 45 13 00 01 00 00 00 20 10
version:         01 03
basic params:    68 26 1e 96 2a
chroma info:     6e 06 a1 54 4c 99 26 19 4f 54
established:     bf ef 00
standard:        01 01 01 01 01 01 01 01 81 80 00 00 00 00 00 00
descriptor 1:    30 2a 00 98 51 00 2c 40 30 70 13 00 78 2d 11 00 00 1e
descriptor 2:    bc 34 00 98 51 00 2a 40 10 90 13 00 78 2d 11 00 00 1e
descriptor 3:    00 00 00 fd 00 3c 4b 1e 50 0e 00 0a 20 20 20 20 20 20
descriptor 4:    00 00 00 fc 00 50 31 39 31 30 0a 20 20 20 20 20 20 20
extensions:      00
checksum:        19

EDID version: 1.3
Manufacturer: PRE Model 13 Serial Number --
Made in week 32 of 2006
Analog display, Input voltage level: 0.7/0.7 V
Sync: Separate 
Maximum image size: 38 cm x 30 cm
Gamma: 2.50
DPMS levels: Off
RGB color display
First detailed timing is preferred timing
Display x,y Chromaticity:
  Red:   0.6298, 0.3300
  Green: 0.2998, 0.5996
  Blue:  0.1484, 0.0976
  White: 0.3095, 0.3300
Established timings supported:
  720x400@70Hz 9:5 HorFreq: 31469 Hz Clock: 28.320 MHz
  640x480@60Hz 4:3 HorFreq: 31469 Hz Clock: 25.175 MHz
  640x480@67Hz 4:3 HorFreq: 35000 Hz Clock: 30.240 MHz
  640x480@72Hz 4:3 HorFreq: 37900 Hz Clock: 31.500 MHz
  640x480@75Hz 4:3 HorFreq: 37500 Hz Clock: 31.500 MHz
  800x600@56Hz 4:3 HorFreq: 35200 Hz Clock: 36.000 MHz
  800x600@60Hz 4:3 HorFreq: 37900 Hz Clock: 40.000 MHz
  800x600@72Hz 4:3 HorFreq: 48100 Hz Clock: 50.000 MHz
  800x600@75Hz 4:3 HorFreq: 46900 Hz Clock: 49.500 MHz
  832x624@75Hz 4:3 HorFreq: 49726 Hz Clock: 57.284 MHz
  1024x768@60Hz 4:3 HorFreq: 48400 Hz Clock: 65.000 MHz
  1024x768@70Hz 4:3 HorFreq: 56500 Hz Clock: 75.000 MHz
  1024x768@75Hz 4:3 HorFreq: 60000 Hz Clock: 78.750 MHz
  1280x1024@75Hz 5:4 HorFreq: 80000 Hz Clock: 135.000 MHz
Standard timings supported:
  1280x1024@60Hz 5:4 HorFreq: 64000 Hz Clock: 108.000 MHz
non-conformant standard timing (0 horiz)
non-conformant standard timing (0 horiz)
non-conformant standard timing (0 horiz)
Detailed mode: Clock 108.000 MHz, 376 mm x 301 mm
               1280 1328 1440 1688 hborder 0
               1024 1025 1028 1068 vborder 0
               +hsync +vsync 
               VertFreq: 59 Hz, HorFreq: 63981 Hz
Detailed mode: Clock 135.000 MHz, 376 mm x 301 mm
               1280 1296 1440 1688 hborder 0
               1024 1025 1028 1066 vborder 0
               +hsync +vsync 
               VertFreq: 75 Hz, HorFreq: 79976 Hz
Monitor ranges (GTF): 60-75Hz V, 30-80kHz H, max dotclock 140MHz
Monitor name: P1910
Checksum: 0x19 (valid)
One or more of the timings is out of range of the Monitor Ranges:
  Vertical Freq: 56 - 75 Hz
  Horizontal Freq: 31469 - 80000 Hz
  Maximum Clock: 135.000 MHz
