
EDID (hex):
00ffffffffffff000472750413da2083
201c010380351e782aa195a755529f27
145054b30c00714f818081c081009500
b300d1c00101023a801871382d40582c
45000f282100001e000000fd00374c1e
5311000a202020202020000000ff0054
34314545303034343230360a000000fc
0041636572204b32343248594c0a00a1

Extracted contents:
header:          00 ff ff ff ff ff ff 00
serial number:   04 72 75 04 13 da 20 83 20 1c
version:         01 03
basic params:    80 35 1e 78 2a
chroma info:     a1 95 a7 55 52 9f 27 14 50 54
established:     b3 0c 00
standard:        71 4f 81 80 81 c0 81 00 95 00 b3 00 d1 c0 01 01
descriptor 1:    02 3a 80 18 71 38 2d 40 58 2c 45 00 0f 28 21 00 00 1e
descriptor 2:    00 00 00 fd 00 37 4c 1e 53 11 00 0a 20 20 20 20 20 20
descriptor 3:    00 00 00 ff 00 54 34 31 45 45 30 30 34 34 32 30 36 0a
descriptor 4:    00 00 00 fc 00 41 63 65 72 20 4b 32 34 32 48 59 4c 0a
extensions:      00
checksum:        a1

EDID version: 1.3
Manufacturer: ACR Model 475 Serial Number --
Made in week 32 of 2018
Digital display
Maximum image size: 53 cm x 30 cm
Gamma: 2.20
DPMS levels: Off
RGB color display
First detailed timing is preferred timing
Display x,y Chromaticity:
  Red:   0.6542, 0.3339
  Green: 0.3203, 0.6220
  Blue:  0.1542, 0.0791
  White: 0.3134, 0.3291
Established timings supported:
  720x400@70Hz 9:5 HorFreq: 31469 Hz Clock: 28.320 MHz
  640x480@60Hz 4:3 HorFreq: 31469 Hz Clock: 25.175 MHz
  640x480@67Hz 4:3 HorFreq: 35000 Hz Clock: 30.240 MHz
  800x600@56Hz 4:3 HorFreq: 35200 Hz Clock: 36.000 MHz
  800x600@60Hz 4:3 HorFreq: 37900 Hz Clock: 40.000 MHz
  1024x768@60Hz 4:3 HorFreq: 48400 Hz Clock: 65.000 MHz
  1024x768@70Hz 4:3 HorFreq: 56500 Hz Clock: 75.000 MHz
Standard timings supported:
  1152x864@75Hz 4:3 HorFreq: 67500 Hz Clock: 108.000 MHz
  1280x1024@60Hz 5:4 HorFreq: 64000 Hz Clock: 108.000 MHz
  1280x720@60Hz 16:9
  1280x800@60Hz 16:10
  1440x900@60Hz 16:10 HorFreq: 55500 Hz Clock: 88.750 MHz
  1680x1050@60Hz 16:10 HorFreq: 64700 Hz Clock: 119.000 MHz
  1920x1080@60Hz 16:9
Detailed mode: Clock 148.500 MHz, 527 mm x 296 mm
               1920 2008 2052 2200 hborder 0
               1080 1084 1089 1125 vborder 0
               +hsync +vsync 
               VertFreq: 60 Hz, HorFreq: 67500 Hz
Monitor ranges (GTF): 55-76Hz V, 30-83kHz H, max dotclock 170MHz
Serial number: --
Monitor name: Acer K242HYL
Checksum: 0xa1 (valid)
