
EDID (hex):
00ffffffffffff0006af471100000000
01100103801e13780a87f594574f8c27
27505400000001010101010101010101
0101010101011c2aa01252840c304020
33002fbd100000180000000f00000000
00000000000000000020000000fe0041
554f0a202020202020202020000000fe
004231343150573031205631200a00d1

Extracted contents:
header:          00 ff ff ff ff ff ff 00
serial number:   06 af 47 11 00 00 00 00 01 10
version:         01 03
basic params:    80 1e 13 78 0a
chroma info:     87 f5 94 57 4f 8c 27 27 50 54
established:     00 00 00
standard:        01 01 01 01 01 01 01 01 01 01 01 01 01 01 01 01
descriptor 1:    1c 2a a0 12 52 84 0c 30 40 20 33 00 2f bd 10 00 00 18
descriptor 2:    00 00 00 0f 00 00 00 00 00 00 00 00 00 00 00 00 00 20
descriptor 3:    00 00 00 fe 00 41 55 4f 0a 20 20 20 20 20 20 20 20 20
descriptor 4:    00 00 00 fe 00 42 31 34 31 50 57 30 31 20 56 31 20 0a
extensions:      00
checksum:        d1

EDID version: 1.3
Manufacturer: AUO Model 1147 Serial Number --
Made in week 1 of 2006
Digital display
Maximum image size: 30 cm x 19 cm
Gamma: 2.20
RGB color display
First detailed timing is preferred timing
Display x,y Chromaticity:
  Red:   0.5800, 0.3398
  Green: 0.3095, 0.5498
  Blue:  0.1552, 0.1552
  White: 0.3134, 0.3291
Established timings supported:
Standard timings supported:
Detailed mode: Clock 107.800 MHz, 303 mm x 189 mm
               1440 1504 1536 1970 hborder 0
                900  903  906  912 vborder 0
               -hsync -vsync 
               VertFreq: 60 Hz, HorFreq: 54720 Hz
Manufacturer-specified data, tag 15
ASCII string: AUO
ASCII string: B141PW01 V1 
Checksum: 0xd1 (valid)
EDID block does NOT conform to EDID 1.3!
	Missing name descriptor
	Missing monitor ranges
