
EDID (hex):
00ffffffffffff0006af905000000000
001e0104951d117803a5659156579129
20505400000001010101010101010101
010101010101ce1d56e250001e302616
360025a510000018df1356e250001e30
2616360025a510000018000000000000
00000000000000000000000000000002
001048ff0f3c7d100c357d202020009a

edid-decode (hex):

00 ff ff ff ff ff ff 00 06 af 90 50 00 00 00 00
00 1e 01 04 95 1d 11 78 03 a5 65 91 56 57 91 29
20 50 54 00 00 00 01 01 01 01 01 01 01 01 01 01
01 01 01 01 01 01 ce 1d 56 e2 50 00 1e 30 26 16
36 00 25 a5 10 00 00 18 df 13 56 e2 50 00 1e 30
26 16 36 00 25 a5 10 00 00 18 00 00 00 00 00 00
00 00 00 00 00 00 00 00 00 00 00 00 00 00 00 02
00 10 48 ff 0f 3c 7d 10 0c 35 7d 20 20 20 00 9a

----------------

Block 0, Base EDID:
  EDID Structure Version & Revision: 1.4
  Vendor & Product Identification:
    Manufacturer: AUO
    Model: 20624
    Made in: 2020
  Basic Display Parameters & Features:
    Digital display
    Bits per primary color channel: 6
    DisplayPort interface
    Maximum image size: 29 cm x 17 cm
    Gamma: 2.20
    Supported color formats: RGB 4:4:4
    First detailed timing includes the native pixel format and preferred refresh rate
    Display is continuous frequency
  Color Characteristics:
    Red  : 0.5683, 0.3378
    Green: 0.3408, 0.5673
    Blue : 0.1611, 0.1269
    White: 0.3134, 0.3291
  Established Timings I & II: none
  Standard Timings: none
  Detailed Timing Descriptors:
    DTD 1:  1366x768    60.059067 Hz 683:384   47.927 kHz     76.300000 MHz (293 mm x 165 mm)
                 Hfront   38 Hsync  22 Hback  166 Hpol N
                 Vfront    3 Vsync   6 Vback   21 Vpol N
    DTD 2:  1366x768    40.042002 Hz 683:384   31.954 kHz     50.870000 MHz (293 mm x 165 mm)
                 Hfront   38 Hsync  22 Hback  166 Hpol N
                 Vfront    3 Vsync   6 Vback   21 Vpol N
    Empty Descriptor
    Manufacturer-Specified Display Descriptor (0x02): 00 02 00 10 48 ff 0f 3c 7d 10 0c 35 7d 20 20 20 '....H..<}..5}   '
Checksum: 0x9a
