
EDID (hex):
00ffffffffffff0030e4b90100000000
0012010380160d780abfb59658548b27
20505400000001010101010101010101
010101010101741800d2415864203020
3600e07e000000190000000000000000
00000000000000000000000000fe004c
4720446973706c61790a2020000000fc
004c503130315753412d544c41310024

Extracted contents:
header:          00 ff ff ff ff ff ff 00
serial number:   30 e4 b9 01 00 00 00 00 00 12
version:         01 03
basic params:    80 16 0d 78 0a
chroma info:     bf b5 96 58 54 8b 27 20 50 54
established:     00 00 00
standard:        01 01 01 01 01 01 01 01 01 01 01 01 01 01 01 01
descriptor 1:    74 18 00 d2 41 58 64 20 30 20 36 00 e0 7e 00 00 00 19
descriptor 2:    00 00 00 00 00 00 00 00 00 00 00 00 00 00 00 00 00 00
descriptor 3:    00 00 00 fe 00 4c 47 20 44 69 73 70 6c 61 79 0a 20 20
descriptor 4:    00 00 00 fc 00 4c 50 31 30 31 57 53 41 2d 54 4c 41 31
extensions:      00
checksum:        24

EDID version: 1.3
Manufacturer: LGD Model 1b9 Serial Number --
Made in year 2008
Digital display
Maximum image size: 22 cm x 13 cm
Gamma: 2.20
RGB color display
First detailed timing is preferred timing
Display x,y Chromaticity:
  Red:   0.5878, 0.3466
  Green: 0.3310, 0.5458
  Blue:  0.1542, 0.1279
  White: 0.3134, 0.3291
Established timings supported:
Standard timings supported:
Detailed mode: Clock 62.600 MHz, 224 mm x 126 mm
               1024 1072 1104 1490 hborder 0
                600  603  609  700 vborder 0
               -hsync -vsync 
               VertFreq: 60 Hz, HorFreq: 42013 Hz
Manufacturer-specified data, tag 0
ASCII string: LG Display
Checksum: 0x24 (valid)
EDID block does NOT conform to EDID 1.3!
	Name descriptor not terminated with a newline
	Missing monitor ranges


