
EDID (hex):
00ffffffffffff004e14050a00000000
111d010380381e783eee91a3544c9926
0f5054bfef80d1c0d1e8d1fc95009040
8180814081c0d29680a070382d403020
450055502100001eb06d80a070382d40
1820350055502100001e000000fd0030
a5baba27000a202020202020000000fc
0053636570747265204d32350a200135
020343f24f04051013141f2021222748
494a4b4ce200d5e305c00023097f0783
01000067030c001000383ce606050169
694f681a0000010130a50067d85dc401
4ec800023a801871382d40582c3500ba
892100001efe5b80a070383540302035
00ba892100001e011d8018711c2d2058
2c4500ba892100009e0000000000008d

Extracted contents:
header:          00 ff ff ff ff ff ff 00
serial number:   4e 14 05 0a 00 00 00 00 11 1d
version:         01 03
basic params:    80 38 1e 78 3e
chroma info:     ee 91 a3 54 4c 99 26 0f 50 54
established:     bf ef 80
standard:        d1 c0 d1 e8 d1 fc 95 00 90 40 81 80 81 40 81 c0
descriptor 1:    d2 96 80 a0 70 38 2d 40 30 20 45 00 55 50 21 00 00 1e
descriptor 2:    b0 6d 80 a0 70 38 2d 40 18 20 35 00 55 50 21 00 00 1e
descriptor 3:    00 00 00 fd 00 30 a5 ba ba 27 00 0a 20 20 20 20 20 20
descriptor 4:    00 00 00 fc 00 53 63 65 70 74 72 65 20 4d 32 35 0a 20
extensions:      01
checksum:        35

EDID version: 1.3
Manufacturer: SPT Model a05 Serial Number --
Made in week 17 of 2019
Digital display
Maximum image size: 56 cm x 30 cm
Gamma: 2.20
DPMS levels: Off
Undefined display color type
Default (sRGB) color space is primary color space
First detailed timing is preferred timing
Display x,y Chromaticity:
  Red:   0.6396, 0.3300
  Green: 0.2998, 0.5996
  Blue:  0.1503, 0.0595
  White: 0.3125, 0.3291
Established timings supported:
  720x400@70Hz 9:5 HorFreq: 31469 Hz Clock: 28.320 MHz
  640x480@60Hz 4:3 HorFreq: 31469 Hz Clock: 25.175 MHz
  640x480@67Hz 4:3 HorFreq: 35000 Hz Clock: 30.240 MHz
  640x480@72Hz 4:3 HorFreq: 37900 Hz Clock: 31.500 MHz
  640x480@75Hz 4:3 HorFreq: 37500 Hz Clock: 31.500 MHz
  800x600@56Hz 4:3 HorFreq: 35200 Hz Clock: 36.000 MHz
  800x600@60Hz 4:3 HorFreq: 37900 Hz Clock: 40.000 MHz
  800x600@72Hz 4:3 HorFreq: 48100 Hz Clock: 50.000 MHz
  800x600@75Hz 4:3 HorFreq: 46900 Hz Clock: 49.500 MHz
  832x624@75Hz 4:3 HorFreq: 49726 Hz Clock: 57.284 MHz
  1024x768@60Hz 4:3 HorFreq: 48400 Hz Clock: 65.000 MHz
  1024x768@70Hz 4:3 HorFreq: 56500 Hz Clock: 75.000 MHz
  1024x768@75Hz 4:3 HorFreq: 60000 Hz Clock: 78.750 MHz
  1280x1024@75Hz 5:4 HorFreq: 80000 Hz Clock: 135.000 MHz
  1152x870@75Hz 192:145 HorFreq: 67500 Hz Clock: 108.000 MHz
Standard timings supported:
  1920x1080@60Hz 16:9
  1920x1080@100Hz 16:9
  1920x1080@120Hz 16:9
  1440x900@60Hz 16:10 HorFreq: 55500 Hz Clock: 88.750 MHz
  1400x1050@60Hz 4:3 HorFreq: 64700 Hz Clock: 101.000 MHz
  1280x1024@60Hz 5:4 HorFreq: 64000 Hz Clock: 108.000 MHz
  1280x960@60Hz 4:3 HorFreq: 60000 Hz Clock: 108.000 MHz
  1280x720@60Hz 16:9
Detailed mode: Clock 386.100 MHz, 597 mm x 336 mm
               1920 1968 2000 2080 hborder 0
               1080 1084 1089 1125 vborder 0
               +hsync +vsync 
               VertFreq: 165 Hz, HorFreq: 185625 Hz
Detailed mode: Clock 280.800 MHz, 597 mm x 336 mm
               1920 1944 1976 2080 hborder 0
               1080 1083 1088 1125 vborder 0
               +hsync +vsync 
               VertFreq: 120 Hz, HorFreq: 135000 Hz
Monitor ranges (GTF): 48-165Hz V, 186-186kHz H, max dotclock 390MHz
Monitor name: Sceptre M25
Has 1 extension blocks
Checksum: 0x35 (valid)

CTA extension block
Extension version: 3
63 bytes of CTA data
  Video data block
    VIC   4 1280x720@60Hz 16:9  HorFreq: 45000 Hz Clock: 74.250 MHz
    VIC   5 1920x1080i@60Hz 16:9  HorFreq: 33750 Hz Clock: 74.250 MHz
    VIC  16 1920x1080@60Hz 16:9  HorFreq: 67500 Hz Clock: 148.500 MHz
    VIC  19 1280x720@50Hz 16:9  HorFreq: 37500 Hz Clock: 74.250 MHz
    VIC  20 1920x1080i@50Hz 16:9  HorFreq: 28125 Hz Clock: 74.250 MHz
    VIC  31 1920x1080@50Hz 16:9  HorFreq: 56250 Hz Clock: 148.500 MHz
    VIC  32 1920x1080@24Hz 16:9  HorFreq: 27000 Hz Clock: 74.250 MHz
    VIC  33 1920x1080@25Hz 16:9  HorFreq: 28125 Hz Clock: 74.250 MHz
    VIC  34 1920x1080@30Hz 16:9  HorFreq: 33750 Hz Clock: 74.250 MHz
    VIC  39 1920x1080i@50Hz 16:9  HorFreq: 31250 Hz Clock: 72.000 MHz
    VIC  72 1920x1080@24Hz 64:27  HorFreq: 27000 Hz Clock: 74.250 MHz
    VIC  73 1920x1080@25Hz 64:27  HorFreq: 28125 Hz Clock: 74.250 MHz
    VIC  74 1920x1080@30Hz 64:27  HorFreq: 33750 Hz Clock: 74.250 MHz
    VIC  75 1920x1080@50Hz 64:27  HorFreq: 56250 Hz Clock: 148.500 MHz
    VIC  76 1920x1080@60Hz 64:27  HorFreq: 67500 Hz Clock: 148.500 MHz
  Extended tag: Video capability data block
    YCbCr quantization: Selectable (via AVI YQ) (1)
    RGB quantization: Selectable (via AVI Q) (1)
    PT scan behaviour: Always Overscannned (1)
    IT scan behaviour: Always Overscannned (1)
    CE scan behaviour: Always Overscannned (1)
  Extended tag: Colorimetry data block
    BT2020YCC
    BT2020RGB
  Audio data block
    Linear PCM, max channels 2
      Supported sample rates (kHz): 192 176.4 96 88.2 48 44.1 32
      Supported sample sizes (bits): 24 20 16
  Speaker allocation data block
    Speaker map:
      FL/FR - Front Left/Right
  Vendor-specific data block, OUI 000c03 (HDMI)
    Source physical address 1.0.0.0
    DC_36bit
    DC_30bit
    DC_Y444
    Maximum TMDS clock: 300MHz
  Extended tag: HDR static metadata data block
    Electro optical transfer functions:
      Traditional gamma - SDR luminance range
      SMPTE ST2084
    Supported static metadata descriptors:
      Static metadata type 1
    Desired content max luminance: 105 (486.099 cd/m^2)
    Desired content max frame-average luminance: 105 (486.099 cd/m^2)
    Desired content min luminance: 79 (0.467 cd/m^2)
  Vendor-specific data block, OUI 00001a
  Vendor-specific data block, OUI c45dd8 (HDMI Forum)
    Version: 1
    Maximum TMDS Character Rate: 390MHz
    SCDC Present
    SCDC Read Request Capable
    Supports scrambling for <= 340 Mcsc
Underscans PC formats by default
Basic audio support
Supports YCbCr 4:4:4
Supports YCbCr 4:2:2
2 native detailed modes
Detailed mode: Clock 148.500 MHz, 698 mm x 393 mm
               1920 2008 2052 2200 hborder 0
               1080 1083 1088 1125 vborder 0
               +hsync +vsync 
               VertFreq: 60 Hz, HorFreq: 67500 Hz
Detailed mode: Clock 235.500 MHz, 698 mm x 393 mm
               1920 1968 2000 2080 hborder 0
               1080 1083 1088 1133 vborder 0
               +hsync +vsync 
               VertFreq: 99 Hz, HorFreq: 113221 Hz
Detailed mode: Clock 74.250 MHz, 698 mm x 393 mm
               1920 2008 2052 2200 hborder 0
                540  544  549  585 vborder 0
               +hsync +vsync interlaced 
               VertFreq: 57 Hz, HorFreq: 33750 Hz
Checksum: 0x8d (valid)

EDID block does NOT conform to EDID 1.3!
	HDMI Forum VSDB did not immediately follow the HDMI VSDB
One or more of the timings is out of range of the Monitor Ranges:
  Vertical Freq: 24 - 165 Hz
  Horizontal Freq: 27000 - 185625 Hz
  Maximum Clock: 386.100 MHz
