
EDID (hex):
00ffffffffffff0006af5c1100000000
24180104951a0e78026bf59155549127
22505400000001010101010101010101
010101010101891d56d0500020302820
360000901000001a891d565a52002030
2820360000901000001a000000fe004b
59303550804231313658545400000000
0000412296011100000a010a2020005f

Extracted contents:
header:          00 ff ff ff ff ff ff 00
serial number:   06 af 5c 11 00 00 00 00 24 18
version:         01 04
basic params:    95 1a 0e 78 02
chroma info:     6b f5 91 55 54 91 27 22 50 54
established:     00 00 00
standard:        01 01 01 01 01 01 01 01 01 01 01 01 01 01 01 01
descriptor 1:    89 1d 56 d0 50 00 20 30 28 20 36 00 00 90 10 00 00 1a
descriptor 2:    89 1d 56 5a 52 00 20 30 28 20 36 00 00 90 10 00 00 1a
descriptor 3:    00 00 00 fe 00 4b 59 30 35 50 80 42 31 31 36 58 54 54
descriptor 4:    00 00 00 00 00 00 41 22 96 01 11 00 00 0a 01 0a 20 20
extensions:      00
checksum:        5f

EDID version: 1.4
Manufacturer: AUO Model 115c Serial Number --
Made in week 36 of 2014
Digital display
6 bits per primary color channel
DisplayPort interface
Maximum image size: 26 cm x 14 cm
Gamma: 2.20
Supported color formats: RGB 4:4:4
First detailed timing includes the native pixel format and preferred refresh rate
Display x,y Chromaticity:
  Red:   0.5673, 0.3339
  Green: 0.3300, 0.5693
  Blue:  0.1552, 0.1357
  White: 0.3134, 0.3291
Established timings supported:
Standard timings supported:
Detailed mode: Clock 75.610 MHz, 256 mm x 144 mm
               1366 1406 1438 1574 hborder 0
                768  771  777  800 vborder 0
               +hsync -vsync 
               VertFreq: 60 Hz, HorFreq: 48036 Hz
Detailed mode: Clock 75.610 MHz, 256 mm x 144 mm
               1366 1406 1438 1968 hborder 0
                768  771  777  800 vborder 0
               +hsync -vsync 
               VertFreq: 48 Hz, HorFreq: 38419 Hz
ASCII string: KY05P
Manufacturer-specified data, tag 0
Checksum: 0x5f (valid)
EDID block does NOT conform to EDID 1.4!
	Missing name descriptor
	Missing monitor ranges
	Detailed block string not properly terminated
