
EDID (hex):
00ffffffffffff00410c7f08873f0600
0b15010380342078ee9ff5a6564b9a25
125054bfef807140814081c09500950f
a940b3000101283c80a070b023403020
360007442100001a000000ff00444c34
31313131343039343739000000fc0050
68696c69707320323430420a000000fd
003055185e11000a202020202020007b

Extracted contents:
header:          00 ff ff ff ff ff ff 00
serial number:   41 0c 7f 08 87 3f 06 00 0b 15
version:         01 03
basic params:    80 34 20 78 ee
chroma info:     9f f5 a6 56 4b 9a 25 12 50 54
established:     bf ef 80
standard:        71 40 81 40 81 c0 95 00 95 0f a9 40 b3 00 01 01
descriptor 1:    28 3c 80 a0 70 b0 23 40 30 20 36 00 07 44 21 00 00 1a
descriptor 2:    00 00 00 ff 00 44 4c 34 31 31 31 31 34 30 39 34 37 39
descriptor 3:    00 00 00 fc 00 50 68 69 6c 69 70 73 20 32 34 30 42 0a
descriptor 4:    00 00 00 fd 00 30 55 18 5e 11 00 0a 20 20 20 20 20 20
extensions:      00
checksum:        7b

EDID version: 1.3
Manufacturer: PHL Model 87f Serial Number --
Made in week 11 of 2011
Digital display
Maximum image size: 52 cm x 32 cm
Gamma: 2.20
DPMS levels: Standby Suspend Off
RGB color display
Default (sRGB) color space is primary color space
First detailed timing is preferred timing
Display x,y Chromaticity:
  Red:   0.6503, 0.3369
  Green: 0.2958, 0.6044
  Blue:  0.1474, 0.0732
  White: 0.3134, 0.3291
Established timings supported:
  720x400@70Hz 9:5 HorFreq: 31469 Hz Clock: 28.320 MHz
  640x480@60Hz 4:3 HorFreq: 31469 Hz Clock: 25.175 MHz
  640x480@67Hz 4:3 HorFreq: 35000 Hz Clock: 30.240 MHz
  640x480@72Hz 4:3 HorFreq: 37900 Hz Clock: 31.500 MHz
  640x480@75Hz 4:3 HorFreq: 37500 Hz Clock: 31.500 MHz
  800x600@56Hz 4:3 HorFreq: 35200 Hz Clock: 36.000 MHz
  800x600@60Hz 4:3 HorFreq: 37900 Hz Clock: 40.000 MHz
  800x600@72Hz 4:3 HorFreq: 48100 Hz Clock: 50.000 MHz
  800x600@75Hz 4:3 HorFreq: 46900 Hz Clock: 49.500 MHz
  832x624@75Hz 4:3 HorFreq: 49726 Hz Clock: 57.284 MHz
  1024x768@60Hz 4:3 HorFreq: 48400 Hz Clock: 65.000 MHz
  1024x768@70Hz 4:3 HorFreq: 56500 Hz Clock: 75.000 MHz
  1024x768@75Hz 4:3 HorFreq: 60000 Hz Clock: 78.750 MHz
  1280x1024@75Hz 5:4 HorFreq: 80000 Hz Clock: 135.000 MHz
  1152x870@75Hz 192:145 HorFreq: 67500 Hz Clock: 108.000 MHz
Standard timings supported:
  1152x864@60Hz 4:3
  1280x960@60Hz 4:3 HorFreq: 60000 Hz Clock: 108.000 MHz
  1280x720@60Hz 16:9
  1440x900@60Hz 16:10 HorFreq: 55500 Hz Clock: 88.750 MHz
  1440x900@75Hz 16:10 HorFreq: 82300 Hz Clock: 156.000 MHz
  1600x1200@60Hz 4:3 HorFreq: 75000 Hz Clock: 162.000 MHz
  1680x1050@60Hz 16:10 HorFreq: 64700 Hz Clock: 119.000 MHz
Detailed mode: Clock 154.000 MHz, 519 mm x 324 mm
               1920 1968 2000 2080 hborder 0
               1200 1203 1209 1235 vborder 0
               +hsync -vsync 
               VertFreq: 59 Hz, HorFreq: 74038 Hz
Serial number: --
Monitor name: Philips 240B
Monitor ranges (GTF): 48-85Hz V, 24-94kHz H, max dotclock 170MHz
Checksum: 0x7b (valid)
EDID block does NOT conform to EDID 1.3!
	sRGB is signaled, but the chromaticities do not match
