edid-decode (hex):

00 ff ff ff ff ff ff 00 30 ae 92 00 01 00 00 00
17 16 01 04 a5 33 1c 78 0a 01 4c a7 55 46 99 24
12 48 4b 21 08 00 81 80 81 00 81 c0 95 00 01 01
01 01 01 01 01 01 02 3a 80 18 71 38 2d 40 58 2c
45 00 fd 1e 11 00 00 1e 00 00 00 fd 00 39 3e 1e
5a 14 20 20 20 20 20 20 20 20 00 00 00 10 00 32
3e 1e 5a 14 35 00 55 50 21 00 00 1a 00 00 00 fc
00 4c 45 4e 2d 4d 39 32 7a 2d 42 0a 20 20 00 62

----------------

Block 0, Base EDID:
  EDID Structure Version & Revision: 1.4
  Vendor & Product Identification:
    Manufacturer: LEN
    Model: 146
    Serial Number: ...
    Made in: week 23 of 2012
  Basic Display Parameters & Features:
    Digital display
    Bits per primary color channel: 8
    DisplayPort interface
    Maximum image size: 51 cm x 28 cm
    Gamma: 2.20
    Supported color formats: RGB 4:4:4, YCrCb 4:4:4
    First detailed timing includes the native pixel format and preferred refresh rate
  Color Characteristics:
    Red  : 0.6523, 0.3320
    Green: 0.2734, 0.5986
    Blue : 0.1416, 0.0703
    White: 0.2841, 0.2929
  Established Timings I & II:
    DMT 0x04:   640x480    59.940 Hz   4:3    31.469 kHz  25.175 MHz
    DMT 0x09:   800x600    60.317 Hz   4:3    37.879 kHz  40.000 MHz
    DMT 0x10:  1024x768    60.004 Hz   4:3    48.363 kHz  65.000 MHz
  Standard Timings:
    DMT 0x23:  1280x1024   60.020 Hz   5:4    63.981 kHz 108.000 MHz
    DMT 0x1c:  1280x800    59.810 Hz  16:10   49.702 kHz  83.500 MHz
    DMT 0x55:  1280x720    60.000 Hz  16:9    45.000 kHz  74.250 MHz
    DMT 0x2f:  1440x900    59.887 Hz  16:10   55.935 kHz 106.500 MHz
  Detailed Timing Descriptors:
    DTD 1:  1920x1080   60.000 Hz  16:9    67.500 kHz 148.500 MHz (509 mm x 286 mm)
                 Hfront   88 Hsync  44 Hback 148 Hpol P
                 Vfront    4 Vsync   5 Vback  36 Vpol P
  Display Range Limits:
    Monitor ranges (Unknown (0x20)): 57-62 Hz V, 30-90 kHz H, max dotclock 200 MHz
    Dummy Descriptor:
    Display Product Name: 'LEN-M92z-B'
Checksum: 0x62

----------------

Failures:

Block 0, Base EDID:
  Display Range Limits: Unknown range class (0x20).
  Display Range Limits: Byte 11 is 0x20 instead of 0x0a.
  Dummy Descriptor: Dummy block filled with garbage.

EDID conformity: FAIL
