edid-decode (hex):

00 ff ff ff ff ff ff 00 0e 11 59 30 34 02 00 00
16 0b 01 02 08 1e 16 76 ea 98 cf 9e 54 47 97 23
1c 4c 4c af ee 00 61 46 01 01 01 01 01 01 01 01
01 01 01 01 01 01 64 19 00 40 41 00 26 30 18 88
36 00 30 e4 10 00 00 18 00 00 00 fd 00 38 4b 1f
3c 08 00 0a 20 20 20 20 20 20 00 00 00 fc 00 43
4f 4d 50 41 51 20 46 50 37 34 35 41 00 00 00 ff
00 31 32 32 42 47 35 36 50 43 35 36 34 0a 00 dd

00 ff ff ff ff ff ff 00 0e 11 59 30 34 02 00 00
16 0b 01 02 08 1e 16 76 ea 98 cf 9e 54 47 97 23
1c 4c 4c af ee 00 61 46 01 01 01 01 01 01 01 01
01 01 01 01 01 01 64 19 00 40 41 00 26 30 18 88
36 00 30 e4 10 00 00 18 00 00 00 fd 00 38 4b 1f
3c 08 00 0a 20 20 20 20 20 20 00 00 00 fc 00 43
4f 4d 50 41 51 20 46 50 37 34 35 41 00 00 00 ff
00 31 32 32 42 47 35 36 50 43 35 36 34 0a 00 dd

----------------

Block 0, Base EDID:
  EDID Structure Version & Revision: 1.2
  Vendor & Product Identification:
    Manufacturer: CPQ
    Model: 12377
    Serial Number: ...
    Made in: week 22 of 2001
  Basic Display Parameters & Features:
    Analog display
    Signal Level Standard: 0.700 : 0.300 : 1.000 V p-p
    Blank level equals black level
    Sync: Separate
    Maximum image size: 30 cm x 22 cm
    Gamma: 2.18
    DPMS levels: Standby Suspend Off
    RGB color display
    First detailed timing is the preferred timing
  Color Characteristics:
    Red  : 0.6191, 0.3291
    Green: 0.2792, 0.5898
    Blue : 0.1396, 0.1093
    White: 0.2998, 0.2998
  Established Timings I & II:
    IBM     :   720x400    70.081663 Hz   9:5     31.467 kHz     28.320000 MHz
    DMT 0x04:   640x480    59.940476 Hz   4:3     31.469 kHz     25.175000 MHz
    DMT 0x05:   640x480    72.808802 Hz   4:3     37.861 kHz     31.500000 MHz
    DMT 0x06:   640x480    75.000000 Hz   4:3     37.500 kHz     31.500000 MHz
    DMT 0x08:   800x600    56.250000 Hz   4:3     35.156 kHz     36.000000 MHz
    DMT 0x09:   800x600    60.316541 Hz   4:3     37.879 kHz     40.000000 MHz
    DMT 0x0a:   800x600    72.187572 Hz   4:3     48.077 kHz     50.000000 MHz
    DMT 0x0b:   800x600    75.000000 Hz   4:3     46.875 kHz     49.500000 MHz
    Apple   :   832x624    74.551266 Hz   4:3     49.726 kHz     57.284000 MHz
    DMT 0x10:  1024x768    60.003840 Hz   4:3     48.363 kHz     65.000000 MHz
    DMT 0x11:  1024x768    70.069359 Hz   4:3     56.476 kHz     75.000000 MHz
    DMT 0x12:  1024x768    75.028582 Hz   4:3     60.023 kHz     78.750000 MHz
  Standard Timings:
    GTF     :  1024x768    65.999558 Hz   4:3     52.668 kHz     71.628000 MHz
  Detailed Timing Descriptors:
    DTD 1:  1024x768    60.003840 Hz   4:3     48.363 kHz     65.000000 MHz (304 mm x 228 mm)
                 Hfront   24 Hsync 136 Hback  160 Hpol N
                 Vfront    3 Vsync   6 Vback   29 Vpol N
    Display Range Limits:
      Monitor ranges (GTF): 56-75 Hz V, 31-60 kHz H, max dotclock 80 MHz
    Display Product Name: 'COMPAQ FP745A'
    Display Product Serial Number: ...
Checksum: 0xdd

----------------

Block 1, Unknown EDID Extension Block 0x00:
  00 ff ff ff ff ff ff 00 0e 11 59 30 34 02 00 00 '..........Y04...'
  16 0b 01 02 08 1e 16 76 ea 98 cf 9e 54 47 97 23 '.......v....TG.#'
  1c 4c 4c af ee 00 61 46 01 01 01 01 01 01 01 01 '.LL...aF........'
  01 01 01 01 01 01 64 19 00 40 41 00 26 30 18 88 '......d..@A.&0..'
  36 00 30 e4 10 00 00 18 00 00 00 fd 00 38 4b 1f '6.0..........8K.'
  3c 08 00 0a 20 20 20 20 20 20 00 00 00 fc 00 43 '<...      .....C'
  4f 4d 50 41 51 20 46 50 37 34 35 41 00 00 00 ff 'OMPAQ FP745A....'
  00 31 32 32 42 47 35 36 50 43 35 36 34 0a 00 dd '.122BG56PC564...'
Checksum: 0xdd

----------------

Warnings:

Block 0, Base EDID:
  EDID Structure Version & Revision: EDID 1.2 is deprecated, do not use.

Failures:

Block 1, Base EDID:
  Unknown Extension Block.
EDID:
  Base EDID: EDID specified 0 extension block(s), but found 1 extension block(s).

EDID conformity: FAIL
