
EDID (hex):
00ffffffffffff004c2dcc0b00000000
0d180104b54728783ae691a7554ea025
0c5054bfef80714f810081c08180a9c0
b30095000101565e00a0a0a029503020
3500c48e2100001a023a801871382d40
582c4500c48e2100001e000000fd0038
4b1e5a19000a202020202020000000fc
00533332443835300a2020202020019e
02030ef0411023090707830100000000
00000000000000000000000000000000
00000000000000000000000000000000
00000000000000000000000000000000
00000000000000000000000000000000
00000000000000000000000000000000
00000000000000000000000000000000
000000000000000000000000000000ee

Extracted contents:
header:          00 ff ff ff ff ff ff 00
serial number:   4c 2d cc 0b 00 00 00 00 0d 18
version:         01 04
basic params:    b5 47 28 78 3a
chroma info:     e6 91 a7 55 4e a0 25 0c 50 54
established:     bf ef 80
standard:        71 4f 81 00 81 c0 81 80 a9 c0 b3 00 95 00 01 01
descriptor 1:    56 5e 00 a0 a0 a0 29 50 30 20 35 00 c4 8e 21 00 00 1a
descriptor 2:    02 3a 80 18 71 38 2d 40 58 2c 45 00 c4 8e 21 00 00 1e
descriptor 3:    00 00 00 fd 00 38 4b 1e 5a 19 00 0a 20 20 20 20 20 20
descriptor 4:    00 00 00 fc 00 53 33 32 44 38 35 30 0a 20 20 20 20 20
extensions:      01
checksum:        9e

EDID version: 1.4
Manufacturer: SAM Model bcc Serial Number --
Made in week 13 of 2014
Digital display
10 bits per primary color channel
DisplayPort interface
Maximum image size: 71 cm x 40 cm
Gamma: 2.20
DPMS levels: Off
Supported color formats: RGB 4:4:4, YCrCb 4:4:4, YCrCb 4:2:2
First detailed timing includes the native pixel format and preferred refresh rate
Display x,y Chromaticity:
  Red:   0.6552, 0.3339
  Green: 0.3056, 0.6269
  Blue:  0.1464, 0.0478
  White: 0.3125, 0.3291
Established timings supported:
  720x400@70Hz 9:5 HorFreq: 31469 Hz Clock: 28.320 MHz
  640x480@60Hz 4:3 HorFreq: 31469 Hz Clock: 25.175 MHz
  640x480@67Hz 4:3 HorFreq: 35000 Hz Clock: 30.240 MHz
  640x480@72Hz 4:3 HorFreq: 37900 Hz Clock: 31.500 MHz
  640x480@75Hz 4:3 HorFreq: 37500 Hz Clock: 31.500 MHz
  800x600@56Hz 4:3 HorFreq: 35200 Hz Clock: 36.000 MHz
  800x600@60Hz 4:3 HorFreq: 37900 Hz Clock: 40.000 MHz
  800x600@72Hz 4:3 HorFreq: 48100 Hz Clock: 50.000 MHz
  800x600@75Hz 4:3 HorFreq: 46900 Hz Clock: 49.500 MHz
  832x624@75Hz 4:3 HorFreq: 49726 Hz Clock: 57.284 MHz
  1024x768@60Hz 4:3 HorFreq: 48400 Hz Clock: 65.000 MHz
  1024x768@70Hz 4:3 HorFreq: 56500 Hz Clock: 75.000 MHz
  1024x768@75Hz 4:3 HorFreq: 60000 Hz Clock: 78.750 MHz
  1280x1024@75Hz 5:4 HorFreq: 80000 Hz Clock: 135.000 MHz
  1152x870@75Hz 192:145 HorFreq: 67500 Hz Clock: 108.000 MHz
Standard timings supported:
  1152x864@75Hz 4:3 HorFreq: 67500 Hz Clock: 108.000 MHz
  1280x800@60Hz 16:10
  1280x720@60Hz 16:9
  1280x1024@60Hz 5:4 HorFreq: 64000 Hz Clock: 108.000 MHz
  1600x900@60Hz 16:9
  1680x1050@60Hz 16:10 HorFreq: 64700 Hz Clock: 119.000 MHz
  1440x900@60Hz 16:10 HorFreq: 55500 Hz Clock: 88.750 MHz
Detailed mode: Clock 241.500 MHz, 708 mm x 398 mm
               2560 2608 2640 2720 hborder 0
               1440 1443 1448 1481 vborder 0
               +hsync -vsync 
               VertFreq: 59 Hz, HorFreq: 88786 Hz
Detailed mode: Clock 148.500 MHz, 708 mm x 398 mm
               1920 2008 2052 2200 hborder 0
               1080 1084 1089 1125 vborder 0
               +hsync +vsync 
               VertFreq: 60 Hz, HorFreq: 67500 Hz
Monitor ranges (GTF): 56-75Hz V, 30-90kHz H, max dotclock 250MHz
Monitor name: S32D850
Has 1 extension blocks
Checksum: 0x9e (valid)

CTA extension block
Extension version: 3
10 bytes of CTA data
  Video data block
    VIC  16 1920x1080@60Hz 16:9  HorFreq: 67500 Hz Clock: 148.500 MHz
  Audio data block
    Linear PCM, max channels 2
      Supported sample rates (kHz): 48 44.1 32
      Supported sample sizes (bits): 24 20 16
  Speaker allocation data block
    Speaker map:
      FL/FR - Front Left/Right
Underscans PC formats by default
Basic audio support
Supports YCbCr 4:4:4
Supports YCbCr 4:2:2
0 native detailed modes
Checksum: 0xee (valid)



