edid-decode (hex):

00 ff ff ff ff ff ff 00 1a 54 9b 04 30 38 42 4e
07 13 01 03 80 30 1b 78 2a 3d 81 a6 56 4a 9a 24
12 50 54 00 00 00 01 01 01 01 01 01 01 01 01 01
01 01 01 01 01 01 56 5e 00 a0 a0 a0 29 50 30 20
35 00 55 50 21 00 00 1a 56 5e 00 a0 a0 a0 29 50
30 20 35 00 55 50 21 00 00 1a 00 00 00 fd 00 38
3d 1e 5b 19 00 0a 20 20 20 20 20 20 00 00 00 fc
00 44 49 47 49 54 41 4c 0a 20 20 20 20 20 00 98

----------------

Block 0, Base EDID:
  EDID Structure Version & Revision: 1.3
  Vendor & Product Identification:
    Manufacturer: FRT
    Model: 1179
    Serial Number: ...
    Made in: week 7 of 2009
  Basic Display Parameters & Features:
    Digital display
    Maximum image size: 48 cm x 27 cm
    Gamma: 2.20
    DPMS levels: Off
    RGB color display
    First detailed timing is the preferred timing
  Color Characteristics:
    Red  : 0.6484, 0.3388
    Green: 0.2919, 0.6025
    Blue : 0.1425, 0.0703
    White: 0.3125, 0.3291
  Established Timings I & II: none
  Standard Timings: none
  Detailed Timing Descriptors:
    DTD 1:  2560x1440   59.950550 Hz  16:9     88.787 kHz    241.500000 MHz (597 mm x 336 mm)
                 Hfront   48 Hsync  32 Hback   80 Hpol P
                 Vfront    3 Vsync   5 Vback   33 Vpol N
    DTD 2:  2560x1440   59.950550 Hz  16:9     88.787 kHz    241.500000 MHz (597 mm x 336 mm)
                 Hfront   48 Hsync  32 Hback   80 Hpol P
                 Vfront    3 Vsync   5 Vback   33 Vpol N
    Display Range Limits:
      Monitor ranges (GTF): 56-61 Hz V, 30-91 kHz H, max dotclock 250 MHz
    Display Product Name: 'DIGITAL'
Checksum: 0x98

----------------

Failures:

Block 0, Base EDID:
  Detailed Timing Descriptor #1: Mismatch of image size 597x336 mm vs display size 480x270 mm.
  Detailed Timing Descriptor #2: Mismatch of image size 597x336 mm vs display size 480x270 mm.
EDID:
  Base EDID: The DTD max image size is 597x336mm, which is larger than the display size 480.0x270.0mm.

EDID conformity: FAIL
