edid-decode (hex):

00 ff ff ff ff ff ff 00 0d ae e2 14 00 00 00 00
29 1b 01 04 95 1f 11 78 02 ee 95 a3 54 4c 99 26
0f 50 54 00 00 00 01 01 01 01 01 01 01 01 01 01
01 01 01 01 01 01 b4 3b 80 4a 71 38 34 40 30 20
35 00 35 ad 10 00 00 1a b4 3b 80 4a 71 38 6a 42
30 20 35 00 35 ad 10 00 00 1a 00 00 00 00 00 00
00 00 00 00 00 00 00 00 00 00 00 00 00 00 00 02
00 0c 26 ff 14 3c c8 10 0c 29 c8 00 00 00 00 27

----------------

Block 0, Base EDID:
  EDID Structure Version & Revision: 1.4
  Vendor & Product Identification:
    Manufacturer: CMN
    Model: 5346
    Made in: week 41 of 2017
  Basic Display Parameters & Features:
    Digital display
    Bits per primary color channel: 6
    DisplayPort interface
    Maximum image size: 31 cm x 17 cm
    Gamma: 2.20
    Supported color formats: RGB 4:4:4
    First detailed timing includes the native pixel format and preferred refresh rate
  Color Characteristics:
    Red  : 0.6396, 0.3300
    Green: 0.2998, 0.5996
    Blue : 0.1503, 0.0595
    White: 0.3134, 0.3291
  Established Timings I & II: none
  Standard Timings: none
  Detailed Timing Descriptors:
    DTD 1:  1920x1080   60.007852 Hz  16:9     67.929 kHz    152.840000 MHz (309 mm x 173 mm)
                 Hfront   48 Hsync  32 Hback  250 Hpol P
                 Vfront    3 Vsync   5 Vback   44 Vpol N
    DTD 2:  1920x1080   40.005235 Hz  16:9     67.929 kHz    152.840000 MHz (309 mm x 173 mm)
                 Hfront   48 Hsync  32 Hback  250 Hpol P
                 Vfront    3 Vsync   5 Vback  610 Vpol N
    Empty Descriptor
    Manufacturer-Specified Display Descriptor (0x02): 00 02 00 0c 26 ff 14 3c c8 10 0c 29 c8 00 00 00 '....&..<...)....'
Checksum: 0x27

----------------

Warnings:

Block 0, Base EDID:
  Missing Display Product Name.

Failures:

Block 0, Base EDID:
  Empty Descriptor: Use Dummy Descriptor instead of all zeroes.

EDID conformity: FAIL
