edid-decode (hex):

00 ff ff ff ff ff ff 00 0d af 18 12 00 00 00 00
1b 10 01 03 80 19 12 78 0a fe 60 95 55 51 87 26
22 50 54 00 08 00 01 01 01 01 01 01 01 01 01 01
01 01 01 01 01 01 64 19 00 40 41 00 26 30 18 88
36 00 f6 b8 00 00 00 18 00 00 00 fe 00 4e 31 32
31 58 35 2d 4c 30 33 0a 20 20 00 00 00 fe 00 43
4d 4f 0a 20 20 20 20 20 20 20 20 20 00 00 00 fe
00 4e 31 32 31 58 35 2d 4c 30 33 0a 20 20 00 83

----------------

Block 0, Base EDID:
  EDID Structure Version & Revision: 1.3
  Vendor & Product Identification:
    Manufacturer: CMO
    Model: 4632
    Made in: week 27 of 2006
  Basic Display Parameters & Features:
    Digital display
    Maximum image size: 25 cm x 18 cm
    Gamma: 2.20
    RGB color display
    First detailed timing is preferred timing
  Color Characteristics:
    Red  : 0.5849, 0.3349
    Green: 0.3193, 0.5292
    Blue : 0.1494, 0.1347
    White: 0.3125, 0.3281
  Established Timings I & II:
    DMT 0x10:  1024x768    60.004 Hz   4:3    48.363 kHz  65.000 MHz
  Standard Timings: none
  Detailed Timing Descriptors:
    DTD 1:  1024x768    60.004 Hz   4:3    48.363 kHz  65.000 MHz (246 mm x 184 mm)
                 Hfront   24 Hsync 136 Hback 160 Hpol N
                 Vfront    3 Vsync   6 Vback  29 Vpol N
    Alphanumeric Data String: 'N121X5-L03'
    Alphanumeric Data String: 'CMO'
    Alphanumeric Data String: 'N121X5-L03'
Checksum: 0x83

----------------

Failures:

Block 0, Base EDID:
  Missing Display Product Name.
  Missing Display Range Limits Descriptor.

EDID conformity: FAIL
