edid-decode (hex):

00 ff ff ff ff ff ff 00 04 69 b1 22 cf 60 00 00
0c 11 01 03 0e 2f 1e 78 2a c7 20 a4 55 49 99 27
13 50 54 bf ef 80 71 4f 81 80 81 40 81 4f 81 cf
95 00 90 40 b3 00 21 39 90 30 62 1a 27 40 18 b0
36 40 d9 28 11 00 00 1c 00 00 00 fd 00 38 4c 2f
54 0f 00 0a 20 20 20 20 20 20 00 00 00 ff 00 37
33 4c 38 30 32 34 37 38 33 0a 20 20 00 00 00 fc
00 4d 57 32 32 31 0a 20 20 20 20 20 20 20 00 1d

00 ff ff ff ff ff ff 00 04 69 b1 22 cf 60 00 00
0c 11 01 03 0e 2f 1e 78 2a c7 20 a4 55 49 99 27
13 50 54 bf ef 80 71 4f 81 80 81 40 81 4f 81 cf
95 00 90 40 b3 00 21 39 90 30 62 1a 27 40 18 b0
36 40 d9 28 11 00 00 1c 00 00 00 fd 00 38 4c 2f
54 0f 00 0a 20 20 20 20 20 20 00 00 00 ff 00 37
33 4c 38 30 32 34 37 38 33 0a 20 20 00 00 00 fc
00 4d 57 32 32 31 0a 20 20 20 20 20 20 20 00 1d

----------------

Block 0, Base EDID:
  EDID Structure Version & Revision: 1.3
  Vendor & Product Identification:
    Manufacturer: ACI
    Model: 8881
    Serial Number: ...
    Made in: week 12 of 2007
  Basic Display Parameters & Features:
    Analog display
    Signal Level Standard: 0.700 : 0.300 : 1.000 V p-p
    Blank level equals black level
    Sync: Separate Composite SyncOnGreen
    Maximum image size: 47 cm x 30 cm
    Gamma: 2.20
    DPMS levels: Off
    RGB color display
    First detailed timing is the preferred timing
  Color Characteristics:
    Red  : 0.6435, 0.3320
    Green: 0.2861, 0.6005
    Blue : 0.1523, 0.0761
    White: 0.3125, 0.3281
  Established Timings I & II:
    IBM     :   720x400    70.081663 Hz   9:5     31.467 kHz     28.320000 MHz
    DMT 0x04:   640x480    59.940476 Hz   4:3     31.469 kHz     25.175000 MHz
    Apple   :   640x480    66.666667 Hz   4:3     35.000 kHz     30.240000 MHz
    DMT 0x05:   640x480    72.808802 Hz   4:3     37.861 kHz     31.500000 MHz
    DMT 0x06:   640x480    75.000000 Hz   4:3     37.500 kHz     31.500000 MHz
    DMT 0x08:   800x600    56.250000 Hz   4:3     35.156 kHz     36.000000 MHz
    DMT 0x09:   800x600    60.316541 Hz   4:3     37.879 kHz     40.000000 MHz
    DMT 0x0a:   800x600    72.187572 Hz   4:3     48.077 kHz     50.000000 MHz
    DMT 0x0b:   800x600    75.000000 Hz   4:3     46.875 kHz     49.500000 MHz
    Apple   :   832x624    74.551266 Hz   4:3     49.726 kHz     57.284000 MHz
    DMT 0x10:  1024x768    60.003840 Hz   4:3     48.363 kHz     65.000000 MHz
    DMT 0x11:  1024x768    70.069359 Hz   4:3     56.476 kHz     75.000000 MHz
    DMT 0x12:  1024x768    75.028582 Hz   4:3     60.023 kHz     78.750000 MHz
    DMT 0x24:  1280x1024   75.024675 Hz   5:4     79.976 kHz    135.000000 MHz
    Apple   :  1152x870    75.061550 Hz 192:145   68.681 kHz    100.000000 MHz
  Standard Timings:
    DMT 0x15:  1152x864    75.000000 Hz   4:3     67.500 kHz    108.000000 MHz
    DMT 0x23:  1280x1024   60.019740 Hz   5:4     63.981 kHz    108.000000 MHz
    DMT 0x20:  1280x960    60.000000 Hz   4:3     60.000 kHz    108.000000 MHz
    GTF     :  1280x960    74.999884 Hz   4:3     75.150 kHz    129.859000 MHz
    GTF     :  1280x720    74.999686 Hz  16:9     56.400 kHz     95.654000 MHz
    DMT 0x2f:  1440x900    59.887445 Hz  16:10    55.935 kHz    106.500000 MHz
    DMT 0x2a:  1400x1050   59.978442 Hz   4:3     65.317 kHz    121.750000 MHz
    DMT 0x3a:  1680x1050   59.954250 Hz  16:10    65.290 kHz    146.250000 MHz
  Detailed Timing Descriptors:
    DTD 1:  1680x1050   59.954250 Hz  16:10    65.290 kHz    146.250000 MHz (473 mm x 296 mm)
                 Hfront  280 Hsync 176 Hback  104 Hpol N
                 Vfront    3 Vsync   6 Vback   30 Vpol P
    Display Range Limits:
      Monitor ranges (GTF): 56-76 Hz V, 47-84 kHz H, max dotclock 150 MHz
    Display Product Serial Number: ...
    Display Product Name: 'MW221'
Checksum: 0x1d

----------------

Block 1, Unknown EDID Extension Block 0x00:
  00 ff ff ff ff ff ff 00 04 69 b1 22 cf 60 00 00 '.........i.".`..'
  0c 11 01 03 0e 2f 1e 78 2a c7 20 a4 55 49 99 27 '...../.x*. .UI.''
  13 50 54 bf ef 80 71 4f 81 80 81 40 81 4f 81 cf '.PT...qO...@.O..'
  95 00 90 40 b3 00 21 39 90 30 62 1a 27 40 18 b0 '...@..!9.0b.'@..'
  36 40 d9 28 11 00 00 1c 00 00 00 fd 00 38 4c 2f '6@.(.........8L/'
  54 0f 00 0a 20 20 20 20 20 20 00 00 00 ff 00 37 'T...      .....7'
  33 4c 38 30 32 34 37 38 33 0a 20 20 00 00 00 fc '3L8024783.  ....'
  00 4d 57 32 32 31 0a 20 20 20 20 20 20 20 00 1d '.MW221.       ..'
Checksum: 0x1d

----------------

Warnings:

Block 0, Base EDID:
  Detailed Timing Descriptor #1: DTD is similar but not identical to DMT 0x3a.

Failures:

Block 1, Base EDID:
  Unknown Extension Block.
EDID:
  Base EDID: Some timings are out of range of the Monitor Ranges:
    Horizontal Freq: 31.466 - 79.976 kHz (Monitor: 47.000 - 84.000 kHz)
  Base EDID: EDID specified 0 extension block(s), but found 1 extension block(s).

EDID conformity: FAIL
