edid-decode (hex):

00 ff ff ff ff ff ff 00 20 2e 00 24 01 00 00 00
03 20 01 04 a5 35 1e 78 3b a6 61 a9 53 45 98 22
1e 4d 5d ad cf 00 d1 c0 81 80 31 68 31 7c 45 68
45 7c 61 68 61 7c 02 3a 80 18 71 38 2d 40 30 20
35 00 13 2a 21 00 00 1a 45 98 80 b4 70 38 2d 40
30 20 35 00 ba 89 21 00 00 1a 00 00 00 fd 00 30
a5 de de 27 01 0a 20 20 20 20 20 20 00 00 00 fc
00 4d 4f 45 58 48 44 30 34 0a 20 20 20 20 01 4e

02 03 19 74 4c 81 9f 85 94 04 13 03 12 01 02 11
00 23 09 07 07 83 01 00 00 fb 81 80 a0 70 38 1f
40 30 20 35 00 09 25 21 00 00 18 86 6f 80 a0 70
38 40 40 30 20 35 00 ba 89 21 00 00 18 ab 22 a0
a0 50 84 1a 30 30 20 36 00 ba 89 21 00 00 1e 7c
2e 90 a0 60 1a 1e 40 30 20 35 00 ba 89 21 00 00
1e 30 2a 40 c8 60 84 64 30 18 50 13 00 ba 89 21
00 00 18 00 00 00 00 00 00 00 00 00 00 00 00 61

00 ff ff ff ff ff ff 00 20 2e 00 24 01 00 00 00
03 20 01 04 a5 35 1e 78 3b a6 61 a9 53 45 98 22
1e 4d 5d ad cf 00 d1 c0 81 80 31 68 31 7c 45 68
45 7c 61 68 61 7c 02 3a 80 18 71 38 2d 40 30 20
35 00 13 2a 21 00 00 1a 45 98 80 b4 70 38 2d 40
30 20 35 00 ba 89 21 00 00 1a 00 00 00 fd 00 30
a5 de de 27 01 0a 20 20 20 20 20 20 00 00 00 fc
00 4d 4f 45 58 48 44 30 34 0a 20 20 20 20 01 4e

02 03 19 74 4c 81 9f 85 94 04 13 03 12 01 02 11
00 23 09 07 07 83 01 00 00 fb 81 80 a0 70 38 1f
40 30 20 35 00 09 25 21 00 00 18 86 6f 80 a0 70
38 40 40 30 20 35 00 ba 89 21 00 00 18 ab 22 a0
a0 50 84 1a 30 30 20 36 00 ba 89 21 00 00 1e 7c
2e 90 a0 60 1a 1e 40 30 20 35 00 ba 89 21 00 00
1e 30 2a 40 c8 60 84 64 30 18 50 13 00 ba 89 21
00 00 18 00 00 00 00 00 00 00 00 00 00 00 00 61

----------------

Block 0, Base EDID:
  EDID Structure Version & Revision: 1.4
  Vendor & Product Identification:
    Manufacturer: HAN
    Model: 9216
    Serial Number: ...
    Made in: week 3 of 2022
  Basic Display Parameters & Features:
    Digital display
    Bits per primary color channel: 8
    DisplayPort interface
    Maximum image size: 53 cm x 30 cm
    Gamma: 2.20
    DPMS levels: Off
    Supported color formats: RGB 4:4:4, YCrCb 4:4:4, YCrCb 4:2:2
    First detailed timing includes the native pixel format and preferred refresh rate
    Display is continuous frequency
  Color Characteristics:
    Red  : 0.6621, 0.3261
    Green: 0.2705, 0.5957
    Blue : 0.1337, 0.1191
    White: 0.3007, 0.3642
  Established Timings I & II:
    IBM     :   720x400    70.081663 Hz   9:5     31.467 kHz     28.320000 MHz
    DMT 0x04:   640x480    59.940476 Hz   4:3     31.469 kHz     25.175000 MHz
    DMT 0x05:   640x480    72.808802 Hz   4:3     37.861 kHz     31.500000 MHz
    DMT 0x06:   640x480    75.000000 Hz   4:3     37.500 kHz     31.500000 MHz
    DMT 0x09:   800x600    60.316541 Hz   4:3     37.879 kHz     40.000000 MHz
    DMT 0x0a:   800x600    72.187572 Hz   4:3     48.077 kHz     50.000000 MHz
    DMT 0x0b:   800x600    75.000000 Hz   4:3     46.875 kHz     49.500000 MHz
    DMT 0x10:  1024x768    60.003840 Hz   4:3     48.363 kHz     65.000000 MHz
    DMT 0x11:  1024x768    70.069359 Hz   4:3     56.476 kHz     75.000000 MHz
    DMT 0x12:  1024x768    75.028582 Hz   4:3     60.023 kHz     78.750000 MHz
    DMT 0x24:  1280x1024   75.024675 Hz   5:4     79.976 kHz    135.000000 MHz
  Standard Timings:
    DMT 0x52:  1920x1080   60.000000 Hz  16:9     67.500 kHz    148.500000 MHz
    DMT 0x23:  1280x1024   60.019740 Hz   5:4     63.981 kHz    108.000000 MHz
    GTF     :   640x480    99.999537 Hz   4:3     50.900 kHz     43.163000 MHz
    GTF     :   640x480   119.999084 Hz   4:3     61.800 kHz     52.406000 MHz
    GTF     :   800x600    99.999707 Hz   4:3     63.600 kHz     68.179000 MHz
    GTF     :   800x600   119.999886 Hz   4:3     77.160 kHz     83.950000 MHz
    GTF     :  1024x768   100.000177 Hz   4:3     81.400 kHz    113.309000 MHz
    GTF     :  1024x768   119.999931 Hz   4:3     98.760 kHz    139.054000 MHz
  Detailed Timing Descriptors:
    DTD  1:  1920x1080   60.000000 Hz  16:9     67.500 kHz    148.500000 MHz (531 mm x 298 mm)
                  Hfront   48 Hsync  32 Hback  200 Hpol P
                  Vfront    3 Vsync   5 Vback   37 Vpol N
    DTD  2:  1920x1080  164.998942 Hz  16:9    185.624 kHz    389.810000 MHz (698 mm x 393 mm)
                  Hfront   48 Hsync  32 Hback  100 Hpol P
                  Vfront    3 Vsync   5 Vback   37 Vpol N
    Display Range Limits:
      Monitor ranges (Bare Limits): 48-165 Hz V, 222-222 kHz H, max dotclock 390 MHz
    Display Product Name: 'MOEXHD04'
  Extension blocks: 1
Checksum: 0x4e

----------------

Block 1, CTA-861 Extension Block:
  Revision: 3
  Basic audio support
  Supports YCbCr 4:4:4
  Supports YCbCr 4:2:2
  Native detailed modes: 4
  Video Data Block:
    VIC   1:   640x480    59.940476 Hz   4:3     31.469 kHz     25.175000 MHz (native)
    VIC  31:  1920x1080   50.000000 Hz  16:9     56.250 kHz    148.500000 MHz (native)
    VIC   5:  1920x1080i  60.000000 Hz  16:9     33.750 kHz     74.250000 MHz (native)
    VIC  20:  1920x1080i  50.000000 Hz  16:9     28.125 kHz     74.250000 MHz (native)
    VIC   4:  1280x720    60.000000 Hz  16:9     45.000 kHz     74.250000 MHz
    VIC  19:  1280x720    50.000000 Hz  16:9     37.500 kHz     74.250000 MHz
    VIC   3:   720x480    59.940060 Hz  16:9     31.469 kHz     27.000000 MHz
    VIC  18:   720x576    50.000000 Hz  16:9     31.250 kHz     27.000000 MHz
    VIC   1:   640x480    59.940476 Hz   4:3     31.469 kHz     25.175000 MHz
    VIC   2:   720x480    59.940060 Hz   4:3     31.469 kHz     27.000000 MHz
    VIC  17:   720x576    50.000000 Hz   4:3     31.250 kHz     27.000000 MHz
  Audio Data Block:
    Linear PCM:
      Max channels: 2
      Supported sample rates (kHz): 48 44.1 32
      Supported sample sizes (bits): 24 20 16
  Speaker Allocation Data Block:
    FL/FR - Front Left/Right
  Detailed Timing Descriptors:
    DTD  3:  1920x1080  143.992765 Hz  16:9    159.976 kHz    332.750000 MHz (521 mm x 293 mm)
                  Hfront   48 Hsync  32 Hback   80 Hpol N
                  Vfront    3 Vsync   5 Vback   23 Vpol N
    DTD  4:  1920x1080  119.982181 Hz  16:9    137.260 kHz    285.500000 MHz (698 mm x 393 mm)
                  Hfront   48 Hsync  32 Hback   80 Hpol N
                  Vfront    3 Vsync   5 Vback   56 Vpol N
    DTD  5:  1440x900    59.901458 Hz  16:10    55.469 kHz     88.750000 MHz (698 mm x 393 mm)
                  Hfront   48 Hsync  32 Hback   80 Hpol P
                  Vfront    3 Vsync   6 Vback   17 Vpol P
    DTD  6:  1680x1050   59.883253 Hz  16:10    64.674 kHz    119.000000 MHz (698 mm x 393 mm)
                  Hfront   48 Hsync  32 Hback   80 Hpol P
                  Vfront    3 Vsync   5 Vback   22 Vpol P
    DTD  7:  1600x900    60.000000 Hz  16:9     60.000 kHz    108.000000 MHz (698 mm x 393 mm)
                  Hfront   24 Hsync  80 Hback   96 Hpol N
                  Vfront    1 Vsync   3 Vback   96 Vpol N
Checksum: 0x61  Unused space in Extension Block: 12 bytes

----------------

Block 2, Unknown EDID Extension Block 0x00:
  00 ff ff ff ff ff ff 00 20 2e 00 24 01 00 00 00 '........ ..$....'
  03 20 01 04 a5 35 1e 78 3b a6 61 a9 53 45 98 22 '. ...5.x;.a.SE."'
  1e 4d 5d ad cf 00 d1 c0 81 80 31 68 31 7c 45 68 '.M].......1h1|Eh'
  45 7c 61 68 61 7c 02 3a 80 18 71 38 2d 40 30 20 'E|aha|.:..q8-@0 '
  35 00 13 2a 21 00 00 1a 45 98 80 b4 70 38 2d 40 '5..*!...E...p8-@'
  30 20 35 00 ba 89 21 00 00 1a 00 00 00 fd 00 30 '0 5...!........0'
  a5 de de 27 01 0a 20 20 20 20 20 20 00 00 00 fc '...'..      ....'
  00 4d 4f 45 58 48 44 30 34 0a 20 20 20 20 01 4e '.MOEXHD04.    .N'
Checksum: 0x4e

----------------

Block 3, CTA-861 Extension Block:
  Revision: 3
  Basic audio support
  Supports YCbCr 4:4:4
  Supports YCbCr 4:2:2
  Native detailed modes: 4
  Video Data Block:
    VIC   1:   640x480    59.940476 Hz   4:3     31.469 kHz     25.175000 MHz (native)
    VIC  31:  1920x1080   50.000000 Hz  16:9     56.250 kHz    148.500000 MHz (native)
    VIC   5:  1920x1080i  60.000000 Hz  16:9     33.750 kHz     74.250000 MHz (native)
    VIC  20:  1920x1080i  50.000000 Hz  16:9     28.125 kHz     74.250000 MHz (native)
    VIC   4:  1280x720    60.000000 Hz  16:9     45.000 kHz     74.250000 MHz
    VIC  19:  1280x720    50.000000 Hz  16:9     37.500 kHz     74.250000 MHz
    VIC   3:   720x480    59.940060 Hz  16:9     31.469 kHz     27.000000 MHz
    VIC  18:   720x576    50.000000 Hz  16:9     31.250 kHz     27.000000 MHz
    VIC   1:   640x480    59.940476 Hz   4:3     31.469 kHz     25.175000 MHz
    VIC   2:   720x480    59.940060 Hz   4:3     31.469 kHz     27.000000 MHz
    VIC  17:   720x576    50.000000 Hz   4:3     31.250 kHz     27.000000 MHz
  Audio Data Block:
    Linear PCM:
      Max channels: 2
      Supported sample rates (kHz): 48 44.1 32
      Supported sample sizes (bits): 24 20 16
  Speaker Allocation Data Block:
    FL/FR - Front Left/Right
  Detailed Timing Descriptors:
    DTD  8:  1920x1080  143.992765 Hz  16:9    159.976 kHz    332.750000 MHz (521 mm x 293 mm)
                  Hfront   48 Hsync  32 Hback   80 Hpol N
                  Vfront    3 Vsync   5 Vback   23 Vpol N
    DTD  9:  1920x1080  119.982181 Hz  16:9    137.260 kHz    285.500000 MHz (698 mm x 393 mm)
                  Hfront   48 Hsync  32 Hback   80 Hpol N
                  Vfront    3 Vsync   5 Vback   56 Vpol N
    DTD 10:  1440x900    59.901458 Hz  16:10    55.469 kHz     88.750000 MHz (698 mm x 393 mm)
                  Hfront   48 Hsync  32 Hback   80 Hpol P
                  Vfront    3 Vsync   6 Vback   17 Vpol P
    DTD 11:  1680x1050   59.883253 Hz  16:10    64.674 kHz    119.000000 MHz (698 mm x 393 mm)
                  Hfront   48 Hsync  32 Hback   80 Hpol P
                  Vfront    3 Vsync   5 Vback   22 Vpol P
    DTD 12:  1600x900    60.000000 Hz  16:9     60.000 kHz    108.000000 MHz (698 mm x 393 mm)
                  Hfront   24 Hsync  80 Hback   96 Hpol N
                  Vfront    1 Vsync   3 Vback   96 Vpol N
Checksum: 0x61  Unused space in Extension Block: 12 bytes

----------------

Warnings:

Block 0, Base EDID:
  Detailed Timing Descriptor #1: DTD is similar but not identical to VIC 16.
Block 1, CTA-861 Extension Block:
  IT Video Formats are overscanned by default, but normally this should be underscanned.
  Detailed Timing Descriptor #5: DTD is similar but not identical to DMT 0x2e.
  Detailed Timing Descriptor #6: DTD is similar but not identical to DMT 0x39.
  Detailed Timing Descriptor #7: DTD is similar but not identical to DMT 0x53.
  Add a Colorimetry Data Block with the sRGB colorimetry bit set to avoid interop issues.
Block 3, CTA-861 Extension Block:
  IT Video Formats are overscanned by default, but normally this should be underscanned.
  Detailed Timing Descriptor #10: DTD is similar but not identical to DMT 0x2e.
  Detailed Timing Descriptor #11: DTD is similar but not identical to DMT 0x39.
  Detailed Timing Descriptor #12: DTD is similar but not identical to DMT 0x53.
  Add a Colorimetry Data Block with the sRGB colorimetry bit set to avoid interop issues.
EDID:
  Base EDID: Some timings are out of range of the Monitor Ranges:
    Horizontal Freq: 28.125 - 185.623 kHz (Monitor: 222.000 - 222.000 kHz)
  CTA-861: Multiple native interlaced timings are defined.

Failures:

Block 0, Base EDID:
  Detailed Timing Descriptor #2: Mismatch of image size 698x393 mm vs display size 530x300 mm.
Block 1, CTA-861 Extension Block:
  Video Data Block: Duplicate VIC 1.
  Detailed Timing Descriptor #4: Mismatch of image size 698x393 mm vs display size 530x300 mm.
  Detailed Timing Descriptor #5: Mismatch of image size 698x393 mm vs display size 530x300 mm.
  Detailed Timing Descriptor #6: Mismatch of image size 698x393 mm vs display size 530x300 mm.
  Detailed Timing Descriptor #7: Mismatch of image size 698x393 mm vs display size 530x300 mm.
  Missing VCDB, needed for Set Selectable RGB Quantization to avoid interop issues.
Block 2, Base EDID:
  Unknown Extension Block.
Block 3, CTA-861 Extension Block:
  Video Data Block: Duplicate VIC 31.
  Video Data Block: Duplicate VIC 5.
  Video Data Block: Duplicate VIC 20.
  Video Data Block: Duplicate VIC 4.
  Video Data Block: Duplicate VIC 19.
  Video Data Block: Duplicate VIC 3.
  Video Data Block: Duplicate VIC 18.
  Video Data Block: Duplicate VIC 2.
  Video Data Block: Duplicate VIC 17.
  Speaker Allocation Data Block: Only one instance of this Data Block is allowed.
  Detailed Timing Descriptor #9: Mismatch of image size 698x393 mm vs display size 530x300 mm.
  Detailed Timing Descriptor #10: Mismatch of image size 698x393 mm vs display size 530x300 mm.
  Detailed Timing Descriptor #11: Mismatch of image size 698x393 mm vs display size 530x300 mm.
  Detailed Timing Descriptor #12: Mismatch of image size 698x393 mm vs display size 530x300 mm.
  Missing VCDB, needed for Set Selectable RGB Quantization to avoid interop issues.
EDID:
  Base EDID: The DTD max image size is 698x393mm, which is larger than the display size 530.0x300.0mm.
  Base EDID: EDID specified 1 extension block(s), but found 3 extension block(s).
  CTA-861: Native progressive timings are a mix of several resolutions.

EDID conformity: FAIL
