edid-decode (hex):

00 ff ff ff ff ff ff 00 10 ac 67 41 57 39 42 41
1e 1c 01 03 80 3c 22 78 ea 04 15 a9 54 4d a6 26
09 50 54 a5 4b 00 71 4f 81 80 a9 40 d1 c0 01 01
01 01 01 01 01 01 56 5e 00 a0 a0 a0 29 50 30 20
35 00 55 50 21 00 00 1a 00 00 00 ff 00 31 4b 44
54 34 4e 32 0a 20 20 20 20 20 00 00 00 fc 00 44
45 4c 4c 20 53 32 37 31 39 44 4d 0a 00 00 00 fd
00 2f 4b 1e 8c 3c 00 0a 20 20 20 20 20 20 01 f9

----------------

Block 0, Base EDID:
  EDID Structure Version & Revision: 1.3
  Vendor & Product Identification:
    Manufacturer: DEL
    Model: 16743
    Serial Number: ...
    Made in: week 30 of 2018
  Basic Display Parameters & Features:
    Digital display
    Maximum image size: 60 cm x 34 cm
    Gamma: 2.20
    DPMS levels: Standby Suspend Off
    RGB color display
    First detailed timing is preferred timing
  Color Characteristics:
    Red  : 0.6601, 0.3281
    Green: 0.3017, 0.6484
    Blue : 0.1484, 0.0361
    White: 0.3134, 0.3291
  Established Timings I & II:
    IBM     :   720x400    70.082 Hz   9:5    31.467 kHz  28.320 MHz
    DMT 0x04:   640x480    59.940 Hz   4:3    31.469 kHz  25.175 MHz
    DMT 0x06:   640x480    75.000 Hz   4:3    37.500 kHz  31.500 MHz
    DMT 0x09:   800x600    60.317 Hz   4:3    37.879 kHz  40.000 MHz
    DMT 0x0b:   800x600    75.000 Hz   4:3    46.875 kHz  49.500 MHz
    DMT 0x10:  1024x768    60.004 Hz   4:3    48.363 kHz  65.000 MHz
    DMT 0x12:  1024x768    75.029 Hz   4:3    60.023 kHz  78.750 MHz
    DMT 0x24:  1280x1024   75.025 Hz   5:4    79.976 kHz 135.000 MHz
  Standard Timings:
    DMT 0x15:  1152x864    75.000 Hz   4:3    67.500 kHz 108.000 MHz
    DMT 0x23:  1280x1024   60.020 Hz   5:4    63.981 kHz 108.000 MHz
    DMT 0x33:  1600x1200   60.000 Hz   4:3    75.000 kHz 162.000 MHz
    DMT 0x52:  1920x1080   60.000 Hz  16:9    67.500 kHz 148.500 MHz
  Detailed Timing Descriptors:
    DTD 1:  2560x1440   59.951 Hz  16:9    88.787 kHz 241.500 MHz (597 mm x 336 mm)
                 Hfront   48 Hsync  32 Hback  80 Hpol P
                 Vfront    3 Vsync   5 Vback  33 Vpol N
    Display Product Serial Number: ...
    Display Product Name: 'DELL S2719DM'
  Display Range Limits:
    Monitor ranges (GTF): 47-75 Hz V, 30-140 kHz H, max dotclock 600 MHz
  Extension blocks: 1
Checksum: 0xf9

----------------

Failures:

Block 0, Base EDID:
  Base EDID: EDID specified 1 extension block(s), but found 0 extension block(s).

EDID conformity: FAIL
