edid-decode (hex):

00 ff ff ff ff ff ff 00 06 af ec 42 00 00 00 00
31 17 01 04 90 22 13 78 02 bb f5 94 55 54 90 27
23 50 54 00 00 00 01 01 01 01 01 01 01 01 01 01
01 01 01 01 01 01 ce 1d 56 c0 50 00 30 30 08 0a
31 00 58 c1 10 00 00 1e df 13 56 c0 50 00 30 30
08 0a 31 00 58 c1 10 00 00 18 00 00 00 00 00 00
00 00 00 00 00 00 00 00 00 00 00 00 00 00 00 02
00 10 48 ff 0f 3c 6e 1f 14 22 6e 20 20 20 00 70

----------------

Block 0, Base EDID:
  EDID Structure Version & Revision: 1.4
  Vendor & Product Identification:
    Manufacturer: AUO
    Model: 17132
    Made in: week 49 of 2013
  Basic Display Parameters & Features:
    Digital display
    Bits per primary color channel: 6
    Digital interface is not defined
    Maximum image size: 34 cm x 19 cm
    Gamma: 2.20
    Supported color formats: RGB 4:4:4
    First detailed timing includes the native pixel format and preferred refresh rate
  Color Characteristics:
    Red  : 0.5800, 0.3349
    Green: 0.3300, 0.5654
    Blue : 0.1552, 0.1396
    White: 0.3134, 0.3291
  Established Timings I & II: none
  Standard Timings: none
  Detailed Timing Descriptors:
    DTD 1:  1366x768    60.016 Hz 683:384  48.973 kHz  76.300 MHz (344 mm x 193 mm)
                 Hfront    8 Hsync  10 Hback 174 Hpol P
                 Vfront    3 Vsync   1 Vback  44 Vpol P
    DTD 2:  1366x768    40.013 Hz 683:384  32.651 kHz  50.870 MHz (344 mm x 193 mm)
                 Hfront    8 Hsync  10 Hback 174 Hpol N
                 Vfront    3 Vsync   1 Vback  44 Vpol N
    Empty Descriptor
    Manufacturer-Specified Display Descriptor (0x02): 00 02 00 10 48 ff 0f 3c 6e 1f 14 22 6e 20 20 20 '....H..<n.."n   '
Checksum: 0x70
