edid-decode (hex):

00 ff ff ff ff ff ff 00 0d ae ff 14 00 00 00 00
2f 1c 01 04 95 1f 11 78 03 28 65 97 59 54 8e 27
1e 50 54 00 00 00 01 01 01 01 01 01 01 01 01 01
01 01 01 01 01 01 b4 3b 80 4a 71 38 34 40 50 3c
68 00 35 ad 10 00 00 1a cd 27 80 4a 71 38 34 40
50 3c 68 00 35 ad 10 00 00 1a 00 00 00 00 00 00
00 00 00 00 00 00 00 00 00 00 00 00 00 00 00 02
00 0c 3d ff 0d 3c 7d 10 0a 16 7d 00 00 00 00 e2

----------------

Block 0, Base EDID:
  EDID Structure Version & Revision: 1.4
  Vendor & Product Identification:
    Manufacturer: CMN
    Model: 5375
    Made in: week 47 of 2018
  Basic Display Parameters & Features:
    Digital display
    Bits per primary color channel: 6
    DisplayPort interface
    Maximum image size: 31 cm x 17 cm
    Gamma: 2.20
    Supported color formats: RGB 4:4:4
    First detailed timing includes the native pixel format and preferred refresh rate
    Display is continuous frequency
  Color Characteristics:
    Red  : 0.5898, 0.3496
    Green: 0.3300, 0.5546
    Blue : 0.1533, 0.1191
    White: 0.3134, 0.3291
  Established Timings I & II: none
  Standard Timings: none
  Detailed Timing Descriptors:
    DTD 1:  1920x1080   60.008 Hz  16:9    67.929 kHz 152.840 MHz (309 mm x 173 mm)
                 Hfront   80 Hsync  60 Hback 190 Hpol P
                 Vfront    6 Vsync   8 Vback  38 Vpol N
    DTD 2:  1920x1080   40.004 Hz  16:9    45.284 kHz 101.890 MHz (309 mm x 173 mm)
                 Hfront   80 Hsync  60 Hback 190 Hpol P
                 Vfront    6 Vsync   8 Vback  38 Vpol N
    Empty Descriptor
    Manufacturer-Specified Display Descriptor (0x02): 00 02 00 0c 3d ff 0d 3c 7d 10 0a 16 7d 00 00 00 '....=..<}...}...'
Checksum: 0xe2

----------------

Failures:

Block 0, Base EDID:
  Empty Descriptor: Use Dummy Descriptor instead of all zeroes.
  Missing Display Product Name.
  Missing Display Range Limits Descriptor.

EDID conformity: FAIL
