
EDID (hex):
00ffffffffffff0010acf3a04c414730
331b0104b55825783eee95a3544c9926
0f5054a54b00714f81008180a940d1c0
0101010101014c9a00a0f0402e603020
3a00706f3100001a000000ff00354b43
303337434b3047414c0a000000fc0044
454c4c20553338313844570a000000fd
001855197328000a20202020202001aa

Extracted contents:
header:          00 ff ff ff ff ff ff 00
serial number:   10 ac f3 a0 4c 41 47 30 33 1b
version:         01 04
basic params:    b5 58 25 78 3e
chroma info:     ee 95 a3 54 4c 99 26 0f 50 54
established:     a5 4b 00
standard:        71 4f 81 00 81 80 a9 40 d1 c0 01 01 01 01 01 01
descriptor 1:    4c 9a 00 a0 f0 40 2e 60 30 20 3a 00 70 6f 31 00 00 1a
descriptor 2:    00 00 00 ff 00 35 4b 43 30 33 37 43 4b 30 47 41 4c 0a
descriptor 3:    00 00 00 fc 00 44 45 4c 4c 20 55 33 38 31 38 44 57 0a
descriptor 4:    00 00 00 fd 00 18 55 19 73 28 00 0a 20 20 20 20 20 20
extensions:      01
checksum:        aa

EDID version: 1.4
Manufacturer: DEL Model a0f3 Serial Number --
Made in week 51 of 2017
Digital display
10 bits per primary color channel
DisplayPort interface
Maximum image size: 88 cm x 37 cm
Gamma: 2.20
DPMS levels: Off
Supported color formats: RGB 4:4:4, YCrCb 4:4:4, YCrCb 4:2:2
Default (sRGB) color space is primary color space
First detailed timing includes the native pixel format and preferred refresh rate
Display x,y Chromaticity:
  Red:   0.6396, 0.3300
  Green: 0.2998, 0.5996
  Blue:  0.1503, 0.0595
  White: 0.3134, 0.3291
Established timings supported:
  720x400@70Hz 9:5 HorFreq: 31469 Hz Clock: 28.320 MHz
  640x480@60Hz 4:3 HorFreq: 31469 Hz Clock: 25.175 MHz
  640x480@75Hz 4:3 HorFreq: 37500 Hz Clock: 31.500 MHz
  800x600@60Hz 4:3 HorFreq: 37900 Hz Clock: 40.000 MHz
  800x600@75Hz 4:3 HorFreq: 46900 Hz Clock: 49.500 MHz
  1024x768@60Hz 4:3 HorFreq: 48400 Hz Clock: 65.000 MHz
  1024x768@75Hz 4:3 HorFreq: 60000 Hz Clock: 78.750 MHz
  1280x1024@75Hz 5:4 HorFreq: 80000 Hz Clock: 135.000 MHz
Standard timings supported:
  1152x864@75Hz 4:3 HorFreq: 67500 Hz Clock: 108.000 MHz
  1280x800@60Hz 16:10
  1280x1024@60Hz 5:4 HorFreq: 64000 Hz Clock: 108.000 MHz
  1600x1200@60Hz 4:3 HorFreq: 75000 Hz Clock: 162.000 MHz
  1920x1080@60Hz 16:9
Detailed mode: Clock 395.000 MHz, 880 mm x 367 mm
               3840 3888 3920 4000 hborder 0
               1600 1603 1613 1646 vborder 0
               +hsync -vsync 
               VertFreq: 59 Hz, HorFreq: 98750 Hz
Serial number: --
Monitor name: DELL U3818DW
Monitor ranges (GTF): 24-85Hz V, 25-115kHz H, max dotclock 400MHz
Has 1 extension blocks
Checksum: 0xaa (valid)
EDID block does NOT conform to EDID 1.4!
	sRGB is signaled, but the chromaticities do not match


