edid-decode (hex):

00 ff ff ff ff ff ff 00 10 ac 31 f0 4c 4d 45 30
04 15 01 03 0e 33 1d 78 ea 1e 55 a0 59 56 9f 27
0d 50 54 a5 4b 00 71 4f 81 80 d1 c0 01 01 01 01
01 01 01 01 01 01 02 3a 80 18 71 38 2d 40 58 2c
45 00 fd 1e 11 00 00 1e 00 00 00 ff 00 31 37 4b
52 39 31 31 4b 30 45 4d 4c 0a 00 00 00 fc 00 44
45 4c 4c 20 53 54 32 33 32 31 4c 0a 00 00 00 fd
00 38 4c 1e 53 11 00 0a 20 20 20 20 20 20 00 eb

----------------

Block 0, Base EDID:
  EDID Structure Version & Revision: 1.3
  Vendor & Product Identification:
    Manufacturer: DEL
    Model: 61489
    Serial Number: ...
    Made in: week 4 of 2011
  Basic Display Parameters & Features:
    Analog display
    Input voltage level: 0.7/0.3 V
    Blank level equals black level
    Sync: Separate Composite SyncOnGreen
    Maximum image size: 51 cm x 29 cm
    Gamma: 2.20
    DPMS levels: Standby Suspend Off
    RGB color display
    First detailed timing is the preferred timing
  Color Characteristics:
    Red  : 0.6250, 0.3486
    Green: 0.3388, 0.6230
    Blue : 0.1533, 0.0517
    White: 0.3134, 0.3291
  Established Timings I & II:
    IBM     :   720x400    70.082 Hz   9:5    31.467 kHz  28.320 MHz
    DMT 0x04:   640x480    59.940 Hz   4:3    31.469 kHz  25.175 MHz
    DMT 0x06:   640x480    75.000 Hz   4:3    37.500 kHz  31.500 MHz
    DMT 0x09:   800x600    60.317 Hz   4:3    37.879 kHz  40.000 MHz
    DMT 0x0b:   800x600    75.000 Hz   4:3    46.875 kHz  49.500 MHz
    DMT 0x10:  1024x768    60.004 Hz   4:3    48.363 kHz  65.000 MHz
    DMT 0x12:  1024x768    75.029 Hz   4:3    60.023 kHz  78.750 MHz
    DMT 0x24:  1280x1024   75.025 Hz   5:4    79.976 kHz 135.000 MHz
  Standard Timings:
    DMT 0x15:  1152x864    75.000 Hz   4:3    67.500 kHz 108.000 MHz
    DMT 0x23:  1280x1024   60.020 Hz   5:4    63.981 kHz 108.000 MHz
    DMT 0x52:  1920x1080   60.000 Hz  16:9    67.500 kHz 148.500 MHz
  Detailed Timing Descriptors:
    DTD 1:  1920x1080   60.000 Hz  16:9    67.500 kHz 148.500 MHz (509 mm x 286 mm)
                 Hfront   88 Hsync  44 Hback 148 Hpol P
                 Vfront    4 Vsync   5 Vback  36 Vpol P
    Display Product Serial Number: ...
    Display Product Name: 'DELL ST2321L'
  Display Range Limits:
    Monitor ranges (GTF): 56-76 Hz V, 30-83 kHz H, max dotclock 170 MHz
Checksum: 0xeb

----------------

EDID conformity: PASS
