edid-decode (hex):

00 ff ff ff ff ff ff 00 22 f0 35 42 01 00 00 00
01 19 01 03 81 30 1b 78 ea 64 b5 ab 52 38 ab 25
13 50 54 00 00 00 01 01 01 01 01 01 01 01 01 01
01 01 01 01 01 01 19 38 80 00 71 38 14 40 60 40
84 00 dc 0c 11 00 00 1c 00 00 00 10 00 00 00 00
00 00 00 00 00 00 00 00 00 00 00 00 00 fc 00 48
50 20 41 4c 4c 2d 69 6e 2d 4f 6e 65 00 00 00 ff
00 4c 4d 32 31 35 57 46 33 0a 20 20 20 20 00 ca

----------------

Block 0, Base EDID:
  EDID Structure Version & Revision: 1.3
  Vendor & Product Identification:
    Manufacturer: HWP
    Model: 16949
    Serial Number: ...
    Made in: week 1 of 2015
  Basic Display Parameters & Features:
    Digital display
    DFP 1.x compatible TMDS
    Maximum image size: 48 cm x 27 cm
    Gamma: 2.20
    DPMS levels: Standby Suspend Off
    RGB color display
    First detailed timing is the preferred timing
  Color Characteristics:
    Red  : 0.6689, 0.3222
    Green: 0.2197, 0.6679
    Blue : 0.1464, 0.0771
    White: 0.3134, 0.3291
  Established Timings I & II: none
  Standard Timings: none
  Detailed Timing Descriptors:
    DTD 1:  1920x1080   59.997493 Hz  16:9     65.997 kHz    143.610000 MHz (476 mm x 268 mm)
                 Hfront   96 Hsync  64 Hback   96 Hpol N
                 Vfront    8 Vsync   4 Vback    8 Vpol P
    Dummy Descriptor:
    Display Product Name: 'HP ALL-in-One'
    Display Product Serial Number: ...
Checksum: 0xca

----------------

Failures:

Block 0, Base EDID:
  Missing Display Range Limits Descriptor.

EDID conformity: FAIL
