
EDID (hex):
00ffffffffffff001e6dd25b7f121f00
0121010380462778eacf85a85643ab25
0f5054210800d1c06140454001010101
010101010101747400a0a0a053503020
3500b9882100001a000000fd0030901e
e63c000a202020202020000000fc004c
4720554c545241474541520a000000ff
003330314d414d42484c5835310a0187
02033ef1230907074d100403011f1312
3f5d5e5f5f5f6d030c001000b83c2000
6001020367d85dc401788003e30f0018
e2006ae305c000e60600000000003761
00a0a0a0555030203500b9882100001a
565e00a0a0a0295030203500b9882100
001a0000000000000000000000000000
0000000000000000000000000000005a

edid-decode (hex):

00 ff ff ff ff ff ff 00 1e 6d d2 5b 7f 12 1f 00
01 21 01 03 80 46 27 78 ea cf 85 a8 56 43 ab 25
0f 50 54 21 08 00 d1 c0 61 40 45 40 01 01 01 01
01 01 01 01 01 01 74 74 00 a0 a0 a0 53 50 30 20
35 00 b9 88 21 00 00 1a 00 00 00 fd 00 30 90 1e
e6 3c 00 0a 20 20 20 20 20 20 00 00 00 fc 00 4c
47 20 55 4c 54 52 41 47 45 41 52 0a 00 00 00 ff
00 33 30 31 4d 41 4d 42 48 4c 58 35 31 0a 01 87

02 03 3e f1 23 09 07 07 4d 10 04 03 01 1f 13 12
3f 5d 5e 5f 5f 5f 6d 03 0c 00 10 00 b8 3c 20 00
60 01 02 03 67 d8 5d c4 01 78 80 03 e3 0f 00 18
e2 00 6a e3 05 c0 00 e6 06 00 00 00 00 00 37 61
00 a0 a0 a0 55 50 30 20 35 00 b9 88 21 00 00 1a
56 5e 00 a0 a0 a0 29 50 30 20 35 00 b9 88 21 00
00 1a 00 00 00 00 00 00 00 00 00 00 00 00 00 00
00 00 00 00 00 00 00 00 00 00 00 00 00 00 00 5a

----------------

Block 0, Base EDID:
  EDID Structure Version & Revision: 1.3
  Vendor & Product Identification:
    Manufacturer: GSM
    Model: 23506
    Serial Number: 2036351
    Made in: week 1 of 2023
  Basic Display Parameters & Features:
    Digital display
    Maximum image size: 70 cm x 39 cm
    Gamma: 2.20
    DPMS levels: Standby Suspend Off
    RGB color display
    First detailed timing is the preferred timing
  Color Characteristics:
    Red  : 0.6591, 0.3359
    Green: 0.2646, 0.6708
    Blue : 0.1464, 0.0585
    White: 0.3134, 0.3291
  Established Timings I & II:
    DMT 0x04:   640x480    59.940476 Hz   4:3     31.469 kHz     25.175000 MHz
    DMT 0x09:   800x600    60.316541 Hz   4:3     37.879 kHz     40.000000 MHz
    DMT 0x10:  1024x768    60.003840 Hz   4:3     48.363 kHz     65.000000 MHz
  Standard Timings:
    DMT 0x52:  1920x1080   60.000000 Hz  16:9     67.500 kHz    148.500000 MHz
    DMT 0x10:  1024x768    60.003840 Hz   4:3     48.363 kHz     65.000000 MHz
    DMT 0x09:   800x600    60.316541 Hz   4:3     37.879 kHz     40.000000 MHz
  Detailed Timing Descriptors:
    DTD 1:  2560x1440   71.965162 Hz  16:9    109.603 kHz    298.120000 MHz (697 mm x 392 mm)
                 Hfront   48 Hsync  32 Hback   80 Hpol P
                 Vfront    3 Vsync   5 Vback   75 Vpol N
    Display Range Limits:
      Monitor ranges (GTF): 48-144 Hz V, 30-230 kHz H, max dotclock 600 MHz
    Display Product Name: 'LG ULTRAGEAR'
    Display Product Serial Number: '301MAMBHLX51'
  Extension blocks: 1
Checksum: 0x87

----------------

Block 1, CTA-861 Extension Block:
  Revision: 3
  Underscans IT Video Formats by default
  Basic audio support
  Supports YCbCr 4:4:4
  Supports YCbCr 4:2:2
  Native detailed modes: 1
  Audio Data Block:
    Linear PCM:
      Max channels: 2
      Supported sample rates (kHz): 48 44.1 32
      Supported sample sizes (bits): 24 20 16
  Video Data Block:
    VIC  16:  1920x1080   60.000000 Hz  16:9     67.500 kHz    148.500000 MHz
    VIC   4:  1280x720    60.000000 Hz  16:9     45.000 kHz     74.250000 MHz
    VIC   3:   720x480    59.940060 Hz  16:9     31.469 kHz     27.000000 MHz
    VIC   1:   640x480    59.940476 Hz   4:3     31.469 kHz     25.175000 MHz
    VIC  31:  1920x1080   50.000000 Hz  16:9     56.250 kHz    148.500000 MHz
    VIC  19:  1280x720    50.000000 Hz  16:9     37.500 kHz     74.250000 MHz
    VIC  18:   720x576    50.000000 Hz  16:9     31.250 kHz     27.000000 MHz
    VIC  63:  1920x1080  120.000000 Hz  16:9    135.000 kHz    297.000000 MHz
    VIC  93:  3840x2160   24.000000 Hz  16:9     54.000 kHz    297.000000 MHz
    VIC  94:  3840x2160   25.000000 Hz  16:9     56.250 kHz    297.000000 MHz
    VIC  95:  3840x2160   30.000000 Hz  16:9     67.500 kHz    297.000000 MHz
    VIC  95:  3840x2160   30.000000 Hz  16:9     67.500 kHz    297.000000 MHz
    VIC  95:  3840x2160   30.000000 Hz  16:9     67.500 kHz    297.000000 MHz
  Vendor-Specific Data Block (HDMI), OUI 00-0C-03:
    Source physical address: 1.0.0.0
    Supports_AI
    DC_36bit
    DC_30bit
    DC_Y444
    Maximum TMDS clock: 300 MHz
    Extended HDMI video details:
      HDMI VICs:
        HDMI VIC 1:  3840x2160   30.000000 Hz  16:9     67.500 kHz    297.000000 MHz
        HDMI VIC 2:  3840x2160   25.000000 Hz  16:9     56.250 kHz    297.000000 MHz
        HDMI VIC 3:  3840x2160   24.000000 Hz  16:9     54.000 kHz    297.000000 MHz
  Vendor-Specific Data Block (HDMI Forum), OUI C4-5D-D8:
    Version: 1
    Maximum TMDS Character Rate: 600 MHz
    SCDC Present
    Supports 12-bits/component Deep Color 4:2:0 Pixel Encoding
    Supports 10-bits/component Deep Color 4:2:0 Pixel Encoding
  YCbCr 4:2:0 Capability Map Data Block:
    VIC  95:  3840x2160   30.000000 Hz  16:9     67.500 kHz    297.000000 MHz
    VIC  95:  3840x2160   30.000000 Hz  16:9     67.500 kHz    297.000000 MHz
  Video Capability Data Block:
    YCbCr quantization: No Data
    RGB quantization: Selectable (via AVI Q)
    PT scan behavior: Always Underscanned
    IT scan behavior: Always Underscanned
    CE scan behavior: Always Underscanned
  Colorimetry Data Block:
    BT2020YCC
    BT2020RGB
  HDR Static Metadata Data Block:
    Electro optical transfer functions:
    Supported static metadata descriptors:
    Desired content max luminance: 0 (50.000 cd/m^2)
    Desired content max frame-average luminance: 0 (50.000 cd/m^2)
    Desired content min luminance: 0 (0.000 cd/m^2)
  Detailed Timing Descriptors:
    DTD 2:  2560x1440   59.997589 Hz  16:9     91.496 kHz    248.870000 MHz (697 mm x 392 mm)
                 Hfront   48 Hsync  32 Hback   80 Hpol P
                 Vfront    3 Vsync   5 Vback   77 Vpol N
    DTD 3:  2560x1440   59.950550 Hz  16:9     88.787 kHz    241.500000 MHz (697 mm x 392 mm)
                 Hfront   48 Hsync  32 Hback   80 Hpol P
                 Vfront    3 Vsync   5 Vback   33 Vpol N
Checksum: 0x5a  Unused space in Extension Block: 29 bytes


