edid-decode (hex):

00 ff ff ff ff ff ff 00 22 f0 15 26 01 01 01 01
24 11 01 03 80 32 1f 78 ea cf b5 a3 55 49 99 25
10 50 54 a5 6f 80 61 59 81 40 81 80 81 99 a9 40
d1 00 01 01 01 01 28 3c 80 a0 70 b0 23 40 30 20
36 00 ef 36 11 00 00 1a 00 00 00 fd 00 30 55 1e
5e 11 00 0a 20 20 20 20 20 20 00 00 00 fc 00 68
70 20 4c 32 33 33 35 0a 20 20 20 20 00 00 00 ff
00 43 4e 50 37 33 36 5a 30 34 48 0a 20 20 00 0d

----------------

Block 0, Base EDID:
  EDID Structure Version & Revision: 1.3
  Vendor & Product Identification:
    Manufacturer: HWP
    Model: 9749
    Serial Number: ...
    Made in: week 36 of 2007
  Basic Display Parameters & Features:
    Digital display
    Maximum image size: 50 cm x 31 cm
    Gamma: 2.20
    DPMS levels: Standby Suspend Off
    RGB color display
    First detailed timing is preferred timing
  Color Characteristics:
    Red  : 0.6396, 0.3320
    Green: 0.2880, 0.6005
    Blue : 0.1464, 0.0654
    White: 0.3134, 0.3291
  Established Timings I & II:
    IBM     :   720x400    70.082 Hz   9:5    31.467 kHz  28.320 MHz
    DMT 0x04:   640x480    59.940 Hz   4:3    31.469 kHz  25.175 MHz
    DMT 0x06:   640x480    75.000 Hz   4:3    37.500 kHz  31.500 MHz
    DMT 0x09:   800x600    60.317 Hz   4:3    37.879 kHz  40.000 MHz
    DMT 0x0b:   800x600    75.000 Hz   4:3    46.875 kHz  49.500 MHz
    Apple   :   832x624    74.551 Hz   4:3    49.726 kHz  57.284 MHz
    DMT 0x10:  1024x768    60.004 Hz   4:3    48.363 kHz  65.000 MHz
    DMT 0x11:  1024x768    70.069 Hz   4:3    56.476 kHz  75.000 MHz
    DMT 0x12:  1024x768    75.029 Hz   4:3    60.023 kHz  78.750 MHz
    DMT 0x24:  1280x1024   75.025 Hz   5:4    79.976 kHz 135.000 MHz
    Apple   :  1152x870    75.062 Hz 192:145  68.681 kHz 100.000 MHz
  Standard Timings:
    DMT 0x13:  1024x768    84.997 Hz   4:3    68.677 kHz  94.500 MHz
    DMT 0x20:  1280x960    60.000 Hz   4:3    60.000 kHz 108.000 MHz
    DMT 0x23:  1280x1024   60.020 Hz   5:4    63.981 kHz 108.000 MHz
    DMT 0x25:  1280x1024   85.024 Hz   5:4    91.146 kHz 157.500 MHz
    DMT 0x33:  1600x1200   60.000 Hz   4:3    75.000 kHz 162.000 MHz
    DMT 0x45:  1920x1200   59.885 Hz  16:10   74.556 kHz 193.250 MHz
  Detailed Timing Descriptors:
    DTD 1:  1920x1200   59.950 Hz   8:5    74.038 kHz 154.000 MHz (495 mm x 310 mm)
                 Hfront   48 Hsync  32 Hback  80 Hpol P
                 Vfront    3 Vsync   6 Vback  26 Vpol N
  Display Range Limits:
    Monitor ranges (GTF): 48-85 Hz V, 30-94 kHz H, max dotclock 170 MHz
    Display Product Name: 'hp L2335'
    Display Product Serial Number: ...
Checksum: 0xd
