
EDID (hex):
00ffffffffffff0009d1777f01010101
141e0104a53c22783fa265a454519d26
105054a56b80d1c081c081008180a9c0
b30081bc0101023a801871382d40582c
450056502100001e000000ff00454258
354c3034303438534c30000000fd0030
f0ffff3c010a202020202020000000fc
005a4f57494520584c204c43440a0107
020318f14b010203040590111213141f
2309070783010000fe5b80a070383540
3020350056502100001a866f80a07038
40403020350056502100001a5a8780a0
70384d403020350056502100001a23e8
8078703887401c20980c56502100001a
9cc700085200a0407490370056502100
001c00000000000000000000000000b8

Extracted contents:
header:          00 ff ff ff ff ff ff 00
serial number:   09 d1 77 7f 01 01 01 01 14 1e
version:         01 04
basic params:    a5 3c 22 78 3f
chroma info:     a2 65 a4 54 51 9d 26 10 50 54
established:     a5 6b 80
standard:        d1 c0 81 c0 81 00 81 80 a9 c0 b3 00 81 bc 01 01
descriptor 1:    02 3a 80 18 71 38 2d 40 58 2c 45 00 56 50 21 00 00 1e
descriptor 2:    00 00 00 ff 00 45 42 58 35 4c 30 34 30 34 38 53 4c 30
descriptor 3:    00 00 00 fd 00 30 f0 ff ff 3c 01 0a 20 20 20 20 20 20
descriptor 4:    00 00 00 fc 00 5a 4f 57 49 45 20 58 4c 20 4c 43 44 0a
extensions:      01
checksum:        07

EDID version: 1.4
Manufacturer: BNQ Model 7f77 Serial Number --
Made in week 20 of 2020
Digital display
8 bits per primary color channel
DisplayPort interface
Maximum image size: 60 cm x 34 cm
Gamma: 2.20
DPMS levels: Off
Supported color formats: RGB 4:4:4, YCrCb 4:4:4, YCrCb 4:2:2
Default (sRGB) color space is primary color space
First detailed timing includes the native pixel format and preferred refresh rate
Display is continuous frequency
Display x,y Chromaticity:
  Red:   0.6425, 0.3300
  Green: 0.3164, 0.6152
  Blue:  0.1494, 0.0644
  White: 0.3134, 0.3291
Established timings supported:
  720x400@70Hz 9:5 HorFreq: 31469 Hz Clock: 28.320 MHz
  640x480@60Hz 4:3 HorFreq: 31469 Hz Clock: 25.175 MHz
  640x480@75Hz 4:3 HorFreq: 37500 Hz Clock: 31.500 MHz
  800x600@60Hz 4:3 HorFreq: 37900 Hz Clock: 40.000 MHz
  800x600@75Hz 4:3 HorFreq: 46900 Hz Clock: 49.500 MHz
  832x624@75Hz 4:3 HorFreq: 49726 Hz Clock: 57.284 MHz
  1024x768@60Hz 4:3 HorFreq: 48400 Hz Clock: 65.000 MHz
  1024x768@75Hz 4:3 HorFreq: 60000 Hz Clock: 78.750 MHz
  1280x1024@75Hz 5:4 HorFreq: 80000 Hz Clock: 135.000 MHz
  1152x870@75Hz 192:145 HorFreq: 67500 Hz Clock: 108.000 MHz
Standard timings supported:
  1920x1080@60Hz 16:9
  1280x720@60Hz 16:9
  1280x800@60Hz 16:10
  1280x1024@60Hz 5:4 HorFreq: 64000 Hz Clock: 108.000 MHz
  1600x900@60Hz 16:9
  1680x1050@60Hz 16:10 HorFreq: 64700 Hz Clock: 119.000 MHz
  1280x1024@120Hz 5:4
Detailed mode: Clock 148.500 MHz, 598 mm x 336 mm
               1920 2008 2052 2200 hborder 0
               1080 1084 1089 1125 vborder 0
               +hsync +vsync 
               VertFreq: 60 Hz, HorFreq: 67500 Hz
Serial number: --
Monitor ranges (bare limits): 48-240Hz V, 255-255kHz H, max dotclock 600MHz
Monitor name: ZOWIE XL LCD
Has 1 extension blocks
Checksum: 0x7 (valid)

CTA extension block
Extension version: 3
20 bytes of CTA data
  Video data block
    VIC   1 640x480@60Hz 4:3  HorFreq: 31469 Hz Clock: 25.175 MHz
    VIC   2 720x480@60Hz 4:3  HorFreq: 31469 Hz Clock: 27.000 MHz
    VIC   3 720x480@60Hz 16:9  HorFreq: 31469 Hz Clock: 27.000 MHz
    VIC   4 1280x720@60Hz 16:9  HorFreq: 45000 Hz Clock: 74.250 MHz
    VIC   5 1920x1080i@60Hz 16:9  HorFreq: 33750 Hz Clock: 74.250 MHz
    VIC  16 1920x1080@60Hz 16:9 (native) HorFreq: 67500 Hz Clock: 148.500 MHz
    VIC  17 720x576@50Hz 4:3  HorFreq: 31250 Hz Clock: 27.000 MHz
    VIC  18 720x576@50Hz 16:9  HorFreq: 31250 Hz Clock: 27.000 MHz
    VIC  19 1280x720@50Hz 16:9  HorFreq: 37500 Hz Clock: 74.250 MHz
    VIC  20 1920x1080i@50Hz 16:9  HorFreq: 28125 Hz Clock: 74.250 MHz
    VIC  31 1920x1080@50Hz 16:9  HorFreq: 56250 Hz Clock: 148.500 MHz
  Audio data block
    Linear PCM, max channels 2
      Supported sample rates (kHz): 48 44.1 32
      Supported sample sizes (bits): 24 20 16
  Speaker allocation data block
    Speaker map:
      FL/FR - Front Left/Right
Underscans PC formats by default
Basic audio support
Supports YCbCr 4:4:4
Supports YCbCr 4:2:2
1 native detailed modes
Detailed mode: Clock 235.500 MHz, 598 mm x 336 mm
               1920 1968 2000 2080 hborder 0
               1080 1083 1088 1133 vborder 0
               +hsync -vsync 
               VertFreq: 99 Hz, HorFreq: 113221 Hz
Detailed mode: Clock 285.500 MHz, 598 mm x 336 mm
               1920 1968 2000 2080 hborder 0
               1080 1083 1088 1144 vborder 0
               +hsync -vsync 
               VertFreq: 119 Hz, HorFreq: 137259 Hz
Detailed mode: Clock 346.500 MHz, 598 mm x 336 mm
               1920 1968 2000 2080 hborder 0
               1080 1083 1088 1157 vborder 0
               +hsync -vsync 
               VertFreq: 143 Hz, HorFreq: 166586 Hz
Detailed mode: Clock 594.270 MHz, 598 mm x 336 mm
               1920 1948 1980 2040 hborder 0
               1080 1137 1145 1215 vborder 0
               +hsync -vsync 
               VertFreq: 239 Hz, HorFreq: 291308 Hz
Detailed mode: Clock 511.000 MHz, 598 mm x 336 mm
               1280 1396 1540 1800 hborder 0
               1024 1027 1034 1184 vborder 0
               -hsync +vsync 
               VertFreq: 239 Hz, HorFreq: 283888 Hz
Checksum: 0xb8 (valid)

EDID block does NOT conform to EDID 1.4!
	sRGB is signaled, but the chromaticities do not match
Warning: One or more of the timings is out of range of the Monitor Ranges:
  Vertical Freq: 50 - 239 Hz
  Horizontal Freq: 28125 - 291308 Hz
  Maximum Clock: 594.270 MHz
EDID block does not conform at all!
	Both the serial number and the serial string are set


