edid-decode (hex):

00 ff ff ff ff ff ff 00 1e 6d 66 4b 71 7f 07 00
08 11 01 03 a0 26 1e 78 22 ec 54 a5 58 4a 9a 26
21 50 54 a5 6b 80 31 4f 45 4f 61 4f 81 80 01 01
01 01 01 01 01 01 30 2a 00 98 51 00 2a 40 30 70
13 00 78 2d 11 00 00 1e 00 00 00 fd 00 38 4b 1e
53 0e 00 0a 20 20 20 20 20 20 00 00 00 fc 00 4c
31 39 37 32 48 0a 20 20 20 20 20 20 00 00 00 fc
00 0a 20 20 20 20 20 20 20 20 20 20 20 20 01 1e

02 03 23 c1 4b 00 00 84 00 00 00 03 00 00 00 00
23 09 04 01 83 01 00 00 67 03 0c 00 30 00 80 1e
e2 00 0f 02 3a 80 d0 72 38 2d 40 10 2c 45 80 a0
5a 00 00 00 1e 00 00 00 00 00 00 00 00 00 00 00
00 00 00 00 00 00 00 00 00 00 00 00 00 00 00 00
00 00 00 00 00 00 00 00 00 00 00 00 00 00 00 00
00 00 00 00 00 00 00 00 00 00 00 00 00 00 00 00
00 00 00 00 00 00 00 00 00 00 00 00 00 00 00 9f

----------------

Block 0, Base EDID:
  EDID Structure Version & Revision: 1.3
  Vendor & Product Identification:
    Manufacturer: GSM
    Model: 19302
    Serial Number: ...
    Made in: week 8 of 2007
  Basic Display Parameters & Features:
    Digital display
    Maximum image size: 38 cm x 30 cm
    Gamma: 2.20
    DPMS levels: Off
    Monochrome or grayscale display
    First detailed timing is the preferred timing
  Color Characteristics:
    Red  : 0.6474, 0.3457
    Green: 0.2919, 0.6015
    Blue : 0.1494, 0.1298
    White: 0.3134, 0.3281
  Established Timings I & II:
    IBM     :   720x400    70.082 Hz   9:5    31.467 kHz  28.320 MHz
    DMT 0x04:   640x480    59.940 Hz   4:3    31.469 kHz  25.175 MHz
    DMT 0x06:   640x480    75.000 Hz   4:3    37.500 kHz  31.500 MHz
    DMT 0x09:   800x600    60.317 Hz   4:3    37.879 kHz  40.000 MHz
    DMT 0x0b:   800x600    75.000 Hz   4:3    46.875 kHz  49.500 MHz
    Apple   :   832x624    74.551 Hz   4:3    49.726 kHz  57.284 MHz
    DMT 0x10:  1024x768    60.004 Hz   4:3    48.363 kHz  65.000 MHz
    DMT 0x12:  1024x768    75.029 Hz   4:3    60.023 kHz  78.750 MHz
    DMT 0x24:  1280x1024   75.025 Hz   5:4    79.976 kHz 135.000 MHz
    Apple   :  1152x870    75.062 Hz 192:145  68.681 kHz 100.000 MHz
  Standard Timings:
    DMT 0x06:   640x480    75.000 Hz   4:3    37.500 kHz  31.500 MHz
    DMT 0x0b:   800x600    75.000 Hz   4:3    46.875 kHz  49.500 MHz
    DMT 0x12:  1024x768    75.029 Hz   4:3    60.023 kHz  78.750 MHz
    DMT 0x23:  1280x1024   60.020 Hz   5:4    63.981 kHz 108.000 MHz
  Detailed Timing Descriptors:
    DTD 1:  1280x1024   60.020 Hz   5:4    63.981 kHz 108.000 MHz (376 mm x 301 mm)
                 Hfront   48 Hsync 112 Hback 248 Hpol P
                 Vfront    1 Vsync   3 Vback  38 Vpol P
  Display Range Limits:
    Monitor ranges (GTF): 56-75 Hz V, 30-83 kHz H, max dotclock 140 MHz
    Display Product Name: 'L1972H'
    Display Product Name: ''
  Extension blocks: 1
Checksum: 0x1e

----------------

Block 1, CTA-861 Extension Block:
  Revision: 3
  Underscans IT Video Formats by default
  Basic audio support
  Native detailed modes: 1
  Video Data Block:
    VIC   4:  1280x720    60.000 Hz  16:9    45.000 kHz  74.250 MHz (native)
    VIC   3:   720x480    59.940 Hz  16:9    31.469 kHz  27.000 MHz
  Audio Data Block:
    Linear PCM:
      Max channels: 2
      Supported sample rates (kHz): 48
      Supported sample sizes (bits): 16
  Speaker Allocation Data Block:
    FL/FR - Front Left/Right
  Vendor-Specific Data Block (HDMI), OUI 00-0C-03:
    Source physical address: 3.0.0.0
    Supports_AI
    Maximum TMDS clock: 150 MHz
  Video Capability Data Block:
    YCbCr quantization: No Data
    RGB quantization: No Data
    PT scan behavior: No Data
    IT scan behavior: Supports both over- and underscan
    CE scan behavior: Supports both over- and underscan
  Detailed Timing Descriptors:
    DTD 2:  1920x1080   50.000 Hz  16:9    56.250 kHz 148.500 MHz (160 mm x 90 mm)
                 Hfront  528 Hsync  44 Hback 148 Hpol P
                 Vfront    4 Vsync   5 Vback  36 Vpol P
Checksum: 0x9f

----------------

Warnings:

Block 1, CTA-861 Extension Block:
  Video Capability Data Block: Set Selectable RGB Quantization to avoid interop issues.

Failures:

Block 0, Base EDID:
  Basic Display Parameters & Features: Digital Video Interface Standard set to reserved value 0x20.
  Display Product Name: Empty string.
Block 1, CTA-861 Extension Block:
  Detailed Timing Descriptor #2: Mismatch of image size 160x90 mm vs display size 380x300 mm.
EDID:
  Base EDID: Some timings are out of range of the Monitor Ranges:
    Vertical Freq: 50.000 - 75.062 Hz (Monitor: 56.000 - 75.000 Hz)
    Maximum Clock: 148.500 MHz (Monitor: 140.000 MHz)
  CTA-861: Native progressive timings are a mix of several resolutions.

EDID conformity: FAIL
