
EDID (hex):
00ffffffffffff0063186e078b2b3c01
2c110103002f1d782ac905a3574b9c25
125054bfef80454a9500818001010101
0101010101017c2e90a0601a1e403020
3600da281100001a000000ff00463734
34324530373231313930000000fd0038
4b1f5311000a202020202020000000fc
004d32324549340a20202020202000e3

Extracted contents:
header:          00 ff ff ff ff ff ff 00
serial number:   63 18 6e 07 8b 2b 3c 01 2c 11
version:         01 03
basic params:    00 2f 1d 78 2a
chroma info:     c9 05 a3 57 4b 9c 25 12 50 54
established:     bf ef 80
standard:        45 4a 95 00 81 80 01 01 01 01 01 01 01 01 01 01
descriptor 1:    7c 2e 90 a0 60 1a 1e 40 30 20 36 00 da 28 11 00 00 1a
descriptor 2:    00 00 00 ff 00 46 37 34 34 32 45 30 37 32 31 31 39 30
descriptor 3:    00 00 00 fd 00 38 4b 1f 53 11 00 0a 20 20 20 20 20 20
descriptor 4:    00 00 00 fc 00 4d 32 32 45 49 34 0a 20 20 20 20 20 20
extensions:      00
checksum:        e3

EDID version: 1.3
Manufacturer: XXX Model 76e Serial Number --
Made in week 44 of 2007
Analog display, Input voltage level: 0.7/0.3 V
Sync: 
Maximum image size: 47 cm x 29 cm
Gamma: 2.20
DPMS levels: Off
RGB color display
First detailed timing is preferred timing
Display x,y Chromaticity:
  Red:   0.6396, 0.3398
  Green: 0.2949, 0.6103
  Blue:  0.1445, 0.0703
  White: 0.3134, 0.3291
Established timings supported:
  720x400@70Hz 9:5 HorFreq: 31469 Hz Clock: 28.320 MHz
  640x480@60Hz 4:3 HorFreq: 31469 Hz Clock: 25.175 MHz
  640x480@67Hz 4:3 HorFreq: 35000 Hz Clock: 30.240 MHz
  640x480@72Hz 4:3 HorFreq: 37900 Hz Clock: 31.500 MHz
  640x480@75Hz 4:3 HorFreq: 37500 Hz Clock: 31.500 MHz
  800x600@56Hz 4:3 HorFreq: 35200 Hz Clock: 36.000 MHz
  800x600@60Hz 4:3 HorFreq: 37900 Hz Clock: 40.000 MHz
  800x600@72Hz 4:3 HorFreq: 48100 Hz Clock: 50.000 MHz
  800x600@75Hz 4:3 HorFreq: 46900 Hz Clock: 49.500 MHz
  832x624@75Hz 4:3 HorFreq: 49726 Hz Clock: 57.284 MHz
  1024x768@60Hz 4:3 HorFreq: 48400 Hz Clock: 65.000 MHz
  1024x768@70Hz 4:3 HorFreq: 56500 Hz Clock: 75.000 MHz
  1024x768@75Hz 4:3 HorFreq: 60000 Hz Clock: 78.750 MHz
  1280x1024@75Hz 5:4 HorFreq: 80000 Hz Clock: 135.000 MHz
  1152x870@75Hz 192:145 HorFreq: 67500 Hz Clock: 108.000 MHz
Standard timings supported:
  800x600@70Hz 4:3
  1440x900@60Hz 16:10 HorFreq: 55500 Hz Clock: 88.750 MHz
  1280x1024@60Hz 5:4 HorFreq: 64000 Hz Clock: 108.000 MHz
Detailed mode: Clock 119.000 MHz, 474 mm x 296 mm
               1680 1728 1760 1840 hborder 0
               1050 1053 1059 1080 vborder 0
               +hsync -vsync 
               VertFreq: 59 Hz, HorFreq: 64673 Hz
Serial number: --
Monitor ranges (GTF): 56-75Hz V, 31-83kHz H, max dotclock 170MHz
Monitor name: M22EI4
Checksum: 0xe3 (valid)
