
EDID (hex):
00ffffffffffff004c2d370d3050364d
221a0103803c22782a5295a556549d25
0e5054b38c0081c0810081809500a9c0
b30001010101215280a07238304088c8
350056502100001c000000fd0030481e
5216000a202020202020000000fc0043
3237463539310a2020202020000000ff
0048544e483830313530320a20200168

Extracted contents:
header:          00 ff ff ff ff ff ff 00
serial number:   4c 2d 37 0d 30 50 36 4d 22 1a
version:         01 03
basic params:    80 3c 22 78 2a
chroma info:     52 95 a5 56 54 9d 25 0e 50 54
established:     b3 8c 00
standard:        81 c0 81 00 81 80 95 00 a9 c0 b3 00 01 01 01 01
descriptor 1:    21 52 80 a0 72 38 30 40 88 c8 35 00 56 50 21 00 00 1c
descriptor 2:    00 00 00 fd 00 30 48 1e 52 16 00 0a 20 20 20 20 20 20
descriptor 3:    00 00 00 fc 00 43 32 37 46 35 39 31 0a 20 20 20 20 20
descriptor 4:    00 00 00 ff 00 48 54 4e 48 38 30 31 35 30 32 0a 20 20
extensions:      01
checksum:        68

EDID version: 1.3
Manufacturer: SAM Model d37 Serial Number --
Made in week 34 of 2016
Digital display
Maximum image size: 60 cm x 34 cm
Gamma: 2.20
DPMS levels: Off
RGB color display
First detailed timing is preferred timing
Display x,y Chromaticity:
  Red:   0.6455, 0.3369
  Green: 0.3281, 0.6152
  Blue:  0.1464, 0.0556
  White: 0.3134, 0.3291
Established timings supported:
  720x400@70Hz 9:5 HorFreq: 31469 Hz Clock: 28.320 MHz
  640x480@60Hz 4:3 HorFreq: 31469 Hz Clock: 25.175 MHz
  640x480@67Hz 4:3 HorFreq: 35000 Hz Clock: 30.240 MHz
  800x600@56Hz 4:3 HorFreq: 35200 Hz Clock: 36.000 MHz
  800x600@60Hz 4:3 HorFreq: 37900 Hz Clock: 40.000 MHz
  800x600@72Hz 4:3 HorFreq: 48100 Hz Clock: 50.000 MHz
  1024x768@60Hz 4:3 HorFreq: 48400 Hz Clock: 65.000 MHz
  1024x768@70Hz 4:3 HorFreq: 56500 Hz Clock: 75.000 MHz
Standard timings supported:
  1280x720@60Hz 16:9
  1280x800@60Hz 16:10
  1280x1024@60Hz 5:4 HorFreq: 64000 Hz Clock: 108.000 MHz
  1440x900@60Hz 16:10 HorFreq: 55500 Hz Clock: 88.750 MHz
  1600x900@60Hz 16:9
  1680x1050@60Hz 16:10 HorFreq: 64700 Hz Clock: 119.000 MHz
Detailed mode: Clock 210.250 MHz, 598 mm x 336 mm
               1920 2056 2256 2592 hborder 0
               1080 1083 1088 1128 vborder 0
               -hsync +vsync 
               VertFreq: 71 Hz, HorFreq: 81114 Hz
Monitor ranges (GTF): 48-72Hz V, 30-82kHz H, max dotclock 220MHz
Monitor name: C27F591
Serial number: --
Has 1 extension blocks
Checksum: 0x68 (valid)
