edid-decode (hex):

00 ff ff ff ff ff ff 00 44 93 11 00 00 00 00 00
00 0f 01 03 80 1e 17 78 0a 58 20 97 53 50 90 23
1e 50 54 00 00 00 01 01 01 01 01 01 01 01 01 01
01 01 01 01 01 01 64 19 00 40 41 00 26 30 18 88
36 00 30 e4 10 00 00 19 00 00 00 0f 00 04 c0 2e
c0 02 11 11 11 76 c0 12 63 01 00 00 00 fe 00 51
55 41 4e 54 41 44 49 53 50 4c 41 59 00 00 00 fe
00 51 44 31 35 58 4c 30 36 31 0a 20 20 20 00 18

----------------

Block 0, Base EDID:
  EDID Structure Version & Revision: 1.3
  Vendor & Product Identification:
    Manufacturer: QDS
    Model: 17
    Made in: 2005
  Basic Display Parameters & Features:
    Digital display
    Maximum image size: 30 cm x 23 cm
    Gamma: 2.20
    RGB color display
    First detailed timing is preferred timing
  Color Characteristics:
    Red  : 0.5908, 0.3251
    Green: 0.3144, 0.5625
    Blue : 0.1367, 0.1191
    White: 0.3125, 0.3281
  Established Timings I & II: none
  Standard Timings: none
  Detailed Timing Descriptors:
    DTD 1:  1024x768    60.004 Hz   4:3    48.363 kHz  65.000 MHz (304 mm x 228 mm)
                 Hfront   24 Hsync 136 Hback 160 Hpol N
                 Vfront    3 Vsync   6 Vback  29 Vpol N
    Manufacturer-Specified Display Descriptor (0x0f): 00 0f 00 04 c0 2e c0 02 11 11 11 76 c0 12 63 01 '...........v..c.'
    Alphanumeric Data String: 'QUANTADISPLAY'
    Alphanumeric Data String: 'QD15XL061'
Checksum: 0x18
