edid-decode (hex):

00 ff ff ff ff ff ff 00 32 0c 00 c5 00 00 00 00
00 10 01 03 80 21 15 78 0a 0f 10 97 58 52 88 28
23 50 54 00 00 00 01 01 01 01 01 01 01 01 01 01
01 01 01 01 01 01 7e 1d 00 e8 50 20 20 30 40 30
36 00 4b cf 10 00 00 19 7e 1d 00 e8 50 20 20 30
40 30 36 00 4b cf 10 00 00 00 00 00 00 fe 00 54
4d 30 33 37 00 31 35 34 57 30 31 0a 00 00 00 fe
00 1f 2d 3a 45 65 8c ab ff 01 01 0a 20 20 00 4c

----------------

Block 0, Base EDID:
  EDID Structure Version & Revision: 1.3
  Vendor & Product Identification:
    Manufacturer: LPL
    Model: 50432
    Made in: 2006
  Basic Display Parameters & Features:
    Digital display
    Maximum image size: 33 cm x 21 cm
    Gamma: 2.20
    RGB color display
    First detailed timing is the preferred timing
  Color Characteristics:
    Red  : 0.5898, 0.3437
    Green: 0.3232, 0.5341
    Blue : 0.1562, 0.1376
    White: 0.3125, 0.3281
  Established Timings I & II: none
  Standard Timings: none
  Detailed Timing Descriptors:
    DTD 1:  1280x800    60.016662 Hz   8:5     49.934 kHz     75.500000 MHz (DE timing only, 331 mm x 207 mm)
                 Hfront   64 Hsync  48 Hback  120 Hpol N
                 Vfront    3 Vsync   6 Vback   23 Vpol N
    DTD 2:  1280x800    60.016662 Hz   8:5     49.934 kHz     75.500000 MHz (DE timing only, 331 mm x 207 mm)
                 Hfront   64 Hsync  48 Hback  120 Hpol N
                 Vfront    3 Vsync   6 Vback   23 Vpol N
    SPWG Module Revision: 0
    SPWG Descriptor #3:
      SPWG PC Maker P/N: 'TM037'
      SPWG LCD Supplier EEDID Revision: 0
      SPWG Manufacturer P/N: '154W01'
    SPWG Descriptor #4:
      SMBUS Values: 0x1f 0x2d 0x3a 0x45 0x65 0x8c 0xab 0xff
      LVDS Channels: 1
      Panel Self Test Present
Checksum: 0x4c

----------------

Failures:

Block 0, Base EDID:
  Missing Display Product Name.
  Missing Display Range Limits Descriptor.

EDID conformity: FAIL
