edid-decode (hex):

00 ff ff ff ff ff ff 00 09 e5 2f 09 30 30 4a 37
06 1f 01 04 b5 22 17 78 02 ee 95 a3 54 4c 99 26
0f 50 54 00 00 00 01 01 01 01 01 01 01 01 01 01
01 01 01 01 01 01 0a 6c d8 a0 90 90 28 60 30 20
36 00 52 e2 10 00 00 1a 00 00 00 00 00 00 00 00
00 00 00 00 00 00 00 00 00 00 00 00 00 fe 00 42
4f 45 20 58 53 0a 20 20 20 20 20 20 00 00 00 fe
00 54 56 31 36 30 44 4b 54 2d 4e 48 30 0a 00 23

00 ff ff ff ff ff ff 00 09 e5 2f 09 30 30 4a 37
06 1f 01 04 b5 22 17 78 02 ee 95 a3 54 4c 99 26
0f 50 54 00 00 00 01 01 01 01 01 01 01 01 01 01
01 01 01 01 01 01 0a 6c d8 a0 90 90 28 60 30 20
36 00 52 e2 10 00 00 1a 00 00 00 00 00 00 00 00
00 00 00 00 00 00 00 00 00 00 00 00 00 fe 00 42
4f 45 20 58 53 0a 20 20 20 20 20 20 00 00 00 fe
00 54 56 31 36 30 44 4b 54 2d 4e 48 30 0a 00 23

----------------

Block 0, Base EDID:
  EDID Structure Version & Revision: 1.4
  Vendor & Product Identification:
    Manufacturer: BOE
    Model: 2351
    Serial Number: ...
    Made in: week 6 of 2021
  Basic Display Parameters & Features:
    Digital display
    Bits per primary color channel: 10
    DisplayPort interface
    Maximum image size: 34 cm x 23 cm
    Gamma: 2.20
    Supported color formats: RGB 4:4:4
    First detailed timing includes the native pixel format and preferred refresh rate
  Color Characteristics:
    Red  : 0.6396, 0.3300
    Green: 0.2998, 0.5996
    Blue : 0.1503, 0.0595
    White: 0.3134, 0.3291
  Established Timings I & II: none
  Standard Timings: none
  Detailed Timing Descriptors:
    DTD 1:  2520x1680   60.000868 Hz   3:2    103.201 kHz    276.580000 MHz (338 mm x 226 mm)
                 Hfront   48 Hsync  32 Hback   80 Hpol P
                 Vfront    3 Vsync   6 Vback   31 Vpol N
    Empty Descriptor
    Alphanumeric Data String: 'BOE XS'
    Alphanumeric Data String: 'TV160DKT-NH0'
Checksum: 0x23

----------------

Block 1, Unknown EDID Extension Block 0x00:
  00 ff ff ff ff ff ff 00 09 e5 2f 09 30 30 4a 37 '........../.00J7'
  06 1f 01 04 b5 22 17 78 02 ee 95 a3 54 4c 99 26 '.....".x....TL.&'
  0f 50 54 00 00 00 01 01 01 01 01 01 01 01 01 01 '.PT.............'
  01 01 01 01 01 01 0a 6c d8 a0 90 90 28 60 30 20 '.......l....(`0 '
  36 00 52 e2 10 00 00 1a 00 00 00 00 00 00 00 00 '6.R.............'
  00 00 00 00 00 00 00 00 00 00 00 00 00 fe 00 42 '...............B'
  4f 45 20 58 53 0a 20 20 20 20 20 20 00 00 00 fe 'OE XS.      ....'
  00 54 56 31 36 30 44 4b 54 2d 4e 48 30 0a 00 23 '.TV160DKT-NH0..#'
Checksum: 0x23

----------------

Warnings:

Block 0, Base EDID:
  Missing Display Product Name.

Failures:

Block 0, Base EDID:
  Empty Descriptor: Use Dummy Descriptor instead of all zeroes.
Block 1, Base EDID:
  Unknown Extension Block.
EDID:
  Base EDID: EDID specified 0 extension block(s), but found 1 extension block(s).

EDID conformity: FAIL
