
EDID (hex):
00ffffffffffff0009e52f0930323443
03200104b522177802ee95a3544c9926
0f505400000001010101010101010101
0101010101010a6cd8a0909028603020
360052e21000001a0000000000000000
00000000000000000000000000fe0042
4f452058530a202020202020000000fe
005456313630444b542d4e48300a012c
70137900000301140a6c0004d7099f00
2f001f008f0627000200050000000000
00000000000000000000000000000000
00000000000000000000000000000000
00000000000000000000000000000000
00000000000000000000000000000000
00000000000000000000000000000000
00000000000000000000000000005290

edid-decode (hex):

00 ff ff ff ff ff ff 00 09 e5 2f 09 30 32 34 43
03 20 01 04 b5 22 17 78 02 ee 95 a3 54 4c 99 26
0f 50 54 00 00 00 01 01 01 01 01 01 01 01 01 01
01 01 01 01 01 01 0a 6c d8 a0 90 90 28 60 30 20
36 00 52 e2 10 00 00 1a 00 00 00 00 00 00 00 00
00 00 00 00 00 00 00 00 00 00 00 00 00 fe 00 42
4f 45 20 58 53 0a 20 20 20 20 20 20 00 00 00 fe
00 54 56 31 36 30 44 4b 54 2d 4e 48 30 0a 01 2c

70 13 79 00 00 03 01 14 0a 6c 00 04 d7 09 9f 00
2f 00 1f 00 8f 06 27 00 02 00 05 00 00 00 00 00
00 00 00 00 00 00 00 00 00 00 00 00 00 00 00 00
00 00 00 00 00 00 00 00 00 00 00 00 00 00 00 00
00 00 00 00 00 00 00 00 00 00 00 00 00 00 00 00
00 00 00 00 00 00 00 00 00 00 00 00 00 00 00 00
00 00 00 00 00 00 00 00 00 00 00 00 00 00 00 00
00 00 00 00 00 00 00 00 00 00 00 00 00 00 52 90

----------------

Block 0, Base EDID:
  EDID Structure Version & Revision: 1.4
  Vendor & Product Identification:
    Manufacturer: BOE
    Model: 2351
    Serial Number: 1127494192
    Made in: week 3 of 2022
  Basic Display Parameters & Features:
    Digital display
    Bits per primary color channel: 10
    DisplayPort interface
    Maximum image size: 34 cm x 23 cm
    Gamma: 2.20
    Supported color formats: RGB 4:4:4
    First detailed timing includes the native pixel format and preferred refresh rate
  Color Characteristics:
    Red  : 0.6396, 0.3300
    Green: 0.2998, 0.5996
    Blue : 0.1503, 0.0595
    White: 0.3134, 0.3291
  Established Timings I & II: none
  Standard Timings: none
  Detailed Timing Descriptors:
    DTD 1:  2520x1680   60.000868 Hz   3:2    103.201 kHz    276.580000 MHz (338 mm x 226 mm)
                 Hfront   48 Hsync  32 Hback   80 Hpol P
                 Vfront    3 Vsync   6 Vback   31 Vpol N
    Empty Descriptor
    Alphanumeric Data String: 'BOE XS'
    Alphanumeric Data String: 'TV160DKT-NH0'
  Extension blocks: 1
Checksum: 0x2c

----------------

Block 1, DisplayID Extension Block:
  Version: 1.3
  Extension Count: 0
  Display Product Type: Extension Section
  Video Timing Modes Type 1 - Detailed Timings Data Block:
    DTD:  2520x1680   60.003037 Hz  16:9    103.205 kHz    276.590000 MHz (aspect 16:9, no 3D stereo)
               Hfront   48 Hsync  32 Hback   80 Hpol N
               Vfront    3 Vsync   6 Vback   31 Vpol N
  Checksum: 0x52
Checksum: 0x90
