edid-decode (hex):

00 ff ff ff ff ff ff 00 4c a3 44 30 00 00 00 00
00 0f 01 03 80 1f 17 78 0a d9 0e 96 56 52 86 27
23 50 54 00 00 00 01 01 01 01 01 01 01 01 01 01
01 01 01 01 01 01 64 19 00 40 41 00 26 30 18 88
36 00 30 e4 10 00 00 19 00 00 00 0f 00 04 7e 18
ff 01 05 02 6f 18 ff 02 74 02 00 00 00 fe 00 53
41 4d 53 55 4e 47 0a 20 20 20 20 20 00 00 00 fe
00 4c 54 4e 31 35 30 58 42 2d 4c 30 33 0a 00 d2

----------------

Block 0, Base EDID:
  EDID Structure Version & Revision: 1.3
  Vendor & Product Identification:
    Manufacturer: SEC
    Model: 12356
    Made in: 2005
  Basic Display Parameters & Features:
    Digital display
    Maximum image size: 31 cm x 23 cm
    Gamma: 2.20
    RGB color display
    First detailed timing is preferred timing
  Color Characteristics:
    Red  : 0.5888, 0.3369
    Green: 0.3222, 0.5244
    Blue : 0.1523, 0.1367
    White: 0.3154, 0.3300
  Established Timings I & II: none
  Standard Timings: none
  Detailed Timing Descriptors:
    DTD 1:  1024x768    60.004 Hz   4:3    48.363 kHz  65.000 MHz (304 mm x 228 mm)
                 Hfront   24 Hsync 136 Hback 160 Hpol N
                 Vfront    3 Vsync   6 Vback  29 Vpol N
    Manufacturer-Specified Display Descriptor (0x0f): 00 0f 00 04 7e 18 ff 01 05 02 6f 18 ff 02 74 02 '....~.....o...t.'
    Alphanumeric Data String: 'SAMSUNG'
    Alphanumeric Data String: 'LTN150XB-L03'
Checksum: 0xd2

----------------

Failures:

Block 0, Base EDID:
  Missing Display Product Name.
  Missing Display Range Limits Descriptor.

EDID conformity: FAIL
