edid-decode (hex):

00 ff ff ff ff ff ff 00 04 69 a1 19 01 01 01 01
18 10 01 03 80 29 1a 78 ea d2 b5 a2 59 4a 95 24
14 50 54 af cf 00 81 80 71 4f 95 00 01 01 01 01
01 01 01 01 01 01 68 29 a0 d0 51 84 22 30 50 98
36 00 9a 04 11 00 00 14 00 00 00 fd 00 37 4b 1e
50 0e 00 0a 20 20 20 20 20 20 00 00 00 ff 00 36
36 4c 39 30 30 32 34 37 33 0a 20 20 00 00 00 fc
00 50 57 31 39 31 0a 20 20 20 20 20 20 20 00 0f

----------------

Block 0, Base EDID:
  EDID Structure Version & Revision: 1.3
  Vendor & Product Identification:
    Manufacturer: ACI
    Model: 6561
    Serial Number: ...
    Made in: week 24 of 2006
  Basic Display Parameters & Features:
    Digital display
    Maximum image size: 41 cm x 26 cm
    Gamma: 2.20
    DPMS levels: Standby Suspend Off
    RGB color display
    First detailed timing is the preferred timing
  Color Characteristics:
    Red  : 0.6357, 0.3486
    Green: 0.2890, 0.5839
    Blue : 0.1425, 0.0810
    White: 0.3134, 0.3291
  Established Timings I & II:
    IBM     :   720x400    70.082 Hz   9:5    31.467 kHz  28.320 MHz
    DMT 0x04:   640x480    59.940 Hz   4:3    31.469 kHz  25.175 MHz
    DMT 0x05:   640x480    72.809 Hz   4:3    37.861 kHz  31.500 MHz
    DMT 0x06:   640x480    75.000 Hz   4:3    37.500 kHz  31.500 MHz
    DMT 0x08:   800x600    56.250 Hz   4:3    35.156 kHz  36.000 MHz
    DMT 0x09:   800x600    60.317 Hz   4:3    37.879 kHz  40.000 MHz
    DMT 0x0a:   800x600    72.188 Hz   4:3    48.077 kHz  50.000 MHz
    DMT 0x0b:   800x600    75.000 Hz   4:3    46.875 kHz  49.500 MHz
    DMT 0x10:  1024x768    60.004 Hz   4:3    48.363 kHz  65.000 MHz
    DMT 0x11:  1024x768    70.069 Hz   4:3    56.476 kHz  75.000 MHz
    DMT 0x12:  1024x768    75.029 Hz   4:3    60.023 kHz  78.750 MHz
    DMT 0x24:  1280x1024   75.025 Hz   5:4    79.976 kHz 135.000 MHz
  Standard Timings:
    DMT 0x23:  1280x1024   60.020 Hz   5:4    63.981 kHz 108.000 MHz
    DMT 0x15:  1152x864    75.000 Hz   4:3    67.500 kHz 108.000 MHz
    DMT 0x2f:  1440x900    59.887 Hz  16:10   55.935 kHz 106.500 MHz
  Detailed Timing Descriptors:
    DTD 1:  1440x900    59.606 Hz   8:5    55.672 kHz 106.000 MHz (digital composite, serrate, 410 mm x 260 mm)
                 Hfront   80 Hsync 152 Hback 232 Hpol N
                 Vfront    3 Vsync   6 Vback  25
  Display Range Limits:
    Monitor ranges (GTF): 55-75 Hz V, 30-80 kHz H, max dotclock 140 MHz
    Display Product Serial Number: ...
    Display Product Name: 'PW191'
Checksum: 0x0f

----------------

EDID conformity: PASS
