edid-decode (hex):

00 ff ff ff ff ff ff 00 4c 2d df 03 00 00 00 00
02 12 01 03 80 10 09 78 0a e5 b1 a3 55 49 99 83
13 50 54 21 08 00 81 80 01 01 01 01 01 01 01 01
01 01 01 01 01 01 9a 29 a0 d0 51 84 22 30 50 98
36 00 a0 5a 00 00 00 1c 01 1d 00 72 51 d0 1e 20
6e 28 55 00 a0 5a 00 00 00 1e 00 00 00 fd 00 17
3d 1a 44 0f 00 0a 20 20 20 20 20 20 00 00 00 fc
00 53 41 4d 53 55 4e 47 0a 20 20 20 20 20 01 c9

02 03 1f f1 4b 84 13 05 14 03 12 10 1f 20 21 22
23 09 07 07 83 01 00 00 66 03 0c 00 10 00 80 66
21 50 b0 51 00 1b 30 40 70 36 00 a0 5a 00 00 00
1e 01 1d 00 bc 52 d0 1e 20 b8 28 55 40 a0 5a 00
00 00 1e 01 1d 80 18 71 1c 16 20 58 2c 25 00 a0
5a 00 00 00 9e 01 1d 80 d0 72 1c 16 20 10 2c 25
80 a0 5a 00 00 00 9e 8c 0a d0 8a 20 e0 2d 10 10
3e 96 00 a0 5a 00 00 00 18 00 00 00 00 00 00 16

----------------

Block 0, Base EDID:
  EDID Structure Version & Revision: 1.3
  Vendor & Product Identification:
    Manufacturer: SAM
    Model: 991
    Made in: week 2 of 2008
  Basic Display Parameters & Features:
    Digital display
    Maximum image size: 16 cm x 9 cm
    Gamma: 2.20
    RGB color display
    First detailed timing is the preferred timing
  Color Characteristics:
    Red  : 0.6396, 0.3339
    Green: 0.2861, 0.5986
    Blue : 0.5136, 0.0771
    White: 0.3125, 0.3291
  Established Timings I & II:
    DMT 0x04:   640x480    59.940 Hz   4:3    31.469 kHz  25.175 MHz
    DMT 0x09:   800x600    60.317 Hz   4:3    37.879 kHz  40.000 MHz
    DMT 0x10:  1024x768    60.004 Hz   4:3    48.363 kHz  65.000 MHz
  Standard Timings:
    DMT 0x23:  1280x1024   60.020 Hz   5:4    63.981 kHz 108.000 MHz
  Detailed Timing Descriptors:
    DTD 1:  1440x900    59.887 Hz   8:5    55.935 kHz 106.500 MHz (160 mm x 90 mm)
                 Hfront   80 Hsync 152 Hback 232 Hpol N
                 Vfront    3 Vsync   6 Vback  25 Vpol P
    DTD 2:  1280x720    60.000 Hz  16:9    45.000 kHz  74.250 MHz (160 mm x 90 mm)
                 Hfront  110 Hsync  40 Hback 220 Hpol P
                 Vfront    5 Vsync   5 Vback  20 Vpol P
  Display Range Limits:
    Monitor ranges (GTF): 23-61 Hz V, 26-68 kHz H, max dotclock 150 MHz
    Display Product Name: 'SAMSUNG'
  Extension blocks: 1
Checksum: 0xc9

----------------

Block 1, CTA-861 Extension Block:
  Revision: 3
  Underscans IT Video Formats by default
  Basic audio support
  Supports YCbCr 4:4:4
  Supports YCbCr 4:2:2
  Native detailed modes: 1
  Video Data Block:
    VIC   4:  1280x720    60.000 Hz  16:9    45.000 kHz  74.250 MHz (native)
    VIC  19:  1280x720    50.000 Hz  16:9    37.500 kHz  74.250 MHz
    VIC   5:  1920x1080i  60.000 Hz  16:9    33.750 kHz  74.250 MHz
    VIC  20:  1920x1080i  50.000 Hz  16:9    28.125 kHz  74.250 MHz
    VIC   3:   720x480    59.940 Hz  16:9    31.469 kHz  27.000 MHz
    VIC  18:   720x576    50.000 Hz  16:9    31.250 kHz  27.000 MHz
    VIC  16:  1920x1080   60.000 Hz  16:9    67.500 kHz 148.500 MHz
    VIC  31:  1920x1080   50.000 Hz  16:9    56.250 kHz 148.500 MHz
    VIC  32:  1920x1080   24.000 Hz  16:9    27.000 kHz  74.250 MHz
    VIC  33:  1920x1080   25.000 Hz  16:9    28.125 kHz  74.250 MHz
    VIC  34:  1920x1080   30.000 Hz  16:9    33.750 kHz  74.250 MHz
  Audio Data Block:
    Linear PCM:
      Max channels: 2
      Supported sample rates (kHz): 48 44.1 32
      Supported sample sizes (bits): 24 20 16
  Speaker Allocation Data Block:
    FL/FR - Front Left/Right
  Vendor-Specific Data Block (HDMI), OUI 00-0C-03:
    Source physical address: 1.0.0.0
    Supports_AI
  Detailed Timing Descriptors:
    DTD 3:  1360x768    60.015 Hz  85:48   47.712 kHz  85.500 MHz (160 mm x 90 mm)
                 Hfront   64 Hsync 112 Hback 256 Hpol P
                 Vfront    3 Vsync   6 Vback  18 Vpol P
    DTD 4:  1280x720    50.000 Hz  16:9    37.500 kHz  74.250 MHz (160 mm x 90 mm)
                 Hfront  440 Hsync  40 Hback 220 Hpol P
                 Vfront    5 Vsync   5 Vback  20 Vpol P
    DTD 5:  1920x1080i  60.000 Hz  16:9    33.750 kHz  74.250 MHz (160 mm x 90 mm)
                 Hfront   88 Hsync  44 Hback 148 Hpol P
                 Vfront    2 Vsync   5 Vback  15 Vpol P Vfront +0.5 Odd Field
                 Vfront    2 Vsync   5 Vback  15 Vpol P Vback  +0.5 Even Field
    DTD 6:  1920x1080i  50.000 Hz  16:9    28.125 kHz  74.250 MHz (160 mm x 90 mm)
                 Hfront  528 Hsync  44 Hback 148 Hpol P
                 Vfront    2 Vsync   5 Vback  15 Vpol P Vfront +0.5 Odd Field
                 Vfront    2 Vsync   5 Vback  15 Vpol P Vback  +0.5 Even Field
    DTD 7:   720x480    59.940 Hz   3:2    31.469 kHz  27.000 MHz (160 mm x 90 mm)
                 Hfront   16 Hsync  62 Hback  60 Hpol N
                 Vfront    9 Vsync   6 Vback  30 Vpol N
Checksum: 0x16

----------------

Warnings:

Block 0, Base EDID:
  Basic Display Parameters & Features: Dubious maximum image size (16x9 is smaller than 10x10 cm).
Block 1, CTA-861 Extension Block:
  Missing VCDB, needed for Set Selectable RGB Quantization to avoid interop issues.

Failures:

EDID:
  CTA-861: Native progressive timings are a mix of several resolutions.

EDID conformity: FAIL
