edid-decode (hex):

00 ff ff ff ff ff ff 00 1e f9 f1 05 01 01 01 01
34 0b 01 03 68 1e 17 78 ea 6d 8c 98 59 50 93 26
20 4c 52 bf ee 00 31 4f 45 4f 01 01 01 01 01 01
01 01 01 01 01 01 c3 1e 00 20 41 00 20 30 10 60
13 00 30 e4 10 00 00 1e 00 00 00 fd 00 37 4b 1f
3c 08 00 0a 20 20 20 20 20 20 00 00 00 fc 00 46
50 44 31 35 32 30 0a 20 20 20 20 20 00 00 00 ff
00 4c 49 43 31 35 32 42 32 36 36 34 0a 20 00 3d

00 ff ff ff ff ff ff 00 1e f9 f1 05 01 01 01 01
34 0b 01 03 68 1e 17 78 ea 6d 8c 98 59 50 93 26
20 4c 52 bf ee 00 31 4f 45 4f 01 01 01 01 01 01
01 01 01 01 01 01 c3 1e 00 20 41 00 20 30 10 60
13 00 30 e4 10 00 00 1e 00 00 00 fd 00 37 4b 1f
3c 08 00 0a 20 20 20 20 20 20 00 00 00 fc 00 46
50 44 31 35 32 30 0a 20 20 20 20 20 00 00 00 ff
00 4c 49 43 31 35 32 42 32 36 36 34 0a 20 00 3d

----------------

Block 0, Base EDID:
  EDID Structure Version & Revision: 1.3
  Vendor & Product Identification:
    Manufacturer: GWY
    Model: 1521
    Serial Number: ...
    Made in: week 52 of 2001
  Basic Display Parameters & Features:
    Analog display
    Signal Level Standard: 0.700 : 0.000 : 0.700 V p-p
    Blank level equals black level
    Sync: Separate
    Maximum image size: 30 cm x 23 cm
    Gamma: 2.20
    DPMS levels: Standby Suspend Off
    RGB color display
    First detailed timing is the preferred timing
  Color Characteristics:
    Red  : 0.5947, 0.3496
    Green: 0.3154, 0.5751
    Blue : 0.1503, 0.1250
    White: 0.2998, 0.3203
  Established Timings I & II:
    IBM     :   720x400    70.081663 Hz   9:5     31.467 kHz     28.320000 MHz
    DMT 0x04:   640x480    59.940476 Hz   4:3     31.469 kHz     25.175000 MHz
    Apple   :   640x480    66.666667 Hz   4:3     35.000 kHz     30.240000 MHz
    DMT 0x05:   640x480    72.808802 Hz   4:3     37.861 kHz     31.500000 MHz
    DMT 0x06:   640x480    75.000000 Hz   4:3     37.500 kHz     31.500000 MHz
    DMT 0x08:   800x600    56.250000 Hz   4:3     35.156 kHz     36.000000 MHz
    DMT 0x09:   800x600    60.316541 Hz   4:3     37.879 kHz     40.000000 MHz
    DMT 0x0a:   800x600    72.187572 Hz   4:3     48.077 kHz     50.000000 MHz
    DMT 0x0b:   800x600    75.000000 Hz   4:3     46.875 kHz     49.500000 MHz
    Apple   :   832x624    74.551266 Hz   4:3     49.726 kHz     57.284000 MHz
    DMT 0x10:  1024x768    60.003840 Hz   4:3     48.363 kHz     65.000000 MHz
    DMT 0x11:  1024x768    70.069359 Hz   4:3     56.476 kHz     75.000000 MHz
    DMT 0x12:  1024x768    75.028582 Hz   4:3     60.023 kHz     78.750000 MHz
  Standard Timings:
    DMT 0x06:   640x480    75.000000 Hz   4:3     37.500 kHz     31.500000 MHz
    DMT 0x0b:   800x600    75.000000 Hz   4:3     46.875 kHz     49.500000 MHz
  Detailed Timing Descriptors:
    DTD 1:  1024x768    75.028582 Hz   4:3     60.023 kHz     78.750000 MHz (304 mm x 228 mm)
                 Hfront   16 Hsync  96 Hback  176 Hpol P
                 Vfront    1 Vsync   3 Vback   28 Vpol P
    Display Range Limits:
      Monitor ranges (GTF): 55-75 Hz V, 31-60 kHz H, max dotclock 80 MHz
    Display Product Name: 'FPD1520'
    Display Product Serial Number: ...
Checksum: 0x3d

----------------

Block 1, Unknown EDID Extension Block 0x00:
  00 ff ff ff ff ff ff 00 1e f9 f1 05 01 01 01 01 '................'
  34 0b 01 03 68 1e 17 78 ea 6d 8c 98 59 50 93 26 '4...h..x.m..YP.&'
  20 4c 52 bf ee 00 31 4f 45 4f 01 01 01 01 01 01 ' LR...1OEO......'
  01 01 01 01 01 01 c3 1e 00 20 41 00 20 30 10 60 '......... A. 0.`'
  13 00 30 e4 10 00 00 1e 00 00 00 fd 00 37 4b 1f '..0..........7K.'
  3c 08 00 0a 20 20 20 20 20 20 00 00 00 fc 00 46 '<...      .....F'
  50 44 31 35 32 30 0a 20 20 20 20 20 00 00 00 ff 'PD1520.     ....'
  00 4c 49 43 31 35 32 42 32 36 36 34 0a 20 00 3d '.LIC152B2664. .='
Checksum: 0x3d

----------------

Failures:

Block 1, Base EDID:
  Unknown Extension Block.
EDID:
  Base EDID: EDID specified 0 extension block(s), but found 1 extension block(s).

EDID conformity: FAIL
