
EDID (hex):
00ffffffffffff0006af936e00000000
251f0104a526167802707593585a9429
20505400000001010101010101010101
010101010101403880b470383e401010
3e007ed7100000180000000f00000000
00000000000000000020000000fe0041
554f0a202020202020202020000000fe
004231373348414e30342e38200a0062

edid-decode (hex):

00 ff ff ff ff ff ff 00 06 af 93 6e 00 00 00 00
25 1f 01 04 a5 26 16 78 02 70 75 93 58 5a 94 29
20 50 54 00 00 00 01 01 01 01 01 01 01 01 01 01
01 01 01 01 01 01 40 38 80 b4 70 38 3e 40 10 10
3e 00 7e d7 10 00 00 18 00 00 00 0f 00 00 00 00
00 00 00 00 00 00 00 00 00 20 00 00 00 fe 00 41
55 4f 0a 20 20 20 20 20 20 20 20 20 00 00 00 fe
00 42 31 37 33 48 41 4e 30 34 2e 38 20 0a 00 62

----------------

Block 0, Base EDID:
  EDID Structure Version & Revision: 1.4
  Vendor & Product Identification:
    Manufacturer: AUO
    Model: 28307
    Made in: week 37 of 2021
  Basic Display Parameters & Features:
    Digital display
    Bits per primary color channel: 8
    DisplayPort interface
    Maximum image size: 38 cm x 22 cm
    Gamma: 2.20
    Supported color formats: RGB 4:4:4
    First detailed timing includes the native pixel format and preferred refresh rate
  Color Characteristics:
    Red  : 0.5751, 0.3466
    Green: 0.3515, 0.5781
    Blue : 0.1611, 0.1279
    White: 0.3134, 0.3291
  Established Timings I & II: none
  Standard Timings: none
  Detailed Timing Descriptors:
    DTD 1:  1920x1080   60.045034 Hz  16:9     68.571 kHz    144.000000 MHz (382 mm x 215 mm)
                 Hfront   16 Hsync  16 Hback  148 Hpol N
                 Vfront    3 Vsync  14 Vback   45 Vpol N
    Manufacturer-Specified Display Descriptor (0x0f): 00 0f 00 00 00 00 00 00 00 00 00 00 00 00 00 20 '............... '
    Alphanumeric Data String: 'AUO'
    Alphanumeric Data String: 'B173HAN04.8 '
Checksum: 0x62
