
EDID (hex):
00ffffffffffff0026cd015601010101
181201036c342178ea5ad5a7564b9b24
135054bdef80714f81908180818ca940
b300950f9500283c80a070b023403020
360007442100001a000000ff00303537
34323832343530393632000000fd0038
4c1e5311000a202020202020000000fc
00504c423234303357530a202020005e

Extracted contents:
header:          00 ff ff ff ff ff ff 00
serial number:   26 cd 01 56 01 01 01 01 18 12
version:         01 03
basic params:    6c 34 21 78 ea
chroma info:     5a d5 a7 56 4b 9b 24 13 50 54
established:     bd ef 80
standard:        71 4f 81 90 81 80 81 8c a9 40 b3 00 95 0f 95 00
descriptor 1:    28 3c 80 a0 70 b0 23 40 30 20 36 00 07 44 21 00 00 1a
descriptor 2:    00 00 00 ff 00 30 35 37 34 32 38 32 34 35 30 39 36 32
descriptor 3:    00 00 00 fd 00 38 4c 1e 53 11 00 0a 20 20 20 20 20 20
descriptor 4:    00 00 00 fc 00 50 4c 42 32 34 30 33 57 53 0a 20 20 20
extensions:      00
checksum:        5e

EDID version: 1.3
Manufacturer: IVM Model 5601 Serial Number --
Made in week 24 of 2008
Analog display, Input voltage level: 0.7/0.7 V
Sync: Separate Composite 
Maximum image size: 52 cm x 33 cm
Gamma: 2.20
DPMS levels: Standby Suspend Off
RGB color display
First detailed timing is preferred timing
Display x,y Chromaticity:
  Red:   0.6533, 0.3369
  Green: 0.2949, 0.6074
  Blue:  0.1435, 0.0751
  White: 0.3134, 0.3291
Established timings supported:
  720x400@70Hz 9:5 HorFreq: 31469 Hz Clock: 28.320 MHz
  640x480@60Hz 4:3 HorFreq: 31469 Hz Clock: 25.175 MHz
  640x480@67Hz 4:3 HorFreq: 35000 Hz Clock: 30.240 MHz
  640x480@72Hz 4:3 HorFreq: 37900 Hz Clock: 31.500 MHz
  640x480@75Hz 4:3 HorFreq: 37500 Hz Clock: 31.500 MHz
  800x600@60Hz 4:3 HorFreq: 37900 Hz Clock: 40.000 MHz
  800x600@72Hz 4:3 HorFreq: 48100 Hz Clock: 50.000 MHz
  800x600@75Hz 4:3 HorFreq: 46900 Hz Clock: 49.500 MHz
  832x624@75Hz 4:3 HorFreq: 49726 Hz Clock: 57.284 MHz
  1024x768@60Hz 4:3 HorFreq: 48400 Hz Clock: 65.000 MHz
  1024x768@70Hz 4:3 HorFreq: 56500 Hz Clock: 75.000 MHz
  1024x768@75Hz 4:3 HorFreq: 60000 Hz Clock: 78.750 MHz
  1280x1024@75Hz 5:4 HorFreq: 80000 Hz Clock: 135.000 MHz
  1152x870@75Hz 192:145 HorFreq: 67500 Hz Clock: 108.000 MHz
Standard timings supported:
  1152x864@75Hz 4:3 HorFreq: 67500 Hz Clock: 108.000 MHz
  1280x1024@76Hz 5:4
  1280x1024@60Hz 5:4 HorFreq: 64000 Hz Clock: 108.000 MHz
  1280x1024@72Hz 5:4
  1600x1200@60Hz 4:3 HorFreq: 75000 Hz Clock: 162.000 MHz
  1680x1050@60Hz 16:10 HorFreq: 64700 Hz Clock: 119.000 MHz
  1440x900@75Hz 16:10 HorFreq: 82300 Hz Clock: 156.000 MHz
  1440x900@60Hz 16:10 HorFreq: 55500 Hz Clock: 88.750 MHz
Detailed mode: Clock 154.000 MHz, 519 mm x 324 mm
               1920 1968 2000 2080 hborder 0
               1200 1203 1209 1235 vborder 0
               +hsync -vsync 
               VertFreq: 59 Hz, HorFreq: 74038 Hz
Serial number: --
Monitor ranges (GTF): 56-76Hz V, 30-83kHz H, max dotclock 170MHz
Monitor name: PLB2403WS
Checksum: 0x5e (valid)
