edid-decode (hex):

00 ff ff ff ff ff ff 00 4c a3 45 41 00 00 00 00
00 15 01 03 80 1f 11 78 0a 4f 35 8f 57 55 90 29
1e 50 54 00 00 00 01 01 01 01 01 01 01 01 01 01
01 01 01 01 01 01 12 1b 56 72 50 00 0c 30 30 20
55 00 35 ae 10 00 00 19 00 00 00 0f 00 00 00 00
00 00 00 00 00 20 52 03 15 00 00 00 00 fe 00 53
41 4d 53 55 4e 47 0a 20 20 20 20 20 00 00 00 fe
00 31 34 30 41 54 32 36 2d 54 30 31 0a 20 00 cf

----------------

Block 0, Base EDID:
  EDID Structure Version & Revision: 1.3
  Vendor & Product Identification:
    Manufacturer: SEC
    Model: 16709
    Made in: 2011
  Basic Display Parameters & Features:
    Digital display
    Maximum image size: 31 cm x 17 cm
    Gamma: 2.20
    RGB color display
    First detailed timing is the preferred timing
  Color Characteristics:
    Red  : 0.5595, 0.3398
    Green: 0.3349, 0.5654
    Blue : 0.1601, 0.1201
    White: 0.3134, 0.3291
  Established Timings I & II: none
  Standard Timings: none
  Detailed Timing Descriptors:
    DTD 1:  1366x768    60.031 Hz 683:384  46.824 kHz  69.300 MHz (309 mm x 174 mm)
                 Hfront   48 Hsync  32 Hback  34 Hpol N
                 Vfront    5 Vsync   5 Vback   2 Vpol N
    Manufacturer-Specified Display Descriptor (0x0f): 00 0f 00 00 00 00 00 00 00 00 00 20 52 03 15 00 '........... R...'
    Alphanumeric Data String: 'SAMSUNG'
    Alphanumeric Data String: '140AT26-T01'
Checksum: 0xcf

----------------

Failures:

Block 0, Base EDID:
  Missing Display Product Name.
  Missing Display Range Limits Descriptor.

EDID conformity: FAIL
