
EDID (hex):
00ffffffffffff0009d11e8045540000
031b0103803c22782e7cd0a8544a9d24
0e5054a56b80d1c081c081008180a9c0
b3000101010104740030f2705a80b058
8a00544f2100001a000000ff00483148
3030333738534c300a20000000fd001e
4c1e581e000a202020202020000000fc
0042656e51204c43440a202020200192

Extracted contents:
header:          00 ff ff ff ff ff ff 00
serial number:   09 d1 1e 80 45 54 00 00 03 1b
version:         01 03
basic params:    80 3c 22 78 2e
chroma info:     7c d0 a8 54 4a 9d 24 0e 50 54
established:     a5 6b 80
standard:        d1 c0 81 c0 81 00 81 80 a9 c0 b3 00 01 01 01 01
descriptor 1:    04 74 00 30 f2 70 5a 80 b0 58 8a 00 54 4f 21 00 00 1a
descriptor 2:    00 00 00 ff 00 48 31 48 30 30 33 37 38 53 4c 30 0a 20
descriptor 3:    00 00 00 fd 00 1e 4c 1e 58 1e 00 0a 20 20 20 20 20 20
descriptor 4:    00 00 00 fc 00 42 65 6e 51 20 4c 43 44 0a 20 20 20 20
extensions:      01
checksum:        92

EDID version: 1.3
Manufacturer: BNQ Model 801e Serial Number --
Made in week 3 of 2017
Digital display
Maximum image size: 60 cm x 34 cm
Gamma: 2.20
DPMS levels: Off
RGB color display
Default (sRGB) color space is primary color space
First detailed timing is preferred timing
Display x,y Chromaticity:
  Red:   0.6572, 0.3310
  Green: 0.2919, 0.6132
  Blue:  0.1435, 0.0556
  White: 0.3125, 0.3281
Established timings supported:
  720x400@70Hz 9:5 HorFreq: 31469 Hz Clock: 28.320 MHz
  640x480@60Hz 4:3 HorFreq: 31469 Hz Clock: 25.175 MHz
  640x480@75Hz 4:3 HorFreq: 37500 Hz Clock: 31.500 MHz
  800x600@60Hz 4:3 HorFreq: 37900 Hz Clock: 40.000 MHz
  800x600@75Hz 4:3 HorFreq: 46900 Hz Clock: 49.500 MHz
  832x624@75Hz 4:3 HorFreq: 49726 Hz Clock: 57.284 MHz
  1024x768@60Hz 4:3 HorFreq: 48400 Hz Clock: 65.000 MHz
  1024x768@75Hz 4:3 HorFreq: 60000 Hz Clock: 78.750 MHz
  1280x1024@75Hz 5:4 HorFreq: 80000 Hz Clock: 135.000 MHz
  1152x870@75Hz 192:145 HorFreq: 67500 Hz Clock: 108.000 MHz
Standard timings supported:
  1920x1080@60Hz 16:9
  1280x720@60Hz 16:9
  1280x800@60Hz 16:10
  1280x1024@60Hz 5:4 HorFreq: 64000 Hz Clock: 108.000 MHz
  1600x900@60Hz 16:9
  1680x1050@60Hz 16:10 HorFreq: 64700 Hz Clock: 119.000 MHz
Detailed mode: Clock 297.000 MHz, 596 mm x 335 mm
               3840 4016 4104 4400 hborder 0
               2160 2168 2178 2250 vborder 0
               +hsync -vsync 
               VertFreq: 30 Hz, HorFreq: 67500 Hz
Serial number: --
Monitor ranges (GTF): 30-76Hz V, 30-88kHz H, max dotclock 300MHz
Monitor name: BenQ LCD
Has 1 extension blocks
Checksum: 0x92 (valid)
EDID block does NOT conform to EDID 1.3!
	sRGB is signaled, but the chromaticities do not match
