
EDID (hex):
00ffffffffffff001c540432ac050000
201f0104b54627783be1b5ad5045a025
0d5054bfcf00814081809500714f81c0
b300d1c001014dd000a0f0703e803020
3500b9882100001a000000ff00323133
3231423030313435320a000000fd0030
90ffff83010a202020202020000000fc
004769676162797465204d3332550276
020342f156010304131f120211900f0e
1d1e60610514765d5e5f2f2309070783
01000065030c0010006d1a0000020b30
900005653c653ce305c301e606050165
6512565e00a0a0a0295030203500b988
2100001a8a6f80a0703840403020280c
b9882100001a6fc200a0a0a055503020
3500b9882100001a0000000000000035
701279000003016447f80104ff0e4f00
07001f006f087e0070000700eba30104
ff0e4f0007001f006f087e0070000700
d0500104ff0e9f0010003e006f082700
14000700fb7e00047f07870017001f00
3704110002000400f7e30004ff099f00
07001f009f0531001800070000000000
0000000000000000000000000000d190

Extracted contents:
header:          00 ff ff ff ff ff ff 00
serial number:   1c 54 04 32 ac 05 00 00 20 1f
version:         01 04
basic params:    b5 46 27 78 3b
chroma info:     e1 b5 ad 50 45 a0 25 0d 50 54
established:     bf cf 00
standard:        81 40 81 80 95 00 71 4f 81 c0 b3 00 d1 c0 01 01
descriptor 1:    4d d0 00 a0 f0 70 3e 80 30 20 35 00 b9 88 21 00 00 1a
descriptor 2:    00 00 00 ff 00 32 31 33 32 31 42 30 30 31 34 35 32 0a
descriptor 3:    00 00 00 fd 00 30 90 ff ff 83 01 0a 20 20 20 20 20 20
descriptor 4:    00 00 00 fc 00 47 69 67 61 62 79 74 65 20 4d 33 32 55
extensions:      02
checksum:        76

EDID version: 1.4
Manufacturer: GBT Model 3204 Serial Number --
Made in week 32 of 2021
Digital display
10 bits per primary color channel
DisplayPort interface
Maximum image size: 70 cm x 39 cm
Gamma: 2.20
DPMS levels: Off
Supported color formats: RGB 4:4:4, YCrCb 4:4:4, YCrCb 4:2:2
First detailed timing includes the native pixel format and preferred refresh rate
Display is continuous frequency
Display x,y Chromaticity:
  Red:   0.6787, 0.3144
  Green: 0.2695, 0.6259
  Blue:  0.1464, 0.0537
  White: 0.3134, 0.3291
Established timings supported:
  720x400@70Hz 9:5 HorFreq: 31469 Hz Clock: 28.320 MHz
  640x480@60Hz 4:3 HorFreq: 31469 Hz Clock: 25.175 MHz
  640x480@67Hz 4:3 HorFreq: 35000 Hz Clock: 30.240 MHz
  640x480@72Hz 4:3 HorFreq: 37900 Hz Clock: 31.500 MHz
  640x480@75Hz 4:3 HorFreq: 37500 Hz Clock: 31.500 MHz
  800x600@56Hz 4:3 HorFreq: 35200 Hz Clock: 36.000 MHz
  800x600@60Hz 4:3 HorFreq: 37900 Hz Clock: 40.000 MHz
  800x600@72Hz 4:3 HorFreq: 48100 Hz Clock: 50.000 MHz
  800x600@75Hz 4:3 HorFreq: 46900 Hz Clock: 49.500 MHz
  1024x768@60Hz 4:3 HorFreq: 48400 Hz Clock: 65.000 MHz
  1024x768@70Hz 4:3 HorFreq: 56500 Hz Clock: 75.000 MHz
  1024x768@75Hz 4:3 HorFreq: 60000 Hz Clock: 78.750 MHz
  1280x1024@75Hz 5:4 HorFreq: 80000 Hz Clock: 135.000 MHz
Standard timings supported:
  1280x960@60Hz 4:3 HorFreq: 60000 Hz Clock: 108.000 MHz
  1280x1024@60Hz 5:4 HorFreq: 64000 Hz Clock: 108.000 MHz
  1440x900@60Hz 16:10 HorFreq: 55500 Hz Clock: 88.750 MHz
  1152x864@75Hz 4:3 HorFreq: 67500 Hz Clock: 108.000 MHz
  1280x720@60Hz 16:9
  1680x1050@60Hz 16:10 HorFreq: 64700 Hz Clock: 119.000 MHz
  1920x1080@60Hz 16:9
Detailed mode: Clock 533.250 MHz, 697 mm x 392 mm
               3840 3888 3920 4000 hborder 0
               2160 2163 2168 2222 vborder 0
               +hsync -vsync 
               VertFreq: 59 Hz, HorFreq: 133312 Hz
Serial number: --
Monitor ranges (bare limits): 48-144Hz V, 255-255kHz H, max dotclock 1310MHz
Has 2 extension blocks
Checksum: 0x76 (valid)

CTA extension block
Extension version: 3
62 bytes of CTA data
  Video data block
    VIC   1 640x480@60Hz 4:3  HorFreq: 31469 Hz Clock: 25.175 MHz
    VIC   3 720x480@60Hz 16:9  HorFreq: 31469 Hz Clock: 27.000 MHz
    VIC   4 1280x720@60Hz 16:9  HorFreq: 45000 Hz Clock: 74.250 MHz
    VIC  19 1280x720@50Hz 16:9  HorFreq: 37500 Hz Clock: 74.250 MHz
    VIC  31 1920x1080@50Hz 16:9  HorFreq: 56250 Hz Clock: 148.500 MHz
    VIC  18 720x576@50Hz 16:9  HorFreq: 31250 Hz Clock: 27.000 MHz
    VIC   2 720x480@60Hz 4:3  HorFreq: 31469 Hz Clock: 27.000 MHz
    VIC  17 720x576@50Hz 4:3  HorFreq: 31250 Hz Clock: 27.000 MHz
    VIC  16 1920x1080@60Hz 16:9 (native) HorFreq: 67500 Hz Clock: 148.500 MHz
    VIC  15 1440x480@60Hz 16:9  HorFreq: 31469 Hz Clock: 54.000 MHz
    VIC  14 1440x480@60Hz 4:3  HorFreq: 31469 Hz Clock: 54.000 MHz
    VIC  29 1440x576@50Hz 4:3  HorFreq: 31250 Hz Clock: 54.000 MHz
    VIC  30 1440x576@50Hz 16:9  HorFreq: 31250 Hz Clock: 54.000 MHz
    VIC  96 3840x2160@50Hz 16:9  HorFreq: 112500 Hz Clock: 594.000 MHz
    VIC  97 3840x2160@60Hz 16:9  HorFreq: 135000 Hz Clock: 594.000 MHz
    VIC   5 1920x1080i@60Hz 16:9  HorFreq: 33750 Hz Clock: 74.250 MHz
    VIC  20 1920x1080i@50Hz 16:9  HorFreq: 28125 Hz Clock: 74.250 MHz
    VIC 118 3840x2160@120Hz 16:9  HorFreq: 270000 Hz Clock: 1188.000 MHz
    VIC  93 3840x2160@24Hz 16:9  HorFreq: 54000 Hz Clock: 297.000 MHz
    VIC  94 3840x2160@25Hz 16:9  HorFreq: 56250 Hz Clock: 297.000 MHz
    VIC  95 3840x2160@30Hz 16:9  HorFreq: 67500 Hz Clock: 297.000 MHz
    VIC  47 1280x720@120Hz 16:9  HorFreq: 90000 Hz Clock: 148.500 MHz
  Audio data block
    Linear PCM, max channels 2
      Supported sample rates (kHz): 48 44.1 32
      Supported sample sizes (bits): 24 20 16
  Speaker allocation data block
    Speaker map:
      FL/FR - Front Left/Right
  Vendor-specific data block, OUI 000c03 (HDMI)
    Source physical address 1.0.0.0
  Vendor-specific data block, OUI 00001a
  Extended tag: Colorimetry data block
    xvYCC601
    xvYCC709
    BT2020YCC
    BT2020RGB
  Extended tag: HDR static metadata data block
    Electro optical transfer functions:
      Traditional gamma - SDR luminance range
      SMPTE ST2084
    Supported static metadata descriptors:
      Static metadata type 1
    Desired content max luminance: 101 (445.755 cd/m^2)
    Desired content max frame-average luminance: 101 (445.755 cd/m^2)
    Desired content min luminance: 18 (0.022 cd/m^2)
Underscans PC formats by default
Basic audio support
Supports YCbCr 4:4:4
Supports YCbCr 4:2:2
1 native detailed modes
Detailed mode: Clock 241.500 MHz, 697 mm x 392 mm
               2560 2608 2640 2720 hborder 0
               1440 1443 1448 1481 vborder 0
               +hsync -vsync 
               VertFreq: 59 Hz, HorFreq: 88786 Hz
Detailed mode: Clock 285.540 MHz, 697 mm x 392 mm
               1920 1968 2000 2080 hborder 0
               1080 1130 1138 1144 vborder 0
               +hsync -vsync 
               VertFreq: 119 Hz, HorFreq: 137278 Hz
Detailed mode: Clock 497.750 MHz, 697 mm x 392 mm
               2560 2608 2640 2720 hborder 0
               1440 1443 1448 1525 vborder 0
               +hsync -vsync 
               VertFreq: 119 Hz, HorFreq: 182996 Hz
Checksum: 0x35 (valid)


DisplayID extension block
Extension version: 18
Length 121, version 18, extension count 0
Checksum: 0xd1 (valid)
Type 1 detailed timing: aspect: 16:9,  
Detailed mode: Clock 1290.950 MHz, 0 mm x 0 mm
               3839 3846 3877 3918
               2159 2271 2278 2285
               -hsync -vsync
Type 1 detailed timing: aspect: 16:9,  
Detailed mode: Clock 1074.990 MHz, 0 mm x 0 mm
               3839 3846 3877 3918
               2159 2271 2278 2285
               -hsync -vsync
Type 1 detailed timing: aspect: 16:9,  
Detailed mode: Clock 862.240 MHz, 0 mm x 0 mm
               3839 3855 3917 3998
               2159 2179 2186 2198
               -hsync -vsync
Type 1 detailed timing: aspect: 16:9,  
Detailed mode: Clock 325.070 MHz, 0 mm x 0 mm
               1919 1942 1973 2054
               1079 1081 1085 1096
               -hsync -vsync
Type 1 detailed timing: aspect: 16:9,  
Detailed mode: Clock 583.590 MHz, 0 mm x 0 mm
               2559 2566 2597 2718
               1439 1463 1470 1488
               -hsync -vsync

EDID block does NOT conform to EDID 1.4!
	Name descriptor not terminated with a newline
Warning: One or more of the timings is out of range of the Monitor Ranges:
  Vertical Freq: 24 - 120 Hz
  Horizontal Freq: 28125 - 270000 Hz
  Maximum Clock: 1188.000 MHz
EDID block does not conform at all!
	Both the serial number and the serial string are set
