
EDID (hex):
00ffffffffffff00647437bc01010101
0b210104b52314782bee91a3544c9926
0f5054210800d100b300950081000101
0101010101019c6800a0a04029603020
350062c71000001a000000ffa00a2020
20202020202020202020000000fc0053
63756c70746f720a20202020000000fd
00303f6e6e28010a202020202020014c
020320f2459001020304e200c023097f
0783010000e305c000e6060501626200
6a5e00a0a0a029503020350062c71000
001e023a801871382d40582c450062c7
100000ff3240801871b02d40582c4500
62c7100000ff00000000000000000000
00000000000000000000000000000000
00000000000000000000000000000053

edid-decode (hex):

00 ff ff ff ff ff ff 00 64 74 37 bc 01 01 01 01
0b 21 01 04 b5 23 14 78 2b ee 91 a3 54 4c 99 26
0f 50 54 21 08 00 d1 00 b3 00 95 00 81 00 01 01
01 01 01 01 01 01 9c 68 00 a0 a0 40 29 60 30 20
35 00 62 c7 10 00 00 1a 00 00 00 ff a0 0a 20 20
20 20 20 20 20 20 20 20 20 20 00 00 00 fc 00 53
63 75 6c 70 74 6f 72 0a 20 20 20 20 00 00 00 fd
00 30 3f 6e 6e 28 01 0a 20 20 20 20 20 20 01 4c

02 03 20 f2 45 90 01 02 03 04 e2 00 c0 23 09 7f
07 83 01 00 00 e3 05 c0 00 e6 06 05 01 62 62 00
6a 5e 00 a0 a0 a0 29 50 30 20 35 00 62 c7 10 00
00 1e 02 3a 80 18 71 38 2d 40 58 2c 45 00 62 c7
10 00 00 ff 32 40 80 18 71 b0 2d 40 58 2c 45 00
62 c7 10 00 00 ff 00 00 00 00 00 00 00 00 00 00
00 00 00 00 00 00 00 00 00 00 00 00 00 00 00 00
00 00 00 00 00 00 00 00 00 00 00 00 00 00 00 53

----------------

Block 0, Base EDID:
  EDID Structure Version & Revision: 1.4
  Vendor & Product Identification:
    Manufacturer: YCT
    Model: 48183
    Serial Number: 16843009
    Made in: week 11 of 2023
  Basic Display Parameters & Features:
    Digital display
    Bits per primary color channel: 10
    DisplayPort interface
    Maximum image size: 35 cm x 20 cm
    Gamma: 2.20
    DPMS levels: Off
    Supported color formats: RGB 4:4:4, YCrCb 4:4:4
    First detailed timing includes the native pixel format and preferred refresh rate
    Display is continuous frequency
  Color Characteristics:
    Red  : 0.6396, 0.3300
    Green: 0.2998, 0.5996
    Blue : 0.1503, 0.0595
    White: 0.3125, 0.3291
  Established Timings I & II:
    DMT 0x04:   640x480    59.940476 Hz   4:3     31.469 kHz     25.175000 MHz
    DMT 0x09:   800x600    60.316541 Hz   4:3     37.879 kHz     40.000000 MHz
    DMT 0x10:  1024x768    60.003840 Hz   4:3     48.363 kHz     65.000000 MHz
  Standard Timings:
    DMT 0x45:  1920x1200   59.884600 Hz  16:10    74.556 kHz    193.250000 MHz
    DMT 0x3a:  1680x1050   59.954250 Hz  16:10    65.290 kHz    146.250000 MHz
    DMT 0x2f:  1440x900    59.887445 Hz  16:10    55.935 kHz    106.500000 MHz
    DMT 0x1c:  1280x800    59.810326 Hz  16:10    49.702 kHz     83.500000 MHz
  Detailed Timing Descriptors:
    DTD 1:  2560x1600   59.997491 Hz  16:10    98.456 kHz    267.800000 MHz (354 mm x 199 mm)
                 Hfront   48 Hsync  32 Hback   80 Hpol P
                 Vfront    3 Vsync   5 Vback   33 Vpol N
    Display Product Serial Number: ''
    Display Product Name: 'Sculptor'
    Display Range Limits:
      Monitor ranges (Bare Limits): 48-63 Hz V, 110-110 kHz H, max dotclock 400 MHz
  Extension blocks: 1
Checksum: 0x4c

----------------

Block 1, CTA-861 Extension Block:
  Revision: 3
  Underscans IT Video Formats by default
  Basic audio support
  Supports YCbCr 4:4:4
  Supports YCbCr 4:2:2
  Native detailed modes: 2
  Video Data Block:
    VIC  16:  1920x1080   60.000000 Hz  16:9     67.500 kHz    148.500000 MHz (native)
    VIC   1:   640x480    59.940476 Hz   4:3     31.469 kHz     25.175000 MHz
    VIC   2:   720x480    59.940060 Hz   4:3     31.469 kHz     27.000000 MHz
    VIC   3:   720x480    59.940060 Hz  16:9     31.469 kHz     27.000000 MHz
    VIC   4:  1280x720    60.000000 Hz  16:9     45.000 kHz     74.250000 MHz
  Video Capability Data Block:
    YCbCr quantization: Selectable (via AVI YQ)
    RGB quantization: Selectable (via AVI Q)
    PT scan behavior: No Data
    IT scan behavior: IT video formats not supported
    CE scan behavior: CE video formats not supported
  Audio Data Block:
    Linear PCM:
      Max channels: 2
      Supported sample rates (kHz): 192 176.4 96 88.2 48 44.1 32
      Supported sample sizes (bits): 24 20 16
  Speaker Allocation Data Block:
    FL/FR - Front Left/Right
  Colorimetry Data Block:
    BT2020YCC
    BT2020RGB
  HDR Static Metadata Data Block:
    Electro optical transfer functions:
      Traditional gamma - SDR luminance range
      SMPTE ST2084
    Supported static metadata descriptors:
      Static metadata type 1
    Desired content max luminance: 98 (417.710 cd/m^2)
    Desired content max frame-average luminance: 98 (417.710 cd/m^2)
    Desired content min luminance: 0 (0.000 cd/m^2)
  Detailed Timing Descriptors:
    DTD 2:  2560x1440   60.000199 Hz  16:9     88.860 kHz    241.700000 MHz (354 mm x 199 mm)
                 Hfront   48 Hsync  32 Hback   80 Hpol P
                 Vfront    3 Vsync   5 Vback   33 Vpol P
    DTD 3:  1920x2160i  59.973345 Hz   8:9     67.500 kHz    148.500000 MHz (side by side interleaved, 354 mm x 199 mm)
                 Hfront   88 Hsync  44 Hback  148 Hpol P
                 Vfront    4 Vsync   5 Vback   36 Vpol P Vfront +0.5 Odd Field
                 Vfront    4 Vsync   5 Vback   36 Vpol P Vback  +0.5 Even Field
    DTD 4:  1920x2400i  59.975913 Hz   4:5     74.700 kHz    164.340000 MHz (side by side interleaved, 354 mm x 199 mm)
                 Hfront   88 Hsync  44 Hback  148 Hpol P
                 Vfront    4 Vsync   5 Vback   36 Vpol P Vfront +0.5 Odd Field
                 Vfront    4 Vsync   5 Vback   36 Vpol P Vback  +0.5 Even Field
Checksum: 0x53  Unused space in Extension Block: 41 bytes
