
EDID (hex):
00ffffffffffff0030e4a70200000000
00140103801f11780a4a059e5b549525
18505400000001010101010101010101
0101010101019e1b5680500015302820
350036ae100000190000000000000000
00000000000000000000000000fe004c
4720446973706c61790a2020000000fe
004c503134305748312d544c4533001a

Extracted contents:
header:          00 ff ff ff ff ff ff 00
serial number:   30 e4 a7 02 00 00 00 00 00 14
version:         01 03
basic params:    80 1f 11 78 0a
chroma info:     4a 05 9e 5b 54 95 25 18 50 54
established:     00 00 00
standard:        01 01 01 01 01 01 01 01 01 01 01 01 01 01 01 01
descriptor 1:    9e 1b 56 80 50 00 15 30 28 20 35 00 36 ae 10 00 00 19
descriptor 2:    00 00 00 00 00 00 00 00 00 00 00 00 00 00 00 00 00 00
descriptor 3:    00 00 00 fe 00 4c 47 20 44 69 73 70 6c 61 79 0a 20 20
descriptor 4:    00 00 00 fe 00 4c 50 31 34 30 57 48 31 2d 54 4c 45 33
extensions:      00
checksum:        1a

EDID version: 1.3
Manufacturer: LGD Model 2a7 Serial Number --
Made in year 2010
Digital display
Maximum image size: 31 cm x 17 cm
Gamma: 2.20
RGB color display
First detailed timing is preferred timing
Display x,y Chromaticity:
  Red:   0.6181, 0.3554
  Green: 0.3300, 0.5839
  Blue:  0.1445, 0.0937
  White: 0.3134, 0.3291
Established timings supported:
Standard timings supported:
Detailed mode: Clock 70.700 MHz, 310 mm x 174 mm
               1366 1406 1438 1494 hborder 0
                768  771  776  789 vborder 0
               -hsync -vsync 
               VertFreq: 59 Hz, HorFreq: 47322 Hz
Manufacturer-specified data, tag 0
ASCII string: LG Display
ASCII string: LP140WH1-TLE3
Checksum: 0x1a (valid)
EDID block does NOT conform to EDID 1.3!
	Missing name descriptor
	Missing monitor ranges
