edid-decode (hex):

00 ff ff ff ff ff ff 00 1e 6d fb 76 d1 40 08 00
0a 1e 01 03 80 57 25 78 ea ca 95 a6 55 4e a1 26
0f 50 54 25 6b 80 71 40 81 80 81 c0 a9 c0 b3 00
d1 c0 81 00 d1 cf d8 a4 00 20 f1 40 68 60 30 20
7a 00 6a 6e 31 00 00 1a 85 cf 00 20 f1 40 74 60
30 20 7a 00 6a 6e 31 00 00 1a 00 00 00 fd 00 38
4b 1e 7d 36 00 0a 20 20 20 20 20 20 00 00 00 fc
00 4c 47 20 55 4c 54 52 41 57 49 44 45 0a 01 06

00 00 00 00 00 00 00 00 00 00 00 00 00 00 00 00
00 00 00 00 00 00 00 00 00 00 00 00 00 00 00 00
00 00 00 00 00 00 00 00 00 00 00 00 00 00 00 00
00 00 00 00 00 00 00 00 00 00 00 00 00 00 00 00
00 00 00 00 00 00 00 00 00 00 00 00 00 00 00 00
00 00 00 00 00 00 00 00 00 00 00 00 00 00 00 00
00 00 00 00 00 00 00 00 00 00 00 00 00 00 00 00
00 00 00 00 00 00 00 00 00 00 00 00 00 00 00 00

----------------

Block 0, Base EDID:
  EDID Structure Version & Revision: 1.3
  Vendor & Product Identification:
    Manufacturer: GSM
    Model: 30459
    Serial Number: ...
    Made in: week 10 of 2020
  Basic Display Parameters & Features:
    Digital display
    Maximum image size: 87 cm x 37 cm
    Gamma: 2.20
    DPMS levels: Standby Suspend Off
    RGB color display
    First detailed timing is the preferred timing
  Color Characteristics:
    Red  : 0.6513, 0.3320
    Green: 0.3066, 0.6308
    Blue : 0.1503, 0.0595
    White: 0.3134, 0.3291
  Established Timings I & II:
    DMT 0x04:   640x480    59.940476 Hz   4:3     31.469 kHz     25.175000 MHz
    DMT 0x06:   640x480    75.000000 Hz   4:3     37.500 kHz     31.500000 MHz
    DMT 0x09:   800x600    60.316541 Hz   4:3     37.879 kHz     40.000000 MHz
    DMT 0x0b:   800x600    75.000000 Hz   4:3     46.875 kHz     49.500000 MHz
    Apple   :   832x624    74.551266 Hz   4:3     49.726 kHz     57.284000 MHz
    DMT 0x10:  1024x768    60.003840 Hz   4:3     48.363 kHz     65.000000 MHz
    DMT 0x12:  1024x768    75.028582 Hz   4:3     60.023 kHz     78.750000 MHz
    DMT 0x24:  1280x1024   75.024675 Hz   5:4     79.976 kHz    135.000000 MHz
    Apple   :  1152x870    75.061550 Hz 192:145   68.681 kHz    100.000000 MHz
  Standard Timings:
    GTF     :  1152x864    60.000000 Hz   4:3     53.700 kHz     81.624000 MHz
    DMT 0x23:  1280x1024   60.019740 Hz   5:4     63.981 kHz    108.000000 MHz
    DMT 0x55:  1280x720    60.000000 Hz  16:9     45.000 kHz     74.250000 MHz
    DMT 0x53:  1600x900    60.000000 Hz  16:9     60.000 kHz    108.000000 MHz (RB)
    DMT 0x3a:  1680x1050   59.954250 Hz  16:10    65.290 kHz    146.250000 MHz
    DMT 0x52:  1920x1080   60.000000 Hz  16:9     67.500 kHz    148.500000 MHz
    DMT 0x1c:  1280x800    59.810326 Hz  16:10    49.702 kHz     83.500000 MHz
    GTF     :  1920x1080   75.000068 Hz  16:9     84.600 kHz    220.637000 MHz
  Detailed Timing Descriptors:
    DTD 1:  3840x1600   59.993358 Hz  12:5    102.229 kHz    422.000000 MHz (874 mm x 366 mm)
                 Hfront   48 Hsync  32 Hback  208 Hpol P
                 Vfront    7 Vsync  10 Vback   87 Vpol N
    DTD 2:  3840x1600   74.996668 Hz  12:5    128.694 kHz    531.250000 MHz (874 mm x 366 mm)
                 Hfront   48 Hsync  32 Hback  208 Hpol P
                 Vfront    7 Vsync  10 Vback   99 Vpol N
    Display Range Limits:
      Monitor ranges (GTF): 56-75 Hz V, 30-125 kHz H, max dotclock 540 MHz
    Display Product Name: 'LG ULTRAWIDE'
  Extension blocks: 1
Checksum: 0x06

----------------

Block 1, Unknown EDID Extension Block 0x00:
  00 00 00 00 00 00 00 00 00 00 00 00 00 00 00 00 '................'
  00 00 00 00 00 00 00 00 00 00 00 00 00 00 00 00 '................'
  00 00 00 00 00 00 00 00 00 00 00 00 00 00 00 00 '................'
  00 00 00 00 00 00 00 00 00 00 00 00 00 00 00 00 '................'
  00 00 00 00 00 00 00 00 00 00 00 00 00 00 00 00 '................'
  00 00 00 00 00 00 00 00 00 00 00 00 00 00 00 00 '................'
  00 00 00 00 00 00 00 00 00 00 00 00 00 00 00 00 '................'
  00 00 00 00 00 00 00 00 00 00 00 00 00 00 00 00 '................'
Checksum: 0x00

----------------

Failures:

Block 1, Base EDID:
  Unknown Extension Block.
EDID:
  Base EDID: Some timings are out of range of the Monitor Ranges:
    Horizontal Freq: 31.468 - 128.694 kHz (Monitor: 30.000 - 125.000 kHz)

EDID conformity: FAIL
