edid-decode (hex):

00 ff ff ff ff ff ff 00 30 ae a8 66 00 00 00 00
0f 1f 01 04 a5 35 1e 78 3f 31 35 a9 54 4c 9f 25
0e 50 54 af ef 00 d1 00 d1 c0 b3 00 95 00 81 80
01 01 01 01 01 01 56 5e 00 a0 a0 a0 29 50 30 20
35 00 0e 28 21 00 00 1a 00 00 00 fc 00 51 32 34
68 2d 31 30 0a 20 20 20 20 20 00 00 00 fd 00 30
4b 70 70 1e 01 0a 20 20 20 20 20 20 00 00 00 ff
00 55 35 48 46 33 38 47 58 0a 20 20 20 20 01 81

02 03 1c f0 49 10 1f 04 13 12 11 03 02 01 23 09
07 07 83 01 00 00 65 47 e0 00 04 00 56 5e 00 a0
a0 a0 29 50 30 20 35 00 0e 28 21 00 00 1a d9 76
00 a0 a0 a0 34 50 30 20 35 00 0e 28 21 00 00 1a
7c 2e 90 a0 60 1a 1e 40 30 20 36 00 0e 28 21 00
00 1a 2a 44 80 a0 70 38 27 40 30 20 35 00 0e 28
21 00 00 1a 66 21 56 aa 51 00 1e 30 46 8f 33 00
0e 28 21 00 00 1e 00 00 00 00 00 00 00 00 00 5e

00 ff ff ff ff ff ff 00 30 ae a8 66 00 00 00 00
0f 1f 01 04 a5 35 1e 78 3f 31 35 a9 54 4c 9f 25
0e 50 54 af ef 00 d1 00 d1 c0 b3 00 95 00 81 80
01 01 01 01 01 01 56 5e 00 a0 a0 a0 29 50 30 20
35 00 0e 28 21 00 00 1a 00 00 00 fc 00 51 32 34
68 2d 31 30 0a 20 20 20 20 20 00 00 00 fd 00 30
4b 70 70 1e 01 0a 20 20 20 20 20 20 00 00 00 ff
00 55 35 48 46 33 38 47 58 0a 20 20 20 20 01 81

02 03 1c f0 49 10 1f 04 13 12 11 03 02 01 23 09
07 07 83 01 00 00 65 47 e0 00 04 00 56 5e 00 a0
a0 a0 29 50 30 20 35 00 0e 28 21 00 00 1a d9 76
00 a0 a0 a0 34 50 30 20 35 00 0e 28 21 00 00 1a
7c 2e 90 a0 60 1a 1e 40 30 20 36 00 0e 28 21 00
00 1a 2a 44 80 a0 70 38 27 40 30 20 35 00 0e 28
21 00 00 1a 66 21 56 aa 51 00 1e 30 46 8f 33 00
0e 28 21 00 00 1e 00 00 00 00 00 00 00 00 00 5e

----------------

Block 0, Base EDID:
  EDID Structure Version & Revision: 1.4
  Vendor & Product Identification:
    Manufacturer: LEN
    Model: 26280
    Made in: week 15 of 2021
  Basic Display Parameters & Features:
    Digital display
    Bits per primary color channel: 8
    DisplayPort interface
    Maximum image size: 53 cm x 30 cm
    Gamma: 2.20
    DPMS levels: Off
    Supported color formats: RGB 4:4:4, YCrCb 4:4:4, YCrCb 4:2:2
    Default (sRGB) color space is primary color space
    First detailed timing includes the native pixel format and preferred refresh rate
    Display is continuous frequency
  Color Characteristics:
    Red  : 0.6601, 0.3310
    Green: 0.2968, 0.6220
    Blue : 0.1445, 0.0576
    White: 0.3134, 0.3291
  Established Timings I & II:
    IBM     :   720x400    70.081663 Hz   9:5     31.467 kHz     28.320000 MHz
    DMT 0x04:   640x480    59.940476 Hz   4:3     31.469 kHz     25.175000 MHz
    DMT 0x05:   640x480    72.808802 Hz   4:3     37.861 kHz     31.500000 MHz
    DMT 0x06:   640x480    75.000000 Hz   4:3     37.500 kHz     31.500000 MHz
    DMT 0x08:   800x600    56.250000 Hz   4:3     35.156 kHz     36.000000 MHz
    DMT 0x09:   800x600    60.316541 Hz   4:3     37.879 kHz     40.000000 MHz
    DMT 0x0a:   800x600    72.187572 Hz   4:3     48.077 kHz     50.000000 MHz
    DMT 0x0b:   800x600    75.000000 Hz   4:3     46.875 kHz     49.500000 MHz
    Apple   :   832x624    74.551266 Hz   4:3     49.726 kHz     57.284000 MHz
    DMT 0x10:  1024x768    60.003840 Hz   4:3     48.363 kHz     65.000000 MHz
    DMT 0x11:  1024x768    70.069359 Hz   4:3     56.476 kHz     75.000000 MHz
    DMT 0x12:  1024x768    75.028582 Hz   4:3     60.023 kHz     78.750000 MHz
    DMT 0x24:  1280x1024   75.024675 Hz   5:4     79.976 kHz    135.000000 MHz
  Standard Timings:
    DMT 0x45:  1920x1200   59.884600 Hz  16:10    74.556 kHz    193.250000 MHz
    DMT 0x52:  1920x1080   60.000000 Hz  16:9     67.500 kHz    148.500000 MHz
    DMT 0x3a:  1680x1050   59.954250 Hz  16:10    65.290 kHz    146.250000 MHz
    DMT 0x2f:  1440x900    59.887445 Hz  16:10    55.935 kHz    106.500000 MHz
    DMT 0x23:  1280x1024   60.019740 Hz   5:4     63.981 kHz    108.000000 MHz
  Detailed Timing Descriptors:
    DTD  1:  2560x1440   59.950550 Hz  16:9     88.787 kHz    241.500000 MHz (526 mm x 296 mm)
                  Hfront   48 Hsync  32 Hback   80 Hpol P
                  Vfront    3 Vsync   5 Vback   33 Vpol N
    Display Product Name: 'Q24h-10'
    Display Range Limits:
      Monitor ranges (Bare Limits): 48-75 Hz V, 112-112 kHz H, max dotclock 300 MHz
    Display Product Serial Number: ...
  Extension blocks: 1
Checksum: 0x81

----------------

Block 1, CTA-861 Extension Block:
  Revision: 3
  Underscans IT Video Formats by default
  Basic audio support
  Supports YCbCr 4:4:4
  Supports YCbCr 4:2:2
  Native detailed modes: 0
  Video Data Block:
    VIC  16:  1920x1080   60.000000 Hz  16:9     67.500 kHz    148.500000 MHz
    VIC  31:  1920x1080   50.000000 Hz  16:9     56.250 kHz    148.500000 MHz
    VIC   4:  1280x720    60.000000 Hz  16:9     45.000 kHz     74.250000 MHz
    VIC  19:  1280x720    50.000000 Hz  16:9     37.500 kHz     74.250000 MHz
    VIC  18:   720x576    50.000000 Hz  16:9     31.250 kHz     27.000000 MHz
    VIC  17:   720x576    50.000000 Hz   4:3     31.250 kHz     27.000000 MHz
    VIC   3:   720x480    59.940060 Hz  16:9     31.469 kHz     27.000000 MHz
    VIC   2:   720x480    59.940060 Hz   4:3     31.469 kHz     27.000000 MHz
    VIC   1:   640x480    59.940476 Hz   4:3     31.469 kHz     25.175000 MHz
  Audio Data Block:
    Linear PCM:
      Max channels: 2
      Supported sample rates (kHz): 48 44.1 32
      Supported sample sizes (bits): 24 20 16
  Speaker Allocation Data Block:
    FL/FR - Front Left/Right
  Vendor-Specific Data Block (InFocus), OUI 00-E0-47:
    04 00                                           '..'
  Detailed Timing Descriptors:
    DTD  2:  2560x1440   59.950550 Hz  16:9     88.787 kHz    241.500000 MHz (526 mm x 296 mm)
                  Hfront   48 Hsync  32 Hback   80 Hpol P
                  Vfront    3 Vsync   5 Vback   33 Vpol N
    DTD  3:  2560x1440   74.970923 Hz  16:9    111.857 kHz    304.250000 MHz (526 mm x 296 mm)
                  Hfront   48 Hsync  32 Hback   80 Hpol P
                  Vfront    3 Vsync   5 Vback   44 Vpol N
    DTD  4:  1680x1050   59.883253 Hz  16:10    64.674 kHz    119.000000 MHz (526 mm x 296 mm)
                  Hfront   48 Hsync  32 Hback   80 Hpol P
                  Vfront    3 Vsync   6 Vback   21 Vpol N
    DTD  5:  1920x1080   74.972503 Hz  16:9     83.894 kHz    174.500000 MHz (526 mm x 296 mm)
                  Hfront   48 Hsync  32 Hback   80 Hpol P
                  Vfront    3 Vsync   5 Vback   31 Vpol N
    DTD  6:  1366x768    59.789541 Hz 683:384   47.712 kHz     85.500000 MHz (526 mm x 296 mm)
                  Hfront   70 Hsync 143 Hback  213 Hpol P
                  Vfront    3 Vsync   3 Vback   24 Vpol P
Checksum: 0x5e  Unused space in Extension Block: 9 bytes

----------------

Block 2, Unknown EDID Extension Block 0x00:
  00 ff ff ff ff ff ff 00 30 ae a8 66 00 00 00 00 '........0..f....'
  0f 1f 01 04 a5 35 1e 78 3f 31 35 a9 54 4c 9f 25 '.....5.x?15.TL.%'
  0e 50 54 af ef 00 d1 00 d1 c0 b3 00 95 00 81 80 '.PT.............'
  01 01 01 01 01 01 56 5e 00 a0 a0 a0 29 50 30 20 '......V^....)P0 '
  35 00 0e 28 21 00 00 1a 00 00 00 fc 00 51 32 34 '5..(!........Q24'
  68 2d 31 30 0a 20 20 20 20 20 00 00 00 fd 00 30 'h-10.     .....0'
  4b 70 70 1e 01 0a 20 20 20 20 20 20 00 00 00 ff 'Kpp...      ....'
  00 55 35 48 46 33 38 47 58 0a 20 20 20 20 01 81 '.U5HF38GX.    ..'
Checksum: 0x81

----------------

Block 3, CTA-861 Extension Block:
  Revision: 3
  Underscans IT Video Formats by default
  Basic audio support
  Supports YCbCr 4:4:4
  Supports YCbCr 4:2:2
  Native detailed modes: 0
  Video Data Block:
    VIC  16:  1920x1080   60.000000 Hz  16:9     67.500 kHz    148.500000 MHz
    VIC  31:  1920x1080   50.000000 Hz  16:9     56.250 kHz    148.500000 MHz
    VIC   4:  1280x720    60.000000 Hz  16:9     45.000 kHz     74.250000 MHz
    VIC  19:  1280x720    50.000000 Hz  16:9     37.500 kHz     74.250000 MHz
    VIC  18:   720x576    50.000000 Hz  16:9     31.250 kHz     27.000000 MHz
    VIC  17:   720x576    50.000000 Hz   4:3     31.250 kHz     27.000000 MHz
    VIC   3:   720x480    59.940060 Hz  16:9     31.469 kHz     27.000000 MHz
    VIC   2:   720x480    59.940060 Hz   4:3     31.469 kHz     27.000000 MHz
    VIC   1:   640x480    59.940476 Hz   4:3     31.469 kHz     25.175000 MHz
  Audio Data Block:
    Linear PCM:
      Max channels: 2
      Supported sample rates (kHz): 48 44.1 32
      Supported sample sizes (bits): 24 20 16
  Speaker Allocation Data Block:
    FL/FR - Front Left/Right
  Vendor-Specific Data Block (InFocus), OUI 00-E0-47:
    04 00                                           '..'
  Detailed Timing Descriptors:
    DTD  7:  2560x1440   59.950550 Hz  16:9     88.787 kHz    241.500000 MHz (526 mm x 296 mm)
                  Hfront   48 Hsync  32 Hback   80 Hpol P
                  Vfront    3 Vsync   5 Vback   33 Vpol N
    DTD  8:  2560x1440   74.970923 Hz  16:9    111.857 kHz    304.250000 MHz (526 mm x 296 mm)
                  Hfront   48 Hsync  32 Hback   80 Hpol P
                  Vfront    3 Vsync   5 Vback   44 Vpol N
    DTD  9:  1680x1050   59.883253 Hz  16:10    64.674 kHz    119.000000 MHz (526 mm x 296 mm)
                  Hfront   48 Hsync  32 Hback   80 Hpol P
                  Vfront    3 Vsync   6 Vback   21 Vpol N
    DTD 10:  1920x1080   74.972503 Hz  16:9     83.894 kHz    174.500000 MHz (526 mm x 296 mm)
                  Hfront   48 Hsync  32 Hback   80 Hpol P
                  Vfront    3 Vsync   5 Vback   31 Vpol N
    DTD 11:  1366x768    59.789541 Hz 683:384   47.712 kHz     85.500000 MHz (526 mm x 296 mm)
                  Hfront   70 Hsync 143 Hback  213 Hpol P
                  Vfront    3 Vsync   3 Vback   24 Vpol P
Checksum: 0x5e  Unused space in Extension Block: 9 bytes

----------------

Warnings:

Block 1, CTA-861 Extension Block:
  Video Data Block: VIC 16 is the preferred timing, overriding the first detailed timings. Is this intended?
EDID:
  Base EDID: Some timings are out of range of the Monitor Ranges:
    Horizontal Freq: 31.250 - 111.856 kHz (Monitor: 112.000 - 112.000 kHz)
    Maximum Clock: 304.250 MHz (Monitor: 300.000 MHz)

Failures:

Block 0, Base EDID:
  Basic Display Parameters & Features: sRGB is signaled, but the chromaticities do not match.
Block 1, CTA-861 Extension Block:
  Missing VCDB, needed for Set Selectable RGB Quantization to avoid interop issues.
Block 2, Base EDID:
  Unknown Extension Block.
Block 3, CTA-861 Extension Block:
  Video Data Block: Duplicate VIC 16.
  Video Data Block: Duplicate VIC 31.
  Video Data Block: Duplicate VIC 4.
  Video Data Block: Duplicate VIC 19.
  Video Data Block: Duplicate VIC 18.
  Video Data Block: Duplicate VIC 17.
  Video Data Block: Duplicate VIC 3.
  Video Data Block: Duplicate VIC 2.
  Video Data Block: Duplicate VIC 1.
  Speaker Allocation Data Block: Only one instance of this Data Block is allowed.
  Missing VCDB, needed for Set Selectable RGB Quantization to avoid interop issues.
EDID:
  Base EDID: EDID specified 1 extension block(s), but found 3 extension block(s).

EDID conformity: FAIL
