
EDID (hex):
00ffffffffffff0005e31915310a0000
15130103682113782a62b09b57508f28
265054bfee00310a0101010101010101
0101010101011a1d008051d01c204080
3500540e1100001c000000ff00493533
39354941303032363039000000fd0037
4b1e3c08000a202020202020000000fc
00353139570a20202020202020200068

Extracted contents:
header:          00 ff ff ff ff ff ff 00
serial number:   05 e3 19 15 31 0a 00 00 15 13
version:         01 03
basic params:    68 21 13 78 2a
chroma info:     62 b0 9b 57 50 8f 28 26 50 54
established:     bf ee 00
standard:        31 0a 01 01 01 01 01 01 01 01 01 01 01 01 01 01
descriptor 1:    1a 1d 00 80 51 d0 1c 20 40 80 35 00 54 0e 11 00 00 1c
descriptor 2:    00 00 00 ff 00 49 35 33 39 35 49 41 30 30 32 36 30 39
descriptor 3:    00 00 00 fd 00 37 4b 1e 3c 08 00 0a 20 20 20 20 20 20
descriptor 4:    00 00 00 fc 00 35 31 39 57 0a 20 20 20 20 20 20 20 20
extensions:      00
checksum:        68

EDID version: 1.3
Manufacturer: AOC Model 1519 Serial Number --
Made in week 21 of 2009
Analog display, Input voltage level: 0.7/0.7 V
Sync: Separate 
Maximum image size: 33 cm x 19 cm
Gamma: 2.20
DPMS levels: Off
RGB color display
First detailed timing is preferred timing
Display x,y Chromaticity:
  Red:   0.6064, 0.3417
  Green: 0.3125, 0.5605
  Blue:  0.1582, 0.1513
  White: 0.3125, 0.3281
Established timings supported:
  720x400@70Hz 9:5 HorFreq: 31469 Hz Clock: 28.320 MHz
  640x480@60Hz 4:3 HorFreq: 31469 Hz Clock: 25.175 MHz
  640x480@67Hz 4:3 HorFreq: 35000 Hz Clock: 30.240 MHz
  640x480@72Hz 4:3 HorFreq: 37900 Hz Clock: 31.500 MHz
  640x480@75Hz 4:3 HorFreq: 37500 Hz Clock: 31.500 MHz
  800x600@56Hz 4:3 HorFreq: 35200 Hz Clock: 36.000 MHz
  800x600@60Hz 4:3 HorFreq: 37900 Hz Clock: 40.000 MHz
  800x600@72Hz 4:3 HorFreq: 48100 Hz Clock: 50.000 MHz
  800x600@75Hz 4:3 HorFreq: 46900 Hz Clock: 49.500 MHz
  832x624@75Hz 4:3 HorFreq: 49726 Hz Clock: 57.284 MHz
  1024x768@60Hz 4:3 HorFreq: 48400 Hz Clock: 65.000 MHz
  1024x768@70Hz 4:3 HorFreq: 56500 Hz Clock: 75.000 MHz
  1024x768@75Hz 4:3 HorFreq: 60000 Hz Clock: 78.750 MHz
Standard timings supported:
  640x400@70Hz 16:10
Detailed mode: Clock 74.500 MHz, 340 mm x 270 mm
               1280 1344 1472 1664 hborder 0
                720  723  728  748 vborder 0
               -hsync +vsync 
               VertFreq: 59 Hz, HorFreq: 44771 Hz
Serial number: --
Monitor ranges (GTF): 55-75Hz V, 30-60kHz H, max dotclock 80MHz
Monitor name: 519W
Checksum: 0x68 (valid)
