edid-decode (hex):

00 ff ff ff ff ff ff 00 09 e5 43 06 00 00 00 00
01 19 01 04 95 1b 0f 78 0a 22 90 9c 5a 55 91 27
1d 50 54 00 00 00 01 01 01 01 01 01 01 01 01 01
01 01 01 01 01 01 99 36 80 a0 70 38 28 40 30 20
36 00 14 9b 10 00 00 1a ae 2b 80 a0 70 38 28 40
30 20 36 00 14 9b 10 00 00 1a 00 00 00 fe 00 43
37 43 4e 37 80 4e 56 31 32 35 46 48 00 00 00 00
00 00 41 11 96 00 00 00 00 0a 01 0a 20 20 00 5c

----------------

Block 0, Base EDID:
  EDID Structure Version & Revision: 1.4
  Vendor & Product Identification:
    Manufacturer: BOE
    Model: 1603
    Made in: week 1 of 2015
  Basic Display Parameters & Features:
    Digital display
    Bits per primary color channel: 6
    DisplayPort interface
    Maximum image size: 27 cm x 15 cm
    Gamma: 2.20
    Supported color formats: RGB 4:4:4, YCrCb 4:4:4
    First detailed timing includes the native pixel format and preferred refresh rate
  Color Characteristics:
    Red  : 0.6093, 0.3535
    Green: 0.3320, 0.5683
    Blue : 0.1542, 0.1142
    White: 0.3125, 0.3281
  Established Timings I & II: none
  Standard Timings: none
  Detailed Timing Descriptors:
    DTD 1:  1920x1080   59.997 Hz  16:9    67.197 kHz 139.770 MHz (276 mm x 155 mm)
                 Hfront   48 Hsync  32 Hback  80 Hpol P
                 Vfront    3 Vsync   6 Vback  31 Vpol N
    DTD 2:  1920x1080   48.000 Hz  16:9    53.760 kHz 111.820 MHz (276 mm x 155 mm)
                 Hfront   48 Hsync  32 Hback  80 Hpol P
                 Vfront    3 Vsync   6 Vback  31 Vpol N
    Alphanumeric Data String: 'C7CN7'
    Manufacturer-Specified Display Descriptor (0x00): 00 00 00 00 41 11 96 00 00 00 00 0a 01 0a 20 20 '....A.........  '
Checksum: 0x5c

----------------

Failures:

Block 0, Base EDID:
  Alphanumeric Data String: Non-printable character.
  Missing Display Product Name.

EDID conformity: FAIL
