edid-decode (hex):

00 ff ff ff ff ff ff 00 36 77 10 02 00 00 00 03
09 18 01 03 68 33 1d 78 2a 68 50 a5 56 4a 98 25
11 50 54 25 4b 00 81 00 90 00 95 00 a9 c0 a9 40
b3 00 81 c0 81 0f 02 3a 80 18 71 38 2d 40 58 2c
45 00 76 f2 31 00 00 1e 01 1d 00 72 51 d0 1e 20
6e 28 55 00 76 f2 31 00 00 1e 00 00 00 fd 00 32
55 1e 51 11 00 0a 20 20 20 20 20 20 00 00 00 fc
00 56 47 41 20 54 4f 20 48 44 4d 49 0a 20 00 98

00 ff ff ff ff ff ff 00 36 77 10 02 00 00 00 03
09 18 01 03 68 33 1d 78 2a 68 50 a5 56 4a 98 25
11 50 54 25 4b 00 81 00 90 00 95 00 a9 c0 a9 40
b3 00 81 c0 81 0f 02 3a 80 18 71 38 2d 40 58 2c
45 00 76 f2 31 00 00 1e 01 1d 00 72 51 d0 1e 20
6e 28 55 00 76 f2 31 00 00 1e 00 00 00 fd 00 32
55 1e 51 11 00 0a 20 20 20 20 20 20 00 00 00 fc
00 56 47 41 20 54 4f 20 48 44 4d 49 0a 20 00 98

----------------

Block 0, Base EDID:
  EDID Structure Version & Revision: 1.3
  Vendor & Product Identification:
    Manufacturer: MSW
    Model: 528
    Serial Number: ...
    Made in: week 9 of 2014
  Basic Display Parameters & Features:
    Analog display
    Signal Level Standard: 0.700 : 0.000 : 0.700 V p-p
    Blank level equals black level
    Sync: Separate
    Maximum image size: 51 cm x 29 cm
    Gamma: 2.20
    DPMS levels: Off
    RGB color display
    First detailed timing is the preferred timing
  Color Characteristics:
    Red  : 0.6455, 0.3378
    Green: 0.2910, 0.5937
    Blue : 0.1455, 0.0673
    White: 0.3125, 0.3281
  Established Timings I & II:
    DMT 0x04:   640x480    59.940476 Hz   4:3     31.469 kHz     25.175000 MHz
    DMT 0x06:   640x480    75.000000 Hz   4:3     37.500 kHz     31.500000 MHz
    DMT 0x09:   800x600    60.316541 Hz   4:3     37.879 kHz     40.000000 MHz
    DMT 0x0b:   800x600    75.000000 Hz   4:3     46.875 kHz     49.500000 MHz
    DMT 0x10:  1024x768    60.003840 Hz   4:3     48.363 kHz     65.000000 MHz
    DMT 0x12:  1024x768    75.028582 Hz   4:3     60.023 kHz     78.750000 MHz
    DMT 0x24:  1280x1024   75.024675 Hz   5:4     79.976 kHz    135.000000 MHz
  Standard Timings:
    DMT 0x1c:  1280x800    59.810326 Hz  16:10    49.702 kHz     83.500000 MHz
    GTF     :  1400x875    59.999833 Hz  16:10    54.360 kHz    100.457000 MHz
    DMT 0x2f:  1440x900    59.887445 Hz  16:10    55.935 kHz    106.500000 MHz
    DMT 0x53:  1600x900    60.000000 Hz  16:9     60.000 kHz    108.000000 MHz (RB)
    DMT 0x33:  1600x1200   60.000000 Hz   4:3     75.000 kHz    162.000000 MHz
    DMT 0x3a:  1680x1050   59.954250 Hz  16:10    65.290 kHz    146.250000 MHz
    DMT 0x55:  1280x720    60.000000 Hz  16:9     45.000 kHz     74.250000 MHz
    DMT 0x1d:  1280x800    74.934142 Hz  16:10    62.795 kHz    106.500000 MHz
  Detailed Timing Descriptors:
    DTD 1:  1920x1080   60.000000 Hz  16:9     67.500 kHz    148.500000 MHz (886 mm x 498 mm)
                 Hfront   88 Hsync  44 Hback  148 Hpol P
                 Vfront    4 Vsync   5 Vback   36 Vpol P
    DTD 2:  1280x720    60.000000 Hz  16:9     45.000 kHz     74.250000 MHz (886 mm x 498 mm)
                 Hfront  110 Hsync  40 Hback  220 Hpol P
                 Vfront    5 Vsync   5 Vback   20 Vpol P
    Display Range Limits:
      Monitor ranges (GTF): 50-85 Hz V, 30-81 kHz H, max dotclock 170 MHz
    Display Product Name: 'VGA TO HDMI'
Checksum: 0x98

----------------

Block 1, Unknown EDID Extension Block 0x00:
  00 ff ff ff ff ff ff 00 36 77 10 02 00 00 00 03 '........6w......'
  09 18 01 03 68 33 1d 78 2a 68 50 a5 56 4a 98 25 '....h3.x*hP.VJ.%'
  11 50 54 25 4b 00 81 00 90 00 95 00 a9 c0 a9 40 '.PT%K..........@'
  b3 00 81 c0 81 0f 02 3a 80 18 71 38 2d 40 58 2c '.......:..q8-@X,'
  45 00 76 f2 31 00 00 1e 01 1d 00 72 51 d0 1e 20 'E.v.1......rQ.. '
  6e 28 55 00 76 f2 31 00 00 1e 00 00 00 fd 00 32 'n(U.v.1........2'
  55 1e 51 11 00 0a 20 20 20 20 20 20 00 00 00 fc 'U.Q...      ....'
  00 56 47 41 20 54 4f 20 48 44 4d 49 0a 20 00 98 '.VGA TO HDMI. ..'
Checksum: 0x98

----------------

Warnings:

Block 0, Base EDID:
  Standard Timings: Standard Timing 1400x875 has a dubious odd vertical resolution.

Failures:

Block 0, Base EDID:
  Detailed Timing Descriptor #1: Mismatch of image size 886x498 mm vs display size 510x290 mm.
  Detailed Timing Descriptor #2: Mismatch of image size 886x498 mm vs display size 510x290 mm.
Block 1, Base EDID:
  Unknown Extension Block.
EDID:
  Base EDID: The DTD max image size is 886x498mm, which is larger than the display size 510.0x290.0mm.
  Base EDID: EDID specified 0 extension block(s), but found 1 extension block(s).

EDID conformity: FAIL
