edid-decode (hex):

00 ff ff ff ff ff ff 00 0d af 26 12 00 00 00 00
2d 10 01 03 80 1a 11 78 0a 9f 05 96 56 50 88 27
20 50 54 00 00 00 01 01 01 01 01 01 01 01 01 01
01 01 01 01 01 01 1b 1b 00 84 50 20 13 30 28 1a
25 00 04 aa 10 00 00 18 00 00 00 fe 00 4e 31 32
31 49 41 2d 4c 30 32 0a 20 20 00 00 00 fe 00 43
4d 4f 0a 20 20 20 20 20 20 20 20 20 00 00 00 fe
00 4e 31 32 31 49 41 2d 4c 30 32 0a 20 20 00 72

----------------

Block 0, Base EDID:
  EDID Structure Version & Revision: 1.3
  Vendor & Product Identification:
    Manufacturer: CMO
    Model: 4646
    Made in: week 45 of 2006
  Basic Display Parameters & Features:
    Digital display
    Maximum image size: 26 cm x 17 cm
    Gamma: 2.20
    RGB color display
    First detailed timing is the preferred timing
  Color Characteristics:
    Red  : 0.5878, 0.3369
    Green: 0.3154, 0.5341
    Blue : 0.1523, 0.1250
    White: 0.3134, 0.3291
  Established Timings I & II: none
  Standard Timings: none
  Detailed Timing Descriptors:
    DTD 1:  1280x800    60.003736 Hz  16:10    49.143 kHz     69.390000 MHz (260 mm x 170 mm)
                 Hfront   40 Hsync  26 Hback   66 Hpol N
                 Vfront    2 Vsync   5 Vback   12 Vpol N
    Alphanumeric Data String: 'N121IA-L02'
    Alphanumeric Data String: 'CMO'
    Alphanumeric Data String: 'N121IA-L02'
Checksum: 0x72

----------------

Failures:

Block 0, Base EDID:
  Missing Display Product Name.
  Missing Display Range Limits Descriptor.

EDID conformity: FAIL
