
EDID (hex):
00ffffffffffff001ab31002fa8e0800
1b0c01030820187eea1269a552499924
0e484ca442003168456845593159614f
818001010101ea240060410028303060
130032e61000001e000000ff00594552
473536303839300a2020000000fd0032
a01e480b000a202020202020000000fc
00433737390a202020202020202000fb

Extracted contents:
header:          00 ff ff ff ff ff ff 00
serial number:   1a b3 10 02 fa 8e 08 00 1b 0c
version:         01 03
basic params:    08 20 18 7e ea
chroma info:     12 69 a5 52 49 99 24 0e 48 4c
established:     a4 42 00
standard:        31 68 45 68 45 59 31 59 61 4f 81 80 01 01 01 01
descriptor 1:    ea 24 00 60 41 00 28 30 30 60 13 00 32 e6 10 00 00 1e
descriptor 2:    00 00 00 ff 00 59 45 52 47 35 36 30 38 39 30 0a 20 20
descriptor 3:    00 00 00 fd 00 32 a0 1e 48 0b 00 0a 20 20 20 20 20 20
descriptor 4:    00 00 00 fc 00 43 37 37 39 0a 20 20 20 20 20 20 20 20
extensions:      00
checksum:        fb

EDID version: 1.3
Manufacturer: FUS Model 210 Serial Number --
Analog display, Input voltage level: 0.7/0.3 V
Sync: Separate 
Maximum image size: 32 cm x 24 cm
Gamma: 2.26
DPMS levels: Standby Suspend Off
RGB color display
First detailed timing is preferred timing
Display x,y Chromaticity:
  Red:   0.6445, 0.3212
  Green: 0.2851, 0.5996
  Blue:  0.1416, 0.0566
  White: 0.2832, 0.2978
Established timings supported:
  720x400@70Hz 9:5 HorFreq: 31469 Hz Clock: 28.320 MHz
  640x480@60Hz 4:3 HorFreq: 31469 Hz Clock: 25.175 MHz
  640x480@75Hz 4:3 HorFreq: 37500 Hz Clock: 31.500 MHz
  800x600@75Hz 4:3 HorFreq: 46900 Hz Clock: 49.500 MHz
  1024x768@75Hz 4:3 HorFreq: 60000 Hz Clock: 78.750 MHz
Standard timings supported:
  640x480@100Hz 4:3
  800x600@100Hz 4:3
  800x600@85Hz 4:3 HorFreq: 53700 Hz Clock: 56.250 MHz
  640x480@85Hz 4:3 HorFreq: 43300 Hz Clock: 36.000 MHz
  1024x768@75Hz 4:3 HorFreq: 60000 Hz Clock: 78.750 MHz
  1280x1024@60Hz 5:4 HorFreq: 64000 Hz Clock: 108.000 MHz
Detailed mode: Clock 94.500 MHz, 306 mm x 230 mm
               1024 1072 1168 1376 hborder 0
                768  769  772  808 vborder 0
               +hsync +vsync 
               VertFreq: 84 Hz, HorFreq: 68677 Hz
Serial number: --
Monitor ranges (GTF): 50-160Hz V, 30-72kHz H, max dotclock 110MHz
Monitor name: C779
Checksum: 0xfb (valid)
EDID block does not conform at all!
	Bad year of manufacture


