edid-decode (hex):

00 ff ff ff ff ff ff 00 1a b3 10 02 81 ba 07 00
30 0b 01 03 08 20 18 7e ea 12 69 a5 52 49 99 24
0e 48 4c a4 42 00 31 68 45 68 45 59 31 59 61 4f
81 80 01 01 01 01 ea 24 00 60 41 00 28 30 30 60
13 00 32 e6 10 00 00 1e 00 00 00 ff 00 59 45 52
47 35 30 36 34 39 37 0a 20 20 00 00 00 fd 00 32
a0 1e 48 0b 00 0a 20 20 20 20 20 20 00 00 00 fc
00 43 37 37 39 0a 20 20 20 20 20 20 20 20 00 32

00 ff ff ff ff ff ff 00 1a b3 10 02 81 ba 07 00
30 0b 01 03 08 20 18 7e ea 12 69 a5 52 49 99 24
0e 48 4c a4 42 00 31 68 45 68 45 59 31 59 61 4f
81 80 01 01 01 01 ea 24 00 60 41 00 28 30 30 60
13 00 32 e6 10 00 00 1e 00 00 00 ff 00 59 45 52
47 35 30 36 34 39 37 0a 20 20 00 00 00 fd 00 32
a0 1e 48 0b 00 0a 20 20 20 20 20 20 00 00 00 fc
00 43 37 37 39 0a 20 20 20 20 20 20 20 20 00 32

----------------

Block 0, Base EDID:
  EDID Structure Version & Revision: 1.3
  Vendor & Product Identification:
    Manufacturer: FUS
    Model: 528
    Serial Number: ...
    Made in: week 48 of 2001
  Basic Display Parameters & Features:
    Analog display
    Signal Level Standard: 0.700 : 0.300 : 1.000 V p-p
    Blank level equals black level
    Sync: Separate
    Maximum image size: 32 cm x 24 cm
    Gamma: 2.26
    DPMS levels: Standby Suspend Off
    RGB color display
    First detailed timing is the preferred timing
  Color Characteristics:
    Red  : 0.6445, 0.3212
    Green: 0.2851, 0.5996
    Blue : 0.1416, 0.0566
    White: 0.2832, 0.2978
  Established Timings I & II:
    IBM     :   720x400    70.081663 Hz   9:5     31.467 kHz     28.320000 MHz
    DMT 0x04:   640x480    59.940476 Hz   4:3     31.469 kHz     25.175000 MHz
    DMT 0x06:   640x480    75.000000 Hz   4:3     37.500 kHz     31.500000 MHz
    DMT 0x0b:   800x600    75.000000 Hz   4:3     46.875 kHz     49.500000 MHz
    DMT 0x12:  1024x768    75.028582 Hz   4:3     60.023 kHz     78.750000 MHz
  Standard Timings:
    GTF     :   640x480    99.999537 Hz   4:3     50.900 kHz     43.163000 MHz
    GTF     :   800x600    99.999707 Hz   4:3     63.600 kHz     68.179000 MHz
    DMT 0x0c:   800x600    85.061274 Hz   4:3     53.674 kHz     56.250000 MHz
    DMT 0x07:   640x480    85.008312 Hz   4:3     43.269 kHz     36.000000 MHz
    DMT 0x12:  1024x768    75.028582 Hz   4:3     60.023 kHz     78.750000 MHz
    DMT 0x23:  1280x1024   60.019740 Hz   5:4     63.981 kHz    108.000000 MHz
  Detailed Timing Descriptors:
    DTD 1:  1024x768    84.996690 Hz   4:3     68.677 kHz     94.500000 MHz (306 mm x 230 mm)
                 Hfront   48 Hsync  96 Hback  208 Hpol P
                 Vfront    1 Vsync   3 Vback   36 Vpol P
    Display Product Serial Number: ...
    Display Range Limits:
      Monitor ranges (GTF): 50-160 Hz V, 30-72 kHz H, max dotclock 110 MHz
    Display Product Name: 'C779'
Checksum: 0x32

----------------

Block 1, Unknown EDID Extension Block 0x00:
  00 ff ff ff ff ff ff 00 1a b3 10 02 81 ba 07 00 '................'
  30 0b 01 03 08 20 18 7e ea 12 69 a5 52 49 99 24 '0.... .~..i.RI.$'
  0e 48 4c a4 42 00 31 68 45 68 45 59 31 59 61 4f '.HL.B.1hEhEY1YaO'
  81 80 01 01 01 01 ea 24 00 60 41 00 28 30 30 60 '.......$.`A.(00`'
  13 00 32 e6 10 00 00 1e 00 00 00 ff 00 59 45 52 '..2..........YER'
  47 35 30 36 34 39 37 0a 20 20 00 00 00 fd 00 32 'G506497.  .....2'
  a0 1e 48 0b 00 0a 20 20 20 20 20 20 00 00 00 fc '..H...      ....'
  00 43 37 37 39 0a 20 20 20 20 20 20 20 20 00 32 '.C779.        .2'
Checksum: 0x32

----------------

Failures:

Block 0, Base EDID:
  Detailed Timing Descriptor #1: Mismatch of image size 306x230 mm vs display size 320x240 mm.
Block 1, Base EDID:
  Unknown Extension Block.
EDID:
  Base EDID: EDID specified 0 extension block(s), but found 1 extension block(s).

EDID conformity: FAIL
