
EDID (hex):
00ffffffffffff00593a300001010101
271101033f5d3478ea856ba258499d25
0f474aa54a0001010101010101010101
010101010101662156b051001b308082
2600a20b3200001a000000fd0032551f
460b0200bc902100001a000000ff0053
41414d424833393232303234000000fc
00565834324c20484454563130410011

Extracted contents:
header:          00 ff ff ff ff ff ff 00
serial number:   59 3a 30 00 01 01 01 01 27 11
version:         01 03
basic params:    3f 5d 34 78 ea
chroma info:     85 6b a2 58 49 9d 25 0f 47 4a
established:     a5 4a 00
standard:        01 01 01 01 01 01 01 01 01 01 01 01 01 01 01 01
descriptor 1:    66 21 56 b0 51 00 1b 30 80 82 26 00 a2 0b 32 00 00 1a
descriptor 2:    00 00 00 fd 00 32 55 1f 46 0b 02 00 bc 90 21 00 00 1a
descriptor 3:    00 00 00 ff 00 53 41 41 4d 42 48 33 39 32 32 30 32 34
descriptor 4:    00 00 00 fc 00 56 58 34 32 4c 20 48 44 54 56 31 30 41
extensions:      00
checksum:        11

EDID version: 1.3
Manufacturer: VIZ Model 30 Serial Number --
Made in week 39 of 2007
Analog display, Input voltage level: 0.714/0.286 V
Configurable signal levels
Sync: Separate Composite SyncOnGreen Serration 
Maximum image size: 93 cm x 52 cm
Gamma: 2.20
DPMS levels: Standby Suspend Off
RGB color display
First detailed timing is preferred timing
Display x,y Chromaticity:
  Red:   0.6347, 0.3437
  Green: 0.2861, 0.6142
  Blue:  0.1455, 0.0605
  White: 0.2792, 0.2919
Established timings supported:
  720x400@70Hz 9:5 HorFreq: 31469 Hz Clock: 28.320 MHz
  640x480@60Hz 4:3 HorFreq: 31469 Hz Clock: 25.175 MHz
  640x480@75Hz 4:3 HorFreq: 37500 Hz Clock: 31.500 MHz
  800x600@60Hz 4:3 HorFreq: 37900 Hz Clock: 40.000 MHz
  800x600@75Hz 4:3 HorFreq: 46900 Hz Clock: 49.500 MHz
  1024x768@60Hz 4:3 HorFreq: 48400 Hz Clock: 65.000 MHz
  1024x768@75Hz 4:3 HorFreq: 60000 Hz Clock: 78.750 MHz
Standard timings supported:
Detailed mode: Clock 85.500 MHz, 930 mm x 523 mm
               1366 1494 1624 1798 hborder 0
                768  770  776  795 vborder 0
               +hsync -vsync 
               VertFreq: 59 Hz, HorFreq: 47552 Hz
Monitor ranges (GTF with icing): 50-85Hz V, 31-70kHz H, max dotclock 110MHz
Serial number: --
Checksum: 0x11 (valid)
EDID block does NOT conform to EDID 1.3!
	Name descriptor not terminated with a newline
