edid-decode (hex):

00 ff ff ff ff ff ff 00 21 43 02 17 01 00 00 00
19 0d 01 02 0c 1f 17 6b e8 0c 90 a0 57 47 98 26
10 62 4c bf ef 80 01 01 01 01 01 01 01 01 01 01
01 01 01 01 01 01 d4 30 00 90 51 00 27 40 20 a0
03 00 67 1f 11 08 06 18 00 00 00 fd 00 37 4c 1e
50 8c 00 0a 20 20 20 20 20 20 00 00 00 00 00 00
00 00 00 00 00 00 00 00 00 00 00 00 00 00 00 00
00 00 00 00 00 00 00 00 00 00 00 00 00 00 00 26

----------------

Block 0, Base EDID:
  EDID Structure Version & Revision: 1.2
  Vendor & Product Identification:
    Manufacturer: HJC
    Model: 5890
    Serial Number: ...
    Made in: week 25 of 2003
  Basic Display Parameters & Features:
    Analog display
    Input voltage level: 0.7/0.3 V
    Blank level equals black level
    Sync: Separate Composite
    Maximum image size: 31 cm x 23 cm
    Gamma: 2.07
    DPMS levels: Standby Suspend Off
    RGB color display
  Color Characteristics:
    Red  : 0.6250, 0.3398
    Green: 0.2802, 0.5937
    Blue : 0.1503, 0.0634
    White: 0.3828, 0.2968
  Established Timings I & II:
    IBM     :   720x400    70.081663 Hz   9:5     31.467 kHz     28.320000 MHz
    DMT 0x04:   640x480    59.940476 Hz   4:3     31.469 kHz     25.175000 MHz
    Apple   :   640x480    66.666667 Hz   4:3     35.000 kHz     30.240000 MHz
    DMT 0x05:   640x480    72.808802 Hz   4:3     37.861 kHz     31.500000 MHz
    DMT 0x06:   640x480    75.000000 Hz   4:3     37.500 kHz     31.500000 MHz
    DMT 0x08:   800x600    56.250000 Hz   4:3     35.156 kHz     36.000000 MHz
    DMT 0x09:   800x600    60.316541 Hz   4:3     37.879 kHz     40.000000 MHz
    DMT 0x0a:   800x600    72.187572 Hz   4:3     48.077 kHz     50.000000 MHz
    DMT 0x0b:   800x600    75.000000 Hz   4:3     46.875 kHz     49.500000 MHz
    Apple   :   832x624    74.551266 Hz   4:3     49.726 kHz     57.284000 MHz
    DMT 0x10:  1024x768    60.003840 Hz   4:3     48.363 kHz     65.000000 MHz
    DMT 0x11:  1024x768    70.069359 Hz   4:3     56.476 kHz     75.000000 MHz
    DMT 0x12:  1024x768    75.028582 Hz   4:3     60.023 kHz     78.750000 MHz
    DMT 0x24:  1280x1024   75.024675 Hz   5:4     79.976 kHz    135.000000 MHz
    Apple   :  1152x870    75.061550 Hz 192:145   68.681 kHz    100.000000 MHz
  Standard Timings: none
  Detailed Timing Descriptors:
    DTD 1:  1280x1024   69.995072 Hz   5:4     74.405 kHz    125.000000 MHz (359 mm x 287 mm)
                 Hfront   32 Hsync 160 Hback  192 Hpol N Hborder 8
                 Vfront    0 Vsync   3 Vback   24 Vpol N Vborder 6
                   d4 30 00 90 51 00 27 40 20 a0 03 00 67 1f 11 08 06 18 '.0..Q.'@ ...g.....'
    Display Range Limits:
      Monitor ranges (GTF): 55-76 Hz V, 30-80 kHz H, max dotclock 1400 MHz
    Empty Descriptor
    Empty Descriptor
Checksum: 0x26

----------------

Warnings:

Block 0, Base EDID:
  EDID Structure Version & Revision: EDID 1.2 is deprecated, do not use.
  Detailed Timing Descriptor #1: The use of non-zero borders in a DTD is not recommended.

Failures:

Block 0, Base EDID:
  Detailed Timing Descriptor #1: 0 values in the video timing:
    Horizontal Active/Blanking 1280/400
    Horizontal Frontporch/Sync Width 32/160
    Vertical Active/Blanking 1024/39
    Vertical Frontporch/Sync Width 0/3
  Detailed Timing Descriptor #1: Mismatch of image size 359x287 mm vs display size 310x230 mm.
  Empty Descriptor: Use Dummy Descriptor instead of all zeroes.
  Empty Descriptor: Use Dummy Descriptor instead of all zeroes.

EDID conformity: FAIL
