
EDID (hex):
00ffffffffffff004c2d860632324c43
2614010380301b782a78f1a655489b26
125054bfef80714f8100814081809500
b300a940950f023a801871382d40582c
4500dd0c1100001e000000fd00384b1e
5111000a202020202020000000fc0053
4d4558323232300a20202020000000ff
004839585a3930363836300a20200162
02010400023a80d072382d40102c4580
dd0c1100001e011d007251d01e206e28
5500dd0c1100001e011d00bc52d01e20
b8285540151e1100001e8c0ad0902040
31200c405500dd1e110000188c0ad08a
20e02d10103e9600dd1e110000180000
00000000000000000000000000000000
00000000000000000000000000000099

edid-decode (hex):

00 ff ff ff ff ff ff 00 4c 2d 86 06 32 32 4c 43
26 14 01 03 80 30 1b 78 2a 78 f1 a6 55 48 9b 26
12 50 54 bf ef 80 71 4f 81 00 81 40 81 80 95 00
b3 00 a9 40 95 0f 02 3a 80 18 71 38 2d 40 58 2c
45 00 dd 0c 11 00 00 1e 00 00 00 fd 00 38 4b 1e
51 11 00 0a 20 20 20 20 20 20 00 00 00 fc 00 53
4d 45 58 32 32 32 30 0a 20 20 20 20 00 00 00 ff
00 48 39 58 5a 39 30 36 38 36 30 0a 20 20 01 62

02 01 04 00 02 3a 80 d0 72 38 2d 40 10 2c 45 80
dd 0c 11 00 00 1e 01 1d 00 72 51 d0 1e 20 6e 28
55 00 dd 0c 11 00 00 1e 01 1d 00 bc 52 d0 1e 20
b8 28 55 40 15 1e 11 00 00 1e 8c 0a d0 90 20 40
31 20 0c 40 55 00 dd 1e 11 00 00 18 8c 0a d0 8a
20 e0 2d 10 10 3e 96 00 dd 1e 11 00 00 18 00 00
00 00 00 00 00 00 00 00 00 00 00 00 00 00 00 00
00 00 00 00 00 00 00 00 00 00 00 00 00 00 00 99

----------------

Block 0, Base EDID:
  EDID Structure Version & Revision: 1.3
  Vendor & Product Identification:
    Manufacturer: SAM
    Model: 1670
    Serial Number: 1129067058
    Made in: week 38 of 2010
  Basic Display Parameters & Features:
    Digital display
    Maximum image size: 48 cm x 27 cm
    Gamma: 2.20
    DPMS levels: Off
    RGB color display
    First detailed timing is the preferred timing
  Color Characteristics:
    Red  : 0.6494, 0.3349
    Green: 0.2832, 0.6054
    Blue : 0.1513, 0.0732
    White: 0.3125, 0.3291
  Established Timings I & II:
    IBM     :   720x400    70.081663 Hz   9:5     31.467 kHz     28.320000 MHz
    DMT 0x04:   640x480    59.940476 Hz   4:3     31.469 kHz     25.175000 MHz
    Apple   :   640x480    66.666667 Hz   4:3     35.000 kHz     30.240000 MHz
    DMT 0x05:   640x480    72.808802 Hz   4:3     37.861 kHz     31.500000 MHz
    DMT 0x06:   640x480    75.000000 Hz   4:3     37.500 kHz     31.500000 MHz
    DMT 0x08:   800x600    56.250000 Hz   4:3     35.156 kHz     36.000000 MHz
    DMT 0x09:   800x600    60.316541 Hz   4:3     37.879 kHz     40.000000 MHz
    DMT 0x0a:   800x600    72.187572 Hz   4:3     48.077 kHz     50.000000 MHz
    DMT 0x0b:   800x600    75.000000 Hz   4:3     46.875 kHz     49.500000 MHz
    Apple   :   832x624    74.551266 Hz   4:3     49.726 kHz     57.284000 MHz
    DMT 0x10:  1024x768    60.003840 Hz   4:3     48.363 kHz     65.000000 MHz
    DMT 0x11:  1024x768    70.069359 Hz   4:3     56.476 kHz     75.000000 MHz
    DMT 0x12:  1024x768    75.028582 Hz   4:3     60.023 kHz     78.750000 MHz
    DMT 0x24:  1280x1024   75.024675 Hz   5:4     79.976 kHz    135.000000 MHz
    Apple   :  1152x870    75.061550 Hz 192:145   68.681 kHz    100.000000 MHz
  Standard Timings:
    DMT 0x15:  1152x864    75.000000 Hz   4:3     67.500 kHz    108.000000 MHz
    DMT 0x1c:  1280x800    59.810326 Hz  16:10    49.702 kHz     83.500000 MHz
    DMT 0x20:  1280x960    60.000000 Hz   4:3     60.000 kHz    108.000000 MHz
    DMT 0x23:  1280x1024   60.019740 Hz   5:4     63.981 kHz    108.000000 MHz
    DMT 0x2f:  1440x900    59.887445 Hz  16:10    55.935 kHz    106.500000 MHz
    DMT 0x3a:  1680x1050   59.954250 Hz  16:10    65.290 kHz    146.250000 MHz
    DMT 0x33:  1600x1200   60.000000 Hz   4:3     75.000 kHz    162.000000 MHz
    DMT 0x30:  1440x900    74.984427 Hz  16:10    70.635 kHz    136.750000 MHz
  Detailed Timing Descriptors:
    DTD 1:  1920x1080   60.000000 Hz  16:9     67.500 kHz    148.500000 MHz (477 mm x 268 mm)
                 Hfront   88 Hsync  44 Hback  148 Hpol P
                 Vfront    4 Vsync   5 Vback   36 Vpol P
    Display Range Limits:
      Monitor ranges (GTF): 56-75 Hz V, 30-81 kHz H, max dotclock 170 MHz
    Display Product Name: 'SMEX2220'
    Display Product Serial Number: 'H9XZ906860'
  Extension blocks: 1
Checksum: 0x62

----------------

Block 1, CTA-861 Extension Block:
  Revision: 1
  Detailed Timing Descriptors:
    DTD 2:  1920x1080   50.000000 Hz  16:9     56.250 kHz    148.500000 MHz (477 mm x 268 mm)
                 Hfront  528 Hsync  44 Hback  148 Hpol P
                 Vfront    4 Vsync   5 Vback   36 Vpol P
    DTD 3:  1280x720    60.000000 Hz  16:9     45.000 kHz     74.250000 MHz (477 mm x 268 mm)
                 Hfront  110 Hsync  40 Hback  220 Hpol P
                 Vfront    5 Vsync   5 Vback   20 Vpol P
    DTD 4:  1280x720    50.000000 Hz  16:9     37.500 kHz     74.250000 MHz (277 mm x 286 mm)
                 Hfront  440 Hsync  40 Hback  220 Hpol P
                 Vfront    5 Vsync   5 Vback   20 Vpol P
    DTD 5:   720x576    50.000000 Hz   5:4     31.250 kHz     27.000000 MHz (477 mm x 286 mm)
                 Hfront   12 Hsync  64 Hback   68 Hpol N
                 Vfront    5 Vsync   5 Vback   39 Vpol N
    DTD 6:   720x480    59.940060 Hz   3:2     31.469 kHz     27.000000 MHz (477 mm x 286 mm)
                 Hfront   16 Hsync  62 Hback   60 Hpol N
                 Vfront    9 Vsync   6 Vback   30 Vpol N
Checksum: 0x99  Unused space in Extension Block: 33 bytes
