edid-decode (hex):

00 ff ff ff ff ff ff 00 04 72 43 02 26 71 10 05
33 14 01 03 80 34 1d 78 2a 2c c5 a4 56 50 a1 28
0f 50 54 bf ef 80 71 4f 81 00 81 80 95 00 95 0f
b3 00 d1 c0 01 01 02 3a 80 18 71 38 2d 40 58 2c
45 00 09 25 21 00 00 1e 00 00 00 fd 00 38 4b 1e
53 11 00 0a 20 20 20 20 20 20 00 00 00 fc 00 41
63 65 72 20 48 53 32 34 34 48 51 0a 00 00 00 ff
00 4c 53 38 30 57 30 30 39 34 33 39 30 0a 01 0f

02 03 2f 72 4c 20 13 84 14 05 90 03 02 01 12 1f
11 83 01 00 00 75 03 0c 00 10 00 00 21 20 c0 0b
01 01 00 07 00 10 20 38 10 48 10 23 09 7f 07 02
3a 80 18 71 38 2d 40 58 2c 45 00 09 25 21 00 00
1e 01 1d 00 72 51 d0 1e 20 6e 28 55 00 09 25 21
00 00 1e 00 00 00 00 00 00 00 00 00 00 00 00 00
00 00 00 00 00 00 00 00 00 00 00 00 00 00 00 00
00 00 00 00 00 00 00 00 00 00 00 00 00 00 00 50

----------------

Block 0, Base EDID:
  EDID Structure Version & Revision: 1.3
  Vendor & Product Identification:
    Manufacturer: ACR
    Model: 579
    Serial Number: ...
    Made in: week 51 of 2010
  Basic Display Parameters & Features:
    Digital display
    Maximum image size: 52 cm x 29 cm
    Gamma: 2.20
    DPMS levels: Off
    RGB color display
    First detailed timing is the preferred timing
  Color Characteristics:
    Red  : 0.6406, 0.3378
    Green: 0.3154, 0.6289
    Blue : 0.1591, 0.0585
    White: 0.3134, 0.3291
  Established Timings I & II:
    IBM     :   720x400    70.082 Hz   9:5    31.467 kHz  28.320 MHz
    DMT 0x04:   640x480    59.940 Hz   4:3    31.469 kHz  25.175 MHz
    Apple   :   640x480    66.667 Hz   4:3    35.000 kHz  30.240 MHz
    DMT 0x05:   640x480    72.809 Hz   4:3    37.861 kHz  31.500 MHz
    DMT 0x06:   640x480    75.000 Hz   4:3    37.500 kHz  31.500 MHz
    DMT 0x08:   800x600    56.250 Hz   4:3    35.156 kHz  36.000 MHz
    DMT 0x09:   800x600    60.317 Hz   4:3    37.879 kHz  40.000 MHz
    DMT 0x0a:   800x600    72.188 Hz   4:3    48.077 kHz  50.000 MHz
    DMT 0x0b:   800x600    75.000 Hz   4:3    46.875 kHz  49.500 MHz
    Apple   :   832x624    74.551 Hz   4:3    49.726 kHz  57.284 MHz
    DMT 0x10:  1024x768    60.004 Hz   4:3    48.363 kHz  65.000 MHz
    DMT 0x11:  1024x768    70.069 Hz   4:3    56.476 kHz  75.000 MHz
    DMT 0x12:  1024x768    75.029 Hz   4:3    60.023 kHz  78.750 MHz
    DMT 0x24:  1280x1024   75.025 Hz   5:4    79.976 kHz 135.000 MHz
    Apple   :  1152x870    75.062 Hz 192:145  68.681 kHz 100.000 MHz
  Standard Timings:
    DMT 0x15:  1152x864    75.000 Hz   4:3    67.500 kHz 108.000 MHz
    DMT 0x1c:  1280x800    59.810 Hz  16:10   49.702 kHz  83.500 MHz
    DMT 0x23:  1280x1024   60.020 Hz   5:4    63.981 kHz 108.000 MHz
    DMT 0x2f:  1440x900    59.887 Hz  16:10   55.935 kHz 106.500 MHz
    DMT 0x30:  1440x900    74.984 Hz  16:10   70.635 kHz 136.750 MHz
    DMT 0x3a:  1680x1050   59.954 Hz  16:10   65.290 kHz 146.250 MHz
    DMT 0x52:  1920x1080   60.000 Hz  16:9    67.500 kHz 148.500 MHz
  Detailed Timing Descriptors:
    DTD 1:  1920x1080   60.000 Hz  16:9    67.500 kHz 148.500 MHz (521 mm x 293 mm)
                 Hfront   88 Hsync  44 Hback 148 Hpol P
                 Vfront    4 Vsync   5 Vback  36 Vpol P
  Display Range Limits:
    Monitor ranges (GTF): 56-75 Hz V, 30-83 kHz H, max dotclock 170 MHz
    Display Product Name: 'Acer HS244HQ'
    Display Product Serial Number: ...
  Extension blocks: 1
Checksum: 0x0f

----------------

Block 1, CTA-861 Extension Block:
  Revision: 3
  Basic audio support
  Supports YCbCr 4:4:4
  Supports YCbCr 4:2:2
  Native detailed modes: 2
  Video Data Block:
    VIC  32:  1920x1080   24.000 Hz  16:9    27.000 kHz  74.250 MHz
    VIC  19:  1280x720    50.000 Hz  16:9    37.500 kHz  74.250 MHz
    VIC   4:  1280x720    60.000 Hz  16:9    45.000 kHz  74.250 MHz (native)
    VIC  20:  1920x1080i  50.000 Hz  16:9    28.125 kHz  74.250 MHz
    VIC   5:  1920x1080i  60.000 Hz  16:9    33.750 kHz  74.250 MHz
    VIC  16:  1920x1080   60.000 Hz  16:9    67.500 kHz 148.500 MHz (native)
    VIC   3:   720x480    59.940 Hz  16:9    31.469 kHz  27.000 MHz
    VIC   2:   720x480    59.940 Hz   4:3    31.469 kHz  27.000 MHz
    VIC   1:   640x480    59.940 Hz   4:3    31.469 kHz  25.175 MHz
    VIC  18:   720x576    50.000 Hz  16:9    31.250 kHz  27.000 MHz
    VIC  31:  1920x1080   50.000 Hz  16:9    56.250 kHz 148.500 MHz
    VIC  17:   720x576    50.000 Hz   4:3    31.250 kHz  27.000 MHz
  Speaker Allocation Data Block:
    FL/FR - Front Left/Right
  Vendor-Specific Data Block (HDMI), OUI 00-0C-03:
    Source physical address: 1.0.0.0
    Maximum TMDS clock: 165 MHz
    Extended HDMI video details:
      3D present
      3D-capable-VIC mask present
      3D: Side-by-side (half, horizontal)
      3D: Frame-packing
      3D VIC indices that support these capabilities:
        VIC  32:  1920x1080   24.000 Hz  16:9    27.000 kHz  74.250 MHz
        VIC  19:  1280x720    50.000 Hz  16:9    37.500 kHz  74.250 MHz
        VIC   4:  1280x720    60.000 Hz  16:9    45.000 kHz  74.250 MHz
      3D VIC indices with specific capabilities:
        VIC  32:  1920x1080   24.000 Hz  16:9    27.000 kHz  74.250 MHz (frame packing)
        VIC  19:  1280x720    50.000 Hz  16:9    37.500 kHz  74.250 MHz (frame packing)
        VIC   4:  1280x720    60.000 Hz  16:9    45.000 kHz  74.250 MHz (frame packing)
        VIC  20:  1920x1080i  50.000 Hz  16:9    28.125 kHz  74.250 MHz (side-by-side, horizontal)
        VIC   5:  1920x1080i  60.000 Hz  16:9    33.750 kHz  74.250 MHz (side-by-side, horizontal)
  Audio Data Block:
    Linear PCM:
      Max channels: 2
      Supported sample rates (kHz): 192 176.4 96 88.2 48 44.1 32
      Supported sample sizes (bits): 24 20 16
  Detailed Timing Descriptors:
    DTD 2:  1920x1080   60.000 Hz  16:9    67.500 kHz 148.500 MHz (521 mm x 293 mm)
                 Hfront   88 Hsync  44 Hback 148 Hpol P
                 Vfront    4 Vsync   5 Vback  36 Vpol P
    DTD 3:  1280x720    60.000 Hz  16:9    45.000 kHz  74.250 MHz (521 mm x 293 mm)
                 Hfront  110 Hsync  40 Hback 220 Hpol P
                 Vfront    5 Vsync   5 Vback  20 Vpol P
Checksum: 0x50

----------------

Warnings:

Block 1, CTA-861 Extension Block:
  IT Video Formats are overscanned by default, but normally this should be underscanned.
  Display Product Serial Number is set, so the Serial Number in the Base EDID should be 0.
  Missing VCDB, needed for Set Selectable RGB Quantization to avoid interop issues.

Failures:

EDID:
  Base EDID: Some timings are out of range of the Monitor Ranges:
    Vertical Freq: 24.000 - 75.062 Hz (Monitor: 56.000 - 75.000 Hz)
    Horizontal Freq: 27.000 - 79.976 kHz (Monitor: 30.000 - 83.000 kHz)
  CTA-861: Native progressive timings are a mix of several resolutions.

EDID conformity: FAIL
