edid-decode (hex):

00 ff ff ff ff ff ff 00 30 ae c3 66 57 30 48 32
1f 1f 01 04 b5 3c 22 78 3b 78 e5 ad 4f 46 ab 26
0d 50 54 bd ef 00 81 80 95 00 b3 00 d1 c0 61 68
61 7c 45 68 45 7c 56 5e 00 a0 a0 a0 29 50 30 20
35 00 55 50 21 00 00 1e 00 00 00 ff 00 55 36 33
33 32 48 30 57 0a 20 20 20 20 00 00 00 fd 00 30
a5 fa fa 41 01 0a 20 20 20 20 20 20 00 00 00 fc
00 47 32 37 71 2d 32 30 0a 20 20 20 20 20 01 20

02 03 32 f1 49 01 02 03 04 11 12 13 90 1f 23 09
07 07 83 01 00 00 e2 00 d5 6d 1a 00 00 02 01 30
a5 00 00 00 00 00 00 e3 05 c0 00 e6 06 07 01 61
56 1c 14 ec 00 a0 a0 a0 67 50 20 30 35 00 55 50
21 00 00 1a 70 a0 00 a0 a0 a0 46 50 30 20 35 00
55 50 21 00 00 1e 70 c2 00 a0 a0 a0 55 50 30 20
35 00 55 50 21 00 00 1a e6 f9 00 50 a0 a0 1e 50
08 20 08 04 55 50 21 00 00 1a 00 00 00 00 00 65

00 ff ff ff ff ff ff 00 30 ae c3 66 57 30 48 32
1f 1f 01 04 b5 3c 22 78 3b 78 e5 ad 4f 46 ab 26
0d 50 54 bd ef 00 81 80 95 00 b3 00 d1 c0 61 68
61 7c 45 68 45 7c 56 5e 00 a0 a0 a0 29 50 30 20
35 00 55 50 21 00 00 1e 00 00 00 ff 00 55 36 33
33 32 48 30 57 0a 20 20 20 20 00 00 00 fd 00 30
a5 fa fa 41 01 0a 20 20 20 20 20 20 00 00 00 fc
00 47 32 37 71 2d 32 30 0a 20 20 20 20 20 01 20

02 03 32 f1 49 01 02 03 04 11 12 13 90 1f 23 09
07 07 83 01 00 00 e2 00 d5 6d 1a 00 00 02 01 30
a5 00 00 00 00 00 00 e3 05 c0 00 e6 06 07 01 61
56 1c 14 ec 00 a0 a0 a0 67 50 20 30 35 00 55 50
21 00 00 1a 70 a0 00 a0 a0 a0 46 50 30 20 35 00
55 50 21 00 00 1e 70 c2 00 a0 a0 a0 55 50 30 20
35 00 55 50 21 00 00 1a e6 f9 00 50 a0 a0 1e 50
08 20 08 04 55 50 21 00 00 1a 00 00 00 00 00 65

----------------

Block 0, Base EDID:
  EDID Structure Version & Revision: 1.4
  Vendor & Product Identification:
    Manufacturer: LEN
    Model: 26307
    Serial Number: ...
    Made in: week 31 of 2021
  Basic Display Parameters & Features:
    Digital display
    Bits per primary color channel: 10
    DisplayPort interface
    Maximum image size: 60 cm x 34 cm
    Gamma: 2.20
    DPMS levels: Off
    Supported color formats: RGB 4:4:4, YCrCb 4:4:4, YCrCb 4:2:2
    First detailed timing includes the native pixel format and preferred refresh rate
    Display is continuous frequency
  Color Characteristics:
    Red  : 0.6767, 0.3115
    Green: 0.2753, 0.6679
    Blue : 0.1513, 0.0527
    White: 0.3134, 0.3291
  Established Timings I & II:
    IBM     :   720x400    70.081663 Hz   9:5     31.467 kHz     28.320000 MHz
    DMT 0x04:   640x480    59.940476 Hz   4:3     31.469 kHz     25.175000 MHz
    Apple   :   640x480    66.666667 Hz   4:3     35.000 kHz     30.240000 MHz
    DMT 0x05:   640x480    72.808802 Hz   4:3     37.861 kHz     31.500000 MHz
    DMT 0x06:   640x480    75.000000 Hz   4:3     37.500 kHz     31.500000 MHz
    DMT 0x09:   800x600    60.316541 Hz   4:3     37.879 kHz     40.000000 MHz
    DMT 0x0a:   800x600    72.187572 Hz   4:3     48.077 kHz     50.000000 MHz
    DMT 0x0b:   800x600    75.000000 Hz   4:3     46.875 kHz     49.500000 MHz
    Apple   :   832x624    74.551266 Hz   4:3     49.726 kHz     57.284000 MHz
    DMT 0x10:  1024x768    60.003840 Hz   4:3     48.363 kHz     65.000000 MHz
    DMT 0x11:  1024x768    70.069359 Hz   4:3     56.476 kHz     75.000000 MHz
    DMT 0x12:  1024x768    75.028582 Hz   4:3     60.023 kHz     78.750000 MHz
    DMT 0x24:  1280x1024   75.024675 Hz   5:4     79.976 kHz    135.000000 MHz
  Standard Timings:
    DMT 0x23:  1280x1024   60.019740 Hz   5:4     63.981 kHz    108.000000 MHz
    DMT 0x2f:  1440x900    59.887445 Hz  16:10    55.935 kHz    106.500000 MHz
    DMT 0x3a:  1680x1050   59.954250 Hz  16:10    65.290 kHz    146.250000 MHz
    DMT 0x52:  1920x1080   60.000000 Hz  16:9     67.500 kHz    148.500000 MHz
    GTF     :  1024x768   100.000177 Hz   4:3     81.400 kHz    113.309000 MHz
    GTF     :  1024x768   119.999931 Hz   4:3     98.760 kHz    139.054000 MHz
    GTF     :   800x600    99.999707 Hz   4:3     63.600 kHz     68.179000 MHz
    GTF     :   800x600   119.999886 Hz   4:3     77.160 kHz     83.950000 MHz
  Detailed Timing Descriptors:
    DTD 1:  2560x1440   59.950550 Hz  16:9     88.787 kHz    241.500000 MHz (597 mm x 336 mm)
                 Hfront   48 Hsync  32 Hback   80 Hpol P
                 Vfront    3 Vsync   5 Vback   33 Vpol P
    Display Product Serial Number: ...
    Display Range Limits:
      Monitor ranges (Bare Limits): 48-165 Hz V, 250-250 kHz H, max dotclock 650 MHz
    Display Product Name: 'G27q-20'
  Extension blocks: 1
Checksum: 0x20

----------------

Block 1, CTA-861 Extension Block:
  Revision: 3
  Underscans IT Video Formats by default
  Basic audio support
  Supports YCbCr 4:4:4
  Supports YCbCr 4:2:2
  Native detailed modes: 1
  Video Data Block:
    VIC   1:   640x480    59.940476 Hz   4:3     31.469 kHz     25.175000 MHz
    VIC   2:   720x480    59.940060 Hz   4:3     31.469 kHz     27.000000 MHz
    VIC   3:   720x480    59.940060 Hz  16:9     31.469 kHz     27.000000 MHz
    VIC   4:  1280x720    60.000000 Hz  16:9     45.000 kHz     74.250000 MHz
    VIC  17:   720x576    50.000000 Hz   4:3     31.250 kHz     27.000000 MHz
    VIC  18:   720x576    50.000000 Hz  16:9     31.250 kHz     27.000000 MHz
    VIC  19:  1280x720    50.000000 Hz  16:9     37.500 kHz     74.250000 MHz
    VIC  16:  1920x1080   60.000000 Hz  16:9     67.500 kHz    148.500000 MHz (native)
    VIC  31:  1920x1080   50.000000 Hz  16:9     56.250 kHz    148.500000 MHz
  Audio Data Block:
    Linear PCM:
      Max channels: 2
      Supported sample rates (kHz): 48 44.1 32
      Supported sample sizes (bits): 24 20 16
  Speaker Allocation Data Block:
    FL/FR - Front Left/Right
  Video Capability Data Block:
    YCbCr quantization: Selectable (via AVI YQ)
    RGB quantization: Selectable (via AVI Q)
    PT scan behavior: Always Overscanned
    IT scan behavior: Always Overscanned
    CE scan behavior: Always Overscanned
  Vendor-Specific Data Block (AMD), OUI 00-00-1A:
    Version: 2.1
    Minimum Refresh Rate: 48 Hz
    Maximum Refresh Rate: 165 Hz
    Flags 1.x: 0x00
    Flags 2.x: 0x00
    Maximum luminance: 0 (50.000 cd/m^2)
    Minimum luminance: 0 (0.000 cd/m^2)
    Unknown: 0x00 0x00
  Colorimetry Data Block:
    BT2020YCC
    BT2020RGB
  HDR Static Metadata Data Block:
    Electro optical transfer functions:
      Traditional gamma - SDR luminance range
      Traditional gamma - HDR luminance range
      SMPTE ST2084
    Supported static metadata descriptors:
      Static metadata type 1
    Desired content max luminance: 97 (408.759 cd/m^2)
    Desired content max frame-average luminance: 86 (322.098 cd/m^2)
    Desired content min luminance: 28 (0.049 cd/m^2)
  Detailed Timing Descriptors:
    DTD 2:  2560x1440  143.999466 Hz  16:9    222.191 kHz    604.360000 MHz (597 mm x 336 mm)
                 Hfront   32 Hsync  48 Hback   80 Hpol P
                 Vfront    3 Vsync   5 Vback   95 Vpol N
    DTD 3:  2560x1440  100.000000 Hz  16:9    151.000 kHz    410.720000 MHz (597 mm x 336 mm)
                 Hfront   48 Hsync  32 Hback   80 Hpol P
                 Vfront    3 Vsync   5 Vback   62 Vpol P
    DTD 4:  2560x1440  120.000000 Hz  16:9    183.000 kHz    497.760000 MHz (597 mm x 336 mm)
                 Hfront   48 Hsync  32 Hback   80 Hpol P
                 Vfront    3 Vsync   5 Vback   77 Vpol N
    DTD 5:  2560x1440  164.847454 Hz  16:9    242.326 kHz    639.740000 MHz (597 mm x 336 mm)
                 Hfront    8 Hsync  32 Hback   40 Hpol P
                 Vfront   16 Vsync   8 Vback    6 Vpol N
Checksum: 0x65  Unused space in Extension Block: 5 bytes

----------------

Block 2, Unknown EDID Extension Block 0x00:
  00 ff ff ff ff ff ff 00 30 ae c3 66 57 30 48 32 '........0..fW0H2'
  1f 1f 01 04 b5 3c 22 78 3b 78 e5 ad 4f 46 ab 26 '.....<"x;x..OF.&'
  0d 50 54 bd ef 00 81 80 95 00 b3 00 d1 c0 61 68 '.PT...........ah'
  61 7c 45 68 45 7c 56 5e 00 a0 a0 a0 29 50 30 20 'a|EhE|V^....)P0 '
  35 00 55 50 21 00 00 1e 00 00 00 ff 00 55 36 33 '5.UP!........U63'
  33 32 48 30 57 0a 20 20 20 20 00 00 00 fd 00 30 '32H0W.    .....0'
  a5 fa fa 41 01 0a 20 20 20 20 20 20 00 00 00 fc '...A..      ....'
  00 47 32 37 71 2d 32 30 0a 20 20 20 20 20 01 20 '.G27q-20.     . '
Checksum: 0x20

----------------

Block 3, CTA-861 Extension Block:
  Revision: 3
  Underscans IT Video Formats by default
  Basic audio support
  Supports YCbCr 4:4:4
  Supports YCbCr 4:2:2
  Native detailed modes: 1
  Video Data Block:
    VIC   1:   640x480    59.940476 Hz   4:3     31.469 kHz     25.175000 MHz
    VIC   2:   720x480    59.940060 Hz   4:3     31.469 kHz     27.000000 MHz
    VIC   3:   720x480    59.940060 Hz  16:9     31.469 kHz     27.000000 MHz
    VIC   4:  1280x720    60.000000 Hz  16:9     45.000 kHz     74.250000 MHz
    VIC  17:   720x576    50.000000 Hz   4:3     31.250 kHz     27.000000 MHz
    VIC  18:   720x576    50.000000 Hz  16:9     31.250 kHz     27.000000 MHz
    VIC  19:  1280x720    50.000000 Hz  16:9     37.500 kHz     74.250000 MHz
    VIC  16:  1920x1080   60.000000 Hz  16:9     67.500 kHz    148.500000 MHz (native)
    VIC  31:  1920x1080   50.000000 Hz  16:9     56.250 kHz    148.500000 MHz
  Audio Data Block:
    Linear PCM:
      Max channels: 2
      Supported sample rates (kHz): 48 44.1 32
      Supported sample sizes (bits): 24 20 16
  Speaker Allocation Data Block:
    FL/FR - Front Left/Right
  Video Capability Data Block:
    YCbCr quantization: Selectable (via AVI YQ)
    RGB quantization: Selectable (via AVI Q)
    PT scan behavior: Always Overscanned
    IT scan behavior: Always Overscanned
    CE scan behavior: Always Overscanned
  Vendor-Specific Data Block (AMD), OUI 00-00-1A:
    Version: 2.1
    Minimum Refresh Rate: 48 Hz
    Maximum Refresh Rate: 165 Hz
    Flags 1.x: 0x00
    Flags 2.x: 0x00
    Maximum luminance: 0 (50.000 cd/m^2)
    Minimum luminance: 0 (0.000 cd/m^2)
    Unknown: 0x00 0x00
  Colorimetry Data Block:
    BT2020YCC
    BT2020RGB
  HDR Static Metadata Data Block:
    Electro optical transfer functions:
      Traditional gamma - SDR luminance range
      Traditional gamma - HDR luminance range
      SMPTE ST2084
    Supported static metadata descriptors:
      Static metadata type 1
    Desired content max luminance: 97 (408.759 cd/m^2)
    Desired content max frame-average luminance: 86 (322.098 cd/m^2)
    Desired content min luminance: 28 (0.049 cd/m^2)
  Detailed Timing Descriptors:
    DTD 6:  2560x1440  143.999466 Hz  16:9    222.191 kHz    604.360000 MHz (597 mm x 336 mm)
                 Hfront   32 Hsync  48 Hback   80 Hpol P
                 Vfront    3 Vsync   5 Vback   95 Vpol N
    DTD 7:  2560x1440  100.000000 Hz  16:9    151.000 kHz    410.720000 MHz (597 mm x 336 mm)
                 Hfront   48 Hsync  32 Hback   80 Hpol P
                 Vfront    3 Vsync   5 Vback   62 Vpol P
    DTD 8:  2560x1440  120.000000 Hz  16:9    183.000 kHz    497.760000 MHz (597 mm x 336 mm)
                 Hfront   48 Hsync  32 Hback   80 Hpol P
                 Vfront    3 Vsync   5 Vback   77 Vpol N
    DTD 9:  2560x1440  164.847454 Hz  16:9    242.326 kHz    639.740000 MHz (597 mm x 336 mm)
                 Hfront    8 Hsync  32 Hback   40 Hpol P
                 Vfront   16 Vsync   8 Vback    6 Vpol N
Checksum: 0x65  Unused space in Extension Block: 5 bytes

----------------

Warnings:

Block 1, CTA-861 Extension Block:
  Video Capability Data Block: IT scan behavior is expected to support underscanned.
  Video Capability Data Block: S_PT is equal to S_IT and S_CE, so should be set to 0 instead.
  Colorimetry Data Block: Set the sRGB colorimetry bit to avoid interop issues.
  Display Product Serial Number is set, so the Serial Number in the Base EDID should be 0.
Block 3, CTA-861 Extension Block:
  Video Capability Data Block: IT scan behavior is expected to support underscanned.
  Video Capability Data Block: S_PT is equal to S_IT and S_CE, so should be set to 0 instead.
  Colorimetry Data Block: Set the sRGB colorimetry bit to avoid interop issues.
  Display Product Serial Number is set, so the Serial Number in the Base EDID should be 0.
EDID:
  Base EDID: Some timings are out of range of the Monitor Ranges:
    Horizontal Freq: 31.250 - 242.325 kHz (Monitor: 250.000 - 250.000 kHz)

Failures:

Block 1, CTA-861 Extension Block:
  Video Capability Data Block: IT video formats are always overscanned, but bit 7 of Byte 3 of the CTA-861 Extension header is set to underscanned.
Block 2, Base EDID:
  Unknown Extension Block.
Block 3, CTA-861 Extension Block:
  Video Data Block: Duplicate VIC 1.
  Video Data Block: Duplicate VIC 2.
  Video Data Block: Duplicate VIC 3.
  Video Data Block: Duplicate VIC 4.
  Video Data Block: Duplicate VIC 17.
  Video Data Block: Duplicate VIC 18.
  Video Data Block: Duplicate VIC 19.
  Video Data Block: Duplicate VIC 16.
  Video Data Block: Duplicate VIC 31.
  Speaker Allocation Data Block: Only one instance of this Data Block is allowed.
  Video Capability Data Block: Only one instance of this Data Block is allowed.
  Video Capability Data Block: IT video formats are always overscanned, but bit 7 of Byte 3 of the CTA-861 Extension header is set to underscanned.
  Colorimetry Data Block: Only one instance of this Data Block is allowed.
  HDR Static Metadata Data Block: Only one instance of this Data Block is allowed.
EDID:
  Base EDID: EDID specified 1 extension block(s), but found 3 extension block(s).
  CTA-861: Native progressive timings are a mix of several resolutions.

EDID conformity: FAIL
