
EDID (hex):
00ffffffffffff0030aec3664d365231
141f0104b53c22783b78e5ad4f46ab26
0d5054bdef0081809500b300d1c06168
617c4568457c565e00a0a0a029503020
350055502100001e000000ff00553633
333152364d0a20202020000000fd0030
a5fafa41010a202020202020000000fc
00473237712d32300a20202020200121
020332f14901020304111213901f2309
070783010000e200d56d1a0000020130
a5000000000000e305c000e606070161
561c14ec00a0a0a06750203035005550
2100001a70a000a0a0a0465030203500
55502100001e70c200a0a0a055503020
350055502100001ae6f90050a0a01e50
0820080455502100001a000000000065

Extracted contents:
header:          00 ff ff ff ff ff ff 00
serial number:   30 ae c3 66 4d 36 52 31 14 1f
version:         01 04
basic params:    b5 3c 22 78 3b
chroma info:     78 e5 ad 4f 46 ab 26 0d 50 54
established:     bd ef 00
standard:        81 80 95 00 b3 00 d1 c0 61 68 61 7c 45 68 45 7c
descriptor 1:    56 5e 00 a0 a0 a0 29 50 30 20 35 00 55 50 21 00 00 1e
descriptor 2:    00 00 00 ff 00 55 36 33 33 31 52 36 4d 0a 20 20 20 20
descriptor 3:    00 00 00 fd 00 30 a5 fa fa 41 01 0a 20 20 20 20 20 20
descriptor 4:    00 00 00 fc 00 47 32 37 71 2d 32 30 0a 20 20 20 20 20
extensions:      01
checksum:        21

EDID version: 1.4
Manufacturer: LEN Model 66c3 Serial Number --
Made in week 20 of 2021
Digital display
10 bits per primary color channel
DisplayPort interface
Maximum image size: 60 cm x 34 cm
Gamma: 2.20
DPMS levels: Off
Supported color formats: RGB 4:4:4, YCrCb 4:4:4, YCrCb 4:2:2
First detailed timing includes the native pixel format and preferred refresh rate
Display is continuous frequency
Display x,y Chromaticity:
  Red:   0.6767, 0.3115
  Green: 0.2753, 0.6679
  Blue:  0.1513, 0.0527
  White: 0.3134, 0.3291
Established timings supported:
  720x400@70Hz 9:5 HorFreq: 31469 Hz Clock: 28.320 MHz
  640x480@60Hz 4:3 HorFreq: 31469 Hz Clock: 25.175 MHz
  640x480@67Hz 4:3 HorFreq: 35000 Hz Clock: 30.240 MHz
  640x480@72Hz 4:3 HorFreq: 37900 Hz Clock: 31.500 MHz
  640x480@75Hz 4:3 HorFreq: 37500 Hz Clock: 31.500 MHz
  800x600@60Hz 4:3 HorFreq: 37900 Hz Clock: 40.000 MHz
  800x600@72Hz 4:3 HorFreq: 48100 Hz Clock: 50.000 MHz
  800x600@75Hz 4:3 HorFreq: 46900 Hz Clock: 49.500 MHz
  832x624@75Hz 4:3 HorFreq: 49726 Hz Clock: 57.284 MHz
  1024x768@60Hz 4:3 HorFreq: 48400 Hz Clock: 65.000 MHz
  1024x768@70Hz 4:3 HorFreq: 56500 Hz Clock: 75.000 MHz
  1024x768@75Hz 4:3 HorFreq: 60000 Hz Clock: 78.750 MHz
  1280x1024@75Hz 5:4 HorFreq: 80000 Hz Clock: 135.000 MHz
Standard timings supported:
  1280x1024@60Hz 5:4 HorFreq: 64000 Hz Clock: 108.000 MHz
  1440x900@60Hz 16:10 HorFreq: 55500 Hz Clock: 88.750 MHz
  1680x1050@60Hz 16:10 HorFreq: 64700 Hz Clock: 119.000 MHz
  1920x1080@60Hz 16:9
  1024x768@100Hz 4:3
  1024x768@120Hz 4:3
  800x600@100Hz 4:3
  800x600@120Hz 4:3
Detailed mode: Clock 241.500 MHz, 597 mm x 336 mm
               2560 2608 2640 2720 hborder 0
               1440 1443 1448 1481 vborder 0
               +hsync +vsync 
               VertFreq: 59 Hz, HorFreq: 88786 Hz
Serial number: --
Monitor ranges (bare limits): 48-165Hz V, 250-250kHz H, max dotclock 650MHz
Monitor name: G27q-20
Has 1 extension blocks
Checksum: 0x21 (valid)

CTA extension block
Extension version: 3
46 bytes of CTA data
  Video data block
    VIC   1 640x480@60Hz 4:3  HorFreq: 31469 Hz Clock: 25.175 MHz
    VIC   2 720x480@60Hz 4:3  HorFreq: 31469 Hz Clock: 27.000 MHz
    VIC   3 720x480@60Hz 16:9  HorFreq: 31469 Hz Clock: 27.000 MHz
    VIC   4 1280x720@60Hz 16:9  HorFreq: 45000 Hz Clock: 74.250 MHz
    VIC  17 720x576@50Hz 4:3  HorFreq: 31250 Hz Clock: 27.000 MHz
    VIC  18 720x576@50Hz 16:9  HorFreq: 31250 Hz Clock: 27.000 MHz
    VIC  19 1280x720@50Hz 16:9  HorFreq: 37500 Hz Clock: 74.250 MHz
    VIC  16 1920x1080@60Hz 16:9 (native) HorFreq: 67500 Hz Clock: 148.500 MHz
    VIC  31 1920x1080@50Hz 16:9  HorFreq: 56250 Hz Clock: 148.500 MHz
  Audio data block
    Linear PCM, max channels 2
      Supported sample rates (kHz): 48 44.1 32
      Supported sample sizes (bits): 24 20 16
  Speaker allocation data block
    Speaker map:
      FL/FR - Front Left/Right
  Extended tag: Video capability data block
    YCbCr quantization: Selectable (via AVI YQ) (1)
    RGB quantization: Selectable (via AVI Q) (1)
    PT scan behaviour: Always Overscannned (1)
    IT scan behaviour: Always Overscannned (1)
    CE scan behaviour: Always Overscannned (1)
  Vendor-specific data block, OUI 00001a
  Extended tag: Colorimetry data block
    BT2020YCC
    BT2020RGB
  Extended tag: HDR static metadata data block
    Electro optical transfer functions:
      Traditional gamma - SDR luminance range
      Traditional gamma - HDR luminance range
      SMPTE ST2084
    Supported static metadata descriptors:
      Static metadata type 1
    Desired content max luminance: 97 (408.759 cd/m^2)
    Desired content max frame-average luminance: 86 (322.098 cd/m^2)
    Desired content min luminance: 28 (0.049 cd/m^2)
Underscans PC formats by default
Basic audio support
Supports YCbCr 4:4:4
Supports YCbCr 4:2:2
1 native detailed modes
Detailed mode: Clock 604.360 MHz, 597 mm x 336 mm
               2560 2592 2640 2720 hborder 0
               1440 1443 1448 1543 vborder 0
               +hsync -vsync 
               VertFreq: 143 Hz, HorFreq: 222191 Hz
Detailed mode: Clock 410.720 MHz, 597 mm x 336 mm
               2560 2608 2640 2720 hborder 0
               1440 1443 1448 1510 vborder 0
               +hsync +vsync 
               VertFreq: 100 Hz, HorFreq: 151000 Hz
Detailed mode: Clock 497.760 MHz, 597 mm x 336 mm
               2560 2608 2640 2720 hborder 0
               1440 1443 1448 1525 vborder 0
               +hsync -vsync 
               VertFreq: 120 Hz, HorFreq: 183000 Hz
Detailed mode: Clock 639.740 MHz, 597 mm x 336 mm
               2560 2568 2600 2640 hborder 0
               1440 1456 1464 1470 vborder 0
               +hsync -vsync 
               VertFreq: 164 Hz, HorFreq: 242325 Hz
Checksum: 0x65 (valid)

Warning: One or more of the timings is out of range of the Monitor Ranges:
  Vertical Freq: 50 - 164 Hz
  Horizontal Freq: 31250 - 242325 Hz
  Maximum Clock: 639.740 MHz
EDID block does not conform at all!
	Both the serial number and the serial string are set


