edid-decode (hex):

00 ff ff ff ff ff ff 00 4c a3 45 32 00 00 00 00
00 12 01 00 80 21 15 78 0a 87 f5 94 57 4f 8c 27
27 50 54 00 00 00 01 01 01 01 01 01 01 01 01 01
01 01 01 01 01 01 8f 1b 00 82 50 20 22 30 10 30
13 00 4b cf 10 00 00 19 00 00 00 0f 00 00 00 00
00 00 00 00 00 23 87 02 64 01 00 00 00 fe 00 53
41 4d 53 55 4e 47 0a 20 20 20 20 20 00 00 00 fe
00 4c 54 4e 31 35 34 41 54 31 30 30 30 30 00 9b

----------------

Block 0, Base EDID:
  EDID Structure Version & Revision: 1.0
  Vendor & Product Identification:
    Manufacturer: SEC
    Model: 12869
    Made in: 2008
  Basic Display Parameters & Features:
    Digital display
    Maximum image size: 33 cm x 21 cm
    Gamma: 2.20
    RGB color display
    First detailed timing is the preferred timing
  Color Characteristics:
    Red  : 0.5800, 0.3398
    Green: 0.3095, 0.5498
    Blue : 0.1552, 0.1552
    White: 0.3134, 0.3291
  Established Timings I & II: none
  Standard Timings: none
  Detailed Timing Descriptors:
    DTD 1:  1280x800    59.994558 Hz   8:5     50.035 kHz     70.550000 MHz (331 mm x 207 mm)
                 Hfront   16 Hsync  48 Hback   66 Hpol N
                 Vfront    1 Vsync   3 Vback   30 Vpol N
    Manufacturer-Specified Display Descriptor (0x0f): 00 0f 00 00 00 00 00 00 00 00 00 23 87 02 64 01 '...........#..d.'
    Alphanumeric Data String: 'SAMSUNG'
    Alphanumeric Data String: 'LTN154AT10000'
Checksum: 0x9b

----------------

Warnings:

Block 0, Base EDID:
  EDID Structure Version & Revision: EDID 1.0 is deprecated, do not use.

Failures:

Block 0, Base EDID:
  Display Descriptor #2: Has descriptor blocks other than detailed timings.
  Display Descriptor #3: Has descriptor blocks other than detailed timings.
  Display Descriptor #4: Has descriptor blocks other than detailed timings.

EDID conformity: FAIL
