
EDID (hex):
00ffffffffffff004c83523200000000
00180104951f11780a7df59157578f29
1e505400000001010101010101010101
0101010101018a1b565a500027303020
550035ae100000190000000f00000000
000000000025b4061500000000fe0053
414d53554e470a2020202020000000fe
00313430415433352d5430310a200002

Extracted contents:
header:          00 ff ff ff ff ff ff 00
serial number:   4c 83 52 32 00 00 00 00 00 18
version:         01 04
basic params:    95 1f 11 78 0a
chroma info:     7d f5 91 57 57 8f 29 1e 50 54
established:     00 00 00
standard:        01 01 01 01 01 01 01 01 01 01 01 01 01 01 01 01
descriptor 1:    8a 1b 56 5a 50 00 27 30 30 20 55 00 35 ae 10 00 00 19
descriptor 2:    00 00 00 0f 00 00 00 00 00 00 00 00 00 25 b4 06 15 00
descriptor 3:    00 00 00 fe 00 53 41 4d 53 55 4e 47 0a 20 20 20 20 20
descriptor 4:    00 00 00 fe 00 31 34 30 41 54 33 35 2d 54 30 31 0a 20
extensions:      00
checksum:        02

EDID version: 1.4
Manufacturer: SDC Model 3252 Serial Number --
Made in year 2014
Digital display
6 bits per primary color channel
DisplayPort interface
Maximum image size: 31 cm x 17 cm
Gamma: 2.20
Supported color formats: RGB 4:4:4, YCrCb 4:4:4
First detailed timing includes the native pixel format and preferred refresh rate
Display x,y Chromaticity:
  Red:   0.5673, 0.3427
  Green: 0.3427, 0.5595
  Blue:  0.1630, 0.1201
  White: 0.3134, 0.3291
Established timings supported:
Standard timings supported:
Detailed mode: Clock 70.500 MHz, 309 mm x 174 mm
               1366 1414 1446 1456 hborder 0
                768  773  778  807 vborder 0
               -hsync -vsync 
               VertFreq: 60 Hz, HorFreq: 48420 Hz
Manufacturer-specified data, tag 15
ASCII string: SAMSUNG
ASCII string: 140AT35-T01
Checksum: 0x2 (valid)
EDID block does NOT conform to EDID 1.4!
	Missing name descriptor
	Missing monitor ranges
