edid-decode (hex):

00 ff ff ff ff ff ff 00 4c a3 42 33 00 00 00 00
00 15 01 03 80 16 0d 78 0a 85 95 99 57 4f 8f 26
21 50 54 00 00 00 01 01 01 01 01 01 01 01 01 01
01 01 01 01 01 01 80 16 00 48 41 58 6e 20 18 88
36 00 df 7d 00 00 00 19 00 00 00 0f 00 00 00 00
00 00 00 00 00 58 d2 0a 55 00 00 00 00 fe 00 53
41 4d 53 55 4e 47 0a 20 20 20 20 20 00 00 00 fe
00 31 30 31 4e 54 30 39 2d 38 30 35 0a 20 00 44

----------------

Block 0, Base EDID:
  EDID Structure Version & Revision: 1.3
  Vendor & Product Identification:
    Manufacturer: SEC
    Model: 13122
    Made in: 2011
  Basic Display Parameters & Features:
    Digital display
    Maximum image size: 22 cm x 13 cm
    Gamma: 2.20
    RGB color display
    First detailed timing is the preferred timing
  Color Characteristics:
    Red  : 0.5996, 0.3398
    Green: 0.3095, 0.5595
    Blue : 0.1503, 0.1298
    White: 0.3134, 0.3291
  Established Timings I & II: none
  Standard Timings: none
  Detailed Timing Descriptors:
    DTD 1:  1024x600    60.005000 Hz 128:75    42.604 kHz     57.600000 MHz (223 mm x 125 mm)
                 Hfront   24 Hsync 136 Hback  168 Hpol N
                 Vfront    3 Vsync   6 Vback  101 Vpol N
    Manufacturer-Specified Display Descriptor (0x0f): 00 0f 00 00 00 00 00 00 00 00 00 58 d2 0a 55 00 '...........X..U.'
    Alphanumeric Data String: 'SAMSUNG'
    Alphanumeric Data String: '101NT09-805'
Checksum: 0x44

----------------

Failures:

Block 0, Base EDID:
  Missing Display Product Name.
  Missing Display Range Limits Descriptor.

EDID conformity: FAIL
