edid-decode (hex):

00 ff ff ff ff ff ff 00 30 e4 82 03 00 00 00 00
00 16 01 03 80 1f 11 78 0a ba 85 a3 58 54 a1 27
0c 50 54 00 00 00 01 01 01 01 01 01 01 01 01 01
01 01 01 01 01 01 30 2a 40 44 61 84 24 30 30 20
35 00 35 ae 10 00 00 19 00 00 00 00 00 00 00 00
00 00 00 00 00 00 00 00 00 00 00 00 00 fe 00 4c
47 20 44 69 73 70 6c 61 79 0a 20 20 00 00 00 fe
00 4c 50 31 34 30 57 44 32 2d 54 4c 45 32 00 52

----------------

Block 0, Base EDID:
  EDID Structure Version & Revision: 1.3
  Vendor & Product Identification:
    Manufacturer: LGD
    Model: 898
    Made in: 2012
  Basic Display Parameters & Features:
    Digital display
    Maximum image size: 31 cm x 17 cm
    Gamma: 2.20
    RGB color display
    First detailed timing is preferred timing
  Color Characteristics:
    Red  : 0.6386, 0.3466
    Green: 0.3300, 0.6308
    Blue : 0.1542, 0.0468
    White: 0.3134, 0.3291
  Established Timings I & II: none
  Standard Timings: none
  Detailed Timing Descriptors:
    DTD 1:  1600x900    59.971 Hz  16:9    56.133 kHz 108.000 MHz (309 mm x 174 mm)
                 Hfront   48 Hsync  32 Hback 244 Hpol N
                 Vfront    3 Vsync   5 Vback  28 Vpol N
    Empty Descriptor
    Alphanumeric Data String: 'LG Display'
    Alphanumeric Data String: 'LP140WD2-TLE2'
Checksum: 0x52
