edid-decode (hex):

00 ff ff ff ff ff ff 00 25 cc 05 00 00 00 00 00
00 13 01 03 80 22 13 78 0a c8 85 9e 57 54 9b 26
12 50 54 00 00 00 01 01 01 01 01 01 01 01 01 01
01 01 01 01 01 01 c6 1b 56 7f 50 00 19 30 1f 15
34 00 58 c2 10 00 00 18 00 00 00 00 00 00 00 00
00 00 00 00 00 00 00 00 00 00 00 00 00 fe 00 49
4e 4c 0a 20 20 20 20 20 20 20 20 20 00 00 00 00
00 42 54 31 35 36 47 57 30 31 56 32 32 10 00 a6

----------------

Block 0, Base EDID:
  EDID Structure Version & Revision: 1.3
  Vendor & Product Identification:
    Manufacturer: INL
    Model: 5
    Made in: 2009
  Basic Display Parameters & Features:
    Digital display
    Maximum image size: 34 cm x 19 cm
    Gamma: 2.20
    RGB color display
    First detailed timing is preferred timing
  Color Characteristics:
    Red  : 0.6201, 0.3398
    Green: 0.3300, 0.6054
    Blue : 0.1503, 0.0703
    White: 0.3134, 0.3291
  Established Timings I & II: none
  Standard Timings: none
  Detailed Timing Descriptors:
    DTD 1:  1366x768    60.053 Hz 683:384  47.622 kHz  71.100 MHz (344 mm x 194 mm)
                 Hfront   31 Hsync  21 Hback  75 Hpol N
                 Vfront    3 Vsync   4 Vback  18 Vpol N
    Empty Descriptor
    Alphanumeric Data String: 'INL'
    Manufacturer-Specified Display Descriptor (0x00): 00 00 00 42 54 31 35 36 47 57 30 31 56 32 32 10 '...BT156GW01V22.'
Checksum: 0xa6

----------------

Failures:

Block 0, Base EDID:
  Empty Descriptor: Use Dummy Descriptor instead of all zeroes.
  Missing Display Product Name.
  Missing Display Range Limits Descriptor.

EDID conformity: FAIL
