edid-decode (hex):

00 ff ff ff ff ff ff 00 08 59 19 00 01 01 01 01
01 18 01 03 08 29 17 78 0a fc 95 a2 57 53 a1 27
0c 50 54 a3 08 00 31 40 81 80 81 c0 81 00 81 40
81 0f 01 01 01 01 98 21 50 b0 51 00 1b 30 40 70
36 00 40 84 63 00 00 1e 40 1f 00 80 51 00 1e 30
40 80 37 00 40 84 63 00 00 1c 00 00 00 fd 00 39
3f 1e 31 09 00 0a 20 20 20 20 20 20 00 00 00 fc
00 4e 53 2d 31 39 45 33 31 30 4e 41 31 35 00 47

----------------

Block 0, Base EDID:
  EDID Structure Version & Revision: 1.3
  Vendor & Product Identification:
    Manufacturer: BBY
    Model: 25
    Serial Number: ...
    Made in: week 1 of 2014
  Basic Display Parameters & Features:
    Analog display
    Input voltage level: 0.7/0.3 V
    Sync: Separate
    Maximum image size: 41 cm x 23 cm
    Gamma: 2.20
    RGB color display
    First detailed timing is preferred timing
  Color Characteristics:
    Red  : 0.6357, 0.3427
    Green: 0.3271, 0.6289
    Blue : 0.1542, 0.0478
    White: 0.3134, 0.3291
  Established Timings I & II:
    IBM     :   720x400    70.082 Hz   9:5    31.467 kHz  28.320 MHz
    DMT 0x04:   640x480    59.940 Hz   4:3    31.469 kHz  25.175 MHz
    DMT 0x08:   800x600    56.250 Hz   4:3    35.156 kHz  36.000 MHz
    DMT 0x09:   800x600    60.317 Hz   4:3    37.879 kHz  40.000 MHz
    DMT 0x10:  1024x768    60.004 Hz   4:3    48.363 kHz  65.000 MHz
  Standard Timings:
    DMT 0x04:   640x480    59.940 Hz   4:3    31.469 kHz  25.175 MHz
    DMT 0x23:  1280x1024   60.020 Hz   5:4    63.981 kHz 108.000 MHz
    DMT 0x55:  1280x720    60.000 Hz  16:9    45.000 kHz  74.250 MHz
    DMT 0x1c:  1280x800    59.810 Hz  16:10   49.702 kHz  83.500 MHz
    DMT 0x20:  1280x960    60.000 Hz   4:3    60.000 kHz 108.000 MHz
    DMT 0x1d:  1280x800    74.934 Hz  16:10   62.795 kHz 106.500 MHz
  Detailed Timing Descriptors:
    DTD 1:  1360x768    60.366 Hz  85:48   47.991 kHz  86.000 MHz (1600 mm x 900 mm)
                 Hfront   64 Hsync 112 Hback 256 Hpol P
                 Vfront    3 Vsync   6 Vback  18 Vpol P
    DTD 2:  1280x768    60.247 Hz   5:3    48.077 kHz  80.000 MHz (1600 mm x 900 mm)
                 Hfront   64 Hsync 128 Hback 192 Hpol N
                 Vfront    3 Vsync   7 Vback  20 Vpol P
  Display Range Limits:
    Monitor ranges (GTF): 57-63 Hz V, 30-49 kHz H, max dotclock 90 MHz
    Display Product Name: 'NS-19E310NA15'
Checksum: 0x47

----------------

Failures:

Block 0, Base EDID:
  Detailed Timing Descriptor #1: Mismatch of image size 1600x900 mm vs display size 410x230 mm.
  Detailed Timing Descriptor #2: Mismatch of image size 1600x900 mm vs display size 410x230 mm.
All Blocks:
  Some timings are out of range of the Monitor Ranges:
    Vertical Freq: 56.250 - 74.934 Hz (Monitor: 57.000 - 63.000 Hz)
    Horizontal Freq: 31.466 - 63.981 kHz (Monitor: 30.000 - 49.000 kHz)
    Maximum Clock: 108.000 MHz (Monitor: 90.000 MHz)

EDID conformity: FAIL
