edid-decode (hex):

00 ff ff ff ff ff ff 00 0d ae 71 13 00 00 00 00
0b 1a 01 04 95 1d 11 78 02 87 85 a4 57 50 9b 27
0d 50 54 00 00 00 01 01 01 01 01 01 01 01 01 01
01 01 01 01 01 01 b4 3b 80 4a 71 38 34 40 30 20
35 00 25 a5 10 00 00 18 b4 3b 80 4a 71 38 4f 41
30 20 35 00 25 a5 10 00 00 18 00 00 00 fe 00 43
4d 4e 0a 20 20 20 20 20 20 20 20 20 00 00 00 fe
00 4e 31 33 33 48 43 45 2d 47 41 31 0a 20 00 07

----------------

Block 0, Base EDID:
  EDID Structure Version & Revision: 1.4
  Vendor & Product Identification:
    Manufacturer: CMN
    Model: 4977
    Made in: week 11 of 2016
  Basic Display Parameters & Features:
    Digital display
    Bits per primary color channel: 6
    DisplayPort interface
    Maximum image size: 29 cm x 17 cm
    Gamma: 2.20
    Supported color formats: RGB 4:4:4
    First detailed timing includes the native pixel format and preferred refresh rate
  Color Characteristics:
    Red  : 0.6425, 0.3398
    Green: 0.3134, 0.6083
    Blue : 0.1542, 0.0507
    White: 0.3134, 0.3291
  Established Timings I & II: none
  Standard Timings: none
  Detailed Timing Descriptors:
    DTD 1:  1920x1080   60.008 Hz  16:9    67.929 kHz 152.840 MHz (293 mm x 165 mm)
                 Hfront   48 Hsync  32 Hback 250 Hpol N
                 Vfront    3 Vsync   5 Vback  44 Vpol N
    DTD 2:  1920x1080   48.006 Hz  16:9    67.929 kHz 152.840 MHz (293 mm x 165 mm)
                 Hfront   48 Hsync  32 Hback 250 Hpol N
                 Vfront    3 Vsync   5 Vback 327 Vpol N
    Alphanumeric Data String: 'CMN'
    Alphanumeric Data String: 'N133HCE-GA1'
Checksum: 0x07

----------------

Failures:

Block 0, Base EDID:
  Missing Display Product Name.

EDID conformity: FAIL
