edid-decode (hex):

00 ff ff ff ff ff ff 00 5e 74 34 2c 00 00 00 02
19 1b 01 04 a5 1d 13 78 0a ee 95 a3 54 4c 99 26
0f 50 54 00 00 00 01 01 01 01 01 01 01 01 01 01
01 01 01 01 01 01 54 56 d0 a0 80 e0 14 50 30 20
55 00 1d be 10 00 00 18 00 00 00 10 00 00 00 00
00 00 00 00 00 00 00 00 00 00 00 00 00 fe 00 57
53 54 0a 20 20 20 20 20 20 20 20 20 00 00 00 fc
00 4b 4c 2e 31 33 35 30 57 2e 30 30 33 0a 00 92

00 ff ff ff ff ff ff 00 5e 74 34 2c 00 00 00 02
19 1b 01 04 a5 1d 13 78 0a ee 95 a3 54 4c 99 26
0f 50 54 00 00 00 01 01 01 01 01 01 01 01 01 01
01 01 01 01 01 01 54 56 d0 a0 80 e0 14 50 30 20
55 00 1d be 10 00 00 18 00 00 00 10 00 00 00 00
00 00 00 00 00 00 00 00 00 00 00 00 00 fe 00 57
53 54 0a 20 20 20 20 20 20 20 20 20 00 00 00 fc
00 4b 4c 2e 31 33 35 30 57 2e 30 30 33 0a 00 92

----------------

Block 0, Base EDID:
  EDID Structure Version & Revision: 1.4
  Vendor & Product Identification:
    Manufacturer: WST
    Model: 11316
    Serial Number: ...
    Made in: week 25 of 2017
  Basic Display Parameters & Features:
    Digital display
    Bits per primary color channel: 8
    DisplayPort interface
    Maximum image size: 29 cm x 19 cm
    Gamma: 2.20
    Supported color formats: RGB 4:4:4, YCrCb 4:4:4
    First detailed timing includes the native pixel format and preferred refresh rate
  Color Characteristics:
    Red  : 0.6396, 0.3300
    Green: 0.2998, 0.5996
    Blue : 0.1503, 0.0595
    White: 0.3134, 0.3291
  Established Timings I & II: none
  Standard Timings: none
  Detailed Timing Descriptors:
    DTD 1:  2256x1504   60.021988 Hz   3:2     91.474 kHz    221.000000 MHz (285 mm x 190 mm)
                 Hfront   48 Hsync  32 Hback   80 Hpol N
                 Vfront    5 Vsync   5 Vback   10 Vpol N
    Dummy Descriptor:
    Alphanumeric Data String: 'WST'
    Display Product Name: 'KL.1350W.003'
Checksum: 0x92

----------------

Block 1, Unknown EDID Extension Block 0x00:
  00 ff ff ff ff ff ff 00 5e 74 34 2c 00 00 00 02 '........^t4,....'
  19 1b 01 04 a5 1d 13 78 0a ee 95 a3 54 4c 99 26 '.......x....TL.&'
  0f 50 54 00 00 00 01 01 01 01 01 01 01 01 01 01 '.PT.............'
  01 01 01 01 01 01 54 56 d0 a0 80 e0 14 50 30 20 '......TV.....P0 '
  55 00 1d be 10 00 00 18 00 00 00 10 00 00 00 00 'U...............'
  00 00 00 00 00 00 00 00 00 00 00 00 00 fe 00 57 '...............W'
  53 54 0a 20 20 20 20 20 20 20 20 20 00 00 00 fc 'ST.         ....'
  00 4b 4c 2e 31 33 35 30 57 2e 30 30 33 0a 00 92 '.KL.1350W.003...'
Checksum: 0x92

----------------

Failures:

Block 1, Base EDID:
  Unknown Extension Block.
EDID:
  Base EDID: EDID specified 0 extension block(s), but found 1 extension block(s).

EDID conformity: FAIL
