edid-decode (hex):

00 ff ff ff ff ff ff 00 06 af ed 11 00 00 00 00
00 17 01 04 95 22 13 78 02 e2 95 a3 54 52 99 26
0f 50 54 00 00 00 01 01 01 01 01 01 01 01 01 01
01 01 01 01 01 01 14 37 80 b8 70 38 24 40 10 10
3e 00 58 c1 10 00 00 1a 14 37 80 b8 70 38 24 40
10 10 3e 00 58 c1 10 00 00 1a 00 00 00 fe 00 35
31 52 43 59 80 42 31 35 36 48 41 4e 00 00 00 00
00 00 41 02 9e 00 10 00 00 0a 01 0a 20 20 00 84

----------------

Block 0, Base EDID:
  EDID Structure Version & Revision: 1.4
  Vendor & Product Identification:
    Manufacturer: AUO
    Model: 4589
    Made in: 2013
  Basic Display Parameters & Features:
    Digital display
    Bits per primary color channel: 6
    DisplayPort interface
    Maximum image size: 34 cm x 19 cm
    Gamma: 2.20
    Supported color formats: RGB 4:4:4
    First detailed timing includes the native pixel format and preferred refresh rate
  Color Characteristics:
    Red  : 0.6396, 0.3300
    Green: 0.3203, 0.5996
    Blue : 0.1503, 0.0595
    White: 0.3134, 0.3291
  Established Timings I & II: none
  Standard Timings: none
  Detailed Timing Descriptors:
    DTD 1:  1920x1080   60.049 Hz  16:9    67.015 kHz 141.000 MHz (344 mm x 193 mm)
                 Hfront   16 Hsync  16 Hback 152 Hpol P
                 Vfront    3 Vsync  14 Vback  19 Vpol N
    DTD 2:  1920x1080   60.049 Hz  16:9    67.015 kHz 141.000 MHz (344 mm x 193 mm)
                 Hfront   16 Hsync  16 Hback 152 Hpol P
                 Vfront    3 Vsync  14 Vback  19 Vpol N
    Alphanumeric Data String: '51RCY'
    Manufacturer-Specified Display Descriptor (0x00): 00 00 00 00 41 02 9e 00 10 00 00 0a 01 0a 20 20 '....A.........  '
Checksum: 0x84

----------------

Failures:

Block 0, Base EDID:
  Alphanumeric Data String: Non-printable character.
  Missing Display Product Name.

EDID conformity: FAIL
