edid-decode (hex):

00 ff ff ff ff ff ff 00 06 af ed 11 00 00 00 00
00 16 01 04 95 22 13 78 02 06 95 97 57 53 94 26
1c 50 54 00 00 00 01 01 01 01 01 01 01 01 01 01
01 01 01 01 01 01 14 37 80 b8 70 38 24 40 10 10
3e 00 58 c1 10 00 00 18 b8 24 80 b8 70 38 24 40
10 10 3e 00 58 c1 10 00 00 18 00 00 00 00 00 00
00 00 00 00 00 00 00 00 00 00 00 00 00 00 00 02
00 11 39 f9 0a 3c 96 11 1e 24 96 20 20 20 00 37

----------------

Block 0, Base EDID:
  EDID Structure Version & Revision: 1.4
  Vendor & Product Identification:
    Manufacturer: AUO
    Model: 4589
    Made in: 2012
  Basic Display Parameters & Features:
    Digital display
    Bits per primary color channel: 6
    DisplayPort interface
    Maximum image size: 34 cm x 19 cm
    Gamma: 2.20
    Supported color formats: RGB 4:4:4
    First detailed timing includes the native pixel format and preferred refresh rate
  Color Characteristics:
    Red  : 0.5898, 0.3398
    Green: 0.3251, 0.5800
    Blue : 0.1503, 0.1103
    White: 0.3134, 0.3291
  Established Timings I & II: none
  Standard Timings: none
  Detailed Timing Descriptors:
    DTD 1:  1920x1080   60.049471 Hz  16:9     67.015 kHz    141.000000 MHz (344 mm x 193 mm)
                 Hfront   16 Hsync  16 Hback  152 Hpol N
                 Vfront    3 Vsync  14 Vback   19 Vpol N
    DTD 2:  1920x1080   40.032980 Hz  16:9     44.677 kHz     94.000000 MHz (344 mm x 193 mm)
                 Hfront   16 Hsync  16 Hback  152 Hpol N
                 Vfront    3 Vsync  14 Vback   19 Vpol N
    Empty Descriptor
    Manufacturer-Specified Display Descriptor (0x02): 00 02 00 11 39 f9 0a 3c 96 11 1e 24 96 20 20 20 '....9..<...$.   '
Checksum: 0x37

----------------

Warnings:

Block 0, Base EDID:
  Missing Display Product Name.

Failures:

Block 0, Base EDID:
  Empty Descriptor: Use Dummy Descriptor instead of all zeroes.

EDID conformity: FAIL
