
EDID (hex):
00ffffffffffff0006afed1100000000
001801049522137802e295a354529926
0f505400000001010101010101010101
010101010101143780b8703824401010
3e0058c11000001a102c80b870382440
10103e0058c11000001a000000fe0052
39503630154231353648414e00000000
000041229e001000000a010a202000f0

Extracted contents:
header:          00 ff ff ff ff ff ff 00
serial number:   06 af ed 11 00 00 00 00 00 18
version:         01 04
basic params:    95 22 13 78 02
chroma info:     e2 95 a3 54 52 99 26 0f 50 54
established:     00 00 00
standard:        01 01 01 01 01 01 01 01 01 01 01 01 01 01 01 01
descriptor 1:    14 37 80 b8 70 38 24 40 10 10 3e 00 58 c1 10 00 00 1a
descriptor 2:    10 2c 80 b8 70 38 24 40 10 10 3e 00 58 c1 10 00 00 1a
descriptor 3:    00 00 00 fe 00 52 39 50 36 30 15 42 31 35 36 48 41 4e
descriptor 4:    00 00 00 00 00 00 41 22 9e 00 10 00 00 0a 01 0a 20 20
extensions:      00
checksum:        f0

EDID version: 1.4
Manufacturer: AUO Model 11ed Serial Number --
Made in year 2014
Digital display
6 bits per primary color channel
DisplayPort interface
Maximum image size: 34 cm x 19 cm
Gamma: 2.20
Supported color formats: RGB 4:4:4
First detailed timing includes the native pixel format and preferred refresh rate
Display x,y Chromaticity:
  Red:   0.6396, 0.3300
  Green: 0.3203, 0.5996
  Blue:  0.1503, 0.0595
  White: 0.3134, 0.3291
Established timings supported:
Standard timings supported:
Detailed mode: Clock 141.000 MHz, 344 mm x 193 mm
               1920 1936 1952 2104 hborder 0
               1080 1083 1097 1116 vborder 0
               +hsync -vsync 
               VertFreq: 60 Hz, HorFreq: 67015 Hz
Detailed mode: Clock 112.800 MHz, 344 mm x 193 mm
               1920 1936 1952 2104 hborder 0
               1080 1083 1097 1116 vborder 0
               +hsync -vsync 
               VertFreq: 48 Hz, HorFreq: 53612 Hz
ASCII string: R9P60
Manufacturer-specified data, tag 0
Checksum: 0xf0 (valid)
EDID block does NOT conform to EDID 1.4!
	Missing name descriptor
	Missing monitor ranges
	Detailed block string not properly terminated
