edid-decode (hex):

00 ff ff ff ff ff ff 00 30 64 06 37 31 35 39 32
25 11 01 03 80 1a 10 78 0a 87 ae 99 57 4f 8c 26
22 50 54 00 00 00 01 01 01 01 01 01 01 01 01 01
01 01 01 01 01 01 c2 1a 00 82 50 20 0a 30 10 30
22 00 05 a3 10 00 00 18 00 00 00 00 00 00 00 00
00 00 00 00 00 00 00 00 00 00 00 00 00 fe 00 54
4d 31 31 31 a1 31 32 31 45 57 33 44 00 00 00 fe
00 2a 39 45 50 70 90 b0 ff 01 01 0a 20 20 00 5d

----------------

Block 0, Base EDID:
  EDID Structure Version & Revision: 1.3
  Vendor & Product Identification:
    Manufacturer: LCD
    Model: 14086
    Serial Number: ...
    Made in: week 37 of 2007
  Basic Display Parameters & Features:
    Digital display
    Maximum image size: 26 cm x 16 cm
    Gamma: 2.20
    RGB color display
    First detailed timing is the preferred timing
  Color Characteristics:
    Red  : 0.5996, 0.3398
    Green: 0.3095, 0.5498
    Blue : 0.1503, 0.1347
    White: 0.3154, 0.3300
  Established Timings I & II: none
  Standard Timings: none
  Detailed Timing Descriptors:
    DTD 1:  1280x800    59.977 Hz   8:5    48.582 kHz  68.500 MHz (261 mm x 163 mm)
                 Hfront   16 Hsync  48 Hback  66 Hpol N
                 Vfront    2 Vsync   2 Vback   6 Vpol N
    Empty Descriptor
    Alphanumeric Data String: 'TM111'
    Alphanumeric Data String: '*9EPp'
Checksum: 0x5d

----------------

Failures:

Block 0, Base EDID:
  Empty Descriptor: Use Dummy Descriptor instead of all zeroes.
  Alphanumeric Data String: Non-printable character.
  Alphanumeric Data String: Non-printable character.
  Missing Display Product Name.
  Missing Display Range Limits Descriptor.

EDID conformity: FAIL
