
EDID (hex):
00ffffffffffff0030aed40b01010101
17160104a5331d783ae295a2554f9f26
115054adcf0031468180818c9500950f
b300d1c001011a3680a070381f403020
3500fd1e1100001a000000fd00324b1e
5115000a202020202020000000fc004c
454e204c54323332337a7743000000ff
00564e2d30313138330a2020202001ba
020316f14990040302011f1312112309
070783010000011d007251d01e206e28
5500fd1e1100001e8c0ad08a20e02d10
103e9600fd1e110000182b1680d02038
284028403a00fd1e1100001a9821c040
3138284040603a00fd1e1100001aec2c
00b05138284050883a00fd1e1100001c
0000000000000000000000000000008f

edid-decode (hex):

00 ff ff ff ff ff ff 00 30 ae d4 0b 01 01 01 01
17 16 01 04 a5 33 1d 78 3a e2 95 a2 55 4f 9f 26
11 50 54 ad cf 00 31 46 81 80 81 8c 95 00 95 0f
b3 00 d1 c0 01 01 1a 36 80 a0 70 38 1f 40 30 20
35 00 fd 1e 11 00 00 1a 00 00 00 fd 00 32 4b 1e
51 15 00 0a 20 20 20 20 20 20 00 00 00 fc 00 4c
45 4e 20 4c 54 32 33 32 33 7a 77 43 00 00 00 ff
00 56 4e 2d 30 31 31 38 33 0a 20 20 20 20 01 ba

02 03 16 f1 49 90 04 03 02 01 1f 13 12 11 23 09
07 07 83 01 00 00 01 1d 00 72 51 d0 1e 20 6e 28
55 00 fd 1e 11 00 00 1e 8c 0a d0 8a 20 e0 2d 10
10 3e 96 00 fd 1e 11 00 00 18 2b 16 80 d0 20 38
28 40 28 40 3a 00 fd 1e 11 00 00 1a 98 21 c0 40
31 38 28 40 40 60 3a 00 fd 1e 11 00 00 1a ec 2c
00 b0 51 38 28 40 50 88 3a 00 fd 1e 11 00 00 1c
00 00 00 00 00 00 00 00 00 00 00 00 00 00 00 8f

----------------

Block 0, Base EDID:
  EDID Structure Version & Revision: 1.4
  Vendor & Product Identification:
    Manufacturer: LEN
    Model: 3028
    Serial Number: 16843009
    Made in: week 23 of 2012
  Basic Display Parameters & Features:
    Digital display
    Bits per primary color channel: 8
    DisplayPort interface
    Maximum image size: 51 cm x 29 cm
    Gamma: 2.20
    DPMS levels: Off
    Supported color formats: RGB 4:4:4, YCrCb 4:4:4, YCrCb 4:2:2
    First detailed timing includes the native pixel format and preferred refresh rate
  Color Characteristics:
    Red  : 0.6357, 0.3339
    Green: 0.3085, 0.6230
    Blue : 0.1503, 0.0673
    White: 0.3134, 0.3291
  Established Timings I & II:
    IBM     :   720x400    70.081663 Hz   9:5     31.467 kHz     28.320000 MHz
    DMT 0x04:   640x480    59.940476 Hz   4:3     31.469 kHz     25.175000 MHz
    DMT 0x05:   640x480    72.808802 Hz   4:3     37.861 kHz     31.500000 MHz
    DMT 0x06:   640x480    75.000000 Hz   4:3     37.500 kHz     31.500000 MHz
    DMT 0x09:   800x600    60.316541 Hz   4:3     37.879 kHz     40.000000 MHz
    DMT 0x0a:   800x600    72.187572 Hz   4:3     48.077 kHz     50.000000 MHz
    DMT 0x0b:   800x600    75.000000 Hz   4:3     46.875 kHz     49.500000 MHz
    DMT 0x10:  1024x768    60.003840 Hz   4:3     48.363 kHz     65.000000 MHz
    DMT 0x11:  1024x768    70.069359 Hz   4:3     56.476 kHz     75.000000 MHz
    DMT 0x12:  1024x768    75.028582 Hz   4:3     60.023 kHz     78.750000 MHz
    DMT 0x24:  1280x1024   75.024675 Hz   5:4     79.976 kHz    135.000000 MHz
  Standard Timings:
    GTF     :   640x480    65.999646 Hz   4:3     32.934 kHz     26.874000 MHz
    DMT 0x23:  1280x1024   60.019740 Hz   5:4     63.981 kHz    108.000000 MHz
    GTF     :  1280x1024   72.000069 Hz   5:4     76.824 kHz    132.752000 MHz
    DMT 0x2f:  1440x900    59.887445 Hz  16:10    55.935 kHz    106.500000 MHz
    DMT 0x30:  1440x900    74.984427 Hz  16:10    70.635 kHz    136.750000 MHz
    DMT 0x3a:  1680x1050   59.954250 Hz  16:10    65.290 kHz    146.250000 MHz
    DMT 0x52:  1920x1080   60.000000 Hz  16:9     67.500 kHz    148.500000 MHz
  Detailed Timing Descriptors:
    DTD 1:  1920x1080   59.933878 Hz  16:9     66.587 kHz    138.500000 MHz (509 mm x 286 mm)
                 Hfront   48 Hsync  32 Hback   80 Hpol P
                 Vfront    3 Vsync   5 Vback   23 Vpol N
    Display Range Limits:
      Monitor ranges (GTF): 50-75 Hz V, 30-81 kHz H, max dotclock 210 MHz
    Display Product Name: 'LEN LT2323zwC'
    Display Product Serial Number: 'VN-01183'
  Extension blocks: 1
Checksum: 0xba

----------------

Block 1, CTA-861 Extension Block:
  Revision: 3
  Underscans IT Video Formats by default
  Basic audio support
  Supports YCbCr 4:4:4
  Supports YCbCr 4:2:2
  Native detailed modes: 1
  Video Data Block:
    VIC  16:  1920x1080   60.000000 Hz  16:9     67.500 kHz    148.500000 MHz (native)
    VIC   4:  1280x720    60.000000 Hz  16:9     45.000 kHz     74.250000 MHz
    VIC   3:   720x480    59.940060 Hz  16:9     31.469 kHz     27.000000 MHz
    VIC   2:   720x480    59.940060 Hz   4:3     31.469 kHz     27.000000 MHz
    VIC   1:   640x480    59.940476 Hz   4:3     31.469 kHz     25.175000 MHz
    VIC  31:  1920x1080   50.000000 Hz  16:9     56.250 kHz    148.500000 MHz
    VIC  19:  1280x720    50.000000 Hz  16:9     37.500 kHz     74.250000 MHz
    VIC  18:   720x576    50.000000 Hz  16:9     31.250 kHz     27.000000 MHz
    VIC  17:   720x576    50.000000 Hz   4:3     31.250 kHz     27.000000 MHz
  Audio Data Block:
    Linear PCM:
      Max channels: 2
      Supported sample rates (kHz): 48 44.1 32
      Supported sample sizes (bits): 24 20 16
  Speaker Allocation Data Block:
    FL/FR - Front Left/Right
  Detailed Timing Descriptors:
    DTD 2:  1280x720    60.000000 Hz  16:9     45.000 kHz     74.250000 MHz (509 mm x 286 mm)
                 Hfront  110 Hsync  40 Hback  220 Hpol P
                 Vfront    5 Vsync   5 Vback   20 Vpol P
    DTD 3:   720x480    59.940060 Hz   3:2     31.469 kHz     27.000000 MHz (509 mm x 286 mm)
                 Hfront   16 Hsync  62 Hback   60 Hpol N
                 Vfront    9 Vsync   6 Vback   30 Vpol N
    DTD 4:   640x1080   59.751937 Hz  16:27    66.922 kHz     56.750000 MHz (509 mm x 286 mm)
                 Hfront   40 Hsync  64 Hback  104 Hpol P
                 Vfront    3 Vsync  10 Vback   27 Vpol N
    DTD 5:   960x1080   59.988839 Hz   8:9     67.188 kHz     86.000000 MHz (509 mm x 286 mm)
                 Hfront   64 Hsync  96 Hback  160 Hpol P
                 Vfront    3 Vsync  10 Vback   27 Vpol N
    DTD 6:  1280x1080   59.975801 Hz  32:27    67.173 kHz    115.000000 MHz (509 mm x 286 mm)
                 Hfront   80 Hsync 136 Hback  216 Hpol N
                 Vfront    3 Vsync  10 Vback   27 Vpol P
Checksum: 0x8f  Unused space in Extension Block: 15 bytes


