
EDID (hex):
00ffffffffffff0015c3761901010101
2a130104a5301e78e2ee95a3544c9926
0f5054afcf0081808140714f01010101
01010101010121399030621a274068b0
3600da291100001c000000ff00363831
33343130390a20202020000000fd0037
4c1f520f000a202020202020000000fc
005332323032570a2020202020200026

Extracted contents:
header:          00 ff ff ff ff ff ff 00
serial number:   15 c3 76 19 01 01 01 01 2a 13
version:         01 04
basic params:    a5 30 1e 78 e2
chroma info:     ee 95 a3 54 4c 99 26 0f 50 54
established:     af cf 00
standard:        81 80 81 40 71 4f 01 01 01 01 01 01 01 01 01 01
descriptor 1:    21 39 90 30 62 1a 27 40 68 b0 36 00 da 29 11 00 00 1c
descriptor 2:    00 00 00 ff 00 36 38 31 33 34 31 30 39 0a 20 20 20 20
descriptor 3:    00 00 00 fd 00 37 4c 1f 52 0f 00 0a 20 20 20 20 20 20
descriptor 4:    00 00 00 fc 00 53 32 32 30 32 57 0a 20 20 20 20 20 20
extensions:      00
checksum:        26

EDID version: 1.4
Manufacturer: ENC Model 1976 Serial Number --
Made in week 42 of 2009
Digital display
8 bits per primary color channel
DisplayPort interface
Maximum image size: 48 cm x 30 cm
Gamma: 2.20
DPMS levels: Standby Suspend Off
Supported color formats: RGB 4:4:4
First detailed timing includes the native pixel format and preferred refresh rate
Display x,y Chromaticity:
  Red:   0.6396, 0.3300
  Green: 0.2998, 0.5996
  Blue:  0.1503, 0.0595
  White: 0.3134, 0.3291
Established timings supported:
  720x400@70Hz 9:5 HorFreq: 31469 Hz Clock: 28.320 MHz
  640x480@60Hz 4:3 HorFreq: 31469 Hz Clock: 25.175 MHz
  640x480@72Hz 4:3 HorFreq: 37900 Hz Clock: 31.500 MHz
  640x480@75Hz 4:3 HorFreq: 37500 Hz Clock: 31.500 MHz
  800x600@56Hz 4:3 HorFreq: 35200 Hz Clock: 36.000 MHz
  800x600@60Hz 4:3 HorFreq: 37900 Hz Clock: 40.000 MHz
  800x600@72Hz 4:3 HorFreq: 48100 Hz Clock: 50.000 MHz
  800x600@75Hz 4:3 HorFreq: 46900 Hz Clock: 49.500 MHz
  1024x768@60Hz 4:3 HorFreq: 48400 Hz Clock: 65.000 MHz
  1024x768@70Hz 4:3 HorFreq: 56500 Hz Clock: 75.000 MHz
  1024x768@75Hz 4:3 HorFreq: 60000 Hz Clock: 78.750 MHz
  1280x1024@75Hz 5:4 HorFreq: 80000 Hz Clock: 135.000 MHz
Standard timings supported:
  1280x1024@60Hz 5:4 HorFreq: 64000 Hz Clock: 108.000 MHz
  1280x960@60Hz 4:3 HorFreq: 60000 Hz Clock: 108.000 MHz
  1152x864@75Hz 4:3 HorFreq: 67500 Hz Clock: 108.000 MHz
Detailed mode: Clock 146.250 MHz, 474 mm x 297 mm
               1680 1784 1960 2240 hborder 0
               1050 1053 1059 1089 vborder 0
               -hsync +vsync 
               VertFreq: 59 Hz, HorFreq: 65290 Hz
Serial number: --
Monitor ranges (GTF): 55-76Hz V, 31-82kHz H, max dotclock 150MHz
Monitor name: S2202W
Checksum: 0x26 (valid)
