
EDID (hex):
00ffffffffffff0009e5970900000000
1c1e0104a5221678078235a5534a9e26
0f505400000001010101010101010101
0101010101011dd800a0a0405f603020
360059d71000001a000000fd003078cb
cb37010a20202020201a000000fe0042
4f452043510a202020202020000000fe
004e4531363051444d2d4e59320a00a6

Extracted contents:
header:          00 ff ff ff ff ff ff 00
serial number:   09 e5 97 09 00 00 00 00 1c 1e
version:         01 04
basic params:    a5 22 16 78 07
chroma info:     82 35 a5 53 4a 9e 26 0f 50 54
established:     00 00 00
standard:        01 01 01 01 01 01 01 01 01 01 01 01 01 01 01 01
descriptor 1:    1d d8 00 a0 a0 40 5f 60 30 20 36 00 59 d7 10 00 00 1a
descriptor 2:    00 00 00 fd 00 30 78 cb cb 37 01 0a 20 20 20 20 20 1a
descriptor 3:    00 00 00 fe 00 42 4f 45 20 43 51 0a 20 20 20 20 20 20
descriptor 4:    00 00 00 fe 00 4e 45 31 36 30 51 44 4d 2d 4e 59 32 0a
extensions:      00
checksum:        a6

EDID version: 1.4
Manufacturer: BOE Model 997 Serial Number --
Made in week 28 of 2020
Digital display
8 bits per primary color channel
DisplayPort interface
Maximum image size: 34 cm x 22 cm
Gamma: 2.20
Supported color formats: RGB 4:4:4
Default (sRGB) color space is primary color space
First detailed timing includes the native pixel format and preferred refresh rate
Display is continuous frequency
Display x,y Chromaticity:
  Red:   0.6464, 0.3242
  Green: 0.2890, 0.6191
  Blue:  0.1484, 0.0615
  White: 0.3134, 0.3291
Established timings supported:
Standard timings supported:
Detailed mode: Clock 553.250 MHz, 345 mm x 215 mm
               2560 2608 2640 2720 hborder 0
               1600 1603 1609 1695 vborder 0
               +hsync -vsync 
               VertFreq: 120 Hz, HorFreq: 203400 Hz
Monitor ranges (bare limits): 48-120Hz V, 203-203kHz H, max dotclock 550MHz
ASCII string: BOE CQ
ASCII string: NE160QDM-NY2
Checksum: 0xa6 (valid)
EDID block does NOT conform to EDID 1.4!
	sRGB is signaled, but the chromaticities do not match
	Missing name descriptor
Warning: One or more of the timings is out of range of the Monitor Ranges:
  Vertical Freq: 120 - 120 Hz
  Horizontal Freq: 203400 - 203400 Hz
  Maximum Clock: 553.250 MHz
