edid-decode (hex):

00 ff ff ff ff ff ff 00 04 69 d5 19 51 1f 03 00
16 12 01 03 08 29 1a 78 ea 85 85 a6 57 4a 9c 26
12 50 54 bf ef 80 71 4f 81 00 81 0f 81 40 81 80
95 00 95 0f 01 01 9a 29 a0 d0 51 84 22 30 50 98
36 00 98 ff 10 00 00 1c 00 00 00 fd 00 37 4b 1e
53 0f 00 0a 20 20 20 20 20 20 00 00 00 fc 00 41
53 55 53 20 56 57 31 39 33 44 0a 20 00 00 00 ff
00 38 35 4c 4d 54 46 32 30 34 36 32 35 0a 00 aa

00 ff ff ff ff ff ff 00 04 69 d5 19 51 1f 03 00
16 12 01 03 08 29 1a 78 ea 85 85 a6 57 4a 9c 26
12 50 54 bf ef 80 71 4f 81 00 81 0f 81 40 81 80
95 00 95 0f 01 01 9a 29 a0 d0 51 84 22 30 50 98
36 00 98 ff 10 00 00 1c 00 00 00 fd 00 37 4b 1e
53 0f 00 0a 20 20 20 20 20 20 00 00 00 fc 00 41
53 55 53 20 56 57 31 39 33 44 0a 20 00 00 00 ff
00 38 35 4c 4d 54 46 32 30 34 36 32 35 0a 00 aa

----------------

Block 0, Base EDID:
  EDID Structure Version & Revision: 1.3
  Vendor & Product Identification:
    Manufacturer: ACI
    Model: 6613
    Serial Number: ...
    Made in: week 22 of 2008
  Basic Display Parameters & Features:
    Analog display
    Signal Level Standard: 0.700 : 0.300 : 1.000 V p-p
    Blank level equals black level
    Sync: Separate
    Maximum image size: 41 cm x 26 cm
    Gamma: 2.20
    DPMS levels: Standby Suspend Off
    RGB color display
    First detailed timing is the preferred timing
  Color Characteristics:
    Red  : 0.6503, 0.3398
    Green: 0.2900, 0.6103
    Blue : 0.1503, 0.0703
    White: 0.3134, 0.3291
  Established Timings I & II:
    IBM     :   720x400    70.081663 Hz   9:5     31.467 kHz     28.320000 MHz
    DMT 0x04:   640x480    59.940476 Hz   4:3     31.469 kHz     25.175000 MHz
    Apple   :   640x480    66.666667 Hz   4:3     35.000 kHz     30.240000 MHz
    DMT 0x05:   640x480    72.808802 Hz   4:3     37.861 kHz     31.500000 MHz
    DMT 0x06:   640x480    75.000000 Hz   4:3     37.500 kHz     31.500000 MHz
    DMT 0x08:   800x600    56.250000 Hz   4:3     35.156 kHz     36.000000 MHz
    DMT 0x09:   800x600    60.316541 Hz   4:3     37.879 kHz     40.000000 MHz
    DMT 0x0a:   800x600    72.187572 Hz   4:3     48.077 kHz     50.000000 MHz
    DMT 0x0b:   800x600    75.000000 Hz   4:3     46.875 kHz     49.500000 MHz
    Apple   :   832x624    74.551266 Hz   4:3     49.726 kHz     57.284000 MHz
    DMT 0x10:  1024x768    60.003840 Hz   4:3     48.363 kHz     65.000000 MHz
    DMT 0x11:  1024x768    70.069359 Hz   4:3     56.476 kHz     75.000000 MHz
    DMT 0x12:  1024x768    75.028582 Hz   4:3     60.023 kHz     78.750000 MHz
    DMT 0x24:  1280x1024   75.024675 Hz   5:4     79.976 kHz    135.000000 MHz
    Apple   :  1152x870    75.061550 Hz 192:145   68.681 kHz    100.000000 MHz
  Standard Timings:
    DMT 0x15:  1152x864    75.000000 Hz   4:3     67.500 kHz    108.000000 MHz
    DMT 0x1c:  1280x800    59.810326 Hz  16:10    49.702 kHz     83.500000 MHz
    DMT 0x1d:  1280x800    74.934142 Hz  16:10    62.795 kHz    106.500000 MHz
    DMT 0x20:  1280x960    60.000000 Hz   4:3     60.000 kHz    108.000000 MHz
    DMT 0x23:  1280x1024   60.019740 Hz   5:4     63.981 kHz    108.000000 MHz
    DMT 0x2f:  1440x900    59.887445 Hz  16:10    55.935 kHz    106.500000 MHz
    DMT 0x30:  1440x900    74.984427 Hz  16:10    70.635 kHz    136.750000 MHz
  Detailed Timing Descriptors:
    DTD 1:  1440x900    59.887445 Hz  16:10    55.935 kHz    106.500000 MHz (408 mm x 255 mm)
                 Hfront   80 Hsync 152 Hback  232 Hpol N
                 Vfront    3 Vsync   6 Vback   25 Vpol P
    Display Range Limits:
      Monitor ranges (GTF): 55-75 Hz V, 30-83 kHz H, max dotclock 150 MHz
    Display Product Name: 'ASUS VW193D'
    Display Product Serial Number: ...
Checksum: 0xaa

----------------

Block 1, Unknown EDID Extension Block 0x00:
  00 ff ff ff ff ff ff 00 04 69 d5 19 51 1f 03 00 '.........i..Q...'
  16 12 01 03 08 29 1a 78 ea 85 85 a6 57 4a 9c 26 '.....).x....WJ.&'
  12 50 54 bf ef 80 71 4f 81 00 81 0f 81 40 81 80 '.PT...qO.....@..'
  95 00 95 0f 01 01 9a 29 a0 d0 51 84 22 30 50 98 '.......)..Q."0P.'
  36 00 98 ff 10 00 00 1c 00 00 00 fd 00 37 4b 1e '6............7K.'
  53 0f 00 0a 20 20 20 20 20 20 00 00 00 fc 00 41 'S...      .....A'
  53 55 53 20 56 57 31 39 33 44 0a 20 00 00 00 ff 'SUS VW193D. ....'
  00 38 35 4c 4d 54 46 32 30 34 36 32 35 0a 00 aa '.85LMTF204625...'
Checksum: 0xaa

----------------

Failures:

Block 1, Base EDID:
  Unknown Extension Block.
EDID:
  Base EDID: EDID specified 0 extension block(s), but found 1 extension block(s).

EDID conformity: FAIL
