
EDID (hex):
00ffffffffffff0009e5020800000000
011c0104952213780a24109759548e27
1e505400000001010101010101010101
0101010101019c3b8010713850403020
360058c11000001a2e2c80de70381440
6464440558c11000001a000000fe004d
39503734804e5431354e343100000000
0000412196001000000a010a20200059

Extracted contents:
header:          00 ff ff ff ff ff ff 00
serial number:   09 e5 02 08 00 00 00 00 01 1c
version:         01 04
basic params:    95 22 13 78 0a
chroma info:     24 10 97 59 54 8e 27 1e 50 54
established:     00 00 00
standard:        01 01 01 01 01 01 01 01 01 01 01 01 01 01 01 01
descriptor 1:    9c 3b 80 10 71 38 50 40 30 20 36 00 58 c1 10 00 00 1a
descriptor 2:    2e 2c 80 de 70 38 14 40 64 64 44 05 58 c1 10 00 00 1a
descriptor 3:    00 00 00 fe 00 4d 39 50 37 34 80 4e 54 31 35 4e 34 31
descriptor 4:    00 00 00 00 00 00 41 21 96 00 10 00 00 0a 01 0a 20 20
extensions:      00
checksum:        59

EDID version: 1.4
Manufacturer: BOE Model 802 Serial Number --
Made in week 1 of 2018
Digital display
6 bits per primary color channel
DisplayPort interface
Maximum image size: 34 cm x 19 cm
Gamma: 2.20
Supported color formats: RGB 4:4:4, YCrCb 4:4:4
First detailed timing includes the native pixel format and preferred refresh rate
Display x,y Chromaticity:
  Red:   0.5898, 0.3496
  Green: 0.3291, 0.5546
  Blue:  0.1523, 0.1181
  White: 0.3125, 0.3281
Established timings supported:
Standard timings supported:
Detailed mode: Clock 152.600 MHz, 344 mm x 193 mm
               1920 1968 2000 2192 hborder 0
               1080 1083 1089 1160 vborder 0
               +hsync -vsync 
               VertFreq: 60 Hz, HorFreq: 69616 Hz
Detailed mode: Clock 113.100 MHz, 344 mm x 193 mm
               1920 2020 2120 2142 hborder 0
               1080 1100 1120 1100 vborder 0
               +hsync -vsync 
               VertFreq: 48 Hz, HorFreq: 52801 Hz
ASCII string: M9P74
Manufacturer-specified data, tag 0
Checksum: 0x59 (valid)
EDID block does NOT conform to EDID 1.4!
	Missing name descriptor
	Missing monitor ranges
	Detailed block string not properly terminated
