
EDID (hex):
00ffffffffffff000472afadfd031082
15120103803420780e4995a95437ad25
135054bfcf009500950f8100810f81c0
8180a9400101283c80a070b023403020
360006442100001a000000fd00384b1e
5e11000a202020202020000000fc0041
6365722050323433570a2020000000ff
004c41463034303036373232310a00d1

Extracted contents:
header:          00 ff ff ff ff ff ff 00
serial number:   04 72 af ad fd 03 10 82 15 12
version:         01 03
basic params:    80 34 20 78 0e
chroma info:     49 95 a9 54 37 ad 25 13 50 54
established:     bf cf 00
standard:        95 00 95 0f 81 00 81 0f 81 c0 81 80 a9 40 01 01
descriptor 1:    28 3c 80 a0 70 b0 23 40 30 20 36 00 06 44 21 00 00 1a
descriptor 2:    00 00 00 fd 00 38 4b 1e 5e 11 00 0a 20 20 20 20 20 20
descriptor 3:    00 00 00 fc 00 41 63 65 72 20 50 32 34 33 57 0a 20 20
descriptor 4:    00 00 00 ff 00 4c 41 46 30 34 30 30 36 37 32 32 31 0a
extensions:      00
checksum:        d1

EDID version: 1.3
Manufacturer: ACR Model adaf Serial Number --
Made in week 21 of 2008
Digital display
Maximum image size: 52 cm x 32 cm
Gamma: 2.20
RGB color display
Default (sRGB) color space is primary color space
First detailed timing is preferred timing
Display x,y Chromaticity:
  Red:   0.6611, 0.3281
  Green: 0.2167, 0.6767
  Blue:  0.1464, 0.0751
  White: 0.3134, 0.3291
Established timings supported:
  720x400@70Hz 9:5 HorFreq: 31469 Hz Clock: 28.320 MHz
  640x480@60Hz 4:3 HorFreq: 31469 Hz Clock: 25.175 MHz
  640x480@67Hz 4:3 HorFreq: 35000 Hz Clock: 30.240 MHz
  640x480@72Hz 4:3 HorFreq: 37900 Hz Clock: 31.500 MHz
  640x480@75Hz 4:3 HorFreq: 37500 Hz Clock: 31.500 MHz
  800x600@56Hz 4:3 HorFreq: 35200 Hz Clock: 36.000 MHz
  800x600@60Hz 4:3 HorFreq: 37900 Hz Clock: 40.000 MHz
  800x600@72Hz 4:3 HorFreq: 48100 Hz Clock: 50.000 MHz
  800x600@75Hz 4:3 HorFreq: 46900 Hz Clock: 49.500 MHz
  1024x768@60Hz 4:3 HorFreq: 48400 Hz Clock: 65.000 MHz
  1024x768@70Hz 4:3 HorFreq: 56500 Hz Clock: 75.000 MHz
  1024x768@75Hz 4:3 HorFreq: 60000 Hz Clock: 78.750 MHz
  1280x1024@75Hz 5:4 HorFreq: 80000 Hz Clock: 135.000 MHz
Standard timings supported:
  1440x900@60Hz 16:10 HorFreq: 55500 Hz Clock: 88.750 MHz
  1440x900@75Hz 16:10 HorFreq: 82300 Hz Clock: 156.000 MHz
  1280x800@60Hz 16:10
  1280x800@75Hz 16:10
  1280x720@60Hz 16:9
  1280x1024@60Hz 5:4 HorFreq: 64000 Hz Clock: 108.000 MHz
  1600x1200@60Hz 4:3 HorFreq: 75000 Hz Clock: 162.000 MHz
Detailed mode: Clock 154.000 MHz, 518 mm x 324 mm
               1920 1968 2000 2080 hborder 0
               1200 1203 1209 1235 vborder 0
               +hsync -vsync 
               VertFreq: 59 Hz, HorFreq: 74038 Hz
Monitor ranges (GTF): 56-75Hz V, 30-94kHz H, max dotclock 170MHz
Monitor name: Acer P243W
Serial number: --
Checksum: 0xd1 (valid)
EDID block does NOT conform to EDID 1.3!
	sRGB is signaled, but the chromaticities do not match
