edid-decode (hex):

00 ff ff ff ff ff ff 00 22 70 1c 00 b0 04 00 00
04 13 01 03 80 3b 25 78 2a af f6 a6 54 4c 9e 23
10 4f 54 21 08 00 81 80 95 00 a9 40 b3 00 d1 00
01 01 01 01 01 01 28 3c 80 a0 70 b0 23 40 30 20
36 00 51 5e 21 00 00 1a 00 00 00 ff 00 31 32 30
30 0a 20 20 20 20 20 20 20 20 00 00 00 fd 00 32
3d 0e 4b 10 00 0a 20 20 20 20 20 20 00 00 00 fc
00 54 32 38 31 48 0a 20 20 20 20 20 20 20 01 76

02 03 22 70 23 09 07 07 83 01 00 00 65 03 0c 00
10 00 4f 10 1f 05 14 04 13 12 11 16 15 03 02 01
07 06 02 3a 80 d0 72 38 2d 40 10 2c 45 80 51 5e
21 00 00 1e 02 3a 80 18 71 38 2d 40 58 2c 45 00
51 5e 21 00 00 1e 01 1d 00 bc 52 d0 1e 20 b8 28
55 40 51 5e 21 00 00 1e 01 1d 00 72 51 d0 1e 20
6e 28 55 00 51 5e 21 00 00 1e 8c 0a d0 90 20 40
31 20 0c 40 55 00 51 5e 21 00 00 1e 00 00 00 4a

----------------

Block 0, Base EDID:
  EDID Structure Version & Revision: 1.3
  Vendor & Product Identification:
    Manufacturer: HSP
    Model: 28
    Serial Number: ...
    Made in: week 4 of 2009
  Basic Display Parameters & Features:
    Digital display
    Maximum image size: 59 cm x 37 cm
    Gamma: 2.20
    DPMS levels: Off
    RGB color display
    First detailed timing is the preferred timing
  Color Characteristics:
    Red  : 0.6503, 0.3300
    Green: 0.2998, 0.6201
    Blue : 0.1396, 0.0654
    White: 0.3095, 0.3300
  Established Timings I & II:
    DMT 0x04:   640x480    59.940 Hz   4:3    31.469 kHz  25.175 MHz
    DMT 0x09:   800x600    60.317 Hz   4:3    37.879 kHz  40.000 MHz
    DMT 0x10:  1024x768    60.004 Hz   4:3    48.363 kHz  65.000 MHz
  Standard Timings:
    DMT 0x23:  1280x1024   60.020 Hz   5:4    63.981 kHz 108.000 MHz
    DMT 0x2f:  1440x900    59.887 Hz  16:10   55.935 kHz 106.500 MHz
    DMT 0x33:  1600x1200   60.000 Hz   4:3    75.000 kHz 162.000 MHz
    DMT 0x3a:  1680x1050   59.954 Hz  16:10   65.290 kHz 146.250 MHz
    DMT 0x45:  1920x1200   59.885 Hz  16:10   74.556 kHz 193.250 MHz
  Detailed Timing Descriptors:
    DTD 1:  1920x1200   59.950 Hz   8:5    74.038 kHz 154.000 MHz (593 mm x 350 mm)
                 Hfront   48 Hsync  32 Hback  80 Hpol P
                 Vfront    3 Vsync   6 Vback  26 Vpol N
    Display Product Serial Number: ...
  Display Range Limits:
    Monitor ranges (GTF): 50-61 Hz V, 14-75 kHz H, max dotclock 160 MHz
    Display Product Name: 'T281H'
  Extension blocks: 1
Checksum: 0x76

----------------

Block 1, CTA-861 Extension Block:
  Revision: 3
  Basic audio support
  Supports YCbCr 4:4:4
  Supports YCbCr 4:2:2
  Native detailed modes: 0
  Audio Data Block:
    Linear PCM:
      Max channels: 2
      Supported sample rates (kHz): 48 44.1 32
      Supported sample sizes (bits): 24 20 16
  Speaker Allocation Data Block:
    FL/FR - Front Left/Right
  Vendor-Specific Data Block (HDMI), OUI 00-0C-03:
    Source physical address: 1.0.0.0
  Video Data Block:
    VIC  16:  1920x1080   60.000 Hz  16:9    67.500 kHz 148.500 MHz
    VIC  31:  1920x1080   50.000 Hz  16:9    56.250 kHz 148.500 MHz
    VIC   5:  1920x1080i  60.000 Hz  16:9    33.750 kHz  74.250 MHz
    VIC  20:  1920x1080i  50.000 Hz  16:9    28.125 kHz  74.250 MHz
    VIC   4:  1280x720    60.000 Hz  16:9    45.000 kHz  74.250 MHz
    VIC  19:  1280x720    50.000 Hz  16:9    37.500 kHz  74.250 MHz
    VIC  18:   720x576    50.000 Hz  16:9    31.250 kHz  27.000 MHz
    VIC  17:   720x576    50.000 Hz   4:3    31.250 kHz  27.000 MHz
    VIC  22:  1440x576i   50.000 Hz  16:9    15.625 kHz  27.000 MHz
    VIC  21:  1440x576i   50.000 Hz   4:3    15.625 kHz  27.000 MHz
    VIC   3:   720x480    59.940 Hz  16:9    31.469 kHz  27.000 MHz
    VIC   2:   720x480    59.940 Hz   4:3    31.469 kHz  27.000 MHz
    VIC   1:   640x480    59.940 Hz   4:3    31.469 kHz  25.175 MHz
    VIC   7:  1440x480i   59.940 Hz  16:9    15.734 kHz  27.000 MHz
    VIC   6:  1440x480i   59.940 Hz   4:3    15.734 kHz  27.000 MHz
  Detailed Timing Descriptors:
    DTD 2:  1920x1080   50.000 Hz  16:9    56.250 kHz 148.500 MHz (593 mm x 350 mm)
                 Hfront  528 Hsync  44 Hback 148 Hpol P
                 Vfront    4 Vsync   5 Vback  36 Vpol P
    DTD 3:  1920x1080   60.000 Hz  16:9    67.500 kHz 148.500 MHz (593 mm x 350 mm)
                 Hfront   88 Hsync  44 Hback 148 Hpol P
                 Vfront    4 Vsync   5 Vback  36 Vpol P
    DTD 4:  1280x720    50.000 Hz  16:9    37.500 kHz  74.250 MHz (593 mm x 350 mm)
                 Hfront  440 Hsync  40 Hback 220 Hpol P
                 Vfront    5 Vsync   5 Vback  20 Vpol P
    DTD 5:  1280x720    60.000 Hz  16:9    45.000 kHz  74.250 MHz (593 mm x 350 mm)
                 Hfront  110 Hsync  40 Hback 220 Hpol P
                 Vfront    5 Vsync   5 Vback  20 Vpol P
    DTD 6:   720x576    50.000 Hz   5:4    31.250 kHz  27.000 MHz (593 mm x 350 mm)
                 Hfront   12 Hsync  64 Hback  68 Hpol P
                 Vfront    5 Vsync   5 Vback  39 Vpol P
Checksum: 0x4a

----------------

Warnings:

Block 1, CTA-861 Extension Block:
  IT Video Formats are overscanned by default, but normally this should be underscanned.
  Video Data Block: VIC 16 is the preferred timing, overriding the first detailed timings. Is this intended?
  Display Product Serial Number is set, so the Serial Number in the Base EDID should be 0.
  Missing VCDB, needed for Set Selectable RGB Quantization to avoid interop issues.

Failures:

EDID:
  Base EDID: Some timings are out of range of the Monitor Ranges:
    Maximum Clock: 193.250 MHz (Monitor: 160.000 MHz)

EDID conformity: FAIL
