edid-decode (hex):

00 ff ff ff ff ff ff 00 22 70 1c 00 0f 00 00 00
13 14 01 03 80 3b 25 78 2a af f5 a6 54 4c 9e 23
10 50 54 21 08 00 81 80 95 00 b3 00 d1 00 01 01
01 01 01 01 01 01 28 3c 80 a0 70 b0 23 40 30 20
36 00 51 72 21 00 00 1a 00 00 00 ff 00 30 31 39
46 4e 32 36 59 30 30 30 31 35 00 00 00 fc 00 48
53 47 31 30 37 35 0a 20 20 20 20 20 00 00 00 fd
00 3b 3d 1f 50 11 00 0a 20 20 20 20 20 20 01 6e

----------------

Block 0, Base EDID:
  EDID Structure Version & Revision: 1.3
  Vendor & Product Identification:
    Manufacturer: HSP
    Model: 28
    Serial Number: ...
    Made in: week 19 of 2010
  Basic Display Parameters & Features:
    Digital display
    Maximum image size: 59 cm x 37 cm
    Gamma: 2.20
    DPMS levels: Off
    RGB color display
    First detailed timing is the preferred timing
  Color Characteristics:
    Red  : 0.6503, 0.3300
    Green: 0.2998, 0.6201
    Blue : 0.1396, 0.0654
    White: 0.3134, 0.3291
  Established Timings I & II:
    DMT 0x04:   640x480    59.940476 Hz   4:3     31.469 kHz     25.175000 MHz
    DMT 0x09:   800x600    60.316541 Hz   4:3     37.879 kHz     40.000000 MHz
    DMT 0x10:  1024x768    60.003840 Hz   4:3     48.363 kHz     65.000000 MHz
  Standard Timings:
    DMT 0x23:  1280x1024   60.019740 Hz   5:4     63.981 kHz    108.000000 MHz
    DMT 0x2f:  1440x900    59.887445 Hz  16:10    55.935 kHz    106.500000 MHz
    DMT 0x3a:  1680x1050   59.954250 Hz  16:10    65.290 kHz    146.250000 MHz
    DMT 0x45:  1920x1200   59.884600 Hz  16:10    74.556 kHz    193.250000 MHz
  Detailed Timing Descriptors:
    DTD 1:  1920x1200   59.950171 Hz   8:5     74.038 kHz    154.000000 MHz (593 mm x 370 mm)
                 Hfront   48 Hsync  32 Hback   80 Hpol P
                 Vfront    3 Vsync   6 Vback   26 Vpol N
    Display Product Serial Number: ...
    Display Product Name: 'HSG1075'
    Display Range Limits:
      Monitor ranges (GTF): 59-61 Hz V, 31-80 kHz H, max dotclock 170 MHz
  Extension blocks: 1
Checksum: 0x6e

----------------

Failures:

Block 0, Base EDID:
  Base EDID: EDID specified 1 extension block(s), but found 0 extension block(s).
EDID:
  Base EDID: Some timings are out of range of the Monitor Ranges:
    Maximum Clock: 193.250 MHz (Monitor: 170.000 MHz)

EDID conformity: FAIL
