edid-decode (hex):

00 ff ff ff ff ff ff 00 4c 2d 9d 00 35 31 59 47
18 0e 01 03 6c 1e 17 61 2a ff 59 99 55 4d 97 26
1b 4b 4f bf ee 00 31 40 45 40 61 40 31 4f 45 4f
61 4f 01 01 01 01 64 19 00 40 41 00 26 30 18 88
36 00 30 e4 10 00 00 18 00 00 00 fd 00 38 4b 1e
3d 08 00 0a 20 20 20 20 20 20 00 00 00 fc 00 53
79 6e 63 4d 61 73 74 65 72 0a 20 20 00 00 00 ff
00 48 39 4e 58 36 31 30 39 35 39 0a 20 20 00 73

----------------

Block 0, Base EDID:
  EDID Structure Version & Revision: 1.3
  Vendor & Product Identification:
    Manufacturer: SAM
    Model: 157
    Serial Number: ...
    Made in: week 24 of 2004
  Basic Display Parameters & Features:
    Analog display
    Input voltage level: 0.7/0.7 V
    Sync: Separate Composite
    Maximum image size: 30 cm x 23 cm
    Gamma: 1.97
    DPMS levels: Off
    RGB color display
    First detailed timing is the preferred timing
  Color Characteristics:
    Red  : 0.6005, 0.3349
    Green: 0.3037, 0.5927
    Blue : 0.1494, 0.1064
    White: 0.2949, 0.3095
  Established Timings I & II:
    IBM     :   720x400    70.082 Hz   9:5    31.467 kHz  28.320 MHz
    DMT 0x04:   640x480    59.940 Hz   4:3    31.469 kHz  25.175 MHz
    Apple   :   640x480    66.667 Hz   4:3    35.000 kHz  30.240 MHz
    DMT 0x05:   640x480    72.809 Hz   4:3    37.861 kHz  31.500 MHz
    DMT 0x06:   640x480    75.000 Hz   4:3    37.500 kHz  31.500 MHz
    DMT 0x08:   800x600    56.250 Hz   4:3    35.156 kHz  36.000 MHz
    DMT 0x09:   800x600    60.317 Hz   4:3    37.879 kHz  40.000 MHz
    DMT 0x0a:   800x600    72.188 Hz   4:3    48.077 kHz  50.000 MHz
    DMT 0x0b:   800x600    75.000 Hz   4:3    46.875 kHz  49.500 MHz
    Apple   :   832x624    74.551 Hz   4:3    49.726 kHz  57.284 MHz
    DMT 0x10:  1024x768    60.004 Hz   4:3    48.363 kHz  65.000 MHz
    DMT 0x11:  1024x768    70.069 Hz   4:3    56.476 kHz  75.000 MHz
    DMT 0x12:  1024x768    75.029 Hz   4:3    60.023 kHz  78.750 MHz
  Standard Timings:
    DMT 0x04:   640x480    59.940 Hz   4:3    31.469 kHz  25.175 MHz
    DMT 0x09:   800x600    60.317 Hz   4:3    37.879 kHz  40.000 MHz
    DMT 0x10:  1024x768    60.004 Hz   4:3    48.363 kHz  65.000 MHz
    DMT 0x06:   640x480    75.000 Hz   4:3    37.500 kHz  31.500 MHz
    DMT 0x0b:   800x600    75.000 Hz   4:3    46.875 kHz  49.500 MHz
    DMT 0x12:  1024x768    75.029 Hz   4:3    60.023 kHz  78.750 MHz
  Detailed Timing Descriptors:
    DTD 1:  1024x768    60.004 Hz   4:3    48.363 kHz  65.000 MHz (304 mm x 228 mm)
                 Hfront   24 Hsync 136 Hback 160 Hpol N
                 Vfront    3 Vsync   6 Vback  29 Vpol N
  Display Range Limits:
    Monitor ranges (GTF): 56-75 Hz V, 30-61 kHz H, max dotclock 80 MHz
    Display Product Name: 'SyncMaster'
    Display Product Serial Number: ...
Checksum: 0x73

----------------

EDID conformity: PASS
