edid-decode (hex):

00 ff ff ff ff ff ff 00 2d b2 1a 46 01 00 00 00
06 16 01 04 c2 24 1d 8c ea 9c 20 9c 54 4f 8f 26
21 52 56 2f cf 00 81 80 b3 00 a9 c0 90 40 a9 40
81 40 81 00 71 4f 02 3a 80 18 71 38 2d 40 58 2c
45 00 20 20 00 00 00 1e 9e 20 00 90 51 20 1f 30
48 80 36 00 10 0a 00 00 00 1a 21 39 90 30 62 1a
27 40 68 b0 36 00 20 20 00 00 00 1e 00 00 00 fc
00 56 50 2d 34 36 31 0a 20 20 20 20 20 20 01 ae

02 03 22 f3 4d 90 1f 04 13 05 14 02 11 06 15 22
21 20 23 09 04 07 83 01 00 00 67 03 0c 00 10 00
38 2d 9a 29 a0 d0 51 84 22 30 50 98 10 00 20 20
00 00 00 1e 66 21 56 aa 51 00 1e 30 46 8f 33 00
20 20 00 00 00 1e 28 3c 80 a0 70 b0 23 40 30 20
36 00 20 20 00 00 00 1e 3c 39 00 a0 80 38 1a 40
30 20 3a 00 20 20 00 00 00 1e b2 2f 00 a0 80 38
1a 40 50 20 3a 00 20 20 00 00 00 1e 00 00 00 b2

----------------

Block 0, Base EDID:
  EDID Structure Version & Revision: 1.4
  Vendor & Product Identification:
    Manufacturer: KMR
    Model: 17946
    Serial Number: ...
    Made in: week 6 of 2012
  Basic Display Parameters & Features:
    Digital display
    Bits per primary color channel: 12
    HDMI-a interface
    Maximum image size: 36 cm x 29 cm
    Gamma: 2.40
    DPMS levels: Standby Suspend Off
    Supported color formats: RGB 4:4:4, YCrCb 4:4:4
    First detailed timing includes the native pixel format and preferred refresh rate
  Color Characteristics:
    Red  : 0.6113, 0.3291
    Green: 0.3115, 0.5585
    Blue : 0.1484, 0.1308
    White: 0.3203, 0.3359
  Established Timings I & II:
    DMT 0x04:   640x480    59.940 Hz   4:3    31.469 kHz  25.175 MHz
    DMT 0x05:   640x480    72.809 Hz   4:3    37.861 kHz  31.500 MHz
    DMT 0x06:   640x480    75.000 Hz   4:3    37.500 kHz  31.500 MHz
    DMT 0x08:   800x600    56.250 Hz   4:3    35.156 kHz  36.000 MHz
    DMT 0x09:   800x600    60.317 Hz   4:3    37.879 kHz  40.000 MHz
    DMT 0x0a:   800x600    72.188 Hz   4:3    48.077 kHz  50.000 MHz
    DMT 0x0b:   800x600    75.000 Hz   4:3    46.875 kHz  49.500 MHz
    DMT 0x10:  1024x768    60.004 Hz   4:3    48.363 kHz  65.000 MHz
    DMT 0x11:  1024x768    70.069 Hz   4:3    56.476 kHz  75.000 MHz
    DMT 0x12:  1024x768    75.029 Hz   4:3    60.023 kHz  78.750 MHz
    DMT 0x24:  1280x1024   75.025 Hz   5:4    79.976 kHz 135.000 MHz
  Standard Timings:
    DMT 0x23:  1280x1024   60.020 Hz   5:4    63.981 kHz 108.000 MHz
    DMT 0x3a:  1680x1050   59.954 Hz  16:10   65.290 kHz 146.250 MHz
    DMT 0x53:  1600x900    60.000 Hz  16:9    60.000 kHz 108.000 MHz (RB)
    DMT 0x2a:  1400x1050   59.978 Hz   4:3    65.317 kHz 121.750 MHz
    DMT 0x33:  1600x1200   60.000 Hz   4:3    75.000 kHz 162.000 MHz
    DMT 0x20:  1280x960    60.000 Hz   4:3    60.000 kHz 108.000 MHz
    DMT 0x1c:  1280x800    59.810 Hz  16:10   49.702 kHz  83.500 MHz
    DMT 0x15:  1152x864    75.000 Hz   4:3    67.500 kHz 108.000 MHz
  Detailed Timing Descriptors:
    DTD 1:  1920x1080   60.000 Hz  16:9    67.500 kHz 148.500 MHz (32 mm x 32 mm)
                 Hfront   88 Hsync  44 Hback 148 Hpol P
                 Vfront    4 Vsync   5 Vback  36 Vpol P
    DTD 2:  1280x800    59.810 Hz   8:5    49.702 kHz  83.500 MHz (16 mm x 10 mm)
                 Hfront   72 Hsync 128 Hback 200 Hpol P
                 Vfront    3 Vsync   6 Vback  22 Vpol N
    DTD 3:  1680x1050   59.954 Hz   8:5    65.290 kHz 146.250 MHz (32 mm x 32 mm)
                 Hfront  104 Hsync 176 Hback 280 Hpol P
                 Vfront    3 Vsync   6 Vback  30 Vpol P
    Display Product Name: 'VP-461'
  Extension blocks: 1
Checksum: 0xae

----------------

Block 1, CTA-861 Extension Block:
  Revision: 3
  Underscans IT Video Formats by default
  Basic audio support
  Supports YCbCr 4:4:4
  Supports YCbCr 4:2:2
  Native detailed modes: 3
  Video Data Block:
    VIC  16:  1920x1080   60.000 Hz  16:9    67.500 kHz 148.500 MHz (native)
    VIC  31:  1920x1080   50.000 Hz  16:9    56.250 kHz 148.500 MHz
    VIC   4:  1280x720    60.000 Hz  16:9    45.000 kHz  74.250 MHz
    VIC  19:  1280x720    50.000 Hz  16:9    37.500 kHz  74.250 MHz
    VIC   5:  1920x1080i  60.000 Hz  16:9    33.750 kHz  74.250 MHz
    VIC  20:  1920x1080i  50.000 Hz  16:9    28.125 kHz  74.250 MHz
    VIC   2:   720x480    59.940 Hz   4:3    31.469 kHz  27.000 MHz
    VIC  17:   720x576    50.000 Hz   4:3    31.250 kHz  27.000 MHz
    VIC   6:  1440x480i   59.940 Hz   4:3    15.734 kHz  27.000 MHz
    VIC  21:  1440x576i   50.000 Hz   4:3    15.625 kHz  27.000 MHz
    VIC  34:  1920x1080   30.000 Hz  16:9    33.750 kHz  74.250 MHz
    VIC  33:  1920x1080   25.000 Hz  16:9    28.125 kHz  74.250 MHz
    VIC  32:  1920x1080   24.000 Hz  16:9    27.000 kHz  74.250 MHz
  Audio Data Block:
    Linear PCM:
      Max channels: 2
      Supported sample rates (kHz): 48
      Supported sample sizes (bits): 24 20 16
  Speaker Allocation Data Block:
    FL/FR - Front Left/Right
  Vendor-Specific Data Block (HDMI), OUI 00-0C-03:
    Source physical address: 1.0.0.0
    DC_36bit
    DC_30bit
    DC_Y444
    Maximum TMDS clock: 225 MHz
  Detailed Timing Descriptors:
    DTD 4:  1440x900    59.887 Hz   8:5    55.935 kHz 106.500 MHz (32 mm x 32 mm)
                 Hfront   80 Hsync 152 Hback 232 Hpol P
                 Vfront    1 Vsync   0 Vback  33 Vpol P
                   9a 29 a0 d0 51 84 22 30 50 98 10 00 20 20 00 00 00 1e '.)..Q."0P...  ....'
    DTD 5:  1366x768    59.790 Hz 683:384  47.712 kHz  85.500 MHz (32 mm x 32 mm)
                 Hfront   70 Hsync 143 Hback 213 Hpol P
                 Vfront    3 Vsync   3 Vback  24 Vpol P
    DTD 6:  1920x1200   59.950 Hz   8:5    74.038 kHz 154.000 MHz (32 mm x 32 mm)
                 Hfront   48 Hsync  32 Hback  80 Hpol P
                 Vfront    3 Vsync   6 Vback  26 Vpol P
    DTD 7:  2048x1080   59.999 Hz 256:135  66.359 kHz 146.520 MHz (32 mm x 32 mm)
                 Hfront   48 Hsync  32 Hback  80 Hpol P
                 Vfront    3 Vsync  10 Vback  13 Vpol P
    DTD 8:  2048x1080   49.999 Hz 256:135  55.299 kHz 122.100 MHz (32 mm x 32 mm)
                 Hfront   80 Hsync  32 Hback  48 Hpol P
                 Vfront    3 Vsync  10 Vback  13 Vpol P
Checksum: 0xb2

----------------

Warnings:

Block 1, CTA-861 Extension Block:
  Missing VCDB, needed for Set Selectable RGB Quantization to avoid interop issues.

Failures:

Block 0, Base EDID:
  Detailed Timing Descriptor #1: Mismatch of image size 32x32 mm vs display size 360x290 mm.
  Detailed Timing Descriptor #2: Mismatch of image size 16x10 mm vs display size 360x290 mm.
  Detailed Timing Descriptor #3: Mismatch of image size 32x32 mm vs display size 360x290 mm.
Block 1, CTA-861 Extension Block:
  Vendor-Specific Data Block (HDMI): The HDMI Specification uses EDID 1.3, not 1.4.
  Detailed Timing Descriptor #4: 0 values in the video timing:
    Horizontal Active/Blanking 1440/464
    Horizontal Frontporch/Sync Width 80/152
    Vertical Active/Blanking 900/34
    Vertical Frontporch/Sync Width 1/0
  Detailed Timing Descriptor #4: Mismatch of image size 32x32 mm vs display size 360x290 mm.
  Detailed Timing Descriptor #5: Mismatch of image size 32x32 mm vs display size 360x290 mm.
  Detailed Timing Descriptor #6: Mismatch of image size 32x32 mm vs display size 360x290 mm.
  Detailed Timing Descriptor #7: Mismatch of image size 32x32 mm vs display size 360x290 mm.
  Detailed Timing Descriptor #8: Mismatch of image size 32x32 mm vs display size 360x290 mm.
EDID:
  CTA-861: Native progressive timings are a mix of several resolutions.

EDID conformity: FAIL
