edid-decode (hex):

00 ff ff ff ff ff ff 00 5c 85 40 60 4d 15 00 00
21 13 01 03 68 47 28 78 2a 82 ff a6 55 46 98 24
0f 47 49 2f ce 00 81 c0 8b c0 81 80 01 01 01 01
01 01 01 01 01 01 9d 1c 56 82 50 00 30 30 28 20
35 00 c5 8f 21 00 00 1a 00 00 00 fc 00 53 4b 2d
33 32 48 36 34 30 47 0a 20 20 00 00 00 fd 00 32
4b 1e 46 0b 00 0a 20 20 20 20 20 20 00 00 00 00
00 00 00 00 00 00 00 00 00 00 00 00 00 00 00 22

00 ff ff ff ff ff ff 00 5c 85 40 60 4d 15 00 00
21 13 01 03 68 47 28 78 2a 82 ff a6 55 46 98 24
0f 47 49 2f ce 00 81 c0 8b c0 81 80 01 01 01 01
01 01 01 01 01 01 9d 1c 56 82 50 00 30 30 28 20
35 00 c5 8f 21 00 00 1a 00 00 00 fc 00 53 4b 2d
33 32 48 36 34 30 47 0a 20 20 00 00 00 fd 00 32
4b 1e 46 0b 00 0a 20 20 20 20 20 20 00 00 00 00
00 00 00 00 00 00 00 00 00 00 00 00 00 00 00 22

----------------

Block 0, Base EDID:
  EDID Structure Version & Revision: 1.3
  Vendor & Product Identification:
    Manufacturer: WDE
    Model: 24640
    Serial Number: ...
    Made in: week 33 of 2009
  Basic Display Parameters & Features:
    Analog display
    Signal Level Standard: 0.700 : 0.000 : 0.700 V p-p
    Blank level equals black level
    Sync: Separate
    Maximum image size: 71 cm x 40 cm
    Gamma: 2.20
    DPMS levels: Off
    RGB color display
    First detailed timing is the preferred timing
  Color Characteristics:
    Red  : 0.6503, 0.3320
    Green: 0.2734, 0.5957
    Blue : 0.1435, 0.0615
    White: 0.2802, 0.2880
  Established Timings I & II:
    DMT 0x04:   640x480    59.940476 Hz   4:3     31.469 kHz     25.175000 MHz
    DMT 0x05:   640x480    72.808802 Hz   4:3     37.861 kHz     31.500000 MHz
    DMT 0x06:   640x480    75.000000 Hz   4:3     37.500 kHz     31.500000 MHz
    DMT 0x08:   800x600    56.250000 Hz   4:3     35.156 kHz     36.000000 MHz
    DMT 0x09:   800x600    60.316541 Hz   4:3     37.879 kHz     40.000000 MHz
    DMT 0x0a:   800x600    72.187572 Hz   4:3     48.077 kHz     50.000000 MHz
    DMT 0x0b:   800x600    75.000000 Hz   4:3     46.875 kHz     49.500000 MHz
    DMT 0x10:  1024x768    60.003840 Hz   4:3     48.363 kHz     65.000000 MHz
    DMT 0x11:  1024x768    70.069359 Hz   4:3     56.476 kHz     75.000000 MHz
    DMT 0x12:  1024x768    75.028582 Hz   4:3     60.023 kHz     78.750000 MHz
  Standard Timings:
    DMT 0x55:  1280x720    60.000000 Hz  16:9     45.000 kHz     74.250000 MHz
    GTF     :  1360x765    60.000341 Hz  16:9     47.520 kHz     84.396000 MHz
    DMT 0x23:  1280x1024   60.019740 Hz   5:4     63.981 kHz    108.000000 MHz
  Detailed Timing Descriptors:
    DTD 1:  1366x768    60.004784 Hz 683:384   48.964 kHz     73.250000 MHz (709 mm x 399 mm)
                 Hfront   40 Hsync  32 Hback   58 Hpol P
                 Vfront    3 Vsync   5 Vback   40 Vpol N
    Display Product Name: 'SK-32H640G'
    Display Range Limits:
      Monitor ranges (GTF): 50-75 Hz V, 30-70 kHz H, max dotclock 110 MHz
    Empty Descriptor
Checksum: 0x22

----------------

Block 1, Unknown EDID Extension Block 0x00:
  00 ff ff ff ff ff ff 00 5c 85 40 60 4d 15 00 00 '........\.@`M...'
  21 13 01 03 68 47 28 78 2a 82 ff a6 55 46 98 24 '!...hG(x*...UF.$'
  0f 47 49 2f ce 00 81 c0 8b c0 81 80 01 01 01 01 '.GI/............'
  01 01 01 01 01 01 9d 1c 56 82 50 00 30 30 28 20 '........V.P.00( '
  35 00 c5 8f 21 00 00 1a 00 00 00 fc 00 53 4b 2d '5...!........SK-'
  33 32 48 36 34 30 47 0a 20 20 00 00 00 fd 00 32 '32H640G.  .....2'
  4b 1e 46 0b 00 0a 20 20 20 20 20 20 00 00 00 00 'K.F...      ....'
  00 00 00 00 00 00 00 00 00 00 00 00 00 00 00 22 '..............."'
Checksum: 0x22

----------------

Warnings:

Block 0, Base EDID:
  Standard Timings: Standard Timing 1360x765 has a dubious odd vertical resolution.

Failures:

Block 0, Base EDID:
  Empty Descriptor: Use Dummy Descriptor instead of all zeroes.
Block 1, Base EDID:
  Unknown Extension Block.
EDID:
  Base EDID: EDID specified 0 extension block(s), but found 1 extension block(s).

EDID conformity: FAIL
