
EDID (hex):
00ffffffffffff0004726900c4928093
2613010368291778ca3d85a6564a9a24
125054bf6f80714f8140818081c08100
010101010101662156aa51001e30468f
33009ae61000001e000000fd00374c1f
500e000a202020202020000000fc0058
31393348510a0a0a0a0a0a0a000000ff
004c454b3044313031383534350a00ef

Extracted contents:
header:          00 ff ff ff ff ff ff 00
serial number:   04 72 69 00 c4 92 80 93 26 13
version:         01 03
basic params:    68 29 17 78 ca
chroma info:     3d 85 a6 56 4a 9a 24 12 50 54
established:     bf 6f 80
standard:        71 4f 81 40 81 80 81 c0 81 00 01 01 01 01 01 01
descriptor 1:    66 21 56 aa 51 00 1e 30 46 8f 33 00 9a e6 10 00 00 1e
descriptor 2:    00 00 00 fd 00 37 4c 1f 50 0e 00 0a 20 20 20 20 20 20
descriptor 3:    00 00 00 fc 00 58 31 39 33 48 51 0a 0a 0a 0a 0a 0a 0a
descriptor 4:    00 00 00 ff 00 4c 45 4b 30 44 31 30 31 38 35 34 35 0a
extensions:      00
checksum:        ef

EDID version: 1.3
Manufacturer: ACR Model 69 Serial Number --
Made in week 38 of 2009
Analog display, Input voltage level: 0.7/0.7 V
Sync: Separate 
Maximum image size: 41 cm x 23 cm
Gamma: 2.20
DPMS levels: Standby Suspend
RGB color display
First detailed timing is preferred timing
Display x,y Chromaticity:
  Red:   0.6484, 0.3388
  Green: 0.2919, 0.6025
  Blue:  0.1425, 0.0703
  White: 0.3134, 0.3291
Established timings supported:
  720x400@70Hz 9:5 HorFreq: 31469 Hz Clock: 28.320 MHz
  640x480@60Hz 4:3 HorFreq: 31469 Hz Clock: 25.175 MHz
  640x480@67Hz 4:3 HorFreq: 35000 Hz Clock: 30.240 MHz
  640x480@72Hz 4:3 HorFreq: 37900 Hz Clock: 31.500 MHz
  640x480@75Hz 4:3 HorFreq: 37500 Hz Clock: 31.500 MHz
  800x600@56Hz 4:3 HorFreq: 35200 Hz Clock: 36.000 MHz
  800x600@60Hz 4:3 HorFreq: 37900 Hz Clock: 40.000 MHz
  800x600@75Hz 4:3 HorFreq: 46900 Hz Clock: 49.500 MHz
  832x624@75Hz 4:3 HorFreq: 49726 Hz Clock: 57.284 MHz
  1024x768@60Hz 4:3 HorFreq: 48400 Hz Clock: 65.000 MHz
  1024x768@70Hz 4:3 HorFreq: 56500 Hz Clock: 75.000 MHz
  1024x768@75Hz 4:3 HorFreq: 60000 Hz Clock: 78.750 MHz
  1280x1024@75Hz 5:4 HorFreq: 80000 Hz Clock: 135.000 MHz
  1152x870@75Hz 192:145 HorFreq: 67500 Hz Clock: 108.000 MHz
Standard timings supported:
  1152x864@75Hz 4:3 HorFreq: 67500 Hz Clock: 108.000 MHz
  1280x960@60Hz 4:3 HorFreq: 60000 Hz Clock: 108.000 MHz
  1280x1024@60Hz 5:4 HorFreq: 64000 Hz Clock: 108.000 MHz
  1280x720@60Hz 16:9
  1280x800@60Hz 16:10
Detailed mode: Clock 85.500 MHz, 410 mm x 230 mm
               1366 1436 1579 1792 hborder 0
                768  771  774  798 vborder 0
               +hsync +vsync 
               VertFreq: 59 Hz, HorFreq: 47712 Hz
Monitor ranges (GTF): 55-76Hz V, 31-80kHz H, max dotclock 140MHz
Monitor name: X193HQ
Serial number: --
Checksum: 0xef (valid)
EDID block does NOT conform to EDID 1.3!
	Detailed block string not properly terminated
