edid-decode (hex):

00 ff ff ff ff ff ff 00 41 0c 7c c1 fe 60 00 00
28 1c 01 03 80 35 1e 78 2a de 81 a9 4f 46 ab 26
0d 50 54 bf ef 00 d1 c0 b3 00 95 00 81 80 81 40
81 c0 01 01 01 01 02 3a 80 18 71 38 2d 40 58 2c
45 00 0f 28 21 00 00 1e 2a 44 80 a0 70 38 27 40
30 20 35 00 0f 28 21 00 00 1a 00 00 00 fc 00 50
48 4c 20 32 34 36 45 39 51 0a 20 20 00 00 00 fd
00 30 4c 1e 55 12 00 0a 20 20 20 20 20 20 01 79

----------------

Block 0, Base EDID:
  EDID Structure Version & Revision: 1.3
  Vendor & Product Identification:
    Manufacturer: PHL
    Model: 49532
    Serial Number: ...
    Made in: week 40 of 2018
  Basic Display Parameters & Features:
    Digital display
    Maximum image size: 53 cm x 30 cm
    Gamma: 2.20
    DPMS levels: Off
    RGB color display
    First detailed timing is the preferred timing
  Color Characteristics:
    Red  : 0.6630, 0.3095
    Green: 0.2763, 0.6699
    Blue : 0.1503, 0.0507
    White: 0.3125, 0.3291
  Established Timings I & II:
    IBM     :   720x400    70.082 Hz   9:5    31.467 kHz  28.320 MHz
    DMT 0x04:   640x480    59.940 Hz   4:3    31.469 kHz  25.175 MHz
    Apple   :   640x480    66.667 Hz   4:3    35.000 kHz  30.240 MHz
    DMT 0x05:   640x480    72.809 Hz   4:3    37.861 kHz  31.500 MHz
    DMT 0x06:   640x480    75.000 Hz   4:3    37.500 kHz  31.500 MHz
    DMT 0x08:   800x600    56.250 Hz   4:3    35.156 kHz  36.000 MHz
    DMT 0x09:   800x600    60.317 Hz   4:3    37.879 kHz  40.000 MHz
    DMT 0x0a:   800x600    72.188 Hz   4:3    48.077 kHz  50.000 MHz
    DMT 0x0b:   800x600    75.000 Hz   4:3    46.875 kHz  49.500 MHz
    Apple   :   832x624    74.551 Hz   4:3    49.726 kHz  57.284 MHz
    DMT 0x10:  1024x768    60.004 Hz   4:3    48.363 kHz  65.000 MHz
    DMT 0x11:  1024x768    70.069 Hz   4:3    56.476 kHz  75.000 MHz
    DMT 0x12:  1024x768    75.029 Hz   4:3    60.023 kHz  78.750 MHz
    DMT 0x24:  1280x1024   75.025 Hz   5:4    79.976 kHz 135.000 MHz
  Standard Timings:
    DMT 0x52:  1920x1080   60.000 Hz  16:9    67.500 kHz 148.500 MHz
    DMT 0x3a:  1680x1050   59.954 Hz  16:10   65.290 kHz 146.250 MHz
    DMT 0x2f:  1440x900    59.887 Hz  16:10   55.935 kHz 106.500 MHz
    DMT 0x23:  1280x1024   60.020 Hz   5:4    63.981 kHz 108.000 MHz
    DMT 0x20:  1280x960    60.000 Hz   4:3    60.000 kHz 108.000 MHz
    DMT 0x55:  1280x720    60.000 Hz  16:9    45.000 kHz  74.250 MHz
  Detailed Timing Descriptors:
    DTD 1:  1920x1080   60.000 Hz  16:9    67.500 kHz 148.500 MHz (527 mm x 296 mm)
                 Hfront   88 Hsync  44 Hback 148 Hpol P
                 Vfront    4 Vsync   5 Vback  36 Vpol P
    DTD 2:  1920x1080   74.973 Hz  16:9    83.894 kHz 174.500 MHz (527 mm x 296 mm)
                 Hfront   48 Hsync  32 Hback  80 Hpol P
                 Vfront    3 Vsync   5 Vback  31 Vpol N
    Display Product Name: 'PHL 246E9Q'
  Display Range Limits:
    Monitor ranges (GTF): 48-76 Hz V, 30-85 kHz H, max dotclock 180 MHz
  Extension blocks: 1
Checksum: 0x79

----------------

Failures:

Block 0, Base EDID:
  Base EDID: EDID specified 1 extension block(s), but found 0 extension block(s).

EDID conformity: FAIL
