edid-decode (hex):

00 ff ff ff ff ff ff 00 11 af 55 10 0d 00 00 00
03 1b 01 04 a1 2f 1e ff 23 0d c9 a0 57 47 98 27
12 48 4c bf ec 00 45 00 45 0f 45 40 45 4c 81 c0
95 00 a9 40 b3 00 93 2e 90 a0 60 1a 1e 40 30 20
36 00 da 28 11 00 00 1e 00 00 00 fd 00 31 4b 1f
50 11 00 0a 20 20 20 20 20 20 00 00 00 fc 00 44
4d 31 36 38 30 31 30 35 30 46 31 0a 00 00 00 ff
00 34 30 30 35 32 32 30 31 33 0a 20 20 20 00 4c

----------------

Block 0, Base EDID:
  EDID Structure Version & Revision: 1.4
  Vendor & Product Identification:
    Manufacturer: DMO
    Model: 4181
    Serial Number: ...
    Made in: week 3 of 2017
  Basic Display Parameters & Features:
    Digital display
    Bits per primary color channel: 8
    DVI interface
    Maximum image size: 47 cm x 30 cm
    Gamma is defined in an extension block
    DPMS levels: Off
    Supported color formats: RGB 4:4:4
    First detailed timing includes the native pixel format and preferred refresh rate
    Display is continuous frequency
  Color Characteristics:
    Red  : 0.6250, 0.3398
    Green: 0.2802, 0.5947
    Blue : 0.1552, 0.0703
    White: 0.2832, 0.2978
  Established Timings I & II:
    IBM     :   720x400    70.081663 Hz   9:5     31.467 kHz     28.320000 MHz
    DMT 0x04:   640x480    59.940476 Hz   4:3     31.469 kHz     25.175000 MHz
    Apple   :   640x480    66.666667 Hz   4:3     35.000 kHz     30.240000 MHz
    DMT 0x05:   640x480    72.808802 Hz   4:3     37.861 kHz     31.500000 MHz
    DMT 0x06:   640x480    75.000000 Hz   4:3     37.500 kHz     31.500000 MHz
    DMT 0x08:   800x600    56.250000 Hz   4:3     35.156 kHz     36.000000 MHz
    DMT 0x09:   800x600    60.316541 Hz   4:3     37.879 kHz     40.000000 MHz
    DMT 0x0a:   800x600    72.187572 Hz   4:3     48.077 kHz     50.000000 MHz
    DMT 0x0b:   800x600    75.000000 Hz   4:3     46.875 kHz     49.500000 MHz
    Apple   :   832x624    74.551266 Hz   4:3     49.726 kHz     57.284000 MHz
    DMT 0x10:  1024x768    60.003840 Hz   4:3     48.363 kHz     65.000000 MHz
    DMT 0x11:  1024x768    70.069359 Hz   4:3     56.476 kHz     75.000000 MHz
  Standard Timings:
    GTF     :   800x500    60.000689 Hz  16:10    31.080 kHz     31.329000 MHz
    GTF     :   800x500    74.999253 Hz  16:10    39.225 kHz     40.166000 MHz
    DMT 0x09:   800x600    60.316541 Hz   4:3     37.879 kHz     40.000000 MHz
    DMT 0x0a:   800x600    72.187572 Hz   4:3     48.077 kHz     50.000000 MHz
    DMT 0x55:  1280x720    60.000000 Hz  16:9     45.000 kHz     74.250000 MHz
    DMT 0x2f:  1440x900    59.887445 Hz  16:10    55.935 kHz    106.500000 MHz
    DMT 0x33:  1600x1200   60.000000 Hz   4:3     75.000 kHz    162.000000 MHz
    DMT 0x3a:  1680x1050   59.954250 Hz  16:10    65.290 kHz    146.250000 MHz
  Detailed Timing Descriptors:
    DTD 1:  1680x1050   59.998994 Hz  16:10    64.799 kHz    119.230000 MHz (474 mm x 296 mm)
                 Hfront   48 Hsync  32 Hback   80 Hpol P
                 Vfront    3 Vsync   6 Vback   21 Vpol P
    Display Range Limits:
      Monitor ranges (GTF): 49-75 Hz V, 31-80 kHz H, max dotclock 170 MHz
    Display Product Name: 'DM16801050F1'
    Display Product Serial Number: ...
Checksum: 0x4c

----------------

Warnings:

Block 0, Base EDID:
  Display Range Limits: GTF support is deprecated in EDID 1.4.

EDID conformity: PASS
