edid-decode (hex):

00 ff ff ff ff ff ff 00 30 e4 25 13 00 00 00 00
00 17 01 04 90 26 15 78 02 82 15 97 5b 58 9c 27
1b 50 54 00 00 00 01 01 01 01 01 01 01 01 01 01
01 01 01 01 01 01 e8 26 40 ae 60 84 24 30 30 20
35 00 7e d7 10 00 00 19 f0 19 40 ae 60 84 24 30
30 20 35 00 7e d7 10 00 00 19 00 00 00 00 00 00
00 00 00 00 00 00 00 00 00 00 00 00 00 00 00 02
00 0c 47 ff 0a 3c 64 21 26 3b 64 00 00 00 00 99

----------------

Block 0, Base EDID:
  EDID Structure Version & Revision: 1.4
  Vendor & Product Identification:
    Manufacturer: LGD
    Model: 4901
    Made in: 2013
  Basic Display Parameters & Features:
    Digital display
    Bits per primary color channel: 6
    Digital interface is not defined
    Maximum image size: 38 cm x 21 cm
    Gamma: 2.20
    Supported color formats: RGB 4:4:4
    First detailed timing includes the native pixel format and preferred refresh rate
  Color Characteristics:
    Red  : 0.5917, 0.3554
    Green: 0.3437, 0.6113
    Blue : 0.1523, 0.1064
    White: 0.3134, 0.3291
  Established Timings I & II: none
  Standard Timings: none
  Detailed Timing Descriptors:
    DTD 1:  1600x900    59.983234 Hz  16:9     56.144 kHz     99.600000 MHz (382 mm x 215 mm)
                 Hfront   48 Hsync  32 Hback   94 Hpol N
                 Vfront    3 Vsync   5 Vback   28 Vpol N
    DTD 2:  1600x900    39.988822 Hz  16:9     37.430 kHz     66.400000 MHz (382 mm x 215 mm)
                 Hfront   48 Hsync  32 Hback   94 Hpol N
                 Vfront    3 Vsync   5 Vback   28 Vpol N
    Empty Descriptor
    Manufacturer-Specified Display Descriptor (0x02): 00 02 00 0c 47 ff 0a 3c 64 21 26 3b 64 00 00 00 '....G..<d!&;d...'
Checksum: 0x99

----------------

Warnings:

Block 0, Base EDID:
  Missing Display Product Name.

Failures:

Block 0, Base EDID:
  Empty Descriptor: Use Dummy Descriptor instead of all zeroes.

EDID conformity: FAIL
