edid-decode (hex):

00 ff ff ff ff ff ff 00 1a b3 af 08 15 1c 00 00
1b 1d 01 04 b5 50 22 78 3a 17 15 aa 54 4e 9c 26
10 50 54 a5 4b 00 81 80 95 00 a9 c0 b3 00 d1 c0
d1 00 01 01 01 01 4e d4 70 a0 d0 a0 46 50 30 40
3a 00 20 4f 31 00 00 1c e7 7c 70 a0 d0 a0 29 50
30 20 3a 00 20 4f 31 00 00 1a 00 00 00 fd 00 30
66 1e a0 3c 01 0a 20 20 20 20 20 20 00 00 00 fc
00 42 33 34 2d 39 20 55 45 0a 20 20 20 20 01 5f

02 03 1e 71 51 90 1f 05 14 04 03 12 01 02 11 13
07 15 16 06 27 5a 23 09 07 07 83 01 00 00 4e d4
70 a0 d0 a0 46 50 30 40 3a 00 20 4f 31 00 00 1c
e7 7c 70 a0 d0 a0 29 50 30 20 3a 00 20 4f 31 00
00 1a 02 3a 80 18 71 38 2d 40 94 2c 45 08 20 4f
31 00 00 1e 58 4d 00 b8 a1 38 14 40 94 2c b5 00
20 4f 31 00 00 1e c7 79 00 a0 a3 a0 32 50 b8 18
13 10 20 4f 31 00 00 1c 00 00 00 00 00 00 00 98

00 ff ff ff ff ff ff 00 1a b3 af 08 15 1c 00 00
1b 1d 01 04 b5 50 22 78 3a 17 15 aa 54 4e 9c 26
10 50 54 a5 4b 00 81 80 95 00 a9 c0 b3 00 d1 c0
d1 00 01 01 01 01 4e d4 70 a0 d0 a0 46 50 30 40
3a 00 20 4f 31 00 00 1c e7 7c 70 a0 d0 a0 29 50
30 20 3a 00 20 4f 31 00 00 1a 00 00 00 fd 00 30
66 1e a0 3c 01 0a 20 20 20 20 20 20 00 00 00 fc
00 42 33 34 2d 39 20 55 45 0a 20 20 20 20 01 5f

02 03 1e 71 51 90 1f 05 14 04 03 12 01 02 11 13
07 15 16 06 27 5a 23 09 07 07 83 01 00 00 4e d4
70 a0 d0 a0 46 50 30 40 3a 00 20 4f 31 00 00 1c
e7 7c 70 a0 d0 a0 29 50 30 20 3a 00 20 4f 31 00
00 1a 02 3a 80 18 71 38 2d 40 94 2c 45 08 20 4f
31 00 00 1e 58 4d 00 b8 a1 38 14 40 94 2c b5 00
20 4f 31 00 00 1e c7 79 00 a0 a3 a0 32 50 b8 18
13 10 20 4f 31 00 00 1c 00 00 00 00 00 00 00 98

----------------

Block 0, Base EDID:
  EDID Structure Version & Revision: 1.4
  Vendor & Product Identification:
    Manufacturer: FUS
    Model: 2223
    Serial Number: ...
    Made in: week 27 of 2019
  Basic Display Parameters & Features:
    Digital display
    Bits per primary color channel: 10
    DisplayPort interface
    Maximum image size: 80 cm x 34 cm
    Gamma: 2.20
    DPMS levels: Off
    Supported color formats: RGB 4:4:4, YCrCb 4:4:4, YCrCb 4:2:2
    First detailed timing includes the native pixel format and preferred refresh rate
  Color Characteristics:
    Red  : 0.6640, 0.3291
    Green: 0.3056, 0.6123
    Blue : 0.1484, 0.0634
    White: 0.3134, 0.3291
  Established Timings I & II:
    IBM     :   720x400    70.081663 Hz   9:5     31.467 kHz     28.320000 MHz
    DMT 0x04:   640x480    59.940476 Hz   4:3     31.469 kHz     25.175000 MHz
    DMT 0x06:   640x480    75.000000 Hz   4:3     37.500 kHz     31.500000 MHz
    DMT 0x09:   800x600    60.316541 Hz   4:3     37.879 kHz     40.000000 MHz
    DMT 0x0b:   800x600    75.000000 Hz   4:3     46.875 kHz     49.500000 MHz
    DMT 0x10:  1024x768    60.003840 Hz   4:3     48.363 kHz     65.000000 MHz
    DMT 0x12:  1024x768    75.028582 Hz   4:3     60.023 kHz     78.750000 MHz
    DMT 0x24:  1280x1024   75.024675 Hz   5:4     79.976 kHz    135.000000 MHz
  Standard Timings:
    DMT 0x23:  1280x1024   60.019740 Hz   5:4     63.981 kHz    108.000000 MHz
    DMT 0x2f:  1440x900    59.887445 Hz  16:10    55.935 kHz    106.500000 MHz
    DMT 0x53:  1600x900    60.000000 Hz  16:9     60.000 kHz    108.000000 MHz (RB)
    DMT 0x3a:  1680x1050   59.954250 Hz  16:10    65.290 kHz    146.250000 MHz
    DMT 0x52:  1920x1080   60.000000 Hz  16:9     67.500 kHz    148.500000 MHz
    DMT 0x45:  1920x1200   59.884600 Hz  16:10    74.556 kHz    193.250000 MHz
  Detailed Timing Descriptors:
    DTD  1:  3440x1440   99.981604 Hz  43:18   150.972 kHz    543.500000 MHz (800 mm x 335 mm)
                  Hfront   48 Hsync  64 Hback   48 Hpol N
                  Vfront    3 Vsync  10 Vback   57 Vpol P
    DTD  2:  3440x1440   59.972616 Hz  43:18    88.819 kHz    319.750000 MHz (800 mm x 335 mm)
                  Hfront   48 Hsync  32 Hback   80 Hpol P
                  Vfront    3 Vsync  10 Vback   28 Vpol N
    Display Range Limits:
      Monitor ranges (Bare Limits): 48-102 Hz V, 30-160 kHz H, max dotclock 600 MHz
    Display Product Name: 'B34-9 UE'
  Extension blocks: 1
Checksum: 0x5f

----------------

Block 1, CTA-861 Extension Block:
  Revision: 3
  Basic audio support
  Supports YCbCr 4:4:4
  Supports YCbCr 4:2:2
  Native detailed modes: 1
  Video Data Block:
    VIC  16:  1920x1080   60.000000 Hz  16:9     67.500 kHz    148.500000 MHz (native)
    VIC  31:  1920x1080   50.000000 Hz  16:9     56.250 kHz    148.500000 MHz
    VIC   5:  1920x1080i  60.000000 Hz  16:9     33.750 kHz     74.250000 MHz
    VIC  20:  1920x1080i  50.000000 Hz  16:9     28.125 kHz     74.250000 MHz
    VIC   4:  1280x720    60.000000 Hz  16:9     45.000 kHz     74.250000 MHz
    VIC   3:   720x480    59.940060 Hz  16:9     31.469 kHz     27.000000 MHz
    VIC  18:   720x576    50.000000 Hz  16:9     31.250 kHz     27.000000 MHz
    VIC   1:   640x480    59.940476 Hz   4:3     31.469 kHz     25.175000 MHz
    VIC   2:   720x480    59.940060 Hz   4:3     31.469 kHz     27.000000 MHz
    VIC  17:   720x576    50.000000 Hz   4:3     31.250 kHz     27.000000 MHz
    VIC  19:  1280x720    50.000000 Hz  16:9     37.500 kHz     74.250000 MHz
    VIC   7:  1440x480i   59.940060 Hz  16:9     15.734 kHz     27.000000 MHz
    VIC  21:  1440x576i   50.000000 Hz   4:3     15.625 kHz     27.000000 MHz
    VIC  22:  1440x576i   50.000000 Hz  16:9     15.625 kHz     27.000000 MHz
    VIC   6:  1440x480i   59.940060 Hz   4:3     15.734 kHz     27.000000 MHz
    VIC  39:  1920x1080i  50.000000 Hz  16:9     31.250 kHz     72.000000 MHz
    VIC  90:  2560x1080   60.000000 Hz  64:27    66.000 kHz    198.000000 MHz
  Audio Data Block:
    Linear PCM:
      Max channels: 2
      Supported sample rates (kHz): 48 44.1 32
      Supported sample sizes (bits): 24 20 16
  Speaker Allocation Data Block:
    FL/FR - Front Left/Right
  Detailed Timing Descriptors:
    DTD  3:  3440x1440   99.981604 Hz  43:18   150.972 kHz    543.500000 MHz (800 mm x 335 mm)
                  Hfront   48 Hsync  64 Hback   48 Hpol N
                  Vfront    3 Vsync  10 Vback   57 Vpol P
    DTD  4:  3440x1440   59.972616 Hz  43:18    88.819 kHz    319.750000 MHz (800 mm x 335 mm)
                  Hfront   48 Hsync  32 Hback   80 Hpol P
                  Vfront    3 Vsync  10 Vback   28 Vpol N
    DTD  5:  1920x1080   60.000000 Hz  16:9     67.500 kHz    148.500000 MHz (800 mm x 335 mm)
                  Hfront  148 Hsync  44 Hback   88 Hpol P
                  Vfront   36 Vsync   5 Vback    4 Vpol P
    DTD  6:  2560x1080   60.000000 Hz  64:27    66.000 kHz    198.000000 MHz (800 mm x 335 mm)
                  Hfront  148 Hsync  44 Hback  248 Hpol P
                  Vfront   11 Vsync   5 Vback    4 Vpol P
    DTD  7:  2560x1440   59.985146 Hz  16:9     89.378 kHz    311.750000 MHz (800 mm x 335 mm)
                  Hfront  184 Hsync 280 Hback  464 Hpol N
                  Vfront    1 Vsync   3 Vback   46 Vpol P
Checksum: 0x98  Unused space in Extension Block: 7 bytes

----------------

Block 2, Unknown EDID Extension Block 0x00:
  00 ff ff ff ff ff ff 00 1a b3 af 08 15 1c 00 00 '................'
  1b 1d 01 04 b5 50 22 78 3a 17 15 aa 54 4e 9c 26 '.....P"x:...TN.&'
  10 50 54 a5 4b 00 81 80 95 00 a9 c0 b3 00 d1 c0 '.PT.K...........'
  d1 00 01 01 01 01 4e d4 70 a0 d0 a0 46 50 30 40 '......N.p...FP0@'
  3a 00 20 4f 31 00 00 1c e7 7c 70 a0 d0 a0 29 50 ':. O1....|p...)P'
  30 20 3a 00 20 4f 31 00 00 1a 00 00 00 fd 00 30 '0 :. O1........0'
  66 1e a0 3c 01 0a 20 20 20 20 20 20 00 00 00 fc 'f..<..      ....'
  00 42 33 34 2d 39 20 55 45 0a 20 20 20 20 01 5f '.B34-9 UE.    ._'
Checksum: 0x5f

----------------

Block 3, CTA-861 Extension Block:
  Revision: 3
  Basic audio support
  Supports YCbCr 4:4:4
  Supports YCbCr 4:2:2
  Native detailed modes: 1
  Video Data Block:
    VIC  16:  1920x1080   60.000000 Hz  16:9     67.500 kHz    148.500000 MHz (native)
    VIC  31:  1920x1080   50.000000 Hz  16:9     56.250 kHz    148.500000 MHz
    VIC   5:  1920x1080i  60.000000 Hz  16:9     33.750 kHz     74.250000 MHz
    VIC  20:  1920x1080i  50.000000 Hz  16:9     28.125 kHz     74.250000 MHz
    VIC   4:  1280x720    60.000000 Hz  16:9     45.000 kHz     74.250000 MHz
    VIC   3:   720x480    59.940060 Hz  16:9     31.469 kHz     27.000000 MHz
    VIC  18:   720x576    50.000000 Hz  16:9     31.250 kHz     27.000000 MHz
    VIC   1:   640x480    59.940476 Hz   4:3     31.469 kHz     25.175000 MHz
    VIC   2:   720x480    59.940060 Hz   4:3     31.469 kHz     27.000000 MHz
    VIC  17:   720x576    50.000000 Hz   4:3     31.250 kHz     27.000000 MHz
    VIC  19:  1280x720    50.000000 Hz  16:9     37.500 kHz     74.250000 MHz
    VIC   7:  1440x480i   59.940060 Hz  16:9     15.734 kHz     27.000000 MHz
    VIC  21:  1440x576i   50.000000 Hz   4:3     15.625 kHz     27.000000 MHz
    VIC  22:  1440x576i   50.000000 Hz  16:9     15.625 kHz     27.000000 MHz
    VIC   6:  1440x480i   59.940060 Hz   4:3     15.734 kHz     27.000000 MHz
    VIC  39:  1920x1080i  50.000000 Hz  16:9     31.250 kHz     72.000000 MHz
    VIC  90:  2560x1080   60.000000 Hz  64:27    66.000 kHz    198.000000 MHz
  Audio Data Block:
    Linear PCM:
      Max channels: 2
      Supported sample rates (kHz): 48 44.1 32
      Supported sample sizes (bits): 24 20 16
  Speaker Allocation Data Block:
    FL/FR - Front Left/Right
  Detailed Timing Descriptors:
    DTD  8:  3440x1440   99.981604 Hz  43:18   150.972 kHz    543.500000 MHz (800 mm x 335 mm)
                  Hfront   48 Hsync  64 Hback   48 Hpol N
                  Vfront    3 Vsync  10 Vback   57 Vpol P
    DTD  9:  3440x1440   59.972616 Hz  43:18    88.819 kHz    319.750000 MHz (800 mm x 335 mm)
                  Hfront   48 Hsync  32 Hback   80 Hpol P
                  Vfront    3 Vsync  10 Vback   28 Vpol N
    DTD 10:  1920x1080   60.000000 Hz  16:9     67.500 kHz    148.500000 MHz (800 mm x 335 mm)
                  Hfront  148 Hsync  44 Hback   88 Hpol P
                  Vfront   36 Vsync   5 Vback    4 Vpol P
    DTD 11:  2560x1080   60.000000 Hz  64:27    66.000 kHz    198.000000 MHz (800 mm x 335 mm)
                  Hfront  148 Hsync  44 Hback  248 Hpol P
                  Vfront   11 Vsync   5 Vback    4 Vpol P
    DTD 12:  2560x1440   59.985146 Hz  16:9     89.378 kHz    311.750000 MHz (800 mm x 335 mm)
                  Hfront  184 Hsync 280 Hback  464 Hpol N
                  Vfront    1 Vsync   3 Vback   46 Vpol P
Checksum: 0x98  Unused space in Extension Block: 7 bytes

----------------

Warnings:

Block 1, CTA-861 Extension Block:
  IT Video Formats are overscanned by default, but normally this should be underscanned.
  Detailed Timing Descriptor #5: DTD is similar but not identical to VIC 16.
  Detailed Timing Descriptor #6: DTD is similar but not identical to VIC 90.
  Add a Colorimetry Data Block with the sRGB colorimetry bit set to avoid interop issues.
Block 3, CTA-861 Extension Block:
  IT Video Formats are overscanned by default, but normally this should be underscanned.
  Detailed Timing Descriptor #10: DTD is similar but not identical to VIC 16.
  Detailed Timing Descriptor #11: DTD is similar but not identical to VIC 90.
  Add a Colorimetry Data Block with the sRGB colorimetry bit set to avoid interop issues.
EDID:
  Base EDID: Some timings are out of range of the Monitor Ranges:
    Horizontal Freq: 15.625 - 150.972 kHz (Monitor: 30.000 - 160.000 kHz)

Failures:

Block 1, CTA-861 Extension Block:
  Missing VCDB, needed for Set Selectable RGB Quantization to avoid interop issues.
Block 2, Base EDID:
  Unknown Extension Block.
Block 3, CTA-861 Extension Block:
  Video Data Block: Duplicate VIC 16.
  Video Data Block: Duplicate VIC 31.
  Video Data Block: Duplicate VIC 5.
  Video Data Block: Duplicate VIC 20.
  Video Data Block: Duplicate VIC 4.
  Video Data Block: Duplicate VIC 3.
  Video Data Block: Duplicate VIC 18.
  Video Data Block: Duplicate VIC 1.
  Video Data Block: Duplicate VIC 2.
  Video Data Block: Duplicate VIC 17.
  Video Data Block: Duplicate VIC 19.
  Video Data Block: Duplicate VIC 7.
  Video Data Block: Duplicate VIC 21.
  Video Data Block: Duplicate VIC 22.
  Video Data Block: Duplicate VIC 6.
  Video Data Block: Duplicate VIC 39.
  Video Data Block: Duplicate VIC 90.
  Speaker Allocation Data Block: Only one instance of this Data Block is allowed.
  Missing VCDB, needed for Set Selectable RGB Quantization to avoid interop issues.
EDID:
  Base EDID: EDID specified 1 extension block(s), but found 3 extension block(s).
  CTA-861: Native progressive timings are a mix of several resolutions.

EDID conformity: FAIL
