
EDID (hex):
00ffffffffffff0010ac21d04d373430
2a12010368221378ee5541a3554a9727
155054a54a0001010101010101010101
010101010101662156aa51001e30468f
330058c21000001e000000ff00504b33
38353841463034374d0a000000fd0038
4b1e5309000a202020202020000000fc
0044454c4c204531363039570a2000e8

Extracted contents:
header:          00 ff ff ff ff ff ff 00
serial number:   10 ac 21 d0 4d 37 34 30 2a 12
version:         01 03
basic params:    68 22 13 78 ee
chroma info:     55 41 a3 55 4a 97 27 15 50 54
established:     a5 4a 00
standard:        01 01 01 01 01 01 01 01 01 01 01 01 01 01 01 01
descriptor 1:    66 21 56 aa 51 00 1e 30 46 8f 33 00 58 c2 10 00 00 1e
descriptor 2:    00 00 00 ff 00 50 4b 33 38 35 38 41 46 30 34 37 4d 0a
descriptor 3:    00 00 00 fd 00 38 4b 1e 53 09 00 0a 20 20 20 20 20 20
descriptor 4:    00 00 00 fc 00 44 45 4c 4c 20 45 31 36 30 39 57 0a 20
extensions:      00
checksum:        e8

EDID version: 1.3
Manufacturer: DEL Model d021 Serial Number --
Made in week 42 of 2008
Analog display, Input voltage level: 0.7/0.7 V
Sync: Separate 
Maximum image size: 34 cm x 19 cm
Gamma: 2.20
DPMS levels: Standby Suspend Off
RGB color display
Default (sRGB) color space is primary color space
First detailed timing is preferred timing
Display x,y Chromaticity:
  Red:   0.6376, 0.3330
  Green: 0.2900, 0.5908
  Blue:  0.1533, 0.0820
  White: 0.3125, 0.3291
Established timings supported:
  720x400@70Hz 9:5 HorFreq: 31469 Hz Clock: 28.320 MHz
  640x480@60Hz 4:3 HorFreq: 31469 Hz Clock: 25.175 MHz
  640x480@75Hz 4:3 HorFreq: 37500 Hz Clock: 31.500 MHz
  800x600@60Hz 4:3 HorFreq: 37900 Hz Clock: 40.000 MHz
  800x600@75Hz 4:3 HorFreq: 46900 Hz Clock: 49.500 MHz
  1024x768@60Hz 4:3 HorFreq: 48400 Hz Clock: 65.000 MHz
  1024x768@75Hz 4:3 HorFreq: 60000 Hz Clock: 78.750 MHz
Standard timings supported:
Detailed mode: Clock 85.500 MHz, 344 mm x 194 mm
               1366 1436 1579 1792 hborder 0
                768  771  774  798 vborder 0
               +hsync +vsync 
               VertFreq: 59 Hz, HorFreq: 47712 Hz
Serial number: --
Monitor ranges (GTF): 56-75Hz V, 30-83kHz H, max dotclock 90MHz
Monitor name: DELL E1609W
Checksum: 0xe8 (valid)
EDID block does NOT conform to EDID 1.3!
	sRGB is signaled, but the chromaticities do not match
