edid-decode (hex):

00 ff ff ff ff ff ff 00 09 e5 ff 08 00 00 00 00
01 1d 01 04 95 1a 0e 78 0a 81 35 96 59 5a 9a 29
1c 50 54 00 00 00 01 01 01 01 01 01 01 01 01 01
01 01 01 01 01 01 6b 1b 56 64 50 00 1e 30 26 16
44 00 00 90 10 00 00 1a ef 15 56 64 50 00 1e 30
26 16 44 00 00 90 10 00 00 1a 00 00 00 fe 00 42
4f 45 20 48 46 0a 20 20 20 20 20 20 00 00 00 fc
00 4e 56 31 31 36 57 48 4d 2d 54 31 34 0a 00 0f

----------------

Block 0, Base EDID:
  EDID Structure Version & Revision: 1.4
  Vendor & Product Identification:
    Manufacturer: BOE
    Model: 2303
    Made in: week 1 of 2019
  Basic Display Parameters & Features:
    Digital display
    Bits per primary color channel: 6
    DisplayPort interface
    Maximum image size: 26 cm x 14 cm
    Gamma: 2.20
    Supported color formats: RGB 4:4:4, YCrCb 4:4:4
    First detailed timing includes the native pixel format and preferred refresh rate
  Color Characteristics:
    Red  : 0.5878, 0.3476
    Green: 0.3515, 0.6025
    Blue : 0.1601, 0.1123
    White: 0.3134, 0.3291
  Established Timings I & II: none
  Standard Timings: none
  Detailed Timing Descriptors:
    DTD 1:  1366x768    59.998222 Hz 683:384   47.879 kHz     70.190000 MHz (256 mm x 144 mm)
                 Hfront   38 Hsync  22 Hback   40 Hpol P
                 Vfront    4 Vsync   4 Vback   22 Vpol N
    DTD 2:  1366x768    47.996868 Hz 683:384   38.302 kHz     56.150000 MHz (256 mm x 144 mm)
                 Hfront   38 Hsync  22 Hback   40 Hpol P
                 Vfront    4 Vsync   4 Vback   22 Vpol N
    Alphanumeric Data String: 'BOE HF'
    Display Product Name: 'NV116WHM-T14'
Checksum: 0x0f

----------------

EDID conformity: PASS
