edid-decode (hex):

00 ff ff ff ff ff ff 00 4c 2d 3b 08 00 00 00 00
06 15 01 03 80 5f 37 78 2a 7a 24 a4 53 4e a6 29
0c 4a 52 00 00 00 01 01 01 01 01 01 01 01 01 01
01 01 01 01 01 01 02 3a 80 18 71 38 2d 40 58 2c
45 00 b6 26 32 00 00 1e 02 3a 80 18 71 38 2d 40
58 2c 45 00 b6 26 32 00 00 1e 00 00 00 fd 00 32
3d 1e 51 0f 00 0a 20 20 20 20 20 20 00 00 00 fc
00 53 4d 53 55 52 34 30 0a 20 20 20 20 20 00 f3

----------------

Block 0, Base EDID:
  EDID Structure Version & Revision: 1.3
  Vendor & Product Identification:
    Manufacturer: SAM
    Model: 2107
    Made in: week 6 of 2011
  Basic Display Parameters & Features:
    Digital display
    Maximum image size: 95 cm x 55 cm
    Gamma: 2.20
    DPMS levels: Off
    RGB color display
    First detailed timing is the preferred timing
  Color Characteristics:
    Red  : 0.6416, 0.3271
    Green: 0.3066, 0.6503
    Blue : 0.1601, 0.0488
    White: 0.2900, 0.3203
  Established Timings I & II: none
  Standard Timings: none
  Detailed Timing Descriptors:
    DTD 1:  1920x1080   60.000000 Hz  16:9     67.500 kHz    148.500000 MHz (950 mm x 550 mm)
                 Hfront   88 Hsync  44 Hback  148 Hpol P
                 Vfront    4 Vsync   5 Vback   36 Vpol P
    DTD 2:  1920x1080   60.000000 Hz  16:9     67.500 kHz    148.500000 MHz (950 mm x 550 mm)
                 Hfront   88 Hsync  44 Hback  148 Hpol P
                 Vfront    4 Vsync   5 Vback   36 Vpol P
    Display Range Limits:
      Monitor ranges (GTF): 50-61 Hz V, 30-81 kHz H, max dotclock 150 MHz
    Display Product Name: 'SMSUR40'
Checksum: 0xf3

----------------

EDID conformity: PASS
