edid-decode (hex):

00 ff ff ff ff ff ff 00 41 0c 2a 09 11 01 00 00
05 1d 01 03 80 77 22 78 2e dc 41 ac 50 47 a5 26
11 50 54 bf ef 00 d1 c0 81 80 01 01 01 01 01 01
01 01 01 01 01 01 1a 68 00 a0 f0 38 1f 40 30 20
3a 00 a9 50 41 00 00 1a 56 5e 00 a0 a0 a0 29 50
30 20 35 00 a9 50 41 00 00 1e 00 00 00 fc 00 50
48 4c 20 34 39 39 50 39 0a 20 20 20 00 00 00 fd
00 30 4b 1e e6 3c 00 0a 20 20 20 20 20 20 02 d5

02 03 4b f1 50 10 1f 05 14 04 13 03 12 02 11 01
5d 5e 5f 60 61 23 09 07 07 83 01 00 00 6d 03 0c
00 10 00 38 78 20 00 60 01 02 03 67 d8 5d c4 01
78 80 03 68 1a 00 00 01 01 30 4b e6 e3 05 e3 01
e3 0f 00 c0 e6 06 07 01 61 56 1c 02 3a 80 18 71
38 2d 40 58 2c 45 00 a9 50 41 00 00 1e a0 73 00
6a a0 a0 29 50 08 20 35 00 a9 50 41 00 00 1a 00
00 00 00 00 00 00 00 00 00 00 00 00 00 00 00 14

70 12 79 00 00 03 01 3c 33 b7 00 04 ff 13 9f 00
2f 80 1f 00 9f 05 28 00 02 00 09 00 be d6 00 04
ff 13 9f 00 2f 80 1f 00 9f 05 2f 00 02 00 09 00
55 5a 00 04 ff 13 9f 00 2f 80 1f 00 9f 05 14 00
02 00 09 00 00 00 00 00 00 00 00 00 00 00 00 00
00 00 00 00 00 00 00 00 00 00 00 00 00 00 00 00
00 00 00 00 00 00 00 00 00 00 00 00 00 00 00 00
00 00 00 00 00 00 00 00 00 00 00 00 00 00 07 90

----------------

Block 0, Base EDID:
  EDID Structure Version & Revision: 1.3
  Vendor & Product Identification:
    Manufacturer: PHL
    Model: 2346
    Serial Number: ...
    Made in: week 5 of 2019
  Basic Display Parameters & Features:
    Digital display
    Maximum image size: 119 cm x 34 cm
    Gamma: 2.20
    DPMS levels: Off
    RGB color display
    Default (sRGB) color space is primary color space
    First detailed timing is the preferred timing
  Color Characteristics:
    Red  : 0.6748, 0.3134
    Green: 0.2802, 0.6445
    Blue : 0.1494, 0.0664
    White: 0.3125, 0.3291
  Established Timings I & II:
    IBM     :   720x400    70.082 Hz   9:5    31.467 kHz  28.320 MHz
    DMT 0x04:   640x480    59.940 Hz   4:3    31.469 kHz  25.175 MHz
    Apple   :   640x480    66.667 Hz   4:3    35.000 kHz  30.240 MHz
    DMT 0x05:   640x480    72.809 Hz   4:3    37.861 kHz  31.500 MHz
    DMT 0x06:   640x480    75.000 Hz   4:3    37.500 kHz  31.500 MHz
    DMT 0x08:   800x600    56.250 Hz   4:3    35.156 kHz  36.000 MHz
    DMT 0x09:   800x600    60.317 Hz   4:3    37.879 kHz  40.000 MHz
    DMT 0x0a:   800x600    72.188 Hz   4:3    48.077 kHz  50.000 MHz
    DMT 0x0b:   800x600    75.000 Hz   4:3    46.875 kHz  49.500 MHz
    Apple   :   832x624    74.551 Hz   4:3    49.726 kHz  57.284 MHz
    DMT 0x10:  1024x768    60.004 Hz   4:3    48.363 kHz  65.000 MHz
    DMT 0x11:  1024x768    70.069 Hz   4:3    56.476 kHz  75.000 MHz
    DMT 0x12:  1024x768    75.029 Hz   4:3    60.023 kHz  78.750 MHz
    DMT 0x24:  1280x1024   75.025 Hz   5:4    79.976 kHz 135.000 MHz
  Standard Timings:
    DMT 0x52:  1920x1080   60.000 Hz  16:9    67.500 kHz 148.500 MHz
    DMT 0x23:  1280x1024   60.020 Hz   5:4    63.981 kHz 108.000 MHz
  Detailed Timing Descriptors:
    DTD 1:  3840x1080   59.968 Hz  32:9    66.625 kHz 266.500 MHz (1193 mm x 336 mm)
                 Hfront   48 Hsync  32 Hback  80 Hpol P
                 Vfront    3 Vsync  10 Vback  18 Vpol N
    DTD 2:  2560x1440   59.951 Hz  16:9    88.787 kHz 241.500 MHz (1193 mm x 336 mm)
                 Hfront   48 Hsync  32 Hback  80 Hpol P
                 Vfront    3 Vsync   5 Vback  33 Vpol P
    Display Product Name: 'PHL 499P9'
  Display Range Limits:
    Monitor ranges (GTF): 48-75 Hz V, 30-230 kHz H, max dotclock 600 MHz
  Extension blocks: 2
Checksum: 0xd5

----------------

Block 1, CTA-861 Extension Block:
  Revision: 3
  Underscans IT Video Formats by default
  Basic audio support
  Supports YCbCr 4:4:4
  Supports YCbCr 4:2:2
  Native detailed modes: 1
  Video Data Block:
    VIC  16:  1920x1080   60.000 Hz  16:9    67.500 kHz 148.500 MHz
    VIC  31:  1920x1080   50.000 Hz  16:9    56.250 kHz 148.500 MHz
    VIC   5:  1920x1080i  60.000 Hz  16:9    33.750 kHz  74.250 MHz
    VIC  20:  1920x1080i  50.000 Hz  16:9    28.125 kHz  74.250 MHz
    VIC   4:  1280x720    60.000 Hz  16:9    45.000 kHz  74.250 MHz
    VIC  19:  1280x720    50.000 Hz  16:9    37.500 kHz  74.250 MHz
    VIC   3:   720x480    59.940 Hz  16:9    31.469 kHz  27.000 MHz
    VIC  18:   720x576    50.000 Hz  16:9    31.250 kHz  27.000 MHz
    VIC   2:   720x480    59.940 Hz   4:3    31.469 kHz  27.000 MHz
    VIC  17:   720x576    50.000 Hz   4:3    31.250 kHz  27.000 MHz
    VIC   1:   640x480    59.940 Hz   4:3    31.469 kHz  25.175 MHz
    VIC  93:  3840x2160   24.000 Hz  16:9    54.000 kHz 297.000 MHz
    VIC  94:  3840x2160   25.000 Hz  16:9    56.250 kHz 297.000 MHz
    VIC  95:  3840x2160   30.000 Hz  16:9    67.500 kHz 297.000 MHz
    VIC  96:  3840x2160   50.000 Hz  16:9   112.500 kHz 594.000 MHz
    VIC  97:  3840x2160   60.000 Hz  16:9   135.000 kHz 594.000 MHz
  Audio Data Block:
    Linear PCM:
      Max channels: 2
      Supported sample rates (kHz): 48 44.1 32
      Supported sample sizes (bits): 24 20 16
  Speaker Allocation Data Block:
    FL/FR - Front Left/Right
  Vendor-Specific Data Block (HDMI), OUI 00-0C-03:
    Source physical address: 1.0.0.0
    DC_36bit
    DC_30bit
    DC_Y444
    Maximum TMDS clock: 600 MHz
    Extended HDMI video details:
      HDMI VICs:
        HDMI VIC 1:  3840x2160   30.000 Hz  16:9    67.500 kHz 297.000 MHz
        HDMI VIC 2:  3840x2160   25.000 Hz  16:9    56.250 kHz 297.000 MHz
        HDMI VIC 3:  3840x2160   24.000 Hz  16:9    54.000 kHz 297.000 MHz
  Vendor-Specific Data Block (HDMI Forum), OUI C4-5D-D8:
    Version: 1
    Maximum TMDS Character Rate: 600 MHz
    SCDC Present
    Supports 12-bits/component Deep Color 4:2:0 Pixel Encoding
    Supports 10-bits/component Deep Color 4:2:0 Pixel Encoding
  Vendor-Specific Data Block (AMD), OUI 00-00-1A:
    Version: 1.1
    Minimum Refresh Rate: 48 Hz
    Maximum Refresh Rate: 75 Hz
    Flags 1.x: 0xe6 (MCCS)
  Colorimetry Data Block:
    xvYCC601
    xvYCC709
    BT2020cYCC
    BT2020YCC
    BT2020RGB
  YCbCr 4:2:0 Capability Map Data Block:
    VIC  96:  3840x2160   50.000 Hz  16:9    56.250 kHz 297.000 MHz
    VIC  97:  3840x2160   60.000 Hz  16:9    67.500 kHz 297.000 MHz
  HDR Static Metadata Data Block:
    Electro optical transfer functions:
      Traditional gamma - SDR luminance range
      Traditional gamma - HDR luminance range
      SMPTE ST2084
    Supported static metadata descriptors:
      Static metadata type 1
    Desired content max luminance: 97 (408.759 cd/m^2)
    Desired content max frame-average luminance: 86 (322.098 cd/m^2)
    Desired content min luminance: 28 (0.049 cd/m^2)
  Detailed Timing Descriptors:
    DTD 3:  1920x1080   60.000 Hz  16:9    67.500 kHz 148.500 MHz (1193 mm x 336 mm)
                 Hfront   88 Hsync  44 Hback 148 Hpol P
                 Vfront    4 Vsync   5 Vback  36 Vpol P
    DTD 4:  2560x1440   74.968 Hz  16:9   111.028 kHz 296.000 MHz (1193 mm x 336 mm)
                 Hfront    8 Hsync  32 Hback  66 Hpol P
                 Vfront    3 Vsync   5 Vback  33 Vpol N
Checksum: 0x14

----------------

Block 2, DisplayID Extension Block:
  Version: 1.2
  Extension Count: 0
  Display Product Type: Extension Section
  Video Timing Modes Type 1 - Detailed Timings Data Block:
    DTD:  5120x1440   59.977 Hz  16:9    88.826 kHz 469.000 MHz (aspect 16:9, no 3D stereo)
               Hfront   48 Hsync  32 Hback  80 Hpol P
               Vfront    3 Vsync  10 Vback  28 Vpol N
    DTD:  5120x1440   69.973 Hz  16:9   104.119 kHz 549.750 MHz (aspect 16:9, no 3D stereo)
               Hfront   48 Hsync  32 Hback  80 Hpol P
               Vfront    3 Vsync  10 Vback  35 Vpol N
    DTD:  5120x1440   29.979 Hz  16:9    43.799 kHz 231.260 MHz (aspect 16:9, no 3D stereo)
               Hfront   48 Hsync  32 Hback  80 Hpol P
               Vfront    3 Vsync  10 Vback   8 Vpol N
  Checksum: 0x07
Checksum: 0x90

----------------

Warnings:

Block 1, CTA-861 Extension Block:
  Missing VCDB, needed for Set Selectable RGB Quantization to avoid interop issues.

Failures:

Block 0, Base EDID:
  Basic Display Parameters & Features: sRGB is signaled, but the chromaticities do not match.
Block 1, CTA-861 Extension Block:
  Vendor-Specific Data Block (HDMI): HDMI VSDB Max TMDS rate is > 340.
Block 2, DisplayID Extension Block:
  DisplayID Base Block has no product type.
EDID:
  Base EDID: Some timings are out of range of the Monitor Ranges:
    Vertical Freq: 24.000 - 75.029 Hz (Monitor: 48.000 - 75.000 Hz)
    Horizontal Freq: 28.125 - 135.000 kHz (Monitor: 30.000 - 230.000 kHz)
  Base EDID: EDID 1.3 requires a Block Map Extension in Block 1 if there are more than 2 blocks in the EDID.
  DisplayID: Missing DisplayID Product Identification Data Block.
  DisplayID: DisplayID expects at least one preferred timing.

EDID conformity: FAIL
