
EDID (hex):
00ffffffffffff004c2db60735354154
30140103683c22782a92c1a259559e27
0e5054bfef80714f8100814081809500
950fb3000101023a801871382d40582c
450056502100001e662150b051001b30
4070360056502100001e000000fd003c
4b1e5111000a202020202020000000fc
00534d543237413535300a20202000f6

Extracted contents:
header:          00 ff ff ff ff ff ff 00
serial number:   4c 2d b6 07 35 35 41 54 30 14
version:         01 03
basic params:    68 3c 22 78 2a
chroma info:     92 c1 a2 59 55 9e 27 0e 50 54
established:     bf ef 80
standard:        71 4f 81 00 81 40 81 80 95 00 95 0f b3 00 01 01
descriptor 1:    02 3a 80 18 71 38 2d 40 58 2c 45 00 56 50 21 00 00 1e
descriptor 2:    66 21 50 b0 51 00 1b 30 40 70 36 00 56 50 21 00 00 1e
descriptor 3:    00 00 00 fd 00 3c 4b 1e 51 11 00 0a 20 20 20 20 20 20
descriptor 4:    00 00 00 fc 00 53 4d 54 32 37 41 35 35 30 0a 20 20 20
extensions:      00
checksum:        f6

EDID version: 1.3
Manufacturer: SAM Model 7b6 Serial Number --
Made in week 48 of 2010
Analog display, Input voltage level: 0.7/0.7 V
Sync: Separate 
Maximum image size: 60 cm x 34 cm
Gamma: 2.20
DPMS levels: Off
RGB color display
First detailed timing is preferred timing
Display x,y Chromaticity:
  Red:   0.6347, 0.3486
  Green: 0.3320, 0.6191
  Blue:  0.1552, 0.0546
  White: 0.3125, 0.3291
Established timings supported:
  720x400@70Hz 9:5 HorFreq: 31469 Hz Clock: 28.320 MHz
  640x480@60Hz 4:3 HorFreq: 31469 Hz Clock: 25.175 MHz
  640x480@67Hz 4:3 HorFreq: 35000 Hz Clock: 30.240 MHz
  640x480@72Hz 4:3 HorFreq: 37900 Hz Clock: 31.500 MHz
  640x480@75Hz 4:3 HorFreq: 37500 Hz Clock: 31.500 MHz
  800x600@56Hz 4:3 HorFreq: 35200 Hz Clock: 36.000 MHz
  800x600@60Hz 4:3 HorFreq: 37900 Hz Clock: 40.000 MHz
  800x600@72Hz 4:3 HorFreq: 48100 Hz Clock: 50.000 MHz
  800x600@75Hz 4:3 HorFreq: 46900 Hz Clock: 49.500 MHz
  832x624@75Hz 4:3 HorFreq: 49726 Hz Clock: 57.284 MHz
  1024x768@60Hz 4:3 HorFreq: 48400 Hz Clock: 65.000 MHz
  1024x768@70Hz 4:3 HorFreq: 56500 Hz Clock: 75.000 MHz
  1024x768@75Hz 4:3 HorFreq: 60000 Hz Clock: 78.750 MHz
  1280x1024@75Hz 5:4 HorFreq: 80000 Hz Clock: 135.000 MHz
  1152x870@75Hz 192:145 HorFreq: 67500 Hz Clock: 108.000 MHz
Standard timings supported:
  1152x864@75Hz 4:3 HorFreq: 67500 Hz Clock: 108.000 MHz
  1280x800@60Hz 16:10
  1280x960@60Hz 4:3 HorFreq: 60000 Hz Clock: 108.000 MHz
  1280x1024@60Hz 5:4 HorFreq: 64000 Hz Clock: 108.000 MHz
  1440x900@60Hz 16:10 HorFreq: 55500 Hz Clock: 88.750 MHz
  1440x900@75Hz 16:10 HorFreq: 82300 Hz Clock: 156.000 MHz
  1680x1050@60Hz 16:10 HorFreq: 64700 Hz Clock: 119.000 MHz
Detailed mode: Clock 148.500 MHz, 598 mm x 336 mm
               1920 2008 2052 2200 hborder 0
               1080 1084 1089 1125 vborder 0
               +hsync +vsync 
               VertFreq: 60 Hz, HorFreq: 67500 Hz
Detailed mode: Clock 85.500 MHz, 598 mm x 336 mm
               1360 1424 1536 1792 hborder 0
                768  771  777  795 vborder 0
               +hsync +vsync 
               VertFreq: 60 Hz, HorFreq: 47712 Hz
Monitor ranges (GTF): 60-75Hz V, 30-81kHz H, max dotclock 170MHz
Monitor name: SMT27A550
Checksum: 0xf6 (valid)
One or more of the timings is out of range of the Monitor Ranges:
  Vertical Freq: 56 - 75 Hz
  Horizontal Freq: 31469 - 82300 Hz
  Maximum Clock: 156.000 MHz
