edid-decode (hex):

00 ff ff ff ff ff ff 00 0d ae 04 16 00 00 00 00
0b 1d 01 04 a5 24 14 78 02 ee 95 a3 54 4c 99 26
0f 50 54 00 00 00 01 01 01 01 01 01 01 01 01 01
01 01 01 01 01 01 b4 3b 80 4a 71 38 34 40 30 20
35 00 63 c7 10 00 00 1a 00 00 00 fe 00 4e 31 36
31 48 43 41 2d 45 41 33 0a 20 00 00 00 fe 00 43
4d 4e 0a 20 20 20 20 20 20 20 20 20 00 00 00 fe
00 4e 31 36 31 48 43 41 2d 45 41 33 0a 20 00 30

----------------

Block 0, Base EDID:
  EDID Structure Version & Revision: 1.4
  Vendor & Product Identification:
    Manufacturer: CMN
    Model: 5636
    Made in: week 11 of 2019
  Basic Display Parameters & Features:
    Digital display
    Bits per primary color channel: 8
    DisplayPort interface
    Maximum image size: 36 cm x 20 cm
    Gamma: 2.20
    Supported color formats: RGB 4:4:4
    First detailed timing includes the native pixel format and preferred refresh rate
  Color Characteristics:
    Red  : 0.6396, 0.3300
    Green: 0.2998, 0.5996
    Blue : 0.1503, 0.0595
    White: 0.3134, 0.3291
  Established Timings I & II: none
  Standard Timings: none
  Detailed Timing Descriptors:
    DTD 1:  1920x1080   60.007852 Hz  16:9     67.929 kHz    152.840000 MHz (355 mm x 199 mm)
                 Hfront   48 Hsync  32 Hback  250 Hpol P
                 Vfront    3 Vsync   5 Vback   44 Vpol N
    Alphanumeric Data String: 'N161HCA-EA3'
    Alphanumeric Data String: 'CMN'
    Alphanumeric Data String: 'N161HCA-EA3'
Checksum: 0x30

----------------

Warnings:

Block 0, Base EDID:
  Missing Display Product Name.

EDID conformity: PASS
