edid-decode (hex):

00 ff ff ff ff ff ff 00 4a 8b 8a 8b 01 01 01 01
0b 22 01 03 80 35 1d 78 2e 08 a5 a2 57 4f a2 28
0f 50 54 21 08 00 d1 c0 b3 00 95 00 81 80 81 40
81 c0 01 01 01 01 98 e2 00 a0 a0 a0 29 50 30 20
35 00 6d 55 21 00 00 1a 70 c2 00 a0 a0 a0 55 50
30 20 35 00 6d 55 21 00 00 1a 00 00 00 fc 00 52
54 4b 20 51 48 44 20 48 44 52 0a 20 00 00 00 fd
00 3c 90 3c 90 3f 00 0a 20 20 20 20 20 20 01 b5

02 03 3d f2 48 81 03 29 47 10 40 3f 03 e2 00 d5
e3 05 c0 00 23 09 7f 07 83 01 00 00 68 03 0c 00
10 00 38 7e 00 e6 06 05 01 69 69 4f 68 1a 00 00
01 01 3c 90 e6 67 d8 5d c4 01 7e 80 01 5b 9d 00
a0 a0 a0 29 50 30 20 35 00 54 50 21 00 00 1e 6a
5e 00 a0 a0 a0 29 50 30 20 35 00 55 6e 21 00 00
1e d4 bc 00 a0 a0 a0 29 50 30 20 35 00 6d 55 21
00 00 1a 00 00 00 00 00 00 00 00 00 00 00 00 b7

00 ff ff ff ff ff ff 00 4a 8b 8a 8b 01 01 01 01
0b 22 01 03 80 35 1d 78 2e 08 a5 a2 57 4f a2 28
0f 50 54 21 08 00 d1 c0 b3 00 95 00 81 80 81 40
81 c0 01 01 01 01 98 e2 00 a0 a0 a0 29 50 30 20
35 00 6d 55 21 00 00 1a 70 c2 00 a0 a0 a0 55 50
30 20 35 00 6d 55 21 00 00 1a 00 00 00 fc 00 52
54 4b 20 51 48 44 20 48 44 52 0a 20 00 00 00 fd
00 3c 90 3c 90 3f 00 0a 20 20 20 20 20 20 01 b5

02 03 3d f2 48 81 03 29 47 10 40 3f 03 e2 00 d5
e3 05 c0 00 23 09 7f 07 83 01 00 00 68 03 0c 00
10 00 38 7e 00 e6 06 05 01 69 69 4f 68 1a 00 00
01 01 3c 90 e6 67 d8 5d c4 01 7e 80 01 5b 9d 00
a0 a0 a0 29 50 30 20 35 00 54 50 21 00 00 1e 6a
5e 00 a0 a0 a0 29 50 30 20 35 00 55 6e 21 00 00
1e d4 bc 00 a0 a0 a0 29 50 30 20 35 00 6d 55 21
00 00 1a 00 00 00 00 00 00 00 00 00 00 00 00 b7

----------------

Block 0, Base EDID:
  EDID Structure Version & Revision: 1.3
  Vendor & Product Identification:
    Manufacturer: RTK
    Model: 35722
    Serial Number: ...
    Made in: week 11 of 2024
  Basic Display Parameters & Features:
    Digital display
    Maximum image size: 53 cm x 29 cm
    Gamma: 2.20
    DPMS levels: Off
    RGB color display
    Default (sRGB) color space is primary color space
    First detailed timing is the preferred timing
  Color Characteristics:
    Red  : 0.6328, 0.3398
    Green: 0.3105, 0.6328
    Blue : 0.1582, 0.0605
    White: 0.3134, 0.3291
  Established Timings I & II:
    DMT 0x04:   640x480    59.940476 Hz   4:3     31.469 kHz     25.175000 MHz
    DMT 0x09:   800x600    60.316541 Hz   4:3     37.879 kHz     40.000000 MHz
    DMT 0x10:  1024x768    60.003840 Hz   4:3     48.363 kHz     65.000000 MHz
  Standard Timings:
    DMT 0x52:  1920x1080   60.000000 Hz  16:9     67.500 kHz    148.500000 MHz
    DMT 0x3a:  1680x1050   59.954250 Hz  16:10    65.290 kHz    146.250000 MHz
    DMT 0x2f:  1440x900    59.887445 Hz  16:10    55.935 kHz    106.500000 MHz
    DMT 0x23:  1280x1024   60.019740 Hz   5:4     63.981 kHz    108.000000 MHz
    DMT 0x20:  1280x960    60.000000 Hz   4:3     60.000 kHz    108.000000 MHz
    DMT 0x55:  1280x720    60.000000 Hz  16:9     45.000 kHz     74.250000 MHz
  Detailed Timing Descriptors:
    DTD 1:  2560x1440  144.000477 Hz  16:9    213.265 kHz    580.080000 MHz (621 mm x 341 mm)
                 Hfront   48 Hsync  32 Hback   80 Hpol P
                 Vfront    3 Vsync   5 Vback   33 Vpol N
    DTD 2:  2560x1440  120.000000 Hz  16:9    183.000 kHz    497.760000 MHz (621 mm x 341 mm)
                 Hfront   48 Hsync  32 Hback   80 Hpol P
                 Vfront    3 Vsync   5 Vback   77 Vpol N
    Display Product Name: 'RTK QHD HDR'
    Display Range Limits:
      Monitor ranges (GTF): 60-144 Hz V, 60-144 kHz H, max dotclock 630 MHz
  Extension blocks: 1
Checksum: 0xb5

----------------

Block 1, CTA-861 Extension Block:
  Revision: 3
  Underscans IT Video Formats by default
  Basic audio support
  Supports YCbCr 4:4:4
  Supports YCbCr 4:2:2
  Native detailed modes: 2
  Video Data Block:
    VIC   1:   640x480    59.940476 Hz   4:3     31.469 kHz     25.175000 MHz (native)
    VIC   3:   720x480    59.940060 Hz  16:9     31.469 kHz     27.000000 MHz
    VIC  41:  1280x720   100.000000 Hz  16:9     75.000 kHz    148.500000 MHz
    VIC  71:  1280x720   120.000000 Hz  64:27    90.000 kHz    148.500000 MHz
    VIC  16:  1920x1080   60.000000 Hz  16:9     67.500 kHz    148.500000 MHz
    VIC  64:  1920x1080  100.000000 Hz  16:9    112.500 kHz    297.000000 MHz
    VIC  63:  1920x1080  120.000000 Hz  16:9    135.000 kHz    297.000000 MHz
    VIC   3:   720x480    59.940060 Hz  16:9     31.469 kHz     27.000000 MHz
  Video Capability Data Block:
    YCbCr quantization: Selectable (via AVI YQ)
    RGB quantization: Selectable (via AVI Q)
    PT scan behavior: Always Overscanned
    IT scan behavior: Always Overscanned
    CE scan behavior: Always Overscanned
  Colorimetry Data Block:
    BT2020YCC
    BT2020RGB
  Audio Data Block:
    Linear PCM:
      Max channels: 2
      Supported sample rates (kHz): 192 176.4 96 88.2 48 44.1 32
      Supported sample sizes (bits): 24 20 16
  Speaker Allocation Data Block:
    FL/FR - Front Left/Right
  Vendor-Specific Data Block (HDMI), OUI 00-0C-03:
    Source physical address: 1.0.0.0
    DC_36bit
    DC_30bit
    DC_Y444
    Maximum TMDS clock: 630 MHz
  HDR Static Metadata Data Block:
    Electro optical transfer functions:
      Traditional gamma - SDR luminance range
      SMPTE ST2084
    Supported static metadata descriptors:
      Static metadata type 1
    Desired content max luminance: 105 (486.099 cd/m^2)
    Desired content max frame-average luminance: 105 (486.099 cd/m^2)
    Desired content min luminance: 79 (0.467 cd/m^2)
  Vendor-Specific Data Block (AMD), OUI 00-00-1A:
    Version: 1.1
    Minimum Refresh Rate: 60 Hz
    Maximum Refresh Rate: 144 Hz
    Flags 1.x: 0xe6 (MCCS)
  Vendor-Specific Data Block (HDMI Forum), OUI C4-5D-D8:
    Version: 1
    Maximum TMDS Character Rate: 630 MHz
    SCDC Present
    Supports 10-bits/component Deep Color 4:2:0 Pixel Encoding
  Detailed Timing Descriptors:
    DTD 3:  2560x1440   99.999504 Hz  16:9    148.099 kHz    402.830000 MHz (596 mm x 336 mm)
                 Hfront   48 Hsync  32 Hback   80 Hpol P
                 Vfront    3 Vsync   5 Vback   33 Vpol P
    DTD 4:  2560x1440   60.000199 Hz  16:9     88.860 kHz    241.700000 MHz (597 mm x 366 mm)
                 Hfront   48 Hsync  32 Hback   80 Hpol P
                 Vfront    3 Vsync   5 Vback   33 Vpol P
    DTD 5:  2560x1440  120.000397 Hz  16:9    177.721 kHz    483.400000 MHz (621 mm x 341 mm)
                 Hfront   48 Hsync  32 Hback   80 Hpol P
                 Vfront    3 Vsync   5 Vback   33 Vpol N
Checksum: 0xb7  Unused space in Extension Block: 12 bytes

----------------

Block 2, Unknown EDID Extension Block 0x00:
  00 ff ff ff ff ff ff 00 4a 8b 8a 8b 01 01 01 01 '........J.......'
  0b 22 01 03 80 35 1d 78 2e 08 a5 a2 57 4f a2 28 '."...5.x....WO.('
  0f 50 54 21 08 00 d1 c0 b3 00 95 00 81 80 81 40 '.PT!...........@'
  81 c0 01 01 01 01 98 e2 00 a0 a0 a0 29 50 30 20 '............)P0 '
  35 00 6d 55 21 00 00 1a 70 c2 00 a0 a0 a0 55 50 '5.mU!...p.....UP'
  30 20 35 00 6d 55 21 00 00 1a 00 00 00 fc 00 52 '0 5.mU!........R'
  54 4b 20 51 48 44 20 48 44 52 0a 20 00 00 00 fd 'TK QHD HDR. ....'
  00 3c 90 3c 90 3f 00 0a 20 20 20 20 20 20 01 b5 '.<.<.?..      ..'
Checksum: 0xb5

----------------

Block 3, CTA-861 Extension Block:
  Revision: 3
  Underscans IT Video Formats by default
  Basic audio support
  Supports YCbCr 4:4:4
  Supports YCbCr 4:2:2
  Native detailed modes: 2
  Video Data Block:
    VIC   1:   640x480    59.940476 Hz   4:3     31.469 kHz     25.175000 MHz (native)
    VIC   3:   720x480    59.940060 Hz  16:9     31.469 kHz     27.000000 MHz
    VIC  41:  1280x720   100.000000 Hz  16:9     75.000 kHz    148.500000 MHz
    VIC  71:  1280x720   120.000000 Hz  64:27    90.000 kHz    148.500000 MHz
    VIC  16:  1920x1080   60.000000 Hz  16:9     67.500 kHz    148.500000 MHz
    VIC  64:  1920x1080  100.000000 Hz  16:9    112.500 kHz    297.000000 MHz
    VIC  63:  1920x1080  120.000000 Hz  16:9    135.000 kHz    297.000000 MHz
    VIC   3:   720x480    59.940060 Hz  16:9     31.469 kHz     27.000000 MHz
  Video Capability Data Block:
    YCbCr quantization: Selectable (via AVI YQ)
    RGB quantization: Selectable (via AVI Q)
    PT scan behavior: Always Overscanned
    IT scan behavior: Always Overscanned
    CE scan behavior: Always Overscanned
  Colorimetry Data Block:
    BT2020YCC
    BT2020RGB
  Audio Data Block:
    Linear PCM:
      Max channels: 2
      Supported sample rates (kHz): 192 176.4 96 88.2 48 44.1 32
      Supported sample sizes (bits): 24 20 16
  Speaker Allocation Data Block:
    FL/FR - Front Left/Right
  Vendor-Specific Data Block (HDMI), OUI 00-0C-03:
    Source physical address: 1.0.0.0
    DC_36bit
    DC_30bit
    DC_Y444
    Maximum TMDS clock: 630 MHz
  HDR Static Metadata Data Block:
    Electro optical transfer functions:
      Traditional gamma - SDR luminance range
      SMPTE ST2084
    Supported static metadata descriptors:
      Static metadata type 1
    Desired content max luminance: 105 (486.099 cd/m^2)
    Desired content max frame-average luminance: 105 (486.099 cd/m^2)
    Desired content min luminance: 79 (0.467 cd/m^2)
  Vendor-Specific Data Block (AMD), OUI 00-00-1A:
    Version: 1.1
    Minimum Refresh Rate: 60 Hz
    Maximum Refresh Rate: 144 Hz
    Flags 1.x: 0xe6 (MCCS)
  Vendor-Specific Data Block (HDMI Forum), OUI C4-5D-D8:
    Version: 1
    Maximum TMDS Character Rate: 630 MHz
    SCDC Present
    Supports 10-bits/component Deep Color 4:2:0 Pixel Encoding
  Detailed Timing Descriptors:
    DTD 6:  2560x1440   99.999504 Hz  16:9    148.099 kHz    402.830000 MHz (596 mm x 336 mm)
                 Hfront   48 Hsync  32 Hback   80 Hpol P
                 Vfront    3 Vsync   5 Vback   33 Vpol P
    DTD 7:  2560x1440   60.000199 Hz  16:9     88.860 kHz    241.700000 MHz (597 mm x 366 mm)
                 Hfront   48 Hsync  32 Hback   80 Hpol P
                 Vfront    3 Vsync   5 Vback   33 Vpol P
    DTD 8:  2560x1440  120.000397 Hz  16:9    177.721 kHz    483.400000 MHz (621 mm x 341 mm)
                 Hfront   48 Hsync  32 Hback   80 Hpol P
                 Vfront    3 Vsync   5 Vback   33 Vpol N
Checksum: 0xb7  Unused space in Extension Block: 12 bytes

----------------

Warnings:

Block 1, CTA-861 Extension Block:
  Video Capability Data Block: IT scan behavior is expected to support underscanned.
  Video Capability Data Block: S_PT is equal to S_IT and S_CE, so should be set to 0 instead.
Block 3, CTA-861 Extension Block:
  Video Capability Data Block: IT scan behavior is expected to support underscanned.
  Video Capability Data Block: S_PT is equal to S_IT and S_CE, so should be set to 0 instead.

Failures:

Block 0, Base EDID:
  Basic Display Parameters & Features: sRGB is signaled, but the chromaticities do not match.
  Detailed Timing Descriptor #1: Mismatch of image size 621x341 mm vs display size 530x290 mm.
  Detailed Timing Descriptor #2: Mismatch of image size 621x341 mm vs display size 530x290 mm.
Block 1, CTA-861 Extension Block:
  Video Data Block: Duplicate VIC 3.
  Video Capability Data Block: IT video formats are always overscanned, but bit 7 of Byte 3 of the CTA-861 Extension header is set to underscanned.
  Vendor-Specific Data Block (HDMI), OUI 00-0C-03: HDMI VSDB Max TMDS rate is > 340.
  Vendor-Specific Data Block (HDMI Forum), OUI C4-5D-D8: HDMI Forum VSDB did not immediately follow the HDMI VSDB.
  Vendor-Specific Data Block (HDMI Forum), OUI C4-5D-D8: Max TMDS rate is > 0 and <= 340 or > 600.
  Detailed Timing Descriptor #3: Mismatch of image size 596x336 mm vs display size 530x290 mm.
  Detailed Timing Descriptor #4: Mismatch of image size 597x366 mm vs display size 530x290 mm.
  Detailed Timing Descriptor #5: Mismatch of image size 621x341 mm vs display size 530x290 mm.
Block 2, Base EDID:
  Unknown Extension Block.
Block 3, CTA-861 Extension Block:
  Video Data Block: Duplicate VIC 1.
  Video Data Block: Duplicate VIC 41.
  Video Data Block: Duplicate VIC 71.
  Video Data Block: Duplicate VIC 16.
  Video Data Block: Duplicate VIC 64.
  Video Data Block: Duplicate VIC 63.
  Video Capability Data Block: Only one instance of this Data Block is allowed.
  Video Capability Data Block: IT video formats are always overscanned, but bit 7 of Byte 3 of the CTA-861 Extension header is set to underscanned.
  Colorimetry Data Block: Only one instance of this Data Block is allowed.
  Speaker Allocation Data Block: Only one instance of this Data Block is allowed.
  Vendor-Specific Data Block (HDMI), OUI 00-0C-03: HDMI VSDB Max TMDS rate is > 340.
  HDR Static Metadata Data Block: Only one instance of this Data Block is allowed.
  Vendor-Specific Data Block (HDMI Forum), OUI C4-5D-D8: HDMI Forum VSDB did not immediately follow the HDMI VSDB.
  Vendor-Specific Data Block (HDMI Forum), OUI C4-5D-D8: Duplicate HDMI Forum VSDB/SCDB.
  Vendor-Specific Data Block (HDMI Forum), OUI C4-5D-D8: Max TMDS rate is > 0 and <= 340 or > 600.
  Detailed Timing Descriptor #6: Mismatch of image size 596x336 mm vs display size 530x290 mm.
  Detailed Timing Descriptor #7: Mismatch of image size 597x366 mm vs display size 530x290 mm.
  Detailed Timing Descriptor #8: Mismatch of image size 621x341 mm vs display size 530x290 mm.
EDID:
  Base EDID: Some timings are out of range of the Monitor Ranges:
    Horizontal Freq: 31.468 - 213.264 kHz (Monitor: 60.000 - 144.000 kHz)
  Base EDID: The DTD max image size is 621x366mm, which is larger than the display size 530.0x290.0mm.
  Base EDID: EDID specified 1 extension block(s), but found 3 extension block(s).
  Base EDID: EDID 1.3 requires a Block Map Extension in Block 1 if there are more than 2 blocks in the EDID.
  CTA-861: Native progressive timings are a mix of several resolutions.

EDID conformity: FAIL
