
EDID (hex):
00ffffffffffff0010ac72a04d525a31
0816010380301b78ea01f5a257529f27
0a5054a54b00714f8180d1c001010101
010101010101023a801871382d40582c
4500dd0c1100001e000000ff004e3846
334d323248315a524d0a000000fc0044
454c4c204532323131480a20000000fd
00384c1e5311000a2020202020200041

Extracted contents:
header:          00 ff ff ff ff ff ff 00
serial number:   10 ac 72 a0 4d 52 5a 31 08 16
version:         01 03
basic params:    80 30 1b 78 ea
chroma info:     01 f5 a2 57 52 9f 27 0a 50 54
established:     a5 4b 00
standard:        71 4f 81 80 d1 c0 01 01 01 01 01 01 01 01 01 01
descriptor 1:    02 3a 80 18 71 38 2d 40 58 2c 45 00 dd 0c 11 00 00 1e
descriptor 2:    00 00 00 ff 00 4e 38 46 33 4d 32 32 48 31 5a 52 4d 0a
descriptor 3:    00 00 00 fc 00 44 45 4c 4c 20 45 32 32 31 31 48 0a 20
descriptor 4:    00 00 00 fd 00 38 4c 1e 53 11 00 0a 20 20 20 20 20 20
extensions:      00
checksum:        41

EDID version: 1.3
Manufacturer: DEL Model a072 Serial Number --
Made in week 8 of 2012
Digital display
Maximum image size: 48 cm x 27 cm
Gamma: 2.20
DPMS levels: Standby Suspend Off
RGB color display
First detailed timing is preferred timing
Display x,y Chromaticity:
  Red:   0.6328, 0.3398
  Green: 0.3203, 0.6220
  Blue:  0.1552, 0.0419
  White: 0.3134, 0.3291
Established timings supported:
  720x400@70Hz 9:5 HorFreq: 31469 Hz Clock: 28.320 MHz
  640x480@60Hz 4:3 HorFreq: 31469 Hz Clock: 25.175 MHz
  640x480@75Hz 4:3 HorFreq: 37500 Hz Clock: 31.500 MHz
  800x600@60Hz 4:3 HorFreq: 37900 Hz Clock: 40.000 MHz
  800x600@75Hz 4:3 HorFreq: 46900 Hz Clock: 49.500 MHz
  1024x768@60Hz 4:3 HorFreq: 48400 Hz Clock: 65.000 MHz
  1024x768@75Hz 4:3 HorFreq: 60000 Hz Clock: 78.750 MHz
  1280x1024@75Hz 5:4 HorFreq: 80000 Hz Clock: 135.000 MHz
Standard timings supported:
  1152x864@75Hz 4:3 HorFreq: 67500 Hz Clock: 108.000 MHz
  1280x1024@60Hz 5:4 HorFreq: 64000 Hz Clock: 108.000 MHz
  1920x1080@60Hz 16:9
Detailed mode: Clock 148.500 MHz, 477 mm x 268 mm
               1920 2008 2052 2200 hborder 0
               1080 1084 1089 1125 vborder 0
               +hsync +vsync 
               VertFreq: 60 Hz, HorFreq: 67500 Hz
Serial number: --
Monitor name: DELL E2211H
Monitor ranges (GTF): 56-76Hz V, 30-83kHz H, max dotclock 170MHz
Checksum: 0x41 (valid)


