
EDID (hex):
00ffffffffffff00410ccdc059370000
171901046e2917782a0cc5a45750a128
0d5054bd4b00818081c0010101010101
010101010101662156aa51001e30468f
33009ae61000001e000000ff00554b30
31353233303134313639000000fc0050
484c2031393356350a202020000000fd
00384c1e530e000a2020202020200024

Extracted contents:
header:          00 ff ff ff ff ff ff 00
serial number:   41 0c cd c0 59 37 00 00 17 19
version:         01 04
basic params:    6e 29 17 78 2a
chroma info:     0c c5 a4 57 50 a1 28 0d 50 54
established:     bd 4b 00
standard:        81 80 81 c0 01 01 01 01 01 01 01 01 01 01 01 01
descriptor 1:    66 21 56 aa 51 00 1e 30 46 8f 33 00 9a e6 10 00 00 1e
descriptor 2:    00 00 00 ff 00 55 4b 30 31 35 32 33 30 31 34 31 36 39
descriptor 3:    00 00 00 fc 00 50 48 4c 20 31 39 33 56 35 0a 20 20 20
descriptor 4:    00 00 00 fd 00 38 4c 1e 53 0e 00 0a 20 20 20 20 20 20
extensions:      00
checksum:        24

EDID version: 1.4
Manufacturer: PHL Model c0cd Serial Number --
Made in week 23 of 2015
Analog display, Input voltage level: 0.7/0.7 V
Blank level equals black level
Sync: Separate Composite SyncOnGreen 
Maximum image size: 41 cm x 23 cm
Gamma: 2.20
DPMS levels: Off
RGB color display
First detailed timing includes the native pixel format and preferred refresh rate
Display x,y Chromaticity:
  Red:   0.6406, 0.3398
  Green: 0.3154, 0.6289
  Blue:  0.1591, 0.0507
  White: 0.3134, 0.3291
Established timings supported:
  720x400@70Hz 9:5 HorFreq: 31469 Hz Clock: 28.320 MHz
  640x480@60Hz 4:3 HorFreq: 31469 Hz Clock: 25.175 MHz
  640x480@67Hz 4:3 HorFreq: 35000 Hz Clock: 30.240 MHz
  640x480@72Hz 4:3 HorFreq: 37900 Hz Clock: 31.500 MHz
  640x480@75Hz 4:3 HorFreq: 37500 Hz Clock: 31.500 MHz
  800x600@60Hz 4:3 HorFreq: 37900 Hz Clock: 40.000 MHz
  800x600@75Hz 4:3 HorFreq: 46900 Hz Clock: 49.500 MHz
  1024x768@60Hz 4:3 HorFreq: 48400 Hz Clock: 65.000 MHz
  1024x768@75Hz 4:3 HorFreq: 60000 Hz Clock: 78.750 MHz
  1280x1024@75Hz 5:4 HorFreq: 80000 Hz Clock: 135.000 MHz
Standard timings supported:
  1280x1024@60Hz 5:4 HorFreq: 64000 Hz Clock: 108.000 MHz
  1280x720@60Hz 16:9
Detailed mode: Clock 85.500 MHz, 410 mm x 230 mm
               1366 1436 1579 1792 hborder 0
                768  771  774  798 vborder 0
               +hsync +vsync 
               VertFreq: 59 Hz, HorFreq: 47712 Hz
Serial number: --
Monitor name: PHL 193V5
Monitor ranges (GTF): 56-76Hz V, 30-83kHz H, max dotclock 140MHz
Checksum: 0x24 (valid)
