
EDID (hex):
00ffffffffffff004162c10059550095
3213010380331c78eaee95a3544c9926
0f5054b30c00714f8180810095000101
010101010101023a801871382d40582c
4500fd1e1100001e000000fc00566973
656f2032333057730a20000000fd0038
4c1f5312000a202020202020000000ff
004431353043303034343030300a001a

Extracted contents:
header:          00 ff ff ff ff ff ff 00
serial number:   41 62 c1 00 59 55 00 95 32 13
version:         01 03
basic params:    80 33 1c 78 ea
chroma info:     ee 95 a3 54 4c 99 26 0f 50 54
established:     b3 0c 00
standard:        71 4f 81 80 81 00 95 00 01 01 01 01 01 01 01 01
descriptor 1:    02 3a 80 18 71 38 2d 40 58 2c 45 00 fd 1e 11 00 00 1e
descriptor 2:    00 00 00 fc 00 56 69 73 65 6f 20 32 33 30 57 73 0a 20
descriptor 3:    00 00 00 fd 00 38 4c 1f 53 12 00 0a 20 20 20 20 20 20
descriptor 4:    00 00 00 ff 00 44 31 35 30 43 30 30 34 34 30 30 30 0a
extensions:      00
checksum:        1a

EDID version: 1.3
Manufacturer: PKB Model c1 Serial Number --
Made in week 50 of 2009
Digital display
Maximum image size: 51 cm x 28 cm
Gamma: 2.20
DPMS levels: Standby Suspend Off
RGB color display
First detailed timing is preferred timing
Display x,y Chromaticity:
  Red:   0.6396, 0.3300
  Green: 0.2998, 0.5996
  Blue:  0.1503, 0.0595
  White: 0.3134, 0.3291
Established timings supported:
  720x400@70Hz 9:5 HorFreq: 31469 Hz Clock: 28.320 MHz
  640x480@60Hz 4:3 HorFreq: 31469 Hz Clock: 25.175 MHz
  640x480@67Hz 4:3 HorFreq: 35000 Hz Clock: 30.240 MHz
  800x600@56Hz 4:3 HorFreq: 35200 Hz Clock: 36.000 MHz
  800x600@60Hz 4:3 HorFreq: 37900 Hz Clock: 40.000 MHz
  1024x768@60Hz 4:3 HorFreq: 48400 Hz Clock: 65.000 MHz
  1024x768@70Hz 4:3 HorFreq: 56500 Hz Clock: 75.000 MHz
Standard timings supported:
  1152x864@75Hz 4:3 HorFreq: 67500 Hz Clock: 108.000 MHz
  1280x1024@60Hz 5:4 HorFreq: 64000 Hz Clock: 108.000 MHz
  1280x800@60Hz 16:10
  1440x900@60Hz 16:10 HorFreq: 55500 Hz Clock: 88.750 MHz
Detailed mode: Clock 148.500 MHz, 509 mm x 286 mm
               1920 2008 2052 2200 hborder 0
               1080 1084 1089 1125 vborder 0
               +hsync +vsync 
               VertFreq: 60 Hz, HorFreq: 67500 Hz
Monitor name: Viseo 230Ws
Monitor ranges (GTF): 56-76Hz V, 31-83kHz H, max dotclock 180MHz
Serial number: --
Checksum: 0x1a (valid)
