
EDID (hex):
00ffffffffffff0015a11c0663320000
260f0103081e1789ea71d6a256499624
134f54afce0001010101010101010101
010101010101c31e0020410020301060
130030e410000018000000fc00653135
74340a20202020202020000000fd0038
4c1e3c08000a202020202020000000ff
0033353920353048203132383939003a

Extracted contents:
header:          00 ff ff ff ff ff ff 00
serial number:   15 a1 1c 06 63 32 00 00 26 0f
version:         01 03
basic params:    08 1e 17 89 ea
chroma info:     71 d6 a2 56 49 96 24 13 4f 54
established:     af ce 00
standard:        01 01 01 01 01 01 01 01 01 01 01 01 01 01 01 01
descriptor 1:    c3 1e 00 20 41 00 20 30 10 60 13 00 30 e4 10 00 00 18
descriptor 2:    00 00 00 fc 00 65 31 35 74 34 0a 20 20 20 20 20 20 20
descriptor 3:    00 00 00 fd 00 38 4c 1e 3c 08 00 0a 20 20 20 20 20 20
descriptor 4:    00 00 00 ff 00 33 35 39 20 35 30 48 20 31 32 38 39 39
extensions:      00
checksum:        3a

EDID version: 1.3
Manufacturer: EMA Model 61c Serial Number --
Analog display, Input voltage level: 0.7/0.3 V
Sync: Separate 
Maximum image size: 30 cm x 23 cm
Gamma: 2.37
DPMS levels: Standby Suspend Off
RGB color display
First detailed timing is preferred timing
Display x,y Chromaticity:
  Red:   0.6337, 0.3388
  Green: 0.2851, 0.5869
  Blue:  0.1435, 0.0751
  White: 0.3095, 0.3300
Established timings supported:
  720x400@70Hz 9:5 HorFreq: 31469 Hz Clock: 28.320 MHz
  640x480@60Hz 4:3 HorFreq: 31469 Hz Clock: 25.175 MHz
  640x480@72Hz 4:3 HorFreq: 37900 Hz Clock: 31.500 MHz
  640x480@75Hz 4:3 HorFreq: 37500 Hz Clock: 31.500 MHz
  800x600@56Hz 4:3 HorFreq: 35200 Hz Clock: 36.000 MHz
  800x600@60Hz 4:3 HorFreq: 37900 Hz Clock: 40.000 MHz
  800x600@72Hz 4:3 HorFreq: 48100 Hz Clock: 50.000 MHz
  800x600@75Hz 4:3 HorFreq: 46900 Hz Clock: 49.500 MHz
  1024x768@60Hz 4:3 HorFreq: 48400 Hz Clock: 65.000 MHz
  1024x768@70Hz 4:3 HorFreq: 56500 Hz Clock: 75.000 MHz
  1024x768@75Hz 4:3 HorFreq: 60000 Hz Clock: 78.750 MHz
Standard timings supported:
Detailed mode: Clock 78.750 MHz, 304 mm x 228 mm
               1024 1040 1136 1312 hborder 0
                768  769  772  800 vborder 0
               -hsync -vsync 
               VertFreq: 75 Hz, HorFreq: 60022 Hz
Monitor name: e15t4
Monitor ranges (GTF): 56-76Hz V, 30-60kHz H, max dotclock 80MHz
Serial number: -- 50H 12899
Checksum: 0x3a (valid)
One or more of the timings is out of range of the Monitor Ranges:
  Vertical Freq: 56 - 75 Hz
  Horizontal Freq: 31469 - 60022 Hz
  Maximum Clock: 78.750 MHz
EDID block does not conform at all!
	Bad year of manufacture
