edid-decode (hex):

00 ff ff ff ff ff ff 00 2e 83 54 18 b0 00 00 00
04 15 01 03 80 29 17 78 0a f0 65 98 57 51 91 27
21 50 54 a1 08 00 01 01 01 01 01 01 01 01 01 01
01 01 01 01 01 01 01 1d 00 72 51 d0 1e 20 6e 28
55 00 c4 8e 21 00 00 1e 66 21 50 b0 51 00 1b 30
40 70 36 00 9a e6 10 00 00 1e 00 00 00 fc 00 31
39 4c 31 33 41 2d 48 2d 43 53 0a 20 00 00 00 fd
00 31 3d 0f 31 09 00 0a 20 20 20 20 20 20 01 b5

02 03 21 73 4e 84 93 10 1f 05 14 03 12 07 16 01
06 15 11 23 09 0f 07 83 01 00 00 65 03 0c 00 10
00 01 1d 00 bc 52 d0 1e 20 b8 28 55 40 c4 8e 21
00 00 1e 01 1d 80 18 71 1c 16 20 58 2c 25 00 c4
8e 21 00 00 9e 01 1d 80 d0 72 1c 16 20 10 2c 25
80 c4 8e 21 00 00 9e 8c 0a d0 8a 20 e0 2d 10 10
3e 96 00 c4 8e 21 00 00 18 8c 0a d0 90 20 40 31
20 0c 40 55 00 c4 8e 21 00 00 18 00 00 00 00 0b

----------------

Block 0, Base EDID:
  EDID Structure Version & Revision: 1.3
  Vendor & Product Identification:
    Manufacturer: KTC
    Model: 6228
    Serial Number: ...
    Made in: week 4 of 2011
  Basic Display Parameters & Features:
    Digital display
    Maximum image size: 41 cm x 23 cm
    Gamma: 2.20
    RGB color display
    First detailed timing is the preferred timing
  Color Characteristics:
    Red  : 0.5966, 0.3427
    Green: 0.3164, 0.5664
    Blue : 0.1533, 0.1308
    White: 0.3134, 0.3291
  Established Timings I & II:
    IBM     :   720x400    70.082 Hz   9:5    31.467 kHz  28.320 MHz
    DMT 0x04:   640x480    59.940 Hz   4:3    31.469 kHz  25.175 MHz
    DMT 0x09:   800x600    60.317 Hz   4:3    37.879 kHz  40.000 MHz
    DMT 0x10:  1024x768    60.004 Hz   4:3    48.363 kHz  65.000 MHz
  Standard Timings: none
  Detailed Timing Descriptors:
    DTD 1:  1280x720    60.000 Hz  16:9    45.000 kHz  74.250 MHz (708 mm x 398 mm)
                 Hfront  110 Hsync  40 Hback 220 Hpol P
                 Vfront    5 Vsync   5 Vback  20 Vpol P
    DTD 2:  1360x768    60.015 Hz  85:48   47.712 kHz  85.500 MHz (410 mm x 230 mm)
                 Hfront   64 Hsync 112 Hback 256 Hpol P
                 Vfront    3 Vsync   6 Vback  18 Vpol P
    Display Product Name: '19L13A-H-CS'
  Display Range Limits:
    Monitor ranges (GTF): 49-61 Hz V, 15-49 kHz H, max dotclock 90 MHz
  Extension blocks: 1
Checksum: 0xb5

----------------

Block 1, CTA-861 Extension Block:
  Revision: 3
  Basic audio support
  Supports YCbCr 4:4:4
  Supports YCbCr 4:2:2
  Native detailed modes: 3
  Video Data Block:
    VIC   4:  1280x720    60.000 Hz  16:9    45.000 kHz  74.250 MHz (native)
    VIC  19:  1280x720    50.000 Hz  16:9    37.500 kHz  74.250 MHz (native)
    VIC  16:  1920x1080   60.000 Hz  16:9    67.500 kHz 148.500 MHz
    VIC  31:  1920x1080   50.000 Hz  16:9    56.250 kHz 148.500 MHz
    VIC   5:  1920x1080i  60.000 Hz  16:9    33.750 kHz  74.250 MHz
    VIC  20:  1920x1080i  50.000 Hz  16:9    28.125 kHz  74.250 MHz
    VIC   3:   720x480    59.940 Hz  16:9    31.469 kHz  27.000 MHz
    VIC  18:   720x576    50.000 Hz  16:9    31.250 kHz  27.000 MHz
    VIC   7:  1440x480i   59.940 Hz  16:9    15.734 kHz  27.000 MHz
    VIC  22:  1440x576i   50.000 Hz  16:9    15.625 kHz  27.000 MHz
    VIC   1:   640x480    59.940 Hz   4:3    31.469 kHz  25.175 MHz
    VIC   6:  1440x480i   59.940 Hz   4:3    15.734 kHz  27.000 MHz
    VIC  21:  1440x576i   50.000 Hz   4:3    15.625 kHz  27.000 MHz
    VIC  17:   720x576    50.000 Hz   4:3    31.250 kHz  27.000 MHz
  Audio Data Block:
    Linear PCM:
      Max channels: 2
      Supported sample rates (kHz): 88.2 48 44.1 32
      Supported sample sizes (bits): 24 20 16
  Speaker Allocation Data Block:
    FL/FR - Front Left/Right
  Vendor-Specific Data Block (HDMI), OUI 00-0C-03:
    Source physical address: 1.0.0.0
  Detailed Timing Descriptors:
    DTD 3:  1280x720    50.000 Hz  16:9    37.500 kHz  74.250 MHz (708 mm x 398 mm)
                 Hfront  440 Hsync  40 Hback 220 Hpol P
                 Vfront    5 Vsync   5 Vback  20 Vpol P
    DTD 4:  1920x1080i  60.000 Hz  16:9    33.750 kHz  74.250 MHz (708 mm x 398 mm)
                 Hfront   88 Hsync  44 Hback 148 Hpol P
                 Vfront    2 Vsync   5 Vback  15 Vpol P Vfront +0.5 Odd Field
                 Vfront    2 Vsync   5 Vback  15 Vpol P Vback  +0.5 Even Field
    DTD 5:  1920x1080i  50.000 Hz  16:9    28.125 kHz  74.250 MHz (708 mm x 398 mm)
                 Hfront  528 Hsync  44 Hback 148 Hpol P
                 Vfront    2 Vsync   5 Vback  15 Vpol P Vfront +0.5 Odd Field
                 Vfront    2 Vsync   5 Vback  15 Vpol P Vback  +0.5 Even Field
    DTD 6:   720x480    59.940 Hz   3:2    31.469 kHz  27.000 MHz (708 mm x 398 mm)
                 Hfront   16 Hsync  62 Hback  60 Hpol N
                 Vfront    9 Vsync   6 Vback  30 Vpol N
    DTD 7:   720x576    50.000 Hz   5:4    31.250 kHz  27.000 MHz (708 mm x 398 mm)
                 Hfront   12 Hsync  64 Hback  68 Hpol N
                 Vfront    5 Vsync   5 Vback  39 Vpol N
Checksum: 0x0b

----------------

Warnings:

Block 1, CTA-861 Extension Block:
  IT Video Formats are overscanned by default, but normally this should be underscanned.
  Missing VCDB, needed for Set Selectable RGB Quantization to avoid interop issues.

Failures:

Block 0, Base EDID:
  Detailed Timing Descriptor #1: Mismatch of image size 708x398 mm vs display size 410x230 mm.
Block 1, CTA-861 Extension Block:
  Detailed Timing Descriptor #3: Mismatch of image size 708x398 mm vs display size 410x230 mm.
  Detailed Timing Descriptor #4: Mismatch of image size 708x398 mm vs display size 410x230 mm.
  Detailed Timing Descriptor #5: Mismatch of image size 708x398 mm vs display size 410x230 mm.
  Detailed Timing Descriptor #6: Mismatch of image size 708x398 mm vs display size 410x230 mm.
  Detailed Timing Descriptor #7: Mismatch of image size 708x398 mm vs display size 410x230 mm.
EDID:
  Base EDID: Some timings are out of range of the Monitor Ranges:
    Vertical Freq: 50.000 - 70.082 Hz (Monitor: 49.000 - 61.000 Hz)
    Horizontal Freq: 15.625 - 67.500 kHz (Monitor: 15.000 - 49.000 kHz)
    Maximum Clock: 148.500 MHz (Monitor: 90.000 MHz)
  CTA-861: Native progressive timings are a mix of several resolutions.

EDID conformity: FAIL
