edid-decode (hex):

00 ff ff ff ff ff ff 00 0c 65 00 00 00 00 00 00
03 15 01 03 68 2b 1b 78 ee b5 05 a5 56 4a 9a 25
12 50 54 21 08 00 71 4f 81 80 b3 00 d1 c0 8b c0
01 01 01 01 01 01 02 3a 80 18 71 38 2d 40 58 2c
45 00 e0 0e 11 00 00 1e 00 00 00 ff 00 58 59 58
58 58 59 4d 44 31 32 33 50 0a 00 00 00 fc 00 43
43 45 20 54 56 0a 0a 0a 0a 0a 0a 0a 00 00 00 fd
00 38 4c 1e 53 10 00 0a 20 20 20 20 20 20 00 6d

----------------

Block 0, Base EDID:
  EDID Structure Version & Revision: 1.3
  Vendor & Product Identification:
    Manufacturer: CCE
    Model: 0
    Made in: week 3 of 2011
  Basic Display Parameters & Features:
    Analog display
    Input voltage level: 0.7/0.7 V
    Blank level equals black level
    Sync: Separate
    Maximum image size: 43 cm x 27 cm
    Gamma: 2.20
    DPMS levels: Standby Suspend Off
    RGB color display
    Default (sRGB) color space is primary color space
    First detailed timing is the preferred timing
  Color Characteristics:
    Red  : 0.6464, 0.3388
    Green: 0.2900, 0.6025
    Blue : 0.1445, 0.0703
    White: 0.3134, 0.3291
  Established Timings I & II:
    DMT 0x04:   640x480    59.940 Hz   4:3    31.469 kHz  25.175 MHz
    DMT 0x09:   800x600    60.317 Hz   4:3    37.879 kHz  40.000 MHz
    DMT 0x10:  1024x768    60.004 Hz   4:3    48.363 kHz  65.000 MHz
  Standard Timings:
    DMT 0x15:  1152x864    75.000 Hz   4:3    67.500 kHz 108.000 MHz
    DMT 0x23:  1280x1024   60.020 Hz   5:4    63.981 kHz 108.000 MHz
    DMT 0x3a:  1680x1050   59.954 Hz  16:10   65.290 kHz 146.250 MHz
    DMT 0x52:  1920x1080   60.000 Hz  16:9    67.500 kHz 148.500 MHz
    GTF     :  1360x768    60.000 Hz  16:9    47.700 kHz  84.715 MHz
  Detailed Timing Descriptors:
    DTD 1:  1920x1080   60.000 Hz  16:9    67.500 kHz 148.500 MHz (480 mm x 270 mm)
                 Hfront   88 Hsync  44 Hback 148 Hpol P
                 Vfront    4 Vsync   5 Vback  36 Vpol P
    Display Product Serial Number: ...
    Display Product Name: 'CCE TV'
  Display Range Limits:
    Monitor ranges (GTF): 56-76 Hz V, 30-83 kHz H, max dotclock 160 MHz
Checksum: 0x6d

----------------

Failures:

Block 0, Base EDID:
  Basic Display Parameters & Features: sRGB is signaled, but the chromaticities do not match.
  Detailed Timing Descriptor #1: Mismatch of image size 480x270 mm vs display size 430x270 mm.
  Display Product Name: Non-space after newline.

EDID conformity: FAIL
