edid-decode (hex):

00 ff ff ff ff ff ff 00 06 af 24 60 00 00 00 00
01 12 01 03 80 1d 12 78 0a 50 c5 98 58 52 8e 27
25 50 54 00 00 00 01 01 01 01 01 01 01 01 01 01
01 01 01 01 01 01 12 1b 00 87 50 20 10 30 30 20
36 00 1e b2 10 00 00 18 00 00 00 0f 00 00 00 00
00 00 00 00 00 00 00 00 00 20 00 00 00 fe 00 41
55 4f 0a 20 20 20 20 20 20 20 20 20 00 00 00 fe
00 42 31 33 33 45 57 30 36 20 56 30 20 0a 00 d9

----------------

Block 0, Base EDID:
  EDID Structure Version & Revision: 1.3
  Vendor & Product Identification:
    Manufacturer: AUO
    Model: 24612
    Made in: week 1 of 2008
  Basic Display Parameters & Features:
    Digital display
    Maximum image size: 29 cm x 18 cm
    Gamma: 2.20
    RGB color display
    First detailed timing is preferred timing
  Color Characteristics:
    Red  : 0.5947, 0.3447
    Green: 0.3203, 0.5546
    Blue : 0.1552, 0.1445
    White: 0.3134, 0.3291
  Established Timings I & II: none
  Standard Timings: none
  Detailed Timing Descriptors:
    DTD 1:  1280x800    60.019 Hz   8:5    48.975 kHz  69.300 MHz (286 mm x 178 mm)
                 Hfront   48 Hsync  32 Hback  55 Hpol N
                 Vfront    3 Vsync   6 Vback   7 Vpol N
    Manufacturer-Specified Display Descriptor (0x0f): 00 0f 00 00 00 00 00 00 00 00 00 00 00 00 00 20 '............... '
    Alphanumeric Data String: 'AUO'
    Alphanumeric Data String: 'B133EW06 V0 '
Checksum: 0xd9
