edid-decode (hex):

00 ff ff ff ff ff ff 00 59 25 50 18 01 00 00 00
25 17 01 03 00 25 1d 78 ee 5a d5 a7 56 4b 9b 24
13 50 54 ad cf 00 81 00 81 80 81 8a 81 8f 45 4a
01 01 01 01 01 01 00 1e 56 ea 50 00 20 30 28 46
55 00 58 c2 10 00 00 1a 00 00 00 fd 00 3b 4b 1e
3c 08 00 0a 20 20 20 20 20 20 66 21 50 b0 51 00
1b 30 40 70 36 00 9e 01 11 00 00 1e 00 00 00 fc
00 41 2f 47 31 39 35 36 0a 0a 0a 0a 0a 0a 00 4d

----------------

Block 0, Base EDID:
  EDID Structure Version & Revision: 1.3
  Vendor & Product Identification:
    Manufacturer: VIE
    Model: 6224
    Serial Number: ...
    Made in: week 37 of 2013
  Basic Display Parameters & Features:
    Analog display
    Input voltage level: 0.7/0.3 V
    Blank level equals black level
    Maximum image size: 37 cm x 29 cm
    Gamma: 2.20
    DPMS levels: Standby Suspend Off
    RGB color display
    Default (sRGB) color space is primary color space
    First detailed timing is the preferred timing
  Color Characteristics:
    Red  : 0.6533, 0.3369
    Green: 0.2949, 0.6074
    Blue : 0.1435, 0.0751
    White: 0.3134, 0.3291
  Established Timings I & II:
    IBM     :   720x400    70.082 Hz   9:5    31.467 kHz  28.320 MHz
    DMT 0x04:   640x480    59.940 Hz   4:3    31.469 kHz  25.175 MHz
    DMT 0x05:   640x480    72.809 Hz   4:3    37.861 kHz  31.500 MHz
    DMT 0x06:   640x480    75.000 Hz   4:3    37.500 kHz  31.500 MHz
    DMT 0x09:   800x600    60.317 Hz   4:3    37.879 kHz  40.000 MHz
    DMT 0x0a:   800x600    72.188 Hz   4:3    48.077 kHz  50.000 MHz
    DMT 0x0b:   800x600    75.000 Hz   4:3    46.875 kHz  49.500 MHz
    DMT 0x10:  1024x768    60.004 Hz   4:3    48.363 kHz  65.000 MHz
    DMT 0x11:  1024x768    70.069 Hz   4:3    56.476 kHz  75.000 MHz
    DMT 0x12:  1024x768    75.029 Hz   4:3    60.023 kHz  78.750 MHz
    DMT 0x24:  1280x1024   75.025 Hz   5:4    79.976 kHz 135.000 MHz
  Standard Timings:
    DMT 0x1c:  1280x800    59.810 Hz  16:10   49.702 kHz  83.500 MHz
    DMT 0x23:  1280x1024   60.020 Hz   5:4    63.981 kHz 108.000 MHz
    GTF     :  1280x1024   70.000 Hz   5:4    74.620 kHz 128.943 MHz
    DMT 0x24:  1280x1024   75.025 Hz   5:4    79.976 kHz 135.000 MHz
    GTF     :   800x600    70.000 Hz   4:3    43.750 kHz  45.500 MHz
  Detailed Timing Descriptors:
    DTD 1:  1366x768    60.000 Hz 683:384  48.000 kHz  76.800 MHz (344 mm x 194 mm)
                 Hfront   40 Hsync  70 Hback 124 Hpol P
                 Vfront    5 Vsync   5 Vback  22 Vpol N
  Display Range Limits:
    Monitor ranges (GTF): 59-75 Hz V, 30-60 kHz H, max dotclock 80 MHz
    DTD 2:  1360x768    60.015 Hz  85:48   47.712 kHz  85.500 MHz (414 mm x 257 mm)
                 Hfront   64 Hsync 112 Hback 256 Hpol P
                 Vfront    3 Vsync   6 Vback  18 Vpol P
    Display Product Name: 'A/G1956'
Checksum: 0x4d

----------------

Failures:

Block 0, Base EDID:
  Basic Display Parameters & Features: sRGB is signaled, but the chromaticities do not match.
  Detailed Timing Descriptor #1: Mismatch of image size 344x194 mm vs display size 370x290 mm.
  Detailed Timing Descriptor #2: Mismatch of image size 414x257 mm vs display size 370x290 mm.
  Detailed Timing Descriptor #2: Invalid detailed timing descriptor ordering.
  Display Product Name: Non-space after newline.
EDID:
  Base EDID: Some timings are out of range of the Monitor Ranges:
    Horizontal Freq: 31.466 - 79.976 kHz (Monitor: 30.000 - 60.000 kHz)
    Maximum Clock: 135.000 MHz (Monitor: 80.000 MHz)

EDID conformity: FAIL
