
EDID (hex):
00ffffffffffff005044203100000000
241a01030a221378eaccef9d57519928
154f53bfee00810081c0614601010101
010101010101662156aa51001e30468f
330058c11000001e000000ff00303030
310a2020202020202020000000fd0038
4b1e3d0b000a202020202020000000fc
005647410a20202020202020202000b3

edid-decode (hex):

00 ff ff ff ff ff ff 00 50 44 20 31 00 00 00 00
24 1a 01 03 0a 22 13 78 ea cc ef 9d 57 51 99 28
15 4f 53 bf ee 00 81 00 81 c0 61 46 01 01 01 01
01 01 01 01 01 01 66 21 56 aa 51 00 1e 30 46 8f
33 00 58 c1 10 00 00 1e 00 00 00 ff 00 30 30 30
31 0a 20 20 20 20 20 20 20 20 00 00 00 fd 00 38
4b 1e 3d 0b 00 0a 20 20 20 20 20 20 00 00 00 fc
00 56 47 41 0a 20 20 20 20 20 20 20 20 20 00 b3

----------------

Block 0, Base EDID:
  EDID Structure Version & Revision: 1.3
  Vendor & Product Identification:
    Manufacturer: TBD
    Model: 12576
    Made in: week 36 of 2016
  Basic Display Parameters & Features:
    Analog display
    Signal Level Standard: 0.700 : 0.300 : 1.000 V p-p
    Blank level equals black level
    Sync: Separate SyncOnGreen
    Maximum image size: 34 cm x 19 cm
    Gamma: 2.20
    DPMS levels: Standby Suspend Off
    RGB color display
    First detailed timing is the preferred timing
  Color Characteristics:
    Red  : 0.6162, 0.3398
    Green: 0.3193, 0.5976
    Blue : 0.1591, 0.0839
    White: 0.3115, 0.3271
  Established Timings I & II:
    IBM     :   720x400    70.081663 Hz   9:5     31.467 kHz     28.320000 MHz
    DMT 0x04:   640x480    59.940476 Hz   4:3     31.469 kHz     25.175000 MHz
    Apple   :   640x480    66.666667 Hz   4:3     35.000 kHz     30.240000 MHz
    DMT 0x05:   640x480    72.808802 Hz   4:3     37.861 kHz     31.500000 MHz
    DMT 0x06:   640x480    75.000000 Hz   4:3     37.500 kHz     31.500000 MHz
    DMT 0x08:   800x600    56.250000 Hz   4:3     35.156 kHz     36.000000 MHz
    DMT 0x09:   800x600    60.316541 Hz   4:3     37.879 kHz     40.000000 MHz
    DMT 0x0a:   800x600    72.187572 Hz   4:3     48.077 kHz     50.000000 MHz
    DMT 0x0b:   800x600    75.000000 Hz   4:3     46.875 kHz     49.500000 MHz
    Apple   :   832x624    74.551266 Hz   4:3     49.726 kHz     57.284000 MHz
    DMT 0x10:  1024x768    60.003840 Hz   4:3     48.363 kHz     65.000000 MHz
    DMT 0x11:  1024x768    70.069359 Hz   4:3     56.476 kHz     75.000000 MHz
    DMT 0x12:  1024x768    75.028582 Hz   4:3     60.023 kHz     78.750000 MHz
  Standard Timings:
    DMT 0x1c:  1280x800    59.810326 Hz  16:10    49.702 kHz     83.500000 MHz
    DMT 0x55:  1280x720    60.000000 Hz  16:9     45.000 kHz     74.250000 MHz
    GTF     :  1024x768    65.999558 Hz   4:3     52.668 kHz     71.628000 MHz
  Detailed Timing Descriptors:
    DTD 1:  1366x768    59.789541 Hz 683:384   47.712 kHz     85.500000 MHz (344 mm x 193 mm)
                 Hfront   70 Hsync 143 Hback  213 Hpol P
                 Vfront    3 Vsync   3 Vback   24 Vpol P
    Display Product Serial Number: '0001'
    Display Range Limits:
      Monitor ranges (GTF): 56-75 Hz V, 30-61 kHz H, max dotclock 110 MHz
    Display Product Name: 'VGA'
Checksum: 0xb3


