
EDID (hex):
00ffffffffffff0030e4280200000000
00130103802313780a1be59e59509826
0e505400000001010101010101010101
0101010101011c2a4040618424303020
350059c2100000190000000000000000
00000000000000000000000000fe004c
4720446973706c61790a2020000000fe
004c503135365744312d544c443200d4

Extracted contents:
header:          00 ff ff ff ff ff ff 00
serial number:   30 e4 28 02 00 00 00 00 00 13
version:         01 03
basic params:    80 23 13 78 0a
chroma info:     1b e5 9e 59 50 98 26 0e 50 54
established:     00 00 00
standard:        01 01 01 01 01 01 01 01 01 01 01 01 01 01 01 01
descriptor 1:    1c 2a 40 40 61 84 24 30 30 20 35 00 59 c2 10 00 00 19
descriptor 2:    00 00 00 00 00 00 00 00 00 00 00 00 00 00 00 00 00 00
descriptor 3:    00 00 00 fe 00 4c 47 20 44 69 73 70 6c 61 79 0a 20 20
descriptor 4:    00 00 00 fe 00 4c 50 31 35 36 57 44 31 2d 54 4c 44 32
extensions:      00
checksum:        d4

EDID version: 1.3
Manufacturer: LGD Model 228 Serial Number --
Made in year 2009
Digital display
Maximum image size: 35 cm x 19 cm
Gamma: 2.20
RGB color display
First detailed timing is preferred timing
Display x,y Chromaticity:
  Red:   0.6171, 0.3486
  Green: 0.3144, 0.5966
  Blue:  0.1513, 0.0566
  White: 0.3134, 0.3291
Established timings supported:
Standard timings supported:
Detailed mode: Clock 107.800 MHz, 345 mm x 194 mm
               1600 1648 1680 1920 hborder 0
                900  903  908  936 vborder 0
               -hsync -vsync 
               VertFreq: 59 Hz, HorFreq: 56145 Hz
Manufacturer-specified data, tag 0
ASCII string: LG Display
ASCII string: LP156WD1-TLD2
Checksum: 0xd4 (valid)
EDID block does NOT conform to EDID 1.3!
	Missing name descriptor
	Missing monitor ranges
