edid-decode (hex):

00 ff ff ff ff ff ff 00 30 ae 50 40 00 00 00 00
01 10 01 03 80 21 15 78 ea 1c f5 97 58 50 8e 27
27 50 54 00 00 00 01 01 01 01 01 01 01 01 01 01
01 01 01 01 01 01 f4 1a 00 81 50 20 10 30 30 20
36 00 4b cf 10 00 00 18 76 16 00 81 50 20 10 30
30 20 36 00 4b cf 10 00 00 18 00 00 00 0f 00 81
0a 32 81 0a 28 14 01 00 06 af 74 24 00 00 00 fe
00 42 31 35 34 45 57 30 32 20 56 36 20 0a 00 70

----------------

Block 0, Base EDID:
  EDID Structure Version & Revision: 1.3
  Vendor & Product Identification:
    Manufacturer: LEN
    Model: 16464
    Made in: week 1 of 2006
  Basic Display Parameters & Features:
    Digital display
    Maximum image size: 33 cm x 21 cm
    Gamma: 2.20
    DPMS levels: Standby Suspend Off
    RGB color display
    First detailed timing is the preferred timing
  Color Characteristics:
    Red  : 0.5898, 0.3447
    Green: 0.3154, 0.5546
    Blue : 0.1552, 0.1552
    White: 0.3134, 0.3291
  Established Timings I & II: none
  Standard Timings: none
  Detailed Timing Descriptors:
    DTD 1:  1280x800    60.013 Hz   8:5    48.971 kHz  69.000 MHz (331 mm x 207 mm)
                 Hfront   48 Hsync  32 Hback  49 Hpol N
                 Vfront    3 Vsync   6 Vback   7 Vpol N
    DTD 2:  1280x800    50.011 Hz   8:5    40.809 kHz  57.500 MHz (331 mm x 207 mm)
                 Hfront   48 Hsync  32 Hback  49 Hpol N
                 Vfront    3 Vsync   6 Vback   7 Vpol N
    Manufacturer-Specified Display Descriptor (0x0f): 00 0f 00 81 0a 32 81 0a 28 14 01 00 06 af 74 24 '.....2..(.....t$'
    Alphanumeric Data String: 'B154EW02 V6 '
Checksum: 0x70

----------------

Failures:

Block 0, Base EDID:
  Alphanumeric Data String: One or more trailing spaces.
  Missing Display Product Name.
  Missing Display Range Limits Descriptor.

EDID conformity: FAIL
