edid-decode (hex):

00 ff ff ff ff ff ff 00 30 ae 50 40 00 00 00 00
28 11 01 03 80 21 15 78 ea 07 f5 9a 57 4e 87 26
1e 50 54 00 00 00 01 01 01 01 01 01 01 01 01 01
01 01 01 01 01 01 12 1b 00 7d 50 20 16 30 30 20
36 00 4b cf 10 00 00 18 8f 16 00 7d 50 20 16 30
30 20 36 00 4b cf 10 00 00 18 00 00 00 0f 00 81
0a 32 81 0a 28 14 01 00 0d af 53 15 00 00 00 fe
00 4e 31 35 34 49 33 2d 4c 30 32 0a 20 20 00 82

----------------

Block 0, Base EDID:
  EDID Structure Version & Revision: 1.3
  Vendor & Product Identification:
    Manufacturer: LEN
    Model: 16464
    Made in: week 40 of 2007
  Basic Display Parameters & Features:
    Digital display
    Maximum image size: 33 cm x 21 cm
    Gamma: 2.20
    DPMS levels: Standby Suspend Off
    RGB color display
    First detailed timing is the preferred timing
  Color Characteristics:
    Red  : 0.6015, 0.3398
    Green: 0.3056, 0.5302
    Blue : 0.1513, 0.1201
    White: 0.3134, 0.3291
  Established Timings I & II: none
  Standard Timings: none
  Detailed Timing Descriptors:
    DTD 1:  1280x800    60.005 Hz   8:5    49.324 kHz  69.300 MHz (331 mm x 207 mm)
                 Hfront   48 Hsync  32 Hback  45 Hpol N
                 Vfront    3 Vsync   6 Vback  13 Vpol N
    DTD 2:  1280x800    50.004 Hz   8:5    41.103 kHz  57.750 MHz (331 mm x 207 mm)
                 Hfront   48 Hsync  32 Hback  45 Hpol N
                 Vfront    3 Vsync   6 Vback  13 Vpol N
    Manufacturer-Specified Display Descriptor (0x0f): 00 0f 00 81 0a 32 81 0a 28 14 01 00 0d af 53 15 '.....2..(.....S.'
    Alphanumeric Data String: 'N154I3-L02'
Checksum: 0x82

----------------

Failures:

Block 0, Base EDID:
  Missing Display Product Name.
  Missing Display Range Limits Descriptor.

EDID conformity: FAIL
