edid-decode (hex):

00 ff ff ff ff ff ff 00 30 ae 50 40 00 00 00 00
00 12 01 03 80 21 15 78 ea 03 15 97 57 52 8c 27
21 50 54 00 00 00 01 01 01 01 01 01 01 01 01 01
01 01 01 01 01 01 8a 1b 00 a0 50 20 10 30 30 20
36 00 4b cf 10 00 00 19 f3 16 00 a0 50 20 10 30
30 20 36 00 4b cf 10 00 00 19 00 00 00 0f 00 81
0a 32 81 0a 28 14 01 00 4c a3 41 54 00 00 00 fe
00 4c 54 4e 31 35 34 41 54 30 37 4a 30 31 00 65

----------------

Block 0, Base EDID:
  EDID Structure Version & Revision: 1.3
  Vendor & Product Identification:
    Manufacturer: LEN
    Model: 16464
    Made in: 2008
  Basic Display Parameters & Features:
    Digital display
    Maximum image size: 33 cm x 21 cm
    Gamma: 2.20
    DPMS levels: Standby Suspend Off
    RGB color display
    First detailed timing is the preferred timing
  Color Characteristics:
    Red  : 0.5898, 0.3398
    Green: 0.3203, 0.5498
    Blue : 0.1523, 0.1298
    White: 0.3134, 0.3291
  Established Timings I & II: none
  Standard Timings: none
  Detailed Timing Descriptors:
    DTD 1:  1280x800    59.997958 Hz  16:10    48.958 kHz     70.500000 MHz (331 mm x 207 mm)
                 Hfront   48 Hsync  32 Hback   80 Hpol N
                 Vfront    3 Vsync   6 Vback    7 Vpol N
    DTD 2:  1280x800    49.998298 Hz  16:10    40.799 kHz     58.750000 MHz (331 mm x 207 mm)
                 Hfront   48 Hsync  32 Hback   80 Hpol N
                 Vfront    3 Vsync   6 Vback    7 Vpol N
    Manufacturer-Specified Display Descriptor (0x0f): 00 0f 00 81 0a 32 81 0a 28 14 01 00 4c a3 41 54 '.....2..(...L.AT'
    Alphanumeric Data String: 'LTN154AT07J01'
Checksum: 0x65

----------------

Failures:

Block 0, Base EDID:
  Missing Display Product Name.
  Missing Display Range Limits Descriptor.

EDID conformity: FAIL
