edid-decode (hex):

00 ff ff ff ff ff ff 00 30 ae 50 40 00 00 00 00
00 11 01 03 80 21 15 78 ea b3 40 99 59 53 8d 27
25 50 54 00 00 00 01 01 01 01 01 01 01 01 01 01
01 01 01 01 01 01 bc 1b 00 a0 50 20 17 30 30 20
36 00 4b cf 10 00 00 19 26 17 00 80 50 20 10 30
18 20 36 00 4b cf 10 00 00 19 00 00 00 0f 00 81
0a 32 81 0a 28 14 01 00 32 0c 01 15 00 00 00 fe
00 31 35 34 57 58 34 2d 54 4c 43 36 0a 20 00 be

----------------

Block 0, Base EDID:
  EDID Structure Version & Revision: 1.3
  Vendor & Product Identification:
    Manufacturer: LEN
    Model: 16464
    Made in: 2007
  Basic Display Parameters & Features:
    Digital display
    Maximum image size: 33 cm x 21 cm
    Gamma: 2.20
    DPMS levels: Standby Suspend Off
    RGB color display
    First detailed timing is the preferred timing
  Color Characteristics:
    Red  : 0.5996, 0.3505
    Green: 0.3242, 0.5537
    Blue : 0.1533, 0.1445
    White: 0.3125, 0.3281
  Established Timings I & II: none
  Standard Timings: none
  Detailed Timing Descriptors:
    DTD 1:  1280x800    59.909545 Hz   8:5     49.306 kHz     71.000000 MHz (331 mm x 207 mm)
                 Hfront   48 Hsync  32 Hback   80 Hpol N
                 Vfront    3 Vsync   6 Vback   14 Vpol N
    DTD 2:  1280x800    51.578515 Hz   8:5     42.088 kHz     59.260000 MHz (331 mm x 207 mm)
                 Hfront   24 Hsync  32 Hback   72 Hpol N
                 Vfront    3 Vsync   6 Vback    7 Vpol N
    Manufacturer-Specified Display Descriptor (0x0f): 00 0f 00 81 0a 32 81 0a 28 14 01 00 32 0c 01 15 '.....2..(...2...'
    Alphanumeric Data String: '154WX4-TLC6'
Checksum: 0xbe

----------------

Warnings:

Block 0, Base EDID:
  Detailed Timing Descriptor #1: DTD is similar but not identical to DMT 0x1b.

Failures:

Block 0, Base EDID:
  Missing Display Product Name.
  Missing Display Range Limits Descriptor.

EDID conformity: FAIL
