
EDID (hex):
00ffffffffffff0030ae504000000000
0011010380211578eab3409959538d27
25505400000001010101010101010101
010101010101bc1b00a0502017303020
36004bcf100000192617008050201030
182036004bcf100000190000000f0081
0a32810a28140100320c010b000000fe
003135345758342d544c41360a2000ca

Extracted contents:
header:          00 ff ff ff ff ff ff 00
serial number:   30 ae 50 40 00 00 00 00 00 11
version:         01 03
basic params:    80 21 15 78 ea
chroma info:     b3 40 99 59 53 8d 27 25 50 54
established:     00 00 00
standard:        01 01 01 01 01 01 01 01 01 01 01 01 01 01 01 01
descriptor 1:    bc 1b 00 a0 50 20 17 30 30 20 36 00 4b cf 10 00 00 19
descriptor 2:    26 17 00 80 50 20 10 30 18 20 36 00 4b cf 10 00 00 19
descriptor 3:    00 00 00 0f 00 81 0a 32 81 0a 28 14 01 00 32 0c 01 0b
descriptor 4:    00 00 00 fe 00 31 35 34 57 58 34 2d 54 4c 41 36 0a 20
extensions:      00
checksum:        ca

EDID version: 1.3
Manufacturer: LEN Model 4050 Serial Number --
Made in year 2007
Digital display
Maximum image size: 33 cm x 21 cm
Gamma: 2.20
DPMS levels: Standby Suspend Off
RGB color display
First detailed timing is preferred timing
Display x,y Chromaticity:
  Red:   0.5996, 0.3505
  Green: 0.3242, 0.5537
  Blue:  0.1533, 0.1445
  White: 0.3125, 0.3281
Established timings supported:
Standard timings supported:
Detailed mode: Clock 71.000 MHz, 331 mm x 207 mm
               1280 1328 1360 1440 hborder 0
                800  803  809  823 vborder 0
               -hsync -vsync 
               VertFreq: 59 Hz, HorFreq: 49305 Hz
Detailed mode: Clock 59.260 MHz, 331 mm x 207 mm
               1280 1304 1336 1408 hborder 0
                800  803  809  816 vborder 0
               -hsync -vsync 
               VertFreq: 51 Hz, HorFreq: 42088 Hz
Manufacturer-specified data, tag 15
ASCII string: 154WX4-TLA6
Checksum: 0xca (valid)
EDID block does NOT conform to EDID 1.3!
	Missing name descriptor
	Missing monitor ranges
