edid-decode (hex):

00 ff ff ff ff ff ff 00 30 ae 50 40 00 00 00 00
00 10 01 03 80 21 15 78 ea b3 70 99 59 53 8d 27
23 50 54 00 00 00 01 01 01 01 01 01 01 01 01 01
01 01 01 01 01 01 c7 1b 00 a0 50 20 17 30 30 20
36 00 4b cf 10 00 00 19 26 17 00 a0 50 20 17 30
30 20 36 00 4b cf 10 00 00 19 00 00 00 0f 00 81
0a 32 81 0a 28 14 01 00 32 0c 00 00 00 00 00 fe
00 31 35 34 57 30 31 2d 54 4c 45 35 0a 20 00 87

----------------

Block 0, Base EDID:
  EDID Structure Version & Revision: 1.3
  Vendor & Product Identification:
    Manufacturer: LEN
    Model: 16464
    Made in: 2006
  Basic Display Parameters & Features:
    Digital display
    Maximum image size: 33 cm x 21 cm
    Gamma: 2.20
    DPMS levels: Standby Suspend Off
    RGB color display
    First detailed timing is the preferred timing
  Color Characteristics:
    Red  : 0.5996, 0.3505
    Green: 0.3242, 0.5537
    Blue : 0.1533, 0.1396
    White: 0.3125, 0.3281
  Established Timings I & II: none
  Standard Timings: none
  Detailed Timing Descriptors:
    DTD 1:  1280x800    60.002363 Hz   8:5     49.382 kHz     71.110000 MHz (331 mm x 207 mm)
                 Hfront   48 Hsync  32 Hback   80 Hpol N
                 Vfront    3 Vsync   6 Vback   14 Vpol N
    DTD 2:  1280x800    50.003375 Hz   8:5     41.153 kHz     59.260000 MHz (331 mm x 207 mm)
                 Hfront   48 Hsync  32 Hback   80 Hpol N
                 Vfront    3 Vsync   6 Vback   14 Vpol N
    Manufacturer-Specified Display Descriptor (0x0f): 00 0f 00 81 0a 32 81 0a 28 14 01 00 32 0c 00 00 '.....2..(...2...'
    Alphanumeric Data String: '154W01-TLE5'
Checksum: 0x87

----------------

Failures:

Block 0, Base EDID:
  Missing Display Product Name.
  Missing Display Range Limits Descriptor.

EDID conformity: FAIL
