edid-decode (hex):

00 ff ff ff ff ff ff 00 3e 4e 00 00 00 00 00 00
01 19 01 03 80 35 1e 00 8a ee 95 a3 54 4c 99 26
0f 50 54 a5 4e 00 01 01 01 01 01 01 01 01 01 01
01 01 01 01 01 01 02 3a 80 18 71 38 2d 40 58 2c
45 00 3f 43 21 00 00 1a 00 00 00 fd 00 18 55 0f
50 10 00 0a 20 20 20 20 20 20 00 00 00 fc 00 43
4c 42 32 34 42 34 37 30 44 53 0a 20 00 00 00 00
00 00 00 00 00 00 00 00 00 00 00 00 00 00 01 df

02 03 2a 74 50 90 05 04 03 07 02 06 01 1f 14 13
12 16 11 15 20 29 09 07 03 15 07 3c 55 07 3c 83
01 00 00 66 03 0c 00 10 00 00 01 1d 00 bc 52 d0
1e 20 b8 28 55 40 c4 8e 21 00 00 1e 01 1d 80 d0
72 1c 16 20 10 2c 25 80 c4 8e 21 00 00 9e 8c 0a
d0 8a 20 e0 2d 10 10 3e 96 00 13 8e 21 00 00 18
8c 0a d0 90 20 40 31 20 0c 40 55 00 13 8e 21 00
00 18 00 00 00 00 00 00 00 00 00 00 00 00 00 07

----------------

Block 0, Base EDID:
  EDID Structure Version & Revision: 1.3
  Vendor & Product Identification:
    Manufacturer: ORN
    Model: 0
    Made in: week 1 of 2015
  Basic Display Parameters & Features:
    Digital display
    Maximum image size: 53 cm x 30 cm
    Gamma: 1.00
    DPMS levels: Standby
    RGB color display
    First detailed timing is the preferred timing
  Color Characteristics:
    Red  : 0.6396, 0.3300
    Green: 0.2998, 0.5996
    Blue : 0.1503, 0.0595
    White: 0.3134, 0.3291
  Established Timings I & II:
    IBM     :   720x400    70.082 Hz   9:5    31.467 kHz  28.320 MHz
    DMT 0x04:   640x480    59.940 Hz   4:3    31.469 kHz  25.175 MHz
    DMT 0x06:   640x480    75.000 Hz   4:3    37.500 kHz  31.500 MHz
    DMT 0x09:   800x600    60.317 Hz   4:3    37.879 kHz  40.000 MHz
    DMT 0x0b:   800x600    75.000 Hz   4:3    46.875 kHz  49.500 MHz
    DMT 0x10:  1024x768    60.004 Hz   4:3    48.363 kHz  65.000 MHz
    DMT 0x11:  1024x768    70.069 Hz   4:3    56.476 kHz  75.000 MHz
    DMT 0x12:  1024x768    75.029 Hz   4:3    60.023 kHz  78.750 MHz
  Standard Timings: none
  Detailed Timing Descriptors:
    DTD 1:  1920x1080   60.000 Hz  16:9    67.500 kHz 148.500 MHz (575 mm x 323 mm)
                 Hfront   88 Hsync  44 Hback 148 Hpol P
                 Vfront    4 Vsync   5 Vback  36 Vpol N
  Display Range Limits:
    Monitor ranges (GTF): 24-85 Hz V, 15-80 kHz H, max dotclock 160 MHz
    Display Product Name: 'CLB24B470DS'
    Empty Descriptor
  Extension blocks: 1
Checksum: 0xdf

----------------

Block 1, CTA-861 Extension Block:
  Revision: 3
  Basic audio support
  Supports YCbCr 4:4:4
  Supports YCbCr 4:2:2
  Native detailed modes: 4
  Video Data Block:
    VIC  16:  1920x1080   60.000 Hz  16:9    67.500 kHz 148.500 MHz (native)
    VIC   5:  1920x1080i  60.000 Hz  16:9    33.750 kHz  74.250 MHz
    VIC   4:  1280x720    60.000 Hz  16:9    45.000 kHz  74.250 MHz
    VIC   3:   720x480    59.940 Hz  16:9    31.469 kHz  27.000 MHz
    VIC   7:  1440x480i   59.940 Hz  16:9    15.734 kHz  27.000 MHz
    VIC   2:   720x480    59.940 Hz   4:3    31.469 kHz  27.000 MHz
    VIC   6:  1440x480i   59.940 Hz   4:3    15.734 kHz  27.000 MHz
    VIC   1:   640x480    59.940 Hz   4:3    31.469 kHz  25.175 MHz
    VIC  31:  1920x1080   50.000 Hz  16:9    56.250 kHz 148.500 MHz
    VIC  20:  1920x1080i  50.000 Hz  16:9    28.125 kHz  74.250 MHz
    VIC  19:  1280x720    50.000 Hz  16:9    37.500 kHz  74.250 MHz
    VIC  18:   720x576    50.000 Hz  16:9    31.250 kHz  27.000 MHz
    VIC  22:  1440x576i   50.000 Hz  16:9    15.625 kHz  27.000 MHz
    VIC  17:   720x576    50.000 Hz   4:3    31.250 kHz  27.000 MHz
    VIC  21:  1440x576i   50.000 Hz   4:3    15.625 kHz  27.000 MHz
    VIC  32:  1920x1080   24.000 Hz  16:9    27.000 kHz  74.250 MHz
  Audio Data Block:
    Linear PCM:
      Max channels: 2
      Supported sample rates (kHz): 48 44.1 32
      Supported sample sizes (bits): 20 16
    AC-3:
      Max channels: 6
      Supported sample rates (kHz): 48 44.1 32
      Maximum bit rate: 480 kb/s
    Enhanced AC-3 (DD+):
      Max channels: 6
      Supported sample rates (kHz): 48 44.1 32
  Speaker Allocation Data Block:
    FL/FR - Front Left/Right
  Vendor-Specific Data Block (HDMI), OUI 00-0C-03:
    Source physical address: 1.0.0.0
  Detailed Timing Descriptors:
    DTD 2:  1280x720    50.000 Hz  16:9    37.500 kHz  74.250 MHz (708 mm x 398 mm)
                 Hfront  440 Hsync  40 Hback 220 Hpol P
                 Vfront    5 Vsync   5 Vback  20 Vpol P
    DTD 3:  1920x1080i  50.000 Hz  16:9    28.125 kHz  74.250 MHz (708 mm x 398 mm)
                 Hfront  528 Hsync  44 Hback 148 Hpol P
                 Vfront    2 Vsync   5 Vback  15 Vpol P Vfront +0.5 Odd Field
                 Vfront    2 Vsync   5 Vback  15 Vpol P Vback  +0.5 Even Field
    DTD 4:   720x480    59.940 Hz   3:2    31.469 kHz  27.000 MHz (531 mm x 398 mm)
                 Hfront   16 Hsync  62 Hback  60 Hpol N
                 Vfront    9 Vsync   6 Vback  30 Vpol N
    DTD 5:   720x576    50.000 Hz   5:4    31.250 kHz  27.000 MHz (531 mm x 398 mm)
                 Hfront   12 Hsync  64 Hback  68 Hpol N
                 Vfront    5 Vsync   5 Vback  39 Vpol N
Checksum: 0x07

----------------

Warnings:

Block 1, CTA-861 Extension Block:
  IT Video Formats are overscanned by default, but normally this should be underscanned.
  Missing VCDB, needed for Set Selectable RGB Quantization to avoid interop issues.

Failures:

Block 0, Base EDID:
  Detailed Timing Descriptor #1: Mismatch of image size 575x323 mm vs display size 530x300 mm.
  Empty Descriptor: Use Dummy Descriptor instead of all zeroes.
Block 1, CTA-861 Extension Block:
  Detailed Timing Descriptor #2: Mismatch of image size 708x398 mm vs display size 530x300 mm.
  Detailed Timing Descriptor #3: Mismatch of image size 708x398 mm vs display size 530x300 mm.
  Detailed Timing Descriptor #4: Mismatch of image size 531x398 mm vs display size 530x300 mm.
  Detailed Timing Descriptor #5: Mismatch of image size 531x398 mm vs display size 530x300 mm.
EDID:
  CTA-861: Native progressive timings are a mix of several resolutions.

EDID conformity: FAIL
