edid-decode (hex):

00 ff ff ff ff ff ff 00 10 ac 14 a0 4c 59 48 30
02 10 01 04 68 22 1b 78 ee ca f6 a3 57 47 9e 23
11 4f 54 a5 4b 00 71 4f 81 80 01 01 01 01 01 01
01 01 01 01 01 01 30 2a 00 98 51 00 2a 40 30 70
13 00 52 0e 11 00 00 1e 00 00 00 fd 00 38 4b 1f
50 0e 00 0a 20 20 20 20 20 20 00 00 00 ff 00 43
43 36 33 39 36 31 39 30 48 59 4c 0a 00 00 00 fc
00 44 45 4c 4c 20 45 31 37 36 46 50 0a 20 00 a0

00 ff ff ff ff ff ff 00 10 ac 14 a0 4c 59 48 30
02 10 01 04 68 22 1b 78 ee ca f6 a3 57 47 9e 23
11 4f 54 a5 4b 00 71 4f 81 80 01 01 01 01 01 01
01 01 01 01 01 01 30 2a 00 98 51 00 2a 40 30 70
13 00 52 0e 11 00 00 1e 00 00 00 fd 00 38 4b 1f
50 0e 00 0a 20 20 20 20 20 20 00 00 00 ff 00 43
43 36 33 39 36 31 39 30 48 59 4c 0a 00 00 00 fc
00 44 45 4c 4c 20 45 31 37 36 46 50 0a 20 00 a0

----------------

Block 0, Base EDID:
  EDID Structure Version & Revision: 1.4
  Vendor & Product Identification:
    Manufacturer: DEL
    Model: 40980
    Serial Number: ...
    Made in: week 2 of 2006
  Basic Display Parameters & Features:
    Analog display
    Signal Level Standard: 0.700 : 0.000 : 0.700 V p-p
    Blank level equals black level
    Sync: Separate
    Maximum image size: 34 cm x 27 cm
    Gamma: 2.20
    DPMS levels: Standby Suspend Off
    RGB color display
    Default (sRGB) color space is primary color space
    First detailed timing includes the native pixel format and preferred refresh rate
  Color Characteristics:
    Red  : 0.6396, 0.3398
    Green: 0.2792, 0.6191
    Blue : 0.1396, 0.0693
    White: 0.3095, 0.3300
  Established Timings I & II:
    IBM     :   720x400    70.081663 Hz   9:5     31.467 kHz     28.320000 MHz
    DMT 0x04:   640x480    59.940476 Hz   4:3     31.469 kHz     25.175000 MHz
    DMT 0x06:   640x480    75.000000 Hz   4:3     37.500 kHz     31.500000 MHz
    DMT 0x09:   800x600    60.316541 Hz   4:3     37.879 kHz     40.000000 MHz
    DMT 0x0b:   800x600    75.000000 Hz   4:3     46.875 kHz     49.500000 MHz
    DMT 0x10:  1024x768    60.003840 Hz   4:3     48.363 kHz     65.000000 MHz
    DMT 0x12:  1024x768    75.028582 Hz   4:3     60.023 kHz     78.750000 MHz
    DMT 0x24:  1280x1024   75.024675 Hz   5:4     79.976 kHz    135.000000 MHz
  Standard Timings:
    DMT 0x15:  1152x864    75.000000 Hz   4:3     67.500 kHz    108.000000 MHz
    DMT 0x23:  1280x1024   60.019740 Hz   5:4     63.981 kHz    108.000000 MHz
  Detailed Timing Descriptors:
    DTD 1:  1280x1024   60.019740 Hz   5:4     63.981 kHz    108.000000 MHz (338 mm x 270 mm)
                 Hfront   48 Hsync 112 Hback  248 Hpol P
                 Vfront    1 Vsync   3 Vback   38 Vpol P
    Display Range Limits:
      Monitor ranges (GTF): 56-75 Hz V, 31-80 kHz H, max dotclock 140 MHz
    Display Product Serial Number: ...
    Display Product Name: 'DELL E176FP'
Checksum: 0xa0

----------------

Block 1, Unknown EDID Extension Block 0x00:
  00 ff ff ff ff ff ff 00 10 ac 14 a0 4c 59 48 30 '............LYH0'
  02 10 01 04 68 22 1b 78 ee ca f6 a3 57 47 9e 23 '....h".x....WG.#'
  11 4f 54 a5 4b 00 71 4f 81 80 01 01 01 01 01 01 '.OT.K.qO........'
  01 01 01 01 01 01 30 2a 00 98 51 00 2a 40 30 70 '......0*..Q.*@0p'
  13 00 52 0e 11 00 00 1e 00 00 00 fd 00 38 4b 1f '..R..........8K.'
  50 0e 00 0a 20 20 20 20 20 20 00 00 00 ff 00 43 'P...      .....C'
  43 36 33 39 36 31 39 30 48 59 4c 0a 00 00 00 fc 'C6396190HYL.....'
  00 44 45 4c 4c 20 45 31 37 36 46 50 0a 20 00 a0 '.DELL E176FP. ..'
Checksum: 0xa0

----------------

Warnings:

Block 0, Base EDID:
  Display Range Limits: GTF support is deprecated in EDID 1.4.

Failures:

Block 0, Base EDID:
  Basic Display Parameters & Features: sRGB is signaled, but the chromaticities do not match.
  Display Range Limits: GTF can't be combined with non-continuous frequencies.
Block 1, Base EDID:
  Unknown Extension Block.
EDID:
  Base EDID: EDID specified 0 extension block(s), but found 1 extension block(s).

EDID conformity: FAIL
