
EDID (hex):
00ffffffffffff000610f49c02010101
01140103801a0e780a50c59858528e27
25505400000001010101010101010101
010101010101201c5686500020300e38
13000090100000180000000100061030
00000000000000000a20000000fe0042
313136585730352056300a20000000fe
00436f6c6f72204c43440a20202000e3

Extracted contents:
header:          00 ff ff ff ff ff ff 00
serial number:   06 10 f4 9c 02 01 01 01 01 14
version:         01 03
basic params:    80 1a 0e 78 0a
chroma info:     50 c5 98 58 52 8e 27 25 50 54
established:     00 00 00
standard:        01 01 01 01 01 01 01 01 01 01 01 01 01 01 01 01
descriptor 1:    20 1c 56 86 50 00 20 30 0e 38 13 00 00 90 10 00 00 18
descriptor 2:    00 00 00 01 00 06 10 30 00 00 00 00 00 00 00 00 0a 20
descriptor 3:    00 00 00 fe 00 42 31 31 36 58 57 30 35 20 56 30 0a 20
descriptor 4:    00 00 00 fe 00 43 6f 6c 6f 72 20 4c 43 44 0a 20 20 20
extensions:      00
checksum:        e3

EDID version: 1.3
Manufacturer: APP Model 9cf4 Serial Number --
Made in week 1 of 2010
Digital display
Maximum image size: 26 cm x 14 cm
Gamma: 2.20
RGB color display
First detailed timing is preferred timing
Display x,y Chromaticity:
  Red:   0.5947, 0.3447
  Green: 0.3203, 0.5546
  Blue:  0.1552, 0.1445
  White: 0.3134, 0.3291
Established timings supported:
Standard timings supported:
Detailed mode: Clock 72.000 MHz, 256 mm x 144 mm
               1366 1380 1436 1500 hborder 0
                768  769  772  800 vborder 0
               -hsync -vsync 
               VertFreq: 60 Hz, HorFreq: 48000 Hz
Manufacturer-specified data, tag 1
ASCII string: B116XW05 V0
ASCII string: Color LCD
Checksum: 0xe3 (valid)
EDID block does NOT conform to EDID 1.3!
	Missing name descriptor
	Missing monitor ranges
