edid-decode (hex):

00 ff ff ff ff ff ff 00 1e 6d 4d 4a f1 09 00 00
03 0c 01 01 0e 24 1b bf e8 9a d9 a1 54 4b 99 24
12 48 4c ff ff 80 31 40 45 59 61 59 81 8f 81 99
a9 4f a9 59 71 4f d6 09 80 a0 20 e0 2d 10 10 60
a2 00 5e 06 11 00 00 1e f9 15 20 f8 30 58 1f 20
20 40 13 00 5e 06 11 00 00 1e 00 00 00 fd 00 32
c8 1e 6b 17 00 0a 20 20 20 20 20 20 00 00 00 fc
00 46 6c 61 74 72 6f 6e 39 31 35 46 54 0a 00 5a

----------------

Block 0, Base EDID:
  EDID Structure Version & Revision: 1.1
  Vendor & Product Identification:
    Manufacturer: GSM
    Model: 19021
    Serial Number: ...
    Made in: week 3 of 2002
  Basic Display Parameters & Features:
    Analog display
    Input voltage level: 0.7/0.3 V
    Blank level equals black level
    Sync: Separate Composite SyncOnGreen
    Maximum image size: 36 cm x 27 cm
    Gamma: 2.91
    DPMS levels: Standby Suspend Off
    RGB color display
  Color Characteristics:
    Red  : 0.6308, 0.3291
    Green: 0.2949, 0.5996
    Blue : 0.1435, 0.0712
    White: 0.2832, 0.2978
  Established Timings I & II:
    IBM     :   720x400    70.082 Hz   9:5    31.467 kHz  28.320 MHz
    IBM     :   720x400    87.850 Hz   9:5    39.444 kHz  35.500 MHz
    DMT 0x04:   640x480    59.940 Hz   4:3    31.469 kHz  25.175 MHz
    Apple   :   640x480    66.667 Hz   4:3    35.000 kHz  30.240 MHz
    DMT 0x05:   640x480    72.809 Hz   4:3    37.861 kHz  31.500 MHz
    DMT 0x06:   640x480    75.000 Hz   4:3    37.500 kHz  31.500 MHz
    DMT 0x08:   800x600    56.250 Hz   4:3    35.156 kHz  36.000 MHz
    DMT 0x09:   800x600    60.317 Hz   4:3    37.879 kHz  40.000 MHz
    DMT 0x0a:   800x600    72.188 Hz   4:3    48.077 kHz  50.000 MHz
    DMT 0x0b:   800x600    75.000 Hz   4:3    46.875 kHz  49.500 MHz
    Apple   :   832x624    74.551 Hz   4:3    49.726 kHz  57.284 MHz
    DMT 0x0f:  1024x768i   86.958 Hz   4:3    35.522 kHz  44.900 MHz
    DMT 0x10:  1024x768    60.004 Hz   4:3    48.363 kHz  65.000 MHz
    DMT 0x11:  1024x768    70.069 Hz   4:3    56.476 kHz  75.000 MHz
    DMT 0x12:  1024x768    75.029 Hz   4:3    60.023 kHz  78.750 MHz
    DMT 0x24:  1280x1024   75.025 Hz   5:4    79.976 kHz 135.000 MHz
    Apple   :  1152x870    75.062 Hz 192:145  68.681 kHz 100.000 MHz
  Standard Timings:
    DMT 0x04:   640x480    59.940 Hz   4:3    31.469 kHz  25.175 MHz
    DMT 0x0c:   800x600    85.061 Hz   4:3    53.674 kHz  56.250 MHz
    DMT 0x13:  1024x768    84.997 Hz   4:3    68.677 kHz  94.500 MHz
    DMT 0x24:  1280x1024   75.025 Hz   5:4    79.976 kHz 135.000 MHz
    DMT 0x25:  1280x1024   85.024 Hz   5:4    91.146 kHz 157.500 MHz
    DMT 0x36:  1600x1200   75.000 Hz   4:3    93.750 kHz 202.500 MHz
    DMT 0x37:  1600x1200   85.000 Hz   4:3   106.250 kHz 229.500 MHz
    DMT 0x15:  1152x864    75.000 Hz   4:3    67.500 kHz 108.000 MHz
  Detailed Timing Descriptors:
    DTD 1:   640x480    59.952 Hz   4:3    31.475 kHz  25.180 MHz (350 mm x 262 mm)
                 Hfront   16 Hsync  96 Hback  48 Hpol P
                 Vfront   10 Vsync   2 Vback  33 Vpol P
    DTD 2:   800x600    85.061 Hz   4:3    53.674 kHz  56.250 MHz (350 mm x 262 mm)
                 Hfront   32 Hsync  64 Hback 152 Hpol P
                 Vfront    1 Vsync   3 Vback  27 Vpol P
  Display Range Limits:
    Monitor ranges (GTF): 50-200 Hz V, 30-107 kHz H, max dotclock 230 MHz
    Display Product Name: 'Flatron915FT'
Checksum: 0x5a

----------------

Warnings:

Block 0, Base EDID:
  EDID Structure Version & Revision: EDID 1.1 is deprecated, do not use.

EDID conformity: PASS
