edid-decode (hex):

00 ff ff ff ff ff ff 00 4c a3 42 5a 00 00 00 00
00 14 01 04 90 1f 11 78 0a 85 95 99 57 4f 8f 26
21 50 54 00 00 00 01 01 01 01 01 01 01 01 01 01
01 01 01 01 01 01 12 1b 56 72 50 00 0c 30 30 20
25 00 35 ae 10 00 00 19 0c 12 56 72 50 00 0c 30
30 20 25 00 35 ae 10 00 00 19 00 00 00 00 00 00
00 00 00 00 00 00 00 00 00 00 00 00 00 00 00 02
00 0c 42 f2 0b 3c 69 14 12 21 6e 00 00 00 00 a1

----------------

Block 0, Base EDID:
  EDID Structure Version & Revision: 1.4
  Vendor & Product Identification:
    Manufacturer: SEC
    Model: 23106
    Made in: 2010
  Basic Display Parameters & Features:
    Digital display
    Bits per primary color channel: 6
    Digital interface is not defined
    Maximum image size: 31 cm x 17 cm
    Gamma: 2.20
    Supported color formats: RGB 4:4:4, YCrCb 4:4:4
    First detailed timing includes the native pixel format and preferred refresh rate
  Color Characteristics:
    Red  : 0.5996, 0.3398
    Green: 0.3095, 0.5595
    Blue : 0.1503, 0.1298
    White: 0.3134, 0.3291
  Established Timings I & II: none
  Standard Timings: none
  Detailed Timing Descriptors:
    DTD 1:  1366x768    60.031185 Hz 683:384   46.824 kHz     69.300000 MHz (309 mm x 174 mm)
                 Hfront   48 Hsync  32 Hback   34 Hpol N
                 Vfront    2 Vsync   5 Vback    5 Vpol N
    DTD 2:  1366x768    40.020790 Hz 683:384   31.216 kHz     46.200000 MHz (309 mm x 174 mm)
                 Hfront   48 Hsync  32 Hback   34 Hpol N
                 Vfront    2 Vsync   5 Vback    5 Vpol N
    Empty Descriptor
    Manufacturer-Specified Display Descriptor (0x02): 00 02 00 0c 42 f2 0b 3c 69 14 12 21 6e 00 00 00 '....B..<i..!n...'
Checksum: 0xa1

----------------

Warnings:

Block 0, Base EDID:
  Missing Display Product Name.

Failures:

Block 0, Base EDID:
  Empty Descriptor: Use Dummy Descriptor instead of all zeroes.

EDID conformity: FAIL
