edid-decode (hex):

00 ff ff ff ff ff ff 00 4c 2d 17 00 35 31 47 47
02 0d 01 03 08 1e 17 b2 ea ff 59 99 55 4d 97 26
1b 4b 4f af ce 00 31 4f 45 4f 61 4f 31 40 01 01
01 01 01 01 01 01 64 19 00 40 41 00 26 30 18 88
36 00 30 e4 10 00 00 18 00 00 00 fd 00 38 4b 1e
3c 08 00 0a 20 20 20 20 20 20 00 00 00 fc 00 53
79 6e 63 4d 61 73 74 65 72 0a 20 20 00 00 00 ff
00 48 39 4e 57 31 30 35 32 36 35 0a 20 20 00 d4

00 ff ff ff ff ff ff 00 4c 2d 17 00 35 31 47 47
02 0d 01 03 08 1e 17 b2 ea ff 59 99 55 4d 97 26
1b 4b 4f af ce 00 31 4f 45 4f 61 4f 31 40 01 01
01 01 01 01 01 01 64 19 00 40 41 00 26 30 18 88
36 00 30 e4 10 00 00 18 00 00 00 fd 00 38 4b 1e
3c 08 00 0a 20 20 20 20 20 20 00 00 00 fc 00 53
79 6e 63 4d 61 73 74 65 72 0a 20 20 00 00 00 ff
00 48 39 4e 57 31 30 35 32 36 35 0a 20 20 00 d4

----------------

Block 0, Base EDID:
  EDID Structure Version & Revision: 1.3
  Vendor & Product Identification:
    Manufacturer: SAM
    Model: 23
    Serial Number: ...
    Made in: week 2 of 2003
  Basic Display Parameters & Features:
    Analog display
    Signal Level Standard: 0.700 : 0.300 : 1.000 V p-p
    Blank level equals black level
    Sync: Separate
    Maximum image size: 30 cm x 23 cm
    Gamma: 2.78
    DPMS levels: Standby Suspend Off
    RGB color display
    First detailed timing is the preferred timing
  Color Characteristics:
    Red  : 0.6005, 0.3349
    Green: 0.3037, 0.5927
    Blue : 0.1494, 0.1064
    White: 0.2949, 0.3095
  Established Timings I & II:
    IBM     :   720x400    70.081663 Hz   9:5     31.467 kHz     28.320000 MHz
    DMT 0x04:   640x480    59.940476 Hz   4:3     31.469 kHz     25.175000 MHz
    DMT 0x05:   640x480    72.808802 Hz   4:3     37.861 kHz     31.500000 MHz
    DMT 0x06:   640x480    75.000000 Hz   4:3     37.500 kHz     31.500000 MHz
    DMT 0x08:   800x600    56.250000 Hz   4:3     35.156 kHz     36.000000 MHz
    DMT 0x09:   800x600    60.316541 Hz   4:3     37.879 kHz     40.000000 MHz
    DMT 0x0a:   800x600    72.187572 Hz   4:3     48.077 kHz     50.000000 MHz
    DMT 0x0b:   800x600    75.000000 Hz   4:3     46.875 kHz     49.500000 MHz
    DMT 0x10:  1024x768    60.003840 Hz   4:3     48.363 kHz     65.000000 MHz
    DMT 0x11:  1024x768    70.069359 Hz   4:3     56.476 kHz     75.000000 MHz
    DMT 0x12:  1024x768    75.028582 Hz   4:3     60.023 kHz     78.750000 MHz
  Standard Timings:
    DMT 0x06:   640x480    75.000000 Hz   4:3     37.500 kHz     31.500000 MHz
    DMT 0x0b:   800x600    75.000000 Hz   4:3     46.875 kHz     49.500000 MHz
    DMT 0x12:  1024x768    75.028582 Hz   4:3     60.023 kHz     78.750000 MHz
    DMT 0x04:   640x480    59.940476 Hz   4:3     31.469 kHz     25.175000 MHz
  Detailed Timing Descriptors:
    DTD 1:  1024x768    60.003840 Hz   4:3     48.363 kHz     65.000000 MHz (304 mm x 228 mm)
                 Hfront   24 Hsync 136 Hback  160 Hpol N
                 Vfront    3 Vsync   6 Vback   29 Vpol N
    Display Range Limits:
      Monitor ranges (GTF): 56-75 Hz V, 30-60 kHz H, max dotclock 80 MHz
    Display Product Name: 'SyncMaster'
    Display Product Serial Number: ...
Checksum: 0xd4

----------------

Block 1, Unknown EDID Extension Block 0x00:
  00 ff ff ff ff ff ff 00 4c 2d 17 00 35 31 47 47 '........L-..51GG'
  02 0d 01 03 08 1e 17 b2 ea ff 59 99 55 4d 97 26 '..........Y.UM.&'
  1b 4b 4f af ce 00 31 4f 45 4f 61 4f 31 40 01 01 '.KO...1OEOaO1@..'
  01 01 01 01 01 01 64 19 00 40 41 00 26 30 18 88 '......d..@A.&0..'
  36 00 30 e4 10 00 00 18 00 00 00 fd 00 38 4b 1e '6.0..........8K.'
  3c 08 00 0a 20 20 20 20 20 20 00 00 00 fc 00 53 '<...      .....S'
  79 6e 63 4d 61 73 74 65 72 0a 20 20 00 00 00 ff 'yncMaster.  ....'
  00 48 39 4e 57 31 30 35 32 36 35 0a 20 20 00 d4 '.H9NW105265.  ..'
Checksum: 0xd4

----------------

Failures:

Block 1, Base EDID:
  Unknown Extension Block.
EDID:
  Base EDID: EDID specified 0 extension block(s), but found 1 extension block(s).

EDID conformity: FAIL
