edid-decode (hex):

00 ff ff ff ff ff ff 00 26 cd 2d 56 c6 03 00 00
32 1e 01 03 80 33 1d 78 2a d9 05 a5 57 51 9e 27
0f 50 54 b7 4f 00 d1 c0 81 80 95 00 b3 00 81 40
71 4f 95 0f 01 01 02 3a 80 18 71 38 2d 40 58 2c
45 00 fd 1e 11 00 00 1e 00 00 00 fd 00 37 4c 1e
53 11 00 0a 20 20 20 20 20 20 00 00 00 ff 00 31
31 33 30 35 4a 4c 43 30 30 39 36 36 00 00 00 fc
00 50 4c 32 33 39 30 0a 20 20 20 20 20 20 00 87

00 ff ff ff ff ff ff 00 26 cd 2d 56 c6 03 00 00
32 1e 01 03 80 33 1d 78 2a d9 05 a5 57 51 9e 27
0f 50 54 b7 4f 00 d1 c0 81 80 95 00 b3 00 81 40
71 4f 95 0f 01 01 02 3a 80 18 71 38 2d 40 58 2c
45 00 fd 1e 11 00 00 1e 00 00 00 fd 00 37 4c 1e
53 11 00 0a 20 20 20 20 20 20 00 00 00 ff 00 31
31 33 30 35 4a 4c 43 30 30 39 36 36 00 00 00 fc
00 50 4c 32 33 39 30 0a 20 20 20 20 20 20 00 87

----------------

Block 0, Base EDID:
  EDID Structure Version & Revision: 1.3
  Vendor & Product Identification:
    Manufacturer: IVM
    Model: 22061
    Serial Number: ...
    Made in: week 50 of 2020
  Basic Display Parameters & Features:
    Digital display
    Maximum image size: 51 cm x 29 cm
    Gamma: 2.20
    DPMS levels: Off
    RGB color display
    First detailed timing is the preferred timing
  Color Characteristics:
    Red  : 0.6474, 0.3408
    Green: 0.3183, 0.6181
    Blue : 0.1523, 0.0585
    White: 0.3134, 0.3291
  Established Timings I & II:
    IBM     :   720x400    70.081663 Hz   9:5     31.467 kHz     28.320000 MHz
    DMT 0x04:   640x480    59.940476 Hz   4:3     31.469 kHz     25.175000 MHz
    Apple   :   640x480    66.666667 Hz   4:3     35.000 kHz     30.240000 MHz
    DMT 0x06:   640x480    75.000000 Hz   4:3     37.500 kHz     31.500000 MHz
    DMT 0x08:   800x600    56.250000 Hz   4:3     35.156 kHz     36.000000 MHz
    DMT 0x09:   800x600    60.316541 Hz   4:3     37.879 kHz     40.000000 MHz
    DMT 0x0b:   800x600    75.000000 Hz   4:3     46.875 kHz     49.500000 MHz
    DMT 0x10:  1024x768    60.003840 Hz   4:3     48.363 kHz     65.000000 MHz
    DMT 0x11:  1024x768    70.069359 Hz   4:3     56.476 kHz     75.000000 MHz
    DMT 0x12:  1024x768    75.028582 Hz   4:3     60.023 kHz     78.750000 MHz
    DMT 0x24:  1280x1024   75.024675 Hz   5:4     79.976 kHz    135.000000 MHz
  Standard Timings:
    DMT 0x52:  1920x1080   60.000000 Hz  16:9     67.500 kHz    148.500000 MHz
    DMT 0x23:  1280x1024   60.019740 Hz   5:4     63.981 kHz    108.000000 MHz
    DMT 0x2f:  1440x900    59.887445 Hz  16:10    55.935 kHz    106.500000 MHz
    DMT 0x3a:  1680x1050   59.954250 Hz  16:10    65.290 kHz    146.250000 MHz
    DMT 0x20:  1280x960    60.000000 Hz   4:3     60.000 kHz    108.000000 MHz
    DMT 0x15:  1152x864    75.000000 Hz   4:3     67.500 kHz    108.000000 MHz
    DMT 0x30:  1440x900    74.984427 Hz  16:10    70.635 kHz    136.750000 MHz
  Detailed Timing Descriptors:
    DTD 1:  1920x1080   60.000000 Hz  16:9     67.500 kHz    148.500000 MHz (509 mm x 286 mm)
                 Hfront   88 Hsync  44 Hback  148 Hpol P
                 Vfront    4 Vsync   5 Vback   36 Vpol P
    Display Range Limits:
      Monitor ranges (GTF): 55-76 Hz V, 30-83 kHz H, max dotclock 170 MHz
    Display Product Serial Number: ...
    Display Product Name: 'PL2390'
Checksum: 0x87

----------------

Block 1, Unknown EDID Extension Block 0x00:
  00 ff ff ff ff ff ff 00 26 cd 2d 56 c6 03 00 00 '........&.-V....'
  32 1e 01 03 80 33 1d 78 2a d9 05 a5 57 51 9e 27 '2....3.x*...WQ.''
  0f 50 54 b7 4f 00 d1 c0 81 80 95 00 b3 00 81 40 '.PT.O..........@'
  71 4f 95 0f 01 01 02 3a 80 18 71 38 2d 40 58 2c 'qO.....:..q8-@X,'
  45 00 fd 1e 11 00 00 1e 00 00 00 fd 00 37 4c 1e 'E............7L.'
  53 11 00 0a 20 20 20 20 20 20 00 00 00 ff 00 31 'S...      .....1'
  31 33 30 35 4a 4c 43 30 30 39 36 36 00 00 00 fc '1305JLC00966....'
  00 50 4c 32 33 39 30 0a 20 20 20 20 20 20 00 87 '.PL2390.      ..'
Checksum: 0x87

----------------

Failures:

Block 1, Base EDID:
  Unknown Extension Block.
EDID:
  Base EDID: EDID specified 0 extension block(s), but found 1 extension block(s).

EDID conformity: FAIL
