edid-decode (hex):

00 ff ff ff ff ff ff 00 4d 10 45 41 01 01 01 01
00 13 01 03 1c 39 20 78 2e 9e ad a4 55 45 98 26
10 47 4a bf ee 00 81 c0 81 00 8b c0 01 01 01 01
01 01 01 01 01 01 20 21 50 a0 51 00 1e 30 48 88
35 00 9a e6 10 00 00 18 00 00 00 ff 00 30 31 30
31 30 31 30 31 0a 20 20 20 20 00 00 00 fc 00 53
48 41 52 50 20 4c 43 44 0a 20 20 20 00 00 00 fd
00 38 4c 1e 55 10 00 0a 20 20 20 20 20 20 00 12

----------------

Block 0, Base EDID:
  EDID Structure Version & Revision: 1.3
  Vendor & Product Identification:
    Manufacturer: SHP
    Model: 16709
    Serial Number: ...
    Made in: 2009
  Basic Display Parameters & Features:
    Analog display
    Input voltage level: 0.7/0.3 V
    Configurable signal levels
    Sync: Separate Composite
    Maximum image size: 57 cm x 32 cm
    Gamma: 2.20
    DPMS levels: Off
    RGB color display
    Default (sRGB) color space is primary color space
    First detailed timing is preferred timing
  Color Characteristics:
    Red  : 0.6425, 0.3330
    Green: 0.2724, 0.5957
    Blue : 0.1503, 0.0644
    White: 0.2802, 0.2900
  Established Timings I & II:
    IBM     :   720x400    70.082 Hz   9:5    31.467 kHz  28.320 MHz
    DMT 0x04:   640x480    59.940 Hz   4:3    31.469 kHz  25.175 MHz
    Apple   :   640x480    66.667 Hz   4:3    35.000 kHz  30.240 MHz
    DMT 0x05:   640x480    72.809 Hz   4:3    37.861 kHz  31.500 MHz
    DMT 0x06:   640x480    75.000 Hz   4:3    37.500 kHz  31.500 MHz
    DMT 0x08:   800x600    56.250 Hz   4:3    35.156 kHz  36.000 MHz
    DMT 0x09:   800x600    60.317 Hz   4:3    37.879 kHz  40.000 MHz
    DMT 0x0a:   800x600    72.188 Hz   4:3    48.077 kHz  50.000 MHz
    DMT 0x0b:   800x600    75.000 Hz   4:3    46.875 kHz  49.500 MHz
    Apple   :   832x624    74.551 Hz   4:3    49.726 kHz  57.284 MHz
    DMT 0x10:  1024x768    60.004 Hz   4:3    48.363 kHz  65.000 MHz
    DMT 0x11:  1024x768    70.069 Hz   4:3    56.476 kHz  75.000 MHz
    DMT 0x12:  1024x768    75.029 Hz   4:3    60.023 kHz  78.750 MHz
  Standard Timings:
    DMT 0x55:  1280x720    60.000 Hz  16:9    45.000 kHz  74.250 MHz
    DMT 0x1c:  1280x800    59.810 Hz  16:10   49.702 kHz  83.500 MHz
    GTF     :  1360x768    60.000 Hz  16:9    47.700 kHz  84.715 MHz
  Detailed Timing Descriptors:
    DTD 1:  1360x768    59.834 Hz  85:48   47.748 kHz  84.800 MHz (410 mm x 230 mm)
                 Hfront   72 Hsync 136 Hback 208 Hpol N
                 Vfront    3 Vsync   5 Vback  22 Vpol N
    Display Product Serial Number: ...
    Display Product Name: 'SHARP LCD'
  Display Range Limits:
    Monitor ranges (GTF): 56-76 Hz V, 30-85 kHz H, max dotclock 160 MHz
Checksum: 0x12
