edid-decode (hex):

00 ff ff ff ff ff ff 00 5c 23 19 10 f9 07 00 00
04 12 01 03 81 1b 11 78 aa d4 45 96 57 52 89 28
25 50 54 a5 ee 00 81 00 01 01 01 01 01 01 01 01
01 01 01 01 01 01 94 20 00 90 51 20 1c 30 c8 88
83 04 05 a3 10 00 00 1e 00 00 00 fd 00 38 4b 1f
52 0e 00 0a 20 20 20 20 20 20 00 00 00 ff 00 38
41 43 30 30 32 30 34 31 20 20 20 20 00 00 00 fc
00 43 69 6e 74 69 71 20 31 32 57 58 0a 20 00 e8

----------------

Block 0, Base EDID:
  EDID Structure Version & Revision: 1.3
  Vendor & Product Identification:
    Manufacturer: WAC
    Model: 4121
    Serial Number: ...
    Made in: week 4 of 2008
  Basic Display Parameters & Features:
    Digital display
    DFP 1.x compatible TMDS
    Maximum image size: 27 cm x 17 cm
    Gamma: 2.20
    DPMS levels: Standby Off
    RGB color display
    First detailed timing is the preferred timing
  Color Characteristics:
    Red  : 0.5888, 0.3408
    Green: 0.3212, 0.5351
    Blue : 0.1572, 0.1445
    White: 0.3134, 0.3291
  Established Timings I & II:
    IBM     :   720x400    70.082 Hz   9:5    31.467 kHz  28.320 MHz
    DMT 0x04:   640x480    59.940 Hz   4:3    31.469 kHz  25.175 MHz
    DMT 0x06:   640x480    75.000 Hz   4:3    37.500 kHz  31.500 MHz
    DMT 0x09:   800x600    60.317 Hz   4:3    37.879 kHz  40.000 MHz
    DMT 0x0a:   800x600    72.188 Hz   4:3    48.077 kHz  50.000 MHz
    DMT 0x0b:   800x600    75.000 Hz   4:3    46.875 kHz  49.500 MHz
    Apple   :   832x624    74.551 Hz   4:3    49.726 kHz  57.284 MHz
    DMT 0x10:  1024x768    60.004 Hz   4:3    48.363 kHz  65.000 MHz
    DMT 0x11:  1024x768    70.069 Hz   4:3    56.476 kHz  75.000 MHz
    DMT 0x12:  1024x768    75.029 Hz   4:3    60.023 kHz  78.750 MHz
  Standard Timings:
    DMT 0x1c:  1280x800    59.810 Hz  16:10   49.702 kHz  83.500 MHz
  Detailed Timing Descriptors:
    DTD 1:  1280x800    59.955 Hz   8:5    49.643 kHz  83.400 MHz (261 mm x 163 mm)
                 Hfront  200 Hsync 136 Hback  64 Hpol P
                 Vfront   24 Vsync   3 Vback   1 Vpol P
  Display Range Limits:
    Monitor ranges (GTF): 56-75 Hz V, 31-82 kHz H, max dotclock 140 MHz
    Display Product Serial Number: ...
    Display Product Name: 'Cintiq 12WX'
Checksum: 0xe8

----------------

Failures:

Block 0, Base EDID:
  Display Product Serial Number: One or more trailing spaces.

EDID conformity: FAIL
