
EDID (hex):
00ffffffffffff004dd9032801010101
09170103809a57782a1bbea25534b326
144a5220000001010101010101010101
010101010101023a801871382d40582c
450003626300001e011d8018711c1620
582c250003626300009e000000fc0053
484152502048444d490a2020000000fd
00174c0f4b11000a2020202020200100
02033074489020220504030201320f7f
071507553d1fc05707006754005f7e01
835f000067030c001100b82de3050301
011d007251d01e206e28550003626300
001e8c0ad08a20e02d10103e96008262
43000018000000000000000000000000
00000000000000000000000000000000
00000000000000000000000000000099

Extracted contents:
header:          00 ff ff ff ff ff ff 00
serial number:   4d d9 03 28 01 01 01 01 09 17
version:         01 03
basic params:    80 9a 57 78 2a
chroma info:     1b be a2 55 34 b3 26 14 4a 52
established:     20 00 00
standard:        01 01 01 01 01 01 01 01 01 01 01 01 01 01 01 01
descriptor 1:    02 3a 80 18 71 38 2d 40 58 2c 45 00 03 62 63 00 00 1e
descriptor 2:    01 1d 80 18 71 1c 16 20 58 2c 25 00 03 62 63 00 00 9e
descriptor 3:    00 00 00 fc 00 53 48 41 52 50 20 48 44 4d 49 0a 20 20
descriptor 4:    00 00 00 fd 00 17 4c 0f 4b 11 00 0a 20 20 20 20 20 20
extensions:      01
checksum:        00

EDID version: 1.3
Manufacturer: SNY Model 2803 Serial Number --
Made in week 9 of 2013
Digital display
Maximum image size: 154 cm x 87 cm
Gamma: 2.20
DPMS levels: Off
RGB color display
First detailed timing is preferred timing
Display x,y Chromaticity:
  Red:   0.6328, 0.3330
  Green: 0.2050, 0.7021
  Blue:  0.1503, 0.0810
  White: 0.2919, 0.3222
Established timings supported:
  640x480@60Hz 4:3 HorFreq: 31469 Hz Clock: 25.175 MHz
Standard timings supported:
Detailed mode: Clock 148.500 MHz, 1539 mm x 866 mm
               1920 2008 2052 2200 hborder 0
               1080 1084 1089 1125 vborder 0
               +hsync +vsync 
               VertFreq: 60 Hz, HorFreq: 67500 Hz
Detailed mode: Clock 74.250 MHz, 1539 mm x 866 mm
               1920 2008 2052 2200 hborder 0
                540  542  547  562 vborder 0
               +hsync +vsync interlaced 
               VertFreq: 60 Hz, HorFreq: 33750 Hz
Monitor name: SHARP HDMI
Monitor ranges (GTF): 23-76Hz V, 15-75kHz H, max dotclock 170MHz
Has 1 extension blocks
Checksum: 0x0 (valid)

CTA extension block
Extension version: 3
44 bytes of CTA data
  Video data block
    VIC  16 1920x1080@60Hz 16:9 (native) HorFreq: 67500 Hz Clock: 148.500 MHz
    VIC  32 1920x1080@24Hz 16:9  HorFreq: 27000 Hz Clock: 74.250 MHz
    VIC  34 1920x1080@30Hz 16:9  HorFreq: 33750 Hz Clock: 74.250 MHz
    VIC   5 1920x1080i@60Hz 16:9  HorFreq: 33750 Hz Clock: 74.250 MHz
    VIC   4 1280x720@60Hz 16:9  HorFreq: 45000 Hz Clock: 74.250 MHz
    VIC   3 720x480@60Hz 16:9  HorFreq: 31469 Hz Clock: 27.000 MHz
    VIC   2 720x480@60Hz 4:3  HorFreq: 31469 Hz Clock: 27.000 MHz
    VIC   1 640x480@60Hz 4:3  HorFreq: 31469 Hz Clock: 25.175 MHz
  Audio data block
    Linear PCM, max channels 8
      Supported sample rates (kHz): 192 176.4 96 88.2 48 44.1 32
      Supported sample sizes (bits): 24 20 16
    AC-3, max channels 6
      Supported sample rates (kHz): 48 44.1 32
      Maximum bit rate: 680 kHz
    DTS, max channels 6
      Supported sample rates (kHz): 96 88.2 48 44.1 32
      Maximum bit rate: 1536 kHz
    Dolby Digital+, max channels 8
      Supported sample rates (kHz): 48 44.1 32
    MAT (MLP), max channels 8
      Supported sample rates (kHz): 192 96 48
    DTS-HD, max channels 8
      Supported sample rates (kHz): 192 176.4 96 88.2 48 44.1
  Speaker allocation data block
    Speaker map:
      FL/FR - Front Left/Right
      LFE - Low Frequency Effects
      FC - Front Center
      BL/BR - Back Left/Right
      BC - Back Center
      RLC/RRC - Rear Left/Right of Center
  Vendor-specific data block, OUI 000c03 (HDMI)
    Source physical address 1.1.0.0
    Supports_AI
    DC_36bit
    DC_30bit
    DC_Y444
    Maximum TMDS clock: 225MHz
  Extended tag: Colorimetry data block
    xvYCC601
    xvYCC709
Basic audio support
Supports YCbCr 4:4:4
Supports YCbCr 4:2:2
4 native detailed modes
Detailed mode: Clock 74.250 MHz, 1539 mm x 866 mm
               1280 1390 1430 1650 hborder 0
                720  725  730  750 vborder 0
               +hsync +vsync 
               VertFreq: 60 Hz, HorFreq: 45000 Hz
Detailed mode: Clock 27.000 MHz, 1154 mm x 866 mm
                720  736  798  858 hborder 0
                480  489  495  525 vborder 0
               -hsync -vsync 
               VertFreq: 59 Hz, HorFreq: 31468 Hz
Checksum: 0x99 (valid)
