edid-decode (hex):

00 ff ff ff ff ff ff 00 06 b3 b1 32 4c e5 01 00
32 1c 01 04 a5 46 27 78 3b 10 e5 ae 50 48 a7 25
11 50 54 bf cf 00 d1 c0 71 4f 81 c0 81 40 81 80
95 00 b3 00 01 01 f8 e3 00 a0 a0 a0 32 50 08 20
98 04 b9 89 21 00 00 1e 69 5e 00 a0 a0 a0 29 50
30 20 b8 04 b9 89 21 00 00 1a 00 00 00 fd 00 30
90 de de 3c 01 0a 20 20 20 20 20 20 00 00 00 fc
00 41 53 55 53 20 58 47 33 32 56 0a 20 20 01 90

02 03 20 71 4d 01 02 03 11 12 13 0f 1d 1e 0e 90
1f 04 23 09 17 07 83 01 00 00 65 03 0c 00 20 00
5a a0 00 a0 a0 a0 46 50 30 20 35 00 b9 89 21 00
00 1a 6f c2 00 a0 a0 a0 55 50 30 20 35 00 b9 89
21 00 00 1a 5a 87 00 a0 a0 a0 3b 50 30 20 35 00
b9 89 21 00 00 1a 00 00 00 00 00 00 00 00 00 00
00 00 00 00 00 00 00 00 00 00 00 00 00 00 00 00
00 00 00 00 00 00 00 00 00 00 00 00 00 00 00 fc

----------------

Block 0, Base EDID:
  EDID Structure Version & Revision: 1.4
  Vendor & Product Identification:
    Manufacturer: AUS
    Model: 12977
    Serial Number: ...
    Made in: week 50 of 2018
  Basic Display Parameters & Features:
    Digital display
    Bits per primary color channel: 8
    DisplayPort interface
    Maximum image size: 70 cm x 39 cm
    Gamma: 2.20
    DPMS levels: Off
    Supported color formats: RGB 4:4:4, YCrCb 4:4:4, YCrCb 4:2:2
    First detailed timing includes the native pixel format and preferred refresh rate
    Display is continuous frequency
  Color Characteristics:
    Red  : 0.6796, 0.3134
    Green: 0.2812, 0.6523
    Blue : 0.1474, 0.0683
    White: 0.3134, 0.3291
  Established Timings I & II:
    IBM     :   720x400    70.082 Hz   9:5    31.467 kHz  28.320 MHz
    DMT 0x04:   640x480    59.940 Hz   4:3    31.469 kHz  25.175 MHz
    Apple   :   640x480    66.667 Hz   4:3    35.000 kHz  30.240 MHz
    DMT 0x05:   640x480    72.809 Hz   4:3    37.861 kHz  31.500 MHz
    DMT 0x06:   640x480    75.000 Hz   4:3    37.500 kHz  31.500 MHz
    DMT 0x08:   800x600    56.250 Hz   4:3    35.156 kHz  36.000 MHz
    DMT 0x09:   800x600    60.317 Hz   4:3    37.879 kHz  40.000 MHz
    DMT 0x0a:   800x600    72.188 Hz   4:3    48.077 kHz  50.000 MHz
    DMT 0x0b:   800x600    75.000 Hz   4:3    46.875 kHz  49.500 MHz
    DMT 0x10:  1024x768    60.004 Hz   4:3    48.363 kHz  65.000 MHz
    DMT 0x11:  1024x768    70.069 Hz   4:3    56.476 kHz  75.000 MHz
    DMT 0x12:  1024x768    75.029 Hz   4:3    60.023 kHz  78.750 MHz
    DMT 0x24:  1280x1024   75.025 Hz   5:4    79.976 kHz 135.000 MHz
  Standard Timings:
    DMT 0x52:  1920x1080   60.000 Hz  16:9    67.500 kHz 148.500 MHz
    DMT 0x15:  1152x864    75.000 Hz   4:3    67.500 kHz 108.000 MHz
    DMT 0x55:  1280x720    60.000 Hz  16:9    45.000 kHz  74.250 MHz
    DMT 0x20:  1280x960    60.000 Hz   4:3    60.000 kHz 108.000 MHz
    DMT 0x23:  1280x1024   60.020 Hz   5:4    63.981 kHz 108.000 MHz
    DMT 0x2f:  1440x900    59.887 Hz  16:10   55.935 kHz 106.500 MHz
    DMT 0x3a:  1680x1050   59.954 Hz  16:10   65.290 kHz 146.250 MHz
  Detailed Timing Descriptors:
    DTD 1:  2560x1440  143.999 Hz  16:9   214.559 kHz 583.600 MHz (697 mm x 393 mm)
                 Hfront    8 Hsync  32 Hback 120 Hpol P
                 Vfront   25 Vsync   8 Vback  17 Vpol P
    DTD 2:  2560x1440   59.998 Hz  16:9    88.857 kHz 241.690 MHz (697 mm x 393 mm)
                 Hfront   48 Hsync  32 Hback  80 Hpol P
                 Vfront   27 Vsync   8 Vback   6 Vpol N
  Display Range Limits:
    Monitor ranges (Bare Limits): 48-144 Hz V, 222-222 kHz H, max dotclock 600 MHz
    Display Product Name: 'ASUS XG32V'
  Extension blocks: 1
Checksum: 0x90

----------------

Block 1, CTA-861 Extension Block:
  Revision: 3
  Basic audio support
  Supports YCbCr 4:4:4
  Supports YCbCr 4:2:2
  Native detailed modes: 1
  Video Data Block:
    VIC   1:   640x480    59.940 Hz   4:3    31.469 kHz  25.175 MHz
    VIC   2:   720x480    59.940 Hz   4:3    31.469 kHz  27.000 MHz
    VIC   3:   720x480    59.940 Hz  16:9    31.469 kHz  27.000 MHz
    VIC  17:   720x576    50.000 Hz   4:3    31.250 kHz  27.000 MHz
    VIC  18:   720x576    50.000 Hz  16:9    31.250 kHz  27.000 MHz
    VIC  19:  1280x720    50.000 Hz  16:9    37.500 kHz  74.250 MHz
    VIC  15:  1440x480    59.940 Hz  16:9    31.469 kHz  54.000 MHz
    VIC  29:  1440x576    50.000 Hz   4:3    31.250 kHz  54.000 MHz
    VIC  30:  1440x576    50.000 Hz  16:9    31.250 kHz  54.000 MHz
    VIC  14:  1440x480    59.940 Hz   4:3    31.469 kHz  54.000 MHz
    VIC  16:  1920x1080   60.000 Hz  16:9    67.500 kHz 148.500 MHz (native)
    VIC  31:  1920x1080   50.000 Hz  16:9    56.250 kHz 148.500 MHz
    VIC   4:  1280x720    60.000 Hz  16:9    45.000 kHz  74.250 MHz
  Audio Data Block:
    Linear PCM:
      Max channels: 2
      Supported sample rates (kHz): 96 48 44.1 32
      Supported sample sizes (bits): 24 20 16
  Speaker Allocation Data Block:
    FL/FR - Front Left/Right
  Vendor-Specific Data Block (HDMI), OUI 00-0C-03:
    Source physical address: 2.0.0.0
  Detailed Timing Descriptors:
    DTD 3:  2560x1440   99.946 Hz  16:9   150.919 kHz 410.500 MHz (697 mm x 393 mm)
                 Hfront   48 Hsync  32 Hback  80 Hpol P
                 Vfront    3 Vsync   5 Vback  62 Vpol N
    DTD 4:  2560x1440  119.998 Hz  16:9   182.996 kHz 497.750 MHz (697 mm x 393 mm)
                 Hfront   48 Hsync  32 Hback  80 Hpol P
                 Vfront    3 Vsync   5 Vback  77 Vpol N
    DTD 5:  2560x1440   84.983 Hz  16:9   127.390 kHz 346.500 MHz (697 mm x 393 mm)
                 Hfront   48 Hsync  32 Hback  80 Hpol P
                 Vfront    3 Vsync   5 Vback  51 Vpol N
Checksum: 0xfc

----------------

Warnings:

Block 1, CTA-861 Extension Block:
  IT Video Formats are overscanned by default, but normally this should be underscanned.
  Missing VCDB, needed for Set Selectable RGB Quantization to avoid interop issues.
EDID:
  Base EDID: Some timings are out of range of the Monitor Ranges:
    Horizontal Freq: 31.250 - 214.558 kHz (Monitor: 222.000 - 222.000 kHz)

Failures:

Block 1, CTA-861 Extension Block:
  Vendor-Specific Data Block (HDMI): The HDMI Specification uses EDID 1.3, not 1.4.
EDID:
  CTA-861: Native progressive timings are a mix of several resolutions.

EDID conformity: FAIL
