
EDID (hex):
00ffffffffffff0030aeab17781c0100
1e11010308221b782a5a41a15b4b8d24
185153bfef0001010101010101010101
010101010101bc34009851002a401090
1300540e11000018000000ff00383233
38303733303732383234000000fd0037
4b1e500d000a202020202020000000fc
004c584d2d4c313741422020200a0005

Extracted contents:
header:          00 ff ff ff ff ff ff 00
serial number:   30 ae ab 17 78 1c 01 00 1e 11
version:         01 03
basic params:    08 22 1b 78 2a
chroma info:     5a 41 a1 5b 4b 8d 24 18 51 53
established:     bf ef 00
standard:        01 01 01 01 01 01 01 01 01 01 01 01 01 01 01 01
descriptor 1:    bc 34 00 98 51 00 2a 40 10 90 13 00 54 0e 11 00 00 18
descriptor 2:    00 00 00 ff 00 38 32 33 38 30 37 33 30 37 32 38 32 34
descriptor 3:    00 00 00 fd 00 37 4b 1e 50 0d 00 0a 20 20 20 20 20 20
descriptor 4:    00 00 00 fc 00 4c 58 4d 2d 4c 31 37 41 42 20 20 20 0a
extensions:      00
checksum:        05

EDID version: 1.3
Manufacturer: LEN Model 17ab Serial Number --
Made in week 30 of 2007
Analog display, Input voltage level: 0.7/0.3 V
Sync: Separate 
Maximum image size: 34 cm x 27 cm
Gamma: 2.20
DPMS levels: Off
RGB color display
First detailed timing is preferred timing
Display x,y Chromaticity:
  Red:   0.6298, 0.3564
  Green: 0.2949, 0.5527
  Blue:  0.1416, 0.0937
  White: 0.3164, 0.3251
Established timings supported:
  720x400@70Hz 9:5 HorFreq: 31469 Hz Clock: 28.320 MHz
  640x480@60Hz 4:3 HorFreq: 31469 Hz Clock: 25.175 MHz
  640x480@67Hz 4:3 HorFreq: 35000 Hz Clock: 30.240 MHz
  640x480@72Hz 4:3 HorFreq: 37900 Hz Clock: 31.500 MHz
  640x480@75Hz 4:3 HorFreq: 37500 Hz Clock: 31.500 MHz
  800x600@56Hz 4:3 HorFreq: 35200 Hz Clock: 36.000 MHz
  800x600@60Hz 4:3 HorFreq: 37900 Hz Clock: 40.000 MHz
  800x600@72Hz 4:3 HorFreq: 48100 Hz Clock: 50.000 MHz
  800x600@75Hz 4:3 HorFreq: 46900 Hz Clock: 49.500 MHz
  832x624@75Hz 4:3 HorFreq: 49726 Hz Clock: 57.284 MHz
  1024x768@60Hz 4:3 HorFreq: 48400 Hz Clock: 65.000 MHz
  1024x768@70Hz 4:3 HorFreq: 56500 Hz Clock: 75.000 MHz
  1024x768@75Hz 4:3 HorFreq: 60000 Hz Clock: 78.750 MHz
  1280x1024@75Hz 5:4 HorFreq: 80000 Hz Clock: 135.000 MHz
Standard timings supported:
Detailed mode: Clock 135.000 MHz, 340 mm x 270 mm
               1280 1296 1440 1688 hborder 0
               1024 1025 1028 1066 vborder 0
               -hsync -vsync 
               VertFreq: 75 Hz, HorFreq: 79976 Hz
Serial number: --
Monitor ranges (GTF): 55-75Hz V, 30-80kHz H, max dotclock 130MHz
Monitor name: LXM-L17AB   
Checksum: 0x5 (valid)
One or more of the timings is out of range of the Monitor Ranges:
  Vertical Freq: 56 - 75 Hz
  Horizontal Freq: 31469 - 80000 Hz
  Maximum Clock: 135.000 MHz
