
EDID (hex):
00ffffffffffff0009e5780a00000000
011f0104a51f11780263d5955c578d27
1c505400000001010101010101010101
0101010101012a3680a070381f403020
350035ae1000001a522b80a070381f40
3020350035ae1000001a000000fe0042
4f452044540a202020202020000000fe
00504531343046484d2d4e38300a0089

Extracted contents:
header:          00 ff ff ff ff ff ff 00
serial number:   09 e5 78 0a 00 00 00 00 01 1f
version:         01 04
basic params:    a5 1f 11 78 02
chroma info:     63 d5 95 5c 57 8d 27 1c 50 54
established:     00 00 00
standard:        01 01 01 01 01 01 01 01 01 01 01 01 01 01 01 01
descriptor 1:    2a 36 80 a0 70 38 1f 40 30 20 35 00 35 ae 10 00 00 1a
descriptor 2:    52 2b 80 a0 70 38 1f 40 30 20 35 00 35 ae 10 00 00 1a
descriptor 3:    00 00 00 fe 00 42 4f 45 20 44 54 0a 20 20 20 20 20 20
descriptor 4:    00 00 00 fe 00 50 45 31 34 30 46 48 4d 2d 4e 38 30 0a
extensions:      00
checksum:        89

EDID version: 1.4
Manufacturer: BOE Model a78 Serial Number --
Made in week 1 of 2021
Digital display
8 bits per primary color channel
DisplayPort interface
Maximum image size: 31 cm x 17 cm
Gamma: 2.20
Supported color formats: RGB 4:4:4
First detailed timing includes the native pixel format and preferred refresh rate
Display x,y Chromaticity:
  Red:   0.5830, 0.3613
  Green: 0.3398, 0.5537
  Blue:  0.1552, 0.1103
  White: 0.3134, 0.3291
Established timings supported:
Standard timings supported:
Detailed mode: Clock 138.660 MHz, 309 mm x 174 mm
               1920 1968 2000 2080 hborder 0
               1080 1083 1088 1111 vborder 0
               +hsync -vsync 
               VertFreq: 60 Hz, HorFreq: 66663 Hz
Detailed mode: Clock 110.900 MHz, 309 mm x 174 mm
               1920 1968 2000 2080 hborder 0
               1080 1083 1088 1111 vborder 0
               +hsync -vsync 
               VertFreq: 47 Hz, HorFreq: 53317 Hz
ASCII string: BOE DT
ASCII string: PE140FHM-N80
Checksum: 0x89 (valid)
EDID block does NOT conform to EDID 1.4!
	Missing name descriptor
	Missing monitor ranges
