edid-decode (hex):

00 ff ff ff ff ff ff 00 30 e4 b3 02 00 00 00 00
00 14 01 03 80 1f 11 78 0a 50 85 96 59 56 8f 28
1f 50 54 00 00 00 01 01 01 01 01 01 01 01 01 01
01 01 01 01 01 01 12 1b 56 78 50 00 0e 30 20 20
35 00 36 ae 10 00 00 19 00 00 00 00 00 00 00 00
00 00 00 00 00 00 00 00 00 00 00 00 00 fe 00 4c
47 20 44 69 73 70 6c 61 79 0a 20 20 00 00 00 fe
00 4c 50 31 34 30 57 48 31 2d 54 4c 44 36 00 2d

----------------

Block 0, Base EDID:
  EDID Structure Version & Revision: 1.3
  Vendor & Product Identification:
    Manufacturer: LGD
    Model: 691
    Made in: 2010
  Basic Display Parameters & Features:
    Digital display
    Maximum image size: 31 cm x 17 cm
    Gamma: 2.20
    RGB color display
    First detailed timing is the preferred timing
  Color Characteristics:
    Red  : 0.5869, 0.3486
    Green: 0.3359, 0.5585
    Blue : 0.1582, 0.1210
    White: 0.3134, 0.3291
  Established Timings I & II: none
  Standard Timings: none
  Detailed Timing Descriptors:
    DTD 1:  1366x768    59.636 Hz 683:384  46.635 kHz  69.300 MHz (310 mm x 174 mm)
                 Hfront   32 Hsync  32 Hback  56 Hpol N
                 Vfront    3 Vsync   5 Vback   6 Vpol N
    Empty Descriptor
    Alphanumeric Data String: 'LG Display'
    Alphanumeric Data String: 'LP140WH1-TLD6'
Checksum: 0x2d

----------------

Failures:

Block 0, Base EDID:
  Empty Descriptor: Use Dummy Descriptor instead of all zeroes.
  Missing Display Product Name.
  Missing Display Range Limits Descriptor.

EDID conformity: FAIL
