edid-decode (hex):

00 ff ff ff ff ff ff 00 1c e6 50 24 01 00 00 00
31 1e 01 03 80 36 1f 78 ea 2d 36 a7 54 38 ae 26
0d 4f 54 af cf 00 a9 c0 b3 00 95 00 81 80 81 c0
81 00 81 40 45 40 02 3a 80 18 71 38 2d 40 58 2c
45 00 1e 31 21 00 00 1e 00 00 00 fc 00 4d 47 33
30 30 0a 20 20 20 20 20 20 20 00 00 00 fd 00 30
4c 0f 96 13 00 0a 20 20 20 20 20 20 00 00 00 ff
00 30 30 30 30 30 30 30 30 30 30 30 30 31 01 f9

02 03 2a f1 48 90 1f 05 14 04 13 03 12 23 09 07
07 83 01 00 00 67 03 0c 00 10 00 38 2d 68 1a 00
00 01 01 2d 4b 00 e3 05 e3 01 7f 48 80 18 71 38
2d 40 30 28 55 00 a0 5a 00 00 00 1e 66 21 56 aa
51 00 1e 30 46 8f 33 00 b2 ee 10 00 00 1e 00 00
00 00 00 00 00 00 00 00 00 00 00 00 00 00 00 00
00 00 00 00 00 00 00 00 00 00 00 00 00 00 00 00
00 00 00 00 00 00 00 00 00 00 00 00 00 00 00 fd

----------------

Block 0, Base EDID:
  EDID Structure Version & Revision: 1.3
  Vendor & Product Identification:
    Manufacturer: GGF
    Model: 9296
    Serial Number: ...
    Made in: week 49 of 2020
  Basic Display Parameters & Features:
    Digital display
    Maximum image size: 54 cm x 31 cm
    Gamma: 2.20
    DPMS levels: Standby Suspend Off
    RGB color display
    First detailed timing is the preferred timing
  Color Characteristics:
    Red  : 0.6523, 0.3300
    Green: 0.2216, 0.6806
    Blue : 0.1484, 0.0537
    White: 0.3095, 0.3300
  Established Timings I & II:
    IBM     :   720x400    70.081663 Hz   9:5     31.467 kHz     28.320000 MHz
    DMT 0x04:   640x480    59.940476 Hz   4:3     31.469 kHz     25.175000 MHz
    DMT 0x05:   640x480    72.808802 Hz   4:3     37.861 kHz     31.500000 MHz
    DMT 0x06:   640x480    75.000000 Hz   4:3     37.500 kHz     31.500000 MHz
    DMT 0x08:   800x600    56.250000 Hz   4:3     35.156 kHz     36.000000 MHz
    DMT 0x09:   800x600    60.316541 Hz   4:3     37.879 kHz     40.000000 MHz
    DMT 0x0a:   800x600    72.187572 Hz   4:3     48.077 kHz     50.000000 MHz
    DMT 0x0b:   800x600    75.000000 Hz   4:3     46.875 kHz     49.500000 MHz
    DMT 0x10:  1024x768    60.003840 Hz   4:3     48.363 kHz     65.000000 MHz
    DMT 0x11:  1024x768    70.069359 Hz   4:3     56.476 kHz     75.000000 MHz
    DMT 0x12:  1024x768    75.028582 Hz   4:3     60.023 kHz     78.750000 MHz
    DMT 0x24:  1280x1024   75.024675 Hz   5:4     79.976 kHz    135.000000 MHz
  Standard Timings:
    DMT 0x53:  1600x900    60.000000 Hz  16:9     60.000 kHz    108.000000 MHz (RB)
    DMT 0x3a:  1680x1050   59.954250 Hz  16:10    65.290 kHz    146.250000 MHz
    DMT 0x2f:  1440x900    59.887445 Hz  16:10    55.935 kHz    106.500000 MHz
    DMT 0x23:  1280x1024   60.019740 Hz   5:4     63.981 kHz    108.000000 MHz
    DMT 0x55:  1280x720    60.000000 Hz  16:9     45.000 kHz     74.250000 MHz
    DMT 0x1c:  1280x800    59.810326 Hz  16:10    49.702 kHz     83.500000 MHz
    DMT 0x20:  1280x960    60.000000 Hz   4:3     60.000 kHz    108.000000 MHz
    DMT 0x09:   800x600    60.316541 Hz   4:3     37.879 kHz     40.000000 MHz
  Detailed Timing Descriptors:
    DTD 1:  1920x1080   60.000000 Hz  16:9     67.500 kHz    148.500000 MHz (542 mm x 305 mm)
                 Hfront   88 Hsync  44 Hback  148 Hpol P
                 Vfront    4 Vsync   5 Vback   36 Vpol P
    Display Product Name: 'MG300'
    Display Range Limits:
      Monitor ranges (GTF): 48-76 Hz V, 15-150 kHz H, max dotclock 190 MHz
    Display Product Serial Number: ...
  Extension blocks: 1
Checksum: 0xf9

----------------

Block 1, CTA-861 Extension Block:
  Revision: 3
  Underscans IT Video Formats by default
  Basic audio support
  Supports YCbCr 4:4:4
  Supports YCbCr 4:2:2
  Native detailed modes: 1
  Video Data Block:
    VIC  16:  1920x1080   60.000000 Hz  16:9     67.500 kHz    148.500000 MHz (native)
    VIC  31:  1920x1080   50.000000 Hz  16:9     56.250 kHz    148.500000 MHz
    VIC   5:  1920x1080i  60.000000 Hz  16:9     33.750 kHz     74.250000 MHz
    VIC  20:  1920x1080i  50.000000 Hz  16:9     28.125 kHz     74.250000 MHz
    VIC   4:  1280x720    60.000000 Hz  16:9     45.000 kHz     74.250000 MHz
    VIC  19:  1280x720    50.000000 Hz  16:9     37.500 kHz     74.250000 MHz
    VIC   3:   720x480    59.940060 Hz  16:9     31.469 kHz     27.000000 MHz
    VIC  18:   720x576    50.000000 Hz  16:9     31.250 kHz     27.000000 MHz
  Audio Data Block:
    Linear PCM:
      Max channels: 2
      Supported sample rates (kHz): 48 44.1 32
      Supported sample sizes (bits): 24 20 16
  Speaker Allocation Data Block:
    FL/FR - Front Left/Right
  Vendor-Specific Data Block (HDMI), OUI 00-0C-03:
    Source physical address: 1.0.0.0
    DC_36bit
    DC_30bit
    DC_Y444
    Maximum TMDS clock: 225 MHz
  Vendor-Specific Data Block (AMD), OUI 00-00-1A:
    Version: 1.1
    Minimum Refresh Rate: 45 Hz
    Maximum Refresh Rate: 75 Hz
    Flags 1.x: 0x00
  Colorimetry Data Block:
    xvYCC601
    xvYCC709
    BT2020cYCC
    BT2020YCC
    BT2020RGB
  Detailed Timing Descriptors:
    DTD 2:  1920x1080   74.985859 Hz  16:9     84.359 kHz    185.590000 MHz (160 mm x 90 mm)
                 Hfront   48 Hsync  40 Hback  192 Hpol P
                 Vfront    5 Vsync   5 Vback   35 Vpol P
    DTD 3:  1366x768    59.789541 Hz 683:384   47.712 kHz     85.500000 MHz (434 mm x 238 mm)
                 Hfront   70 Hsync 143 Hback  213 Hpol P
                 Vfront    3 Vsync   3 Vback   24 Vpol P
Checksum: 0xfd

----------------

Warnings:

Block 1, CTA-861 Extension Block:
  Display Product Serial Number is set, so the Serial Number in the Base EDID should be 0.
EDID:
  CTA-861: Multiple native progressive timings are defined.

Failures:

Block 1, CTA-861 Extension Block:
  Detailed Timing Descriptor #2: Mismatch of image size 160x90 mm vs display size 540x310 mm.
  Detailed Timing Descriptor #3: Mismatch of image size 434x238 mm vs display size 540x310 mm.
  Missing VCDB, needed for Set Selectable RGB Quantization to avoid interop issues.

EDID conformity: FAIL
