edid-decode (hex):

00 ff ff ff ff ff ff 00 09 d1 98 78 45 54 00 00
0b 16 01 03 0e 29 17 78 2e 29 45 a3 56 4b 98 25
12 50 54 a5 6a 00 81 c0 81 cf 01 01 01 01 01 01
01 01 01 01 01 01 66 21 56 aa 51 00 1e 30 46 8f
33 00 9a e6 10 00 00 1e 00 00 00 fd 00 32 4c 1e
53 0b 00 0a 20 20 20 20 20 20 00 00 00 fc 00 42
65 6e 51 20 47 39 35 30 41 0a 20 20 00 00 00 ff
00 44 33 43 30 31 34 39 33 30 31 39 0a 20 00 8c

00 ff ff ff ff ff ff 00 09 d1 98 78 45 54 00 00
0b 16 01 03 0e 29 17 78 2e 29 45 a3 56 4b 98 25
12 50 54 a5 6a 00 81 c0 81 cf 01 01 01 01 01 01
01 01 01 01 01 01 66 21 56 aa 51 00 1e 30 46 8f
33 00 9a e6 10 00 00 1e 00 00 00 fd 00 32 4c 1e
53 0b 00 0a 20 20 20 20 20 20 00 00 00 fc 00 42
65 6e 51 20 47 39 35 30 41 0a 20 20 00 00 00 ff
00 44 33 43 30 31 34 39 33 30 31 39 0a 20 00 8c

----------------

Block 0, Base EDID:
  EDID Structure Version & Revision: 1.3
  Vendor & Product Identification:
    Manufacturer: BNQ
    Model: 30872
    Serial Number: ...
    Made in: week 11 of 2012
  Basic Display Parameters & Features:
    Analog display
    Signal Level Standard: 0.700 : 0.300 : 1.000 V p-p
    Blank level equals black level
    Sync: Separate Composite SyncOnGreen
    Maximum image size: 41 cm x 23 cm
    Gamma: 2.20
    DPMS levels: Off
    RGB color display
    Default (sRGB) color space is primary color space
    First detailed timing is the preferred timing
  Color Characteristics:
    Red  : 0.6367, 0.3378
    Green: 0.2949, 0.5947
    Blue : 0.1455, 0.0703
    White: 0.3134, 0.3291
  Established Timings I & II:
    IBM     :   720x400    70.081663 Hz   9:5     31.467 kHz     28.320000 MHz
    DMT 0x04:   640x480    59.940476 Hz   4:3     31.469 kHz     25.175000 MHz
    DMT 0x06:   640x480    75.000000 Hz   4:3     37.500 kHz     31.500000 MHz
    DMT 0x09:   800x600    60.316541 Hz   4:3     37.879 kHz     40.000000 MHz
    DMT 0x0b:   800x600    75.000000 Hz   4:3     46.875 kHz     49.500000 MHz
    Apple   :   832x624    74.551266 Hz   4:3     49.726 kHz     57.284000 MHz
    DMT 0x10:  1024x768    60.003840 Hz   4:3     48.363 kHz     65.000000 MHz
    DMT 0x12:  1024x768    75.028582 Hz   4:3     60.023 kHz     78.750000 MHz
  Standard Timings:
    DMT 0x55:  1280x720    60.000000 Hz  16:9     45.000 kHz     74.250000 MHz
    GTF     :  1280x720    74.999686 Hz  16:9     56.400 kHz     95.654000 MHz
  Detailed Timing Descriptors:
    DTD 1:  1366x768    59.789541 Hz 683:384   47.712 kHz     85.500000 MHz (410 mm x 230 mm)
                 Hfront   70 Hsync 143 Hback  213 Hpol P
                 Vfront    3 Vsync   3 Vback   24 Vpol P
    Display Range Limits:
      Monitor ranges (GTF): 50-76 Hz V, 30-83 kHz H, max dotclock 110 MHz
    Display Product Name: 'BenQ G950A'
    Display Product Serial Number: ...
Checksum: 0x8c

----------------

Block 1, Unknown EDID Extension Block 0x00:
  00 ff ff ff ff ff ff 00 09 d1 98 78 45 54 00 00 '...........xET..'
  0b 16 01 03 0e 29 17 78 2e 29 45 a3 56 4b 98 25 '.....).x.)E.VK.%'
  12 50 54 a5 6a 00 81 c0 81 cf 01 01 01 01 01 01 '.PT.j...........'
  01 01 01 01 01 01 66 21 56 aa 51 00 1e 30 46 8f '......f!V.Q..0F.'
  33 00 9a e6 10 00 00 1e 00 00 00 fd 00 32 4c 1e '3............2L.'
  53 0b 00 0a 20 20 20 20 20 20 00 00 00 fc 00 42 'S...      .....B'
  65 6e 51 20 47 39 35 30 41 0a 20 20 00 00 00 ff 'enQ G950A.  ....'
  00 44 33 43 30 31 34 39 33 30 31 39 0a 20 00 8c '.D3C01493019. ..'
Checksum: 0x8c

----------------

Failures:

Block 0, Base EDID:
  Basic Display Parameters & Features: sRGB is signaled, but the chromaticities do not match.
Block 1, Base EDID:
  Unknown Extension Block.
EDID:
  Base EDID: EDID specified 0 extension block(s), but found 1 extension block(s).

EDID conformity: FAIL
