
EDID (hex):
00ffffffffffff0009d1987845540000
251501030e2917782e2945a3564b9825
125054a56a0081c081cf010101010101
010101010101662156aa51001e30468f
33009ae61000001e000000fd00324c1e
530b000a202020202020000000fc0042
656e512047393530410a2020000000ff
0046394230323530353031390a200071

Extracted contents:
header:          00 ff ff ff ff ff ff 00
serial number:   09 d1 98 78 45 54 00 00 25 15
version:         01 03
basic params:    0e 29 17 78 2e
chroma info:     29 45 a3 56 4b 98 25 12 50 54
established:     a5 6a 00
standard:        81 c0 81 cf 01 01 01 01 01 01 01 01 01 01 01 01
descriptor 1:    66 21 56 aa 51 00 1e 30 46 8f 33 00 9a e6 10 00 00 1e
descriptor 2:    00 00 00 fd 00 32 4c 1e 53 0b 00 0a 20 20 20 20 20 20
descriptor 3:    00 00 00 fc 00 42 65 6e 51 20 47 39 35 30 41 0a 20 20
descriptor 4:    00 00 00 ff 00 46 39 42 30 32 35 30 35 30 31 39 0a 20
extensions:      00
checksum:        71

EDID version: 1.3
Manufacturer: BNQ Model 7898 Serial Number --
Made in week 37 of 2011
Analog display, Input voltage level: 0.7/0.3 V
Sync: Separate Composite SyncOnGreen 
Maximum image size: 41 cm x 23 cm
Gamma: 2.20
DPMS levels: Off
RGB color display
Default (sRGB) color space is primary color space
First detailed timing is preferred timing
Display x,y Chromaticity:
  Red:   0.6367, 0.3378
  Green: 0.2949, 0.5947
  Blue:  0.1455, 0.0703
  White: 0.3134, 0.3291
Established timings supported:
  720x400@70Hz 9:5 HorFreq: 31469 Hz Clock: 28.320 MHz
  640x480@60Hz 4:3 HorFreq: 31469 Hz Clock: 25.175 MHz
  640x480@75Hz 4:3 HorFreq: 37500 Hz Clock: 31.500 MHz
  800x600@60Hz 4:3 HorFreq: 37900 Hz Clock: 40.000 MHz
  800x600@75Hz 4:3 HorFreq: 46900 Hz Clock: 49.500 MHz
  832x624@75Hz 4:3 HorFreq: 49726 Hz Clock: 57.284 MHz
  1024x768@60Hz 4:3 HorFreq: 48400 Hz Clock: 65.000 MHz
  1024x768@75Hz 4:3 HorFreq: 60000 Hz Clock: 78.750 MHz
Standard timings supported:
  1280x720@60Hz 16:9
  1280x720@75Hz 16:9
Detailed mode: Clock 85.500 MHz, 410 mm x 230 mm
               1366 1436 1579 1792 hborder 0
                768  771  774  798 vborder 0
               +hsync +vsync 
               VertFreq: 59 Hz, HorFreq: 47712 Hz
Monitor ranges (GTF): 50-76Hz V, 30-83kHz H, max dotclock 110MHz
Monitor name: BenQ G950A
Serial number: --
Checksum: 0x71 (valid)
EDID block does NOT conform to EDID 1.3!
	sRGB is signaled, but the chromaticities do not match
