edid-decode (hex):

00 ff ff ff ff ff ff 00 4c 83 44 57 00 00 00 00
00 19 01 04 a5 22 13 78 0a e7 25 99 59 56 8e 28
1e 50 54 00 00 00 01 01 01 01 01 01 01 01 01 01
01 01 01 01 01 01 d2 37 80 a2 70 38 40 40 30 20
25 00 58 c2 10 00 00 19 37 25 80 a2 70 38 40 40
30 20 25 00 58 c2 10 00 00 19 00 00 00 00 00 00
00 00 00 00 00 00 00 00 00 00 00 00 00 00 00 02
00 0c 3f ff 0c 3c 7d 1e 18 32 7d 00 00 00 00 e7

----------------

Block 0, Base EDID:
  EDID Structure Version & Revision: 1.4
  Vendor & Product Identification:
    Manufacturer: SDC
    Model: 22340
    Made in: 2015
  Basic Display Parameters & Features:
    Digital display
    Bits per primary color channel: 8
    DisplayPort interface
    Maximum image size: 34 cm x 19 cm
    Gamma: 2.20
    Supported color formats: RGB 4:4:4, YCrCb 4:4:4
    First detailed timing includes the native pixel format and preferred refresh rate
  Color Characteristics:
    Red  : 0.6005, 0.3496
    Green: 0.3369, 0.5576
    Blue : 0.1562, 0.1191
    White: 0.3134, 0.3291
  Established Timings I & II: none
  Standard Timings: none
  Detailed Timing Descriptors:
    DTD 1:  1920x1080   59.996 Hz  16:9    68.636 kHz 142.900 MHz (344 mm x 194 mm)
                 Hfront   48 Hsync  32 Hback  82 Hpol N
                 Vfront    2 Vsync   5 Vback  57 Vpol N
    DTD 2:  1920x1080   39.999 Hz  16:9    45.759 kHz  95.270 MHz (344 mm x 194 mm)
                 Hfront   48 Hsync  32 Hback  82 Hpol N
                 Vfront    2 Vsync   5 Vback  57 Vpol N
    Empty Descriptor
    Manufacturer-Specified Display Descriptor (0x02): 00 02 00 0c 3f ff 0c 3c 7d 1e 18 32 7d 00 00 00 '....?..<}..2}...'
Checksum: 0xe7
