
EDID (hex):
00ffffffffffff004c83503200000000
00180104952213780ae415995b5a9627
1e505400000001010101010101010101
010101010101dc3780a0703840403020
250058c2100000190000000f00000000
00000000001e82105200000000fe0053
414d53554e470a2020202020000000fe
00313536484c30372d3730310a200008

Extracted contents:
header:          00 ff ff ff ff ff ff 00
serial number:   4c 83 50 32 00 00 00 00 00 18
version:         01 04
basic params:    95 22 13 78 0a
chroma info:     e4 15 99 5b 5a 96 27 1e 50 54
established:     00 00 00
standard:        01 01 01 01 01 01 01 01 01 01 01 01 01 01 01 01
descriptor 1:    dc 37 80 a0 70 38 40 40 30 20 25 00 58 c2 10 00 00 19
descriptor 2:    00 00 00 0f 00 00 00 00 00 00 00 00 00 1e 82 10 52 00
descriptor 3:    00 00 00 fe 00 53 41 4d 53 55 4e 47 0a 20 20 20 20 20
descriptor 4:    00 00 00 fe 00 31 35 36 48 4c 30 37 2d 37 30 31 0a 20
extensions:      00
checksum:        08

EDID version: 1.4
Manufacturer: SDC Model 3250 Serial Number --
Made in year 2014
Digital display
6 bits per primary color channel
DisplayPort interface
Maximum image size: 34 cm x 19 cm
Gamma: 2.20
Supported color formats: RGB 4:4:4, YCrCb 4:4:4
First detailed timing includes the native pixel format and preferred refresh rate
Display x,y Chromaticity:
  Red:   0.6005, 0.3574
  Green: 0.3525, 0.5859
  Blue:  0.1523, 0.1181
  White: 0.3134, 0.3291
Established timings supported:
Standard timings supported:
Detailed mode: Clock 143.000 MHz, 344 mm x 194 mm
               1920 1968 2000 2080 hborder 0
               1080 1082 1087 1144 vborder 0
               -hsync -vsync 
               VertFreq: 60 Hz, HorFreq: 68750 Hz
Manufacturer-specified data, tag 15
ASCII string: SAMSUNG
ASCII string: 156HL07-701
Checksum: 0x8 (valid)
EDID block does NOT conform to EDID 1.4!
	Missing name descriptor
	Missing monitor ranges


