edid-decode (hex):

00 ff ff ff ff ff ff 00 22 f0 55 29 01 01 01 01
29 15 01 03 80 34 20 78 2a fc 81 a4 55 4d 9d 25
12 50 54 21 08 00 d1 c0 81 c0 81 40 81 80 95 00
a9 40 b3 00 01 01 28 3c 80 a0 70 b0 23 40 30 20
36 00 06 44 21 00 00 1a 00 00 00 fd 00 18 3c 18
50 11 00 0a 20 20 20 20 20 20 00 00 00 fc 00 48
50 20 5a 52 32 34 34 30 77 0a 20 20 00 00 00 ff
00 43 4e 54 31 34 31 30 31 35 5a 0a 20 20 00 4a

00 ff ff ff ff ff ff 00 22 f0 55 29 01 01 01 01
29 15 01 03 80 34 20 78 2a fc 81 a4 55 4d 9d 25
12 50 54 21 08 00 d1 c0 81 c0 81 40 81 80 95 00
a9 40 b3 00 01 01 28 3c 80 a0 70 b0 23 40 30 20
36 00 06 44 21 00 00 1a 00 00 00 fd 00 18 3c 18
50 11 00 0a 20 20 20 20 20 20 00 00 00 fc 00 48
50 20 5a 52 32 34 34 30 77 0a 20 20 00 00 00 ff
00 43 4e 54 31 34 31 30 31 35 5a 0a 20 20 00 4a

----------------

Block 0, Base EDID:
  EDID Structure Version & Revision: 1.3
  Vendor & Product Identification:
    Manufacturer: HWP
    Model: 10581
    Serial Number: ...
    Made in: week 41 of 2011
  Basic Display Parameters & Features:
    Digital display
    Maximum image size: 52 cm x 32 cm
    Gamma: 2.20
    DPMS levels: Off
    RGB color display
    First detailed timing is the preferred timing
  Color Characteristics:
    Red  : 0.6435, 0.3349
    Green: 0.3037, 0.6132
    Blue : 0.1464, 0.0703
    White: 0.3125, 0.3291
  Established Timings I & II:
    DMT 0x04:   640x480    59.940476 Hz   4:3     31.469 kHz     25.175000 MHz
    DMT 0x09:   800x600    60.316541 Hz   4:3     37.879 kHz     40.000000 MHz
    DMT 0x10:  1024x768    60.003840 Hz   4:3     48.363 kHz     65.000000 MHz
  Standard Timings:
    DMT 0x52:  1920x1080   60.000000 Hz  16:9     67.500 kHz    148.500000 MHz
    DMT 0x55:  1280x720    60.000000 Hz  16:9     45.000 kHz     74.250000 MHz
    DMT 0x20:  1280x960    60.000000 Hz   4:3     60.000 kHz    108.000000 MHz
    DMT 0x23:  1280x1024   60.019740 Hz   5:4     63.981 kHz    108.000000 MHz
    DMT 0x2f:  1440x900    59.887445 Hz  16:10    55.935 kHz    106.500000 MHz
    DMT 0x33:  1600x1200   60.000000 Hz   4:3     75.000 kHz    162.000000 MHz
    DMT 0x3a:  1680x1050   59.954250 Hz  16:10    65.290 kHz    146.250000 MHz
  Detailed Timing Descriptors:
    DTD 1:  1920x1200   59.950171 Hz  16:10    74.038 kHz    154.000000 MHz (518 mm x 324 mm)
                 Hfront   48 Hsync  32 Hback   80 Hpol P
                 Vfront    3 Vsync   6 Vback   26 Vpol N
    Display Range Limits:
      Monitor ranges (GTF): 24-60 Hz V, 24-80 kHz H, max dotclock 170 MHz
    Display Product Name: 'HP ZR2440w'
    Display Product Serial Number: ...
Checksum: 0x4a

----------------

Block 1, Unknown EDID Extension Block 0x00:
  00 ff ff ff ff ff ff 00 22 f0 55 29 01 01 01 01 '........".U)....'
  29 15 01 03 80 34 20 78 2a fc 81 a4 55 4d 9d 25 ')....4 x*...UM.%'
  12 50 54 21 08 00 d1 c0 81 c0 81 40 81 80 95 00 '.PT!.......@....'
  a9 40 b3 00 01 01 28 3c 80 a0 70 b0 23 40 30 20 '.@....(<..p.#@0 '
  36 00 06 44 21 00 00 1a 00 00 00 fd 00 18 3c 18 '6..D!.........<.'
  50 11 00 0a 20 20 20 20 20 20 00 00 00 fc 00 48 'P...      .....H'
  50 20 5a 52 32 34 34 30 77 0a 20 20 00 00 00 ff 'P ZR2440w.  ....'
  00 43 4e 54 31 34 31 30 31 35 5a 0a 20 20 00 4a '.CNT141015Z.  .J'
Checksum: 0x4a

----------------

Failures:

Block 1, Base EDID:
  Unknown Extension Block.
EDID:
  Base EDID: EDID specified 0 extension block(s), but found 1 extension block(s).

EDID conformity: FAIL
