
EDID (hex):
00ffffffffffff0009e5950600000000
011a0104952615780a3750a5554e9c26
10505400000001010101010101010101
0101010101013c3780de703814403020
36007cd21000001a302c80de70381440
302036007cd21000001a000000fe0039
39443439804e5631374e343100000000
0001411196000000000a010a20200099

Extracted contents:
header:          00 ff ff ff ff ff ff 00
serial number:   09 e5 95 06 00 00 00 00 01 1a
version:         01 04
basic params:    95 26 15 78 0a
chroma info:     37 50 a5 55 4e 9c 26 10 50 54
established:     00 00 00
standard:        01 01 01 01 01 01 01 01 01 01 01 01 01 01 01 01
descriptor 1:    3c 37 80 de 70 38 14 40 30 20 36 00 7c d2 10 00 00 1a
descriptor 2:    30 2c 80 de 70 38 14 40 30 20 36 00 7c d2 10 00 00 1a
descriptor 3:    00 00 00 fe 00 39 39 44 34 39 80 4e 56 31 37 4e 34 31
descriptor 4:    00 00 00 00 00 01 41 11 96 00 00 00 00 0a 01 0a 20 20
extensions:      00
checksum:        99

EDID version: 1.4
Manufacturer: BOE Model 695 Serial Number --
Made in week 1 of 2016
Digital display
6 bits per primary color channel
DisplayPort interface
Maximum image size: 38 cm x 21 cm
Gamma: 2.20
Supported color formats: RGB 4:4:4, YCrCb 4:4:4
First detailed timing includes the native pixel format and preferred refresh rate
Display x,y Chromaticity:
  Red:   0.6445, 0.3349
  Green: 0.3056, 0.6123
  Blue:  0.1494, 0.0634
  White: 0.3125, 0.3281
Established timings supported:
Standard timings supported:
Detailed mode: Clock 141.400 MHz, 380 mm x 210 mm
               1920 1968 2000 2142 hborder 0
               1080 1083 1089 1100 vborder 0
               +hsync -vsync 
               VertFreq: 60 Hz, HorFreq: 66013 Hz
Detailed mode: Clock 113.120 MHz, 380 mm x 210 mm
               1920 1968 2000 2142 hborder 0
               1080 1083 1089 1100 vborder 0
               +hsync -vsync 
               VertFreq: 48 Hz, HorFreq: 52810 Hz
ASCII string: 99D49
Manufacturer-specified data, tag 0
Checksum: 0x99 (valid)
EDID block does NOT conform to EDID 1.4!
	Missing name descriptor
	Missing monitor ranges
	Detailed block string not properly terminated
