edid-decode (hex):

00 ff ff ff ff ff ff 00 4d d9 01 26 01 01 01 01
01 11 01 03 18 47 28 78 ee 00 04 00 54 4c 00 26
0f 50 54 2f cc 00 31 40 45 40 61 40 81 c0 31 4f
45 4f 31 59 45 59 20 1c 50 a0 50 00 16 30 30 20
35 00 47 28 00 00 00 1a 20 1c 00 c0 50 00 31 30
40 20 07 04 43 28 00 10 0d 1a 00 00 00 fd 00 01
55 01 39 08 00 0a 20 20 20 20 20 20 00 00 00 fc
00 53 4f 4e 59 20 54 56 0a 20 20 20 20 20 00 84

----------------

Block 0, Base EDID:
  EDID Structure Version & Revision: 1.3
  Vendor & Product Identification:
    Manufacturer: SNY
    Model: 9729
    Serial Number: ...
    Made in: week 1 of 2007
  Basic Display Parameters & Features:
    Analog display
    Input voltage level: 0.7/0.3 V
    Blank-to-black setup/pedestal
    Sync: Separate
    Maximum image size: 71 cm x 40 cm
    Gamma: 2.20
    DPMS levels: Standby Suspend Off
    RGB color display
    Default (sRGB) color space is primary color space
    First detailed timing is the preferred timing
  Color Characteristics:
    Red  : 0.0000, 0.3281
    Green: 0.2968, 0.0000
    Blue : 0.1484, 0.0585
    White: 0.3134, 0.3281
  Established Timings I & II:
    DMT 0x04:   640x480    59.940476 Hz   4:3     31.469 kHz     25.175000 MHz
    DMT 0x05:   640x480    72.808802 Hz   4:3     37.861 kHz     31.500000 MHz
    DMT 0x06:   640x480    75.000000 Hz   4:3     37.500 kHz     31.500000 MHz
    DMT 0x08:   800x600    56.250000 Hz   4:3     35.156 kHz     36.000000 MHz
    DMT 0x09:   800x600    60.316541 Hz   4:3     37.879 kHz     40.000000 MHz
    DMT 0x0a:   800x600    72.187572 Hz   4:3     48.077 kHz     50.000000 MHz
    DMT 0x0b:   800x600    75.000000 Hz   4:3     46.875 kHz     49.500000 MHz
    DMT 0x10:  1024x768    60.003840 Hz   4:3     48.363 kHz     65.000000 MHz
    DMT 0x11:  1024x768    70.069359 Hz   4:3     56.476 kHz     75.000000 MHz
  Standard Timings:
    DMT 0x04:   640x480    59.940476 Hz   4:3     31.469 kHz     25.175000 MHz
    DMT 0x09:   800x600    60.316541 Hz   4:3     37.879 kHz     40.000000 MHz
    DMT 0x10:  1024x768    60.003840 Hz   4:3     48.363 kHz     65.000000 MHz
    DMT 0x55:  1280x720    60.000000 Hz  16:9     45.000 kHz     74.250000 MHz
    DMT 0x06:   640x480    75.000000 Hz   4:3     37.500 kHz     31.500000 MHz
    DMT 0x0b:   800x600    75.000000 Hz   4:3     46.875 kHz     49.500000 MHz
    DMT 0x07:   640x480    85.008312 Hz   4:3     43.269 kHz     36.000000 MHz
    DMT 0x0c:   800x600    85.061274 Hz   4:3     53.674 kHz     56.250000 MHz
  Detailed Timing Descriptors:
    DTD 1:  1360x768    59.960027 Hz  85:48    47.368 kHz     72.000000 MHz (71 mm x 40 mm)
                 Hfront   48 Hsync  32 Hback   80 Hpol P
                 Vfront    3 Vsync   5 Vback   14 Vpol N
    DTD 2:  1280x768    59.869086 Hz   5:3     48.913 kHz     72.000000 MHz (67 mm x 40 mm)
                 Hfront   64 Hsync  32 Hback   64 Hpol P Hborder 16
                 Vfront   16 Vsync   7 Vback    0 Vpol N Vborder 13
    Display Range Limits:
      Monitor ranges (GTF): 1-85 Hz V, 1-57 kHz H, max dotclock 80 MHz
    Display Product Name: 'SONY TV'
Checksum: 0x84

----------------

Warnings:

Block 0, Base EDID:
  Detailed Timing Descriptor #2: The use of non-zero borders in a DTD is not recommended.

Failures:

Block 0, Base EDID:
  Basic Display Parameters & Features: sRGB is signaled, but the chromaticities do not match.
  Detailed Timing Descriptor #1: Mismatch of image size 71x40 mm vs display size 710x400 mm.
  Detailed Timing Descriptor #2: 0 or negative vertical back porch.
  Detailed Timing Descriptor #2: Mismatch of image size 67x40 mm vs display size 710x400 mm.

EDID conformity: FAIL
