
EDID (hex):
00ffffffffffff005cb40a005b1e0000
06190103084627788ed7a5a2594a9624
145054afce0001010101010101010101
010101010101662156aa51001e30468f
330040846300001e000000fc00574433
324842313132300a2020000000fd0039
4e1e410b0000000000000000000000ff
00303031304e35303630303330320082

edid-decode (hex):

00 ff ff ff ff ff ff 00 5c b4 0a 00 5b 1e 00 00
06 19 01 03 08 46 27 78 8e d7 a5 a2 59 4a 96 24
14 50 54 af ce 00 01 01 01 01 01 01 01 01 01 01
01 01 01 01 01 01 66 21 56 aa 51 00 1e 30 46 8f
33 00 40 84 63 00 00 1e 00 00 00 fc 00 57 44 33
32 48 42 31 31 32 30 0a 20 20 00 00 00 fd 00 39
4e 1e 41 0b 00 00 00 00 00 00 00 00 00 00 00 ff
00 30 30 31 30 4e 35 30 36 30 30 33 30 32 00 82

----------------

Block 0, Base EDID:
  EDID Structure Version & Revision: 1.3
  Vendor & Product Identification:
    Manufacturer: WET
    Model: 10
    Serial Number: 7771
    Made in: week 6 of 2015
  Basic Display Parameters & Features:
    Analog display
    Signal Level Standard: 0.700 : 0.300 : 1.000 V p-p
    Blank level equals black level
    Sync: Separate
    Maximum image size: 70 cm x 39 cm
    Gamma: 2.20
    DPMS levels: Standby
    RGB color display
    Default (sRGB) color space is primary color space
    First detailed timing is the preferred timing
  Color Characteristics:
    Red  : 0.6357, 0.3486
    Green: 0.2900, 0.5888
    Blue : 0.1425, 0.0800
    White: 0.3134, 0.3291
  Established Timings I & II:
    IBM     :   720x400    70.081663 Hz   9:5     31.467 kHz     28.320000 MHz
    DMT 0x04:   640x480    59.940476 Hz   4:3     31.469 kHz     25.175000 MHz
    DMT 0x05:   640x480    72.808802 Hz   4:3     37.861 kHz     31.500000 MHz
    DMT 0x06:   640x480    75.000000 Hz   4:3     37.500 kHz     31.500000 MHz
    DMT 0x08:   800x600    56.250000 Hz   4:3     35.156 kHz     36.000000 MHz
    DMT 0x09:   800x600    60.316541 Hz   4:3     37.879 kHz     40.000000 MHz
    DMT 0x0a:   800x600    72.187572 Hz   4:3     48.077 kHz     50.000000 MHz
    DMT 0x0b:   800x600    75.000000 Hz   4:3     46.875 kHz     49.500000 MHz
    DMT 0x10:  1024x768    60.003840 Hz   4:3     48.363 kHz     65.000000 MHz
    DMT 0x11:  1024x768    70.069359 Hz   4:3     56.476 kHz     75.000000 MHz
    DMT 0x12:  1024x768    75.028582 Hz   4:3     60.023 kHz     78.750000 MHz
  Standard Timings: none
  Detailed Timing Descriptors:
    DTD 1:  1366x768    59.789541 Hz 683:384   47.712 kHz     85.500000 MHz (1600 mm x 900 mm)
                 Hfront   70 Hsync 143 Hback  213 Hpol P
                 Vfront    3 Vsync   3 Vback   24 Vpol P
    Display Product Name: 'WD32HB1120'
    Display Range Limits:
      Monitor ranges (GTF): 57-78 Hz V, 30-65 kHz H, max dotclock 110 MHz
    Display Product Serial Number: '0010N50600302'
Checksum: 0x82
