
EDID (hex):
00ffffffffffff004032441400000000
29130104a51f11780a96a59e57529929
15505400000001010101010101010101
0101010101017e1d56c2500026301f41
4c0058c11000001a0000001000002630
1f414c0058c11000001a000000fc0050
415231333636583736380a20000000fe
004e31343042362d4c31320a202000a5

Extracted contents:
header:          00 ff ff ff ff ff ff 00
serial number:   40 32 44 14 00 00 00 00 29 13
version:         01 04
basic params:    a5 1f 11 78 0a
chroma info:     96 a5 9e 57 52 99 29 15 50 54
established:     00 00 00
standard:        01 01 01 01 01 01 01 01 01 01 01 01 01 01 01 01
descriptor 1:    7e 1d 56 c2 50 00 26 30 1f 41 4c 00 58 c1 10 00 00 1a
descriptor 2:    00 00 00 10 00 00 26 30 1f 41 4c 00 58 c1 10 00 00 1a
descriptor 3:    00 00 00 fc 00 50 41 52 31 33 36 36 58 37 36 38 0a 20
descriptor 4:    00 00 00 fe 00 4e 31 34 30 42 36 2d 4c 31 32 0a 20 20
extensions:      00
checksum:        a5

EDID version: 1.4
Manufacturer: PAR Model 1444 Serial Number --
Made in week 41 of 2009
Digital display
8 bits per primary color channel
DisplayPort interface
Maximum image size: 31 cm x 17 cm
Gamma: 2.20
Supported color formats: RGB 4:4:4, YCrCb 4:4:4
First detailed timing includes the native pixel format and preferred refresh rate
Display x,y Chromaticity:
  Red:   0.6191, 0.3408
  Green: 0.3212, 0.5996
  Blue:  0.1621, 0.0839
  White: 0.3134, 0.3291
Established timings supported:
Standard timings supported:
Detailed mode: Clock 75.500 MHz, 344 mm x 193 mm
               1366 1397 1462 1560 hborder 0
                768  772  784  806 vborder 0
               +hsync -vsync 
               VertFreq: 60 Hz, HorFreq: 48397 Hz
Dummy block
Monitor name: PAR1366X768
ASCII string: N140B6-L12
Checksum: 0xa5 (valid)
	Missing monitor ranges
EDID block does not conform at all!
	Dummy block filled with garbage
