edid-decode (hex):

00 ff ff ff ff ff ff 00 06 af b5 db 00 00 00 00
2d 22 01 04 b5 22 16 78 03 c8 b5 a7 55 48 9f 25
0f 50 54 00 00 00 01 01 01 01 01 01 01 01 01 01
01 01 01 01 01 01 3e d8 00 a0 a0 40 60 60 30 20
aa 00 58 d7 10 00 00 1a 7f 56 00 a0 a0 40 60 60
30 20 aa 00 58 d7 10 00 00 1a 00 00 00 fe 00 48
56 39 33 4a 80 42 31 36 30 51 41 4e 00 00 00 00
00 03 41 2e 9e 00 11 00 00 0b 41 0a 20 20 01 69

70 20 79 02 00 20 00 13 4f 55 41 b5 db 00 00 00
00 2d 18 07 42 31 36 30 51 41 4e 21 01 1d 77 0d
6a 08 00 0a 40 06 88 7a fa 54 87 f4 9e 56 d2 0f
02 35 54 b0 5c b0 5c 00 34 13 78 22 00 14 6b 72
08 85 ff 09 9f 00 2f 80 1f 00 3f 06 5f 00 09 00
09 00 25 01 09 6b 72 08 6b 72 08 30 78 80 2e 00
06 80 4b b0 5c b0 5c 81 00 13 72 1a 00 00 03 51
30 78 00 00 53 49 53 49 78 00 00 00 00 00 62 90

00 ff ff ff ff ff ff 00 06 af b5 db 00 00 00 00
2d 22 01 04 b5 22 16 78 03 c8 b5 a7 55 48 9f 25
0f 50 54 00 00 00 01 01 01 01 01 01 01 01 01 01
01 01 01 01 01 01 3e d8 00 a0 a0 40 60 60 30 20
aa 00 58 d7 10 00 00 1a 7f 56 00 a0 a0 40 60 60
30 20 aa 00 58 d7 10 00 00 1a 00 00 00 fe 00 48
56 39 33 4a 80 42 31 36 30 51 41 4e 00 00 00 00
00 03 41 2e 9e 00 11 00 00 0b 41 0a 20 20 01 69

70 20 79 02 00 20 00 13 4f 55 41 b5 db 00 00 00
00 2d 18 07 42 31 36 30 51 41 4e 21 01 1d 77 0d
6a 08 00 0a 40 06 88 7a fa 54 87 f4 9e 56 d2 0f
02 35 54 b0 5c b0 5c 00 34 13 78 22 00 14 6b 72
08 85 ff 09 9f 00 2f 80 1f 00 3f 06 5f 00 09 00
09 00 25 01 09 6b 72 08 6b 72 08 30 78 80 2e 00
06 80 4b b0 5c b0 5c 81 00 13 72 1a 00 00 03 51
30 78 00 00 53 49 53 49 78 00 00 00 00 00 62 90

----------------

Block 0, Base EDID:
  EDID Structure Version & Revision: 1.4
  Vendor & Product Identification:
    Manufacturer: AUO
    Model: 56245
    Made in: week 45 of 2024
  Basic Display Parameters & Features:
    Digital display
    Bits per primary color channel: 10
    DisplayPort interface
    Maximum image size: 34 cm x 22 cm
    Gamma: 2.20
    Supported color formats: RGB 4:4:4
    First detailed timing includes the native pixel format and preferred refresh rate
    Display is continuous frequency
  Color Characteristics:
    Red  : 0.6552, 0.3320
    Green: 0.2832, 0.6210
    Blue : 0.1464, 0.0615
    White: 0.3134, 0.3291
  Established Timings I & II: none
  Standard Timings: none
  Detailed Timing Descriptors:
    DTD 1:  2560x1600  120.001214 Hz  16:10   203.522 kHz    553.580000 MHz (344 mm x 215 mm)
                 Hfront   48 Hsync  32 Hback   80 Hpol P
                 Vfront   10 Vsync  10 Vback   76 Vpol N
    DTD 2:  2560x1600   48.000052 Hz  16:10    81.408 kHz    221.430000 MHz (344 mm x 215 mm)
                 Hfront   48 Hsync  32 Hback   80 Hpol P
                 Vfront   10 Vsync  10 Vback   76 Vpol N
    Alphanumeric Data String: 'HV93J'
    Manufacturer-Specified Display Descriptor (0x00): 00 00 00 03 41 2e 9e 00 11 00 00 0b 41 0a 20 20 '....A.......A.  '
  Extension blocks: 1
Checksum: 0x69

----------------

Block 1, DisplayID Extension Block:
  Version: 2.0
  Extension Count: 0
  Display Product Primary Use Case: None of the listed primary use cases; generic display
  Product Identification Data Block (0x20), OUI 4F-55-41:
    Product Code: 56245
    Year of Manufacture: 2024, Week 45
    Product ID: B160QAN
  Display Parameters Data Block (0x21):
    Image size: 344.7 mm x 215.4 mm
    Display native pixel format: 2560x1600
    Scan Orientation: Left to Right, Top to Bottom
    Luminance Information: Guidance for the Source device
    Color Information: CIE 1931
    Audio Speaker Information: not integrated
    Native Color Chromaticity:
      Primary #1:  (0.654785, 0.331787)
      Primary #2:  (0.282959, 0.620850)
      Primary #3:  (0.145996, 0.061768)
      White Point: (0.312988, 0.328857)
    Native Maximum Luminance (Full Coverage): 300.000000 cd/m^2
    Native Maximum Luminance (10% Rectangular Coverage): 300.000000 cd/m^2
    Native Minimum Luminance: 0.250000 cd/m^2
    Native Color Depth: 12 bpc
    Display Device Technology: Active Matrix LCD
    Display Device Theme Preference: No Preference
    Native Gamma EOTF: 2.20
  Video Timing Modes Type 7 - Detailed Timings Data Block:
    DTD:  2560x1600  120.001214 Hz  16:10   203.522 kHz    553.580000 MHz (aspect 16:10, no 3D stereo, preferred)
               Hfront   48 Hsync  32 Hback   80 Hpol P
               Vfront   10 Vsync  10 Vback   76 Vpol N
  Dynamic Video Timing Range Limits Data Block:
    Minimum Pixel Clock: 553580 kHz
    Maximum Pixel Clock: 553580 kHz
    Minimum Vertical Refresh Rate: 48 Hz
    Maximum Vertical Refresh Rate: 120 Hz
    Seamless Dynamic Video Timing Support: Yes
  Unknown DisplayID Data Block (0x2e, length 6):
    80 4b b0 5c b0 5c                               '.K.\.\'
  CTA-861 DisplayID Data Block:
  Vendor-Specific Data Block (AMD), OUI 00-00-1A:
    Version: 3.81
    Minimum Refresh Rate: 48 Hz
    Maximum Refresh Rate: 120 Hz
    Flags 1.x: 0x00
    Flags 2.x: 0x00
    Maximum luminance: 83 (301.833 cd/m^2)
    Minimum luminance: 73 (0.247 cd/m^2)
    Unknown: 0x53 0x49
  Checksum: 0x62
Checksum: 0x90

----------------

Block 2, Unknown EDID Extension Block 0x00:
  00 ff ff ff ff ff ff 00 06 af b5 db 00 00 00 00 '................'
  2d 22 01 04 b5 22 16 78 03 c8 b5 a7 55 48 9f 25 '-"...".x....UH.%'
  0f 50 54 00 00 00 01 01 01 01 01 01 01 01 01 01 '.PT.............'
  01 01 01 01 01 01 3e d8 00 a0 a0 40 60 60 30 20 '......>....@``0 '
  aa 00 58 d7 10 00 00 1a 7f 56 00 a0 a0 40 60 60 '..X......V...@``'
  30 20 aa 00 58 d7 10 00 00 1a 00 00 00 fe 00 48 '0 ..X..........H'
  56 39 33 4a 80 42 31 36 30 51 41 4e 00 00 00 00 'V93J.B160QAN....'
  00 03 41 2e 9e 00 11 00 00 0b 41 0a 20 20 01 69 '..A.......A.  .i'
Checksum: 0x69

----------------

Block 3, DisplayID Extension Block:
  Version: 2.0
  Extension Count: 0
  Product Identification Data Block (0x20), OUI 4F-55-41:
    Product Code: 56245
    Year of Manufacture: 2024, Week 45
    Product ID: B160QAN
  Display Parameters Data Block (0x21):
    Image size: 344.7 mm x 215.4 mm
    Display native pixel format: 2560x1600
    Scan Orientation: Left to Right, Top to Bottom
    Luminance Information: Guidance for the Source device
    Color Information: CIE 1931
    Audio Speaker Information: not integrated
    Native Color Chromaticity:
      Primary #1:  (0.654785, 0.331787)
      Primary #2:  (0.282959, 0.620850)
      Primary #3:  (0.145996, 0.061768)
      White Point: (0.312988, 0.328857)
    Native Maximum Luminance (Full Coverage): 300.000000 cd/m^2
    Native Maximum Luminance (10% Rectangular Coverage): 300.000000 cd/m^2
    Native Minimum Luminance: 0.250000 cd/m^2
    Native Color Depth: 12 bpc
    Display Device Technology: Active Matrix LCD
    Display Device Theme Preference: No Preference
    Native Gamma EOTF: 2.20
  Video Timing Modes Type 7 - Detailed Timings Data Block:
    DTD:  2560x1600  120.001214 Hz  16:10   203.522 kHz    553.580000 MHz (aspect 16:10, no 3D stereo, preferred)
               Hfront   48 Hsync  32 Hback   80 Hpol P
               Vfront   10 Vsync  10 Vback   76 Vpol N
  Dynamic Video Timing Range Limits Data Block:
    Minimum Pixel Clock: 553580 kHz
    Maximum Pixel Clock: 553580 kHz
    Minimum Vertical Refresh Rate: 48 Hz
    Maximum Vertical Refresh Rate: 120 Hz
    Seamless Dynamic Video Timing Support: Yes
  Unknown DisplayID Data Block (0x2e, length 6):
    80 4b b0 5c b0 5c                               '.K.\.\'
  CTA-861 DisplayID Data Block:
  Vendor-Specific Data Block (AMD), OUI 00-00-1A:
    Version: 3.81
    Minimum Refresh Rate: 48 Hz
    Maximum Refresh Rate: 120 Hz
    Flags 1.x: 0x00
    Flags 2.x: 0x00
    Maximum luminance: 83 (301.833 cd/m^2)
    Minimum luminance: 73 (0.247 cd/m^2)
    Unknown: 0x53 0x49
  Checksum: 0x62
Checksum: 0x90

----------------

Warnings:

Block 0, Base EDID:
  Missing Display Product Name.
Block 1, DisplayID Extension Block:
  Product Identification Data Block (0x20), OUI 4F-55-41: Unknown OUI 4F-55-41 (possible PNP OUA).
Block 3, DisplayID Extension Block:
  Product Identification Data Block (0x20), OUI 4F-55-41: Unknown OUI 4F-55-41 (possible PNP OUA).

Failures:

Block 0, Base EDID:
  Alphanumeric Data String: Non-printable character.
  Missing Display Range Limits Descriptor.
Block 1, DisplayID Extension Block:
  Expected 0 DisplayID Extension Block, but got 1.
Block 2, Base EDID:
  Unknown Extension Block.
Block 3, DisplayID Extension Block:
  Product Type should be 0 in extension block.
  Product Identification Data Block (0x20), OUI 4F-55-41: Product Identification Data Block (0x20), OUI 4F-55-41 is required to be the first DisplayID Data Block.
  Display Parameters Data Block (0x21): Duplicate Display Parameters Data Block.
EDID:
  Base EDID: EDID specified 1 extension block(s), but found 3 extension block(s).
  DisplayID: Missing DisplayID Display Interface Features Data Block.

EDID conformity: FAIL
