edid-decode (hex):

00 ff ff ff ff ff ff 00 22 f0 56 28 01 01 01 01
26 13 01 03 a0 22 1b 8c ee f6 b0 a3 55 4c 9b 25
11 50 54 a1 08 00 81 40 01 01 01 01 01 01 01 01
01 01 01 01 01 01 30 2a 00 98 51 00 2a 40 30 70
13 00 54 0e 11 00 00 1e 00 00 00 fd 00 32 4c 18
53 0e 00 0a 20 20 20 20 20 20 00 00 00 fc 00 4c
45 31 37 31 31 0a 20 20 20 20 20 20 00 00 00 ff
00 43 4e 43 39 33 38 50 35 34 5a 0a 20 20 00 63

00 ff ff ff ff ff ff 00 22 f0 56 28 01 01 01 01
26 13 01 03 a0 22 1b 8c ee f6 b0 a3 55 4c 9b 25
11 50 54 a1 08 00 81 40 01 01 01 01 01 01 01 01
01 01 01 01 01 01 30 2a 00 98 51 00 2a 40 30 70
13 00 54 0e 11 00 00 1e 00 00 00 fd 00 32 4c 18
53 0e 00 0a 20 20 20 20 20 20 00 00 00 fc 00 4c
45 31 37 31 31 0a 20 20 20 20 20 20 00 00 00 ff
00 43 4e 43 39 33 38 50 35 34 5a 0a 20 20 00 63

----------------

Block 0, Base EDID:
  EDID Structure Version & Revision: 1.3
  Vendor & Product Identification:
    Manufacturer: HWP
    Model: 10326
    Serial Number: ...
    Made in: week 38 of 2009
  Basic Display Parameters & Features:
    Digital display
    Maximum image size: 34 cm x 27 cm
    Gamma: 2.40
    DPMS levels: Standby Suspend Off
    RGB color display
    Default (sRGB) color space is primary color space
    First detailed timing is the preferred timing
  Color Characteristics:
    Red  : 0.6396, 0.3349
    Green: 0.2978, 0.6074
    Blue : 0.1464, 0.0693
    White: 0.3125, 0.3281
  Established Timings I & II:
    IBM     :   720x400    70.081663 Hz   9:5     31.467 kHz     28.320000 MHz
    DMT 0x04:   640x480    59.940476 Hz   4:3     31.469 kHz     25.175000 MHz
    DMT 0x09:   800x600    60.316541 Hz   4:3     37.879 kHz     40.000000 MHz
    DMT 0x10:  1024x768    60.003840 Hz   4:3     48.363 kHz     65.000000 MHz
  Standard Timings:
    DMT 0x20:  1280x960    60.000000 Hz   4:3     60.000 kHz    108.000000 MHz
  Detailed Timing Descriptors:
    DTD 1:  1280x1024   60.019740 Hz   5:4     63.981 kHz    108.000000 MHz (340 mm x 270 mm)
                 Hfront   48 Hsync 112 Hback  248 Hpol P
                 Vfront    1 Vsync   3 Vback   38 Vpol P
    Display Range Limits:
      Monitor ranges (GTF): 50-76 Hz V, 24-83 kHz H, max dotclock 140 MHz
    Display Product Name: 'LE1711'
    Display Product Serial Number: ...
Checksum: 0x63

----------------

Block 1, Unknown EDID Extension Block 0x00:
  00 ff ff ff ff ff ff 00 22 f0 56 28 01 01 01 01 '........".V(....'
  26 13 01 03 a0 22 1b 8c ee f6 b0 a3 55 4c 9b 25 '&...."......UL.%'
  11 50 54 a1 08 00 81 40 01 01 01 01 01 01 01 01 '.PT....@........'
  01 01 01 01 01 01 30 2a 00 98 51 00 2a 40 30 70 '......0*..Q.*@0p'
  13 00 54 0e 11 00 00 1e 00 00 00 fd 00 32 4c 18 '..T..........2L.'
  53 0e 00 0a 20 20 20 20 20 20 00 00 00 fc 00 4c 'S...      .....L'
  45 31 37 31 31 0a 20 20 20 20 20 20 00 00 00 ff 'E1711.      ....'
  00 43 4e 43 39 33 38 50 35 34 5a 0a 20 20 00 63 '.CNC938P54Z.  .c'
Checksum: 0x63

----------------

Warnings:

Block 0, Base EDID:
  Basic Display Parameters & Features: sRGB is signaled, but the gamma != 2.2.

Failures:

Block 0, Base EDID:
  Basic Display Parameters & Features: Digital Video Interface Standard set to reserved value 0x20.
  Basic Display Parameters & Features: sRGB is signaled, but the chromaticities do not match.
Block 1, Base EDID:
  Unknown Extension Block.
EDID:
  Base EDID: EDID specified 0 extension block(s), but found 1 extension block(s).

EDID conformity: FAIL
