
EDID (hex):
00ffffffffffff001e6d914b52a00100
0c1201036a291778ea1e95a355489827
155054a56e00314f454f614f01010101
010101010101662150b051001b304070
360096e51000001e0e1f008051001e30
4080370096e51000001c000000fd0038
4b1e3d09000a202020202020000000fc
0057313934310a2020202020202000dc

Extracted contents:
header:          00 ff ff ff ff ff ff 00
serial number:   1e 6d 91 4b 52 a0 01 00 0c 12
version:         01 03
basic params:    6a 29 17 78 ea
chroma info:     1e 95 a3 55 48 98 27 15 50 54
established:     a5 6e 00
standard:        31 4f 45 4f 61 4f 01 01 01 01 01 01 01 01 01 01
descriptor 1:    66 21 50 b0 51 00 1b 30 40 70 36 00 96 e5 10 00 00 1e
descriptor 2:    0e 1f 00 80 51 00 1e 30 40 80 37 00 96 e5 10 00 00 1c
descriptor 3:    00 00 00 fd 00 38 4b 1e 3d 09 00 0a 20 20 20 20 20 20
descriptor 4:    00 00 00 fc 00 57 31 39 34 31 0a 20 20 20 20 20 20 20
extensions:      00
checksum:        dc

EDID version: 1.3
Manufacturer: GSM Model 4b91 Serial Number --
Made in week 12 of 2008
Analog display, Input voltage level: 0.7/0.7 V
Sync: Separate SyncOnGreen 
Maximum image size: 41 cm x 23 cm
Gamma: 2.20
DPMS levels: Standby Suspend Off
RGB color display
First detailed timing is preferred timing
Display x,y Chromaticity:
  Red:   0.6367, 0.3330
  Green: 0.2841, 0.5957
  Blue:  0.1542, 0.0830
  White: 0.3134, 0.3291
Established timings supported:
  720x400@70Hz 9:5 HorFreq: 31469 Hz Clock: 28.320 MHz
  640x480@60Hz 4:3 HorFreq: 31469 Hz Clock: 25.175 MHz
  640x480@75Hz 4:3 HorFreq: 37500 Hz Clock: 31.500 MHz
  800x600@60Hz 4:3 HorFreq: 37900 Hz Clock: 40.000 MHz
  800x600@75Hz 4:3 HorFreq: 46900 Hz Clock: 49.500 MHz
  832x624@75Hz 4:3 HorFreq: 49726 Hz Clock: 57.284 MHz
  1024x768@60Hz 4:3 HorFreq: 48400 Hz Clock: 65.000 MHz
  1024x768@70Hz 4:3 HorFreq: 56500 Hz Clock: 75.000 MHz
  1024x768@75Hz 4:3 HorFreq: 60000 Hz Clock: 78.750 MHz
Standard timings supported:
  640x480@75Hz 4:3 HorFreq: 37500 Hz Clock: 31.500 MHz
  800x600@75Hz 4:3 HorFreq: 46900 Hz Clock: 49.500 MHz
  1024x768@75Hz 4:3 HorFreq: 60000 Hz Clock: 78.750 MHz
Detailed mode: Clock 85.500 MHz, 406 mm x 229 mm
               1360 1424 1536 1792 hborder 0
                768  771  777  795 vborder 0
               +hsync +vsync 
               VertFreq: 60 Hz, HorFreq: 47712 Hz
Detailed mode: Clock 79.500 MHz, 406 mm x 229 mm
               1280 1344 1472 1664 hborder 0
                768  771  778  798 vborder 0
               -hsync +vsync 
               VertFreq: 59 Hz, HorFreq: 47776 Hz
Monitor ranges (GTF): 56-75Hz V, 30-61kHz H, max dotclock 90MHz
Monitor name: W1941
Checksum: 0xdc (valid)
