
EDID (hex):
00ffffffffffff00328d000000000000
2d170103e87341782aee91a3544c9926
0f505421080081008140818090409500
a9c0b300a940011d007251d01e206e28
5500c48e2100001ef339801871382d40
582c4500c48e2100001e000000fd001e
551e6414000a202020202020000000fc
0048444d493241560a202020002001d6

Extracted contents:
header:          00 ff ff ff ff ff ff 00
serial number:   32 8d 00 00 00 00 00 00 2d 17
version:         01 03
basic params:    e8 73 41 78 2a
chroma info:     ee 91 a3 54 4c 99 26 0f 50 54
established:     21 08 00
standard:        81 00 81 40 81 80 90 40 95 00 a9 c0 b3 00 a9 40
descriptor 1:    01 1d 00 72 51 d0 1e 20 6e 28 55 00 c4 8e 21 00 00 1e
descriptor 2:    f3 39 80 18 71 38 2d 40 58 2c 45 00 c4 8e 21 00 00 1e
descriptor 3:    00 00 00 fd 00 1e 55 1e 64 14 00 0a 20 20 20 20 20 20
descriptor 4:    00 00 00 fc 00 48 44 4d 49 32 41 56 0a 20 20 20 00 20
extensions:      01
checksum:        d6

EDID version: 1.3
Manufacturer: LTM Model 0 Serial Number --
Made in week 45 of 2013
Digital display
Maximum image size: 115 cm x 65 cm
Gamma: 2.20
DPMS levels: Off
RGB color display
First detailed timing is preferred timing
Display x,y Chromaticity:
  Red:   0.6396, 0.3300
  Green: 0.2998, 0.5996
  Blue:  0.1503, 0.0595
  White: 0.3125, 0.3291
Established timings supported:
  640x480@60Hz 4:3 HorFreq: 31469 Hz Clock: 25.175 MHz
  800x600@60Hz 4:3 HorFreq: 37900 Hz Clock: 40.000 MHz
  1024x768@60Hz 4:3 HorFreq: 48400 Hz Clock: 65.000 MHz
Standard timings supported:
  1280x800@60Hz 16:10
  1280x960@60Hz 4:3 HorFreq: 60000 Hz Clock: 108.000 MHz
  1280x1024@60Hz 5:4 HorFreq: 64000 Hz Clock: 108.000 MHz
  1400x1050@60Hz 4:3 HorFreq: 64700 Hz Clock: 101.000 MHz
  1440x900@60Hz 16:10 HorFreq: 55500 Hz Clock: 88.750 MHz
  1600x900@60Hz 16:9
  1680x1050@60Hz 16:10 HorFreq: 64700 Hz Clock: 119.000 MHz
  1600x1200@60Hz 4:3 HorFreq: 75000 Hz Clock: 162.000 MHz
Detailed mode: Clock 74.250 MHz, 708 mm x 398 mm
               1280 1390 1430 1650 hborder 0
                720  725  730  750 vborder 0
               +hsync +vsync 
               VertFreq: 60 Hz, HorFreq: 45000 Hz
Detailed mode: Clock 148.350 MHz, 708 mm x 398 mm
               1920 2008 2052 2200 hborder 0
               1080 1084 1089 1125 vborder 0
               +hsync +vsync 
               VertFreq: 59 Hz, HorFreq: 67431 Hz
Monitor ranges (GTF): 30-85Hz V, 30-100kHz H, max dotclock 200MHz
Monitor name: HDMI2AV
Has 1 extension blocks
Checksum: 0xd6 (valid)
EDID block does NOT conform to EDID 1.3!
	Digital display field contains garbage: 68
