edid-decode (hex):

00 ff ff ff ff ff ff 00 32 8d 00 00 00 00 00 00
2d 17 01 03 80 73 41 78 2a ee 91 a3 54 4c 99 26
0f 50 54 21 08 00 81 00 81 40 81 80 90 40 95 00
a9 c0 b3 00 a9 40 01 1d 00 72 51 d0 1e 20 6e 28
55 00 c4 8e 21 00 00 1e f3 39 80 18 71 38 2d 40
58 2c 45 00 c4 8e 21 00 00 1e 00 00 00 fd 00 1e
55 1e 64 14 00 0a 20 20 20 20 20 20 00 00 00 fc
00 48 44 4d 49 32 41 56 0a 20 20 20 00 20 01 3e

02 03 1b 61 23 09 07 07 83 01 00 00 67 03 0c 00
20 00 80 2d 43 90 84 02 e2 00 0f 8c 0a d0 8a 20
e0 2d 10 10 3e 96 00 a0 5a 00 00 00 00 00 00 00
00 00 00 00 00 00 00 00 00 00 00 00 00 00 00 00
00 00 00 00 00 00 00 00 00 00 00 00 00 00 00 00
00 00 00 00 00 00 00 00 00 00 00 00 00 00 00 00
00 00 00 00 00 00 00 00 00 00 00 00 00 00 00 00
00 00 00 00 00 00 00 00 00 00 00 00 00 00 00 29

----------------

Block 0, Base EDID:
  EDID Structure Version & Revision: 1.3
  Vendor & Product Identification:
    Manufacturer: LTM
    Model: 0
    Made in: week 45 of 2013
  Basic Display Parameters & Features:
    Digital display
    Maximum image size: 115 cm x 65 cm
    Gamma: 2.20
    DPMS levels: Off
    RGB color display
    First detailed timing is the preferred timing
  Color Characteristics:
    Red  : 0.6396, 0.3300
    Green: 0.2998, 0.5996
    Blue : 0.1503, 0.0595
    White: 0.3125, 0.3291
  Established Timings I & II:
    DMT 0x04:   640x480    59.940 Hz   4:3    31.469 kHz  25.175 MHz
    DMT 0x09:   800x600    60.317 Hz   4:3    37.879 kHz  40.000 MHz
    DMT 0x10:  1024x768    60.004 Hz   4:3    48.363 kHz  65.000 MHz
  Standard Timings:
    DMT 0x1c:  1280x800    59.810 Hz  16:10   49.702 kHz  83.500 MHz
    DMT 0x20:  1280x960    60.000 Hz   4:3    60.000 kHz 108.000 MHz
    DMT 0x23:  1280x1024   60.020 Hz   5:4    63.981 kHz 108.000 MHz
    DMT 0x2a:  1400x1050   59.978 Hz   4:3    65.317 kHz 121.750 MHz
    DMT 0x2f:  1440x900    59.887 Hz  16:10   55.935 kHz 106.500 MHz
    DMT 0x53:  1600x900    60.000 Hz  16:9    60.000 kHz 108.000 MHz (RB)
    DMT 0x3a:  1680x1050   59.954 Hz  16:10   65.290 kHz 146.250 MHz
    DMT 0x33:  1600x1200   60.000 Hz   4:3    75.000 kHz 162.000 MHz
  Detailed Timing Descriptors:
    DTD 1:  1280x720    60.000 Hz  16:9    45.000 kHz  74.250 MHz (708 mm x 398 mm)
                 Hfront  110 Hsync  40 Hback 220 Hpol P
                 Vfront    5 Vsync   5 Vback  20 Vpol P
    DTD 2:  1920x1080   59.939 Hz  16:9    67.432 kHz 148.350 MHz (708 mm x 398 mm)
                 Hfront   88 Hsync  44 Hback 148 Hpol P
                 Vfront    4 Vsync   5 Vback  36 Vpol P
  Display Range Limits:
    Monitor ranges (GTF): 30-85 Hz V, 30-100 kHz H, max dotclock 200 MHz
    Display Product Name: 'HDMI2AV'
  Extension blocks: 1
Checksum: 0x3e

----------------

Block 1, CTA-861 Extension Block:
  Revision: 3
  Basic audio support
  Supports YCbCr 4:4:4
  Native detailed modes: 1
  Audio Data Block:
    Linear PCM:
      Max channels: 2
      Supported sample rates (kHz): 48 44.1 32
      Supported sample sizes (bits): 24 20 16
  Speaker Allocation Data Block:
    FL/FR - Front Left/Right
  Vendor-Specific Data Block (HDMI), OUI 00-0C-03:
    Source physical address: 2.0.0.0
    Supports_AI
    Maximum TMDS clock: 225 MHz
  Video Data Block:
    VIC  16:  1920x1080   60.000 Hz  16:9    67.500 kHz 148.500 MHz (native)
    VIC   4:  1280x720    60.000 Hz  16:9    45.000 kHz  74.250 MHz (native)
    VIC   2:   720x480    59.940 Hz   4:3    31.469 kHz  27.000 MHz
  Video Capability Data Block:
    YCbCr quantization: No Data
    RGB quantization: No Data
    PT scan behavior: No Data
    IT scan behavior: Supports both over- and underscan
    CE scan behavior: Supports both over- and underscan
  Detailed Timing Descriptors:
    DTD 3:   720x480    59.940 Hz   3:2    31.469 kHz  27.000 MHz (analog composite, sync-on-green, 160 mm x 90 mm)
                 Hfront   16 Hsync  62 Hback  60 Hpol N
                 Vfront    9 Vsync   6 Vback  30 Vpol N
Checksum: 0x29

----------------

Warnings:

Block 1, CTA-861 Extension Block:
  IT Video Formats are overscanned by default, but normally this should be underscanned.
  Video Capability Data Block: Set Selectable RGB Quantization to avoid interop issues.

Failures:

Block 0, Base EDID:
  Detailed Timing Descriptor #1: Mismatch of image size 708x398 mm vs display size 1150x650 mm.
  Detailed Timing Descriptor #2: Mismatch of image size 708x398 mm vs display size 1150x650 mm.
  Display Product Name: Non-space after newline.
Block 1, CTA-861 Extension Block:
  Detailed Timing Descriptor #3: Mismatch of image size 160x90 mm vs display size 1150x650 mm.
EDID:
  CTA-861: Native progressive timings are a mix of several resolutions.

EDID conformity: FAIL
