
EDID (hex):
00ffffffffffff0049f7811d00000000
24100103680000ffe8bbb9a352469824
0f484c2dce00314f454f010101010101
01010101010164190040410026301888
3600671f11000018000000fd003a551e
410b000a202020202020000000fc0000
0000000000000a2020202020000000ff
00483131313730313833300a202000e2

Extracted contents:
header:          00 ff ff ff ff ff ff 00
serial number:   49 f7 81 1d 00 00 00 00 24 10
version:         01 03
basic params:    68 00 00 ff e8
chroma info:     bb b9 a3 52 46 98 24 0f 48 4c
established:     2d ce 00
standard:        31 4f 45 4f 01 01 01 01 01 01 01 01 01 01 01 01
descriptor 1:    64 19 00 40 41 00 26 30 18 88 36 00 67 1f 11 00 00 18
descriptor 2:    00 00 00 fd 00 3a 55 1e 41 0b 00 0a 20 20 20 20 20 20
descriptor 3:    00 00 00 fc 00 00 00 00 00 00 00 00 0a 20 20 20 20 20
descriptor 4:    00 00 00 ff 00 48 31 31 31 37 30 31 38 33 30 0a 20 20
extensions:      00
checksum:        e2

EDID version: 1.3
Manufacturer: ROW Model 1d81 Serial Number --
Made in week 36 of 2006
Analog display, Input voltage level: 0.7/0.7 V
Sync: Separate 
Image size is variable
Gamma: 1.0
DPMS levels: Standby Suspend Off
RGB color display
Display x,y Chromaticity:
  Red:   0.6386, 0.3232
  Green: 0.2753, 0.5966
  Blue:  0.1425, 0.0615
  White: 0.2832, 0.2978
Established timings supported:
  640x480@60Hz 4:3 HorFreq: 31469 Hz Clock: 25.175 MHz
  640x480@72Hz 4:3 HorFreq: 37900 Hz Clock: 31.500 MHz
  640x480@75Hz 4:3 HorFreq: 37500 Hz Clock: 31.500 MHz
  800x600@60Hz 4:3 HorFreq: 37900 Hz Clock: 40.000 MHz
  800x600@72Hz 4:3 HorFreq: 48100 Hz Clock: 50.000 MHz
  800x600@75Hz 4:3 HorFreq: 46900 Hz Clock: 49.500 MHz
  1024x768@60Hz 4:3 HorFreq: 48400 Hz Clock: 65.000 MHz
  1024x768@70Hz 4:3 HorFreq: 56500 Hz Clock: 75.000 MHz
  1024x768@75Hz 4:3 HorFreq: 60000 Hz Clock: 78.750 MHz
Standard timings supported:
  640x480@75Hz 4:3 HorFreq: 37500 Hz Clock: 31.500 MHz
  800x600@75Hz 4:3 HorFreq: 46900 Hz Clock: 49.500 MHz
Detailed mode: Clock 65.000 MHz, 359 mm x 287 mm
               1024 1048 1184 1344 hborder 0
                768  771  777  806 vborder 0
               -hsync -vsync 
               VertFreq: 60 Hz, HorFreq: 48363 Hz
Monitor ranges (GTF): 58-85Hz V, 30-65kHz H, max dotclock 110MHz
Serial number: --
Checksum: 0xe2 (valid)
EDID block does NOT conform to EDID 1.3!
	Name descriptor not terminated with a newline
	Missing preferred timing
