
EDID (hex):
00ffffffffffff004e84000000000000
011f010380351e782af6e5a7534d9924
145054bfef00d1cfb300950081808140
81c0d1cf0101023a801871382d40582c
4500132a2100001e000000ff00303030
303030303030300a2020000000fd0030
4b1e5514000a202020202020000000fc
0048444d490a2020202020202020017f
020316b14b101f051404130312021101
65030c0010008c0ad08a20e02d10103e
9600132a2100001e011d007251d01e20
6e285500132a2100001e8c0ad08a20e0
2d10103e9600132a2100001e2a4480a0
70382740582c4500132a2100001e0000
00000000000000000000000000000000
0000000000000000000000000000008b

Extracted contents:
header:          00 ff ff ff ff ff ff 00
serial number:   4e 84 00 00 00 00 00 00 01 1f
version:         01 03
basic params:    80 35 1e 78 2a
chroma info:     f6 e5 a7 53 4d 99 24 14 50 54
established:     bf ef 00
standard:        d1 cf b3 00 95 00 81 80 81 40 81 c0 d1 cf 01 01
descriptor 1:    02 3a 80 18 71 38 2d 40 58 2c 45 00 13 2a 21 00 00 1e
descriptor 2:    00 00 00 ff 00 30 30 30 30 30 30 30 30 30 30 0a 20 20
descriptor 3:    00 00 00 fd 00 30 4b 1e 55 14 00 0a 20 20 20 20 20 20
descriptor 4:    00 00 00 fc 00 48 44 4d 49 0a 20 20 20 20 20 20 20 20
extensions:      01
checksum:        7f

EDID version: 1.3
Manufacturer: STD Model 0 Serial Number --
Made in week 1 of 2021
Digital display
Maximum image size: 53 cm x 30 cm
Gamma: 2.20
DPMS levels: Off
RGB color display
First detailed timing is preferred timing
Display x,y Chromaticity:
  Red:   0.6552, 0.3271
  Green: 0.3017, 0.5996
  Blue:  0.1435, 0.0800
  White: 0.3134, 0.3291
Established timings supported:
  720x400@70Hz 9:5 HorFreq: 31469 Hz Clock: 28.320 MHz
  640x480@60Hz 4:3 HorFreq: 31469 Hz Clock: 25.175 MHz
  640x480@67Hz 4:3 HorFreq: 35000 Hz Clock: 30.240 MHz
  640x480@72Hz 4:3 HorFreq: 37900 Hz Clock: 31.500 MHz
  640x480@75Hz 4:3 HorFreq: 37500 Hz Clock: 31.500 MHz
  800x600@56Hz 4:3 HorFreq: 35200 Hz Clock: 36.000 MHz
  800x600@60Hz 4:3 HorFreq: 37900 Hz Clock: 40.000 MHz
  800x600@72Hz 4:3 HorFreq: 48100 Hz Clock: 50.000 MHz
  800x600@75Hz 4:3 HorFreq: 46900 Hz Clock: 49.500 MHz
  832x624@75Hz 4:3 HorFreq: 49726 Hz Clock: 57.284 MHz
  1024x768@60Hz 4:3 HorFreq: 48400 Hz Clock: 65.000 MHz
  1024x768@70Hz 4:3 HorFreq: 56500 Hz Clock: 75.000 MHz
  1024x768@75Hz 4:3 HorFreq: 60000 Hz Clock: 78.750 MHz
  1280x1024@75Hz 5:4 HorFreq: 80000 Hz Clock: 135.000 MHz
Standard timings supported:
  1920x1080@75Hz 16:9
  1680x1050@60Hz 16:10 HorFreq: 64700 Hz Clock: 119.000 MHz
  1440x900@60Hz 16:10 HorFreq: 55500 Hz Clock: 88.750 MHz
  1280x1024@60Hz 5:4 HorFreq: 64000 Hz Clock: 108.000 MHz
  1280x960@60Hz 4:3 HorFreq: 60000 Hz Clock: 108.000 MHz
  1280x720@60Hz 16:9
  1920x1080@75Hz 16:9
Detailed mode: Clock 148.500 MHz, 531 mm x 298 mm
               1920 2008 2052 2200 hborder 0
               1080 1084 1089 1125 vborder 0
               +hsync +vsync 
               VertFreq: 60 Hz, HorFreq: 67500 Hz
Serial number: --
Monitor ranges (GTF): 48-75Hz V, 30-85kHz H, max dotclock 200MHz
Monitor name: HDMI
Has 1 extension blocks
Checksum: 0x7f (valid)

CTA extension block
Extension version: 3
18 bytes of CTA data
  Video data block
    VIC  16 1920x1080@60Hz 16:9  HorFreq: 67500 Hz Clock: 148.500 MHz
    VIC  31 1920x1080@50Hz 16:9  HorFreq: 56250 Hz Clock: 148.500 MHz
    VIC   5 1920x1080i@60Hz 16:9  HorFreq: 33750 Hz Clock: 74.250 MHz
    VIC  20 1920x1080i@50Hz 16:9  HorFreq: 28125 Hz Clock: 74.250 MHz
    VIC   4 1280x720@60Hz 16:9  HorFreq: 45000 Hz Clock: 74.250 MHz
    VIC  19 1280x720@50Hz 16:9  HorFreq: 37500 Hz Clock: 74.250 MHz
    VIC   3 720x480@60Hz 16:9  HorFreq: 31469 Hz Clock: 27.000 MHz
    VIC  18 720x576@50Hz 16:9  HorFreq: 31250 Hz Clock: 27.000 MHz
    VIC   2 720x480@60Hz 4:3  HorFreq: 31469 Hz Clock: 27.000 MHz
    VIC  17 720x576@50Hz 4:3  HorFreq: 31250 Hz Clock: 27.000 MHz
    VIC   1 640x480@60Hz 4:3  HorFreq: 31469 Hz Clock: 25.175 MHz
  Vendor-specific data block, OUI 000c03 (HDMI)
    Source physical address 1.0.0.0
Underscans PC formats by default
Supports YCbCr 4:4:4
Supports YCbCr 4:2:2
1 native detailed modes
Detailed mode: Clock 27.000 MHz, 531 mm x 298 mm
                720  736  798  858 hborder 0
                480  489  495  525 vborder 0
               +hsync +vsync 
               VertFreq: 59 Hz, HorFreq: 31468 Hz
Detailed mode: Clock 74.250 MHz, 531 mm x 298 mm
               1280 1390 1430 1650 hborder 0
                720  725  730  750 vborder 0
               +hsync +vsync 
               VertFreq: 60 Hz, HorFreq: 45000 Hz
Detailed mode: Clock 27.000 MHz, 531 mm x 298 mm
                720  736  798  858 hborder 0
                480  489  495  525 vborder 0
               +hsync +vsync 
               VertFreq: 59 Hz, HorFreq: 31468 Hz
Detailed mode: Clock 174.500 MHz, 531 mm x 298 mm
               1920 2008 2052 2080 hborder 0
               1080 1084 1089 1119 vborder 0
               +hsync +vsync 
               VertFreq: 74 Hz, HorFreq: 83894 Hz
Checksum: 0x8b (valid)

One or more of the timings is out of range of the Monitor Ranges:
  Vertical Freq: 50 - 75 Hz
  Horizontal Freq: 28125 - 83894 Hz
  Maximum Clock: 174.500 MHz
