
EDID (hex):
00ffffffffffff004c83533800000000
00190104a51a11780bee95a3544c9926
0f505400000001010101010101010101
010101010101d282b0dca02040703020
250004ad10000019000000fd00303c00
0022040a141414141414000000fe0053
414d53554e470a2020202020000000fe
00313233594c30312d3030310a2000fb

Extracted contents:
header:          00 ff ff ff ff ff ff 00
serial number:   4c 83 53 38 00 00 00 00 00 19
version:         01 04
basic params:    a5 1a 11 78 0b
chroma info:     ee 95 a3 54 4c 99 26 0f 50 54
established:     00 00 00
standard:        01 01 01 01 01 01 01 01 01 01 01 01 01 01 01 01
descriptor 1:    d2 82 b0 dc a0 20 40 70 30 20 25 00 04 ad 10 00 00 19
descriptor 2:    00 00 00 fd 00 30 3c 00 00 22 04 0a 14 14 14 14 14 14
descriptor 3:    00 00 00 fe 00 53 41 4d 53 55 4e 47 0a 20 20 20 20 20
descriptor 4:    00 00 00 fe 00 31 32 33 59 4c 30 31 2d 30 30 31 0a 20
extensions:      00
checksum:        fb

EDID version: 1.4
Manufacturer: SDC Model 3853 Serial Number --
Made in year 2015
Digital display
8 bits per primary color channel
DisplayPort interface
Maximum image size: 26 cm x 17 cm
Gamma: 2.20
Supported color formats: RGB 4:4:4, YCrCb 4:4:4
First detailed timing includes the native pixel format and preferred refresh rate
Display is continuous frequency
Display x,y Chromaticity:
  Red:   0.6396, 0.3300
  Green: 0.2998, 0.5996
  Blue:  0.1503, 0.0595
  White: 0.3134, 0.3291
Established timings supported:
Standard timings supported:
Detailed mode: Clock 334.900 MHz, 260 mm x 173 mm
               2736 2784 2816 2956 hborder 0
               1824 1826 1831 1888 vborder 0
               -hsync -vsync 
               VertFreq: 60 Hz, HorFreq: 113294 Hz
Monitor ranges (CVT): 48-60Hz V, 0-0kHz H, max dotclock 340MHz
CVT version 0.10
Real max dotclock: 338.75MHz
Max active pixels per line: 160
Supported aspect ratios:    5:4 
Preferred aspect ratio: 4:3
Supports CVT reduced blanking
Supported display scaling:
    Vertical stretch
Preferred vertical refresh: 20 Hz
ASCII string: SAMSUNG
ASCII string: 123YL01-001
Checksum: 0xfb (valid)
EDID block does NOT conform to EDID 1.4!
	Missing name descriptor
EDID block does not conform at all!
	Detailed blocks filled with garbage
	Range descriptor contains garbage
