edid-decode (hex):

00 ff ff ff ff ff ff 00 4c 2d 53 70 37 44 58 43
33 1e 01 04 b5 77 22 78 3a c7 25 b1 4b 46 a8 26
0e 50 54 bf ef 80 71 4f 81 00 81 c0 81 80 a9 c0
b3 00 95 00 d1 c0 1a 68 00 a0 f0 38 1f 40 30 20
3a 00 a9 50 41 00 00 1a 00 00 00 fd 08 32 f0 1e
66 c2 00 0a 20 20 20 20 20 20 00 00 00 fc 00 4c
43 34 39 47 39 35 54 0a 20 20 20 20 00 00 00 ff
00 48 34 5a 4e 43 30 31 32 32 39 0a 20 20 02 c4

02 03 22 f0 44 10 5a 3f 5c 23 09 07 07 83 01 00
00 e3 05 c0 00 e6 06 05 01 8b 73 12 e5 01 8b 84
90 01 56 5e 00 a0 a0 a0 29 50 30 20 35 00 a9 50
41 00 00 1a 58 4d 00 b8 a1 38 14 40 f8 2c 45 00
a9 50 41 00 00 1e 74 d6 00 a0 f0 38 40 40 30 20
3a 00 a9 50 41 00 00 1a 6f c2 00 a0 a0 a0 55 50
30 20 35 00 a9 50 41 00 00 1a 00 00 00 00 00 00
00 00 00 00 00 00 00 00 00 00 00 00 00 00 00 82

70 12 79 00 00 03 01 64 9c f5 02 88 ff 13 3f 01
7f 80 1f 00 9f 05 2e 00 20 00 07 00 2f 79 01 08
ff 13 9f 00 2f 80 1f 00 9f 05 53 00 02 00 09 00
33 b7 00 08 ff 13 9f 00 2f 80 1f 00 9f 05 28 00
02 00 09 00 e3 6e 01 08 ff 09 4f 00 07 80 1f 00
9f 05 2a 00 20 00 07 00 90 c7 01 08 ff 0e 9f 00
2f 80 1f 00 37 04 86 00 02 00 09 00 00 00 00 00
00 00 00 00 00 00 00 00 00 00 00 00 00 00 1d 90

----------------

Block 0, Base EDID:
  EDID Structure Version & Revision: 1.4
  Vendor & Product Identification:
    Manufacturer: SAM
    Model: 28755
    Serial Number: ...
    Made in: week 51 of 2020
  Basic Display Parameters & Features:
    Digital display
    Bits per primary color channel: 10
    DisplayPort interface
    Maximum image size: 119 cm x 34 cm
    Gamma: 2.20
    DPMS levels: Off
    Supported color formats: RGB 4:4:4, YCrCb 4:4:4, YCrCb 4:2:2
    First detailed timing includes the native pixel format and preferred refresh rate
  Color Characteristics:
    Red  : 0.6943, 0.2929
    Green: 0.2744, 0.6591
    Blue : 0.1484, 0.0566
    White: 0.3134, 0.3291
  Established Timings I & II:
    IBM     :   720x400    70.082 Hz   9:5    31.467 kHz  28.320 MHz
    DMT 0x04:   640x480    59.940 Hz   4:3    31.469 kHz  25.175 MHz
    Apple   :   640x480    66.667 Hz   4:3    35.000 kHz  30.240 MHz
    DMT 0x05:   640x480    72.809 Hz   4:3    37.861 kHz  31.500 MHz
    DMT 0x06:   640x480    75.000 Hz   4:3    37.500 kHz  31.500 MHz
    DMT 0x08:   800x600    56.250 Hz   4:3    35.156 kHz  36.000 MHz
    DMT 0x09:   800x600    60.317 Hz   4:3    37.879 kHz  40.000 MHz
    DMT 0x0a:   800x600    72.188 Hz   4:3    48.077 kHz  50.000 MHz
    DMT 0x0b:   800x600    75.000 Hz   4:3    46.875 kHz  49.500 MHz
    Apple   :   832x624    74.551 Hz   4:3    49.726 kHz  57.284 MHz
    DMT 0x10:  1024x768    60.004 Hz   4:3    48.363 kHz  65.000 MHz
    DMT 0x11:  1024x768    70.069 Hz   4:3    56.476 kHz  75.000 MHz
    DMT 0x12:  1024x768    75.029 Hz   4:3    60.023 kHz  78.750 MHz
    DMT 0x24:  1280x1024   75.025 Hz   5:4    79.976 kHz 135.000 MHz
    Apple   :  1152x870    75.062 Hz 192:145  68.681 kHz 100.000 MHz
  Standard Timings:
    DMT 0x15:  1152x864    75.000 Hz   4:3    67.500 kHz 108.000 MHz
    DMT 0x1c:  1280x800    59.810 Hz  16:10   49.702 kHz  83.500 MHz
    DMT 0x55:  1280x720    60.000 Hz  16:9    45.000 kHz  74.250 MHz
    DMT 0x23:  1280x1024   60.020 Hz   5:4    63.981 kHz 108.000 MHz
    DMT 0x53:  1600x900    60.000 Hz  16:9    60.000 kHz 108.000 MHz (RB)
    DMT 0x3a:  1680x1050   59.954 Hz  16:10   65.290 kHz 146.250 MHz
    DMT 0x2f:  1440x900    59.887 Hz  16:10   55.935 kHz 106.500 MHz
    DMT 0x52:  1920x1080   60.000 Hz  16:9    67.500 kHz 148.500 MHz
  Detailed Timing Descriptors:
    DTD 1:  3840x1080   59.968 Hz  32:9    66.625 kHz 266.500 MHz (1193 mm x 336 mm)
                 Hfront   48 Hsync  32 Hback  80 Hpol P
                 Vfront    3 Vsync  10 Vback  18 Vpol N
  Display Range Limits:
    Monitor ranges (GTF): 50-240 Hz V, 30-357 kHz H, max dotclock 1940 MHz
    Display Product Name: 'LC49G95T'
    Display Product Serial Number: ...
  Extension blocks: 2
Checksum: 0xc4

----------------

Block 1, CTA-861 Extension Block:
  Revision: 3
  Underscans IT Video Formats by default
  Basic audio support
  Supports YCbCr 4:4:4
  Supports YCbCr 4:2:2
  Native detailed modes: 0
  Video Data Block:
    VIC  16:  1920x1080   60.000 Hz  16:9    67.500 kHz 148.500 MHz
    VIC  90:  2560x1080   60.000 Hz  64:27   66.000 kHz 198.000 MHz
    VIC  63:  1920x1080  120.000 Hz  16:9   135.000 kHz 297.000 MHz
    VIC  92:  2560x1080  120.000 Hz  64:27  150.000 kHz 495.000 MHz
  Audio Data Block:
    Linear PCM:
      Max channels: 2
      Supported sample rates (kHz): 48 44.1 32
      Supported sample sizes (bits): 24 20 16
  Speaker Allocation Data Block:
    FL/FR - Front Left/Right
  Colorimetry Data Block:
    BT2020YCC
    BT2020RGB
  HDR Static Metadata Data Block:
    Electro optical transfer functions:
      Traditional gamma - SDR luminance range
      SMPTE ST2084
    Supported static metadata descriptors:
      Static metadata type 1
    Desired content max luminance: 139 (1015.241 cd/m^2)
    Desired content max frame-average luminance: 115 (603.666 cd/m^2)
    Desired content min luminance: 18 (0.051 cd/m^2)
  Vendor-Specific Video Data Block (HDR10+), OUI 90-84-8B:
    Application Version: 1
  Detailed Timing Descriptors:
    DTD 2:  2560x1440   59.951 Hz  16:9    88.787 kHz 241.500 MHz (1193 mm x 336 mm)
                 Hfront   48 Hsync  32 Hback  80 Hpol P
                 Vfront    3 Vsync   5 Vback  33 Vpol N
    DTD 3:  2560x1080   60.000 Hz  64:27   66.000 kHz 198.000 MHz (1193 mm x 336 mm)
                 Hfront  248 Hsync  44 Hback 148 Hpol P
                 Vfront    4 Vsync   5 Vback  11 Vpol P
    DTD 4:  3840x1080  119.974 Hz  32:9   137.250 kHz 549.000 MHz (1193 mm x 336 mm)
                 Hfront   48 Hsync  32 Hback  80 Hpol P
                 Vfront    3 Vsync  10 Vback  51 Vpol N
    DTD 5:  2560x1440  119.998 Hz  16:9   182.996 kHz 497.750 MHz (1193 mm x 336 mm)
                 Hfront   48 Hsync  32 Hback  80 Hpol P
                 Vfront    3 Vsync   5 Vback  77 Vpol N
Checksum: 0x82

----------------

Block 2, DisplayID Extension Block:
  Version: 1.2
  Extension Count: 0
  Display Product Type: Extension Section
  Video Timing Modes Type 1 - Detailed Timings Data Block:
    DTD:  5120x1440  239.761 Hz   0:0   356.524 kHz 1939.490 MHz (aspect undefined, no 3D stereo, preferred)
               Hfront  128 Hsync  32 Hback 160 Hpol P
               Vfront   33 Vsync   8 Vback   6 Vpol N
    DTD:  5120x1440  119.999 Hz   0:0   182.879 kHz 965.600 MHz (aspect undefined, no 3D stereo)
               Hfront   48 Hsync  32 Hback  80 Hpol P
               Vfront    3 Vsync  10 Vback  71 Vpol N
    DTD:  5120x1440   59.977 Hz   0:0    88.826 kHz 469.000 MHz (aspect undefined, no 3D stereo)
               Hfront   48 Hsync  32 Hback  80 Hpol P
               Vfront    3 Vsync  10 Vback  28 Vpol N
    DTD:  2560x1440  239.901 Hz   0:0   355.773 kHz 939.240 MHz (aspect undefined, no 3D stereo)
               Hfront    8 Hsync  32 Hback  40 Hpol P
               Vfront   33 Vsync   8 Vback   2 Vpol N
    DTD:  3840x1080  239.969 Hz   0:0   291.562 kHz 1166.250 MHz (aspect undefined, no 3D stereo)
               Hfront   48 Hsync  32 Hback  80 Hpol P
               Vfront    3 Vsync  10 Vback 122 Vpol N
  Checksum: 0x1d
Checksum: 0x90

----------------

Warnings:

Block 1, CTA-861 Extension Block:
  Video Data Block: VIC 16 is the preferred timing, overriding the first detailed timings. Is this intended?
  Display Product Serial Number is set, so the Serial Number in the Base EDID should be 0.
  Missing VCDB, needed for Set Selectable RGB Quantization to avoid interop issues.

Failures:

Block 0, Base EDID:
  Display Range Limits: GTF can't be combined with non-continuous frequencies.
Block 2, DisplayID Extension Block:
  DisplayID Base Block has no product type.
  Video Timing Modes Type 1 - Detailed Timings Data Block: Unknown aspect 0x08.
  Video Timing Modes Type 1 - Detailed Timings Data Block: Unknown aspect 0x08.
  Video Timing Modes Type 1 - Detailed Timings Data Block: Unknown aspect 0x08.
  Video Timing Modes Type 1 - Detailed Timings Data Block: Unknown aspect 0x08.
  Video Timing Modes Type 1 - Detailed Timings Data Block: Unknown aspect 0x08.
EDID:
  DisplayID: Missing DisplayID Product Identification Data Block.

EDID conformity: FAIL
