edid-decode (hex):

00 ff ff ff ff ff ff 00 30 64 40 55 30 32 38 34
15 10 01 03 80 1d 12 78 0a 19 18 9d 55 4a 8d 26
20 4d 55 00 00 00 01 01 01 01 01 01 01 01 01 01
01 01 01 01 01 01 9e 20 00 90 51 20 1f 30 48 80
36 00 1f b4 10 00 00 18 00 00 00 0f 00 00 00 00
00 00 00 00 00 00 00 00 00 00 00 00 00 fe 00 54
4d 44 49 53 50 4c 41 59 0a 20 20 20 00 00 00 fe
00 4c 54 44 31 33 33 4b 58 32 53 0a 20 20 00 a3

----------------

Block 0, Base EDID:
  EDID Structure Version & Revision: 1.3
  Vendor & Product Identification:
    Manufacturer: LCD
    Model: 21824
    Serial Number: ...
    Made in: week 21 of 2006
  Basic Display Parameters & Features:
    Digital display
    Maximum image size: 29 cm x 18 cm
    Gamma: 2.20
    RGB color display
    First detailed timing is the preferred timing
  Color Characteristics:
    Red  : 0.6132, 0.3330
    Green: 0.2910, 0.5517
    Blue : 0.1484, 0.1259
    White: 0.3027, 0.3320
  Established Timings I & II: none
  Standard Timings: none
  Detailed Timing Descriptors:
    DTD 1:  1280x800    59.810 Hz   8:5    49.702 kHz  83.500 MHz (287 mm x 180 mm)
                 Hfront   72 Hsync 128 Hback 200 Hpol N
                 Vfront    3 Vsync   6 Vback  22 Vpol N
    Manufacturer-Specified Display Descriptor (0x0f): 00 0f 00 00 00 00 00 00 00 00 00 00 00 00 00 00 '................'
    Alphanumeric Data String: 'TMDISPLAY'
    Alphanumeric Data String: 'LTD133KX2S'
Checksum: 0xa3

----------------

Failures:

Block 0, Base EDID:
  Missing Display Product Name.
  Missing Display Range Limits Descriptor.

EDID conformity: FAIL
