edid-decode (hex):

00 ff ff ff ff ff ff 00 30 64 40 55 00 00 00 00
14 11 01 02 80 19 0e ff 0a 7f ee 9b 5b 52 8c 25
25 4d 56 00 00 00 01 01 01 01 01 01 01 01 01 01
01 01 01 01 01 01 46 1e 56 2a 51 00 08 30 40 6a
16 00 f6 8b 00 00 00 18 00 00 00 0f 00 04 88 04
88 01 02 01 02 91 95 03 04 00 00 00 00 fe 00 54
4d 44 49 53 50 4c 41 59 0a 20 20 20 00 00 00 fe
00 4c 54 44 31 31 31 45 58 44 41 0a 20 20 00 a7

----------------

Block 0, Base EDID:
  EDID Structure Version & Revision: 1.2
  Vendor & Product Identification:
    Manufacturer: LCD
    Model: 21824
    Made in: week 20 of 2007
  Basic Display Parameters & Features:
    Digital display
    Maximum image size: 25 cm x 14 cm
    Gamma is defined in an extension block
    RGB color display
    First detailed timing is the preferred timing
  Color Characteristics:
    Red  : 0.6064, 0.3583
    Green: 0.3232, 0.5498
    Blue : 0.1474, 0.1464
    White: 0.3037, 0.3378
  Established Timings I & II: none
  Standard Timings: none
  Detailed Timing Descriptors:
    DTD 1:  1366x768    60.019 Hz 683:384  46.575 kHz  77.500 MHz (246 mm x 139 mm)
                 Hfront   64 Hsync 106 Hback 128 Hpol N
                 Vfront    1 Vsync   6 Vback   1 Vpol N
    Manufacturer-Specified Display Descriptor (0x0f): 00 0f 00 04 88 04 88 01 02 01 02 91 95 03 04 00 '................'
    Alphanumeric Data String: 'TMDISPLAY'
    Alphanumeric Data String: 'LTD111EXDA'
Checksum: 0xa7

----------------

Warnings:

Block 0, Base EDID:
  EDID Structure Version & Revision: EDID 1.2 is deprecated, do not use.

EDID conformity: PASS
