
EDID (hex):
00ffffffffffff005a633aeb00000000
03200104a54627783a2c91a654519e26
125054bfef80d1c08140818090409500
a940b300a9c0023a801871382d40582c
4500615c2100001e000000fd0030a51e
c129010a202020202020000000fc0056
58333231382d50432d6d6864000000ff
005743333232303330323536380a0136
020321f44c0103051404131f12021190
3f230907078301000067030c00100038
52866f80a07038404030203500615c21
00001efe5b80a0703835403020350061
5c2100001e011d007251d01e206e2855
00615c2100001ea49c80a07038594030
203600615c2100001afc7e8088703812
4018203500615c2100001e00000000d6

Extracted contents:
header:          00 ff ff ff ff ff ff 00
serial number:   5a 63 3a eb 00 00 00 00 03 20
version:         01 04
basic params:    a5 46 27 78 3a
chroma info:     2c 91 a6 54 51 9e 26 12 50 54
established:     bf ef 80
standard:        d1 c0 81 40 81 80 90 40 95 00 a9 40 b3 00 a9 c0
descriptor 1:    02 3a 80 18 71 38 2d 40 58 2c 45 00 61 5c 21 00 00 1e
descriptor 2:    00 00 00 fd 00 30 a5 1e c1 29 01 0a 20 20 20 20 20 20
descriptor 3:    00 00 00 fc 00 56 58 33 32 31 38 2d 50 43 2d 6d 68 64
descriptor 4:    00 00 00 ff 00 57 43 33 32 32 30 33 30 32 35 36 38 0a
extensions:      01
checksum:        36

EDID version: 1.4
Manufacturer: VSC Model eb3a Serial Number --
Made in week 3 of 2022
Digital display
8 bits per primary color channel
DisplayPort interface
Maximum image size: 70 cm x 39 cm
Gamma: 2.20
DPMS levels: Off
Supported color formats: RGB 4:4:4, YCrCb 4:4:4, YCrCb 4:2:2
First detailed timing includes the native pixel format and preferred refresh rate
Display x,y Chromaticity:
  Red:   0.6484, 0.3300
  Green: 0.3193, 0.6171
  Blue:  0.1503, 0.0712
  White: 0.3125, 0.3291
Established timings supported:
  720x400@70Hz 9:5 HorFreq: 31469 Hz Clock: 28.320 MHz
  640x480@60Hz 4:3 HorFreq: 31469 Hz Clock: 25.175 MHz
  640x480@67Hz 4:3 HorFreq: 35000 Hz Clock: 30.240 MHz
  640x480@72Hz 4:3 HorFreq: 37900 Hz Clock: 31.500 MHz
  640x480@75Hz 4:3 HorFreq: 37500 Hz Clock: 31.500 MHz
  800x600@56Hz 4:3 HorFreq: 35200 Hz Clock: 36.000 MHz
  800x600@60Hz 4:3 HorFreq: 37900 Hz Clock: 40.000 MHz
  800x600@72Hz 4:3 HorFreq: 48100 Hz Clock: 50.000 MHz
  800x600@75Hz 4:3 HorFreq: 46900 Hz Clock: 49.500 MHz
  832x624@75Hz 4:3 HorFreq: 49726 Hz Clock: 57.284 MHz
  1024x768@60Hz 4:3 HorFreq: 48400 Hz Clock: 65.000 MHz
  1024x768@70Hz 4:3 HorFreq: 56500 Hz Clock: 75.000 MHz
  1024x768@75Hz 4:3 HorFreq: 60000 Hz Clock: 78.750 MHz
  1280x1024@75Hz 5:4 HorFreq: 80000 Hz Clock: 135.000 MHz
  1152x870@75Hz 192:145 HorFreq: 67500 Hz Clock: 108.000 MHz
Standard timings supported:
  1920x1080@60Hz 16:9
  1280x960@60Hz 4:3 HorFreq: 60000 Hz Clock: 108.000 MHz
  1280x1024@60Hz 5:4 HorFreq: 64000 Hz Clock: 108.000 MHz
  1400x1050@60Hz 4:3 HorFreq: 64700 Hz Clock: 101.000 MHz
  1440x900@60Hz 16:10 HorFreq: 55500 Hz Clock: 88.750 MHz
  1600x1200@60Hz 4:3 HorFreq: 75000 Hz Clock: 162.000 MHz
  1680x1050@60Hz 16:10 HorFreq: 64700 Hz Clock: 119.000 MHz
  1600x900@60Hz 16:9
Detailed mode: Clock 148.500 MHz, 609 mm x 348 mm
               1920 2008 2052 2200 hborder 0
               1080 1084 1089 1125 vborder 0
               +hsync +vsync 
               VertFreq: 60 Hz, HorFreq: 67500 Hz
Monitor ranges (bare limits): 48-165Hz V, 30-193kHz H, max dotclock 410MHz
Serial number: --
Has 1 extension blocks
Checksum: 0x36 (valid)

CTA extension block
Extension version: 3
29 bytes of CTA data
  Video data block
    VIC   1 640x480@60Hz 4:3  HorFreq: 31469 Hz Clock: 25.175 MHz
    VIC   3 720x480@60Hz 16:9  HorFreq: 31469 Hz Clock: 27.000 MHz
    VIC   5 1920x1080i@60Hz 16:9  HorFreq: 33750 Hz Clock: 74.250 MHz
    VIC  20 1920x1080i@50Hz 16:9  HorFreq: 28125 Hz Clock: 74.250 MHz
    VIC   4 1280x720@60Hz 16:9  HorFreq: 45000 Hz Clock: 74.250 MHz
    VIC  19 1280x720@50Hz 16:9  HorFreq: 37500 Hz Clock: 74.250 MHz
    VIC  31 1920x1080@50Hz 16:9  HorFreq: 56250 Hz Clock: 148.500 MHz
    VIC  18 720x576@50Hz 16:9  HorFreq: 31250 Hz Clock: 27.000 MHz
    VIC   2 720x480@60Hz 4:3  HorFreq: 31469 Hz Clock: 27.000 MHz
    VIC  17 720x576@50Hz 4:3  HorFreq: 31250 Hz Clock: 27.000 MHz
    VIC  16 1920x1080@60Hz 16:9 (native) HorFreq: 67500 Hz Clock: 148.500 MHz
    VIC  63 1920x1080@120Hz 16:9  HorFreq: 135000 Hz Clock: 297.000 MHz
  Audio data block
    Linear PCM, max channels 2
      Supported sample rates (kHz): 48 44.1 32
      Supported sample sizes (bits): 24 20 16
  Speaker allocation data block
    Speaker map:
      FL/FR - Front Left/Right
  Vendor-specific data block, OUI 000c03 (HDMI)
    Source physical address 1.0.0.0
    DC_36bit
    DC_30bit
    DC_Y444
    Maximum TMDS clock: 410MHz
Underscans PC formats by default
Basic audio support
Supports YCbCr 4:4:4
Supports YCbCr 4:2:2
4 native detailed modes
Detailed mode: Clock 285.500 MHz, 609 mm x 348 mm
               1920 1968 2000 2080 hborder 0
               1080 1083 1088 1144 vborder 0
               +hsync +vsync 
               VertFreq: 119 Hz, HorFreq: 137259 Hz
Detailed mode: Clock 235.500 MHz, 609 mm x 348 mm
               1920 1968 2000 2080 hborder 0
               1080 1083 1088 1133 vborder 0
               +hsync +vsync 
               VertFreq: 99 Hz, HorFreq: 113221 Hz
Detailed mode: Clock 74.250 MHz, 609 mm x 348 mm
               1280 1390 1430 1650 hborder 0
                720  725  730  750 vborder 0
               +hsync +vsync 
               VertFreq: 60 Hz, HorFreq: 45000 Hz
Detailed mode: Clock 401.000 MHz, 609 mm x 348 mm
               1920 1968 2000 2080 hborder 0
               1080 1083 1089 1169 vborder 0
               +hsync -vsync 
               VertFreq: 164 Hz, HorFreq: 192788 Hz
Detailed mode: Clock 325.080 MHz, 609 mm x 348 mm
               1920 1944 1976 2056 hborder 0
               1080 1083 1088 1098 vborder 0
               +hsync +vsync 
               VertFreq: 144 Hz, HorFreq: 158112 Hz
Checksum: 0xd6 (valid)

EDID block does NOT conform to EDID 1.4!
	HDMI VSDB Max TMDS rate is > 340
	Name descriptor not terminated with a newline
Warning: One or more of the timings is out of range of the Monitor Ranges:
  Vertical Freq: 50 - 164 Hz
  Horizontal Freq: 28125 - 192788 Hz
  Maximum Clock: 401.000 MHz
