edid-decode (hex):

00 ff ff ff ff ff ff 00 58 58 00 00 a0 05 1a 04
01 00 01 03 80 00 00 78 ee ee 91 a3 54 4c 99 26
0f 50 54 00 00 00 01 01 01 01 01 01 01 01 01 01
01 01 01 01 01 01 c9 23 a0 06 50 1a 06 40 02 02
22 00 00 00 00 00 00 00 00 00 00 fd 00 00 c8 00
c8 64 00 0a 20 20 20 20 20 20 00 00 00 fc 00 56
42 4f 58 20 6d 6f 6e 69 74 6f 72 0a 00 00 00 10
00 0a 20 20 20 20 20 20 20 20 20 20 20 20 00 3a

----------------

Block 0, Base EDID:
  EDID Structure Version & Revision: 1.3
  Vendor & Product Identification:
    Manufacturer: VBX
    Model: 0
    Serial Number: ...
    Made in: week 1 of 1990
  Basic Display Parameters & Features:
    Digital display
    Image size is variable
    Gamma: 2.20
    DPMS levels: Standby Suspend Off
    RGB color display
    Default (sRGB) color space is primary color space
    First detailed timing is preferred timing
  Color Characteristics:
    Red  : 0.6396, 0.3300
    Green: 0.2998, 0.5996
    Blue : 0.1503, 0.0595
    White: 0.3125, 0.3291
  Established Timings I & II: none
  Standard Timings: none
  Detailed Timing Descriptors:
    DTD 1:  1440x1050   59.994 Hz  48:35   63.354 kHz  91.610 MHz (analog composite, sync-on-green)
                 Hfront    2 Hsync   2 Hback   2 Hpol N
                 Vfront    2 Vsync   2 Vback   2 Vpol N
  Display Range Limits:
    Monitor ranges (GTF): 0-200 Hz V, 0-200 kHz H, max dotclock 1000 MHz
    Display Product Name: 'VBOX monitor'
    Dummy Descriptor:
Checksum: 0x3a

----------------

Failures:

Block 0, Base EDID:
  Dummy Descriptor: Dummy block filled with garbage.

EDID conformity: FAIL
