
EDID (hex):
00ffffffffffff0004721b0420339070
091b0104a5351e783a14d5a55852a226
0c5054b30c00d1c081c081009500b300
81808140714f023a801871382d40582c
4500132b2100001e000000fd0018901e
a021010a202020202020000000ff0054
31594545303031343230300a000000fc
0041636572205842323430480a20013e
02031bf14e0102030411121305141f90
2022402309070183010000866f80a070
38404030203500132b2100001afc7e80
887038124018203500132b2100001efe
5b80a07038354030203500132b210000
1a000000000000000000000000000000
00000000000000000000000000000000
0000000000000000000000000000002a

Extracted contents:
header:          00 ff ff ff ff ff ff 00
serial number:   04 72 1b 04 20 33 90 70 09 1b
version:         01 04
basic params:    a5 35 1e 78 3a
chroma info:     14 d5 a5 58 52 a2 26 0c 50 54
established:     b3 0c 00
standard:        d1 c0 81 c0 81 00 95 00 b3 00 81 80 81 40 71 4f
descriptor 1:    02 3a 80 18 71 38 2d 40 58 2c 45 00 13 2b 21 00 00 1e
descriptor 2:    00 00 00 fd 00 18 90 1e a0 21 01 0a 20 20 20 20 20 20
descriptor 3:    00 00 00 ff 00 54 31 59 45 45 30 30 31 34 32 30 30 0a
descriptor 4:    00 00 00 fc 00 41 63 65 72 20 58 42 32 34 30 48 0a 20
extensions:      01
checksum:        3e

EDID version: 1.4
Manufacturer: ACR Model 41b Serial Number --
Made in week 9 of 2017
Digital display
8 bits per primary color channel
DisplayPort interface
Maximum image size: 53 cm x 30 cm
Gamma: 2.20
DPMS levels: Off
Supported color formats: RGB 4:4:4, YCrCb 4:4:4, YCrCb 4:2:2
First detailed timing includes the native pixel format and preferred refresh rate
Display x,y Chromaticity:
  Red:   0.6445, 0.3447
  Green: 0.3212, 0.6328
  Blue:  0.1513, 0.0478
  White: 0.3134, 0.3291
Established timings supported:
  720x400@70Hz 9:5 HorFreq: 31469 Hz Clock: 28.320 MHz
  640x480@60Hz 4:3 HorFreq: 31469 Hz Clock: 25.175 MHz
  640x480@67Hz 4:3 HorFreq: 35000 Hz Clock: 30.240 MHz
  800x600@56Hz 4:3 HorFreq: 35200 Hz Clock: 36.000 MHz
  800x600@60Hz 4:3 HorFreq: 37900 Hz Clock: 40.000 MHz
  1024x768@60Hz 4:3 HorFreq: 48400 Hz Clock: 65.000 MHz
  1024x768@70Hz 4:3 HorFreq: 56500 Hz Clock: 75.000 MHz
Standard timings supported:
  1920x1080@60Hz 16:9
  1280x720@60Hz 16:9
  1280x800@60Hz 16:10
  1440x900@60Hz 16:10 HorFreq: 55500 Hz Clock: 88.750 MHz
  1680x1050@60Hz 16:10 HorFreq: 64700 Hz Clock: 119.000 MHz
  1280x1024@60Hz 5:4 HorFreq: 64000 Hz Clock: 108.000 MHz
  1280x960@60Hz 4:3 HorFreq: 60000 Hz Clock: 108.000 MHz
  1152x864@75Hz 4:3 HorFreq: 67500 Hz Clock: 108.000 MHz
Detailed mode: Clock 148.500 MHz, 531 mm x 299 mm
               1920 2008 2052 2200 hborder 0
               1080 1084 1089 1125 vborder 0
               +hsync +vsync 
               VertFreq: 60 Hz, HorFreq: 67500 Hz
Monitor ranges (bare limits): 24-144Hz V, 30-160kHz H, max dotclock 330MHz
Serial number: --
Monitor name: Acer XB240H
Has 1 extension blocks
Checksum: 0x3e (valid)

CTA extension block
Extension version: 3
23 bytes of CTA data
  Video data block
    VIC   1 640x480@60Hz 4:3  HorFreq: 31469 Hz Clock: 25.175 MHz
    VIC   2 720x480@60Hz 4:3  HorFreq: 31469 Hz Clock: 27.000 MHz
    VIC   3 720x480@60Hz 16:9  HorFreq: 31469 Hz Clock: 27.000 MHz
    VIC   4 1280x720@60Hz 16:9  HorFreq: 45000 Hz Clock: 74.250 MHz
    VIC  17 720x576@50Hz 4:3  HorFreq: 31250 Hz Clock: 27.000 MHz
    VIC  18 720x576@50Hz 16:9  HorFreq: 31250 Hz Clock: 27.000 MHz
    VIC  19 1280x720@50Hz 16:9  HorFreq: 37500 Hz Clock: 74.250 MHz
    VIC   5 1920x1080i@60Hz 16:9  HorFreq: 33750 Hz Clock: 74.250 MHz
    VIC  20 1920x1080i@50Hz 16:9  HorFreq: 28125 Hz Clock: 74.250 MHz
    VIC  31 1920x1080@50Hz 16:9  HorFreq: 56250 Hz Clock: 148.500 MHz
    VIC  16 1920x1080@60Hz 16:9 (native) HorFreq: 67500 Hz Clock: 148.500 MHz
    VIC  32 1920x1080@24Hz 16:9  HorFreq: 27000 Hz Clock: 74.250 MHz
    VIC  34 1920x1080@30Hz 16:9  HorFreq: 33750 Hz Clock: 74.250 MHz
    VIC  64 1920x1080@100Hz 16:9  HorFreq: 112500 Hz Clock: 297.000 MHz
  Audio data block
    Linear PCM, max channels 2
      Supported sample rates (kHz): 48 44.1 32
      Supported sample sizes (bits): 16
  Speaker allocation data block
    Speaker map:
      FL/FR - Front Left/Right
Underscans PC formats by default
Basic audio support
Supports YCbCr 4:4:4
Supports YCbCr 4:2:2
1 native detailed modes
Detailed mode: Clock 285.500 MHz, 531 mm x 299 mm
               1920 1968 2000 2080 hborder 0
               1080 1083 1088 1144 vborder 0
               +hsync -vsync 
               VertFreq: 119 Hz, HorFreq: 137259 Hz
Detailed mode: Clock 325.080 MHz, 531 mm x 299 mm
               1920 1944 1976 2056 hborder 0
               1080 1083 1088 1098 vborder 0
               +hsync +vsync 
               VertFreq: 144 Hz, HorFreq: 158112 Hz
Detailed mode: Clock 235.500 MHz, 531 mm x 299 mm
               1920 1968 2000 2080 hborder 0
               1080 1083 1088 1133 vborder 0
               +hsync -vsync 
               VertFreq: 99 Hz, HorFreq: 113221 Hz
Checksum: 0x2a (valid)

Warning: One or more of the timings is out of range of the Monitor Ranges:
  Vertical Freq: 24 - 144 Hz
  Horizontal Freq: 27000 - 158112 Hz
  Maximum Clock: 325.080 MHz
EDID block does not conform at all!
	Both the serial number and the serial string are set


