
EDID (hex):
00ffffffffffff0004726004ffffffff
ff170104a53e227806ee91a3544c9926
0f505421080001010101010101010101
0101010101014dd000a0f0703e803020
35006d552100001a000000ff00234153
5042634e705a6c366e64000000fd001e
3c348536010a202020202020000000fc
0041636572205842323831484b0a0116
020312412309070183010000654b0400
0101ef5100a0f0701980302035006d55
2100001aa36600a0f0701f8030203500
6d552100001a00000000000000000000
00000000000000000000000000000000
00000000000000000000000000000000
00000000000000000000000000000000
000000000000000000000000000000b5

edid-decode (hex):

00 ff ff ff ff ff ff 00 04 72 60 04 ff ff ff ff
ff 17 01 04 a5 3e 22 78 06 ee 91 a3 54 4c 99 26
0f 50 54 21 08 00 01 01 01 01 01 01 01 01 01 01
01 01 01 01 01 01 4d d0 00 a0 f0 70 3e 80 30 20
35 00 6d 55 21 00 00 1a 00 00 00 ff 00 23 41 53
50 42 63 4e 70 5a 6c 36 6e 64 00 00 00 fd 00 1e
3c 34 85 36 01 0a 20 20 20 20 20 20 00 00 00 fc
00 41 63 65 72 20 58 42 32 38 31 48 4b 0a 01 16

02 03 12 41 23 09 07 01 83 01 00 00 65 4b 04 00
01 01 ef 51 00 a0 f0 70 19 80 30 20 35 00 6d 55
21 00 00 1a a3 66 00 a0 f0 70 1f 80 30 20 35 00
6d 55 21 00 00 1a 00 00 00 00 00 00 00 00 00 00
00 00 00 00 00 00 00 00 00 00 00 00 00 00 00 00
00 00 00 00 00 00 00 00 00 00 00 00 00 00 00 00
00 00 00 00 00 00 00 00 00 00 00 00 00 00 00 00
00 00 00 00 00 00 00 00 00 00 00 00 00 00 00 b5

----------------

Block 0, Base EDID:
  EDID Structure Version & Revision: 1.4
  Vendor & Product Identification:
    Manufacturer: ACR
    Model: 1120
    Serial Number: 4294967295
    Model year: 2013
  Basic Display Parameters & Features:
    Digital display
    Bits per primary color channel: 8
    DisplayPort interface
    Maximum image size: 62 cm x 34 cm
    Gamma: 2.20
    Supported color formats: RGB 4:4:4
    Default (sRGB) color space is primary color space
    First detailed timing includes the native pixel format and preferred refresh rate
  Color Characteristics:
    Red  : 0.6396, 0.3300
    Green: 0.2998, 0.5996
    Blue : 0.1503, 0.0595
    White: 0.3125, 0.3291
  Established Timings I & II:
    DMT 0x04:   640x480    59.940476 Hz   4:3     31.469 kHz     25.175000 MHz
    DMT 0x09:   800x600    60.316541 Hz   4:3     37.879 kHz     40.000000 MHz
    DMT 0x10:  1024x768    60.003840 Hz   4:3     48.363 kHz     65.000000 MHz
  Standard Timings: none
  Detailed Timing Descriptors:
    DTD 1:  3840x2160   59.996625 Hz  16:9    133.312 kHz    533.250000 MHz (621 mm x 341 mm)
                 Hfront   48 Hsync  32 Hback   80 Hpol P
                 Vfront    3 Vsync   5 Vback   54 Vpol N
    Display Product Serial Number: '#ASPBcNpZl6nd'
    Display Range Limits:
      Monitor ranges (Bare Limits): 30-60 Hz V, 52-133 kHz H, max dotclock 540 MHz
    Display Product Name: 'Acer XB281HK'
  Extension blocks: 1
Checksum: 0x16

----------------

Block 1, CTA-861 Extension Block:
  Revision: 3
  Basic audio support
  Native detailed modes: 1
  Audio Data Block:
    Linear PCM:
      Max channels: 2
      Supported sample rates (kHz): 48 44.1 32
      Supported sample sizes (bits): 16
  Speaker Allocation Data Block:
    FL/FR - Front Left/Right
  Vendor-Specific Data Block (NVIDIA), OUI 00-04-4B:
    01 01                                           '..'
  Detailed Timing Descriptors:
    DTD 2:  3840x2160   23.998856 Hz  16:9     52.438 kHz    209.750000 MHz (621 mm x 341 mm)
                 Hfront   48 Hsync  32 Hback   80 Hpol P
                 Vfront    3 Vsync   5 Vback   17 Vpol N
    DTD 3:  3840x2160   29.980602 Hz  16:9     65.688 kHz    262.750000 MHz (621 mm x 341 mm)
                 Hfront   48 Hsync  32 Hback   80 Hpol P
                 Vfront    3 Vsync   5 Vback   23 Vpol N
Checksum: 0xb5  Unused space in Extension Block: 73 bytes


