
EDID (hex):
00ffffffffffff0009e5ac0600000000
03190104951f1178029d409a5d558d28
1e505400000001010101010101010101
010101010101bc398018713828403020
350035ad1000001a0000000000000000
0000000000000000001a000000fe0042
4f452044540a202020202020000000fe
004e5631343046484d2d4e34350a00b7

Extracted contents:
header:          00 ff ff ff ff ff ff 00
serial number:   09 e5 ac 06 00 00 00 00 03 19
version:         01 04
basic params:    95 1f 11 78 02
chroma info:     9d 40 9a 5d 55 8d 28 1e 50 54
established:     00 00 00
standard:        01 01 01 01 01 01 01 01 01 01 01 01 01 01 01 01
descriptor 1:    bc 39 80 18 71 38 28 40 30 20 35 00 35 ad 10 00 00 1a
descriptor 2:    00 00 00 00 00 00 00 00 00 00 00 00 00 00 00 00 00 1a
descriptor 3:    00 00 00 fe 00 42 4f 45 20 44 54 0a 20 20 20 20 20 20
descriptor 4:    00 00 00 fe 00 4e 56 31 34 30 46 48 4d 2d 4e 34 35 0a
extensions:      00
checksum:        b7

EDID version: 1.4
Manufacturer: BOE Model 6ac Serial Number --
Made in week 3 of 2015
Digital display
6 bits per primary color channel
DisplayPort interface
Maximum image size: 31 cm x 17 cm
Gamma: 2.20
Supported color formats: RGB 4:4:4
First detailed timing includes the native pixel format and preferred refresh rate
Display x,y Chromaticity:
  Red:   0.6035, 0.3642
  Green: 0.3349, 0.5517
  Blue:  0.1572, 0.1171
  White: 0.3125, 0.3281
Established timings supported:
Standard timings supported:
Detailed mode: Clock 147.800 MHz, 309 mm x 173 mm
               1920 1968 2000 2200 hborder 0
               1080 1083 1088 1120 vborder 0
               +hsync -vsync 
               VertFreq: 59 Hz, HorFreq: 67181 Hz
Manufacturer-specified data, tag 0
ASCII string: BOE DT
ASCII string: NV140FHM-N45
Checksum: 0xb7 (valid)
EDID block does NOT conform to EDID 1.4!
	Missing name descriptor
	Missing monitor ranges
