edid-decode (hex):

00 ff ff ff ff ff ff 00 06 af 9d 30 f1 54 e0 e7
10 1b 01 04 a5 26 15 78 02 6a 75 a4 56 52 9c 27
0b 50 54 00 00 00 01 01 01 01 01 01 01 01 01 01
01 01 01 01 01 01 ce 8f 80 ac 70 38 8e 40 30 20
a5 00 7e d6 10 00 00 18 ce 8f 80 ac 70 38 3a 47
30 20 a5 00 7e d6 10 00 00 18 00 00 00 00 00 00
00 00 00 00 00 00 00 00 00 00 00 00 00 00 00 02
00 10 36 ff 0f 3c 96 24 14 33 96 20 20 20 00 25

----------------

Block 0, Base EDID:
  EDID Structure Version & Revision: 1.4
  Vendor & Product Identification:
    Manufacturer: AUO
    Model: 12445
    Serial Number: ...
    Made in: week 16 of 2017
  Basic Display Parameters & Features:
    Digital display
    Bits per primary color channel: 8
    DisplayPort interface
    Maximum image size: 38 cm x 21 cm
    Gamma: 2.20
    Supported color formats: RGB 4:4:4
    First detailed timing includes the native pixel format and preferred refresh rate
  Color Characteristics:
    Red  : 0.6416, 0.3378
    Green: 0.3222, 0.6113
    Blue : 0.1533, 0.0458
    White: 0.3134, 0.3291
  Established Timings I & II: none
  Standard Timings: none
  Detailed Timing Descriptors:
    DTD 1:  1920x1080  144.005846 Hz  16:9    175.975 kHz    368.140000 MHz (382 mm x 214 mm)
                 Hfront   48 Hsync  32 Hback   92 Hpol N
                 Vfront   10 Vsync   5 Vback  127 Vpol N
    DTD 2:  1920x1080   60.059776 Hz  16:9    175.975 kHz    368.140000 MHz (382 mm x 214 mm)
                 Hfront   48 Hsync  32 Hback   92 Hpol N
                 Vfront   10 Vsync   5 Vback 1835 Vpol N
    Empty Descriptor
    Manufacturer-Specified Display Descriptor (0x02): 00 02 00 10 36 ff 0f 3c 96 24 14 33 96 20 20 20 '....6..<.$.3.   '
Checksum: 0x25

----------------

Failures:

Block 0, Base EDID:
  Empty Descriptor: Use Dummy Descriptor instead of all zeroes.
  Missing Display Product Name.

EDID conformity: FAIL
