
EDID (hex):
00ffffffffffff0034ac604701010101
2e10010380372278ea8585a85334aa25
125054bfef80714f8180a94081409500
9040b3000101283c80a070b023403020
360026582100001a000000fd00374c1f
5311000a202020202020000000fc0052
445432363157480a20202020000000ff
003659313030313436414a0a20200043

Extracted contents:
header:          00 ff ff ff ff ff ff 00
serial number:   34 ac 60 47 01 01 01 01 2e 10
version:         01 03
basic params:    80 37 22 78 ea
chroma info:     85 85 a8 53 34 aa 25 12 50 54
established:     bf ef 80
standard:        71 4f 81 80 a9 40 81 40 95 00 90 40 b3 00 01 01
descriptor 1:    28 3c 80 a0 70 b0 23 40 30 20 36 00 26 58 21 00 00 1a
descriptor 2:    00 00 00 fd 00 37 4c 1f 53 11 00 0a 20 20 20 20 20 20
descriptor 3:    00 00 00 fc 00 52 44 54 32 36 31 57 48 0a 20 20 20 20
descriptor 4:    00 00 00 ff 00 36 59 31 30 30 31 34 36 41 4a 0a 20 20
extensions:      00
checksum:        43

EDID version: 1.3
Manufacturer: MEL Model 4760 Serial Number --
Made in week 46 of 2006
Digital display
Maximum image size: 55 cm x 34 cm
Gamma: 2.20
DPMS levels: Standby Suspend Off
RGB color display
First detailed timing is preferred timing
Display x,y Chromaticity:
  Red:   0.6582, 0.3242
  Green: 0.2041, 0.6650
  Blue:  0.1464, 0.0703
  White: 0.3134, 0.3291
Established timings supported:
  720x400@70Hz 9:5 HorFreq: 31469 Hz Clock: 28.320 MHz
  640x480@60Hz 4:3 HorFreq: 31469 Hz Clock: 25.175 MHz
  640x480@67Hz 4:3 HorFreq: 35000 Hz Clock: 30.240 MHz
  640x480@72Hz 4:3 HorFreq: 37900 Hz Clock: 31.500 MHz
  640x480@75Hz 4:3 HorFreq: 37500 Hz Clock: 31.500 MHz
  800x600@56Hz 4:3 HorFreq: 35200 Hz Clock: 36.000 MHz
  800x600@60Hz 4:3 HorFreq: 37900 Hz Clock: 40.000 MHz
  800x600@72Hz 4:3 HorFreq: 48100 Hz Clock: 50.000 MHz
  800x600@75Hz 4:3 HorFreq: 46900 Hz Clock: 49.500 MHz
  832x624@75Hz 4:3 HorFreq: 49726 Hz Clock: 57.284 MHz
  1024x768@60Hz 4:3 HorFreq: 48400 Hz Clock: 65.000 MHz
  1024x768@70Hz 4:3 HorFreq: 56500 Hz Clock: 75.000 MHz
  1024x768@75Hz 4:3 HorFreq: 60000 Hz Clock: 78.750 MHz
  1280x1024@75Hz 5:4 HorFreq: 80000 Hz Clock: 135.000 MHz
  1152x870@75Hz 192:145 HorFreq: 67500 Hz Clock: 108.000 MHz
Standard timings supported:
  1152x864@75Hz 4:3 HorFreq: 67500 Hz Clock: 108.000 MHz
  1280x1024@60Hz 5:4 HorFreq: 64000 Hz Clock: 108.000 MHz
  1600x1200@60Hz 4:3 HorFreq: 75000 Hz Clock: 162.000 MHz
  1280x960@60Hz 4:3 HorFreq: 60000 Hz Clock: 108.000 MHz
  1440x900@60Hz 16:10 HorFreq: 55500 Hz Clock: 88.750 MHz
  1400x1050@60Hz 4:3 HorFreq: 64700 Hz Clock: 101.000 MHz
  1680x1050@60Hz 16:10 HorFreq: 64700 Hz Clock: 119.000 MHz
Detailed mode: Clock 154.000 MHz, 550 mm x 344 mm
               1920 1968 2000 2080 hborder 0
               1200 1203 1209 1235 vborder 0
               +hsync -vsync 
               VertFreq: 59 Hz, HorFreq: 74038 Hz
Monitor ranges (GTF): 55-76Hz V, 31-83kHz H, max dotclock 170MHz
Monitor name: RDT261WH
Serial number: --
Checksum: 0x43 (valid)
