
EDID (hex):
00ffffffffffff0022f04a2801010101
0b160104a0342078e69ec5a6564b9a25
135054210800814081809500a940b300
d1c001010101023a801871382d403020
350058c21000001a000000fd00323f18
4c14000a202020202020000000fc004c
41323430350a202020202020000000ff
00434e3432313130434c4b0a20200107
02031b41230907078301000067030c00
2000002143100403e2000f8c0ad08a20
e02d10103e9600a05a00000000000000
00000000000000000000000000000000
00000000000000000000000000000000
00000000000000000000000000000000
00000000000000000000000000000000
000000000000000000000000000000d4

Extracted contents:
header:          00 ff ff ff ff ff ff 00
serial number:   22 f0 4a 28 01 01 01 01 0b 16
version:         01 04
basic params:    a0 34 20 78 e6
chroma info:     9e c5 a6 56 4b 9a 25 13 50 54
established:     21 08 00
standard:        81 40 81 80 95 00 a9 40 b3 00 d1 c0 01 01 01 01
descriptor 1:    02 3a 80 18 71 38 2d 40 30 20 35 00 58 c2 10 00 00 1a
descriptor 2:    00 00 00 fd 00 32 3f 18 4c 14 00 0a 20 20 20 20 20 20
descriptor 3:    00 00 00 fc 00 4c 41 32 34 30 35 0a 20 20 20 20 20 20
descriptor 4:    00 00 00 ff 00 43 4e 34 32 31 31 30 43 4c 4b 0a 20 20
extensions:      01
checksum:        07

EDID version: 1.4
Manufacturer: HWP Model 284a Serial Number --
Made in week 11 of 2012
Digital display
8 bits per primary color channel
Digital interface is not defined
Maximum image size: 52 cm x 32 cm
Gamma: 2.20
DPMS levels: Standby Suspend Off
Supported color formats: RGB 4:4:4
Default (sRGB) color space is primary color space
First detailed timing includes the native pixel format and preferred refresh rate
Display x,y Chromaticity:
  Red:   0.6503, 0.3369
  Green: 0.2958, 0.6035
  Blue:  0.1474, 0.0742
  White: 0.3134, 0.3291
Established timings supported:
  640x480@60Hz 4:3 HorFreq: 31469 Hz Clock: 25.175 MHz
  800x600@60Hz 4:3 HorFreq: 37900 Hz Clock: 40.000 MHz
  1024x768@60Hz 4:3 HorFreq: 48400 Hz Clock: 65.000 MHz
Standard timings supported:
  1280x960@60Hz 4:3 HorFreq: 60000 Hz Clock: 108.000 MHz
  1280x1024@60Hz 5:4 HorFreq: 64000 Hz Clock: 108.000 MHz
  1440x900@60Hz 16:10 HorFreq: 55500 Hz Clock: 88.750 MHz
  1600x1200@60Hz 4:3 HorFreq: 75000 Hz Clock: 162.000 MHz
  1680x1050@60Hz 16:10 HorFreq: 64700 Hz Clock: 119.000 MHz
  1920x1080@60Hz 16:9
Detailed mode: Clock 148.500 MHz, 344 mm x 194 mm
               1920 1968 2000 2200 hborder 0
               1080 1083 1088 1125 vborder 0
               +hsync -vsync 
               VertFreq: 60 Hz, HorFreq: 67500 Hz
Monitor ranges (GTF): 50-63Hz V, 24-76kHz H, max dotclock 200MHz
Monitor name: LA2405
Serial number: --
Has 1 extension blocks
Checksum: 0x7 (valid)

CTA extension block
Extension version: 3
23 bytes of CTA data
  Audio data block
    Linear PCM, max channels 2
      Supported sample rates (kHz): 48 44.1 32
      Supported sample sizes (bits): 24 20 16
  Speaker allocation data block
    Speaker map:
      FL/FR - Front Left/Right
  Vendor-specific data block, OUI 000c03 (HDMI)
    Source physical address 2.0.0.0
    Maximum TMDS clock: 165MHz
  Video data block
    VIC  16 1920x1080@60Hz 16:9  HorFreq: 67500 Hz Clock: 148.500 MHz
    VIC   4 1280x720@60Hz 16:9  HorFreq: 45000 Hz Clock: 74.250 MHz
    VIC   3 720x480@60Hz 16:9  HorFreq: 31469 Hz Clock: 27.000 MHz
  Extended tag: Video capability data block
    YCbCr quantization: No Data (0)
    RGB quantization: No Data (0)
    PT scan behaviour: No Data (0)
    IT scan behaviour: Support both over- and underscan (3)
    CE scan behaviour: Support both over- and underscan (3)
Basic audio support
1 native detailed modes
Detailed mode: Clock 27.000 MHz, 160 mm x 90 mm
                720  736  798  858 hborder 0
                480  489  495  525 vborder 0
               -hsync -vsync analog composite 
               VertFreq: 59 Hz, HorFreq: 31468 Hz
Checksum: 0xd4 (valid)

EDID block does NOT conform to EDID 1.4!
	sRGB is signaled, but the chromaticities do not match
EDID block does not conform at all!
	Both the serial number and the serial string are set
