
EDID (hex):
00ffffffffffff002157000000000001
291701030e331d782ac1b0a3544c9926
0f50542fcf00714f81c0814081809040
a9407140a9cf023a801871382d40582c
4500fd1e1100001e000000fd003c4b1e
5110000a202020202020000000fc0056
474120544f2048444d490a20283c80a0
70b0234030203600fd1e1100002000d4

Extracted contents:
header:          00 ff ff ff ff ff ff 00
serial number:   21 57 00 00 00 00 00 01 29 17
version:         01 03
basic params:    0e 33 1d 78 2a
chroma info:     c1 b0 a3 54 4c 99 26 0f 50 54
established:     2f cf 00
standard:        71 4f 81 c0 81 40 81 80 90 40 a9 40 71 40 a9 cf
descriptor 1:    02 3a 80 18 71 38 2d 40 58 2c 45 00 fd 1e 11 00 00 1e
descriptor 2:    00 00 00 fd 00 3c 4b 1e 51 10 00 0a 20 20 20 20 20 20
descriptor 3:    00 00 00 fc 00 56 47 41 20 54 4f 20 48 44 4d 49 0a 20
descriptor 4:    28 3c 80 a0 70 b0 23 40 30 20 36 00 fd 1e 11 00 00 20
extensions:      00
checksum:        d4

EDID version: 1.3
Manufacturer: HJW Model 0 Serial Number --
Made in week 41 of 2013
Analog display, Input voltage level: 0.7/0.3 V
Sync: Separate Composite SyncOnGreen 
Maximum image size: 51 cm x 29 cm
Gamma: 2.20
DPMS levels: Off
RGB color display
First detailed timing is preferred timing
Display x,y Chromaticity:
  Red:   0.6396, 0.3281
  Green: 0.2968, 0.5986
  Blue:  0.1503, 0.0615
  White: 0.3125, 0.3281
Established timings supported:
  640x480@60Hz 4:3 HorFreq: 31469 Hz Clock: 25.175 MHz
  640x480@72Hz 4:3 HorFreq: 37900 Hz Clock: 31.500 MHz
  640x480@75Hz 4:3 HorFreq: 37500 Hz Clock: 31.500 MHz
  800x600@56Hz 4:3 HorFreq: 35200 Hz Clock: 36.000 MHz
  800x600@60Hz 4:3 HorFreq: 37900 Hz Clock: 40.000 MHz
  800x600@72Hz 4:3 HorFreq: 48100 Hz Clock: 50.000 MHz
  800x600@75Hz 4:3 HorFreq: 46900 Hz Clock: 49.500 MHz
  1024x768@60Hz 4:3 HorFreq: 48400 Hz Clock: 65.000 MHz
  1024x768@70Hz 4:3 HorFreq: 56500 Hz Clock: 75.000 MHz
  1024x768@75Hz 4:3 HorFreq: 60000 Hz Clock: 78.750 MHz
  1280x1024@75Hz 5:4 HorFreq: 80000 Hz Clock: 135.000 MHz
Standard timings supported:
  1152x864@75Hz 4:3 HorFreq: 67500 Hz Clock: 108.000 MHz
  1280x720@60Hz 16:9
  1280x960@60Hz 4:3 HorFreq: 60000 Hz Clock: 108.000 MHz
  1280x1024@60Hz 5:4 HorFreq: 64000 Hz Clock: 108.000 MHz
  1400x1050@60Hz 4:3 HorFreq: 64700 Hz Clock: 101.000 MHz
  1600x1200@60Hz 4:3 HorFreq: 75000 Hz Clock: 162.000 MHz
  1152x864@60Hz 4:3
  1600x900@75Hz 16:9
Detailed mode: Clock 148.500 MHz, 509 mm x 286 mm
               1920 2008 2052 2200 hborder 0
               1080 1084 1089 1125 vborder 0
               +hsync +vsync 
               VertFreq: 60 Hz, HorFreq: 67500 Hz
Monitor ranges (GTF): 60-75Hz V, 30-81kHz H, max dotclock 160MHz
Monitor name: VGA TO HDMI
Detailed mode: Clock 154.000 MHz, 509 mm x 286 mm
               1920 1968 2000 2080 hborder 0
               1200 1203 1209 1235 vborder 0
               -hsync -vsync analog composite field sequential L/R
               VertFreq: 59 Hz, HorFreq: 74038 Hz
Checksum: 0xd4 (valid)
One or more of the timings is out of range of the Monitor Ranges:
  Vertical Freq: 56 - 75 Hz
  Horizontal Freq: 31469 - 80000 Hz
  Maximum Clock: 162.000 MHz
EDID block does not conform at all!
	Invalid detailed timing descriptor ordering
