
EDID (hex):
00ffffffffffff004d67122700000000
23200104b53c2278f93301b34933bd28
0b5055adcf00d1c08180714fa9c0b300
b33cd1fc95004dd000a0f0703e803020
8a00584a2100001a000000fd0c309050
5082010a202020202020000000fc0020
4d3237503230500a20202020000000ff
00303030303030303030303030310202
020334f123097f07830100004b900403
0112131f3f617600e2007fe305c000e6
0607018b77216d1a0000020b30900004
8b218b2198e200a0a0a0295030203500
00000000001e2c39a0205384bd3068b0
360055502100001e98ad00a0f0703e80
30208a00584a2100001e000000000000
00000000000000000000000000000044
701279030003013c4a0b0204ff0e6701
2f801f006f08360002000400404f0104
ff0e9f002f801f006f08620002000400
ceac0104ff0e9f006f801f006f087e00
76000400000000000000000000000000
00000000000000000000000000000000
00000000000000000000000000000000
00000000000000000000000000004c90

Extracted contents:
header:          00 ff ff ff ff ff ff 00
serial number:   4d 67 12 27 00 00 00 00 23 20
version:         01 04
basic params:    b5 3c 22 78 f9
chroma info:     33 01 b3 49 33 bd 28 0b 50 55
established:     ad cf 00
standard:        d1 c0 81 80 71 4f a9 c0 b3 00 b3 3c d1 fc 95 00
descriptor 1:    4d d0 00 a0 f0 70 3e 80 30 20 8a 00 58 4a 21 00 00 1a
descriptor 2:    00 00 00 fd 0c 30 90 50 50 82 01 0a 20 20 20 20 20 20
descriptor 3:    00 00 00 fc 00 20 4d 32 37 50 32 30 50 0a 20 20 20 20
descriptor 4:    00 00 00 ff 00 30 30 30 30 30 30 30 30 30 30 30 30 31
extensions:      02
checksum:        02

EDID version: 1.4
Manufacturer: SKG Model 2712 Serial Number --
Made in week 35 of 2022
Digital display
10 bits per primary color channel
DisplayPort interface
Maximum image size: 60 cm x 34 cm
Gamma: 2.20
DPMS levels: Standby Suspend Off
Supported color formats: RGB 4:4:4, YCrCb 4:4:4, YCrCb 4:2:2
Display is continuous frequency
Display x,y Chromaticity:
  Red:   0.6992, 0.2880
  Green: 0.1992, 0.7412
  Blue:  0.1562, 0.0429
  White: 0.3125, 0.3330
Established timings supported:
  720x400@70Hz 9:5 HorFreq: 31469 Hz Clock: 28.320 MHz
  640x480@60Hz 4:3 HorFreq: 31469 Hz Clock: 25.175 MHz
  640x480@72Hz 4:3 HorFreq: 37900 Hz Clock: 31.500 MHz
  640x480@75Hz 4:3 HorFreq: 37500 Hz Clock: 31.500 MHz
  800x600@60Hz 4:3 HorFreq: 37900 Hz Clock: 40.000 MHz
  800x600@72Hz 4:3 HorFreq: 48100 Hz Clock: 50.000 MHz
  800x600@75Hz 4:3 HorFreq: 46900 Hz Clock: 49.500 MHz
  1024x768@60Hz 4:3 HorFreq: 48400 Hz Clock: 65.000 MHz
  1024x768@70Hz 4:3 HorFreq: 56500 Hz Clock: 75.000 MHz
  1024x768@75Hz 4:3 HorFreq: 60000 Hz Clock: 78.750 MHz
  1280x1024@75Hz 5:4 HorFreq: 80000 Hz Clock: 135.000 MHz
Standard timings supported:
  1920x1080@60Hz 16:9
  1280x1024@60Hz 5:4 HorFreq: 64000 Hz Clock: 108.000 MHz
  1152x864@75Hz 4:3 HorFreq: 67500 Hz Clock: 108.000 MHz
  1600x900@60Hz 16:9
  1680x1050@60Hz 16:10 HorFreq: 64700 Hz Clock: 119.000 MHz
  1680x1050@120Hz 16:10
  1920x1080@120Hz 16:9
  1440x900@60Hz 16:10 HorFreq: 55500 Hz Clock: 88.750 MHz
Detailed mode: Clock 533.250 MHz, 600 mm x 330 mm
               3840 3888 3920 4000 hborder 0
               2160 2168 2178 2222 vborder 0
               +hsync -vsync 
               VertFreq: 59 Hz, HorFreq: 133312 Hz
Monitor ranges (bare limits): 48-144Hz V, 80-335kHz H, max dotclock 1300MHz
Monitor name:  M27P20P
Serial number: --
Has 2 extension blocks
Checksum: 0x2 (valid)

CTA extension block
Extension version: 3
48 bytes of CTA data
  Audio data block
    Linear PCM, max channels 2
      Supported sample rates (kHz): 192 176.4 96 88.2 48 44.1 32
      Supported sample sizes (bits): 24 20 16
  Speaker allocation data block
    Speaker map:
      FL/FR - Front Left/Right
  Video data block
    VIC  16 1920x1080@60Hz 16:9 (native) HorFreq: 67500 Hz Clock: 148.500 MHz
    VIC   4 1280x720@60Hz 16:9  HorFreq: 45000 Hz Clock: 74.250 MHz
    VIC   3 720x480@60Hz 16:9  HorFreq: 31469 Hz Clock: 27.000 MHz
    VIC   1 640x480@60Hz 4:3  HorFreq: 31469 Hz Clock: 25.175 MHz
    VIC  18 720x576@50Hz 16:9  HorFreq: 31250 Hz Clock: 27.000 MHz
    VIC  19 1280x720@50Hz 16:9  HorFreq: 37500 Hz Clock: 74.250 MHz
    VIC  31 1920x1080@50Hz 16:9  HorFreq: 56250 Hz Clock: 148.500 MHz
    VIC  63 1920x1080@120Hz 16:9  HorFreq: 135000 Hz Clock: 297.000 MHz
    VIC  97 3840x2160@60Hz 16:9  HorFreq: 135000 Hz Clock: 594.000 MHz
    VIC 118 3840x2160@120Hz 16:9  HorFreq: 270000 Hz Clock: 1188.000 MHz
  Extended tag: Video capability data block
    YCbCr quantization: No Data (0)
    RGB quantization: Selectable (via AVI Q) (1)
    PT scan behaviour: Support both over- and underscan (3)
    IT scan behaviour: Support both over- and underscan (3)
    CE scan behaviour: Support both over- and underscan (3)
  Extended tag: Colorimetry data block
    BT2020YCC
    BT2020RGB
  Extended tag: HDR static metadata data block
    Electro optical transfer functions:
      Traditional gamma - SDR luminance range
      Traditional gamma - HDR luminance range
      SMPTE ST2084
    Supported static metadata descriptors:
      Static metadata type 1
    Desired content max luminance: 139 (1015.241 cd/m^2)
    Desired content max frame-average luminance: 119 (658.302 cd/m^2)
    Desired content min luminance: 33 (0.170 cd/m^2)
  Vendor-specific data block, OUI 00001a
Underscans PC formats by default
Basic audio support
Supports YCbCr 4:4:4
Supports YCbCr 4:2:2
1 native detailed modes
Detailed mode: Clock 580.080 MHz, 0 mm x 0 mm
               2560 2608 2640 2720 hborder 0
               1440 1443 1448 1481 vborder 0
               +hsync +vsync 
               VertFreq: 144 Hz, HorFreq: 213264 Hz
Detailed mode: Clock 146.360 MHz, 597 mm x 336 mm
               1440 1544 1720 2240 hborder 0
                900  903  909 1089 vborder 0
               +hsync +vsync 
               VertFreq: 59 Hz, HorFreq: 65339 Hz
Detailed mode: Clock 444.400 MHz, 600 mm x 330 mm
               3840 3888 3920 4000 hborder 0
               2160 2168 2178 2222 vborder 0
               +hsync +vsync 
               VertFreq: 50 Hz, HorFreq: 111100 Hz
Checksum: 0x44 (valid)


DisplayID extension block
Extension version: 18
Length 121, version 18, extension count 0
Checksum: 0x4c (valid)
Type 1 detailed timing: aspect: 16:9,  
Detailed mode: Clock 1339.620 MHz, 0 mm x 0 mm
               3839 3886 3917 4198
               2159 2161 2165 2213
               +hsync -vsync
Type 1 detailed timing: aspect: 16:9,  
Detailed mode: Clock 858.240 MHz, 0 mm x 0 mm
               3839 3886 3917 3998
               2159 2161 2165 2257
               +hsync -vsync
Type 1 detailed timing: aspect: 16:9,  
Detailed mode: Clock 1097.740 MHz, 0 mm x 0 mm
               3839 3950 3981 3998
               2159 2277 2281 2285
               +hsync -vsync

Warning: One or more of the timings is out of range of the Monitor Ranges:
  Vertical Freq: 50 - 144 Hz
  Horizontal Freq: 31250 - 270000 Hz
  Maximum Clock: 1188.000 MHz
