
EDID (hex):
00ffffffffffff0030640a0901010101
0c140103801d11780a859599574f8f26
21505400080001010101010101010101
010101010101d21b569850000e301e3e
240027a610000018000000fd003a3e2e
3007000a202020202020000000fc004c
54313333454530393530300a000000ff
004148345230433030343036390a0017

edid-decode (hex):

00 ff ff ff ff ff ff 00 30 64 0a 09 01 01 01 01
0c 14 01 03 80 1d 11 78 0a 85 95 99 57 4f 8f 26
21 50 54 00 08 00 01 01 01 01 01 01 01 01 01 01
01 01 01 01 01 01 d2 1b 56 98 50 00 0e 30 1e 3e
24 00 27 a6 10 00 00 18 00 00 00 fd 00 3a 3e 2e
30 07 00 0a 20 20 20 20 20 20 00 00 00 fc 00 4c
54 31 33 33 45 45 30 39 35 30 30 0a 00 00 00 ff
00 41 48 34 52 30 43 30 30 34 30 36 39 0a 00 17

----------------

Block 0, Base EDID:
  EDID Structure Version & Revision: 1.3
  Vendor & Product Identification:
    Manufacturer: LCD
    Model: 2314
    Serial Number: 16843009
    Made in: week 12 of 2010
  Basic Display Parameters & Features:
    Digital display
    Maximum image size: 29 cm x 17 cm
    Gamma: 2.20
    RGB color display
    First detailed timing is the preferred timing
  Color Characteristics:
    Red  : 0.5996, 0.3398
    Green: 0.3095, 0.5595
    Blue : 0.1503, 0.1298
    White: 0.3134, 0.3291
  Established Timings I & II:
    DMT 0x10:  1024x768    60.003840 Hz   4:3     48.363 kHz     65.000000 MHz
  Standard Timings: none
  Detailed Timing Descriptors:
    DTD 1:  1366x768    59.996159 Hz 683:384   46.917 kHz     71.220000 MHz (295 mm x 166 mm)
                 Hfront   30 Hsync  62 Hback   60 Hpol N
                 Vfront    2 Vsync   4 Vback    8 Vpol N
    Display Range Limits:
      Monitor ranges (GTF): 58-62 Hz V, 46-48 kHz H, max dotclock 70 MHz
    Display Product Name: 'LT133EE09500'
    Display Product Serial Number: 'AH4R0C004069'
Checksum: 0x17
