
EDID (hex):
00ffffffffffff002613061502000020
091d0104b51e1a783aef65a656529d28
0b505421080071408180a9c0d1c00101
0101010101012d3680a070381f40582c
45002c041100001e000000ff00303030
30303030303030310a20000000fc0049
505331353036554844520a20000000fd
0037414b4b12000a20202020202001ee
02031ef24301040223097f0783010000
e305e000e200c0e6060501626228023a
801871382d40582c45002c041100001e
00000000000000000000000000000000
00000000000000000000000000000000
00000000000000000000000000000000
00000000000000000000000000000000
00000000000000000000000000000011

Extracted contents:
header:          00 ff ff ff ff ff ff 00
serial number:   26 13 06 15 02 00 00 20 09 1d
version:         01 04
basic params:    b5 1e 1a 78 3a
chroma info:     ef 65 a6 56 52 9d 28 0b 50 54
established:     21 08 00
standard:        71 40 81 80 a9 c0 d1 c0 01 01 01 01 01 01 01 01
descriptor 1:    2d 36 80 a0 70 38 1f 40 58 2c 45 00 2c 04 11 00 00 1e
descriptor 2:    00 00 00 ff 00 30 30 30 30 30 30 30 30 30 30 31 0a 20
descriptor 3:    00 00 00 fc 00 49 50 53 31 35 30 36 55 48 44 52 0a 20
descriptor 4:    00 00 00 fd 00 37 41 4b 4b 12 00 0a 20 20 20 20 20 20
extensions:      01
checksum:        ee

EDID version: 1.4
Manufacturer: IPS Model 1506 Serial Number --
Made in week 9 of 2019
Digital display
10 bits per primary color channel
DisplayPort interface
Maximum image size: 30 cm x 26 cm
Gamma: 2.20
DPMS levels: Off
Supported color formats: RGB 4:4:4, YCrCb 4:4:4, YCrCb 4:2:2
First detailed timing includes the native pixel format and preferred refresh rate
Display x,y Chromaticity:
  Red:   0.6513, 0.3378
  Green: 0.3232, 0.6162
  Blue:  0.1572, 0.0449
  White: 0.3134, 0.3291
Established timings supported:
  640x480@60Hz 4:3 HorFreq: 31469 Hz Clock: 25.175 MHz
  800x600@60Hz 4:3 HorFreq: 37900 Hz Clock: 40.000 MHz
  1024x768@60Hz 4:3 HorFreq: 48400 Hz Clock: 65.000 MHz
Standard timings supported:
  1152x864@60Hz 4:3
  1280x1024@60Hz 5:4 HorFreq: 64000 Hz Clock: 108.000 MHz
  1600x900@60Hz 16:9
  1920x1080@60Hz 16:9
Detailed mode: Clock 138.690 MHz, 300 mm x 260 mm
               1920 2008 2052 2080 hborder 0
               1080 1084 1089 1111 vborder 0
               +hsync +vsync 
               VertFreq: 60 Hz, HorFreq: 66677 Hz
Serial number: --
Monitor name: IPS1506UHDR
Monitor ranges (GTF): 55-65Hz V, 75-75kHz H, max dotclock 180MHz
Has 1 extension blocks
Checksum: 0xee (valid)

CTA extension block
Extension version: 3
26 bytes of CTA data
  Video data block
    VIC   1 640x480@60Hz 4:3  HorFreq: 31469 Hz Clock: 25.175 MHz
    VIC   4 1280x720@60Hz 16:9  HorFreq: 45000 Hz Clock: 74.250 MHz
    VIC   2 720x480@60Hz 4:3  HorFreq: 31469 Hz Clock: 27.000 MHz
  Audio data block
    Linear PCM, max channels 2
      Supported sample rates (kHz): 192 176.4 96 88.2 48 44.1 32
      Supported sample sizes (bits): 24 20 16
  Speaker allocation data block
    Speaker map:
      FL/FR - Front Left/Right
  Extended tag: Colorimetry data block
    BT2020cYCC
    BT2020YCC
    BT2020RGB
  Extended tag: Video capability data block
    YCbCr quantization: Selectable (via AVI YQ) (1)
    RGB quantization: Selectable (via AVI Q) (1)
    PT scan behaviour: No Data (0)
    IT scan behaviour: IT video formats not supported (0)
    CE scan behaviour: CE video formats not supported (0)
  Extended tag: HDR static metadata data block
    Electro optical transfer functions:
      Traditional gamma - SDR luminance range
      SMPTE ST2084
    Supported static metadata descriptors:
      Static metadata type 1
    Desired content max luminance: 98 (417.710 cd/m^2)
    Desired content max frame-average luminance: 98 (417.710 cd/m^2)
    Desired content min luminance: 40 (0.103 cd/m^2)
Underscans PC formats by default
Basic audio support
Supports YCbCr 4:4:4
Supports YCbCr 4:2:2
2 native detailed modes
Detailed mode: Clock 148.500 MHz, 300 mm x 260 mm
               1920 2008 2052 2200 hborder 0
               1080 1084 1089 1125 vborder 0
               +hsync +vsync 
               VertFreq: 60 Hz, HorFreq: 67500 Hz
Checksum: 0x11 (valid)

Warning: One or more of the timings is out of range of the Monitor Ranges:
  Vertical Freq: 60 - 60 Hz
  Horizontal Freq: 31469 - 67500 Hz
  Maximum Clock: 148.500 MHz
EDID block does not conform at all!
	Both the serial number and the serial string are set


