edid-decode (hex):

00 ff ff ff ff ff ff 00 09 e5 c9 08 00 00 00 00
22 1d 01 04 a5 1f 11 78 03 34 c5 95 5c 5a 92 29
1d 50 54 00 00 00 01 01 01 01 01 01 01 01 01 01
01 01 01 01 01 01 8b 39 80 10 71 38 28 40 30 20
36 00 35 ae 10 00 00 1a 00 00 00 00 00 00 00 00
00 00 00 00 00 00 00 00 00 00 00 00 00 fe 00 42
4f 45 20 43 51 0a 20 20 20 20 20 20 00 00 00 fe
00 4e 54 31 34 30 46 48 4d 2d 4e 34 35 0a 00 9b

----------------

Block 0, Base EDID:
  EDID Structure Version & Revision: 1.4
  Vendor & Product Identification:
    Manufacturer: BOE
    Model: 2249
    Made in: week 34 of 2019
  Basic Display Parameters & Features:
    Digital display
    Bits per primary color channel: 8
    DisplayPort interface
    Maximum image size: 31 cm x 17 cm
    Gamma: 2.20
    Supported color formats: RGB 4:4:4
    First detailed timing includes the native pixel format and preferred refresh rate
    Display is continuous frequency
  Color Characteristics:
    Red  : 0.5820, 0.3623
    Green: 0.3525, 0.5703
    Blue : 0.1630, 0.1132
    White: 0.3134, 0.3291
  Established Timings I & II: none
  Standard Timings: none
  Detailed Timing Descriptors:
    DTD 1:  1920x1080   60.003096 Hz  16:9     67.203 kHz    147.310000 MHz (309 mm x 174 mm)
                 Hfront   48 Hsync  32 Hback  192 Hpol P
                 Vfront    3 Vsync   6 Vback   31 Vpol N
    Empty Descriptor
    Alphanumeric Data String: 'BOE CQ'
    Alphanumeric Data String: 'NT140FHM-N45'
Checksum: 0x9b

----------------

Warnings:

Block 0, Base EDID:
  Missing Display Product Name.

Failures:

Block 0, Base EDID:
  Empty Descriptor: Use Dummy Descriptor instead of all zeroes.
  Missing Display Range Limits Descriptor.

EDID conformity: FAIL
