edid-decode (hex):

00 ff ff ff ff ff ff 00 10 ac 0d a1 4c 56 34 30
31 1c 01 04 b5 78 22 78 3e ee 91 a3 54 4c 99 26
0f 50 54 a5 4b 00 71 4f 81 00 81 80 a9 40 d1 c0
01 01 01 01 01 01 1a 68 00 a0 f0 38 1f 40 30 20
3a 00 ae 51 41 00 00 1a 00 00 00 ff 00 34 34 53
5a 57 50 32 0a 20 20 20 20 20 00 00 00 fc 00 44
65 6c 6c 20 55 34 39 31 39 44 57 0a 00 00 00 fd
00 18 56 19 73 2f 01 0a 20 20 20 20 20 20 02 d4

02 03 10 b1 4b 90 05 04 03 02 01 14 1f 12 13 5a
cd 46 00 a0 a0 38 1f 40 30 20 3a 00 ae 51 41 00
00 1a 00 00 00 00 00 00 00 00 00 00 00 00 00 00
00 00 00 00 00 00 00 00 00 00 00 00 00 00 00 00
00 00 00 00 00 00 00 00 00 00 00 00 00 00 00 00
00 00 00 00 00 00 00 00 00 00 00 00 00 00 00 00
00 00 00 00 00 00 00 00 00 00 00 00 00 00 00 00
00 00 00 00 00 00 00 00 00 00 00 00 00 00 00 d0

70 12 79 03 00 01 00 0c cd 2e 2a 0d 00 14 a0 05
10 78 ff 99 03 01 28 33 b7 00 88 ff 13 9f 00 2f
80 1f 00 9f 05 28 00 02 00 09 00 54 5a 00 08 ff
13 9f 00 2f 80 1f 00 9f 05 14 00 02 00 09 00 00
00 00 00 00 00 00 00 00 00 00 00 00 00 00 00 00
00 00 00 00 00 00 00 00 00 00 00 00 00 00 00 00
00 00 00 00 00 00 00 00 00 00 00 00 00 00 00 00
00 00 00 00 00 00 00 00 00 00 00 00 00 00 6e 90

----------------

Block 0, Base EDID:
  EDID Structure Version & Revision: 1.4
  Vendor & Product Identification:
    Manufacturer: DEL
    Model: 41229
    Serial Number: ...
    Made in: week 49 of 2018
  Basic Display Parameters & Features:
    Digital display
    Bits per primary color channel: 10
    DisplayPort interface
    Maximum image size: 120 cm x 34 cm
    Gamma: 2.20
    DPMS levels: Off
    Supported color formats: RGB 4:4:4, YCrCb 4:4:4, YCrCb 4:2:2
    Default (sRGB) color space is primary color space
    First detailed timing includes the native pixel format and preferred refresh rate
  Color Characteristics:
    Red  : 0.6396, 0.3300
    Green: 0.2998, 0.5996
    Blue : 0.1503, 0.0595
    White: 0.3125, 0.3291
  Established Timings I & II:
    IBM     :   720x400    70.082 Hz   9:5    31.467 kHz  28.320 MHz
    DMT 0x04:   640x480    59.940 Hz   4:3    31.469 kHz  25.175 MHz
    DMT 0x06:   640x480    75.000 Hz   4:3    37.500 kHz  31.500 MHz
    DMT 0x09:   800x600    60.317 Hz   4:3    37.879 kHz  40.000 MHz
    DMT 0x0b:   800x600    75.000 Hz   4:3    46.875 kHz  49.500 MHz
    DMT 0x10:  1024x768    60.004 Hz   4:3    48.363 kHz  65.000 MHz
    DMT 0x12:  1024x768    75.029 Hz   4:3    60.023 kHz  78.750 MHz
    DMT 0x24:  1280x1024   75.025 Hz   5:4    79.976 kHz 135.000 MHz
  Standard Timings:
    DMT 0x15:  1152x864    75.000 Hz   4:3    67.500 kHz 108.000 MHz
    DMT 0x1c:  1280x800    59.810 Hz  16:10   49.702 kHz  83.500 MHz
    DMT 0x23:  1280x1024   60.020 Hz   5:4    63.981 kHz 108.000 MHz
    DMT 0x33:  1600x1200   60.000 Hz   4:3    75.000 kHz 162.000 MHz
    DMT 0x52:  1920x1080   60.000 Hz  16:9    67.500 kHz 148.500 MHz
  Detailed Timing Descriptors:
    DTD 1:  3840x1080   59.968 Hz  32:9    66.625 kHz 266.500 MHz (1198 mm x 337 mm)
                 Hfront   48 Hsync  32 Hback  80 Hpol P
                 Vfront    3 Vsync  10 Vback  18 Vpol N
    Display Product Serial Number: ...
    Display Product Name: 'Dell U4919DW'
  Display Range Limits:
    Monitor ranges (Bare Limits): 24-86 Hz V, 25-115 kHz H, max dotclock 470 MHz
  Extension blocks: 2
Checksum: 0xd4

----------------

Block 1, CTA-861 Extension Block:
  Revision: 3
  Underscans PC formats by default
  Supports YCbCr 4:4:4
  Supports YCbCr 4:2:2
  Native detailed modes: 1
  Video Data Block:
    VIC  16:  1920x1080   60.000 Hz  16:9    67.500 kHz 148.500 MHz (native)
    VIC   5:  1920x1080i  60.000 Hz  16:9    33.750 kHz  74.250 MHz
    VIC   4:  1280x720    60.000 Hz  16:9    45.000 kHz  74.250 MHz
    VIC   3:   720x480    59.940 Hz  16:9    31.469 kHz  27.000 MHz
    VIC   2:   720x480    59.940 Hz   4:3    31.469 kHz  27.000 MHz
    VIC   1:   640x480    59.940 Hz   4:3    31.469 kHz  25.175 MHz
    VIC  20:  1920x1080i  50.000 Hz  16:9    28.125 kHz  74.250 MHz
    VIC  31:  1920x1080   50.000 Hz  16:9    56.250 kHz 148.500 MHz
    VIC  18:   720x576    50.000 Hz  16:9    31.250 kHz  27.000 MHz
    VIC  19:  1280x720    50.000 Hz  16:9    37.500 kHz  74.250 MHz
    VIC  90:  2560x1080   60.000 Hz  64:27   66.000 kHz 198.000 MHz
  Detailed Timing Descriptors:
    DTD 2:  2560x1080   59.978 Hz  64:27   66.636 kHz 181.250 MHz (1198 mm x 337 mm)
                 Hfront   48 Hsync  32 Hback  80 Hpol P
                 Vfront    3 Vsync  10 Vback  18 Vpol N
Checksum: 0xd0

----------------

Block 2, DisplayID Extension Block:
  Version: 1.2
  Extension Count: 0
  Display Product Type: Standalone display device
  Display Parameters Data Block (0x01):
    Image size: 1198.1 mm x 337.0 mm
    Pixels: 5120 x 1440
    Feature support flags:
      Power management (DPM)
    Gamma: 2.20
    Aspect ratio: 3.55
    Dynamic bpc native: 10
    Dynamic bpc overall: 10
  Video Timing Modes Type 1 - Detailed Timings Data Block:
    DTD 3:  5120x1440   59.977 Hz   0:0    88.826 kHz 469.000 MHz (aspect undefined, no 3D stereo, preferred)
                 Hfront   48 Hsync  32 Hback  80 Hpol P
                 Vfront    3 Vsync  10 Vback  28 Vpol N
    DTD 4:  5120x1440   29.978 Hz   0:0    43.797 kHz 231.250 MHz (aspect undefined, no 3D stereo)
                 Hfront   48 Hsync  32 Hback  80 Hpol P
                 Vfront    3 Vsync  10 Vback   8 Vpol N
  Checksum: 0x6e
Checksum: 0x90
