edid-decode (hex):

00 ff ff ff ff ff ff 00 06 af 44 44 00 00 00 00
01 10 01 03 80 1e 13 78 0a 7f e5 93 55 50 8c 27
22 50 54 00 00 00 01 01 01 01 01 01 01 01 01 01
01 01 01 01 01 01 ee 1a 00 80 50 20 10 30 15 20
35 00 30 be 10 00 00 18 00 00 00 0f 00 00 00 00
00 00 00 00 00 00 00 00 00 20 00 00 00 fe 00 41
55 4f 0a 20 20 20 20 20 20 20 20 20 00 00 00 fe
00 42 31 34 31 45 57 30 34 20 56 34 20 0a 00 be

----------------

Block 0, Base EDID:
  EDID Structure Version & Revision: 1.3
  Vendor & Product Identification:
    Manufacturer: AUO
    Model: 17476
    Made in: week 1 of 2006
  Basic Display Parameters & Features:
    Digital display
    Maximum image size: 30 cm x 19 cm
    Gamma: 2.20
    RGB color display
    First detailed timing is preferred timing
  Color Characteristics:
    Red  : 0.5751, 0.3349
    Green: 0.3154, 0.5498
    Blue : 0.1552, 0.1347
    White: 0.3134, 0.3291
  Established Timings I & II: none
  Standard Timings: none
  Detailed Timing Descriptors:
    DTD 1:  1280x800    60.004 Hz   8:5    48.963 kHz  68.940 MHz (304 mm x 190 mm)
                 Hfront   21 Hsync  32 Hback  75 Hpol N
                 Vfront    3 Vsync   5 Vback   8 Vpol N
    Manufacturer-Specified Display Descriptor (0x0f): 00 0f 00 00 00 00 00 00 00 00 00 00 00 00 00 20 '............... '
    Alphanumeric Data String: 'AUO'
    Alphanumeric Data String: 'B141EW04 V4 '
Checksum: 0xbe
