
EDID (hex):
00ffffffffffff0051b820144831365a
1c1f0104b51e147807ee95a3544c9926
0f505400000001010101010101010101
01010101010144a3d8b4909028603020
86042cc810000018000000fd00305aa0
a02b010a202020202020000000ff000a
202020202020202020202020000000fc
00544c3134324744585030322d300155
701379000003012843a30004d709b300
2f001f008f0683031700050043a30004
d709b3002f001f008f06080617000500
00000000000000000000000000000000
00000000000000000000000000000000
00000000000000000000000000000000
00000000000000000000000000000000
0000000000000000000000000000bc90

Extracted contents:
header:          00 ff ff ff ff ff ff 00
serial number:   51 b8 20 14 48 31 36 5a 1c 1f
version:         01 04
basic params:    b5 1e 14 78 07
chroma info:     ee 95 a3 54 4c 99 26 0f 50 54
established:     00 00 00
standard:        01 01 01 01 01 01 01 01 01 01 01 01 01 01 01 01
descriptor 1:    44 a3 d8 b4 90 90 28 60 30 20 86 04 2c c8 10 00 00 18
descriptor 2:    00 00 00 fd 00 30 5a a0 a0 2b 01 0a 20 20 20 20 20 20
descriptor 3:    00 00 00 ff 00 0a 20 20 20 20 20 20 20 20 20 20 20 20
descriptor 4:    00 00 00 fc 00 54 4c 31 34 32 47 44 58 50 30 32 2d 30
extensions:      01
checksum:        55

EDID version: 1.4
Manufacturer: TMX Model 1420 Serial Number --
Made in week 28 of 2021
Digital display
10 bits per primary color channel
DisplayPort interface
Maximum image size: 30 cm x 20 cm
Gamma: 2.20
Supported color formats: RGB 4:4:4
Default (sRGB) color space is primary color space
First detailed timing includes the native pixel format and preferred refresh rate
Display is continuous frequency
Display x,y Chromaticity:
  Red:   0.6396, 0.3300
  Green: 0.2998, 0.5996
  Blue:  0.1503, 0.0595
  White: 0.3134, 0.3291
Established timings supported:
Standard timings supported:
Detailed mode: Clock 417.960 MHz, 300 mm x 200 mm
               2520 2568 2600 2700 hborder 0
               1680 1704 1710 1720 vborder 0
               -hsync -vsync 
               VertFreq: 90 Hz, HorFreq: 154800 Hz
Monitor ranges (bare limits): 48-90Hz V, 160-160kHz H, max dotclock 430MHz
Serial number: 
-- 1 extension blocks
Checksum: 0x55 (valid)

DisplayID extension block
Extension version: 19
Length 121, version 19, extension count 0
Checksum: 0xbc (valid)
Type 1 detailed timing: aspect: 16:9,  
Detailed mode: Clock 417.950 MHz, 0 mm x 0 mm
               2519 2566 2597 2698
               1679 1702 1707 2578
               -hsync -vsync
Type 1 detailed timing: aspect: 16:9,  
Detailed mode: Clock 417.950 MHz, 0 mm x 0 mm
               2519 2566 2597 2698
               1679 1702 1707 3223
               -hsync -vsync

EDID block does NOT conform to EDID 1.4!
	sRGB is signaled, but the chromaticities do not match
	Name descriptor not terminated with a newline
Warning: One or more of the timings is out of range of the Monitor Ranges:
  Vertical Freq: 90 - 90 Hz
  Horizontal Freq: 154800 - 154800 Hz
  Maximum Clock: 417.960 MHz
EDID block does not conform at all!
	Has -1426063360 nonconformant extension block(s)
