edid-decode (hex):

00 ff ff ff ff ff ff 00 06 af 3d 53 2e 0b 00 00
00 1b 01 04 95 1f 11 78 02 8a 05 a5 55 4e 9b 28
0f 50 54 00 00 00 01 01 01 01 01 01 01 01 01 01
01 01 01 01 01 01 b4 37 80 a0 70 38 3e 40 10 10
35 00 35 ae 10 00 00 18 b4 37 80 a0 70 38 78 42
10 10 35 00 35 ae 10 00 00 18 00 00 00 00 00 00
00 00 00 00 00 00 00 00 00 00 00 00 00 00 00 02
00 14 30 ff 12 3c c8 0c 0b 26 c8 20 20 20 00 ae

00 ff ff ff ff ff ff 00 06 af 3d 53 2e 0b 00 00
00 1b 01 04 95 1f 11 78 02 8a 05 a5 55 4e 9b 28
0f 50 54 00 00 00 01 01 01 01 01 01 01 01 01 01
01 01 01 01 01 01 b4 37 80 a0 70 38 3e 40 10 10
35 00 35 ae 10 00 00 18 b4 37 80 a0 70 38 78 42
10 10 35 00 35 ae 10 00 00 18 00 00 00 00 00 00
00 00 00 00 00 00 00 00 00 00 00 00 00 00 00 02
00 14 30 ff 12 3c c8 0c 0b 26 c8 20 20 20 00 ae

----------------

Block 0, Base EDID:
  EDID Structure Version & Revision: 1.4
  Vendor & Product Identification:
    Manufacturer: AUO
    Model: 21309
    Serial Number: ...
    Made in: 2017
  Basic Display Parameters & Features:
    Digital display
    Bits per primary color channel: 6
    DisplayPort interface
    Maximum image size: 31 cm x 17 cm
    Gamma: 2.20
    Supported color formats: RGB 4:4:4
    First detailed timing includes the native pixel format and preferred refresh rate
  Color Characteristics:
    Red  : 0.6464, 0.3320
    Green: 0.3066, 0.6074
    Blue : 0.1562, 0.0585
    White: 0.3134, 0.3291
  Established Timings I & II: none
  Standard Timings: none
  Detailed Timing Descriptors:
    DTD 1:  1920x1080   60.033006 Hz  16:9     68.558 kHz    142.600000 MHz (309 mm x 174 mm)
                 Hfront   16 Hsync  16 Hback  128 Hpol N
                 Vfront    3 Vsync   5 Vback   54 Vpol N
    DTD 2:  1920x1080   40.045381 Hz  16:9     68.558 kHz    142.600000 MHz (309 mm x 174 mm)
                 Hfront   16 Hsync  16 Hback  128 Hpol N
                 Vfront    3 Vsync   5 Vback  624 Vpol N
    Empty Descriptor
    Manufacturer-Specified Display Descriptor (0x02): 00 02 00 14 30 ff 12 3c c8 0c 0b 26 c8 20 20 20 '....0..<...&.   '
Checksum: 0xae

----------------

Block 1, Unknown EDID Extension Block 0x00:
  00 ff ff ff ff ff ff 00 06 af 3d 53 2e 0b 00 00 '..........=S....'
  00 1b 01 04 95 1f 11 78 02 8a 05 a5 55 4e 9b 28 '.......x....UN.('
  0f 50 54 00 00 00 01 01 01 01 01 01 01 01 01 01 '.PT.............'
  01 01 01 01 01 01 b4 37 80 a0 70 38 3e 40 10 10 '.......7..p8>@..'
  35 00 35 ae 10 00 00 18 b4 37 80 a0 70 38 78 42 '5.5......7..p8xB'
  10 10 35 00 35 ae 10 00 00 18 00 00 00 00 00 00 '..5.5...........'
  00 00 00 00 00 00 00 00 00 00 00 00 00 00 00 02 '................'
  00 14 30 ff 12 3c c8 0c 0b 26 c8 20 20 20 00 ae '..0..<...&.   ..'
Checksum: 0xae

----------------

Warnings:

Block 0, Base EDID:
  Missing Display Product Name.

Failures:

Block 0, Base EDID:
  Empty Descriptor: Use Dummy Descriptor instead of all zeroes.
Block 1, Base EDID:
  Unknown Extension Block.
EDID:
  Base EDID: EDID specified 0 extension block(s), but found 1 extension block(s).

EDID conformity: FAIL
