edid-decode (hex):

00 ff ff ff ff ff ff 00 30 e4 a5 04 00 00 00 00
00 19 01 04 a5 19 11 78 ea 62 65 a1 55 57 9a 26
1d 50 54 00 00 00 01 01 01 01 01 01 01 01 01 01
01 01 01 01 01 01 66 3f 80 a0 70 00 14 50 28 28
44 00 fd a9 00 00 00 19 44 2a 80 a0 70 00 14 50
28 28 44 00 fd a9 00 00 00 19 00 00 00 00 00 00
00 00 00 00 00 00 00 00 00 00 00 00 00 00 00 02
00 07 2d ff 0a 3c aa 19 0d 25 aa 00 00 00 00 9a

----------------

Block 0, Base EDID:
  EDID Structure Version & Revision: 1.4
  Vendor & Product Identification:
    Manufacturer: LGD
    Model: 1189
    Made in: 2015
  Basic Display Parameters & Features:
    Digital display
    Bits per primary color channel: 8
    DisplayPort interface
    Maximum image size: 25 cm x 17 cm
    Gamma: 2.20
    DPMS levels: Standby Suspend Off
    Supported color formats: RGB 4:4:4, YCrCb 4:4:4
    First detailed timing includes the native pixel format and preferred refresh rate
  Color Characteristics:
    Red  : 0.6298, 0.3339
    Green: 0.3398, 0.6035
    Blue : 0.1494, 0.1152
    White: 0.3134, 0.3291
  Established Timings I & II: none
  Standard Timings: none
  Detailed Timing Descriptors:
    DTD 1:  1920x1280   60.022189 Hz   3:2     78.029 kHz    162.300000 MHz (253 mm x 169 mm)
                 Hfront   40 Hsync  40 Hback   80 Hpol N
                 Vfront    4 Vsync   4 Vback   12 Vpol N
    DTD 2:  1920x1280   40.014793 Hz   3:2     52.019 kHz    108.200000 MHz (253 mm x 169 mm)
                 Hfront   40 Hsync  40 Hback   80 Hpol N
                 Vfront    4 Vsync   4 Vback   12 Vpol N
    Empty Descriptor
    Manufacturer-Specified Display Descriptor (0x02): 00 02 00 07 2d ff 0a 3c aa 19 0d 25 aa 00 00 00 '....-..<...%....'
Checksum: 0x9a

----------------

Warnings:

Block 0, Base EDID:
  Missing Display Product Name.

Failures:

Block 0, Base EDID:
  Empty Descriptor: Use Dummy Descriptor instead of all zeroes.

EDID conformity: FAIL
