
EDID (hex):
00ffffffffffff0004727c07aa110000
2d0f01030e261e782e6875a25a499f23
135054bfef808180714f010101010101
010101010101302a009851002a403070
1300782d1100001e000000fd00384b1f
530e000a202020202020000000fc0041
4c313931360a202020202020000000fe
00414345520a2020202020202020003f

Extracted contents:
header:          00 ff ff ff ff ff ff 00
serial number:   04 72 7c 07 aa 11 00 00 2d 0f
version:         01 03
basic params:    0e 26 1e 78 2e
chroma info:     68 75 a2 5a 49 9f 23 13 50 54
established:     bf ef 80
standard:        81 80 71 4f 01 01 01 01 01 01 01 01 01 01 01 01
descriptor 1:    30 2a 00 98 51 00 2a 40 30 70 13 00 78 2d 11 00 00 1e
descriptor 2:    00 00 00 fd 00 38 4b 1f 53 0e 00 0a 20 20 20 20 20 20
descriptor 3:    00 00 00 fc 00 41 4c 31 39 31 36 0a 20 20 20 20 20 20
descriptor 4:    00 00 00 fe 00 41 43 45 52 0a 20 20 20 20 20 20 20 20
extensions:      00
checksum:        3f

EDID version: 1.3
Manufacturer: ACR Model 77c Serial Number --
Analog display, Input voltage level: 0.7/0.3 V
Sync: Separate Composite SyncOnGreen 
Maximum image size: 38 cm x 30 cm
Gamma: 2.20
DPMS levels: Off
RGB color display
Default (sRGB) color space is primary color space
First detailed timing is preferred timing
Display x,y Chromaticity:
  Red:   0.6337, 0.3535
  Green: 0.2871, 0.6210
  Blue:  0.1376, 0.0771
  White: 0.3134, 0.3291
Established timings supported:
  720x400@70Hz 9:5 HorFreq: 31469 Hz Clock: 28.320 MHz
  640x480@60Hz 4:3 HorFreq: 31469 Hz Clock: 25.175 MHz
  640x480@67Hz 4:3 HorFreq: 35000 Hz Clock: 30.240 MHz
  640x480@72Hz 4:3 HorFreq: 37900 Hz Clock: 31.500 MHz
  640x480@75Hz 4:3 HorFreq: 37500 Hz Clock: 31.500 MHz
  800x600@56Hz 4:3 HorFreq: 35200 Hz Clock: 36.000 MHz
  800x600@60Hz 4:3 HorFreq: 37900 Hz Clock: 40.000 MHz
  800x600@72Hz 4:3 HorFreq: 48100 Hz Clock: 50.000 MHz
  800x600@75Hz 4:3 HorFreq: 46900 Hz Clock: 49.500 MHz
  832x624@75Hz 4:3 HorFreq: 49726 Hz Clock: 57.284 MHz
  1024x768@60Hz 4:3 HorFreq: 48400 Hz Clock: 65.000 MHz
  1024x768@70Hz 4:3 HorFreq: 56500 Hz Clock: 75.000 MHz
  1024x768@75Hz 4:3 HorFreq: 60000 Hz Clock: 78.750 MHz
  1280x1024@75Hz 5:4 HorFreq: 80000 Hz Clock: 135.000 MHz
  1152x870@75Hz 192:145 HorFreq: 67500 Hz Clock: 108.000 MHz
Standard timings supported:
  1280x1024@60Hz 5:4 HorFreq: 64000 Hz Clock: 108.000 MHz
  1152x864@75Hz 4:3 HorFreq: 67500 Hz Clock: 108.000 MHz
Detailed mode: Clock 108.000 MHz, 376 mm x 301 mm
               1280 1328 1440 1688 hborder 0
               1024 1025 1028 1066 vborder 0
               +hsync +vsync 
               VertFreq: 60 Hz, HorFreq: 63981 Hz
Monitor ranges (GTF): 56-75Hz V, 31-83kHz H, max dotclock 140MHz
Monitor name: AL1916
ASCII string: ACER
Checksum: 0x3f (valid)
EDID block does NOT conform to EDID 1.3!
	sRGB is signaled, but the chromaticities do not match
EDID block does not conform at all!
	Bad year of manufacture
