
EDID (hex):
00ffffffffffff004c2dd97142335834
121f010380351e782acb75a656539d27
125054bfef80714f810081c081809500
a9c0b3000101b37d806a703817402c20
35000f282100001e000000fd0032901e
9f22000a202020202020000000fc004c
53323441473332780a202020000000ff
0048394a52433030393935202020011c
02031cf147903f1f0413031223090707
8301000067030c001000b84404748018
71382d40582c45000f282100001e023a
801871382d40582c45000f282100001e
00000000000000000000000000000000
00000000000000000000000000000000
00000000000000000000000000000000
000000000000000000000000000000bf

Extracted contents:
header:          00 ff ff ff ff ff ff 00
serial number:   4c 2d d9 71 42 33 58 34 12 1f
version:         01 03
basic params:    80 35 1e 78 2a
chroma info:     cb 75 a6 56 53 9d 27 12 50 54
established:     bf ef 80
standard:        71 4f 81 00 81 c0 81 80 95 00 a9 c0 b3 00 01 01
descriptor 1:    b3 7d 80 6a 70 38 17 40 2c 20 35 00 0f 28 21 00 00 1e
descriptor 2:    00 00 00 fd 00 32 90 1e 9f 22 00 0a 20 20 20 20 20 20
descriptor 3:    00 00 00 fc 00 4c 53 32 34 41 47 33 32 78 0a 20 20 20
descriptor 4:    00 00 00 ff 00 48 39 4a 52 43 30 30 39 39 35 20 20 20
extensions:      01
checksum:        1c

EDID version: 1.3
Manufacturer: SAM Model 71d9 Serial Number --
Made in week 18 of 2021
Digital display
Maximum image size: 53 cm x 30 cm
Gamma: 2.20
DPMS levels: Off
RGB color display
First detailed timing is preferred timing
Display x,y Chromaticity:
  Red:   0.6513, 0.3359
  Green: 0.3261, 0.6162
  Blue:  0.1533, 0.0732
  White: 0.3134, 0.3291
Established timings supported:
  720x400@70Hz 9:5 HorFreq: 31469 Hz Clock: 28.320 MHz
  640x480@60Hz 4:3 HorFreq: 31469 Hz Clock: 25.175 MHz
  640x480@67Hz 4:3 HorFreq: 35000 Hz Clock: 30.240 MHz
  640x480@72Hz 4:3 HorFreq: 37900 Hz Clock: 31.500 MHz
  640x480@75Hz 4:3 HorFreq: 37500 Hz Clock: 31.500 MHz
  800x600@56Hz 4:3 HorFreq: 35200 Hz Clock: 36.000 MHz
  800x600@60Hz 4:3 HorFreq: 37900 Hz Clock: 40.000 MHz
  800x600@72Hz 4:3 HorFreq: 48100 Hz Clock: 50.000 MHz
  800x600@75Hz 4:3 HorFreq: 46900 Hz Clock: 49.500 MHz
  832x624@75Hz 4:3 HorFreq: 49726 Hz Clock: 57.284 MHz
  1024x768@60Hz 4:3 HorFreq: 48400 Hz Clock: 65.000 MHz
  1024x768@70Hz 4:3 HorFreq: 56500 Hz Clock: 75.000 MHz
  1024x768@75Hz 4:3 HorFreq: 60000 Hz Clock: 78.750 MHz
  1280x1024@75Hz 5:4 HorFreq: 80000 Hz Clock: 135.000 MHz
  1152x870@75Hz 192:145 HorFreq: 67500 Hz Clock: 108.000 MHz
Standard timings supported:
  1152x864@75Hz 4:3 HorFreq: 67500 Hz Clock: 108.000 MHz
  1280x800@60Hz 16:10
  1280x720@60Hz 16:9
  1280x1024@60Hz 5:4 HorFreq: 64000 Hz Clock: 108.000 MHz
  1440x900@60Hz 16:10 HorFreq: 55500 Hz Clock: 88.750 MHz
  1600x900@60Hz 16:9
  1680x1050@60Hz 16:10 HorFreq: 64700 Hz Clock: 119.000 MHz
Detailed mode: Clock 321.790 MHz, 527 mm x 296 mm
               1920 1964 1996 2026 hborder 0
               1080 1083 1088 1103 vborder 0
               +hsync +vsync 
               VertFreq: 143 Hz, HorFreq: 158830 Hz
Monitor ranges (GTF): 50-144Hz V, 30-159kHz H, max dotclock 340MHz
Monitor name: LS24AG32x
Serial number: --   
Has 1 extension blocks
Checksum: 0x1c (valid)

CTA extension block
Extension version: 3
24 bytes of CTA data
  Video data block
    VIC  16 1920x1080@60Hz 16:9 (native) HorFreq: 67500 Hz Clock: 148.500 MHz
    VIC  63 1920x1080@120Hz 16:9  HorFreq: 135000 Hz Clock: 297.000 MHz
    VIC  31 1920x1080@50Hz 16:9  HorFreq: 56250 Hz Clock: 148.500 MHz
    VIC   4 1280x720@60Hz 16:9  HorFreq: 45000 Hz Clock: 74.250 MHz
    VIC  19 1280x720@50Hz 16:9  HorFreq: 37500 Hz Clock: 74.250 MHz
    VIC   3 720x480@60Hz 16:9  HorFreq: 31469 Hz Clock: 27.000 MHz
    VIC  18 720x576@50Hz 16:9  HorFreq: 31250 Hz Clock: 27.000 MHz
  Audio data block
    Linear PCM, max channels 2
      Supported sample rates (kHz): 48 44.1 32
      Supported sample sizes (bits): 24 20 16
  Speaker allocation data block
    Speaker map:
      FL/FR - Front Left/Right
  Vendor-specific data block, OUI 000c03 (HDMI)
    Source physical address 1.0.0.0
    Supports_AI
    DC_36bit
    DC_30bit
    DC_Y444
    Maximum TMDS clock: 340MHz
Underscans PC formats by default
Basic audio support
Supports YCbCr 4:4:4
Supports YCbCr 4:2:2
1 native detailed modes
Detailed mode: Clock 297.000 MHz, 527 mm x 296 mm
               1920 2008 2052 2200 hborder 0
               1080 1084 1089 1125 vborder 0
               +hsync +vsync 
               VertFreq: 120 Hz, HorFreq: 135000 Hz
Detailed mode: Clock 148.500 MHz, 527 mm x 296 mm
               1920 2008 2052 2200 hborder 0
               1080 1084 1089 1125 vborder 0
               +hsync +vsync 
               VertFreq: 60 Hz, HorFreq: 67500 Hz
Checksum: 0xbf (valid)

EDID block does not conform at all!
	Both the serial number and the serial string are set
