
EDID (hex):
00ffffffffffff005a632c6d01010101
221701031a0000780aace9a05b569225
114f5dbfef809500904081fc617c6159
457c45590101023a801871382d40582c
450000000000001e000000ff00544259
3133333430313336350a000000fd0030
781e6411000a202020202020000000fc
00504a443738323048440a202020003b

Extracted contents:
header:          00 ff ff ff ff ff ff 00
serial number:   5a 63 2c 6d 01 01 01 01 22 17
version:         01 03
basic params:    1a 00 00 78 0a
chroma info:     ac e9 a0 5b 56 92 25 11 4f 5d
established:     bf ef 80
standard:        95 00 90 40 81 fc 61 7c 61 59 45 7c 45 59 01 01
descriptor 1:    02 3a 80 18 71 38 2d 40 58 2c 45 00 00 00 00 00 00 1e
descriptor 2:    00 00 00 ff 00 54 42 59 31 33 33 34 30 31 33 36 35 0a
descriptor 3:    00 00 00 fd 00 30 78 1e 64 11 00 0a 20 20 20 20 20 20
descriptor 4:    00 00 00 fc 00 50 4a 44 37 38 32 30 48 44 0a 20 20 20
extensions:      00
checksum:        3b

EDID version: 1.3
Manufacturer: VSC Model 6d2c Serial Number --
Made in week 34 of 2013
Analog display, Input voltage level: 0.7/0.3 V
Configurable signal levels
Sync: Separate SyncOnGreen 
Image size is variable
Gamma: 2.20
RGB color display
First detailed timing is preferred timing
Display x,y Chromaticity:
  Red:   0.6269, 0.3574
  Green: 0.3388, 0.5703
  Blue:  0.1474, 0.0683
  White: 0.3105, 0.3642
Established timings supported:
  720x400@70Hz 9:5 HorFreq: 31469 Hz Clock: 28.320 MHz
  640x480@60Hz 4:3 HorFreq: 31469 Hz Clock: 25.175 MHz
  640x480@67Hz 4:3 HorFreq: 35000 Hz Clock: 30.240 MHz
  640x480@72Hz 4:3 HorFreq: 37900 Hz Clock: 31.500 MHz
  640x480@75Hz 4:3 HorFreq: 37500 Hz Clock: 31.500 MHz
  800x600@56Hz 4:3 HorFreq: 35200 Hz Clock: 36.000 MHz
  800x600@60Hz 4:3 HorFreq: 37900 Hz Clock: 40.000 MHz
  800x600@72Hz 4:3 HorFreq: 48100 Hz Clock: 50.000 MHz
  800x600@75Hz 4:3 HorFreq: 46900 Hz Clock: 49.500 MHz
  832x624@75Hz 4:3 HorFreq: 49726 Hz Clock: 57.284 MHz
  1024x768@60Hz 4:3 HorFreq: 48400 Hz Clock: 65.000 MHz
  1024x768@70Hz 4:3 HorFreq: 56500 Hz Clock: 75.000 MHz
  1024x768@75Hz 4:3 HorFreq: 60000 Hz Clock: 78.750 MHz
  1280x1024@75Hz 5:4 HorFreq: 80000 Hz Clock: 135.000 MHz
  1152x870@75Hz 192:145 HorFreq: 67500 Hz Clock: 108.000 MHz
Standard timings supported:
  1440x900@60Hz 16:10 HorFreq: 55500 Hz Clock: 88.750 MHz
  1400x1050@60Hz 4:3 HorFreq: 64700 Hz Clock: 101.000 MHz
  1280x720@120Hz 16:9
  1024x768@120Hz 4:3
  1024x768@85Hz 4:3 HorFreq: 68700 Hz Clock: 94.500 MHz
  800x600@120Hz 4:3
  800x600@85Hz 4:3 HorFreq: 53700 Hz Clock: 56.250 MHz
Detailed mode: Clock 148.500 MHz, 0 mm x 0 mm
               1920 2008 2052 2200 hborder 0
               1080 1084 1089 1125 vborder 0
               +hsync +vsync 
               VertFreq: 60 Hz, HorFreq: 67500 Hz
Serial number: --
Monitor ranges (GTF): 48-120Hz V, 30-100kHz H, max dotclock 170MHz
Monitor name: PJD7820HD
Checksum: 0x3b (valid)
