
EDID (hex):
00ffffffffffff000daf011500000000
280c0103801e17780a77f1a05a4b9624
184f5400080001010101010101010101
01010101010164190040410026301888
360030e410000018000000fe004e3135
30583320202020202020000000fe004e
313530583320202020202020000000fc
00436f6c6f72204c43440a2020200033

Extracted contents:
header:          00 ff ff ff ff ff ff 00
serial number:   0d af 01 15 00 00 00 00 28 0c
version:         01 03
basic params:    80 1e 17 78 0a
chroma info:     77 f1 a0 5a 4b 96 24 18 4f 54
established:     00 08 00
standard:        01 01 01 01 01 01 01 01 01 01 01 01 01 01 01 01
descriptor 1:    64 19 00 40 41 00 26 30 18 88 36 00 30 e4 10 00 00 18
descriptor 2:    00 00 00 fe 00 4e 31 35 30 58 33 20 20 20 20 20 20 20
descriptor 3:    00 00 00 fe 00 4e 31 35 30 58 33 20 20 20 20 20 20 20
descriptor 4:    00 00 00 fc 00 43 6f 6c 6f 72 20 4c 43 44 0a 20 20 20
extensions:      00
checksum:        33

EDID version: 1.3
Manufacturer: CMO Model 1501 Serial Number --
Digital display
Maximum image size: 30 cm x 23 cm
Gamma: 2.20
RGB color display
First detailed timing is preferred timing
Display x,y Chromaticity:
  Red:   0.6259, 0.3544
  Green: 0.2939, 0.5888
  Blue:  0.1435, 0.0966
  White: 0.3085, 0.3291
Established timings supported:
  1024x768@60Hz 4:3 HorFreq: 48400 Hz Clock: 65.000 MHz
Standard timings supported:
Detailed mode: Clock 65.000 MHz, 304 mm x 228 mm
               1024 1048 1184 1344 hborder 0
                768  771  777  806 vborder 0
               -hsync -vsync 
               VertFreq: 60 Hz, HorFreq: 48363 Hz
ASCII string: N150X3       
ASCII string: N150X3       
Monitor name: Color LCD
Checksum: 0x33 (valid)
EDID block does NOT conform to EDID 1.3!
	Missing monitor ranges
EDID block does not conform at all!
	Bad year of manufacture
