
EDID (hex):
00ffffffffffff0005e30124a7bf0100
201d0103803420782a6d75a7564ea025
0d5054bfef00d1c0b300950081808140
81c001010101283c80a070b023403020
360006442100001a000000ff00474d42
4b384841313134353939000000fc0032
345031580a20202020202020000000fd
00324c1e5311000a202020202020008e

Extracted contents:
header:          00 ff ff ff ff ff ff 00
serial number:   05 e3 01 24 a7 bf 01 00 20 1d
version:         01 03
basic params:    80 34 20 78 2a
chroma info:     6d 75 a7 56 4e a0 25 0d 50 54
established:     bf ef 00
standard:        d1 c0 b3 00 95 00 81 80 81 40 81 c0 01 01 01 01
descriptor 1:    28 3c 80 a0 70 b0 23 40 30 20 36 00 06 44 21 00 00 1a
descriptor 2:    00 00 00 ff 00 47 4d 42 4b 38 48 41 31 31 34 35 39 39
descriptor 3:    00 00 00 fc 00 32 34 50 31 58 0a 20 20 20 20 20 20 20
descriptor 4:    00 00 00 fd 00 32 4c 1e 53 11 00 0a 20 20 20 20 20 20
extensions:      00
checksum:        8e

EDID version: 1.3
Manufacturer: AOC Model 2401 Serial Number --
Made in week 32 of 2019
Digital display
Maximum image size: 52 cm x 32 cm
Gamma: 2.20
DPMS levels: Off
RGB color display
First detailed timing is preferred timing
Display x,y Chromaticity:
  Red:   0.6533, 0.3378
  Green: 0.3076, 0.6259
  Blue:  0.1455, 0.0537
  White: 0.3134, 0.3291
Established timings supported:
  720x400@70Hz 9:5 HorFreq: 31469 Hz Clock: 28.320 MHz
  640x480@60Hz 4:3 HorFreq: 31469 Hz Clock: 25.175 MHz
  640x480@67Hz 4:3 HorFreq: 35000 Hz Clock: 30.240 MHz
  640x480@72Hz 4:3 HorFreq: 37900 Hz Clock: 31.500 MHz
  640x480@75Hz 4:3 HorFreq: 37500 Hz Clock: 31.500 MHz
  800x600@56Hz 4:3 HorFreq: 35200 Hz Clock: 36.000 MHz
  800x600@60Hz 4:3 HorFreq: 37900 Hz Clock: 40.000 MHz
  800x600@72Hz 4:3 HorFreq: 48100 Hz Clock: 50.000 MHz
  800x600@75Hz 4:3 HorFreq: 46900 Hz Clock: 49.500 MHz
  832x624@75Hz 4:3 HorFreq: 49726 Hz Clock: 57.284 MHz
  1024x768@60Hz 4:3 HorFreq: 48400 Hz Clock: 65.000 MHz
  1024x768@70Hz 4:3 HorFreq: 56500 Hz Clock: 75.000 MHz
  1024x768@75Hz 4:3 HorFreq: 60000 Hz Clock: 78.750 MHz
  1280x1024@75Hz 5:4 HorFreq: 80000 Hz Clock: 135.000 MHz
Standard timings supported:
  1920x1080@60Hz 16:9
  1680x1050@60Hz 16:10 HorFreq: 64700 Hz Clock: 119.000 MHz
  1440x900@60Hz 16:10 HorFreq: 55500 Hz Clock: 88.750 MHz
  1280x1024@60Hz 5:4 HorFreq: 64000 Hz Clock: 108.000 MHz
  1280x960@60Hz 4:3 HorFreq: 60000 Hz Clock: 108.000 MHz
  1280x720@60Hz 16:9
Detailed mode: Clock 154.000 MHz, 518 mm x 324 mm
               1920 1968 2000 2080 hborder 0
               1200 1203 1209 1235 vborder 0
               +hsync -vsync 
               VertFreq: 59 Hz, HorFreq: 74038 Hz
Serial number: --
Monitor name: 24P1X
Monitor ranges (GTF): 50-76Hz V, 30-83kHz H, max dotclock 170MHz
Checksum: 0x8e (valid)
