
EDID (hex):
00ffffffffffff0010ac17a053474d31
2710010380342178eeee91a3544c9926
0f5054a54b008180a940714fb3000101
010101010101283c80a070b023403020
360007442100001a000000ff00434333
3032363953314d475320000000fc0044
454c4c20323430375746500a000000fd
00384c1e5311000a2020202020200087

Extracted contents:
header:          00 ff ff ff ff ff ff 00
serial number:   10 ac 17 a0 53 47 4d 31 27 10
version:         01 03
basic params:    80 34 21 78 ee
chroma info:     ee 91 a3 54 4c 99 26 0f 50 54
established:     a5 4b 00
standard:        81 80 a9 40 71 4f b3 00 01 01 01 01 01 01 01 01
descriptor 1:    28 3c 80 a0 70 b0 23 40 30 20 36 00 07 44 21 00 00 1a
descriptor 2:    00 00 00 ff 00 43 43 33 30 32 36 39 53 31 4d 47 53 20
descriptor 3:    00 00 00 fc 00 44 45 4c 4c 20 32 34 30 37 57 46 50 0a
descriptor 4:    00 00 00 fd 00 38 4c 1e 53 11 00 0a 20 20 20 20 20 20
extensions:      00
checksum:        87

EDID version: 1.3
Manufacturer: DEL Model a017 Serial Number --
Made in week 39 of 2006
Digital display
Maximum image size: 52 cm x 33 cm
Gamma: 2.20
DPMS levels: Standby Suspend Off
RGB color display
Default (sRGB) color space is primary color space
First detailed timing is preferred timing
Display x,y Chromaticity:
  Red:   0.6396, 0.3300
  Green: 0.2998, 0.5996
  Blue:  0.1503, 0.0595
  White: 0.3125, 0.3291
Established timings supported:
  720x400@70Hz 9:5 HorFreq: 31469 Hz Clock: 28.320 MHz
  640x480@60Hz 4:3 HorFreq: 31469 Hz Clock: 25.175 MHz
  640x480@75Hz 4:3 HorFreq: 37500 Hz Clock: 31.500 MHz
  800x600@60Hz 4:3 HorFreq: 37900 Hz Clock: 40.000 MHz
  800x600@75Hz 4:3 HorFreq: 46900 Hz Clock: 49.500 MHz
  1024x768@60Hz 4:3 HorFreq: 48400 Hz Clock: 65.000 MHz
  1024x768@75Hz 4:3 HorFreq: 60000 Hz Clock: 78.750 MHz
  1280x1024@75Hz 5:4 HorFreq: 80000 Hz Clock: 135.000 MHz
Standard timings supported:
  1280x1024@60Hz 5:4 HorFreq: 64000 Hz Clock: 108.000 MHz
  1600x1200@60Hz 4:3 HorFreq: 75000 Hz Clock: 162.000 MHz
  1152x864@75Hz 4:3 HorFreq: 67500 Hz Clock: 108.000 MHz
  1680x1050@60Hz 16:10 HorFreq: 64700 Hz Clock: 119.000 MHz
Detailed mode: Clock 154.000 MHz, 519 mm x 324 mm
               1920 1968 2000 2080 hborder 0
               1200 1203 1209 1235 vborder 0
               +hsync -vsync 
               VertFreq: 59 Hz, HorFreq: 74038 Hz
Serial number: -- 
Monitor name: DELL 2407WFP
Monitor ranges (GTF): 56-76Hz V, 30-83kHz H, max dotclock 170MHz
Checksum: 0x87 (valid)
