
EDID (hex):
00ffffffffffff0006af9a4900000000
001f0104a51e13780344c5a85547a124
0e505400000001010101010101010101
010101010101006900a0a0402e603020
35002dbc1000001a005400a0a0402e60
302035002dbc1000001a000000fe0058
37463757804231343051414e00000000
00024101b2011100000a010a20200126
02030f00e3058000e60605016b6b4100
00000000000000000000000000000000
00000000000000000000000000000000
00000000000000000000000000000000
00000000000000000000000000000000
00000000000000000000000000000000
00000000000000000000000000000000
0000000000000000000000000000007b

Extracted contents:
header:          00 ff ff ff ff ff ff 00
serial number:   06 af 9a 49 00 00 00 00 00 1f
version:         01 04
basic params:    a5 1e 13 78 03
chroma info:     44 c5 a8 55 47 a1 24 0e 50 54
established:     00 00 00
standard:        01 01 01 01 01 01 01 01 01 01 01 01 01 01 01 01
descriptor 1:    00 69 00 a0 a0 40 2e 60 30 20 35 00 2d bc 10 00 00 1a
descriptor 2:    00 54 00 a0 a0 40 2e 60 30 20 35 00 2d bc 10 00 00 1a
descriptor 3:    00 00 00 fe 00 58 37 46 37 57 80 42 31 34 30 51 41 4e
descriptor 4:    00 00 00 00 00 02 41 01 b2 01 11 00 00 0a 01 0a 20 20
extensions:      01
checksum:        26

EDID version: 1.4
Manufacturer: AUO Model 499a Serial Number --
Made in year 2021
Digital display
8 bits per primary color channel
DisplayPort interface
Maximum image size: 30 cm x 19 cm
Gamma: 2.20
Supported color formats: RGB 4:4:4
First detailed timing includes the native pixel format and preferred refresh rate
Display is continuous frequency
Display x,y Chromaticity:
  Red:   0.6572, 0.3320
  Green: 0.2783, 0.6289
  Blue:  0.1435, 0.0546
  White: 0.3134, 0.3291
Established timings supported:
Standard timings supported:
Detailed mode: Clock 268.800 MHz, 301 mm x 188 mm
               2560 2608 2640 2720 hborder 0
               1600 1603 1608 1646 vborder 0
               +hsync -vsync 
               VertFreq: 60 Hz, HorFreq: 98823 Hz
Detailed mode: Clock 215.040 MHz, 301 mm x 188 mm
               2560 2608 2640 2720 hborder 0
               1600 1603 1608 1646 vborder 0
               +hsync -vsync 
               VertFreq: 48 Hz, HorFreq: 79058 Hz
ASCII string: X7F7W
Manufacturer-specified data, tag 0
Has 1 extension blocks
Checksum: 0x26 (valid)

CTA extension block
Extension version: 3
11 bytes of CTA data
  Extended tag: Colorimetry data block
    BT2020RGB
  Extended tag: HDR static metadata data block
    Electro optical transfer functions:
      Traditional gamma - SDR luminance range
      SMPTE ST2084
    Supported static metadata descriptors:
      Static metadata type 1
    Desired content max luminance: 107 (507.620 cd/m^2)
    Desired content max frame-average luminance: 107 (507.620 cd/m^2)
    Desired content min luminance: 65 (0.330 cd/m^2)
0 native detailed modes
Checksum: 0x7b (valid)

EDID block does NOT conform to EDID 1.4!
	Required 640x480p60 timings are missing in the established timings
	and/or in the SVD list (VIC 1)
	Missing name descriptor
	Missing monitor ranges
	Detailed block string not properly terminated
