edid-decode (hex):

00 ff ff ff ff ff ff 00 22 f0 47 28 01 01 01 01
16 15 01 03 68 2f 1e 78 ee 36 c5 a4 55 4c 9c 25
12 50 54 a1 08 00 81 40 81 80 95 00 a9 40 b3 00
01 01 01 01 01 01 21 39 90 30 62 1a 27 40 68 b0
36 00 d9 28 11 00 00 1c 00 00 00 fd 00 32 4c 18
53 11 00 0a 20 20 20 20 20 20 00 00 00 fc 00 4c
41 32 32 30 35 0a 20 20 20 20 20 20 00 00 00 ff
00 33 43 51 31 32 32 51 38 4a 32 0a 20 20 00 de

00 ff ff ff ff ff ff 00 22 f0 47 28 01 01 01 01
16 15 01 03 68 2f 1e 78 ee 36 c5 a4 55 4c 9c 25
12 50 54 a1 08 00 81 40 81 80 95 00 a9 40 b3 00
01 01 01 01 01 01 21 39 90 30 62 1a 27 40 68 b0
36 00 d9 28 11 00 00 1c 00 00 00 fd 00 32 4c 18
53 11 00 0a 20 20 20 20 20 20 00 00 00 fc 00 4c
41 32 32 30 35 0a 20 20 20 20 20 20 00 00 00 ff
00 33 43 51 31 32 32 51 38 4a 32 0a 20 20 00 de

----------------

Block 0, Base EDID:
  EDID Structure Version & Revision: 1.3
  Vendor & Product Identification:
    Manufacturer: HWP
    Model: 10311
    Serial Number: ...
    Made in: week 22 of 2011
  Basic Display Parameters & Features:
    Analog display
    Signal Level Standard: 0.700 : 0.000 : 0.700 V p-p
    Blank level equals black level
    Sync: Separate
    Maximum image size: 47 cm x 30 cm
    Gamma: 2.20
    DPMS levels: Standby Suspend Off
    RGB color display
    Default (sRGB) color space is primary color space
    First detailed timing is the preferred timing
  Color Characteristics:
    Red  : 0.6406, 0.3349
    Green: 0.2978, 0.6113
    Blue : 0.1474, 0.0703
    White: 0.3134, 0.3291
  Established Timings I & II:
    IBM     :   720x400    70.081663 Hz   9:5     31.467 kHz     28.320000 MHz
    DMT 0x04:   640x480    59.940476 Hz   4:3     31.469 kHz     25.175000 MHz
    DMT 0x09:   800x600    60.316541 Hz   4:3     37.879 kHz     40.000000 MHz
    DMT 0x10:  1024x768    60.003840 Hz   4:3     48.363 kHz     65.000000 MHz
  Standard Timings:
    DMT 0x20:  1280x960    60.000000 Hz   4:3     60.000 kHz    108.000000 MHz
    DMT 0x23:  1280x1024   60.019740 Hz   5:4     63.981 kHz    108.000000 MHz
    DMT 0x2f:  1440x900    59.887445 Hz  16:10    55.935 kHz    106.500000 MHz
    DMT 0x33:  1600x1200   60.000000 Hz   4:3     75.000 kHz    162.000000 MHz
    DMT 0x3a:  1680x1050   59.954250 Hz  16:10    65.290 kHz    146.250000 MHz
  Detailed Timing Descriptors:
    DTD 1:  1680x1050   59.954250 Hz  16:10    65.290 kHz    146.250000 MHz (473 mm x 296 mm)
                 Hfront  104 Hsync 176 Hback  280 Hpol N
                 Vfront    3 Vsync   6 Vback   30 Vpol P
    Display Range Limits:
      Monitor ranges (GTF): 50-76 Hz V, 24-83 kHz H, max dotclock 170 MHz
    Display Product Name: 'LA2205'
    Display Product Serial Number: ...
Checksum: 0xde

----------------

Block 1, Unknown EDID Extension Block 0x00:
  00 ff ff ff ff ff ff 00 22 f0 47 28 01 01 01 01 '........".G(....'
  16 15 01 03 68 2f 1e 78 ee 36 c5 a4 55 4c 9c 25 '....h/.x.6..UL.%'
  12 50 54 a1 08 00 81 40 81 80 95 00 a9 40 b3 00 '.PT....@.....@..'
  01 01 01 01 01 01 21 39 90 30 62 1a 27 40 68 b0 '......!9.0b.'@h.'
  36 00 d9 28 11 00 00 1c 00 00 00 fd 00 32 4c 18 '6..(.........2L.'
  53 11 00 0a 20 20 20 20 20 20 00 00 00 fc 00 4c 'S...      .....L'
  41 32 32 30 35 0a 20 20 20 20 20 20 00 00 00 ff 'A2205.      ....'
  00 33 43 51 31 32 32 51 38 4a 32 0a 20 20 00 de '.3CQ122Q8J2.  ..'
Checksum: 0xde

----------------

Failures:

Block 0, Base EDID:
  Basic Display Parameters & Features: sRGB is signaled, but the chromaticities do not match.
Block 1, Base EDID:
  Unknown Extension Block.
EDID:
  Base EDID: EDID specified 0 extension block(s), but found 1 extension block(s).

EDID conformity: FAIL
