
EDID (hex):
00ffffffffffff0006b3a62501010101
021f0104a5361e783b0875a6574ea326
0c5054b7ef00714f8180814081c08100
9500b3000101023a801871382d40582c
4500202f2100001e000000fd003090a2
a222010a202020202020000000fc0056
473235390a20202020202020000000ff
004d314c4d51533032393439370a01e1
02031ff14f900504030201111213141f
0e0f1d1e2309070783010000e2006a66
2156aa51001e30468f3300202f210000
1e8a4d80a070382c4030203500202f21
00001afe5b80a0703835403020350020
2f2100001a866f80a070384040302035
00202f2100001a0a8380a070382b4030
203500202f2100001a0000000000009c

edid-decode (hex):

00 ff ff ff ff ff ff 00 06 b3 a6 25 01 01 01 01
02 1f 01 04 a5 36 1e 78 3b 08 75 a6 57 4e a3 26
0c 50 54 b7 ef 00 71 4f 81 80 81 40 81 c0 81 00
95 00 b3 00 01 01 02 3a 80 18 71 38 2d 40 58 2c
45 00 20 2f 21 00 00 1e 00 00 00 fd 00 30 90 a2
a2 22 01 0a 20 20 20 20 20 20 00 00 00 fc 00 56
47 32 35 39 0a 20 20 20 20 20 20 20 00 00 00 ff
00 4d 31 4c 4d 51 53 30 32 39 34 39 37 0a 01 e1

02 03 1f f1 4f 90 05 04 03 02 01 11 12 13 14 1f
0e 0f 1d 1e 23 09 07 07 83 01 00 00 e2 00 6a 66
21 56 aa 51 00 1e 30 46 8f 33 00 20 2f 21 00 00
1e 8a 4d 80 a0 70 38 2c 40 30 20 35 00 20 2f 21
00 00 1a fe 5b 80 a0 70 38 35 40 30 20 35 00 20
2f 21 00 00 1a 86 6f 80 a0 70 38 40 40 30 20 35
00 20 2f 21 00 00 1a 0a 83 80 a0 70 38 2b 40 30
20 35 00 20 2f 21 00 00 1a 00 00 00 00 00 00 9c

----------------

Block 0, Base EDID:
  EDID Structure Version & Revision: 1.4
  Vendor & Product Identification:
    Manufacturer: AUS
    Model: 9638
    Serial Number: 16843009
    Made in: week 2 of 2021
  Basic Display Parameters & Features:
    Digital display
    Bits per primary color channel: 8
    DisplayPort interface
    Maximum image size: 54 cm x 30 cm
    Gamma: 2.20
    DPMS levels: Off
    Supported color formats: RGB 4:4:4, YCrCb 4:4:4, YCrCb 4:2:2
    First detailed timing includes the native pixel format and preferred refresh rate
    Display is continuous frequency
  Color Characteristics:
    Red  : 0.6484, 0.3398
    Green: 0.3066, 0.6367
    Blue : 0.1494, 0.0498
    White: 0.3134, 0.3291
  Established Timings I & II:
    IBM     :   720x400    70.081663 Hz   9:5     31.467 kHz     28.320000 MHz
    DMT 0x04:   640x480    59.940476 Hz   4:3     31.469 kHz     25.175000 MHz
    Apple   :   640x480    66.666667 Hz   4:3     35.000 kHz     30.240000 MHz
    DMT 0x06:   640x480    75.000000 Hz   4:3     37.500 kHz     31.500000 MHz
    DMT 0x08:   800x600    56.250000 Hz   4:3     35.156 kHz     36.000000 MHz
    DMT 0x09:   800x600    60.316541 Hz   4:3     37.879 kHz     40.000000 MHz
    DMT 0x0a:   800x600    72.187572 Hz   4:3     48.077 kHz     50.000000 MHz
    DMT 0x0b:   800x600    75.000000 Hz   4:3     46.875 kHz     49.500000 MHz
    Apple   :   832x624    74.551266 Hz   4:3     49.726 kHz     57.284000 MHz
    DMT 0x10:  1024x768    60.003840 Hz   4:3     48.363 kHz     65.000000 MHz
    DMT 0x11:  1024x768    70.069359 Hz   4:3     56.476 kHz     75.000000 MHz
    DMT 0x12:  1024x768    75.028582 Hz   4:3     60.023 kHz     78.750000 MHz
    DMT 0x24:  1280x1024   75.024675 Hz   5:4     79.976 kHz    135.000000 MHz
  Standard Timings:
    DMT 0x15:  1152x864    75.000000 Hz   4:3     67.500 kHz    108.000000 MHz
    DMT 0x23:  1280x1024   60.019740 Hz   5:4     63.981 kHz    108.000000 MHz
    DMT 0x20:  1280x960    60.000000 Hz   4:3     60.000 kHz    108.000000 MHz
    DMT 0x55:  1280x720    60.000000 Hz  16:9     45.000 kHz     74.250000 MHz
    DMT 0x1c:  1280x800    59.810326 Hz  16:10    49.702 kHz     83.500000 MHz
    DMT 0x2f:  1440x900    59.887445 Hz  16:10    55.935 kHz    106.500000 MHz
    DMT 0x3a:  1680x1050   59.954250 Hz  16:10    65.290 kHz    146.250000 MHz
  Detailed Timing Descriptors:
    DTD 1:  1920x1080   60.000000 Hz  16:9     67.500 kHz    148.500000 MHz (544 mm x 303 mm)
                 Hfront   88 Hsync  44 Hback  148 Hpol P
                 Vfront    4 Vsync   5 Vback   36 Vpol P
    Display Range Limits:
      Monitor ranges (Bare Limits): 48-144 Hz V, 162-162 kHz H, max dotclock 340 MHz
    Display Product Name: 'VG259'
    Display Product Serial Number: 'M1LMQS029497'
  Extension blocks: 1
Checksum: 0xe1

----------------

Block 1, CTA-861 Extension Block:
  Revision: 3
  Underscans IT Video Formats by default
  Basic audio support
  Supports YCbCr 4:4:4
  Supports YCbCr 4:2:2
  Native detailed modes: 1
  Video Data Block:
    VIC  16:  1920x1080   60.000000 Hz  16:9     67.500 kHz    148.500000 MHz (native)
    VIC   5:  1920x1080i  60.000000 Hz  16:9     33.750 kHz     74.250000 MHz
    VIC   4:  1280x720    60.000000 Hz  16:9     45.000 kHz     74.250000 MHz
    VIC   3:   720x480    59.940060 Hz  16:9     31.469 kHz     27.000000 MHz
    VIC   2:   720x480    59.940060 Hz   4:3     31.469 kHz     27.000000 MHz
    VIC   1:   640x480    59.940476 Hz   4:3     31.469 kHz     25.175000 MHz
    VIC  17:   720x576    50.000000 Hz   4:3     31.250 kHz     27.000000 MHz
    VIC  18:   720x576    50.000000 Hz  16:9     31.250 kHz     27.000000 MHz
    VIC  19:  1280x720    50.000000 Hz  16:9     37.500 kHz     74.250000 MHz
    VIC  20:  1920x1080i  50.000000 Hz  16:9     28.125 kHz     74.250000 MHz
    VIC  31:  1920x1080   50.000000 Hz  16:9     56.250 kHz    148.500000 MHz
    VIC  14:  1440x480    59.940060 Hz   4:3     31.469 kHz     54.000000 MHz
    VIC  15:  1440x480    59.940060 Hz  16:9     31.469 kHz     54.000000 MHz
    VIC  29:  1440x576    50.000000 Hz   4:3     31.250 kHz     54.000000 MHz
    VIC  30:  1440x576    50.000000 Hz  16:9     31.250 kHz     54.000000 MHz
  Audio Data Block:
    Linear PCM:
      Max channels: 2
      Supported sample rates (kHz): 48 44.1 32
      Supported sample sizes (bits): 24 20 16
  Speaker Allocation Data Block:
    FL/FR - Front Left/Right
  Video Capability Data Block:
    YCbCr quantization: No Data
    RGB quantization: Selectable (via AVI Q)
    PT scan behavior: Always Underscanned
    IT scan behavior: Always Underscanned
    CE scan behavior: Always Underscanned
  Detailed Timing Descriptors:
    DTD 2:  1366x768    59.789541 Hz 683:384   47.712 kHz     85.500000 MHz (544 mm x 303 mm)
                 Hfront   70 Hsync 143 Hback  213 Hpol P
                 Vfront    3 Vsync   3 Vback   24 Vpol P
    DTD 3:  1920x1080   84.904531 Hz  16:9     95.433 kHz    198.500000 MHz (544 mm x 303 mm)
                 Hfront   48 Hsync  32 Hback   80 Hpol P
                 Vfront    3 Vsync   5 Vback   36 Vpol N
    DTD 4:  1920x1080   99.930409 Hz  16:9    113.221 kHz    235.500000 MHz (544 mm x 303 mm)
                 Hfront   48 Hsync  32 Hback   80 Hpol P
                 Vfront    3 Vsync   5 Vback   45 Vpol N
    DTD 5:  1920x1080  119.982181 Hz  16:9    137.260 kHz    285.500000 MHz (544 mm x 303 mm)
                 Hfront   48 Hsync  32 Hback   80 Hpol P
                 Vfront    3 Vsync   5 Vback   56 Vpol N
    DTD 6:  1920x1080  143.614289 Hz  16:9    161.279 kHz    335.460000 MHz (544 mm x 303 mm)
                 Hfront   48 Hsync  32 Hback   80 Hpol P
                 Vfront    3 Vsync   5 Vback   35 Vpol N
Checksum: 0x9c  Unused space in Extension Block: 6 bytes


