
EDID (hex):
00ffffffffffff0006af2d5c00000000
141c0104a51d117802ee95a3544c9926
0f505400000001010101010101010101
010101010101b43780a070383e403a2a
350025a510000018b43780a070385c41
3a2a350025a510000018000000fe0041
554f0a202020202020202020000000fe
004231333348414e30352e43200a00ac

Extracted contents:
header:          00 ff ff ff ff ff ff 00
serial number:   06 af 2d 5c 00 00 00 00 14 1c
version:         01 04
basic params:    a5 1d 11 78 02
chroma info:     ee 95 a3 54 4c 99 26 0f 50 54
established:     00 00 00
standard:        01 01 01 01 01 01 01 01 01 01 01 01 01 01 01 01
descriptor 1:    b4 37 80 a0 70 38 3e 40 3a 2a 35 00 25 a5 10 00 00 18
descriptor 2:    b4 37 80 a0 70 38 5c 41 3a 2a 35 00 25 a5 10 00 00 18
descriptor 3:    00 00 00 fe 00 41 55 4f 0a 20 20 20 20 20 20 20 20 20
descriptor 4:    00 00 00 fe 00 42 31 33 33 48 41 4e 30 35 2e 43 20 0a
extensions:      00
checksum:        ac

EDID version: 1.4
Manufacturer: AUO Model 5c2d Serial Number --
Made in week 20 of 2018
Digital display
8 bits per primary color channel
DisplayPort interface
Maximum image size: 29 cm x 17 cm
Gamma: 2.20
Supported color formats: RGB 4:4:4
First detailed timing includes the native pixel format and preferred refresh rate
Display x,y Chromaticity:
  Red:   0.6396, 0.3300
  Green: 0.2998, 0.5996
  Blue:  0.1503, 0.0595
  White: 0.3134, 0.3291
Established timings supported:
Standard timings supported:
Detailed mode: Clock 142.600 MHz, 293 mm x 165 mm
               1920 1978 2020 2080 hborder 0
               1080 1083 1088 1142 vborder 0
               -hsync -vsync 
               VertFreq: 60 Hz, HorFreq: 68557 Hz
Detailed mode: Clock 142.600 MHz, 293 mm x 165 mm
               1920 1978 2020 2080 hborder 0
               1080 1083 1088 1428 vborder 0
               -hsync -vsync 
               VertFreq: 48 Hz, HorFreq: 68557 Hz
ASCII string: AUO
ASCII string: B133HAN05.C 
Checksum: 0xac (valid)
EDID block does NOT conform to EDID 1.4!
	Missing name descriptor
	Missing monitor ranges


