edid-decode (hex):

00 ff ff ff ff ff ff 00 22 f0 22 32 01 01 01 01
27 1c 01 03 68 35 1e 78 2e 3b 85 a5 54 50 9d 26
9a 50 54 a1 08 00 d1 c0 81 c0 a9 c0 95 00 b3 00
81 00 81 80 01 01 02 3a 80 18 71 38 2d 40 58 2c
45 00 13 2b 21 00 00 1e 00 00 00 fd 00 32 4c 18
50 11 00 0a 20 20 20 20 20 20 00 00 00 fc 00 48
50 20 32 34 75 68 0a 20 20 20 20 20 00 00 00 ff
00 43 4e 4b 38 33 39 30 51 43 34 0a 20 20 00 ea

00 ff ff ff ff ff ff 00 22 f0 22 32 01 01 01 01
27 1c 01 03 68 35 1e 78 2e 3b 85 a5 54 50 9d 26
9a 50 54 a1 08 00 d1 c0 81 c0 a9 c0 95 00 b3 00
81 00 81 80 01 01 02 3a 80 18 71 38 2d 40 58 2c
45 00 13 2b 21 00 00 1e 00 00 00 fd 00 32 4c 18
50 11 00 0a 20 20 20 20 20 20 00 00 00 fc 00 48
50 20 32 34 75 68 0a 20 20 20 20 20 00 00 00 ff
00 43 4e 4b 38 33 39 30 51 43 34 0a 20 20 00 ea

----------------

Block 0, Base EDID:
  EDID Structure Version & Revision: 1.3
  Vendor & Product Identification:
    Manufacturer: HWP
    Model: 12834
    Serial Number: ...
    Made in: week 39 of 2018
  Basic Display Parameters & Features:
    Analog display
    Signal Level Standard: 0.700 : 0.000 : 0.700 V p-p
    Blank level equals black level
    Sync: Separate
    Maximum image size: 53 cm x 30 cm
    Gamma: 2.20
    DPMS levels: Off
    RGB color display
    Default (sRGB) color space is primary color space
    First detailed timing is the preferred timing
  Color Characteristics:
    Red  : 0.6445, 0.3310
    Green: 0.3144, 0.6162
    Blue : 0.1503, 0.6015
    White: 0.3134, 0.3291
  Established Timings I & II:
    IBM     :   720x400    70.081663 Hz   9:5     31.467 kHz     28.320000 MHz
    DMT 0x04:   640x480    59.940476 Hz   4:3     31.469 kHz     25.175000 MHz
    DMT 0x09:   800x600    60.316541 Hz   4:3     37.879 kHz     40.000000 MHz
    DMT 0x10:  1024x768    60.003840 Hz   4:3     48.363 kHz     65.000000 MHz
  Standard Timings:
    DMT 0x52:  1920x1080   60.000000 Hz  16:9     67.500 kHz    148.500000 MHz
    DMT 0x55:  1280x720    60.000000 Hz  16:9     45.000 kHz     74.250000 MHz
    DMT 0x53:  1600x900    60.000000 Hz  16:9     60.000 kHz    108.000000 MHz (RB)
    DMT 0x2f:  1440x900    59.887445 Hz  16:10    55.935 kHz    106.500000 MHz
    DMT 0x3a:  1680x1050   59.954250 Hz  16:10    65.290 kHz    146.250000 MHz
    DMT 0x1c:  1280x800    59.810326 Hz  16:10    49.702 kHz     83.500000 MHz
    DMT 0x23:  1280x1024   60.019740 Hz   5:4     63.981 kHz    108.000000 MHz
  Detailed Timing Descriptors:
    DTD 1:  1920x1080   60.000000 Hz  16:9     67.500 kHz    148.500000 MHz (531 mm x 299 mm)
                 Hfront   88 Hsync  44 Hback  148 Hpol P
                 Vfront    4 Vsync   5 Vback   36 Vpol P
    Display Range Limits:
      Monitor ranges (GTF): 50-76 Hz V, 24-80 kHz H, max dotclock 170 MHz
    Display Product Name: 'HP 24uh'
    Display Product Serial Number: ...
Checksum: 0xea

----------------

Block 1, Unknown EDID Extension Block 0x00:
  00 ff ff ff ff ff ff 00 22 f0 22 32 01 01 01 01 '........"."2....'
  27 1c 01 03 68 35 1e 78 2e 3b 85 a5 54 50 9d 26 ''...h5.x.;..TP.&'
  9a 50 54 a1 08 00 d1 c0 81 c0 a9 c0 95 00 b3 00 '.PT.............'
  81 00 81 80 01 01 02 3a 80 18 71 38 2d 40 58 2c '.......:..q8-@X,'
  45 00 13 2b 21 00 00 1e 00 00 00 fd 00 32 4c 18 'E..+!........2L.'
  50 11 00 0a 20 20 20 20 20 20 00 00 00 fc 00 48 'P...      .....H'
  50 20 32 34 75 68 0a 20 20 20 20 20 00 00 00 ff 'P 24uh.     ....'
  00 43 4e 4b 38 33 39 30 51 43 34 0a 20 20 00 ea '.CNK8390QC4.  ..'
Checksum: 0xea

----------------

Failures:

Block 0, Base EDID:
  Basic Display Parameters & Features: sRGB is signaled, but the chromaticities do not match.
Block 1, Base EDID:
  Unknown Extension Block.
EDID:
  Base EDID: EDID specified 0 extension block(s), but found 1 extension block(s).

EDID conformity: FAIL
