
EDID (hex):
00ffffffffffff000df2d81700000000
0d150103801d10780a0a959e57549126
0f505400000001010101010101010101
010101010101121b566a500011303b27
590025a510000018121b566a50001130
3b27590025a510000018000000fe0043
50540a202020202020202020000000fe
00434c414131333357423031412000fb

Extracted contents:
header:          00 ff ff ff ff ff ff 00
serial number:   0d f2 d8 17 00 00 00 00 0d 15
version:         01 03
basic params:    80 1d 10 78 0a
chroma info:     0a 95 9e 57 54 91 26 0f 50 54
established:     00 00 00
standard:        01 01 01 01 01 01 01 01 01 01 01 01 01 01 01 01
descriptor 1:    12 1b 56 6a 50 00 11 30 3b 27 59 00 25 a5 10 00 00 18
descriptor 2:    12 1b 56 6a 50 00 11 30 3b 27 59 00 25 a5 10 00 00 18
descriptor 3:    00 00 00 fe 00 43 50 54 0a 20 20 20 20 20 20 20 20 20
descriptor 4:    00 00 00 fe 00 43 4c 41 41 31 33 33 57 42 30 31 41 20
extensions:      00
checksum:        fb

EDID version: 1.3
Manufacturer: COR Model 17d8 Serial Number --
Made in week 13 of 2011
Digital display
Maximum image size: 29 cm x 16 cm
Gamma: 2.20
RGB color display
First detailed timing is preferred timing
Display x,y Chromaticity:
  Red:   0.6171, 0.3398
  Green: 0.3300, 0.5683
  Blue:  0.1503, 0.0595
  White: 0.3134, 0.3291
Established timings supported:
Standard timings supported:
Detailed mode: Clock 69.300 MHz, 293 mm x 165 mm
               1366 1425 1464 1472 hborder 0
                768  773  782  785 vborder 0
               -hsync -vsync 
               VertFreq: 59 Hz, HorFreq: 47078 Hz
Detailed mode: Clock 69.300 MHz, 293 mm x 165 mm
               1366 1425 1464 1472 hborder 0
                768  773  782  785 vborder 0
               -hsync -vsync 
               VertFreq: 59 Hz, HorFreq: 47078 Hz
ASCII string: CPT
ASCII string: CLAA133WB01A 
Checksum: 0xfb (valid)
EDID block does NOT conform to EDID 1.3!
	Missing name descriptor
	Missing monitor ranges
