
EDID (hex):
00ffffffffffff000469a328c7300200
1d1a0104b53e22783a1cb5a3574fa027
0d5054bfef00d1c0814081809500b300
714f81c001014dd000a0f0703e803020
35006d552100001aa36600a0f0701f80
302035006d552100001a000000fd001e
5018a03c041100f0f838f03c000000fc
0041535553205042323837510a2001a6
02031c714f0102031112130414051f90
0e0f1d1e2309170783010000565e00a0
a0a02950302035006d552100001ee268
00a0a0402e60302036006d552100001a
011d00bc52d01e20b82855406d552100
001e8c0ad090204031200c4055006d55
21000018000000000000000000000000
00000000000000000000000000000090

Extracted contents:
header:          00 ff ff ff ff ff ff 00
serial number:   04 69 a3 28 c7 30 02 00 1d 1a
version:         01 04
basic params:    b5 3e 22 78 3a
chroma info:     1c b5 a3 57 4f a0 27 0d 50 54
established:     bf ef 00
standard:        d1 c0 81 40 81 80 95 00 b3 00 71 4f 81 c0 01 01
descriptor 1:    4d d0 00 a0 f0 70 3e 80 30 20 35 00 6d 55 21 00 00 1a
descriptor 2:    a3 66 00 a0 f0 70 1f 80 30 20 35 00 6d 55 21 00 00 1a
descriptor 3:    00 00 00 fd 00 1e 50 18 a0 3c 04 11 00 f0 f8 38 f0 3c
descriptor 4:    00 00 00 fc 00 41 53 55 53 20 50 42 32 38 37 51 0a 20
extensions:      01
checksum:        a6

EDID version: 1.4
Manufacturer: ACI Model 28a3 Serial Number --
Made in week 29 of 2016
Digital display
10 bits per primary color channel
DisplayPort interface
Maximum image size: 62 cm x 34 cm
Gamma: 2.20
DPMS levels: Off
Supported color formats: RGB 4:4:4, YCrCb 4:4:4, YCrCb 4:2:2
First detailed timing includes the native pixel format and preferred refresh rate
Display x,y Chromaticity:
  Red:   0.6367, 0.3408
  Green: 0.3115, 0.6250
  Blue:  0.1542, 0.0537
  White: 0.3134, 0.3291
Established timings supported:
  720x400@70Hz 9:5 HorFreq: 31469 Hz Clock: 28.320 MHz
  640x480@60Hz 4:3 HorFreq: 31469 Hz Clock: 25.175 MHz
  640x480@67Hz 4:3 HorFreq: 35000 Hz Clock: 30.240 MHz
  640x480@72Hz 4:3 HorFreq: 37900 Hz Clock: 31.500 MHz
  640x480@75Hz 4:3 HorFreq: 37500 Hz Clock: 31.500 MHz
  800x600@56Hz 4:3 HorFreq: 35200 Hz Clock: 36.000 MHz
  800x600@60Hz 4:3 HorFreq: 37900 Hz Clock: 40.000 MHz
  800x600@72Hz 4:3 HorFreq: 48100 Hz Clock: 50.000 MHz
  800x600@75Hz 4:3 HorFreq: 46900 Hz Clock: 49.500 MHz
  832x624@75Hz 4:3 HorFreq: 49726 Hz Clock: 57.284 MHz
  1024x768@60Hz 4:3 HorFreq: 48400 Hz Clock: 65.000 MHz
  1024x768@70Hz 4:3 HorFreq: 56500 Hz Clock: 75.000 MHz
  1024x768@75Hz 4:3 HorFreq: 60000 Hz Clock: 78.750 MHz
  1280x1024@75Hz 5:4 HorFreq: 80000 Hz Clock: 135.000 MHz
Standard timings supported:
  1920x1080@60Hz 16:9
  1280x960@60Hz 4:3 HorFreq: 60000 Hz Clock: 108.000 MHz
  1280x1024@60Hz 5:4 HorFreq: 64000 Hz Clock: 108.000 MHz
  1440x900@60Hz 16:10 HorFreq: 55500 Hz Clock: 88.750 MHz
  1680x1050@60Hz 16:10 HorFreq: 64700 Hz Clock: 119.000 MHz
  1152x864@75Hz 4:3 HorFreq: 67500 Hz Clock: 108.000 MHz
  1280x720@60Hz 16:9
Detailed mode: Clock 533.250 MHz, 621 mm x 341 mm
               3840 3888 3920 4000 hborder 0
               2160 2163 2168 2222 vborder 0
               +hsync -vsync 
               VertFreq: 59 Hz, HorFreq: 133312 Hz
Detailed mode: Clock 262.750 MHz, 621 mm x 341 mm
               3840 3888 3920 4000 hborder 0
               2160 2163 2168 2191 vborder 0
               +hsync -vsync 
               VertFreq: 29 Hz, HorFreq: 65687 Hz
Monitor ranges (CVT): 30-80Hz V, 24-160kHz H, max dotclock 600MHz
CVT version 1.1
Max active pixels per line: 1920
Supported aspect ratios: 4:3 16:9 16:10 5:4 15:9
Preferred aspect ratio: 16:9
Supports CVT standard blanking
Supports CVT reduced blanking
Supported display scaling:
    Horizontal shrink
    Horizontal stretch
    Vertical shrink
    Vertical stretch
Preferred vertical refresh: 60 Hz
Monitor name: ASUS PB287Q
Has 1 extension blocks
Checksum: 0xa6 (valid)

CTA extension block
Extension version: 3
24 bytes of CTA data
  Video data block
    VIC   1 640x480@60Hz 4:3  HorFreq: 31469 Hz Clock: 25.175 MHz
    VIC   2 720x480@60Hz 4:3  HorFreq: 31469 Hz Clock: 27.000 MHz
    VIC   3 720x480@60Hz 16:9  HorFreq: 31469 Hz Clock: 27.000 MHz
    VIC  17 720x576@50Hz 4:3  HorFreq: 31250 Hz Clock: 27.000 MHz
    VIC  18 720x576@50Hz 16:9  HorFreq: 31250 Hz Clock: 27.000 MHz
    VIC  19 1280x720@50Hz 16:9  HorFreq: 37500 Hz Clock: 74.250 MHz
    VIC   4 1280x720@60Hz 16:9  HorFreq: 45000 Hz Clock: 74.250 MHz
    VIC  20 1920x1080i@50Hz 16:9  HorFreq: 28125 Hz Clock: 74.250 MHz
    VIC   5 1920x1080i@60Hz 16:9  HorFreq: 33750 Hz Clock: 74.250 MHz
    VIC  31 1920x1080@50Hz 16:9  HorFreq: 56250 Hz Clock: 148.500 MHz
    VIC  16 1920x1080@60Hz 16:9 (native) HorFreq: 67500 Hz Clock: 148.500 MHz
    VIC  14 1440x480@60Hz 4:3  HorFreq: 31469 Hz Clock: 54.000 MHz
    VIC  15 1440x480@60Hz 16:9  HorFreq: 31469 Hz Clock: 54.000 MHz
    VIC  29 1440x576@50Hz 4:3  HorFreq: 31250 Hz Clock: 54.000 MHz
    VIC  30 1440x576@50Hz 16:9  HorFreq: 31250 Hz Clock: 54.000 MHz
  Audio data block
    Linear PCM, max channels 2
      Supported sample rates (kHz): 96 48 44.1 32
      Supported sample sizes (bits): 24 20 16
  Speaker allocation data block
    Speaker map:
      FL/FR - Front Left/Right
Basic audio support
Supports YCbCr 4:4:4
Supports YCbCr 4:2:2
1 native detailed modes
Detailed mode: Clock 241.500 MHz, 621 mm x 341 mm
               2560 2608 2640 2720 hborder 0
               1440 1443 1448 1481 vborder 0
               +hsync +vsync 
               VertFreq: 59 Hz, HorFreq: 88786 Hz
Detailed mode: Clock 268.500 MHz, 621 mm x 341 mm
               2560 2608 2640 2720 hborder 0
               1600 1603 1609 1646 vborder 0
               +hsync -vsync 
               VertFreq: 59 Hz, HorFreq: 98713 Hz
Detailed mode: Clock 74.250 MHz, 621 mm x 341 mm
               1280 1720 1760 1980 hborder 0
                720  725  730  750 vborder 0
               +hsync +vsync 
               VertFreq: 50 Hz, HorFreq: 37500 Hz
Detailed mode: Clock 27.000 MHz, 621 mm x 341 mm
                720  732  796  864 hborder 0
                576  581  586  625 vborder 0
               -hsync -vsync 
               VertFreq: 50 Hz, HorFreq: 31250 Hz
Checksum: 0x90 (valid)

Warning: One or more of the timings is out of range of the Monitor Ranges:
  Vertical Freq: 29 - 75 Hz
  Horizontal Freq: 28125 - 133312 Hz
  Maximum Clock: 533.250 MHz
