edid-decode (hex):

00 ff ff ff ff ff ff 00 32 0c 00 b6 00 00 00 00
00 10 01 02 80 1a 10 78 0a 8c a0 97 58 54 8b 28
25 50 54 00 00 00 01 01 01 01 01 01 01 01 01 01
01 01 01 01 01 01 bc 1b 00 a0 50 20 17 30 30 30
26 00 05 a3 10 00 00 19 00 00 00 00 00 00 00 00
00 00 00 00 00 00 00 00 00 00 00 00 00 fe 00 4c
47 50 68 69 6c 69 70 73 4c 43 44 0a 00 00 00 fe
00 4c 50 31 32 31 57 58 31 2d 54 4c 41 32 00 be

----------------

Block 0, Base EDID:
  EDID Structure Version & Revision: 1.2
  Vendor & Product Identification:
    Manufacturer: LPL
    Model: 46592
    Made in: 2006
  Basic Display Parameters & Features:
    Digital display
    Maximum image size: 26 cm x 16 cm
    Gamma: 2.20
    RGB color display
    First detailed timing is preferred timing
  Color Characteristics:
    Red  : 0.5917, 0.3437
    Green: 0.3310, 0.5429
    Blue : 0.1582, 0.1464
    White: 0.3125, 0.3281
  Established Timings I & II: none
  Standard Timings: none
  Detailed Timing Descriptors:
    DTD 1:  1280x800    59.910 Hz   8:5    49.306 kHz  71.000 MHz (261 mm x 163 mm)
                 Hfront   48 Hsync  48 Hback  64 Hpol N
                 Vfront    2 Vsync   6 Vback  15 Vpol N
    Empty Descriptor
    Alphanumeric Data String: 'LGPhilipsLCD'
    Alphanumeric Data String: 'LP121WX1-TLA2'
Checksum: 0xbe

----------------

Warnings:

Block 0, Base EDID:
  EDID Structure Version & Revision: EDID 1.2 is deprecated, do not use.

Failures:

Block 0, Base EDID:
  Empty Descriptor: Use Dummy Descriptor instead of all zeroes.

EDID conformity: FAIL
