
EDID (hex):
00ffffffffffff0030ae491103000000
02180103682917782ada25a45954a028
0e5054bdee0001010101010101010101
010101010101662156aa51001e30468f
330099e61000001e662150b051001b30
4070360099e61000001e000000ff0034
323548433156484436363333000000fc
004c454e204c533139323177410a001a

Extracted contents:
header:          00 ff ff ff ff ff ff 00
serial number:   30 ae 49 11 03 00 00 00 02 18
version:         01 03
basic params:    68 29 17 78 2a
chroma info:     da 25 a4 59 54 a0 28 0e 50 54
established:     bd ee 00
standard:        01 01 01 01 01 01 01 01 01 01 01 01 01 01 01 01
descriptor 1:    66 21 56 aa 51 00 1e 30 46 8f 33 00 99 e6 10 00 00 1e
descriptor 2:    66 21 50 b0 51 00 1b 30 40 70 36 00 99 e6 10 00 00 1e
descriptor 3:    00 00 00 ff 00 34 32 35 48 43 31 56 48 44 36 36 33 33
descriptor 4:    00 00 00 fc 00 4c 45 4e 20 4c 53 31 39 32 31 77 41 0a
extensions:      00
checksum:        1a

EDID version: 1.3
Manufacturer: LEN Model 1149 Serial Number --
Made in week 2 of 2014
Analog display, Input voltage level: 0.7/0.7 V
Sync: Separate 
Maximum image size: 41 cm x 23 cm
Gamma: 2.20
DPMS levels: Off
RGB color display
First detailed timing is preferred timing
Display x,y Chromaticity:
  Red:   0.6435, 0.3486
  Green: 0.3300, 0.6269
  Blue:  0.1562, 0.0566
  White: 0.3134, 0.3291
Established timings supported:
  720x400@70Hz 9:5 HorFreq: 31469 Hz Clock: 28.320 MHz
  640x480@60Hz 4:3 HorFreq: 31469 Hz Clock: 25.175 MHz
  640x480@67Hz 4:3 HorFreq: 35000 Hz Clock: 30.240 MHz
  640x480@72Hz 4:3 HorFreq: 37900 Hz Clock: 31.500 MHz
  640x480@75Hz 4:3 HorFreq: 37500 Hz Clock: 31.500 MHz
  800x600@60Hz 4:3 HorFreq: 37900 Hz Clock: 40.000 MHz
  800x600@72Hz 4:3 HorFreq: 48100 Hz Clock: 50.000 MHz
  800x600@75Hz 4:3 HorFreq: 46900 Hz Clock: 49.500 MHz
  832x624@75Hz 4:3 HorFreq: 49726 Hz Clock: 57.284 MHz
  1024x768@60Hz 4:3 HorFreq: 48400 Hz Clock: 65.000 MHz
  1024x768@70Hz 4:3 HorFreq: 56500 Hz Clock: 75.000 MHz
  1024x768@75Hz 4:3 HorFreq: 60000 Hz Clock: 78.750 MHz
Standard timings supported:
Detailed mode: Clock 85.500 MHz, 409 mm x 230 mm
               1366 1436 1579 1792 hborder 0
                768  771  774  798 vborder 0
               +hsync +vsync 
               VertFreq: 59 Hz, HorFreq: 47712 Hz
Detailed mode: Clock 85.500 MHz, 409 mm x 230 mm
               1360 1424 1536 1792 hborder 0
                768  771  777  795 vborder 0
               +hsync +vsync 
               VertFreq: 60 Hz, HorFreq: 47712 Hz
Serial number: --
Monitor name: LEN LS1921wA
Checksum: 0x1a (valid)
EDID block does NOT conform to EDID 1.3!
	Missing monitor ranges
