edid-decode (hex):

00 ff ff ff ff ff ff 00 1e f9 af 08 01 01 01 01
19 12 01 03 80 2f 1e 78 2a 78 f5 a6 55 48 9b 26
12 50 54 a3 08 00 b3 00 95 00 81 80 81 00 01 01
01 01 01 01 01 01 21 39 90 30 62 1a 27 40 68 b0
36 00 d1 05 11 00 00 1c 00 00 00 fd 00 30 4c 18
53 10 00 0a 20 20 20 20 20 20 00 00 00 fc 00 48
44 32 32 30 31 0a 20 20 20 20 20 20 00 00 00 ff
00 4d 32 48 38 36 37 30 43 30 32 30 31 35 01 f8

02 03 23 f1 4f 90 07 06 05 04 03 02 01 9f 16 15
14 13 12 11 83 01 00 00 23 09 07 07 66 03 0c 00
10 00 80 8c 0a d0 8a 20 e0 2d 10 10 3e 96 00 d1
05 11 00 00 18 01 1d 00 72 51 d0 1e 20 6e 28 55
00 d1 05 11 00 00 18 02 3a 80 18 71 38 2d 40 58
2c 45 00 d1 05 11 00 00 1e 01 1d 00 bc 52 d0 1e
20 b8 28 55 40 d1 05 11 00 00 1e 02 3a 80 d0 72
38 2d 40 10 2c 45 80 d1 05 11 00 00 1e 00 00 17

00 ff ff ff ff ff ff 00 1e f9 af 08 01 01 01 01
19 12 01 03 80 2f 1e 78 2a 78 f5 a6 55 48 9b 26
12 50 54 a3 08 00 b3 00 95 00 81 80 81 00 01 01
01 01 01 01 01 01 21 39 90 30 62 1a 27 40 68 b0
36 00 d1 05 11 00 00 1c 00 00 00 fd 00 30 4c 18
53 10 00 0a 20 20 20 20 20 20 00 00 00 fc 00 48
44 32 32 30 31 0a 20 20 20 20 20 20 00 00 00 ff
00 4d 32 48 38 36 37 30 43 30 32 30 31 35 01 f8

02 03 23 f1 4f 90 07 06 05 04 03 02 01 9f 16 15
14 13 12 11 83 01 00 00 23 09 07 07 66 03 0c 00
10 00 80 8c 0a d0 8a 20 e0 2d 10 10 3e 96 00 d1
05 11 00 00 18 01 1d 00 72 51 d0 1e 20 6e 28 55
00 d1 05 11 00 00 18 02 3a 80 18 71 38 2d 40 58
2c 45 00 d1 05 11 00 00 1e 01 1d 00 bc 52 d0 1e
20 b8 28 55 40 d1 05 11 00 00 1e 02 3a 80 d0 72
38 2d 40 10 2c 45 80 d1 05 11 00 00 1e 00 00 17

----------------

Block 0, Base EDID:
  EDID Structure Version & Revision: 1.3
  Vendor & Product Identification:
    Manufacturer: GWY
    Model: 2223
    Serial Number: ...
    Made in: week 25 of 2008
  Basic Display Parameters & Features:
    Digital display
    Maximum image size: 47 cm x 30 cm
    Gamma: 2.20
    DPMS levels: Off
    RGB color display
    First detailed timing is the preferred timing
  Color Characteristics:
    Red  : 0.6494, 0.3349
    Green: 0.2832, 0.6054
    Blue : 0.1513, 0.0732
    White: 0.3134, 0.3291
  Established Timings I & II:
    IBM     :   720x400    70.081663 Hz   9:5     31.467 kHz     28.320000 MHz
    DMT 0x04:   640x480    59.940476 Hz   4:3     31.469 kHz     25.175000 MHz
    DMT 0x08:   800x600    56.250000 Hz   4:3     35.156 kHz     36.000000 MHz
    DMT 0x09:   800x600    60.316541 Hz   4:3     37.879 kHz     40.000000 MHz
    DMT 0x10:  1024x768    60.003840 Hz   4:3     48.363 kHz     65.000000 MHz
  Standard Timings:
    DMT 0x3a:  1680x1050   59.954250 Hz  16:10    65.290 kHz    146.250000 MHz
    DMT 0x2f:  1440x900    59.887445 Hz  16:10    55.935 kHz    106.500000 MHz
    DMT 0x23:  1280x1024   60.019740 Hz   5:4     63.981 kHz    108.000000 MHz
    DMT 0x1c:  1280x800    59.810326 Hz  16:10    49.702 kHz     83.500000 MHz
  Detailed Timing Descriptors:
    DTD  1:  1680x1050   59.954250 Hz  16:10    65.290 kHz    146.250000 MHz (465 mm x 261 mm)
                  Hfront  104 Hsync 176 Hback  280 Hpol N
                  Vfront    3 Vsync   6 Vback   30 Vpol P
    Display Range Limits:
      Monitor ranges (GTF): 48-76 Hz V, 24-83 kHz H, max dotclock 160 MHz
    Display Product Name: 'HD2201'
    Display Product Serial Number: ...
  Extension blocks: 1
Checksum: 0xf8

----------------

Block 1, CTA-861 Extension Block:
  Revision: 3
  Underscans IT Video Formats by default
  Basic audio support
  Supports YCbCr 4:4:4
  Supports YCbCr 4:2:2
  Native detailed modes: 1
  Video Data Block:
    VIC  16:  1920x1080   60.000000 Hz  16:9     67.500 kHz    148.500000 MHz (native)
    VIC   7:  1440x480i   59.940060 Hz  16:9     15.734 kHz     27.000000 MHz
    VIC   6:  1440x480i   59.940060 Hz   4:3     15.734 kHz     27.000000 MHz
    VIC   5:  1920x1080i  60.000000 Hz  16:9     33.750 kHz     74.250000 MHz
    VIC   4:  1280x720    60.000000 Hz  16:9     45.000 kHz     74.250000 MHz
    VIC   3:   720x480    59.940060 Hz  16:9     31.469 kHz     27.000000 MHz
    VIC   2:   720x480    59.940060 Hz   4:3     31.469 kHz     27.000000 MHz
    VIC   1:   640x480    59.940476 Hz   4:3     31.469 kHz     25.175000 MHz
    VIC  31:  1920x1080   50.000000 Hz  16:9     56.250 kHz    148.500000 MHz (native)
    VIC  22:  1440x576i   50.000000 Hz  16:9     15.625 kHz     27.000000 MHz
    VIC  21:  1440x576i   50.000000 Hz   4:3     15.625 kHz     27.000000 MHz
    VIC  20:  1920x1080i  50.000000 Hz  16:9     28.125 kHz     74.250000 MHz
    VIC  19:  1280x720    50.000000 Hz  16:9     37.500 kHz     74.250000 MHz
    VIC  18:   720x576    50.000000 Hz  16:9     31.250 kHz     27.000000 MHz
    VIC  17:   720x576    50.000000 Hz   4:3     31.250 kHz     27.000000 MHz
  Speaker Allocation Data Block:
    FL/FR - Front Left/Right
  Audio Data Block:
    Linear PCM:
      Max channels: 2
      Supported sample rates (kHz): 48 44.1 32
      Supported sample sizes (bits): 24 20 16
  Vendor-Specific Data Block (HDMI), OUI 00-0C-03:
    Source physical address: 1.0.0.0
    Supports_AI
  Detailed Timing Descriptors:
    DTD  2:   720x480    59.940060 Hz   3:2     31.469 kHz     27.000000 MHz (465 mm x 261 mm)
                  Hfront   16 Hsync  62 Hback   60 Hpol N
                  Vfront    9 Vsync   6 Vback   30 Vpol N
    DTD  3:  1280x720    60.000000 Hz  16:9     45.000 kHz     74.250000 MHz (465 mm x 261 mm)
                  Hfront  110 Hsync  40 Hback  220 Hpol N
                  Vfront    5 Vsync   5 Vback   20 Vpol N
    DTD  4:  1920x1080   60.000000 Hz  16:9     67.500 kHz    148.500000 MHz (465 mm x 261 mm)
                  Hfront   88 Hsync  44 Hback  148 Hpol P
                  Vfront    4 Vsync   5 Vback   36 Vpol P
    DTD  5:  1280x720    50.000000 Hz  16:9     37.500 kHz     74.250000 MHz (465 mm x 261 mm)
                  Hfront  440 Hsync  40 Hback  220 Hpol P
                  Vfront    5 Vsync   5 Vback   20 Vpol P
    DTD  6:  1920x1080   50.000000 Hz  16:9     56.250 kHz    148.500000 MHz (465 mm x 261 mm)
                  Hfront  528 Hsync  44 Hback  148 Hpol P
                  Vfront    4 Vsync   5 Vback   36 Vpol P
Checksum: 0x17  Unused space in Extension Block: 2 bytes

----------------

Block 2, Unknown EDID Extension Block 0x00:
  00 ff ff ff ff ff ff 00 1e f9 af 08 01 01 01 01 '................'
  19 12 01 03 80 2f 1e 78 2a 78 f5 a6 55 48 9b 26 '...../.x*x..UH.&'
  12 50 54 a3 08 00 b3 00 95 00 81 80 81 00 01 01 '.PT.............'
  01 01 01 01 01 01 21 39 90 30 62 1a 27 40 68 b0 '......!9.0b.'@h.'
  36 00 d1 05 11 00 00 1c 00 00 00 fd 00 30 4c 18 '6............0L.'
  53 10 00 0a 20 20 20 20 20 20 00 00 00 fc 00 48 'S...      .....H'
  44 32 32 30 31 0a 20 20 20 20 20 20 00 00 00 ff 'D2201.      ....'
  00 4d 32 48 38 36 37 30 43 30 32 30 31 35 01 f8 '.M2H8670C02015..'
Checksum: 0xf8

----------------

Block 3, CTA-861 Extension Block:
  Revision: 3
  Underscans IT Video Formats by default
  Basic audio support
  Supports YCbCr 4:4:4
  Supports YCbCr 4:2:2
  Native detailed modes: 1
  Video Data Block:
    VIC  16:  1920x1080   60.000000 Hz  16:9     67.500 kHz    148.500000 MHz (native)
    VIC   7:  1440x480i   59.940060 Hz  16:9     15.734 kHz     27.000000 MHz
    VIC   6:  1440x480i   59.940060 Hz   4:3     15.734 kHz     27.000000 MHz
    VIC   5:  1920x1080i  60.000000 Hz  16:9     33.750 kHz     74.250000 MHz
    VIC   4:  1280x720    60.000000 Hz  16:9     45.000 kHz     74.250000 MHz
    VIC   3:   720x480    59.940060 Hz  16:9     31.469 kHz     27.000000 MHz
    VIC   2:   720x480    59.940060 Hz   4:3     31.469 kHz     27.000000 MHz
    VIC   1:   640x480    59.940476 Hz   4:3     31.469 kHz     25.175000 MHz
    VIC  31:  1920x1080   50.000000 Hz  16:9     56.250 kHz    148.500000 MHz (native)
    VIC  22:  1440x576i   50.000000 Hz  16:9     15.625 kHz     27.000000 MHz
    VIC  21:  1440x576i   50.000000 Hz   4:3     15.625 kHz     27.000000 MHz
    VIC  20:  1920x1080i  50.000000 Hz  16:9     28.125 kHz     74.250000 MHz
    VIC  19:  1280x720    50.000000 Hz  16:9     37.500 kHz     74.250000 MHz
    VIC  18:   720x576    50.000000 Hz  16:9     31.250 kHz     27.000000 MHz
    VIC  17:   720x576    50.000000 Hz   4:3     31.250 kHz     27.000000 MHz
  Speaker Allocation Data Block:
    FL/FR - Front Left/Right
  Audio Data Block:
    Linear PCM:
      Max channels: 2
      Supported sample rates (kHz): 48 44.1 32
      Supported sample sizes (bits): 24 20 16
  Vendor-Specific Data Block (HDMI), OUI 00-0C-03:
    Source physical address: 1.0.0.0
    Supports_AI
  Detailed Timing Descriptors:
    DTD  7:   720x480    59.940060 Hz   3:2     31.469 kHz     27.000000 MHz (465 mm x 261 mm)
                  Hfront   16 Hsync  62 Hback   60 Hpol N
                  Vfront    9 Vsync   6 Vback   30 Vpol N
    DTD  8:  1280x720    60.000000 Hz  16:9     45.000 kHz     74.250000 MHz (465 mm x 261 mm)
                  Hfront  110 Hsync  40 Hback  220 Hpol N
                  Vfront    5 Vsync   5 Vback   20 Vpol N
    DTD  9:  1920x1080   60.000000 Hz  16:9     67.500 kHz    148.500000 MHz (465 mm x 261 mm)
                  Hfront   88 Hsync  44 Hback  148 Hpol P
                  Vfront    4 Vsync   5 Vback   36 Vpol P
    DTD 10:  1280x720    50.000000 Hz  16:9     37.500 kHz     74.250000 MHz (465 mm x 261 mm)
                  Hfront  440 Hsync  40 Hback  220 Hpol P
                  Vfront    5 Vsync   5 Vback   20 Vpol P
    DTD 11:  1920x1080   50.000000 Hz  16:9     56.250 kHz    148.500000 MHz (465 mm x 261 mm)
                  Hfront  528 Hsync  44 Hback  148 Hpol P
                  Vfront    4 Vsync   5 Vback   36 Vpol P
Checksum: 0x17  Unused space in Extension Block: 2 bytes

----------------

Warnings:

Block 1, CTA-861 Extension Block:
  Detailed Timing Descriptor #3: DTD is similar but not identical to VIC 4.
  Display Product Serial Number is set, so the Serial Number in the Base EDID should be 0.
  Add a Colorimetry Data Block with the sRGB colorimetry bit set to avoid interop issues.
Block 3, CTA-861 Extension Block:
  Detailed Timing Descriptor #8: DTD is similar but not identical to VIC 4.
  Display Product Serial Number is set, so the Serial Number in the Base EDID should be 0.
  Add a Colorimetry Data Block with the sRGB colorimetry bit set to avoid interop issues.

Failures:

Block 1, CTA-861 Extension Block:
  Missing VCDB, needed for Set Selectable RGB Quantization to avoid interop issues.
Block 2, Base EDID:
  Unknown Extension Block.
Block 3, CTA-861 Extension Block:
  Video Data Block: Duplicate VIC 16.
  Video Data Block: Duplicate VIC 7.
  Video Data Block: Duplicate VIC 6.
  Video Data Block: Duplicate VIC 5.
  Video Data Block: Duplicate VIC 4.
  Video Data Block: Duplicate VIC 3.
  Video Data Block: Duplicate VIC 2.
  Video Data Block: Duplicate VIC 1.
  Video Data Block: Duplicate VIC 31.
  Video Data Block: Duplicate VIC 22.
  Video Data Block: Duplicate VIC 21.
  Video Data Block: Duplicate VIC 20.
  Video Data Block: Duplicate VIC 19.
  Video Data Block: Duplicate VIC 18.
  Video Data Block: Duplicate VIC 17.
  Speaker Allocation Data Block: Only one instance of this Data Block is allowed.
  Missing VCDB, needed for Set Selectable RGB Quantization to avoid interop issues.
EDID:
  Base EDID: Some timings are out of range of the Monitor Ranges:
    Horizontal Freq: 15.625 - 67.500 kHz (Monitor: 24.000 - 83.000 kHz)
  Base EDID: EDID specified 1 extension block(s), but found 3 extension block(s).
  Base EDID: EDID 1.3 requires a Block Map Extension in Block 1 if there are more than 2 blocks in the EDID.
  CTA-861: Native progressive timings are a mix of several resolutions.

EDID conformity: FAIL
