
EDID (hex):
00ffffffffffff0005e36a24410a0000
121d010368351e782a6435a5544f9e27
125054bfef00d1c081803168317c4568
457c6168617c023a801871382d40582c
4500132b2100001e000000fd00324c1e
5311000a202020202020000000fc0032
34363047340a202020202020000000ff
004636314a34584130303236323500c9

Extracted contents:
header:          00 ff ff ff ff ff ff 00
serial number:   05 e3 6a 24 41 0a 00 00 12 1d
version:         01 03
basic params:    68 35 1e 78 2a
chroma info:     64 35 a5 54 4f 9e 27 12 50 54
established:     bf ef 00
standard:        d1 c0 81 80 31 68 31 7c 45 68 45 7c 61 68 61 7c
descriptor 1:    02 3a 80 18 71 38 2d 40 58 2c 45 00 13 2b 21 00 00 1e
descriptor 2:    00 00 00 fd 00 32 4c 1e 53 11 00 0a 20 20 20 20 20 20
descriptor 3:    00 00 00 fc 00 32 34 36 30 47 34 0a 20 20 20 20 20 20
descriptor 4:    00 00 00 ff 00 46 36 31 4a 34 58 41 30 30 32 36 32 35
extensions:      00
checksum:        c9

EDID version: 1.3
Manufacturer: AOC Model 246a Serial Number --
Made in week 18 of 2019
Analog display, Input voltage level: 0.7/0.7 V
Sync: Separate 
Maximum image size: 53 cm x 30 cm
Gamma: 2.20
DPMS levels: Off
RGB color display
First detailed timing is preferred timing
Display x,y Chromaticity:
  Red:   0.6455, 0.3300
  Green: 0.3095, 0.6171
  Blue:  0.1523, 0.0732
  White: 0.3134, 0.3291
Established timings supported:
  720x400@70Hz 9:5 HorFreq: 31469 Hz Clock: 28.320 MHz
  640x480@60Hz 4:3 HorFreq: 31469 Hz Clock: 25.175 MHz
  640x480@67Hz 4:3 HorFreq: 35000 Hz Clock: 30.240 MHz
  640x480@72Hz 4:3 HorFreq: 37900 Hz Clock: 31.500 MHz
  640x480@75Hz 4:3 HorFreq: 37500 Hz Clock: 31.500 MHz
  800x600@56Hz 4:3 HorFreq: 35200 Hz Clock: 36.000 MHz
  800x600@60Hz 4:3 HorFreq: 37900 Hz Clock: 40.000 MHz
  800x600@72Hz 4:3 HorFreq: 48100 Hz Clock: 50.000 MHz
  800x600@75Hz 4:3 HorFreq: 46900 Hz Clock: 49.500 MHz
  832x624@75Hz 4:3 HorFreq: 49726 Hz Clock: 57.284 MHz
  1024x768@60Hz 4:3 HorFreq: 48400 Hz Clock: 65.000 MHz
  1024x768@70Hz 4:3 HorFreq: 56500 Hz Clock: 75.000 MHz
  1024x768@75Hz 4:3 HorFreq: 60000 Hz Clock: 78.750 MHz
  1280x1024@75Hz 5:4 HorFreq: 80000 Hz Clock: 135.000 MHz
Standard timings supported:
  1920x1080@60Hz 16:9
  1280x1024@60Hz 5:4 HorFreq: 64000 Hz Clock: 108.000 MHz
  640x480@100Hz 4:3
  640x480@120Hz 4:3
  800x600@100Hz 4:3
  800x600@120Hz 4:3
  1024x768@100Hz 4:3
  1024x768@120Hz 4:3
Detailed mode: Clock 148.500 MHz, 531 mm x 299 mm
               1920 2008 2052 2200 hborder 0
               1080 1084 1089 1125 vborder 0
               +hsync +vsync 
               VertFreq: 60 Hz, HorFreq: 67500 Hz
Monitor ranges (GTF): 50-76Hz V, 30-83kHz H, max dotclock 170MHz
Monitor name: 2460G4
Serial number: --
Checksum: 0xc9 (valid)
One or more of the timings is out of range of the Monitor Ranges:
  Vertical Freq: 56 - 120 Hz
  Horizontal Freq: 31469 - 80000 Hz
  Maximum Clock: 148.500 MHz
