edid-decode (hex):

00 ff ff ff ff ff ff 00 1a b3 0a 08 65 43 03 00
2c 16 01 03 80 30 1b 78 2a 23 55 a3 54 51 9e 27
11 50 54 a5 4b 00 81 80 a9 40 95 00 b3 00 01 01
01 01 01 01 01 01 02 3a 80 18 71 38 2d 40 58 2c
45 00 de 0c 11 00 00 1e 00 00 00 fd 00 32 4c 1e
52 10 00 0a 20 20 20 20 20 20 00 00 00 fc 00 4c
32 32 54 2d 33 20 4c 45 44 0a 20 20 00 00 00 ff
00 59 56 35 46 32 31 33 38 36 31 0a 20 20 00 8d

00 ff ff ff ff ff ff 00 1a b3 0a 08 65 43 03 00
2c 16 01 03 80 30 1b 78 2a 23 55 a3 54 51 9e 27
11 50 54 a5 4b 00 81 80 a9 40 95 00 b3 00 01 01
01 01 01 01 01 01 02 3a 80 18 71 38 2d 40 58 2c
45 00 de 0c 11 00 00 1e 00 00 00 fd 00 32 4c 1e
52 10 00 0a 20 20 20 20 20 20 00 00 00 fc 00 4c
32 32 54 2d 33 20 4c 45 44 0a 20 20 00 00 00 ff
00 59 56 35 46 32 31 33 38 36 31 0a 20 20 00 8d

----------------

Block 0, Base EDID:
  EDID Structure Version & Revision: 1.3
  Vendor & Product Identification:
    Manufacturer: FUS
    Model: 2058
    Serial Number: ...
    Made in: week 44 of 2012
  Basic Display Parameters & Features:
    Digital display
    Maximum image size: 48 cm x 27 cm
    Gamma: 2.20
    DPMS levels: Off
    RGB color display
    First detailed timing is the preferred timing
  Color Characteristics:
    Red  : 0.6367, 0.3300
    Green: 0.3164, 0.6201
    Blue : 0.1533, 0.0673
    White: 0.3134, 0.3291
  Established Timings I & II:
    IBM     :   720x400    70.081663 Hz   9:5     31.467 kHz     28.320000 MHz
    DMT 0x04:   640x480    59.940476 Hz   4:3     31.469 kHz     25.175000 MHz
    DMT 0x06:   640x480    75.000000 Hz   4:3     37.500 kHz     31.500000 MHz
    DMT 0x09:   800x600    60.316541 Hz   4:3     37.879 kHz     40.000000 MHz
    DMT 0x0b:   800x600    75.000000 Hz   4:3     46.875 kHz     49.500000 MHz
    DMT 0x10:  1024x768    60.003840 Hz   4:3     48.363 kHz     65.000000 MHz
    DMT 0x12:  1024x768    75.028582 Hz   4:3     60.023 kHz     78.750000 MHz
    DMT 0x24:  1280x1024   75.024675 Hz   5:4     79.976 kHz    135.000000 MHz
  Standard Timings:
    DMT 0x23:  1280x1024   60.019740 Hz   5:4     63.981 kHz    108.000000 MHz
    DMT 0x33:  1600x1200   60.000000 Hz   4:3     75.000 kHz    162.000000 MHz
    DMT 0x2f:  1440x900    59.887445 Hz  16:10    55.935 kHz    106.500000 MHz
    DMT 0x3a:  1680x1050   59.954250 Hz  16:10    65.290 kHz    146.250000 MHz
  Detailed Timing Descriptors:
    DTD 1:  1920x1080   60.000000 Hz  16:9     67.500 kHz    148.500000 MHz (478 mm x 268 mm)
                 Hfront   88 Hsync  44 Hback  148 Hpol P
                 Vfront    4 Vsync   5 Vback   36 Vpol P
    Display Range Limits:
      Monitor ranges (GTF): 50-76 Hz V, 30-82 kHz H, max dotclock 160 MHz
    Display Product Name: 'L22T-3 LED'
    Display Product Serial Number: ...
Checksum: 0x8d

----------------

Block 1, Unknown EDID Extension Block 0x00:
  00 ff ff ff ff ff ff 00 1a b3 0a 08 65 43 03 00 '............eC..'
  2c 16 01 03 80 30 1b 78 2a 23 55 a3 54 51 9e 27 ',....0.x*#U.TQ.''
  11 50 54 a5 4b 00 81 80 a9 40 95 00 b3 00 01 01 '.PT.K....@......'
  01 01 01 01 01 01 02 3a 80 18 71 38 2d 40 58 2c '.......:..q8-@X,'
  45 00 de 0c 11 00 00 1e 00 00 00 fd 00 32 4c 1e 'E............2L.'
  52 10 00 0a 20 20 20 20 20 20 00 00 00 fc 00 4c 'R...      .....L'
  32 32 54 2d 33 20 4c 45 44 0a 20 20 00 00 00 ff '22T-3 LED.  ....'
  00 59 56 35 46 32 31 33 38 36 31 0a 20 20 00 8d '.YV5F213861.  ..'
Checksum: 0x8d

----------------

Warnings:

EDID:
  Base EDID: Some timings are out of range of the Monitor Ranges:
    Maximum Clock: 162.000 MHz (Monitor: 160.000 MHz)
    Could be due to a Monitor Range off-by-one rounding issue

Failures:

Block 1, Base EDID:
  Unknown Extension Block.
EDID:
  Base EDID: EDID specified 0 extension block(s), but found 1 extension block(s).

EDID conformity: FAIL
