
EDID (hex):
00ffffffffffff001ab30a08f8060100
2d15010380301b782a2355a354519e27
115054a54b008180a9409500b3000101
010101010101023a801871382d40582c
4500de0c1100001e000000fd00384c1e
5210000a202020202020000000fc004c
3232542d33204c45440a2020000000ff
00595635463036373332300a20200036

Extracted contents:
header:          00 ff ff ff ff ff ff 00
serial number:   1a b3 0a 08 f8 06 01 00 2d 15
version:         01 03
basic params:    80 30 1b 78 2a
chroma info:     23 55 a3 54 51 9e 27 11 50 54
established:     a5 4b 00
standard:        81 80 a9 40 95 00 b3 00 01 01 01 01 01 01 01 01
descriptor 1:    02 3a 80 18 71 38 2d 40 58 2c 45 00 de 0c 11 00 00 1e
descriptor 2:    00 00 00 fd 00 38 4c 1e 52 10 00 0a 20 20 20 20 20 20
descriptor 3:    00 00 00 fc 00 4c 32 32 54 2d 33 20 4c 45 44 0a 20 20
descriptor 4:    00 00 00 ff 00 59 56 35 46 30 36 37 33 32 30 0a 20 20
extensions:      00
checksum:        36

EDID version: 1.3
Manufacturer: FUS Model 80a Serial Number --
Made in week 45 of 2011
Digital display
Maximum image size: 48 cm x 27 cm
Gamma: 2.20
DPMS levels: Off
RGB color display
First detailed timing is preferred timing
Display x,y Chromaticity:
  Red:   0.6367, 0.3300
  Green: 0.3164, 0.6201
  Blue:  0.1533, 0.0673
  White: 0.3134, 0.3291
Established timings supported:
  720x400@70Hz 9:5 HorFreq: 31469 Hz Clock: 28.320 MHz
  640x480@60Hz 4:3 HorFreq: 31469 Hz Clock: 25.175 MHz
  640x480@75Hz 4:3 HorFreq: 37500 Hz Clock: 31.500 MHz
  800x600@60Hz 4:3 HorFreq: 37900 Hz Clock: 40.000 MHz
  800x600@75Hz 4:3 HorFreq: 46900 Hz Clock: 49.500 MHz
  1024x768@60Hz 4:3 HorFreq: 48400 Hz Clock: 65.000 MHz
  1024x768@75Hz 4:3 HorFreq: 60000 Hz Clock: 78.750 MHz
  1280x1024@75Hz 5:4 HorFreq: 80000 Hz Clock: 135.000 MHz
Standard timings supported:
  1280x1024@60Hz 5:4 HorFreq: 64000 Hz Clock: 108.000 MHz
  1600x1200@60Hz 4:3 HorFreq: 75000 Hz Clock: 162.000 MHz
  1440x900@60Hz 16:10 HorFreq: 55500 Hz Clock: 88.750 MHz
  1680x1050@60Hz 16:10 HorFreq: 64700 Hz Clock: 119.000 MHz
Detailed mode: Clock 148.500 MHz, 478 mm x 268 mm
               1920 2008 2052 2200 hborder 0
               1080 1084 1089 1125 vborder 0
               +hsync +vsync 
               VertFreq: 60 Hz, HorFreq: 67500 Hz
Monitor ranges (GTF): 56-76Hz V, 30-82kHz H, max dotclock 160MHz
Monitor name: L22T-3 LED
Serial number: --
Checksum: 0x36 (valid)
One or more of the timings is out of range of the Monitor Ranges:
  Vertical Freq: 60 - 75 Hz
  Horizontal Freq: 31469 - 80000 Hz
  Maximum Clock: 162.000 MHz


