
EDID (hex):
00ffffffffffff005a633b6100000000
131f0104b55021783b2455a84c4c9e25
105052bfef80714f8140818081c08100
9500b300d1c0f57c70a0d0a029503020
35001d4e3100001a000000ff0057464a
3231313930303332350a000000fd0030
90a0a051010a202020202020000000fc
005658333431382d324b50430a2002cc
020335f44c010203040590111213141f
3f23090707830100006d1a0000020130
90000000000000e606070169694fe305
c001e200ff235a0070a3382640302035
001d4e3100001ef0d270a0d0a03c5030
2035001d4e3100001e5a8780a070384d
40304035001d4e3100001e20fd70a0d0
a03c50302035001d4e3100001e000021
7012790000030014bf2f01046f0d9f00
2f001f009f053b000280040007000a08
81000804000402100000000000000000
00000000000000000000000000000000
00000000000000000000000000000000
00000000000000000000000000000000
00000000000000000000000000000000
0000000000000000000000000000e190

Extracted contents:
header:          00 ff ff ff ff ff ff 00
serial number:   5a 63 3b 61 00 00 00 00 13 1f
version:         01 04
basic params:    b5 50 21 78 3b
chroma info:     24 55 a8 4c 4c 9e 25 10 50 52
established:     bf ef 80
standard:        71 4f 81 40 81 80 81 c0 81 00 95 00 b3 00 d1 c0
descriptor 1:    f5 7c 70 a0 d0 a0 29 50 30 20 35 00 1d 4e 31 00 00 1a
descriptor 2:    00 00 00 ff 00 57 46 4a 32 31 31 39 30 30 33 32 35 0a
descriptor 3:    00 00 00 fd 00 30 90 a0 a0 51 01 0a 20 20 20 20 20 20
descriptor 4:    00 00 00 fc 00 56 58 33 34 31 38 2d 32 4b 50 43 0a 20
extensions:      02
checksum:        cc

EDID version: 1.4
Manufacturer: VSC Model 613b Serial Number --
Made in week 19 of 2021
Digital display
10 bits per primary color channel
DisplayPort interface
Maximum image size: 80 cm x 33 cm
Gamma: 2.20
DPMS levels: Off
Supported color formats: RGB 4:4:4, YCrCb 4:4:4, YCrCb 4:2:2
First detailed timing includes the native pixel format and preferred refresh rate
Display is continuous frequency
Display x,y Chromaticity:
  Red:   0.6562, 0.2988
  Green: 0.2978, 0.6171
  Blue:  0.1455, 0.0634
  White: 0.3134, 0.3212
Established timings supported:
  720x400@70Hz 9:5 HorFreq: 31469 Hz Clock: 28.320 MHz
  640x480@60Hz 4:3 HorFreq: 31469 Hz Clock: 25.175 MHz
  640x480@67Hz 4:3 HorFreq: 35000 Hz Clock: 30.240 MHz
  640x480@72Hz 4:3 HorFreq: 37900 Hz Clock: 31.500 MHz
  640x480@75Hz 4:3 HorFreq: 37500 Hz Clock: 31.500 MHz
  800x600@56Hz 4:3 HorFreq: 35200 Hz Clock: 36.000 MHz
  800x600@60Hz 4:3 HorFreq: 37900 Hz Clock: 40.000 MHz
  800x600@72Hz 4:3 HorFreq: 48100 Hz Clock: 50.000 MHz
  800x600@75Hz 4:3 HorFreq: 46900 Hz Clock: 49.500 MHz
  832x624@75Hz 4:3 HorFreq: 49726 Hz Clock: 57.284 MHz
  1024x768@60Hz 4:3 HorFreq: 48400 Hz Clock: 65.000 MHz
  1024x768@70Hz 4:3 HorFreq: 56500 Hz Clock: 75.000 MHz
  1024x768@75Hz 4:3 HorFreq: 60000 Hz Clock: 78.750 MHz
  1280x1024@75Hz 5:4 HorFreq: 80000 Hz Clock: 135.000 MHz
  1152x870@75Hz 192:145 HorFreq: 67500 Hz Clock: 108.000 MHz
Standard timings supported:
  1152x864@75Hz 4:3 HorFreq: 67500 Hz Clock: 108.000 MHz
  1280x960@60Hz 4:3 HorFreq: 60000 Hz Clock: 108.000 MHz
  1280x1024@60Hz 5:4 HorFreq: 64000 Hz Clock: 108.000 MHz
  1280x720@60Hz 16:9
  1280x800@60Hz 16:10
  1440x900@60Hz 16:10 HorFreq: 55500 Hz Clock: 88.750 MHz
  1680x1050@60Hz 16:10 HorFreq: 64700 Hz Clock: 119.000 MHz
  1920x1080@60Hz 16:9
Detailed mode: Clock 319.890 MHz, 797 mm x 334 mm
               3440 3488 3520 3600 hborder 0
               1440 1443 1448 1481 vborder 0
               +hsync -vsync 
               VertFreq: 59 Hz, HorFreq: 88858 Hz
Serial number: --
Monitor ranges (bare limits): 48-144Hz V, 160-160kHz H, max dotclock 810MHz
Monitor name: VX3418-2KPC
Has 2 extension blocks
Checksum: 0xcc (valid)

CTA extension block
Extension version: 3
49 bytes of CTA data
  Video data block
    VIC   1 640x480@60Hz 4:3  HorFreq: 31469 Hz Clock: 25.175 MHz
    VIC   2 720x480@60Hz 4:3  HorFreq: 31469 Hz Clock: 27.000 MHz
    VIC   3 720x480@60Hz 16:9  HorFreq: 31469 Hz Clock: 27.000 MHz
    VIC   4 1280x720@60Hz 16:9  HorFreq: 45000 Hz Clock: 74.250 MHz
    VIC   5 1920x1080i@60Hz 16:9  HorFreq: 33750 Hz Clock: 74.250 MHz
    VIC  16 1920x1080@60Hz 16:9 (native) HorFreq: 67500 Hz Clock: 148.500 MHz
    VIC  17 720x576@50Hz 4:3  HorFreq: 31250 Hz Clock: 27.000 MHz
    VIC  18 720x576@50Hz 16:9  HorFreq: 31250 Hz Clock: 27.000 MHz
    VIC  19 1280x720@50Hz 16:9  HorFreq: 37500 Hz Clock: 74.250 MHz
    VIC  20 1920x1080i@50Hz 16:9  HorFreq: 28125 Hz Clock: 74.250 MHz
    VIC  31 1920x1080@50Hz 16:9  HorFreq: 56250 Hz Clock: 148.500 MHz
    VIC  63 1920x1080@120Hz 16:9  HorFreq: 135000 Hz Clock: 297.000 MHz
  Audio data block
    Linear PCM, max channels 2
      Supported sample rates (kHz): 48 44.1 32
      Supported sample sizes (bits): 24 20 16
  Speaker allocation data block
    Speaker map:
      FL/FR - Front Left/Right
  Vendor-specific data block, OUI 00001a
  Extended tag: HDR static metadata data block
    Electro optical transfer functions:
      Traditional gamma - SDR luminance range
      Traditional gamma - HDR luminance range
      SMPTE ST2084
    Supported static metadata descriptors:
      Static metadata type 1
    Desired content max luminance: 105 (486.099 cd/m^2)
    Desired content max frame-average luminance: 105 (486.099 cd/m^2)
    Desired content min luminance: 79 (0.467 cd/m^2)
  Extended tag: Colorimetry data block
    BT2020YCC
    BT2020RGB
  Extended tag: Video capability data block
    YCbCr quantization: Selectable (via AVI YQ) (1)
    RGB quantization: Selectable (via AVI Q) (1)
    PT scan behaviour: Support both over- and underscan (3)
    IT scan behaviour: Support both over- and underscan (3)
    CE scan behaviour: Support both over- and underscan (3)
Underscans PC formats by default
Basic audio support
Supports YCbCr 4:4:4
Supports YCbCr 4:2:2
4 native detailed modes
Detailed mode: Clock 230.750 MHz, 797 mm x 334 mm
               2560 2608 2640 3440 hborder 0
               1080 1083 1088 1118 vborder 0
               +hsync +vsync 
               VertFreq: 59 Hz, HorFreq: 67078 Hz
Detailed mode: Clock 540.000 MHz, 797 mm x 334 mm
               3440 3488 3520 3600 hborder 0
               1440 1443 1448 1500 vborder 0
               +hsync +vsync 
               VertFreq: 100 Hz, HorFreq: 150000 Hz
Detailed mode: Clock 346.500 MHz, 797 mm x 334 mm
               1920 1968 2032 2080 hborder 0
               1080 1083 1088 1157 vborder 0
               +hsync +vsync 
               VertFreq: 143 Hz, HorFreq: 166586 Hz
Detailed mode: Clock 648.000 MHz, 797 mm x 334 mm
               3440 3488 3520 3600 hborder 0
               1440 1443 1448 1500 vborder 0
               +hsync +vsync 
               VertFreq: 120 Hz, HorFreq: 180000 Hz
Checksum: 0x21 (valid)


DisplayID extension block
Extension version: 18
Length 121, version 18, extension count 0
Checksum: 0xe1 (valid)
Type 1 detailed timing: aspect: 16:9,  
Detailed mode: Clock 777.590 MHz, 0 mm x 0 mm
               3439 3486 3517 3598
               1439 1441 1445 1498
               -hsync +vsync
VESA DMT timing block

Warning: One or more of the timings is out of range of the Monitor Ranges:
  Vertical Freq: 50 - 143 Hz
  Horizontal Freq: 28125 - 180000 Hz
  Maximum Clock: 648.000 MHz


