edid-decode (hex):

00 ff ff ff ff ff ff 00 21 63 00 26 00 00 00 00
05 16 01 03 80 3a 21 78 ea b1 a5 a1 58 4f 95 26
16 50 54 23 08 00 81 80 81 c0 b3 00 95 00 81 00
01 01 01 01 01 01 30 2a 00 98 51 00 2a 40 30 70
13 00 68 0e 11 00 00 1e 02 3a 80 18 71 38 2d 40
58 2c 45 00 55 50 21 00 00 1a 00 00 00 fd 00 3a
41 1e 53 11 00 0a 20 20 20 20 20 20 00 00 00 fc
00 0a 20 20 20 20 20 20 20 20 20 20 20 20 00 cf

00 ff ff ff ff ff ff 00 21 63 00 26 00 00 00 00
05 16 01 03 80 3a 21 78 ea b1 a5 a1 58 4f 95 26
16 50 54 23 08 00 81 80 81 c0 b3 00 95 00 81 00
01 01 01 01 01 01 30 2a 00 98 51 00 2a 40 30 70
13 00 68 0e 11 00 00 1e 02 3a 80 18 71 38 2d 40
58 2c 45 00 55 50 21 00 00 1a 00 00 00 fd 00 3a
41 1e 53 11 00 0a 20 20 20 20 20 20 00 00 00 fc
00 0a 20 20 20 20 20 20 20 20 20 20 20 20 00 cf

----------------

Block 0, Base EDID:
  EDID Structure Version & Revision: 1.3
  Vendor & Product Identification:
    Manufacturer: HKC
    Model: 9728
    Made in: week 5 of 2012
  Basic Display Parameters & Features:
    Digital display
    Maximum image size: 58 cm x 33 cm
    Gamma: 2.20
    DPMS levels: Standby Suspend Off
    RGB color display
    First detailed timing is the preferred timing
  Color Characteristics:
    Red  : 0.6308, 0.3466
    Green: 0.3085, 0.5830
    Blue : 0.1503, 0.0878
    White: 0.3134, 0.3291
  Established Timings I & II:
    DMT 0x04:   640x480    59.940476 Hz   4:3     31.469 kHz     25.175000 MHz
    DMT 0x08:   800x600    56.250000 Hz   4:3     35.156 kHz     36.000000 MHz
    DMT 0x09:   800x600    60.316541 Hz   4:3     37.879 kHz     40.000000 MHz
    DMT 0x10:  1024x768    60.003840 Hz   4:3     48.363 kHz     65.000000 MHz
  Standard Timings:
    DMT 0x23:  1280x1024   60.019740 Hz   5:4     63.981 kHz    108.000000 MHz
    DMT 0x55:  1280x720    60.000000 Hz  16:9     45.000 kHz     74.250000 MHz
    DMT 0x3a:  1680x1050   59.954250 Hz  16:10    65.290 kHz    146.250000 MHz
    DMT 0x2f:  1440x900    59.887445 Hz  16:10    55.935 kHz    106.500000 MHz
    DMT 0x1c:  1280x800    59.810326 Hz  16:10    49.702 kHz     83.500000 MHz
  Detailed Timing Descriptors:
    DTD 1:  1280x1024   60.019740 Hz   5:4     63.981 kHz    108.000000 MHz (360 mm x 270 mm)
                 Hfront   48 Hsync 112 Hback  248 Hpol P
                 Vfront    1 Vsync   3 Vback   38 Vpol P
    DTD 2:  1920x1080   60.000000 Hz  16:9     67.500 kHz    148.500000 MHz (597 mm x 336 mm)
                 Hfront   88 Hsync  44 Hback  148 Hpol P
                 Vfront    4 Vsync   5 Vback   36 Vpol N
    Display Range Limits:
      Monitor ranges (GTF): 58-65 Hz V, 30-83 kHz H, max dotclock 170 MHz
    Display Product Name: ''
Checksum: 0xcf

----------------

Block 1, Unknown EDID Extension Block 0x00:
  00 ff ff ff ff ff ff 00 21 63 00 26 00 00 00 00 '........!c.&....'
  05 16 01 03 80 3a 21 78 ea b1 a5 a1 58 4f 95 26 '.....:!x....XO.&'
  16 50 54 23 08 00 81 80 81 c0 b3 00 95 00 81 00 '.PT#............'
  01 01 01 01 01 01 30 2a 00 98 51 00 2a 40 30 70 '......0*..Q.*@0p'
  13 00 68 0e 11 00 00 1e 02 3a 80 18 71 38 2d 40 '..h......:..q8-@'
  58 2c 45 00 55 50 21 00 00 1a 00 00 00 fd 00 3a 'X,E.UP!........:'
  41 1e 53 11 00 0a 20 20 20 20 20 20 00 00 00 fc 'A.S...      ....'
  00 0a 20 20 20 20 20 20 20 20 20 20 20 20 00 cf '..            ..'
Checksum: 0xcf

----------------

Warnings:

Block 0, Base EDID:
  Detailed Timing Descriptor #2: DTD is similar but not identical to VIC 16.

Failures:

Block 0, Base EDID:
  Detailed Timing Descriptor #1: Mismatch of image size 360x270 mm vs display size 580x330 mm.
  Detailed Timing Descriptor #2: Mismatch of image size 597x336 mm vs display size 580x330 mm.
  Display Product Name: Empty string.
Block 1, Base EDID:
  Unknown Extension Block.
EDID:
  Base EDID: Some timings are out of range of the Monitor Ranges:
    Vertical Freq: 56.250 - 60.317 Hz (Monitor: 58.000 - 65.000 Hz)
  Base EDID: The DTD max image size is 597x336mm, which is larger than the display size 580.0x330.0mm.
  Base EDID: EDID specified 0 extension block(s), but found 1 extension block(s).

EDID conformity: FAIL
