
EDID (hex):
00ffffffffffff0006af471200000000
010f0103801e13780a87c594574f8c27
25505400000001010101010101010101
0101010101013822a0a050840c303020
360030be100000180000000f00000000
00000000000000000020000000fe0041
554f0a202020202020202020000000fe
004231343150573031205632200a006d

Extracted contents:
header:          00 ff ff ff ff ff ff 00
serial number:   06 af 47 12 00 00 00 00 01 0f
version:         01 03
basic params:    80 1e 13 78 0a
chroma info:     87 c5 94 57 4f 8c 27 25 50 54
established:     00 00 00
standard:        01 01 01 01 01 01 01 01 01 01 01 01 01 01 01 01
descriptor 1:    38 22 a0 a0 50 84 0c 30 30 20 36 00 30 be 10 00 00 18
descriptor 2:    00 00 00 0f 00 00 00 00 00 00 00 00 00 00 00 00 00 20
descriptor 3:    00 00 00 fe 00 41 55 4f 0a 20 20 20 20 20 20 20 20 20
descriptor 4:    00 00 00 fe 00 42 31 34 31 50 57 30 31 20 56 32 20 0a
extensions:      00
checksum:        6d

EDID version: 1.3
Manufacturer: AUO Model 1247 Serial Number --
Digital display
Maximum image size: 30 cm x 19 cm
Gamma: 2.20
RGB color display
First detailed timing is preferred timing
Display x,y Chromaticity:
  Red:   0.5800, 0.3398
  Green: 0.3095, 0.5498
  Blue:  0.1552, 0.1445
  White: 0.3134, 0.3291
Established timings supported:
Standard timings supported:
Detailed mode: Clock 87.600 MHz, 304 mm x 190 mm
               1440 1488 1520 1600 hborder 0
                900  903  909  912 vborder 0
               -hsync -vsync 
               VertFreq: 60 Hz, HorFreq: 54750 Hz
Manufacturer-specified data, tag 15
ASCII string: AUO
ASCII string: B141PW01 V2 
Checksum: 0x6d (valid)
EDID block does NOT conform to EDID 1.3!
	Missing name descriptor
	Missing monitor ranges
EDID block does not conform at all!
	Bad year of manufacture
