edid-decode (hex):

00 ff ff ff ff ff ff 00 09 e5 74 09 00 00 00 00
0d 1f 01 04 a5 22 13 78 07 01 25 a5 53 4b a0 27
0e 50 54 00 00 00 01 01 01 01 01 01 01 01 01 01
01 01 01 01 01 01 40 3f 00 af a0 a0 28 50 30 20
36 00 58 c2 10 00 00 18 00 00 00 fd 00 30 a5 f4
f4 43 01 0a 20 20 20 20 20 20 00 00 00 fe 00 42
4f 45 20 43 51 0a 20 20 20 20 20 20 00 00 00 fe
00 4e 45 31 35 36 51 48 4d 2d 4e 59 32 0a 01 33

70 13 79 00 00 03 01 14 e5 04 01 84 ff 09 ae 00
2f 00 1f 00 9f 05 27 00 02 00 05 00 00 00 00 00
00 00 00 00 00 00 00 00 00 00 00 00 00 00 00 00
00 00 00 00 00 00 00 00 00 00 00 00 00 00 00 00
00 00 00 00 00 00 00 00 00 00 00 00 00 00 00 00
00 00 00 00 00 00 00 00 00 00 00 00 00 00 00 00
00 00 00 00 00 00 00 00 00 00 00 00 00 00 00 00
00 00 00 00 00 00 00 00 00 00 00 00 00 00 18 90

----------------

Block 0, Base EDID:
  EDID Structure Version & Revision: 1.4
  Vendor & Product Identification:
    Manufacturer: BOE
    Model: 2420
    Made in: week 13 of 2021
  Basic Display Parameters & Features:
    Digital display
    Bits per primary color channel: 8
    DisplayPort interface
    Maximum image size: 34 cm x 19 cm
    Gamma: 2.20
    Supported color formats: RGB 4:4:4
    Default (sRGB) color space is primary color space
    First detailed timing includes the native pixel format and preferred refresh rate
    Display is continuous frequency
  Color Characteristics:
    Red  : 0.6445, 0.3242
    Green: 0.2929, 0.6259
    Blue : 0.1523, 0.0566
    White: 0.3134, 0.3291
  Established Timings I & II: none
  Standard Timings: none
  Detailed Timing Descriptors:
    DTD 1:  2560x1440   40.001976 Hz  16:9     59.203 kHz    161.920000 MHz (344 mm x 194 mm)
                 Hfront   48 Hsync  32 Hback   95 Hpol N
                 Vfront    3 Vsync   6 Vback   31 Vpol N
    Display Range Limits:
      Monitor ranges (Bare Limits): 48-165 Hz V, 244-244 kHz H, max dotclock 670 MHz
    Alphanumeric Data String: 'BOE CQ'
    Alphanumeric Data String: 'NE156QHM-NY2'
  Extension blocks: 1
Checksum: 0x33

----------------

Block 1, DisplayID Extension Block:
  Version: 1.3
  Extension Count: 0
  Display Product Type: Extension Section
  Video Timing Modes Type 1 - Detailed Timings Data Block:
    DTD:  2560x1440  165.003212 Hz  16:9    244.205 kHz    667.900000 MHz (aspect 16:9, no 3D stereo, preferred)
               Hfront   48 Hsync  32 Hback   95 Hpol N
               Vfront    3 Vsync   6 Vback   31 Vpol N
  Checksum: 0x18
Checksum: 0x90

----------------

Warnings:

EDID:
  Base EDID: Some timings are out of range of the Monitor Ranges:
    Vertical Freq: 40.002 - 165.003 Hz (Monitor: 48.000 - 165.000 Hz)
    Horizontal Freq: 59.202 - 244.204 kHz (Monitor: 244.000 - 244.000 kHz)

Failures:

Block 0, Base EDID:
  Basic Display Parameters & Features: sRGB is signaled, but the chromaticities do not match.
  Missing Display Product Name.
Block 1, DisplayID Extension Block:
  DisplayID Base Block has no product type.
EDID:
  DisplayID: Missing DisplayID Product Identification Data Block.

EDID conformity: FAIL
