edid-decode (hex):

00 ff ff ff ff ff ff 00 0d af 00 11 00 00 00 00
09 13 01 03 80 19 0e 78 0a cf 45 90 59 57 95 29
1f 50 54 00 00 00 01 01 01 01 01 01 01 01 01 01
01 01 01 01 01 01 9c 19 56 2a 50 00 08 30 07 0e
13 00 00 90 10 00 00 18 00 00 00 fe 00 4e 31 31
36 42 36 2d 4c 30 32 0a 20 20 00 00 00 fe 00 43
4d 4f 0a 20 20 20 20 20 20 20 20 20 00 00 00 fe
00 4e 31 31 36 42 36 2d 4c 30 32 0a 20 20 00 65

----------------

Block 0, Base EDID:
  EDID Structure Version & Revision: 1.3
  Vendor & Product Identification:
    Manufacturer: CMO
    Model: 4352
    Made in: week 9 of 2009
  Basic Display Parameters & Features:
    Digital display
    Maximum image size: 25 cm x 14 cm
    Gamma: 2.20
    RGB color display
    First detailed timing is preferred timing
  Color Characteristics:
    Red  : 0.5654, 0.3476
    Green: 0.3427, 0.5849
    Blue : 0.1611, 0.1210
    White: 0.3134, 0.3291
  Established Timings I & II: none
  Standard Timings: none
  Detailed Timing Descriptors:
    DTD 1:  1366x768    60.003 Hz 683:384  46.562 kHz  65.560 MHz (256 mm x 144 mm)
                 Hfront    7 Hsync  14 Hback  21 Hpol N
                 Vfront    1 Vsync   3 Vback   4 Vpol N
    Alphanumeric Data String: 'N116B6-L02'
    Alphanumeric Data String: 'CMO'
    Alphanumeric Data String: 'N116B6-L02'
Checksum: 0x65
