
EDID (hex):
00ffffffffffff005df25027211d9a00
20180104a53c2278e2d6a5a2594a9524
145054bfcf80818081407140a9c08100
81c09040614f023a801871382d40582c
450070cf1000001a21399030621a2740
68b0360055001100001c000000ff004a
54323731343332303033360a000000fc
0054455252412032373530570a2000fc

Extracted contents:
header:          00 ff ff ff ff ff ff 00
serial number:   5d f2 50 27 21 1d 9a 00 20 18
version:         01 04
basic params:    a5 3c 22 78 e2
chroma info:     d6 a5 a2 59 4a 95 24 14 50 54
established:     bf cf 80
standard:        81 80 81 40 71 40 a9 c0 81 00 81 c0 90 40 61 4f
descriptor 1:    02 3a 80 18 71 38 2d 40 58 2c 45 00 70 cf 10 00 00 1a
descriptor 2:    21 39 90 30 62 1a 27 40 68 b0 36 00 55 00 11 00 00 1c
descriptor 3:    00 00 00 ff 00 4a 54 32 37 31 34 33 32 30 30 33 36 0a
descriptor 4:    00 00 00 fc 00 54 45 52 52 41 20 32 37 35 30 57 0a 20
extensions:      00
checksum:        fc

EDID version: 1.4
Manufacturer: WOR Model 2750 Serial Number --
Made in week 32 of 2014
Digital display
8 bits per primary color channel
DisplayPort interface
Maximum image size: 60 cm x 34 cm
Gamma: 2.20
DPMS levels: Standby Suspend Off
Supported color formats: RGB 4:4:4
First detailed timing includes the native pixel format and preferred refresh rate
Display x,y Chromaticity:
  Red:   0.6357, 0.3486
  Green: 0.2900, 0.5839
  Blue:  0.1425, 0.0800
  White: 0.3134, 0.3291
Established timings supported:
  720x400@70Hz 9:5 HorFreq: 31469 Hz Clock: 28.320 MHz
  640x480@60Hz 4:3 HorFreq: 31469 Hz Clock: 25.175 MHz
  640x480@67Hz 4:3 HorFreq: 35000 Hz Clock: 30.240 MHz
  640x480@72Hz 4:3 HorFreq: 37900 Hz Clock: 31.500 MHz
  640x480@75Hz 4:3 HorFreq: 37500 Hz Clock: 31.500 MHz
  800x600@56Hz 4:3 HorFreq: 35200 Hz Clock: 36.000 MHz
  800x600@60Hz 4:3 HorFreq: 37900 Hz Clock: 40.000 MHz
  800x600@72Hz 4:3 HorFreq: 48100 Hz Clock: 50.000 MHz
  800x600@75Hz 4:3 HorFreq: 46900 Hz Clock: 49.500 MHz
  1024x768@60Hz 4:3 HorFreq: 48400 Hz Clock: 65.000 MHz
  1024x768@70Hz 4:3 HorFreq: 56500 Hz Clock: 75.000 MHz
  1024x768@75Hz 4:3 HorFreq: 60000 Hz Clock: 78.750 MHz
  1280x1024@75Hz 5:4 HorFreq: 80000 Hz Clock: 135.000 MHz
  1152x870@75Hz 192:145 HorFreq: 67500 Hz Clock: 108.000 MHz
Standard timings supported:
  1280x1024@60Hz 5:4 HorFreq: 64000 Hz Clock: 108.000 MHz
  1280x960@60Hz 4:3 HorFreq: 60000 Hz Clock: 108.000 MHz
  1152x864@60Hz 4:3
  1600x900@60Hz 16:9
  1280x800@60Hz 16:10
  1280x720@60Hz 16:9
  1400x1050@60Hz 4:3 HorFreq: 64700 Hz Clock: 101.000 MHz
  1024x768@75Hz 4:3 HorFreq: 60000 Hz Clock: 78.750 MHz
Detailed mode: Clock 148.500 MHz, 368 mm x 207 mm
               1920 2008 2052 2200 hborder 0
               1080 1084 1089 1125 vborder 0
               +hsync -vsync 
               VertFreq: 60 Hz, HorFreq: 67500 Hz
Detailed mode: Clock 146.250 MHz, 341 mm x 256 mm
               1680 1784 1960 2240 hborder 0
               1050 1053 1059 1089 vborder 0
               -hsync +vsync 
               VertFreq: 59 Hz, HorFreq: 65290 Hz
Serial number: --
Monitor name: TERRA 2750W
Checksum: 0xfc (valid)
	Missing monitor ranges
