edid-decode (hex):

00 ff ff ff ff ff ff 00 38 b8 50 42 01 01 01 01
00 15 01 03 80 5d 34 78 2a f9 ab a2 55 4a 9a 25
0f 47 4a b7 ee 00 81 c0 81 80 d1 c0 01 01 01 01
01 01 01 01 01 01 30 2a 00 98 51 00 2a 40 30 70
13 00 a2 0b 32 00 00 1e 1a 36 80 a0 70 38 1f 40
30 20 25 00 a2 0b 32 00 00 1c 00 00 00 fd 00 37
4c 0f 46 0f 00 0a 20 20 20 20 20 20 00 00 00 fc
00 54 4c 2d 34 32 53 52 35 30 30 44 0a 20 01 24

02 03 2b f1 51 01 02 03 04 05 06 07 90 11 12 13
16 15 1f 14 20 21 23 09 7f 07 83 01 00 00 6c 03
0c 00 10 00 00 1e c0 01 01 01 01 8c 0a d0 8a 20
e0 2d 10 10 3e 96 00 a2 0b 32 00 00 18 02 3a 80
18 71 38 2d 40 58 2c 25 00 a2 0b 32 00 00 1e 01
1d 80 18 71 1c 2d 20 58 2c 25 00 a2 0b 32 00 00
9e 01 1d 80 d0 72 1c 2d 20 10 2c 43 80 a2 0b 32
00 00 9e 00 00 00 00 00 00 00 00 00 00 00 00 57

00 ff ff ff ff ff ff 00 38 b8 50 42 01 01 01 01
00 15 01 03 80 5d 34 78 2a f9 ab a2 55 4a 9a 25
0f 47 4a b7 ee 00 81 c0 81 80 d1 c0 01 01 01 01
01 01 01 01 01 01 30 2a 00 98 51 00 2a 40 30 70
13 00 a2 0b 32 00 00 1e 1a 36 80 a0 70 38 1f 40
30 20 25 00 a2 0b 32 00 00 1c 00 00 00 fd 00 37
4c 0f 46 0f 00 0a 20 20 20 20 20 20 00 00 00 fc
00 54 4c 2d 34 32 53 52 35 30 30 44 0a 20 01 24

02 03 2b f1 51 01 02 03 04 05 06 07 90 11 12 13
16 15 1f 14 20 21 23 09 7f 07 83 01 00 00 6c 03
0c 00 10 00 00 1e c0 01 01 01 01 8c 0a d0 8a 20
e0 2d 10 10 3e 96 00 a2 0b 32 00 00 18 02 3a 80
18 71 38 2d 40 58 2c 25 00 a2 0b 32 00 00 1e 01
1d 80 18 71 1c 2d 20 58 2c 25 00 a2 0b 32 00 00
9e 01 1d 80 d0 72 1c 2d 20 10 2c 43 80 a2 0b 32
00 00 9e 00 00 00 00 00 00 00 00 00 00 00 00 57

----------------

Block 0, Base EDID:
  EDID Structure Version & Revision: 1.3
  Vendor & Product Identification:
    Manufacturer: NEX
    Model: 16976
    Serial Number: ...
    Made in: 2011
  Basic Display Parameters & Features:
    Digital display
    Maximum image size: 93 cm x 52 cm
    Gamma: 2.20
    DPMS levels: Off
    RGB color display
    First detailed timing is the preferred timing
  Color Characteristics:
    Red  : 0.6357, 0.3349
    Green: 0.2910, 0.6025
    Blue : 0.1464, 0.0605
    White: 0.2792, 0.2919
  Established Timings I & II:
    IBM     :   720x400    70.081663 Hz   9:5     31.467 kHz     28.320000 MHz
    DMT 0x04:   640x480    59.940476 Hz   4:3     31.469 kHz     25.175000 MHz
    Apple   :   640x480    66.666667 Hz   4:3     35.000 kHz     30.240000 MHz
    DMT 0x06:   640x480    75.000000 Hz   4:3     37.500 kHz     31.500000 MHz
    DMT 0x08:   800x600    56.250000 Hz   4:3     35.156 kHz     36.000000 MHz
    DMT 0x09:   800x600    60.316541 Hz   4:3     37.879 kHz     40.000000 MHz
    DMT 0x0a:   800x600    72.187572 Hz   4:3     48.077 kHz     50.000000 MHz
    DMT 0x0b:   800x600    75.000000 Hz   4:3     46.875 kHz     49.500000 MHz
    Apple   :   832x624    74.551266 Hz   4:3     49.726 kHz     57.284000 MHz
    DMT 0x10:  1024x768    60.003840 Hz   4:3     48.363 kHz     65.000000 MHz
    DMT 0x11:  1024x768    70.069359 Hz   4:3     56.476 kHz     75.000000 MHz
    DMT 0x12:  1024x768    75.028582 Hz   4:3     60.023 kHz     78.750000 MHz
  Standard Timings:
    DMT 0x55:  1280x720    60.000000 Hz  16:9     45.000 kHz     74.250000 MHz
    DMT 0x23:  1280x1024   60.019740 Hz   5:4     63.981 kHz    108.000000 MHz
    DMT 0x52:  1920x1080   60.000000 Hz  16:9     67.500 kHz    148.500000 MHz
  Detailed Timing Descriptors:
    DTD  1:  1280x1024   60.019740 Hz   5:4     63.981 kHz    108.000000 MHz (930 mm x 523 mm)
                  Hfront   48 Hsync 112 Hback  248 Hpol P
                  Vfront    1 Vsync   3 Vback   38 Vpol P
    DTD  2:  1920x1080   59.933878 Hz  16:9     66.587 kHz    138.500000 MHz (930 mm x 523 mm)
                  Hfront   48 Hsync  32 Hback   80 Hpol N
                  Vfront    2 Vsync   5 Vback   24 Vpol P
    Display Range Limits:
      Monitor ranges (GTF): 55-76 Hz V, 15-70 kHz H, max dotclock 150 MHz
    Display Product Name: 'TL-42SR500D'
  Extension blocks: 1
Checksum: 0x24

----------------

Block 1, CTA-861 Extension Block:
  Revision: 3
  Underscans IT Video Formats by default
  Basic audio support
  Supports YCbCr 4:4:4
  Supports YCbCr 4:2:2
  Native detailed modes: 1
  Video Data Block:
    VIC   1:   640x480    59.940476 Hz   4:3     31.469 kHz     25.175000 MHz
    VIC   2:   720x480    59.940060 Hz   4:3     31.469 kHz     27.000000 MHz
    VIC   3:   720x480    59.940060 Hz  16:9     31.469 kHz     27.000000 MHz
    VIC   4:  1280x720    60.000000 Hz  16:9     45.000 kHz     74.250000 MHz
    VIC   5:  1920x1080i  60.000000 Hz  16:9     33.750 kHz     74.250000 MHz
    VIC   6:  1440x480i   59.940060 Hz   4:3     15.734 kHz     27.000000 MHz
    VIC   7:  1440x480i   59.940060 Hz  16:9     15.734 kHz     27.000000 MHz
    VIC  16:  1920x1080   60.000000 Hz  16:9     67.500 kHz    148.500000 MHz (native)
    VIC  17:   720x576    50.000000 Hz   4:3     31.250 kHz     27.000000 MHz
    VIC  18:   720x576    50.000000 Hz  16:9     31.250 kHz     27.000000 MHz
    VIC  19:  1280x720    50.000000 Hz  16:9     37.500 kHz     74.250000 MHz
    VIC  22:  1440x576i   50.000000 Hz  16:9     15.625 kHz     27.000000 MHz
    VIC  21:  1440x576i   50.000000 Hz   4:3     15.625 kHz     27.000000 MHz
    VIC  31:  1920x1080   50.000000 Hz  16:9     56.250 kHz    148.500000 MHz
    VIC  20:  1920x1080i  50.000000 Hz  16:9     28.125 kHz     74.250000 MHz
    VIC  32:  1920x1080   24.000000 Hz  16:9     27.000 kHz     74.250000 MHz
    VIC  33:  1920x1080   25.000000 Hz  16:9     28.125 kHz     74.250000 MHz
  Audio Data Block:
    Linear PCM:
      Max channels: 2
      Supported sample rates (kHz): 192 176.4 96 88.2 48 44.1 32
      Supported sample sizes (bits): 24 20 16
  Speaker Allocation Data Block:
    FL/FR - Front Left/Right
  Vendor-Specific Data Block (HDMI), OUI 00-0C-03:
    Source physical address: 1.0.0.0
    Maximum TMDS clock: 150 MHz
    Video latency: 0 ms
    Audio latency: 0 ms
    Interlaced video latency: 0 ms
    Interlaced audio latency: 0 ms
  Detailed Timing Descriptors:
    DTD  3:   720x480    59.940060 Hz   3:2     31.469 kHz     27.000000 MHz (930 mm x 523 mm)
                  Hfront   16 Hsync  62 Hback   60 Hpol N
                  Vfront    9 Vsync   6 Vback   30 Vpol N
    DTD  4:  1920x1080   60.000000 Hz  16:9     67.500 kHz    148.500000 MHz (930 mm x 523 mm)
                  Hfront   88 Hsync  44 Hback  148 Hpol P
                  Vfront    2 Vsync   5 Vback   38 Vpol P
    DTD  5:  1920x1080i  57.643040 Hz  16:9     33.750 kHz     74.250000 MHz (930 mm x 523 mm)
                  Hfront   88 Hsync  44 Hback  148 Hpol P
                  Vfront    2 Vsync   5 Vback   38 Vpol P Vfront +0.5 Odd Field
                  Vfront    2 Vsync   5 Vback   38 Vpol P Vback  +0.5 Even Field
    DTD  6:  1920x1080i  48.035867 Hz  16:9     28.125 kHz     74.250000 MHz (930 mm x 523 mm)
                  Hfront  528 Hsync  44 Hback  148 Hpol P
                  Vfront    4 Vsync   3 Vback   38 Vpol P Vfront +0.5 Odd Field
                  Vfront    4 Vsync   3 Vback   38 Vpol P Vback  +0.5 Even Field
Checksum: 0x57  Unused space in Extension Block: 12 bytes

----------------

Block 2, Unknown EDID Extension Block 0x00:
  00 ff ff ff ff ff ff 00 38 b8 50 42 01 01 01 01 '........8.PB....'
  00 15 01 03 80 5d 34 78 2a f9 ab a2 55 4a 9a 25 '.....]4x*...UJ.%'
  0f 47 4a b7 ee 00 81 c0 81 80 d1 c0 01 01 01 01 '.GJ.............'
  01 01 01 01 01 01 30 2a 00 98 51 00 2a 40 30 70 '......0*..Q.*@0p'
  13 00 a2 0b 32 00 00 1e 1a 36 80 a0 70 38 1f 40 '....2....6..p8.@'
  30 20 25 00 a2 0b 32 00 00 1c 00 00 00 fd 00 37 '0 %...2........7'
  4c 0f 46 0f 00 0a 20 20 20 20 20 20 00 00 00 fc 'L.F...      ....'
  00 54 4c 2d 34 32 53 52 35 30 30 44 0a 20 01 24 '.TL-42SR500D. .$'
Checksum: 0x24

----------------

Block 3, CTA-861 Extension Block:
  Revision: 3
  Underscans IT Video Formats by default
  Basic audio support
  Supports YCbCr 4:4:4
  Supports YCbCr 4:2:2
  Native detailed modes: 1
  Video Data Block:
    VIC   1:   640x480    59.940476 Hz   4:3     31.469 kHz     25.175000 MHz
    VIC   2:   720x480    59.940060 Hz   4:3     31.469 kHz     27.000000 MHz
    VIC   3:   720x480    59.940060 Hz  16:9     31.469 kHz     27.000000 MHz
    VIC   4:  1280x720    60.000000 Hz  16:9     45.000 kHz     74.250000 MHz
    VIC   5:  1920x1080i  60.000000 Hz  16:9     33.750 kHz     74.250000 MHz
    VIC   6:  1440x480i   59.940060 Hz   4:3     15.734 kHz     27.000000 MHz
    VIC   7:  1440x480i   59.940060 Hz  16:9     15.734 kHz     27.000000 MHz
    VIC  16:  1920x1080   60.000000 Hz  16:9     67.500 kHz    148.500000 MHz (native)
    VIC  17:   720x576    50.000000 Hz   4:3     31.250 kHz     27.000000 MHz
    VIC  18:   720x576    50.000000 Hz  16:9     31.250 kHz     27.000000 MHz
    VIC  19:  1280x720    50.000000 Hz  16:9     37.500 kHz     74.250000 MHz
    VIC  22:  1440x576i   50.000000 Hz  16:9     15.625 kHz     27.000000 MHz
    VIC  21:  1440x576i   50.000000 Hz   4:3     15.625 kHz     27.000000 MHz
    VIC  31:  1920x1080   50.000000 Hz  16:9     56.250 kHz    148.500000 MHz
    VIC  20:  1920x1080i  50.000000 Hz  16:9     28.125 kHz     74.250000 MHz
    VIC  32:  1920x1080   24.000000 Hz  16:9     27.000 kHz     74.250000 MHz
    VIC  33:  1920x1080   25.000000 Hz  16:9     28.125 kHz     74.250000 MHz
  Audio Data Block:
    Linear PCM:
      Max channels: 2
      Supported sample rates (kHz): 192 176.4 96 88.2 48 44.1 32
      Supported sample sizes (bits): 24 20 16
  Speaker Allocation Data Block:
    FL/FR - Front Left/Right
  Vendor-Specific Data Block (HDMI), OUI 00-0C-03:
    Source physical address: 1.0.0.0
    Maximum TMDS clock: 150 MHz
    Video latency: 0 ms
    Audio latency: 0 ms
    Interlaced video latency: 0 ms
    Interlaced audio latency: 0 ms
  Detailed Timing Descriptors:
    DTD  7:   720x480    59.940060 Hz   3:2     31.469 kHz     27.000000 MHz (930 mm x 523 mm)
                  Hfront   16 Hsync  62 Hback   60 Hpol N
                  Vfront    9 Vsync   6 Vback   30 Vpol N
    DTD  8:  1920x1080   60.000000 Hz  16:9     67.500 kHz    148.500000 MHz (930 mm x 523 mm)
                  Hfront   88 Hsync  44 Hback  148 Hpol P
                  Vfront    2 Vsync   5 Vback   38 Vpol P
    DTD  9:  1920x1080i  57.643040 Hz  16:9     33.750 kHz     74.250000 MHz (930 mm x 523 mm)
                  Hfront   88 Hsync  44 Hback  148 Hpol P
                  Vfront    2 Vsync   5 Vback   38 Vpol P Vfront +0.5 Odd Field
                  Vfront    2 Vsync   5 Vback   38 Vpol P Vback  +0.5 Even Field
    DTD 10:  1920x1080i  48.035867 Hz  16:9     28.125 kHz     74.250000 MHz (930 mm x 523 mm)
                  Hfront  528 Hsync  44 Hback  148 Hpol P
                  Vfront    4 Vsync   3 Vback   38 Vpol P Vfront +0.5 Odd Field
                  Vfront    4 Vsync   3 Vback   38 Vpol P Vback  +0.5 Even Field
Checksum: 0x57  Unused space in Extension Block: 12 bytes

----------------

Warnings:

Block 1, CTA-861 Extension Block:
  Vendor-Specific Data Block (HDMI), OUI 00-0C-03: Progressive and Interlaced latency values are identical, no need for both.
  Detailed Timing Descriptor #4: DTD is similar but not identical to VIC 16.
  Add a Colorimetry Data Block with the sRGB colorimetry bit set to avoid interop issues.
Block 3, CTA-861 Extension Block:
  Vendor-Specific Data Block (HDMI), OUI 00-0C-03: Progressive and Interlaced latency values are identical, no need for both.
  Detailed Timing Descriptor #8: DTD is similar but not identical to VIC 16.
  Add a Colorimetry Data Block with the sRGB colorimetry bit set to avoid interop issues.

Failures:

Block 1, CTA-861 Extension Block:
  Missing VCDB, needed for Set Selectable RGB Quantization to avoid interop issues.
Block 2, Base EDID:
  Unknown Extension Block.
Block 3, CTA-861 Extension Block:
  Video Data Block: Duplicate VIC 1.
  Video Data Block: Duplicate VIC 2.
  Video Data Block: Duplicate VIC 3.
  Video Data Block: Duplicate VIC 4.
  Video Data Block: Duplicate VIC 5.
  Video Data Block: Duplicate VIC 6.
  Video Data Block: Duplicate VIC 7.
  Video Data Block: Duplicate VIC 16.
  Video Data Block: Duplicate VIC 17.
  Video Data Block: Duplicate VIC 18.
  Video Data Block: Duplicate VIC 19.
  Video Data Block: Duplicate VIC 22.
  Video Data Block: Duplicate VIC 21.
  Video Data Block: Duplicate VIC 31.
  Video Data Block: Duplicate VIC 20.
  Video Data Block: Duplicate VIC 32.
  Video Data Block: Duplicate VIC 33.
  Speaker Allocation Data Block: Only one instance of this Data Block is allowed.
  Missing VCDB, needed for Set Selectable RGB Quantization to avoid interop issues.
EDID:
  Base EDID: Some timings are out of range of the Monitor Ranges:
    Vertical Freq: 24.000 - 75.029 Hz (Monitor: 55.000 - 76.000 Hz)
  Base EDID: EDID specified 1 extension block(s), but found 3 extension block(s).
  Base EDID: EDID 1.3 requires a Block Map Extension in Block 1 if there are more than 2 blocks in the EDID.
  CTA-861: Native progressive timings are a mix of several resolutions.

EDID conformity: FAIL
