
EDID (hex):
00ffffffffffff006318512800000100
141d0103807944780a6945aa5144a526
0f50542108008140a940818081c0a9c0
01010101010108e80030f2705a80b058
8a00b9a84200001e6fc200a0a0a05550
3020350056502100001e000000fc0042
65796f6e642054560a202020000000fd
00324b1e503c000a20202020202001df
020370f05566656462615f5d101f2220
051404130302065e113f320907071517
505517016704033d07c05f7e01830100
00e200cb6e030c001000b84421008001
02030468d85dc40178880702e305e301
e20f11e3060f01eb0146d0004d4e5284
4e6e87e5018b849001e61146d0007080
000000000000000000000000000000ec

edid-decode (hex):

00 ff ff ff ff ff ff 00 63 18 51 28 00 00 01 00
14 1d 01 03 80 79 44 78 0a 69 45 aa 51 44 a5 26
0f 50 54 21 08 00 81 40 a9 40 81 80 81 c0 a9 c0
01 01 01 01 01 01 08 e8 00 30 f2 70 5a 80 b0 58
8a 00 b9 a8 42 00 00 1e 6f c2 00 a0 a0 a0 55 50
30 20 35 00 56 50 21 00 00 1e 00 00 00 fc 00 42
65 79 6f 6e 64 20 54 56 0a 20 20 20 00 00 00 fd
00 32 4b 1e 50 3c 00 0a 20 20 20 20 20 20 01 df

02 03 70 f0 55 66 65 64 62 61 5f 5d 10 1f 22 20
05 14 04 13 03 02 06 5e 11 3f 32 09 07 07 15 17
50 55 17 01 67 04 03 3d 07 c0 5f 7e 01 83 01 00
00 e2 00 cb 6e 03 0c 00 10 00 b8 44 21 00 80 01
02 03 04 68 d8 5d c4 01 78 88 07 02 e3 05 e3 01
e2 0f 11 e3 06 0f 01 eb 01 46 d0 00 4d 4e 52 84
4e 6e 87 e5 01 8b 84 90 01 e6 11 46 d0 00 70 80
00 00 00 00 00 00 00 00 00 00 00 00 00 00 00 ec

----------------

Block 0, Base EDID:
  EDID Structure Version & Revision: 1.3
  Vendor & Product Identification:
    Manufacturer: XXX
    Model: 10321
    Serial Number: 65536
    Made in: week 20 of 2019
  Basic Display Parameters & Features:
    Digital display
    Maximum image size: 121 cm x 68 cm
    Gamma: 2.20
    RGB color display
    First detailed timing is the preferred timing
  Color Characteristics:
    Red  : 0.6650, 0.3183
    Green: 0.2675, 0.6455
    Blue : 0.1494, 0.0585
    White: 0.3134, 0.3291
  Established Timings I & II:
    DMT 0x04:   640x480    59.940476 Hz   4:3     31.469 kHz     25.175000 MHz
    DMT 0x09:   800x600    60.316541 Hz   4:3     37.879 kHz     40.000000 MHz
    DMT 0x10:  1024x768    60.003840 Hz   4:3     48.363 kHz     65.000000 MHz
  Standard Timings:
    DMT 0x20:  1280x960    60.000000 Hz   4:3     60.000 kHz    108.000000 MHz
    DMT 0x33:  1600x1200   60.000000 Hz   4:3     75.000 kHz    162.000000 MHz
    DMT 0x23:  1280x1024   60.019740 Hz   5:4     63.981 kHz    108.000000 MHz
    DMT 0x55:  1280x720    60.000000 Hz  16:9     45.000 kHz     74.250000 MHz
    DMT 0x53:  1600x900    60.000000 Hz  16:9     60.000 kHz    108.000000 MHz (RB)
  Detailed Timing Descriptors:
    DTD 1:  3840x2160   60.000000 Hz  16:9    135.000 kHz    594.000000 MHz (1209 mm x 680 mm)
                 Hfront  176 Hsync  88 Hback  296 Hpol P
                 Vfront    8 Vsync  10 Vback   72 Vpol P
    DTD 2:  2560x1440  119.997589 Hz  16:9    182.996 kHz    497.750000 MHz (598 mm x 336 mm)
                 Hfront   48 Hsync  32 Hback   80 Hpol P
                 Vfront    3 Vsync   5 Vback   77 Vpol P
    Display Product Name: 'Beyond TV'
    Display Range Limits:
      Monitor ranges (GTF): 50-75 Hz V, 30-80 kHz H, max dotclock 600 MHz
  Extension blocks: 1
Checksum: 0xdf

----------------

Block 1, CTA-861 Extension Block:
  Revision: 3
  Underscans IT Video Formats by default
  Basic audio support
  Supports YCbCr 4:4:4
  Supports YCbCr 4:2:2
  Native detailed modes: 0
  Video Data Block:
    VIC 102:  4096x2160   60.000000 Hz 256:135  135.000 kHz    594.000000 MHz
    VIC 101:  4096x2160   50.000000 Hz 256:135  112.500 kHz    594.000000 MHz
    VIC 100:  4096x2160   30.000000 Hz 256:135   67.500 kHz    297.000000 MHz
    VIC  98:  4096x2160   24.000000 Hz 256:135   54.000 kHz    297.000000 MHz
    VIC  97:  3840x2160   60.000000 Hz  16:9    135.000 kHz    594.000000 MHz
    VIC  95:  3840x2160   30.000000 Hz  16:9     67.500 kHz    297.000000 MHz
    VIC  93:  3840x2160   24.000000 Hz  16:9     54.000 kHz    297.000000 MHz
    VIC  16:  1920x1080   60.000000 Hz  16:9     67.500 kHz    148.500000 MHz
    VIC  31:  1920x1080   50.000000 Hz  16:9     56.250 kHz    148.500000 MHz
    VIC  34:  1920x1080   30.000000 Hz  16:9     33.750 kHz     74.250000 MHz
    VIC  32:  1920x1080   24.000000 Hz  16:9     27.000 kHz     74.250000 MHz
    VIC   5:  1920x1080i  60.000000 Hz  16:9     33.750 kHz     74.250000 MHz
    VIC  20:  1920x1080i  50.000000 Hz  16:9     28.125 kHz     74.250000 MHz
    VIC   4:  1280x720    60.000000 Hz  16:9     45.000 kHz     74.250000 MHz
    VIC  19:  1280x720    50.000000 Hz  16:9     37.500 kHz     74.250000 MHz
    VIC   3:   720x480    59.940060 Hz  16:9     31.469 kHz     27.000000 MHz
    VIC   2:   720x480    59.940060 Hz   4:3     31.469 kHz     27.000000 MHz
    VIC   6:  1440x480i   59.940060 Hz   4:3     15.734 kHz     27.000000 MHz
    VIC  94:  3840x2160   25.000000 Hz  16:9     56.250 kHz    297.000000 MHz
    VIC  17:   720x576    50.000000 Hz   4:3     31.250 kHz     27.000000 MHz
    VIC  63:  1920x1080  120.000000 Hz  16:9    135.000 kHz    297.000000 MHz
  Audio Data Block:
    Linear PCM:
      Max channels: 2
      Supported sample rates (kHz): 48 44.1 32
      Supported sample sizes (bits): 24 20 16
    AC-3:
      Max channels: 6
      Supported sample rates (kHz): 96 48 44.1 32
      Maximum bit rate: 640 kb/s
    Enhanced AC-3 (DD+):
      Max channels: 6
      Supported sample rates (kHz): 96 48 44.1 32
      Supports Joint Object Coding
    MAT (MLP):
      Max channels: 8
      Supported sample rates (kHz): 48
      Supports Dolby TrueHD, object audio PCM and channel-based PCM
      Hash calculation not required for object audio PCM or channel-based PCM
    DTS:
      Max channels: 6
      Supported sample rates (kHz): 48 44.1 32
      Maximum bit rate: 1536 kb/s
    DTS-HD:
      Max channels: 8
      Supported sample rates (kHz): 192 176.4 96 88.2 48 44.1
      Audio Format Code dependent value: 0x01
  Speaker Allocation Data Block:
    FL/FR - Front Left/Right
  Video Capability Data Block:
    YCbCr quantization: Selectable (via AVI YQ)
    RGB quantization: Selectable (via AVI Q)
    PT scan behavior: No Data
    IT scan behavior: Always Underscanned
    CE scan behavior: Supports both over- and underscan
  Vendor-Specific Data Block (HDMI), OUI 00-0C-03:
    Source physical address: 1.0.0.0
    Supports_AI
    DC_36bit
    DC_30bit
    DC_Y444
    Maximum TMDS clock: 340 MHz
    Supported Content Types:
      Graphics
    Extended HDMI video details:
      HDMI VICs:
        HDMI VIC 1:  3840x2160   30.000000 Hz  16:9     67.500 kHz    297.000000 MHz
        HDMI VIC 2:  3840x2160   25.000000 Hz  16:9     56.250 kHz    297.000000 MHz
        HDMI VIC 3:  3840x2160   24.000000 Hz  16:9     54.000 kHz    297.000000 MHz
        HDMI VIC 4:  4096x2160   24.000000 Hz 256:135   54.000 kHz    297.000000 MHz
  Vendor-Specific Data Block (HDMI Forum), OUI C4-5D-D8:
    Version: 1
    Maximum TMDS Character Rate: 600 MHz
    SCDC Present
    Supports scrambling for <= 340 Mcsc
    Supports 16-bits/component Deep Color 4:2:0 Pixel Encoding
    Supports 12-bits/component Deep Color 4:2:0 Pixel Encoding
    Supports 10-bits/component Deep Color 4:2:0 Pixel Encoding
    Supports Auto Low-Latency Mode
  Colorimetry Data Block:
    xvYCC601
    xvYCC709
    BT2020cYCC
    BT2020YCC
    BT2020RGB
    Gamut Boundary Description Metadata Profile P0
  YCbCr 4:2:0 Capability Map Data Block:
    VIC 102:  4096x2160   60.000000 Hz 256:135  135.000 kHz    594.000000 MHz
    VIC  97:  3840x2160   60.000000 Hz  16:9    135.000 kHz    594.000000 MHz
  HDR Static Metadata Data Block:
    Electro optical transfer functions:
      Traditional gamma - SDR luminance range
      Traditional gamma - HDR luminance range
      SMPTE ST2084
      Hybrid Log-Gamma
    Supported static metadata descriptors:
      Static metadata type 1
  Vendor-Specific Video Data Block (Dolby), OUI 00-D0-46:
    Version: 2 (12 bytes)
    Supports YUV422 12 bit
    Supports global dimming
    DM Version: 5.x
    Backlt Min Luma: 75 cd/m^2
    Interface: Standard + Low-Latency
    Supports 10b 12b 444: Not supported
    Target Min PQ v2: 180 (0.04555910 cd/m^2)
    Target Max PQ v2: 2705 (447 cd/m^2)
    Unique Rx, Ry: 0.67578125, 0.31250000
    Unique Gx, Gy: 0.25781250, 0.65234375
    Unique Bx, By: 0.14843750, 0.05859375
  Vendor-Specific Video Data Block (HDR10+), OUI 90-84-8B:
    Application Version: 1
  Vendor-Specific Audio Data Block (Dolby), OUI 00-D0-46:
    Version: 1 (7 bytes)
    Height speaker zone present
    Surround speaker zone present
    Center speaker zone present
Checksum: 0xec  Unused space in Extension Block: 15 bytes
