
EDID (hex):
00ffffffffffff0022f05a2801010000
1e130103802f1b780a3585a656489a24
12505400000001010101010101010101
0101010101012035808c703814403c3c
a800d60e11000018000000fe005a4e36
0a202020202020202020000000fe0048
500a20202020202020202020000000fe
004d323135485730310a202020200090

Extracted contents:
header:          00 ff ff ff ff ff ff 00
serial number:   22 f0 5a 28 01 01 00 00 1e 13
version:         01 03
basic params:    80 2f 1b 78 0a
chroma info:     35 85 a6 56 48 9a 24 12 50 54
established:     00 00 00
standard:        01 01 01 01 01 01 01 01 01 01 01 01 01 01 01 01
descriptor 1:    20 35 80 8c 70 38 14 40 3c 3c a8 00 d6 0e 11 00 00 18
descriptor 2:    00 00 00 fe 00 5a 4e 36 0a 20 20 20 20 20 20 20 20 20
descriptor 3:    00 00 00 fe 00 48 50 0a 20 20 20 20 20 20 20 20 20 20
descriptor 4:    00 00 00 fe 00 4d 32 31 35 48 57 30 31 0a 20 20 20 20
extensions:      00
checksum:        90

EDID version: 1.3
Manufacturer: HWP Model 285a Serial Number --
Made in week 30 of 2009
Digital display
Maximum image size: 47 cm x 27 cm
Gamma: 2.20
RGB color display
First detailed timing is preferred timing
Display x,y Chromaticity:
  Red:   0.6484, 0.3388
  Green: 0.2822, 0.6025
  Blue:  0.1425, 0.0703
  White: 0.3134, 0.3291
Established timings supported:
Standard timings supported:
Detailed mode: Clock 136.000 MHz, 470 mm x 270 mm
               1920 1980 2040 2060 hborder 0
               1080 1090 1098 1100 vborder 0
               -hsync -vsync 
               VertFreq: 60 Hz, HorFreq: 66019 Hz
ASCII string: ZN6
ASCII string: HP
ASCII string: M215HW01
Checksum: 0x90 (valid)
EDID block does NOT conform to EDID 1.3!
	Missing name descriptor
	Missing monitor ranges
