
EDID (hex):
00ffffffffffff0006afd11200000000
0112010380160d780a11b59758579326
1e505400000001010101010101010101
0101010101012c150040414060203020
4400df7d000000180000000f00000000
00000000000000000020000000fe0041
554f0a202020202020202020000000fe
004231303141573031205632200a0038

Extracted contents:
header:          00 ff ff ff ff ff ff 00
serial number:   06 af d1 12 00 00 00 00 01 12
version:         01 03
basic params:    80 16 0d 78 0a
chroma info:     11 b5 97 58 57 93 26 1e 50 54
established:     00 00 00
standard:        01 01 01 01 01 01 01 01 01 01 01 01 01 01 01 01
descriptor 1:    2c 15 00 40 41 40 60 20 30 20 44 00 df 7d 00 00 00 18
descriptor 2:    00 00 00 0f 00 00 00 00 00 00 00 00 00 00 00 00 00 20
descriptor 3:    00 00 00 fe 00 41 55 4f 0a 20 20 20 20 20 20 20 20 20
descriptor 4:    00 00 00 fe 00 42 31 30 31 41 57 30 31 20 56 32 20 0a
extensions:      00
checksum:        38

EDID version: 1.3
Manufacturer: AUO Model 12d1 Serial Number --
Made in week 1 of 2008
Digital display
Maximum image size: 22 cm x 13 cm
Gamma: 2.20
RGB color display
First detailed timing is preferred timing
Display x,y Chromaticity:
  Red:   0.5898, 0.3447
  Green: 0.3398, 0.5751
  Blue:  0.1503, 0.1201
  White: 0.3134, 0.3291
Established timings supported:
Standard timings supported:
Detailed mode: Clock 54.200 MHz, 223 mm x 125 mm
               1024 1072 1104 1344 hborder 0
                576  580  584  672 vborder 0
               -hsync -vsync 
               VertFreq: 60 Hz, HorFreq: 40327 Hz
Manufacturer-specified data, tag 15
ASCII string: AUO
ASCII string: B101AW01 V2 
Checksum: 0x38 (valid)
EDID block does NOT conform to EDID 1.3!
	Missing name descriptor
	Missing monitor ranges
