
EDID (hex):
00ffffffffffff0030aeb26233333652
01200104a5351e783ef735a7554fa325
0c5054bdcf008180818a9500b300d1c0
d100714f8100565e00a0a0a029503020
35000f282100001a000000ff00563330
38523633330a20202020000000fd0030
4b1e721e010a202020202020000000fc
00503234682d324c0a20202020200113
02031cf1490102030413901f12112309
07078301000065030c002000cc7400a0
a0a01e50302035000f282100001a6621
56aa51001e30468f33000f282100001e
483f403062b0324040c013000f282100
001e0000000000000000000000000000
00000000000000000000000000000000
00000000000000000000000000000037

Extracted contents:
header:          00 ff ff ff ff ff ff 00
serial number:   30 ae b2 62 33 33 36 52 01 20
version:         01 04
basic params:    a5 35 1e 78 3e
chroma info:     f7 35 a7 55 4f a3 25 0c 50 54
established:     bd cf 00
standard:        81 80 81 8a 95 00 b3 00 d1 c0 d1 00 71 4f 81 00
descriptor 1:    56 5e 00 a0 a0 a0 29 50 30 20 35 00 0f 28 21 00 00 1a
descriptor 2:    00 00 00 ff 00 56 33 30 38 52 36 33 33 0a 20 20 20 20
descriptor 3:    00 00 00 fd 00 30 4b 1e 72 1e 01 0a 20 20 20 20 20 20
descriptor 4:    00 00 00 fc 00 50 32 34 68 2d 32 4c 0a 20 20 20 20 20
extensions:      01
checksum:        13

EDID version: 1.4
Manufacturer: LEN Model 62b2 Serial Number --
Made in week 1 of 2022
Digital display
8 bits per primary color channel
DisplayPort interface
Maximum image size: 53 cm x 30 cm
Gamma: 2.20
DPMS levels: Off
Supported color formats: RGB 4:4:4, YCrCb 4:4:4, YCrCb 4:2:2
Default (sRGB) color space is primary color space
First detailed timing includes the native pixel format and preferred refresh rate
Display x,y Chromaticity:
  Red:   0.6552, 0.3349
  Green: 0.3095, 0.6396
  Blue:  0.1445, 0.0498
  White: 0.3134, 0.3291
Established timings supported:
  720x400@70Hz 9:5 HorFreq: 31469 Hz Clock: 28.320 MHz
  640x480@60Hz 4:3 HorFreq: 31469 Hz Clock: 25.175 MHz
  640x480@67Hz 4:3 HorFreq: 35000 Hz Clock: 30.240 MHz
  640x480@72Hz 4:3 HorFreq: 37900 Hz Clock: 31.500 MHz
  640x480@75Hz 4:3 HorFreq: 37500 Hz Clock: 31.500 MHz
  800x600@60Hz 4:3 HorFreq: 37900 Hz Clock: 40.000 MHz
  800x600@72Hz 4:3 HorFreq: 48100 Hz Clock: 50.000 MHz
  800x600@75Hz 4:3 HorFreq: 46900 Hz Clock: 49.500 MHz
  1024x768@60Hz 4:3 HorFreq: 48400 Hz Clock: 65.000 MHz
  1024x768@70Hz 4:3 HorFreq: 56500 Hz Clock: 75.000 MHz
  1024x768@75Hz 4:3 HorFreq: 60000 Hz Clock: 78.750 MHz
  1280x1024@75Hz 5:4 HorFreq: 80000 Hz Clock: 135.000 MHz
Standard timings supported:
  1280x1024@60Hz 5:4 HorFreq: 64000 Hz Clock: 108.000 MHz
  1280x1024@70Hz 5:4
  1440x900@60Hz 16:10 HorFreq: 55500 Hz Clock: 88.750 MHz
  1680x1050@60Hz 16:10 HorFreq: 64700 Hz Clock: 119.000 MHz
  1920x1080@60Hz 16:9
  1920x1200@60Hz 16:10 HorFreq: 74000 Hz Clock: 154.000 MHz
  1152x864@75Hz 4:3 HorFreq: 67500 Hz Clock: 108.000 MHz
  1280x800@60Hz 16:10
Detailed mode: Clock 241.500 MHz, 527 mm x 296 mm
               2560 2608 2640 2720 hborder 0
               1440 1443 1448 1481 vborder 0
               +hsync -vsync 
               VertFreq: 59 Hz, HorFreq: 88786 Hz
Serial number: --
Monitor ranges (bare limits): 48-75Hz V, 30-114kHz H, max dotclock 300MHz
Monitor name: P24h-2L
Has 1 extension blocks
Checksum: 0x13 (valid)

CTA extension block
Extension version: 3
24 bytes of CTA data
  Video data block
    VIC   1 640x480@60Hz 4:3  HorFreq: 31469 Hz Clock: 25.175 MHz
    VIC   2 720x480@60Hz 4:3  HorFreq: 31469 Hz Clock: 27.000 MHz
    VIC   3 720x480@60Hz 16:9  HorFreq: 31469 Hz Clock: 27.000 MHz
    VIC   4 1280x720@60Hz 16:9  HorFreq: 45000 Hz Clock: 74.250 MHz
    VIC  19 1280x720@50Hz 16:9  HorFreq: 37500 Hz Clock: 74.250 MHz
    VIC  16 1920x1080@60Hz 16:9 (native) HorFreq: 67500 Hz Clock: 148.500 MHz
    VIC  31 1920x1080@50Hz 16:9  HorFreq: 56250 Hz Clock: 148.500 MHz
    VIC  18 720x576@50Hz 16:9  HorFreq: 31250 Hz Clock: 27.000 MHz
    VIC  17 720x576@50Hz 4:3  HorFreq: 31250 Hz Clock: 27.000 MHz
  Audio data block
    Linear PCM, max channels 2
      Supported sample rates (kHz): 48 44.1 32
      Supported sample sizes (bits): 24 20 16
  Speaker allocation data block
    Speaker map:
      FL/FR - Front Left/Right
  Vendor-specific data block, OUI 000c03 (HDMI)
    Source physical address 2.0.0.0
Underscans PC formats by default
Basic audio support
Supports YCbCr 4:4:4
Supports YCbCr 4:2:2
1 native detailed modes
Detailed mode: Clock 299.000 MHz, 527 mm x 296 mm
               2560 2608 2640 2720 hborder 0
               1440 1443 1448 1470 vborder 0
               +hsync -vsync 
               VertFreq: 74 Hz, HorFreq: 109926 Hz
Detailed mode: Clock 85.500 MHz, 527 mm x 296 mm
               1366 1436 1579 1792 hborder 0
                768  771  774  798 vborder 0
               +hsync +vsync 
               VertFreq: 59 Hz, HorFreq: 47712 Hz
Detailed mode: Clock 162.000 MHz, 527 mm x 296 mm
               1600 1664 1856 2160 hborder 0
               1200 1201 1204 1250 vborder 0
               +hsync +vsync 
               VertFreq: 60 Hz, HorFreq: 75000 Hz
Checksum: 0x37 (valid)

EDID block does NOT conform to EDID 1.4!
	sRGB is signaled, but the chromaticities do not match
EDID block does not conform at all!
	Both the serial number and the serial string are set


