edid-decode (hex):

00 ff ff ff ff ff ff 00 24 4d 53 1a 01 01 01 01
26 0f 01 03 68 24 1b cb ea 7c 58 a3 53 47 9a 24
10 48 4c ad 67 00 31 59 45 59 61 59 81 99 a9 4f
01 01 01 01 01 01 86 3d 00 c0 51 00 30 40 40 a0
13 00 68 00 11 00 00 1e 00 00 00 ff 00 56 35 2d
31 38 39 35 33 0a 20 20 20 20 00 00 00 fc 00 49
42 4d 20 43 31 39 30 20 43 52 54 0a 00 00 00 fd
00 32 a0 1e 60 15 00 0a 20 20 20 20 20 20 00 e5

00 ff ff ff ff ff ff 00 24 4d 53 1a 01 01 01 01
26 0f 01 03 68 24 1b cb ea 7c 58 a3 53 47 9a 24
10 48 4c ad 67 00 31 59 45 59 61 59 81 99 a9 4f
01 01 01 01 01 01 86 3d 00 c0 51 00 30 40 40 a0
13 00 68 00 11 00 00 1e 00 00 00 ff 00 56 35 2d
31 38 39 35 33 0a 20 20 20 20 00 00 00 fc 00 49
42 4d 20 43 31 39 30 20 43 52 54 0a 00 00 00 fd
00 32 a0 1e 60 15 00 0a 20 20 20 20 20 20 00 e5

----------------

Block 0, Base EDID:
  EDID Structure Version & Revision: 1.3
  Vendor & Product Identification:
    Manufacturer: IBM
    Model: 6739
    Serial Number: ...
    Made in: week 38 of 2005
  Basic Display Parameters & Features:
    Analog display
    Signal Level Standard: 0.700 : 0.000 : 0.700 V p-p
    Blank level equals black level
    Sync: Separate
    Maximum image size: 36 cm x 27 cm
    Gamma: 3.03
    DPMS levels: Standby Suspend Off
    RGB color display
    First detailed timing is the preferred timing
  Color Characteristics:
    Red  : 0.6376, 0.3271
    Green: 0.2802, 0.6015
    Blue : 0.1416, 0.0634
    White: 0.2832, 0.2968
  Established Timings I & II:
    IBM     :   720x400    70.081663 Hz   9:5     31.467 kHz     28.320000 MHz
    DMT 0x04:   640x480    59.940476 Hz   4:3     31.469 kHz     25.175000 MHz
    DMT 0x05:   640x480    72.808802 Hz   4:3     37.861 kHz     31.500000 MHz
    DMT 0x06:   640x480    75.000000 Hz   4:3     37.500 kHz     31.500000 MHz
    DMT 0x09:   800x600    60.316541 Hz   4:3     37.879 kHz     40.000000 MHz
    DMT 0x0b:   800x600    75.000000 Hz   4:3     46.875 kHz     49.500000 MHz
    Apple   :   832x624    74.551266 Hz   4:3     49.726 kHz     57.284000 MHz
    DMT 0x11:  1024x768    70.069359 Hz   4:3     56.476 kHz     75.000000 MHz
    DMT 0x12:  1024x768    75.028582 Hz   4:3     60.023 kHz     78.750000 MHz
    DMT 0x24:  1280x1024   75.024675 Hz   5:4     79.976 kHz    135.000000 MHz
  Standard Timings:
    DMT 0x07:   640x480    85.008312 Hz   4:3     43.269 kHz     36.000000 MHz
    DMT 0x0c:   800x600    85.061274 Hz   4:3     53.674 kHz     56.250000 MHz
    DMT 0x13:  1024x768    84.996690 Hz   4:3     68.677 kHz     94.500000 MHz
    DMT 0x25:  1280x1024   85.024098 Hz   5:4     91.146 kHz    157.500000 MHz
    DMT 0x36:  1600x1200   75.000000 Hz   4:3     93.750 kHz    202.500000 MHz
  Detailed Timing Descriptors:
    DTD 1:  1280x1024   85.024098 Hz   5:4     91.146 kHz    157.500000 MHz (360 mm x 256 mm)
                 Hfront   64 Hsync 160 Hback  224 Hpol P
                 Vfront    1 Vsync   3 Vback   44 Vpol P
    Display Product Serial Number: ...
    Display Product Name: 'IBM C190 CRT'
    Display Range Limits:
      Monitor ranges (GTF): 50-160 Hz V, 30-96 kHz H, max dotclock 210 MHz
Checksum: 0xe5

----------------

Block 1, Unknown EDID Extension Block 0x00:
  00 ff ff ff ff ff ff 00 24 4d 53 1a 01 01 01 01 '........$MS.....'
  26 0f 01 03 68 24 1b cb ea 7c 58 a3 53 47 9a 24 '&...h$...|X.SG.$'
  10 48 4c ad 67 00 31 59 45 59 61 59 81 99 a9 4f '.HL.g.1YEYaY...O'
  01 01 01 01 01 01 86 3d 00 c0 51 00 30 40 40 a0 '.......=..Q.0@@.'
  13 00 68 00 11 00 00 1e 00 00 00 ff 00 56 35 2d '..h..........V5-'
  31 38 39 35 33 0a 20 20 20 20 00 00 00 fc 00 49 '18953.    .....I'
  42 4d 20 43 31 39 30 20 43 52 54 0a 00 00 00 fd 'BM C190 CRT.....'
  00 32 a0 1e 60 15 00 0a 20 20 20 20 20 20 00 e5 '.2..`...      ..'
Checksum: 0xe5

----------------

Failures:

Block 1, Base EDID:
  Unknown Extension Block.
EDID:
  Base EDID: EDID specified 0 extension block(s), but found 1 extension block(s).

EDID conformity: FAIL
