
EDID (hex):
00ffffffffffff00046940e301010101
03140103803b2178eee984a555489b26
125054a10800814081809500b3000101
010101010101023a801871382d40582c
450055502100001e000000fd00304c18
5e09000a202020202020000000fc0045
5432373030490a2020202020000000ff
00415355533131393339303030340084

Extracted contents:
header:          00 ff ff ff ff ff ff 00
serial number:   04 69 40 e3 01 01 01 01 03 14
version:         01 03
basic params:    80 3b 21 78 ee
chroma info:     e9 84 a5 55 48 9b 26 12 50 54
established:     a1 08 00
standard:        81 40 81 80 95 00 b3 00 01 01 01 01 01 01 01 01
descriptor 1:    02 3a 80 18 71 38 2d 40 58 2c 45 00 55 50 21 00 00 1e
descriptor 2:    00 00 00 fd 00 30 4c 18 5e 09 00 0a 20 20 20 20 20 20
descriptor 3:    00 00 00 fc 00 45 54 32 37 30 30 49 0a 20 20 20 20 20
descriptor 4:    00 00 00 ff 00 41 53 55 53 31 31 39 33 39 30 30 30 34
extensions:      00
checksum:        84

EDID version: 1.3
Manufacturer: ACI Model e340 Serial Number --
Made in week 3 of 2010
Digital display
Maximum image size: 59 cm x 33 cm
Gamma: 2.20
DPMS levels: Standby Suspend Off
RGB color display
Default (sRGB) color space is primary color space
First detailed timing is preferred timing
Display x,y Chromaticity:
  Red:   0.6474, 0.3339
  Green: 0.2832, 0.6064
  Blue:  0.1503, 0.0703
  White: 0.3134, 0.3281
Established timings supported:
  720x400@70Hz 9:5 HorFreq: 31469 Hz Clock: 28.320 MHz
  640x480@60Hz 4:3 HorFreq: 31469 Hz Clock: 25.175 MHz
  800x600@60Hz 4:3 HorFreq: 37900 Hz Clock: 40.000 MHz
  1024x768@60Hz 4:3 HorFreq: 48400 Hz Clock: 65.000 MHz
Standard timings supported:
  1280x960@60Hz 4:3 HorFreq: 60000 Hz Clock: 108.000 MHz
  1280x1024@60Hz 5:4 HorFreq: 64000 Hz Clock: 108.000 MHz
  1440x900@60Hz 16:10 HorFreq: 55500 Hz Clock: 88.750 MHz
  1680x1050@60Hz 16:10 HorFreq: 64700 Hz Clock: 119.000 MHz
Detailed mode: Clock 148.500 MHz, 597 mm x 336 mm
               1920 2008 2052 2200 hborder 0
               1080 1084 1089 1125 vborder 0
               +hsync +vsync 
               VertFreq: 60 Hz, HorFreq: 67500 Hz
Monitor ranges (GTF): 48-76Hz V, 24-94kHz H, max dotclock 90MHz
Monitor name: ET2700I
Serial number: --
Checksum: 0x84 (valid)
EDID block does NOT conform to EDID 1.3!
	sRGB is signaled, but the chromaticities do not match
One or more of the timings is out of range of the Monitor Ranges:
  Vertical Freq: 60 - 70 Hz
  Horizontal Freq: 31469 - 67500 Hz
  Maximum Clock: 148.500 MHz
