edid-decode (hex):

00 ff ff ff ff ff ff 00 30 e4 45 01 00 00 00 00
00 12 01 03 90 1d 12 78 0a df 45 95 5a 54 8d 26
1d 50 54 00 00 00 01 01 01 01 01 01 01 01 01 01
01 01 01 01 01 01 f4 1a 00 82 50 20 10 30 30 20
36 00 1e b3 10 00 00 18 f4 1a 00 82 50 20 10 30
30 20 36 00 1e b3 10 00 00 18 00 00 00 fe 00 58
32 38 33 43 80 31 33 33 57 58 32 0a 00 00 00 fe
00 08 0e 14 19 33 66 a1 ff 01 01 0a 20 20 00 ee

----------------

Block 0, Base EDID:
  EDID Structure Version & Revision: 1.3
  Vendor & Product Identification:
    Manufacturer: LGD
    Model: 325
    Made in: 2008
  Basic Display Parameters & Features:
    Digital display
    Maximum image size: 29 cm x 18 cm
    Gamma: 2.20
    RGB color display
    First detailed timing is the preferred timing
  Color Characteristics:
    Red  : 0.5849, 0.3525
    Green: 0.3310, 0.5537
    Blue : 0.1494, 0.1132
    White: 0.3134, 0.3291
  Established Timings I & II: none
  Standard Timings: none
  Detailed Timing Descriptors:
    DTD 1:  1280x800    59.970797 Hz  16:10    48.936 kHz     69.000000 MHz (286 mm x 179 mm)
                 Hfront   48 Hsync  32 Hback   50 Hpol N
                 Vfront    3 Vsync   6 Vback    7 Vpol N
    DTD 2:  1280x800    59.970797 Hz  16:10    48.936 kHz     69.000000 MHz (286 mm x 179 mm)
                 Hfront   48 Hsync  32 Hback   50 Hpol N
                 Vfront    3 Vsync   6 Vback    7 Vpol N
    SPWG Module Revision: 24
    SPWG Descriptor #3:
      SPWG PC Maker P/N: 'X283C'
      SPWG LCD Supplier EEDID Revision: 128
      SPWG Manufacturer P/N: '133WX2'
    SPWG Descriptor #4:
      SMBUS Values: 0x08 0x0e 0x14 0x19 0x33 0x66 0xa1 0xff
      LVDS Channels: 1
      Panel Self Test Present
Checksum: 0xee

----------------

Failures:

Block 0, Base EDID:
  Basic Display Parameters & Features: Digital Video Interface Standard set to reserved value 0x10.
  Missing Display Product Name.
  Missing Display Range Limits Descriptor.

EDID conformity: FAIL
