edid-decode (hex):

00 ff ff ff ff ff ff 00 30 e4 a0 01 00 00 00 00
00 12 01 04 90 25 17 78 0a 4f d0 97 59 56 8c 27
20 50 54 00 00 00 01 01 01 01 01 01 01 01 01 01
01 01 01 01 01 01 c6 2a a0 30 52 84 0c 30 50 50
23 00 6f e6 10 00 00 19 00 00 00 00 00 00 00 00
00 00 00 00 00 00 00 00 00 00 00 00 00 fe 00 46
52 39 36 32 00 31 37 31 57 50 41 0a 00 00 00 fe
00 2e 3e 49 53 74 97 c6 ff 02 01 0a 20 20 00 08

----------------

Block 0, Base EDID:
  EDID Structure Version & Revision: 1.4
  Vendor & Product Identification:
    Manufacturer: LGD
    Model: 416
    Made in: 2008
  Basic Display Parameters & Features:
    Digital display
    Bits per primary color channel: 6
    Digital interface is not defined
    Maximum image size: 37 cm x 23 cm
    Gamma: 2.20
    Supported color formats: RGB 4:4:4, YCrCb 4:4:4
    First detailed timing includes the native pixel format and preferred refresh rate
  Color Characteristics:
    Red  : 0.5908, 0.3476
    Green: 0.3388, 0.5498
    Blue : 0.1552, 0.1259
    White: 0.3125, 0.3281
  Established Timings I & II: none
  Standard Timings: none
  Detailed Timing Descriptors:
    DTD 1:  1440x900    60.032895 Hz  16:10    54.750 kHz    109.500000 MHz (367 mm x 230 mm)
                 Hfront   80 Hsync  80 Hback  400 Hpol N
                 Vfront    2 Vsync   3 Vback    7 Vpol N
    Empty Descriptor
    Alphanumeric Data String: 'FR962'
    Alphanumeric Data String: '.>ISt'
Checksum: 0x08

----------------

Warnings:

Block 0, Base EDID:
  Missing Display Product Name.

Failures:

Block 0, Base EDID:
  Empty Descriptor: Use Dummy Descriptor instead of all zeroes.
  Alphanumeric Data String: Non-printable character.
  Alphanumeric Data String: Non-printable character.

EDID conformity: FAIL
