
EDID (hex):
00ffffffffffff0028892a4200000000
001b0104a51d147803de50a3544c9926
0f505400000001010101010101010101
010101010101b798b8a0b0d03e700820
080c25c41000001ab798b8a0b0d04172
0820080c25c41000001a000000fe004a
444920202020202020202020000000fe
004c504d3133394d3432324120200039

Extracted contents:
header:          00 ff ff ff ff ff ff 00
serial number:   28 89 2a 42 00 00 00 00 00 1b
version:         01 04
basic params:    a5 1d 14 78 03
chroma info:     de 50 a3 54 4c 99 26 0f 50 54
established:     00 00 00
standard:        01 01 01 01 01 01 01 01 01 01 01 01 01 01 01 01
descriptor 1:    b7 98 b8 a0 b0 d0 3e 70 08 20 08 0c 25 c4 10 00 00 1a
descriptor 2:    b7 98 b8 a0 b0 d0 41 72 08 20 08 0c 25 c4 10 00 00 1a
descriptor 3:    00 00 00 fe 00 4a 44 49 20 20 20 20 20 20 20 20 20 20
descriptor 4:    00 00 00 fe 00 4c 50 4d 31 33 39 4d 34 32 32 41 20 20
extensions:      00
checksum:        39

EDID version: 1.4
Manufacturer: JDI Model 422a Serial Number --
Made in year 2017
Digital display
8 bits per primary color channel
DisplayPort interface
Maximum image size: 29 cm x 20 cm
Gamma: 2.20
Supported color formats: RGB 4:4:4
First detailed timing includes the native pixel format and preferred refresh rate
Display is continuous frequency
Display x,y Chromaticity:
  Red:   0.6396, 0.3291
  Green: 0.2998, 0.5996
  Blue:  0.1494, 0.0595
  White: 0.3125, 0.3281
Established timings supported:
Standard timings supported:
Detailed mode: Clock 390.950 MHz, 293 mm x 196 mm
               3000 3008 3040 3160 hborder 0
               2000 2048 2056 2062 vborder 0
               +hsync -vsync 
               VertFreq: 59 Hz, HorFreq: 123718 Hz
Detailed mode: Clock 390.950 MHz, 293 mm x 196 mm
               3000 3008 3040 3160 hborder 0
               2000 2048 2056 2577 vborder 0
               +hsync -vsync 
               VertFreq: 48 Hz, HorFreq: 123718 Hz
ASCII string: JDI          
ASCII string: LPM139M422A  
Checksum: 0x39 (valid)
EDID block does NOT conform to EDID 1.4!
	Missing name descriptor
	Missing monitor ranges
