
EDID (hex):
00ffffffffffff000daeb61500000000
02160104902213780ad1f5935d599026
1d505400000001010101010101010101
010101010101d81d56e150002030442d
470058c11000001ae71356e150002030
442d470058c11000001a000000000000
00000000000000000000000000000002
000c4cff0a3c6410121e64000000004c

Extracted contents:
header:          00 ff ff ff ff ff ff 00
serial number:   0d ae b6 15 00 00 00 00 02 16
version:         01 04
basic params:    90 22 13 78 0a
chroma info:     d1 f5 93 5d 59 90 26 1d 50 54
established:     00 00 00
standard:        01 01 01 01 01 01 01 01 01 01 01 01 01 01 01 01
descriptor 1:    d8 1d 56 e1 50 00 20 30 44 2d 47 00 58 c1 10 00 00 1a
descriptor 2:    e7 13 56 e1 50 00 20 30 44 2d 47 00 58 c1 10 00 00 1a
descriptor 3:    00 00 00 00 00 00 00 00 00 00 00 00 00 00 00 00 00 00
descriptor 4:    00 00 00 02 00 0c 4c ff 0a 3c 64 10 12 1e 64 00 00 00
extensions:      00
checksum:        4c

EDID version: 1.4
Manufacturer: CMN Model 15b6 Serial Number --
Made in week 2 of 2012
Digital display
6 bits per primary color channel
Digital interface is not defined
Maximum image size: 34 cm x 19 cm
Gamma: 2.20
Supported color formats: RGB 4:4:4, YCrCb 4:4:4
First detailed timing includes the native pixel format and preferred refresh rate
Display x,y Chromaticity:
  Red:   0.5771, 0.3642
  Green: 0.3476, 0.5634
  Blue:  0.1513, 0.1162
  White: 0.3134, 0.3291
Established timings supported:
Standard timings supported:
Detailed mode: Clock 76.400 MHz, 344 mm x 193 mm
               1366 1434 1479 1591 hborder 0
                768  772  779  800 vborder 0
               +hsync -vsync 
               VertFreq: 60 Hz, HorFreq: 48020 Hz
Detailed mode: Clock 50.950 MHz, 344 mm x 193 mm
               1366 1434 1479 1591 hborder 0
                768  772  779  800 vborder 0
               +hsync -vsync 
               VertFreq: 40 Hz, HorFreq: 32023 Hz
Manufacturer-specified data, tag 0
Manufacturer-specified data, tag 2
Checksum: 0x4c (valid)
EDID block does NOT conform to EDID 1.4!
	Missing name descriptor
	Missing monitor ranges
