
EDID (hex):
00ffffffffffff000daeb61500000000
02160103802213780ad1f5935d599026
1d505400000001010101010101010101
010101010101d81d56e250001f30442e
460058c210000018a60000fe004e3135
364247452d4c42310a20000000fe0043
4d4e0a202020202020202020000000fe
004e3135364247452d4c42310a20008d

Extracted contents:
header:          00 ff ff ff ff ff ff 00
serial number:   0d ae b6 15 00 00 00 00 02 16
version:         01 03
basic params:    80 22 13 78 0a
chroma info:     d1 f5 93 5d 59 90 26 1d 50 54
established:     00 00 00
standard:        01 01 01 01 01 01 01 01 01 01 01 01 01 01 01 01
descriptor 1:    d8 1d 56 e2 50 00 1f 30 44 2e 46 00 58 c2 10 00 00 18
descriptor 2:    a6 00 00 fe 00 4e 31 35 36 42 47 45 2d 4c 42 31 0a 20
descriptor 3:    00 00 00 fe 00 43 4d 4e 0a 20 20 20 20 20 20 20 20 20
descriptor 4:    00 00 00 fe 00 4e 31 35 36 42 47 45 2d 4c 42 31 0a 20
extensions:      00
checksum:        8d

EDID version: 1.3
Manufacturer: CMN Model 15b6 Serial Number --
Made in week 2 of 2012
Digital display
Maximum image size: 34 cm x 19 cm
Gamma: 2.20
RGB color display
First detailed timing is preferred timing
Display x,y Chromaticity:
  Red:   0.5771, 0.3642
  Green: 0.3476, 0.5634
  Blue:  0.1513, 0.1162
  White: 0.3134, 0.3291
Established timings supported:
Standard timings supported:
Detailed mode: Clock 76.400 MHz, 344 mm x 194 mm
               1366 1434 1480 1592 hborder 0
                768  772  778  799 vborder 0
               -hsync -vsync 
               VertFreq: 60 Hz, HorFreq: 47989 Hz
Detailed mode: Clock 1.660 MHz, 1069 mm x 588 mm
                  0  310  376  254 hborder 49
                846  866  889 2175 vborder 10
               -hsync -vsync analog composite field sequential L/R
               VertFreq: 3 Hz, HorFreq: 6535 Hz
ASCII string: CMN
ASCII string: N156BGE-LB1
Checksum: 0x8d (valid)
EDID block does NOT conform to EDID 1.3!
	Missing name descriptor
	Missing monitor ranges
