
EDID (hex):
00ffffffffffff000859431900000000
01140103082917782a3f31a555489a27
135054afce0081c00101010101010101
010101010101662150b051001b304070
360099e61000001e0e1f008051001e30
4080370099e61000001c000000fc0044
5831394c443135304131310a000000fd
00324b1e460a00000000000a200a00bb

Extracted contents:
header:          00 ff ff ff ff ff ff 00
serial number:   08 59 43 19 00 00 00 00 01 14
version:         01 03
basic params:    08 29 17 78 2a
chroma info:     3f 31 a5 55 48 9a 27 13 50 54
established:     af ce 00
standard:        81 c0 01 01 01 01 01 01 01 01 01 01 01 01 01 01
descriptor 1:    66 21 50 b0 51 00 1b 30 40 70 36 00 99 e6 10 00 00 1e
descriptor 2:    0e 1f 00 80 51 00 1e 30 40 80 37 00 99 e6 10 00 00 1c
descriptor 3:    00 00 00 fc 00 44 58 31 39 4c 44 31 35 30 41 31 31 0a
descriptor 4:    00 00 00 fd 00 32 4b 1e 46 0a 00 00 00 00 00 0a 20 0a
extensions:      00
checksum:        bb

EDID version: 1.3
Manufacturer: BBY Model 1943 Serial Number --
Made in week 1 of 2010
Analog display, Input voltage level: 0.7/0.3 V
Sync: Separate 
Maximum image size: 41 cm x 23 cm
Gamma: 2.20
DPMS levels: Off
RGB color display
First detailed timing is preferred timing
Display x,y Chromaticity:
  Red:   0.6445, 0.3349
  Green: 0.2841, 0.6044
  Blue:  0.1523, 0.0771
  White: 0.3125, 0.3291
Established timings supported:
  720x400@70Hz 9:5 HorFreq: 31469 Hz Clock: 28.320 MHz
  640x480@60Hz 4:3 HorFreq: 31469 Hz Clock: 25.175 MHz
  640x480@72Hz 4:3 HorFreq: 37900 Hz Clock: 31.500 MHz
  640x480@75Hz 4:3 HorFreq: 37500 Hz Clock: 31.500 MHz
  800x600@56Hz 4:3 HorFreq: 35200 Hz Clock: 36.000 MHz
  800x600@60Hz 4:3 HorFreq: 37900 Hz Clock: 40.000 MHz
  800x600@72Hz 4:3 HorFreq: 48100 Hz Clock: 50.000 MHz
  800x600@75Hz 4:3 HorFreq: 46900 Hz Clock: 49.500 MHz
  1024x768@60Hz 4:3 HorFreq: 48400 Hz Clock: 65.000 MHz
  1024x768@70Hz 4:3 HorFreq: 56500 Hz Clock: 75.000 MHz
  1024x768@75Hz 4:3 HorFreq: 60000 Hz Clock: 78.750 MHz
Standard timings supported:
  1280x720@60Hz 16:9
Detailed mode: Clock 85.500 MHz, 409 mm x 230 mm
               1360 1424 1536 1792 hborder 0
                768  771  777  795 vborder 0
               +hsync +vsync 
               VertFreq: 60 Hz, HorFreq: 47712 Hz
Detailed mode: Clock 79.500 MHz, 409 mm x 230 mm
               1280 1344 1472 1664 hborder 0
                768  771  778  798 vborder 0
               -hsync +vsync 
               VertFreq: 59 Hz, HorFreq: 47776 Hz
Monitor name: DX19LD150A11
Monitor ranges (GTF): 50-75Hz V, 30-70kHz H, max dotclock 100MHz
Checksum: 0xbb (valid)
