edid-decode (hex):

00 ff ff ff ff ff ff 00 22 64 c7 61 00 00 00 00
2b 16 01 04 a5 22 13 78 e2 8d a5 9d 5b 55 9c 26
19 50 54 bf ee 00 81 00 81 c0 61 46 01 01 01 01
01 01 01 01 01 01 66 21 56 aa 51 00 1e 30 46 8f
33 00 58 c1 10 00 00 1e 00 00 00 ff 00 31 32 33
34 35 36 37 38 39 30 31 32 33 00 00 00 fd 00 38
4b 1e 3d 0b 00 0a 20 20 20 20 20 20 00 00 00 fc
00 48 4c 31 36 31 41 42 42 0a 20 20 20 20 00 82

----------------

Block 0, Base EDID:
  EDID Structure Version & Revision: 1.4
  Vendor & Product Identification:
    Manufacturer: HSD
    Model: 25031
    Made in: week 43 of 2012
  Basic Display Parameters & Features:
    Digital display
    Bits per primary color channel: 8
    DisplayPort interface
    Maximum image size: 34 cm x 19 cm
    Gamma: 2.20
    DPMS levels: Standby Suspend Off
    Supported color formats: RGB 4:4:4
    First detailed timing includes the native pixel format and preferred refresh rate
  Color Characteristics:
    Red  : 0.6152, 0.3554
    Green: 0.3349, 0.6103
    Blue : 0.1503, 0.0996
    White: 0.3134, 0.3291
  Established Timings I & II:
    IBM     :   720x400    70.082 Hz   9:5    31.467 kHz  28.320 MHz
    DMT 0x04:   640x480    59.940 Hz   4:3    31.469 kHz  25.175 MHz
    Apple   :   640x480    66.667 Hz   4:3    35.000 kHz  30.240 MHz
    DMT 0x05:   640x480    72.809 Hz   4:3    37.861 kHz  31.500 MHz
    DMT 0x06:   640x480    75.000 Hz   4:3    37.500 kHz  31.500 MHz
    DMT 0x08:   800x600    56.250 Hz   4:3    35.156 kHz  36.000 MHz
    DMT 0x09:   800x600    60.317 Hz   4:3    37.879 kHz  40.000 MHz
    DMT 0x0a:   800x600    72.188 Hz   4:3    48.077 kHz  50.000 MHz
    DMT 0x0b:   800x600    75.000 Hz   4:3    46.875 kHz  49.500 MHz
    Apple   :   832x624    74.551 Hz   4:3    49.726 kHz  57.284 MHz
    DMT 0x10:  1024x768    60.004 Hz   4:3    48.363 kHz  65.000 MHz
    DMT 0x11:  1024x768    70.069 Hz   4:3    56.476 kHz  75.000 MHz
    DMT 0x12:  1024x768    75.029 Hz   4:3    60.023 kHz  78.750 MHz
  Standard Timings:
    DMT 0x1c:  1280x800    59.810 Hz  16:10   49.702 kHz  83.500 MHz
    DMT 0x55:  1280x720    60.000 Hz  16:9    45.000 kHz  74.250 MHz
    CVT     :  1024x768    65.720 Hz   4:3    52.641 kHz  70.750 MHz (EDID 1.4 source)
    GTF     :  1024x768    66.000 Hz   4:3    52.668 kHz  71.628 MHz (EDID 1.3 source)
  Detailed Timing Descriptors:
    DTD 1:  1366x768    59.790 Hz 683:384  47.712 kHz  85.500 MHz (344 mm x 193 mm)
                 Hfront   70 Hsync 143 Hback 213 Hpol P
                 Vfront    3 Vsync   3 Vback  24 Vpol P
    Display Product Serial Number: ...
  Display Range Limits:
    Monitor ranges (GTF): 56-75 Hz V, 30-61 kHz H, max dotclock 110 MHz
    Display Product Name: 'HL161ABB'
Checksum: 0x82

----------------

Failures:

Block 0, Base EDID:
  Display Range Limits: GTF can't be combined with non-continuous frequencies.
All Blocks:
  CVT timings are used, but the EDID does not signal CVT support.

EDID conformity: FAIL
