
EDID (hex):
00ffffffffffff000daf031700000000
0d100103802517780a69359255549127
21505400000001010101010101010101
010101010101ab22a0a050841a303020
36006fe610000018000000fe004e3137
3043322d4c30320a2020000000fe0043
4d4f0a202020202020202020000000fe
004e31373043322d4c30320a2020003a

Extracted contents:
header:          00 ff ff ff ff ff ff 00
serial number:   0d af 03 17 00 00 00 00 0d 10
version:         01 03
basic params:    80 25 17 78 0a
chroma info:     69 35 92 55 54 91 27 21 50 54
established:     00 00 00
standard:        01 01 01 01 01 01 01 01 01 01 01 01 01 01 01 01
descriptor 1:    ab 22 a0 a0 50 84 1a 30 30 20 36 00 6f e6 10 00 00 18
descriptor 2:    00 00 00 fe 00 4e 31 37 30 43 32 2d 4c 30 32 0a 20 20
descriptor 3:    00 00 00 fe 00 43 4d 4f 0a 20 20 20 20 20 20 20 20 20
descriptor 4:    00 00 00 fe 00 4e 31 37 30 43 32 2d 4c 30 32 0a 20 20
extensions:      00
checksum:        3a

EDID version: 1.3
Manufacturer: CMO Model 1703 Serial Number --
Made in week 13 of 2006
Digital display
Maximum image size: 37 cm x 23 cm
Gamma: 2.20
RGB color display
First detailed timing is preferred timing
Display x,y Chromaticity:
  Red:   0.5712, 0.3339
  Green: 0.3300, 0.5673
  Blue:  0.1523, 0.1318
  White: 0.3134, 0.3291
Established timings supported:
Standard timings supported:
Detailed mode: Clock 88.750 MHz, 367 mm x 230 mm
               1440 1488 1520 1600 hborder 0
                900  903  909  926 vborder 0
               -hsync -vsync 
               VertFreq: 59 Hz, HorFreq: 55468 Hz
ASCII string: N170C2-L02
ASCII string: CMO
ASCII string: N170C2-L02
Checksum: 0x3a (valid)
EDID block does NOT conform to EDID 1.3!
	Missing name descriptor
	Missing monitor ranges
