
EDID (hex):
00ffffffffffff0006afec4500000000
04190104952213780250259358579229
22505400000001010101010101010101
010101010101ce1d56c050003030080a
310058c1100000180000000f00000000
00000000000000000020000000fe0041
554f0a202020202020202020000000fe
004231353658544e30342e35200a003a

Extracted contents:
header:          00 ff ff ff ff ff ff 00
serial number:   06 af ec 45 00 00 00 00 04 19
version:         01 04
basic params:    95 22 13 78 02
chroma info:     50 25 93 58 57 92 29 22 50 54
established:     00 00 00
standard:        01 01 01 01 01 01 01 01 01 01 01 01 01 01 01 01
descriptor 1:    ce 1d 56 c0 50 00 30 30 08 0a 31 00 58 c1 10 00 00 18
descriptor 2:    00 00 00 0f 00 00 00 00 00 00 00 00 00 00 00 00 00 20
descriptor 3:    00 00 00 fe 00 41 55 4f 0a 20 20 20 20 20 20 20 20 20
descriptor 4:    00 00 00 fe 00 42 31 35 36 58 54 4e 30 34 2e 35 20 0a
extensions:      00
checksum:        3a

EDID version: 1.4
Manufacturer: AUO Model 45ec Serial Number --
Made in week 4 of 2015
Digital display
6 bits per primary color channel
DisplayPort interface
Maximum image size: 34 cm x 19 cm
Gamma: 2.20
Supported color formats: RGB 4:4:4
First detailed timing includes the native pixel format and preferred refresh rate
Display x,y Chromaticity:
  Red:   0.5751, 0.3447
  Green: 0.3398, 0.5703
  Blue:  0.1601, 0.1347
  White: 0.3134, 0.3291
Established timings supported:
Standard timings supported:
Detailed mode: Clock 76.300 MHz, 344 mm x 193 mm
               1366 1374 1384 1558 hborder 0
                768  771  772  816 vborder 0
               -hsync -vsync 
               VertFreq: 60 Hz, HorFreq: 48973 Hz
Manufacturer-specified data, tag 15
ASCII string: AUO
ASCII string: B156XTN04.5 
Checksum: 0x3a (valid)
EDID block does NOT conform to EDID 1.4!
	Missing name descriptor
	Missing monitor ranges
