
EDID (hex):
00ffffffffffff004a8b32bc01010101
0f210103803c22782eee91a3544c9926
0f5054210800d100b300950081000101
0101010101019c6800a0a04029603020
350058d71000001a000000fc00445231
3630320a202020202020000000ff000a
202020202020202020202020000000fd
00303f1e6e28000a2020202020200104
020331f2459001020304e200d5e305c0
0023097f078301000067030c00100018
3ce6060501626200681a00000101303c
e66a5e00a0a0a029503020350058d710
00001e023a801871382d40582c450006
44210000ff0000000000000000000000
00000000000000000000000000000000
000000000000000000000000000000de

edid-decode (hex):

00 ff ff ff ff ff ff 00 4a 8b 32 bc 01 01 01 01
0f 21 01 03 80 3c 22 78 2e ee 91 a3 54 4c 99 26
0f 50 54 21 08 00 d1 00 b3 00 95 00 81 00 01 01
01 01 01 01 01 01 9c 68 00 a0 a0 40 29 60 30 20
35 00 58 d7 10 00 00 1a 00 00 00 fc 00 44 52 31
36 30 32 0a 20 20 20 20 20 20 00 00 00 ff 00 0a
20 20 20 20 20 20 20 20 20 20 20 20 00 00 00 fd
00 30 3f 1e 6e 28 00 0a 20 20 20 20 20 20 01 04

02 03 31 f2 45 90 01 02 03 04 e2 00 d5 e3 05 c0
00 23 09 7f 07 83 01 00 00 67 03 0c 00 10 00 18
3c e6 06 05 01 62 62 00 68 1a 00 00 01 01 30 3c
e6 6a 5e 00 a0 a0 a0 29 50 30 20 35 00 58 d7 10
00 00 1e 02 3a 80 18 71 38 2d 40 58 2c 45 00 06
44 21 00 00 ff 00 00 00 00 00 00 00 00 00 00 00
00 00 00 00 00 00 00 00 00 00 00 00 00 00 00 00
00 00 00 00 00 00 00 00 00 00 00 00 00 00 00 de

----------------

Block 0, Base EDID:
  EDID Structure Version & Revision: 1.3
  Vendor & Product Identification:
    Manufacturer: RTK
    Model: 48178
    Serial Number: 16843009
    Made in: week 15 of 2023
  Basic Display Parameters & Features:
    Digital display
    Maximum image size: 60 cm x 34 cm
    Gamma: 2.20
    DPMS levels: Off
    RGB color display
    Default (sRGB) color space is primary color space
    First detailed timing is the preferred timing
  Color Characteristics:
    Red  : 0.6396, 0.3300
    Green: 0.2998, 0.5996
    Blue : 0.1503, 0.0595
    White: 0.3125, 0.3291
  Established Timings I & II:
    DMT 0x04:   640x480    59.940476 Hz   4:3     31.469 kHz     25.175000 MHz
    DMT 0x09:   800x600    60.316541 Hz   4:3     37.879 kHz     40.000000 MHz
    DMT 0x10:  1024x768    60.003840 Hz   4:3     48.363 kHz     65.000000 MHz
  Standard Timings:
    DMT 0x45:  1920x1200   59.884600 Hz  16:10    74.556 kHz    193.250000 MHz
    DMT 0x3a:  1680x1050   59.954250 Hz  16:10    65.290 kHz    146.250000 MHz
    DMT 0x2f:  1440x900    59.887445 Hz  16:10    55.935 kHz    106.500000 MHz
    DMT 0x1c:  1280x800    59.810326 Hz  16:10    49.702 kHz     83.500000 MHz
  Detailed Timing Descriptors:
    DTD 1:  2560x1600   59.997491 Hz  16:10    98.456 kHz    267.800000 MHz (344 mm x 215 mm)
                 Hfront   48 Hsync  32 Hback   80 Hpol P
                 Vfront    3 Vsync   5 Vback   33 Vpol N
    Display Product Name: 'DR1602'
    Display Product Serial Number: ''
    Display Range Limits:
      Monitor ranges (GTF): 48-63 Hz V, 30-110 kHz H, max dotclock 400 MHz
  Extension blocks: 1
Checksum: 0x04

----------------

Block 1, CTA-861 Extension Block:
  Revision: 3
  Underscans IT Video Formats by default
  Basic audio support
  Supports YCbCr 4:4:4
  Supports YCbCr 4:2:2
  Native detailed modes: 2
  Video Data Block:
    VIC  16:  1920x1080   60.000000 Hz  16:9     67.500 kHz    148.500000 MHz (native)
    VIC   1:   640x480    59.940476 Hz   4:3     31.469 kHz     25.175000 MHz
    VIC   2:   720x480    59.940060 Hz   4:3     31.469 kHz     27.000000 MHz
    VIC   3:   720x480    59.940060 Hz  16:9     31.469 kHz     27.000000 MHz
    VIC   4:  1280x720    60.000000 Hz  16:9     45.000 kHz     74.250000 MHz
  Video Capability Data Block:
    YCbCr quantization: Selectable (via AVI YQ)
    RGB quantization: Selectable (via AVI Q)
    PT scan behavior: Always Overscanned
    IT scan behavior: Always Overscanned
    CE scan behavior: Always Overscanned
  Colorimetry Data Block:
    BT2020YCC
    BT2020RGB
  Audio Data Block:
    Linear PCM:
      Max channels: 2
      Supported sample rates (kHz): 192 176.4 96 88.2 48 44.1 32
      Supported sample sizes (bits): 24 20 16
  Speaker Allocation Data Block:
    FL/FR - Front Left/Right
  Vendor-Specific Data Block (HDMI), OUI 00-0C-03:
    Source physical address: 1.0.0.0
    DC_30bit
    DC_Y444
    Maximum TMDS clock: 300 MHz
  HDR Static Metadata Data Block:
    Electro optical transfer functions:
      Traditional gamma - SDR luminance range
      SMPTE ST2084
    Supported static metadata descriptors:
      Static metadata type 1
    Desired content max luminance: 98 (417.710 cd/m^2)
    Desired content max frame-average luminance: 98 (417.710 cd/m^2)
    Desired content min luminance: 0 (0.000 cd/m^2)
  Vendor-Specific Data Block (AMD), OUI 00-00-1A:
    Version: 1.1
    Minimum Refresh Rate: 48 Hz
    Maximum Refresh Rate: 60 Hz
    Flags 1.x: 0xe6 (MCCS)
  Detailed Timing Descriptors:
    DTD 2:  2560x1440   60.000199 Hz  16:9     88.860 kHz    241.700000 MHz (344 mm x 215 mm)
                 Hfront   48 Hsync  32 Hback   80 Hpol P
                 Vfront    3 Vsync   5 Vback   33 Vpol P
    DTD 3:  1920x2160i  59.973345 Hz   8:9     67.500 kHz    148.500000 MHz (side by side interleaved, 518 mm x 324 mm)
                 Hfront   88 Hsync  44 Hback  148 Hpol P
                 Vfront    4 Vsync   5 Vback   36 Vpol P Vfront +0.5 Odd Field
                 Vfront    4 Vsync   5 Vback   36 Vpol P Vback  +0.5 Even Field
Checksum: 0xde  Unused space in Extension Block: 42 bytes
