edid-decode (hex):

00 ff ff ff ff ff ff 00 30 ae ae 0f 01 01 01 01
1f 14 01 03 6c 33 1d 78 ee c2 85 a4 56 4d 9c 25
12 50 54 bf cf 00 71 4f 81 80 81 8c 81 8a 95 00
95 0f b3 00 b3 0f 02 3a 80 18 71 38 2d 40 58 2c
45 00 fe 1f 11 00 00 1e 00 00 00 fd 00 32 4b 1e
53 14 00 0a 20 20 20 20 20 20 00 00 00 fc 00 4c
32 33 32 31 78 20 57 69 64 65 0a 20 00 00 00 ff
00 36 56 36 31 30 33 30 33 0a 20 20 20 20 01 8e

02 01 04 00 2b 16 80 d0 20 38 28 40 28 40 3a 00
fe 1f 11 00 00 1a 98 21 c0 40 31 38 28 40 40 60
3a 00 fe 1f 11 00 00 1a ec 2c 00 b0 51 38 28 40
50 88 3a 00 fe 1f 11 00 00 1c 00 00 00 00 00 00
00 00 00 00 00 00 00 00 00 00 00 00 00 00 00 00
00 00 00 00 00 00 00 00 00 00 00 00 00 00 00 00
00 00 00 00 00 00 00 00 00 00 00 00 00 00 00 00
00 00 00 00 00 00 00 00 00 00 00 00 00 00 00 fd

----------------

Block 0, Base EDID:
  EDID Structure Version & Revision: 1.3
  Vendor & Product Identification:
    Manufacturer: LEN
    Model: 4014
    Serial Number: ...
    Made in: week 31 of 2010
  Basic Display Parameters & Features:
    Analog display
    Input voltage level: 0.7/0.7 V
    Sync: Separate Composite
    Maximum image size: 51 cm x 29 cm
    Gamma: 2.20
    DPMS levels: Standby Suspend Off
    RGB color display
    Default (sRGB) color space is primary color space
    First detailed timing is preferred timing
  Color Characteristics:
    Red  : 0.6435, 0.3359
    Green: 0.3007, 0.6113
    Blue : 0.1464, 0.0703
    White: 0.3134, 0.3291
  Established Timings I & II:
    IBM     :   720x400    70.082 Hz   9:5    31.467 kHz  28.320 MHz
    DMT 0x04:   640x480    59.940 Hz   4:3    31.469 kHz  25.175 MHz
    Apple   :   640x480    66.667 Hz   4:3    35.000 kHz  30.240 MHz
    DMT 0x05:   640x480    72.809 Hz   4:3    37.861 kHz  31.500 MHz
    DMT 0x06:   640x480    75.000 Hz   4:3    37.500 kHz  31.500 MHz
    DMT 0x08:   800x600    56.250 Hz   4:3    35.156 kHz  36.000 MHz
    DMT 0x09:   800x600    60.317 Hz   4:3    37.879 kHz  40.000 MHz
    DMT 0x0a:   800x600    72.188 Hz   4:3    48.077 kHz  50.000 MHz
    DMT 0x0b:   800x600    75.000 Hz   4:3    46.875 kHz  49.500 MHz
    DMT 0x10:  1024x768    60.004 Hz   4:3    48.363 kHz  65.000 MHz
    DMT 0x11:  1024x768    70.069 Hz   4:3    56.476 kHz  75.000 MHz
    DMT 0x12:  1024x768    75.029 Hz   4:3    60.023 kHz  78.750 MHz
    DMT 0x24:  1280x1024   75.025 Hz   5:4    79.976 kHz 135.000 MHz
  Standard Timings:
    DMT 0x15:  1152x864    75.000 Hz   4:3    67.500 kHz 108.000 MHz
    DMT 0x23:  1280x1024   60.020 Hz   5:4    63.981 kHz 108.000 MHz
    GTF     :  1280x1024   72.000 Hz   5:4    76.824 kHz 132.752 MHz
    GTF     :  1280x1024   70.000 Hz   5:4    74.620 kHz 128.943 MHz
    DMT 0x2f:  1440x900    59.887 Hz  16:10   55.935 kHz 106.500 MHz
    DMT 0x30:  1440x900    74.984 Hz  16:10   70.635 kHz 136.750 MHz
    DMT 0x3a:  1680x1050   59.954 Hz  16:10   65.290 kHz 146.250 MHz
    DMT 0x3b:  1680x1050   74.892 Hz  16:10   82.306 kHz 187.000 MHz
  Detailed Timing Descriptors:
    DTD 1:  1920x1080   60.000 Hz  16:9    67.500 kHz 148.500 MHz (510 mm x 287 mm)
                 Hfront   88 Hsync  44 Hback 148 Hpol P
                 Vfront    4 Vsync   5 Vback  36 Vpol P
  Display Range Limits:
    Monitor ranges (GTF): 50-75 Hz V, 30-83 kHz H, max dotclock 200 MHz
    Display Product Name: 'L2321x Wide'
    Display Product Serial Number: ...
  Extension blocks: 1
Checksum: 0x8e

----------------

Block 1, CTA-861 Extension Block:
  Revision: 1
  Detailed Timing Descriptors:
    DTD 2:   640x1080   59.752 Hz  16:27   66.922 kHz  56.750 MHz (510 mm x 287 mm)
                 Hfront   40 Hsync  64 Hback 104 Hpol P
                 Vfront    3 Vsync  10 Vback  27 Vpol N
    DTD 3:   960x1080   59.989 Hz   8:9    67.188 kHz  86.000 MHz (510 mm x 287 mm)
                 Hfront   64 Hsync  96 Hback 160 Hpol P
                 Vfront    3 Vsync  10 Vback  27 Vpol N
    DTD 4:  1280x1080   59.976 Hz  32:27   67.173 kHz 115.000 MHz (510 mm x 287 mm)
                 Hfront   80 Hsync 136 Hback 216 Hpol N
                 Vfront    3 Vsync  10 Vback  27 Vpol P
Checksum: 0xfd
