
EDID (hex):
00ffffffffffff002114300001000000
0a180103807341780acf74a3574cb023
09484cadad80810081408180b3007140
9500a9c0010008e80030f2705a80b058
8a00c48e2100001e023a801871382d40
582c4500b08e3100001e000000fc0041
6374766950616e656c205635000000fd
003b461f8c3c000a20202020202001ce
02034cf25b048403011213141607901b
20225d5f5061626465665e6302061115
26090707110706830100006e030c0021
00783c2000800102030467d85dc40178
8007e3050301e50f008019008c0ad08a
20e02d10103e9600c48e210000188c0a
a01451f01600267c4300c48e21000098
000000000000000000000000000000c5

Extracted contents:
header:          00 ff ff ff ff ff ff 00
serial number:   21 14 30 00 01 00 00 00 0a 18
version:         01 03
basic params:    80 73 41 78 0a
chroma info:     cf 74 a3 57 4c b0 23 09 48 4c
established:     ad ad 80
standard:        81 00 81 40 81 80 b3 00 71 40 95 00 a9 c0 01 00
descriptor 1:    08 e8 00 30 f2 70 5a 80 b0 58 8a 00 c4 8e 21 00 00 1e
descriptor 2:    02 3a 80 18 71 38 2d 40 58 2c 45 00 b0 8e 31 00 00 1e
descriptor 3:    00 00 00 fc 00 41 63 74 76 69 50 61 6e 65 6c 20 56 35
descriptor 4:    00 00 00 fd 00 3b 46 1f 8c 3c 00 0a 20 20 20 20 20 20
extensions:      01
checksum:        ce

EDID version: 1.3
Manufacturer: HHT Model 30 Serial Number --
Made in week 10 of 2014
Digital display
Maximum image size: 115 cm x 65 cm
Gamma: 2.20
RGB color display
First detailed timing is preferred timing
Display x,y Chromaticity:
  Red:   0.6396, 0.3398
  Green: 0.2998, 0.6904
  Blue:  0.1376, 0.0380
  White: 0.2822, 0.2968
Established timings supported:
  720x400@70Hz 9:5 HorFreq: 31469 Hz Clock: 28.320 MHz
  640x480@60Hz 4:3 HorFreq: 31469 Hz Clock: 25.175 MHz
  640x480@72Hz 4:3 HorFreq: 37900 Hz Clock: 31.500 MHz
  640x480@75Hz 4:3 HorFreq: 37500 Hz Clock: 31.500 MHz
  800x600@60Hz 4:3 HorFreq: 37900 Hz Clock: 40.000 MHz
  800x600@72Hz 4:3 HorFreq: 48100 Hz Clock: 50.000 MHz
  832x624@75Hz 4:3 HorFreq: 49726 Hz Clock: 57.284 MHz
  1024x768@60Hz 4:3 HorFreq: 48400 Hz Clock: 65.000 MHz
  1024x768@70Hz 4:3 HorFreq: 56500 Hz Clock: 75.000 MHz
  1280x1024@75Hz 5:4 HorFreq: 80000 Hz Clock: 135.000 MHz
  1152x870@75Hz 192:145 HorFreq: 67500 Hz Clock: 108.000 MHz
Standard timings supported:
  1280x800@60Hz 16:10
  1280x960@60Hz 4:3 HorFreq: 60000 Hz Clock: 108.000 MHz
  1280x1024@60Hz 5:4 HorFreq: 64000 Hz Clock: 108.000 MHz
  1680x1050@60Hz 16:10 HorFreq: 64700 Hz Clock: 119.000 MHz
  1152x864@60Hz 4:3
  1440x900@60Hz 16:10 HorFreq: 55500 Hz Clock: 88.750 MHz
  1600x900@60Hz 16:9
  256x160@60Hz 16:10
Detailed mode: Clock 594.000 MHz, 708 mm x 398 mm
               3840 4016 4104 4400 hborder 0
               2160 2168 2178 2250 vborder 0
               +hsync +vsync 
               VertFreq: 60 Hz, HorFreq: 135000 Hz
Detailed mode: Clock 148.500 MHz, 944 mm x 398 mm
               1920 2008 2052 2200 hborder 0
               1080 1084 1089 1125 vborder 0
               +hsync +vsync 
               VertFreq: 60 Hz, HorFreq: 67500 Hz
Monitor ranges (GTF): 59-70Hz V, 31-140kHz H, max dotclock 600MHz
Has 1 extension blocks
Checksum: 0xce (valid)

CTA extension block
Extension version: 3
72 bytes of CTA data
  Video data block
    VIC   4 1280x720@60Hz 16:9  HorFreq: 45000 Hz Clock: 74.250 MHz
    VIC   4 1280x720@60Hz 16:9 (native) HorFreq: 45000 Hz Clock: 74.250 MHz
    VIC   3 720x480@60Hz 16:9  HorFreq: 31469 Hz Clock: 27.000 MHz
    VIC   1 640x480@60Hz 4:3  HorFreq: 31469 Hz Clock: 25.175 MHz
    VIC  18 720x576@50Hz 16:9  HorFreq: 31250 Hz Clock: 27.000 MHz
    VIC  19 1280x720@50Hz 16:9  HorFreq: 37500 Hz Clock: 74.250 MHz
    VIC  20 1920x1080i@50Hz 16:9  HorFreq: 28125 Hz Clock: 74.250 MHz
    VIC  22 1440x576i@50Hz 16:9  HorFreq: 15625 Hz Clock: 27.000 MHz
    VIC   7 1440x480i@60Hz 16:9  HorFreq: 15734 Hz Clock: 27.000 MHz
    VIC  16 1920x1080@60Hz 16:9 (native) HorFreq: 67500 Hz Clock: 148.500 MHz
    VIC  27 2880x288@50Hz 4:3  HorFreq: 15625 Hz Clock: 54.000 MHz
    VIC  32 1920x1080@24Hz 16:9  HorFreq: 27000 Hz Clock: 74.250 MHz
    VIC  34 1920x1080@30Hz 16:9  HorFreq: 33750 Hz Clock: 74.250 MHz
    VIC  93 3840x2160@24Hz 16:9  HorFreq: 54000 Hz Clock: 297.000 MHz
    VIC  95 3840x2160@30Hz 16:9  HorFreq: 67500 Hz Clock: 297.000 MHz
    VIC  80 1680x720@25Hz 64:27  HorFreq: 18750 Hz Clock: 59.400 MHz
    VIC  97 3840x2160@60Hz 16:9  HorFreq: 135000 Hz Clock: 594.000 MHz
    VIC  98 4096x2160@24Hz 256:135  HorFreq: 54000 Hz Clock: 297.000 MHz
    VIC 100 4096x2160@30Hz 256:135  HorFreq: 67500 Hz Clock: 297.000 MHz
    VIC 101 4096x2160@50Hz 256:135  HorFreq: 112500 Hz Clock: 594.000 MHz
    VIC 102 4096x2160@60Hz 256:135  HorFreq: 135000 Hz Clock: 594.000 MHz
    VIC  94 3840x2160@25Hz 16:9  HorFreq: 56250 Hz Clock: 297.000 MHz
    VIC  99 4096x2160@25Hz 256:135  HorFreq: 56250 Hz Clock: 297.000 MHz
    VIC   2 720x480@60Hz 4:3  HorFreq: 31469 Hz Clock: 27.000 MHz
    VIC   6 1440x480i@60Hz 4:3  HorFreq: 15734 Hz Clock: 27.000 MHz
    VIC  17 720x576@50Hz 4:3  HorFreq: 31250 Hz Clock: 27.000 MHz
    VIC  21 1440x576i@50Hz 4:3  HorFreq: 15625 Hz Clock: 27.000 MHz
  Audio data block
    Linear PCM, max channels 2
      Supported sample rates (kHz): 48 44.1 32
      Supported sample sizes (bits): 24 20 16
    AC-3, max channels 2
      Supported sample rates (kHz): 48 44.1 32
      Maximum bit rate: 48 kHz
  Speaker allocation data block
    Speaker map:
      FL/FR - Front Left/Right
  Vendor-specific data block, OUI 000c03 (HDMI)
    Source physical address 2.1.0.0
    DC_48bit
    DC_36bit
    DC_30bit
    DC_Y444
    Maximum TMDS clock: 300MHz
    Extended HDMI video details:
      HDMI VIC 1 3840x2160@30Hz 16:9 HorFreq: 67500 Hz Clock: 297.000 MHz
      HDMI VIC 2 3840x2160@25Hz 16:9 HorFreq: 56250 Hz Clock: 297.000 MHz
      HDMI VIC 3 3840x2160@24Hz 16:9 HorFreq: 54000 Hz Clock: 297.000 MHz
      HDMI VIC 4 4096x2160@24Hz 256:135 HorFreq: 54000 Hz Clock: 297.000 MHz
  Vendor-specific data block, OUI c45dd8 (HDMI Forum)
    Version: 1
    Maximum TMDS Character Rate: 600MHz
    SCDC Present
    Supports 16-bits/component Deep Color 4:2:0 Pixel Encoding
    Supports 12-bits/component Deep Color 4:2:0 Pixel Encoding
    Supports 10-bits/component Deep Color 4:2:0 Pixel Encoding
  Extended tag: Colorimetry data block
    xvYCC601
    xvYCC709
  Extended tag: YCbCr 4:2:0 capability map data block
    VSD Index 15
    VSD Index 16
    VSD Index 19
    VSD Index 20
Underscans PC formats by default
Basic audio support
Supports YCbCr 4:4:4
Supports YCbCr 4:2:2
2 native detailed modes
Detailed mode: Clock 27.000 MHz, 708 mm x 398 mm
                720  736  798  858 hborder 0
                480  489  495  525 vborder 0
               -hsync -vsync 
               VertFreq: 59 Hz, HorFreq: 31468 Hz
Detailed mode: Clock 27.000 MHz, 708 mm x 398 mm
               1440 1478 1602 1716 hborder 0
                240  244  247  262 vborder 0
               -hsync -vsync interlaced 
               VertFreq: 60 Hz, HorFreq: 15734 Hz
Checksum: 0xc5 (valid)

EDID block does NOT conform to EDID 1.3!
	Name descriptor not terminated with a newline
One or more of the timings is out of range of the Monitor Ranges:
  Vertical Freq: 24 - 75 Hz
  Horizontal Freq: 15625 - 135000 Hz
  Maximum Clock: 594.000 MHz
