
EDID (hex):
00ffffffffffff006a92e90300000000
05220104a5221378031bbba658559d26
0e4f5500000001010101010101010101
010101010101403a800471383c403020
360059c21000001a9a2e800471383c40
3020360059c21000001a000000fe0042
4f452020200a202020202020000000fe
005a54524831353646484430330a00a6

edid-decode (hex):

00 ff ff ff ff ff ff 00 6a 92 e9 03 00 00 00 00
05 22 01 04 a5 22 13 78 03 1b bb a6 58 55 9d 26
0e 4f 55 00 00 00 01 01 01 01 01 01 01 01 01 01
01 01 01 01 01 01 40 3a 80 04 71 38 3c 40 30 20
36 00 59 c2 10 00 00 1a 9a 2e 80 04 71 38 3c 40
30 20 36 00 59 c2 10 00 00 1a 00 00 00 fe 00 42
4f 45 20 20 20 0a 20 20 20 20 20 20 00 00 00 fe
00 5a 54 52 48 31 35 36 46 48 44 30 33 0a 00 a6

----------------

Block 0, Base EDID:
  EDID Structure Version & Revision: 1.4
  Vendor & Product Identification:
    Manufacturer: ZTR
    Model: 1001
    Made in: week 5 of 2024
  Basic Display Parameters & Features:
    Digital display
    Bits per primary color channel: 8
    DisplayPort interface
    Maximum image size: 34 cm x 19 cm
    Gamma: 2.20
    Supported color formats: RGB 4:4:4
    First detailed timing includes the native pixel format and preferred refresh rate
    Display is continuous frequency
  Color Characteristics:
    Red  : 0.6484, 0.3447
    Green: 0.3339, 0.6162
    Blue : 0.1503, 0.0576
    White: 0.3105, 0.3349
  Established Timings I & II: none
  Standard Timings: none
  Detailed Timing Descriptors:
    DTD 1:  1920x1080   60.003219 Hz  16:9     68.404 kHz    149.120000 MHz (345 mm x 194 mm)
                 Hfront   48 Hsync  32 Hback  180 Hpol P
                 Vfront    3 Vsync   6 Vback   51 Vpol N
    DTD 2:  1920x1080   48.004185 Hz  16:9     54.725 kHz    119.300000 MHz (345 mm x 194 mm)
                 Hfront   48 Hsync  32 Hback  180 Hpol P
                 Vfront    3 Vsync   6 Vback   51 Vpol N
    Alphanumeric Data String: 'BOE   '
    Alphanumeric Data String: 'ZTRH156FHD03'
Checksum: 0xa6
