
EDID (hex):
00ffffffffffff00444c128001000000
03150103801e1778eab1a5a1584f9526
165054afcf008180818ab30095008100
810f81c00101bc34009851002a401090
1300680e1100001efc3a800071384640
30203600d90a1100001a000000fc0051
58562e323357410a20202020000000fc
000a202020202020202020202020002d

Extracted contents:
header:          00 ff ff ff ff ff ff 00
serial number:   44 4c 12 80 01 00 00 00 03 15
version:         01 03
basic params:    80 1e 17 78 ea
chroma info:     b1 a5 a1 58 4f 95 26 16 50 54
established:     af cf 00
standard:        81 80 81 8a b3 00 95 00 81 00 81 0f 81 c0 01 01
descriptor 1:    bc 34 00 98 51 00 2a 40 10 90 13 00 68 0e 11 00 00 1e
descriptor 2:    fc 3a 80 00 71 38 46 40 30 20 36 00 d9 0a 11 00 00 1a
descriptor 3:    00 00 00 fc 00 51 58 56 2e 32 33 57 41 0a 20 20 20 20
descriptor 4:    00 00 00 fc 00 0a 20 20 20 20 20 20 20 20 20 20 20 20
extensions:      00
checksum:        2d

EDID version: 1.3
Manufacturer: QBL Model 8012 Serial Number --
Made in week 3 of 2011
Digital display
Maximum image size: 30 cm x 23 cm
Gamma: 2.20
DPMS levels: Standby Suspend Off
RGB color display
First detailed timing is preferred timing
Display x,y Chromaticity:
  Red:   0.6308, 0.3466
  Green: 0.3085, 0.5830
  Blue:  0.1503, 0.0878
  White: 0.3134, 0.3291
Established timings supported:
  720x400@70Hz 9:5 HorFreq: 31469 Hz Clock: 28.320 MHz
  640x480@60Hz 4:3 HorFreq: 31469 Hz Clock: 25.175 MHz
  640x480@72Hz 4:3 HorFreq: 37900 Hz Clock: 31.500 MHz
  640x480@75Hz 4:3 HorFreq: 37500 Hz Clock: 31.500 MHz
  800x600@56Hz 4:3 HorFreq: 35200 Hz Clock: 36.000 MHz
  800x600@60Hz 4:3 HorFreq: 37900 Hz Clock: 40.000 MHz
  800x600@72Hz 4:3 HorFreq: 48100 Hz Clock: 50.000 MHz
  800x600@75Hz 4:3 HorFreq: 46900 Hz Clock: 49.500 MHz
  1024x768@60Hz 4:3 HorFreq: 48400 Hz Clock: 65.000 MHz
  1024x768@70Hz 4:3 HorFreq: 56500 Hz Clock: 75.000 MHz
  1024x768@75Hz 4:3 HorFreq: 60000 Hz Clock: 78.750 MHz
  1280x1024@75Hz 5:4 HorFreq: 80000 Hz Clock: 135.000 MHz
Standard timings supported:
  1280x1024@60Hz 5:4 HorFreq: 64000 Hz Clock: 108.000 MHz
  1280x1024@70Hz 5:4
  1680x1050@60Hz 16:10 HorFreq: 64700 Hz Clock: 119.000 MHz
  1440x900@60Hz 16:10 HorFreq: 55500 Hz Clock: 88.750 MHz
  1280x800@60Hz 16:10
  1280x800@75Hz 16:10
  1280x720@60Hz 16:9
Detailed mode: Clock 135.000 MHz, 360 mm x 270 mm
               1280 1296 1440 1688 hborder 0
               1024 1025 1028 1066 vborder 0
               +hsync +vsync 
               VertFreq: 75 Hz, HorFreq: 79976 Hz
Detailed mode: Clock 151.000 MHz, 473 mm x 266 mm
               1920 1968 2000 2176 hborder 0
               1080 1083 1089 1150 vborder 0
               +hsync -vsync 
               VertFreq: 60 Hz, HorFreq: 69393 Hz
Monitor name: QXV.23WA
Checksum: 0x2d (valid)
EDID block does NOT conform to EDID 1.3!
	Missing monitor ranges


