
EDID (hex):
00ffffffffffff0009d1287845540000
1c1501036e331d782eee95a3544c9926
0f5054a56b8061c081c0814081809500
a940b300d1c0023a801871382d40582c
4500fe1f1100001e000000fd00324c18
5315000a202020202020000000fc0042
454e51204732333230484442000000ff
0044374230313733303031390a20004f

Extracted contents:
header:          00 ff ff ff ff ff ff 00
serial number:   09 d1 28 78 45 54 00 00 1c 15
version:         01 03
basic params:    6e 33 1d 78 2e
chroma info:     ee 95 a3 54 4c 99 26 0f 50 54
established:     a5 6b 80
standard:        61 c0 81 c0 81 40 81 80 95 00 a9 40 b3 00 d1 c0
descriptor 1:    02 3a 80 18 71 38 2d 40 58 2c 45 00 fe 1f 11 00 00 1e
descriptor 2:    00 00 00 fd 00 32 4c 18 53 15 00 0a 20 20 20 20 20 20
descriptor 3:    00 00 00 fc 00 42 45 4e 51 20 47 32 33 32 30 48 44 42
descriptor 4:    00 00 00 ff 00 44 37 42 30 31 37 33 30 30 31 39 0a 20
extensions:      00
checksum:        4f

EDID version: 1.3
Manufacturer: BNQ Model 7828 Serial Number --
Made in week 28 of 2011
Analog display, Input voltage level: 0.7/0.7 V
Sync: Separate Composite SyncOnGreen 
Maximum image size: 51 cm x 29 cm
Gamma: 2.20
DPMS levels: Off
RGB color display
Default (sRGB) color space is primary color space
First detailed timing is preferred timing
Display x,y Chromaticity:
  Red:   0.6396, 0.3300
  Green: 0.2998, 0.5996
  Blue:  0.1503, 0.0595
  White: 0.3134, 0.3291
Established timings supported:
  720x400@70Hz 9:5 HorFreq: 31469 Hz Clock: 28.320 MHz
  640x480@60Hz 4:3 HorFreq: 31469 Hz Clock: 25.175 MHz
  640x480@75Hz 4:3 HorFreq: 37500 Hz Clock: 31.500 MHz
  800x600@60Hz 4:3 HorFreq: 37900 Hz Clock: 40.000 MHz
  800x600@75Hz 4:3 HorFreq: 46900 Hz Clock: 49.500 MHz
  832x624@75Hz 4:3 HorFreq: 49726 Hz Clock: 57.284 MHz
  1024x768@60Hz 4:3 HorFreq: 48400 Hz Clock: 65.000 MHz
  1024x768@75Hz 4:3 HorFreq: 60000 Hz Clock: 78.750 MHz
  1280x1024@75Hz 5:4 HorFreq: 80000 Hz Clock: 135.000 MHz
  1152x870@75Hz 192:145 HorFreq: 67500 Hz Clock: 108.000 MHz
Standard timings supported:
  1024x576@60Hz 16:9
  1280x720@60Hz 16:9
  1280x960@60Hz 4:3 HorFreq: 60000 Hz Clock: 108.000 MHz
  1280x1024@60Hz 5:4 HorFreq: 64000 Hz Clock: 108.000 MHz
  1440x900@60Hz 16:10 HorFreq: 55500 Hz Clock: 88.750 MHz
  1600x1200@60Hz 4:3 HorFreq: 75000 Hz Clock: 162.000 MHz
  1680x1050@60Hz 16:10 HorFreq: 64700 Hz Clock: 119.000 MHz
  1920x1080@60Hz 16:9
Detailed mode: Clock 148.500 MHz, 510 mm x 287 mm
               1920 2008 2052 2200 hborder 0
               1080 1084 1089 1125 vborder 0
               +hsync +vsync 
               VertFreq: 60 Hz, HorFreq: 67500 Hz
Monitor ranges (GTF): 50-76Hz V, 24-83kHz H, max dotclock 210MHz
Serial number: --
Checksum: 0x4f (valid)
EDID block does NOT conform to EDID 1.3!
	sRGB is signaled, but the chromaticities do not match
	Name descriptor not terminated with a newline
