edid-decode (hex):

00 ff ff ff ff ff ff 00 0d ae 20 17 00 00 00 00
02 15 01 04 90 26 15 78 02 ed 95 a3 54 4c 9c 26
0f 50 54 00 00 00 01 01 01 01 01 01 01 01 01 01
01 01 01 01 01 01 31 37 80 be 70 38 24 40 38 26
46 00 7e d7 10 00 00 1a 00 00 00 00 00 00 00 00
00 00 00 00 00 00 00 00 00 00 00 00 00 fe 00 48
44 4b 50 56 83 31 37 33 48 47 45 0a 00 00 00 00
00 00 41 01 9e 00 00 00 00 02 01 0a 20 20 00 f0

----------------

Block 0, Base EDID:
  EDID Structure Version & Revision: 1.4
  Vendor & Product Identification:
    Manufacturer: CMN
    Model: 5920
    Made in: week 2 of 2011
  Basic Display Parameters & Features:
    Digital display
    Bits per primary color channel: 6
    Digital interface is not defined
    Maximum image size: 38 cm x 21 cm
    Gamma: 2.20
    Supported color formats: RGB 4:4:4
    First detailed timing includes the native pixel format and preferred refresh rate
  Color Characteristics:
    Red  : 0.6396, 0.3300
    Green: 0.2998, 0.6103
    Blue : 0.1503, 0.0595
    White: 0.3134, 0.3291
  Established Timings I & II: none
  Standard Timings: none
  Detailed Timing Descriptors:
    DTD 1:  1920x1080   60.002 Hz  16:9    66.962 kHz 141.290 MHz (382 mm x 215 mm)
                 Hfront   56 Hsync  38 Hback  96 Hpol P
                 Vfront    4 Vsync   6 Vback  26 Vpol N
    Empty Descriptor
    Alphanumeric Data String: 'HDKPV'
    Manufacturer-Specified Display Descriptor (0x00): 00 00 00 00 41 01 9e 00 00 00 00 02 01 0a 20 20 '....A.........  '
Checksum: 0xf0
