edid-decode (hex):

00 ff ff ff ff ff ff 00 30 ae c9 24 01 01 01 01
1e 11 01 03 6e 24 1e 78 ee 3d 85 a6 56 4a 9a 24
12 50 54 bd cf 00 81 80 81 8a 81 8c 81 90 01 01
01 01 01 01 01 01 30 2a 00 98 51 00 2a 40 30 70
13 00 52 0e 11 00 00 1e 00 00 00 fd 00 38 4c 1e
51 0e 00 0a 20 20 20 20 20 20 00 00 00 fc 00 4c
45 4e 20 4c 31 37 31 70 0a 20 20 20 00 00 00 ff
00 56 4c 2d 59 47 33 31 38 0a 20 20 20 20 00 af

00 ff ff ff ff ff ff 00 30 ae c9 24 01 01 01 01
1e 11 01 03 6e 24 1e 78 ee 3d 85 a6 56 4a 9a 24
12 50 54 bd cf 00 81 80 81 8a 81 8c 81 90 01 01
01 01 01 01 01 01 30 2a 00 98 51 00 2a 40 30 70
13 00 52 0e 11 00 00 1e 00 00 00 fd 00 38 4c 1e
51 0e 00 0a 20 20 20 20 20 20 00 00 00 fc 00 4c
45 4e 20 4c 31 37 31 70 0a 20 20 20 00 00 00 ff
00 56 4c 2d 59 47 33 31 38 0a 20 20 20 20 00 af

----------------

Block 0, Base EDID:
  EDID Structure Version & Revision: 1.3
  Vendor & Product Identification:
    Manufacturer: LEN
    Model: 9417
    Serial Number: ...
    Made in: week 30 of 2007
  Basic Display Parameters & Features:
    Analog display
    Signal Level Standard: 0.700 : 0.000 : 0.700 V p-p
    Blank level equals black level
    Sync: Separate Composite SyncOnGreen
    Maximum image size: 36 cm x 30 cm
    Gamma: 2.20
    DPMS levels: Standby Suspend Off
    RGB color display
    Default (sRGB) color space is primary color space
    First detailed timing is the preferred timing
  Color Characteristics:
    Red  : 0.6484, 0.3388
    Green: 0.2919, 0.6025
    Blue : 0.1425, 0.0703
    White: 0.3134, 0.3291
  Established Timings I & II:
    IBM     :   720x400    70.081663 Hz   9:5     31.467 kHz     28.320000 MHz
    DMT 0x04:   640x480    59.940476 Hz   4:3     31.469 kHz     25.175000 MHz
    Apple   :   640x480    66.666667 Hz   4:3     35.000 kHz     30.240000 MHz
    DMT 0x05:   640x480    72.808802 Hz   4:3     37.861 kHz     31.500000 MHz
    DMT 0x06:   640x480    75.000000 Hz   4:3     37.500 kHz     31.500000 MHz
    DMT 0x09:   800x600    60.316541 Hz   4:3     37.879 kHz     40.000000 MHz
    DMT 0x0a:   800x600    72.187572 Hz   4:3     48.077 kHz     50.000000 MHz
    DMT 0x0b:   800x600    75.000000 Hz   4:3     46.875 kHz     49.500000 MHz
    DMT 0x10:  1024x768    60.003840 Hz   4:3     48.363 kHz     65.000000 MHz
    DMT 0x11:  1024x768    70.069359 Hz   4:3     56.476 kHz     75.000000 MHz
    DMT 0x12:  1024x768    75.028582 Hz   4:3     60.023 kHz     78.750000 MHz
    DMT 0x24:  1280x1024   75.024675 Hz   5:4     79.976 kHz    135.000000 MHz
  Standard Timings:
    DMT 0x23:  1280x1024   60.019740 Hz   5:4     63.981 kHz    108.000000 MHz
    GTF     :  1280x1024   69.999805 Hz   5:4     74.620 kHz    128.943000 MHz
    GTF     :  1280x1024   72.000069 Hz   5:4     76.824 kHz    132.752000 MHz
    GTF     :  1280x1024   75.999957 Hz   5:4     81.320 kHz    141.822000 MHz
  Detailed Timing Descriptors:
    DTD 1:  1280x1024   60.019740 Hz   5:4     63.981 kHz    108.000000 MHz (338 mm x 270 mm)
                 Hfront   48 Hsync 112 Hback  248 Hpol P
                 Vfront    1 Vsync   3 Vback   38 Vpol P
    Display Range Limits:
      Monitor ranges (GTF): 56-76 Hz V, 30-81 kHz H, max dotclock 140 MHz
    Display Product Name: 'LEN L171p'
    Display Product Serial Number: ...
Checksum: 0xaf

----------------

Block 1, Unknown EDID Extension Block 0x00:
  00 ff ff ff ff ff ff 00 30 ae c9 24 01 01 01 01 '........0..$....'
  1e 11 01 03 6e 24 1e 78 ee 3d 85 a6 56 4a 9a 24 '....n$.x.=..VJ.$'
  12 50 54 bd cf 00 81 80 81 8a 81 8c 81 90 01 01 '.PT.............'
  01 01 01 01 01 01 30 2a 00 98 51 00 2a 40 30 70 '......0*..Q.*@0p'
  13 00 52 0e 11 00 00 1e 00 00 00 fd 00 38 4c 1e '..R..........8L.'
  51 0e 00 0a 20 20 20 20 20 20 00 00 00 fc 00 4c 'Q...      .....L'
  45 4e 20 4c 31 37 31 70 0a 20 20 20 00 00 00 ff 'EN L171p.   ....'
  00 56 4c 2d 59 47 33 31 38 0a 20 20 20 20 00 af '.VL-YG318.    ..'
Checksum: 0xaf

----------------

Warnings:

EDID:
  Base EDID: Some timings are out of range of the Monitor Ranges:
    Maximum Clock: 141.822 MHz (Monitor: 140.000 MHz)
    Could be due to a Monitor Range off-by-one rounding issue

Failures:

Block 0, Base EDID:
  Basic Display Parameters & Features: sRGB is signaled, but the chromaticities do not match.
  Detailed Timing Descriptor #1: Mismatch of image size 338x270 mm vs display size 360x300 mm.
Block 1, Base EDID:
  Unknown Extension Block.
EDID:
  Base EDID: EDID specified 0 extension block(s), but found 1 extension block(s).

EDID conformity: FAIL
