edid-decode (hex):

00 ff ff ff ff ff ff 00 30 e4 5d 05 00 00 00 00
00 1a 01 04 a5 1a 11 78 02 55 55 00 00 00 00 00
00 50 54 00 00 00 01 01 01 01 01 01 01 01 01 01
01 01 01 01 01 01 58 98 b8 a0 b0 d0 39 70 30 20
3a 00 04 ad 10 00 00 1b 90 65 b8 a0 b0 d0 39 70
30 20 3a 00 04 ad 10 00 00 1b 00 00 00 00 00 00
00 00 00 00 00 00 00 00 00 00 00 00 00 00 00 02
00 0c 21 54 0a 3c 4b 27 13 15 e1 00 00 00 00 d2

----------------

Block 0, Base EDID:
  EDID Structure Version & Revision: 1.4
  Vendor & Product Identification:
    Manufacturer: LGD
    Model: 1373
    Made in: 2016
  Basic Display Parameters & Features:
    Digital display
    Bits per primary color channel: 8
    DisplayPort interface
    Maximum image size: 26 cm x 17 cm
    Gamma: 2.20
    Supported color formats: RGB 4:4:4
    First detailed timing includes the native pixel format and preferred refresh rate
  Color Characteristics:
    Red  : 0.0009, 0.0009
    Green: 0.0009, 0.0009
    Blue : 0.0009, 0.0009
    White: 0.3134, 0.3291
  Established Timings I & II: none
  Standard Timings: none
  Detailed Timing Descriptors:
    DTD 1:  3000x2000   59.998892 Hz   3:2    123.418 kHz    390.000000 MHz (260 mm x 173 mm)
                 Hfront   48 Hsync  32 Hback   80 Hpol P
                 Vfront    3 Vsync  10 Vback   44 Vpol N
    DTD 2:  3000x2000   39.999262 Hz   3:2     82.278 kHz    260.000000 MHz (260 mm x 173 mm)
                 Hfront   48 Hsync  32 Hback   80 Hpol P
                 Vfront    3 Vsync  10 Vback   44 Vpol N
    Empty Descriptor
    Manufacturer-Specified Display Descriptor (0x02): 00 02 00 0c 21 54 0a 3c 4b 27 13 15 e1 00 00 00 '....!T.<K'......'
Checksum: 0xd2

----------------

Warnings:

Block 0, Base EDID:
  Missing Display Product Name.

Failures:

Block 0, Base EDID:
  Empty Descriptor: Use Dummy Descriptor instead of all zeroes.

EDID conformity: FAIL
