
EDID (hex):
00ffffffffffff001e6d3d56fe380300
07120103802f1e78ead425a455499b27
135054a76b8081808140714f95000101
0101010101017c2e90a0601a1e403020
3600b20e1100001a21399030621a2740
68b03600b20e1100001c000000fd0038
4b1c530f000a202020202020000000fc
004d32323857410a2020202020200094

Extracted contents:
header:          00 ff ff ff ff ff ff 00
serial number:   1e 6d 3d 56 fe 38 03 00 07 12
version:         01 03
basic params:    80 2f 1e 78 ea
chroma info:     d4 25 a4 55 49 9b 27 13 50 54
established:     a7 6b 80
standard:        81 80 81 40 71 4f 95 00 01 01 01 01 01 01 01 01
descriptor 1:    7c 2e 90 a0 60 1a 1e 40 30 20 36 00 b2 0e 11 00 00 1a
descriptor 2:    21 39 90 30 62 1a 27 40 68 b0 36 00 b2 0e 11 00 00 1c
descriptor 3:    00 00 00 fd 00 38 4b 1c 53 0f 00 0a 20 20 20 20 20 20
descriptor 4:    00 00 00 fc 00 4d 32 32 38 57 41 0a 20 20 20 20 20 20
extensions:      00
checksum:        94

EDID version: 1.3
Manufacturer: GSM Model 563d Serial Number --
Made in week 7 of 2008
Digital display
Maximum image size: 47 cm x 30 cm
Gamma: 2.20
DPMS levels: Standby Suspend Off
RGB color display
First detailed timing is preferred timing
Display x,y Chromaticity:
  Red:   0.6435, 0.3330
  Green: 0.2861, 0.6054
  Blue:  0.1523, 0.0761
  White: 0.3134, 0.3291
Established timings supported:
  720x400@70Hz 9:5 HorFreq: 31469 Hz Clock: 28.320 MHz
  640x480@60Hz 4:3 HorFreq: 31469 Hz Clock: 25.175 MHz
  640x480@75Hz 4:3 HorFreq: 37500 Hz Clock: 31.500 MHz
  800x600@56Hz 4:3 HorFreq: 35200 Hz Clock: 36.000 MHz
  800x600@60Hz 4:3 HorFreq: 37900 Hz Clock: 40.000 MHz
  800x600@75Hz 4:3 HorFreq: 46900 Hz Clock: 49.500 MHz
  832x624@75Hz 4:3 HorFreq: 49726 Hz Clock: 57.284 MHz
  1024x768@60Hz 4:3 HorFreq: 48400 Hz Clock: 65.000 MHz
  1024x768@75Hz 4:3 HorFreq: 60000 Hz Clock: 78.750 MHz
  1280x1024@75Hz 5:4 HorFreq: 80000 Hz Clock: 135.000 MHz
  1152x870@75Hz 192:145 HorFreq: 67500 Hz Clock: 108.000 MHz
Standard timings supported:
  1280x1024@60Hz 5:4 HorFreq: 64000 Hz Clock: 108.000 MHz
  1280x960@60Hz 4:3 HorFreq: 60000 Hz Clock: 108.000 MHz
  1152x864@75Hz 4:3 HorFreq: 67500 Hz Clock: 108.000 MHz
  1440x900@60Hz 16:10 HorFreq: 55500 Hz Clock: 88.750 MHz
Detailed mode: Clock 119.000 MHz, 434 mm x 270 mm
               1680 1728 1760 1840 hborder 0
               1050 1053 1059 1080 vborder 0
               +hsync -vsync 
               VertFreq: 59 Hz, HorFreq: 64673 Hz
Detailed mode: Clock 146.250 MHz, 434 mm x 270 mm
               1680 1784 1960 2240 hborder 0
               1050 1053 1059 1089 vborder 0
               -hsync +vsync 
               VertFreq: 59 Hz, HorFreq: 65290 Hz
Monitor ranges (GTF): 56-75Hz V, 28-83kHz H, max dotclock 150MHz
Monitor name: M228WA
Checksum: 0x94 (valid)
