edid-decode (hex):

00 ff ff ff ff ff ff 00 4f 2d 15 00 38 56 4c 05
2f 0f 01 03 68 00 00 ff ea bb b9 a3 52 46 98 24
0f 48 4c ef ee 00 81 80 01 01 01 01 01 01 01 01
01 01 01 01 01 01 00 00 00 10 00 20 20 20 20 20
20 20 20 0a 20 20 20 20 00 00 00 ff 00 38 38 38
38 38 38 30 31 0a 20 20 20 20 00 00 00 fc 00 56
54 45 4b 0a 20 20 20 20 20 20 20 20 00 00 00 fd
00 39 4c 1e 50 0b 00 0a 20 20 20 20 20 20 00 30

----------------

Block 0, Base EDID:
  EDID Structure Version & Revision: 1.3
  Vendor & Product Identification:
    Manufacturer: SYM
    Model: 21
    Serial Number: ...
    Made in: week 47 of 2005
  Basic Display Parameters & Features:
    Analog display
    Input voltage level: 0.7/0.7 V
    Blank level equals black level
    Sync: Separate
    Image size is variable
    Gamma is defined in an extension block
    DPMS levels: Standby Suspend Off
    RGB color display
    First detailed timing is the preferred timing
  Color Characteristics:
    Red  : 0.6386, 0.3232
    Green: 0.2753, 0.5966
    Blue : 0.1425, 0.0615
    White: 0.2832, 0.2978
  Established Timings I & II:
    IBM     :   720x400    70.081663 Hz   9:5     31.467 kHz     28.320000 MHz
    IBM     :   720x400    87.849542 Hz   9:5     39.444 kHz     35.500000 MHz
    DMT 0x04:   640x480    59.940476 Hz   4:3     31.469 kHz     25.175000 MHz
    DMT 0x05:   640x480    72.808802 Hz   4:3     37.861 kHz     31.500000 MHz
    DMT 0x06:   640x480    75.000000 Hz   4:3     37.500 kHz     31.500000 MHz
    DMT 0x08:   800x600    56.250000 Hz   4:3     35.156 kHz     36.000000 MHz
    DMT 0x09:   800x600    60.316541 Hz   4:3     37.879 kHz     40.000000 MHz
    DMT 0x0a:   800x600    72.187572 Hz   4:3     48.077 kHz     50.000000 MHz
    DMT 0x0b:   800x600    75.000000 Hz   4:3     46.875 kHz     49.500000 MHz
    Apple   :   832x624    74.551266 Hz   4:3     49.726 kHz     57.284000 MHz
    DMT 0x10:  1024x768    60.003840 Hz   4:3     48.363 kHz     65.000000 MHz
    DMT 0x11:  1024x768    70.069359 Hz   4:3     56.476 kHz     75.000000 MHz
    DMT 0x12:  1024x768    75.028582 Hz   4:3     60.023 kHz     78.750000 MHz
  Standard Timings:
    DMT 0x23:  1280x1024   60.019740 Hz   5:4     63.981 kHz    108.000000 MHz
  Detailed Timing Descriptors:
    Dummy Descriptor:
    Display Product Serial Number: ...
    Display Product Name: 'VTEK'
    Display Range Limits:
      Monitor ranges (GTF): 57-76 Hz V, 30-80 kHz H, max dotclock 110 MHz
Checksum: 0x30

----------------

Failures:

Block 0, Base EDID:
  Standard Timings: Missing preferred timing.
  Dummy Descriptor: Dummy block filled with garbage.
EDID:
  Base EDID: Some timings are out of range of the Monitor Ranges:
    Vertical Freq: 56.250 - 87.850 Hz (Monitor: 57.000 - 76.000 Hz)

EDID conformity: FAIL
