
EDID (hex):
00ffffffffffff004c2d0f0d4e534e30
2f19010380341d782a5295a556549d25
0e505423080081c0810081809500a9c0
b30001010101023a801871382d40582c
450009252100001e011d007251d01e20
6e28550009252100001e000000fd0032
3c1e5111000a202020202020000000fc
00533234453530300a202020202001f0

Extracted contents:
header:          00 ff ff ff ff ff ff 00
serial number:   4c 2d 0f 0d 4e 53 4e 30 2f 19
version:         01 03
basic params:    80 34 1d 78 2a
chroma info:     52 95 a5 56 54 9d 25 0e 50 54
established:     23 08 00
standard:        81 c0 81 00 81 80 95 00 a9 c0 b3 00 01 01 01 01
descriptor 1:    02 3a 80 18 71 38 2d 40 58 2c 45 00 09 25 21 00 00 1e
descriptor 2:    01 1d 00 72 51 d0 1e 20 6e 28 55 00 09 25 21 00 00 1e
descriptor 3:    00 00 00 fd 00 32 3c 1e 51 11 00 0a 20 20 20 20 20 20
descriptor 4:    00 00 00 fc 00 53 32 34 45 35 30 30 0a 20 20 20 20 20
extensions:      01
checksum:        f0

EDID version: 1.3
Manufacturer: SAM Model d0f Serial Number --
Made in week 47 of 2015
Digital display
Maximum image size: 52 cm x 29 cm
Gamma: 2.20
DPMS levels: Off
RGB color display
First detailed timing is preferred timing
Display x,y Chromaticity:
  Red:   0.6455, 0.3369
  Green: 0.3281, 0.6152
  Blue:  0.1464, 0.0556
  White: 0.3134, 0.3291
Established timings supported:
  640x480@60Hz 4:3 HorFreq: 31469 Hz Clock: 25.175 MHz
  800x600@56Hz 4:3 HorFreq: 35200 Hz Clock: 36.000 MHz
  800x600@60Hz 4:3 HorFreq: 37900 Hz Clock: 40.000 MHz
  1024x768@60Hz 4:3 HorFreq: 48400 Hz Clock: 65.000 MHz
Standard timings supported:
  1280x720@60Hz 16:9
  1280x800@60Hz 16:10
  1280x1024@60Hz 5:4 HorFreq: 64000 Hz Clock: 108.000 MHz
  1440x900@60Hz 16:10 HorFreq: 55500 Hz Clock: 88.750 MHz
  1600x900@60Hz 16:9
  1680x1050@60Hz 16:10 HorFreq: 64700 Hz Clock: 119.000 MHz
Detailed mode: Clock 148.500 MHz, 521 mm x 293 mm
               1920 2008 2052 2200 hborder 0
               1080 1084 1089 1125 vborder 0
               +hsync +vsync 
               VertFreq: 60 Hz, HorFreq: 67500 Hz
Detailed mode: Clock 74.250 MHz, 521 mm x 293 mm
               1280 1390 1430 1650 hborder 0
                720  725  730  750 vborder 0
               +hsync +vsync 
               VertFreq: 60 Hz, HorFreq: 45000 Hz
Monitor ranges (GTF): 50-60Hz V, 30-81kHz H, max dotclock 170MHz
Monitor name: S24E500
Has 1 extension blocks
Checksum: 0xf0 (valid)
