edid-decode (hex):

00 ff ff ff ff ff ff 00 09 d1 64 76 2f 01 00 00
2c 0d 01 03 68 1f 17 78 ea f7 e0 9d 58 4a 97 25
19 50 54 bd ee 00 01 01 01 01 01 01 01 01 01 01
01 01 01 01 01 01 64 19 00 40 41 00 26 30 18 88
36 00 30 e4 10 00 00 18 d5 09 80 a0 20 5e 63 10
10 60 52 08 30 e4 10 00 00 1a 00 00 00 fd 00 38
4b 1f 3f 08 0a 20 20 20 20 20 20 20 00 00 00 fc
00 42 45 4e 51 20 46 50 35 36 37 73 0a 20 00 57

----------------

Block 0, Base EDID:
  EDID Structure Version & Revision: 1.3
  Vendor & Product Identification:
    Manufacturer: BNQ
    Model: 30308
    Serial Number: ...
    Made in: week 44 of 2003
  Basic Display Parameters & Features:
    Analog display
    Input voltage level: 0.7/0.7 V
    Sync: Separate
    Maximum image size: 31 cm x 23 cm
    Gamma: 2.20
    DPMS levels: Standby Suspend Off
    RGB color display
    First detailed timing is the preferred timing
  Color Characteristics:
    Red  : 0.6162, 0.3466
    Green: 0.2900, 0.5927
    Blue : 0.1474, 0.0996
    White: 0.3125, 0.3281
  Established Timings I & II:
    IBM     :   720x400    70.082 Hz   9:5    31.467 kHz  28.320 MHz
    DMT 0x04:   640x480    59.940 Hz   4:3    31.469 kHz  25.175 MHz
    Apple   :   640x480    66.667 Hz   4:3    35.000 kHz  30.240 MHz
    DMT 0x05:   640x480    72.809 Hz   4:3    37.861 kHz  31.500 MHz
    DMT 0x06:   640x480    75.000 Hz   4:3    37.500 kHz  31.500 MHz
    DMT 0x09:   800x600    60.317 Hz   4:3    37.879 kHz  40.000 MHz
    DMT 0x0a:   800x600    72.188 Hz   4:3    48.077 kHz  50.000 MHz
    DMT 0x0b:   800x600    75.000 Hz   4:3    46.875 kHz  49.500 MHz
    Apple   :   832x624    74.551 Hz   4:3    49.726 kHz  57.284 MHz
    DMT 0x10:  1024x768    60.004 Hz   4:3    48.363 kHz  65.000 MHz
    DMT 0x11:  1024x768    70.069 Hz   4:3    56.476 kHz  75.000 MHz
    DMT 0x12:  1024x768    75.029 Hz   4:3    60.023 kHz  78.750 MHz
  Standard Timings: none
  Detailed Timing Descriptors:
    DTD 1:  1024x768    60.004 Hz   4:3    48.363 kHz  65.000 MHz (304 mm x 228 mm)
                 Hfront   24 Hsync 136 Hback 160 Hpol N
                 Vfront    3 Vsync   6 Vback  29 Vpol N
    DTD 2:   640x350    70.072 Hz  64:35   31.462 kHz  25.170 MHz (304 mm x 228 mm)
                 Hfront   16 Hsync  96 Hback  48 Hpol P
                 Vfront   37 Vsync   2 Vback  60 Vpol N
  Display Range Limits:
    Monitor ranges (Unknown (0x0a)): 56-75 Hz V, 31-63 kHz H, max dotclock 80 MHz
    Display Product Name: 'BENQ FP567s'
Checksum: 0x57

----------------

Failures:

Block 0, Base EDID:
  Display Range Limits: Unknown range class (0x0a).
  Display Range Limits: Byte 11 is 0x20 instead of 0x0a.

EDID conformity: FAIL
