
EDID (hex):
00ffffffffffff0030e4d70300000000
00160104951f11780a4bb59458569128
1f505400000001010101010101010101
010101010101da1d56e250002030442d
470035ae10000019e21356e250002030
442d470035ae10000019000000fe0037
30563033803134305748320a00000000
00004131940010000009010a2020004c

Extracted contents:
header:          00 ff ff ff ff ff ff 00
serial number:   30 e4 d7 03 00 00 00 00 00 16
version:         01 04
basic params:    95 1f 11 78 0a
chroma info:     4b b5 94 58 56 91 28 1f 50 54
established:     00 00 00
standard:        01 01 01 01 01 01 01 01 01 01 01 01 01 01 01 01
descriptor 1:    da 1d 56 e2 50 00 20 30 44 2d 47 00 35 ae 10 00 00 19
descriptor 2:    e2 13 56 e2 50 00 20 30 44 2d 47 00 35 ae 10 00 00 19
descriptor 3:    00 00 00 fe 00 37 30 56 30 33 80 31 34 30 57 48 32 0a
descriptor 4:    00 00 00 00 00 00 41 31 94 00 10 00 00 09 01 0a 20 20
extensions:      00
checksum:        4c

EDID version: 1.4
Manufacturer: LGD Model 3d7 Serial Number --
Made in year 2012
Digital display
6 bits per primary color channel
DisplayPort interface
Maximum image size: 31 cm x 17 cm
Gamma: 2.20
Supported color formats: RGB 4:4:4, YCrCb 4:4:4
First detailed timing includes the native pixel format and preferred refresh rate
Display x,y Chromaticity:
  Red:   0.5791, 0.3437
  Green: 0.3378, 0.5693
  Blue:  0.1582, 0.1240
  White: 0.3134, 0.3291
Established timings supported:
Standard timings supported:
Detailed mode: Clock 76.420 MHz, 309 mm x 174 mm
               1366 1434 1479 1592 hborder 0
                768  772  779  800 vborder 0
               -hsync -vsync 
               VertFreq: 60 Hz, HorFreq: 48002 Hz
Detailed mode: Clock 50.900 MHz, 309 mm x 174 mm
               1366 1434 1479 1592 hborder 0
                768  772  779  800 vborder 0
               -hsync -vsync 
               VertFreq: 39 Hz, HorFreq: 31972 Hz
ASCII string: 70V03
Manufacturer-specified data, tag 0
Checksum: 0x4c (valid)
EDID block does NOT conform to EDID 1.4!
	Missing name descriptor
	Missing monitor ranges
	Detailed block string not properly terminated
