
EDID (hex):
00ffffffffffff0030ae354000000000
00130103801e1378ea1f359359558a28
22505400000001010101010101010101
010101010101121b007c502016303020
360030be100000188a16007c50201630
3020360030be100000180000000f0081
0a32810a2816090030e40502000000fe
004c503134315758352d544c503300e6

Extracted contents:
header:          00 ff ff ff ff ff ff 00
serial number:   30 ae 35 40 00 00 00 00 00 13
version:         01 03
basic params:    80 1e 13 78 ea
chroma info:     1f 35 93 59 55 8a 28 22 50 54
established:     00 00 00
standard:        01 01 01 01 01 01 01 01 01 01 01 01 01 01 01 01
descriptor 1:    12 1b 00 7c 50 20 16 30 30 20 36 00 30 be 10 00 00 18
descriptor 2:    8a 16 00 7c 50 20 16 30 30 20 36 00 30 be 10 00 00 18
descriptor 3:    00 00 00 0f 00 81 0a 32 81 0a 28 16 09 00 30 e4 05 02
descriptor 4:    00 00 00 fe 00 4c 50 31 34 31 57 58 35 2d 54 4c 50 33
extensions:      00
checksum:        e6

EDID version: 1.3
Manufacturer: LEN Model 4035 Serial Number --
Made in year 2009
Digital display
Maximum image size: 30 cm x 19 cm
Gamma: 2.20
DPMS levels: Standby Suspend Off
RGB color display
First detailed timing is preferred timing
Display x,y Chromaticity:
  Red:   0.5742, 0.3486
  Green: 0.3349, 0.5419
  Blue:  0.1562, 0.1357
  White: 0.3134, 0.3291
Established timings supported:
Standard timings supported:
Detailed mode: Clock 69.300 MHz, 304 mm x 190 mm
               1280 1328 1360 1404 hborder 0
                800  803  809  822 vborder 0
               -hsync -vsync 
               VertFreq: 60 Hz, HorFreq: 49358 Hz
Detailed mode: Clock 57.700 MHz, 304 mm x 190 mm
               1280 1328 1360 1404 hborder 0
                800  803  809  822 vborder 0
               -hsync -vsync 
               VertFreq: 49 Hz, HorFreq: 41096 Hz
Manufacturer-specified data, tag 15
ASCII string: LP141WX5-TLP3
Checksum: 0xe6 (valid)
EDID block does NOT conform to EDID 1.3!
	Missing name descriptor
	Missing monitor ranges
