edid-decode (hex):

00 ff ff ff ff ff ff 00 30 ae 35 40 00 00 00 00
31 12 01 03 80 1e 13 78 ea 93 65 94 59 56 91 28
22 50 54 00 00 00 01 01 01 01 01 01 01 01 01 01
01 01 01 01 01 01 7b 1d 00 e6 50 20 21 30 45 2e
49 00 2f be 10 00 00 18 31 1b 00 64 51 20 33 30
6b 47 7d 00 2f be 10 00 00 18 00 00 00 0f 00 81
0a 32 81 0a 28 16 09 00 0d af 41 14 00 00 00 fe
00 4e 31 34 31 49 36 2d 4c 30 31 0a 20 20 00 83

----------------

Block 0, Base EDID:
  EDID Structure Version & Revision: 1.3
  Vendor & Product Identification:
    Manufacturer: LEN
    Model: 16437
    Made in: week 49 of 2008
  Basic Display Parameters & Features:
    Digital display
    Maximum image size: 30 cm x 19 cm
    Gamma: 2.20
    DPMS levels: Standby Suspend Off
    RGB color display
    First detailed timing is preferred timing
  Color Characteristics:
    Red  : 0.5800, 0.3486
    Green: 0.3359, 0.5693
    Blue : 0.1572, 0.1347
    White: 0.3134, 0.3291
  Established Timings I & II: none
  Standard Timings: none
  Detailed Timing Descriptors:
    DTD 1:  1280x800    60.000 Hz   8:5    49.980 kHz  75.470 MHz (303 mm x 190 mm)
                 Hfront   69 Hsync  46 Hback 115 Hpol N
                 Vfront    4 Vsync   9 Vback  20 Vpol N
    DTD 2:  1280x800    49.999 Hz   8:5    42.549 kHz  69.610 MHz (303 mm x 190 mm)
                 Hfront  107 Hsync  71 Hback 178 Hpol N
                 Vfront    7 Vsync  13 Vback  31 Vpol N
    Manufacturer-Specified Display Descriptor (0x0f): 00 0f 00 81 0a 32 81 0a 28 16 09 00 0d af 41 14 '.....2..(.....A.'
    Alphanumeric Data String: 'N141I6-L01'
Checksum: 0x83
