
EDID (hex):
00ffffffffffff0006b3222701010101
11210104b53c22783b9e20a8554ca026
0e5054bfef00714f81809500d1c00101
010101010101565e00a0a0a029503020
350055502100001c000000fd0030a5f3
f341010a202020202020000000fc0056
473237410a20202020202020000000ff
0052344c4d51533134363731380a017a
020323f148901d1e1f1405403f230907
0783010000e305e001e6060701737300
e2006a21fa0050a0a01e500a3c350055
502100001e28f80050a0a0405008203a
0055502100001eeaf70050a0a06f5028
20680055502100001a59e7006aa0a067
501520350055502100001a6fc200a0a0
a055503020350055502100001a0000ac

edid-decode (hex):

00 ff ff ff ff ff ff 00 06 b3 22 27 01 01 01 01
11 21 01 04 b5 3c 22 78 3b 9e 20 a8 55 4c a0 26
0e 50 54 bf ef 00 71 4f 81 80 95 00 d1 c0 01 01
01 01 01 01 01 01 56 5e 00 a0 a0 a0 29 50 30 20
35 00 55 50 21 00 00 1c 00 00 00 fd 00 30 a5 f3
f3 41 01 0a 20 20 20 20 20 20 00 00 00 fc 00 56
47 32 37 41 0a 20 20 20 20 20 20 20 00 00 00 ff
00 52 34 4c 4d 51 53 31 34 36 37 31 38 0a 01 7a

02 03 23 f1 48 90 1d 1e 1f 14 05 40 3f 23 09 07
07 83 01 00 00 e3 05 e0 01 e6 06 07 01 73 73 00
e2 00 6a 21 fa 00 50 a0 a0 1e 50 0a 3c 35 00 55
50 21 00 00 1e 28 f8 00 50 a0 a0 40 50 08 20 3a
00 55 50 21 00 00 1e ea f7 00 50 a0 a0 6f 50 28
20 68 00 55 50 21 00 00 1a 59 e7 00 6a a0 a0 67
50 15 20 35 00 55 50 21 00 00 1a 6f c2 00 a0 a0
a0 55 50 30 20 35 00 55 50 21 00 00 1a 00 00 ac

----------------

Block 0, Base EDID:
  EDID Structure Version & Revision: 1.4
  Vendor & Product Identification:
    Manufacturer: AUS
    Model: 10018
    Serial Number: 16843009
    Made in: week 17 of 2023
  Basic Display Parameters & Features:
    Digital display
    Bits per primary color channel: 10
    DisplayPort interface
    Maximum image size: 60 cm x 34 cm
    Gamma: 2.20
    DPMS levels: Off
    Supported color formats: RGB 4:4:4, YCrCb 4:4:4, YCrCb 4:2:2
    First detailed timing includes the native pixel format and preferred refresh rate
    Display is continuous frequency
  Color Characteristics:
    Red  : 0.6582, 0.3330
    Green: 0.2998, 0.6269
    Blue : 0.1484, 0.0566
    White: 0.3125, 0.3281
  Established Timings I & II:
    IBM     :   720x400    70.081663 Hz   9:5     31.467 kHz     28.320000 MHz
    DMT 0x04:   640x480    59.940476 Hz   4:3     31.469 kHz     25.175000 MHz
    Apple   :   640x480    66.666667 Hz   4:3     35.000 kHz     30.240000 MHz
    DMT 0x05:   640x480    72.808802 Hz   4:3     37.861 kHz     31.500000 MHz
    DMT 0x06:   640x480    75.000000 Hz   4:3     37.500 kHz     31.500000 MHz
    DMT 0x08:   800x600    56.250000 Hz   4:3     35.156 kHz     36.000000 MHz
    DMT 0x09:   800x600    60.316541 Hz   4:3     37.879 kHz     40.000000 MHz
    DMT 0x0a:   800x600    72.187572 Hz   4:3     48.077 kHz     50.000000 MHz
    DMT 0x0b:   800x600    75.000000 Hz   4:3     46.875 kHz     49.500000 MHz
    Apple   :   832x624    74.551266 Hz   4:3     49.726 kHz     57.284000 MHz
    DMT 0x10:  1024x768    60.003840 Hz   4:3     48.363 kHz     65.000000 MHz
    DMT 0x11:  1024x768    70.069359 Hz   4:3     56.476 kHz     75.000000 MHz
    DMT 0x12:  1024x768    75.028582 Hz   4:3     60.023 kHz     78.750000 MHz
    DMT 0x24:  1280x1024   75.024675 Hz   5:4     79.976 kHz    135.000000 MHz
  Standard Timings:
    DMT 0x15:  1152x864    75.000000 Hz   4:3     67.500 kHz    108.000000 MHz
    DMT 0x23:  1280x1024   60.019740 Hz   5:4     63.981 kHz    108.000000 MHz
    DMT 0x2f:  1440x900    59.887445 Hz  16:10    55.935 kHz    106.500000 MHz
    DMT 0x52:  1920x1080   60.000000 Hz  16:9     67.500 kHz    148.500000 MHz
  Detailed Timing Descriptors:
    DTD 1:  2560x1440   59.950550 Hz  16:9     88.787 kHz    241.500000 MHz (597 mm x 336 mm)
                 Hfront   48 Hsync  32 Hback   80 Hpol N
                 Vfront    3 Vsync   5 Vback   33 Vpol P
    Display Range Limits:
      Monitor ranges (Bare Limits): 48-165 Hz V, 243-243 kHz H, max dotclock 650 MHz
    Display Product Name: 'VG27A'
    Display Product Serial Number: 'R4LMQS146718'
  Extension blocks: 1
Checksum: 0x7a

----------------

Block 1, CTA-861 Extension Block:
  Revision: 3
  Underscans IT Video Formats by default
  Basic audio support
  Supports YCbCr 4:4:4
  Supports YCbCr 4:2:2
  Native detailed modes: 1
  Video Data Block:
    VIC  16:  1920x1080   60.000000 Hz  16:9     67.500 kHz    148.500000 MHz (native)
    VIC  29:  1440x576    50.000000 Hz   4:3     31.250 kHz     54.000000 MHz
    VIC  30:  1440x576    50.000000 Hz  16:9     31.250 kHz     54.000000 MHz
    VIC  31:  1920x1080   50.000000 Hz  16:9     56.250 kHz    148.500000 MHz
    VIC  20:  1920x1080i  50.000000 Hz  16:9     28.125 kHz     74.250000 MHz
    VIC   5:  1920x1080i  60.000000 Hz  16:9     33.750 kHz     74.250000 MHz
    VIC  64:  1920x1080  100.000000 Hz  16:9    112.500 kHz    297.000000 MHz
    VIC  63:  1920x1080  120.000000 Hz  16:9    135.000 kHz    297.000000 MHz
  Audio Data Block:
    Linear PCM:
      Max channels: 2
      Supported sample rates (kHz): 48 44.1 32
      Supported sample sizes (bits): 24 20 16
  Speaker Allocation Data Block:
    FL/FR - Front Left/Right
  Colorimetry Data Block:
    BT2020cYCC
    BT2020YCC
    BT2020RGB
    Gamut Boundary Description Metadata Profile P0
  HDR Static Metadata Data Block:
    Electro optical transfer functions:
      Traditional gamma - SDR luminance range
      Traditional gamma - HDR luminance range
      SMPTE ST2084
    Supported static metadata descriptors:
      Static metadata type 1
    Desired content max luminance: 115 (603.666 cd/m^2)
    Desired content max frame-average luminance: 115 (603.666 cd/m^2)
    Desired content min luminance: 0 (0.000 cd/m^2)
  Video Capability Data Block:
    YCbCr quantization: No Data
    RGB quantization: Selectable (via AVI Q)
    PT scan behavior: Always Underscanned
    IT scan behavior: Always Underscanned
    CE scan behavior: Always Underscanned
  Detailed Timing Descriptors:
    DTD 2:  2560x1440  164.999485 Hz  16:9    242.549 kHz    640.330000 MHz (597 mm x 336 mm)
                 Hfront   10 Hsync  60 Hback   10 Hpol P
                 Vfront    3 Vsync   5 Vback   22 Vpol P
    DTD 3:  2560x1440  159.997582 Hz  16:9    240.636 kHz    635.280000 MHz (597 mm x 336 mm)
                 Hfront    8 Hsync  32 Hback   40 Hpol P
                 Vfront    3 Vsync  10 Vback   51 Vpol P
    DTD 4:  2560x1440  154.997753 Hz  16:9    240.402 kHz    634.660000 MHz (597 mm x 336 mm)
                 Hfront   40 Hsync  32 Hback    8 Hpol P
                 Vfront    6 Vsync   8 Vback   97 Vpol N
    DTD 5:  2560x1440  143.972318 Hz  16:9    222.149 kHz    592.250000 MHz (597 mm x 336 mm)
                 Hfront   21 Hsync  32 Hback   53 Hpol P
                 Vfront    3 Vsync   5 Vback   95 Vpol N
    DTD 6:  2560x1440  119.997589 Hz  16:9    182.996 kHz    497.750000 MHz (597 mm x 336 mm)
                 Hfront   48 Hsync  32 Hback   80 Hpol P
                 Vfront    3 Vsync   5 Vback   77 Vpol N
Checksum: 0xac  Unused space in Extension Block: 2 bytes


