edid-decode (hex):

00 ff ff ff ff ff ff 00 2c ee 00 24 00 00 00 00
1c 1a 01 04 a5 34 20 78 33 87 e5 a4 56 50 9e 26
0d 50 54 af cb 00 b3 00 95 00 81 80 81 c0 71 4f
a9 c0 8b c0 01 00 02 3a 80 18 71 38 2d 40 58 2c
45 00 dd 0c 11 00 00 1e 00 00 00 fd 00 28 90 a7
a7 0a 01 0a 20 20 20 20 20 20 00 00 00 fc 00 4b
41 4c 45 44 32 34 31 34 34 46 0a 20 00 00 00 10
00 00 00 00 00 00 00 00 00 00 00 00 00 00 01 c5

02 03 0c c1 23 09 07 07 83 01 00 00 2a 82 80 50
70 38 4d 40 08 20 f8 0c 36 aa 10 00 00 1a 8a 6f
80 a0 70 38 40 40 30 20 35 00 40 44 21 00 00 1a
00 00 00 00 00 00 00 00 00 00 00 00 00 00 00 00
00 00 00 00 00 00 00 00 00 00 00 00 00 00 00 00
00 00 00 00 00 00 00 00 00 00 00 00 00 00 00 00
00 00 00 00 00 00 00 00 00 00 00 00 00 00 00 00
00 00 00 00 00 00 00 00 00 00 00 00 00 00 00 04

----------------

Block 0, Base EDID:
  EDID Structure Version & Revision: 1.4
  Vendor & Product Identification:
    Manufacturer: KGN
    Model: 9216
    Made in: week 28 of 2016
  Basic Display Parameters & Features:
    Digital display
    Bits per primary color channel: 8
    DisplayPort interface
    Maximum image size: 52 cm x 32 cm
    Gamma: 2.20
    DPMS levels: Off
    Supported color formats: RGB 4:4:4, YCrCb 4:2:2
    First detailed timing includes the native pixel format and preferred refresh rate
    Display is continuous frequency
  Color Characteristics:
    Red  : 0.6425, 0.3359
    Green: 0.3134, 0.6201
    Blue : 0.1513, 0.0527
    White: 0.3134, 0.3291
  Established Timings I & II:
    IBM     :   720x400    70.082 Hz   9:5    31.467 kHz  28.320 MHz
    DMT 0x04:   640x480    59.940 Hz   4:3    31.469 kHz  25.175 MHz
    DMT 0x05:   640x480    72.809 Hz   4:3    37.861 kHz  31.500 MHz
    DMT 0x06:   640x480    75.000 Hz   4:3    37.500 kHz  31.500 MHz
    DMT 0x08:   800x600    56.250 Hz   4:3    35.156 kHz  36.000 MHz
    DMT 0x09:   800x600    60.317 Hz   4:3    37.879 kHz  40.000 MHz
    DMT 0x0a:   800x600    72.188 Hz   4:3    48.077 kHz  50.000 MHz
    DMT 0x0b:   800x600    75.000 Hz   4:3    46.875 kHz  49.500 MHz
    DMT 0x10:  1024x768    60.004 Hz   4:3    48.363 kHz  65.000 MHz
    DMT 0x12:  1024x768    75.029 Hz   4:3    60.023 kHz  78.750 MHz
    DMT 0x24:  1280x1024   75.025 Hz   5:4    79.976 kHz 135.000 MHz
  Standard Timings:
    DMT 0x3a:  1680x1050   59.954 Hz  16:10   65.290 kHz 146.250 MHz
    DMT 0x2f:  1440x900    59.887 Hz  16:10   55.935 kHz 106.500 MHz
    DMT 0x23:  1280x1024   60.020 Hz   5:4    63.981 kHz 108.000 MHz
    DMT 0x55:  1280x720    60.000 Hz  16:9    45.000 kHz  74.250 MHz
    DMT 0x15:  1152x864    75.000 Hz   4:3    67.500 kHz 108.000 MHz
    DMT 0x53:  1600x900    60.000 Hz  16:9    60.000 kHz 108.000 MHz (RB)
    CVT     :  1360x768    59.799 Hz  16:9    47.720 kHz  84.750 MHz (EDID 1.4 source)
    GTF     :  1360x768    60.000 Hz  16:9    47.700 kHz  84.715 MHz (EDID 1.3 source)
  Detailed Timing Descriptors:
    DTD 1:  1920x1080   60.000 Hz  16:9    67.500 kHz 148.500 MHz (477 mm x 268 mm)
                 Hfront   88 Hsync  44 Hback 148 Hpol P
                 Vfront    4 Vsync   5 Vback  36 Vpol P
  Display Range Limits:
    Monitor ranges (Bare Limits): 40-144 Hz V, 167-167 kHz H, max dotclock 100 MHz
    Display Product Name: 'KALED24144F'
    Dummy Descriptor:
  Extension blocks: 1
Checksum: 0xc5

----------------

Block 1, CTA-861 Extension Block:
  Revision: 3
  Underscans PC formats by default
  Basic audio support
  Native detailed modes: 1
  Audio Data Block:
    Linear PCM:
      Max channels: 2
      Supported sample rates (kHz): 48 44.1 32
      Supported sample sizes (bits): 24 20 16
  Speaker Allocation Data Block:
    FL/FR - Front Left/Right
  Detailed Timing Descriptors:
    DTD 2:  1920x1080  144.002 Hz  16:9   166.610 kHz 333.220 MHz (310 mm x 170 mm)
                 Hfront    8 Hsync  32 Hback  40 Hpol P
                 Vfront   63 Vsync   8 Vback   6 Vpol N
    DTD 3:  1920x1080  119.999 Hz  16:9   137.279 kHz 285.540 MHz (576 mm x 324 mm)
                 Hfront   48 Hsync  32 Hback  80 Hpol P
                 Vfront    3 Vsync   5 Vback  56 Vpol N
Checksum: 0x4
