edid-decode (hex):

00 ff ff ff ff ff ff 00 2d e1 30 00 01 00 00 00
01 12 01 03 80 73 41 78 0a cf 74 a3 57 4c b0 23
09 48 4c 21 08 00 8b 00 81 c0 61 40 81 80 01 01
01 01 01 01 01 01 01 1d 00 72 51 d0 1e 20 6e 28
55 00 c4 8e 21 00 00 1e 01 1d 80 18 71 1c 16 20
58 2c 25 00 c4 8e 21 00 00 9e 00 00 00 fc 00 4b
4f 4e 4b 41 20 4c 43 44 54 56 0a 20 00 00 00 fd
00 16 50 0e 5b 10 00 0a 20 20 20 20 20 20 01 e6

----------------

Block 0, Base EDID:
  EDID Structure Version & Revision: 1.3
  Vendor & Product Identification:
    Manufacturer: KOA
    Model: 48
    Serial Number: ...
    Made in: week 1 of 2008
  Basic Display Parameters & Features:
    Digital display
    Maximum image size: 115 cm x 65 cm
    Gamma: 2.20
    RGB color display
    First detailed timing is the preferred timing
  Color Characteristics:
    Red  : 0.6396, 0.3398
    Green: 0.2998, 0.6904
    Blue : 0.1376, 0.0380
    White: 0.2822, 0.2968
  Established Timings I & II:
    DMT 0x04:   640x480    59.940 Hz   4:3    31.469 kHz  25.175 MHz
    DMT 0x09:   800x600    60.317 Hz   4:3    37.879 kHz  40.000 MHz
    DMT 0x10:  1024x768    60.004 Hz   4:3    48.363 kHz  65.000 MHz
  Standard Timings:
    GTF     :  1360x856    60.000 Hz  16:10   53.160 kHz  95.263 MHz
    DMT 0x55:  1280x720    60.000 Hz  16:9    45.000 kHz  74.250 MHz
    DMT 0x10:  1024x768    60.004 Hz   4:3    48.363 kHz  65.000 MHz
    DMT 0x23:  1280x1024   60.020 Hz   5:4    63.981 kHz 108.000 MHz
  Detailed Timing Descriptors:
    DTD 1:  1280x720    60.000 Hz  16:9    45.000 kHz  74.250 MHz (708 mm x 398 mm)
                 Hfront  110 Hsync  40 Hback 220 Hpol P
                 Vfront    5 Vsync   5 Vback  20 Vpol P
    DTD 2:  1920x1080i  60.000 Hz  16:9    33.750 kHz  74.250 MHz (708 mm x 398 mm)
                 Hfront   88 Hsync  44 Hback 148 Hpol P
                 Vfront    2 Vsync   5 Vback  15 Vpol P Vfront +0.5 Odd Field
                 Vfront    2 Vsync   5 Vback  15 Vpol P Vback  +0.5 Even Field
    Display Product Name: 'KONKA LCDTV'
  Display Range Limits:
    Monitor ranges (GTF): 22-80 Hz V, 14-91 kHz H, max dotclock 160 MHz
  Extension blocks: 1
Checksum: 0xe6

----------------

Failures:

Block 0, Base EDID:
  Detailed Timing Descriptor #1: Mismatch of image size 708x398 mm vs display size 1150x650 mm.
  Detailed Timing Descriptor #2: Mismatch of image size 708x398 mm vs display size 1150x650 mm.
  Base EDID: EDID specified 1 extension block(s), but found 0 extension block(s).

EDID conformity: FAIL
