
EDID (hex):
00ffffffffffff0009e5570700000000
011b01049522137802f100945c589229
21505400000001010101010101010101
010101010101ce1d56e250001e303020
360058c21000001a0000000000000000
0000000000000000001a000000fe0042
4f452043510a202020202020000000fe
004e5431353657484d2d4e34340a0080

Extracted contents:
header:          00 ff ff ff ff ff ff 00
serial number:   09 e5 57 07 00 00 00 00 01 1b
version:         01 04
basic params:    95 22 13 78 02
chroma info:     f1 00 94 5c 58 92 29 21 50 54
established:     00 00 00
standard:        01 01 01 01 01 01 01 01 01 01 01 01 01 01 01 01
descriptor 1:    ce 1d 56 e2 50 00 1e 30 30 20 36 00 58 c2 10 00 00 1a
descriptor 2:    00 00 00 00 00 00 00 00 00 00 00 00 00 00 00 00 00 1a
descriptor 3:    00 00 00 fe 00 42 4f 45 20 43 51 0a 20 20 20 20 20 20
descriptor 4:    00 00 00 fe 00 4e 54 31 35 36 57 48 4d 2d 4e 34 34 0a
extensions:      00
checksum:        80

EDID version: 1.4
Manufacturer: BOE Model 757 Serial Number --
Made in week 1 of 2017
Digital display
6 bits per primary color channel
DisplayPort interface
Maximum image size: 34 cm x 19 cm
Gamma: 2.20
Supported color formats: RGB 4:4:4
First detailed timing includes the native pixel format and preferred refresh rate
Display x,y Chromaticity:
  Red:   0.5810, 0.3623
  Green: 0.3437, 0.5712
  Blue:  0.1601, 0.1289
  White: 0.3125, 0.3281
Established timings supported:
Standard timings supported:
Detailed mode: Clock 76.300 MHz, 344 mm x 194 mm
               1366 1414 1446 1592 hborder 0
                768  771  777  798 vborder 0
               +hsync -vsync 
               VertFreq: 60 Hz, HorFreq: 47927 Hz
Manufacturer-specified data, tag 0
ASCII string: BOE CQ
ASCII string: NT156WHM-N44
Checksum: 0x80 (valid)
EDID block does NOT conform to EDID 1.4!
	Missing name descriptor
	Missing monitor ranges
