edid-decode (hex):

00 ff ff ff ff ff ff 00 0a 6c 26 98 26 08 23 20
21 21 01 04 b5 1f 0c 78 22 62 6e a1 54 57 94 21
14 4c 54 00 00 00 81 c0 01 01 01 01 01 01 01 01
01 01 01 01 01 01 04 27 80 0e 71 d0 28 20 30 20
63 00 35 73 10 00 00 1e 00 00 00 fd 00 38 4b 1e
53 0d 00 0a 20 20 20 20 20 20 00 00 00 fc 00 4b
33 0a 20 20 20 20 20 20 20 20 20 20 00 00 00 ff
00 4b 33 2d 32 30 32 33 30 38 32 36 0a 20 01 09

02 03 14 c2 41 04 23 09 7f 07 83 01 00 00 65 03
0c 00 10 00 01 1d 80 18 71 1c 16 20 58 2c 25 00
16 7c 10 00 00 1e 00 00 00 00 00 00 00 00 00 00
00 00 00 00 00 00 00 00 00 00 00 00 00 00 00 00
00 00 00 00 00 00 00 00 00 00 00 00 00 00 00 00
00 00 00 00 00 00 00 00 00 00 00 00 00 00 00 00
00 00 00 00 00 00 00 00 00 00 00 00 00 00 00 00
00 00 00 00 00 00 00 00 00 00 00 00 00 00 00 44

00 ff ff ff ff ff ff 00 0a 6c 26 98 26 08 23 20
21 21 01 04 b5 1f 0c 78 22 62 6e a1 54 57 94 21
14 4c 54 00 00 00 81 c0 01 01 01 01 01 01 01 01
01 01 01 01 01 01 04 27 80 0e 71 d0 28 20 30 20
63 00 35 73 10 00 00 1e 00 00 00 fd 00 38 4b 1e
53 0d 00 0a 20 20 20 20 20 20 00 00 00 fc 00 4b
33 0a 20 20 20 20 20 20 20 20 20 20 00 00 00 ff
00 4b 33 2d 32 30 32 33 30 38 32 36 0a 20 01 09

02 03 14 c2 41 04 23 09 7f 07 83 01 00 00 65 03
0c 00 10 00 01 1d 80 18 71 1c 16 20 58 2c 25 00
16 7c 10 00 00 1e 00 00 00 00 00 00 00 00 00 00
00 00 00 00 00 00 00 00 00 00 00 00 00 00 00 00
00 00 00 00 00 00 00 00 00 00 00 00 00 00 00 00
00 00 00 00 00 00 00 00 00 00 00 00 00 00 00 00
00 00 00 00 00 00 00 00 00 00 00 00 00 00 00 00
00 00 00 00 00 00 00 00 00 00 00 00 00 00 00 44

----------------

Block 0, Base EDID:
  EDID Structure Version & Revision: 1.4
  Vendor & Product Identification:
    Manufacturer: BSL
    Model: 38950
    Serial Number: ...
    Made in: week 33 of 2023
  Basic Display Parameters & Features:
    Digital display
    Bits per primary color channel: 10
    DisplayPort interface
    Maximum image size: 31 cm x 12 cm
    Gamma: 2.20
    DPMS levels: Off
    Supported color formats: RGB 4:4:4
    First detailed timing includes the native pixel format and preferred refresh rate
  Color Characteristics:
    Red  : 0.6298, 0.3300
    Green: 0.3398, 0.5800
    Blue : 0.1298, 0.0800
    White: 0.2998, 0.3300
  Established Timings I & II: none
  Standard Timings:
    DMT 0x55:  1280x720    60.000000 Hz  16:9     45.000 kHz     74.250000 MHz
  Detailed Timing Descriptors:
    DTD 1:  1920x720    60.009613 Hz   8:3     45.607 kHz     99.880000 MHz (309 mm x 115 mm)
                 Hfront   48 Hsync  32 Hback  190 Hpol P
                 Vfront    6 Vsync   3 Vback   31 Vpol P
    Display Range Limits:
      Monitor ranges (GTF): 56-75 Hz V, 30-83 kHz H, max dotclock 130 MHz
    Display Product Name: 'K3'
    Display Product Serial Number: ...
  Extension blocks: 1
Checksum: 0x09

----------------

Block 1, CTA-861 Extension Block:
  Revision: 3
  Underscans IT Video Formats by default
  Basic audio support
  Native detailed modes: 2
  Video Data Block:
    VIC   4:  1280x720    60.000000 Hz  16:9     45.000 kHz     74.250000 MHz
  Audio Data Block:
    Linear PCM:
      Max channels: 2
      Supported sample rates (kHz): 192 176.4 96 88.2 48 44.1 32
      Supported sample sizes (bits): 24 20 16
  Speaker Allocation Data Block:
    FL/FR - Front Left/Right
  Vendor-Specific Data Block (HDMI), OUI 00-0C-03:
    Source physical address: 1.0.0.0
  Detailed Timing Descriptors:
    DTD 2:  1920x540    60.053381 Hz  32:9     33.750 kHz     74.250000 MHz (278 mm x 124 mm)
                 Hfront   88 Hsync  44 Hback  148 Hpol P
                 Vfront    2 Vsync   5 Vback   15 Vpol P
Checksum: 0x44  Unused space in Extension Block: 89 bytes

----------------

Block 2, Unknown EDID Extension Block 0x00:
  00 ff ff ff ff ff ff 00 0a 6c 26 98 26 08 23 20 '.........l&.&.# '
  21 21 01 04 b5 1f 0c 78 22 62 6e a1 54 57 94 21 '!!.....x"bn.TW.!'
  14 4c 54 00 00 00 81 c0 01 01 01 01 01 01 01 01 '.LT.............'
  01 01 01 01 01 01 04 27 80 0e 71 d0 28 20 30 20 '.......'..q.( 0 '
  63 00 35 73 10 00 00 1e 00 00 00 fd 00 38 4b 1e 'c.5s.........8K.'
  53 0d 00 0a 20 20 20 20 20 20 00 00 00 fc 00 4b 'S...      .....K'
  33 0a 20 20 20 20 20 20 20 20 20 20 00 00 00 ff '3.          ....'
  00 4b 33 2d 32 30 32 33 30 38 32 36 0a 20 01 09 '.K3-20230826. ..'
Checksum: 0x09

----------------

Block 3, CTA-861 Extension Block:
  Revision: 3
  Underscans IT Video Formats by default
  Basic audio support
  Native detailed modes: 2
  Video Data Block:
    VIC   4:  1280x720    60.000000 Hz  16:9     45.000 kHz     74.250000 MHz
  Audio Data Block:
    Linear PCM:
      Max channels: 2
      Supported sample rates (kHz): 192 176.4 96 88.2 48 44.1 32
      Supported sample sizes (bits): 24 20 16
  Speaker Allocation Data Block:
    FL/FR - Front Left/Right
  Vendor-Specific Data Block (HDMI), OUI 00-0C-03:
    Source physical address: 1.0.0.0
  Detailed Timing Descriptors:
    DTD 3:  1920x540    60.053381 Hz  32:9     33.750 kHz     74.250000 MHz (278 mm x 124 mm)
                 Hfront   88 Hsync  44 Hback  148 Hpol P
                 Vfront    2 Vsync   5 Vback   15 Vpol P
Checksum: 0x44  Unused space in Extension Block: 89 bytes

----------------

Warnings:

Block 0, Base EDID:
  Display Range Limits: GTF support is deprecated in EDID 1.4.
Block 1, CTA-861 Extension Block:
  Display Product Serial Number is set, so the Serial Number in the Base EDID should be 0.
  Add a Colorimetry Data Block with the sRGB colorimetry bit set to avoid interop issues.
Block 3, CTA-861 Extension Block:
  Display Product Serial Number is set, so the Serial Number in the Base EDID should be 0.
  Add a Colorimetry Data Block with the sRGB colorimetry bit set to avoid interop issues.

Failures:

Block 0, Base EDID:
  Display Range Limits: GTF can't be combined with non-continuous frequencies.
Block 1, CTA-861 Extension Block:
  Vendor-Specific Data Block (HDMI), OUI 00-0C-03: The HDMI Specification requires EDID 1.3 instead of 1.4.
  Required 640x480p60 timings are missing in the established timings and the SVD list (VIC 1).
  Missing VCDB, needed for Set Selectable RGB Quantization to avoid interop issues.
Block 2, Base EDID:
  Unknown Extension Block.
Block 3, CTA-861 Extension Block:
  Video Data Block: Duplicate VIC 4.
  Speaker Allocation Data Block: Only one instance of this Data Block is allowed.
  Vendor-Specific Data Block (HDMI), OUI 00-0C-03: The HDMI Specification requires EDID 1.3 instead of 1.4.
  Required 640x480p60 timings are missing in the established timings and the SVD list (VIC 1).
  Missing VCDB, needed for Set Selectable RGB Quantization to avoid interop issues.
EDID:
  Base EDID: EDID specified 1 extension block(s), but found 3 extension block(s).
  CTA-861: Native progressive timings are a mix of several resolutions.

EDID conformity: FAIL
