edid-decode (hex):

00 ff ff ff ff ff ff 00 4e 14 01 24 b9 06 00 00
26 11 01 03 81 34 20 78 2b b0 a6 a3 56 4a 9c 23
11 4f 53 bf ef 80 81 c0 81 40 95 00 b3 00 01 01
81 80 a9 40 71 40 28 3c 80 a0 70 b0 23 40 30 20
26 00 06 44 21 00 00 1c 1a 36 80 a0 70 38 1f 40
30 20 25 00 06 44 21 00 00 18 66 21 50 b0 51 00
1b 30 70 00 36 10 06 44 21 00 00 00 00 00 00 fc
00 53 63 65 70 74 72 65 20 58 32 34 57 47 00 e8

00 ff ff ff ff ff ff 00 4e 14 01 24 b9 06 00 00
26 11 01 03 81 34 20 78 2b b0 a6 a3 56 4a 9c 23
11 4f 53 bf ef 80 81 c0 81 40 95 00 b3 00 01 01
81 80 a9 40 71 40 28 3c 80 a0 70 b0 23 40 30 20
26 00 06 44 21 00 00 1c 1a 36 80 a0 70 38 1f 40
30 20 25 00 06 44 21 00 00 18 66 21 50 b0 51 00
1b 30 70 00 36 10 06 44 21 00 00 00 00 00 00 fc
00 53 63 65 70 74 72 65 20 58 32 34 57 47 00 e8

----------------

Block 0, Base EDID:
  EDID Structure Version & Revision: 1.3
  Vendor & Product Identification:
    Manufacturer: SPT
    Model: 9217
    Serial Number: ...
    Made in: week 38 of 2007
  Basic Display Parameters & Features:
    Digital display
    DFP 1.x compatible TMDS
    Maximum image size: 52 cm x 32 cm
    Gamma: 2.20
    DPMS levels: Off
    RGB color display
    First detailed timing is the preferred timing
    Supports GTF timings within operating range
  Color Characteristics:
    Red  : 0.6386, 0.3388
    Green: 0.2890, 0.6093
    Blue : 0.1386, 0.0683
    White: 0.3095, 0.3261
  Established Timings I & II:
    IBM     :   720x400    70.081663 Hz   9:5     31.467 kHz     28.320000 MHz
    DMT 0x04:   640x480    59.940476 Hz   4:3     31.469 kHz     25.175000 MHz
    Apple   :   640x480    66.666667 Hz   4:3     35.000 kHz     30.240000 MHz
    DMT 0x05:   640x480    72.808802 Hz   4:3     37.861 kHz     31.500000 MHz
    DMT 0x06:   640x480    75.000000 Hz   4:3     37.500 kHz     31.500000 MHz
    DMT 0x08:   800x600    56.250000 Hz   4:3     35.156 kHz     36.000000 MHz
    DMT 0x09:   800x600    60.316541 Hz   4:3     37.879 kHz     40.000000 MHz
    DMT 0x0a:   800x600    72.187572 Hz   4:3     48.077 kHz     50.000000 MHz
    DMT 0x0b:   800x600    75.000000 Hz   4:3     46.875 kHz     49.500000 MHz
    Apple   :   832x624    74.551266 Hz   4:3     49.726 kHz     57.284000 MHz
    DMT 0x10:  1024x768    60.003840 Hz   4:3     48.363 kHz     65.000000 MHz
    DMT 0x11:  1024x768    70.069359 Hz   4:3     56.476 kHz     75.000000 MHz
    DMT 0x12:  1024x768    75.028582 Hz   4:3     60.023 kHz     78.750000 MHz
    DMT 0x24:  1280x1024   75.024675 Hz   5:4     79.976 kHz    135.000000 MHz
    Apple   :  1152x870    75.061550 Hz 192:145   68.681 kHz    100.000000 MHz
  Standard Timings:
    DMT 0x55:  1280x720    60.000000 Hz  16:9     45.000 kHz     74.250000 MHz
    DMT 0x20:  1280x960    60.000000 Hz   4:3     60.000 kHz    108.000000 MHz
    DMT 0x2f:  1440x900    59.887445 Hz  16:10    55.935 kHz    106.500000 MHz
    DMT 0x3a:  1680x1050   59.954250 Hz  16:10    65.290 kHz    146.250000 MHz
    DMT 0x23:  1280x1024   60.019740 Hz   5:4     63.981 kHz    108.000000 MHz
    DMT 0x33:  1600x1200   60.000000 Hz   4:3     75.000 kHz    162.000000 MHz
    GTF     :  1152x864    60.000000 Hz   4:3     53.700 kHz     81.624000 MHz
  Detailed Timing Descriptors:
    DTD 1:  1920x1200   59.950171 Hz  16:10    74.038 kHz    154.000000 MHz (518 mm x 324 mm)
                 Hfront   48 Hsync  32 Hback   80 Hpol N
                 Vfront    2 Vsync   6 Vback   27 Vpol P
    DTD 2:  1920x1080   59.933878 Hz  16:9     66.587 kHz    138.500000 MHz (518 mm x 324 mm)
                 Hfront   48 Hsync  32 Hback   80 Hpol N
                 Vfront    2 Vsync   5 Vback   24 Vpol N
    DTD 3:  1360x768    60.015162 Hz  85:48    47.712 kHz     85.500000 MHz (analog composite, sync-on-green, 518 mm x 324 mm)
                 Hfront  112 Hsync 256 Hback   64 Hpol N
                 Vfront    3 Vsync   6 Vback   18 Vpol N
    Display Product Name: 'Sceptre X24WG'
Checksum: 0xe8

----------------

Block 1, Unknown EDID Extension Block 0x00:
  00 ff ff ff ff ff ff 00 4e 14 01 24 b9 06 00 00 '........N..$....'
  26 11 01 03 81 34 20 78 2b b0 a6 a3 56 4a 9c 23 '&....4 x+...VJ.#'
  11 4f 53 bf ef 80 81 c0 81 40 95 00 b3 00 01 01 '.OS......@......'
  81 80 a9 40 71 40 28 3c 80 a0 70 b0 23 40 30 20 '...@q@(<..p.#@0 '
  26 00 06 44 21 00 00 1c 1a 36 80 a0 70 38 1f 40 '&..D!....6..p8.@'
  30 20 25 00 06 44 21 00 00 18 66 21 50 b0 51 00 '0 %..D!...f!P.Q.'
  1b 30 70 00 36 10 06 44 21 00 00 00 00 00 00 fc '.0p.6..D!.......'
  00 53 63 65 70 74 72 65 20 58 32 34 57 47 00 e8 '.Sceptre X24WG..'
Checksum: 0xe8

----------------

Warnings:

Block 0, Base EDID:
  Detailed Timing Descriptor #1: DTD is similar but not identical to DMT 0x44.
  Detailed Timing Descriptor #3: DTD is similar but not identical to DMT 0x27.

Failures:

Block 0, Base EDID:
  Missing Display Range Limits Descriptor.
Block 1, Base EDID:
  Unknown Extension Block.
EDID:
  Base EDID: EDID specified 0 extension block(s), but found 1 extension block(s).

EDID conformity: FAIL
