edid-decode (hex):

00 ff ff ff ff ff ff 00 5a 63 31 bb 01 01 01 01
07 1a 01 04 a5 35 1e 78 37 64 35 a5 54 4f 9e 27
12 50 54 bf ef 80 b3 00 a9 40 95 00 90 40 81 80
81 40 81 c0 01 01 86 6f 80 a0 70 38 40 40 30 20
35 00 13 2b 21 00 00 1e 02 3a 80 18 71 38 2d 40
58 2c 45 00 13 2b 21 00 00 1e 00 00 00 fd 00 30
92 b4 b4 22 01 0a 20 20 20 20 20 20 00 00 00 fc
00 58 47 32 34 30 31 20 53 45 52 49 45 53 01 2b

02 03 1c f1 4f bf 40 10 05 04 03 07 1f 22 21 20
13 12 16 01 23 09 7f 07 83 01 00 00 02 3a 80 18
71 38 2d 40 58 2c 45 00 13 2b 21 00 00 1e 08 82
80 50 70 38 4d 40 08 20 f8 0c 13 2b 21 00 00 1c
01 1d 00 72 51 d0 1e 20 6e 28 55 00 13 2b 21 00
00 1e 8c 0a d0 8a 20 e0 2d 10 10 3e 96 00 13 2b
21 00 00 18 6d 58 80 50 70 38 35 40 08 20 78 08
13 2b 21 00 00 1c 00 00 00 00 00 00 00 00 00 6f

----------------

Block 0, Base EDID:
  EDID Structure Version & Revision: 1.4
  Vendor & Product Identification:
    Manufacturer: VSC
    Model: 47921
    Serial Number: ...
    Made in: week 7 of 2016
  Basic Display Parameters & Features:
    Digital display
    Bits per primary color channel: 8
    DisplayPort interface
    Maximum image size: 53 cm x 30 cm
    Gamma: 2.20
    DPMS levels: Off
    Supported color formats: RGB 4:4:4, YCrCb 4:2:2
    Default (sRGB) color space is primary color space
    First detailed timing includes the native pixel format and preferred refresh rate
    Display is continuous frequency
  Color Characteristics:
    Red  : 0.6455, 0.3300
    Green: 0.3095, 0.6171
    Blue : 0.1523, 0.0732
    White: 0.3134, 0.3291
  Established Timings I & II:
    IBM     :   720x400    70.082 Hz   9:5    31.467 kHz  28.320 MHz
    DMT 0x04:   640x480    59.940 Hz   4:3    31.469 kHz  25.175 MHz
    Apple   :   640x480    66.667 Hz   4:3    35.000 kHz  30.240 MHz
    DMT 0x05:   640x480    72.809 Hz   4:3    37.861 kHz  31.500 MHz
    DMT 0x06:   640x480    75.000 Hz   4:3    37.500 kHz  31.500 MHz
    DMT 0x08:   800x600    56.250 Hz   4:3    35.156 kHz  36.000 MHz
    DMT 0x09:   800x600    60.317 Hz   4:3    37.879 kHz  40.000 MHz
    DMT 0x0a:   800x600    72.188 Hz   4:3    48.077 kHz  50.000 MHz
    DMT 0x0b:   800x600    75.000 Hz   4:3    46.875 kHz  49.500 MHz
    Apple   :   832x624    74.551 Hz   4:3    49.726 kHz  57.284 MHz
    DMT 0x10:  1024x768    60.004 Hz   4:3    48.363 kHz  65.000 MHz
    DMT 0x11:  1024x768    70.069 Hz   4:3    56.476 kHz  75.000 MHz
    DMT 0x12:  1024x768    75.029 Hz   4:3    60.023 kHz  78.750 MHz
    DMT 0x24:  1280x1024   75.025 Hz   5:4    79.976 kHz 135.000 MHz
    Apple   :  1152x870    75.062 Hz 192:145  68.681 kHz 100.000 MHz
  Standard Timings:
    DMT 0x3a:  1680x1050   59.954 Hz  16:10   65.290 kHz 146.250 MHz
    DMT 0x33:  1600x1200   60.000 Hz   4:3    75.000 kHz 162.000 MHz
    DMT 0x2f:  1440x900    59.887 Hz  16:10   55.935 kHz 106.500 MHz
    DMT 0x2a:  1400x1050   59.978 Hz   4:3    65.317 kHz 121.750 MHz
    DMT 0x23:  1280x1024   60.020 Hz   5:4    63.981 kHz 108.000 MHz
    DMT 0x20:  1280x960    60.000 Hz   4:3    60.000 kHz 108.000 MHz
    DMT 0x55:  1280x720    60.000 Hz  16:9    45.000 kHz  74.250 MHz
  Detailed Timing Descriptors:
    DTD 1:  1920x1080  119.982 Hz  16:9   137.260 kHz 285.500 MHz (531 mm x 299 mm)
                 Hfront   48 Hsync  32 Hback  80 Hpol P
                 Vfront    3 Vsync   5 Vback  56 Vpol P
    DTD 2:  1920x1080   60.000 Hz  16:9    67.500 kHz 148.500 MHz (531 mm x 299 mm)
                 Hfront   88 Hsync  44 Hback 148 Hpol P
                 Vfront    4 Vsync   5 Vback  36 Vpol P
  Display Range Limits:
    Monitor ranges (Bare Limits): 48-146 Hz V, 180-180 kHz H, max dotclock 340 MHz
    Display Product Name: 'XG2401 SERIES'
  Extension blocks: 1
Checksum: 0x2b

----------------

Block 1, CTA-861 Extension Block:
  Revision: 3
  Underscans PC formats by default
  Basic audio support
  Supports YCbCr 4:4:4
  Supports YCbCr 4:2:2
  Native detailed modes: 1
  Video Data Block:
    VIC  63:  1920x1080  120.000 Hz  16:9   135.000 kHz 297.000 MHz (native)
    VIC  64:  1920x1080  100.000 Hz  16:9   112.500 kHz 297.000 MHz
    VIC  16:  1920x1080   60.000 Hz  16:9    67.500 kHz 148.500 MHz
    VIC   5:  1920x1080i  60.000 Hz  16:9    33.750 kHz  74.250 MHz
    VIC   4:  1280x720    60.000 Hz  16:9    45.000 kHz  74.250 MHz
    VIC   3:   720x480    59.940 Hz  16:9    31.469 kHz  27.000 MHz
    VIC   7:  1440x480i   59.940 Hz  16:9    15.734 kHz  27.000 MHz
    VIC  31:  1920x1080   50.000 Hz  16:9    56.250 kHz 148.500 MHz
    VIC  34:  1920x1080   30.000 Hz  16:9    33.750 kHz  74.250 MHz
    VIC  33:  1920x1080   25.000 Hz  16:9    28.125 kHz  74.250 MHz
    VIC  32:  1920x1080   24.000 Hz  16:9    27.000 kHz  74.250 MHz
    VIC  19:  1280x720    50.000 Hz  16:9    37.500 kHz  74.250 MHz
    VIC  18:   720x576    50.000 Hz  16:9    31.250 kHz  27.000 MHz
    VIC  22:  1440x576i   50.000 Hz  16:9    15.625 kHz  27.000 MHz
    VIC   1:   640x480    59.940 Hz   4:3    31.469 kHz  25.175 MHz
  Audio Data Block:
    Linear PCM:
      Max channels: 2
      Supported sample rates (kHz): 192 176.4 96 88.2 48 44.1 32
      Supported sample sizes (bits): 24 20 16
  Speaker Allocation Data Block:
    FL/FR - Front Left/Right
  Detailed Timing Descriptors:
    DTD 3:  1920x1080   60.000 Hz  16:9    67.500 kHz 148.500 MHz (531 mm x 299 mm)
                 Hfront   88 Hsync  44 Hback 148 Hpol P
                 Vfront    4 Vsync   5 Vback  36 Vpol P
    DTD 4:  1920x1080  143.855 Hz  16:9   166.440 kHz 332.880 MHz (531 mm x 299 mm)
                 Hfront    8 Hsync  32 Hback  40 Hpol N
                 Vfront   63 Vsync   8 Vback   6 Vpol P
    DTD 5:  1280x720    60.000 Hz  16:9    45.000 kHz  74.250 MHz (531 mm x 299 mm)
                 Hfront  110 Hsync  40 Hback 220 Hpol P
                 Vfront    5 Vsync   5 Vback  20 Vpol P
    DTD 6:   720x480    59.940 Hz   3:2    31.469 kHz  27.000 MHz (531 mm x 299 mm)
                 Hfront   16 Hsync  62 Hback  60 Hpol N
                 Vfront    9 Vsync   6 Vback  30 Vpol N
    DTD 7:  1920x1080   99.898 Hz  16:9   113.185 kHz 226.370 MHz (531 mm x 299 mm)
                 Hfront    8 Hsync  32 Hback  40 Hpol N
                 Vfront   39 Vsync   8 Vback   6 Vpol P
Checksum: 0x6f
