
EDID (hex):
00ffffffffffff005a6331bb01010101
251c0104a5351e78376435a5544f9e27
125054bfef80b300a940950090408180
814081c00101866f80a0703840403020
3500132b2100001e023a801871382d40
582c4500132b2100001e000000fd0030
92b4b422010a202020202020000000fc
0058473234303120534552494553010b
02031cf14fbf4010050403071f222120
1312160123097f0783010000023a8018
71382d40582c4500132b2100001e0882
805070384d400820f80c132b2100001c
011d007251d01e206e285500132b2100
001e8c0ad08a20e02d10103e9600132b
210000186d5880507038354008207808
132b2100001c0000000000000000006f

Extracted contents:
header:          00 ff ff ff ff ff ff 00
serial number:   5a 63 31 bb 01 01 01 01 25 1c
version:         01 04
basic params:    a5 35 1e 78 37
chroma info:     64 35 a5 54 4f 9e 27 12 50 54
established:     bf ef 80
standard:        b3 00 a9 40 95 00 90 40 81 80 81 40 81 c0 01 01
descriptor 1:    86 6f 80 a0 70 38 40 40 30 20 35 00 13 2b 21 00 00 1e
descriptor 2:    02 3a 80 18 71 38 2d 40 58 2c 45 00 13 2b 21 00 00 1e
descriptor 3:    00 00 00 fd 00 30 92 b4 b4 22 01 0a 20 20 20 20 20 20
descriptor 4:    00 00 00 fc 00 58 47 32 34 30 31 20 53 45 52 49 45 53
extensions:      01
checksum:        0b

EDID version: 1.4
Manufacturer: VSC Model bb31 Serial Number --
Made in week 37 of 2018
Digital display
8 bits per primary color channel
DisplayPort interface
Maximum image size: 53 cm x 30 cm
Gamma: 2.20
DPMS levels: Off
Supported color formats: RGB 4:4:4, YCrCb 4:2:2
Default (sRGB) color space is primary color space
First detailed timing includes the native pixel format and preferred refresh rate
Display is continuous frequency
Display x,y Chromaticity:
  Red:   0.6455, 0.3300
  Green: 0.3095, 0.6171
  Blue:  0.1523, 0.0732
  White: 0.3134, 0.3291
Established timings supported:
  720x400@70Hz 9:5 HorFreq: 31469 Hz Clock: 28.320 MHz
  640x480@60Hz 4:3 HorFreq: 31469 Hz Clock: 25.175 MHz
  640x480@67Hz 4:3 HorFreq: 35000 Hz Clock: 30.240 MHz
  640x480@72Hz 4:3 HorFreq: 37900 Hz Clock: 31.500 MHz
  640x480@75Hz 4:3 HorFreq: 37500 Hz Clock: 31.500 MHz
  800x600@56Hz 4:3 HorFreq: 35200 Hz Clock: 36.000 MHz
  800x600@60Hz 4:3 HorFreq: 37900 Hz Clock: 40.000 MHz
  800x600@72Hz 4:3 HorFreq: 48100 Hz Clock: 50.000 MHz
  800x600@75Hz 4:3 HorFreq: 46900 Hz Clock: 49.500 MHz
  832x624@75Hz 4:3 HorFreq: 49726 Hz Clock: 57.284 MHz
  1024x768@60Hz 4:3 HorFreq: 48400 Hz Clock: 65.000 MHz
  1024x768@70Hz 4:3 HorFreq: 56500 Hz Clock: 75.000 MHz
  1024x768@75Hz 4:3 HorFreq: 60000 Hz Clock: 78.750 MHz
  1280x1024@75Hz 5:4 HorFreq: 80000 Hz Clock: 135.000 MHz
  1152x870@75Hz 192:145 HorFreq: 67500 Hz Clock: 108.000 MHz
Standard timings supported:
  1680x1050@60Hz 16:10 HorFreq: 64700 Hz Clock: 119.000 MHz
  1600x1200@60Hz 4:3 HorFreq: 75000 Hz Clock: 162.000 MHz
  1440x900@60Hz 16:10 HorFreq: 55500 Hz Clock: 88.750 MHz
  1400x1050@60Hz 4:3 HorFreq: 64700 Hz Clock: 101.000 MHz
  1280x1024@60Hz 5:4 HorFreq: 64000 Hz Clock: 108.000 MHz
  1280x960@60Hz 4:3 HorFreq: 60000 Hz Clock: 108.000 MHz
  1280x720@60Hz 16:9
Detailed mode: Clock 285.500 MHz, 531 mm x 299 mm
               1920 1968 2000 2080 hborder 0
               1080 1083 1088 1144 vborder 0
               +hsync +vsync 
               VertFreq: 119 Hz, HorFreq: 137259 Hz
Detailed mode: Clock 148.500 MHz, 531 mm x 299 mm
               1920 2008 2052 2200 hborder 0
               1080 1084 1089 1125 vborder 0
               +hsync +vsync 
               VertFreq: 60 Hz, HorFreq: 67500 Hz
Monitor ranges (bare limits): 48-146Hz V, 180-180kHz H, max dotclock 340MHz
Has 1 extension blocks
Checksum: 0xb (valid)

CTA extension block
Extension version: 3
24 bytes of CTA data
  Video data block
    VIC  63 1920x1080@120Hz 16:9 (native) HorFreq: 135000 Hz Clock: 297.000 MHz
    VIC  64 1920x1080@100Hz 16:9  HorFreq: 112500 Hz Clock: 297.000 MHz
    VIC  16 1920x1080@60Hz 16:9  HorFreq: 67500 Hz Clock: 148.500 MHz
    VIC   5 1920x1080i@60Hz 16:9  HorFreq: 33750 Hz Clock: 74.250 MHz
    VIC   4 1280x720@60Hz 16:9  HorFreq: 45000 Hz Clock: 74.250 MHz
    VIC   3 720x480@60Hz 16:9  HorFreq: 31469 Hz Clock: 27.000 MHz
    VIC   7 1440x480i@60Hz 16:9  HorFreq: 15734 Hz Clock: 27.000 MHz
    VIC  31 1920x1080@50Hz 16:9  HorFreq: 56250 Hz Clock: 148.500 MHz
    VIC  34 1920x1080@30Hz 16:9  HorFreq: 33750 Hz Clock: 74.250 MHz
    VIC  33 1920x1080@25Hz 16:9  HorFreq: 28125 Hz Clock: 74.250 MHz
    VIC  32 1920x1080@24Hz 16:9  HorFreq: 27000 Hz Clock: 74.250 MHz
    VIC  19 1280x720@50Hz 16:9  HorFreq: 37500 Hz Clock: 74.250 MHz
    VIC  18 720x576@50Hz 16:9  HorFreq: 31250 Hz Clock: 27.000 MHz
    VIC  22 1440x576i@50Hz 16:9  HorFreq: 15625 Hz Clock: 27.000 MHz
    VIC   1 640x480@60Hz 4:3  HorFreq: 31469 Hz Clock: 25.175 MHz
  Audio data block
    Linear PCM, max channels 2
      Supported sample rates (kHz): 192 176.4 96 88.2 48 44.1 32
      Supported sample sizes (bits): 24 20 16
  Speaker allocation data block
    Speaker map:
      FL/FR - Front Left/Right
Underscans PC formats by default
Basic audio support
Supports YCbCr 4:4:4
Supports YCbCr 4:2:2
1 native detailed modes
Detailed mode: Clock 148.500 MHz, 531 mm x 299 mm
               1920 2008 2052 2200 hborder 0
               1080 1084 1089 1125 vborder 0
               +hsync +vsync 
               VertFreq: 60 Hz, HorFreq: 67500 Hz
Detailed mode: Clock 332.880 MHz, 531 mm x 299 mm
               1920 1928 1960 2000 hborder 0
               1080 1143 1151 1157 vborder 0
               -hsync +vsync 
               VertFreq: 143 Hz, HorFreq: 166440 Hz
Detailed mode: Clock 74.250 MHz, 531 mm x 299 mm
               1280 1390 1430 1650 hborder 0
                720  725  730  750 vborder 0
               +hsync +vsync 
               VertFreq: 60 Hz, HorFreq: 45000 Hz
Detailed mode: Clock 27.000 MHz, 531 mm x 299 mm
                720  736  798  858 hborder 0
                480  489  495  525 vborder 0
               -hsync -vsync 
               VertFreq: 59 Hz, HorFreq: 31468 Hz
Detailed mode: Clock 226.370 MHz, 531 mm x 299 mm
               1920 1928 1960 2000 hborder 0
               1080 1119 1127 1133 vborder 0
               -hsync +vsync 
               VertFreq: 99 Hz, HorFreq: 113185 Hz
Checksum: 0x6f (valid)

EDID block does NOT conform to EDID 1.4!
	sRGB is signaled, but the chromaticities do not match
	Name descriptor not terminated with a newline
Warning: One or more of the timings is out of range of the Monitor Ranges:
  Vertical Freq: 24 - 143 Hz
  Horizontal Freq: 15625 - 166440 Hz
  Maximum Clock: 332.880 MHz


