edid-decode (hex):

00 ff ff ff ff ff ff 00 30 ae cc 60 01 01 01 01
34 19 01 04 a5 2f 1e 78 3a c5 45 a3 57 52 9f 27
0d 50 54 bd cf 00 71 4f 81 80 81 8c 95 00 95 0f
81 00 b3 0f 01 01 21 39 90 30 62 1a 27 40 68 b0
36 00 da 28 11 00 00 1c 00 00 00 fd 00 32 4b 1e
51 15 00 0a 20 20 20 20 20 20 00 00 00 fc 00 4c
45 4e 20 54 32 32 35 34 70 43 0a 20 00 00 00 ff
00 56 4e 2d 41 30 52 58 54 42 0a 20 20 20 01 36

02 03 18 f0 4b 04 03 02 07 16 01 06 11 12 15 13
23 09 7f 07 83 01 00 00 66 21 56 aa 51 00 1e 30
46 8f 33 00 da 28 11 00 00 1e 30 2a 40 c8 60 84
64 30 18 50 13 00 da 28 11 00 00 1e 01 1d 00 72
51 d0 1e 20 6e 28 55 00 da 28 11 00 00 1e 66 21
50 b0 51 00 1b 30 40 70 36 00 da 28 11 00 00 1e
a9 1a 00 a0 50 00 16 30 30 20 37 00 da 28 11 00
00 1a 00 00 00 00 00 00 00 00 00 00 00 00 00 23

00 ff ff ff ff ff ff 00 30 ae cc 60 01 01 01 01
34 19 01 04 a5 2f 1e 78 3a c5 45 a3 57 52 9f 27
0d 50 54 bd cf 00 71 4f 81 80 81 8c 95 00 95 0f
81 00 b3 0f 01 01 21 39 90 30 62 1a 27 40 68 b0
36 00 da 28 11 00 00 1c 00 00 00 fd 00 32 4b 1e
51 15 00 0a 20 20 20 20 20 20 00 00 00 fc 00 4c
45 4e 20 54 32 32 35 34 70 43 0a 20 00 00 00 ff
00 56 4e 2d 41 30 52 58 54 42 0a 20 20 20 01 36

02 03 18 f0 4b 04 03 02 07 16 01 06 11 12 15 13
23 09 7f 07 83 01 00 00 66 21 56 aa 51 00 1e 30
46 8f 33 00 da 28 11 00 00 1e 30 2a 40 c8 60 84
64 30 18 50 13 00 da 28 11 00 00 1e 01 1d 00 72
51 d0 1e 20 6e 28 55 00 da 28 11 00 00 1e 66 21
50 b0 51 00 1b 30 40 70 36 00 da 28 11 00 00 1e
a9 1a 00 a0 50 00 16 30 30 20 37 00 da 28 11 00
00 1a 00 00 00 00 00 00 00 00 00 00 00 00 00 23

----------------

Block 0, Base EDID:
  EDID Structure Version & Revision: 1.4
  Vendor & Product Identification:
    Manufacturer: LEN
    Model: 24780
    Serial Number: ...
    Made in: week 52 of 2015
  Basic Display Parameters & Features:
    Digital display
    Bits per primary color channel: 8
    DisplayPort interface
    Maximum image size: 47 cm x 30 cm
    Gamma: 2.20
    DPMS levels: Off
    Supported color formats: RGB 4:4:4, YCrCb 4:4:4, YCrCb 4:2:2
    First detailed timing includes the native pixel format and preferred refresh rate
  Color Characteristics:
    Red  : 0.6396, 0.3398
    Green: 0.3212, 0.6220
    Blue : 0.1533, 0.0507
    White: 0.3134, 0.3291
  Established Timings I & II:
    IBM     :   720x400    70.081663 Hz   9:5     31.467 kHz     28.320000 MHz
    DMT 0x04:   640x480    59.940476 Hz   4:3     31.469 kHz     25.175000 MHz
    Apple   :   640x480    66.666667 Hz   4:3     35.000 kHz     30.240000 MHz
    DMT 0x05:   640x480    72.808802 Hz   4:3     37.861 kHz     31.500000 MHz
    DMT 0x06:   640x480    75.000000 Hz   4:3     37.500 kHz     31.500000 MHz
    DMT 0x09:   800x600    60.316541 Hz   4:3     37.879 kHz     40.000000 MHz
    DMT 0x0a:   800x600    72.187572 Hz   4:3     48.077 kHz     50.000000 MHz
    DMT 0x0b:   800x600    75.000000 Hz   4:3     46.875 kHz     49.500000 MHz
    DMT 0x10:  1024x768    60.003840 Hz   4:3     48.363 kHz     65.000000 MHz
    DMT 0x11:  1024x768    70.069359 Hz   4:3     56.476 kHz     75.000000 MHz
    DMT 0x12:  1024x768    75.028582 Hz   4:3     60.023 kHz     78.750000 MHz
    DMT 0x24:  1280x1024   75.024675 Hz   5:4     79.976 kHz    135.000000 MHz
  Standard Timings:
    DMT 0x15:  1152x864    75.000000 Hz   4:3     67.500 kHz    108.000000 MHz
    DMT 0x23:  1280x1024   60.019740 Hz   5:4     63.981 kHz    108.000000 MHz
    GTF     :  1280x1024   72.000069 Hz   5:4     76.824 kHz    132.752000 MHz
    DMT 0x2f:  1440x900    59.887445 Hz  16:10    55.935 kHz    106.500000 MHz
    DMT 0x30:  1440x900    74.984427 Hz  16:10    70.635 kHz    136.750000 MHz
    DMT 0x1c:  1280x800    59.810326 Hz  16:10    49.702 kHz     83.500000 MHz
    DMT 0x3b:  1680x1050   74.892027 Hz  16:10    82.306 kHz    187.000000 MHz
  Detailed Timing Descriptors:
    DTD  1:  1680x1050   59.954250 Hz  16:10    65.290 kHz    146.250000 MHz (474 mm x 296 mm)
                  Hfront  104 Hsync 176 Hback  280 Hpol N
                  Vfront    3 Vsync   6 Vback   30 Vpol P
    Display Range Limits:
      Monitor ranges (GTF): 50-75 Hz V, 30-81 kHz H, max dotclock 210 MHz
    Display Product Name: 'LEN T2254pC'
    Display Product Serial Number: ...
  Extension blocks: 1
Checksum: 0x36

----------------

Block 1, CTA-861 Extension Block:
  Revision: 3
  Underscans IT Video Formats by default
  Basic audio support
  Supports YCbCr 4:4:4
  Supports YCbCr 4:2:2
  Native detailed modes: 0
  Video Data Block:
    VIC   4:  1280x720    60.000000 Hz  16:9     45.000 kHz     74.250000 MHz
    VIC   3:   720x480    59.940060 Hz  16:9     31.469 kHz     27.000000 MHz
    VIC   2:   720x480    59.940060 Hz   4:3     31.469 kHz     27.000000 MHz
    VIC   7:  1440x480i   59.940060 Hz  16:9     15.734 kHz     27.000000 MHz
    VIC  22:  1440x576i   50.000000 Hz  16:9     15.625 kHz     27.000000 MHz
    VIC   1:   640x480    59.940476 Hz   4:3     31.469 kHz     25.175000 MHz
    VIC   6:  1440x480i   59.940060 Hz   4:3     15.734 kHz     27.000000 MHz
    VIC  17:   720x576    50.000000 Hz   4:3     31.250 kHz     27.000000 MHz
    VIC  18:   720x576    50.000000 Hz  16:9     31.250 kHz     27.000000 MHz
    VIC  21:  1440x576i   50.000000 Hz   4:3     15.625 kHz     27.000000 MHz
    VIC  19:  1280x720    50.000000 Hz  16:9     37.500 kHz     74.250000 MHz
  Audio Data Block:
    Linear PCM:
      Max channels: 2
      Supported sample rates (kHz): 192 176.4 96 88.2 48 44.1 32
      Supported sample sizes (bits): 24 20 16
  Speaker Allocation Data Block:
    FL/FR - Front Left/Right
  Detailed Timing Descriptors:
    DTD  2:  1366x768    59.789541 Hz 683:384   47.712 kHz     85.500000 MHz (474 mm x 296 mm)
                  Hfront   70 Hsync 143 Hback  213 Hpol P
                  Vfront    3 Vsync   3 Vback   24 Vpol P
    DTD  3:  1600x900    60.000000 Hz  16:9     60.000 kHz    108.000000 MHz (474 mm x 296 mm)
                  Hfront   24 Hsync  80 Hback   96 Hpol P
                  Vfront    1 Vsync   3 Vback   96 Vpol P
    DTD  4:  1280x720    60.000000 Hz  16:9     45.000 kHz     74.250000 MHz (474 mm x 296 mm)
                  Hfront  110 Hsync  40 Hback  220 Hpol P
                  Vfront    5 Vsync   5 Vback   20 Vpol P
    DTD  5:  1360x768    60.015162 Hz  85:48    47.712 kHz     85.500000 MHz (474 mm x 296 mm)
                  Hfront   64 Hsync 112 Hback  256 Hpol P
                  Vfront    3 Vsync   6 Vback   18 Vpol P
    DTD  6:  1280x768    59.994726 Hz   5:3     47.396 kHz     68.250000 MHz (474 mm x 296 mm)
                  Hfront   48 Hsync  32 Hback   80 Hpol P
                  Vfront    3 Vsync   7 Vback   12 Vpol N
Checksum: 0x23  Unused space in Extension Block: 13 bytes

----------------

Block 2, Unknown EDID Extension Block 0x00:
  00 ff ff ff ff ff ff 00 30 ae cc 60 01 01 01 01 '........0..`....'
  34 19 01 04 a5 2f 1e 78 3a c5 45 a3 57 52 9f 27 '4..../.x:.E.WR.''
  0d 50 54 bd cf 00 71 4f 81 80 81 8c 95 00 95 0f '.PT...qO........'
  81 00 b3 0f 01 01 21 39 90 30 62 1a 27 40 68 b0 '......!9.0b.'@h.'
  36 00 da 28 11 00 00 1c 00 00 00 fd 00 32 4b 1e '6..(.........2K.'
  51 15 00 0a 20 20 20 20 20 20 00 00 00 fc 00 4c 'Q...      .....L'
  45 4e 20 54 32 32 35 34 70 43 0a 20 00 00 00 ff 'EN T2254pC. ....'
  00 56 4e 2d 41 30 52 58 54 42 0a 20 20 20 01 36 '.VN-A0RXTB.   .6'
Checksum: 0x36

----------------

Block 3, CTA-861 Extension Block:
  Revision: 3
  Underscans IT Video Formats by default
  Basic audio support
  Supports YCbCr 4:4:4
  Supports YCbCr 4:2:2
  Native detailed modes: 0
  Video Data Block:
    VIC   4:  1280x720    60.000000 Hz  16:9     45.000 kHz     74.250000 MHz
    VIC   3:   720x480    59.940060 Hz  16:9     31.469 kHz     27.000000 MHz
    VIC   2:   720x480    59.940060 Hz   4:3     31.469 kHz     27.000000 MHz
    VIC   7:  1440x480i   59.940060 Hz  16:9     15.734 kHz     27.000000 MHz
    VIC  22:  1440x576i   50.000000 Hz  16:9     15.625 kHz     27.000000 MHz
    VIC   1:   640x480    59.940476 Hz   4:3     31.469 kHz     25.175000 MHz
    VIC   6:  1440x480i   59.940060 Hz   4:3     15.734 kHz     27.000000 MHz
    VIC  17:   720x576    50.000000 Hz   4:3     31.250 kHz     27.000000 MHz
    VIC  18:   720x576    50.000000 Hz  16:9     31.250 kHz     27.000000 MHz
    VIC  21:  1440x576i   50.000000 Hz   4:3     15.625 kHz     27.000000 MHz
    VIC  19:  1280x720    50.000000 Hz  16:9     37.500 kHz     74.250000 MHz
  Audio Data Block:
    Linear PCM:
      Max channels: 2
      Supported sample rates (kHz): 192 176.4 96 88.2 48 44.1 32
      Supported sample sizes (bits): 24 20 16
  Speaker Allocation Data Block:
    FL/FR - Front Left/Right
  Detailed Timing Descriptors:
    DTD  7:  1366x768    59.789541 Hz 683:384   47.712 kHz     85.500000 MHz (474 mm x 296 mm)
                  Hfront   70 Hsync 143 Hback  213 Hpol P
                  Vfront    3 Vsync   3 Vback   24 Vpol P
    DTD  8:  1600x900    60.000000 Hz  16:9     60.000 kHz    108.000000 MHz (474 mm x 296 mm)
                  Hfront   24 Hsync  80 Hback   96 Hpol P
                  Vfront    1 Vsync   3 Vback   96 Vpol P
    DTD  9:  1280x720    60.000000 Hz  16:9     45.000 kHz     74.250000 MHz (474 mm x 296 mm)
                  Hfront  110 Hsync  40 Hback  220 Hpol P
                  Vfront    5 Vsync   5 Vback   20 Vpol P
    DTD 10:  1360x768    60.015162 Hz  85:48    47.712 kHz     85.500000 MHz (474 mm x 296 mm)
                  Hfront   64 Hsync 112 Hback  256 Hpol P
                  Vfront    3 Vsync   6 Vback   18 Vpol P
    DTD 11:  1280x768    59.994726 Hz   5:3     47.396 kHz     68.250000 MHz (474 mm x 296 mm)
                  Hfront   48 Hsync  32 Hback   80 Hpol P
                  Vfront    3 Vsync   7 Vback   12 Vpol N
Checksum: 0x23  Unused space in Extension Block: 13 bytes

----------------

Warnings:

Block 0, Base EDID:
  Display Range Limits: GTF support is deprecated in EDID 1.4.
Block 1, CTA-861 Extension Block:
  Video Data Block: VIC 4 is the preferred timing, overriding the first detailed timings. Is this intended?
  Display Product Serial Number is set, so the Serial Number in the Base EDID should be 0.
  Add a Colorimetry Data Block with the sRGB colorimetry bit set to avoid interop issues.
Block 3, CTA-861 Extension Block:
  Display Product Serial Number is set, so the Serial Number in the Base EDID should be 0.
  Add a Colorimetry Data Block with the sRGB colorimetry bit set to avoid interop issues.
EDID:
  Base EDID: Some timings are out of range of the Monitor Ranges:
    Horizontal Freq: 15.625 - 82.306 kHz (Monitor: 30.000 - 81.000 kHz)

Failures:

Block 0, Base EDID:
  Display Range Limits: GTF can't be combined with non-continuous frequencies.
Block 1, CTA-861 Extension Block:
  Missing VCDB, needed for Set Selectable RGB Quantization to avoid interop issues.
Block 2, Base EDID:
  Unknown Extension Block.
Block 3, CTA-861 Extension Block:
  Video Data Block: Duplicate VIC 4.
  Video Data Block: Duplicate VIC 3.
  Video Data Block: Duplicate VIC 2.
  Video Data Block: Duplicate VIC 7.
  Video Data Block: Duplicate VIC 22.
  Video Data Block: Duplicate VIC 1.
  Video Data Block: Duplicate VIC 6.
  Video Data Block: Duplicate VIC 17.
  Video Data Block: Duplicate VIC 18.
  Video Data Block: Duplicate VIC 21.
  Video Data Block: Duplicate VIC 19.
  Speaker Allocation Data Block: Only one instance of this Data Block is allowed.
  Missing VCDB, needed for Set Selectable RGB Quantization to avoid interop issues.
EDID:
  Base EDID: EDID specified 1 extension block(s), but found 3 extension block(s).

EDID conformity: FAIL
