
EDID (hex):
00ffffffffffff0030e48e0201000000
00130103801f11780a8e359358569029
20505400000001010101010101010101
010101010101bc1b5688500014303020
350036ae100000190000000000000000
00000000000000000000000000fe004c
4720446973706c61790a2020000000fe
004c503134305748322d544c5131008c

Extracted contents:
header:          00 ff ff ff ff ff ff 00
serial number:   30 e4 8e 02 01 00 00 00 00 13
version:         01 03
basic params:    80 1f 11 78 0a
chroma info:     8e 35 93 58 56 90 29 20 50 54
established:     00 00 00
standard:        01 01 01 01 01 01 01 01 01 01 01 01 01 01 01 01
descriptor 1:    bc 1b 56 88 50 00 14 30 30 20 35 00 36 ae 10 00 00 19
descriptor 2:    00 00 00 00 00 00 00 00 00 00 00 00 00 00 00 00 00 00
descriptor 3:    00 00 00 fe 00 4c 47 20 44 69 73 70 6c 61 79 0a 20 20
descriptor 4:    00 00 00 fe 00 4c 50 31 34 30 57 48 32 2d 54 4c 51 31
extensions:      00
checksum:        8c

EDID version: 1.3
Manufacturer: LGD Model 28e Serial Number --
Made in year 2009
Digital display
Maximum image size: 31 cm x 17 cm
Gamma: 2.20
RGB color display
First detailed timing is preferred timing
Display x,y Chromaticity:
  Red:   0.5761, 0.3437
  Green: 0.3388, 0.5644
  Blue:  0.1601, 0.1279
  White: 0.3134, 0.3291
Established timings supported:
Standard timings supported:
Detailed mode: Clock 71.000 MHz, 310 mm x 174 mm
               1366 1414 1446 1502 hborder 0
                768  771  776  788 vborder 0
               -hsync -vsync 
               VertFreq: 59 Hz, HorFreq: 47270 Hz
Manufacturer-specified data, tag 0
ASCII string: LG Display
ASCII string: LP140WH2-TLQ1
Checksum: 0x8c (valid)
EDID block does NOT conform to EDID 1.3!
	Missing name descriptor
	Missing monitor ranges
