edid-decode (hex):

00 ff ff ff ff ff ff 00 4d 10 15 15 00 00 00 00
0d 1f 01 04 a5 22 15 78 0e de 50 a3 54 4c 99 26
0f 50 54 00 00 00 01 01 01 01 01 01 01 01 01 01
01 01 01 01 01 01 28 3c 80 a0 70 b0 23 40 30 20
36 00 50 d2 10 00 00 18 20 30 80 a0 70 b0 23 40
30 20 36 00 50 d2 10 00 00 18 00 00 00 fe 00 44
57 37 58 4e 82 4c 51 31 35 36 4e 31 00 00 00 00
00 02 41 03 32 00 12 00 00 0a 01 0a 20 20 00 d0

00 ff ff ff ff ff ff 00 4d 10 15 15 00 00 00 00
0d 1f 01 04 a5 22 15 78 0e de 50 a3 54 4c 99 26
0f 50 54 00 00 00 01 01 01 01 01 01 01 01 01 01
01 01 01 01 01 01 28 3c 80 a0 70 b0 23 40 30 20
36 00 50 d2 10 00 00 18 20 30 80 a0 70 b0 23 40
30 20 36 00 50 d2 10 00 00 18 00 00 00 fe 00 44
57 37 58 4e 82 4c 51 31 35 36 4e 31 00 00 00 00
00 02 41 03 32 00 12 00 00 0a 01 0a 20 20 00 d0

----------------

Block 0, Base EDID:
  EDID Structure Version & Revision: 1.4
  Vendor & Product Identification:
    Manufacturer: SHP
    Model: 5397
    Made in: week 13 of 2021
  Basic Display Parameters & Features:
    Digital display
    Bits per primary color channel: 8
    DisplayPort interface
    Maximum image size: 34 cm x 21 cm
    Gamma: 2.20
    Supported color formats: RGB 4:4:4, YCrCb 4:4:4
    Default (sRGB) color space is primary color space
    First detailed timing includes the native pixel format and preferred refresh rate
  Color Characteristics:
    Red  : 0.6396, 0.3291
    Green: 0.2998, 0.5996
    Blue : 0.1494, 0.0595
    White: 0.3125, 0.3281
  Established Timings I & II: none
  Standard Timings: none
  Detailed Timing Descriptors:
    DTD 1:  1920x1200   59.950171 Hz  16:10    74.038 kHz    154.000000 MHz (336 mm x 210 mm)
                 Hfront   48 Hsync  32 Hback   80 Hpol N
                 Vfront    3 Vsync   6 Vback   26 Vpol N
    DTD 2:  1920x1200   47.960137 Hz  16:10    59.231 kHz    123.200000 MHz (336 mm x 210 mm)
                 Hfront   48 Hsync  32 Hback   80 Hpol N
                 Vfront    3 Vsync   6 Vback   26 Vpol N
    Alphanumeric Data String: 'DW7XN'
    Manufacturer-Specified Display Descriptor (0x00): 00 00 00 02 41 03 32 00 12 00 00 0a 01 0a 20 20 '....A.2.......  '
Checksum: 0xd0

----------------

Block 1, Unknown EDID Extension Block 0x00:
  00 ff ff ff ff ff ff 00 4d 10 15 15 00 00 00 00 '........M.......'
  0d 1f 01 04 a5 22 15 78 0e de 50 a3 54 4c 99 26 '.....".x..P.TL.&'
  0f 50 54 00 00 00 01 01 01 01 01 01 01 01 01 01 '.PT.............'
  01 01 01 01 01 01 28 3c 80 a0 70 b0 23 40 30 20 '......(<..p.#@0 '
  36 00 50 d2 10 00 00 18 20 30 80 a0 70 b0 23 40 '6.P..... 0..p.#@'
  30 20 36 00 50 d2 10 00 00 18 00 00 00 fe 00 44 '0 6.P..........D'
  57 37 58 4e 82 4c 51 31 35 36 4e 31 00 00 00 00 'W7XN.LQ156N1....'
  00 02 41 03 32 00 12 00 00 0a 01 0a 20 20 00 d0 '..A.2.......  ..'
Checksum: 0xd0

----------------

Warnings:

Block 0, Base EDID:
  Detailed Timing Descriptor #1: DTD is similar but not identical to DMT 0x44.
  Missing Display Product Name.

Failures:

Block 0, Base EDID:
  Basic Display Parameters & Features: sRGB is signaled, but the chromaticities do not match.
  Alphanumeric Data String: Non-printable character.
Block 1, Base EDID:
  Unknown Extension Block.
EDID:
  Base EDID: EDID specified 0 extension block(s), but found 1 extension block(s).

EDID conformity: FAIL
