
EDID (hex):
00ffffffffffff0022f0462601010101
050f0103681e168ceed2d0a15a4c9424
1b5054adee0001010101010101010101
01010101010164190040410026301888
36002cdc10000018000000fd00324c1e
3f08000a202020202020000000fc0048
5020767331350a2020202020000000ff
00434e4335303530474c320a202000ee

Extracted contents:
header:          00 ff ff ff ff ff ff 00
serial number:   22 f0 46 26 01 01 01 01 05 0f
version:         01 03
basic params:    68 1e 16 8c ee
chroma info:     d2 d0 a1 5a 4c 94 24 1b 50 54
established:     ad ee 00
standard:        01 01 01 01 01 01 01 01 01 01 01 01 01 01 01 01
descriptor 1:    64 19 00 40 41 00 26 30 18 88 36 00 2c dc 10 00 00 18
descriptor 2:    00 00 00 fd 00 32 4c 1e 3f 08 00 0a 20 20 20 20 20 20
descriptor 3:    00 00 00 fc 00 48 50 20 76 73 31 35 0a 20 20 20 20 20
descriptor 4:    00 00 00 ff 00 43 4e 43 35 30 35 30 47 4c 32 0a 20 20
extensions:      00
checksum:        ee

EDID version: 1.3
Manufacturer: HWP Model 2646 Serial Number --
Analog display, Input voltage level: 0.7/0.7 V
Sync: Separate 
Maximum image size: 30 cm x 22 cm
Gamma: 2.40
DPMS levels: Standby Suspend Off
RGB color display
Default (sRGB) color space is primary color space
First detailed timing is preferred timing
Display x,y Chromaticity:
  Red:   0.6318, 0.3525
  Green: 0.2968, 0.5800
  Blue:  0.1435, 0.1064
  White: 0.3125, 0.3281
Established timings supported:
  720x400@70Hz 9:5 HorFreq: 31469 Hz Clock: 28.320 MHz
  640x480@60Hz 4:3 HorFreq: 31469 Hz Clock: 25.175 MHz
  640x480@72Hz 4:3 HorFreq: 37900 Hz Clock: 31.500 MHz
  640x480@75Hz 4:3 HorFreq: 37500 Hz Clock: 31.500 MHz
  800x600@60Hz 4:3 HorFreq: 37900 Hz Clock: 40.000 MHz
  800x600@72Hz 4:3 HorFreq: 48100 Hz Clock: 50.000 MHz
  800x600@75Hz 4:3 HorFreq: 46900 Hz Clock: 49.500 MHz
  832x624@75Hz 4:3 HorFreq: 49726 Hz Clock: 57.284 MHz
  1024x768@60Hz 4:3 HorFreq: 48400 Hz Clock: 65.000 MHz
  1024x768@70Hz 4:3 HorFreq: 56500 Hz Clock: 75.000 MHz
  1024x768@75Hz 4:3 HorFreq: 60000 Hz Clock: 78.750 MHz
Standard timings supported:
Detailed mode: Clock 65.000 MHz, 300 mm x 220 mm
               1024 1048 1184 1344 hborder 0
                768  771  777  806 vborder 0
               -hsync -vsync 
               VertFreq: 60 Hz, HorFreq: 48363 Hz
Monitor ranges (GTF): 50-76Hz V, 30-63kHz H, max dotclock 80MHz
Monitor name: HP vs15
Serial number: --
Checksum: 0xee (valid)
EDID block does NOT conform to EDID 1.3!
	sRGB is signaled, but the chromaticities do not match
EDID block does not conform at all!
	Bad year of manufacture
