
EDID (hex):
00ffffffffffff0015c31128d6f35301
331a0104a53c2278fa9325a9544d9e25
0c5054a10800a9408180d100b300a9c0
810081c00101565e00a0a0a029503020
350055502100001a21390000a3a01c50
7808351055502100001c000000fd001d
3d1f5919000a202020202020000000fc
004556323738300a2020202020200151
020312f145100403020123091f078301
00000000000000000000000000000000
00000000000000000000000000000000
00000000000000000000000000000000
00000000000000000000000000000000
00000000000000000000000000000000
00000000000000000000000000000000
000000000000000000000000000000c3

Extracted contents:
header:          00 ff ff ff ff ff ff 00
serial number:   15 c3 11 28 d6 f3 53 01 33 1a
version:         01 04
basic params:    a5 3c 22 78 fa
chroma info:     93 25 a9 54 4d 9e 25 0c 50 54
established:     a1 08 00
standard:        a9 40 81 80 d1 00 b3 00 a9 c0 81 00 81 c0 01 01
descriptor 1:    56 5e 00 a0 a0 a0 29 50 30 20 35 00 55 50 21 00 00 1a
descriptor 2:    21 39 00 00 a3 a0 1c 50 78 08 35 10 55 50 21 00 00 1c
descriptor 3:    00 00 00 fd 00 1d 3d 1f 59 19 00 0a 20 20 20 20 20 20
descriptor 4:    00 00 00 fc 00 45 56 32 37 38 30 0a 20 20 20 20 20 20
extensions:      01
checksum:        51

EDID version: 1.4
Manufacturer: ENC Model 2811 Serial Number --
Made in week 51 of 2016
Digital display
8 bits per primary color channel
DisplayPort interface
Maximum image size: 60 cm x 34 cm
Gamma: 2.20
DPMS levels: Standby Suspend Off
Supported color formats: RGB 4:4:4, YCrCb 4:4:4, YCrCb 4:2:2
First detailed timing includes the native pixel format and preferred refresh rate
Display x,y Chromaticity:
  Red:   0.6621, 0.3291
  Green: 0.3007, 0.6201
  Blue:  0.1445, 0.0488
  White: 0.3134, 0.3291
Established timings supported:
  720x400@70Hz 9:5 HorFreq: 31469 Hz Clock: 28.320 MHz
  640x480@60Hz 4:3 HorFreq: 31469 Hz Clock: 25.175 MHz
  800x600@60Hz 4:3 HorFreq: 37900 Hz Clock: 40.000 MHz
  1024x768@60Hz 4:3 HorFreq: 48400 Hz Clock: 65.000 MHz
Standard timings supported:
  1600x1200@60Hz 4:3 HorFreq: 75000 Hz Clock: 162.000 MHz
  1280x1024@60Hz 5:4 HorFreq: 64000 Hz Clock: 108.000 MHz
  1920x1200@60Hz 16:10 HorFreq: 74000 Hz Clock: 154.000 MHz
  1680x1050@60Hz 16:10 HorFreq: 64700 Hz Clock: 119.000 MHz
  1600x900@60Hz 16:9
  1280x800@60Hz 16:10
  1280x720@60Hz 16:9
Detailed mode: Clock 241.500 MHz, 597 mm x 336 mm
               2560 2608 2640 2720 hborder 0
               1440 1443 1448 1481 vborder 0
               +hsync -vsync 
               VertFreq: 59 Hz, HorFreq: 88786 Hz
Detailed mode: Clock 146.250 MHz, 597 mm x 336 mm
               2560 2680 2944 3328 hborder 0
               1440 1443 1448 1468 vborder 0
               -hsync +vsync 
               VertFreq: 29 Hz, HorFreq: 43945 Hz
Monitor ranges (GTF): 29-61Hz V, 31-89kHz H, max dotclock 250MHz
Monitor name: EV2780
Has 1 extension blocks
Checksum: 0x51 (valid)

CTA extension block
Extension version: 3
14 bytes of CTA data
  Video data block
    VIC  16 1920x1080@60Hz 16:9  HorFreq: 67500 Hz Clock: 148.500 MHz
    VIC   4 1280x720@60Hz 16:9  HorFreq: 45000 Hz Clock: 74.250 MHz
    VIC   3 720x480@60Hz 16:9  HorFreq: 31469 Hz Clock: 27.000 MHz
    VIC   2 720x480@60Hz 4:3  HorFreq: 31469 Hz Clock: 27.000 MHz
    VIC   1 640x480@60Hz 4:3  HorFreq: 31469 Hz Clock: 25.175 MHz
  Audio data block
    Linear PCM, max channels 2
      Supported sample rates (kHz): 96 88.2 48 44.1 32
      Supported sample sizes (bits): 24 20 16
  Speaker allocation data block
    Speaker map:
      FL/FR - Front Left/Right
Underscans PC formats by default
Basic audio support
Supports YCbCr 4:4:4
Supports YCbCr 4:2:2
1 native detailed modes
Checksum: 0xc3 (valid)

Warning: One or more of the timings is out of range of the Monitor Ranges:
  Vertical Freq: 29 - 70 Hz
  Horizontal Freq: 31469 - 88786 Hz
  Maximum Clock: 241.500 MHz


