
EDID (hex):
00ffffffffffff0015c3311701010101
0e0f010280261e78eaee95a3544c9926
0f5054a1080081800101010101010101
010101010101302a009851002a403070
1300782d1100001e000000ff00323836
32343033350a20202020000000fd003b
3d1e410b000a202020202020000000fc
004c3738380a202020202020202000af

Extracted contents:
header:          00 ff ff ff ff ff ff 00
serial number:   15 c3 31 17 01 01 01 01 0e 0f
version:         01 02
basic params:    80 26 1e 78 ea
chroma info:     ee 95 a3 54 4c 99 26 0f 50 54
established:     a1 08 00
standard:        81 80 01 01 01 01 01 01 01 01 01 01 01 01 01 01
descriptor 1:    30 2a 00 98 51 00 2a 40 30 70 13 00 78 2d 11 00 00 1e
descriptor 2:    00 00 00 ff 00 32 38 36 32 34 30 33 35 0a 20 20 20 20
descriptor 3:    00 00 00 fd 00 3b 3d 1e 41 0b 00 0a 20 20 20 20 20 20
descriptor 4:    00 00 00 fc 00 4c 37 38 38 0a 20 20 20 20 20 20 20 20
extensions:      00
checksum:        af

EDID version: 1.2
Manufacturer: ENC Model 1731 Serial Number --
Digital display
Maximum image size: 38 cm x 30 cm
Gamma: 2.20
DPMS levels: Standby Suspend Off
RGB color display
First detailed timing is preferred timing
Display x,y Chromaticity:
  Red:   0.6396, 0.3300
  Green: 0.2998, 0.5996
  Blue:  0.1503, 0.0595
  White: 0.3134, 0.3291
Established timings supported:
  720x400@70Hz 9:5 HorFreq: 31469 Hz Clock: 28.320 MHz
  640x480@60Hz 4:3 HorFreq: 31469 Hz Clock: 25.175 MHz
  800x600@60Hz 4:3 HorFreq: 37900 Hz Clock: 40.000 MHz
  1024x768@60Hz 4:3 HorFreq: 48400 Hz Clock: 65.000 MHz
Standard timings supported:
  1280x1024@60Hz 5:4 HorFreq: 64000 Hz Clock: 108.000 MHz
Detailed mode: Clock 108.000 MHz, 376 mm x 301 mm
               1280 1328 1440 1688 hborder 0
               1024 1025 1028 1066 vborder 0
               +hsync +vsync 
               VertFreq: 60 Hz, HorFreq: 63981 Hz
Serial number: --
Monitor ranges (GTF): 59-61Hz V, 30-65kHz H, max dotclock 110MHz
Monitor name: L788
Checksum: 0xaf (valid)
One or more of the timings is out of range of the Monitor Ranges:
  Vertical Freq: 60 - 70 Hz
  Horizontal Freq: 31469 - 64000 Hz
  Maximum Clock: 108.000 MHz
EDID block does not conform at all!
	Bad year of manufacture
