edid-decode (hex):

00 ff ff ff ff ff ff 00 4d 10 01 42 01 01 01 01
00 15 01 03 68 29 17 78 2a c1 ec a1 53 46 97 24
11 47 49 23 08 00 81 c0 01 01 01 01 01 01 01 01
01 01 01 01 01 01 1b 21 50 a0 51 00 1e 30 48 88
35 00 80 68 21 00 00 1c 0e 1f 00 80 51 00 1e 30
40 80 37 00 80 80 21 00 00 1c 00 00 00 fc 00 53
48 50 41 50 20 4c 43 44 0a 20 20 20 00 00 00 fd
00 37 3e 1e 46 10 00 0a 20 20 20 20 20 20 00 48

----------------

Block 0, Base EDID:
  EDID Structure Version & Revision: 1.3
  Vendor & Product Identification:
    Manufacturer: SHP
    Model: 16897
    Serial Number: ...
    Made in: 2011
  Basic Display Parameters & Features:
    Analog display
    Input voltage level: 0.7/0.7 V
    Sync: Separate
    Maximum image size: 41 cm x 23 cm
    Gamma: 2.20
    DPMS levels: Off
    RGB color display
    First detailed timing is preferred timing
  Color Characteristics:
    Red  : 0.6318, 0.3242
    Green: 0.2734, 0.5908
    Blue : 0.1435, 0.0683
    White: 0.2802, 0.2851
  Established Timings I & II:
    DMT 0x04:   640x480    59.940 Hz   4:3    31.469 kHz  25.175 MHz
    DMT 0x08:   800x600    56.250 Hz   4:3    35.156 kHz  36.000 MHz
    DMT 0x09:   800x600    60.317 Hz   4:3    37.879 kHz  40.000 MHz
    DMT 0x10:  1024x768    60.004 Hz   4:3    48.363 kHz  65.000 MHz
  Standard Timings:
    DMT 0x55:  1280x720    60.000 Hz  16:9    45.000 kHz  74.250 MHz
  Detailed Timing Descriptors:
    DTD 1:  1360x768    59.799 Hz  85:48   47.720 kHz  84.750 MHz (640 mm x 360 mm)
                 Hfront   72 Hsync 136 Hback 208 Hpol N
                 Vfront    3 Vsync   5 Vback  22 Vpol P
    DTD 2:  1280x768    59.870 Hz   5:3    47.776 kHz  79.500 MHz (640 mm x 384 mm)
                 Hfront   64 Hsync 128 Hback 192 Hpol N
                 Vfront    3 Vsync   7 Vback  20 Vpol P
    Display Product Name: 'SHPAP LCD'
  Display Range Limits:
    Monitor ranges (GTF): 55-62 Hz V, 30-70 kHz H, max dotclock 160 MHz
Checksum: 0x48
