
EDID (hex):
00ffffffffffff000e982a2000000000
250f010308221b78e80526a3594a9c23
144f54afcf0001010101010101010101
010101010101302a009851002a403070
1300520e1100001e000000fd00384b1e
500e000a202020202020000000ff004c
453535333730313433340a20000000fc
00583738320a20202020202020200086

Extracted contents:
header:          00 ff ff ff ff ff ff 00
serial number:   0e 98 2a 20 00 00 00 00 25 0f
version:         01 03
basic params:    08 22 1b 78 e8
chroma info:     05 26 a3 59 4a 9c 23 14 4f 54
established:     af cf 00
standard:        01 01 01 01 01 01 01 01 01 01 01 01 01 01 01 01
descriptor 1:    30 2a 00 98 51 00 2a 40 30 70 13 00 52 0e 11 00 00 1e
descriptor 2:    00 00 00 fd 00 38 4b 1e 50 0e 00 0a 20 20 20 20 20 20
descriptor 3:    00 00 00 ff 00 4c 45 35 35 33 37 30 31 34 33 34 0a 20
descriptor 4:    00 00 00 fc 00 58 37 38 32 0a 20 20 20 20 20 20 20 20
extensions:      00
checksum:        86

EDID version: 1.3
Manufacturer: CTX Model 202a Serial Number --
Analog display, Input voltage level: 0.7/0.3 V
Sync: Separate 
Maximum image size: 34 cm x 27 cm
Gamma: 2.20
DPMS levels: Standby Suspend Off
RGB color display
Display x,y Chromaticity:
  Red:   0.6367, 0.3476
  Green: 0.2900, 0.6103
  Blue:  0.1367, 0.0800
  White: 0.3095, 0.3300
Established timings supported:
  720x400@70Hz 9:5 HorFreq: 31469 Hz Clock: 28.320 MHz
  640x480@60Hz 4:3 HorFreq: 31469 Hz Clock: 25.175 MHz
  640x480@72Hz 4:3 HorFreq: 37900 Hz Clock: 31.500 MHz
  640x480@75Hz 4:3 HorFreq: 37500 Hz Clock: 31.500 MHz
  800x600@56Hz 4:3 HorFreq: 35200 Hz Clock: 36.000 MHz
  800x600@60Hz 4:3 HorFreq: 37900 Hz Clock: 40.000 MHz
  800x600@72Hz 4:3 HorFreq: 48100 Hz Clock: 50.000 MHz
  800x600@75Hz 4:3 HorFreq: 46900 Hz Clock: 49.500 MHz
  1024x768@60Hz 4:3 HorFreq: 48400 Hz Clock: 65.000 MHz
  1024x768@70Hz 4:3 HorFreq: 56500 Hz Clock: 75.000 MHz
  1024x768@75Hz 4:3 HorFreq: 60000 Hz Clock: 78.750 MHz
  1280x1024@75Hz 5:4 HorFreq: 80000 Hz Clock: 135.000 MHz
Standard timings supported:
Detailed mode: Clock 108.000 MHz, 338 mm x 270 mm
               1280 1328 1440 1688 hborder 0
               1024 1025 1028 1066 vborder 0
               +hsync +vsync 
               VertFreq: 60 Hz, HorFreq: 63981 Hz
Monitor ranges (GTF): 56-75Hz V, 30-80kHz H, max dotclock 140MHz
Serial number: --
Monitor name: X782
Checksum: 0x86 (valid)
EDID block does NOT conform to EDID 1.3!
	Missing preferred timing
EDID block does not conform at all!
	Bad year of manufacture
