
EDID (hex):
00ffffffffffff0038a3776601010101
0510010308221b78eac5c6a3574a9c23
124f54bfef80714f814f010101010101
010101010101302a009851002a403070
1300520e1100001e000000fd00384b1f
510e000a202020202020000000fc004c
43443732584d0a2020202020000000ff
0036324631383930344e420a202000b2

Extracted contents:
header:          00 ff ff ff ff ff ff 00
serial number:   38 a3 77 66 01 01 01 01 05 10
version:         01 03
basic params:    08 22 1b 78 ea
chroma info:     c5 c6 a3 57 4a 9c 23 12 4f 54
established:     bf ef 80
standard:        71 4f 81 4f 01 01 01 01 01 01 01 01 01 01 01 01
descriptor 1:    30 2a 00 98 51 00 2a 40 30 70 13 00 52 0e 11 00 00 1e
descriptor 2:    00 00 00 fd 00 38 4b 1f 51 0e 00 0a 20 20 20 20 20 20
descriptor 3:    00 00 00 fc 00 4c 43 44 37 32 58 4d 0a 20 20 20 20 20
descriptor 4:    00 00 00 ff 00 36 32 46 31 38 39 30 34 4e 42 0a 20 20
extensions:      00
checksum:        b2

EDID version: 1.3
Manufacturer: NEC Model 6677 Serial Number --
Made in week 5 of 2006
Analog display, Input voltage level: 0.7/0.3 V
Sync: Separate 
Maximum image size: 34 cm x 27 cm
Gamma: 2.20
DPMS levels: Standby Suspend Off
RGB color display
First detailed timing is preferred timing
Display x,y Chromaticity:
  Red:   0.6396, 0.3398
  Green: 0.2900, 0.6103
  Blue:  0.1396, 0.0703
  White: 0.3095, 0.3300
Established timings supported:
  720x400@70Hz 9:5 HorFreq: 31469 Hz Clock: 28.320 MHz
  640x480@60Hz 4:3 HorFreq: 31469 Hz Clock: 25.175 MHz
  640x480@67Hz 4:3 HorFreq: 35000 Hz Clock: 30.240 MHz
  640x480@72Hz 4:3 HorFreq: 37900 Hz Clock: 31.500 MHz
  640x480@75Hz 4:3 HorFreq: 37500 Hz Clock: 31.500 MHz
  800x600@56Hz 4:3 HorFreq: 35200 Hz Clock: 36.000 MHz
  800x600@60Hz 4:3 HorFreq: 37900 Hz Clock: 40.000 MHz
  800x600@72Hz 4:3 HorFreq: 48100 Hz Clock: 50.000 MHz
  800x600@75Hz 4:3 HorFreq: 46900 Hz Clock: 49.500 MHz
  832x624@75Hz 4:3 HorFreq: 49726 Hz Clock: 57.284 MHz
  1024x768@60Hz 4:3 HorFreq: 48400 Hz Clock: 65.000 MHz
  1024x768@70Hz 4:3 HorFreq: 56500 Hz Clock: 75.000 MHz
  1024x768@75Hz 4:3 HorFreq: 60000 Hz Clock: 78.750 MHz
  1280x1024@75Hz 5:4 HorFreq: 80000 Hz Clock: 135.000 MHz
  1152x870@75Hz 192:145 HorFreq: 67500 Hz Clock: 108.000 MHz
Standard timings supported:
  1152x864@75Hz 4:3 HorFreq: 67500 Hz Clock: 108.000 MHz
  1280x960@75Hz 4:3
Detailed mode: Clock 108.000 MHz, 338 mm x 270 mm
               1280 1328 1440 1688 hborder 0
               1024 1025 1028 1066 vborder 0
               +hsync +vsync 
               VertFreq: 60 Hz, HorFreq: 63981 Hz
Monitor ranges (GTF): 56-75Hz V, 31-81kHz H, max dotclock 140MHz
Monitor name: LCD72XM
Serial number: --
Checksum: 0xb2 (valid)
