edid-decode (hex):

00 ff ff ff ff ff ff 00 22 f0 44 33 00 00 00 00
15 1c 01 04 a5 50 21 78 3a 8d 75 ab 52 4b a4 27
0f 50 54 a1 08 00 d1 c0 a9 c0 81 c0 d1 00 b3 00
95 00 a9 40 81 80 f5 7c 70 a0 d0 a0 29 50 30 20
3a 00 1d 4d 31 00 00 1a 00 00 00 fd 00 1e 3c 1e
5a 20 01 0a 20 20 20 20 20 20 00 00 00 fc 00 48
50 20 53 33 34 30 63 0a 20 20 20 20 00 00 00 ff
00 43 4e 34 38 32 31 30 37 47 32 0a 20 20 01 58

02 03 1c f1 4f 10 1f 04 13 03 02 12 11 01 05 27
06 07 15 16 23 09 07 07 83 01 00 00 a9 4c 70 00
d4 a0 1c 50 a0 60 3a 10 1d 4d 31 00 00 1a dd 3b
70 a0 d3 a0 17 50 78 58 3a 10 1d 4d 31 00 00 1e
99 3e 70 b0 d3 a0 18 50 80 58 3a 10 1d 4d 31 00
00 1a 56 5e 00 a0 a0 a0 29 50 30 20 35 00 1d 4d
31 00 00 1a 40 3c 80 a0 70 b0 23 40 30 20 36 00
1d 4d 31 00 00 1a 00 00 00 00 00 00 00 00 00 ab

00 ff ff ff ff ff ff 00 22 f0 44 33 00 00 00 00
15 1c 01 04 a5 50 21 78 3a 8d 75 ab 52 4b a4 27
0f 50 54 a1 08 00 d1 c0 a9 c0 81 c0 d1 00 b3 00
95 00 a9 40 81 80 f5 7c 70 a0 d0 a0 29 50 30 20
3a 00 1d 4d 31 00 00 1a 00 00 00 fd 00 1e 3c 1e
5a 20 01 0a 20 20 20 20 20 20 00 00 00 fc 00 48
50 20 53 33 34 30 63 0a 20 20 20 20 00 00 00 ff
00 43 4e 34 38 32 31 30 37 47 32 0a 20 20 01 58

02 03 1c f1 4f 10 1f 04 13 03 02 12 11 01 05 27
06 07 15 16 23 09 07 07 83 01 00 00 a9 4c 70 00
d4 a0 1c 50 a0 60 3a 10 1d 4d 31 00 00 1a dd 3b
70 a0 d3 a0 17 50 78 58 3a 10 1d 4d 31 00 00 1e
99 3e 70 b0 d3 a0 18 50 80 58 3a 10 1d 4d 31 00
00 1a 56 5e 00 a0 a0 a0 29 50 30 20 35 00 1d 4d
31 00 00 1a 40 3c 80 a0 70 b0 23 40 30 20 36 00
1d 4d 31 00 00 1a 00 00 00 00 00 00 00 00 00 ab

----------------

Block 0, Base EDID:
  EDID Structure Version & Revision: 1.4
  Vendor & Product Identification:
    Manufacturer: HWP
    Model: 13124
    Made in: week 21 of 2018
  Basic Display Parameters & Features:
    Digital display
    Bits per primary color channel: 8
    DisplayPort interface
    Maximum image size: 80 cm x 33 cm
    Gamma: 2.20
    DPMS levels: Off
    Supported color formats: RGB 4:4:4, YCrCb 4:4:4, YCrCb 4:2:2
    First detailed timing includes the native pixel format and preferred refresh rate
  Color Characteristics:
    Red  : 0.6699, 0.3203
    Green: 0.2958, 0.6416
    Blue : 0.1533, 0.0615
    White: 0.3134, 0.3291
  Established Timings I & II:
    IBM     :   720x400    70.081663 Hz   9:5     31.467 kHz     28.320000 MHz
    DMT 0x04:   640x480    59.940476 Hz   4:3     31.469 kHz     25.175000 MHz
    DMT 0x09:   800x600    60.316541 Hz   4:3     37.879 kHz     40.000000 MHz
    DMT 0x10:  1024x768    60.003840 Hz   4:3     48.363 kHz     65.000000 MHz
  Standard Timings:
    DMT 0x52:  1920x1080   60.000000 Hz  16:9     67.500 kHz    148.500000 MHz
    DMT 0x53:  1600x900    60.000000 Hz  16:9     60.000 kHz    108.000000 MHz (RB)
    DMT 0x55:  1280x720    60.000000 Hz  16:9     45.000 kHz     74.250000 MHz
    DMT 0x45:  1920x1200   59.884600 Hz  16:10    74.556 kHz    193.250000 MHz
    DMT 0x3a:  1680x1050   59.954250 Hz  16:10    65.290 kHz    146.250000 MHz
    DMT 0x2f:  1440x900    59.887445 Hz  16:10    55.935 kHz    106.500000 MHz
    DMT 0x33:  1600x1200   60.000000 Hz   4:3     75.000 kHz    162.000000 MHz
    DMT 0x23:  1280x1024   60.019740 Hz   5:4     63.981 kHz    108.000000 MHz
  Detailed Timing Descriptors:
    DTD  1:  3440x1440   59.998875 Hz  43:18    88.858 kHz    319.890000 MHz (797 mm x 333 mm)
                  Hfront   48 Hsync  32 Hback   80 Hpol P
                  Vfront    3 Vsync  10 Vback   28 Vpol N
    Display Range Limits:
      Monitor ranges (Bare Limits): 30-60 Hz V, 30-90 kHz H, max dotclock 320 MHz
    Display Product Name: 'HP S340c'
    Display Product Serial Number: ...
  Extension blocks: 1
Checksum: 0x58

----------------

Block 1, CTA-861 Extension Block:
  Revision: 3
  Underscans IT Video Formats by default
  Basic audio support
  Supports YCbCr 4:4:4
  Supports YCbCr 4:2:2
  Native detailed modes: 1
  Video Data Block:
    VIC  16:  1920x1080   60.000000 Hz  16:9     67.500 kHz    148.500000 MHz
    VIC  31:  1920x1080   50.000000 Hz  16:9     56.250 kHz    148.500000 MHz
    VIC   4:  1280x720    60.000000 Hz  16:9     45.000 kHz     74.250000 MHz
    VIC  19:  1280x720    50.000000 Hz  16:9     37.500 kHz     74.250000 MHz
    VIC   3:   720x480    59.940060 Hz  16:9     31.469 kHz     27.000000 MHz
    VIC   2:   720x480    59.940060 Hz   4:3     31.469 kHz     27.000000 MHz
    VIC  18:   720x576    50.000000 Hz  16:9     31.250 kHz     27.000000 MHz
    VIC  17:   720x576    50.000000 Hz   4:3     31.250 kHz     27.000000 MHz
    VIC   1:   640x480    59.940476 Hz   4:3     31.469 kHz     25.175000 MHz
    VIC   5:  1920x1080i  60.000000 Hz  16:9     33.750 kHz     74.250000 MHz
    VIC  39:  1920x1080i  50.000000 Hz  16:9     31.250 kHz     72.000000 MHz
    VIC   6:  1440x480i   59.940060 Hz   4:3     15.734 kHz     27.000000 MHz
    VIC   7:  1440x480i   59.940060 Hz  16:9     15.734 kHz     27.000000 MHz
    VIC  21:  1440x576i   50.000000 Hz   4:3     15.625 kHz     27.000000 MHz
    VIC  22:  1440x576i   50.000000 Hz  16:9     15.625 kHz     27.000000 MHz
  Audio Data Block:
    Linear PCM:
      Max channels: 2
      Supported sample rates (kHz): 48 44.1 32
      Supported sample sizes (bits): 24 20 16
  Speaker Allocation Data Block:
    FL/FR - Front Left/Right
  Detailed Timing Descriptors:
    DTD  2:  3440x1440   29.947421 Hz  43:18    43.963 kHz    196.250000 MHz (797 mm x 333 mm)
                  Hfront  160 Hsync 352 Hback  512 Hpol P
                  Vfront    3 Vsync  10 Vback   15 Vpol N
    DTD  3:  3440x1440   23.981344 Hz  43:18    35.085 kHz    153.250000 MHz (797 mm x 333 mm)
                  Hfront  120 Hsync 344 Hback  464 Hpol P
                  Vfront    3 Vsync  10 Vback   10 Vpol P
    DTD  4:  3440x1440   24.968153 Hz  43:18    36.553 kHz    160.250000 MHz (797 mm x 333 mm)
                  Hfront  128 Hsync 344 Hback  472 Hpol P
                  Vfront    3 Vsync  10 Vback   11 Vpol N
    DTD  5:  2560x1440   59.950550 Hz  16:9     88.787 kHz    241.500000 MHz (797 mm x 333 mm)
                  Hfront   48 Hsync  32 Hback   80 Hpol P
                  Vfront    3 Vsync   5 Vback   33 Vpol N
    DTD  6:  1920x1200   60.043600 Hz  16:10    74.154 kHz    154.240000 MHz (797 mm x 333 mm)
                  Hfront   48 Hsync  32 Hback   80 Hpol P
                  Vfront    3 Vsync   6 Vback   26 Vpol N
Checksum: 0xab  Unused space in Extension Block: 9 bytes

----------------

Block 2, Unknown EDID Extension Block 0x00:
  00 ff ff ff ff ff ff 00 22 f0 44 33 00 00 00 00 '........".D3....'
  15 1c 01 04 a5 50 21 78 3a 8d 75 ab 52 4b a4 27 '.....P!x:.u.RK.''
  0f 50 54 a1 08 00 d1 c0 a9 c0 81 c0 d1 00 b3 00 '.PT.............'
  95 00 a9 40 81 80 f5 7c 70 a0 d0 a0 29 50 30 20 '...@...|p...)P0 '
  3a 00 1d 4d 31 00 00 1a 00 00 00 fd 00 1e 3c 1e ':..M1.........<.'
  5a 20 01 0a 20 20 20 20 20 20 00 00 00 fc 00 48 'Z ..      .....H'
  50 20 53 33 34 30 63 0a 20 20 20 20 00 00 00 ff 'P S340c.    ....'
  00 43 4e 34 38 32 31 30 37 47 32 0a 20 20 01 58 '.CN482107G2.  .X'
Checksum: 0x58

----------------

Block 3, CTA-861 Extension Block:
  Revision: 3
  Underscans IT Video Formats by default
  Basic audio support
  Supports YCbCr 4:4:4
  Supports YCbCr 4:2:2
  Native detailed modes: 1
  Video Data Block:
    VIC  16:  1920x1080   60.000000 Hz  16:9     67.500 kHz    148.500000 MHz
    VIC  31:  1920x1080   50.000000 Hz  16:9     56.250 kHz    148.500000 MHz
    VIC   4:  1280x720    60.000000 Hz  16:9     45.000 kHz     74.250000 MHz
    VIC  19:  1280x720    50.000000 Hz  16:9     37.500 kHz     74.250000 MHz
    VIC   3:   720x480    59.940060 Hz  16:9     31.469 kHz     27.000000 MHz
    VIC   2:   720x480    59.940060 Hz   4:3     31.469 kHz     27.000000 MHz
    VIC  18:   720x576    50.000000 Hz  16:9     31.250 kHz     27.000000 MHz
    VIC  17:   720x576    50.000000 Hz   4:3     31.250 kHz     27.000000 MHz
    VIC   1:   640x480    59.940476 Hz   4:3     31.469 kHz     25.175000 MHz
    VIC   5:  1920x1080i  60.000000 Hz  16:9     33.750 kHz     74.250000 MHz
    VIC  39:  1920x1080i  50.000000 Hz  16:9     31.250 kHz     72.000000 MHz
    VIC   6:  1440x480i   59.940060 Hz   4:3     15.734 kHz     27.000000 MHz
    VIC   7:  1440x480i   59.940060 Hz  16:9     15.734 kHz     27.000000 MHz
    VIC  21:  1440x576i   50.000000 Hz   4:3     15.625 kHz     27.000000 MHz
    VIC  22:  1440x576i   50.000000 Hz  16:9     15.625 kHz     27.000000 MHz
  Audio Data Block:
    Linear PCM:
      Max channels: 2
      Supported sample rates (kHz): 48 44.1 32
      Supported sample sizes (bits): 24 20 16
  Speaker Allocation Data Block:
    FL/FR - Front Left/Right
  Detailed Timing Descriptors:
    DTD  7:  3440x1440   29.947421 Hz  43:18    43.963 kHz    196.250000 MHz (797 mm x 333 mm)
                  Hfront  160 Hsync 352 Hback  512 Hpol P
                  Vfront    3 Vsync  10 Vback   15 Vpol N
    DTD  8:  3440x1440   23.981344 Hz  43:18    35.085 kHz    153.250000 MHz (797 mm x 333 mm)
                  Hfront  120 Hsync 344 Hback  464 Hpol P
                  Vfront    3 Vsync  10 Vback   10 Vpol P
    DTD  9:  3440x1440   24.968153 Hz  43:18    36.553 kHz    160.250000 MHz (797 mm x 333 mm)
                  Hfront  128 Hsync 344 Hback  472 Hpol P
                  Vfront    3 Vsync  10 Vback   11 Vpol N
    DTD 10:  2560x1440   59.950550 Hz  16:9     88.787 kHz    241.500000 MHz (797 mm x 333 mm)
                  Hfront   48 Hsync  32 Hback   80 Hpol P
                  Vfront    3 Vsync   5 Vback   33 Vpol N
    DTD 11:  1920x1200   60.043600 Hz  16:10    74.154 kHz    154.240000 MHz (797 mm x 333 mm)
                  Hfront   48 Hsync  32 Hback   80 Hpol P
                  Vfront    3 Vsync   6 Vback   26 Vpol N
Checksum: 0xab  Unused space in Extension Block: 9 bytes

----------------

Warnings:

Block 1, CTA-861 Extension Block:
  Add a Colorimetry Data Block with the sRGB colorimetry bit set to avoid interop issues.
Block 3, CTA-861 Extension Block:
  Add a Colorimetry Data Block with the sRGB colorimetry bit set to avoid interop issues.
EDID:
  Base EDID: Some timings are out of range of the Monitor Ranges:
    Vertical Freq: 23.981 - 70.082 Hz (Monitor: 30.000 - 60.000 Hz)
    Horizontal Freq: 15.625 - 88.858 kHz (Monitor: 30.000 - 90.000 kHz)

Failures:

Block 1, CTA-861 Extension Block:
  Missing VCDB, needed for Set Selectable RGB Quantization to avoid interop issues.
Block 2, Base EDID:
  Unknown Extension Block.
Block 3, CTA-861 Extension Block:
  Video Data Block: Duplicate VIC 16.
  Video Data Block: Duplicate VIC 31.
  Video Data Block: Duplicate VIC 4.
  Video Data Block: Duplicate VIC 19.
  Video Data Block: Duplicate VIC 3.
  Video Data Block: Duplicate VIC 2.
  Video Data Block: Duplicate VIC 18.
  Video Data Block: Duplicate VIC 17.
  Video Data Block: Duplicate VIC 1.
  Video Data Block: Duplicate VIC 5.
  Video Data Block: Duplicate VIC 39.
  Video Data Block: Duplicate VIC 6.
  Video Data Block: Duplicate VIC 7.
  Video Data Block: Duplicate VIC 21.
  Video Data Block: Duplicate VIC 22.
  Speaker Allocation Data Block: Only one instance of this Data Block is allowed.
  Missing VCDB, needed for Set Selectable RGB Quantization to avoid interop issues.
EDID:
  Base EDID: EDID specified 1 extension block(s), but found 3 extension block(s).

EDID conformity: FAIL
