
EDID (hex):
00ffffffffffff0006afd52000000000
0113010380160d780a43259459568d28
22505400000001010101010101010101
0101010101019c18008250d014203020
3600de7d000000180000000f00000000
00000000000000000020000000fe0041
554f0a202020202020202020000000fe
004231303145573032205630200a008a

Extracted contents:
header:          00 ff ff ff ff ff ff 00
serial number:   06 af d5 20 00 00 00 00 01 13
version:         01 03
basic params:    80 16 0d 78 0a
chroma info:     43 25 94 59 56 8d 28 22 50 54
established:     00 00 00
standard:        01 01 01 01 01 01 01 01 01 01 01 01 01 01 01 01
descriptor 1:    9c 18 00 82 50 d0 14 20 30 20 36 00 de 7d 00 00 00 18
descriptor 2:    00 00 00 0f 00 00 00 00 00 00 00 00 00 00 00 00 00 20
descriptor 3:    00 00 00 fe 00 41 55 4f 0a 20 20 20 20 20 20 20 20 20
descriptor 4:    00 00 00 fe 00 42 31 30 31 45 57 30 32 20 56 30 20 0a
extensions:      00
checksum:        8a

EDID version: 1.3
Manufacturer: AUO Model 20d5 Serial Number --
Made in week 1 of 2009
Digital display
Maximum image size: 22 cm x 13 cm
Gamma: 2.20
RGB color display
First detailed timing is preferred timing
Display x,y Chromaticity:
  Red:   0.5791, 0.3476
  Green: 0.3359, 0.5537
  Blue:  0.1562, 0.1347
  White: 0.3134, 0.3291
Established timings supported:
Standard timings supported:
Detailed mode: Clock 63.000 MHz, 222 mm x 125 mm
               1280 1328 1360 1410 hborder 0
                720  723  729  740 vborder 0
               -hsync -vsync 
               VertFreq: 60 Hz, HorFreq: 44680 Hz
Manufacturer-specified data, tag 15
ASCII string: AUO
ASCII string: B101EW02 V0 
Checksum: 0x8a (valid)
EDID block does NOT conform to EDID 1.3!
	Missing name descriptor
	Missing monitor ranges
