
EDID (hex):
00ffffffffffff0010ac49a14c573730
211e0104a550227807ee91a3544c9926
0f505421080001010101010101010101
010101010101e77c70a0d0a029503020
3a001e4f3100001a000000ff00234153
4f4e4e35794465766264000000fd0001
78b4b440010a202020202020000000fc
0044656c6c20415733343230445701ba
020312412309070183010000654b0400
01019d6770a0d0a0225030203a001e4f
3100001a1ab370a0d0a03b5030203a00
1e4f3100001aa0cf7050d0a046500820
880c1e4f3100001a80f77050d0a03c50
08203a001e4f3100001e000000000000
00000000000000000000000000000000
000000000000000000000000000000ee

Extracted contents:
header:          00 ff ff ff ff ff ff 00
serial number:   10 ac 49 a1 4c 57 37 30 21 1e
version:         01 04
basic params:    a5 50 22 78 07
chroma info:     ee 91 a3 54 4c 99 26 0f 50 54
established:     21 08 00
standard:        01 01 01 01 01 01 01 01 01 01 01 01 01 01 01 01
descriptor 1:    e7 7c 70 a0 d0 a0 29 50 30 20 3a 00 1e 4f 31 00 00 1a
descriptor 2:    00 00 00 ff 00 23 41 53 4f 4e 4e 35 79 44 65 76 62 64
descriptor 3:    00 00 00 fd 00 01 78 b4 b4 40 01 0a 20 20 20 20 20 20
descriptor 4:    00 00 00 fc 00 44 65 6c 6c 20 41 57 33 34 32 30 44 57
extensions:      01
checksum:        ba

EDID version: 1.4
Manufacturer: DEL Model a149 Serial Number --
Made in week 33 of 2020
Digital display
8 bits per primary color channel
DisplayPort interface
Maximum image size: 80 cm x 34 cm
Gamma: 2.20
Supported color formats: RGB 4:4:4
Default (sRGB) color space is primary color space
First detailed timing includes the native pixel format and preferred refresh rate
Display is continuous frequency
Display x,y Chromaticity:
  Red:   0.6396, 0.3300
  Green: 0.2998, 0.5996
  Blue:  0.1503, 0.0595
  White: 0.3125, 0.3291
Established timings supported:
  640x480@60Hz 4:3 HorFreq: 31469 Hz Clock: 25.175 MHz
  800x600@60Hz 4:3 HorFreq: 37900 Hz Clock: 40.000 MHz
  1024x768@60Hz 4:3 HorFreq: 48400 Hz Clock: 65.000 MHz
Standard timings supported:
Detailed mode: Clock 319.750 MHz, 798 mm x 335 mm
               3440 3488 3520 3600 hborder 0
               1440 1443 1453 1481 vborder 0
               +hsync -vsync 
               VertFreq: 59 Hz, HorFreq: 88819 Hz
Serial number: --
Monitor ranges (bare limits): 1-120Hz V, 180-180kHz H, max dotclock 640MHz
Has 1 extension blocks
Checksum: 0xba (valid)

CTA extension block
Extension version: 3
14 bytes of CTA data
  Audio data block
    Linear PCM, max channels 2
      Supported sample rates (kHz): 48 44.1 32
      Supported sample sizes (bits): 16
  Speaker allocation data block
    Speaker map:
      FL/FR - Front Left/Right
  Vendor-specific data block, OUI 00044b
Basic audio support
1 native detailed modes
Detailed mode: Clock 265.250 MHz, 798 mm x 335 mm
               3440 3488 3520 3600 hborder 0
               1440 1443 1453 1474 vborder 0
               +hsync -vsync 
               VertFreq: 49 Hz, HorFreq: 73680 Hz
Detailed mode: Clock 458.500 MHz, 798 mm x 335 mm
               3440 3488 3520 3600 hborder 0
               1440 1443 1453 1499 vborder 0
               +hsync -vsync 
               VertFreq: 84 Hz, HorFreq: 127361 Hz
Detailed mode: Clock 531.520 MHz, 798 mm x 335 mm
               3440 3448 3480 3520 hborder 0
               1440 1496 1504 1510 vborder 0
               +hsync -vsync 
               VertFreq: 100 Hz, HorFreq: 151000 Hz
Detailed mode: Clock 633.600 MHz, 798 mm x 335 mm
               3440 3448 3480 3520 hborder 0
               1440 1443 1453 1500 vborder 0
               +hsync +vsync 
               VertFreq: 120 Hz, HorFreq: 180000 Hz
Checksum: 0xee (valid)

EDID block does NOT conform to EDID 1.4!
	Name descriptor not terminated with a newline
Warning: One or more of the timings is out of range of the Monitor Ranges:
  Vertical Freq: 49 - 120 Hz
  Horizontal Freq: 31469 - 180000 Hz
  Maximum Clock: 633.600 MHz
EDID block does not conform at all!
	Both the serial number and the serial string are set
