edid-decode (hex):

00 ff ff ff ff ff ff 00 41 0c af c0 73 66 00 00
1b 17 01 03 6e 29 17 78 2a be 05 a1 56 52 9d 27
0c 50 54 bd 4b 00 81 80 81 c0 01 01 01 01 01 01
01 01 01 01 01 01 66 21 56 aa 51 00 1e 30 46 8f
33 00 9a e6 10 00 00 1e 00 00 00 ff 00 55 4b 30
31 33 32 37 30 32 36 32 32 37 00 00 00 fc 00 50
68 69 6c 69 70 73 20 31 39 36 56 34 00 00 00 fd
00 38 4c 1e 53 0e 00 0a 20 20 20 20 20 20 00 81

00 ff ff ff ff ff ff 00 41 0c af c0 73 66 00 00
1b 17 01 03 6e 29 17 78 2a be 05 a1 56 52 9d 27
0c 50 54 bd 4b 00 81 80 81 c0 01 01 01 01 01 01
01 01 01 01 01 01 66 21 56 aa 51 00 1e 30 46 8f
33 00 9a e6 10 00 00 1e 00 00 00 ff 00 55 4b 30
31 33 32 37 30 32 36 32 32 37 00 00 00 fc 00 50
68 69 6c 69 70 73 20 31 39 36 56 34 00 00 00 fd
00 38 4c 1e 53 0e 00 0a 20 20 20 20 20 20 00 81

----------------

Block 0, Base EDID:
  EDID Structure Version & Revision: 1.3
  Vendor & Product Identification:
    Manufacturer: PHL
    Model: 49327
    Serial Number: ...
    Made in: week 27 of 2013
  Basic Display Parameters & Features:
    Analog display
    Signal Level Standard: 0.700 : 0.000 : 0.700 V p-p
    Blank level equals black level
    Sync: Separate Composite SyncOnGreen
    Maximum image size: 41 cm x 23 cm
    Gamma: 2.20
    DPMS levels: Off
    RGB color display
    First detailed timing is the preferred timing
  Color Characteristics:
    Red  : 0.6308, 0.3388
    Green: 0.3232, 0.6152
    Blue : 0.1523, 0.0468
    White: 0.3134, 0.3291
  Established Timings I & II:
    IBM     :   720x400    70.081663 Hz   9:5     31.467 kHz     28.320000 MHz
    DMT 0x04:   640x480    59.940476 Hz   4:3     31.469 kHz     25.175000 MHz
    Apple   :   640x480    66.666667 Hz   4:3     35.000 kHz     30.240000 MHz
    DMT 0x05:   640x480    72.808802 Hz   4:3     37.861 kHz     31.500000 MHz
    DMT 0x06:   640x480    75.000000 Hz   4:3     37.500 kHz     31.500000 MHz
    DMT 0x09:   800x600    60.316541 Hz   4:3     37.879 kHz     40.000000 MHz
    DMT 0x0b:   800x600    75.000000 Hz   4:3     46.875 kHz     49.500000 MHz
    DMT 0x10:  1024x768    60.003840 Hz   4:3     48.363 kHz     65.000000 MHz
    DMT 0x12:  1024x768    75.028582 Hz   4:3     60.023 kHz     78.750000 MHz
    DMT 0x24:  1280x1024   75.024675 Hz   5:4     79.976 kHz    135.000000 MHz
  Standard Timings:
    DMT 0x23:  1280x1024   60.019740 Hz   5:4     63.981 kHz    108.000000 MHz
    DMT 0x55:  1280x720    60.000000 Hz  16:9     45.000 kHz     74.250000 MHz
  Detailed Timing Descriptors:
    DTD 1:  1366x768    59.789541 Hz 683:384   47.712 kHz     85.500000 MHz (410 mm x 230 mm)
                 Hfront   70 Hsync 143 Hback  213 Hpol P
                 Vfront    3 Vsync   3 Vback   24 Vpol P
    Display Product Serial Number: ...
    Display Product Name: 'Philips 196V4'
    Display Range Limits:
      Monitor ranges (GTF): 56-76 Hz V, 30-83 kHz H, max dotclock 140 MHz
Checksum: 0x81

----------------

Block 1, Unknown EDID Extension Block 0x00:
  00 ff ff ff ff ff ff 00 41 0c af c0 73 66 00 00 '........A...sf..'
  1b 17 01 03 6e 29 17 78 2a be 05 a1 56 52 9d 27 '....n).x*...VR.''
  0c 50 54 bd 4b 00 81 80 81 c0 01 01 01 01 01 01 '.PT.K...........'
  01 01 01 01 01 01 66 21 56 aa 51 00 1e 30 46 8f '......f!V.Q..0F.'
  33 00 9a e6 10 00 00 1e 00 00 00 ff 00 55 4b 30 '3............UK0'
  31 33 32 37 30 32 36 32 32 37 00 00 00 fc 00 50 '1327026227.....P'
  68 69 6c 69 70 73 20 31 39 36 56 34 00 00 00 fd 'hilips 196V4....'
  00 38 4c 1e 53 0e 00 0a 20 20 20 20 20 20 00 81 '.8L.S...      ..'
Checksum: 0x81

----------------

Failures:

Block 1, Base EDID:
  Unknown Extension Block.
EDID:
  Base EDID: EDID specified 0 extension block(s), but found 1 extension block(s).

EDID conformity: FAIL
