
EDID (hex):
00ffffffffffff001e6d615a0f660600
02180103803c2278eaeed5a356509f26
105054210800714081c0810081809500
9040a9c0b300023a801871382d40582c
450058542100001e000000fd00383d1e
530f000a202020202020000000fc0032
374d5037350a202020202020000000ff
000a2020202020202020202020200128
02031df14a900403011412051f101323
0907078301000065030c001000023a80
1871382d40582c450058542100001e01
1d8018711c1620582c25005854210000
9e011d007251d01e206e285500585421
00001e8c0ad08a20e02d10103e960058
54210000180000000000000000000000
00000000000000000000000000000076

Extracted contents:
header:          00 ff ff ff ff ff ff 00
serial number:   1e 6d 61 5a 0f 66 06 00 02 18
version:         01 03
basic params:    80 3c 22 78 ea
chroma info:     ee d5 a3 56 50 9f 26 10 50 54
established:     21 08 00
standard:        71 40 81 c0 81 00 81 80 95 00 90 40 a9 c0 b3 00
descriptor 1:    02 3a 80 18 71 38 2d 40 58 2c 45 00 58 54 21 00 00 1e
descriptor 2:    00 00 00 fd 00 38 3d 1e 53 0f 00 0a 20 20 20 20 20 20
descriptor 3:    00 00 00 fc 00 32 37 4d 50 37 35 0a 20 20 20 20 20 20
descriptor 4:    00 00 00 ff 00 0a 20 20 20 20 20 20 20 20 20 20 20 20
extensions:      01
checksum:        28

EDID version: 1.3
Manufacturer: GSM Model 5a61 Serial Number --
Made in week 2 of 2014
Digital display
Maximum image size: 60 cm x 34 cm
Gamma: 2.20
DPMS levels: Standby Suspend Off
RGB color display
First detailed timing is preferred timing
Display x,y Chromaticity:
  Red:   0.6396, 0.3378
  Green: 0.3154, 0.6230
  Blue:  0.1513, 0.0634
  White: 0.3134, 0.3291
Established timings supported:
  640x480@60Hz 4:3 HorFreq: 31469 Hz Clock: 25.175 MHz
  800x600@60Hz 4:3 HorFreq: 37900 Hz Clock: 40.000 MHz
  1024x768@60Hz 4:3 HorFreq: 48400 Hz Clock: 65.000 MHz
Standard timings supported:
  1152x864@60Hz 4:3
  1280x720@60Hz 16:9
  1280x800@60Hz 16:10
  1280x1024@60Hz 5:4 HorFreq: 64000 Hz Clock: 108.000 MHz
  1440x900@60Hz 16:10 HorFreq: 55500 Hz Clock: 88.750 MHz
  1400x1050@60Hz 4:3 HorFreq: 64700 Hz Clock: 101.000 MHz
  1600x900@60Hz 16:9
  1680x1050@60Hz 16:10 HorFreq: 64700 Hz Clock: 119.000 MHz
Detailed mode: Clock 148.500 MHz, 600 mm x 340 mm
               1920 2008 2052 2200 hborder 0
               1080 1084 1089 1125 vborder 0
               +hsync +vsync 
               VertFreq: 60 Hz, HorFreq: 67500 Hz
Monitor ranges (GTF): 56-61Hz V, 30-83kHz H, max dotclock 150MHz
Monitor name: 27MP75
Serial number: 
-- 1 extension blocks
Checksum: 0x28 (valid)

CTA extension block
Extension version: 3
25 bytes of CTA data
  Video data block
    VIC  16 1920x1080@60Hz 16:9 (native) HorFreq: 67500 Hz Clock: 148.500 MHz
    VIC   4 1280x720@60Hz 16:9  HorFreq: 45000 Hz Clock: 74.250 MHz
    VIC   3 720x480@60Hz 16:9  HorFreq: 31469 Hz Clock: 27.000 MHz
    VIC   1 640x480@60Hz 4:3  HorFreq: 31469 Hz Clock: 25.175 MHz
    VIC  20 1920x1080i@50Hz 16:9  HorFreq: 28125 Hz Clock: 74.250 MHz
    VIC  18 720x576@50Hz 16:9  HorFreq: 31250 Hz Clock: 27.000 MHz
    VIC   5 1920x1080i@60Hz 16:9  HorFreq: 33750 Hz Clock: 74.250 MHz
    VIC  31 1920x1080@50Hz 16:9  HorFreq: 56250 Hz Clock: 148.500 MHz
    VIC  16 1920x1080@60Hz 16:9  HorFreq: 67500 Hz Clock: 148.500 MHz
    VIC  19 1280x720@50Hz 16:9  HorFreq: 37500 Hz Clock: 74.250 MHz
  Audio data block
    Linear PCM, max channels 2
      Supported sample rates (kHz): 48 44.1 32
      Supported sample sizes (bits): 24 20 16
  Speaker allocation data block
    Speaker map:
      FL/FR - Front Left/Right
  Vendor-specific data block, OUI 000c03 (HDMI)
    Source physical address 1.0.0.0
Underscans PC formats by default
Basic audio support
Supports YCbCr 4:4:4
Supports YCbCr 4:2:2
1 native detailed modes
Detailed mode: Clock 148.500 MHz, 600 mm x 340 mm
               1920 2008 2052 2200 hborder 0
               1080 1084 1089 1125 vborder 0
               +hsync +vsync 
               VertFreq: 60 Hz, HorFreq: 67500 Hz
Detailed mode: Clock 74.250 MHz, 600 mm x 340 mm
               1920 2008 2052 2200 hborder 0
                540  542  547  562 vborder 0
               +hsync +vsync interlaced 
               VertFreq: 60 Hz, HorFreq: 33750 Hz
Detailed mode: Clock 74.250 MHz, 600 mm x 340 mm
               1280 1390 1430 1650 hborder 0
                720  725  730  750 vborder 0
               +hsync +vsync 
               VertFreq: 60 Hz, HorFreq: 45000 Hz
Detailed mode: Clock 27.000 MHz, 600 mm x 340 mm
                720  736  798  858 hborder 0
                480  489  495  525 vborder 0
               -hsync -vsync 
               VertFreq: 59 Hz, HorFreq: 31468 Hz
Checksum: 0x76 (valid)

One or more of the timings is out of range of the Monitor Ranges:
  Vertical Freq: 50 - 60 Hz
  Horizontal Freq: 28125 - 67500 Hz
  Maximum Clock: 148.500 MHz
EDID block does not conform at all!
	Both the serial number and the serial string are set


