edid-decode (hex):

00 ff ff ff ff ff ff 00 4c 2d 7e 09 36 39 32 30
2b 16 01 03 0e 24 15 78 2a 55 71 9e 57 52 99 29
15 50 54 23 08 00 81 c0 01 01 01 01 01 01 01 01
01 01 01 01 01 01 66 21 56 aa 51 00 1e 30 46 8f
33 00 68 d2 10 00 00 1e 00 00 00 fd 00 38 3d 1e
3d 09 00 0a 20 20 20 20 20 20 00 00 00 fc 00 53
31 36 42 31 31 30 0a 20 20 20 20 20 00 00 00 ff
00 48 51 41 43 41 30 38 36 33 39 0a 20 20 00 ea

----------------

Block 0, Base EDID:
  EDID Structure Version & Revision: 1.3
  Vendor & Product Identification:
    Manufacturer: SAM
    Model: 2430
    Serial Number: ...
    Made in: week 43 of 2012
  Basic Display Parameters & Features:
    Analog display
    Input voltage level: 0.7/0.3 V
    Sync: Separate Composite SyncOnGreen
    Maximum image size: 36 cm x 21 cm
    Gamma: 2.20
    DPMS levels: Off
    RGB color display
    First detailed timing is the preferred timing
  Color Characteristics:
    Red  : 0.6181, 0.3408
    Green: 0.3212, 0.5986
    Blue : 0.1611, 0.0849
    White: 0.3125, 0.3291
  Established Timings I & II:
    DMT 0x04:   640x480    59.940 Hz   4:3    31.469 kHz  25.175 MHz
    DMT 0x08:   800x600    56.250 Hz   4:3    35.156 kHz  36.000 MHz
    DMT 0x09:   800x600    60.317 Hz   4:3    37.879 kHz  40.000 MHz
    DMT 0x10:  1024x768    60.004 Hz   4:3    48.363 kHz  65.000 MHz
  Standard Timings:
    DMT 0x55:  1280x720    60.000 Hz  16:9    45.000 kHz  74.250 MHz
  Detailed Timing Descriptors:
    DTD 1:  1366x768    59.790 Hz 683:384  47.712 kHz  85.500 MHz (360 mm x 210 mm)
                 Hfront   70 Hsync 143 Hback 213 Hpol P
                 Vfront    3 Vsync   3 Vback  24 Vpol P
  Display Range Limits:
    Monitor ranges (GTF): 56-61 Hz V, 30-61 kHz H, max dotclock 90 MHz
    Display Product Name: 'S16B110'
    Display Product Serial Number: ...
Checksum: 0xea

----------------

EDID conformity: PASS
