edid-decode (hex):

00 ff ff ff ff ff ff 00 30 e4 0b 04 00 00 00 00
00 17 01 04 95 1d 10 78 0a 4b b5 94 58 56 91 28
1f 50 54 00 00 00 01 01 01 01 01 01 01 01 01 01
01 01 01 01 01 01 ce 1d 56 f4 50 00 16 30 30 20
35 00 25 a5 10 00 00 19 df 13 56 f4 50 00 16 30
30 20 35 00 25 a5 10 00 00 19 00 00 00 00 00 00
00 00 00 00 00 00 00 00 00 00 00 00 00 00 00 02
00 0c 4c ff 0a 3c 64 0a 14 22 64 00 00 00 00 81

----------------

Block 0, Base EDID:
  EDID Structure Version & Revision: 1.4
  Vendor & Product Identification:
    Manufacturer: LGD
    Model: 1035
    Made in: 2013
  Basic Display Parameters & Features:
    Digital display
    Bits per primary color channel: 6
    DisplayPort interface
    Maximum image size: 29 cm x 16 cm
    Gamma: 2.20
    Supported color formats: RGB 4:4:4, YCrCb 4:4:4
    First detailed timing includes the native pixel format and preferred refresh rate
  Color Characteristics:
    Red  : 0.5791, 0.3437
    Green: 0.3378, 0.5693
    Blue : 0.1582, 0.1240
    White: 0.3134, 0.3291
  Established Timings I & II: none
  Standard Timings: none
  Detailed Timing Descriptors:
    DTD 1:  1366x768    59.989 Hz 683:384  47.391 kHz  76.300 MHz (293 mm x 165 mm)
                 Hfront   48 Hsync  32 Hback 164 Hpol N
                 Vfront    3 Vsync   5 Vback  14 Vpol N
    DTD 2:  1366x768    39.995 Hz 683:384  31.596 kHz  50.870 MHz (293 mm x 165 mm)
                 Hfront   48 Hsync  32 Hback 164 Hpol N
                 Vfront    3 Vsync   5 Vback  14 Vpol N
    Empty Descriptor
    Manufacturer-Specified Display Descriptor (0x02): 00 02 00 0c 4c ff 0a 3c 64 0a 14 22 64 00 00 00 '....L..<d.."d...'
Checksum: 0x81

----------------

Failures:

Block 0, Base EDID:
  Empty Descriptor: Use Dummy Descriptor instead of all zeroes.
  Missing Display Product Name.

EDID conformity: FAIL
