edid-decode (hex):

00 ff ff ff ff ff ff 00 0e 98 70 53 00 00 00 00
00 0b 01 01 1d 21 19 6e e8 20 78 a0 56 48 9a 26
12 48 4c bd fe 80 31 7c 45 68 61 59 81 80 81 40
01 01 01 01 01 01 10 0e 80 c0 20 e0 1d 10 20 30
13 00 36 e8 10 00 00 18 f9 15 20 f8 30 58 1f 20
20 40 13 00 36 e8 10 00 00 1e ea 24 00 60 41 00
28 30 30 60 13 00 36 e8 10 00 00 1e 00 00 00 fd
00 32 82 1e 48 0b 00 0a 20 20 20 20 20 20 00 ce

----------------

Block 0, Base EDID:
  EDID Structure Version & Revision: 1.1
  Vendor & Product Identification:
    Manufacturer: CTX
    Model: 21360
    Made in: 2001
  Basic Display Parameters & Features:
    Analog display
    Input voltage level: 0.7/0.3 V
    Blank-to-black setup/pedestal
    Sync: Separate Composite Serration
    Maximum image size: 33 cm x 25 cm
    Gamma: 2.10
    DPMS levels: Standby Suspend Off
    RGB color display
  Color Characteristics:
    Red  : 0.6250, 0.3378
    Green: 0.2812, 0.6015
    Blue : 0.1494, 0.0732
    White: 0.2832, 0.2968
  Established Timings I & II:
    IBM     :   720x400    70.081663 Hz   9:5     31.467 kHz     28.320000 MHz
    DMT 0x04:   640x480    59.940476 Hz   4:3     31.469 kHz     25.175000 MHz
    Apple   :   640x480    66.666667 Hz   4:3     35.000 kHz     30.240000 MHz
    DMT 0x05:   640x480    72.808802 Hz   4:3     37.861 kHz     31.500000 MHz
    DMT 0x06:   640x480    75.000000 Hz   4:3     37.500 kHz     31.500000 MHz
    DMT 0x09:   800x600    60.316541 Hz   4:3     37.879 kHz     40.000000 MHz
    DMT 0x0a:   800x600    72.187572 Hz   4:3     48.077 kHz     50.000000 MHz
    DMT 0x0b:   800x600    75.000000 Hz   4:3     46.875 kHz     49.500000 MHz
    Apple   :   832x624    74.551266 Hz   4:3     49.726 kHz     57.284000 MHz
    DMT 0x0f:  1024x768i   86.957532 Hz   4:3     35.522 kHz     44.900000 MHz
    DMT 0x10:  1024x768    60.003840 Hz   4:3     48.363 kHz     65.000000 MHz
    DMT 0x11:  1024x768    70.069359 Hz   4:3     56.476 kHz     75.000000 MHz
    DMT 0x12:  1024x768    75.028582 Hz   4:3     60.023 kHz     78.750000 MHz
    Apple   :  1152x870    75.061550 Hz 192:145   68.681 kHz    100.000000 MHz
  Standard Timings:
    Unknown :   640x480   120.000 Hz   4:3
    Unknown :   800x600   100.000 Hz   4:3
    DMT 0x13:  1024x768    84.996690 Hz   4:3     68.677 kHz     94.500000 MHz
    DMT 0x23:  1280x1024   60.019740 Hz   5:4     63.981 kHz    108.000000 MHz
    DMT 0x20:  1280x960    60.000000 Hz   4:3     60.000 kHz    108.000000 MHz
  Detailed Timing Descriptors:
    DTD 1:   640x480    85.008312 Hz   4:3     43.269 kHz     36.000000 MHz (310 mm x 232 mm)
                 Hfront   32 Hsync  48 Hback  112 Hpol N
                 Vfront    1 Vsync   3 Vback   25 Vpol N
    DTD 2:   800x600    85.061274 Hz   4:3     53.674 kHz     56.250000 MHz (310 mm x 232 mm)
                 Hfront   32 Hsync  64 Hback  152 Hpol P
                 Vfront    1 Vsync   3 Vback   27 Vpol P
    DTD 3:  1024x768    84.996690 Hz   4:3     68.677 kHz     94.500000 MHz (310 mm x 232 mm)
                 Hfront   48 Hsync  96 Hback  208 Hpol P
                 Vfront    1 Vsync   3 Vback   36 Vpol P
    Display Range Limits:
      Monitor ranges (GTF): 50-130 Hz V, 30-72 kHz H, max dotclock 110 MHz
Checksum: 0xce

----------------

Warnings:

Block 0, Base EDID:
  EDID Structure Version & Revision: EDID 1.1 is deprecated, do not use.
  Detailed Timing Descriptor #1: DTD is similar but not identical to DMT 0x07.

Failures:

Block 0, Base EDID:
  Detailed Timing Descriptor #1: Mismatch of image size 310x232 mm vs display size 330x250 mm.
  Detailed Timing Descriptor #2: Mismatch of image size 310x232 mm vs display size 330x250 mm.
  Detailed Timing Descriptor #3: Mismatch of image size 310x232 mm vs display size 330x250 mm.

EDID conformity: FAIL
