
EDID (hex):
00ffffffffffff00046956a04c524530
02170103803c2278ea8e05ad4f33b026
0d505400000001010101010101010101
010101010101565e00a0a0a029503020
350055502100001e000000ff00415355
5332303133303131370a000000fc0045
54323730320a202020202020000000fd
00384c1e5111000a202020202020009b

Extracted contents:
header:          00 ff ff ff ff ff ff 00
serial number:   04 69 56 a0 4c 52 45 30 02 17
version:         01 03
basic params:    80 3c 22 78 ea
chroma info:     8e 05 ad 4f 33 b0 26 0d 50 54
established:     00 00 00
standard:        01 01 01 01 01 01 01 01 01 01 01 01 01 01 01 01
descriptor 1:    56 5e 00 a0 a0 a0 29 50 30 20 35 00 55 50 21 00 00 1e
descriptor 2:    00 00 00 ff 00 41 53 55 53 32 30 31 33 30 31 31 37 0a
descriptor 3:    00 00 00 fc 00 45 54 32 37 30 32 0a 20 20 20 20 20 20
descriptor 4:    00 00 00 fd 00 38 4c 1e 51 11 00 0a 20 20 20 20 20 20
extensions:      00
checksum:        9b

EDID version: 1.3
Manufacturer: ACI Model a056 Serial Number --
Made in week 2 of 2013
Digital display
Maximum image size: 60 cm x 34 cm
Gamma: 2.20
DPMS levels: Standby Suspend Off
RGB color display
First detailed timing is preferred timing
Display x,y Chromaticity:
  Red:   0.6777, 0.3085
  Green: 0.2021, 0.6894
  Blue:  0.1484, 0.0507
  White: 0.3134, 0.3291
Established timings supported:
Standard timings supported:
Detailed mode: Clock 241.500 MHz, 597 mm x 336 mm
               2560 2608 2640 2720 hborder 0
               1440 1443 1448 1481 vborder 0
               +hsync +vsync 
               VertFreq: 59 Hz, HorFreq: 88786 Hz
Serial number: --
Monitor name: ET2702
Monitor ranges (GTF): 56-76Hz V, 30-81kHz H, max dotclock 170MHz
Checksum: 0x9b (valid)
One or more of the timings is out of range of the Monitor Ranges:
  Vertical Freq: 59 - 59 Hz
  Horizontal Freq: 88786 - 88786 Hz
  Maximum Clock: 241.500 MHz
