
EDID (hex):
00ffffffffffff002163312700000000
14210104b53c2178f9c271ac5045ae25
0a5054adcf0081809500b300d1c0714f
a9c0b33cd1fc146400f0a0a055503020
350055502100001a000000fd0c30f0ff
ff6e010a202020202020000000fc0032
374533514b0a202020202020000000ff
00303030303030303030303030310276
02032df123090707480103049011131f
3fe2007fe305e301e6060701625f216d
1a0000020130f0000162216222023a80
1871382d40582c450055502100001e6f
c200a0a0a05550302035005550210000
1a388b801871382d4030203500555021
00001abbe98040713821403020450055
502100001e000000000000000000001d
7012790300030150337c0104ff099f00
2f001f009f0532000200040054150104
ff09c7002f001f009f05760002000400
50e70004ff09c7000f003f009f053100
02000400c2a500047f0717012f001f00
37045800020004000000000000000000
00000000000000000000000000000000
0000000000000000000000000000cb90

edid-decode (hex):

00 ff ff ff ff ff ff 00 21 63 31 27 00 00 00 00
14 21 01 04 b5 3c 21 78 f9 c2 71 ac 50 45 ae 25
0a 50 54 ad cf 00 81 80 95 00 b3 00 d1 c0 71 4f
a9 c0 b3 3c d1 fc 14 64 00 f0 a0 a0 55 50 30 20
35 00 55 50 21 00 00 1a 00 00 00 fd 0c 30 f0 ff
ff 6e 01 0a 20 20 20 20 20 20 00 00 00 fc 00 32
37 45 33 51 4b 0a 20 20 20 20 20 20 00 00 00 ff
00 30 30 30 30 30 30 30 30 30 30 30 30 31 02 76

02 03 2d f1 23 09 07 07 48 01 03 04 90 11 13 1f
3f e2 00 7f e3 05 e3 01 e6 06 07 01 62 5f 21 6d
1a 00 00 02 01 30 f0 00 01 62 21 62 22 02 3a 80
18 71 38 2d 40 58 2c 45 00 55 50 21 00 00 1e 6f
c2 00 a0 a0 a0 55 50 30 20 35 00 55 50 21 00 00
1a 38 8b 80 18 71 38 2d 40 30 20 35 00 55 50 21
00 00 1a bb e9 80 40 71 38 21 40 30 20 45 00 55
50 21 00 00 1e 00 00 00 00 00 00 00 00 00 00 1d

70 12 79 03 00 03 01 50 33 7c 01 04 ff 09 9f 00
2f 00 1f 00 9f 05 32 00 02 00 04 00 54 15 01 04
ff 09 c7 00 2f 00 1f 00 9f 05 76 00 02 00 04 00
50 e7 00 04 ff 09 c7 00 0f 00 3f 00 9f 05 31 00
02 00 04 00 c2 a5 00 04 7f 07 17 01 2f 00 1f 00
37 04 58 00 02 00 04 00 00 00 00 00 00 00 00 00
00 00 00 00 00 00 00 00 00 00 00 00 00 00 00 00
00 00 00 00 00 00 00 00 00 00 00 00 00 00 cb 90

----------------

Block 0, Base EDID:
  EDID Structure Version & Revision: 1.4
  Vendor & Product Identification:
    Manufacturer: HKC
    Model: 10033
    Made in: week 20 of 2023
  Basic Display Parameters & Features:
    Digital display
    Bits per primary color channel: 10
    DisplayPort interface
    Maximum image size: 60 cm x 33 cm
    Gamma: 2.20
    DPMS levels: Standby Suspend Off
    Supported color formats: RGB 4:4:4, YCrCb 4:4:4, YCrCb 4:2:2
    First detailed timing does not include the native pixel format and preferred refresh rate
    Display is continuous frequency
  Color Characteristics:
    Red  : 0.6748, 0.3125
    Green: 0.2695, 0.6816
    Blue : 0.1455, 0.0419
    White: 0.3125, 0.3291
  Established Timings I & II:
    IBM     :   720x400    70.081663 Hz   9:5     31.467 kHz     28.320000 MHz
    DMT 0x04:   640x480    59.940476 Hz   4:3     31.469 kHz     25.175000 MHz
    DMT 0x05:   640x480    72.808802 Hz   4:3     37.861 kHz     31.500000 MHz
    DMT 0x06:   640x480    75.000000 Hz   4:3     37.500 kHz     31.500000 MHz
    DMT 0x09:   800x600    60.316541 Hz   4:3     37.879 kHz     40.000000 MHz
    DMT 0x0a:   800x600    72.187572 Hz   4:3     48.077 kHz     50.000000 MHz
    DMT 0x0b:   800x600    75.000000 Hz   4:3     46.875 kHz     49.500000 MHz
    DMT 0x10:  1024x768    60.003840 Hz   4:3     48.363 kHz     65.000000 MHz
    DMT 0x11:  1024x768    70.069359 Hz   4:3     56.476 kHz     75.000000 MHz
    DMT 0x12:  1024x768    75.028582 Hz   4:3     60.023 kHz     78.750000 MHz
    DMT 0x24:  1280x1024   75.024675 Hz   5:4     79.976 kHz    135.000000 MHz
  Standard Timings:
    DMT 0x23:  1280x1024   60.019740 Hz   5:4     63.981 kHz    108.000000 MHz
    DMT 0x2f:  1440x900    59.887445 Hz  16:10    55.935 kHz    106.500000 MHz
    DMT 0x3a:  1680x1050   59.954250 Hz  16:10    65.290 kHz    146.250000 MHz
    DMT 0x52:  1920x1080   60.000000 Hz  16:9     67.500 kHz    148.500000 MHz
    DMT 0x15:  1152x864    75.000000 Hz   4:3     67.500 kHz    108.000000 MHz
    DMT 0x53:  1600x900    60.000000 Hz  16:9     60.000 kHz    108.000000 MHz (RB)
    GTF     :  1680x1050  120.000000 Hz  16:10   135.000 kHz    313.200000 MHz
    GTF     :  1920x1080  119.999987 Hz  16:9    138.840 kHz    368.759000 MHz
  Detailed Timing Descriptors:
    DTD 1:  2560x1440   60.000000 Hz  16:9     91.500 kHz    256.200000 MHz (597 mm x 336 mm)
                 Hfront   48 Hsync  32 Hback  160 Hpol P
                 Vfront    3 Vsync   5 Vback   77 Vpol N
    Display Range Limits:
      Monitor ranges (Bare Limits): 48-240 Hz V, 510-510 kHz H, max dotclock 1100 MHz
    Display Product Name: '27E3QK'
    Display Product Serial Number: '0000000000001'
  Extension blocks: 2
Checksum: 0x76

----------------

Block 1, CTA-861 Extension Block:
  Revision: 3
  Underscans IT Video Formats by default
  Basic audio support
  Supports YCbCr 4:4:4
  Supports YCbCr 4:2:2
  Native detailed modes: 1
  Audio Data Block:
    Linear PCM:
      Max channels: 2
      Supported sample rates (kHz): 48 44.1 32
      Supported sample sizes (bits): 24 20 16
  Video Data Block:
    VIC   1:   640x480    59.940476 Hz   4:3     31.469 kHz     25.175000 MHz
    VIC   3:   720x480    59.940060 Hz  16:9     31.469 kHz     27.000000 MHz
    VIC   4:  1280x720    60.000000 Hz  16:9     45.000 kHz     74.250000 MHz
    VIC  16:  1920x1080   60.000000 Hz  16:9     67.500 kHz    148.500000 MHz (native)
    VIC  17:   720x576    50.000000 Hz   4:3     31.250 kHz     27.000000 MHz
    VIC  19:  1280x720    50.000000 Hz  16:9     37.500 kHz     74.250000 MHz
    VIC  31:  1920x1080   50.000000 Hz  16:9     56.250 kHz    148.500000 MHz
    VIC  63:  1920x1080  120.000000 Hz  16:9    135.000 kHz    297.000000 MHz
  Video Capability Data Block:
    YCbCr quantization: No Data
    RGB quantization: Selectable (via AVI Q)
    PT scan behavior: Supports both over- and underscan
    IT scan behavior: Supports both over- and underscan
    CE scan behavior: Supports both over- and underscan
  Colorimetry Data Block:
    xvYCC601
    xvYCC709
    BT2020cYCC
    BT2020YCC
    BT2020RGB
    Gamut Boundary Description Metadata Profile P0
  HDR Static Metadata Data Block:
    Electro optical transfer functions:
      Traditional gamma - SDR luminance range
      Traditional gamma - HDR luminance range
      SMPTE ST2084
    Supported static metadata descriptors:
      Static metadata type 1
    Desired content max luminance: 98 (417.710 cd/m^2)
    Desired content max frame-average luminance: 95 (391.429 cd/m^2)
    Desired content min luminance: 33 (0.070 cd/m^2)
  Vendor-Specific Data Block (AMD), OUI 00-00-1A:
    Version: 2.1
    Minimum Refresh Rate: 48 Hz
    Maximum Refresh Rate: 240 Hz
    Flags 1.x: 0x00
    Flags 2.x: 0x01
    Maximum luminance: 98 (417.710 cd/m^2)
    Minimum luminance: 33 (0.070 cd/m^2)
    Unknown: 0x62 0x22
  Detailed Timing Descriptors:
    DTD 2:  1920x1080   60.000000 Hz  16:9     67.500 kHz    148.500000 MHz (597 mm x 336 mm)
                 Hfront   88 Hsync  44 Hback  148 Hpol P
                 Vfront    4 Vsync   5 Vback   36 Vpol P
    DTD 3:  2560x1440  119.997589 Hz  16:9    182.996 kHz    497.750000 MHz (597 mm x 336 mm)
                 Hfront   48 Hsync  32 Hback   80 Hpol P
                 Vfront    3 Vsync   5 Vback   77 Vpol N
    DTD 4:  1920x1080  144.000000 Hz  16:9    162.000 kHz    356.400000 MHz (597 mm x 336 mm)
                 Hfront   48 Hsync  32 Hback  200 Hpol P
                 Vfront    3 Vsync   5 Vback   37 Vpol N
    DTD 5:  1920x1080  240.000481 Hz  16:9    267.121 kHz    598.350000 MHz (597 mm x 336 mm)
                 Hfront   48 Hsync  32 Hback  240 Hpol P
                 Vfront    4 Vsync   5 Vback   24 Vpol P
Checksum: 0x1d  Unused space in Extension Block: 10 bytes

----------------

Block 2, DisplayID Extension Block:
  Version: 1.2
  Extension Count: 0
  Display Product Type: Standalone display device
  Video Timing Modes Type 1 - Detailed Timings Data Block:
    DTD:  2560x1440  239.998816 Hz  16:9    357.838 kHz    973.320000 MHz (aspect 16:9, no 3D stereo)
               Hfront   48 Hsync  32 Hback   80 Hpol N
               Vfront    3 Vsync   5 Vback   43 Vpol N
    DTD:  2560x1440  165.000325 Hz  16:9    257.236 kHz    709.970000 MHz (aspect 16:9, no 3D stereo)
               Hfront   48 Hsync  32 Hback  120 Hpol N
               Vfront    3 Vsync   5 Vback  111 Vpol N
    DTD:  2560x1440  143.996207 Hz  16:9    214.554 kHz    592.170000 MHz (aspect 16:9, no 3D stereo)
               Hfront   16 Hsync  64 Hback  120 Hpol N
               Vfront    3 Vsync   5 Vback   42 Vpol N
    DTD:  1920x1080  165.001166 Hz  16:9    192.886 kHz    424.350000 MHz (aspect 16:9, no 3D stereo)
               Hfront   48 Hsync  32 Hback  200 Hpol N
               Vfront    3 Vsync   5 Vback   81 Vpol N
  Checksum: 0xcb
Checksum: 0x90
