
EDID (hex):
00ffffffffffff0005f0aa00f4000000
201001036c221b78eac5c6a3574a9c23
124f54bdef80714f8180818c01010101
010101010101302a009851002a403070
1300520e1100001e000000fe00000000
00000000000000000020000000fc0041
4f50454e2046323730300a20000000fe
004d31373045503031205630200a006f

Extracted contents:
header:          00 ff ff ff ff ff ff 00
serial number:   05 f0 aa 00 f4 00 00 00 20 10
version:         01 03
basic params:    6c 22 1b 78 ea
chroma info:     c5 c6 a3 57 4a 9c 23 12 4f 54
established:     bd ef 80
standard:        71 4f 81 80 81 8c 01 01 01 01 01 01 01 01 01 01
descriptor 1:    30 2a 00 98 51 00 2a 40 30 70 13 00 52 0e 11 00 00 1e
descriptor 2:    00 00 00 fe 00 00 00 00 00 00 00 00 00 00 00 00 00 20
descriptor 3:    00 00 00 fc 00 41 4f 50 45 4e 20 46 32 37 30 30 0a 20
descriptor 4:    00 00 00 fe 00 4d 31 37 30 45 50 30 31 20 56 30 20 0a
extensions:      00
checksum:        6f

EDID version: 1.3
Manufacturer: AOP Model aa Serial Number --
Made in week 32 of 2006
Analog display, Input voltage level: 0.7/0.7 V
Sync: Separate Composite 
Maximum image size: 34 cm x 27 cm
Gamma: 2.20
DPMS levels: Standby Suspend Off
RGB color display
First detailed timing is preferred timing
Display x,y Chromaticity:
  Red:   0.6396, 0.3398
  Green: 0.2900, 0.6103
  Blue:  0.1396, 0.0703
  White: 0.3095, 0.3300
Established timings supported:
  720x400@70Hz 9:5 HorFreq: 31469 Hz Clock: 28.320 MHz
  640x480@60Hz 4:3 HorFreq: 31469 Hz Clock: 25.175 MHz
  640x480@67Hz 4:3 HorFreq: 35000 Hz Clock: 30.240 MHz
  640x480@72Hz 4:3 HorFreq: 37900 Hz Clock: 31.500 MHz
  640x480@75Hz 4:3 HorFreq: 37500 Hz Clock: 31.500 MHz
  800x600@60Hz 4:3 HorFreq: 37900 Hz Clock: 40.000 MHz
  800x600@72Hz 4:3 HorFreq: 48100 Hz Clock: 50.000 MHz
  800x600@75Hz 4:3 HorFreq: 46900 Hz Clock: 49.500 MHz
  832x624@75Hz 4:3 HorFreq: 49726 Hz Clock: 57.284 MHz
  1024x768@60Hz 4:3 HorFreq: 48400 Hz Clock: 65.000 MHz
  1024x768@70Hz 4:3 HorFreq: 56500 Hz Clock: 75.000 MHz
  1024x768@75Hz 4:3 HorFreq: 60000 Hz Clock: 78.750 MHz
  1280x1024@75Hz 5:4 HorFreq: 80000 Hz Clock: 135.000 MHz
  1152x870@75Hz 192:145 HorFreq: 67500 Hz Clock: 108.000 MHz
Standard timings supported:
  1152x864@75Hz 4:3 HorFreq: 67500 Hz Clock: 108.000 MHz
  1280x1024@60Hz 5:4 HorFreq: 64000 Hz Clock: 108.000 MHz
  1280x1024@72Hz 5:4
Detailed mode: Clock 108.000 MHz, 338 mm x 270 mm
               1280 1328 1440 1688 hborder 0
               1024 1025 1028 1066 vborder 0
               +hsync +vsync 
               VertFreq: 60 Hz, HorFreq: 63981 Hz
ASCII string: 
Monitor name: AOPEN F2700
ASCII string: M170EP01 V0 
Checksum: 0x6f (valid)
EDID block does NOT conform to EDID 1.3!
	Missing monitor ranges
	Detailed block string not properly terminated
