edid-decode (hex):

00 ff ff ff ff ff ff 00 46 a1 00 20 01 00 00 00
07 15 01 03 80 2c 19 78 ea b9 04 a6 55 4b 9b 25
13 50 54 00 00 00 01 01 01 01 01 01 01 01 01 01
01 01 01 01 01 01 30 2a 40 c8 60 84 64 30 18 50
13 00 d9 28 11 00 00 1c 00 00 00 10 00 10 51 55
41 14 0a 20 20 20 20 20 20 20 00 00 00 fe 00 10
51 55 41 14 0a 20 20 20 20 20 20 20 00 00 00 fc
00 4c 65 6e 6f 76 6f 20 41 49 4f 0a 20 20 00 00

----------------

Block 0, Base EDID:
  EDID Structure Version & Revision: 1.3
  Vendor & Product Identification:
    Manufacturer: QUA
    Model: 8192
    Serial Number: ...
    Made in: week 7 of 2011
  Basic Display Parameters & Features:
    Digital display
    Maximum image size: 44 cm x 25 cm
    Gamma: 2.20
    DPMS levels: Standby Suspend Off
    RGB color display
    First detailed timing is preferred timing
  Color Characteristics:
    Red  : 0.6503, 0.3349
    Green: 0.2949, 0.6064
    Blue : 0.1445, 0.0742
    White: 0.3134, 0.3281
  Established Timings I & II: none
  Standard Timings: none
  Detailed Timing Descriptors:
    DTD 1:  1600x900    60.000 Hz  16:9    60.000 kHz 108.000 MHz (473 mm x 296 mm)
                 Hfront   24 Hsync  80 Hback  96 Hpol N
                 Vfront    1 Vsync   3 Vback  96 Vpol P
    Dummy Descriptor:
    Alphanumeric Data String: ''
    Display Product Name: 'Lenovo AIO'
Checksum: 0x0

----------------

Failures:

Block 0, Base EDID:
  Detailed Timing Descriptor #1: Mismatch of image size 473x296 mm vs display size 440x250 mm.
  Dummy Descriptor: Dummy block filled with garbage.
  Alphanumeric Data String: Non-printable character.
  Missing Display Range Limits Descriptor.

EDID conformity: FAIL
