
EDID (hex):
00ffffffffffff00061030a000000000
26190104b5211578020f91ae5243b026
0d505400000001010101010101010101
0101010101017c804050b00834700820
68084bcf1000001a0000001000000000
00000000000000000000000000fc0043
6f6c6f72204c43440a20202000000010
000000000000000000000000000000c1

Extracted contents:
header:          00 ff ff ff ff ff ff 00
serial number:   06 10 30 a0 00 00 00 00 26 19
version:         01 04
basic params:    b5 21 15 78 02
chroma info:     0f 91 ae 52 43 b0 26 0d 50 54
established:     00 00 00
standard:        01 01 01 01 01 01 01 01 01 01 01 01 01 01 01 01
descriptor 1:    7c 80 40 50 b0 08 34 70 08 20 68 08 4b cf 10 00 00 1a
descriptor 2:    00 00 00 10 00 00 00 00 00 00 00 00 00 00 00 00 00 00
descriptor 3:    00 00 00 fc 00 43 6f 6c 6f 72 20 4c 43 44 0a 20 20 20
descriptor 4:    00 00 00 10 00 00 00 00 00 00 00 00 00 00 00 00 00 00
extensions:      00
checksum:        c1

EDID version: 1.4
Manufacturer: APP Model a030 Serial Number --
Made in week 38 of 2015
Digital display
10 bits per primary color channel
DisplayPort interface
Maximum image size: 33 cm x 21 cm
Gamma: 2.20
Supported color formats: RGB 4:4:4
First detailed timing includes the native pixel format and preferred refresh rate
Display x,y Chromaticity:
  Red:   0.6796, 0.3203
  Green: 0.2646, 0.6904
  Blue:  0.1503, 0.0517
  White: 0.3125, 0.3291
Established timings supported:
Standard timings supported:
Detailed mode: Clock 328.920 MHz, 331 mm x 207 mm
               2880 2888 2920 2960 hborder 0
               1800 1838 1846 1852 vborder 0
               +hsync -vsync 
               VertFreq: 60 Hz, HorFreq: 111121 Hz
Dummy block
Monitor name: Color LCD
Dummy block
Checksum: 0xc1 (valid)
	Missing monitor ranges
