
EDID (hex):
00ffffffffffff000469ac20fafc1a06
01180103812b18780a2585a4594f9e23
1a5054210800d1c00101010101010101
010101010101023a801871382d40582c
4500b0f31000001e023a80d072382d40
102c4580b0f31000001e000000fc0050
543230310a20202020202020000000fd
00323c1f440f000a2020202020200159
02031c7149901f041303021211012309
07078301000065030c001000011d0072
51d01e206e285500b0f31000001e011d
00bc52d01e20b8285540b0f31000001e
8c0ad08a20e02d10103e9600b0f31000
00188c0ad090204031200c405500b0f3
10000018d60980a020e02d101060a200
44f3100000180000000000000000002d

edid-decode (hex):

00 ff ff ff ff ff ff 00 04 69 ac 20 fa fc 1a 06
01 18 01 03 81 2b 18 78 0a 25 85 a4 59 4f 9e 23
1a 50 54 21 08 00 d1 c0 01 01 01 01 01 01 01 01
01 01 01 01 01 01 02 3a 80 18 71 38 2d 40 58 2c
45 00 b0 f3 10 00 00 1e 02 3a 80 d0 72 38 2d 40
10 2c 45 80 b0 f3 10 00 00 1e 00 00 00 fc 00 50
54 32 30 31 0a 20 20 20 20 20 20 20 00 00 00 fd
00 32 3c 1f 44 0f 00 0a 20 20 20 20 20 20 01 59

02 03 1c 71 49 90 1f 04 13 03 02 12 11 01 23 09
07 07 83 01 00 00 65 03 0c 00 10 00 01 1d 00 72
51 d0 1e 20 6e 28 55 00 b0 f3 10 00 00 1e 01 1d
00 bc 52 d0 1e 20 b8 28 55 40 b0 f3 10 00 00 1e
8c 0a d0 8a 20 e0 2d 10 10 3e 96 00 b0 f3 10 00
00 18 8c 0a d0 90 20 40 31 20 0c 40 55 00 b0 f3
10 00 00 18 d6 09 80 a0 20 e0 2d 10 10 60 a2 00
44 f3 10 00 00 18 00 00 00 00 00 00 00 00 00 2d

----------------

Block 0, Base EDID:
  EDID Structure Version & Revision: 1.3
  Vendor & Product Identification:
    Manufacturer: ACI
    Model: 8364
    Serial Number: 102431994
    Made in: week 1 of 2014
  Basic Display Parameters & Features:
    Digital display
    DFP 1.x compatible TMDS
    Maximum image size: 43 cm x 24 cm
    Gamma: 2.20
    RGB color display
    First detailed timing is the preferred timing
  Color Characteristics:
    Red  : 0.6406, 0.3496
    Green: 0.3095, 0.6181
    Blue : 0.1386, 0.1015
    White: 0.3134, 0.3291
  Established Timings I & II:
    DMT 0x04:   640x480    59.940476 Hz   4:3     31.469 kHz     25.175000 MHz
    DMT 0x09:   800x600    60.316541 Hz   4:3     37.879 kHz     40.000000 MHz
    DMT 0x10:  1024x768    60.003840 Hz   4:3     48.363 kHz     65.000000 MHz
  Standard Timings:
    DMT 0x52:  1920x1080   60.000000 Hz  16:9     67.500 kHz    148.500000 MHz
  Detailed Timing Descriptors:
    DTD 1:  1920x1080   60.000000 Hz  16:9     67.500 kHz    148.500000 MHz (432 mm x 243 mm)
                 Hfront   88 Hsync  44 Hback  148 Hpol P
                 Vfront    4 Vsync   5 Vback   36 Vpol P
    DTD 2:  1920x1080   50.000000 Hz  16:9     56.250 kHz    148.500000 MHz (432 mm x 243 mm)
                 Hfront  528 Hsync  44 Hback  148 Hpol P
                 Vfront    4 Vsync   5 Vback   36 Vpol P
    Display Product Name: 'PT201'
    Display Range Limits:
      Monitor ranges (GTF): 50-60 Hz V, 31-68 kHz H, max dotclock 150 MHz
  Extension blocks: 1
Checksum: 0x59

----------------

Block 1, CTA-861 Extension Block:
  Revision: 3
  Basic audio support
  Supports YCbCr 4:4:4
  Supports YCbCr 4:2:2
  Native detailed modes: 1
  Video Data Block:
    VIC  16:  1920x1080   60.000000 Hz  16:9     67.500 kHz    148.500000 MHz (native)
    VIC  31:  1920x1080   50.000000 Hz  16:9     56.250 kHz    148.500000 MHz
    VIC   4:  1280x720    60.000000 Hz  16:9     45.000 kHz     74.250000 MHz
    VIC  19:  1280x720    50.000000 Hz  16:9     37.500 kHz     74.250000 MHz
    VIC   3:   720x480    59.940060 Hz  16:9     31.469 kHz     27.000000 MHz
    VIC   2:   720x480    59.940060 Hz   4:3     31.469 kHz     27.000000 MHz
    VIC  18:   720x576    50.000000 Hz  16:9     31.250 kHz     27.000000 MHz
    VIC  17:   720x576    50.000000 Hz   4:3     31.250 kHz     27.000000 MHz
    VIC   1:   640x480    59.940476 Hz   4:3     31.469 kHz     25.175000 MHz
  Audio Data Block:
    Linear PCM:
      Max channels: 2
      Supported sample rates (kHz): 48 44.1 32
      Supported sample sizes (bits): 24 20 16
  Speaker Allocation Data Block:
    FL/FR - Front Left/Right
  Vendor-Specific Data Block (HDMI), OUI 00-0C-03:
    Source physical address: 1.0.0.0
  Detailed Timing Descriptors:
    DTD 3:  1280x720    60.000000 Hz  16:9     45.000 kHz     74.250000 MHz (432 mm x 243 mm)
                 Hfront  110 Hsync  40 Hback  220 Hpol P
                 Vfront    5 Vsync   5 Vback   20 Vpol P
    DTD 4:  1280x720    50.000000 Hz  16:9     37.500 kHz     74.250000 MHz (432 mm x 243 mm)
                 Hfront  440 Hsync  40 Hback  220 Hpol P
                 Vfront    5 Vsync   5 Vback   20 Vpol P
    DTD 5:   720x480    59.940060 Hz   3:2     31.469 kHz     27.000000 MHz (432 mm x 243 mm)
                 Hfront   16 Hsync  62 Hback   60 Hpol N
                 Vfront    9 Vsync   6 Vback   30 Vpol N
    DTD 6:   720x576    50.000000 Hz   5:4     31.250 kHz     27.000000 MHz (432 mm x 243 mm)
                 Hfront   12 Hsync  64 Hback   68 Hpol N
                 Vfront    5 Vsync   5 Vback   39 Vpol N
    DTD 7:   640x480    59.952381 Hz   4:3     31.475 kHz     25.180000 MHz (324 mm x 243 mm)
                 Hfront   16 Hsync  96 Hback   48 Hpol N
                 Vfront   10 Vsync   2 Vback   33 Vpol N
Checksum: 0x2d  Unused space in Extension Block: 9 bytes
