edid-decode (hex):

00 ff ff ff ff ff ff 00 4c 83 54 47 00 00 00 00
00 19 01 04 a5 26 15 78 0a 59 35 a3 56 4b 9c 25
10 50 54 00 00 00 01 01 01 01 01 01 01 01 01 01
01 01 01 01 01 01 2a 36 80 a0 70 38 1f 40 30 20
25 00 7e d7 10 00 00 19 1c 24 80 a0 70 38 1f 40
30 20 25 00 7e d7 10 00 00 19 00 00 00 00 00 00
00 00 00 00 00 00 00 00 00 00 00 00 00 00 00 02
00 0c 3f ff 0c 3c 7d 1e 18 32 7d 00 00 00 00 fb

----------------

Block 0, Base EDID:
  EDID Structure Version & Revision: 1.4
  Vendor & Product Identification:
    Manufacturer: SDC
    Model: 18260
    Made in: 2015
  Basic Display Parameters & Features:
    Digital display
    Bits per primary color channel: 8
    DisplayPort interface
    Maximum image size: 38 cm x 21 cm
    Gamma: 2.20
    Supported color formats: RGB 4:4:4, YCrCb 4:4:4
    First detailed timing includes the native pixel format and preferred refresh rate
  Color Characteristics:
    Red  : 0.6376, 0.3369
    Green: 0.2949, 0.6103
    Blue : 0.1445, 0.0654
    White: 0.3134, 0.3291
  Established Timings I & II: none
  Standard Timings: none
  Detailed Timing Descriptors:
    DTD 1:  1920x1080   60.003116 Hz  16:9     66.663 kHz    138.660000 MHz (382 mm x 215 mm)
                 Hfront   48 Hsync  32 Hback   80 Hpol N
                 Vfront    2 Vsync   5 Vback   24 Vpol N
    DTD 2:  1920x1080   40.002077 Hz  16:9     44.442 kHz     92.440000 MHz (382 mm x 215 mm)
                 Hfront   48 Hsync  32 Hback   80 Hpol N
                 Vfront    2 Vsync   5 Vback   24 Vpol N
    Empty Descriptor
    Manufacturer-Specified Display Descriptor (0x02): 00 02 00 0c 3f ff 0c 3c 7d 1e 18 32 7d 00 00 00 '....?..<}..2}...'
Checksum: 0xfb

----------------

Warnings:

Block 0, Base EDID:
  Missing Display Product Name.

Failures:

Block 0, Base EDID:
  Empty Descriptor: Use Dummy Descriptor instead of all zeroes.

EDID conformity: FAIL
