edid-decode (hex):

00 ff ff ff ff ff ff 00 24 4d 51 1a 01 01 01 01
06 10 01 03 68 21 18 b7 ea f6 29 a2 53 47 99 25
10 48 4c a0 43 00 31 59 45 59 61 59 71 4f 01 01
01 01 01 01 01 01 ea 24 00 60 41 00 28 30 30 60
13 00 36 e6 10 00 00 1e 00 00 00 fc 00 49 42 4d
20 43 31 37 30 20 43 52 54 0a 00 00 00 fd 00 32
a0 1e 55 12 00 0a 20 20 20 20 20 20 00 00 00 ff
00 56 43 47 39 38 38 36 0a 20 20 20 20 20 00 24

----------------

Block 0, Base EDID:
  EDID Structure Version & Revision: 1.3
  Vendor & Product Identification:
    Manufacturer: IBM
    Model: 6737
    Serial Number: ...
    Made in: week 6 of 2006
  Basic Display Parameters & Features:
    Analog display
    Signal Level Standard: 0.700 : 0.000 : 0.700 V p-p
    Blank level equals black level
    Sync: Separate
    Maximum image size: 33 cm x 24 cm
    Gamma: 2.83
    DPMS levels: Standby Suspend Off
    RGB color display
    First detailed timing is the preferred timing
  Color Characteristics:
    Red  : 0.6357, 0.3271
    Green: 0.2783, 0.5996
    Blue : 0.1445, 0.0644
    White: 0.2832, 0.2978
  Established Timings I & II:
    IBM     :   720x400    70.081663 Hz   9:5     31.467 kHz     28.320000 MHz
    DMT 0x04:   640x480    59.940476 Hz   4:3     31.469 kHz     25.175000 MHz
    DMT 0x0b:   800x600    75.000000 Hz   4:3     46.875 kHz     49.500000 MHz
    DMT 0x12:  1024x768    75.028582 Hz   4:3     60.023 kHz     78.750000 MHz
    DMT 0x24:  1280x1024   75.024675 Hz   5:4     79.976 kHz    135.000000 MHz
  Standard Timings:
    DMT 0x07:   640x480    85.008312 Hz   4:3     43.269 kHz     36.000000 MHz
    DMT 0x0c:   800x600    85.061274 Hz   4:3     53.674 kHz     56.250000 MHz
    DMT 0x13:  1024x768    84.996690 Hz   4:3     68.677 kHz     94.500000 MHz
    DMT 0x15:  1152x864    75.000000 Hz   4:3     67.500 kHz    108.000000 MHz
  Detailed Timing Descriptors:
    DTD 1:  1024x768    84.996690 Hz   4:3     68.677 kHz     94.500000 MHz (310 mm x 230 mm)
                 Hfront   48 Hsync  96 Hback  208 Hpol P
                 Vfront    1 Vsync   3 Vback   36 Vpol P
    Display Product Name: 'IBM C170 CRT'
    Display Range Limits:
      Monitor ranges (GTF): 50-160 Hz V, 30-85 kHz H, max dotclock 180 MHz
    Display Product Serial Number: ...
Checksum: 0x24

----------------

Failures:

Block 0, Base EDID:
  Detailed Timing Descriptor #1: Mismatch of image size 310x230 mm vs display size 330x240 mm.

EDID conformity: FAIL
