edid-decode (hex):

00 ff ff ff ff ff ff 00 4c 2d 36 0d 55 32 50 30
1a 1b 01 04 a5 3c 22 78 3b 52 95 a5 56 54 9d 25
0e 50 54 b3 8c 00 81 c0 81 00 81 80 95 00 a9 c0
b3 00 01 01 01 01 21 52 80 a0 72 38 30 40 88 c8
35 00 56 50 21 00 00 1c 00 00 00 fd 00 30 48 52
52 16 01 0a 20 20 20 20 20 20 00 00 00 fc 00 43
32 37 46 35 39 31 0a 20 20 20 20 20 00 00 00 ff
00 48 54 48 4a 36 30 33 35 38 36 0a 20 20 01 f8

02 03 0f f1 42 90 04 23 09 07 07 83 01 00 00 02
3a 80 18 71 38 2d 40 58 2c 45 00 56 50 21 00 00
1e 00 00 00 00 00 00 00 00 00 00 00 00 00 00 00
00 00 00 00 00 00 00 00 00 00 00 00 00 00 00 00
00 00 00 00 00 00 00 00 00 00 00 00 00 00 00 00
00 00 00 00 00 00 00 00 00 00 00 00 00 00 00 00
00 00 00 00 00 00 00 00 00 00 00 00 00 00 00 00
00 00 00 00 00 00 00 00 00 00 00 00 00 00 00 cf

00 ff ff ff ff ff ff 00 4c 2d 36 0d 55 32 50 30
1a 1b 01 04 a5 3c 22 78 3b 52 95 a5 56 54 9d 25
0e 50 54 b3 8c 00 81 c0 81 00 81 80 95 00 a9 c0
b3 00 01 01 01 01 21 52 80 a0 72 38 30 40 88 c8
35 00 56 50 21 00 00 1c 00 00 00 fd 00 30 48 52
52 16 01 0a 20 20 20 20 20 20 00 00 00 fc 00 43
32 37 46 35 39 31 0a 20 20 20 20 20 00 00 00 ff
00 48 54 48 4a 36 30 33 35 38 36 0a 20 20 01 f8

02 03 0f f1 42 90 04 23 09 07 07 83 01 00 00 02
3a 80 18 71 38 2d 40 58 2c 45 00 56 50 21 00 00
1e 00 00 00 00 00 00 00 00 00 00 00 00 00 00 00
00 00 00 00 00 00 00 00 00 00 00 00 00 00 00 00
00 00 00 00 00 00 00 00 00 00 00 00 00 00 00 00
00 00 00 00 00 00 00 00 00 00 00 00 00 00 00 00
00 00 00 00 00 00 00 00 00 00 00 00 00 00 00 00
00 00 00 00 00 00 00 00 00 00 00 00 00 00 00 cf

----------------

Block 0, Base EDID:
  EDID Structure Version & Revision: 1.4
  Vendor & Product Identification:
    Manufacturer: SAM
    Model: 3382
    Serial Number: ...
    Made in: week 26 of 2017
  Basic Display Parameters & Features:
    Digital display
    Bits per primary color channel: 8
    DisplayPort interface
    Maximum image size: 60 cm x 34 cm
    Gamma: 2.20
    DPMS levels: Off
    Supported color formats: RGB 4:4:4, YCrCb 4:4:4, YCrCb 4:2:2
    First detailed timing includes the native pixel format and preferred refresh rate
    Display is continuous frequency
  Color Characteristics:
    Red  : 0.6455, 0.3369
    Green: 0.3281, 0.6152
    Blue : 0.1464, 0.0556
    White: 0.3134, 0.3291
  Established Timings I & II:
    IBM     :   720x400    70.081663 Hz   9:5     31.467 kHz     28.320000 MHz
    DMT 0x04:   640x480    59.940476 Hz   4:3     31.469 kHz     25.175000 MHz
    Apple   :   640x480    66.666667 Hz   4:3     35.000 kHz     30.240000 MHz
    DMT 0x08:   800x600    56.250000 Hz   4:3     35.156 kHz     36.000000 MHz
    DMT 0x09:   800x600    60.316541 Hz   4:3     37.879 kHz     40.000000 MHz
    DMT 0x0a:   800x600    72.187572 Hz   4:3     48.077 kHz     50.000000 MHz
    DMT 0x10:  1024x768    60.003840 Hz   4:3     48.363 kHz     65.000000 MHz
    DMT 0x11:  1024x768    70.069359 Hz   4:3     56.476 kHz     75.000000 MHz
  Standard Timings:
    DMT 0x55:  1280x720    60.000000 Hz  16:9     45.000 kHz     74.250000 MHz
    DMT 0x1c:  1280x800    59.810326 Hz  16:10    49.702 kHz     83.500000 MHz
    DMT 0x23:  1280x1024   60.019740 Hz   5:4     63.981 kHz    108.000000 MHz
    DMT 0x2f:  1440x900    59.887445 Hz  16:10    55.935 kHz    106.500000 MHz
    DMT 0x53:  1600x900    60.000000 Hz  16:9     60.000 kHz    108.000000 MHz (RB)
    DMT 0x3a:  1680x1050   59.954250 Hz  16:10    65.290 kHz    146.250000 MHz
  Detailed Timing Descriptors:
    DTD 1:  1920x1080   71.910434 Hz  16:9     81.115 kHz    210.250000 MHz (598 mm x 336 mm)
                 Hfront  136 Hsync 200 Hback  336 Hpol N
                 Vfront    3 Vsync   5 Vback   40 Vpol P
    Display Range Limits:
      Monitor ranges (Bare Limits): 48-72 Hz V, 82-82 kHz H, max dotclock 220 MHz
    Display Product Name: 'C27F591'
    Display Product Serial Number: ...
  Extension blocks: 1
Checksum: 0xf8

----------------

Block 1, CTA-861 Extension Block:
  Revision: 3
  Underscans IT Video Formats by default
  Basic audio support
  Supports YCbCr 4:4:4
  Supports YCbCr 4:2:2
  Native detailed modes: 1
  Video Data Block:
    VIC  16:  1920x1080   60.000000 Hz  16:9     67.500 kHz    148.500000 MHz (native)
    VIC   4:  1280x720    60.000000 Hz  16:9     45.000 kHz     74.250000 MHz
  Audio Data Block:
    Linear PCM:
      Max channels: 2
      Supported sample rates (kHz): 48 44.1 32
      Supported sample sizes (bits): 24 20 16
  Speaker Allocation Data Block:
    FL/FR - Front Left/Right
  Detailed Timing Descriptors:
    DTD 2:  1920x1080   60.000000 Hz  16:9     67.500 kHz    148.500000 MHz (598 mm x 336 mm)
                 Hfront   88 Hsync  44 Hback  148 Hpol P
                 Vfront    4 Vsync   5 Vback   36 Vpol P
Checksum: 0xcf  Unused space in Extension Block: 94 bytes

----------------

Block 2, Unknown EDID Extension Block 0x00:
  00 ff ff ff ff ff ff 00 4c 2d 36 0d 55 32 50 30 '........L-6.U2P0'
  1a 1b 01 04 a5 3c 22 78 3b 52 95 a5 56 54 9d 25 '.....<"x;R..VT.%'
  0e 50 54 b3 8c 00 81 c0 81 00 81 80 95 00 a9 c0 '.PT.............'
  b3 00 01 01 01 01 21 52 80 a0 72 38 30 40 88 c8 '......!R..r80@..'
  35 00 56 50 21 00 00 1c 00 00 00 fd 00 30 48 52 '5.VP!........0HR'
  52 16 01 0a 20 20 20 20 20 20 00 00 00 fc 00 43 'R...      .....C'
  32 37 46 35 39 31 0a 20 20 20 20 20 00 00 00 ff '27F591.     ....'
  00 48 54 48 4a 36 30 33 35 38 36 0a 20 20 01 f8 '.HTHJ603586.  ..'
Checksum: 0xf8

----------------

Block 3, CTA-861 Extension Block:
  Revision: 3
  Underscans IT Video Formats by default
  Basic audio support
  Supports YCbCr 4:4:4
  Supports YCbCr 4:2:2
  Native detailed modes: 1
  Video Data Block:
    VIC  16:  1920x1080   60.000000 Hz  16:9     67.500 kHz    148.500000 MHz (native)
    VIC   4:  1280x720    60.000000 Hz  16:9     45.000 kHz     74.250000 MHz
  Audio Data Block:
    Linear PCM:
      Max channels: 2
      Supported sample rates (kHz): 48 44.1 32
      Supported sample sizes (bits): 24 20 16
  Speaker Allocation Data Block:
    FL/FR - Front Left/Right
  Detailed Timing Descriptors:
    DTD 3:  1920x1080   60.000000 Hz  16:9     67.500 kHz    148.500000 MHz (598 mm x 336 mm)
                 Hfront   88 Hsync  44 Hback  148 Hpol P
                 Vfront    4 Vsync   5 Vback   36 Vpol P
Checksum: 0xcf  Unused space in Extension Block: 94 bytes

----------------

Warnings:

Block 1, CTA-861 Extension Block:
  Display Product Serial Number is set, so the Serial Number in the Base EDID should be 0.
  Add a Colorimetry Data Block with the sRGB colorimetry bit set to avoid interop issues.
Block 3, CTA-861 Extension Block:
  Display Product Serial Number is set, so the Serial Number in the Base EDID should be 0.
  Add a Colorimetry Data Block with the sRGB colorimetry bit set to avoid interop issues.
EDID:
  Base EDID: Some timings are out of range of the Monitor Ranges:
    Horizontal Freq: 31.466 - 81.114 kHz (Monitor: 82.000 - 82.000 kHz)
  CTA-861: Multiple native progressive timings are defined.

Failures:

Block 1, CTA-861 Extension Block:
  Missing VCDB, needed for Set Selectable RGB Quantization to avoid interop issues.
Block 2, Base EDID:
  Unknown Extension Block.
Block 3, CTA-861 Extension Block:
  Video Data Block: Duplicate VIC 16.
  Video Data Block: Duplicate VIC 4.
  Speaker Allocation Data Block: Only one instance of this Data Block is allowed.
  Missing VCDB, needed for Set Selectable RGB Quantization to avoid interop issues.
EDID:
  Base EDID: EDID specified 1 extension block(s), but found 3 extension block(s).

EDID conformity: FAIL
