edid-decode (hex):

00 ff ff ff ff ff ff 00 09 d1 48 79 45 54 00 00
18 1c 01 03 80 3c 22 78 2e a7 05 ab 4f 46 ab 27
0c 50 54 a5 6b 80 d1 c0 81 c0 81 00 81 80 a9 c0
b3 00 01 01 01 01 02 3a 80 18 71 38 2d 40 58 2c
45 00 56 50 21 00 00 1e 00 00 00 ff 00 54 36 4a
30 32 38 35 38 53 4c 30 0a 20 00 00 00 fd 00 32
4c 1e 53 13 00 0a 20 20 20 20 20 20 00 00 00 fc
00 42 65 6e 51 20 45 57 32 37 37 48 44 52 01 d3

02 03 32 f1 4f 90 05 04 03 02 01 11 12 13 14 06
07 15 16 1f e2 00 cf 23 09 07 07 67 03 0c 00 20
00 38 3c 83 01 00 00 e3 05 c3 01 e6 06 05 01 60
60 46 02 3a 80 18 71 38 2d 40 58 2c 45 00 56 50
21 00 00 1f 01 1d 80 18 71 1c 16 20 58 2c 25 00
56 50 21 00 00 9f 01 1d 00 72 51 d0 1e 20 6e 28
55 00 56 50 21 00 00 1e 8c 0a d0 8a 20 e0 2d 10
10 3e 96 00 56 50 21 00 00 18 00 00 00 00 00 5c

----------------

Block 0, Base EDID:
  EDID Structure Version & Revision: 1.3
  Vendor & Product Identification:
    Manufacturer: BNQ
    Model: 31048
    Serial Number: ...
    Made in: week 24 of 2018
  Basic Display Parameters & Features:
    Digital display
    Maximum image size: 60 cm x 34 cm
    Gamma: 2.20
    DPMS levels: Off
    RGB color display
    Default (sRGB) color space is primary color space
    First detailed timing is preferred timing
  Color Characteristics:
    Red  : 0.6699, 0.3105
    Green: 0.2744, 0.6708
    Blue : 0.1523, 0.0468
    White: 0.3134, 0.3291
  Established Timings I & II:
    IBM     :   720x400    70.082 Hz   9:5    31.467 kHz  28.320 MHz
    DMT 0x04:   640x480    59.940 Hz   4:3    31.469 kHz  25.175 MHz
    DMT 0x06:   640x480    75.000 Hz   4:3    37.500 kHz  31.500 MHz
    DMT 0x09:   800x600    60.317 Hz   4:3    37.879 kHz  40.000 MHz
    DMT 0x0b:   800x600    75.000 Hz   4:3    46.875 kHz  49.500 MHz
    Apple   :   832x624    74.551 Hz   4:3    49.726 kHz  57.284 MHz
    DMT 0x10:  1024x768    60.004 Hz   4:3    48.363 kHz  65.000 MHz
    DMT 0x12:  1024x768    75.029 Hz   4:3    60.023 kHz  78.750 MHz
    DMT 0x24:  1280x1024   75.025 Hz   5:4    79.976 kHz 135.000 MHz
    Apple   :  1152x870    75.062 Hz 192:145  68.681 kHz 100.000 MHz
  Standard Timings:
    DMT 0x52:  1920x1080   60.000 Hz  16:9    67.500 kHz 148.500 MHz
    DMT 0x55:  1280x720    60.000 Hz  16:9    45.000 kHz  74.250 MHz
    DMT 0x1c:  1280x800    59.810 Hz  16:10   49.702 kHz  83.500 MHz
    DMT 0x23:  1280x1024   60.020 Hz   5:4    63.981 kHz 108.000 MHz
    DMT 0x53:  1600x900    60.000 Hz  16:9    60.000 kHz 108.000 MHz (RB)
    DMT 0x3a:  1680x1050   59.954 Hz  16:10   65.290 kHz 146.250 MHz
  Detailed Timing Descriptors:
    DTD 1:  1920x1080   60.000 Hz  16:9    67.500 kHz 148.500 MHz (598 mm x 336 mm)
                 Hfront   88 Hsync  44 Hback 148 Hpol P
                 Vfront    4 Vsync   5 Vback  36 Vpol P
    Display Product Serial Number: ...
  Display Range Limits:
    Monitor ranges (GTF): 50-76 Hz V, 30-83 kHz H, max dotclock 190 MHz
    Display Product Name: 'BenQ EW277HDR'
  Extension blocks: 1
Checksum: 0xd3

----------------

Block 1, CTA-861 Extension Block:
  Revision: 3
  Underscans PC formats by default
  Basic audio support
  Supports YCbCr 4:4:4
  Supports YCbCr 4:2:2
  Native detailed modes: 1
  Video Data Block:
    VIC  16:  1920x1080   60.000 Hz  16:9    67.500 kHz 148.500 MHz (native)
    VIC   5:  1920x1080i  60.000 Hz  16:9    33.750 kHz  74.250 MHz
    VIC   4:  1280x720    60.000 Hz  16:9    45.000 kHz  74.250 MHz
    VIC   3:   720x480    59.940 Hz  16:9    31.469 kHz  27.000 MHz
    VIC   2:   720x480    59.940 Hz   4:3    31.469 kHz  27.000 MHz
    VIC   1:   640x480    59.940 Hz   4:3    31.469 kHz  25.175 MHz
    VIC  17:   720x576    50.000 Hz   4:3    31.250 kHz  27.000 MHz
    VIC  18:   720x576    50.000 Hz  16:9    31.250 kHz  27.000 MHz
    VIC  19:  1280x720    50.000 Hz  16:9    37.500 kHz  74.250 MHz
    VIC  20:  1920x1080i  50.000 Hz  16:9    28.125 kHz  74.250 MHz
    VIC   6:  1440x480i   59.940 Hz   4:3    15.734 kHz  27.000 MHz
    VIC   7:  1440x480i   59.940 Hz  16:9    15.734 kHz  27.000 MHz
    VIC  21:  1440x576i   50.000 Hz   4:3    15.625 kHz  27.000 MHz
    VIC  22:  1440x576i   50.000 Hz  16:9    15.625 kHz  27.000 MHz
    VIC  31:  1920x1080   50.000 Hz  16:9    56.250 kHz 148.500 MHz
  Video Capability Data Block:
    YCbCr quantization: Selectable (via AVI YQ)
    RGB quantization: Selectable (via AVI Q)
    PT scan behavior: No Data
    IT scan behavior: Supports both over- and underscan
    CE scan behavior: Supports both over- and underscan
  Audio Data Block:
    Linear PCM:
      Max channels: 2
      Supported sample rates (kHz): 48 44.1 32
      Supported sample sizes (bits): 24 20 16
  Vendor-Specific Data Block (HDMI), OUI 00-0C-03:
    Source physical address: 2.0.0.0
    DC_36bit
    DC_30bit
    DC_Y444
    Maximum TMDS clock: 300 MHz
  Speaker Allocation Data Block:
    FL/FR - Front Left/Right
  Colorimetry Data Block:
    xvYCC601
    xvYCC709
    BT2020YCC
    BT2020RGB
  HDR Static Metadata Data Block:
    Electro optical transfer functions:
      Traditional gamma - SDR luminance range
      SMPTE ST2084
    Supported static metadata descriptors:
      Static metadata type 1
    Desired content max luminance: 96 (400.000 cd/m^2)
    Desired content max frame-average luminance: 96 (400.000 cd/m^2)
    Desired content min luminance: 70 (0.301 cd/m^2)
  Detailed Timing Descriptors:
    DTD 2:  1920x1080   60.000 Hz  16:9    67.500 kHz 148.500 MHz (598 mm x 336 mm)
                 Hfront   88 Hsync  44 Hback 148 Hpol P
                 Vfront    4 Vsync   5 Vback  36 Vpol P
    DTD 3:  1920x1080i  60.000 Hz  16:9    33.750 kHz  74.250 MHz (598 mm x 336 mm)
                 Hfront   88 Hsync  44 Hback 148 Hpol P
                 Vfront    2 Vsync   5 Vback  15 Vpol P Vfront +0.5 Odd Field
                 Vfront    2 Vsync   5 Vback  15 Vpol P Vback  +0.5 Even Field
    DTD 4:  1280x720    60.000 Hz  16:9    45.000 kHz  74.250 MHz (598 mm x 336 mm)
                 Hfront  110 Hsync  40 Hback 220 Hpol P
                 Vfront    5 Vsync   5 Vback  20 Vpol P
    DTD 5:   720x480    59.940 Hz   3:2    31.469 kHz  27.000 MHz (598 mm x 336 mm)
                 Hfront   16 Hsync  62 Hback  60 Hpol N
                 Vfront    9 Vsync   6 Vback  30 Vpol N
Checksum: 0x5c

----------------

Warnings:

Block 1, CTA-861 Extension Block:
  Display Product Serial Number is set, so the Serial Number in the Base EDID should be 0.

Failures:

Block 0, Base EDID:
  Basic Display Parameters & Features: sRGB is signaled, but the chromaticities do not match.
All Blocks:
  Some timings are out of range of the Monitor Ranges:
    Horizontal Freq: 15.625 - 79.976 kHz (Monitor: 30.000 - 83.000 kHz)

EDID conformity: FAIL
