
EDID (hex):
00ffffffffffff0010acd0424c574a42
1e220104b53c22783962a5ad5046ab24
0e5054a54b00d1c0a940a9c081c08180
714f01010101565e00a0a0a029503020
350055502100001a000000ff00373434
484833340a2020202020000000fc0044
454c4c205532373234440a20000000fd
003078b2b23c010a20202020202001cb
02031ef14ebf40101f22212004131211
03020123097f0783010000e200eac8be
00bea0a028503020a80455502100001a
d97600a0a0a034503020350055502100
001a866f80a070384040302035005550
2100001a7e3900a080381f4030203a00
55502100001a00000000000000000000
00000000000000000000000000000061

edid-decode (hex):

00 ff ff ff ff ff ff 00 10 ac d0 42 4c 57 4a 42
1e 22 01 04 b5 3c 22 78 39 62 a5 ad 50 46 ab 24
0e 50 54 a5 4b 00 d1 c0 a9 40 a9 c0 81 c0 81 80
71 4f 01 01 01 01 56 5e 00 a0 a0 a0 29 50 30 20
35 00 55 50 21 00 00 1a 00 00 00 ff 00 37 34 34
48 48 33 34 0a 20 20 20 20 20 00 00 00 fc 00 44
45 4c 4c 20 55 32 37 32 34 44 0a 20 00 00 00 fd
00 30 78 b2 b2 3c 01 0a 20 20 20 20 20 20 01 cb

02 03 1e f1 4e bf 40 10 1f 22 21 20 04 13 12 11
03 02 01 23 09 7f 07 83 01 00 00 e2 00 ea c8 be
00 be a0 a0 28 50 30 20 a8 04 55 50 21 00 00 1a
d9 76 00 a0 a0 a0 34 50 30 20 35 00 55 50 21 00
00 1a 86 6f 80 a0 70 38 40 40 30 20 35 00 55 50
21 00 00 1a 7e 39 00 a0 80 38 1f 40 30 20 3a 00
55 50 21 00 00 1a 00 00 00 00 00 00 00 00 00 00
00 00 00 00 00 00 00 00 00 00 00 00 00 00 00 61

----------------

Block 0, Base EDID:
  EDID Structure Version & Revision: 1.4
  Vendor & Product Identification:
    Manufacturer: DEL
    Model: 17104
    Serial Number: 1112168268
    Made in: week 30 of 2024
  Basic Display Parameters & Features:
    Digital display
    Bits per primary color channel: 10
    DisplayPort interface
    Maximum image size: 60 cm x 34 cm
    Gamma: 2.20
    DPMS levels: Off
    Supported color formats: RGB 4:4:4, YCrCb 4:4:4, YCrCb 4:2:2
    First detailed timing does not include the native pixel format and preferred refresh rate
    Display is continuous frequency
  Color Characteristics:
    Red  : 0.6767, 0.3144
    Green: 0.2734, 0.6699
    Blue : 0.1425, 0.0566
    White: 0.3134, 0.3291
  Established Timings I & II:
    IBM     :   720x400    70.081663 Hz   9:5     31.467 kHz     28.320000 MHz
    DMT 0x04:   640x480    59.940476 Hz   4:3     31.469 kHz     25.175000 MHz
    DMT 0x06:   640x480    75.000000 Hz   4:3     37.500 kHz     31.500000 MHz
    DMT 0x09:   800x600    60.316541 Hz   4:3     37.879 kHz     40.000000 MHz
    DMT 0x0b:   800x600    75.000000 Hz   4:3     46.875 kHz     49.500000 MHz
    DMT 0x10:  1024x768    60.003840 Hz   4:3     48.363 kHz     65.000000 MHz
    DMT 0x12:  1024x768    75.028582 Hz   4:3     60.023 kHz     78.750000 MHz
    DMT 0x24:  1280x1024   75.024675 Hz   5:4     79.976 kHz    135.000000 MHz
  Standard Timings:
    DMT 0x52:  1920x1080   60.000000 Hz  16:9     67.500 kHz    148.500000 MHz
    DMT 0x33:  1600x1200   60.000000 Hz   4:3     75.000 kHz    162.000000 MHz
    DMT 0x53:  1600x900    60.000000 Hz  16:9     60.000 kHz    108.000000 MHz (RB)
    DMT 0x55:  1280x720    60.000000 Hz  16:9     45.000 kHz     74.250000 MHz
    DMT 0x23:  1280x1024   60.019740 Hz   5:4     63.981 kHz    108.000000 MHz
    DMT 0x15:  1152x864    75.000000 Hz   4:3     67.500 kHz    108.000000 MHz
  Detailed Timing Descriptors:
    DTD 1:  2560x1440   59.950550 Hz  16:9     88.787 kHz    241.500000 MHz (597 mm x 336 mm)
                 Hfront   48 Hsync  32 Hback   80 Hpol P
                 Vfront    3 Vsync   5 Vback   33 Vpol N
    Display Product Serial Number: '744HH34'
    Display Product Name: 'DELL U2724D'
    Display Range Limits:
      Monitor ranges (Bare Limits): 48-120 Hz V, 178-178 kHz H, max dotclock 600 MHz
  Extension blocks: 1
Checksum: 0xcb

----------------

Block 1, CTA-861 Extension Block:
  Revision: 3
  Underscans IT Video Formats by default
  Basic audio support
  Supports YCbCr 4:4:4
  Supports YCbCr 4:2:2
  Native detailed modes: 1
  Video Data Block:
    VIC  63:  1920x1080  120.000000 Hz  16:9    135.000 kHz    297.000000 MHz (native)
    VIC  64:  1920x1080  100.000000 Hz  16:9    112.500 kHz    297.000000 MHz
    VIC  16:  1920x1080   60.000000 Hz  16:9     67.500 kHz    148.500000 MHz
    VIC  31:  1920x1080   50.000000 Hz  16:9     56.250 kHz    148.500000 MHz
    VIC  34:  1920x1080   30.000000 Hz  16:9     33.750 kHz     74.250000 MHz
    VIC  33:  1920x1080   25.000000 Hz  16:9     28.125 kHz     74.250000 MHz
    VIC  32:  1920x1080   24.000000 Hz  16:9     27.000 kHz     74.250000 MHz
    VIC   4:  1280x720    60.000000 Hz  16:9     45.000 kHz     74.250000 MHz
    VIC  19:  1280x720    50.000000 Hz  16:9     37.500 kHz     74.250000 MHz
    VIC  18:   720x576    50.000000 Hz  16:9     31.250 kHz     27.000000 MHz
    VIC  17:   720x576    50.000000 Hz   4:3     31.250 kHz     27.000000 MHz
    VIC   3:   720x480    59.940060 Hz  16:9     31.469 kHz     27.000000 MHz
    VIC   2:   720x480    59.940060 Hz   4:3     31.469 kHz     27.000000 MHz
    VIC   1:   640x480    59.940476 Hz   4:3     31.469 kHz     25.175000 MHz
  Audio Data Block:
    Linear PCM:
      Max channels: 2
      Supported sample rates (kHz): 192 176.4 96 88.2 48 44.1 32
      Supported sample sizes (bits): 24 20 16
  Speaker Allocation Data Block:
    FL/FR - Front Left/Right
  Video Capability Data Block:
    YCbCr quantization: Selectable (via AVI YQ)
    RGB quantization: Selectable (via AVI Q)
    PT scan behavior: Always Underscanned
    IT scan behavior: Always Underscanned
    CE scan behavior: Always Underscanned
  Detailed Timing Descriptors:
    DTD 2:  2560x1440  120.000000 Hz  16:9    177.600 kHz    488.400000 MHz (597 mm x 336 mm)
                 Hfront   48 Hsync  32 Hback  110 Hpol P
                 Vfront   26 Vsync   8 Vback    6 Vpol N
    DTD 3:  2560x1440   74.970923 Hz  16:9    111.857 kHz    304.250000 MHz (597 mm x 336 mm)
                 Hfront   48 Hsync  32 Hback   80 Hpol P
                 Vfront    3 Vsync   5 Vback   44 Vpol N
    DTD 4:  1920x1080  119.982181 Hz  16:9    137.260 kHz    285.500000 MHz (597 mm x 336 mm)
                 Hfront   48 Hsync  32 Hback   80 Hpol P
                 Vfront    3 Vsync   5 Vback   56 Vpol N
    DTD 5:  2048x1080   59.997848 Hz 256:135   66.658 kHz    147.180000 MHz (597 mm x 336 mm)
                 Hfront   48 Hsync  32 Hback   80 Hpol P
                 Vfront    3 Vsync  10 Vback   18 Vpol N
Checksum: 0x61  Unused space in Extension Block: 25 bytes
