edid-decode (hex):

00 ff ff ff ff ff ff 00 20 a4 07 15 01 01 01 01
06 11 01 03 00 21 15 14 2a ca a5 95 5b 4c 95 27
22 50 54 a1 08 00 01 01 01 01 01 01 01 01 01 01
01 01 01 01 01 01 40 1f 00 40 51 20 1e 30 30 20
26 00 4b cf 10 00 00 1a 00 00 00 ff 00 35 30 35
33 44 30 30 31 30 30 30 31 0a 00 00 00 fd 00 3a
3e 1f 33 08 00 0a 20 20 20 20 20 20 00 00 00 fc
00 48 45 44 59 0a 20 20 20 20 20 20 20 20 00 60

----------------

Block 0, Base EDID:
  EDID Structure Version & Revision: 1.3
  Vendor & Product Identification:
    Manufacturer: HED
    Model: 5383
    Serial Number: ...
    Made in: week 6 of 2007
  Basic Display Parameters & Features:
    Analog display
    Signal Level Standard: 0.700 : 0.300 : 1.000 V p-p
    Blank level equals black level
    Maximum image size: 33 cm x 21 cm
    Gamma: 1.20
    DPMS levels: Off
    RGB color display
    First detailed timing is the preferred timing
  Color Characteristics:
    Red  : 0.5849, 0.3554
    Green: 0.2988, 0.5839
    Blue : 0.1542, 0.1347
    White: 0.3134, 0.3291
  Established Timings I & II:
    IBM     :   720x400    70.081663 Hz   9:5     31.467 kHz     28.320000 MHz
    DMT 0x04:   640x480    59.940476 Hz   4:3     31.469 kHz     25.175000 MHz
    DMT 0x09:   800x600    60.316541 Hz   4:3     37.879 kHz     40.000000 MHz
    DMT 0x10:  1024x768    60.003840 Hz   4:3     48.363 kHz     65.000000 MHz
  Standard Timings: none
  Detailed Timing Descriptors:
    DTD 1:  1280x800    60.240964 Hz   8:5     50.000 kHz     80.000000 MHz (331 mm x 207 mm)
                 Hfront   48 Hsync  32 Hback  240 Hpol P
                 Vfront    2 Vsync   6 Vback   22 Vpol N
    Display Product Serial Number: ...
    Display Range Limits:
      Monitor ranges (GTF): 58-62 Hz V, 31-51 kHz H, max dotclock 80 MHz
    Display Product Name: 'HEDY'
Checksum: 0x60

----------------

Failures:

EDID:
  Base EDID: Some timings are out of range of the Monitor Ranges:
    Vertical Freq: 59.940 - 70.082 Hz (Monitor: 58.000 - 62.000 Hz)
    Maximum Clock: 80.000 MHz (Monitor: 80.000 MHz)

EDID conformity: FAIL
