
EDID (hex):
00ffffffffffff00342701197f000000
1810010368261e6eef8bc5a45a489b25
1a5054bfee80818f0101010101010101
0101010101010e1f008051001e304080
370040ce1000001cf12700a051002530
508037007c2c1100001ce520009f5120
1c304d8a130040ce1000001ce12900b2
51202230528b030040ce1000001c00a9

Extracted contents:
header:          00 ff ff ff ff ff ff 00
serial number:   34 27 01 19 7f 00 00 00 18 10
version:         01 03
basic params:    68 26 1e 6e ef
chroma info:     8b c5 a4 5a 48 9b 25 1a 50 54
established:     bf ee 80
standard:        81 8f 01 01 01 01 01 01 01 01 01 01 01 01 01 01
descriptor 1:    0e 1f 00 80 51 00 1e 30 40 80 37 00 40 ce 10 00 00 1c
descriptor 2:    f1 27 00 a0 51 00 25 30 50 80 37 00 7c 2c 11 00 00 1c
descriptor 3:    e5 20 00 9f 51 20 1c 30 4d 8a 13 00 40 ce 10 00 00 1c
descriptor 4:    e1 29 00 b2 51 20 22 30 52 8b 03 00 40 ce 10 00 00 1c
extensions:      00
checksum:        a9

EDID version: 1.3
Manufacturer: MAG Model 1901 Serial Number --
Made in week 24 of 2006
Analog display, Input voltage level: 0.7/0.7 V
Sync: Separate 
Maximum image size: 38 cm x 30 cm
Gamma: 2.10
DPMS levels: Standby Suspend Off
RGB color display
Default (sRGB) color space is primary color space
First detailed timing is preferred timing
Supports GTF timings within operating range
Display x,y Chromaticity:
  Red:   0.6425, 0.3515
  Green: 0.2832, 0.6083
  Blue:  0.1474, 0.1015
  White: 0.3134, 0.3291
Established timings supported:
  720x400@70Hz 9:5 HorFreq: 31469 Hz Clock: 28.320 MHz
  640x480@60Hz 4:3 HorFreq: 31469 Hz Clock: 25.175 MHz
  640x480@67Hz 4:3 HorFreq: 35000 Hz Clock: 30.240 MHz
  640x480@72Hz 4:3 HorFreq: 37900 Hz Clock: 31.500 MHz
  640x480@75Hz 4:3 HorFreq: 37500 Hz Clock: 31.500 MHz
  800x600@56Hz 4:3 HorFreq: 35200 Hz Clock: 36.000 MHz
  800x600@60Hz 4:3 HorFreq: 37900 Hz Clock: 40.000 MHz
  800x600@72Hz 4:3 HorFreq: 48100 Hz Clock: 50.000 MHz
  800x600@75Hz 4:3 HorFreq: 46900 Hz Clock: 49.500 MHz
  832x624@75Hz 4:3 HorFreq: 49726 Hz Clock: 57.284 MHz
  1024x768@60Hz 4:3 HorFreq: 48400 Hz Clock: 65.000 MHz
  1024x768@70Hz 4:3 HorFreq: 56500 Hz Clock: 75.000 MHz
  1024x768@75Hz 4:3 HorFreq: 60000 Hz Clock: 78.750 MHz
  1152x870@75Hz 192:145 HorFreq: 67500 Hz Clock: 108.000 MHz
Standard timings supported:
  1280x1024@75Hz 5:4 HorFreq: 80000 Hz Clock: 135.000 MHz
Detailed mode: Clock 79.500 MHz, 320 mm x 206 mm
               1280 1344 1472 1664 hborder 0
                768  771  778  798 vborder 0
               -hsync +vsync 
               VertFreq: 59 Hz, HorFreq: 47776 Hz
Detailed mode: Clock 102.250 MHz, 380 mm x 300 mm
               1280 1360 1488 1696 hborder 0
                768  771  778  805 vborder 0
               -hsync +vsync 
               VertFreq: 74 Hz, HorFreq: 60288 Hz
Detailed mode: Clock 84.210 MHz, 320 mm x 206 mm
               1280 1357 1495 1695 hborder 0
                800  801  804  828 vborder 0
               -hsync +vsync 
               VertFreq: 60 Hz, HorFreq: 49681 Hz
Detailed mode: Clock 107.210 MHz, 320 mm x 206 mm
               1280 1362 1501 1714 hborder 0
                800  800  803  834 vborder 0
               -hsync +vsync 
               VertFreq: 74 Hz, HorFreq: 62549 Hz
Checksum: 0xa9 (valid)
EDID block does NOT conform to EDID 1.3!
	sRGB is signaled, but the chromaticities do not match
	Missing name descriptor
	Missing monitor ranges
