edid-decode (hex):

00 ff ff ff ff ff ff 00 05 e3 49 16 01 00 00 00
2a 15 01 03 81 22 13 78 2a b8 65 92 57 58 8d 28
1f 50 54 00 00 00 01 01 01 01 01 01 01 01 01 01
01 01 01 01 01 01 20 1c 56 a0 50 00 10 30 0e 38
13 00 58 c1 10 00 00 1e 00 00 00 ff 00 43 5a 53
42 41 48 41 30 30 34 34 34 32 00 00 00 fd 00 32
4b 26 3a 09 00 0a 20 20 20 20 20 20 00 00 00 fc
00 31 36 34 39 57 0a 20 20 20 20 20 20 20 00 f4

----------------

Block 0, Base EDID:
  EDID Structure Version & Revision: 1.3
  Vendor & Product Identification:
    Manufacturer: AOC
    Model: 5705
    Serial Number: ...
    Made in: week 42 of 2011
  Basic Display Parameters & Features:
    Digital display
    DFP 1.x compatible TMDS
    Maximum image size: 34 cm x 19 cm
    Gamma: 2.20
    DPMS levels: Off
    RGB color display
    First detailed timing is the preferred timing
  Color Characteristics:
    Red  : 0.5722, 0.3427
    Green: 0.3457, 0.5507
    Blue : 0.1572, 0.1230
    White: 0.3134, 0.3291
  Established Timings I & II: none
  Standard Timings: none
  Detailed Timing Descriptors:
    DTD 1:  1366x768    60.181346 Hz 683:384   47.182 kHz     72.000000 MHz (344 mm x 193 mm)
                 Hfront   14 Hsync  56 Hback   90 Hpol P
                 Vfront    1 Vsync   3 Vback   12 Vpol P
    Display Product Serial Number: ...
    Display Range Limits:
      Monitor ranges (GTF): 50-75 Hz V, 38-58 kHz H, max dotclock 90 MHz
    Display Product Name: '1649W'
Checksum: 0xf4

----------------

EDID conformity: PASS
