edid-decode (hex):

00 ff ff ff ff ff ff 00 09 e5 99 08 00 00 00 00
00 0f 01 03 80 18 12 78 0a 8d 51 92 55 4e 89 26
28 4e 54 00 08 00 01 01 01 01 01 01 01 01 01 01
01 01 01 01 01 01 64 19 00 40 41 00 26 30 18 88
36 00 f5 b8 00 00 00 18 00 00 00 fe 00 20 0a 20
20 20 20 20 20 20 20 20 20 20 00 00 00 fe 00 42
4f 45 20 48 59 44 49 53 0a 20 20 20 00 00 00 fe
00 48 54 31 32 58 32 31 2d 32 32 31 0a 20 00 9a

----------------

Block 0, Base EDID:
  EDID Structure Version & Revision: 1.3
  Vendor & Product Identification:
    Manufacturer: BOE
    Model: 2201
    Made in: 2005
  Basic Display Parameters & Features:
    Digital display
    Maximum image size: 24 cm x 18 cm
    Gamma: 2.20
    RGB color display
    First detailed timing is preferred timing
  Color Characteristics:
    Red  : 0.5722, 0.3320
    Green: 0.3076, 0.5361
    Blue : 0.1494, 0.1572
    White: 0.3046, 0.3291
  Established Timings I & II:
    DMT 0x10:  1024x768    60.004 Hz   4:3    48.363 kHz  65.000 MHz
  Standard Timings: none
  Detailed Timing Descriptors:
    DTD 1:  1024x768    60.004 Hz   4:3    48.363 kHz  65.000 MHz (245 mm x 184 mm)
                 Hfront   24 Hsync 136 Hback 160 Hpol N
                 Vfront    3 Vsync   6 Vback  29 Vpol N
    Alphanumeric Data String: ' '
    Alphanumeric Data String: 'BOE HYDIS'
    Alphanumeric Data String: 'HT12X21-221'
Checksum: 0x9a

----------------

Failures:

Block 0, Base EDID:
  Alphanumeric Data String: One or more trailing spaces.
  Missing Display Product Name.
  Missing Display Range Limits Descriptor.

EDID conformity: FAIL
