edid-decode (hex):

00 ff ff ff ff ff ff 00 26 13 19 20 01 00 00 00
23 1d 01 03 00 00 00 78 ea 2d 36 a7 54 38 ae 26
0d 4f 54 af cf 00 d1 c0 b3 00 95 00 81 80 81 8a
81 00 81 40 01 01 02 3a 80 18 71 38 2d 40 58 2c
45 00 d6 18 11 00 00 1c 66 21 50 b0 51 00 1b 30
40 70 36 00 30 e4 10 00 00 1e 2a 44 80 a0 70 38
27 40 30 2c 45 00 d6 18 11 00 00 1e 00 00 00 fc
00 43 4f 4f 4c 47 45 4e 0a 20 20 20 20 20 00 0b

00 ff ff ff ff ff ff 00 26 13 19 20 01 00 00 00
23 1d 01 03 00 00 00 78 ea 2d 36 a7 54 38 ae 26
0d 4f 54 af cf 00 d1 c0 b3 00 95 00 81 80 81 8a
81 00 81 40 01 01 02 3a 80 18 71 38 2d 40 58 2c
45 00 d6 18 11 00 00 1c 66 21 50 b0 51 00 1b 30
40 70 36 00 30 e4 10 00 00 1e 2a 44 80 a0 70 38
27 40 30 2c 45 00 d6 18 11 00 00 1e 00 00 00 fc
00 43 4f 4f 4c 47 45 4e 0a 20 20 20 20 20 00 0b

----------------

Block 0, Base EDID:
  EDID Structure Version & Revision: 1.3
  Vendor & Product Identification:
    Manufacturer: IPS
    Model: 8217
    Serial Number: ...
    Made in: week 35 of 2019
  Basic Display Parameters & Features:
    Analog display
    Signal Level Standard: 0.700 : 0.300 : 1.000 V p-p
    Blank level equals black level
    Image size is variable
    Gamma: 2.20
    DPMS levels: Standby Suspend Off
    RGB color display
    First detailed timing is the preferred timing
  Color Characteristics:
    Red  : 0.6523, 0.3300
    Green: 0.2216, 0.6806
    Blue : 0.1484, 0.0537
    White: 0.3095, 0.3300
  Established Timings I & II:
    IBM     :   720x400    70.081663 Hz   9:5     31.467 kHz     28.320000 MHz
    DMT 0x04:   640x480    59.940476 Hz   4:3     31.469 kHz     25.175000 MHz
    DMT 0x05:   640x480    72.808802 Hz   4:3     37.861 kHz     31.500000 MHz
    DMT 0x06:   640x480    75.000000 Hz   4:3     37.500 kHz     31.500000 MHz
    DMT 0x08:   800x600    56.250000 Hz   4:3     35.156 kHz     36.000000 MHz
    DMT 0x09:   800x600    60.316541 Hz   4:3     37.879 kHz     40.000000 MHz
    DMT 0x0a:   800x600    72.187572 Hz   4:3     48.077 kHz     50.000000 MHz
    DMT 0x0b:   800x600    75.000000 Hz   4:3     46.875 kHz     49.500000 MHz
    DMT 0x10:  1024x768    60.003840 Hz   4:3     48.363 kHz     65.000000 MHz
    DMT 0x11:  1024x768    70.069359 Hz   4:3     56.476 kHz     75.000000 MHz
    DMT 0x12:  1024x768    75.028582 Hz   4:3     60.023 kHz     78.750000 MHz
    DMT 0x24:  1280x1024   75.024675 Hz   5:4     79.976 kHz    135.000000 MHz
  Standard Timings:
    DMT 0x52:  1920x1080   60.000000 Hz  16:9     67.500 kHz    148.500000 MHz
    DMT 0x3a:  1680x1050   59.954250 Hz  16:10    65.290 kHz    146.250000 MHz
    DMT 0x2f:  1440x900    59.887445 Hz  16:10    55.935 kHz    106.500000 MHz
    DMT 0x23:  1280x1024   60.019740 Hz   5:4     63.981 kHz    108.000000 MHz
    GTF     :  1280x1024   69.999805 Hz   5:4     74.620 kHz    128.943000 MHz
    DMT 0x1c:  1280x800    59.810326 Hz  16:10    49.702 kHz     83.500000 MHz
    DMT 0x20:  1280x960    60.000000 Hz   4:3     60.000 kHz    108.000000 MHz
  Detailed Timing Descriptors:
    DTD 1:  1920x1080   60.000000 Hz  16:9     67.500 kHz    148.500000 MHz (470 mm x 280 mm)
                 Hfront   88 Hsync  44 Hback  148 Hpol N
                 Vfront    4 Vsync   5 Vback   36 Vpol P
    DTD 2:  1360x768    60.015162 Hz  85:48    47.712 kHz     85.500000 MHz (304 mm x 228 mm)
                 Hfront   64 Hsync 112 Hback  256 Hpol P
                 Vfront    3 Vsync   6 Vback   18 Vpol P
    DTD 3:  1920x1080   74.972503 Hz  16:9     83.894 kHz    174.500000 MHz (470 mm x 280 mm)
                 Hfront   48 Hsync  44 Hback   68 Hpol P
                 Vfront    4 Vsync   5 Vback   30 Vpol P
    Display Product Name: 'COOLGEN'
Checksum: 0x0b

----------------

Block 1, Unknown EDID Extension Block 0x00:
  00 ff ff ff ff ff ff 00 26 13 19 20 01 00 00 00 '........&.. ....'
  23 1d 01 03 00 00 00 78 ea 2d 36 a7 54 38 ae 26 '#......x.-6.T8.&'
  0d 4f 54 af cf 00 d1 c0 b3 00 95 00 81 80 81 8a '.OT.............'
  81 00 81 40 01 01 02 3a 80 18 71 38 2d 40 58 2c '...@...:..q8-@X,'
  45 00 d6 18 11 00 00 1c 66 21 50 b0 51 00 1b 30 'E.......f!P.Q..0'
  40 70 36 00 30 e4 10 00 00 1e 2a 44 80 a0 70 38 '@p6.0.....*D..p8'
  27 40 30 2c 45 00 d6 18 11 00 00 1e 00 00 00 fc ''@0,E...........'
  00 43 4f 4f 4c 47 45 4e 0a 20 20 20 20 20 00 0b '.COOLGEN.     ..'
Checksum: 0x0b

----------------

Warnings:

Block 0, Base EDID:
  Detailed Timing Descriptor #1: DTD is similar but not identical to VIC 16.

Failures:

Block 0, Base EDID:
  Missing Display Range Limits Descriptor.
Block 1, Base EDID:
  Unknown Extension Block.
EDID:
  Base EDID: The DTD max image size is 470x280mm, but the display size is not specified anywhere.
  Base EDID: EDID specified 0 extension block(s), but found 1 extension block(s).

EDID conformity: FAIL
