edid-decode (hex):

00 ff ff ff ff ff ff 00 1a b3 90 08 00 00 00 00
21 1b 01 03 80 3c 22 78 2a 55 a5 a7 56 52 9c 26
11 50 54 a5 4b 00 81 c0 81 80 95 00 a9 c0 b3 00
01 01 01 01 01 01 02 3a 80 18 71 38 2d 40 58 2c
45 00 56 50 21 00 00 1e 00 00 00 fd 00 38 4c 1e
52 11 00 0a 20 20 20 20 20 20 00 00 00 fc 00 42
32 37 54 2d 37 20 50 72 6f 0a 20 20 00 00 00 ff
00 59 56 41 56 30 32 34 38 34 36 0a 20 20 00 13

----------------

Block 0, Base EDID:
  EDID Structure Version & Revision: 1.3
  Vendor & Product Identification:
    Manufacturer: FUS
    Model: 2192
    Made in: week 33 of 2017
  Basic Display Parameters & Features:
    Digital display
    Maximum image size: 60 cm x 34 cm
    Gamma: 2.20
    DPMS levels: Off
    RGB color display
    First detailed timing is the preferred timing
  Color Characteristics:
    Red  : 0.6533, 0.3369
    Green: 0.3212, 0.6103
    Blue : 0.1503, 0.0683
    White: 0.3134, 0.3291
  Established Timings I & II:
    IBM     :   720x400    70.081663 Hz   9:5     31.467 kHz     28.320000 MHz
    DMT 0x04:   640x480    59.940476 Hz   4:3     31.469 kHz     25.175000 MHz
    DMT 0x06:   640x480    75.000000 Hz   4:3     37.500 kHz     31.500000 MHz
    DMT 0x09:   800x600    60.316541 Hz   4:3     37.879 kHz     40.000000 MHz
    DMT 0x0b:   800x600    75.000000 Hz   4:3     46.875 kHz     49.500000 MHz
    DMT 0x10:  1024x768    60.003840 Hz   4:3     48.363 kHz     65.000000 MHz
    DMT 0x12:  1024x768    75.028582 Hz   4:3     60.023 kHz     78.750000 MHz
    DMT 0x24:  1280x1024   75.024675 Hz   5:4     79.976 kHz    135.000000 MHz
  Standard Timings:
    DMT 0x55:  1280x720    60.000000 Hz  16:9     45.000 kHz     74.250000 MHz
    DMT 0x23:  1280x1024   60.019740 Hz   5:4     63.981 kHz    108.000000 MHz
    DMT 0x2f:  1440x900    59.887445 Hz  16:10    55.935 kHz    106.500000 MHz
    DMT 0x53:  1600x900    60.000000 Hz  16:9     60.000 kHz    108.000000 MHz (RB)
    DMT 0x3a:  1680x1050   59.954250 Hz  16:10    65.290 kHz    146.250000 MHz
  Detailed Timing Descriptors:
    DTD 1:  1920x1080   60.000000 Hz  16:9     67.500 kHz    148.500000 MHz (598 mm x 336 mm)
                 Hfront   88 Hsync  44 Hback  148 Hpol P
                 Vfront    4 Vsync   5 Vback   36 Vpol P
    Display Range Limits:
      Monitor ranges (GTF): 56-76 Hz V, 30-82 kHz H, max dotclock 170 MHz
    Display Product Name: 'B27T-7 Pro'
    Display Product Serial Number: ...
Checksum: 0x13

----------------

EDID conformity: PASS
