
EDID (hex):
00ffffffffffff0026cd5153339f9800
080e010381291f78efe595a5584c9726
1e50542fce00a940818f614061594540
455931403159483f403062b0324040c0
130098321100001e000000fd00325518
5010000a202020202020000000fc0050
4c483531300a202020202020000000ff
000a20202020202020202020202000f4

Extracted contents:
header:          00 ff ff ff ff ff ff 00
serial number:   26 cd 51 53 33 9f 98 00 08 0e
version:         01 03
basic params:    81 29 1f 78 ef
chroma info:     e5 95 a5 58 4c 97 26 1e 50 54
established:     2f ce 00
standard:        a9 40 81 8f 61 40 61 59 45 40 45 59 31 40 31 59
descriptor 1:    48 3f 40 30 62 b0 32 40 40 c0 13 00 98 32 11 00 00 1e
descriptor 2:    00 00 00 fd 00 32 55 18 50 10 00 0a 20 20 20 20 20 20
descriptor 3:    00 00 00 fc 00 50 4c 48 35 31 30 0a 20 20 20 20 20 20
descriptor 4:    00 00 00 ff 00 0a 20 20 20 20 20 20 20 20 20 20 20 20
extensions:      00
checksum:        f4

EDID version: 1.3
Manufacturer: IVM Model 5351 Serial Number --
Digital display
DFP 1.x compatible TMDS
Maximum image size: 41 cm x 31 cm
Gamma: 2.20
DPMS levels: Standby Suspend Off
RGB color display
Default (sRGB) color space is primary color space
First detailed timing is preferred timing
Supports GTF timings within operating range
Display x,y Chromaticity:
  Red:   0.6474, 0.3457
  Green: 0.2978, 0.5908
  Blue:  0.1503, 0.1181
  White: 0.3134, 0.3291
Established timings supported:
  640x480@60Hz 4:3 HorFreq: 31469 Hz Clock: 25.175 MHz
  640x480@72Hz 4:3 HorFreq: 37900 Hz Clock: 31.500 MHz
  640x480@75Hz 4:3 HorFreq: 37500 Hz Clock: 31.500 MHz
  800x600@56Hz 4:3 HorFreq: 35200 Hz Clock: 36.000 MHz
  800x600@60Hz 4:3 HorFreq: 37900 Hz Clock: 40.000 MHz
  800x600@72Hz 4:3 HorFreq: 48100 Hz Clock: 50.000 MHz
  800x600@75Hz 4:3 HorFreq: 46900 Hz Clock: 49.500 MHz
  1024x768@60Hz 4:3 HorFreq: 48400 Hz Clock: 65.000 MHz
  1024x768@70Hz 4:3 HorFreq: 56500 Hz Clock: 75.000 MHz
  1024x768@75Hz 4:3 HorFreq: 60000 Hz Clock: 78.750 MHz
Standard timings supported:
  1600x1200@60Hz 4:3 HorFreq: 75000 Hz Clock: 162.000 MHz
  1280x1024@75Hz 5:4 HorFreq: 80000 Hz Clock: 135.000 MHz
  1024x768@60Hz 4:3 HorFreq: 48400 Hz Clock: 65.000 MHz
  1024x768@85Hz 4:3 HorFreq: 68700 Hz Clock: 94.500 MHz
  800x600@60Hz 4:3 HorFreq: 37900 Hz Clock: 40.000 MHz
  800x600@85Hz 4:3 HorFreq: 53700 Hz Clock: 56.250 MHz
  640x480@60Hz 4:3 HorFreq: 31469 Hz Clock: 25.175 MHz
  640x480@85Hz 4:3 HorFreq: 43300 Hz Clock: 36.000 MHz
Detailed mode: Clock 162.000 MHz, 408 mm x 306 mm
               1600 1664 1856 2160 hborder 0
               1200 1201 1204 1250 vborder 0
               +hsync +vsync 
               VertFreq: 60 Hz, HorFreq: 75000 Hz
Monitor ranges (GTF): 50-85Hz V, 24-80kHz H, max dotclock 160MHz
Monitor name: PLH510
Serial number: 
-- 0xf4 (valid)
EDID block does NOT conform to EDID 1.3!
	sRGB is signaled, but the chromaticities do not match
One or more of the timings is out of range of the Monitor Ranges:
  Vertical Freq: 56 - 85 Hz
  Horizontal Freq: 31469 - 80000 Hz
  Maximum Clock: 162.000 MHz
EDID block does not conform at all!
	Bad year of manufacture


