edid-decode (hex):

00 ff ff ff ff ff ff 00 30 e4 ee 02 00 00 00 00
00 14 01 04 90 1f 11 78 02 88 45 95 5a 56 8d 28
23 50 54 00 00 00 01 01 01 01 01 01 01 01 01 01
01 01 01 01 01 01 12 1b 56 68 50 00 12 30 30 20
35 00 35 ae 10 00 00 18 0c 12 56 68 50 00 12 30
30 20 35 00 35 ae 10 00 00 18 00 00 00 00 00 00
00 00 00 00 00 00 00 00 00 00 00 00 00 00 00 02
00 0c 4c ff 0a 3c 64 15 11 1d 64 00 00 00 00 5c

----------------

Block 0, Base EDID:
  EDID Structure Version & Revision: 1.4
  Vendor & Product Identification:
    Manufacturer: LGD
    Model: 750
    Made in: 2010
  Basic Display Parameters & Features:
    Digital display
    Bits per primary color channel: 6
    Digital interface is not defined
    Maximum image size: 31 cm x 17 cm
    Gamma: 2.20
    Supported color formats: RGB 4:4:4
    First detailed timing includes the native pixel format and preferred refresh rate
  Color Characteristics:
    Red  : 0.5839, 0.3515
    Green: 0.3378, 0.5507
    Blue : 0.1572, 0.1367
    White: 0.3134, 0.3291
  Established Timings I & II: none
  Standard Timings: none
  Detailed Timing Descriptors:
    DTD 1:  1366x768    59.978190 Hz 683:384   47.143 kHz     69.300000 MHz (309 mm x 174 mm)
                 Hfront   48 Hsync  32 Hback   24 Hpol N
                 Vfront    3 Vsync   5 Vback   10 Vpol N
    DTD 2:  1366x768    39.985460 Hz 683:384   31.429 kHz     46.200000 MHz (309 mm x 174 mm)
                 Hfront   48 Hsync  32 Hback   24 Hpol N
                 Vfront    3 Vsync   5 Vback   10 Vpol N
    Empty Descriptor
    Manufacturer-Specified Display Descriptor (0x02): 00 02 00 0c 4c ff 0a 3c 64 15 11 1d 64 00 00 00 '....L..<d...d...'
Checksum: 0x5c

----------------

Failures:

Block 0, Base EDID:
  Empty Descriptor: Use Dummy Descriptor instead of all zeroes.
  Missing Display Product Name.

EDID conformity: FAIL
