
EDID (hex):
00ffffffffffff00320c440100000000
00120103902115780aee809959518c28
25505400000001010101010101010101
010101010101de21a07050841f302020
56004bcf1000001b0000000000000000
00000000000000000000000000fe004c
475068696c6970734c43440a000000fe
004c503135345750312d544c45310044

Extracted contents:
header:          00 ff ff ff ff ff ff 00
serial number:   32 0c 44 01 00 00 00 00 00 12
version:         01 03
basic params:    90 21 15 78 0a
chroma info:     ee 80 99 59 51 8c 28 25 50 54
established:     00 00 00
standard:        01 01 01 01 01 01 01 01 01 01 01 01 01 01 01 01
descriptor 1:    de 21 a0 70 50 84 1f 30 20 20 56 00 4b cf 10 00 00 1b
descriptor 2:    00 00 00 00 00 00 00 00 00 00 00 00 00 00 00 00 00 00
descriptor 3:    00 00 00 fe 00 4c 47 50 68 69 6c 69 70 73 4c 43 44 0a
descriptor 4:    00 00 00 fe 00 4c 50 31 35 34 57 50 31 2d 54 4c 45 31
extensions:      00
checksum:        44

EDID version: 1.3
Manufacturer: LPL Model 144 Serial Number --
Made in year 2008
Digital display
Maximum image size: 33 cm x 21 cm
Gamma: 2.20
RGB color display
First detailed timing is preferred timing
Display x,y Chromaticity:
  Red:   0.6005, 0.3496
  Green: 0.3193, 0.5488
  Blue:  0.1582, 0.1445
  White: 0.3125, 0.3281
Established timings supported:
Standard timings supported:
Detailed mode: Clock 86.700 MHz, 331 mm x 207 mm
               1440 1472 1504 1552 hborder 0
                900  905  911  931 vborder 0
               +hsync -vsync 
               VertFreq: 60 Hz, HorFreq: 55863 Hz
Manufacturer-specified data, tag 0
ASCII string: LGPhilipsLCD
ASCII string: LP154WP1-TLE1
Checksum: 0x44 (valid)
EDID block does NOT conform to EDID 1.3!
	Digital display field contains garbage: 10
	Missing name descriptor
	Missing monitor ranges


