edid-decode (hex):

00 ff ff ff ff ff ff 00 50 6c 00 00 01 01 01 01
02 16 01 03 08 4c 2d 78 0a 0d c9 a0 57 47 98 27
12 48 4c 21 08 00 01 01 01 01 01 01 01 01 01 01
01 01 01 01 01 01 66 21 50 b0 51 00 1b 30 40 70
36 00 44 40 21 00 00 18 01 1d 00 72 51 d0 1e 20
6e 28 55 00 44 40 21 00 00 1e 00 00 00 fc 00 20
20 20 20 20 44 54 56 20 20 20 20 20 00 00 00 fd
00 32 55 0e 46 10 00 0a 20 20 20 20 20 20 00 36

----------------

Block 0, Base EDID:
  EDID Structure Version & Revision: 1.3
  Vendor & Product Identification:
    Manufacturer: TCL
    Model: 0
    Serial Number: ...
    Made in: week 2 of 2012
  Basic Display Parameters & Features:
    Analog display
    Input voltage level: 0.7/0.3 V
    Sync: Separate
    Maximum image size: 76 cm x 45 cm
    Gamma: 2.20
    RGB color display
    First detailed timing is the preferred timing
  Color Characteristics:
    Red  : 0.6250, 0.3398
    Green: 0.2802, 0.5947
    Blue : 0.1552, 0.0703
    White: 0.2832, 0.2978
  Established Timings I & II:
    DMT 0x04:   640x480    59.940 Hz   4:3    31.469 kHz  25.175 MHz
    DMT 0x09:   800x600    60.317 Hz   4:3    37.879 kHz  40.000 MHz
    DMT 0x10:  1024x768    60.004 Hz   4:3    48.363 kHz  65.000 MHz
  Standard Timings: none
  Detailed Timing Descriptors:
    DTD 1:  1360x768    60.015 Hz  85:48   47.712 kHz  85.500 MHz (580 mm x 320 mm)
                 Hfront   64 Hsync 112 Hback 256 Hpol N
                 Vfront    3 Vsync   6 Vback  18 Vpol N
    DTD 2:  1280x720    60.000 Hz  16:9    45.000 kHz  74.250 MHz (580 mm x 320 mm)
                 Hfront  110 Hsync  40 Hback 220 Hpol P
                 Vfront    5 Vsync   5 Vback  20 Vpol P
    Display Product Name: '     DTV     '
  Display Range Limits:
    Monitor ranges (GTF): 50-85 Hz V, 14-70 kHz H, max dotclock 160 MHz
Checksum: 0x36

----------------

Failures:

Block 0, Base EDID:
  Detailed Timing Descriptor #1: Mismatch of image size 580x320 mm vs display size 760x450 mm.
  Detailed Timing Descriptor #2: Mismatch of image size 580x320 mm vs display size 760x450 mm.
  Display Product Name: One or more trailing spaces.

EDID conformity: FAIL
