edid-decode (hex):

00 ff ff ff ff ff ff 00 04 72 7b 05 34 c2 40 80
04 1c 01 04 68 36 1e 78 ca 90 55 a7 55 53 a0 28
13 50 54 bf ef 80 71 4f 81 40 81 80 81 c0 81 00
95 00 b3 00 d1 c0 02 3a 80 18 71 38 2d 40 58 2c
45 00 20 2f 21 00 00 1e 00 00 00 fd 00 38 4c 1f
53 11 00 0a 20 20 20 20 20 20 00 00 00 fc 00 4b
41 32 35 31 51 0a 20 20 20 20 20 20 00 00 00 ff
00 54 38 53 53 41 30 30 31 38 35 33 32 0a 00 10

----------------

Block 0, Base EDID:
  EDID Structure Version & Revision: 1.4
  Vendor & Product Identification:
    Manufacturer: ACR
    Model: 1403
    Serial Number: ...
    Made in: week 4 of 2018
  Basic Display Parameters & Features:
    Analog display
    Input voltage level: 0.7/0.7 V
    Blank level equals black level
    Sync: Separate
    Maximum image size: 54 cm x 30 cm
    Gamma: 2.20
    DPMS levels: Standby Suspend
    RGB color display
    First detailed timing includes the native pixel format and preferred refresh rate
  Color Characteristics:
    Red  : 0.6542, 0.3330
    Green: 0.3242, 0.6250
    Blue : 0.1572, 0.0751
    White: 0.3134, 0.3291
  Established Timings I & II:
    IBM     :   720x400    70.082 Hz   9:5    31.467 kHz  28.320 MHz
    DMT 0x04:   640x480    59.940 Hz   4:3    31.469 kHz  25.175 MHz
    Apple   :   640x480    66.667 Hz   4:3    35.000 kHz  30.240 MHz
    DMT 0x05:   640x480    72.809 Hz   4:3    37.861 kHz  31.500 MHz
    DMT 0x06:   640x480    75.000 Hz   4:3    37.500 kHz  31.500 MHz
    DMT 0x08:   800x600    56.250 Hz   4:3    35.156 kHz  36.000 MHz
    DMT 0x09:   800x600    60.317 Hz   4:3    37.879 kHz  40.000 MHz
    DMT 0x0a:   800x600    72.188 Hz   4:3    48.077 kHz  50.000 MHz
    DMT 0x0b:   800x600    75.000 Hz   4:3    46.875 kHz  49.500 MHz
    Apple   :   832x624    74.551 Hz   4:3    49.726 kHz  57.284 MHz
    DMT 0x10:  1024x768    60.004 Hz   4:3    48.363 kHz  65.000 MHz
    DMT 0x11:  1024x768    70.069 Hz   4:3    56.476 kHz  75.000 MHz
    DMT 0x12:  1024x768    75.029 Hz   4:3    60.023 kHz  78.750 MHz
    DMT 0x24:  1280x1024   75.025 Hz   5:4    79.976 kHz 135.000 MHz
    Apple   :  1152x870    75.062 Hz 192:145  68.681 kHz 100.000 MHz
  Standard Timings:
    DMT 0x15:  1152x864    75.000 Hz   4:3    67.500 kHz 108.000 MHz
    DMT 0x20:  1280x960    60.000 Hz   4:3    60.000 kHz 108.000 MHz
    DMT 0x23:  1280x1024   60.020 Hz   5:4    63.981 kHz 108.000 MHz
    DMT 0x55:  1280x720    60.000 Hz  16:9    45.000 kHz  74.250 MHz
    DMT 0x1c:  1280x800    59.810 Hz  16:10   49.702 kHz  83.500 MHz
    DMT 0x2f:  1440x900    59.887 Hz  16:10   55.935 kHz 106.500 MHz
    DMT 0x3a:  1680x1050   59.954 Hz  16:10   65.290 kHz 146.250 MHz
    DMT 0x52:  1920x1080   60.000 Hz  16:9    67.500 kHz 148.500 MHz
  Detailed Timing Descriptors:
    DTD 1:  1920x1080   60.000 Hz  16:9    67.500 kHz 148.500 MHz (544 mm x 303 mm)
                 Hfront   88 Hsync  44 Hback 148 Hpol P
                 Vfront    4 Vsync   5 Vback  36 Vpol P
  Display Range Limits:
    Monitor ranges (GTF): 56-76 Hz V, 31-83 kHz H, max dotclock 170 MHz
    Display Product Name: 'KA251Q'
    Display Product Serial Number: ...
Checksum: 0x10

----------------

Failures:

Block 0, Base EDID:
  Display Range Limits: GTF can't be combined with non-continuous frequencies.

EDID conformity: FAIL
