edid-decode (hex):

00 ff ff ff ff ff ff 00 26 cf 36 05 00 00 00 00
00 1d 01 04 95 1d 11 78 0a 85 b0 94 57 53 93 27
22 50 54 00 00 00 01 01 01 01 01 01 01 01 01 01
01 01 01 01 01 01 38 36 80 a0 70 38 20 40 18 30
3c 00 26 a5 10 00 00 18 5e 2b 80 a0 70 38 20 40
18 30 3c 00 26 a5 10 00 00 18 00 00 00 fe 00 52
4e 39 47 46 80 31 33 33 4e 57 46 34 00 00 00 00
00 00 41 31 16 00 10 00 00 0a 01 0a 20 20 00 b0

----------------

Block 0, Base EDID:
  EDID Structure Version & Revision: 1.4
  Vendor & Product Identification:
    Manufacturer: IVO
    Model: 1334
    Made in: 2019
  Basic Display Parameters & Features:
    Digital display
    Bits per primary color channel: 6
    DisplayPort interface
    Maximum image size: 29 cm x 17 cm
    Gamma: 2.20
    Supported color formats: RGB 4:4:4, YCrCb 4:4:4
    First detailed timing includes the native pixel format and preferred refresh rate
  Color Characteristics:
    Red  : 0.5800, 0.3398
    Green: 0.3251, 0.5751
    Blue : 0.1542, 0.1357
    White: 0.3125, 0.3281
  Established Timings I & II: none
  Standard Timings: none
  Detailed Timing Descriptors:
    DTD 1:  1920x1080   60.009685 Hz  16:9     66.731 kHz    138.800000 MHz (294 mm x 165 mm)
                 Hfront   24 Hsync  48 Hback   88 Hpol N
                 Vfront    3 Vsync  12 Vback   17 Vpol N
    DTD 2:  1920x1080   47.999101 Hz  16:9     53.375 kHz    111.020000 MHz (294 mm x 165 mm)
                 Hfront   24 Hsync  48 Hback   88 Hpol N
                 Vfront    3 Vsync  12 Vback   17 Vpol N
    Alphanumeric Data String: 'RN9GF'
    Manufacturer-Specified Display Descriptor (0x00): 00 00 00 00 41 31 16 00 10 00 00 0a 01 0a 20 20 '....A1........  '
Checksum: 0xb0

----------------

Failures:

Block 0, Base EDID:
  Alphanumeric Data String: Non-printable character.
  Missing Display Product Name.

EDID conformity: FAIL
