
EDID (hex):
00ffffffffffff0030e4840300000000
00160104902213780a01a59c595a9b26
18505400000001010101010101010101
010101010101d81d56f4500016302430
350058c21000001be51356f450001630
2430350058c21000001b000000000000
00000000000000000000000000000002
000c47ff0a3c6412222964000000007f

Extracted contents:
header:          00 ff ff ff ff ff ff 00
serial number:   30 e4 84 03 00 00 00 00 00 16
version:         01 04
basic params:    90 22 13 78 0a
chroma info:     01 a5 9c 59 5a 9b 26 18 50 54
established:     00 00 00
standard:        01 01 01 01 01 01 01 01 01 01 01 01 01 01 01 01
descriptor 1:    d8 1d 56 f4 50 00 16 30 24 30 35 00 58 c2 10 00 00 1b
descriptor 2:    e5 13 56 f4 50 00 16 30 24 30 35 00 58 c2 10 00 00 1b
descriptor 3:    00 00 00 00 00 00 00 00 00 00 00 00 00 00 00 00 00 00
descriptor 4:    00 00 00 02 00 0c 47 ff 0a 3c 64 12 22 29 64 00 00 00
extensions:      00
checksum:        7f

EDID version: 1.4
Manufacturer: LGD Model 384 Serial Number --
Made in year 2012
Digital display
6 bits per primary color channel
Digital interface is not defined
Maximum image size: 34 cm x 19 cm
Gamma: 2.20
Supported color formats: RGB 4:4:4, YCrCb 4:4:4
First detailed timing includes the native pixel format and preferred refresh rate
Display x,y Chromaticity:
  Red:   0.6093, 0.3476
  Green: 0.3515, 0.6064
  Blue:  0.1503, 0.0957
  White: 0.3134, 0.3291
Established timings supported:
Standard timings supported:
Detailed mode: Clock 76.400 MHz, 344 mm x 194 mm
               1366 1402 1450 1610 hborder 0
                768  771  776  790 vborder 0
               +hsync -vsync 
               VertFreq: 60 Hz, HorFreq: 47453 Hz
Detailed mode: Clock 50.930 MHz, 344 mm x 194 mm
               1366 1402 1450 1610 hborder 0
                768  771  776  790 vborder 0
               +hsync -vsync 
               VertFreq: 40 Hz, HorFreq: 31633 Hz
Manufacturer-specified data, tag 0
Manufacturer-specified data, tag 2
Checksum: 0x7f (valid)
EDID block does NOT conform to EDID 1.4!
	Missing name descriptor
	Missing monitor ranges
