
EDID (hex):
00ffffffffffff0030ae930001000000
13160104a5301b780a014ca755469924
12484b2108008180810081c0a9c00101
010101010101023a801871382d40582c
4500fd1e1100001e00000010000a2020
20202020202020202020000000fd0039
3e1e5a14350055502100001a000000fc
004c454e2d453932492d430a2020003f

Extracted contents:
header:          00 ff ff ff ff ff ff 00
serial number:   30 ae 93 00 01 00 00 00 13 16
version:         01 04
basic params:    a5 30 1b 78 0a
chroma info:     01 4c a7 55 46 99 24 12 48 4b
established:     21 08 00
standard:        81 80 81 00 81 c0 a9 c0 01 01 01 01 01 01 01 01
descriptor 1:    02 3a 80 18 71 38 2d 40 58 2c 45 00 fd 1e 11 00 00 1e
descriptor 2:    00 00 00 10 00 0a 20 20 20 20 20 20 20 20 20 20 20 20
descriptor 3:    00 00 00 fd 00 39 3e 1e 5a 14 35 00 55 50 21 00 00 1a
descriptor 4:    00 00 00 fc 00 4c 45 4e 2d 45 39 32 49 2d 43 0a 20 20
extensions:      00
checksum:        3f

EDID version: 1.4
Manufacturer: LEN Model 93 Serial Number --
Made in week 19 of 2012
Digital display
8 bits per primary color channel
DisplayPort interface
Maximum image size: 48 cm x 27 cm
Gamma: 2.20
Supported color formats: RGB 4:4:4, YCrCb 4:4:4
First detailed timing includes the native pixel format and preferred refresh rate
Display x,y Chromaticity:
  Red:   0.6523, 0.3320
  Green: 0.2734, 0.5986
  Blue:  0.1416, 0.0703
  White: 0.2841, 0.2929
Established timings supported:
  640x480@60Hz 4:3 HorFreq: 31469 Hz Clock: 25.175 MHz
  800x600@60Hz 4:3 HorFreq: 37900 Hz Clock: 40.000 MHz
  1024x768@60Hz 4:3 HorFreq: 48400 Hz Clock: 65.000 MHz
Standard timings supported:
  1280x1024@60Hz 5:4 HorFreq: 64000 Hz Clock: 108.000 MHz
  1280x800@60Hz 16:10
  1280x720@60Hz 16:9
  1600x900@60Hz 16:9
Detailed mode: Clock 148.500 MHz, 509 mm x 286 mm
               1920 2008 2052 2200 hborder 0
               1080 1084 1089 1125 vborder 0
               +hsync +vsync 
               VertFreq: 60 Hz, HorFreq: 67500 Hz
Dummy block
Monitor ranges (invalid): 57-62Hz V, 30-90kHz H, max dotclock 200MHz
Monitor name: LEN-E92I-C
Checksum: 0x3f (valid)
EDID block does not conform at all!
	Detailed blocks filled with garbage
	Dummy block filled with garbage
	Range descriptor contains garbage
