
EDID (hex):
00ffffffffffff004c2e750b00030100
00130103801009780a9203a256489925
144a4d21080001010101010101010101
010101010101011d007251d01e206e28
550010090000001e011d8018711c1620
582c250010090000009e000000fc0053
414e594f204c43440a202020000000fd
003b3d0f2e08000a202020202020010d
02031a71478405020306070126090707
15073c66030c002000808c0ad08a20e0
2d10103e96000403000000188c0ad08a
20e02d10103e96001009000000188c0a
a01451f01600267c4300040300000098
8c0aa01451f01600267c430010090000
0098d60980a020e02d101060a2000403
000000180000000000000000000000a8

Extracted contents:
header:          00 ff ff ff ff ff ff 00
serial number:   4c 2e 75 0b 00 03 01 00 00 13
version:         01 03
basic params:    80 10 09 78 0a
chroma info:     92 03 a2 56 48 99 25 14 4a 4d
established:     21 08 00
standard:        01 01 01 01 01 01 01 01 01 01 01 01 01 01 01 01
descriptor 1:    01 1d 00 72 51 d0 1e 20 6e 28 55 00 10 09 00 00 00 1e
descriptor 2:    01 1d 80 18 71 1c 16 20 58 2c 25 00 10 09 00 00 00 9e
descriptor 3:    00 00 00 fc 00 53 41 4e 59 4f 20 4c 43 44 0a 20 20 20
descriptor 4:    00 00 00 fd 00 3b 3d 0f 2e 08 00 0a 20 20 20 20 20 20
extensions:      01
checksum:        0d

EDID version: 1.3
Manufacturer: SAN Model b75 Serial Number --
Made in year 2009
Digital display
Maximum image size: 16 cm x 9 cm
Gamma: 2.20
RGB color display
First detailed timing is preferred timing
Display x,y Chromaticity:
  Red:   0.6347, 0.3369
  Green: 0.2812, 0.5996
  Blue:  0.1445, 0.0781
  White: 0.2890, 0.3037
Established timings supported:
  640x480@60Hz 4:3 HorFreq: 31469 Hz Clock: 25.175 MHz
  800x600@60Hz 4:3 HorFreq: 37900 Hz Clock: 40.000 MHz
  1024x768@60Hz 4:3 HorFreq: 48400 Hz Clock: 65.000 MHz
Standard timings supported:
Detailed mode: Clock 74.250 MHz, 16 mm x 9 mm
               1280 1390 1430 1650 hborder 0
                720  725  730  750 vborder 0
               +hsync +vsync 
               VertFreq: 60 Hz, HorFreq: 45000 Hz
Detailed mode: Clock 74.250 MHz, 16 mm x 9 mm
               1920 2008 2052 2200 hborder 0
                540  542  547  562 vborder 0
               +hsync +vsync interlaced 
               VertFreq: 60 Hz, HorFreq: 33750 Hz
Monitor name: SANYO LCD
Monitor ranges (GTF): 59-61Hz V, 15-46kHz H, max dotclock 80MHz
Has 1 extension blocks
Checksum: 0xd (valid)

CTA extension block
Extension version: 3
22 bytes of CTA data
  Video data block
    VIC   4 1280x720@60Hz 16:9 (native) HorFreq: 45000 Hz Clock: 74.250 MHz
    VIC   5 1920x1080i@60Hz 16:9  HorFreq: 33750 Hz Clock: 74.250 MHz
    VIC   2 720x480@60Hz 4:3  HorFreq: 31469 Hz Clock: 27.000 MHz
    VIC   3 720x480@60Hz 16:9  HorFreq: 31469 Hz Clock: 27.000 MHz
    VIC   6 1440x480i@60Hz 4:3  HorFreq: 15734 Hz Clock: 27.000 MHz
    VIC   7 1440x480i@60Hz 16:9  HorFreq: 15734 Hz Clock: 27.000 MHz
    VIC   1 640x480@60Hz 4:3  HorFreq: 31469 Hz Clock: 25.175 MHz
  Audio data block
    Linear PCM, max channels 2
      Supported sample rates (kHz): 48 44.1 32
      Supported sample sizes (bits): 24 20 16
    AC-3, max channels 6
      Supported sample rates (kHz): 48 44.1 32
      Maximum bit rate: 480 kHz
  Vendor-specific data block, OUI 000c03 (HDMI)
    Source physical address 2.0.0.0
    Supports_AI
Basic audio support
Supports YCbCr 4:4:4
Supports YCbCr 4:2:2
1 native detailed modes
Detailed mode: Clock 27.000 MHz, 4 mm x 3 mm
                720  736  798  858 hborder 0
                480  489  495  525 vborder 0
               -hsync -vsync 
               VertFreq: 59 Hz, HorFreq: 31468 Hz
Detailed mode: Clock 27.000 MHz, 16 mm x 9 mm
                720  736  798  858 hborder 0
                480  489  495  525 vborder 0
               -hsync -vsync 
               VertFreq: 59 Hz, HorFreq: 31468 Hz
Detailed mode: Clock 27.000 MHz, 4 mm x 3 mm
               1440 1478 1602 1716 hborder 0
                240  244  247  262 vborder 0
               -hsync -vsync interlaced 
               VertFreq: 60 Hz, HorFreq: 15734 Hz
Detailed mode: Clock 27.000 MHz, 16 mm x 9 mm
               1440 1478 1602 1716 hborder 0
                240  244  247  262 vborder 0
               -hsync -vsync interlaced 
               VertFreq: 60 Hz, HorFreq: 15734 Hz
Detailed mode: Clock 25.180 MHz, 4 mm x 3 mm
                640  656  752  800 hborder 0
                480  490  492  525 vborder 0
               -hsync -vsync 
               VertFreq: 59 Hz, HorFreq: 31475 Hz
Checksum: 0xa8 (valid)

One or more of the timings is out of range of the Monitor Ranges:
  Vertical Freq: 59 - 60 Hz
  Horizontal Freq: 15734 - 48400 Hz
  Maximum Clock: 74.250 MHz
