edid-decode (hex):

00 ff ff ff ff ff ff 00 30 64 80 e9 04 00 00 00
1f 16 01 03 68 28 19 78 2f 57 0e a3 59 49 97 24
14 4f 54 a5 4f 00 81 80 95 00 01 01 01 01 01 01
01 01 01 01 01 01 9a 29 a0 d0 51 84 22 30 50 98
36 00 98 ff 10 00 00 1c 00 00 00 ff 00 41 35 39
43 38 42 41 30 30 30 30 30 34 00 00 00 fd 00 38
4c 1e 52 0e 00 0a 20 20 20 20 20 20 00 00 00 fc
00 4c 43 44 2d 4d 4f 4e 49 54 4f 52 0a 20 00 a8

00 ff ff ff ff ff ff 00 30 64 80 e9 04 00 00 00
1f 16 01 03 68 28 19 78 2f 57 0e a3 59 49 97 24
14 4f 54 a5 4f 00 81 80 95 00 01 01 01 01 01 01
01 01 01 01 01 01 9a 29 a0 d0 51 84 22 30 50 98
36 00 98 ff 10 00 00 1c 00 00 00 ff 00 41 35 39
43 38 42 41 30 30 30 30 30 34 00 00 00 fd 00 38
4c 1e 52 0e 00 0a 20 20 20 20 20 20 00 00 00 fc
00 4c 43 44 2d 4d 4f 4e 49 54 4f 52 0a 20 00 a8

----------------

Block 0, Base EDID:
  EDID Structure Version & Revision: 1.3
  Vendor & Product Identification:
    Manufacturer: LCD
    Model: 59776
    Serial Number: ...
    Made in: week 31 of 2012
  Basic Display Parameters & Features:
    Analog display
    Signal Level Standard: 0.700 : 0.000 : 0.700 V p-p
    Blank level equals black level
    Sync: Separate
    Maximum image size: 40 cm x 25 cm
    Gamma: 2.20
    DPMS levels: Off
    RGB color display
    Default (sRGB) color space is primary color space
    First detailed timing is the preferred timing
    Supports GTF timings within operating range
  Color Characteristics:
    Red  : 0.6376, 0.3486
    Green: 0.2861, 0.5927
    Blue : 0.1406, 0.0781
    White: 0.3115, 0.3300
  Established Timings I & II:
    IBM     :   720x400    70.081663 Hz   9:5     31.467 kHz     28.320000 MHz
    DMT 0x04:   640x480    59.940476 Hz   4:3     31.469 kHz     25.175000 MHz
    DMT 0x06:   640x480    75.000000 Hz   4:3     37.500 kHz     31.500000 MHz
    DMT 0x09:   800x600    60.316541 Hz   4:3     37.879 kHz     40.000000 MHz
    DMT 0x0b:   800x600    75.000000 Hz   4:3     46.875 kHz     49.500000 MHz
    DMT 0x10:  1024x768    60.003840 Hz   4:3     48.363 kHz     65.000000 MHz
    DMT 0x11:  1024x768    70.069359 Hz   4:3     56.476 kHz     75.000000 MHz
    DMT 0x12:  1024x768    75.028582 Hz   4:3     60.023 kHz     78.750000 MHz
    DMT 0x24:  1280x1024   75.024675 Hz   5:4     79.976 kHz    135.000000 MHz
  Standard Timings:
    DMT 0x23:  1280x1024   60.019740 Hz   5:4     63.981 kHz    108.000000 MHz
    DMT 0x2f:  1440x900    59.887445 Hz  16:10    55.935 kHz    106.500000 MHz
  Detailed Timing Descriptors:
    DTD 1:  1440x900    59.887445 Hz  16:10    55.935 kHz    106.500000 MHz (408 mm x 255 mm)
                 Hfront   80 Hsync 152 Hback  232 Hpol N
                 Vfront    3 Vsync   6 Vback   25 Vpol P
    Display Product Serial Number: ...
    Display Range Limits:
      Monitor ranges (GTF): 56-76 Hz V, 30-82 kHz H, max dotclock 140 MHz
    Display Product Name: 'LCD-MONITOR'
Checksum: 0xa8

----------------

Block 1, Unknown EDID Extension Block 0x00:
  00 ff ff ff ff ff ff 00 30 64 80 e9 04 00 00 00 '........0d......'
  1f 16 01 03 68 28 19 78 2f 57 0e a3 59 49 97 24 '....h(.x/W..YI.$'
  14 4f 54 a5 4f 00 81 80 95 00 01 01 01 01 01 01 '.OT.O...........'
  01 01 01 01 01 01 9a 29 a0 d0 51 84 22 30 50 98 '.......)..Q."0P.'
  36 00 98 ff 10 00 00 1c 00 00 00 ff 00 41 35 39 '6............A59'
  43 38 42 41 30 30 30 30 30 34 00 00 00 fd 00 38 'C8BA000004.....8'
  4c 1e 52 0e 00 0a 20 20 20 20 20 20 00 00 00 fc 'L.R...      ....'
  00 4c 43 44 2d 4d 4f 4e 49 54 4f 52 0a 20 00 a8 '.LCD-MONITOR. ..'
Checksum: 0xa8

----------------

Failures:

Block 0, Base EDID:
  Basic Display Parameters & Features: sRGB is signaled, but the chromaticities do not match.
Block 1, Base EDID:
  Unknown Extension Block.
EDID:
  Base EDID: EDID specified 0 extension block(s), but found 1 extension block(s).

EDID conformity: FAIL
