
EDID (hex):
00ffffffffffff00306480e97f050000
27170103682819782f570ea359499724
144f54a54f0081809500010101010101
0101010101019a29a0d0518422305098
360098ff1000001c000000ff00433139
44394241303031343037000000fd0038
4c1e520e000a202020202020000000fc
004c43442d4d4f4e49544f520a200017

Extracted contents:
header:          00 ff ff ff ff ff ff 00
serial number:   30 64 80 e9 7f 05 00 00 27 17
version:         01 03
basic params:    68 28 19 78 2f
chroma info:     57 0e a3 59 49 97 24 14 4f 54
established:     a5 4f 00
standard:        81 80 95 00 01 01 01 01 01 01 01 01 01 01 01 01
descriptor 1:    9a 29 a0 d0 51 84 22 30 50 98 36 00 98 ff 10 00 00 1c
descriptor 2:    00 00 00 ff 00 43 31 39 44 39 42 41 30 30 31 34 30 37
descriptor 3:    00 00 00 fd 00 38 4c 1e 52 0e 00 0a 20 20 20 20 20 20
descriptor 4:    00 00 00 fc 00 4c 43 44 2d 4d 4f 4e 49 54 4f 52 0a 20
extensions:      00
checksum:        17

EDID version: 1.3
Manufacturer: LCD Model e980 Serial Number --
Made in week 39 of 2013
Analog display, Input voltage level: 0.7/0.7 V
Sync: Separate 
Maximum image size: 40 cm x 25 cm
Gamma: 2.20
DPMS levels: Off
RGB color display
Default (sRGB) color space is primary color space
First detailed timing is preferred timing
Supports GTF timings within operating range
Display x,y Chromaticity:
  Red:   0.6376, 0.3486
  Green: 0.2861, 0.5927
  Blue:  0.1406, 0.0781
  White: 0.3115, 0.3300
Established timings supported:
  720x400@70Hz 9:5 HorFreq: 31469 Hz Clock: 28.320 MHz
  640x480@60Hz 4:3 HorFreq: 31469 Hz Clock: 25.175 MHz
  640x480@75Hz 4:3 HorFreq: 37500 Hz Clock: 31.500 MHz
  800x600@60Hz 4:3 HorFreq: 37900 Hz Clock: 40.000 MHz
  800x600@75Hz 4:3 HorFreq: 46900 Hz Clock: 49.500 MHz
  1024x768@60Hz 4:3 HorFreq: 48400 Hz Clock: 65.000 MHz
  1024x768@70Hz 4:3 HorFreq: 56500 Hz Clock: 75.000 MHz
  1024x768@75Hz 4:3 HorFreq: 60000 Hz Clock: 78.750 MHz
  1280x1024@75Hz 5:4 HorFreq: 80000 Hz Clock: 135.000 MHz
Standard timings supported:
  1280x1024@60Hz 5:4 HorFreq: 64000 Hz Clock: 108.000 MHz
  1440x900@60Hz 16:10 HorFreq: 55500 Hz Clock: 88.750 MHz
Detailed mode: Clock 106.500 MHz, 408 mm x 255 mm
               1440 1520 1672 1904 hborder 0
                900  903  909  934 vborder 0
               -hsync +vsync 
               VertFreq: 59 Hz, HorFreq: 55934 Hz
Serial number: --
Monitor ranges (GTF): 56-76Hz V, 30-82kHz H, max dotclock 140MHz
Monitor name: LCD-MONITOR
Checksum: 0x17 (valid)
EDID block does NOT conform to EDID 1.3!
	sRGB is signaled, but the chromaticities do not match
