edid-decode (hex):

00 ff ff ff ff ff ff 00 06 10 8d 9c 01 01 01 01
00 11 01 03 80 34 20 78 0a c7 74 a3 57 4a 9d 25
11 50 54 00 00 10 01 01 01 01 01 01 01 01 01 01
01 01 01 01 01 01 f0 3c 80 a0 70 b0 2d 40 30 20
36 00 06 44 11 00 00 1e 00 00 00 01 00 06 10 30
11 01 00 00 00 00 00 00 0a 20 00 00 00 fe 00 4c
4d 32 34 30 57 55 32 2d 53 4c 42 31 00 00 00 fc
00 43 6f 6c 6f 72 20 4c 43 44 0a 20 20 20 00 45

----------------

Block 0, Base EDID:
  EDID Structure Version & Revision: 1.3
  Vendor & Product Identification:
    Manufacturer: APP
    Model: 40077
    Serial Number: ...
    Made in: 2007
  Basic Display Parameters & Features:
    Digital display
    Maximum image size: 52 cm x 32 cm
    Gamma: 2.20
    RGB color display
    First detailed timing is the preferred timing
  Color Characteristics:
    Red  : 0.6396, 0.3398
    Green: 0.2900, 0.6162
    Blue : 0.1455, 0.0693
    White: 0.3134, 0.3281
  Established Timings I & II:
  Standard Timings: none
  Detailed Timing Descriptors:
    DTD 1:  1920x1200   60.240964 Hz   8:5     75.000 kHz    156.000000 MHz (262 mm x 324 mm)
                 Hfront   48 Hsync  32 Hback   80 Hpol P
                 Vfront    3 Vsync   6 Vback   36 Vpol P
    Manufacturer-Specified Display Descriptor (0x01): 00 01 00 06 10 30 11 01 00 00 00 00 00 00 0a 20 '.....0......... '
    Alphanumeric Data String: 'LM240WU2-SLB1'
    Display Product Name: 'Color LCD'
Checksum: 0x45

----------------

Failures:

Block 0, Base EDID:
  Missing Display Range Limits Descriptor.

EDID conformity: FAIL
