
EDID (hex):
00ffffffffffff003669b03cc70c0000
321f0104b53c22783b1c95a75549a226
0f5054bfcf00d1c0714f81c081408180
9500b300010100fa0050a0a01f500a3c
350055502100001e695e00a0a0a02950
3020b80455502100001a000000fd0030
a5fafa41010a202020202020000000fc
004d5349204732374351340a202001f1
020320714d0102031112130f1d1e0e90
1f04230917078301000065030c001000
5aa000a0a0a046503020350055502100
001a6fc200a0a0a05550302035005550
2100001a5a8700a0a0a03b5030203500
55502100001a00000000000000000000
00000000000000000000000000000000
000000000000000000000000000000e3

Extracted contents:
header:          00 ff ff ff ff ff ff 00
serial number:   36 69 b0 3c c7 0c 00 00 32 1f
version:         01 04
basic params:    b5 3c 22 78 3b
chroma info:     1c 95 a7 55 49 a2 26 0f 50 54
established:     bf cf 00
standard:        d1 c0 71 4f 81 c0 81 40 81 80 95 00 b3 00 01 01
descriptor 1:    00 fa 00 50 a0 a0 1f 50 0a 3c 35 00 55 50 21 00 00 1e
descriptor 2:    69 5e 00 a0 a0 a0 29 50 30 20 b8 04 55 50 21 00 00 1a
descriptor 3:    00 00 00 fd 00 30 a5 fa fa 41 01 0a 20 20 20 20 20 20
descriptor 4:    00 00 00 fc 00 4d 53 49 20 47 32 37 43 51 34 0a 20 20
extensions:      01
checksum:        f1

EDID version: 1.4
Manufacturer: MSI Model 3cb0 Serial Number --
Made in week 50 of 2021
Digital display
10 bits per primary color channel
DisplayPort interface
Maximum image size: 60 cm x 34 cm
Gamma: 2.20
DPMS levels: Off
Supported color formats: RGB 4:4:4, YCrCb 4:4:4, YCrCb 4:2:2
First detailed timing includes the native pixel format and preferred refresh rate
Display is continuous frequency
Display x,y Chromaticity:
  Red:   0.6523, 0.3330
  Green: 0.2880, 0.6328
  Blue:  0.1503, 0.0595
  White: 0.3134, 0.3291
Established timings supported:
  720x400@70Hz 9:5 HorFreq: 31469 Hz Clock: 28.320 MHz
  640x480@60Hz 4:3 HorFreq: 31469 Hz Clock: 25.175 MHz
  640x480@67Hz 4:3 HorFreq: 35000 Hz Clock: 30.240 MHz
  640x480@72Hz 4:3 HorFreq: 37900 Hz Clock: 31.500 MHz
  640x480@75Hz 4:3 HorFreq: 37500 Hz Clock: 31.500 MHz
  800x600@56Hz 4:3 HorFreq: 35200 Hz Clock: 36.000 MHz
  800x600@60Hz 4:3 HorFreq: 37900 Hz Clock: 40.000 MHz
  800x600@72Hz 4:3 HorFreq: 48100 Hz Clock: 50.000 MHz
  800x600@75Hz 4:3 HorFreq: 46900 Hz Clock: 49.500 MHz
  1024x768@60Hz 4:3 HorFreq: 48400 Hz Clock: 65.000 MHz
  1024x768@70Hz 4:3 HorFreq: 56500 Hz Clock: 75.000 MHz
  1024x768@75Hz 4:3 HorFreq: 60000 Hz Clock: 78.750 MHz
  1280x1024@75Hz 5:4 HorFreq: 80000 Hz Clock: 135.000 MHz
Standard timings supported:
  1920x1080@60Hz 16:9
  1152x864@75Hz 4:3 HorFreq: 67500 Hz Clock: 108.000 MHz
  1280x720@60Hz 16:9
  1280x960@60Hz 4:3 HorFreq: 60000 Hz Clock: 108.000 MHz
  1280x1024@60Hz 5:4 HorFreq: 64000 Hz Clock: 108.000 MHz
  1440x900@60Hz 16:10 HorFreq: 55500 Hz Clock: 88.750 MHz
  1680x1050@60Hz 16:10 HorFreq: 64700 Hz Clock: 119.000 MHz
Detailed mode: Clock 640.000 MHz, 597 mm x 336 mm
               2560 2570 2630 2640 hborder 0
               1440 1443 1448 1471 vborder 0
               +hsync +vsync 
               VertFreq: 164 Hz, HorFreq: 242424 Hz
Detailed mode: Clock 241.690 MHz, 597 mm x 336 mm
               2560 2608 2640 2720 hborder 0
               1440 1467 1475 1481 vborder 0
               +hsync -vsync 
               VertFreq: 59 Hz, HorFreq: 88856 Hz
Monitor ranges (bare limits): 48-165Hz V, 250-250kHz H, max dotclock 650MHz
Monitor name: MSI G27CQ4
Has 1 extension blocks
Checksum: 0xf1 (valid)

CTA extension block
Extension version: 3
28 bytes of CTA data
  Video data block
    VIC   1 640x480@60Hz 4:3  HorFreq: 31469 Hz Clock: 25.175 MHz
    VIC   2 720x480@60Hz 4:3  HorFreq: 31469 Hz Clock: 27.000 MHz
    VIC   3 720x480@60Hz 16:9  HorFreq: 31469 Hz Clock: 27.000 MHz
    VIC  17 720x576@50Hz 4:3  HorFreq: 31250 Hz Clock: 27.000 MHz
    VIC  18 720x576@50Hz 16:9  HorFreq: 31250 Hz Clock: 27.000 MHz
    VIC  19 1280x720@50Hz 16:9  HorFreq: 37500 Hz Clock: 74.250 MHz
    VIC  15 1440x480@60Hz 16:9  HorFreq: 31469 Hz Clock: 54.000 MHz
    VIC  29 1440x576@50Hz 4:3  HorFreq: 31250 Hz Clock: 54.000 MHz
    VIC  30 1440x576@50Hz 16:9  HorFreq: 31250 Hz Clock: 54.000 MHz
    VIC  14 1440x480@60Hz 4:3  HorFreq: 31469 Hz Clock: 54.000 MHz
    VIC  16 1920x1080@60Hz 16:9 (native) HorFreq: 67500 Hz Clock: 148.500 MHz
    VIC  31 1920x1080@50Hz 16:9  HorFreq: 56250 Hz Clock: 148.500 MHz
    VIC   4 1280x720@60Hz 16:9  HorFreq: 45000 Hz Clock: 74.250 MHz
  Audio data block
    Linear PCM, max channels 2
      Supported sample rates (kHz): 96 48 44.1 32
      Supported sample sizes (bits): 24 20 16
  Speaker allocation data block
    Speaker map:
      FL/FR - Front Left/Right
  Vendor-specific data block, OUI 000c03 (HDMI)
    Source physical address 1.0.0.0
Basic audio support
Supports YCbCr 4:4:4
Supports YCbCr 4:2:2
1 native detailed modes
Detailed mode: Clock 410.500 MHz, 597 mm x 336 mm
               2560 2608 2640 2720 hborder 0
               1440 1443 1448 1510 vborder 0
               +hsync -vsync 
               VertFreq: 99 Hz, HorFreq: 150919 Hz
Detailed mode: Clock 497.750 MHz, 597 mm x 336 mm
               2560 2608 2640 2720 hborder 0
               1440 1443 1448 1525 vborder 0
               +hsync -vsync 
               VertFreq: 119 Hz, HorFreq: 182996 Hz
Detailed mode: Clock 346.500 MHz, 597 mm x 336 mm
               2560 2608 2640 2720 hborder 0
               1440 1443 1448 1499 vborder 0
               +hsync -vsync 
               VertFreq: 84 Hz, HorFreq: 127389 Hz
Checksum: 0xe3 (valid)

Warning: One or more of the timings is out of range of the Monitor Ranges:
  Vertical Freq: 50 - 164 Hz
  Horizontal Freq: 31250 - 242424 Hz
  Maximum Clock: 640.000 MHz


