
EDID (hex):
00ffffffffffff0022f05f3101010101
2f190103804728782e9145a7554ea025
0c5054a10800d1c081c081809500a9c0
a940b300d100565e00a0a0a029503020
3500c48f2100001a000000fd00323c18
5a19000a202020202020000000fc0048
5020454e56592033320a2020000000ff
00434e433534373053304b0a202001a2
02031ff249909f041303021211012309
07078301000065030c001000e2002b02
3a801871382d40582c4500c48f210000
1e023a80d072382d40102c4580c48f21
00001e00000000000000000000000000
00000000000000000000000000000000
00000000000000000000000000000000
00000000000000000000000000000068

Extracted contents:
header:          00 ff ff ff ff ff ff 00
serial number:   22 f0 5f 31 01 01 01 01 2f 19
version:         01 03
basic params:    80 47 28 78 2e
chroma info:     91 45 a7 55 4e a0 25 0c 50 54
established:     a1 08 00
standard:        d1 c0 81 c0 81 80 95 00 a9 c0 a9 40 b3 00 d1 00
descriptor 1:    56 5e 00 a0 a0 a0 29 50 30 20 35 00 c4 8f 21 00 00 1a
descriptor 2:    00 00 00 fd 00 32 3c 18 5a 19 00 0a 20 20 20 20 20 20
descriptor 3:    00 00 00 fc 00 48 50 20 45 4e 56 59 20 33 32 0a 20 20
descriptor 4:    00 00 00 ff 00 43 4e 43 35 34 37 30 53 30 4b 0a 20 20
extensions:      01
checksum:        a2

EDID version: 1.3
Manufacturer: HWP Model 315f Serial Number --
Made in week 47 of 2015
Digital display
Maximum image size: 71 cm x 40 cm
Gamma: 2.20
DPMS levels: Off
RGB color display
Default (sRGB) color space is primary color space
First detailed timing is preferred timing
Display x,y Chromaticity:
  Red:   0.6542, 0.3330
  Green: 0.3046, 0.6259
  Blue:  0.1455, 0.0468
  White: 0.3134, 0.3291
Established timings supported:
  720x400@70Hz 9:5 HorFreq: 31469 Hz Clock: 28.320 MHz
  640x480@60Hz 4:3 HorFreq: 31469 Hz Clock: 25.175 MHz
  800x600@60Hz 4:3 HorFreq: 37900 Hz Clock: 40.000 MHz
  1024x768@60Hz 4:3 HorFreq: 48400 Hz Clock: 65.000 MHz
Standard timings supported:
  1920x1080@60Hz 16:9
  1280x720@60Hz 16:9
  1280x1024@60Hz 5:4 HorFreq: 64000 Hz Clock: 108.000 MHz
  1440x900@60Hz 16:10 HorFreq: 55500 Hz Clock: 88.750 MHz
  1600x900@60Hz 16:9
  1600x1200@60Hz 4:3 HorFreq: 75000 Hz Clock: 162.000 MHz
  1680x1050@60Hz 16:10 HorFreq: 64700 Hz Clock: 119.000 MHz
  1920x1200@60Hz 16:10 HorFreq: 74000 Hz Clock: 154.000 MHz
Detailed mode: Clock 241.500 MHz, 708 mm x 399 mm
               2560 2608 2640 2720 hborder 0
               1440 1443 1448 1481 vborder 0
               +hsync -vsync 
               VertFreq: 59 Hz, HorFreq: 88786 Hz
Monitor ranges (GTF): 50-60Hz V, 24-90kHz H, max dotclock 250MHz
Monitor name: HP ENVY 32
Serial number: --
Has 1 extension blocks
Checksum: 0xa2 (valid)

CTA extension block
Extension version: 3
27 bytes of CTA data
  Video data block
    VIC  16 1920x1080@60Hz 16:9 (native) HorFreq: 67500 Hz Clock: 148.500 MHz
    VIC  31 1920x1080@50Hz 16:9 (native) HorFreq: 56250 Hz Clock: 148.500 MHz
    VIC   4 1280x720@60Hz 16:9  HorFreq: 45000 Hz Clock: 74.250 MHz
    VIC  19 1280x720@50Hz 16:9  HorFreq: 37500 Hz Clock: 74.250 MHz
    VIC   3 720x480@60Hz 16:9  HorFreq: 31469 Hz Clock: 27.000 MHz
    VIC   2 720x480@60Hz 4:3  HorFreq: 31469 Hz Clock: 27.000 MHz
    VIC  18 720x576@50Hz 16:9  HorFreq: 31250 Hz Clock: 27.000 MHz
    VIC  17 720x576@50Hz 4:3  HorFreq: 31250 Hz Clock: 27.000 MHz
    VIC   1 640x480@60Hz 4:3  HorFreq: 31469 Hz Clock: 25.175 MHz
  Audio data block
    Linear PCM, max channels 2
      Supported sample rates (kHz): 48 44.1 32
      Supported sample sizes (bits): 24 20 16
  Speaker allocation data block
    Speaker map:
      FL/FR - Front Left/Right
  Vendor-specific data block, OUI 000c03 (HDMI)
    Source physical address 1.0.0.0
  Extended tag: Video capability data block
    YCbCr quantization: No Data (0)
    RGB quantization: No Data (0)
    PT scan behaviour: Always Underscanned (2)
    IT scan behaviour: Always Underscanned (2)
    CE scan behaviour: Support both over- and underscan (3)
Underscans PC formats by default
Basic audio support
Supports YCbCr 4:4:4
Supports YCbCr 4:2:2
2 native detailed modes
Detailed mode: Clock 148.500 MHz, 708 mm x 399 mm
               1920 2008 2052 2200 hborder 0
               1080 1084 1089 1125 vborder 0
               +hsync +vsync 
               VertFreq: 60 Hz, HorFreq: 67500 Hz
Detailed mode: Clock 148.500 MHz, 708 mm x 399 mm
               1920 2448 2492 2640 hborder 0
               1080 1084 1089 1125 vborder 0
               +hsync +vsync 
               VertFreq: 50 Hz, HorFreq: 56250 Hz
Checksum: 0x68 (valid)

EDID block does NOT conform to EDID 1.3!
	sRGB is signaled, but the chromaticities do not match
One or more of the timings is out of range of the Monitor Ranges:
  Vertical Freq: 50 - 70 Hz
  Horizontal Freq: 31250 - 88786 Hz
  Maximum Clock: 241.500 MHz
EDID block does not conform at all!
	Both the serial number and the serial string are set
