
EDID (hex):
00ffffffffffff0009e5610c00000000
19210104a522167807c211a6544a9d25
0d505400000001010101010101010101
0101010101019a3f80c870b050403020
360059d71000001ae23280c870b05040
3020360059d71000001a000000fd0028
3c4d4d10010a202020202020000000fe
004e5631363057554d2d4e36310a00e5

edid-decode (hex):

00 ff ff ff ff ff ff 00 09 e5 61 0c 00 00 00 00
19 21 01 04 a5 22 16 78 07 c2 11 a6 54 4a 9d 25
0d 50 54 00 00 00 01 01 01 01 01 01 01 01 01 01
01 01 01 01 01 01 9a 3f 80 c8 70 b0 50 40 30 20
36 00 59 d7 10 00 00 1a e2 32 80 c8 70 b0 50 40
30 20 36 00 59 d7 10 00 00 1a 00 00 00 fd 00 28
3c 4d 4d 10 01 0a 20 20 20 20 20 20 00 00 00 fe
00 4e 56 31 36 30 57 55 4d 2d 4e 36 31 0a 00 e5

----------------

Block 0, Base EDID:
  EDID Structure Version & Revision: 1.4
  Vendor & Product Identification:
    Manufacturer: BOE
    Model: 3169
    Made in: week 25 of 2023
  Basic Display Parameters & Features:
    Digital display
    Bits per primary color channel: 8
    DisplayPort interface
    Maximum image size: 34 cm x 22 cm
    Gamma: 2.20
    Supported color formats: RGB 4:4:4
    Default (sRGB) color space is primary color space
    First detailed timing includes the native pixel format and preferred refresh rate
    Display is continuous frequency
  Color Characteristics:
    Red  : 0.6513, 0.3281
    Green: 0.2890, 0.6152
    Blue : 0.1445, 0.0517
    White: 0.3125, 0.3291
  Established Timings I & II: none
  Standard Timings: none
  Detailed Timing Descriptors:
    DTD 1:  1920x1200   60.001474 Hz  16:10    76.802 kHz    162.820000 MHz (345 mm x 215 mm)
                 Hfront   48 Hsync  32 Hback  120 Hpol P
                 Vfront    3 Vsync   6 Vback   71 Vpol N
    DTD 2:  1920x1200   48.002653 Hz  16:10    61.443 kHz    130.260000 MHz (345 mm x 215 mm)
                 Hfront   48 Hsync  32 Hback  120 Hpol P
                 Vfront    3 Vsync   6 Vback   71 Vpol N
    Display Range Limits:
      Monitor ranges (Bare Limits): 40-60 Hz V, 77-77 kHz H, max dotclock 160 MHz
    Alphanumeric Data String: 'NV160WUM-N61'
Checksum: 0xe5
