
EDID (hex):
00ffffffffffff00320c00a500000000
000f0103801e13780ac4409458538c28
23505400000001010101010101010101
010101010101bc1b00a0502017303020
360030be100000180000000000000000
00000000000000000000000000fe004c
475068696c6970734c43440a000000fe
004c503134315758312d544c413200ae

Extracted contents:
header:          00 ff ff ff ff ff ff 00
serial number:   32 0c 00 a5 00 00 00 00 00 0f
version:         01 03
basic params:    80 1e 13 78 0a
chroma info:     c4 40 94 58 53 8c 28 23 50 54
established:     00 00 00
standard:        01 01 01 01 01 01 01 01 01 01 01 01 01 01 01 01
descriptor 1:    bc 1b 00 a0 50 20 17 30 30 20 36 00 30 be 10 00 00 18
descriptor 2:    00 00 00 00 00 00 00 00 00 00 00 00 00 00 00 00 00 00
descriptor 3:    00 00 00 fe 00 4c 47 50 68 69 6c 69 70 73 4c 43 44 0a
descriptor 4:    00 00 00 fe 00 4c 50 31 34 31 57 58 31 2d 54 4c 41 32
extensions:      00
checksum:        ae

EDID version: 1.3
Manufacturer: LPL Model a500 Serial Number --
Digital display
Maximum image size: 30 cm x 19 cm
Gamma: 2.20
RGB color display
First detailed timing is preferred timing
Display x,y Chromaticity:
  Red:   0.5810, 0.3437
  Green: 0.3251, 0.5468
  Blue:  0.1572, 0.1367
  White: 0.3125, 0.3281
Established timings supported:
Standard timings supported:
Detailed mode: Clock 71.000 MHz, 304 mm x 190 mm
               1280 1328 1360 1440 hborder 0
                800  803  809  823 vborder 0
               -hsync -vsync 
               VertFreq: 59 Hz, HorFreq: 49305 Hz
Manufacturer-specified data, tag 0
ASCII string: LGPhilipsLCD
ASCII string: LP141WX1-TLA2
Checksum: 0xae (valid)
EDID block does NOT conform to EDID 1.3!
	Missing name descriptor
	Missing monitor ranges
EDID block does not conform at all!
	Bad year of manufacture
