
EDID (hex):
00ffffffffffff0009e5c20700000000
011c01049522137802de50a3544c9926
0f505400000001010101010101010101
010101010101413780cc70381e403020
360058c11000001ad62480cc70381e40
3020360058c11000001a000000000000
00000000000000000000000000000002
000628ff0a3cc8161137c800000000eb

Extracted contents:
header:          00 ff ff ff ff ff ff 00
serial number:   09 e5 c2 07 00 00 00 00 01 1c
version:         01 04
basic params:    95 22 13 78 02
chroma info:     de 50 a3 54 4c 99 26 0f 50 54
established:     00 00 00
standard:        01 01 01 01 01 01 01 01 01 01 01 01 01 01 01 01
descriptor 1:    41 37 80 cc 70 38 1e 40 30 20 36 00 58 c1 10 00 00 1a
descriptor 2:    d6 24 80 cc 70 38 1e 40 30 20 36 00 58 c1 10 00 00 1a
descriptor 3:    00 00 00 00 00 00 00 00 00 00 00 00 00 00 00 00 00 00
descriptor 4:    00 00 00 02 00 06 28 ff 0a 3c c8 16 11 37 c8 00 00 00
extensions:      00
checksum:        eb

EDID version: 1.4
Manufacturer: BOE Model 7c2 Serial Number --
Made in week 1 of 2018
Digital display
6 bits per primary color channel
DisplayPort interface
Maximum image size: 34 cm x 19 cm
Gamma: 2.20
Supported color formats: RGB 4:4:4
First detailed timing includes the native pixel format and preferred refresh rate
Display x,y Chromaticity:
  Red:   0.6396, 0.3291
  Green: 0.2998, 0.5996
  Blue:  0.1494, 0.0595
  White: 0.3125, 0.3281
Established timings supported:
Standard timings supported:
Detailed mode: Clock 141.450 MHz, 344 mm x 193 mm
               1920 1968 2000 2124 hborder 0
               1080 1083 1089 1110 vborder 0
               +hsync -vsync 
               VertFreq: 59 Hz, HorFreq: 66596 Hz
Detailed mode: Clock 94.300 MHz, 344 mm x 193 mm
               1920 1968 2000 2124 hborder 0
               1080 1083 1089 1110 vborder 0
               +hsync -vsync 
               VertFreq: 39 Hz, HorFreq: 44397 Hz
Manufacturer-specified data, tag 0
Manufacturer-specified data, tag 2
Checksum: 0xeb (valid)
EDID block does NOT conform to EDID 1.4!
	Missing name descriptor
	Missing monitor ranges
