edid-decode (hex):

00 ff ff ff ff ff ff 00 30 e4 97 05 00 00 00 00
00 1b 01 04 95 1d 11 78 02 24 15 a3 59 55 a0 27
0a 50 54 00 00 00 01 01 01 01 01 01 01 01 01 01
01 01 01 01 01 01 2e 36 80 a0 70 38 1f 40 30 20
35 00 26 a5 10 00 00 19 1f 24 80 a0 70 38 1f 40
30 20 35 00 26 a5 10 00 00 19 00 00 00 00 00 00
00 00 00 00 00 00 00 00 00 00 00 00 00 00 00 02
00 0c 33 ff 0a 3c 96 12 10 28 96 00 00 00 00 07

----------------

Block 0, Base EDID:
  EDID Structure Version & Revision: 1.4
  Vendor & Product Identification:
    Manufacturer: LGD
    Model: 1431
    Made in: 2017
  Basic Display Parameters & Features:
    Digital display
    Bits per primary color channel: 6
    DisplayPort interface
    Maximum image size: 29 cm x 17 cm
    Gamma: 2.20
    Supported color formats: RGB 4:4:4
    First detailed timing includes the native pixel format and preferred refresh rate
  Color Characteristics:
    Red  : 0.6367, 0.3496
    Green: 0.3330, 0.6250
    Blue : 0.1523, 0.0400
    White: 0.3134, 0.3291
  Established Timings I & II: none
  Standard Timings: none
  Detailed Timing Descriptors:
    DTD 1:  1920x1080   60.020425 Hz  16:9     66.683 kHz    138.700000 MHz (294 mm x 165 mm)
                 Hfront   48 Hsync  32 Hback   80 Hpol N
                 Vfront    3 Vsync   5 Vback   23 Vpol N
    DTD 2:  1920x1080   40.015059 Hz  16:9     44.457 kHz     92.470000 MHz (294 mm x 165 mm)
                 Hfront   48 Hsync  32 Hback   80 Hpol N
                 Vfront    3 Vsync   5 Vback   23 Vpol N
    Empty Descriptor
    Manufacturer-Specified Display Descriptor (0x02): 00 02 00 0c 33 ff 0a 3c 96 12 10 28 96 00 00 00 '....3..<...(....'
Checksum: 0x07

----------------

Warnings:

Block 0, Base EDID:
  Missing Display Product Name.

Failures:

Block 0, Base EDID:
  Empty Descriptor: Use Dummy Descriptor instead of all zeroes.

EDID conformity: FAIL
