edid-decode (hex):

00 ff ff ff ff ff ff 00 12 e5 e6 00 00 00 00 00
14 10 01 03 80 46 28 64 0a 00 00 a2 55 46 94 24
0f 47 4a 25 4a 00 81 80 01 01 01 01 01 01 01 01
01 01 01 01 01 01 01 1d 00 72 51 d0 1e 20 6e 28
55 00 c4 8e 21 00 00 1e 1b 21 50 a0 51 00 1e 30
48 88 35 00 c4 8e 21 00 00 1c 00 00 00 fc 00 53
4c 2d 32 33 30 44 0a 20 20 20 20 20 00 00 00 fd
00 37 50 19 46 0b 00 0a 20 20 20 20 20 20 01 c4

02 03 18 f1 45 84 03 05 02 01 23 09 07 01 83 01
00 00 65 03 0c 00 10 00 01 1d 80 18 71 1c 16 20
58 2c 25 00 c4 8e 21 00 00 9e 8c 0a d0 8a 20 e0
2d 10 10 3e 96 00 13 8e 21 00 00 18 d6 09 80 a0
20 e0 2d 10 10 60 a2 00 13 8e 21 00 00 18 8c 0a
d0 8a 20 e0 2d 10 10 3e 96 00 c4 8e 21 00 00 18
00 00 00 00 00 00 00 00 00 00 00 00 00 00 00 00
00 00 00 00 00 00 00 00 00 00 00 00 00 00 00 00

00 ff ff ff ff ff ff 00 12 e5 e6 00 00 00 00 00
14 10 01 03 80 46 28 64 0a 00 00 a2 55 46 94 24
0f 47 4a 25 4a 00 81 80 01 01 01 01 01 01 01 01
01 01 01 01 01 01 01 1d 00 72 51 d0 1e 20 6e 28
55 00 c4 8e 21 00 00 1e 1b 21 50 a0 51 00 1e 30
48 88 35 00 c4 8e 21 00 00 1c 00 00 00 fc 00 53
4c 2d 32 33 30 44 0a 20 20 20 20 20 00 00 00 fd
00 37 50 19 46 0b 00 0a 20 20 20 20 20 20 01 c4

02 03 18 f1 45 84 03 05 02 01 23 09 07 01 83 01
00 00 65 03 0c 00 10 00 01 1d 80 18 71 1c 16 20
58 2c 25 00 c4 8e 21 00 00 9e 8c 0a d0 8a 20 e0
2d 10 10 3e 96 00 13 8e 21 00 00 18 d6 09 80 a0
20 e0 2d 10 10 60 a2 00 13 8e 21 00 00 18 8c 0a
d0 8a 20 e0 2d 10 10 3e 96 00 c4 8e 21 00 00 18
00 00 00 00 00 00 00 00 00 00 00 00 00 00 00 00
00 00 00 00 00 00 00 00 00 00 00 00 00 00 00 00

----------------

Block 0, Base EDID:
  EDID Structure Version & Revision: 1.3
  Vendor & Product Identification:
    Manufacturer: DWE
    Model: 230
    Made in: week 20 of 2006
  Basic Display Parameters & Features:
    Digital display
    Maximum image size: 70 cm x 40 cm
    Gamma: 2.00
    RGB color display
    First detailed timing is the preferred timing
  Color Characteristics:
    Red  : 0.6328, 0.3320
    Green: 0.2734, 0.5781
    Blue : 0.1406, 0.0585
    White: 0.2773, 0.2890
  Established Timings I & II:
    DMT 0x04:   640x480    59.940476 Hz   4:3     31.469 kHz     25.175000 MHz
    DMT 0x06:   640x480    75.000000 Hz   4:3     37.500 kHz     31.500000 MHz
    DMT 0x09:   800x600    60.316541 Hz   4:3     37.879 kHz     40.000000 MHz
    DMT 0x0b:   800x600    75.000000 Hz   4:3     46.875 kHz     49.500000 MHz
    DMT 0x10:  1024x768    60.003840 Hz   4:3     48.363 kHz     65.000000 MHz
    DMT 0x12:  1024x768    75.028582 Hz   4:3     60.023 kHz     78.750000 MHz
  Standard Timings:
    DMT 0x23:  1280x1024   60.019740 Hz   5:4     63.981 kHz    108.000000 MHz
  Detailed Timing Descriptors:
    DTD  1:  1280x720    60.000000 Hz  16:9     45.000 kHz     74.250000 MHz (708 mm x 398 mm)
                  Hfront  110 Hsync  40 Hback  220 Hpol P
                  Vfront    5 Vsync   5 Vback   20 Vpol P
    DTD  2:  1360x768    59.798991 Hz  85:48    47.720 kHz     84.750000 MHz (708 mm x 398 mm)
                  Hfront   72 Hsync 136 Hback  208 Hpol N
                  Vfront    3 Vsync   5 Vback   22 Vpol P
    Display Product Name: 'SL-230D'
    Display Range Limits:
      Monitor ranges (GTF): 55-80 Hz V, 25-70 kHz H, max dotclock 110 MHz
  Extension blocks: 1
Checksum: 0xc4

----------------

Block 1, CTA-861 Extension Block:
  Revision: 3
  Underscans IT Video Formats by default
  Basic audio support
  Supports YCbCr 4:4:4
  Supports YCbCr 4:2:2
  Native detailed modes: 1
  Video Data Block:
    VIC   4:  1280x720    60.000000 Hz  16:9     45.000 kHz     74.250000 MHz (native)
    VIC   3:   720x480    59.940060 Hz  16:9     31.469 kHz     27.000000 MHz
    VIC   5:  1920x1080i  60.000000 Hz  16:9     33.750 kHz     74.250000 MHz
    VIC   2:   720x480    59.940060 Hz   4:3     31.469 kHz     27.000000 MHz
    VIC   1:   640x480    59.940476 Hz   4:3     31.469 kHz     25.175000 MHz
  Audio Data Block:
    Linear PCM:
      Max channels: 2
      Supported sample rates (kHz): 48 44.1 32
      Supported sample sizes (bits): 16
  Speaker Allocation Data Block:
    FL/FR - Front Left/Right
  Vendor-Specific Data Block (HDMI), OUI 00-0C-03:
    Source physical address: 1.0.0.0
  Detailed Timing Descriptors:
    DTD  3:  1920x1080i  60.000000 Hz  16:9     33.750 kHz     74.250000 MHz (708 mm x 398 mm)
                  Hfront   88 Hsync  44 Hback  148 Hpol P
                  Vfront    2 Vsync   5 Vback   15 Vpol P Vfront +0.5 Odd Field
                  Vfront    2 Vsync   5 Vback   15 Vpol P Vback  +0.5 Even Field
    DTD  4:   720x480    59.940060 Hz   3:2     31.469 kHz     27.000000 MHz (531 mm x 398 mm)
                  Hfront   16 Hsync  62 Hback   60 Hpol N
                  Vfront    9 Vsync   6 Vback   30 Vpol N
    DTD  5:   640x480    59.952381 Hz   4:3     31.475 kHz     25.180000 MHz (531 mm x 398 mm)
                  Hfront   16 Hsync  96 Hback   48 Hpol N
                  Vfront   10 Vsync   2 Vback   33 Vpol N
    DTD  6:   720x480    59.940060 Hz   3:2     31.469 kHz     27.000000 MHz (708 mm x 398 mm)
                  Hfront   16 Hsync  62 Hback   60 Hpol N
                  Vfront    9 Vsync   6 Vback   30 Vpol N
Checksum: 0x00  Unused space in Extension Block: 31 bytes

----------------

Block 2, Unknown EDID Extension Block 0x00:
  00 ff ff ff ff ff ff 00 12 e5 e6 00 00 00 00 00 '................'
  14 10 01 03 80 46 28 64 0a 00 00 a2 55 46 94 24 '.....F(d....UF.$'
  0f 47 4a 25 4a 00 81 80 01 01 01 01 01 01 01 01 '.GJ%J...........'
  01 01 01 01 01 01 01 1d 00 72 51 d0 1e 20 6e 28 '.........rQ.. n('
  55 00 c4 8e 21 00 00 1e 1b 21 50 a0 51 00 1e 30 'U...!....!P.Q..0'
  48 88 35 00 c4 8e 21 00 00 1c 00 00 00 fc 00 53 'H.5...!........S'
  4c 2d 32 33 30 44 0a 20 20 20 20 20 00 00 00 fd 'L-230D.     ....'
  00 37 50 19 46 0b 00 0a 20 20 20 20 20 20 01 c4 '.7P.F...      ..'
Checksum: 0xc4

----------------

Block 3, CTA-861 Extension Block:
  Revision: 3
  Underscans IT Video Formats by default
  Basic audio support
  Supports YCbCr 4:4:4
  Supports YCbCr 4:2:2
  Native detailed modes: 1
  Video Data Block:
    VIC   4:  1280x720    60.000000 Hz  16:9     45.000 kHz     74.250000 MHz (native)
    VIC   3:   720x480    59.940060 Hz  16:9     31.469 kHz     27.000000 MHz
    VIC   5:  1920x1080i  60.000000 Hz  16:9     33.750 kHz     74.250000 MHz
    VIC   2:   720x480    59.940060 Hz   4:3     31.469 kHz     27.000000 MHz
    VIC   1:   640x480    59.940476 Hz   4:3     31.469 kHz     25.175000 MHz
  Audio Data Block:
    Linear PCM:
      Max channels: 2
      Supported sample rates (kHz): 48 44.1 32
      Supported sample sizes (bits): 16
  Speaker Allocation Data Block:
    FL/FR - Front Left/Right
  Vendor-Specific Data Block (HDMI), OUI 00-0C-03:
    Source physical address: 1.0.0.0
  Detailed Timing Descriptors:
    DTD  7:  1920x1080i  60.000000 Hz  16:9     33.750 kHz     74.250000 MHz (708 mm x 398 mm)
                  Hfront   88 Hsync  44 Hback  148 Hpol P
                  Vfront    2 Vsync   5 Vback   15 Vpol P Vfront +0.5 Odd Field
                  Vfront    2 Vsync   5 Vback   15 Vpol P Vback  +0.5 Even Field
    DTD  8:   720x480    59.940060 Hz   3:2     31.469 kHz     27.000000 MHz (531 mm x 398 mm)
                  Hfront   16 Hsync  62 Hback   60 Hpol N
                  Vfront    9 Vsync   6 Vback   30 Vpol N
    DTD  9:   640x480    59.952381 Hz   4:3     31.475 kHz     25.180000 MHz (531 mm x 398 mm)
                  Hfront   16 Hsync  96 Hback   48 Hpol N
                  Vfront   10 Vsync   2 Vback   33 Vpol N
    DTD 10:   720x480    59.940060 Hz   3:2     31.469 kHz     27.000000 MHz (708 mm x 398 mm)
                  Hfront   16 Hsync  62 Hback   60 Hpol N
                  Vfront    9 Vsync   6 Vback   30 Vpol N
Checksum: 0x00  Unused space in Extension Block: 31 bytes

----------------

Warnings:

Block 1, CTA-861 Extension Block:
  Add a Colorimetry Data Block with the sRGB colorimetry bit set to avoid interop issues.
Block 3, CTA-861 Extension Block:
  Add a Colorimetry Data Block with the sRGB colorimetry bit set to avoid interop issues.
EDID:
  CTA-861: Multiple native progressive timings are defined.

Failures:

Block 1, CTA-861 Extension Block:
  Missing VCDB, needed for Set Selectable RGB Quantization to avoid interop issues.
Block 2, Base EDID:
  Unknown Extension Block.
Block 3, CTA-861 Extension Block:
  Video Data Block: Duplicate VIC 4.
  Video Data Block: Duplicate VIC 3.
  Video Data Block: Duplicate VIC 5.
  Video Data Block: Duplicate VIC 2.
  Video Data Block: Duplicate VIC 1.
  Speaker Allocation Data Block: Only one instance of this Data Block is allowed.
  Missing VCDB, needed for Set Selectable RGB Quantization to avoid interop issues.
EDID:
  Base EDID: EDID specified 1 extension block(s), but found 3 extension block(s).
  Base EDID: EDID 1.3 requires a Block Map Extension in Block 1 if there are more than 2 blocks in the EDID.

EDID conformity: FAIL
