
EDID (hex):
00ffffffffffff00410cfa08530b0000
111e0104b55f36783a583da555539c25
0c474abfef00d1c0b300950081808140
81c0010101014dd000a0f0703e803020
3500b91f3200001a565e00a0a0a02950
30203500b91f3200001e000000fd0017
501ea03c010a202020202020000000fc
0050484c2042444d343335300a20012a
020326f14b0103051404131f12021190
23090707830100006d030c0010001878
200060010203011d007251d01e206e28
5500b91f3200001e8c0ad08a20e02d10
103e9600b91f320000188c0ad0902040
31200c405500b91f320000184d6c80a0
70703e8030203a00b91f3200001a0000
0000000000000000000000000000006d

Extracted contents:
header:          00 ff ff ff ff ff ff 00
serial number:   41 0c fa 08 53 0b 00 00 11 1e
version:         01 04
basic params:    b5 5f 36 78 3a
chroma info:     58 3d a5 55 53 9c 25 0c 47 4a
established:     bf ef 00
standard:        d1 c0 b3 00 95 00 81 80 81 40 81 c0 01 01 01 01
descriptor 1:    4d d0 00 a0 f0 70 3e 80 30 20 35 00 b9 1f 32 00 00 1a
descriptor 2:    56 5e 00 a0 a0 a0 29 50 30 20 35 00 b9 1f 32 00 00 1e
descriptor 3:    00 00 00 fd 00 17 50 1e a0 3c 01 0a 20 20 20 20 20 20
descriptor 4:    00 00 00 fc 00 50 48 4c 20 42 44 4d 34 33 35 30 0a 20
extensions:      01
checksum:        2a

EDID version: 1.4
Manufacturer: PHL Model 8fa Serial Number --
Made in week 17 of 2020
Digital display
10 bits per primary color channel
DisplayPort interface
Maximum image size: 95 cm x 54 cm
Gamma: 2.20
DPMS levels: Off
Supported color formats: RGB 4:4:4, YCrCb 4:4:4, YCrCb 4:2:2
First detailed timing includes the native pixel format and preferred refresh rate
Display x,y Chromaticity:
  Red:   0.6455, 0.3330
  Green: 0.3261, 0.6093
  Blue:  0.1445, 0.0498
  White: 0.2802, 0.2900
Established timings supported:
  720x400@70Hz 9:5 HorFreq: 31469 Hz Clock: 28.320 MHz
  640x480@60Hz 4:3 HorFreq: 31469 Hz Clock: 25.175 MHz
  640x480@67Hz 4:3 HorFreq: 35000 Hz Clock: 30.240 MHz
  640x480@72Hz 4:3 HorFreq: 37900 Hz Clock: 31.500 MHz
  640x480@75Hz 4:3 HorFreq: 37500 Hz Clock: 31.500 MHz
  800x600@56Hz 4:3 HorFreq: 35200 Hz Clock: 36.000 MHz
  800x600@60Hz 4:3 HorFreq: 37900 Hz Clock: 40.000 MHz
  800x600@72Hz 4:3 HorFreq: 48100 Hz Clock: 50.000 MHz
  800x600@75Hz 4:3 HorFreq: 46900 Hz Clock: 49.500 MHz
  832x624@75Hz 4:3 HorFreq: 49726 Hz Clock: 57.284 MHz
  1024x768@60Hz 4:3 HorFreq: 48400 Hz Clock: 65.000 MHz
  1024x768@70Hz 4:3 HorFreq: 56500 Hz Clock: 75.000 MHz
  1024x768@75Hz 4:3 HorFreq: 60000 Hz Clock: 78.750 MHz
  1280x1024@75Hz 5:4 HorFreq: 80000 Hz Clock: 135.000 MHz
Standard timings supported:
  1920x1080@60Hz 16:9
  1680x1050@60Hz 16:10 HorFreq: 64700 Hz Clock: 119.000 MHz
  1440x900@60Hz 16:10 HorFreq: 55500 Hz Clock: 88.750 MHz
  1280x1024@60Hz 5:4 HorFreq: 64000 Hz Clock: 108.000 MHz
  1280x960@60Hz 4:3 HorFreq: 60000 Hz Clock: 108.000 MHz
  1280x720@60Hz 16:9
Detailed mode: Clock 533.250 MHz, 953 mm x 543 mm
               3840 3888 3920 4000 hborder 0
               2160 2163 2168 2222 vborder 0
               +hsync -vsync 
               VertFreq: 59 Hz, HorFreq: 133312 Hz
Detailed mode: Clock 241.500 MHz, 953 mm x 543 mm
               2560 2608 2640 2720 hborder 0
               1440 1443 1448 1481 vborder 0
               +hsync +vsync 
               VertFreq: 59 Hz, HorFreq: 88786 Hz
Monitor ranges (bare limits): 23-80Hz V, 30-160kHz H, max dotclock 600MHz
Monitor name: PHL BDM4350
Has 1 extension blocks
Checksum: 0x2a (valid)

CTA extension block
Extension version: 3
34 bytes of CTA data
  Video data block
    VIC   1 640x480@60Hz 4:3  HorFreq: 31469 Hz Clock: 25.175 MHz
    VIC   3 720x480@60Hz 16:9  HorFreq: 31469 Hz Clock: 27.000 MHz
    VIC   5 1920x1080i@60Hz 16:9  HorFreq: 33750 Hz Clock: 74.250 MHz
    VIC  20 1920x1080i@50Hz 16:9  HorFreq: 28125 Hz Clock: 74.250 MHz
    VIC   4 1280x720@60Hz 16:9  HorFreq: 45000 Hz Clock: 74.250 MHz
    VIC  19 1280x720@50Hz 16:9  HorFreq: 37500 Hz Clock: 74.250 MHz
    VIC  31 1920x1080@50Hz 16:9  HorFreq: 56250 Hz Clock: 148.500 MHz
    VIC  18 720x576@50Hz 16:9  HorFreq: 31250 Hz Clock: 27.000 MHz
    VIC   2 720x480@60Hz 4:3  HorFreq: 31469 Hz Clock: 27.000 MHz
    VIC  17 720x576@50Hz 4:3  HorFreq: 31250 Hz Clock: 27.000 MHz
    VIC  16 1920x1080@60Hz 16:9 (native) HorFreq: 67500 Hz Clock: 148.500 MHz
  Audio data block
    Linear PCM, max channels 2
      Supported sample rates (kHz): 48 44.1 32
      Supported sample sizes (bits): 24 20 16
  Speaker allocation data block
    Speaker map:
      FL/FR - Front Left/Right
  Vendor-specific data block, OUI 000c03 (HDMI)
    Source physical address 1.0.0.0
    DC_30bit
    DC_Y444
    Maximum TMDS clock: 600MHz
    Extended HDMI video details:
      HDMI VIC 1 3840x2160@30Hz 16:9 HorFreq: 67500 Hz Clock: 297.000 MHz
      HDMI VIC 2 3840x2160@25Hz 16:9 HorFreq: 56250 Hz Clock: 297.000 MHz
      HDMI VIC 3 3840x2160@24Hz 16:9 HorFreq: 54000 Hz Clock: 297.000 MHz
Underscans PC formats by default
Basic audio support
Supports YCbCr 4:4:4
Supports YCbCr 4:2:2
1 native detailed modes
Detailed mode: Clock 74.250 MHz, 953 mm x 543 mm
               1280 1390 1430 1650 hborder 0
                720  725  730  750 vborder 0
               +hsync +vsync 
               VertFreq: 60 Hz, HorFreq: 45000 Hz
Detailed mode: Clock 27.000 MHz, 953 mm x 543 mm
                720  736  798  858 hborder 0
                480  489  495  525 vborder 0
               -hsync -vsync 
               VertFreq: 59 Hz, HorFreq: 31468 Hz
Detailed mode: Clock 27.000 MHz, 953 mm x 543 mm
                720  732  796  864 hborder 0
                576  581  586  625 vborder 0
               -hsync -vsync 
               VertFreq: 50 Hz, HorFreq: 31250 Hz
Detailed mode: Clock 277.250 MHz, 953 mm x 543 mm
               1920 1968 2000 2080 hborder 0
               2160 2163 2173 2222 vborder 0
               +hsync -vsync 
               VertFreq: 59 Hz, HorFreq: 133293 Hz
Checksum: 0x6d (valid)

EDID block does NOT conform to EDID 1.4!
	HDMI VSDB Max TMDS rate is > 340
Warning: One or more of the timings is out of range of the Monitor Ranges:
  Vertical Freq: 24 - 75 Hz
  Horizontal Freq: 28125 - 133312 Hz
  Maximum Clock: 533.250 MHz
Warning: HDMI VIC Codes must have their CTA-861 VIC equivalents in the VSB


