edid-decode (hex):

00 ff ff ff ff ff ff 00 09 e5 b0 05 00 00 00 00
01 15 01 04 80 1f 11 78 0a b0 90 97 58 54 92 26
1d 50 54 00 00 00 01 01 01 01 01 01 01 01 01 01
01 01 01 01 01 01 4c 1d 56 d4 50 00 18 30 30 20
36 00 35 ad 10 00 00 1a 22 15 56 b2 50 00 6c 30
30 20 36 00 35 ad 10 00 00 1a 00 00 00 fe 00 44
33 4d 52 35 80 48 42 31 34 32 30 30 00 00 00 00
00 00 41 01 94 00 00 00 00 01 01 0a 20 20 00 24

----------------

Block 0, Base EDID:
  EDID Structure Version & Revision: 1.4
  Vendor & Product Identification:
    Manufacturer: BOE
    Model: 1456
    Made in: week 1 of 2011
  Basic Display Parameters & Features:
    Digital display
    Color depth is undefined
    Digital interface is not defined
    Maximum image size: 31 cm x 17 cm
    Gamma: 2.20
    Supported color formats: RGB 4:4:4, YCrCb 4:4:4
    First detailed timing includes the native pixel format and preferred refresh rate
  Color Characteristics:
    Red  : 0.5917, 0.3466
    Green: 0.3281, 0.5703
    Blue : 0.1503, 0.1142
    White: 0.3125, 0.3281
  Established Timings I & II: none
  Standard Timings: none
  Detailed Timing Descriptors:
    DTD 1:  1366x768    60.011 Hz 683:384  47.529 kHz  75.000 MHz (309 mm x 173 mm)
                 Hfront   48 Hsync  32 Hback 132 Hpol P
                 Vfront    3 Vsync   6 Vback  15 Vpol N
    DTD 2:  1366x768    39.999 Hz 683:384  35.039 kHz  54.100 MHz (309 mm x 173 mm)
                 Hfront   48 Hsync  32 Hback  98 Hpol P
                 Vfront    3 Vsync   6 Vback  99 Vpol N
    Alphanumeric Data String: 'D3MR5'
    Manufacturer-Specified Display Descriptor (0x00): 00 00 00 00 41 01 94 00 00 00 00 01 01 0a 20 20 '....A.........  '
Checksum: 0x24

----------------

Failures:

Block 0, Base EDID:
  Alphanumeric Data String: Non-printable character.
  Missing Display Product Name.

EDID conformity: FAIL
