edid-decode (hex):

00 ff ff ff ff ff ff 00 42 93 15 26 cf cf 02 00
1e 0e 01 03 08 1e 17 64 28 40 05 9c 57 52 92 26
1c 50 54 ad ce 00 01 01 01 01 01 01 01 01 01 01
01 01 01 01 01 01 c3 1e 00 20 41 00 20 30 10 60
13 00 30 e4 10 00 00 1e 00 00 00 fc 00 43 4c 2d
4c 43 44 2d 38 35 38 32 0a 20 00 00 00 fd 00 3c
4b 1e 3c 08 00 00 00 00 00 00 00 00 00 00 00 ff
00 46 48 5a 4a 34 37 30 31 38 34 32 37 31 00 d7

----------------

Block 0, Base EDID:
  EDID Structure Version & Revision: 1.3
  Vendor & Product Identification:
    Manufacturer: PTS
    Model: 9749
    Serial Number: ...
    Made in: week 30 of 2004
  Basic Display Parameters & Features:
    Analog display
    Input voltage level: 0.7/0.3 V
    Sync: Separate
    Maximum image size: 30 cm x 23 cm
    Gamma: 2.00
    DPMS levels: Off
    RGB color display
  Color Characteristics:
    Red  : 0.6103, 0.3398
    Green: 0.3203, 0.5703
    Blue : 0.1484, 0.1093
    White: 0.3134, 0.3291
  Established Timings I & II:
    IBM     :   720x400    70.082 Hz   9:5    31.467 kHz  28.320 MHz
    DMT 0x04:   640x480    59.940 Hz   4:3    31.469 kHz  25.175 MHz
    DMT 0x05:   640x480    72.809 Hz   4:3    37.861 kHz  31.500 MHz
    DMT 0x06:   640x480    75.000 Hz   4:3    37.500 kHz  31.500 MHz
    DMT 0x09:   800x600    60.317 Hz   4:3    37.879 kHz  40.000 MHz
    DMT 0x0a:   800x600    72.188 Hz   4:3    48.077 kHz  50.000 MHz
    DMT 0x0b:   800x600    75.000 Hz   4:3    46.875 kHz  49.500 MHz
    DMT 0x10:  1024x768    60.004 Hz   4:3    48.363 kHz  65.000 MHz
    DMT 0x11:  1024x768    70.069 Hz   4:3    56.476 kHz  75.000 MHz
    DMT 0x12:  1024x768    75.029 Hz   4:3    60.023 kHz  78.750 MHz
  Standard Timings: none
  Detailed Timing Descriptors:
    DTD 1:  1024x768    75.029 Hz   4:3    60.023 kHz  78.750 MHz (304 mm x 228 mm)
                 Hfront   16 Hsync  96 Hback 176 Hpol P
                 Vfront    1 Vsync   3 Vback  28 Vpol P
    Display Product Name: 'CL-LCD-8582'
  Display Range Limits:
    Monitor ranges (GTF): 60-75 Hz V, 30-60 kHz H, max dotclock 80 MHz
    Display Product Serial Number: ...
Checksum: 0xd7

----------------

Failures:

Block 0, Base EDID:
  Display Range Limits: Byte 11 is 0x00 instead of 0x0a.
  Display Range Limits: Byte 12 is 0x00 instead of 0x20.

EDID conformity: FAIL
