edid-decode (hex):

00 ff ff ff ff ff ff 00 4a 8b bf 01 01 00 50 63
01 1e 01 04 b5 3c 21 78 2b 8c 75 a9 54 45 98 22
1e 50 54 21 08 00 01 01 81 c0 81 80 95 00 a9 c0
b3 00 d1 c0 d1 00 dd 68 00 a0 a0 40 2d 60 30 20
35 00 58 4a 21 00 00 1a 00 00 00 fd 00 30 82 f6
f6 48 01 0a 20 20 20 20 20 20 00 00 00 fc 00 54
79 70 65 5f 43 0a 20 20 20 20 20 20 af fb 00 a0
a0 40 2d 60 30 20 45 00 12 22 21 00 00 1a 01 7d

02 03 23 f4 48 90 05 04 03 02 01 1f 13 23 09 07
07 83 01 00 00 e2 00 ff e3 05 c0 00 e6 06 05 01
62 62 00 dd 68 00 a0 a0 40 2d 60 30 20 35 00 58
4a 21 00 00 1a 04 e3 00 a0 a0 40 2d 60 30 20 35
00 58 4a 21 00 00 1a c8 ae 00 a0 a0 40 2d 60 30
20 45 00 58 4a 21 00 00 1a bc d1 00 a0 a0 40 2d
60 30 20 45 00 12 22 21 00 00 1a 00 00 00 00 00
00 00 00 00 00 00 00 00 00 00 00 00 00 00 00 31

----------------

Block 0, Base EDID:
  EDID Structure Version & Revision: 1.4
  Vendor & Product Identification:
    Manufacturer: RTK
    Model: 447
    Serial Number: ...
    Made in: week 1 of 2020
  Basic Display Parameters & Features:
    Digital display
    Bits per primary color channel: 10
    DisplayPort interface
    Maximum image size: 60 cm x 33 cm
    Gamma: 2.20
    DPMS levels: Off
    Supported color formats: RGB 4:4:4, YCrCb 4:4:4
    First detailed timing includes the native pixel format and preferred refresh rate
    Display is continuous frequency
  Color Characteristics:
    Red  : 0.6621, 0.3281
    Green: 0.2724, 0.5937
    Blue : 0.1337, 0.1201
    White: 0.3134, 0.3291
  Established Timings I & II:
    DMT 0x04:   640x480    59.940476 Hz   4:3     31.469 kHz     25.175000 MHz
    DMT 0x09:   800x600    60.316541 Hz   4:3     37.879 kHz     40.000000 MHz
    DMT 0x10:  1024x768    60.003840 Hz   4:3     48.363 kHz     65.000000 MHz
  Standard Timings:
    DMT 0x55:  1280x720    60.000000 Hz  16:9     45.000 kHz     74.250000 MHz
    DMT 0x23:  1280x1024   60.019740 Hz   5:4     63.981 kHz    108.000000 MHz
    DMT 0x2f:  1440x900    59.887445 Hz  16:10    55.935 kHz    106.500000 MHz
    DMT 0x53:  1600x900    60.000000 Hz  16:9     60.000 kHz    108.000000 MHz (RB)
    DMT 0x3a:  1680x1050   59.954250 Hz  16:10    65.290 kHz    146.250000 MHz
    DMT 0x52:  1920x1080   60.000000 Hz  16:9     67.500 kHz    148.500000 MHz
    DMT 0x45:  1920x1200   59.884600 Hz  16:10    74.556 kHz    193.250000 MHz
  Detailed Timing Descriptors:
    DTD 1:  2560x1600   59.996871 Hz  16:10    98.695 kHz    268.450000 MHz (600 mm x 330 mm)
                 Hfront   48 Hsync  32 Hback   80 Hpol P
                 Vfront    3 Vsync   5 Vback   37 Vpol N
    Display Range Limits:
      Monitor ranges (Bare Limits): 48-130 Hz V, 246-246 kHz H, max dotclock 720 MHz
    Display Product Name: 'Type_C'
    DTD 2:  2560x1600  143.999195 Hz  16:10   236.879 kHz    644.310000 MHz (530 mm x 290 mm)
                 Hfront   48 Hsync  32 Hback   80 Hpol P
                 Vfront    4 Vsync   5 Vback   36 Vpol N
  Extension blocks: 1
Checksum: 0x7d

----------------

Block 1, CTA-861 Extension Block:
  Revision: 3
  Underscans IT Video Formats by default
  Basic audio support
  Supports YCbCr 4:4:4
  Supports YCbCr 4:2:2
  Native detailed modes: 4
  Video Data Block:
    VIC  16:  1920x1080   60.000000 Hz  16:9     67.500 kHz    148.500000 MHz (native)
    VIC   5:  1920x1080i  60.000000 Hz  16:9     33.750 kHz     74.250000 MHz
    VIC   4:  1280x720    60.000000 Hz  16:9     45.000 kHz     74.250000 MHz
    VIC   3:   720x480    59.940060 Hz  16:9     31.469 kHz     27.000000 MHz
    VIC   2:   720x480    59.940060 Hz   4:3     31.469 kHz     27.000000 MHz
    VIC   1:   640x480    59.940476 Hz   4:3     31.469 kHz     25.175000 MHz
    VIC  31:  1920x1080   50.000000 Hz  16:9     56.250 kHz    148.500000 MHz
    VIC  19:  1280x720    50.000000 Hz  16:9     37.500 kHz     74.250000 MHz
  Audio Data Block:
    Linear PCM:
      Max channels: 2
      Supported sample rates (kHz): 48 44.1 32
      Supported sample sizes (bits): 24 20 16
  Speaker Allocation Data Block:
    FL/FR - Front Left/Right
  Video Capability Data Block:
    YCbCr quantization: Selectable (via AVI YQ)
    RGB quantization: Selectable (via AVI Q)
    PT scan behavior: Supports both over- and underscan
    IT scan behavior: Supports both over- and underscan
    CE scan behavior: Supports both over- and underscan
  Colorimetry Data Block:
    BT2020YCC
    BT2020RGB
  HDR Static Metadata Data Block:
    Electro optical transfer functions:
      Traditional gamma - SDR luminance range
      SMPTE ST2084
    Supported static metadata descriptors:
      Static metadata type 1
    Desired content max luminance: 98 (417.710 cd/m^2)
    Desired content max frame-average luminance: 98 (417.710 cd/m^2)
    Desired content min luminance: 0 (0.000 cd/m^2)
  Detailed Timing Descriptors:
    DTD 3:  2560x1600   59.996871 Hz  16:10    98.695 kHz    268.450000 MHz (600 mm x 330 mm)
                 Hfront   48 Hsync  32 Hback   80 Hpol P
                 Vfront    3 Vsync   5 Vback   37 Vpol N
    DTD 4:  2560x1600  129.885571 Hz  16:10   213.662 kHz    581.160000 MHz (600 mm x 330 mm)
                 Hfront   48 Hsync  32 Hback   80 Hpol P
                 Vfront    3 Vsync   5 Vback   37 Vpol N
    DTD 5:  2560x1600  100.000000 Hz  16:10   164.500 kHz    447.440000 MHz (600 mm x 330 mm)
                 Hfront   48 Hsync  32 Hback   80 Hpol P
                 Vfront    4 Vsync   5 Vback   36 Vpol N
    DTD 6:  2560x1600  119.998212 Hz  16:10   197.397 kHz    536.920000 MHz (530 mm x 290 mm)
                 Hfront   48 Hsync  32 Hback   80 Hpol P
                 Vfront    4 Vsync   5 Vback   36 Vpol N
Checksum: 0x31  Unused space in Extension Block: 20 bytes

----------------

Warnings:

Block 1, CTA-861 Extension Block:
  Video Capability Data Block: S_PT is equal to S_IT and S_CE, so should be set to 0 instead.
  Colorimetry Data Block: Set the sRGB colorimetry bit to avoid interop issues.
EDID:
  Base EDID: Some timings are out of range of the Monitor Ranges:
    Vertical Freq: 50.000 - 143.999 Hz (Monitor: 48.000 - 130.000 Hz)
    Horizontal Freq: 31.468 - 236.878 kHz (Monitor: 246.000 - 246.000 kHz)

Failures:

Block 0, Base EDID:
  Detailed Timing Descriptor #2: Mismatch of image size 530x290 mm vs display size 600x330 mm.
  Detailed Timing Descriptor #2: Invalid detailed timing descriptor ordering.
Block 1, CTA-861 Extension Block:
  Detailed Timing Descriptor #6: Mismatch of image size 530x290 mm vs display size 600x330 mm.
EDID:
  CTA-861: Native progressive timings are a mix of several resolutions.

EDID conformity: FAIL
