edid-decode (hex):

00 ff ff ff ff ff ff 00 36 98 00 03 e1 9a 42 51
26 0f 01 03 80 29 1f 79 2a 60 e5 a3 57 4b 9c 25
11 50 54 25 4b 00 a9 40 81 80 81 99 81 40 81 59
61 59 45 59 31 59 6f 2c 00 30 81 00 26 30 58 40
3f 00 34 36 31 00 00 1a d5 35 00 f8 80 00 20 30
48 38 1f 00 34 36 31 00 00 1a 26 4a 00 98 a1 00
2a 40 30 70 1c 00 34 36 31 00 00 1a 9b 40 00 68
81 00 28 30 70 48 1c 00 34 36 31 00 00 18 00 17

----------------

Block 0, Base EDID:
  EDID Structure Version & Revision: 1.3
  Vendor & Product Identification:
    Manufacturer: MTX
    Model: 768
    Serial Number: ...
    Made in: week 38 of 2005
  Basic Display Parameters & Features:
    Digital display
    Maximum image size: 41 cm x 31 cm
    Gamma: 2.21
    DPMS levels: Off
    RGB color display
    First detailed timing is preferred timing
  Color Characteristics:
    Red  : 0.6376, 0.3417
    Green: 0.2929, 0.6093
    Blue : 0.1474, 0.0683
    White: 0.3134, 0.3291
  Established Timings I & II:
    DMT 0x04:   640x480    59.940 Hz   4:3    31.469 kHz  25.175 MHz
    DMT 0x06:   640x480    75.000 Hz   4:3    37.500 kHz  31.500 MHz
    DMT 0x09:   800x600    60.317 Hz   4:3    37.879 kHz  40.000 MHz
    DMT 0x0b:   800x600    75.000 Hz   4:3    46.875 kHz  49.500 MHz
    DMT 0x10:  1024x768    60.004 Hz   4:3    48.363 kHz  65.000 MHz
    DMT 0x12:  1024x768    75.029 Hz   4:3    60.023 kHz  78.750 MHz
    DMT 0x24:  1280x1024   75.025 Hz   5:4    79.976 kHz 135.000 MHz
  Standard Timings:
    DMT 0x33:  1600x1200   60.000 Hz   4:3    75.000 kHz 162.000 MHz
    DMT 0x23:  1280x1024   60.020 Hz   5:4    63.981 kHz 108.000 MHz
    DMT 0x25:  1280x1024   85.024 Hz   5:4    91.146 kHz 157.500 MHz
    DMT 0x20:  1280x960    60.000 Hz   4:3    60.000 kHz 108.000 MHz
    DMT 0x21:  1280x960    85.002 Hz   4:3    85.938 kHz 148.500 MHz
    DMT 0x13:  1024x768    84.997 Hz   4:3    68.677 kHz  94.500 MHz
    DMT 0x0c:   800x600    85.061 Hz   4:3    53.674 kHz  56.250 MHz
    DMT 0x07:   640x480    85.008 Hz   4:3    43.269 kHz  36.000 MHz
  Detailed Timing Descriptors:
    DTD 1:  2048x768    60.004 Hz   8:3    48.363 kHz 113.750 MHz (820 mm x 310 mm)
                 Hfront   88 Hsync  64 Hback 152 Hpol P
                 Vfront    3 Vsync  15 Vback  20 Vpol N
    DTD 2:  2048x768    75.027 Hz   8:3    60.022 kHz 137.810 MHz (820 mm x 310 mm)
                 Hfront   72 Hsync  56 Hback 120 Hpol P
                 Vfront    1 Vsync  15 Vback  16 Vpol N
    DTD 3:  2560x1024   59.996 Hz   5:2    63.956 kHz 189.820 MHz (820 mm x 310 mm)
                 Hfront   48 Hsync 112 Hback 248 Hpol P
                 Vfront    1 Vsync  12 Vback  29 Vpol N
    DTD 4:  2048x768    85.004 Hz   8:3    68.684 kHz 165.390 MHz (820 mm x 310 mm)
                 Hfront  112 Hsync  72 Hback 176 Hpol N
                 Vfront    1 Vsync  12 Vback  27 Vpol N
Checksum: 0x17

----------------

Failures:

Block 0, Base EDID:
  Detailed Timing Descriptor #1: Mismatch of image size 820x310 mm vs display size 410x310 mm.
  Detailed Timing Descriptor #2: Mismatch of image size 820x310 mm vs display size 410x310 mm.
  Detailed Timing Descriptor #3: Mismatch of image size 820x310 mm vs display size 410x310 mm.
  Detailed Timing Descriptor #4: Mismatch of image size 820x310 mm vs display size 410x310 mm.
  Missing Display Product Name.
  Missing Display Range Limits Descriptor.

EDID conformity: FAIL
