edid-decode (hex):

00 ff ff ff ff ff ff 00 06 10 be 9c 00 00 00 00
11 13 01 03 80 1d 12 78 0a da e0 98 59 51 8c 24
22 50 54 00 00 00 01 01 01 01 01 01 01 01 01 01
01 01 01 01 01 01 52 1c 00 8f 50 20 2e 30 30 20
36 00 1e b3 10 00 00 18 00 00 00 01 00 06 10 20
00 00 00 00 00 00 00 00 0a 20 00 00 00 fe 00 4c
50 31 33 33 57 58 32 2d 54 4c 43 37 00 00 00 fe
00 43 6f 6c 6f 72 20 4c 43 44 0a 20 20 20 00 5d

----------------

Block 0, Base EDID:
  EDID Structure Version & Revision: 1.3
  Vendor & Product Identification:
    Manufacturer: APP
    Model: 40126
    Made in: week 17 of 2009
  Basic Display Parameters & Features:
    Digital display
    Maximum image size: 29 cm x 18 cm
    Gamma: 2.20
    RGB color display
    First detailed timing is the preferred timing
  Color Characteristics:
    Red  : 0.5966, 0.3486
    Green: 0.3183, 0.5488
    Blue : 0.1435, 0.1347
    White: 0.3125, 0.3281
  Established Timings I & II: none
  Standard Timings: none
  Detailed Timing Descriptors:
    DTD 1:  1280x800    60.223050 Hz   8:5     50.949 kHz     72.500000 MHz (286 mm x 179 mm)
                 Hfront   48 Hsync  32 Hback   63 Hpol N
                 Vfront    3 Vsync   6 Vback   37 Vpol N
    Manufacturer-Specified Display Descriptor (0x01): 00 01 00 06 10 20 00 00 00 00 00 00 00 00 0a 20 '..... ......... '
    Alphanumeric Data String: 'LP133WX2-TLC7'
    Alphanumeric Data String: 'Color LCD'
Checksum: 0x5d

----------------

Failures:

Block 0, Base EDID:
  Missing Display Product Name.
  Missing Display Range Limits Descriptor.

EDID conformity: FAIL
