edid-decode (hex):

00 ff ff ff ff ff ff 00 10 ac c3 a0 53 57 43 31
2f 1a 01 03 80 35 1e 78 ea 7c 15 a7 54 4b 9f 26
0d 50 54 a5 4b 00 81 00 b3 00 d1 00 71 4f a9 40
81 80 d1 c0 01 01 56 5e 00 a0 a0 a0 29 50 30 20
35 00 0f 28 21 00 00 1a 00 00 00 ff 00 33 52 4b
50 52 36 42 48 31 43 57 53 0a 00 00 00 fc 00 44
45 4c 4c 20 50 32 34 31 36 44 0a 20 00 00 00 fd
00 31 56 1d 71 1c 00 0a 20 20 20 20 20 20 01 aa

02 03 1b b1 50 90 05 04 03 02 07 16 01 06 11 12
15 13 14 1f 20 65 03 0c 00 10 00 02 3a 80 18 71
38 2d 40 58 2c 45 00 0f 28 21 00 00 1e 01 1d 80
18 71 1c 16 20 58 2c 25 00 0f 28 21 00 00 9e 01
1d 00 72 51 d0 1e 20 6e 28 55 00 0f 28 21 00 00
1e 8c 0a d0 8a 20 e0 2d 10 10 3e 96 00 0f 28 21
00 00 18 f4 4c 00 c0 82 80 2b 40 60 d8 35 48 0f
28 21 00 00 1c 00 00 00 00 00 00 00 00 00 00 53

----------------

Block 0, Base EDID:
  EDID Structure Version & Revision: 1.3
  Vendor & Product Identification:
    Manufacturer: DEL
    Model: 41155
    Serial Number: ...
    Made in: week 47 of 2016
  Basic Display Parameters & Features:
    Digital display
    Maximum image size: 53 cm x 30 cm
    Gamma: 2.20
    DPMS levels: Standby Suspend Off
    RGB color display
    First detailed timing is the preferred timing
  Color Characteristics:
    Red  : 0.6533, 0.3310
    Green: 0.2958, 0.6210
    Blue : 0.1484, 0.0517
    White: 0.3134, 0.3291
  Established Timings I & II:
    IBM     :   720x400    70.082 Hz   9:5    31.467 kHz  28.320 MHz
    DMT 0x04:   640x480    59.940 Hz   4:3    31.469 kHz  25.175 MHz
    DMT 0x06:   640x480    75.000 Hz   4:3    37.500 kHz  31.500 MHz
    DMT 0x09:   800x600    60.317 Hz   4:3    37.879 kHz  40.000 MHz
    DMT 0x0b:   800x600    75.000 Hz   4:3    46.875 kHz  49.500 MHz
    DMT 0x10:  1024x768    60.004 Hz   4:3    48.363 kHz  65.000 MHz
    DMT 0x12:  1024x768    75.029 Hz   4:3    60.023 kHz  78.750 MHz
    DMT 0x24:  1280x1024   75.025 Hz   5:4    79.976 kHz 135.000 MHz
  Standard Timings:
    DMT 0x1c:  1280x800    59.810 Hz  16:10   49.702 kHz  83.500 MHz
    DMT 0x3a:  1680x1050   59.954 Hz  16:10   65.290 kHz 146.250 MHz
    DMT 0x45:  1920x1200   59.885 Hz  16:10   74.556 kHz 193.250 MHz
    DMT 0x15:  1152x864    75.000 Hz   4:3    67.500 kHz 108.000 MHz
    DMT 0x33:  1600x1200   60.000 Hz   4:3    75.000 kHz 162.000 MHz
    DMT 0x23:  1280x1024   60.020 Hz   5:4    63.981 kHz 108.000 MHz
    DMT 0x52:  1920x1080   60.000 Hz  16:9    67.500 kHz 148.500 MHz
  Detailed Timing Descriptors:
    DTD 1:  2560x1440   59.951 Hz  16:9    88.787 kHz 241.500 MHz (527 mm x 296 mm)
                 Hfront   48 Hsync  32 Hback  80 Hpol P
                 Vfront    3 Vsync   5 Vback  33 Vpol N
    Display Product Serial Number: ...
    Display Product Name: 'DELL P2416D'
  Display Range Limits:
    Monitor ranges (GTF): 49-86 Hz V, 29-113 kHz H, max dotclock 280 MHz
  Extension blocks: 1
Checksum: 0xaa

----------------

Block 1, CTA-861 Extension Block:
  Revision: 3
  Underscans IT Video Formats by default
  Supports YCbCr 4:4:4
  Supports YCbCr 4:2:2
  Native detailed modes: 1
  Video Data Block:
    VIC  16:  1920x1080   60.000 Hz  16:9    67.500 kHz 148.500 MHz (native)
    VIC   5:  1920x1080i  60.000 Hz  16:9    33.750 kHz  74.250 MHz
    VIC   4:  1280x720    60.000 Hz  16:9    45.000 kHz  74.250 MHz
    VIC   3:   720x480    59.940 Hz  16:9    31.469 kHz  27.000 MHz
    VIC   2:   720x480    59.940 Hz   4:3    31.469 kHz  27.000 MHz
    VIC   7:  1440x480i   59.940 Hz  16:9    15.734 kHz  27.000 MHz
    VIC  22:  1440x576i   50.000 Hz  16:9    15.625 kHz  27.000 MHz
    VIC   1:   640x480    59.940 Hz   4:3    31.469 kHz  25.175 MHz
    VIC   6:  1440x480i   59.940 Hz   4:3    15.734 kHz  27.000 MHz
    VIC  17:   720x576    50.000 Hz   4:3    31.250 kHz  27.000 MHz
    VIC  18:   720x576    50.000 Hz  16:9    31.250 kHz  27.000 MHz
    VIC  21:  1440x576i   50.000 Hz   4:3    15.625 kHz  27.000 MHz
    VIC  19:  1280x720    50.000 Hz  16:9    37.500 kHz  74.250 MHz
    VIC  20:  1920x1080i  50.000 Hz  16:9    28.125 kHz  74.250 MHz
    VIC  31:  1920x1080   50.000 Hz  16:9    56.250 kHz 148.500 MHz
    VIC  32:  1920x1080   24.000 Hz  16:9    27.000 kHz  74.250 MHz
  Vendor-Specific Data Block (HDMI), OUI 00-0C-03:
    Source physical address: 1.0.0.0
  Detailed Timing Descriptors:
    DTD 2:  1920x1080   60.000 Hz  16:9    67.500 kHz 148.500 MHz (527 mm x 296 mm)
                 Hfront   88 Hsync  44 Hback 148 Hpol P
                 Vfront    4 Vsync   5 Vback  36 Vpol P
    DTD 3:  1920x1080i  60.000 Hz  16:9    33.750 kHz  74.250 MHz (527 mm x 296 mm)
                 Hfront   88 Hsync  44 Hback 148 Hpol P
                 Vfront    2 Vsync   5 Vback  15 Vpol P Vfront +0.5 Odd Field
                 Vfront    2 Vsync   5 Vback  15 Vpol P Vback  +0.5 Even Field
    DTD 4:  1280x720    60.000 Hz  16:9    45.000 kHz  74.250 MHz (527 mm x 296 mm)
                 Hfront  110 Hsync  40 Hback 220 Hpol P
                 Vfront    5 Vsync   5 Vback  20 Vpol P
    DTD 5:   720x480    59.940 Hz   3:2    31.469 kHz  27.000 MHz (527 mm x 296 mm)
                 Hfront   16 Hsync  62 Hback  60 Hpol N
                 Vfront    9 Vsync   6 Vback  30 Vpol N
    DTD 6:  2048x1152   59.903 Hz  16:9    71.584 kHz 197.000 MHz (527 mm x 296 mm)
                 Hfront  352 Hsync 216 Hback 136 Hpol N
                 Vfront   35 Vsync   5 Vback   3 Vpol P
Checksum: 0x53

----------------

Warnings:

Block 1, CTA-861 Extension Block:
  Display Product Serial Number is set, so the Serial Number in the Base EDID should be 0.
  Missing VCDB, needed for Set Selectable RGB Quantization to avoid interop issues.

Failures:

EDID:
  Base EDID: Some timings are out of range of the Monitor Ranges:
    Vertical Freq: 24.000 - 75.029 Hz (Monitor: 49.000 - 86.000 Hz)
    Horizontal Freq: 15.625 - 88.786 kHz (Monitor: 29.000 - 113.000 kHz)
  CTA-861: Native progressive timings are a mix of several resolutions.

EDID conformity: FAIL
