
EDID (hex):
00ffffffffffff0005e36b220b070000
0f1a010380301b782a43f5a756539c26
105054bfef00d1c0b300950081808140
81c001010101023a801871382d40582c
4500dd0c1100001e000000fd00324c1e
5311000a202020202020000000fc0032
323639574d0a202020202020000000ff
0041474247343941303031383033019f
02031ec14b1010101f04130313021301
230907078301000065030c001000011d
007251d01e206e285500dd0c11000018
011d007251d01e206e285500dd0c1100
001e011d007251d01e206e285500dd0c
11000018011d007251d01e206e285500
dd0c1100001800000000000000000000
00000000000000000000000000000047

edid-decode (hex):

00 ff ff ff ff ff ff 00 05 e3 6b 22 0b 07 00 00
0f 1a 01 03 80 30 1b 78 2a 43 f5 a7 56 53 9c 26
10 50 54 bf ef 00 d1 c0 b3 00 95 00 81 80 81 40
81 c0 01 01 01 01 02 3a 80 18 71 38 2d 40 58 2c
45 00 dd 0c 11 00 00 1e 00 00 00 fd 00 32 4c 1e
53 11 00 0a 20 20 20 20 20 20 00 00 00 fc 00 32
32 36 39 57 4d 0a 20 20 20 20 20 20 00 00 00 ff
00 41 47 42 47 34 39 41 30 30 31 38 30 33 01 9f

02 03 1e c1 4b 10 10 10 1f 04 13 03 13 02 13 01
23 09 07 07 83 01 00 00 65 03 0c 00 10 00 01 1d
00 72 51 d0 1e 20 6e 28 55 00 dd 0c 11 00 00 18
01 1d 00 72 51 d0 1e 20 6e 28 55 00 dd 0c 11 00
00 1e 01 1d 00 72 51 d0 1e 20 6e 28 55 00 dd 0c
11 00 00 18 01 1d 00 72 51 d0 1e 20 6e 28 55 00
dd 0c 11 00 00 18 00 00 00 00 00 00 00 00 00 00
00 00 00 00 00 00 00 00 00 00 00 00 00 00 00 47

----------------

Block 0, Base EDID:
  EDID Structure Version & Revision: 1.3
  Vendor & Product Identification:
    Manufacturer: AOC
    Model: 8811
    Serial Number: 1803
    Made in: week 15 of 2016
  Basic Display Parameters & Features:
    Digital display
    Maximum image size: 48 cm x 27 cm
    Gamma: 2.20
    DPMS levels: Off
    RGB color display
    First detailed timing is the preferred timing
  Color Characteristics:
    Red  : 0.6533, 0.3359
    Green: 0.3242, 0.6123
    Blue : 0.1513, 0.0654
    White: 0.3134, 0.3291
  Established Timings I & II:
    IBM     :   720x400    70.081663 Hz   9:5     31.467 kHz     28.320000 MHz
    DMT 0x04:   640x480    59.940476 Hz   4:3     31.469 kHz     25.175000 MHz
    Apple   :   640x480    66.666667 Hz   4:3     35.000 kHz     30.240000 MHz
    DMT 0x05:   640x480    72.808802 Hz   4:3     37.861 kHz     31.500000 MHz
    DMT 0x06:   640x480    75.000000 Hz   4:3     37.500 kHz     31.500000 MHz
    DMT 0x08:   800x600    56.250000 Hz   4:3     35.156 kHz     36.000000 MHz
    DMT 0x09:   800x600    60.316541 Hz   4:3     37.879 kHz     40.000000 MHz
    DMT 0x0a:   800x600    72.187572 Hz   4:3     48.077 kHz     50.000000 MHz
    DMT 0x0b:   800x600    75.000000 Hz   4:3     46.875 kHz     49.500000 MHz
    Apple   :   832x624    74.551266 Hz   4:3     49.726 kHz     57.284000 MHz
    DMT 0x10:  1024x768    60.003840 Hz   4:3     48.363 kHz     65.000000 MHz
    DMT 0x11:  1024x768    70.069359 Hz   4:3     56.476 kHz     75.000000 MHz
    DMT 0x12:  1024x768    75.028582 Hz   4:3     60.023 kHz     78.750000 MHz
    DMT 0x24:  1280x1024   75.024675 Hz   5:4     79.976 kHz    135.000000 MHz
  Standard Timings:
    DMT 0x52:  1920x1080   60.000000 Hz  16:9     67.500 kHz    148.500000 MHz
    DMT 0x3a:  1680x1050   59.954250 Hz  16:10    65.290 kHz    146.250000 MHz
    DMT 0x2f:  1440x900    59.887445 Hz  16:10    55.935 kHz    106.500000 MHz
    DMT 0x23:  1280x1024   60.019740 Hz   5:4     63.981 kHz    108.000000 MHz
    DMT 0x20:  1280x960    60.000000 Hz   4:3     60.000 kHz    108.000000 MHz
    DMT 0x55:  1280x720    60.000000 Hz  16:9     45.000 kHz     74.250000 MHz
  Detailed Timing Descriptors:
    DTD 1:  1920x1080   60.000000 Hz  16:9     67.500 kHz    148.500000 MHz (477 mm x 268 mm)
                 Hfront   88 Hsync  44 Hback  148 Hpol P
                 Vfront    4 Vsync   5 Vback   36 Vpol P
    Display Range Limits:
      Monitor ranges (GTF): 50-76 Hz V, 30-83 kHz H, max dotclock 170 MHz
    Display Product Name: '2269WM'
    Display Product Serial Number: 'AGBG49A001803'
  Extension blocks: 1
Checksum: 0x9f

----------------

Block 1, CTA-861 Extension Block:
  Revision: 3
  Underscans IT Video Formats by default
  Basic audio support
  Native detailed modes: 1
  Video Data Block:
    VIC  16:  1920x1080   60.000000 Hz  16:9     67.500 kHz    148.500000 MHz
    VIC  16:  1920x1080   60.000000 Hz  16:9     67.500 kHz    148.500000 MHz
    VIC  16:  1920x1080   60.000000 Hz  16:9     67.500 kHz    148.500000 MHz
    VIC  31:  1920x1080   50.000000 Hz  16:9     56.250 kHz    148.500000 MHz
    VIC   4:  1280x720    60.000000 Hz  16:9     45.000 kHz     74.250000 MHz
    VIC  19:  1280x720    50.000000 Hz  16:9     37.500 kHz     74.250000 MHz
    VIC   3:   720x480    59.940060 Hz  16:9     31.469 kHz     27.000000 MHz
    VIC  19:  1280x720    50.000000 Hz  16:9     37.500 kHz     74.250000 MHz
    VIC   2:   720x480    59.940060 Hz   4:3     31.469 kHz     27.000000 MHz
    VIC  19:  1280x720    50.000000 Hz  16:9     37.500 kHz     74.250000 MHz
    VIC   1:   640x480    59.940476 Hz   4:3     31.469 kHz     25.175000 MHz
  Audio Data Block:
    Linear PCM:
      Max channels: 2
      Supported sample rates (kHz): 48 44.1 32
      Supported sample sizes (bits): 24 20 16
  Speaker Allocation Data Block:
    FL/FR - Front Left/Right
  Vendor-Specific Data Block (HDMI), OUI 00-0C-03:
    Source physical address: 1.0.0.0
  Detailed Timing Descriptors:
    DTD 2:  1280x720    60.000000 Hz  16:9     45.000 kHz     74.250000 MHz (477 mm x 268 mm)
                 Hfront  110 Hsync  40 Hback  220 Hpol N
                 Vfront    5 Vsync   5 Vback   20 Vpol N
    DTD 3:  1280x720    60.000000 Hz  16:9     45.000 kHz     74.250000 MHz (477 mm x 268 mm)
                 Hfront  110 Hsync  40 Hback  220 Hpol P
                 Vfront    5 Vsync   5 Vback   20 Vpol P
    DTD 4:  1280x720    60.000000 Hz  16:9     45.000 kHz     74.250000 MHz (477 mm x 268 mm)
                 Hfront  110 Hsync  40 Hback  220 Hpol N
                 Vfront    5 Vsync   5 Vback   20 Vpol N
    DTD 5:  1280x720    60.000000 Hz  16:9     45.000 kHz     74.250000 MHz (477 mm x 268 mm)
                 Hfront  110 Hsync  40 Hback  220 Hpol N
                 Vfront    5 Vsync   5 Vback   20 Vpol N
Checksum: 0x47  Unused space in Extension Block: 25 bytes


