edid-decode (hex):

00 ff ff ff ff ff ff 00 0e 11 95 13 d4 01 02 01
30 0b 01 03 81 24 1d 78 ea 83 60 a6 57 48 9f 24
15 4c 4f bd ef 80 81 80 81 99 61 59 45 59 31 59
01 01 01 01 01 01 30 2a 00 98 51 00 2a 40 30 70
13 00 68 22 11 00 00 1e 00 00 00 fd 00 3a 55 20
5b 10 00 0a 20 20 20 20 20 20 00 00 00 0d 00 02
01 2e 03 e2 02 a8 0a bf 00 6b 02 33 00 00 00 fc
00 43 50 51 20 54 46 54 38 30 33 30 0a 20 00 27

----------------

Block 0, Base EDID:
  EDID Structure Version & Revision: 1.3
  Vendor & Product Identification:
    Manufacturer: CPQ
    Model: 5013
    Serial Number: ...
    Made in: week 48 of 2001
  Basic Display Parameters & Features:
    Digital display
    DFP 1.x compatible TMDS
    Maximum image size: 36 cm x 29 cm
    Gamma: 2.20
    DPMS levels: Standby Suspend Off
    RGB color display
    First detailed timing is preferred timing
  Color Characteristics:
    Red  : 0.6503, 0.3398
    Green: 0.2812, 0.6240
    Blue : 0.1416, 0.0839
    White: 0.2968, 0.3085
  Established Timings I & II:
    IBM     :   720x400    70.082 Hz   9:5    31.467 kHz  28.320 MHz
    DMT 0x04:   640x480    59.940 Hz   4:3    31.469 kHz  25.175 MHz
    Apple   :   640x480    66.667 Hz   4:3    35.000 kHz  30.240 MHz
    DMT 0x05:   640x480    72.809 Hz   4:3    37.861 kHz  31.500 MHz
    DMT 0x06:   640x480    75.000 Hz   4:3    37.500 kHz  31.500 MHz
    DMT 0x09:   800x600    60.317 Hz   4:3    37.879 kHz  40.000 MHz
    DMT 0x0a:   800x600    72.188 Hz   4:3    48.077 kHz  50.000 MHz
    DMT 0x0b:   800x600    75.000 Hz   4:3    46.875 kHz  49.500 MHz
    Apple   :   832x624    74.551 Hz   4:3    49.726 kHz  57.284 MHz
    DMT 0x10:  1024x768    60.004 Hz   4:3    48.363 kHz  65.000 MHz
    DMT 0x11:  1024x768    70.069 Hz   4:3    56.476 kHz  75.000 MHz
    DMT 0x12:  1024x768    75.029 Hz   4:3    60.023 kHz  78.750 MHz
    DMT 0x24:  1280x1024   75.025 Hz   5:4    79.976 kHz 135.000 MHz
    Apple   :  1152x870    75.062 Hz 192:145  68.681 kHz 100.000 MHz
  Standard Timings:
    DMT 0x23:  1280x1024   60.020 Hz   5:4    63.981 kHz 108.000 MHz
    DMT 0x25:  1280x1024   85.024 Hz   5:4    91.146 kHz 157.500 MHz
    DMT 0x13:  1024x768    84.997 Hz   4:3    68.677 kHz  94.500 MHz
    DMT 0x0c:   800x600    85.061 Hz   4:3    53.674 kHz  56.250 MHz
    DMT 0x07:   640x480    85.008 Hz   4:3    43.269 kHz  36.000 MHz
  Detailed Timing Descriptors:
    DTD 1:  1280x1024   60.020 Hz   5:4    63.981 kHz 108.000 MHz (360 mm x 290 mm)
                 Hfront   48 Hsync 112 Hback 248 Hpol P
                 Vfront    1 Vsync   3 Vback  38 Vpol P
  Display Range Limits:
    Monitor ranges (GTF): 58-85 Hz V, 32-91 kHz H, max dotclock 160 MHz
    Manufacturer-Specified Display Descriptor (0x0d): 00 0d 00 02 01 2e 03 e2 02 a8 0a bf 00 6b 02 33 '.............k.3'
    Display Product Name: 'CPQ TFT8030'
Checksum: 0x27
