
EDID (hex):
00ffffffffffff0030aebd6001010101
151901030e291778ea9915a55551a027
105054afef00818a8180714f01010101
010101010101662156aa51001e30468f
33009ae61000001e000000fd00324c1e
410e000a202020202020000000fc0045
31393232732020576964650a000000ff
0056393031473130310a202020200008

Extracted contents:
header:          00 ff ff ff ff ff ff 00
serial number:   30 ae bd 60 01 01 01 01 15 19
version:         01 03
basic params:    0e 29 17 78 ea
chroma info:     99 15 a5 55 51 a0 27 10 50 54
established:     af ef 00
standard:        81 8a 81 80 71 4f 01 01 01 01 01 01 01 01 01 01
descriptor 1:    66 21 56 aa 51 00 1e 30 46 8f 33 00 9a e6 10 00 00 1e
descriptor 2:    00 00 00 fd 00 32 4c 1e 41 0e 00 0a 20 20 20 20 20 20
descriptor 3:    00 00 00 fc 00 45 31 39 32 32 73 20 20 57 69 64 65 0a
descriptor 4:    00 00 00 ff 00 56 39 30 31 47 31 30 31 0a 20 20 20 20
extensions:      00
checksum:        08

EDID version: 1.3
Manufacturer: LEN Model 60bd Serial Number --
Made in week 21 of 2015
Analog display, Input voltage level: 0.7/0.3 V
Sync: Separate Composite SyncOnGreen 
Maximum image size: 41 cm x 23 cm
Gamma: 2.20
DPMS levels: Standby Suspend Off
RGB color display
First detailed timing is preferred timing
Display x,y Chromaticity:
  Red:   0.6464, 0.3330
  Green: 0.3183, 0.6259
  Blue:  0.1523, 0.0634
  White: 0.3134, 0.3291
Established timings supported:
  720x400@70Hz 9:5 HorFreq: 31469 Hz Clock: 28.320 MHz
  640x480@60Hz 4:3 HorFreq: 31469 Hz Clock: 25.175 MHz
  640x480@72Hz 4:3 HorFreq: 37900 Hz Clock: 31.500 MHz
  640x480@75Hz 4:3 HorFreq: 37500 Hz Clock: 31.500 MHz
  800x600@56Hz 4:3 HorFreq: 35200 Hz Clock: 36.000 MHz
  800x600@60Hz 4:3 HorFreq: 37900 Hz Clock: 40.000 MHz
  800x600@72Hz 4:3 HorFreq: 48100 Hz Clock: 50.000 MHz
  800x600@75Hz 4:3 HorFreq: 46900 Hz Clock: 49.500 MHz
  832x624@75Hz 4:3 HorFreq: 49726 Hz Clock: 57.284 MHz
  1024x768@60Hz 4:3 HorFreq: 48400 Hz Clock: 65.000 MHz
  1024x768@70Hz 4:3 HorFreq: 56500 Hz Clock: 75.000 MHz
  1024x768@75Hz 4:3 HorFreq: 60000 Hz Clock: 78.750 MHz
  1280x1024@75Hz 5:4 HorFreq: 80000 Hz Clock: 135.000 MHz
Standard timings supported:
  1280x1024@70Hz 5:4
  1280x1024@60Hz 5:4 HorFreq: 64000 Hz Clock: 108.000 MHz
  1152x864@75Hz 4:3 HorFreq: 67500 Hz Clock: 108.000 MHz
Detailed mode: Clock 85.500 MHz, 410 mm x 230 mm
               1366 1436 1579 1792 hborder 0
                768  771  774  798 vborder 0
               +hsync +vsync 
               VertFreq: 59 Hz, HorFreq: 47712 Hz
Monitor ranges (GTF): 50-76Hz V, 30-65kHz H, max dotclock 140MHz
Monitor name: E1922s  Wide
Serial number: --
Checksum: 0x8 (valid)
One or more of the timings is out of range of the Monitor Ranges:
  Vertical Freq: 56 - 75 Hz
  Horizontal Freq: 31469 - 80000 Hz
  Maximum Clock: 135.000 MHz
