edid-decode (hex):

00 ff ff ff ff ff ff 00 69 33 d5 4e 53 00 00 00
01 1e 01 04 b5 3d 22 78 06 5f b5 a2 57 4f a2 28
0f 50 54 00 00 00 01 01 01 01 01 01 01 01 01 01
01 01 01 01 01 01 60 cc 80 50 70 38 0a 40 10 20
13 00 6b 5c 21 00 00 1e 78 69 80 50 70 38 2d 40
10 20 35 00 6b 5c 21 00 00 1e 00 00 00 fc 00 5a
57 53 20 32 38 22 20 32 34 30 48 5a 00 00 00 fd
0a 1e e1 84 19 38 01 0a 20 20 20 20 20 20 01 42

02 03 0a 02 65 03 0c 00 10 00 60 cc 80 50 70 38
0a 40 10 20 13 00 6b 5c 21 00 00 1e 78 69 80 50
70 38 2d 40 10 20 35 00 35 ae 10 00 00 1e 00 00
00 00 00 00 00 00 00 00 00 00 00 00 00 00 00 00
00 00 00 00 00 00 00 00 00 00 00 00 00 00 00 00
00 00 00 00 00 00 00 00 00 00 00 00 00 00 00 00
00 00 00 00 00 00 00 00 00 00 00 00 00 00 00 00
00 00 00 00 00 00 00 00 00 00 00 00 00 00 00 f8

----------------

Block 0, Base EDID:
  EDID Structure Version & Revision: 1.4
  Vendor & Product Identification:
    Manufacturer: ZIS
    Model: 20181
    Serial Number: ...
    Made in: week 1 of 2020
  Basic Display Parameters & Features:
    Digital display
    Bits per primary color channel: 10
    DisplayPort interface
    Maximum image size: 61 cm x 34 cm
    Gamma: 2.20
    Supported color formats: RGB 4:4:4
    Default (sRGB) color space is primary color space
    First detailed timing includes the native pixel format and preferred refresh rate
  Color Characteristics:
    Red  : 0.6337, 0.3408
    Green: 0.3115, 0.6357
    Blue : 0.1582, 0.0615
    White: 0.3134, 0.3291
  Established Timings I & II: none
  Standard Timings: none
  Detailed Timing Descriptors:
    DTD 1:  1920x1080  240.000000 Hz  16:9    261.600 kHz    523.200000 MHz (619 mm x 348 mm)
                 Hfront   16 Hsync  32 Hback   32 Hpol P
                 Vfront    1 Vsync   3 Vback    6 Vpol P
    DTD 2:  1920x1080  120.000000 Hz  16:9    135.000 kHz    270.000000 MHz (619 mm x 348 mm)
                 Hfront   16 Hsync  32 Hback   32 Hpol P
                 Vfront    3 Vsync   5 Vback   37 Vpol P
    Display Product Name: 'ZWS 28" 240HZ'
    Display Range Limits:
      Monitor ranges (Bare Limits): 30-480 Hz V, 132-280 kHz H, max dotclock 560 MHz
  Extension blocks: 1
Checksum: 0x42

----------------

Block 1, CTA-861 Extension Block:
  Revision: 3
  Native detailed modes: 2
  Vendor-Specific Data Block (HDMI), OUI 00-0C-03:
    Source physical address: 1.0.0.0
  Detailed Timing Descriptors:
    DTD 3:  1920x1080  240.000000 Hz  16:9    261.600 kHz    523.200000 MHz (619 mm x 348 mm)
                 Hfront   16 Hsync  32 Hback   32 Hpol P
                 Vfront    1 Vsync   3 Vback    6 Vpol P
    DTD 4:  1920x1080  120.000000 Hz  16:9    135.000 kHz    270.000000 MHz (309 mm x 174 mm)
                 Hfront   16 Hsync  32 Hback   32 Hpol P
                 Vfront    3 Vsync   5 Vback   37 Vpol P
Checksum: 0xf8  Unused space in Extension Block: 81 bytes

----------------

Warnings:

Block 1, CTA-861 Extension Block:
  IT Video Formats are overscanned by default, but normally this should be underscanned.
EDID:
  CTA-861: Multiple native progressive timings are defined.

Failures:

Block 0, Base EDID:
  Basic Display Parameters & Features: sRGB is signaled, but the chromaticities do not match.
Block 1, CTA-861 Extension Block:
  Vendor-Specific Data Block (HDMI), OUI 00-0C-03: The HDMI Specification requires EDID 1.3 instead of 1.4.
  Detailed Timing Descriptor #4: Mismatch of image size 309x174 mm vs display size 610x340 mm.
  Required 640x480p60 timings are missing in the established timings and the SVD list (VIC 1).
  Missing VCDB, needed for Set Selectable RGB Quantization to avoid interop issues.

EDID conformity: FAIL
