edid-decode (hex):

00 ff ff ff ff ff ff 00 22 f0 2f 19 00 00 00 00
24 17 01 04 a5 3c 22 78 22 ed e0 a6 55 4d 9e 25
0c 50 54 00 00 00 01 01 01 01 01 01 01 01 01 01
01 01 01 01 01 01 56 5e 00 a0 a0 a0 29 50 30 20
22 02 55 50 21 00 00 1a 1a 1d 00 80 51 d0 1c 20
40 80 75 00 55 50 21 00 00 1e 00 00 00 fc 00 48
50 20 5a 31 20 47 65 6e 32 0a 20 20 00 00 00 ff
00 43 4e 54 30 30 30 30 31 30 31 30 0a 20 00 24

----------------

Block 0, Base EDID:
  EDID Structure Version & Revision: 1.4
  Vendor & Product Identification:
    Manufacturer: HWP
    Model: 6447
    Made in: week 36 of 2013
  Basic Display Parameters & Features:
    Digital display
    Bits per primary color channel: 8
    DisplayPort interface
    Maximum image size: 60 cm x 34 cm
    Gamma: 2.20
    DPMS levels: Off
    Supported color formats: RGB 4:4:4
    First detailed timing includes the native pixel format and preferred refresh rate
  Color Characteristics:
    Red  : 0.6513, 0.3339
    Green: 0.3037, 0.6181
    Blue : 0.1474, 0.0488
    White: 0.3125, 0.3281
  Established Timings I & II: none
  Standard Timings: none
  Detailed Timing Descriptors:
    DTD 1:  2560x1440   59.951 Hz  16:9    88.787 kHz 241.500 MHz (597 mm x 336 mm)
                 Hfront   48 Hsync  32 Hback  80 Hpol P
                 Vfront    2 Vsync  34 Vback   5 Vpol N
    DTD 2:  1280x720    59.855 Hz  16:9    44.772 kHz  74.500 MHz (597 mm x 336 mm)
                 Hfront   64 Hsync 128 Hback 192 Hpol P
                 Vfront    7 Vsync   5 Vback  16 Vpol P
    Display Product Name: 'HP Z1 Gen2'
    Display Product Serial Number: ...
Checksum: 0x24

----------------

EDID conformity: PASS
