edid-decode (hex):

00 ff ff ff ff ff ff 00 05 e3 43 20 8f 04 00 00
04 15 01 03 68 2c 19 78 2a 5b 85 a3 59 54 9b 27
0f 50 54 bf ee 00 31 0a 61 40 61 4c 61 4f 81 c0
a9 c0 01 01 01 01 30 2a 40 c8 60 84 64 30 18 50
13 00 bb f9 10 00 00 1e 00 00 00 ff 00 41 45 43
42 31 4f 32 30 30 31 31 36 37 00 00 00 fd 00 37
4b 1e 51 0e 00 0a 20 20 20 20 20 20 00 00 00 fc
00 32 30 34 33 0a 20 20 20 20 20 20 20 20 00 cc

00 ff ff ff ff ff ff 00 05 e3 43 20 8f 04 00 00
04 15 01 03 68 2c 19 78 2a 5b 85 a3 59 54 9b 27
0f 50 54 bf ee 00 31 0a 61 40 61 4c 61 4f 81 c0
a9 c0 01 01 01 01 30 2a 40 c8 60 84 64 30 18 50
13 00 bb f9 10 00 00 1e 00 00 00 ff 00 41 45 43
42 31 4f 32 30 30 31 31 36 37 00 00 00 fd 00 37
4b 1e 51 0e 00 0a 20 20 20 20 20 20 00 00 00 fc
00 32 30 34 33 0a 20 20 20 20 20 20 20 20 00 cc

----------------

Block 0, Base EDID:
  EDID Structure Version & Revision: 1.3
  Vendor & Product Identification:
    Manufacturer: AOC
    Model: 8259
    Serial Number: ...
    Made in: week 4 of 2011
  Basic Display Parameters & Features:
    Analog display
    Signal Level Standard: 0.700 : 0.000 : 0.700 V p-p
    Blank level equals black level
    Sync: Separate
    Maximum image size: 44 cm x 25 cm
    Gamma: 2.20
    DPMS levels: Off
    RGB color display
    First detailed timing is the preferred timing
  Color Characteristics:
    Red  : 0.6376, 0.3486
    Green: 0.3300, 0.6083
    Blue : 0.1542, 0.0585
    White: 0.3134, 0.3291
  Established Timings I & II:
    IBM     :   720x400    70.081663 Hz   9:5     31.467 kHz     28.320000 MHz
    DMT 0x04:   640x480    59.940476 Hz   4:3     31.469 kHz     25.175000 MHz
    Apple   :   640x480    66.666667 Hz   4:3     35.000 kHz     30.240000 MHz
    DMT 0x05:   640x480    72.808802 Hz   4:3     37.861 kHz     31.500000 MHz
    DMT 0x06:   640x480    75.000000 Hz   4:3     37.500 kHz     31.500000 MHz
    DMT 0x08:   800x600    56.250000 Hz   4:3     35.156 kHz     36.000000 MHz
    DMT 0x09:   800x600    60.316541 Hz   4:3     37.879 kHz     40.000000 MHz
    DMT 0x0a:   800x600    72.187572 Hz   4:3     48.077 kHz     50.000000 MHz
    DMT 0x0b:   800x600    75.000000 Hz   4:3     46.875 kHz     49.500000 MHz
    Apple   :   832x624    74.551266 Hz   4:3     49.726 kHz     57.284000 MHz
    DMT 0x10:  1024x768    60.003840 Hz   4:3     48.363 kHz     65.000000 MHz
    DMT 0x11:  1024x768    70.069359 Hz   4:3     56.476 kHz     75.000000 MHz
    DMT 0x12:  1024x768    75.028582 Hz   4:3     60.023 kHz     78.750000 MHz
  Standard Timings:
    GTF     :   640x400    70.000000 Hz  16:10    29.190 kHz     23.352000 MHz
    DMT 0x10:  1024x768    60.003840 Hz   4:3     48.363 kHz     65.000000 MHz
    DMT 0x11:  1024x768    70.069359 Hz   4:3     56.476 kHz     75.000000 MHz
    DMT 0x12:  1024x768    75.028582 Hz   4:3     60.023 kHz     78.750000 MHz
    DMT 0x55:  1280x720    60.000000 Hz  16:9     45.000 kHz     74.250000 MHz
    DMT 0x53:  1600x900    60.000000 Hz  16:9     60.000 kHz    108.000000 MHz (RB)
  Detailed Timing Descriptors:
    DTD 1:  1600x900    60.000000 Hz  16:9     60.000 kHz    108.000000 MHz (443 mm x 249 mm)
                 Hfront   24 Hsync  80 Hback   96 Hpol P
                 Vfront    1 Vsync   3 Vback   96 Vpol P
    Display Product Serial Number: ...
    Display Range Limits:
      Monitor ranges (GTF): 55-75 Hz V, 30-81 kHz H, max dotclock 140 MHz
    Display Product Name: '2043'
Checksum: 0xcc

----------------

Block 1, Unknown EDID Extension Block 0x00:
  00 ff ff ff ff ff ff 00 05 e3 43 20 8f 04 00 00 '..........C ....'
  04 15 01 03 68 2c 19 78 2a 5b 85 a3 59 54 9b 27 '....h,.x*[..YT.''
  0f 50 54 bf ee 00 31 0a 61 40 61 4c 61 4f 81 c0 '.PT...1.a@aLaO..'
  a9 c0 01 01 01 01 30 2a 40 c8 60 84 64 30 18 50 '......0*@.`.d0.P'
  13 00 bb f9 10 00 00 1e 00 00 00 ff 00 41 45 43 '.............AEC'
  42 31 4f 32 30 30 31 31 36 37 00 00 00 fd 00 37 'B1O2001167.....7'
  4b 1e 51 0e 00 0a 20 20 20 20 20 20 00 00 00 fc 'K.Q...      ....'
  00 32 30 34 33 0a 20 20 20 20 20 20 20 20 00 cc '.2043.        ..'
Checksum: 0xcc

----------------

Warnings:

EDID:
  Base EDID: Some timings are out of range of the Monitor Ranges:
    Horizontal Freq: 29.190 - 60.022 kHz (Monitor: 30.000 - 81.000 kHz)
    Could be due to a Monitor Range off-by-one rounding issue

Failures:

Block 1, Base EDID:
  Unknown Extension Block.
EDID:
  Base EDID: EDID specified 0 extension block(s), but found 1 extension block(s).

EDID conformity: FAIL
