edid-decode (hex):

00 ff ff ff ff ff ff 00 06 af b5 c4 b5 c4 00 00
19 22 01 04 b5 22 16 78 03 b2 af ad 51 44 af 26
0f 4f 53 00 00 00 01 01 01 01 01 01 01 01 01 01
01 01 01 01 01 01 bb aa 80 a0 c0 d0 a8 70 6c 30
aa 00 58 d7 10 00 00 18 00 00 00 fd 0c 30 a5 67
67 78 01 0a 20 20 20 20 20 20 00 00 00 fe 00 41
55 4f 0a 20 20 20 20 20 20 20 20 20 00 00 00 fc
00 42 31 36 30 51 41 4e 30 34 2e 55 20 0a 02 f0

70 20 79 02 00 22 00 14 13 57 12 05 7f 0c 9f 00
6b 80 2f 00 cf 07 a7 00 09 00 09 00 25 01 09 13
57 12 13 57 12 30 a5 80 2b 00 0c 27 00 3c a4 00
00 27 00 30 3b 00 00 81 00 20 e3 05 80 00 e6 06
07 01 6b 6b 47 74 1a 00 00 03 01 30 a5 00 20 6b
47 6b 47 a5 00 00 00 00 8d 00 00 00 00 00 00 00
00 00 00 00 00 00 00 00 00 00 00 00 00 00 00 00
00 00 00 00 00 00 00 00 00 00 00 00 00 00 58 90

02 03 0f 00 e3 05 80 00 e6 06 05 01 6b 6b 47 00
00 00 00 00 00 00 00 00 00 00 00 00 00 00 00 00
00 00 00 00 00 00 00 00 00 00 00 00 00 00 00 00
00 00 00 00 00 00 00 00 00 00 00 00 00 00 00 00
00 00 00 00 00 00 00 00 00 00 00 00 00 00 00 00
00 00 00 00 00 00 00 00 00 00 00 00 00 00 00 00
00 00 00 00 00 00 00 00 00 00 00 00 00 00 00 00
00 00 00 00 00 00 00 00 00 00 00 00 00 00 00 75

00 ff ff ff ff ff ff 00 06 af b5 c4 b5 c4 00 00
19 22 01 04 b5 22 16 78 03 b2 af ad 51 44 af 26
0f 4f 53 00 00 00 01 01 01 01 01 01 01 01 01 01
01 01 01 01 01 01 bb aa 80 a0 c0 d0 a8 70 6c 30
aa 00 58 d7 10 00 00 18 00 00 00 fd 0c 30 a5 67
67 78 01 0a 20 20 20 20 20 20 00 00 00 fe 00 41
55 4f 0a 20 20 20 20 20 20 20 20 20 00 00 00 fc
00 42 31 36 30 51 41 4e 30 34 2e 55 20 0a 02 f0

70 20 79 02 00 22 00 14 13 57 12 05 7f 0c 9f 00
6b 80 2f 00 cf 07 a7 00 09 00 09 00 25 01 09 13
57 12 13 57 12 30 a5 80 2b 00 0c 27 00 3c a4 00
00 27 00 30 3b 00 00 81 00 20 e3 05 80 00 e6 06
07 01 6b 6b 47 74 1a 00 00 03 01 30 a5 00 20 6b
47 6b 47 a5 00 00 00 00 8d 00 00 00 00 00 00 00
00 00 00 00 00 00 00 00 00 00 00 00 00 00 00 00
00 00 00 00 00 00 00 00 00 00 00 00 00 00 58 90

02 03 0f 00 e3 05 80 00 e6 06 05 01 6b 6b 47 00
00 00 00 00 00 00 00 00 00 00 00 00 00 00 00 00
00 00 00 00 00 00 00 00 00 00 00 00 00 00 00 00
00 00 00 00 00 00 00 00 00 00 00 00 00 00 00 00
00 00 00 00 00 00 00 00 00 00 00 00 00 00 00 00
00 00 00 00 00 00 00 00 00 00 00 00 00 00 00 00
00 00 00 00 00 00 00 00 00 00 00 00 00 00 00 00
00 00 00 00 00 00 00 00 00 00 00 00 00 00 00 75

----------------

Block 0, Base EDID:
  EDID Structure Version & Revision: 1.4
  Vendor & Product Identification:
    Manufacturer: AUO
    Model: 50357
    Serial Number: ...
    Made in: week 25 of 2024
  Basic Display Parameters & Features:
    Digital display
    Bits per primary color channel: 10
    DisplayPort interface
    Maximum image size: 34 cm x 22 cm
    Gamma: 2.20
    Supported color formats: RGB 4:4:4
    First detailed timing includes the native pixel format and preferred refresh rate
    Display is continuous frequency
  Color Characteristics:
    Red  : 0.6777, 0.3193
    Green: 0.2656, 0.6855
    Blue : 0.1503, 0.0605
    White: 0.3115, 0.3271
  Established Timings I & II: none
  Standard Timings: none
  Detailed Timing Descriptors:
    DTD 1:  3200x2000   60.000165 Hz  16:10   130.080 kHz    437.070000 MHz (344 mm x 215 mm)
                 Hfront  108 Hsync  48 Hback    4 Hpol N
                 Vfront   10 Vsync  10 Vback  148 Vpol N
    Display Range Limits:
      Monitor ranges (Bare Limits): 48-165 Hz V, 358-358 kHz H, max dotclock 1200 MHz
    Alphanumeric Data String: 'AUO'
    Display Product Name: 'B160QAN04.U '
  Extension blocks: 2
Checksum: 0xf0

----------------

Block 1, DisplayID Extension Block:
  Version: 2.0
  Extension Count: 0
  Display Product Primary Use Case: None of the listed primary use cases; generic display
  Video Timing Modes Type 7 - Detailed Timings Data Block:
    DTD:  3200x2000  165.000110 Hz  16:10   357.720 kHz   1201.940000 MHz (aspect 16:10, no 3D stereo)
               Hfront  108 Hsync  48 Hback    4 Hpol P
               Vfront   10 Vsync  10 Vback  148 Vpol N
  Dynamic Video Timing Range Limits Data Block:
    Minimum Pixel Clock: 1201940 kHz
    Maximum Pixel Clock: 1201940 kHz
    Minimum Vertical Refresh Rate: 48 Hz
    Maximum Vertical Refresh Rate: 165 Hz
    Seamless Dynamic Video Timing Support: Yes
  Adaptive Sync Data Block:
    Descriptor #1:
      Native Panel Range
      Fixed Average V-Total and Adaptive V-Total
      'Max Single Frame Duration Increase' field value without jitter impact
      'Max Single Frame Duration Decrease' field value without jitter impact
      Max Duration Increase: 0.00 ms
      Max Duration Decrease: 0.00 ms
      Min Refresh Rate: 60 Hz
      Max Refresh Rate: 165 Hz
    Descriptor #2:
      Native Panel Range
      Fixed Average V-Total and Adaptive V-Total
      'Max Single Frame Duration Increase' field value without jitter impact
      'Max Single Frame Duration Decrease' field value without jitter impact
      Max Duration Increase: 0.00 ms
      Max Duration Decrease: 0.00 ms
      Min Refresh Rate: 48 Hz
      Max Refresh Rate: 60 Hz
  CTA-861 DisplayID Data Block:
  Colorimetry Data Block:
    BT2020RGB
  HDR Static Metadata Data Block:
    Electro optical transfer functions:
      Traditional gamma - SDR luminance range
      Traditional gamma - HDR luminance range
      SMPTE ST2084
    Supported static metadata descriptors:
      Static metadata type 1
    Desired content max luminance: 107 (507.620 cd/m^2)
    Desired content max frame-average luminance: 107 (507.620 cd/m^2)
    Desired content min luminance: 71 (0.394 cd/m^2)
  Vendor-Specific Data Block (AMD), OUI 00-00-1A:
    Version: 3.1
    Minimum Refresh Rate: 48 Hz
    Maximum Refresh Rate: 165 Hz
    Flags 1.x: 0x00
    Flags 2.x: 0x20
    Maximum luminance: 107 (507.620 cd/m^2)
    Minimum luminance: 71 (0.394 cd/m^2)
    Unknown: 0x6b 0x47
  Checksum: 0x58
Checksum: 0x90

----------------

Block 2, CTA-861 Extension Block:
  Revision: 3
  Native detailed modes: 0
  Colorimetry Data Block:
    BT2020RGB
  HDR Static Metadata Data Block:
    Electro optical transfer functions:
      Traditional gamma - SDR luminance range
      SMPTE ST2084
    Supported static metadata descriptors:
      Static metadata type 1
    Desired content max luminance: 107 (507.620 cd/m^2)
    Desired content max frame-average luminance: 107 (507.620 cd/m^2)
    Desired content min luminance: 71 (0.394 cd/m^2)
Checksum: 0x75  Unused space in Extension Block: 112 bytes

----------------

Block 3, Unknown EDID Extension Block 0x00:
  00 ff ff ff ff ff ff 00 06 af b5 c4 b5 c4 00 00 '................'
  19 22 01 04 b5 22 16 78 03 b2 af ad 51 44 af 26 '."...".x....QD.&'
  0f 4f 53 00 00 00 01 01 01 01 01 01 01 01 01 01 '.OS.............'
  01 01 01 01 01 01 bb aa 80 a0 c0 d0 a8 70 6c 30 '.............pl0'
  aa 00 58 d7 10 00 00 18 00 00 00 fd 0c 30 a5 67 '..X..........0.g'
  67 78 01 0a 20 20 20 20 20 20 00 00 00 fe 00 41 'gx..      .....A'
  55 4f 0a 20 20 20 20 20 20 20 20 20 00 00 00 fc 'UO.         ....'
  00 42 31 36 30 51 41 4e 30 34 2e 55 20 0a 02 f0 '.B160QAN04.U ...'
Checksum: 0xf0

----------------

Block 4, DisplayID Extension Block:
  Version: 2.0
  Extension Count: 0
  Video Timing Modes Type 7 - Detailed Timings Data Block:
    DTD:  3200x2000  165.000110 Hz  16:10   357.720 kHz   1201.940000 MHz (aspect 16:10, no 3D stereo)
               Hfront  108 Hsync  48 Hback    4 Hpol P
               Vfront   10 Vsync  10 Vback  148 Vpol N
  Dynamic Video Timing Range Limits Data Block:
    Minimum Pixel Clock: 1201940 kHz
    Maximum Pixel Clock: 1201940 kHz
    Minimum Vertical Refresh Rate: 48 Hz
    Maximum Vertical Refresh Rate: 165 Hz
    Seamless Dynamic Video Timing Support: Yes
  Adaptive Sync Data Block:
    Descriptor #1:
      Native Panel Range
      Fixed Average V-Total and Adaptive V-Total
      'Max Single Frame Duration Increase' field value without jitter impact
      'Max Single Frame Duration Decrease' field value without jitter impact
      Max Duration Increase: 0.00 ms
      Max Duration Decrease: 0.00 ms
      Min Refresh Rate: 60 Hz
      Max Refresh Rate: 165 Hz
    Descriptor #2:
      Native Panel Range
      Fixed Average V-Total and Adaptive V-Total
      'Max Single Frame Duration Increase' field value without jitter impact
      'Max Single Frame Duration Decrease' field value without jitter impact
      Max Duration Increase: 0.00 ms
      Max Duration Decrease: 0.00 ms
      Min Refresh Rate: 48 Hz
      Max Refresh Rate: 60 Hz
  CTA-861 DisplayID Data Block:
  Colorimetry Data Block:
    BT2020RGB
  HDR Static Metadata Data Block:
    Electro optical transfer functions:
      Traditional gamma - SDR luminance range
      Traditional gamma - HDR luminance range
      SMPTE ST2084
    Supported static metadata descriptors:
      Static metadata type 1
    Desired content max luminance: 107 (507.620 cd/m^2)
    Desired content max frame-average luminance: 107 (507.620 cd/m^2)
    Desired content min luminance: 71 (0.394 cd/m^2)
  Vendor-Specific Data Block (AMD), OUI 00-00-1A:
    Version: 3.1
    Minimum Refresh Rate: 48 Hz
    Maximum Refresh Rate: 165 Hz
    Flags 1.x: 0x00
    Flags 2.x: 0x20
    Maximum luminance: 107 (507.620 cd/m^2)
    Minimum luminance: 71 (0.394 cd/m^2)
    Unknown: 0x6b 0x47
  Checksum: 0x58
Checksum: 0x90

----------------

Block 5, CTA-861 Extension Block:
  Revision: 3
  Native detailed modes: 0
  Colorimetry Data Block:
    BT2020RGB
  HDR Static Metadata Data Block:
    Electro optical transfer functions:
      Traditional gamma - SDR luminance range
      SMPTE ST2084
    Supported static metadata descriptors:
      Static metadata type 1
    Desired content max luminance: 107 (507.620 cd/m^2)
    Desired content max frame-average luminance: 107 (507.620 cd/m^2)
    Desired content min luminance: 71 (0.394 cd/m^2)
Checksum: 0x75  Unused space in Extension Block: 112 bytes

----------------

Warnings:

Block 1, DisplayID Extension Block:
  Colorimetry Data Block: Set the sRGB colorimetry bit to avoid interop issues.
Block 2, CTA-861 Extension Block:
  IT Video Formats are overscanned by default, but normally this should be underscanned.
  Colorimetry Data Block: Set the sRGB colorimetry bit to avoid interop issues.
Block 4, DisplayID Extension Block:
  Colorimetry Data Block: Set the sRGB colorimetry bit to avoid interop issues.
Block 5, CTA-861 Extension Block:
  IT Video Formats are overscanned by default, but normally this should be underscanned.
  Colorimetry Data Block: Set the sRGB colorimetry bit to avoid interop issues.
EDID:
  Base EDID: Some timings are out of range of the Monitor Ranges:
    Horizontal Freq: 130.080 - 357.720 kHz (Monitor: 358.000 - 358.000 kHz)
    Maximum Clock: 1201.940 MHz (Monitor: 1200.000 MHz)

Failures:

Block 0, Base EDID:
  Display Product Name: One or more trailing spaces.
Block 1, DisplayID Extension Block:
  Expected 0 DisplayID Extension Block, but got 1.
Block 2, CTA-861 Extension Block:
  Required 640x480p60 timings are missing in the established timings and the SVD list (VIC 1).
  Missing VCDB, needed for Set Selectable RGB Quantization to avoid interop issues.
Block 3, Base EDID:
  Unknown Extension Block.
Block 4, DisplayID Extension Block:
  Product Type should be 0 in extension block.
  Colorimetry Data Block: Only one instance of this Data Block is allowed.
  HDR Static Metadata Data Block: Only one instance of this Data Block is allowed.
Block 5, CTA-861 Extension Block:
  Colorimetry Data Block: Only one instance of this Data Block is allowed.
  HDR Static Metadata Data Block: Only one instance of this Data Block is allowed.
  Required 640x480p60 timings are missing in the established timings and the SVD list (VIC 1).
  Missing VCDB, needed for Set Selectable RGB Quantization to avoid interop issues.
EDID:
  Base EDID: EDID specified 2 extension block(s), but found 5 extension block(s).
  DisplayID: Missing DisplayID Product Identification Data Block.
  DisplayID: Missing DisplayID Display Parameters Data Block.
  DisplayID: Missing DisplayID Display Interface Features Data Block.
  DisplayID: DisplayID expects at least one preferred timing.

EDID conformity: FAIL
