edid-decode (hex):

00 ff ff ff ff ff ff 00 4c 2d 84 05 33 32 59 4d
35 13 01 03 0e 33 1d 78 2a ee 91 a3 54 4c 99 26
0f 50 54 23 08 00 81 80 81 40 81 00 95 00 b3 00
01 01 01 01 01 01 3b 3d 00 a0 80 80 21 40 30 20
35 00 fe 1f 11 00 00 1a 00 00 00 fd 00 38 3c 1e
51 10 00 0a 20 20 20 20 20 20 00 00 00 fc 00 53
79 6e 63 4d 61 73 74 65 72 0a 20 20 00 00 00 ff
00 48 39 4e 53 43 30 34 31 36 38 0a 20 20 00 bd

00 ff ff ff ff ff ff 00 4c 2d 84 05 33 32 59 4d
35 13 01 03 0e 33 1d 78 2a ee 91 a3 54 4c 99 26
0f 50 54 23 08 00 81 80 81 40 81 00 95 00 b3 00
01 01 01 01 01 01 3b 3d 00 a0 80 80 21 40 30 20
35 00 fe 1f 11 00 00 1a 00 00 00 fd 00 38 3c 1e
51 10 00 0a 20 20 20 20 20 20 00 00 00 fc 00 53
79 6e 63 4d 61 73 74 65 72 0a 20 20 00 00 00 ff
00 48 39 4e 53 43 30 34 31 36 38 0a 20 20 00 bd

----------------

Block 0, Base EDID:
  EDID Structure Version & Revision: 1.3
  Vendor & Product Identification:
    Manufacturer: SAM
    Model: 1412
    Serial Number: ...
    Made in: week 53 of 2009
  Basic Display Parameters & Features:
    Analog display
    Signal Level Standard: 0.700 : 0.300 : 1.000 V p-p
    Blank level equals black level
    Sync: Separate Composite SyncOnGreen
    Maximum image size: 51 cm x 29 cm
    Gamma: 2.20
    DPMS levels: Off
    RGB color display
    First detailed timing is the preferred timing
  Color Characteristics:
    Red  : 0.6396, 0.3300
    Green: 0.2998, 0.5996
    Blue : 0.1503, 0.0595
    White: 0.3125, 0.3291
  Established Timings I & II:
    DMT 0x04:   640x480    59.940476 Hz   4:3     31.469 kHz     25.175000 MHz
    DMT 0x08:   800x600    56.250000 Hz   4:3     35.156 kHz     36.000000 MHz
    DMT 0x09:   800x600    60.316541 Hz   4:3     37.879 kHz     40.000000 MHz
    DMT 0x10:  1024x768    60.003840 Hz   4:3     48.363 kHz     65.000000 MHz
  Standard Timings:
    DMT 0x23:  1280x1024   60.019740 Hz   5:4     63.981 kHz    108.000000 MHz
    DMT 0x20:  1280x960    60.000000 Hz   4:3     60.000 kHz    108.000000 MHz
    DMT 0x1c:  1280x800    59.810326 Hz  16:10    49.702 kHz     83.500000 MHz
    DMT 0x2f:  1440x900    59.887445 Hz  16:10    55.935 kHz    106.500000 MHz
    DMT 0x3a:  1680x1050   59.954250 Hz  16:10    65.290 kHz    146.250000 MHz
  Detailed Timing Descriptors:
    DTD 1:  2048x1152   59.908732 Hz  16:9     70.992 kHz    156.750000 MHz (510 mm x 287 mm)
                 Hfront   48 Hsync  32 Hback   80 Hpol P
                 Vfront    3 Vsync   5 Vback   25 Vpol N
    Display Range Limits:
      Monitor ranges (GTF): 56-60 Hz V, 30-81 kHz H, max dotclock 160 MHz
    Display Product Name: 'SyncMaster'
    Display Product Serial Number: ...
Checksum: 0xbd

----------------

Block 1, Unknown EDID Extension Block 0x00:
  00 ff ff ff ff ff ff 00 4c 2d 84 05 33 32 59 4d '........L-..32YM'
  35 13 01 03 0e 33 1d 78 2a ee 91 a3 54 4c 99 26 '5....3.x*...TL.&'
  0f 50 54 23 08 00 81 80 81 40 81 00 95 00 b3 00 '.PT#.....@......'
  01 01 01 01 01 01 3b 3d 00 a0 80 80 21 40 30 20 '......;=....!@0 '
  35 00 fe 1f 11 00 00 1a 00 00 00 fd 00 38 3c 1e '5............8<.'
  51 10 00 0a 20 20 20 20 20 20 00 00 00 fc 00 53 'Q...      .....S'
  79 6e 63 4d 61 73 74 65 72 0a 20 20 00 00 00 ff 'yncMaster.  ....'
  00 48 39 4e 53 43 30 34 31 36 38 0a 20 20 00 bd '.H9NSC04168.  ..'
Checksum: 0xbd

----------------

Failures:

Block 0, Base EDID:
  Basic Display Parameters & Features: The chromaticities match sRGB, but sRGB is not signaled.
Block 1, Base EDID:
  Unknown Extension Block.
EDID:
  Base EDID: EDID specified 0 extension block(s), but found 1 extension block(s).

EDID conformity: FAIL
