edid-decode (hex):

00 ff ff ff ff ff ff 00 4c a3 42 31 00 00 00 00
00 14 01 03 80 20 13 78 0a ca 45 95 5b 59 94 2a
20 50 54 00 00 00 01 01 01 01 01 01 01 01 01 01
01 01 01 01 01 01 12 1b 56 6c 50 00 10 30 20 16
24 00 35 ae 10 00 00 19 00 00 00 0f 00 00 00 00
00 00 00 00 00 2a c0 06 29 00 00 00 00 fe 00 53
41 4d 53 55 4e 47 0a 20 20 20 20 20 00 00 00 fe
00 31 34 30 41 54 32 30 2d 53 30 31 0a 20 00 05

----------------

Block 0, Base EDID:
  EDID Structure Version & Revision: 1.3
  Vendor & Product Identification:
    Manufacturer: SEC
    Model: 12610
    Made in: 2010
  Basic Display Parameters & Features:
    Digital display
    Maximum image size: 32 cm x 19 cm
    Gamma: 2.20
    RGB color display
    First detailed timing is preferred timing
  Color Characteristics:
    Red  : 0.5849, 0.3554
    Green: 0.3496, 0.5800
    Blue : 0.1650, 0.1250
    White: 0.3134, 0.3291
  Established Timings I & II: none
  Standard Timings: none
  Detailed Timing Descriptors:
    DTD 1:  1366x768    59.968 Hz 683:384  47.015 kHz  69.300 MHz (309 mm x 174 mm)
                 Hfront   32 Hsync  22 Hback  54 Hpol N
                 Vfront    2 Vsync   4 Vback  10 Vpol N
    Manufacturer-Specified Display Descriptor (0x0f): 00 0f 00 00 00 00 00 00 00 00 00 2a c0 06 29 00 '...........*..).'
    Alphanumeric Data String: 'SAMSUNG'
    Alphanumeric Data String: '140AT20-S01'
Checksum: 0x5

----------------

Failures:

Block 0, Base EDID:
  Detailed Timing Descriptor #1: Mismatch of image size 309x174 mm vs display size 320x190 mm.
  Missing Display Product Name.
  Missing Display Range Limits Descriptor.

EDID conformity: FAIL
