edid-decode (hex):

00 ff ff ff ff ff ff 00 22 70 13 00 d0 00 00 00
1e 11 01 03 0a 29 1a 78 ea 9b b6 a4 53 4b 9d 24
14 4f 54 bf ef 80 81 80 81 c0 81 40 71 4f 61 46
90 4f 95 0f 01 01 9a 29 a0 d0 51 84 22 30 50 98
36 00 98 ff 10 00 00 1e 00 00 00 fd 00 37 4b 1e
53 0e 01 01 01 01 01 01 01 01 00 00 00 ff 00 37
33 30 4e 4c 4d 30 32 41 30 32 30 38 00 00 00 fc
00 4c 4d 30 32 0a 20 20 20 20 20 20 20 20 00 56

----------------

Block 0, Base EDID:
  EDID Structure Version & Revision: 1.3
  Vendor & Product Identification:
    Manufacturer: HSP
    Model: 19
    Serial Number: ...
    Made in: week 30 of 2007
  Basic Display Parameters & Features:
    Analog display
    Input voltage level: 0.7/0.3 V
    Blank level equals black level
    Sync: Separate SyncOnGreen
    Maximum image size: 41 cm x 26 cm
    Gamma: 2.20
    DPMS levels: Standby Suspend Off
    RGB color display
    First detailed timing is the preferred timing
  Color Characteristics:
    Red  : 0.6425, 0.3251
    Green: 0.2949, 0.6162
    Blue : 0.1425, 0.0810
    White: 0.3095, 0.3300
  Established Timings I & II:
    IBM     :   720x400    70.082 Hz   9:5    31.467 kHz  28.320 MHz
    DMT 0x04:   640x480    59.940 Hz   4:3    31.469 kHz  25.175 MHz
    Apple   :   640x480    66.667 Hz   4:3    35.000 kHz  30.240 MHz
    DMT 0x05:   640x480    72.809 Hz   4:3    37.861 kHz  31.500 MHz
    DMT 0x06:   640x480    75.000 Hz   4:3    37.500 kHz  31.500 MHz
    DMT 0x08:   800x600    56.250 Hz   4:3    35.156 kHz  36.000 MHz
    DMT 0x09:   800x600    60.317 Hz   4:3    37.879 kHz  40.000 MHz
    DMT 0x0a:   800x600    72.188 Hz   4:3    48.077 kHz  50.000 MHz
    DMT 0x0b:   800x600    75.000 Hz   4:3    46.875 kHz  49.500 MHz
    Apple   :   832x624    74.551 Hz   4:3    49.726 kHz  57.284 MHz
    DMT 0x10:  1024x768    60.004 Hz   4:3    48.363 kHz  65.000 MHz
    DMT 0x11:  1024x768    70.069 Hz   4:3    56.476 kHz  75.000 MHz
    DMT 0x12:  1024x768    75.029 Hz   4:3    60.023 kHz  78.750 MHz
    DMT 0x24:  1280x1024   75.025 Hz   5:4    79.976 kHz 135.000 MHz
    Apple   :  1152x870    75.062 Hz 192:145  68.681 kHz 100.000 MHz
  Standard Timings:
    DMT 0x23:  1280x1024   60.020 Hz   5:4    63.981 kHz 108.000 MHz
    DMT 0x55:  1280x720    60.000 Hz  16:9    45.000 kHz  74.250 MHz
    DMT 0x20:  1280x960    60.000 Hz   4:3    60.000 kHz 108.000 MHz
    DMT 0x15:  1152x864    75.000 Hz   4:3    67.500 kHz 108.000 MHz
    GTF     :  1024x768    66.000 Hz   4:3    52.668 kHz  71.628 MHz
    DMT 0x2b:  1400x1050   74.867 Hz   4:3    82.278 kHz 156.000 MHz
    DMT 0x30:  1440x900    74.984 Hz  16:10   70.635 kHz 136.750 MHz
  Detailed Timing Descriptors:
    DTD 1:  1440x900    59.887 Hz   8:5    55.935 kHz 106.500 MHz (408 mm x 255 mm)
                 Hfront   80 Hsync 152 Hback 232 Hpol P
                 Vfront    3 Vsync   6 Vback  25 Vpol P
  Display Range Limits:
    Monitor ranges (Bare Limits): 55-75 Hz V, 30-83 kHz H, max dotclock 140 MHz
    Display Product Serial Number: ...
    Display Product Name: 'LM02'
Checksum: 0x56

----------------

Failures:

Block 0, Base EDID:
  Display Range Limits: 'Bare Limits' is not allowed for EDID < 1.4.
  Display Range Limits: Byte 11 is 0x01 instead of 0x0a.
  Display Range Limits: Bytes 12-17 must be 0x20.
EDID:
  Base EDID: GTF timings are used, but the EDID does not signal GTF support.
  Base EDID: Some timings are out of range of the Monitor Ranges:
    Maximum Clock: 156.000 MHz (Monitor: 140.000 MHz)

EDID conformity: FAIL
