edid-decode (hex):

00 ff ff ff ff ff ff 00 06 af ed 17 00 00 00 00
00 14 01 04 90 22 13 78 02 21 35 ad 50 37 aa 24
11 50 54 00 00 00 01 01 01 01 01 01 01 01 01 01
01 01 01 01 01 01 4c 36 80 82 70 38 32 40 3c 30
aa 00 58 c1 10 00 00 1a 4c 36 80 82 70 38 32 40
3c 30 aa 00 58 c1 10 00 00 1a 00 00 00 fe 00 4b
59 59 56 4b 0a 42 31 35 36 48 57 31 00 00 00 00
00 00 81 02 9b 01 01 00 00 02 01 0a 20 20 00 29

----------------

Block 0, Base EDID:
  EDID Structure Version & Revision: 1.4
  Vendor & Product Identification:
    Manufacturer: AUO
    Model: 6125
    Made in: 2010
  Basic Display Parameters & Features:
    Digital display
    Bits per primary color channel: 6
    Digital interface is not defined
    Maximum image size: 34 cm x 19 cm
    Gamma: 2.20
    Supported color formats: RGB 4:4:4
    First detailed timing includes the native pixel format and preferred refresh rate
  Color Characteristics:
    Red  : 0.6757, 0.3144
    Green: 0.2148, 0.6650
    Blue : 0.1406, 0.0693
    White: 0.3134, 0.3291
  Established Timings I & II: none
  Standard Timings: none
  Detailed Timing Descriptors:
    DTD 1:  1920x1080   60.004317 Hz  16:9     67.805 kHz    139.000000 MHz (344 mm x 193 mm)
                 Hfront   60 Hsync  48 Hback   22 Hpol P
                 Vfront   10 Vsync  10 Vback   30 Vpol N
    DTD 2:  1920x1080   60.004317 Hz  16:9     67.805 kHz    139.000000 MHz (344 mm x 193 mm)
                 Hfront   60 Hsync  48 Hback   22 Hpol P
                 Vfront   10 Vsync  10 Vback   30 Vpol N
    Alphanumeric Data String: 'KYYVK'
    Manufacturer-Specified Display Descriptor (0x00): 00 00 00 00 81 02 9b 01 01 00 00 02 01 0a 20 20 '..............  '
Checksum: 0x29

----------------

Failures:

Block 0, Base EDID:
  Missing Display Product Name.

EDID conformity: FAIL
