
EDID (hex):
00ffffffffffff0006afed1700000000
0014010490221378022135ad5037aa24
11505400000001010101010101010101
010101010101783780ae703832403c30
aa0058c11000001a783780ae70383240
3c30aa0058c11000001a000000fe004b
5959564b804231353648573100000000
000081029b0101000002010a20200001

Extracted contents:
header:          00 ff ff ff ff ff ff 00
serial number:   06 af ed 17 00 00 00 00 00 14
version:         01 04
basic params:    90 22 13 78 02
chroma info:     21 35 ad 50 37 aa 24 11 50 54
established:     00 00 00
standard:        01 01 01 01 01 01 01 01 01 01 01 01 01 01 01 01
descriptor 1:    78 37 80 ae 70 38 32 40 3c 30 aa 00 58 c1 10 00 00 1a
descriptor 2:    78 37 80 ae 70 38 32 40 3c 30 aa 00 58 c1 10 00 00 1a
descriptor 3:    00 00 00 fe 00 4b 59 59 56 4b 80 42 31 35 36 48 57 31
descriptor 4:    00 00 00 00 00 00 81 02 9b 01 01 00 00 02 01 0a 20 20
extensions:      00
checksum:        01

EDID version: 1.4
Manufacturer: AUO Model 17ed Serial Number --
Made in year 2010
Digital display
6 bits per primary color channel
Digital interface is not defined
Maximum image size: 34 cm x 19 cm
Gamma: 2.20
Supported color formats: RGB 4:4:4
First detailed timing includes the native pixel format and preferred refresh rate
Display x,y Chromaticity:
  Red:   0.6757, 0.3144
  Green: 0.2148, 0.6650
  Blue:  0.1406, 0.0693
  White: 0.3134, 0.3291
Established timings supported:
Standard timings supported:
Detailed mode: Clock 142.000 MHz, 344 mm x 193 mm
               1920 1980 2028 2094 hborder 0
               1080 1090 1100 1130 vborder 0
               +hsync -vsync 
               VertFreq: 60 Hz, HorFreq: 67812 Hz
Detailed mode: Clock 142.000 MHz, 344 mm x 193 mm
               1920 1980 2028 2094 hborder 0
               1080 1090 1100 1130 vborder 0
               +hsync -vsync 
               VertFreq: 60 Hz, HorFreq: 67812 Hz
ASCII string: KYYVK
Manufacturer-specified data, tag 0
Checksum: 0x1 (valid)
EDID block does NOT conform to EDID 1.4!
	Missing name descriptor
	Missing monitor ranges
	Detailed block string not properly terminated
