edid-decode (hex):

00 ff ff ff ff ff ff 00 4c 23 53 24 36 59 3f 1e
2e 21 01 03 0e 35 1d 78 2a 35 81 a6 56 48 9a 24
12 50 54 af cf 80 81 00 81 40 81 80 95 00 a9 40
b3 00 d1 c0 01 01 30 44 80 a0 70 38 27 40 2c 20
45 00 12 22 21 00 00 1e 00 00 00 ff 00 31 32 33
36 37 38 39 0a 20 20 20 20 20 00 00 00 fd 00 38
4b 1e 5f 12 00 0a 20 20 20 20 20 20 00 00 00 fc
00 4c 45 44 20 4d 4f 4e 49 54 4f 52 0a 20 00 8c

00 ff ff ff ff ff ff 00 4c 23 53 24 36 59 3f 1e
2e 21 01 03 0e 35 1d 78 2a 35 81 a6 56 48 9a 24
12 50 54 af cf 80 81 00 81 40 81 80 95 00 a9 40
b3 00 d1 c0 01 01 30 44 80 a0 70 38 27 40 2c 20
45 00 12 22 21 00 00 1e 00 00 00 ff 00 31 32 33
36 37 38 39 0a 20 20 20 20 20 00 00 00 fd 00 38
4b 1e 5f 12 00 0a 20 20 20 20 20 20 00 00 00 fc
00 4c 45 44 20 4d 4f 4e 49 54 4f 52 0a 20 00 8c

----------------

Block 0, Base EDID:
  EDID Structure Version & Revision: 1.3
  Vendor & Product Identification:
    Manufacturer: SAC
    Model: 9299
    Serial Number: ...
    Made in: week 46 of 2023
  Basic Display Parameters & Features:
    Analog display
    Signal Level Standard: 0.700 : 0.300 : 1.000 V p-p
    Blank level equals black level
    Sync: Separate Composite SyncOnGreen
    Maximum image size: 53 cm x 29 cm
    Gamma: 2.20
    DPMS levels: Off
    RGB color display
    First detailed timing is the preferred timing
  Color Characteristics:
    Red  : 0.6484, 0.3388
    Green: 0.2822, 0.6025
    Blue : 0.1425, 0.0703
    White: 0.3125, 0.3291
  Established Timings I & II:
    IBM     :   720x400    70.081663 Hz   9:5     31.467 kHz     28.320000 MHz
    DMT 0x04:   640x480    59.940476 Hz   4:3     31.469 kHz     25.175000 MHz
    DMT 0x05:   640x480    72.808802 Hz   4:3     37.861 kHz     31.500000 MHz
    DMT 0x06:   640x480    75.000000 Hz   4:3     37.500 kHz     31.500000 MHz
    DMT 0x08:   800x600    56.250000 Hz   4:3     35.156 kHz     36.000000 MHz
    DMT 0x09:   800x600    60.316541 Hz   4:3     37.879 kHz     40.000000 MHz
    DMT 0x0a:   800x600    72.187572 Hz   4:3     48.077 kHz     50.000000 MHz
    DMT 0x0b:   800x600    75.000000 Hz   4:3     46.875 kHz     49.500000 MHz
    DMT 0x10:  1024x768    60.003840 Hz   4:3     48.363 kHz     65.000000 MHz
    DMT 0x11:  1024x768    70.069359 Hz   4:3     56.476 kHz     75.000000 MHz
    DMT 0x12:  1024x768    75.028582 Hz   4:3     60.023 kHz     78.750000 MHz
    DMT 0x24:  1280x1024   75.024675 Hz   5:4     79.976 kHz    135.000000 MHz
    Apple   :  1152x870    75.061550 Hz 192:145   68.681 kHz    100.000000 MHz
  Standard Timings:
    DMT 0x1c:  1280x800    59.810326 Hz  16:10    49.702 kHz     83.500000 MHz
    DMT 0x20:  1280x960    60.000000 Hz   4:3     60.000 kHz    108.000000 MHz
    DMT 0x23:  1280x1024   60.019740 Hz   5:4     63.981 kHz    108.000000 MHz
    DMT 0x2f:  1440x900    59.887445 Hz  16:10    55.935 kHz    106.500000 MHz
    DMT 0x33:  1600x1200   60.000000 Hz   4:3     75.000 kHz    162.000000 MHz
    DMT 0x3a:  1680x1050   59.954250 Hz  16:10    65.290 kHz    146.250000 MHz
    DMT 0x52:  1920x1080   60.000000 Hz  16:9     67.500 kHz    148.500000 MHz
  Detailed Timing Descriptors:
    DTD 1:  1920x1080   74.998281 Hz  16:9     83.923 kHz    174.560000 MHz (530 mm x 290 mm)
                 Hfront   44 Hsync  32 Hback   84 Hpol P
                 Vfront    4 Vsync   5 Vback   30 Vpol P
    Display Product Serial Number: ...
    Display Range Limits:
      Monitor ranges (GTF): 56-75 Hz V, 30-95 kHz H, max dotclock 180 MHz
    Display Product Name: 'LED MONITOR'
Checksum: 0x8c

----------------

Block 1, Unknown EDID Extension Block 0x00:
  00 ff ff ff ff ff ff 00 4c 23 53 24 36 59 3f 1e '........L#S$6Y?.'
  2e 21 01 03 0e 35 1d 78 2a 35 81 a6 56 48 9a 24 '.!...5.x*5..VH.$'
  12 50 54 af cf 80 81 00 81 40 81 80 95 00 a9 40 '.PT......@.....@'
  b3 00 d1 c0 01 01 30 44 80 a0 70 38 27 40 2c 20 '......0D..p8'@, '
  45 00 12 22 21 00 00 1e 00 00 00 ff 00 31 32 33 'E.."!........123'
  36 37 38 39 0a 20 20 20 20 20 00 00 00 fd 00 38 '6789.     .....8'
  4b 1e 5f 12 00 0a 20 20 20 20 20 20 00 00 00 fc 'K._...      ....'
  00 4c 45 44 20 4d 4f 4e 49 54 4f 52 0a 20 00 8c '.LED MONITOR. ..'
Checksum: 0x8c

----------------

Failures:

Block 1, Base EDID:
  Unknown Extension Block.
EDID:
  Base EDID: EDID specified 0 extension block(s), but found 1 extension block(s).

EDID conformity: FAIL
