
EDID (hex):
00ffffffffffff0009d1a37f45540000
221f0104b5361e783b5ac5a6574fa125
0d5054a56b80b300a9c081bc810081c0
8180617c0101023a801871382d40582c
4500202f2100001e000000ff0057384d
30373232393031390a20000000fd0030
a5b9b927010a202020202020000000fc
0042656e5120455832353130530a01a3
02033df14e3f40901f22212004131211
0302012309070783010000e200ff6503
0c0010006d1a0000020130a500000000
0000e305c301e606050162623a5a8780
a070384d4030203500202f2100001ad0
9480a070381e4030203500202f210000
1ac93600a04000373030203400202f21
00001a0000000000000000000000005e

edid-decode (hex):

00 ff ff ff ff ff ff 00 09 d1 a3 7f 45 54 00 00
22 1f 01 04 b5 36 1e 78 3b 5a c5 a6 57 4f a1 25
0d 50 54 a5 6b 80 b3 00 a9 c0 81 bc 81 00 81 c0
81 80 61 7c 01 01 02 3a 80 18 71 38 2d 40 58 2c
45 00 20 2f 21 00 00 1e 00 00 00 ff 00 57 38 4d
30 37 32 32 39 30 31 39 0a 20 00 00 00 fd 00 30
a5 b9 b9 27 01 0a 20 20 20 20 20 20 00 00 00 fc
00 42 65 6e 51 20 45 58 32 35 31 30 53 0a 01 a3

02 03 3d f1 4e 3f 40 90 1f 22 21 20 04 13 12 11
03 02 01 23 09 07 07 83 01 00 00 e2 00 ff 65 03
0c 00 10 00 6d 1a 00 00 02 01 30 a5 00 00 00 00
00 00 e3 05 c3 01 e6 06 05 01 62 62 3a 5a 87 80
a0 70 38 4d 40 30 20 35 00 20 2f 21 00 00 1a d0
94 80 a0 70 38 1e 40 30 20 35 00 20 2f 21 00 00
1a c9 36 00 a0 40 00 37 30 30 20 34 00 20 2f 21
00 00 1a 00 00 00 00 00 00 00 00 00 00 00 00 5e

----------------

Block 0, Base EDID:
  EDID Structure Version & Revision: 1.4
  Vendor & Product Identification:
    Manufacturer: BNQ
    Model: 32675
    Serial Number: 21573
    Made in: week 34 of 2021
  Basic Display Parameters & Features:
    Digital display
    Bits per primary color channel: 10
    DisplayPort interface
    Maximum image size: 54 cm x 30 cm
    Gamma: 2.20
    DPMS levels: Off
    Supported color formats: RGB 4:4:4, YCrCb 4:4:4, YCrCb 4:2:2
    First detailed timing includes the native pixel format and preferred refresh rate
    Display is continuous frequency
  Color Characteristics:
    Red  : 0.6494, 0.3408
    Green: 0.3105, 0.6308
    Blue : 0.1474, 0.0507
    White: 0.3134, 0.3291
  Established Timings I & II:
    IBM     :   720x400    70.081663 Hz   9:5     31.467 kHz     28.320000 MHz
    DMT 0x04:   640x480    59.940476 Hz   4:3     31.469 kHz     25.175000 MHz
    DMT 0x06:   640x480    75.000000 Hz   4:3     37.500 kHz     31.500000 MHz
    DMT 0x09:   800x600    60.316541 Hz   4:3     37.879 kHz     40.000000 MHz
    DMT 0x0b:   800x600    75.000000 Hz   4:3     46.875 kHz     49.500000 MHz
    Apple   :   832x624    74.551266 Hz   4:3     49.726 kHz     57.284000 MHz
    DMT 0x10:  1024x768    60.003840 Hz   4:3     48.363 kHz     65.000000 MHz
    DMT 0x12:  1024x768    75.028582 Hz   4:3     60.023 kHz     78.750000 MHz
    DMT 0x24:  1280x1024   75.024675 Hz   5:4     79.976 kHz    135.000000 MHz
    Apple   :  1152x870    75.061550 Hz 192:145   68.681 kHz    100.000000 MHz
  Standard Timings:
    DMT 0x3a:  1680x1050   59.954250 Hz  16:10    65.290 kHz    146.250000 MHz
    DMT 0x53:  1600x900    60.000000 Hz  16:9     60.000 kHz    108.000000 MHz (RB)
    GTF     :  1280x1024  120.000185 Hz   5:4    131.640 kHz    233.793000 MHz
    DMT 0x1c:  1280x800    59.810326 Hz  16:10    49.702 kHz     83.500000 MHz
    DMT 0x55:  1280x720    60.000000 Hz  16:9     45.000 kHz     74.250000 MHz
    DMT 0x23:  1280x1024   60.019740 Hz   5:4     63.981 kHz    108.000000 MHz
    GTF     :  1024x768   119.999931 Hz   4:3     98.760 kHz    139.054000 MHz
  Detailed Timing Descriptors:
    DTD 1:  1920x1080   60.000000 Hz  16:9     67.500 kHz    148.500000 MHz (544 mm x 303 mm)
                 Hfront   88 Hsync  44 Hback  148 Hpol P
                 Vfront    4 Vsync   5 Vback   36 Vpol P
    Display Product Serial Number: 'W8M07229019'
    Display Range Limits:
      Monitor ranges (Bare Limits): 48-165 Hz V, 185-185 kHz H, max dotclock 390 MHz
    Display Product Name: 'BenQ EX2510S'
  Extension blocks: 1
Checksum: 0xa3

----------------

Block 1, CTA-861 Extension Block:
  Revision: 3
  Underscans IT Video Formats by default
  Basic audio support
  Supports YCbCr 4:4:4
  Supports YCbCr 4:2:2
  Native detailed modes: 1
  Video Data Block:
    VIC  63:  1920x1080  120.000000 Hz  16:9    135.000 kHz    297.000000 MHz
    VIC  64:  1920x1080  100.000000 Hz  16:9    112.500 kHz    297.000000 MHz
    VIC  16:  1920x1080   60.000000 Hz  16:9     67.500 kHz    148.500000 MHz (native)
    VIC  31:  1920x1080   50.000000 Hz  16:9     56.250 kHz    148.500000 MHz
    VIC  34:  1920x1080   30.000000 Hz  16:9     33.750 kHz     74.250000 MHz
    VIC  33:  1920x1080   25.000000 Hz  16:9     28.125 kHz     74.250000 MHz
    VIC  32:  1920x1080   24.000000 Hz  16:9     27.000 kHz     74.250000 MHz
    VIC   4:  1280x720    60.000000 Hz  16:9     45.000 kHz     74.250000 MHz
    VIC  19:  1280x720    50.000000 Hz  16:9     37.500 kHz     74.250000 MHz
    VIC  18:   720x576    50.000000 Hz  16:9     31.250 kHz     27.000000 MHz
    VIC  17:   720x576    50.000000 Hz   4:3     31.250 kHz     27.000000 MHz
    VIC   3:   720x480    59.940060 Hz  16:9     31.469 kHz     27.000000 MHz
    VIC   2:   720x480    59.940060 Hz   4:3     31.469 kHz     27.000000 MHz
    VIC   1:   640x480    59.940476 Hz   4:3     31.469 kHz     25.175000 MHz
  Audio Data Block:
    Linear PCM:
      Max channels: 2
      Supported sample rates (kHz): 48 44.1 32
      Supported sample sizes (bits): 24 20 16
  Speaker Allocation Data Block:
    FL/FR - Front Left/Right
  Video Capability Data Block:
    YCbCr quantization: Selectable (via AVI YQ)
    RGB quantization: Selectable (via AVI Q)
    PT scan behavior: Supports both over- and underscan
    IT scan behavior: Supports both over- and underscan
    CE scan behavior: Supports both over- and underscan
  Vendor-Specific Data Block (HDMI), OUI 00-0C-03:
    Source physical address: 1.0.0.0
  Vendor-Specific Data Block (AMD), OUI 00-00-1A:
    Version: 2.1
    Minimum Refresh Rate: 48 Hz
    Maximum Refresh Rate: 165 Hz
    Flags 1.x: 0x00
    Flags 2.x: 0x00
    Maximum luminance: 0 (50.000 cd/m^2)
    Minimum luminance: 0 (0.000 cd/m^2)
    Unknown: 0x00 0x00
  Colorimetry Data Block:
    xvYCC601
    xvYCC709
    BT2020YCC
    BT2020RGB
    Gamut Boundary Description Metadata Profile P0
  HDR Static Metadata Data Block:
    Electro optical transfer functions:
      Traditional gamma - SDR luminance range
      SMPTE ST2084
    Supported static metadata descriptors:
      Static metadata type 1
    Desired content max luminance: 98 (417.710 cd/m^2)
    Desired content max frame-average luminance: 98 (417.710 cd/m^2)
    Desired content min luminance: 58 (0.216 cd/m^2)
  Detailed Timing Descriptors:
    DTD 2:  1920x1080  143.981451 Hz  16:9    166.587 kHz    346.500000 MHz (544 mm x 303 mm)
                 Hfront   48 Hsync  32 Hback   80 Hpol P
                 Vfront    3 Vsync   5 Vback   69 Vpol N
    DTD 3:  1920x1080  165.003465 Hz  16:9    183.154 kHz    380.960000 MHz (544 mm x 303 mm)
                 Hfront   48 Hsync  32 Hback   80 Hpol P
                 Vfront    3 Vsync   5 Vback   22 Vpol N
    DTD 4:  1024x768   143.930002 Hz   4:3    118.454 kHz    140.250000 MHz (544 mm x 303 mm)
                 Hfront   48 Hsync  32 Hback   80 Hpol P
                 Vfront    3 Vsync   4 Vback   48 Vpol N
Checksum: 0x5e  Unused space in Extension Block: 12 bytes


