edid-decode (hex):

00 ff ff ff ff ff ff 00 0d ae 95 14 00 00 00 00
28 16 01 04 95 1f 11 78 02 f8 45 96 57 54 92 28
23 50 54 00 00 00 01 01 01 01 01 01 01 01 01 01
01 01 01 01 01 01 da 1d 56 e2 50 00 20 30 44 2d
47 00 35 ae 10 00 00 1a e7 13 56 e2 50 00 20 30
44 2d 47 00 35 ae 10 00 00 1a 00 00 00 00 00 00
00 00 00 00 00 00 00 00 00 00 00 00 00 00 00 02
00 0c 4c ff 0a 3c 64 12 0f 1a 64 00 00 00 00 44

----------------

Block 0, Base EDID:
  EDID Structure Version & Revision: 1.4
  Vendor & Product Identification:
    Manufacturer: CMN
    Model: 5269
    Made in: week 40 of 2012
  Basic Display Parameters & Features:
    Digital display
    Bits per primary color channel: 6
    DisplayPort interface
    Maximum image size: 31 cm x 17 cm
    Gamma: 2.20
    Supported color formats: RGB 4:4:4
    First detailed timing includes the native pixel format and preferred refresh rate
  Color Characteristics:
    Red  : 0.5888, 0.3427
    Green: 0.3300, 0.5703
    Blue : 0.1572, 0.1367
    White: 0.3134, 0.3291
  Established Timings I & II: none
  Standard Timings: none
  Detailed Timing Descriptors:
    DTD 1:  1366x768    60.003 Hz 683:384  48.003 kHz  76.420 MHz (309 mm x 174 mm)
                 Hfront   68 Hsync  45 Hback 113 Hpol P
                 Vfront    4 Vsync   7 Vback  21 Vpol N
    DTD 2:  1366x768    40.005 Hz 683:384  32.004 kHz  50.950 MHz (309 mm x 174 mm)
                 Hfront   68 Hsync  45 Hback 113 Hpol P
                 Vfront    4 Vsync   7 Vback  21 Vpol N
    Empty Descriptor
    Manufacturer-Specified Display Descriptor (0x02): 00 02 00 0c 4c ff 0a 3c 64 12 0f 1a 64 00 00 00 '....L..<d...d...'
Checksum: 0x44
