
EDID (hex):
00ffffffffffff004dd9020901010101
0114010308a05a780a0dc9a057479827
12484c21080081c00101010101010101
010101010101662150b051001b304070
360040846300001e0e1f008051001e30
4080370040846300001c000000fd0039
3f1e3109000a202020202020000000fc
00534f4e592054560a2020202020001f

Extracted contents:
header:          00 ff ff ff ff ff ff 00
serial number:   4d d9 02 09 01 01 01 01 01 14
version:         01 03
basic params:    08 a0 5a 78 0a
chroma info:     0d c9 a0 57 47 98 27 12 48 4c
established:     21 08 00
standard:        81 c0 01 01 01 01 01 01 01 01 01 01 01 01 01 01
descriptor 1:    66 21 50 b0 51 00 1b 30 40 70 36 00 40 84 63 00 00 1e
descriptor 2:    0e 1f 00 80 51 00 1e 30 40 80 37 00 40 84 63 00 00 1c
descriptor 3:    00 00 00 fd 00 39 3f 1e 31 09 00 0a 20 20 20 20 20 20
descriptor 4:    00 00 00 fc 00 53 4f 4e 59 20 54 56 0a 20 20 20 20 20
extensions:      00
checksum:        1f

EDID version: 1.3
Manufacturer: SNY Model 902 Serial Number --
Made in week 1 of 2010
Analog display, Input voltage level: 0.7/0.3 V
Sync: Separate 
Maximum image size: 160 cm x 90 cm
Gamma: 2.20
RGB color display
First detailed timing is preferred timing
Display x,y Chromaticity:
  Red:   0.6250, 0.3398
  Green: 0.2802, 0.5947
  Blue:  0.1552, 0.0703
  White: 0.2832, 0.2978
Established timings supported:
  640x480@60Hz 4:3 HorFreq: 31469 Hz Clock: 25.175 MHz
  800x600@60Hz 4:3 HorFreq: 37900 Hz Clock: 40.000 MHz
  1024x768@60Hz 4:3 HorFreq: 48400 Hz Clock: 65.000 MHz
Standard timings supported:
  1280x720@60Hz 16:9
Detailed mode: Clock 85.500 MHz, 1600 mm x 900 mm
               1360 1424 1536 1792 hborder 0
                768  771  777  795 vborder 0
               +hsync +vsync 
               VertFreq: 60 Hz, HorFreq: 47712 Hz
Detailed mode: Clock 79.500 MHz, 1600 mm x 900 mm
               1280 1344 1472 1664 hborder 0
                768  771  778  798 vborder 0
               -hsync +vsync 
               VertFreq: 59 Hz, HorFreq: 47776 Hz
Monitor ranges (GTF): 57-63Hz V, 30-49kHz H, max dotclock 90MHz
Monitor name: SONY TV
Checksum: 0x1f (valid)
