edid-decode (hex):

00 ff ff ff ff ff ff 00 41 0c 8b 2f 01 01 01 01
01 22 01 03 80 90 51 78 0a 92 10 ad 52 44 ac 25
0c 50 54 20 00 00 d1 c0 81 c0 01 01 01 01 01 01
01 01 01 01 01 01 08 e8 00 30 f2 70 5a 80 b0 58
8a 00 a0 2a 53 00 00 1e 6f c2 00 a0 a0 a0 55 50
30 20 35 00 a0 2a 53 00 00 1a 00 00 00 fc 00 50
68 69 6c 69 70 73 20 55 48 44 54 56 00 00 00 fd
00 30 78 0f 46 3c 00 0a 20 20 20 20 20 20 01 71

02 03 75 f1 e2 78 03 53 76 61 60 5f 5e 5d 3f 10
1f 22 21 20 05 14 04 13 12 03 01 35 0f 1f 07 15
07 50 57 06 07 3d 07 c0 5f 7e 07 67 04 07 5f 1f
01 83 01 00 00 6d 03 0c 00 20 00 38 44 28 08 60
01 02 03 6a d8 5d c4 01 78 80 6b 02 28 00 e2 00
c9 e2 0f 07 e3 05 c0 00 e3 06 0d 01 eb 01 46 d0
00 4d 0a 76 88 5e 6e 96 e5 01 8b 84 90 01 e6 11
46 d0 00 70 00 00 00 00 00 00 00 00 00 00 00 49

02 03 2c f1 6d 1a 00 00 02 03 28 90 00 00 00 00
00 00 35 0f 1f 07 15 07 50 57 1e 07 3d 07 c0 5f
3e 07 67 04 07 5f 7e 01 83 01 00 00 56 5e 00 a0
a0 a0 29 50 30 20 35 00 a0 2a 53 00 00 1a 00 00
00 00 00 00 00 00 00 00 00 00 00 00 00 00 00 00
00 00 00 00 00 00 00 00 00 00 00 00 00 00 00 00
00 00 00 00 00 00 00 00 00 00 00 00 00 00 00 00
00 00 00 00 00 00 00 00 00 00 00 00 00 00 00 03

70 12 79 00 00 03 01 3c 3c fe 01 84 ff 0e 4f 00
07 80 1f 00 6f 08 99 00 8b 00 07 00 f0 ee 00 04
ff 09 bf 00 07 80 1f 00 9f 05 66 00 58 00 07 00
37 8b 00 04 7f 07 17 01 57 80 2b 00 37 04 2c 00
03 00 04 00 00 00 00 00 00 00 00 00 00 00 00 00
00 00 00 00 00 00 00 00 00 00 00 00 00 00 00 00
00 00 00 00 00 00 00 00 00 00 00 00 00 00 00 00
00 00 00 00 00 00 00 00 00 00 00 00 00 00 46 90

00 ff ff ff ff ff ff 00 41 0c 8b 2f 01 01 01 01
01 22 01 03 80 90 51 78 0a 92 10 ad 52 44 ac 25
0c 50 54 20 00 00 d1 c0 81 c0 01 01 01 01 01 01
01 01 01 01 01 01 08 e8 00 30 f2 70 5a 80 b0 58
8a 00 a0 2a 53 00 00 1e 6f c2 00 a0 a0 a0 55 50
30 20 35 00 a0 2a 53 00 00 1a 00 00 00 fc 00 50
68 69 6c 69 70 73 20 55 48 44 54 56 00 00 00 fd
00 30 78 0f 46 3c 00 0a 20 20 20 20 20 20 01 71

02 03 75 f1 e2 78 03 53 76 61 60 5f 5e 5d 3f 10
1f 22 21 20 05 14 04 13 12 03 01 35 0f 1f 07 15
07 50 57 06 07 3d 07 c0 5f 7e 07 67 04 07 5f 1f
01 83 01 00 00 6d 03 0c 00 20 00 38 44 28 08 60
01 02 03 6a d8 5d c4 01 78 80 6b 02 28 00 e2 00
c9 e2 0f 07 e3 05 c0 00 e3 06 0d 01 eb 01 46 d0
00 4d 0a 76 88 5e 6e 96 e5 01 8b 84 90 01 e6 11
46 d0 00 70 00 00 00 00 00 00 00 00 00 00 00 49

02 03 2c f1 6d 1a 00 00 02 03 28 90 00 00 00 00
00 00 35 0f 1f 07 15 07 50 57 1e 07 3d 07 c0 5f
3e 07 67 04 07 5f 7e 01 83 01 00 00 56 5e 00 a0
a0 a0 29 50 30 20 35 00 a0 2a 53 00 00 1a 00 00
00 00 00 00 00 00 00 00 00 00 00 00 00 00 00 00
00 00 00 00 00 00 00 00 00 00 00 00 00 00 00 00
00 00 00 00 00 00 00 00 00 00 00 00 00 00 00 00
00 00 00 00 00 00 00 00 00 00 00 00 00 00 00 03

70 12 79 00 00 03 01 3c 3c fe 01 84 ff 0e 4f 00
07 80 1f 00 6f 08 99 00 8b 00 07 00 f0 ee 00 04
ff 09 bf 00 07 80 1f 00 9f 05 66 00 58 00 07 00
37 8b 00 04 7f 07 17 01 57 80 2b 00 37 04 2c 00
03 00 04 00 00 00 00 00 00 00 00 00 00 00 00 00
00 00 00 00 00 00 00 00 00 00 00 00 00 00 00 00
00 00 00 00 00 00 00 00 00 00 00 00 00 00 00 00
00 00 00 00 00 00 00 00 00 00 00 00 00 00 46 90

----------------

Block 0, Base EDID:
  EDID Structure Version & Revision: 1.3
  Vendor & Product Identification:
    Manufacturer: PHL
    Model: 12171
    Serial Number: ...
    Made in: week 1 of 2024
  Basic Display Parameters & Features:
    Digital display
    Maximum image size: 144 cm x 81 cm
    Gamma: 2.20
    RGB color display
    First detailed timing is the preferred timing
  Color Characteristics:
    Red  : 0.6777, 0.3212
    Green: 0.2656, 0.6738
    Blue : 0.1445, 0.0478
    White: 0.3125, 0.3281
  Established Timings I & II:
    DMT 0x04:   640x480    59.940476 Hz   4:3     31.469 kHz     25.175000 MHz
  Standard Timings:
    DMT 0x52:  1920x1080   60.000000 Hz  16:9     67.500 kHz    148.500000 MHz
    DMT 0x55:  1280x720    60.000000 Hz  16:9     45.000 kHz     74.250000 MHz
  Detailed Timing Descriptors:
    DTD 1:  3840x2160   60.000000 Hz  16:9    135.000 kHz    594.000000 MHz (1440 mm x 810 mm)
                 Hfront  176 Hsync  88 Hback  296 Hpol P
                 Vfront    8 Vsync  10 Vback   72 Vpol P
    DTD 2:  2560x1440  119.997589 Hz  16:9    182.996 kHz    497.750000 MHz (1440 mm x 810 mm)
                 Hfront   48 Hsync  32 Hback   80 Hpol P
                 Vfront    3 Vsync   5 Vback   77 Vpol N
    Display Product Name: 'Philips UHDTV'
    Display Range Limits:
      Monitor ranges (GTF): 48-120 Hz V, 15-70 kHz H, max dotclock 600 MHz
  Extension blocks: 1
Checksum: 0x71

----------------

Block 1, CTA-861 Extension Block:
  Revision: 3
  Underscans IT Video Formats by default
  Basic audio support
  Supports YCbCr 4:4:4
  Supports YCbCr 4:2:2
  Native detailed modes: 1
  HDMI Forum EDID Extension Override Data Block:
    EDID Extension Block Count: 3
  Video Data Block:
    VIC 118:  3840x2160  120.000000 Hz  16:9    270.000 kHz   1188.000000 MHz
    VIC  97:  3840x2160   60.000000 Hz  16:9    135.000 kHz    594.000000 MHz
    VIC  96:  3840x2160   50.000000 Hz  16:9    112.500 kHz    594.000000 MHz
    VIC  95:  3840x2160   30.000000 Hz  16:9     67.500 kHz    297.000000 MHz
    VIC  94:  3840x2160   25.000000 Hz  16:9     56.250 kHz    297.000000 MHz
    VIC  93:  3840x2160   24.000000 Hz  16:9     54.000 kHz    297.000000 MHz
    VIC  63:  1920x1080  120.000000 Hz  16:9    135.000 kHz    297.000000 MHz
    VIC  16:  1920x1080   60.000000 Hz  16:9     67.500 kHz    148.500000 MHz
    VIC  31:  1920x1080   50.000000 Hz  16:9     56.250 kHz    148.500000 MHz
    VIC  34:  1920x1080   30.000000 Hz  16:9     33.750 kHz     74.250000 MHz
    VIC  33:  1920x1080   25.000000 Hz  16:9     28.125 kHz     74.250000 MHz
    VIC  32:  1920x1080   24.000000 Hz  16:9     27.000 kHz     74.250000 MHz
    VIC   5:  1920x1080i  60.000000 Hz  16:9     33.750 kHz     74.250000 MHz
    VIC  20:  1920x1080i  50.000000 Hz  16:9     28.125 kHz     74.250000 MHz
    VIC   4:  1280x720    60.000000 Hz  16:9     45.000 kHz     74.250000 MHz
    VIC  19:  1280x720    50.000000 Hz  16:9     37.500 kHz     74.250000 MHz
    VIC  18:   720x576    50.000000 Hz  16:9     31.250 kHz     27.000000 MHz
    VIC   3:   720x480    59.940060 Hz  16:9     31.469 kHz     27.000000 MHz
    VIC   1:   640x480    59.940476 Hz   4:3     31.469 kHz     25.175000 MHz
  Audio Data Block:
    Linear PCM:
      Max channels: 8
      Supported sample rates (kHz): 96 88.2 48 44.1 32
      Supported sample sizes (bits): 24 20 16
    AC-3:
      Max channels: 6
      Supported sample rates (kHz): 48 44.1 32
      Maximum bit rate: 640 kb/s
    Enhanced AC-3 (DD+):
      Max channels: 8
      Supported sample rates (kHz): 48 44.1
      Supports Joint Object Coding
      Supports Joint Object Coding with ACMOD28
    DTS:
      Max channels: 6
      Supported sample rates (kHz): 48 44.1 32
      Maximum bit rate: 1536 kb/s
    DTS-HD:
      Max channels: 8
      Supported sample rates (kHz): 192 176.4 96 88.2 48 44.1
      Supports DTS:X
      Audio Format Code dependent value: 0x07
    MAT (MLP):
      Max channels: 8
      Supported sample rates (kHz): 48
      Supports Dolby TrueHD, object audio PCM and channel-based PCM
      Hash calculation not required for object audio PCM or channel-based PCM
    DTS-HD:
      Max channels: 8
      Supported sample rates (kHz): 96 88.2 48 44.1 32
      Audio Format Code dependent value: 0x01
  Speaker Allocation Data Block:
    FL/FR - Front Left/Right
  Vendor-Specific Data Block (HDMI), OUI 00-0C-03:
    Source physical address: 2.0.0.0
    DC_36bit
    DC_30bit
    DC_Y444
    Maximum TMDS clock: 340 MHz
    Supported Content Types:
      Game
    Extended HDMI video details:
      Base EDID image size is aspect ratio
      HDMI VICs:
        HDMI VIC 1:  3840x2160   30.000000 Hz  16:9     67.500 kHz    297.000000 MHz
        HDMI VIC 2:  3840x2160   25.000000 Hz  16:9     56.250 kHz    297.000000 MHz
        HDMI VIC 3:  3840x2160   24.000000 Hz  16:9     54.000 kHz    297.000000 MHz
  Vendor-Specific Data Block (HDMI Forum), OUI C4-5D-D8:
    Version: 1
    Maximum TMDS Character Rate: 600 MHz
    SCDC Present
    Max Fixed Rate Link: 3 and 6 Gbps per lane on 3 lanes, 6, 8, 10 and 12 Gbps on 4 lanes
    Supports UHD VIC
    Supports 12-bits/component Deep Color 4:2:0 Pixel Encoding
    Supports 10-bits/component Deep Color 4:2:0 Pixel Encoding
    Supports Auto Low-Latency Mode
    VRRmin: 40 Hz
  Video Capability Data Block:
    YCbCr quantization: Selectable (via AVI YQ)
    RGB quantization: Selectable (via AVI Q)
    PT scan behavior: No Data
    IT scan behavior: Always Underscanned
    CE scan behavior: Always Overscanned
  YCbCr 4:2:0 Capability Map Data Block:
    VIC 118:  3840x2160  120.000000 Hz  16:9    270.000 kHz   1188.000000 MHz
    VIC  97:  3840x2160   60.000000 Hz  16:9    135.000 kHz    594.000000 MHz
    VIC  96:  3840x2160   50.000000 Hz  16:9    112.500 kHz    594.000000 MHz
  Colorimetry Data Block:
    BT2020YCC
    BT2020RGB
  HDR Static Metadata Data Block:
    Electro optical transfer functions:
      Traditional gamma - SDR luminance range
      SMPTE ST2084
      Hybrid Log-Gamma
    Supported static metadata descriptors:
      Static metadata type 1
  Vendor-Specific Video Data Block (Dolby), OUI 00-D0-46:
    Version: 2 (12 bytes)
    Supports YUV422 12 bit
    DM Version: 5.x
    Backlt Min Luma: 75 cd/m^2
    Interface: Standard + Low-Latency
    Supports 10b 12b 444: Not supported
    Target Min PQ v2: 20 (0.00064354 cd/m^2)
    Target Max PQ v2: 2965 (807 cd/m^2)
    Unique Rx, Ry: 0.67578125, 0.32031250
    Unique Gx, Gy: 0.26562500, 0.68359375
    Unique Bx, By: 0.14843750, 0.05468750
  Vendor-Specific Video Data Block (HDR10+), OUI 90-84-8B:
    Application Version: 1
  Vendor-Specific Audio Data Block (Dolby), OUI 00-D0-46:
    Version: 1 (7 bytes)
    Height speaker zone present
    Surround speaker zone present
    Center speaker zone present
Checksum: 0x49  Unused space in Extension Block: 10 bytes

----------------

Block 2, CTA-861 Extension Block:
  Revision: 3
  Underscans IT Video Formats by default
  Basic audio support
  Supports YCbCr 4:4:4
  Supports YCbCr 4:2:2
  Native detailed modes: 1
  Vendor-Specific Data Block (AMD), OUI 00-00-1A:
    Version: 2.3
    Minimum Refresh Rate: 40 Hz
    Maximum Refresh Rate: 144 Hz
    Flags 1.x: 0x00
    Flags 2.x: 0x00
    Maximum luminance: 0 (50.000 cd/m^2)
    Minimum luminance: 0 (0.000 cd/m^2)
    Unknown: 0x00 0x00
  Audio Data Block:
    Linear PCM:
      Max channels: 8
      Supported sample rates (kHz): 96 88.2 48 44.1 32
      Supported sample sizes (bits): 24 20 16
    AC-3:
      Max channels: 6
      Supported sample rates (kHz): 48 44.1 32
      Maximum bit rate: 640 kb/s
    Enhanced AC-3 (DD+):
      Max channels: 8
      Supported sample rates (kHz): 96 88.2 48 44.1
      Supports Joint Object Coding
      Supports Joint Object Coding with ACMOD28
    DTS:
      Max channels: 6
      Supported sample rates (kHz): 48 44.1 32
      Maximum bit rate: 1536 kb/s
    DTS-HD:
      Max channels: 8
      Supported sample rates (kHz): 176.4 96 88.2 48 44.1
      Supports DTS:X
      Audio Format Code dependent value: 0x07
    MAT (MLP):
      Max channels: 8
      Supported sample rates (kHz): 48
      Supports Dolby TrueHD, object audio PCM and channel-based PCM
      Hash calculation not required for object audio PCM or channel-based PCM
    DTS-HD:
      Max channels: 8
      Supported sample rates (kHz): 192 176.4 96 88.2 48 44.1
      Audio Format Code dependent value: 0x01
  Speaker Allocation Data Block:
    FL/FR - Front Left/Right
  Detailed Timing Descriptors:
    DTD 3:  2560x1440   59.950550 Hz  16:9     88.787 kHz    241.500000 MHz (1440 mm x 810 mm)
                 Hfront   48 Hsync  32 Hback   80 Hpol P
                 Vfront    3 Vsync   5 Vback   33 Vpol N
Checksum: 0x03  Unused space in Extension Block: 65 bytes

----------------

Block 3, DisplayID Extension Block:
  Version: 1.2
  Extension Count: 0
  Display Product Type: Extension Section
  Video Timing Modes Type 1 - Detailed Timings Data Block:
    DTD:  3840x2160  144.000362 Hz  16:9    333.217 kHz   1306.210000 MHz (aspect 16:9, no 3D stereo, preferred)
               Hfront    8 Hsync  32 Hback   40 Hpol P
               Vfront  140 Vsync   8 Vback    6 Vpol N
    DTD:  2560x1440  144.051248 Hz  16:9    222.271 kHz    611.690000 MHz (aspect 16:9, no 3D stereo)
               Hfront    8 Hsync  32 Hback  152 Hpol P
               Vfront   89 Vsync   8 Vback    6 Vpol N
    DTD:  1920x1080  144.000000 Hz  16:9    162.000 kHz    356.400000 MHz (aspect 16:9, no 3D stereo)
               Hfront   88 Hsync  44 Hback  148 Hpol P
               Vfront    4 Vsync   5 Vback   36 Vpol N
  Checksum: 0x46
Checksum: 0x90

----------------

Block 4, Unknown EDID Extension Block 0x00:
  00 ff ff ff ff ff ff 00 41 0c 8b 2f 01 01 01 01 '........A../....'
  01 22 01 03 80 90 51 78 0a 92 10 ad 52 44 ac 25 '."....Qx....RD.%'
  0c 50 54 20 00 00 d1 c0 81 c0 01 01 01 01 01 01 '.PT ............'
  01 01 01 01 01 01 08 e8 00 30 f2 70 5a 80 b0 58 '.........0.pZ..X'
  8a 00 a0 2a 53 00 00 1e 6f c2 00 a0 a0 a0 55 50 '...*S...o.....UP'
  30 20 35 00 a0 2a 53 00 00 1a 00 00 00 fc 00 50 '0 5..*S........P'
  68 69 6c 69 70 73 20 55 48 44 54 56 00 00 00 fd 'hilips UHDTV....'
  00 30 78 0f 46 3c 00 0a 20 20 20 20 20 20 01 71 '.0x.F<..      .q'
Checksum: 0x71

----------------

Block 5, CTA-861 Extension Block:
  Revision: 3
  Underscans IT Video Formats by default
  Basic audio support
  Supports YCbCr 4:4:4
  Supports YCbCr 4:2:2
  Native detailed modes: 1
  HDMI Forum EDID Extension Override Data Block:
    EDID Extension Block Count: 3
  Video Data Block:
    VIC 118:  3840x2160  120.000000 Hz  16:9    270.000 kHz   1188.000000 MHz
    VIC  97:  3840x2160   60.000000 Hz  16:9    135.000 kHz    594.000000 MHz
    VIC  96:  3840x2160   50.000000 Hz  16:9    112.500 kHz    594.000000 MHz
    VIC  95:  3840x2160   30.000000 Hz  16:9     67.500 kHz    297.000000 MHz
    VIC  94:  3840x2160   25.000000 Hz  16:9     56.250 kHz    297.000000 MHz
    VIC  93:  3840x2160   24.000000 Hz  16:9     54.000 kHz    297.000000 MHz
    VIC  63:  1920x1080  120.000000 Hz  16:9    135.000 kHz    297.000000 MHz
    VIC  16:  1920x1080   60.000000 Hz  16:9     67.500 kHz    148.500000 MHz
    VIC  31:  1920x1080   50.000000 Hz  16:9     56.250 kHz    148.500000 MHz
    VIC  34:  1920x1080   30.000000 Hz  16:9     33.750 kHz     74.250000 MHz
    VIC  33:  1920x1080   25.000000 Hz  16:9     28.125 kHz     74.250000 MHz
    VIC  32:  1920x1080   24.000000 Hz  16:9     27.000 kHz     74.250000 MHz
    VIC   5:  1920x1080i  60.000000 Hz  16:9     33.750 kHz     74.250000 MHz
    VIC  20:  1920x1080i  50.000000 Hz  16:9     28.125 kHz     74.250000 MHz
    VIC   4:  1280x720    60.000000 Hz  16:9     45.000 kHz     74.250000 MHz
    VIC  19:  1280x720    50.000000 Hz  16:9     37.500 kHz     74.250000 MHz
    VIC  18:   720x576    50.000000 Hz  16:9     31.250 kHz     27.000000 MHz
    VIC   3:   720x480    59.940060 Hz  16:9     31.469 kHz     27.000000 MHz
    VIC   1:   640x480    59.940476 Hz   4:3     31.469 kHz     25.175000 MHz
  Audio Data Block:
    Linear PCM:
      Max channels: 8
      Supported sample rates (kHz): 96 88.2 48 44.1 32
      Supported sample sizes (bits): 24 20 16
    AC-3:
      Max channels: 6
      Supported sample rates (kHz): 48 44.1 32
      Maximum bit rate: 640 kb/s
    Enhanced AC-3 (DD+):
      Max channels: 8
      Supported sample rates (kHz): 48 44.1
      Supports Joint Object Coding
      Supports Joint Object Coding with ACMOD28
    DTS:
      Max channels: 6
      Supported sample rates (kHz): 48 44.1 32
      Maximum bit rate: 1536 kb/s
    DTS-HD:
      Max channels: 8
      Supported sample rates (kHz): 192 176.4 96 88.2 48 44.1
      Supports DTS:X
      Audio Format Code dependent value: 0x07
    MAT (MLP):
      Max channels: 8
      Supported sample rates (kHz): 48
      Supports Dolby TrueHD, object audio PCM and channel-based PCM
      Hash calculation not required for object audio PCM or channel-based PCM
    DTS-HD:
      Max channels: 8
      Supported sample rates (kHz): 96 88.2 48 44.1 32
      Audio Format Code dependent value: 0x01
  Speaker Allocation Data Block:
    FL/FR - Front Left/Right
  Vendor-Specific Data Block (HDMI), OUI 00-0C-03:
    Source physical address: 2.0.0.0
    DC_36bit
    DC_30bit
    DC_Y444
    Maximum TMDS clock: 340 MHz
    Supported Content Types:
      Game
    Extended HDMI video details:
      Base EDID image size is aspect ratio
      HDMI VICs:
        HDMI VIC 1:  3840x2160   30.000000 Hz  16:9     67.500 kHz    297.000000 MHz
        HDMI VIC 2:  3840x2160   25.000000 Hz  16:9     56.250 kHz    297.000000 MHz
        HDMI VIC 3:  3840x2160   24.000000 Hz  16:9     54.000 kHz    297.000000 MHz
  Vendor-Specific Data Block (HDMI Forum), OUI C4-5D-D8:
    Version: 1
    Maximum TMDS Character Rate: 600 MHz
    SCDC Present
    Max Fixed Rate Link: 3 and 6 Gbps per lane on 3 lanes, 6, 8, 10 and 12 Gbps on 4 lanes
    Supports UHD VIC
    Supports 12-bits/component Deep Color 4:2:0 Pixel Encoding
    Supports 10-bits/component Deep Color 4:2:0 Pixel Encoding
    Supports Auto Low-Latency Mode
    VRRmin: 40 Hz
  Video Capability Data Block:
    YCbCr quantization: Selectable (via AVI YQ)
    RGB quantization: Selectable (via AVI Q)
    PT scan behavior: No Data
    IT scan behavior: Always Underscanned
    CE scan behavior: Always Overscanned
  YCbCr 4:2:0 Capability Map Data Block:
    VIC 118:  3840x2160  120.000000 Hz  16:9    270.000 kHz   1188.000000 MHz
    VIC  97:  3840x2160   60.000000 Hz  16:9    135.000 kHz    594.000000 MHz
    VIC  96:  3840x2160   50.000000 Hz  16:9    112.500 kHz    594.000000 MHz
  Colorimetry Data Block:
    BT2020YCC
    BT2020RGB
  HDR Static Metadata Data Block:
    Electro optical transfer functions:
      Traditional gamma - SDR luminance range
      SMPTE ST2084
      Hybrid Log-Gamma
    Supported static metadata descriptors:
      Static metadata type 1
  Vendor-Specific Video Data Block (Dolby), OUI 00-D0-46:
    Version: 2 (12 bytes)
    Supports YUV422 12 bit
    DM Version: 5.x
    Backlt Min Luma: 75 cd/m^2
    Interface: Standard + Low-Latency
    Supports 10b 12b 444: Not supported
    Target Min PQ v2: 20 (0.00064354 cd/m^2)
    Target Max PQ v2: 2965 (807 cd/m^2)
    Unique Rx, Ry: 0.67578125, 0.32031250
    Unique Gx, Gy: 0.26562500, 0.68359375
    Unique Bx, By: 0.14843750, 0.05468750
  Vendor-Specific Video Data Block (HDR10+), OUI 90-84-8B:
    Application Version: 1
  Vendor-Specific Audio Data Block (Dolby), OUI 00-D0-46:
    Version: 1 (7 bytes)
    Height speaker zone present
    Surround speaker zone present
    Center speaker zone present
Checksum: 0x49  Unused space in Extension Block: 10 bytes

----------------

Block 6, CTA-861 Extension Block:
  Revision: 3
  Underscans IT Video Formats by default
  Basic audio support
  Supports YCbCr 4:4:4
  Supports YCbCr 4:2:2
  Native detailed modes: 1
  Vendor-Specific Data Block (AMD), OUI 00-00-1A:
    Version: 2.3
    Minimum Refresh Rate: 40 Hz
    Maximum Refresh Rate: 144 Hz
    Flags 1.x: 0x00
    Flags 2.x: 0x00
    Maximum luminance: 0 (50.000 cd/m^2)
    Minimum luminance: 0 (0.000 cd/m^2)
    Unknown: 0x00 0x00
  Audio Data Block:
    Linear PCM:
      Max channels: 8
      Supported sample rates (kHz): 96 88.2 48 44.1 32
      Supported sample sizes (bits): 24 20 16
    AC-3:
      Max channels: 6
      Supported sample rates (kHz): 48 44.1 32
      Maximum bit rate: 640 kb/s
    Enhanced AC-3 (DD+):
      Max channels: 8
      Supported sample rates (kHz): 96 88.2 48 44.1
      Supports Joint Object Coding
      Supports Joint Object Coding with ACMOD28
    DTS:
      Max channels: 6
      Supported sample rates (kHz): 48 44.1 32
      Maximum bit rate: 1536 kb/s
    DTS-HD:
      Max channels: 8
      Supported sample rates (kHz): 176.4 96 88.2 48 44.1
      Supports DTS:X
      Audio Format Code dependent value: 0x07
    MAT (MLP):
      Max channels: 8
      Supported sample rates (kHz): 48
      Supports Dolby TrueHD, object audio PCM and channel-based PCM
      Hash calculation not required for object audio PCM or channel-based PCM
    DTS-HD:
      Max channels: 8
      Supported sample rates (kHz): 192 176.4 96 88.2 48 44.1
      Audio Format Code dependent value: 0x01
  Speaker Allocation Data Block:
    FL/FR - Front Left/Right
  Detailed Timing Descriptors:
    DTD 4:  2560x1440   59.950550 Hz  16:9     88.787 kHz    241.500000 MHz (1440 mm x 810 mm)
                 Hfront   48 Hsync  32 Hback   80 Hpol P
                 Vfront    3 Vsync   5 Vback   33 Vpol N
Checksum: 0x03  Unused space in Extension Block: 65 bytes

----------------

Block 7, DisplayID Extension Block:
  Version: 1.2
  Extension Count: 0
  Video Timing Modes Type 1 - Detailed Timings Data Block:
    DTD:  3840x2160  144.000362 Hz  16:9    333.217 kHz   1306.210000 MHz (aspect 16:9, no 3D stereo, preferred)
               Hfront    8 Hsync  32 Hback   40 Hpol P
               Vfront  140 Vsync   8 Vback    6 Vpol N
    DTD:  2560x1440  144.051248 Hz  16:9    222.271 kHz    611.690000 MHz (aspect 16:9, no 3D stereo)
               Hfront    8 Hsync  32 Hback  152 Hpol P
               Vfront   89 Vsync   8 Vback    6 Vpol N
    DTD:  1920x1080  144.000000 Hz  16:9    162.000 kHz    356.400000 MHz (aspect 16:9, no 3D stereo)
               Hfront   88 Hsync  44 Hback  148 Hpol P
               Vfront    4 Vsync   5 Vback   36 Vpol N
  Checksum: 0x46
Checksum: 0x90

----------------

Warnings:

Block 1, CTA-861 Extension Block:
  Colorimetry Data Block: Set the sRGB colorimetry bit to avoid interop issues.
Block 5, CTA-861 Extension Block:
  Colorimetry Data Block: Set the sRGB colorimetry bit to avoid interop issues.

Failures:

Block 2, CTA-861 Extension Block:
  Speaker Allocation Data Block: Only one instance of this Data Block is allowed.
Block 3, DisplayID Extension Block:
  DisplayID Base Block has no product type.
  Expected 0 DisplayID Extension Block, but got 1.
Block 4, Base EDID:
  Unknown Extension Block.
Block 5, CTA-861 Extension Block:
  HDMI Forum EDID Extension Override Data Block: Only one instance of this Data Block is allowed.
  HDMI Forum EDID Extension Override Data Block: Data Block can only be present in Block 1.
  HDMI Forum EDID Extension Override Data Block: Data Block starts at a wrong offset.
  Video Data Block: Duplicate VIC 118.
  Video Data Block: Duplicate VIC 97.
  Video Data Block: Duplicate VIC 96.
  Video Data Block: Duplicate VIC 95.
  Video Data Block: Duplicate VIC 94.
  Video Data Block: Duplicate VIC 93.
  Video Data Block: Duplicate VIC 63.
  Video Data Block: Duplicate VIC 16.
  Video Data Block: Duplicate VIC 31.
  Video Data Block: Duplicate VIC 34.
  Video Data Block: Duplicate VIC 33.
  Video Data Block: Duplicate VIC 32.
  Video Data Block: Duplicate VIC 5.
  Video Data Block: Duplicate VIC 20.
  Video Data Block: Duplicate VIC 4.
  Video Data Block: Duplicate VIC 19.
  Video Data Block: Duplicate VIC 18.
  Video Data Block: Duplicate VIC 3.
  Video Data Block: Duplicate VIC 1.
  Speaker Allocation Data Block: Only one instance of this Data Block is allowed.
  Vendor-Specific Data Block (HDMI Forum), OUI C4-5D-D8: Duplicate HDMI Forum VSDB/SCDB.
  Video Capability Data Block: Only one instance of this Data Block is allowed.
  YCbCr 4:2:0 Capability Map Data Block: Only one instance of this Data Block is allowed.
  Colorimetry Data Block: Only one instance of this Data Block is allowed.
  HDR Static Metadata Data Block: Only one instance of this Data Block is allowed.
Block 6, CTA-861 Extension Block:
  Speaker Allocation Data Block: Only one instance of this Data Block is allowed.
EDID:
  Base EDID: Some timings are out of range of the Monitor Ranges:
    Vertical Freq: 24.000 - 144.051 Hz (Monitor: 48.000 - 120.000 Hz)
    Horizontal Freq: 27.000 - 333.216 kHz (Monitor: 15.000 - 70.000 kHz)
    Maximum Clock: 1306.210 MHz (Monitor: 600.000 MHz)
  Base EDID: HDMI Forum EDID Extension Override Data Block specified 3 extension block(s), but found 7 extension block(s).
  DisplayID: Missing DisplayID Product Identification Data Block.

EDID conformity: FAIL
