edid-decode (hex):

00 ff ff ff ff ff ff 00 1a b3 a4 07 01 00 00 00
2b 12 01 03 68 32 1d 82 2a d4 25 a4 55 49 9b 27
13 50 54 a5 4b 00 81 c0 81 80 a9 40 01 01 01 01
01 01 01 01 01 01 02 3a 80 18 71 38 2d 40 58 2c
96 00 f1 24 11 00 00 1e 00 00 00 fd 00 32 4c 1c
52 10 00 0a 20 20 20 20 20 20 00 00 00 fc 00 4c
4c 20 33 32 32 30 54 0a 20 20 20 20 00 00 00 ff
00 59 45 38 48 30 32 31 34 36 34 0a 20 20 00 14

----------------

Block 0, Base EDID:
  EDID Structure Version & Revision: 1.3
  Vendor & Product Identification:
    Manufacturer: FUS
    Model: 1956
    Serial Number: ...
    Made in: week 43 of 2008
  Basic Display Parameters & Features:
    Analog display
    Input voltage level: 0.7/0.7 V
    Blank level equals black level
    Sync: Separate
    Maximum image size: 50 cm x 29 cm
    Gamma: 2.30
    DPMS levels: Off
    RGB color display
    First detailed timing is the preferred timing
  Color Characteristics:
    Red  : 0.6435, 0.3330
    Green: 0.2861, 0.6054
    Blue : 0.1523, 0.0761
    White: 0.3134, 0.3291
  Established Timings I & II:
    IBM     :   720x400    70.082 Hz   9:5    31.467 kHz  28.320 MHz
    DMT 0x04:   640x480    59.940 Hz   4:3    31.469 kHz  25.175 MHz
    DMT 0x06:   640x480    75.000 Hz   4:3    37.500 kHz  31.500 MHz
    DMT 0x09:   800x600    60.317 Hz   4:3    37.879 kHz  40.000 MHz
    DMT 0x0b:   800x600    75.000 Hz   4:3    46.875 kHz  49.500 MHz
    DMT 0x10:  1024x768    60.004 Hz   4:3    48.363 kHz  65.000 MHz
    DMT 0x12:  1024x768    75.029 Hz   4:3    60.023 kHz  78.750 MHz
    DMT 0x24:  1280x1024   75.025 Hz   5:4    79.976 kHz 135.000 MHz
  Standard Timings:
    DMT 0x55:  1280x720    60.000 Hz  16:9    45.000 kHz  74.250 MHz
    DMT 0x23:  1280x1024   60.020 Hz   5:4    63.981 kHz 108.000 MHz
    DMT 0x33:  1600x1200   60.000 Hz   4:3    75.000 kHz 162.000 MHz
  Detailed Timing Descriptors:
    DTD 1:  1920x1080   60.000 Hz  16:9    67.500 kHz 148.500 MHz (497 mm x 292 mm)
                 Hfront   88 Hsync  44 Hback 148 Hpol P
                 Vfront    9 Vsync   6 Vback  30 Vpol P
  Display Range Limits:
    Monitor ranges (GTF): 50-76 Hz V, 28-82 kHz H, max dotclock 160 MHz
    Display Product Name: 'LL 3220T'
    Display Product Serial Number: ...
Checksum: 0x14

----------------

Warnings:

EDID:
  Base EDID: Some timings are out of range of the Monitor Ranges:
    Maximum Clock: 162.000 MHz (Monitor: 160.000 MHz)
    Could be due to a Monitor Range off-by-one rounding issue

EDID conformity: PASS
