edid-decode (hex):

00 ff ff ff ff ff ff 00 0d ae 02 16 00 00 00 00
2a 1d 01 04 a5 24 14 78 03 ee 95 a3 54 4c 99 26
0f 50 54 00 00 00 01 01 01 01 01 01 01 01 01 01
01 01 01 01 01 01 9e 85 80 a0 70 38 3e 40 30 20
a6 00 63 c7 10 00 00 1a 9e 85 80 a0 70 38 7c 46
30 20 a6 00 63 c7 10 00 00 1a 00 00 00 00 00 00
00 00 00 00 00 00 00 00 00 00 00 00 00 00 00 02
00 0c 33 ff 0f 3c 96 29 12 2d 96 00 00 00 00 7e

----------------

Block 0, Base EDID:
  EDID Structure Version & Revision: 1.4
  Vendor & Product Identification:
    Manufacturer: CMN
    Model: 5634
    Made in: week 42 of 2019
  Basic Display Parameters & Features:
    Digital display
    Bits per primary color channel: 8
    DisplayPort interface
    Maximum image size: 36 cm x 20 cm
    Gamma: 2.20
    Supported color formats: RGB 4:4:4
    First detailed timing includes the native pixel format and preferred refresh rate
    Display is continuous frequency
  Color Characteristics:
    Red  : 0.6396, 0.3300
    Green: 0.2998, 0.5996
    Blue : 0.1503, 0.0595
    White: 0.3134, 0.3291
  Established Timings I & II: none
  Standard Timings: none
  Detailed Timing Descriptors:
    DTD 1:  1920x1080  144.003 Hz  16:9   164.452 kHz 342.060 MHz (355 mm x 199 mm)
                 Hfront   48 Hsync  32 Hback  80 Hpol P
                 Vfront   10 Vsync   6 Vback  46 Vpol N
    DTD 2:  1920x1080   60.019 Hz  16:9   164.452 kHz 342.060 MHz (355 mm x 199 mm)
                 Hfront   48 Hsync  32 Hback  80 Hpol P
                 Vfront   10 Vsync   6 Vback 1644 Vpol N
    Empty Descriptor
    Manufacturer-Specified Display Descriptor (0x02): 00 02 00 0c 33 ff 0f 3c 96 29 12 2d 96 00 00 00 '....3..<.).-....'
Checksum: 0x7e

----------------

Failures:

Block 0, Base EDID:
  Empty Descriptor: Use Dummy Descriptor instead of all zeroes.
  Missing Display Product Name.
  Missing Display Range Limits Descriptor.

EDID conformity: FAIL
