
EDID (hex):
00ffffffffffff000dae021600000000
311e0104a524147803ee95a3544c9926
0f505400000001010101010101010101
0101010101019e8580a070383e403020
a60063c71000001aad3780a070383e40
3020a60063c71000001a000000000000
00000000000000000000000000000002
000c33ff0f3c9629122d9600000000f9

Extracted contents:
header:          00 ff ff ff ff ff ff 00
serial number:   0d ae 02 16 00 00 00 00 31 1e
version:         01 04
basic params:    a5 24 14 78 03
chroma info:     ee 95 a3 54 4c 99 26 0f 50 54
established:     00 00 00
standard:        01 01 01 01 01 01 01 01 01 01 01 01 01 01 01 01
descriptor 1:    9e 85 80 a0 70 38 3e 40 30 20 a6 00 63 c7 10 00 00 1a
descriptor 2:    ad 37 80 a0 70 38 3e 40 30 20 a6 00 63 c7 10 00 00 1a
descriptor 3:    00 00 00 00 00 00 00 00 00 00 00 00 00 00 00 00 00 00
descriptor 4:    00 00 00 02 00 0c 33 ff 0f 3c 96 29 12 2d 96 00 00 00
extensions:      00
checksum:        f9

EDID version: 1.4
Manufacturer: CMN Model 1602 Serial Number --
Made in week 49 of 2020
Digital display
8 bits per primary color channel
DisplayPort interface
Maximum image size: 36 cm x 20 cm
Gamma: 2.20
Supported color formats: RGB 4:4:4
First detailed timing includes the native pixel format and preferred refresh rate
Display is continuous frequency
Display x,y Chromaticity:
  Red:   0.6396, 0.3300
  Green: 0.2998, 0.5996
  Blue:  0.1503, 0.0595
  White: 0.3134, 0.3291
Established timings supported:
Standard timings supported:
Detailed mode: Clock 342.060 MHz, 355 mm x 199 mm
               1920 1968 2000 2080 hborder 0
               1080 1090 1096 1142 vborder 0
               +hsync -vsync 
               VertFreq: 144 Hz, HorFreq: 164451 Hz
Detailed mode: Clock 142.530 MHz, 355 mm x 199 mm
               1920 1968 2000 2080 hborder 0
               1080 1090 1096 1142 vborder 0
               +hsync -vsync 
               VertFreq: 60 Hz, HorFreq: 68524 Hz
Manufacturer-specified data, tag 0
Manufacturer-specified data, tag 2
Checksum: 0xf9 (valid)
EDID block does NOT conform to EDID 1.4!
	Missing name descriptor
	Missing monitor ranges
