edid-decode (hex):

00 ff ff ff ff ff ff 00 30 e4 7d 02 00 00 00 00
00 13 01 03 80 22 13 78 0a 4e 85 9e 5b 55 95 26
18 50 54 00 00 00 01 01 01 01 01 01 01 01 01 01
01 01 01 01 01 01 12 1b 56 78 50 00 0e 30 20 20
24 00 58 c2 10 00 00 19 00 00 00 00 00 00 00 00
00 00 00 00 00 00 00 00 00 00 00 00 00 fe 00 4c
47 20 44 69 73 70 6c 61 79 0a 20 20 00 00 00 fc
00 4c 50 31 35 36 57 48 32 2d 54 4c 52 32 00 26

----------------

Block 0, Base EDID:
  EDID Structure Version & Revision: 1.3
  Vendor & Product Identification:
    Manufacturer: LGD
    Model: 637
    Made in: 2009
  Basic Display Parameters & Features:
    Digital display
    Maximum image size: 34 cm x 19 cm
    Gamma: 2.20
    RGB color display
    First detailed timing is the preferred timing
  Color Characteristics:
    Red  : 0.6181, 0.3554
    Green: 0.3349, 0.5839
    Blue : 0.1503, 0.0937
    White: 0.3134, 0.3291
  Established Timings I & II: none
  Standard Timings: none
  Detailed Timing Descriptors:
    DTD 1:  1366x768    59.635885 Hz 683:384   46.635 kHz     69.300000 MHz (344 mm x 194 mm)
                 Hfront   32 Hsync  32 Hback   56 Hpol N
                 Vfront    2 Vsync   4 Vback    8 Vpol N
    Empty Descriptor
    Alphanumeric Data String: 'LG Display'
    Display Product Name: 'LP156WH2-TLR2'
Checksum: 0x26

----------------

Failures:

Block 0, Base EDID:
  Empty Descriptor: Use Dummy Descriptor instead of all zeroes.
  Missing Display Range Limits Descriptor.

EDID conformity: FAIL
