edid-decode (hex):

00 ff ff ff ff ff ff 00 41 0c 09 41 87 51 25 02
27 09 01 01 0e 22 19 b0 e8 00 b9 a0 57 49 9b 26
10 48 4c a4 43 80 45 4f 61 59 81 99 01 01 01 01
01 01 01 01 01 01 1a 4f 40 30 62 b0 32 40 40 c0
13 00 54 ff 10 00 00 1e 00 00 00 ff 00 59 41 30
30 39 39 33 36 30 30 30 31 33 35 00 00 fc 00 50
48 49 4c 49 50 53 20 31 30 39 53 0a 00 00 00 fd
00 32 a0 1e 5f ff 00 0a 20 20 20 20 20 20 00 f7

----------------

Block 0, Base EDID:
  EDID Structure Version & Revision: 1.1
  Vendor & Product Identification:
    Manufacturer: PHL
    Model: 16649
    Serial Number: ...
    Made in: week 39 of 1999
  Basic Display Parameters & Features:
    Analog display
    Signal Level Standard: 0.700 : 0.300 : 1.000 V p-p
    Blank level equals black level
    Sync: Separate Composite SyncOnGreen
    Maximum image size: 34 cm x 25 cm
    Gamma: 2.76
    DPMS levels: Standby Suspend Off
    RGB color display
  Color Characteristics:
    Red  : 0.6250, 0.3398
    Green: 0.2851, 0.6054
    Blue : 0.1503, 0.0654
    White: 0.2832, 0.2978
  Established Timings I & II:
    IBM     :   720x400    70.081663 Hz   9:5     31.467 kHz     28.320000 MHz
    DMT 0x04:   640x480    59.940476 Hz   4:3     31.469 kHz     25.175000 MHz
    DMT 0x06:   640x480    75.000000 Hz   4:3     37.500 kHz     31.500000 MHz
    DMT 0x0b:   800x600    75.000000 Hz   4:3     46.875 kHz     49.500000 MHz
    DMT 0x12:  1024x768    75.028582 Hz   4:3     60.023 kHz     78.750000 MHz
    DMT 0x24:  1280x1024   75.024675 Hz   5:4     79.976 kHz    135.000000 MHz
    Apple   :  1152x870    75.061550 Hz 192:145   68.681 kHz    100.000000 MHz
  Standard Timings:
    DMT 0x0b:   800x600    75.000000 Hz   4:3     46.875 kHz     49.500000 MHz
    DMT 0x13:  1024x768    84.996690 Hz   4:3     68.677 kHz     94.500000 MHz
    DMT 0x25:  1280x1024   85.024098 Hz   5:4     91.146 kHz    157.500000 MHz
  Detailed Timing Descriptors:
    DTD 1:  1600x1200   75.000000 Hz   4:3     93.750 kHz    202.500000 MHz (340 mm x 255 mm)
                 Hfront   64 Hsync 192 Hback  304 Hpol P
                 Vfront    1 Vsync   3 Vback   46 Vpol P
    Display Product Serial Number: ...
    Detailed mode: 35 00 00 fc 00 50 48 49 4c 49 50 53 20 31 30 39 53 0a '5....PHILIPS 109S.'
    Display Range Limits:
      Monitor ranges (GTF): 50-160 Hz V, 30-95 kHz H, max dotclock 2550 MHz
Checksum: 0xf7

----------------

Warnings:

Block 0, Base EDID:
  EDID Structure Version & Revision: EDID 1.1 is deprecated, do not use.

Failures:

Block 0, Base EDID:
  Detailed Timing Descriptor #2: Pixelclock < 10 MHz, assuming invalid data 0x35 0x00.
  Detailed Timing Descriptor #2: Invalid detailed timing descriptor ordering.

EDID conformity: FAIL
