
EDID (hex):
00ffffffffffff005c2d002701000000
051f0103803c21783e2d1fa6564fa026
0d4f53a56b80b300a9c0950081008140
818081c07140565e00a0a0a029503020
3500584a2100001e023a801871382d40
582c450055502100001e000000fd0030
641ee13c000a202020202020000000fc
0055473237510a20202020202020013b
020340f34c0103050704901112131416
1f23090707830100006a030c00100038
7820000067d85dc40178c000681a0000
01013064ede305e301e6060701604f43
047600a0a0a0295030203600bc862100
001a5b9d00a0a0a0295030403600f42c
1100001e000000000000000000000000
000000000000000000000000000000d6

Extracted contents:
header:          00 ff ff ff ff ff ff 00
serial number:   5c 2d 00 27 01 00 00 00 05 1f
version:         01 03
basic params:    80 3c 21 78 3e
chroma info:     2d 1f a6 56 4f a0 26 0d 4f 53
established:     a5 6b 80
standard:        b3 00 a9 c0 95 00 81 00 81 40 81 80 81 c0 71 40
descriptor 1:    56 5e 00 a0 a0 a0 29 50 30 20 35 00 58 4a 21 00 00 1e
descriptor 2:    02 3a 80 18 71 38 2d 40 58 2c 45 00 55 50 21 00 00 1e
descriptor 3:    00 00 00 fd 00 30 64 1e e1 3c 00 0a 20 20 20 20 20 20
descriptor 4:    00 00 00 fc 00 55 47 32 37 51 0a 20 20 20 20 20 20 20
extensions:      01
checksum:        3b

EDID version: 1.3
Manufacturer: WAM Model 2700 Serial Number --
Made in week 5 of 2021
Digital display
Maximum image size: 60 cm x 33 cm
Gamma: 2.20
DPMS levels: Off
Undefined display color type
Default (sRGB) color space is primary color space
First detailed timing is preferred timing
Display x,y Chromaticity:
  Red:   0.6484, 0.3378
  Green: 0.3115, 0.6259
  Blue:  0.1484, 0.0517
  White: 0.3115, 0.3271
Established timings supported:
  720x400@70Hz 9:5 HorFreq: 31469 Hz Clock: 28.320 MHz
  640x480@60Hz 4:3 HorFreq: 31469 Hz Clock: 25.175 MHz
  640x480@75Hz 4:3 HorFreq: 37500 Hz Clock: 31.500 MHz
  800x600@60Hz 4:3 HorFreq: 37900 Hz Clock: 40.000 MHz
  800x600@75Hz 4:3 HorFreq: 46900 Hz Clock: 49.500 MHz
  832x624@75Hz 4:3 HorFreq: 49726 Hz Clock: 57.284 MHz
  1024x768@60Hz 4:3 HorFreq: 48400 Hz Clock: 65.000 MHz
  1024x768@75Hz 4:3 HorFreq: 60000 Hz Clock: 78.750 MHz
  1280x1024@75Hz 5:4 HorFreq: 80000 Hz Clock: 135.000 MHz
  1152x870@75Hz 192:145 HorFreq: 67500 Hz Clock: 108.000 MHz
Standard timings supported:
  1680x1050@60Hz 16:10 HorFreq: 64700 Hz Clock: 119.000 MHz
  1600x900@60Hz 16:9
  1440x900@60Hz 16:10 HorFreq: 55500 Hz Clock: 88.750 MHz
  1280x800@60Hz 16:10
  1280x960@60Hz 4:3 HorFreq: 60000 Hz Clock: 108.000 MHz
  1280x1024@60Hz 5:4 HorFreq: 64000 Hz Clock: 108.000 MHz
  1280x720@60Hz 16:9
  1152x864@60Hz 4:3
Detailed mode: Clock 241.500 MHz, 600 mm x 330 mm
               2560 2608 2640 2720 hborder 0
               1440 1443 1448 1481 vborder 0
               +hsync +vsync 
               VertFreq: 59 Hz, HorFreq: 88786 Hz
Detailed mode: Clock 148.500 MHz, 597 mm x 336 mm
               1920 2008 2052 2200 hborder 0
               1080 1084 1089 1125 vborder 0
               +hsync +vsync 
               VertFreq: 60 Hz, HorFreq: 67500 Hz
Monitor ranges (GTF): 48-100Hz V, 30-225kHz H, max dotclock 600MHz
Monitor name: UG27Q
Has 1 extension blocks
Checksum: 0x3b (valid)

CTA extension block
Extension version: 3
60 bytes of CTA data
  Video data block
    VIC   1 640x480@60Hz 4:3  HorFreq: 31469 Hz Clock: 25.175 MHz
    VIC   3 720x480@60Hz 16:9  HorFreq: 31469 Hz Clock: 27.000 MHz
    VIC   5 1920x1080i@60Hz 16:9  HorFreq: 33750 Hz Clock: 74.250 MHz
    VIC   7 1440x480i@60Hz 16:9  HorFreq: 15734 Hz Clock: 27.000 MHz
    VIC   4 1280x720@60Hz 16:9  HorFreq: 45000 Hz Clock: 74.250 MHz
    VIC  16 1920x1080@60Hz 16:9 (native) HorFreq: 67500 Hz Clock: 148.500 MHz
    VIC  17 720x576@50Hz 4:3  HorFreq: 31250 Hz Clock: 27.000 MHz
    VIC  18 720x576@50Hz 16:9  HorFreq: 31250 Hz Clock: 27.000 MHz
    VIC  19 1280x720@50Hz 16:9  HorFreq: 37500 Hz Clock: 74.250 MHz
    VIC  20 1920x1080i@50Hz 16:9  HorFreq: 28125 Hz Clock: 74.250 MHz
    VIC  22 1440x576i@50Hz 16:9  HorFreq: 15625 Hz Clock: 27.000 MHz
    VIC  31 1920x1080@50Hz 16:9  HorFreq: 56250 Hz Clock: 148.500 MHz
  Audio data block
    Linear PCM, max channels 2
      Supported sample rates (kHz): 48 44.1 32
      Supported sample sizes (bits): 24 20 16
  Speaker allocation data block
    Speaker map:
      FL/FR - Front Left/Right
  Vendor-specific data block, OUI 000c03 (HDMI)
    Source physical address 1.0.0.0
    DC_36bit
    DC_30bit
    DC_Y444
    Maximum TMDS clock: 600MHz
    Extended HDMI video details:
  Vendor-specific data block, OUI c45dd8 (HDMI Forum)
    Version: 1
    Maximum TMDS Character Rate: 600MHz
    SCDC Present
    SCDC Read Request Capable
  Vendor-specific data block, OUI 00001a
  Extended tag: Colorimetry data block
    xvYCC601
    xvYCC709
    BT2020cYCC
    BT2020YCC
    BT2020RGB
  Extended tag: HDR static metadata data block
    Electro optical transfer functions:
      Traditional gamma - SDR luminance range
      Traditional gamma - HDR luminance range
      SMPTE ST2084
    Supported static metadata descriptors:
      Static metadata type 1
    Desired content max luminance: 96 (400.000 cd/m^2)
    Desired content max frame-average luminance: 79 (276.782 cd/m^2)
    Desired content min luminance: 67 (0.276 cd/m^2)
Underscans PC formats by default
Basic audio support
Supports YCbCr 4:4:4
Supports YCbCr 4:2:2
3 native detailed modes
Detailed mode: Clock 302.120 MHz, 700 mm x 390 mm
               2560 2608 2640 2720 hborder 0
               1440 1443 1449 1481 vborder 0
               +hsync -vsync 
               VertFreq: 74 Hz, HorFreq: 111073 Hz
Detailed mode: Clock 402.830 MHz, 500 mm x 300 mm
               2560 2608 2672 2720 hborder 0
               1440 1443 1449 1481 vborder 0
               +hsync +vsync 
               VertFreq: 99 Hz, HorFreq: 148099 Hz
Checksum: 0xd6 (valid)

EDID block does NOT conform to EDID 1.3!
	sRGB is signaled, but the chromaticities do not match
	HDMI VSDB Max TMDS rate is > 340
One or more of the timings is out of range of the Monitor Ranges:
  Vertical Freq: 50 - 99 Hz
  Horizontal Freq: 15625 - 148099 Hz
  Maximum Clock: 402.830 MHz
