
EDID (hex):
00ffffffffffff0005e307193e060000
2912010368261e782a6ac6a1594b9923
174f59bfef0081800101010101010101
010101010101302a009851002a403070
13007c2c1100001e000000ff00493435
38414841303031353938000000fd0037
4b1e530e000a202020202020000000fc
003930370a20202020202020202000d1

Extracted contents:
header:          00 ff ff ff ff ff ff 00
serial number:   05 e3 07 19 3e 06 00 00 29 12
version:         01 03
basic params:    68 26 1e 78 2a
chroma info:     6a c6 a1 59 4b 99 23 17 4f 59
established:     bf ef 00
standard:        81 80 01 01 01 01 01 01 01 01 01 01 01 01 01 01
descriptor 1:    30 2a 00 98 51 00 2a 40 30 70 13 00 7c 2c 11 00 00 1e
descriptor 2:    00 00 00 ff 00 49 34 35 38 41 48 41 30 30 31 35 39 38
descriptor 3:    00 00 00 fd 00 37 4b 1e 53 0e 00 0a 20 20 20 20 20 20
descriptor 4:    00 00 00 fc 00 39 30 37 0a 20 20 20 20 20 20 20 20 20
extensions:      00
checksum:        d1

EDID version: 1.3
Manufacturer: AOC Model 1907 Serial Number --
Made in week 41 of 2008
Analog display, Input voltage level: 0.7/0.7 V
Sync: Separate 
Maximum image size: 38 cm x 30 cm
Gamma: 2.20
DPMS levels: Off
RGB color display
First detailed timing is preferred timing
Display x,y Chromaticity:
  Red:   0.6298, 0.3496
  Green: 0.2949, 0.5996
  Blue:  0.1396, 0.0898
  White: 0.3095, 0.3496
Established timings supported:
  720x400@70Hz 9:5 HorFreq: 31469 Hz Clock: 28.320 MHz
  640x480@60Hz 4:3 HorFreq: 31469 Hz Clock: 25.175 MHz
  640x480@67Hz 4:3 HorFreq: 35000 Hz Clock: 30.240 MHz
  640x480@72Hz 4:3 HorFreq: 37900 Hz Clock: 31.500 MHz
  640x480@75Hz 4:3 HorFreq: 37500 Hz Clock: 31.500 MHz
  800x600@56Hz 4:3 HorFreq: 35200 Hz Clock: 36.000 MHz
  800x600@60Hz 4:3 HorFreq: 37900 Hz Clock: 40.000 MHz
  800x600@72Hz 4:3 HorFreq: 48100 Hz Clock: 50.000 MHz
  800x600@75Hz 4:3 HorFreq: 46900 Hz Clock: 49.500 MHz
  832x624@75Hz 4:3 HorFreq: 49726 Hz Clock: 57.284 MHz
  1024x768@60Hz 4:3 HorFreq: 48400 Hz Clock: 65.000 MHz
  1024x768@70Hz 4:3 HorFreq: 56500 Hz Clock: 75.000 MHz
  1024x768@75Hz 4:3 HorFreq: 60000 Hz Clock: 78.750 MHz
  1280x1024@75Hz 5:4 HorFreq: 80000 Hz Clock: 135.000 MHz
Standard timings supported:
  1280x1024@60Hz 5:4 HorFreq: 64000 Hz Clock: 108.000 MHz
Detailed mode: Clock 108.000 MHz, 380 mm x 300 mm
               1280 1328 1440 1688 hborder 0
               1024 1025 1028 1066 vborder 0
               +hsync +vsync 
               VertFreq: 60 Hz, HorFreq: 63981 Hz
Serial number: --
Monitor ranges (GTF): 55-75Hz V, 30-83kHz H, max dotclock 140MHz
Monitor name: 907
Checksum: 0xd1 (valid)
