edid-decode (hex):

00 ff ff ff ff ff ff 00 20 a3 33 32 01 00 00 00
10 10 01 03 80 52 2e 78 0a 0d c9 a0 57 47 98 27
12 48 4c bf cf 00 01 01 01 01 01 01 01 01 01 01
01 01 01 01 01 01 01 1d 00 72 51 d0 1a 20 6e 28
55 00 7e 88 42 00 00 1a 01 1d 00 bc 52 d0 1e 20
b8 28 55 40 c4 8e 21 00 00 18 00 00 00 fc 00 4c
43 44 33 32 33 33 4e 45 55 0a 20 20 00 00 00 fd
00 32 50 0f 44 0f 00 0a 20 20 20 20 20 20 01 36

02 03 20 70 4c 01 02 04 05 06 0e 10 11 13 14 19
1f 23 09 07 07 83 01 00 00 66 03 0c 00 10 00 00
01 1d 80 18 71 1c 16 20 58 2c 25 00 c4 8e 21 00
00 9e 01 1d 80 d0 72 1c 16 20 10 2c 25 80 c4 8e
21 00 00 9e 8c 0a d0 90 20 40 31 20 0c 40 55 00
13 8e 21 00 00 18 8c 0a d0 8a 20 e0 2d 10 10 3e
96 00 13 8e 21 00 00 18 d6 09 80 a0 20 e0 2d 10
08 60 22 00 12 8e 21 08 08 18 00 00 00 00 00 29

----------------

Block 0, Base EDID:
  EDID Structure Version & Revision: 1.3
  Vendor & Product Identification:
    Manufacturer: HEC
    Model: 12851
    Serial Number: ...
    Made in: week 16 of 2006
  Basic Display Parameters & Features:
    Digital display
    Maximum image size: 82 cm x 46 cm
    Gamma: 2.20
    RGB color display
    First detailed timing is preferred timing
  Color Characteristics:
    Red  : 0.6250, 0.3398
    Green: 0.2802, 0.5947
    Blue : 0.1552, 0.0703
    White: 0.2832, 0.2978
  Established Timings I & II:
    IBM     :   720x400    70.082 Hz   9:5    31.467 kHz  28.320 MHz
    DMT 0x04:   640x480    59.940 Hz   4:3    31.469 kHz  25.175 MHz
    Apple   :   640x480    66.667 Hz   4:3    35.000 kHz  30.240 MHz
    DMT 0x05:   640x480    72.809 Hz   4:3    37.861 kHz  31.500 MHz
    DMT 0x06:   640x480    75.000 Hz   4:3    37.500 kHz  31.500 MHz
    DMT 0x08:   800x600    56.250 Hz   4:3    35.156 kHz  36.000 MHz
    DMT 0x09:   800x600    60.317 Hz   4:3    37.879 kHz  40.000 MHz
    DMT 0x0a:   800x600    72.188 Hz   4:3    48.077 kHz  50.000 MHz
    DMT 0x0b:   800x600    75.000 Hz   4:3    46.875 kHz  49.500 MHz
    DMT 0x10:  1024x768    60.004 Hz   4:3    48.363 kHz  65.000 MHz
    DMT 0x11:  1024x768    70.069 Hz   4:3    56.476 kHz  75.000 MHz
    DMT 0x12:  1024x768    75.029 Hz   4:3    60.023 kHz  78.750 MHz
    DMT 0x24:  1280x1024   75.025 Hz   5:4    79.976 kHz 135.000 MHz
  Standard Timings: none
  Detailed Timing Descriptors:
    DTD 1:  1280x720    60.322 Hz  16:9    45.000 kHz  74.250 MHz (1150 mm x 648 mm)
                 Hfront  110 Hsync  40 Hback 220 Hpol P
                 Vfront    5 Vsync   5 Vback  16 Vpol N
    DTD 2:  1280x720    50.000 Hz  16:9    37.500 kHz  74.250 MHz (708 mm x 398 mm)
                 Hfront  440 Hsync  40 Hback 220 Hpol N
                 Vfront    5 Vsync   5 Vback  20 Vpol N
    Display Product Name: 'LCD3233NEU'
  Display Range Limits:
    Monitor ranges (GTF): 50-80 Hz V, 15-68 kHz H, max dotclock 150 MHz
  Extension blocks: 1
Checksum: 0x36

----------------

Block 1, CTA-861 Extension Block:
  Revision: 3
  Basic audio support
  Supports YCbCr 4:4:4
  Supports YCbCr 4:2:2
  Native detailed modes: 0
  Video Data Block:
    VIC   1:   640x480    59.940 Hz   4:3    31.469 kHz  25.175 MHz
    VIC   2:   720x480    59.940 Hz   4:3    31.469 kHz  27.000 MHz
    VIC   4:  1280x720    60.000 Hz  16:9    45.000 kHz  74.250 MHz
    VIC   5:  1920x1080i  60.000 Hz  16:9    33.750 kHz  74.250 MHz
    VIC   6:  1440x480i   59.940 Hz   4:3    15.734 kHz  27.000 MHz
    VIC  14:  1440x480    59.940 Hz   4:3    31.469 kHz  54.000 MHz
    VIC  16:  1920x1080   60.000 Hz  16:9    67.500 kHz 148.500 MHz
    VIC  17:   720x576    50.000 Hz   4:3    31.250 kHz  27.000 MHz
    VIC  19:  1280x720    50.000 Hz  16:9    37.500 kHz  74.250 MHz
    VIC  20:  1920x1080i  50.000 Hz  16:9    28.125 kHz  74.250 MHz
    VIC  25:  2880x576i   50.000 Hz   4:3    15.625 kHz  54.000 MHz
    VIC  31:  1920x1080   50.000 Hz  16:9    56.250 kHz 148.500 MHz
  Audio Data Block:
    Linear PCM:
      Max channels: 2
      Supported sample rates (kHz): 48 44.1 32
      Supported sample sizes (bits): 24 20 16
  Speaker Allocation Data Block:
    FL/FR - Front Left/Right
  Vendor-Specific Data Block (HDMI), OUI 00-0C-03:
    Source physical address: 1.0.0.0
  Detailed Timing Descriptors:
    DTD 3:  1920x1080i  60.000 Hz  16:9    33.750 kHz  74.250 MHz (708 mm x 398 mm)
                 Hfront   88 Hsync  44 Hback 148 Hpol P
                 Vfront    2 Vsync   5 Vback  15 Vpol P Vfront +0.5 Odd Field
                 Vfront    2 Vsync   5 Vback  15 Vpol P Vback  +0.5 Even Field
    DTD 4:  1920x1080i  50.000 Hz  16:9    28.125 kHz  74.250 MHz (708 mm x 398 mm)
                 Hfront  528 Hsync  44 Hback 148 Hpol P
                 Vfront    2 Vsync   5 Vback  15 Vpol P Vfront +0.5 Odd Field
                 Vfront    2 Vsync   5 Vback  15 Vpol P Vback  +0.5 Even Field
    DTD 5:   720x576    50.000 Hz   5:4    31.250 kHz  27.000 MHz (531 mm x 398 mm)
                 Hfront   12 Hsync  64 Hback  68 Hpol N
                 Vfront    5 Vsync   5 Vback  39 Vpol N
    DTD 6:   720x480    59.940 Hz   3:2    31.469 kHz  27.000 MHz (531 mm x 398 mm)
                 Hfront   16 Hsync  62 Hback  60 Hpol N
                 Vfront    9 Vsync   6 Vback  30 Vpol N
    DTD 7:   640x480    59.952 Hz   4:3    31.475 kHz  25.180 MHz (530 mm x 398 mm)
                 Hfront    8 Hsync  96 Hback  56 Hpol N Hborder 8
                 Vfront    2 Vsync   2 Vback  41 Vpol N Vborder 8
Checksum: 0x29

----------------

Warnings:

Block 1, CTA-861 Extension Block:
  Video Data Block: VIC 1 is the preferred timing, overriding the first detailed timings. Is this intended?

Failures:

Block 0, Base EDID:
  Detailed Timing Descriptor #1: Mismatch of image size 1150x648 mm vs display size 820x460 mm.
  Detailed Timing Descriptor #2: Mismatch of image size 708x398 mm vs display size 820x460 mm.
Block 1, CTA-861 Extension Block:
  Detailed Timing Descriptor #3: Mismatch of image size 708x398 mm vs display size 820x460 mm.
  Detailed Timing Descriptor #4: Mismatch of image size 708x398 mm vs display size 820x460 mm.
  Detailed Timing Descriptor #5: Mismatch of image size 531x398 mm vs display size 820x460 mm.
  Detailed Timing Descriptor #6: Mismatch of image size 531x398 mm vs display size 820x460 mm.
  Detailed Timing Descriptor #7: Mismatch of image size 530x398 mm vs display size 820x460 mm.
All Blocks:
  Some timings are out of range of the Monitor Ranges:
    Horizontal Freq: 15.625 - 79.976 kHz (Monitor: 15.000 - 68.000 kHz)

EDID conformity: FAIL
