edid-decode (hex):

00 ff ff ff ff ff ff 00 06 af 92 29 00 00 00 00
08 1e 01 04 a5 22 13 78 03 3e 85 91 56 59 91 28
1f 50 54 00 00 00 01 01 01 01 01 01 01 01 01 01
01 01 01 01 01 01 34 8a 80 a0 70 38 64 40 6c 30
35 00 58 c1 10 00 00 18 dc 37 80 a0 70 38 3e 40
6c 30 35 00 58 c1 10 00 00 18 00 00 00 00 00 00
00 00 00 00 00 00 00 00 00 00 00 00 00 00 00 02
00 10 48 ff 0f 3c 7d 2d 1b 2a 7d 20 20 20 00 70

----------------

Block 0, Base EDID:
  EDID Structure Version & Revision: 1.4
  Vendor & Product Identification:
    Manufacturer: AUO
    Model: 10642
    Made in: week 8 of 2020
  Basic Display Parameters & Features:
    Digital display
    Bits per primary color channel: 8
    DisplayPort interface
    Maximum image size: 34 cm x 19 cm
    Gamma: 2.20
    Supported color formats: RGB 4:4:4
    First detailed timing includes the native pixel format and preferred refresh rate
    Display is continuous frequency
  Color Characteristics:
    Red  : 0.5664, 0.3388
    Green: 0.3505, 0.5683
    Blue : 0.1582, 0.1210
    White: 0.3134, 0.3291
  Established Timings I & II: none
  Standard Timings: none
  Detailed Timing Descriptors:
    DTD 1:  1920x1080  144.149283 Hz  16:9    170.096 kHz    353.800000 MHz (344 mm x 193 mm)
                 Hfront  108 Hsync  48 Hback    4 Hpol N
                 Vfront    3 Vsync   5 Vback   92 Vpol N
    DTD 2:  1920x1080   60.201401 Hz  16:9     68.750 kHz    143.000000 MHz (344 mm x 193 mm)
                 Hfront  108 Hsync  48 Hback    4 Hpol N
                 Vfront    3 Vsync   5 Vback   54 Vpol N
    Empty Descriptor
    Manufacturer-Specified Display Descriptor (0x02): 00 02 00 10 48 ff 0f 3c 7d 2d 1b 2a 7d 20 20 20 '....H..<}-.*}   '
Checksum: 0x70

----------------

Failures:

Block 0, Base EDID:
  Empty Descriptor: Use Dummy Descriptor instead of all zeroes.
  Missing Display Product Name.
  Missing Display Range Limits Descriptor.

EDID conformity: FAIL
