edid-decode (hex):

00 ff ff ff ff ff ff 00 4c a3 53 32 00 00 00 00
00 14 01 03 80 22 13 78 0a ba a5 9f 5b 4d 94 25
19 50 54 00 00 00 01 01 01 01 01 01 01 01 01 01
01 01 01 01 01 01 12 1b 56 72 50 00 0c 30 30 20
25 00 58 c2 10 00 00 19 00 00 00 0f 00 00 00 00
00 00 00 00 00 1e b4 02 74 00 00 00 00 fe 00 53
41 4d 53 55 4e 47 0a 20 20 20 20 20 00 00 00 fe
00 31 35 36 41 54 30 35 2d 59 30 32 0a 20 00 1b

----------------

Block 0, Base EDID:
  EDID Structure Version & Revision: 1.3
  Vendor & Product Identification:
    Manufacturer: SEC
    Model: 12883
    Made in: 2010
  Basic Display Parameters & Features:
    Digital display
    Maximum image size: 34 cm x 19 cm
    Gamma: 2.20
    RGB color display
    First detailed timing is preferred timing
  Color Characteristics:
    Red  : 0.6230, 0.3583
    Green: 0.3027, 0.5800
    Blue : 0.1464, 0.0996
    White: 0.3134, 0.3291
  Established Timings I & II: none
  Standard Timings: none
  Detailed Timing Descriptors:
    DTD 1:  1366x768    60.031 Hz 683:384  46.824 kHz  69.300 MHz (344 mm x 194 mm)
                 Hfront   48 Hsync  32 Hback  34 Hpol N
                 Vfront    2 Vsync   5 Vback   5 Vpol N
    Manufacturer-Specified Display Descriptor (0x0f): 00 0f 00 00 00 00 00 00 00 00 00 1e b4 02 74 00 '..............t.'
    Alphanumeric Data String: 'SAMSUNG'
    Alphanumeric Data String: '156AT05-Y02'
Checksum: 0x1b

----------------

Failures:

Block 0, Base EDID:
  Missing Display Product Name.
  Missing Display Range Limits Descriptor.

EDID conformity: FAIL
