
EDID (hex):
00ffffffffffff0034a4c48901010101
3212010308291a78ead6a5a2594a9524
145054afcf0081809500950f01010101
010101010101ab22a0a050841a303020
36009a001100001a000000fc004d4433
3039393950450a202020000000fd003c
4b1e500e000a202020202020000000ff
003831323030303535330a20202000ea

Extracted contents:
header:          00 ff ff ff ff ff ff 00
serial number:   34 a4 c4 89 01 01 01 01 32 12
version:         01 03
basic params:    08 29 1a 78 ea
chroma info:     d6 a5 a2 59 4a 95 24 14 50 54
established:     af cf 00
standard:        81 80 95 00 95 0f 01 01 01 01 01 01 01 01 01 01
descriptor 1:    ab 22 a0 a0 50 84 1a 30 30 20 36 00 9a 00 11 00 00 1a
descriptor 2:    00 00 00 fc 00 4d 44 33 30 39 39 39 50 45 0a 20 20 20
descriptor 3:    00 00 00 fd 00 3c 4b 1e 50 0e 00 0a 20 20 20 20 20 20
descriptor 4:    00 00 00 ff 00 38 31 32 30 30 30 35 35 33 0a 20 20 20
extensions:      00
checksum:        ea

EDID version: 1.3
Manufacturer: MED Model 89c4 Serial Number --
Made in week 50 of 2008
Analog display, Input voltage level: 0.7/0.3 V
Sync: Separate 
Maximum image size: 41 cm x 26 cm
Gamma: 2.20
DPMS levels: Standby Suspend Off
RGB color display
First detailed timing is preferred timing
Display x,y Chromaticity:
  Red:   0.6357, 0.3486
  Green: 0.2900, 0.5839
  Blue:  0.1425, 0.0800
  White: 0.3134, 0.3291
Established timings supported:
  720x400@70Hz 9:5 HorFreq: 31469 Hz Clock: 28.320 MHz
  640x480@60Hz 4:3 HorFreq: 31469 Hz Clock: 25.175 MHz
  640x480@72Hz 4:3 HorFreq: 37900 Hz Clock: 31.500 MHz
  640x480@75Hz 4:3 HorFreq: 37500 Hz Clock: 31.500 MHz
  800x600@56Hz 4:3 HorFreq: 35200 Hz Clock: 36.000 MHz
  800x600@60Hz 4:3 HorFreq: 37900 Hz Clock: 40.000 MHz
  800x600@72Hz 4:3 HorFreq: 48100 Hz Clock: 50.000 MHz
  800x600@75Hz 4:3 HorFreq: 46900 Hz Clock: 49.500 MHz
  1024x768@60Hz 4:3 HorFreq: 48400 Hz Clock: 65.000 MHz
  1024x768@70Hz 4:3 HorFreq: 56500 Hz Clock: 75.000 MHz
  1024x768@75Hz 4:3 HorFreq: 60000 Hz Clock: 78.750 MHz
  1280x1024@75Hz 5:4 HorFreq: 80000 Hz Clock: 135.000 MHz
Standard timings supported:
  1280x1024@60Hz 5:4 HorFreq: 64000 Hz Clock: 108.000 MHz
  1440x900@60Hz 16:10 HorFreq: 55500 Hz Clock: 88.750 MHz
  1440x900@75Hz 16:10 HorFreq: 82300 Hz Clock: 156.000 MHz
Detailed mode: Clock 88.750 MHz, 410 mm x 256 mm
               1440 1488 1520 1600 hborder 0
                900  903  909  926 vborder 0
               +hsync -vsync 
               VertFreq: 59 Hz, HorFreq: 55468 Hz
Monitor name: MD30999PE
Monitor ranges (GTF): 60-75Hz V, 30-80kHz H, max dotclock 140MHz
Serial number: --
Checksum: 0xea (valid)
One or more of the timings is out of range of the Monitor Ranges:
  Vertical Freq: 56 - 75 Hz
  Horizontal Freq: 31469 - 82300 Hz
  Maximum Clock: 156.000 MHz
