edid-decode (hex):

00 ff ff ff ff ff ff 00 22 f0 0c 26 33 38 4a 42
2e 0e 01 03 80 1e 17 78 ea b3 a5 a1 58 4f 89 26
16 50 54 ad ee 00 61 40 01 01 01 01 01 01 01 01
01 01 01 01 01 01 64 19 00 40 41 00 26 30 18 88
36 00 30 e4 10 00 00 18 00 00 00 fd 00 38 4c 1e
3f 08 00 0a 20 20 20 20 20 20 00 00 00 fc 00 68
70 20 4c 31 35 33 30 0a 20 20 20 20 00 00 00 ff
00 43 4e 50 34 34 36 42 4a 38 33 0a 20 20 00 b9

00 ff ff ff ff ff ff 00 22 f0 0c 26 33 38 4a 42
2e 0e 01 03 80 1e 17 78 ea b3 a5 a1 58 4f 89 26
16 50 54 ad ee 00 61 40 01 01 01 01 01 01 01 01
01 01 01 01 01 01 64 19 00 40 41 00 26 30 18 88
36 00 30 e4 10 00 00 18 00 00 00 fd 00 38 4c 1e
3f 08 00 0a 20 20 20 20 20 20 00 00 00 fc 00 68
70 20 4c 31 35 33 30 0a 20 20 20 20 00 00 00 ff
00 43 4e 50 34 34 36 42 4a 38 33 0a 20 20 00 b9

----------------

Block 0, Base EDID:
  EDID Structure Version & Revision: 1.3
  Vendor & Product Identification:
    Manufacturer: HWP
    Model: 9740
    Serial Number: ...
    Made in: week 46 of 2004
  Basic Display Parameters & Features:
    Digital display
    Maximum image size: 30 cm x 23 cm
    Gamma: 2.20
    DPMS levels: Standby Suspend Off
    RGB color display
    First detailed timing is the preferred timing
  Color Characteristics:
    Red  : 0.6308, 0.3466
    Green: 0.3085, 0.5380
    Blue : 0.1503, 0.0878
    White: 0.3134, 0.3291
  Established Timings I & II:
    IBM     :   720x400    70.081663 Hz   9:5     31.467 kHz     28.320000 MHz
    DMT 0x04:   640x480    59.940476 Hz   4:3     31.469 kHz     25.175000 MHz
    DMT 0x05:   640x480    72.808802 Hz   4:3     37.861 kHz     31.500000 MHz
    DMT 0x06:   640x480    75.000000 Hz   4:3     37.500 kHz     31.500000 MHz
    DMT 0x09:   800x600    60.316541 Hz   4:3     37.879 kHz     40.000000 MHz
    DMT 0x0a:   800x600    72.187572 Hz   4:3     48.077 kHz     50.000000 MHz
    DMT 0x0b:   800x600    75.000000 Hz   4:3     46.875 kHz     49.500000 MHz
    Apple   :   832x624    74.551266 Hz   4:3     49.726 kHz     57.284000 MHz
    DMT 0x10:  1024x768    60.003840 Hz   4:3     48.363 kHz     65.000000 MHz
    DMT 0x11:  1024x768    70.069359 Hz   4:3     56.476 kHz     75.000000 MHz
    DMT 0x12:  1024x768    75.028582 Hz   4:3     60.023 kHz     78.750000 MHz
  Standard Timings:
    DMT 0x10:  1024x768    60.003840 Hz   4:3     48.363 kHz     65.000000 MHz
  Detailed Timing Descriptors:
    DTD 1:  1024x768    60.003840 Hz   4:3     48.363 kHz     65.000000 MHz (304 mm x 228 mm)
                 Hfront   24 Hsync 136 Hback  160 Hpol N
                 Vfront    3 Vsync   6 Vback   29 Vpol N
    Display Range Limits:
      Monitor ranges (GTF): 56-76 Hz V, 30-63 kHz H, max dotclock 80 MHz
    Display Product Name: 'hp L1530'
    Display Product Serial Number: ...
Checksum: 0xb9

----------------

Block 1, Unknown EDID Extension Block 0x00:
  00 ff ff ff ff ff ff 00 22 f0 0c 26 33 38 4a 42 '........"..&38JB'
  2e 0e 01 03 80 1e 17 78 ea b3 a5 a1 58 4f 89 26 '.......x....XO.&'
  16 50 54 ad ee 00 61 40 01 01 01 01 01 01 01 01 '.PT...a@........'
  01 01 01 01 01 01 64 19 00 40 41 00 26 30 18 88 '......d..@A.&0..'
  36 00 30 e4 10 00 00 18 00 00 00 fd 00 38 4c 1e '6.0..........8L.'
  3f 08 00 0a 20 20 20 20 20 20 00 00 00 fc 00 68 '?...      .....h'
  70 20 4c 31 35 33 30 0a 20 20 20 20 00 00 00 ff 'p L1530.    ....'
  00 43 4e 50 34 34 36 42 4a 38 33 0a 20 20 00 b9 '.CNP446BJ83.  ..'
Checksum: 0xb9

----------------

Failures:

Block 1, Base EDID:
  Unknown Extension Block.
EDID:
  Base EDID: EDID specified 0 extension block(s), but found 1 extension block(s).

EDID conformity: FAIL
