edid-decode (hex):

00 ff ff ff ff ff ff 00 16 09 75 14 01 00 00 00
2c 1b 01 03 68 46 27 78 ea f0 65 98 57 51 91 27
21 50 54 a1 08 00 01 01 01 01 01 01 01 01 01 01
01 01 01 01 01 01 66 21 50 b0 51 00 1b 30 40 70
36 00 ba 88 21 00 00 1e 00 00 00 fd 00 38 3f 1f
32 08 00 0a 20 20 20 20 20 20 00 00 00 fc 00 4c
45 33 32 4d 31 34 37 35 0a 20 20 20 00 00 00 fe
00 0a 20 20 20 20 20 20 20 20 20 20 20 20 00 ed

----------------

Block 0, Base EDID:
  EDID Structure Version & Revision: 1.3
  Vendor & Product Identification:
    Manufacturer: EPI
    Model: 5237
    Serial Number: ...
    Made in: week 44 of 2017
  Basic Display Parameters & Features:
    Analog display
    Input voltage level: 0.7/0.7 V
    Blank level equals black level
    Sync: Separate
    Maximum image size: 70 cm x 39 cm
    Gamma: 2.20
    DPMS levels: Standby Suspend Off
    RGB color display
    First detailed timing is the preferred timing
  Color Characteristics:
    Red  : 0.5966, 0.3427
    Green: 0.3164, 0.5664
    Blue : 0.1533, 0.1308
    White: 0.3134, 0.3291
  Established Timings I & II:
    IBM     :   720x400    70.081663 Hz   9:5     31.467 kHz     28.320000 MHz
    DMT 0x04:   640x480    59.940476 Hz   4:3     31.469 kHz     25.175000 MHz
    DMT 0x09:   800x600    60.316541 Hz   4:3     37.879 kHz     40.000000 MHz
    DMT 0x10:  1024x768    60.003840 Hz   4:3     48.363 kHz     65.000000 MHz
  Standard Timings: none
  Detailed Timing Descriptors:
    DTD 1:  1360x768    60.015162 Hz  85:48    47.712 kHz     85.500000 MHz (698 mm x 392 mm)
                 Hfront   64 Hsync 112 Hback  256 Hpol P
                 Vfront    3 Vsync   6 Vback   18 Vpol P
    Display Range Limits:
      Monitor ranges (GTF): 56-63 Hz V, 31-50 kHz H, max dotclock 80 MHz
    Display Product Name: 'LE32M1475'
    Alphanumeric Data String: ''
Checksum: 0xed

----------------

Failures:

Block 0, Base EDID:
  Alphanumeric Data String: Empty string.
EDID:
  Base EDID: Some timings are out of range of the Monitor Ranges:
    Vertical Freq: 59.940 - 70.082 Hz (Monitor: 56.000 - 63.000 Hz)
    Maximum Clock: 85.500 MHz (Monitor: 80.000 MHz)

EDID conformity: FAIL
