edid-decode (hex):

00 ff ff ff ff ff ff 00 4d 10 fa 13 00 00 00 00
22 17 01 04 a5 1a 0e 78 0e de 50 a3 54 4c 99 26
0f 50 54 00 00 00 01 01 01 01 01 01 01 01 01 01
01 01 01 01 01 01 56 5e 00 a0 a0 a0 29 50 30 20
35 00 01 91 10 00 00 18 87 4b 00 a0 a0 a0 29 50
30 20 35 00 5a c2 10 00 00 18 00 00 00 fe 00 57
34 48 50 59 80 4c 51 31 31 36 54 31 00 00 00 00
00 02 41 03 28 00 12 00 00 0b 01 0a 20 20 00 4e

----------------

Block 0, Base EDID:
  EDID Structure Version & Revision: 1.4
  Vendor & Product Identification:
    Manufacturer: SHP
    Model: 5114
    Made in: week 34 of 2013
  Basic Display Parameters & Features:
    Digital display
    Bits per primary color channel: 8
    DisplayPort interface
    Maximum image size: 26 cm x 14 cm
    Gamma: 2.20
    Supported color formats: RGB 4:4:4, YCrCb 4:4:4
    Default (sRGB) color space is primary color space
    First detailed timing includes the native pixel format and preferred refresh rate
  Color Characteristics:
    Red  : 0.6396, 0.3291
    Green: 0.2998, 0.5996
    Blue : 0.1494, 0.0595
    White: 0.3125, 0.3281
  Established Timings I & II: none
  Standard Timings: none
  Detailed Timing Descriptors:
    DTD 1:  2560x1440   59.950550 Hz  16:9     88.787 kHz    241.500000 MHz (257 mm x 145 mm)
                 Hfront   48 Hsync  32 Hback   80 Hpol N
                 Vfront    3 Vsync   5 Vback   33 Vpol N
    DTD 2:  2560x1440   47.997676 Hz  16:9     71.085 kHz    193.350000 MHz (346 mm x 194 mm)
                 Hfront   48 Hsync  32 Hback   80 Hpol N
                 Vfront    3 Vsync   5 Vback   33 Vpol N
    Alphanumeric Data String: 'W4HPY'
    Manufacturer-Specified Display Descriptor (0x00): 00 00 00 02 41 03 28 00 12 00 00 0b 01 0a 20 20 '....A.(.......  '
Checksum: 0x4e

----------------

Failures:

Block 0, Base EDID:
  Basic Display Parameters & Features: sRGB is signaled, but the chromaticities do not match.
  Detailed Timing Descriptor #2: Mismatch of image size 346x194 mm vs display size 260x140 mm.
  Alphanumeric Data String: Non-printable character.
  Missing Display Product Name.

EDID conformity: FAIL
