edid-decode (hex):

00 ff ff ff ff ff ff 00 22 f0 36 33 01 01 01 01
03 1b 01 03 68 2a 1a 78 2a 6e 75 a3 55 51 a0 27
0c 50 54 a1 08 00 81 c0 81 80 81 00 95 00 01 01
01 01 01 01 01 01 9a 29 a0 d0 51 84 22 30 50 98
36 00 a3 06 11 00 00 1c 00 00 00 fd 00 32 3c 1e
46 0b 00 0a 20 20 20 20 20 20 00 00 00 fc 00 43
6f 6d 70 61 71 20 42 32 30 31 0a 20 00 00 00 ff
00 36 43 4d 37 30 33 30 54 32 38 0a 20 20 00 66

00 ff ff ff ff ff ff 00 22 f0 36 33 01 01 01 01
03 1b 01 03 68 2a 1a 78 2a 6e 75 a3 55 51 a0 27
0c 50 54 a1 08 00 81 c0 81 80 81 00 95 00 01 01
01 01 01 01 01 01 9a 29 a0 d0 51 84 22 30 50 98
36 00 a3 06 11 00 00 1c 00 00 00 fd 00 32 3c 1e
46 0b 00 0a 20 20 20 20 20 20 00 00 00 fc 00 43
6f 6d 70 61 71 20 42 32 30 31 0a 20 00 00 00 ff
00 36 43 4d 37 30 33 30 54 32 38 0a 20 20 00 66

----------------

Block 0, Base EDID:
  EDID Structure Version & Revision: 1.3
  Vendor & Product Identification:
    Manufacturer: HWP
    Model: 13110
    Serial Number: ...
    Made in: week 3 of 2017
  Basic Display Parameters & Features:
    Analog display
    Signal Level Standard: 0.700 : 0.000 : 0.700 V p-p
    Blank level equals black level
    Sync: Separate
    Maximum image size: 42 cm x 26 cm
    Gamma: 2.20
    DPMS levels: Off
    RGB color display
    First detailed timing is the preferred timing
  Color Characteristics:
    Red  : 0.6376, 0.3339
    Green: 0.3193, 0.6269
    Blue : 0.1533, 0.0498
    White: 0.3134, 0.3291
  Established Timings I & II:
    IBM     :   720x400    70.081663 Hz   9:5     31.467 kHz     28.320000 MHz
    DMT 0x04:   640x480    59.940476 Hz   4:3     31.469 kHz     25.175000 MHz
    DMT 0x09:   800x600    60.316541 Hz   4:3     37.879 kHz     40.000000 MHz
    DMT 0x10:  1024x768    60.003840 Hz   4:3     48.363 kHz     65.000000 MHz
  Standard Timings:
    DMT 0x55:  1280x720    60.000000 Hz  16:9     45.000 kHz     74.250000 MHz
    DMT 0x23:  1280x1024   60.019740 Hz   5:4     63.981 kHz    108.000000 MHz
    DMT 0x1c:  1280x800    59.810326 Hz  16:10    49.702 kHz     83.500000 MHz
    DMT 0x2f:  1440x900    59.887445 Hz  16:10    55.935 kHz    106.500000 MHz
  Detailed Timing Descriptors:
    DTD 1:  1440x900    59.887445 Hz  16:10    55.935 kHz    106.500000 MHz (419 mm x 262 mm)
                 Hfront   80 Hsync 152 Hback  232 Hpol N
                 Vfront    3 Vsync   6 Vback   25 Vpol P
    Display Range Limits:
      Monitor ranges (GTF): 50-60 Hz V, 30-70 kHz H, max dotclock 110 MHz
    Display Product Name: 'Compaq B201'
    Display Product Serial Number: ...
Checksum: 0x66

----------------

Block 1, Unknown EDID Extension Block 0x00:
  00 ff ff ff ff ff ff 00 22 f0 36 33 01 01 01 01 '........".63....'
  03 1b 01 03 68 2a 1a 78 2a 6e 75 a3 55 51 a0 27 '....h*.x*nu.UQ.''
  0c 50 54 a1 08 00 81 c0 81 80 81 00 95 00 01 01 '.PT.............'
  01 01 01 01 01 01 9a 29 a0 d0 51 84 22 30 50 98 '.......)..Q."0P.'
  36 00 a3 06 11 00 00 1c 00 00 00 fd 00 32 3c 1e '6............2<.'
  46 0b 00 0a 20 20 20 20 20 20 00 00 00 fc 00 43 'F...      .....C'
  6f 6d 70 61 71 20 42 32 30 31 0a 20 00 00 00 ff 'ompaq B201. ....'
  00 36 43 4d 37 30 33 30 54 32 38 0a 20 20 00 66 '.6CM7030T28.  .f'
Checksum: 0x66

----------------

Failures:

Block 1, Base EDID:
  Unknown Extension Block.
EDID:
  Base EDID: Some timings are out of range of the Monitor Ranges:
    Vertical Freq: 59.810 - 70.082 Hz (Monitor: 50.000 - 60.000 Hz)
  Base EDID: EDID specified 0 extension block(s), but found 1 extension block(s).

EDID conformity: FAIL
