
EDID (hex):
00ffffffffffff0026cf1a0600000000
06140103802213780a73e09f59569225
0d505400000001010101010101010101
010101010101341d56b4500026303020
3c0058c2100000190000000000000000
00000000000000000001000000fe0049
6e666f566973696f6e0a2020000000fe
004d3135364e575232205230200a008a

Extracted contents:
header:          00 ff ff ff ff ff ff 00
serial number:   26 cf 1a 06 00 00 00 00 06 14
version:         01 03
basic params:    80 22 13 78 0a
chroma info:     73 e0 9f 59 56 92 25 0d 50 54
established:     00 00 00
standard:        01 01 01 01 01 01 01 01 01 01 01 01 01 01 01 01
descriptor 1:    34 1d 56 b4 50 00 26 30 30 20 3c 00 58 c2 10 00 00 19
descriptor 2:    00 00 00 00 00 00 00 00 00 00 00 00 00 00 00 00 00 01
descriptor 3:    00 00 00 fe 00 49 6e 66 6f 56 69 73 69 6f 6e 0a 20 20
descriptor 4:    00 00 00 fe 00 4d 31 35 36 4e 57 52 32 20 52 30 20 0a
extensions:      00
checksum:        8a

EDID version: 1.3
Manufacturer: IVO Model 61a Serial Number --
Made in week 6 of 2010
Digital display
Maximum image size: 34 cm x 19 cm
Gamma: 2.20
RGB color display
First detailed timing is preferred timing
Display x,y Chromaticity:
  Red:   0.6220, 0.3505
  Green: 0.3359, 0.5732
  Blue:  0.1474, 0.0527
  White: 0.3125, 0.3281
Established timings supported:
Standard timings supported:
Detailed mode: Clock 74.760 MHz, 344 mm x 194 mm
               1366 1414 1446 1546 hborder 0
                768  771  783  806 vborder 0
               -hsync -vsync 
               VertFreq: 59 Hz, HorFreq: 48357 Hz
Manufacturer-specified data, tag 0
ASCII string: InfoVision
ASCII string: M156NWR2 R0 
Checksum: 0x8a (valid)
EDID block does NOT conform to EDID 1.3!
	Missing name descriptor
	Missing monitor ranges
