
EDID (hex):
00ffffffffffff001ab3540701000000
1611010380221b782aaea5a6544c9926
145054a54b0081800101010101010101
010101010101302a009851002a403070
1300520e1100001e000000ff00594534
533030343632330a2020000000fd0037
4c1e510e000a202020202020000000fc
004c31372d370a2020202020202000f3

Extracted contents:
header:          00 ff ff ff ff ff ff 00
serial number:   1a b3 54 07 01 00 00 00 16 11
version:         01 03
basic params:    80 22 1b 78 2a
chroma info:     ae a5 a6 54 4c 99 26 14 50 54
established:     a5 4b 00
standard:        81 80 01 01 01 01 01 01 01 01 01 01 01 01 01 01
descriptor 1:    30 2a 00 98 51 00 2a 40 30 70 13 00 52 0e 11 00 00 1e
descriptor 2:    00 00 00 ff 00 59 45 34 53 30 30 34 36 32 33 0a 20 20
descriptor 3:    00 00 00 fd 00 37 4c 1e 51 0e 00 0a 20 20 20 20 20 20
descriptor 4:    00 00 00 fc 00 4c 31 37 2d 37 0a 20 20 20 20 20 20 20
extensions:      00
checksum:        f3

EDID version: 1.3
Manufacturer: FUS Model 754 Serial Number --
Made in week 22 of 2007
Digital display
Maximum image size: 34 cm x 27 cm
Gamma: 2.20
DPMS levels: Off
RGB color display
First detailed timing is preferred timing
Display x,y Chromaticity:
  Red:   0.6503, 0.3300
  Green: 0.2998, 0.5996
  Blue:  0.1503, 0.0800
  White: 0.3134, 0.3291
Established timings supported:
  720x400@70Hz 9:5 HorFreq: 31469 Hz Clock: 28.320 MHz
  640x480@60Hz 4:3 HorFreq: 31469 Hz Clock: 25.175 MHz
  640x480@75Hz 4:3 HorFreq: 37500 Hz Clock: 31.500 MHz
  800x600@60Hz 4:3 HorFreq: 37900 Hz Clock: 40.000 MHz
  800x600@75Hz 4:3 HorFreq: 46900 Hz Clock: 49.500 MHz
  1024x768@60Hz 4:3 HorFreq: 48400 Hz Clock: 65.000 MHz
  1024x768@75Hz 4:3 HorFreq: 60000 Hz Clock: 78.750 MHz
  1280x1024@75Hz 5:4 HorFreq: 80000 Hz Clock: 135.000 MHz
Standard timings supported:
  1280x1024@60Hz 5:4 HorFreq: 64000 Hz Clock: 108.000 MHz
Detailed mode: Clock 108.000 MHz, 338 mm x 270 mm
               1280 1328 1440 1688 hborder 0
               1024 1025 1028 1066 vborder 0
               +hsync +vsync 
               VertFreq: 60 Hz, HorFreq: 63981 Hz
Serial number: --
Monitor ranges (GTF): 55-76Hz V, 30-81kHz H, max dotclock 140MHz
Monitor name: L17-7
Checksum: 0xf3 (valid)


