edid-decode (hex):

00 ff ff ff ff ff ff 00 0d ae 11 14 00 00 00 00
2d 1d 01 04 b5 1f 14 78 02 ee 95 a3 54 4c 99 26
0f 50 54 00 00 00 01 01 01 01 01 01 01 01 01 01
01 01 01 01 01 01 ae 68 00 a0 a0 40 2a 60 30 20
36 00 38 c3 10 00 00 1a ae 68 00 a0 a0 40 c4 61
30 20 36 00 38 c3 10 00 00 1a 00 00 00 fe 00 4a
47 4d 47 34 80 31 34 35 47 43 47 0a 00 00 00 00
00 03 41 01 9e 00 10 00 00 0b 01 0a 20 20 00 67

----------------

Block 0, Base EDID:
  EDID Structure Version & Revision: 1.4
  Vendor & Product Identification:
    Manufacturer: CMN
    Model: 5137
    Made in: week 45 of 2019
  Basic Display Parameters & Features:
    Digital display
    Bits per primary color channel: 10
    DisplayPort interface
    Maximum image size: 31 cm x 20 cm
    Gamma: 2.20
    Supported color formats: RGB 4:4:4
    First detailed timing includes the native pixel format and preferred refresh rate
  Color Characteristics:
    Red  : 0.6396, 0.3300
    Green: 0.2998, 0.5996
    Blue : 0.1503, 0.0595
    White: 0.3134, 0.3291
  Established Timings I & II: none
  Standard Timings: none
  Detailed Timing Descriptors:
    DTD 1:  2560x1600   60.001254 Hz   8:5     98.522 kHz    267.980000 MHz (312 mm x 195 mm)
                 Hfront   48 Hsync  32 Hback   80 Hpol P
                 Vfront    3 Vsync   6 Vback   33 Vpol N
    DTD 2:  2560x1600   48.012699 Hz   8:5     98.522 kHz    267.980000 MHz (312 mm x 195 mm)
                 Hfront   48 Hsync  32 Hback   80 Hpol P
                 Vfront    3 Vsync   6 Vback  443 Vpol N
    Alphanumeric Data String: 'JGMG4'
    Manufacturer-Specified Display Descriptor (0x00): 00 00 00 03 41 01 9e 00 10 00 00 0b 01 0a 20 20 '....A.........  '
Checksum: 0x67

----------------

Failures:

Block 0, Base EDID:
  Alphanumeric Data String: Non-printable character.
  Missing Display Product Name.

EDID conformity: FAIL
