
EDID (hex):
00ffffffffffff0009d1817845540000
0115010380291a782ed8e5a354489924
115054a56b8061c081c0818095000101
0101010101019a29a0d0518422305098
360098ff1000001c000000fd00324c1e
530e000a202020202020000000fc0042
656e5120474c3934310a2020000000ff
0039314230313930333031390a2000b1

Extracted contents:
header:          00 ff ff ff ff ff ff 00
serial number:   09 d1 81 78 45 54 00 00 01 15
version:         01 03
basic params:    80 29 1a 78 2e
chroma info:     d8 e5 a3 54 48 99 24 11 50 54
established:     a5 6b 80
standard:        61 c0 81 c0 81 80 95 00 01 01 01 01 01 01 01 01
descriptor 1:    9a 29 a0 d0 51 84 22 30 50 98 36 00 98 ff 10 00 00 1c
descriptor 2:    00 00 00 fd 00 32 4c 1e 53 0e 00 0a 20 20 20 20 20 20
descriptor 3:    00 00 00 fc 00 42 65 6e 51 20 47 4c 39 34 31 0a 20 20
descriptor 4:    00 00 00 ff 00 39 31 42 30 31 39 30 33 30 31 39 0a 20
extensions:      00
checksum:        b1

EDID version: 1.3
Manufacturer: BNQ Model 7881 Serial Number --
Made in week 1 of 2011
Digital display
Maximum image size: 41 cm x 26 cm
Gamma: 2.20
DPMS levels: Off
RGB color display
Default (sRGB) color space is primary color space
First detailed timing is preferred timing
Display x,y Chromaticity:
  Red:   0.6396, 0.3291
  Green: 0.2832, 0.5976
  Blue:  0.1435, 0.0683
  White: 0.3134, 0.3291
Established timings supported:
  720x400@70Hz 9:5 HorFreq: 31469 Hz Clock: 28.320 MHz
  640x480@60Hz 4:3 HorFreq: 31469 Hz Clock: 25.175 MHz
  640x480@75Hz 4:3 HorFreq: 37500 Hz Clock: 31.500 MHz
  800x600@60Hz 4:3 HorFreq: 37900 Hz Clock: 40.000 MHz
  800x600@75Hz 4:3 HorFreq: 46900 Hz Clock: 49.500 MHz
  832x624@75Hz 4:3 HorFreq: 49726 Hz Clock: 57.284 MHz
  1024x768@60Hz 4:3 HorFreq: 48400 Hz Clock: 65.000 MHz
  1024x768@75Hz 4:3 HorFreq: 60000 Hz Clock: 78.750 MHz
  1280x1024@75Hz 5:4 HorFreq: 80000 Hz Clock: 135.000 MHz
  1152x870@75Hz 192:145 HorFreq: 67500 Hz Clock: 108.000 MHz
Standard timings supported:
  1024x576@60Hz 16:9
  1280x720@60Hz 16:9
  1280x1024@60Hz 5:4 HorFreq: 64000 Hz Clock: 108.000 MHz
  1440x900@60Hz 16:10 HorFreq: 55500 Hz Clock: 88.750 MHz
Detailed mode: Clock 106.500 MHz, 408 mm x 255 mm
               1440 1520 1672 1904 hborder 0
                900  903  909  934 vborder 0
               -hsync +vsync 
               VertFreq: 59 Hz, HorFreq: 55934 Hz
Monitor ranges (GTF): 50-76Hz V, 30-83kHz H, max dotclock 140MHz
Monitor name: BenQ GL941
Serial number: --
Checksum: 0xb1 (valid)
EDID block does NOT conform to EDID 1.3!
	sRGB is signaled, but the chromaticities do not match
