
EDID (hex):
00ffffffffffff00244dcb2401010101
240f010380261e78ea6f86a25a4d9424
1a4f54bfef808180818c714f01010101
010101010101302a009851002a403070
1300782d1100001e000000fd00374c1e
510e000a202020202020000000ff0056
5236333937310a2020202020000000fc
0049424d204c313931700a2020200081

Extracted contents:
header:          00 ff ff ff ff ff ff 00
serial number:   24 4d cb 24 01 01 01 01 24 0f
version:         01 03
basic params:    80 26 1e 78 ea
chroma info:     6f 86 a2 5a 4d 94 24 1a 4f 54
established:     bf ef 80
standard:        81 80 81 8c 71 4f 01 01 01 01 01 01 01 01 01 01
descriptor 1:    30 2a 00 98 51 00 2a 40 30 70 13 00 78 2d 11 00 00 1e
descriptor 2:    00 00 00 fd 00 37 4c 1e 51 0e 00 0a 20 20 20 20 20 20
descriptor 3:    00 00 00 ff 00 56 52 36 33 39 37 31 0a 20 20 20 20 20
descriptor 4:    00 00 00 fc 00 49 42 4d 20 4c 31 39 31 70 0a 20 20 20
extensions:      00
checksum:        81

EDID version: 1.3
Manufacturer: IBM Model 24cb Serial Number --
Digital display
Maximum image size: 38 cm x 30 cm
Gamma: 2.20
DPMS levels: Standby Suspend Off
RGB color display
First detailed timing is preferred timing
Display x,y Chromaticity:
  Red:   0.6337, 0.3535
  Green: 0.3037, 0.5810
  Blue:  0.1425, 0.1015
  White: 0.3095, 0.3300
Established timings supported:
  720x400@70Hz 9:5 HorFreq: 31469 Hz Clock: 28.320 MHz
  640x480@60Hz 4:3 HorFreq: 31469 Hz Clock: 25.175 MHz
  640x480@67Hz 4:3 HorFreq: 35000 Hz Clock: 30.240 MHz
  640x480@72Hz 4:3 HorFreq: 37900 Hz Clock: 31.500 MHz
  640x480@75Hz 4:3 HorFreq: 37500 Hz Clock: 31.500 MHz
  800x600@56Hz 4:3 HorFreq: 35200 Hz Clock: 36.000 MHz
  800x600@60Hz 4:3 HorFreq: 37900 Hz Clock: 40.000 MHz
  800x600@72Hz 4:3 HorFreq: 48100 Hz Clock: 50.000 MHz
  800x600@75Hz 4:3 HorFreq: 46900 Hz Clock: 49.500 MHz
  832x624@75Hz 4:3 HorFreq: 49726 Hz Clock: 57.284 MHz
  1024x768@60Hz 4:3 HorFreq: 48400 Hz Clock: 65.000 MHz
  1024x768@70Hz 4:3 HorFreq: 56500 Hz Clock: 75.000 MHz
  1024x768@75Hz 4:3 HorFreq: 60000 Hz Clock: 78.750 MHz
  1280x1024@75Hz 5:4 HorFreq: 80000 Hz Clock: 135.000 MHz
  1152x870@75Hz 192:145 HorFreq: 67500 Hz Clock: 108.000 MHz
Standard timings supported:
  1280x1024@60Hz 5:4 HorFreq: 64000 Hz Clock: 108.000 MHz
  1280x1024@72Hz 5:4
  1152x864@75Hz 4:3 HorFreq: 67500 Hz Clock: 108.000 MHz
Detailed mode: Clock 108.000 MHz, 376 mm x 301 mm
               1280 1328 1440 1688 hborder 0
               1024 1025 1028 1066 vborder 0
               +hsync +vsync 
               VertFreq: 60 Hz, HorFreq: 63981 Hz
Monitor ranges (GTF): 55-76Hz V, 30-81kHz H, max dotclock 140MHz
Serial number: --
Monitor name: IBM L191p
Checksum: 0x81 (valid)
EDID block does not conform at all!
	Bad year of manufacture
