
EDID (hex):
00ffffffffffff004249700601000000
07110103814627780ade58a3544c9926
0f4547bfee00314f454c454f614a614f
455981c08bc0011d007251d01e206e28
5500c48e2100001e8c0ad08a20e02d10
103e9600c48e21000018000000fc0050
52492048444d492054560a20000000fd
0030560f4109000a2020202020200103
02031b71488504030201060701260907
0715075066030c001000808c0ad08a20
e02d10103e9600138e21000018011d80
18711c1620582c2500c48e2100009e00
00000000000000000000000000000000
00000000000000000000000000000000
00000000000000000000000000000000
000000000000000000000000000000be

Extracted contents:
header:          00 ff ff ff ff ff ff 00
serial number:   42 49 70 06 01 00 00 00 07 11
version:         01 03
basic params:    81 46 27 78 0a
chroma info:     de 58 a3 54 4c 99 26 0f 45 47
established:     bf ee 00
standard:        31 4f 45 4c 45 4f 61 4a 61 4f 45 59 81 c0 8b c0
descriptor 1:    01 1d 00 72 51 d0 1e 20 6e 28 55 00 c4 8e 21 00 00 1e
descriptor 2:    8c 0a d0 8a 20 e0 2d 10 10 3e 96 00 c4 8e 21 00 00 18
descriptor 3:    00 00 00 fc 00 50 52 49 20 48 44 4d 49 20 54 56 0a 20
descriptor 4:    00 00 00 fd 00 30 56 0f 41 09 00 0a 20 20 20 20 20 20
extensions:      01
checksum:        03

EDID version: 1.3
Manufacturer: PRI Model 670 Serial Number --
Made in week 7 of 2007
Digital display
DFP 1.x compatible TMDS
Maximum image size: 70 cm x 39 cm
Gamma: 2.20
RGB color display
First detailed timing is preferred timing
Display x,y Chromaticity:
  Red:   0.6396, 0.3291
  Green: 0.2998, 0.5996
  Blue:  0.1494, 0.0595
  White: 0.2714, 0.2773
Established timings supported:
  720x400@70Hz 9:5 HorFreq: 31469 Hz Clock: 28.320 MHz
  640x480@60Hz 4:3 HorFreq: 31469 Hz Clock: 25.175 MHz
  640x480@67Hz 4:3 HorFreq: 35000 Hz Clock: 30.240 MHz
  640x480@72Hz 4:3 HorFreq: 37900 Hz Clock: 31.500 MHz
  640x480@75Hz 4:3 HorFreq: 37500 Hz Clock: 31.500 MHz
  800x600@56Hz 4:3 HorFreq: 35200 Hz Clock: 36.000 MHz
  800x600@60Hz 4:3 HorFreq: 37900 Hz Clock: 40.000 MHz
  800x600@72Hz 4:3 HorFreq: 48100 Hz Clock: 50.000 MHz
  800x600@75Hz 4:3 HorFreq: 46900 Hz Clock: 49.500 MHz
  832x624@75Hz 4:3 HorFreq: 49726 Hz Clock: 57.284 MHz
  1024x768@60Hz 4:3 HorFreq: 48400 Hz Clock: 65.000 MHz
  1024x768@70Hz 4:3 HorFreq: 56500 Hz Clock: 75.000 MHz
  1024x768@75Hz 4:3 HorFreq: 60000 Hz Clock: 78.750 MHz
Standard timings supported:
  640x480@75Hz 4:3 HorFreq: 37500 Hz Clock: 31.500 MHz
  800x600@72Hz 4:3 HorFreq: 48100 Hz Clock: 50.000 MHz
  800x600@75Hz 4:3 HorFreq: 46900 Hz Clock: 49.500 MHz
  1024x768@70Hz 4:3 HorFreq: 56500 Hz Clock: 75.000 MHz
  1024x768@75Hz 4:3 HorFreq: 60000 Hz Clock: 78.750 MHz
  800x600@85Hz 4:3 HorFreq: 53700 Hz Clock: 56.250 MHz
  1280x720@60Hz 16:9
  1360x765@60Hz 16:9
Detailed mode: Clock 74.250 MHz, 708 mm x 398 mm
               1280 1390 1430 1650 hborder 0
                720  725  730  750 vborder 0
               +hsync +vsync 
               VertFreq: 60 Hz, HorFreq: 45000 Hz
Detailed mode: Clock 27.000 MHz, 708 mm x 398 mm
                720  736  798  858 hborder 0
                480  489  495  525 vborder 0
               -hsync -vsync 
               VertFreq: 59 Hz, HorFreq: 31468 Hz
Monitor name: PRI HDMI TV
Monitor ranges (GTF): 48-86Hz V, 15-65kHz H, max dotclock 90MHz
Has 1 extension blocks
Checksum: 0x3 (valid)

CTA extension block
Extension version: 3
23 bytes of CTA data
  Video data block
    VIC   5 1920x1080i@60Hz 16:9 (native) HorFreq: 33750 Hz Clock: 74.250 MHz
    VIC   4 1280x720@60Hz 16:9  HorFreq: 45000 Hz Clock: 74.250 MHz
    VIC   3 720x480@60Hz 16:9  HorFreq: 31469 Hz Clock: 27.000 MHz
    VIC   2 720x480@60Hz 4:3  HorFreq: 31469 Hz Clock: 27.000 MHz
    VIC   1 640x480@60Hz 4:3  HorFreq: 31469 Hz Clock: 25.175 MHz
    VIC   6 1440x480i@60Hz 4:3  HorFreq: 15734 Hz Clock: 27.000 MHz
    VIC   7 1440x480i@60Hz 16:9  HorFreq: 15734 Hz Clock: 27.000 MHz
    VIC   1 640x480@60Hz 4:3  HorFreq: 31469 Hz Clock: 25.175 MHz
  Audio data block
    Linear PCM, max channels 2
      Supported sample rates (kHz): 48 44.1 32
      Supported sample sizes (bits): 24 20 16
    AC-3, max channels 6
      Supported sample rates (kHz): 48 44.1 32
      Maximum bit rate: 640 kHz
  Vendor-specific data block, OUI 000c03 (HDMI)
    Source physical address 1.0.0.0
    Supports_AI
Basic audio support
Supports YCbCr 4:4:4
Supports YCbCr 4:2:2
1 native detailed modes
Detailed mode: Clock 27.000 MHz, 531 mm x 398 mm
                720  736  798  858 hborder 0
                480  489  495  525 vborder 0
               -hsync -vsync 
               VertFreq: 59 Hz, HorFreq: 31468 Hz
Detailed mode: Clock 74.250 MHz, 708 mm x 398 mm
               1920 2008 2052 2200 hborder 0
                540  542  547  562 vborder 0
               +hsync +vsync interlaced 
               VertFreq: 60 Hz, HorFreq: 33750 Hz
Checksum: 0xbe (valid)
