edid-decode (hex):

00 ff ff ff ff ff ff 00 4a 8b 3b 2a 01 01 01 01
2c 1d 01 04 a5 09 0f 78 3a ef 65 a6 56 52 9d 28
0b 50 54 00 00 00 01 01 01 01 01 01 01 01 01 01
01 01 01 01 01 01 fa 3c b0 58 40 80 64 70 20 18
c8 0c 72 b8 00 00 00 1e 96 37 38 a8 40 80 44 70
28 08 80 01 72 b8 00 00 00 1e ba 2c 1a a0 40 90
28 60 40 08 84 01 72 b8 00 00 00 1e 00 00 00 fc
00 0a 20 20 20 20 20 20 20 20 20 20 20 20 01 11

02 03 13 f2 40 23 09 7f 07 83 01 00 00 65 03 0c
00 10 00 9a 29 84 22 30 a0 3a 50 0a 11 36 00 72
b8 00 00 00 1e 55 1d 20 a0 30 00 2e 50 20 0a a0
01 72 b8 00 00 00 1e da 1b d0 8c 20 00 28 50 40
08 a0 01 72 b8 00 00 00 1e 9e 16 00 8c 30 00 38
40 30 0a a8 01 72 b8 00 00 00 1e 53 11 58 a4 20
c0 18 30 44 08 c4 00 72 b8 00 00 00 1e 00 00 00
00 00 00 00 00 00 00 00 00 00 00 00 00 00 00 a0

----------------

Block 0, Base EDID:
  EDID Structure Version & Revision: 1.4
  Vendor & Product Identification:
    Manufacturer: RTK
    Model: 10811
    Serial Number: ...
    Made in: week 44 of 2019
  Basic Display Parameters & Features:
    Digital display
    Bits per primary color channel: 8
    DisplayPort interface
    Maximum image size: 9 cm x 15 cm
    Gamma: 2.20
    DPMS levels: Off
    Supported color formats: RGB 4:4:4, YCrCb 4:4:4, YCrCb 4:2:2
    First detailed timing includes the native pixel format and preferred refresh rate
  Color Characteristics:
    Red  : 0.6513, 0.3378
    Green: 0.3232, 0.6162
    Blue : 0.1572, 0.0449
    White: 0.3134, 0.3291
  Established Timings I & II: none
  Standard Timings: none
  Detailed Timing Descriptors:
    DTD 1:  1200x1920   59.997848 Hz   5:8    121.196 kHz    156.100000 MHz (114 mm x 184 mm)
                 Hfront   32 Hsync  24 Hback   32 Hpol P
                 Vfront   60 Vsync   8 Vback   32 Vpol P
    DTD 2:  1080x1920   57.355350 Hz   9:16   114.022 kHz    142.300000 MHz (114 mm x 184 mm)
                 Hfront   40 Hsync   8 Hback  120 Hpol P
                 Vfront    8 Vsync  16 Vback   44 Vpol P
    DTD 3:  1050x1680   55.016337 Hz   5:8     94.628 kHz    114.500000 MHz (114 mm x 184 mm)
                 Hfront   64 Hsync   8 Hback   88 Hpol P
                 Vfront    8 Vsync  20 Vback   12 Vpol P
    Display Product Name: ''
  Extension blocks: 1
Checksum: 0x11

----------------

Block 1, CTA-861 Extension Block:
  Revision: 3
  Underscans IT Video Formats by default
  Basic audio support
  Supports YCbCr 4:4:4
  Supports YCbCr 4:2:2
  Native detailed modes: 2
  Video Data Block:
  Audio Data Block:
    Linear PCM:
      Max channels: 2
      Supported sample rates (kHz): 192 176.4 96 88.2 48 44.1 32
      Supported sample sizes (bits): 24 20 16
  Speaker Allocation Data Block:
    FL/FR - Front Left/Right
  Vendor-Specific Data Block (HDMI), OUI 00-0C-03:
    Source physical address: 1.0.0.0
  Detailed Timing Descriptors:
    DTD 4:   900x1440   76.118622 Hz   5:8    114.026 kHz    106.500000 MHz (114 mm x 184 mm)
                 Hfront   10 Hsync  17 Hback    7 Hpol P
                 Vfront    3 Vsync   6 Vback   49 Vpol P
    DTD 5:   800x1280   58.988499 Hz   5:8     78.219 kHz     75.090000 MHz (114 mm x 184 mm)
                 Hfront   32 Hsync  10 Hback  118 Hpol P
                 Vfront   10 Vsync  16 Vback   20 Vpol P
    DTD 6:   720x1280   62.808316 Hz   9:16    82.907 kHz     71.300000 MHz (114 mm x 184 mm)
                 Hfront   64 Hsync   8 Hback   68 Hpol P
                 Vfront   10 Vsync  16 Vback   14 Vpol P
    DTD 7:   768x1024   59.043074 Hz   3:4     63.767 kHz     57.900000 MHz (114 mm x 184 mm)
                 Hfront   48 Hsync  10 Hback   82 Hpol P
                 Vfront   10 Vsync  24 Vback   22 Vpol P
    DTD 8:   600x960    58.993636 Hz   5:8     58.050 kHz     44.350000 MHz (114 mm x 184 mm)
                 Hfront   68 Hsync   8 Hback   88 Hpol P
                 Vfront   12 Vsync   4 Vback    8 Vpol P
Checksum: 0xa0  Unused space in Extension Block: 18 bytes

----------------

Warnings:

Block 0, Base EDID:
  Basic Display Parameters & Features: Dubious maximum image size (9x15 is smaller than 10x10 cm).
Block 1, CTA-861 Extension Block:
  Add a Colorimetry Data Block with the sRGB colorimetry bit set to avoid interop issues.

Failures:

Block 0, Base EDID:
  Detailed Timing Descriptor #1: Mismatch of image size 114x184 mm vs display size 90x150 mm.
  Detailed Timing Descriptor #2: Mismatch of image size 114x184 mm vs display size 90x150 mm.
  Detailed Timing Descriptor #3: Mismatch of image size 114x184 mm vs display size 90x150 mm.
  Display Product Name: Empty string.
Block 1, CTA-861 Extension Block:
  Vendor-Specific Data Block (HDMI), OUI 00-0C-03: The HDMI Specification requires EDID 1.3 instead of 1.4.
  Detailed Timing Descriptor #4: Mismatch of image size 114x184 mm vs display size 90x150 mm.
  Detailed Timing Descriptor #5: Mismatch of image size 114x184 mm vs display size 90x150 mm.
  Detailed Timing Descriptor #6: Mismatch of image size 114x184 mm vs display size 90x150 mm.
  Detailed Timing Descriptor #7: Mismatch of image size 114x184 mm vs display size 90x150 mm.
  Detailed Timing Descriptor #8: Mismatch of image size 114x184 mm vs display size 90x150 mm.
  Required 640x480p60 timings are missing in the established timings and the SVD list (VIC 1).
  Missing VCDB, needed for Set Selectable RGB Quantization to avoid interop issues.
EDID:
  Base EDID: The DTD max image size is 114x184mm, which is larger than the display size 90.0x150.0mm.
  CTA-861: Native progressive timings are a mix of several resolutions.

EDID conformity: FAIL
