
EDID (hex):
00ffffffffffff004ca34c3000000000
00120103802314780a87f594574f8c27
27505400000001010101010101010101
010101010101293680a070381f403020
250061c6100000190000000f00000000
00000000002091026400000000fe0053
414d53554e470a2020202020000000fe
00313630485430312d4330310a200044

Extracted contents:
header:          00 ff ff ff ff ff ff 00
serial number:   4c a3 4c 30 00 00 00 00 00 12
version:         01 03
basic params:    80 23 14 78 0a
chroma info:     87 f5 94 57 4f 8c 27 27 50 54
established:     00 00 00
standard:        01 01 01 01 01 01 01 01 01 01 01 01 01 01 01 01
descriptor 1:    29 36 80 a0 70 38 1f 40 30 20 25 00 61 c6 10 00 00 19
descriptor 2:    00 00 00 0f 00 00 00 00 00 00 00 00 00 20 91 02 64 00
descriptor 3:    00 00 00 fe 00 53 41 4d 53 55 4e 47 0a 20 20 20 20 20
descriptor 4:    00 00 00 fe 00 31 36 30 48 54 30 31 2d 43 30 31 0a 20
extensions:      00
checksum:        44

EDID version: 1.3
Manufacturer: SEC Model 304c Serial Number --
Made in year 2008
Digital display
Maximum image size: 35 cm x 20 cm
Gamma: 2.20
RGB color display
First detailed timing is preferred timing
Display x,y Chromaticity:
  Red:   0.5800, 0.3398
  Green: 0.3095, 0.5498
  Blue:  0.1552, 0.1552
  White: 0.3134, 0.3291
Established timings supported:
Standard timings supported:
Detailed mode: Clock 138.650 MHz, 353 mm x 198 mm
               1920 1968 2000 2080 hborder 0
               1080 1082 1087 1111 vborder 0
               -hsync -vsync 
               VertFreq: 59 Hz, HorFreq: 66658 Hz
Manufacturer-specified data, tag 15
ASCII string: SAMSUNG
ASCII string: 160HT01-C01
Checksum: 0x44 (valid)
EDID block does NOT conform to EDID 1.3!
	Missing name descriptor
	Missing monitor ranges
