edid-decode (hex):

00 ff ff ff ff ff ff 00 4c 2d 34 08 34 41 54 5a
2c 15 01 03 80 29 1a 78 2a 01 f5 a2 57 52 9f 27
0a 50 54 bf ef 80 95 0f 81 80 81 40 71 4f 81 00
81 0f 01 01 01 01 9a 29 a0 d0 51 84 22 30 50 98
36 00 98 ff 10 00 00 1c 00 00 00 fd 00 38 4b 1e
51 0e 00 0a 20 20 20 20 20 20 00 00 00 fc 00 53
4d 53 31 39 41 34 35 30 0a 20 20 20 00 00 00 ff
00 48 4d 42 42 42 30 30 37 39 32 0a 20 20 01 20

02 01 04 00 01 1d 00 72 51 d0 1e 20 6e 28 55 00
98 ff 10 00 00 1e 01 1d 00 bc 52 d0 1e 20 b8 28
55 40 98 ff 10 00 00 1e 8c 0a d0 90 20 40 31 20
0c 40 55 00 98 ff 10 00 00 18 8c 0a d0 8a 20 e0
2d 10 10 3e 96 00 98 ff 10 00 00 18 00 00 00 00
00 00 00 00 00 00 00 00 00 00 00 00 00 00 00 00
00 00 00 00 00 00 00 00 00 00 00 00 00 00 00 00
00 00 00 00 00 00 00 00 00 00 00 00 00 00 00 0f

----------------

Block 0, Base EDID:
  EDID Structure Version & Revision: 1.3
  Vendor & Product Identification:
    Manufacturer: SAM
    Model: 2100
    Serial Number: ...
    Made in: week 44 of 2011
  Basic Display Parameters & Features:
    Digital display
    Maximum image size: 41 cm x 26 cm
    Gamma: 2.20
    DPMS levels: Off
    RGB color display
    First detailed timing is the preferred timing
  Color Characteristics:
    Red  : 0.6328, 0.3398
    Green: 0.3203, 0.6220
    Blue : 0.1552, 0.0419
    White: 0.3134, 0.3291
  Established Timings I & II:
    IBM     :   720x400    70.081663 Hz   9:5     31.467 kHz     28.320000 MHz
    DMT 0x04:   640x480    59.940476 Hz   4:3     31.469 kHz     25.175000 MHz
    Apple   :   640x480    66.666667 Hz   4:3     35.000 kHz     30.240000 MHz
    DMT 0x05:   640x480    72.808802 Hz   4:3     37.861 kHz     31.500000 MHz
    DMT 0x06:   640x480    75.000000 Hz   4:3     37.500 kHz     31.500000 MHz
    DMT 0x08:   800x600    56.250000 Hz   4:3     35.156 kHz     36.000000 MHz
    DMT 0x09:   800x600    60.316541 Hz   4:3     37.879 kHz     40.000000 MHz
    DMT 0x0a:   800x600    72.187572 Hz   4:3     48.077 kHz     50.000000 MHz
    DMT 0x0b:   800x600    75.000000 Hz   4:3     46.875 kHz     49.500000 MHz
    Apple   :   832x624    74.551266 Hz   4:3     49.726 kHz     57.284000 MHz
    DMT 0x10:  1024x768    60.003840 Hz   4:3     48.363 kHz     65.000000 MHz
    DMT 0x11:  1024x768    70.069359 Hz   4:3     56.476 kHz     75.000000 MHz
    DMT 0x12:  1024x768    75.028582 Hz   4:3     60.023 kHz     78.750000 MHz
    DMT 0x24:  1280x1024   75.024675 Hz   5:4     79.976 kHz    135.000000 MHz
    Apple   :  1152x870    75.061550 Hz 192:145   68.681 kHz    100.000000 MHz
  Standard Timings:
    DMT 0x30:  1440x900    74.984427 Hz  16:10    70.635 kHz    136.750000 MHz
    DMT 0x23:  1280x1024   60.019740 Hz   5:4     63.981 kHz    108.000000 MHz
    DMT 0x20:  1280x960    60.000000 Hz   4:3     60.000 kHz    108.000000 MHz
    DMT 0x15:  1152x864    75.000000 Hz   4:3     67.500 kHz    108.000000 MHz
    DMT 0x1c:  1280x800    59.810326 Hz  16:10    49.702 kHz     83.500000 MHz
    DMT 0x1d:  1280x800    74.934142 Hz  16:10    62.795 kHz    106.500000 MHz
  Detailed Timing Descriptors:
    DTD 1:  1440x900    59.887445 Hz   8:5     55.935 kHz    106.500000 MHz (408 mm x 255 mm)
                 Hfront   80 Hsync 152 Hback  232 Hpol N
                 Vfront    3 Vsync   6 Vback   25 Vpol P
    Display Range Limits:
      Monitor ranges (GTF): 56-75 Hz V, 30-81 kHz H, max dotclock 140 MHz
    Display Product Name: 'SMS19A450'
    Display Product Serial Number: ...
  Extension blocks: 1
Checksum: 0x20

----------------

Block 1, CTA-861 Extension Block:
  Revision: 1
  Detailed Timing Descriptors:
    DTD 2:  1280x720    60.000000 Hz  16:9     45.000 kHz     74.250000 MHz (408 mm x 255 mm)
                 Hfront  110 Hsync  40 Hback  220 Hpol P
                 Vfront    5 Vsync   5 Vback   20 Vpol P
    DTD 3:  1280x720    50.000000 Hz  16:9     37.500 kHz     74.250000 MHz (408 mm x 255 mm)
                 Hfront  440 Hsync  40 Hback  220 Hpol P
                 Vfront    5 Vsync   5 Vback   20 Vpol P
    DTD 4:   720x576    50.000000 Hz   5:4     31.250 kHz     27.000000 MHz (408 mm x 255 mm)
                 Hfront   12 Hsync  64 Hback   68 Hpol N
                 Vfront    5 Vsync   5 Vback   39 Vpol N
    DTD 5:   720x480    59.940060 Hz   3:2     31.469 kHz     27.000000 MHz (408 mm x 255 mm)
                 Hfront   16 Hsync  62 Hback   60 Hpol N
                 Vfront    9 Vsync   6 Vback   30 Vpol N
Checksum: 0x0f

----------------

Warnings:

Block 1, CTA-861 Extension Block:
  Display Product Serial Number is set, so the Serial Number in the Base EDID should be 0.

Failures:

Block 1, CTA-861 Extension Block:
  Missing VCDB, needed for Set Selectable RGB Quantization to avoid interop issues.
EDID:
  Base EDID: Some timings are out of range of the Monitor Ranges:
    Vertical Freq: 50.000 - 75.062 Hz (Monitor: 56.000 - 75.000 Hz)

EDID conformity: FAIL
