edid-decode (hex):

00 ff ff ff ff ff ff 00 10 8c 00 00 8f 04 00 00
20 10 01 03 7e 22 1b 78 eb 0c 55 a5 59 47 9b 24
12 50 54 bf ef 80 81 80 71 4f 31 4f 3b cc 31 ca
01 01 01 01 01 01 30 2a 00 98 51 00 2a 40 30 70
13 00 51 0e 11 00 00 1e 00 00 00 ff 00 30 30 31
31 36 37 0a 20 20 20 20 20 20 00 00 00 fd 00 37
4b 1e 50 0e ea 20 20 20 20 20 20 20 00 00 00 fc
00 46 31 37 39 53 0a 20 20 20 20 20 20 20 00 28

----------------

Block 0, Base EDID:
  EDID Structure Version & Revision: 1.3
  Vendor & Product Identification:
    Manufacturer: DDL
    Model: 0
    Serial Number: ...
    Made in: week 32 of 2006
  Basic Display Parameters & Features:
    Analog display
    Signal Level Standard: 0.700 : 0.000 : 0.700 V p-p
    Blank-to-black setup/pedestal
    Sync: Separate Composite SyncOnGreen
    Maximum image size: 34 cm x 27 cm
    Gamma: 2.20
    DPMS levels: Standby Suspend Off
    RGB color display
    First detailed timing is the preferred timing
    Supports GTF timings within operating range
  Color Characteristics:
    Red  : 0.6445, 0.3476
    Green: 0.2802, 0.6054
    Blue : 0.1416, 0.0712
    White: 0.3134, 0.3291
  Established Timings I & II:
    IBM     :   720x400    70.081663 Hz   9:5     31.467 kHz     28.320000 MHz
    DMT 0x04:   640x480    59.940476 Hz   4:3     31.469 kHz     25.175000 MHz
    Apple   :   640x480    66.666667 Hz   4:3     35.000 kHz     30.240000 MHz
    DMT 0x05:   640x480    72.808802 Hz   4:3     37.861 kHz     31.500000 MHz
    DMT 0x06:   640x480    75.000000 Hz   4:3     37.500 kHz     31.500000 MHz
    DMT 0x08:   800x600    56.250000 Hz   4:3     35.156 kHz     36.000000 MHz
    DMT 0x09:   800x600    60.316541 Hz   4:3     37.879 kHz     40.000000 MHz
    DMT 0x0a:   800x600    72.187572 Hz   4:3     48.077 kHz     50.000000 MHz
    DMT 0x0b:   800x600    75.000000 Hz   4:3     46.875 kHz     49.500000 MHz
    Apple   :   832x624    74.551266 Hz   4:3     49.726 kHz     57.284000 MHz
    DMT 0x10:  1024x768    60.003840 Hz   4:3     48.363 kHz     65.000000 MHz
    DMT 0x11:  1024x768    70.069359 Hz   4:3     56.476 kHz     75.000000 MHz
    DMT 0x12:  1024x768    75.028582 Hz   4:3     60.023 kHz     78.750000 MHz
    DMT 0x24:  1280x1024   75.024675 Hz   5:4     79.976 kHz    135.000000 MHz
    Apple   :  1152x870    75.061550 Hz 192:145   68.681 kHz    100.000000 MHz
  Standard Timings:
    DMT 0x23:  1280x1024   60.019740 Hz   5:4     63.981 kHz    108.000000 MHz
    DMT 0x15:  1152x864    75.000000 Hz   4:3     67.500 kHz    108.000000 MHz
    DMT 0x06:   640x480    75.000000 Hz   4:3     37.500 kHz     31.500000 MHz
    GTF     :   720x405    72.001119 Hz  16:9     30.456 kHz     27.289000 MHz
    GTF     :   640x360    70.000000 Hz  16:9     26.250 kHz     20.580000 MHz
  Detailed Timing Descriptors:
    DTD 1:  1280x1024   60.019740 Hz   5:4     63.981 kHz    108.000000 MHz (337 mm x 270 mm)
                 Hfront   48 Hsync 112 Hback  248 Hpol P
                 Vfront    1 Vsync   3 Vback   38 Vpol P
    Display Product Serial Number: ...
    Display Range Limits:
      Monitor ranges (Unknown (0xea)): 55-75 Hz V, 30-80 kHz H, max dotclock 140 MHz
    Display Product Name: 'F179S'
Checksum: 0x28

----------------

Warnings:

Block 0, Base EDID:
  Standard Timings: Standard Timing 720x405 has a dubious odd vertical resolution.

Failures:

Block 0, Base EDID:
  Display Range Limits: Unknown range class (0xea).
  Display Range Limits: Byte 11 is 0x20 instead of 0x0a.
EDID:
  Base EDID: Some timings are out of range of the Monitor Ranges:
    Horizontal Freq: 26.250 - 79.976 kHz (Monitor: 30.000 - 80.000 kHz)

EDID conformity: FAIL
