
EDID (hex):
00ffffffffffff0055a3000000000000
011c010380a05a780aee95a3544c9926
0f5054a30800d1c0b300810081808140
81c00101010108e80030f2705a80b058
8a0040846300001e023a801871382d40
582c450040846300001a000000fd0017
501ea03c000a202020202020000000fc
00554d432d424c415550554e4b54012e
020357715861605d5e5f101f04130514
202122030211121566656263642f0907
071507505707003d07c05f7e01830100
00e200ff6d030c003000183c20006001
020367d85dc401788001e305c301e40f
030018e3060d01011d007251d01e206e
28550040846300001e011d8018711c16
20582c250040846300009e000000001f

Extracted contents:
header:          00 ff ff ff ff ff ff 00
serial number:   55 a3 00 00 00 00 00 00 01 1c
version:         01 03
basic params:    80 a0 5a 78 0a
chroma info:     ee 95 a3 54 4c 99 26 0f 50 54
established:     a3 08 00
standard:        d1 c0 b3 00 81 00 81 80 81 40 81 c0 01 01 01 01
descriptor 1:    08 e8 00 30 f2 70 5a 80 b0 58 8a 00 40 84 63 00 00 1e
descriptor 2:    02 3a 80 18 71 38 2d 40 58 2c 45 00 40 84 63 00 00 1a
descriptor 3:    00 00 00 fd 00 17 50 1e a0 3c 00 0a 20 20 20 20 20 20
descriptor 4:    00 00 00 fc 00 55 4d 43 2d 42 4c 41 55 50 55 4e 4b 54
extensions:      01
checksum:        2e

EDID version: 1.3
Manufacturer: UMC Model 0 Serial Number --
Made in week 1 of 2018
Digital display
Maximum image size: 160 cm x 90 cm
Gamma: 2.20
RGB color display
First detailed timing is preferred timing
Display x,y Chromaticity:
  Red:   0.6396, 0.3300
  Green: 0.2998, 0.5996
  Blue:  0.1503, 0.0595
  White: 0.3134, 0.3291
Established timings supported:
  720x400@70Hz 9:5 HorFreq: 31469 Hz Clock: 28.320 MHz
  640x480@60Hz 4:3 HorFreq: 31469 Hz Clock: 25.175 MHz
  800x600@56Hz 4:3 HorFreq: 35200 Hz Clock: 36.000 MHz
  800x600@60Hz 4:3 HorFreq: 37900 Hz Clock: 40.000 MHz
  1024x768@60Hz 4:3 HorFreq: 48400 Hz Clock: 65.000 MHz
Standard timings supported:
  1920x1080@60Hz 16:9
  1680x1050@60Hz 16:10 HorFreq: 64700 Hz Clock: 119.000 MHz
  1280x800@60Hz 16:10
  1280x1024@60Hz 5:4 HorFreq: 64000 Hz Clock: 108.000 MHz
  1280x960@60Hz 4:3 HorFreq: 60000 Hz Clock: 108.000 MHz
  1280x720@60Hz 16:9
Detailed mode: Clock 594.000 MHz, 1600 mm x 900 mm
               3840 4016 4104 4400 hborder 0
               2160 2168 2178 2250 vborder 0
               +hsync +vsync 
               VertFreq: 60 Hz, HorFreq: 135000 Hz
Detailed mode: Clock 148.500 MHz, 1600 mm x 900 mm
               1920 2008 2052 2200 hborder 0
               1080 1084 1089 1125 vborder 0
               +hsync -vsync 
               VertFreq: 60 Hz, HorFreq: 67500 Hz
Monitor ranges (GTF): 23-80Hz V, 30-160kHz H, max dotclock 600MHz
Has 1 extension blocks
Checksum: 0x2e (valid)

CTA extension block
Extension version: 3
83 bytes of CTA data
  Video data block
    VIC  97 3840x2160@60Hz 16:9  HorFreq: 135000 Hz Clock: 594.000 MHz
    VIC  96 3840x2160@50Hz 16:9  HorFreq: 112500 Hz Clock: 594.000 MHz
    VIC  93 3840x2160@24Hz 16:9  HorFreq: 54000 Hz Clock: 297.000 MHz
    VIC  94 3840x2160@25Hz 16:9  HorFreq: 56250 Hz Clock: 297.000 MHz
    VIC  95 3840x2160@30Hz 16:9  HorFreq: 67500 Hz Clock: 297.000 MHz
    VIC  16 1920x1080@60Hz 16:9  HorFreq: 67500 Hz Clock: 148.500 MHz
    VIC  31 1920x1080@50Hz 16:9  HorFreq: 56250 Hz Clock: 148.500 MHz
    VIC   4 1280x720@60Hz 16:9  HorFreq: 45000 Hz Clock: 74.250 MHz
    VIC  19 1280x720@50Hz 16:9  HorFreq: 37500 Hz Clock: 74.250 MHz
    VIC   5 1920x1080i@60Hz 16:9  HorFreq: 33750 Hz Clock: 74.250 MHz
    VIC  20 1920x1080i@50Hz 16:9  HorFreq: 28125 Hz Clock: 74.250 MHz
    VIC  32 1920x1080@24Hz 16:9  HorFreq: 27000 Hz Clock: 74.250 MHz
    VIC  33 1920x1080@25Hz 16:9  HorFreq: 28125 Hz Clock: 74.250 MHz
    VIC  34 1920x1080@30Hz 16:9  HorFreq: 33750 Hz Clock: 74.250 MHz
    VIC   3 720x480@60Hz 16:9  HorFreq: 31469 Hz Clock: 27.000 MHz
    VIC   2 720x480@60Hz 4:3  HorFreq: 31469 Hz Clock: 27.000 MHz
    VIC  17 720x576@50Hz 4:3  HorFreq: 31250 Hz Clock: 27.000 MHz
    VIC  18 720x576@50Hz 16:9  HorFreq: 31250 Hz Clock: 27.000 MHz
    VIC  21 1440x576i@50Hz 4:3  HorFreq: 15625 Hz Clock: 27.000 MHz
    VIC 102 4096x2160@60Hz 256:135  HorFreq: 135000 Hz Clock: 594.000 MHz
    VIC 101 4096x2160@50Hz 256:135  HorFreq: 112500 Hz Clock: 594.000 MHz
    VIC  98 4096x2160@24Hz 256:135  HorFreq: 54000 Hz Clock: 297.000 MHz
    VIC  99 4096x2160@25Hz 256:135  HorFreq: 56250 Hz Clock: 297.000 MHz
    VIC 100 4096x2160@30Hz 256:135  HorFreq: 67500 Hz Clock: 297.000 MHz
  Audio data block
    Linear PCM, max channels 2
      Supported sample rates (kHz): 48 44.1 32
      Supported sample sizes (bits): 24 20 16
    AC-3, max channels 6
      Supported sample rates (kHz): 48 44.1 32
      Maximum bit rate: 640 kHz
    Dolby Digital+, max channels 8
      Supported sample rates (kHz): 48 44.1 32
    DTS, max channels 6
      Supported sample rates (kHz): 48 44.1 32
      Maximum bit rate: 1536 kHz
    DTS-HD, max channels 8
      Supported sample rates (kHz): 192 176.4 96 88.2 48 44.1
  Speaker allocation data block
    Speaker map:
      FL/FR - Front Left/Right
  Extended tag: Video capability data block
    YCbCr quantization: Selectable (via AVI YQ) (1)
    RGB quantization: Selectable (via AVI Q) (1)
    PT scan behaviour: Support both over- and underscan (3)
    IT scan behaviour: Support both over- and underscan (3)
    CE scan behaviour: Support both over- and underscan (3)
  Vendor-specific data block, OUI 000c03 (HDMI)
    Source physical address 3.0.0.0
    DC_30bit
    DC_Y444
    Maximum TMDS clock: 300MHz
    Extended HDMI video details:
      HDMI VIC 1 3840x2160@30Hz 16:9 HorFreq: 67500 Hz Clock: 297.000 MHz
      HDMI VIC 2 3840x2160@25Hz 16:9 HorFreq: 56250 Hz Clock: 297.000 MHz
      HDMI VIC 3 3840x2160@24Hz 16:9 HorFreq: 54000 Hz Clock: 297.000 MHz
  Vendor-specific data block, OUI c45dd8 (HDMI Forum)
    Version: 1
    Maximum TMDS Character Rate: 600MHz
    SCDC Present
    Supports 10-bits/component Deep Color 4:2:0 Pixel Encoding
  Extended tag: Colorimetry data block
    xvYCC601
    xvYCC709
    BT2020YCC
    BT2020RGB
  Extended tag: YCbCr 4:2:0 capability map data block
    VSD Index 0
    VSD Index 1
    VSD Index 19
    VSD Index 20
  Extended tag: HDR static metadata data block
    Electro optical transfer functions:
      Traditional gamma - SDR luminance range
      SMPTE ST2084
      Hybrid Log-Gamma
    Supported static metadata descriptors:
      Static metadata type 1
Basic audio support
Supports YCbCr 4:4:4
Supports YCbCr 4:2:2
1 native detailed modes
Detailed mode: Clock 74.250 MHz, 1600 mm x 900 mm
               1280 1390 1430 1650 hborder 0
                720  725  730  750 vborder 0
               +hsync +vsync 
               VertFreq: 60 Hz, HorFreq: 45000 Hz
Detailed mode: Clock 74.250 MHz, 1600 mm x 900 mm
               1920 2008 2052 2200 hborder 0
                540  542  547  562 vborder 0
               +hsync +vsync interlaced 
               VertFreq: 60 Hz, HorFreq: 33750 Hz
Checksum: 0x1f (valid)

EDID block does NOT conform to EDID 1.3!
	Name descriptor not terminated with a newline
One or more of the timings is out of range of the Monitor Ranges:
  Vertical Freq: 24 - 70 Hz
  Horizontal Freq: 15625 - 135000 Hz
  Maximum Clock: 594.000 MHz


