
EDID (hex):
00ffffffffffff002264400672360000
26130103802314780af7659f56579c26
11505400000001010101010101010101
010101010101781d56c2500026303042
680061c710000019000000fe00000000
00000000000000000000000000fc0048
5344313630504857310a202000000010
000a20202020202020202020202000fb

Extracted contents:
header:          00 ff ff ff ff ff ff 00
serial number:   22 64 40 06 72 36 00 00 26 13
version:         01 03
basic params:    80 23 14 78 0a
chroma info:     f7 65 9f 56 57 9c 26 11 50 54
established:     00 00 00
standard:        01 01 01 01 01 01 01 01 01 01 01 01 01 01 01 01
descriptor 1:    78 1d 56 c2 50 00 26 30 30 42 68 00 61 c7 10 00 00 19
descriptor 2:    00 00 00 fe 00 00 00 00 00 00 00 00 00 00 00 00 00 00
descriptor 3:    00 00 00 fc 00 48 53 44 31 36 30 50 48 57 31 0a 20 20
descriptor 4:    00 00 00 10 00 0a 20 20 20 20 20 20 20 20 20 20 20 20
extensions:      00
checksum:        fb

EDID version: 1.3
Manufacturer: HSD Model 640 Serial Number --
Made in week 38 of 2009
Digital display
Maximum image size: 35 cm x 20 cm
Gamma: 2.20
RGB color display
First detailed timing is preferred timing
Display x,y Chromaticity:
  Red:   0.6240, 0.3388
  Green: 0.3408, 0.6123
  Blue:  0.1494, 0.0683
  White: 0.3134, 0.3291
Established timings supported:
Standard timings supported:
Detailed mode: Clock 75.440 MHz, 353 mm x 199 mm
               1366 1414 1480 1560 hborder 0
                768  774  782  806 vborder 0
               -hsync -vsync 
               VertFreq: 59 Hz, HorFreq: 48358 Hz
ASCII string: 
Monitor name: HSD160PHW1
Dummy block
Checksum: 0xfb (valid)
EDID block does NOT conform to EDID 1.3!
	Missing monitor ranges
	Detailed block string not properly terminated
EDID block does not conform at all!
	Dummy block filled with garbage
