edid-decode (hex):

00 ff ff ff ff ff ff 00 22 64 40 06 88 55 02 00
10 10 01 03 80 23 14 78 0a f7 65 9f 56 57 9c 26
11 50 54 00 00 00 01 01 01 01 01 01 01 01 01 01
01 01 01 01 01 01 78 1d 56 c2 50 00 26 30 30 42
68 00 61 c7 10 00 00 19 00 00 00 fe 00 00 00 00
00 00 00 00 00 00 00 00 00 00 00 00 00 fc 00 48
53 44 31 36 30 50 48 57 31 0a 20 20 00 00 00 10
00 0a 20 20 20 20 20 20 20 20 20 20 20 20 00 dd

----------------

Block 0, Base EDID:
  EDID Structure Version & Revision: 1.3
  Vendor & Product Identification:
    Manufacturer: HSD
    Model: 1600
    Serial Number: ...
    Made in: week 16 of 2006
  Basic Display Parameters & Features:
    Digital display
    Maximum image size: 35 cm x 20 cm
    Gamma: 2.20
    RGB color display
    First detailed timing is preferred timing
  Color Characteristics:
    Red  : 0.6240, 0.3388
    Green: 0.3408, 0.6123
    Blue : 0.1494, 0.0683
    White: 0.3134, 0.3291
  Established Timings I & II: none
  Standard Timings: none
  Detailed Timing Descriptors:
    DTD 1:  1366x768    59.999 Hz 683:384  48.359 kHz  75.440 MHz (353 mm x 199 mm)
                 Hfront   48 Hsync  66 Hback  80 Hpol N
                 Vfront    6 Vsync   8 Vback  24 Vpol N
    Alphanumeric Data String: ''
    Display Product Name: 'HSD160PHW1'
    Dummy Descriptor:
Checksum: 0xdd
