
EDID (hex):
00ffffffffffff005c23431001010101
041a0104b53c2278224ae0b04d37b324
0e5054a1080081c08180a940d1c00101
010101010101565e00a0a0a029503020
3500544f2100001a000000ff00303030
36414251313030333134000000fc0043
696e74697120323751484454000000fd
00314c487319000a20202020202001a3
02030f01449001030465030c00100056
5e00a0a0a0295030203500544f210000
1a000000000000000000000000000000
00000000000000000000000000000000
00000000000000000000000000000000
00000000000000000000000000000000
00000000000000000000000000000000
0000000000000000000000000000001b

Extracted contents:
header:          00 ff ff ff ff ff ff 00
serial number:   5c 23 43 10 01 01 01 01 04 1a
version:         01 04
basic params:    b5 3c 22 78 22
chroma info:     4a e0 b0 4d 37 b3 24 0e 50 54
established:     a1 08 00
standard:        81 c0 81 80 a9 40 d1 c0 01 01 01 01 01 01 01 01
descriptor 1:    56 5e 00 a0 a0 a0 29 50 30 20 35 00 54 4f 21 00 00 1a
descriptor 2:    00 00 00 ff 00 30 30 30 36 41 42 51 31 30 30 33 31 34
descriptor 3:    00 00 00 fc 00 43 69 6e 74 69 71 20 32 37 51 48 44 54
descriptor 4:    00 00 00 fd 00 31 4c 48 73 19 00 0a 20 20 20 20 20 20
extensions:      01
checksum:        a3

EDID version: 1.4
Manufacturer: WAC Model 1043 Serial Number --
Made in week 4 of 2016
Digital display
10 bits per primary color channel
DisplayPort interface
Maximum image size: 60 cm x 34 cm
Gamma: 2.20
DPMS levels: Off
Supported color formats: RGB 4:4:4
First detailed timing includes the native pixel format and preferred refresh rate
Display x,y Chromaticity:
  Red:   0.6884, 0.3007
  Green: 0.2167, 0.7011
  Blue:  0.1435, 0.0566
  White: 0.3125, 0.3281
Established timings supported:
  720x400@70Hz 9:5 HorFreq: 31469 Hz Clock: 28.320 MHz
  640x480@60Hz 4:3 HorFreq: 31469 Hz Clock: 25.175 MHz
  800x600@60Hz 4:3 HorFreq: 37900 Hz Clock: 40.000 MHz
  1024x768@60Hz 4:3 HorFreq: 48400 Hz Clock: 65.000 MHz
Standard timings supported:
  1280x720@60Hz 16:9
  1280x1024@60Hz 5:4 HorFreq: 64000 Hz Clock: 108.000 MHz
  1600x1200@60Hz 4:3 HorFreq: 75000 Hz Clock: 162.000 MHz
  1920x1080@60Hz 16:9
Detailed mode: Clock 241.500 MHz, 596 mm x 335 mm
               2560 2608 2640 2720 hborder 0
               1440 1443 1448 1481 vborder 0
               +hsync -vsync 
               VertFreq: 59 Hz, HorFreq: 88786 Hz
Serial number: --
Monitor ranges (GTF): 49-76Hz V, 72-115kHz H, max dotclock 250MHz
Has 1 extension blocks
Checksum: 0xa3 (valid)

CTA extension block
Extension version: 3
11 bytes of CTA data
  Video data block
    VIC  16 1920x1080@60Hz 16:9 (native) HorFreq: 67500 Hz Clock: 148.500 MHz
    VIC   1 640x480@60Hz 4:3  HorFreq: 31469 Hz Clock: 25.175 MHz
    VIC   3 720x480@60Hz 16:9  HorFreq: 31469 Hz Clock: 27.000 MHz
    VIC   4 1280x720@60Hz 16:9  HorFreq: 45000 Hz Clock: 74.250 MHz
  Vendor-specific data block, OUI 000c03 (HDMI)
    Source physical address 1.0.0.0
1 native detailed modes
Detailed mode: Clock 241.500 MHz, 596 mm x 335 mm
               2560 2608 2640 2720 hborder 0
               1440 1443 1448 1481 vborder 0
               +hsync -vsync 
               VertFreq: 59 Hz, HorFreq: 88786 Hz
Checksum: 0x1b (valid)

EDID block does NOT conform to EDID 1.4!
	Name descriptor not terminated with a newline
Warning: One or more of the timings is out of range of the Monitor Ranges:
  Vertical Freq: 59 - 70 Hz
  Horizontal Freq: 31469 - 88786 Hz
  Maximum Clock: 241.500 MHz
EDID block does not conform at all!
	Both the serial number and the serial string are set


