edid-decode (hex):

00 ff ff ff ff ff ff 00 22 0e 35 37 01 01 01 01
1e 1f 01 04 a5 3c 22 78 3b 31 e5 ac 4f 44 9f 24
15 50 54 a1 08 00 d1 00 d1 c0 b3 00 a9 c0 95 00
81 80 81 00 81 c0 56 5e 00 a0 a0 a0 29 50 30 20
35 00 55 50 21 00 00 1a 00 00 00 fd 00 3c a5 ff
ff 48 01 0a 20 20 20 20 20 20 00 00 00 fc 00 48
50 20 58 32 37 71 63 0a 20 20 20 20 00 00 00 ff
00 43 4e 43 31 33 30 31 37 32 47 0a 20 20 02 56

02 03 25 f1 47 10 3f 40 04 03 02 01 23 09 07 07
83 01 00 00 6d 1a 00 00 02 01 3c a5 00 00 00 00
00 00 e2 00 6b 09 ec 00 a0 a0 a0 67 50 30 20 35
00 55 50 21 00 00 1a 6f c2 00 a0 a0 a0 55 50 30
20 35 00 55 50 21 00 00 1e d9 76 00 a0 a0 a0 34
50 30 20 35 00 55 50 21 00 00 1a 00 00 00 00 00
00 00 00 00 00 00 00 00 00 00 00 00 00 00 00 00
00 00 00 00 00 00 00 00 00 00 00 00 00 00 00 67

70 12 79 00 00 03 01 14 40 10 01 88 ff 09 00 01
08 00 20 00 9f 05 3c 00 06 00 08 00 00 00 00 00
00 00 00 00 00 00 00 00 00 00 00 00 00 00 00 00
00 00 00 00 00 00 00 00 00 00 00 00 00 00 00 00
00 00 00 00 00 00 00 00 00 00 00 00 00 00 00 00
00 00 00 00 00 00 00 00 00 00 00 00 00 00 00 00
00 00 00 00 00 00 00 00 00 00 00 00 00 00 00 00
00 00 00 00 00 00 00 00 00 00 00 00 00 00 65 90

00 ff ff ff ff ff ff 00 22 0e 35 37 01 01 01 01
1e 1f 01 04 a5 3c 22 78 3b 31 e5 ac 4f 44 9f 24
15 50 54 a1 08 00 d1 00 d1 c0 b3 00 a9 c0 95 00
81 80 81 00 81 c0 56 5e 00 a0 a0 a0 29 50 30 20
35 00 55 50 21 00 00 1a 00 00 00 fd 00 3c a5 ff
ff 48 01 0a 20 20 20 20 20 20 00 00 00 fc 00 48
50 20 58 32 37 71 63 0a 20 20 20 20 00 00 00 ff
00 43 4e 43 31 33 30 31 37 32 47 0a 20 20 02 56

02 03 25 f1 47 10 3f 40 04 03 02 01 23 09 07 07
83 01 00 00 6d 1a 00 00 02 01 3c a5 00 00 00 00
00 00 e2 00 6b 09 ec 00 a0 a0 a0 67 50 30 20 35
00 55 50 21 00 00 1a 6f c2 00 a0 a0 a0 55 50 30
20 35 00 55 50 21 00 00 1e d9 76 00 a0 a0 a0 34
50 30 20 35 00 55 50 21 00 00 1a 00 00 00 00 00
00 00 00 00 00 00 00 00 00 00 00 00 00 00 00 00
00 00 00 00 00 00 00 00 00 00 00 00 00 00 00 67

70 12 79 00 00 03 01 14 40 10 01 88 ff 09 00 01
08 00 20 00 9f 05 3c 00 06 00 08 00 00 00 00 00
00 00 00 00 00 00 00 00 00 00 00 00 00 00 00 00
00 00 00 00 00 00 00 00 00 00 00 00 00 00 00 00
00 00 00 00 00 00 00 00 00 00 00 00 00 00 00 00
00 00 00 00 00 00 00 00 00 00 00 00 00 00 00 00
00 00 00 00 00 00 00 00 00 00 00 00 00 00 00 00
00 00 00 00 00 00 00 00 00 00 00 00 00 00 65 90

----------------

Block 0, Base EDID:
  EDID Structure Version & Revision: 1.4
  Vendor & Product Identification:
    Manufacturer: HPN
    Model: 14133
    Serial Number: ...
    Made in: week 30 of 2021
  Basic Display Parameters & Features:
    Digital display
    Bits per primary color channel: 8
    DisplayPort interface
    Maximum image size: 60 cm x 34 cm
    Gamma: 2.20
    DPMS levels: Off
    Supported color formats: RGB 4:4:4, YCrCb 4:4:4, YCrCb 4:2:2
    First detailed timing includes the native pixel format and preferred refresh rate
    Display is continuous frequency
  Color Characteristics:
    Red  : 0.6718, 0.3115
    Green: 0.2656, 0.6220
    Blue : 0.1435, 0.0839
    White: 0.3134, 0.3291
  Established Timings I & II:
    IBM     :   720x400    70.081663 Hz   9:5     31.467 kHz     28.320000 MHz
    DMT 0x04:   640x480    59.940476 Hz   4:3     31.469 kHz     25.175000 MHz
    DMT 0x09:   800x600    60.316541 Hz   4:3     37.879 kHz     40.000000 MHz
    DMT 0x10:  1024x768    60.003840 Hz   4:3     48.363 kHz     65.000000 MHz
  Standard Timings:
    DMT 0x45:  1920x1200   59.884600 Hz  16:10    74.556 kHz    193.250000 MHz
    DMT 0x52:  1920x1080   60.000000 Hz  16:9     67.500 kHz    148.500000 MHz
    DMT 0x3a:  1680x1050   59.954250 Hz  16:10    65.290 kHz    146.250000 MHz
    DMT 0x53:  1600x900    60.000000 Hz  16:9     60.000 kHz    108.000000 MHz (RB)
    DMT 0x2f:  1440x900    59.887445 Hz  16:10    55.935 kHz    106.500000 MHz
    DMT 0x23:  1280x1024   60.019740 Hz   5:4     63.981 kHz    108.000000 MHz
    DMT 0x1c:  1280x800    59.810326 Hz  16:10    49.702 kHz     83.500000 MHz
    DMT 0x55:  1280x720    60.000000 Hz  16:9     45.000 kHz     74.250000 MHz
  Detailed Timing Descriptors:
    DTD 1:  2560x1440   59.950550 Hz  16:9     88.787 kHz    241.500000 MHz (597 mm x 336 mm)
                 Hfront   48 Hsync  32 Hback   80 Hpol P
                 Vfront    3 Vsync   5 Vback   33 Vpol N
    Display Range Limits:
      Monitor ranges (Bare Limits): 60-165 Hz V, 255-255 kHz H, max dotclock 720 MHz
    Display Product Name: 'HP X27qc'
    Display Product Serial Number: ...
  Extension blocks: 2
Checksum: 0x56

----------------

Block 1, CTA-861 Extension Block:
  Revision: 3
  Underscans IT Video Formats by default
  Basic audio support
  Supports YCbCr 4:4:4
  Supports YCbCr 4:2:2
  Native detailed modes: 1
  Video Data Block:
    VIC  16:  1920x1080   60.000000 Hz  16:9     67.500 kHz    148.500000 MHz
    VIC  63:  1920x1080  120.000000 Hz  16:9    135.000 kHz    297.000000 MHz
    VIC  64:  1920x1080  100.000000 Hz  16:9    112.500 kHz    297.000000 MHz
    VIC   4:  1280x720    60.000000 Hz  16:9     45.000 kHz     74.250000 MHz
    VIC   3:   720x480    59.940060 Hz  16:9     31.469 kHz     27.000000 MHz
    VIC   2:   720x480    59.940060 Hz   4:3     31.469 kHz     27.000000 MHz
    VIC   1:   640x480    59.940476 Hz   4:3     31.469 kHz     25.175000 MHz
  Audio Data Block:
    Linear PCM:
      Max channels: 2
      Supported sample rates (kHz): 48 44.1 32
      Supported sample sizes (bits): 24 20 16
  Speaker Allocation Data Block:
    FL/FR - Front Left/Right
  Vendor-Specific Data Block (AMD), OUI 00-00-1A:
    Version: 2.1
    Minimum Refresh Rate: 60 Hz
    Maximum Refresh Rate: 165 Hz
    Flags 1.x: 0x00
    Flags 2.x: 0x00
    Maximum luminance: 0 (50.000 cd/m^2)
    Minimum luminance: 0 (0.000 cd/m^2)
    Unknown: 0x00 0x00
  Video Capability Data Block:
    YCbCr quantization: No Data
    RGB quantization: Selectable (via AVI Q)
    PT scan behavior: Always Underscanned
    IT scan behavior: Always Underscanned
    CE scan behavior: Supports both over- and underscan
  Detailed Timing Descriptors:
    DTD 2:  2560x1440  143.973257 Hz  16:9    222.151 kHz    604.250000 MHz (597 mm x 336 mm)
                 Hfront   48 Hsync  32 Hback   80 Hpol P
                 Vfront    3 Vsync   5 Vback   95 Vpol N
    DTD 3:  2560x1440  119.997589 Hz  16:9    182.996 kHz    497.750000 MHz (597 mm x 336 mm)
                 Hfront   48 Hsync  32 Hback   80 Hpol P
                 Vfront    3 Vsync   5 Vback   77 Vpol P
    DTD 4:  2560x1440   74.970923 Hz  16:9    111.857 kHz    304.250000 MHz (597 mm x 336 mm)
                 Hfront   48 Hsync  32 Hback   80 Hpol P
                 Vfront    3 Vsync   5 Vback   44 Vpol N
Checksum: 0x67  Unused space in Extension Block: 36 bytes

----------------

Block 2, DisplayID Extension Block:
  Version: 1.2
  Extension Count: 0
  Display Product Type: Extension Section
  Video Timing Modes Type 1 - Detailed Timings Data Block:
    DTD:  2560x1440  164.833904 Hz   0:0    247.416 kHz    696.970000 MHz (aspect undefined, no 3D stereo, preferred)
               Hfront    9 Hsync  33 Hback  215 Hpol N
               Vfront    7 Vsync   9 Vback   45 Vpol N
  Checksum: 0x65
Checksum: 0x90

----------------

Block 3, Unknown EDID Extension Block 0x00:
  00 ff ff ff ff ff ff 00 22 0e 35 37 01 01 01 01 '........".57....'
  1e 1f 01 04 a5 3c 22 78 3b 31 e5 ac 4f 44 9f 24 '.....<"x;1..OD.$'
  15 50 54 a1 08 00 d1 00 d1 c0 b3 00 a9 c0 95 00 '.PT.............'
  81 80 81 00 81 c0 56 5e 00 a0 a0 a0 29 50 30 20 '......V^....)P0 '
  35 00 55 50 21 00 00 1a 00 00 00 fd 00 3c a5 ff '5.UP!........<..'
  ff 48 01 0a 20 20 20 20 20 20 00 00 00 fc 00 48 '.H..      .....H'
  50 20 58 32 37 71 63 0a 20 20 20 20 00 00 00 ff 'P X27qc.    ....'
  00 43 4e 43 31 33 30 31 37 32 47 0a 20 20 02 56 '.CNC130172G.  .V'
Checksum: 0x56

----------------

Block 4, CTA-861 Extension Block:
  Revision: 3
  Underscans IT Video Formats by default
  Basic audio support
  Supports YCbCr 4:4:4
  Supports YCbCr 4:2:2
  Native detailed modes: 1
  Video Data Block:
    VIC  16:  1920x1080   60.000000 Hz  16:9     67.500 kHz    148.500000 MHz
    VIC  63:  1920x1080  120.000000 Hz  16:9    135.000 kHz    297.000000 MHz
    VIC  64:  1920x1080  100.000000 Hz  16:9    112.500 kHz    297.000000 MHz
    VIC   4:  1280x720    60.000000 Hz  16:9     45.000 kHz     74.250000 MHz
    VIC   3:   720x480    59.940060 Hz  16:9     31.469 kHz     27.000000 MHz
    VIC   2:   720x480    59.940060 Hz   4:3     31.469 kHz     27.000000 MHz
    VIC   1:   640x480    59.940476 Hz   4:3     31.469 kHz     25.175000 MHz
  Audio Data Block:
    Linear PCM:
      Max channels: 2
      Supported sample rates (kHz): 48 44.1 32
      Supported sample sizes (bits): 24 20 16
  Speaker Allocation Data Block:
    FL/FR - Front Left/Right
  Vendor-Specific Data Block (AMD), OUI 00-00-1A:
    Version: 2.1
    Minimum Refresh Rate: 60 Hz
    Maximum Refresh Rate: 165 Hz
    Flags 1.x: 0x00
    Flags 2.x: 0x00
    Maximum luminance: 0 (50.000 cd/m^2)
    Minimum luminance: 0 (0.000 cd/m^2)
    Unknown: 0x00 0x00
  Video Capability Data Block:
    YCbCr quantization: No Data
    RGB quantization: Selectable (via AVI Q)
    PT scan behavior: Always Underscanned
    IT scan behavior: Always Underscanned
    CE scan behavior: Supports both over- and underscan
  Detailed Timing Descriptors:
    DTD 5:  2560x1440  143.973257 Hz  16:9    222.151 kHz    604.250000 MHz (597 mm x 336 mm)
                 Hfront   48 Hsync  32 Hback   80 Hpol P
                 Vfront    3 Vsync   5 Vback   95 Vpol N
    DTD 6:  2560x1440  119.997589 Hz  16:9    182.996 kHz    497.750000 MHz (597 mm x 336 mm)
                 Hfront   48 Hsync  32 Hback   80 Hpol P
                 Vfront    3 Vsync   5 Vback   77 Vpol P
    DTD 7:  2560x1440   74.970923 Hz  16:9    111.857 kHz    304.250000 MHz (597 mm x 336 mm)
                 Hfront   48 Hsync  32 Hback   80 Hpol P
                 Vfront    3 Vsync   5 Vback   44 Vpol N
Checksum: 0x67  Unused space in Extension Block: 36 bytes

----------------

Block 5, DisplayID Extension Block:
  Version: 1.2
  Extension Count: 0
  Video Timing Modes Type 1 - Detailed Timings Data Block:
    DTD:  2560x1440  164.833904 Hz   0:0    247.416 kHz    696.970000 MHz (aspect undefined, no 3D stereo, preferred)
               Hfront    9 Hsync  33 Hback  215 Hpol N
               Vfront    7 Vsync   9 Vback   45 Vpol N
  Checksum: 0x65
Checksum: 0x90

----------------

Warnings:

Block 1, CTA-861 Extension Block:
  Video Capability Data Block: Set Selectable YCbCr Quantization to avoid interop issues.
  Display Product Serial Number is set, so the Serial Number in the Base EDID should be 0.
  Add a Colorimetry Data Block with the sRGB colorimetry bit set to avoid interop issues.
Block 4, CTA-861 Extension Block:
  Video Capability Data Block: Set Selectable YCbCr Quantization to avoid interop issues.
  Display Product Serial Number is set, so the Serial Number in the Base EDID should be 0.
  Add a Colorimetry Data Block with the sRGB colorimetry bit set to avoid interop issues.
EDID:
  Base EDID: Some timings are out of range of the Monitor Ranges:
    Horizontal Freq: 31.466 - 247.415 kHz (Monitor: 255.000 - 255.000 kHz)

Failures:

Block 2, DisplayID Extension Block:
  DisplayID Base Block has no product type.
  Expected 0 DisplayID Extension Block, but got 1.
Block 3, Base EDID:
  Unknown Extension Block.
Block 4, CTA-861 Extension Block:
  Video Data Block: Duplicate VIC 16.
  Video Data Block: Duplicate VIC 63.
  Video Data Block: Duplicate VIC 64.
  Video Data Block: Duplicate VIC 4.
  Video Data Block: Duplicate VIC 3.
  Video Data Block: Duplicate VIC 2.
  Video Data Block: Duplicate VIC 1.
  Speaker Allocation Data Block: Only one instance of this Data Block is allowed.
  Video Capability Data Block: Only one instance of this Data Block is allowed.
EDID:
  Base EDID: EDID specified 2 extension block(s), but found 5 extension block(s).
  DisplayID: Missing DisplayID Product Identification Data Block.

EDID conformity: FAIL
