edid-decode (hex):

00 ff ff ff ff ff ff 00 4c 2d 27 00 37 31 4e 41
0f 0d 01 03 68 20 18 6b 2a 12 69 a5 52 49 99 24
0e 48 4c a4 00 00 31 40 31 59 45 59 61 59 81 80
01 01 01 01 01 01 ea 24 00 60 41 00 28 30 30 60
13 00 38 ea 10 00 00 1e 00 00 00 fd 00 32 a0 1e
47 0b 00 0a 20 20 20 20 20 20 00 00 00 fc 00 53
79 6e 63 4d 61 73 74 65 72 0a 20 20 00 00 00 ff
00 48 4d 44 57 34 30 31 35 32 30 0a 20 20 00 0b

00 ff ff ff ff ff ff 00 4c 2d 27 00 37 31 4e 41
0f 0d 01 03 68 20 18 6b 2a 12 69 a5 52 49 99 24
0e 48 4c a4 00 00 31 40 31 59 45 59 61 59 81 80
01 01 01 01 01 01 ea 24 00 60 41 00 28 30 30 60
13 00 38 ea 10 00 00 1e 00 00 00 fd 00 32 a0 1e
47 0b 00 0a 20 20 20 20 20 20 00 00 00 fc 00 53
79 6e 63 4d 61 73 74 65 72 0a 20 20 00 00 00 ff
00 48 4d 44 57 34 30 31 35 32 30 0a 20 20 00 0b

----------------

Block 0, Base EDID:
  EDID Structure Version & Revision: 1.3
  Vendor & Product Identification:
    Manufacturer: SAM
    Model: 39
    Serial Number: ...
    Made in: week 15 of 2003
  Basic Display Parameters & Features:
    Analog display
    Signal Level Standard: 0.700 : 0.000 : 0.700 V p-p
    Blank level equals black level
    Sync: Separate
    Maximum image size: 32 cm x 24 cm
    Gamma: 2.07
    DPMS levels: Off
    RGB color display
    First detailed timing is the preferred timing
  Color Characteristics:
    Red  : 0.6445, 0.3212
    Green: 0.2851, 0.5996
    Blue : 0.1416, 0.0566
    White: 0.2832, 0.2978
  Established Timings I & II:
    IBM     :   720x400    70.081663 Hz   9:5     31.467 kHz     28.320000 MHz
    DMT 0x04:   640x480    59.940476 Hz   4:3     31.469 kHz     25.175000 MHz
    DMT 0x06:   640x480    75.000000 Hz   4:3     37.500 kHz     31.500000 MHz
  Standard Timings:
    DMT 0x04:   640x480    59.940476 Hz   4:3     31.469 kHz     25.175000 MHz
    DMT 0x07:   640x480    85.008312 Hz   4:3     43.269 kHz     36.000000 MHz
    DMT 0x0c:   800x600    85.061274 Hz   4:3     53.674 kHz     56.250000 MHz
    DMT 0x13:  1024x768    84.996690 Hz   4:3     68.677 kHz     94.500000 MHz
    DMT 0x23:  1280x1024   60.019740 Hz   5:4     63.981 kHz    108.000000 MHz
  Detailed Timing Descriptors:
    DTD 1:  1024x768    84.996690 Hz   4:3     68.677 kHz     94.500000 MHz (312 mm x 234 mm)
                 Hfront   48 Hsync  96 Hback  208 Hpol P
                 Vfront    1 Vsync   3 Vback   36 Vpol P
    Display Range Limits:
      Monitor ranges (GTF): 50-160 Hz V, 30-71 kHz H, max dotclock 110 MHz
    Display Product Name: 'SyncMaster'
    Display Product Serial Number: ...
Checksum: 0x0b

----------------

Block 1, Unknown EDID Extension Block 0x00:
  00 ff ff ff ff ff ff 00 4c 2d 27 00 37 31 4e 41 '........L-'.71NA'
  0f 0d 01 03 68 20 18 6b 2a 12 69 a5 52 49 99 24 '....h .k*.i.RI.$'
  0e 48 4c a4 00 00 31 40 31 59 45 59 61 59 81 80 '.HL...1@1YEYaY..'
  01 01 01 01 01 01 ea 24 00 60 41 00 28 30 30 60 '.......$.`A.(00`'
  13 00 38 ea 10 00 00 1e 00 00 00 fd 00 32 a0 1e '..8..........2..'
  47 0b 00 0a 20 20 20 20 20 20 00 00 00 fc 00 53 'G...      .....S'
  79 6e 63 4d 61 73 74 65 72 0a 20 20 00 00 00 ff 'yncMaster.  ....'
  00 48 4d 44 57 34 30 31 35 32 30 0a 20 20 00 0b '.HMDW401520.  ..'
Checksum: 0x0b

----------------

Failures:

Block 1, Base EDID:
  Unknown Extension Block.
EDID:
  Base EDID: EDID specified 0 extension block(s), but found 1 extension block(s).

EDID conformity: FAIL
