edid-decode (hex):

00 ff ff ff ff ff ff 00 4c 2d 27 00 37 31 4e 41
2d 0d 01 03 68 20 18 6b 2a 12 69 a5 52 49 99 24
0e 48 4c a4 00 00 31 40 31 59 45 59 61 59 81 80
01 01 01 01 01 01 ea 24 00 60 41 00 28 30 30 60
13 00 38 ea 10 00 00 1e 00 00 00 fd 00 32 a0 1e
47 0b 00 0a 20 20 20 20 20 20 00 00 00 fc 00 53
79 6e 63 4d 61 73 74 65 72 0a 20 20 00 00 00 ff
00 48 4d 42 57 42 30 32 33 37 37 0a 20 20 00 d6

----------------

Block 0, Base EDID:
  EDID Structure Version & Revision: 1.3
  Vendor & Product Identification:
    Manufacturer: SAM
    Model: 39
    Serial Number: ...
    Made in: week 45 of 2003
  Basic Display Parameters & Features:
    Analog display
    Input voltage level: 0.7/0.7 V
    Blank level equals black level
    Sync: Separate
    Maximum image size: 32 cm x 24 cm
    Gamma: 2.07
    DPMS levels: Off
    RGB color display
    First detailed timing is the preferred timing
  Color Characteristics:
    Red  : 0.6445, 0.3212
    Green: 0.2851, 0.5996
    Blue : 0.1416, 0.0566
    White: 0.2832, 0.2978
  Established Timings I & II:
    IBM     :   720x400    70.082 Hz   9:5    31.467 kHz  28.320 MHz
    DMT 0x04:   640x480    59.940 Hz   4:3    31.469 kHz  25.175 MHz
    DMT 0x06:   640x480    75.000 Hz   4:3    37.500 kHz  31.500 MHz
  Standard Timings:
    DMT 0x04:   640x480    59.940 Hz   4:3    31.469 kHz  25.175 MHz
    DMT 0x07:   640x480    85.008 Hz   4:3    43.269 kHz  36.000 MHz
    DMT 0x0c:   800x600    85.061 Hz   4:3    53.674 kHz  56.250 MHz
    DMT 0x13:  1024x768    84.997 Hz   4:3    68.677 kHz  94.500 MHz
    DMT 0x23:  1280x1024   60.020 Hz   5:4    63.981 kHz 108.000 MHz
  Detailed Timing Descriptors:
    DTD 1:  1024x768    84.997 Hz   4:3    68.677 kHz  94.500 MHz (312 mm x 234 mm)
                 Hfront   48 Hsync  96 Hback 208 Hpol P
                 Vfront    1 Vsync   3 Vback  36 Vpol P
  Display Range Limits:
    Monitor ranges (GTF): 50-160 Hz V, 30-71 kHz H, max dotclock 110 MHz
    Display Product Name: 'SyncMaster'
    Display Product Serial Number: ...
Checksum: 0xd6

----------------

EDID conformity: PASS
