
EDID (hex):
00ffffffffffff0030aeb76100000000
211c0104a5351e783ad825a2574b9f27
0d5054afef00714f8180818a9500a9c0
a9cfb3000101023a801871382d40582c
4500dc0b1100001e000000fc00453234
2d31300a202020202020000000fd0032
4b1e5110000a202020202020000000ff
0056393034304342460a2020202001d4
020316b14b9005040302011f12131411
65030c001000011d8018711c1620582c
2500c48e2100009e7c2e90a0601a1e40
30203600dc0b1100001cab22a0a05084
1a3030203600dc0b1100001c662156aa
51001e30468f3300dc0b1100001e0000
00000000000000000000000000000000
000000000000000000000000000000d5

edid-decode (hex):

00 ff ff ff ff ff ff 00 30 ae b7 61 00 00 00 00
21 1c 01 04 a5 35 1e 78 3a d8 25 a2 57 4b 9f 27
0d 50 54 af ef 00 71 4f 81 80 81 8a 95 00 a9 c0
a9 cf b3 00 01 01 02 3a 80 18 71 38 2d 40 58 2c
45 00 dc 0b 11 00 00 1e 00 00 00 fc 00 45 32 34
2d 31 30 0a 20 20 20 20 20 20 00 00 00 fd 00 32
4b 1e 51 10 00 0a 20 20 20 20 20 20 00 00 00 ff
00 56 39 30 34 30 43 42 46 0a 20 20 20 20 01 d4

02 03 16 b1 4b 90 05 04 03 02 01 1f 12 13 14 11
65 03 0c 00 10 00 01 1d 80 18 71 1c 16 20 58 2c
25 00 c4 8e 21 00 00 9e 7c 2e 90 a0 60 1a 1e 40
30 20 36 00 dc 0b 11 00 00 1c ab 22 a0 a0 50 84
1a 30 30 20 36 00 dc 0b 11 00 00 1c 66 21 56 aa
51 00 1e 30 46 8f 33 00 dc 0b 11 00 00 1e 00 00
00 00 00 00 00 00 00 00 00 00 00 00 00 00 00 00
00 00 00 00 00 00 00 00 00 00 00 00 00 00 00 d5

----------------

Block 0, Base EDID:
  EDID Structure Version & Revision: 1.4
  Vendor & Product Identification:
    Manufacturer: LEN
    Model: 25015
    Made in: week 33 of 2018
  Basic Display Parameters & Features:
    Digital display
    Bits per primary color channel: 8
    DisplayPort interface
    Maximum image size: 53 cm x 30 cm
    Gamma: 2.20
    DPMS levels: Off
    Supported color formats: RGB 4:4:4, YCrCb 4:4:4, YCrCb 4:2:2
    First detailed timing includes the native pixel format and preferred refresh rate
  Color Characteristics:
    Red  : 0.6357, 0.3408
    Green: 0.2949, 0.6210
    Blue : 0.1523, 0.0527
    White: 0.3134, 0.3291
  Established Timings I & II:
    IBM     :   720x400    70.081663 Hz   9:5     31.467 kHz     28.320000 MHz
    DMT 0x04:   640x480    59.940476 Hz   4:3     31.469 kHz     25.175000 MHz
    DMT 0x05:   640x480    72.808802 Hz   4:3     37.861 kHz     31.500000 MHz
    DMT 0x06:   640x480    75.000000 Hz   4:3     37.500 kHz     31.500000 MHz
    DMT 0x08:   800x600    56.250000 Hz   4:3     35.156 kHz     36.000000 MHz
    DMT 0x09:   800x600    60.316541 Hz   4:3     37.879 kHz     40.000000 MHz
    DMT 0x0a:   800x600    72.187572 Hz   4:3     48.077 kHz     50.000000 MHz
    DMT 0x0b:   800x600    75.000000 Hz   4:3     46.875 kHz     49.500000 MHz
    Apple   :   832x624    74.551266 Hz   4:3     49.726 kHz     57.284000 MHz
    DMT 0x10:  1024x768    60.003840 Hz   4:3     48.363 kHz     65.000000 MHz
    DMT 0x11:  1024x768    70.069359 Hz   4:3     56.476 kHz     75.000000 MHz
    DMT 0x12:  1024x768    75.028582 Hz   4:3     60.023 kHz     78.750000 MHz
    DMT 0x24:  1280x1024   75.024675 Hz   5:4     79.976 kHz    135.000000 MHz
  Standard Timings:
    DMT 0x15:  1152x864    75.000000 Hz   4:3     67.500 kHz    108.000000 MHz
    DMT 0x23:  1280x1024   60.019740 Hz   5:4     63.981 kHz    108.000000 MHz
    GTF     :  1280x1024   69.999805 Hz   5:4     74.620 kHz    128.943000 MHz
    DMT 0x2f:  1440x900    59.887445 Hz  16:10    55.935 kHz    106.500000 MHz
    DMT 0x53:  1600x900    60.000000 Hz  16:9     60.000 kHz    108.000000 MHz (RB)
    GTF     :  1600x900    75.000000 Hz  16:9     70.500 kHz    152.280000 MHz
    DMT 0x3a:  1680x1050   59.954250 Hz  16:10    65.290 kHz    146.250000 MHz
  Detailed Timing Descriptors:
    DTD 1:  1920x1080   60.000000 Hz  16:9     67.500 kHz    148.500000 MHz (476 mm x 267 mm)
                 Hfront   88 Hsync  44 Hback  148 Hpol P
                 Vfront    4 Vsync   5 Vback   36 Vpol P
    Display Product Name: 'E24-10'
    Display Range Limits:
      Monitor ranges (GTF): 50-75 Hz V, 30-81 kHz H, max dotclock 160 MHz
    Display Product Serial Number: 'V9040CBF'
  Extension blocks: 1
Checksum: 0xd4

----------------

Block 1, CTA-861 Extension Block:
  Revision: 3
  Underscans IT Video Formats by default
  Supports YCbCr 4:4:4
  Supports YCbCr 4:2:2
  Native detailed modes: 1
  Video Data Block:
    VIC  16:  1920x1080   60.000000 Hz  16:9     67.500 kHz    148.500000 MHz (native)
    VIC   5:  1920x1080i  60.000000 Hz  16:9     33.750 kHz     74.250000 MHz
    VIC   4:  1280x720    60.000000 Hz  16:9     45.000 kHz     74.250000 MHz
    VIC   3:   720x480    59.940060 Hz  16:9     31.469 kHz     27.000000 MHz
    VIC   2:   720x480    59.940060 Hz   4:3     31.469 kHz     27.000000 MHz
    VIC   1:   640x480    59.940476 Hz   4:3     31.469 kHz     25.175000 MHz
    VIC  31:  1920x1080   50.000000 Hz  16:9     56.250 kHz    148.500000 MHz
    VIC  18:   720x576    50.000000 Hz  16:9     31.250 kHz     27.000000 MHz
    VIC  19:  1280x720    50.000000 Hz  16:9     37.500 kHz     74.250000 MHz
    VIC  20:  1920x1080i  50.000000 Hz  16:9     28.125 kHz     74.250000 MHz
    VIC  17:   720x576    50.000000 Hz   4:3     31.250 kHz     27.000000 MHz
  Vendor-Specific Data Block (HDMI), OUI 00-0C-03:
    Source physical address: 1.0.0.0
  Detailed Timing Descriptors:
    DTD 2:  1920x1080i  60.000000 Hz  16:9     33.750 kHz     74.250000 MHz (708 mm x 398 mm)
                 Hfront   88 Hsync  44 Hback  148 Hpol P
                 Vfront    2 Vsync   5 Vback   15 Vpol P Vfront +0.5 Odd Field
                 Vfront    2 Vsync   5 Vback   15 Vpol P Vback  +0.5 Even Field
    DTD 3:  1680x1050   59.883253 Hz  16:10    64.674 kHz    119.000000 MHz (476 mm x 267 mm)
                 Hfront   48 Hsync  32 Hback   80 Hpol N
                 Vfront    3 Vsync   6 Vback   21 Vpol P
    DTD 4:  1440x900    59.901458 Hz  16:10    55.469 kHz     88.750000 MHz (476 mm x 267 mm)
                 Hfront   48 Hsync  32 Hback   80 Hpol N
                 Vfront    3 Vsync   6 Vback   17 Vpol P
    DTD 5:  1366x768    59.789541 Hz 683:384   47.712 kHz     85.500000 MHz (476 mm x 267 mm)
                 Hfront   70 Hsync 143 Hback  213 Hpol P
                 Vfront    3 Vsync   3 Vback   24 Vpol P
Checksum: 0xd5  Unused space in Extension Block: 33 bytes


