edid-decode (hex):

00 ff ff ff ff ff ff 00 36 69 00 00 00 00 00 00
10 17 01 04 a5 2c 19 78 0a 44 e5 a3 5a 52 a2 26
0e 50 54 00 00 00 01 c1 01 c1 01 c1 01 c1 01 c1
01 c1 01 c1 01 c1 31 2e 40 00 62 84 22 30 58 a8
35 00 ba f9 10 00 00 18 00 00 00 10 00 06 10 30
11 01 00 00 00 00 00 00 0a 20 00 00 00 fe 00 4d
53 49 20 41 49 4f 20 50 43 0a 20 20 00 00 00 fc
00 4d 53 49 20 41 49 4f 20 50 43 0a 20 20 00 9c

----------------

Block 0, Base EDID:
  EDID Structure Version & Revision: 1.4
  Vendor & Product Identification:
    Manufacturer: MSI
    Model: 0
    Made in: week 16 of 2013
  Basic Display Parameters & Features:
    Digital display
    Bits per primary color channel: 8
    DisplayPort interface
    Maximum image size: 44 cm x 25 cm
    Gamma: 2.20
    Supported color formats: RGB 4:4:4, YCrCb 4:4:4
    First detailed timing includes the native pixel format and preferred refresh rate
  Color Characteristics:
    Red  : 0.6376, 0.3515
    Green: 0.3212, 0.6328
    Blue : 0.1513, 0.0566
    White: 0.3134, 0.3291
  Established Timings I & II: none
  Standard Timings:
  Detailed Timing Descriptors:
    DTD 1:  1600x900    59.946 Hz  16:9    55.990 kHz 118.250 MHz (442 mm x 249 mm)
                 Hfront   88 Hsync 168 Hback 256 Hpol N
                 Vfront    3 Vsync   5 Vback  26 Vpol N
    Dummy Descriptor:
    Alphanumeric Data String: 'MSI AIO PC'
    Display Product Name: 'MSI AIO PC'
Checksum: 0x9c
