edid-decode (hex):

00 ff ff ff ff ff ff 00 34 ac 81 43 f9 14 00 00
16 0a 01 01 0c 1f 17 a3 e8 67 a8 a0 56 47 99 26
11 48 4c ff ef 80 31 59 45 59 61 59 71 4f 81 59
81 99 a9 45 a9 4a 1a 4f 40 30 62 b0 32 40 40 c0
13 00 38 ea 10 00 00 1e 00 00 00 fd 00 32 82 1e
60 16 00 0a 20 20 20 20 20 20 00 00 00 fc 00 4e
46 4e 39 37 30 35 0a 20 20 20 20 20 00 00 00 ff
00 30 30 35 31 30 35 33 36 39 0a 20 20 20 00 6f

----------------

Block 0, Base EDID:
  EDID Structure Version & Revision: 1.1
  Vendor & Product Identification:
    Manufacturer: MEL
    Model: 17281
    Serial Number: ...
    Made in: week 22 of 2000
  Basic Display Parameters & Features:
    Analog display
    Input voltage level: 0.7/0.3 V
    Blank level equals black level
    Sync: Separate Composite
    Maximum image size: 31 cm x 23 cm
    Gamma: 2.63
    DPMS levels: Standby Suspend Off
    RGB color display
  Color Characteristics:
    Red  : 0.6259, 0.3378
    Green: 0.2783, 0.6005
    Blue : 0.1503, 0.0683
    White: 0.2832, 0.2968
  Established Timings I & II:
    IBM     :   720x400    70.082 Hz   9:5    31.467 kHz  28.320 MHz
    IBM     :   720x400    87.850 Hz   9:5    39.444 kHz  35.500 MHz
    DMT 0x04:   640x480    59.940 Hz   4:3    31.469 kHz  25.175 MHz
    Apple   :   640x480    66.667 Hz   4:3    35.000 kHz  30.240 MHz
    DMT 0x05:   640x480    72.809 Hz   4:3    37.861 kHz  31.500 MHz
    DMT 0x06:   640x480    75.000 Hz   4:3    37.500 kHz  31.500 MHz
    DMT 0x08:   800x600    56.250 Hz   4:3    35.156 kHz  36.000 MHz
    DMT 0x09:   800x600    60.317 Hz   4:3    37.879 kHz  40.000 MHz
    DMT 0x0a:   800x600    72.188 Hz   4:3    48.077 kHz  50.000 MHz
    DMT 0x0b:   800x600    75.000 Hz   4:3    46.875 kHz  49.500 MHz
    Apple   :   832x624    74.551 Hz   4:3    49.726 kHz  57.284 MHz
    DMT 0x10:  1024x768    60.004 Hz   4:3    48.363 kHz  65.000 MHz
    DMT 0x11:  1024x768    70.069 Hz   4:3    56.476 kHz  75.000 MHz
    DMT 0x12:  1024x768    75.029 Hz   4:3    60.023 kHz  78.750 MHz
    DMT 0x24:  1280x1024   75.025 Hz   5:4    79.976 kHz 135.000 MHz
    Apple   :  1152x870    75.062 Hz 192:145  68.681 kHz 100.000 MHz
  Standard Timings:
    DMT 0x07:   640x480    85.008 Hz   4:3    43.269 kHz  36.000 MHz
    DMT 0x0c:   800x600    85.061 Hz   4:3    53.674 kHz  56.250 MHz
    DMT 0x13:  1024x768    84.997 Hz   4:3    68.677 kHz  94.500 MHz
    DMT 0x15:  1152x864    75.000 Hz   4:3    67.500 kHz 108.000 MHz
    DMT 0x21:  1280x960    85.002 Hz   4:3    85.938 kHz 148.500 MHz
    DMT 0x25:  1280x1024   85.024 Hz   5:4    91.146 kHz 157.500 MHz
    DMT 0x34:  1600x1200   65.000 Hz   4:3    81.250 kHz 175.500 MHz
    DMT 0x35:  1600x1200   70.000 Hz   4:3    87.500 kHz 189.000 MHz
  Detailed Timing Descriptors:
    DTD 1:  1600x1200   75.000 Hz   4:3    93.750 kHz 202.500 MHz (312 mm x 234 mm)
                 Hfront   64 Hsync 192 Hback 304 Hpol P
                 Vfront    1 Vsync   3 Vback  46 Vpol P
  Display Range Limits:
    Monitor ranges (GTF): 50-130 Hz V, 30-96 kHz H, max dotclock 220 MHz
    Display Product Name: 'NFN9705'
    Display Product Serial Number: ...
Checksum: 0x6f

----------------

Warnings:

Block 0, Base EDID:
  EDID Structure Version & Revision: EDID 1.1 is deprecated, do not use.

EDID conformity: PASS
