
EDID (hex):
00ffffffffffff002264356771040000
22150103803b25782aaff1a6544c9e23
105054bfef80714f814081809500950f
a94001010101283c80a070b023403020
360051732100001a000000ff00313334
4c4d3341593031313337000000fd0032
4b1e5511000a202020202020000000fc
00485a323831480a20202020202000e9

Extracted contents:
header:          00 ff ff ff ff ff ff 00
serial number:   22 64 35 67 71 04 00 00 22 15
version:         01 03
basic params:    80 3b 25 78 2a
chroma info:     af f1 a6 54 4c 9e 23 10 50 54
established:     bf ef 80
standard:        71 4f 81 40 81 80 95 00 95 0f a9 40 01 01 01 01
descriptor 1:    28 3c 80 a0 70 b0 23 40 30 20 36 00 51 73 21 00 00 1a
descriptor 2:    00 00 00 ff 00 31 33 34 4c 4d 33 41 59 30 31 31 33 37
descriptor 3:    00 00 00 fd 00 32 4b 1e 55 11 00 0a 20 20 20 20 20 20
descriptor 4:    00 00 00 fc 00 48 5a 32 38 31 48 0a 20 20 20 20 20 20
extensions:      00
checksum:        e9

EDID version: 1.3
Manufacturer: HSD Model 6735 Serial Number --
Made in week 34 of 2011
Digital display
Maximum image size: 59 cm x 37 cm
Gamma: 2.20
DPMS levels: Off
RGB color display
First detailed timing is preferred timing
Display x,y Chromaticity:
  Red:   0.6503, 0.3300
  Green: 0.2998, 0.6201
  Blue:  0.1396, 0.0654
  White: 0.3125, 0.3291
Established timings supported:
  720x400@70Hz 9:5 HorFreq: 31469 Hz Clock: 28.320 MHz
  640x480@60Hz 4:3 HorFreq: 31469 Hz Clock: 25.175 MHz
  640x480@67Hz 4:3 HorFreq: 35000 Hz Clock: 30.240 MHz
  640x480@72Hz 4:3 HorFreq: 37900 Hz Clock: 31.500 MHz
  640x480@75Hz 4:3 HorFreq: 37500 Hz Clock: 31.500 MHz
  800x600@56Hz 4:3 HorFreq: 35200 Hz Clock: 36.000 MHz
  800x600@60Hz 4:3 HorFreq: 37900 Hz Clock: 40.000 MHz
  800x600@72Hz 4:3 HorFreq: 48100 Hz Clock: 50.000 MHz
  800x600@75Hz 4:3 HorFreq: 46900 Hz Clock: 49.500 MHz
  832x624@75Hz 4:3 HorFreq: 49726 Hz Clock: 57.284 MHz
  1024x768@60Hz 4:3 HorFreq: 48400 Hz Clock: 65.000 MHz
  1024x768@70Hz 4:3 HorFreq: 56500 Hz Clock: 75.000 MHz
  1024x768@75Hz 4:3 HorFreq: 60000 Hz Clock: 78.750 MHz
  1280x1024@75Hz 5:4 HorFreq: 80000 Hz Clock: 135.000 MHz
  1152x870@75Hz 192:145 HorFreq: 67500 Hz Clock: 108.000 MHz
Standard timings supported:
  1152x864@75Hz 4:3 HorFreq: 67500 Hz Clock: 108.000 MHz
  1280x960@60Hz 4:3 HorFreq: 60000 Hz Clock: 108.000 MHz
  1280x1024@60Hz 5:4 HorFreq: 64000 Hz Clock: 108.000 MHz
  1440x900@60Hz 16:10 HorFreq: 55500 Hz Clock: 88.750 MHz
  1440x900@75Hz 16:10 HorFreq: 82300 Hz Clock: 156.000 MHz
  1600x1200@60Hz 4:3 HorFreq: 75000 Hz Clock: 162.000 MHz
Detailed mode: Clock 154.000 MHz, 593 mm x 371 mm
               1920 1968 2000 2080 hborder 0
               1200 1203 1209 1235 vborder 0
               +hsync -vsync 
               VertFreq: 59 Hz, HorFreq: 74038 Hz
Serial number: --
Monitor ranges (GTF): 50-75Hz V, 30-85kHz H, max dotclock 170MHz
Monitor name: HZ281H
Checksum: 0xe9 (valid)
