
EDID (hex):
00ffffffffffff00368b21103c220000
2c0d010368241c78eba69ca15a4b9824
164c57bfef008180818f6140614a614f
4540454a454f302a009851002a403070
1300671f1100001e000000ff00383736
34000000000000000000000000fd0032
4c1e530e000a202020202020000000fc
004d6963726f74656b20383135430022

Extracted contents:
header:          00 ff ff ff ff ff ff 00
serial number:   36 8b 21 10 3c 22 00 00 2c 0d
version:         01 03
basic params:    68 24 1c 78 eb
chroma info:     a6 9c a1 5a 4b 98 24 16 4c 57
established:     bf ef 00
standard:        81 80 81 8f 61 40 61 4a 61 4f 45 40 45 4a 45 4f
descriptor 1:    30 2a 00 98 51 00 2a 40 30 70 13 00 67 1f 11 00 00 1e
descriptor 2:    00 00 00 ff 00 38 37 36 34 00 00 00 00 00 00 00 00 00
descriptor 3:    00 00 00 fd 00 32 4c 1e 53 0e 00 0a 20 20 20 20 20 20
descriptor 4:    00 00 00 fc 00 4d 69 63 72 6f 74 65 6b 20 38 31 35 43
extensions:      00
checksum:        22

EDID version: 1.3
Manufacturer: MTK Model 1021 Serial Number --
Analog display, Input voltage level: 0.7/0.7 V
Sync: Separate 
Maximum image size: 36 cm x 28 cm
Gamma: 2.20
DPMS levels: Standby Suspend Off
RGB color display
First detailed timing is preferred timing
Supports GTF timings within operating range
Display x,y Chromaticity:
  Red:   0.6308, 0.3535
  Green: 0.2939, 0.5957
  Blue:  0.1425, 0.0869
  White: 0.2998, 0.3398
Established timings supported:
  720x400@70Hz 9:5 HorFreq: 31469 Hz Clock: 28.320 MHz
  640x480@60Hz 4:3 HorFreq: 31469 Hz Clock: 25.175 MHz
  640x480@67Hz 4:3 HorFreq: 35000 Hz Clock: 30.240 MHz
  640x480@72Hz 4:3 HorFreq: 37900 Hz Clock: 31.500 MHz
  640x480@75Hz 4:3 HorFreq: 37500 Hz Clock: 31.500 MHz
  800x600@56Hz 4:3 HorFreq: 35200 Hz Clock: 36.000 MHz
  800x600@60Hz 4:3 HorFreq: 37900 Hz Clock: 40.000 MHz
  800x600@72Hz 4:3 HorFreq: 48100 Hz Clock: 50.000 MHz
  800x600@75Hz 4:3 HorFreq: 46900 Hz Clock: 49.500 MHz
  832x624@75Hz 4:3 HorFreq: 49726 Hz Clock: 57.284 MHz
  1024x768@60Hz 4:3 HorFreq: 48400 Hz Clock: 65.000 MHz
  1024x768@70Hz 4:3 HorFreq: 56500 Hz Clock: 75.000 MHz
  1024x768@75Hz 4:3 HorFreq: 60000 Hz Clock: 78.750 MHz
  1280x1024@75Hz 5:4 HorFreq: 80000 Hz Clock: 135.000 MHz
Standard timings supported:
  1280x1024@60Hz 5:4 HorFreq: 64000 Hz Clock: 108.000 MHz
  1280x1024@75Hz 5:4 HorFreq: 80000 Hz Clock: 135.000 MHz
  1024x768@60Hz 4:3 HorFreq: 48400 Hz Clock: 65.000 MHz
  1024x768@70Hz 4:3 HorFreq: 56500 Hz Clock: 75.000 MHz
  1024x768@75Hz 4:3 HorFreq: 60000 Hz Clock: 78.750 MHz
  800x600@60Hz 4:3 HorFreq: 37900 Hz Clock: 40.000 MHz
  800x600@70Hz 4:3
  800x600@75Hz 4:3 HorFreq: 46900 Hz Clock: 49.500 MHz
Detailed mode: Clock 108.000 MHz, 359 mm x 287 mm
               1280 1328 1440 1688 hborder 0
               1024 1025 1028 1066 vborder 0
               +hsync +vsync 
               VertFreq: 60 Hz, HorFreq: 63981 Hz
Serial number: --
Monitor ranges (GTF): 50-76Hz V, 30-83kHz H, max dotclock 140MHz
Checksum: 0x22 (valid)
EDID block does NOT conform to EDID 1.3!
	Name descriptor not terminated with a newline
	Detailed block string not properly terminated
EDID block does not conform at all!
	Bad year of manufacture


