
EDID (hex):
00ffffffffffff004d294f2101000000
0013010380351d780e6085a6564a9c25
125054a56b80710081c081408180a9c0
b300d1c00101023a801871382d40582c
4500dc0c1100001e8c0ad08a20e02d10
103e9600dc0c11000018000000fc0053
49492052455045415445520a000000fd
00324c185311000a202020202020014a
02032f71459003040501230f7f072315
0750233d1fc0234d020023571700235f
1400834f000068030c000000b82d0001
1d007251d01e206e285500dc0c110000
1e011d8018711c1620582c2500dc0c11
00009ed60980a020e02d101060a20065
0c110000180000000000000000000000
0000000000000000000000000000009a

Extracted contents:
header:          00 ff ff ff ff ff ff 00
serial number:   4d 29 4f 21 01 00 00 00 00 13
version:         01 03
basic params:    80 35 1d 78 0e
chroma info:     60 85 a6 56 4a 9c 25 12 50 54
established:     a5 6b 80
standard:        71 00 81 c0 81 40 81 80 a9 c0 b3 00 d1 c0 01 01
descriptor 1:    02 3a 80 18 71 38 2d 40 58 2c 45 00 dc 0c 11 00 00 1e
descriptor 2:    8c 0a d0 8a 20 e0 2d 10 10 3e 96 00 dc 0c 11 00 00 18
descriptor 3:    00 00 00 fc 00 53 49 49 20 52 45 50 45 41 54 45 52 0a
descriptor 4:    00 00 00 fd 00 32 4c 18 53 11 00 0a 20 20 20 20 20 20
extensions:      01
checksum:        4a

EDID version: 1.3
Manufacturer: SII Model 214f Serial Number --
Made in year 2009
Digital display
Maximum image size: 53 cm x 29 cm
Gamma: 2.20
RGB color display
Default (sRGB) color space is primary color space
First detailed timing is preferred timing
Display x,y Chromaticity:
  Red:   0.6494, 0.3378
  Green: 0.2890, 0.6093
  Blue:  0.1464, 0.0703
  White: 0.3134, 0.3291
Established timings supported:
  720x400@70Hz 9:5 HorFreq: 31469 Hz Clock: 28.320 MHz
  640x480@60Hz 4:3 HorFreq: 31469 Hz Clock: 25.175 MHz
  640x480@75Hz 4:3 HorFreq: 37500 Hz Clock: 31.500 MHz
  800x600@60Hz 4:3 HorFreq: 37900 Hz Clock: 40.000 MHz
  800x600@75Hz 4:3 HorFreq: 46900 Hz Clock: 49.500 MHz
  832x624@75Hz 4:3 HorFreq: 49726 Hz Clock: 57.284 MHz
  1024x768@60Hz 4:3 HorFreq: 48400 Hz Clock: 65.000 MHz
  1024x768@75Hz 4:3 HorFreq: 60000 Hz Clock: 78.750 MHz
  1280x1024@75Hz 5:4 HorFreq: 80000 Hz Clock: 135.000 MHz
  1152x870@75Hz 192:145 HorFreq: 67500 Hz Clock: 108.000 MHz
Standard timings supported:
  1152x720@60Hz 16:10
  1280x720@60Hz 16:9
  1280x960@60Hz 4:3 HorFreq: 60000 Hz Clock: 108.000 MHz
  1280x1024@60Hz 5:4 HorFreq: 64000 Hz Clock: 108.000 MHz
  1600x900@60Hz 16:9
  1680x1050@60Hz 16:10 HorFreq: 64700 Hz Clock: 119.000 MHz
  1920x1080@60Hz 16:9
Detailed mode: Clock 148.500 MHz, 476 mm x 268 mm
               1920 2008 2052 2200 hborder 0
               1080 1084 1089 1125 vborder 0
               +hsync +vsync 
               VertFreq: 60 Hz, HorFreq: 67500 Hz
Detailed mode: Clock 27.000 MHz, 476 mm x 268 mm
                720  736  798  858 hborder 0
                480  489  495  525 vborder 0
               -hsync -vsync 
               VertFreq: 59 Hz, HorFreq: 31468 Hz
Monitor name: SII REPEATER
Monitor ranges (GTF): 50-76Hz V, 24-83kHz H, max dotclock 170MHz
Has 1 extension blocks
Checksum: 0x4a (valid)

CTA extension block
Extension version: 3
43 bytes of CTA data
  Video data block
    VIC  16 1920x1080@60Hz 16:9 (native) HorFreq: 67500 Hz Clock: 148.500 MHz
    VIC   3 720x480@60Hz 16:9  HorFreq: 31469 Hz Clock: 27.000 MHz
    VIC   4 1280x720@60Hz 16:9  HorFreq: 45000 Hz Clock: 74.250 MHz
    VIC   5 1920x1080i@60Hz 16:9  HorFreq: 33750 Hz Clock: 74.250 MHz
    VIC   1 640x480@60Hz 4:3  HorFreq: 31469 Hz Clock: 25.175 MHz
  Audio data block
    Linear PCM, max channels 8
      Supported sample rates (kHz): 192 176.4 96 88.2 48 44.1 32
      Supported sample sizes (bits): 24 20 16
  Audio data block
    AC-3, max channels 6
      Supported sample rates (kHz): 48 44.1 32
      Maximum bit rate: 640 kHz
  Audio data block
    DTS, max channels 6
      Supported sample rates (kHz): 96 88.2 48 44.1 32
      Maximum bit rate: 1536 kHz
  Audio data block
    One Bit Audio, max channels 6
      Supported sample rates (kHz): 44.1
  Audio data block
    Dolby Digital+, max channels 8
      Supported sample rates (kHz): 96 48 44.1 32
  Audio data block
    DTS-HD, max channels 8
      Supported sample rates (kHz): 96 48
  Speaker allocation data block
    Speaker map:
      FL/FR - Front Left/Right
      LFE - Low Frequency Effects
      FC - Front Center
      BL/BR - Back Left/Right
      RLC/RRC - Rear Left/Right of Center
  Vendor-specific data block, OUI 000c03 (HDMI)
    Source physical address 0.0.0.0
    Supports_AI
    DC_36bit
    DC_30bit
    DC_Y444
    Maximum TMDS clock: 225MHz
Basic audio support
Supports YCbCr 4:4:4
Supports YCbCr 4:2:2
1 native detailed modes
Detailed mode: Clock 74.250 MHz, 476 mm x 268 mm
               1280 1390 1430 1650 hborder 0
                720  725  730  750 vborder 0
               +hsync +vsync 
               VertFreq: 60 Hz, HorFreq: 45000 Hz
Detailed mode: Clock 74.250 MHz, 476 mm x 268 mm
               1920 2008 2052 2200 hborder 0
                540  542  547  562 vborder 0
               +hsync +vsync interlaced 
               VertFreq: 60 Hz, HorFreq: 33750 Hz
Detailed mode: Clock 25.180 MHz, 357 mm x 268 mm
                640  656  752  800 hborder 0
                480  490  492  525 vborder 0
               -hsync -vsync 
               VertFreq: 59 Hz, HorFreq: 31475 Hz
Checksum: 0x9a (valid)

EDID block does NOT conform to EDID 1.3!
	sRGB is signaled, but the chromaticities do not match
