edid-decode (hex):

00 ff ff ff ff ff ff 00 0e 14 d5 37 00 00 00 00
10 1b 01 03 95 1a 10 78 0a 3f a5 9d 54 57 90 26
1e 50 54 00 00 00 01 01 01 01 01 01 01 01 01 01
01 01 01 01 01 01 2e 3b 80 7d 70 b0 23 40 30 20
35 00 04 a2 10 00 00 19 2e 3b 80 7d 70 b0 0a 40
30 20 36 00 04 a2 10 00 00 18 00 00 00 fe 00 43
4c 41 41 31 32 31 46 50 30 31 20 20 41 4c 31 41
47 44 35 41 30 30 32 37 34 42 58 31 20 20 00 71

00 ff ff ff ff ff ff 00 0e 14 d5 37 00 00 00 00
10 1b 01 03 95 1a 10 78 0a 3f a5 9d 54 57 90 26
1e 50 54 00 00 00 01 01 01 01 01 01 01 01 01 01
01 01 01 01 01 01 2e 3b 80 7d 70 b0 23 40 30 20
35 00 04 a2 10 00 00 19 2e 3b 80 7d 70 b0 0a 40
30 20 36 00 04 a2 10 00 00 18 00 00 00 fe 00 43
4c 41 41 31 32 31 46 50 30 31 20 20 41 4c 31 41
47 44 35 41 30 30 32 37 34 42 58 31 20 20 00 71

----------------

Block 0, Base EDID:
  EDID Structure Version & Revision: 1.3
  Vendor & Product Identification:
    Manufacturer: CPT
    Model: 14293
    Made in: week 16 of 2017
  Basic Display Parameters & Features:
    Digital display
    DFP 1.x compatible TMDS
    Maximum image size: 26 cm x 16 cm
    Gamma: 2.20
    RGB color display
    First detailed timing is the preferred timing
  Color Characteristics:
    Red  : 0.6132, 0.3310
    Green: 0.3427, 0.5654
    Blue : 0.1503, 0.1191
    White: 0.3134, 0.3291
  Established Timings I & II: none
  Standard Timings: none
  Detailed Timing Descriptors:
    DTD 1:  1920x1200   59.986340 Hz  16:10    74.083 kHz    151.500000 MHz (260 mm x 162 mm)
                 Hfront   48 Hsync  32 Hback   45 Hpol N
                 Vfront    3 Vsync   5 Vback   27 Vpol N
    DTD 2:  1920x1200   61.225727 Hz  16:10    74.083 kHz    151.500000 MHz (260 mm x 162 mm)
                 Hfront   48 Hsync  32 Hback   45 Hpol N
                 Vfront    3 Vsync   6 Vback    1 Vpol N
    Alphanumeric Data String: 'CLAA121FP01  '
    DTD 3:  1073x1092   47.555013 Hz 1073:1092   66.625 kHz    195.210000 MHz (analog composite, sync-on-green, field sequential L/R, 1332 mm x 2114 mm)
                 Hfront   48 Hsync 816 Hback  895 Hpol N Hborder 49
                 Vfront   19 Vsync  50 Vback  176 Vpol N Vborder 32
Checksum: 0x71

----------------

Block 1, Unknown EDID Extension Block 0x00:
  00 ff ff ff ff ff ff 00 0e 14 d5 37 00 00 00 00 '...........7....'
  10 1b 01 03 95 1a 10 78 0a 3f a5 9d 54 57 90 26 '.......x.?..TW.&'
  1e 50 54 00 00 00 01 01 01 01 01 01 01 01 01 01 '.PT.............'
  01 01 01 01 01 01 2e 3b 80 7d 70 b0 23 40 30 20 '.......;.}p.#@0 '
  35 00 04 a2 10 00 00 19 2e 3b 80 7d 70 b0 0a 40 '5........;.}p..@'
  30 20 36 00 04 a2 10 00 00 18 00 00 00 fe 00 43 '0 6............C'
  4c 41 41 31 32 31 46 50 30 31 20 20 41 4c 31 41 'LAA121FP01  AL1A'
  47 44 35 41 30 30 32 37 34 42 58 31 20 20 00 71 'GD5A00274BX1  .q'
Checksum: 0x71

----------------

Warnings:

Block 0, Base EDID:
  Detailed Timing Descriptor #3: The use of non-zero borders in a DTD is not recommended.

Failures:

Block 0, Base EDID:
  Basic Display Parameters & Features: Digital Video Interface Standard set to reserved value 0x14.
  Alphanumeric Data String: One or more trailing spaces.
  Detailed Timing Descriptor #3: Mismatch of image size 1332x2114 mm vs display size 260x160 mm.
  Detailed Timing Descriptor #3: Invalid detailed timing descriptor ordering.
  Missing Display Product Name.
  Missing Display Range Limits Descriptor.
Block 1, Base EDID:
  Unknown Extension Block.
EDID:
  Base EDID: The DTD max image size is 1332x2114mm, which is larger than the display size 260.0x160.0mm.
  Base EDID: EDID specified 0 extension block(s), but found 1 extension block(s).

EDID conformity: FAIL
