
EDID (hex):
00ffffffffffff000e14d53700000000
111b0103951a10780a3fa59d54579026
1e505400000001010101010101010101
0101010101012e3b807d70b023403020
350004a2100000192e3b807d70b00a40
3020360004a210000018000000fe0043
4c4141313231465030312020414c3141
57444a4530303237344d58312020003c

edid-decode (hex):

00 ff ff ff ff ff ff 00 0e 14 d5 37 00 00 00 00
11 1b 01 03 95 1a 10 78 0a 3f a5 9d 54 57 90 26
1e 50 54 00 00 00 01 01 01 01 01 01 01 01 01 01
01 01 01 01 01 01 2e 3b 80 7d 70 b0 23 40 30 20
35 00 04 a2 10 00 00 19 2e 3b 80 7d 70 b0 0a 40
30 20 36 00 04 a2 10 00 00 18 00 00 00 fe 00 43
4c 41 41 31 32 31 46 50 30 31 20 20 41 4c 31 41
57 44 4a 45 30 30 32 37 34 4d 58 31 20 20 00 3c

----------------

Block 0, Base EDID:
  EDID Structure Version & Revision: 1.3
  Vendor & Product Identification:
    Manufacturer: CPT
    Model: 14293
    Made in: week 17 of 2017
  Basic Display Parameters & Features:
    Digital display
    DFP 1.x compatible TMDS
    Maximum image size: 26 cm x 16 cm
    Gamma: 2.20
    RGB color display
    First detailed timing is the preferred timing
  Color Characteristics:
    Red  : 0.6132, 0.3310
    Green: 0.3427, 0.5654
    Blue : 0.1503, 0.1191
    White: 0.3134, 0.3291
  Established Timings I & II: none
  Standard Timings: none
  Detailed Timing Descriptors:
    DTD 1:  1920x1200   59.986340 Hz  16:10    74.083 kHz    151.500000 MHz (260 mm x 162 mm)
                 Hfront   48 Hsync  32 Hback   45 Hpol N
                 Vfront    3 Vsync   5 Vback   27 Vpol N
    DTD 2:  1920x1200   61.225727 Hz  16:10    74.083 kHz    151.500000 MHz (260 mm x 162 mm)
                 Hfront   48 Hsync  32 Hback   45 Hpol N
                 Vfront    3 Vsync   6 Vback    1 Vpol N
    Alphanumeric Data String: 'CLAA121FP01  '
    DTD 3:  1329x1092   25.049545 Hz 443:364   61.271 kHz    195.210000 MHz (analog composite, sync-on-green, field sequential L/R, 1332 mm x 2125 mm)
                 Hfront   48 Hsync 816 Hback  895 Hpol N Hborder 49
                 Vfront   19 Vsync  50 Vback 1221 Vpol N Vborder 32
Checksum: 0x3c
