edid-decode (hex):

00 ff ff ff ff ff ff 00 30 ae bb 41 00 00 00 00
20 1f 01 04 a5 22 16 78 e3 81 6d a4 54 4b 98 23
10 4f 54 00 00 00 01 01 01 01 01 01 01 01 01 01
01 01 01 01 01 01 ef 68 00 a0 a0 40 2e 60 30 20
36 00 58 d7 10 00 00 1a 00 00 00 fd 00 28 3c 63
63 1b 01 0a 20 20 20 20 20 20 00 00 00 0f 00 ff
0a 3c ff 0a 28 28 0a 04 0e 6f 0e 16 00 00 00 fe
00 4d 4e 47 30 30 37 44 41 31 2d 43 0a 20 00 8d

00 ff ff ff ff ff ff 00 30 ae bb 41 00 00 00 00
20 1f 01 04 a5 22 16 78 e3 81 6d a4 54 4b 98 23
10 4f 54 00 00 00 01 01 01 01 01 01 01 01 01 01
01 01 01 01 01 01 ef 68 00 a0 a0 40 2e 60 30 20
36 00 58 d7 10 00 00 1a 00 00 00 fd 00 28 3c 63
63 1b 01 0a 20 20 20 20 20 20 00 00 00 0f 00 ff
0a 3c ff 0a 28 28 0a 04 0e 6f 0e 16 00 00 00 fe
00 4d 4e 47 30 30 37 44 41 31 2d 43 0a 20 00 8d

----------------

Block 0, Base EDID:
  EDID Structure Version & Revision: 1.4
  Vendor & Product Identification:
    Manufacturer: LEN
    Model: 16827
    Made in: week 32 of 2021
  Basic Display Parameters & Features:
    Digital display
    Bits per primary color channel: 8
    DisplayPort interface
    Maximum image size: 34 cm x 22 cm
    Gamma: 2.20
    DPMS levels: Standby Suspend Off
    Supported color formats: RGB 4:4:4
    First detailed timing includes the native pixel format and preferred refresh rate
    Display is continuous frequency
  Color Characteristics:
    Red  : 0.6425, 0.3281
    Green: 0.2929, 0.5947
    Blue : 0.1376, 0.0644
    White: 0.3115, 0.3291
  Established Timings I & II: none
  Standard Timings: none
  Detailed Timing Descriptors:
    DTD 1:  2560x1600   60.000625 Hz  16:10    98.761 kHz    268.630000 MHz (344 mm x 215 mm)
                 Hfront   48 Hsync  32 Hback   80 Hpol P
                 Vfront    3 Vsync   6 Vback   37 Vpol N
    Display Range Limits:
      Monitor ranges (Bare Limits): 40-60 Hz V, 99-99 kHz H, max dotclock 270 MHz
    Manufacturer-Specified Display Descriptor (0x0f): 00 0f 00 ff 0a 3c ff 0a 28 28 0a 04 0e 6f 0e 16 '.....<..((...o..'
    Alphanumeric Data String: 'MNG007DA1-C'
Checksum: 0x8d

----------------

Block 1, Unknown EDID Extension Block 0x00:
  00 ff ff ff ff ff ff 00 30 ae bb 41 00 00 00 00 '........0..A....'
  20 1f 01 04 a5 22 16 78 e3 81 6d a4 54 4b 98 23 ' ....".x..m.TK.#'
  10 4f 54 00 00 00 01 01 01 01 01 01 01 01 01 01 '.OT.............'
  01 01 01 01 01 01 ef 68 00 a0 a0 40 2e 60 30 20 '.......h...@.`0 '
  36 00 58 d7 10 00 00 1a 00 00 00 fd 00 28 3c 63 '6.X..........(<c'
  63 1b 01 0a 20 20 20 20 20 20 00 00 00 0f 00 ff 'c...      ......'
  0a 3c ff 0a 28 28 0a 04 0e 6f 0e 16 00 00 00 fe '.<..((...o......'
  00 4d 4e 47 30 30 37 44 41 31 2d 43 0a 20 00 8d '.MNG007DA1-C. ..'
Checksum: 0x8d

----------------

Warnings:

Block 0, Base EDID:
  Missing Display Product Name.

Failures:

Block 1, Base EDID:
  Unknown Extension Block.
EDID:
  Base EDID: EDID specified 0 extension block(s), but found 1 extension block(s).

EDID conformity: FAIL
