
EDID (hex):
00ffffffffffff000e6f101400000000
001f0104b51f1478036151a4544d9926
0f505400000001010101010101010101
010101010101809700a0c08050703020
360038c310000018000000fd001e78f0
f04e010a202020202020000000fe0043
534f542054330a2020202020000000fe
004d4e453530375a41312d310a200221
02030f00e60601016060280000000000
00000000000000000000000000000000
00000000000000000000000000000000
00000000000000000000000000000000
00000000000000000000000000000000
00000000000000000000000000000000
00000000000000000000000000000000
000000000000000000000000000018fe
7013790000030114002f0105ff0b9f00
2f001f007f074f000200050000000000
00000000000000000000000000000000
00000000000000000000000000000000
00000000000000000000000000000000
00000000000000000000000000000000
00000000000000000000000000000000
00000000000000000000000000005490

Extracted contents:
header:          00 ff ff ff ff ff ff 00
serial number:   0e 6f 10 14 00 00 00 00 00 1f
version:         01 04
basic params:    b5 1f 14 78 03
chroma info:     61 51 a4 54 4d 99 26 0f 50 54
established:     00 00 00
standard:        01 01 01 01 01 01 01 01 01 01 01 01 01 01 01 01
descriptor 1:    80 97 00 a0 c0 80 50 70 30 20 36 00 38 c3 10 00 00 18
descriptor 2:    00 00 00 fd 00 1e 78 f0 f0 4e 01 0a 20 20 20 20 20 20
descriptor 3:    00 00 00 fe 00 43 53 4f 54 20 54 33 0a 20 20 20 20 20
descriptor 4:    00 00 00 fe 00 4d 4e 45 35 30 37 5a 41 31 2d 31 0a 20
extensions:      02
checksum:        21

EDID version: 1.4
Manufacturer: CSO Model 1410 Serial Number --
Made in year 2021
Digital display
10 bits per primary color channel
DisplayPort interface
Maximum image size: 31 cm x 20 cm
Gamma: 2.20
Supported color formats: RGB 4:4:4
First detailed timing includes the native pixel format and preferred refresh rate
Display is continuous frequency
Display x,y Chromaticity:
  Red:   0.6416, 0.3300
  Green: 0.3007, 0.5986
  Blue:  0.1494, 0.0595
  White: 0.3125, 0.3291
Established timings supported:
Standard timings supported:
Detailed mode: Clock 387.840 MHz, 312 mm x 195 mm
               3072 3120 3152 3232 hborder 0
               1920 1923 1929 2000 vborder 0
               -hsync -vsync 
               VertFreq: 60 Hz, HorFreq: 120000 Hz
Monitor ranges (bare limits): 30-120Hz V, 240-240kHz H, max dotclock 780MHz
ASCII string: CSOT T3
ASCII string: MNE507ZA1-1
Has 2 extension blocks
Checksum: 0x21 (valid)

CTA extension block
Extension version: 3
11 bytes of CTA data
  Extended tag: HDR static metadata data block
    Electro optical transfer functions:
      Traditional gamma - SDR luminance range
    Supported static metadata descriptors:
      Static metadata type 1
    Desired content max luminance: 96 (400.000 cd/m^2)
    Desired content max frame-average luminance: 96 (400.000 cd/m^2)
    Desired content min luminance: 40 (0.098 cd/m^2)
  Unknown tag 0, length 0 (raw 00)
  Unknown tag 0, length 0 (raw 00)
  Unknown tag 0, length 0 (raw 00)
  Unknown tag 0, length 0 (raw 00)
0 native detailed modes
Checksum: 0xfe (valid)


DisplayID extension block
Extension version: 19
Length 121, version 19, extension count 0
Checksum: 0x54 (valid)
Type 1 detailed timing: aspect: 16:10,  
Detailed mode: Clock 775.680 MHz, 0 mm x 0 mm
               3071 3118 3149 3230
               1919 1921 1926 1998
               -hsync -vsync

EDID block does NOT conform to EDID 1.4!
	Required 640x480p60 timings are missing in the established timings
	and/or in the SVD list (VIC 1)
	Missing name descriptor
Warning: One or more of the timings is out of range of the Monitor Ranges:
  Vertical Freq: 60 - 60 Hz
  Horizontal Freq: 120000 - 120000 Hz
  Maximum Clock: 387.840 MHz
