
EDID (hex):
00ffffffffffff004eae960500000000
1310010380291f78eaa6a5a3574a9d25
125054bfef00a941a940818081907186
010101010101ae3340b060b027400840
5a0098321100001e000000fd00384c1f
5c11000a202020202020000000fc0058
37323030410a202020202020000000ff
00303631395041303530350a20200031

Extracted contents:
header:          00 ff ff ff ff ff ff 00
serial number:   4e ae 96 05 00 00 00 00 13 10
version:         01 03
basic params:    80 29 1f 78 ea
chroma info:     a6 a5 a3 57 4a 9d 25 12 50 54
established:     bf ef 00
standard:        a9 41 a9 40 81 80 81 90 71 86 01 01 01 01 01 01
descriptor 1:    ae 33 40 b0 60 b0 27 40 08 40 5a 00 98 32 11 00 00 1e
descriptor 2:    00 00 00 fd 00 38 4c 1f 5c 11 00 0a 20 20 20 20 20 20
descriptor 3:    00 00 00 fc 00 58 37 32 30 30 41 0a 20 20 20 20 20 20
descriptor 4:    00 00 00 ff 00 30 36 31 39 50 41 30 35 30 35 0a 20 20
extensions:      00
checksum:        31

EDID version: 1.3
Manufacturer: SUN Model 596 Serial Number --
Made in week 19 of 2006
Digital display
Maximum image size: 41 cm x 31 cm
Gamma: 2.20
DPMS levels: Standby Suspend Off
RGB color display
First detailed timing is preferred timing
Display x,y Chromaticity:
  Red:   0.6386, 0.3417
  Green: 0.2900, 0.6152
  Blue:  0.1464, 0.0722
  White: 0.3134, 0.3291
Established timings supported:
  720x400@70Hz 9:5 HorFreq: 31469 Hz Clock: 28.320 MHz
  640x480@60Hz 4:3 HorFreq: 31469 Hz Clock: 25.175 MHz
  640x480@67Hz 4:3 HorFreq: 35000 Hz Clock: 30.240 MHz
  640x480@72Hz 4:3 HorFreq: 37900 Hz Clock: 31.500 MHz
  640x480@75Hz 4:3 HorFreq: 37500 Hz Clock: 31.500 MHz
  800x600@56Hz 4:3 HorFreq: 35200 Hz Clock: 36.000 MHz
  800x600@60Hz 4:3 HorFreq: 37900 Hz Clock: 40.000 MHz
  800x600@72Hz 4:3 HorFreq: 48100 Hz Clock: 50.000 MHz
  800x600@75Hz 4:3 HorFreq: 46900 Hz Clock: 49.500 MHz
  832x624@75Hz 4:3 HorFreq: 49726 Hz Clock: 57.284 MHz
  1024x768@60Hz 4:3 HorFreq: 48400 Hz Clock: 65.000 MHz
  1024x768@70Hz 4:3 HorFreq: 56500 Hz Clock: 75.000 MHz
  1024x768@75Hz 4:3 HorFreq: 60000 Hz Clock: 78.750 MHz
  1280x1024@75Hz 5:4 HorFreq: 80000 Hz Clock: 135.000 MHz
Standard timings supported:
  1600x1200@61Hz 4:3
  1600x1200@60Hz 4:3 HorFreq: 75000 Hz Clock: 162.000 MHz
  1280x1024@60Hz 5:4 HorFreq: 64000 Hz Clock: 108.000 MHz
  1280x1024@76Hz 5:4
  1152x921@66Hz 5:4
Detailed mode: Clock 132.300 MHz, 408 mm x 306 mm
               1600 1608 1672 1776 hborder 0
               1200 1205 1215 1239 vborder 0
               +hsync +vsync 
               VertFreq: 60 Hz, HorFreq: 74493 Hz
Monitor ranges (GTF): 56-76Hz V, 31-92kHz H, max dotclock 170MHz
Monitor name: X7200A
Serial number: --
Checksum: 0x31 (valid)
