
EDID (hex):
00ffffffffffff004c2d352c00000000
24070101281c1547e8e2f99e594e9927
10484cfff80031594559010101010101
010101010101100e80c020e01d103838
13000bc810000018f91520f830581f20
204013000bc81000001e641900404100
2630188836000bc810000018000000fd
0032781e37ff000a2020202020200074

Extracted contents:
header:          00 ff ff ff ff ff ff 00
serial number:   4c 2d 35 2c 00 00 00 00 24 07
version:         01 01
basic params:    28 1c 15 47 e8
chroma info:     e2 f9 9e 59 4e 99 27 10 48 4c
established:     ff f8 00
standard:        31 59 45 59 01 01 01 01 01 01 01 01 01 01 01 01
descriptor 1:    10 0e 80 c0 20 e0 1d 10 38 38 13 00 0b c8 10 00 00 18
descriptor 2:    f9 15 20 f8 30 58 1f 20 20 40 13 00 0b c8 10 00 00 1e
descriptor 3:    64 19 00 40 41 00 26 30 18 88 36 00 0b c8 10 00 00 18
descriptor 4:    00 00 00 fd 00 32 78 1e 37 ff 00 0a 20 20 20 20 20 20
extensions:      00
checksum:        74

EDID version: 1.1
Manufacturer: SAM Model 2c35 Serial Number --
Analog display, Input voltage level: 0.714/0.286 V
Sync: Separate 
Maximum image size: 28 cm x 21 cm
Gamma: 1.71
DPMS levels: Standby Suspend Off
RGB color display
Display x,y Chromaticity:
  Red:   0.6201, 0.3496
  Green: 0.3046, 0.5996
  Blue:  0.1552, 0.0654
  White: 0.2832, 0.2978
Established timings supported:
  720x400@70Hz 9:5 HorFreq: 31469 Hz Clock: 28.320 MHz
  720x400@88Hz 9:5 HorFreq: 39500 Hz Clock: 35.500 MHz
  640x480@60Hz 4:3 HorFreq: 31469 Hz Clock: 25.175 MHz
  640x480@67Hz 4:3 HorFreq: 35000 Hz Clock: 30.240 MHz
  640x480@72Hz 4:3 HorFreq: 37900 Hz Clock: 31.500 MHz
  640x480@75Hz 4:3 HorFreq: 37500 Hz Clock: 31.500 MHz
  800x600@56Hz 4:3 HorFreq: 35200 Hz Clock: 36.000 MHz
  800x600@60Hz 4:3 HorFreq: 37900 Hz Clock: 40.000 MHz
  800x600@72Hz 4:3 HorFreq: 48100 Hz Clock: 50.000 MHz
  800x600@75Hz 4:3 HorFreq: 46900 Hz Clock: 49.500 MHz
  832x624@75Hz 4:3 HorFreq: 49726 Hz Clock: 57.284 MHz
  1280x768i@87Hz 5:3 HorFreq: 35522 Hz Clock: 44.900 MHz
  1024x768@60Hz 4:3 HorFreq: 48400 Hz Clock: 65.000 MHz
Standard timings supported:
  640x480@85Hz 4:3 HorFreq: 43300 Hz Clock: 36.000 MHz
  800x600@85Hz 4:3 HorFreq: 53700 Hz Clock: 56.250 MHz
Detailed mode: Clock 36.000 MHz, 267 mm x 200 mm
                640  696  752  832 hborder 0
                480  481  484  509 vborder 0
               -hsync -vsync 
               VertFreq: 85 Hz, HorFreq: 43269 Hz
Detailed mode: Clock 56.250 MHz, 267 mm x 200 mm
                800  832  896 1048 hborder 0
                600  601  604  631 vborder 0
               +hsync +vsync 
               VertFreq: 85 Hz, HorFreq: 53673 Hz
Detailed mode: Clock 65.000 MHz, 267 mm x 200 mm
               1024 1048 1184 1344 hborder 0
                768  771  777  806 vborder 0
               -hsync -vsync 
               VertFreq: 60 Hz, HorFreq: 48363 Hz
Monitor ranges (GTF): 50-120Hz V, 30-55kHz H, max dotclock 2550MHz
Checksum: 0x74 (valid)
EDID block does NOT conform to EDID 1.0!
	Has descriptor blocks other than detailed timings
EDID block does not conform at all!
	Bad year of manufacture
