
EDID (hex):
00ffffffffffff0022f6256a22f680c0
301f0103805021780a54b1ac5047a426
115054bfcf0081408180714f81c0b300
d1c0010101014ed470a0d0a046503040
3a001d4e3100001ce77c70a0d0a02950
30203a001d4e3100001a000000fd0030
901ea03c010a202020202020000000fc
005a51452d4342410a2020202020019f
020344b14b1f9014010304121305025a
83010000e200d567030c002000384067
d85dc4017880006d1a000002013090e6
0000000000e305c081e30f0000e60605
0166661c565e00a0a0a0295030203500
1d4e3100001a0ece14a0a03859403020
3a001d4e3100001adf45146aa0381f40
152018041d4e3100001a00000000003a

Extracted contents:
header:          00 ff ff ff ff ff ff 00
serial number:   22 f6 25 6a 22 f6 80 c0 30 1f
version:         01 03
basic params:    80 50 21 78 0a
chroma info:     54 b1 ac 50 47 a4 26 11 50 54
established:     bf cf 00
standard:        81 40 81 80 71 4f 81 c0 b3 00 d1 c0 01 01 01 01
descriptor 1:    4e d4 70 a0 d0 a0 46 50 30 40 3a 00 1d 4e 31 00 00 1c
descriptor 2:    e7 7c 70 a0 d0 a0 29 50 30 20 3a 00 1d 4e 31 00 00 1a
descriptor 3:    00 00 00 fd 00 30 90 1e a0 3c 01 0a 20 20 20 20 20 20
descriptor 4:    00 00 00 fc 00 5a 51 45 2d 43 42 41 0a 20 20 20 20 20
extensions:      01
checksum:        9f

EDID version: 1.3
Manufacturer: HWV Model 6a25 Serial Number --
Made in week 48 of 2021
Digital display
Maximum image size: 80 cm x 33 cm
Gamma: 2.20
RGB color display
First detailed timing is preferred timing
Display x,y Chromaticity:
  Red:   0.6728, 0.3134
  Green: 0.2783, 0.6406
  Blue:  0.1503, 0.0693
  White: 0.3125, 0.3291
Established timings supported:
  720x400@70Hz 9:5 HorFreq: 31469 Hz Clock: 28.320 MHz
  640x480@60Hz 4:3 HorFreq: 31469 Hz Clock: 25.175 MHz
  640x480@67Hz 4:3 HorFreq: 35000 Hz Clock: 30.240 MHz
  640x480@72Hz 4:3 HorFreq: 37900 Hz Clock: 31.500 MHz
  640x480@75Hz 4:3 HorFreq: 37500 Hz Clock: 31.500 MHz
  800x600@56Hz 4:3 HorFreq: 35200 Hz Clock: 36.000 MHz
  800x600@60Hz 4:3 HorFreq: 37900 Hz Clock: 40.000 MHz
  800x600@72Hz 4:3 HorFreq: 48100 Hz Clock: 50.000 MHz
  800x600@75Hz 4:3 HorFreq: 46900 Hz Clock: 49.500 MHz
  1024x768@60Hz 4:3 HorFreq: 48400 Hz Clock: 65.000 MHz
  1024x768@70Hz 4:3 HorFreq: 56500 Hz Clock: 75.000 MHz
  1024x768@75Hz 4:3 HorFreq: 60000 Hz Clock: 78.750 MHz
  1280x1024@75Hz 5:4 HorFreq: 80000 Hz Clock: 135.000 MHz
Standard timings supported:
  1280x960@60Hz 4:3 HorFreq: 60000 Hz Clock: 108.000 MHz
  1280x1024@60Hz 5:4 HorFreq: 64000 Hz Clock: 108.000 MHz
  1152x864@75Hz 4:3 HorFreq: 67500 Hz Clock: 108.000 MHz
  1280x720@60Hz 16:9
  1680x1050@60Hz 16:10 HorFreq: 64700 Hz Clock: 119.000 MHz
  1920x1080@60Hz 16:9
Detailed mode: Clock 543.500 MHz, 797 mm x 334 mm
               3440 3488 3552 3600 hborder 0
               1440 1443 1453 1510 vborder 0
               -hsync +vsync 
               VertFreq: 99 Hz, HorFreq: 150972 Hz
Detailed mode: Clock 319.750 MHz, 797 mm x 334 mm
               3440 3488 3520 3600 hborder 0
               1440 1443 1453 1481 vborder 0
               +hsync -vsync 
               VertFreq: 59 Hz, HorFreq: 88819 Hz
Monitor ranges (bare limits): 48-144Hz V, 30-160kHz H, max dotclock 600MHz
Monitor name: ZQE-CBA
Has 1 extension blocks
Checksum: 0x9f (valid)

CTA extension block
Extension version: 3
64 bytes of CTA data
  Video data block
    VIC  31 1920x1080@50Hz 16:9  HorFreq: 56250 Hz Clock: 148.500 MHz
    VIC  16 1920x1080@60Hz 16:9 (native) HorFreq: 67500 Hz Clock: 148.500 MHz
    VIC  20 1920x1080i@50Hz 16:9  HorFreq: 28125 Hz Clock: 74.250 MHz
    VIC   1 640x480@60Hz 4:3  HorFreq: 31469 Hz Clock: 25.175 MHz
    VIC   3 720x480@60Hz 16:9  HorFreq: 31469 Hz Clock: 27.000 MHz
    VIC   4 1280x720@60Hz 16:9  HorFreq: 45000 Hz Clock: 74.250 MHz
    VIC  18 720x576@50Hz 16:9  HorFreq: 31250 Hz Clock: 27.000 MHz
    VIC  19 1280x720@50Hz 16:9  HorFreq: 37500 Hz Clock: 74.250 MHz
    VIC   5 1920x1080i@60Hz 16:9  HorFreq: 33750 Hz Clock: 74.250 MHz
    VIC   2 720x480@60Hz 4:3  HorFreq: 31469 Hz Clock: 27.000 MHz
    VIC  90 2560x1080@60Hz 64:27  HorFreq: 66000 Hz Clock: 198.000 MHz
  Speaker allocation data block
    Speaker map:
      FL/FR - Front Left/Right
  Extended tag: Video capability data block
    YCbCr quantization: Selectable (via AVI YQ) (1)
    RGB quantization: Selectable (via AVI Q) (1)
    PT scan behaviour: Always Overscannned (1)
    IT scan behaviour: Always Overscannned (1)
    CE scan behaviour: Always Overscannned (1)
  Vendor-specific data block, OUI 000c03 (HDMI)
    Source physical address 2.0.0.0
    DC_36bit
    DC_30bit
    DC_Y444
    Maximum TMDS clock: 320MHz
  Vendor-specific data block, OUI c45dd8 (HDMI Forum)
    Version: 1
    Maximum TMDS Character Rate: 600MHz
    SCDC Present
  Vendor-specific data block, OUI 00001a
  Extended tag: Colorimetry data block
    BT2020YCC
    BT2020RGB
    DCI-P3
  Extended tag: YCbCr 4:2:0 capability map data block
  Extended tag: HDR static metadata data block
    Electro optical transfer functions:
      Traditional gamma - SDR luminance range
      SMPTE ST2084
    Supported static metadata descriptors:
      Static metadata type 1
    Desired content max luminance: 102 (455.515 cd/m^2)
    Desired content max frame-average luminance: 102 (455.515 cd/m^2)
    Desired content min luminance: 28 (0.055 cd/m^2)
Underscans PC formats by default
Supports YCbCr 4:4:4
Supports YCbCr 4:2:2
1 native detailed modes
Detailed mode: Clock 241.500 MHz, 797 mm x 334 mm
               2560 2608 2640 2720 hborder 0
               1440 1443 1448 1481 vborder 0
               +hsync -vsync 
               VertFreq: 59 Hz, HorFreq: 88786 Hz
Detailed mode: Clock 527.500 MHz, 797 mm x 334 mm
               2580 2628 2660 2740 hborder 0
               1080 1083 1093 1169 vborder 0
               +hsync -vsync 
               VertFreq: 164 Hz, HorFreq: 192518 Hz
Detailed mode: Clock 178.870 MHz, 797 mm x 334 mm
               2580 2601 2633 2686 hborder 0
               1080 1097 1105 1111 vborder 0
               +hsync -vsync 
               VertFreq: 59 Hz, HorFreq: 66593 Hz
Checksum: 0x3a (valid)

EDID block does not conform at all!
	Detailed blocks filled with garbage
	Range descriptor contains garbage
