
EDID (hex):
00ffffffffffff0022f6256a22f680c0
0b200104b55021783b54b1ac5047a426
115054bfcf0081408180714f81c0b300
d1c0010101014ed470a0d0a046503040
3a001d4e3100001ce77c70a0d0a02950
30203a001d4e3100001a000000fd0030
a5e0e051010a202020202020000000fc
005a51452d4342410a2020202020022f
02033cb14b1f9014010304121305023f
83010000e200d567030c00200038786d
1a0000020130a5000000000000e305c0
81e30f0000e606050166661c565e00a0
a0a02950302035001d4e3100001a0ece
14a0a038594030203a001d4e3100001a
df45146aa0381f40152018041d4e3100
001a000000000000000000000000004f
701279000003013c570101046f0d9f00
2f001f009f0554004600070074380104
6f0d9f002f001f009f05660058000700
a25701886f0d9f002f001f009f052800
1a000700000000000000000000000000
00000000000000000000000000000000
00000000000000000000000000000000
0000000000000000000000000000cf90

Extracted contents:
header:          00 ff ff ff ff ff ff 00
serial number:   22 f6 25 6a 22 f6 80 c0 0b 20
version:         01 04
basic params:    b5 50 21 78 3b
chroma info:     54 b1 ac 50 47 a4 26 11 50 54
established:     bf cf 00
standard:        81 40 81 80 71 4f 81 c0 b3 00 d1 c0 01 01 01 01
descriptor 1:    4e d4 70 a0 d0 a0 46 50 30 40 3a 00 1d 4e 31 00 00 1c
descriptor 2:    e7 7c 70 a0 d0 a0 29 50 30 20 3a 00 1d 4e 31 00 00 1a
descriptor 3:    00 00 00 fd 00 30 a5 e0 e0 51 01 0a 20 20 20 20 20 20
descriptor 4:    00 00 00 fc 00 5a 51 45 2d 43 42 41 0a 20 20 20 20 20
extensions:      02
checksum:        2f

EDID version: 1.4
Manufacturer: HWV Model 6a25 Serial Number --
Made in week 11 of 2022
Digital display
10 bits per primary color channel
DisplayPort interface
Maximum image size: 80 cm x 33 cm
Gamma: 2.20
DPMS levels: Off
Supported color formats: RGB 4:4:4, YCrCb 4:4:4, YCrCb 4:2:2
First detailed timing includes the native pixel format and preferred refresh rate
Display is continuous frequency
Display x,y Chromaticity:
  Red:   0.6728, 0.3134
  Green: 0.2783, 0.6406
  Blue:  0.1503, 0.0693
  White: 0.3125, 0.3291
Established timings supported:
  720x400@70Hz 9:5 HorFreq: 31469 Hz Clock: 28.320 MHz
  640x480@60Hz 4:3 HorFreq: 31469 Hz Clock: 25.175 MHz
  640x480@67Hz 4:3 HorFreq: 35000 Hz Clock: 30.240 MHz
  640x480@72Hz 4:3 HorFreq: 37900 Hz Clock: 31.500 MHz
  640x480@75Hz 4:3 HorFreq: 37500 Hz Clock: 31.500 MHz
  800x600@56Hz 4:3 HorFreq: 35200 Hz Clock: 36.000 MHz
  800x600@60Hz 4:3 HorFreq: 37900 Hz Clock: 40.000 MHz
  800x600@72Hz 4:3 HorFreq: 48100 Hz Clock: 50.000 MHz
  800x600@75Hz 4:3 HorFreq: 46900 Hz Clock: 49.500 MHz
  1024x768@60Hz 4:3 HorFreq: 48400 Hz Clock: 65.000 MHz
  1024x768@70Hz 4:3 HorFreq: 56500 Hz Clock: 75.000 MHz
  1024x768@75Hz 4:3 HorFreq: 60000 Hz Clock: 78.750 MHz
  1280x1024@75Hz 5:4 HorFreq: 80000 Hz Clock: 135.000 MHz
Standard timings supported:
  1280x960@60Hz 4:3 HorFreq: 60000 Hz Clock: 108.000 MHz
  1280x1024@60Hz 5:4 HorFreq: 64000 Hz Clock: 108.000 MHz
  1152x864@75Hz 4:3 HorFreq: 67500 Hz Clock: 108.000 MHz
  1280x720@60Hz 16:9
  1680x1050@60Hz 16:10 HorFreq: 64700 Hz Clock: 119.000 MHz
  1920x1080@60Hz 16:9
Detailed mode: Clock 543.500 MHz, 797 mm x 334 mm
               3440 3488 3552 3600 hborder 0
               1440 1443 1453 1510 vborder 0
               -hsync +vsync 
               VertFreq: 99 Hz, HorFreq: 150972 Hz
Detailed mode: Clock 319.750 MHz, 797 mm x 334 mm
               3440 3488 3520 3600 hborder 0
               1440 1443 1453 1481 vborder 0
               +hsync -vsync 
               VertFreq: 59 Hz, HorFreq: 88819 Hz
Monitor ranges (bare limits): 48-165Hz V, 224-224kHz H, max dotclock 810MHz
Monitor name: ZQE-CBA
Has 2 extension blocks
Checksum: 0x2f (valid)

CTA extension block
Extension version: 3
56 bytes of CTA data
  Video data block
    VIC  31 1920x1080@50Hz 16:9  HorFreq: 56250 Hz Clock: 148.500 MHz
    VIC  16 1920x1080@60Hz 16:9 (native) HorFreq: 67500 Hz Clock: 148.500 MHz
    VIC  20 1920x1080i@50Hz 16:9  HorFreq: 28125 Hz Clock: 74.250 MHz
    VIC   1 640x480@60Hz 4:3  HorFreq: 31469 Hz Clock: 25.175 MHz
    VIC   3 720x480@60Hz 16:9  HorFreq: 31469 Hz Clock: 27.000 MHz
    VIC   4 1280x720@60Hz 16:9  HorFreq: 45000 Hz Clock: 74.250 MHz
    VIC  18 720x576@50Hz 16:9  HorFreq: 31250 Hz Clock: 27.000 MHz
    VIC  19 1280x720@50Hz 16:9  HorFreq: 37500 Hz Clock: 74.250 MHz
    VIC   5 1920x1080i@60Hz 16:9  HorFreq: 33750 Hz Clock: 74.250 MHz
    VIC   2 720x480@60Hz 4:3  HorFreq: 31469 Hz Clock: 27.000 MHz
    VIC  63 1920x1080@120Hz 16:9  HorFreq: 135000 Hz Clock: 297.000 MHz
  Speaker allocation data block
    Speaker map:
      FL/FR - Front Left/Right
  Extended tag: Video capability data block
    YCbCr quantization: Selectable (via AVI YQ) (1)
    RGB quantization: Selectable (via AVI Q) (1)
    PT scan behaviour: Always Overscannned (1)
    IT scan behaviour: Always Overscannned (1)
    CE scan behaviour: Always Overscannned (1)
  Vendor-specific data block, OUI 000c03 (HDMI)
    Source physical address 2.0.0.0
    DC_36bit
    DC_30bit
    DC_Y444
    Maximum TMDS clock: 600MHz
  Vendor-specific data block, OUI 00001a
  Extended tag: Colorimetry data block
    BT2020YCC
    BT2020RGB
    DCI-P3
  Extended tag: YCbCr 4:2:0 capability map data block
  Extended tag: HDR static metadata data block
    Electro optical transfer functions:
      Traditional gamma - SDR luminance range
      SMPTE ST2084
    Supported static metadata descriptors:
      Static metadata type 1
    Desired content max luminance: 102 (455.515 cd/m^2)
    Desired content max frame-average luminance: 102 (455.515 cd/m^2)
    Desired content min luminance: 28 (0.055 cd/m^2)
Underscans PC formats by default
Supports YCbCr 4:4:4
Supports YCbCr 4:2:2
1 native detailed modes
Detailed mode: Clock 241.500 MHz, 797 mm x 334 mm
               2560 2608 2640 2720 hborder 0
               1440 1443 1448 1481 vborder 0
               +hsync -vsync 
               VertFreq: 59 Hz, HorFreq: 88786 Hz
Detailed mode: Clock 527.500 MHz, 797 mm x 334 mm
               2580 2628 2660 2740 hborder 0
               1080 1083 1093 1169 vborder 0
               +hsync -vsync 
               VertFreq: 164 Hz, HorFreq: 192518 Hz
Detailed mode: Clock 178.870 MHz, 797 mm x 334 mm
               2580 2601 2633 2686 hborder 0
               1080 1097 1105 1111 vborder 0
               +hsync -vsync 
               VertFreq: 59 Hz, HorFreq: 66593 Hz
Checksum: 0x4f (valid)


DisplayID extension block
Extension version: 18
Length 121, version 18, extension count 0
Checksum: 0xcf (valid)
Type 1 detailed timing: aspect: 16:9,  
Detailed mode: Clock 658.790 MHz, 0 mm x 0 mm
               3439 3486 3517 3598
               1439 1509 1516 1523
               -hsync -vsync
Type 1 detailed timing: aspect: 16:9,  
Detailed mode: Clock 799.880 MHz, 0 mm x 0 mm
               3439 3486 3517 3598
               1439 1527 1534 1541
               -hsync -vsync
Type 1 detailed timing: aspect: undefined, Preferred  
Detailed mode: Clock 879.700 MHz, 0 mm x 0 mm
               3439 3486 3517 3598
               1439 1465 1472 1479
               -hsync -vsync

EDID block does NOT conform to EDID 1.4!
	HDMI VSDB Max TMDS rate is > 340
Warning: One or more of the timings is out of range of the Monitor Ranges:
  Vertical Freq: 50 - 164 Hz
  Horizontal Freq: 28125 - 192518 Hz
  Maximum Clock: 543.500 MHz


