edid-decode (hex):

00 ff ff ff ff ff ff 00 26 cf 4c 3d 00 00 00 00
00 1f 01 04 a5 23 13 78 03 35 10 91 57 59 92 29
1f 50 54 00 00 00 01 01 01 01 01 01 01 01 01 01
01 01 01 01 01 01 0e 83 80 a0 70 38 28 40 30 20
35 00 59 c2 10 00 00 19 00 00 00 fd 00 30 90 a1
a1 22 01 0a 20 20 20 20 20 20 00 00 00 fe 00 49
6e 66 6f 56 69 73 69 6f 6e 0a 20 20 00 00 00 fe
00 4d 31 35 36 4e 57 46 39 20 52 32 20 0a 00 5f

00 ff ff ff ff ff ff 00 26 cf 4c 3d 00 00 00 00
00 1f 01 04 a5 23 13 78 03 35 10 91 57 59 92 29
1f 50 54 00 00 00 01 01 01 01 01 01 01 01 01 01
01 01 01 01 01 01 0e 83 80 a0 70 38 28 40 30 20
35 00 59 c2 10 00 00 19 00 00 00 fd 00 30 90 a1
a1 22 01 0a 20 20 20 20 20 20 00 00 00 fe 00 49
6e 66 6f 56 69 73 69 6f 6e 0a 20 20 00 00 00 fe
00 4d 31 35 36 4e 57 46 39 20 52 32 20 0a 00 5f

----------------

Block 0, Base EDID:
  EDID Structure Version & Revision: 1.4
  Vendor & Product Identification:
    Manufacturer: IVO
    Model: 15692
    Made in: 2021
  Basic Display Parameters & Features:
    Digital display
    Bits per primary color channel: 8
    DisplayPort interface
    Maximum image size: 35 cm x 19 cm
    Gamma: 2.20
    Supported color formats: RGB 4:4:4
    First detailed timing includes the native pixel format and preferred refresh rate
    Display is continuous frequency
  Color Characteristics:
    Red  : 0.5664, 0.3427
    Green: 0.3486, 0.5712
    Blue : 0.1601, 0.1220
    White: 0.3125, 0.3281
  Established Timings I & II: none
  Standard Timings: none
  Detailed Timing Descriptors:
    DTD 1:  1920x1080  144.016140 Hz  16:9    161.298 kHz    335.500000 MHz (345 mm x 194 mm)
                 Hfront   48 Hsync  32 Hback   80 Hpol N
                 Vfront    3 Vsync   5 Vback   32 Vpol N
    Display Range Limits:
      Monitor ranges (Bare Limits): 48-144 Hz V, 161-161 kHz H, max dotclock 340 MHz
    Alphanumeric Data String: 'InfoVision'
    Alphanumeric Data String: 'M156NWF9 R2 '
Checksum: 0x5f

----------------

Block 1, Unknown EDID Extension Block 0x00:
  00 ff ff ff ff ff ff 00 26 cf 4c 3d 00 00 00 00 '........&.L=....'
  00 1f 01 04 a5 23 13 78 03 35 10 91 57 59 92 29 '.....#.x.5..WY.)'
  1f 50 54 00 00 00 01 01 01 01 01 01 01 01 01 01 '.PT.............'
  01 01 01 01 01 01 0e 83 80 a0 70 38 28 40 30 20 '..........p8(@0 '
  35 00 59 c2 10 00 00 19 00 00 00 fd 00 30 90 a1 '5.Y..........0..'
  a1 22 01 0a 20 20 20 20 20 20 00 00 00 fe 00 49 '."..      .....I'
  6e 66 6f 56 69 73 69 6f 6e 0a 20 20 00 00 00 fe 'nfoVision.  ....'
  00 4d 31 35 36 4e 57 46 39 20 52 32 20 0a 00 5f '.M156NWF9 R2 .._'
Checksum: 0x5f

----------------

Warnings:

Block 0, Base EDID:
  Missing Display Product Name.

Failures:

Block 0, Base EDID:
  Alphanumeric Data String: One or more trailing spaces.
Block 1, Base EDID:
  Unknown Extension Block.
EDID:
  Base EDID: EDID specified 0 extension block(s), but found 1 extension block(s).

EDID conformity: FAIL
