
EDID (hex):
00ffffffffffff00220e923301010101
2c1a010368301b782a3455a75552a027
115054a10800d1c081c0a9c0b3009500
810081800101023a801871382d40582c
4500dd0c1100001e000000fd00323c18
5011000a202020202020000000fc0048
5020503232330a2020202020000000ff
00434e4b363434314254420a202000e1

Extracted contents:
header:          00 ff ff ff ff ff ff 00
serial number:   22 0e 92 33 01 01 01 01 2c 1a
version:         01 03
basic params:    68 30 1b 78 2a
chroma info:     34 55 a7 55 52 a0 27 11 50 54
established:     a1 08 00
standard:        d1 c0 81 c0 a9 c0 b3 00 95 00 81 00 81 80 01 01
descriptor 1:    02 3a 80 18 71 38 2d 40 58 2c 45 00 dd 0c 11 00 00 1e
descriptor 2:    00 00 00 fd 00 32 3c 18 50 11 00 0a 20 20 20 20 20 20
descriptor 3:    00 00 00 fc 00 48 50 20 50 32 32 33 0a 20 20 20 20 20
descriptor 4:    00 00 00 ff 00 43 4e 4b 36 34 34 31 42 54 42 0a 20 20
extensions:      00
checksum:        e1

EDID version: 1.3
Manufacturer: HPN Model 3392 Serial Number --
Made in week 44 of 2016
Analog display, Input voltage level: 0.7/0.7 V
Sync: Separate 
Maximum image size: 48 cm x 27 cm
Gamma: 2.20
DPMS levels: Off
RGB color display
First detailed timing is preferred timing
Display x,y Chromaticity:
  Red:   0.6523, 0.3349
  Green: 0.3212, 0.6250
  Blue:  0.1533, 0.0673
  White: 0.3134, 0.3291
Established timings supported:
  720x400@70Hz 9:5 HorFreq: 31469 Hz Clock: 28.320 MHz
  640x480@60Hz 4:3 HorFreq: 31469 Hz Clock: 25.175 MHz
  800x600@60Hz 4:3 HorFreq: 37900 Hz Clock: 40.000 MHz
  1024x768@60Hz 4:3 HorFreq: 48400 Hz Clock: 65.000 MHz
Standard timings supported:
  1920x1080@60Hz 16:9
  1280x720@60Hz 16:9
  1600x900@60Hz 16:9
  1680x1050@60Hz 16:10 HorFreq: 64700 Hz Clock: 119.000 MHz
  1440x900@60Hz 16:10 HorFreq: 55500 Hz Clock: 88.750 MHz
  1280x800@60Hz 16:10
  1280x1024@60Hz 5:4 HorFreq: 64000 Hz Clock: 108.000 MHz
Detailed mode: Clock 148.500 MHz, 477 mm x 268 mm
               1920 2008 2052 2200 hborder 0
               1080 1084 1089 1125 vborder 0
               +hsync +vsync 
               VertFreq: 60 Hz, HorFreq: 67500 Hz
Monitor ranges (GTF): 50-60Hz V, 24-80kHz H, max dotclock 170MHz
Monitor name: HP P223
Serial number: --
Checksum: 0xe1 (valid)
One or more of the timings is out of range of the Monitor Ranges:
  Vertical Freq: 60 - 70 Hz
  Horizontal Freq: 31469 - 67500 Hz
  Maximum Clock: 148.500 MHz
