edid-decode (hex):

00 ff ff ff ff ff ff 00 38 a3 11 68 00 00 00 00
33 15 01 04 b5 40 28 78 e2 bf 85 ae 4e 33 b2 26
0f 50 54 bf ef 80 81 00 81 80 90 40 8b c0 95 00
a9 40 b3 00 d1 00 e2 68 00 a0 a0 40 2e 60 30 20
36 00 81 90 21 00 00 1a 00 00 00 fd 00 1e 57 1f
63 1b 00 0a 20 20 20 20 20 20 00 00 00 fc 00 50
41 33 30 31 57 0a 20 20 20 20 20 20 00 00 00 ff
00 31 5a 31 30 34 39 37 32 55 57 0a 20 20 00 27

00 ff ff ff ff ff ff 00 38 a3 11 68 00 00 00 00
33 15 01 04 b5 40 28 78 e2 bf 85 ae 4e 33 b2 26
0f 50 54 bf ef 80 81 00 81 80 90 40 8b c0 95 00
a9 40 b3 00 d1 00 e2 68 00 a0 a0 40 2e 60 30 20
36 00 81 90 21 00 00 1a 00 00 00 fd 00 1e 57 1f
63 1b 00 0a 20 20 20 20 20 20 00 00 00 fc 00 50
41 33 30 31 57 0a 20 20 20 20 20 20 00 00 00 ff
00 31 5a 31 30 34 39 37 32 55 57 0a 20 20 00 27

----------------

Block 0, Base EDID:
  EDID Structure Version & Revision: 1.4
  Vendor & Product Identification:
    Manufacturer: NEC
    Model: 26641
    Made in: week 51 of 2011
  Basic Display Parameters & Features:
    Digital display
    Bits per primary color channel: 10
    DisplayPort interface
    Maximum image size: 64 cm x 40 cm
    Gamma: 2.20
    DPMS levels: Standby Suspend Off
    Supported color formats: RGB 4:4:4
    First detailed timing includes the native pixel format and preferred refresh rate
  Color Characteristics:
    Red  : 0.6816, 0.3076
    Green: 0.2021, 0.6982
    Blue : 0.1503, 0.0585
    White: 0.3134, 0.3291
  Established Timings I & II:
    IBM     :   720x400    70.081663 Hz   9:5     31.467 kHz     28.320000 MHz
    DMT 0x04:   640x480    59.940476 Hz   4:3     31.469 kHz     25.175000 MHz
    Apple   :   640x480    66.666667 Hz   4:3     35.000 kHz     30.240000 MHz
    DMT 0x05:   640x480    72.808802 Hz   4:3     37.861 kHz     31.500000 MHz
    DMT 0x06:   640x480    75.000000 Hz   4:3     37.500 kHz     31.500000 MHz
    DMT 0x08:   800x600    56.250000 Hz   4:3     35.156 kHz     36.000000 MHz
    DMT 0x09:   800x600    60.316541 Hz   4:3     37.879 kHz     40.000000 MHz
    DMT 0x0a:   800x600    72.187572 Hz   4:3     48.077 kHz     50.000000 MHz
    DMT 0x0b:   800x600    75.000000 Hz   4:3     46.875 kHz     49.500000 MHz
    Apple   :   832x624    74.551266 Hz   4:3     49.726 kHz     57.284000 MHz
    DMT 0x10:  1024x768    60.003840 Hz   4:3     48.363 kHz     65.000000 MHz
    DMT 0x11:  1024x768    70.069359 Hz   4:3     56.476 kHz     75.000000 MHz
    DMT 0x12:  1024x768    75.028582 Hz   4:3     60.023 kHz     78.750000 MHz
    DMT 0x24:  1280x1024   75.024675 Hz   5:4     79.976 kHz    135.000000 MHz
    Apple   :  1152x870    75.061550 Hz 192:145   68.681 kHz    100.000000 MHz
  Standard Timings:
    DMT 0x1c:  1280x800    59.810326 Hz  16:10    49.702 kHz     83.500000 MHz
    DMT 0x23:  1280x1024   60.019740 Hz   5:4     63.981 kHz    108.000000 MHz
    DMT 0x2a:  1400x1050   59.978442 Hz   4:3     65.317 kHz    121.750000 MHz
    GTF     :  1360x765    60.000341 Hz  16:9     47.520 kHz     84.396000 MHz
    DMT 0x2f:  1440x900    59.887445 Hz  16:10    55.935 kHz    106.500000 MHz
    DMT 0x33:  1600x1200   60.000000 Hz   4:3     75.000 kHz    162.000000 MHz
    DMT 0x3a:  1680x1050   59.954250 Hz  16:10    65.290 kHz    146.250000 MHz
    DMT 0x45:  1920x1200   59.884600 Hz  16:10    74.556 kHz    193.250000 MHz
  Detailed Timing Descriptors:
    DTD 1:  2560x1600   59.971589 Hz  16:10    98.713 kHz    268.500000 MHz (641 mm x 400 mm)
                 Hfront   48 Hsync  32 Hback   80 Hpol P
                 Vfront    3 Vsync   6 Vback   37 Vpol N
    Display Range Limits:
      Monitor ranges (GTF): 30-87 Hz V, 31-99 kHz H, max dotclock 270 MHz
    Display Product Name: 'PA301W'
    Display Product Serial Number: ...
Checksum: 0x27

----------------

Block 1, Unknown EDID Extension Block 0x00:
  00 ff ff ff ff ff ff 00 38 a3 11 68 00 00 00 00 '........8..h....'
  33 15 01 04 b5 40 28 78 e2 bf 85 ae 4e 33 b2 26 '3....@(x....N3.&'
  0f 50 54 bf ef 80 81 00 81 80 90 40 8b c0 95 00 '.PT........@....'
  a9 40 b3 00 d1 00 e2 68 00 a0 a0 40 2e 60 30 20 '.@.....h...@.`0 '
  36 00 81 90 21 00 00 1a 00 00 00 fd 00 1e 57 1f '6...!.........W.'
  63 1b 00 0a 20 20 20 20 20 20 00 00 00 fc 00 50 'c...      .....P'
  41 33 30 31 57 0a 20 20 20 20 20 20 00 00 00 ff 'A301W.      ....'
  00 31 5a 31 30 34 39 37 32 55 57 0a 20 20 00 27 '.1Z104972UW.  .''
Checksum: 0x27

----------------

Warnings:

Block 0, Base EDID:
  Standard Timings: Standard Timing 1360x765 has a dubious odd vertical resolution.
  Display Range Limits: GTF support is deprecated in EDID 1.4.

Failures:

Block 0, Base EDID:
  Display Range Limits: GTF can't be combined with non-continuous frequencies.
Block 1, Base EDID:
  Unknown Extension Block.
EDID:
  Base EDID: EDID specified 0 extension block(s), but found 1 extension block(s).

EDID conformity: FAIL
