
EDID (hex):
00ffffffffffff005c23311031343530
2c1c010381301b78ea7ca5a3544ea027
12505421080081008180b30001010101
010101010101023a801871382d40582c
4500dc0c1100001e000000fd00324b1e
500f000a202020202020000000ff0038
4a41433030303534310a2020000000fc
0043696e74697120323248440a200015

Extracted contents:
header:          00 ff ff ff ff ff ff 00
serial number:   5c 23 31 10 31 34 35 30 2c 1c
version:         01 03
basic params:    81 30 1b 78 ea
chroma info:     7c a5 a3 54 4e a0 27 12 50 54
established:     21 08 00
standard:        81 00 81 80 b3 00 01 01 01 01 01 01 01 01 01 01
descriptor 1:    02 3a 80 18 71 38 2d 40 58 2c 45 00 dc 0c 11 00 00 1e
descriptor 2:    00 00 00 fd 00 32 4b 1e 50 0f 00 0a 20 20 20 20 20 20
descriptor 3:    00 00 00 ff 00 38 4a 41 43 30 30 30 35 34 31 0a 20 20
descriptor 4:    00 00 00 fc 00 43 69 6e 74 69 71 20 32 32 48 44 0a 20
extensions:      00
checksum:        15

EDID version: 1.3
Manufacturer: WAC Model 1031 Serial Number --
Made in week 44 of 2018
Digital display
DFP 1.x compatible TMDS
Maximum image size: 48 cm x 27 cm
Gamma: 2.20
DPMS levels: Standby Suspend Off
RGB color display
First detailed timing is preferred timing
Display x,y Chromaticity:
  Red:   0.6376, 0.3310
  Green: 0.3076, 0.6250
  Blue:  0.1542, 0.0722
  White: 0.3134, 0.3291
Established timings supported:
  640x480@60Hz 4:3 HorFreq: 31469 Hz Clock: 25.175 MHz
  800x600@60Hz 4:3 HorFreq: 37900 Hz Clock: 40.000 MHz
  1024x768@60Hz 4:3 HorFreq: 48400 Hz Clock: 65.000 MHz
Standard timings supported:
  1280x800@60Hz 16:10
  1280x1024@60Hz 5:4 HorFreq: 64000 Hz Clock: 108.000 MHz
  1680x1050@60Hz 16:10 HorFreq: 64700 Hz Clock: 119.000 MHz
Detailed mode: Clock 148.500 MHz, 476 mm x 268 mm
               1920 2008 2052 2200 hborder 0
               1080 1084 1089 1125 vborder 0
               +hsync +vsync 
               VertFreq: 60 Hz, HorFreq: 67500 Hz
Monitor ranges (GTF): 50-75Hz V, 30-80kHz H, max dotclock 150MHz
Serial number: --
Monitor name: Cintiq 22HD
Checksum: 0x15 (valid)


