edid-decode (hex):

00 ff ff ff ff ff ff 00 4d 10 92 14 00 00 00 00
28 1b 01 04 a5 1a 11 78 06 07 30 a4 54 4c 9a 26
0e 50 54 00 00 00 01 01 01 01 01 01 01 01 01 01
01 01 01 01 01 01 29 40 80 a0 70 00 25 50 30 20
3a 00 03 ad 10 00 00 18 00 00 00 10 00 00 00 00
00 00 00 00 00 00 00 00 00 00 00 00 00 10 00 00
00 00 00 00 00 00 00 00 00 00 00 00 00 00 00 fc
00 4c 51 31 32 33 4e 31 4a 57 33 32 0a 20 00 a2

00 ff ff ff ff ff ff 00 4d 10 92 14 00 00 00 00
28 1b 01 04 a5 1a 11 78 06 07 30 a4 54 4c 9a 26
0e 50 54 00 00 00 01 01 01 01 01 01 01 01 01 01
01 01 01 01 01 01 29 40 80 a0 70 00 25 50 30 20
3a 00 03 ad 10 00 00 18 00 00 00 10 00 00 00 00
00 00 00 00 00 00 00 00 00 00 00 00 00 10 00 00
00 00 00 00 00 00 00 00 00 00 00 00 00 00 00 fc
00 4c 51 31 32 33 4e 31 4a 57 33 32 0a 20 00 a2

----------------

Block 0, Base EDID:
  EDID Structure Version & Revision: 1.4
  Vendor & Product Identification:
    Manufacturer: SHP
    Model: 5266
    Made in: week 40 of 2017
  Basic Display Parameters & Features:
    Digital display
    Bits per primary color channel: 8
    DisplayPort interface
    Maximum image size: 26 cm x 17 cm
    Gamma: 2.20
    Supported color formats: RGB 4:4:4
    Default (sRGB) color space is primary color space
    First detailed timing includes the native pixel format and preferred refresh rate
  Color Characteristics:
    Red  : 0.6406, 0.3281
    Green: 0.2978, 0.6044
    Blue : 0.1484, 0.0576
    White: 0.3125, 0.3281
  Established Timings I & II: none
  Standard Timings: none
  Detailed Timing Descriptors:
    DTD 1:  1920x1280   59.959261 Hz   3:2     78.966 kHz    164.250000 MHz (259 mm x 173 mm)
                 Hfront   48 Hsync  32 Hback   80 Hpol N
                 Vfront    3 Vsync  10 Vback   24 Vpol N
    Dummy Descriptor:
    Dummy Descriptor:
    Display Product Name: 'LQ123N1JW32'
Checksum: 0xa2

----------------

Block 1, Unknown EDID Extension Block 0x00:
  00 ff ff ff ff ff ff 00 4d 10 92 14 00 00 00 00 '........M.......'
  28 1b 01 04 a5 1a 11 78 06 07 30 a4 54 4c 9a 26 '(......x..0.TL.&'
  0e 50 54 00 00 00 01 01 01 01 01 01 01 01 01 01 '.PT.............'
  01 01 01 01 01 01 29 40 80 a0 70 00 25 50 30 20 '......)@..p.%P0 '
  3a 00 03 ad 10 00 00 18 00 00 00 10 00 00 00 00 ':...............'
  00 00 00 00 00 00 00 00 00 00 00 00 00 10 00 00 '................'
  00 00 00 00 00 00 00 00 00 00 00 00 00 00 00 fc '................'
  00 4c 51 31 32 33 4e 31 4a 57 33 32 0a 20 00 a2 '.LQ123N1JW32. ..'
Checksum: 0xa2

----------------

Failures:

Block 0, Base EDID:
  Basic Display Parameters & Features: sRGB is signaled, but the chromaticities do not match.
Block 1, Base EDID:
  Unknown Extension Block.
EDID:
  Base EDID: EDID specified 0 extension block(s), but found 1 extension block(s).

EDID conformity: FAIL
