edid-decode (hex):

00 ff ff ff ff ff ff 00 06 af d2 20 00 00 00 00
01 12 01 03 80 16 0d 78 0a 2b 69 97 57 55 96 29
21 4f 54 00 00 00 01 01 01 01 01 01 01 01 01 01
01 01 01 01 01 01 b0 13 00 40 41 58 19 20 18 88
31 00 df 7d 00 00 00 18 00 00 00 0f 00 00 00 00
00 00 00 00 00 00 00 00 00 20 00 00 00 fe 00 41
55 4f 0a 20 20 20 20 20 20 20 20 20 00 00 00 fe
00 42 31 30 31 41 57 30 32 20 56 30 20 0a 00 c7

----------------

Block 0, Base EDID:
  EDID Structure Version & Revision: 1.3
  Vendor & Product Identification:
    Manufacturer: AUO
    Model: 8402
    Made in: week 1 of 2008
  Basic Display Parameters & Features:
    Digital display
    Maximum image size: 22 cm x 13 cm
    Gamma: 2.20
    RGB color display
    First detailed timing is the preferred timing
  Color Characteristics:
    Red  : 0.5898, 0.3417
    Green: 0.3339, 0.5888
    Blue : 0.1611, 0.1308
    White: 0.3105, 0.3291
  Established Timings I & II: none
  Standard Timings: none
  Detailed Timing Descriptors:
    DTD 1:  1024x600    60.000000 Hz 128:75    37.500 kHz     50.400000 MHz (223 mm x 125 mm)
                 Hfront   24 Hsync 136 Hback  160 Hpol N
                 Vfront    3 Vsync   1 Vback   21 Vpol N
    Manufacturer-Specified Display Descriptor (0x0f): 00 0f 00 00 00 00 00 00 00 00 00 00 00 00 00 20 '............... '
    Alphanumeric Data String: 'AUO'
    Alphanumeric Data String: 'B101AW02 V0 '
Checksum: 0xc7

----------------

Failures:

Block 0, Base EDID:
  Alphanumeric Data String: One or more trailing spaces.
  Missing Display Product Name.
  Missing Display Range Limits Descriptor.

EDID conformity: FAIL
