edid-decode (hex):

00 ff ff ff ff ff ff 00 30 e4 38 06 00 00 00 00
00 1d 01 04 a5 1d 11 78 07 08 b5 a0 57 4e 9b 26
0c 50 54 00 00 00 01 01 01 01 01 01 01 01 01 01
01 01 01 01 01 01 2e 36 80 a0 70 38 1f 40 30 20
35 00 26 a5 10 00 00 19 1f 24 80 a0 70 38 1f 40
30 20 35 00 26 a5 10 00 00 19 00 00 00 00 00 00
00 00 00 00 00 00 00 00 00 00 00 00 00 00 00 02
00 07 26 ff 0a 3c c8 0b 12 14 c8 00 00 00 00 a1

00 ff ff ff ff ff ff 00 30 e4 38 06 00 00 00 00
00 1d 01 04 a5 1d 11 78 07 08 b5 a0 57 4e 9b 26
0c 50 54 00 00 00 01 01 01 01 01 01 01 01 01 01
01 01 01 01 01 01 2e 36 80 a0 70 38 1f 40 30 20
35 00 26 a5 10 00 00 19 1f 24 80 a0 70 38 1f 40
30 20 35 00 26 a5 10 00 00 19 00 00 00 00 00 00
00 00 00 00 00 00 00 00 00 00 00 00 00 00 00 02
00 07 26 ff 0a 3c c8 0b 12 14 c8 00 00 00 00 a1

----------------

Block 0, Base EDID:
  EDID Structure Version & Revision: 1.4
  Vendor & Product Identification:
    Manufacturer: LGD
    Model: 1592
    Made in: 2019
  Basic Display Parameters & Features:
    Digital display
    Bits per primary color channel: 8
    DisplayPort interface
    Maximum image size: 29 cm x 17 cm
    Gamma: 2.20
    Supported color formats: RGB 4:4:4
    Default (sRGB) color space is primary color space
    First detailed timing includes the native pixel format and preferred refresh rate
    Display is continuous frequency
  Color Characteristics:
    Red  : 0.6250, 0.3398
    Green: 0.3066, 0.6054
    Blue : 0.1503, 0.0498
    White: 0.3134, 0.3291
  Established Timings I & II: none
  Standard Timings: none
  Detailed Timing Descriptors:
    DTD 1:  1920x1080   60.020425 Hz  16:9     66.683 kHz    138.700000 MHz (294 mm x 165 mm)
                 Hfront   48 Hsync  32 Hback   80 Hpol N
                 Vfront    3 Vsync   5 Vback   23 Vpol N
    DTD 2:  1920x1080   40.015059 Hz  16:9     44.457 kHz     92.470000 MHz (294 mm x 165 mm)
                 Hfront   48 Hsync  32 Hback   80 Hpol N
                 Vfront    3 Vsync   5 Vback   23 Vpol N
    Empty Descriptor
    Manufacturer-Specified Display Descriptor (0x02): 00 02 00 07 26 ff 0a 3c c8 0b 12 14 c8 00 00 00 '....&..<........'
Checksum: 0xa1

----------------

Block 1, Unknown EDID Extension Block 0x00:
  00 ff ff ff ff ff ff 00 30 e4 38 06 00 00 00 00 '........0.8.....'
  00 1d 01 04 a5 1d 11 78 07 08 b5 a0 57 4e 9b 26 '.......x....WN.&'
  0c 50 54 00 00 00 01 01 01 01 01 01 01 01 01 01 '.PT.............'
  01 01 01 01 01 01 2e 36 80 a0 70 38 1f 40 30 20 '.......6..p8.@0 '
  35 00 26 a5 10 00 00 19 1f 24 80 a0 70 38 1f 40 '5.&......$..p8.@'
  30 20 35 00 26 a5 10 00 00 19 00 00 00 00 00 00 '0 5.&...........'
  00 00 00 00 00 00 00 00 00 00 00 00 00 00 00 02 '................'
  00 07 26 ff 0a 3c c8 0b 12 14 c8 00 00 00 00 a1 '..&..<..........'
Checksum: 0xa1

----------------

Warnings:

Block 0, Base EDID:
  Missing Display Product Name.

Failures:

Block 0, Base EDID:
  Basic Display Parameters & Features: sRGB is signaled, but the chromaticities do not match.
  Empty Descriptor: Use Dummy Descriptor instead of all zeroes.
  Missing Display Range Limits Descriptor.
Block 1, Base EDID:
  Unknown Extension Block.
EDID:
  Base EDID: EDID specified 0 extension block(s), but found 1 extension block(s).

EDID conformity: FAIL
