
EDID (hex):
00ffffffffffff005a631e0f01010101
23100103a0221b78bada65a556489924
155054bfef8081808140714f61594559
315901010101302a009851002a403070
1300520e1100001e000000ff00513835
3036333532353236300a000000fd0032
551e520e000a202020202020000000fc
005641373033205345524945530a01d2
02031b6223097f078301000067030c00
2000802d43011084e2000f0000360040
e86300001a1a1d008051d01c20408035
0040846300001c000000000000000000
00005500000000000000000000000000
00000000000000000000000000000000
00000000000000000000000000000000
000000000000000000000000000000c0

Extracted contents:
header:          00 ff ff ff ff ff ff 00
serial number:   5a 63 1e 0f 01 01 01 01 23 10
version:         01 03
basic params:    a0 22 1b 78 ba
chroma info:     da 65 a5 56 48 99 24 15 50 54
established:     bf ef 80
standard:        81 80 81 40 71 4f 61 59 45 59 31 59 01 01 01 01
descriptor 1:    30 2a 00 98 51 00 2a 40 30 70 13 00 52 0e 11 00 00 1e
descriptor 2:    00 00 00 ff 00 51 38 35 30 36 33 35 32 35 32 36 30 0a
descriptor 3:    00 00 00 fd 00 32 55 1e 52 0e 00 0a 20 20 20 20 20 20
descriptor 4:    00 00 00 fc 00 56 41 37 30 33 20 53 45 52 49 45 53 0a
extensions:      01
checksum:        d2

EDID version: 1.3
Manufacturer: VSC Model f1e Serial Number --
Made in week 35 of 2006
Digital display
Maximum image size: 34 cm x 27 cm
Gamma: 2.20
DPMS levels: Standby Off
Undefined display color type
First detailed timing is preferred timing
Display x,y Chromaticity:
  Red:   0.6474, 0.3369
  Green: 0.2832, 0.5996
  Blue:  0.1416, 0.0839
  White: 0.3134, 0.3291
Established timings supported:
  720x400@70Hz 9:5 HorFreq: 31469 Hz Clock: 28.320 MHz
  640x480@60Hz 4:3 HorFreq: 31469 Hz Clock: 25.175 MHz
  640x480@67Hz 4:3 HorFreq: 35000 Hz Clock: 30.240 MHz
  640x480@72Hz 4:3 HorFreq: 37900 Hz Clock: 31.500 MHz
  640x480@75Hz 4:3 HorFreq: 37500 Hz Clock: 31.500 MHz
  800x600@56Hz 4:3 HorFreq: 35200 Hz Clock: 36.000 MHz
  800x600@60Hz 4:3 HorFreq: 37900 Hz Clock: 40.000 MHz
  800x600@72Hz 4:3 HorFreq: 48100 Hz Clock: 50.000 MHz
  800x600@75Hz 4:3 HorFreq: 46900 Hz Clock: 49.500 MHz
  832x624@75Hz 4:3 HorFreq: 49726 Hz Clock: 57.284 MHz
  1024x768@60Hz 4:3 HorFreq: 48400 Hz Clock: 65.000 MHz
  1024x768@70Hz 4:3 HorFreq: 56500 Hz Clock: 75.000 MHz
  1024x768@75Hz 4:3 HorFreq: 60000 Hz Clock: 78.750 MHz
  1280x1024@75Hz 5:4 HorFreq: 80000 Hz Clock: 135.000 MHz
  1152x870@75Hz 192:145 HorFreq: 67500 Hz Clock: 108.000 MHz
Standard timings supported:
  1280x1024@60Hz 5:4 HorFreq: 64000 Hz Clock: 108.000 MHz
  1280x960@60Hz 4:3 HorFreq: 60000 Hz Clock: 108.000 MHz
  1152x864@75Hz 4:3 HorFreq: 67500 Hz Clock: 108.000 MHz
  1024x768@85Hz 4:3 HorFreq: 68700 Hz Clock: 94.500 MHz
  800x600@85Hz 4:3 HorFreq: 53700 Hz Clock: 56.250 MHz
  640x480@85Hz 4:3 HorFreq: 43300 Hz Clock: 36.000 MHz
Detailed mode: Clock 108.000 MHz, 338 mm x 270 mm
               1280 1328 1440 1688 hborder 0
               1024 1025 1028 1066 vborder 0
               +hsync +vsync 
               VertFreq: 60 Hz, HorFreq: 63981 Hz
Serial number: --
Monitor ranges (GTF): 50-85Hz V, 30-82kHz H, max dotclock 140MHz
Monitor name: VA703 SERIES
Has 1 extension blocks
Checksum: 0xd2 (valid)

CTA extension block
Extension version: 3
23 bytes of CTA data
  Audio data block
    Linear PCM, max channels 2
      Supported sample rates (kHz): 192 176.4 96 88.2 48 44.1 32
      Supported sample sizes (bits): 24 20 16
  Speaker allocation data block
    Speaker map:
      FL/FR - Front Left/Right
  Vendor-specific data block, OUI 000c03 (HDMI)
    Source physical address 2.0.0.0
    Supports_AI
    Maximum TMDS clock: 225MHz
  Video data block
    VIC   1 640x480@60Hz 4:3  HorFreq: 31469 Hz Clock: 25.175 MHz
    VIC  16 1920x1080@60Hz 16:9  HorFreq: 67500 Hz Clock: 148.500 MHz
    VIC   4 1280x720@60Hz 16:9 (native) HorFreq: 45000 Hz Clock: 74.250 MHz
  Extended tag: Video capability data block
    YCbCr quantization: No Data (0)
    RGB quantization: No Data (0)
    PT scan behaviour: No Data (0)
    IT scan behaviour: Support both over- and underscan (3)
    CE scan behaviour: Support both over- and underscan (3)
Basic audio support
Supports YCbCr 4:4:4
2 native detailed modes
Detailed mode: Clock 328.320 MHz, 0 mm x 0 mm
               1077 1077 1105 1077 hborder 0
                132  132  132  231 vborder 0
               -hsync -vsync analog composite 
               VertFreq: 1319 Hz, HorFreq: 304846 Hz
Checksum: 0xc0 (valid)

EDID block does NOT conform to EDID 1.3!
	Digital display field contains garbage: 20
One or more of the timings is out of range of the Monitor Ranges:
  Vertical Freq: 56 - 1319 Hz
  Horizontal Freq: 31469 - 304846 Hz
  Maximum Clock: 328.320 MHz
EDID block does not conform at all!
	Both the serial number and the serial string are set
