edid-decode (hex):

00 ff ff ff ff ff ff 00 04 72 64 ad 04 a8 41 80
04 12 01 03 80 2b 1b 78 ea cf c5 a3 5a 49 a0 25
12 50 54 bf ef 90 a9 40 71 4f 81 40 8b c0 95 00
95 0f 90 40 01 01 21 39 90 30 62 1a 27 40 68 b0
36 00 b1 0f 11 00 00 19 00 00 00 fd 00 38 4d 1f
54 11 00 0a 20 20 20 20 20 20 00 00 00 ff 00 4c
36 34 30 43 30 39 34 34 30 35 34 0a 00 00 00 fc
00 41 4c 32 30 31 36 57 0a 20 20 20 20 20 00 89

----------------

Block 0, Base EDID:
  EDID Structure Version & Revision: 1.3
  Vendor & Product Identification:
    Manufacturer: ACR
    Model: 44388
    Serial Number: ...
    Made in: week 4 of 2008
  Basic Display Parameters & Features:
    Digital display
    Maximum image size: 43 cm x 27 cm
    Gamma: 2.20
    DPMS levels: Standby Suspend Off
    RGB color display
    First detailed timing is preferred timing
  Color Characteristics:
    Red  : 0.6396, 0.3515
    Green: 0.2880, 0.6279
    Blue : 0.1474, 0.0703
    White: 0.3134, 0.3291
  Established Timings I & II:
    IBM     :   720x400    70.082 Hz   9:5    31.467 kHz  28.320 MHz
    DMT 0x04:   640x480    59.940 Hz   4:3    31.469 kHz  25.175 MHz
    Apple   :   640x480    66.667 Hz   4:3    35.000 kHz  30.240 MHz
    DMT 0x05:   640x480    72.809 Hz   4:3    37.861 kHz  31.500 MHz
    DMT 0x06:   640x480    75.000 Hz   4:3    37.500 kHz  31.500 MHz
    DMT 0x08:   800x600    56.250 Hz   4:3    35.156 kHz  36.000 MHz
    DMT 0x09:   800x600    60.317 Hz   4:3    37.879 kHz  40.000 MHz
    DMT 0x0a:   800x600    72.188 Hz   4:3    48.077 kHz  50.000 MHz
    DMT 0x0b:   800x600    75.000 Hz   4:3    46.875 kHz  49.500 MHz
    Apple   :   832x624    74.551 Hz   4:3    49.726 kHz  57.284 MHz
    DMT 0x10:  1024x768    60.004 Hz   4:3    48.363 kHz  65.000 MHz
    DMT 0x11:  1024x768    70.069 Hz   4:3    56.476 kHz  75.000 MHz
    DMT 0x12:  1024x768    75.029 Hz   4:3    60.023 kHz  78.750 MHz
    DMT 0x24:  1280x1024   75.025 Hz   5:4    79.976 kHz 135.000 MHz
    Apple   :  1152x870    75.062 Hz 192:145  68.681 kHz 100.000 MHz
  Standard Timings:
    DMT 0x33:  1600x1200   60.000 Hz   4:3    75.000 kHz 162.000 MHz
    DMT 0x15:  1152x864    75.000 Hz   4:3    67.500 kHz 108.000 MHz
    DMT 0x20:  1280x960    60.000 Hz   4:3    60.000 kHz 108.000 MHz
    GTF     :  1360x768    60.000 Hz  16:9    47.700 kHz  84.715 MHz
    DMT 0x2f:  1440x900    59.887 Hz  16:10   55.935 kHz 106.500 MHz
    DMT 0x30:  1440x900    74.984 Hz  16:10   70.635 kHz 136.750 MHz
    DMT 0x2a:  1400x1050   59.978 Hz   4:3    65.317 kHz 121.750 MHz
  Detailed Timing Descriptors:
    DTD 1:  1680x1050   59.954 Hz   8:5    65.290 kHz 146.250 MHz (433 mm x 271 mm)
                 Hfront  104 Hsync 176 Hback 280 Hpol N
                 Vfront    3 Vsync   6 Vback  30 Vpol N
  Display Range Limits:
    Monitor ranges (GTF): 56-77 Hz V, 31-84 kHz H, max dotclock 170 MHz
    Display Product Serial Number: ...
    Display Product Name: 'AL2016W'
Checksum: 0x89
