edid-decode (hex):

00 ff ff ff ff ff ff 00 4a 84 3a 38 01 01 01 01
19 20 01 04 b5 43 1c 78 fb 11 05 a5 57 4f ad 2a
0a 50 54 24 4b 00 b3 00 d1 c0 a9 c0 95 00 90 40
81 80 81 40 81 c0 b4 46 00 a0 a0 38 1f 40 12 20
28 00 a1 1c 21 00 00 1e 00 00 00 ff 00 57 36 57
32 30 30 31 30 30 30 30 31 0a 00 00 00 fd 00 30
4b 71 71 17 01 0a 20 20 20 20 20 20 00 00 00 fc
00 44 50 0a 20 20 20 20 20 20 20 20 20 20 01 b4

02 03 12 f1 41 90 23 09 7f 07 83 01 00 00 e3 05
ff 01 88 58 00 a0 a0 38 1f 40 12 20 28 00 a1 1c
21 00 00 1e 01 1d 80 18 71 1c 16 20 58 2c 25 00
a1 1c 21 00 00 9e 02 3a 80 d0 72 38 2d 40 10 2c
45 80 a1 1c 21 00 00 1e 01 1d 00 72 51 d0 1e 20
6e 28 55 00 a1 1c 21 00 00 1e 00 00 00 00 00 00
00 00 00 00 00 00 00 00 00 00 00 00 00 00 00 00
00 00 00 00 00 00 00 00 00 00 00 00 00 00 00 e8

00 ff ff ff ff ff ff 00 4a 84 3a 38 01 01 01 01
19 20 01 04 b5 43 1c 78 fb 11 05 a5 57 4f ad 2a
0a 50 54 24 4b 00 b3 00 d1 c0 a9 c0 95 00 90 40
81 80 81 40 81 c0 b4 46 00 a0 a0 38 1f 40 12 20
28 00 a1 1c 21 00 00 1e 00 00 00 ff 00 57 36 57
32 30 30 31 30 30 30 30 31 0a 00 00 00 fd 00 30
4b 71 71 17 01 0a 20 20 20 20 20 20 00 00 00 fc
00 44 50 0a 20 20 20 20 20 20 20 20 20 20 01 b4

02 03 12 f1 41 90 23 09 7f 07 83 01 00 00 e3 05
ff 01 88 58 00 a0 a0 38 1f 40 12 20 28 00 a1 1c
21 00 00 1e 01 1d 80 18 71 1c 16 20 58 2c 25 00
a1 1c 21 00 00 9e 02 3a 80 d0 72 38 2d 40 10 2c
45 80 a1 1c 21 00 00 1e 01 1d 00 72 51 d0 1e 20
6e 28 55 00 a1 1c 21 00 00 1e 00 00 00 00 00 00
00 00 00 00 00 00 00 00 00 00 00 00 00 00 00 00
00 00 00 00 00 00 00 00 00 00 00 00 00 00 00 e8

----------------

Block 0, Base EDID:
  EDID Structure Version & Revision: 1.4
  Vendor & Product Identification:
    Manufacturer: RTD
    Model: 14394
    Serial Number: ...
    Made in: week 25 of 2022
  Basic Display Parameters & Features:
    Digital display
    Bits per primary color channel: 10
    DisplayPort interface
    Maximum image size: 67 cm x 28 cm
    Gamma: 2.20
    DPMS levels: Standby Suspend Off
    Supported color formats: RGB 4:4:4, YCrCb 4:4:4, YCrCb 4:2:2
    First detailed timing includes the native pixel format and preferred refresh rate
    Display is continuous frequency
  Color Characteristics:
    Red  : 0.6445, 0.3408
    Green: 0.3085, 0.6767
    Blue : 0.1640, 0.0390
    White: 0.3134, 0.3291
  Established Timings I & II:
    DMT 0x04:   640x480    59.940476 Hz   4:3     31.469 kHz     25.175000 MHz
    DMT 0x06:   640x480    75.000000 Hz   4:3     37.500 kHz     31.500000 MHz
    DMT 0x0b:   800x600    75.000000 Hz   4:3     46.875 kHz     49.500000 MHz
    DMT 0x10:  1024x768    60.003840 Hz   4:3     48.363 kHz     65.000000 MHz
    DMT 0x12:  1024x768    75.028582 Hz   4:3     60.023 kHz     78.750000 MHz
    DMT 0x24:  1280x1024   75.024675 Hz   5:4     79.976 kHz    135.000000 MHz
  Standard Timings:
    DMT 0x3a:  1680x1050   59.954250 Hz  16:10    65.290 kHz    146.250000 MHz
    DMT 0x52:  1920x1080   60.000000 Hz  16:9     67.500 kHz    148.500000 MHz
    DMT 0x53:  1600x900    60.000000 Hz  16:9     60.000 kHz    108.000000 MHz (RB)
    DMT 0x2f:  1440x900    59.887445 Hz  16:10    55.935 kHz    106.500000 MHz
    DMT 0x2a:  1400x1050   59.978442 Hz   4:3     65.317 kHz    121.750000 MHz
    DMT 0x23:  1280x1024   60.019740 Hz   5:4     63.981 kHz    108.000000 MHz
    DMT 0x20:  1280x960    60.000000 Hz   4:3     60.000 kHz    108.000000 MHz
    DMT 0x55:  1280x720    60.000000 Hz  16:9     45.000 kHz     74.250000 MHz
  Detailed Timing Descriptors:
    DTD 1:  2560x1080   59.895695 Hz  64:27    66.544 kHz    181.000000 MHz (673 mm x 284 mm)
                 Hfront   18 Hsync  32 Hback  110 Hpol P
                 Vfront    2 Vsync   8 Vback   21 Vpol P
    Display Product Serial Number: ...
    Display Range Limits:
      Monitor ranges (Bare Limits): 48-75 Hz V, 113-113 kHz H, max dotclock 230 MHz
    Display Product Name: 'DP'
  Extension blocks: 1
Checksum: 0xb4

----------------

Block 1, CTA-861 Extension Block:
  Revision: 3
  Underscans IT Video Formats by default
  Basic audio support
  Supports YCbCr 4:4:4
  Supports YCbCr 4:2:2
  Native detailed modes: 1
  Video Data Block:
    VIC  16:  1920x1080   60.000000 Hz  16:9     67.500 kHz    148.500000 MHz (native)
  Audio Data Block:
    Linear PCM:
      Max channels: 2
      Supported sample rates (kHz): 192 176.4 96 88.2 48 44.1 32
      Supported sample sizes (bits): 24 20 16
  Speaker Allocation Data Block:
    FL/FR - Front Left/Right
  Colorimetry Data Block:
    xvYCC601
    xvYCC709
    sYCC601
    opYCC601
    opRGB
    BT2020cYCC
    BT2020YCC
    BT2020RGB
    Gamut Boundary Description Metadata Profile P0
  Detailed Timing Descriptors:
    DTD 2:  2560x1080   74.998676 Hz  64:27    83.324 kHz    226.640000 MHz (673 mm x 284 mm)
                 Hfront   18 Hsync  32 Hback  110 Hpol P
                 Vfront    2 Vsync   8 Vback   21 Vpol P
    DTD 3:  1920x1080i  60.000000 Hz  16:9     33.750 kHz     74.250000 MHz (673 mm x 284 mm)
                 Hfront   88 Hsync  44 Hback  148 Hpol P
                 Vfront    2 Vsync   5 Vback   15 Vpol P Vfront +0.5 Odd Field
                 Vfront    2 Vsync   5 Vback   15 Vpol P Vback  +0.5 Even Field
    DTD 4:  1920x1080   50.000000 Hz  16:9     56.250 kHz    148.500000 MHz (673 mm x 284 mm)
                 Hfront  528 Hsync  44 Hback  148 Hpol P
                 Vfront    4 Vsync   5 Vback   36 Vpol P
    DTD 5:  1280x720    60.000000 Hz  16:9     45.000 kHz     74.250000 MHz (673 mm x 284 mm)
                 Hfront  110 Hsync  40 Hback  220 Hpol P
                 Vfront    5 Vsync   5 Vback   20 Vpol P
Checksum: 0xe8  Unused space in Extension Block: 37 bytes

----------------

Block 2, Unknown EDID Extension Block 0x00:
  00 ff ff ff ff ff ff 00 4a 84 3a 38 01 01 01 01 '........J.:8....'
  19 20 01 04 b5 43 1c 78 fb 11 05 a5 57 4f ad 2a '. ...C.x....WO.*'
  0a 50 54 24 4b 00 b3 00 d1 c0 a9 c0 95 00 90 40 '.PT$K..........@'
  81 80 81 40 81 c0 b4 46 00 a0 a0 38 1f 40 12 20 '...@...F...8.@. '
  28 00 a1 1c 21 00 00 1e 00 00 00 ff 00 57 36 57 '(...!........W6W'
  32 30 30 31 30 30 30 30 31 0a 00 00 00 fd 00 30 '200100001......0'
  4b 71 71 17 01 0a 20 20 20 20 20 20 00 00 00 fc 'Kqq...      ....'
  00 44 50 0a 20 20 20 20 20 20 20 20 20 20 01 b4 '.DP.          ..'
Checksum: 0xb4

----------------

Block 3, CTA-861 Extension Block:
  Revision: 3
  Underscans IT Video Formats by default
  Basic audio support
  Supports YCbCr 4:4:4
  Supports YCbCr 4:2:2
  Native detailed modes: 1
  Video Data Block:
    VIC  16:  1920x1080   60.000000 Hz  16:9     67.500 kHz    148.500000 MHz (native)
  Audio Data Block:
    Linear PCM:
      Max channels: 2
      Supported sample rates (kHz): 192 176.4 96 88.2 48 44.1 32
      Supported sample sizes (bits): 24 20 16
  Speaker Allocation Data Block:
    FL/FR - Front Left/Right
  Colorimetry Data Block:
    xvYCC601
    xvYCC709
    sYCC601
    opYCC601
    opRGB
    BT2020cYCC
    BT2020YCC
    BT2020RGB
    Gamut Boundary Description Metadata Profile P0
  Detailed Timing Descriptors:
    DTD 6:  2560x1080   74.998676 Hz  64:27    83.324 kHz    226.640000 MHz (673 mm x 284 mm)
                 Hfront   18 Hsync  32 Hback  110 Hpol P
                 Vfront    2 Vsync   8 Vback   21 Vpol P
    DTD 7:  1920x1080i  60.000000 Hz  16:9     33.750 kHz     74.250000 MHz (673 mm x 284 mm)
                 Hfront   88 Hsync  44 Hback  148 Hpol P
                 Vfront    2 Vsync   5 Vback   15 Vpol P Vfront +0.5 Odd Field
                 Vfront    2 Vsync   5 Vback   15 Vpol P Vback  +0.5 Even Field
    DTD 8:  1920x1080   50.000000 Hz  16:9     56.250 kHz    148.500000 MHz (673 mm x 284 mm)
                 Hfront  528 Hsync  44 Hback  148 Hpol P
                 Vfront    4 Vsync   5 Vback   36 Vpol P
    DTD 9:  1280x720    60.000000 Hz  16:9     45.000 kHz     74.250000 MHz (673 mm x 284 mm)
                 Hfront  110 Hsync  40 Hback  220 Hpol P
                 Vfront    5 Vsync   5 Vback   20 Vpol P
Checksum: 0xe8  Unused space in Extension Block: 37 bytes

----------------

Warnings:

Block 1, CTA-861 Extension Block:
  Colorimetry Data Block: Set the sRGB colorimetry bit to avoid interop issues.
  Display Product Serial Number is set, so the Serial Number in the Base EDID should be 0.
Block 3, CTA-861 Extension Block:
  Colorimetry Data Block: Set the sRGB colorimetry bit to avoid interop issues.
  Display Product Serial Number is set, so the Serial Number in the Base EDID should be 0.
EDID:
  Base EDID: Some timings are out of range of the Monitor Ranges:
    Horizontal Freq: 31.468 - 83.323 kHz (Monitor: 113.000 - 113.000 kHz)

Failures:

Block 1, CTA-861 Extension Block:
  Missing VCDB, needed for Set Selectable RGB Quantization to avoid interop issues.
Block 2, Base EDID:
  Unknown Extension Block.
Block 3, CTA-861 Extension Block:
  Video Data Block: Duplicate VIC 16.
  Speaker Allocation Data Block: Only one instance of this Data Block is allowed.
  Colorimetry Data Block: Only one instance of this Data Block is allowed.
  Missing VCDB, needed for Set Selectable RGB Quantization to avoid interop issues.
EDID:
  Base EDID: EDID specified 1 extension block(s), but found 3 extension block(s).
  CTA-861: Native progressive timings are a mix of several resolutions.

EDID conformity: FAIL
