edid-decode (hex):

00 ff ff ff ff ff ff 00 22 64 00 00 00 00 00 00
09 19 01 04 a5 30 1b 78 22 f1 b0 a5 56 48 9a 24
11 50 54 bf ef 80 d1 c0 b3 00 a9 40 95 00 81 80
81 40 71 4f 01 01 02 3a 80 18 71 38 2d 40 58 2c
45 00 dd 0c 11 00 00 1e 00 00 00 ff 00 31 32 33
34 35 36 37 38 39 30 31 32 33 00 00 00 fd 00 38
4b 1e 53 12 00 0a 20 20 20 20 20 20 00 00 00 fc
00 48 45 32 32 35 44 50 42 0a 20 20 20 20 00 48

00 ff ff ff ff ff ff 00 22 64 00 00 00 00 00 00
09 19 01 04 a5 30 1b 78 22 f1 b0 a5 56 48 9a 24
11 50 54 bf ef 80 d1 c0 b3 00 a9 40 95 00 81 80
81 40 71 4f 01 01 02 3a 80 18 71 38 2d 40 58 2c
45 00 dd 0c 11 00 00 1e 00 00 00 ff 00 31 32 33
34 35 36 37 38 39 30 31 32 33 00 00 00 fd 00 38
4b 1e 53 12 00 0a 20 20 20 20 20 20 00 00 00 fc
00 48 45 32 32 35 44 50 42 0a 20 20 20 20 00 48

----------------

Block 0, Base EDID:
  EDID Structure Version & Revision: 1.4
  Vendor & Product Identification:
    Manufacturer: HSD
    Model: 0
    Made in: week 9 of 2015
  Basic Display Parameters & Features:
    Digital display
    Bits per primary color channel: 8
    DisplayPort interface
    Maximum image size: 48 cm x 27 cm
    Gamma: 2.20
    DPMS levels: Off
    Supported color formats: RGB 4:4:4
    First detailed timing includes the native pixel format and preferred refresh rate
  Color Characteristics:
    Red  : 0.6474, 0.3388
    Green: 0.2812, 0.6025
    Blue : 0.1425, 0.0693
    White: 0.3125, 0.3281
  Established Timings I & II:
    IBM     :   720x400    70.081663 Hz   9:5     31.467 kHz     28.320000 MHz
    DMT 0x04:   640x480    59.940476 Hz   4:3     31.469 kHz     25.175000 MHz
    Apple   :   640x480    66.666667 Hz   4:3     35.000 kHz     30.240000 MHz
    DMT 0x05:   640x480    72.808802 Hz   4:3     37.861 kHz     31.500000 MHz
    DMT 0x06:   640x480    75.000000 Hz   4:3     37.500 kHz     31.500000 MHz
    DMT 0x08:   800x600    56.250000 Hz   4:3     35.156 kHz     36.000000 MHz
    DMT 0x09:   800x600    60.316541 Hz   4:3     37.879 kHz     40.000000 MHz
    DMT 0x0a:   800x600    72.187572 Hz   4:3     48.077 kHz     50.000000 MHz
    DMT 0x0b:   800x600    75.000000 Hz   4:3     46.875 kHz     49.500000 MHz
    Apple   :   832x624    74.551266 Hz   4:3     49.726 kHz     57.284000 MHz
    DMT 0x10:  1024x768    60.003840 Hz   4:3     48.363 kHz     65.000000 MHz
    DMT 0x11:  1024x768    70.069359 Hz   4:3     56.476 kHz     75.000000 MHz
    DMT 0x12:  1024x768    75.028582 Hz   4:3     60.023 kHz     78.750000 MHz
    DMT 0x24:  1280x1024   75.024675 Hz   5:4     79.976 kHz    135.000000 MHz
    Apple   :  1152x870    75.061550 Hz 192:145   68.681 kHz    100.000000 MHz
  Standard Timings:
    DMT 0x52:  1920x1080   60.000000 Hz  16:9     67.500 kHz    148.500000 MHz
    DMT 0x3a:  1680x1050   59.954250 Hz  16:10    65.290 kHz    146.250000 MHz
    DMT 0x33:  1600x1200   60.000000 Hz   4:3     75.000 kHz    162.000000 MHz
    DMT 0x2f:  1440x900    59.887445 Hz  16:10    55.935 kHz    106.500000 MHz
    DMT 0x23:  1280x1024   60.019740 Hz   5:4     63.981 kHz    108.000000 MHz
    DMT 0x20:  1280x960    60.000000 Hz   4:3     60.000 kHz    108.000000 MHz
    DMT 0x15:  1152x864    75.000000 Hz   4:3     67.500 kHz    108.000000 MHz
  Detailed Timing Descriptors:
    DTD 1:  1920x1080   60.000000 Hz  16:9     67.500 kHz    148.500000 MHz (477 mm x 268 mm)
                 Hfront   88 Hsync  44 Hback  148 Hpol P
                 Vfront    4 Vsync   5 Vback   36 Vpol P
    Display Product Serial Number: ...
    Display Range Limits:
      Monitor ranges (GTF): 56-75 Hz V, 30-83 kHz H, max dotclock 180 MHz
    Display Product Name: 'HE225DPB'
Checksum: 0x48

----------------

Block 1, Unknown EDID Extension Block 0x00:
  00 ff ff ff ff ff ff 00 22 64 00 00 00 00 00 00 '........"d......'
  09 19 01 04 a5 30 1b 78 22 f1 b0 a5 56 48 9a 24 '.....0.x"...VH.$'
  11 50 54 bf ef 80 d1 c0 b3 00 a9 40 95 00 81 80 '.PT........@....'
  81 40 71 4f 01 01 02 3a 80 18 71 38 2d 40 58 2c '.@qO...:..q8-@X,'
  45 00 dd 0c 11 00 00 1e 00 00 00 ff 00 31 32 33 'E............123'
  34 35 36 37 38 39 30 31 32 33 00 00 00 fd 00 38 '4567890123.....8'
  4b 1e 53 12 00 0a 20 20 20 20 20 20 00 00 00 fc 'K.S...      ....'
  00 48 45 32 32 35 44 50 42 0a 20 20 20 20 00 48 '.HE225DPB.    .H'
Checksum: 0x48

----------------

Warnings:

Block 0, Base EDID:
  Display Range Limits: GTF support is deprecated in EDID 1.4.

Failures:

Block 0, Base EDID:
  Display Range Limits: GTF can't be combined with non-continuous frequencies.
Block 1, Base EDID:
  Unknown Extension Block.
EDID:
  Base EDID: EDID specified 0 extension block(s), but found 1 extension block(s).

EDID conformity: FAIL
