
EDID (hex):
00ffffffffffff002264000000000000
1a17010380291778ea6cd0a5554b9a24
115054bfee80814081c0714f61460101
010101010101662156aa51001e30468f
33009ae61000001e000000ff00313233
34353637383930313233000000fd0038
4b1e3d0b000a202020202020000000fc
0048503139354443420a2020202000e3

Extracted contents:
header:          00 ff ff ff ff ff ff 00
serial number:   22 64 00 00 00 00 00 00 1a 17
version:         01 03
basic params:    80 29 17 78 ea
chroma info:     6c d0 a5 55 4b 9a 24 11 50 54
established:     bf ee 80
standard:        81 40 81 c0 71 4f 61 46 01 01 01 01 01 01 01 01
descriptor 1:    66 21 56 aa 51 00 1e 30 46 8f 33 00 9a e6 10 00 00 1e
descriptor 2:    00 00 00 ff 00 31 32 33 34 35 36 37 38 39 30 31 32 33
descriptor 3:    00 00 00 fd 00 38 4b 1e 3d 0b 00 0a 20 20 20 20 20 20
descriptor 4:    00 00 00 fc 00 48 50 31 39 35 44 43 42 0a 20 20 20 20
extensions:      00
checksum:        e3

EDID version: 1.3
Manufacturer: HSD Model 0 Serial Number --
Made in week 26 of 2013
Digital display
Maximum image size: 41 cm x 23 cm
Gamma: 2.20
DPMS levels: Standby Suspend Off
RGB color display
First detailed timing is preferred timing
Display x,y Chromaticity:
  Red:   0.6455, 0.3339
  Green: 0.2958, 0.6015
  Blue:  0.1435, 0.0673
  White: 0.3125, 0.3281
Established timings supported:
  720x400@70Hz 9:5 HorFreq: 31469 Hz Clock: 28.320 MHz
  640x480@60Hz 4:3 HorFreq: 31469 Hz Clock: 25.175 MHz
  640x480@67Hz 4:3 HorFreq: 35000 Hz Clock: 30.240 MHz
  640x480@72Hz 4:3 HorFreq: 37900 Hz Clock: 31.500 MHz
  640x480@75Hz 4:3 HorFreq: 37500 Hz Clock: 31.500 MHz
  800x600@56Hz 4:3 HorFreq: 35200 Hz Clock: 36.000 MHz
  800x600@60Hz 4:3 HorFreq: 37900 Hz Clock: 40.000 MHz
  800x600@72Hz 4:3 HorFreq: 48100 Hz Clock: 50.000 MHz
  800x600@75Hz 4:3 HorFreq: 46900 Hz Clock: 49.500 MHz
  832x624@75Hz 4:3 HorFreq: 49726 Hz Clock: 57.284 MHz
  1024x768@60Hz 4:3 HorFreq: 48400 Hz Clock: 65.000 MHz
  1024x768@70Hz 4:3 HorFreq: 56500 Hz Clock: 75.000 MHz
  1024x768@75Hz 4:3 HorFreq: 60000 Hz Clock: 78.750 MHz
  1152x870@75Hz 192:145 HorFreq: 67500 Hz Clock: 108.000 MHz
Standard timings supported:
  1280x960@60Hz 4:3 HorFreq: 60000 Hz Clock: 108.000 MHz
  1280x720@60Hz 16:9
  1152x864@75Hz 4:3 HorFreq: 67500 Hz Clock: 108.000 MHz
  1024x768@66Hz 4:3
Detailed mode: Clock 85.500 MHz, 410 mm x 230 mm
               1366 1436 1579 1792 hborder 0
                768  771  774  798 vborder 0
               +hsync +vsync 
               VertFreq: 59 Hz, HorFreq: 47712 Hz
Serial number: --
Monitor ranges (GTF): 56-75Hz V, 30-61kHz H, max dotclock 110MHz
Monitor name: HP195DCB
Checksum: 0xe3 (valid)
One or more of the timings is out of range of the Monitor Ranges:
  Vertical Freq: 56 - 75 Hz
  Horizontal Freq: 31469 - 67500 Hz
  Maximum Clock: 108.000 MHz
