
EDID (hex):
00ffffffffffff00220e223501010101
2c1d0103803c22782acd25a3574b9f27
0d5054a10800d1c081c0a9c0b3009500
818081000101023a801871382d40582c
450056502100001e000000fd00323c1e
5011000a202020202020000000fc0048
5020563237300a2020202020000000ff
00314352393434324253430a202000fd

Extracted contents:
header:          00 ff ff ff ff ff ff 00
serial number:   22 0e 22 35 01 01 01 01 2c 1d
version:         01 03
basic params:    80 3c 22 78 2a
chroma info:     cd 25 a3 57 4b 9f 27 0d 50 54
established:     a1 08 00
standard:        d1 c0 81 c0 a9 c0 b3 00 95 00 81 80 81 00 01 01
descriptor 1:    02 3a 80 18 71 38 2d 40 58 2c 45 00 56 50 21 00 00 1e
descriptor 2:    00 00 00 fd 00 32 3c 1e 50 11 00 0a 20 20 20 20 20 20
descriptor 3:    00 00 00 fc 00 48 50 20 56 32 37 30 0a 20 20 20 20 20
descriptor 4:    00 00 00 ff 00 31 43 52 39 34 34 32 42 53 43 0a 20 20
extensions:      00
checksum:        fd

EDID version: 1.3
Manufacturer: HPN Model 3522 Serial Number --
Made in week 44 of 2019
Digital display
Maximum image size: 60 cm x 34 cm
Gamma: 2.20
DPMS levels: Off
RGB color display
First detailed timing is preferred timing
Display x,y Chromaticity:
  Red:   0.6396, 0.3398
  Green: 0.2958, 0.6220
  Blue:  0.1523, 0.0527
  White: 0.3134, 0.3291
Established timings supported:
  720x400@70Hz 9:5 HorFreq: 31469 Hz Clock: 28.320 MHz
  640x480@60Hz 4:3 HorFreq: 31469 Hz Clock: 25.175 MHz
  800x600@60Hz 4:3 HorFreq: 37900 Hz Clock: 40.000 MHz
  1024x768@60Hz 4:3 HorFreq: 48400 Hz Clock: 65.000 MHz
Standard timings supported:
  1920x1080@60Hz 16:9
  1280x720@60Hz 16:9
  1600x900@60Hz 16:9
  1680x1050@60Hz 16:10 HorFreq: 64700 Hz Clock: 119.000 MHz
  1440x900@60Hz 16:10 HorFreq: 55500 Hz Clock: 88.750 MHz
  1280x1024@60Hz 5:4 HorFreq: 64000 Hz Clock: 108.000 MHz
  1280x800@60Hz 16:10
Detailed mode: Clock 148.500 MHz, 598 mm x 336 mm
               1920 2008 2052 2200 hborder 0
               1080 1084 1089 1125 vborder 0
               +hsync +vsync 
               VertFreq: 60 Hz, HorFreq: 67500 Hz
Monitor ranges (GTF): 50-60Hz V, 30-80kHz H, max dotclock 170MHz
Monitor name: HP V270
Serial number: --
Checksum: 0xfd (valid)
One or more of the timings is out of range of the Monitor Ranges:
  Vertical Freq: 60 - 70 Hz
  Horizontal Freq: 31469 - 67500 Hz
  Maximum Clock: 148.500 MHz


