edid-decode (hex):

00 ff ff ff ff ff ff 00 09 e5 87 06 00 00 00 00
01 19 01 04 a5 22 13 78 02 b0 90 97 58 54 92 26
1d 50 54 00 00 00 01 01 01 01 01 01 01 01 01 01
01 01 01 01 01 01 9c 3b 80 10 71 38 50 40 30 20
36 00 58 c1 10 00 00 1a d6 24 80 de 70 38 14 40
64 64 44 05 58 c1 10 00 00 1a 00 00 00 00 00 00
00 00 00 00 00 00 00 00 00 00 00 00 00 00 00 02
00 0c 43 f6 0b 3c 6e 0f 10 1c 73 00 00 00 00 51

----------------

Block 0, Base EDID:
  EDID Structure Version & Revision: 1.4
  Vendor & Product Identification:
    Manufacturer: BOE
    Model: 1671
    Made in: week 1 of 2015
  Basic Display Parameters & Features:
    Digital display
    Bits per primary color channel: 8
    DisplayPort interface
    Maximum image size: 34 cm x 19 cm
    Gamma: 2.20
    Supported color formats: RGB 4:4:4
    First detailed timing includes the native pixel format and preferred refresh rate
  Color Characteristics:
    Red  : 0.5917, 0.3466
    Green: 0.3281, 0.5703
    Blue : 0.1503, 0.1142
    White: 0.3125, 0.3281
  Established Timings I & II: none
  Standard Timings: none
  Detailed Timing Descriptors:
    DTD 1:  1920x1080   60.014473 Hz  16:9     69.617 kHz    152.600000 MHz (344 mm x 193 mm)
                 Hfront   48 Hsync  32 Hback  192 Hpol P
                 Vfront    3 Vsync   6 Vback   71 Vpol N
    DTD 2:  1920x1080   40.022069 Hz  16:9     44.024 kHz     94.300000 MHz (344 mm x 193 mm)
                 Hfront  100 Hsync 100 Hback   22 Hpol P
                 Vfront   20 Vsync  20 Vback  -20 Vpol N
    Empty Descriptor
    Manufacturer-Specified Display Descriptor (0x02): 00 02 00 0c 43 f6 0b 3c 6e 0f 10 1c 73 00 00 00 '....C..<n...s...'
Checksum: 0x51

----------------

Failures:

Block 0, Base EDID:
  Detailed Timing Descriptor #2: 0 or negative vertical back porch.
  Empty Descriptor: Use Dummy Descriptor instead of all zeroes.
  Missing Display Product Name.

EDID conformity: FAIL
