edid-decode (hex):

00 ff ff ff ff ff ff 00 0d ae 12 16 00 00 00 00
1e 21 01 04 a5 22 16 78 02 28 65 97 59 54 8e 27
1e 50 54 00 00 00 01 01 01 01 01 01 01 01 01 01
01 01 01 01 01 01 42 3c 80 a0 70 b0 24 40 2e 1e
a6 00 58 d7 10 00 00 1a 35 30 80 a0 70 b0 24 40
2e 1e a6 00 58 d7 10 00 00 1a 00 00 00 fe 00 52
4a 39 36 52 80 31 36 30 4a 43 41 0a 00 00 00 00
00 01 41 31 99 00 10 00 00 0a 01 0a 20 20 00 b4

00 ff ff ff ff ff ff 00 0d ae 12 16 00 00 00 00
1e 21 01 04 a5 22 16 78 02 28 65 97 59 54 8e 27
1e 50 54 00 00 00 01 01 01 01 01 01 01 01 01 01
01 01 01 01 01 01 42 3c 80 a0 70 b0 24 40 2e 1e
a6 00 58 d7 10 00 00 1a 35 30 80 a0 70 b0 24 40
2e 1e a6 00 58 d7 10 00 00 1a 00 00 00 fe 00 52
4a 39 36 52 80 31 36 30 4a 43 41 0a 00 00 00 00
00 01 41 31 99 00 10 00 00 0a 01 0a 20 20 00 b4

----------------

Block 0, Base EDID:
  EDID Structure Version & Revision: 1.4
  Vendor & Product Identification:
    Manufacturer: CMN
    Model: 5650
    Made in: week 30 of 2023
  Basic Display Parameters & Features:
    Digital display
    Bits per primary color channel: 8
    DisplayPort interface
    Maximum image size: 34 cm x 22 cm
    Gamma: 2.20
    Supported color formats: RGB 4:4:4
    First detailed timing includes the native pixel format and preferred refresh rate
  Color Characteristics:
    Red  : 0.5898, 0.3496
    Green: 0.3300, 0.5546
    Blue : 0.1533, 0.1191
    White: 0.3134, 0.3291
  Established Timings I & II: none
  Standard Timings: none
  Detailed Timing Descriptors:
    DTD 1:  1920x1200   60.002801 Hz  16:10    74.163 kHz    154.260000 MHz (344 mm x 215 mm)
                 Hfront   46 Hsync  30 Hback   84 Hpol P
                 Vfront   10 Vsync   6 Vback   20 Vpol N
    DTD 2:  1920x1200   48.003018 Hz  16:10    59.332 kHz    123.410000 MHz (344 mm x 215 mm)
                 Hfront   46 Hsync  30 Hback   84 Hpol P
                 Vfront   10 Vsync   6 Vback   20 Vpol N
    Alphanumeric Data String: 'RJ96R'
    Manufacturer-Specified Display Descriptor (0x00): 00 00 00 01 41 31 99 00 10 00 00 0a 01 0a 20 20 '....A1........  '
Checksum: 0xb4

----------------

Block 1, Unknown EDID Extension Block 0x00:
  00 ff ff ff ff ff ff 00 0d ae 12 16 00 00 00 00 '................'
  1e 21 01 04 a5 22 16 78 02 28 65 97 59 54 8e 27 '.!...".x.(e.YT.''
  1e 50 54 00 00 00 01 01 01 01 01 01 01 01 01 01 '.PT.............'
  01 01 01 01 01 01 42 3c 80 a0 70 b0 24 40 2e 1e '......B<..p.$@..'
  a6 00 58 d7 10 00 00 1a 35 30 80 a0 70 b0 24 40 '..X.....50..p.$@'
  2e 1e a6 00 58 d7 10 00 00 1a 00 00 00 fe 00 52 '....X..........R'
  4a 39 36 52 80 31 36 30 4a 43 41 0a 00 00 00 00 'J96R.160JCA.....'
  00 01 41 31 99 00 10 00 00 0a 01 0a 20 20 00 b4 '..A1........  ..'
Checksum: 0xb4

----------------

Warnings:

Block 0, Base EDID:
  Missing Display Product Name.

Failures:

Block 0, Base EDID:
  Alphanumeric Data String: Non-printable character.
Block 1, Base EDID:
  Unknown Extension Block.
EDID:
  Base EDID: EDID specified 0 extension block(s), but found 1 extension block(s).

EDID conformity: FAIL
