
EDID (hex):
00ffffffffffff0006af3d3800000000
001a0104951f1178028d15a156529d28
0a505400000001010101010101010101
010101010101143780b8703824401010
3e0035ae100000180000000f00000000
00000000000000000020000000fe0041
554f0a202020202020202020000000fe
004231343048414e30332e38200a003d

Extracted contents:
header:          00 ff ff ff ff ff ff 00
serial number:   06 af 3d 38 00 00 00 00 00 1a
version:         01 04
basic params:    95 1f 11 78 02
chroma info:     8d 15 a1 56 52 9d 28 0a 50 54
established:     00 00 00
standard:        01 01 01 01 01 01 01 01 01 01 01 01 01 01 01 01
descriptor 1:    14 37 80 b8 70 38 24 40 10 10 3e 00 35 ae 10 00 00 18
descriptor 2:    00 00 00 0f 00 00 00 00 00 00 00 00 00 00 00 00 00 20
descriptor 3:    00 00 00 fe 00 41 55 4f 0a 20 20 20 20 20 20 20 20 20
descriptor 4:    00 00 00 fe 00 42 31 34 30 48 41 4e 30 33 2e 38 20 0a
extensions:      00
checksum:        3d

EDID version: 1.4
Manufacturer: AUO Model 383d Serial Number --
Made in year 2016
Digital display
6 bits per primary color channel
DisplayPort interface
Maximum image size: 31 cm x 17 cm
Gamma: 2.20
Supported color formats: RGB 4:4:4
First detailed timing includes the native pixel format and preferred refresh rate
Display x,y Chromaticity:
  Red:   0.6308, 0.3359
  Green: 0.3232, 0.6142
  Blue:  0.1562, 0.0400
  White: 0.3134, 0.3291
Established timings supported:
Standard timings supported:
Detailed mode: Clock 141.000 MHz, 309 mm x 174 mm
               1920 1936 1952 2104 hborder 0
               1080 1083 1097 1116 vborder 0
               -hsync -vsync 
               VertFreq: 60 Hz, HorFreq: 67015 Hz
Manufacturer-specified data, tag 15
ASCII string: AUO
ASCII string: B140HAN03.8 
Checksum: 0x3d (valid)
EDID block does NOT conform to EDID 1.4!
	Missing name descriptor
	Missing monitor ranges
