
EDID (hex):
00ffffffffffff003683279501000000
24150104a573417802cf74a3574cb023
09484ca1080081806140454031400101
010101010101662156aa51001e30468f
33007e8a4200001e0e1f008051001e30
408037007e8a4200001c000000fd003a
3e1e5310000a202020202020000000fc
0054560a20202020202020202020004e

Extracted contents:
header:          00 ff ff ff ff ff ff 00
serial number:   36 83 27 95 01 00 00 00 24 15
version:         01 04
basic params:    a5 73 41 78 02
chroma info:     cf 74 a3 57 4c b0 23 09 48 4c
established:     a1 08 00
standard:        81 80 61 40 45 40 31 40 01 01 01 01 01 01 01 01
descriptor 1:    66 21 56 aa 51 00 1e 30 46 8f 33 00 7e 8a 42 00 00 1e
descriptor 2:    0e 1f 00 80 51 00 1e 30 40 80 37 00 7e 8a 42 00 00 1c
descriptor 3:    00 00 00 fd 00 3a 3e 1e 53 10 00 0a 20 20 20 20 20 20
descriptor 4:    00 00 00 fc 00 54 56 0a 20 20 20 20 20 20 20 20 20 20
extensions:      00
checksum:        4e

EDID version: 1.4
Manufacturer: MTC Model 9527 Serial Number --
Made in week 36 of 2011
Digital display
8 bits per primary color channel
DisplayPort interface
Maximum image size: 115 cm x 65 cm
Gamma: 2.20
Supported color formats: RGB 4:4:4
First detailed timing includes the native pixel format and preferred refresh rate
Display x,y Chromaticity:
  Red:   0.6396, 0.3398
  Green: 0.2998, 0.6904
  Blue:  0.1376, 0.0380
  White: 0.2822, 0.2968
Established timings supported:
  720x400@70Hz 9:5 HorFreq: 31469 Hz Clock: 28.320 MHz
  640x480@60Hz 4:3 HorFreq: 31469 Hz Clock: 25.175 MHz
  800x600@60Hz 4:3 HorFreq: 37900 Hz Clock: 40.000 MHz
  1024x768@60Hz 4:3 HorFreq: 48400 Hz Clock: 65.000 MHz
Standard timings supported:
  1280x1024@60Hz 5:4 HorFreq: 64000 Hz Clock: 108.000 MHz
  1024x768@60Hz 4:3 HorFreq: 48400 Hz Clock: 65.000 MHz
  800x600@60Hz 4:3 HorFreq: 37900 Hz Clock: 40.000 MHz
  640x480@60Hz 4:3 HorFreq: 31469 Hz Clock: 25.175 MHz
Detailed mode: Clock 85.500 MHz, 1150 mm x 650 mm
               1366 1436 1579 1792 hborder 0
                768  771  774  798 vborder 0
               +hsync +vsync 
               VertFreq: 59 Hz, HorFreq: 47712 Hz
Detailed mode: Clock 79.500 MHz, 1150 mm x 650 mm
               1280 1344 1472 1664 hborder 0
                768  771  778  798 vborder 0
               -hsync +vsync 
               VertFreq: 59 Hz, HorFreq: 47776 Hz
Monitor ranges (GTF): 58-62Hz V, 30-83kHz H, max dotclock 160MHz
Monitor name: TV
Checksum: 0x4e (valid)
Warning: One or more of the timings is out of range of the Monitor Ranges:
  Vertical Freq: 59 - 70 Hz
  Horizontal Freq: 31469 - 64000 Hz
  Maximum Clock: 108.000 MHz
