edid-decode (hex):

00 ff ff ff ff ff ff 00 30 e4 3b 05 00 00 00 00
00 1a 01 04 95 1d 11 78 02 2a 05 93 58 55 91 29
1e 50 54 00 00 00 01 01 01 01 01 01 01 01 01 01
01 01 01 01 01 01 2e 36 80 a0 70 38 1f 40 30 20
35 00 26 a5 10 00 00 19 57 2b 80 a0 70 38 1f 40
30 20 35 00 26 a5 10 00 00 19 00 00 00 fe 00 4c
47 20 44 69 73 70 6c 61 79 0a 20 20 00 00 00 fe
00 4c 50 31 33 33 57 46 32 2d 53 50 4c 38 00 10

----------------

Block 0, Base EDID:
  EDID Structure Version & Revision: 1.4
  Vendor & Product Identification:
    Manufacturer: LGD
    Model: 1339
    Made in: 2016
  Basic Display Parameters & Features:
    Digital display
    Bits per primary color channel: 6
    DisplayPort interface
    Maximum image size: 29 cm x 17 cm
    Gamma: 2.20
    Supported color formats: RGB 4:4:4
    First detailed timing includes the native pixel format and preferred refresh rate
  Color Characteristics:
    Red  : 0.5742, 0.3457
    Green: 0.3339, 0.5683
    Blue : 0.1601, 0.1171
    White: 0.3134, 0.3291
  Established Timings I & II: none
  Standard Timings: none
  Detailed Timing Descriptors:
    DTD 1:  1920x1080   60.020 Hz  16:9    66.683 kHz 138.700 MHz (294 mm x 165 mm)
                 Hfront   48 Hsync  32 Hback  80 Hpol N
                 Vfront    3 Vsync   5 Vback  23 Vpol N
    DTD 2:  1920x1080   48.012 Hz  16:9    53.341 kHz 110.950 MHz (294 mm x 165 mm)
                 Hfront   48 Hsync  32 Hback  80 Hpol N
                 Vfront    3 Vsync   5 Vback  23 Vpol N
    Alphanumeric Data String: 'LG Display'
    Alphanumeric Data String: 'LP133WF2-SPL8'
Checksum: 0x10
