
EDID (hex):
00ffffffffffff004c2d340f425a5a42
171e0103804627782aaea5af4f42af26
0f5054bfef80714f810081c081809500
a9c0b300010104740030f2705a80b058
8a00b9882100001e000000fd00184b1e
5a1e000a202020202020000000fc0055
33324a3539780a2020202020000000ff
0048345a4e3630303534340a202001e4
020326f04b5f10041f13031320225e5d
23090707830100006d030c001000803c
200060010203023a801871382d40582c
4500b9882100001e023a80d072382d40
102c4580b9882100001e04740030f270
5a80b0588a00b9882100001e565e00a0
a0a0295030203500b9882100001a0000
000000000000000000000000000000fb

edid-decode (hex):

00 ff ff ff ff ff ff 00 4c 2d 34 0f 42 5a 5a 42
17 1e 01 03 80 46 27 78 2a ae a5 af 4f 42 af 26
0f 50 54 bf ef 80 71 4f 81 00 81 c0 81 80 95 00
a9 c0 b3 00 01 01 04 74 00 30 f2 70 5a 80 b0 58
8a 00 b9 88 21 00 00 1e 00 00 00 fd 00 18 4b 1e
5a 1e 00 0a 20 20 20 20 20 20 00 00 00 fc 00 55
33 32 4a 35 39 78 0a 20 20 20 20 20 00 00 00 ff
00 48 34 5a 4e 36 30 30 35 34 34 0a 20 20 01 e4

02 03 26 f0 4b 5f 10 04 1f 13 03 13 20 22 5e 5d
23 09 07 07 83 01 00 00 6d 03 0c 00 10 00 80 3c
20 00 60 01 02 03 02 3a 80 18 71 38 2d 40 58 2c
45 00 b9 88 21 00 00 1e 02 3a 80 d0 72 38 2d 40
10 2c 45 80 b9 88 21 00 00 1e 04 74 00 30 f2 70
5a 80 b0 58 8a 00 b9 88 21 00 00 1e 56 5e 00 a0
a0 a0 29 50 30 20 35 00 b9 88 21 00 00 1a 00 00
00 00 00 00 00 00 00 00 00 00 00 00 00 00 00 fb

----------------

Block 0, Base EDID:
  EDID Structure Version & Revision: 1.3
  Vendor & Product Identification:
    Manufacturer: SAM
    Model: 3892
    Serial Number: 1113217602
    Made in: week 23 of 2020
  Basic Display Parameters & Features:
    Digital display
    Maximum image size: 70 cm x 39 cm
    Gamma: 2.20
    DPMS levels: Off
    RGB color display
    First detailed timing is the preferred timing
  Color Characteristics:
    Red  : 0.6855, 0.3105
    Green: 0.2607, 0.6855
    Blue : 0.1503, 0.0605
    White: 0.3134, 0.3291
  Established Timings I & II:
    IBM     :   720x400    70.081663 Hz   9:5     31.467 kHz     28.320000 MHz
    DMT 0x04:   640x480    59.940476 Hz   4:3     31.469 kHz     25.175000 MHz
    Apple   :   640x480    66.666667 Hz   4:3     35.000 kHz     30.240000 MHz
    DMT 0x05:   640x480    72.808802 Hz   4:3     37.861 kHz     31.500000 MHz
    DMT 0x06:   640x480    75.000000 Hz   4:3     37.500 kHz     31.500000 MHz
    DMT 0x08:   800x600    56.250000 Hz   4:3     35.156 kHz     36.000000 MHz
    DMT 0x09:   800x600    60.316541 Hz   4:3     37.879 kHz     40.000000 MHz
    DMT 0x0a:   800x600    72.187572 Hz   4:3     48.077 kHz     50.000000 MHz
    DMT 0x0b:   800x600    75.000000 Hz   4:3     46.875 kHz     49.500000 MHz
    Apple   :   832x624    74.551266 Hz   4:3     49.726 kHz     57.284000 MHz
    DMT 0x10:  1024x768    60.003840 Hz   4:3     48.363 kHz     65.000000 MHz
    DMT 0x11:  1024x768    70.069359 Hz   4:3     56.476 kHz     75.000000 MHz
    DMT 0x12:  1024x768    75.028582 Hz   4:3     60.023 kHz     78.750000 MHz
    DMT 0x24:  1280x1024   75.024675 Hz   5:4     79.976 kHz    135.000000 MHz
    Apple   :  1152x870    75.061550 Hz 192:145   68.681 kHz    100.000000 MHz
  Standard Timings:
    DMT 0x15:  1152x864    75.000000 Hz   4:3     67.500 kHz    108.000000 MHz
    DMT 0x1c:  1280x800    59.810326 Hz  16:10    49.702 kHz     83.500000 MHz
    DMT 0x55:  1280x720    60.000000 Hz  16:9     45.000 kHz     74.250000 MHz
    DMT 0x23:  1280x1024   60.019740 Hz   5:4     63.981 kHz    108.000000 MHz
    DMT 0x2f:  1440x900    59.887445 Hz  16:10    55.935 kHz    106.500000 MHz
    DMT 0x53:  1600x900    60.000000 Hz  16:9     60.000 kHz    108.000000 MHz (RB)
    DMT 0x3a:  1680x1050   59.954250 Hz  16:10    65.290 kHz    146.250000 MHz
  Detailed Timing Descriptors:
    DTD 1:  3840x2160   30.000000 Hz  16:9     67.500 kHz    297.000000 MHz (697 mm x 392 mm)
                 Hfront  176 Hsync  88 Hback  296 Hpol P
                 Vfront    8 Vsync  10 Vback   72 Vpol P
    Display Range Limits:
      Monitor ranges (GTF): 24-75 Hz V, 30-90 kHz H, max dotclock 300 MHz
    Display Product Name: 'U32J59x'
    Display Product Serial Number: 'H4ZN600544'
  Extension blocks: 1
Checksum: 0xe4

----------------

Block 1, CTA-861 Extension Block:
  Revision: 3
  Underscans IT Video Formats by default
  Basic audio support
  Supports YCbCr 4:4:4
  Supports YCbCr 4:2:2
  Native detailed modes: 0
  Video Data Block:
    VIC  95:  3840x2160   30.000000 Hz  16:9     67.500 kHz    297.000000 MHz
    VIC  16:  1920x1080   60.000000 Hz  16:9     67.500 kHz    148.500000 MHz
    VIC   4:  1280x720    60.000000 Hz  16:9     45.000 kHz     74.250000 MHz
    VIC  31:  1920x1080   50.000000 Hz  16:9     56.250 kHz    148.500000 MHz
    VIC  19:  1280x720    50.000000 Hz  16:9     37.500 kHz     74.250000 MHz
    VIC   3:   720x480    59.940060 Hz  16:9     31.469 kHz     27.000000 MHz
    VIC  19:  1280x720    50.000000 Hz  16:9     37.500 kHz     74.250000 MHz
    VIC  32:  1920x1080   24.000000 Hz  16:9     27.000 kHz     74.250000 MHz
    VIC  34:  1920x1080   30.000000 Hz  16:9     33.750 kHz     74.250000 MHz
    VIC  94:  3840x2160   25.000000 Hz  16:9     56.250 kHz    297.000000 MHz
    VIC  93:  3840x2160   24.000000 Hz  16:9     54.000 kHz    297.000000 MHz
  Audio Data Block:
    Linear PCM:
      Max channels: 2
      Supported sample rates (kHz): 48 44.1 32
      Supported sample sizes (bits): 24 20 16
  Speaker Allocation Data Block:
    FL/FR - Front Left/Right
  Vendor-Specific Data Block (HDMI), OUI 00-0C-03:
    Source physical address: 1.0.0.0
    Supports_AI
    Maximum TMDS clock: 300 MHz
    Extended HDMI video details:
      HDMI VICs:
        HDMI VIC 1:  3840x2160   30.000000 Hz  16:9     67.500 kHz    297.000000 MHz
        HDMI VIC 2:  3840x2160   25.000000 Hz  16:9     56.250 kHz    297.000000 MHz
        HDMI VIC 3:  3840x2160   24.000000 Hz  16:9     54.000 kHz    297.000000 MHz
  Detailed Timing Descriptors:
    DTD 2:  1920x1080   60.000000 Hz  16:9     67.500 kHz    148.500000 MHz (697 mm x 392 mm)
                 Hfront   88 Hsync  44 Hback  148 Hpol P
                 Vfront    4 Vsync   5 Vback   36 Vpol P
    DTD 3:  1920x1080   50.000000 Hz  16:9     56.250 kHz    148.500000 MHz (697 mm x 392 mm)
                 Hfront  528 Hsync  44 Hback  148 Hpol P
                 Vfront    4 Vsync   5 Vback   36 Vpol P
    DTD 4:  3840x2160   30.000000 Hz  16:9     67.500 kHz    297.000000 MHz (697 mm x 392 mm)
                 Hfront  176 Hsync  88 Hback  296 Hpol P
                 Vfront    8 Vsync  10 Vback   72 Vpol P
    DTD 5:  2560x1440   59.950550 Hz  16:9     88.787 kHz    241.500000 MHz (697 mm x 392 mm)
                 Hfront   48 Hsync  32 Hback   80 Hpol P
                 Vfront    3 Vsync   5 Vback   33 Vpol N
Checksum: 0xfb  Unused space in Extension Block: 17 bytes


