
EDID (hex):
00ffffffffffff0006af2c1600000000
00180104951d107802bbf59455549027
23505400000001010101010101010101
010101010101881d56e2500016302616
360025a4100000180000000f00000000
00000000000000000020000000fe0041
554f0a202020202020202020000000fe
004231333358544e30312e36200a0069

Extracted contents:
header:          00 ff ff ff ff ff ff 00
serial number:   06 af 2c 16 00 00 00 00 00 18
version:         01 04
basic params:    95 1d 10 78 02
chroma info:     bb f5 94 55 54 90 27 23 50 54
established:     00 00 00
standard:        01 01 01 01 01 01 01 01 01 01 01 01 01 01 01 01
descriptor 1:    88 1d 56 e2 50 00 16 30 26 16 36 00 25 a4 10 00 00 18
descriptor 2:    00 00 00 0f 00 00 00 00 00 00 00 00 00 00 00 00 00 20
descriptor 3:    00 00 00 fe 00 41 55 4f 0a 20 20 20 20 20 20 20 20 20
descriptor 4:    00 00 00 fe 00 42 31 33 33 58 54 4e 30 31 2e 36 20 0a
extensions:      00
checksum:        69

EDID version: 1.4
Manufacturer: AUO Model 162c Serial Number --
Made in year 2014
Digital display
6 bits per primary color channel
DisplayPort interface
Maximum image size: 29 cm x 16 cm
Gamma: 2.20
Supported color formats: RGB 4:4:4
First detailed timing includes the native pixel format and preferred refresh rate
Display x,y Chromaticity:
  Red:   0.5800, 0.3349
  Green: 0.3300, 0.5654
  Blue:  0.1552, 0.1396
  White: 0.3134, 0.3291
Established timings supported:
Standard timings supported:
Detailed mode: Clock 75.600 MHz, 293 mm x 164 mm
               1366 1404 1426 1592 hborder 0
                768  771  777  790 vborder 0
               -hsync -vsync 
               VertFreq: 60 Hz, HorFreq: 47487 Hz
Manufacturer-specified data, tag 15
ASCII string: AUO
ASCII string: B133XTN01.6 
Checksum: 0x69 (valid)
EDID block does NOT conform to EDID 1.4!
	Missing name descriptor
	Missing monitor ranges
