edid-decode (hex):

00 ff ff ff ff ff ff 00 4d 10 7d 14 00 00 00 00
2d 1a 01 04 a5 1d 11 78 06 de 50 a3 54 4c 99 26
0f 50 54 00 00 00 01 01 01 01 01 01 01 01 01 01
01 01 01 01 01 01 cd 91 80 a0 c0 08 34 70 30 20
35 00 26 a5 10 00 00 18 ad 74 80 a0 c0 08 34 70
30 20 35 00 26 a5 10 00 00 18 00 00 00 10 00 00
00 00 00 00 00 00 00 00 00 00 00 00 00 00 00 fe
00 4c 51 31 33 33 5a 31 4a 5a 32 35 0a 20 00 ff

----------------

Block 0, Base EDID:
  EDID Structure Version & Revision: 1.4
  Vendor & Product Identification:
    Manufacturer: SHP
    Model: 5245
    Made in: week 45 of 2016
  Basic Display Parameters & Features:
    Digital display
    Bits per primary color channel: 8
    DisplayPort interface
    Maximum image size: 29 cm x 17 cm
    Gamma: 2.20
    Supported color formats: RGB 4:4:4
    Default (sRGB) color space is primary color space
    First detailed timing includes the native pixel format and preferred refresh rate
  Color Characteristics:
    Red  : 0.6396, 0.3291
    Green: 0.2998, 0.5996
    Blue : 0.1494, 0.0595
    White: 0.3125, 0.3281
  Established Timings I & II: none
  Standard Timings: none
  Detailed Timing Descriptors:
    DTD 1:  3200x1800   59.981809 Hz  16:9    111.086 kHz    373.250000 MHz (294 mm x 165 mm)
                 Hfront   48 Hsync  32 Hback   80 Hpol N
                 Vfront    3 Vsync   5 Vback   44 Vpol N
    DTD 2:  3200x1800   47.999910 Hz  16:9     88.896 kHz    298.690000 MHz (294 mm x 165 mm)
                 Hfront   48 Hsync  32 Hback   80 Hpol N
                 Vfront    3 Vsync   5 Vback   44 Vpol N
    Dummy Descriptor:
    Alphanumeric Data String: 'LQ133Z1JZ25'
Checksum: 0xff

----------------

Failures:

Block 0, Base EDID:
  Basic Display Parameters & Features: sRGB is signaled, but the chromaticities do not match.
  Missing Display Product Name.

EDID conformity: FAIL
