edid-decode (hex):

00 ff ff ff ff ff ff 00 1a b3 40 07 01 01 01 01
13 11 01 03 80 26 1e 78 2a fd 56 a5 53 4a 9d 24
14 4f 54 a5 4b 00 81 80 01 01 01 01 01 01 01 01
01 01 01 01 01 01 30 2a 00 98 51 00 2a 40 30 70
13 00 78 2d 11 00 00 1e 00 00 00 fd 00 38 4b 1f
51 0e 00 0a 20 20 20 20 20 20 00 00 00 fc 00 48
31 39 2d 32 0a 20 20 20 20 20 20 20 00 00 00 ff
00 59 45 32 57 30 31 31 34 34 31 0a 20 20 00 c6

00 ff ff ff ff ff ff 00 1a b3 40 07 01 01 01 01
13 11 01 03 80 26 1e 78 2a fd 56 a5 53 4a 9d 24
14 4f 54 a5 4b 00 81 80 01 01 01 01 01 01 01 01
01 01 01 01 01 01 30 2a 00 98 51 00 2a 40 30 70
13 00 78 2d 11 00 00 1e 00 00 00 fd 00 38 4b 1f
51 0e 00 0a 20 20 20 20 20 20 00 00 00 fc 00 48
31 39 2d 32 0a 20 20 20 20 20 20 20 00 00 00 ff
00 59 45 32 57 30 31 31 34 34 31 0a 20 20 00 c6

----------------

Block 0, Base EDID:
  EDID Structure Version & Revision: 1.3
  Vendor & Product Identification:
    Manufacturer: FUS
    Model: 1856
    Serial Number: ...
    Made in: week 19 of 2007
  Basic Display Parameters & Features:
    Digital display
    Maximum image size: 38 cm x 30 cm
    Gamma: 2.20
    DPMS levels: Off
    RGB color display
    First detailed timing is the preferred timing
  Color Characteristics:
    Red  : 0.6474, 0.3271
    Green: 0.2919, 0.6142
    Blue : 0.1416, 0.0791
    White: 0.3095, 0.3300
  Established Timings I & II:
    IBM     :   720x400    70.081663 Hz   9:5     31.467 kHz     28.320000 MHz
    DMT 0x04:   640x480    59.940476 Hz   4:3     31.469 kHz     25.175000 MHz
    DMT 0x06:   640x480    75.000000 Hz   4:3     37.500 kHz     31.500000 MHz
    DMT 0x09:   800x600    60.316541 Hz   4:3     37.879 kHz     40.000000 MHz
    DMT 0x0b:   800x600    75.000000 Hz   4:3     46.875 kHz     49.500000 MHz
    DMT 0x10:  1024x768    60.003840 Hz   4:3     48.363 kHz     65.000000 MHz
    DMT 0x12:  1024x768    75.028582 Hz   4:3     60.023 kHz     78.750000 MHz
    DMT 0x24:  1280x1024   75.024675 Hz   5:4     79.976 kHz    135.000000 MHz
  Standard Timings:
    DMT 0x23:  1280x1024   60.019740 Hz   5:4     63.981 kHz    108.000000 MHz
  Detailed Timing Descriptors:
    DTD 1:  1280x1024   60.019740 Hz   5:4     63.981 kHz    108.000000 MHz (376 mm x 301 mm)
                 Hfront   48 Hsync 112 Hback  248 Hpol P
                 Vfront    1 Vsync   3 Vback   38 Vpol P
    Display Range Limits:
      Monitor ranges (GTF): 56-75 Hz V, 31-81 kHz H, max dotclock 140 MHz
    Display Product Name: 'H19-2'
    Display Product Serial Number: ...
Checksum: 0xc6

----------------

Block 1, Unknown EDID Extension Block 0x00:
  00 ff ff ff ff ff ff 00 1a b3 40 07 01 01 01 01 '..........@.....'
  13 11 01 03 80 26 1e 78 2a fd 56 a5 53 4a 9d 24 '.....&.x*.V.SJ.$'
  14 4f 54 a5 4b 00 81 80 01 01 01 01 01 01 01 01 '.OT.K...........'
  01 01 01 01 01 01 30 2a 00 98 51 00 2a 40 30 70 '......0*..Q.*@0p'
  13 00 78 2d 11 00 00 1e 00 00 00 fd 00 38 4b 1f '..x-.........8K.'
  51 0e 00 0a 20 20 20 20 20 20 00 00 00 fc 00 48 'Q...      .....H'
  31 39 2d 32 0a 20 20 20 20 20 20 20 00 00 00 ff '19-2.       ....'
  00 59 45 32 57 30 31 31 34 34 31 0a 20 20 00 c6 '.YE2W011441.  ..'
Checksum: 0xc6

----------------

Failures:

Block 1, Base EDID:
  Unknown Extension Block.
EDID:
  Base EDID: EDID specified 0 extension block(s), but found 1 extension block(s).

EDID conformity: FAIL
