
EDID (hex):
00ffffffffffff004d10301400000000
24190104a52313780edf50a35435b526
0f505400000001010101010101010101
0101010101014dd000a0f0703e803020
35005ac2100000184dd000a0f0706882
30203500000000000000000000fe0034
334e3830824c51313536443100000000
0002010323001100000b010a202000be

Extracted contents:
header:          00 ff ff ff ff ff ff 00
serial number:   4d 10 30 14 00 00 00 00 24 19
version:         01 04
basic params:    a5 23 13 78 0e
chroma info:     df 50 a3 54 35 b5 26 0f 50 54
established:     00 00 00
standard:        01 01 01 01 01 01 01 01 01 01 01 01 01 01 01 01
descriptor 1:    4d d0 00 a0 f0 70 3e 80 30 20 35 00 5a c2 10 00 00 18
descriptor 2:    4d d0 00 a0 f0 70 68 82 30 20 35 00 00 00 00 00 00 00
descriptor 3:    00 00 00 fe 00 34 33 4e 38 30 82 4c 51 31 35 36 44 31
descriptor 4:    00 00 00 00 00 02 01 03 23 00 11 00 00 0b 01 0a 20 20
extensions:      00
checksum:        be

EDID version: 1.4
Manufacturer: SHP Model 1430 Serial Number --
Made in week 36 of 2015
Digital display
8 bits per primary color channel
DisplayPort interface
Maximum image size: 35 cm x 19 cm
Gamma: 2.20
Supported color formats: RGB 4:4:4, YCrCb 4:4:4
Default (sRGB) color space is primary color space
First detailed timing includes the native pixel format and preferred refresh rate
Display x,y Chromaticity:
  Red:   0.6396, 0.3291
  Green: 0.2099, 0.7099
  Blue:  0.1494, 0.0595
  White: 0.3125, 0.3281
Established timings supported:
Standard timings supported:
Detailed mode: Clock 533.250 MHz, 346 mm x 194 mm
               3840 3888 3920 4000 hborder 0
               2160 2163 2168 2222 vborder 0
               -hsync -vsync 
               VertFreq: 59 Hz, HorFreq: 133312 Hz
Detailed mode: Clock 533.250 MHz, 0 mm x 0 mm
               3840 3888 3920 4000 hborder 0
               2160 2163 2168 2776 vborder 0
               -hsync -vsync analog composite 
               VertFreq: 48 Hz, HorFreq: 133312 Hz
ASCII string: 43N80
Manufacturer-specified data, tag 0
Checksum: 0xbe (valid)
EDID block does NOT conform to EDID 1.4!
	sRGB is signaled, but the chromaticities do not match
	Missing name descriptor
	Missing monitor ranges
	Detailed block string not properly terminated
