edid-decode (hex):

00 ff ff ff ff ff ff 00 06 b3 24 27 01 01 01 01
2a 1f 01 03 80 3d 23 78 ee 73 d1 ac 4f 48 a5 27
11 50 54 3f cf 00 d1 c0 81 80 95 00 b3 00 01 01
01 01 01 01 01 01 69 5e 00 a0 a0 a0 29 50 30 20
b8 04 55 50 21 00 00 1a 00 00 00 fd 00 30 90 1e
f3 3c 00 0a 20 20 20 20 20 20 00 00 00 fc 00 58
47 32 37 57 51 0a 20 20 20 20 20 20 00 00 00 ff
00 4d 41 4c 4d 41 53 30 30 30 32 36 37 0a 01 29

02 03 49 71 4b 02 03 11 12 13 04 90 1f 40 3f 61
23 09 17 07 83 01 00 00 67 03 0c 00 10 00 38 3c
67 d8 5d c4 01 78 80 03 6d 1a 00 00 02 03 30 90
e6 0f 64 2f 64 2f e3 05 c0 00 e6 06 05 01 64 64
2f e4 0f 00 04 00 e2 00 6a 60 e8 00 78 a0 a0 67
50 1c 20 f8 0c 55 50 21 00 00 1a 6f c2 00 a0 a0
a0 55 50 30 20 35 00 55 50 21 00 00 1a b7 8c 80
c8 70 38 64 40 18 10 25 00 55 50 21 00 00 1e cf

00 ff ff ff ff ff ff 00 06 b3 24 27 01 01 01 01
2a 1f 01 03 80 3d 23 78 ee 73 d1 ac 4f 48 a5 27
11 50 54 3f cf 00 d1 c0 81 80 95 00 b3 00 01 01
01 01 01 01 01 01 69 5e 00 a0 a0 a0 29 50 30 20
b8 04 55 50 21 00 00 1a 00 00 00 fd 00 30 90 1e
f3 3c 00 0a 20 20 20 20 20 20 00 00 00 fc 00 58
47 32 37 57 51 0a 20 20 20 20 20 20 00 00 00 ff
00 4d 41 4c 4d 41 53 30 30 30 32 36 37 0a 01 29

02 03 49 71 4b 02 03 11 12 13 04 90 1f 40 3f 61
23 09 17 07 83 01 00 00 67 03 0c 00 10 00 38 3c
67 d8 5d c4 01 78 80 03 6d 1a 00 00 02 03 30 90
e6 0f 64 2f 64 2f e3 05 c0 00 e6 06 05 01 64 64
2f e4 0f 00 04 00 e2 00 6a 60 e8 00 78 a0 a0 67
50 1c 20 f8 0c 55 50 21 00 00 1a 6f c2 00 a0 a0
a0 55 50 30 20 35 00 55 50 21 00 00 1a b7 8c 80
c8 70 38 64 40 18 10 25 00 55 50 21 00 00 1e cf

----------------

Block 0, Base EDID:
  EDID Structure Version & Revision: 1.3
  Vendor & Product Identification:
    Manufacturer: AUS
    Model: 10020
    Serial Number: ...
    Made in: week 42 of 2021
  Basic Display Parameters & Features:
    Digital display
    Maximum image size: 61 cm x 35 cm
    Gamma: 2.20
    DPMS levels: Standby Suspend Off
    RGB color display
    Default (sRGB) color space is primary color space
    First detailed timing is the preferred timing
  Color Characteristics:
    Red  : 0.6728, 0.3115
    Green: 0.2812, 0.6474
    Blue : 0.1552, 0.0673
    White: 0.3125, 0.3291
  Established Timings I & II:
    DMT 0x04:   640x480    59.940476 Hz   4:3     31.469 kHz     25.175000 MHz
    Apple   :   640x480    66.666667 Hz   4:3     35.000 kHz     30.240000 MHz
    DMT 0x05:   640x480    72.808802 Hz   4:3     37.861 kHz     31.500000 MHz
    DMT 0x06:   640x480    75.000000 Hz   4:3     37.500 kHz     31.500000 MHz
    DMT 0x08:   800x600    56.250000 Hz   4:3     35.156 kHz     36.000000 MHz
    DMT 0x09:   800x600    60.316541 Hz   4:3     37.879 kHz     40.000000 MHz
    DMT 0x0a:   800x600    72.187572 Hz   4:3     48.077 kHz     50.000000 MHz
    DMT 0x0b:   800x600    75.000000 Hz   4:3     46.875 kHz     49.500000 MHz
    DMT 0x10:  1024x768    60.003840 Hz   4:3     48.363 kHz     65.000000 MHz
    DMT 0x11:  1024x768    70.069359 Hz   4:3     56.476 kHz     75.000000 MHz
    DMT 0x12:  1024x768    75.028582 Hz   4:3     60.023 kHz     78.750000 MHz
    DMT 0x24:  1280x1024   75.024675 Hz   5:4     79.976 kHz    135.000000 MHz
  Standard Timings:
    DMT 0x52:  1920x1080   60.000000 Hz  16:9     67.500 kHz    148.500000 MHz
    DMT 0x23:  1280x1024   60.019740 Hz   5:4     63.981 kHz    108.000000 MHz
    DMT 0x2f:  1440x900    59.887445 Hz  16:10    55.935 kHz    106.500000 MHz
    DMT 0x3a:  1680x1050   59.954250 Hz  16:10    65.290 kHz    146.250000 MHz
  Detailed Timing Descriptors:
    DTD 1:  2560x1440   59.997716 Hz  16:9     88.857 kHz    241.690000 MHz (597 mm x 336 mm)
                 Hfront   48 Hsync  32 Hback   80 Hpol P
                 Vfront   27 Vsync   8 Vback    6 Vpol N
    Display Range Limits:
      Monitor ranges (GTF): 48-144 Hz V, 30-243 kHz H, max dotclock 600 MHz
    Display Product Name: 'XG27WQ'
    Display Product Serial Number: ...
  Extension blocks: 1
Checksum: 0x29

----------------

Block 1, CTA-861 Extension Block:
  Revision: 3
  Basic audio support
  Supports YCbCr 4:4:4
  Supports YCbCr 4:2:2
  Native detailed modes: 1
  Video Data Block:
    VIC   2:   720x480    59.940060 Hz   4:3     31.469 kHz     27.000000 MHz
    VIC   3:   720x480    59.940060 Hz  16:9     31.469 kHz     27.000000 MHz
    VIC  17:   720x576    50.000000 Hz   4:3     31.250 kHz     27.000000 MHz
    VIC  18:   720x576    50.000000 Hz  16:9     31.250 kHz     27.000000 MHz
    VIC  19:  1280x720    50.000000 Hz  16:9     37.500 kHz     74.250000 MHz
    VIC   4:  1280x720    60.000000 Hz  16:9     45.000 kHz     74.250000 MHz
    VIC  16:  1920x1080   60.000000 Hz  16:9     67.500 kHz    148.500000 MHz (native)
    VIC  31:  1920x1080   50.000000 Hz  16:9     56.250 kHz    148.500000 MHz
    VIC  64:  1920x1080  100.000000 Hz  16:9    112.500 kHz    297.000000 MHz
    VIC  63:  1920x1080  120.000000 Hz  16:9    135.000 kHz    297.000000 MHz
    VIC  97:  3840x2160   60.000000 Hz  16:9    135.000 kHz    594.000000 MHz
  Audio Data Block:
    Linear PCM:
      Max channels: 2
      Supported sample rates (kHz): 96 48 44.1 32
      Supported sample sizes (bits): 24 20 16
  Speaker Allocation Data Block:
    FL/FR - Front Left/Right
  Vendor-Specific Data Block (HDMI), OUI 00-0C-03:
    Source physical address: 1.0.0.0
    DC_36bit
    DC_30bit
    DC_Y444
    Maximum TMDS clock: 300 MHz
  Vendor-Specific Data Block (HDMI Forum), OUI C4-5D-D8:
    Version: 1
    Maximum TMDS Character Rate: 600 MHz
    SCDC Present
    Supports 12-bits/component Deep Color 4:2:0 Pixel Encoding
    Supports 10-bits/component Deep Color 4:2:0 Pixel Encoding
  Vendor-Specific Data Block (AMD), OUI 00-00-1A:
    Version: 2.3
    Minimum Refresh Rate: 48 Hz
    Maximum Refresh Rate: 144 Hz
    Flags 1.x: 0xe6 (MCCS)
    Flags 2.x: 0x0f
    Maximum luminance: 100 (436.203 cd/m^2)
    Minimum luminance: 47 (0.148 cd/m^2)
    Maximum luminance (without local dimming): 100 (436.203 cd/m^2)
    Minimum luminance (without local dimming): 47 (0.148 cd/m^2)
  Colorimetry Data Block:
    BT2020YCC
    BT2020RGB
  HDR Static Metadata Data Block:
    Electro optical transfer functions:
      Traditional gamma - SDR luminance range
      SMPTE ST2084
    Supported static metadata descriptors:
      Static metadata type 1
    Desired content max luminance: 100 (436.203 cd/m^2)
    Desired content max frame-average luminance: 100 (436.203 cd/m^2)
    Desired content min luminance: 47 (0.148 cd/m^2)
  YCbCr 4:2:0 Capability Map Data Block:
    VIC  97:  3840x2160   60.000000 Hz  16:9    135.000 kHz    594.000000 MHz
  Video Capability Data Block:
    YCbCr quantization: No Data
    RGB quantization: Selectable (via AVI Q)
    PT scan behavior: Always Underscanned
    IT scan behavior: Always Underscanned
    CE scan behavior: Always Underscanned
  Detailed Timing Descriptors:
    DTD 2:  2560x1440  143.856221 Hz  16:9    221.970 kHz    594.880000 MHz (597 mm x 336 mm)
                 Hfront   28 Hsync  32 Hback   60 Hpol P
                 Vfront   63 Vsync   8 Vback   32 Vpol N
    DTD 3:  2560x1440  119.997589 Hz  16:9    182.996 kHz    497.750000 MHz (597 mm x 336 mm)
                 Hfront   48 Hsync  32 Hback   80 Hpol P
                 Vfront    3 Vsync   5 Vback   77 Vpol N
    DTD 4:  1920x1080  143.999840 Hz  16:9    169.920 kHz    360.230000 MHz (597 mm x 336 mm)
                 Hfront   24 Hsync  16 Hback  160 Hpol P
                 Vfront    2 Vsync   5 Vback   93 Vpol P
Checksum: 0xcf

----------------

Block 2, Unknown EDID Extension Block 0x00:
  00 ff ff ff ff ff ff 00 06 b3 24 27 01 01 01 01 '..........$'....'
  2a 1f 01 03 80 3d 23 78 ee 73 d1 ac 4f 48 a5 27 '*....=#x.s..OH.''
  11 50 54 3f cf 00 d1 c0 81 80 95 00 b3 00 01 01 '.PT?............'
  01 01 01 01 01 01 69 5e 00 a0 a0 a0 29 50 30 20 '......i^....)P0 '
  b8 04 55 50 21 00 00 1a 00 00 00 fd 00 30 90 1e '..UP!........0..'
  f3 3c 00 0a 20 20 20 20 20 20 00 00 00 fc 00 58 '.<..      .....X'
  47 32 37 57 51 0a 20 20 20 20 20 20 00 00 00 ff 'G27WQ.      ....'
  00 4d 41 4c 4d 41 53 30 30 30 32 36 37 0a 01 29 '.MALMAS000267..)'
Checksum: 0x29

----------------

Block 3, CTA-861 Extension Block:
  Revision: 3
  Basic audio support
  Supports YCbCr 4:4:4
  Supports YCbCr 4:2:2
  Native detailed modes: 1
  Video Data Block:
    VIC   2:   720x480    59.940060 Hz   4:3     31.469 kHz     27.000000 MHz
    VIC   3:   720x480    59.940060 Hz  16:9     31.469 kHz     27.000000 MHz
    VIC  17:   720x576    50.000000 Hz   4:3     31.250 kHz     27.000000 MHz
    VIC  18:   720x576    50.000000 Hz  16:9     31.250 kHz     27.000000 MHz
    VIC  19:  1280x720    50.000000 Hz  16:9     37.500 kHz     74.250000 MHz
    VIC   4:  1280x720    60.000000 Hz  16:9     45.000 kHz     74.250000 MHz
    VIC  16:  1920x1080   60.000000 Hz  16:9     67.500 kHz    148.500000 MHz (native)
    VIC  31:  1920x1080   50.000000 Hz  16:9     56.250 kHz    148.500000 MHz
    VIC  64:  1920x1080  100.000000 Hz  16:9    112.500 kHz    297.000000 MHz
    VIC  63:  1920x1080  120.000000 Hz  16:9    135.000 kHz    297.000000 MHz
    VIC  97:  3840x2160   60.000000 Hz  16:9    135.000 kHz    594.000000 MHz
  Audio Data Block:
    Linear PCM:
      Max channels: 2
      Supported sample rates (kHz): 96 48 44.1 32
      Supported sample sizes (bits): 24 20 16
  Speaker Allocation Data Block:
    FL/FR - Front Left/Right
  Vendor-Specific Data Block (HDMI), OUI 00-0C-03:
    Source physical address: 1.0.0.0
    DC_36bit
    DC_30bit
    DC_Y444
    Maximum TMDS clock: 300 MHz
  Vendor-Specific Data Block (HDMI Forum), OUI C4-5D-D8:
    Version: 1
    Maximum TMDS Character Rate: 600 MHz
    SCDC Present
    Supports 12-bits/component Deep Color 4:2:0 Pixel Encoding
    Supports 10-bits/component Deep Color 4:2:0 Pixel Encoding
  Vendor-Specific Data Block (AMD), OUI 00-00-1A:
    Version: 2.3
    Minimum Refresh Rate: 48 Hz
    Maximum Refresh Rate: 144 Hz
    Flags 1.x: 0xe6 (MCCS)
    Flags 2.x: 0x0f
    Maximum luminance: 100 (436.203 cd/m^2)
    Minimum luminance: 47 (0.148 cd/m^2)
    Maximum luminance (without local dimming): 100 (436.203 cd/m^2)
    Minimum luminance (without local dimming): 47 (0.148 cd/m^2)
  Colorimetry Data Block:
    BT2020YCC
    BT2020RGB
  HDR Static Metadata Data Block:
    Electro optical transfer functions:
      Traditional gamma - SDR luminance range
      SMPTE ST2084
    Supported static metadata descriptors:
      Static metadata type 1
    Desired content max luminance: 100 (436.203 cd/m^2)
    Desired content max frame-average luminance: 100 (436.203 cd/m^2)
    Desired content min luminance: 47 (0.148 cd/m^2)
  YCbCr 4:2:0 Capability Map Data Block:
    VIC  97:  3840x2160   60.000000 Hz  16:9    135.000 kHz    594.000000 MHz
  Video Capability Data Block:
    YCbCr quantization: No Data
    RGB quantization: Selectable (via AVI Q)
    PT scan behavior: Always Underscanned
    IT scan behavior: Always Underscanned
    CE scan behavior: Always Underscanned
  Detailed Timing Descriptors:
    DTD 5:  2560x1440  143.856221 Hz  16:9    221.970 kHz    594.880000 MHz (597 mm x 336 mm)
                 Hfront   28 Hsync  32 Hback   60 Hpol P
                 Vfront   63 Vsync   8 Vback   32 Vpol N
    DTD 6:  2560x1440  119.997589 Hz  16:9    182.996 kHz    497.750000 MHz (597 mm x 336 mm)
                 Hfront   48 Hsync  32 Hback   80 Hpol P
                 Vfront    3 Vsync   5 Vback   77 Vpol N
    DTD 7:  1920x1080  143.999840 Hz  16:9    169.920 kHz    360.230000 MHz (597 mm x 336 mm)
                 Hfront   24 Hsync  16 Hback  160 Hpol P
                 Vfront    2 Vsync   5 Vback   93 Vpol P
Checksum: 0xcf

----------------

Warnings:

Block 1, CTA-861 Extension Block:
  IT Video Formats are overscanned by default, but normally this should be underscanned.
  Video Capability Data Block: Set Selectable YCbCr Quantization to avoid interop issues.
  Video Capability Data Block: S_PT is equal to S_IT and S_CE, so should be set to 0 instead.
  Display Product Serial Number is set, so the Serial Number in the Base EDID should be 0.
Block 3, CTA-861 Extension Block:
  IT Video Formats are overscanned by default, but normally this should be underscanned.
  Video Capability Data Block: Set Selectable YCbCr Quantization to avoid interop issues.
  Video Capability Data Block: S_PT is equal to S_IT and S_CE, so should be set to 0 instead.
  Display Product Serial Number is set, so the Serial Number in the Base EDID should be 0.

Failures:

Block 0, Base EDID:
  Basic Display Parameters & Features: sRGB is signaled, but the chromaticities do not match.
  Detailed Timing Descriptor #1: Mismatch of image size 597x336 mm vs display size 610x350 mm.
Block 1, CTA-861 Extension Block:
  Video Capability Data Block: IT video formats are always underscanned, but bit 7 of Byte 3 of the CTA-861 Extension header is set to overscanned.
  Detailed Timing Descriptor #2: Mismatch of image size 597x336 mm vs display size 610x350 mm.
  Detailed Timing Descriptor #3: Mismatch of image size 597x336 mm vs display size 610x350 mm.
  Detailed Timing Descriptor #4: Mismatch of image size 597x336 mm vs display size 610x350 mm.
Block 2, Base EDID:
  Unknown Extension Block.
Block 3, CTA-861 Extension Block:
  Video Data Block: Duplicate VIC 2.
  Video Data Block: Duplicate VIC 3.
  Video Data Block: Duplicate VIC 17.
  Video Data Block: Duplicate VIC 18.
  Video Data Block: Duplicate VIC 19.
  Video Data Block: Duplicate VIC 4.
  Video Data Block: Duplicate VIC 16.
  Video Data Block: Duplicate VIC 31.
  Video Data Block: Duplicate VIC 64.
  Video Data Block: Duplicate VIC 63.
  Video Data Block: Duplicate VIC 97.
  Speaker Allocation Data Block: Only one instance of this Data Block is allowed.
  Vendor-Specific Data Block (HDMI Forum), OUI C4-5D-D8: Duplicate HDMI Forum VSDB/SCDB.
  Colorimetry Data Block: Only one instance of this Data Block is allowed.
  HDR Static Metadata Data Block: Only one instance of this Data Block is allowed.
  YCbCr 4:2:0 Capability Map Data Block: Only one instance of this Data Block is allowed.
  Video Capability Data Block: Only one instance of this Data Block is allowed.
  Video Capability Data Block: IT video formats are always underscanned, but bit 7 of Byte 3 of the CTA-861 Extension header is set to overscanned.
  Detailed Timing Descriptor #5: Mismatch of image size 597x336 mm vs display size 610x350 mm.
  Detailed Timing Descriptor #6: Mismatch of image size 597x336 mm vs display size 610x350 mm.
  Detailed Timing Descriptor #7: Mismatch of image size 597x336 mm vs display size 610x350 mm.
EDID:
  Base EDID: EDID specified 1 extension block(s), but found 3 extension block(s).
  Base EDID: EDID 1.3 requires a Block Map Extension in Block 1 if there are more than 2 blocks in the EDID.
  CTA-861: Native progressive timings are a mix of several resolutions.

EDID conformity: FAIL
