edid-decode (hex):

00 ff ff ff ff ff ff 00 09 d1 07 78 45 54 00 00
07 12 01 03 0e 2b 1b 78 2e c4 f6 a3 57 4a 9c 23
11 4f 54 a5 6b 80 71 00 81 00 95 00 95 0f 81 80
81 40 b3 00 01 01 7c 2e 90 a0 60 1a 1e 40 30 20
36 00 b2 0e 11 00 00 1a 00 00 00 ff 00 56 32 38
32 30 34 37 36 53 4c 30 0a 20 00 00 00 fd 00 37
4c 1f 53 11 00 0a 20 20 20 20 20 20 00 00 00 fc
00 42 65 6e 51 20 47 32 30 30 30 57 0a 0a 00 b9

----------------

Block 0, Base EDID:
  EDID Structure Version & Revision: 1.3
  Vendor & Product Identification:
    Manufacturer: BNQ
    Model: 30727
    Serial Number: ...
    Made in: week 7 of 2008
  Basic Display Parameters & Features:
    Analog display
    Input voltage level: 0.7/0.3 V
    Sync: Separate Composite SyncOnGreen
    Maximum image size: 43 cm x 27 cm
    Gamma: 2.20
    DPMS levels: Off
    RGB color display
    Default (sRGB) color space is primary color space
    First detailed timing is preferred timing
  Color Characteristics:
    Red  : 0.6396, 0.3398
    Green: 0.2900, 0.6093
    Blue : 0.1396, 0.0693
    White: 0.3095, 0.3300
  Established Timings I & II:
    IBM     :   720x400    70.082 Hz   9:5    31.467 kHz  28.320 MHz
    DMT 0x04:   640x480    59.940 Hz   4:3    31.469 kHz  25.175 MHz
    DMT 0x06:   640x480    75.000 Hz   4:3    37.500 kHz  31.500 MHz
    DMT 0x09:   800x600    60.317 Hz   4:3    37.879 kHz  40.000 MHz
    DMT 0x0b:   800x600    75.000 Hz   4:3    46.875 kHz  49.500 MHz
    Apple   :   832x624    74.551 Hz   4:3    49.726 kHz  57.284 MHz
    DMT 0x10:  1024x768    60.004 Hz   4:3    48.363 kHz  65.000 MHz
    DMT 0x12:  1024x768    75.029 Hz   4:3    60.023 kHz  78.750 MHz
    DMT 0x24:  1280x1024   75.025 Hz   5:4    79.976 kHz 135.000 MHz
    Apple   :  1152x870    75.062 Hz 192:145  68.681 kHz 100.000 MHz
  Standard Timings:
    GTF     :  1152x720    60.000 Hz  16:10   44.760 kHz  67.319 MHz
    DMT 0x1c:  1280x800    59.810 Hz  16:10   49.702 kHz  83.500 MHz
    DMT 0x2f:  1440x900    59.887 Hz  16:10   55.935 kHz 106.500 MHz
    DMT 0x30:  1440x900    74.984 Hz  16:10   70.635 kHz 136.750 MHz
    DMT 0x23:  1280x1024   60.020 Hz   5:4    63.981 kHz 108.000 MHz
    DMT 0x20:  1280x960    60.000 Hz   4:3    60.000 kHz 108.000 MHz
    DMT 0x3a:  1680x1050   59.954 Hz  16:10   65.290 kHz 146.250 MHz
  Detailed Timing Descriptors:
    DTD 1:  1680x1050   59.883 Hz   8:5    64.674 kHz 119.000 MHz (434 mm x 270 mm)
                 Hfront   48 Hsync  32 Hback  80 Hpol P
                 Vfront    3 Vsync   6 Vback  21 Vpol N
    Display Product Serial Number: ...
  Display Range Limits:
    Monitor ranges (GTF): 55-76 Hz V, 31-83 kHz H, max dotclock 170 MHz
    Display Product Name: 'BenQ G2000W'
Checksum: 0xb9
