
EDID (hex):
00ffffffffffff0006afec2600000000
01130103802213780ad7759355558d29
24505400000001010101010101010101
0101010101010c1c56a0500010303020
360058c1100000180000000f00000000
00000000000000000020000000fe0041
554f0a202020202020202020000000fe
004231353658573032205636200a0065

Extracted contents:
header:          00 ff ff ff ff ff ff 00
serial number:   06 af ec 26 00 00 00 00 01 13
version:         01 03
basic params:    80 22 13 78 0a
chroma info:     d7 75 93 55 55 8d 29 24 50 54
established:     00 00 00
standard:        01 01 01 01 01 01 01 01 01 01 01 01 01 01 01 01
descriptor 1:    0c 1c 56 a0 50 00 10 30 30 20 36 00 58 c1 10 00 00 18
descriptor 2:    00 00 00 0f 00 00 00 00 00 00 00 00 00 00 00 00 00 20
descriptor 3:    00 00 00 fe 00 41 55 4f 0a 20 20 20 20 20 20 20 20 20
descriptor 4:    00 00 00 fe 00 42 31 35 36 58 57 30 32 20 56 36 20 0a
extensions:      00
checksum:        65

EDID version: 1.3
Manufacturer: AUO Model 26ec Serial Number --
Made in week 1 of 2009
Digital display
Maximum image size: 34 cm x 19 cm
Gamma: 2.20
RGB color display
First detailed timing is preferred timing
Display x,y Chromaticity:
  Red:   0.5771, 0.3330
  Green: 0.3330, 0.5537
  Blue:  0.1611, 0.1435
  White: 0.3134, 0.3291
Established timings supported:
Standard timings supported:
Detailed mode: Clock 71.800 MHz, 344 mm x 193 mm
               1366 1414 1446 1526 hborder 0
                768  771  777  784 vborder 0
               -hsync -vsync 
               VertFreq: 60 Hz, HorFreq: 47051 Hz
Manufacturer-specified data, tag 15
ASCII string: AUO
ASCII string: B156XW02 V6 
Checksum: 0x65 (valid)
EDID block does NOT conform to EDID 1.3!
	Missing name descriptor
	Missing monitor ranges
