
EDID (hex):
00ffffffffffff001ab3a30701000000
35120103682b1a782ac905a3574b9c25
125054a54a0081c00101010101010101
010101010101662156aa51001e30468f
3300aeff1000001e000000fd00324b1c
5210000a202020202020000000fc004c
4c2033313930540a20202020000000ff
00594538473136353838370a20200059

Extracted contents:
header:          00 ff ff ff ff ff ff 00
serial number:   1a b3 a3 07 01 00 00 00 35 12
version:         01 03
basic params:    68 2b 1a 78 2a
chroma info:     c9 05 a3 57 4b 9c 25 12 50 54
established:     a5 4a 00
standard:        81 c0 01 01 01 01 01 01 01 01 01 01 01 01 01 01
descriptor 1:    66 21 56 aa 51 00 1e 30 46 8f 33 00 ae ff 10 00 00 1e
descriptor 2:    00 00 00 fd 00 32 4b 1c 52 10 00 0a 20 20 20 20 20 20
descriptor 3:    00 00 00 fc 00 4c 4c 20 33 31 39 30 54 0a 20 20 20 20
descriptor 4:    00 00 00 ff 00 59 45 38 47 31 36 35 38 38 37 0a 20 20
extensions:      00
checksum:        59

EDID version: 1.3
Manufacturer: FUS Model 7a3 Serial Number --
Made in week 53 of 2008
Analog display, Input voltage level: 0.7/0.7 V
Sync: Separate 
Maximum image size: 43 cm x 26 cm
Gamma: 2.20
DPMS levels: Off
RGB color display
First detailed timing is preferred timing
Display x,y Chromaticity:
  Red:   0.6396, 0.3398
  Green: 0.2949, 0.6103
  Blue:  0.1445, 0.0703
  White: 0.3134, 0.3291
Established timings supported:
  720x400@70Hz 9:5 HorFreq: 31469 Hz Clock: 28.320 MHz
  640x480@60Hz 4:3 HorFreq: 31469 Hz Clock: 25.175 MHz
  640x480@75Hz 4:3 HorFreq: 37500 Hz Clock: 31.500 MHz
  800x600@60Hz 4:3 HorFreq: 37900 Hz Clock: 40.000 MHz
  800x600@75Hz 4:3 HorFreq: 46900 Hz Clock: 49.500 MHz
  1024x768@60Hz 4:3 HorFreq: 48400 Hz Clock: 65.000 MHz
  1024x768@75Hz 4:3 HorFreq: 60000 Hz Clock: 78.750 MHz
Standard timings supported:
  1280x720@60Hz 16:9
Detailed mode: Clock 85.500 MHz, 430 mm x 255 mm
               1366 1436 1579 1792 hborder 0
                768  771  774  798 vborder 0
               +hsync +vsync 
               VertFreq: 59 Hz, HorFreq: 47712 Hz
Monitor ranges (GTF): 50-75Hz V, 28-82kHz H, max dotclock 160MHz
Monitor name: LL 3190T
Serial number: --
Checksum: 0x59 (valid)
