
EDID (hex):
00ffffffffffff002685166500000000
03190104003c22780a3d25a35951a025
0f505421080081c08180a940d1c0b300
90409500a9c064190040410026301888
360000c010000018662156aa51001e30
468f330055c01000001e000000fc0044
503256474120563232320a20302a0008
52c028306070130040f01000001e00ec

Extracted contents:
header:          00 ff ff ff ff ff ff 00
serial number:   26 85 16 65 00 00 00 00 03 19
version:         01 04
basic params:    00 3c 22 78 0a
chroma info:     3d 25 a3 59 51 a0 25 0f 50 54
established:     21 08 00
standard:        81 c0 81 80 a9 40 d1 c0 b3 00 90 40 95 00 a9 c0
descriptor 1:    64 19 00 40 41 00 26 30 18 88 36 00 00 c0 10 00 00 18
descriptor 2:    66 21 56 aa 51 00 1e 30 46 8f 33 00 55 c0 10 00 00 1e
descriptor 3:    00 00 00 fc 00 44 50 32 56 47 41 20 56 32 32 32 0a 20
descriptor 4:    30 2a 00 08 52 c0 28 30 60 70 13 00 40 f0 10 00 00 1e
extensions:      00
checksum:        ec

EDID version: 1.4
Manufacturer: ITE Model 6516 Serial Number --
Made in week 3 of 2015
Analog display, Input voltage level: 0.7/0.3 V
Blank level equals black level
Sync: 
Maximum image size: 60 cm x 34 cm
Gamma: 2.20
RGB color display
First detailed timing includes the native pixel format and preferred refresh rate
Display x,y Chromaticity:
  Red:   0.6367, 0.3505
  Green: 0.3193, 0.6259
  Blue:  0.1445, 0.0605
  White: 0.3134, 0.3291
Established timings supported:
  640x480@60Hz 4:3 HorFreq: 31469 Hz Clock: 25.175 MHz
  800x600@60Hz 4:3 HorFreq: 37900 Hz Clock: 40.000 MHz
  1024x768@60Hz 4:3 HorFreq: 48400 Hz Clock: 65.000 MHz
Standard timings supported:
  1280x720@60Hz 16:9
  1280x1024@60Hz 5:4 HorFreq: 64000 Hz Clock: 108.000 MHz
  1600x1200@60Hz 4:3 HorFreq: 75000 Hz Clock: 162.000 MHz
  1920x1080@60Hz 16:9
  1680x1050@60Hz 16:10 HorFreq: 64700 Hz Clock: 119.000 MHz
  1400x1050@60Hz 4:3 HorFreq: 64700 Hz Clock: 101.000 MHz
  1440x900@60Hz 16:10 HorFreq: 55500 Hz Clock: 88.750 MHz
  1600x900@60Hz 16:9
Detailed mode: Clock 65.000 MHz, 256 mm x 192 mm
               1024 1048 1184 1344 hborder 0
                768  771  777  806 vborder 0
               -hsync -vsync 
               VertFreq: 60 Hz, HorFreq: 48363 Hz
Detailed mode: Clock 85.500 MHz, 341 mm x 192 mm
               1366 1436 1579 1792 hborder 0
                768  771  774  798 vborder 0
               +hsync +vsync 
               VertFreq: 59 Hz, HorFreq: 47712 Hz
Monitor name: DP2VGA V222
Detailed mode: Clock 108.000 MHz, 320 mm x 240 mm
               1280 1376 1488 1800 hborder 0
                960  961  964 1000 vborder 0
               +hsync +vsync 
               VertFreq: 60 Hz, HorFreq: 60000 Hz
Checksum: 0xec (valid)
	Missing monitor ranges
EDID block does not conform at all!
	Invalid detailed timing descriptor ordering
