
EDID (hex):
00ffffffffffff00410c83c0a7520000
021601036e291a782aa150a3574c9d25
115054bd4b009500950f81c081800101
010101010101ab22a0a050841a303020
360098ff1000001a000000ff00554b39
31323032303231313539000000fc0050
68696c69707320313930454c000000fd
00384c1e530e000a20202020202000aa

Extracted contents:
header:          00 ff ff ff ff ff ff 00
serial number:   41 0c 83 c0 a7 52 00 00 02 16
version:         01 03
basic params:    6e 29 1a 78 2a
chroma info:     a1 50 a3 57 4c 9d 25 11 50 54
established:     bd 4b 00
standard:        95 00 95 0f 81 c0 81 80 01 01 01 01 01 01 01 01
descriptor 1:    ab 22 a0 a0 50 84 1a 30 30 20 36 00 98 ff 10 00 00 1a
descriptor 2:    00 00 00 ff 00 55 4b 39 31 32 30 32 30 32 31 31 35 39
descriptor 3:    00 00 00 fc 00 50 68 69 6c 69 70 73 20 31 39 30 45 4c
descriptor 4:    00 00 00 fd 00 38 4c 1e 53 0e 00 0a 20 20 20 20 20 20
extensions:      00
checksum:        aa

EDID version: 1.3
Manufacturer: PHL Model c083 Serial Number --
Made in week 2 of 2012
Analog display, Input voltage level: 0.7/0.7 V
Sync: Separate Composite SyncOnGreen 
Maximum image size: 41 cm x 26 cm
Gamma: 2.20
DPMS levels: Off
RGB color display
First detailed timing is preferred timing
Display x,y Chromaticity:
  Red:   0.6386, 0.3417
  Green: 0.2968, 0.6142
  Blue:  0.1455, 0.0673
  White: 0.3125, 0.3281
Established timings supported:
  720x400@70Hz 9:5 HorFreq: 31469 Hz Clock: 28.320 MHz
  640x480@60Hz 4:3 HorFreq: 31469 Hz Clock: 25.175 MHz
  640x480@67Hz 4:3 HorFreq: 35000 Hz Clock: 30.240 MHz
  640x480@72Hz 4:3 HorFreq: 37900 Hz Clock: 31.500 MHz
  640x480@75Hz 4:3 HorFreq: 37500 Hz Clock: 31.500 MHz
  800x600@60Hz 4:3 HorFreq: 37900 Hz Clock: 40.000 MHz
  800x600@75Hz 4:3 HorFreq: 46900 Hz Clock: 49.500 MHz
  1024x768@60Hz 4:3 HorFreq: 48400 Hz Clock: 65.000 MHz
  1024x768@75Hz 4:3 HorFreq: 60000 Hz Clock: 78.750 MHz
  1280x1024@75Hz 5:4 HorFreq: 80000 Hz Clock: 135.000 MHz
Standard timings supported:
  1440x900@60Hz 16:10 HorFreq: 55500 Hz Clock: 88.750 MHz
  1440x900@75Hz 16:10 HorFreq: 82300 Hz Clock: 156.000 MHz
  1280x720@60Hz 16:9
  1280x1024@60Hz 5:4 HorFreq: 64000 Hz Clock: 108.000 MHz
Detailed mode: Clock 88.750 MHz, 408 mm x 255 mm
               1440 1488 1520 1600 hborder 0
                900  903  909  926 vborder 0
               +hsync -vsync 
               VertFreq: 59 Hz, HorFreq: 55468 Hz
Serial number: --
Monitor ranges (GTF): 56-76Hz V, 30-83kHz H, max dotclock 140MHz
Checksum: 0xaa (valid)
EDID block does NOT conform to EDID 1.3!
	Name descriptor not terminated with a newline
One or more of the timings is out of range of the Monitor Ranges:
  Vertical Freq: 59 - 75 Hz
  Horizontal Freq: 31469 - 82300 Hz
  Maximum Clock: 156.000 MHz
