edid-decode (hex):

00 ff ff ff ff ff ff 00 30 e4 47 02 00 00 00 00
00 13 01 03 80 1f 11 78 0a 4a 05 9e 5b 54 95 25
18 50 54 00 00 00 01 01 01 01 01 01 01 01 01 01
01 01 01 01 01 01 3e 1c 56 a0 50 00 16 30 30 20
35 00 36 ae 10 00 00 19 3e 1c 56 a0 50 00 16 30
30 20 35 00 36 ae 10 00 00 19 00 00 00 fe 00 54
39 31 38 52 80 31 34 30 57 48 31 0a 00 00 00 00
00 ff ff ff ff ff ff ff ff 01 01 0a 20 20 00 d5

----------------

Block 0, Base EDID:
  EDID Structure Version & Revision: 1.3
  Vendor & Product Identification:
    Manufacturer: LGD
    Model: 583
    Made in: 2009
  Basic Display Parameters & Features:
    Digital display
    Maximum image size: 31 cm x 17 cm
    Gamma: 2.20
    RGB color display
    First detailed timing is the preferred timing
  Color Characteristics:
    Red  : 0.6181, 0.3554
    Green: 0.3300, 0.5839
    Blue : 0.1445, 0.0937
    White: 0.3134, 0.3291
  Established Timings I & II: none
  Standard Timings: none
  Detailed Timing Descriptors:
    DTD 1:  1366x768    59.973124 Hz 683:384   47.379 kHz     72.300000 MHz (310 mm x 174 mm)
                 Hfront   48 Hsync  32 Hback   80 Hpol N
                 Vfront    3 Vsync   5 Vback   14 Vpol N
    DTD 2:  1366x768    59.973124 Hz 683:384   47.379 kHz     72.300000 MHz (310 mm x 174 mm)
                 Hfront   48 Hsync  32 Hback   80 Hpol N
                 Vfront    3 Vsync   5 Vback   14 Vpol N
    Alphanumeric Data String: 'T918R'
    Manufacturer-Specified Display Descriptor (0x00): 00 00 00 ff ff ff ff ff ff ff ff 01 01 0a 20 20 '..............  '
Checksum: 0xd5

----------------

Failures:

Block 0, Base EDID:
  Alphanumeric Data String: Non-printable character.
  Missing Display Product Name.
  Missing Display Range Limits Descriptor.

EDID conformity: FAIL
