
EDID (hex):
00ffffffffffff0015c3251701010101
2413010280261f78eaa7efa6544a9e23
144c50a1080081800101010101010101
010101010101302a009851002a403070
1300792e1100001e000000ff00363438
30333039390a20202020000000fd003b
3d1e410b000a202020202020000000fc
005231320a20202020202020202000a0

Extracted contents:
header:          00 ff ff ff ff ff ff 00
serial number:   15 c3 25 17 01 01 01 01 24 13
version:         01 02
basic params:    80 26 1f 78 ea
chroma info:     a7 ef a6 54 4a 9e 23 14 4c 50
established:     a1 08 00
standard:        81 80 01 01 01 01 01 01 01 01 01 01 01 01 01 01
descriptor 1:    30 2a 00 98 51 00 2a 40 30 70 13 00 79 2e 11 00 00 1e
descriptor 2:    00 00 00 ff 00 36 34 38 30 33 30 39 39 0a 20 20 20 20
descriptor 3:    00 00 00 fd 00 3b 3d 1e 41 0b 00 0a 20 20 20 20 20 20
descriptor 4:    00 00 00 fc 00 52 31 32 0a 20 20 20 20 20 20 20 20 20
extensions:      00
checksum:        a0

EDID version: 1.2
Manufacturer: ENC Model 1725 Serial Number --
Made in week 36 of 2009
Digital display
Maximum image size: 38 cm x 31 cm
Gamma: 2.20
DPMS levels: Standby Suspend Off
RGB color display
First detailed timing is preferred timing
Display x,y Chromaticity:
  Red:   0.6503, 0.3300
  Green: 0.2900, 0.6201
  Blue:  0.1396, 0.0800
  White: 0.2998, 0.3154
Established timings supported:
  720x400@70Hz 9:5 HorFreq: 31469 Hz Clock: 28.320 MHz
  640x480@60Hz 4:3 HorFreq: 31469 Hz Clock: 25.175 MHz
  800x600@60Hz 4:3 HorFreq: 37900 Hz Clock: 40.000 MHz
  1024x768@60Hz 4:3 HorFreq: 48400 Hz Clock: 65.000 MHz
Standard timings supported:
  1280x1024@60Hz 5:4 HorFreq: 64000 Hz Clock: 108.000 MHz
Detailed mode: Clock 108.000 MHz, 377 mm x 302 mm
               1280 1328 1440 1688 hborder 0
               1024 1025 1028 1066 vborder 0
               +hsync +vsync 
               VertFreq: 60 Hz, HorFreq: 63981 Hz
Serial number: --
Monitor ranges (GTF): 59-61Hz V, 30-65kHz H, max dotclock 110MHz
Monitor name: R12
Checksum: 0xa0 (valid)
One or more of the timings is out of range of the Monitor Ranges:
  Vertical Freq: 60 - 70 Hz
  Horizontal Freq: 31469 - 64000 Hz
  Maximum Clock: 108.000 MHz
