
EDID (hex):
00ffffffffffff004c83714100000000
231e0104b51e1378020cf1ae523cb923
0c505400000001010101010101010101
010101010101a4c34050b00850700820
88002ebd1000001ba4c34050b008fc73
082088002ebd1000001b0000000f00ff
0a5aff0a3c28800100000000000000fe
0041544e413430594b30372d31200181
02030f00e3058000e606050174600700
00000000000000000000000000000000
00000000000000000000000000000000
00000000000000000000000000000000
00000000000000000000000000000000
00000000000000000000000000000000
00000000000000000000000000000000
000000000000000000000000000000b7

Extracted contents:
header:          00 ff ff ff ff ff ff 00
serial number:   4c 83 71 41 00 00 00 00 23 1e
version:         01 04
basic params:    b5 1e 13 78 02
chroma info:     0c f1 ae 52 3c b9 23 0c 50 54
established:     00 00 00
standard:        01 01 01 01 01 01 01 01 01 01 01 01 01 01 01 01
descriptor 1:    a4 c3 40 50 b0 08 50 70 08 20 88 00 2e bd 10 00 00 1b
descriptor 2:    a4 c3 40 50 b0 08 fc 73 08 20 88 00 2e bd 10 00 00 1b
descriptor 3:    00 00 00 0f 00 ff 0a 5a ff 0a 3c 28 80 01 00 00 00 00
descriptor 4:    00 00 00 fe 00 41 54 4e 41 34 30 59 4b 30 37 2d 31 20
extensions:      01
checksum:        81

EDID version: 1.4
Manufacturer: SDC Model 4171 Serial Number --
Made in week 35 of 2020
Digital display
10 bits per primary color channel
DisplayPort interface
Maximum image size: 30 cm x 19 cm
Gamma: 2.20
Supported color formats: RGB 4:4:4
First detailed timing includes the native pixel format and preferred refresh rate
Display x,y Chromaticity:
  Red:   0.6796, 0.3203
  Green: 0.2373, 0.7226
  Blue:  0.1396, 0.0498
  White: 0.3125, 0.3291
Established timings supported:
Standard timings supported:
Detailed mode: Clock 500.840 MHz, 302 mm x 189 mm
               2880 2888 2920 2960 hborder 0
               1800 1808 1816 1880 vborder 0
               +hsync -vsync 
               VertFreq: 90 Hz, HorFreq: 169202 Hz
Detailed mode: Clock 500.840 MHz, 302 mm x 189 mm
               2880 2888 2920 2960 hborder 0
               1800 1808 1816 2820 vborder 0
               +hsync -vsync 
               VertFreq: 60 Hz, HorFreq: 169202 Hz
Manufacturer-specified data, tag 15
ASCII string: ATNA40YK07-1 
Has 1 extension blocks
Checksum: 0x81 (valid)

CTA extension block
Extension version: 3
11 bytes of CTA data
  Extended tag: Colorimetry data block
    BT2020RGB
  Extended tag: HDR static metadata data block
    Electro optical transfer functions:
      Traditional gamma - SDR luminance range
      SMPTE ST2084
    Supported static metadata descriptors:
      Static metadata type 1
    Desired content max luminance: 116 (616.884 cd/m^2)
    Desired content max frame-average luminance: 96 (400.000 cd/m^2)
    Desired content min luminance: 7 (0.005 cd/m^2)
0 native detailed modes
Checksum: 0xb7 (valid)

EDID block does NOT conform to EDID 1.4!
	Required 640x480p60 timings are missing in the established timings
	and/or in the SVD list (VIC 1)
	Missing name descriptor
	Missing monitor ranges


