
EDID (hex):
00ffffffffffff0030e4bd0500000000
001b0104a51d1078eb23f5a251479c27
10505400000001010101010101010101
0101010101014dd000a0f0703e803020
350025a51000001b000000fd001e3c85
8536010a202020202020000000000000
00000000000000000000000000000002
000c2dff0a3caa27153aaa0000000001

Extracted contents:
header:          00 ff ff ff ff ff ff 00
serial number:   30 e4 bd 05 00 00 00 00 00 1b
version:         01 04
basic params:    a5 1d 10 78 eb
chroma info:     23 f5 a2 51 47 9c 27 10 50 54
established:     00 00 00
standard:        01 01 01 01 01 01 01 01 01 01 01 01 01 01 01 01
descriptor 1:    4d d0 00 a0 f0 70 3e 80 30 20 35 00 25 a5 10 00 00 1b
descriptor 2:    00 00 00 fd 00 1e 3c 85 85 36 01 0a 20 20 20 20 20 20
descriptor 3:    00 00 00 00 00 00 00 00 00 00 00 00 00 00 00 00 00 00
descriptor 4:    00 00 00 02 00 0c 2d ff 0a 3c aa 27 15 3a aa 00 00 00
extensions:      00
checksum:        01

EDID version: 1.4
Manufacturer: LGD Model 5bd Serial Number --
Made in year 2017
Digital display
8 bits per primary color channel
DisplayPort interface
Maximum image size: 29 cm x 16 cm
Gamma: 2.20
DPMS levels: Standby Suspend Off
Supported color formats: RGB 4:4:4, YCrCb 4:4:4
First detailed timing includes the native pixel format and preferred refresh rate
Display is continuous frequency
Display x,y Chromaticity:
  Red:   0.6328, 0.3183
  Green: 0.2773, 0.6123
  Blue:  0.1552, 0.0654
  White: 0.3134, 0.3291
Established timings supported:
Standard timings supported:
Detailed mode: Clock 533.250 MHz, 293 mm x 165 mm
               3840 3888 3920 4000 hborder 0
               2160 2163 2168 2222 vborder 0
               +hsync -vsync 
               VertFreq: 59 Hz, HorFreq: 133312 Hz
Monitor ranges (bare limits): 30-60Hz V, 133-133kHz H, max dotclock 540MHz
Manufacturer-specified data, tag 0
Manufacturer-specified data, tag 2
Checksum: 0x1 (valid)
EDID block does NOT conform to EDID 1.4!
	Missing name descriptor
Warning: One or more of the timings is out of range of the Monitor Ranges:
  Vertical Freq: 59 - 59 Hz
  Horizontal Freq: 133312 - 133312 Hz
  Maximum Clock: 533.250 MHz
