
EDID (hex):
00ffffffffffff003eb470020a1a0000
12180104a53c2278e2d6a5a2594a9524
145054afcf00810081409040a9c08180
81c09500b300023a801871382d40582c
450070cf1000001e0e1f008051001e30
3020370070cf1000001c662150b05100
1b3040703600c4fe1000001e000000fc
00416e616c6f670a20202020202000cf

Extracted contents:
header:          00 ff ff ff ff ff ff 00
serial number:   3e b4 70 02 0a 1a 00 00 12 18
version:         01 04
basic params:    a5 3c 22 78 e2
chroma info:     d6 a5 a2 59 4a 95 24 14 50 54
established:     af cf 00
standard:        81 00 81 40 90 40 a9 c0 81 80 81 c0 95 00 b3 00
descriptor 1:    02 3a 80 18 71 38 2d 40 58 2c 45 00 70 cf 10 00 00 1e
descriptor 2:    0e 1f 00 80 51 00 1e 30 30 20 37 00 70 cf 10 00 00 1c
descriptor 3:    66 21 50 b0 51 00 1b 30 40 70 36 00 c4 fe 10 00 00 1e
descriptor 4:    00 00 00 fc 00 41 6e 61 6c 6f 67 0a 20 20 20 20 20 20
extensions:      00
checksum:        cf

EDID version: 1.4
Manufacturer: OUT Model 270 Serial Number --
Made in week 18 of 2014
Digital display
8 bits per primary color channel
DisplayPort interface
Maximum image size: 60 cm x 34 cm
Gamma: 2.20
DPMS levels: Standby Suspend Off
Supported color formats: RGB 4:4:4
First detailed timing includes the native pixel format and preferred refresh rate
Display x,y Chromaticity:
  Red:   0.6357, 0.3486
  Green: 0.2900, 0.5839
  Blue:  0.1425, 0.0800
  White: 0.3134, 0.3291
Established timings supported:
  720x400@70Hz 9:5 HorFreq: 31469 Hz Clock: 28.320 MHz
  640x480@60Hz 4:3 HorFreq: 31469 Hz Clock: 25.175 MHz
  640x480@72Hz 4:3 HorFreq: 37900 Hz Clock: 31.500 MHz
  640x480@75Hz 4:3 HorFreq: 37500 Hz Clock: 31.500 MHz
  800x600@56Hz 4:3 HorFreq: 35200 Hz Clock: 36.000 MHz
  800x600@60Hz 4:3 HorFreq: 37900 Hz Clock: 40.000 MHz
  800x600@72Hz 4:3 HorFreq: 48100 Hz Clock: 50.000 MHz
  800x600@75Hz 4:3 HorFreq: 46900 Hz Clock: 49.500 MHz
  1024x768@60Hz 4:3 HorFreq: 48400 Hz Clock: 65.000 MHz
  1024x768@70Hz 4:3 HorFreq: 56500 Hz Clock: 75.000 MHz
  1024x768@75Hz 4:3 HorFreq: 60000 Hz Clock: 78.750 MHz
  1280x1024@75Hz 5:4 HorFreq: 80000 Hz Clock: 135.000 MHz
Standard timings supported:
  1280x800@60Hz 16:10
  1280x960@60Hz 4:3 HorFreq: 60000 Hz Clock: 108.000 MHz
  1400x1050@60Hz 4:3 HorFreq: 64700 Hz Clock: 101.000 MHz
  1600x900@60Hz 16:9
  1280x1024@60Hz 5:4 HorFreq: 64000 Hz Clock: 108.000 MHz
  1280x720@60Hz 16:9
  1440x900@60Hz 16:10 HorFreq: 55500 Hz Clock: 88.750 MHz
  1680x1050@60Hz 16:10 HorFreq: 64700 Hz Clock: 119.000 MHz
Detailed mode: Clock 148.500 MHz, 368 mm x 207 mm
               1920 2008 2052 2200 hborder 0
               1080 1084 1089 1125 vborder 0
               +hsync +vsync 
               VertFreq: 60 Hz, HorFreq: 67500 Hz
Detailed mode: Clock 79.500 MHz, 368 mm x 207 mm
               1280 1328 1360 1664 hborder 0
                768  771  778  798 vborder 0
               -hsync +vsync 
               VertFreq: 59 Hz, HorFreq: 47776 Hz
Detailed mode: Clock 85.500 MHz, 452 mm x 254 mm
               1360 1424 1536 1792 hborder 0
                768  771  777  795 vborder 0
               +hsync +vsync 
               VertFreq: 60 Hz, HorFreq: 47712 Hz
Monitor name: Analog
Checksum: 0xcf (valid)
	Missing monitor ranges
