
EDID (hex):
00ffffffffffff0009e5180600000000
01180104802213780afb0f955855912a
1e4f5600000001010101010101010101
010101010101641b5677500013303020
4400159c1000001a8417568051005c30
64644405159c1000001a000000000000
00000000000000000000000000000002
000c33ff0b3c6e19111e6e0000000098

Extracted contents:
header:          00 ff ff ff ff ff ff 00
serial number:   09 e5 18 06 00 00 00 00 01 18
version:         01 04
basic params:    80 22 13 78 0a
chroma info:     fb 0f 95 58 55 91 2a 1e 4f 56
established:     00 00 00
standard:        01 01 01 01 01 01 01 01 01 01 01 01 01 01 01 01
descriptor 1:    64 1b 56 77 50 00 13 30 30 20 44 00 15 9c 10 00 00 1a
descriptor 2:    84 17 56 80 51 00 5c 30 64 64 44 05 15 9c 10 00 00 1a
descriptor 3:    00 00 00 00 00 00 00 00 00 00 00 00 00 00 00 00 00 00
descriptor 4:    00 00 00 02 00 0c 33 ff 0b 3c 6e 19 11 1e 6e 00 00 00
extensions:      00
checksum:        98

EDID version: 1.4
Manufacturer: BOE Model 618 Serial Number --
Made in week 1 of 2014
Digital display
Color depth is undefined
Digital interface is not defined
Maximum image size: 34 cm x 19 cm
Gamma: 2.20
Supported color formats: RGB 4:4:4, YCrCb 4:4:4
First detailed timing includes the native pixel format and preferred refresh rate
Display x,y Chromaticity:
  Red:   0.5849, 0.3466
  Green: 0.3339, 0.5693
  Blue:  0.1640, 0.1171
  White: 0.3115, 0.3388
Established timings supported:
Standard timings supported:
Detailed mode: Clock 70.120 MHz, 277 mm x 156 mm
               1366 1414 1446 1485 hborder 0
                768  772  776  787 vborder 0
               +hsync -vsync 
               VertFreq: 59 Hz, HorFreq: 47218 Hz
Detailed mode: Clock 60.200 MHz, 277 mm x 156 mm
               1366 1466 1566 1750 hborder 0
                768  788  808  860 vborder 0
               +hsync -vsync 
               VertFreq: 40 Hz, HorFreq: 34400 Hz
Manufacturer-specified data, tag 0
Manufacturer-specified data, tag 2
Checksum: 0x98 (valid)
EDID block does NOT conform to EDID 1.4!
	Missing name descriptor
	Missing monitor ranges
