edid-decode (hex):

00 ff ff ff ff ff ff 00 21 63 93 33 01 01 01 01
24 17 01 03 80 34 1d 78 0a 01 c1 a0 57 47 98 27
12 4c 4c a1 08 00 31 40 45 40 61 40 81 80 01 01
01 01 01 01 01 01 02 3a 80 18 71 38 2d 40 58 2c
46 00 40 84 63 00 00 1e 4c 1d 00 72 51 d0 1e 20
6e 28 55 00 40 84 63 00 00 1e 00 00 00 fc 00 4c
43 44 54 56 0a 20 20 20 20 20 20 20 00 00 00 fd
00 30 3e 0e 44 0f 00 0a 20 20 20 20 20 20 01 17

----------------

Block 0, Base EDID:
  EDID Structure Version & Revision: 1.3
  Vendor & Product Identification:
    Manufacturer: HKC
    Model: 13203
    Serial Number: ...
    Made in: week 36 of 2013
  Basic Display Parameters & Features:
    Digital display
    Maximum image size: 52 cm x 29 cm
    Gamma: 2.20
    RGB color display
    First detailed timing is the preferred timing
  Color Characteristics:
    Red  : 0.6250, 0.3398
    Green: 0.2773, 0.5947
    Blue : 0.1552, 0.0703
    White: 0.2968, 0.2978
  Established Timings I & II:
    IBM     :   720x400    70.082 Hz   9:5    31.467 kHz  28.320 MHz
    DMT 0x04:   640x480    59.940 Hz   4:3    31.469 kHz  25.175 MHz
    DMT 0x09:   800x600    60.317 Hz   4:3    37.879 kHz  40.000 MHz
    DMT 0x10:  1024x768    60.004 Hz   4:3    48.363 kHz  65.000 MHz
  Standard Timings:
    DMT 0x04:   640x480    59.940 Hz   4:3    31.469 kHz  25.175 MHz
    DMT 0x09:   800x600    60.317 Hz   4:3    37.879 kHz  40.000 MHz
    DMT 0x10:  1024x768    60.004 Hz   4:3    48.363 kHz  65.000 MHz
    DMT 0x23:  1280x1024   60.020 Hz   5:4    63.981 kHz 108.000 MHz
  Detailed Timing Descriptors:
    DTD 1:  1920x1080   60.000 Hz  16:9    67.500 kHz 148.500 MHz (1600 mm x 900 mm)
                 Hfront   88 Hsync  44 Hback 148 Hpol P
                 Vfront    4 Vsync   6 Vback  35 Vpol P
    DTD 2:  1280x720    60.606 Hz  16:9    45.455 kHz  75.000 MHz (1600 mm x 900 mm)
                 Hfront  110 Hsync  40 Hback 220 Hpol P
                 Vfront    5 Vsync   5 Vback  20 Vpol P
    Display Product Name: 'LCDTV'
  Display Range Limits:
    Monitor ranges (GTF): 48-62 Hz V, 14-68 kHz H, max dotclock 150 MHz
  Extension blocks: 1
Checksum: 0x17

----------------

Failures:

Block 0, Base EDID:
  Detailed Timing Descriptor #1: Mismatch of image size 1600x900 mm vs display size 520x290 mm.
  Detailed Timing Descriptor #2: Mismatch of image size 1600x900 mm vs display size 520x290 mm.
  Base EDID: EDID specified 1 extension block(s), but found 0 extension block(s).
EDID:
  Base EDID: Some timings are out of range of the Monitor Ranges:
    Vertical Freq: 59.940 - 70.082 Hz (Monitor: 48.000 - 62.000 Hz)

EDID conformity: FAIL
