edid-decode (hex):

00 ff ff ff ff ff ff 00 1d 85 01 11 01 00 00 00
20 1f 01 03 80 2b 1b 6d ef c5 c6 a3 57 4a 9c 23
12 4f 54 23 08 00 01 01 01 01 01 01 01 01 01 01
01 01 01 01 01 01 02 3a 80 18 71 38 2d 40 58 2c
45 00 c0 6c 00 00 00 1e 20 1c 56 86 50 00 20 30
0e 38 13 00 06 44 21 00 00 1e 00 00 00 fd 00 31
4c 1e 55 12 00 0a 20 20 20 20 20 20 00 00 00 fc
00 4c 43 44 20 4d 4f 4e 49 54 4f 52 20 20 01 b6

02 03 16 71 43 90 04 02 23 09 7f 07 83 01 00 00
65 03 0c 00 10 00 02 3a 80 18 71 38 2d 40 58 2c
45 00 d7 40 32 00 00 1e 00 00 00 00 00 00 00 00
00 00 00 00 00 00 00 00 00 00 00 00 00 00 00 00
00 00 00 00 00 00 00 00 00 00 00 00 00 00 00 00
00 00 00 00 00 00 00 00 00 00 00 00 00 00 00 00
00 00 00 00 00 00 00 00 00 00 00 00 00 00 00 00
00 00 00 00 00 00 00 00 00 00 00 00 00 00 00 c7

00 ff ff ff ff ff ff 00 1d 85 01 11 01 00 00 00
20 1f 01 03 80 2b 1b 6d ef c5 c6 a3 57 4a 9c 23
12 4f 54 23 08 00 01 01 01 01 01 01 01 01 01 01
01 01 01 01 01 01 02 3a 80 18 71 38 2d 40 58 2c
45 00 c0 6c 00 00 00 1e 20 1c 56 86 50 00 20 30
0e 38 13 00 06 44 21 00 00 1e 00 00 00 fd 00 31
4c 1e 55 12 00 0a 20 20 20 20 20 20 00 00 00 fc
00 4c 43 44 20 4d 4f 4e 49 54 4f 52 20 20 01 b6

02 03 16 71 43 90 04 02 23 09 7f 07 83 01 00 00
65 03 0c 00 10 00 02 3a 80 18 71 38 2d 40 58 2c
45 00 d7 40 32 00 00 1e 00 00 00 00 00 00 00 00
00 00 00 00 00 00 00 00 00 00 00 00 00 00 00 00
00 00 00 00 00 00 00 00 00 00 00 00 00 00 00 00
00 00 00 00 00 00 00 00 00 00 00 00 00 00 00 00
00 00 00 00 00 00 00 00 00 00 00 00 00 00 00 00
00 00 00 00 00 00 00 00 00 00 00 00 00 00 00 c7

----------------

Block 0, Base EDID:
  EDID Structure Version & Revision: 1.3
  Vendor & Product Identification:
    Manufacturer: GLE
    Model: 4353
    Serial Number: ...
    Made in: week 32 of 2021
  Basic Display Parameters & Features:
    Digital display
    Maximum image size: 43 cm x 27 cm
    Gamma: 2.09
    DPMS levels: Standby Suspend Off
    RGB color display
    Default (sRGB) color space is primary color space
    First detailed timing is the preferred timing
    Supports GTF timings within operating range
  Color Characteristics:
    Red  : 0.6396, 0.3398
    Green: 0.2900, 0.6103
    Blue : 0.1396, 0.0703
    White: 0.3095, 0.3300
  Established Timings I & II:
    DMT 0x04:   640x480    59.940476 Hz   4:3     31.469 kHz     25.175000 MHz
    DMT 0x08:   800x600    56.250000 Hz   4:3     35.156 kHz     36.000000 MHz
    DMT 0x09:   800x600    60.316541 Hz   4:3     37.879 kHz     40.000000 MHz
    DMT 0x10:  1024x768    60.003840 Hz   4:3     48.363 kHz     65.000000 MHz
  Standard Timings: none
  Detailed Timing Descriptors:
    DTD 1:  1920x1080   60.000000 Hz  16:9     67.500 kHz    148.500000 MHz (192 mm x 108 mm)
                 Hfront   88 Hsync  44 Hback  148 Hpol P
                 Vfront    4 Vsync   5 Vback   36 Vpol P
    DTD 2:  1366x768    60.000000 Hz 683:384   48.000 kHz     72.000000 MHz (518 mm x 324 mm)
                 Hfront   14 Hsync  56 Hback   64 Hpol P
                 Vfront    1 Vsync   3 Vback   28 Vpol P
    Display Range Limits:
      Monitor ranges (GTF): 49-76 Hz V, 30-85 kHz H, max dotclock 180 MHz
    Display Product Name: 'LCD MONITOR  '
  Extension blocks: 1
Checksum: 0xb6

----------------

Block 1, CTA-861 Extension Block:
  Revision: 3
  Basic audio support
  Supports YCbCr 4:4:4
  Supports YCbCr 4:2:2
  Native detailed modes: 1
  Video Data Block:
    VIC  16:  1920x1080   60.000000 Hz  16:9     67.500 kHz    148.500000 MHz (native)
    VIC   4:  1280x720    60.000000 Hz  16:9     45.000 kHz     74.250000 MHz
    VIC   2:   720x480    59.940060 Hz   4:3     31.469 kHz     27.000000 MHz
  Audio Data Block:
    Linear PCM:
      Max channels: 2
      Supported sample rates (kHz): 192 176.4 96 88.2 48 44.1 32
      Supported sample sizes (bits): 24 20 16
  Speaker Allocation Data Block:
    FL/FR - Front Left/Right
  Vendor-Specific Data Block (HDMI), OUI 00-0C-03:
    Source physical address: 1.0.0.0
  Detailed Timing Descriptors:
    DTD 3:  1920x1080   60.000000 Hz  16:9     67.500 kHz    148.500000 MHz (983 mm x 576 mm)
                 Hfront   88 Hsync  44 Hback  148 Hpol P
                 Vfront    4 Vsync   5 Vback   36 Vpol P
Checksum: 0xc7  Unused space in Extension Block: 87 bytes

----------------

Block 2, Unknown EDID Extension Block 0x00:
  00 ff ff ff ff ff ff 00 1d 85 01 11 01 00 00 00 '................'
  20 1f 01 03 80 2b 1b 6d ef c5 c6 a3 57 4a 9c 23 ' ....+.m....WJ.#'
  12 4f 54 23 08 00 01 01 01 01 01 01 01 01 01 01 '.OT#............'
  01 01 01 01 01 01 02 3a 80 18 71 38 2d 40 58 2c '.......:..q8-@X,'
  45 00 c0 6c 00 00 00 1e 20 1c 56 86 50 00 20 30 'E..l.... .V.P. 0'
  0e 38 13 00 06 44 21 00 00 1e 00 00 00 fd 00 31 '.8...D!........1'
  4c 1e 55 12 00 0a 20 20 20 20 20 20 00 00 00 fc 'L.U...      ....'
  00 4c 43 44 20 4d 4f 4e 49 54 4f 52 20 20 01 b6 '.LCD MONITOR  ..'
Checksum: 0xb6

----------------

Block 3, CTA-861 Extension Block:
  Revision: 3
  Basic audio support
  Supports YCbCr 4:4:4
  Supports YCbCr 4:2:2
  Native detailed modes: 1
  Video Data Block:
    VIC  16:  1920x1080   60.000000 Hz  16:9     67.500 kHz    148.500000 MHz (native)
    VIC   4:  1280x720    60.000000 Hz  16:9     45.000 kHz     74.250000 MHz
    VIC   2:   720x480    59.940060 Hz   4:3     31.469 kHz     27.000000 MHz
  Audio Data Block:
    Linear PCM:
      Max channels: 2
      Supported sample rates (kHz): 192 176.4 96 88.2 48 44.1 32
      Supported sample sizes (bits): 24 20 16
  Speaker Allocation Data Block:
    FL/FR - Front Left/Right
  Vendor-Specific Data Block (HDMI), OUI 00-0C-03:
    Source physical address: 1.0.0.0
  Detailed Timing Descriptors:
    DTD 4:  1920x1080   60.000000 Hz  16:9     67.500 kHz    148.500000 MHz (983 mm x 576 mm)
                 Hfront   88 Hsync  44 Hback  148 Hpol P
                 Vfront    4 Vsync   5 Vback   36 Vpol P
Checksum: 0xc7  Unused space in Extension Block: 87 bytes

----------------

Warnings:

Block 0, Base EDID:
  Basic Display Parameters & Features: sRGB is signaled, but the gamma != 2.2.
Block 1, CTA-861 Extension Block:
  IT Video Formats are overscanned by default, but normally this should be underscanned.
Block 3, CTA-861 Extension Block:
  IT Video Formats are overscanned by default, but normally this should be underscanned.
EDID:
  CTA-861: Multiple native progressive timings are defined.

Failures:

Block 0, Base EDID:
  Basic Display Parameters & Features: sRGB is signaled, but the chromaticities do not match.
  Detailed Timing Descriptor #1: Mismatch of image size 192x108 mm vs display size 430x270 mm.
  Detailed Timing Descriptor #2: Mismatch of image size 518x324 mm vs display size 430x270 mm.
  Display Product Name: One or more trailing spaces.
Block 1, CTA-861 Extension Block:
  Detailed Timing Descriptor #3: Mismatch of image size 983x576 mm vs display size 430x270 mm.
  Missing VCDB, needed for Set Selectable RGB Quantization to avoid interop issues.
Block 2, Base EDID:
  Unknown Extension Block.
Block 3, CTA-861 Extension Block:
  Video Data Block: Duplicate VIC 16.
  Video Data Block: Duplicate VIC 4.
  Video Data Block: Duplicate VIC 2.
  Speaker Allocation Data Block: Only one instance of this Data Block is allowed.
  Detailed Timing Descriptor #4: Mismatch of image size 983x576 mm vs display size 430x270 mm.
  Missing VCDB, needed for Set Selectable RGB Quantization to avoid interop issues.
EDID:
  Base EDID: The DTD max image size is 983x576mm, which is larger than the display size 430.0x270.0mm.
  Base EDID: EDID specified 1 extension block(s), but found 3 extension block(s).
  Base EDID: EDID 1.3 requires a Block Map Extension in Block 1 if there are more than 2 blocks in the EDID.

EDID conformity: FAIL
