
EDID (hex):
00ffffffffffff000daf311400000000
00000103801e13780a09059757518a27
20505400000001010101010101010101
010101010101ab22a0a050841a303020
36002fbe10000018000000fe004e3134
3143332d4c30320a2020000000fe0043
4d4f0a202020202020202020000000fe
004e31343143332d4c30320a20200035

Extracted contents:
header:          00 ff ff ff ff ff ff 00
serial number:   0d af 31 14 00 00 00 00 00 00
version:         01 03
basic params:    80 1e 13 78 0a
chroma info:     09 05 97 57 51 8a 27 20 50 54
established:     00 00 00
standard:        01 01 01 01 01 01 01 01 01 01 01 01 01 01 01 01
descriptor 1:    ab 22 a0 a0 50 84 1a 30 30 20 36 00 2f be 10 00 00 18
descriptor 2:    00 00 00 fe 00 4e 31 34 31 43 33 2d 4c 30 32 0a 20 20
descriptor 3:    00 00 00 fe 00 43 4d 4f 0a 20 20 20 20 20 20 20 20 20
descriptor 4:    00 00 00 fe 00 4e 31 34 31 43 33 2d 4c 30 32 0a 20 20
extensions:      00
checksum:        35

EDID version: 1.3
Manufacturer: CMO Model 1431 Serial Number --
Digital display
Maximum image size: 30 cm x 19 cm
Gamma: 2.20
RGB color display
First detailed timing is preferred timing
Display x,y Chromaticity:
  Red:   0.5898, 0.3398
  Green: 0.3183, 0.5400
  Blue:  0.1523, 0.1250
  White: 0.3134, 0.3291
Established timings supported:
Standard timings supported:
Detailed mode: Clock 88.750 MHz, 303 mm x 190 mm
               1440 1488 1520 1600 hborder 0
                900  903  909  926 vborder 0
               -hsync -vsync 
               VertFreq: 59 Hz, HorFreq: 55468 Hz
ASCII string: N141C3-L02
ASCII string: CMO
ASCII string: N141C3-L02
Checksum: 0x35 (valid)
EDID block does NOT conform to EDID 1.3!
	Missing name descriptor
	Missing monitor ranges
EDID block does not conform at all!
	Bad year of manufacture
