
EDID (hex):
00ffffffffffff000c2cd6077f10f444
2210010381251e78efde95a3544c9926
0f5054afcf0081807140814001018100
81c001010101302a009851002a403090
1300782d1100001e000000ff00303031
3135363834353639350a000000fc004b
572d56442d3030310a202020000000fd
00374b1e500e000a20202020202000c7

Extracted contents:
header:          00 ff ff ff ff ff ff 00
serial number:   0c 2c d6 07 7f 10 f4 44 22 10
version:         01 03
basic params:    81 25 1e 78 ef
chroma info:     de 95 a3 54 4c 99 26 0f 50 54
established:     af cf 00
standard:        81 80 71 40 81 40 01 01 81 00 81 c0 01 01 01 01
descriptor 1:    30 2a 00 98 51 00 2a 40 30 90 13 00 78 2d 11 00 00 1e
descriptor 2:    00 00 00 ff 00 30 30 31 31 35 36 38 34 35 36 39 35 0a
descriptor 3:    00 00 00 fc 00 4b 57 2d 56 44 2d 30 30 31 0a 20 20 20
descriptor 4:    00 00 00 fd 00 37 4b 1e 50 0e 00 0a 20 20 20 20 20 20
extensions:      00
checksum:        c7

EDID version: 1.3
Manufacturer: CAL Model 7d6 Serial Number --
Made in week 34 of 2006
Digital display
DFP 1.x compatible TMDS
Maximum image size: 37 cm x 30 cm
Gamma: 2.20
DPMS levels: Standby Suspend Off
RGB color display
Default (sRGB) color space is primary color space
First detailed timing is preferred timing
Supports GTF timings within operating range
Display x,y Chromaticity:
  Red:   0.6396, 0.3291
  Green: 0.2998, 0.5996
  Blue:  0.1503, 0.0595
  White: 0.3134, 0.3291
Established timings supported:
  720x400@70Hz 9:5 HorFreq: 31469 Hz Clock: 28.320 MHz
  640x480@60Hz 4:3 HorFreq: 31469 Hz Clock: 25.175 MHz
  640x480@72Hz 4:3 HorFreq: 37900 Hz Clock: 31.500 MHz
  640x480@75Hz 4:3 HorFreq: 37500 Hz Clock: 31.500 MHz
  800x600@56Hz 4:3 HorFreq: 35200 Hz Clock: 36.000 MHz
  800x600@60Hz 4:3 HorFreq: 37900 Hz Clock: 40.000 MHz
  800x600@72Hz 4:3 HorFreq: 48100 Hz Clock: 50.000 MHz
  800x600@75Hz 4:3 HorFreq: 46900 Hz Clock: 49.500 MHz
  1024x768@60Hz 4:3 HorFreq: 48400 Hz Clock: 65.000 MHz
  1024x768@70Hz 4:3 HorFreq: 56500 Hz Clock: 75.000 MHz
  1024x768@75Hz 4:3 HorFreq: 60000 Hz Clock: 78.750 MHz
  1280x1024@75Hz 5:4 HorFreq: 80000 Hz Clock: 135.000 MHz
Standard timings supported:
  1280x1024@60Hz 5:4 HorFreq: 64000 Hz Clock: 108.000 MHz
  1152x864@60Hz 4:3
  1280x960@60Hz 4:3 HorFreq: 60000 Hz Clock: 108.000 MHz
  1280x800@60Hz 16:10
  1280x720@60Hz 16:9
Detailed mode: Clock 108.000 MHz, 376 mm x 301 mm
               1280 1328 1472 1688 hborder 0
               1024 1025 1028 1066 vborder 0
               +hsync +vsync 
               VertFreq: 60 Hz, HorFreq: 63981 Hz
Serial number: --
Monitor name: KW-VD-001
Monitor ranges (GTF): 55-75Hz V, 30-80kHz H, max dotclock 140MHz
Checksum: 0xc7 (valid)
EDID block does NOT conform to EDID 1.3!
	sRGB is signaled, but the chromaticities do not match
