edid-decode (hex):

00 ff ff ff ff ff ff 00 59 3a 95 00 01 01 01 01
00 19 01 03 1c 34 1d 78 2a 2a c5 a4 56 4f 9e 28
0f 50 54 a5 ce 00 01 01 01 01 01 01 01 01 01 01
01 01 01 01 01 01 66 21 50 b0 51 00 1b 30 40 70
36 00 09 25 21 00 00 1e 64 19 00 40 41 00 26 30
18 88 36 00 09 25 21 00 00 18 00 00 00 fc 00 44
32 34 68 2d 43 31 0a 20 20 20 20 20 00 00 00 fd
00 38 4c 1f 50 0f 00 0a 20 20 20 20 20 20 00 51

00 ff ff ff ff ff ff 00 59 3a 95 00 01 01 01 01
00 19 01 03 1c 34 1d 78 2a 2a c5 a4 56 4f 9e 28
0f 50 54 a5 ce 00 01 01 01 01 01 01 01 01 01 01
01 01 01 01 01 01 66 21 50 b0 51 00 1b 30 40 70
36 00 09 25 21 00 00 1e 64 19 00 40 41 00 26 30
18 88 36 00 09 25 21 00 00 18 00 00 00 fc 00 44
32 34 68 2d 43 31 0a 20 20 20 20 20 00 00 00 fd
00 38 4c 1f 50 0f 00 0a 20 20 20 20 20 20 00 51

----------------

Block 0, Base EDID:
  EDID Structure Version & Revision: 1.3
  Vendor & Product Identification:
    Manufacturer: VIZ
    Model: 149
    Serial Number: ...
    Made in: 2015
  Basic Display Parameters & Features:
    Analog display
    Signal Level Standard: 0.700 : 0.300 : 1.000 V p-p
    Blank-to-black setup/pedestal
    Sync: Separate Composite
    Maximum image size: 52 cm x 29 cm
    Gamma: 2.20
    DPMS levels: Off
    RGB color display
    First detailed timing is the preferred timing
  Color Characteristics:
    Red  : 0.6406, 0.3378
    Green: 0.3105, 0.6191
    Blue : 0.1591, 0.0585
    White: 0.3134, 0.3291
  Established Timings I & II:
    IBM     :   720x400    70.081663 Hz   9:5     31.467 kHz     28.320000 MHz
    DMT 0x04:   640x480    59.940476 Hz   4:3     31.469 kHz     25.175000 MHz
    DMT 0x06:   640x480    75.000000 Hz   4:3     37.500 kHz     31.500000 MHz
    DMT 0x09:   800x600    60.316541 Hz   4:3     37.879 kHz     40.000000 MHz
    DMT 0x0a:   800x600    72.187572 Hz   4:3     48.077 kHz     50.000000 MHz
    DMT 0x0b:   800x600    75.000000 Hz   4:3     46.875 kHz     49.500000 MHz
    DMT 0x10:  1024x768    60.003840 Hz   4:3     48.363 kHz     65.000000 MHz
    DMT 0x11:  1024x768    70.069359 Hz   4:3     56.476 kHz     75.000000 MHz
    DMT 0x12:  1024x768    75.028582 Hz   4:3     60.023 kHz     78.750000 MHz
  Standard Timings: none
  Detailed Timing Descriptors:
    DTD 1:  1360x768    60.015162 Hz  85:48    47.712 kHz     85.500000 MHz (521 mm x 293 mm)
                 Hfront   64 Hsync 112 Hback  256 Hpol P
                 Vfront    3 Vsync   6 Vback   18 Vpol P
    DTD 2:  1024x768    60.003840 Hz   4:3     48.363 kHz     65.000000 MHz (521 mm x 293 mm)
                 Hfront   24 Hsync 136 Hback  160 Hpol N
                 Vfront    3 Vsync   6 Vback   29 Vpol N
    Display Product Name: 'D24h-C1'
    Display Range Limits:
      Monitor ranges (GTF): 56-76 Hz V, 31-80 kHz H, max dotclock 150 MHz
Checksum: 0x51

----------------

Block 1, Unknown EDID Extension Block 0x00:
  00 ff ff ff ff ff ff 00 59 3a 95 00 01 01 01 01 '........Y:......'
  00 19 01 03 1c 34 1d 78 2a 2a c5 a4 56 4f 9e 28 '.....4.x**..VO.('
  0f 50 54 a5 ce 00 01 01 01 01 01 01 01 01 01 01 '.PT.............'
  01 01 01 01 01 01 66 21 50 b0 51 00 1b 30 40 70 '......f!P.Q..0@p'
  36 00 09 25 21 00 00 1e 64 19 00 40 41 00 26 30 '6..%!...d..@A.&0'
  18 88 36 00 09 25 21 00 00 18 00 00 00 fc 00 44 '..6..%!........D'
  32 34 68 2d 43 31 0a 20 20 20 20 20 00 00 00 fd '24h-C1.     ....'
  00 38 4c 1f 50 0f 00 0a 20 20 20 20 20 20 00 51 '.8L.P...      .Q'
Checksum: 0x51

----------------

Failures:

Block 1, Base EDID:
  Unknown Extension Block.
EDID:
  Base EDID: EDID specified 0 extension block(s), but found 1 extension block(s).

EDID conformity: FAIL
