
EDID (hex):
00ffffffffffff005925002701000000
12210103803c2178ea2d36a75438ae26
0d4f54a10800d1c0b3009500818081c0
81003b800101023a801871382d40582c
45000f282100001e000000fc00484f52
495a4f4e20205a32370a000000fd003a
3e1e5310000a202020202020000000ff
003030303030303030300a2020200199
020330f1479005040323090723090707
8301000067030c001000382d681a0000
0101304cede60607015b5b0fe305c000
2a4480a07038274030203500a05a0000
001e011d00bc52d01e20b8285540a05a
0000001e000000000000000000000000
00000000000000000000000000000000
000000000000000000000000000000cc

edid-decode (hex):

00 ff ff ff ff ff ff 00 59 25 00 27 01 00 00 00
12 21 01 03 80 3c 21 78 ea 2d 36 a7 54 38 ae 26
0d 4f 54 a1 08 00 d1 c0 b3 00 95 00 81 80 81 c0
81 00 3b 80 01 01 02 3a 80 18 71 38 2d 40 58 2c
45 00 0f 28 21 00 00 1e 00 00 00 fc 00 48 4f 52
49 5a 4f 4e 20 20 5a 32 37 0a 00 00 00 fd 00 3a
3e 1e 53 10 00 0a 20 20 20 20 20 20 00 00 00 ff
00 30 30 30 30 30 30 30 30 30 0a 20 20 20 01 99

02 03 30 f1 47 90 05 04 03 23 09 07 23 09 07 07
83 01 00 00 67 03 0c 00 10 00 38 2d 68 1a 00 00
01 01 30 4c ed e6 06 07 01 5b 5b 0f e3 05 c0 00
2a 44 80 a0 70 38 27 40 30 20 35 00 a0 5a 00 00
00 1e 01 1d 00 bc 52 d0 1e 20 b8 28 55 40 a0 5a
00 00 00 1e 00 00 00 00 00 00 00 00 00 00 00 00
00 00 00 00 00 00 00 00 00 00 00 00 00 00 00 00
00 00 00 00 00 00 00 00 00 00 00 00 00 00 00 cc

----------------

Block 0, Base EDID:
  EDID Structure Version & Revision: 1.3
  Vendor & Product Identification:
    Manufacturer: VIE
    Model: 9984
    Serial Number: 1
    Made in: week 18 of 2023
  Basic Display Parameters & Features:
    Digital display
    Maximum image size: 60 cm x 33 cm
    Gamma: 2.20
    DPMS levels: Standby Suspend Off
    RGB color display
    First detailed timing is the preferred timing
  Color Characteristics:
    Red  : 0.6523, 0.3300
    Green: 0.2216, 0.6806
    Blue : 0.1484, 0.0537
    White: 0.3095, 0.3300
  Established Timings I & II:
    IBM     :   720x400    70.081663 Hz   9:5     31.467 kHz     28.320000 MHz
    DMT 0x04:   640x480    59.940476 Hz   4:3     31.469 kHz     25.175000 MHz
    DMT 0x09:   800x600    60.316541 Hz   4:3     37.879 kHz     40.000000 MHz
    DMT 0x10:  1024x768    60.003840 Hz   4:3     48.363 kHz     65.000000 MHz
  Standard Timings:
    DMT 0x52:  1920x1080   60.000000 Hz  16:9     67.500 kHz    148.500000 MHz
    DMT 0x3a:  1680x1050   59.954250 Hz  16:10    65.290 kHz    146.250000 MHz
    DMT 0x2f:  1440x900    59.887445 Hz  16:10    55.935 kHz    106.500000 MHz
    DMT 0x23:  1280x1024   60.019740 Hz   5:4     63.981 kHz    108.000000 MHz
    DMT 0x55:  1280x720    60.000000 Hz  16:9     45.000 kHz     74.250000 MHz
    DMT 0x1c:  1280x800    59.810326 Hz  16:10    49.702 kHz     83.500000 MHz
    GTF     :   720x576    60.000294 Hz   5:4     35.820 kHz     32.668000 MHz
  Detailed Timing Descriptors:
    DTD 1:  1920x1080   60.000000 Hz  16:9     67.500 kHz    148.500000 MHz (527 mm x 296 mm)
                 Hfront   88 Hsync  44 Hback  148 Hpol P
                 Vfront    4 Vsync   5 Vback   36 Vpol P
    Display Product Name: 'HORIZON  Z27'
    Display Range Limits:
      Monitor ranges (GTF): 58-62 Hz V, 30-83 kHz H, max dotclock 160 MHz
    Display Product Serial Number: '000000000'
  Extension blocks: 1
Checksum: 0x99

----------------

Block 1, CTA-861 Extension Block:
  Revision: 3
  Underscans IT Video Formats by default
  Basic audio support
  Supports YCbCr 4:4:4
  Supports YCbCr 4:2:2
  Native detailed modes: 1
  Video Data Block:
    VIC  16:  1920x1080   60.000000 Hz  16:9     67.500 kHz    148.500000 MHz (native)
    VIC   5:  1920x1080i  60.000000 Hz  16:9     33.750 kHz     74.250000 MHz
    VIC   4:  1280x720    60.000000 Hz  16:9     45.000 kHz     74.250000 MHz
    VIC   3:   720x480    59.940060 Hz  16:9     31.469 kHz     27.000000 MHz
    VIC  35:  2880x480    59.940060 Hz   4:3     31.469 kHz    108.000000 MHz
    VIC   9:  1440x240    60.054449 Hz  16:9     15.734 kHz     27.000000 MHz
    VIC   7:  1440x480i   59.940060 Hz  16:9     15.734 kHz     27.000000 MHz
  Audio Data Block:
    Linear PCM:
      Max channels: 2
      Supported sample rates (kHz): 48 44.1 32
      Supported sample sizes (bits): 24 20 16
  Speaker Allocation Data Block:
    FL/FR - Front Left/Right
  Vendor-Specific Data Block (HDMI), OUI 00-0C-03:
    Source physical address: 1.0.0.0
    DC_36bit
    DC_30bit
    DC_Y444
    Maximum TMDS clock: 225 MHz
  Vendor-Specific Data Block (AMD), OUI 00-00-1A:
    Version: 1.1
    Minimum Refresh Rate: 48 Hz
    Maximum Refresh Rate: 76 Hz
    Flags 1.x: 0xed (MCCS)
  HDR Static Metadata Data Block:
    Electro optical transfer functions:
      Traditional gamma - SDR luminance range
      Traditional gamma - HDR luminance range
      SMPTE ST2084
    Supported static metadata descriptors:
      Static metadata type 1
    Desired content max luminance: 91 (358.942 cd/m^2)
    Desired content max frame-average luminance: 91 (358.942 cd/m^2)
    Desired content min luminance: 15 (0.012 cd/m^2)
  Colorimetry Data Block:
    BT2020YCC
    BT2020RGB
  Detailed Timing Descriptors:
    DTD 2:  1920x1080   74.972503 Hz  16:9     83.894 kHz    174.500000 MHz (160 mm x 90 mm)
                 Hfront   48 Hsync  32 Hback   80 Hpol P
                 Vfront    3 Vsync   5 Vback   31 Vpol P
    DTD 3:  1280x720    50.000000 Hz  16:9     37.500 kHz     74.250000 MHz (160 mm x 90 mm)
                 Hfront  440 Hsync  40 Hback  220 Hpol P
                 Vfront    5 Vsync   5 Vback   20 Vpol P
Checksum: 0xcc  Unused space in Extension Block: 43 bytes
