
EDID (hex):
00ffffffffffff0015c3402401010101
1a19010380301e78ea3ad5a45554a228
0a50542108008180814081c001010101
0101010101017c2e90a0601a1e403020
3600da291100001a000000ff00323531
35353036350a20202020000000fd003b
3d1f440c000a202020202020000000fc
00455632323136570a202020202000b8

Extracted contents:
header:          00 ff ff ff ff ff ff 00
serial number:   15 c3 40 24 01 01 01 01 1a 19
version:         01 03
basic params:    80 30 1e 78 ea
chroma info:     3a d5 a4 55 54 a2 28 0a 50 54
established:     21 08 00
standard:        81 80 81 40 81 c0 01 01 01 01 01 01 01 01 01 01
descriptor 1:    7c 2e 90 a0 60 1a 1e 40 30 20 36 00 da 29 11 00 00 1a
descriptor 2:    00 00 00 ff 00 32 35 31 35 35 30 36 35 0a 20 20 20 20
descriptor 3:    00 00 00 fd 00 3b 3d 1f 44 0c 00 0a 20 20 20 20 20 20
descriptor 4:    00 00 00 fc 00 45 56 32 32 31 36 57 0a 20 20 20 20 20
extensions:      00
checksum:        b8

EDID version: 1.3
Manufacturer: ENC Model 2440 Serial Number --
Made in week 26 of 2015
Digital display
Maximum image size: 48 cm x 30 cm
Gamma: 2.20
DPMS levels: Standby Suspend Off
RGB color display
First detailed timing is preferred timing
Display x,y Chromaticity:
  Red:   0.6406, 0.3349
  Green: 0.3300, 0.6347
  Blue:  0.1591, 0.0400
  White: 0.3134, 0.3291
Established timings supported:
  640x480@60Hz 4:3 HorFreq: 31469 Hz Clock: 25.175 MHz
  800x600@60Hz 4:3 HorFreq: 37900 Hz Clock: 40.000 MHz
  1024x768@60Hz 4:3 HorFreq: 48400 Hz Clock: 65.000 MHz
Standard timings supported:
  1280x1024@60Hz 5:4 HorFreq: 64000 Hz Clock: 108.000 MHz
  1280x960@60Hz 4:3 HorFreq: 60000 Hz Clock: 108.000 MHz
  1280x720@60Hz 16:9
Detailed mode: Clock 119.000 MHz, 474 mm x 297 mm
               1680 1728 1760 1840 hborder 0
               1050 1053 1059 1080 vborder 0
               +hsync -vsync 
               VertFreq: 59 Hz, HorFreq: 64673 Hz
Serial number: --
Monitor ranges (GTF): 59-61Hz V, 31-68kHz H, max dotclock 120MHz
Monitor name: EV2216W
Checksum: 0xb8 (valid)
