edid-decode (hex):

00 ff ff ff ff ff ff 00 06 b3 cb 24 3d d4 01 00
32 1c 01 03 80 35 1e 78 2a 0e f5 a5 55 50 9e 26
10 50 54 bf ef 00 d1 c0 b3 00 95 00 81 80 81 40
81 c0 71 4f 01 01 02 3a 80 18 71 38 2d 40 58 2c
45 00 13 2b 21 00 00 1e 00 00 00 ff 00 4a 43 4c
4d 54 46 31 31 39 38 36 39 0a 00 00 00 fd 00 30
4b 18 54 12 00 0a 20 20 20 20 20 20 00 00 00 fc
00 48 44 4d 49 43 0a 20 20 20 20 20 20 20 01 2d

02 03 23 f1 4f 01 02 03 11 12 13 04 14 05 0e 0f
1d 1e 1f 90 23 09 17 07 83 01 00 00 66 03 0c 00
11 00 80 8c 0a d0 8a 20 e0 2d 10 10 3e 96 00 04
03 00 00 00 18 8c 0a d0 8a 20 e0 2d 10 10 3e 96
00 10 09 00 00 00 18 8c 0a d0 90 20 40 31 20 0c
40 55 00 04 03 00 00 00 18 8c 0a d0 90 20 40 31
20 0c 40 55 00 10 09 00 00 00 18 01 1d 00 bc 52
d0 1e 20 b8 28 55 40 10 09 00 00 00 1e 00 00 2c

00 ff ff ff ff ff ff 00 06 b3 cb 24 3d d4 01 00
32 1c 01 03 80 35 1e 78 2a 0e f5 a5 55 50 9e 26
10 50 54 bf ef 00 d1 c0 b3 00 95 00 81 80 81 40
81 c0 71 4f 01 01 02 3a 80 18 71 38 2d 40 58 2c
45 00 13 2b 21 00 00 1e 00 00 00 ff 00 4a 43 4c
4d 54 46 31 31 39 38 36 39 0a 00 00 00 fd 00 30
4b 18 54 12 00 0a 20 20 20 20 20 20 00 00 00 fc
00 48 44 4d 49 43 0a 20 20 20 20 20 20 20 01 2d

02 03 23 f1 4f 01 02 03 11 12 13 04 14 05 0e 0f
1d 1e 1f 90 23 09 17 07 83 01 00 00 66 03 0c 00
11 00 80 8c 0a d0 8a 20 e0 2d 10 10 3e 96 00 04
03 00 00 00 18 8c 0a d0 8a 20 e0 2d 10 10 3e 96
00 10 09 00 00 00 18 8c 0a d0 90 20 40 31 20 0c
40 55 00 04 03 00 00 00 18 8c 0a d0 90 20 40 31
20 0c 40 55 00 10 09 00 00 00 18 01 1d 00 bc 52
d0 1e 20 b8 28 55 40 10 09 00 00 00 1e 00 00 2c

----------------

Block 0, Base EDID:
  EDID Structure Version & Revision: 1.3
  Vendor & Product Identification:
    Manufacturer: AUS
    Model: 9419
    Serial Number: ...
    Made in: week 50 of 2018
  Basic Display Parameters & Features:
    Digital display
    Maximum image size: 53 cm x 30 cm
    Gamma: 2.20
    DPMS levels: Off
    RGB color display
    First detailed timing is the preferred timing
  Color Characteristics:
    Red  : 0.6445, 0.3320
    Green: 0.3154, 0.6191
    Blue : 0.1513, 0.0654
    White: 0.3134, 0.3291
  Established Timings I & II:
    IBM     :   720x400    70.081663 Hz   9:5     31.467 kHz     28.320000 MHz
    DMT 0x04:   640x480    59.940476 Hz   4:3     31.469 kHz     25.175000 MHz
    Apple   :   640x480    66.666667 Hz   4:3     35.000 kHz     30.240000 MHz
    DMT 0x05:   640x480    72.808802 Hz   4:3     37.861 kHz     31.500000 MHz
    DMT 0x06:   640x480    75.000000 Hz   4:3     37.500 kHz     31.500000 MHz
    DMT 0x08:   800x600    56.250000 Hz   4:3     35.156 kHz     36.000000 MHz
    DMT 0x09:   800x600    60.316541 Hz   4:3     37.879 kHz     40.000000 MHz
    DMT 0x0a:   800x600    72.187572 Hz   4:3     48.077 kHz     50.000000 MHz
    DMT 0x0b:   800x600    75.000000 Hz   4:3     46.875 kHz     49.500000 MHz
    Apple   :   832x624    74.551266 Hz   4:3     49.726 kHz     57.284000 MHz
    DMT 0x10:  1024x768    60.003840 Hz   4:3     48.363 kHz     65.000000 MHz
    DMT 0x11:  1024x768    70.069359 Hz   4:3     56.476 kHz     75.000000 MHz
    DMT 0x12:  1024x768    75.028582 Hz   4:3     60.023 kHz     78.750000 MHz
    DMT 0x24:  1280x1024   75.024675 Hz   5:4     79.976 kHz    135.000000 MHz
  Standard Timings:
    DMT 0x52:  1920x1080   60.000000 Hz  16:9     67.500 kHz    148.500000 MHz
    DMT 0x3a:  1680x1050   59.954250 Hz  16:10    65.290 kHz    146.250000 MHz
    DMT 0x2f:  1440x900    59.887445 Hz  16:10    55.935 kHz    106.500000 MHz
    DMT 0x23:  1280x1024   60.019740 Hz   5:4     63.981 kHz    108.000000 MHz
    DMT 0x20:  1280x960    60.000000 Hz   4:3     60.000 kHz    108.000000 MHz
    DMT 0x55:  1280x720    60.000000 Hz  16:9     45.000 kHz     74.250000 MHz
    DMT 0x15:  1152x864    75.000000 Hz   4:3     67.500 kHz    108.000000 MHz
  Detailed Timing Descriptors:
    DTD  1:  1920x1080   60.000000 Hz  16:9     67.500 kHz    148.500000 MHz (531 mm x 299 mm)
                  Hfront   88 Hsync  44 Hback  148 Hpol P
                  Vfront    4 Vsync   5 Vback   36 Vpol P
    Display Product Serial Number: ...
    Display Range Limits:
      Monitor ranges (GTF): 48-75 Hz V, 24-84 kHz H, max dotclock 180 MHz
    Display Product Name: 'HDMIC'
  Extension blocks: 1
Checksum: 0x2d

----------------

Block 1, CTA-861 Extension Block:
  Revision: 3
  Underscans IT Video Formats by default
  Basic audio support
  Supports YCbCr 4:4:4
  Supports YCbCr 4:2:2
  Native detailed modes: 1
  Video Data Block:
    VIC   1:   640x480    59.940476 Hz   4:3     31.469 kHz     25.175000 MHz
    VIC   2:   720x480    59.940060 Hz   4:3     31.469 kHz     27.000000 MHz
    VIC   3:   720x480    59.940060 Hz  16:9     31.469 kHz     27.000000 MHz
    VIC  17:   720x576    50.000000 Hz   4:3     31.250 kHz     27.000000 MHz
    VIC  18:   720x576    50.000000 Hz  16:9     31.250 kHz     27.000000 MHz
    VIC  19:  1280x720    50.000000 Hz  16:9     37.500 kHz     74.250000 MHz
    VIC   4:  1280x720    60.000000 Hz  16:9     45.000 kHz     74.250000 MHz
    VIC  20:  1920x1080i  50.000000 Hz  16:9     28.125 kHz     74.250000 MHz
    VIC   5:  1920x1080i  60.000000 Hz  16:9     33.750 kHz     74.250000 MHz
    VIC  14:  1440x480    59.940060 Hz   4:3     31.469 kHz     54.000000 MHz
    VIC  15:  1440x480    59.940060 Hz  16:9     31.469 kHz     54.000000 MHz
    VIC  29:  1440x576    50.000000 Hz   4:3     31.250 kHz     54.000000 MHz
    VIC  30:  1440x576    50.000000 Hz  16:9     31.250 kHz     54.000000 MHz
    VIC  31:  1920x1080   50.000000 Hz  16:9     56.250 kHz    148.500000 MHz
    VIC  16:  1920x1080   60.000000 Hz  16:9     67.500 kHz    148.500000 MHz (native)
  Audio Data Block:
    Linear PCM:
      Max channels: 2
      Supported sample rates (kHz): 96 48 44.1 32
      Supported sample sizes (bits): 24 20 16
  Speaker Allocation Data Block:
    FL/FR - Front Left/Right
  Vendor-Specific Data Block (HDMI), OUI 00-0C-03:
    Source physical address: 1.1.0.0
    Supports_AI
  Detailed Timing Descriptors:
    DTD  2:   720x480    59.940060 Hz   3:2     31.469 kHz     27.000000 MHz (4 mm x 3 mm)
                  Hfront   16 Hsync  62 Hback   60 Hpol N
                  Vfront    9 Vsync   6 Vback   30 Vpol N
    DTD  3:   720x480    59.940060 Hz   3:2     31.469 kHz     27.000000 MHz (16 mm x 9 mm)
                  Hfront   16 Hsync  62 Hback   60 Hpol N
                  Vfront    9 Vsync   6 Vback   30 Vpol N
    DTD  4:   720x576    50.000000 Hz   5:4     31.250 kHz     27.000000 MHz (4 mm x 3 mm)
                  Hfront   12 Hsync  64 Hback   68 Hpol N
                  Vfront    5 Vsync   5 Vback   39 Vpol N
    DTD  5:   720x576    50.000000 Hz   5:4     31.250 kHz     27.000000 MHz (16 mm x 9 mm)
                  Hfront   12 Hsync  64 Hback   68 Hpol N
                  Vfront    5 Vsync   5 Vback   39 Vpol N
    DTD  6:  1280x720    50.000000 Hz  16:9     37.500 kHz     74.250000 MHz (16 mm x 9 mm)
                  Hfront  440 Hsync  40 Hback  220 Hpol P
                  Vfront    5 Vsync   5 Vback   20 Vpol P
Checksum: 0x2c  Unused space in Extension Block: 2 bytes

----------------

Block 2, Unknown EDID Extension Block 0x00:
  00 ff ff ff ff ff ff 00 06 b3 cb 24 3d d4 01 00 '...........$=...'
  32 1c 01 03 80 35 1e 78 2a 0e f5 a5 55 50 9e 26 '2....5.x*...UP.&'
  10 50 54 bf ef 00 d1 c0 b3 00 95 00 81 80 81 40 '.PT............@'
  81 c0 71 4f 01 01 02 3a 80 18 71 38 2d 40 58 2c '..qO...:..q8-@X,'
  45 00 13 2b 21 00 00 1e 00 00 00 ff 00 4a 43 4c 'E..+!........JCL'
  4d 54 46 31 31 39 38 36 39 0a 00 00 00 fd 00 30 'MTF119869......0'
  4b 18 54 12 00 0a 20 20 20 20 20 20 00 00 00 fc 'K.T...      ....'
  00 48 44 4d 49 43 0a 20 20 20 20 20 20 20 01 2d '.HDMIC.       .-'
Checksum: 0x2d

----------------

Block 3, CTA-861 Extension Block:
  Revision: 3
  Underscans IT Video Formats by default
  Basic audio support
  Supports YCbCr 4:4:4
  Supports YCbCr 4:2:2
  Native detailed modes: 1
  Video Data Block:
    VIC   1:   640x480    59.940476 Hz   4:3     31.469 kHz     25.175000 MHz
    VIC   2:   720x480    59.940060 Hz   4:3     31.469 kHz     27.000000 MHz
    VIC   3:   720x480    59.940060 Hz  16:9     31.469 kHz     27.000000 MHz
    VIC  17:   720x576    50.000000 Hz   4:3     31.250 kHz     27.000000 MHz
    VIC  18:   720x576    50.000000 Hz  16:9     31.250 kHz     27.000000 MHz
    VIC  19:  1280x720    50.000000 Hz  16:9     37.500 kHz     74.250000 MHz
    VIC   4:  1280x720    60.000000 Hz  16:9     45.000 kHz     74.250000 MHz
    VIC  20:  1920x1080i  50.000000 Hz  16:9     28.125 kHz     74.250000 MHz
    VIC   5:  1920x1080i  60.000000 Hz  16:9     33.750 kHz     74.250000 MHz
    VIC  14:  1440x480    59.940060 Hz   4:3     31.469 kHz     54.000000 MHz
    VIC  15:  1440x480    59.940060 Hz  16:9     31.469 kHz     54.000000 MHz
    VIC  29:  1440x576    50.000000 Hz   4:3     31.250 kHz     54.000000 MHz
    VIC  30:  1440x576    50.000000 Hz  16:9     31.250 kHz     54.000000 MHz
    VIC  31:  1920x1080   50.000000 Hz  16:9     56.250 kHz    148.500000 MHz
    VIC  16:  1920x1080   60.000000 Hz  16:9     67.500 kHz    148.500000 MHz (native)
  Audio Data Block:
    Linear PCM:
      Max channels: 2
      Supported sample rates (kHz): 96 48 44.1 32
      Supported sample sizes (bits): 24 20 16
  Speaker Allocation Data Block:
    FL/FR - Front Left/Right
  Vendor-Specific Data Block (HDMI), OUI 00-0C-03:
    Source physical address: 1.1.0.0
    Supports_AI
  Detailed Timing Descriptors:
    DTD  7:   720x480    59.940060 Hz   3:2     31.469 kHz     27.000000 MHz (4 mm x 3 mm)
                  Hfront   16 Hsync  62 Hback   60 Hpol N
                  Vfront    9 Vsync   6 Vback   30 Vpol N
    DTD  8:   720x480    59.940060 Hz   3:2     31.469 kHz     27.000000 MHz (16 mm x 9 mm)
                  Hfront   16 Hsync  62 Hback   60 Hpol N
                  Vfront    9 Vsync   6 Vback   30 Vpol N
    DTD  9:   720x576    50.000000 Hz   5:4     31.250 kHz     27.000000 MHz (4 mm x 3 mm)
                  Hfront   12 Hsync  64 Hback   68 Hpol N
                  Vfront    5 Vsync   5 Vback   39 Vpol N
    DTD 10:   720x576    50.000000 Hz   5:4     31.250 kHz     27.000000 MHz (16 mm x 9 mm)
                  Hfront   12 Hsync  64 Hback   68 Hpol N
                  Vfront    5 Vsync   5 Vback   39 Vpol N
    DTD 11:  1280x720    50.000000 Hz  16:9     37.500 kHz     74.250000 MHz (16 mm x 9 mm)
                  Hfront  440 Hsync  40 Hback  220 Hpol P
                  Vfront    5 Vsync   5 Vback   20 Vpol P
Checksum: 0x2c  Unused space in Extension Block: 2 bytes

----------------

Warnings:

Block 1, CTA-861 Extension Block:
  Display Product Serial Number is set, so the Serial Number in the Base EDID should be 0.
  Add a Colorimetry Data Block with the sRGB colorimetry bit set to avoid interop issues.
Block 3, CTA-861 Extension Block:
  Display Product Serial Number is set, so the Serial Number in the Base EDID should be 0.
  Add a Colorimetry Data Block with the sRGB colorimetry bit set to avoid interop issues.
EDID:
  CTA-861: Multiple native progressive timings are defined.

Failures:

Block 1, CTA-861 Extension Block:
  Detailed Timing Descriptor #2: Mismatch of image size 4x3 mm vs display size 530x300 mm.
  Detailed Timing Descriptor #3: Mismatch of image size 16x9 mm vs display size 530x300 mm.
  Detailed Timing Descriptor #4: Mismatch of image size 4x3 mm vs display size 530x300 mm.
  Detailed Timing Descriptor #5: Mismatch of image size 16x9 mm vs display size 530x300 mm.
  Detailed Timing Descriptor #6: Mismatch of image size 16x9 mm vs display size 530x300 mm.
  Missing VCDB, needed for Set Selectable RGB Quantization to avoid interop issues.
Block 2, Base EDID:
  Unknown Extension Block.
Block 3, CTA-861 Extension Block:
  Video Data Block: Duplicate VIC 1.
  Video Data Block: Duplicate VIC 2.
  Video Data Block: Duplicate VIC 3.
  Video Data Block: Duplicate VIC 17.
  Video Data Block: Duplicate VIC 18.
  Video Data Block: Duplicate VIC 19.
  Video Data Block: Duplicate VIC 4.
  Video Data Block: Duplicate VIC 20.
  Video Data Block: Duplicate VIC 5.
  Video Data Block: Duplicate VIC 14.
  Video Data Block: Duplicate VIC 15.
  Video Data Block: Duplicate VIC 29.
  Video Data Block: Duplicate VIC 30.
  Video Data Block: Duplicate VIC 31.
  Video Data Block: Duplicate VIC 16.
  Speaker Allocation Data Block: Only one instance of this Data Block is allowed.
  Detailed Timing Descriptor #7: Mismatch of image size 4x3 mm vs display size 530x300 mm.
  Detailed Timing Descriptor #8: Mismatch of image size 16x9 mm vs display size 530x300 mm.
  Detailed Timing Descriptor #9: Mismatch of image size 4x3 mm vs display size 530x300 mm.
  Detailed Timing Descriptor #10: Mismatch of image size 16x9 mm vs display size 530x300 mm.
  Detailed Timing Descriptor #11: Mismatch of image size 16x9 mm vs display size 530x300 mm.
  Missing VCDB, needed for Set Selectable RGB Quantization to avoid interop issues.
EDID:
  Base EDID: EDID specified 1 extension block(s), but found 3 extension block(s).
  Base EDID: EDID 1.3 requires a Block Map Extension in Block 1 if there are more than 2 blocks in the EDID.

EDID conformity: FAIL
