
EDID (hex):
00ffffffffffff005032190cb0210000
030f01030e221b782aaea5a6544c9926
145054bfef808180614045403140818f
614f454f314f000000fc005461726761
20566973696f6e61000000fc00727920
4c43442031372d340a20000000fd0032
501e500e0a20202020202020000000ff
004331393530333030383632340a00a9

Extracted contents:
header:          00 ff ff ff ff ff ff 00
serial number:   50 32 19 0c b0 21 00 00 03 0f
version:         01 03
basic params:    0e 22 1b 78 2a
chroma info:     ae a5 a6 54 4c 99 26 14 50 54
established:     bf ef 80
standard:        81 80 61 40 45 40 31 40 81 8f 61 4f 45 4f 31 4f
descriptor 1:    00 00 00 fc 00 54 61 72 67 61 20 56 69 73 69 6f 6e 61
descriptor 2:    00 00 00 fc 00 72 79 20 4c 43 44 20 31 37 2d 34 0a 20
descriptor 3:    00 00 00 fd 00 32 50 1e 50 0e 0a 20 20 20 20 20 20 20
descriptor 4:    00 00 00 ff 00 43 31 39 35 30 33 30 30 38 36 32 34 0a
extensions:      00
checksum:        a9

EDID version: 1.3
Manufacturer: TAR Model c19 Serial Number --
Analog display, Input voltage level: 0.7/0.3 V
Sync: Separate Composite SyncOnGreen 
Maximum image size: 34 cm x 27 cm
Gamma: 2.20
DPMS levels: Off
RGB color display
First detailed timing is preferred timing
Display x,y Chromaticity:
  Red:   0.6503, 0.3300
  Green: 0.2998, 0.5996
  Blue:  0.1503, 0.0800
  White: 0.3134, 0.3291
Established timings supported:
  720x400@70Hz 9:5 HorFreq: 31469 Hz Clock: 28.320 MHz
  640x480@60Hz 4:3 HorFreq: 31469 Hz Clock: 25.175 MHz
  640x480@67Hz 4:3 HorFreq: 35000 Hz Clock: 30.240 MHz
  640x480@72Hz 4:3 HorFreq: 37900 Hz Clock: 31.500 MHz
  640x480@75Hz 4:3 HorFreq: 37500 Hz Clock: 31.500 MHz
  800x600@56Hz 4:3 HorFreq: 35200 Hz Clock: 36.000 MHz
  800x600@60Hz 4:3 HorFreq: 37900 Hz Clock: 40.000 MHz
  800x600@72Hz 4:3 HorFreq: 48100 Hz Clock: 50.000 MHz
  800x600@75Hz 4:3 HorFreq: 46900 Hz Clock: 49.500 MHz
  832x624@75Hz 4:3 HorFreq: 49726 Hz Clock: 57.284 MHz
  1024x768@60Hz 4:3 HorFreq: 48400 Hz Clock: 65.000 MHz
  1024x768@70Hz 4:3 HorFreq: 56500 Hz Clock: 75.000 MHz
  1024x768@75Hz 4:3 HorFreq: 60000 Hz Clock: 78.750 MHz
  1280x1024@75Hz 5:4 HorFreq: 80000 Hz Clock: 135.000 MHz
  1152x870@75Hz 192:145 HorFreq: 67500 Hz Clock: 108.000 MHz
Standard timings supported:
  1280x1024@60Hz 5:4 HorFreq: 64000 Hz Clock: 108.000 MHz
  1024x768@60Hz 4:3 HorFreq: 48400 Hz Clock: 65.000 MHz
  800x600@60Hz 4:3 HorFreq: 37900 Hz Clock: 40.000 MHz
  640x480@60Hz 4:3 HorFreq: 31469 Hz Clock: 25.175 MHz
  1280x1024@75Hz 5:4 HorFreq: 80000 Hz Clock: 135.000 MHz
  1024x768@75Hz 4:3 HorFreq: 60000 Hz Clock: 78.750 MHz
  800x600@75Hz 4:3 HorFreq: 46900 Hz Clock: 49.500 MHz
  640x480@75Hz 4:3 HorFreq: 37500 Hz Clock: 31.500 MHz
Monitor name: Targa Visionary LCD 17-4
Monitor ranges (invalid): 50-80Hz V, 30-80kHz H, max dotclock 140MHz
Serial number: --
Checksum: 0xa9 (valid)
EDID block does NOT conform to EDID 1.3!
	Missing preferred timing
EDID block does not conform at all!
	Bad year of manufacture
	Detailed blocks filled with garbage
	Range descriptor contains garbage


