
EDID (hex):
00ffffffffffff00320c02a000000000
00110102802517780a1c909759538c27
23505400000001010101010101010101
010101010101ab22a0a050841a305020
16046fe6100000190000000000000000
00000000000000000000000000fe004c
475068696c6970734c43440a000000fe
004c503137315750342d544c42340090

Extracted contents:
header:          00 ff ff ff ff ff ff 00
serial number:   32 0c 02 a0 00 00 00 00 00 11
version:         01 02
basic params:    80 25 17 78 0a
chroma info:     1c 90 97 59 53 8c 27 23 50 54
established:     00 00 00
standard:        01 01 01 01 01 01 01 01 01 01 01 01 01 01 01 01
descriptor 1:    ab 22 a0 a0 50 84 1a 30 50 20 16 04 6f e6 10 00 00 19
descriptor 2:    00 00 00 00 00 00 00 00 00 00 00 00 00 00 00 00 00 00
descriptor 3:    00 00 00 fe 00 4c 47 50 68 69 6c 69 70 73 4c 43 44 0a
descriptor 4:    00 00 00 fe 00 4c 50 31 37 31 57 50 34 2d 54 4c 42 34
extensions:      00
checksum:        90

EDID version: 1.2
Manufacturer: LPL Model a002 Serial Number --
Made in year 2007
Digital display
Maximum image size: 37 cm x 23 cm
Gamma: 2.20
RGB color display
First detailed timing is preferred timing
Display x,y Chromaticity:
  Red:   0.5898, 0.3486
  Green: 0.3271, 0.5468
  Blue:  0.1542, 0.1376
  White: 0.3125, 0.3281
Established timings supported:
Standard timings supported:
Detailed mode: Clock 88.750 MHz, 367 mm x 230 mm
               1440 1520 1552 1600 hborder 0
                900  917  923  926 vborder 0
               -hsync -vsync 
               VertFreq: 59 Hz, HorFreq: 55468 Hz
Manufacturer-specified data, tag 0
ASCII string: LGPhilipsLCD
ASCII string: LP171WP4-TLB4
Checksum: 0x90 (valid)
