
EDID (hex):
00ffffffffffff0034ac8044fb1f0000
070b01020c281e78e99c68a0574a9b26
12484cffff8045596159714f8199a94f
c14fc28ad14da659403062b0324040c0
13008c291100001e000000fd0032a01e
6e21000a202020202020000000fc004e
5356313130374b0a20202020000000ff
003130323330383138370a20202000ba

edid-decode (hex):

00 ff ff ff ff ff ff 00 34 ac 80 44 fb 1f 00 00
07 0b 01 02 0c 28 1e 78 e9 9c 68 a0 57 4a 9b 26
12 48 4c ff ff 80 45 59 61 59 71 4f 81 99 a9 4f
c1 4f c2 8a d1 4d a6 59 40 30 62 b0 32 40 40 c0
13 00 8c 29 11 00 00 1e 00 00 00 fd 00 32 a0 1e
6e 21 00 0a 20 20 20 20 20 20 00 00 00 fc 00 4e
53 56 31 31 30 37 4b 0a 20 20 20 20 00 00 00 ff
00 31 30 32 33 30 38 31 38 37 0a 20 20 20 00 ba

----------------

Block 0, Base EDID:
  EDID Structure Version & Revision: 1.2
  Vendor & Product Identification:
    Manufacturer: MEL
    Model: 17536
    Serial Number: 8187
    Made in: week 7 of 2001
  Basic Display Parameters & Features:
    Analog display
    Signal Level Standard: 0.700 : 0.300 : 1.000 V p-p
    Blank level equals black level
    Sync: Separate Composite
    Maximum image size: 40 cm x 30 cm
    Gamma: 2.20
    DPMS levels: Standby Suspend Off
    RGB color display
    Supports GTF timings within operating range
  Color Characteristics:
    Red  : 0.6269, 0.3408
    Green: 0.2919, 0.6054
    Blue : 0.1494, 0.0722
    White: 0.2832, 0.2968
  Established Timings I & II:
    IBM     :   720x400    70.081663 Hz   9:5     31.467 kHz     28.320000 MHz
    IBM     :   720x400    87.849542 Hz   9:5     39.444 kHz     35.500000 MHz
    DMT 0x04:   640x480    59.940476 Hz   4:3     31.469 kHz     25.175000 MHz
    Apple   :   640x480    66.666667 Hz   4:3     35.000 kHz     30.240000 MHz
    DMT 0x05:   640x480    72.808802 Hz   4:3     37.861 kHz     31.500000 MHz
    DMT 0x06:   640x480    75.000000 Hz   4:3     37.500 kHz     31.500000 MHz
    DMT 0x08:   800x600    56.250000 Hz   4:3     35.156 kHz     36.000000 MHz
    DMT 0x09:   800x600    60.316541 Hz   4:3     37.879 kHz     40.000000 MHz
    DMT 0x0a:   800x600    72.187572 Hz   4:3     48.077 kHz     50.000000 MHz
    DMT 0x0b:   800x600    75.000000 Hz   4:3     46.875 kHz     49.500000 MHz
    Apple   :   832x624    74.551266 Hz   4:3     49.726 kHz     57.284000 MHz
    DMT 0x0f:  1024x768i   86.957532 Hz   4:3     35.522 kHz     44.900000 MHz
    DMT 0x10:  1024x768    60.003840 Hz   4:3     48.363 kHz     65.000000 MHz
    DMT 0x11:  1024x768    70.069359 Hz   4:3     56.476 kHz     75.000000 MHz
    DMT 0x12:  1024x768    75.028582 Hz   4:3     60.023 kHz     78.750000 MHz
    DMT 0x24:  1280x1024   75.024675 Hz   5:4     79.976 kHz    135.000000 MHz
    Apple   :  1152x870    75.061550 Hz 192:145   68.681 kHz    100.000000 MHz
  Standard Timings:
    DMT 0x0c:   800x600    85.061274 Hz   4:3     53.674 kHz     56.250000 MHz
    DMT 0x13:  1024x768    84.996690 Hz   4:3     68.677 kHz     94.500000 MHz
    DMT 0x15:  1152x864    75.000000 Hz   4:3     67.500 kHz    108.000000 MHz
    DMT 0x25:  1280x1024   85.024098 Hz   5:4     91.146 kHz    157.500000 MHz
    DMT 0x36:  1600x1200   75.000000 Hz   4:3     93.750 kHz    202.500000 MHz
    DMT 0x3f:  1792x1344   74.996724 Hz   4:3    106.270 kHz    261.000000 MHz
    GTF     :  1800x1440   70.000011 Hz   5:4    104.930 kHz    259.387000 MHz
    GTF     :  1920x1440   73.000071 Hz   4:3    109.573 kHz    289.273000 MHz
  Detailed Timing Descriptors:
    DTD 1:  1600x1200   85.000000 Hz   4:3    106.250 kHz    229.500000 MHz (396 mm x 297 mm)
                 Hfront   64 Hsync 192 Hback  304 Hpol P
                 Vfront    1 Vsync   3 Vback   46 Vpol P
    Display Range Limits:
      Monitor ranges (GTF): 50-160 Hz V, 30-110 kHz H, max dotclock 330 MHz
    Display Product Name: 'NSV1107K'
    Display Product Serial Number: '102308187'
Checksum: 0xba


