
EDID (hex):
00ffffffffffff00410c81c012ca0000
2c15010380301b782a0a45a7544a9925
115054bd4b00d1c08180950f9500b300
010101010101023a801871382d40582c
4500e00c1100001e000000ff00465842
31313434303531373330000000fd0038
4c1e5311000a202020202020000000fc
005068696c69707320323236564c00b2

edid-decode (hex):

00 ff ff ff ff ff ff 00 41 0c 81 c0 12 ca 00 00
2c 15 01 03 80 30 1b 78 2a 0a 45 a7 54 4a 99 25
11 50 54 bd 4b 00 d1 c0 81 80 95 0f 95 00 b3 00
01 01 01 01 01 01 02 3a 80 18 71 38 2d 40 58 2c
45 00 e0 0c 11 00 00 1e 00 00 00 ff 00 46 58 42
31 31 34 34 30 35 31 37 33 30 00 00 00 fd 00 38
4c 1e 53 11 00 0a 20 20 20 20 20 20 00 00 00 fc
00 50 68 69 6c 69 70 73 20 32 32 36 56 4c 00 b2

----------------

Block 0, Base EDID:
  EDID Structure Version & Revision: 1.3
  Vendor & Product Identification:
    Manufacturer: PHL
    Model: 49281
    Serial Number: 51730
    Made in: week 44 of 2011
  Basic Display Parameters & Features:
    Digital display
    Maximum image size: 48 cm x 27 cm
    Gamma: 2.20
    DPMS levels: Off
    RGB color display
    First detailed timing is the preferred timing
  Color Characteristics:
    Red  : 0.6523, 0.3281
    Green: 0.2910, 0.5996
    Blue : 0.1455, 0.0664
    White: 0.3134, 0.3291
  Established Timings I & II:
    IBM     :   720x400    70.081663 Hz   9:5     31.467 kHz     28.320000 MHz
    DMT 0x04:   640x480    59.940476 Hz   4:3     31.469 kHz     25.175000 MHz
    Apple   :   640x480    66.666667 Hz   4:3     35.000 kHz     30.240000 MHz
    DMT 0x05:   640x480    72.808802 Hz   4:3     37.861 kHz     31.500000 MHz
    DMT 0x06:   640x480    75.000000 Hz   4:3     37.500 kHz     31.500000 MHz
    DMT 0x09:   800x600    60.316541 Hz   4:3     37.879 kHz     40.000000 MHz
    DMT 0x0b:   800x600    75.000000 Hz   4:3     46.875 kHz     49.500000 MHz
    DMT 0x10:  1024x768    60.003840 Hz   4:3     48.363 kHz     65.000000 MHz
    DMT 0x12:  1024x768    75.028582 Hz   4:3     60.023 kHz     78.750000 MHz
    DMT 0x24:  1280x1024   75.024675 Hz   5:4     79.976 kHz    135.000000 MHz
  Standard Timings:
    DMT 0x52:  1920x1080   60.000000 Hz  16:9     67.500 kHz    148.500000 MHz
    DMT 0x23:  1280x1024   60.019740 Hz   5:4     63.981 kHz    108.000000 MHz
    DMT 0x30:  1440x900    74.984427 Hz  16:10    70.635 kHz    136.750000 MHz
    DMT 0x2f:  1440x900    59.887445 Hz  16:10    55.935 kHz    106.500000 MHz
    DMT 0x3a:  1680x1050   59.954250 Hz  16:10    65.290 kHz    146.250000 MHz
  Detailed Timing Descriptors:
    DTD 1:  1920x1080   60.000000 Hz  16:9     67.500 kHz    148.500000 MHz (480 mm x 268 mm)
                 Hfront   88 Hsync  44 Hback  148 Hpol P
                 Vfront    4 Vsync   5 Vback   36 Vpol P
    Display Product Serial Number: 'FXB1144051730'
    Display Range Limits:
      Monitor ranges (GTF): 56-76 Hz V, 30-83 kHz H, max dotclock 170 MHz
    Display Product Name: 'Philips 226VL'
Checksum: 0xb2
