
EDID (hex):
00ffffffffffff0021573618bde90200
251d010380351d7822ee91a3544c9926
0f5054210f0081008140818090409500
0101a940b300011d007251d01e206e28
55000f484200001e0e1f008051001e30
408037000f484200001c000000fd0017
551e641e000a202020202020000000fc
004d4143524f53494c49434f4e0a0156
02032ef152021113841f100312061507
1605145e5f636423090707830100006e
030c001000003c200080010203046621
50b051001b30407036000f484200001e
662156aa51001e30468f33000f484200
001e8c0ad08a20e02d10103e96001009
00000018000000000000000000000000
000000000000000000000000000000af

Extracted contents:
header:          00 ff ff ff ff ff ff 00
serial number:   21 57 36 18 bd e9 02 00 25 1d
version:         01 03
basic params:    80 35 1d 78 22
chroma info:     ee 91 a3 54 4c 99 26 0f 50 54
established:     21 0f 00
standard:        81 00 81 40 81 80 90 40 95 00 01 01 a9 40 b3 00
descriptor 1:    01 1d 00 72 51 d0 1e 20 6e 28 55 00 0f 48 42 00 00 1e
descriptor 2:    0e 1f 00 80 51 00 1e 30 40 80 37 00 0f 48 42 00 00 1c
descriptor 3:    00 00 00 fd 00 17 55 1e 64 1e 00 0a 20 20 20 20 20 20
descriptor 4:    00 00 00 fc 00 4d 41 43 52 4f 53 49 4c 49 43 4f 4e 0a
extensions:      01
checksum:        56

EDID version: 1.3
Manufacturer: HJW Model 1836 Serial Number --
Made in week 37 of 2019
Digital display
Maximum image size: 53 cm x 29 cm
Gamma: 2.20
DPMS levels: Off
Monochrome or grayscale display
First detailed timing is preferred timing
Display x,y Chromaticity:
  Red:   0.6396, 0.3300
  Green: 0.2998, 0.5996
  Blue:  0.1503, 0.0595
  White: 0.3125, 0.3291
Established timings supported:
  640x480@60Hz 4:3 HorFreq: 31469 Hz Clock: 25.175 MHz
  800x600@60Hz 4:3 HorFreq: 37900 Hz Clock: 40.000 MHz
  1024x768@60Hz 4:3 HorFreq: 48400 Hz Clock: 65.000 MHz
  1024x768@70Hz 4:3 HorFreq: 56500 Hz Clock: 75.000 MHz
  1024x768@75Hz 4:3 HorFreq: 60000 Hz Clock: 78.750 MHz
  1280x1024@75Hz 5:4 HorFreq: 80000 Hz Clock: 135.000 MHz
Standard timings supported:
  1280x800@60Hz 16:10
  1280x960@60Hz 4:3 HorFreq: 60000 Hz Clock: 108.000 MHz
  1280x1024@60Hz 5:4 HorFreq: 64000 Hz Clock: 108.000 MHz
  1400x1050@60Hz 4:3 HorFreq: 64700 Hz Clock: 101.000 MHz
  1440x900@60Hz 16:10 HorFreq: 55500 Hz Clock: 88.750 MHz
  1600x1200@60Hz 4:3 HorFreq: 75000 Hz Clock: 162.000 MHz
  1680x1050@60Hz 16:10 HorFreq: 64700 Hz Clock: 119.000 MHz
Detailed mode: Clock 74.250 MHz, 1039 mm x 584 mm
               1280 1390 1430 1650 hborder 0
                720  725  730  750 vborder 0
               +hsync +vsync 
               VertFreq: 60 Hz, HorFreq: 45000 Hz
Detailed mode: Clock 79.500 MHz, 1039 mm x 584 mm
               1280 1344 1472 1664 hborder 0
                768  771  778  798 vborder 0
               -hsync +vsync 
               VertFreq: 59 Hz, HorFreq: 47776 Hz
Monitor ranges (GTF): 23-85Hz V, 30-100kHz H, max dotclock 300MHz
Monitor name: MACROSILICON
Has 1 extension blocks
Checksum: 0x56 (valid)

CTA extension block
Extension version: 3
42 bytes of CTA data
  Video data block
    VIC   2 720x480@60Hz 4:3  HorFreq: 31469 Hz Clock: 27.000 MHz
    VIC  17 720x576@50Hz 4:3  HorFreq: 31250 Hz Clock: 27.000 MHz
    VIC  19 1280x720@50Hz 16:9  HorFreq: 37500 Hz Clock: 74.250 MHz
    VIC   4 1280x720@60Hz 16:9 (native) HorFreq: 45000 Hz Clock: 74.250 MHz
    VIC  31 1920x1080@50Hz 16:9  HorFreq: 56250 Hz Clock: 148.500 MHz
    VIC  16 1920x1080@60Hz 16:9  HorFreq: 67500 Hz Clock: 148.500 MHz
    VIC   3 720x480@60Hz 16:9  HorFreq: 31469 Hz Clock: 27.000 MHz
    VIC  18 720x576@50Hz 16:9  HorFreq: 31250 Hz Clock: 27.000 MHz
    VIC   6 1440x480i@60Hz 4:3  HorFreq: 15734 Hz Clock: 27.000 MHz
    VIC  21 1440x576i@50Hz 4:3  HorFreq: 15625 Hz Clock: 27.000 MHz
    VIC   7 1440x480i@60Hz 16:9  HorFreq: 15734 Hz Clock: 27.000 MHz
    VIC  22 1440x576i@50Hz 16:9  HorFreq: 15625 Hz Clock: 27.000 MHz
    VIC   5 1920x1080i@60Hz 16:9  HorFreq: 33750 Hz Clock: 74.250 MHz
    VIC  20 1920x1080i@50Hz 16:9  HorFreq: 28125 Hz Clock: 74.250 MHz
    VIC  94 3840x2160@25Hz 16:9  HorFreq: 56250 Hz Clock: 297.000 MHz
    VIC  95 3840x2160@30Hz 16:9  HorFreq: 67500 Hz Clock: 297.000 MHz
    VIC  99 4096x2160@25Hz 256:135  HorFreq: 56250 Hz Clock: 297.000 MHz
    VIC 100 4096x2160@30Hz 256:135  HorFreq: 67500 Hz Clock: 297.000 MHz
  Audio data block
    Linear PCM, max channels 2
      Supported sample rates (kHz): 48 44.1 32
      Supported sample sizes (bits): 24 20 16
  Speaker allocation data block
    Speaker map:
      FL/FR - Front Left/Right
  Vendor-specific data block, OUI 000c03 (HDMI)
    Source physical address 1.0.0.0
    Maximum TMDS clock: 300MHz
    Extended HDMI video details:
      HDMI VIC 1 3840x2160@30Hz 16:9 HorFreq: 67500 Hz Clock: 297.000 MHz
      HDMI VIC 2 3840x2160@25Hz 16:9 HorFreq: 56250 Hz Clock: 297.000 MHz
      HDMI VIC 3 3840x2160@24Hz 16:9 HorFreq: 54000 Hz Clock: 297.000 MHz
      HDMI VIC 4 4096x2160@24Hz 256:135 HorFreq: 54000 Hz Clock: 297.000 MHz
Underscans PC formats by default
Basic audio support
Supports YCbCr 4:4:4
Supports YCbCr 4:2:2
1 native detailed modes
Detailed mode: Clock 85.500 MHz, 1039 mm x 584 mm
               1360 1424 1536 1792 hborder 0
                768  771  777  795 vborder 0
               +hsync +vsync 
               VertFreq: 60 Hz, HorFreq: 47712 Hz
Detailed mode: Clock 85.500 MHz, 1039 mm x 584 mm
               1366 1436 1579 1792 hborder 0
                768  771  774  798 vborder 0
               +hsync +vsync 
               VertFreq: 59 Hz, HorFreq: 47712 Hz
Detailed mode: Clock 27.000 MHz, 16 mm x 9 mm
                720  736  798  858 hborder 0
                480  489  495  525 vborder 0
               -hsync -vsync 
               VertFreq: 59 Hz, HorFreq: 31468 Hz
Checksum: 0xaf (valid)

One or more of the timings is out of range of the Monitor Ranges:
  Vertical Freq: 24 - 75 Hz
  Horizontal Freq: 15625 - 80000 Hz
  Maximum Clock: 297.000 MHz
Warning: HDMI VIC Codes must have their CTA-861 VIC equivalents in the VSB


