
EDID (hex):
00ffffffffffff000472c7001e6b3092
17130103682c1978ca6a84a5554d9d25
115054bfef80714f8140818081c0a9c0
8100010101012f2640a060841a303020
3500bbf91000001a000000fd00384c1f
5311000a202020202020000000fc0056
323033480a20202020202020000000ff
004c47503044303039383530300a0063

Extracted contents:
header:          00 ff ff ff ff ff ff 00
serial number:   04 72 c7 00 1e 6b 30 92 17 13
version:         01 03
basic params:    68 2c 19 78 ca
chroma info:     6a 84 a5 55 4d 9d 25 11 50 54
established:     bf ef 80
standard:        71 4f 81 40 81 80 81 c0 a9 c0 81 00 01 01 01 01
descriptor 1:    2f 26 40 a0 60 84 1a 30 30 20 35 00 bb f9 10 00 00 1a
descriptor 2:    00 00 00 fd 00 38 4c 1f 53 11 00 0a 20 20 20 20 20 20
descriptor 3:    00 00 00 fc 00 56 32 30 33 48 0a 20 20 20 20 20 20 20
descriptor 4:    00 00 00 ff 00 4c 47 50 30 44 30 30 39 38 35 30 30 0a
extensions:      00
checksum:        63

EDID version: 1.3
Manufacturer: ACR Model c7 Serial Number --
Made in week 23 of 2009
Analog display, Input voltage level: 0.7/0.7 V
Sync: Separate 
Maximum image size: 44 cm x 25 cm
Gamma: 2.20
DPMS levels: Standby Suspend
RGB color display
First detailed timing is preferred timing
Display x,y Chromaticity:
  Red:   0.6455, 0.3339
  Green: 0.3027, 0.6152
  Blue:  0.1464, 0.0664
  White: 0.3134, 0.3281
Established timings supported:
  720x400@70Hz 9:5 HorFreq: 31469 Hz Clock: 28.320 MHz
  640x480@60Hz 4:3 HorFreq: 31469 Hz Clock: 25.175 MHz
  640x480@67Hz 4:3 HorFreq: 35000 Hz Clock: 30.240 MHz
  640x480@72Hz 4:3 HorFreq: 37900 Hz Clock: 31.500 MHz
  640x480@75Hz 4:3 HorFreq: 37500 Hz Clock: 31.500 MHz
  800x600@56Hz 4:3 HorFreq: 35200 Hz Clock: 36.000 MHz
  800x600@60Hz 4:3 HorFreq: 37900 Hz Clock: 40.000 MHz
  800x600@72Hz 4:3 HorFreq: 48100 Hz Clock: 50.000 MHz
  800x600@75Hz 4:3 HorFreq: 46900 Hz Clock: 49.500 MHz
  832x624@75Hz 4:3 HorFreq: 49726 Hz Clock: 57.284 MHz
  1024x768@60Hz 4:3 HorFreq: 48400 Hz Clock: 65.000 MHz
  1024x768@70Hz 4:3 HorFreq: 56500 Hz Clock: 75.000 MHz
  1024x768@75Hz 4:3 HorFreq: 60000 Hz Clock: 78.750 MHz
  1280x1024@75Hz 5:4 HorFreq: 80000 Hz Clock: 135.000 MHz
  1152x870@75Hz 192:145 HorFreq: 67500 Hz Clock: 108.000 MHz
Standard timings supported:
  1152x864@75Hz 4:3 HorFreq: 67500 Hz Clock: 108.000 MHz
  1280x960@60Hz 4:3 HorFreq: 60000 Hz Clock: 108.000 MHz
  1280x1024@60Hz 5:4 HorFreq: 64000 Hz Clock: 108.000 MHz
  1280x720@60Hz 16:9
  1600x900@60Hz 16:9
  1280x800@60Hz 16:10
Detailed mode: Clock 97.750 MHz, 443 mm x 249 mm
               1600 1648 1680 1760 hborder 0
                900  903  908  926 vborder 0
               +hsync -vsync 
               VertFreq: 59 Hz, HorFreq: 55539 Hz
Monitor ranges (GTF): 56-76Hz V, 31-83kHz H, max dotclock 170MHz
Monitor name: V203H
Serial number: --
Checksum: 0x63 (valid)
