
EDID (hex):
00ffffffffffff0010ac03a1554a4530
0e1d0104a5361e783b9051a75553a028
135054a54b00714f8180a9c0d1c00101
010101010101023a801871382d40582c
4500202f2100001e000000ff00393947
314739335630454a550a000000fc0044
454c4c204157323531384846000000fd
0030f0ffff3c010a20202020202001ad
020319f14c9005040302071601141f12
132309070783010000866f80a0703840
4030203500202f2100001a5a8780a070
384d4030203500202f2100001aa1dd80
78703850401c20980c202f2100001a00
00000000000000000000000000000000
00000000000000000000000000000000
0000000000000000000000000000002a

Extracted contents:
header:          00 ff ff ff ff ff ff 00
serial number:   10 ac 03 a1 55 4a 45 30 0e 1d
version:         01 04
basic params:    a5 36 1e 78 3b
chroma info:     90 51 a7 55 53 a0 28 13 50 54
established:     a5 4b 00
standard:        71 4f 81 80 a9 c0 d1 c0 01 01 01 01 01 01 01 01
descriptor 1:    02 3a 80 18 71 38 2d 40 58 2c 45 00 20 2f 21 00 00 1e
descriptor 2:    00 00 00 ff 00 39 39 47 31 47 39 33 56 30 45 4a 55 0a
descriptor 3:    00 00 00 fc 00 44 45 4c 4c 20 41 57 32 35 31 38 48 46
descriptor 4:    00 00 00 fd 00 30 f0 ff ff 3c 01 0a 20 20 20 20 20 20
extensions:      01
checksum:        ad

EDID version: 1.4
Manufacturer: DEL Model a103 Serial Number --
Made in week 14 of 2019
Digital display
8 bits per primary color channel
DisplayPort interface
Maximum image size: 54 cm x 30 cm
Gamma: 2.20
DPMS levels: Off
Supported color formats: RGB 4:4:4, YCrCb 4:4:4, YCrCb 4:2:2
First detailed timing includes the native pixel format and preferred refresh rate
Display is continuous frequency
Display x,y Chromaticity:
  Red:   0.6542, 0.3330
  Green: 0.3242, 0.6250
  Blue:  0.1572, 0.0751
  White: 0.3125, 0.3291
Established timings supported:
  720x400@70Hz 9:5 HorFreq: 31469 Hz Clock: 28.320 MHz
  640x480@60Hz 4:3 HorFreq: 31469 Hz Clock: 25.175 MHz
  640x480@75Hz 4:3 HorFreq: 37500 Hz Clock: 31.500 MHz
  800x600@60Hz 4:3 HorFreq: 37900 Hz Clock: 40.000 MHz
  800x600@75Hz 4:3 HorFreq: 46900 Hz Clock: 49.500 MHz
  1024x768@60Hz 4:3 HorFreq: 48400 Hz Clock: 65.000 MHz
  1024x768@75Hz 4:3 HorFreq: 60000 Hz Clock: 78.750 MHz
  1280x1024@75Hz 5:4 HorFreq: 80000 Hz Clock: 135.000 MHz
Standard timings supported:
  1152x864@75Hz 4:3 HorFreq: 67500 Hz Clock: 108.000 MHz
  1280x1024@60Hz 5:4 HorFreq: 64000 Hz Clock: 108.000 MHz
  1600x900@60Hz 16:9
  1920x1080@60Hz 16:9
Detailed mode: Clock 148.500 MHz, 544 mm x 303 mm
               1920 2008 2052 2200 hborder 0
               1080 1084 1089 1125 vborder 0
               +hsync +vsync 
               VertFreq: 60 Hz, HorFreq: 67500 Hz
Serial number: --
Monitor ranges (bare limits): 48-240Hz V, 255-255kHz H, max dotclock 600MHz
Has 1 extension blocks
Checksum: 0xad (valid)

CTA extension block
Extension version: 3
21 bytes of CTA data
  Video data block
    VIC  16 1920x1080@60Hz 16:9 (native) HorFreq: 67500 Hz Clock: 148.500 MHz
    VIC   5 1920x1080i@60Hz 16:9  HorFreq: 33750 Hz Clock: 74.250 MHz
    VIC   4 1280x720@60Hz 16:9  HorFreq: 45000 Hz Clock: 74.250 MHz
    VIC   3 720x480@60Hz 16:9  HorFreq: 31469 Hz Clock: 27.000 MHz
    VIC   2 720x480@60Hz 4:3  HorFreq: 31469 Hz Clock: 27.000 MHz
    VIC   7 1440x480i@60Hz 16:9  HorFreq: 15734 Hz Clock: 27.000 MHz
    VIC  22 1440x576i@50Hz 16:9  HorFreq: 15625 Hz Clock: 27.000 MHz
    VIC   1 640x480@60Hz 4:3  HorFreq: 31469 Hz Clock: 25.175 MHz
    VIC  20 1920x1080i@50Hz 16:9  HorFreq: 28125 Hz Clock: 74.250 MHz
    VIC  31 1920x1080@50Hz 16:9  HorFreq: 56250 Hz Clock: 148.500 MHz
    VIC  18 720x576@50Hz 16:9  HorFreq: 31250 Hz Clock: 27.000 MHz
    VIC  19 1280x720@50Hz 16:9  HorFreq: 37500 Hz Clock: 74.250 MHz
  Audio data block
    Linear PCM, max channels 2
      Supported sample rates (kHz): 48 44.1 32
      Supported sample sizes (bits): 24 20 16
  Speaker allocation data block
    Speaker map:
      FL/FR - Front Left/Right
Underscans PC formats by default
Basic audio support
Supports YCbCr 4:4:4
Supports YCbCr 4:2:2
1 native detailed modes
Detailed mode: Clock 285.500 MHz, 544 mm x 303 mm
               1920 1968 2000 2080 hborder 0
               1080 1083 1088 1144 vborder 0
               +hsync -vsync 
               VertFreq: 119 Hz, HorFreq: 137259 Hz
Detailed mode: Clock 346.500 MHz, 544 mm x 303 mm
               1920 1968 2000 2080 hborder 0
               1080 1083 1088 1157 vborder 0
               +hsync -vsync 
               VertFreq: 143 Hz, HorFreq: 166586 Hz
Detailed mode: Clock 567.370 MHz, 544 mm x 303 mm
               1920 1948 1980 2040 hborder 0
               1080 1137 1145 1160 vborder 0
               +hsync -vsync 
               VertFreq: 239 Hz, HorFreq: 278122 Hz
Checksum: 0x2a (valid)

EDID block does NOT conform to EDID 1.4!
	Name descriptor not terminated with a newline
Warning: One or more of the timings is out of range of the Monitor Ranges:
  Vertical Freq: 50 - 239 Hz
  Horizontal Freq: 15625 - 278122 Hz
  Maximum Clock: 567.370 MHz
EDID block does not conform at all!
	Both the serial number and the serial string are set
