edid-decode (hex):

00 ff ff ff ff ff ff 00 36 69 a5 3e 00 00 00 00
23 21 01 04 b5 5e 27 78 3b 8b 15 af 4e 4b a7 23
0e 4f 52 a5 cb 00 81 a8 81 80 01 01 b3 00 95 28
d1 c0 b3 28 d1 e8 36 7d 70 a0 d0 a0 2c 50 30 20
35 00 ac 86 31 00 00 1a 00 00 00 ff 00 45 41 35
48 30 35 33 38 30 30 32 36 35 00 00 00 fd 00 30
90 de de 4e 01 0a 20 20 20 20 20 20 00 00 00 fc
00 4d 53 49 20 4d 41 47 34 30 31 51 52 0a 02 8c

02 03 23 f4 48 01 5c 04 90 13 12 5a 3f 23 09 07
07 83 01 00 00 e6 06 07 01 60 60 00 e2 00 ff e3
05 e3 01 6a 5e 00 a0 a0 a0 29 50 30 20 35 00 ac
86 31 00 00 1a 6f c2 00 a0 a0 a0 55 50 30 20 35
00 ac 86 31 00 00 1e 4a 21 70 50 30 a0 29 50 08
20 b8 04 ac 86 31 00 00 1e 42 41 b8 a0 60 a0 29
50 30 20 35 00 1d 4d 31 00 00 1e 00 00 00 00 00
00 00 00 00 00 00 00 00 00 00 00 00 00 00 00 84

00 ff ff ff ff ff ff 00 36 69 a5 3e 00 00 00 00
23 21 01 04 b5 5e 27 78 3b 8b 15 af 4e 4b a7 23
0e 4f 52 a5 cb 00 81 a8 81 80 01 01 b3 00 95 28
d1 c0 b3 28 d1 e8 36 7d 70 a0 d0 a0 2c 50 30 20
35 00 ac 86 31 00 00 1a 00 00 00 ff 00 45 41 35
48 30 35 33 38 30 30 32 36 35 00 00 00 fd 00 30
90 de de 4e 01 0a 20 20 20 20 20 20 00 00 00 fc
00 4d 53 49 20 4d 41 47 34 30 31 51 52 0a 02 8c

00 ff ff ff ff ff ff 00 36 69 a5 3e 00 00 00 00
23 21 01 04 b5 5e 27 78 3b 8b 15 af 4e 4b a7 23
0e 4f 52 a5 cb 00 81 a8 81 80 01 01 b3 00 95 28
d1 c0 b3 28 d1 e8 36 7d 70 a0 d0 a0 2c 50 30 20
35 00 ac 86 31 00 00 1a 00 00 00 ff 00 45 41 35
48 30 35 33 38 30 30 32 36 35 00 00 00 fd 00 30
90 de de 4e 01 0a 20 20 20 20 20 20 00 00 00 fc
00 4d 53 49 20 4d 41 47 34 30 31 51 52 0a 02 8c

02 03 23 f4 48 01 5c 04 90 13 12 5a 3f 23 09 07
07 83 01 00 00 e6 06 07 01 60 60 00 e2 00 ff e3
05 e3 01 6a 5e 00 a0 a0 a0 29 50 30 20 35 00 ac
86 31 00 00 1a 6f c2 00 a0 a0 a0 55 50 30 20 35
00 ac 86 31 00 00 1e 4a 21 70 50 30 a0 29 50 08
20 b8 04 ac 86 31 00 00 1e 42 41 b8 a0 60 a0 29
50 30 20 35 00 1d 4d 31 00 00 1e 00 00 00 00 00
00 00 00 00 00 00 00 00 00 00 00 00 00 00 00 84

00 ff ff ff ff ff ff 00 36 69 a5 3e 00 00 00 00
23 21 01 04 b5 5e 27 78 3b 8b 15 af 4e 4b a7 23
0e 4f 52 a5 cb 00 81 a8 81 80 01 01 b3 00 95 28
d1 c0 b3 28 d1 e8 36 7d 70 a0 d0 a0 2c 50 30 20
35 00 ac 86 31 00 00 1a 00 00 00 ff 00 45 41 35
48 30 35 33 38 30 30 32 36 35 00 00 00 fd 00 30
90 de de 4e 01 0a 20 20 20 20 20 20 00 00 00 fc
00 4d 53 49 20 4d 41 47 34 30 31 51 52 0a 02 8c

----------------

Block 0, Base EDID:
  EDID Structure Version & Revision: 1.4
  Vendor & Product Identification:
    Manufacturer: MSI
    Model: 16037
    Made in: week 35 of 2023
  Basic Display Parameters & Features:
    Digital display
    Bits per primary color channel: 10
    DisplayPort interface
    Maximum image size: 94 cm x 39 cm
    Gamma: 2.20
    DPMS levels: Off
    Supported color formats: RGB 4:4:4, YCrCb 4:4:4, YCrCb 4:2:2
    First detailed timing includes the native pixel format and preferred refresh rate
    Display is continuous frequency
  Color Characteristics:
    Red  : 0.6855, 0.3046
    Green: 0.2949, 0.6552
    Blue : 0.1367, 0.0556
    White: 0.3095, 0.3212
  Established Timings I & II:
    IBM     :   720x400    70.081663 Hz   9:5     31.467 kHz     28.320000 MHz
    DMT 0x04:   640x480    59.940476 Hz   4:3     31.469 kHz     25.175000 MHz
    DMT 0x06:   640x480    75.000000 Hz   4:3     37.500 kHz     31.500000 MHz
    DMT 0x09:   800x600    60.316541 Hz   4:3     37.879 kHz     40.000000 MHz
    DMT 0x0a:   800x600    72.187572 Hz   4:3     48.077 kHz     50.000000 MHz
    DMT 0x0b:   800x600    75.000000 Hz   4:3     46.875 kHz     49.500000 MHz
    DMT 0x10:  1024x768    60.003840 Hz   4:3     48.363 kHz     65.000000 MHz
    DMT 0x12:  1024x768    75.028582 Hz   4:3     60.023 kHz     78.750000 MHz
    DMT 0x24:  1280x1024   75.024675 Hz   5:4     79.976 kHz    135.000000 MHz
  Standard Timings:
    GTF     :  1280x1024  100.000000 Hz   5:4    108.500 kHz    190.960000 MHz
    DMT 0x23:  1280x1024   60.019740 Hz   5:4     63.981 kHz    108.000000 MHz
    DMT 0x3a:  1680x1050   59.954250 Hz  16:10    65.290 kHz    146.250000 MHz
    GTF     :  1440x900    99.999787 Hz  16:10    95.300 kHz    187.550000 MHz
    DMT 0x52:  1920x1080   60.000000 Hz  16:9     67.500 kHz    148.500000 MHz
    GTF     :  1680x1050  100.000078 Hz  16:10   111.200 kHz    256.205000 MHz
    GTF     :  1920x1080  100.000000 Hz  16:9    114.400 kHz    302.016000 MHz
  Detailed Timing Descriptors:
    DTD 1:  3440x1440   59.999251 Hz  43:18    89.039 kHz    320.540000 MHz (940 mm x 390 mm)
                 Hfront   48 Hsync  32 Hback   80 Hpol P
                 Vfront    3 Vsync   5 Vback   36 Vpol N
    Display Product Serial Number: ...
    Display Range Limits:
      Monitor ranges (Bare Limits): 48-144 Hz V, 222-222 kHz H, max dotclock 780 MHz
    Display Product Name: 'MSI MAG401QR'
  Extension blocks: 2
Checksum: 0x8c

----------------

Block 1, CTA-861 Extension Block:
  Revision: 3
  Underscans IT Video Formats by default
  Basic audio support
  Supports YCbCr 4:4:4
  Supports YCbCr 4:2:2
  Native detailed modes: 4
  Video Data Block:
    VIC   1:   640x480    59.940476 Hz   4:3     31.469 kHz     25.175000 MHz
    VIC  92:  2560x1080  120.000000 Hz  64:27   150.000 kHz    495.000000 MHz
    VIC   4:  1280x720    60.000000 Hz  16:9     45.000 kHz     74.250000 MHz
    VIC  16:  1920x1080   60.000000 Hz  16:9     67.500 kHz    148.500000 MHz (native)
    VIC  19:  1280x720    50.000000 Hz  16:9     37.500 kHz     74.250000 MHz
    VIC  18:   720x576    50.000000 Hz  16:9     31.250 kHz     27.000000 MHz
    VIC  90:  2560x1080   60.000000 Hz  64:27    66.000 kHz    198.000000 MHz
    VIC  63:  1920x1080  120.000000 Hz  16:9    135.000 kHz    297.000000 MHz
  Audio Data Block:
    Linear PCM:
      Max channels: 2
      Supported sample rates (kHz): 48 44.1 32
      Supported sample sizes (bits): 24 20 16
  Speaker Allocation Data Block:
    FL/FR - Front Left/Right
  HDR Static Metadata Data Block:
    Electro optical transfer functions:
      Traditional gamma - SDR luminance range
      Traditional gamma - HDR luminance range
      SMPTE ST2084
    Supported static metadata descriptors:
      Static metadata type 1
    Desired content max luminance: 96 (400.000 cd/m^2)
    Desired content max frame-average luminance: 96 (400.000 cd/m^2)
    Desired content min luminance: 0 (0.000 cd/m^2)
  Video Capability Data Block:
    YCbCr quantization: Selectable (via AVI YQ)
    RGB quantization: Selectable (via AVI Q)
    PT scan behavior: Supports both over- and underscan
    IT scan behavior: Supports both over- and underscan
    CE scan behavior: Supports both over- and underscan
  Colorimetry Data Block:
    xvYCC601
    xvYCC709
    BT2020cYCC
    BT2020YCC
    BT2020RGB
    Gamut Boundary Description Metadata Profile P0
  Detailed Timing Descriptors:
    DTD 2:  2560x1440   60.000199 Hz  16:9     88.860 kHz    241.700000 MHz (940 mm x 390 mm)
                 Hfront   48 Hsync  32 Hback   80 Hpol P
                 Vfront    3 Vsync   5 Vback   33 Vpol N
    DTD 3:  2560x1440  119.997589 Hz  16:9    182.996 kHz    497.750000 MHz (940 mm x 390 mm)
                 Hfront   48 Hsync  32 Hback   80 Hpol P
                 Vfront    3 Vsync   5 Vback   77 Vpol P
    DTD 4:   880x1440   59.939793 Hz  11:18    88.771 kHz     85.220000 MHz (940 mm x 390 mm)
                 Hfront    8 Hsync  32 Hback   40 Hpol P
                 Vfront   27 Vsync   8 Vback    6 Vpol P
    DTD 5:  1720x1440   60.001149 Hz  43:36    88.862 kHz    167.060000 MHz (797 mm x 333 mm)
                 Hfront   48 Hsync  32 Hback   80 Hpol P
                 Vfront    3 Vsync   5 Vback   33 Vpol P
Checksum: 0x84  Unused space in Extension Block: 20 bytes

----------------

Block 2, Unknown EDID Extension Block 0x00:
  00 ff ff ff ff ff ff 00 36 69 a5 3e 00 00 00 00 '........6i.>....'
  23 21 01 04 b5 5e 27 78 3b 8b 15 af 4e 4b a7 23 '#!...^'x;...NK.#'
  0e 4f 52 a5 cb 00 81 a8 81 80 01 01 b3 00 95 28 '.OR............('
  d1 c0 b3 28 d1 e8 36 7d 70 a0 d0 a0 2c 50 30 20 '...(..6}p...,P0 '
  35 00 ac 86 31 00 00 1a 00 00 00 ff 00 45 41 35 '5...1........EA5'
  48 30 35 33 38 30 30 32 36 35 00 00 00 fd 00 30 'H053800265.....0'
  90 de de 4e 01 0a 20 20 20 20 20 20 00 00 00 fc '...N..      ....'
  00 4d 53 49 20 4d 41 47 34 30 31 51 52 0a 02 8c '.MSI MAG401QR...'
Checksum: 0x8c

----------------

Block 3, Unknown EDID Extension Block 0x00:
  00 ff ff ff ff ff ff 00 36 69 a5 3e 00 00 00 00 '........6i.>....'
  23 21 01 04 b5 5e 27 78 3b 8b 15 af 4e 4b a7 23 '#!...^'x;...NK.#'
  0e 4f 52 a5 cb 00 81 a8 81 80 01 01 b3 00 95 28 '.OR............('
  d1 c0 b3 28 d1 e8 36 7d 70 a0 d0 a0 2c 50 30 20 '...(..6}p...,P0 '
  35 00 ac 86 31 00 00 1a 00 00 00 ff 00 45 41 35 '5...1........EA5'
  48 30 35 33 38 30 30 32 36 35 00 00 00 fd 00 30 'H053800265.....0'
  90 de de 4e 01 0a 20 20 20 20 20 20 00 00 00 fc '...N..      ....'
  00 4d 53 49 20 4d 41 47 34 30 31 51 52 0a 02 8c '.MSI MAG401QR...'
Checksum: 0x8c

----------------

Block 4, CTA-861 Extension Block:
  Revision: 3
  Underscans IT Video Formats by default
  Basic audio support
  Supports YCbCr 4:4:4
  Supports YCbCr 4:2:2
  Native detailed modes: 4
  Video Data Block:
    VIC   1:   640x480    59.940476 Hz   4:3     31.469 kHz     25.175000 MHz
    VIC  92:  2560x1080  120.000000 Hz  64:27   150.000 kHz    495.000000 MHz
    VIC   4:  1280x720    60.000000 Hz  16:9     45.000 kHz     74.250000 MHz
    VIC  16:  1920x1080   60.000000 Hz  16:9     67.500 kHz    148.500000 MHz (native)
    VIC  19:  1280x720    50.000000 Hz  16:9     37.500 kHz     74.250000 MHz
    VIC  18:   720x576    50.000000 Hz  16:9     31.250 kHz     27.000000 MHz
    VIC  90:  2560x1080   60.000000 Hz  64:27    66.000 kHz    198.000000 MHz
    VIC  63:  1920x1080  120.000000 Hz  16:9    135.000 kHz    297.000000 MHz
  Audio Data Block:
    Linear PCM:
      Max channels: 2
      Supported sample rates (kHz): 48 44.1 32
      Supported sample sizes (bits): 24 20 16
  Speaker Allocation Data Block:
    FL/FR - Front Left/Right
  HDR Static Metadata Data Block:
    Electro optical transfer functions:
      Traditional gamma - SDR luminance range
      Traditional gamma - HDR luminance range
      SMPTE ST2084
    Supported static metadata descriptors:
      Static metadata type 1
    Desired content max luminance: 96 (400.000 cd/m^2)
    Desired content max frame-average luminance: 96 (400.000 cd/m^2)
    Desired content min luminance: 0 (0.000 cd/m^2)
  Video Capability Data Block:
    YCbCr quantization: Selectable (via AVI YQ)
    RGB quantization: Selectable (via AVI Q)
    PT scan behavior: Supports both over- and underscan
    IT scan behavior: Supports both over- and underscan
    CE scan behavior: Supports both over- and underscan
  Colorimetry Data Block:
    xvYCC601
    xvYCC709
    BT2020cYCC
    BT2020YCC
    BT2020RGB
    Gamut Boundary Description Metadata Profile P0
  Detailed Timing Descriptors:
    DTD 6:  2560x1440   60.000199 Hz  16:9     88.860 kHz    241.700000 MHz (940 mm x 390 mm)
                 Hfront   48 Hsync  32 Hback   80 Hpol P
                 Vfront    3 Vsync   5 Vback   33 Vpol N
    DTD 7:  2560x1440  119.997589 Hz  16:9    182.996 kHz    497.750000 MHz (940 mm x 390 mm)
                 Hfront   48 Hsync  32 Hback   80 Hpol P
                 Vfront    3 Vsync   5 Vback   77 Vpol P
    DTD 8:   880x1440   59.939793 Hz  11:18    88.771 kHz     85.220000 MHz (940 mm x 390 mm)
                 Hfront    8 Hsync  32 Hback   40 Hpol P
                 Vfront   27 Vsync   8 Vback    6 Vpol P
    DTD 9:  1720x1440   60.001149 Hz  43:36    88.862 kHz    167.060000 MHz (797 mm x 333 mm)
                 Hfront   48 Hsync  32 Hback   80 Hpol P
                 Vfront    3 Vsync   5 Vback   33 Vpol P
Checksum: 0x84  Unused space in Extension Block: 20 bytes

----------------

Block 5, Unknown EDID Extension Block 0x00:
  00 ff ff ff ff ff ff 00 36 69 a5 3e 00 00 00 00 '........6i.>....'
  23 21 01 04 b5 5e 27 78 3b 8b 15 af 4e 4b a7 23 '#!...^'x;...NK.#'
  0e 4f 52 a5 cb 00 81 a8 81 80 01 01 b3 00 95 28 '.OR............('
  d1 c0 b3 28 d1 e8 36 7d 70 a0 d0 a0 2c 50 30 20 '...(..6}p...,P0 '
  35 00 ac 86 31 00 00 1a 00 00 00 ff 00 45 41 35 '5...1........EA5'
  48 30 35 33 38 30 30 32 36 35 00 00 00 fd 00 30 'H053800265.....0'
  90 de de 4e 01 0a 20 20 20 20 20 20 00 00 00 fc '...N..      ....'
  00 4d 53 49 20 4d 41 47 34 30 31 51 52 0a 02 8c '.MSI MAG401QR...'
Checksum: 0x8c

----------------

Warnings:

Block 1, CTA-861 Extension Block:
  Video Capability Data Block: S_PT is equal to S_IT and S_CE, so should be set to 0 instead.
  Colorimetry Data Block: Set the sRGB colorimetry bit to avoid interop issues.
Block 4, CTA-861 Extension Block:
  Video Capability Data Block: S_PT is equal to S_IT and S_CE, so should be set to 0 instead.
  Colorimetry Data Block: Set the sRGB colorimetry bit to avoid interop issues.
EDID:
  Base EDID: Some timings are out of range of the Monitor Ranges:
    Horizontal Freq: 31.250 - 182.996 kHz (Monitor: 222.000 - 222.000 kHz)

Failures:

Block 1, CTA-861 Extension Block:
  Detailed Timing Descriptor #5: Mismatch of image size 797x333 mm vs display size 940x390 mm.
Block 2, Base EDID:
  Unknown Extension Block.
Block 3, Base EDID:
  Unknown Extension Block.
Block 4, CTA-861 Extension Block:
  Video Data Block: Duplicate VIC 1.
  Video Data Block: Duplicate VIC 92.
  Video Data Block: Duplicate VIC 4.
  Video Data Block: Duplicate VIC 16.
  Video Data Block: Duplicate VIC 19.
  Video Data Block: Duplicate VIC 18.
  Video Data Block: Duplicate VIC 90.
  Video Data Block: Duplicate VIC 63.
  Speaker Allocation Data Block: Only one instance of this Data Block is allowed.
  HDR Static Metadata Data Block: Only one instance of this Data Block is allowed.
  Video Capability Data Block: Only one instance of this Data Block is allowed.
  Colorimetry Data Block: Only one instance of this Data Block is allowed.
  Detailed Timing Descriptor #9: Mismatch of image size 797x333 mm vs display size 940x390 mm.
Block 5, Base EDID:
  Unknown Extension Block.
EDID:
  Base EDID: EDID specified 2 extension block(s), but found 5 extension block(s).
  CTA-861: Native progressive timings are a mix of several resolutions.

EDID conformity: FAIL
