
EDID (hex):
00ffffffffffff0022f07f2801010101
2b13010380342078ee4995a95437ad25
135054a56b80814081809500b300d1c0
010101010101283c80a070b023403020
360006442100001a000000fd00324c18
5311000a202020202020000000fc0048
50204c323434356d0a202020000000ff
00334351393433325854440a202000b6

Extracted contents:
header:          00 ff ff ff ff ff ff 00
serial number:   22 f0 7f 28 01 01 01 01 2b 13
version:         01 03
basic params:    80 34 20 78 ee
chroma info:     49 95 a9 54 37 ad 25 13 50 54
established:     a5 6b 80
standard:        81 40 81 80 95 00 b3 00 d1 c0 01 01 01 01 01 01
descriptor 1:    28 3c 80 a0 70 b0 23 40 30 20 36 00 06 44 21 00 00 1a
descriptor 2:    00 00 00 fd 00 32 4c 18 53 11 00 0a 20 20 20 20 20 20
descriptor 3:    00 00 00 fc 00 48 50 20 4c 32 34 34 35 6d 0a 20 20 20
descriptor 4:    00 00 00 ff 00 33 43 51 39 34 33 32 58 54 44 0a 20 20
extensions:      00
checksum:        b6

EDID version: 1.3
Manufacturer: HWP Model 287f Serial Number --
Made in week 43 of 2009
Digital display
Maximum image size: 52 cm x 32 cm
Gamma: 2.20
DPMS levels: Standby Suspend Off
RGB color display
Default (sRGB) color space is primary color space
First detailed timing is preferred timing
Display x,y Chromaticity:
  Red:   0.6611, 0.3281
  Green: 0.2167, 0.6767
  Blue:  0.1464, 0.0751
  White: 0.3134, 0.3291
Established timings supported:
  720x400@70Hz 9:5 HorFreq: 31469 Hz Clock: 28.320 MHz
  640x480@60Hz 4:3 HorFreq: 31469 Hz Clock: 25.175 MHz
  640x480@75Hz 4:3 HorFreq: 37500 Hz Clock: 31.500 MHz
  800x600@60Hz 4:3 HorFreq: 37900 Hz Clock: 40.000 MHz
  800x600@75Hz 4:3 HorFreq: 46900 Hz Clock: 49.500 MHz
  832x624@75Hz 4:3 HorFreq: 49726 Hz Clock: 57.284 MHz
  1024x768@60Hz 4:3 HorFreq: 48400 Hz Clock: 65.000 MHz
  1024x768@75Hz 4:3 HorFreq: 60000 Hz Clock: 78.750 MHz
  1280x1024@75Hz 5:4 HorFreq: 80000 Hz Clock: 135.000 MHz
  1152x870@75Hz 192:145 HorFreq: 67500 Hz Clock: 108.000 MHz
Standard timings supported:
  1280x960@60Hz 4:3 HorFreq: 60000 Hz Clock: 108.000 MHz
  1280x1024@60Hz 5:4 HorFreq: 64000 Hz Clock: 108.000 MHz
  1440x900@60Hz 16:10 HorFreq: 55500 Hz Clock: 88.750 MHz
  1680x1050@60Hz 16:10 HorFreq: 64700 Hz Clock: 119.000 MHz
  1920x1080@60Hz 16:9
Detailed mode: Clock 154.000 MHz, 518 mm x 324 mm
               1920 1968 2000 2080 hborder 0
               1200 1203 1209 1235 vborder 0
               +hsync -vsync 
               VertFreq: 59 Hz, HorFreq: 74038 Hz
Monitor ranges (GTF): 50-76Hz V, 24-83kHz H, max dotclock 170MHz
Monitor name: HP L2445m
Serial number: --
Checksum: 0xb6 (valid)
EDID block does NOT conform to EDID 1.3!
	sRGB is signaled, but the chromaticities do not match
