
EDID (hex):
00ffffffffffff002cee8c0a01010101
021f0104b53c22789f9fd1a2574c9c24
0c5054256b807140818081c0a9c0b300
d1c08100d1cf726000c8a0a033503020
350055502100001a000000fd00304b70
7024010a202020202020000000fc004b
414d4e3237514653410a2020000000ff
003031323334353637380a20202001c4
02030af12309060783018c7800c8a0a0
335030203500ba882100001e00000000
00000000000000000000000000000000
00000000000000000000000000000000
00000000000000000000000000000000
00000000000000000000000000000000
00000000000000000000000000000000
000000000000000000000000000000ae

Extracted contents:
header:          00 ff ff ff ff ff ff 00
serial number:   2c ee 8c 0a 01 01 01 01 02 1f
version:         01 04
basic params:    b5 3c 22 78 9f
chroma info:     9f d1 a2 57 4c 9c 24 0c 50 54
established:     25 6b 80
standard:        71 40 81 80 81 c0 a9 c0 b3 00 d1 c0 81 00 d1 cf
descriptor 1:    72 60 00 c8 a0 a0 33 50 30 20 35 00 55 50 21 00 00 1a
descriptor 2:    00 00 00 fd 00 30 4b 70 70 24 01 0a 20 20 20 20 20 20
descriptor 3:    00 00 00 fc 00 4b 41 4d 4e 32 37 51 46 53 41 0a 20 20
descriptor 4:    00 00 00 ff 00 30 31 32 33 34 35 36 37 38 0a 20 20 20
extensions:      01
checksum:        c4

EDID version: 1.4
Manufacturer: KGN Model a8c Serial Number --
Made in week 2 of 2021
Digital display
10 bits per primary color channel
DisplayPort interface
Maximum image size: 60 cm x 34 cm
Gamma: 2.20
DPMS levels: Standby
Supported color formats: RGB 4:4:4, YCrCb 4:4:4, YCrCb 4:2:2
Default (sRGB) color space is primary color space
First detailed timing includes the native pixel format and preferred refresh rate
Display is continuous frequency
Display x,y Chromaticity:
  Red:   0.6347, 0.3408
  Green: 0.2998, 0.6123
  Blue:  0.1435, 0.0478
  White: 0.3125, 0.3291
Established timings supported:
  640x480@60Hz 4:3 HorFreq: 31469 Hz Clock: 25.175 MHz
  640x480@75Hz 4:3 HorFreq: 37500 Hz Clock: 31.500 MHz
  800x600@60Hz 4:3 HorFreq: 37900 Hz Clock: 40.000 MHz
  800x600@75Hz 4:3 HorFreq: 46900 Hz Clock: 49.500 MHz
  832x624@75Hz 4:3 HorFreq: 49726 Hz Clock: 57.284 MHz
  1024x768@60Hz 4:3 HorFreq: 48400 Hz Clock: 65.000 MHz
  1024x768@75Hz 4:3 HorFreq: 60000 Hz Clock: 78.750 MHz
  1280x1024@75Hz 5:4 HorFreq: 80000 Hz Clock: 135.000 MHz
  1152x870@75Hz 192:145 HorFreq: 67500 Hz Clock: 108.000 MHz
Standard timings supported:
  1152x864@60Hz 4:3
  1280x1024@60Hz 5:4 HorFreq: 64000 Hz Clock: 108.000 MHz
  1280x720@60Hz 16:9
  1600x900@60Hz 16:9
  1680x1050@60Hz 16:10 HorFreq: 64700 Hz Clock: 119.000 MHz
  1920x1080@60Hz 16:9
  1280x800@60Hz 16:10
  1920x1080@75Hz 16:9
Detailed mode: Clock 246.900 MHz, 597 mm x 336 mm
               2560 2608 2640 2760 hborder 0
               1440 1443 1448 1491 vborder 0
               +hsync -vsync 
               VertFreq: 59 Hz, HorFreq: 89456 Hz
Monitor ranges (bare limits): 48-75Hz V, 112-112kHz H, max dotclock 360MHz
Monitor name: KAMN27QFSA
Serial number: --
Has 1 extension blocks
Checksum: 0xc4 (valid)

CTA extension block
Extension version: 3
6 bytes of CTA data
  Audio data block
    Linear PCM, max channels 2
      Supported sample rates (kHz): 48 44.1
      Supported sample sizes (bits): 24 20 16
  Speaker allocation data block
    Speaker map:
      FL/FR - Front Left/Right
      TpFC - Top Front Center
      LS/RS - Left/Right Surround
      TpSiL/TpSiR - Top Side Left/Right
      TpLS/TpRS - Top Left/Right Surround
      LSd/RSd - Left/Right Surround Direct
Underscans PC formats by default
Basic audio support
Supports YCbCr 4:4:4
Supports YCbCr 4:2:2
1 native detailed modes
Detailed mode: Clock 308.600 MHz, 698 mm x 392 mm
               2560 2608 2640 2760 hborder 0
               1440 1443 1448 1491 vborder 0
               +hsync +vsync 
               VertFreq: 74 Hz, HorFreq: 111811 Hz
Checksum: 0xae (valid)

EDID block does NOT conform to EDID 1.4!
	sRGB is signaled, but the chromaticities do not match
Warning: One or more of the timings is out of range of the Monitor Ranges:
  Vertical Freq: 59 - 75 Hz
  Horizontal Freq: 31469 - 111811 Hz
  Maximum Clock: 308.600 MHz
EDID block does not conform at all!
	Both the serial number and the serial string are set


