
EDID (hex):
00ffffffffffff003aac000001000000
21100103081e1778caf0649857519127
214f54a3080001010101010101010101
01010101010164190040410026301888
360030e410000018000000fe000a2020
20202020202020202020000000fc0058
47414036300a202020202020000000ff
000a20202020202020202020202000dd

Extracted contents:
header:          00 ff ff ff ff ff ff 00
serial number:   3a ac 00 00 01 00 00 00 21 10
version:         01 03
basic params:    08 1e 17 78 ca
chroma info:     f0 64 98 57 51 91 27 21 4f 54
established:     a3 08 00
standard:        01 01 01 01 01 01 01 01 01 01 01 01 01 01 01 01
descriptor 1:    64 19 00 40 41 00 26 30 18 88 36 00 30 e4 10 00 00 18
descriptor 2:    00 00 00 fe 00 0a 20 20 20 20 20 20 20 20 20 20 20 20
descriptor 3:    00 00 00 fc 00 58 47 41 40 36 30 0a 20 20 20 20 20 20
descriptor 4:    00 00 00 ff 00 0a 20 20 20 20 20 20 20 20 20 20 20 20
extensions:      00
checksum:        dd

EDID version: 1.3
Manufacturer: NUL Model 0 Serial Number --
Made in week 33 of 2006
Analog display, Input voltage level: 0.7/0.3 V
Sync: Separate 
Maximum image size: 30 cm x 23 cm
Gamma: 2.20
DPMS levels: Standby Suspend
RGB color display
First detailed timing is preferred timing
Display x,y Chromaticity:
  Red:   0.5966, 0.3427
  Green: 0.3164, 0.5664
  Blue:  0.1533, 0.1308
  White: 0.3095, 0.3281
Established timings supported:
  720x400@70Hz 9:5 HorFreq: 31469 Hz Clock: 28.320 MHz
  640x480@60Hz 4:3 HorFreq: 31469 Hz Clock: 25.175 MHz
  800x600@56Hz 4:3 HorFreq: 35200 Hz Clock: 36.000 MHz
  800x600@60Hz 4:3 HorFreq: 37900 Hz Clock: 40.000 MHz
  1024x768@60Hz 4:3 HorFreq: 48400 Hz Clock: 65.000 MHz
Standard timings supported:
Detailed mode: Clock 65.000 MHz, 304 mm x 228 mm
               1024 1048 1184 1344 hborder 0
                768  771  777  806 vborder 0
               -hsync -vsync 
               VertFreq: 60 Hz, HorFreq: 48363 Hz
ASCII string: 
Monitor name: XGA@60
Serial number: 
-- 0xdd (valid)
EDID block does NOT conform to EDID 1.3!
	Missing monitor ranges
