edid-decode (hex):

00 ff ff ff ff ff ff 00 0d af 70 15 00 00 00 00
29 13 01 03 80 23 13 78 0a 07 f5 9a 57 4e 87 26
1e 50 54 00 00 00 01 01 01 01 01 01 01 01 01 01
01 01 01 01 01 01 40 1f 56 c2 50 00 26 30 1f 41
4c 00 58 c1 10 00 00 1a a5 13 56 c2 50 00 26 30
1f 41 4c 00 58 c1 10 00 00 1a 00 00 00 fe 00 43
4d 4f 0a 20 20 20 20 20 20 20 20 20 00 00 00 fe
00 4e 31 35 36 42 36 2d 44 30 37 0a 20 20 00 99

----------------

Block 0, Base EDID:
  EDID Structure Version & Revision: 1.3
  Vendor & Product Identification:
    Manufacturer: CMO
    Model: 5488
    Made in: week 41 of 2009
  Basic Display Parameters & Features:
    Digital display
    Maximum image size: 35 cm x 19 cm
    Gamma: 2.20
    RGB color display
    First detailed timing is the preferred timing
  Color Characteristics:
    Red  : 0.6015, 0.3398
    Green: 0.3056, 0.5302
    Blue : 0.1513, 0.1201
    White: 0.3134, 0.3291
  Established Timings I & II: none
  Standard Timings: none
  Detailed Timing Descriptors:
    DTD 1:  1366x768    63.625374 Hz 683:384   51.282 kHz     80.000000 MHz (344 mm x 193 mm)
                 Hfront   31 Hsync  65 Hback   98 Hpol P
                 Vfront    4 Vsync  12 Vback   22 Vpol N
    DTD 2:  1366x768    39.996501 Hz 683:384   32.237 kHz     50.290000 MHz (344 mm x 193 mm)
                 Hfront   31 Hsync  65 Hback   98 Hpol P
                 Vfront    4 Vsync  12 Vback   22 Vpol N
    Alphanumeric Data String: 'CMO'
    Alphanumeric Data String: 'N156B6-D07'
Checksum: 0x99

----------------

Failures:

Block 0, Base EDID:
  Missing Display Product Name.
  Missing Display Range Limits Descriptor.

EDID conformity: FAIL
