edid-decode (hex):

00 ff ff ff ff ff ff 00 10 ac 1d a1 4c 51 4d 31
1a 1e 01 04 a5 35 1e 78 3a 05 f5 a5 57 52 9c 27
0b 50 54 a5 4b 00 71 4f 81 80 a9 c0 d1 c0 01 01
01 01 01 01 01 01 02 3a 80 18 71 38 2d 40 58 2c
45 00 0f 28 21 00 00 1e 00 00 00 ff 00 31 5a 36
42 4c 30 33 0a 20 20 20 20 20 00 00 00 fc 00 44
45 4c 4c 20 50 32 34 31 39 48 43 0a 00 00 00 fd
00 38 4c 1e 53 11 01 0a 20 20 20 20 20 20 00 d9

00 ff ff ff ff ff ff 00 10 ac 1d a1 4c 51 4d 31
1a 1e 01 04 a5 35 1e 78 3a 05 f5 a5 57 52 9c 27
0b 50 54 a5 4b 00 71 4f 81 80 a9 c0 d1 c0 01 01
01 01 01 01 01 01 02 3a 80 18 71 38 2d 40 58 2c
45 00 0f 28 21 00 00 1e 00 00 00 ff 00 31 5a 36
42 4c 30 33 0a 20 20 20 20 20 00 00 00 fc 00 44
45 4c 4c 20 50 32 34 31 39 48 43 0a 00 00 00 fd
00 38 4c 1e 53 11 01 0a 20 20 20 20 20 20 00 d9

----------------

Block 0, Base EDID:
  EDID Structure Version & Revision: 1.4
  Vendor & Product Identification:
    Manufacturer: DEL
    Model: 41245
    Serial Number: ...
    Made in: week 26 of 2020
  Basic Display Parameters & Features:
    Digital display
    Bits per primary color channel: 8
    DisplayPort interface
    Maximum image size: 53 cm x 30 cm
    Gamma: 2.20
    DPMS levels: Off
    Supported color formats: RGB 4:4:4, YCrCb 4:4:4, YCrCb 4:2:2
    First detailed timing includes the native pixel format and preferred refresh rate
  Color Characteristics:
    Red  : 0.6445, 0.3398
    Green: 0.3212, 0.6103
    Blue : 0.1552, 0.0458
    White: 0.3134, 0.3291
  Established Timings I & II:
    IBM     :   720x400    70.081663 Hz   9:5     31.467 kHz     28.320000 MHz
    DMT 0x04:   640x480    59.940476 Hz   4:3     31.469 kHz     25.175000 MHz
    DMT 0x06:   640x480    75.000000 Hz   4:3     37.500 kHz     31.500000 MHz
    DMT 0x09:   800x600    60.316541 Hz   4:3     37.879 kHz     40.000000 MHz
    DMT 0x0b:   800x600    75.000000 Hz   4:3     46.875 kHz     49.500000 MHz
    DMT 0x10:  1024x768    60.003840 Hz   4:3     48.363 kHz     65.000000 MHz
    DMT 0x12:  1024x768    75.028582 Hz   4:3     60.023 kHz     78.750000 MHz
    DMT 0x24:  1280x1024   75.024675 Hz   5:4     79.976 kHz    135.000000 MHz
  Standard Timings:
    DMT 0x15:  1152x864    75.000000 Hz   4:3     67.500 kHz    108.000000 MHz
    DMT 0x23:  1280x1024   60.019740 Hz   5:4     63.981 kHz    108.000000 MHz
    DMT 0x53:  1600x900    60.000000 Hz  16:9     60.000 kHz    108.000000 MHz (RB)
    DMT 0x52:  1920x1080   60.000000 Hz  16:9     67.500 kHz    148.500000 MHz
  Detailed Timing Descriptors:
    DTD 1:  1920x1080   60.000000 Hz  16:9     67.500 kHz    148.500000 MHz (527 mm x 296 mm)
                 Hfront   88 Hsync  44 Hback  148 Hpol P
                 Vfront    4 Vsync   5 Vback   36 Vpol P
    Display Product Serial Number: ...
    Display Product Name: 'DELL P2419HC'
    Display Range Limits:
      Monitor ranges (Bare Limits): 56-76 Hz V, 30-83 kHz H, max dotclock 170 MHz
Checksum: 0xd9

----------------

Block 1, Unknown EDID Extension Block 0x00:
  00 ff ff ff ff ff ff 00 10 ac 1d a1 4c 51 4d 31 '............LQM1'
  1a 1e 01 04 a5 35 1e 78 3a 05 f5 a5 57 52 9c 27 '.....5.x:...WR.''
  0b 50 54 a5 4b 00 71 4f 81 80 a9 c0 d1 c0 01 01 '.PT.K.qO........'
  01 01 01 01 01 01 02 3a 80 18 71 38 2d 40 58 2c '.......:..q8-@X,'
  45 00 0f 28 21 00 00 1e 00 00 00 ff 00 31 5a 36 'E..(!........1Z6'
  42 4c 30 33 0a 20 20 20 20 20 00 00 00 fc 00 44 'BL03.     .....D'
  45 4c 4c 20 50 32 34 31 39 48 43 0a 00 00 00 fd 'ELL P2419HC.....'
  00 38 4c 1e 53 11 01 0a 20 20 20 20 20 20 00 d9 '.8L.S...      ..'
Checksum: 0xd9

----------------

Failures:

Block 1, Base EDID:
  Unknown Extension Block.
EDID:
  Base EDID: EDID specified 0 extension block(s), but found 1 extension block(s).

EDID conformity: FAIL
