edid-decode (hex):

00 ff ff ff ff ff ff 00 4c a3 43 41 00 00 00 00
00 0f 01 03 80 1d 15 78 0a 43 de 98 57 52 8c 27
21 50 54 00 00 00 01 01 01 01 01 01 01 01 01 01
01 01 01 01 01 01 30 2a 78 20 51 1a 10 40 30 70
14 00 1e d6 10 00 00 19 00 00 00 0f 00 00 00 00
00 00 00 00 00 0f f2 02 4b 01 00 00 00 fe 00 53
41 4d 53 55 4e 47 0a 20 20 20 20 20 00 00 00 fe
00 31 34 31 50 34 2d 4c 30 33 2d 41 47 0a 00 0d

----------------

Block 0, Base EDID:
  EDID Structure Version & Revision: 1.3
  Vendor & Product Identification:
    Manufacturer: SEC
    Model: 16707
    Made in: 2005
  Basic Display Parameters & Features:
    Digital display
    Maximum image size: 29 cm x 21 cm
    Gamma: 2.20
    RGB color display
    First detailed timing is the preferred timing
  Color Characteristics:
    Red  : 0.5947, 0.3398
    Green: 0.3203, 0.5498
    Blue : 0.1552, 0.1298
    White: 0.3154, 0.3300
  Established Timings I & II: none
  Standard Timings: none
  Detailed Timing Descriptors:
    DTD 1:  1400x1050   60.019740 Hz   4:3     63.981 kHz    108.000000 MHz (286 mm x 214 mm)
                 Hfront   48 Hsync 112 Hback  128 Hpol N
                 Vfront    1 Vsync   4 Vback   11 Vpol N
    Manufacturer-Specified Display Descriptor (0x0f): 00 0f 00 00 00 00 00 00 00 00 00 0f f2 02 4b 01 '..............K.'
    Alphanumeric Data String: 'SAMSUNG'
    Alphanumeric Data String: '141P4-L03-AG'
Checksum: 0x0d

----------------

Failures:

Block 0, Base EDID:
  Missing Display Product Name.
  Missing Display Range Limits Descriptor.

EDID conformity: FAIL
