
EDID (hex):
00ffffffffffff004c2d77714e575843
2e1f0104b54024783b6115ad5045a426
0e5054bfef8081c0810081809500a9c0
b300714f01014dd000a0f0703e803020
350078682100001a000000fd0c309045
458f010a202020202020000000fc004c
53323841473730304e0a2020000000ff
0048345a524230303336390a20200214
02032cf1465f103f0403762309070783
010000e305c0006d1a0000020f309000
0461045a04e6060501615a00023a8018
71382d40582c450078682100001e565e
00a0a0a029503020350078682100001a
707e805070382d400820f80478682100
001a6fc200a0a0a05550302035007868
2100001a000000000000000000000054
7012790000030128512c0288ff0e2f02
f7801f006f0859004b00070097e20008
ff099f0007803f009f05280002000400
00000000000000000000000000000000
00000000000000000000000000000000
00000000000000000000000000000000
00000000000000000000000000000000
00000000000000000000000000008c90

edid-decode (hex):

00 ff ff ff ff ff ff 00 4c 2d 77 71 4e 57 58 43
2e 1f 01 04 b5 40 24 78 3b 61 15 ad 50 45 a4 26
0e 50 54 bf ef 80 81 c0 81 00 81 80 95 00 a9 c0
b3 00 71 4f 01 01 4d d0 00 a0 f0 70 3e 80 30 20
35 00 78 68 21 00 00 1a 00 00 00 fd 0c 30 90 45
45 8f 01 0a 20 20 20 20 20 20 00 00 00 fc 00 4c
53 32 38 41 47 37 30 30 4e 0a 20 20 00 00 00 ff
00 48 34 5a 52 42 30 30 33 36 39 0a 20 20 02 14

02 03 2c f1 46 5f 10 3f 04 03 76 23 09 07 07 83
01 00 00 e3 05 c0 00 6d 1a 00 00 02 0f 30 90 00
04 61 04 5a 04 e6 06 05 01 61 5a 00 02 3a 80 18
71 38 2d 40 58 2c 45 00 78 68 21 00 00 1e 56 5e
00 a0 a0 a0 29 50 30 20 35 00 78 68 21 00 00 1a
70 7e 80 50 70 38 2d 40 08 20 f8 04 78 68 21 00
00 1a 6f c2 00 a0 a0 a0 55 50 30 20 35 00 78 68
21 00 00 1a 00 00 00 00 00 00 00 00 00 00 00 54

70 12 79 00 00 03 01 28 51 2c 02 88 ff 0e 2f 02
f7 80 1f 00 6f 08 59 00 4b 00 07 00 97 e2 00 08
ff 09 9f 00 07 80 3f 00 9f 05 28 00 02 00 04 00
00 00 00 00 00 00 00 00 00 00 00 00 00 00 00 00
00 00 00 00 00 00 00 00 00 00 00 00 00 00 00 00
00 00 00 00 00 00 00 00 00 00 00 00 00 00 00 00
00 00 00 00 00 00 00 00 00 00 00 00 00 00 00 00
00 00 00 00 00 00 00 00 00 00 00 00 00 00 8c 90

----------------

Block 0, Base EDID:
  EDID Structure Version & Revision: 1.4
  Vendor & Product Identification:
    Manufacturer: SAM
    Model: 29047
    Serial Number: 1129862990
    Made in: week 46 of 2021
  Basic Display Parameters & Features:
    Digital display
    Bits per primary color channel: 10
    DisplayPort interface
    Maximum image size: 64 cm x 36 cm
    Gamma: 2.20
    DPMS levels: Off
    Supported color formats: RGB 4:4:4, YCrCb 4:4:4, YCrCb 4:2:2
    First detailed timing includes the native pixel format and preferred refresh rate
    Display is continuous frequency
  Color Characteristics:
    Red  : 0.6767, 0.3144
    Green: 0.2695, 0.6416
    Blue : 0.1484, 0.0556
    White: 0.3134, 0.3291
  Established Timings I & II:
    IBM     :   720x400    70.081663 Hz   9:5     31.467 kHz     28.320000 MHz
    DMT 0x04:   640x480    59.940476 Hz   4:3     31.469 kHz     25.175000 MHz
    Apple   :   640x480    66.666667 Hz   4:3     35.000 kHz     30.240000 MHz
    DMT 0x05:   640x480    72.808802 Hz   4:3     37.861 kHz     31.500000 MHz
    DMT 0x06:   640x480    75.000000 Hz   4:3     37.500 kHz     31.500000 MHz
    DMT 0x08:   800x600    56.250000 Hz   4:3     35.156 kHz     36.000000 MHz
    DMT 0x09:   800x600    60.316541 Hz   4:3     37.879 kHz     40.000000 MHz
    DMT 0x0a:   800x600    72.187572 Hz   4:3     48.077 kHz     50.000000 MHz
    DMT 0x0b:   800x600    75.000000 Hz   4:3     46.875 kHz     49.500000 MHz
    Apple   :   832x624    74.551266 Hz   4:3     49.726 kHz     57.284000 MHz
    DMT 0x10:  1024x768    60.003840 Hz   4:3     48.363 kHz     65.000000 MHz
    DMT 0x11:  1024x768    70.069359 Hz   4:3     56.476 kHz     75.000000 MHz
    DMT 0x12:  1024x768    75.028582 Hz   4:3     60.023 kHz     78.750000 MHz
    DMT 0x24:  1280x1024   75.024675 Hz   5:4     79.976 kHz    135.000000 MHz
    Apple   :  1152x870    75.061550 Hz 192:145   68.681 kHz    100.000000 MHz
  Standard Timings:
    DMT 0x55:  1280x720    60.000000 Hz  16:9     45.000 kHz     74.250000 MHz
    DMT 0x1c:  1280x800    59.810326 Hz  16:10    49.702 kHz     83.500000 MHz
    DMT 0x23:  1280x1024   60.019740 Hz   5:4     63.981 kHz    108.000000 MHz
    DMT 0x2f:  1440x900    59.887445 Hz  16:10    55.935 kHz    106.500000 MHz
    DMT 0x53:  1600x900    60.000000 Hz  16:9     60.000 kHz    108.000000 MHz (RB)
    DMT 0x3a:  1680x1050   59.954250 Hz  16:10    65.290 kHz    146.250000 MHz
    DMT 0x15:  1152x864    75.000000 Hz   4:3     67.500 kHz    108.000000 MHz
  Detailed Timing Descriptors:
    DTD 1:  3840x2160   59.996625 Hz  16:9    133.312 kHz    533.250000 MHz (632 mm x 360 mm)
                 Hfront   48 Hsync  32 Hback   80 Hpol P
                 Vfront    3 Vsync   5 Vback   54 Vpol N
    Display Range Limits:
      Monitor ranges (Bare Limits): 48-144 Hz V, 324-324 kHz H, max dotclock 1430 MHz
    Display Product Name: 'LS28AG700N'
    Display Product Serial Number: 'H4ZRB00369'
  Extension blocks: 2
Checksum: 0x14

----------------

Block 1, CTA-861 Extension Block:
  Revision: 3
  Underscans IT Video Formats by default
  Basic audio support
  Supports YCbCr 4:4:4
  Supports YCbCr 4:2:2
  Native detailed modes: 1
  Video Data Block:
    VIC  95:  3840x2160   30.000000 Hz  16:9     67.500 kHz    297.000000 MHz
    VIC  16:  1920x1080   60.000000 Hz  16:9     67.500 kHz    148.500000 MHz
    VIC  63:  1920x1080  120.000000 Hz  16:9    135.000 kHz    297.000000 MHz
    VIC   4:  1280x720    60.000000 Hz  16:9     45.000 kHz     74.250000 MHz
    VIC   3:   720x480    59.940060 Hz  16:9     31.469 kHz     27.000000 MHz
    VIC 118:  3840x2160  120.000000 Hz  16:9    270.000 kHz   1188.000000 MHz
  Audio Data Block:
    Linear PCM:
      Max channels: 2
      Supported sample rates (kHz): 48 44.1 32
      Supported sample sizes (bits): 24 20 16
  Speaker Allocation Data Block:
    FL/FR - Front Left/Right
  Colorimetry Data Block:
    BT2020YCC
    BT2020RGB
  Vendor-Specific Data Block (AMD), OUI 00-00-1A:
    Version: 2.15
    Minimum Refresh Rate: 48 Hz
    Maximum Refresh Rate: 144 Hz
    Flags 1.x: 0x00
    Flags 2.x: 0x04
    Maximum luminance: 97 (408.759 cd/m^2)
    Minimum luminance: 4 (0.001 cd/m^2)
    Maximum luminance (without local dimming): 90 (351.250 cd/m^2)
    Minimum luminance (without local dimming): 4 (0.001 cd/m^2)
  HDR Static Metadata Data Block:
    Electro optical transfer functions:
      Traditional gamma - SDR luminance range
      SMPTE ST2084
    Supported static metadata descriptors:
      Static metadata type 1
    Desired content max luminance: 97 (408.759 cd/m^2)
    Desired content max frame-average luminance: 90 (351.250 cd/m^2)
    Desired content min luminance: 0 (0.000 cd/m^2)
  Detailed Timing Descriptors:
    DTD 2:  1920x1080   60.000000 Hz  16:9     67.500 kHz    148.500000 MHz (632 mm x 360 mm)
                 Hfront   88 Hsync  44 Hback  148 Hpol P
                 Vfront    4 Vsync   5 Vback   36 Vpol P
    DTD 3:  2560x1440   59.950550 Hz  16:9     88.787 kHz    241.500000 MHz (632 mm x 360 mm)
                 Hfront   48 Hsync  32 Hback   80 Hpol P
                 Vfront    3 Vsync   5 Vback   33 Vpol N
    DTD 4:  1920x1080  143.857778 Hz  16:9    161.840 kHz    323.680000 MHz (632 mm x 360 mm)
                 Hfront    8 Hsync  32 Hback   40 Hpol P
                 Vfront   31 Vsync   8 Vback    6 Vpol N
    DTD 5:  2560x1440  119.997589 Hz  16:9    182.996 kHz    497.750000 MHz (632 mm x 360 mm)
                 Hfront   48 Hsync  32 Hback   80 Hpol P
                 Vfront    3 Vsync   5 Vback   77 Vpol N
Checksum: 0x54  Unused space in Extension Block: 11 bytes

----------------

Block 2, DisplayID Extension Block:
  Version: 1.2
  Extension Count: 0
  Display Product Type: Extension Section
  Video Timing Modes Type 1 - Detailed Timings Data Block:
    DTD:  3840x2160  143.856566 Hz   0:0    323.677 kHz   1424.180000 MHz (aspect undefined, no 3D stereo, preferred)
               Hfront  248 Hsync  32 Hback  280 Hpol P
               Vfront   76 Vsync   8 Vback    6 Vpol N
    DTD:  2560x1440  144.000477 Hz   0:0    213.265 kHz    580.080000 MHz (aspect undefined, no 3D stereo)
               Hfront    8 Hsync  64 Hback   88 Hpol P
               Vfront    3 Vsync   5 Vback   33 Vpol N
  Checksum: 0x8c
Checksum: 0x90
