
EDID (hex):
00ffffffffffff0038a3c06601010101
1c100104a5221b78e2117ea457499c24
134f54bfef80714f814f010101010101
010101010101302a009851002a403070
1300520e1100001e000000fd00384b1f
510e000a202020202020000000fc004c
434431373556584d2b0a2020000000ff
0036373030393236384e420a2020006f

Extracted contents:
header:          00 ff ff ff ff ff ff 00
serial number:   38 a3 c0 66 01 01 01 01 1c 10
version:         01 04
basic params:    a5 22 1b 78 e2
chroma info:     11 7e a4 57 49 9c 24 13 4f 54
established:     bf ef 80
standard:        71 4f 81 4f 01 01 01 01 01 01 01 01 01 01 01 01
descriptor 1:    30 2a 00 98 51 00 2a 40 30 70 13 00 52 0e 11 00 00 1e
descriptor 2:    00 00 00 fd 00 38 4b 1f 51 0e 00 0a 20 20 20 20 20 20
descriptor 3:    00 00 00 fc 00 4c 43 44 31 37 35 56 58 4d 2b 0a 20 20
descriptor 4:    00 00 00 ff 00 36 37 30 30 39 32 36 38 4e 42 0a 20 20
extensions:      00
checksum:        6f

EDID version: 1.4
Manufacturer: NEC Model 66c0 Serial Number --
Made in week 28 of 2006
Digital display
8 bits per primary color channel
DisplayPort interface
Maximum image size: 34 cm x 27 cm
Gamma: 2.20
DPMS levels: Standby Suspend Off
Supported color formats: RGB 4:4:4
First detailed timing includes the native pixel format and preferred refresh rate
Display x,y Chromaticity:
  Red:   0.6406, 0.3408
  Green: 0.2851, 0.6103
  Blue:  0.1416, 0.0771
  White: 0.3115, 0.3300
Established timings supported:
  720x400@70Hz 9:5 HorFreq: 31469 Hz Clock: 28.320 MHz
  640x480@60Hz 4:3 HorFreq: 31469 Hz Clock: 25.175 MHz
  640x480@67Hz 4:3 HorFreq: 35000 Hz Clock: 30.240 MHz
  640x480@72Hz 4:3 HorFreq: 37900 Hz Clock: 31.500 MHz
  640x480@75Hz 4:3 HorFreq: 37500 Hz Clock: 31.500 MHz
  800x600@56Hz 4:3 HorFreq: 35200 Hz Clock: 36.000 MHz
  800x600@60Hz 4:3 HorFreq: 37900 Hz Clock: 40.000 MHz
  800x600@72Hz 4:3 HorFreq: 48100 Hz Clock: 50.000 MHz
  800x600@75Hz 4:3 HorFreq: 46900 Hz Clock: 49.500 MHz
  832x624@75Hz 4:3 HorFreq: 49726 Hz Clock: 57.284 MHz
  1024x768@60Hz 4:3 HorFreq: 48400 Hz Clock: 65.000 MHz
  1024x768@70Hz 4:3 HorFreq: 56500 Hz Clock: 75.000 MHz
  1024x768@75Hz 4:3 HorFreq: 60000 Hz Clock: 78.750 MHz
  1280x1024@75Hz 5:4 HorFreq: 80000 Hz Clock: 135.000 MHz
  1152x870@75Hz 192:145 HorFreq: 67500 Hz Clock: 108.000 MHz
Standard timings supported:
  1152x864@75Hz 4:3 HorFreq: 67500 Hz Clock: 108.000 MHz
  1280x960@75Hz 4:3
Detailed mode: Clock 108.000 MHz, 338 mm x 270 mm
               1280 1328 1440 1688 hborder 0
               1024 1025 1028 1066 vborder 0
               +hsync +vsync 
               VertFreq: 60 Hz, HorFreq: 63981 Hz
Monitor ranges (GTF): 56-75Hz V, 31-81kHz H, max dotclock 140MHz
Monitor name: LCD175VXM+
Serial number: --
Checksum: 0x6f (valid)
