edid-decode (hex):

00 ff ff ff ff ff ff 00 30 e4 16 05 00 00 00 00
00 1a 01 04 a5 1f 11 78 ea 9d 35 94 5c 55 8f 29
1e 50 54 00 00 00 01 01 01 01 01 01 01 01 01 01
01 01 01 01 01 01 14 37 80 b8 70 38 24 40 30 20
35 00 35 af 10 00 00 1a b8 24 80 b8 70 38 24 40
30 20 35 00 35 af 10 00 00 1a 00 00 00 00 00 00
00 00 00 00 00 00 00 00 00 00 00 00 00 00 00 02
00 0c 47 ff 0a 3c 6e 1d 12 23 6e 00 00 00 00 43

----------------

Block 0, Base EDID:
  EDID Structure Version & Revision: 1.4
  Vendor & Product Identification:
    Manufacturer: LGD
    Model: 1302
    Made in: 2016
  Basic Display Parameters & Features:
    Digital display
    Bits per primary color channel: 8
    DisplayPort interface
    Maximum image size: 31 cm x 17 cm
    Gamma: 2.20
    DPMS levels: Standby Suspend Off
    Supported color formats: RGB 4:4:4, YCrCb 4:4:4
    First detailed timing includes the native pixel format and preferred refresh rate
  Color Characteristics:
    Red  : 0.5800, 0.3603
    Green: 0.3349, 0.5595
    Blue : 0.1601, 0.1201
    White: 0.3134, 0.3291
  Established Timings I & II: none
  Standard Timings: none
  Detailed Timing Descriptors:
    DTD 1:  1920x1080   60.049471 Hz  16:9     67.015 kHz    141.000000 MHz (309 mm x 175 mm)
                 Hfront   48 Hsync  32 Hback  104 Hpol P
                 Vfront    3 Vsync   5 Vback   28 Vpol N
    DTD 2:  1920x1080   40.032980 Hz  16:9     44.677 kHz     94.000000 MHz (309 mm x 175 mm)
                 Hfront   48 Hsync  32 Hback  104 Hpol P
                 Vfront    3 Vsync   5 Vback   28 Vpol N
    Empty Descriptor
    Manufacturer-Specified Display Descriptor (0x02): 00 02 00 0c 47 ff 0a 3c 6e 1d 12 23 6e 00 00 00 '....G..<n..#n...'
Checksum: 0x43

----------------

Warnings:

Block 0, Base EDID:
  Missing Display Product Name.

Failures:

Block 0, Base EDID:
  Empty Descriptor: Use Dummy Descriptor instead of all zeroes.

EDID conformity: FAIL
