
EDID (hex):
00ffffffffffff004ca3593600000000
00160104902213780a859599574f8f26
21505400000001010101010101010101
0101010101016432406462844830a060
350058c2100000199821406462844830
a060350058c210000019000000000000
00000000000000000000000000000002
000c4cff0a3c64201d36640000000026

Extracted contents:
header:          00 ff ff ff ff ff ff 00
serial number:   4c a3 59 36 00 00 00 00 00 16
version:         01 04
basic params:    90 22 13 78 0a
chroma info:     85 95 99 57 4f 8f 26 21 50 54
established:     00 00 00
standard:        01 01 01 01 01 01 01 01 01 01 01 01 01 01 01 01
descriptor 1:    64 32 40 64 62 84 48 30 a0 60 35 00 58 c2 10 00 00 19
descriptor 2:    98 21 40 64 62 84 48 30 a0 60 35 00 58 c2 10 00 00 19
descriptor 3:    00 00 00 00 00 00 00 00 00 00 00 00 00 00 00 00 00 00
descriptor 4:    00 00 00 02 00 0c 4c ff 0a 3c 64 20 1d 36 64 00 00 00
extensions:      00
checksum:        26

EDID version: 1.4
Manufacturer: SEC Model 3659 Serial Number --
Made in year 2012
Digital display
6 bits per primary color channel
Digital interface is not defined
Maximum image size: 34 cm x 19 cm
Gamma: 2.20
Supported color formats: RGB 4:4:4, YCrCb 4:4:4
First detailed timing includes the native pixel format and preferred refresh rate
Display x,y Chromaticity:
  Red:   0.5996, 0.3398
  Green: 0.3095, 0.5595
  Blue:  0.1503, 0.1298
  White: 0.3134, 0.3291
Established timings supported:
Standard timings supported:
Detailed mode: Clock 129.000 MHz, 344 mm x 194 mm
               1600 1760 1856 2212 hborder 0
                900  903  908  972 vborder 0
               -hsync -vsync 
               VertFreq: 59 Hz, HorFreq: 58318 Hz
Detailed mode: Clock 86.000 MHz, 344 mm x 194 mm
               1600 1760 1856 2212 hborder 0
                900  903  908  972 vborder 0
               -hsync -vsync 
               VertFreq: 39 Hz, HorFreq: 38878 Hz
Manufacturer-specified data, tag 0
Manufacturer-specified data, tag 2
Checksum: 0x26 (valid)
EDID block does NOT conform to EDID 1.4!
	Missing name descriptor
	Missing monitor ranges
