
EDID (hex):
00ffffffffffff004d10b41300000000
00000103801e1778ca00000000000000
00000000080061400101010101010101
01010101010164190040410026300c88
360030e4100000180000001000000000
00000000000000000a20000000100000
000000000000000000000a2000000010
004c5131353058314c485332200a0053

Extracted contents:
header:          00 ff ff ff ff ff ff 00
serial number:   4d 10 b4 13 00 00 00 00 00 00
version:         01 03
basic params:    80 1e 17 78 ca
chroma info:     00 00 00 00 00 00 00 00 00 00
established:     00 08 00
standard:        61 40 01 01 01 01 01 01 01 01 01 01 01 01 01 01
descriptor 1:    64 19 00 40 41 00 26 30 0c 88 36 00 30 e4 10 00 00 18
descriptor 2:    00 00 00 10 00 00 00 00 00 00 00 00 00 00 00 00 0a 20
descriptor 3:    00 00 00 10 00 00 00 00 00 00 00 00 00 00 00 00 0a 20
descriptor 4:    00 00 00 10 00 4c 51 31 35 30 58 31 4c 48 53 32 20 0a
extensions:      00
checksum:        53

EDID version: 1.3
Manufacturer: SHP Model 13b4 Serial Number --
Digital display
Maximum image size: 30 cm x 23 cm
Gamma: 2.20
DPMS levels: Standby Suspend
RGB color display
First detailed timing is preferred timing
Display x,y Chromaticity:
  Red:   0.0000, 0.0000
  Green: 0.0000, 0.0000
  Blue:  0.0000, 0.0000
  White: 0.0000, 0.0000
Established timings supported:
  1024x768@60Hz 4:3 HorFreq: 48400 Hz Clock: 65.000 MHz
Standard timings supported:
  1024x768@60Hz 4:3 HorFreq: 48400 Hz Clock: 65.000 MHz
Detailed mode: Clock 65.000 MHz, 304 mm x 228 mm
               1024 1036 1172 1344 hborder 0
                768  771  777  806 vborder 0
               -hsync -vsync 
               VertFreq: 60 Hz, HorFreq: 48363 Hz
Dummy block
Dummy block
Dummy block
Checksum: 0x53 (valid)
EDID block does NOT conform to EDID 1.3!
	Missing name descriptor
	Missing monitor ranges
EDID block does not conform at all!
	Bad year of manufacture
	Dummy block filled with garbage
