edid-decode (hex):

00 ff ff ff ff ff ff 00 63 18 00 00 00 00 00 00
09 15 01 04 6a 00 00 ff 88 99 aa a3 54 4d 95 24
19 51 54 a1 08 00 a9 40 b3 00 81 80 81 c0 81 00
81 40 95 00 01 00 1b 21 50 a0 51 00 1e 30 48 88
35 00 00 00 00 00 00 00 0e 1f 00 80 51 00 1e 30
40 80 37 00 00 00 00 00 00 00 1a 36 80 a0 70 38
1f 40 30 20 35 00 00 00 00 00 00 00 00 00 00 fc
00 4d 53 38 32 56 47 0a 20 20 20 20 20 20 00 9e

----------------

Block 0, Base EDID:
  EDID Structure Version & Revision: 1.4
  Vendor & Product Identification:
    Manufacturer: XXX
    Model: 0
    Made in: week 9 of 2011
  Basic Display Parameters & Features:
    Analog display
    Input voltage level: 0.7/0.7 V
    Blank level equals black level
    Sync: Separate SyncOnGreen
    Image size is variable
    Gamma is defined in an extension block
    DPMS levels: Standby
    RGB color display
    First detailed timing does not include the native pixel format and preferred refresh rate
  Color Characteristics:
    Red  : 0.6386, 0.3291
    Green: 0.3027, 0.5830
    Blue : 0.1425, 0.0996
    White: 0.3183, 0.3300
  Established Timings I & II:
    IBM     :   720x400    70.082 Hz   9:5    31.467 kHz  28.320 MHz
    DMT 0x04:   640x480    59.940 Hz   4:3    31.469 kHz  25.175 MHz
    DMT 0x09:   800x600    60.317 Hz   4:3    37.879 kHz  40.000 MHz
    DMT 0x10:  1024x768    60.004 Hz   4:3    48.363 kHz  65.000 MHz
  Standard Timings:
    DMT 0x33:  1600x1200   60.000 Hz   4:3    75.000 kHz 162.000 MHz
    DMT 0x3a:  1680x1050   59.954 Hz  16:10   65.290 kHz 146.250 MHz
    DMT 0x23:  1280x1024   60.020 Hz   5:4    63.981 kHz 108.000 MHz
    DMT 0x55:  1280x720    60.000 Hz  16:9    45.000 kHz  74.250 MHz
    DMT 0x1c:  1280x800    59.810 Hz  16:10   49.702 kHz  83.500 MHz
    DMT 0x20:  1280x960    60.000 Hz   4:3    60.000 kHz 108.000 MHz
    DMT 0x2f:  1440x900    59.887 Hz  16:10   55.935 kHz 106.500 MHz
  Detailed Timing Descriptors:
    DTD 1:  1360x768    59.799 Hz  85:48   47.720 kHz  84.750 MHz (analog composite, sync-on-green)
                 Hfront   72 Hsync 136 Hback 208 Hpol N
                 Vfront    3 Vsync   5 Vback  22 Vpol N
    DTD 2:  1280x768    59.870 Hz   5:3    47.776 kHz  79.500 MHz (analog composite, sync-on-green)
                 Hfront   64 Hsync 128 Hback 192 Hpol N
                 Vfront    3 Vsync   7 Vback  20 Vpol N
    DTD 3:  1920x1080   59.934 Hz  16:9    66.587 kHz 138.500 MHz (analog composite, sync-on-green)
                 Hfront   48 Hsync  32 Hback  80 Hpol N
                 Vfront    3 Vsync   5 Vback  23 Vpol N
    Display Product Name: 'MS82VG'
Checksum: 0x9e

----------------

Failures:

Block 0, Base EDID:
  Standard Timings: Use 0x0101 as the invalid Standard Timings code, not 0x0100.

EDID conformity: FAIL
