edid-decode (hex):

00 ff ff ff ff ff ff 00 63 18 00 00 00 00 00 00
24 1b 01 03 08 48 29 00 0a d7 a5 a2 59 4a 96 24
14 50 54 af ce 00 d1 c0 b3 00 81 00 81 80 81 40
81 c0 01 01 01 01 66 21 50 b0 51 00 1b 30 40 70
36 00 b9 88 21 00 00 1e 02 3a 80 18 71 38 2d 40
58 2c 45 00 b9 88 21 00 00 1a 00 00 00 fd 00 32
4c 1e 50 10 00 0a 20 20 20 20 20 20 00 00 00 fc
00 41 41 41 0a 20 20 20 20 20 20 20 20 20 00 e5

00 ff ff ff ff ff ff 00 63 18 00 00 00 00 00 00
24 1b 01 03 08 48 29 00 0a d7 a5 a2 59 4a 96 24
14 50 54 af ce 00 d1 c0 b3 00 81 00 81 80 81 40
81 c0 01 01 01 01 66 21 50 b0 51 00 1b 30 40 70
36 00 b9 88 21 00 00 1e 02 3a 80 18 71 38 2d 40
58 2c 45 00 b9 88 21 00 00 1a 00 00 00 fd 00 32
4c 1e 50 10 00 0a 20 20 20 20 20 20 00 00 00 fc
00 41 41 41 0a 20 20 20 20 20 20 20 20 20 00 e5

----------------

Block 0, Base EDID:
  EDID Structure Version & Revision: 1.3
  Vendor & Product Identification:
    Manufacturer: XXX
    Model: 0
    Made in: week 36 of 2017
  Basic Display Parameters & Features:
    Analog display
    Signal Level Standard: 0.700 : 0.300 : 1.000 V p-p
    Blank level equals black level
    Sync: Separate
    Maximum image size: 72 cm x 41 cm
    Gamma: 1.00
    RGB color display
    First detailed timing is the preferred timing
  Color Characteristics:
    Red  : 0.6357, 0.3486
    Green: 0.2900, 0.5888
    Blue : 0.1425, 0.0800
    White: 0.3134, 0.3291
  Established Timings I & II:
    IBM     :   720x400    70.081663 Hz   9:5     31.467 kHz     28.320000 MHz
    DMT 0x04:   640x480    59.940476 Hz   4:3     31.469 kHz     25.175000 MHz
    DMT 0x05:   640x480    72.808802 Hz   4:3     37.861 kHz     31.500000 MHz
    DMT 0x06:   640x480    75.000000 Hz   4:3     37.500 kHz     31.500000 MHz
    DMT 0x08:   800x600    56.250000 Hz   4:3     35.156 kHz     36.000000 MHz
    DMT 0x09:   800x600    60.316541 Hz   4:3     37.879 kHz     40.000000 MHz
    DMT 0x0a:   800x600    72.187572 Hz   4:3     48.077 kHz     50.000000 MHz
    DMT 0x0b:   800x600    75.000000 Hz   4:3     46.875 kHz     49.500000 MHz
    DMT 0x10:  1024x768    60.003840 Hz   4:3     48.363 kHz     65.000000 MHz
    DMT 0x11:  1024x768    70.069359 Hz   4:3     56.476 kHz     75.000000 MHz
    DMT 0x12:  1024x768    75.028582 Hz   4:3     60.023 kHz     78.750000 MHz
  Standard Timings:
    DMT 0x52:  1920x1080   60.000000 Hz  16:9     67.500 kHz    148.500000 MHz
    DMT 0x3a:  1680x1050   59.954250 Hz  16:10    65.290 kHz    146.250000 MHz
    DMT 0x1c:  1280x800    59.810326 Hz  16:10    49.702 kHz     83.500000 MHz
    DMT 0x23:  1280x1024   60.019740 Hz   5:4     63.981 kHz    108.000000 MHz
    DMT 0x20:  1280x960    60.000000 Hz   4:3     60.000 kHz    108.000000 MHz
    DMT 0x55:  1280x720    60.000000 Hz  16:9     45.000 kHz     74.250000 MHz
  Detailed Timing Descriptors:
    DTD 1:  1360x768    60.015162 Hz  85:48    47.712 kHz     85.500000 MHz (697 mm x 392 mm)
                 Hfront   64 Hsync 112 Hback  256 Hpol P
                 Vfront    3 Vsync   6 Vback   18 Vpol P
    DTD 2:  1920x1080   60.000000 Hz  16:9     67.500 kHz    148.500000 MHz (697 mm x 392 mm)
                 Hfront   88 Hsync  44 Hback  148 Hpol P
                 Vfront    4 Vsync   5 Vback   36 Vpol N
    Display Range Limits:
      Monitor ranges (GTF): 50-76 Hz V, 30-80 kHz H, max dotclock 160 MHz
    Display Product Name: 'AAA'
Checksum: 0xe5

----------------

Block 1, Unknown EDID Extension Block 0x00:
  00 ff ff ff ff ff ff 00 63 18 00 00 00 00 00 00 '........c.......'
  24 1b 01 03 08 48 29 00 0a d7 a5 a2 59 4a 96 24 '$....H).....YJ.$'
  14 50 54 af ce 00 d1 c0 b3 00 81 00 81 80 81 40 '.PT............@'
  81 c0 01 01 01 01 66 21 50 b0 51 00 1b 30 40 70 '......f!P.Q..0@p'
  36 00 b9 88 21 00 00 1e 02 3a 80 18 71 38 2d 40 '6...!....:..q8-@'
  58 2c 45 00 b9 88 21 00 00 1a 00 00 00 fd 00 32 'X,E...!........2'
  4c 1e 50 10 00 0a 20 20 20 20 20 20 00 00 00 fc 'L.P...      ....'
  00 41 41 41 0a 20 20 20 20 20 20 20 20 20 00 e5 '.AAA.         ..'
Checksum: 0xe5

----------------

Warnings:

Block 0, Base EDID:
  Detailed Timing Descriptor #2: DTD is similar but not identical to VIC 16.

Failures:

Block 0, Base EDID:
  Detailed Timing Descriptor #1: Mismatch of image size 697x392 mm vs display size 720x410 mm.
  Detailed Timing Descriptor #2: Mismatch of image size 697x392 mm vs display size 720x410 mm.
Block 1, Base EDID:
  Unknown Extension Block.
EDID:
  Base EDID: EDID specified 0 extension block(s), but found 1 extension block(s).

EDID conformity: FAIL
