
EDID (hex):
00ffffffffffff006318000000000000
06160103080000000ad7a5a2594a9624
145054afce00a9c001018100814081c0
0101010101012f2640a060841a303020
350050120000001a662150b051001b30
407036003f432100001e000000fd0032
4c1e5010000a202020202020000000fc
004141410a20202020202020200a00f1

Extracted contents:
header:          00 ff ff ff ff ff ff 00
serial number:   63 18 00 00 00 00 00 00 06 16
version:         01 03
basic params:    08 00 00 00 0a
chroma info:     d7 a5 a2 59 4a 96 24 14 50 54
established:     af ce 00
standard:        a9 c0 01 01 81 00 81 40 81 c0 01 01 01 01 01 01
descriptor 1:    2f 26 40 a0 60 84 1a 30 30 20 35 00 50 12 00 00 00 1a
descriptor 2:    66 21 50 b0 51 00 1b 30 40 70 36 00 3f 43 21 00 00 1e
descriptor 3:    00 00 00 fd 00 32 4c 1e 50 10 00 0a 20 20 20 20 20 20
descriptor 4:    00 00 00 fc 00 41 41 41 0a 20 20 20 20 20 20 20 20 0a
extensions:      00
checksum:        f1

EDID version: 1.3
Manufacturer: XXX Model 0 Serial Number --
Made in week 6 of 2012
Analog display, Input voltage level: 0.7/0.3 V
Sync: Separate 
Image size is variable
Gamma: 1.00
RGB color display
First detailed timing is preferred timing
Display x,y Chromaticity:
  Red:   0.6357, 0.3486
  Green: 0.2900, 0.5888
  Blue:  0.1425, 0.0800
  White: 0.3134, 0.3291
Established timings supported:
  720x400@70Hz 9:5 HorFreq: 31469 Hz Clock: 28.320 MHz
  640x480@60Hz 4:3 HorFreq: 31469 Hz Clock: 25.175 MHz
  640x480@72Hz 4:3 HorFreq: 37900 Hz Clock: 31.500 MHz
  640x480@75Hz 4:3 HorFreq: 37500 Hz Clock: 31.500 MHz
  800x600@56Hz 4:3 HorFreq: 35200 Hz Clock: 36.000 MHz
  800x600@60Hz 4:3 HorFreq: 37900 Hz Clock: 40.000 MHz
  800x600@72Hz 4:3 HorFreq: 48100 Hz Clock: 50.000 MHz
  800x600@75Hz 4:3 HorFreq: 46900 Hz Clock: 49.500 MHz
  1024x768@60Hz 4:3 HorFreq: 48400 Hz Clock: 65.000 MHz
  1024x768@70Hz 4:3 HorFreq: 56500 Hz Clock: 75.000 MHz
  1024x768@75Hz 4:3 HorFreq: 60000 Hz Clock: 78.750 MHz
Standard timings supported:
  1600x900@60Hz 16:9
  1280x800@60Hz 16:10
  1280x960@60Hz 4:3 HorFreq: 60000 Hz Clock: 108.000 MHz
  1280x720@60Hz 16:9
Detailed mode: Clock 97.750 MHz, 80 mm x 18 mm
               1600 1648 1680 1760 hborder 0
                900  903  908  926 vborder 0
               +hsync -vsync 
               VertFreq: 59 Hz, HorFreq: 55539 Hz
Detailed mode: Clock 85.500 MHz, 575 mm x 323 mm
               1360 1424 1536 1792 hborder 0
                768  771  777  795 vborder 0
               +hsync +vsync 
               VertFreq: 60 Hz, HorFreq: 47712 Hz
Monitor ranges (GTF): 50-76Hz V, 30-80kHz H, max dotclock 160MHz
Monitor name: AAA
Checksum: 0xf1 (valid)
EDID block does NOT conform to EDID 1.3!
	Detailed block string not properly terminated
