edid-decode (hex):

00 ff ff ff ff ff ff 00 0d ae b9 15 00 00 00 00
30 17 01 04 90 22 13 78 02 46 35 9e 57 57 94 27
14 50 54 00 00 00 01 01 01 01 01 01 01 01 01 01
01 01 01 01 01 01 14 37 80 b8 70 38 24 40 26 3c
46 00 58 c1 10 00 00 1a b8 24 80 b8 70 38 24 40
26 3c 46 00 58 c1 10 00 00 1a 00 00 00 00 00 00
00 00 00 00 00 00 00 00 00 00 00 00 00 00 00 02
00 0c 2b db 12 3c 96 1f 13 2d a6 00 00 00 00 26

----------------

Block 0, Base EDID:
  EDID Structure Version & Revision: 1.4
  Vendor & Product Identification:
    Manufacturer: CMN
    Model: 5561
    Made in: week 48 of 2013
  Basic Display Parameters & Features:
    Digital display
    Bits per primary color channel: 6
    Digital interface is not defined
    Maximum image size: 34 cm x 19 cm
    Gamma: 2.20
    Supported color formats: RGB 4:4:4
    First detailed timing includes the native pixel format and preferred refresh rate
  Color Characteristics:
    Red  : 0.6181, 0.3398
    Green: 0.3408, 0.5800
    Blue : 0.1523, 0.0810
    White: 0.3134, 0.3291
  Established Timings I & II: none
  Standard Timings: none
  Detailed Timing Descriptors:
    DTD 1:  1920x1080   60.049 Hz  16:9    67.015 kHz 141.000 MHz (344 mm x 193 mm)
                 Hfront   38 Hsync  60 Hback  86 Hpol P
                 Vfront    4 Vsync   6 Vback  26 Vpol N
    DTD 2:  1920x1080   40.033 Hz  16:9    44.677 kHz  94.000 MHz (344 mm x 193 mm)
                 Hfront   38 Hsync  60 Hback  86 Hpol P
                 Vfront    4 Vsync   6 Vback  26 Vpol N
    Empty Descriptor
    Manufacturer-Specified Display Descriptor (0x02): 00 02 00 0c 2b db 12 3c 96 1f 13 2d a6 00 00 00 '....+..<...-....'
Checksum: 0x26

----------------

Failures:

Block 0, Base EDID:
  Empty Descriptor: Use Dummy Descriptor instead of all zeroes.
  Missing Display Product Name.

EDID conformity: FAIL
