
EDID (hex):
00ffffffffffff000472000100000000
111401030e2917782e3d85a6564a9a24
12505401080081c00101010101010101
010101010101662156aa51001e30468f
33009ae61000001e000000ff00000a20
20202020202020202020000000fd0032
4c1e3f0b000a202020202020000000fc
0041494f204c43440a2020202020003a

Extracted contents:
header:          00 ff ff ff ff ff ff 00
serial number:   04 72 00 01 00 00 00 00 11 14
version:         01 03
basic params:    0e 29 17 78 2e
chroma info:     3d 85 a6 56 4a 9a 24 12 50 54
established:     01 08 00
standard:        81 c0 01 01 01 01 01 01 01 01 01 01 01 01 01 01
descriptor 1:    66 21 56 aa 51 00 1e 30 46 8f 33 00 9a e6 10 00 00 1e
descriptor 2:    00 00 00 ff 00 00 0a 20 20 20 20 20 20 20 20 20 20 20
descriptor 3:    00 00 00 fd 00 32 4c 1e 3f 0b 00 0a 20 20 20 20 20 20
descriptor 4:    00 00 00 fc 00 41 49 4f 20 4c 43 44 0a 20 20 20 20 20
extensions:      00
checksum:        3a

EDID version: 1.3
Manufacturer: ACR Model 100 Serial Number --
Made in week 17 of 2010
Analog display, Input voltage level: 0.7/0.3 V
Sync: Separate Composite SyncOnGreen 
Maximum image size: 41 cm x 23 cm
Gamma: 2.20
DPMS levels: Off
RGB color display
Default (sRGB) color space is primary color space
First detailed timing is preferred timing
Display x,y Chromaticity:
  Red:   0.6484, 0.3388
  Green: 0.2919, 0.6025
  Blue:  0.1425, 0.0703
  White: 0.3134, 0.3291
Established timings supported:
  800x600@60Hz 4:3 HorFreq: 37900 Hz Clock: 40.000 MHz
  1024x768@60Hz 4:3 HorFreq: 48400 Hz Clock: 65.000 MHz
Standard timings supported:
  1280x720@60Hz 16:9
Detailed mode: Clock 85.500 MHz, 410 mm x 230 mm
               1366 1436 1579 1792 hborder 0
                768  771  774  798 vborder 0
               +hsync +vsync 
               VertFreq: 59 Hz, HorFreq: 47712 Hz
Serial number: 
-- ranges (GTF): 50-76Hz V, 30-63kHz H, max dotclock 110MHz
Monitor name: AIO LCD
Checksum: 0x3a (valid)
EDID block does NOT conform to EDID 1.3!
	sRGB is signaled, but the chromaticities do not match
	Detailed block string not properly terminated
