
EDID (hex):
00ffffffffffff005a6311f401010101
2d0d0104a5241d78221676a25a4b9724
184f54bfef0081800101010101010101
010101010101302a009851002a403070
1300651e1100001e000000ff00413237
3033343530313734360a000000fd0032
4b1e530e000a202020202020000000fc
005647383030622d320a2020202000a9

Extracted contents:
header:          00 ff ff ff ff ff ff 00
serial number:   5a 63 11 f4 01 01 01 01 2d 0d
version:         01 04
basic params:    a5 24 1d 78 22
chroma info:     16 76 a2 5a 4b 97 24 18 4f 54
established:     bf ef 00
standard:        81 80 01 01 01 01 01 01 01 01 01 01 01 01 01 01
descriptor 1:    30 2a 00 98 51 00 2a 40 30 70 13 00 65 1e 11 00 00 1e
descriptor 2:    00 00 00 ff 00 41 32 37 30 33 34 35 30 31 37 34 36 0a
descriptor 3:    00 00 00 fd 00 32 4b 1e 53 0e 00 0a 20 20 20 20 20 20
descriptor 4:    00 00 00 fc 00 56 47 38 30 30 62 2d 32 0a 20 20 20 20
extensions:      00
checksum:        a9

EDID version: 1.4
Manufacturer: VSC Model f411 Serial Number --
Digital display
8 bits per primary color channel
DisplayPort interface
Maximum image size: 36 cm x 29 cm
Gamma: 2.20
DPMS levels: Off
Supported color formats: RGB 4:4:4
First detailed timing includes the native pixel format and preferred refresh rate
Display x,y Chromaticity:
  Red:   0.6328, 0.3525
  Green: 0.2939, 0.5917
  Blue:  0.1416, 0.0966
  White: 0.3095, 0.3300
Established timings supported:
  720x400@70Hz 9:5 HorFreq: 31469 Hz Clock: 28.320 MHz
  640x480@60Hz 4:3 HorFreq: 31469 Hz Clock: 25.175 MHz
  640x480@67Hz 4:3 HorFreq: 35000 Hz Clock: 30.240 MHz
  640x480@72Hz 4:3 HorFreq: 37900 Hz Clock: 31.500 MHz
  640x480@75Hz 4:3 HorFreq: 37500 Hz Clock: 31.500 MHz
  800x600@56Hz 4:3 HorFreq: 35200 Hz Clock: 36.000 MHz
  800x600@60Hz 4:3 HorFreq: 37900 Hz Clock: 40.000 MHz
  800x600@72Hz 4:3 HorFreq: 48100 Hz Clock: 50.000 MHz
  800x600@75Hz 4:3 HorFreq: 46900 Hz Clock: 49.500 MHz
  832x624@75Hz 4:3 HorFreq: 49726 Hz Clock: 57.284 MHz
  1024x768@60Hz 4:3 HorFreq: 48400 Hz Clock: 65.000 MHz
  1024x768@70Hz 4:3 HorFreq: 56500 Hz Clock: 75.000 MHz
  1024x768@75Hz 4:3 HorFreq: 60000 Hz Clock: 78.750 MHz
  1280x1024@75Hz 5:4 HorFreq: 80000 Hz Clock: 135.000 MHz
Standard timings supported:
  1280x1024@60Hz 5:4 HorFreq: 64000 Hz Clock: 108.000 MHz
Detailed mode: Clock 108.000 MHz, 357 mm x 286 mm
               1280 1328 1440 1688 hborder 0
               1024 1025 1028 1066 vborder 0
               +hsync +vsync 
               VertFreq: 60 Hz, HorFreq: 63981 Hz
Serial number: --
Monitor ranges (GTF): 50-75Hz V, 30-83kHz H, max dotclock 140MHz
Monitor name: VG800b-2
Checksum: 0xa9 (valid)
EDID block does not conform at all!
	Bad year of manufacture
