
EDID (hex):
00ffffffffffff000e14421f00000000
2e140103802615780a4e4d9e57549126
0f505400000001010101010101010101
010101010101322640a060841a303020
35007ed710000018322640a060841a30
302035007ed710000018000000fe0043
50540a202020202020202020000000fe
00434c414131373355413031412000c1

Extracted contents:
header:          00 ff ff ff ff ff ff 00
serial number:   0e 14 42 1f 00 00 00 00 2e 14
version:         01 03
basic params:    80 26 15 78 0a
chroma info:     4e 4d 9e 57 54 91 26 0f 50 54
established:     00 00 00
standard:        01 01 01 01 01 01 01 01 01 01 01 01 01 01 01 01
descriptor 1:    32 26 40 a0 60 84 1a 30 30 20 35 00 7e d7 10 00 00 18
descriptor 2:    32 26 40 a0 60 84 1a 30 30 20 35 00 7e d7 10 00 00 18
descriptor 3:    00 00 00 fe 00 43 50 54 0a 20 20 20 20 20 20 20 20 20
descriptor 4:    00 00 00 fe 00 43 4c 41 41 31 37 33 55 41 30 31 41 20
extensions:      00
checksum:        c1

EDID version: 1.3
Manufacturer: CPT Model 1f42 Serial Number --
Made in week 46 of 2010
Digital display
Maximum image size: 38 cm x 21 cm
Gamma: 2.20
RGB color display
First detailed timing is preferred timing
Display x,y Chromaticity:
  Red:   0.6181, 0.3398
  Green: 0.3310, 0.5683
  Blue:  0.1494, 0.0585
  White: 0.3154, 0.3291
Established timings supported:
Standard timings supported:
Detailed mode: Clock 97.780 MHz, 382 mm x 215 mm
               1600 1648 1680 1760 hborder 0
                900  903  908  926 vborder 0
               -hsync -vsync 
               VertFreq: 59 Hz, HorFreq: 55556 Hz
Detailed mode: Clock 97.780 MHz, 382 mm x 215 mm
               1600 1648 1680 1760 hborder 0
                900  903  908  926 vborder 0
               -hsync -vsync 
               VertFreq: 59 Hz, HorFreq: 55556 Hz
ASCII string: CPT
ASCII string: CLAA173UA01A 
Checksum: 0xc1 (valid)
EDID block does NOT conform to EDID 1.3!
	Missing name descriptor
	Missing monitor ranges
