edid-decode (hex):

00 ff ff ff ff ff ff 00 4d 10 7a 14 00 00 00 00
05 1b 01 04 a5 1a 0e 78 06 de 50 a3 54 4c 99 26
0f 50 54 00 00 00 01 01 01 01 01 01 01 01 01 01
01 01 01 01 01 01 1a 36 80 a0 70 38 1f 40 30 20
35 00 00 90 10 00 00 18 00 00 00 10 00 00 00 00
00 00 00 00 00 00 00 00 00 00 00 00 00 10 00 00
00 00 00 00 00 00 00 00 00 00 00 00 00 00 00 fc
00 4c 51 31 31 36 4d 31 4a 58 30 36 0a 20 00 03

----------------

Block 0, Base EDID:
  EDID Structure Version & Revision: 1.4
  Vendor & Product Identification:
    Manufacturer: SHP
    Model: 5242
    Made in: week 5 of 2017
  Basic Display Parameters & Features:
    Digital display
    Bits per primary color channel: 8
    DisplayPort interface
    Maximum image size: 26 cm x 14 cm
    Gamma: 2.20
    Supported color formats: RGB 4:4:4
    Default (sRGB) color space is primary color space
    First detailed timing includes the native pixel format and preferred refresh rate
  Color Characteristics:
    Red  : 0.6396, 0.3291
    Green: 0.2998, 0.5996
    Blue : 0.1494, 0.0595
    White: 0.3125, 0.3281
  Established Timings I & II: none
  Standard Timings: none
  Detailed Timing Descriptors:
    DTD 1:  1920x1080   59.933878 Hz  16:9     66.587 kHz    138.500000 MHz (256 mm x 144 mm)
                 Hfront   48 Hsync  32 Hback   80 Hpol N
                 Vfront    3 Vsync   5 Vback   23 Vpol N
    Dummy Descriptor:
    Dummy Descriptor:
    Display Product Name: 'LQ116M1JX06'
Checksum: 0x03

----------------

Failures:

Block 0, Base EDID:
  Basic Display Parameters & Features: sRGB is signaled, but the chromaticities do not match.

EDID conformity: FAIL
