edid-decode (hex):

00 ff ff ff ff ff ff 00 28 9a 3d e0 00 00 00 00
11 20 01 04 a5 1f 11 78 0a 1b bb a6 58 55 9d 26
0e 4f 55 00 00 00 01 01 01 01 01 01 01 01 01 01
01 01 01 01 01 01 9c 3b 80 36 71 38 3c 40 30 20
36 00 35 ae 10 00 00 1a a8 2f 80 36 71 38 3c 40
30 20 36 00 35 ae 10 00 00 1a 00 00 00 fe 00 47
31 34 30 45 41 31 34 0a 20 20 20 20 00 00 00 fe
00 47 31 34 30 45 41 31 34 0a 20 20 20 20 00 c4

00 ff ff ff ff ff ff 00 28 9a 3d e0 00 00 00 00
11 20 01 04 a5 1f 11 78 0a 1b bb a6 58 55 9d 26
0e 4f 55 00 00 00 01 01 01 01 01 01 01 01 01 01
01 01 01 01 01 01 9c 3b 80 36 71 38 3c 40 30 20
36 00 35 ae 10 00 00 1a a8 2f 80 36 71 38 3c 40
30 20 36 00 35 ae 10 00 00 1a 00 00 00 fe 00 47
31 34 30 45 41 31 34 0a 20 20 20 20 00 00 00 fe
00 47 31 34 30 45 41 31 34 0a 20 20 20 20 00 c4

----------------

Block 0, Base EDID:
  EDID Structure Version & Revision: 1.4
  Vendor & Product Identification:
    Manufacturer: JDZ
    Model: 57405
    Made in: week 17 of 2022
  Basic Display Parameters & Features:
    Digital display
    Bits per primary color channel: 8
    DisplayPort interface
    Maximum image size: 31 cm x 17 cm
    Gamma: 2.20
    Supported color formats: RGB 4:4:4, YCrCb 4:4:4
    First detailed timing includes the native pixel format and preferred refresh rate
  Color Characteristics:
    Red  : 0.6484, 0.3447
    Green: 0.3339, 0.6162
    Blue : 0.1503, 0.0576
    White: 0.3105, 0.3349
  Established Timings I & II: none
  Standard Timings: none
  Detailed Timing Descriptors:
    DTD 1:  1920x1080   60.026748 Hz  16:9     68.430 kHz    152.600000 MHz (309 mm x 174 mm)
                 Hfront   48 Hsync  32 Hback  230 Hpol P
                 Vfront    3 Vsync   6 Vback   51 Vpol N
    DTD 2:  1920x1080   47.989930 Hz  16:9     54.709 kHz    122.000000 MHz (309 mm x 174 mm)
                 Hfront   48 Hsync  32 Hback  230 Hpol P
                 Vfront    3 Vsync   6 Vback   51 Vpol N
    Alphanumeric Data String: 'G140EA14'
    Alphanumeric Data String: 'G140EA14'
Checksum: 0xc4

----------------

Block 1, Unknown EDID Extension Block 0x00:
  00 ff ff ff ff ff ff 00 28 9a 3d e0 00 00 00 00 '........(.=.....'
  11 20 01 04 a5 1f 11 78 0a 1b bb a6 58 55 9d 26 '. .....x....XU.&'
  0e 4f 55 00 00 00 01 01 01 01 01 01 01 01 01 01 '.OU.............'
  01 01 01 01 01 01 9c 3b 80 36 71 38 3c 40 30 20 '.......;.6q8<@0 '
  36 00 35 ae 10 00 00 1a a8 2f 80 36 71 38 3c 40 '6.5....../.6q8<@'
  30 20 36 00 35 ae 10 00 00 1a 00 00 00 fe 00 47 '0 6.5..........G'
  31 34 30 45 41 31 34 0a 20 20 20 20 00 00 00 fe '140EA14.    ....'
  00 47 31 34 30 45 41 31 34 0a 20 20 20 20 00 c4 '.G140EA14.    ..'
Checksum: 0xc4

----------------

Warnings:

Block 0, Base EDID:
  Missing Display Product Name.

Failures:

Block 1, Base EDID:
  Unknown Extension Block.
EDID:
  Base EDID: EDID specified 0 extension block(s), but found 1 extension block(s).

EDID conformity: FAIL
