edid-decode (hex):

00 ff ff ff ff ff ff 00 06 af 3c 10 00 00 00 00
00 19 01 04 95 1f 11 78 02 9f e5 96 58 53 8a 26
24 50 54 00 00 00 01 01 01 01 01 01 01 01 01 01
01 01 01 01 01 01 ce 1d 56 e2 50 00 1e 30 26 16
36 00 35 ad 10 00 00 1a e2 13 56 e2 50 00 1e 30
26 16 36 00 35 ad 10 00 00 1a 00 00 00 00 00 00
00 00 00 00 00 00 00 00 00 00 00 00 00 00 00 02
00 10 4c ff 0f 3c 64 11 0f 19 64 20 20 20 00 ca

----------------

Block 0, Base EDID:
  EDID Structure Version & Revision: 1.4
  Vendor & Product Identification:
    Manufacturer: AUO
    Model: 4156
    Made in: 2015
  Basic Display Parameters & Features:
    Digital display
    Bits per primary color channel: 6
    DisplayPort interface
    Maximum image size: 31 cm x 17 cm
    Gamma: 2.20
    Supported color formats: RGB 4:4:4
    First detailed timing includes the native pixel format and preferred refresh rate
  Color Characteristics:
    Red  : 0.5878, 0.3447
    Green: 0.3271, 0.5419
    Blue : 0.1513, 0.1425
    White: 0.3134, 0.3291
  Established Timings I & II: none
  Standard Timings: none
  Detailed Timing Descriptors:
    DTD 1:  1366x768    60.059 Hz 683:384  47.927 kHz  76.300 MHz (309 mm x 173 mm)
                 Hfront   38 Hsync  22 Hback 166 Hpol P
                 Vfront    3 Vsync   6 Vback  21 Vpol N
    DTD 2:  1366x768    40.066 Hz 683:384  31.972 kHz  50.900 MHz (309 mm x 173 mm)
                 Hfront   38 Hsync  22 Hback 166 Hpol P
                 Vfront    3 Vsync   6 Vback  21 Vpol N
    Empty Descriptor
    Manufacturer-Specified Display Descriptor (0x02): 00 02 00 10 4c ff 0f 3c 64 11 0f 19 64 20 20 20 '....L..<d...d   '
Checksum: 0xca

----------------

Failures:

Block 0, Base EDID:
  Empty Descriptor: Use Dummy Descriptor instead of all zeroes.
  Missing Display Product Name.

EDID conformity: FAIL
