
EDID (hex):
00ffffffffffff0006af3c1000000000
00170104901f117802bbf59455549027
23505400000001010101010101010101
010101010101c01c56a0500023302616
360035ad1000001a2b1356a050002330
2616360035ad1000001a000000fe0056
584b4a58804231343058545400000000
00004122960111000001010a202000a5

Extracted contents:
header:          00 ff ff ff ff ff ff 00
serial number:   06 af 3c 10 00 00 00 00 00 17
version:         01 04
basic params:    90 1f 11 78 02
chroma info:     bb f5 94 55 54 90 27 23 50 54
established:     00 00 00
standard:        01 01 01 01 01 01 01 01 01 01 01 01 01 01 01 01
descriptor 1:    c0 1c 56 a0 50 00 23 30 26 16 36 00 35 ad 10 00 00 1a
descriptor 2:    2b 13 56 a0 50 00 23 30 26 16 36 00 35 ad 10 00 00 1a
descriptor 3:    00 00 00 fe 00 56 58 4b 4a 58 80 42 31 34 30 58 54 54
descriptor 4:    00 00 00 00 00 00 41 22 96 01 11 00 00 01 01 0a 20 20
extensions:      00
checksum:        a5

EDID version: 1.4
Manufacturer: AUO Model 103c Serial Number --
Made in year 2013
Digital display
6 bits per primary color channel
Digital interface is not defined
Maximum image size: 31 cm x 17 cm
Gamma: 2.20
Supported color formats: RGB 4:4:4
First detailed timing includes the native pixel format and preferred refresh rate
Display x,y Chromaticity:
  Red:   0.5800, 0.3349
  Green: 0.3300, 0.5654
  Blue:  0.1552, 0.1396
  White: 0.3134, 0.3291
Established timings supported:
Standard timings supported:
Detailed mode: Clock 73.600 MHz, 309 mm x 173 mm
               1366 1404 1426 1526 hborder 0
                768  771  777  803 vborder 0
               +hsync -vsync 
               VertFreq: 60 Hz, HorFreq: 48230 Hz
Detailed mode: Clock 49.070 MHz, 309 mm x 173 mm
               1366 1404 1426 1526 hborder 0
                768  771  777  803 vborder 0
               +hsync -vsync 
               VertFreq: 40 Hz, HorFreq: 32155 Hz
ASCII string: VXKJX
Manufacturer-specified data, tag 0
Checksum: 0xa5 (valid)
EDID block does NOT conform to EDID 1.4!
	Missing name descriptor
	Missing monitor ranges
	Detailed block string not properly terminated
