
EDID (hex):
00ffffffffffff0038a3716701010101
1313010308301b78eae615a655499927
135054bfef00714f814f81c0950fb300
818001010101023a801871382d40160b
4500dd0c1100001e000000fd00374c1f
5111000a202020202020000000fc0056
323231570a20202020202020000000ff
0039353130313734324e420a2020000e

Extracted contents:
header:          00 ff ff ff ff ff ff 00
serial number:   38 a3 71 67 01 01 01 01 13 13
version:         01 03
basic params:    08 30 1b 78 ea
chroma info:     e6 15 a6 55 49 99 27 13 50 54
established:     bf ef 00
standard:        71 4f 81 4f 81 c0 95 0f b3 00 81 80 01 01 01 01
descriptor 1:    02 3a 80 18 71 38 2d 40 16 0b 45 00 dd 0c 11 00 00 1e
descriptor 2:    00 00 00 fd 00 37 4c 1f 51 11 00 0a 20 20 20 20 20 20
descriptor 3:    00 00 00 fc 00 56 32 32 31 57 0a 20 20 20 20 20 20 20
descriptor 4:    00 00 00 ff 00 39 35 31 30 31 37 34 32 4e 42 0a 20 20
extensions:      00
checksum:        0e

EDID version: 1.3
Manufacturer: NEC Model 6771 Serial Number --
Made in week 19 of 2009
Analog display, Input voltage level: 0.7/0.3 V
Sync: Separate 
Maximum image size: 48 cm x 27 cm
Gamma: 2.20
DPMS levels: Standby Suspend Off
RGB color display
First detailed timing is preferred timing
Display x,y Chromaticity:
  Red:   0.6513, 0.3339
  Green: 0.2861, 0.5996
  Blue:  0.1523, 0.0751
  White: 0.3134, 0.3291
Established timings supported:
  720x400@70Hz 9:5 HorFreq: 31469 Hz Clock: 28.320 MHz
  640x480@60Hz 4:3 HorFreq: 31469 Hz Clock: 25.175 MHz
  640x480@67Hz 4:3 HorFreq: 35000 Hz Clock: 30.240 MHz
  640x480@72Hz 4:3 HorFreq: 37900 Hz Clock: 31.500 MHz
  640x480@75Hz 4:3 HorFreq: 37500 Hz Clock: 31.500 MHz
  800x600@56Hz 4:3 HorFreq: 35200 Hz Clock: 36.000 MHz
  800x600@60Hz 4:3 HorFreq: 37900 Hz Clock: 40.000 MHz
  800x600@72Hz 4:3 HorFreq: 48100 Hz Clock: 50.000 MHz
  800x600@75Hz 4:3 HorFreq: 46900 Hz Clock: 49.500 MHz
  832x624@75Hz 4:3 HorFreq: 49726 Hz Clock: 57.284 MHz
  1024x768@60Hz 4:3 HorFreq: 48400 Hz Clock: 65.000 MHz
  1024x768@70Hz 4:3 HorFreq: 56500 Hz Clock: 75.000 MHz
  1024x768@75Hz 4:3 HorFreq: 60000 Hz Clock: 78.750 MHz
  1280x1024@75Hz 5:4 HorFreq: 80000 Hz Clock: 135.000 MHz
Standard timings supported:
  1152x864@75Hz 4:3 HorFreq: 67500 Hz Clock: 108.000 MHz
  1280x960@75Hz 4:3
  1280x720@60Hz 16:9
  1440x900@75Hz 16:10 HorFreq: 82300 Hz Clock: 156.000 MHz
  1680x1050@60Hz 16:10 HorFreq: 64700 Hz Clock: 119.000 MHz
  1280x1024@60Hz 5:4 HorFreq: 64000 Hz Clock: 108.000 MHz
Detailed mode: Clock 148.500 MHz, 477 mm x 268 mm
               1920 1942 1953 2200 hborder 0
               1080 1084 1089 1125 vborder 0
               +hsync +vsync 
               VertFreq: 60 Hz, HorFreq: 67500 Hz
Monitor ranges (GTF): 55-76Hz V, 31-81kHz H, max dotclock 170MHz
Monitor name: V221W
Serial number: --
Checksum: 0xe (valid)
One or more of the timings is out of range of the Monitor Ranges:
  Vertical Freq: 56 - 75 Hz
  Horizontal Freq: 31469 - 82300 Hz
  Maximum Clock: 156.000 MHz
