
EDID (hex):
00ffffffffffff00220e933601010101
281f0103803c22782af655a656529b27
0c5054a10800d1c0a9c081c0b3009500
810081800101023a801871382d40582c
450056512100001e000000fd00323c1e
5011000a202020202020000000fc0048
50204532372047340a202020000000ff
00434e4b3134303056484e0a202001f8
020319b149901f041303120211016703
0c0010000022e2006b023a801871382d
40582c450056512100001e023a80d072
382d40102c458056512100001e000000
00000000000000000000000000000000
00000000000000000000000000000000
00000000000000000000000000000000
000000000000000000000000000000e1

Extracted contents:
header:          00 ff ff ff ff ff ff 00
serial number:   22 0e 93 36 01 01 01 01 28 1f
version:         01 03
basic params:    80 3c 22 78 2a
chroma info:     f6 55 a6 56 52 9b 27 0c 50 54
established:     a1 08 00
standard:        d1 c0 a9 c0 81 c0 b3 00 95 00 81 00 81 80 01 01
descriptor 1:    02 3a 80 18 71 38 2d 40 58 2c 45 00 56 51 21 00 00 1e
descriptor 2:    00 00 00 fd 00 32 3c 1e 50 11 00 0a 20 20 20 20 20 20
descriptor 3:    00 00 00 fc 00 48 50 20 45 32 37 20 47 34 0a 20 20 20
descriptor 4:    00 00 00 ff 00 43 4e 4b 31 34 30 30 56 48 4e 0a 20 20
extensions:      01
checksum:        f8

EDID version: 1.3
Manufacturer: HPN Model 3693 Serial Number --
Made in week 40 of 2021
Digital display
Maximum image size: 60 cm x 34 cm
Gamma: 2.20
DPMS levels: Off
RGB color display
First detailed timing is preferred timing
Display x,y Chromaticity:
  Red:   0.6513, 0.3388
  Green: 0.3212, 0.6074
  Blue:  0.1533, 0.0478
  White: 0.3134, 0.3291
Established timings supported:
  720x400@70Hz 9:5 HorFreq: 31469 Hz Clock: 28.320 MHz
  640x480@60Hz 4:3 HorFreq: 31469 Hz Clock: 25.175 MHz
  800x600@60Hz 4:3 HorFreq: 37900 Hz Clock: 40.000 MHz
  1024x768@60Hz 4:3 HorFreq: 48400 Hz Clock: 65.000 MHz
Standard timings supported:
  1920x1080@60Hz 16:9
  1600x900@60Hz 16:9
  1280x720@60Hz 16:9
  1680x1050@60Hz 16:10 HorFreq: 64700 Hz Clock: 119.000 MHz
  1440x900@60Hz 16:10 HorFreq: 55500 Hz Clock: 88.750 MHz
  1280x800@60Hz 16:10
  1280x1024@60Hz 5:4 HorFreq: 64000 Hz Clock: 108.000 MHz
Detailed mode: Clock 148.500 MHz, 598 mm x 337 mm
               1920 2008 2052 2200 hborder 0
               1080 1084 1089 1125 vborder 0
               +hsync +vsync 
               VertFreq: 60 Hz, HorFreq: 67500 Hz
Monitor ranges (GTF): 50-60Hz V, 30-80kHz H, max dotclock 170MHz
Monitor name: HP E27 G4
Serial number: --
Has 1 extension blocks
Checksum: 0xf8 (valid)

CTA extension block
Extension version: 3
21 bytes of CTA data
  Video data block
    VIC  16 1920x1080@60Hz 16:9 (native) HorFreq: 67500 Hz Clock: 148.500 MHz
    VIC  31 1920x1080@50Hz 16:9  HorFreq: 56250 Hz Clock: 148.500 MHz
    VIC   4 1280x720@60Hz 16:9  HorFreq: 45000 Hz Clock: 74.250 MHz
    VIC  19 1280x720@50Hz 16:9  HorFreq: 37500 Hz Clock: 74.250 MHz
    VIC   3 720x480@60Hz 16:9  HorFreq: 31469 Hz Clock: 27.000 MHz
    VIC  18 720x576@50Hz 16:9  HorFreq: 31250 Hz Clock: 27.000 MHz
    VIC   2 720x480@60Hz 4:3  HorFreq: 31469 Hz Clock: 27.000 MHz
    VIC  17 720x576@50Hz 4:3  HorFreq: 31250 Hz Clock: 27.000 MHz
    VIC   1 640x480@60Hz 4:3  HorFreq: 31469 Hz Clock: 25.175 MHz
  Vendor-specific data block, OUI 000c03 (HDMI)
    Source physical address 1.0.0.0
    Maximum TMDS clock: 170MHz
  Extended tag: Video capability data block
    YCbCr quantization: No Data (0)
    RGB quantization: Selectable (via AVI Q) (1)
    PT scan behaviour: Always Underscanned (2)
    IT scan behaviour: Always Underscanned (2)
    CE scan behaviour: Support both over- and underscan (3)
Underscans PC formats by default
Supports YCbCr 4:4:4
Supports YCbCr 4:2:2
1 native detailed modes
Detailed mode: Clock 148.500 MHz, 598 mm x 337 mm
               1920 2008 2052 2200 hborder 0
               1080 1084 1089 1125 vborder 0
               +hsync +vsync 
               VertFreq: 60 Hz, HorFreq: 67500 Hz
Detailed mode: Clock 148.500 MHz, 598 mm x 337 mm
               1920 2448 2492 2640 hborder 0
               1080 1084 1089 1125 vborder 0
               +hsync +vsync 
               VertFreq: 50 Hz, HorFreq: 56250 Hz
Checksum: 0xe1 (valid)

One or more of the timings is out of range of the Monitor Ranges:
  Vertical Freq: 50 - 70 Hz
  Horizontal Freq: 31250 - 67500 Hz
  Maximum Clock: 148.500 MHz
EDID block does not conform at all!
	Both the serial number and the serial string are set
