
EDID (hex):
00ffffffffffff000469a92201010101
2b120103802b1b782ecfe5a35a49a024
135054bfef80b30081808140714f9500
8100b30f81c021399030621a274068b0
3600b10f1100001c000000ff0038414c
4d56443034333339360a000000fd0032
4b1e5211000a202020202020000000fc
00415355532056573232300a2020005e

Extracted contents:
header:          00 ff ff ff ff ff ff 00
serial number:   04 69 a9 22 01 01 01 01 2b 12
version:         01 03
basic params:    80 2b 1b 78 2e
chroma info:     cf e5 a3 5a 49 a0 24 13 50 54
established:     bf ef 80
standard:        b3 00 81 80 81 40 71 4f 95 00 81 00 b3 0f 81 c0
descriptor 1:    21 39 90 30 62 1a 27 40 68 b0 36 00 b1 0f 11 00 00 1c
descriptor 2:    00 00 00 ff 00 38 41 4c 4d 56 44 30 34 33 33 39 36 0a
descriptor 3:    00 00 00 fd 00 32 4b 1e 52 11 00 0a 20 20 20 20 20 20
descriptor 4:    00 00 00 fc 00 41 53 55 53 20 56 57 32 32 30 0a 20 20
extensions:      00
checksum:        5e

EDID version: 1.3
Manufacturer: ACI Model 22a9 Serial Number --
Made in week 43 of 2008
Digital display
Maximum image size: 43 cm x 27 cm
Gamma: 2.20
DPMS levels: Off
RGB color display
Default (sRGB) color space is primary color space
First detailed timing is preferred timing
Display x,y Chromaticity:
  Red:   0.6396, 0.3515
  Green: 0.2880, 0.6279
  Blue:  0.1435, 0.0761
  White: 0.3134, 0.3291
Established timings supported:
  720x400@70Hz 9:5 HorFreq: 31469 Hz Clock: 28.320 MHz
  640x480@60Hz 4:3 HorFreq: 31469 Hz Clock: 25.175 MHz
  640x480@67Hz 4:3 HorFreq: 35000 Hz Clock: 30.240 MHz
  640x480@72Hz 4:3 HorFreq: 37900 Hz Clock: 31.500 MHz
  640x480@75Hz 4:3 HorFreq: 37500 Hz Clock: 31.500 MHz
  800x600@56Hz 4:3 HorFreq: 35200 Hz Clock: 36.000 MHz
  800x600@60Hz 4:3 HorFreq: 37900 Hz Clock: 40.000 MHz
  800x600@72Hz 4:3 HorFreq: 48100 Hz Clock: 50.000 MHz
  800x600@75Hz 4:3 HorFreq: 46900 Hz Clock: 49.500 MHz
  832x624@75Hz 4:3 HorFreq: 49726 Hz Clock: 57.284 MHz
  1024x768@60Hz 4:3 HorFreq: 48400 Hz Clock: 65.000 MHz
  1024x768@70Hz 4:3 HorFreq: 56500 Hz Clock: 75.000 MHz
  1024x768@75Hz 4:3 HorFreq: 60000 Hz Clock: 78.750 MHz
  1280x1024@75Hz 5:4 HorFreq: 80000 Hz Clock: 135.000 MHz
  1152x870@75Hz 192:145 HorFreq: 67500 Hz Clock: 108.000 MHz
Standard timings supported:
  1680x1050@60Hz 16:10 HorFreq: 64700 Hz Clock: 119.000 MHz
  1280x1024@60Hz 5:4 HorFreq: 64000 Hz Clock: 108.000 MHz
  1280x960@60Hz 4:3 HorFreq: 60000 Hz Clock: 108.000 MHz
  1152x864@75Hz 4:3 HorFreq: 67500 Hz Clock: 108.000 MHz
  1440x900@60Hz 16:10 HorFreq: 55500 Hz Clock: 88.750 MHz
  1280x800@60Hz 16:10
  1680x1050@75Hz 16:10 HorFreq: 82300 Hz Clock: 187.000 MHz
  1280x720@60Hz 16:9
Detailed mode: Clock 146.250 MHz, 433 mm x 271 mm
               1680 1784 1960 2240 hborder 0
               1050 1053 1059 1089 vborder 0
               -hsync +vsync 
               VertFreq: 59 Hz, HorFreq: 65290 Hz
Serial number: --
Monitor ranges (GTF): 50-75Hz V, 30-82kHz H, max dotclock 170MHz
Monitor name: ASUS VW220
Checksum: 0x5e (valid)
EDID block does NOT conform to EDID 1.3!
	sRGB is signaled, but the chromaticities do not match
One or more of the timings is out of range of the Monitor Ranges:
  Vertical Freq: 56 - 75 Hz
  Horizontal Freq: 31469 - 82300 Hz
  Maximum Clock: 187.000 MHz
