
EDID (hex):
00ffffffffffff0022f0094002000000
18130103802c1978ee7b00a6554b9a25
135054010800a9c095008bc081c08180
0101010101013b2e40006284223058a8
3500bbf91000001e3b2e400062842230
58a83500bbf91000001e000000fc0048
5020546f756368536d617274000000fd
0037411a410d000a2020202020200029

Extracted contents:
header:          00 ff ff ff ff ff ff 00
serial number:   22 f0 09 40 02 00 00 00 18 13
version:         01 03
basic params:    80 2c 19 78 ee
chroma info:     7b 00 a6 55 4b 9a 25 13 50 54
established:     01 08 00
standard:        a9 c0 95 00 8b c0 81 c0 81 80 01 01 01 01 01 01
descriptor 1:    3b 2e 40 00 62 84 22 30 58 a8 35 00 bb f9 10 00 00 1e
descriptor 2:    3b 2e 40 00 62 84 22 30 58 a8 35 00 bb f9 10 00 00 1e
descriptor 3:    00 00 00 fc 00 48 50 20 54 6f 75 63 68 53 6d 61 72 74
descriptor 4:    00 00 00 fd 00 37 41 1a 41 0d 00 0a 20 20 20 20 20 20
extensions:      00
checksum:        29

EDID version: 1.3
Manufacturer: HWP Model 4009 Serial Number --
Made in week 24 of 2009
Digital display
Maximum image size: 44 cm x 25 cm
Gamma: 2.20
DPMS levels: Standby Suspend Off
RGB color display
Default (sRGB) color space is primary color space
First detailed timing is preferred timing
Display x,y Chromaticity:
  Red:   0.6494, 0.3349
  Green: 0.2949, 0.6044
  Blue:  0.1445, 0.0742
  White: 0.3125, 0.3281
Established timings supported:
  800x600@60Hz 4:3 HorFreq: 37900 Hz Clock: 40.000 MHz
  1024x768@60Hz 4:3 HorFreq: 48400 Hz Clock: 65.000 MHz
Standard timings supported:
  1600x900@60Hz 16:9
  1440x900@60Hz 16:10 HorFreq: 55500 Hz Clock: 88.750 MHz
  1360x765@60Hz 16:9
  1280x720@60Hz 16:9
  1280x1024@60Hz 5:4 HorFreq: 64000 Hz Clock: 108.000 MHz
Detailed mode: Clock 118.350 MHz, 443 mm x 249 mm
               1600 1688 1856 2112 hborder 0
                900  903  908  934 vborder 0
               +hsync +vsync 
               VertFreq: 59 Hz, HorFreq: 56036 Hz
Detailed mode: Clock 118.350 MHz, 443 mm x 249 mm
               1600 1688 1856 2112 hborder 0
                900  903  908  934 vborder 0
               +hsync +vsync 
               VertFreq: 59 Hz, HorFreq: 56036 Hz
Monitor ranges (GTF): 55-65Hz V, 26-65kHz H, max dotclock 130MHz
Checksum: 0x29 (valid)
EDID block does NOT conform to EDID 1.3!
	sRGB is signaled, but the chromaticities do not match
	Name descriptor not terminated with a newline
