edid-decode (hex):

00 ff ff ff ff ff ff 00 0d af 22 14 00 00 00 00
14 10 01 03 80 1e 13 78 0a c0 05 98 57 52 89 27
20 50 54 00 00 00 01 01 01 01 01 01 01 01 01 01
01 01 01 01 01 01 ab 22 a0 a0 50 84 1a 30 30 20
36 00 2f be 10 00 00 18 00 00 00 fe 00 4e 31 34
31 43 32 2d 4c 30 31 0a 20 20 00 00 00 fe 00 43
4d 4f 0a 20 20 20 20 20 20 20 20 20 00 00 00 fe
00 4e 31 34 31 43 32 2d 4c 30 31 0a 20 20 00 6c

----------------

Block 0, Base EDID:
  EDID Structure Version & Revision: 1.3
  Vendor & Product Identification:
    Manufacturer: CMO
    Model: 5154
    Made in: week 20 of 2006
  Basic Display Parameters & Features:
    Digital display
    Maximum image size: 30 cm x 19 cm
    Gamma: 2.20
    RGB color display
    First detailed timing is the preferred timing
  Color Characteristics:
    Red  : 0.5966, 0.3398
    Green: 0.3203, 0.5351
    Blue : 0.1523, 0.1250
    White: 0.3134, 0.3291
  Established Timings I & II: none
  Standard Timings: none
  Detailed Timing Descriptors:
    DTD 1:  1440x900    59.901458 Hz   8:5     55.469 kHz     88.750000 MHz (303 mm x 190 mm)
                 Hfront   48 Hsync  32 Hback   80 Hpol N
                 Vfront    3 Vsync   6 Vback   17 Vpol N
    Alphanumeric Data String: 'N141C2-L01'
    Alphanumeric Data String: 'CMO'
    Alphanumeric Data String: 'N141C2-L01'
Checksum: 0x6c

----------------

Warnings:

Block 0, Base EDID:
  Detailed Timing Descriptor #1: DTD is similar but not identical to DMT 0x2e.

Failures:

Block 0, Base EDID:
  Missing Display Product Name.
  Missing Display Range Limits Descriptor.

EDID conformity: FAIL
