edid-decode (hex):

00 ff ff ff ff ff ff 00 22 f0 04 29 01 01 01 01
12 14 01 03 68 2c 19 78 2e 06 25 a6 56 4b 9b 25
10 50 54 a1 08 00 81 c0 81 80 95 00 a9 c0 01 01
01 01 01 01 01 01 30 2a 40 c8 60 84 64 30 18 50
13 00 bb f9 10 00 00 1e 00 00 00 fd 00 32 4c 18
53 11 00 0a 20 20 20 20 20 20 00 00 00 fc 00 48
50 20 53 32 30 33 31 0a 20 20 20 20 00 00 00 ff
00 33 43 51 30 31 38 31 42 58 53 0a 20 20 00 59

----------------

Block 0, Base EDID:
  EDID Structure Version & Revision: 1.3
  Vendor & Product Identification:
    Manufacturer: HWP
    Model: 10500
    Serial Number: ...
    Made in: week 18 of 2010
  Basic Display Parameters & Features:
    Analog display
    Input voltage level: 0.7/0.7 V
    Blank level equals black level
    Sync: Separate
    Maximum image size: 44 cm x 25 cm
    Gamma: 2.20
    DPMS levels: Off
    RGB color display
    Default (sRGB) color space is primary color space
    First detailed timing is the preferred timing
  Color Characteristics:
    Red  : 0.6484, 0.3359
    Green: 0.2939, 0.6074
    Blue : 0.1445, 0.0644
    White: 0.3134, 0.3291
  Established Timings I & II:
    IBM     :   720x400    70.082 Hz   9:5    31.467 kHz  28.320 MHz
    DMT 0x04:   640x480    59.940 Hz   4:3    31.469 kHz  25.175 MHz
    DMT 0x09:   800x600    60.317 Hz   4:3    37.879 kHz  40.000 MHz
    DMT 0x10:  1024x768    60.004 Hz   4:3    48.363 kHz  65.000 MHz
  Standard Timings:
    DMT 0x55:  1280x720    60.000 Hz  16:9    45.000 kHz  74.250 MHz
    DMT 0x23:  1280x1024   60.020 Hz   5:4    63.981 kHz 108.000 MHz
    DMT 0x2f:  1440x900    59.887 Hz  16:10   55.935 kHz 106.500 MHz
    DMT 0x53:  1600x900    60.000 Hz  16:9    60.000 kHz 108.000 MHz (RB)
  Detailed Timing Descriptors:
    DTD 1:  1600x900    60.000 Hz  16:9    60.000 kHz 108.000 MHz (443 mm x 249 mm)
                 Hfront   24 Hsync  80 Hback  96 Hpol P
                 Vfront    1 Vsync   3 Vback  96 Vpol P
  Display Range Limits:
    Monitor ranges (GTF): 50-76 Hz V, 24-83 kHz H, max dotclock 170 MHz
    Display Product Name: 'HP S2031'
    Display Product Serial Number: ...
Checksum: 0x59

----------------

Failures:

Block 0, Base EDID:
  Basic Display Parameters & Features: sRGB is signaled, but the chromaticities do not match.

EDID conformity: FAIL
