
EDID (hex):
00ffffffffffff0022f0042901010101
12150103682c19782e0625a6564b9b25
105054a1080081c081809500a9c00101
010101010101302a40c8608464301850
1300bbf91000001e000000fd00324c18
5311000a202020202020000000fc0048
502053323033310a20202020000000ff
003343513131384e56424e0a20200041

Extracted contents:
header:          00 ff ff ff ff ff ff 00
serial number:   22 f0 04 29 01 01 01 01 12 15
version:         01 03
basic params:    68 2c 19 78 2e
chroma info:     06 25 a6 56 4b 9b 25 10 50 54
established:     a1 08 00
standard:        81 c0 81 80 95 00 a9 c0 01 01 01 01 01 01 01 01
descriptor 1:    30 2a 40 c8 60 84 64 30 18 50 13 00 bb f9 10 00 00 1e
descriptor 2:    00 00 00 fd 00 32 4c 18 53 11 00 0a 20 20 20 20 20 20
descriptor 3:    00 00 00 fc 00 48 50 20 53 32 30 33 31 0a 20 20 20 20
descriptor 4:    00 00 00 ff 00 33 43 51 31 31 38 4e 56 42 4e 0a 20 20
extensions:      00
checksum:        41

EDID version: 1.3
Manufacturer: HWP Model 2904 Serial Number --
Made in week 18 of 2011
Analog display, Input voltage level: 0.7/0.7 V
Sync: Separate 
Maximum image size: 44 cm x 25 cm
Gamma: 2.20
DPMS levels: Off
RGB color display
Default (sRGB) color space is primary color space
First detailed timing is preferred timing
Display x,y Chromaticity:
  Red:   0.6484, 0.3359
  Green: 0.2939, 0.6074
  Blue:  0.1445, 0.0644
  White: 0.3134, 0.3291
Established timings supported:
  720x400@70Hz 9:5 HorFreq: 31469 Hz Clock: 28.320 MHz
  640x480@60Hz 4:3 HorFreq: 31469 Hz Clock: 25.175 MHz
  800x600@60Hz 4:3 HorFreq: 37900 Hz Clock: 40.000 MHz
  1024x768@60Hz 4:3 HorFreq: 48400 Hz Clock: 65.000 MHz
Standard timings supported:
  1280x720@60Hz 16:9
  1280x1024@60Hz 5:4 HorFreq: 64000 Hz Clock: 108.000 MHz
  1440x900@60Hz 16:10 HorFreq: 55500 Hz Clock: 88.750 MHz
  1600x900@60Hz 16:9
Detailed mode: Clock 108.000 MHz, 443 mm x 249 mm
               1600 1624 1704 1800 hborder 0
                900  901  904 1000 vborder 0
               +hsync +vsync 
               VertFreq: 60 Hz, HorFreq: 60000 Hz
Monitor ranges (GTF): 50-76Hz V, 24-83kHz H, max dotclock 170MHz
Monitor name: HP S2031
Serial number: --
Checksum: 0x41 (valid)
EDID block does NOT conform to EDID 1.3!
	sRGB is signaled, but the chromaticities do not match
