
EDID (hex):
00ffffffffffff004ca3583200000000
00110103802517780a87f594574f8c27
27505400000001010101010101010101
010101010101b325a04051840c304020
33006fe6100000190000000f00000000
000000000078e6022300000000fe0050
593538350331373058320a20000000fe
0023323e456488bfff02010a20200025

Extracted contents:
header:          00 ff ff ff ff ff ff 00
serial number:   4c a3 58 32 00 00 00 00 00 11
version:         01 03
basic params:    80 25 17 78 0a
chroma info:     87 f5 94 57 4f 8c 27 27 50 54
established:     00 00 00
standard:        01 01 01 01 01 01 01 01 01 01 01 01 01 01 01 01
descriptor 1:    b3 25 a0 40 51 84 0c 30 40 20 33 00 6f e6 10 00 00 19
descriptor 2:    00 00 00 0f 00 00 00 00 00 00 00 00 00 78 e6 02 23 00
descriptor 3:    00 00 00 fe 00 50 59 35 38 35 03 31 37 30 58 32 0a 20
descriptor 4:    00 00 00 fe 00 23 32 3e 45 64 88 bf ff 02 01 0a 20 20
extensions:      00
checksum:        25

EDID version: 1.3
Manufacturer: SEC Model 3258 Serial Number --
Made in year 2007
Digital display
Maximum image size: 37 cm x 23 cm
Gamma: 2.20
RGB color display
First detailed timing is preferred timing
Display x,y Chromaticity:
  Red:   0.5800, 0.3398
  Green: 0.3095, 0.5498
  Blue:  0.1552, 0.1552
  White: 0.3134, 0.3291
Established timings supported:
Standard timings supported:
Detailed mode: Clock 96.510 MHz, 367 mm x 230 mm
               1440 1504 1536 1760 hborder 0
                900  903  906  912 vborder 0
               -hsync -vsync 
               VertFreq: 60 Hz, HorFreq: 54835 Hz
Manufacturer-specified data, tag 15
ASCII string: PY585
ASCII string: #2>Ed
Checksum: 0x25 (valid)
EDID block does NOT conform to EDID 1.3!
	Missing name descriptor
	Missing monitor ranges
	Detailed block string not properly terminated
