
EDID (hex):
00ffffffffffff0004727e0563a44090
041d010380331d78eed905a557519e27
0f5054b30c00714f818081c081009500
b300d1c00101023a801871382d40582c
4500fd1e1100001e000000fd00384b1f
4b12000a202020202020000000fc0053
413233300a20202020202020000000ff
005439314141303032323432300a01a5
02031cf1499001030412131f05140309
07070301000065030c001000023a8018
71382d40582c4500fd1e1100001e011d
007251d01e206e285500fd1e1100001e
8c0ad08a20e02d10103e9600fd1e1100
0018d60980a020e02d1008602200fd1e
11080818000000000000000000000000
0000000000000000000000000000007e

edid-decode (hex):

00 ff ff ff ff ff ff 00 04 72 7e 05 63 a4 40 90
04 1d 01 03 80 33 1d 78 ee d9 05 a5 57 51 9e 27
0f 50 54 b3 0c 00 71 4f 81 80 81 c0 81 00 95 00
b3 00 d1 c0 01 01 02 3a 80 18 71 38 2d 40 58 2c
45 00 fd 1e 11 00 00 1e 00 00 00 fd 00 38 4b 1f
4b 12 00 0a 20 20 20 20 20 20 00 00 00 fc 00 53
41 32 33 30 0a 20 20 20 20 20 20 20 00 00 00 ff
00 54 39 31 41 41 30 30 32 32 34 32 30 0a 01 a5

02 03 1c f1 49 90 01 03 04 12 13 1f 05 14 03 09
07 07 03 01 00 00 65 03 0c 00 10 00 02 3a 80 18
71 38 2d 40 58 2c 45 00 fd 1e 11 00 00 1e 01 1d
00 72 51 d0 1e 20 6e 28 55 00 fd 1e 11 00 00 1e
8c 0a d0 8a 20 e0 2d 10 10 3e 96 00 fd 1e 11 00
00 18 d6 09 80 a0 20 e0 2d 10 08 60 22 00 fd 1e
11 08 08 18 00 00 00 00 00 00 00 00 00 00 00 00
00 00 00 00 00 00 00 00 00 00 00 00 00 00 00 7e

----------------

Block 0, Base EDID:
  EDID Structure Version & Revision: 1.3
  Vendor & Product Identification:
    Manufacturer: ACR
    Model: 1406
    Serial Number: 2420155491
    Made in: week 4 of 2019
  Basic Display Parameters & Features:
    Digital display
    Maximum image size: 51 cm x 29 cm
    Gamma: 2.20
    DPMS levels: Standby Suspend Off
    RGB color display
    Default (sRGB) color space is primary color space
    First detailed timing is the preferred timing
  Color Characteristics:
    Red  : 0.6474, 0.3408
    Green: 0.3183, 0.6181
    Blue : 0.1523, 0.0585
    White: 0.3134, 0.3291
  Established Timings I & II:
    IBM     :   720x400    70.081663 Hz   9:5     31.467 kHz     28.320000 MHz
    DMT 0x04:   640x480    59.940476 Hz   4:3     31.469 kHz     25.175000 MHz
    Apple   :   640x480    66.666667 Hz   4:3     35.000 kHz     30.240000 MHz
    DMT 0x08:   800x600    56.250000 Hz   4:3     35.156 kHz     36.000000 MHz
    DMT 0x09:   800x600    60.316541 Hz   4:3     37.879 kHz     40.000000 MHz
    DMT 0x10:  1024x768    60.003840 Hz   4:3     48.363 kHz     65.000000 MHz
    DMT 0x11:  1024x768    70.069359 Hz   4:3     56.476 kHz     75.000000 MHz
  Standard Timings:
    DMT 0x15:  1152x864    75.000000 Hz   4:3     67.500 kHz    108.000000 MHz
    DMT 0x23:  1280x1024   60.019740 Hz   5:4     63.981 kHz    108.000000 MHz
    DMT 0x55:  1280x720    60.000000 Hz  16:9     45.000 kHz     74.250000 MHz
    DMT 0x1c:  1280x800    59.810326 Hz  16:10    49.702 kHz     83.500000 MHz
    DMT 0x2f:  1440x900    59.887445 Hz  16:10    55.935 kHz    106.500000 MHz
    DMT 0x3a:  1680x1050   59.954250 Hz  16:10    65.290 kHz    146.250000 MHz
    DMT 0x52:  1920x1080   60.000000 Hz  16:9     67.500 kHz    148.500000 MHz
  Detailed Timing Descriptors:
    DTD 1:  1920x1080   60.000000 Hz  16:9     67.500 kHz    148.500000 MHz (509 mm x 286 mm)
                 Hfront   88 Hsync  44 Hback  148 Hpol P
                 Vfront    4 Vsync   5 Vback   36 Vpol P
    Display Range Limits:
      Monitor ranges (GTF): 56-75 Hz V, 31-75 kHz H, max dotclock 180 MHz
    Display Product Name: 'SA230'
    Display Product Serial Number: 'T91AA0022420'
  Extension blocks: 1
Checksum: 0xa5

----------------

Block 1, CTA-861 Extension Block:
  Revision: 3
  Underscans IT Video Formats by default
  Basic audio support
  Supports YCbCr 4:4:4
  Supports YCbCr 4:2:2
  Native detailed modes: 1
  Video Data Block:
    VIC  16:  1920x1080   60.000000 Hz  16:9     67.500 kHz    148.500000 MHz (native)
    VIC   1:   640x480    59.940476 Hz   4:3     31.469 kHz     25.175000 MHz
    VIC   3:   720x480    59.940060 Hz  16:9     31.469 kHz     27.000000 MHz
    VIC   4:  1280x720    60.000000 Hz  16:9     45.000 kHz     74.250000 MHz
    VIC  18:   720x576    50.000000 Hz  16:9     31.250 kHz     27.000000 MHz
    VIC  19:  1280x720    50.000000 Hz  16:9     37.500 kHz     74.250000 MHz
    VIC  31:  1920x1080   50.000000 Hz  16:9     56.250 kHz    148.500000 MHz
    VIC   5:  1920x1080i  60.000000 Hz  16:9     33.750 kHz     74.250000 MHz
    VIC  20:  1920x1080i  50.000000 Hz  16:9     28.125 kHz     74.250000 MHz
  Unknown CTA-861 Data Block (tag 0x00, length 3):
    09 07 07                                        '...'
  Unknown CTA-861 Data Block (tag 0x00, length 3):
    01 00 00                                        '...'
  Vendor-Specific Data Block (HDMI), OUI 00-0C-03:
    Source physical address: 1.0.0.0
  Detailed Timing Descriptors:
    DTD 2:  1920x1080   60.000000 Hz  16:9     67.500 kHz    148.500000 MHz (509 mm x 286 mm)
                 Hfront   88 Hsync  44 Hback  148 Hpol P
                 Vfront    4 Vsync   5 Vback   36 Vpol P
    DTD 3:  1280x720    60.000000 Hz  16:9     45.000 kHz     74.250000 MHz (509 mm x 286 mm)
                 Hfront  110 Hsync  40 Hback  220 Hpol P
                 Vfront    5 Vsync   5 Vback   20 Vpol P
    DTD 4:   720x480    59.940060 Hz   3:2     31.469 kHz     27.000000 MHz (509 mm x 286 mm)
                 Hfront   16 Hsync  62 Hback   60 Hpol N
                 Vfront    9 Vsync   6 Vback   30 Vpol N
    DTD 5:   640x480    59.952381 Hz   4:3     31.475 kHz     25.180000 MHz (509 mm x 286 mm)
                 Hfront    8 Hsync  96 Hback   40 Hpol N Hborder 8
                 Vfront    2 Vsync   2 Vback   25 Vpol N Vborder 8
Checksum: 0x7e  Unused space in Extension Block: 27 bytes
