
EDID (hex):
00ffffffffffff0009e5460900000000
0e200104a522137802c9a0955d599429
24505400000001010101010101010101
010101010101393780de703814403020
360058c21000001a0000000000000000
00000000000000000000000000fe0042
4f452043510a202020202020000000fe
004e5631353646484d2d5430310a000e

edid-decode (hex):

00 ff ff ff ff ff ff 00 09 e5 46 09 00 00 00 00
0e 20 01 04 a5 22 13 78 02 c9 a0 95 5d 59 94 29
24 50 54 00 00 00 01 01 01 01 01 01 01 01 01 01
01 01 01 01 01 01 39 37 80 de 70 38 14 40 30 20
36 00 58 c2 10 00 00 1a 00 00 00 00 00 00 00 00
00 00 00 00 00 00 00 00 00 00 00 00 00 fe 00 42
4f 45 20 43 51 0a 20 20 20 20 20 20 00 00 00 fe
00 4e 56 31 35 36 46 48 4d 2d 54 30 31 0a 00 0e

----------------

Block 0, Base EDID:
  EDID Structure Version & Revision: 1.4
  Vendor & Product Identification:
    Manufacturer: BOE
    Model: 2374
    Made in: week 14 of 2022
  Basic Display Parameters & Features:
    Digital display
    Bits per primary color channel: 8
    DisplayPort interface
    Maximum image size: 34 cm x 19 cm
    Gamma: 2.20
    Supported color formats: RGB 4:4:4
    First detailed timing includes the native pixel format and preferred refresh rate
  Color Characteristics:
    Red  : 0.5849, 0.3632
    Green: 0.3496, 0.5791
    Blue : 0.1621, 0.1425
    White: 0.3125, 0.3281
  Established Timings I & II: none
  Standard Timings: none
  Detailed Timing Descriptors:
    DTD 1:  1920x1080   59.999151 Hz  16:9     65.999 kHz    141.370000 MHz (344 mm x 194 mm)
                 Hfront   48 Hsync  32 Hback  142 Hpol P
                 Vfront    3 Vsync   6 Vback   11 Vpol N
    Empty Descriptor
    Alphanumeric Data String: 'BOE CQ'
    Alphanumeric Data String: 'NV156FHM-T01'
Checksum: 0x0e
