
EDID (hex):
00ffffffffffff0010ac81404c363631
15190104b54028783a1df5ae4f35b325
0d5054a54b008100b300d100714fa940
8180d1c00101e26800a0a0402e603020
360081912100001a000000ff00503156
364e35354b3136364c0a000000fc0044
454c4c2055333031340a2020000000fd
0031561d711c010a20202020202001d4
02031df1509005040302071601061112
1513141f2023091f0783010000023a80
1871382d40582c450081912100001e01
1d8018711c1620582c25008191210000
9e011d007251d01e206e285500819121
00001e8f0ad08a20e02d10103e960081
91210000180000000000000000000000
000000000000000000000000000000e6

Extracted contents:
header:          00 ff ff ff ff ff ff 00
serial number:   10 ac 81 40 4c 36 36 31 15 19
version:         01 04
basic params:    b5 40 28 78 3a
chroma info:     1d f5 ae 4f 35 b3 25 0d 50 54
established:     a5 4b 00
standard:        81 00 b3 00 d1 00 71 4f a9 40 81 80 d1 c0 01 01
descriptor 1:    e2 68 00 a0 a0 40 2e 60 30 20 36 00 81 91 21 00 00 1a
descriptor 2:    00 00 00 ff 00 50 31 56 36 4e 35 35 4b 31 36 36 4c 0a
descriptor 3:    00 00 00 fc 00 44 45 4c 4c 20 55 33 30 31 34 0a 20 20
descriptor 4:    00 00 00 fd 00 31 56 1d 71 1c 01 0a 20 20 20 20 20 20
extensions:      01
checksum:        d4

EDID version: 1.4
Manufacturer: DEL Model 4081 Serial Number --
Made in week 21 of 2015
Digital display
10 bits per primary color channel
DisplayPort interface
Maximum image size: 64 cm x 40 cm
Gamma: 2.20
DPMS levels: Off
Supported color formats: RGB 4:4:4, YCrCb 4:4:4, YCrCb 4:2:2
First detailed timing includes the native pixel format and preferred refresh rate
Display x,y Chromaticity:
  Red:   0.6796, 0.3095
  Green: 0.2099, 0.7001
  Blue:  0.1474, 0.0537
  White: 0.3134, 0.3291
Established timings supported:
  720x400@70Hz 9:5 HorFreq: 31469 Hz Clock: 28.320 MHz
  640x480@60Hz 4:3 HorFreq: 31469 Hz Clock: 25.175 MHz
  640x480@75Hz 4:3 HorFreq: 37500 Hz Clock: 31.500 MHz
  800x600@60Hz 4:3 HorFreq: 37900 Hz Clock: 40.000 MHz
  800x600@75Hz 4:3 HorFreq: 46900 Hz Clock: 49.500 MHz
  1024x768@60Hz 4:3 HorFreq: 48400 Hz Clock: 65.000 MHz
  1024x768@75Hz 4:3 HorFreq: 60000 Hz Clock: 78.750 MHz
  1280x1024@75Hz 5:4 HorFreq: 80000 Hz Clock: 135.000 MHz
Standard timings supported:
  1280x800@60Hz 16:10
  1680x1050@60Hz 16:10 HorFreq: 64700 Hz Clock: 119.000 MHz
  1920x1200@60Hz 16:10 HorFreq: 74000 Hz Clock: 154.000 MHz
  1152x864@75Hz 4:3 HorFreq: 67500 Hz Clock: 108.000 MHz
  1600x1200@60Hz 4:3 HorFreq: 75000 Hz Clock: 162.000 MHz
  1280x1024@60Hz 5:4 HorFreq: 64000 Hz Clock: 108.000 MHz
  1920x1080@60Hz 16:9
Detailed mode: Clock 268.500 MHz, 641 mm x 401 mm
               2560 2608 2640 2720 hborder 0
               1600 1603 1609 1646 vborder 0
               +hsync -vsync 
               VertFreq: 59 Hz, HorFreq: 98713 Hz
Serial number: --
Monitor name: DELL U3014
Monitor ranges (bare limits): 49-86Hz V, 29-113kHz H, max dotclock 280MHz
Has 1 extension blocks
Checksum: 0xd4 (valid)

CTA extension block
Extension version: 3
25 bytes of CTA data
  Video data block
    VIC  16 1920x1080@60Hz 16:9 (native) HorFreq: 67500 Hz Clock: 148.500 MHz
    VIC   5 1920x1080i@60Hz 16:9  HorFreq: 33750 Hz Clock: 74.250 MHz
    VIC   4 1280x720@60Hz 16:9  HorFreq: 45000 Hz Clock: 74.250 MHz
    VIC   3 720x480@60Hz 16:9  HorFreq: 31469 Hz Clock: 27.000 MHz
    VIC   2 720x480@60Hz 4:3  HorFreq: 31469 Hz Clock: 27.000 MHz
    VIC   7 1440x480i@60Hz 16:9  HorFreq: 15734 Hz Clock: 27.000 MHz
    VIC  22 1440x576i@50Hz 16:9  HorFreq: 15625 Hz Clock: 27.000 MHz
    VIC   1 640x480@60Hz 4:3  HorFreq: 31469 Hz Clock: 25.175 MHz
    VIC   6 1440x480i@60Hz 4:3  HorFreq: 15734 Hz Clock: 27.000 MHz
    VIC  17 720x576@50Hz 4:3  HorFreq: 31250 Hz Clock: 27.000 MHz
    VIC  18 720x576@50Hz 16:9  HorFreq: 31250 Hz Clock: 27.000 MHz
    VIC  21 1440x576i@50Hz 4:3  HorFreq: 15625 Hz Clock: 27.000 MHz
    VIC  19 1280x720@50Hz 16:9  HorFreq: 37500 Hz Clock: 74.250 MHz
    VIC  20 1920x1080i@50Hz 16:9  HorFreq: 28125 Hz Clock: 74.250 MHz
    VIC  31 1920x1080@50Hz 16:9  HorFreq: 56250 Hz Clock: 148.500 MHz
    VIC  32 1920x1080@24Hz 16:9  HorFreq: 27000 Hz Clock: 74.250 MHz
  Audio data block
    Linear PCM, max channels 2
      Supported sample rates (kHz): 96 88.2 48 44.1 32
      Supported sample sizes (bits): 24 20 16
  Speaker allocation data block
    Speaker map:
      FL/FR - Front Left/Right
Underscans PC formats by default
Basic audio support
Supports YCbCr 4:4:4
Supports YCbCr 4:2:2
1 native detailed modes
Detailed mode: Clock 148.500 MHz, 641 mm x 401 mm
               1920 2008 2052 2200 hborder 0
               1080 1084 1089 1125 vborder 0
               +hsync +vsync 
               VertFreq: 60 Hz, HorFreq: 67500 Hz
Detailed mode: Clock 74.250 MHz, 641 mm x 401 mm
               1920 2008 2052 2200 hborder 0
                540  542  547  562 vborder 0
               +hsync +vsync interlaced 
               VertFreq: 60 Hz, HorFreq: 33750 Hz
Detailed mode: Clock 74.250 MHz, 641 mm x 401 mm
               1280 1390 1430 1650 hborder 0
                720  725  730  750 vborder 0
               +hsync +vsync 
               VertFreq: 60 Hz, HorFreq: 45000 Hz
Detailed mode: Clock 27.030 MHz, 641 mm x 401 mm
                720  736  798  858 hborder 0
                480  489  495  525 vborder 0
               -hsync -vsync 
               VertFreq: 60 Hz, HorFreq: 31503 Hz
Checksum: 0xe6 (valid)

Warning: One or more of the timings is out of range of the Monitor Ranges:
  Vertical Freq: 24 - 75 Hz
  Horizontal Freq: 15625 - 98713 Hz
  Maximum Clock: 268.500 MHz
EDID block does not conform at all!
	Both the serial number and the serial string are set


