
EDID (hex):
00ffffffffffff002067406001010101
00160103804627780a01c1a057479827
124c4ca34e0081c08100810f81409500
b30081800101023a801871382d40582c
460040846300001e0e1f008051001e30
4080370040846300001e000000fc0048
2f4b20415620414d500a2020000000fd
00303e0e440f000a20202020202001c5
02032f704b0102030405202122060790
320f7f073d1ec01507505f7e01570600
677e00835f000067030c001100b82d01
1d8018711c1620582c2500c48e210000
9e023a801871382d40582c4500c48e21
00001e00000000000000000000000000
00000000000000000000000000000000
000000000000000000000000000000cf

Extracted contents:
header:          00 ff ff ff ff ff ff 00
serial number:   20 67 40 60 01 01 01 01 00 16
version:         01 03
basic params:    80 46 27 78 0a
chroma info:     01 c1 a0 57 47 98 27 12 4c 4c
established:     a3 4e 00
standard:        81 c0 81 00 81 0f 81 40 95 00 b3 00 81 80 01 01
descriptor 1:    02 3a 80 18 71 38 2d 40 58 2c 46 00 40 84 63 00 00 1e
descriptor 2:    0e 1f 00 80 51 00 1e 30 40 80 37 00 40 84 63 00 00 1e
descriptor 3:    00 00 00 fc 00 48 2f 4b 20 41 56 20 41 4d 50 0a 20 20
descriptor 4:    00 00 00 fd 00 30 3e 0e 44 0f 00 0a 20 20 20 20 20 20
extensions:      01
checksum:        c5

EDID version: 1.3
Manufacturer: HCG Model 6040 Serial Number --
Made in year 2012
Digital display
Maximum image size: 70 cm x 39 cm
Gamma: 2.20
RGB color display
First detailed timing is preferred timing
Display x,y Chromaticity:
  Red:   0.6250, 0.3398
  Green: 0.2773, 0.5947
  Blue:  0.1552, 0.0703
  White: 0.2968, 0.2978
Established timings supported:
  720x400@70Hz 9:5 HorFreq: 31469 Hz Clock: 28.320 MHz
  640x480@60Hz 4:3 HorFreq: 31469 Hz Clock: 25.175 MHz
  800x600@56Hz 4:3 HorFreq: 35200 Hz Clock: 36.000 MHz
  800x600@60Hz 4:3 HorFreq: 37900 Hz Clock: 40.000 MHz
  800x600@75Hz 4:3 HorFreq: 46900 Hz Clock: 49.500 MHz
  1024x768@60Hz 4:3 HorFreq: 48400 Hz Clock: 65.000 MHz
  1024x768@70Hz 4:3 HorFreq: 56500 Hz Clock: 75.000 MHz
  1024x768@75Hz 4:3 HorFreq: 60000 Hz Clock: 78.750 MHz
Standard timings supported:
  1280x720@60Hz 16:9
  1280x800@60Hz 16:10
  1280x800@75Hz 16:10
  1280x960@60Hz 4:3 HorFreq: 60000 Hz Clock: 108.000 MHz
  1440x900@60Hz 16:10 HorFreq: 55500 Hz Clock: 88.750 MHz
  1680x1050@60Hz 16:10 HorFreq: 64700 Hz Clock: 119.000 MHz
  1280x1024@60Hz 5:4 HorFreq: 64000 Hz Clock: 108.000 MHz
Detailed mode: Clock 148.500 MHz, 1600 mm x 900 mm
               1920 2008 2052 2200 hborder 0
               1080 1084 1090 1125 vborder 0
               +hsync +vsync 
               VertFreq: 60 Hz, HorFreq: 67500 Hz
Detailed mode: Clock 79.500 MHz, 1600 mm x 900 mm
               1280 1344 1472 1664 hborder 0
                768  771  778  798 vborder 0
               +hsync +vsync 
               VertFreq: 59 Hz, HorFreq: 47776 Hz
Monitor name: H/K AV AMP
Monitor ranges (GTF): 48-62Hz V, 14-68kHz H, max dotclock 150MHz
Has 1 extension blocks
Checksum: 0xc5 (valid)

CTA extension block
Extension version: 3
43 bytes of CTA data
  Video data block
    VIC   1 640x480@60Hz 4:3  HorFreq: 31469 Hz Clock: 25.175 MHz
    VIC   2 720x480@60Hz 4:3  HorFreq: 31469 Hz Clock: 27.000 MHz
    VIC   3 720x480@60Hz 16:9  HorFreq: 31469 Hz Clock: 27.000 MHz
    VIC   4 1280x720@60Hz 16:9  HorFreq: 45000 Hz Clock: 74.250 MHz
    VIC   5 1920x1080i@60Hz 16:9  HorFreq: 33750 Hz Clock: 74.250 MHz
    VIC  32 1920x1080@24Hz 16:9  HorFreq: 27000 Hz Clock: 74.250 MHz
    VIC  33 1920x1080@25Hz 16:9  HorFreq: 28125 Hz Clock: 74.250 MHz
    VIC  34 1920x1080@30Hz 16:9  HorFreq: 33750 Hz Clock: 74.250 MHz
    VIC   6 1440x480i@60Hz 4:3  HorFreq: 15734 Hz Clock: 27.000 MHz
    VIC   7 1440x480i@60Hz 16:9  HorFreq: 15734 Hz Clock: 27.000 MHz
    VIC  16 1920x1080@60Hz 16:9 (native) HorFreq: 67500 Hz Clock: 148.500 MHz
  Audio data block
    Linear PCM, max channels 8
      Supported sample rates (kHz): 192 176.4 96 88.2 48 44.1 32
      Supported sample sizes (bits): 24 20 16
    DTS, max channels 6
      Supported sample rates (kHz): 96 88.2 48 44.1
      Maximum bit rate: 1536 kHz
    AC-3, max channels 6
      Supported sample rates (kHz): 48 44.1 32
      Maximum bit rate: 640 kHz
    DTS-HD, max channels 8
      Supported sample rates (kHz): 192 176.4 96 88.2 48 44.1
    Dolby Digital+, max channels 8
      Supported sample rates (kHz): 48 44.1
    MAT (MLP), max channels 8
      Supported sample rates (kHz): 192 176.4 96 88.2 48 44.1
  Speaker allocation data block
    Speaker map:
      FL/FR - Front Left/Right
      LFE - Low Frequency Effects
      FC - Front Center
      BL/BR - Back Left/Right
      BC - Back Center
      RLC/RRC - Rear Left/Right of Center
  Vendor-specific data block, OUI 000c03 (HDMI)
    Source physical address 1.1.0.0
    Supports_AI
    DC_36bit
    DC_30bit
    DC_Y444
    Maximum TMDS clock: 225MHz
Basic audio support
Supports YCbCr 4:4:4
Supports YCbCr 4:2:2
0 native detailed modes
Detailed mode: Clock 74.250 MHz, 708 mm x 398 mm
               1920 2008 2052 2200 hborder 0
                540  542  547  562 vborder 0
               +hsync +vsync interlaced 
               VertFreq: 60 Hz, HorFreq: 33750 Hz
Detailed mode: Clock 148.500 MHz, 708 mm x 398 mm
               1920 2008 2052 2200 hborder 0
               1080 1084 1089 1125 vborder 0
               +hsync +vsync 
               VertFreq: 60 Hz, HorFreq: 67500 Hz
Checksum: 0xcf (valid)

One or more of the timings is out of range of the Monitor Ranges:
  Vertical Freq: 24 - 75 Hz
  Horizontal Freq: 15734 - 67500 Hz
  Maximum Clock: 148.500 MHz
