
EDID (hex):
00ffffffffffff001e6dcb7501010101
0811010380462778ead9b0a357499c25
11494ba56e0031404540614081809040
a940d1c001011a3680a070381f403020
3500e8263200001a1b2150a051001e30
48883500bc862100001c000000fd0039
4b1f5412000a202020202020000000fc
0033374c4636350a20202020202001ff
020321f14e8102031512130414052021
221f10230907078301000065030c0010
00011d008051d01c2040803500bc8821
00001e8c0ad08a20e02d10103e960013
8e21000018023a801871382d40582c45
0006442100001e011d8018711c162058
2c2500c48e2100009e4e1f008051001e
3040803700bc8821000018000000001d

Extracted contents:
header:          00 ff ff ff ff ff ff 00
serial number:   1e 6d cb 75 01 01 01 01 08 11
version:         01 03
basic params:    80 46 27 78 ea
chroma info:     d9 b0 a3 57 49 9c 25 11 49 4b
established:     a5 6e 00
standard:        31 40 45 40 61 40 81 80 90 40 a9 40 d1 c0 01 01
descriptor 1:    1a 36 80 a0 70 38 1f 40 30 20 35 00 e8 26 32 00 00 1a
descriptor 2:    1b 21 50 a0 51 00 1e 30 48 88 35 00 bc 86 21 00 00 1c
descriptor 3:    00 00 00 fd 00 39 4b 1f 54 12 00 0a 20 20 20 20 20 20
descriptor 4:    00 00 00 fc 00 33 37 4c 46 36 35 0a 20 20 20 20 20 20
extensions:      01
checksum:        ff

EDID version: 1.3
Manufacturer: GSM Model 75cb Serial Number --
Made in week 8 of 2007
Digital display
Maximum image size: 70 cm x 39 cm
Gamma: 2.20
DPMS levels: Standby Suspend Off
RGB color display
First detailed timing is preferred timing
Display x,y Chromaticity:
  Red:   0.6396, 0.3408
  Green: 0.2871, 0.6103
  Blue:  0.1464, 0.0693
  White: 0.2851, 0.2929
Established timings supported:
  720x400@70Hz 9:5 HorFreq: 31469 Hz Clock: 28.320 MHz
  640x480@60Hz 4:3 HorFreq: 31469 Hz Clock: 25.175 MHz
  640x480@75Hz 4:3 HorFreq: 37500 Hz Clock: 31.500 MHz
  800x600@60Hz 4:3 HorFreq: 37900 Hz Clock: 40.000 MHz
  800x600@75Hz 4:3 HorFreq: 46900 Hz Clock: 49.500 MHz
  832x624@75Hz 4:3 HorFreq: 49726 Hz Clock: 57.284 MHz
  1024x768@60Hz 4:3 HorFreq: 48400 Hz Clock: 65.000 MHz
  1024x768@70Hz 4:3 HorFreq: 56500 Hz Clock: 75.000 MHz
  1024x768@75Hz 4:3 HorFreq: 60000 Hz Clock: 78.750 MHz
Standard timings supported:
  640x480@60Hz 4:3 HorFreq: 31469 Hz Clock: 25.175 MHz
  800x600@60Hz 4:3 HorFreq: 37900 Hz Clock: 40.000 MHz
  1024x768@60Hz 4:3 HorFreq: 48400 Hz Clock: 65.000 MHz
  1280x1024@60Hz 5:4 HorFreq: 64000 Hz Clock: 108.000 MHz
  1400x1050@60Hz 4:3 HorFreq: 64700 Hz Clock: 101.000 MHz
  1600x1200@60Hz 4:3 HorFreq: 75000 Hz Clock: 162.000 MHz
  1920x1080@60Hz 16:9
Detailed mode: Clock 138.500 MHz, 1000 mm x 550 mm
               1920 1968 2000 2080 hborder 0
               1080 1083 1088 1111 vborder 0
               +hsync -vsync 
               VertFreq: 59 Hz, HorFreq: 66586 Hz
Detailed mode: Clock 84.750 MHz, 700 mm x 390 mm
               1360 1432 1568 1776 hborder 0
                768  771  776  798 vborder 0
               -hsync +vsync 
               VertFreq: 59 Hz, HorFreq: 47719 Hz
Monitor ranges (GTF): 57-75Hz V, 31-84kHz H, max dotclock 180MHz
Monitor name: 37LF65
Has 1 extension blocks
Checksum: 0xff (valid)

CTA extension block
Extension version: 3
29 bytes of CTA data
  Video data block
    VIC   1 640x480@60Hz 4:3 (native) HorFreq: 31469 Hz Clock: 25.175 MHz
    VIC   2 720x480@60Hz 4:3  HorFreq: 31469 Hz Clock: 27.000 MHz
    VIC   3 720x480@60Hz 16:9  HorFreq: 31469 Hz Clock: 27.000 MHz
    VIC  21 1440x576i@50Hz 4:3  HorFreq: 15625 Hz Clock: 27.000 MHz
    VIC  18 720x576@50Hz 16:9  HorFreq: 31250 Hz Clock: 27.000 MHz
    VIC  19 1280x720@50Hz 16:9  HorFreq: 37500 Hz Clock: 74.250 MHz
    VIC   4 1280x720@60Hz 16:9  HorFreq: 45000 Hz Clock: 74.250 MHz
    VIC  20 1920x1080i@50Hz 16:9  HorFreq: 28125 Hz Clock: 74.250 MHz
    VIC   5 1920x1080i@60Hz 16:9  HorFreq: 33750 Hz Clock: 74.250 MHz
    VIC  32 1920x1080@24Hz 16:9  HorFreq: 27000 Hz Clock: 74.250 MHz
    VIC  33 1920x1080@25Hz 16:9  HorFreq: 28125 Hz Clock: 74.250 MHz
    VIC  34 1920x1080@30Hz 16:9  HorFreq: 33750 Hz Clock: 74.250 MHz
    VIC  31 1920x1080@50Hz 16:9  HorFreq: 56250 Hz Clock: 148.500 MHz
    VIC  16 1920x1080@60Hz 16:9  HorFreq: 67500 Hz Clock: 148.500 MHz
  Audio data block
    Linear PCM, max channels 2
      Supported sample rates (kHz): 48 44.1 32
      Supported sample sizes (bits): 24 20 16
  Speaker allocation data block
    Speaker map:
      FL/FR - Front Left/Right
  Vendor-specific data block, OUI 000c03 (HDMI)
    Source physical address 1.0.0.0
Underscans PC formats by default
Basic audio support
Supports YCbCr 4:4:4
Supports YCbCr 4:2:2
1 native detailed modes
Detailed mode: Clock 74.250 MHz, 700 mm x 392 mm
               1280 1344 1472 1664 hborder 0
                720  723  728  748 vborder 0
               +hsync +vsync 
               VertFreq: 59 Hz, HorFreq: 44621 Hz
Detailed mode: Clock 27.000 MHz, 531 mm x 398 mm
                720  736  798  858 hborder 0
                480  489  495  525 vborder 0
               -hsync -vsync 
               VertFreq: 59 Hz, HorFreq: 31468 Hz
Detailed mode: Clock 148.500 MHz, 518 mm x 324 mm
               1920 2008 2052 2200 hborder 0
               1080 1084 1089 1125 vborder 0
               +hsync +vsync 
               VertFreq: 60 Hz, HorFreq: 67500 Hz
Detailed mode: Clock 74.250 MHz, 708 mm x 398 mm
               1920 2008 2052 2200 hborder 0
                540  542  547  562 vborder 0
               +hsync +vsync interlaced 
               VertFreq: 60 Hz, HorFreq: 33750 Hz
Detailed mode: Clock 80.140 MHz, 700 mm x 392 mm
               1280 1344 1472 1664 hborder 0
                768  771  778  798 vborder 0
               -hsync -vsync 
               VertFreq: 60 Hz, HorFreq: 48161 Hz
Checksum: 0x1d (valid)

One or more of the timings is out of range of the Monitor Ranges:
  Vertical Freq: 24 - 75 Hz
  Horizontal Freq: 15625 - 75000 Hz
  Maximum Clock: 162.000 MHz
