edid-decode (hex):

00 ff ff ff ff ff ff 00 4c 83 59 42 00 00 00 00
00 19 01 04 a5 1d 11 78 0a 9f 65 a2 57 4c 9b 26
12 50 54 00 00 00 01 01 01 01 01 01 01 01 01 01
01 01 01 01 01 01 2a 36 80 a0 70 38 1f 40 30 20
25 00 25 a5 10 00 00 19 1c 24 80 a0 70 38 1f 40
30 20 25 00 25 a5 10 00 00 19 00 00 00 00 00 00
00 00 00 00 00 00 00 00 00 00 00 00 00 00 00 02
00 0c 33 ff 0a 3c 96 15 29 29 96 00 00 00 00 82

----------------

Block 0, Base EDID:
  EDID Structure Version & Revision: 1.4
  Vendor & Product Identification:
    Manufacturer: SDC
    Model: 16985
    Made in: 2015
  Basic Display Parameters & Features:
    Digital display
    Bits per primary color channel: 8
    DisplayPort interface
    Maximum image size: 29 cm x 17 cm
    Gamma: 2.20
    Supported color formats: RGB 4:4:4, YCrCb 4:4:4
    First detailed timing includes the native pixel format and preferred refresh rate
  Color Characteristics:
    Red  : 0.6347, 0.3408
    Green: 0.2998, 0.6083
    Blue : 0.1494, 0.0722
    White: 0.3134, 0.3291
  Established Timings I & II: none
  Standard Timings: none
  Detailed Timing Descriptors:
    DTD 1:  1920x1080   60.003 Hz  16:9    66.663 kHz 138.660 MHz (293 mm x 165 mm)
                 Hfront   48 Hsync  32 Hback  80 Hpol N
                 Vfront    2 Vsync   5 Vback  24 Vpol N
    DTD 2:  1920x1080   40.002 Hz  16:9    44.442 kHz  92.440 MHz (293 mm x 165 mm)
                 Hfront   48 Hsync  32 Hback  80 Hpol N
                 Vfront    2 Vsync   5 Vback  24 Vpol N
    Empty Descriptor
    Manufacturer-Specified Display Descriptor (0x02): 00 02 00 0c 33 ff 0a 3c 96 15 29 29 96 00 00 00 '....3..<..))....'
Checksum: 0x82

----------------

Failures:

Block 0, Base EDID:
  Empty Descriptor: Use Dummy Descriptor instead of all zeroes.
  Missing Display Product Name.

EDID conformity: FAIL
