edid-decode (hex):

00 ff ff ff ff ff ff 00 05 e3 50 c7 01 01 01 01
06 12 01 03 68 25 17 78 2a 89 75 a4 58 4f 94 25
17 50 54 bf ef 80 81 80 71 4f 81 40 95 0f 95 00
01 01 01 01 01 01 9a 29 a0 d0 51 84 22 30 50 98
36 00 6f e6 10 00 00 1c 00 00 00 ff 00 4b 33 31
38 32 43 41 30 30 31 32 36 36 00 00 00 fd 00 32
4c 1e 53 0e 00 0a 20 20 20 20 20 20 00 00 00 fc
00 37 31 38 53 77 73 67 2d 31 0a 20 20 20 00 65

00 ff ff ff ff ff ff 00 05 e3 50 c7 01 01 01 01
06 12 01 03 68 25 17 78 2a 89 75 a4 58 4f 94 25
17 50 54 bf ef 80 81 80 71 4f 81 40 95 0f 95 00
01 01 01 01 01 01 9a 29 a0 d0 51 84 22 30 50 98
36 00 6f e6 10 00 00 1c 00 00 00 ff 00 4b 33 31
38 32 43 41 30 30 31 32 36 36 00 00 00 fd 00 32
4c 1e 53 0e 00 0a 20 20 20 20 20 20 00 00 00 fc
00 37 31 38 53 77 73 67 2d 31 0a 20 20 20 00 65

----------------

Block 0, Base EDID:
  EDID Structure Version & Revision: 1.3
  Vendor & Product Identification:
    Manufacturer: AOC
    Model: 51024
    Serial Number: ...
    Made in: week 6 of 2008
  Basic Display Parameters & Features:
    Analog display
    Signal Level Standard: 0.700 : 0.000 : 0.700 V p-p
    Blank level equals black level
    Sync: Separate
    Maximum image size: 37 cm x 23 cm
    Gamma: 2.20
    DPMS levels: Off
    RGB color display
    First detailed timing is the preferred timing
  Color Characteristics:
    Red  : 0.6425, 0.3437
    Green: 0.3105, 0.5791
    Blue : 0.1455, 0.0927
    White: 0.3134, 0.3291
  Established Timings I & II:
    IBM     :   720x400    70.081663 Hz   9:5     31.467 kHz     28.320000 MHz
    DMT 0x04:   640x480    59.940476 Hz   4:3     31.469 kHz     25.175000 MHz
    Apple   :   640x480    66.666667 Hz   4:3     35.000 kHz     30.240000 MHz
    DMT 0x05:   640x480    72.808802 Hz   4:3     37.861 kHz     31.500000 MHz
    DMT 0x06:   640x480    75.000000 Hz   4:3     37.500 kHz     31.500000 MHz
    DMT 0x08:   800x600    56.250000 Hz   4:3     35.156 kHz     36.000000 MHz
    DMT 0x09:   800x600    60.316541 Hz   4:3     37.879 kHz     40.000000 MHz
    DMT 0x0a:   800x600    72.187572 Hz   4:3     48.077 kHz     50.000000 MHz
    DMT 0x0b:   800x600    75.000000 Hz   4:3     46.875 kHz     49.500000 MHz
    Apple   :   832x624    74.551266 Hz   4:3     49.726 kHz     57.284000 MHz
    DMT 0x10:  1024x768    60.003840 Hz   4:3     48.363 kHz     65.000000 MHz
    DMT 0x11:  1024x768    70.069359 Hz   4:3     56.476 kHz     75.000000 MHz
    DMT 0x12:  1024x768    75.028582 Hz   4:3     60.023 kHz     78.750000 MHz
    DMT 0x24:  1280x1024   75.024675 Hz   5:4     79.976 kHz    135.000000 MHz
    Apple   :  1152x870    75.061550 Hz 192:145   68.681 kHz    100.000000 MHz
  Standard Timings:
    DMT 0x23:  1280x1024   60.019740 Hz   5:4     63.981 kHz    108.000000 MHz
    DMT 0x15:  1152x864    75.000000 Hz   4:3     67.500 kHz    108.000000 MHz
    DMT 0x20:  1280x960    60.000000 Hz   4:3     60.000 kHz    108.000000 MHz
    DMT 0x30:  1440x900    74.984427 Hz  16:10    70.635 kHz    136.750000 MHz
    DMT 0x2f:  1440x900    59.887445 Hz  16:10    55.935 kHz    106.500000 MHz
  Detailed Timing Descriptors:
    DTD 1:  1440x900    59.887445 Hz  16:10    55.935 kHz    106.500000 MHz (367 mm x 230 mm)
                 Hfront   80 Hsync 152 Hback  232 Hpol N
                 Vfront    3 Vsync   6 Vback   25 Vpol P
    Display Product Serial Number: ...
    Display Range Limits:
      Monitor ranges (GTF): 50-76 Hz V, 30-83 kHz H, max dotclock 140 MHz
    Display Product Name: '718Swsg-1'
Checksum: 0x65

----------------

Block 1, Unknown EDID Extension Block 0x00:
  00 ff ff ff ff ff ff 00 05 e3 50 c7 01 01 01 01 '..........P.....'
  06 12 01 03 68 25 17 78 2a 89 75 a4 58 4f 94 25 '....h%.x*.u.XO.%'
  17 50 54 bf ef 80 81 80 71 4f 81 40 95 0f 95 00 '.PT.....qO.@....'
  01 01 01 01 01 01 9a 29 a0 d0 51 84 22 30 50 98 '.......)..Q."0P.'
  36 00 6f e6 10 00 00 1c 00 00 00 ff 00 4b 33 31 '6.o..........K31'
  38 32 43 41 30 30 31 32 36 36 00 00 00 fd 00 32 '82CA001266.....2'
  4c 1e 53 0e 00 0a 20 20 20 20 20 20 00 00 00 fc 'L.S...      ....'
  00 37 31 38 53 77 73 67 2d 31 0a 20 20 20 00 65 '.718Swsg-1.   .e'
Checksum: 0x65

----------------

Failures:

Block 1, Base EDID:
  Unknown Extension Block.
EDID:
  Base EDID: EDID specified 0 extension block(s), but found 1 extension block(s).

EDID conformity: FAIL
