
EDID (hex):
00ffffffffffff000daea91400000000
2c170104951f117802fda59255529428
24505400000001010101010101010101
0101010101015e358096703814402c1c
240034ad10000018000000fe004e3134
304847452d4542410a20000000fe0043
4d4e0a202020202020202020000000fe
004e3134304847452d4542410a2000d0

Extracted contents:
header:          00 ff ff ff ff ff ff 00
serial number:   0d ae a9 14 00 00 00 00 2c 17
version:         01 04
basic params:    95 1f 11 78 02
chroma info:     fd a5 92 55 52 94 28 24 50 54
established:     00 00 00
standard:        01 01 01 01 01 01 01 01 01 01 01 01 01 01 01 01
descriptor 1:    5e 35 80 96 70 38 14 40 2c 1c 24 00 34 ad 10 00 00 18
descriptor 2:    00 00 00 fe 00 4e 31 34 30 48 47 45 2d 45 42 41 0a 20
descriptor 3:    00 00 00 fe 00 43 4d 4e 0a 20 20 20 20 20 20 20 20 20
descriptor 4:    00 00 00 fe 00 4e 31 34 30 48 47 45 2d 45 42 41 0a 20
extensions:      00
checksum:        d0

EDID version: 1.4
Manufacturer: CMN Model 14a9 Serial Number --
Made in week 44 of 2013
Digital display
6 bits per primary color channel
DisplayPort interface
Maximum image size: 31 cm x 17 cm
Gamma: 2.20
Supported color formats: RGB 4:4:4
First detailed timing includes the native pixel format and preferred refresh rate
Display x,y Chromaticity:
  Red:   0.5732, 0.3349
  Green: 0.3232, 0.5791
  Blue:  0.1582, 0.1425
  White: 0.3134, 0.3291
Established timings supported:
Standard timings supported:
Detailed mode: Clock 136.620 MHz, 308 mm x 173 mm
               1920 1964 1992 2070 hborder 0
               1080 1082 1086 1100 vborder 0
               -hsync -vsync 
               VertFreq: 60 Hz, HorFreq: 66000 Hz
ASCII string: N140HGE-EBA
ASCII string: CMN
ASCII string: N140HGE-EBA
Checksum: 0xd0 (valid)
EDID block does NOT conform to EDID 1.4!
	Missing name descriptor
	Missing monitor ranges
