
EDID (hex):
00ffffffffffff00410cc5c0760e0000
031901036e351e782a9265a655559f28
0d5054bd4b00d1c08180950f9500b300
81c001010101023a801871382d40582c
4500132b2100001e000000ff00415530
31353033303033373032000000fc0050
484c2032343656350a202020000000fd
00384c1e5311000a202020202020005b

Extracted contents:
header:          00 ff ff ff ff ff ff 00
serial number:   41 0c c5 c0 76 0e 00 00 03 19
version:         01 03
basic params:    6e 35 1e 78 2a
chroma info:     92 65 a6 55 55 9f 28 0d 50 54
established:     bd 4b 00
standard:        d1 c0 81 80 95 0f 95 00 b3 00 81 c0 01 01 01 01
descriptor 1:    02 3a 80 18 71 38 2d 40 58 2c 45 00 13 2b 21 00 00 1e
descriptor 2:    00 00 00 ff 00 41 55 30 31 35 30 33 30 30 33 37 30 32
descriptor 3:    00 00 00 fc 00 50 48 4c 20 32 34 36 56 35 0a 20 20 20
descriptor 4:    00 00 00 fd 00 38 4c 1e 53 11 00 0a 20 20 20 20 20 20
extensions:      00
checksum:        5b

EDID version: 1.3
Manufacturer: PHL Model c0c5 Serial Number --
Made in week 3 of 2015
Analog display, Input voltage level: 0.7/0.7 V
Sync: Separate Composite SyncOnGreen 
Maximum image size: 53 cm x 30 cm
Gamma: 2.20
DPMS levels: Off
RGB color display
First detailed timing is preferred timing
Display x,y Chromaticity:
  Red:   0.6503, 0.3330
  Green: 0.3320, 0.6230
  Blue:  0.1572, 0.0527
  White: 0.3134, 0.3291
Established timings supported:
  720x400@70Hz 9:5 HorFreq: 31469 Hz Clock: 28.320 MHz
  640x480@60Hz 4:3 HorFreq: 31469 Hz Clock: 25.175 MHz
  640x480@67Hz 4:3 HorFreq: 35000 Hz Clock: 30.240 MHz
  640x480@72Hz 4:3 HorFreq: 37900 Hz Clock: 31.500 MHz
  640x480@75Hz 4:3 HorFreq: 37500 Hz Clock: 31.500 MHz
  800x600@60Hz 4:3 HorFreq: 37900 Hz Clock: 40.000 MHz
  800x600@75Hz 4:3 HorFreq: 46900 Hz Clock: 49.500 MHz
  1024x768@60Hz 4:3 HorFreq: 48400 Hz Clock: 65.000 MHz
  1024x768@75Hz 4:3 HorFreq: 60000 Hz Clock: 78.750 MHz
  1280x1024@75Hz 5:4 HorFreq: 80000 Hz Clock: 135.000 MHz
Standard timings supported:
  1920x1080@60Hz 16:9
  1280x1024@60Hz 5:4 HorFreq: 64000 Hz Clock: 108.000 MHz
  1440x900@75Hz 16:10 HorFreq: 82300 Hz Clock: 156.000 MHz
  1440x900@60Hz 16:10 HorFreq: 55500 Hz Clock: 88.750 MHz
  1680x1050@60Hz 16:10 HorFreq: 64700 Hz Clock: 119.000 MHz
  1280x720@60Hz 16:9
Detailed mode: Clock 148.500 MHz, 531 mm x 299 mm
               1920 2008 2052 2200 hborder 0
               1080 1084 1089 1125 vborder 0
               +hsync +vsync 
               VertFreq: 60 Hz, HorFreq: 67500 Hz
Serial number: --
Monitor name: PHL 246V5
Monitor ranges (GTF): 56-76Hz V, 30-83kHz H, max dotclock 170MHz
Checksum: 0x5b (valid)
