
EDID (hex):
00ffffffffffff0009e55f0600000000
0119010495221378024950a458519c26
0b505400000001010101010101010101
010101010101993680a0703828403020
360058c21000001a0000000000000000
00000000000000000000000000fe0042
4f452048460a202020202020000000fe
004e5631353646484d2d4e34330a00cf

Extracted contents:
header:          00 ff ff ff ff ff ff 00
serial number:   09 e5 5f 06 00 00 00 00 01 19
version:         01 04
basic params:    95 22 13 78 02
chroma info:     49 50 a4 58 51 9c 26 0b 50 54
established:     00 00 00
standard:        01 01 01 01 01 01 01 01 01 01 01 01 01 01 01 01
descriptor 1:    99 36 80 a0 70 38 28 40 30 20 36 00 58 c2 10 00 00 1a
descriptor 2:    00 00 00 00 00 00 00 00 00 00 00 00 00 00 00 00 00 00
descriptor 3:    00 00 00 fe 00 42 4f 45 20 48 46 0a 20 20 20 20 20 20
descriptor 4:    00 00 00 fe 00 4e 56 31 35 36 46 48 4d 2d 4e 34 33 0a
extensions:      00
checksum:        cf

EDID version: 1.4
Manufacturer: BOE Model 65f Serial Number --
Made in week 1 of 2015
Digital display
6 bits per primary color channel
DisplayPort interface
Maximum image size: 34 cm x 19 cm
Gamma: 2.20
Supported color formats: RGB 4:4:4
First detailed timing includes the native pixel format and preferred refresh rate
Display x,y Chromaticity:
  Red:   0.6416, 0.3437
  Green: 0.3183, 0.6103
  Blue:  0.1494, 0.0439
  White: 0.3125, 0.3281
Established timings supported:
Standard timings supported:
Detailed mode: Clock 139.770 MHz, 344 mm x 194 mm
               1920 1968 2000 2080 hborder 0
               1080 1083 1089 1120 vborder 0
               +hsync -vsync 
               VertFreq: 59 Hz, HorFreq: 67197 Hz
Manufacturer-specified data, tag 0
ASCII string: BOE HF
ASCII string: NV156FHM-N43
Checksum: 0xcf (valid)
EDID block does NOT conform to EDID 1.4!
	Missing name descriptor
	Missing monitor ranges
