edid-decode (hex):

00 ff ff ff ff ff ff 00 09 e5 39 06 00 00 00 00
03 19 01 04 95 1f 11 78 02 9d 40 9a 5d 55 8d 28
1e 50 54 00 00 00 01 01 01 01 01 01 01 01 01 01
01 01 01 01 01 01 bc 39 80 18 71 38 28 40 30 20
36 00 35 ad 10 00 00 1a 36 2e 80 18 71 38 28 40
30 20 36 00 35 ad 10 00 00 1a 00 00 00 fe 00 47
4e 38 38 37 80 4e 56 31 34 4e 34 31 00 00 00 00
00 00 41 01 94 00 10 00 00 09 01 0a 20 20 00 4a

----------------

Block 0, Base EDID:
  EDID Structure Version & Revision: 1.4
  Vendor & Product Identification:
    Manufacturer: BOE
    Model: 1593
    Made in: week 3 of 2015
  Basic Display Parameters & Features:
    Digital display
    Bits per primary color channel: 6
    DisplayPort interface
    Maximum image size: 31 cm x 17 cm
    Gamma: 2.20
    Supported color formats: RGB 4:4:4
    First detailed timing includes the native pixel format and preferred refresh rate
  Color Characteristics:
    Red  : 0.6035, 0.3642
    Green: 0.3349, 0.5517
    Blue : 0.1572, 0.1171
    White: 0.3125, 0.3281
  Established Timings I & II: none
  Standard Timings: none
  Detailed Timing Descriptors:
    DTD 1:  1920x1080   59.984 Hz  16:9    67.182 kHz 147.800 MHz (309 mm x 173 mm)
                 Hfront   48 Hsync  32 Hback 200 Hpol P
                 Vfront    3 Vsync   6 Vback  31 Vpol N
    DTD 2:  1920x1080   48.011 Hz  16:9    53.773 kHz 118.300 MHz (309 mm x 173 mm)
                 Hfront   48 Hsync  32 Hback 200 Hpol P
                 Vfront    3 Vsync   6 Vback  31 Vpol N
    Alphanumeric Data String: 'GN887'
    Manufacturer-Specified Display Descriptor (0x00): 00 00 00 00 41 01 94 00 10 00 00 09 01 0a 20 20 '....A.........  '
Checksum: 0x4a
