
EDID (hex):
00ffffffffffff0010ac63404c333433
1316010380402878ea8d85ad4f35b125
0e5054a54b00714f81008180a940d100
d14001010101e26800a0a0402e603020
360081912100001a000000ff00504835
4e593235393334334c0a000000fc0044
454c4c2055333031310a2020000000fd
0031561d711c000a20202020202000b7

Extracted contents:
header:          00 ff ff ff ff ff ff 00
serial number:   10 ac 63 40 4c 33 34 33 13 16
version:         01 03
basic params:    80 40 28 78 ea
chroma info:     8d 85 ad 4f 35 b1 25 0e 50 54
established:     a5 4b 00
standard:        71 4f 81 00 81 80 a9 40 d1 00 d1 40 01 01 01 01
descriptor 1:    e2 68 00 a0 a0 40 2e 60 30 20 36 00 81 91 21 00 00 1a
descriptor 2:    00 00 00 ff 00 50 48 35 4e 59 32 35 39 33 34 33 4c 0a
descriptor 3:    00 00 00 fc 00 44 45 4c 4c 20 55 33 30 31 31 0a 20 20
descriptor 4:    00 00 00 fd 00 31 56 1d 71 1c 00 0a 20 20 20 20 20 20
extensions:      00
checksum:        b7

EDID version: 1.3
Manufacturer: DEL Model 4063 Serial Number --
Made in week 19 of 2012
Digital display
Maximum image size: 64 cm x 40 cm
Gamma: 2.20
DPMS levels: Standby Suspend Off
RGB color display
First detailed timing is preferred timing
Display x,y Chromaticity:
  Red:   0.6777, 0.3085
  Green: 0.2099, 0.6923
  Blue:  0.1464, 0.0546
  White: 0.3134, 0.3291
Established timings supported:
  720x400@70Hz 9:5 HorFreq: 31469 Hz Clock: 28.320 MHz
  640x480@60Hz 4:3 HorFreq: 31469 Hz Clock: 25.175 MHz
  640x480@75Hz 4:3 HorFreq: 37500 Hz Clock: 31.500 MHz
  800x600@60Hz 4:3 HorFreq: 37900 Hz Clock: 40.000 MHz
  800x600@75Hz 4:3 HorFreq: 46900 Hz Clock: 49.500 MHz
  1024x768@60Hz 4:3 HorFreq: 48400 Hz Clock: 65.000 MHz
  1024x768@75Hz 4:3 HorFreq: 60000 Hz Clock: 78.750 MHz
  1280x1024@75Hz 5:4 HorFreq: 80000 Hz Clock: 135.000 MHz
Standard timings supported:
  1152x864@75Hz 4:3 HorFreq: 67500 Hz Clock: 108.000 MHz
  1280x800@60Hz 16:10
  1280x1024@60Hz 5:4 HorFreq: 64000 Hz Clock: 108.000 MHz
  1600x1200@60Hz 4:3 HorFreq: 75000 Hz Clock: 162.000 MHz
  1920x1200@60Hz 16:10 HorFreq: 74000 Hz Clock: 154.000 MHz
  1920x1440@60Hz 4:3 HorFreq: 90000 Hz Clock: 234.000 MHz
Detailed mode: Clock 268.500 MHz, 641 mm x 401 mm
               2560 2608 2640 2720 hborder 0
               1600 1603 1609 1646 vborder 0
               +hsync -vsync 
               VertFreq: 59 Hz, HorFreq: 98713 Hz
Serial number: --
Monitor name: DELL U3011
Monitor ranges (GTF): 49-86Hz V, 29-113kHz H, max dotclock 280MHz
Checksum: 0xb7 (valid)
