edid-decode (hex):

00 ff ff ff ff ff ff 00 1a b3 3d 07 01 00 00 00
1e 12 01 03 68 34 20 78 2a ee 95 a3 54 4c 99 26
0f 50 54 a5 4b 00 95 00 95 0f 81 00 81 0f 81 c0
81 80 a9 40 01 01 28 3c 80 a0 70 b0 23 40 30 20
36 00 06 44 21 00 00 1a 7c 2e 90 a0 60 1a 1e 40
30 20 36 00 06 44 21 00 00 1a 00 00 00 fc 00 50
32 34 57 2d 33 0a 20 20 20 20 20 20 00 00 00 ff
00 59 45 32 4c 35 30 34 32 33 35 0a 20 20 00 29

00 ff ff ff ff ff ff 00 1a b3 3d 07 01 00 00 00
1e 12 01 03 68 34 20 78 2a ee 95 a3 54 4c 99 26
0f 50 54 a5 4b 00 95 00 95 0f 81 00 81 0f 81 c0
81 80 a9 40 01 01 28 3c 80 a0 70 b0 23 40 30 20
36 00 06 44 21 00 00 1a 7c 2e 90 a0 60 1a 1e 40
30 20 36 00 06 44 21 00 00 1a 00 00 00 fc 00 50
32 34 57 2d 33 0a 20 20 20 20 20 20 00 00 00 ff
00 59 45 32 4c 35 30 34 32 33 35 0a 20 20 00 29

----------------

Block 0, Base EDID:
  EDID Structure Version & Revision: 1.3
  Vendor & Product Identification:
    Manufacturer: FUS
    Model: 1853
    Serial Number: ...
    Made in: week 30 of 2008
  Basic Display Parameters & Features:
    Analog display
    Signal Level Standard: 0.700 : 0.000 : 0.700 V p-p
    Blank level equals black level
    Sync: Separate
    Maximum image size: 52 cm x 32 cm
    Gamma: 2.20
    DPMS levels: Off
    RGB color display
    First detailed timing is the preferred timing
  Color Characteristics:
    Red  : 0.6396, 0.3300
    Green: 0.2998, 0.5996
    Blue : 0.1503, 0.0595
    White: 0.3134, 0.3291
  Established Timings I & II:
    IBM     :   720x400    70.081663 Hz   9:5     31.467 kHz     28.320000 MHz
    DMT 0x04:   640x480    59.940476 Hz   4:3     31.469 kHz     25.175000 MHz
    DMT 0x06:   640x480    75.000000 Hz   4:3     37.500 kHz     31.500000 MHz
    DMT 0x09:   800x600    60.316541 Hz   4:3     37.879 kHz     40.000000 MHz
    DMT 0x0b:   800x600    75.000000 Hz   4:3     46.875 kHz     49.500000 MHz
    DMT 0x10:  1024x768    60.003840 Hz   4:3     48.363 kHz     65.000000 MHz
    DMT 0x12:  1024x768    75.028582 Hz   4:3     60.023 kHz     78.750000 MHz
    DMT 0x24:  1280x1024   75.024675 Hz   5:4     79.976 kHz    135.000000 MHz
  Standard Timings:
    DMT 0x2f:  1440x900    59.887445 Hz  16:10    55.935 kHz    106.500000 MHz
    DMT 0x30:  1440x900    74.984427 Hz  16:10    70.635 kHz    136.750000 MHz
    DMT 0x1c:  1280x800    59.810326 Hz  16:10    49.702 kHz     83.500000 MHz
    DMT 0x1d:  1280x800    74.934142 Hz  16:10    62.795 kHz    106.500000 MHz
    DMT 0x55:  1280x720    60.000000 Hz  16:9     45.000 kHz     74.250000 MHz
    DMT 0x23:  1280x1024   60.019740 Hz   5:4     63.981 kHz    108.000000 MHz
    DMT 0x33:  1600x1200   60.000000 Hz   4:3     75.000 kHz    162.000000 MHz
  Detailed Timing Descriptors:
    DTD 1:  1920x1200   59.950171 Hz  16:10    74.038 kHz    154.000000 MHz (518 mm x 324 mm)
                 Hfront   48 Hsync  32 Hback   80 Hpol P
                 Vfront    3 Vsync   6 Vback   26 Vpol N
    DTD 2:  1680x1050   59.883253 Hz  16:10    64.674 kHz    119.000000 MHz (518 mm x 324 mm)
                 Hfront   48 Hsync  32 Hback   80 Hpol P
                 Vfront    3 Vsync   6 Vback   21 Vpol N
    Display Product Name: 'P24W-3'
    Display Product Serial Number: ...
Checksum: 0x29

----------------

Block 1, Unknown EDID Extension Block 0x00:
  00 ff ff ff ff ff ff 00 1a b3 3d 07 01 00 00 00 '..........=.....'
  1e 12 01 03 68 34 20 78 2a ee 95 a3 54 4c 99 26 '....h4 x*...TL.&'
  0f 50 54 a5 4b 00 95 00 95 0f 81 00 81 0f 81 c0 '.PT.K...........'
  81 80 a9 40 01 01 28 3c 80 a0 70 b0 23 40 30 20 '...@..(<..p.#@0 '
  36 00 06 44 21 00 00 1a 7c 2e 90 a0 60 1a 1e 40 '6..D!...|...`..@'
  30 20 36 00 06 44 21 00 00 1a 00 00 00 fc 00 50 '0 6..D!........P'
  32 34 57 2d 33 0a 20 20 20 20 20 20 00 00 00 ff '24W-3.      ....'
  00 59 45 32 4c 35 30 34 32 33 35 0a 20 20 00 29 '.YE2L504235.  .)'
Checksum: 0x29

----------------

Failures:

Block 0, Base EDID:
  Missing Display Range Limits Descriptor.
Block 1, Base EDID:
  Unknown Extension Block.
EDID:
  Base EDID: EDID specified 0 extension block(s), but found 1 extension block(s).

EDID conformity: FAIL
