
EDID (hex):
00ffffffffffff00220e323501010101
181c0103803c22782a2895a7554ea326
0f5054a10800d1c081c081809500a9c0
a940b300d10004740030f2705a80b058
8a0055502100001e000000fd00183c1b
641e000a202020202020000000fc0048
5020533237306e0a20202020000000ff
0036434d383234323453440a202001f4
02031bb149101f041303130213016c03
0c002000003c2000400103565e00a0a0
a029503020350055502100001aef5100
a0f07019803020350055502100001a00
00000000000000000000000000000000
00000000000000000000000000000000
00000000000000000000000000000000
00000000000000000000000000000089

Extracted contents:
header:          00 ff ff ff ff ff ff 00
serial number:   22 0e 32 35 01 01 01 01 18 1c
version:         01 03
basic params:    80 3c 22 78 2a
chroma info:     28 95 a7 55 4e a3 26 0f 50 54
established:     a1 08 00
standard:        d1 c0 81 c0 81 80 95 00 a9 c0 a9 40 b3 00 d1 00
descriptor 1:    04 74 00 30 f2 70 5a 80 b0 58 8a 00 55 50 21 00 00 1e
descriptor 2:    00 00 00 fd 00 18 3c 1b 64 1e 00 0a 20 20 20 20 20 20
descriptor 3:    00 00 00 fc 00 48 50 20 53 32 37 30 6e 0a 20 20 20 20
descriptor 4:    00 00 00 ff 00 36 43 4d 38 32 34 32 34 53 44 0a 20 20
extensions:      01
checksum:        f4

EDID version: 1.3
Manufacturer: HPN Model 3532 Serial Number --
Made in week 24 of 2018
Digital display
Maximum image size: 60 cm x 34 cm
Gamma: 2.20
DPMS levels: Off
RGB color display
First detailed timing is preferred timing
Display x,y Chromaticity:
  Red:   0.6523, 0.3339
  Green: 0.3066, 0.6367
  Blue:  0.1503, 0.0595
  White: 0.3134, 0.3291
Established timings supported:
  720x400@70Hz 9:5 HorFreq: 31469 Hz Clock: 28.320 MHz
  640x480@60Hz 4:3 HorFreq: 31469 Hz Clock: 25.175 MHz
  800x600@60Hz 4:3 HorFreq: 37900 Hz Clock: 40.000 MHz
  1024x768@60Hz 4:3 HorFreq: 48400 Hz Clock: 65.000 MHz
Standard timings supported:
  1920x1080@60Hz 16:9
  1280x720@60Hz 16:9
  1280x1024@60Hz 5:4 HorFreq: 64000 Hz Clock: 108.000 MHz
  1440x900@60Hz 16:10 HorFreq: 55500 Hz Clock: 88.750 MHz
  1600x900@60Hz 16:9
  1600x1200@60Hz 4:3 HorFreq: 75000 Hz Clock: 162.000 MHz
  1680x1050@60Hz 16:10 HorFreq: 64700 Hz Clock: 119.000 MHz
  1920x1200@60Hz 16:10 HorFreq: 74000 Hz Clock: 154.000 MHz
Detailed mode: Clock 297.000 MHz, 597 mm x 336 mm
               3840 4016 4104 4400 hborder 0
               2160 2168 2178 2250 vborder 0
               +hsync +vsync 
               VertFreq: 30 Hz, HorFreq: 67500 Hz
Monitor ranges (GTF): 24-60Hz V, 27-100kHz H, max dotclock 300MHz
Monitor name: HP S270n
Serial number: --
Has 1 extension blocks
Checksum: 0xf4 (valid)

CTA extension block
Extension version: 3
23 bytes of CTA data
  Video data block
    VIC  16 1920x1080@60Hz 16:9  HorFreq: 67500 Hz Clock: 148.500 MHz
    VIC  31 1920x1080@50Hz 16:9  HorFreq: 56250 Hz Clock: 148.500 MHz
    VIC   4 1280x720@60Hz 16:9  HorFreq: 45000 Hz Clock: 74.250 MHz
    VIC  19 1280x720@50Hz 16:9  HorFreq: 37500 Hz Clock: 74.250 MHz
    VIC   3 720x480@60Hz 16:9  HorFreq: 31469 Hz Clock: 27.000 MHz
    VIC  19 1280x720@50Hz 16:9  HorFreq: 37500 Hz Clock: 74.250 MHz
    VIC   2 720x480@60Hz 4:3  HorFreq: 31469 Hz Clock: 27.000 MHz
    VIC  19 1280x720@50Hz 16:9  HorFreq: 37500 Hz Clock: 74.250 MHz
    VIC   1 640x480@60Hz 4:3  HorFreq: 31469 Hz Clock: 25.175 MHz
  Vendor-specific data block, OUI 000c03 (HDMI)
    Source physical address 2.0.0.0
    Maximum TMDS clock: 300MHz
    Extended HDMI video details:
      HDMI VIC 1 3840x2160@30Hz 16:9 HorFreq: 67500 Hz Clock: 297.000 MHz
      HDMI VIC 3 3840x2160@24Hz 16:9 HorFreq: 54000 Hz Clock: 297.000 MHz
Underscans PC formats by default
Supports YCbCr 4:4:4
Supports YCbCr 4:2:2
1 native detailed modes
Detailed mode: Clock 241.500 MHz, 597 mm x 336 mm
               2560 2608 2640 2720 hborder 0
               1440 1443 1448 1481 vborder 0
               +hsync -vsync 
               VertFreq: 59 Hz, HorFreq: 88786 Hz
Detailed mode: Clock 209.750 MHz, 597 mm x 336 mm
               3840 3888 3920 4000 hborder 0
               2160 2163 2168 2185 vborder 0
               +hsync -vsync 
               VertFreq: 23 Hz, HorFreq: 52437 Hz
Checksum: 0x89 (valid)

One or more of the timings is out of range of the Monitor Ranges:
  Vertical Freq: 23 - 70 Hz
  Horizontal Freq: 31469 - 88786 Hz
  Maximum Clock: 297.000 MHz
EDID block does not conform at all!
	Both the serial number and the serial string are set
Warning: HDMI VIC Codes must have their CTA-861 VIC equivalents in the VSB


