edid-decode (hex):

00 ff ff ff ff ff ff 00 0d b4 03 27 01 00 00 00
23 20 01 03 80 3c 21 78 0e b8 55 b2 4a 37 bb 25
0a 50 54 a5 4f 00 b3 00 a9 c0 95 00 81 00 81 40
81 80 90 40 71 40 56 5e 00 a0 a0 a0 29 50 30 20
35 00 55 50 21 00 00 1a 00 00 00 ff 00 0a 20 20
20 20 20 20 20 20 20 20 20 20 00 00 00 fd 00 30
a5 a0 a0 44 01 0a 20 20 20 20 20 20 00 00 00 fc
00 47 50 32 37 2d 46 51 53 0a 20 20 20 20 01 7f

02 03 2b 74 43 01 90 1f 23 09 07 07 83 01 00 00
e3 05 e3 01 e6 06 07 01 93 82 22 67 03 0c 00 10
00 18 3c 67 d8 5d c4 01 78 80 00 f5 bd 00 a0 a0
a0 32 50 20 40 45 00 56 50 21 00 00 1e 04 76 00
a0 a0 a0 29 50 30 20 36 00 bc 86 21 00 00 1a f8
e3 00 a0 a0 a0 32 50 30 20 35 00 56 50 21 00 00
1a b6 ff 00 96 a0 a0 18 50 30 40 35 00 70 cf 10
00 00 1e 00 00 00 00 00 00 00 00 00 00 00 00 65

00 ff ff ff ff ff ff 00 0d b4 03 27 01 00 00 00
23 20 01 03 80 3c 21 78 0e b8 55 b2 4a 37 bb 25
0a 50 54 a5 4f 00 b3 00 a9 c0 95 00 81 00 81 40
81 80 90 40 71 40 56 5e 00 a0 a0 a0 29 50 30 20
35 00 55 50 21 00 00 1a 00 00 00 ff 00 0a 20 20
20 20 20 20 20 20 20 20 20 20 00 00 00 fd 00 30
a5 a0 a0 44 01 0a 20 20 20 20 20 20 00 00 00 fc
00 47 50 32 37 2d 46 51 53 0a 20 20 20 20 01 7f

02 03 2b 74 43 01 90 1f 23 09 07 07 83 01 00 00
e3 05 e3 01 e6 06 07 01 93 82 22 67 03 0c 00 10
00 18 3c 67 d8 5d c4 01 78 80 00 f5 bd 00 a0 a0
a0 32 50 20 40 45 00 56 50 21 00 00 1e 04 76 00
a0 a0 a0 29 50 30 20 36 00 bc 86 21 00 00 1a f8
e3 00 a0 a0 a0 32 50 30 20 35 00 56 50 21 00 00
1a b6 ff 00 96 a0 a0 18 50 30 40 35 00 70 cf 10
00 00 1e 00 00 00 00 00 00 00 00 00 00 00 00 65

----------------

Block 0, Base EDID:
  EDID Structure Version & Revision: 1.3
  Vendor & Product Identification:
    Manufacturer: CMT
    Model: 9987
    Serial Number: ...
    Made in: week 35 of 2022
  Basic Display Parameters & Features:
    Digital display
    Maximum image size: 60 cm x 33 cm
    Gamma: 2.20
    RGB color display
    Default (sRGB) color space is primary color space
    First detailed timing is the preferred timing
  Color Characteristics:
    Red  : 0.6972, 0.2919
    Green: 0.2167, 0.7304
    Blue : 0.1455, 0.0400
    White: 0.3134, 0.3291
  Established Timings I & II:
    IBM     :   720x400    70.081663 Hz   9:5     31.467 kHz     28.320000 MHz
    DMT 0x04:   640x480    59.940476 Hz   4:3     31.469 kHz     25.175000 MHz
    DMT 0x06:   640x480    75.000000 Hz   4:3     37.500 kHz     31.500000 MHz
    DMT 0x09:   800x600    60.316541 Hz   4:3     37.879 kHz     40.000000 MHz
    DMT 0x0b:   800x600    75.000000 Hz   4:3     46.875 kHz     49.500000 MHz
    DMT 0x10:  1024x768    60.003840 Hz   4:3     48.363 kHz     65.000000 MHz
    DMT 0x11:  1024x768    70.069359 Hz   4:3     56.476 kHz     75.000000 MHz
    DMT 0x12:  1024x768    75.028582 Hz   4:3     60.023 kHz     78.750000 MHz
    DMT 0x24:  1280x1024   75.024675 Hz   5:4     79.976 kHz    135.000000 MHz
  Standard Timings:
    DMT 0x3a:  1680x1050   59.954250 Hz  16:10    65.290 kHz    146.250000 MHz
    DMT 0x53:  1600x900    60.000000 Hz  16:9     60.000 kHz    108.000000 MHz (RB)
    DMT 0x2f:  1440x900    59.887445 Hz  16:10    55.935 kHz    106.500000 MHz
    DMT 0x1c:  1280x800    59.810326 Hz  16:10    49.702 kHz     83.500000 MHz
    DMT 0x20:  1280x960    60.000000 Hz   4:3     60.000 kHz    108.000000 MHz
    DMT 0x23:  1280x1024   60.019740 Hz   5:4     63.981 kHz    108.000000 MHz
    DMT 0x2a:  1400x1050   59.978442 Hz   4:3     65.317 kHz    121.750000 MHz
    GTF     :  1152x864    60.000000 Hz   4:3     53.700 kHz     81.624000 MHz
  Detailed Timing Descriptors:
    DTD 1:  2560x1440   59.950550 Hz  16:9     88.787 kHz    241.500000 MHz (597 mm x 336 mm)
                 Hfront   48 Hsync  32 Hback   80 Hpol P
                 Vfront    3 Vsync   5 Vback   33 Vpol N
    Display Product Serial Number: ...
    Display Range Limits:
      Monitor ranges (Bare Limits): 48-165 Hz V, 160-160 kHz H, max dotclock 680 MHz
    Display Product Name: 'GP27-FQS'
  Extension blocks: 1
Checksum: 0x7f

----------------

Block 1, CTA-861 Extension Block:
  Revision: 3
  Basic audio support
  Supports YCbCr 4:4:4
  Supports YCbCr 4:2:2
  Native detailed modes: 4
  Video Data Block:
    VIC   1:   640x480    59.940476 Hz   4:3     31.469 kHz     25.175000 MHz
    VIC  16:  1920x1080   60.000000 Hz  16:9     67.500 kHz    148.500000 MHz (native)
    VIC  31:  1920x1080   50.000000 Hz  16:9     56.250 kHz    148.500000 MHz
  Audio Data Block:
    Linear PCM:
      Max channels: 2
      Supported sample rates (kHz): 48 44.1 32
      Supported sample sizes (bits): 24 20 16
  Speaker Allocation Data Block:
    FL/FR - Front Left/Right
  Colorimetry Data Block:
    xvYCC601
    xvYCC709
    BT2020cYCC
    BT2020YCC
    BT2020RGB
    Gamut Boundary Description Metadata Profile P0
  HDR Static Metadata Data Block:
    Electro optical transfer functions:
      Traditional gamma - SDR luminance range
      Traditional gamma - HDR luminance range
      SMPTE ST2084
    Supported static metadata descriptors:
      Static metadata type 1
    Desired content max luminance: 147 (1207.332 cd/m^2)
    Desired content max frame-average luminance: 130 (835.419 cd/m^2)
    Desired content min luminance: 34 (0.215 cd/m^2)
  Vendor-Specific Data Block (HDMI), OUI 00-0C-03:
    Source physical address: 1.0.0.0
    DC_30bit
    DC_Y444
    Maximum TMDS clock: 300 MHz
  Vendor-Specific Data Block (HDMI Forum), OUI C4-5D-D8:
    Version: 1
    Maximum TMDS Character Rate: 600 MHz
    SCDC Present
  Detailed Timing Descriptors:
    DTD 2:  2560x1440  119.988650 Hz  16:9    178.783 kHz    486.290000 MHz (598 mm x 336 mm)
                 Hfront   32 Hsync  64 Hback   64 Hpol P
                 Vfront    4 Vsync   5 Vback   41 Vpol P
    DTD 3:  2560x1440   74.999007 Hz  16:9    111.074 kHz    302.120000 MHz (700 mm x 390 mm)
                 Hfront   48 Hsync  32 Hback   80 Hpol P
                 Vfront    3 Vsync   6 Vback   32 Vpol N
    DTD 4:  2560x1440  143.999210 Hz  16:9    214.559 kHz    583.600000 MHz (598 mm x 336 mm)
                 Hfront   48 Hsync  32 Hback   80 Hpol P
                 Vfront    3 Vsync   5 Vback   42 Vpol N
    DTD 5:  2560x1440  164.998084 Hz  16:9    241.557 kHz    654.620000 MHz (368 mm x 207 mm)
                 Hfront   48 Hsync  64 Hback   38 Hpol P
                 Vfront    3 Vsync   5 Vback   16 Vpol P
Checksum: 0x65  Unused space in Extension Block: 12 bytes

----------------

Block 2, Unknown EDID Extension Block 0x00:
  00 ff ff ff ff ff ff 00 0d b4 03 27 01 00 00 00 '...........'....'
  23 20 01 03 80 3c 21 78 0e b8 55 b2 4a 37 bb 25 '# ...<!x..U.J7.%'
  0a 50 54 a5 4f 00 b3 00 a9 c0 95 00 81 00 81 40 '.PT.O..........@'
  81 80 90 40 71 40 56 5e 00 a0 a0 a0 29 50 30 20 '...@q@V^....)P0 '
  35 00 55 50 21 00 00 1a 00 00 00 ff 00 0a 20 20 '5.UP!.........  '
  20 20 20 20 20 20 20 20 20 20 00 00 00 fd 00 30 '          .....0'
  a5 a0 a0 44 01 0a 20 20 20 20 20 20 00 00 00 fc '...D..      ....'
  00 47 50 32 37 2d 46 51 53 0a 20 20 20 20 01 7f '.GP27-FQS.    ..'
Checksum: 0x7f

----------------

Block 3, CTA-861 Extension Block:
  Revision: 3
  Basic audio support
  Supports YCbCr 4:4:4
  Supports YCbCr 4:2:2
  Native detailed modes: 4
  Video Data Block:
    VIC   1:   640x480    59.940476 Hz   4:3     31.469 kHz     25.175000 MHz
    VIC  16:  1920x1080   60.000000 Hz  16:9     67.500 kHz    148.500000 MHz (native)
    VIC  31:  1920x1080   50.000000 Hz  16:9     56.250 kHz    148.500000 MHz
  Audio Data Block:
    Linear PCM:
      Max channels: 2
      Supported sample rates (kHz): 48 44.1 32
      Supported sample sizes (bits): 24 20 16
  Speaker Allocation Data Block:
    FL/FR - Front Left/Right
  Colorimetry Data Block:
    xvYCC601
    xvYCC709
    BT2020cYCC
    BT2020YCC
    BT2020RGB
    Gamut Boundary Description Metadata Profile P0
  HDR Static Metadata Data Block:
    Electro optical transfer functions:
      Traditional gamma - SDR luminance range
      Traditional gamma - HDR luminance range
      SMPTE ST2084
    Supported static metadata descriptors:
      Static metadata type 1
    Desired content max luminance: 147 (1207.332 cd/m^2)
    Desired content max frame-average luminance: 130 (835.419 cd/m^2)
    Desired content min luminance: 34 (0.215 cd/m^2)
  Vendor-Specific Data Block (HDMI), OUI 00-0C-03:
    Source physical address: 1.0.0.0
    DC_30bit
    DC_Y444
    Maximum TMDS clock: 300 MHz
  Vendor-Specific Data Block (HDMI Forum), OUI C4-5D-D8:
    Version: 1
    Maximum TMDS Character Rate: 600 MHz
    SCDC Present
  Detailed Timing Descriptors:
    DTD 6:  2560x1440  119.988650 Hz  16:9    178.783 kHz    486.290000 MHz (598 mm x 336 mm)
                 Hfront   32 Hsync  64 Hback   64 Hpol P
                 Vfront    4 Vsync   5 Vback   41 Vpol P
    DTD 7:  2560x1440   74.999007 Hz  16:9    111.074 kHz    302.120000 MHz (700 mm x 390 mm)
                 Hfront   48 Hsync  32 Hback   80 Hpol P
                 Vfront    3 Vsync   6 Vback   32 Vpol N
    DTD 8:  2560x1440  143.999210 Hz  16:9    214.559 kHz    583.600000 MHz (598 mm x 336 mm)
                 Hfront   48 Hsync  32 Hback   80 Hpol P
                 Vfront    3 Vsync   5 Vback   42 Vpol N
    DTD 9:  2560x1440  164.998084 Hz  16:9    241.557 kHz    654.620000 MHz (368 mm x 207 mm)
                 Hfront   48 Hsync  64 Hback   38 Hpol P
                 Vfront    3 Vsync   5 Vback   16 Vpol P
Checksum: 0x65  Unused space in Extension Block: 12 bytes

----------------

Warnings:

Block 1, CTA-861 Extension Block:
  IT Video Formats are overscanned by default, but normally this should be underscanned.
  Display Product Serial Number is set, so the Serial Number in the Base EDID should be 0.
Block 3, CTA-861 Extension Block:
  IT Video Formats are overscanned by default, but normally this should be underscanned.
  Display Product Serial Number is set, so the Serial Number in the Base EDID should be 0.

Failures:

Block 0, Base EDID:
  Basic Display Parameters & Features: sRGB is signaled, but the chromaticities do not match.
  Display Product Serial Number: ...
  Display Range Limits: 'Bare Limits' is not allowed for EDID < 1.4.
Block 1, CTA-861 Extension Block:
  Detailed Timing Descriptor #3: Mismatch of image size 700x390 mm vs display size 600x330 mm.
  Detailed Timing Descriptor #5: Mismatch of image size 368x207 mm vs display size 600x330 mm.
  Missing VCDB, needed for Set Selectable RGB Quantization to avoid interop issues.
Block 2, Base EDID:
  Unknown Extension Block.
Block 3, CTA-861 Extension Block:
  Video Data Block: Duplicate VIC 1.
  Video Data Block: Duplicate VIC 16.
  Video Data Block: Duplicate VIC 31.
  Speaker Allocation Data Block: Only one instance of this Data Block is allowed.
  Colorimetry Data Block: Only one instance of this Data Block is allowed.
  HDR Static Metadata Data Block: Only one instance of this Data Block is allowed.
  Vendor-Specific Data Block (HDMI Forum), OUI C4-5D-D8: Duplicate HDMI Forum VSDB/SCDB.
  Detailed Timing Descriptor #7: Mismatch of image size 700x390 mm vs display size 600x330 mm.
  Detailed Timing Descriptor #9: Mismatch of image size 368x207 mm vs display size 600x330 mm.
  Missing VCDB, needed for Set Selectable RGB Quantization to avoid interop issues.
EDID:
  Base EDID: Some timings are out of range of the Monitor Ranges:
    Horizontal Freq: 31.466 - 241.557 kHz (Monitor: 160.000 - 160.000 kHz)
  Base EDID: The DTD max image size is 700x390mm, which is larger than the display size 600.0x330.0mm.
  Base EDID: EDID specified 1 extension block(s), but found 3 extension block(s).
  Base EDID: EDID 1.3 requires a Block Map Extension in Block 1 if there are more than 2 blocks in the EDID.
  CTA-861: Native progressive timings are a mix of several resolutions.

EDID conformity: FAIL
