edid-decode (hex):

00 ff ff ff ff ff ff 00 4c a3 55 32 00 00 00 00
00 13 01 03 80 1f 12 78 0a 87 f5 94 57 4f 8c 27
27 50 54 00 00 00 01 01 01 01 01 01 01 01 01 01
01 01 01 01 01 01 12 1b 56 72 50 00 0c 30 30 20
25 00 34 b8 10 00 00 19 00 00 00 0f 00 00 00 00
00 00 00 00 00 1e b4 02 74 00 00 00 00 fe 00 53
41 4d 53 55 4e 47 0a 20 20 20 20 20 00 00 00 fe
00 31 33 33 41 54 31 37 2d 48 30 31 0a 20 00 48

----------------

Block 0, Base EDID:
  EDID Structure Version & Revision: 1.3
  Vendor & Product Identification:
    Manufacturer: SEC
    Model: 12885
    Made in: 2009
  Basic Display Parameters & Features:
    Digital display
    Maximum image size: 31 cm x 18 cm
    Gamma: 2.20
    RGB color display
    First detailed timing is preferred timing
  Color Characteristics:
    Red  : 0.5800, 0.3398
    Green: 0.3095, 0.5498
    Blue : 0.1552, 0.1552
    White: 0.3134, 0.3291
  Established Timings I & II: none
  Standard Timings: none
  Detailed Timing Descriptors:
    DTD 1:  1366x768    60.031 Hz 683:384  46.824 kHz  69.300 MHz (308 mm x 184 mm)
                 Hfront   48 Hsync  32 Hback  34 Hpol N
                 Vfront    2 Vsync   5 Vback   5 Vpol N
    Manufacturer-Specified Display Descriptor (0x0f): 00 0f 00 00 00 00 00 00 00 00 00 1e b4 02 74 00 '..............t.'
    Alphanumeric Data String: 'SAMSUNG'
    Alphanumeric Data String: '133AT17-H01'
Checksum: 0x48
