edid-decode (hex):

00 ff ff ff ff ff ff 00 09 e5 36 0b 00 00 00 00
11 20 01 04 a5 1b 12 78 03 a6 e5 a6 53 4b 99 27
11 50 57 00 00 00 01 01 01 01 01 01 01 01 01 01
01 01 01 01 01 01 79 50 70 a0 80 a0 28 50 18 10
3a 00 09 b1 10 00 00 1a a6 35 70 a0 80 a0 28 50
18 10 3a 00 09 b1 10 00 00 1a 00 00 00 fe 00 42
4f 45 20 44 54 0a 20 20 20 20 20 20 00 00 00 fe
00 54 56 31 32 36 57 54 42 2d 4e 57 30 0a 00 ed

00 ff ff ff ff ff ff 00 09 e5 36 0b 00 00 00 00
11 20 01 04 a5 1b 12 78 03 a6 e5 a6 53 4b 99 27
11 50 57 00 00 00 01 01 01 01 01 01 01 01 01 01
01 01 01 01 01 01 79 50 70 a0 80 a0 28 50 18 10
3a 00 09 b1 10 00 00 1a a6 35 70 a0 80 a0 28 50
18 10 3a 00 09 b1 10 00 00 1a 00 00 00 fe 00 42
4f 45 20 44 54 0a 20 20 20 20 20 20 00 00 00 fe
00 54 56 31 32 36 57 54 42 2d 4e 57 30 0a 00 ed

----------------

Block 0, Base EDID:
  EDID Structure Version & Revision: 1.4
  Vendor & Product Identification:
    Manufacturer: BOE
    Model: 2870
    Made in: week 17 of 2022
  Basic Display Parameters & Features:
    Digital display
    Bits per primary color channel: 8
    DisplayPort interface
    Maximum image size: 27 cm x 18 cm
    Gamma: 2.20
    Supported color formats: RGB 4:4:4
    First detailed timing includes the native pixel format and preferred refresh rate
    Display is continuous frequency
  Color Characteristics:
    Red  : 0.6503, 0.3261
    Green: 0.2939, 0.5996
    Blue : 0.1552, 0.0683
    White: 0.3134, 0.3408
  Established Timings I & II: none
  Standard Timings: none
  Detailed Timing Descriptors:
    DTD 1:  2160x1440   59.998253 Hz   3:2     88.797 kHz    206.010000 MHz (265 mm x 177 mm)
                 Hfront   24 Hsync  16 Hback  120 Hpol P
                 Vfront    3 Vsync  10 Vback   27 Vpol N
    DTD 2:  2160x1440   39.998835 Hz   3:2     59.198 kHz    137.340000 MHz (265 mm x 177 mm)
                 Hfront   24 Hsync  16 Hback  120 Hpol P
                 Vfront    3 Vsync  10 Vback   27 Vpol N
    Alphanumeric Data String: 'BOE DT'
    Alphanumeric Data String: 'TV126WTB-NW0'
Checksum: 0xed

----------------

Block 1, Unknown EDID Extension Block 0x00:
  00 ff ff ff ff ff ff 00 09 e5 36 0b 00 00 00 00 '..........6.....'
  11 20 01 04 a5 1b 12 78 03 a6 e5 a6 53 4b 99 27 '. .....x....SK.''
  11 50 57 00 00 00 01 01 01 01 01 01 01 01 01 01 '.PW.............'
  01 01 01 01 01 01 79 50 70 a0 80 a0 28 50 18 10 '......yPp...(P..'
  3a 00 09 b1 10 00 00 1a a6 35 70 a0 80 a0 28 50 ':........5p...(P'
  18 10 3a 00 09 b1 10 00 00 1a 00 00 00 fe 00 42 '..:............B'
  4f 45 20 44 54 0a 20 20 20 20 20 20 00 00 00 fe 'OE DT.      ....'
  00 54 56 31 32 36 57 54 42 2d 4e 57 30 0a 00 ed '.TV126WTB-NW0...'
Checksum: 0xed

----------------

Warnings:

Block 0, Base EDID:
  Missing Display Product Name.

Failures:

Block 0, Base EDID:
  Missing Display Range Limits Descriptor.
Block 1, Base EDID:
  Unknown Extension Block.
EDID:
  Base EDID: EDID specified 0 extension block(s), but found 1 extension block(s).

EDID conformity: FAIL
