edid-decode (hex):

00 ff ff ff ff ff ff 00 65 09 50 46 af 03 00 00
13 0f 01 03 68 28 1e 78 eb 3c 3c a7 55 48 9b 23
11 48 4b 3f c0 00 45 cf 45 4c 45 40 61 4a 61 4f
45 40 45 4a 45 4f a0 0f 20 00 31 58 1c 20 12 80
c4 00 98 34 11 00 00 1e 00 00 00 fd 00 2e 4c 1e
52 05 00 0a 20 20 20 20 20 20 00 00 00 00 00 34
32 37 38 31 39 30 30 38 33 0a 00 00 00 00 00 fc
00 4c 54 32 30 41 0a 20 20 20 20 20 20 20 00 f7

----------------

Block 0, Base EDID:
  EDID Structure Version & Revision: 1.3
  Vendor & Product Identification:
    Manufacturer: YHI
    Model: 18000
    Serial Number: ...
    Made in: week 19 of 2005
  Basic Display Parameters & Features:
    Analog display
    Input voltage level: 0.7/0.7 V
    Blank level equals black level
    Sync: Separate
    Maximum image size: 40 cm x 30 cm
    Gamma: 2.20
    DPMS levels: Standby Suspend Off
    RGB color display
    First detailed timing is the preferred timing
    Supports GTF timings within operating range
  Color Characteristics:
    Red  : 0.6523, 0.3349
    Green: 0.2841, 0.6054
    Blue : 0.1367, 0.0693
    White: 0.2841, 0.2929
  Established Timings I & II:
    DMT 0x04:   640x480    59.940 Hz   4:3    31.469 kHz  25.175 MHz
    Apple   :   640x480    66.667 Hz   4:3    35.000 kHz  30.240 MHz
    DMT 0x05:   640x480    72.809 Hz   4:3    37.861 kHz  31.500 MHz
    DMT 0x06:   640x480    75.000 Hz   4:3    37.500 kHz  31.500 MHz
    DMT 0x08:   800x600    56.250 Hz   4:3    35.156 kHz  36.000 MHz
    DMT 0x09:   800x600    60.317 Hz   4:3    37.879 kHz  40.000 MHz
    DMT 0x0a:   800x600    72.188 Hz   4:3    48.077 kHz  50.000 MHz
    DMT 0x0b:   800x600    75.000 Hz   4:3    46.875 kHz  49.500 MHz
  Standard Timings:
    GTF     :   800x456    75.001 Hz  16:9    35.775 kHz  36.634 MHz
    DMT 0x0a:   800x600    72.188 Hz   4:3    48.077 kHz  50.000 MHz
    DMT 0x09:   800x600    60.317 Hz   4:3    37.879 kHz  40.000 MHz
    GTF     :  1024x768    70.000 Hz   4:3    56.000 kHz  76.160 MHz
    DMT 0x12:  1024x768    75.029 Hz   4:3    60.023 kHz  78.750 MHz
    DMT 0x09:   800x600    60.317 Hz   4:3    37.879 kHz  40.000 MHz
    GTF     :   800x600    70.000 Hz   4:3    43.750 kHz  45.500 MHz
    DMT 0x0b:   800x600    75.000 Hz   4:3    46.875 kHz  49.500 MHz
  Detailed Timing Descriptors:
    DTD 1:   800x600    60.317 Hz   4:3    37.879 kHz  40.000 MHz (408 mm x 308 mm)
                 Hfront   18 Hsync 128 Hback 110 Hpol P
                 Vfront   12 Vsync   4 Vback  12 Vpol P
  Display Range Limits:
    Monitor ranges (GTF): 46-76 Hz V, 30-82 kHz H, max dotclock 50 MHz
    Manufacturer-Specified Display Descriptor (0x00): 00 00 00 34 32 37 38 31 39 30 30 38 33 0a 00 00 '...4278190083...'
    Display Product Name: 'LT20A'
Checksum: 0xf7

----------------

Failures:

EDID:
  Base EDID: Some timings are out of range of the Monitor Ranges:
    Maximum Clock: 78.750 MHz (Monitor: 50.000 MHz)

EDID conformity: FAIL
