
EDID (hex):
00ffffffffffff0004720d002e615083
23120103802f1e78e2de95a3544c9926
0f5054bfef90a940714f81408bc09500
950f9040010121399030621a274068b0
3600da2811000019000000fd00384d1f
5411000a202020202020000000ff004c
41563043303135343030320a000000fc
0058323233570a20202020202020016c
02031c7147021113841f100323097f07
8301000067030c0010000028662150b0
51001b30407036000f484200001e6621
56aa51001e30468f33000f484200001e
8c0ad08a20e02d10103e960010090000
00180000000000000000000000000000
00000000000000000000000000000000
00000000000000000000000000000080

Extracted contents:
header:          00 ff ff ff ff ff ff 00
serial number:   04 72 0d 00 2e 61 50 83 23 12
version:         01 03
basic params:    80 2f 1e 78 e2
chroma info:     de 95 a3 54 4c 99 26 0f 50 54
established:     bf ef 90
standard:        a9 40 71 4f 81 40 8b c0 95 00 95 0f 90 40 01 01
descriptor 1:    21 39 90 30 62 1a 27 40 68 b0 36 00 da 28 11 00 00 19
descriptor 2:    00 00 00 fd 00 38 4d 1f 54 11 00 0a 20 20 20 20 20 20
descriptor 3:    00 00 00 ff 00 4c 41 56 30 43 30 31 35 34 30 30 32 0a
descriptor 4:    00 00 00 fc 00 58 32 32 33 57 0a 20 20 20 20 20 20 20
extensions:      01
checksum:        6c

EDID version: 1.3
Manufacturer: ACR Model d Serial Number --
Made in week 35 of 2008
Digital display
Maximum image size: 47 cm x 30 cm
Gamma: 2.20
DPMS levels: Standby Suspend Off
Monochrome or grayscale display
First detailed timing is preferred timing
Display x,y Chromaticity:
  Red:   0.6396, 0.3291
  Green: 0.2998, 0.5996
  Blue:  0.1503, 0.0595
  White: 0.3134, 0.3291
Established timings supported:
  720x400@70Hz 9:5 HorFreq: 31469 Hz Clock: 28.320 MHz
  640x480@60Hz 4:3 HorFreq: 31469 Hz Clock: 25.175 MHz
  640x480@67Hz 4:3 HorFreq: 35000 Hz Clock: 30.240 MHz
  640x480@72Hz 4:3 HorFreq: 37900 Hz Clock: 31.500 MHz
  640x480@75Hz 4:3 HorFreq: 37500 Hz Clock: 31.500 MHz
  800x600@56Hz 4:3 HorFreq: 35200 Hz Clock: 36.000 MHz
  800x600@60Hz 4:3 HorFreq: 37900 Hz Clock: 40.000 MHz
  800x600@72Hz 4:3 HorFreq: 48100 Hz Clock: 50.000 MHz
  800x600@75Hz 4:3 HorFreq: 46900 Hz Clock: 49.500 MHz
  832x624@75Hz 4:3 HorFreq: 49726 Hz Clock: 57.284 MHz
  1024x768@60Hz 4:3 HorFreq: 48400 Hz Clock: 65.000 MHz
  1024x768@70Hz 4:3 HorFreq: 56500 Hz Clock: 75.000 MHz
  1024x768@75Hz 4:3 HorFreq: 60000 Hz Clock: 78.750 MHz
  1280x1024@75Hz 5:4 HorFreq: 80000 Hz Clock: 135.000 MHz
  1152x870@75Hz 192:145 HorFreq: 67500 Hz Clock: 108.000 MHz
Standard timings supported:
  1600x1200@60Hz 4:3 HorFreq: 75000 Hz Clock: 162.000 MHz
  1152x864@75Hz 4:3 HorFreq: 67500 Hz Clock: 108.000 MHz
  1280x960@60Hz 4:3 HorFreq: 60000 Hz Clock: 108.000 MHz
  1360x765@60Hz 16:9
  1440x900@60Hz 16:10 HorFreq: 55500 Hz Clock: 88.750 MHz
  1440x900@75Hz 16:10 HorFreq: 82300 Hz Clock: 156.000 MHz
  1400x1050@60Hz 4:3 HorFreq: 64700 Hz Clock: 101.000 MHz
Detailed mode: Clock 146.250 MHz, 474 mm x 296 mm
               1680 1784 1960 2240 hborder 0
               1050 1053 1059 1089 vborder 0
               -hsync -vsync 
               VertFreq: 59 Hz, HorFreq: 65290 Hz
Monitor ranges (GTF): 56-77Hz V, 31-84kHz H, max dotclock 170MHz
Serial number: --
Monitor name: X223W
Has 1 extension blocks
Checksum: 0x6c (valid)

CTA extension block
Extension version: 3
24 bytes of CTA data
  Video data block
    VIC   2 720x480@60Hz 4:3  HorFreq: 31469 Hz Clock: 27.000 MHz
    VIC  17 720x576@50Hz 4:3  HorFreq: 31250 Hz Clock: 27.000 MHz
    VIC  19 1280x720@50Hz 16:9  HorFreq: 37500 Hz Clock: 74.250 MHz
    VIC   4 1280x720@60Hz 16:9 (native) HorFreq: 45000 Hz Clock: 74.250 MHz
    VIC  31 1920x1080@50Hz 16:9  HorFreq: 56250 Hz Clock: 148.500 MHz
    VIC  16 1920x1080@60Hz 16:9  HorFreq: 67500 Hz Clock: 148.500 MHz
    VIC   3 720x480@60Hz 16:9  HorFreq: 31469 Hz Clock: 27.000 MHz
  Audio data block
    Linear PCM, max channels 2
      Supported sample rates (kHz): 192 176.4 96 88.2 48 44.1 32
      Supported sample sizes (bits): 24 20 16
  Speaker allocation data block
    Speaker map:
      FL/FR - Front Left/Right
  Vendor-specific data block, OUI 000c03 (HDMI)
    Source physical address 1.0.0.0
    Maximum TMDS clock: 200MHz
Basic audio support
Supports YCbCr 4:4:4
Supports YCbCr 4:2:2
1 native detailed modes
Detailed mode: Clock 85.500 MHz, 1039 mm x 584 mm
               1360 1424 1536 1792 hborder 0
                768  771  777  795 vborder 0
               +hsync +vsync 
               VertFreq: 60 Hz, HorFreq: 47712 Hz
Detailed mode: Clock 85.500 MHz, 1039 mm x 584 mm
               1366 1436 1579 1792 hborder 0
                768  771  774  798 vborder 0
               +hsync +vsync 
               VertFreq: 59 Hz, HorFreq: 47712 Hz
Detailed mode: Clock 27.000 MHz, 16 mm x 9 mm
                720  736  798  858 hborder 0
                480  489  495  525 vborder 0
               -hsync -vsync 
               VertFreq: 59 Hz, HorFreq: 31468 Hz
Checksum: 0x80 (valid)

One or more of the timings is out of range of the Monitor Ranges:
  Vertical Freq: 50 - 75 Hz
  Horizontal Freq: 31250 - 82300 Hz
  Maximum Clock: 162.000 MHz
EDID block does not conform at all!
	Both the serial number and the serial string are set
