
EDID (hex):
00ffffffffffff004c2dc10c304e4c47
27190104a5342078227c41a9544b9f25
0d505423080081c0810081809500a9c0
b300d1c00101283c80a070b023403020
360006442100001a000000fd00323c1e
5111000a202020202020000000fc0053
3234453635300a2020202020000000ff
0048544c473930303134340a2020017a
020306814190023a801871382d40582c
450006442100001e0000000000000000
00000000000000000000000000000000
00000000000000000000000000000000
00000000000000000000000000000000
00000000000000000000000000000000
00000000000000000000000000000000
00000000000000000000000000000067

Extracted contents:
header:          00 ff ff ff ff ff ff 00
serial number:   4c 2d c1 0c 30 4e 4c 47 27 19
version:         01 04
basic params:    a5 34 20 78 22
chroma info:     7c 41 a9 54 4b 9f 25 0d 50 54
established:     23 08 00
standard:        81 c0 81 00 81 80 95 00 a9 c0 b3 00 d1 c0 01 01
descriptor 1:    28 3c 80 a0 70 b0 23 40 30 20 36 00 06 44 21 00 00 1a
descriptor 2:    00 00 00 fd 00 32 3c 1e 51 11 00 0a 20 20 20 20 20 20
descriptor 3:    00 00 00 fc 00 53 32 34 45 36 35 30 0a 20 20 20 20 20
descriptor 4:    00 00 00 ff 00 48 54 4c 47 39 30 30 31 34 34 0a 20 20
extensions:      01
checksum:        7a

EDID version: 1.4
Manufacturer: SAM Model cc1 Serial Number --
Made in week 39 of 2015
Digital display
8 bits per primary color channel
DisplayPort interface
Maximum image size: 52 cm x 32 cm
Gamma: 2.20
DPMS levels: Off
Supported color formats: RGB 4:4:4
First detailed timing includes the native pixel format and preferred refresh rate
Display x,y Chromaticity:
  Red:   0.6611, 0.3310
  Green: 0.2958, 0.6210
  Blue:  0.1455, 0.0507
  White: 0.3125, 0.3291
Established timings supported:
  640x480@60Hz 4:3 HorFreq: 31469 Hz Clock: 25.175 MHz
  800x600@56Hz 4:3 HorFreq: 35200 Hz Clock: 36.000 MHz
  800x600@60Hz 4:3 HorFreq: 37900 Hz Clock: 40.000 MHz
  1024x768@60Hz 4:3 HorFreq: 48400 Hz Clock: 65.000 MHz
Standard timings supported:
  1280x720@60Hz 16:9
  1280x800@60Hz 16:10
  1280x1024@60Hz 5:4 HorFreq: 64000 Hz Clock: 108.000 MHz
  1440x900@60Hz 16:10 HorFreq: 55500 Hz Clock: 88.750 MHz
  1600x900@60Hz 16:9
  1680x1050@60Hz 16:10 HorFreq: 64700 Hz Clock: 119.000 MHz
  1920x1080@60Hz 16:9
Detailed mode: Clock 154.000 MHz, 518 mm x 324 mm
               1920 1968 2000 2080 hborder 0
               1200 1203 1209 1235 vborder 0
               +hsync -vsync 
               VertFreq: 59 Hz, HorFreq: 74038 Hz
Monitor ranges (GTF): 50-60Hz V, 30-81kHz H, max dotclock 170MHz
Monitor name: S24E650
Serial number: --
Has 1 extension blocks
Checksum: 0x7a (valid)

CTA extension block
Extension version: 3
2 bytes of CTA data
  Video data block
    VIC  16 1920x1080@60Hz 16:9 (native) HorFreq: 67500 Hz Clock: 148.500 MHz
Underscans PC formats by default
1 native detailed modes
Detailed mode: Clock 148.500 MHz, 518 mm x 324 mm
               1920 2008 2052 2200 hborder 0
               1080 1084 1089 1125 vborder 0
               +hsync +vsync 
               VertFreq: 60 Hz, HorFreq: 67500 Hz
Checksum: 0x67 (valid)

EDID block does not conform at all!
	Both the serial number and the serial string are set


