edid-decode (hex):

00 ff ff ff ff ff ff 00 4a 8b b0 40 01 00 00 00
25 16 01 03 81 28 17 78 ea 64 b5 ab 52 38 ab 25
13 50 54 00 00 00 01 01 01 01 01 01 01 01 01 01
01 01 01 01 01 01 74 1d 56 c2 50 00 26 30 18 18
13 00 99 e6 10 00 00 1e 00 00 00 10 00 00 00 00
00 00 00 00 00 00 00 00 00 00 00 00 00 10 00 4c
61 74 69 74 75 64 65 20 32 30 0a 20 00 00 00 10
00 38 4c 1e 53 10 0a 0a 0a 0a 0a 0a 0a 0a 00 4e

----------------

Block 0, Base EDID:
  EDID Structure Version & Revision: 1.3
  Vendor & Product Identification:
    Manufacturer: RTK
    Model: 16560
    Serial Number: ...
    Made in: week 37 of 2012
  Basic Display Parameters & Features:
    Digital display
    DFP 1.x compatible TMDS
    Maximum image size: 40 cm x 23 cm
    Gamma: 2.20
    DPMS levels: Standby Suspend Off
    RGB color display
    First detailed timing is preferred timing
  Color Characteristics:
    Red  : 0.6689, 0.3222
    Green: 0.2197, 0.6679
    Blue : 0.1464, 0.0771
    White: 0.3134, 0.3291
  Established Timings I & II: none
  Standard Timings: none
  Detailed Timing Descriptors:
    DTD 1:  1366x768    59.967 Hz 683:384  48.333 kHz  75.400 MHz (409 mm x 230 mm)
                 Hfront   24 Hsync  24 Hback 146 Hpol P
                 Vfront    1 Vsync   3 Vback  34 Vpol P
    Dummy Descriptor:
    Dummy Descriptor:
    Dummy Descriptor:
Checksum: 0x4e
