
EDID (hex):
00ffffffffffff000dae181100000000
08180103801a0e780a14359255539529
24505400000001010101010101010101
010101010101da1d56e250002030881e
8c00009010000018000000fe004e3131
364247452d4c33320a20000000fe0043
4d4e0a202020202020202020000000fe
004e3131364247452d4c33320a200088

Extracted contents:
header:          00 ff ff ff ff ff ff 00
serial number:   0d ae 18 11 00 00 00 00 08 18
version:         01 03
basic params:    80 1a 0e 78 0a
chroma info:     14 35 92 55 53 95 29 24 50 54
established:     00 00 00
standard:        01 01 01 01 01 01 01 01 01 01 01 01 01 01 01 01
descriptor 1:    da 1d 56 e2 50 00 20 30 88 1e 8c 00 00 90 10 00 00 18
descriptor 2:    00 00 00 fe 00 4e 31 31 36 42 47 45 2d 4c 33 32 0a 20
descriptor 3:    00 00 00 fe 00 43 4d 4e 0a 20 20 20 20 20 20 20 20 20
descriptor 4:    00 00 00 fe 00 4e 31 31 36 42 47 45 2d 4c 33 32 0a 20
extensions:      00
checksum:        88

EDID version: 1.3
Manufacturer: CMN Model 1118 Serial Number --
Made in week 8 of 2014
Digital display
Maximum image size: 26 cm x 14 cm
Gamma: 2.20
RGB color display
First detailed timing is preferred timing
Display x,y Chromaticity:
  Red:   0.5703, 0.3330
  Green: 0.3251, 0.5820
  Blue:  0.1601, 0.1435
  White: 0.3134, 0.3291
Established timings supported:
Standard timings supported:
Detailed mode: Clock 76.420 MHz, 256 mm x 144 mm
               1366 1502 1532 1592 hborder 0
                768  776  788  800 vborder 0
               -hsync -vsync 
               VertFreq: 60 Hz, HorFreq: 48002 Hz
ASCII string: N116BGE-L32
ASCII string: CMN
ASCII string: N116BGE-L32
Checksum: 0x88 (valid)
EDID block does NOT conform to EDID 1.3!
	Missing name descriptor
	Missing monitor ranges
