
EDID (hex):
00ffffffffffff000dae181100000000
0f170104901a0e780269659657528f27
22505400000001010101010101010101
010101010101bc1b568650001430291b
340000901000001a3016568650001430
291b340000901000001a000000fe0039
4754504a803131364247450a00000000
00004131940010000001010a2020000d

Extracted contents:
header:          00 ff ff ff ff ff ff 00
serial number:   0d ae 18 11 00 00 00 00 0f 17
version:         01 04
basic params:    90 1a 0e 78 02
chroma info:     69 65 96 57 52 8f 27 22 50 54
established:     00 00 00
standard:        01 01 01 01 01 01 01 01 01 01 01 01 01 01 01 01
descriptor 1:    bc 1b 56 86 50 00 14 30 29 1b 34 00 00 90 10 00 00 1a
descriptor 2:    30 16 56 86 50 00 14 30 29 1b 34 00 00 90 10 00 00 1a
descriptor 3:    00 00 00 fe 00 39 47 54 50 4a 80 31 31 36 42 47 45 0a
descriptor 4:    00 00 00 00 00 00 41 31 94 00 10 00 00 01 01 0a 20 20
extensions:      00
checksum:        0d

EDID version: 1.4
Manufacturer: CMN Model 1118 Serial Number --
Made in week 15 of 2013
Digital display
6 bits per primary color channel
Digital interface is not defined
Maximum image size: 26 cm x 14 cm
Gamma: 2.20
Supported color formats: RGB 4:4:4
First detailed timing includes the native pixel format and preferred refresh rate
Display x,y Chromaticity:
  Red:   0.5869, 0.3417
  Green: 0.3222, 0.5595
  Blue:  0.1533, 0.1347
  White: 0.3134, 0.3291
Established timings supported:
Standard timings supported:
Detailed mode: Clock 71.000 MHz, 256 mm x 144 mm
               1366 1407 1434 1500 hborder 0
                768  771  775  788 vborder 0
               +hsync -vsync 
               VertFreq: 60 Hz, HorFreq: 47333 Hz
Detailed mode: Clock 56.800 MHz, 256 mm x 144 mm
               1366 1407 1434 1500 hborder 0
                768  771  775  788 vborder 0
               +hsync -vsync 
               VertFreq: 48 Hz, HorFreq: 37866 Hz
ASCII string: 9GTPJ
Manufacturer-specified data, tag 0
Checksum: 0xd (valid)
EDID block does NOT conform to EDID 1.4!
	Missing name descriptor
	Missing monitor ranges
	Detailed block string not properly terminated


