
EDID (hex):
00ffffffffffff001e6d010001010101
01140103687341780acf74a3574cb023
09484ca1080081c06140454031400101
010101010101662150b051001b304070
36007e8a4200001e011d007251d01e20
6e2855007e8a4200001e000000fd003a
3e1f4610000a202020202020000000fc
004c472054560a202020202020200093

Extracted contents:
header:          00 ff ff ff ff ff ff 00
serial number:   1e 6d 01 00 01 01 01 01 01 14
version:         01 03
basic params:    68 73 41 78 0a
chroma info:     cf 74 a3 57 4c b0 23 09 48 4c
established:     a1 08 00
standard:        81 c0 61 40 45 40 31 40 01 01 01 01 01 01 01 01
descriptor 1:    66 21 50 b0 51 00 1b 30 40 70 36 00 7e 8a 42 00 00 1e
descriptor 2:    01 1d 00 72 51 d0 1e 20 6e 28 55 00 7e 8a 42 00 00 1e
descriptor 3:    00 00 00 fd 00 3a 3e 1f 46 10 00 0a 20 20 20 20 20 20
descriptor 4:    00 00 00 fc 00 4c 47 20 54 56 0a 20 20 20 20 20 20 20
extensions:      00
checksum:        93

EDID version: 1.3
Manufacturer: GSM Model 1 Serial Number --
Made in week 1 of 2010
Analog display, Input voltage level: 0.7/0.7 V
Sync: Separate 
Maximum image size: 115 cm x 65 cm
Gamma: 2.20
RGB color display
First detailed timing is preferred timing
Display x,y Chromaticity:
  Red:   0.6396, 0.3398
  Green: 0.2998, 0.6904
  Blue:  0.1376, 0.0380
  White: 0.2822, 0.2968
Established timings supported:
  720x400@70Hz 9:5 HorFreq: 31469 Hz Clock: 28.320 MHz
  640x480@60Hz 4:3 HorFreq: 31469 Hz Clock: 25.175 MHz
  800x600@60Hz 4:3 HorFreq: 37900 Hz Clock: 40.000 MHz
  1024x768@60Hz 4:3 HorFreq: 48400 Hz Clock: 65.000 MHz
Standard timings supported:
  1280x720@60Hz 16:9
  1024x768@60Hz 4:3 HorFreq: 48400 Hz Clock: 65.000 MHz
  800x600@60Hz 4:3 HorFreq: 37900 Hz Clock: 40.000 MHz
  640x480@60Hz 4:3 HorFreq: 31469 Hz Clock: 25.175 MHz
Detailed mode: Clock 85.500 MHz, 1150 mm x 650 mm
               1360 1424 1536 1792 hborder 0
                768  771  777  795 vborder 0
               +hsync +vsync 
               VertFreq: 60 Hz, HorFreq: 47712 Hz
Detailed mode: Clock 74.250 MHz, 1150 mm x 650 mm
               1280 1390 1430 1650 hborder 0
                720  725  730  750 vborder 0
               +hsync +vsync 
               VertFreq: 60 Hz, HorFreq: 45000 Hz
Monitor ranges (GTF): 58-62Hz V, 31-70kHz H, max dotclock 160MHz
Monitor name: LG TV
Checksum: 0x93 (valid)
One or more of the timings is out of range of the Monitor Ranges:
  Vertical Freq: 60 - 70 Hz
  Horizontal Freq: 31469 - 48400 Hz
  Maximum Clock: 85.500 MHz
