
EDID (hex):
00ffffffffffff001e6d010001010101
00130103187341960acf74a3574cb023
09484cafcf003140454061408180a940
010101010101023a801871382d40582c
4500c48e2100001e662150b051001b30
40703600c48e2100001e000000fd0030
4b1f6411000a202020202020000000fc
004c472054560a2020202020202001fd
020304000e1f008051001e3040803700
c48e2100001cf12700a0510025305080
3700c48e2100001c0000000000000000
00000000000000000000000000000000
00000000000000000000000000000000
00000000000000000000000000000000
00000000000000000000000000000000
00000000000000000000000000000031

Extracted contents:
header:          00 ff ff ff ff ff ff 00
serial number:   1e 6d 01 00 01 01 01 01 00 13
version:         01 03
basic params:    18 73 41 96 0a
chroma info:     cf 74 a3 57 4c b0 23 09 48 4c
established:     af cf 00
standard:        31 40 45 40 61 40 81 80 a9 40 01 01 01 01 01 01
descriptor 1:    02 3a 80 18 71 38 2d 40 58 2c 45 00 c4 8e 21 00 00 1e
descriptor 2:    66 21 50 b0 51 00 1b 30 40 70 36 00 c4 8e 21 00 00 1e
descriptor 3:    00 00 00 fd 00 30 4b 1f 64 11 00 0a 20 20 20 20 20 20
descriptor 4:    00 00 00 fc 00 4c 47 20 54 56 0a 20 20 20 20 20 20 20
extensions:      01
checksum:        fd

EDID version: 1.3
Manufacturer: GSM Model 1 Serial Number --
Made in year 2009
Analog display, Input voltage level: 0.7/0.3 V
Configurable signal levels
Sync: Separate 
Maximum image size: 115 cm x 65 cm
Gamma: 2.50
RGB color display
First detailed timing is preferred timing
Display x,y Chromaticity:
  Red:   0.6396, 0.3398
  Green: 0.2998, 0.6904
  Blue:  0.1376, 0.0380
  White: 0.2822, 0.2968
Established timings supported:
  720x400@70Hz 9:5 HorFreq: 31469 Hz Clock: 28.320 MHz
  640x480@60Hz 4:3 HorFreq: 31469 Hz Clock: 25.175 MHz
  640x480@72Hz 4:3 HorFreq: 37900 Hz Clock: 31.500 MHz
  640x480@75Hz 4:3 HorFreq: 37500 Hz Clock: 31.500 MHz
  800x600@56Hz 4:3 HorFreq: 35200 Hz Clock: 36.000 MHz
  800x600@60Hz 4:3 HorFreq: 37900 Hz Clock: 40.000 MHz
  800x600@72Hz 4:3 HorFreq: 48100 Hz Clock: 50.000 MHz
  800x600@75Hz 4:3 HorFreq: 46900 Hz Clock: 49.500 MHz
  1024x768@60Hz 4:3 HorFreq: 48400 Hz Clock: 65.000 MHz
  1024x768@70Hz 4:3 HorFreq: 56500 Hz Clock: 75.000 MHz
  1024x768@75Hz 4:3 HorFreq: 60000 Hz Clock: 78.750 MHz
  1280x1024@75Hz 5:4 HorFreq: 80000 Hz Clock: 135.000 MHz
Standard timings supported:
  640x480@60Hz 4:3 HorFreq: 31469 Hz Clock: 25.175 MHz
  800x600@60Hz 4:3 HorFreq: 37900 Hz Clock: 40.000 MHz
  1024x768@60Hz 4:3 HorFreq: 48400 Hz Clock: 65.000 MHz
  1280x1024@60Hz 5:4 HorFreq: 64000 Hz Clock: 108.000 MHz
  1600x1200@60Hz 4:3 HorFreq: 75000 Hz Clock: 162.000 MHz
Detailed mode: Clock 148.500 MHz, 708 mm x 398 mm
               1920 2008 2052 2200 hborder 0
               1080 1084 1089 1125 vborder 0
               +hsync +vsync 
               VertFreq: 60 Hz, HorFreq: 67500 Hz
Detailed mode: Clock 85.500 MHz, 708 mm x 398 mm
               1360 1424 1536 1792 hborder 0
                768  771  777  795 vborder 0
               +hsync +vsync 
               VertFreq: 60 Hz, HorFreq: 47712 Hz
Monitor ranges (GTF): 48-75Hz V, 31-100kHz H, max dotclock 170MHz
Monitor name: LG TV
Has 1 extension blocks
Checksum: 0xfd (valid)

CTA extension block
Extension version: 3
0 bytes of CTA data
0 native detailed modes
Detailed mode: Clock 79.500 MHz, 708 mm x 398 mm
               1280 1344 1472 1664 hborder 0
                768  771  778  798 vborder 0
               -hsync +vsync 
               VertFreq: 59 Hz, HorFreq: 47776 Hz
Detailed mode: Clock 102.250 MHz, 708 mm x 398 mm
               1280 1360 1488 1696 hborder 0
                768  771  778  805 vborder 0
               -hsync +vsync 
               VertFreq: 74 Hz, HorFreq: 60288 Hz
Checksum: 0x31 (valid)
