
EDID (hex):
00ffffffffffff001e6d010001010101
0116010368a05a780aee91a3544c9926
0f5054a1080031404540614001010101
01010101010164190040410026301888
3600b08443000018a00f200031581c20
28801400b0844300001e000000fd003a
3e1e5310000a202020202020000000fc
004c472054560a202020202020200058

Extracted contents:
header:          00 ff ff ff ff ff ff 00
serial number:   1e 6d 01 00 01 01 01 01 01 16
version:         01 03
basic params:    68 a0 5a 78 0a
chroma info:     ee 91 a3 54 4c 99 26 0f 50 54
established:     a1 08 00
standard:        31 40 45 40 61 40 01 01 01 01 01 01 01 01 01 01
descriptor 1:    64 19 00 40 41 00 26 30 18 88 36 00 b0 84 43 00 00 18
descriptor 2:    a0 0f 20 00 31 58 1c 20 28 80 14 00 b0 84 43 00 00 1e
descriptor 3:    00 00 00 fd 00 3a 3e 1e 53 10 00 0a 20 20 20 20 20 20
descriptor 4:    00 00 00 fc 00 4c 47 20 54 56 0a 20 20 20 20 20 20 20
extensions:      00
checksum:        58

EDID version: 1.3
Manufacturer: GSM Model 1 Serial Number --
Made in week 1 of 2012
Analog display, Input voltage level: 0.7/0.7 V
Sync: Separate 
Maximum image size: 160 cm x 90 cm
Gamma: 2.20
RGB color display
First detailed timing is preferred timing
Display x,y Chromaticity:
  Red:   0.6396, 0.3300
  Green: 0.2998, 0.5996
  Blue:  0.1503, 0.0595
  White: 0.3125, 0.3291
Established timings supported:
  720x400@70Hz 9:5 HorFreq: 31469 Hz Clock: 28.320 MHz
  640x480@60Hz 4:3 HorFreq: 31469 Hz Clock: 25.175 MHz
  800x600@60Hz 4:3 HorFreq: 37900 Hz Clock: 40.000 MHz
  1024x768@60Hz 4:3 HorFreq: 48400 Hz Clock: 65.000 MHz
Standard timings supported:
  640x480@60Hz 4:3 HorFreq: 31469 Hz Clock: 25.175 MHz
  800x600@60Hz 4:3 HorFreq: 37900 Hz Clock: 40.000 MHz
  1024x768@60Hz 4:3 HorFreq: 48400 Hz Clock: 65.000 MHz
Detailed mode: Clock 65.000 MHz, 1200 mm x 900 mm
               1024 1048 1184 1344 hborder 0
                768  771  777  806 vborder 0
               -hsync -vsync 
               VertFreq: 60 Hz, HorFreq: 48363 Hz
Detailed mode: Clock 40.000 MHz, 1200 mm x 900 mm
                800  840  968 1056 hborder 0
                600  601  605  628 vborder 0
               +hsync +vsync 
               VertFreq: 60 Hz, HorFreq: 37878 Hz
Monitor ranges (GTF): 58-62Hz V, 30-83kHz H, max dotclock 160MHz
Monitor name: LG TV
Checksum: 0x58 (valid)
One or more of the timings is out of range of the Monitor Ranges:
  Vertical Freq: 60 - 70 Hz
  Horizontal Freq: 31469 - 48400 Hz
  Maximum Clock: 65.000 MHz
