edid-decode (hex):

00 ff ff ff ff ff ff 00 10 ac c9 40 01 00 00 00
2e 18 01 04 a5 35 1e 78 e2 64 b5 ab 52 38 ab 25
13 50 54 00 00 00 01 01 01 01 01 01 01 01 01 01
01 01 01 01 01 01 a0 39 80 00 71 38 32 40 30 20
84 00 0f 28 21 00 00 1e 00 00 00 10 00 49 6e 73
70 69 72 6f 6e 20 33 34 35 35 00 00 00 fc 00 49
6e 73 70 69 72 6f 6e 20 33 34 35 35 00 00 00 00
00 03 41 02 99 00 00 00 00 02 01 0a 20 20 00 42

----------------

Block 0, Base EDID:
  EDID Structure Version & Revision: 1.4
  Vendor & Product Identification:
    Manufacturer: DEL
    Model: 16585
    Serial Number: ...
    Made in: week 46 of 2014
  Basic Display Parameters & Features:
    Digital display
    Bits per primary color channel: 8
    DisplayPort interface
    Maximum image size: 53 cm x 30 cm
    Gamma: 2.20
    DPMS levels: Standby Suspend Off
    Supported color formats: RGB 4:4:4
    First detailed timing includes the native pixel format and preferred refresh rate
  Color Characteristics:
    Red  : 0.6689, 0.3222
    Green: 0.2197, 0.6679
    Blue : 0.1464, 0.0771
    White: 0.3134, 0.3291
  Established Timings I & II: none
  Standard Timings: none
  Detailed Timing Descriptors:
    DTD 1:  1920x1080   59.994794 Hz  16:9     67.794 kHz    147.520000 MHz (527 mm x 296 mm)
                 Hfront   48 Hsync  32 Hback  176 Hpol P
                 Vfront    8 Vsync   4 Vback   38 Vpol P
    Dummy Descriptor:
    Display Product Name: 'Inspiron 3455'
    Manufacturer-Specified Display Descriptor (0x00): 00 00 00 03 41 02 99 00 00 00 00 02 01 0a 20 20 '....A.........  '
Checksum: 0x42

----------------

Failures:

Block 0, Base EDID:
  Dummy Descriptor: Dummy block filled with garbage.

EDID conformity: FAIL
