
EDID (hex):
00ffffffffffff000472ca09a2005020
05200104b54627782bebc5ad4f45af27
0c5054afef80d1c0b30095008180714f
81c08140a9c06a5e00a0a0a029503020
3500b9882100001a000000fd0030a5fc
fc51010a202020202020000000fc0058
5a333232515520530a202020000000ff
003132303530303041323347303001ad
02032ae1440104103f23090707830100
00e305c301e606070165653e6d1a0000
020130a50000000000006fc200a0a0a0
555030203500b9882100001e98e200a0
a0a0295030203500b9882100001a8a6f
80a07038404030203500b9882100007f
21fa0050a0a01e501c203500b9882100
007f00000000000000000000000000f2

edid-decode (hex):

00 ff ff ff ff ff ff 00 04 72 ca 09 a2 00 50 20
05 20 01 04 b5 46 27 78 2b eb c5 ad 4f 45 af 27
0c 50 54 af ef 80 d1 c0 b3 00 95 00 81 80 71 4f
81 c0 81 40 a9 c0 6a 5e 00 a0 a0 a0 29 50 30 20
35 00 b9 88 21 00 00 1a 00 00 00 fd 00 30 a5 fc
fc 51 01 0a 20 20 20 20 20 20 00 00 00 fc 00 58
5a 33 32 32 51 55 20 53 0a 20 20 20 00 00 00 ff
00 31 32 30 35 30 30 30 41 32 33 47 30 30 01 ad

02 03 2a e1 44 01 04 10 3f 23 09 07 07 83 01 00
00 e3 05 c3 01 e6 06 07 01 65 65 3e 6d 1a 00 00
02 01 30 a5 00 00 00 00 00 00 6f c2 00 a0 a0 a0
55 50 30 20 35 00 b9 88 21 00 00 1e 98 e2 00 a0
a0 a0 29 50 30 20 35 00 b9 88 21 00 00 1a 8a 6f
80 a0 70 38 40 40 30 20 35 00 b9 88 21 00 00 7f
21 fa 00 50 a0 a0 1e 50 1c 20 35 00 b9 88 21 00
00 7f 00 00 00 00 00 00 00 00 00 00 00 00 00 f2

----------------

Block 0, Base EDID:
  EDID Structure Version & Revision: 1.4
  Vendor & Product Identification:
    Manufacturer: ACR
    Model: 2506
    Serial Number: 542113954
    Made in: week 5 of 2022
  Basic Display Parameters & Features:
    Digital display
    Bits per primary color channel: 10
    DisplayPort interface
    Maximum image size: 70 cm x 39 cm
    Gamma: 2.20
    DPMS levels: Off
    Supported color formats: RGB 4:4:4, YCrCb 4:4:4
    First detailed timing includes the native pixel format and preferred refresh rate
    Display is continuous frequency
  Color Characteristics:
    Red  : 0.6787, 0.3105
    Green: 0.2714, 0.6865
    Blue : 0.1552, 0.0468
    White: 0.3134, 0.3291
  Established Timings I & II:
    IBM     :   720x400    70.081663 Hz   9:5     31.467 kHz     28.320000 MHz
    DMT 0x04:   640x480    59.940476 Hz   4:3     31.469 kHz     25.175000 MHz
    DMT 0x05:   640x480    72.808802 Hz   4:3     37.861 kHz     31.500000 MHz
    DMT 0x06:   640x480    75.000000 Hz   4:3     37.500 kHz     31.500000 MHz
    DMT 0x08:   800x600    56.250000 Hz   4:3     35.156 kHz     36.000000 MHz
    DMT 0x09:   800x600    60.316541 Hz   4:3     37.879 kHz     40.000000 MHz
    DMT 0x0a:   800x600    72.187572 Hz   4:3     48.077 kHz     50.000000 MHz
    DMT 0x0b:   800x600    75.000000 Hz   4:3     46.875 kHz     49.500000 MHz
    Apple   :   832x624    74.551266 Hz   4:3     49.726 kHz     57.284000 MHz
    DMT 0x10:  1024x768    60.003840 Hz   4:3     48.363 kHz     65.000000 MHz
    DMT 0x11:  1024x768    70.069359 Hz   4:3     56.476 kHz     75.000000 MHz
    DMT 0x12:  1024x768    75.028582 Hz   4:3     60.023 kHz     78.750000 MHz
    DMT 0x24:  1280x1024   75.024675 Hz   5:4     79.976 kHz    135.000000 MHz
    Apple   :  1152x870    75.061550 Hz 192:145   68.681 kHz    100.000000 MHz
  Standard Timings:
    DMT 0x52:  1920x1080   60.000000 Hz  16:9     67.500 kHz    148.500000 MHz
    DMT 0x3a:  1680x1050   59.954250 Hz  16:10    65.290 kHz    146.250000 MHz
    DMT 0x2f:  1440x900    59.887445 Hz  16:10    55.935 kHz    106.500000 MHz
    DMT 0x23:  1280x1024   60.019740 Hz   5:4     63.981 kHz    108.000000 MHz
    DMT 0x15:  1152x864    75.000000 Hz   4:3     67.500 kHz    108.000000 MHz
    DMT 0x55:  1280x720    60.000000 Hz  16:9     45.000 kHz     74.250000 MHz
    DMT 0x20:  1280x960    60.000000 Hz   4:3     60.000 kHz    108.000000 MHz
    DMT 0x53:  1600x900    60.000000 Hz  16:9     60.000 kHz    108.000000 MHz (RB)
  Detailed Timing Descriptors:
    DTD 1:  2560x1440   60.000199 Hz  16:9     88.860 kHz    241.700000 MHz (697 mm x 392 mm)
                 Hfront   48 Hsync  32 Hback   80 Hpol P
                 Vfront    3 Vsync   5 Vback   33 Vpol N
    Display Range Limits:
      Monitor ranges (Bare Limits): 48-165 Hz V, 252-252 kHz H, max dotclock 810 MHz
    Display Product Name: 'XZ322QU S'
    Display Product Serial Number: '1205000A23G00'
  Extension blocks: 1
Checksum: 0xad

----------------

Block 1, CTA-861 Extension Block:
  Revision: 3
  Underscans IT Video Formats by default
  Basic audio support
  Supports YCbCr 4:4:4
  Native detailed modes: 1
  Video Data Block:
    VIC   1:   640x480    59.940476 Hz   4:3     31.469 kHz     25.175000 MHz
    VIC   4:  1280x720    60.000000 Hz  16:9     45.000 kHz     74.250000 MHz
    VIC  16:  1920x1080   60.000000 Hz  16:9     67.500 kHz    148.500000 MHz
    VIC  63:  1920x1080  120.000000 Hz  16:9    135.000 kHz    297.000000 MHz
  Audio Data Block:
    Linear PCM:
      Max channels: 2
      Supported sample rates (kHz): 48 44.1 32
      Supported sample sizes (bits): 24 20 16
  Speaker Allocation Data Block:
    FL/FR - Front Left/Right
  Colorimetry Data Block:
    xvYCC601
    xvYCC709
    BT2020YCC
    BT2020RGB
    Gamut Boundary Description Metadata Profile P0
  HDR Static Metadata Data Block:
    Electro optical transfer functions:
      Traditional gamma - SDR luminance range
      Traditional gamma - HDR luminance range
      SMPTE ST2084
    Supported static metadata descriptors:
      Static metadata type 1
    Desired content max luminance: 101 (445.755 cd/m^2)
    Desired content max frame-average luminance: 101 (445.755 cd/m^2)
    Desired content min luminance: 62 (0.264 cd/m^2)
  Vendor-Specific Data Block (AMD), OUI 00-00-1A:
    Version: 2.1
    Minimum Refresh Rate: 48 Hz
    Maximum Refresh Rate: 165 Hz
    Flags 1.x: 0x00
    Flags 2.x: 0x00
    Maximum luminance: 0 (50.000 cd/m^2)
    Minimum luminance: 0 (0.000 cd/m^2)
    Unknown: 0x00 0x00
  Detailed Timing Descriptors:
    DTD 2:  2560x1440  119.997589 Hz  16:9    182.996 kHz    497.750000 MHz (697 mm x 392 mm)
                 Hfront   48 Hsync  32 Hback   80 Hpol P
                 Vfront    3 Vsync   5 Vback   77 Vpol P
    DTD 3:  2560x1440  144.000477 Hz  16:9    213.265 kHz    580.080000 MHz (697 mm x 392 mm)
                 Hfront   48 Hsync  32 Hback   80 Hpol P
                 Vfront    3 Vsync   5 Vback   33 Vpol N
    DTD 4:  1920x1080  119.998991 Hz  16:9    137.279 kHz    285.540000 MHz (side by side interleaved, 697 mm x 392 mm)
                 Hfront   48 Hsync  32 Hback   80 Hpol P
                 Vfront    3 Vsync   5 Vback   56 Vpol P
    DTD 5:  2560x1440  164.999485 Hz  16:9    242.549 kHz    640.330000 MHz (side by side interleaved, 697 mm x 392 mm)
                 Hfront   28 Hsync  32 Hback   20 Hpol P
                 Vfront    3 Vsync   5 Vback   22 Vpol P
Checksum: 0xf2  Unused space in Extension Block: 13 bytes


