
EDID (hex):
00ffffffffffff0004724f049ca15754
2d190103805224782aeed1a555489b26
125054bfef80d1c0b300950081808140
81c08100714fdea370e0d4a035500070
3a50336b3100001cef5170e0d4a03550
00703a50336b3100001c000000fd0017
501e633c000a202020202020000000fc
0041636572205852333431434b0a0136
02032cf14c0103041213051420221f10
0723090707830100006a030c00100038
3c20000067d85dc401788000023a8018
71382d40582c4500336b3100001e011d
007251d01e206e285500336b3100001e
8c0ad08a20e02d10103e9600336b3100
00188c0ad090204031200c405500336b
31000018000000000000000000000012

Extracted contents:
header:          00 ff ff ff ff ff ff 00
serial number:   04 72 4f 04 9c a1 57 54 2d 19
version:         01 03
basic params:    80 52 24 78 2a
chroma info:     ee d1 a5 55 48 9b 26 12 50 54
established:     bf ef 80
standard:        d1 c0 b3 00 95 00 81 80 81 40 81 c0 81 00 71 4f
descriptor 1:    de a3 70 e0 d4 a0 35 50 00 70 3a 50 33 6b 31 00 00 1c
descriptor 2:    ef 51 70 e0 d4 a0 35 50 00 70 3a 50 33 6b 31 00 00 1c
descriptor 3:    00 00 00 fd 00 17 50 1e 63 3c 00 0a 20 20 20 20 20 20
descriptor 4:    00 00 00 fc 00 41 63 65 72 20 58 52 33 34 31 43 4b 0a
extensions:      01
checksum:        36

EDID version: 1.3
Manufacturer: ACR Model 44f Serial Number --
Made in week 45 of 2015
Digital display
Maximum image size: 82 cm x 36 cm
Gamma: 2.20
DPMS levels: Off
RGB color display
First detailed timing is preferred timing
Display x,y Chromaticity:
  Red:   0.6474, 0.3339
  Green: 0.2841, 0.6074
  Blue:  0.1513, 0.0712
  White: 0.3125, 0.3291
Established timings supported:
  720x400@70Hz 9:5 HorFreq: 31469 Hz Clock: 28.320 MHz
  640x480@60Hz 4:3 HorFreq: 31469 Hz Clock: 25.175 MHz
  640x480@67Hz 4:3 HorFreq: 35000 Hz Clock: 30.240 MHz
  640x480@72Hz 4:3 HorFreq: 37900 Hz Clock: 31.500 MHz
  640x480@75Hz 4:3 HorFreq: 37500 Hz Clock: 31.500 MHz
  800x600@56Hz 4:3 HorFreq: 35200 Hz Clock: 36.000 MHz
  800x600@60Hz 4:3 HorFreq: 37900 Hz Clock: 40.000 MHz
  800x600@72Hz 4:3 HorFreq: 48100 Hz Clock: 50.000 MHz
  800x600@75Hz 4:3 HorFreq: 46900 Hz Clock: 49.500 MHz
  832x624@75Hz 4:3 HorFreq: 49726 Hz Clock: 57.284 MHz
  1024x768@60Hz 4:3 HorFreq: 48400 Hz Clock: 65.000 MHz
  1024x768@70Hz 4:3 HorFreq: 56500 Hz Clock: 75.000 MHz
  1024x768@75Hz 4:3 HorFreq: 60000 Hz Clock: 78.750 MHz
  1280x1024@75Hz 5:4 HorFreq: 80000 Hz Clock: 135.000 MHz
  1152x870@75Hz 192:145 HorFreq: 67500 Hz Clock: 108.000 MHz
Standard timings supported:
  1920x1080@60Hz 16:9
  1680x1050@60Hz 16:10 HorFreq: 64700 Hz Clock: 119.000 MHz
  1440x900@60Hz 16:10 HorFreq: 55500 Hz Clock: 88.750 MHz
  1280x1024@60Hz 5:4 HorFreq: 64000 Hz Clock: 108.000 MHz
  1280x960@60Hz 4:3 HorFreq: 60000 Hz Clock: 108.000 MHz
  1280x720@60Hz 16:9
  1280x800@60Hz 16:10
  1152x864@75Hz 4:3 HorFreq: 67500 Hz Clock: 108.000 MHz
Detailed mode: Clock 419.500 MHz, 819 mm x 363 mm
               3440 3696 4064 4688 hborder 0
               1440 1443 1453 1493 vborder 0
               -hsync +vsync 
               VertFreq: 59 Hz, HorFreq: 89483 Hz
Detailed mode: Clock 209.750 MHz, 819 mm x 363 mm
               3440 3696 4064 4688 hborder 0
               1440 1443 1453 1493 vborder 0
               -hsync +vsync 
               VertFreq: 29 Hz, HorFreq: 44741 Hz
Monitor ranges (GTF): 23-80Hz V, 30-99kHz H, max dotclock 600MHz
Monitor name: Acer XR341CK
Has 1 extension blocks
Checksum: 0x36 (valid)

CTA extension block
Extension version: 3
40 bytes of CTA data
  Video data block
    VIC   1 640x480@60Hz 4:3  HorFreq: 31469 Hz Clock: 25.175 MHz
    VIC   3 720x480@60Hz 16:9  HorFreq: 31469 Hz Clock: 27.000 MHz
    VIC   4 1280x720@60Hz 16:9  HorFreq: 45000 Hz Clock: 74.250 MHz
    VIC  18 720x576@50Hz 16:9  HorFreq: 31250 Hz Clock: 27.000 MHz
    VIC  19 1280x720@50Hz 16:9  HorFreq: 37500 Hz Clock: 74.250 MHz
    VIC   5 1920x1080i@60Hz 16:9  HorFreq: 33750 Hz Clock: 74.250 MHz
    VIC  20 1920x1080i@50Hz 16:9  HorFreq: 28125 Hz Clock: 74.250 MHz
    VIC  32 1920x1080@24Hz 16:9  HorFreq: 27000 Hz Clock: 74.250 MHz
    VIC  34 1920x1080@30Hz 16:9  HorFreq: 33750 Hz Clock: 74.250 MHz
    VIC  31 1920x1080@50Hz 16:9  HorFreq: 56250 Hz Clock: 148.500 MHz
    VIC  16 1920x1080@60Hz 16:9  HorFreq: 67500 Hz Clock: 148.500 MHz
    VIC   7 1440x480i@60Hz 16:9  HorFreq: 15734 Hz Clock: 27.000 MHz
  Audio data block
    Linear PCM, max channels 2
      Supported sample rates (kHz): 48 44.1 32
      Supported sample sizes (bits): 24 20 16
  Speaker allocation data block
    Speaker map:
      FL/FR - Front Left/Right
  Vendor-specific data block, OUI 000c03 (HDMI)
    Source physical address 1.0.0.0
    DC_36bit
    DC_30bit
    DC_Y444
    Maximum TMDS clock: 300MHz
    Extended HDMI video details:
  Vendor-specific data block, OUI c45dd8 (HDMI Forum)
    Version: 1
    Maximum TMDS Character Rate: 600MHz
    SCDC Present
Underscans PC formats by default
Basic audio support
Supports YCbCr 4:4:4
Supports YCbCr 4:2:2
1 native detailed modes
Detailed mode: Clock 148.500 MHz, 819 mm x 363 mm
               1920 2008 2052 2200 hborder 0
               1080 1084 1089 1125 vborder 0
               +hsync +vsync 
               VertFreq: 60 Hz, HorFreq: 67500 Hz
Detailed mode: Clock 74.250 MHz, 819 mm x 363 mm
               1280 1390 1430 1650 hborder 0
                720  725  730  750 vborder 0
               +hsync +vsync 
               VertFreq: 60 Hz, HorFreq: 45000 Hz
Detailed mode: Clock 27.000 MHz, 819 mm x 363 mm
                720  736  798  858 hborder 0
                480  489  495  525 vborder 0
               -hsync -vsync 
               VertFreq: 59 Hz, HorFreq: 31468 Hz
Detailed mode: Clock 27.000 MHz, 819 mm x 363 mm
                720  732  796  864 hborder 0
                576  581  586  625 vborder 0
               -hsync -vsync 
               VertFreq: 50 Hz, HorFreq: 31250 Hz
Checksum: 0x12 (valid)

One or more of the timings is out of range of the Monitor Ranges:
  Vertical Freq: 24 - 75 Hz
  Horizontal Freq: 15734 - 89483 Hz
  Maximum Clock: 419.500 MHz
