
EDID (hex):
00ffffffffffff0006af3c1900000000
00130104901f117802c8a59e57549226
99505400000001010101010101010101
010101010101bc1b566a500023302616
360035ad1000001abc1b568a5100f030
2616360035ad1000001a000000fe0047
4a343735804231343058573100000000
00004122940101000001010a202000e6

Extracted contents:
header:          00 ff ff ff ff ff ff 00
serial number:   06 af 3c 19 00 00 00 00 00 13
version:         01 04
basic params:    90 1f 11 78 02
chroma info:     c8 a5 9e 57 54 92 26 99 50 54
established:     00 00 00
standard:        01 01 01 01 01 01 01 01 01 01 01 01 01 01 01 01
descriptor 1:    bc 1b 56 6a 50 00 23 30 26 16 36 00 35 ad 10 00 00 1a
descriptor 2:    bc 1b 56 8a 51 00 f0 30 26 16 36 00 35 ad 10 00 00 1a
descriptor 3:    00 00 00 fe 00 47 4a 34 37 35 80 42 31 34 30 58 57 31
descriptor 4:    00 00 00 00 00 00 41 22 94 01 01 00 00 01 01 0a 20 20
extensions:      00
checksum:        e6

EDID version: 1.4
Manufacturer: AUO Model 193c Serial Number --
Made in year 2009
Digital display
6 bits per primary color channel
Digital interface is not defined
Maximum image size: 31 cm x 17 cm
Gamma: 2.20
Supported color formats: RGB 4:4:4
First detailed timing includes the native pixel format and preferred refresh rate
Display x,y Chromaticity:
  Red:   0.6201, 0.3398
  Green: 0.3300, 0.5703
  Blue:  0.1503, 0.5996
  White: 0.3134, 0.3291
Established timings supported:
Standard timings supported:
Detailed mode: Clock 71.000 MHz, 309 mm x 173 mm
               1366 1404 1426 1472 hborder 0
                768  771  777  803 vborder 0
               +hsync -vsync 
               VertFreq: 60 Hz, HorFreq: 48233 Hz
Detailed mode: Clock 71.000 MHz, 309 mm x 173 mm
               1366 1404 1426 1760 hborder 0
                768  771  777 1008 vborder 0
               +hsync -vsync 
               VertFreq: 40 Hz, HorFreq: 40340 Hz
ASCII string: GJ475
Manufacturer-specified data, tag 0
Checksum: 0xe6 (valid)
EDID block does NOT conform to EDID 1.4!
	Missing name descriptor
	Missing monitor ranges
	Detailed block string not properly terminated
