
EDID (hex):
00ffffffffffff001ef9ad0801010101
0b130103682f1e782a0101a655489b26
125054afcf00b3009500950f8180714f
8100810f010121399030621a274068b0
3600d9281100001c000000fd00304c18
5314000a202020202020000000fc0048
44323230310a202020202020000000ff
004d324a39333730433031343130009d

Extracted contents:
header:          00 ff ff ff ff ff ff 00
serial number:   1e f9 ad 08 01 01 01 01 0b 13
version:         01 03
basic params:    68 2f 1e 78 2a
chroma info:     01 01 a6 55 48 9b 26 12 50 54
established:     af cf 00
standard:        b3 00 95 00 95 0f 81 80 71 4f 81 00 81 0f 01 01
descriptor 1:    21 39 90 30 62 1a 27 40 68 b0 36 00 d9 28 11 00 00 1c
descriptor 2:    00 00 00 fd 00 30 4c 18 53 14 00 0a 20 20 20 20 20 20
descriptor 3:    00 00 00 fc 00 48 44 32 32 30 31 0a 20 20 20 20 20 20
descriptor 4:    00 00 00 ff 00 4d 32 4a 39 33 37 30 43 30 31 34 31 30
extensions:      00
checksum:        9d

EDID version: 1.3
Manufacturer: GWY Model 8ad Serial Number --
Made in week 11 of 2009
Analog display, Input voltage level: 0.7/0.7 V
Sync: Separate 
Maximum image size: 47 cm x 30 cm
Gamma: 2.20
DPMS levels: Off
RGB color display
First detailed timing is preferred timing
Display x,y Chromaticity:
  Red:   0.6484, 0.3320
  Green: 0.2812, 0.6064
  Blue:  0.1484, 0.0703
  White: 0.3125, 0.3291
Established timings supported:
  720x400@70Hz 9:5 HorFreq: 31469 Hz Clock: 28.320 MHz
  640x480@60Hz 4:3 HorFreq: 31469 Hz Clock: 25.175 MHz
  640x480@72Hz 4:3 HorFreq: 37900 Hz Clock: 31.500 MHz
  640x480@75Hz 4:3 HorFreq: 37500 Hz Clock: 31.500 MHz
  800x600@56Hz 4:3 HorFreq: 35200 Hz Clock: 36.000 MHz
  800x600@60Hz 4:3 HorFreq: 37900 Hz Clock: 40.000 MHz
  800x600@72Hz 4:3 HorFreq: 48100 Hz Clock: 50.000 MHz
  800x600@75Hz 4:3 HorFreq: 46900 Hz Clock: 49.500 MHz
  1024x768@60Hz 4:3 HorFreq: 48400 Hz Clock: 65.000 MHz
  1024x768@70Hz 4:3 HorFreq: 56500 Hz Clock: 75.000 MHz
  1024x768@75Hz 4:3 HorFreq: 60000 Hz Clock: 78.750 MHz
  1280x1024@75Hz 5:4 HorFreq: 80000 Hz Clock: 135.000 MHz
Standard timings supported:
  1680x1050@60Hz 16:10 HorFreq: 64700 Hz Clock: 119.000 MHz
  1440x900@60Hz 16:10 HorFreq: 55500 Hz Clock: 88.750 MHz
  1440x900@75Hz 16:10 HorFreq: 82300 Hz Clock: 156.000 MHz
  1280x1024@60Hz 5:4 HorFreq: 64000 Hz Clock: 108.000 MHz
  1152x864@75Hz 4:3 HorFreq: 67500 Hz Clock: 108.000 MHz
  1280x800@60Hz 16:10
  1280x800@75Hz 16:10
Detailed mode: Clock 146.250 MHz, 473 mm x 296 mm
               1680 1784 1960 2240 hborder 0
               1050 1053 1059 1089 vborder 0
               -hsync +vsync 
               VertFreq: 59 Hz, HorFreq: 65290 Hz
Monitor ranges (GTF): 48-76Hz V, 24-83kHz H, max dotclock 200MHz
Monitor name: HD2201
Serial number: --
Checksum: 0x9d (valid)


