edid-decode (hex):

00 ff ff ff ff ff ff 00 5a 63 23 0e 01 01 01 01
08 14 01 03 80 2f 1e 78 2e 78 f5 a6 55 48 9b 26
12 50 54 bf ef 80 a9 40 95 00 90 40 81 80 81 40
71 4f 31 0a 01 01 21 39 90 30 62 1a 27 40 68 b0
36 00 da 28 11 00 00 1c 00 00 00 ff 00 52 41 47
31 30 30 38 30 31 30 37 32 0a 00 00 00 fd 00 32
78 18 ba 21 00 0a 20 20 20 20 20 20 00 00 00 fc
00 56 58 32 32 36 38 77 6d 0a 20 20 20 20 01 b0

02 01 04 03 fd 5e 90 5e 61 1a 27 40 14 14 36 00
da 28 11 00 00 1e a0 67 90 5e 61 1a 27 40 14 14
36 00 da 28 11 00 00 1e 5b 56 90 5e 61 1a 27 40
14 14 36 00 da 28 11 00 00 1e 00 00 00 00 00 00
00 00 00 00 00 00 00 00 00 00 00 00 00 00 00 00
00 00 00 00 00 00 00 00 00 00 00 00 00 00 00 00
00 00 00 00 00 00 00 00 00 00 00 00 00 00 00 00
00 00 00 00 00 00 00 00 00 00 00 00 00 00 00 c6

----------------

Block 0, Base EDID:
  EDID Structure Version & Revision: 1.3
  Vendor & Product Identification:
    Manufacturer: VSC
    Model: 3619
    Serial Number: ...
    Made in: week 8 of 2010
  Basic Display Parameters & Features:
    Digital display
    Maximum image size: 47 cm x 30 cm
    Gamma: 2.20
    DPMS levels: Off
    RGB color display
    Default (sRGB) color space is primary color space
    First detailed timing is preferred timing
  Color Characteristics:
    Red  : 0.6494, 0.3349
    Green: 0.2832, 0.6054
    Blue : 0.1513, 0.0732
    White: 0.3134, 0.3291
  Established Timings I & II:
    IBM     :   720x400    70.082 Hz   9:5    31.467 kHz  28.320 MHz
    DMT 0x04:   640x480    59.940 Hz   4:3    31.469 kHz  25.175 MHz
    Apple   :   640x480    66.667 Hz   4:3    35.000 kHz  30.240 MHz
    DMT 0x05:   640x480    72.809 Hz   4:3    37.861 kHz  31.500 MHz
    DMT 0x06:   640x480    75.000 Hz   4:3    37.500 kHz  31.500 MHz
    DMT 0x08:   800x600    56.250 Hz   4:3    35.156 kHz  36.000 MHz
    DMT 0x09:   800x600    60.317 Hz   4:3    37.879 kHz  40.000 MHz
    DMT 0x0a:   800x600    72.188 Hz   4:3    48.077 kHz  50.000 MHz
    DMT 0x0b:   800x600    75.000 Hz   4:3    46.875 kHz  49.500 MHz
    Apple   :   832x624    74.551 Hz   4:3    49.726 kHz  57.284 MHz
    DMT 0x10:  1024x768    60.004 Hz   4:3    48.363 kHz  65.000 MHz
    DMT 0x11:  1024x768    70.069 Hz   4:3    56.476 kHz  75.000 MHz
    DMT 0x12:  1024x768    75.029 Hz   4:3    60.023 kHz  78.750 MHz
    DMT 0x24:  1280x1024   75.025 Hz   5:4    79.976 kHz 135.000 MHz
    Apple   :  1152x870    75.062 Hz 192:145  68.681 kHz 100.000 MHz
  Standard Timings:
    DMT 0x33:  1600x1200   60.000 Hz   4:3    75.000 kHz 162.000 MHz
    DMT 0x2f:  1440x900    59.887 Hz  16:10   55.935 kHz 106.500 MHz
    DMT 0x2a:  1400x1050   59.978 Hz   4:3    65.317 kHz 121.750 MHz
    DMT 0x23:  1280x1024   60.020 Hz   5:4    63.981 kHz 108.000 MHz
    DMT 0x20:  1280x960    60.000 Hz   4:3    60.000 kHz 108.000 MHz
    DMT 0x15:  1152x864    75.000 Hz   4:3    67.500 kHz 108.000 MHz
    GTF     :   640x400    70.000 Hz  16:10   29.190 kHz  23.352 MHz
  Detailed Timing Descriptors:
    DTD 1:  1680x1050   59.954 Hz   8:5    65.290 kHz 146.250 MHz (474 mm x 296 mm)
                 Hfront  104 Hsync 176 Hback 280 Hpol N
                 Vfront    3 Vsync   6 Vback  30 Vpol P
    Display Product Serial Number: ...
  Display Range Limits:
    Monitor ranges (GTF): 50-120 Hz V, 24-186 kHz H, max dotclock 330 MHz
    Display Product Name: 'VX2268wm'
  Extension blocks: 1
Checksum: 0xb0

----------------

Block 1, CTA-861 Extension Block:
  Revision: 1
  Detailed Timing Descriptors:
    DTD 2:  1680x1050  109.998 Hz   8:5   119.788 kHz 243.170 MHz (474 mm x 296 mm)
                 Hfront   20 Hsync  20 Hback 310 Hpol P
                 Vfront    3 Vsync   6 Vback  30 Vpol P
    DTD 3:  1680x1050  120.000 Hz   8:5   130.680 kHz 265.280 MHz (474 mm x 296 mm)
                 Hfront   20 Hsync  20 Hback 310 Hpol P
                 Vfront    3 Vsync   6 Vback  30 Vpol P
    DTD 4:  1680x1050  100.001 Hz   8:5   108.901 kHz 221.070 MHz (474 mm x 296 mm)
                 Hfront   20 Hsync  20 Hback 310 Hpol P
                 Vfront    3 Vsync   6 Vback  30 Vpol P
Checksum: 0xc6

----------------

Warnings:

Block 1, CTA-861 Extension Block:
  Display Product Serial Number is set, so the Serial Number in the Base EDID should be 0.

Failures:

Block 0, Base EDID:
  Basic Display Parameters & Features: sRGB is signaled, but the chromaticities do not match.
Block 1, CTA-861 Extension Block:
  Non-zero byte 3.

EDID conformity: FAIL
