edid-decode (hex):

00 ff ff ff ff ff ff 00 10 ac 17 f0 4c 4a 38 36
15 14 01 04 b5 34 20 78 3a 1e c5 ae 4f 34 b1 26
0e 50 54 a5 4b 00 81 80 a9 40 d1 00 71 4f 01 01
01 01 01 01 01 01 28 3c 80 a0 70 b0 23 40 30 20
36 00 06 44 21 00 00 1a 00 00 00 ff 00 43 35 39
32 4d 30 35 4c 36 38 4a 4c 0a 00 00 00 fc 00 44
45 4c 4c 20 55 32 34 31 30 0a 20 20 00 00 00 fd
00 38 4c 1e 51 11 00 0a 20 20 20 20 20 20 01 d7

----------------

Block 0, Base EDID:
  EDID Structure Version & Revision: 1.4
  Vendor & Product Identification:
    Manufacturer: DEL
    Model: 61463
    Serial Number: ...
    Made in: week 21 of 2010
  Basic Display Parameters & Features:
    Digital display
    Bits per primary color channel: 10
    DisplayPort interface
    Maximum image size: 52 cm x 32 cm
    Gamma: 2.20
    DPMS levels: Off
    Supported color formats: RGB 4:4:4, YCrCb 4:4:4, YCrCb 4:2:2
    First detailed timing includes the native pixel format and preferred refresh rate
  Color Characteristics:
    Red  : 0.6796, 0.3095
    Green: 0.2060, 0.6933
    Blue : 0.1513, 0.0546
    White: 0.3134, 0.3291
  Established Timings I & II:
    IBM     :   720x400    70.082 Hz   9:5    31.467 kHz  28.320 MHz
    DMT 0x04:   640x480    59.940 Hz   4:3    31.469 kHz  25.175 MHz
    DMT 0x06:   640x480    75.000 Hz   4:3    37.500 kHz  31.500 MHz
    DMT 0x09:   800x600    60.317 Hz   4:3    37.879 kHz  40.000 MHz
    DMT 0x0b:   800x600    75.000 Hz   4:3    46.875 kHz  49.500 MHz
    DMT 0x10:  1024x768    60.004 Hz   4:3    48.363 kHz  65.000 MHz
    DMT 0x12:  1024x768    75.029 Hz   4:3    60.023 kHz  78.750 MHz
    DMT 0x24:  1280x1024   75.025 Hz   5:4    79.976 kHz 135.000 MHz
  Standard Timings:
    DMT 0x23:  1280x1024   60.020 Hz   5:4    63.981 kHz 108.000 MHz
    DMT 0x33:  1600x1200   60.000 Hz   4:3    75.000 kHz 162.000 MHz
    DMT 0x45:  1920x1200   59.885 Hz  16:10   74.556 kHz 193.250 MHz
    DMT 0x15:  1152x864    75.000 Hz   4:3    67.500 kHz 108.000 MHz
  Detailed Timing Descriptors:
    DTD 1:  1920x1200   59.950 Hz   8:5    74.038 kHz 154.000 MHz (518 mm x 324 mm)
                 Hfront   48 Hsync  32 Hback  80 Hpol P
                 Vfront    3 Vsync   6 Vback  26 Vpol N
    Display Product Serial Number: ...
    Display Product Name: 'DELL U2410'
  Display Range Limits:
    Monitor ranges (GTF): 56-76 Hz V, 30-81 kHz H, max dotclock 170 MHz
  Extension blocks: 1
Checksum: 0xd7
