
EDID (hex):
00ffffffffffff0026cf890400000000
00190104951a0e780a12309156539228
1e505400000001010101010101010101
010101010101d51c56a6500023302820
3c000090100000190000000000000000
00000000000000000000000000fe0049
6e666f566973696f6e0a2020000000fe
004d3131364e575231205238200a0027

Extracted contents:
header:          00 ff ff ff ff ff ff 00
serial number:   26 cf 89 04 00 00 00 00 00 19
version:         01 04
basic params:    95 1a 0e 78 0a
chroma info:     12 30 91 56 53 92 28 1e 50 54
established:     00 00 00
standard:        01 01 01 01 01 01 01 01 01 01 01 01 01 01 01 01
descriptor 1:    d5 1c 56 a6 50 00 23 30 28 20 3c 00 00 90 10 00 00 19
descriptor 2:    00 00 00 00 00 00 00 00 00 00 00 00 00 00 00 00 00 00
descriptor 3:    00 00 00 fe 00 49 6e 66 6f 56 69 73 69 6f 6e 0a 20 20
descriptor 4:    00 00 00 fe 00 4d 31 31 36 4e 57 52 31 20 52 38 20 0a
extensions:      00
checksum:        27

EDID version: 1.4
Manufacturer: IVO Model 489 Serial Number --
Made in year 2015
Digital display
6 bits per primary color channel
DisplayPort interface
Maximum image size: 26 cm x 14 cm
Gamma: 2.20
Supported color formats: RGB 4:4:4, YCrCb 4:4:4
First detailed timing includes the native pixel format and preferred refresh rate
Display x,y Chromaticity:
  Red:   0.5664, 0.3369
  Green: 0.3242, 0.5722
  Blue:  0.1562, 0.1201
  White: 0.3125, 0.3281
Established timings supported:
Standard timings supported:
Detailed mode: Clock 73.810 MHz, 256 mm x 144 mm
               1366 1406 1438 1532 hborder 0
                768  771  783  803 vborder 0
               -hsync -vsync 
               VertFreq: 59 Hz, HorFreq: 48178 Hz
Manufacturer-specified data, tag 0
ASCII string: InfoVision
ASCII string: M116NWR1 R8 
Checksum: 0x27 (valid)
EDID block does NOT conform to EDID 1.4!
	Missing name descriptor
	Missing monitor ranges
