
EDID (hex):
00ffffffffffff00506c000000000000
00170103805932780a0dc9a057479827
12484c214300714f8100814081809500
950fb300a940023a801871382d40582c
4500a05a0000001e662150b051001b30
40703600a05a0000001e000000fd0018
4b1a5117000a202020202020000000fc
004d54353635310a202020202020011c
020323744b84101f0513140102110615
26097f03117f188301000067030c0020
00b82d011d00bc52d01e20b8285540c4
8e2100001e011d80d0721c1620102c25
80c48e2100009e8c0ad08a20e02d1010
3e9600138e210000188c0ad090204031
200c405500138e210000180000000000
00000000000000000000000000000042

edid-decode (hex):

00 ff ff ff ff ff ff 00 50 6c 00 00 00 00 00 00
00 17 01 03 80 59 32 78 0a 0d c9 a0 57 47 98 27
12 48 4c 21 43 00 71 4f 81 00 81 40 81 80 95 00
95 0f b3 00 a9 40 02 3a 80 18 71 38 2d 40 58 2c
45 00 a0 5a 00 00 00 1e 66 21 50 b0 51 00 1b 30
40 70 36 00 a0 5a 00 00 00 1e 00 00 00 fd 00 18
4b 1a 51 17 00 0a 20 20 20 20 20 20 00 00 00 fc
00 4d 54 35 36 35 31 0a 20 20 20 20 20 20 01 1c

02 03 23 74 4b 84 10 1f 05 13 14 01 02 11 06 15
26 09 7f 03 11 7f 18 83 01 00 00 67 03 0c 00 20
00 b8 2d 01 1d 00 bc 52 d0 1e 20 b8 28 55 40 c4
8e 21 00 00 1e 01 1d 80 d0 72 1c 16 20 10 2c 25
80 c4 8e 21 00 00 9e 8c 0a d0 8a 20 e0 2d 10 10
3e 96 00 13 8e 21 00 00 18 8c 0a d0 90 20 40 31
20 0c 40 55 00 13 8e 21 00 00 18 00 00 00 00 00
00 00 00 00 00 00 00 00 00 00 00 00 00 00 00 42

----------------

Block 0, Base EDID:
  EDID Structure Version & Revision: 1.3
  Vendor & Product Identification:
    Manufacturer: TCL
    Model: 0
    Made in: 2013
  Basic Display Parameters & Features:
    Digital display
    Maximum image size: 89 cm x 50 cm
    Gamma: 2.20
    RGB color display
    First detailed timing is the preferred timing
  Color Characteristics:
    Red  : 0.6250, 0.3398
    Green: 0.2802, 0.5947
    Blue : 0.1552, 0.0703
    White: 0.2832, 0.2978
  Established Timings I & II:
    DMT 0x04:   640x480    59.940476 Hz   4:3     31.469 kHz     25.175000 MHz
    DMT 0x09:   800x600    60.316541 Hz   4:3     37.879 kHz     40.000000 MHz
    DMT 0x0b:   800x600    75.000000 Hz   4:3     46.875 kHz     49.500000 MHz
    DMT 0x12:  1024x768    75.028582 Hz   4:3     60.023 kHz     78.750000 MHz
    DMT 0x24:  1280x1024   75.024675 Hz   5:4     79.976 kHz    135.000000 MHz
  Standard Timings:
    DMT 0x15:  1152x864    75.000000 Hz   4:3     67.500 kHz    108.000000 MHz
    DMT 0x1c:  1280x800    59.810326 Hz  16:10    49.702 kHz     83.500000 MHz
    DMT 0x20:  1280x960    60.000000 Hz   4:3     60.000 kHz    108.000000 MHz
    DMT 0x23:  1280x1024   60.019740 Hz   5:4     63.981 kHz    108.000000 MHz
    DMT 0x2f:  1440x900    59.887445 Hz  16:10    55.935 kHz    106.500000 MHz
    DMT 0x30:  1440x900    74.984427 Hz  16:10    70.635 kHz    136.750000 MHz
    DMT 0x3a:  1680x1050   59.954250 Hz  16:10    65.290 kHz    146.250000 MHz
    DMT 0x33:  1600x1200   60.000000 Hz   4:3     75.000 kHz    162.000000 MHz
  Detailed Timing Descriptors:
    DTD 1:  1920x1080   60.000000 Hz  16:9     67.500 kHz    148.500000 MHz (160 mm x 90 mm)
                 Hfront   88 Hsync  44 Hback  148 Hpol P
                 Vfront    4 Vsync   5 Vback   36 Vpol P
    DTD 2:  1360x768    60.015162 Hz  85:48    47.712 kHz     85.500000 MHz (160 mm x 90 mm)
                 Hfront   64 Hsync 112 Hback  256 Hpol P
                 Vfront    3 Vsync   6 Vback   18 Vpol P
    Display Range Limits:
      Monitor ranges (GTF): 24-75 Hz V, 26-81 kHz H, max dotclock 230 MHz
    Display Product Name: 'MT5651'
  Extension blocks: 1
Checksum: 0x1c

----------------

Block 1, CTA-861 Extension Block:
  Revision: 3
  Basic audio support
  Supports YCbCr 4:4:4
  Supports YCbCr 4:2:2
  Native detailed modes: 4
  Video Data Block:
    VIC   4:  1280x720    60.000000 Hz  16:9     45.000 kHz     74.250000 MHz (native)
    VIC  16:  1920x1080   60.000000 Hz  16:9     67.500 kHz    148.500000 MHz
    VIC  31:  1920x1080   50.000000 Hz  16:9     56.250 kHz    148.500000 MHz
    VIC   5:  1920x1080i  60.000000 Hz  16:9     33.750 kHz     74.250000 MHz
    VIC  19:  1280x720    50.000000 Hz  16:9     37.500 kHz     74.250000 MHz
    VIC  20:  1920x1080i  50.000000 Hz  16:9     28.125 kHz     74.250000 MHz
    VIC   1:   640x480    59.940476 Hz   4:3     31.469 kHz     25.175000 MHz
    VIC   2:   720x480    59.940060 Hz   4:3     31.469 kHz     27.000000 MHz
    VIC  17:   720x576    50.000000 Hz   4:3     31.250 kHz     27.000000 MHz
    VIC   6:  1440x480i   59.940060 Hz   4:3     15.734 kHz     27.000000 MHz
    VIC  21:  1440x576i   50.000000 Hz   4:3     15.625 kHz     27.000000 MHz
  Audio Data Block:
    Linear PCM:
      Max channels: 2
      Supported sample rates (kHz): 192 176.4 96 88.2 48 44.1 32
      Supported sample sizes (bits): 20 16
    AC-3:
      Max channels: 2
      Supported sample rates (kHz): 192 176.4 96 88.2 48 44.1 32
      Maximum bit rate: 192 kb/s
  Speaker Allocation Data Block:
    FL/FR - Front Left/Right
  Vendor-Specific Data Block (HDMI), OUI 00-0C-03:
    Source physical address: 2.0.0.0
    Supports_AI
    DC_36bit
    DC_30bit
    DC_Y444
    Maximum TMDS clock: 225 MHz
  Detailed Timing Descriptors:
    DTD 3:  1280x720    50.000000 Hz  16:9     37.500 kHz     74.250000 MHz (708 mm x 398 mm)
                 Hfront  440 Hsync  40 Hback  220 Hpol P
                 Vfront    5 Vsync   5 Vback   20 Vpol P
    DTD 4:  1920x1080i  50.000000 Hz  16:9     28.125 kHz     74.250000 MHz (708 mm x 398 mm)
                 Hfront  528 Hsync  44 Hback  148 Hpol P
                 Vfront    2 Vsync   5 Vback   15 Vpol P Vfront +0.5 Odd Field
                 Vfront    2 Vsync   5 Vback   15 Vpol P Vback  +0.5 Even Field
    DTD 5:   720x480    59.940060 Hz   3:2     31.469 kHz     27.000000 MHz (531 mm x 398 mm)
                 Hfront   16 Hsync  62 Hback   60 Hpol N
                 Vfront    9 Vsync   6 Vback   30 Vpol N
    DTD 6:   720x576    50.000000 Hz   5:4     31.250 kHz     27.000000 MHz (531 mm x 398 mm)
                 Hfront   12 Hsync  64 Hback   68 Hpol N
                 Vfront    5 Vsync   5 Vback   39 Vpol N
Checksum: 0x42  Unused space in Extension Block: 20 bytes
