
EDID (hex):
00ffffffffffff00506c000000000000
0d1d0103805f36780a8a5da455529f25
0e474aadcf00714f8140818081009500
b300d1c081c004740030f2705a80b058
8a0020c23100001e023a801871382d40
582c450020c23100001e000000fc0034
335334323543410a20202020000000fd
00174c0f5122000a20202020202001c0

Extracted contents:
header:          00 ff ff ff ff ff ff 00
serial number:   50 6c 00 00 00 00 00 00 0d 1d
version:         01 03
basic params:    80 5f 36 78 0a
chroma info:     8a 5d a4 55 52 9f 25 0e 47 4a
established:     ad cf 00
standard:        71 4f 81 40 81 80 81 00 95 00 b3 00 d1 c0 81 c0
descriptor 1:    04 74 00 30 f2 70 5a 80 b0 58 8a 00 20 c2 31 00 00 1e
descriptor 2:    02 3a 80 18 71 38 2d 40 58 2c 45 00 20 c2 31 00 00 1e
descriptor 3:    00 00 00 fc 00 34 33 53 34 32 35 43 41 0a 20 20 20 20
descriptor 4:    00 00 00 fd 00 17 4c 0f 51 22 00 0a 20 20 20 20 20 20
extensions:      01
checksum:        c0

EDID version: 1.3
Manufacturer: TCL Model 0 Serial Number --
Made in week 13 of 2019
Digital display
Maximum image size: 95 cm x 54 cm
Gamma: 2.20
RGB color display
First detailed timing is preferred timing
Display x,y Chromaticity:
  Red:   0.6425, 0.3320
  Green: 0.3222, 0.6230
  Blue:  0.1455, 0.0556
  White: 0.2802, 0.2900
Established timings supported:
  720x400@70Hz 9:5 HorFreq: 31469 Hz Clock: 28.320 MHz
  640x480@60Hz 4:3 HorFreq: 31469 Hz Clock: 25.175 MHz
  640x480@72Hz 4:3 HorFreq: 37900 Hz Clock: 31.500 MHz
  640x480@75Hz 4:3 HorFreq: 37500 Hz Clock: 31.500 MHz
  800x600@60Hz 4:3 HorFreq: 37900 Hz Clock: 40.000 MHz
  800x600@72Hz 4:3 HorFreq: 48100 Hz Clock: 50.000 MHz
  800x600@75Hz 4:3 HorFreq: 46900 Hz Clock: 49.500 MHz
  1024x768@60Hz 4:3 HorFreq: 48400 Hz Clock: 65.000 MHz
  1024x768@70Hz 4:3 HorFreq: 56500 Hz Clock: 75.000 MHz
  1024x768@75Hz 4:3 HorFreq: 60000 Hz Clock: 78.750 MHz
  1280x1024@75Hz 5:4 HorFreq: 80000 Hz Clock: 135.000 MHz
Standard timings supported:
  1152x864@75Hz 4:3 HorFreq: 67500 Hz Clock: 108.000 MHz
  1280x960@60Hz 4:3 HorFreq: 60000 Hz Clock: 108.000 MHz
  1280x1024@60Hz 5:4 HorFreq: 64000 Hz Clock: 108.000 MHz
  1280x800@60Hz 16:10
  1440x900@60Hz 16:10 HorFreq: 55500 Hz Clock: 88.750 MHz
  1680x1050@60Hz 16:10 HorFreq: 64700 Hz Clock: 119.000 MHz
  1920x1080@60Hz 16:9
  1280x720@60Hz 16:9
Detailed mode: Clock 297.000 MHz, 800 mm x 450 mm
               3840 4016 4104 4400 hborder 0
               2160 2168 2178 2250 vborder 0
               +hsync +vsync 
               VertFreq: 30 Hz, HorFreq: 67500 Hz
Detailed mode: Clock 148.500 MHz, 800 mm x 450 mm
               1920 2008 2052 2200 hborder 0
               1080 1084 1089 1125 vborder 0
               +hsync +vsync 
               VertFreq: 60 Hz, HorFreq: 67500 Hz
Monitor name: 43S425CA
Monitor ranges (GTF): 23-76Hz V, 15-81kHz H, max dotclock 340MHz
Has 1 extension blocks
Checksum: 0xc0 (valid)
