edid-decode (hex):

00 ff ff ff ff ff ff 00 4d d9 01 92 01 01 01 01
08 13 01 03 80 00 00 78 0a da ff a3 58 4a a2 29
17 49 4b 20 00 00 01 01 01 01 01 01 01 01 01 01
01 01 01 01 01 01 02 3a 80 d0 72 38 2d 40 10 2c
45 80 ba 88 21 00 00 1e 8c 0a d0 90 20 40 31 20
0c 40 55 00 ba 88 21 00 00 18 00 00 00 fc 00 53
4f 4e 59 20 41 56 41 4d 50 0a 20 20 00 00 00 fd
00 17 3d 0f 44 0f 00 0a 20 20 20 20 20 20 01 da

02 03 30 76 4c 9f 90 14 05 20 13 04 12 03 11 02
01 2f 09 1f 07 0d 1f 07 0f 1f 07 15 07 55 3d 07
c0 83 5f 00 00 66 03 0c 00 11 00 80 e3 05 03 01
01 1d 80 d0 72 1c 16 20 10 2c 25 80 ba 88 21 00
00 9e 01 1d 80 18 71 1c 16 20 58 2c 25 00 ba 88
21 00 00 9e 01 1d 00 bc 52 d0 1e 20 b8 28 55 40
ba 88 21 00 00 1e 01 1d 00 72 51 d0 1e 20 6e 28
55 00 ba 88 21 00 00 1e 00 00 00 00 00 00 00 90

----------------

Block 0, Base EDID:
  EDID Structure Version & Revision: 1.3
  Vendor & Product Identification:
    Manufacturer: SNY
    Model: 37377
    Serial Number: ...
    Made in: week 8 of 2009
  Basic Display Parameters & Features:
    Digital display
    Image size is variable
    Gamma: 2.20
    RGB color display
    First detailed timing is the preferred timing
  Color Characteristics:
    Red  : 0.6396, 0.3447
    Green: 0.2910, 0.6347
    Blue : 0.1630, 0.0927
    White: 0.2880, 0.2958
  Established Timings I & II:
    DMT 0x04:   640x480    59.940 Hz   4:3    31.469 kHz  25.175 MHz
  Standard Timings: none
  Detailed Timing Descriptors:
    DTD 1:  1920x1080   50.000 Hz  16:9    56.250 kHz 148.500 MHz (698 mm x 392 mm)
                 Hfront  528 Hsync  44 Hback 148 Hpol P
                 Vfront    4 Vsync   5 Vback  36 Vpol P
    DTD 2:   720x576    50.000 Hz   5:4    31.250 kHz  27.000 MHz (698 mm x 392 mm)
                 Hfront   12 Hsync  64 Hback  68 Hpol N
                 Vfront    5 Vsync   5 Vback  39 Vpol N
    Display Product Name: 'SONY AVAMP'
  Display Range Limits:
    Monitor ranges (GTF): 23-61 Hz V, 15-68 kHz H, max dotclock 150 MHz
  Extension blocks: 1
Checksum: 0xda

----------------

Block 1, CTA-861 Extension Block:
  Revision: 3
  Basic audio support
  Supports YCbCr 4:4:4
  Supports YCbCr 4:2:2
  Native detailed modes: 6
  Video Data Block:
    VIC  31:  1920x1080   50.000 Hz  16:9    56.250 kHz 148.500 MHz (native)
    VIC  16:  1920x1080   60.000 Hz  16:9    67.500 kHz 148.500 MHz (native)
    VIC  20:  1920x1080i  50.000 Hz  16:9    28.125 kHz  74.250 MHz
    VIC   5:  1920x1080i  60.000 Hz  16:9    33.750 kHz  74.250 MHz
    VIC  32:  1920x1080   24.000 Hz  16:9    27.000 kHz  74.250 MHz
    VIC  19:  1280x720    50.000 Hz  16:9    37.500 kHz  74.250 MHz
    VIC   4:  1280x720    60.000 Hz  16:9    45.000 kHz  74.250 MHz
    VIC  18:   720x576    50.000 Hz  16:9    31.250 kHz  27.000 MHz
    VIC   3:   720x480    59.940 Hz  16:9    31.469 kHz  27.000 MHz
    VIC  17:   720x576    50.000 Hz   4:3    31.250 kHz  27.000 MHz
    VIC   2:   720x480    59.940 Hz   4:3    31.469 kHz  27.000 MHz
    VIC   1:   640x480    59.940 Hz   4:3    31.469 kHz  25.175 MHz
  Audio Data Block:
    Linear PCM:
      Max channels: 2
      Supported sample rates (kHz): 96 88.2 48 44.1 32
      Supported sample sizes (bits): 24 20 16
    Linear PCM:
      Max channels: 6
      Supported sample rates (kHz): 96 88.2 48 44.1 32
      Supported sample sizes (bits): 24 20 16
    Linear PCM:
      Max channels: 8
      Supported sample rates (kHz): 96 88.2 48 44.1 32
      Supported sample sizes (bits): 24 20 16
    AC-3:
      Max channels: 6
      Supported sample rates (kHz): 48 44.1 32
      Maximum bit rate: 680 kb/s
    DTS:
      Max channels: 6
      Supported sample rates (kHz): 48 44.1 32
      Maximum bit rate: 1536 kb/s
  Speaker Allocation Data Block:
    FL/FR - Front Left/Right
    LFE1 - Low Frequency Effects 1
    FC - Front Center
    BL/BR - Back Left/Right
    BC - Back Center
    RLC/RRC - Rear Left/Right of Center (Deprecated)
  Vendor-Specific Data Block (HDMI), OUI 00-0C-03:
    Source physical address: 1.1.0.0
    Supports_AI
  Colorimetry Data Block:
    xvYCC601
    xvYCC709
  Detailed Timing Descriptors:
    DTD 3:  1920x1080i  50.000 Hz  16:9    28.125 kHz  74.250 MHz (698 mm x 392 mm)
                 Hfront  528 Hsync  44 Hback 148 Hpol P
                 Vfront    2 Vsync   5 Vback  15 Vpol P Vfront +0.5 Odd Field
                 Vfront    2 Vsync   5 Vback  15 Vpol P Vback  +0.5 Even Field
    DTD 4:  1920x1080i  60.000 Hz  16:9    33.750 kHz  74.250 MHz (698 mm x 392 mm)
                 Hfront   88 Hsync  44 Hback 148 Hpol P
                 Vfront    2 Vsync   5 Vback  15 Vpol P Vfront +0.5 Odd Field
                 Vfront    2 Vsync   5 Vback  15 Vpol P Vback  +0.5 Even Field
    DTD 5:  1280x720    50.000 Hz  16:9    37.500 kHz  74.250 MHz (698 mm x 392 mm)
                 Hfront  440 Hsync  40 Hback 220 Hpol P
                 Vfront    5 Vsync   5 Vback  20 Vpol P
    DTD 6:  1280x720    60.000 Hz  16:9    45.000 kHz  74.250 MHz (698 mm x 392 mm)
                 Hfront  110 Hsync  40 Hback 220 Hpol P
                 Vfront    5 Vsync   5 Vback  20 Vpol P
Checksum: 0x90

----------------

Warnings:

Block 1, CTA-861 Extension Block:
  IT Video Formats are overscanned by default, but normally this should be underscanned.
  Missing VCDB, needed for Set Selectable RGB Quantization to avoid interop issues.
EDID:
  CTA-861: Multiple native interlaced timings are defined.

Failures:

Block 0, Base EDID:
  Detailed Timing Descriptor #1: Mismatch of image size vs display size: image size is set, but not display size.
  Detailed Timing Descriptor #2: Mismatch of image size vs display size: image size is set, but not display size.
Block 1, CTA-861 Extension Block:
  Detailed Timing Descriptor #3: Mismatch of image size vs display size: image size is set, but not display size.
  Detailed Timing Descriptor #4: Mismatch of image size vs display size: image size is set, but not display size.
  Detailed Timing Descriptor #5: Mismatch of image size vs display size: image size is set, but not display size.
  Detailed Timing Descriptor #6: Mismatch of image size vs display size: image size is set, but not display size.
EDID:
  CTA-861: Native progressive timings are a mix of several resolutions.

EDID conformity: FAIL
