edid-decode (hex):

00 ff ff ff ff ff ff 00 4c a3 42 45 00 00 00 00
00 12 01 00 80 1e 11 78 0a 87 f5 94 57 4f 8c 27
27 50 54 00 00 00 01 01 01 01 01 01 01 01 01 01
01 01 01 01 01 01 41 1c 56 a0 50 00 16 30 30 20
55 00 35 ae 10 00 00 19 00 00 00 0f 00 00 00 00
00 00 00 00 00 23 87 02 64 01 00 00 00 fe 00 53
41 4d 53 55 4e 47 0a 20 20 20 20 20 00 00 00 fe
00 4c 54 4e 31 34 30 41 54 30 32 30 30 30 00 80

----------------

Block 0, Base EDID:
  EDID Structure Version & Revision: 1.0
  Vendor & Product Identification:
    Manufacturer: SEC
    Model: 17730
    Made in: 2008
  Basic Display Parameters & Features:
    Digital display
    Maximum image size: 30 cm x 17 cm
    Gamma: 2.20
    RGB color display
    First detailed timing is preferred timing
  Color Characteristics:
    Red  : 0.5800, 0.3398
    Green: 0.3095, 0.5498
    Blue : 0.1552, 0.1552
    White: 0.3134, 0.3291
  Established Timings I & II: none
  Standard Timings: none
  Detailed Timing Descriptors:
    DTD 1:  1366x768    59.998 Hz 683:384  47.398 kHz  72.330 MHz (309 mm x 174 mm)
                 Hfront   48 Hsync  32 Hback  80 Hpol N
                 Vfront    5 Vsync   5 Vback  12 Vpol N
    Manufacturer-Specified Display Descriptor (0x0f): 00 0f 00 00 00 00 00 00 00 00 00 23 87 02 64 01 '...........#..d.'
    Alphanumeric Data String: 'SAMSUNG'
    Alphanumeric Data String: 'LTN140AT02000'
Checksum: 0x80
