
EDID (hex):
00ffffffffffff001e6d095c34c20100
04220103803c2278eaab45a456509e27
125054210800d1c00101010101010101
010101010101288380a0703829403020
350058542100001a023a801871382d40
582c450058542100001a000000fd0030
901eaa22000a202020202020000000fc
004c4720554c545241474541520a0184
020328f1230907074b01020304111213
1f903f4065030c0010006d1a00000200
309000044a2e4a2e866f80a070384040
3020350058542100001afe5b80a07038
35403020350058542100001a000000ff
000a2020202020202020202020200000
00000000000000000000000000000000
000000000000000000000000000000fa

edid-decode (hex):

00 ff ff ff ff ff ff 00 1e 6d 09 5c 34 c2 01 00
04 22 01 03 80 3c 22 78 ea ab 45 a4 56 50 9e 27
12 50 54 21 08 00 d1 c0 01 01 01 01 01 01 01 01
01 01 01 01 01 01 28 83 80 a0 70 38 29 40 30 20
35 00 58 54 21 00 00 1a 02 3a 80 18 71 38 2d 40
58 2c 45 00 58 54 21 00 00 1a 00 00 00 fd 00 30
90 1e aa 22 00 0a 20 20 20 20 20 20 00 00 00 fc
00 4c 47 20 55 4c 54 52 41 47 45 41 52 0a 01 84

02 03 28 f1 23 09 07 07 4b 01 02 03 04 11 12 13
1f 90 3f 40 65 03 0c 00 10 00 6d 1a 00 00 02 00
30 90 00 04 4a 2e 4a 2e 86 6f 80 a0 70 38 40 40
30 20 35 00 58 54 21 00 00 1a fe 5b 80 a0 70 38
35 40 30 20 35 00 58 54 21 00 00 1a 00 00 00 ff
00 0a 20 20 20 20 20 20 20 20 20 20 20 20 00 00
00 00 00 00 00 00 00 00 00 00 00 00 00 00 00 00
00 00 00 00 00 00 00 00 00 00 00 00 00 00 00 fa

----------------

Block 0, Base EDID:
  EDID Structure Version & Revision: 1.3
  Vendor & Product Identification:
    Manufacturer: GSM
    Model: 23561
    Serial Number: 115252
    Made in: week 4 of 2024
  Basic Display Parameters & Features:
    Digital display
    Maximum image size: 60 cm x 34 cm
    Gamma: 2.20
    DPMS levels: Standby Suspend Off
    RGB color display
    First detailed timing is the preferred timing
  Color Characteristics:
    Red  : 0.6425, 0.3378
    Green: 0.3144, 0.6201
    Blue : 0.1533, 0.0703
    White: 0.3134, 0.3291
  Established Timings I & II:
    DMT 0x04:   640x480    59.940476 Hz   4:3     31.469 kHz     25.175000 MHz
    DMT 0x09:   800x600    60.316541 Hz   4:3     37.879 kHz     40.000000 MHz
    DMT 0x10:  1024x768    60.003840 Hz   4:3     48.363 kHz     65.000000 MHz
  Standard Timings:
    DMT 0x52:  1920x1080   60.000000 Hz  16:9     67.500 kHz    148.500000 MHz
  Detailed Timing Descriptors:
    DTD 1:  1920x1080  143.999177 Hz  16:9    161.423 kHz    335.760000 MHz (600 mm x 340 mm)
                 Hfront   48 Hsync  32 Hback   80 Hpol P
                 Vfront    3 Vsync   5 Vback   33 Vpol N
    DTD 2:  1920x1080   60.000000 Hz  16:9     67.500 kHz    148.500000 MHz (600 mm x 340 mm)
                 Hfront   88 Hsync  44 Hback  148 Hpol P
                 Vfront    4 Vsync   5 Vback   36 Vpol N
    Display Range Limits:
      Monitor ranges (GTF): 48-144 Hz V, 30-170 kHz H, max dotclock 340 MHz
    Display Product Name: 'LG ULTRAGEAR'
  Extension blocks: 1
Checksum: 0x84

----------------

Block 1, CTA-861 Extension Block:
  Revision: 3
  Underscans IT Video Formats by default
  Basic audio support
  Supports YCbCr 4:4:4
  Supports YCbCr 4:2:2
  Native detailed modes: 1
  Audio Data Block:
    Linear PCM:
      Max channels: 2
      Supported sample rates (kHz): 48 44.1 32
      Supported sample sizes (bits): 24 20 16
  Video Data Block:
    VIC   1:   640x480    59.940476 Hz   4:3     31.469 kHz     25.175000 MHz
    VIC   2:   720x480    59.940060 Hz   4:3     31.469 kHz     27.000000 MHz
    VIC   3:   720x480    59.940060 Hz  16:9     31.469 kHz     27.000000 MHz
    VIC   4:  1280x720    60.000000 Hz  16:9     45.000 kHz     74.250000 MHz
    VIC  17:   720x576    50.000000 Hz   4:3     31.250 kHz     27.000000 MHz
    VIC  18:   720x576    50.000000 Hz  16:9     31.250 kHz     27.000000 MHz
    VIC  19:  1280x720    50.000000 Hz  16:9     37.500 kHz     74.250000 MHz
    VIC  31:  1920x1080   50.000000 Hz  16:9     56.250 kHz    148.500000 MHz
    VIC  16:  1920x1080   60.000000 Hz  16:9     67.500 kHz    148.500000 MHz (native)
    VIC  63:  1920x1080  120.000000 Hz  16:9    135.000 kHz    297.000000 MHz
    VIC  64:  1920x1080  100.000000 Hz  16:9    112.500 kHz    297.000000 MHz
  Vendor-Specific Data Block (HDMI), OUI 00-0C-03:
    Source physical address: 1.0.0.0
  Vendor-Specific Data Block (AMD), OUI 00-00-1A:
    Version: 2.0
    Minimum Refresh Rate: 48 Hz
    Maximum Refresh Rate: 144 Hz
    Flags 1.x: 0x00
    Flags 2.x: 0x04
    Maximum luminance: 74 (248.372 cd/m^2)
    Minimum luminance: 46 (0.081 cd/m^2)
    Maximum luminance (without local dimming): 74 (248.372 cd/m^2)
    Minimum luminance (without local dimming): 46 (0.081 cd/m^2)
  Detailed Timing Descriptors:
    DTD 3:  1920x1080  119.982181 Hz  16:9    137.260 kHz    285.500000 MHz (600 mm x 340 mm)
                 Hfront   48 Hsync  32 Hback   80 Hpol P
                 Vfront    3 Vsync   5 Vback   56 Vpol N
    DTD 4:  1920x1080   99.930409 Hz  16:9    113.221 kHz    235.500000 MHz (600 mm x 340 mm)
                 Hfront   48 Hsync  32 Hback   80 Hpol P
                 Vfront    3 Vsync   5 Vback   45 Vpol N
    Display Product Serial Number: ''
Checksum: 0xfa  Unused space in Extension Block: 33 bytes


