edid-decode (hex):

00 ff ff ff ff ff ff 00 5a 63 41 36 e9 cb 00 00
23 08 01 00 68 1b 14 b6 e8 bf c2 9e 58 47 99 24
0f 48 4f ff f8 00 31 59 45 59 01 01 01 01 01 01
01 01 01 01 01 01 10 0e 80 c0 20 e0 1d 10 38 38
13 00 fa bb 00 00 00 1c 56 13 20 00 31 58 19 20
10 50 13 00 fa bb 00 00 00 1e f9 15 20 f8 30 58
1f 20 20 40 13 00 fa bb 00 00 00 1e 64 19 00 40
41 00 26 30 18 88 36 00 fa bb 00 00 00 18 00 d7

----------------

Block 0, Base EDID:
  EDID Structure Version & Revision: 1.0
  Vendor & Product Identification:
    Manufacturer: VSC
    Model: 13889
    Serial Number: ...
    Made in: week 35 of 1998
  Basic Display Parameters & Features:
    Analog display
    Input voltage level: 0.7/0.7 V
    Blank level equals black level
    Sync: Separate
    Maximum image size: 27 cm x 20 cm
    Gamma: 2.82
    DPMS levels: Standby Suspend Off
    RGB color display
  Color Characteristics:
    Red  : 0.6191, 0.3466
    Green: 0.2802, 0.6005
    Blue : 0.1435, 0.0585
    White: 0.2812, 0.3105
  Established Timings I & II:
    IBM     :   720x400    70.081663 Hz   9:5     31.467 kHz     28.320000 MHz
    IBM     :   720x400    87.849542 Hz   9:5     39.444 kHz     35.500000 MHz
    DMT 0x04:   640x480    59.940476 Hz   4:3     31.469 kHz     25.175000 MHz
    Apple   :   640x480    66.666667 Hz   4:3     35.000 kHz     30.240000 MHz
    DMT 0x05:   640x480    72.808802 Hz   4:3     37.861 kHz     31.500000 MHz
    DMT 0x06:   640x480    75.000000 Hz   4:3     37.500 kHz     31.500000 MHz
    DMT 0x08:   800x600    56.250000 Hz   4:3     35.156 kHz     36.000000 MHz
    DMT 0x09:   800x600    60.316541 Hz   4:3     37.879 kHz     40.000000 MHz
    DMT 0x0a:   800x600    72.187572 Hz   4:3     48.077 kHz     50.000000 MHz
    DMT 0x0b:   800x600    75.000000 Hz   4:3     46.875 kHz     49.500000 MHz
    Apple   :   832x624    74.551266 Hz   4:3     49.726 kHz     57.284000 MHz
    DMT 0x0f:  1024x768i   86.957532 Hz   4:3     35.522 kHz     44.900000 MHz
    DMT 0x10:  1024x768    60.003840 Hz   4:3     48.363 kHz     65.000000 MHz
  Standard Timings:
    DMT 0x07:   640x480    85.008312 Hz   4:3     43.269 kHz     36.000000 MHz
    DMT 0x0c:   800x600    85.061274 Hz   4:3     53.674 kHz     56.250000 MHz
  Detailed Timing Descriptors:
    DTD 1:   640x480    85.008312 Hz   4:3     43.269 kHz     36.000000 MHz (250 mm x 187 mm)
                 Hfront   56 Hsync  56 Hback   80 Hpol N
                 Vfront    1 Vsync   3 Vback   25 Vpol P
    DTD 2:   800x600    75.000000 Hz   4:3     46.875 kHz     49.500000 MHz (250 mm x 187 mm)
                 Hfront   16 Hsync  80 Hback  160 Hpol P
                 Vfront    1 Vsync   3 Vback   21 Vpol P
    DTD 3:   800x600    85.061274 Hz   4:3     53.674 kHz     56.250000 MHz (250 mm x 187 mm)
                 Hfront   32 Hsync  64 Hback  152 Hpol P
                 Vfront    1 Vsync   3 Vback   27 Vpol P
    DTD 4:  1024x768    60.003840 Hz   4:3     48.363 kHz     65.000000 MHz (250 mm x 187 mm)
                 Hfront   24 Hsync 136 Hback  160 Hpol N
                 Vfront    3 Vsync   6 Vback   29 Vpol N
Checksum: 0xd7

----------------

Warnings:

Block 0, Base EDID:
  EDID Structure Version & Revision: EDID 1.0 is deprecated, do not use.
  Detailed Timing Descriptor #1: DTD is similar but not identical to DMT 0x07.

Failures:

Block 0, Base EDID:
  Detailed Timing Descriptor #1: Mismatch of image size 250x187 mm vs display size 270x200 mm.
  Detailed Timing Descriptor #2: Mismatch of image size 250x187 mm vs display size 270x200 mm.
  Detailed Timing Descriptor #3: Mismatch of image size 250x187 mm vs display size 270x200 mm.
  Detailed Timing Descriptor #4: Mismatch of image size 250x187 mm vs display size 270x200 mm.

EDID conformity: FAIL
