edid-decode (hex):

00 ff ff ff ff ff ff 00 30 e4 6f 05 00 00 00 00
00 1a 01 04 a5 1a 11 78 03 a4 a5 a4 56 4d 9d 28
0d 50 54 00 00 00 01 01 01 01 01 01 01 01 01 01
01 01 01 01 01 01 3f 7f b0 a0 a0 20 34 70 30 20
3a 00 04 ad 10 00 00 1b e2 54 b0 a0 a0 20 34 70
30 20 3a 00 04 ad 10 00 00 1b 00 00 00 00 00 00
00 00 00 00 00 00 00 00 00 00 00 00 00 00 00 02
00 0c 26 ff 0a 3c e1 23 31 32 e1 00 00 00 00 15

----------------

Block 0, Base EDID:
  EDID Structure Version & Revision: 1.4
  Vendor & Product Identification:
    Manufacturer: LGD
    Model: 1391
    Made in: 2016
  Basic Display Parameters & Features:
    Digital display
    Bits per primary color channel: 8
    DisplayPort interface
    Maximum image size: 26 cm x 17 cm
    Gamma: 2.20
    Supported color formats: RGB 4:4:4
    First detailed timing includes the native pixel format and preferred refresh rate
    Display is continuous frequency
  Color Characteristics:
    Red  : 0.6425, 0.3378
    Green: 0.3017, 0.6132
    Blue : 0.1582, 0.0527
    White: 0.3134, 0.3291
  Established Timings I & II: none
  Standard Timings: none
  Detailed Timing Descriptors:
    DTD 1:  2736x1824   59.959 Hz   3:2   112.483 kHz 325.750 MHz (260 mm x 173 mm)
                 Hfront   48 Hsync  32 Hback  80 Hpol P
                 Vfront    3 Vsync  10 Vback  39 Vpol N
    DTD 2:  2736x1824   39.997 Hz   3:2    75.035 kHz 217.300 MHz (260 mm x 173 mm)
                 Hfront   48 Hsync  32 Hback  80 Hpol P
                 Vfront    3 Vsync  10 Vback  39 Vpol N
    Empty Descriptor
    Manufacturer-Specified Display Descriptor (0x02): 00 02 00 0c 26 ff 0a 3c e1 23 31 32 e1 00 00 00 '....&..<.#12....'
Checksum: 0x15

----------------

Failures:

Block 0, Base EDID:
  Empty Descriptor: Use Dummy Descriptor instead of all zeroes.
  Missing Display Product Name.
  Missing Display Range Limits Descriptor.

EDID conformity: FAIL
