
EDID (hex):
00ffffffffffff00220e643501010101
071d0104a53c22783aa595a65650a026
0d5054254b00d1c0a9c081c0d100b300
95008100a940565e00a0a0a029503020
350055502100001a000000fd00324c1e
5a1e010a202020202020000000fc0048
50203237710a202020202020000000ff
00434e4b3930373156574a0a2020009d

Extracted contents:
header:          00 ff ff ff ff ff ff 00
serial number:   22 0e 64 35 01 01 01 01 07 1d
version:         01 04
basic params:    a5 3c 22 78 3a
chroma info:     a5 95 a6 56 50 a0 26 0d 50 54
established:     25 4b 00
standard:        d1 c0 a9 c0 81 c0 d1 00 b3 00 95 00 81 00 a9 40
descriptor 1:    56 5e 00 a0 a0 a0 29 50 30 20 35 00 55 50 21 00 00 1a
descriptor 2:    00 00 00 fd 00 32 4c 1e 5a 1e 01 0a 20 20 20 20 20 20
descriptor 3:    00 00 00 fc 00 48 50 20 32 37 71 0a 20 20 20 20 20 20
descriptor 4:    00 00 00 ff 00 43 4e 4b 39 30 37 31 56 57 4a 0a 20 20
extensions:      00
checksum:        9d

EDID version: 1.4
Manufacturer: HPN Model 3564 Serial Number --
Made in week 7 of 2019
Digital display
8 bits per primary color channel
DisplayPort interface
Maximum image size: 60 cm x 34 cm
Gamma: 2.20
DPMS levels: Off
Supported color formats: RGB 4:4:4, YCrCb 4:4:4, YCrCb 4:2:2
First detailed timing includes the native pixel format and preferred refresh rate
Display x,y Chromaticity:
  Red:   0.6503, 0.3378
  Green: 0.3134, 0.6259
  Blue:  0.1503, 0.0517
  White: 0.3134, 0.3291
Established timings supported:
  640x480@60Hz 4:3 HorFreq: 31469 Hz Clock: 25.175 MHz
  640x480@75Hz 4:3 HorFreq: 37500 Hz Clock: 31.500 MHz
  800x600@60Hz 4:3 HorFreq: 37900 Hz Clock: 40.000 MHz
  800x600@75Hz 4:3 HorFreq: 46900 Hz Clock: 49.500 MHz
  1024x768@60Hz 4:3 HorFreq: 48400 Hz Clock: 65.000 MHz
  1024x768@75Hz 4:3 HorFreq: 60000 Hz Clock: 78.750 MHz
  1280x1024@75Hz 5:4 HorFreq: 80000 Hz Clock: 135.000 MHz
Standard timings supported:
  1920x1080@60Hz 16:9
  1600x900@60Hz 16:9
  1280x720@60Hz 16:9
  1920x1200@60Hz 16:10 HorFreq: 74000 Hz Clock: 154.000 MHz
  1680x1050@60Hz 16:10 HorFreq: 64700 Hz Clock: 119.000 MHz
  1440x900@60Hz 16:10 HorFreq: 55500 Hz Clock: 88.750 MHz
  1280x800@60Hz 16:10
  1600x1200@60Hz 4:3 HorFreq: 75000 Hz Clock: 162.000 MHz
Detailed mode: Clock 241.500 MHz, 597 mm x 336 mm
               2560 2608 2640 2720 hborder 0
               1440 1443 1448 1481 vborder 0
               +hsync -vsync 
               VertFreq: 59 Hz, HorFreq: 88786 Hz
Monitor ranges (bare limits): 50-76Hz V, 30-90kHz H, max dotclock 300MHz
Monitor name: HP 27q
Serial number: --
Checksum: 0x9d (valid)
