
EDID (hex):
00ffffffffffff0030e4080600000000
001c0104a51f117802e085a3544e9b26
0e505400000001010101010101010101
0101010101012e3680a070381f403020
350035ae1000001a542b80a070381f40
3020350035ae1000001a000000fe004c
4720446973706c61790a2020000000fe
004c503134305746392d5350463100d5

Extracted contents:
header:          00 ff ff ff ff ff ff 00
serial number:   30 e4 08 06 00 00 00 00 00 1c
version:         01 04
basic params:    a5 1f 11 78 02
chroma info:     e0 85 a3 54 4e 9b 26 0e 50 54
established:     00 00 00
standard:        01 01 01 01 01 01 01 01 01 01 01 01 01 01 01 01
descriptor 1:    2e 36 80 a0 70 38 1f 40 30 20 35 00 35 ae 10 00 00 1a
descriptor 2:    54 2b 80 a0 70 38 1f 40 30 20 35 00 35 ae 10 00 00 1a
descriptor 3:    00 00 00 fe 00 4c 47 20 44 69 73 70 6c 61 79 0a 20 20
descriptor 4:    00 00 00 fe 00 4c 50 31 34 30 57 46 39 2d 53 50 46 31
extensions:      00
checksum:        d5

EDID version: 1.4
Manufacturer: LGD Model 608 Serial Number --
Made in year 2018
Digital display
8 bits per primary color channel
DisplayPort interface
Maximum image size: 31 cm x 17 cm
Gamma: 2.20
Supported color formats: RGB 4:4:4
First detailed timing includes the native pixel format and preferred refresh rate
Display x,y Chromaticity:
  Red:   0.6396, 0.3300
  Green: 0.3046, 0.6054
  Blue:  0.1503, 0.0546
  White: 0.3134, 0.3291
Established timings supported:
Standard timings supported:
Detailed mode: Clock 138.700 MHz, 309 mm x 174 mm
               1920 1968 2000 2080 hborder 0
               1080 1083 1088 1111 vborder 0
               +hsync -vsync 
               VertFreq: 60 Hz, HorFreq: 66682 Hz
Detailed mode: Clock 110.920 MHz, 309 mm x 174 mm
               1920 1968 2000 2080 hborder 0
               1080 1083 1088 1111 vborder 0
               +hsync -vsync 
               VertFreq: 47 Hz, HorFreq: 53326 Hz
ASCII string: LG Display
ASCII string: LP140WF9-SPF1
Checksum: 0xd5 (valid)
EDID block does NOT conform to EDID 1.4!
	Missing name descriptor
	Missing monitor ranges
