edid-decode (hex):

00 ff ff ff ff ff ff 00 04 72 30 02 bc 38 30 04
2b 14 01 03 08 33 1d 78 ea 90 85 a3 58 53 9f 26
0f 50 54 bf 6f 00 71 4f 81 c0 d1 c0 b3 00 81 80
01 01 01 01 01 01 02 3a 80 18 71 38 2d 40 58 2c
45 00 fd 1e 11 00 00 18 00 00 00 fc 00 4d 32 33
30 48 44 4c 0a 20 20 20 20 20 00 00 00 fd 00 38
4c 1e 4b 0f 00 0a 20 20 20 20 20 20 00 00 00 ff
00 4d 41 51 30 43 30 30 36 34 30 30 30 0a 00 15

00 ff ff ff ff ff ff 00 04 72 30 02 bc 38 30 04
2b 14 01 03 08 33 1d 78 ea 90 85 a3 58 53 9f 26
0f 50 54 bf 6f 00 71 4f 81 c0 d1 c0 b3 00 81 80
01 01 01 01 01 01 02 3a 80 18 71 38 2d 40 58 2c
45 00 fd 1e 11 00 00 18 00 00 00 fc 00 4d 32 33
30 48 44 4c 0a 20 20 20 20 20 00 00 00 fd 00 38
4c 1e 4b 0f 00 0a 20 20 20 20 20 20 00 00 00 ff
00 4d 41 51 30 43 30 30 36 34 30 30 30 0a 00 15

----------------

Block 0, Base EDID:
  EDID Structure Version & Revision: 1.3
  Vendor & Product Identification:
    Manufacturer: ACR
    Model: 560
    Serial Number: ...
    Made in: week 43 of 2010
  Basic Display Parameters & Features:
    Analog display
    Signal Level Standard: 0.700 : 0.300 : 1.000 V p-p
    Blank level equals black level
    Sync: Separate
    Maximum image size: 51 cm x 29 cm
    Gamma: 2.20
    DPMS levels: Standby Suspend Off
    RGB color display
    First detailed timing is the preferred timing
  Color Characteristics:
    Red  : 0.6386, 0.3447
    Green: 0.3242, 0.6210
    Blue : 0.1503, 0.0585
    White: 0.3134, 0.3291
  Established Timings I & II:
    IBM     :   720x400    70.081663 Hz   9:5     31.467 kHz     28.320000 MHz
    DMT 0x04:   640x480    59.940476 Hz   4:3     31.469 kHz     25.175000 MHz
    Apple   :   640x480    66.666667 Hz   4:3     35.000 kHz     30.240000 MHz
    DMT 0x05:   640x480    72.808802 Hz   4:3     37.861 kHz     31.500000 MHz
    DMT 0x06:   640x480    75.000000 Hz   4:3     37.500 kHz     31.500000 MHz
    DMT 0x08:   800x600    56.250000 Hz   4:3     35.156 kHz     36.000000 MHz
    DMT 0x09:   800x600    60.316541 Hz   4:3     37.879 kHz     40.000000 MHz
    DMT 0x0b:   800x600    75.000000 Hz   4:3     46.875 kHz     49.500000 MHz
    Apple   :   832x624    74.551266 Hz   4:3     49.726 kHz     57.284000 MHz
    DMT 0x10:  1024x768    60.003840 Hz   4:3     48.363 kHz     65.000000 MHz
    DMT 0x11:  1024x768    70.069359 Hz   4:3     56.476 kHz     75.000000 MHz
    DMT 0x12:  1024x768    75.028582 Hz   4:3     60.023 kHz     78.750000 MHz
    DMT 0x24:  1280x1024   75.024675 Hz   5:4     79.976 kHz    135.000000 MHz
  Standard Timings:
    DMT 0x15:  1152x864    75.000000 Hz   4:3     67.500 kHz    108.000000 MHz
    DMT 0x55:  1280x720    60.000000 Hz  16:9     45.000 kHz     74.250000 MHz
    DMT 0x52:  1920x1080   60.000000 Hz  16:9     67.500 kHz    148.500000 MHz
    DMT 0x3a:  1680x1050   59.954250 Hz  16:10    65.290 kHz    146.250000 MHz
    DMT 0x23:  1280x1024   60.019740 Hz   5:4     63.981 kHz    108.000000 MHz
  Detailed Timing Descriptors:
    DTD 1:  1920x1080   60.000000 Hz  16:9     67.500 kHz    148.500000 MHz (509 mm x 286 mm)
                 Hfront   88 Hsync  44 Hback  148 Hpol N
                 Vfront    4 Vsync   5 Vback   36 Vpol N
    Display Product Name: 'M230HDL'
    Display Range Limits:
      Monitor ranges (GTF): 56-76 Hz V, 30-75 kHz H, max dotclock 150 MHz
    Display Product Serial Number: ...
Checksum: 0x15

----------------

Block 1, Unknown EDID Extension Block 0x00:
  00 ff ff ff ff ff ff 00 04 72 30 02 bc 38 30 04 '.........r0..80.'
  2b 14 01 03 08 33 1d 78 ea 90 85 a3 58 53 9f 26 '+....3.x....XS.&'
  0f 50 54 bf 6f 00 71 4f 81 c0 d1 c0 b3 00 81 80 '.PT.o.qO........'
  01 01 01 01 01 01 02 3a 80 18 71 38 2d 40 58 2c '.......:..q8-@X,'
  45 00 fd 1e 11 00 00 18 00 00 00 fc 00 4d 32 33 'E............M23'
  30 48 44 4c 0a 20 20 20 20 20 00 00 00 fd 00 38 '0HDL.     .....8'
  4c 1e 4b 0f 00 0a 20 20 20 20 20 20 00 00 00 ff 'L.K...      ....'
  00 4d 41 51 30 43 30 30 36 34 30 30 30 0a 00 15 '.MAQ0C0064000...'
Checksum: 0x15

----------------

Warnings:

Block 0, Base EDID:
  Detailed Timing Descriptor #1: DTD is similar but not identical to VIC 16.

Failures:

Block 1, Base EDID:
  Unknown Extension Block.
EDID:
  Base EDID: Some timings are out of range of the Monitor Ranges:
    Horizontal Freq: 31.466 - 79.976 kHz (Monitor: 30.000 - 75.000 kHz)
  Base EDID: EDID specified 0 extension block(s), but found 1 extension block(s).

EDID conformity: FAIL
