edid-decode (hex):

00 ff ff ff ff ff ff 00 1e 6d bd 56 01 01 01 01
0b 12 01 03 80 3c 22 78 0a 60 e5 a9 51 35 ab 24
11 50 54 a5 6f 00 81 80 81 8f 71 40 b3 00 81 4f
d1 c0 01 01 01 01 1a 36 80 a0 70 38 1f 40 30 20
35 00 56 50 21 00 00 1a 21 39 90 30 62 1a 27 40
68 b0 36 00 56 50 21 00 00 1c 00 00 00 fd 00 38
4b 1e 53 11 00 0a 20 20 20 20 20 20 00 00 00 fc
00 4d 32 37 39 34 44 0a 20 20 20 20 20 20 01 f8

00 ff ff ff ff ff ff 00 1e 6d bd 56 01 01 01 01
0b 12 01 03 80 3c 22 78 0a 60 e5 a9 51 35 ab 24
11 50 54 a5 6f 00 81 80 81 8f 71 40 b3 00 81 4f
d1 c0 01 01 01 01 1a 36 80 a0 70 38 1f 40 30 20
35 00 56 50 21 00 00 1a 21 39 90 30 62 1a 27 40
68 b0 36 00 56 50 21 00 00 1c 00 00 00 fd 00 38
4b 1e 53 11 00 0a 20 20 20 20 20 20 00 00 00 fc
00 4d 32 37 39 34 44 0a 20 20 20 20 20 20 01 f8

----------------

Block 0, Base EDID:
  EDID Structure Version & Revision: 1.3
  Vendor & Product Identification:
    Manufacturer: GSM
    Model: 22205
    Serial Number: ...
    Made in: week 11 of 2008
  Basic Display Parameters & Features:
    Digital display
    Maximum image size: 60 cm x 34 cm
    Gamma: 2.20
    RGB color display
    First detailed timing is the preferred timing
  Color Characteristics:
    Red  : 0.6611, 0.3183
    Green: 0.2070, 0.6679
    Blue : 0.1435, 0.0683
    White: 0.3134, 0.3291
  Established Timings I & II:
    IBM     :   720x400    70.081663 Hz   9:5     31.467 kHz     28.320000 MHz
    DMT 0x04:   640x480    59.940476 Hz   4:3     31.469 kHz     25.175000 MHz
    DMT 0x06:   640x480    75.000000 Hz   4:3     37.500 kHz     31.500000 MHz
    DMT 0x09:   800x600    60.316541 Hz   4:3     37.879 kHz     40.000000 MHz
    DMT 0x0b:   800x600    75.000000 Hz   4:3     46.875 kHz     49.500000 MHz
    Apple   :   832x624    74.551266 Hz   4:3     49.726 kHz     57.284000 MHz
    DMT 0x10:  1024x768    60.003840 Hz   4:3     48.363 kHz     65.000000 MHz
    DMT 0x11:  1024x768    70.069359 Hz   4:3     56.476 kHz     75.000000 MHz
    DMT 0x12:  1024x768    75.028582 Hz   4:3     60.023 kHz     78.750000 MHz
    DMT 0x24:  1280x1024   75.024675 Hz   5:4     79.976 kHz    135.000000 MHz
  Standard Timings:
    DMT 0x23:  1280x1024   60.019740 Hz   5:4     63.981 kHz    108.000000 MHz
    DMT 0x24:  1280x1024   75.024675 Hz   5:4     79.976 kHz    135.000000 MHz
    GTF     :  1152x864    60.000000 Hz   4:3     53.700 kHz     81.624000 MHz
    DMT 0x3a:  1680x1050   59.954250 Hz  16:10    65.290 kHz    146.250000 MHz
    GTF     :  1280x960    74.999884 Hz   4:3     75.150 kHz    129.859000 MHz
    DMT 0x52:  1920x1080   60.000000 Hz  16:9     67.500 kHz    148.500000 MHz
  Detailed Timing Descriptors:
    DTD 1:  1920x1080   59.933878 Hz  16:9     66.587 kHz    138.500000 MHz (598 mm x 336 mm)
                 Hfront   48 Hsync  32 Hback   80 Hpol P
                 Vfront    3 Vsync   5 Vback   23 Vpol N
    DTD 2:  1680x1050   59.954250 Hz  16:10    65.290 kHz    146.250000 MHz (598 mm x 336 mm)
                 Hfront  104 Hsync 176 Hback  280 Hpol N
                 Vfront    3 Vsync   6 Vback   30 Vpol P
    Display Range Limits:
      Monitor ranges (GTF): 56-75 Hz V, 30-83 kHz H, max dotclock 170 MHz
    Display Product Name: 'M2794D'
  Extension blocks: 1
Checksum: 0xf8

----------------

Block 1, Unknown EDID Extension Block 0x00:
  00 ff ff ff ff ff ff 00 1e 6d bd 56 01 01 01 01 '.........m.V....'
  0b 12 01 03 80 3c 22 78 0a 60 e5 a9 51 35 ab 24 '.....<"x.`..Q5.$'
  11 50 54 a5 6f 00 81 80 81 8f 71 40 b3 00 81 4f '.PT.o.....q@...O'
  d1 c0 01 01 01 01 1a 36 80 a0 70 38 1f 40 30 20 '.......6..p8.@0 '
  35 00 56 50 21 00 00 1a 21 39 90 30 62 1a 27 40 '5.VP!...!9.0b.'@'
  68 b0 36 00 56 50 21 00 00 1c 00 00 00 fd 00 38 'h.6.VP!........8'
  4b 1e 53 11 00 0a 20 20 20 20 20 20 00 00 00 fc 'K.S...      ....'
  00 4d 32 37 39 34 44 0a 20 20 20 20 20 20 01 f8 '.M2794D.      ..'
Checksum: 0xf8

----------------

Failures:

Block 1, Base EDID:
  Unknown Extension Block.

EDID conformity: FAIL
