edid-decode (hex):

00 ff ff ff ff ff ff 00 06 af 2d 52 00 00 00 00
00 1b 01 04 95 1d 11 78 02 a4 15 9e 55 4e 9b 26
0f 50 54 00 00 00 01 01 01 01 01 01 01 01 01 01
01 01 01 01 01 01 b4 37 80 a0 70 38 3e 40 3a 2a
35 00 25 a5 10 00 00 18 b4 37 80 a0 70 38 7a 42
3a 2a 35 00 25 a5 10 00 00 18 00 00 00 00 00 00
00 00 00 00 00 00 00 00 00 00 00 00 00 00 00 02
00 14 30 ff 12 3c c8 4e 09 21 c8 20 20 20 00 46

----------------

Block 0, Base EDID:
  EDID Structure Version & Revision: 1.4
  Vendor & Product Identification:
    Manufacturer: AUO
    Model: 21037
    Made in: 2017
  Basic Display Parameters & Features:
    Digital display
    Bits per primary color channel: 6
    DisplayPort interface
    Maximum image size: 29 cm x 17 cm
    Gamma: 2.20
    Supported color formats: RGB 4:4:4
    First detailed timing includes the native pixel format and preferred refresh rate
  Color Characteristics:
    Red  : 0.6191, 0.3339
    Green: 0.3056, 0.6054
    Blue : 0.1484, 0.0595
    White: 0.3134, 0.3291
  Established Timings I & II: none
  Standard Timings: none
  Detailed Timing Descriptors:
    DTD 1:  1920x1080   60.033 Hz  16:9    68.558 kHz 142.600 MHz (293 mm x 165 mm)
                 Hfront   58 Hsync  42 Hback  60 Hpol N
                 Vfront    3 Vsync   5 Vback  54 Vpol N
    DTD 2:  1920x1080   39.999 Hz  16:9    68.558 kHz 142.600 MHz (293 mm x 165 mm)
                 Hfront   58 Hsync  42 Hback  60 Hpol N
                 Vfront    3 Vsync   5 Vback 626 Vpol N
    Empty Descriptor
    Manufacturer-Specified Display Descriptor (0x02): 00 02 00 14 30 ff 12 3c c8 4e 09 21 c8 20 20 20 '....0..<.N.!.   '
Checksum: 0x46

----------------

Failures:

Block 0, Base EDID:
  Empty Descriptor: Use Dummy Descriptor instead of all zeroes.
  Missing Display Product Name.

EDID conformity: FAIL
