
EDID (hex):
00ffffffffffff001e6d643b9ea30000
1b0d0103081e1778ea9c5d99584c9326
214c54bfee00314f454f614f01010101
01010101010164190040410026301888
360030e410000018000000ff00333036
4a4534313838360a2020000000fd0032
4b1e3f08000a202020202020000000fc
004c31353132530a20202020202000ec

Extracted contents:
header:          00 ff ff ff ff ff ff 00
serial number:   1e 6d 64 3b 9e a3 00 00 1b 0d
version:         01 03
basic params:    08 1e 17 78 ea
chroma info:     9c 5d 99 58 4c 93 26 21 4c 54
established:     bf ee 00
standard:        31 4f 45 4f 61 4f 01 01 01 01 01 01 01 01 01 01
descriptor 1:    64 19 00 40 41 00 26 30 18 88 36 00 30 e4 10 00 00 18
descriptor 2:    00 00 00 ff 00 33 30 36 4a 45 34 31 38 38 36 0a 20 20
descriptor 3:    00 00 00 fd 00 32 4b 1e 3f 08 00 0a 20 20 20 20 20 20
descriptor 4:    00 00 00 fc 00 4c 31 35 31 32 53 0a 20 20 20 20 20 20
extensions:      00
checksum:        ec

EDID version: 1.3
Manufacturer: GSM Model 3b64 Serial Number --
Analog display, Input voltage level: 0.7/0.3 V
Sync: Separate 
Maximum image size: 30 cm x 23 cm
Gamma: 2.20
DPMS levels: Standby Suspend Off
RGB color display
First detailed timing is preferred timing
Display x,y Chromaticity:
  Red:   0.5996, 0.3447
  Green: 0.2998, 0.5742
  Blue:  0.1494, 0.1298
  White: 0.2998, 0.3291
Established timings supported:
  720x400@70Hz 9:5 HorFreq: 31469 Hz Clock: 28.320 MHz
  640x480@60Hz 4:3 HorFreq: 31469 Hz Clock: 25.175 MHz
  640x480@67Hz 4:3 HorFreq: 35000 Hz Clock: 30.240 MHz
  640x480@72Hz 4:3 HorFreq: 37900 Hz Clock: 31.500 MHz
  640x480@75Hz 4:3 HorFreq: 37500 Hz Clock: 31.500 MHz
  800x600@56Hz 4:3 HorFreq: 35200 Hz Clock: 36.000 MHz
  800x600@60Hz 4:3 HorFreq: 37900 Hz Clock: 40.000 MHz
  800x600@72Hz 4:3 HorFreq: 48100 Hz Clock: 50.000 MHz
  800x600@75Hz 4:3 HorFreq: 46900 Hz Clock: 49.500 MHz
  832x624@75Hz 4:3 HorFreq: 49726 Hz Clock: 57.284 MHz
  1024x768@60Hz 4:3 HorFreq: 48400 Hz Clock: 65.000 MHz
  1024x768@70Hz 4:3 HorFreq: 56500 Hz Clock: 75.000 MHz
  1024x768@75Hz 4:3 HorFreq: 60000 Hz Clock: 78.750 MHz
Standard timings supported:
  640x480@75Hz 4:3 HorFreq: 37500 Hz Clock: 31.500 MHz
  800x600@75Hz 4:3 HorFreq: 46900 Hz Clock: 49.500 MHz
  1024x768@75Hz 4:3 HorFreq: 60000 Hz Clock: 78.750 MHz
Detailed mode: Clock 65.000 MHz, 304 mm x 228 mm
               1024 1048 1184 1344 hborder 0
                768  771  777  806 vborder 0
               -hsync -vsync 
               VertFreq: 60 Hz, HorFreq: 48363 Hz
Serial number: --
Monitor ranges (GTF): 50-75Hz V, 30-63kHz H, max dotclock 80MHz
Monitor name: L1512S
Checksum: 0xec (valid)
EDID block does not conform at all!
	Bad year of manufacture


