edid-decode (hex):

00 ff ff ff ff ff ff 00 09 e5 4e 07 00 00 00 00
01 1b 01 04 95 22 13 78 02 de 50 a3 54 4c 99 26
0f 50 54 00 00 00 01 01 01 01 01 01 01 01 01 01
01 01 01 01 01 01 41 37 80 cc 70 38 1e 40 30 20
36 00 58 c1 10 00 00 1a f5 26 80 0b 71 38 3c 40
64 64 44 05 58 c1 10 00 00 1a 00 00 00 00 00 00
00 00 00 00 00 00 00 00 00 00 00 00 00 00 00 02
00 08 23 ed 0b 3c c8 16 4d 31 c8 00 00 00 00 34

----------------

Block 0, Base EDID:
  EDID Structure Version & Revision: 1.4
  Vendor & Product Identification:
    Manufacturer: BOE
    Model: 1870
    Made in: week 1 of 2017
  Basic Display Parameters & Features:
    Digital display
    Bits per primary color channel: 6
    DisplayPort interface
    Maximum image size: 34 cm x 19 cm
    Gamma: 2.20
    Supported color formats: RGB 4:4:4
    First detailed timing includes the native pixel format and preferred refresh rate
  Color Characteristics:
    Red  : 0.6396, 0.3291
    Green: 0.2998, 0.5996
    Blue : 0.1494, 0.0595
    White: 0.3125, 0.3281
  Established Timings I & II: none
  Standard Timings: none
  Detailed Timing Descriptors:
    DTD 1:  1920x1080   59.996437 Hz  16:9     66.596 kHz    141.450000 MHz (344 mm x 193 mm)
                 Hfront   48 Hsync  32 Hback  124 Hpol P
                 Vfront    3 Vsync   6 Vback   21 Vpol N
    DTD 2:  1920x1080   40.001123 Hz  16:9     45.601 kHz     99.730000 MHz (344 mm x 193 mm)
                 Hfront  100 Hsync 100 Hback   67 Hpol P
                 Vfront   20 Vsync  20 Vback   20 Vpol N
    Empty Descriptor
    Manufacturer-Specified Display Descriptor (0x02): 00 02 00 08 23 ed 0b 3c c8 16 4d 31 c8 00 00 00 '....#..<..M1....'
Checksum: 0x34

----------------

Failures:

Block 0, Base EDID:
  Empty Descriptor: Use Dummy Descriptor instead of all zeroes.
  Missing Display Product Name.

EDID conformity: FAIL
