
EDID (hex):
00ffffffffffff002163501801000000
12140103802917782eb1a5a1584f9526
165054afce0081c08100010101010101
010101010101342150b051001b304070
360030e41000001a000000ff00303030
3030303031303030300a000000fd003c
551e3e08000a202020202020000000fc
000a202020202020202020202020008a

Extracted contents:
header:          00 ff ff ff ff ff ff 00
serial number:   21 63 50 18 01 00 00 00 12 14
version:         01 03
basic params:    80 29 17 78 2e
chroma info:     b1 a5 a1 58 4f 95 26 16 50 54
established:     af ce 00
standard:        81 c0 81 00 01 01 01 01 01 01 01 01 01 01 01 01
descriptor 1:    34 21 50 b0 51 00 1b 30 40 70 36 00 30 e4 10 00 00 1a
descriptor 2:    00 00 00 ff 00 30 30 30 30 30 30 30 31 30 30 30 30 0a
descriptor 3:    00 00 00 fd 00 3c 55 1e 3e 08 00 0a 20 20 20 20 20 20
descriptor 4:    00 00 00 fc 00 0a 20 20 20 20 20 20 20 20 20 20 20 20
extensions:      00
checksum:        8a

EDID version: 1.3
Manufacturer: HKC Model 1850 Serial Number --
Made in week 18 of 2010
Digital display
Maximum image size: 41 cm x 23 cm
Gamma: 2.20
DPMS levels: Off
RGB color display
Default (sRGB) color space is primary color space
First detailed timing is preferred timing
Display x,y Chromaticity:
  Red:   0.6308, 0.3466
  Green: 0.3085, 0.5830
  Blue:  0.1503, 0.0878
  White: 0.3134, 0.3291
Established timings supported:
  720x400@70Hz 9:5 HorFreq: 31469 Hz Clock: 28.320 MHz
  640x480@60Hz 4:3 HorFreq: 31469 Hz Clock: 25.175 MHz
  640x480@72Hz 4:3 HorFreq: 37900 Hz Clock: 31.500 MHz
  640x480@75Hz 4:3 HorFreq: 37500 Hz Clock: 31.500 MHz
  800x600@56Hz 4:3 HorFreq: 35200 Hz Clock: 36.000 MHz
  800x600@60Hz 4:3 HorFreq: 37900 Hz Clock: 40.000 MHz
  800x600@72Hz 4:3 HorFreq: 48100 Hz Clock: 50.000 MHz
  800x600@75Hz 4:3 HorFreq: 46900 Hz Clock: 49.500 MHz
  1024x768@60Hz 4:3 HorFreq: 48400 Hz Clock: 65.000 MHz
  1024x768@70Hz 4:3 HorFreq: 56500 Hz Clock: 75.000 MHz
  1024x768@75Hz 4:3 HorFreq: 60000 Hz Clock: 78.750 MHz
Standard timings supported:
  1280x720@60Hz 16:9
  1280x800@60Hz 16:10
Detailed mode: Clock 85.000 MHz, 304 mm x 228 mm
               1360 1424 1536 1792 hborder 0
                768  771  777  795 vborder 0
               +hsync -vsync 
               VertFreq: 59 Hz, HorFreq: 47433 Hz
Serial number: --
Monitor ranges (GTF): 60-85Hz V, 30-62kHz H, max dotclock 80MHz
Monitor name: 
Checksum: 0x8a (valid)
EDID block does NOT conform to EDID 1.3!
	sRGB is signaled, but the chromaticities do not match
One or more of the timings is out of range of the Monitor Ranges:
  Vertical Freq: 56 - 75 Hz
  Horizontal Freq: 31469 - 60000 Hz
  Maximum Clock: 85.000 MHz
