
EDID (hex):
00ffffffffffff004ca3423200000000
000f0103801e12780a87f594574f8c27
27505400000001010101010101010101
010101010101ed1a0080500030301030
360031b7100000190000000f00000000
0000000000126e132003000000fe0053
414d53554e470a2020202020000000fe
004c544e31343057312d4c30310a00e4

edid-decode (hex):

00 ff ff ff ff ff ff 00 4c a3 42 32 00 00 00 00
00 0f 01 03 80 1e 12 78 0a 87 f5 94 57 4f 8c 27
27 50 54 00 00 00 01 01 01 01 01 01 01 01 01 01
01 01 01 01 01 01 ed 1a 00 80 50 00 30 30 10 30
36 00 31 b7 10 00 00 19 00 00 00 0f 00 00 00 00
00 00 00 00 00 12 6e 13 20 03 00 00 00 fe 00 53
41 4d 53 55 4e 47 0a 20 20 20 20 20 00 00 00 fe
00 4c 54 4e 31 34 30 57 31 2d 4c 30 31 0a 00 e4

----------------

Block 0, Base EDID:
  EDID Structure Version & Revision: 1.3
  Vendor & Product Identification:
    Manufacturer: SEC
    Model: 12866
    Made in: 2005
  Basic Display Parameters & Features:
    Digital display
    Maximum image size: 30 cm x 18 cm
    Gamma: 2.20
    RGB color display
    First detailed timing is the preferred timing
  Color Characteristics:
    Red  : 0.5800, 0.3398
    Green: 0.3095, 0.5498
    Blue : 0.1552, 0.1552
    White: 0.3134, 0.3291
  Established Timings I & II: none
  Standard Timings: none
  Detailed Timing Descriptors:
    DTD 1:  1280x768    59.995056 Hz   5:3     48.956 kHz     68.930000 MHz (305 mm x 183 mm)
                 Hfront   16 Hsync  48 Hback   64 Hpol N
                 Vfront    3 Vsync   6 Vback   39 Vpol N
    Manufacturer-Specified Display Descriptor (0x0f): 00 0f 00 00 00 00 00 00 00 00 00 12 6e 13 20 03 '............n. .'
    Alphanumeric Data String: 'SAMSUNG'
    Alphanumeric Data String: 'LTN140W1-L01'
Checksum: 0xe4
