
EDID (hex):
00ffffffffffff0039ee011804000000
2b1601037a2917782e1e95a355489827
155054afce0001010101010101010101
010101010101662150b051001b304070
360058c21000001e000000fc00464954
38355820202020202020000000ff000a
000000000000000000000000000000ff
003541313130445039462020202000ad

Extracted contents:
header:          00 ff ff ff ff ff ff 00
serial number:   39 ee 01 18 04 00 00 00 2b 16
version:         01 03
basic params:    7a 29 17 78 2e
chroma info:     1e 95 a3 55 48 98 27 15 50 54
established:     af ce 00
standard:        01 01 01 01 01 01 01 01 01 01 01 01 01 01 01 01
descriptor 1:    66 21 50 b0 51 00 1b 30 40 70 36 00 58 c2 10 00 00 1e
descriptor 2:    00 00 00 fc 00 46 49 54 38 35 58 20 20 20 20 20 20 20
descriptor 3:    00 00 00 ff 00 0a 00 00 00 00 00 00 00 00 00 00 00 00
descriptor 4:    00 00 00 ff 00 35 41 31 31 30 44 50 39 46 20 20 20 20
extensions:      00
checksum:        ad

EDID version: 1.3
Manufacturer: NON Model 1801 Serial Number --
Made in week 43 of 2012
Analog display, Input voltage level: 0.7/0.7 V
Configurable signal levels
Sync: Separate SyncOnGreen 
Maximum image size: 41 cm x 23 cm
Gamma: 2.20
DPMS levels: Off
RGB color display
Default (sRGB) color space is primary color space
First detailed timing is preferred timing
Display x,y Chromaticity:
  Red:   0.6367, 0.3330
  Green: 0.2841, 0.5957
  Blue:  0.1542, 0.0830
  White: 0.3134, 0.3291
Established timings supported:
  720x400@70Hz 9:5 HorFreq: 31469 Hz Clock: 28.320 MHz
  640x480@60Hz 4:3 HorFreq: 31469 Hz Clock: 25.175 MHz
  640x480@72Hz 4:3 HorFreq: 37900 Hz Clock: 31.500 MHz
  640x480@75Hz 4:3 HorFreq: 37500 Hz Clock: 31.500 MHz
  800x600@56Hz 4:3 HorFreq: 35200 Hz Clock: 36.000 MHz
  800x600@60Hz 4:3 HorFreq: 37900 Hz Clock: 40.000 MHz
  800x600@72Hz 4:3 HorFreq: 48100 Hz Clock: 50.000 MHz
  800x600@75Hz 4:3 HorFreq: 46900 Hz Clock: 49.500 MHz
  1024x768@60Hz 4:3 HorFreq: 48400 Hz Clock: 65.000 MHz
  1024x768@70Hz 4:3 HorFreq: 56500 Hz Clock: 75.000 MHz
  1024x768@75Hz 4:3 HorFreq: 60000 Hz Clock: 78.750 MHz
Standard timings supported:
Detailed mode: Clock 85.500 MHz, 344 mm x 194 mm
               1360 1424 1536 1792 hborder 0
                768  771  777  795 vborder 0
               +hsync +vsync 
               VertFreq: 60 Hz, HorFreq: 47712 Hz
Serial number: 
-- number: 5A110DP9F    
Checksum: 0xad (valid)
EDID block does NOT conform to EDID 1.3!
	sRGB is signaled, but the chromaticities do not match
	Name descriptor not terminated with a newline
	Missing monitor ranges
	Detailed block string not properly terminated
