
EDID (hex):
00ffffffffffff000dae801400000000
1e160103801f11780acb459657559128
27505400000001010101010101010101
010101010101da1d56e250002030442d
470035ae10000018000000fe004e3134
304247452d4c32330a20000000fe0043
4d4e0a202020202020202020000000fe
004e3134304247452d4c32330a200061

Extracted contents:
header:          00 ff ff ff ff ff ff 00
serial number:   0d ae 80 14 00 00 00 00 1e 16
version:         01 03
basic params:    80 1f 11 78 0a
chroma info:     cb 45 96 57 55 91 28 27 50 54
established:     00 00 00
standard:        01 01 01 01 01 01 01 01 01 01 01 01 01 01 01 01
descriptor 1:    da 1d 56 e2 50 00 20 30 44 2d 47 00 35 ae 10 00 00 18
descriptor 2:    00 00 00 fe 00 4e 31 34 30 42 47 45 2d 4c 32 33 0a 20
descriptor 3:    00 00 00 fe 00 43 4d 4e 0a 20 20 20 20 20 20 20 20 20
descriptor 4:    00 00 00 fe 00 4e 31 34 30 42 47 45 2d 4c 32 33 0a 20
extensions:      00
checksum:        61

EDID version: 1.3
Manufacturer: CMN Model 1480 Serial Number --
Made in week 30 of 2012
Digital display
Maximum image size: 31 cm x 17 cm
Gamma: 2.20
RGB color display
First detailed timing is preferred timing
Display x,y Chromaticity:
  Red:   0.5888, 0.3398
  Green: 0.3339, 0.5693
  Blue:  0.1572, 0.1523
  White: 0.3134, 0.3291
Established timings supported:
Standard timings supported:
Detailed mode: Clock 76.420 MHz, 309 mm x 174 mm
               1366 1434 1479 1592 hborder 0
                768  772  779  800 vborder 0
               -hsync -vsync 
               VertFreq: 60 Hz, HorFreq: 48002 Hz
ASCII string: N140BGE-L23
ASCII string: CMN
ASCII string: N140BGE-L23
Checksum: 0x61 (valid)
EDID block does NOT conform to EDID 1.3!
	Missing name descriptor
	Missing monitor ranges
