edid-decode (hex):

00 ff ff ff ff ff ff 00 1e d4 08 19 d2 5b 7f 02
13 0e 01 03 68 26 1e 78 2a 0b 32 9c 5a 4d 8c 26
20 4e 57 a1 08 00 81 40 71 4f 81 80 01 01 01 01
01 01 01 01 01 01 30 2a 00 98 51 00 2a 40 30 70
13 00 78 2d 11 00 00 1e 00 00 00 fc 00 4c 39 43
48 5f 54 41 0a 20 20 20 20 20 00 00 00 fe 00 4d
52 54 5f 4d 56 50 49 49 0a 20 20 20 00 00 00 fd
00 3c 3c 1f 40 0b 0a 20 20 20 20 20 20 20 00 c0

----------------

Block 0, Base EDID:
  EDID Structure Version & Revision: 1.3
  Vendor & Product Identification:
    Manufacturer: GVT
    Model: 6408
    Serial Number: ...
    Made in: week 19 of 2004
  Basic Display Parameters & Features:
    Analog display
    Input voltage level: 0.7/0.7 V
    Blank level equals black level
    Sync: Separate
    Maximum image size: 38 cm x 30 cm
    Gamma: 2.20
    DPMS levels: Off
    RGB color display
    First detailed timing is the preferred timing
  Color Characteristics:
    Red  : 0.6093, 0.3515
    Green: 0.3027, 0.5498
    Blue : 0.1484, 0.1279
    White: 0.3046, 0.3417
  Established Timings I & II:
    IBM     :   720x400    70.081663 Hz   9:5     31.467 kHz     28.320000 MHz
    DMT 0x04:   640x480    59.940476 Hz   4:3     31.469 kHz     25.175000 MHz
    DMT 0x09:   800x600    60.316541 Hz   4:3     37.879 kHz     40.000000 MHz
    DMT 0x10:  1024x768    60.003840 Hz   4:3     48.363 kHz     65.000000 MHz
  Standard Timings:
    DMT 0x20:  1280x960    60.000000 Hz   4:3     60.000 kHz    108.000000 MHz
    DMT 0x15:  1152x864    75.000000 Hz   4:3     67.500 kHz    108.000000 MHz
    DMT 0x23:  1280x1024   60.019740 Hz   5:4     63.981 kHz    108.000000 MHz
  Detailed Timing Descriptors:
    DTD 1:  1280x1024   60.019740 Hz   5:4     63.981 kHz    108.000000 MHz (376 mm x 301 mm)
                 Hfront   48 Hsync 112 Hback  248 Hpol P
                 Vfront    1 Vsync   3 Vback   38 Vpol P
    Display Product Name: 'L9CH_TA'
    Alphanumeric Data String: 'MRT_MVPII'
    Display Range Limits:
      Monitor ranges (Unknown (0x0a)): 60-60 Hz V, 31-64 kHz H, max dotclock 110 MHz
Checksum: 0xc0

----------------

Failures:

Block 0, Base EDID:
  Display Range Limits: Unknown range class (0x0a).
  Display Range Limits: Byte 11 is 0x20 instead of 0x0a.
EDID:
  Base EDID: Some timings are out of range of the Monitor Ranges:
    Vertical Freq: 59.940 - 75.000 Hz (Monitor: 60.000 - 60.000 Hz)
    Horizontal Freq: 31.466 - 67.500 kHz (Monitor: 31.000 - 64.000 kHz)

EDID conformity: FAIL
