
EDID (hex):
00ffffffffffff001ed408198e2dff01
230d010368261e782a0b329c5a4d8c26
204e57bfef0081408180714f01010101
010101010101302a009851002a403070
1300782d1100001e000000fc004c3943
485f54410a2020202020000000fe004d
52545f4d565049490a202020000000fe
0047566973696f6e0a20202020200001

Extracted contents:
header:          00 ff ff ff ff ff ff 00
serial number:   1e d4 08 19 8e 2d ff 01 23 0d
version:         01 03
basic params:    68 26 1e 78 2a
chroma info:     0b 32 9c 5a 4d 8c 26 20 4e 57
established:     bf ef 00
standard:        81 40 81 80 71 4f 01 01 01 01 01 01 01 01 01 01
descriptor 1:    30 2a 00 98 51 00 2a 40 30 70 13 00 78 2d 11 00 00 1e
descriptor 2:    00 00 00 fc 00 4c 39 43 48 5f 54 41 0a 20 20 20 20 20
descriptor 3:    00 00 00 fe 00 4d 52 54 5f 4d 56 50 49 49 0a 20 20 20
descriptor 4:    00 00 00 fe 00 47 56 69 73 69 6f 6e 0a 20 20 20 20 20
extensions:      00
checksum:        01

EDID version: 1.3
Manufacturer: GVT Model 1908 Serial Number --
Analog display, Input voltage level: 0.7/0.7 V
Sync: Separate 
Maximum image size: 38 cm x 30 cm
Gamma: 2.20
DPMS levels: Off
RGB color display
First detailed timing is preferred timing
Display x,y Chromaticity:
  Red:   0.6093, 0.3515
  Green: 0.3027, 0.5498
  Blue:  0.1484, 0.1279
  White: 0.3046, 0.3417
Established timings supported:
  720x400@70Hz 9:5 HorFreq: 31469 Hz Clock: 28.320 MHz
  640x480@60Hz 4:3 HorFreq: 31469 Hz Clock: 25.175 MHz
  640x480@67Hz 4:3 HorFreq: 35000 Hz Clock: 30.240 MHz
  640x480@72Hz 4:3 HorFreq: 37900 Hz Clock: 31.500 MHz
  640x480@75Hz 4:3 HorFreq: 37500 Hz Clock: 31.500 MHz
  800x600@56Hz 4:3 HorFreq: 35200 Hz Clock: 36.000 MHz
  800x600@60Hz 4:3 HorFreq: 37900 Hz Clock: 40.000 MHz
  800x600@72Hz 4:3 HorFreq: 48100 Hz Clock: 50.000 MHz
  800x600@75Hz 4:3 HorFreq: 46900 Hz Clock: 49.500 MHz
  832x624@75Hz 4:3 HorFreq: 49726 Hz Clock: 57.284 MHz
  1024x768@60Hz 4:3 HorFreq: 48400 Hz Clock: 65.000 MHz
  1024x768@70Hz 4:3 HorFreq: 56500 Hz Clock: 75.000 MHz
  1024x768@75Hz 4:3 HorFreq: 60000 Hz Clock: 78.750 MHz
  1280x1024@75Hz 5:4 HorFreq: 80000 Hz Clock: 135.000 MHz
Standard timings supported:
  1280x960@60Hz 4:3 HorFreq: 60000 Hz Clock: 108.000 MHz
  1280x1024@60Hz 5:4 HorFreq: 64000 Hz Clock: 108.000 MHz
  1152x864@75Hz 4:3 HorFreq: 67500 Hz Clock: 108.000 MHz
Detailed mode: Clock 108.000 MHz, 376 mm x 301 mm
               1280 1328 1440 1688 hborder 0
               1024 1025 1028 1066 vborder 0
               +hsync +vsync 
               VertFreq: 60 Hz, HorFreq: 63981 Hz
Monitor name: L9CH_TA
ASCII string: MRT_MVPII
ASCII string: GVision
Checksum: 0x1 (valid)
EDID block does NOT conform to EDID 1.3!
	Missing monitor ranges
EDID block does not conform at all!
	Bad year of manufacture
