
EDID (hex):
00ffffffffffff000daf411400000000
2d100103801e13780a77b59155509028
25505400000001010101010101010101
010101010101bc1b00a0502017303020
36002fbe10000018000000fe004e3134
3149362d4c30310a2020000000fe0043
4d4f0a202020202020202020000000fe
004e31343149362d4c30310a202000b4

Extracted contents:
header:          00 ff ff ff ff ff ff 00
serial number:   0d af 41 14 00 00 00 00 2d 10
version:         01 03
basic params:    80 1e 13 78 0a
chroma info:     77 b5 91 55 50 90 28 25 50 54
established:     00 00 00
standard:        01 01 01 01 01 01 01 01 01 01 01 01 01 01 01 01
descriptor 1:    bc 1b 00 a0 50 20 17 30 30 20 36 00 2f be 10 00 00 18
descriptor 2:    00 00 00 fe 00 4e 31 34 31 49 36 2d 4c 30 31 0a 20 20
descriptor 3:    00 00 00 fe 00 43 4d 4f 0a 20 20 20 20 20 20 20 20 20
descriptor 4:    00 00 00 fe 00 4e 31 34 31 49 36 2d 4c 30 31 0a 20 20
extensions:      00
checksum:        b4

EDID version: 1.3
Manufacturer: CMO Model 1441 Serial Number --
Made in week 45 of 2006
Digital display
Maximum image size: 30 cm x 19 cm
Gamma: 2.20
RGB color display
First detailed timing is preferred timing
Display x,y Chromaticity:
  Red:   0.5673, 0.3349
  Green: 0.3134, 0.5654
  Blue:  0.1582, 0.1474
  White: 0.3134, 0.3291
Established timings supported:
Standard timings supported:
Detailed mode: Clock 71.000 MHz, 303 mm x 190 mm
               1280 1328 1360 1440 hborder 0
                800  803  809  823 vborder 0
               -hsync -vsync 
               VertFreq: 59 Hz, HorFreq: 49305 Hz
ASCII string: N141I6-L01
ASCII string: CMO
ASCII string: N141I6-L01
Checksum: 0xb4 (valid)
EDID block does NOT conform to EDID 1.3!
	Missing name descriptor
	Missing monitor ranges
