edid-decode (hex):

00 ff ff ff ff ff ff 00 30 e4 de 02 00 00 00 00
00 14 01 04 90 16 0d 78 0a 29 65 99 57 4f 99 27
1e 50 54 00 00 00 01 01 01 01 01 01 01 01 01 01
01 01 01 01 01 01 bc 1b 56 84 50 00 16 30 30 20
35 00 df 7d 00 00 00 1b bc 1b 56 d3 51 00 c8 30
30 20 35 00 df 7d 00 00 00 1b 00 00 00 fe 00 57
48 4b 34 46 80 31 30 31 57 48 31 0a 00 00 00 00
00 00 41 33 94 01 00 00 00 01 01 0a 20 20 00 3a

----------------

Block 0, Base EDID:
  EDID Structure Version & Revision: 1.4
  Vendor & Product Identification:
    Manufacturer: LGD
    Model: 734
    Made in: 2010
  Basic Display Parameters & Features:
    Digital display
    Bits per primary color channel: 6
    Digital interface is not defined
    Maximum image size: 22 cm x 13 cm
    Gamma: 2.20
    Supported color formats: RGB 4:4:4, YCrCb 4:4:4
    First detailed timing includes the native pixel format and preferred refresh rate
  Color Characteristics:
    Red  : 0.5976, 0.3417
    Green: 0.3105, 0.5986
    Blue : 0.1533, 0.1191
    White: 0.3134, 0.3291
  Established Timings I & II: none
  Standard Timings: none
  Detailed Timing Descriptors:
    DTD 1:  1366x768    59.995606 Hz 683:384   47.397 kHz     71.000000 MHz (223 mm x 125 mm)
                 Hfront   48 Hsync  32 Hback   52 Hpol P
                 Vfront    3 Vsync   5 Vback   14 Vpol N
    DTD 2:  1366x768    40.014789 Hz 683:384   38.734 kHz     71.000000 MHz (223 mm x 125 mm)
                 Hfront   48 Hsync  32 Hback  387 Hpol P
                 Vfront    3 Vsync   5 Vback  192 Vpol N
    Alphanumeric Data String: 'WHK4F'
    Manufacturer-Specified Display Descriptor (0x00): 00 00 00 00 41 33 94 01 00 00 00 01 01 0a 20 20 '....A3........  '
Checksum: 0x3a

----------------

Warnings:

Block 0, Base EDID:
  Missing Display Product Name.

Failures:

Block 0, Base EDID:
  Alphanumeric Data String: Non-printable character.

EDID conformity: FAIL
