edid-decode (hex):

00 ff ff ff ff ff ff 00 09 e5 a1 07 00 00 00 00
26 1a 01 04 95 22 13 78 02 c9 a0 95 5d 59 94 29
24 50 54 00 00 00 01 01 01 01 01 01 01 01 01 01
01 01 01 01 01 01 70 3a 80 0b 71 38 3c 40 30 20
36 00 58 c1 10 00 00 1a f5 26 80 0b 71 38 3c 40
64 64 44 05 58 c1 10 00 00 1a 00 00 00 00 00 00
00 00 00 00 00 00 00 00 00 00 00 00 00 00 00 02
00 0f 47 f9 0b 3c 6e 16 15 24 6e 00 00 00 00 99

----------------

Block 0, Base EDID:
  EDID Structure Version & Revision: 1.4
  Vendor & Product Identification:
    Manufacturer: BOE
    Model: 1953
    Made in: week 38 of 2016
  Basic Display Parameters & Features:
    Digital display
    Bits per primary color channel: 6
    DisplayPort interface
    Maximum image size: 34 cm x 19 cm
    Gamma: 2.20
    Supported color formats: RGB 4:4:4
    First detailed timing includes the native pixel format and preferred refresh rate
  Color Characteristics:
    Red  : 0.5849, 0.3632
    Green: 0.3496, 0.5791
    Blue : 0.1621, 0.1425
    White: 0.3125, 0.3281
  Established Timings I & II: none
  Standard Timings: none
  Detailed Timing Descriptors:
    DTD 1:  1920x1080   60.003690 Hz  16:9     68.404 kHz    149.600000 MHz (344 mm x 193 mm)
                 Hfront   48 Hsync  32 Hback  187 Hpol P
                 Vfront    3 Vsync   6 Vback   51 Vpol N
    DTD 2:  1920x1080   40.001123 Hz  16:9     45.601 kHz     99.730000 MHz (344 mm x 193 mm)
                 Hfront  100 Hsync 100 Hback   67 Hpol P
                 Vfront   20 Vsync  20 Vback   20 Vpol N
    Empty Descriptor
    Manufacturer-Specified Display Descriptor (0x02): 00 02 00 0f 47 f9 0b 3c 6e 16 15 24 6e 00 00 00 '....G..<n..$n...'
Checksum: 0x99

----------------

Failures:

Block 0, Base EDID:
  Empty Descriptor: Use Dummy Descriptor instead of all zeroes.
  Missing Display Product Name.

EDID conformity: FAIL
