edid-decode (hex):

00 ff ff ff ff ff ff 00 09 e5 a7 06 00 00 00 00
01 19 01 04 95 1d 11 78 0a 56 c0 99 5a 56 91 2a
24 50 54 00 00 00 01 01 01 01 01 01 01 01 01 01
01 01 01 01 01 01 36 36 80 a0 70 38 20 40 30 20
35 00 26 a5 10 00 00 1a 5e 2b 80 a0 70 38 20 40
30 20 35 00 26 a5 10 00 00 1a 00 00 00 fe 00 34
46 35 48 54 80 4e 54 31 33 57 48 4d 00 00 00 00
00 00 41 01 94 00 10 00 00 09 01 0a 20 20 00 e7

----------------

Block 0, Base EDID:
  EDID Structure Version & Revision: 1.4
  Vendor & Product Identification:
    Manufacturer: BOE
    Model: 1703
    Made in: week 1 of 2015
  Basic Display Parameters & Features:
    Digital display
    Bits per primary color channel: 6
    DisplayPort interface
    Maximum image size: 29 cm x 17 cm
    Gamma: 2.20
    Supported color formats: RGB 4:4:4, YCrCb 4:4:4
    First detailed timing includes the native pixel format and preferred refresh rate
  Color Characteristics:
    Red  : 0.5986, 0.3525
    Green: 0.3369, 0.5683
    Blue : 0.1669, 0.1406
    White: 0.3125, 0.3281
  Established Timings I & II: none
  Standard Timings: none
  Detailed Timing Descriptors:
    DTD 1:  1920x1080   60.001038 Hz  16:9     66.721 kHz    138.780000 MHz (294 mm x 165 mm)
                 Hfront   48 Hsync  32 Hback   80 Hpol P
                 Vfront    3 Vsync   5 Vback   24 Vpol N
    DTD 2:  1920x1080   47.999101 Hz  16:9     53.375 kHz    111.020000 MHz (294 mm x 165 mm)
                 Hfront   48 Hsync  32 Hback   80 Hpol P
                 Vfront    3 Vsync   5 Vback   24 Vpol N
    Alphanumeric Data String: '4F5HT'
    Manufacturer-Specified Display Descriptor (0x00): 00 00 00 00 41 01 94 00 10 00 00 09 01 0a 20 20 '....A.........  '
Checksum: 0xe7

----------------

Failures:

Block 0, Base EDID:
  Alphanumeric Data String: Non-printable character.
  Missing Display Product Name.

EDID conformity: FAIL
