edid-decode (hex):

00 ff ff ff ff ff ff 00 10 ac 9d f0 55 34 55 44
1b 1e 01 03 0e 30 1b 78 ea 27 55 a3 54 4f 9e 27
11 50 54 a5 4b 00 71 4f 81 80 a9 c0 d1 c0 01 01
01 01 01 01 01 01 02 3a 80 18 71 38 2d 40 58 2c
45 00 dc 0c 11 00 00 1e 00 00 00 ff 00 33 33 47
35 38 30 37 33 44 55 34 55 0a 00 00 00 fc 00 44
45 4c 4c 20 45 32 32 31 38 48 4e 0a 00 00 00 fd
00 38 4c 1e 53 11 00 0a 20 20 20 20 20 20 00 4f

00 ff ff ff ff ff ff 00 10 ac 9d f0 55 34 55 44
1b 1e 01 03 0e 30 1b 78 ea 27 55 a3 54 4f 9e 27
11 50 54 a5 4b 00 71 4f 81 80 a9 c0 d1 c0 01 01
01 01 01 01 01 01 02 3a 80 18 71 38 2d 40 58 2c
45 00 dc 0c 11 00 00 1e 00 00 00 ff 00 33 33 47
35 38 30 37 33 44 55 34 55 0a 00 00 00 fc 00 44
45 4c 4c 20 45 32 32 31 38 48 4e 0a 00 00 00 fd
00 38 4c 1e 53 11 00 0a 20 20 20 20 20 20 00 4f

----------------

Block 0, Base EDID:
  EDID Structure Version & Revision: 1.3
  Vendor & Product Identification:
    Manufacturer: DEL
    Model: 61597
    Serial Number: ...
    Made in: week 27 of 2020
  Basic Display Parameters & Features:
    Analog display
    Signal Level Standard: 0.700 : 0.300 : 1.000 V p-p
    Blank level equals black level
    Sync: Separate Composite SyncOnGreen
    Maximum image size: 48 cm x 27 cm
    Gamma: 2.20
    DPMS levels: Standby Suspend Off
    RGB color display
    First detailed timing is the preferred timing
  Color Characteristics:
    Red  : 0.6367, 0.3300
    Green: 0.3095, 0.6201
    Blue : 0.1533, 0.0673
    White: 0.3134, 0.3291
  Established Timings I & II:
    IBM     :   720x400    70.081663 Hz   9:5     31.467 kHz     28.320000 MHz
    DMT 0x04:   640x480    59.940476 Hz   4:3     31.469 kHz     25.175000 MHz
    DMT 0x06:   640x480    75.000000 Hz   4:3     37.500 kHz     31.500000 MHz
    DMT 0x09:   800x600    60.316541 Hz   4:3     37.879 kHz     40.000000 MHz
    DMT 0x0b:   800x600    75.000000 Hz   4:3     46.875 kHz     49.500000 MHz
    DMT 0x10:  1024x768    60.003840 Hz   4:3     48.363 kHz     65.000000 MHz
    DMT 0x12:  1024x768    75.028582 Hz   4:3     60.023 kHz     78.750000 MHz
    DMT 0x24:  1280x1024   75.024675 Hz   5:4     79.976 kHz    135.000000 MHz
  Standard Timings:
    DMT 0x15:  1152x864    75.000000 Hz   4:3     67.500 kHz    108.000000 MHz
    DMT 0x23:  1280x1024   60.019740 Hz   5:4     63.981 kHz    108.000000 MHz
    DMT 0x53:  1600x900    60.000000 Hz  16:9     60.000 kHz    108.000000 MHz (RB)
    DMT 0x52:  1920x1080   60.000000 Hz  16:9     67.500 kHz    148.500000 MHz
  Detailed Timing Descriptors:
    DTD 1:  1920x1080   60.000000 Hz  16:9     67.500 kHz    148.500000 MHz (476 mm x 268 mm)
                 Hfront   88 Hsync  44 Hback  148 Hpol P
                 Vfront    4 Vsync   5 Vback   36 Vpol P
    Display Product Serial Number: ...
    Display Product Name: 'DELL E2218HN'
    Display Range Limits:
      Monitor ranges (GTF): 56-76 Hz V, 30-83 kHz H, max dotclock 170 MHz
Checksum: 0x4f

----------------

Block 1, Unknown EDID Extension Block 0x00:
  00 ff ff ff ff ff ff 00 10 ac 9d f0 55 34 55 44 '............U4UD'
  1b 1e 01 03 0e 30 1b 78 ea 27 55 a3 54 4f 9e 27 '.....0.x.'U.TO.''
  11 50 54 a5 4b 00 71 4f 81 80 a9 c0 d1 c0 01 01 '.PT.K.qO........'
  01 01 01 01 01 01 02 3a 80 18 71 38 2d 40 58 2c '.......:..q8-@X,'
  45 00 dc 0c 11 00 00 1e 00 00 00 ff 00 33 33 47 'E............33G'
  35 38 30 37 33 44 55 34 55 0a 00 00 00 fc 00 44 '58073DU4U......D'
  45 4c 4c 20 45 32 32 31 38 48 4e 0a 00 00 00 fd 'ELL E2218HN.....'
  00 38 4c 1e 53 11 00 0a 20 20 20 20 20 20 00 4f '.8L.S...      .O'
Checksum: 0x4f

----------------

Failures:

Block 1, Base EDID:
  Unknown Extension Block.
EDID:
  Base EDID: EDID specified 0 extension block(s), but found 1 extension block(s).

EDID conformity: FAIL
