edid-decode (hex):

00 ff ff ff ff ff ff 00 4c 83 42 46 00 00 00 00
00 16 01 04 90 1f 11 78 0a 87 f5 94 57 4f 8c 27
27 50 54 00 00 00 01 01 01 01 01 01 01 01 01 01
01 01 01 01 01 01 ce 1d 56 f0 50 00 18 30 40 30
25 00 35 ae 10 00 00 19 d8 13 56 f0 50 00 18 30
40 30 25 00 35 ae 10 00 00 19 00 00 00 00 00 00
00 00 00 00 00 00 00 00 00 00 00 00 00 00 00 02
00 0c 42 f2 0a 3c 64 14 14 21 69 00 00 00 00 9c

----------------

Block 0, Base EDID:
  EDID Structure Version & Revision: 1.4
  Vendor & Product Identification:
    Manufacturer: SDC
    Model: 17986
    Made in: 2012
  Basic Display Parameters & Features:
    Digital display
    Bits per primary color channel: 6
    Digital interface is not defined
    Maximum image size: 31 cm x 17 cm
    Gamma: 2.20
    Supported color formats: RGB 4:4:4, YCrCb 4:4:4
    First detailed timing includes the native pixel format and preferred refresh rate
  Color Characteristics:
    Red  : 0.5800, 0.3398
    Green: 0.3095, 0.5498
    Blue : 0.1552, 0.1552
    White: 0.3134, 0.3291
  Established Timings I & II: none
  Standard Timings: none
  Detailed Timing Descriptors:
    DTD 1:  1366x768    59.986540 Hz 683:384   47.509 kHz     76.300000 MHz (309 mm x 174 mm)
                 Hfront   64 Hsync  48 Hback  128 Hpol N
                 Vfront    2 Vsync   5 Vback   17 Vpol N
    DTD 2:  1366x768    39.938614 Hz 683:384   31.631 kHz     50.800000 MHz (309 mm x 174 mm)
                 Hfront   64 Hsync  48 Hback  128 Hpol N
                 Vfront    2 Vsync   5 Vback   17 Vpol N
    Empty Descriptor
    Manufacturer-Specified Display Descriptor (0x02): 00 02 00 0c 42 f2 0a 3c 64 14 14 21 69 00 00 00 '....B..<d..!i...'
Checksum: 0x9c

----------------

Warnings:

Block 0, Base EDID:
  Missing Display Product Name.

Failures:

Block 0, Base EDID:
  Empty Descriptor: Use Dummy Descriptor instead of all zeroes.

EDID conformity: FAIL
