
EDID (hex):
00ffffffffffff00220e283701010101
1f1f0104b55022783b0c35a9564d9b24
0d5054a10800d1c0b300a9c0d1009500
8180810081c04f7d70aad0a029503020
3a00204f3100001a000000fd003ca5ff
ff5d010a202020202020000000fc0048
50205833340a202020202020000000ff
0036434d31333130484c320a202002ea
020330f147103f400403020123090707
830100006d1a000002013ca500000000
0000e305e001e6060701605a33e200eb
cc9d70aad0a0345030203a00204f3100
001aefd470aad0a0465030203a00204f
3100001a6fc200a0a0a0555030203500
204f3100001a00000000000000000000
00000000000000000000000000000083
701279000003013c0e0201086f0da900
2f801f009f0554000200090052390108
6f0da9002f801f009f05660002000900
c26501886f0d4f012f801f009f051d00
02000900000000000000000000000000
00000000000000000000000000000000
00000000000000000000000000000000
00000000000000000000000000007490

Extracted contents:
header:          00 ff ff ff ff ff ff 00
serial number:   22 0e 28 37 01 01 01 01 1f 1f
version:         01 04
basic params:    b5 50 22 78 3b
chroma info:     0c 35 a9 56 4d 9b 24 0d 50 54
established:     a1 08 00
standard:        d1 c0 b3 00 a9 c0 d1 00 95 00 81 80 81 00 81 c0
descriptor 1:    4f 7d 70 aa d0 a0 29 50 30 20 3a 00 20 4f 31 00 00 1a
descriptor 2:    00 00 00 fd 00 3c a5 ff ff 5d 01 0a 20 20 20 20 20 20
descriptor 3:    00 00 00 fc 00 48 50 20 58 33 34 0a 20 20 20 20 20 20
descriptor 4:    00 00 00 ff 00 36 43 4d 31 33 31 30 48 4c 32 0a 20 20
extensions:      02
checksum:        ea

EDID version: 1.4
Manufacturer: HPN Model 3728 Serial Number --
Made in week 31 of 2021
Digital display
10 bits per primary color channel
DisplayPort interface
Maximum image size: 80 cm x 34 cm
Gamma: 2.20
DPMS levels: Off
Supported color formats: RGB 4:4:4, YCrCb 4:4:4, YCrCb 4:2:2
First detailed timing includes the native pixel format and preferred refresh rate
Display is continuous frequency
Display x,y Chromaticity:
  Red:   0.6601, 0.3359
  Green: 0.3037, 0.6054
  Blue:  0.1406, 0.0537
  White: 0.3134, 0.3291
Established timings supported:
  720x400@70Hz 9:5 HorFreq: 31469 Hz Clock: 28.320 MHz
  640x480@60Hz 4:3 HorFreq: 31469 Hz Clock: 25.175 MHz
  800x600@60Hz 4:3 HorFreq: 37900 Hz Clock: 40.000 MHz
  1024x768@60Hz 4:3 HorFreq: 48400 Hz Clock: 65.000 MHz
Standard timings supported:
  1920x1080@60Hz 16:9
  1680x1050@60Hz 16:10 HorFreq: 64700 Hz Clock: 119.000 MHz
  1600x900@60Hz 16:9
  1920x1200@60Hz 16:10 HorFreq: 74000 Hz Clock: 154.000 MHz
  1440x900@60Hz 16:10 HorFreq: 55500 Hz Clock: 88.750 MHz
  1280x1024@60Hz 5:4 HorFreq: 64000 Hz Clock: 108.000 MHz
  1280x800@60Hz 16:10
  1280x720@60Hz 16:9
Detailed mode: Clock 320.790 MHz, 800 mm x 335 mm
               3440 3488 3520 3610 hborder 0
               1440 1443 1453 1481 vborder 0
               +hsync -vsync 
               VertFreq: 60 Hz, HorFreq: 88861 Hz
Monitor ranges (bare limits): 60-165Hz V, 255-255kHz H, max dotclock 930MHz
Monitor name: HP X34
Serial number: --
Has 2 extension blocks
Checksum: 0xea (valid)

CTA extension block
Extension version: 3
44 bytes of CTA data
  Video data block
    VIC  16 1920x1080@60Hz 16:9  HorFreq: 67500 Hz Clock: 148.500 MHz
    VIC  63 1920x1080@120Hz 16:9  HorFreq: 135000 Hz Clock: 297.000 MHz
    VIC  64 1920x1080@100Hz 16:9  HorFreq: 112500 Hz Clock: 297.000 MHz
    VIC   4 1280x720@60Hz 16:9  HorFreq: 45000 Hz Clock: 74.250 MHz
    VIC   3 720x480@60Hz 16:9  HorFreq: 31469 Hz Clock: 27.000 MHz
    VIC   2 720x480@60Hz 4:3  HorFreq: 31469 Hz Clock: 27.000 MHz
    VIC   1 640x480@60Hz 4:3  HorFreq: 31469 Hz Clock: 25.175 MHz
  Audio data block
    Linear PCM, max channels 2
      Supported sample rates (kHz): 48 44.1 32
      Supported sample sizes (bits): 24 20 16
  Speaker allocation data block
    Speaker map:
      FL/FR - Front Left/Right
  Vendor-specific data block, OUI 00001a
  Extended tag: Colorimetry data block
    BT2020cYCC
    BT2020YCC
    BT2020RGB
  Extended tag: HDR static metadata data block
    Electro optical transfer functions:
      Traditional gamma - SDR luminance range
      Traditional gamma - HDR luminance range
      SMPTE ST2084
    Supported static metadata descriptors:
      Static metadata type 1
    Desired content max luminance: 96 (400.000 cd/m^2)
    Desired content max frame-average luminance: 90 (351.250 cd/m^2)
    Desired content min luminance: 51 (0.160 cd/m^2)
  Extended tag: Video capability data block
    YCbCr quantization: Selectable (via AVI YQ) (1)
    RGB quantization: Selectable (via AVI Q) (1)
    PT scan behaviour: Always Underscanned (2)
    IT scan behaviour: Always Underscanned (2)
    CE scan behaviour: Support both over- and underscan (3)
Underscans PC formats by default
Basic audio support
Supports YCbCr 4:4:4
Supports YCbCr 4:2:2
1 native detailed modes
Detailed mode: Clock 403.960 MHz, 800 mm x 335 mm
               3440 3488 3520 3610 hborder 0
               1440 1443 1453 1492 vborder 0
               +hsync -vsync 
               VertFreq: 75 Hz, HorFreq: 111900 Hz
Detailed mode: Clock 545.110 MHz, 800 mm x 335 mm
               3440 3488 3520 3610 hborder 0
               1440 1443 1453 1510 vborder 0
               +hsync -vsync 
               VertFreq: 100 Hz, HorFreq: 151000 Hz
Detailed mode: Clock 497.750 MHz, 800 mm x 335 mm
               2560 2608 2640 2720 hborder 0
               1440 1443 1448 1525 vborder 0
               +hsync -vsync 
               VertFreq: 119 Hz, HorFreq: 182996 Hz
Checksum: 0x83 (valid)


DisplayID extension block
Extension version: 18
Length 121, version 18, extension count 0
Checksum: 0x74 (valid)
Type 1 detailed timing: aspect: undefined,  
Detailed mode: Clock 660.620 MHz, 0 mm x 0 mm
               3439 3486 3517 3608
               1439 1441 1450 1523
               +hsync -vsync
Type 1 detailed timing: aspect: undefined,  
Detailed mode: Clock 802.100 MHz, 0 mm x 0 mm
               3439 3486 3517 3608
               1439 1441 1450 1541
               +hsync -vsync
Type 1 detailed timing: aspect: undefined, Preferred  
Detailed mode: Clock 915.860 MHz, 0 mm x 0 mm
               3439 3486 3517 3774
               1439 1441 1450 1468
               +hsync -vsync

Warning: One or more of the timings is out of range of the Monitor Ranges:
  Vertical Freq: 60 - 120 Hz
  Horizontal Freq: 31469 - 182996 Hz
  Maximum Clock: 545.110 MHz
EDID block does not conform at all!
	Both the serial number and the serial string are set
