
EDID (hex):
00ffffffffffff00220e283701010101
2c1f0104b55022783b0c35a9564d9b24
0d5054a10800d1c0b300a9c0d1009500
8180810081c04f7d70aad0a029503020
3a00204f3100001a000000fd003ca5ff
ff5d010a202020202020000000fc0048
50205833340a202020202020000000ff
0036434d31343430424c350a202002dc
020330f147103f400403020123090707
830100006d1a000002013ca500000000
0000e305e001e6060701605a33e200eb
cc9d70aad0a0345030203a00204f3100
001aefd470aad0a0465030203a00204f
3100001a6fc200a0a0a0555030203500
204f3100001a00000000000000000000
00000000000000000000000000000083
701279000003013c0e0201086f0da900
2f801f009f0554000200090052390108
6f0da9002f801f009f05660002000900
c26501886f0d4f012f801f009f051d00
02000900000000000000000000000000
00000000000000000000000000000000
00000000000000000000000000000000
00000000000000000000000000007490

edid-decode (hex):

00 ff ff ff ff ff ff 00 22 0e 28 37 01 01 01 01
2c 1f 01 04 b5 50 22 78 3b 0c 35 a9 56 4d 9b 24
0d 50 54 a1 08 00 d1 c0 b3 00 a9 c0 d1 00 95 00
81 80 81 00 81 c0 4f 7d 70 aa d0 a0 29 50 30 20
3a 00 20 4f 31 00 00 1a 00 00 00 fd 00 3c a5 ff
ff 5d 01 0a 20 20 20 20 20 20 00 00 00 fc 00 48
50 20 58 33 34 0a 20 20 20 20 20 20 00 00 00 ff
00 36 43 4d 31 34 34 30 42 4c 35 0a 20 20 02 dc

02 03 30 f1 47 10 3f 40 04 03 02 01 23 09 07 07
83 01 00 00 6d 1a 00 00 02 01 3c a5 00 00 00 00
00 00 e3 05 e0 01 e6 06 07 01 60 5a 33 e2 00 eb
cc 9d 70 aa d0 a0 34 50 30 20 3a 00 20 4f 31 00
00 1a ef d4 70 aa d0 a0 46 50 30 20 3a 00 20 4f
31 00 00 1a 6f c2 00 a0 a0 a0 55 50 30 20 35 00
20 4f 31 00 00 1a 00 00 00 00 00 00 00 00 00 00
00 00 00 00 00 00 00 00 00 00 00 00 00 00 00 83

70 12 79 00 00 03 01 3c 0e 02 01 08 6f 0d a9 00
2f 80 1f 00 9f 05 54 00 02 00 09 00 52 39 01 08
6f 0d a9 00 2f 80 1f 00 9f 05 66 00 02 00 09 00
c2 65 01 88 6f 0d 4f 01 2f 80 1f 00 9f 05 1d 00
02 00 09 00 00 00 00 00 00 00 00 00 00 00 00 00
00 00 00 00 00 00 00 00 00 00 00 00 00 00 00 00
00 00 00 00 00 00 00 00 00 00 00 00 00 00 00 00
00 00 00 00 00 00 00 00 00 00 00 00 00 00 74 90

----------------

Block 0, Base EDID:
  EDID Structure Version & Revision: 1.4
  Vendor & Product Identification:
    Manufacturer: HPN
    Model: 14120
    Serial Number: 16843009
    Made in: week 44 of 2021
  Basic Display Parameters & Features:
    Digital display
    Bits per primary color channel: 10
    DisplayPort interface
    Maximum image size: 80 cm x 34 cm
    Gamma: 2.20
    DPMS levels: Off
    Supported color formats: RGB 4:4:4, YCrCb 4:4:4, YCrCb 4:2:2
    First detailed timing includes the native pixel format and preferred refresh rate
    Display is continuous frequency
  Color Characteristics:
    Red  : 0.6601, 0.3359
    Green: 0.3037, 0.6054
    Blue : 0.1406, 0.0537
    White: 0.3134, 0.3291
  Established Timings I & II:
    IBM     :   720x400    70.081663 Hz   9:5     31.467 kHz     28.320000 MHz
    DMT 0x04:   640x480    59.940476 Hz   4:3     31.469 kHz     25.175000 MHz
    DMT 0x09:   800x600    60.316541 Hz   4:3     37.879 kHz     40.000000 MHz
    DMT 0x10:  1024x768    60.003840 Hz   4:3     48.363 kHz     65.000000 MHz
  Standard Timings:
    DMT 0x52:  1920x1080   60.000000 Hz  16:9     67.500 kHz    148.500000 MHz
    DMT 0x3a:  1680x1050   59.954250 Hz  16:10    65.290 kHz    146.250000 MHz
    DMT 0x53:  1600x900    60.000000 Hz  16:9     60.000 kHz    108.000000 MHz (RB)
    DMT 0x45:  1920x1200   59.884600 Hz  16:10    74.556 kHz    193.250000 MHz
    DMT 0x2f:  1440x900    59.887445 Hz  16:10    55.935 kHz    106.500000 MHz
    DMT 0x23:  1280x1024   60.019740 Hz   5:4     63.981 kHz    108.000000 MHz
    DMT 0x1c:  1280x800    59.810326 Hz  16:10    49.702 kHz     83.500000 MHz
    DMT 0x55:  1280x720    60.000000 Hz  16:9     45.000 kHz     74.250000 MHz
  Detailed Timing Descriptors:
    DTD 1:  3440x1440   60.001010 Hz  43:18    88.861 kHz    320.790000 MHz (800 mm x 335 mm)
                 Hfront   48 Hsync  32 Hback   90 Hpol P
                 Vfront    3 Vsync  10 Vback   28 Vpol N
    Display Range Limits:
      Monitor ranges (Bare Limits): 60-165 Hz V, 255-255 kHz H, max dotclock 930 MHz
    Display Product Name: 'HP X34'
    Display Product Serial Number: '6CM1440BL5'
  Extension blocks: 2
Checksum: 0xdc

----------------

Block 1, CTA-861 Extension Block:
  Revision: 3
  Underscans IT Video Formats by default
  Basic audio support
  Supports YCbCr 4:4:4
  Supports YCbCr 4:2:2
  Native detailed modes: 1
  Video Data Block:
    VIC  16:  1920x1080   60.000000 Hz  16:9     67.500 kHz    148.500000 MHz
    VIC  63:  1920x1080  120.000000 Hz  16:9    135.000 kHz    297.000000 MHz
    VIC  64:  1920x1080  100.000000 Hz  16:9    112.500 kHz    297.000000 MHz
    VIC   4:  1280x720    60.000000 Hz  16:9     45.000 kHz     74.250000 MHz
    VIC   3:   720x480    59.940060 Hz  16:9     31.469 kHz     27.000000 MHz
    VIC   2:   720x480    59.940060 Hz   4:3     31.469 kHz     27.000000 MHz
    VIC   1:   640x480    59.940476 Hz   4:3     31.469 kHz     25.175000 MHz
  Audio Data Block:
    Linear PCM:
      Max channels: 2
      Supported sample rates (kHz): 48 44.1 32
      Supported sample sizes (bits): 24 20 16
  Speaker Allocation Data Block:
    FL/FR - Front Left/Right
  Vendor-Specific Data Block (AMD), OUI 00-00-1A:
    Version: 2.1
    Minimum Refresh Rate: 60 Hz
    Maximum Refresh Rate: 165 Hz
    Flags 1.x: 0x00
    Flags 2.x: 0x00
    Maximum luminance: 0 (50.000 cd/m^2)
    Minimum luminance: 0 (0.000 cd/m^2)
    Unknown: 0x00 0x00
  Colorimetry Data Block:
    BT2020cYCC
    BT2020YCC
    BT2020RGB
    Gamut Boundary Description Metadata Profile P0
  HDR Static Metadata Data Block:
    Electro optical transfer functions:
      Traditional gamma - SDR luminance range
      Traditional gamma - HDR luminance range
      SMPTE ST2084
    Supported static metadata descriptors:
      Static metadata type 1
    Desired content max luminance: 96 (400.000 cd/m^2)
    Desired content max frame-average luminance: 90 (351.250 cd/m^2)
    Desired content min luminance: 51 (0.160 cd/m^2)
  Video Capability Data Block:
    YCbCr quantization: Selectable (via AVI YQ)
    RGB quantization: Selectable (via AVI Q)
    PT scan behavior: Always Underscanned
    IT scan behavior: Always Underscanned
    CE scan behavior: Supports both over- and underscan
  Detailed Timing Descriptors:
    DTD 2:  3440x1440   75.000186 Hz  43:18   111.900 kHz    403.960000 MHz (800 mm x 335 mm)
                 Hfront   48 Hsync  32 Hback   90 Hpol P
                 Vfront    3 Vsync  10 Vback   39 Vpol N
    DTD 3:  3440x1440  100.000000 Hz  43:18   151.000 kHz    545.110000 MHz (800 mm x 335 mm)
                 Hfront   48 Hsync  32 Hback   90 Hpol P
                 Vfront    3 Vsync  10 Vback   57 Vpol N
    DTD 4:  2560x1440  119.997589 Hz  16:9    182.996 kHz    497.750000 MHz (800 mm x 335 mm)
                 Hfront   48 Hsync  32 Hback   80 Hpol P
                 Vfront    3 Vsync   5 Vback   77 Vpol N
Checksum: 0x83  Unused space in Extension Block: 25 bytes

----------------

Block 2, DisplayID Extension Block:
  Version: 1.2
  Extension Count: 0
  Display Product Type: Extension Section
  Video Timing Modes Type 1 - Detailed Timings Data Block:
    DTD:  3440x1440  120.000000 Hz   0:0    183.000 kHz    660.630000 MHz (aspect undefined, no 3D stereo)
               Hfront   48 Hsync  32 Hback   90 Hpol P
               Vfront    3 Vsync  10 Vback   72 Vpol N
    DTD:  3440x1440  143.999440 Hz   0:0    222.191 kHz    802.110000 MHz (aspect undefined, no 3D stereo)
               Hfront   48 Hsync  32 Hback   90 Hpol P
               Vfront    3 Vsync  10 Vback   90 Vpol N
    DTD:  3440x1440  165.000216 Hz   0:0    242.550 kHz    915.870000 MHz (aspect undefined, no 3D stereo, preferred)
               Hfront   48 Hsync  32 Hback  256 Hpol P
               Vfront    3 Vsync  10 Vback   17 Vpol N
  Checksum: 0x74
Checksum: 0x90
