edid-decode (hex):

00 ff ff ff ff ff ff 00 34 a9 02 c3 01 01 01 01
00 13 01 02 0e 46 27 78 ea ee bd a3 54 47 99 26
0c 47 4a 21 0a 00 31 40 45 40 61 40 01 01 01 01
01 01 01 01 01 01 64 19 00 1a 41 00 2a 30 6e 28
55 00 a7 88 21 00 00 1e 00 00 00 fd 00 3b 3d 1e
3c 08 00 0a 20 20 20 20 20 20 00 00 00 fc 00 50
61 6e 61 73 6f 6e 69 63 2d 54 56 0a 00 00 00 fc
00 54 43 2d 4c 33 32 58 32 30 41 41 0a 20 00 e0

----------------

Block 0, Base EDID:
  EDID Structure Version & Revision: 1.2
  Vendor & Product Identification:
    Manufacturer: MEI
    Model: 49922
    Serial Number: ...
    Made in: 2009
  Basic Display Parameters & Features:
    Analog display
    Signal Level Standard: 0.700 : 0.300 : 1.000 V p-p
    Blank level equals black level
    Sync: Separate Composite SyncOnGreen
    Maximum image size: 70 cm x 39 cm
    Gamma: 2.20
    DPMS levels: Standby Suspend Off
    RGB color display
    First detailed timing is the preferred timing
  Color Characteristics:
    Red  : 0.6396, 0.3300
    Green: 0.2802, 0.5996
    Blue : 0.1503, 0.0498
    White: 0.2802, 0.2900
  Established Timings I & II:
    DMT 0x04:   640x480    59.940476 Hz   4:3     31.469 kHz     25.175000 MHz
    DMT 0x09:   800x600    60.316541 Hz   4:3     37.879 kHz     40.000000 MHz
    DMT 0x10:  1024x768    60.003840 Hz   4:3     48.363 kHz     65.000000 MHz
    DMT 0x12:  1024x768    75.028582 Hz   4:3     60.023 kHz     78.750000 MHz
  Standard Timings:
    DMT 0x04:   640x480    59.940476 Hz   4:3     31.469 kHz     25.175000 MHz
    DMT 0x09:   800x600    60.316541 Hz   4:3     37.879 kHz     40.000000 MHz
    DMT 0x10:  1024x768    60.003840 Hz   4:3     48.363 kHz     65.000000 MHz
  Detailed Timing Descriptors:
    DTD 1:  1024x768    61.444804 Hz   4:3     49.770 kHz     65.000000 MHz (679 mm x 392 mm)
                 Hfront  110 Hsync  40 Hback  132 Hpol P
                 Vfront    5 Vsync   5 Vback   32 Vpol P
    Display Range Limits:
      Monitor ranges (GTF): 59-61 Hz V, 30-60 kHz H, max dotclock 80 MHz
    Display Product Name: 'Panasonic-TV'
    Display Product Name: 'TC-L32X20AA'
Checksum: 0xe0

----------------

Warnings:

Block 0, Base EDID:
  EDID Structure Version & Revision: EDID 1.2 is deprecated, do not use.

Failures:

EDID:
  Base EDID: Some timings are out of range of the Monitor Ranges:
    Vertical Freq: 59.940 - 75.029 Hz (Monitor: 59.000 - 61.000 Hz)

EDID conformity: FAIL
