edid-decode (hex):

00 ff ff ff ff ff ff 00 1a b3 00 07 01 01 01 01
33 10 01 03 68 2f 1e 82 2a d4 25 a4 55 49 9b 27
13 50 54 a5 4b 00 95 0f 95 00 81 80 81 40 81 c0
01 01 01 01 01 01 21 39 90 30 62 1a 27 40 68 b0
36 00 da 28 11 00 00 1e 00 00 00 fd 00 38 4c 1e
52 0f 00 0a 20 20 20 20 20 20 00 00 00 fc 00 4c
32 32 2d 31 57 0a 20 20 20 20 20 20 00 00 00 ff
00 59 45 53 50 30 31 30 33 35 35 0a 20 20 00 77

00 ff ff ff ff ff ff 00 1a b3 00 07 01 01 01 01
33 10 01 03 68 2f 1e 82 2a d4 25 a4 55 49 9b 27
13 50 54 a5 4b 00 95 0f 95 00 81 80 81 40 81 c0
01 01 01 01 01 01 21 39 90 30 62 1a 27 40 68 b0
36 00 da 28 11 00 00 1e 00 00 00 fd 00 38 4c 1e
52 0f 00 0a 20 20 20 20 20 20 00 00 00 fc 00 4c
32 32 2d 31 57 0a 20 20 20 20 20 20 00 00 00 ff
00 59 45 53 50 30 31 30 33 35 35 0a 20 20 00 77

----------------

Block 0, Base EDID:
  EDID Structure Version & Revision: 1.3
  Vendor & Product Identification:
    Manufacturer: FUS
    Model: 1792
    Serial Number: ...
    Made in: week 51 of 2006
  Basic Display Parameters & Features:
    Analog display
    Signal Level Standard: 0.700 : 0.000 : 0.700 V p-p
    Blank level equals black level
    Sync: Separate
    Maximum image size: 47 cm x 30 cm
    Gamma: 2.30
    DPMS levels: Off
    RGB color display
    First detailed timing is the preferred timing
  Color Characteristics:
    Red  : 0.6435, 0.3330
    Green: 0.2861, 0.6054
    Blue : 0.1523, 0.0761
    White: 0.3134, 0.3291
  Established Timings I & II:
    IBM     :   720x400    70.081663 Hz   9:5     31.467 kHz     28.320000 MHz
    DMT 0x04:   640x480    59.940476 Hz   4:3     31.469 kHz     25.175000 MHz
    DMT 0x06:   640x480    75.000000 Hz   4:3     37.500 kHz     31.500000 MHz
    DMT 0x09:   800x600    60.316541 Hz   4:3     37.879 kHz     40.000000 MHz
    DMT 0x0b:   800x600    75.000000 Hz   4:3     46.875 kHz     49.500000 MHz
    DMT 0x10:  1024x768    60.003840 Hz   4:3     48.363 kHz     65.000000 MHz
    DMT 0x12:  1024x768    75.028582 Hz   4:3     60.023 kHz     78.750000 MHz
    DMT 0x24:  1280x1024   75.024675 Hz   5:4     79.976 kHz    135.000000 MHz
  Standard Timings:
    DMT 0x30:  1440x900    74.984427 Hz  16:10    70.635 kHz    136.750000 MHz
    DMT 0x2f:  1440x900    59.887445 Hz  16:10    55.935 kHz    106.500000 MHz
    DMT 0x23:  1280x1024   60.019740 Hz   5:4     63.981 kHz    108.000000 MHz
    DMT 0x20:  1280x960    60.000000 Hz   4:3     60.000 kHz    108.000000 MHz
    DMT 0x55:  1280x720    60.000000 Hz  16:9     45.000 kHz     74.250000 MHz
  Detailed Timing Descriptors:
    DTD 1:  1680x1050   59.954250 Hz  16:10    65.290 kHz    146.250000 MHz (474 mm x 296 mm)
                 Hfront  104 Hsync 176 Hback  280 Hpol P
                 Vfront    3 Vsync   6 Vback   30 Vpol P
    Display Range Limits:
      Monitor ranges (GTF): 56-76 Hz V, 30-82 kHz H, max dotclock 150 MHz
    Display Product Name: 'L22-1W'
    Display Product Serial Number: ...
Checksum: 0x77

----------------

Block 1, Unknown EDID Extension Block 0x00:
  00 ff ff ff ff ff ff 00 1a b3 00 07 01 01 01 01 '................'
  33 10 01 03 68 2f 1e 82 2a d4 25 a4 55 49 9b 27 '3...h/..*.%.UI.''
  13 50 54 a5 4b 00 95 0f 95 00 81 80 81 40 81 c0 '.PT.K........@..'
  01 01 01 01 01 01 21 39 90 30 62 1a 27 40 68 b0 '......!9.0b.'@h.'
  36 00 da 28 11 00 00 1e 00 00 00 fd 00 38 4c 1e '6..(.........8L.'
  52 0f 00 0a 20 20 20 20 20 20 00 00 00 fc 00 4c 'R...      .....L'
  32 32 2d 31 57 0a 20 20 20 20 20 20 00 00 00 ff '22-1W.      ....'
  00 59 45 53 50 30 31 30 33 35 35 0a 20 20 00 77 '.YESP010355.  .w'
Checksum: 0x77

----------------

Warnings:

Block 0, Base EDID:
  Detailed Timing Descriptor #1: DTD is similar but not identical to DMT 0x3a.

Failures:

Block 1, Base EDID:
  Unknown Extension Block.
EDID:
  Base EDID: EDID specified 0 extension block(s), but found 1 extension block(s).

EDID conformity: FAIL
