edid-decode (hex):

00 ff ff ff ff ff ff 00 51 f3 92 50 00 00 00 00
0e 10 01 03 80 1f 11 78 ca 09 25 92 57 54 8f 29
22 50 54 00 00 00 01 01 01 01 01 01 01 01 01 01
01 01 01 01 01 01 4c 26 40 a0 60 84 1a 30 30 20
35 00 35 ae 10 00 00 18 00 00 00 fd 00 3b 3d 37
39 0a 00 0a 20 20 20 20 20 20 00 00 00 fc 00 49
6e 74 65 72 6e 61 6c 20 4c 43 44 0a 00 00 00 fe
00 54 4f 53 48 49 42 41 0a 20 20 20 20 20 00 22

----------------

Block 0, Base EDID:
  EDID Structure Version & Revision: 1.3
  Vendor & Product Identification:
    Manufacturer: TOS
    Model: 20626
    Made in: week 14 of 2006
  Basic Display Parameters & Features:
    Digital display
    Maximum image size: 31 cm x 17 cm
    Gamma: 2.20
    DPMS levels: Standby Suspend
    RGB color display
    First detailed timing is preferred timing
  Color Characteristics:
    Red  : 0.5703, 0.3398
    Green: 0.3300, 0.5595
    Blue : 0.1601, 0.1347
    White: 0.3134, 0.3291
  Established Timings I & II: none
  Standard Timings: none
  Detailed Timing Descriptors:
    DTD 1:  1600x900    60.156 Hz  16:9    55.705 kHz  98.040 MHz (309 mm x 174 mm)
                 Hfront   48 Hsync  32 Hback  80 Hpol N
                 Vfront    3 Vsync   5 Vback  18 Vpol N
  Display Range Limits:
    Monitor ranges (GTF): 59-61 Hz V, 55-57 kHz H, max dotclock 100 MHz
    Display Product Name: 'Internal LCD'
    Alphanumeric Data String: 'TOSHIBA'
Checksum: 0x22

----------------

EDID conformity: PASS
