edid-decode (hex):

00 ff ff ff ff ff ff 00 30 e4 d5 03 00 00 00 00
00 16 01 03 80 23 13 78 0a 1f 65 94 58 57 8f 28
1e 50 54 00 00 00 01 01 01 01 01 01 01 01 01 01
01 01 01 01 01 01 58 1b 56 7e 50 00 0e 30 24 30
35 00 59 c2 10 00 00 19 00 00 00 00 00 00 00 00
00 00 00 00 00 00 00 00 00 00 00 00 00 fe 00 4c
47 20 44 69 73 70 6c 61 79 0a 20 20 00 00 00 fe
00 4c 50 31 35 36 57 48 41 2d 53 4c 4c 31 00 a6

----------------

Block 0, Base EDID:
  EDID Structure Version & Revision: 1.3
  Vendor & Product Identification:
    Manufacturer: LGD
    Model: 981
    Made in: 2012
  Basic Display Parameters & Features:
    Digital display
    Maximum image size: 35 cm x 19 cm
    Gamma: 2.20
    RGB color display
    First detailed timing is preferred timing
  Color Characteristics:
    Red  : 0.5781, 0.3447
    Green: 0.3427, 0.5615
    Blue : 0.1572, 0.1191
    White: 0.3134, 0.3291
  Established Timings I & II: none
  Standard Timings: none
  Detailed Timing Descriptors:
    DTD 1:  1366x768    59.996 Hz 683:384  46.917 kHz  70.000 MHz (345 mm x 194 mm)
                 Hfront   36 Hsync  48 Hback  42 Hpol N
                 Vfront    3 Vsync   5 Vback   6 Vpol N
    Empty Descriptor
    Alphanumeric Data String: 'LG Display'
    Alphanumeric Data String: 'LP156WHA-SLL1'
Checksum: 0xa6
