edid-decode (hex):

00 ff ff ff ff ff ff 00 06 af 9e 12 00 00 00 00
00 15 01 04 90 26 15 78 02 c4 95 9e 57 53 92 26
0f 50 54 00 00 00 01 01 01 01 01 01 01 01 01 01
01 01 01 01 01 01 1b 26 40 9a 60 84 1a 30 30 20
36 00 7e d6 10 00 00 18 00 00 00 0f 00 00 00 00
00 00 00 00 00 00 00 00 00 20 00 00 00 fe 00 41
55 4f 0a 20 20 20 20 20 20 20 20 20 00 00 00 fe
00 42 31 37 33 52 54 4e 30 31 2e 32 20 0a 00 e5

----------------

Block 0, Base EDID:
  EDID Structure Version & Revision: 1.4
  Vendor & Product Identification:
    Manufacturer: AUO
    Model: 4766
    Made in: 2011
  Basic Display Parameters & Features:
    Digital display
    Bits per primary color channel: 6
    Digital interface is not defined
    Maximum image size: 38 cm x 21 cm
    Gamma: 2.20
    Supported color formats: RGB 4:4:4
    First detailed timing includes the native pixel format and preferred refresh rate
  Color Characteristics:
    Red  : 0.6201, 0.3398
    Green: 0.3251, 0.5703
    Blue : 0.1503, 0.0595
    White: 0.3134, 0.3291
  Established Timings I & II: none
  Standard Timings: none
  Detailed Timing Descriptors:
    DTD 1:  1600x900    60.060189 Hz  16:9     55.616 kHz     97.550000 MHz (382 mm x 214 mm)
                 Hfront   48 Hsync  32 Hback   74 Hpol N
                 Vfront    3 Vsync   6 Vback   17 Vpol N
    Manufacturer-Specified Display Descriptor (0x0f): 00 0f 00 00 00 00 00 00 00 00 00 00 00 00 00 20 '............... '
    Alphanumeric Data String: 'AUO'
    Alphanumeric Data String: 'B173RTN01.2 '
Checksum: 0xe5

----------------

Warnings:

Block 0, Base EDID:
  Missing Display Product Name.

Failures:

Block 0, Base EDID:
  Alphanumeric Data String: One or more trailing spaces.

EDID conformity: FAIL
