edid-decode (hex):

00 ff ff ff ff ff ff 00 10 ac 17 d0 4c 5a 43 30
0b 12 01 04 6a 25 17 78 ef b6 90 a6 54 51 91 25
17 50 54 a5 4b 00 81 80 71 4f 95 00 01 01 01 01
01 01 01 01 01 01 ab 22 a0 a0 50 84 1a 30 30 20
36 00 72 e6 10 00 00 1a 00 00 00 ff 00 50 4b 32
35 36 38 33 42 30 43 5a 4c 0a 00 00 00 fd 00 32
4d 1e 53 0e 04 11 b2 05 f8 58 f0 00 00 00 00 fc
00 44 45 4c 4c 20 53 45 31 37 38 57 46 50 00 26

----------------

Block 0, Base EDID:
  EDID Structure Version & Revision: 1.4
  Vendor & Product Identification:
    Manufacturer: DEL
    Model: 53271
    Serial Number: ...
    Made in: week 11 of 2008
  Basic Display Parameters & Features:
    Analog display
    Input voltage level: 0.7/0.7 V
    Blank level equals black level
    Sync: Separate SyncOnGreen
    Maximum image size: 37 cm x 23 cm
    Gamma: 2.20
    DPMS levels: Standby Suspend Off
    RGB color display
    Default (sRGB) color space is primary color space
    First detailed timing includes the native pixel format and preferred refresh rate
    Display is continuous frequency
  Color Characteristics:
    Red  : 0.6503, 0.3310
    Green: 0.3173, 0.5683
    Blue : 0.1464, 0.0908
    White: 0.3125, 0.3281
  Established Timings I & II:
    IBM     :   720x400    70.082 Hz   9:5    31.467 kHz  28.320 MHz
    DMT 0x04:   640x480    59.940 Hz   4:3    31.469 kHz  25.175 MHz
    DMT 0x06:   640x480    75.000 Hz   4:3    37.500 kHz  31.500 MHz
    DMT 0x09:   800x600    60.317 Hz   4:3    37.879 kHz  40.000 MHz
    DMT 0x0b:   800x600    75.000 Hz   4:3    46.875 kHz  49.500 MHz
    DMT 0x10:  1024x768    60.004 Hz   4:3    48.363 kHz  65.000 MHz
    DMT 0x12:  1024x768    75.029 Hz   4:3    60.023 kHz  78.750 MHz
    DMT 0x24:  1280x1024   75.025 Hz   5:4    79.976 kHz 135.000 MHz
  Standard Timings:
    DMT 0x23:  1280x1024   60.020 Hz   5:4    63.981 kHz 108.000 MHz
    DMT 0x15:  1152x864    75.000 Hz   4:3    67.500 kHz 108.000 MHz
    DMT 0x2f:  1440x900    59.887 Hz  16:10   55.935 kHz 106.500 MHz
  Detailed Timing Descriptors:
    DTD 1:  1440x900    59.901 Hz   8:5    55.469 kHz  88.750 MHz (370 mm x 230 mm)
                 Hfront   48 Hsync  32 Hback  80 Hpol P
                 Vfront    3 Vsync   6 Vback  17 Vpol N
    Display Product Serial Number: ...
  Display Range Limits:
    Monitor ranges (CVT): 50-77 Hz V, 30-83 kHz H, max dotclock 140 MHz
    CVT version 1.1
    Real max dotclock: 129.00 MHz
    Max active pixels per line: 4136
    Supported aspect ratios: 4:3 16:9 16:10 5:4 15:9
    Preferred aspect ratio: 16:10
    Supports CVT standard blanking
    Supports CVT reduced blanking
    Supported display scaling:
      Horizontal shrink
      Horizontal stretch
      Vertical shrink
      Vertical stretch
    Display Product Name: 'DELL SE178WFP'
Checksum: 0x26

----------------

Warnings:

Block 0, Base EDID:
  Display Range Limits: CVT block corrects dotclock by more than 9.75 MHz.
  Display Range Limits: CVT block does not set preferred refresh rate.

Failures:

Block 0, Base EDID:
  Basic Display Parameters & Features: sRGB is signaled, but the chromaticities do not match.

EDID conformity: FAIL
