
EDID (hex):
00ffffffffffff0030aeb18a00000000
1e200104b51f1478032e50ad5143b026
0f505400000001010101010101010101
010101010101809700a0c08050703020
360038c310000018000000fd001e78f0
f04e010a202020202020000000fe004c
454e4f564f0a202020202020000000fe
004c454e3134352d334b0a20202002da
02030f00e60601016060230000000000
00000000000000000000000000000000
00000000000000000000000000000000
00000000000000000000000000000000
00000000000000000000000000000000
00000000000000000000000000000000
00000000000000000000000000000000
00000000000000000000000000001dfe
7012790000030114002f0105ff0b9f00
2f001f007f074f000200050000000000
00000000000000000000000000000000
00000000000000000000000000000000
00000000000000000000000000000000
00000000000000000000000000000000
00000000000000000000000000000000
00000000000000000000000000005590

edid-decode (hex):

00 ff ff ff ff ff ff 00 30 ae b1 8a 00 00 00 00
1e 20 01 04 b5 1f 14 78 03 2e 50 ad 51 43 b0 26
0f 50 54 00 00 00 01 01 01 01 01 01 01 01 01 01
01 01 01 01 01 01 80 97 00 a0 c0 80 50 70 30 20
36 00 38 c3 10 00 00 18 00 00 00 fd 00 1e 78 f0
f0 4e 01 0a 20 20 20 20 20 20 00 00 00 fe 00 4c
45 4e 4f 56 4f 0a 20 20 20 20 20 20 00 00 00 fe
00 4c 45 4e 31 34 35 2d 33 4b 0a 20 20 20 02 da

02 03 0f 00 e6 06 01 01 60 60 23 00 00 00 00 00
00 00 00 00 00 00 00 00 00 00 00 00 00 00 00 00
00 00 00 00 00 00 00 00 00 00 00 00 00 00 00 00
00 00 00 00 00 00 00 00 00 00 00 00 00 00 00 00
00 00 00 00 00 00 00 00 00 00 00 00 00 00 00 00
00 00 00 00 00 00 00 00 00 00 00 00 00 00 00 00
00 00 00 00 00 00 00 00 00 00 00 00 00 00 00 00
00 00 00 00 00 00 00 00 00 00 00 00 00 00 1d fe

70 12 79 00 00 03 01 14 00 2f 01 05 ff 0b 9f 00
2f 00 1f 00 7f 07 4f 00 02 00 05 00 00 00 00 00
00 00 00 00 00 00 00 00 00 00 00 00 00 00 00 00
00 00 00 00 00 00 00 00 00 00 00 00 00 00 00 00
00 00 00 00 00 00 00 00 00 00 00 00 00 00 00 00
00 00 00 00 00 00 00 00 00 00 00 00 00 00 00 00
00 00 00 00 00 00 00 00 00 00 00 00 00 00 00 00
00 00 00 00 00 00 00 00 00 00 00 00 00 00 55 90

----------------

Block 0, Base EDID:
  EDID Structure Version & Revision: 1.4
  Vendor & Product Identification:
    Manufacturer: LEN
    Model: 35505
    Made in: week 30 of 2022
  Basic Display Parameters & Features:
    Digital display
    Bits per primary color channel: 10
    DisplayPort interface
    Maximum image size: 31 cm x 20 cm
    Gamma: 2.20
    Supported color formats: RGB 4:4:4
    First detailed timing includes the native pixel format and preferred refresh rate
    Display is continuous frequency
  Color Characteristics:
    Red  : 0.6757, 0.3183
    Green: 0.2646, 0.6894
    Blue : 0.1494, 0.0595
    White: 0.3125, 0.3281
  Established Timings I & II: none
  Standard Timings: none
  Detailed Timing Descriptors:
    DTD 1:  3072x1920   60.000000 Hz  16:10   120.000 kHz    387.840000 MHz (312 mm x 195 mm)
                 Hfront   48 Hsync  32 Hback   80 Hpol N
                 Vfront    3 Vsync   6 Vback   71 Vpol N
    Display Range Limits:
      Monitor ranges (Bare Limits): 30-120 Hz V, 240-240 kHz H, max dotclock 780 MHz
    Alphanumeric Data String: 'LENOVO'
    Alphanumeric Data String: 'LEN145-3K'
  Extension blocks: 2
Checksum: 0xda

----------------

Block 1, CTA-861 Extension Block:
  Revision: 3
  Native detailed modes: 0
  HDR Static Metadata Data Block:
    Electro optical transfer functions:
      Traditional gamma - SDR luminance range
    Supported static metadata descriptors:
      Static metadata type 1
    Desired content max luminance: 96 (400.000 cd/m^2)
    Desired content max frame-average luminance: 96 (400.000 cd/m^2)
    Desired content min luminance: 35 (0.075 cd/m^2)
  Unknown CTA-861 Data Block (tag 0x00, length 0):
  Unknown CTA-861 Data Block (tag 0x00, length 0):
  Unknown CTA-861 Data Block (tag 0x00, length 0):
  Unknown CTA-861 Data Block (tag 0x00, length 0):
Checksum: 0xfe  Unused space in Extension Block: 112 bytes

----------------

Block 2, DisplayID Extension Block:
  Version: 1.2
  Extension Count: 0
  Display Product Type: Extension Section
  Video Timing Modes Type 1 - Detailed Timings Data Block:
    DTD:  3072x1920  120.001547 Hz  16:10   240.003 kHz    775.690000 MHz (aspect 16:10, no 3D stereo)
               Hfront   48 Hsync  32 Hback   80 Hpol N
               Vfront    3 Vsync   6 Vback   71 Vpol N
  Checksum: 0x55
Checksum: 0x90


