
EDID (hex):
00ffffffffffff005c85605001010101
24110103084728782a82ffa655469824
0f4749bfee008bc08100818081c00101
0101010101019d1c5682500030302820
3500c58f2100001a000000fd00324b1e
460b000a202020202020000000fc0057
657374696e67686f7573650a000000fc
00534b2d333248323430530a2020008d

Extracted contents:
header:          00 ff ff ff ff ff ff 00
serial number:   5c 85 60 50 01 01 01 01 24 11
version:         01 03
basic params:    08 47 28 78 2a
chroma info:     82 ff a6 55 46 98 24 0f 47 49
established:     bf ee 00
standard:        8b c0 81 00 81 80 81 c0 01 01 01 01 01 01 01 01
descriptor 1:    9d 1c 56 82 50 00 30 30 28 20 35 00 c5 8f 21 00 00 1a
descriptor 2:    00 00 00 fd 00 32 4b 1e 46 0b 00 0a 20 20 20 20 20 20
descriptor 3:    00 00 00 fc 00 57 65 73 74 69 6e 67 68 6f 75 73 65 0a
descriptor 4:    00 00 00 fc 00 53 4b 2d 33 32 48 32 34 30 53 0a 20 20
extensions:      00
checksum:        8d

EDID version: 1.3
Manufacturer: WDE Model 5060 Serial Number --
Made in week 36 of 2007
Analog display, Input voltage level: 0.7/0.3 V
Sync: Separate 
Maximum image size: 71 cm x 40 cm
Gamma: 2.20
DPMS levels: Off
RGB color display
First detailed timing is preferred timing
Display x,y Chromaticity:
  Red:   0.6503, 0.3320
  Green: 0.2734, 0.5957
  Blue:  0.1435, 0.0615
  White: 0.2802, 0.2880
Established timings supported:
  720x400@70Hz 9:5 HorFreq: 31469 Hz Clock: 28.320 MHz
  640x480@60Hz 4:3 HorFreq: 31469 Hz Clock: 25.175 MHz
  640x480@67Hz 4:3 HorFreq: 35000 Hz Clock: 30.240 MHz
  640x480@72Hz 4:3 HorFreq: 37900 Hz Clock: 31.500 MHz
  640x480@75Hz 4:3 HorFreq: 37500 Hz Clock: 31.500 MHz
  800x600@56Hz 4:3 HorFreq: 35200 Hz Clock: 36.000 MHz
  800x600@60Hz 4:3 HorFreq: 37900 Hz Clock: 40.000 MHz
  800x600@72Hz 4:3 HorFreq: 48100 Hz Clock: 50.000 MHz
  800x600@75Hz 4:3 HorFreq: 46900 Hz Clock: 49.500 MHz
  832x624@75Hz 4:3 HorFreq: 49726 Hz Clock: 57.284 MHz
  1024x768@60Hz 4:3 HorFreq: 48400 Hz Clock: 65.000 MHz
  1024x768@70Hz 4:3 HorFreq: 56500 Hz Clock: 75.000 MHz
  1024x768@75Hz 4:3 HorFreq: 60000 Hz Clock: 78.750 MHz
Standard timings supported:
  1360x765@60Hz 16:9
  1280x800@60Hz 16:10
  1280x1024@60Hz 5:4 HorFreq: 64000 Hz Clock: 108.000 MHz
  1280x720@60Hz 16:9
Detailed mode: Clock 73.250 MHz, 709 mm x 399 mm
               1366 1406 1438 1496 hborder 0
                768  771  776  816 vborder 0
               +hsync -vsync 
               VertFreq: 60 Hz, HorFreq: 48963 Hz
Monitor ranges (GTF): 50-75Hz V, 30-70kHz H, max dotclock 110MHz
Monitor name: Westinghouse
Checksum: 0x8d (valid)
