edid-decode (hex):

00 ff ff ff ff ff ff 00 0d af 20 15 00 00 00 00
00 00 01 03 80 21 14 78 0a 77 f1 a0 5a 4b 96 24
18 4f 54 00 00 00 01 01 01 01 01 01 01 01 01 01
01 01 01 01 01 01 5e 33 90 2a 61 1a 3a 40 5b 3c
6c 00 4b cf 10 00 00 18 00 00 00 fe 00 4e 31 35
34 5a 31 2d 4c 30 31 0a 20 20 00 00 00 fe 00 43
4d 4f 0a 20 20 20 20 20 20 20 20 20 00 00 00 fe
00 4e 31 35 34 5a 31 2d 4c 30 31 0a 20 20 00 f2

----------------

Block 0, Base EDID:
  EDID Structure Version & Revision: 1.3
  Vendor & Product Identification:
    Manufacturer: CMO
    Model: 5408
    Made in: 1990
  Basic Display Parameters & Features:
    Digital display
    Maximum image size: 33 cm x 20 cm
    Gamma: 2.20
    RGB color display
    First detailed timing is the preferred timing
  Color Characteristics:
    Red  : 0.6259, 0.3544
    Green: 0.2939, 0.5888
    Blue : 0.1435, 0.0966
    White: 0.3085, 0.3291
  Established Timings I & II: none
  Standard Timings: none
  Detailed Timing Descriptors:
    DTD 1:  1680x1050   60.001 Hz   8:5    66.481 kHz 131.500 MHz (331 mm x 207 mm)
                 Hfront   91 Hsync  60 Hback 147 Hpol N
                 Vfront    6 Vsync  12 Vback  40 Vpol N
    Alphanumeric Data String: 'N154Z1-L01'
    Alphanumeric Data String: 'CMO'
    Alphanumeric Data String: 'N154Z1-L01'
Checksum: 0xf2

----------------

Failures:

Block 0, Base EDID:
  Missing Display Product Name.
  Missing Display Range Limits Descriptor.

EDID conformity: FAIL
