edid-decode (hex):

00 ff ff ff ff ff ff 00 41 0c e1 08 7e 26 00 00
2a 18 01 04 a5 58 31 78 3a f6 3d a3 55 4e 9e 27
0d 47 4a bd 4b 00 d1 c0 81 80 81 40 95 0f 95 00
b3 00 81 c0 01 01 50 d0 00 a0 f0 70 3e 80 30 58
8a 00 6e e5 31 00 00 1a 02 3a 80 18 71 38 2d 40
58 2c 45 00 6e e5 31 00 00 1e 00 00 00 fc 00 50
48 4c 20 42 44 4d 34 30 36 35 0a 20 00 00 00 fd
00 17 50 1e a0 3c 01 0a 20 20 20 20 20 20 01 c6

02 03 23 f4 4b 01 02 03 04 05 90 11 12 13 14 1f
23 09 07 07 83 01 00 00 6a 03 0c 00 40 00 00 78
20 00 00 02 3a 80 d0 72 38 2d 40 10 2c 96 80 6e
e5 31 00 00 18 02 3a 80 18 71 38 2d 40 58 2c 96
00 6e e5 31 00 00 18 04 74 00 30 f2 70 5a 80 b0
58 8a 00 6e e5 31 00 00 1a 01 1d 00 bc 52 d0 1e
20 b8 28 55 40 6e e5 31 00 00 1e 00 00 00 00 00
00 00 00 00 00 00 00 00 00 00 00 00 00 00 00 ec

00 ff ff ff ff ff ff 00 41 0c e1 08 7e 26 00 00
2a 18 01 04 a5 58 31 78 3a f6 3d a3 55 4e 9e 27
0d 47 4a bd 4b 00 d1 c0 81 80 81 40 95 0f 95 00
b3 00 81 c0 01 01 50 d0 00 a0 f0 70 3e 80 30 58
8a 00 6e e5 31 00 00 1a 02 3a 80 18 71 38 2d 40
58 2c 45 00 6e e5 31 00 00 1e 00 00 00 fc 00 50
48 4c 20 42 44 4d 34 30 36 35 0a 20 00 00 00 fd
00 17 50 1e a0 3c 01 0a 20 20 20 20 20 20 01 c6

02 03 23 f4 4b 01 02 03 04 05 90 11 12 13 14 1f
23 09 07 07 83 01 00 00 6a 03 0c 00 40 00 00 78
20 00 00 02 3a 80 d0 72 38 2d 40 10 2c 96 80 6e
e5 31 00 00 18 02 3a 80 18 71 38 2d 40 58 2c 96
00 6e e5 31 00 00 18 04 74 00 30 f2 70 5a 80 b0
58 8a 00 6e e5 31 00 00 1a 01 1d 00 bc 52 d0 1e
20 b8 28 55 40 6e e5 31 00 00 1e 00 00 00 00 00
00 00 00 00 00 00 00 00 00 00 00 00 00 00 00 ec

----------------

Block 0, Base EDID:
  EDID Structure Version & Revision: 1.4
  Vendor & Product Identification:
    Manufacturer: PHL
    Model: 2273
    Serial Number: ...
    Made in: week 42 of 2014
  Basic Display Parameters & Features:
    Digital display
    Bits per primary color channel: 8
    DisplayPort interface
    Maximum image size: 88 cm x 49 cm
    Gamma: 2.20
    DPMS levels: Off
    Supported color formats: RGB 4:4:4, YCrCb 4:4:4, YCrCb 4:2:2
    First detailed timing includes the native pixel format and preferred refresh rate
  Color Characteristics:
    Red  : 0.6396, 0.3349
    Green: 0.3056, 0.6191
    Blue : 0.1523, 0.0537
    White: 0.2802, 0.2900
  Established Timings I & II:
    IBM     :   720x400    70.081663 Hz   9:5     31.467 kHz     28.320000 MHz
    DMT 0x04:   640x480    59.940476 Hz   4:3     31.469 kHz     25.175000 MHz
    Apple   :   640x480    66.666667 Hz   4:3     35.000 kHz     30.240000 MHz
    DMT 0x05:   640x480    72.808802 Hz   4:3     37.861 kHz     31.500000 MHz
    DMT 0x06:   640x480    75.000000 Hz   4:3     37.500 kHz     31.500000 MHz
    DMT 0x09:   800x600    60.316541 Hz   4:3     37.879 kHz     40.000000 MHz
    DMT 0x0b:   800x600    75.000000 Hz   4:3     46.875 kHz     49.500000 MHz
    DMT 0x10:  1024x768    60.003840 Hz   4:3     48.363 kHz     65.000000 MHz
    DMT 0x12:  1024x768    75.028582 Hz   4:3     60.023 kHz     78.750000 MHz
    DMT 0x24:  1280x1024   75.024675 Hz   5:4     79.976 kHz    135.000000 MHz
  Standard Timings:
    DMT 0x52:  1920x1080   60.000000 Hz  16:9     67.500 kHz    148.500000 MHz
    DMT 0x23:  1280x1024   60.019740 Hz   5:4     63.981 kHz    108.000000 MHz
    DMT 0x20:  1280x960    60.000000 Hz   4:3     60.000 kHz    108.000000 MHz
    DMT 0x30:  1440x900    74.984427 Hz  16:10    70.635 kHz    136.750000 MHz
    DMT 0x2f:  1440x900    59.887445 Hz  16:10    55.935 kHz    106.500000 MHz
    DMT 0x3a:  1680x1050   59.954250 Hz  16:10    65.290 kHz    146.250000 MHz
    DMT 0x55:  1280x720    60.000000 Hz  16:9     45.000 kHz     74.250000 MHz
  Detailed Timing Descriptors:
    DTD  1:  3840x2160   60.000000 Hz  16:9    133.320 kHz    533.280000 MHz (878 mm x 485 mm)
                  Hfront   48 Hsync  88 Hback   24 Hpol P
                  Vfront    8 Vsync  10 Vback   44 Vpol N
    DTD  2:  1920x1080   60.000000 Hz  16:9     67.500 kHz    148.500000 MHz (878 mm x 485 mm)
                  Hfront   88 Hsync  44 Hback  148 Hpol P
                  Vfront    4 Vsync   5 Vback   36 Vpol P
    Display Product Name: 'PHL BDM4065'
    Display Range Limits:
      Monitor ranges (Bare Limits): 23-80 Hz V, 30-160 kHz H, max dotclock 600 MHz
  Extension blocks: 1
Checksum: 0xc6

----------------

Block 1, CTA-861 Extension Block:
  Revision: 3
  Underscans IT Video Formats by default
  Basic audio support
  Supports YCbCr 4:4:4
  Supports YCbCr 4:2:2
  Native detailed modes: 4
  Video Data Block:
    VIC   1:   640x480    59.940476 Hz   4:3     31.469 kHz     25.175000 MHz
    VIC   2:   720x480    59.940060 Hz   4:3     31.469 kHz     27.000000 MHz
    VIC   3:   720x480    59.940060 Hz  16:9     31.469 kHz     27.000000 MHz
    VIC   4:  1280x720    60.000000 Hz  16:9     45.000 kHz     74.250000 MHz
    VIC   5:  1920x1080i  60.000000 Hz  16:9     33.750 kHz     74.250000 MHz
    VIC  16:  1920x1080   60.000000 Hz  16:9     67.500 kHz    148.500000 MHz (native)
    VIC  17:   720x576    50.000000 Hz   4:3     31.250 kHz     27.000000 MHz
    VIC  18:   720x576    50.000000 Hz  16:9     31.250 kHz     27.000000 MHz
    VIC  19:  1280x720    50.000000 Hz  16:9     37.500 kHz     74.250000 MHz
    VIC  20:  1920x1080i  50.000000 Hz  16:9     28.125 kHz     74.250000 MHz
    VIC  31:  1920x1080   50.000000 Hz  16:9     56.250 kHz    148.500000 MHz
  Audio Data Block:
    Linear PCM:
      Max channels: 2
      Supported sample rates (kHz): 48 44.1 32
      Supported sample sizes (bits): 24 20 16
  Speaker Allocation Data Block:
    FL/FR - Front Left/Right
  Vendor-Specific Data Block (HDMI), OUI 00-0C-03:
    Source physical address: 4.0.0.0
    Maximum TMDS clock: 600 MHz
    Extended HDMI video details:
  Detailed Timing Descriptors:
    DTD  3:  1920x1080   50.000000 Hz  16:9     56.250 kHz    148.500000 MHz (878 mm x 485 mm)
                  Hfront  528 Hsync  44 Hback  148 Hpol N
                  Vfront    9 Vsync   6 Vback   30 Vpol N
    DTD  4:  1920x1080   60.000000 Hz  16:9     67.500 kHz    148.500000 MHz (878 mm x 485 mm)
                  Hfront   88 Hsync  44 Hback  148 Hpol N
                  Vfront    9 Vsync   6 Vback   30 Vpol N
    DTD  5:  3840x2160   30.000000 Hz  16:9     67.500 kHz    297.000000 MHz (878 mm x 485 mm)
                  Hfront  176 Hsync  88 Hback  296 Hpol P
                  Vfront    8 Vsync  10 Vback   72 Vpol N
    DTD  6:  1280x720    50.000000 Hz  16:9     37.500 kHz     74.250000 MHz (878 mm x 485 mm)
                  Hfront  440 Hsync  40 Hback  220 Hpol P
                  Vfront    5 Vsync   5 Vback   20 Vpol P
Checksum: 0xec  Unused space in Extension Block: 20 bytes

----------------

Block 2, Unknown EDID Extension Block 0x00:
  00 ff ff ff ff ff ff 00 41 0c e1 08 7e 26 00 00 '........A...~&..'
  2a 18 01 04 a5 58 31 78 3a f6 3d a3 55 4e 9e 27 '*....X1x:.=.UN.''
  0d 47 4a bd 4b 00 d1 c0 81 80 81 40 95 0f 95 00 '.GJ.K......@....'
  b3 00 81 c0 01 01 50 d0 00 a0 f0 70 3e 80 30 58 '......P....p>.0X'
  8a 00 6e e5 31 00 00 1a 02 3a 80 18 71 38 2d 40 '..n.1....:..q8-@'
  58 2c 45 00 6e e5 31 00 00 1e 00 00 00 fc 00 50 'X,E.n.1........P'
  48 4c 20 42 44 4d 34 30 36 35 0a 20 00 00 00 fd 'HL BDM4065. ....'
  00 17 50 1e a0 3c 01 0a 20 20 20 20 20 20 01 c6 '..P..<..      ..'
Checksum: 0xc6

----------------

Block 3, CTA-861 Extension Block:
  Revision: 3
  Underscans IT Video Formats by default
  Basic audio support
  Supports YCbCr 4:4:4
  Supports YCbCr 4:2:2
  Native detailed modes: 4
  Video Data Block:
    VIC   1:   640x480    59.940476 Hz   4:3     31.469 kHz     25.175000 MHz
    VIC   2:   720x480    59.940060 Hz   4:3     31.469 kHz     27.000000 MHz
    VIC   3:   720x480    59.940060 Hz  16:9     31.469 kHz     27.000000 MHz
    VIC   4:  1280x720    60.000000 Hz  16:9     45.000 kHz     74.250000 MHz
    VIC   5:  1920x1080i  60.000000 Hz  16:9     33.750 kHz     74.250000 MHz
    VIC  16:  1920x1080   60.000000 Hz  16:9     67.500 kHz    148.500000 MHz (native)
    VIC  17:   720x576    50.000000 Hz   4:3     31.250 kHz     27.000000 MHz
    VIC  18:   720x576    50.000000 Hz  16:9     31.250 kHz     27.000000 MHz
    VIC  19:  1280x720    50.000000 Hz  16:9     37.500 kHz     74.250000 MHz
    VIC  20:  1920x1080i  50.000000 Hz  16:9     28.125 kHz     74.250000 MHz
    VIC  31:  1920x1080   50.000000 Hz  16:9     56.250 kHz    148.500000 MHz
  Audio Data Block:
    Linear PCM:
      Max channels: 2
      Supported sample rates (kHz): 48 44.1 32
      Supported sample sizes (bits): 24 20 16
  Speaker Allocation Data Block:
    FL/FR - Front Left/Right
  Vendor-Specific Data Block (HDMI), OUI 00-0C-03:
    Source physical address: 4.0.0.0
    Maximum TMDS clock: 600 MHz
    Extended HDMI video details:
  Detailed Timing Descriptors:
    DTD  7:  1920x1080   50.000000 Hz  16:9     56.250 kHz    148.500000 MHz (878 mm x 485 mm)
                  Hfront  528 Hsync  44 Hback  148 Hpol N
                  Vfront    9 Vsync   6 Vback   30 Vpol N
    DTD  8:  1920x1080   60.000000 Hz  16:9     67.500 kHz    148.500000 MHz (878 mm x 485 mm)
                  Hfront   88 Hsync  44 Hback  148 Hpol N
                  Vfront    9 Vsync   6 Vback   30 Vpol N
    DTD  9:  3840x2160   30.000000 Hz  16:9     67.500 kHz    297.000000 MHz (878 mm x 485 mm)
                  Hfront  176 Hsync  88 Hback  296 Hpol P
                  Vfront    8 Vsync  10 Vback   72 Vpol N
    DTD 10:  1280x720    50.000000 Hz  16:9     37.500 kHz     74.250000 MHz (878 mm x 485 mm)
                  Hfront  440 Hsync  40 Hback  220 Hpol P
                  Vfront    5 Vsync   5 Vback   20 Vpol P
Checksum: 0xec  Unused space in Extension Block: 20 bytes

----------------

Warnings:

Block 1, CTA-861 Extension Block:
  Detailed Timing Descriptor #3: DTD is similar but not identical to VIC 31.
  Detailed Timing Descriptor #4: DTD is similar but not identical to VIC 16.
  Detailed Timing Descriptor #5: DTD is similar but not identical to VIC 95.
  Add a Colorimetry Data Block with the sRGB colorimetry bit set to avoid interop issues.
Block 3, CTA-861 Extension Block:
  Detailed Timing Descriptor #7: DTD is similar but not identical to VIC 31.
  Detailed Timing Descriptor #8: DTD is similar but not identical to VIC 16.
  Detailed Timing Descriptor #9: DTD is similar but not identical to VIC 95.
  Add a Colorimetry Data Block with the sRGB colorimetry bit set to avoid interop issues.
EDID:
  Base EDID: Some timings are out of range of the Monitor Ranges:
    Horizontal Freq: 28.125 - 133.320 kHz (Monitor: 30.000 - 160.000 kHz)

Failures:

Block 1, CTA-861 Extension Block:
  Vendor-Specific Data Block (HDMI), OUI 00-0C-03: HDMI VSDB Max TMDS rate is > 340.
  Vendor-Specific Data Block (HDMI), OUI 00-0C-03: The HDMI Specification requires EDID 1.3 instead of 1.4.
  Missing VCDB, needed for Set Selectable RGB Quantization to avoid interop issues.
Block 2, Base EDID:
  Unknown Extension Block.
Block 3, CTA-861 Extension Block:
  Video Data Block: Duplicate VIC 1.
  Video Data Block: Duplicate VIC 2.
  Video Data Block: Duplicate VIC 3.
  Video Data Block: Duplicate VIC 4.
  Video Data Block: Duplicate VIC 5.
  Video Data Block: Duplicate VIC 16.
  Video Data Block: Duplicate VIC 17.
  Video Data Block: Duplicate VIC 18.
  Video Data Block: Duplicate VIC 19.
  Video Data Block: Duplicate VIC 20.
  Video Data Block: Duplicate VIC 31.
  Speaker Allocation Data Block: Only one instance of this Data Block is allowed.
  Vendor-Specific Data Block (HDMI), OUI 00-0C-03: HDMI VSDB Max TMDS rate is > 340.
  Vendor-Specific Data Block (HDMI), OUI 00-0C-03: The HDMI Specification requires EDID 1.3 instead of 1.4.
  Missing VCDB, needed for Set Selectable RGB Quantization to avoid interop issues.
EDID:
  Base EDID: EDID specified 1 extension block(s), but found 3 extension block(s).
  CTA-861: Native progressive timings are a mix of several resolutions.

EDID conformity: FAIL
