
EDID (hex):
00ffffffffffff00410ce10878180000
1d190103805831782af63da3554e9e27
0d474abd4b00d1c081808140950f9500
b30081c0010104740030f2705a80b058
8a006ee53100001a565e00a0a0a02950
302035006ee53100001e000000fc0050
484c2042444d343036350a20000000fd
0017501e631e000a2020202020200113
02032af14f0102030506071011121314
15161f0423090707830100006d030c00
2000003c200060010203023a80d07238
2d40102c96806ee531000018ef5100a0
f0701980302035006ee53100001a0474
0030f2705a80b0588a006ee53100001a
7d3900a080381f4030203a006ee53100
001a000000000000000000000000007f

Extracted contents:
header:          00 ff ff ff ff ff ff 00
serial number:   41 0c e1 08 78 18 00 00 1d 19
version:         01 03
basic params:    80 58 31 78 2a
chroma info:     f6 3d a3 55 4e 9e 27 0d 47 4a
established:     bd 4b 00
standard:        d1 c0 81 80 81 40 95 0f 95 00 b3 00 81 c0 01 01
descriptor 1:    04 74 00 30 f2 70 5a 80 b0 58 8a 00 6e e5 31 00 00 1a
descriptor 2:    56 5e 00 a0 a0 a0 29 50 30 20 35 00 6e e5 31 00 00 1e
descriptor 3:    00 00 00 fc 00 50 48 4c 20 42 44 4d 34 30 36 35 0a 20
descriptor 4:    00 00 00 fd 00 17 50 1e 63 1e 00 0a 20 20 20 20 20 20
extensions:      01
checksum:        13

EDID version: 1.3
Manufacturer: PHL Model 8e1 Serial Number --
Made in week 29 of 2015
Digital display
Maximum image size: 88 cm x 49 cm
Gamma: 2.20
DPMS levels: Off
RGB color display
First detailed timing is preferred timing
Display x,y Chromaticity:
  Red:   0.6396, 0.3349
  Green: 0.3056, 0.6191
  Blue:  0.1523, 0.0537
  White: 0.2802, 0.2900
Established timings supported:
  720x400@70Hz 9:5 HorFreq: 31469 Hz Clock: 28.320 MHz
  640x480@60Hz 4:3 HorFreq: 31469 Hz Clock: 25.175 MHz
  640x480@67Hz 4:3 HorFreq: 35000 Hz Clock: 30.240 MHz
  640x480@72Hz 4:3 HorFreq: 37900 Hz Clock: 31.500 MHz
  640x480@75Hz 4:3 HorFreq: 37500 Hz Clock: 31.500 MHz
  800x600@60Hz 4:3 HorFreq: 37900 Hz Clock: 40.000 MHz
  800x600@75Hz 4:3 HorFreq: 46900 Hz Clock: 49.500 MHz
  1024x768@60Hz 4:3 HorFreq: 48400 Hz Clock: 65.000 MHz
  1024x768@75Hz 4:3 HorFreq: 60000 Hz Clock: 78.750 MHz
  1280x1024@75Hz 5:4 HorFreq: 80000 Hz Clock: 135.000 MHz
Standard timings supported:
  1920x1080@60Hz 16:9
  1280x1024@60Hz 5:4 HorFreq: 64000 Hz Clock: 108.000 MHz
  1280x960@60Hz 4:3 HorFreq: 60000 Hz Clock: 108.000 MHz
  1440x900@75Hz 16:10 HorFreq: 82300 Hz Clock: 156.000 MHz
  1440x900@60Hz 16:10 HorFreq: 55500 Hz Clock: 88.750 MHz
  1680x1050@60Hz 16:10 HorFreq: 64700 Hz Clock: 119.000 MHz
  1280x720@60Hz 16:9
Detailed mode: Clock 297.000 MHz, 878 mm x 485 mm
               3840 4016 4104 4400 hborder 0
               2160 2168 2178 2250 vborder 0
               +hsync -vsync 
               VertFreq: 30 Hz, HorFreq: 67500 Hz
Detailed mode: Clock 241.500 MHz, 878 mm x 485 mm
               2560 2608 2640 2720 hborder 0
               1440 1443 1448 1481 vborder 0
               +hsync +vsync 
               VertFreq: 59 Hz, HorFreq: 88786 Hz
Monitor name: PHL BDM4065
Monitor ranges (GTF): 23-80Hz V, 30-99kHz H, max dotclock 300MHz
Has 1 extension blocks
Checksum: 0x13 (valid)

CTA extension block
Extension version: 3
38 bytes of CTA data
  Video data block
    VIC   1 640x480@60Hz 4:3  HorFreq: 31469 Hz Clock: 25.175 MHz
    VIC   2 720x480@60Hz 4:3  HorFreq: 31469 Hz Clock: 27.000 MHz
    VIC   3 720x480@60Hz 16:9  HorFreq: 31469 Hz Clock: 27.000 MHz
    VIC   5 1920x1080i@60Hz 16:9  HorFreq: 33750 Hz Clock: 74.250 MHz
    VIC   6 1440x480i@60Hz 4:3  HorFreq: 15734 Hz Clock: 27.000 MHz
    VIC   7 1440x480i@60Hz 16:9  HorFreq: 15734 Hz Clock: 27.000 MHz
    VIC  16 1920x1080@60Hz 16:9  HorFreq: 67500 Hz Clock: 148.500 MHz
    VIC  17 720x576@50Hz 4:3  HorFreq: 31250 Hz Clock: 27.000 MHz
    VIC  18 720x576@50Hz 16:9  HorFreq: 31250 Hz Clock: 27.000 MHz
    VIC  19 1280x720@50Hz 16:9  HorFreq: 37500 Hz Clock: 74.250 MHz
    VIC  20 1920x1080i@50Hz 16:9  HorFreq: 28125 Hz Clock: 74.250 MHz
    VIC  21 1440x576i@50Hz 4:3  HorFreq: 15625 Hz Clock: 27.000 MHz
    VIC  22 1440x576i@50Hz 16:9  HorFreq: 15625 Hz Clock: 27.000 MHz
    VIC  31 1920x1080@50Hz 16:9  HorFreq: 56250 Hz Clock: 148.500 MHz
    VIC   4 1280x720@60Hz 16:9  HorFreq: 45000 Hz Clock: 74.250 MHz
  Audio data block
    Linear PCM, max channels 2
      Supported sample rates (kHz): 48 44.1 32
      Supported sample sizes (bits): 24 20 16
  Speaker allocation data block
    Speaker map:
      FL/FR - Front Left/Right
  Vendor-specific data block, OUI 000c03 (HDMI)
    Source physical address 2.0.0.0
    Maximum TMDS clock: 300MHz
    Extended HDMI video details:
      HDMI VIC 1 3840x2160@30Hz 16:9 HorFreq: 67500 Hz Clock: 297.000 MHz
      HDMI VIC 2 3840x2160@25Hz 16:9 HorFreq: 56250 Hz Clock: 297.000 MHz
      HDMI VIC 3 3840x2160@24Hz 16:9 HorFreq: 54000 Hz Clock: 297.000 MHz
Underscans PC formats by default
Basic audio support
Supports YCbCr 4:4:4
Supports YCbCr 4:2:2
1 native detailed modes
Detailed mode: Clock 148.500 MHz, 878 mm x 485 mm
               1920 2448 2492 2640 hborder 0
               1080 1089 1095 1125 vborder 0
               -hsync -vsync 
               VertFreq: 50 Hz, HorFreq: 56250 Hz
Detailed mode: Clock 209.750 MHz, 878 mm x 485 mm
               3840 3888 3920 4000 hborder 0
               2160 2163 2168 2185 vborder 0
               +hsync -vsync 
               VertFreq: 23 Hz, HorFreq: 52437 Hz
Detailed mode: Clock 297.000 MHz, 878 mm x 485 mm
               3840 4016 4104 4400 hborder 0
               2160 2168 2178 2250 vborder 0
               +hsync -vsync 
               VertFreq: 30 Hz, HorFreq: 67500 Hz
Detailed mode: Clock 147.170 MHz, 878 mm x 485 mm
               2048 2096 2128 2208 hborder 0
               1080 1083 1093 1111 vborder 0
               +hsync -vsync 
               VertFreq: 59 Hz, HorFreq: 66653 Hz
Checksum: 0x7f (valid)

One or more of the timings is out of range of the Monitor Ranges:
  Vertical Freq: 23 - 75 Hz
  Horizontal Freq: 15625 - 88786 Hz
  Maximum Clock: 297.000 MHz
Warning: HDMI VIC Codes must have their CTA-861 VIC equivalents in the VSB
