
EDID (hex):
00ffffffffffff001ab3e10701000000
0c150103802f1e782ac665a059589d27
0e5054a54b009500950f8100810f81c0
8180b300010121399030621a274068b0
3600da281100001c7c2e90a0601a1e40
30203600da281100001a000000fc0053
4c3232572d31204c45440a20000000ff
005956334d3032303132320a20200048

edid-decode (hex):

00 ff ff ff ff ff ff 00 1a b3 e1 07 01 00 00 00
0c 15 01 03 80 2f 1e 78 2a c6 65 a0 59 58 9d 27
0e 50 54 a5 4b 00 95 00 95 0f 81 00 81 0f 81 c0
81 80 b3 00 01 01 21 39 90 30 62 1a 27 40 68 b0
36 00 da 28 11 00 00 1c 7c 2e 90 a0 60 1a 1e 40
30 20 36 00 da 28 11 00 00 1a 00 00 00 fc 00 53
4c 32 32 57 2d 31 20 4c 45 44 0a 20 00 00 00 ff
00 59 56 33 4d 30 32 30 31 32 32 0a 20 20 00 48

----------------

Block 0, Base EDID:
  EDID Structure Version & Revision: 1.3
  Vendor & Product Identification:
    Manufacturer: FUS
    Model: 2017
    Serial Number: 1
    Made in: week 12 of 2011
  Basic Display Parameters & Features:
    Digital display
    Maximum image size: 47 cm x 30 cm
    Gamma: 2.20
    DPMS levels: Off
    RGB color display
    First detailed timing is the preferred timing
  Color Characteristics:
    Red  : 0.6279, 0.3476
    Green: 0.3447, 0.6152
    Blue : 0.1533, 0.0566
    White: 0.3134, 0.3291
  Established Timings I & II:
    IBM     :   720x400    70.081663 Hz   9:5     31.467 kHz     28.320000 MHz
    DMT 0x04:   640x480    59.940476 Hz   4:3     31.469 kHz     25.175000 MHz
    DMT 0x06:   640x480    75.000000 Hz   4:3     37.500 kHz     31.500000 MHz
    DMT 0x09:   800x600    60.316541 Hz   4:3     37.879 kHz     40.000000 MHz
    DMT 0x0b:   800x600    75.000000 Hz   4:3     46.875 kHz     49.500000 MHz
    DMT 0x10:  1024x768    60.003840 Hz   4:3     48.363 kHz     65.000000 MHz
    DMT 0x12:  1024x768    75.028582 Hz   4:3     60.023 kHz     78.750000 MHz
    DMT 0x24:  1280x1024   75.024675 Hz   5:4     79.976 kHz    135.000000 MHz
  Standard Timings:
    DMT 0x2f:  1440x900    59.887445 Hz  16:10    55.935 kHz    106.500000 MHz
    DMT 0x30:  1440x900    74.984427 Hz  16:10    70.635 kHz    136.750000 MHz
    DMT 0x1c:  1280x800    59.810326 Hz  16:10    49.702 kHz     83.500000 MHz
    DMT 0x1d:  1280x800    74.934142 Hz  16:10    62.795 kHz    106.500000 MHz
    DMT 0x55:  1280x720    60.000000 Hz  16:9     45.000 kHz     74.250000 MHz
    DMT 0x23:  1280x1024   60.019740 Hz   5:4     63.981 kHz    108.000000 MHz
    DMT 0x3a:  1680x1050   59.954250 Hz  16:10    65.290 kHz    146.250000 MHz
  Detailed Timing Descriptors:
    DTD 1:  1680x1050   59.954250 Hz  16:10    65.290 kHz    146.250000 MHz (474 mm x 296 mm)
                 Hfront  104 Hsync 176 Hback  280 Hpol N
                 Vfront    3 Vsync   6 Vback   30 Vpol P
    DTD 2:  1680x1050   59.883253 Hz  16:10    64.674 kHz    119.000000 MHz (474 mm x 296 mm)
                 Hfront   48 Hsync  32 Hback   80 Hpol P
                 Vfront    3 Vsync   6 Vback   21 Vpol N
    Display Product Name: 'SL22W-1 LED'
    Display Product Serial Number: 'YV3M020122'
Checksum: 0x48


