
EDID (hex):
00ffffffffffff0030a3872301000000
2b1f010380351d78ead7a5a2594a9624
145054afcf00714f8100818081c09500
950fb300818a023a801871382d40582c
45000f262100001e000000ff00474b34
34313930330a20202020000000fd0032
4c1e5312000a202020202020000000fc
004c45434f4f204d323431330a2001cc
020320f14d0102030401078212130216
0310230907078301000065030c001000
011d007251d01e206e2855000f262100
001e8c0ad08a20e02d10103e96000f26
2100001e662156aa51001e30468f3300
0f262100001e2a4480a070382740302c
45000f262100001e0000000000000000
00000000000000000000000000000050

Extracted contents:
header:          00 ff ff ff ff ff ff 00
serial number:   30 a3 87 23 01 00 00 00 2b 1f
version:         01 03
basic params:    80 35 1d 78 ea
chroma info:     d7 a5 a2 59 4a 96 24 14 50 54
established:     af cf 00
standard:        71 4f 81 00 81 80 81 c0 95 00 95 0f b3 00 81 8a
descriptor 1:    02 3a 80 18 71 38 2d 40 58 2c 45 00 0f 26 21 00 00 1e
descriptor 2:    00 00 00 ff 00 47 4b 34 34 31 39 30 33 0a 20 20 20 20
descriptor 3:    00 00 00 fd 00 32 4c 1e 53 12 00 0a 20 20 20 20 20 20
descriptor 4:    00 00 00 fc 00 4c 45 43 4f 4f 20 4d 32 34 31 33 0a 20
extensions:      01
checksum:        cc

EDID version: 1.3
Manufacturer: LEC Model 2387 Serial Number --
Made in week 43 of 2021
Digital display
Maximum image size: 53 cm x 29 cm
Gamma: 2.20
DPMS levels: Standby Suspend Off
RGB color display
First detailed timing is preferred timing
Display x,y Chromaticity:
  Red:   0.6357, 0.3486
  Green: 0.2900, 0.5888
  Blue:  0.1425, 0.0800
  White: 0.3134, 0.3291
Established timings supported:
  720x400@70Hz 9:5 HorFreq: 31469 Hz Clock: 28.320 MHz
  640x480@60Hz 4:3 HorFreq: 31469 Hz Clock: 25.175 MHz
  640x480@72Hz 4:3 HorFreq: 37900 Hz Clock: 31.500 MHz
  640x480@75Hz 4:3 HorFreq: 37500 Hz Clock: 31.500 MHz
  800x600@56Hz 4:3 HorFreq: 35200 Hz Clock: 36.000 MHz
  800x600@60Hz 4:3 HorFreq: 37900 Hz Clock: 40.000 MHz
  800x600@72Hz 4:3 HorFreq: 48100 Hz Clock: 50.000 MHz
  800x600@75Hz 4:3 HorFreq: 46900 Hz Clock: 49.500 MHz
  1024x768@60Hz 4:3 HorFreq: 48400 Hz Clock: 65.000 MHz
  1024x768@70Hz 4:3 HorFreq: 56500 Hz Clock: 75.000 MHz
  1024x768@75Hz 4:3 HorFreq: 60000 Hz Clock: 78.750 MHz
  1280x1024@75Hz 5:4 HorFreq: 80000 Hz Clock: 135.000 MHz
Standard timings supported:
  1152x864@75Hz 4:3 HorFreq: 67500 Hz Clock: 108.000 MHz
  1280x800@60Hz 16:10
  1280x1024@60Hz 5:4 HorFreq: 64000 Hz Clock: 108.000 MHz
  1280x720@60Hz 16:9
  1440x900@60Hz 16:10 HorFreq: 55500 Hz Clock: 88.750 MHz
  1440x900@75Hz 16:10 HorFreq: 82300 Hz Clock: 156.000 MHz
  1680x1050@60Hz 16:10 HorFreq: 64700 Hz Clock: 119.000 MHz
  1280x1024@70Hz 5:4
Detailed mode: Clock 148.500 MHz, 527 mm x 294 mm
               1920 2008 2052 2200 hborder 0
               1080 1084 1089 1125 vborder 0
               +hsync +vsync 
               VertFreq: 60 Hz, HorFreq: 67500 Hz
Serial number: --
Monitor ranges (GTF): 50-76Hz V, 30-83kHz H, max dotclock 180MHz
Monitor name: LECOO M2413
Has 1 extension blocks
Checksum: 0xcc (valid)

CTA extension block
Extension version: 3
28 bytes of CTA data
  Video data block
    VIC   1 640x480@60Hz 4:3  HorFreq: 31469 Hz Clock: 25.175 MHz
    VIC   2 720x480@60Hz 4:3  HorFreq: 31469 Hz Clock: 27.000 MHz
    VIC   3 720x480@60Hz 16:9  HorFreq: 31469 Hz Clock: 27.000 MHz
    VIC   4 1280x720@60Hz 16:9  HorFreq: 45000 Hz Clock: 74.250 MHz
    VIC   1 640x480@60Hz 4:3  HorFreq: 31469 Hz Clock: 25.175 MHz
    VIC   7 1440x480i@60Hz 16:9  HorFreq: 15734 Hz Clock: 27.000 MHz
    VIC   2 720x480@60Hz 4:3 (native) HorFreq: 31469 Hz Clock: 27.000 MHz
    VIC  18 720x576@50Hz 16:9  HorFreq: 31250 Hz Clock: 27.000 MHz
    VIC  19 1280x720@50Hz 16:9  HorFreq: 37500 Hz Clock: 74.250 MHz
    VIC   2 720x480@60Hz 4:3  HorFreq: 31469 Hz Clock: 27.000 MHz
    VIC  22 1440x576i@50Hz 16:9  HorFreq: 15625 Hz Clock: 27.000 MHz
    VIC   3 720x480@60Hz 16:9  HorFreq: 31469 Hz Clock: 27.000 MHz
    VIC  16 1920x1080@60Hz 16:9  HorFreq: 67500 Hz Clock: 148.500 MHz
  Audio data block
    Linear PCM, max channels 2
      Supported sample rates (kHz): 48 44.1 32
      Supported sample sizes (bits): 24 20 16
  Speaker allocation data block
    Speaker map:
      FL/FR - Front Left/Right
  Vendor-specific data block, OUI 000c03 (HDMI)
    Source physical address 1.0.0.0
Underscans PC formats by default
Basic audio support
Supports YCbCr 4:4:4
Supports YCbCr 4:2:2
1 native detailed modes
Detailed mode: Clock 74.250 MHz, 527 mm x 294 mm
               1280 1390 1430 1650 hborder 0
                720  725  730  750 vborder 0
               +hsync +vsync 
               VertFreq: 60 Hz, HorFreq: 45000 Hz
Detailed mode: Clock 27.000 MHz, 527 mm x 294 mm
                720  736  798  858 hborder 0
                480  489  495  525 vborder 0
               +hsync +vsync 
               VertFreq: 59 Hz, HorFreq: 31468 Hz
Detailed mode: Clock 85.500 MHz, 527 mm x 294 mm
               1366 1436 1579 1792 hborder 0
                768  771  774  798 vborder 0
               +hsync +vsync 
               VertFreq: 59 Hz, HorFreq: 47712 Hz
Detailed mode: Clock 174.500 MHz, 527 mm x 294 mm
               1920 1968 2012 2080 hborder 0
               1080 1084 1089 1119 vborder 0
               +hsync +vsync 
               VertFreq: 74 Hz, HorFreq: 83894 Hz
Checksum: 0x50 (valid)

One or more of the timings is out of range of the Monitor Ranges:
  Vertical Freq: 50 - 75 Hz
  Horizontal Freq: 15625 - 83894 Hz
  Maximum Clock: 174.500 MHz
EDID block does not conform at all!
	Both the serial number and the serial string are set
