edid-decode (hex):

00 ff ff ff ff ff ff 00 36 cd 92 01 00 00 00 00
14 11 01 04 08 29 1a 78 ea c9 05 a3 57 4b 9c 25
12 50 54 bf ef 80 71 40 71 4f 81 40 81 4f 81 c0
81 80 95 00 95 0f 9a 29 a0 d0 51 84 22 30 50 98
36 00 9a 00 11 00 00 1c 00 00 00 fd 00 37 4c 1e
53 0e 00 00 00 00 00 00 00 00 00 00 00 fc 00 4d
56 31 39 32 57 5f 41 0a 20 20 20 20 65 35 a0 f0
51 84 2a 30 60 98 36 00 9a 00 11 00 00 1c 00 1c

00 ff ff ff ff ff ff 00 36 cd 92 01 00 00 00 00
14 11 01 04 08 29 1a 78 ea c9 05 a3 57 4b 9c 25
12 50 54 bf ef 80 71 40 71 4f 81 40 81 4f 81 c0
81 80 95 00 95 0f 9a 29 a0 d0 51 84 22 30 50 98
36 00 9a 00 11 00 00 1c 00 00 00 fd 00 37 4c 1e
53 0e 00 00 00 00 00 00 00 00 00 00 00 fc 00 4d
56 31 39 32 57 5f 41 0a 20 20 20 20 65 35 a0 f0
51 84 2a 30 60 98 36 00 9a 00 11 00 00 1c 00 1c

----------------

Block 0, Base EDID:
  EDID Structure Version & Revision: 1.4
  Vendor & Product Identification:
    Manufacturer: MVM
    Model: 402
    Made in: week 20 of 2007
  Basic Display Parameters & Features:
    Analog display
    Signal Level Standard: 0.700 : 0.300 : 1.000 V p-p
    Blank level equals black level
    Sync: Separate
    Maximum image size: 41 cm x 26 cm
    Gamma: 2.20
    DPMS levels: Standby Suspend Off
    RGB color display
    First detailed timing includes the native pixel format and preferred refresh rate
  Color Characteristics:
    Red  : 0.6396, 0.3398
    Green: 0.2949, 0.6103
    Blue : 0.1445, 0.0703
    White: 0.3134, 0.3291
  Established Timings I & II:
    IBM     :   720x400    70.081663 Hz   9:5     31.467 kHz     28.320000 MHz
    DMT 0x04:   640x480    59.940476 Hz   4:3     31.469 kHz     25.175000 MHz
    Apple   :   640x480    66.666667 Hz   4:3     35.000 kHz     30.240000 MHz
    DMT 0x05:   640x480    72.808802 Hz   4:3     37.861 kHz     31.500000 MHz
    DMT 0x06:   640x480    75.000000 Hz   4:3     37.500 kHz     31.500000 MHz
    DMT 0x08:   800x600    56.250000 Hz   4:3     35.156 kHz     36.000000 MHz
    DMT 0x09:   800x600    60.316541 Hz   4:3     37.879 kHz     40.000000 MHz
    DMT 0x0a:   800x600    72.187572 Hz   4:3     48.077 kHz     50.000000 MHz
    DMT 0x0b:   800x600    75.000000 Hz   4:3     46.875 kHz     49.500000 MHz
    Apple   :   832x624    74.551266 Hz   4:3     49.726 kHz     57.284000 MHz
    DMT 0x10:  1024x768    60.003840 Hz   4:3     48.363 kHz     65.000000 MHz
    DMT 0x11:  1024x768    70.069359 Hz   4:3     56.476 kHz     75.000000 MHz
    DMT 0x12:  1024x768    75.028582 Hz   4:3     60.023 kHz     78.750000 MHz
    DMT 0x24:  1280x1024   75.024675 Hz   5:4     79.976 kHz    135.000000 MHz
    Apple   :  1152x870    75.061550 Hz 192:145   68.681 kHz    100.000000 MHz
  Standard Timings:
    GTF     :  1152x864    60.000000 Hz   4:3     53.700 kHz     81.624000 MHz
    DMT 0x15:  1152x864    75.000000 Hz   4:3     67.500 kHz    108.000000 MHz
    DMT 0x20:  1280x960    60.000000 Hz   4:3     60.000 kHz    108.000000 MHz
    GTF     :  1280x960    74.999884 Hz   4:3     75.150 kHz    129.859000 MHz
    DMT 0x55:  1280x720    60.000000 Hz  16:9     45.000 kHz     74.250000 MHz
    DMT 0x23:  1280x1024   60.019740 Hz   5:4     63.981 kHz    108.000000 MHz
    DMT 0x2f:  1440x900    59.887445 Hz  16:10    55.935 kHz    106.500000 MHz
    DMT 0x30:  1440x900    74.984427 Hz  16:10    70.635 kHz    136.750000 MHz
  Detailed Timing Descriptors:
    DTD 1:  1440x900    59.887445 Hz  16:10    55.935 kHz    106.500000 MHz (410 mm x 256 mm)
                 Hfront   80 Hsync 152 Hback  232 Hpol N
                 Vfront    3 Vsync   6 Vback   25 Vpol P
    Display Range Limits:
      Monitor ranges (GTF): 55-76 Hz V, 30-83 kHz H, max dotclock 140 MHz
    Display Product Name: 'MV192W_A'
    DTD 2:  1440x900    74.951527 Hz  16:10    70.604 kHz    136.690000 MHz (410 mm x 256 mm)
                 Hfront   96 Hsync 152 Hback  248 Hpol N
                 Vfront    3 Vsync   6 Vback   33 Vpol P
Checksum: 0x1c

----------------

Block 1, Unknown EDID Extension Block 0x00:
  00 ff ff ff ff ff ff 00 36 cd 92 01 00 00 00 00 '........6.......'
  14 11 01 04 08 29 1a 78 ea c9 05 a3 57 4b 9c 25 '.....).x....WK.%'
  12 50 54 bf ef 80 71 40 71 4f 81 40 81 4f 81 c0 '.PT...q@qO.@.O..'
  81 80 95 00 95 0f 9a 29 a0 d0 51 84 22 30 50 98 '.......)..Q."0P.'
  36 00 9a 00 11 00 00 1c 00 00 00 fd 00 37 4c 1e '6............7L.'
  53 0e 00 00 00 00 00 00 00 00 00 00 00 fc 00 4d 'S..............M'
  56 31 39 32 57 5f 41 0a 20 20 20 20 65 35 a0 f0 'V192W_A.    e5..'
  51 84 2a 30 60 98 36 00 9a 00 11 00 00 1c 00 1c 'Q.*0`.6.........'
Checksum: 0x1c

----------------

Warnings:

Block 0, Base EDID:
  Display Range Limits: GTF support is deprecated in EDID 1.4.

Failures:

Block 0, Base EDID:
  Display Range Limits: GTF can't be combined with non-continuous frequencies.
  Display Range Limits: Byte 11 is 0x00 instead of 0x0a.
  Display Range Limits: Bytes 12-17 must be 0x20.
  Detailed Timing Descriptor #2: Invalid detailed timing descriptor ordering.
Block 1, Base EDID:
  Unknown Extension Block.
EDID:
  Base EDID: EDID specified 0 extension block(s), but found 1 extension block(s).

EDID conformity: FAIL
