
EDID (hex):
00ffffffffffff000469e11698a00000
31150103682415782a00259e57529929
15505421080081c08100010101010101
010101010101662150b051001b304070
360067d21000001e662156aa51001e30
468f330067d21000001e000000fd0037
3f1e550b000a202020202020000000fc
0041535553205648313638440a20003c

Extracted contents:
header:          00 ff ff ff ff ff ff 00
serial number:   04 69 e1 16 98 a0 00 00 31 15
version:         01 03
basic params:    68 24 15 78 2a
chroma info:     00 25 9e 57 52 99 29 15 50 54
established:     21 08 00
standard:        81 c0 81 00 01 01 01 01 01 01 01 01 01 01 01 01
descriptor 1:    66 21 50 b0 51 00 1b 30 40 70 36 00 67 d2 10 00 00 1e
descriptor 2:    66 21 56 aa 51 00 1e 30 46 8f 33 00 67 d2 10 00 00 1e
descriptor 3:    00 00 00 fd 00 37 3f 1e 55 0b 00 0a 20 20 20 20 20 20
descriptor 4:    00 00 00 fc 00 41 53 55 53 20 56 48 31 36 38 44 0a 20
extensions:      00
checksum:        3c

EDID version: 1.3
Manufacturer: ACI Model 16e1 Serial Number --
Made in week 49 of 2011
Analog display, Input voltage level: 0.7/0.7 V
Sync: Separate 
Maximum image size: 36 cm x 21 cm
Gamma: 2.20
DPMS levels: Off
RGB color display
First detailed timing is preferred timing
Display x,y Chromaticity:
  Red:   0.6171, 0.3398
  Green: 0.3203, 0.5976
  Blue:  0.1601, 0.0839
  White: 0.3134, 0.3291
Established timings supported:
  640x480@60Hz 4:3 HorFreq: 31469 Hz Clock: 25.175 MHz
  800x600@60Hz 4:3 HorFreq: 37900 Hz Clock: 40.000 MHz
  1024x768@60Hz 4:3 HorFreq: 48400 Hz Clock: 65.000 MHz
Standard timings supported:
  1280x720@60Hz 16:9
  1280x800@60Hz 16:10
Detailed mode: Clock 85.500 MHz, 359 mm x 210 mm
               1360 1424 1536 1792 hborder 0
                768  771  777  795 vborder 0
               +hsync +vsync 
               VertFreq: 60 Hz, HorFreq: 47712 Hz
Detailed mode: Clock 85.500 MHz, 359 mm x 210 mm
               1366 1436 1579 1792 hborder 0
                768  771  774  798 vborder 0
               +hsync +vsync 
               VertFreq: 59 Hz, HorFreq: 47712 Hz
Monitor ranges (GTF): 55-63Hz V, 30-85kHz H, max dotclock 110MHz
Monitor name: ASUS VH168D
Checksum: 0x3c (valid)
