
EDID (hex):
00ffffffffffff0022f0004002000000
1513010380331d78eecc53a3484c9926
8d5053010800d1c0b300a940a9c09500
8bc081800101023a801871382d40582c
4500c48e2100001e0000800071485750
0a202020202020202020000000fc0048
5020546f756368536d617274000000fd
00374c1e5311000a20202020202000b1

Extracted contents:
header:          00 ff ff ff ff ff ff 00
serial number:   22 f0 00 40 02 00 00 00 15 13
version:         01 03
basic params:    80 33 1d 78 ee
chroma info:     cc 53 a3 48 4c 99 26 8d 50 53
established:     01 08 00
standard:        d1 c0 b3 00 a9 40 a9 c0 95 00 8b c0 81 80 01 01
descriptor 1:    02 3a 80 18 71 38 2d 40 58 2c 45 00 c4 8e 21 00 00 1e
descriptor 2:    00 00 80 00 71 48 57 50 0a 20 20 20 20 20 20 20 20 20
descriptor 3:    00 00 00 fc 00 48 50 20 54 6f 75 63 68 53 6d 61 72 74
descriptor 4:    00 00 00 fd 00 37 4c 1e 53 11 00 0a 20 20 20 20 20 20
extensions:      00
checksum:        b1

EDID version: 1.3
Manufacturer: HWP Model 4000 Serial Number --
Made in week 21 of 2009
Digital display
Maximum image size: 51 cm x 29 cm
Gamma: 2.20
DPMS levels: Standby Suspend Off
RGB color display
Default (sRGB) color space is primary color space
First detailed timing is preferred timing
Display x,y Chromaticity:
  Red:   0.6396, 0.2812
  Green: 0.2998, 0.5976
  Blue:  0.1494, 0.5517
  White: 0.3125, 0.3271
Established timings supported:
  800x600@60Hz 4:3 HorFreq: 37900 Hz Clock: 40.000 MHz
  1024x768@60Hz 4:3 HorFreq: 48400 Hz Clock: 65.000 MHz
Standard timings supported:
  1920x1080@60Hz 16:9
  1680x1050@60Hz 16:10 HorFreq: 64700 Hz Clock: 119.000 MHz
  1600x1200@60Hz 4:3 HorFreq: 75000 Hz Clock: 162.000 MHz
  1600x900@60Hz 16:9
  1440x900@60Hz 16:10 HorFreq: 55500 Hz Clock: 88.750 MHz
  1360x765@60Hz 16:9
  1280x1024@60Hz 5:4 HorFreq: 64000 Hz Clock: 108.000 MHz
Detailed mode: Clock 148.500 MHz, 708 mm x 398 mm
               1920 2008 2052 2200 hborder 0
               1080 1084 1089 1125 vborder 0
               +hsync +vsync 
               VertFreq: 60 Hz, HorFreq: 67500 Hz
Monitor descriptor block has byte 2 nonzero (0x80)
Monitor descriptor block has byte 4 nonzero (0x71)
Manufacturer-specified data, tag 0
Monitor ranges (GTF): 55-76Hz V, 30-83kHz H, max dotclock 170MHz
Checksum: 0xb1 (valid)
EDID block does NOT conform to EDID 1.3!
	sRGB is signaled, but the chromaticities do not match
	Name descriptor not terminated with a newline
	Invalid descriptor block padding
