edid-decode (hex):

00 ff ff ff ff ff ff 00 1e f9 b4 07 25 10 00 00
04 11 01 03 e8 26 1e 78 ea a2 a5 a3 57 4c 9d 25
11 50 54 af cf 00 81 80 01 01 01 01 01 01 01 01
01 01 01 01 01 01 30 2a 00 98 51 00 2a 40 30 70
13 00 78 2d 11 00 00 1e 00 00 00 ff 00 4d 57 38
37 31 30 34 31 33 33 0a 20 20 00 00 00 fc 00 46
50 44 31 39 36 35 0a 20 20 20 20 20 00 00 00 fd
00 38 4b 1e 53 0e 00 0a 20 20 20 20 20 20 00 ed

00 ff ff ff ff ff ff 00 1e f9 b4 07 25 10 00 00
04 11 01 03 e8 26 1e 78 ea a2 a5 a3 57 4c 9d 25
11 50 54 af cf 00 81 80 01 01 01 01 01 01 01 01
01 01 01 01 01 01 30 2a 00 98 51 00 2a 40 30 70
13 00 78 2d 11 00 00 1e 00 00 00 ff 00 4d 57 38
37 31 30 34 31 33 33 0a 20 20 00 00 00 fc 00 46
50 44 31 39 36 35 0a 20 20 20 20 20 00 00 00 fd
00 38 4b 1e 53 0e 00 0a 20 20 20 20 20 20 00 ed

----------------

Block 0, Base EDID:
  EDID Structure Version & Revision: 1.3
  Vendor & Product Identification:
    Manufacturer: GWY
    Model: 1972
    Serial Number: ...
    Made in: week 4 of 2007
  Basic Display Parameters & Features:
    Digital display
    Maximum image size: 38 cm x 30 cm
    Gamma: 2.20
    DPMS levels: Standby Suspend Off
    RGB color display
    First detailed timing is the preferred timing
  Color Characteristics:
    Red  : 0.6386, 0.3417
    Green: 0.2968, 0.6152
    Blue : 0.1464, 0.0683
    White: 0.3134, 0.3291
  Established Timings I & II:
    IBM     :   720x400    70.081663 Hz   9:5     31.467 kHz     28.320000 MHz
    DMT 0x04:   640x480    59.940476 Hz   4:3     31.469 kHz     25.175000 MHz
    DMT 0x05:   640x480    72.808802 Hz   4:3     37.861 kHz     31.500000 MHz
    DMT 0x06:   640x480    75.000000 Hz   4:3     37.500 kHz     31.500000 MHz
    DMT 0x08:   800x600    56.250000 Hz   4:3     35.156 kHz     36.000000 MHz
    DMT 0x09:   800x600    60.316541 Hz   4:3     37.879 kHz     40.000000 MHz
    DMT 0x0a:   800x600    72.187572 Hz   4:3     48.077 kHz     50.000000 MHz
    DMT 0x0b:   800x600    75.000000 Hz   4:3     46.875 kHz     49.500000 MHz
    DMT 0x10:  1024x768    60.003840 Hz   4:3     48.363 kHz     65.000000 MHz
    DMT 0x11:  1024x768    70.069359 Hz   4:3     56.476 kHz     75.000000 MHz
    DMT 0x12:  1024x768    75.028582 Hz   4:3     60.023 kHz     78.750000 MHz
    DMT 0x24:  1280x1024   75.024675 Hz   5:4     79.976 kHz    135.000000 MHz
  Standard Timings:
    DMT 0x23:  1280x1024   60.019740 Hz   5:4     63.981 kHz    108.000000 MHz
  Detailed Timing Descriptors:
    DTD 1:  1280x1024   60.019740 Hz   5:4     63.981 kHz    108.000000 MHz (376 mm x 301 mm)
                 Hfront   48 Hsync 112 Hback  248 Hpol P
                 Vfront    1 Vsync   3 Vback   38 Vpol P
    Display Product Serial Number: ...
    Display Product Name: 'FPD1965'
    Display Range Limits:
      Monitor ranges (GTF): 56-75 Hz V, 30-83 kHz H, max dotclock 140 MHz
Checksum: 0xed

----------------

Block 1, Unknown EDID Extension Block 0x00:
  00 ff ff ff ff ff ff 00 1e f9 b4 07 25 10 00 00 '............%...'
  04 11 01 03 e8 26 1e 78 ea a2 a5 a3 57 4c 9d 25 '.....&.x....WL.%'
  11 50 54 af cf 00 81 80 01 01 01 01 01 01 01 01 '.PT.............'
  01 01 01 01 01 01 30 2a 00 98 51 00 2a 40 30 70 '......0*..Q.*@0p'
  13 00 78 2d 11 00 00 1e 00 00 00 ff 00 4d 57 38 '..x-.........MW8'
  37 31 30 34 31 33 33 0a 20 20 00 00 00 fc 00 46 '7104133.  .....F'
  50 44 31 39 36 35 0a 20 20 20 20 20 00 00 00 fd 'PD1965.     ....'
  00 38 4b 1e 53 0e 00 0a 20 20 20 20 20 20 00 ed '.8K.S...      ..'
Checksum: 0xed

----------------

Failures:

Block 0, Base EDID:
  Basic Display Parameters & Features: Digital Video Interface Standard set to reserved value 0x68.
Block 1, Base EDID:
  Unknown Extension Block.
EDID:
  Base EDID: EDID specified 0 extension block(s), but found 1 extension block(s).

EDID conformity: FAIL
