
EDID (hex):
00ffffffffffff001ef9b407011f0000
05100103e8261e78eaa2a5a3574c9d25
115054afcf0081800101010101010101
010101010101302a009851002a403070
1300782d1100001e000000ff004d5738
363130373933370a2020000000fc0046
5044313936350a2020202020000000fd
00384b1e530e000a20202020202000f4

Extracted contents:
header:          00 ff ff ff ff ff ff 00
serial number:   1e f9 b4 07 01 1f 00 00 05 10
version:         01 03
basic params:    e8 26 1e 78 ea
chroma info:     a2 a5 a3 57 4c 9d 25 11 50 54
established:     af cf 00
standard:        81 80 01 01 01 01 01 01 01 01 01 01 01 01 01 01
descriptor 1:    30 2a 00 98 51 00 2a 40 30 70 13 00 78 2d 11 00 00 1e
descriptor 2:    00 00 00 ff 00 4d 57 38 36 31 30 37 39 33 37 0a 20 20
descriptor 3:    00 00 00 fc 00 46 50 44 31 39 36 35 0a 20 20 20 20 20
descriptor 4:    00 00 00 fd 00 38 4b 1e 53 0e 00 0a 20 20 20 20 20 20
extensions:      00
checksum:        f4

EDID version: 1.3
Manufacturer: GWY Model 7b4 Serial Number --
Made in week 5 of 2006
Digital display
Maximum image size: 38 cm x 30 cm
Gamma: 2.20
DPMS levels: Standby Suspend Off
RGB color display
First detailed timing is preferred timing
Display x,y Chromaticity:
  Red:   0.6386, 0.3417
  Green: 0.2968, 0.6152
  Blue:  0.1464, 0.0683
  White: 0.3134, 0.3291
Established timings supported:
  720x400@70Hz 9:5 HorFreq: 31469 Hz Clock: 28.320 MHz
  640x480@60Hz 4:3 HorFreq: 31469 Hz Clock: 25.175 MHz
  640x480@72Hz 4:3 HorFreq: 37900 Hz Clock: 31.500 MHz
  640x480@75Hz 4:3 HorFreq: 37500 Hz Clock: 31.500 MHz
  800x600@56Hz 4:3 HorFreq: 35200 Hz Clock: 36.000 MHz
  800x600@60Hz 4:3 HorFreq: 37900 Hz Clock: 40.000 MHz
  800x600@72Hz 4:3 HorFreq: 48100 Hz Clock: 50.000 MHz
  800x600@75Hz 4:3 HorFreq: 46900 Hz Clock: 49.500 MHz
  1024x768@60Hz 4:3 HorFreq: 48400 Hz Clock: 65.000 MHz
  1024x768@70Hz 4:3 HorFreq: 56500 Hz Clock: 75.000 MHz
  1024x768@75Hz 4:3 HorFreq: 60000 Hz Clock: 78.750 MHz
  1280x1024@75Hz 5:4 HorFreq: 80000 Hz Clock: 135.000 MHz
Standard timings supported:
  1280x1024@60Hz 5:4 HorFreq: 64000 Hz Clock: 108.000 MHz
Detailed mode: Clock 108.000 MHz, 376 mm x 301 mm
               1280 1328 1440 1688 hborder 0
               1024 1025 1028 1066 vborder 0
               +hsync +vsync 
               VertFreq: 60 Hz, HorFreq: 63981 Hz
Serial number: --
Monitor name: FPD1965
Monitor ranges (GTF): 56-75Hz V, 30-83kHz H, max dotclock 140MHz
Checksum: 0xf4 (valid)
EDID block does NOT conform to EDID 1.3!
	Digital display field contains garbage: 68
