edid-decode (hex):

00 ff ff ff ff ff ff 00 22 f0 5c 26 01 01 01 01
32 0f 01 03 68 22 1b 78 ee 01 06 a3 57 4a 9c 23
12 4f 54 ad ef 80 81 80 01 01 01 01 01 01 01 01
01 01 01 01 01 01 30 2a 00 98 51 00 2a 40 30 70
13 00 52 0e 11 00 00 1e 00 00 00 fd 00 32 4c 1e
53 0e 00 0a 20 20 20 20 20 20 00 00 00 fc 00 48
50 20 4c 31 37 30 36 0a 20 20 20 20 00 00 00 ff
00 43 4e 4b 35 35 30 31 37 38 56 0a 20 20 00 74

00 ff ff ff ff ff ff 00 22 f0 5c 26 01 01 01 01
32 0f 01 03 68 22 1b 78 ee 01 06 a3 57 4a 9c 23
12 4f 54 ad ef 80 81 80 01 01 01 01 01 01 01 01
01 01 01 01 01 01 30 2a 00 98 51 00 2a 40 30 70
13 00 52 0e 11 00 00 1e 00 00 00 fd 00 32 4c 1e
53 0e 00 0a 20 20 20 20 20 20 00 00 00 fc 00 48
50 20 4c 31 37 30 36 0a 20 20 20 20 00 00 00 ff
00 43 4e 4b 35 35 30 31 37 38 56 0a 20 20 00 74

----------------

Block 0, Base EDID:
  EDID Structure Version & Revision: 1.3
  Vendor & Product Identification:
    Manufacturer: HWP
    Model: 9820
    Serial Number: ...
    Made in: week 50 of 2005
  Basic Display Parameters & Features:
    Analog display
    Signal Level Standard: 0.700 : 0.000 : 0.700 V p-p
    Blank level equals black level
    Sync: Separate
    Maximum image size: 34 cm x 27 cm
    Gamma: 2.20
    DPMS levels: Standby Suspend Off
    RGB color display
    Default (sRGB) color space is primary color space
    First detailed timing is the preferred timing
  Color Characteristics:
    Red  : 0.6367, 0.3398
    Green: 0.2890, 0.6103
    Blue : 0.1367, 0.0703
    White: 0.3095, 0.3300
  Established Timings I & II:
    IBM     :   720x400    70.081663 Hz   9:5     31.467 kHz     28.320000 MHz
    DMT 0x04:   640x480    59.940476 Hz   4:3     31.469 kHz     25.175000 MHz
    DMT 0x05:   640x480    72.808802 Hz   4:3     37.861 kHz     31.500000 MHz
    DMT 0x06:   640x480    75.000000 Hz   4:3     37.500 kHz     31.500000 MHz
    DMT 0x09:   800x600    60.316541 Hz   4:3     37.879 kHz     40.000000 MHz
    DMT 0x0a:   800x600    72.187572 Hz   4:3     48.077 kHz     50.000000 MHz
    DMT 0x0b:   800x600    75.000000 Hz   4:3     46.875 kHz     49.500000 MHz
    Apple   :   832x624    74.551266 Hz   4:3     49.726 kHz     57.284000 MHz
    DMT 0x10:  1024x768    60.003840 Hz   4:3     48.363 kHz     65.000000 MHz
    DMT 0x11:  1024x768    70.069359 Hz   4:3     56.476 kHz     75.000000 MHz
    DMT 0x12:  1024x768    75.028582 Hz   4:3     60.023 kHz     78.750000 MHz
    DMT 0x24:  1280x1024   75.024675 Hz   5:4     79.976 kHz    135.000000 MHz
    Apple   :  1152x870    75.061550 Hz 192:145   68.681 kHz    100.000000 MHz
  Standard Timings:
    DMT 0x23:  1280x1024   60.019740 Hz   5:4     63.981 kHz    108.000000 MHz
  Detailed Timing Descriptors:
    DTD 1:  1280x1024   60.019740 Hz   5:4     63.981 kHz    108.000000 MHz (338 mm x 270 mm)
                 Hfront   48 Hsync 112 Hback  248 Hpol P
                 Vfront    1 Vsync   3 Vback   38 Vpol P
    Display Range Limits:
      Monitor ranges (GTF): 50-76 Hz V, 30-83 kHz H, max dotclock 140 MHz
    Display Product Name: 'HP L1706'
    Display Product Serial Number: ...
Checksum: 0x74

----------------

Block 1, Unknown EDID Extension Block 0x00:
  00 ff ff ff ff ff ff 00 22 f0 5c 26 01 01 01 01 '........".\&....'
  32 0f 01 03 68 22 1b 78 ee 01 06 a3 57 4a 9c 23 '2...h".x....WJ.#'
  12 4f 54 ad ef 80 81 80 01 01 01 01 01 01 01 01 '.OT.............'
  01 01 01 01 01 01 30 2a 00 98 51 00 2a 40 30 70 '......0*..Q.*@0p'
  13 00 52 0e 11 00 00 1e 00 00 00 fd 00 32 4c 1e '..R..........2L.'
  53 0e 00 0a 20 20 20 20 20 20 00 00 00 fc 00 48 'S...      .....H'
  50 20 4c 31 37 30 36 0a 20 20 20 20 00 00 00 ff 'P L1706.    ....'
  00 43 4e 4b 35 35 30 31 37 38 56 0a 20 20 00 74 '.CNK550178V.  .t'
Checksum: 0x74

----------------

Failures:

Block 0, Base EDID:
  Basic Display Parameters & Features: sRGB is signaled, but the chromaticities do not match.
Block 1, Base EDID:
  Unknown Extension Block.
EDID:
  Base EDID: EDID specified 0 extension block(s), but found 1 extension block(s).

EDID conformity: FAIL
