edid-decode (hex):

00 ff ff ff ff ff ff 00 09 e5 88 07 00 00 00 00
01 1b 01 04 95 26 15 78 02 37 50 a5 55 4e 9c 26
10 50 54 00 00 00 01 01 01 01 01 01 01 01 01 01
01 01 01 01 01 01 c4 36 80 cc 70 38 14 40 30 20
36 00 7d d6 10 00 00 1a 00 00 00 00 00 00 00 00
00 00 00 00 00 00 00 00 00 1a 00 00 00 fe 00 42
4f 45 20 43 51 0a 20 20 20 20 20 20 00 00 00 fe
00 4e 56 31 37 33 46 48 4d 2d 4e 34 31 0a 00 16

----------------

Block 0, Base EDID:
  EDID Structure Version & Revision: 1.4
  Vendor & Product Identification:
    Manufacturer: BOE
    Model: 1928
    Made in: week 1 of 2017
  Basic Display Parameters & Features:
    Digital display
    Bits per primary color channel: 6
    DisplayPort interface
    Maximum image size: 38 cm x 21 cm
    Gamma: 2.20
    Supported color formats: RGB 4:4:4
    First detailed timing includes the native pixel format and preferred refresh rate
  Color Characteristics:
    Red  : 0.6445, 0.3349
    Green: 0.3056, 0.6123
    Blue : 0.1494, 0.0634
    White: 0.3125, 0.3281
  Established Timings I & II: none
  Standard Timings: none
  Detailed Timing Descriptors:
    DTD 1:  1920x1080   60.006848 Hz  16:9     66.008 kHz    140.200000 MHz (381 mm x 214 mm)
                 Hfront   48 Hsync  32 Hback  124 Hpol P
                 Vfront    3 Vsync   6 Vback   11 Vpol N
    Manufacturer-Specified Display Descriptor (0x00): 00 00 00 00 00 00 00 00 00 00 00 00 00 00 00 1a '................'
    Alphanumeric Data String: 'BOE CQ'
    Alphanumeric Data String: 'NV173FHM-N41'
Checksum: 0x16

----------------

Failures:

Block 0, Base EDID:
  Missing Display Product Name.

EDID conformity: FAIL
