
EDID (hex):
00ffffffffffff001e6de37619f90400
0b18010380502278eaca95a6554ea126
0f50542108007140818081c0a9c0b300
d1c0810001019d6770a0d0a022503020
3a00204f3100001a000000fd00383d1e
5a1e000a202020202020000000fc004c
4720554c545241574944450a00000000
000000000000000000000000000001ac
020317f1441004030123090707830100
0065030c0010009f3d70a0d0a0155030
203a00204f3100001a7e4800e0a0381f
4040403a00204f31000018011d007251
d01e206e285500204f3100001e8c0ad0
8a20e02d10103e9600204f3100001800
0000ff003431314b4b5446394b393133
0a0000000000000000000000000000b0

Extracted contents:
header:          00 ff ff ff ff ff ff 00
serial number:   1e 6d e3 76 19 f9 04 00 0b 18
version:         01 03
basic params:    80 50 22 78 ea
chroma info:     ca 95 a6 55 4e a1 26 0f 50 54
established:     21 08 00
standard:        71 40 81 80 81 c0 a9 c0 b3 00 d1 c0 81 00 01 01
descriptor 1:    9d 67 70 a0 d0 a0 22 50 30 20 3a 00 20 4f 31 00 00 1a
descriptor 2:    00 00 00 fd 00 38 3d 1e 5a 1e 00 0a 20 20 20 20 20 20
descriptor 3:    00 00 00 fc 00 4c 47 20 55 4c 54 52 41 57 49 44 45 0a
descriptor 4:    00 00 00 00 00 00 00 00 00 00 00 00 00 00 00 00 00 00
extensions:      01
checksum:        ac

EDID version: 1.3
Manufacturer: GSM Model 76e3 Serial Number --
Made in week 11 of 2014
Digital display
Maximum image size: 80 cm x 34 cm
Gamma: 2.20
DPMS levels: Standby Suspend Off
RGB color display
First detailed timing is preferred timing
Display x,y Chromaticity:
  Red:   0.6513, 0.3320
  Green: 0.3066, 0.6308
  Blue:  0.1503, 0.0595
  White: 0.3134, 0.3291
Established timings supported:
  640x480@60Hz 4:3 HorFreq: 31469 Hz Clock: 25.175 MHz
  800x600@60Hz 4:3 HorFreq: 37900 Hz Clock: 40.000 MHz
  1024x768@60Hz 4:3 HorFreq: 48400 Hz Clock: 65.000 MHz
Standard timings supported:
  1152x864@60Hz 4:3
  1280x1024@60Hz 5:4 HorFreq: 64000 Hz Clock: 108.000 MHz
  1280x720@60Hz 16:9
  1600x900@60Hz 16:9
  1680x1050@60Hz 16:10 HorFreq: 64700 Hz Clock: 119.000 MHz
  1920x1080@60Hz 16:9
  1280x800@60Hz 16:10
Detailed mode: Clock 265.250 MHz, 800 mm x 335 mm
               3440 3488 3520 3600 hborder 0
               1440 1443 1453 1474 vborder 0
               +hsync -vsync 
               VertFreq: 49 Hz, HorFreq: 73680 Hz
Monitor ranges (GTF): 56-61Hz V, 30-90kHz H, max dotclock 300MHz
Monitor name: LG ULTRAWIDE
Manufacturer-specified data, tag 0
Has 1 extension blocks
Checksum: 0xac (valid)

CTA extension block
Extension version: 3
19 bytes of CTA data
  Video data block
    VIC  16 1920x1080@60Hz 16:9  HorFreq: 67500 Hz Clock: 148.500 MHz
    VIC   4 1280x720@60Hz 16:9  HorFreq: 45000 Hz Clock: 74.250 MHz
    VIC   3 720x480@60Hz 16:9  HorFreq: 31469 Hz Clock: 27.000 MHz
    VIC   1 640x480@60Hz 4:3  HorFreq: 31469 Hz Clock: 25.175 MHz
  Audio data block
    Linear PCM, max channels 2
      Supported sample rates (kHz): 48 44.1 32
      Supported sample sizes (bits): 24 20 16
  Speaker allocation data block
    Speaker map:
      FL/FR - Front Left/Right
  Vendor-specific data block, OUI 000c03 (HDMI)
    Source physical address 1.0.0.0
Underscans PC formats by default
Basic audio support
Supports YCbCr 4:4:4
Supports YCbCr 4:2:2
1 native detailed modes
Detailed mode: Clock 157.750 MHz, 800 mm x 335 mm
               3440 3488 3520 3600 hborder 0
               1440 1443 1453 1461 vborder 0
               +hsync -vsync 
               VertFreq: 29 Hz, HorFreq: 43819 Hz
Detailed mode: Clock 185.580 MHz, 800 mm x 335 mm
               2560 2624 2688 2784 hborder 0
               1080 1083 1093 1111 vborder 0
               -hsync -vsync 
               VertFreq: 59 Hz, HorFreq: 66659 Hz
Detailed mode: Clock 74.250 MHz, 800 mm x 335 mm
               1280 1390 1430 1650 hborder 0
                720  725  730  750 vborder 0
               +hsync +vsync 
               VertFreq: 60 Hz, HorFreq: 45000 Hz
Detailed mode: Clock 27.000 MHz, 800 mm x 335 mm
                720  736  798  858 hborder 0
                480  489  495  525 vborder 0
               -hsync -vsync 
               VertFreq: 59 Hz, HorFreq: 31468 Hz
Checksum: 0xb0 (valid)

One or more of the timings is out of range of the Monitor Ranges:
  Vertical Freq: 29 - 60 Hz
  Horizontal Freq: 31468 - 73680 Hz
  Maximum Clock: 265.250 MHz
