edid-decode (hex):

00 ff ff ff ff ff ff 00 05 e3 31 18 a1 8e 03 00
19 12 01 03 68 29 17 78 2a ee d1 a5 55 48 9b 26
12 50 54 bf ee 00 31 0a 61 4c 01 01 01 01 01 01
01 01 01 01 01 01 66 21 56 aa 51 00 1e 30 46 8f
33 00 9d ea 10 00 00 1e 66 21 50 b0 51 00 1b 30
40 70 36 00 22 13 00 00 00 1e 00 00 00 fd 00 37
4b 1e 51 09 00 0a 20 20 20 20 20 20 00 00 00 fc
00 38 33 31 57 0a 20 20 20 20 20 20 20 20 00 18

----------------

Block 0, Base EDID:
  EDID Structure Version & Revision: 1.3
  Vendor & Product Identification:
    Manufacturer: AOC
    Model: 6193
    Serial Number: ...
    Made in: week 25 of 2008
  Basic Display Parameters & Features:
    Analog display
    Input voltage level: 0.7/0.7 V
    Blank level equals black level
    Sync: Separate
    Maximum image size: 41 cm x 23 cm
    Gamma: 2.20
    DPMS levels: Off
    RGB color display
    First detailed timing is the preferred timing
  Color Characteristics:
    Red  : 0.6474, 0.3339
    Green: 0.2841, 0.6074
    Blue : 0.1513, 0.0712
    White: 0.3125, 0.3291
  Established Timings I & II:
    IBM     :   720x400    70.082 Hz   9:5    31.467 kHz  28.320 MHz
    DMT 0x04:   640x480    59.940 Hz   4:3    31.469 kHz  25.175 MHz
    Apple   :   640x480    66.667 Hz   4:3    35.000 kHz  30.240 MHz
    DMT 0x05:   640x480    72.809 Hz   4:3    37.861 kHz  31.500 MHz
    DMT 0x06:   640x480    75.000 Hz   4:3    37.500 kHz  31.500 MHz
    DMT 0x08:   800x600    56.250 Hz   4:3    35.156 kHz  36.000 MHz
    DMT 0x09:   800x600    60.317 Hz   4:3    37.879 kHz  40.000 MHz
    DMT 0x0a:   800x600    72.188 Hz   4:3    48.077 kHz  50.000 MHz
    DMT 0x0b:   800x600    75.000 Hz   4:3    46.875 kHz  49.500 MHz
    Apple   :   832x624    74.551 Hz   4:3    49.726 kHz  57.284 MHz
    DMT 0x10:  1024x768    60.004 Hz   4:3    48.363 kHz  65.000 MHz
    DMT 0x11:  1024x768    70.069 Hz   4:3    56.476 kHz  75.000 MHz
    DMT 0x12:  1024x768    75.029 Hz   4:3    60.023 kHz  78.750 MHz
  Standard Timings:
    GTF     :   640x400    70.000 Hz  16:10   29.190 kHz  23.352 MHz
    DMT 0x11:  1024x768    70.069 Hz   4:3    56.476 kHz  75.000 MHz
  Detailed Timing Descriptors:
    DTD 1:  1366x768    59.790 Hz 683:384  47.712 kHz  85.500 MHz (413 mm x 234 mm)
                 Hfront   70 Hsync 143 Hback 213 Hpol P
                 Vfront    3 Vsync   3 Vback  24 Vpol P
    DTD 2:  1360x768    60.015 Hz  85:48   47.712 kHz  85.500 MHz (34 mm x 19 mm)
                 Hfront   64 Hsync 112 Hback 256 Hpol P
                 Vfront    3 Vsync   6 Vback  18 Vpol P
  Display Range Limits:
    Monitor ranges (GTF): 55-75 Hz V, 30-81 kHz H, max dotclock 90 MHz
    Display Product Name: '831W'
Checksum: 0x18

----------------

Warnings:

EDID:
  Base EDID: Some timings are out of range of the Monitor Ranges:
    Horizontal Freq: 29.190 - 60.022 kHz (Monitor: 30.000 - 81.000 kHz)
    Could be due to a Monitor Range off-by-one rounding issue

Failures:

Block 0, Base EDID:
  Detailed Timing Descriptor #2: Mismatch of image size 34x19 mm vs display size 410x230 mm.

EDID conformity: FAIL
