edid-decode (hex):

00 ff ff ff ff ff ff 00 38 70 4b 00 00 00 00 00
01 1d 01 04 a5 22 13 78 03 9d 45 a3 56 4d 9e 27
0e 4e 51 00 00 00 01 01 01 01 01 01 01 01 01 01
01 01 01 01 01 01 00 82 80 a0 70 38 1f 40 30 20
35 00 58 c2 10 00 00 1a 00 82 80 a0 70 38 32 46
30 20 35 00 58 c2 10 00 00 1a 00 00 00 fd 00 28
3c 43 43 0e 01 0a 20 20 20 20 20 20 00 00 00 fe
00 4c 4d 31 35 36 4c 46 2d 31 46 30 32 0a 00 5f

----------------

Block 0, Base EDID:
  EDID Structure Version & Revision: 1.4
  Vendor & Product Identification:
    Manufacturer: NCP
    Model: 75
    Made in: week 1 of 2019
  Basic Display Parameters & Features:
    Digital display
    Bits per primary color channel: 8
    DisplayPort interface
    Maximum image size: 34 cm x 19 cm
    Gamma: 2.20
    Supported color formats: RGB 4:4:4
    First detailed timing includes the native pixel format and preferred refresh rate
    Display is continuous frequency
  Color Characteristics:
    Red  : 0.6386, 0.3369
    Green: 0.3037, 0.6181
    Blue : 0.1533, 0.0546
    White: 0.3056, 0.3173
  Established Timings I & II: none
  Standard Timings: none
  Detailed Timing Descriptors:
    DTD 1:  1920x1080  144.014 Hz  16:9   160.000 kHz 332.800 MHz (344 mm x 194 mm)
                 Hfront   48 Hsync  32 Hback  80 Hpol P
                 Vfront    3 Vsync   5 Vback  23 Vpol N
    DTD 2:  1920x1080   60.015 Hz  16:9   160.000 kHz 332.800 MHz (344 mm x 194 mm)
                 Hfront   48 Hsync  32 Hback  80 Hpol P
                 Vfront    3 Vsync   5 Vback 1578 Vpol N
  Display Range Limits:
    Monitor ranges (Bare Limits): 40-60 Hz V, 67-67 kHz H, max dotclock 140 MHz
    Alphanumeric Data String: 'LM156LF-1F02'
Checksum: 0x5f

----------------

Warnings:

EDID:
  Base EDID: Some timings are out of range of the Monitor Ranges:
    Vertical Freq: 60.015 - 144.014 Hz (Monitor: 40.000 - 60.000 Hz)
    Horizontal Freq: 160.000 - 160.000 kHz (Monitor: 67.000 - 67.000 kHz)
    Maximum Clock: 332.800 MHz (Monitor: 140.000 MHz)

Failures:

Block 0, Base EDID:
  Missing Display Product Name.

EDID conformity: FAIL
