edid-decode (hex):

00 ff ff ff ff ff ff 00 09 e5 46 08 00 00 00 00
01 1c 01 04 95 1d 11 78 03 28 65 97 59 54 8e 27
1e 50 54 00 00 00 01 01 01 01 01 01 01 01 01 01
01 01 01 01 01 01 19 37 80 c2 70 38 20 40 30 20
36 00 26 a5 10 00 00 1a bc 24 80 c2 70 38 20 40
30 20 36 00 26 a5 10 00 00 1a 00 00 00 00 00 00
00 00 00 00 00 00 00 00 00 00 00 00 00 00 00 02
00 0d 49 ff 0a 3c 6e 16 10 1c 6e 00 00 00 00 9d

----------------

Block 0, Base EDID:
  EDID Structure Version & Revision: 1.4
  Vendor & Product Identification:
    Manufacturer: BOE
    Model: 2118
    Made in: week 1 of 2018
  Basic Display Parameters & Features:
    Digital display
    Bits per primary color channel: 6
    DisplayPort interface
    Maximum image size: 29 cm x 17 cm
    Gamma: 2.20
    Supported color formats: RGB 4:4:4
    First detailed timing includes the native pixel format and preferred refresh rate
    Display is continuous frequency
  Color Characteristics:
    Red  : 0.5898, 0.3496
    Green: 0.3300, 0.5546
    Blue : 0.1533, 0.1191
    White: 0.3134, 0.3291
  Established Timings I & II: none
  Standard Timings: none
  Detailed Timing Descriptors:
    DTD 1:  1920x1080   60.001668 Hz  16:9     66.722 kHz    141.050000 MHz (294 mm x 165 mm)
                 Hfront   48 Hsync  32 Hback  114 Hpol P
                 Vfront    3 Vsync   6 Vback   23 Vpol N
    DTD 2:  1920x1080   40.003948 Hz  16:9     44.484 kHz     94.040000 MHz (294 mm x 165 mm)
                 Hfront   48 Hsync  32 Hback  114 Hpol P
                 Vfront    3 Vsync   6 Vback   23 Vpol N
    Empty Descriptor
    Manufacturer-Specified Display Descriptor (0x02): 00 02 00 0d 49 ff 0a 3c 6e 16 10 1c 6e 00 00 00 '....I..<n...n...'
Checksum: 0x9d

----------------

Warnings:

Block 0, Base EDID:
  Missing Display Product Name.

Failures:

Block 0, Base EDID:
  Empty Descriptor: Use Dummy Descriptor instead of all zeroes.
  Missing Display Range Limits Descriptor.

EDID conformity: FAIL
