
EDID (hex):
00ffffffffffff002264a5065b2e0000
18140103802717780adc259c5b529826
17505400000001010101010101010101
010101010101cc338060703810401820
46007ed710000019000000fe00000000
00000000000000000000000000fc0048
5344313733505557310a202000000010
000a20202020202020202020202000b1

Extracted contents:
header:          00 ff ff ff ff ff ff 00
serial number:   22 64 a5 06 5b 2e 00 00 18 14
version:         01 03
basic params:    80 27 17 78 0a
chroma info:     dc 25 9c 5b 52 98 26 17 50 54
established:     00 00 00
standard:        01 01 01 01 01 01 01 01 01 01 01 01 01 01 01 01
descriptor 1:    cc 33 80 60 70 38 10 40 18 20 46 00 7e d7 10 00 00 19
descriptor 2:    00 00 00 fe 00 00 00 00 00 00 00 00 00 00 00 00 00 00
descriptor 3:    00 00 00 fc 00 48 53 44 31 37 33 50 55 57 31 0a 20 20
descriptor 4:    00 00 00 10 00 0a 20 20 20 20 20 20 20 20 20 20 20 20
extensions:      00
checksum:        b1

EDID version: 1.3
Manufacturer: HSD Model 6a5 Serial Number --
Made in week 24 of 2010
Digital display
Maximum image size: 39 cm x 23 cm
Gamma: 2.20
RGB color display
First detailed timing is preferred timing
Display x,y Chromaticity:
  Red:   0.6123, 0.3564
  Green: 0.3232, 0.5937
  Blue:  0.1484, 0.0917
  White: 0.3134, 0.3291
Established timings supported:
Standard timings supported:
Detailed mode: Clock 132.600 MHz, 382 mm x 215 mm
               1920 1944 1976 2016 hborder 0
               1080 1084 1090 1096 vborder 0
               -hsync -vsync 
               VertFreq: 60 Hz, HorFreq: 65773 Hz
ASCII string: 
Monitor name: HSD173PUW1
Dummy block
Checksum: 0xb1 (valid)
EDID block does NOT conform to EDID 1.3!
	Missing monitor ranges
	Detailed block string not properly terminated
EDID block does not conform at all!
	Dummy block filled with garbage
