edid-decode (hex):

00 ff ff ff ff ff ff 00 22 70 19 00 6b 0f 00 00
1f 14 01 03 64 36 1e 78 2a 82 15 a4 56 4f 9d 24
12 50 54 21 08 00 81 80 95 00 b3 00 01 01 01 01
01 01 01 01 01 01 02 3a 80 18 71 38 2d 40 58 2c
45 00 1f 31 21 00 00 1e 00 00 00 ff 00 30 33 31
46 58 31 34 59 30 33 39 34 37 00 00 00 fc 00 48
53 47 31 30 37 34 0a 20 20 20 20 20 00 00 00 fd
00 3b 3d 1f 46 0f 00 0a 20 20 20 20 20 20 00 3e

00 ff ff ff ff ff ff 00 22 70 19 00 6b 0f 00 00
1f 14 01 03 64 36 1e 78 2a 82 15 a4 56 4f 9d 24
12 50 54 21 08 00 81 80 95 00 b3 00 01 01 01 01
01 01 01 01 01 01 02 3a 80 18 71 38 2d 40 58 2c
45 00 1f 31 21 00 00 1e 00 00 00 ff 00 30 33 31
46 58 31 34 59 30 33 39 34 37 00 00 00 fc 00 48
53 47 31 30 37 34 0a 20 20 20 20 20 00 00 00 fd
00 3b 3d 1f 46 0f 00 0a 20 20 20 20 20 20 00 3e

----------------

Block 0, Base EDID:
  EDID Structure Version & Revision: 1.3
  Vendor & Product Identification:
    Manufacturer: HSP
    Model: 25
    Serial Number: ...
    Made in: week 31 of 2010
  Basic Display Parameters & Features:
    Analog display
    Signal Level Standard: 0.700 : 0.000 : 0.700 V p-p
    Blank level equals black level
    Sync: Composite
    Maximum image size: 54 cm x 30 cm
    Gamma: 2.20
    DPMS levels: Off
    RGB color display
    First detailed timing is the preferred timing
  Color Characteristics:
    Red  : 0.6425, 0.3359
    Green: 0.3085, 0.6152
    Blue : 0.1406, 0.0712
    White: 0.3134, 0.3291
  Established Timings I & II:
    DMT 0x04:   640x480    59.940476 Hz   4:3     31.469 kHz     25.175000 MHz
    DMT 0x09:   800x600    60.316541 Hz   4:3     37.879 kHz     40.000000 MHz
    DMT 0x10:  1024x768    60.003840 Hz   4:3     48.363 kHz     65.000000 MHz
  Standard Timings:
    DMT 0x23:  1280x1024   60.019740 Hz   5:4     63.981 kHz    108.000000 MHz
    DMT 0x2f:  1440x900    59.887445 Hz  16:10    55.935 kHz    106.500000 MHz
    DMT 0x3a:  1680x1050   59.954250 Hz  16:10    65.290 kHz    146.250000 MHz
  Detailed Timing Descriptors:
    DTD 1:  1920x1080   60.000000 Hz  16:9     67.500 kHz    148.500000 MHz (543 mm x 305 mm)
                 Hfront   88 Hsync  44 Hback  148 Hpol P
                 Vfront    4 Vsync   5 Vback   36 Vpol P
    Display Product Serial Number: ...
    Display Product Name: 'HSG1074'
    Display Range Limits:
      Monitor ranges (GTF): 59-61 Hz V, 31-70 kHz H, max dotclock 150 MHz
Checksum: 0x3e

----------------

Block 1, Unknown EDID Extension Block 0x00:
  00 ff ff ff ff ff ff 00 22 70 19 00 6b 0f 00 00 '........"p..k...'
  1f 14 01 03 64 36 1e 78 2a 82 15 a4 56 4f 9d 24 '....d6.x*...VO.$'
  12 50 54 21 08 00 81 80 95 00 b3 00 01 01 01 01 '.PT!............'
  01 01 01 01 01 01 02 3a 80 18 71 38 2d 40 58 2c '.......:..q8-@X,'
  45 00 1f 31 21 00 00 1e 00 00 00 ff 00 30 33 31 'E..1!........031'
  46 58 31 34 59 30 33 39 34 37 00 00 00 fc 00 48 'FX14Y03947.....H'
  53 47 31 30 37 34 0a 20 20 20 20 20 00 00 00 fd 'SG1074.     ....'
  00 3b 3d 1f 46 0f 00 0a 20 20 20 20 20 20 00 3e '.;=.F...      .>'
Checksum: 0x3e

----------------

Failures:

Block 1, Base EDID:
  Unknown Extension Block.
EDID:
  Base EDID: EDID specified 0 extension block(s), but found 1 extension block(s).

EDID conformity: FAIL
