
EDID (hex):
00ffffffffffff0010ac02e046313830
030e01036e241d78ee0925a2574b9924
185054a54b008180714f010101010101
010101010101302a009851002a403070
1300671f1100001e000000ff00375234
373734314c303831460a000000fc0044
454c4c203138303046500a20000000fd
00384b1e500e000a2020202020200052

Extracted contents:
header:          00 ff ff ff ff ff ff 00
serial number:   10 ac 02 e0 46 31 38 30 03 0e
version:         01 03
basic params:    6e 24 1d 78 ee
chroma info:     09 25 a2 57 4b 99 24 18 50 54
established:     a5 4b 00
standard:        81 80 71 4f 01 01 01 01 01 01 01 01 01 01 01 01
descriptor 1:    30 2a 00 98 51 00 2a 40 30 70 13 00 67 1f 11 00 00 1e
descriptor 2:    00 00 00 ff 00 37 52 34 37 37 34 31 4c 30 38 31 46 0a
descriptor 3:    00 00 00 fc 00 44 45 4c 4c 20 31 38 30 30 46 50 0a 20
descriptor 4:    00 00 00 fd 00 38 4b 1e 50 0e 00 0a 20 20 20 20 20 20
extensions:      00
checksum:        52

EDID version: 1.3
Manufacturer: DEL Model e002 Serial Number --
Analog display, Input voltage level: 0.7/0.7 V
Sync: Separate Composite SyncOnGreen 
Maximum image size: 36 cm x 29 cm
Gamma: 2.20
DPMS levels: Standby Suspend Off
RGB color display
Default (sRGB) color space is primary color space
First detailed timing is preferred timing
Display x,y Chromaticity:
  Red:   0.6328, 0.3398
  Green: 0.2949, 0.5986
  Blue:  0.1406, 0.0957
  White: 0.3134, 0.3291
Established timings supported:
  720x400@70Hz 9:5 HorFreq: 31469 Hz Clock: 28.320 MHz
  640x480@60Hz 4:3 HorFreq: 31469 Hz Clock: 25.175 MHz
  640x480@75Hz 4:3 HorFreq: 37500 Hz Clock: 31.500 MHz
  800x600@60Hz 4:3 HorFreq: 37900 Hz Clock: 40.000 MHz
  800x600@75Hz 4:3 HorFreq: 46900 Hz Clock: 49.500 MHz
  1024x768@60Hz 4:3 HorFreq: 48400 Hz Clock: 65.000 MHz
  1024x768@75Hz 4:3 HorFreq: 60000 Hz Clock: 78.750 MHz
  1280x1024@75Hz 5:4 HorFreq: 80000 Hz Clock: 135.000 MHz
Standard timings supported:
  1280x1024@60Hz 5:4 HorFreq: 64000 Hz Clock: 108.000 MHz
  1152x864@75Hz 4:3 HorFreq: 67500 Hz Clock: 108.000 MHz
Detailed mode: Clock 108.000 MHz, 359 mm x 287 mm
               1280 1328 1440 1688 hborder 0
               1024 1025 1028 1066 vborder 0
               +hsync +vsync 
               VertFreq: 60 Hz, HorFreq: 63981 Hz
Serial number: --
Monitor name: DELL 1800FP
Monitor ranges (GTF): 56-75Hz V, 30-80kHz H, max dotclock 140MHz
Checksum: 0x52 (valid)
EDID block does NOT conform to EDID 1.3!
	sRGB is signaled, but the chromaticities do not match
EDID block does not conform at all!
	Bad year of manufacture
