edid-decode (hex):

00 ff ff ff ff ff ff 00 0d ae 36 11 00 00 00 00
08 18 01 04 90 1a 0e 78 02 14 35 92 55 53 95 29
24 50 54 00 00 00 01 01 01 01 01 01 01 01 01 01
01 01 01 01 01 01 da 1d 56 e2 50 00 20 30 88 1e
8c 00 00 90 10 00 00 1a e7 13 56 e2 50 00 20 30
88 1e 8c 00 00 90 10 00 00 1a 00 00 00 00 00 00
00 00 00 00 00 00 00 00 00 00 00 00 00 00 00 02
00 0c 44 ff 0b 3c 6e 11 0c 17 6e 00 00 00 00 73

----------------

Block 0, Base EDID:
  EDID Structure Version & Revision: 1.4
  Vendor & Product Identification:
    Manufacturer: CMN
    Model: 4406
    Made in: week 8 of 2014
  Basic Display Parameters & Features:
    Digital display
    Bits per primary color channel: 6
    Digital interface is not defined
    Maximum image size: 26 cm x 14 cm
    Gamma: 2.20
    Supported color formats: RGB 4:4:4
    First detailed timing includes the native pixel format and preferred refresh rate
  Color Characteristics:
    Red  : 0.5703, 0.3330
    Green: 0.3251, 0.5820
    Blue : 0.1601, 0.1435
    White: 0.3134, 0.3291
  Established Timings I & II: none
  Standard Timings: none
  Detailed Timing Descriptors:
    DTD 1:  1366x768    60.003141 Hz 683:384   48.003 kHz     76.420000 MHz (256 mm x 144 mm)
                 Hfront  136 Hsync  30 Hback   60 Hpol P
                 Vfront    8 Vsync  12 Vback   12 Vpol N
    DTD 2:  1366x768    40.004711 Hz 683:384   32.004 kHz     50.950000 MHz (256 mm x 144 mm)
                 Hfront  136 Hsync  30 Hback   60 Hpol P
                 Vfront    8 Vsync  12 Vback   12 Vpol N
    Empty Descriptor
    Manufacturer-Specified Display Descriptor (0x02): 00 02 00 0c 44 ff 0b 3c 6e 11 0c 17 6e 00 00 00 '....D..<n...n...'
Checksum: 0x73

----------------

Failures:

Block 0, Base EDID:
  Empty Descriptor: Use Dummy Descriptor instead of all zeroes.
  Missing Display Product Name.

EDID conformity: FAIL
