edid-decode (hex):

00 ff ff ff ff ff ff 00 30 ae 20 40 00 00 00 00
32 0f 01 03 80 1c 15 78 ea 34 85 92 55 53 92 26
20 50 54 21 08 00 01 01 01 01 01 01 01 01 01 01
01 01 01 01 01 01 64 19 00 40 41 00 26 30 18 88
36 00 1d d6 10 00 00 18 28 15 00 40 41 00 26 30
18 88 36 00 1d d6 10 00 00 18 00 00 00 0f 00 61
43 32 61 43 28 0f 01 00 0d af 07 14 00 00 00 fe
00 4e 31 34 31 58 43 2d 4c 30 31 0a 20 20 00 45

----------------

Block 0, Base EDID:
  EDID Structure Version & Revision: 1.3
  Vendor & Product Identification:
    Manufacturer: LEN
    Model: 16416
    Made in: week 50 of 2005
  Basic Display Parameters & Features:
    Digital display
    Maximum image size: 28 cm x 21 cm
    Gamma: 2.20
    DPMS levels: Standby Suspend Off
    RGB color display
    First detailed timing is the preferred timing
  Color Characteristics:
    Red  : 0.5703, 0.3349
    Green: 0.3251, 0.5703
    Blue : 0.1503, 0.1250
    White: 0.3134, 0.3291
  Established Timings I & II:
    DMT 0x04:   640x480    59.940 Hz   4:3    31.469 kHz  25.175 MHz
    DMT 0x09:   800x600    60.317 Hz   4:3    37.879 kHz  40.000 MHz
    DMT 0x10:  1024x768    60.004 Hz   4:3    48.363 kHz  65.000 MHz
  Standard Timings: none
  Detailed Timing Descriptors:
    DTD 1:  1024x768    60.004 Hz   4:3    48.363 kHz  65.000 MHz (285 mm x 214 mm)
                 Hfront   24 Hsync 136 Hback 160 Hpol N
                 Vfront    3 Vsync   6 Vback  29 Vpol N
    DTD 2:  1024x768    49.997 Hz   4:3    40.298 kHz  54.160 MHz (285 mm x 214 mm)
                 Hfront   24 Hsync 136 Hback 160 Hpol N
                 Vfront    3 Vsync   6 Vback  29 Vpol N
    Manufacturer-Specified Display Descriptor (0x0f): 00 0f 00 61 43 32 61 43 28 0f 01 00 0d af 07 14 '...aC2aC(.......'
    Alphanumeric Data String: 'N141XC-L01'
Checksum: 0x45

----------------

Failures:

Block 0, Base EDID:
  Missing Display Product Name.
  Missing Display Range Limits Descriptor.

EDID conformity: FAIL
