
EDID (hex):
00ffffffffffff0030ae204000000000
000f0103801d1578ea2d059757518a27
23505421080001010101010101010101
01010101010164190040410026301888
36001ed6100000192815004041002630
188836001ed6100000190000000f0061
43326143280f01004ca35841000000fe
004c544e31343158412d4c30310a00e9

Extracted contents:
header:          00 ff ff ff ff ff ff 00
serial number:   30 ae 20 40 00 00 00 00 00 0f
version:         01 03
basic params:    80 1d 15 78 ea
chroma info:     2d 05 97 57 51 8a 27 23 50 54
established:     21 08 00
standard:        01 01 01 01 01 01 01 01 01 01 01 01 01 01 01 01
descriptor 1:    64 19 00 40 41 00 26 30 18 88 36 00 1e d6 10 00 00 19
descriptor 2:    28 15 00 40 41 00 26 30 18 88 36 00 1e d6 10 00 00 19
descriptor 3:    00 00 00 0f 00 61 43 32 61 43 28 0f 01 00 4c a3 58 41
descriptor 4:    00 00 00 fe 00 4c 54 4e 31 34 31 58 41 2d 4c 30 31 0a
extensions:      00
checksum:        e9

EDID version: 1.3
Manufacturer: LEN Model 4020 Serial Number --
Digital display
Maximum image size: 29 cm x 21 cm
Gamma: 2.20
DPMS levels: Standby Suspend Off
RGB color display
First detailed timing is preferred timing
Display x,y Chromaticity:
  Red:   0.5898, 0.3417
  Green: 0.3193, 0.5400
  Blue:  0.1523, 0.1367
  White: 0.3134, 0.3291
Established timings supported:
  640x480@60Hz 4:3 HorFreq: 31469 Hz Clock: 25.175 MHz
  800x600@60Hz 4:3 HorFreq: 37900 Hz Clock: 40.000 MHz
  1024x768@60Hz 4:3 HorFreq: 48400 Hz Clock: 65.000 MHz
Standard timings supported:
Detailed mode: Clock 65.000 MHz, 286 mm x 214 mm
               1024 1048 1184 1344 hborder 0
                768  771  777  806 vborder 0
               -hsync -vsync 
               VertFreq: 60 Hz, HorFreq: 48363 Hz
Detailed mode: Clock 54.160 MHz, 286 mm x 214 mm
               1024 1048 1184 1344 hborder 0
                768  771  777  806 vborder 0
               -hsync -vsync 
               VertFreq: 49 Hz, HorFreq: 40297 Hz
Manufacturer-specified data, tag 15
ASCII string: LTN141XA-L01
Checksum: 0xe9 (valid)
EDID block does NOT conform to EDID 1.3!
	Missing name descriptor
	Missing monitor ranges
EDID block does not conform at all!
	Bad year of manufacture
