edid-decode (hex):

00 ff ff ff ff ff ff 00 0d f2 89 04 00 00 00 00
20 15 01 04 95 1a 0e 78 02 88 d5 94 59 55 92 27
20 50 54 00 00 00 01 01 01 01 01 01 01 01 01 01
01 01 01 01 01 01 04 1e 56 c2 50 00 35 30 30 20
3c 00 00 90 10 00 00 19 04 1e 56 c2 50 00 35 30
30 20 3c 00 00 90 10 00 00 18 00 00 00 fe 00 49
56 4f 0a 20 20 20 20 20 20 20 20 20 00 00 00 fc
00 50 31 31 36 4e 57 52 31 20 52 32 0a 20 00 86

----------------

Block 0, Base EDID:
  EDID Structure Version & Revision: 1.4
  Vendor & Product Identification:
    Manufacturer: COR
    Model: 1161
    Made in: week 32 of 2011
  Basic Display Parameters & Features:
    Digital display
    Bits per primary color channel: 6
    DisplayPort interface
    Maximum image size: 26 cm x 14 cm
    Gamma: 2.20
    Supported color formats: RGB 4:4:4
    First detailed timing includes the native pixel format and preferred refresh rate
  Color Characteristics:
    Red  : 0.5800, 0.3476
    Green: 0.3339, 0.5703
    Blue : 0.1552, 0.1259
    White: 0.3134, 0.3291
  Established Timings I & II: none
  Standard Timings: none
  Detailed Timing Descriptors:
    DTD 1:  1366x768    59.996 Hz 683:384  49.256 kHz  76.840 MHz (256 mm x 144 mm)
                 Hfront   48 Hsync  32 Hback 114 Hpol N
                 Vfront    3 Vsync  12 Vback  38 Vpol N
    DTD 2:  1366x768    59.996 Hz 683:384  49.256 kHz  76.840 MHz (256 mm x 144 mm)
                 Hfront   48 Hsync  32 Hback 114 Hpol N
                 Vfront    3 Vsync  12 Vback  38 Vpol N
    Alphanumeric Data String: 'IVO'
    Display Product Name: 'P116NWR1 R2'
Checksum: 0x86

----------------

EDID conformity: PASS
