
EDID (hex):
00ffffffffffff004c2da50838383230
1b1601030e2917782a7841a259559b25
0f5054bfee0081c00101010101010101
010101010101662156aa51001e30468f
33009ae61000001e000000fd00384b1e
5109000a202020202020000000fc0053
3139423330300a2020202020000000ff
00485142433730303039370a202000fd

Extracted contents:
header:          00 ff ff ff ff ff ff 00
serial number:   4c 2d a5 08 38 38 32 30 1b 16
version:         01 03
basic params:    0e 29 17 78 2a
chroma info:     78 41 a2 59 55 9b 25 0f 50 54
established:     bf ee 00
standard:        81 c0 01 01 01 01 01 01 01 01 01 01 01 01 01 01
descriptor 1:    66 21 56 aa 51 00 1e 30 46 8f 33 00 9a e6 10 00 00 1e
descriptor 2:    00 00 00 fd 00 38 4b 1e 51 09 00 0a 20 20 20 20 20 20
descriptor 3:    00 00 00 fc 00 53 31 39 42 33 30 30 0a 20 20 20 20 20
descriptor 4:    00 00 00 ff 00 48 51 42 43 37 30 30 30 39 37 0a 20 20
extensions:      00
checksum:        fd

EDID version: 1.3
Manufacturer: SAM Model 8a5 Serial Number --
Made in week 27 of 2012
Analog display, Input voltage level: 0.7/0.3 V
Sync: Separate Composite SyncOnGreen 
Maximum image size: 41 cm x 23 cm
Gamma: 2.20
DPMS levels: Off
RGB color display
First detailed timing is preferred timing
Display x,y Chromaticity:
  Red:   0.6337, 0.3505
  Green: 0.3339, 0.6054
  Blue:  0.1455, 0.0585
  White: 0.3125, 0.3291
Established timings supported:
  720x400@70Hz 9:5 HorFreq: 31469 Hz Clock: 28.320 MHz
  640x480@60Hz 4:3 HorFreq: 31469 Hz Clock: 25.175 MHz
  640x480@67Hz 4:3 HorFreq: 35000 Hz Clock: 30.240 MHz
  640x480@72Hz 4:3 HorFreq: 37900 Hz Clock: 31.500 MHz
  640x480@75Hz 4:3 HorFreq: 37500 Hz Clock: 31.500 MHz
  800x600@56Hz 4:3 HorFreq: 35200 Hz Clock: 36.000 MHz
  800x600@60Hz 4:3 HorFreq: 37900 Hz Clock: 40.000 MHz
  800x600@72Hz 4:3 HorFreq: 48100 Hz Clock: 50.000 MHz
  800x600@75Hz 4:3 HorFreq: 46900 Hz Clock: 49.500 MHz
  832x624@75Hz 4:3 HorFreq: 49726 Hz Clock: 57.284 MHz
  1024x768@60Hz 4:3 HorFreq: 48400 Hz Clock: 65.000 MHz
  1024x768@70Hz 4:3 HorFreq: 56500 Hz Clock: 75.000 MHz
  1024x768@75Hz 4:3 HorFreq: 60000 Hz Clock: 78.750 MHz
Standard timings supported:
  1280x720@60Hz 16:9
Detailed mode: Clock 85.500 MHz, 410 mm x 230 mm
               1366 1436 1579 1792 hborder 0
                768  771  774  798 vborder 0
               +hsync +vsync 
               VertFreq: 59 Hz, HorFreq: 47712 Hz
Monitor ranges (GTF): 56-75Hz V, 30-81kHz H, max dotclock 90MHz
Monitor name: S19B300
Serial number: --
Checksum: 0xfd (valid)
