
EDID (hex):
00ffffffffffff0006af3c3100000000
00150104901f11780210b59758579226
1e505400000001010101010101010101
010101010101ec1d56e850001e302616
360035ad1000001af31356e850001e30
2616360035ad1000001a000000fe0048
504b3932804231343058573300000000
00014121940011000001010a2020005f

Extracted contents:
header:          00 ff ff ff ff ff ff 00
serial number:   06 af 3c 31 00 00 00 00 00 15
version:         01 04
basic params:    90 1f 11 78 02
chroma info:     10 b5 97 58 57 92 26 1e 50 54
established:     00 00 00
standard:        01 01 01 01 01 01 01 01 01 01 01 01 01 01 01 01
descriptor 1:    ec 1d 56 e8 50 00 1e 30 26 16 36 00 35 ad 10 00 00 1a
descriptor 2:    f3 13 56 e8 50 00 1e 30 26 16 36 00 35 ad 10 00 00 1a
descriptor 3:    00 00 00 fe 00 48 50 4b 39 32 80 42 31 34 30 58 57 33
descriptor 4:    00 00 00 00 00 01 41 21 94 00 11 00 00 01 01 0a 20 20
extensions:      00
checksum:        5f

EDID version: 1.4
Manufacturer: AUO Model 313c Serial Number --
Made in year 2011
Digital display
6 bits per primary color channel
Digital interface is not defined
Maximum image size: 31 cm x 17 cm
Gamma: 2.20
Supported color formats: RGB 4:4:4
First detailed timing includes the native pixel format and preferred refresh rate
Display x,y Chromaticity:
  Red:   0.5898, 0.3447
  Green: 0.3398, 0.5703
  Blue:  0.1503, 0.1201
  White: 0.3134, 0.3291
Established timings supported:
Standard timings supported:
Detailed mode: Clock 76.600 MHz, 309 mm x 173 mm
               1366 1404 1426 1598 hborder 0
                768  771  777  798 vborder 0
               +hsync -vsync 
               VertFreq: 60 Hz, HorFreq: 47934 Hz
Detailed mode: Clock 51.070 MHz, 309 mm x 173 mm
               1366 1404 1426 1598 hborder 0
                768  771  777  798 vborder 0
               +hsync -vsync 
               VertFreq: 40 Hz, HorFreq: 31958 Hz
ASCII string: HPK92
Manufacturer-specified data, tag 0
Checksum: 0x5f (valid)
EDID block does NOT conform to EDID 1.4!
	Missing name descriptor
	Missing monitor ranges
	Detailed block string not properly terminated
