edid-decode (hex):

00 ff ff ff ff ff ff 00 09 e5 1a 08 00 00 00 00
23 1c 01 04 a5 22 13 78 02 44 65 a7 57 51 a1 27
10 50 54 00 00 00 01 01 01 01 01 01 01 01 01 01
01 01 01 01 01 01 b6 39 80 f0 70 38 3c 40 30 20
36 00 58 c2 10 00 00 1a 00 00 00 00 00 00 00 00
00 00 00 00 00 00 00 00 00 00 00 00 00 fe 00 52
43 30 44 39 80 4e 56 31 35 4e 34 4d 00 00 00 00
00 01 41 01 9e 00 10 00 00 0a 01 0a 20 20 00 ae

----------------

Block 0, Base EDID:
  EDID Structure Version & Revision: 1.4
  Vendor & Product Identification:
    Manufacturer: BOE
    Model: 2074
    Made in: week 35 of 2018
  Basic Display Parameters & Features:
    Digital display
    Bits per primary color channel: 8
    DisplayPort interface
    Maximum image size: 34 cm x 19 cm
    Gamma: 2.20
    Supported color formats: RGB 4:4:4
    First detailed timing includes the native pixel format and preferred refresh rate
  Color Characteristics:
    Red  : 0.6533, 0.3398
    Green: 0.3173, 0.6289
    Blue : 0.1533, 0.0644
    White: 0.3134, 0.3291
  Established Timings I & II: none
  Standard Timings: none
  Detailed Timing Descriptors:
    DTD 1:  1920x1080   59.998376 Hz  16:9     68.398 kHz    147.740000 MHz (344 mm x 194 mm)
                 Hfront   48 Hsync  32 Hback  160 Hpol P
                 Vfront    3 Vsync   6 Vback   51 Vpol N
    Empty Descriptor
    Alphanumeric Data String: 'RC0D9'
    Manufacturer-Specified Display Descriptor (0x00): 00 00 00 01 41 01 9e 00 10 00 00 0a 01 0a 20 20 '....A.........  '
Checksum: 0xae

----------------

Warnings:

Block 0, Base EDID:
  Missing Display Product Name.

Failures:

Block 0, Base EDID:
  Empty Descriptor: Use Dummy Descriptor instead of all zeroes.
  Alphanumeric Data String: Non-printable character.

EDID conformity: FAIL
