edid-decode (hex):

00 ff ff ff ff ff ff 00 30 e4 55 05 a0 02 02 00
00 1e 01 04 a5 1a 11 78 03 ee 95 a3 54 4c 99 26
0f 50 54 00 00 00 01 01 01 01 01 01 01 01 01 01
01 01 01 01 01 01 3f 7f b0 a0 a0 20 34 70 30 20
3a 00 04 ad 10 00 00 19 00 00 00 fd 00 14 3c 70
70 21 01 0a 20 20 20 20 20 20 00 00 00 fe 00 4c
47 44 5f 4d 50 31 2e 30 5f 0a 20 20 00 00 00 fe
00 4c 50 31 32 33 57 51 33 31 32 36 38 34 00 36

----------------

Block 0, Base EDID:
  EDID Structure Version & Revision: 1.4
  Vendor & Product Identification:
    Manufacturer: LGD
    Model: 1365
    Serial Number: ...
    Made in: 2020
  Basic Display Parameters & Features:
    Digital display
    Bits per primary color channel: 8
    DisplayPort interface
    Maximum image size: 26 cm x 17 cm
    Gamma: 2.20
    Supported color formats: RGB 4:4:4
    First detailed timing includes the native pixel format and preferred refresh rate
    Display is continuous frequency
  Color Characteristics:
    Red  : 0.6396, 0.3300
    Green: 0.2998, 0.5996
    Blue : 0.1503, 0.0595
    White: 0.3134, 0.3291
  Established Timings I & II: none
  Standard Timings: none
  Detailed Timing Descriptors:
    DTD 1:  2736x1824   59.959 Hz   3:2   112.483 kHz 325.750 MHz (260 mm x 173 mm)
                 Hfront   48 Hsync  32 Hback  80 Hpol N
                 Vfront    3 Vsync  10 Vback  39 Vpol N
  Display Range Limits:
    Monitor ranges (Bare Limits): 20-60 Hz V, 112-112 kHz H, max dotclock 330 MHz
    Alphanumeric Data String: 'LGD_MP1.0_'
    Alphanumeric Data String: 'LP123WQ312684'
Checksum: 0x36

----------------

Failures:

Block 0, Base EDID:
  Missing Display Product Name.

EDID conformity: FAIL
