
EDID (hex):
00ffffffffffff0030e45505a0281000
001c0104a51b127803ee95a3544c9926
0f505400000001010101010101010101
010101010101de8a4078b08037703020
550412b710000019000000fd001e3c00
0024040a481414141400000000fe004c
47445f4d50312e305f0a2020000000fe
004c5031323957543131323638340037

edid-decode (hex):

00 ff ff ff ff ff ff 00 30 e4 55 05 a0 28 10 00
00 1c 01 04 a5 1b 12 78 03 ee 95 a3 54 4c 99 26
0f 50 54 00 00 00 01 01 01 01 01 01 01 01 01 01
01 01 01 01 01 01 de 8a 40 78 b0 80 37 70 30 20
55 04 12 b7 10 00 00 19 00 00 00 fd 00 1e 3c 00
00 24 04 0a 48 14 14 14 14 00 00 00 00 fe 00 4c
47 44 5f 4d 50 31 2e 30 5f 0a 20 20 00 00 00 fe
00 4c 50 31 32 39 57 54 31 31 32 36 38 34 00 37

----------------

Block 0, Base EDID:
  EDID Structure Version & Revision: 1.4
  Vendor & Product Identification:
    Manufacturer: LGD
    Model: 1365
    Serial Number: 1058976
    Made in: 2018
  Basic Display Parameters & Features:
    Digital display
    Bits per primary color channel: 8
    DisplayPort interface
    Maximum image size: 27 cm x 18 cm
    Gamma: 2.20
    Supported color formats: RGB 4:4:4
    First detailed timing includes the native pixel format and preferred refresh rate
    Display is continuous frequency
  Color Characteristics:
    Red  : 0.6396, 0.3300
    Green: 0.2998, 0.5996
    Blue : 0.1503, 0.0595
    White: 0.3134, 0.3291
  Established Timings I & II: none
  Standard Timings: none
  Detailed Timing Descriptors:
    DTD 1:  2880x1920   60.000000 Hz   3:2    118.500 kHz    355.500000 MHz (274 mm x 183 mm)
                 Hfront   48 Hsync  32 Hback   40 Hpol N
                 Vfront   21 Vsync   5 Vback   29 Vpol N
    Display Range Limits:
      Monitor ranges (CVT): 30-60 Hz V, 0-0 kHz H, max dotclock 360 MHz
      CVT version 0.10
      Real max dotclock: 355.50 MHz
      Max active pixels per line: 160
      Supported aspect ratios: 5:4
      Preferred aspect ratio: 4:3
      Supports CVT reduced blanking
      Supported display scaling:
        Vertical stretch
    Alphanumeric Data String: 'LGD_MP1.0_'
    Alphanumeric Data String: 'LP129WT112684'
Checksum: 0x37
