edid-decode (hex):

00 ff ff ff ff ff ff 00 30 e4 55 05 a1 00 00 08
00 1a 01 04 a5 1a 11 78 03 ee 95 a3 54 4c 99 26
0f 50 54 00 00 00 01 01 01 01 01 01 01 01 01 01
01 01 01 01 01 01 3f 7f b0 a0 a0 20 34 70 30 20
3a 00 04 ad 10 00 00 19 00 00 00 fd 00 30 3c 00
00 21 04 0a 14 14 14 14 14 14 00 00 00 fe 00 4c
47 44 5f 4d 50 30 2e 31 5f 0a 20 20 00 00 00 fe
00 4c 50 31 32 33 57 51 31 32 32 36 30 34 00 47

00 ff ff ff ff ff ff 00 30 e4 55 05 a1 00 00 08
00 1a 01 04 a5 1a 11 78 03 ee 95 a3 54 4c 99 26
0f 50 54 00 00 00 01 01 01 01 01 01 01 01 01 01
01 01 01 01 01 01 3f 7f b0 a0 a0 20 34 70 30 20
3a 00 04 ad 10 00 00 19 00 00 00 fd 00 30 3c 00
00 21 04 0a 14 14 14 14 14 14 00 00 00 fe 00 4c
47 44 5f 4d 50 30 2e 31 5f 0a 20 20 00 00 00 fe
00 4c 50 31 32 33 57 51 31 32 32 36 30 34 00 47

----------------

Block 0, Base EDID:
  EDID Structure Version & Revision: 1.4
  Vendor & Product Identification:
    Manufacturer: LGD
    Model: 1365
    Serial Number: ...
    Made in: 2016
  Basic Display Parameters & Features:
    Digital display
    Bits per primary color channel: 8
    DisplayPort interface
    Maximum image size: 26 cm x 17 cm
    Gamma: 2.20
    Supported color formats: RGB 4:4:4
    First detailed timing includes the native pixel format and preferred refresh rate
    Display is continuous frequency
  Color Characteristics:
    Red  : 0.6396, 0.3300
    Green: 0.2998, 0.5996
    Blue : 0.1503, 0.0595
    White: 0.3134, 0.3291
  Established Timings I & II: none
  Standard Timings: none
  Detailed Timing Descriptors:
    DTD 1:  2736x1824   59.958814 Hz   3:2    112.483 kHz    325.750000 MHz (260 mm x 173 mm)
                 Hfront   48 Hsync  32 Hback   80 Hpol N
                 Vfront    3 Vsync  10 Vback   39 Vpol N
    Display Range Limits:
      Monitor ranges (CVT): 48-60 Hz V, 0-0 kHz H, max dotclock 330 MHz
      CVT version 0.10
      Real max dotclock: 328.75 MHz
      Max active pixels per line: 160
      Supported aspect ratios: 5:4
      Preferred aspect ratio: 4:3
      Supports CVT reduced blanking
      Supported display scaling:
        Vertical stretch
      Preferred vertical refresh: 20 Hz
    Alphanumeric Data String: 'LGD_MP0.1_'
    Alphanumeric Data String: 'LP123WQ122604'
Checksum: 0x47

----------------

Block 1, Unknown EDID Extension Block 0x00:
  00 ff ff ff ff ff ff 00 30 e4 55 05 a1 00 00 08 '........0.U.....'
  00 1a 01 04 a5 1a 11 78 03 ee 95 a3 54 4c 99 26 '.......x....TL.&'
  0f 50 54 00 00 00 01 01 01 01 01 01 01 01 01 01 '.PT.............'
  01 01 01 01 01 01 3f 7f b0 a0 a0 20 34 70 30 20 '......?.... 4p0 '
  3a 00 04 ad 10 00 00 19 00 00 00 fd 00 30 3c 00 ':............0<.'
  00 21 04 0a 14 14 14 14 14 14 00 00 00 fe 00 4c '.!.............L'
  47 44 5f 4d 50 30 2e 31 5f 0a 20 20 00 00 00 fe 'GD_MP0.1_.  ....'
  00 4c 50 31 32 33 57 51 31 32 32 36 30 34 00 47 '.LP123WQ122604.G'
Checksum: 0x47

----------------

Warnings:

Block 0, Base EDID:
  Missing Display Product Name.

Failures:

Block 0, Base EDID:
  Display Range Limits: Reserved bits of byte 14 are non-zero.
  Display Range Limits: Reserved bits of byte 15 are non-zero.
  Display Range Limits: Reserved bits of byte 16 are non-zero.
Block 1, Base EDID:
  Unknown Extension Block.
EDID:
  Base EDID: EDID specified 0 extension block(s), but found 1 extension block(s).

EDID conformity: FAIL
