
EDID (hex):
00ffffffffffff0035ee32bc01010101
091a0103801e11783eee91a3544c9926
0f5054010800d1c081c0818001010101
010101010101023a801871382d40582c
250035ad1000001e000000fc004d6f6e
69746f720a2020202020000000ff0064
656d6f7365742d310a203020000000fd
00324b545413010a2020202020200151
020325f2421004e200d5e305c0002309
7f078301000067030c001000383ce606
0501626200023a801871382d40582c25
0035ad1000001e000000000000000000
00000000000000000000000000000000
00000000000000000000000000000000
00000000000000000000000000000000
000000000000000000000000000000a6

Extracted contents:
header:          00 ff ff ff ff ff ff 00
serial number:   35 ee 32 bc 01 01 01 01 09 1a
version:         01 03
basic params:    80 1e 11 78 3e
chroma info:     ee 91 a3 54 4c 99 26 0f 50 54
established:     01 08 00
standard:        d1 c0 81 c0 81 80 01 01 01 01 01 01 01 01 01 01
descriptor 1:    02 3a 80 18 71 38 2d 40 58 2c 25 00 35 ad 10 00 00 1e
descriptor 2:    00 00 00 fc 00 4d 6f 6e 69 74 6f 72 0a 20 20 20 20 20
descriptor 3:    00 00 00 ff 00 64 65 6d 6f 73 65 74 2d 31 0a 20 30 20
descriptor 4:    00 00 00 fd 00 32 4b 54 54 13 01 0a 20 20 20 20 20 20
extensions:      01
checksum:        51

EDID version: 1.3
Manufacturer: MON Model bc32 Serial Number --
Made in week 9 of 2016
Digital display
Maximum image size: 30 cm x 17 cm
Gamma: 2.20
DPMS levels: Off
Undefined display color type
Default (sRGB) color space is primary color space
First detailed timing is preferred timing
Display x,y Chromaticity:
  Red:   0.6396, 0.3300
  Green: 0.2998, 0.5996
  Blue:  0.1503, 0.0595
  White: 0.3125, 0.3291
Established timings supported:
  800x600@60Hz 4:3 HorFreq: 37900 Hz Clock: 40.000 MHz
  1024x768@60Hz 4:3 HorFreq: 48400 Hz Clock: 65.000 MHz
Standard timings supported:
  1920x1080@60Hz 16:9
  1280x720@60Hz 16:9
  1280x1024@60Hz 5:4 HorFreq: 64000 Hz Clock: 108.000 MHz
Detailed mode: Clock 148.500 MHz, 309 mm x 173 mm
               1920 2008 2052 2200 hborder 0
               1080 1082 1087 1125 vborder 0
               +hsync +vsync 
               VertFreq: 60 Hz, HorFreq: 67500 Hz
Monitor name: Monitor
Serial number: --
Monitor ranges (bare limits): 50-75Hz V, 84-84kHz H, max dotclock 190MHz
Has 1 extension blocks
Checksum: 0x51 (valid)

CTA extension block
Extension version: 3
33 bytes of CTA data
  Video data block
    VIC  16 1920x1080@60Hz 16:9  HorFreq: 67500 Hz Clock: 148.500 MHz
    VIC   4 1280x720@60Hz 16:9  HorFreq: 45000 Hz Clock: 74.250 MHz
  Extended tag: Video capability data block
    YCbCr quantization: Selectable (via AVI YQ) (1)
    RGB quantization: Selectable (via AVI Q) (1)
    PT scan behaviour: Always Overscannned (1)
    IT scan behaviour: Always Overscannned (1)
    CE scan behaviour: Always Overscannned (1)
  Extended tag: Colorimetry data block
    BT2020YCC
    BT2020RGB
  Audio data block
    Linear PCM, max channels 2
      Supported sample rates (kHz): 192 176.4 96 88.2 48 44.1 32
      Supported sample sizes (bits): 24 20 16
  Speaker allocation data block
    Speaker map:
      FL/FR - Front Left/Right
  Vendor-specific data block, OUI 000c03 (HDMI)
    Source physical address 1.0.0.0
    DC_36bit
    DC_30bit
    DC_Y444
    Maximum TMDS clock: 300MHz
  Extended tag: HDR static metadata data block
    Electro optical transfer functions:
      Traditional gamma - SDR luminance range
      SMPTE ST2084
    Supported static metadata descriptors:
      Static metadata type 1
    Desired content max luminance: 98 (417.710 cd/m^2)
    Desired content max frame-average luminance: 98 (417.710 cd/m^2)
    Desired content min luminance: 0 (0.000 cd/m^2)
Underscans PC formats by default
Basic audio support
Supports YCbCr 4:4:4
Supports YCbCr 4:2:2
2 native detailed modes
Detailed mode: Clock 148.500 MHz, 309 mm x 173 mm
               1920 2008 2052 2200 hborder 0
               1080 1082 1087 1125 vborder 0
               +hsync +vsync 
               VertFreq: 60 Hz, HorFreq: 67500 Hz
Checksum: 0xa6 (valid)

EDID block does NOT conform to EDID 1.3!
	Required 640x480p60 timings are missing in the established timings
	and/or in the SVD list (VIC 1)
EDID block does not conform at all!
	Both the serial number and the serial string are set
	Detailed blocks filled with garbage
	Range descriptor contains garbage
