edid-decode (hex):

00 ff ff ff ff ff ff 00 09 e5 65 06 00 00 00 00
01 19 01 04 95 22 13 78 0a 24 10 97 59 54 8e 27
1e 50 54 00 00 00 01 01 01 01 01 01 01 01 01 01
01 01 01 01 01 01 c8 1b 56 65 50 00 28 30 30 20
44 00 58 c2 10 00 00 1a 84 17 56 80 51 00 5c 30
64 64 44 05 58 c2 10 00 00 1a 00 00 00 00 00 00
00 00 00 00 00 00 00 00 00 00 00 00 00 00 00 02
00 0c 42 f7 0b 3c 6e 10 10 1d 73 00 00 00 00 d6

----------------

Block 0, Base EDID:
  EDID Structure Version & Revision: 1.4
  Vendor & Product Identification:
    Manufacturer: BOE
    Model: 1637
    Made in: week 1 of 2015
  Basic Display Parameters & Features:
    Digital display
    Bits per primary color channel: 6
    DisplayPort interface
    Maximum image size: 34 cm x 19 cm
    Gamma: 2.20
    Supported color formats: RGB 4:4:4, YCrCb 4:4:4
    First detailed timing includes the native pixel format and preferred refresh rate
  Color Characteristics:
    Red  : 0.5898, 0.3496
    Green: 0.3291, 0.5546
    Blue : 0.1523, 0.1181
    White: 0.3125, 0.3281
  Established Timings I & II: none
  Standard Timings: none
  Detailed Timing Descriptors:
    DTD 1:  1366x768    59.999865 Hz 683:384   48.480 kHz     71.120000 MHz (344 mm x 194 mm)
                 Hfront   48 Hsync  32 Hback   21 Hpol P
                 Vfront    4 Vsync   4 Vback   32 Vpol N
    DTD 2:  1366x768    40.000000 Hz 683:384   34.400 kHz     60.200000 MHz (344 mm x 194 mm)
                 Hfront  100 Hsync 100 Hback  184 Hpol P
                 Vfront   20 Vsync  20 Vback   52 Vpol N
    Empty Descriptor
    Manufacturer-Specified Display Descriptor (0x02): 00 02 00 0c 42 f7 0b 3c 6e 10 10 1d 73 00 00 00 '....B..<n...s...'
Checksum: 0xd6

----------------

Warnings:

Block 0, Base EDID:
  Missing Display Product Name.

Failures:

Block 0, Base EDID:
  Empty Descriptor: Use Dummy Descriptor instead of all zeroes.

EDID conformity: FAIL
