
EDID (hex):
00ffffffffffff0022f05d4201000000
0119010381351e78ea64b5ab5238ab25
13505400000001010101010101010101
0101010101019734806470381f402c2c
45000f292100001c0000001000000000
00000000000000000000000000fc0048
5020414c4c2d696e2d4f6e65000000ff
004c544d323338484c30320a2020009a

Extracted contents:
header:          00 ff ff ff ff ff ff 00
serial number:   22 f0 5d 42 01 00 00 00 01 19
version:         01 03
basic params:    81 35 1e 78 ea
chroma info:     64 b5 ab 52 38 ab 25 13 50 54
established:     00 00 00
standard:        01 01 01 01 01 01 01 01 01 01 01 01 01 01 01 01
descriptor 1:    97 34 80 64 70 38 1f 40 2c 2c 45 00 0f 29 21 00 00 1c
descriptor 2:    00 00 00 10 00 00 00 00 00 00 00 00 00 00 00 00 00 00
descriptor 3:    00 00 00 fc 00 48 50 20 41 4c 4c 2d 69 6e 2d 4f 6e 65
descriptor 4:    00 00 00 ff 00 4c 54 4d 32 33 38 48 4c 30 32 0a 20 20
extensions:      00
checksum:        9a

EDID version: 1.3
Manufacturer: HWP Model 425d Serial Number --
Made in week 1 of 2015
Digital display
DFP 1.x compatible TMDS
Maximum image size: 53 cm x 30 cm
Gamma: 2.20
DPMS levels: Standby Suspend Off
RGB color display
First detailed timing is preferred timing
Display x,y Chromaticity:
  Red:   0.6689, 0.3222
  Green: 0.2197, 0.6679
  Blue:  0.1464, 0.0771
  White: 0.3134, 0.3291
Established timings supported:
Standard timings supported:
Detailed mode: Clock 134.630 MHz, 527 mm x 297 mm
               1920 1964 2008 2020 hborder 0
               1080 1084 1089 1111 vborder 0
               -hsync +vsync 
               VertFreq: 59 Hz, HorFreq: 66648 Hz
Dummy block
Serial number: --
Checksum: 0x9a (valid)
EDID block does NOT conform to EDID 1.3!
	Name descriptor not terminated with a newline
	Missing monitor ranges
