
EDID (hex):
00ffffffffffff00061042a000000000
071c0104b51d1278029641a3554da027
0c505400000001010101010101010101
010101010101d9650050a0402e600820
08081eb31000001a000000fc00436f6c
6f72204c43440a202020000000100000
00000000000000000000000000000010
0000000000000000000000000000013d
70127903007f813ffa10000301180f28
17000000000000000000000000000000
00000000000000000000000000000000
464d5839343736303533324a514c5841
530a20202020207f8129fa1000020100
1100000290036b04bf068408e00c0210
2b15ab1cef26823319439f5947759b9a
9bca7600000000000000000000002890

edid-decode (hex):

00 ff ff ff ff ff ff 00 06 10 42 a0 00 00 00 00
07 1c 01 04 b5 1d 12 78 02 96 41 a3 55 4d a0 27
0c 50 54 00 00 00 01 01 01 01 01 01 01 01 01 01
01 01 01 01 01 01 d9 65 00 50 a0 40 2e 60 08 20
08 08 1e b3 10 00 00 1a 00 00 00 fc 00 43 6f 6c
6f 72 20 4c 43 44 0a 20 20 20 00 00 00 10 00 00
00 00 00 00 00 00 00 00 00 00 00 00 00 00 00 10
00 00 00 00 00 00 00 00 00 00 00 00 00 00 01 3d

70 12 79 03 00 7f 81 3f fa 10 00 03 01 18 0f 28
17 00 00 00 00 00 00 00 00 00 00 00 00 00 00 00
00 00 00 00 00 00 00 00 00 00 00 00 00 00 00 00
46 4d 58 39 34 37 36 30 35 33 32 4a 51 4c 58 41
53 0a 20 20 20 20 20 7f 81 29 fa 10 00 02 01 00
11 00 00 02 90 03 6b 04 bf 06 84 08 e0 0c 02 10
2b 15 ab 1c ef 26 82 33 19 43 9f 59 47 75 9b 9a
9b ca 76 00 00 00 00 00 00 00 00 00 00 00 28 90

----------------

Block 0, Base EDID:
  EDID Structure Version & Revision: 1.4
  Vendor & Product Identification:
    Manufacturer: APP
    Model: 41026
    Made in: week 7 of 2018
  Basic Display Parameters & Features:
    Digital display
    Bits per primary color channel: 10
    DisplayPort interface
    Maximum image size: 29 cm x 18 cm
    Gamma: 2.20
    Supported color formats: RGB 4:4:4
    First detailed timing includes the native pixel format and preferred refresh rate
  Color Characteristics:
    Red  : 0.6386, 0.3330
    Green: 0.3017, 0.6269
    Blue : 0.1533, 0.0468
    White: 0.3125, 0.3291
  Established Timings I & II: none
  Standard Timings: none
  Detailed Timing Descriptors:
    DTD 1:  2560x1600   60.000828 Hz  16:10    98.761 kHz    260.730000 MHz (286 mm x 179 mm)
                 Hfront    8 Hsync  32 Hback   40 Hpol P
                 Vfront   32 Vsync   8 Vback    6 Vpol N
    Display Product Name: 'Color LCD'
    Dummy Descriptor:
    Dummy Descriptor:
  Extension blocks: 1
Checksum: 0x3d

----------------

Block 1, DisplayID Extension Block:
  Version: 1.2
  Extension Count: 0
  Display Product Type: Standalone display device
  Vendor-Specific Data Block (0x7f) (Apple), OUI 00-10-FA:
    Type: 3, Version: 1
    18 0f 28 17 00 00 00 00 00 00 00 00 00 00 00 00 '..(.............'
    00 00 00 00 00 00 00 00 00 00 00 00 00 00 00 00 '................'
    00 00 00 46 4d 58 39 34 37 36 30 35 33 32 4a 51 '...FMX94760532JQ'
    4c 58 41 53 0a 20 20 20 20 20                   'LXAS.     '
  Vendor-Specific Data Block (0x7f) (Apple), OUI 00-10-FA:
    Type: 2, Version: 1
    00 11 00 00 02 90 03 6b 04 bf 06 84 08 e0 0c 02 '.......k........'
    10 2b 15 ab 1c ef 26 82 33 19 43 9f 59 47 75 9b '.+....&.3.C.YGu.'
    9a 9b ca 76                                     '...v'
  Checksum: 0x28
Checksum: 0x90
