
EDID (hex):
00ffffffffffff0009d12a8045540000
1d1b0104a5371f783e4455a9554d9d26
0f5054256b80d1c0b300a9c081808100
81c001010101565e00a0a0a029502f20
350029372100001a000000ff004b3748
30343633353031510a20000000fd0032
4c1e5a19000a202020202020000000fc
0042656e5120504432353030510a013b

Extracted contents:
header:          00 ff ff ff ff ff ff 00
serial number:   09 d1 2a 80 45 54 00 00 1d 1b
version:         01 04
basic params:    a5 37 1f 78 3e
chroma info:     44 55 a9 55 4d 9d 26 0f 50 54
established:     25 6b 80
standard:        d1 c0 b3 00 a9 c0 81 80 81 00 81 c0 01 01 01 01
descriptor 1:    56 5e 00 a0 a0 a0 29 50 2f 20 35 00 29 37 21 00 00 1a
descriptor 2:    00 00 00 ff 00 4b 37 48 30 34 36 33 35 30 31 51 0a 20
descriptor 3:    00 00 00 fd 00 32 4c 1e 5a 19 00 0a 20 20 20 20 20 20
descriptor 4:    00 00 00 fc 00 42 65 6e 51 20 50 44 32 35 30 30 51 0a
extensions:      01
checksum:        3b

EDID version: 1.4
Manufacturer: BNQ Model 802a Serial Number --
Made in week 29 of 2017
Digital display
8 bits per primary color channel
DisplayPort interface
Maximum image size: 55 cm x 31 cm
Gamma: 2.20
DPMS levels: Off
Supported color formats: RGB 4:4:4, YCrCb 4:4:4, YCrCb 4:2:2
Default (sRGB) color space is primary color space
First detailed timing includes the native pixel format and preferred refresh rate
Display x,y Chromaticity:
  Red:   0.6611, 0.3320
  Green: 0.3017, 0.6132
  Blue:  0.1494, 0.0595
  White: 0.3134, 0.3291
Established timings supported:
  640x480@60Hz 4:3 HorFreq: 31469 Hz Clock: 25.175 MHz
  640x480@75Hz 4:3 HorFreq: 37500 Hz Clock: 31.500 MHz
  800x600@60Hz 4:3 HorFreq: 37900 Hz Clock: 40.000 MHz
  800x600@75Hz 4:3 HorFreq: 46900 Hz Clock: 49.500 MHz
  832x624@75Hz 4:3 HorFreq: 49726 Hz Clock: 57.284 MHz
  1024x768@60Hz 4:3 HorFreq: 48400 Hz Clock: 65.000 MHz
  1024x768@75Hz 4:3 HorFreq: 60000 Hz Clock: 78.750 MHz
  1280x1024@75Hz 5:4 HorFreq: 80000 Hz Clock: 135.000 MHz
  1152x870@75Hz 192:145 HorFreq: 67500 Hz Clock: 108.000 MHz
Standard timings supported:
  1920x1080@60Hz 16:9
  1680x1050@60Hz 16:10 HorFreq: 64700 Hz Clock: 119.000 MHz
  1600x900@60Hz 16:9
  1280x1024@60Hz 5:4 HorFreq: 64000 Hz Clock: 108.000 MHz
  1280x800@60Hz 16:10
  1280x720@60Hz 16:9
Detailed mode: Clock 241.500 MHz, 553 mm x 311 mm
               2560 2607 2639 2720 hborder 0
               1440 1443 1448 1481 vborder 0
               +hsync -vsync 
               VertFreq: 59 Hz, HorFreq: 88786 Hz
Serial number: --
Monitor ranges (GTF): 50-76Hz V, 30-90kHz H, max dotclock 250MHz
Monitor name: BenQ PD2500Q
Has 1 extension blocks
Checksum: 0x3b (valid)
EDID block does NOT conform to EDID 1.4!
	sRGB is signaled, but the chromaticities do not match


