
EDID (hex):
00ffffffffffff0009e5740a00000000
101f0104a523167803ee95a3544c9926
0f505400000001010101010101010101
010101010101af41805471b028403020
360059d71000001a8c34805471b02840
3020360059d71000001a000000fe0042
4f452043510a202020202020000000fe
004e5631363057554d2d4e48300a001a

Extracted contents:
header:          00 ff ff ff ff ff ff 00
serial number:   09 e5 74 0a 00 00 00 00 10 1f
version:         01 04
basic params:    a5 23 16 78 03
chroma info:     ee 95 a3 54 4c 99 26 0f 50 54
established:     00 00 00
standard:        01 01 01 01 01 01 01 01 01 01 01 01 01 01 01 01
descriptor 1:    af 41 80 54 71 b0 28 40 30 20 36 00 59 d7 10 00 00 1a
descriptor 2:    8c 34 80 54 71 b0 28 40 30 20 36 00 59 d7 10 00 00 1a
descriptor 3:    00 00 00 fe 00 42 4f 45 20 43 51 0a 20 20 20 20 20 20
descriptor 4:    00 00 00 fe 00 4e 56 31 36 30 57 55 4d 2d 4e 48 30 0a
extensions:      00
checksum:        1a

EDID version: 1.4
Manufacturer: BOE Model a74 Serial Number --
Made in week 16 of 2021
Digital display
8 bits per primary color channel
DisplayPort interface
Maximum image size: 35 cm x 22 cm
Gamma: 2.20
Supported color formats: RGB 4:4:4
First detailed timing includes the native pixel format and preferred refresh rate
Display is continuous frequency
Display x,y Chromaticity:
  Red:   0.6396, 0.3300
  Green: 0.2998, 0.5996
  Blue:  0.1503, 0.0595
  White: 0.3134, 0.3291
Established timings supported:
Standard timings supported:
Detailed mode: Clock 168.150 MHz, 345 mm x 215 mm
               1920 1968 2000 2260 hborder 0
               1200 1203 1209 1240 vborder 0
               +hsync -vsync 
               VertFreq: 60 Hz, HorFreq: 74402 Hz
Detailed mode: Clock 134.520 MHz, 345 mm x 215 mm
               1920 1968 2000 2260 hborder 0
               1200 1203 1209 1240 vborder 0
               +hsync -vsync 
               VertFreq: 48 Hz, HorFreq: 59522 Hz
ASCII string: BOE CQ
ASCII string: NV160WUM-NH0
Checksum: 0x1a (valid)
EDID block does NOT conform to EDID 1.4!
	Missing name descriptor
	Missing monitor ranges
