edid-decode (hex):

00 ff ff ff ff ff ff 00 4d d9 00 4c 01 01 01 01
04 10 01 03 80 29 1f 78 ea 26 95 a2 57 4a 9d 25
13 50 54 a1 08 00 a9 40 81 80 81 40 01 01 01 01
01 01 01 01 01 01 48 3f 40 30 62 b0 32 40 40 c0
13 00 98 32 11 00 00 1e 00 00 00 fd 00 39 3f 1c
4b 10 00 0a 20 20 20 20 20 20 00 00 00 fc 00 53
44 4d 2d 53 32 30 35 46 2f 4b 0a 20 00 00 00 ff
00 36 33 30 34 37 37 31 0a 20 20 20 20 20 00 46

00 ff ff ff ff ff ff 00 4d d9 00 4c 01 01 01 01
04 10 01 03 80 29 1f 78 ea 26 95 a2 57 4a 9d 25
13 50 54 a1 08 00 a9 40 81 80 81 40 01 01 01 01
01 01 01 01 01 01 48 3f 40 30 62 b0 32 40 40 c0
13 00 98 32 11 00 00 1e 00 00 00 fd 00 39 3f 1c
4b 10 00 0a 20 20 20 20 20 20 00 00 00 fc 00 53
44 4d 2d 53 32 30 35 46 2f 4b 0a 20 00 00 00 ff
00 36 33 30 34 37 37 31 0a 20 20 20 20 20 00 46

----------------

Block 0, Base EDID:
  EDID Structure Version & Revision: 1.3
  Vendor & Product Identification:
    Manufacturer: SNY
    Model: 19456
    Serial Number: ...
    Made in: week 4 of 2006
  Basic Display Parameters & Features:
    Digital display
    Maximum image size: 41 cm x 31 cm
    Gamma: 2.20
    DPMS levels: Standby Suspend Off
    RGB color display
    First detailed timing is the preferred timing
  Color Characteristics:
    Red  : 0.6328, 0.3417
    Green: 0.2900, 0.6152
    Blue : 0.1464, 0.0751
    White: 0.3134, 0.3291
  Established Timings I & II:
    IBM     :   720x400    70.081663 Hz   9:5     31.467 kHz     28.320000 MHz
    DMT 0x04:   640x480    59.940476 Hz   4:3     31.469 kHz     25.175000 MHz
    DMT 0x09:   800x600    60.316541 Hz   4:3     37.879 kHz     40.000000 MHz
    DMT 0x10:  1024x768    60.003840 Hz   4:3     48.363 kHz     65.000000 MHz
  Standard Timings:
    DMT 0x33:  1600x1200   60.000000 Hz   4:3     75.000 kHz    162.000000 MHz
    DMT 0x23:  1280x1024   60.019740 Hz   5:4     63.981 kHz    108.000000 MHz
    DMT 0x20:  1280x960    60.000000 Hz   4:3     60.000 kHz    108.000000 MHz
  Detailed Timing Descriptors:
    DTD 1:  1600x1200   60.000000 Hz   4:3     75.000 kHz    162.000000 MHz (408 mm x 306 mm)
                 Hfront   64 Hsync 192 Hback  304 Hpol P
                 Vfront    1 Vsync   3 Vback   46 Vpol P
    Display Range Limits:
      Monitor ranges (GTF): 57-63 Hz V, 28-75 kHz H, max dotclock 160 MHz
    Display Product Name: 'SDM-S205F/K'
    Display Product Serial Number: ...
Checksum: 0x46

----------------

Block 1, Unknown EDID Extension Block 0x00:
  00 ff ff ff ff ff ff 00 4d d9 00 4c 01 01 01 01 '........M..L....'
  04 10 01 03 80 29 1f 78 ea 26 95 a2 57 4a 9d 25 '.....).x.&..WJ.%'
  13 50 54 a1 08 00 a9 40 81 80 81 40 01 01 01 01 '.PT....@...@....'
  01 01 01 01 01 01 48 3f 40 30 62 b0 32 40 40 c0 '......H?@0b.2@@.'
  13 00 98 32 11 00 00 1e 00 00 00 fd 00 39 3f 1c '...2.........9?.'
  4b 10 00 0a 20 20 20 20 20 20 00 00 00 fc 00 53 'K...      .....S'
  44 4d 2d 53 32 30 35 46 2f 4b 0a 20 00 00 00 ff 'DM-S205F/K. ....'
  00 36 33 30 34 37 37 31 0a 20 20 20 20 20 00 46 '.6304771.     .F'
Checksum: 0x46

----------------

Failures:

Block 1, Base EDID:
  Unknown Extension Block.
EDID:
  Base EDID: Some timings are out of range of the Monitor Ranges:
    Vertical Freq: 59.940 - 70.082 Hz (Monitor: 57.000 - 63.000 Hz)
    Maximum Clock: 162.000 MHz (Monitor: 160.000 MHz)
  Base EDID: EDID specified 0 extension block(s), but found 1 extension block(s).

EDID conformity: FAIL
