
EDID (hex):
00ffffffffffff0026cd0c56140a0000
2216010380341d782a6041a6564a9c25
125054bfef0081808140714f9500950f
b30001010101023a801871382d40582c
450009252100001e000000fd00384c1e
5311000a202020202020000000fc0050
4c3234303948440a20202020000000ff
0031313030354d32383032353830014f
020308004312131e8c0ad08a20e02d10
103e9600092521000018011d007251d0
1e206e28550009252100001e011d00bc
52d01e20b828554009252100001e8c0a
d090204031200c405500092521000018
00000000000000000000000000000000
00000000000000000000000000000000
000000000000000000000000000000e3

Extracted contents:
header:          00 ff ff ff ff ff ff 00
serial number:   26 cd 0c 56 14 0a 00 00 22 16
version:         01 03
basic params:    80 34 1d 78 2a
chroma info:     60 41 a6 56 4a 9c 25 12 50 54
established:     bf ef 00
standard:        81 80 81 40 71 4f 95 00 95 0f b3 00 01 01 01 01
descriptor 1:    02 3a 80 18 71 38 2d 40 58 2c 45 00 09 25 21 00 00 1e
descriptor 2:    00 00 00 fd 00 38 4c 1e 53 11 00 0a 20 20 20 20 20 20
descriptor 3:    00 00 00 fc 00 50 4c 32 34 30 39 48 44 0a 20 20 20 20
descriptor 4:    00 00 00 ff 00 31 31 30 30 35 4d 32 38 30 32 35 38 30
extensions:      01
checksum:        4f

EDID version: 1.3
Manufacturer: IVM Model 560c Serial Number --
Made in week 34 of 2012
Digital display
Maximum image size: 52 cm x 29 cm
Gamma: 2.20
DPMS levels: Off
RGB color display
First detailed timing is preferred timing
Display x,y Chromaticity:
  Red:   0.6494, 0.3378
  Green: 0.2890, 0.6093
  Blue:  0.1455, 0.0703
  White: 0.3125, 0.3291
Established timings supported:
  720x400@70Hz 9:5 HorFreq: 31469 Hz Clock: 28.320 MHz
  640x480@60Hz 4:3 HorFreq: 31469 Hz Clock: 25.175 MHz
  640x480@67Hz 4:3 HorFreq: 35000 Hz Clock: 30.240 MHz
  640x480@72Hz 4:3 HorFreq: 37900 Hz Clock: 31.500 MHz
  640x480@75Hz 4:3 HorFreq: 37500 Hz Clock: 31.500 MHz
  800x600@56Hz 4:3 HorFreq: 35200 Hz Clock: 36.000 MHz
  800x600@60Hz 4:3 HorFreq: 37900 Hz Clock: 40.000 MHz
  800x600@72Hz 4:3 HorFreq: 48100 Hz Clock: 50.000 MHz
  800x600@75Hz 4:3 HorFreq: 46900 Hz Clock: 49.500 MHz
  832x624@75Hz 4:3 HorFreq: 49726 Hz Clock: 57.284 MHz
  1024x768@60Hz 4:3 HorFreq: 48400 Hz Clock: 65.000 MHz
  1024x768@70Hz 4:3 HorFreq: 56500 Hz Clock: 75.000 MHz
  1024x768@75Hz 4:3 HorFreq: 60000 Hz Clock: 78.750 MHz
  1280x1024@75Hz 5:4 HorFreq: 80000 Hz Clock: 135.000 MHz
Standard timings supported:
  1280x1024@60Hz 5:4 HorFreq: 64000 Hz Clock: 108.000 MHz
  1280x960@60Hz 4:3 HorFreq: 60000 Hz Clock: 108.000 MHz
  1152x864@75Hz 4:3 HorFreq: 67500 Hz Clock: 108.000 MHz
  1440x900@60Hz 16:10 HorFreq: 55500 Hz Clock: 88.750 MHz
  1440x900@75Hz 16:10 HorFreq: 82300 Hz Clock: 156.000 MHz
  1680x1050@60Hz 16:10 HorFreq: 64700 Hz Clock: 119.000 MHz
Detailed mode: Clock 148.500 MHz, 521 mm x 293 mm
               1920 2008 2052 2200 hborder 0
               1080 1084 1089 1125 vborder 0
               +hsync +vsync 
               VertFreq: 60 Hz, HorFreq: 67500 Hz
Monitor ranges (GTF): 56-76Hz V, 30-83kHz H, max dotclock 170MHz
Monitor name: PL2409HD
Serial number: --
Has 1 extension blocks
Checksum: 0x4f (valid)

CTA extension block
Extension version: 3
4 bytes of CTA data
  Video data block
    VIC  18 720x576@50Hz 16:9  HorFreq: 31250 Hz Clock: 27.000 MHz
    VIC  19 1280x720@50Hz 16:9  HorFreq: 37500 Hz Clock: 74.250 MHz
    VIC  30 1440x576@50Hz 16:9  HorFreq: 31250 Hz Clock: 54.000 MHz
0 native detailed modes
Detailed mode: Clock 27.000 MHz, 521 mm x 293 mm
                720  736  798  858 hborder 0
                480  489  495  525 vborder 0
               -hsync -vsync 
               VertFreq: 59 Hz, HorFreq: 31468 Hz
Detailed mode: Clock 74.250 MHz, 521 mm x 293 mm
               1280 1390 1430 1650 hborder 0
                720  725  730  750 vborder 0
               +hsync +vsync 
               VertFreq: 60 Hz, HorFreq: 45000 Hz
Detailed mode: Clock 74.250 MHz, 521 mm x 293 mm
               1280 1720 1760 1980 hborder 0
                720  725  730  750 vborder 0
               +hsync +vsync 
               VertFreq: 50 Hz, HorFreq: 37500 Hz
Detailed mode: Clock 27.000 MHz, 521 mm x 293 mm
                720  732  796  864 hborder 0
                576  581  586  625 vborder 0
               -hsync -vsync 
               VertFreq: 50 Hz, HorFreq: 31250 Hz
Checksum: 0xe3 (valid)

One or more of the timings is out of range of the Monitor Ranges:
  Vertical Freq: 50 - 75 Hz
  Horizontal Freq: 31250 - 82300 Hz
  Maximum Clock: 156.000 MHz
EDID block does not conform at all!
	Both the serial number and the serial string are set


