
EDID (hex):
00ffffffffffff0004720605c0200000
261d0103684627782ae9a59e5851a227
095054bfef80d1c0b300a94095008180
814081c0714f023a801871382d40582c
4500ba892100001e000000fd00374c1e
5311000a202020202020000000fc0045
42333231485120410a202020000000ff
005444344141303031335030300a00a0

Extracted contents:
header:          00 ff ff ff ff ff ff 00
serial number:   04 72 06 05 c0 20 00 00 26 1d
version:         01 03
basic params:    68 46 27 78 2a
chroma info:     e9 a5 9e 58 51 a2 27 09 50 54
established:     bf ef 80
standard:        d1 c0 b3 00 a9 40 95 00 81 80 81 40 81 c0 71 4f
descriptor 1:    02 3a 80 18 71 38 2d 40 58 2c 45 00 ba 89 21 00 00 1e
descriptor 2:    00 00 00 fd 00 37 4c 1e 53 11 00 0a 20 20 20 20 20 20
descriptor 3:    00 00 00 fc 00 45 42 33 32 31 48 51 20 41 0a 20 20 20
descriptor 4:    00 00 00 ff 00 54 44 34 41 41 30 30 31 33 50 30 30 0a
extensions:      00
checksum:        a0

EDID version: 1.3
Manufacturer: ACR Model 506 Serial Number --
Made in week 38 of 2019
Analog display, Input voltage level: 0.7/0.7 V
Sync: Separate 
Maximum image size: 70 cm x 39 cm
Gamma: 2.20
DPMS levels: Off
RGB color display
First detailed timing is preferred timing
Display x,y Chromaticity:
  Red:   0.6201, 0.3457
  Green: 0.3183, 0.6337
  Blue:  0.1542, 0.0371
  White: 0.3134, 0.3291
Established timings supported:
  720x400@70Hz 9:5 HorFreq: 31469 Hz Clock: 28.320 MHz
  640x480@60Hz 4:3 HorFreq: 31469 Hz Clock: 25.175 MHz
  640x480@67Hz 4:3 HorFreq: 35000 Hz Clock: 30.240 MHz
  640x480@72Hz 4:3 HorFreq: 37900 Hz Clock: 31.500 MHz
  640x480@75Hz 4:3 HorFreq: 37500 Hz Clock: 31.500 MHz
  800x600@56Hz 4:3 HorFreq: 35200 Hz Clock: 36.000 MHz
  800x600@60Hz 4:3 HorFreq: 37900 Hz Clock: 40.000 MHz
  800x600@72Hz 4:3 HorFreq: 48100 Hz Clock: 50.000 MHz
  800x600@75Hz 4:3 HorFreq: 46900 Hz Clock: 49.500 MHz
  832x624@75Hz 4:3 HorFreq: 49726 Hz Clock: 57.284 MHz
  1024x768@60Hz 4:3 HorFreq: 48400 Hz Clock: 65.000 MHz
  1024x768@70Hz 4:3 HorFreq: 56500 Hz Clock: 75.000 MHz
  1024x768@75Hz 4:3 HorFreq: 60000 Hz Clock: 78.750 MHz
  1280x1024@75Hz 5:4 HorFreq: 80000 Hz Clock: 135.000 MHz
  1152x870@75Hz 192:145 HorFreq: 67500 Hz Clock: 108.000 MHz
Standard timings supported:
  1920x1080@60Hz 16:9
  1680x1050@60Hz 16:10 HorFreq: 64700 Hz Clock: 119.000 MHz
  1600x1200@60Hz 4:3 HorFreq: 75000 Hz Clock: 162.000 MHz
  1440x900@60Hz 16:10 HorFreq: 55500 Hz Clock: 88.750 MHz
  1280x1024@60Hz 5:4 HorFreq: 64000 Hz Clock: 108.000 MHz
  1280x960@60Hz 4:3 HorFreq: 60000 Hz Clock: 108.000 MHz
  1280x720@60Hz 16:9
  1152x864@75Hz 4:3 HorFreq: 67500 Hz Clock: 108.000 MHz
Detailed mode: Clock 148.500 MHz, 698 mm x 393 mm
               1920 2008 2052 2200 hborder 0
               1080 1084 1089 1125 vborder 0
               +hsync +vsync 
               VertFreq: 60 Hz, HorFreq: 67500 Hz
Monitor ranges (GTF): 55-76Hz V, 30-83kHz H, max dotclock 170MHz
Monitor name: EB321HQ A
Serial number: --
Checksum: 0xa0 (valid)


