
EDID (hex):
00ffffffffffff00220e393501010101
141e0103682917782a22e5a35b4fa326
135054a108008180810081c001010101
010101010101201c5686500020300e38
13009ae61000001e000000fd00323c1e
460b000a202020202020000000fc0048
5020563139620a2020202020000000ff
0042524c303230363937340a20200022

edid-decode (hex):

00 ff ff ff ff ff ff 00 22 0e 39 35 01 01 01 01
14 1e 01 03 68 29 17 78 2a 22 e5 a3 5b 4f a3 26
13 50 54 a1 08 00 81 80 81 00 81 c0 01 01 01 01
01 01 01 01 01 01 20 1c 56 86 50 00 20 30 0e 38
13 00 9a e6 10 00 00 1e 00 00 00 fd 00 32 3c 1e
46 0b 00 0a 20 20 20 20 20 20 00 00 00 fc 00 48
50 20 56 31 39 62 0a 20 20 20 20 20 00 00 00 ff
00 42 52 4c 30 32 30 36 39 37 34 0a 20 20 00 22

----------------

Block 0, Base EDID:
  EDID Structure Version & Revision: 1.3
  Vendor & Product Identification:
    Manufacturer: HPN
    Model: 13625
    Serial Number: 16843009
    Made in: week 20 of 2020
  Basic Display Parameters & Features:
    Analog display
    Signal Level Standard: 0.700 : 0.000 : 0.700 V p-p
    Blank level equals black level
    Sync: Separate
    Maximum image size: 41 cm x 23 cm
    Gamma: 2.20
    DPMS levels: Off
    RGB color display
    First detailed timing is the preferred timing
  Color Characteristics:
    Red  : 0.6367, 0.3574
    Green: 0.3085, 0.6386
    Blue : 0.1513, 0.0761
    White: 0.3134, 0.3291
  Established Timings I & II:
    IBM     :   720x400    70.081663 Hz   9:5     31.467 kHz     28.320000 MHz
    DMT 0x04:   640x480    59.940476 Hz   4:3     31.469 kHz     25.175000 MHz
    DMT 0x09:   800x600    60.316541 Hz   4:3     37.879 kHz     40.000000 MHz
    DMT 0x10:  1024x768    60.003840 Hz   4:3     48.363 kHz     65.000000 MHz
  Standard Timings:
    DMT 0x23:  1280x1024   60.019740 Hz   5:4     63.981 kHz    108.000000 MHz
    DMT 0x1c:  1280x800    59.810326 Hz  16:10    49.702 kHz     83.500000 MHz
    DMT 0x55:  1280x720    60.000000 Hz  16:9     45.000 kHz     74.250000 MHz
  Detailed Timing Descriptors:
    DTD 1:  1366x768    60.000000 Hz 683:384   48.000 kHz     72.000000 MHz (410 mm x 230 mm)
                 Hfront   14 Hsync  56 Hback   64 Hpol P
                 Vfront    1 Vsync   3 Vback   28 Vpol P
    Display Range Limits:
      Monitor ranges (GTF): 50-60 Hz V, 30-70 kHz H, max dotclock 110 MHz
    Display Product Name: 'HP V19b'
    Display Product Serial Number: 'BRL0206974'
Checksum: 0x22
