
EDID (hex):
00ffffffffffff0030e41e0500000000
001a0104a51f1178eaca85a352469926
12505400000001010101010101010101
01010101010160d100b4f0703e803c24
350035ae1000001a0000000000000000
00000000000000000000000000fe004c
4720446973706c61790a2020000000fe
004c503133395544312d5350413100b1

Extracted contents:
header:          00 ff ff ff ff ff ff 00
serial number:   30 e4 1e 05 00 00 00 00 00 1a
version:         01 04
basic params:    a5 1f 11 78 ea
chroma info:     ca 85 a3 52 46 99 26 12 50 54
established:     00 00 00
standard:        01 01 01 01 01 01 01 01 01 01 01 01 01 01 01 01
descriptor 1:    60 d1 00 b4 f0 70 3e 80 3c 24 35 00 35 ae 10 00 00 1a
descriptor 2:    00 00 00 00 00 00 00 00 00 00 00 00 00 00 00 00 00 00
descriptor 3:    00 00 00 fe 00 4c 47 20 44 69 73 70 6c 61 79 0a 20 20
descriptor 4:    00 00 00 fe 00 4c 50 31 33 39 55 44 31 2d 53 50 41 31
extensions:      00
checksum:        b1

EDID version: 1.4
Manufacturer: LGD Model 51e Serial Number --
Made in year 2016
Digital display
8 bits per primary color channel
DisplayPort interface
Maximum image size: 31 cm x 17 cm
Gamma: 2.20
DPMS levels: Standby Suspend Off
Supported color formats: RGB 4:4:4, YCrCb 4:4:4
First detailed timing includes the native pixel format and preferred refresh rate
Display x,y Chromaticity:
  Red:   0.6396, 0.3203
  Green: 0.2753, 0.5996
  Blue:  0.1503, 0.0703
  White: 0.3134, 0.3291
Established timings supported:
Standard timings supported:
Detailed mode: Clock 536.000 MHz, 309 mm x 174 mm
               3840 3900 3936 4020 hborder 0
               2160 2163 2168 2222 vborder 0
               +hsync -vsync 
               VertFreq: 60 Hz, HorFreq: 133333 Hz
Manufacturer-specified data, tag 0
ASCII string: LG Display
ASCII string: LP139UD1-SPA1
Checksum: 0xb1 (valid)
EDID block does NOT conform to EDID 1.4!
	Missing name descriptor
	Missing monitor ranges
