edid-decode (hex):

00 ff ff ff ff ff ff 00 41 2f 24 00 01 01 01 01
00 0e 01 03 08 00 00 78 ea 1b be a2 55 34 b3 26
14 4a 52 bf ee 00 31 59 45 59 61 59 01 01 01 01
01 01 01 01 01 01 64 19 00 40 41 00 26 30 18 88
36 00 00 00 00 00 00 18 0e 1f 00 80 51 00 1e 30
40 80 37 00 00 00 00 00 00 1c 00 00 00 fd 00 37
56 18 46 09 00 0a 20 20 20 20 20 20 00 00 00 fc
00 50 44 50 2d 52 30 34 0a 20 20 20 20 20 00 03

00 ff ff ff ff ff ff 00 41 2f 24 00 01 01 01 01
00 0e 01 03 08 00 00 78 ea 1b be a2 55 34 b3 26
14 4a 52 bf ee 00 31 59 45 59 61 59 01 01 01 01
01 01 01 01 01 01 64 19 00 40 41 00 26 30 18 88
36 00 00 00 00 00 00 18 0e 1f 00 80 51 00 1e 30
40 80 37 00 00 00 00 00 00 1c 00 00 00 fd 00 37
56 18 46 09 00 0a 20 20 20 20 20 20 00 00 00 fc
00 50 44 50 2d 52 30 34 0a 20 20 20 20 20 00 03

----------------

Block 0, Base EDID:
  EDID Structure Version & Revision: 1.3
  Vendor & Product Identification:
    Manufacturer: PIO
    Model: 36
    Serial Number: ...
    Made in: 2004
  Basic Display Parameters & Features:
    Analog display
    Signal Level Standard: 0.700 : 0.300 : 1.000 V p-p
    Blank level equals black level
    Sync: Separate
    Image size is variable
    Gamma: 2.20
    DPMS levels: Standby Suspend Off
    RGB color display
    First detailed timing is the preferred timing
  Color Characteristics:
    Red  : 0.6328, 0.3330
    Green: 0.2050, 0.7021
    Blue : 0.1503, 0.0810
    White: 0.2919, 0.3222
  Established Timings I & II:
    IBM     :   720x400    70.081663 Hz   9:5     31.467 kHz     28.320000 MHz
    DMT 0x04:   640x480    59.940476 Hz   4:3     31.469 kHz     25.175000 MHz
    Apple   :   640x480    66.666667 Hz   4:3     35.000 kHz     30.240000 MHz
    DMT 0x05:   640x480    72.808802 Hz   4:3     37.861 kHz     31.500000 MHz
    DMT 0x06:   640x480    75.000000 Hz   4:3     37.500 kHz     31.500000 MHz
    DMT 0x08:   800x600    56.250000 Hz   4:3     35.156 kHz     36.000000 MHz
    DMT 0x09:   800x600    60.316541 Hz   4:3     37.879 kHz     40.000000 MHz
    DMT 0x0a:   800x600    72.187572 Hz   4:3     48.077 kHz     50.000000 MHz
    DMT 0x0b:   800x600    75.000000 Hz   4:3     46.875 kHz     49.500000 MHz
    Apple   :   832x624    74.551266 Hz   4:3     49.726 kHz     57.284000 MHz
    DMT 0x10:  1024x768    60.003840 Hz   4:3     48.363 kHz     65.000000 MHz
    DMT 0x11:  1024x768    70.069359 Hz   4:3     56.476 kHz     75.000000 MHz
    DMT 0x12:  1024x768    75.028582 Hz   4:3     60.023 kHz     78.750000 MHz
  Standard Timings:
    DMT 0x07:   640x480    85.008312 Hz   4:3     43.269 kHz     36.000000 MHz
    DMT 0x0c:   800x600    85.061274 Hz   4:3     53.674 kHz     56.250000 MHz
    DMT 0x13:  1024x768    84.996690 Hz   4:3     68.677 kHz     94.500000 MHz
  Detailed Timing Descriptors:
    DTD 1:  1024x768    60.003840 Hz   4:3     48.363 kHz     65.000000 MHz
                 Hfront   24 Hsync 136 Hback  160 Hpol N
                 Vfront    3 Vsync   6 Vback   29 Vpol N
    DTD 2:  1280x768    59.870228 Hz   5:3     47.776 kHz     79.500000 MHz
                 Hfront   64 Hsync 128 Hback  192 Hpol N
                 Vfront    3 Vsync   7 Vback   20 Vpol P
    Display Range Limits:
      Monitor ranges (GTF): 55-86 Hz V, 24-70 kHz H, max dotclock 90 MHz
    Display Product Name: 'PDP-R04'
Checksum: 0x03

----------------

Block 1, Unknown EDID Extension Block 0x00:
  00 ff ff ff ff ff ff 00 41 2f 24 00 01 01 01 01 '........A/$.....'
  00 0e 01 03 08 00 00 78 ea 1b be a2 55 34 b3 26 '.......x....U4.&'
  14 4a 52 bf ee 00 31 59 45 59 61 59 01 01 01 01 '.JR...1YEYaY....'
  01 01 01 01 01 01 64 19 00 40 41 00 26 30 18 88 '......d..@A.&0..'
  36 00 00 00 00 00 00 18 0e 1f 00 80 51 00 1e 30 '6...........Q..0'
  40 80 37 00 00 00 00 00 00 1c 00 00 00 fd 00 37 '@.7............7'
  56 18 46 09 00 0a 20 20 20 20 20 20 00 00 00 fc 'V.F...      ....'
  00 50 44 50 2d 52 30 34 0a 20 20 20 20 20 00 03 '.PDP-R04.     ..'
Checksum: 0x03

----------------

Warnings:

EDID:
  Base EDID: Some timings are out of range of the Monitor Ranges:
    Maximum Clock: 94.500 MHz (Monitor: 90.000 MHz)
    Could be due to a Monitor Range off-by-one rounding issue

Failures:

Block 1, Base EDID:
  Unknown Extension Block.
EDID:
  Base EDID: EDID specified 0 extension block(s), but found 1 extension block(s).

EDID conformity: FAIL
