
EDID (hex):
00ffffffffffff001ab31003d4a80100
040d010308221b8cea6f86a25a4d9424
1a4f54a74f003140314f4540454f6140
614f8180818f302a009851002a403070
1300520e1100001e000000ff00594552
413130383735360a2020000000fd0038
4b1f500e000a202020202020000000fc
00343331322046410a20202020200042

Extracted contents:
header:          00 ff ff ff ff ff ff 00
serial number:   1a b3 10 03 d4 a8 01 00 04 0d
version:         01 03
basic params:    08 22 1b 8c ea
chroma info:     6f 86 a2 5a 4d 94 24 1a 4f 54
established:     a7 4f 00
standard:        31 40 31 4f 45 40 45 4f 61 40 61 4f 81 80 81 8f
descriptor 1:    30 2a 00 98 51 00 2a 40 30 70 13 00 52 0e 11 00 00 1e
descriptor 2:    00 00 00 ff 00 59 45 52 41 31 30 38 37 35 36 0a 20 20
descriptor 3:    00 00 00 fd 00 38 4b 1f 50 0e 00 0a 20 20 20 20 20 20
descriptor 4:    00 00 00 fc 00 34 33 31 32 20 46 41 0a 20 20 20 20 20
extensions:      00
checksum:        42

EDID version: 1.3
Manufacturer: FUS Model 310 Serial Number --
Analog display, Input voltage level: 0.7/0.3 V
Sync: Separate 
Maximum image size: 34 cm x 27 cm
Gamma: 2.40
DPMS levels: Standby Suspend Off
RGB color display
First detailed timing is preferred timing
Display x,y Chromaticity:
  Red:   0.6337, 0.3535
  Green: 0.3037, 0.5810
  Blue:  0.1425, 0.1015
  White: 0.3095, 0.3300
Established timings supported:
  720x400@70Hz 9:5 HorFreq: 31469 Hz Clock: 28.320 MHz
  640x480@60Hz 4:3 HorFreq: 31469 Hz Clock: 25.175 MHz
  640x480@75Hz 4:3 HorFreq: 37500 Hz Clock: 31.500 MHz
  800x600@56Hz 4:3 HorFreq: 35200 Hz Clock: 36.000 MHz
  800x600@60Hz 4:3 HorFreq: 37900 Hz Clock: 40.000 MHz
  800x600@75Hz 4:3 HorFreq: 46900 Hz Clock: 49.500 MHz
  1024x768@60Hz 4:3 HorFreq: 48400 Hz Clock: 65.000 MHz
  1024x768@70Hz 4:3 HorFreq: 56500 Hz Clock: 75.000 MHz
  1024x768@75Hz 4:3 HorFreq: 60000 Hz Clock: 78.750 MHz
  1280x1024@75Hz 5:4 HorFreq: 80000 Hz Clock: 135.000 MHz
Standard timings supported:
  640x480@60Hz 4:3 HorFreq: 31469 Hz Clock: 25.175 MHz
  640x480@75Hz 4:3 HorFreq: 37500 Hz Clock: 31.500 MHz
  800x600@60Hz 4:3 HorFreq: 37900 Hz Clock: 40.000 MHz
  800x600@75Hz 4:3 HorFreq: 46900 Hz Clock: 49.500 MHz
  1024x768@60Hz 4:3 HorFreq: 48400 Hz Clock: 65.000 MHz
  1024x768@75Hz 4:3 HorFreq: 60000 Hz Clock: 78.750 MHz
  1280x1024@60Hz 5:4 HorFreq: 64000 Hz Clock: 108.000 MHz
  1280x1024@75Hz 5:4 HorFreq: 80000 Hz Clock: 135.000 MHz
Detailed mode: Clock 108.000 MHz, 338 mm x 270 mm
               1280 1328 1440 1688 hborder 0
               1024 1025 1028 1066 vborder 0
               +hsync +vsync 
               VertFreq: 60 Hz, HorFreq: 63981 Hz
Serial number: --
Monitor ranges (GTF): 56-75Hz V, 31-80kHz H, max dotclock 140MHz
Monitor name: 4312 FA
Checksum: 0x42 (valid)
EDID block does not conform at all!
	Bad year of manufacture
