
EDID (hex):
00ffffffffffff0004725d044eae4751
0e190103802a1a6b2a49a5a457509e27
0f5054bfef80714f81c0810095000101
0101010101019a29a0d0518422305098
3600a3061100001c000000ff00543348
4141303031343232300a000000fd0037
4c1e530e000a202020202020000000fc
0041636572205632303657514c0a00cc

Extracted contents:
header:          00 ff ff ff ff ff ff 00
serial number:   04 72 5d 04 4e ae 47 51 0e 19
version:         01 03
basic params:    80 2a 1a 6b 2a
chroma info:     49 a5 a4 57 50 9e 27 0f 50 54
established:     bf ef 80
standard:        71 4f 81 c0 81 00 95 00 01 01 01 01 01 01 01 01
descriptor 1:    9a 29 a0 d0 51 84 22 30 50 98 36 00 a3 06 11 00 00 1c
descriptor 2:    00 00 00 ff 00 54 33 48 41 41 30 30 31 34 32 32 30 0a
descriptor 3:    00 00 00 fd 00 37 4c 1e 53 0e 00 0a 20 20 20 20 20 20
descriptor 4:    00 00 00 fc 00 41 63 65 72 20 56 32 30 36 57 51 4c 0a
extensions:      00
checksum:        cc

EDID version: 1.3
Manufacturer: ACR Model 45d Serial Number --
Made in week 14 of 2015
Digital display
Maximum image size: 42 cm x 26 cm
Gamma: 2.07
DPMS levels: Off
RGB color display
First detailed timing is preferred timing
Display x,y Chromaticity:
  Red:   0.6416, 0.3398
  Green: 0.3144, 0.6181
  Blue:  0.1542, 0.0605
  White: 0.3134, 0.3291
Established timings supported:
  720x400@70Hz 9:5 HorFreq: 31469 Hz Clock: 28.320 MHz
  640x480@60Hz 4:3 HorFreq: 31469 Hz Clock: 25.175 MHz
  640x480@67Hz 4:3 HorFreq: 35000 Hz Clock: 30.240 MHz
  640x480@72Hz 4:3 HorFreq: 37900 Hz Clock: 31.500 MHz
  640x480@75Hz 4:3 HorFreq: 37500 Hz Clock: 31.500 MHz
  800x600@56Hz 4:3 HorFreq: 35200 Hz Clock: 36.000 MHz
  800x600@60Hz 4:3 HorFreq: 37900 Hz Clock: 40.000 MHz
  800x600@72Hz 4:3 HorFreq: 48100 Hz Clock: 50.000 MHz
  800x600@75Hz 4:3 HorFreq: 46900 Hz Clock: 49.500 MHz
  832x624@75Hz 4:3 HorFreq: 49726 Hz Clock: 57.284 MHz
  1024x768@60Hz 4:3 HorFreq: 48400 Hz Clock: 65.000 MHz
  1024x768@70Hz 4:3 HorFreq: 56500 Hz Clock: 75.000 MHz
  1024x768@75Hz 4:3 HorFreq: 60000 Hz Clock: 78.750 MHz
  1280x1024@75Hz 5:4 HorFreq: 80000 Hz Clock: 135.000 MHz
  1152x870@75Hz 192:145 HorFreq: 67500 Hz Clock: 108.000 MHz
Standard timings supported:
  1152x864@75Hz 4:3 HorFreq: 67500 Hz Clock: 108.000 MHz
  1280x720@60Hz 16:9
  1280x800@60Hz 16:10
  1440x900@60Hz 16:10 HorFreq: 55500 Hz Clock: 88.750 MHz
Detailed mode: Clock 106.500 MHz, 419 mm x 262 mm
               1440 1520 1672 1904 hborder 0
                900  903  909  934 vborder 0
               -hsync +vsync 
               VertFreq: 59 Hz, HorFreq: 55934 Hz
Serial number: --
Monitor ranges (GTF): 55-76Hz V, 30-83kHz H, max dotclock 140MHz
Monitor name: Acer V206WQL
Checksum: 0xcc (valid)


