
EDID (hex):
00ffffffffffff0010acb5a04c523530
241a010380351e78ee7e75a755529c27
0f5054a54b00714f8180a9c0a940d1c0
010101010101023a801871382d40582c
45000f282100001e000000ff0038434e
33593639333035524c0a000000fc0044
454c4c205332343135480a20000000fd
00384c1e5311000a202020202020015e

Extracted contents:
header:          00 ff ff ff ff ff ff 00
serial number:   10 ac b5 a0 4c 52 35 30 24 1a
version:         01 03
basic params:    80 35 1e 78 ee
chroma info:     7e 75 a7 55 52 9c 27 0f 50 54
established:     a5 4b 00
standard:        71 4f 81 80 a9 c0 a9 40 d1 c0 01 01 01 01 01 01
descriptor 1:    02 3a 80 18 71 38 2d 40 58 2c 45 00 0f 28 21 00 00 1e
descriptor 2:    00 00 00 ff 00 38 43 4e 33 59 36 39 33 30 35 52 4c 0a
descriptor 3:    00 00 00 fc 00 44 45 4c 4c 20 53 32 34 31 35 48 0a 20
descriptor 4:    00 00 00 fd 00 38 4c 1e 53 11 00 0a 20 20 20 20 20 20
extensions:      01
checksum:        5e

EDID version: 1.3
Manufacturer: DEL Model a0b5 Serial Number --
Made in week 36 of 2016
Digital display
Maximum image size: 53 cm x 30 cm
Gamma: 2.20
DPMS levels: Standby Suspend Off
RGB color display
Default (sRGB) color space is primary color space
First detailed timing is preferred timing
Display x,y Chromaticity:
  Red:   0.6533, 0.3349
  Green: 0.3232, 0.6113
  Blue:  0.1533, 0.0615
  White: 0.3134, 0.3291
Established timings supported:
  720x400@70Hz 9:5 HorFreq: 31469 Hz Clock: 28.320 MHz
  640x480@60Hz 4:3 HorFreq: 31469 Hz Clock: 25.175 MHz
  640x480@75Hz 4:3 HorFreq: 37500 Hz Clock: 31.500 MHz
  800x600@60Hz 4:3 HorFreq: 37900 Hz Clock: 40.000 MHz
  800x600@75Hz 4:3 HorFreq: 46900 Hz Clock: 49.500 MHz
  1024x768@60Hz 4:3 HorFreq: 48400 Hz Clock: 65.000 MHz
  1024x768@75Hz 4:3 HorFreq: 60000 Hz Clock: 78.750 MHz
  1280x1024@75Hz 5:4 HorFreq: 80000 Hz Clock: 135.000 MHz
Standard timings supported:
  1152x864@75Hz 4:3 HorFreq: 67500 Hz Clock: 108.000 MHz
  1280x1024@60Hz 5:4 HorFreq: 64000 Hz Clock: 108.000 MHz
  1600x900@60Hz 16:9
  1600x1200@60Hz 4:3 HorFreq: 75000 Hz Clock: 162.000 MHz
  1920x1080@60Hz 16:9
Detailed mode: Clock 148.500 MHz, 527 mm x 296 mm
               1920 2008 2052 2200 hborder 0
               1080 1084 1089 1125 vborder 0
               +hsync +vsync 
               VertFreq: 60 Hz, HorFreq: 67500 Hz
Serial number: --
Monitor name: DELL S2415H
Monitor ranges (GTF): 56-76Hz V, 30-83kHz H, max dotclock 170MHz
Has 1 extension blocks
Checksum: 0x5e (valid)
EDID block does NOT conform to EDID 1.3!
	sRGB is signaled, but the chromaticities do not match
