
EDID (hex):
00ffffffffffff004ca3415500000000
00130103802213780ace859e5b4c9426
17505400000001010101010101010101
010101010101411c56a0500016303020
250058c1100000190000000f00000000
00000000001eb4027400000000fe0053
414d53554e470a2020202020000000fe
00313536415430352d5430320a2000b8

Extracted contents:
header:          00 ff ff ff ff ff ff 00
serial number:   4c a3 41 55 00 00 00 00 00 13
version:         01 03
basic params:    80 22 13 78 0a
chroma info:     ce 85 9e 5b 4c 94 26 17 50 54
established:     00 00 00
standard:        01 01 01 01 01 01 01 01 01 01 01 01 01 01 01 01
descriptor 1:    41 1c 56 a0 50 00 16 30 30 20 25 00 58 c1 10 00 00 19
descriptor 2:    00 00 00 0f 00 00 00 00 00 00 00 00 00 1e b4 02 74 00
descriptor 3:    00 00 00 fe 00 53 41 4d 53 55 4e 47 0a 20 20 20 20 20
descriptor 4:    00 00 00 fe 00 31 35 36 41 54 30 35 2d 54 30 32 0a 20
extensions:      00
checksum:        b8

EDID version: 1.3
Manufacturer: SEC Model 5541 Serial Number --
Made in year 2009
Digital display
Maximum image size: 34 cm x 19 cm
Gamma: 2.20
RGB color display
First detailed timing is preferred timing
Display x,y Chromaticity:
  Red:   0.6201, 0.3554
  Green: 0.2998, 0.5800
  Blue:  0.1503, 0.0898
  White: 0.3134, 0.3291
Established timings supported:
Standard timings supported:
Detailed mode: Clock 72.330 MHz, 344 mm x 193 mm
               1366 1414 1446 1526 hborder 0
                768  770  775  790 vborder 0
               -hsync -vsync 
               VertFreq: 59 Hz, HorFreq: 47398 Hz
Manufacturer-specified data, tag 15
ASCII string: SAMSUNG
ASCII string: 156AT05-T02
Checksum: 0xb8 (valid)
EDID block does NOT conform to EDID 1.3!
	Missing name descriptor
	Missing monitor ranges
