edid-decode (hex):

00 ff ff ff ff ff ff 00 0d ae 44 11 00 00 00 00
27 1b 01 04 95 1a 0e 78 02 67 75 98 59 53 90 27
1c 50 54 00 00 00 01 01 01 01 01 01 01 01 01 01
01 01 01 01 01 01 da 1d 56 e2 50 00 20 30 88 1e
8c 00 00 90 10 00 00 18 00 00 00 fe 00 4e 31 31
36 42 43 50 2d 45 42 31 0a 20 00 00 00 fe 00 43
4d 4e 0a 20 20 20 20 20 20 20 20 20 00 00 00 fe
00 4e 31 31 36 42 43 50 2d 45 42 31 0a 20 00 82

----------------

Block 0, Base EDID:
  EDID Structure Version & Revision: 1.4
  Vendor & Product Identification:
    Manufacturer: CMN
    Model: 4420
    Made in: week 39 of 2017
  Basic Display Parameters & Features:
    Digital display
    Bits per primary color channel: 6
    DisplayPort interface
    Maximum image size: 26 cm x 14 cm
    Gamma: 2.20
    Supported color formats: RGB 4:4:4
    First detailed timing includes the native pixel format and preferred refresh rate
  Color Characteristics:
    Red  : 0.5947, 0.3496
    Green: 0.3251, 0.5654
    Blue : 0.1533, 0.1123
    White: 0.3134, 0.3291
  Established Timings I & II: none
  Standard Timings: none
  Detailed Timing Descriptors:
    DTD 1:  1366x768    60.003141 Hz 683:384   48.003 kHz     76.420000 MHz (256 mm x 144 mm)
                 Hfront  136 Hsync  30 Hback   60 Hpol N
                 Vfront    8 Vsync  12 Vback   12 Vpol N
    Alphanumeric Data String: 'N116BCP-EB1'
    Alphanumeric Data String: 'CMN'
    Alphanumeric Data String: 'N116BCP-EB1'
Checksum: 0x82

----------------

Warnings:

Block 0, Base EDID:
  Missing Display Product Name.

EDID conformity: PASS
