edid-decode (hex):

00 ff ff ff ff ff ff 00 15 c3 44 27 72 d8 a5 01
19 1a 01 03 80 34 21 78 ea 13 b5 b1 4e 35 b5 26
09 50 54 a1 08 00 a9 40 81 80 81 40 b3 00 01 01
01 01 01 01 01 01 28 3c 80 a0 70 b0 23 40 30 20
36 00 07 44 21 00 00 1a 1a 36 80 a0 70 38 1f 40
30 20 35 00 07 44 21 00 00 1a 00 00 00 fd 00 17
3f 1a 4e 11 00 0a 20 20 20 20 20 20 00 00 00 fc
00 43 53 32 34 32 30 0a 20 20 20 20 20 20 00 83

00 ff ff ff ff ff ff 00 15 c3 44 27 72 d8 a5 01
19 1a 01 03 80 34 21 78 ea 13 b5 b1 4e 35 b5 26
09 50 54 a1 08 00 a9 40 81 80 81 40 b3 00 01 01
01 01 01 01 01 01 28 3c 80 a0 70 b0 23 40 30 20
36 00 07 44 21 00 00 1a 1a 36 80 a0 70 38 1f 40
30 20 35 00 07 44 21 00 00 1a 00 00 00 fd 00 17
3f 1a 4e 11 00 0a 20 20 20 20 20 20 00 00 00 fc
00 43 53 32 34 32 30 0a 20 20 20 20 20 20 00 83

----------------

Block 0, Base EDID:
  EDID Structure Version & Revision: 1.3
  Vendor & Product Identification:
    Manufacturer: ENC
    Model: 10052
    Serial Number: ...
    Made in: week 25 of 2016
  Basic Display Parameters & Features:
    Digital display
    Maximum image size: 52 cm x 33 cm
    Gamma: 2.20
    DPMS levels: Standby Suspend Off
    RGB color display
    First detailed timing is the preferred timing
  Color Characteristics:
    Red  : 0.6914, 0.3056
    Green: 0.2070, 0.7099
    Blue : 0.1503, 0.0380
    White: 0.3134, 0.3291
  Established Timings I & II:
    IBM     :   720x400    70.081663 Hz   9:5     31.467 kHz     28.320000 MHz
    DMT 0x04:   640x480    59.940476 Hz   4:3     31.469 kHz     25.175000 MHz
    DMT 0x09:   800x600    60.316541 Hz   4:3     37.879 kHz     40.000000 MHz
    DMT 0x10:  1024x768    60.003840 Hz   4:3     48.363 kHz     65.000000 MHz
  Standard Timings:
    DMT 0x33:  1600x1200   60.000000 Hz   4:3     75.000 kHz    162.000000 MHz
    DMT 0x23:  1280x1024   60.019740 Hz   5:4     63.981 kHz    108.000000 MHz
    DMT 0x20:  1280x960    60.000000 Hz   4:3     60.000 kHz    108.000000 MHz
    DMT 0x3a:  1680x1050   59.954250 Hz  16:10    65.290 kHz    146.250000 MHz
  Detailed Timing Descriptors:
    DTD 1:  1920x1200   59.950171 Hz  16:10    74.038 kHz    154.000000 MHz (519 mm x 324 mm)
                 Hfront   48 Hsync  32 Hback   80 Hpol P
                 Vfront    3 Vsync   6 Vback   26 Vpol N
    DTD 2:  1920x1080   59.933878 Hz  16:9     66.587 kHz    138.500000 MHz (519 mm x 324 mm)
                 Hfront   48 Hsync  32 Hback   80 Hpol P
                 Vfront    3 Vsync   5 Vback   23 Vpol N
    Display Range Limits:
      Monitor ranges (GTF): 23-63 Hz V, 26-78 kHz H, max dotclock 170 MHz
    Display Product Name: 'CS2420'
Checksum: 0x83

----------------

Block 1, Unknown EDID Extension Block 0x00:
  00 ff ff ff ff ff ff 00 15 c3 44 27 72 d8 a5 01 '..........D'r...'
  19 1a 01 03 80 34 21 78 ea 13 b5 b1 4e 35 b5 26 '.....4!x....N5.&'
  09 50 54 a1 08 00 a9 40 81 80 81 40 b3 00 01 01 '.PT....@...@....'
  01 01 01 01 01 01 28 3c 80 a0 70 b0 23 40 30 20 '......(<..p.#@0 '
  36 00 07 44 21 00 00 1a 1a 36 80 a0 70 38 1f 40 '6..D!....6..p8.@'
  30 20 35 00 07 44 21 00 00 1a 00 00 00 fd 00 17 '0 5..D!.........'
  3f 1a 4e 11 00 0a 20 20 20 20 20 20 00 00 00 fc '?.N...      ....'
  00 43 53 32 34 32 30 0a 20 20 20 20 20 20 00 83 '.CS2420.      ..'
Checksum: 0x83

----------------

Failures:

Block 1, Base EDID:
  Unknown Extension Block.
EDID:
  Base EDID: Some timings are out of range of the Monitor Ranges:
    Vertical Freq: 59.934 - 70.082 Hz (Monitor: 23.000 - 63.000 Hz)
  Base EDID: EDID specified 0 extension block(s), but found 1 extension block(s).

EDID conformity: FAIL
