
EDID (hex):
00ffffffffffff002157100100000002
2a1701030e331d782bc1b0a3544c9926
0f5054254b00714f8100814081809500
a940b30081c0023a801871382d40582c
4500fd1e1100001e283c80a070b02340
30203600fd1e11000020000000fc0056
474120544f2048444d490a20000000fa
007140810f8bc08bc09040a9c00a0037

Extracted contents:
header:          00 ff ff ff ff ff ff 00
serial number:   21 57 10 01 00 00 00 02 2a 17
version:         01 03
basic params:    0e 33 1d 78 2b
chroma info:     c1 b0 a3 54 4c 99 26 0f 50 54
established:     25 4b 00
standard:        71 4f 81 00 81 40 81 80 95 00 a9 40 b3 00 81 c0
descriptor 1:    02 3a 80 18 71 38 2d 40 58 2c 45 00 fd 1e 11 00 00 1e
descriptor 2:    28 3c 80 a0 70 b0 23 40 30 20 36 00 fd 1e 11 00 00 20
descriptor 3:    00 00 00 fc 00 56 47 41 20 54 4f 20 48 44 4d 49 0a 20
descriptor 4:    00 00 00 fa 00 71 40 81 0f 8b c0 8b c0 90 40 a9 c0 0a
extensions:      00
checksum:        37

EDID version: 1.3
Manufacturer: HJW Model 110 Serial Number --
Made in week 42 of 2013
Analog display, Input voltage level: 0.7/0.3 V
Sync: Separate Composite SyncOnGreen 
Maximum image size: 51 cm x 29 cm
Gamma: 2.20
DPMS levels: Off
RGB color display
First detailed timing is preferred timing
Supports GTF timings within operating range
Display x,y Chromaticity:
  Red:   0.6396, 0.3281
  Green: 0.2968, 0.5986
  Blue:  0.1503, 0.0615
  White: 0.3125, 0.3281
Established timings supported:
  640x480@60Hz 4:3 HorFreq: 31469 Hz Clock: 25.175 MHz
  640x480@75Hz 4:3 HorFreq: 37500 Hz Clock: 31.500 MHz
  800x600@60Hz 4:3 HorFreq: 37900 Hz Clock: 40.000 MHz
  800x600@75Hz 4:3 HorFreq: 46900 Hz Clock: 49.500 MHz
  1024x768@60Hz 4:3 HorFreq: 48400 Hz Clock: 65.000 MHz
  1024x768@75Hz 4:3 HorFreq: 60000 Hz Clock: 78.750 MHz
  1280x1024@75Hz 5:4 HorFreq: 80000 Hz Clock: 135.000 MHz
Standard timings supported:
  1152x864@75Hz 4:3 HorFreq: 67500 Hz Clock: 108.000 MHz
  1280x800@60Hz 16:10
  1280x960@60Hz 4:3 HorFreq: 60000 Hz Clock: 108.000 MHz
  1280x1024@60Hz 5:4 HorFreq: 64000 Hz Clock: 108.000 MHz
  1440x900@60Hz 16:10 HorFreq: 55500 Hz Clock: 88.750 MHz
  1600x1200@60Hz 4:3 HorFreq: 75000 Hz Clock: 162.000 MHz
  1680x1050@60Hz 16:10 HorFreq: 64700 Hz Clock: 119.000 MHz
  1280x720@60Hz 16:9
Detailed mode: Clock 148.500 MHz, 509 mm x 286 mm
               1920 2008 2052 2200 hborder 0
               1080 1084 1089 1125 vborder 0
               +hsync +vsync 
               VertFreq: 60 Hz, HorFreq: 67500 Hz
Detailed mode: Clock 154.000 MHz, 509 mm x 286 mm
               1920 1968 2000 2080 hborder 0
               1200 1203 1209 1235 vborder 0
               -hsync -vsync analog composite field sequential L/R
               VertFreq: 59 Hz, HorFreq: 74038 Hz
Monitor name: VGA TO HDMI
More standard timings:
  1152x864@60Hz 4:3
  1280x800@75Hz 16:10
  1360x765@60Hz 16:9
  1360x765@60Hz 16:9
  1400x1050@60Hz 4:3 HorFreq: 64700 Hz Clock: 101.000 MHz
  1600x900@60Hz 16:9
Checksum: 0x37 (valid)
EDID block does NOT conform to EDID 1.3!
	Missing monitor ranges
