edid-decode (hex):

00 ff ff ff ff ff ff 00 09 e5 1c 06 00 00 00 00
01 18 01 04 95 1a 0f 78 0a 5d 40 94 5b 57 94 29
1c 50 54 00 00 00 01 01 01 01 01 01 01 01 01 01
01 01 01 01 01 01 b7 1d 56 ef 50 00 16 30 30 20
36 00 00 90 10 00 00 1a ce 13 56 ef 50 00 16 30
30 20 36 00 00 90 10 00 00 00 00 00 00 00 00 00
00 00 00 00 00 00 00 00 00 00 00 00 00 00 00 02
00 0a 3c e2 0a 3c 6e 15 0b 12 78 00 00 00 00 cf

----------------

Block 0, Base EDID:
  EDID Structure Version & Revision: 1.4
  Vendor & Product Identification:
    Manufacturer: BOE
    Model: 1564
    Made in: week 1 of 2014
  Basic Display Parameters & Features:
    Digital display
    Bits per primary color channel: 6
    DisplayPort interface
    Maximum image size: 26 cm x 15 cm
    Gamma: 2.20
    Supported color formats: RGB 4:4:4, YCrCb 4:4:4
    First detailed timing includes the native pixel format and preferred refresh rate
  Color Characteristics:
    Red  : 0.5791, 0.3564
    Green: 0.3427, 0.5791
    Blue : 0.1611, 0.1093
    White: 0.3125, 0.3281
  Established Timings I & II: none
  Standard Timings: none
  Detailed Timing Descriptors:
    DTD 1:  1366x768    59.994479 Hz 683:384   47.396 kHz     76.070000 MHz (256 mm x 144 mm)
                 Hfront   48 Hsync  32 Hback  159 Hpol P
                 Vfront    3 Vsync   6 Vback   13 Vpol N
    DTD 2:  1366x768    39.985804 Hz 683:384   31.589 kHz     50.700000 MHz (analog composite, sync-on-green, 256 mm x 144 mm)
                 Hfront   48 Hsync  32 Hback  159 Hpol N
                 Vfront    3 Vsync   6 Vback   13 Vpol N
    Empty Descriptor
    Manufacturer-Specified Display Descriptor (0x02): 00 02 00 0a 3c e2 0a 3c 6e 15 0b 12 78 00 00 00 '....<..<n...x...'
Checksum: 0xcf

----------------

Warnings:

Block 0, Base EDID:
  Missing Display Product Name.

Failures:

Block 0, Base EDID:
  Empty Descriptor: Use Dummy Descriptor instead of all zeroes.

EDID conformity: FAIL
