
EDID (hex):
00ffffffffffff0030e4166600000000
00140104901c10780a10a59658578f28
20505400000001010101010101010101
010101010101121b567850000e302020
2400159c1000001ac01256a050001630
30203500159c1000001a000000fe004d
59343236803132355748320a00000000
00004131940000000001010a2020008f

Extracted contents:
header:          00 ff ff ff ff ff ff 00
serial number:   30 e4 16 66 00 00 00 00 00 14
version:         01 04
basic params:    90 1c 10 78 0a
chroma info:     10 a5 96 58 57 8f 28 20 50 54
established:     00 00 00
standard:        01 01 01 01 01 01 01 01 01 01 01 01 01 01 01 01
descriptor 1:    12 1b 56 78 50 00 0e 30 20 20 24 00 15 9c 10 00 00 1a
descriptor 2:    c0 12 56 a0 50 00 16 30 30 20 35 00 15 9c 10 00 00 1a
descriptor 3:    00 00 00 fe 00 4d 59 34 32 36 80 31 32 35 57 48 32 0a
descriptor 4:    00 00 00 00 00 00 41 31 94 00 00 00 00 01 01 0a 20 20
extensions:      00
checksum:        8f

EDID version: 1.4
Manufacturer: LGD Model 6616 Serial Number --
Made in year 2010
Digital display
6 bits per primary color channel
Digital interface is not defined
Maximum image size: 28 cm x 16 cm
Gamma: 2.20
Supported color formats: RGB 4:4:4, YCrCb 4:4:4
First detailed timing includes the native pixel format and preferred refresh rate
Display x,y Chromaticity:
  Red:   0.5859, 0.3447
  Green: 0.3398, 0.5585
  Blue:  0.1582, 0.1269
  White: 0.3134, 0.3291
Established timings supported:
Standard timings supported:
Detailed mode: Clock 69.300 MHz, 277 mm x 156 mm
               1366 1398 1430 1486 hborder 0
                768  770  774  782 vborder 0
               +hsync -vsync 
               VertFreq: 59 Hz, HorFreq: 46635 Hz
Detailed mode: Clock 48.000 MHz, 277 mm x 156 mm
               1366 1414 1446 1526 hborder 0
                768  771  776  790 vborder 0
               +hsync -vsync 
               VertFreq: 39 Hz, HorFreq: 31454 Hz
ASCII string: MY426
Manufacturer-specified data, tag 0
Checksum: 0x8f (valid)
EDID block does NOT conform to EDID 1.4!
	Missing name descriptor
	Missing monitor ranges
	Detailed block string not properly terminated
