
EDID (hex):
00ffffffffffff0008ab621561b90b03
310f01030e2213782a3c44a654469924
13484bbfef0001010101010101010101
010101010101662150b051001b304070
360058c21000001a000000fd00384c1f
510f000a202020202020000000ff0035
32353030303030300a202020000000fc
00423136572d564a415a310a0a0a00bb

Extracted contents:
header:          00 ff ff ff ff ff ff 00
serial number:   08 ab 62 15 61 b9 0b 03 31 0f
version:         01 03
basic params:    0e 22 13 78 2a
chroma info:     3c 44 a6 54 46 99 24 13 48 4b
established:     bf ef 00
standard:        01 01 01 01 01 01 01 01 01 01 01 01 01 01 01 01
descriptor 1:    66 21 50 b0 51 00 1b 30 40 70 36 00 58 c2 10 00 00 1a
descriptor 2:    00 00 00 fd 00 38 4c 1f 51 0f 00 0a 20 20 20 20 20 20
descriptor 3:    00 00 00 ff 00 35 32 35 30 30 30 30 30 30 0a 20 20 20
descriptor 4:    00 00 00 fc 00 42 31 36 57 2d 56 4a 41 5a 31 0a 0a 0a
extensions:      00
checksum:        bb

EDID version: 1.3
Manufacturer: BEK Model 1562 Serial Number --
Analog display, Input voltage level: 0.7/0.3 V
Sync: Separate Composite SyncOnGreen 
Maximum image size: 34 cm x 19 cm
Gamma: 2.20
DPMS levels: Off
RGB color display
First detailed timing is preferred timing
Display x,y Chromaticity:
  Red:   0.6484, 0.3310
  Green: 0.2763, 0.5976
  Blue:  0.1416, 0.0742
  White: 0.2822, 0.2929
Established timings supported:
  720x400@70Hz 9:5 HorFreq: 31469 Hz Clock: 28.320 MHz
  640x480@60Hz 4:3 HorFreq: 31469 Hz Clock: 25.175 MHz
  640x480@67Hz 4:3 HorFreq: 35000 Hz Clock: 30.240 MHz
  640x480@72Hz 4:3 HorFreq: 37900 Hz Clock: 31.500 MHz
  640x480@75Hz 4:3 HorFreq: 37500 Hz Clock: 31.500 MHz
  800x600@56Hz 4:3 HorFreq: 35200 Hz Clock: 36.000 MHz
  800x600@60Hz 4:3 HorFreq: 37900 Hz Clock: 40.000 MHz
  800x600@72Hz 4:3 HorFreq: 48100 Hz Clock: 50.000 MHz
  800x600@75Hz 4:3 HorFreq: 46900 Hz Clock: 49.500 MHz
  832x624@75Hz 4:3 HorFreq: 49726 Hz Clock: 57.284 MHz
  1024x768@60Hz 4:3 HorFreq: 48400 Hz Clock: 65.000 MHz
  1024x768@70Hz 4:3 HorFreq: 56500 Hz Clock: 75.000 MHz
  1024x768@75Hz 4:3 HorFreq: 60000 Hz Clock: 78.750 MHz
  1280x1024@75Hz 5:4 HorFreq: 80000 Hz Clock: 135.000 MHz
Standard timings supported:
Detailed mode: Clock 85.500 MHz, 344 mm x 194 mm
               1360 1424 1536 1792 hborder 0
                768  771  777  795 vborder 0
               +hsync -vsync 
               VertFreq: 60 Hz, HorFreq: 47712 Hz
Monitor ranges (GTF): 56-76Hz V, 31-81kHz H, max dotclock 150MHz
Serial number: --
Monitor name: B16W-VJAZ1
Checksum: 0xbb (valid)
EDID block does NOT conform to EDID 1.3!
	Detailed block string not properly terminated
EDID block does not conform at all!
	Bad year of manufacture
