
EDID (hex):
00ffffffffffff0005b700005d020000
08120103082a1a782ae5b5a355499927
135054bfef809500950f8140718f0101
0101010101019a29a0d0518422305098
3600a4001100001c000000ff00303030
3630350a202020202020000000fd0037
4b1e500e000a202020202020000000fc
0058313931305744530a2020202000c4

Extracted contents:
header:          00 ff ff ff ff ff ff 00
serial number:   05 b7 00 00 5d 02 00 00 08 12
version:         01 03
basic params:    08 2a 1a 78 2a
chroma info:     e5 b5 a3 55 49 99 27 13 50 54
established:     bf ef 80
standard:        95 00 95 0f 81 40 71 8f 01 01 01 01 01 01 01 01
descriptor 1:    9a 29 a0 d0 51 84 22 30 50 98 36 00 a4 00 11 00 00 1c
descriptor 2:    00 00 00 ff 00 30 30 30 36 30 35 0a 20 20 20 20 20 20
descriptor 3:    00 00 00 fd 00 37 4b 1e 50 0e 00 0a 20 20 20 20 20 20
descriptor 4:    00 00 00 fc 00 58 31 39 31 30 57 44 53 0a 20 20 20 20
extensions:      00
checksum:        c4

EDID version: 1.3
Manufacturer: AMW Model 0 Serial Number --
Made in week 8 of 2008
Analog display, Input voltage level: 0.7/0.3 V
Sync: Separate 
Maximum image size: 42 cm x 26 cm
Gamma: 2.20
DPMS levels: Off
RGB color display
First detailed timing is preferred timing
Display x,y Chromaticity:
  Red:   0.6396, 0.3339
  Green: 0.2861, 0.5986
  Blue:  0.1542, 0.0771
  White: 0.3134, 0.3291
Established timings supported:
  720x400@70Hz 9:5 HorFreq: 31469 Hz Clock: 28.320 MHz
  640x480@60Hz 4:3 HorFreq: 31469 Hz Clock: 25.175 MHz
  640x480@67Hz 4:3 HorFreq: 35000 Hz Clock: 30.240 MHz
  640x480@72Hz 4:3 HorFreq: 37900 Hz Clock: 31.500 MHz
  640x480@75Hz 4:3 HorFreq: 37500 Hz Clock: 31.500 MHz
  800x600@56Hz 4:3 HorFreq: 35200 Hz Clock: 36.000 MHz
  800x600@60Hz 4:3 HorFreq: 37900 Hz Clock: 40.000 MHz
  800x600@72Hz 4:3 HorFreq: 48100 Hz Clock: 50.000 MHz
  800x600@75Hz 4:3 HorFreq: 46900 Hz Clock: 49.500 MHz
  832x624@75Hz 4:3 HorFreq: 49726 Hz Clock: 57.284 MHz
  1024x768@60Hz 4:3 HorFreq: 48400 Hz Clock: 65.000 MHz
  1024x768@70Hz 4:3 HorFreq: 56500 Hz Clock: 75.000 MHz
  1024x768@75Hz 4:3 HorFreq: 60000 Hz Clock: 78.750 MHz
  1280x1024@75Hz 5:4 HorFreq: 80000 Hz Clock: 135.000 MHz
  1152x870@75Hz 192:145 HorFreq: 67500 Hz Clock: 108.000 MHz
Standard timings supported:
  1440x900@60Hz 16:10 HorFreq: 55500 Hz Clock: 88.750 MHz
  1440x900@75Hz 16:10 HorFreq: 82300 Hz Clock: 156.000 MHz
  1280x960@60Hz 4:3 HorFreq: 60000 Hz Clock: 108.000 MHz
  1152x921@75Hz 5:4
Detailed mode: Clock 106.500 MHz, 420 mm x 256 mm
               1440 1520 1672 1904 hborder 0
                900  903  909  934 vborder 0
               -hsync +vsync 
               VertFreq: 59 Hz, HorFreq: 55934 Hz
Serial number: --
Monitor ranges (GTF): 55-75Hz V, 30-80kHz H, max dotclock 140MHz
Monitor name: X1910WDS
Checksum: 0xc4 (valid)
One or more of the timings is out of range of the Monitor Ranges:
  Vertical Freq: 56 - 75 Hz
  Horizontal Freq: 31469 - 82300 Hz
  Maximum Clock: 156.000 MHz


