edid-decode (hex):

00 ff ff ff ff ff ff 00 06 af 74 80 00 00 00 00
01 11 01 03 80 21 15 78 0a 1c f5 97 58 50 8e 27
27 50 54 00 00 00 01 01 01 01 01 01 01 01 01 01
01 01 01 01 01 01 12 1b 00 87 50 20 10 30 30 20
36 00 4b cf 10 00 00 18 00 00 00 0f 00 00 00 00
00 00 00 00 00 00 00 00 00 20 00 00 00 fe 00 41
55 4f 0a 20 00 20 20 20 20 20 20 20 00 00 00 fe
00 42 31 35 34 45 57 30 38 20 56 30 20 0a 00 39

----------------

Block 0, Base EDID:
  EDID Structure Version & Revision: 1.3
  Vendor & Product Identification:
    Manufacturer: AUO
    Model: 32884
    Made in: week 1 of 2007
  Basic Display Parameters & Features:
    Digital display
    Maximum image size: 33 cm x 21 cm
    Gamma: 2.20
    RGB color display
    First detailed timing is the preferred timing
  Color Characteristics:
    Red  : 0.5898, 0.3447
    Green: 0.3154, 0.5546
    Blue : 0.1552, 0.1552
    White: 0.3134, 0.3291
  Established Timings I & II: none
  Standard Timings: none
  Detailed Timing Descriptors:
    DTD 1:  1280x800    60.018707 Hz   8:5     48.975 kHz     69.300000 MHz (331 mm x 207 mm)
                 Hfront   48 Hsync  32 Hback   55 Hpol N
                 Vfront    3 Vsync   6 Vback    7 Vpol N
    Manufacturer-Specified Display Descriptor (0x0f): 00 0f 00 00 00 00 00 00 00 00 00 00 00 00 00 20 '............... '
    Alphanumeric Data String: 'AUO'
    Alphanumeric Data String: 'B154EW08 V0 '
Checksum: 0x39

----------------

Failures:

Block 0, Base EDID:
  Alphanumeric Data String: Non-space after newline.
  Alphanumeric Data String: One or more trailing spaces.
  Missing Display Product Name.
  Missing Display Range Limits Descriptor.

EDID conformity: FAIL
