edid-decode (hex):

00 ff ff ff ff ff ff 00 36 84 02 01 00 00 00 00
01 12 01 03 80 21 15 78 0a cf c0 97 59 4e 91 27
21 50 54 00 00 00 01 01 01 01 01 01 01 01 01 01
01 01 01 01 01 01 ea 1b 00 a0 50 20 17 30 30 20
36 00 4b cf 10 00 00 18 00 00 00 0f 00 00 00 00
00 00 00 00 00 00 00 00 00 01 00 00 00 fe 00 4d
49 4e 44 54 45 43 48 20 20 20 20 20 00 00 00 fe
00 4d 31 35 34 4e 57 57 31 30 30 30 20 0a 00 b6

----------------

Block 0, Base EDID:
  EDID Structure Version & Revision: 1.3
  Vendor & Product Identification:
    Manufacturer: MTD
    Model: 258
    Made in: week 1 of 2008
  Basic Display Parameters & Features:
    Digital display
    Maximum image size: 33 cm x 21 cm
    Gamma: 2.20
    RGB color display
    First detailed timing is preferred timing
  Color Characteristics:
    Red  : 0.5927, 0.3476
    Green: 0.3076, 0.5693
    Blue : 0.1552, 0.1289
    White: 0.3125, 0.3281
  Established Timings I & II: none
  Standard Timings: none
  Detailed Timing Descriptors:
    DTD 1:  1280x800    60.298 Hz   8:5    49.625 kHz  71.460 MHz (331 mm x 207 mm)
                 Hfront   48 Hsync  32 Hback  80 Hpol N
                 Vfront    3 Vsync   6 Vback  14 Vpol N
    Manufacturer-Specified Display Descriptor (0x0f): 00 0f 00 00 00 00 00 00 00 00 00 00 00 00 00 01 '................'
    Alphanumeric Data String: 'MINDTECH     '
    Alphanumeric Data String: 'M154NWW1000 '
Checksum: 0xb6
