
EDID (hex):
00ffffffffffff0010acfa935826df04
1c1b010380351e780a54c0a35b4fa426
12505400000001010101010101010101
010101010101023a801871382d403021
840010292100001e0000001000000000
00000000000000000000000000fc0049
6e737069726f6e2033343735000000fd
00324b405314000a2020212020200067

Extracted contents:
header:          00 ff ff ff ff ff ff 00
serial number:   10 ac fa 93 58 26 df 04 1c 1b
version:         01 03
basic params:    80 35 1e 78 0a
chroma info:     54 c0 a3 5b 4f a4 26 12 50 54
established:     00 00 00
standard:        01 01 01 01 01 01 01 01 01 01 01 01 01 01 01 01
descriptor 1:    02 3a 80 18 71 38 2d 40 30 21 84 00 10 29 21 00 00 1e
descriptor 2:    00 00 00 10 00 00 00 00 00 00 00 00 00 00 00 00 00 00
descriptor 3:    00 00 00 fc 00 49 6e 73 70 69 72 6f 6e 20 33 34 37 35
descriptor 4:    00 00 00 fd 00 32 4b 40 53 14 00 0a 20 20 21 20 20 20
extensions:      00
checksum:        67

EDID version: 1.3
Manufacturer: DEL Model 93fa Serial Number --
Made in week 28 of 2017
Digital display
Maximum image size: 53 cm x 30 cm
Gamma: 2.20
RGB color display
First detailed timing is preferred timing
Display x,y Chromaticity:
  Red:   0.6376, 0.3564
  Green: 0.3095, 0.6406
  Blue:  0.1513, 0.0703
  White: 0.3125, 0.3281
Established timings supported:
Standard timings supported:
Detailed mode: Clock 148.500 MHz, 528 mm x 297 mm
               1920 1968 2001 2200 hborder 0
               1080 1088 1092 1125 vborder 0
               +hsync +vsync 
               VertFreq: 60 Hz, HorFreq: 67500 Hz
Dummy block
Monitor ranges (GTF): 50-75Hz V, 64-83kHz H, max dotclock 200MHz
Checksum: 0x67 (valid)
EDID block does NOT conform to EDID 1.3!
	Name descriptor not terminated with a newline
