
EDID (hex):
00ffffffffffff0010ac22d04c343631
2214010380251778ea3a959c564e9726
185054bfef809500714f8180950f8100
0101010101019a29a0d0518422305098
360072e61000001c000000ff004b3837
364830384b3136344c0a000000fd0038
4b1e530e000a202020202020000000fc
0044454c4c204531373039570a20016d
02031b61230907078301000067030c00
2000802d43908402e2000f8c0ad08a20
e02d10103e9600a05a00000000000000
00000000000000000000000000000000
00000000000000000000000000000000
00000000000000000000000000000000
00000000000000000000000000000000
00000000000000000000000000000029

Extracted contents:
header:          00 ff ff ff ff ff ff 00
serial number:   10 ac 22 d0 4c 34 36 31 22 14
version:         01 03
basic params:    80 25 17 78 ea
chroma info:     3a 95 9c 56 4e 97 26 18 50 54
established:     bf ef 80
standard:        95 00 71 4f 81 80 95 0f 81 00 01 01 01 01 01 01
descriptor 1:    9a 29 a0 d0 51 84 22 30 50 98 36 00 72 e6 10 00 00 1c
descriptor 2:    00 00 00 ff 00 4b 38 37 36 48 30 38 4b 31 36 34 4c 0a
descriptor 3:    00 00 00 fd 00 38 4b 1e 53 0e 00 0a 20 20 20 20 20 20
descriptor 4:    00 00 00 fc 00 44 45 4c 4c 20 45 31 37 30 39 57 0a 20
extensions:      01
checksum:        6d

EDID version: 1.3
Manufacturer: DEL Model d022 Serial Number --
Made in week 34 of 2010
Digital display
Maximum image size: 37 cm x 23 cm
Gamma: 2.20
DPMS levels: Standby Suspend Off
RGB color display
First detailed timing is preferred timing
Display x,y Chromaticity:
  Red:   0.6093, 0.3388
  Green: 0.3066, 0.5917
  Blue:  0.1503, 0.0947
  White: 0.3134, 0.3291
Established timings supported:
  720x400@70Hz 9:5 HorFreq: 31469 Hz Clock: 28.320 MHz
  640x480@60Hz 4:3 HorFreq: 31469 Hz Clock: 25.175 MHz
  640x480@67Hz 4:3 HorFreq: 35000 Hz Clock: 30.240 MHz
  640x480@72Hz 4:3 HorFreq: 37900 Hz Clock: 31.500 MHz
  640x480@75Hz 4:3 HorFreq: 37500 Hz Clock: 31.500 MHz
  800x600@56Hz 4:3 HorFreq: 35200 Hz Clock: 36.000 MHz
  800x600@60Hz 4:3 HorFreq: 37900 Hz Clock: 40.000 MHz
  800x600@72Hz 4:3 HorFreq: 48100 Hz Clock: 50.000 MHz
  800x600@75Hz 4:3 HorFreq: 46900 Hz Clock: 49.500 MHz
  832x624@75Hz 4:3 HorFreq: 49726 Hz Clock: 57.284 MHz
  1024x768@60Hz 4:3 HorFreq: 48400 Hz Clock: 65.000 MHz
  1024x768@70Hz 4:3 HorFreq: 56500 Hz Clock: 75.000 MHz
  1024x768@75Hz 4:3 HorFreq: 60000 Hz Clock: 78.750 MHz
  1280x1024@75Hz 5:4 HorFreq: 80000 Hz Clock: 135.000 MHz
  1152x870@75Hz 192:145 HorFreq: 67500 Hz Clock: 108.000 MHz
Standard timings supported:
  1440x900@60Hz 16:10 HorFreq: 55500 Hz Clock: 88.750 MHz
  1152x864@75Hz 4:3 HorFreq: 67500 Hz Clock: 108.000 MHz
  1280x1024@60Hz 5:4 HorFreq: 64000 Hz Clock: 108.000 MHz
  1440x900@75Hz 16:10 HorFreq: 82300 Hz Clock: 156.000 MHz
  1280x800@60Hz 16:10
Detailed mode: Clock 106.500 MHz, 370 mm x 230 mm
               1440 1520 1672 1904 hborder 0
                900  903  909  934 vborder 0
               -hsync +vsync 
               VertFreq: 59 Hz, HorFreq: 55934 Hz
Serial number: --
Monitor ranges (GTF): 56-75Hz V, 30-83kHz H, max dotclock 140MHz
Monitor name: DELL E1709W
Has 1 extension blocks
Checksum: 0x6d (valid)

CTA extension block
Extension version: 3
23 bytes of CTA data
  Audio data block
    Linear PCM, max channels 2
      Supported sample rates (kHz): 48 44.1 32
      Supported sample sizes (bits): 24 20 16
  Speaker allocation data block
    Speaker map:
      FL/FR - Front Left/Right
  Vendor-specific data block, OUI 000c03 (HDMI)
    Source physical address 2.0.0.0
    Supports_AI
    Maximum TMDS clock: 225MHz
  Video data block
    VIC  16 1920x1080@60Hz 16:9 (native) HorFreq: 67500 Hz Clock: 148.500 MHz
    VIC   4 1280x720@60Hz 16:9 (native) HorFreq: 45000 Hz Clock: 74.250 MHz
    VIC   2 720x480@60Hz 4:3  HorFreq: 31469 Hz Clock: 27.000 MHz
  Extended tag: Video capability data block
    YCbCr quantization: No Data (0)
    RGB quantization: No Data (0)
    PT scan behaviour: No Data (0)
    IT scan behaviour: Support both over- and underscan (3)
    CE scan behaviour: Support both over- and underscan (3)
Basic audio support
Supports YCbCr 4:4:4
1 native detailed modes
Detailed mode: Clock 27.000 MHz, 160 mm x 90 mm
                720  736  798  858 hborder 0
                480  489  495  525 vborder 0
               -hsync -vsync analog composite 
               VertFreq: 59 Hz, HorFreq: 31468 Hz
Checksum: 0x29 (valid)

One or more of the timings is out of range of the Monitor Ranges:
  Vertical Freq: 56 - 75 Hz
  Horizontal Freq: 31468 - 82300 Hz
  Maximum Clock: 156.000 MHz
EDID block does not conform at all!
	Both the serial number and the serial string are set


