
EDID (hex):
00ffffffffffff0030aec92401010101
1e100104a5211b78a04325a458479e24
135054bdcf0081800101010101010101
010101010101302a009851002a403070
1300510e11000018000000fd00374c1e
530e000a202020202020000000fc004c
454e204c3137310a20202020000000ff
00563638353731340a202020202000f3

Extracted contents:
header:          00 ff ff ff ff ff ff 00
serial number:   30 ae c9 24 01 01 01 01 1e 10
version:         01 04
basic params:    a5 21 1b 78 a0
chroma info:     43 25 a4 58 47 9e 24 13 50 54
established:     bd cf 00
standard:        81 80 01 01 01 01 01 01 01 01 01 01 01 01 01 01
descriptor 1:    30 2a 00 98 51 00 2a 40 30 70 13 00 51 0e 11 00 00 18
descriptor 2:    00 00 00 fd 00 37 4c 1e 53 0e 00 0a 20 20 20 20 20 20
descriptor 3:    00 00 00 fc 00 4c 45 4e 20 4c 31 37 31 0a 20 20 20 20
descriptor 4:    00 00 00 ff 00 56 36 38 35 37 31 34 0a 20 20 20 20 20
extensions:      00
checksum:        f3

EDID version: 1.4
Manufacturer: LEN Model 24c9 Serial Number --
Made in week 30 of 2006
Digital display
8 bits per primary color channel
DisplayPort interface
Maximum image size: 33 cm x 27 cm
Gamma: 2.20
DPMS levels: Standby Off
Supported color formats: RGB 4:4:4
Display x,y Chromaticity:
  Red:   0.6416, 0.3437
  Green: 0.2773, 0.6201
  Blue:  0.1406, 0.0761
  White: 0.3134, 0.3291
Established timings supported:
  720x400@70Hz 9:5 HorFreq: 31469 Hz Clock: 28.320 MHz
  640x480@60Hz 4:3 HorFreq: 31469 Hz Clock: 25.175 MHz
  640x480@67Hz 4:3 HorFreq: 35000 Hz Clock: 30.240 MHz
  640x480@72Hz 4:3 HorFreq: 37900 Hz Clock: 31.500 MHz
  640x480@75Hz 4:3 HorFreq: 37500 Hz Clock: 31.500 MHz
  800x600@60Hz 4:3 HorFreq: 37900 Hz Clock: 40.000 MHz
  800x600@72Hz 4:3 HorFreq: 48100 Hz Clock: 50.000 MHz
  800x600@75Hz 4:3 HorFreq: 46900 Hz Clock: 49.500 MHz
  1024x768@60Hz 4:3 HorFreq: 48400 Hz Clock: 65.000 MHz
  1024x768@70Hz 4:3 HorFreq: 56500 Hz Clock: 75.000 MHz
  1024x768@75Hz 4:3 HorFreq: 60000 Hz Clock: 78.750 MHz
  1280x1024@75Hz 5:4 HorFreq: 80000 Hz Clock: 135.000 MHz
Standard timings supported:
  1280x1024@60Hz 5:4 HorFreq: 64000 Hz Clock: 108.000 MHz
Detailed mode: Clock 108.000 MHz, 337 mm x 270 mm
               1280 1328 1440 1688 hborder 0
               1024 1025 1028 1066 vborder 0
               -hsync -vsync 
               VertFreq: 60 Hz, HorFreq: 63981 Hz
Monitor ranges (GTF): 55-76Hz V, 30-83kHz H, max dotclock 140MHz
Monitor name: LEN L171
Serial number: --
Checksum: 0xf3 (valid)
