edid-decode (hex):

00 ff ff ff ff ff ff 00 34 a9 12 40 24 c1 0c 10
1e 0b 01 03 80 00 00 78 0a 2f cd a3 54 45 97 24
11 46 47 00 00 00 01 01 01 01 01 01 01 01 01 01
01 01 01 01 01 01 02 3a 80 18 71 38 2d 40 58 2c
45 00 10 09 00 00 00 1e 8c 0a d0 8a 20 e0 2d 10
10 3e 96 00 10 09 00 00 00 18 00 00 00 fc 00 31
30 53 50 5f 41 4d 50 0a 20 20 20 20 00 00 00 fd
00 17 3f 0f 45 0f 00 0a 20 20 20 20 20 20 01 92

02 03 1f 70 49 10 03 20 04 02 05 06 07 01 26 09
07 07 15 07 50 83 01 00 00 65 03 0c 00 21 00 01
1d 80 3e 73 38 2d 40 7e 2c 45 80 10 09 00 00 00
1e 00 00 00 00 00 00 00 00 00 00 00 00 00 00 00
00 00 00 00 00 00 00 00 00 00 00 00 00 00 00 00
00 00 00 00 00 00 00 00 00 00 00 00 00 00 00 00
00 00 00 00 00 00 00 00 00 00 00 00 00 00 00 00
00 00 00 00 00 00 00 00 00 00 00 00 00 00 00 7b

00 ff ff ff ff ff ff 00 34 a9 12 40 24 c1 0c 10
1e 0b 01 03 80 00 00 78 0a 2f cd a3 54 45 97 24
11 46 47 00 00 00 01 01 01 01 01 01 01 01 01 01
01 01 01 01 01 01 02 3a 80 18 71 38 2d 40 58 2c
45 00 10 09 00 00 00 1e 8c 0a d0 8a 20 e0 2d 10
10 3e 96 00 10 09 00 00 00 18 00 00 00 fc 00 31
30 53 50 5f 41 4d 50 0a 20 20 20 20 00 00 00 fd
00 17 3f 0f 45 0f 00 0a 20 20 20 20 20 20 01 92

02 03 1f 70 49 10 03 20 04 02 05 06 07 01 26 09
07 07 15 07 50 83 01 00 00 65 03 0c 00 21 00 01
1d 80 3e 73 38 2d 40 7e 2c 45 80 10 09 00 00 00
1e 00 00 00 00 00 00 00 00 00 00 00 00 00 00 00
00 00 00 00 00 00 00 00 00 00 00 00 00 00 00 00
00 00 00 00 00 00 00 00 00 00 00 00 00 00 00 00
00 00 00 00 00 00 00 00 00 00 00 00 00 00 00 00
00 00 00 00 00 00 00 00 00 00 00 00 00 00 00 7b

----------------

Block 0, Base EDID:
  EDID Structure Version & Revision: 1.3
  Vendor & Product Identification:
    Manufacturer: MEI
    Model: 16402
    Serial Number: ...
    Made in: week 30 of 2001
  Basic Display Parameters & Features:
    Digital display
    Image size is variable
    Gamma: 2.20
    RGB color display
    First detailed timing is the preferred timing
  Color Characteristics:
    Red  : 0.6367, 0.3300
    Green: 0.2724, 0.5927
    Blue : 0.1435, 0.0664
    White: 0.2763, 0.2783
  Established Timings I & II: none
  Standard Timings: none
  Detailed Timing Descriptors:
    DTD 1:  1920x1080   60.000000 Hz  16:9     67.500 kHz    148.500000 MHz (16 mm x 9 mm)
                 Hfront   88 Hsync  44 Hback  148 Hpol P
                 Vfront    4 Vsync   5 Vback   36 Vpol P
    DTD 2:   720x480    59.940060 Hz   3:2     31.469 kHz     27.000000 MHz (16 mm x 9 mm)
                 Hfront   16 Hsync  62 Hback   60 Hpol N
                 Vfront    9 Vsync   6 Vback   30 Vpol N
    Display Product Name: '10SP_AMP'
    Display Range Limits:
      Monitor ranges (GTF): 23-63 Hz V, 15-69 kHz H, max dotclock 150 MHz
  Extension blocks: 1
Checksum: 0x92

----------------

Block 1, CTA-861 Extension Block:
  Revision: 3
  Basic audio support
  Supports YCbCr 4:4:4
  Supports YCbCr 4:2:2
  Native detailed modes: 0
  Video Data Block:
    VIC  16:  1920x1080   60.000000 Hz  16:9     67.500 kHz    148.500000 MHz
    VIC   3:   720x480    59.940060 Hz  16:9     31.469 kHz     27.000000 MHz
    VIC  32:  1920x1080   24.000000 Hz  16:9     27.000 kHz     74.250000 MHz
    VIC   4:  1280x720    60.000000 Hz  16:9     45.000 kHz     74.250000 MHz
    VIC   2:   720x480    59.940060 Hz   4:3     31.469 kHz     27.000000 MHz
    VIC   5:  1920x1080i  60.000000 Hz  16:9     33.750 kHz     74.250000 MHz
    VIC   6:  1440x480i   59.940060 Hz   4:3     15.734 kHz     27.000000 MHz
    VIC   7:  1440x480i   59.940060 Hz  16:9     15.734 kHz     27.000000 MHz
    VIC   1:   640x480    59.940476 Hz   4:3     31.469 kHz     25.175000 MHz
  Audio Data Block:
    Linear PCM:
      Max channels: 2
      Supported sample rates (kHz): 48 44.1 32
      Supported sample sizes (bits): 24 20 16
    AC-3:
      Max channels: 6
      Supported sample rates (kHz): 48 44.1 32
      Maximum bit rate: 640 kb/s
  Speaker Allocation Data Block:
    FL/FR - Front Left/Right
  Vendor-Specific Data Block (HDMI), OUI 00-0C-03:
    Source physical address: 2.1.0.0
  Detailed Timing Descriptors:
    DTD 3:  1920x1080   24.000000 Hz  16:9     27.000 kHz     74.250000 MHz (16 mm x 9 mm)
                 Hfront  638 Hsync  44 Hback  148 Hpol P
                 Vfront    4 Vsync   5 Vback   36 Vpol P
Checksum: 0x7b  Unused space in Extension Block: 78 bytes

----------------

Block 2, Unknown EDID Extension Block 0x00:
  00 ff ff ff ff ff ff 00 34 a9 12 40 24 c1 0c 10 '........4..@$...'
  1e 0b 01 03 80 00 00 78 0a 2f cd a3 54 45 97 24 '.......x./..TE.$'
  11 46 47 00 00 00 01 01 01 01 01 01 01 01 01 01 '.FG.............'
  01 01 01 01 01 01 02 3a 80 18 71 38 2d 40 58 2c '.......:..q8-@X,'
  45 00 10 09 00 00 00 1e 8c 0a d0 8a 20 e0 2d 10 'E........... .-.'
  10 3e 96 00 10 09 00 00 00 18 00 00 00 fc 00 31 '.>.............1'
  30 53 50 5f 41 4d 50 0a 20 20 20 20 00 00 00 fd '0SP_AMP.    ....'
  00 17 3f 0f 45 0f 00 0a 20 20 20 20 20 20 01 92 '..?.E...      ..'
Checksum: 0x92

----------------

Block 3, CTA-861 Extension Block:
  Revision: 3
  Basic audio support
  Supports YCbCr 4:4:4
  Supports YCbCr 4:2:2
  Native detailed modes: 0
  Video Data Block:
    VIC  16:  1920x1080   60.000000 Hz  16:9     67.500 kHz    148.500000 MHz
    VIC   3:   720x480    59.940060 Hz  16:9     31.469 kHz     27.000000 MHz
    VIC  32:  1920x1080   24.000000 Hz  16:9     27.000 kHz     74.250000 MHz
    VIC   4:  1280x720    60.000000 Hz  16:9     45.000 kHz     74.250000 MHz
    VIC   2:   720x480    59.940060 Hz   4:3     31.469 kHz     27.000000 MHz
    VIC   5:  1920x1080i  60.000000 Hz  16:9     33.750 kHz     74.250000 MHz
    VIC   6:  1440x480i   59.940060 Hz   4:3     15.734 kHz     27.000000 MHz
    VIC   7:  1440x480i   59.940060 Hz  16:9     15.734 kHz     27.000000 MHz
    VIC   1:   640x480    59.940476 Hz   4:3     31.469 kHz     25.175000 MHz
  Audio Data Block:
    Linear PCM:
      Max channels: 2
      Supported sample rates (kHz): 48 44.1 32
      Supported sample sizes (bits): 24 20 16
    AC-3:
      Max channels: 6
      Supported sample rates (kHz): 48 44.1 32
      Maximum bit rate: 640 kb/s
  Speaker Allocation Data Block:
    FL/FR - Front Left/Right
  Vendor-Specific Data Block (HDMI), OUI 00-0C-03:
    Source physical address: 2.1.0.0
  Detailed Timing Descriptors:
    DTD 4:  1920x1080   24.000000 Hz  16:9     27.000 kHz     74.250000 MHz (16 mm x 9 mm)
                 Hfront  638 Hsync  44 Hback  148 Hpol P
                 Vfront    4 Vsync   5 Vback   36 Vpol P
Checksum: 0x7b  Unused space in Extension Block: 78 bytes

----------------

Warnings:

Block 1, CTA-861 Extension Block:
  IT Video Formats are overscanned by default, but normally this should be underscanned.
  Video Data Block: For improved preferred timing interoperability, set 'Native detailed modes' to 1.
  Add a Colorimetry Data Block with the sRGB colorimetry bit set to avoid interop issues.
Block 3, CTA-861 Extension Block:
  IT Video Formats are overscanned by default, but normally this should be underscanned.
  Add a Colorimetry Data Block with the sRGB colorimetry bit set to avoid interop issues.

Failures:

Block 1, CTA-861 Extension Block:
  Missing VCDB, needed for Set Selectable RGB Quantization to avoid interop issues.
Block 2, Base EDID:
  Unknown Extension Block.
Block 3, CTA-861 Extension Block:
  Video Data Block: Duplicate VIC 16.
  Video Data Block: Duplicate VIC 3.
  Video Data Block: Duplicate VIC 32.
  Video Data Block: Duplicate VIC 4.
  Video Data Block: Duplicate VIC 2.
  Video Data Block: Duplicate VIC 5.
  Video Data Block: Duplicate VIC 6.
  Video Data Block: Duplicate VIC 7.
  Video Data Block: Duplicate VIC 1.
  Speaker Allocation Data Block: Only one instance of this Data Block is allowed.
  Missing VCDB, needed for Set Selectable RGB Quantization to avoid interop issues.
EDID:
  Base EDID: The DTD max image size is 16x9mm, but the display size is not specified anywhere.
  Base EDID: EDID specified 1 extension block(s), but found 3 extension block(s).
  Base EDID: EDID 1.3 requires a Block Map Extension in Block 1 if there are more than 2 blocks in the EDID.

EDID conformity: FAIL
