
EDID (hex):
00ffffffffffff0022f0752901010101
0916010368331d782a77c5a3544f9f27
115054a1080081c0814081809500a940
b300d1c00101023a801871382d40582c
4500fd1e1100001e000000fd00324c18
5e14000a202020202020000000fc0048
502078323330310a20202020000000ff
0033434d323039303056460a2020007d

Extracted contents:
header:          00 ff ff ff ff ff ff 00
serial number:   22 f0 75 29 01 01 01 01 09 16
version:         01 03
basic params:    68 33 1d 78 2a
chroma info:     77 c5 a3 54 4f 9f 27 11 50 54
established:     a1 08 00
standard:        81 c0 81 40 81 80 95 00 a9 40 b3 00 d1 c0 01 01
descriptor 1:    02 3a 80 18 71 38 2d 40 58 2c 45 00 fd 1e 11 00 00 1e
descriptor 2:    00 00 00 fd 00 32 4c 18 5e 14 00 0a 20 20 20 20 20 20
descriptor 3:    00 00 00 fc 00 48 50 20 78 32 33 30 31 0a 20 20 20 20
descriptor 4:    00 00 00 ff 00 33 43 4d 32 30 39 30 30 56 46 0a 20 20
extensions:      00
checksum:        7d

EDID version: 1.3
Manufacturer: HWP Model 2975 Serial Number --
Made in week 9 of 2012
Analog display, Input voltage level: 0.7/0.7 V
Sync: Separate 
Maximum image size: 51 cm x 29 cm
Gamma: 2.20
DPMS levels: Off
RGB color display
First detailed timing is preferred timing
Display x,y Chromaticity:
  Red:   0.6376, 0.3310
  Green: 0.3095, 0.6240
  Blue:  0.1552, 0.0664
  White: 0.3134, 0.3291
Established timings supported:
  720x400@70Hz 9:5 HorFreq: 31469 Hz Clock: 28.320 MHz
  640x480@60Hz 4:3 HorFreq: 31469 Hz Clock: 25.175 MHz
  800x600@60Hz 4:3 HorFreq: 37900 Hz Clock: 40.000 MHz
  1024x768@60Hz 4:3 HorFreq: 48400 Hz Clock: 65.000 MHz
Standard timings supported:
  1280x720@60Hz 16:9
  1280x960@60Hz 4:3 HorFreq: 60000 Hz Clock: 108.000 MHz
  1280x1024@60Hz 5:4 HorFreq: 64000 Hz Clock: 108.000 MHz
  1440x900@60Hz 16:10 HorFreq: 55500 Hz Clock: 88.750 MHz
  1600x1200@60Hz 4:3 HorFreq: 75000 Hz Clock: 162.000 MHz
  1680x1050@60Hz 16:10 HorFreq: 64700 Hz Clock: 119.000 MHz
  1920x1080@60Hz 16:9
Detailed mode: Clock 148.500 MHz, 509 mm x 286 mm
               1920 2008 2052 2200 hborder 0
               1080 1084 1089 1125 vborder 0
               +hsync +vsync 
               VertFreq: 60 Hz, HorFreq: 67500 Hz
Monitor ranges (GTF): 50-76Hz V, 24-94kHz H, max dotclock 200MHz
Monitor name: HP x2301
Serial number: --
Checksum: 0x7d (valid)
