
EDID (hex):
00ffffffffffff000e6f051300000000
141e0104a51d127803a2aca7534b9c24
0d4f5300000001010101010101010101
010101010101ef6800a0a0402e603020
36001eb310000018000000fd00283c63
631b010a202020202020000000fe0043
534f542054330a2020202020000000fe
004d4e443330374441312d340a2000a8

Extracted contents:
header:          00 ff ff ff ff ff ff 00
serial number:   0e 6f 05 13 00 00 00 00 14 1e
version:         01 04
basic params:    a5 1d 12 78 03
chroma info:     a2 ac a7 53 4b 9c 24 0d 4f 53
established:     00 00 00
standard:        01 01 01 01 01 01 01 01 01 01 01 01 01 01 01 01
descriptor 1:    ef 68 00 a0 a0 40 2e 60 30 20 36 00 1e b3 10 00 00 18
descriptor 2:    00 00 00 fd 00 28 3c 63 63 1b 01 0a 20 20 20 20 20 20
descriptor 3:    00 00 00 fe 00 43 53 4f 54 20 54 33 0a 20 20 20 20 20
descriptor 4:    00 00 00 fe 00 4d 4e 44 33 30 37 44 41 31 2d 34 0a 20
extensions:      00
checksum:        a8

EDID version: 1.4
Manufacturer: CSO Model 1305 Serial Number --
Made in week 20 of 2020
Digital display
8 bits per primary color channel
DisplayPort interface
Maximum image size: 29 cm x 18 cm
Gamma: 2.20
Supported color formats: RGB 4:4:4
First detailed timing includes the native pixel format and preferred refresh rate
Display is continuous frequency
Display x,y Chromaticity:
  Red:   0.6542, 0.3261
  Green: 0.2929, 0.6113
  Blue:  0.1425, 0.0527
  White: 0.3115, 0.3242
Established timings supported:
Standard timings supported:
Detailed mode: Clock 268.630 MHz, 286 mm x 179 mm
               2560 2608 2640 2720 hborder 0
               1600 1603 1609 1646 vborder 0
               -hsync -vsync 
               VertFreq: 60 Hz, HorFreq: 98761 Hz
Monitor ranges (bare limits): 40-60Hz V, 99-99kHz H, max dotclock 270MHz
ASCII string: CSOT T3
ASCII string: MND307DA1-4
Checksum: 0xa8 (valid)
EDID block does NOT conform to EDID 1.4!
	Missing name descriptor
Warning: One or more of the timings is out of range of the Monitor Ranges:
  Vertical Freq: 60 - 60 Hz
  Horizontal Freq: 98761 - 98761 Hz
  Maximum Clock: 268.630 MHz
