edid-decode (hex):

00 ff ff ff ff ff ff 00 1e 6d be 58 3f e4 02 00
09 16 01 03 a0 30 1b 78 ba 95 35 a1 59 57 9f 27
0e 50 54 a5 4b 00 71 4f 81 80 95 00 a9 c0 81 00
81 c0 90 40 b3 00 02 3a 80 18 71 38 2d 40 58 2c
45 00 dd 0c 11 00 00 1e 00 00 00 fd 00 38 4b 1e
53 0f 00 0a 20 20 20 20 20 20 00 00 00 fc 00 45
32 32 34 32 0a 20 20 20 20 20 20 20 00 00 00 ff
00 32 30 39 4e 44 56 57 35 4b 35 30 33 0a 01 f3

02 03 1b 71 23 09 07 07 83 01 00 00 67 03 0c 00
10 00 80 21 43 01 10 84 e2 00 0f 01 1d 00 72 51
d0 1e 20 6e 28 55 00 81 49 00 00 00 1e 00 00 00
10 00 00 00 00 00 00 00 00 00 00 00 00 00 00 00
00 00 10 00 00 00 00 00 00 00 00 00 00 00 00 00
00 00 00 00 10 00 00 00 00 00 00 00 00 00 00 00
00 00 00 00 00 00 10 00 00 00 00 00 00 00 00 00
00 00 00 00 00 00 00 00 00 00 00 00 00 00 00 bf

----------------

Block 0, Base EDID:
  EDID Structure Version & Revision: 1.3
  Vendor & Product Identification:
    Manufacturer: GSM
    Model: 22718
    Serial Number: ...
    Made in: week 9 of 2012
  Basic Display Parameters & Features:
    Digital display
    Maximum image size: 48 cm x 27 cm
    Gamma: 2.20
    DPMS levels: Standby Off
    Undefined display color type
    First detailed timing is preferred timing
  Color Characteristics:
    Red  : 0.6308, 0.3486
    Green: 0.3408, 0.6220
    Blue : 0.1523, 0.0576
    White: 0.3134, 0.3291
  Established Timings I & II:
    IBM     :   720x400    70.082 Hz   9:5    31.467 kHz  28.320 MHz
    DMT 0x04:   640x480    59.940 Hz   4:3    31.469 kHz  25.175 MHz
    DMT 0x06:   640x480    75.000 Hz   4:3    37.500 kHz  31.500 MHz
    DMT 0x09:   800x600    60.317 Hz   4:3    37.879 kHz  40.000 MHz
    DMT 0x0b:   800x600    75.000 Hz   4:3    46.875 kHz  49.500 MHz
    DMT 0x10:  1024x768    60.004 Hz   4:3    48.363 kHz  65.000 MHz
    DMT 0x12:  1024x768    75.029 Hz   4:3    60.023 kHz  78.750 MHz
    DMT 0x24:  1280x1024   75.025 Hz   5:4    79.976 kHz 135.000 MHz
  Standard Timings:
    DMT 0x15:  1152x864    75.000 Hz   4:3    67.500 kHz 108.000 MHz
    DMT 0x23:  1280x1024   60.020 Hz   5:4    63.981 kHz 108.000 MHz
    DMT 0x2f:  1440x900    59.887 Hz  16:10   55.935 kHz 106.500 MHz
    DMT 0x53:  1600x900    60.000 Hz  16:9    60.000 kHz 108.000 MHz (RB)
    DMT 0x1c:  1280x800    59.810 Hz  16:10   49.702 kHz  83.500 MHz
    DMT 0x55:  1280x720    60.000 Hz  16:9    45.000 kHz  74.250 MHz
    DMT 0x2a:  1400x1050   59.978 Hz   4:3    65.317 kHz 121.750 MHz
    DMT 0x3a:  1680x1050   59.954 Hz  16:10   65.290 kHz 146.250 MHz
  Detailed Timing Descriptors:
    DTD 1:  1920x1080   60.000 Hz  16:9    67.500 kHz 148.500 MHz (477 mm x 268 mm)
                 Hfront   88 Hsync  44 Hback 148 Hpol P
                 Vfront    4 Vsync   5 Vback  36 Vpol P
  Display Range Limits:
    Monitor ranges (GTF): 56-75 Hz V, 30-83 kHz H, max dotclock 150 MHz
    Display Product Name: 'E2242'
    Display Product Serial Number: ...
  Extension blocks: 1
Checksum: 0xf3

----------------

Block 1, CTA-861 Extension Block:
  Revision: 3
  Basic audio support
  Supports YCbCr 4:4:4
  Supports YCbCr 4:2:2
  Native detailed modes: 1
  Audio Data Block:
    Linear PCM:
      Max channels: 2
      Supported sample rates (kHz): 48 44.1 32
      Supported sample sizes (bits): 24 20 16
  Speaker Allocation Data Block:
    FL/FR - Front Left/Right
  Vendor-Specific Data Block (HDMI), OUI 00-0C-03:
    Source physical address: 1.0.0.0
    Supports_AI
    Maximum TMDS clock: 165 MHz
  Video Data Block:
    VIC   1:   640x480    59.940 Hz   4:3    31.469 kHz  25.175 MHz
    VIC  16:  1920x1080   60.000 Hz  16:9    67.500 kHz 148.500 MHz
    VIC   4:  1280x720    60.000 Hz  16:9    45.000 kHz  74.250 MHz (native)
  Video Capability Data Block:
    YCbCr quantization: No Data
    RGB quantization: No Data
    PT scan behavior: No Data
    IT scan behavior: IT video formats not supported
    CE scan behavior: Supports both over- and underscan
  Detailed Timing Descriptors:
    DTD 2:  1280x720    60.000 Hz  16:9    45.000 kHz  74.250 MHz (129 mm x 73 mm)
                 Hfront  110 Hsync  40 Hback 220 Hpol P
                 Vfront    5 Vsync   5 Vback  20 Vpol P
    Dummy Descriptor:
    Dummy Descriptor:
    Dummy Descriptor:
    Dummy Descriptor:
Checksum: 0xbf

----------------

Warnings:

Block 1, CTA-861 Extension Block:
  Video Capability Data Block: Set Selectable RGB Quantization to avoid interop issues.
  Display Product Serial Number is set, so the Serial Number in the Base EDID should be 0.

Failures:

Block 0, Base EDID:
  Basic Display Parameters & Features: Digital Video Interface Standard set to reserved value 0x20.
Block 1, CTA-861 Extension Block:
  Detailed Timing Descriptor #2: Mismatch of image size 129x73 mm vs display size 480x270 mm.

EDID conformity: FAIL
