
EDID (hex):
00ffffffffffff0009e5150700000000
311a010495190e7802e990955c589429
24505400000001010101010101010101
010101010101381d56c850001c303020
360000901000001a7a1356c850001c30
6464440500901000001a000000000000
00000000000000000000000000000002
000f47f90b3c6e0c0b136e0000000020

Extracted contents:
header:          00 ff ff ff ff ff ff 00
serial number:   09 e5 15 07 00 00 00 00 31 1a
version:         01 04
basic params:    95 19 0e 78 02
chroma info:     e9 90 95 5c 58 94 29 24 50 54
established:     00 00 00
standard:        01 01 01 01 01 01 01 01 01 01 01 01 01 01 01 01
descriptor 1:    38 1d 56 c8 50 00 1c 30 30 20 36 00 00 90 10 00 00 1a
descriptor 2:    7a 13 56 c8 50 00 1c 30 64 64 44 05 00 90 10 00 00 1a
descriptor 3:    00 00 00 00 00 00 00 00 00 00 00 00 00 00 00 00 00 00
descriptor 4:    00 00 00 02 00 0f 47 f9 0b 3c 6e 0c 0b 13 6e 00 00 00
extensions:      00
checksum:        20

EDID version: 1.4
Manufacturer: BOE Model 715 Serial Number --
Made in week 49 of 2016
Digital display
6 bits per primary color channel
DisplayPort interface
Maximum image size: 25 cm x 14 cm
Gamma: 2.20
Supported color formats: RGB 4:4:4
First detailed timing includes the native pixel format and preferred refresh rate
Display x,y Chromaticity:
  Red:   0.5849, 0.3613
  Green: 0.3457, 0.5791
  Blue:  0.1621, 0.1416
  White: 0.3125, 0.3281
Established timings supported:
Standard timings supported:
Detailed mode: Clock 74.800 MHz, 256 mm x 144 mm
               1366 1414 1446 1566 hborder 0
                768  771  777  796 vborder 0
               +hsync -vsync 
               VertFreq: 60 Hz, HorFreq: 47765 Hz
Detailed mode: Clock 49.860 MHz, 256 mm x 144 mm
               1366 1466 1566 1566 hborder 0
                768  788  808  796 vborder 0
               +hsync -vsync 
               VertFreq: 39 Hz, HorFreq: 31839 Hz
Manufacturer-specified data, tag 0
Manufacturer-specified data, tag 2
Checksum: 0x20 (valid)
EDID block does NOT conform to EDID 1.4!
	Missing name descriptor
	Missing monitor ranges


