edid-decode (hex):

00 ff ff ff ff ff ff 00 4d 10 1b 14 00 00 00 00
03 18 01 04 a5 1d 11 78 06 de 54 a3 54 4c 99 26
0f 50 54 00 00 00 01 01 01 01 01 01 01 01 01 01
01 01 01 01 01 01 b0 36 80 9a 70 38 2d 40 0a 0a
55 00 26 a5 10 00 00 18 00 00 00 10 00 00 00 00
00 00 00 00 00 00 00 00 00 00 00 00 00 fe 00 42
4f 45 5f 42 34 0a 20 20 20 20 20 20 00 00 00 fe
00 31 34 22 20 49 50 53 0a 20 20 20 20 20 00 e3

----------------

Block 0, Base EDID:
  EDID Structure Version & Revision: 1.4
  Vendor & Product Identification:
    Manufacturer: SHP
    Model: 5147
    Made in: week 3 of 2014
  Basic Display Parameters & Features:
    Digital display
    Bits per primary color channel: 8
    DisplayPort interface
    Maximum image size: 29 cm x 17 cm
    Gamma: 2.20
    Supported color formats: RGB 4:4:4
    Default (sRGB) color space is primary color space
    First detailed timing includes the native pixel format and preferred refresh rate
  Color Characteristics:
    Red  : 0.6396, 0.3291
    Green: 0.2998, 0.5996
    Blue : 0.1494, 0.0595
    White: 0.3134, 0.3281
  Established Timings I & II: none
  Standard Timings: none
  Detailed Timing Descriptors:
    DTD 1:  1920x1080   60.002 Hz  16:9    67.502 kHz 140.000 MHz (294 mm x 165 mm)
                 Hfront   10 Hsync  10 Hback 134 Hpol N
                 Vfront    5 Vsync   5 Vback  35 Vpol N
    Dummy Descriptor:
    Alphanumeric Data String: 'BOE_B4'
    Alphanumeric Data String: '14" IPS'
Checksum: 0xe3

----------------

Failures:

Block 0, Base EDID:
  Basic Display Parameters & Features: sRGB is signaled, but the chromaticities do not match.
  Missing Display Product Name.

EDID conformity: FAIL
