
EDID (hex):
00ffffffffffff004d101b1400000000
03180104a51d117806de50a3544c9926
0f505400000001010101010101010101
010101010101ad36806470384c400a0a
050026a510000018c82b806470384c40
0a0a050026a510000018000000100000
000000000000000000000000000000fc
004c513133334d314a5730310a20000e

Extracted contents:
header:          00 ff ff ff ff ff ff 00
serial number:   4d 10 1b 14 00 00 00 00 03 18
version:         01 04
basic params:    a5 1d 11 78 06
chroma info:     de 50 a3 54 4c 99 26 0f 50 54
established:     00 00 00
standard:        01 01 01 01 01 01 01 01 01 01 01 01 01 01 01 01
descriptor 1:    ad 36 80 64 70 38 4c 40 0a 0a 05 00 26 a5 10 00 00 18
descriptor 2:    c8 2b 80 64 70 38 4c 40 0a 0a 05 00 26 a5 10 00 00 18
descriptor 3:    00 00 00 10 00 00 00 00 00 00 00 00 00 00 00 00 00 00
descriptor 4:    00 00 00 fc 00 4c 51 31 33 33 4d 31 4a 57 30 31 0a 20
extensions:      00
checksum:        0e

EDID version: 1.4
Manufacturer: SHP Model 141b Serial Number --
Made in week 3 of 2014
Digital display
8 bits per primary color channel
DisplayPort interface
Maximum image size: 29 cm x 17 cm
Gamma: 2.20
Supported color formats: RGB 4:4:4
Default (sRGB) color space is primary color space
First detailed timing includes the native pixel format and preferred refresh rate
Display x,y Chromaticity:
  Red:   0.6396, 0.3291
  Green: 0.2998, 0.5996
  Blue:  0.1494, 0.0595
  White: 0.3125, 0.3281
Established timings supported:
Standard timings supported:
Detailed mode: Clock 139.970 MHz, 294 mm x 165 mm
               1920 1930 1940 2020 hborder 0
               1080 1080 1085 1156 vborder 0
               -hsync -vsync 
               VertFreq: 59 Hz, HorFreq: 69292 Hz
Detailed mode: Clock 112.080 MHz, 294 mm x 165 mm
               1920 1930 1940 2020 hborder 0
               1080 1080 1085 1156 vborder 0
               -hsync -vsync 
               VertFreq: 47 Hz, HorFreq: 55485 Hz
Dummy block
Monitor name: LQ133M1JW01
Checksum: 0xe (valid)
EDID block does NOT conform to EDID 1.4!
	sRGB is signaled, but the chromaticities do not match
	Missing monitor ranges
