edid-decode (hex):

00 ff ff ff ff ff ff 00 30 e4 32 02 00 00 00 00
00 13 01 03 80 1a 0e 78 0a bf 45 95 58 52 8a 28
25 50 54 00 00 00 01 01 01 01 01 01 01 01 01 01
01 01 01 01 01 01 12 1b 56 84 50 00 07 30 12 14
13 00 00 90 10 00 00 1b 00 00 00 00 00 00 00 00
00 00 00 00 00 00 00 00 00 00 00 00 00 fe 00 4c
47 20 44 69 73 70 6c 61 79 0a 20 20 00 00 00 fc
00 4c 50 31 31 36 57 48 32 2d 54 4c 43 31 00 1a

----------------

Block 0, Base EDID:
  EDID Structure Version & Revision: 1.3
  Vendor & Product Identification:
    Manufacturer: LGD
    Model: 562
    Made in: 2009
  Basic Display Parameters & Features:
    Digital display
    Maximum image size: 26 cm x 14 cm
    Gamma: 2.20
    RGB color display
    First detailed timing is the preferred timing
  Color Characteristics:
    Red  : 0.5839, 0.3466
    Green: 0.3232, 0.5419
    Blue : 0.1572, 0.1445
    White: 0.3134, 0.3291
  Established Timings I & II: none
  Standard Timings: none
  Detailed Timing Descriptors:
    DTD 1:  1366x768    59.692493 Hz 683:384   46.262 kHz     69.300000 MHz (256 mm x 144 mm)
                 Hfront   18 Hsync  20 Hback   94 Hpol P
                 Vfront    1 Vsync   3 Vback    3 Vpol N
    Empty Descriptor
    Alphanumeric Data String: 'LG Display'
    Display Product Name: 'LP116WH2-TLC1'
Checksum: 0x1a

----------------

Failures:

Block 0, Base EDID:
  Empty Descriptor: Use Dummy Descriptor instead of all zeroes.
  Missing Display Range Limits Descriptor.

EDID conformity: FAIL
