
EDID (hex):
00ffffffffffff001e6d745b0b0c0600
061d0104b53c2278800f91ae5243b026
0f505420000001010101010101010101
01010101010125cc0050f0703e800820
180058542100001aa35b0050a0a02950
0820180058542100001a000000ff0039
30364e544d58424e3239390a000000fc
004c4720556c74726146696e650a02a4
701279030001000c3e17160d0014400b
50784e99290010b8287febabcd4b3996
6a4257a55bb1b303002824cc0084ff0e
4f0007801f006f083d00000007005e8e
00047f0c4f0007801f00070733000000
07000000000000000000000000000000
00000000000000000000000000000000
00000000000000000000000000004f90
701279030012001682100000ff093f0b
000000000047534d745b010101010300
14d0bc0008ff099f0007801f003f0b51
00000007000000000000000000000000
00000000000000000000000000000000
00000000000000000000000000000000
00000000000000000000000000000000
00000000000000000000000000001290

Extracted contents:
header:          00 ff ff ff ff ff ff 00
serial number:   1e 6d 74 5b 0b 0c 06 00 06 1d
version:         01 04
basic params:    b5 3c 22 78 80
chroma info:     0f 91 ae 52 43 b0 26 0f 50 54
established:     20 00 00
standard:        01 01 01 01 01 01 01 01 01 01 01 01 01 01 01 01
descriptor 1:    25 cc 00 50 f0 70 3e 80 08 20 18 00 58 54 21 00 00 1a
descriptor 2:    a3 5b 00 50 a0 a0 29 50 08 20 18 00 58 54 21 00 00 1a
descriptor 3:    00 00 00 ff 00 39 30 36 4e 54 4d 58 42 4e 32 39 39 0a
descriptor 4:    00 00 00 fc 00 4c 47 20 55 6c 74 72 61 46 69 6e 65 0a
extensions:      02
checksum:        a4

EDID version: 1.4
Manufacturer: GSM Model 5b74 Serial Number --
Made in week 6 of 2019
Digital display
10 bits per primary color channel
DisplayPort interface
Maximum image size: 60 cm x 34 cm
Gamma: 2.20
DPMS levels: Standby
Supported color formats: RGB 4:4:4
Display x,y Chromaticity:
  Red:   0.6796, 0.3203
  Green: 0.2646, 0.6904
  Blue:  0.1503, 0.0595
  White: 0.3125, 0.3291
Established timings supported:
  640x480@60Hz 4:3 HorFreq: 31469 Hz Clock: 25.175 MHz
Standard timings supported:
Detailed mode: Clock 522.610 MHz, 600 mm x 340 mm
               3840 3848 3880 3920 hborder 0
               2160 2161 2169 2222 vborder 0
               +hsync -vsync 
               VertFreq: 59 Hz, HorFreq: 133318 Hz
Detailed mode: Clock 234.590 MHz, 600 mm x 340 mm
               2560 2568 2600 2640 hborder 0
               1440 1441 1449 1481 vborder 0
               +hsync -vsync 
               VertFreq: 59 Hz, HorFreq: 88859 Hz
Serial number: --
Monitor name: LG UltraFine
Has 2 extension blocks
Checksum: 0xa4 (valid)

DisplayID extension block
Extension version: 18
Length 121, version 18, extension count 0
Checksum: 0x4f (valid)
Display Parameters block
Unknown displayid data block 0x29
Type 1 detailed timing: aspect: 16:9, Preferred  
Detailed mode: Clock 522.600 MHz, 0 mm x 0 mm
               3839 3846 3877 3918
               2159 2159 2166 2220
               +hsync -vsync
Type 1 detailed timing: aspect: 16:9,  
Detailed mode: Clock 364.460 MHz, 0 mm x 0 mm
               3199 3206 3237 3278
               1799 1799 1806 1850
               +hsync -vsync


DisplayID extension block
Extension version: 18
Length 121, version 18, extension count 0
Checksum: 0x12 (valid)
tiled display block: capabilities 0x00000082
num horizontal tiles 2, num vertical tiles 1
tile location (0, 0)
tile dimensions (2560, 2880)
Type 1 detailed timing: aspect: undefined,  
Detailed mode: Clock 483.360 MHz, 0 mm x 0 mm
               2559 2566 2597 2718
               2879 2879 2886 2960
               +hsync -vsync

	Missing monitor ranges
EDID block does not conform at all!
	Has -1207959552 nonconformant extension block(s)
