
EDID (hex):
00ffffffffffff001e6d745be7bc0a00
0a1e0104b53c2278800f91ae5243b026
0f505420000001010101010101010101
01010101010125cc0050f0703e800820
180058542100001aa35b0050a0a02950
0820180058542100001a000000ff0030
31304e544e484c503731390a000000fc
004c4720556c74726146696e650a0223
701279030001000c3e17160d0014400b
50784e99290010930fcbed27ba412d8f
b5f087ab9063de03002824cc0084ff0e
4f0007801f006f083d00000007005e8e
00047f0c4f0007801f00070733000000
07000000000000000000000000000000
00000000000000000000000000000000
0000000000000000000000000000b290
701279030012001682100000ff093f0b
000000000047534d745b010101010300
14d0bc0008ff099f0007801f003f0b51
00000007000000000000000000000000
00000000000000000000000000000000
00000000000000000000000000000000
00000000000000000000000000000000
00000000000000000000000000001290

edid-decode (hex):

00 ff ff ff ff ff ff 00 1e 6d 74 5b e7 bc 0a 00
0a 1e 01 04 b5 3c 22 78 80 0f 91 ae 52 43 b0 26
0f 50 54 20 00 00 01 01 01 01 01 01 01 01 01 01
01 01 01 01 01 01 25 cc 00 50 f0 70 3e 80 08 20
18 00 58 54 21 00 00 1a a3 5b 00 50 a0 a0 29 50
08 20 18 00 58 54 21 00 00 1a 00 00 00 ff 00 30
31 30 4e 54 4e 48 4c 50 37 31 39 0a 00 00 00 fc
00 4c 47 20 55 6c 74 72 61 46 69 6e 65 0a 02 23

70 12 79 03 00 01 00 0c 3e 17 16 0d 00 14 40 0b
50 78 4e 99 29 00 10 93 0f cb ed 27 ba 41 2d 8f
b5 f0 87 ab 90 63 de 03 00 28 24 cc 00 84 ff 0e
4f 00 07 80 1f 00 6f 08 3d 00 00 00 07 00 5e 8e
00 04 7f 0c 4f 00 07 80 1f 00 07 07 33 00 00 00
07 00 00 00 00 00 00 00 00 00 00 00 00 00 00 00
00 00 00 00 00 00 00 00 00 00 00 00 00 00 00 00
00 00 00 00 00 00 00 00 00 00 00 00 00 00 b2 90

70 12 79 03 00 12 00 16 82 10 00 00 ff 09 3f 0b
00 00 00 00 00 47 53 4d 74 5b 01 01 01 01 03 00
14 d0 bc 00 08 ff 09 9f 00 07 80 1f 00 3f 0b 51
00 00 00 07 00 00 00 00 00 00 00 00 00 00 00 00
00 00 00 00 00 00 00 00 00 00 00 00 00 00 00 00
00 00 00 00 00 00 00 00 00 00 00 00 00 00 00 00
00 00 00 00 00 00 00 00 00 00 00 00 00 00 00 00
00 00 00 00 00 00 00 00 00 00 00 00 00 00 12 90

----------------

Block 0, Base EDID:
  EDID Structure Version & Revision: 1.4
  Vendor & Product Identification:
    Manufacturer: GSM
    Model: 23412
    Serial Number: 703719
    Made in: week 10 of 2020
  Basic Display Parameters & Features:
    Digital display
    Bits per primary color channel: 10
    DisplayPort interface
    Maximum image size: 60 cm x 34 cm
    Gamma: 2.20
    DPMS levels: Standby
    Supported color formats: RGB 4:4:4
    First detailed timing does not include the native pixel format and preferred refresh rate
  Color Characteristics:
    Red  : 0.6796, 0.3203
    Green: 0.2646, 0.6904
    Blue : 0.1503, 0.0595
    White: 0.3125, 0.3291
  Established Timings I & II:
    DMT 0x04:   640x480    59.940476 Hz   4:3     31.469 kHz     25.175000 MHz
  Standard Timings: none
  Detailed Timing Descriptors:
    DTD 1:  3840x2160   59.999495 Hz  16:9    133.319 kHz    522.610000 MHz (600 mm x 340 mm)
                 Hfront    8 Hsync  32 Hback   40 Hpol P
                 Vfront    1 Vsync   8 Vback   53 Vpol N
    DTD 2:  2560x1440   59.999898 Hz  16:9     88.860 kHz    234.590000 MHz (600 mm x 340 mm)
                 Hfront    8 Hsync  32 Hback   40 Hpol P
                 Vfront    1 Vsync   8 Vback   32 Vpol N
    Display Product Serial Number: '010NTNHLP719'
    Display Product Name: 'LG UltraFine'
  Extension blocks: 2
Checksum: 0x23

----------------

Block 1, DisplayID Extension Block:
  Version: 1.2
  Extension Count: 0
  Display Product Type: Standalone display device
  Display Parameters Data Block (0x01):
    Image size: 595.0 mm x 335.0 mm
    Display native pixel format: 5120x2880
    Feature support flags:
      Power management (DPM)
      Separate audio inputs provided
    Gamma: 2.20
    Aspect ratio: 1.78
    Dynamic bpc native: 10
    Dynamic bpc overall: 10
  ContainerID Data Block:
    Container ID: 930fcbed-27ba-412d-8fb5-f087ab9063de
  Video Timing Modes Type 1 - Detailed Timings Data Block:
    DTD:  3840x2160   59.999495 Hz  16:9    133.319 kHz    522.610000 MHz (aspect 16:9, no 3D stereo, preferred)
               Hfront    8 Hsync  32 Hback   40 Hpol P
               Vfront    1 Vsync   8 Vback   53 Vpol N
    DTD:  3200x1800   59.999407 Hz  16:9    111.119 kHz    364.470000 MHz (aspect 16:9, no 3D stereo)
               Hfront    8 Hsync  32 Hback   40 Hpol P
               Vfront    1 Vsync   8 Vback   43 Vpol N
  Checksum: 0xb2
Checksum: 0x90

----------------

Block 2, DisplayID Extension Block:
  Version: 1.2
  Extension Count: 0
  Tiled Display Topology Data Block (0x12):
    Capabilities:
      Behavior if it is the only tile: Image is scaled to fit the entire tiled display
      Behavior if more than one tile and fewer than total number of tiles: Undefined
    Tiled display consists of a single physical display enclosure
    Num horizontal tiles: 2 Num vertical tiles: 1
    Tile location: 0, 0
    Tile resolution: 2560x2880
    Tiled Display Manufacturer/Vendor ID: GSM
    Tiled Display Product ID Code: 23412
    Tiled Display Serial Number: 16843009
  Video Timing Modes Type 1 - Detailed Timings Data Block:
    DTD:  2560x2880   59.996475 Hz   0:0    177.710 kHz    483.370000 MHz (aspect undefined, no 3D stereo)
               Hfront    8 Hsync  32 Hback  120 Hpol P
               Vfront    1 Vsync   8 Vback   73 Vpol N
  Checksum: 0x12
Checksum: 0x90


