
EDID (hex):
00ffffffffffff0006afed1200000000
00160104952213780206959757539426
1c505400000001010101010101010101
0101010101013c3780c0703820403064
8e0058c110000018d32480c070382040
30648e0058c110000018000000fe0041
554f0a202020202020202020000000fe
004231353648414e30312e32200a0022

Extracted contents:
header:          00 ff ff ff ff ff ff 00
serial number:   06 af ed 12 00 00 00 00 00 16
version:         01 04
basic params:    95 22 13 78 02
chroma info:     06 95 97 57 53 94 26 1c 50 54
established:     00 00 00
standard:        01 01 01 01 01 01 01 01 01 01 01 01 01 01 01 01
descriptor 1:    3c 37 80 c0 70 38 20 40 30 64 8e 00 58 c1 10 00 00 18
descriptor 2:    d3 24 80 c0 70 38 20 40 30 64 8e 00 58 c1 10 00 00 18
descriptor 3:    00 00 00 fe 00 41 55 4f 0a 20 20 20 20 20 20 20 20 20
descriptor 4:    00 00 00 fe 00 42 31 35 36 48 41 4e 30 31 2e 32 20 0a
extensions:      00
checksum:        22

EDID version: 1.4
Manufacturer: AUO Model 12ed Serial Number --
Made in year 2012
Digital display
6 bits per primary color channel
DisplayPort interface
Maximum image size: 34 cm x 19 cm
Gamma: 2.20
Supported color formats: RGB 4:4:4
First detailed timing includes the native pixel format and preferred refresh rate
Display x,y Chromaticity:
  Red:   0.5898, 0.3398
  Green: 0.3251, 0.5800
  Blue:  0.1503, 0.1103
  White: 0.3134, 0.3291
Established timings supported:
Standard timings supported:
Detailed mode: Clock 141.400 MHz, 344 mm x 193 mm
               1920 1968 2068 2112 hborder 0
               1080 1088 1102 1112 vborder 0
               -hsync -vsync 
               VertFreq: 60 Hz, HorFreq: 66950 Hz
Detailed mode: Clock 94.270 MHz, 344 mm x 193 mm
               1920 1968 2068 2112 hborder 0
               1080 1088 1102 1112 vborder 0
               -hsync -vsync 
               VertFreq: 40 Hz, HorFreq: 44635 Hz
ASCII string: AUO
ASCII string: B156HAN01.2 
Checksum: 0x22 (valid)
EDID block does NOT conform to EDID 1.4!
	Missing name descriptor
	Missing monitor ranges
