
EDID (hex):
00ffffffffffff0012c18d0af7000000
091d0103803c2278ead305a355529e28
0e5054a108008180a940d10001010101
010101010101023a801871382d40582c
450056502100001e000000fc00564d53
20313030303436373834000000fd0032
4b1e5011000a202020202020000000ff
0044545430393143303234370a200039

Extracted contents:
header:          00 ff ff ff ff ff ff 00
serial number:   12 c1 8d 0a f7 00 00 00 09 1d
version:         01 03
basic params:    80 3c 22 78 ea
chroma info:     d3 05 a3 55 52 9e 28 0e 50 54
established:     a1 08 00
standard:        81 80 a9 40 d1 00 01 01 01 01 01 01 01 01 01 01
descriptor 1:    02 3a 80 18 71 38 2d 40 58 2c 45 00 56 50 21 00 00 1e
descriptor 2:    00 00 00 fc 00 56 4d 53 20 31 30 30 30 34 36 37 38 34
descriptor 3:    00 00 00 fd 00 32 4b 1e 50 11 00 0a 20 20 20 20 20 20
descriptor 4:    00 00 00 ff 00 44 54 54 30 39 31 43 30 32 34 37 0a 20
extensions:      00
checksum:        39

EDID version: 1.3
Manufacturer: DVA Model a8d Serial Number --
Made in week 9 of 2019
Digital display
Maximum image size: 60 cm x 34 cm
Gamma: 2.20
DPMS levels: Standby Suspend Off
RGB color display
First detailed timing is preferred timing
Display x,y Chromaticity:
  Red:   0.6396, 0.3330
  Green: 0.3203, 0.6201
  Blue:  0.1562, 0.0546
  White: 0.3134, 0.3291
Established timings supported:
  720x400@70Hz 9:5 HorFreq: 31469 Hz Clock: 28.320 MHz
  640x480@60Hz 4:3 HorFreq: 31469 Hz Clock: 25.175 MHz
  800x600@60Hz 4:3 HorFreq: 37900 Hz Clock: 40.000 MHz
  1024x768@60Hz 4:3 HorFreq: 48400 Hz Clock: 65.000 MHz
Standard timings supported:
  1280x1024@60Hz 5:4 HorFreq: 64000 Hz Clock: 108.000 MHz
  1600x1200@60Hz 4:3 HorFreq: 75000 Hz Clock: 162.000 MHz
  1920x1200@60Hz 16:10 HorFreq: 74000 Hz Clock: 154.000 MHz
Detailed mode: Clock 148.500 MHz, 598 mm x 336 mm
               1920 2008 2052 2200 hborder 0
               1080 1084 1089 1125 vborder 0
               +hsync +vsync 
               VertFreq: 60 Hz, HorFreq: 67500 Hz
Monitor ranges (GTF): 50-75Hz V, 30-80kHz H, max dotclock 170MHz
Serial number: --
Checksum: 0x39 (valid)
EDID block does NOT conform to EDID 1.3!
	Name descriptor not terminated with a newline


