edid-decode (hex):

00 ff ff ff ff ff ff 00 0d af 32 13 00 00 00 00
08 15 01 04 90 1d 10 78 02 98 55 95 59 56 93 28
20 50 54 00 00 00 01 01 01 01 01 01 01 01 01 01
01 01 01 01 01 01 e9 1d 56 d3 50 00 29 30 21 46
4d 00 25 a4 10 00 00 1a fe 14 56 0e 51 00 35 30
51 36 59 00 25 a4 10 00 00 1a 00 00 00 fe 00 36
35 4d 4a 46 80 31 33 33 42 47 45 0a 00 00 00 00
00 00 41 31 96 00 10 00 00 01 01 0a 20 20 00 d5

----------------

Block 0, Base EDID:
  EDID Structure Version & Revision: 1.4
  Vendor & Product Identification:
    Manufacturer: CMO
    Model: 4914
    Made in: week 8 of 2011
  Basic Display Parameters & Features:
    Digital display
    Bits per primary color channel: 6
    Digital interface is not defined
    Maximum image size: 29 cm x 16 cm
    Gamma: 2.20
    Supported color formats: RGB 4:4:4
    First detailed timing includes the native pixel format and preferred refresh rate
  Color Characteristics:
    Red  : 0.5839, 0.3486
    Green: 0.3378, 0.5742
    Blue : 0.1572, 0.1259
    White: 0.3134, 0.3291
  Established Timings I & II: none
  Standard Timings: none
  Detailed Timing Descriptors:
    DTD 1:  1366x768    60.018 Hz 683:384  48.554 kHz  76.570 MHz (293 mm x 164 mm)
                 Hfront   33 Hsync  70 Hback 108 Hpol P
                 Vfront    4 Vsync  13 Vback  24 Vpol N
    DTD 2:  1366x768    40.010 Hz 683:384  32.848 kHz  53.740 MHz (293 mm x 164 mm)
                 Hfront   81 Hsync  54 Hback 135 Hpol P
                 Vfront    5 Vsync   9 Vback  39 Vpol N
    Alphanumeric Data String: '65MJF'
    Manufacturer-Specified Display Descriptor (0x00): 00 00 00 00 41 31 96 00 10 00 00 01 01 0a 20 20 '....A1........  '
Checksum: 0xd5

----------------

Failures:

Block 0, Base EDID:
  Alphanumeric Data String: Non-printable character.
  Missing Display Product Name.

EDID conformity: FAIL
