edid-decode (hex):

00 ff ff ff ff ff ff 00 4d 67 18 34 00 00 00 00
21 1f 01 04 b5 51 23 78 3b 65 f5 ad 50 49 b0 22
13 50 54 a5 cf 00 71 4f 81 c0 81 40 81 80 95 00
a9 c0 b3 00 d1 c0 f5 7c 70 a0 d0 a0 29 50 30 20
35 00 2a 5c 31 00 00 1a 20 fd 70 a0 d0 a0 3c 50
30 20 35 00 2a 5c 31 00 00 1e 00 00 00 fd 00 30
91 a0 a0 50 01 0a 20 20 20 20 20 20 00 00 00 fc
00 50 4d 4f 20 47 33 34 30 2d 43 57 51 4b 02 9c

02 03 3a f4 51 01 02 03 04 05 90 11 12 13 14 1f
3f 5d 5e 5f 60 61 23 09 07 07 83 01 00 00 e6 06
05 01 63 63 20 6d 1a 00 00 02 01 30 91 00 00 68
00 00 00 e3 05 e3 03 e2 00 c0 f0 d2 70 a0 d0 a0
3c 50 30 20 35 00 2a 5c 31 00 00 1e 4d d0 00 a0
f0 70 3e 80 30 20 35 00 2a 5c 31 00 00 1e f2 49
00 a0 a0 38 50 40 20 30 35 00 2a 5c 31 00 00 1e
00 00 00 00 00 00 00 00 00 00 00 00 00 00 00 a7

00 ff ff ff ff ff ff 00 4d 67 18 34 00 00 00 00
21 1f 01 04 b5 51 23 78 3b 65 f5 ad 50 49 b0 22
13 50 54 a5 cf 00 71 4f 81 c0 81 40 81 80 95 00
a9 c0 b3 00 d1 c0 f5 7c 70 a0 d0 a0 29 50 30 20
35 00 2a 5c 31 00 00 1a 20 fd 70 a0 d0 a0 3c 50
30 20 35 00 2a 5c 31 00 00 1e 00 00 00 fd 00 30
91 a0 a0 50 01 0a 20 20 20 20 20 20 00 00 00 fc
00 50 4d 4f 20 47 33 34 30 2d 43 57 51 4b 02 9c

00 ff ff ff ff ff ff 00 4d 67 18 34 00 00 00 00
21 1f 01 04 b5 51 23 78 3b 65 f5 ad 50 49 b0 22
13 50 54 a5 cf 00 71 4f 81 c0 81 40 81 80 95 00
a9 c0 b3 00 d1 c0 f5 7c 70 a0 d0 a0 29 50 30 20
35 00 2a 5c 31 00 00 1a 20 fd 70 a0 d0 a0 3c 50
30 20 35 00 2a 5c 31 00 00 1e 00 00 00 fd 00 30
91 a0 a0 50 01 0a 20 20 20 20 20 20 00 00 00 fc
00 50 4d 4f 20 47 33 34 30 2d 43 57 51 4b 02 9c

02 03 3a f4 51 01 02 03 04 05 90 11 12 13 14 1f
3f 5d 5e 5f 60 61 23 09 07 07 83 01 00 00 e6 06
05 01 63 63 20 6d 1a 00 00 02 01 30 91 00 00 68
00 00 00 e3 05 e3 03 e2 00 c0 f0 d2 70 a0 d0 a0
3c 50 30 20 35 00 2a 5c 31 00 00 1e 4d d0 00 a0
f0 70 3e 80 30 20 35 00 2a 5c 31 00 00 1e f2 49
00 a0 a0 38 50 40 20 30 35 00 2a 5c 31 00 00 1e
00 00 00 00 00 00 00 00 00 00 00 00 00 00 00 a7

00 ff ff ff ff ff ff 00 4d 67 18 34 00 00 00 00
21 1f 01 04 b5 51 23 78 3b 65 f5 ad 50 49 b0 22
13 50 54 a5 cf 00 71 4f 81 c0 81 40 81 80 95 00
a9 c0 b3 00 d1 c0 f5 7c 70 a0 d0 a0 29 50 30 20
35 00 2a 5c 31 00 00 1a 20 fd 70 a0 d0 a0 3c 50
30 20 35 00 2a 5c 31 00 00 1e 00 00 00 fd 00 30
91 a0 a0 50 01 0a 20 20 20 20 20 20 00 00 00 fc
00 50 4d 4f 20 47 33 34 30 2d 43 57 51 4b 02 9c

----------------

Block 0, Base EDID:
  EDID Structure Version & Revision: 1.4
  Vendor & Product Identification:
    Manufacturer: SKG
    Model: 13336
    Made in: week 33 of 2021
  Basic Display Parameters & Features:
    Digital display
    Bits per primary color channel: 10
    DisplayPort interface
    Maximum image size: 81 cm x 35 cm
    Gamma: 2.20
    DPMS levels: Off
    Supported color formats: RGB 4:4:4, YCrCb 4:4:4, YCrCb 4:2:2
    First detailed timing includes the native pixel format and preferred refresh rate
    Display is continuous frequency
  Color Characteristics:
    Red  : 0.6767, 0.3144
    Green: 0.2861, 0.6884
    Blue : 0.1357, 0.0771
    White: 0.3134, 0.3291
  Established Timings I & II:
    IBM     :   720x400    70.081663 Hz   9:5     31.467 kHz     28.320000 MHz
    DMT 0x04:   640x480    59.940476 Hz   4:3     31.469 kHz     25.175000 MHz
    DMT 0x06:   640x480    75.000000 Hz   4:3     37.500 kHz     31.500000 MHz
    DMT 0x09:   800x600    60.316541 Hz   4:3     37.879 kHz     40.000000 MHz
    DMT 0x0a:   800x600    72.187572 Hz   4:3     48.077 kHz     50.000000 MHz
    DMT 0x0b:   800x600    75.000000 Hz   4:3     46.875 kHz     49.500000 MHz
    DMT 0x10:  1024x768    60.003840 Hz   4:3     48.363 kHz     65.000000 MHz
    DMT 0x11:  1024x768    70.069359 Hz   4:3     56.476 kHz     75.000000 MHz
    DMT 0x12:  1024x768    75.028582 Hz   4:3     60.023 kHz     78.750000 MHz
    DMT 0x24:  1280x1024   75.024675 Hz   5:4     79.976 kHz    135.000000 MHz
  Standard Timings:
    DMT 0x15:  1152x864    75.000000 Hz   4:3     67.500 kHz    108.000000 MHz
    DMT 0x55:  1280x720    60.000000 Hz  16:9     45.000 kHz     74.250000 MHz
    DMT 0x20:  1280x960    60.000000 Hz   4:3     60.000 kHz    108.000000 MHz
    DMT 0x23:  1280x1024   60.019740 Hz   5:4     63.981 kHz    108.000000 MHz
    DMT 0x2f:  1440x900    59.887445 Hz  16:10    55.935 kHz    106.500000 MHz
    DMT 0x53:  1600x900    60.000000 Hz  16:9     60.000 kHz    108.000000 MHz (RB)
    DMT 0x3a:  1680x1050   59.954250 Hz  16:10    65.290 kHz    146.250000 MHz
    DMT 0x52:  1920x1080   60.000000 Hz  16:9     67.500 kHz    148.500000 MHz
  Detailed Timing Descriptors:
    DTD 1:  3440x1440   59.998875 Hz  43:18    88.858 kHz    319.890000 MHz (810 mm x 348 mm)
                 Hfront   48 Hsync  32 Hback   80 Hpol P
                 Vfront    3 Vsync   5 Vback   33 Vpol N
    DTD 2:  3440x1440  120.000000 Hz  43:18   180.000 kHz    648.000000 MHz (810 mm x 348 mm)
                 Hfront   48 Hsync  32 Hback   80 Hpol P
                 Vfront    3 Vsync   5 Vback   52 Vpol P
    Display Range Limits:
      Monitor ranges (Bare Limits): 48-145 Hz V, 160-160 kHz H, max dotclock 800 MHz
    Display Product Name: 'PMO G340-CWQK'
  Extension blocks: 2
Checksum: 0x9c

----------------

Block 1, CTA-861 Extension Block:
  Revision: 3
  Underscans IT Video Formats by default
  Basic audio support
  Supports YCbCr 4:4:4
  Supports YCbCr 4:2:2
  Native detailed modes: 4
  Video Data Block:
    VIC   1:   640x480    59.940476 Hz   4:3     31.469 kHz     25.175000 MHz
    VIC   2:   720x480    59.940060 Hz   4:3     31.469 kHz     27.000000 MHz
    VIC   3:   720x480    59.940060 Hz  16:9     31.469 kHz     27.000000 MHz
    VIC   4:  1280x720    60.000000 Hz  16:9     45.000 kHz     74.250000 MHz
    VIC   5:  1920x1080i  60.000000 Hz  16:9     33.750 kHz     74.250000 MHz
    VIC  16:  1920x1080   60.000000 Hz  16:9     67.500 kHz    148.500000 MHz (native)
    VIC  17:   720x576    50.000000 Hz   4:3     31.250 kHz     27.000000 MHz
    VIC  18:   720x576    50.000000 Hz  16:9     31.250 kHz     27.000000 MHz
    VIC  19:  1280x720    50.000000 Hz  16:9     37.500 kHz     74.250000 MHz
    VIC  20:  1920x1080i  50.000000 Hz  16:9     28.125 kHz     74.250000 MHz
    VIC  31:  1920x1080   50.000000 Hz  16:9     56.250 kHz    148.500000 MHz
    VIC  63:  1920x1080  120.000000 Hz  16:9    135.000 kHz    297.000000 MHz
    VIC  93:  3840x2160   24.000000 Hz  16:9     54.000 kHz    297.000000 MHz
    VIC  94:  3840x2160   25.000000 Hz  16:9     56.250 kHz    297.000000 MHz
    VIC  95:  3840x2160   30.000000 Hz  16:9     67.500 kHz    297.000000 MHz
    VIC  96:  3840x2160   50.000000 Hz  16:9    112.500 kHz    594.000000 MHz
    VIC  97:  3840x2160   60.000000 Hz  16:9    135.000 kHz    594.000000 MHz
  Audio Data Block:
    Linear PCM:
      Max channels: 2
      Supported sample rates (kHz): 48 44.1 32
      Supported sample sizes (bits): 24 20 16
  Speaker Allocation Data Block:
    FL/FR - Front Left/Right
  HDR Static Metadata Data Block:
    Electro optical transfer functions:
      Traditional gamma - SDR luminance range
      SMPTE ST2084
    Supported static metadata descriptors:
      Static metadata type 1
    Desired content max luminance: 99 (426.856 cd/m^2)
    Desired content max frame-average luminance: 99 (426.856 cd/m^2)
    Desired content min luminance: 32 (0.067 cd/m^2)
  Vendor-Specific Data Block (AMD), OUI 00-00-1A:
    Version: 2.1
    Minimum Refresh Rate: 48 Hz
    Maximum Refresh Rate: 145 Hz
    Flags 1.x: 0x00
    Flags 2.x: 0x00
    Maximum luminance: 104 (475.683 cd/m^2)
    Minimum luminance: 0 (0.000 cd/m^2)
    Unknown: 0x00 0x00
  Colorimetry Data Block:
    xvYCC601
    xvYCC709
    BT2020cYCC
    BT2020YCC
    BT2020RGB
    Gamut Boundary Description Metadata Profile P0
    Reserved Gamut Boundary Description Metadata Profile P1
  Video Capability Data Block:
    YCbCr quantization: Selectable (via AVI YQ)
    RGB quantization: Selectable (via AVI Q)
    PT scan behavior: No Data
    IT scan behavior: IT video formats not supported
    CE scan behavior: CE video formats not supported
  Detailed Timing Descriptors:
    DTD 3:  3440x1440  100.000000 Hz  43:18   150.000 kHz    540.000000 MHz (810 mm x 348 mm)
                 Hfront   48 Hsync  32 Hback   80 Hpol P
                 Vfront    3 Vsync   5 Vback   52 Vpol P
    DTD 4:  3840x2160   59.996625 Hz  16:9    133.312 kHz    533.250000 MHz (810 mm x 348 mm)
                 Hfront   48 Hsync  32 Hback   80 Hpol P
                 Vfront    3 Vsync   5 Vback   54 Vpol P
    DTD 5:  2560x1080   59.996197 Hz  64:27    69.596 kHz    189.300000 MHz (810 mm x 348 mm)
                 Hfront   32 Hsync  48 Hback   80 Hpol P
                 Vfront    3 Vsync   5 Vback   72 Vpol P
Checksum: 0xa7  Unused space in Extension Block: 15 bytes

----------------

Block 2, Unknown EDID Extension Block 0x00:
  00 ff ff ff ff ff ff 00 4d 67 18 34 00 00 00 00 '........Mg.4....'
  21 1f 01 04 b5 51 23 78 3b 65 f5 ad 50 49 b0 22 '!....Q#x;e..PI."'
  13 50 54 a5 cf 00 71 4f 81 c0 81 40 81 80 95 00 '.PT...qO...@....'
  a9 c0 b3 00 d1 c0 f5 7c 70 a0 d0 a0 29 50 30 20 '.......|p...)P0 '
  35 00 2a 5c 31 00 00 1a 20 fd 70 a0 d0 a0 3c 50 '5.*\1... .p...<P'
  30 20 35 00 2a 5c 31 00 00 1e 00 00 00 fd 00 30 '0 5.*\1........0'
  91 a0 a0 50 01 0a 20 20 20 20 20 20 00 00 00 fc '...P..      ....'
  00 50 4d 4f 20 47 33 34 30 2d 43 57 51 4b 02 9c '.PMO G340-CWQK..'
Checksum: 0x9c

----------------

Block 3, Unknown EDID Extension Block 0x00:
  00 ff ff ff ff ff ff 00 4d 67 18 34 00 00 00 00 '........Mg.4....'
  21 1f 01 04 b5 51 23 78 3b 65 f5 ad 50 49 b0 22 '!....Q#x;e..PI."'
  13 50 54 a5 cf 00 71 4f 81 c0 81 40 81 80 95 00 '.PT...qO...@....'
  a9 c0 b3 00 d1 c0 f5 7c 70 a0 d0 a0 29 50 30 20 '.......|p...)P0 '
  35 00 2a 5c 31 00 00 1a 20 fd 70 a0 d0 a0 3c 50 '5.*\1... .p...<P'
  30 20 35 00 2a 5c 31 00 00 1e 00 00 00 fd 00 30 '0 5.*\1........0'
  91 a0 a0 50 01 0a 20 20 20 20 20 20 00 00 00 fc '...P..      ....'
  00 50 4d 4f 20 47 33 34 30 2d 43 57 51 4b 02 9c '.PMO G340-CWQK..'
Checksum: 0x9c

----------------

Block 4, CTA-861 Extension Block:
  Revision: 3
  Underscans IT Video Formats by default
  Basic audio support
  Supports YCbCr 4:4:4
  Supports YCbCr 4:2:2
  Native detailed modes: 4
  Video Data Block:
    VIC   1:   640x480    59.940476 Hz   4:3     31.469 kHz     25.175000 MHz
    VIC   2:   720x480    59.940060 Hz   4:3     31.469 kHz     27.000000 MHz
    VIC   3:   720x480    59.940060 Hz  16:9     31.469 kHz     27.000000 MHz
    VIC   4:  1280x720    60.000000 Hz  16:9     45.000 kHz     74.250000 MHz
    VIC   5:  1920x1080i  60.000000 Hz  16:9     33.750 kHz     74.250000 MHz
    VIC  16:  1920x1080   60.000000 Hz  16:9     67.500 kHz    148.500000 MHz (native)
    VIC  17:   720x576    50.000000 Hz   4:3     31.250 kHz     27.000000 MHz
    VIC  18:   720x576    50.000000 Hz  16:9     31.250 kHz     27.000000 MHz
    VIC  19:  1280x720    50.000000 Hz  16:9     37.500 kHz     74.250000 MHz
    VIC  20:  1920x1080i  50.000000 Hz  16:9     28.125 kHz     74.250000 MHz
    VIC  31:  1920x1080   50.000000 Hz  16:9     56.250 kHz    148.500000 MHz
    VIC  63:  1920x1080  120.000000 Hz  16:9    135.000 kHz    297.000000 MHz
    VIC  93:  3840x2160   24.000000 Hz  16:9     54.000 kHz    297.000000 MHz
    VIC  94:  3840x2160   25.000000 Hz  16:9     56.250 kHz    297.000000 MHz
    VIC  95:  3840x2160   30.000000 Hz  16:9     67.500 kHz    297.000000 MHz
    VIC  96:  3840x2160   50.000000 Hz  16:9    112.500 kHz    594.000000 MHz
    VIC  97:  3840x2160   60.000000 Hz  16:9    135.000 kHz    594.000000 MHz
  Audio Data Block:
    Linear PCM:
      Max channels: 2
      Supported sample rates (kHz): 48 44.1 32
      Supported sample sizes (bits): 24 20 16
  Speaker Allocation Data Block:
    FL/FR - Front Left/Right
  HDR Static Metadata Data Block:
    Electro optical transfer functions:
      Traditional gamma - SDR luminance range
      SMPTE ST2084
    Supported static metadata descriptors:
      Static metadata type 1
    Desired content max luminance: 99 (426.856 cd/m^2)
    Desired content max frame-average luminance: 99 (426.856 cd/m^2)
    Desired content min luminance: 32 (0.067 cd/m^2)
  Vendor-Specific Data Block (AMD), OUI 00-00-1A:
    Version: 2.1
    Minimum Refresh Rate: 48 Hz
    Maximum Refresh Rate: 145 Hz
    Flags 1.x: 0x00
    Flags 2.x: 0x00
    Maximum luminance: 104 (475.683 cd/m^2)
    Minimum luminance: 0 (0.000 cd/m^2)
    Unknown: 0x00 0x00
  Colorimetry Data Block:
    xvYCC601
    xvYCC709
    BT2020cYCC
    BT2020YCC
    BT2020RGB
    Gamut Boundary Description Metadata Profile P0
    Reserved Gamut Boundary Description Metadata Profile P1
  Video Capability Data Block:
    YCbCr quantization: Selectable (via AVI YQ)
    RGB quantization: Selectable (via AVI Q)
    PT scan behavior: No Data
    IT scan behavior: IT video formats not supported
    CE scan behavior: CE video formats not supported
  Detailed Timing Descriptors:
    DTD 6:  3440x1440  100.000000 Hz  43:18   150.000 kHz    540.000000 MHz (810 mm x 348 mm)
                 Hfront   48 Hsync  32 Hback   80 Hpol P
                 Vfront    3 Vsync   5 Vback   52 Vpol P
    DTD 7:  3840x2160   59.996625 Hz  16:9    133.312 kHz    533.250000 MHz (810 mm x 348 mm)
                 Hfront   48 Hsync  32 Hback   80 Hpol P
                 Vfront    3 Vsync   5 Vback   54 Vpol P
    DTD 8:  2560x1080   59.996197 Hz  64:27    69.596 kHz    189.300000 MHz (810 mm x 348 mm)
                 Hfront   32 Hsync  48 Hback   80 Hpol P
                 Vfront    3 Vsync   5 Vback   72 Vpol P
Checksum: 0xa7  Unused space in Extension Block: 15 bytes

----------------

Block 5, Unknown EDID Extension Block 0x00:
  00 ff ff ff ff ff ff 00 4d 67 18 34 00 00 00 00 '........Mg.4....'
  21 1f 01 04 b5 51 23 78 3b 65 f5 ad 50 49 b0 22 '!....Q#x;e..PI."'
  13 50 54 a5 cf 00 71 4f 81 c0 81 40 81 80 95 00 '.PT...qO...@....'
  a9 c0 b3 00 d1 c0 f5 7c 70 a0 d0 a0 29 50 30 20 '.......|p...)P0 '
  35 00 2a 5c 31 00 00 1a 20 fd 70 a0 d0 a0 3c 50 '5.*\1... .p...<P'
  30 20 35 00 2a 5c 31 00 00 1e 00 00 00 fd 00 30 '0 5.*\1........0'
  91 a0 a0 50 01 0a 20 20 20 20 20 20 00 00 00 fc '...P..      ....'
  00 50 4d 4f 20 47 33 34 30 2d 43 57 51 4b 02 9c '.PMO G340-CWQK..'
Checksum: 0x9c

----------------

Warnings:

Block 1, CTA-861 Extension Block:
  Colorimetry Data Block: Set the sRGB colorimetry bit to avoid interop issues.
  Video Capability Data Block: IT scan behavior is expected to support underscanned.
  Video Capability Data Block: 'CE video formats not supported' makes no sense.
Block 4, CTA-861 Extension Block:
  Colorimetry Data Block: Set the sRGB colorimetry bit to avoid interop issues.
  Video Capability Data Block: IT scan behavior is expected to support underscanned.
  Video Capability Data Block: 'CE video formats not supported' makes no sense.
EDID:
  Base EDID: Some timings are out of range of the Monitor Ranges:
    Vertical Freq: 24.000 - 120.000 Hz (Monitor: 48.000 - 145.000 Hz)
    Horizontal Freq: 28.125 - 180.000 kHz (Monitor: 160.000 - 160.000 kHz)

Failures:

Block 1, CTA-861 Extension Block:
  Colorimetry Data Block: Reserved bits MD1-MD3 must be 0.
Block 2, Base EDID:
  Unknown Extension Block.
Block 3, Base EDID:
  Unknown Extension Block.
Block 4, CTA-861 Extension Block:
  Video Data Block: Duplicate VIC 1.
  Video Data Block: Duplicate VIC 2.
  Video Data Block: Duplicate VIC 3.
  Video Data Block: Duplicate VIC 4.
  Video Data Block: Duplicate VIC 5.
  Video Data Block: Duplicate VIC 16.
  Video Data Block: Duplicate VIC 17.
  Video Data Block: Duplicate VIC 18.
  Video Data Block: Duplicate VIC 19.
  Video Data Block: Duplicate VIC 20.
  Video Data Block: Duplicate VIC 31.
  Video Data Block: Duplicate VIC 63.
  Video Data Block: Duplicate VIC 93.
  Video Data Block: Duplicate VIC 94.
  Video Data Block: Duplicate VIC 95.
  Video Data Block: Duplicate VIC 96.
  Video Data Block: Duplicate VIC 97.
  Speaker Allocation Data Block: Only one instance of this Data Block is allowed.
  HDR Static Metadata Data Block: Only one instance of this Data Block is allowed.
  Colorimetry Data Block: Only one instance of this Data Block is allowed.
  Colorimetry Data Block: Reserved bits MD1-MD3 must be 0.
  Video Capability Data Block: Only one instance of this Data Block is allowed.
Block 5, Base EDID:
  Unknown Extension Block.
EDID:
  Base EDID: EDID specified 2 extension block(s), but found 5 extension block(s).
  CTA-861: Native progressive timings are a mix of several resolutions.

EDID conformity: FAIL
