
EDID (hex):
00ffffffffffff0034ac6e4801010101
0a17010380301b78ea01f5a257529f27
0a5054bfef80714f8180814fa9c0b300
010101010101023a801871382d40582c
4500dc0c1100001e000000fd00384c1f
5210000a202020202020000000fc0052
4454323232574c4d0a202020000000ff
003333323631373737454a0a2020009c

Extracted contents:
header:          00 ff ff ff ff ff ff 00
serial number:   34 ac 6e 48 01 01 01 01 0a 17
version:         01 03
basic params:    80 30 1b 78 ea
chroma info:     01 f5 a2 57 52 9f 27 0a 50 54
established:     bf ef 80
standard:        71 4f 81 80 81 4f a9 c0 b3 00 01 01 01 01 01 01
descriptor 1:    02 3a 80 18 71 38 2d 40 58 2c 45 00 dc 0c 11 00 00 1e
descriptor 2:    00 00 00 fd 00 38 4c 1f 52 10 00 0a 20 20 20 20 20 20
descriptor 3:    00 00 00 fc 00 52 44 54 32 32 32 57 4c 4d 0a 20 20 20
descriptor 4:    00 00 00 ff 00 33 33 32 36 31 37 37 37 45 4a 0a 20 20
extensions:      00
checksum:        9c

EDID version: 1.3
Manufacturer: MEL Model 486e Serial Number --
Made in week 10 of 2013
Digital display
Maximum image size: 48 cm x 27 cm
Gamma: 2.20
DPMS levels: Standby Suspend Off
RGB color display
First detailed timing is preferred timing
Display x,y Chromaticity:
  Red:   0.6328, 0.3398
  Green: 0.3203, 0.6220
  Blue:  0.1552, 0.0419
  White: 0.3134, 0.3291
Established timings supported:
  720x400@70Hz 9:5 HorFreq: 31469 Hz Clock: 28.320 MHz
  640x480@60Hz 4:3 HorFreq: 31469 Hz Clock: 25.175 MHz
  640x480@67Hz 4:3 HorFreq: 35000 Hz Clock: 30.240 MHz
  640x480@72Hz 4:3 HorFreq: 37900 Hz Clock: 31.500 MHz
  640x480@75Hz 4:3 HorFreq: 37500 Hz Clock: 31.500 MHz
  800x600@56Hz 4:3 HorFreq: 35200 Hz Clock: 36.000 MHz
  800x600@60Hz 4:3 HorFreq: 37900 Hz Clock: 40.000 MHz
  800x600@72Hz 4:3 HorFreq: 48100 Hz Clock: 50.000 MHz
  800x600@75Hz 4:3 HorFreq: 46900 Hz Clock: 49.500 MHz
  832x624@75Hz 4:3 HorFreq: 49726 Hz Clock: 57.284 MHz
  1024x768@60Hz 4:3 HorFreq: 48400 Hz Clock: 65.000 MHz
  1024x768@70Hz 4:3 HorFreq: 56500 Hz Clock: 75.000 MHz
  1024x768@75Hz 4:3 HorFreq: 60000 Hz Clock: 78.750 MHz
  1280x1024@75Hz 5:4 HorFreq: 80000 Hz Clock: 135.000 MHz
  1152x870@75Hz 192:145 HorFreq: 67500 Hz Clock: 108.000 MHz
Standard timings supported:
  1152x864@75Hz 4:3 HorFreq: 67500 Hz Clock: 108.000 MHz
  1280x1024@60Hz 5:4 HorFreq: 64000 Hz Clock: 108.000 MHz
  1280x960@75Hz 4:3
  1600x900@60Hz 16:9
  1680x1050@60Hz 16:10 HorFreq: 64700 Hz Clock: 119.000 MHz
Detailed mode: Clock 148.500 MHz, 476 mm x 268 mm
               1920 2008 2052 2200 hborder 0
               1080 1084 1089 1125 vborder 0
               +hsync +vsync 
               VertFreq: 60 Hz, HorFreq: 67500 Hz
Monitor ranges (GTF): 56-76Hz V, 31-82kHz H, max dotclock 160MHz
Monitor name: RDT222WLM
Serial number: --
Checksum: 0x9c (valid)
