
EDID (hex):
00ffffffffffff00410c0ae029920000
310c0103681f17bbe8e5b89e594a9c26
10484cadee0031594559615981803168
45688140714fd60980a0205e63101060
520832e61000001a000000ff00204844
20203033373431370a20000000fc0050
48494c495053203130375434000000fd
0032a01e470b000a2020202020200064

Extracted contents:
header:          00 ff ff ff ff ff ff 00
serial number:   41 0c 0a e0 29 92 00 00 31 0c
version:         01 03
basic params:    68 1f 17 bb e8
chroma info:     e5 b8 9e 59 4a 9c 26 10 48 4c
established:     ad ee 00
standard:        31 59 45 59 61 59 81 80 31 68 45 68 81 40 71 4f
descriptor 1:    d6 09 80 a0 20 5e 63 10 10 60 52 08 32 e6 10 00 00 1a
descriptor 2:    00 00 00 ff 00 20 48 44 20 20 30 33 37 34 31 37 0a 20
descriptor 3:    00 00 00 fc 00 50 48 49 4c 49 50 53 20 31 30 37 54 34
descriptor 4:    00 00 00 fd 00 32 a0 1e 47 0b 00 0a 20 20 20 20 20 20
extensions:      00
checksum:        64

EDID version: 1.3
Manufacturer: PHL Model e00a Serial Number --
Analog display, Input voltage level: 0.7/0.7 V
Sync: Separate 
Maximum image size: 31 cm x 23 cm
Gamma: 2.87
DPMS levels: Standby Suspend Off
RGB color display
Display x,y Chromaticity:
  Red:   0.6201, 0.3496
  Green: 0.2900, 0.6103
  Blue:  0.1503, 0.0654
  White: 0.2832, 0.2968
Established timings supported:
  720x400@70Hz 9:5 HorFreq: 31469 Hz Clock: 28.320 MHz
  640x480@60Hz 4:3 HorFreq: 31469 Hz Clock: 25.175 MHz
  640x480@72Hz 4:3 HorFreq: 37900 Hz Clock: 31.500 MHz
  640x480@75Hz 4:3 HorFreq: 37500 Hz Clock: 31.500 MHz
  800x600@60Hz 4:3 HorFreq: 37900 Hz Clock: 40.000 MHz
  800x600@72Hz 4:3 HorFreq: 48100 Hz Clock: 50.000 MHz
  800x600@75Hz 4:3 HorFreq: 46900 Hz Clock: 49.500 MHz
  832x624@75Hz 4:3 HorFreq: 49726 Hz Clock: 57.284 MHz
  1024x768@60Hz 4:3 HorFreq: 48400 Hz Clock: 65.000 MHz
  1024x768@70Hz 4:3 HorFreq: 56500 Hz Clock: 75.000 MHz
  1024x768@75Hz 4:3 HorFreq: 60000 Hz Clock: 78.750 MHz
Standard timings supported:
  640x480@85Hz 4:3 HorFreq: 43300 Hz Clock: 36.000 MHz
  800x600@85Hz 4:3 HorFreq: 53700 Hz Clock: 56.250 MHz
  1024x768@85Hz 4:3 HorFreq: 68700 Hz Clock: 94.500 MHz
  1280x1024@60Hz 5:4 HorFreq: 64000 Hz Clock: 108.000 MHz
  640x480@100Hz 4:3
  800x600@100Hz 4:3
  1280x960@60Hz 4:3 HorFreq: 60000 Hz Clock: 108.000 MHz
  1152x864@75Hz 4:3 HorFreq: 67500 Hz Clock: 108.000 MHz
Detailed mode: Clock 25.180 MHz, 306 mm x 230 mm
                640  656  752  800 hborder 0
                350  387  389  449 vborder 0
               +hsync -vsync 
               VertFreq: 70 Hz, HorFreq: 31475 Hz
Serial number:  --  037417
Monitor ranges (GTF): 50-160Hz V, 30-71kHz H, max dotclock 110MHz
Checksum: 0x64 (valid)
EDID block does NOT conform to EDID 1.3!
	Name descriptor not terminated with a newline
	Missing preferred timing
EDID block does not conform at all!
	Bad year of manufacture
