edid-decode (hex):

00 ff ff ff ff ff ff 00 21 31 05 07 ad cb 31 01
1a 0e 01 03 08 21 1b 78 e8 c5 c6 a3 57 4a 9c 23
12 4f 54 a5 4f 00 81 80 01 01 01 01 01 01 01 01
01 01 01 01 01 01 30 2a 00 98 51 00 2a 40 30 70
13 00 51 0e 11 00 00 1e 10 0b d0 b4 20 90 31 10
12 6c d2 00 51 0e 11 00 00 1c d5 09 80 a0 20 e0
2d 10 10 60 a2 00 51 0e 11 00 00 18 00 00 00 fc
00 4c 37 30 4e 0a 20 20 20 20 20 20 20 20 00 b2

00 ff ff ff ff ff ff 00 21 31 05 07 ad cb 31 01
1a 0e 01 03 08 21 1b 78 e8 c5 c6 a3 57 4a 9c 23
12 4f 54 a5 4f 00 81 80 01 01 01 01 01 01 01 01
01 01 01 01 01 01 30 2a 00 98 51 00 2a 40 30 70
13 00 51 0e 11 00 00 1e 10 0b d0 b4 20 90 31 10
12 6c d2 00 51 0e 11 00 00 1c d5 09 80 a0 20 e0
2d 10 10 60 a2 00 51 0e 11 00 00 18 00 00 00 fc
00 4c 37 30 4e 0a 20 20 20 20 20 20 20 20 00 b2

----------------

Block 0, Base EDID:
  EDID Structure Version & Revision: 1.3
  Vendor & Product Identification:
    Manufacturer: HIQ
    Model: 1797
    Serial Number: ...
    Made in: week 26 of 2004
  Basic Display Parameters & Features:
    Analog display
    Signal Level Standard: 0.700 : 0.300 : 1.000 V p-p
    Blank level equals black level
    Sync: Separate
    Maximum image size: 33 cm x 27 cm
    Gamma: 2.20
    DPMS levels: Standby Suspend Off
    RGB color display
  Color Characteristics:
    Red  : 0.6396, 0.3398
    Green: 0.2900, 0.6103
    Blue : 0.1396, 0.0703
    White: 0.3095, 0.3300
  Established Timings I & II:
    IBM     :   720x400    70.081663 Hz   9:5     31.467 kHz     28.320000 MHz
    DMT 0x04:   640x480    59.940476 Hz   4:3     31.469 kHz     25.175000 MHz
    DMT 0x06:   640x480    75.000000 Hz   4:3     37.500 kHz     31.500000 MHz
    DMT 0x09:   800x600    60.316541 Hz   4:3     37.879 kHz     40.000000 MHz
    DMT 0x0b:   800x600    75.000000 Hz   4:3     46.875 kHz     49.500000 MHz
    DMT 0x10:  1024x768    60.003840 Hz   4:3     48.363 kHz     65.000000 MHz
    DMT 0x11:  1024x768    70.069359 Hz   4:3     56.476 kHz     75.000000 MHz
    DMT 0x12:  1024x768    75.028582 Hz   4:3     60.023 kHz     78.750000 MHz
    DMT 0x24:  1280x1024   75.024675 Hz   5:4     79.976 kHz    135.000000 MHz
  Standard Timings:
    DMT 0x23:  1280x1024   60.019740 Hz   5:4     63.981 kHz    108.000000 MHz
  Detailed Timing Descriptors:
    DTD 1:  1280x1024   60.019740 Hz   5:4     63.981 kHz    108.000000 MHz (337 mm x 270 mm)
                 Hfront   48 Hsync 112 Hback  248 Hpol P
                 Vfront    1 Vsync   3 Vback   38 Vpol P
    DTD 2:   720x400    70.081663 Hz   9:5     31.467 kHz     28.320000 MHz (337 mm x 270 mm)
                 Hfront   18 Hsync 108 Hback   54 Hpol N
                 Vfront   13 Vsync   2 Vback   34 Vpol P
    DTD 3:   640x480    59.928571 Hz   4:3     31.462 kHz     25.170000 MHz (337 mm x 270 mm)
                 Hfront   16 Hsync  96 Hback   48 Hpol N
                 Vfront   10 Vsync   2 Vback   33 Vpol N
    Display Product Name: 'L70N'
Checksum: 0xb2

----------------

Block 1, Unknown EDID Extension Block 0x00:
  00 ff ff ff ff ff ff 00 21 31 05 07 ad cb 31 01 '........!1....1.'
  1a 0e 01 03 08 21 1b 78 e8 c5 c6 a3 57 4a 9c 23 '.....!.x....WJ.#'
  12 4f 54 a5 4f 00 81 80 01 01 01 01 01 01 01 01 '.OT.O...........'
  01 01 01 01 01 01 30 2a 00 98 51 00 2a 40 30 70 '......0*..Q.*@0p'
  13 00 51 0e 11 00 00 1e 10 0b d0 b4 20 90 31 10 '..Q......... .1.'
  12 6c d2 00 51 0e 11 00 00 1c d5 09 80 a0 20 e0 '.l..Q......... .'
  2d 10 10 60 a2 00 51 0e 11 00 00 18 00 00 00 fc '-..`..Q.........'
  00 4c 37 30 4e 0a 20 20 20 20 20 20 20 20 00 b2 '.L70N.        ..'
Checksum: 0xb2

----------------

Failures:

Block 0, Base EDID:
  Basic Display Parameters & Features: EDID 1.3 requires that the first detailed timing is the preferred timing.
  Missing Display Range Limits Descriptor.
Block 1, Base EDID:
  Unknown Extension Block.
EDID:
  Base EDID: EDID specified 0 extension block(s), but found 1 extension block(s).

EDID conformity: FAIL
