
EDID (hex):
00ffffffffffff0009e5b50500000000
01160104801f11780ab0909758549226
1d505400000001010101010101010101
010101010101ce1d56e0500020303020
360035ad1000001ace1d56e050002030
3020360035ad1000001a000000fe0042
4f452048460a202020202020000000fe
0048423134305758312d3130300a004d

Extracted contents:
header:          00 ff ff ff ff ff ff 00
serial number:   09 e5 b5 05 00 00 00 00 01 16
version:         01 04
basic params:    80 1f 11 78 0a
chroma info:     b0 90 97 58 54 92 26 1d 50 54
established:     00 00 00
standard:        01 01 01 01 01 01 01 01 01 01 01 01 01 01 01 01
descriptor 1:    ce 1d 56 e0 50 00 20 30 30 20 36 00 35 ad 10 00 00 1a
descriptor 2:    ce 1d 56 e0 50 00 20 30 30 20 36 00 35 ad 10 00 00 1a
descriptor 3:    00 00 00 fe 00 42 4f 45 20 48 46 0a 20 20 20 20 20 20
descriptor 4:    00 00 00 fe 00 48 42 31 34 30 57 58 31 2d 31 30 30 0a
extensions:      00
checksum:        4d

EDID version: 1.4
Manufacturer: BOE Model 5b5 Serial Number --
Made in week 1 of 2012
Digital display
Color depth is undefined
Digital interface is not defined
Maximum image size: 31 cm x 17 cm
Gamma: 2.20
Supported color formats: RGB 4:4:4, YCrCb 4:4:4
First detailed timing includes the native pixel format and preferred refresh rate
Display x,y Chromaticity:
  Red:   0.5917, 0.3466
  Green: 0.3281, 0.5703
  Blue:  0.1503, 0.1142
  White: 0.3125, 0.3281
Established timings supported:
Standard timings supported:
Detailed mode: Clock 76.300 MHz, 309 mm x 173 mm
               1366 1414 1446 1590 hborder 0
                768  771  777  800 vborder 0
               +hsync -vsync 
               VertFreq: 59 Hz, HorFreq: 47987 Hz
Detailed mode: Clock 76.300 MHz, 309 mm x 173 mm
               1366 1414 1446 1590 hborder 0
                768  771  777  800 vborder 0
               +hsync -vsync 
               VertFreq: 59 Hz, HorFreq: 47987 Hz
ASCII string: BOE HF
ASCII string: HB140WX1-100
Checksum: 0x4d (valid)
EDID block does NOT conform to EDID 1.4!
	Missing name descriptor
	Missing monitor ranges
