edid-decode (hex):

00 ff ff ff ff ff ff 00 09 e5 b5 05 00 00 00 00
01 16 01 04 80 1f 11 78 0a b0 90 97 58 54 92 26
1d 50 54 00 00 00 01 01 01 01 01 01 01 01 01 01
01 01 01 01 01 01 cf 1d 56 f4 50 00 16 30 30 20
36 00 35 ad 10 00 00 1a df 13 56 f4 50 00 16 30
30 20 36 00 35 ad 10 00 00 1a 00 00 00 00 00 00
00 00 00 00 00 00 00 00 00 00 00 00 00 00 00 02
00 0c 44 ff 0a 3c 6e 13 16 2c 6e 00 00 00 00 7a

----------------

Block 0, Base EDID:
  EDID Structure Version & Revision: 1.4
  Vendor & Product Identification:
    Manufacturer: BOE
    Model: 1461
    Made in: week 1 of 2012
  Basic Display Parameters & Features:
    Digital display
    Color depth is undefined
    Digital interface is not defined
    Maximum image size: 31 cm x 17 cm
    Gamma: 2.20
    Supported color formats: RGB 4:4:4, YCrCb 4:4:4
    First detailed timing includes the native pixel format and preferred refresh rate
  Color Characteristics:
    Red  : 0.5917, 0.3466
    Green: 0.3281, 0.5703
    Blue : 0.1503, 0.1142
    White: 0.3125, 0.3281
  Established Timings I & II: none
  Standard Timings: none
  Detailed Timing Descriptors:
    DTD 1:  1366x768    59.996855 Hz 683:384   47.398 kHz     76.310000 MHz (309 mm x 173 mm)
                 Hfront   48 Hsync  32 Hback  164 Hpol P
                 Vfront    3 Vsync   6 Vback   13 Vpol N
    DTD 2:  1366x768    39.995283 Hz 683:384   31.596 kHz     50.870000 MHz (309 mm x 173 mm)
                 Hfront   48 Hsync  32 Hback  164 Hpol P
                 Vfront    3 Vsync   6 Vback   13 Vpol N
    Empty Descriptor
    Manufacturer-Specified Display Descriptor (0x02): 00 02 00 0c 44 ff 0a 3c 6e 13 16 2c 6e 00 00 00 '....D..<n..,n...'
Checksum: 0x7a

----------------

Failures:

Block 0, Base EDID:
  Empty Descriptor: Use Dummy Descriptor instead of all zeroes.
  Missing Display Product Name.

EDID conformity: FAIL
