
EDID (hex):
00ffffffffffff0030ae9f126bca0000
171601036c2f1a782ece85a259539c27
0f5054afef00818081c0810f9500b300
714fa9c0a9cf023a801871382d40582c
4500dc0c1100001e302a40c860846430
18501300dc0c1100001e000000fd0032
4c1e5315000a202020202020000000fc
004c454e204c3232363277410a200050

Extracted contents:
header:          00 ff ff ff ff ff ff 00
serial number:   30 ae 9f 12 6b ca 00 00 17 16
version:         01 03
basic params:    6c 2f 1a 78 2e
chroma info:     ce 85 a2 59 53 9c 27 0f 50 54
established:     af ef 00
standard:        81 80 81 c0 81 0f 95 00 b3 00 71 4f a9 c0 a9 cf
descriptor 1:    02 3a 80 18 71 38 2d 40 58 2c 45 00 dc 0c 11 00 00 1e
descriptor 2:    30 2a 40 c8 60 84 64 30 18 50 13 00 dc 0c 11 00 00 1e
descriptor 3:    00 00 00 fd 00 32 4c 1e 53 15 00 0a 20 20 20 20 20 20
descriptor 4:    00 00 00 fc 00 4c 45 4e 20 4c 32 32 36 32 77 41 0a 20
extensions:      00
checksum:        50

EDID version: 1.3
Manufacturer: LEN Model 129f Serial Number --
Made in week 23 of 2012
Analog display, Input voltage level: 0.7/0.7 V
Sync: Separate Composite 
Maximum image size: 47 cm x 26 cm
Gamma: 2.20
DPMS levels: Off
RGB color display
Default (sRGB) color space is primary color space
First detailed timing is preferred timing
Display x,y Chromaticity:
  Red:   0.6357, 0.3476
  Green: 0.3271, 0.6113
  Blue:  0.1542, 0.0585
  White: 0.3134, 0.3291
Established timings supported:
  720x400@70Hz 9:5 HorFreq: 31469 Hz Clock: 28.320 MHz
  640x480@60Hz 4:3 HorFreq: 31469 Hz Clock: 25.175 MHz
  640x480@72Hz 4:3 HorFreq: 37900 Hz Clock: 31.500 MHz
  640x480@75Hz 4:3 HorFreq: 37500 Hz Clock: 31.500 MHz
  800x600@56Hz 4:3 HorFreq: 35200 Hz Clock: 36.000 MHz
  800x600@60Hz 4:3 HorFreq: 37900 Hz Clock: 40.000 MHz
  800x600@72Hz 4:3 HorFreq: 48100 Hz Clock: 50.000 MHz
  800x600@75Hz 4:3 HorFreq: 46900 Hz Clock: 49.500 MHz
  832x624@75Hz 4:3 HorFreq: 49726 Hz Clock: 57.284 MHz
  1024x768@60Hz 4:3 HorFreq: 48400 Hz Clock: 65.000 MHz
  1024x768@70Hz 4:3 HorFreq: 56500 Hz Clock: 75.000 MHz
  1024x768@75Hz 4:3 HorFreq: 60000 Hz Clock: 78.750 MHz
  1280x1024@75Hz 5:4 HorFreq: 80000 Hz Clock: 135.000 MHz
Standard timings supported:
  1280x1024@60Hz 5:4 HorFreq: 64000 Hz Clock: 108.000 MHz
  1280x720@60Hz 16:9
  1280x800@75Hz 16:10
  1440x900@60Hz 16:10 HorFreq: 55500 Hz Clock: 88.750 MHz
  1680x1050@60Hz 16:10 HorFreq: 64700 Hz Clock: 119.000 MHz
  1152x864@75Hz 4:3 HorFreq: 67500 Hz Clock: 108.000 MHz
  1600x900@60Hz 16:9
  1600x900@75Hz 16:9
Detailed mode: Clock 148.500 MHz, 476 mm x 268 mm
               1920 2008 2052 2200 hborder 0
               1080 1084 1089 1125 vborder 0
               +hsync +vsync 
               VertFreq: 60 Hz, HorFreq: 67500 Hz
Detailed mode: Clock 108.000 MHz, 476 mm x 268 mm
               1600 1624 1704 1800 hborder 0
                900  901  904 1000 vborder 0
               +hsync +vsync 
               VertFreq: 60 Hz, HorFreq: 60000 Hz
Monitor ranges (GTF): 50-76Hz V, 30-83kHz H, max dotclock 210MHz
Monitor name: LEN L2262wA
Checksum: 0x50 (valid)
EDID block does NOT conform to EDID 1.3!
	sRGB is signaled, but the chromaticities do not match
