edid-decode (hex):

00 ff ff ff ff ff ff 00 32 0c 01 03 00 00 00 00
00 11 01 03 80 21 15 78 0a b3 40 99 59 53 8d 27
25 50 54 00 00 00 01 01 01 01 01 01 01 01 01 01
01 01 01 01 01 01 39 1c 00 b8 50 20 17 30 30 20
36 00 4b cf 10 00 00 19 39 1c 00 b8 50 20 17 30
30 20 36 00 4b cf 10 00 00 00 00 00 00 fe 00 58
55 32 33 35 81 31 35 34 57 30 31 0a 00 00 00 fe
00 24 32 3d 45 68 8b a7 ff 01 01 0a 20 20 00 d4

----------------

Block 0, Base EDID:
  EDID Structure Version & Revision: 1.3
  Vendor & Product Identification:
    Manufacturer: LPL
    Model: 769
    Made in: 2007
  Basic Display Parameters & Features:
    Digital display
    Maximum image size: 33 cm x 21 cm
    Gamma: 2.20
    RGB color display
    First detailed timing is the preferred timing
  Color Characteristics:
    Red  : 0.5996, 0.3505
    Green: 0.3242, 0.5537
    Blue : 0.1533, 0.1445
    White: 0.3125, 0.3281
  Established Timings I & II: none
  Standard Timings: none
  Detailed Timing Descriptors:
    DTD 1:  1280x800    59.964876 Hz   8:5     49.351 kHz     72.250000 MHz (DE timing only, 331 mm x 207 mm)
                 Hfront   48 Hsync  32 Hback  104 Hpol N
                 Vfront    3 Vsync   6 Vback   14 Vpol N
    DTD 2:  1280x800    59.964876 Hz   8:5     49.351 kHz     72.250000 MHz (DE timing only, 331 mm x 207 mm)
                 Hfront   48 Hsync  32 Hback  104 Hpol N
                 Vfront    3 Vsync   6 Vback   14 Vpol N
    SPWG Module Revision: 0
    SPWG Descriptor #3:
      SPWG PC Maker P/N: 'XU235'
      SPWG LCD Supplier EEDID Revision: 129
      SPWG Manufacturer P/N: '154W01'
    SPWG Descriptor #4:
      SMBUS Values: 0x24 0x32 0x3d 0x45 0x68 0x8b 0xa7 0xff
      LVDS Channels: 1
      Panel Self Test Present
Checksum: 0xd4

----------------

Failures:

Block 0, Base EDID:
  Missing Display Product Name.
  Missing Display Range Limits Descriptor.

EDID conformity: FAIL
