edid-decode (hex):

00 ff ff ff ff ff ff 00 15 c3 81 20 01 01 01 01
2c 12 01 03 80 34 21 78 ea f9 f5 a8 53 37 ae 25
12 50 54 a1 08 00 a9 40 81 80 81 40 b3 00 d1 c0
81 c0 01 01 01 01 28 3c 80 a0 70 b0 23 40 30 20
36 00 07 44 21 00 00 1a 00 00 00 ff 00 30 30 30
30 30 30 30 31 0a 20 20 20 20 00 00 00 fd 00 3b
47 1f 4c 11 00 0a 20 20 20 20 20 20 00 00 00 fc
00 46 58 32 34 33 31 0a 20 20 20 20 20 20 01 79

02 03 17 c0 43 10 04 01 23 09 07 07 83 01 00 00
66 03 0c 00 20 00 80 02 3a 80 18 71 38 2d 40 58
2c 45 00 07 24 21 00 00 1e 01 1d 00 72 51 d0 1e
20 6e 28 55 00 07 24 21 00 00 1e d5 09 80 a0 20
e0 2d 10 10 60 a2 00 b0 44 11 00 00 18 00 00 00
00 00 00 00 00 00 00 00 00 00 00 00 00 00 00 00
00 00 00 00 00 00 00 00 00 00 00 00 00 00 00 00
00 00 00 00 00 00 00 00 00 00 00 00 00 00 00 2e

----------------

Block 0, Base EDID:
  EDID Structure Version & Revision: 1.3
  Vendor & Product Identification:
    Manufacturer: ENC
    Model: 8321
    Serial Number: ...
    Made in: week 44 of 2008
  Basic Display Parameters & Features:
    Digital display
    Maximum image size: 52 cm x 33 cm
    Gamma: 2.20
    DPMS levels: Standby Suspend Off
    RGB color display
    First detailed timing is the preferred timing
  Color Characteristics:
    Red  : 0.6591, 0.3271
    Green: 0.2167, 0.6806
    Blue : 0.1474, 0.0732
    White: 0.3134, 0.3291
  Established Timings I & II:
    IBM     :   720x400    70.082 Hz   9:5    31.467 kHz  28.320 MHz
    DMT 0x04:   640x480    59.940 Hz   4:3    31.469 kHz  25.175 MHz
    DMT 0x09:   800x600    60.317 Hz   4:3    37.879 kHz  40.000 MHz
    DMT 0x10:  1024x768    60.004 Hz   4:3    48.363 kHz  65.000 MHz
  Standard Timings:
    DMT 0x33:  1600x1200   60.000 Hz   4:3    75.000 kHz 162.000 MHz
    DMT 0x23:  1280x1024   60.020 Hz   5:4    63.981 kHz 108.000 MHz
    DMT 0x20:  1280x960    60.000 Hz   4:3    60.000 kHz 108.000 MHz
    DMT 0x3a:  1680x1050   59.954 Hz  16:10   65.290 kHz 146.250 MHz
    DMT 0x52:  1920x1080   60.000 Hz  16:9    67.500 kHz 148.500 MHz
    DMT 0x55:  1280x720    60.000 Hz  16:9    45.000 kHz  74.250 MHz
  Detailed Timing Descriptors:
    DTD 1:  1920x1200   59.950 Hz   8:5    74.038 kHz 154.000 MHz (519 mm x 324 mm)
                 Hfront   48 Hsync  32 Hback  80 Hpol P
                 Vfront    3 Vsync   6 Vback  26 Vpol N
    Display Product Serial Number: ...
  Display Range Limits:
    Monitor ranges (GTF): 59-71 Hz V, 31-76 kHz H, max dotclock 170 MHz
    Display Product Name: 'FX2431'
  Extension blocks: 1
Checksum: 0x79

----------------

Block 1, CTA-861 Extension Block:
  Revision: 3
  Underscans IT Video Formats by default
  Basic audio support
  Native detailed modes: 0
  Video Data Block:
    VIC  16:  1920x1080   60.000 Hz  16:9    67.500 kHz 148.500 MHz
    VIC   4:  1280x720    60.000 Hz  16:9    45.000 kHz  74.250 MHz
    VIC   1:   640x480    59.940 Hz   4:3    31.469 kHz  25.175 MHz
  Audio Data Block:
    Linear PCM:
      Max channels: 2
      Supported sample rates (kHz): 48 44.1 32
      Supported sample sizes (bits): 24 20 16
  Speaker Allocation Data Block:
    FL/FR - Front Left/Right
  Vendor-Specific Data Block (HDMI), OUI 00-0C-03:
    Source physical address: 2.0.0.0
    Supports_AI
  Detailed Timing Descriptors:
    DTD 2:  1920x1080   60.000 Hz  16:9    67.500 kHz 148.500 MHz (519 mm x 292 mm)
                 Hfront   88 Hsync  44 Hback 148 Hpol P
                 Vfront    4 Vsync   5 Vback  36 Vpol P
    DTD 3:  1280x720    60.000 Hz  16:9    45.000 kHz  74.250 MHz (519 mm x 292 mm)
                 Hfront  110 Hsync  40 Hback 220 Hpol P
                 Vfront    5 Vsync   5 Vback  20 Vpol P
    DTD 4:   640x480    59.929 Hz   4:3    31.462 kHz  25.170 MHz (432 mm x 324 mm)
                 Hfront   16 Hsync  96 Hback  48 Hpol N
                 Vfront   10 Vsync   2 Vback  33 Vpol N
Checksum: 0x2e

----------------

Warnings:

Block 1, CTA-861 Extension Block:
  Video Data Block: VIC 16 is the preferred timing, overriding the first detailed timings. Is this intended?
  Display Product Serial Number is set, so the Serial Number in the Base EDID should be 0.
  Missing VCDB, needed for Set Selectable RGB Quantization to avoid interop issues.

EDID conformity: PASS
