
EDID (hex):
00ffffffffffff0009d15a7845540000
2a15010380301b782e78c0a55454a027
0d5054a56b8061c0810081c081408180
a9c0b300d1c0023a801871382d40582c
4500dd0c1100001e000000ff00584142
3036323832534c300a20000000fd0032
4c1e5311000a202020202020000000fc
0042656e5120473232323248444c005e

Extracted contents:
header:          00 ff ff ff ff ff ff 00
serial number:   09 d1 5a 78 45 54 00 00 2a 15
version:         01 03
basic params:    80 30 1b 78 2e
chroma info:     78 c0 a5 54 54 a0 27 0d 50 54
established:     a5 6b 80
standard:        61 c0 81 00 81 c0 81 40 81 80 a9 c0 b3 00 d1 c0
descriptor 1:    02 3a 80 18 71 38 2d 40 58 2c 45 00 dd 0c 11 00 00 1e
descriptor 2:    00 00 00 ff 00 58 41 42 30 36 32 38 32 53 4c 30 0a 20
descriptor 3:    00 00 00 fd 00 32 4c 1e 53 11 00 0a 20 20 20 20 20 20
descriptor 4:    00 00 00 fc 00 42 65 6e 51 20 47 32 32 32 32 48 44 4c
extensions:      00
checksum:        5e

EDID version: 1.3
Manufacturer: BNQ Model 785a Serial Number --
Made in week 42 of 2011
Digital display
Maximum image size: 48 cm x 27 cm
Gamma: 2.20
DPMS levels: Off
RGB color display
Default (sRGB) color space is primary color space
First detailed timing is preferred timing
Display x,y Chromaticity:
  Red:   0.6455, 0.3310
  Green: 0.3300, 0.6250
  Blue:  0.1552, 0.0507
  White: 0.3125, 0.3281
Established timings supported:
  720x400@70Hz 9:5 HorFreq: 31469 Hz Clock: 28.320 MHz
  640x480@60Hz 4:3 HorFreq: 31469 Hz Clock: 25.175 MHz
  640x480@75Hz 4:3 HorFreq: 37500 Hz Clock: 31.500 MHz
  800x600@60Hz 4:3 HorFreq: 37900 Hz Clock: 40.000 MHz
  800x600@75Hz 4:3 HorFreq: 46900 Hz Clock: 49.500 MHz
  832x624@75Hz 4:3 HorFreq: 49726 Hz Clock: 57.284 MHz
  1024x768@60Hz 4:3 HorFreq: 48400 Hz Clock: 65.000 MHz
  1024x768@75Hz 4:3 HorFreq: 60000 Hz Clock: 78.750 MHz
  1280x1024@75Hz 5:4 HorFreq: 80000 Hz Clock: 135.000 MHz
  1152x870@75Hz 192:145 HorFreq: 67500 Hz Clock: 108.000 MHz
Standard timings supported:
  1024x576@60Hz 16:9
  1280x800@60Hz 16:10
  1280x720@60Hz 16:9
  1280x960@60Hz 4:3 HorFreq: 60000 Hz Clock: 108.000 MHz
  1280x1024@60Hz 5:4 HorFreq: 64000 Hz Clock: 108.000 MHz
  1600x900@60Hz 16:9
  1680x1050@60Hz 16:10 HorFreq: 64700 Hz Clock: 119.000 MHz
  1920x1080@60Hz 16:9
Detailed mode: Clock 148.500 MHz, 477 mm x 268 mm
               1920 2008 2052 2200 hborder 0
               1080 1084 1089 1125 vborder 0
               +hsync +vsync 
               VertFreq: 60 Hz, HorFreq: 67500 Hz
Serial number: --
Monitor ranges (GTF): 50-76Hz V, 30-83kHz H, max dotclock 170MHz
Checksum: 0x5e (valid)
EDID block does NOT conform to EDID 1.3!
	sRGB is signaled, but the chromaticities do not match
	Name descriptor not terminated with a newline


