edid-decode (hex):

00 ff ff ff ff ff ff 00 06 af 47 14 00 00 00 00
01 10 01 03 80 1e 13 78 0a 87 f5 94 57 4f 8c 27
27 50 54 00 00 00 01 01 01 01 01 01 01 01 01 01
01 01 01 01 01 01 9e 25 a0 40 51 84 0c 30 40 20
33 00 2f bd 10 00 00 19 9e 25 a0 40 51 84 0c 30
40 20 33 00 2f bd 10 00 00 00 00 00 00 fe 00 55
38 30 34 47 00 42 31 34 31 50 57 31 00 00 00 fe
00 29 39 46 4f 6f 8c b3 ff 02 01 0a 20 20 00 f6

----------------

Block 0, Base EDID:
  EDID Structure Version & Revision: 1.3
  Vendor & Product Identification:
    Manufacturer: AUO
    Model: 5191
    Made in: week 1 of 2006
  Basic Display Parameters & Features:
    Digital display
    Maximum image size: 30 cm x 19 cm
    Gamma: 2.20
    RGB color display
    First detailed timing is preferred timing
  Color Characteristics:
    Red  : 0.5800, 0.3398
    Green: 0.3095, 0.5498
    Blue : 0.1552, 0.1552
    White: 0.3134, 0.3291
  Established Timings I & II: none
  Standard Timings: none
  Detailed Timing Descriptors:
    DTD 1:  1440x900    59.996 Hz   8:5    54.716 kHz  96.300 MHz (DE timing only, 303 mm x 189 mm)
                 Hfront   64 Hsync  32 Hback 224 Hpol N
                 Vfront    3 Vsync   3 Vback   6 Vpol N
    DTD 2:  1440x900    59.996 Hz   8:5    54.716 kHz  96.300 MHz (DE timing only, 303 mm x 189 mm)
                 Hfront   64 Hsync  32 Hback 224 Hpol N
                 Vfront    3 Vsync   3 Vback   6 Vpol N
    SPWG Module Revision: 0
    SPWG Descriptor #3:
      SPWG PC Maker P/N: 'U804G'
      SPWG LCD Supplier EEDID Revision: 0
      SPWG Manufacturer P/N: 'B141PW1'
    SPWG Descriptor #4:
      SMBUS Values: 0x29 0x39 0x46 0x4f 0x6f 0x8c 0xb3 0xff
      LVDS Channels: 2
      Panel Self Test Present
Checksum: 0xf6
