edid-decode (hex):

00 ff ff ff ff ff ff 00 26 cd 1d 61 4e 00 00 00
31 1d 01 03 80 34 1d 78 2a af e5 a6 55 51 9b 25
0d 50 54 25 4b 00 d1 c0 81 80 95 00 b3 00 81 40
d1 cf 01 01 01 01 02 3a 80 18 71 38 2d 40 58 2c
45 00 09 25 21 00 00 1e 00 00 00 fd 00 37 4c 1e
55 12 00 0a 20 20 20 20 20 20 00 00 00 ff 00 31
31 33 35 37 56 39 43 30 30 30 37 38 00 00 00 fc
00 50 4c 58 32 34 38 31 48 0a 20 20 20 20 01 30

02 03 1e f1 4b 90 1f 05 14 04 13 11 12 03 02 01
23 09 07 01 83 01 00 00 65 03 0c 00 10 00 8c 0a
d0 8a 20 e0 2d 10 10 3e 96 00 09 25 21 00 00 18
01 1d 00 72 51 d0 1e 20 6e 28 55 00 09 25 21 00
00 1e 8c 0a d0 90 20 40 31 20 0c 40 55 00 09 25
21 00 00 18 2a 44 80 a0 70 38 27 40 30 20 35 00
09 25 21 00 00 1a 00 00 00 00 00 00 00 00 00 00
00 00 00 00 00 00 00 00 00 00 00 00 00 00 00 64

----------------

Block 0, Base EDID:
  EDID Structure Version & Revision: 1.3
  Vendor & Product Identification:
    Manufacturer: IVM
    Model: 24861
    Serial Number: ...
    Made in: week 49 of 2019
  Basic Display Parameters & Features:
    Digital display
    Maximum image size: 52 cm x 29 cm
    Gamma: 2.20
    DPMS levels: Off
    RGB color display
    First detailed timing is the preferred timing
  Color Characteristics:
    Red  : 0.6503, 0.3339
    Green: 0.3193, 0.6083
    Blue : 0.1474, 0.0527
    White: 0.3134, 0.3291
  Established Timings I & II:
    DMT 0x04:   640x480    59.940 Hz   4:3    31.469 kHz  25.175 MHz
    DMT 0x06:   640x480    75.000 Hz   4:3    37.500 kHz  31.500 MHz
    DMT 0x09:   800x600    60.317 Hz   4:3    37.879 kHz  40.000 MHz
    DMT 0x0b:   800x600    75.000 Hz   4:3    46.875 kHz  49.500 MHz
    DMT 0x10:  1024x768    60.004 Hz   4:3    48.363 kHz  65.000 MHz
    DMT 0x12:  1024x768    75.029 Hz   4:3    60.023 kHz  78.750 MHz
    DMT 0x24:  1280x1024   75.025 Hz   5:4    79.976 kHz 135.000 MHz
  Standard Timings:
    DMT 0x52:  1920x1080   60.000 Hz  16:9    67.500 kHz 148.500 MHz
    DMT 0x23:  1280x1024   60.020 Hz   5:4    63.981 kHz 108.000 MHz
    DMT 0x2f:  1440x900    59.887 Hz  16:10   55.935 kHz 106.500 MHz
    DMT 0x3a:  1680x1050   59.954 Hz  16:10   65.290 kHz 146.250 MHz
    DMT 0x20:  1280x960    60.000 Hz   4:3    60.000 kHz 108.000 MHz
    GTF     :  1920x1080   75.000 Hz  16:9    84.600 kHz 220.637 MHz
  Detailed Timing Descriptors:
    DTD 1:  1920x1080   60.000 Hz  16:9    67.500 kHz 148.500 MHz (521 mm x 293 mm)
                 Hfront   88 Hsync  44 Hback 148 Hpol P
                 Vfront    4 Vsync   5 Vback  36 Vpol P
  Display Range Limits:
    Monitor ranges (GTF): 55-76 Hz V, 30-85 kHz H, max dotclock 180 MHz
    Display Product Serial Number: ...
    Display Product Name: 'PLX2481H'
  Extension blocks: 1
Checksum: 0x30

----------------

Block 1, CTA-861 Extension Block:
  Revision: 3
  Underscans IT Video Formats by default
  Basic audio support
  Supports YCbCr 4:4:4
  Supports YCbCr 4:2:2
  Native detailed modes: 1
  Video Data Block:
    VIC  16:  1920x1080   60.000 Hz  16:9    67.500 kHz 148.500 MHz (native)
    VIC  31:  1920x1080   50.000 Hz  16:9    56.250 kHz 148.500 MHz
    VIC   5:  1920x1080i  60.000 Hz  16:9    33.750 kHz  74.250 MHz
    VIC  20:  1920x1080i  50.000 Hz  16:9    28.125 kHz  74.250 MHz
    VIC   4:  1280x720    60.000 Hz  16:9    45.000 kHz  74.250 MHz
    VIC  19:  1280x720    50.000 Hz  16:9    37.500 kHz  74.250 MHz
    VIC  17:   720x576    50.000 Hz   4:3    31.250 kHz  27.000 MHz
    VIC  18:   720x576    50.000 Hz  16:9    31.250 kHz  27.000 MHz
    VIC   3:   720x480    59.940 Hz  16:9    31.469 kHz  27.000 MHz
    VIC   2:   720x480    59.940 Hz   4:3    31.469 kHz  27.000 MHz
    VIC   1:   640x480    59.940 Hz   4:3    31.469 kHz  25.175 MHz
  Audio Data Block:
    Linear PCM:
      Max channels: 2
      Supported sample rates (kHz): 48 44.1 32
      Supported sample sizes (bits): 16
  Speaker Allocation Data Block:
    FL/FR - Front Left/Right
  Vendor-Specific Data Block (HDMI), OUI 00-0C-03:
    Source physical address: 1.0.0.0
  Detailed Timing Descriptors:
    DTD 2:   720x480    59.940 Hz   3:2    31.469 kHz  27.000 MHz (521 mm x 293 mm)
                 Hfront   16 Hsync  62 Hback  60 Hpol N
                 Vfront    9 Vsync   6 Vback  30 Vpol N
    DTD 3:  1280x720    60.000 Hz  16:9    45.000 kHz  74.250 MHz (521 mm x 293 mm)
                 Hfront  110 Hsync  40 Hback 220 Hpol P
                 Vfront    5 Vsync   5 Vback  20 Vpol P
    DTD 4:   720x576    50.000 Hz   5:4    31.250 kHz  27.000 MHz (521 mm x 293 mm)
                 Hfront   12 Hsync  64 Hback  68 Hpol N
                 Vfront    5 Vsync   5 Vback  39 Vpol N
    DTD 5:  1920x1080   74.973 Hz  16:9    83.894 kHz 174.500 MHz (521 mm x 293 mm)
                 Hfront   48 Hsync  32 Hback  80 Hpol P
                 Vfront    3 Vsync   5 Vback  31 Vpol N
Checksum: 0x64

----------------

Warnings:

Block 1, CTA-861 Extension Block:
  Display Product Serial Number is set, so the Serial Number in the Base EDID should be 0.
  Missing VCDB, needed for Set Selectable RGB Quantization to avoid interop issues.
EDID:
  CTA-861: Multiple native progressive timings are defined.

Failures:

EDID:
  Base EDID: Some timings are out of range of the Monitor Ranges:
    Vertical Freq: 50.000 - 75.029 Hz (Monitor: 55.000 - 76.000 Hz)
    Horizontal Freq: 28.125 - 84.600 kHz (Monitor: 30.000 - 85.000 kHz)
    Maximum Clock: 220.637 MHz (Monitor: 180.000 MHz)

EDID conformity: FAIL
