
EDID (hex):
00ffffffffffff004c2d9e0f44484e34
06200104a53c2278228681a954469822
205054bb8c0081c0810081809500a9c0
b30001010101023a801871382d40582c
450056502100001e000000fd0038481e
5111000a202020202020000000fc0043
3237523530780a2020202020000000ff
00483443543230303533374b002000f5

Extracted contents:
header:          00 ff ff ff ff ff ff 00
serial number:   4c 2d 9e 0f 44 48 4e 34 06 20
version:         01 04
basic params:    a5 3c 22 78 22
chroma info:     86 81 a9 54 46 98 22 20 50 54
established:     bb 8c 00
standard:        81 c0 81 00 81 80 95 00 a9 c0 b3 00 01 01 01 01
descriptor 1:    02 3a 80 18 71 38 2d 40 58 2c 45 00 56 50 21 00 00 1e
descriptor 2:    00 00 00 fd 00 38 48 1e 51 11 00 0a 20 20 20 20 20 20
descriptor 3:    00 00 00 fc 00 43 32 37 52 35 30 78 0a 20 20 20 20 20
descriptor 4:    00 00 00 ff 00 48 34 43 54 32 30 30 35 33 37 4b 00 20
extensions:      00
checksum:        f5

EDID version: 1.4
Manufacturer: SAM Model f9e Serial Number --
Made in week 6 of 2022
Digital display
8 bits per primary color channel
DisplayPort interface
Maximum image size: 60 cm x 34 cm
Gamma: 2.20
DPMS levels: Off
Supported color formats: RGB 4:4:4
First detailed timing includes the native pixel format and preferred refresh rate
Display x,y Chromaticity:
  Red:   0.6621, 0.3281
  Green: 0.2744, 0.5957
  Blue:  0.1347, 0.1250
  White: 0.3125, 0.3291
Established timings supported:
  720x400@70Hz 9:5 HorFreq: 31469 Hz Clock: 28.320 MHz
  640x480@60Hz 4:3 HorFreq: 31469 Hz Clock: 25.175 MHz
  640x480@67Hz 4:3 HorFreq: 35000 Hz Clock: 30.240 MHz
  640x480@72Hz 4:3 HorFreq: 37900 Hz Clock: 31.500 MHz
  800x600@56Hz 4:3 HorFreq: 35200 Hz Clock: 36.000 MHz
  800x600@60Hz 4:3 HorFreq: 37900 Hz Clock: 40.000 MHz
  800x600@72Hz 4:3 HorFreq: 48100 Hz Clock: 50.000 MHz
  1024x768@60Hz 4:3 HorFreq: 48400 Hz Clock: 65.000 MHz
  1024x768@70Hz 4:3 HorFreq: 56500 Hz Clock: 75.000 MHz
Standard timings supported:
  1280x720@60Hz 16:9
  1280x800@60Hz 16:10
  1280x1024@60Hz 5:4 HorFreq: 64000 Hz Clock: 108.000 MHz
  1440x900@60Hz 16:10 HorFreq: 55500 Hz Clock: 88.750 MHz
  1600x900@60Hz 16:9
  1680x1050@60Hz 16:10 HorFreq: 64700 Hz Clock: 119.000 MHz
Detailed mode: Clock 148.500 MHz, 598 mm x 336 mm
               1920 2008 2052 2200 hborder 0
               1080 1084 1089 1125 vborder 0
               +hsync +vsync 
               VertFreq: 60 Hz, HorFreq: 67500 Hz
Monitor ranges (GTF): 56-72Hz V, 30-81kHz H, max dotclock 170MHz
Monitor name: C27R50x
Serial number: --
Checksum: 0xf5 (valid)
EDID block does NOT conform to EDID 1.4!
	Detailed block string not properly terminated
