
EDID (hex):
00ffffffffffff0030aeb16700000000
22210104b56d1f783b6485aa5149a724
0e50542dcf80d1c0b300950081808140
810081c00101565e00a0a0a029503020
35003f324100001a000000ff00555050
30334331420a20202020000000fd0030
a5f7f782010a202020202020000000fc
00523435772d33300a202020202002e3
020335f14c5a593f901f131211040302
0123090707830100006d1a0000020330
a50004662c0000e305c000e606050166
6601e200caf8e300a0a0a03250302098
043f324100001a70c200a0a0a0555030
2035003f324100001a0474801871382d
40582c45003f324100001e023a801871
382d40582c45003f324100001e0000a1
70127906000301641fbb0109ff139f00
2f801f009f05330005000700befb0189
ff139f002f803f009f05330005000700
92b80089ff139f002f801f009f053300
0500070044710109ff139f002f801f00
9f05330005000700a2030109ff099f00
2f801f009f0528000200040000000000
0000000000000000000000000000b090

edid-decode (hex):

00 ff ff ff ff ff ff 00 30 ae b1 67 00 00 00 00
22 21 01 04 b5 6d 1f 78 3b 64 85 aa 51 49 a7 24
0e 50 54 2d cf 80 d1 c0 b3 00 95 00 81 80 81 40
81 00 81 c0 01 01 56 5e 00 a0 a0 a0 29 50 30 20
35 00 3f 32 41 00 00 1a 00 00 00 ff 00 55 50 50
30 33 43 31 42 0a 20 20 20 20 00 00 00 fd 00 30
a5 f7 f7 82 01 0a 20 20 20 20 20 20 00 00 00 fc
00 52 34 35 77 2d 33 30 0a 20 20 20 20 20 02 e3

02 03 35 f1 4c 5a 59 3f 90 1f 13 12 11 04 03 02
01 23 09 07 07 83 01 00 00 6d 1a 00 00 02 03 30
a5 00 04 66 2c 00 00 e3 05 c0 00 e6 06 05 01 66
66 01 e2 00 ca f8 e3 00 a0 a0 a0 32 50 30 20 98
04 3f 32 41 00 00 1a 70 c2 00 a0 a0 a0 55 50 30
20 35 00 3f 32 41 00 00 1a 04 74 80 18 71 38 2d
40 58 2c 45 00 3f 32 41 00 00 1e 02 3a 80 18 71
38 2d 40 58 2c 45 00 3f 32 41 00 00 1e 00 00 a1

70 12 79 06 00 03 01 64 1f bb 01 09 ff 13 9f 00
2f 80 1f 00 9f 05 33 00 05 00 07 00 be fb 01 89
ff 13 9f 00 2f 80 3f 00 9f 05 33 00 05 00 07 00
92 b8 00 89 ff 13 9f 00 2f 80 1f 00 9f 05 33 00
05 00 07 00 44 71 01 09 ff 13 9f 00 2f 80 1f 00
9f 05 33 00 05 00 07 00 a2 03 01 09 ff 09 9f 00
2f 80 1f 00 9f 05 28 00 02 00 04 00 00 00 00 00
00 00 00 00 00 00 00 00 00 00 00 00 00 00 b0 90

----------------

Block 0, Base EDID:
  EDID Structure Version & Revision: 1.4
  Vendor & Product Identification:
    Manufacturer: LEN
    Model: 26545
    Made in: week 34 of 2023
  Basic Display Parameters & Features:
    Digital display
    Bits per primary color channel: 10
    DisplayPort interface
    Maximum image size: 109 cm x 31 cm
    Gamma: 2.20
    DPMS levels: Off
    Supported color formats: RGB 4:4:4, YCrCb 4:4:4, YCrCb 4:2:2
    First detailed timing includes the native pixel format and preferred refresh rate
    Display is continuous frequency
  Color Characteristics:
    Red  : 0.6650, 0.3183
    Green: 0.2861, 0.6523
    Blue : 0.1425, 0.0546
    White: 0.3134, 0.3291
  Established Timings I & II:
    DMT 0x04:   640x480    59.940476 Hz   4:3     31.469 kHz     25.175000 MHz
    DMT 0x05:   640x480    72.808802 Hz   4:3     37.861 kHz     31.500000 MHz
    DMT 0x06:   640x480    75.000000 Hz   4:3     37.500 kHz     31.500000 MHz
    DMT 0x09:   800x600    60.316541 Hz   4:3     37.879 kHz     40.000000 MHz
    DMT 0x0a:   800x600    72.187572 Hz   4:3     48.077 kHz     50.000000 MHz
    DMT 0x0b:   800x600    75.000000 Hz   4:3     46.875 kHz     49.500000 MHz
    DMT 0x10:  1024x768    60.003840 Hz   4:3     48.363 kHz     65.000000 MHz
    DMT 0x11:  1024x768    70.069359 Hz   4:3     56.476 kHz     75.000000 MHz
    DMT 0x12:  1024x768    75.028582 Hz   4:3     60.023 kHz     78.750000 MHz
    DMT 0x24:  1280x1024   75.024675 Hz   5:4     79.976 kHz    135.000000 MHz
    Apple   :  1152x870    75.061550 Hz 192:145   68.681 kHz    100.000000 MHz
  Standard Timings:
    DMT 0x52:  1920x1080   60.000000 Hz  16:9     67.500 kHz    148.500000 MHz
    DMT 0x3a:  1680x1050   59.954250 Hz  16:10    65.290 kHz    146.250000 MHz
    DMT 0x2f:  1440x900    59.887445 Hz  16:10    55.935 kHz    106.500000 MHz
    DMT 0x23:  1280x1024   60.019740 Hz   5:4     63.981 kHz    108.000000 MHz
    DMT 0x20:  1280x960    60.000000 Hz   4:3     60.000 kHz    108.000000 MHz
    DMT 0x1c:  1280x800    59.810326 Hz  16:10    49.702 kHz     83.500000 MHz
    DMT 0x55:  1280x720    60.000000 Hz  16:9     45.000 kHz     74.250000 MHz
  Detailed Timing Descriptors:
    DTD 1:  2560x1440   59.950550 Hz  16:9     88.787 kHz    241.500000 MHz (1087 mm x 306 mm)
                 Hfront   48 Hsync  32 Hback   80 Hpol P
                 Vfront    3 Vsync   5 Vback   33 Vpol N
    Display Product Serial Number: 'UPP03C1B'
    Display Range Limits:
      Monitor ranges (Bare Limits): 48-165 Hz V, 247-247 kHz H, max dotclock 1300 MHz
    Display Product Name: 'R45w-30'
  Extension blocks: 2
Checksum: 0xe3

----------------

Block 1, CTA-861 Extension Block:
  Revision: 3
  Underscans IT Video Formats by default
  Basic audio support
  Supports YCbCr 4:4:4
  Supports YCbCr 4:2:2
  Native detailed modes: 1
  Video Data Block:
    VIC  90:  2560x1080   60.000000 Hz  64:27    66.000 kHz    198.000000 MHz
    VIC  89:  2560x1080   50.000000 Hz  64:27    56.250 kHz    185.625000 MHz
    VIC  63:  1920x1080  120.000000 Hz  16:9    135.000 kHz    297.000000 MHz
    VIC  16:  1920x1080   60.000000 Hz  16:9     67.500 kHz    148.500000 MHz (native)
    VIC  31:  1920x1080   50.000000 Hz  16:9     56.250 kHz    148.500000 MHz
    VIC  19:  1280x720    50.000000 Hz  16:9     37.500 kHz     74.250000 MHz
    VIC  18:   720x576    50.000000 Hz  16:9     31.250 kHz     27.000000 MHz
    VIC  17:   720x576    50.000000 Hz   4:3     31.250 kHz     27.000000 MHz
    VIC   4:  1280x720    60.000000 Hz  16:9     45.000 kHz     74.250000 MHz
    VIC   3:   720x480    59.940060 Hz  16:9     31.469 kHz     27.000000 MHz
    VIC   2:   720x480    59.940060 Hz   4:3     31.469 kHz     27.000000 MHz
    VIC   1:   640x480    59.940476 Hz   4:3     31.469 kHz     25.175000 MHz
  Audio Data Block:
    Linear PCM:
      Max channels: 2
      Supported sample rates (kHz): 48 44.1 32
      Supported sample sizes (bits): 24 20 16
  Speaker Allocation Data Block:
    FL/FR - Front Left/Right
  Vendor-Specific Data Block (AMD), OUI 00-00-1A:
    Version: 2.3
    Minimum Refresh Rate: 48 Hz
    Maximum Refresh Rate: 165 Hz
    Flags 1.x: 0x00
    Flags 2.x: 0x04
    Maximum luminance: 102 (455.515 cd/m^2)
    Minimum luminance: 44 (0.136 cd/m^2)
    Maximum luminance (without local dimming): 0 (50.000 cd/m^2)
    Minimum luminance (without local dimming): 0 (0.000 cd/m^2)
  Colorimetry Data Block:
    BT2020YCC
    BT2020RGB
  HDR Static Metadata Data Block:
    Electro optical transfer functions:
      Traditional gamma - SDR luminance range
      SMPTE ST2084
    Supported static metadata descriptors:
      Static metadata type 1
    Desired content max luminance: 102 (455.515 cd/m^2)
    Desired content max frame-average luminance: 102 (455.515 cd/m^2)
    Desired content min luminance: 1 (0.000 cd/m^2)
  Video Capability Data Block:
    YCbCr quantization: Selectable (via AVI YQ)
    RGB quantization: Selectable (via AVI Q)
    PT scan behavior: No Data
    IT scan behavior: Always Underscanned
    CE scan behavior: Always Underscanned
  Detailed Timing Descriptors:
    DTD 2:  2560x1440  143.999210 Hz  16:9    214.559 kHz    583.600000 MHz (1087 mm x 306 mm)
                 Hfront   48 Hsync  32 Hback   80 Hpol P
                 Vfront   25 Vsync   8 Vback   17 Vpol N
    DTD 3:  2560x1440  120.000000 Hz  16:9    183.000 kHz    497.760000 MHz (1087 mm x 306 mm)
                 Hfront   48 Hsync  32 Hback   80 Hpol P
                 Vfront    3 Vsync   5 Vback   77 Vpol N
    DTD 4:  1920x1080  120.000000 Hz  16:9    135.000 kHz    297.000000 MHz (1087 mm x 306 mm)
                 Hfront   88 Hsync  44 Hback  148 Hpol P
                 Vfront    4 Vsync   5 Vback   36 Vpol P
    DTD 5:  1920x1080   60.000000 Hz  16:9     67.500 kHz    148.500000 MHz (1087 mm x 306 mm)
                 Hfront   88 Hsync  44 Hback  148 Hpol P
                 Vfront    4 Vsync   5 Vback   36 Vpol P
Checksum: 0xa1  Unused space in Extension Block: 2 bytes

----------------

Block 2, DisplayID Extension Block:
  Version: 1.2
  Extension Count: 0
  Display Product Type: DIRECT DRIVE monitor
  Video Timing Modes Type 1 - Detailed Timings Data Block:
    DTD:  5120x1440  144.000325 Hz   0:0    214.848 kHz   1134.400000 MHz (aspect reserved, no 3D stereo)
               Hfront   48 Hsync  32 Hback   80 Hpol P
               Vfront    6 Vsync   8 Vback   38 Vpol N
    DTD:  5120x1440  164.999949 Hz   0:0    246.180 kHz   1299.830000 MHz (aspect reserved, no 3D stereo, preferred)
               Hfront   48 Hsync  64 Hback   48 Hpol P
               Vfront    6 Vsync   8 Vback   38 Vpol N
    DTD:  5120x1440   59.980248 Hz   0:0     89.491 kHz    472.510000 MHz (aspect reserved, no 3D stereo, preferred)
               Hfront   48 Hsync  32 Hback   80 Hpol P
               Vfront    6 Vsync   8 Vback   38 Vpol N
    DTD:  5120x1440  119.999848 Hz   0:0    179.040 kHz    945.330000 MHz (aspect reserved, no 3D stereo)
               Hfront   48 Hsync  32 Hback   80 Hpol P
               Vfront    6 Vsync   8 Vback   38 Vpol N
    DTD:  2560x1440  164.999305 Hz   0:0    244.364 kHz    664.670000 MHz (aspect reserved, no 3D stereo)
               Hfront   48 Hsync  32 Hback   80 Hpol P
               Vfront    3 Vsync   5 Vback   33 Vpol N
  Checksum: 0xb0
Checksum: 0x90
