edid-decode (hex):

00 ff ff ff ff ff ff 00 10 ac d7 93 01 00 00 00
24 17 01 03 80 33 1d 78 ee cd 30 a3 55 4f a0 27
11 50 54 00 00 00 01 01 01 01 01 01 01 01 01 01
01 01 01 01 01 01 a2 35 80 a0 70 38 14 40 60 40
84 00 fd 1e 11 00 00 00 00 00 00 fc 00 4f 70 74
69 50 6c 65 78 20 39 30 32 30 00 00 00 fc 00 0a
20 20 20 20 20 20 20 20 20 20 20 20 00 00 00 fc
00 0a 20 20 20 20 20 20 20 20 20 20 20 20 00 2f

----------------

Block 0, Base EDID:
  EDID Structure Version & Revision: 1.3
  Vendor & Product Identification:
    Manufacturer: DEL
    Model: 37847
    Serial Number: ...
    Made in: week 36 of 2013
  Basic Display Parameters & Features:
    Digital display
    Maximum image size: 51 cm x 29 cm
    Gamma: 2.20
    DPMS levels: Standby Suspend Off
    RGB color display
    Default (sRGB) color space is primary color space
    First detailed timing is the preferred timing
  Color Characteristics:
    Red  : 0.6396, 0.3320
    Green: 0.3115, 0.6259
    Blue : 0.1523, 0.0693
    White: 0.3125, 0.3281
  Established Timings I & II: none
  Standard Timings: none
  Detailed Timing Descriptors:
    DTD 1:  1920x1080   60.008741 Hz  16:9     66.010 kHz    137.300000 MHz (analog composite, sync-on-green, 509 mm x 286 mm)
                 Hfront   96 Hsync  64 Hback    0 Hpol N
                 Vfront    8 Vsync   4 Vback    8 Vpol N
    Display Product Name: 'OptiPlex 9020'
    Display Product Name: ''
    Display Product Name: ''
Checksum: 0x2f

----------------

Failures:

Block 0, Base EDID:
  Basic Display Parameters & Features: sRGB is signaled, but the chromaticities do not match.
  Detailed Timing Descriptor #1: 0 or negative horizontal back porch.
  Display Product Name: Empty string.
  Display Product Name: Empty string.
  Missing Display Range Limits Descriptor.

EDID conformity: FAIL
