
EDID (hex):
00ffffffffffff001e6d2977999f0000
041d010380462778ea0595a756519c25
155054256b807140818081c0a9c0b300
d1c08100d1cf565e00a0a0a029503020
3500b9882100001ad97600a0a0a03450
30203500b9882100001a000000fd0038
4b1e7820000a202020202020000000fc
004c47205148440a20202020202001e3
020317f12309070748100403011f1312
2265030c001000000000000000000000
00000000000000000000000000000000
00000000000000000000000000000000
00000000000000000000000000000000
ff003930344e54545131363835370a00
00000000000000000000000000000000
00000000000000000000000000000077

Extracted contents:
header:          00 ff ff ff ff ff ff 00
serial number:   1e 6d 29 77 99 9f 00 00 04 1d
version:         01 03
basic params:    80 46 27 78 ea
chroma info:     05 95 a7 56 51 9c 25 15 50 54
established:     25 6b 80
standard:        71 40 81 80 81 c0 a9 c0 b3 00 d1 c0 81 00 d1 cf
descriptor 1:    56 5e 00 a0 a0 a0 29 50 30 20 35 00 b9 88 21 00 00 1a
descriptor 2:    d9 76 00 a0 a0 a0 34 50 30 20 35 00 b9 88 21 00 00 1a
descriptor 3:    00 00 00 fd 00 38 4b 1e 78 20 00 0a 20 20 20 20 20 20
descriptor 4:    00 00 00 fc 00 4c 47 20 51 48 44 0a 20 20 20 20 20 20
extensions:      01
checksum:        e3

EDID version: 1.3
Manufacturer: GSM Model 7729 Serial Number --
Made in week 4 of 2019
Digital display
Maximum image size: 70 cm x 39 cm
Gamma: 2.20
DPMS levels: Standby Suspend Off
RGB color display
First detailed timing is preferred timing
Display x,y Chromaticity:
  Red:   0.6523, 0.3359
  Green: 0.3173, 0.6103
  Blue:  0.1464, 0.0830
  White: 0.3134, 0.3291
Established timings supported:
  640x480@60Hz 4:3 HorFreq: 31469 Hz Clock: 25.175 MHz
  640x480@75Hz 4:3 HorFreq: 37500 Hz Clock: 31.500 MHz
  800x600@60Hz 4:3 HorFreq: 37900 Hz Clock: 40.000 MHz
  800x600@75Hz 4:3 HorFreq: 46900 Hz Clock: 49.500 MHz
  832x624@75Hz 4:3 HorFreq: 49726 Hz Clock: 57.284 MHz
  1024x768@60Hz 4:3 HorFreq: 48400 Hz Clock: 65.000 MHz
  1024x768@75Hz 4:3 HorFreq: 60000 Hz Clock: 78.750 MHz
  1280x1024@75Hz 5:4 HorFreq: 80000 Hz Clock: 135.000 MHz
  1152x870@75Hz 192:145 HorFreq: 67500 Hz Clock: 108.000 MHz
Standard timings supported:
  1152x864@60Hz 4:3
  1280x1024@60Hz 5:4 HorFreq: 64000 Hz Clock: 108.000 MHz
  1280x720@60Hz 16:9
  1600x900@60Hz 16:9
  1680x1050@60Hz 16:10 HorFreq: 64700 Hz Clock: 119.000 MHz
  1920x1080@60Hz 16:9
  1280x800@60Hz 16:10
  1920x1080@75Hz 16:9
Detailed mode: Clock 241.500 MHz, 697 mm x 392 mm
               2560 2608 2640 2720 hborder 0
               1440 1443 1448 1481 vborder 0
               +hsync -vsync 
               VertFreq: 59 Hz, HorFreq: 88786 Hz
Detailed mode: Clock 304.250 MHz, 697 mm x 392 mm
               2560 2608 2640 2720 hborder 0
               1440 1443 1448 1492 vborder 0
               +hsync -vsync 
               VertFreq: 74 Hz, HorFreq: 111856 Hz
Monitor ranges (GTF): 56-75Hz V, 30-120kHz H, max dotclock 320MHz
Monitor name: LG QHD
Has 1 extension blocks
Checksum: 0xe3 (valid)

CTA extension block
Extension version: 3
19 bytes of CTA data
  Audio data block
    Linear PCM, max channels 2
      Supported sample rates (kHz): 48 44.1 32
      Supported sample sizes (bits): 24 20 16
  Video data block
    VIC  16 1920x1080@60Hz 16:9  HorFreq: 67500 Hz Clock: 148.500 MHz
    VIC   4 1280x720@60Hz 16:9  HorFreq: 45000 Hz Clock: 74.250 MHz
    VIC   3 720x480@60Hz 16:9  HorFreq: 31469 Hz Clock: 27.000 MHz
    VIC   1 640x480@60Hz 4:3  HorFreq: 31469 Hz Clock: 25.175 MHz
    VIC  31 1920x1080@50Hz 16:9  HorFreq: 56250 Hz Clock: 148.500 MHz
    VIC  19 1280x720@50Hz 16:9  HorFreq: 37500 Hz Clock: 74.250 MHz
    VIC  18 720x576@50Hz 16:9  HorFreq: 31250 Hz Clock: 27.000 MHz
    VIC  34 1920x1080@30Hz 16:9  HorFreq: 33750 Hz Clock: 74.250 MHz
  Vendor-specific data block, OUI 000c03 (HDMI)
    Source physical address 1.0.0.0
Underscans PC formats by default
Basic audio support
Supports YCbCr 4:4:4
Supports YCbCr 4:2:2
1 native detailed modes
Checksum: 0x77 (valid)

One or more of the timings is out of range of the Monitor Ranges:
  Vertical Freq: 30 - 75 Hz
  Horizontal Freq: 31250 - 111856 Hz
  Maximum Clock: 304.250 MHz
