edid-decode (hex):

00 ff ff ff ff ff ff 00 41 0c 75 08 03 cb 00 00
1d 15 01 03 68 22 13 78 2a b3 70 a2 55 48 98 27
15 50 54 bf ee 00 31 0a 61 4c 01 01 01 01 01 01
01 01 01 01 01 01 7f 21 56 aa 51 00 1e 30 46 8f
33 00 58 c2 10 00 00 1e 00 00 00 ff 00 46 58 39
31 31 32 39 30 35 31 39 37 31 00 00 00 fc 00 50
68 69 6c 69 70 73 20 31 36 30 45 57 00 00 00 fd
00 38 4c 1e 3c 08 00 0a 20 20 20 20 20 20 00 40

00 ff ff ff ff ff ff 00 41 0c 75 08 03 cb 00 00
1d 15 01 03 68 22 13 78 2a b3 70 a2 55 48 98 27
15 50 54 bf ee 00 31 0a 61 4c 01 01 01 01 01 01
01 01 01 01 01 01 7f 21 56 aa 51 00 1e 30 46 8f
33 00 58 c2 10 00 00 1e 00 00 00 ff 00 46 58 39
31 31 32 39 30 35 31 39 37 31 00 00 00 fc 00 50
68 69 6c 69 70 73 20 31 36 30 45 57 00 00 00 fd
00 38 4c 1e 3c 08 00 0a 20 20 20 20 20 20 00 40

----------------

Block 0, Base EDID:
  EDID Structure Version & Revision: 1.3
  Vendor & Product Identification:
    Manufacturer: PHL
    Model: 2165
    Serial Number: ...
    Made in: week 29 of 2011
  Basic Display Parameters & Features:
    Analog display
    Signal Level Standard: 0.700 : 0.000 : 0.700 V p-p
    Blank level equals black level
    Sync: Separate
    Maximum image size: 34 cm x 19 cm
    Gamma: 2.20
    DPMS levels: Off
    RGB color display
    First detailed timing is the preferred timing
  Color Characteristics:
    Red  : 0.6347, 0.3349
    Green: 0.2812, 0.5966
    Blue : 0.1533, 0.0849
    White: 0.3125, 0.3281
  Established Timings I & II:
    IBM     :   720x400    70.081663 Hz   9:5     31.467 kHz     28.320000 MHz
    DMT 0x04:   640x480    59.940476 Hz   4:3     31.469 kHz     25.175000 MHz
    Apple   :   640x480    66.666667 Hz   4:3     35.000 kHz     30.240000 MHz
    DMT 0x05:   640x480    72.808802 Hz   4:3     37.861 kHz     31.500000 MHz
    DMT 0x06:   640x480    75.000000 Hz   4:3     37.500 kHz     31.500000 MHz
    DMT 0x08:   800x600    56.250000 Hz   4:3     35.156 kHz     36.000000 MHz
    DMT 0x09:   800x600    60.316541 Hz   4:3     37.879 kHz     40.000000 MHz
    DMT 0x0a:   800x600    72.187572 Hz   4:3     48.077 kHz     50.000000 MHz
    DMT 0x0b:   800x600    75.000000 Hz   4:3     46.875 kHz     49.500000 MHz
    Apple   :   832x624    74.551266 Hz   4:3     49.726 kHz     57.284000 MHz
    DMT 0x10:  1024x768    60.003840 Hz   4:3     48.363 kHz     65.000000 MHz
    DMT 0x11:  1024x768    70.069359 Hz   4:3     56.476 kHz     75.000000 MHz
    DMT 0x12:  1024x768    75.028582 Hz   4:3     60.023 kHz     78.750000 MHz
  Standard Timings:
    GTF     :   640x400    70.000000 Hz  16:10    29.190 kHz     23.352000 MHz
    DMT 0x11:  1024x768    70.069359 Hz   4:3     56.476 kHz     75.000000 MHz
  Detailed Timing Descriptors:
    DTD 1:  1366x768    59.964364 Hz 683:384   47.852 kHz     85.750000 MHz (344 mm x 194 mm)
                 Hfront   70 Hsync 143 Hback  213 Hpol P
                 Vfront    3 Vsync   3 Vback   24 Vpol P
    Display Product Serial Number: ...
    Display Product Name: 'Philips 160EW'
    Display Range Limits:
      Monitor ranges (GTF): 56-76 Hz V, 30-60 kHz H, max dotclock 80 MHz
Checksum: 0x40

----------------

Block 1, Unknown EDID Extension Block 0x00:
  00 ff ff ff ff ff ff 00 41 0c 75 08 03 cb 00 00 '........A.u.....'
  1d 15 01 03 68 22 13 78 2a b3 70 a2 55 48 98 27 '....h".x*.p.UH.''
  15 50 54 bf ee 00 31 0a 61 4c 01 01 01 01 01 01 '.PT...1.aL......'
  01 01 01 01 01 01 7f 21 56 aa 51 00 1e 30 46 8f '.......!V.Q..0F.'
  33 00 58 c2 10 00 00 1e 00 00 00 ff 00 46 58 39 '3.X..........FX9'
  31 31 32 39 30 35 31 39 37 31 00 00 00 fc 00 50 '1129051971.....P'
  68 69 6c 69 70 73 20 31 36 30 45 57 00 00 00 fd 'hilips 160EW....'
  00 38 4c 1e 3c 08 00 0a 20 20 20 20 20 20 00 40 '.8L.<...      .@'
Checksum: 0x40

----------------

Warnings:

EDID:
  Base EDID: Some timings are out of range of the Monitor Ranges:
    Horizontal Freq: 29.190 - 60.022 kHz (Monitor: 30.000 - 60.000 kHz)
    Maximum Clock: 85.750 MHz (Monitor: 80.000 MHz)
    Could be due to a Monitor Range off-by-one rounding issue

Failures:

Block 1, Base EDID:
  Unknown Extension Block.
EDID:
  Base EDID: EDID specified 0 extension block(s), but found 1 extension block(s).

EDID conformity: FAIL
