edid-decode (hex):

00 ff ff ff ff ff ff 00 4d 10 63 14 00 00 00 00
14 1a 01 04 a5 23 13 78 06 de 50 a3 54 4c 99 26
0f 50 54 00 00 00 01 01 01 01 01 01 01 01 01 01
01 01 01 01 01 01 66 d0 00 a0 f0 70 3e 80 30 20
35 00 5a c2 10 00 00 18 00 00 00 10 00 00 00 00
00 00 00 00 00 00 00 00 00 00 00 00 00 10 00 00
00 00 00 00 00 00 00 00 00 00 00 00 00 00 00 fe
00 4c 51 31 35 36 44 31 4a 58 30 36 0a 20 00 f8

----------------

Block 0, Base EDID:
  EDID Structure Version & Revision: 1.4
  Vendor & Product Identification:
    Manufacturer: SHP
    Model: 5219
    Made in: week 20 of 2016
  Basic Display Parameters & Features:
    Digital display
    Bits per primary color channel: 8
    DisplayPort interface
    Maximum image size: 35 cm x 19 cm
    Gamma: 2.20
    Supported color formats: RGB 4:4:4
    Default (sRGB) color space is primary color space
    First detailed timing includes the native pixel format and preferred refresh rate
  Color Characteristics:
    Red  : 0.6396, 0.3291
    Green: 0.2998, 0.5996
    Blue : 0.1494, 0.0595
    White: 0.3125, 0.3281
  Established Timings I & II: none
  Standard Timings: none
  Detailed Timing Descriptors:
    DTD 1:  3840x2160   60.025 Hz  16:9   133.375 kHz 533.500 MHz (346 mm x 194 mm)
                 Hfront   48 Hsync  32 Hback  80 Hpol N
                 Vfront    3 Vsync   5 Vback  54 Vpol N
    Dummy Descriptor:
    Dummy Descriptor:
    Alphanumeric Data String: 'LQ156D1JX06'
Checksum: 0xf8

----------------

Failures:

Block 0, Base EDID:
  Basic Display Parameters & Features: sRGB is signaled, but the chromaticities do not match.
  Missing Display Product Name.

EDID conformity: FAIL
