
EDID (hex):
00ffffffffffff006318000000000000
0c1a0103800000000ad7a5a2594a9624
145054a30800d1c0b300810081808140
81c001010101023a801871382d40582c
45003f432100001a662150b051001b30
407036003f432100001e000000fd0032
4c1e5010000a202020202020000000fc
004449474954414c2054560a20200121
020324745090050403070206011f1413
1216111520230907038301000066030c
00300000011d00bc52d01e20b8285540
c48e2100001e011d80d0721c1620102c
2580c48e2100009e8c0ad08a20e02d10
103e9600138e210000188c0ad0902040
31200c405500138e2100001800000000
000000000000000000000000000000e3

Extracted contents:
header:          00 ff ff ff ff ff ff 00
serial number:   63 18 00 00 00 00 00 00 0c 1a
version:         01 03
basic params:    80 00 00 00 0a
chroma info:     d7 a5 a2 59 4a 96 24 14 50 54
established:     a3 08 00
standard:        d1 c0 b3 00 81 00 81 80 81 40 81 c0 01 01 01 01
descriptor 1:    02 3a 80 18 71 38 2d 40 58 2c 45 00 3f 43 21 00 00 1a
descriptor 2:    66 21 50 b0 51 00 1b 30 40 70 36 00 3f 43 21 00 00 1e
descriptor 3:    00 00 00 fd 00 32 4c 1e 50 10 00 0a 20 20 20 20 20 20
descriptor 4:    00 00 00 fc 00 44 49 47 49 54 41 4c 20 54 56 0a 20 20
extensions:      01
checksum:        21

EDID version: 1.3
Manufacturer: XXX Model 0 Serial Number --
Made in week 12 of 2016
Digital display
Image size is variable
Gamma: 1.00
RGB color display
First detailed timing is preferred timing
Display x,y Chromaticity:
  Red:   0.6357, 0.3486
  Green: 0.2900, 0.5888
  Blue:  0.1425, 0.0800
  White: 0.3134, 0.3291
Established timings supported:
  720x400@70Hz 9:5 HorFreq: 31469 Hz Clock: 28.320 MHz
  640x480@60Hz 4:3 HorFreq: 31469 Hz Clock: 25.175 MHz
  800x600@56Hz 4:3 HorFreq: 35200 Hz Clock: 36.000 MHz
  800x600@60Hz 4:3 HorFreq: 37900 Hz Clock: 40.000 MHz
  1024x768@60Hz 4:3 HorFreq: 48400 Hz Clock: 65.000 MHz
Standard timings supported:
  1920x1080@60Hz 16:9
  1680x1050@60Hz 16:10 HorFreq: 64700 Hz Clock: 119.000 MHz
  1280x800@60Hz 16:10
  1280x1024@60Hz 5:4 HorFreq: 64000 Hz Clock: 108.000 MHz
  1280x960@60Hz 4:3 HorFreq: 60000 Hz Clock: 108.000 MHz
  1280x720@60Hz 16:9
Detailed mode: Clock 148.500 MHz, 575 mm x 323 mm
               1920 2008 2052 2200 hborder 0
               1080 1084 1089 1125 vborder 0
               +hsync -vsync 
               VertFreq: 60 Hz, HorFreq: 67500 Hz
Detailed mode: Clock 85.500 MHz, 575 mm x 323 mm
               1360 1424 1536 1792 hborder 0
                768  771  777  795 vborder 0
               +hsync +vsync 
               VertFreq: 60 Hz, HorFreq: 47712 Hz
Monitor ranges (GTF): 50-76Hz V, 30-80kHz H, max dotclock 160MHz
Monitor name: DIGITAL TV
Has 1 extension blocks
Checksum: 0x21 (valid)

CTA extension block
Extension version: 3
32 bytes of CTA data
  Video data block
    VIC  16 1920x1080@60Hz 16:9 (native) HorFreq: 67500 Hz Clock: 148.500 MHz
    VIC   5 1920x1080i@60Hz 16:9  HorFreq: 33750 Hz Clock: 74.250 MHz
    VIC   4 1280x720@60Hz 16:9  HorFreq: 45000 Hz Clock: 74.250 MHz
    VIC   3 720x480@60Hz 16:9  HorFreq: 31469 Hz Clock: 27.000 MHz
    VIC   7 1440x480i@60Hz 16:9  HorFreq: 15734 Hz Clock: 27.000 MHz
    VIC   2 720x480@60Hz 4:3  HorFreq: 31469 Hz Clock: 27.000 MHz
    VIC   6 1440x480i@60Hz 4:3  HorFreq: 15734 Hz Clock: 27.000 MHz
    VIC   1 640x480@60Hz 4:3  HorFreq: 31469 Hz Clock: 25.175 MHz
    VIC  31 1920x1080@50Hz 16:9  HorFreq: 56250 Hz Clock: 148.500 MHz
    VIC  20 1920x1080i@50Hz 16:9  HorFreq: 28125 Hz Clock: 74.250 MHz
    VIC  19 1280x720@50Hz 16:9  HorFreq: 37500 Hz Clock: 74.250 MHz
    VIC  18 720x576@50Hz 16:9  HorFreq: 31250 Hz Clock: 27.000 MHz
    VIC  22 1440x576i@50Hz 16:9  HorFreq: 15625 Hz Clock: 27.000 MHz
    VIC  17 720x576@50Hz 4:3  HorFreq: 31250 Hz Clock: 27.000 MHz
    VIC  21 1440x576i@50Hz 4:3  HorFreq: 15625 Hz Clock: 27.000 MHz
    VIC  32 1920x1080@24Hz 16:9  HorFreq: 27000 Hz Clock: 74.250 MHz
  Audio data block
    Linear PCM, max channels 2
      Supported sample rates (kHz): 48 44.1 32
      Supported sample sizes (bits): 20 16
  Speaker allocation data block
    Speaker map:
      FL/FR - Front Left/Right
  Vendor-specific data block, OUI 000c03 (HDMI)
    Source physical address 3.0.0.0
Basic audio support
Supports YCbCr 4:4:4
Supports YCbCr 4:2:2
4 native detailed modes
Detailed mode: Clock 74.250 MHz, 708 mm x 398 mm
               1280 1720 1760 1980 hborder 0
                720  725  730  750 vborder 0
               +hsync +vsync 
               VertFreq: 50 Hz, HorFreq: 37500 Hz
Detailed mode: Clock 74.250 MHz, 708 mm x 398 mm
               1920 2448 2492 2640 hborder 0
                540  542  547  562 vborder 0
               +hsync +vsync interlaced 
               VertFreq: 50 Hz, HorFreq: 28125 Hz
Detailed mode: Clock 27.000 MHz, 531 mm x 398 mm
                720  736  798  858 hborder 0
                480  489  495  525 vborder 0
               -hsync -vsync 
               VertFreq: 59 Hz, HorFreq: 31468 Hz
Detailed mode: Clock 27.000 MHz, 531 mm x 398 mm
                720  732  796  864 hborder 0
                576  581  586  625 vborder 0
               -hsync -vsync 
               VertFreq: 50 Hz, HorFreq: 31250 Hz
Checksum: 0xe3 (valid)

One or more of the timings is out of range of the Monitor Ranges:
  Vertical Freq: 24 - 70 Hz
  Horizontal Freq: 15625 - 67500 Hz
  Maximum Clock: 148.500 MHz
