edid-decode (hex):

00 ff ff ff ff ff ff 00 63 18 00 00 00 00 00 00
06 16 01 03 80 00 00 00 0a d7 a5 a2 59 4a 96 24
14 50 54 a3 08 00 d1 00 b3 00 81 00 81 80 81 40
81 c0 01 01 01 01 28 3c 80 a0 70 b0 1b 40 40 70
36 00 3f 43 21 00 00 1a 7c 2e 90 b0 61 1a 1b 40
40 70 36 00 3f 43 21 00 00 1e ab 22 a0 a0 50 84
1b 30 20 50 36 00 3f 43 21 00 00 1a 00 00 00 fc
00 41 41 41 0a 20 20 20 20 20 20 20 20 0a 01 8b

02 03 22 71 50 90 05 04 03 07 02 06 01 1f 14 13
12 16 11 15 20 23 09 07 07 68 03 0c 00 10 00 00
00 00 01 1d 00 72 51 d0 1e 20 6e 28 55 00 00 00
00 00 00 1e 8c 0a d0 8a 20 e0 2d 10 10 3e 96 00
00 00 00 00 00 1e 01 1d 80 d0 72 1c 16 20 10 2c
25 80 00 00 00 00 00 9e 01 1d 00 bc 52 d0 1e 20
b8 28 55 40 c4 8e 21 00 00 1e 8c 0a d0 90 20 40
31 20 0c 40 55 00 00 00 00 00 00 1e 00 00 00 79

----------------

Block 0, Base EDID:
  EDID Structure Version & Revision: 1.3
  Vendor & Product Identification:
    Manufacturer: XXX
    Model: 0
    Made in: week 6 of 2012
  Basic Display Parameters & Features:
    Digital display
    Image size is variable
    Gamma: 1.00
    RGB color display
    First detailed timing is preferred timing
  Color Characteristics:
    Red  : 0.6357, 0.3486
    Green: 0.2900, 0.5888
    Blue : 0.1425, 0.0800
    White: 0.3134, 0.3291
  Established Timings I & II:
    IBM     :   720x400    70.082 Hz   9:5    31.467 kHz  28.320 MHz
    DMT 0x04:   640x480    59.940 Hz   4:3    31.469 kHz  25.175 MHz
    DMT 0x08:   800x600    56.250 Hz   4:3    35.156 kHz  36.000 MHz
    DMT 0x09:   800x600    60.317 Hz   4:3    37.879 kHz  40.000 MHz
    DMT 0x10:  1024x768    60.004 Hz   4:3    48.363 kHz  65.000 MHz
  Standard Timings:
    DMT 0x45:  1920x1200   59.885 Hz  16:10   74.556 kHz 193.250 MHz
    DMT 0x3a:  1680x1050   59.954 Hz  16:10   65.290 kHz 146.250 MHz
    DMT 0x1c:  1280x800    59.810 Hz  16:10   49.702 kHz  83.500 MHz
    DMT 0x23:  1280x1024   60.020 Hz   5:4    63.981 kHz 108.000 MHz
    DMT 0x20:  1280x960    60.000 Hz   4:3    60.000 kHz 108.000 MHz
    DMT 0x55:  1280x720    60.000 Hz  16:9    45.000 kHz  74.250 MHz
  Detailed Timing Descriptors:
    DTD 1:  1920x1200   60.341 Hz   8:5    74.038 kHz 154.000 MHz (575 mm x 323 mm)
                 Hfront   64 Hsync 112 Hback -16 Hpol P
                 Vfront    3 Vsync   6 Vback  18 Vpol N
    DTD 2:  1680x1050   52.316 Hz   8:5    56.345 kHz 119.000 MHz (575 mm x 323 mm)
                 Hfront   64 Hsync 112 Hback 256 Hpol P
                 Vfront    3 Vsync   6 Vback  18 Vpol P
    DTD 3:  1440x900    59.837 Hz   8:5    55.469 kHz  88.750 MHz (575 mm x 323 mm)
                 Hfront   32 Hsync  80 Hback  48 Hpol P
                 Vfront    3 Vsync   6 Vback  18 Vpol N
    Display Product Name: 'AAA'
  Extension blocks: 1
Checksum: 0x8b

----------------

Block 1, CTA-861 Extension Block:
  Revision: 3
  Basic audio support
  Supports YCbCr 4:4:4
  Supports YCbCr 4:2:2
  Native detailed modes: 1
  Video Data Block:
    VIC  16:  1920x1080   60.000 Hz  16:9    67.500 kHz 148.500 MHz (native)
    VIC   5:  1920x1080i  60.000 Hz  16:9    33.750 kHz  74.250 MHz
    VIC   4:  1280x720    60.000 Hz  16:9    45.000 kHz  74.250 MHz
    VIC   3:   720x480    59.940 Hz  16:9    31.469 kHz  27.000 MHz
    VIC   7:  1440x480i   59.940 Hz  16:9    15.734 kHz  27.000 MHz
    VIC   2:   720x480    59.940 Hz   4:3    31.469 kHz  27.000 MHz
    VIC   6:  1440x480i   59.940 Hz   4:3    15.734 kHz  27.000 MHz
    VIC   1:   640x480    59.940 Hz   4:3    31.469 kHz  25.175 MHz
    VIC  31:  1920x1080   50.000 Hz  16:9    56.250 kHz 148.500 MHz
    VIC  20:  1920x1080i  50.000 Hz  16:9    28.125 kHz  74.250 MHz
    VIC  19:  1280x720    50.000 Hz  16:9    37.500 kHz  74.250 MHz
    VIC  18:   720x576    50.000 Hz  16:9    31.250 kHz  27.000 MHz
    VIC  22:  1440x576i   50.000 Hz  16:9    15.625 kHz  27.000 MHz
    VIC  17:   720x576    50.000 Hz   4:3    31.250 kHz  27.000 MHz
    VIC  21:  1440x576i   50.000 Hz   4:3    15.625 kHz  27.000 MHz
    VIC  32:  1920x1080   24.000 Hz  16:9    27.000 kHz  74.250 MHz
  Audio Data Block:
    Linear PCM:
      Max channels: 2
      Supported sample rates (kHz): 48 44.1 32
      Supported sample sizes (bits): 24 20 16
  Vendor-Specific Data Block (HDMI), OUI 00-0C-03:
    Source physical address: 1.0.0.0
    Maximum TMDS clock: 0 MHz
  Detailed Timing Descriptors:
    DTD 4:  1280x720    60.000 Hz  16:9    45.000 kHz  74.250 MHz
                 Hfront  110 Hsync  40 Hback 220 Hpol P
                 Vfront    5 Vsync   5 Vback  20 Vpol P
    DTD 5:   720x480    59.940 Hz   3:2    31.469 kHz  27.000 MHz
                 Hfront   16 Hsync  62 Hback  60 Hpol P
                 Vfront    9 Vsync   6 Vback  30 Vpol P
    DTD 6:  1920x1080i  50.000 Hz  16:9    28.125 kHz  74.250 MHz
                 Hfront  528 Hsync  44 Hback 148 Hpol P
                 Vfront    2 Vsync   5 Vback  15 Vpol P Vfront +0.5 Odd Field
                 Vfront    2 Vsync   5 Vback  15 Vpol P Vback  +0.5 Even Field
    DTD 7:  1280x720    50.000 Hz  16:9    37.500 kHz  74.250 MHz (708 mm x 398 mm)
                 Hfront  440 Hsync  40 Hback 220 Hpol P
                 Vfront    5 Vsync   5 Vback  20 Vpol P
    DTD 8:   720x576    50.000 Hz   5:4    31.250 kHz  27.000 MHz
                 Hfront   12 Hsync  64 Hback  68 Hpol P
                 Vfront    5 Vsync   5 Vback  39 Vpol P
Checksum: 0x79

----------------

Failures:

Block 0, Base EDID:
  Detailed Timing Descriptor #1: 0 or negative horizontal back porch.
  Detailed Timing Descriptor #1: Mismatch of image size vs display size: image size is set, but not display size.
  Detailed Timing Descriptor #2: Mismatch of image size vs display size: image size is set, but not display size.
  Detailed Timing Descriptor #3: Mismatch of image size vs display size: image size is set, but not display size.
  Display Product Name: Non-space after newline.
  Missing Display Range Limits Descriptor.
Block 1, CTA-861 Extension Block:
  Detailed Timing Descriptor #7: Mismatch of image size vs display size: image size is set, but not display size.

EDID conformity: FAIL
