edid-decode (hex):

00 ff ff ff ff ff ff 00 05 e3 02 34 85 03 00 00
09 1e 01 04 b5 50 21 78 3f 3e c5 ad 4f 47 a3 26
12 50 54 bf ef 00 d1 c0 b3 00 95 00 81 80 81 c0
31 68 45 68 61 68 e7 7c 70 a0 d0 a0 29 50 30 20
3a 00 1d 4e 31 00 00 1a 4e d4 70 a0 d0 a0 46 50
30 40 3a 00 1d 4e 31 00 00 1c 00 00 00 fc 00 55
33 34 47 32 47 34 52 33 0a 20 20 20 00 00 00 fd
00 30 90 dc dc 50 01 0a 20 20 20 20 20 20 02 57

02 03 2c f1 4e 01 03 05 14 04 13 1f 12 02 11 90
59 5a 5c 23 09 07 07 83 01 00 00 65 03 0c 00 10
00 e3 05 e3 01 e6 06 07 01 53 53 00 d8 59 00 60
a3 38 28 40 a0 10 3a 10 1d 4e 31 00 00 1a f4 b0
00 a0 a0 38 4d 40 30 20 3a 00 1d 4e 31 00 00 1a
02 3a 80 18 71 38 2d 40 58 2c 45 00 1d 4e 31 00
00 1e ef 51 b8 70 62 a0 35 50 80 b8 3a 00 1d 4e
31 00 00 1c 00 00 00 00 00 00 00 00 00 00 00 de

70 12 79 00 00 03 01 28 cf fe 00 04 6f 0d 9f 00
2f 00 3f 00 9f 05 45 00 02 80 09 00 b9 2d 01 04
6f 0d 9f 00 2f 00 3f 00 9f 05 31 00 02 80 09 00
00 00 00 00 00 00 00 00 00 00 00 00 00 00 00 00
00 00 00 00 00 00 00 00 00 00 00 00 00 00 00 00
00 00 00 00 00 00 00 00 00 00 00 00 00 00 00 00
00 00 00 00 00 00 00 00 00 00 00 00 00 00 00 00
00 00 00 00 00 00 00 00 00 00 00 00 00 00 a7 90

----------------

Block 0, Base EDID:
  EDID Structure Version & Revision: 1.4
  Vendor & Product Identification:
    Manufacturer: AOC
    Model: 13314
    Serial Number: ...
    Made in: week 9 of 2020
  Basic Display Parameters & Features:
    Digital display
    Bits per primary color channel: 10
    DisplayPort interface
    Maximum image size: 80 cm x 33 cm
    Gamma: 2.20
    DPMS levels: Off
    Supported color formats: RGB 4:4:4, YCrCb 4:4:4, YCrCb 4:2:2
    Default (sRGB) color space is primary color space
    First detailed timing includes the native pixel format and preferred refresh rate
    Display is continuous frequency
  Color Characteristics:
    Red  : 0.6757, 0.3115
    Green: 0.2802, 0.6386
    Blue : 0.1513, 0.0703
    White: 0.3134, 0.3291
  Established Timings I & II:
    IBM     :   720x400    70.082 Hz   9:5    31.467 kHz  28.320 MHz
    DMT 0x04:   640x480    59.940 Hz   4:3    31.469 kHz  25.175 MHz
    Apple   :   640x480    66.667 Hz   4:3    35.000 kHz  30.240 MHz
    DMT 0x05:   640x480    72.809 Hz   4:3    37.861 kHz  31.500 MHz
    DMT 0x06:   640x480    75.000 Hz   4:3    37.500 kHz  31.500 MHz
    DMT 0x08:   800x600    56.250 Hz   4:3    35.156 kHz  36.000 MHz
    DMT 0x09:   800x600    60.317 Hz   4:3    37.879 kHz  40.000 MHz
    DMT 0x0a:   800x600    72.188 Hz   4:3    48.077 kHz  50.000 MHz
    DMT 0x0b:   800x600    75.000 Hz   4:3    46.875 kHz  49.500 MHz
    Apple   :   832x624    74.551 Hz   4:3    49.726 kHz  57.284 MHz
    DMT 0x10:  1024x768    60.004 Hz   4:3    48.363 kHz  65.000 MHz
    DMT 0x11:  1024x768    70.069 Hz   4:3    56.476 kHz  75.000 MHz
    DMT 0x12:  1024x768    75.029 Hz   4:3    60.023 kHz  78.750 MHz
    DMT 0x24:  1280x1024   75.025 Hz   5:4    79.976 kHz 135.000 MHz
  Standard Timings:
    DMT 0x52:  1920x1080   60.000 Hz  16:9    67.500 kHz 148.500 MHz
    DMT 0x3a:  1680x1050   59.954 Hz  16:10   65.290 kHz 146.250 MHz
    DMT 0x2f:  1440x900    59.887 Hz  16:10   55.935 kHz 106.500 MHz
    DMT 0x23:  1280x1024   60.020 Hz   5:4    63.981 kHz 108.000 MHz
    DMT 0x55:  1280x720    60.000 Hz  16:9    45.000 kHz  74.250 MHz
    CVT     :   640x480    99.769 Hz   4:3    51.082 kHz  42.500 MHz (EDID 1.4 source)
    GTF     :   640x480   100.000 Hz   4:3    50.900 kHz  43.163 MHz (EDID 1.3 source)
    CVT     :   800x600    99.662 Hz   4:3    63.684 kHz  67.250 MHz (EDID 1.4 source)
    GTF     :   800x600   100.000 Hz   4:3    63.600 kHz  68.179 MHz (EDID 1.3 source)
    CVT     :  1024x768    99.972 Hz   4:3    81.577 kHz 112.250 MHz (EDID 1.4 source)
    GTF     :  1024x768   100.000 Hz   4:3    81.400 kHz 113.309 MHz (EDID 1.3 source)
  Detailed Timing Descriptors:
    DTD 1:  3440x1440   59.973 Hz  43:18   88.819 kHz 319.750 MHz (797 mm x 334 mm)
                 Hfront   48 Hsync  32 Hback  80 Hpol P
                 Vfront    3 Vsync  10 Vback  28 Vpol N
    DTD 2:  3440x1440   99.982 Hz  43:18  150.972 kHz 543.500 MHz (797 mm x 334 mm)
                 Hfront   48 Hsync  64 Hback  48 Hpol N
                 Vfront    3 Vsync  10 Vback  57 Vpol P
    Display Product Name: 'U34G2G4R3'
  Display Range Limits:
    Monitor ranges (Bare Limits): 48-144 Hz V, 220-220 kHz H, max dotclock 800 MHz
  Extension blocks: 2
Checksum: 0x57

----------------

Block 1, CTA-861 Extension Block:
  Revision: 3
  Underscans IT Video Formats by default
  Basic audio support
  Supports YCbCr 4:4:4
  Supports YCbCr 4:2:2
  Native detailed modes: 1
  Video Data Block:
    VIC   1:   640x480    59.940 Hz   4:3    31.469 kHz  25.175 MHz
    VIC   3:   720x480    59.940 Hz  16:9    31.469 kHz  27.000 MHz
    VIC   5:  1920x1080i  60.000 Hz  16:9    33.750 kHz  74.250 MHz
    VIC  20:  1920x1080i  50.000 Hz  16:9    28.125 kHz  74.250 MHz
    VIC   4:  1280x720    60.000 Hz  16:9    45.000 kHz  74.250 MHz
    VIC  19:  1280x720    50.000 Hz  16:9    37.500 kHz  74.250 MHz
    VIC  31:  1920x1080   50.000 Hz  16:9    56.250 kHz 148.500 MHz
    VIC  18:   720x576    50.000 Hz  16:9    31.250 kHz  27.000 MHz
    VIC   2:   720x480    59.940 Hz   4:3    31.469 kHz  27.000 MHz
    VIC  17:   720x576    50.000 Hz   4:3    31.250 kHz  27.000 MHz
    VIC  16:  1920x1080   60.000 Hz  16:9    67.500 kHz 148.500 MHz (native)
    VIC  89:  2560x1080   50.000 Hz  64:27   56.250 kHz 185.625 MHz
    VIC  90:  2560x1080   60.000 Hz  64:27   66.000 kHz 198.000 MHz
    VIC  92:  2560x1080  120.000 Hz  64:27  150.000 kHz 495.000 MHz
  Audio Data Block:
    Linear PCM:
      Max channels: 2
      Supported sample rates (kHz): 48 44.1 32
      Supported sample sizes (bits): 24 20 16
  Speaker Allocation Data Block:
    FL/FR - Front Left/Right
  Vendor-Specific Data Block (HDMI), OUI 00-0C-03:
    Source physical address: 1.0.0.0
  Colorimetry Data Block:
    xvYCC601
    xvYCC709
    BT2020cYCC
    BT2020YCC
    BT2020RGB
  HDR Static Metadata Data Block:
    Electro optical transfer functions:
      Traditional gamma - SDR luminance range
      Traditional gamma - HDR luminance range
      SMPTE ST2084
    Supported static metadata descriptors:
      Static metadata type 1
    Desired content max luminance: 83 (301.833 cd/m^2)
    Desired content max frame-average luminance: 83 (301.833 cd/m^2)
    Desired content min luminance: 0 (0.000 cd/m^2)
  Detailed Timing Descriptors:
    DTD 3:  2560x1080   59.976 Hz  64:27   67.173 kHz 230.000 MHz (797 mm x 334 mm)
                 Hfront  160 Hsync 272 Hback 432 Hpol P
                 Vfront    3 Vsync  10 Vback  27 Vpol N
    DTD 4:  2560x1080  143.945 Hz  64:27  166.544 kHz 453.000 MHz (797 mm x 334 mm)
                 Hfront   48 Hsync  32 Hback  80 Hpol P
                 Vfront    3 Vsync  10 Vback  64 Vpol N
    DTD 5:  1920x1080   60.000 Hz  16:9    67.500 kHz 148.500 MHz (797 mm x 334 mm)
                 Hfront   88 Hsync  44 Hback 148 Hpol P
                 Vfront    4 Vsync   5 Vback  36 Vpol P
    DTD 6:  1720x1440   59.936 Hz  43:36   89.484 kHz 209.750 MHz (797 mm x 334 mm)
                 Hfront  128 Hsync 184 Hback 312 Hpol N
                 Vfront    3 Vsync  10 Vback  40 Vpol P
Checksum: 0xde

----------------

Block 2, DisplayID Extension Block:
  Version: 1.2
  Extension Count: 0
  Display Product Type: Extension Section
  Video Timing Modes Type 1 - Detailed Timings Data Block:
    DTD:  3440x1440  120.000 Hz  16:9   181.200 kHz 652.320 MHz (aspect 16:9, no 3D stereo)
               Hfront   48 Hsync  64 Hback  48 Hpol N
               Vfront    3 Vsync  10 Vback  57 Vpol P
    DTD:  3440x1440  144.001 Hz  16:9   214.561 kHz 772.420 MHz (aspect 16:9, no 3D stereo)
               Hfront   48 Hsync  64 Hback  48 Hpol N
               Vfront    3 Vsync  10 Vback  37 Vpol P
  Checksum: 0xa7
Checksum: 0x90

----------------

Warnings:

Block 1, CTA-861 Extension Block:
  Missing VCDB, needed for Set Selectable RGB Quantization to avoid interop issues.
EDID:
  Base EDID: Some timings are out of range of the Monitor Ranges:
    Horizontal Freq: 28.125 - 214.561 kHz (Monitor: 220.000 - 220.000 kHz)

Failures:

Block 0, Base EDID:
  Basic Display Parameters & Features: sRGB is signaled, but the chromaticities do not match.
Block 1, CTA-861 Extension Block:
  Vendor-Specific Data Block (HDMI): The HDMI Specification requires EDID 1.3 instead of 1.4.
Block 2, DisplayID Extension Block:
  DisplayID Base Block has no product type.
EDID:
  Base EDID: GTF timings are used, but the EDID does not signal GTF support.
  Base EDID: CVT timings are used, but the EDID does not signal CVT support.
  CTA-861: Native progressive timings are a mix of several resolutions.
  DisplayID: Missing DisplayID Product Identification Data Block.
  DisplayID: DisplayID expects at least one preferred timing.

EDID conformity: FAIL
