
EDID (hex):
00ffffffffffff0005e37016cb430000
19180103682213782aa2959e59579927
185054a1080001010101010101010101
010101010101662156aa51001e30468f
330058c21000001e662150b051001b30
4070360058c21000001e000000ff0047
435234364941303137333535000000fc
0031363730570a202020202020200086

Extracted contents:
header:          00 ff ff ff ff ff ff 00
serial number:   05 e3 70 16 cb 43 00 00 19 18
version:         01 03
basic params:    68 22 13 78 2a
chroma info:     a2 95 9e 59 57 99 27 18 50 54
established:     a1 08 00
standard:        01 01 01 01 01 01 01 01 01 01 01 01 01 01 01 01
descriptor 1:    66 21 56 aa 51 00 1e 30 46 8f 33 00 58 c2 10 00 00 1e
descriptor 2:    66 21 50 b0 51 00 1b 30 40 70 36 00 58 c2 10 00 00 1e
descriptor 3:    00 00 00 ff 00 47 43 52 34 36 49 41 30 31 37 33 35 35
descriptor 4:    00 00 00 fc 00 31 36 37 30 57 0a 20 20 20 20 20 20 20
extensions:      00
checksum:        86

EDID version: 1.3
Manufacturer: AOC Model 1670 Serial Number --
Made in week 25 of 2014
Analog display, Input voltage level: 0.7/0.7 V
Sync: Separate 
Maximum image size: 34 cm x 19 cm
Gamma: 2.20
DPMS levels: Off
RGB color display
First detailed timing is preferred timing
Display x,y Chromaticity:
  Red:   0.6191, 0.3496
  Green: 0.3398, 0.5996
  Blue:  0.1542, 0.0947
  White: 0.3134, 0.3291
Established timings supported:
  720x400@70Hz 9:5 HorFreq: 31469 Hz Clock: 28.320 MHz
  640x480@60Hz 4:3 HorFreq: 31469 Hz Clock: 25.175 MHz
  800x600@60Hz 4:3 HorFreq: 37900 Hz Clock: 40.000 MHz
  1024x768@60Hz 4:3 HorFreq: 48400 Hz Clock: 65.000 MHz
Standard timings supported:
Detailed mode: Clock 85.500 MHz, 344 mm x 194 mm
               1366 1436 1579 1792 hborder 0
                768  771  774  798 vborder 0
               +hsync +vsync 
               VertFreq: 59 Hz, HorFreq: 47712 Hz
Detailed mode: Clock 85.500 MHz, 344 mm x 194 mm
               1360 1424 1536 1792 hborder 0
                768  771  777  795 vborder 0
               +hsync +vsync 
               VertFreq: 60 Hz, HorFreq: 47712 Hz
Serial number: --
Monitor name: 1670W
Checksum: 0x86 (valid)
EDID block does NOT conform to EDID 1.3!
	Missing monitor ranges
