edid-decode (hex):

00 ff ff ff ff ff ff 00 05 e3 70 16 56 19 00 00
27 1d 01 03 68 22 13 78 2a a2 95 9e 59 57 99 27
18 50 54 a1 08 00 01 01 01 01 01 01 01 01 01 01
01 01 01 01 01 01 66 21 56 aa 51 00 1e 30 46 8f
33 00 58 c2 10 00 00 1e 66 21 50 b0 51 00 1b 30
40 70 36 00 58 c2 10 00 00 1e 00 00 00 ff 00 4b
51 55 4a 39 58 41 30 30 36 34 38 36 00 00 00 fc
00 31 36 37 30 57 0a 20 20 20 20 20 20 20 00 d2

00 ff ff ff ff ff ff 00 05 e3 70 16 56 19 00 00
27 1d 01 03 68 22 13 78 2a a2 95 9e 59 57 99 27
18 50 54 a1 08 00 01 01 01 01 01 01 01 01 01 01
01 01 01 01 01 01 66 21 56 aa 51 00 1e 30 46 8f
33 00 58 c2 10 00 00 1e 66 21 50 b0 51 00 1b 30
40 70 36 00 58 c2 10 00 00 1e 00 00 00 ff 00 4b
51 55 4a 39 58 41 30 30 36 34 38 36 00 00 00 fc
00 31 36 37 30 57 0a 20 20 20 20 20 20 20 00 d2

----------------

Block 0, Base EDID:
  EDID Structure Version & Revision: 1.3
  Vendor & Product Identification:
    Manufacturer: AOC
    Model: 5744
    Serial Number: ...
    Made in: week 39 of 2019
  Basic Display Parameters & Features:
    Analog display
    Signal Level Standard: 0.700 : 0.000 : 0.700 V p-p
    Blank level equals black level
    Sync: Separate
    Maximum image size: 34 cm x 19 cm
    Gamma: 2.20
    DPMS levels: Off
    RGB color display
    First detailed timing is the preferred timing
  Color Characteristics:
    Red  : 0.6191, 0.3496
    Green: 0.3398, 0.5996
    Blue : 0.1542, 0.0947
    White: 0.3134, 0.3291
  Established Timings I & II:
    IBM     :   720x400    70.081663 Hz   9:5     31.467 kHz     28.320000 MHz
    DMT 0x04:   640x480    59.940476 Hz   4:3     31.469 kHz     25.175000 MHz
    DMT 0x09:   800x600    60.316541 Hz   4:3     37.879 kHz     40.000000 MHz
    DMT 0x10:  1024x768    60.003840 Hz   4:3     48.363 kHz     65.000000 MHz
  Standard Timings: none
  Detailed Timing Descriptors:
    DTD 1:  1366x768    59.789541 Hz 683:384   47.712 kHz     85.500000 MHz (344 mm x 194 mm)
                 Hfront   70 Hsync 143 Hback  213 Hpol P
                 Vfront    3 Vsync   3 Vback   24 Vpol P
    DTD 2:  1360x768    60.015162 Hz  85:48    47.712 kHz     85.500000 MHz (344 mm x 194 mm)
                 Hfront   64 Hsync 112 Hback  256 Hpol P
                 Vfront    3 Vsync   6 Vback   18 Vpol P
    Display Product Serial Number: ...
    Display Product Name: '1670W'
Checksum: 0xd2

----------------

Block 1, Unknown EDID Extension Block 0x00:
  00 ff ff ff ff ff ff 00 05 e3 70 16 56 19 00 00 '..........p.V...'
  27 1d 01 03 68 22 13 78 2a a2 95 9e 59 57 99 27 ''...h".x*...YW.''
  18 50 54 a1 08 00 01 01 01 01 01 01 01 01 01 01 '.PT.............'
  01 01 01 01 01 01 66 21 56 aa 51 00 1e 30 46 8f '......f!V.Q..0F.'
  33 00 58 c2 10 00 00 1e 66 21 50 b0 51 00 1b 30 '3.X.....f!P.Q..0'
  40 70 36 00 58 c2 10 00 00 1e 00 00 00 ff 00 4b '@p6.X..........K'
  51 55 4a 39 58 41 30 30 36 34 38 36 00 00 00 fc 'QUJ9XA006486....'
  00 31 36 37 30 57 0a 20 20 20 20 20 20 20 00 d2 '.1670W.       ..'
Checksum: 0xd2

----------------

Failures:

Block 0, Base EDID:
  Missing Display Range Limits Descriptor.
Block 1, Base EDID:
  Unknown Extension Block.
EDID:
  Base EDID: EDID specified 0 extension block(s), but found 1 extension block(s).

EDID conformity: FAIL
