
EDID (hex):
00ffffffffffff002a59560101000000
241d0103801e1a782abe95ae5045a726
0f5054210800d1c0b300950081808140
81c03b800101023a801871382d40582c
45002c041100001e662156aa51001e30
468f3300c4fe1000001e000000fd0038
3f1e5311000a202020202020000000fc
0048444d490a2020202020202020019b
020316f1430102032309070783010000
65030c0010008c0ad08a20e02d10103e
96000f2821000018011d007251d01e20
6e2855000f282100001e8c0ad08a20e0
2d10103e96000f28210000188c0ad090
204031200c4055000f28210000180000
00000000000000000000000000000000
0000000000000000000000000000005f

Extracted contents:
header:          00 ff ff ff ff ff ff 00
serial number:   2a 59 56 01 01 00 00 00 24 1d
version:         01 03
basic params:    80 1e 1a 78 2a
chroma info:     be 95 ae 50 45 a7 26 0f 50 54
established:     21 08 00
standard:        d1 c0 b3 00 95 00 81 80 81 40 81 c0 3b 80 01 01
descriptor 1:    02 3a 80 18 71 38 2d 40 58 2c 45 00 2c 04 11 00 00 1e
descriptor 2:    66 21 56 aa 51 00 1e 30 46 8f 33 00 c4 fe 10 00 00 1e
descriptor 3:    00 00 00 fd 00 38 3f 1e 53 11 00 0a 20 20 20 20 20 20
descriptor 4:    00 00 00 fc 00 48 44 4d 49 0a 20 20 20 20 20 20 20 20
extensions:      01
checksum:        9b

EDID version: 1.3
Manufacturer: JRY Model 156 Serial Number --
Made in week 36 of 2019
Digital display
Maximum image size: 30 cm x 26 cm
Gamma: 2.20
DPMS levels: Off
RGB color display
First detailed timing is preferred timing
Display x,y Chromaticity:
  Red:   0.6816, 0.3154
  Green: 0.2724, 0.6542
  Blue:  0.1503, 0.0595
  White: 0.3134, 0.3291
Established timings supported:
  640x480@60Hz 4:3 HorFreq: 31469 Hz Clock: 25.175 MHz
  800x600@60Hz 4:3 HorFreq: 37900 Hz Clock: 40.000 MHz
  1024x768@60Hz 4:3 HorFreq: 48400 Hz Clock: 65.000 MHz
Standard timings supported:
  1920x1080@60Hz 16:9
  1680x1050@60Hz 16:10 HorFreq: 64700 Hz Clock: 119.000 MHz
  1440x900@60Hz 16:10 HorFreq: 55500 Hz Clock: 88.750 MHz
  1280x1024@60Hz 5:4 HorFreq: 64000 Hz Clock: 108.000 MHz
  1280x960@60Hz 4:3 HorFreq: 60000 Hz Clock: 108.000 MHz
  1280x720@60Hz 16:9
  720x576@60Hz 5:4
Detailed mode: Clock 148.500 MHz, 300 mm x 260 mm
               1920 2008 2052 2200 hborder 0
               1080 1084 1089 1125 vborder 0
               +hsync +vsync 
               VertFreq: 60 Hz, HorFreq: 67500 Hz
Detailed mode: Clock 85.500 MHz, 452 mm x 254 mm
               1366 1436 1579 1792 hborder 0
                768  771  774  798 vborder 0
               +hsync +vsync 
               VertFreq: 59 Hz, HorFreq: 47712 Hz
Monitor ranges (GTF): 56-63Hz V, 30-83kHz H, max dotclock 170MHz
Monitor name: HDMI
Has 1 extension blocks
Checksum: 0x9b (valid)

CTA extension block
Extension version: 3
18 bytes of CTA data
  Video data block
    VIC   1 640x480@60Hz 4:3  HorFreq: 31469 Hz Clock: 25.175 MHz
    VIC   2 720x480@60Hz 4:3  HorFreq: 31469 Hz Clock: 27.000 MHz
    VIC   3 720x480@60Hz 16:9  HorFreq: 31469 Hz Clock: 27.000 MHz
  Audio data block
    Linear PCM, max channels 2
      Supported sample rates (kHz): 48 44.1 32
      Supported sample sizes (bits): 24 20 16
  Speaker allocation data block
    Speaker map:
      FL/FR - Front Left/Right
  Vendor-specific data block, OUI 000c03 (HDMI)
    Source physical address 1.0.0.0
Underscans PC formats by default
Basic audio support
Supports YCbCr 4:4:4
Supports YCbCr 4:2:2
1 native detailed modes
Detailed mode: Clock 27.000 MHz, 527 mm x 296 mm
                720  736  798  858 hborder 0
                480  489  495  525 vborder 0
               -hsync -vsync 
               VertFreq: 59 Hz, HorFreq: 31468 Hz
Detailed mode: Clock 74.250 MHz, 527 mm x 296 mm
               1280 1390 1430 1650 hborder 0
                720  725  730  750 vborder 0
               +hsync +vsync 
               VertFreq: 60 Hz, HorFreq: 45000 Hz
Detailed mode: Clock 27.000 MHz, 527 mm x 296 mm
                720  736  798  858 hborder 0
                480  489  495  525 vborder 0
               -hsync -vsync 
               VertFreq: 59 Hz, HorFreq: 31468 Hz
Detailed mode: Clock 27.000 MHz, 527 mm x 296 mm
                720  732  796  864 hborder 0
                576  581  586  625 vborder 0
               -hsync -vsync 
               VertFreq: 50 Hz, HorFreq: 31250 Hz
Checksum: 0x5f (valid)

One or more of the timings is out of range of the Monitor Ranges:
  Vertical Freq: 50 - 60 Hz
  Horizontal Freq: 31250 - 67500 Hz
  Maximum Clock: 148.500 MHz
