edid-decode (hex):

00 ff ff ff ff ff ff 00 22 f0 20 30 01 01 01 01
10 16 01 04 68 34 20 78 ee 01 f5 a2 57 52 9f 27
0a 50 54 21 08 00 81 40 81 80 95 00 a9 40 b3 00
d1 c0 01 01 01 01 7d 4b 80 a0 72 b0 2d 40 88 c8
36 00 06 44 21 00 00 1c 00 00 00 fd 00 32 3f 18
4c 14 00 0a 20 20 20 20 20 20 00 00 00 fc 00 48
50 20 4c 41 32 34 30 35 78 0a 20 20 00 00 00 ff
00 43 4e 34 32 31 36 30 43 48 36 0a 20 20 00 53

----------------

Block 0, Base EDID:
  EDID Structure Version & Revision: 1.4
  Vendor & Product Identification:
    Manufacturer: HWP
    Model: 12320
    Serial Number: ...
    Made in: week 16 of 2012
  Basic Display Parameters & Features:
    Analog display
    Input voltage level: 0.7/0.7 V
    Blank level equals black level
    Sync: Separate
    Maximum image size: 52 cm x 32 cm
    Gamma: 2.20
    DPMS levels: Standby Suspend Off
    RGB color display
    Default (sRGB) color space is primary color space
    First detailed timing includes the native pixel format and preferred refresh rate
  Color Characteristics:
    Red  : 0.6328, 0.3398
    Green: 0.3203, 0.6220
    Blue : 0.1552, 0.0419
    White: 0.3134, 0.3291
  Established Timings I & II:
    DMT 0x04:   640x480    59.940 Hz   4:3    31.469 kHz  25.175 MHz
    DMT 0x09:   800x600    60.317 Hz   4:3    37.879 kHz  40.000 MHz
    DMT 0x10:  1024x768    60.004 Hz   4:3    48.363 kHz  65.000 MHz
  Standard Timings:
    DMT 0x20:  1280x960    60.000 Hz   4:3    60.000 kHz 108.000 MHz
    DMT 0x23:  1280x1024   60.020 Hz   5:4    63.981 kHz 108.000 MHz
    DMT 0x2f:  1440x900    59.887 Hz  16:10   55.935 kHz 106.500 MHz
    DMT 0x33:  1600x1200   60.000 Hz   4:3    75.000 kHz 162.000 MHz
    DMT 0x3a:  1680x1050   59.954 Hz  16:10   65.290 kHz 146.250 MHz
    DMT 0x52:  1920x1080   60.000 Hz  16:9    67.500 kHz 148.500 MHz
  Detailed Timing Descriptors:
    DTD 1:  1920x1200   59.885 Hz   8:5    74.556 kHz 193.250 MHz (518 mm x 324 mm)
                 Hfront  136 Hsync 200 Hback 336 Hpol N
                 Vfront    3 Vsync   6 Vback  36 Vpol P
  Display Range Limits:
    Monitor ranges (GTF): 50-63 Hz V, 24-76 kHz H, max dotclock 200 MHz
    Display Product Name: 'HP LA2405x'
    Display Product Serial Number: ...
Checksum: 0x53

----------------

Failures:

Block 0, Base EDID:
  Basic Display Parameters & Features: sRGB is signaled, but the chromaticities do not match.
  Display Range Limits: GTF can't be combined with non-continuous frequencies.

EDID conformity: FAIL
