edid-decode (hex):

00 ff ff ff ff ff ff 00 30 f0 57 06 00 00 00 00
00 00 01 03 80 1e 16 78 0a 72 b0 96 57 52 87 28
23 50 54 00 00 00 01 01 01 01 01 01 01 01 01 01
01 01 01 01 01 01 64 19 00 40 41 00 26 30 18 88
36 00 30 e4 10 00 00 18 00 00 00 00 00 00 00 00
00 00 00 00 00 00 00 00 00 00 00 00 00 00 00 4c
47 50 68 69 6c 69 70 73 4c 43 44 0a 00 00 00 00
00 4c 50 31 35 30 58 30 38 2d 41 33 0a 0a 00 12

----------------

Block 0, Base EDID:
  EDID Structure Version & Revision: 1.3
  Vendor & Product Identification:
    Manufacturer: LGP
    Model: 1623
    Made in: 1990
  Basic Display Parameters & Features:
    Digital display
    Maximum image size: 30 cm x 22 cm
    Gamma: 2.20
    RGB color display
    First detailed timing is preferred timing
  Color Characteristics:
    Red  : 0.5869, 0.3427
    Green: 0.3203, 0.5292
    Blue : 0.1582, 0.1396
    White: 0.3125, 0.3281
  Established Timings I & II: none
  Standard Timings: none
  Detailed Timing Descriptors:
    DTD 1:  1024x768    60.004 Hz   4:3    48.363 kHz  65.000 MHz (304 mm x 228 mm)
                 Hfront   24 Hsync 136 Hback 160 Hpol N
                 Vfront    3 Vsync   6 Vback  29 Vpol N
    Empty Descriptor
    Manufacturer-Specified Display Descriptor (0x00): 00 00 00 4c 47 50 68 69 6c 69 70 73 4c 43 44 0a '...LGPhilipsLCD.'
    Manufacturer-Specified Display Descriptor (0x00): 00 00 00 4c 50 31 35 30 58 30 38 2d 41 33 0a 0a '...LP150X08-A3..'
Checksum: 0x12
