
EDID (hex):
00ffffffffffff0030e4ac0100000000
00120103802115780aba959759558c27
21505400000001010101010101010101
010101010101121b0080502014301820
44004bcf100000180000000000000000
00000000000000000000000000fe004c
4720446973706c61790a2020000000fe
004c503135345758372d544c4233008f

Extracted contents:
header:          00 ff ff ff ff ff ff 00
serial number:   30 e4 ac 01 00 00 00 00 00 12
version:         01 03
basic params:    80 21 15 78 0a
chroma info:     ba 95 97 59 55 8c 27 21 50 54
established:     00 00 00
standard:        01 01 01 01 01 01 01 01 01 01 01 01 01 01 01 01
descriptor 1:    12 1b 00 80 50 20 14 30 18 20 44 00 4b cf 10 00 00 18
descriptor 2:    00 00 00 00 00 00 00 00 00 00 00 00 00 00 00 00 00 00
descriptor 3:    00 00 00 fe 00 4c 47 20 44 69 73 70 6c 61 79 0a 20 20
descriptor 4:    00 00 00 fe 00 4c 50 31 35 34 57 58 37 2d 54 4c 42 33
extensions:      00
checksum:        8f

EDID version: 1.3
Manufacturer: LGD Model 1ac Serial Number --
Made in year 2008
Digital display
Maximum image size: 33 cm x 21 cm
Gamma: 2.20
RGB color display
First detailed timing is preferred timing
Display x,y Chromaticity:
  Red:   0.5917, 0.3505
  Green: 0.3339, 0.5488
  Blue:  0.1542, 0.1298
  White: 0.3134, 0.3291
Established timings supported:
Standard timings supported:
Detailed mode: Clock 69.300 MHz, 331 mm x 207 mm
               1280 1304 1336 1408 hborder 0
                800  804  808  820 vborder 0
               -hsync -vsync 
               VertFreq: 60 Hz, HorFreq: 49218 Hz
Manufacturer-specified data, tag 0
ASCII string: LG Display
ASCII string: LP154WX7-TLB3
Checksum: 0x8f (valid)
EDID block does NOT conform to EDID 1.3!
	Missing name descriptor
	Missing monitor ranges
