edid-decode (hex):

00 ff ff ff ff ff ff 00 22 f0 11 42 01 00 00 00
19 16 01 03 80 33 1d 78 0a 0c b0 a2 57 51 9f 27
0a 50 54 00 00 00 01 01 01 01 01 01 01 01 01 01
01 01 01 01 01 01 9d 34 80 64 70 38 1f 40 30 20
26 00 fe 1f 11 00 00 18 00 00 00 fe 00 56 30 36
0a 20 20 20 20 20 20 20 20 20 00 00 00 fc 00 48
50 51 20 38 33 30 30 20 41 69 4f 0a 00 00 00 fe
00 4c 54 4d 32 33 30 48 54 31 30 48 30 32 00 1b

----------------

Block 0, Base EDID:
  EDID Structure Version & Revision: 1.3
  Vendor & Product Identification:
    Manufacturer: HWP
    Model: 16913
    Serial Number: ...
    Made in: week 25 of 2012
  Basic Display Parameters & Features:
    Digital display
    Maximum image size: 51 cm x 29 cm
    Gamma: 2.20
    RGB color display
    First detailed timing is preferred timing
  Color Characteristics:
    Red  : 0.6328, 0.3398
    Green: 0.3193, 0.6210
    Blue : 0.1542, 0.0419
    White: 0.3125, 0.3281
  Established Timings I & II: none
  Standard Timings: none
  Detailed Timing Descriptors:
    DTD 1:  1920x1080   60.016 Hz  16:9    66.678 kHz 134.690 MHz (510 mm x 287 mm)
                 Hfront   48 Hsync  32 Hback  20 Hpol N
                 Vfront    2 Vsync   6 Vback  23 Vpol N
    Alphanumeric Data String: 'V06'
    Display Product Name: 'HPQ 8300 AiO'
    Alphanumeric Data String: 'LTM230HT10H02'
Checksum: 0x1b

----------------

Failures:

Block 0, Base EDID:
  Missing Display Range Limits Descriptor.

EDID conformity: FAIL
