edid-decode (hex):

00 ff ff ff ff ff ff 00 22 f0 11 42 01 00 00 00
01 17 01 03 80 33 1d 78 ee b1 c4 a3 56 4f 9e 27
0f 50 54 a1 08 00 b3 00 81 c0 a9 c0 d1 c0 81 80
a9 40 95 00 01 01 02 3a 80 18 71 38 2d 40 58 2c
45 00 fe 1f 11 00 00 1e 00 00 00 fd 00 2f 4b 40
53 14 00 0a 20 20 20 20 20 20 00 00 00 fc 00 48
50 20 54 6f 75 63 68 53 6d 61 72 74 00 00 00 ff
00 31 0a 20 20 20 20 20 20 20 20 20 20 20 00 c2

00 ff ff ff ff ff ff 00 22 f0 11 42 01 00 00 00
01 17 01 03 80 33 1d 78 ee b1 c4 a3 56 4f 9e 27
0f 50 54 a1 08 00 b3 00 81 c0 a9 c0 d1 c0 81 80
a9 40 95 00 01 01 02 3a 80 18 71 38 2d 40 58 2c
45 00 fe 1f 11 00 00 1e 00 00 00 fd 00 2f 4b 40
53 14 00 0a 20 20 20 20 20 20 00 00 00 fc 00 48
50 20 54 6f 75 63 68 53 6d 61 72 74 00 00 00 ff
00 31 0a 20 20 20 20 20 20 20 20 20 20 20 00 c2

----------------

Block 0, Base EDID:
  EDID Structure Version & Revision: 1.3
  Vendor & Product Identification:
    Manufacturer: HWP
    Model: 16913
    Serial Number: ...
    Made in: week 1 of 2013
  Basic Display Parameters & Features:
    Digital display
    Maximum image size: 51 cm x 29 cm
    Gamma: 2.20
    DPMS levels: Standby Suspend Off
    RGB color display
    Default (sRGB) color space is primary color space
    First detailed timing is the preferred timing
  Color Characteristics:
    Red  : 0.6386, 0.3388
    Green: 0.3085, 0.6181
    Blue : 0.1552, 0.0585
    White: 0.3134, 0.3281
  Established Timings I & II:
    IBM     :   720x400    70.081663 Hz   9:5     31.467 kHz     28.320000 MHz
    DMT 0x04:   640x480    59.940476 Hz   4:3     31.469 kHz     25.175000 MHz
    DMT 0x09:   800x600    60.316541 Hz   4:3     37.879 kHz     40.000000 MHz
    DMT 0x10:  1024x768    60.003840 Hz   4:3     48.363 kHz     65.000000 MHz
  Standard Timings:
    DMT 0x3a:  1680x1050   59.954250 Hz  16:10    65.290 kHz    146.250000 MHz
    DMT 0x55:  1280x720    60.000000 Hz  16:9     45.000 kHz     74.250000 MHz
    DMT 0x53:  1600x900    60.000000 Hz  16:9     60.000 kHz    108.000000 MHz (RB)
    DMT 0x52:  1920x1080   60.000000 Hz  16:9     67.500 kHz    148.500000 MHz
    DMT 0x23:  1280x1024   60.019740 Hz   5:4     63.981 kHz    108.000000 MHz
    DMT 0x33:  1600x1200   60.000000 Hz   4:3     75.000 kHz    162.000000 MHz
    DMT 0x2f:  1440x900    59.887445 Hz  16:10    55.935 kHz    106.500000 MHz
  Detailed Timing Descriptors:
    DTD 1:  1920x1080   60.000000 Hz  16:9     67.500 kHz    148.500000 MHz (510 mm x 287 mm)
                 Hfront   88 Hsync  44 Hback  148 Hpol P
                 Vfront    4 Vsync   5 Vback   36 Vpol P
    Display Range Limits:
      Monitor ranges (GTF): 47-75 Hz V, 64-83 kHz H, max dotclock 200 MHz
    Display Product Name: 'HP TouchSmart'
    Display Product Serial Number: ...
Checksum: 0xc2

----------------

Block 1, Unknown EDID Extension Block 0x00:
  00 ff ff ff ff ff ff 00 22 f0 11 42 01 00 00 00 '........"..B....'
  01 17 01 03 80 33 1d 78 ee b1 c4 a3 56 4f 9e 27 '.....3.x....VO.''
  0f 50 54 a1 08 00 b3 00 81 c0 a9 c0 d1 c0 81 80 '.PT.............'
  a9 40 95 00 01 01 02 3a 80 18 71 38 2d 40 58 2c '.@.....:..q8-@X,'
  45 00 fe 1f 11 00 00 1e 00 00 00 fd 00 2f 4b 40 'E............/K@'
  53 14 00 0a 20 20 20 20 20 20 00 00 00 fc 00 48 'S...      .....H'
  50 20 54 6f 75 63 68 53 6d 61 72 74 00 00 00 ff 'P TouchSmart....'
  00 31 0a 20 20 20 20 20 20 20 20 20 20 20 00 c2 '.1.           ..'
Checksum: 0xc2

----------------

Failures:

Block 0, Base EDID:
  Basic Display Parameters & Features: sRGB is signaled, but the chromaticities do not match.
Block 1, Base EDID:
  Unknown Extension Block.
EDID:
  Base EDID: Some timings are out of range of the Monitor Ranges:
    Horizontal Freq: 31.466 - 75.000 kHz (Monitor: 64.000 - 83.000 kHz)
  Base EDID: EDID specified 0 extension block(s), but found 1 extension block(s).

EDID conformity: FAIL
