
EDID (hex):
00ffffffffffff0022f0114201000000
3014010380331d78eeee20a356519e27
0b505400000001010101010101010101
0101010101019d34806470381f401e14
3500fd1e11000000000000fc00485020
546f756368536d617274000000fc000a
202020202020202020202020000000fc
000a202020202020202020202020002d

Extracted contents:
header:          00 ff ff ff ff ff ff 00
serial number:   22 f0 11 42 01 00 00 00 30 14
version:         01 03
basic params:    80 33 1d 78 ee
chroma info:     ee 20 a3 56 51 9e 27 0b 50 54
established:     00 00 00
standard:        01 01 01 01 01 01 01 01 01 01 01 01 01 01 01 01
descriptor 1:    9d 34 80 64 70 38 1f 40 1e 14 35 00 fd 1e 11 00 00 00
descriptor 2:    00 00 00 fc 00 48 50 20 54 6f 75 63 68 53 6d 61 72 74
descriptor 3:    00 00 00 fc 00 0a 20 20 20 20 20 20 20 20 20 20 20 20
descriptor 4:    00 00 00 fc 00 0a 20 20 20 20 20 20 20 20 20 20 20 20
extensions:      00
checksum:        2d

EDID version: 1.3
Manufacturer: HWP Model 4211 Serial Number --
Made in week 48 of 2010
Digital display
Maximum image size: 51 cm x 29 cm
Gamma: 2.20
DPMS levels: Standby Suspend Off
RGB color display
Default (sRGB) color space is primary color space
First detailed timing is preferred timing
Display x,y Chromaticity:
  Red:   0.6396, 0.3378
  Green: 0.3193, 0.6191
  Blue:  0.1523, 0.0449
  White: 0.3125, 0.3281
Established timings supported:
Standard timings supported:
Detailed mode: Clock 134.690 MHz, 509 mm x 286 mm
               1920 1950 1970 2020 hborder 0
               1080 1083 1088 1111 vborder 0
               -hsync -vsync analog composite 
               VertFreq: 60 Hz, HorFreq: 66678 Hz
Monitor name: HP TouchSmart
Checksum: 0x2d (valid)
EDID block does NOT conform to EDID 1.3!
	sRGB is signaled, but the chromaticities do not match
	Missing monitor ranges
