
EDID (hex):
00ffffffffffff0060b2107b9c4f0100
2d0f010368221b96ea6e06a1544c9926
194f54bfef0081907146715001010101
010101018180302a009851002a403070
1300510e1100001e000000fd00384c1e
510e000a202020202020000000fc0058
41332d31370a202020202020000000ff
0046325a55354133383539313655009a

Extracted contents:
header:          00 ff ff ff ff ff ff 00
serial number:   60 b2 10 7b 9c 4f 01 00 2d 0f
version:         01 03
basic params:    68 22 1b 96 ea
chroma info:     6e 06 a1 54 4c 99 26 19 4f 54
established:     bf ef 00
standard:        81 90 71 46 71 50 01 01 01 01 01 01 01 01 81 80
descriptor 1:    30 2a 00 98 51 00 2a 40 30 70 13 00 51 0e 11 00 00 1e
descriptor 2:    00 00 00 fd 00 38 4c 1e 51 0e 00 0a 20 20 20 20 20 20
descriptor 3:    00 00 00 fc 00 58 41 33 2d 31 37 0a 20 20 20 20 20 20
descriptor 4:    00 00 00 ff 00 46 32 5a 55 35 41 33 38 35 39 31 36 55
extensions:      00
checksum:        9a

EDID version: 1.3
Manufacturer: XER Model 7b10 Serial Number --
Analog display, Input voltage level: 0.7/0.7 V
Sync: Separate 
Maximum image size: 34 cm x 27 cm
Gamma: 2.50
DPMS levels: Standby Suspend Off
RGB color display
First detailed timing is preferred timing
Display x,y Chromaticity:
  Red:   0.6298, 0.3300
  Green: 0.2998, 0.5996
  Blue:  0.1484, 0.0976
  White: 0.3095, 0.3300
Established timings supported:
  720x400@70Hz 9:5 HorFreq: 31469 Hz Clock: 28.320 MHz
  640x480@60Hz 4:3 HorFreq: 31469 Hz Clock: 25.175 MHz
  640x480@67Hz 4:3 HorFreq: 35000 Hz Clock: 30.240 MHz
  640x480@72Hz 4:3 HorFreq: 37900 Hz Clock: 31.500 MHz
  640x480@75Hz 4:3 HorFreq: 37500 Hz Clock: 31.500 MHz
  800x600@56Hz 4:3 HorFreq: 35200 Hz Clock: 36.000 MHz
  800x600@60Hz 4:3 HorFreq: 37900 Hz Clock: 40.000 MHz
  800x600@72Hz 4:3 HorFreq: 48100 Hz Clock: 50.000 MHz
  800x600@75Hz 4:3 HorFreq: 46900 Hz Clock: 49.500 MHz
  832x624@75Hz 4:3 HorFreq: 49726 Hz Clock: 57.284 MHz
  1024x768@60Hz 4:3 HorFreq: 48400 Hz Clock: 65.000 MHz
  1024x768@70Hz 4:3 HorFreq: 56500 Hz Clock: 75.000 MHz
  1024x768@75Hz 4:3 HorFreq: 60000 Hz Clock: 78.750 MHz
  1280x1024@75Hz 5:4 HorFreq: 80000 Hz Clock: 135.000 MHz
Standard timings supported:
  1280x1024@76Hz 5:4
  1152x864@66Hz 4:3
  1152x864@76Hz 4:3
  1280x1024@60Hz 5:4 HorFreq: 64000 Hz Clock: 108.000 MHz
Detailed mode: Clock 108.000 MHz, 337 mm x 270 mm
               1280 1328 1440 1688 hborder 0
               1024 1025 1028 1066 vborder 0
               +hsync +vsync 
               VertFreq: 60 Hz, HorFreq: 63981 Hz
Monitor ranges (GTF): 56-76Hz V, 30-81kHz H, max dotclock 140MHz
Monitor name: XA3-17
Serial number: --
Checksum: 0x9a (valid)
EDID block does not conform at all!
	Bad year of manufacture
