
EDID (hex):
00ffffffffffff00593a720001010101
1d150103084627782a1dfda5534ca125
10474aa5ce00d1c08bc0010101010101
010101010101023a801871382d40582c
4500ba882100001e000000fd00384c1f
520f000a202020202020000000fc0045
3332314d560a202020202020000000ff
00494d4b44414d323930303438330031

edid-decode (hex):

00 ff ff ff ff ff ff 00 59 3a 72 00 01 01 01 01
1d 15 01 03 08 46 27 78 2a 1d fd a5 53 4c a1 25
10 47 4a a5 ce 00 d1 c0 8b c0 01 01 01 01 01 01
01 01 01 01 01 01 02 3a 80 18 71 38 2d 40 58 2c
45 00 ba 88 21 00 00 1e 00 00 00 fd 00 38 4c 1f
52 0f 00 0a 20 20 20 20 20 20 00 00 00 fc 00 45
33 32 31 4d 56 0a 20 20 20 20 20 20 00 00 00 ff
00 49 4d 4b 44 41 4d 32 39 30 30 34 38 33 00 31

----------------

Block 0, Base EDID:
  EDID Structure Version & Revision: 1.3
  Vendor & Product Identification:
    Manufacturer: VIZ
    Model: 114
    Serial Number: 16843009
    Made in: week 29 of 2011
  Basic Display Parameters & Features:
    Analog display
    Signal Level Standard: 0.700 : 0.300 : 1.000 V p-p
    Blank level equals black level
    Sync: Separate
    Maximum image size: 70 cm x 39 cm
    Gamma: 2.20
    DPMS levels: Off
    RGB color display
    First detailed timing is the preferred timing
  Color Characteristics:
    Red  : 0.6445, 0.3251
    Green: 0.2998, 0.6298
    Blue : 0.1474, 0.0654
    White: 0.2802, 0.2900
  Established Timings I & II:
    IBM     :   720x400    70.081663 Hz   9:5     31.467 kHz     28.320000 MHz
    DMT 0x04:   640x480    59.940476 Hz   4:3     31.469 kHz     25.175000 MHz
    DMT 0x06:   640x480    75.000000 Hz   4:3     37.500 kHz     31.500000 MHz
    DMT 0x09:   800x600    60.316541 Hz   4:3     37.879 kHz     40.000000 MHz
    DMT 0x0a:   800x600    72.187572 Hz   4:3     48.077 kHz     50.000000 MHz
    DMT 0x0b:   800x600    75.000000 Hz   4:3     46.875 kHz     49.500000 MHz
    DMT 0x10:  1024x768    60.003840 Hz   4:3     48.363 kHz     65.000000 MHz
    DMT 0x11:  1024x768    70.069359 Hz   4:3     56.476 kHz     75.000000 MHz
    DMT 0x12:  1024x768    75.028582 Hz   4:3     60.023 kHz     78.750000 MHz
  Standard Timings:
    DMT 0x52:  1920x1080   60.000000 Hz  16:9     67.500 kHz    148.500000 MHz
    GTF     :  1360x765    60.000341 Hz  16:9     47.520 kHz     84.396000 MHz
  Detailed Timing Descriptors:
    DTD 1:  1920x1080   60.000000 Hz  16:9     67.500 kHz    148.500000 MHz (698 mm x 392 mm)
                 Hfront   88 Hsync  44 Hback  148 Hpol P
                 Vfront    4 Vsync   5 Vback   36 Vpol P
    Display Range Limits:
      Monitor ranges (GTF): 56-76 Hz V, 31-82 kHz H, max dotclock 150 MHz
    Display Product Name: 'E321MV'
    Display Product Serial Number: 'IMKDAM2900483'
Checksum: 0x31
