
EDID (hex):
00ffffffffffff005a63377101000000
1e1f0103803d24782e5995af4f42af26
0f5054bfef80d1c0b300a94095009040
8180814081c008e80030f2705a80b058
8a0060632100001a000000ff00564c4a
3231333036303635310a000000fd0028
3c0fa03c000a202020202020000000fc
005658323737362d344b2d6d6864010d
020348f155010304050710121314161f
2021223f405d5e5f606123097f078300
00006d030c0010003878200060010203
67d85dc401788803e305e301e40f0000
18e60607016060454dd000a0f0703e80
3020350060632100001a565e00a0a0a0
29503020350060632100001e00000000
00000000000000000000000000000001

Extracted contents:
header:          00 ff ff ff ff ff ff 00
serial number:   5a 63 37 71 01 00 00 00 1e 1f
version:         01 03
basic params:    80 3d 24 78 2e
chroma info:     59 95 af 4f 42 af 26 0f 50 54
established:     bf ef 80
standard:        d1 c0 b3 00 a9 40 95 00 90 40 81 80 81 40 81 c0
descriptor 1:    08 e8 00 30 f2 70 5a 80 b0 58 8a 00 60 63 21 00 00 1a
descriptor 2:    00 00 00 ff 00 56 4c 4a 32 31 33 30 36 30 36 35 31 0a
descriptor 3:    00 00 00 fd 00 28 3c 0f a0 3c 00 0a 20 20 20 20 20 20
descriptor 4:    00 00 00 fc 00 56 58 32 37 37 36 2d 34 4b 2d 6d 68 64
extensions:      01
checksum:        0d

EDID version: 1.3
Manufacturer: VSC Model 7137 Serial Number --
Made in week 30 of 2021
Digital display
Maximum image size: 61 cm x 36 cm
Gamma: 2.20
DPMS levels: Off
RGB color display
Default (sRGB) color space is primary color space
First detailed timing is preferred timing
Display x,y Chromaticity:
  Red:   0.6845, 0.3095
  Green: 0.2597, 0.6845
  Blue:  0.1503, 0.0595
  White: 0.3134, 0.3291
Established timings supported:
  720x400@70Hz 9:5 HorFreq: 31469 Hz Clock: 28.320 MHz
  640x480@60Hz 4:3 HorFreq: 31469 Hz Clock: 25.175 MHz
  640x480@67Hz 4:3 HorFreq: 35000 Hz Clock: 30.240 MHz
  640x480@72Hz 4:3 HorFreq: 37900 Hz Clock: 31.500 MHz
  640x480@75Hz 4:3 HorFreq: 37500 Hz Clock: 31.500 MHz
  800x600@56Hz 4:3 HorFreq: 35200 Hz Clock: 36.000 MHz
  800x600@60Hz 4:3 HorFreq: 37900 Hz Clock: 40.000 MHz
  800x600@72Hz 4:3 HorFreq: 48100 Hz Clock: 50.000 MHz
  800x600@75Hz 4:3 HorFreq: 46900 Hz Clock: 49.500 MHz
  832x624@75Hz 4:3 HorFreq: 49726 Hz Clock: 57.284 MHz
  1024x768@60Hz 4:3 HorFreq: 48400 Hz Clock: 65.000 MHz
  1024x768@70Hz 4:3 HorFreq: 56500 Hz Clock: 75.000 MHz
  1024x768@75Hz 4:3 HorFreq: 60000 Hz Clock: 78.750 MHz
  1280x1024@75Hz 5:4 HorFreq: 80000 Hz Clock: 135.000 MHz
  1152x870@75Hz 192:145 HorFreq: 67500 Hz Clock: 108.000 MHz
Standard timings supported:
  1920x1080@60Hz 16:9
  1680x1050@60Hz 16:10 HorFreq: 64700 Hz Clock: 119.000 MHz
  1600x1200@60Hz 4:3 HorFreq: 75000 Hz Clock: 162.000 MHz
  1440x900@60Hz 16:10 HorFreq: 55500 Hz Clock: 88.750 MHz
  1400x1050@60Hz 4:3 HorFreq: 64700 Hz Clock: 101.000 MHz
  1280x1024@60Hz 5:4 HorFreq: 64000 Hz Clock: 108.000 MHz
  1280x960@60Hz 4:3 HorFreq: 60000 Hz Clock: 108.000 MHz
  1280x720@60Hz 16:9
Detailed mode: Clock 594.000 MHz, 608 mm x 355 mm
               3840 4016 4104 4400 hborder 0
               2160 2168 2178 2250 vborder 0
               +hsync -vsync 
               VertFreq: 60 Hz, HorFreq: 135000 Hz
Serial number: --
Monitor ranges (GTF): 40-60Hz V, 15-160kHz H, max dotclock 600MHz
Has 1 extension blocks
Checksum: 0xd (valid)

CTA extension block
Extension version: 3
68 bytes of CTA data
  Video data block
    VIC   1 640x480@60Hz 4:3  HorFreq: 31469 Hz Clock: 25.175 MHz
    VIC   3 720x480@60Hz 16:9  HorFreq: 31469 Hz Clock: 27.000 MHz
    VIC   4 1280x720@60Hz 16:9  HorFreq: 45000 Hz Clock: 74.250 MHz
    VIC   5 1920x1080i@60Hz 16:9  HorFreq: 33750 Hz Clock: 74.250 MHz
    VIC   7 1440x480i@60Hz 16:9  HorFreq: 15734 Hz Clock: 27.000 MHz
    VIC  16 1920x1080@60Hz 16:9  HorFreq: 67500 Hz Clock: 148.500 MHz
    VIC  18 720x576@50Hz 16:9  HorFreq: 31250 Hz Clock: 27.000 MHz
    VIC  19 1280x720@50Hz 16:9  HorFreq: 37500 Hz Clock: 74.250 MHz
    VIC  20 1920x1080i@50Hz 16:9  HorFreq: 28125 Hz Clock: 74.250 MHz
    VIC  22 1440x576i@50Hz 16:9  HorFreq: 15625 Hz Clock: 27.000 MHz
    VIC  31 1920x1080@50Hz 16:9  HorFreq: 56250 Hz Clock: 148.500 MHz
    VIC  32 1920x1080@24Hz 16:9  HorFreq: 27000 Hz Clock: 74.250 MHz
    VIC  33 1920x1080@25Hz 16:9  HorFreq: 28125 Hz Clock: 74.250 MHz
    VIC  34 1920x1080@30Hz 16:9  HorFreq: 33750 Hz Clock: 74.250 MHz
    VIC  63 1920x1080@120Hz 16:9  HorFreq: 135000 Hz Clock: 297.000 MHz
    VIC  64 1920x1080@100Hz 16:9  HorFreq: 112500 Hz Clock: 297.000 MHz
    VIC  93 3840x2160@24Hz 16:9  HorFreq: 54000 Hz Clock: 297.000 MHz
    VIC  94 3840x2160@25Hz 16:9  HorFreq: 56250 Hz Clock: 297.000 MHz
    VIC  95 3840x2160@30Hz 16:9  HorFreq: 67500 Hz Clock: 297.000 MHz
    VIC  96 3840x2160@50Hz 16:9  HorFreq: 112500 Hz Clock: 594.000 MHz
    VIC  97 3840x2160@60Hz 16:9  HorFreq: 135000 Hz Clock: 594.000 MHz
  Audio data block
    Linear PCM, max channels 2
      Supported sample rates (kHz): 192 176.4 96 88.2 48 44.1 32
      Supported sample sizes (bits): 24 20 16
  Speaker allocation data block
    Speaker map:
  Vendor-specific data block, OUI 000c03 (HDMI)
    Source physical address 1.0.0.0
    DC_36bit
    DC_30bit
    DC_Y444
    Maximum TMDS clock: 600MHz
    Extended HDMI video details:
      HDMI VIC 1 3840x2160@30Hz 16:9 HorFreq: 67500 Hz Clock: 297.000 MHz
      HDMI VIC 2 3840x2160@25Hz 16:9 HorFreq: 56250 Hz Clock: 297.000 MHz
      HDMI VIC 3 3840x2160@24Hz 16:9 HorFreq: 54000 Hz Clock: 297.000 MHz
  Vendor-specific data block, OUI c45dd8 (HDMI Forum)
    Version: 1
    Maximum TMDS Character Rate: 600MHz
    SCDC Present
    Supports scrambling for <= 340 Mcsc
    Supports 12-bits/component Deep Color 4:2:0 Pixel Encoding
    Supports 10-bits/component Deep Color 4:2:0 Pixel Encoding
  Extended tag: Colorimetry data block
    xvYCC601
    xvYCC709
    BT2020cYCC
    BT2020YCC
    BT2020RGB
  Extended tag: YCbCr 4:2:0 capability map data block
    VSD Index 19
    VSD Index 20
  Extended tag: HDR static metadata data block
    Electro optical transfer functions:
      Traditional gamma - SDR luminance range
      Traditional gamma - HDR luminance range
      SMPTE ST2084
    Supported static metadata descriptors:
      Static metadata type 1
    Desired content max luminance: 96 (400.000 cd/m^2)
    Desired content max frame-average luminance: 96 (400.000 cd/m^2)
    Desired content min luminance: 69 (0.293 cd/m^2)
Underscans PC formats by default
Basic audio support
Supports YCbCr 4:4:4
Supports YCbCr 4:2:2
1 native detailed modes
Detailed mode: Clock 533.250 MHz, 608 mm x 355 mm
               3840 3888 3920 4000 hborder 0
               2160 2163 2168 2222 vborder 0
               +hsync -vsync 
               VertFreq: 59 Hz, HorFreq: 133312 Hz
Detailed mode: Clock 241.500 MHz, 608 mm x 355 mm
               2560 2608 2640 2720 hborder 0
               1440 1443 1448 1481 vborder 0
               +hsync +vsync 
               VertFreq: 59 Hz, HorFreq: 88786 Hz
Checksum: 0x1 (valid)

EDID block does NOT conform to EDID 1.3!
	sRGB is signaled, but the chromaticities do not match
	HDMI VSDB Max TMDS rate is > 340
	Name descriptor not terminated with a newline
One or more of the timings is out of range of the Monitor Ranges:
  Vertical Freq: 24 - 120 Hz
  Horizontal Freq: 15625 - 135000 Hz
  Maximum Clock: 594.000 MHz
EDID block does not conform at all!
	Both the serial number and the serial string are set
