edid-decode (hex):

00 ff ff ff ff ff ff 00 30 e4 f1 02 00 00 00 00
00 15 01 04 90 22 13 78 0a 05 85 9b 5b 54 94 26
0e 50 54 00 00 00 01 01 01 01 01 01 01 01 01 01
01 01 01 01 01 01 ce 1d 56 f4 50 00 16 30 24 28
35 00 58 c2 10 00 00 19 df 13 56 f4 50 00 16 30
24 28 35 00 58 c2 10 00 00 19 00 00 00 00 00 00
00 00 00 00 00 00 00 00 00 00 00 00 00 00 00 02
00 0c 4c ff 0a 3c 64 1b 13 1f 64 00 00 00 00 75

----------------

Block 0, Base EDID:
  EDID Structure Version & Revision: 1.4
  Vendor & Product Identification:
    Manufacturer: LGD
    Model: 753
    Made in: 2011
  Basic Display Parameters & Features:
    Digital display
    Bits per primary color channel: 6
    Digital interface is not defined
    Maximum image size: 34 cm x 19 cm
    Gamma: 2.20
    Supported color formats: RGB 4:4:4, YCrCb 4:4:4
    First detailed timing includes the native pixel format and preferred refresh rate
  Color Characteristics:
    Red  : 0.6054, 0.3554
    Green: 0.3291, 0.5791
    Blue : 0.1503, 0.0546
    White: 0.3134, 0.3291
  Established Timings I & II: none
  Standard Timings: none
  Detailed Timing Descriptors:
    DTD 1:  1366x768    59.989 Hz 683:384  47.391 kHz  76.300 MHz (344 mm x 194 mm)
                 Hfront   36 Hsync  40 Hback 168 Hpol N
                 Vfront    3 Vsync   5 Vback  14 Vpol N
    DTD 2:  1366x768    39.995 Hz 683:384  31.596 kHz  50.870 MHz (344 mm x 194 mm)
                 Hfront   36 Hsync  40 Hback 168 Hpol N
                 Vfront    3 Vsync   5 Vback  14 Vpol N
    Empty Descriptor
    Manufacturer-Specified Display Descriptor (0x02): 00 02 00 0c 4c ff 0a 3c 64 1b 13 1f 64 00 00 00 '....L..<d...d...'
Checksum: 0x75

----------------

Failures:

Block 0, Base EDID:
  Empty Descriptor: Use Dummy Descriptor instead of all zeroes.
  Missing Display Product Name.

EDID conformity: FAIL
