edid-decode (hex):

00 ff ff ff ff ff ff 00 4c 2d 74 74 5a 50 51 30
31 21 01 04 b5 8c 28 78 3b 4e d5 ae 4e 45 aa 27
0e 50 54 25 cf 00 71 4f 81 c0 81 00 81 80 95 00
a9 c0 b3 00 d1 c0 1a 68 00 a0 f0 38 1f 40 30 20
3a 00 78 90 51 00 00 1a 00 00 00 fd 0c 60 f0 ff
ff ff 01 0a 20 20 20 20 20 20 00 00 00 fc 00 4f
64 79 73 73 65 79 20 47 39 35 4e 43 00 00 00 ff
00 48 4e 54 57 42 30 30 35 38 30 0a 20 20 03 82

02 03 31 f0 45 61 5f 10 04 03 23 09 07 07 83 01
00 00 e3 05 c0 00 6d 1a 00 00 02 0f 60 f0 00 04
8b 06 73 08 e6 06 05 01 8b 73 00 e5 01 8b 84 90
79 56 5e 00 a0 a0 a0 29 50 30 20 35 00 78 90 51
00 00 1a 00 00 00 00 00 00 00 00 00 00 00 00 00
00 00 00 00 00 00 00 00 00 00 00 00 00 00 00 00
00 00 00 00 00 00 00 00 00 00 00 00 00 00 00 00
00 00 00 00 00 00 00 00 00 00 00 00 00 00 00 6d

70 12 79 03 00 03 01 50 bf 75 06 88 ff 1d 9f 00
2f 80 1f 00 6f 08 59 00 02 00 09 00 1f a0 03 04
ff 0e 2f 02 f7 80 1f 00 6f 08 59 00 02 00 04 00
33 e9 00 04 7f 07 17 01 11 80 1f 00 37 04 32 00
02 00 04 00 33 98 01 88 ff 1d 9f 00 2f 80 1f 00
6f 08 3d 00 02 00 09 00 25 00 09 7f 99 40 7f 99
40 60 f0 80 00 00 00 00 00 00 00 00 00 00 00 00
00 00 00 00 00 00 00 00 00 00 00 00 00 00 5d 90

70 12 79 00 00 03 01 50 d0 b4 01 08 ff 0e 17 01
6b 80 1f 00 37 04 32 00 02 00 09 00 73 fc 02 08
ff 13 3f 01 7f 80 1f 00 9f 05 3a 00 02 00 09 00
af 94 01 04 ff 09 3f 01 7f 80 1f 00 9f 05 3a 00
02 00 04 00 33 b7 00 08 ff 13 9f 00 2f 80 1f 00
9f 05 28 00 02 00 09 00 00 00 00 00 00 00 00 00
00 00 00 00 00 00 00 00 00 00 00 00 00 00 00 00
00 00 00 00 00 00 00 00 00 00 00 00 00 00 41 90

00 ff ff ff ff ff ff 00 4c 2d 74 74 5a 50 51 30
31 21 01 04 b5 8c 28 78 3b 4e d5 ae 4e 45 aa 27
0e 50 54 25 cf 00 71 4f 81 c0 81 00 81 80 95 00
a9 c0 b3 00 d1 c0 1a 68 00 a0 f0 38 1f 40 30 20
3a 00 78 90 51 00 00 1a 00 00 00 fd 0c 60 f0 ff
ff ff 01 0a 20 20 20 20 20 20 00 00 00 fc 00 4f
64 79 73 73 65 79 20 47 39 35 4e 43 00 00 00 ff
00 48 4e 54 57 42 30 30 35 38 30 0a 20 20 03 82

02 03 31 f0 45 61 5f 10 04 03 23 09 07 07 83 01
00 00 e3 05 c0 00 6d 1a 00 00 02 0f 60 f0 00 04
8b 06 73 08 e6 06 05 01 8b 73 00 e5 01 8b 84 90
79 56 5e 00 a0 a0 a0 29 50 30 20 35 00 78 90 51
00 00 1a 00 00 00 00 00 00 00 00 00 00 00 00 00
00 00 00 00 00 00 00 00 00 00 00 00 00 00 00 00
00 00 00 00 00 00 00 00 00 00 00 00 00 00 00 00
00 00 00 00 00 00 00 00 00 00 00 00 00 00 00 6d

70 12 79 03 00 03 01 50 bf 75 06 88 ff 1d 9f 00
2f 80 1f 00 6f 08 59 00 02 00 09 00 1f a0 03 04
ff 0e 2f 02 f7 80 1f 00 6f 08 59 00 02 00 04 00
33 e9 00 04 7f 07 17 01 11 80 1f 00 37 04 32 00
02 00 04 00 33 98 01 88 ff 1d 9f 00 2f 80 1f 00
6f 08 3d 00 02 00 09 00 25 00 09 7f 99 40 7f 99
40 60 f0 80 00 00 00 00 00 00 00 00 00 00 00 00
00 00 00 00 00 00 00 00 00 00 00 00 00 00 5d 90

70 12 79 00 00 03 01 50 d0 b4 01 08 ff 0e 17 01
6b 80 1f 00 37 04 32 00 02 00 09 00 73 fc 02 08
ff 13 3f 01 7f 80 1f 00 9f 05 3a 00 02 00 09 00
af 94 01 04 ff 09 3f 01 7f 80 1f 00 9f 05 3a 00
02 00 04 00 33 b7 00 08 ff 13 9f 00 2f 80 1f 00
9f 05 28 00 02 00 09 00 00 00 00 00 00 00 00 00
00 00 00 00 00 00 00 00 00 00 00 00 00 00 00 00
00 00 00 00 00 00 00 00 00 00 00 00 00 00 41 90

----------------

Block 0, Base EDID:
  EDID Structure Version & Revision: 1.4
  Vendor & Product Identification:
    Manufacturer: SAM
    Model: 29812
    Serial Number: ...
    Made in: week 49 of 2023
  Basic Display Parameters & Features:
    Digital display
    Bits per primary color channel: 10
    DisplayPort interface
    Maximum image size: 140 cm x 40 cm
    Gamma: 2.20
    DPMS levels: Off
    Supported color formats: RGB 4:4:4, YCrCb 4:4:4, YCrCb 4:2:2
    First detailed timing includes the native pixel format and preferred refresh rate
    Display is continuous frequency
  Color Characteristics:
    Red  : 0.6806, 0.3046
    Green: 0.2724, 0.6660
    Blue : 0.1552, 0.0556
    White: 0.3134, 0.3291
  Established Timings I & II:
    DMT 0x04:   640x480    59.940476 Hz   4:3     31.469 kHz     25.175000 MHz
    DMT 0x06:   640x480    75.000000 Hz   4:3     37.500 kHz     31.500000 MHz
    DMT 0x09:   800x600    60.316541 Hz   4:3     37.879 kHz     40.000000 MHz
    DMT 0x0a:   800x600    72.187572 Hz   4:3     48.077 kHz     50.000000 MHz
    DMT 0x0b:   800x600    75.000000 Hz   4:3     46.875 kHz     49.500000 MHz
    DMT 0x10:  1024x768    60.003840 Hz   4:3     48.363 kHz     65.000000 MHz
    DMT 0x11:  1024x768    70.069359 Hz   4:3     56.476 kHz     75.000000 MHz
    DMT 0x12:  1024x768    75.028582 Hz   4:3     60.023 kHz     78.750000 MHz
    DMT 0x24:  1280x1024   75.024675 Hz   5:4     79.976 kHz    135.000000 MHz
  Standard Timings:
    DMT 0x15:  1152x864    75.000000 Hz   4:3     67.500 kHz    108.000000 MHz
    DMT 0x55:  1280x720    60.000000 Hz  16:9     45.000 kHz     74.250000 MHz
    DMT 0x1c:  1280x800    59.810326 Hz  16:10    49.702 kHz     83.500000 MHz
    DMT 0x23:  1280x1024   60.019740 Hz   5:4     63.981 kHz    108.000000 MHz
    DMT 0x2f:  1440x900    59.887445 Hz  16:10    55.935 kHz    106.500000 MHz
    DMT 0x53:  1600x900    60.000000 Hz  16:9     60.000 kHz    108.000000 MHz (RB)
    DMT 0x3a:  1680x1050   59.954250 Hz  16:10    65.290 kHz    146.250000 MHz
    DMT 0x52:  1920x1080   60.000000 Hz  16:9     67.500 kHz    148.500000 MHz
  Detailed Timing Descriptors:
    DTD 1:  3840x1080   59.968497 Hz  32:9     66.625 kHz    266.500000 MHz (1400 mm x 400 mm)
                 Hfront   48 Hsync  32 Hback   80 Hpol P
                 Vfront    3 Vsync  10 Vback   18 Vpol N
    Display Range Limits:
      Monitor ranges (Bare Limits): 96-240 Hz V, 510-510 kHz H, max dotclock 2550 MHz
    Display Product Name: 'Odyssey G95NC'
    Display Product Serial Number: ...
  Extension blocks: 3
Checksum: 0x82

----------------

Block 1, CTA-861 Extension Block:
  Revision: 3
  Underscans IT Video Formats by default
  Basic audio support
  Supports YCbCr 4:4:4
  Supports YCbCr 4:2:2
  Native detailed modes: 0
  Video Data Block:
    VIC  97:  3840x2160   60.000000 Hz  16:9    135.000 kHz    594.000000 MHz
    VIC  95:  3840x2160   30.000000 Hz  16:9     67.500 kHz    297.000000 MHz
    VIC  16:  1920x1080   60.000000 Hz  16:9     67.500 kHz    148.500000 MHz
    VIC   4:  1280x720    60.000000 Hz  16:9     45.000 kHz     74.250000 MHz
    VIC   3:   720x480    59.940060 Hz  16:9     31.469 kHz     27.000000 MHz
  Audio Data Block:
    Linear PCM:
      Max channels: 2
      Supported sample rates (kHz): 48 44.1 32
      Supported sample sizes (bits): 24 20 16
  Speaker Allocation Data Block:
    FL/FR - Front Left/Right
  Colorimetry Data Block:
    BT2020YCC
    BT2020RGB
  Vendor-Specific Data Block (AMD), OUI 00-00-1A:
    Version: 2.15
    Minimum Refresh Rate: 96 Hz
    Maximum Refresh Rate: 240 Hz
    Flags 1.x: 0x00
    Flags 2.x: 0x04
    Maximum luminance: 139 (1015.241 cd/m^2)
    Minimum luminance: 6 (0.006 cd/m^2)
    Maximum luminance (without local dimming): 115 (603.666 cd/m^2)
    Minimum luminance (without local dimming): 8 (0.006 cd/m^2)
  HDR Static Metadata Data Block:
    Electro optical transfer functions:
      Traditional gamma - SDR luminance range
      SMPTE ST2084
    Supported static metadata descriptors:
      Static metadata type 1
    Desired content max luminance: 139 (1015.241 cd/m^2)
    Desired content max frame-average luminance: 115 (603.666 cd/m^2)
    Desired content min luminance: 0 (0.000 cd/m^2)
  Vendor-Specific Video Data Block (HDR10+), OUI 90-84-8B:
    Application Version: 121
  Detailed Timing Descriptors:
    DTD 2:  2560x1440   59.950550 Hz  16:9     88.787 kHz    241.500000 MHz (1400 mm x 400 mm)
                 Hfront   48 Hsync  32 Hback   80 Hpol P
                 Vfront    3 Vsync   5 Vback   33 Vpol N
Checksum: 0x6d  Unused space in Extension Block: 60 bytes

----------------

Block 2, DisplayID Extension Block:
  Version: 1.2
  Extension Count: 0
  Display Product Type: Standalone display device
  Video Timing Modes Type 1 - Detailed Timings Data Block:
    DTD:  7680x2160  240.000000 Hz   0:0    540.000 kHz   4233.600000 MHz (aspect undefined, no 3D stereo, preferred)
               Hfront   48 Hsync  32 Hback   80 Hpol P
               Vfront    3 Vsync  10 Vback   77 Vpol N
    DTD:  3840x2160  240.000000 Hz  16:9    540.000 kHz   2376.000000 MHz (aspect 16:9, no 3D stereo)
               Hfront  248 Hsync  32 Hback  280 Hpol P
               Vfront    3 Vsync   5 Vback   82 Vpol N
    DTD:  1920x1080  239.932481 Hz  16:9    271.364 kHz    597.000000 MHz (aspect 16:9, no 3D stereo)
               Hfront   18 Hsync  32 Hback  230 Hpol P
               Vfront    3 Vsync   5 Vback   43 Vpol N
    DTD:  7680x2160   59.986866 Hz   0:0    133.291 kHz   1045.000000 MHz (aspect undefined, no 3D stereo, preferred)
               Hfront   48 Hsync  32 Hback   80 Hpol P
               Vfront    3 Vsync  10 Vback   49 Vpol N
  Dynamic Video Timing Range Limits Data Block:
    Minimum Pixel Clock: 4233600 kHz
    Maximum Pixel Clock: 4233600 kHz
    Minimum Vertical Refresh Rate: 96 Hz
    Maximum Vertical Refresh Rate: 240 Hz
    Seamless Dynamic Video Timing Support: Yes
  Checksum: 0x5d
Checksum: 0x90

----------------

Block 3, DisplayID Extension Block:
  Version: 1.2
  Extension Count: 0
  Video Timing Modes Type 1 - Detailed Timings Data Block:
    DTD:  3840x1080  239.982231 Hz   0:0    271.420 kHz   1118.250000 MHz (aspect undefined, no 3D stereo)
               Hfront  108 Hsync  32 Hback  140 Hpol P
               Vfront    3 Vsync  10 Vback   38 Vpol N
    DTD:  5120x1440  239.988424 Hz   0:0    359.743 kHz   1957.000000 MHz (aspect undefined, no 3D stereo)
               Hfront  128 Hsync  32 Hback  160 Hpol P
               Vfront    3 Vsync  10 Vback   46 Vpol N
    DTD:  2560x1440  239.974798 Hz  16:9    359.722 kHz   1036.000000 MHz (aspect 16:9, no 3D stereo)
               Hfront  128 Hsync  32 Hback  160 Hpol P
               Vfront    3 Vsync   5 Vback   51 Vpol N
    DTD:  5120x1440   59.976879 Hz   0:0     88.826 kHz    469.000000 MHz (aspect undefined, no 3D stereo)
               Hfront   48 Hsync  32 Hback   80 Hpol P
               Vfront    3 Vsync  10 Vback   28 Vpol N
  Checksum: 0x41
Checksum: 0x90

----------------

Block 4, Unknown EDID Extension Block 0x00:
  00 ff ff ff ff ff ff 00 4c 2d 74 74 5a 50 51 30 '........L-ttZPQ0'
  31 21 01 04 b5 8c 28 78 3b 4e d5 ae 4e 45 aa 27 '1!....(x;N..NE.''
  0e 50 54 25 cf 00 71 4f 81 c0 81 00 81 80 95 00 '.PT%..qO........'
  a9 c0 b3 00 d1 c0 1a 68 00 a0 f0 38 1f 40 30 20 '.......h...8.@0 '
  3a 00 78 90 51 00 00 1a 00 00 00 fd 0c 60 f0 ff ':.x.Q........`..'
  ff ff 01 0a 20 20 20 20 20 20 00 00 00 fc 00 4f '....      .....O'
  64 79 73 73 65 79 20 47 39 35 4e 43 00 00 00 ff 'dyssey G95NC....'
  00 48 4e 54 57 42 30 30 35 38 30 0a 20 20 03 82 '.HNTWB00580.  ..'
Checksum: 0x82

----------------

Block 5, CTA-861 Extension Block:
  Revision: 3
  Underscans IT Video Formats by default
  Basic audio support
  Supports YCbCr 4:4:4
  Supports YCbCr 4:2:2
  Native detailed modes: 0
  Video Data Block:
    VIC  97:  3840x2160   60.000000 Hz  16:9    135.000 kHz    594.000000 MHz
    VIC  95:  3840x2160   30.000000 Hz  16:9     67.500 kHz    297.000000 MHz
    VIC  16:  1920x1080   60.000000 Hz  16:9     67.500 kHz    148.500000 MHz
    VIC   4:  1280x720    60.000000 Hz  16:9     45.000 kHz     74.250000 MHz
    VIC   3:   720x480    59.940060 Hz  16:9     31.469 kHz     27.000000 MHz
  Audio Data Block:
    Linear PCM:
      Max channels: 2
      Supported sample rates (kHz): 48 44.1 32
      Supported sample sizes (bits): 24 20 16
  Speaker Allocation Data Block:
    FL/FR - Front Left/Right
  Colorimetry Data Block:
    BT2020YCC
    BT2020RGB
  Vendor-Specific Data Block (AMD), OUI 00-00-1A:
    Version: 2.15
    Minimum Refresh Rate: 96 Hz
    Maximum Refresh Rate: 240 Hz
    Flags 1.x: 0x00
    Flags 2.x: 0x04
    Maximum luminance: 139 (1015.241 cd/m^2)
    Minimum luminance: 6 (0.006 cd/m^2)
    Maximum luminance (without local dimming): 115 (603.666 cd/m^2)
    Minimum luminance (without local dimming): 8 (0.006 cd/m^2)
  HDR Static Metadata Data Block:
    Electro optical transfer functions:
      Traditional gamma - SDR luminance range
      SMPTE ST2084
    Supported static metadata descriptors:
      Static metadata type 1
    Desired content max luminance: 139 (1015.241 cd/m^2)
    Desired content max frame-average luminance: 115 (603.666 cd/m^2)
    Desired content min luminance: 0 (0.000 cd/m^2)
  Vendor-Specific Video Data Block (HDR10+), OUI 90-84-8B:
    Application Version: 121
  Detailed Timing Descriptors:
    DTD 3:  2560x1440   59.950550 Hz  16:9     88.787 kHz    241.500000 MHz (1400 mm x 400 mm)
                 Hfront   48 Hsync  32 Hback   80 Hpol P
                 Vfront    3 Vsync   5 Vback   33 Vpol N
Checksum: 0x6d  Unused space in Extension Block: 60 bytes

----------------

Block 6, DisplayID Extension Block:
  Version: 1.2
  Extension Count: 0
  Video Timing Modes Type 1 - Detailed Timings Data Block:
    DTD:  7680x2160  240.000000 Hz   0:0    540.000 kHz   4233.600000 MHz (aspect undefined, no 3D stereo, preferred)
               Hfront   48 Hsync  32 Hback   80 Hpol P
               Vfront    3 Vsync  10 Vback   77 Vpol N
    DTD:  3840x2160  240.000000 Hz  16:9    540.000 kHz   2376.000000 MHz (aspect 16:9, no 3D stereo)
               Hfront  248 Hsync  32 Hback  280 Hpol P
               Vfront    3 Vsync   5 Vback   82 Vpol N
    DTD:  1920x1080  239.932481 Hz  16:9    271.364 kHz    597.000000 MHz (aspect 16:9, no 3D stereo)
               Hfront   18 Hsync  32 Hback  230 Hpol P
               Vfront    3 Vsync   5 Vback   43 Vpol N
    DTD:  7680x2160   59.986866 Hz   0:0    133.291 kHz   1045.000000 MHz (aspect undefined, no 3D stereo, preferred)
               Hfront   48 Hsync  32 Hback   80 Hpol P
               Vfront    3 Vsync  10 Vback   49 Vpol N
  Dynamic Video Timing Range Limits Data Block:
    Minimum Pixel Clock: 4233600 kHz
    Maximum Pixel Clock: 4233600 kHz
    Minimum Vertical Refresh Rate: 96 Hz
    Maximum Vertical Refresh Rate: 240 Hz
    Seamless Dynamic Video Timing Support: Yes
  Checksum: 0x5d
Checksum: 0x90

----------------

Block 7, DisplayID Extension Block:
  Version: 1.2
  Extension Count: 0
  Video Timing Modes Type 1 - Detailed Timings Data Block:
    DTD:  3840x1080  239.982231 Hz   0:0    271.420 kHz   1118.250000 MHz (aspect undefined, no 3D stereo)
               Hfront  108 Hsync  32 Hback  140 Hpol P
               Vfront    3 Vsync  10 Vback   38 Vpol N
    DTD:  5120x1440  239.988424 Hz   0:0    359.743 kHz   1957.000000 MHz (aspect undefined, no 3D stereo)
               Hfront  128 Hsync  32 Hback  160 Hpol P
               Vfront    3 Vsync  10 Vback   46 Vpol N
    DTD:  2560x1440  239.974798 Hz  16:9    359.722 kHz   1036.000000 MHz (aspect 16:9, no 3D stereo)
               Hfront  128 Hsync  32 Hback  160 Hpol P
               Vfront    3 Vsync   5 Vback   51 Vpol N
    DTD:  5120x1440   59.976879 Hz   0:0     88.826 kHz    469.000000 MHz (aspect undefined, no 3D stereo)
               Hfront   48 Hsync  32 Hback   80 Hpol P
               Vfront    3 Vsync  10 Vback   28 Vpol N
  Checksum: 0x41
Checksum: 0x90

----------------

Warnings:

Block 1, CTA-861 Extension Block:
  Video Data Block: VIC 97 is the preferred timing, overriding the first detailed timings. Is this intended?
  Colorimetry Data Block: Set the sRGB colorimetry bit to avoid interop issues.
  Display Product Serial Number is set, so the Serial Number in the Base EDID should be 0.
Block 5, CTA-861 Extension Block:
  Colorimetry Data Block: Set the sRGB colorimetry bit to avoid interop issues.
  Display Product Serial Number is set, so the Serial Number in the Base EDID should be 0.
EDID:
  Base EDID: Some timings are out of range of the Monitor Ranges:
    Vertical Freq: 30.000 - 240.000 Hz (Monitor: 96.000 - 240.000 Hz)
    Horizontal Freq: 31.468 - 540.000 kHz (Monitor: 510.000 - 510.000 kHz)
    Maximum Clock: 4233.600 MHz (Monitor: 2550.000 MHz)

Failures:

Block 1, CTA-861 Extension Block:
  Missing VCDB, needed for Set Selectable RGB Quantization to avoid interop issues.
Block 2, DisplayID Extension Block:
  Expected 0 DisplayID Extension Block, but got 3.
  Dynamic Video Timing Range Limits Data Block: Use of DisplayID v2.0 tag for DisplayID v1.2.
Block 4, Base EDID:
  Unknown Extension Block.
Block 5, CTA-861 Extension Block:
  Video Data Block: Duplicate VIC 97.
  Video Data Block: Duplicate VIC 95.
  Video Data Block: Duplicate VIC 16.
  Video Data Block: Duplicate VIC 4.
  Video Data Block: Duplicate VIC 3.
  Speaker Allocation Data Block: Only one instance of this Data Block is allowed.
  Colorimetry Data Block: Only one instance of this Data Block is allowed.
  HDR Static Metadata Data Block: Only one instance of this Data Block is allowed.
  Missing VCDB, needed for Set Selectable RGB Quantization to avoid interop issues.
Block 6, DisplayID Extension Block:
  Product Type should be 0 in extension block.
  Dynamic Video Timing Range Limits Data Block: Use of DisplayID v2.0 tag for DisplayID v1.2.
EDID:
  Base EDID: EDID specified 3 extension block(s), but found 7 extension block(s).
  DisplayID: Missing DisplayID Product Identification Data Block.
  DisplayID: Missing DisplayID Display Parameters Data Block.
  DisplayID: Missing DisplayID Display Interface Features Data Block.

EDID conformity: FAIL
