
EDID (hex):
00ffffffffffff0026340d909b8e3201
1513010308342078ea9ec5a6564b9a25
135054a76f80d100a940b30081407140
818095000101283c80a070b023403020
360008402100001a023a801871382d40
582c450008402100001e000000fd003b
4c1f5312000a202020202020000000fc
00573234584420445355420a20200093

Extracted contents:
header:          00 ff ff ff ff ff ff 00
serial number:   26 34 0d 90 9b 8e 32 01 15 13
version:         01 03
basic params:    08 34 20 78 ea
chroma info:     9e c5 a6 56 4b 9a 25 13 50 54
established:     a7 6f 80
standard:        d1 00 a9 40 b3 00 81 40 71 40 81 80 95 00 01 01
descriptor 1:    28 3c 80 a0 70 b0 23 40 30 20 36 00 08 40 21 00 00 1a
descriptor 2:    02 3a 80 18 71 38 2d 40 58 2c 45 00 08 40 21 00 00 1e
descriptor 3:    00 00 00 fd 00 3b 4c 1f 53 12 00 0a 20 20 20 20 20 20
descriptor 4:    00 00 00 fc 00 57 32 34 58 44 20 44 53 55 42 0a 20 20
extensions:      00
checksum:        93

EDID version: 1.3
Manufacturer: IQT Model 900d Serial Number --
Made in week 21 of 2009
Analog display, Input voltage level: 0.7/0.3 V
Sync: Separate 
Maximum image size: 52 cm x 32 cm
Gamma: 2.20
DPMS levels: Standby Suspend Off
RGB color display
First detailed timing is preferred timing
Display x,y Chromaticity:
  Red:   0.6503, 0.3369
  Green: 0.2958, 0.6035
  Blue:  0.1474, 0.0742
  White: 0.3134, 0.3291
Established timings supported:
  720x400@70Hz 9:5 HorFreq: 31469 Hz Clock: 28.320 MHz
  640x480@60Hz 4:3 HorFreq: 31469 Hz Clock: 25.175 MHz
  640x480@75Hz 4:3 HorFreq: 37500 Hz Clock: 31.500 MHz
  800x600@56Hz 4:3 HorFreq: 35200 Hz Clock: 36.000 MHz
  800x600@60Hz 4:3 HorFreq: 37900 Hz Clock: 40.000 MHz
  800x600@75Hz 4:3 HorFreq: 46900 Hz Clock: 49.500 MHz
  832x624@75Hz 4:3 HorFreq: 49726 Hz Clock: 57.284 MHz
  1024x768@60Hz 4:3 HorFreq: 48400 Hz Clock: 65.000 MHz
  1024x768@70Hz 4:3 HorFreq: 56500 Hz Clock: 75.000 MHz
  1024x768@75Hz 4:3 HorFreq: 60000 Hz Clock: 78.750 MHz
  1280x1024@75Hz 5:4 HorFreq: 80000 Hz Clock: 135.000 MHz
  1152x870@75Hz 192:145 HorFreq: 67500 Hz Clock: 108.000 MHz
Standard timings supported:
  1920x1200@60Hz 16:10 HorFreq: 74000 Hz Clock: 154.000 MHz
  1600x1200@60Hz 4:3 HorFreq: 75000 Hz Clock: 162.000 MHz
  1680x1050@60Hz 16:10 HorFreq: 64700 Hz Clock: 119.000 MHz
  1280x960@60Hz 4:3 HorFreq: 60000 Hz Clock: 108.000 MHz
  1152x864@60Hz 4:3
  1280x1024@60Hz 5:4 HorFreq: 64000 Hz Clock: 108.000 MHz
  1440x900@60Hz 16:10 HorFreq: 55500 Hz Clock: 88.750 MHz
Detailed mode: Clock 154.000 MHz, 520 mm x 320 mm
               1920 1968 2000 2080 hborder 0
               1200 1203 1209 1235 vborder 0
               +hsync -vsync 
               VertFreq: 59 Hz, HorFreq: 74038 Hz
Detailed mode: Clock 148.500 MHz, 520 mm x 320 mm
               1920 2008 2052 2200 hborder 0
               1080 1084 1089 1125 vborder 0
               +hsync +vsync 
               VertFreq: 60 Hz, HorFreq: 67500 Hz
Monitor ranges (GTF): 59-76Hz V, 31-83kHz H, max dotclock 180MHz
Monitor name: W24XD DSUB
Checksum: 0x93 (valid)
One or more of the timings is out of range of the Monitor Ranges:
  Vertical Freq: 56 - 75 Hz
  Horizontal Freq: 31469 - 80000 Hz
  Maximum Clock: 162.000 MHz
