edid-decode (hex):

00 ff ff ff ff ff ff 00 09 e5 39 07 00 00 00 00
01 1b 01 04 95 22 13 78 02 24 10 97 59 54 8e 27
1e 50 54 00 00 00 01 01 01 01 01 01 01 01 01 01
01 01 01 01 01 01 70 3a 80 0b 71 38 3c 40 30 20
36 00 58 c1 10 00 00 1a f2 26 80 0b 71 38 3c 40
64 64 44 05 58 c1 10 00 00 1a 00 00 00 00 00 00
00 00 00 00 00 00 00 00 00 00 00 00 00 00 00 02
00 0c 3e dd 0a 3c 6e 15 11 1e 6e 0a 20 20 00 5c

----------------

Block 0, Base EDID:
  EDID Structure Version & Revision: 1.4
  Vendor & Product Identification:
    Manufacturer: BOE
    Model: 1849
    Made in: week 1 of 2017
  Basic Display Parameters & Features:
    Digital display
    Bits per primary color channel: 6
    DisplayPort interface
    Maximum image size: 34 cm x 19 cm
    Gamma: 2.20
    Supported color formats: RGB 4:4:4
    First detailed timing includes the native pixel format and preferred refresh rate
  Color Characteristics:
    Red  : 0.5898, 0.3496
    Green: 0.3291, 0.5546
    Blue : 0.1523, 0.1181
    White: 0.3125, 0.3281
  Established Timings I & II: none
  Standard Timings: none
  Detailed Timing Descriptors:
    DTD 1:  1920x1080   60.003690 Hz  16:9     68.404 kHz    149.600000 MHz (344 mm x 193 mm)
                 Hfront   48 Hsync  32 Hback  187 Hpol P
                 Vfront    3 Vsync   6 Vback   51 Vpol N
    DTD 2:  1920x1080   39.989090 Hz  16:9     45.588 kHz     99.700000 MHz (344 mm x 193 mm)
                 Hfront  100 Hsync 100 Hback   67 Hpol P
                 Vfront   20 Vsync  20 Vback   20 Vpol N
    Empty Descriptor
    Manufacturer-Specified Display Descriptor (0x02): 00 02 00 0c 3e dd 0a 3c 6e 15 11 1e 6e 0a 20 20 '....>..<n...n.  '
Checksum: 0x5c

----------------

Failures:

Block 0, Base EDID:
  Empty Descriptor: Use Dummy Descriptor instead of all zeroes.
  Missing Display Product Name.

EDID conformity: FAIL
