
EDID (hex):
00ffffffffffff0009e5f10700000000
011c010495221378020980955c5a9129
21505400000001010101010101010101
010101010101033a803671381e403020
360058c11000001a0000000000000000
00000000000000000000000000fe0042
4f452043510a202020202020000000fe
004e5431353646484d2d4e36320a003e

Extracted contents:
header:          00 ff ff ff ff ff ff 00
serial number:   09 e5 f1 07 00 00 00 00 01 1c
version:         01 04
basic params:    95 22 13 78 02
chroma info:     09 80 95 5c 5a 91 29 21 50 54
established:     00 00 00
standard:        01 01 01 01 01 01 01 01 01 01 01 01 01 01 01 01
descriptor 1:    03 3a 80 36 71 38 1e 40 30 20 36 00 58 c1 10 00 00 1a
descriptor 2:    00 00 00 00 00 00 00 00 00 00 00 00 00 00 00 00 00 00
descriptor 3:    00 00 00 fe 00 42 4f 45 20 43 51 0a 20 20 20 20 20 20
descriptor 4:    00 00 00 fe 00 4e 54 31 35 36 46 48 4d 2d 4e 36 32 0a
extensions:      00
checksum:        3e

EDID version: 1.4
Manufacturer: BOE Model 7f1 Serial Number --
Made in week 1 of 2018
Digital display
6 bits per primary color channel
DisplayPort interface
Maximum image size: 34 cm x 19 cm
Gamma: 2.20
Supported color formats: RGB 4:4:4
First detailed timing includes the native pixel format and preferred refresh rate
Display x,y Chromaticity:
  Red:   0.5820, 0.3593
  Green: 0.3535, 0.5673
  Blue:  0.1621, 0.1289
  White: 0.3125, 0.3281
Established timings supported:
Standard timings supported:
Detailed mode: Clock 148.510 MHz, 344 mm x 193 mm
               1920 1968 2000 2230 hborder 0
               1080 1083 1089 1110 vborder 0
               +hsync -vsync 
               VertFreq: 59 Hz, HorFreq: 66596 Hz
Manufacturer-specified data, tag 0
ASCII string: BOE CQ
ASCII string: NT156FHM-N62
Checksum: 0x3e (valid)
EDID block does NOT conform to EDID 1.4!
	Missing name descriptor
	Missing monitor ranges
