edid-decode (hex):

00 ff ff ff ff ff ff 00 4d d9 00 34 01 01 01 01
1a 0f 01 03 0e 22 1b 78 ea 2e e5 a4 57 4a 9c 25
11 50 54 ad cf 00 81 80 81 40 01 01 01 01 01 01
01 01 01 01 01 01 30 2a 00 98 51 00 2a 40 30 70
13 00 52 0e 11 00 00 1e 00 00 00 fd 00 30 4b 1c
51 0e 00 0a 20 20 20 20 20 20 00 00 00 fc 00 53
44 4d 2d 53 37 35 41 2f 45 0a 20 20 00 00 00 ff
00 36 37 30 38 38 33 34 0a 20 20 20 20 20 00 22

00 ff ff ff ff ff ff 00 4d d9 00 34 01 01 01 01
1a 0f 01 03 0e 22 1b 78 ea 2e e5 a4 57 4a 9c 25
11 50 54 ad cf 00 81 80 81 40 01 01 01 01 01 01
01 01 01 01 01 01 30 2a 00 98 51 00 2a 40 30 70
13 00 52 0e 11 00 00 1e 00 00 00 fd 00 30 4b 1c
51 0e 00 0a 20 20 20 20 20 20 00 00 00 fc 00 53
44 4d 2d 53 37 35 41 2f 45 0a 20 20 00 00 00 ff
00 36 37 30 38 38 33 34 0a 20 20 20 20 20 00 22

----------------

Block 0, Base EDID:
  EDID Structure Version & Revision: 1.3
  Vendor & Product Identification:
    Manufacturer: SNY
    Model: 13312
    Serial Number: ...
    Made in: week 26 of 2005
  Basic Display Parameters & Features:
    Analog display
    Signal Level Standard: 0.700 : 0.300 : 1.000 V p-p
    Blank level equals black level
    Sync: Separate Composite SyncOnGreen
    Maximum image size: 34 cm x 27 cm
    Gamma: 2.20
    DPMS levels: Standby Suspend Off
    RGB color display
    First detailed timing is the preferred timing
  Color Characteristics:
    Red  : 0.6406, 0.3417
    Green: 0.2919, 0.6113
    Blue : 0.1474, 0.0683
    White: 0.3134, 0.3291
  Established Timings I & II:
    IBM     :   720x400    70.081663 Hz   9:5     31.467 kHz     28.320000 MHz
    DMT 0x04:   640x480    59.940476 Hz   4:3     31.469 kHz     25.175000 MHz
    DMT 0x05:   640x480    72.808802 Hz   4:3     37.861 kHz     31.500000 MHz
    DMT 0x06:   640x480    75.000000 Hz   4:3     37.500 kHz     31.500000 MHz
    DMT 0x09:   800x600    60.316541 Hz   4:3     37.879 kHz     40.000000 MHz
    DMT 0x0a:   800x600    72.187572 Hz   4:3     48.077 kHz     50.000000 MHz
    DMT 0x0b:   800x600    75.000000 Hz   4:3     46.875 kHz     49.500000 MHz
    DMT 0x10:  1024x768    60.003840 Hz   4:3     48.363 kHz     65.000000 MHz
    DMT 0x11:  1024x768    70.069359 Hz   4:3     56.476 kHz     75.000000 MHz
    DMT 0x12:  1024x768    75.028582 Hz   4:3     60.023 kHz     78.750000 MHz
    DMT 0x24:  1280x1024   75.024675 Hz   5:4     79.976 kHz    135.000000 MHz
  Standard Timings:
    DMT 0x23:  1280x1024   60.019740 Hz   5:4     63.981 kHz    108.000000 MHz
    DMT 0x20:  1280x960    60.000000 Hz   4:3     60.000 kHz    108.000000 MHz
  Detailed Timing Descriptors:
    DTD 1:  1280x1024   60.019740 Hz   5:4     63.981 kHz    108.000000 MHz (338 mm x 270 mm)
                 Hfront   48 Hsync 112 Hback  248 Hpol P
                 Vfront    1 Vsync   3 Vback   38 Vpol P
    Display Range Limits:
      Monitor ranges (GTF): 48-75 Hz V, 28-81 kHz H, max dotclock 140 MHz
    Display Product Name: 'SDM-S75A/E'
    Display Product Serial Number: ...
Checksum: 0x22

----------------

Block 1, Unknown EDID Extension Block 0x00:
  00 ff ff ff ff ff ff 00 4d d9 00 34 01 01 01 01 '........M..4....'
  1a 0f 01 03 0e 22 1b 78 ea 2e e5 a4 57 4a 9c 25 '.....".x....WJ.%'
  11 50 54 ad cf 00 81 80 81 40 01 01 01 01 01 01 '.PT......@......'
  01 01 01 01 01 01 30 2a 00 98 51 00 2a 40 30 70 '......0*..Q.*@0p'
  13 00 52 0e 11 00 00 1e 00 00 00 fd 00 30 4b 1c '..R..........0K.'
  51 0e 00 0a 20 20 20 20 20 20 00 00 00 fc 00 53 'Q...      .....S'
  44 4d 2d 53 37 35 41 2f 45 0a 20 20 00 00 00 ff 'DM-S75A/E.  ....'
  00 36 37 30 38 38 33 34 0a 20 20 20 20 20 00 22 '.6708834.     ."'
Checksum: 0x22

----------------

Failures:

Block 1, Base EDID:
  Unknown Extension Block.
EDID:
  Base EDID: EDID specified 0 extension block(s), but found 1 extension block(s).

EDID conformity: FAIL
