edid-decode (hex):

00 ff ff ff ff ff ff 00 1a b3 21 01 3d 4b 00 00
12 0b 01 03 08 1e 17 78 ea ec de 9e 54 47 97 23
1c 4c 54 bf ee 00 61 40 61 4a 61 4f 45 40 45 4f
31 40 31 4f 01 01 64 19 00 30 41 00 26 30 18 88
36 00 30 e4 10 00 00 18 00 00 00 ff 00 59 45 54
50 31 31 39 32 36 31 0a 20 20 00 00 00 fd 00 37
4b 1e 3d 08 00 0a 20 20 20 20 20 20 00 00 00 fc
00 43 33 38 33 46 41 0a 20 20 20 20 20 20 00 b2

----------------

Block 0, Base EDID:
  EDID Structure Version & Revision: 1.3
  Vendor & Product Identification:
    Manufacturer: FUS
    Model: 289
    Serial Number: ...
    Made in: week 18 of 2001
  Basic Display Parameters & Features:
    Analog display
    Input voltage level: 0.7/0.3 V
    Sync: Separate
    Maximum image size: 30 cm x 23 cm
    Gamma: 2.20
    DPMS levels: Standby Suspend Off
    RGB color display
    First detailed timing is preferred timing
  Color Characteristics:
    Red  : 0.6201, 0.3300
    Green: 0.2802, 0.5898
    Blue : 0.1396, 0.1103
    White: 0.2998, 0.3300
  Established Timings I & II:
    IBM     :   720x400    70.082 Hz   9:5    31.467 kHz  28.320 MHz
    DMT 0x04:   640x480    59.940 Hz   4:3    31.469 kHz  25.175 MHz
    Apple   :   640x480    66.667 Hz   4:3    35.000 kHz  30.240 MHz
    DMT 0x05:   640x480    72.809 Hz   4:3    37.861 kHz  31.500 MHz
    DMT 0x06:   640x480    75.000 Hz   4:3    37.500 kHz  31.500 MHz
    DMT 0x08:   800x600    56.250 Hz   4:3    35.156 kHz  36.000 MHz
    DMT 0x09:   800x600    60.317 Hz   4:3    37.879 kHz  40.000 MHz
    DMT 0x0a:   800x600    72.188 Hz   4:3    48.077 kHz  50.000 MHz
    DMT 0x0b:   800x600    75.000 Hz   4:3    46.875 kHz  49.500 MHz
    Apple   :   832x624    74.551 Hz   4:3    49.726 kHz  57.284 MHz
    DMT 0x10:  1024x768    60.004 Hz   4:3    48.363 kHz  65.000 MHz
    DMT 0x11:  1024x768    70.069 Hz   4:3    56.476 kHz  75.000 MHz
    DMT 0x12:  1024x768    75.029 Hz   4:3    60.023 kHz  78.750 MHz
  Standard Timings:
    DMT 0x10:  1024x768    60.004 Hz   4:3    48.363 kHz  65.000 MHz
    GTF     :  1024x768    70.000 Hz   4:3    56.000 kHz  76.160 MHz
    DMT 0x12:  1024x768    75.029 Hz   4:3    60.023 kHz  78.750 MHz
    DMT 0x09:   800x600    60.317 Hz   4:3    37.879 kHz  40.000 MHz
    DMT 0x0b:   800x600    75.000 Hz   4:3    46.875 kHz  49.500 MHz
    DMT 0x04:   640x480    59.940 Hz   4:3    31.469 kHz  25.175 MHz
    DMT 0x06:   640x480    75.000 Hz   4:3    37.500 kHz  31.500 MHz
  Detailed Timing Descriptors:
    DTD 1:  1024x768    60.727 Hz   4:3    48.946 kHz  65.000 MHz (304 mm x 228 mm)
                 Hfront   24 Hsync 136 Hback 144 Hpol N
                 Vfront    3 Vsync   6 Vback  29 Vpol N
    Display Product Serial Number: ...
  Display Range Limits:
    Monitor ranges (GTF): 55-75 Hz V, 30-61 kHz H, max dotclock 80 MHz
    Display Product Name: 'C383FA'
Checksum: 0xb2

----------------

EDID conformity: PASS
