
EDID (hex):
00ffffffffffff001c54033400000000
2e1f0104b55021783b4beaac5147a725
125054bfef80714f81c0814081809500
a9c0b300d1c0f57c70a0d0a029503020
35001d4e3100001a000000ff00323134
3632423030333533340a000000fd0030
90dede4e010a202020202020000000fc
0047333457514320410a2020202002d4
020334f44e919f859404130312010211
4e4700230a0707830100006d1a000002
113090000000000000e305e301e60607
01636127d4bc00a0a0a02950301f3500
1d4e310000183a6b70a0d0a055503020
35001d4e3100001e1ccf708cd0a02950
302035001d4e3100001e6a5e00a0a0a0
2950302035001d4e3100001e0000000a
7012790000030014bf2f01046f0d9f00
2f001f009f053b000280040007000a08
81000804000402100003011450ae0004
ff09b3002f003f003704320002800400
03011457ec0004ff0903012d003f009f
0531000280040003011442910004ff09
b3002f003f0037043200028004000000
00000000000000000000000000006e90

Extracted contents:
header:          00 ff ff ff ff ff ff 00
serial number:   1c 54 03 34 00 00 00 00 2e 1f
version:         01 04
basic params:    b5 50 21 78 3b
chroma info:     4b ea ac 51 47 a7 25 12 50 54
established:     bf ef 80
standard:        71 4f 81 c0 81 40 81 80 95 00 a9 c0 b3 00 d1 c0
descriptor 1:    f5 7c 70 a0 d0 a0 29 50 30 20 35 00 1d 4e 31 00 00 1a
descriptor 2:    00 00 00 ff 00 32 31 34 36 32 42 30 30 33 35 33 34 0a
descriptor 3:    00 00 00 fd 00 30 90 de de 4e 01 0a 20 20 20 20 20 20
descriptor 4:    00 00 00 fc 00 47 33 34 57 51 43 20 41 0a 20 20 20 20
extensions:      02
checksum:        d4

EDID version: 1.4
Manufacturer: GBT Model 3403 Serial Number --
Made in week 46 of 2021
Digital display
10 bits per primary color channel
DisplayPort interface
Maximum image size: 80 cm x 33 cm
Gamma: 2.20
DPMS levels: Off
Supported color formats: RGB 4:4:4, YCrCb 4:4:4, YCrCb 4:2:2
First detailed timing includes the native pixel format and preferred refresh rate
Display is continuous frequency
Display x,y Chromaticity:
  Red:   0.6728, 0.3164
  Green: 0.2792, 0.6552
  Blue:  0.1474, 0.0722
  White: 0.3144, 0.3300
Established timings supported:
  720x400@70Hz 9:5 HorFreq: 31469 Hz Clock: 28.320 MHz
  640x480@60Hz 4:3 HorFreq: 31469 Hz Clock: 25.175 MHz
  640x480@67Hz 4:3 HorFreq: 35000 Hz Clock: 30.240 MHz
  640x480@72Hz 4:3 HorFreq: 37900 Hz Clock: 31.500 MHz
  640x480@75Hz 4:3 HorFreq: 37500 Hz Clock: 31.500 MHz
  800x600@56Hz 4:3 HorFreq: 35200 Hz Clock: 36.000 MHz
  800x600@60Hz 4:3 HorFreq: 37900 Hz Clock: 40.000 MHz
  800x600@72Hz 4:3 HorFreq: 48100 Hz Clock: 50.000 MHz
  800x600@75Hz 4:3 HorFreq: 46900 Hz Clock: 49.500 MHz
  832x624@75Hz 4:3 HorFreq: 49726 Hz Clock: 57.284 MHz
  1024x768@60Hz 4:3 HorFreq: 48400 Hz Clock: 65.000 MHz
  1024x768@70Hz 4:3 HorFreq: 56500 Hz Clock: 75.000 MHz
  1024x768@75Hz 4:3 HorFreq: 60000 Hz Clock: 78.750 MHz
  1280x1024@75Hz 5:4 HorFreq: 80000 Hz Clock: 135.000 MHz
  1152x870@75Hz 192:145 HorFreq: 67500 Hz Clock: 108.000 MHz
Standard timings supported:
  1152x864@75Hz 4:3 HorFreq: 67500 Hz Clock: 108.000 MHz
  1280x720@60Hz 16:9
  1280x960@60Hz 4:3 HorFreq: 60000 Hz Clock: 108.000 MHz
  1280x1024@60Hz 5:4 HorFreq: 64000 Hz Clock: 108.000 MHz
  1440x900@60Hz 16:10 HorFreq: 55500 Hz Clock: 88.750 MHz
  1600x900@60Hz 16:9
  1680x1050@60Hz 16:10 HorFreq: 64700 Hz Clock: 119.000 MHz
  1920x1080@60Hz 16:9
Detailed mode: Clock 319.890 MHz, 797 mm x 334 mm
               3440 3488 3520 3600 hborder 0
               1440 1443 1448 1481 vborder 0
               +hsync -vsync 
               VertFreq: 59 Hz, HorFreq: 88858 Hz
Serial number: --
Monitor ranges (bare limits): 48-144Hz V, 222-222kHz H, max dotclock 780MHz
Monitor name: G34WQC A
Has 2 extension blocks
Checksum: 0xd4 (valid)

CTA extension block
Extension version: 3
48 bytes of CTA data
  Video data block
    VIC  17 720x576@50Hz 4:3 (native) HorFreq: 31250 Hz Clock: 27.000 MHz
    VIC  31 1920x1080@50Hz 16:9 (native) HorFreq: 56250 Hz Clock: 148.500 MHz
    VIC   5 1920x1080i@60Hz 16:9 (native) HorFreq: 33750 Hz Clock: 74.250 MHz
    VIC  20 1920x1080i@50Hz 16:9 (native) HorFreq: 28125 Hz Clock: 74.250 MHz
    VIC   4 1280x720@60Hz 16:9  HorFreq: 45000 Hz Clock: 74.250 MHz
    VIC  19 1280x720@50Hz 16:9  HorFreq: 37500 Hz Clock: 74.250 MHz
    VIC   3 720x480@60Hz 16:9  HorFreq: 31469 Hz Clock: 27.000 MHz
    VIC  18 720x576@50Hz 16:9  HorFreq: 31250 Hz Clock: 27.000 MHz
    VIC   1 640x480@60Hz 4:3  HorFreq: 31469 Hz Clock: 25.175 MHz
    VIC   2 720x480@60Hz 4:3  HorFreq: 31469 Hz Clock: 27.000 MHz
    VIC  17 720x576@50Hz 4:3  HorFreq: 31250 Hz Clock: 27.000 MHz
    VIC  78 1920x1080@120Hz 64:27  HorFreq: 135000 Hz Clock: 297.000 MHz
    VIC  71 1280x720@120Hz 64:27  HorFreq: 91000 Hz Clock: 148.500 MHz
  Audio data block
    Linear PCM, max channels 3
      Supported sample rates (kHz): 48 44.1 32
      Supported sample sizes (bits): 24 20 16
  Speaker allocation data block
    Speaker map:
      FL/FR - Front Left/Right
  Vendor-specific data block, OUI 00001a
  Extended tag: Colorimetry data block
    xvYCC601
    xvYCC709
    BT2020cYCC
    BT2020YCC
    BT2020RGB
  Extended tag: HDR static metadata data block
    Electro optical transfer functions:
      Traditional gamma - SDR luminance range
      Traditional gamma - HDR luminance range
      SMPTE ST2084
    Supported static metadata descriptors:
      Static metadata type 1
    Desired content max luminance: 99 (426.856 cd/m^2)
    Desired content max frame-average luminance: 97 (408.759 cd/m^2)
    Desired content min luminance: 39 (0.100 cd/m^2)
Underscans PC formats by default
Basic audio support
Supports YCbCr 4:4:4
Supports YCbCr 4:2:2
4 native detailed modes
Detailed mode: Clock 483.400 MHz, 797 mm x 334 mm
               2560 2608 2639 2720 hborder 0
               1440 1443 1448 1481 vborder 0
               -hsync -vsync 
               VertFreq: 120 Hz, HorFreq: 177720 Hz
Detailed mode: Clock 274.500 MHz, 797 mm x 334 mm
               3440 3488 3520 3600 hborder 0
               1440 1443 1448 1525 vborder 0
               +hsync +vsync 
               VertFreq: 50 Hz, HorFreq: 76250 Hz
Detailed mode: Clock 530.200 MHz, 797 mm x 334 mm
               3440 3488 3520 3580 hborder 0
               1440 1443 1448 1481 vborder 0
               +hsync +vsync 
               VertFreq: 100 Hz, HorFreq: 148100 Hz
Detailed mode: Clock 241.700 MHz, 797 mm x 334 mm
               2560 2608 2640 2720 hborder 0
               1440 1443 1448 1481 vborder 0
               +hsync +vsync 
               VertFreq: 60 Hz, HorFreq: 88860 Hz
Checksum: 0xa (valid)


DisplayID extension block
Extension version: 18
Length 121, version 18, extension count 0
Checksum: 0x6e (valid)
Type 1 detailed timing: aspect: 16:9,  
Detailed mode: Clock 777.590 MHz, 0 mm x 0 mm
               3439 3486 3517 3598
               1439 1441 1445 1498
               -hsync +vsync
VESA DMT timing block
Type 1 detailed timing: aspect: 16:9,  
Detailed mode: Clock 446.240 MHz, 0 mm x 0 mm
               2559 2606 2669 2738
               1079 1081 1085 1129
               -hsync +vsync
Type 1 detailed timing: aspect: 16:9,  
Detailed mode: Clock 605.030 MHz, 0 mm x 0 mm
               2559 2604 2667 2818
               1439 1441 1445 1488
               -hsync +vsync
Type 1 detailed timing: aspect: 16:9,  
Detailed mode: Clock 371.860 MHz, 0 mm x 0 mm
               2559 2606 2669 2738
               1079 1081 1085 1129
               -hsync +vsync

Warning: One or more of the timings is out of range of the Monitor Ranges:
  Vertical Freq: 50 - 120 Hz
  Horizontal Freq: 28125 - 177720 Hz
  Maximum Clock: 530.200 MHz
