
EDID (hex):
00ffffffffffff0030af14f04c4e3530
351301036e342078ee1ec5ae4f34b126
0e5054a508008180a940d1c071408140
a9c001010101023a801871382d40582c
450006442100001a662150b051001b30
4070360006442100001e662156aa5100
1e30468f330006442100001e000000fc
004c656e6f766f2041494f0a202000d9

Extracted contents:
header:          00 ff ff ff ff ff ff 00
serial number:   30 af 14 f0 4c 4e 35 30 35 13
version:         01 03
basic params:    6e 34 20 78 ee
chroma info:     1e c5 ae 4f 34 b1 26 0e 50 54
established:     a5 08 00
standard:        81 80 a9 40 d1 c0 71 40 81 40 a9 c0 01 01 01 01
descriptor 1:    02 3a 80 18 71 38 2d 40 58 2c 45 00 06 44 21 00 00 1a
descriptor 2:    66 21 50 b0 51 00 1b 30 40 70 36 00 06 44 21 00 00 1e
descriptor 3:    66 21 56 aa 51 00 1e 30 46 8f 33 00 06 44 21 00 00 1e
descriptor 4:    00 00 00 fc 00 4c 65 6e 6f 76 6f 20 41 49 4f 0a 20 20
extensions:      00
checksum:        d9

EDID version: 1.3
Manufacturer: LEO Model f014 Serial Number --
Made in week 53 of 2009
Analog display, Input voltage level: 0.7/0.7 V
Sync: Separate Composite SyncOnGreen 
Maximum image size: 52 cm x 32 cm
Gamma: 2.20
DPMS levels: Standby Suspend Off
RGB color display
Default (sRGB) color space is primary color space
First detailed timing is preferred timing
Display x,y Chromaticity:
  Red:   0.6796, 0.3095
  Green: 0.2060, 0.6933
  Blue:  0.1513, 0.0546
  White: 0.3134, 0.3291
Established timings supported:
  720x400@70Hz 9:5 HorFreq: 31469 Hz Clock: 28.320 MHz
  640x480@60Hz 4:3 HorFreq: 31469 Hz Clock: 25.175 MHz
  640x480@75Hz 4:3 HorFreq: 37500 Hz Clock: 31.500 MHz
  800x600@60Hz 4:3 HorFreq: 37900 Hz Clock: 40.000 MHz
  1024x768@60Hz 4:3 HorFreq: 48400 Hz Clock: 65.000 MHz
Standard timings supported:
  1280x1024@60Hz 5:4 HorFreq: 64000 Hz Clock: 108.000 MHz
  1600x1200@60Hz 4:3 HorFreq: 75000 Hz Clock: 162.000 MHz
  1920x1080@60Hz 16:9
  1152x864@60Hz 4:3
  1280x960@60Hz 4:3 HorFreq: 60000 Hz Clock: 108.000 MHz
  1600x900@60Hz 16:9
Detailed mode: Clock 148.500 MHz, 518 mm x 324 mm
               1920 2008 2052 2200 hborder 0
               1080 1084 1089 1125 vborder 0
               +hsync -vsync 
               VertFreq: 60 Hz, HorFreq: 67500 Hz
Detailed mode: Clock 85.500 MHz, 518 mm x 324 mm
               1360 1424 1536 1792 hborder 0
                768  771  777  795 vborder 0
               +hsync +vsync 
               VertFreq: 60 Hz, HorFreq: 47712 Hz
Detailed mode: Clock 85.500 MHz, 518 mm x 324 mm
               1366 1436 1579 1792 hborder 0
                768  771  774  798 vborder 0
               +hsync +vsync 
               VertFreq: 59 Hz, HorFreq: 47712 Hz
Monitor name: Lenovo AIO
Checksum: 0xd9 (valid)
EDID block does NOT conform to EDID 1.3!
	sRGB is signaled, but the chromaticities do not match
	Missing monitor ranges
