edid-decode (hex):

00 ff ff ff ff ff ff 00 06 10 10 92 80 d3 01 02
00 08 01 01 68 27 1d 86 e8 0d c9 a0 57 47 98 27
12 48 4c 35 ef 80 31 59 45 59 61 59 81 80 81 99
a9 40 a9 4f a9 59 10 0e 80 c0 20 e0 1d 10 38 38
13 00 84 23 11 00 00 1e 1b 4f 40 30 62 b0 32 40
40 c0 13 00 84 23 11 00 00 1e 00 00 00 fd 00 30
78 1e 6b 17 00 0a 20 20 20 20 20 20 00 00 00 fc
00 53 74 75 64 69 6f 44 73 70 6c 79 32 31 00 ba

----------------

Block 0, Base EDID:
  EDID Structure Version & Revision: 1.1
  Vendor & Product Identification:
    Manufacturer: APP
    Model: 37392
    Serial Number: ...
    Made in: 1998
  Basic Display Parameters & Features:
    Analog display
    Signal Level Standard: 0.700 : 0.000 : 0.700 V p-p
    Blank level equals black level
    Sync: Separate
    Maximum image size: 39 cm x 29 cm
    Gamma: 2.34
    DPMS levels: Standby Suspend Off
    RGB color display
  Color Characteristics:
    Red  : 0.6250, 0.3398
    Green: 0.2802, 0.5947
    Blue : 0.1552, 0.0703
    White: 0.2832, 0.2978
  Established Timings I & II:
    DMT 0x04:   640x480    59.940476 Hz   4:3     31.469 kHz     25.175000 MHz
    Apple   :   640x480    66.666667 Hz   4:3     35.000 kHz     30.240000 MHz
    DMT 0x06:   640x480    75.000000 Hz   4:3     37.500 kHz     31.500000 MHz
    DMT 0x09:   800x600    60.316541 Hz   4:3     37.879 kHz     40.000000 MHz
    DMT 0x0a:   800x600    72.187572 Hz   4:3     48.077 kHz     50.000000 MHz
    DMT 0x0b:   800x600    75.000000 Hz   4:3     46.875 kHz     49.500000 MHz
    Apple   :   832x624    74.551266 Hz   4:3     49.726 kHz     57.284000 MHz
    DMT 0x10:  1024x768    60.003840 Hz   4:3     48.363 kHz     65.000000 MHz
    DMT 0x11:  1024x768    70.069359 Hz   4:3     56.476 kHz     75.000000 MHz
    DMT 0x12:  1024x768    75.028582 Hz   4:3     60.023 kHz     78.750000 MHz
    DMT 0x24:  1280x1024   75.024675 Hz   5:4     79.976 kHz    135.000000 MHz
    Apple   :  1152x870    75.061550 Hz 192:145   68.681 kHz    100.000000 MHz
  Standard Timings:
    DMT 0x07:   640x480    85.008312 Hz   4:3     43.269 kHz     36.000000 MHz
    DMT 0x0c:   800x600    85.061274 Hz   4:3     53.674 kHz     56.250000 MHz
    DMT 0x13:  1024x768    84.996690 Hz   4:3     68.677 kHz     94.500000 MHz
    DMT 0x23:  1280x1024   60.019740 Hz   5:4     63.981 kHz    108.000000 MHz
    DMT 0x25:  1280x1024   85.024098 Hz   5:4     91.146 kHz    157.500000 MHz
    DMT 0x33:  1600x1200   60.000000 Hz   4:3     75.000 kHz    162.000000 MHz
    DMT 0x36:  1600x1200   75.000000 Hz   4:3     93.750 kHz    202.500000 MHz
    DMT 0x37:  1600x1200   85.000000 Hz   4:3    106.250 kHz    229.500000 MHz
  Detailed Timing Descriptors:
    DTD 1:   640x480    85.008312 Hz   4:3     43.269 kHz     36.000000 MHz (388 mm x 291 mm)
                 Hfront   56 Hsync  56 Hback   80 Hpol P
                 Vfront    1 Vsync   3 Vback   25 Vpol P
    DTD 2:  1600x1200   75.003704 Hz   4:3     93.755 kHz    202.510000 MHz (388 mm x 291 mm)
                 Hfront   64 Hsync 192 Hback  304 Hpol P
                 Vfront    1 Vsync   3 Vback   46 Vpol P
    Display Range Limits:
      Monitor ranges (GTF): 48-120 Hz V, 30-107 kHz H, max dotclock 230 MHz
    Display Product Name: 'StudioDsply21'
Checksum: 0xba

----------------

Warnings:

Block 0, Base EDID:
  EDID Structure Version & Revision: EDID 1.1 is deprecated, do not use.
  Detailed Timing Descriptor #1: DTD is similar but not identical to DMT 0x07.

EDID conformity: PASS
