
EDID (hex):
00ffffffffffff0010ac23a001010101
3210010368221b78eeaea5a6544c9926
145054a54b00714f8180010101010101
010101010101302a009851002a403070
1300520e1100001e000000fd00384b1e
510e000a202020202020000000ff0037
33373331364342323645370a000000fc
0044454c4c204531373746500a200021

Extracted contents:
header:          00 ff ff ff ff ff ff 00
serial number:   10 ac 23 a0 01 01 01 01 32 10
version:         01 03
basic params:    68 22 1b 78 ee
chroma info:     ae a5 a6 54 4c 99 26 14 50 54
established:     a5 4b 00
standard:        71 4f 81 80 01 01 01 01 01 01 01 01 01 01 01 01
descriptor 1:    30 2a 00 98 51 00 2a 40 30 70 13 00 52 0e 11 00 00 1e
descriptor 2:    00 00 00 fd 00 38 4b 1e 51 0e 00 0a 20 20 20 20 20 20
descriptor 3:    00 00 00 ff 00 37 33 37 33 31 36 43 42 32 36 45 37 0a
descriptor 4:    00 00 00 fc 00 44 45 4c 4c 20 45 31 37 37 46 50 0a 20
extensions:      00
checksum:        21

EDID version: 1.3
Manufacturer: DEL Model a023 Serial Number --
Made in week 50 of 2006
Analog display, Input voltage level: 0.7/0.7 V
Sync: Separate 
Maximum image size: 34 cm x 27 cm
Gamma: 2.20
DPMS levels: Standby Suspend Off
RGB color display
Default (sRGB) color space is primary color space
First detailed timing is preferred timing
Display x,y Chromaticity:
  Red:   0.6503, 0.3300
  Green: 0.2998, 0.5996
  Blue:  0.1503, 0.0800
  White: 0.3134, 0.3291
Established timings supported:
  720x400@70Hz 9:5 HorFreq: 31469 Hz Clock: 28.320 MHz
  640x480@60Hz 4:3 HorFreq: 31469 Hz Clock: 25.175 MHz
  640x480@75Hz 4:3 HorFreq: 37500 Hz Clock: 31.500 MHz
  800x600@60Hz 4:3 HorFreq: 37900 Hz Clock: 40.000 MHz
  800x600@75Hz 4:3 HorFreq: 46900 Hz Clock: 49.500 MHz
  1024x768@60Hz 4:3 HorFreq: 48400 Hz Clock: 65.000 MHz
  1024x768@75Hz 4:3 HorFreq: 60000 Hz Clock: 78.750 MHz
  1280x1024@75Hz 5:4 HorFreq: 80000 Hz Clock: 135.000 MHz
Standard timings supported:
  1152x864@75Hz 4:3 HorFreq: 67500 Hz Clock: 108.000 MHz
  1280x1024@60Hz 5:4 HorFreq: 64000 Hz Clock: 108.000 MHz
Detailed mode: Clock 108.000 MHz, 338 mm x 270 mm
               1280 1328 1440 1688 hborder 0
               1024 1025 1028 1066 vborder 0
               +hsync +vsync 
               VertFreq: 60 Hz, HorFreq: 63981 Hz
Monitor ranges (GTF): 56-75Hz V, 30-81kHz H, max dotclock 140MHz
Serial number: --
Monitor name: DELL E177FP
Checksum: 0x21 (valid)
EDID block does NOT conform to EDID 1.3!
	sRGB is signaled, but the chromaticities do not match
