
EDID (hex):
00ffffffffffff0010ac3bd04d593444
29180103802b1878ea2cc5a45650a128
0f5054a54b00714f8180a9c001010101
0101010101012f2640a060841a303020
3500b0f01000001a000000ff00504430
36443441384434594d0a000000fc0044
454c4c204532303134480a20000000fd
00384c1e5311000a202020202020018f
02031b61230907078301000067030c00
2000802d43908402e2000f8c0ad08a20
e02d10103e9600a05a00000000000000
00000000000000000000000000000000
00000000000000000000000000000000
00000000000000000000000000000000
00000000000000000000000000000000
00000000000000000000000000000029

Extracted contents:
header:          00 ff ff ff ff ff ff 00
serial number:   10 ac 3b d0 4d 59 34 44 29 18
version:         01 03
basic params:    80 2b 18 78 ea
chroma info:     2c c5 a4 56 50 a1 28 0f 50 54
established:     a5 4b 00
standard:        71 4f 81 80 a9 c0 01 01 01 01 01 01 01 01 01 01
descriptor 1:    2f 26 40 a0 60 84 1a 30 30 20 35 00 b0 f0 10 00 00 1a
descriptor 2:    00 00 00 ff 00 50 44 30 36 44 34 41 38 44 34 59 4d 0a
descriptor 3:    00 00 00 fc 00 44 45 4c 4c 20 45 32 30 31 34 48 0a 20
descriptor 4:    00 00 00 fd 00 38 4c 1e 53 11 00 0a 20 20 20 20 20 20
extensions:      01
checksum:        8f

EDID version: 1.3
Manufacturer: DEL Model d03b Serial Number --
Made in week 41 of 2014
Digital display
Maximum image size: 43 cm x 24 cm
Gamma: 2.20
DPMS levels: Standby Suspend Off
RGB color display
First detailed timing is preferred timing
Display x,y Chromaticity:
  Red:   0.6406, 0.3378
  Green: 0.3154, 0.6289
  Blue:  0.1591, 0.0585
  White: 0.3134, 0.3291
Established timings supported:
  720x400@70Hz 9:5 HorFreq: 31469 Hz Clock: 28.320 MHz
  640x480@60Hz 4:3 HorFreq: 31469 Hz Clock: 25.175 MHz
  640x480@75Hz 4:3 HorFreq: 37500 Hz Clock: 31.500 MHz
  800x600@60Hz 4:3 HorFreq: 37900 Hz Clock: 40.000 MHz
  800x600@75Hz 4:3 HorFreq: 46900 Hz Clock: 49.500 MHz
  1024x768@60Hz 4:3 HorFreq: 48400 Hz Clock: 65.000 MHz
  1024x768@75Hz 4:3 HorFreq: 60000 Hz Clock: 78.750 MHz
  1280x1024@75Hz 5:4 HorFreq: 80000 Hz Clock: 135.000 MHz
Standard timings supported:
  1152x864@75Hz 4:3 HorFreq: 67500 Hz Clock: 108.000 MHz
  1280x1024@60Hz 5:4 HorFreq: 64000 Hz Clock: 108.000 MHz
  1600x900@60Hz 16:9
Detailed mode: Clock 97.750 MHz, 432 mm x 240 mm
               1600 1648 1680 1760 hborder 0
                900  903  908  926 vborder 0
               +hsync -vsync 
               VertFreq: 59 Hz, HorFreq: 55539 Hz
Serial number: --
Monitor name: DELL E2014H
Monitor ranges (GTF): 56-76Hz V, 30-83kHz H, max dotclock 170MHz
Has 1 extension blocks
Checksum: 0x8f (valid)

CTA extension block
Extension version: 3
23 bytes of CTA data
  Audio data block
    Linear PCM, max channels 2
      Supported sample rates (kHz): 48 44.1 32
      Supported sample sizes (bits): 24 20 16
  Speaker allocation data block
    Speaker map:
      FL/FR - Front Left/Right
  Vendor-specific data block, OUI 000c03 (HDMI)
    Source physical address 2.0.0.0
    Supports_AI
    Maximum TMDS clock: 225MHz
  Video data block
    VIC  16 1920x1080@60Hz 16:9 (native) HorFreq: 67500 Hz Clock: 148.500 MHz
    VIC   4 1280x720@60Hz 16:9 (native) HorFreq: 45000 Hz Clock: 74.250 MHz
    VIC   2 720x480@60Hz 4:3  HorFreq: 31469 Hz Clock: 27.000 MHz
  Extended tag: Video capability data block
    YCbCr quantization: No Data (0)
    RGB quantization: No Data (0)
    PT scan behaviour: No Data (0)
    IT scan behaviour: Support both over- and underscan (3)
    CE scan behaviour: Support both over- and underscan (3)
Basic audio support
Supports YCbCr 4:4:4
1 native detailed modes
Detailed mode: Clock 27.000 MHz, 160 mm x 90 mm
                720  736  798  858 hborder 0
                480  489  495  525 vborder 0
               -hsync -vsync analog composite 
               VertFreq: 59 Hz, HorFreq: 31468 Hz
Checksum: 0x29 (valid)

EDID block does not conform at all!
	Both the serial number and the serial string are set
