edid-decode (hex):

00 ff ff ff ff ff ff 00 0d ae bd 15 00 00 00 00
11 16 01 04 95 22 13 78 02 e9 15 95 5a 56 93 27
1e 50 54 00 00 00 01 01 01 01 01 01 01 01 01 01
01 01 01 01 01 01 79 1d 56 c2 50 00 26 30 1f 41
4c 00 58 c2 10 00 00 18 00 00 00 fe 00 4e 31 35
36 42 47 45 2d 45 41 31 0a 20 00 00 00 fe 00 43
4d 4e 0a 20 20 20 20 20 20 20 20 20 00 00 00 fe
00 4e 31 35 36 42 47 45 2d 45 41 31 0a 20 00 6a

----------------

Block 0, Base EDID:
  EDID Structure Version & Revision: 1.4
  Vendor & Product Identification:
    Manufacturer: CMN
    Model: 5565
    Made in: week 17 of 2012
  Basic Display Parameters & Features:
    Digital display
    Bits per primary color channel: 6
    DisplayPort interface
    Maximum image size: 34 cm x 19 cm
    Gamma: 2.20
    Supported color formats: RGB 4:4:4
    First detailed timing includes the native pixel format and preferred refresh rate
  Color Characteristics:
    Red  : 0.5849, 0.3535
    Green: 0.3378, 0.5751
    Blue : 0.1523, 0.1181
    White: 0.3134, 0.3291
  Established Timings I & II: none
  Standard Timings: none
  Detailed Timing Descriptors:
    DTD 1:  1366x768    60.006681 Hz 683:384   48.365 kHz     75.450000 MHz (344 mm x 194 mm)
                 Hfront   31 Hsync  65 Hback   98 Hpol N
                 Vfront    4 Vsync  12 Vback   22 Vpol N
    Alphanumeric Data String: 'N156BGE-EA1'
    Alphanumeric Data String: 'CMN'
    Alphanumeric Data String: 'N156BGE-EA1'
Checksum: 0x6a

----------------

Failures:

Block 0, Base EDID:
  Missing Display Product Name.

EDID conformity: FAIL
