edid-decode (hex):

00 ff ff ff ff ff ff 00 0d ae 70 14 00 00 00 00
26 15 01 04 90 1f 11 78 0a cb d5 96 57 55 91 2a
24 50 54 00 00 00 01 01 01 01 01 01 01 01 01 01
01 01 01 01 01 01 da 1d 56 e2 50 00 20 30 44 2d
47 00 35 ae 10 00 00 1a e7 13 56 e2 50 00 20 30
44 2d 47 00 35 ae 10 00 00 1a 00 00 00 00 00 00
00 00 00 00 00 00 00 00 00 00 00 00 00 00 00 02
00 0c 49 ff 0a 3c 64 0a 14 24 64 00 00 00 00 ff

----------------

Block 0, Base EDID:
  EDID Structure Version & Revision: 1.4
  Vendor & Product Identification:
    Manufacturer: CMN
    Model: 5232
    Made in: week 38 of 2011
  Basic Display Parameters & Features:
    Digital display
    Bits per primary color channel: 6
    Digital interface is not defined
    Maximum image size: 31 cm x 17 cm
    Gamma: 2.20
    Supported color formats: RGB 4:4:4, YCrCb 4:4:4
    First detailed timing includes the native pixel format and preferred refresh rate
  Color Characteristics:
    Red  : 0.5888, 0.3398
    Green: 0.3339, 0.5693
    Blue : 0.1669, 0.1416
    White: 0.3134, 0.3291
  Established Timings I & II: none
  Standard Timings: none
  Detailed Timing Descriptors:
    DTD 1:  1366x768    60.003141 Hz 683:384   48.003 kHz     76.420000 MHz (309 mm x 174 mm)
                 Hfront   68 Hsync  45 Hback  113 Hpol P
                 Vfront    4 Vsync   7 Vback   21 Vpol N
    DTD 2:  1366x768    40.004711 Hz 683:384   32.004 kHz     50.950000 MHz (309 mm x 174 mm)
                 Hfront   68 Hsync  45 Hback  113 Hpol P
                 Vfront    4 Vsync   7 Vback   21 Vpol N
    Empty Descriptor
    Manufacturer-Specified Display Descriptor (0x02): 00 02 00 0c 49 ff 0a 3c 64 0a 14 24 64 00 00 00 '....I..<d..$d...'
Checksum: 0xff

----------------

Failures:

Block 0, Base EDID:
  Empty Descriptor: Use Dummy Descriptor instead of all zeroes.
  Missing Display Product Name.

EDID conformity: FAIL
