edid-decode (hex):

00 ff ff ff ff ff ff 00 0d ae 70 14 00 00 00 00
28 15 01 03 80 1e 11 78 0a d1 45 9b 59 57 8e 2b
23 50 54 00 00 00 01 01 01 01 01 01 01 01 01 01
01 01 01 01 01 01 12 1b 56 72 50 00 0c 30 10 22
26 00 35 ae 10 00 00 18 00 00 00 fe 00 4e 31 34
30 42 47 45 2d 4c 32 32 0a 20 00 00 00 fe 00 43
4d 4e 0a 20 20 20 20 20 20 20 20 20 00 00 00 fe
00 4e 31 34 30 42 47 45 2d 4c 32 32 0a 20 00 0e

----------------

Block 0, Base EDID:
  EDID Structure Version & Revision: 1.3
  Vendor & Product Identification:
    Manufacturer: CMN
    Model: 5232
    Made in: week 40 of 2011
  Basic Display Parameters & Features:
    Digital display
    Maximum image size: 30 cm x 17 cm
    Gamma: 2.20
    RGB color display
    First detailed timing is preferred timing
  Color Characteristics:
    Red  : 0.6083, 0.3486
    Green: 0.3398, 0.5556
    Blue : 0.1689, 0.1367
    White: 0.3134, 0.3291
  Established Timings I & II: none
  Standard Timings: none
  Detailed Timing Descriptors:
    DTD 1:  1366x768    60.031 Hz 683:384  46.824 kHz  69.300 MHz (309 mm x 174 mm)
                 Hfront   16 Hsync  34 Hback  64 Hpol N
                 Vfront    2 Vsync   6 Vback   4 Vpol N
    Alphanumeric Data String: 'N140BGE-L22'
    Alphanumeric Data String: 'CMN'
    Alphanumeric Data String: 'N140BGE-L22'
Checksum: 0xe
