edid-decode (hex):

00 ff ff ff ff ff ff 00 05 23 51 71 e6 16 00 00
2b 0c 01 03 68 1e 17 78 ea 71 f5 9f 55 4b 99 24
1c 4f 54 af ce 00 61 46 01 01 01 01 01 01 01 01
01 01 01 01 01 01 c3 1e 00 20 41 00 20 30 10 60
13 00 30 e4 10 00 00 1e 00 00 00 fd 00 31 4b 18
3d 08 00 0a 20 20 20 20 20 20 00 00 00 fc 00 46
2d 31 35 0a 20 20 20 20 20 20 20 20 00 00 00 ff
00 35 38 36 32 0a 20 20 20 20 20 20 20 20 00 df

00 ff ff ff ff ff ff 00 05 23 51 71 e6 16 00 00
2b 0c 01 03 68 1e 17 78 ea 71 f5 9f 55 4b 99 24
1c 4f 54 af ce 00 61 46 01 01 01 01 01 01 01 01
01 01 01 01 01 01 c3 1e 00 20 41 00 20 30 10 60
13 00 30 e4 10 00 00 1e 00 00 00 fd 00 31 4b 18
3d 08 00 0a 20 20 20 20 20 20 00 00 00 fc 00 46
2d 31 35 0a 20 20 20 20 20 20 20 20 00 00 00 ff
00 35 38 36 32 0a 20 20 20 20 20 20 20 20 00 df

----------------

Block 0, Base EDID:
  EDID Structure Version & Revision: 1.3
  Vendor & Product Identification:
    Manufacturer: AIC
    Model: 29009
    Serial Number: ...
    Made in: week 43 of 2002
  Basic Display Parameters & Features:
    Analog display
    Signal Level Standard: 0.700 : 0.000 : 0.700 V p-p
    Blank level equals black level
    Sync: Separate
    Maximum image size: 30 cm x 23 cm
    Gamma: 2.20
    DPMS levels: Standby Suspend Off
    RGB color display
    First detailed timing is the preferred timing
  Color Characteristics:
    Red  : 0.6220, 0.3349
    Green: 0.2929, 0.5986
    Blue : 0.1435, 0.1123
    White: 0.3095, 0.3291
  Established Timings I & II:
    IBM     :   720x400    70.081663 Hz   9:5     31.467 kHz     28.320000 MHz
    DMT 0x04:   640x480    59.940476 Hz   4:3     31.469 kHz     25.175000 MHz
    DMT 0x05:   640x480    72.808802 Hz   4:3     37.861 kHz     31.500000 MHz
    DMT 0x06:   640x480    75.000000 Hz   4:3     37.500 kHz     31.500000 MHz
    DMT 0x08:   800x600    56.250000 Hz   4:3     35.156 kHz     36.000000 MHz
    DMT 0x09:   800x600    60.316541 Hz   4:3     37.879 kHz     40.000000 MHz
    DMT 0x0a:   800x600    72.187572 Hz   4:3     48.077 kHz     50.000000 MHz
    DMT 0x0b:   800x600    75.000000 Hz   4:3     46.875 kHz     49.500000 MHz
    DMT 0x10:  1024x768    60.003840 Hz   4:3     48.363 kHz     65.000000 MHz
    DMT 0x11:  1024x768    70.069359 Hz   4:3     56.476 kHz     75.000000 MHz
    DMT 0x12:  1024x768    75.028582 Hz   4:3     60.023 kHz     78.750000 MHz
  Standard Timings:
    GTF     :  1024x768    65.999558 Hz   4:3     52.668 kHz     71.628000 MHz
  Detailed Timing Descriptors:
    DTD 1:  1024x768    75.028582 Hz   4:3     60.023 kHz     78.750000 MHz (304 mm x 228 mm)
                 Hfront   16 Hsync  96 Hback  176 Hpol P
                 Vfront    1 Vsync   3 Vback   28 Vpol P
    Display Range Limits:
      Monitor ranges (GTF): 49-75 Hz V, 24-61 kHz H, max dotclock 80 MHz
    Display Product Name: 'F-15'
    Display Product Serial Number: ...
Checksum: 0xdf

----------------

Block 1, Unknown EDID Extension Block 0x00:
  00 ff ff ff ff ff ff 00 05 23 51 71 e6 16 00 00 '.........#Qq....'
  2b 0c 01 03 68 1e 17 78 ea 71 f5 9f 55 4b 99 24 '+...h..x.q..UK.$'
  1c 4f 54 af ce 00 61 46 01 01 01 01 01 01 01 01 '.OT...aF........'
  01 01 01 01 01 01 c3 1e 00 20 41 00 20 30 10 60 '......... A. 0.`'
  13 00 30 e4 10 00 00 1e 00 00 00 fd 00 31 4b 18 '..0..........1K.'
  3d 08 00 0a 20 20 20 20 20 20 00 00 00 fc 00 46 '=...      .....F'
  2d 31 35 0a 20 20 20 20 20 20 20 20 00 00 00 ff '-15.        ....'
  00 35 38 36 32 0a 20 20 20 20 20 20 20 20 00 df '.5862.        ..'
Checksum: 0xdf

----------------

Failures:

Block 1, Base EDID:
  Unknown Extension Block.
EDID:
  Base EDID: EDID specified 0 extension block(s), but found 1 extension block(s).

EDID conformity: FAIL
