edid-decode (hex):

00 ff ff ff ff ff ff 00 1e 6d 71 5c 87 2d 00 00
08 22 01 03 80 36 1e 78 ea 31 35 a5 55 4e a1 26
0c 50 54 21 09 00 d1 c0 61 40 01 01 01 01 01 01
01 01 01 01 01 01 60 59 80 a0 70 38 14 40 30 20
35 00 1f 2e 21 00 00 1a 1a 36 80 a0 70 38 1f 40
30 20 3a 00 1f 2e 21 00 00 1a 00 00 00 fd 00 30
64 1e 78 19 00 0a 20 20 20 20 20 20 00 00 00 fc
00 4c 47 20 46 48 44 0a 20 20 20 20 20 20 01 48

02 03 16 f1 47 90 04 03 01 12 13 1f 23 09 07 07
65 03 0c 00 10 00 2a 44 80 a0 70 38 27 40 30 20
35 00 1f 2e 21 00 00 1e 01 1d 00 72 51 d0 1e 20
6e 28 55 00 1f 2e 21 00 00 1e 00 00 00 ff 00 34
30 38 4e 54 56 53 30 42 36 35 35 0a 00 00 00 00
00 00 00 00 00 00 00 00 00 00 00 00 00 00 00 00
00 00 00 00 00 00 00 00 00 00 00 00 00 00 00 00
00 00 00 00 00 00 00 00 00 00 00 00 00 00 00 fd

00 ff ff ff ff ff ff 00 1e 6d 71 5c 87 2d 00 00
08 22 01 03 80 36 1e 78 ea 31 35 a5 55 4e a1 26
0c 50 54 21 09 00 d1 c0 61 40 01 01 01 01 01 01
01 01 01 01 01 01 60 59 80 a0 70 38 14 40 30 20
35 00 1f 2e 21 00 00 1a 1a 36 80 a0 70 38 1f 40
30 20 3a 00 1f 2e 21 00 00 1a 00 00 00 fd 00 30
64 1e 78 19 00 0a 20 20 20 20 20 20 00 00 00 fc
00 4c 47 20 46 48 44 0a 20 20 20 20 20 20 01 48

02 03 16 f1 47 90 04 03 01 12 13 1f 23 09 07 07
65 03 0c 00 10 00 2a 44 80 a0 70 38 27 40 30 20
35 00 1f 2e 21 00 00 1e 01 1d 00 72 51 d0 1e 20
6e 28 55 00 1f 2e 21 00 00 1e 00 00 00 ff 00 34
30 38 4e 54 56 53 30 42 36 35 35 0a 00 00 00 00
00 00 00 00 00 00 00 00 00 00 00 00 00 00 00 00
00 00 00 00 00 00 00 00 00 00 00 00 00 00 00 00
00 00 00 00 00 00 00 00 00 00 00 00 00 00 00 fd

----------------

Block 0, Base EDID:
  EDID Structure Version & Revision: 1.3
  Vendor & Product Identification:
    Manufacturer: GSM
    Model: 23665
    Serial Number: ...
    Made in: week 8 of 2024
  Basic Display Parameters & Features:
    Digital display
    Maximum image size: 54 cm x 30 cm
    Gamma: 2.20
    DPMS levels: Standby Suspend Off
    RGB color display
    First detailed timing is the preferred timing
  Color Characteristics:
    Red  : 0.6445, 0.3349
    Green: 0.3046, 0.6298
    Blue : 0.1484, 0.0498
    White: 0.3134, 0.3291
  Established Timings I & II:
    DMT 0x04:   640x480    59.940476 Hz   4:3     31.469 kHz     25.175000 MHz
    DMT 0x09:   800x600    60.316541 Hz   4:3     37.879 kHz     40.000000 MHz
    DMT 0x10:  1024x768    60.003840 Hz   4:3     48.363 kHz     65.000000 MHz
    DMT 0x24:  1280x1024   75.024675 Hz   5:4     79.976 kHz    135.000000 MHz
  Standard Timings:
    DMT 0x52:  1920x1080   60.000000 Hz  16:9     67.500 kHz    148.500000 MHz
    DMT 0x10:  1024x768    60.003840 Hz   4:3     48.363 kHz     65.000000 MHz
  Detailed Timing Descriptors:
    DTD 1:  1920x1080  100.000000 Hz  16:9    110.000 kHz    228.800000 MHz (543 mm x 302 mm)
                 Hfront   48 Hsync  32 Hback   80 Hpol P
                 Vfront    3 Vsync   5 Vback   12 Vpol N
    DTD 2:  1920x1080   59.933878 Hz  16:9     66.587 kHz    138.500000 MHz (543 mm x 302 mm)
                 Hfront   48 Hsync  32 Hback   80 Hpol P
                 Vfront    3 Vsync  10 Vback   18 Vpol N
    Display Range Limits:
      Monitor ranges (GTF): 48-100 Hz V, 30-120 kHz H, max dotclock 250 MHz
    Display Product Name: 'LG FHD'
  Extension blocks: 1
Checksum: 0x48

----------------

Block 1, CTA-861 Extension Block:
  Revision: 3
  Underscans IT Video Formats by default
  Basic audio support
  Supports YCbCr 4:4:4
  Supports YCbCr 4:2:2
  Native detailed modes: 1
  Video Data Block:
    VIC  16:  1920x1080   60.000000 Hz  16:9     67.500 kHz    148.500000 MHz (native)
    VIC   4:  1280x720    60.000000 Hz  16:9     45.000 kHz     74.250000 MHz
    VIC   3:   720x480    59.940060 Hz  16:9     31.469 kHz     27.000000 MHz
    VIC   1:   640x480    59.940476 Hz   4:3     31.469 kHz     25.175000 MHz
    VIC  18:   720x576    50.000000 Hz  16:9     31.250 kHz     27.000000 MHz
    VIC  19:  1280x720    50.000000 Hz  16:9     37.500 kHz     74.250000 MHz
    VIC  31:  1920x1080   50.000000 Hz  16:9     56.250 kHz    148.500000 MHz
  Audio Data Block:
    Linear PCM:
      Max channels: 2
      Supported sample rates (kHz): 48 44.1 32
      Supported sample sizes (bits): 24 20 16
  Vendor-Specific Data Block (HDMI), OUI 00-0C-03:
    Source physical address: 1.0.0.0
  Detailed Timing Descriptors:
    DTD 3:  1920x1080   74.972503 Hz  16:9     83.894 kHz    174.500000 MHz (543 mm x 302 mm)
                 Hfront   48 Hsync  32 Hback   80 Hpol P
                 Vfront    3 Vsync   5 Vback   31 Vpol P
    DTD 4:  1280x720    60.000000 Hz  16:9     45.000 kHz     74.250000 MHz (543 mm x 302 mm)
                 Hfront  110 Hsync  40 Hback  220 Hpol P
                 Vfront    5 Vsync   5 Vback   20 Vpol P
    Display Product Serial Number: ...
Checksum: 0xfd  Unused space in Extension Block: 51 bytes

----------------

Block 2, Unknown EDID Extension Block 0x00:
  00 ff ff ff ff ff ff 00 1e 6d 71 5c 87 2d 00 00 '.........mq\.-..'
  08 22 01 03 80 36 1e 78 ea 31 35 a5 55 4e a1 26 '."...6.x.15.UN.&'
  0c 50 54 21 09 00 d1 c0 61 40 01 01 01 01 01 01 '.PT!....a@......'
  01 01 01 01 01 01 60 59 80 a0 70 38 14 40 30 20 '......`Y..p8.@0 '
  35 00 1f 2e 21 00 00 1a 1a 36 80 a0 70 38 1f 40 '5...!....6..p8.@'
  30 20 3a 00 1f 2e 21 00 00 1a 00 00 00 fd 00 30 '0 :...!........0'
  64 1e 78 19 00 0a 20 20 20 20 20 20 00 00 00 fc 'd.x...      ....'
  00 4c 47 20 46 48 44 0a 20 20 20 20 20 20 01 48 '.LG FHD.      .H'
Checksum: 0x48

----------------

Block 3, CTA-861 Extension Block:
  Revision: 3
  Underscans IT Video Formats by default
  Basic audio support
  Supports YCbCr 4:4:4
  Supports YCbCr 4:2:2
  Native detailed modes: 1
  Video Data Block:
    VIC  16:  1920x1080   60.000000 Hz  16:9     67.500 kHz    148.500000 MHz (native)
    VIC   4:  1280x720    60.000000 Hz  16:9     45.000 kHz     74.250000 MHz
    VIC   3:   720x480    59.940060 Hz  16:9     31.469 kHz     27.000000 MHz
    VIC   1:   640x480    59.940476 Hz   4:3     31.469 kHz     25.175000 MHz
    VIC  18:   720x576    50.000000 Hz  16:9     31.250 kHz     27.000000 MHz
    VIC  19:  1280x720    50.000000 Hz  16:9     37.500 kHz     74.250000 MHz
    VIC  31:  1920x1080   50.000000 Hz  16:9     56.250 kHz    148.500000 MHz
  Audio Data Block:
    Linear PCM:
      Max channels: 2
      Supported sample rates (kHz): 48 44.1 32
      Supported sample sizes (bits): 24 20 16
  Vendor-Specific Data Block (HDMI), OUI 00-0C-03:
    Source physical address: 1.0.0.0
  Detailed Timing Descriptors:
    DTD 5:  1920x1080   74.972503 Hz  16:9     83.894 kHz    174.500000 MHz (543 mm x 302 mm)
                 Hfront   48 Hsync  32 Hback   80 Hpol P
                 Vfront    3 Vsync   5 Vback   31 Vpol P
    DTD 6:  1280x720    60.000000 Hz  16:9     45.000 kHz     74.250000 MHz (543 mm x 302 mm)
                 Hfront  110 Hsync  40 Hback  220 Hpol P
                 Vfront    5 Vsync   5 Vback   20 Vpol P
    Display Product Serial Number: ...
Checksum: 0xfd  Unused space in Extension Block: 51 bytes

----------------

Warnings:

Block 1, CTA-861 Extension Block:
  Display Product Serial Number is set, so the Serial Number in the Base EDID should be 0.
  Add a Colorimetry Data Block with the sRGB colorimetry bit set to avoid interop issues.
Block 3, CTA-861 Extension Block:
  Display Product Serial Number is set, so the Serial Number in the Base EDID should be 0.
  Add a Colorimetry Data Block with the sRGB colorimetry bit set to avoid interop issues.
EDID:
  CTA-861: Multiple native progressive timings are defined.

Failures:

Block 1, CTA-861 Extension Block:
  Missing VCDB, needed for Set Selectable RGB Quantization to avoid interop issues.
Block 2, Base EDID:
  Unknown Extension Block.
Block 3, CTA-861 Extension Block:
  Video Data Block: Duplicate VIC 16.
  Video Data Block: Duplicate VIC 4.
  Video Data Block: Duplicate VIC 3.
  Video Data Block: Duplicate VIC 1.
  Video Data Block: Duplicate VIC 18.
  Video Data Block: Duplicate VIC 19.
  Video Data Block: Duplicate VIC 31.
  Missing VCDB, needed for Set Selectable RGB Quantization to avoid interop issues.
EDID:
  Base EDID: EDID specified 1 extension block(s), but found 3 extension block(s).
  Base EDID: EDID 1.3 requires a Block Map Extension in Block 1 if there are more than 2 blocks in the EDID.

EDID conformity: FAIL
