edid-decode (hex):

00 ff ff ff ff ff ff 00 06 af 3c 24 00 00 00 00
00 13 01 04 90 1f 11 78 02 c8 a5 9e 57 54 92 26
99 50 54 00 00 00 01 01 01 01 01 01 01 01 01 01
01 01 01 01 01 01 12 1b 56 46 50 00 23 30 26 16
36 00 35 ad 10 00 00 1a 12 1b 56 46 50 00 23 30
26 16 36 00 35 ad 10 00 00 1a 00 00 00 fe 00 48
33 44 33 38 80 42 31 34 30 58 57 32 00 00 00 00
00 00 41 01 96 00 01 00 00 01 01 0a 20 20 00 8b

----------------

Block 0, Base EDID:
  EDID Structure Version & Revision: 1.4
  Vendor & Product Identification:
    Manufacturer: AUO
    Model: 9276
    Made in: 2009
  Basic Display Parameters & Features:
    Digital display
    Bits per primary color channel: 6
    Digital interface is not defined
    Maximum image size: 31 cm x 17 cm
    Gamma: 2.20
    Supported color formats: RGB 4:4:4
    First detailed timing includes the native pixel format and preferred refresh rate
  Color Characteristics:
    Red  : 0.6201, 0.3398
    Green: 0.3300, 0.5703
    Blue : 0.1503, 0.5996
    White: 0.3134, 0.3291
  Established Timings I & II: none
  Standard Timings: none
  Detailed Timing Descriptors:
    DTD 1:  1366x768    60.098447 Hz 683:384   48.259 kHz     69.300000 MHz (309 mm x 173 mm)
                 Hfront   38 Hsync  22 Hback   10 Hpol P
                 Vfront    3 Vsync   6 Vback   26 Vpol N
    DTD 2:  1366x768    60.098447 Hz 683:384   48.259 kHz     69.300000 MHz (309 mm x 173 mm)
                 Hfront   38 Hsync  22 Hback   10 Hpol P
                 Vfront    3 Vsync   6 Vback   26 Vpol N
    Alphanumeric Data String: 'H3D38'
    Manufacturer-Specified Display Descriptor (0x00): 00 00 00 00 41 01 96 00 01 00 00 01 01 0a 20 20 '....A.........  '
Checksum: 0x8b

----------------

Warnings:

Block 0, Base EDID:
  Missing Display Product Name.

Failures:

Block 0, Base EDID:
  Alphanumeric Data String: Non-printable character.

EDID conformity: FAIL
