
EDID (hex):
00ffffffffffff00320c270100000000
00120103802115780a14659859538b28
23505400000001010101010101010101
010101010101bc1b00a0502017303020
36004bcf100000190000000000000000
00000000000000000000000000fe004c
475068696c6970734c43440a000000fc
004c503135345758342d544c44340073

edid-decode (hex):

00 ff ff ff ff ff ff 00 32 0c 27 01 00 00 00 00
00 12 01 03 80 21 15 78 0a 14 65 98 59 53 8b 28
23 50 54 00 00 00 01 01 01 01 01 01 01 01 01 01
01 01 01 01 01 01 bc 1b 00 a0 50 20 17 30 30 20
36 00 4b cf 10 00 00 19 00 00 00 00 00 00 00 00
00 00 00 00 00 00 00 00 00 00 00 00 00 fe 00 4c
47 50 68 69 6c 69 70 73 4c 43 44 0a 00 00 00 fc
00 4c 50 31 35 34 57 58 34 2d 54 4c 44 34 00 73

----------------

Block 0, Base EDID:
  EDID Structure Version & Revision: 1.3
  Vendor & Product Identification:
    Manufacturer: LPL
    Model: 295
    Made in: 2008
  Basic Display Parameters & Features:
    Digital display
    Maximum image size: 33 cm x 21 cm
    Gamma: 2.20
    RGB color display
    First detailed timing is the preferred timing
  Color Characteristics:
    Red  : 0.5937, 0.3486
    Green: 0.3251, 0.5429
    Blue : 0.1572, 0.1386
    White: 0.3134, 0.3291
  Established Timings I & II: none
  Standard Timings: none
  Detailed Timing Descriptors:
    DTD 1:  1280x800    59.909545 Hz  16:10    49.306 kHz     71.000000 MHz (331 mm x 207 mm)
                 Hfront   48 Hsync  32 Hback   80 Hpol N
                 Vfront    3 Vsync   6 Vback   14 Vpol N
    Empty Descriptor
    Alphanumeric Data String: 'LGPhilipsLCD'
    Display Product Name: 'LP154WX4-TLD4'
Checksum: 0x73
