
EDID (hex):
00ffffffffffff001ab3830821940200
0e1b010368301b782a4d45a556519f27
0e5054a54b0081c081809500b300d1c0
010101010101023a801871382d40582c
4500dc0c1100001e000000fd00384c1e
5211000a202020202020000000fc0045
3232542d372050726f0a2020000000ff
00595639553136383939330a202000b6

Extracted contents:
header:          00 ff ff ff ff ff ff 00
serial number:   1a b3 83 08 21 94 02 00 0e 1b
version:         01 03
basic params:    68 30 1b 78 2a
chroma info:     4d 45 a5 56 51 9f 27 0e 50 54
established:     a5 4b 00
standard:        81 c0 81 80 95 00 b3 00 d1 c0 01 01 01 01 01 01
descriptor 1:    02 3a 80 18 71 38 2d 40 58 2c 45 00 dc 0c 11 00 00 1e
descriptor 2:    00 00 00 fd 00 38 4c 1e 52 11 00 0a 20 20 20 20 20 20
descriptor 3:    00 00 00 fc 00 45 32 32 54 2d 37 20 50 72 6f 0a 20 20
descriptor 4:    00 00 00 ff 00 59 56 39 55 31 36 38 39 39 33 0a 20 20
extensions:      00
checksum:        b6

EDID version: 1.3
Manufacturer: FUS Model 883 Serial Number --
Made in week 14 of 2017
Analog display, Input voltage level: 0.7/0.7 V
Sync: Separate 
Maximum image size: 48 cm x 27 cm
Gamma: 2.20
DPMS levels: Off
RGB color display
First detailed timing is preferred timing
Display x,y Chromaticity:
  Red:   0.6455, 0.3359
  Green: 0.3193, 0.6220
  Blue:  0.1533, 0.0546
  White: 0.3134, 0.3291
Established timings supported:
  720x400@70Hz 9:5 HorFreq: 31469 Hz Clock: 28.320 MHz
  640x480@60Hz 4:3 HorFreq: 31469 Hz Clock: 25.175 MHz
  640x480@75Hz 4:3 HorFreq: 37500 Hz Clock: 31.500 MHz
  800x600@60Hz 4:3 HorFreq: 37900 Hz Clock: 40.000 MHz
  800x600@75Hz 4:3 HorFreq: 46900 Hz Clock: 49.500 MHz
  1024x768@60Hz 4:3 HorFreq: 48400 Hz Clock: 65.000 MHz
  1024x768@75Hz 4:3 HorFreq: 60000 Hz Clock: 78.750 MHz
  1280x1024@75Hz 5:4 HorFreq: 80000 Hz Clock: 135.000 MHz
Standard timings supported:
  1280x720@60Hz 16:9
  1280x1024@60Hz 5:4 HorFreq: 64000 Hz Clock: 108.000 MHz
  1440x900@60Hz 16:10 HorFreq: 55500 Hz Clock: 88.750 MHz
  1680x1050@60Hz 16:10 HorFreq: 64700 Hz Clock: 119.000 MHz
  1920x1080@60Hz 16:9
Detailed mode: Clock 148.500 MHz, 476 mm x 268 mm
               1920 2008 2052 2200 hborder 0
               1080 1084 1089 1125 vborder 0
               +hsync +vsync 
               VertFreq: 60 Hz, HorFreq: 67500 Hz
Monitor ranges (GTF): 56-76Hz V, 30-82kHz H, max dotclock 170MHz
Monitor name: E22T-7 Pro
Serial number: --
Checksum: 0xb6 (valid)
