
EDID (hex):
00ffffffffffff0009e5b50700000000
051c0104951e117802f7009657549228
23505400000001010101010101010101
0101010101014a1c56a2500016303020
360035ad1000001adc1256a250001630
3020360035ad1000001a000000000000
00000000000000000000000000000002
000c49ff0a3c6e110f1b6e00000000e8

Extracted contents:
header:          00 ff ff ff ff ff ff 00
serial number:   09 e5 b5 07 00 00 00 00 05 1c
version:         01 04
basic params:    95 1e 11 78 02
chroma info:     f7 00 96 57 54 92 28 23 50 54
established:     00 00 00
standard:        01 01 01 01 01 01 01 01 01 01 01 01 01 01 01 01
descriptor 1:    4a 1c 56 a2 50 00 16 30 30 20 36 00 35 ad 10 00 00 1a
descriptor 2:    dc 12 56 a2 50 00 16 30 30 20 36 00 35 ad 10 00 00 1a
descriptor 3:    00 00 00 00 00 00 00 00 00 00 00 00 00 00 00 00 00 00
descriptor 4:    00 00 00 02 00 0c 49 ff 0a 3c 6e 11 0f 1b 6e 00 00 00
extensions:      00
checksum:        e8

EDID version: 1.4
Manufacturer: BOE Model 7b5 Serial Number --
Made in week 5 of 2018
Digital display
6 bits per primary color channel
DisplayPort interface
Maximum image size: 30 cm x 17 cm
Gamma: 2.20
Supported color formats: RGB 4:4:4
First detailed timing includes the native pixel format and preferred refresh rate
Display x,y Chromaticity:
  Red:   0.5888, 0.3427
  Green: 0.3291, 0.5732
  Blue:  0.1562, 0.1367
  White: 0.3125, 0.3281
Established timings supported:
Standard timings supported:
Detailed mode: Clock 72.420 MHz, 309 mm x 173 mm
               1366 1414 1446 1528 hborder 0
                768  771  777  790 vborder 0
               +hsync -vsync 
               VertFreq: 59 Hz, HorFreq: 47395 Hz
Detailed mode: Clock 48.280 MHz, 309 mm x 173 mm
               1366 1414 1446 1528 hborder 0
                768  771  777  790 vborder 0
               +hsync -vsync 
               VertFreq: 39 Hz, HorFreq: 31596 Hz
Manufacturer-specified data, tag 0
Manufacturer-specified data, tag 2
Checksum: 0xe8 (valid)
EDID block does NOT conform to EDID 1.4!
	Missing name descriptor
	Missing monitor ranges
