edid-decode (hex):

00 ff ff ff ff ff ff 00 51 a1 00 12 01 00 00 00
12 1a 01 04 a5 19 11 78 02 eb 5d a6 54 45 a9 26
0f 4c 4f 00 00 00 01 01 01 01 01 01 01 01 01 01
01 01 01 01 01 01 7a 50 70 a0 80 a0 28 50 30 20
3a 00 fe a9 00 00 00 18 62 40 70 a0 80 a0 28 50
30 20 3a 00 fe a9 00 00 00 18 00 00 00 0f 00 54
49 41 4e 4d 41 41 56 49 43 00 00 00 00 00 00 0f
00 54 4d 31 32 30 47 44 53 50 30 31 00 00 00 6b

----------------

Block 0, Base EDID:
  EDID Structure Version & Revision: 1.4
  Vendor & Product Identification:
    Manufacturer: TMA
    Model: 4608
    Serial Number: ...
    Made in: week 18 of 2016
  Basic Display Parameters & Features:
    Digital display
    Bits per primary color channel: 8
    DisplayPort interface
    Maximum image size: 25 cm x 17 cm
    Gamma: 2.20
    Supported color formats: RGB 4:4:4
    First detailed timing includes the native pixel format and preferred refresh rate
  Color Characteristics:
    Red  : 0.6513, 0.3300
    Green: 0.2714, 0.6630
    Blue : 0.1494, 0.0595
    White: 0.2998, 0.3095
  Established Timings I & II: none
  Standard Timings: none
  Detailed Timing Descriptors:
    DTD 1:  2160x1440   60.001165 Hz   3:2     88.802 kHz    206.020000 MHz (254 mm x 169 mm)
                 Hfront   48 Hsync  32 Hback   80 Hpol N
                 Vfront    3 Vsync  10 Vback   27 Vpol N
    DTD 2:  2160x1440   48.002097 Hz   3:2     71.043 kHz    164.820000 MHz (254 mm x 169 mm)
                 Hfront   48 Hsync  32 Hback   80 Hpol N
                 Vfront    3 Vsync  10 Vback   27 Vpol N
    Manufacturer-Specified Display Descriptor (0x0f): 00 0f 00 54 49 41 4e 4d 41 41 56 49 43 00 00 00 '...TIANMAAVIC...'
    Manufacturer-Specified Display Descriptor (0x0f): 00 0f 00 54 4d 31 32 30 47 44 53 50 30 31 00 00 '...TM120GDSP01..'
Checksum: 0x6b

----------------

Failures:

Block 0, Base EDID:
  Missing Display Product Name.

EDID conformity: FAIL
