edid-decode (hex):

00 ff ff ff ff ff ff 00 04 72 80 02 42 25 00 14
28 15 01 03 68 22 13 78 2e b0 25 9f 59 56 93 26
0d 50 54 23 08 00 81 c0 81 00 01 01 01 01 01 01
01 01 01 01 01 01 66 21 56 a8 51 00 1e 30 45 8f
3a 00 58 c2 10 00 00 1c 00 00 00 fd 00 32 3c 1e
32 10 00 0a 20 20 20 20 20 20 00 00 00 fc 00 41
63 65 72 20 50 31 36 36 48 51 4c 0a 00 00 00 ff
00 4c 54 59 30 38 30 31 30 34 32 30 30 0a 00 48

00 ff ff ff ff ff ff 00 04 72 80 02 42 25 00 14
28 15 01 03 68 22 13 78 2e b0 25 9f 59 56 93 26
0d 50 54 23 08 00 81 c0 81 00 01 01 01 01 01 01
01 01 01 01 01 01 66 21 56 a8 51 00 1e 30 45 8f
3a 00 58 c2 10 00 00 1c 00 00 00 fd 00 32 3c 1e
32 10 00 0a 20 20 20 20 20 20 00 00 00 fc 00 41
63 65 72 20 50 31 36 36 48 51 4c 0a 00 00 00 ff
00 4c 54 59 30 38 30 31 30 34 32 30 30 0a 00 48

----------------

Block 0, Base EDID:
  EDID Structure Version & Revision: 1.3
  Vendor & Product Identification:
    Manufacturer: ACR
    Model: 640
    Serial Number: ...
    Made in: week 40 of 2011
  Basic Display Parameters & Features:
    Analog display
    Signal Level Standard: 0.700 : 0.000 : 0.700 V p-p
    Blank level equals black level
    Sync: Separate
    Maximum image size: 34 cm x 19 cm
    Gamma: 2.20
    DPMS levels: Off
    RGB color display
    Default (sRGB) color space is primary color space
    First detailed timing is the preferred timing
  Color Characteristics:
    Red  : 0.6230, 0.3505
    Green: 0.3359, 0.5742
    Blue : 0.1484, 0.0527
    White: 0.3134, 0.3291
  Established Timings I & II:
    DMT 0x04:   640x480    59.940476 Hz   4:3     31.469 kHz     25.175000 MHz
    DMT 0x08:   800x600    56.250000 Hz   4:3     35.156 kHz     36.000000 MHz
    DMT 0x09:   800x600    60.316541 Hz   4:3     37.879 kHz     40.000000 MHz
    DMT 0x10:  1024x768    60.003840 Hz   4:3     48.363 kHz     65.000000 MHz
  Standard Timings:
    DMT 0x55:  1280x720    60.000000 Hz  16:9     45.000 kHz     74.250000 MHz
    DMT 0x1c:  1280x800    59.810326 Hz  16:10    49.702 kHz     83.500000 MHz
  Detailed Timing Descriptors:
    DTD 1:  1366x768    59.856345 Hz 683:384   47.765 kHz     85.500000 MHz (344 mm x 194 mm)
                 Hfront   69 Hsync 143 Hback  212 Hpol N
                 Vfront    3 Vsync  10 Vback   17 Vpol P
    Display Range Limits:
      Monitor ranges (GTF): 50-60 Hz V, 30-50 kHz H, max dotclock 160 MHz
    Display Product Name: 'Acer P166HQL'
    Display Product Serial Number: ...
Checksum: 0x48

----------------

Block 1, Unknown EDID Extension Block 0x00:
  00 ff ff ff ff ff ff 00 04 72 80 02 42 25 00 14 '.........r..B%..'
  28 15 01 03 68 22 13 78 2e b0 25 9f 59 56 93 26 '(...h".x..%.YV.&'
  0d 50 54 23 08 00 81 c0 81 00 01 01 01 01 01 01 '.PT#............'
  01 01 01 01 01 01 66 21 56 a8 51 00 1e 30 45 8f '......f!V.Q..0E.'
  3a 00 58 c2 10 00 00 1c 00 00 00 fd 00 32 3c 1e ':.X..........2<.'
  32 10 00 0a 20 20 20 20 20 20 00 00 00 fc 00 41 '2...      .....A'
  63 65 72 20 50 31 36 36 48 51 4c 0a 00 00 00 ff 'cer P166HQL.....'
  00 4c 54 59 30 38 30 31 30 34 32 30 30 0a 00 48 '.LTY080104200..H'
Checksum: 0x48

----------------

Failures:

Block 0, Base EDID:
  Basic Display Parameters & Features: sRGB is signaled, but the chromaticities do not match.
Block 1, Base EDID:
  Unknown Extension Block.
EDID:
  Base EDID: EDID specified 0 extension block(s), but found 1 extension block(s).

EDID conformity: FAIL
