
EDID (hex):
00ffffffffffff0030aea16001010101
2f18010381301b782ae295a2554f9f26
115054afef00714f8180818a9500a9c0
a9cfb30001011a3680a070381f403020
3500dd0c1100001a000000fd00324b1e
5111000a202020202020000000fc004c
454e204c5432323233707743000000ff
00564e2d3931393035390a20202001c0
020322f14f9005040302071601061112
1513141f23097f078301000065030c00
1000023a801871382d40582c4500dd0c
1100001e011d8018711c1620582c2500
dd0c1100009e011d007251d01e206e28
5500dd0c1100001e8c0ad08a20e02d10
103e9600dd0c11000018662156aa5100
1e30468f3300dd0c1100001e000000bf

Extracted contents:
header:          00 ff ff ff ff ff ff 00
serial number:   30 ae a1 60 01 01 01 01 2f 18
version:         01 03
basic params:    81 30 1b 78 2a
chroma info:     e2 95 a2 55 4f 9f 26 11 50 54
established:     af ef 00
standard:        71 4f 81 80 81 8a 95 00 a9 c0 a9 cf b3 00 01 01
descriptor 1:    1a 36 80 a0 70 38 1f 40 30 20 35 00 dd 0c 11 00 00 1a
descriptor 2:    00 00 00 fd 00 32 4b 1e 51 11 00 0a 20 20 20 20 20 20
descriptor 3:    00 00 00 fc 00 4c 45 4e 20 4c 54 32 32 32 33 70 77 43
descriptor 4:    00 00 00 ff 00 56 4e 2d 39 31 39 30 35 39 0a 20 20 20
extensions:      01
checksum:        c0

EDID version: 1.3
Manufacturer: LEN Model 60a1 Serial Number --
Made in week 47 of 2014
Digital display
DFP 1.x compatible TMDS
Maximum image size: 48 cm x 27 cm
Gamma: 2.20
DPMS levels: Off
RGB color display
First detailed timing is preferred timing
Display x,y Chromaticity:
  Red:   0.6357, 0.3339
  Green: 0.3085, 0.6230
  Blue:  0.1503, 0.0673
  White: 0.3134, 0.3291
Established timings supported:
  720x400@70Hz 9:5 HorFreq: 31469 Hz Clock: 28.320 MHz
  640x480@60Hz 4:3 HorFreq: 31469 Hz Clock: 25.175 MHz
  640x480@72Hz 4:3 HorFreq: 37900 Hz Clock: 31.500 MHz
  640x480@75Hz 4:3 HorFreq: 37500 Hz Clock: 31.500 MHz
  800x600@56Hz 4:3 HorFreq: 35200 Hz Clock: 36.000 MHz
  800x600@60Hz 4:3 HorFreq: 37900 Hz Clock: 40.000 MHz
  800x600@72Hz 4:3 HorFreq: 48100 Hz Clock: 50.000 MHz
  800x600@75Hz 4:3 HorFreq: 46900 Hz Clock: 49.500 MHz
  832x624@75Hz 4:3 HorFreq: 49726 Hz Clock: 57.284 MHz
  1024x768@60Hz 4:3 HorFreq: 48400 Hz Clock: 65.000 MHz
  1024x768@70Hz 4:3 HorFreq: 56500 Hz Clock: 75.000 MHz
  1024x768@75Hz 4:3 HorFreq: 60000 Hz Clock: 78.750 MHz
  1280x1024@75Hz 5:4 HorFreq: 80000 Hz Clock: 135.000 MHz
Standard timings supported:
  1152x864@75Hz 4:3 HorFreq: 67500 Hz Clock: 108.000 MHz
  1280x1024@60Hz 5:4 HorFreq: 64000 Hz Clock: 108.000 MHz
  1280x1024@70Hz 5:4
  1440x900@60Hz 16:10 HorFreq: 55500 Hz Clock: 88.750 MHz
  1600x900@60Hz 16:9
  1600x900@75Hz 16:9
  1680x1050@60Hz 16:10 HorFreq: 64700 Hz Clock: 119.000 MHz
Detailed mode: Clock 138.500 MHz, 477 mm x 268 mm
               1920 1968 2000 2080 hborder 0
               1080 1083 1088 1111 vborder 0
               +hsync -vsync 
               VertFreq: 59 Hz, HorFreq: 66586 Hz
Monitor ranges (GTF): 50-75Hz V, 30-81kHz H, max dotclock 170MHz
Serial number: --
Has 1 extension blocks
Checksum: 0xc0 (valid)

CTA extension block
Extension version: 3
30 bytes of CTA data
  Video data block
    VIC  16 1920x1080@60Hz 16:9 (native) HorFreq: 67500 Hz Clock: 148.500 MHz
    VIC   5 1920x1080i@60Hz 16:9  HorFreq: 33750 Hz Clock: 74.250 MHz
    VIC   4 1280x720@60Hz 16:9  HorFreq: 45000 Hz Clock: 74.250 MHz
    VIC   3 720x480@60Hz 16:9  HorFreq: 31469 Hz Clock: 27.000 MHz
    VIC   2 720x480@60Hz 4:3  HorFreq: 31469 Hz Clock: 27.000 MHz
    VIC   7 1440x480i@60Hz 16:9  HorFreq: 15734 Hz Clock: 27.000 MHz
    VIC  22 1440x576i@50Hz 16:9  HorFreq: 15625 Hz Clock: 27.000 MHz
    VIC   1 640x480@60Hz 4:3  HorFreq: 31469 Hz Clock: 25.175 MHz
    VIC   6 1440x480i@60Hz 4:3  HorFreq: 15734 Hz Clock: 27.000 MHz
    VIC  17 720x576@50Hz 4:3  HorFreq: 31250 Hz Clock: 27.000 MHz
    VIC  18 720x576@50Hz 16:9  HorFreq: 31250 Hz Clock: 27.000 MHz
    VIC  21 1440x576i@50Hz 4:3  HorFreq: 15625 Hz Clock: 27.000 MHz
    VIC  19 1280x720@50Hz 16:9  HorFreq: 37500 Hz Clock: 74.250 MHz
    VIC  20 1920x1080i@50Hz 16:9  HorFreq: 28125 Hz Clock: 74.250 MHz
    VIC  31 1920x1080@50Hz 16:9  HorFreq: 56250 Hz Clock: 148.500 MHz
  Audio data block
    Linear PCM, max channels 2
      Supported sample rates (kHz): 192 176.4 96 88.2 48 44.1 32
      Supported sample sizes (bits): 24 20 16
  Speaker allocation data block
    Speaker map:
      FL/FR - Front Left/Right
  Vendor-specific data block, OUI 000c03 (HDMI)
    Source physical address 1.0.0.0
Underscans PC formats by default
Basic audio support
Supports YCbCr 4:4:4
Supports YCbCr 4:2:2
1 native detailed modes
Detailed mode: Clock 148.500 MHz, 477 mm x 268 mm
               1920 2008 2052 2200 hborder 0
               1080 1084 1089 1125 vborder 0
               +hsync +vsync 
               VertFreq: 60 Hz, HorFreq: 67500 Hz
Detailed mode: Clock 74.250 MHz, 477 mm x 268 mm
               1920 2008 2052 2200 hborder 0
                540  542  547  562 vborder 0
               +hsync +vsync interlaced 
               VertFreq: 60 Hz, HorFreq: 33750 Hz
Detailed mode: Clock 74.250 MHz, 477 mm x 268 mm
               1280 1390 1430 1650 hborder 0
                720  725  730  750 vborder 0
               +hsync +vsync 
               VertFreq: 60 Hz, HorFreq: 45000 Hz
Detailed mode: Clock 27.000 MHz, 477 mm x 268 mm
                720  736  798  858 hborder 0
                480  489  495  525 vborder 0
               -hsync -vsync 
               VertFreq: 59 Hz, HorFreq: 31468 Hz
Detailed mode: Clock 85.500 MHz, 477 mm x 268 mm
               1366 1436 1579 1792 hborder 0
                768  771  774  798 vborder 0
               +hsync +vsync 
               VertFreq: 59 Hz, HorFreq: 47712 Hz
Checksum: 0xbf (valid)

EDID block does NOT conform to EDID 1.3!
	Name descriptor not terminated with a newline
One or more of the timings is out of range of the Monitor Ranges:
  Vertical Freq: 50 - 75 Hz
  Horizontal Freq: 15625 - 80000 Hz
  Maximum Clock: 148.500 MHz
EDID block does not conform at all!
	Both the serial number and the serial string are set
