edid-decode (hex):

00 ff ff ff ff ff ff 00 1a b3 10 07 01 01 01 01
0b 11 01 03 68 2f 1e 82 2a d4 25 a4 55 49 9b 27
13 50 54 a5 4b 00 95 0f 81 80 81 40 71 4f 95 00
b3 00 81 c0 01 01 6c 39 90 30 62 1a 27 40 68 b0
36 00 da 28 11 00 00 1c 00 00 00 ff 00 59 45 54
4d 30 30 33 37 36 33 0a 20 20 00 00 00 fd 00 38
4b 1f 53 0f 2d 0a 20 56 0a 20 20 20 00 00 00 fc
00 4c 32 32 57 2d 33 0a 20 20 20 20 20 20 00 83

00 ff ff ff ff ff ff 00 1a b3 10 07 01 01 01 01
0b 11 01 03 68 2f 1e 82 2a d4 25 a4 55 49 9b 27
13 50 54 a5 4b 00 95 0f 81 80 81 40 71 4f 95 00
b3 00 81 c0 01 01 6c 39 90 30 62 1a 27 40 68 b0
36 00 da 28 11 00 00 1c 00 00 00 ff 00 59 45 54
4d 30 30 33 37 36 33 0a 20 20 00 00 00 fd 00 38
4b 1f 53 0f 2d 0a 20 56 0a 20 20 20 00 00 00 fc
00 4c 32 32 57 2d 33 0a 20 20 20 20 20 20 00 83

----------------

Block 0, Base EDID:
  EDID Structure Version & Revision: 1.3
  Vendor & Product Identification:
    Manufacturer: FUS
    Model: 1808
    Serial Number: ...
    Made in: week 11 of 2007
  Basic Display Parameters & Features:
    Analog display
    Signal Level Standard: 0.700 : 0.000 : 0.700 V p-p
    Blank level equals black level
    Sync: Separate
    Maximum image size: 47 cm x 30 cm
    Gamma: 2.30
    DPMS levels: Off
    RGB color display
    First detailed timing is the preferred timing
  Color Characteristics:
    Red  : 0.6435, 0.3330
    Green: 0.2861, 0.6054
    Blue : 0.1523, 0.0761
    White: 0.3134, 0.3291
  Established Timings I & II:
    IBM     :   720x400    70.081663 Hz   9:5     31.467 kHz     28.320000 MHz
    DMT 0x04:   640x480    59.940476 Hz   4:3     31.469 kHz     25.175000 MHz
    DMT 0x06:   640x480    75.000000 Hz   4:3     37.500 kHz     31.500000 MHz
    DMT 0x09:   800x600    60.316541 Hz   4:3     37.879 kHz     40.000000 MHz
    DMT 0x0b:   800x600    75.000000 Hz   4:3     46.875 kHz     49.500000 MHz
    DMT 0x10:  1024x768    60.003840 Hz   4:3     48.363 kHz     65.000000 MHz
    DMT 0x12:  1024x768    75.028582 Hz   4:3     60.023 kHz     78.750000 MHz
    DMT 0x24:  1280x1024   75.024675 Hz   5:4     79.976 kHz    135.000000 MHz
  Standard Timings:
    DMT 0x30:  1440x900    74.984427 Hz  16:10    70.635 kHz    136.750000 MHz
    DMT 0x23:  1280x1024   60.019740 Hz   5:4     63.981 kHz    108.000000 MHz
    DMT 0x20:  1280x960    60.000000 Hz   4:3     60.000 kHz    108.000000 MHz
    DMT 0x15:  1152x864    75.000000 Hz   4:3     67.500 kHz    108.000000 MHz
    DMT 0x2f:  1440x900    59.887445 Hz  16:10    55.935 kHz    106.500000 MHz
    DMT 0x3a:  1680x1050   59.954250 Hz  16:10    65.290 kHz    146.250000 MHz
    DMT 0x55:  1280x720    60.000000 Hz  16:9     45.000 kHz     74.250000 MHz
  Detailed Timing Descriptors:
    DTD 1:  1680x1050   60.261708 Hz  16:10    65.625 kHz    147.000000 MHz (474 mm x 296 mm)
                 Hfront  104 Hsync 176 Hback  280 Hpol N
                 Vfront    3 Vsync   6 Vback   30 Vpol P
    Display Product Serial Number: ...
    Display Range Limits:
      Monitor ranges (Unknown (0x2d)): 56-75 Hz V, 31-83 kHz H, max dotclock 150 MHz
    Display Product Name: 'L22W-3'
Checksum: 0x83

----------------

Block 1, Unknown EDID Extension Block 0x00:
  00 ff ff ff ff ff ff 00 1a b3 10 07 01 01 01 01 '................'
  0b 11 01 03 68 2f 1e 82 2a d4 25 a4 55 49 9b 27 '....h/..*.%.UI.''
  13 50 54 a5 4b 00 95 0f 81 80 81 40 71 4f 95 00 '.PT.K......@qO..'
  b3 00 81 c0 01 01 6c 39 90 30 62 1a 27 40 68 b0 '......l9.0b.'@h.'
  36 00 da 28 11 00 00 1c 00 00 00 ff 00 59 45 54 '6..(.........YET'
  4d 30 30 33 37 36 33 0a 20 20 00 00 00 fd 00 38 'M003763.  .....8'
  4b 1f 53 0f 2d 0a 20 56 0a 20 20 20 00 00 00 fc 'K.S.-. V.   ....'
  00 4c 32 32 57 2d 33 0a 20 20 20 20 20 20 00 83 '.L22W-3.      ..'
Checksum: 0x83

----------------

Failures:

Block 0, Base EDID:
  Display Range Limits: Unknown range class (0x2d).
  Display Range Limits: Bytes 12-17 must be 0x20.
Block 1, Base EDID:
  Unknown Extension Block.
EDID:
  Base EDID: EDID specified 0 extension block(s), but found 1 extension block(s).

EDID conformity: FAIL
