edid-decode (hex):

00 ff ff ff ff ff ff 00 30 ae 86 10 01 01 01 01
22 15 01 03 80 29 1a 78 ee e5 b5 a3 55 49 99 27
13 50 54 af ef 00 71 4f 81 c0 81 80 81 80 81 80
95 00 95 0f d1 c0 a1 13 00 40 41 58 19 20 2c 58
36 00 ff ff 00 00 00 1c 00 00 00 fc 00 4c 45 4e
20 4c 31 39 35 30 77 44 0a 20 00 00 00 fd 00 32
4c 1e 51 0e 00 0a 20 20 20 20 20 20 00 00 00 ff
00 42 33 34 33 32 38 34 35 0a 20 20 20 20 01 dc

02 03 21 71 4e 06 07 02 03 15 96 11 12 13 04 14
05 1f 90 23 09 07 07 83 01 00 00 65 03 0c 00 10
00 8c 0a d0 90 20 40 31 20 0c 40 55 00 b9 88 21
00 00 18 01 1d 80 18 71 1c 16 20 58 2c 25 00 b9
88 21 00 00 9e 01 1d 80 d0 72 1c 16 20 10 2c 25
80 b9 88 21 00 00 9e 01 1d 00 bc 52 d0 1e 20 b8
28 55 40 b9 88 21 00 00 1e 02 3a 80 d0 72 38 2d
40 10 2c 45 80 b9 88 21 00 00 1e 00 00 00 00 d0

00 ff ff ff ff ff ff 00 30 ae 86 10 01 01 01 01
22 15 01 03 80 29 1a 78 ee e5 b5 a3 55 49 99 27
13 50 54 af ef 00 71 4f 81 c0 81 80 81 80 81 80
95 00 95 0f d1 c0 a1 13 00 40 41 58 19 20 2c 58
36 00 ff ff 00 00 00 1c 00 00 00 fc 00 4c 45 4e
20 4c 31 39 35 30 77 44 0a 20 00 00 00 fd 00 32
4c 1e 51 0e 00 0a 20 20 20 20 20 20 00 00 00 ff
00 42 33 34 33 32 38 34 35 0a 20 20 20 20 01 dc

02 03 21 71 4e 06 07 02 03 15 96 11 12 13 04 14
05 1f 90 23 09 07 07 83 01 00 00 65 03 0c 00 10
00 8c 0a d0 90 20 40 31 20 0c 40 55 00 b9 88 21
00 00 18 01 1d 80 18 71 1c 16 20 58 2c 25 00 b9
88 21 00 00 9e 01 1d 80 d0 72 1c 16 20 10 2c 25
80 b9 88 21 00 00 9e 01 1d 00 bc 52 d0 1e 20 b8
28 55 40 b9 88 21 00 00 1e 02 3a 80 d0 72 38 2d
40 10 2c 45 80 b9 88 21 00 00 1e 00 00 00 00 d0

----------------

Block 0, Base EDID:
  EDID Structure Version & Revision: 1.3
  Vendor & Product Identification:
    Manufacturer: LEN
    Model: 4230
    Serial Number: ...
    Made in: week 34 of 2011
  Basic Display Parameters & Features:
    Digital display
    Maximum image size: 41 cm x 26 cm
    Gamma: 2.20
    DPMS levels: Standby Suspend Off
    RGB color display
    Default (sRGB) color space is primary color space
    First detailed timing is the preferred timing
  Color Characteristics:
    Red  : 0.6396, 0.3339
    Green: 0.2861, 0.5986
    Blue : 0.1542, 0.0771
    White: 0.3134, 0.3291
  Established Timings I & II:
    IBM     :   720x400    70.081663 Hz   9:5     31.467 kHz     28.320000 MHz
    DMT 0x04:   640x480    59.940476 Hz   4:3     31.469 kHz     25.175000 MHz
    DMT 0x05:   640x480    72.808802 Hz   4:3     37.861 kHz     31.500000 MHz
    DMT 0x06:   640x480    75.000000 Hz   4:3     37.500 kHz     31.500000 MHz
    DMT 0x08:   800x600    56.250000 Hz   4:3     35.156 kHz     36.000000 MHz
    DMT 0x09:   800x600    60.316541 Hz   4:3     37.879 kHz     40.000000 MHz
    DMT 0x0a:   800x600    72.187572 Hz   4:3     48.077 kHz     50.000000 MHz
    DMT 0x0b:   800x600    75.000000 Hz   4:3     46.875 kHz     49.500000 MHz
    Apple   :   832x624    74.551266 Hz   4:3     49.726 kHz     57.284000 MHz
    DMT 0x10:  1024x768    60.003840 Hz   4:3     48.363 kHz     65.000000 MHz
    DMT 0x11:  1024x768    70.069359 Hz   4:3     56.476 kHz     75.000000 MHz
    DMT 0x12:  1024x768    75.028582 Hz   4:3     60.023 kHz     78.750000 MHz
    DMT 0x24:  1280x1024   75.024675 Hz   5:4     79.976 kHz    135.000000 MHz
  Standard Timings:
    DMT 0x15:  1152x864    75.000000 Hz   4:3     67.500 kHz    108.000000 MHz
    DMT 0x55:  1280x720    60.000000 Hz  16:9     45.000 kHz     74.250000 MHz
    DMT 0x23:  1280x1024   60.019740 Hz   5:4     63.981 kHz    108.000000 MHz
    DMT 0x23:  1280x1024   60.019740 Hz   5:4     63.981 kHz    108.000000 MHz
    DMT 0x23:  1280x1024   60.019740 Hz   5:4     63.981 kHz    108.000000 MHz
    DMT 0x2f:  1440x900    59.887445 Hz  16:10    55.935 kHz    106.500000 MHz
    DMT 0x30:  1440x900    74.984427 Hz  16:10    70.635 kHz    136.750000 MHz
    DMT 0x52:  1920x1080   60.000000 Hz  16:9     67.500 kHz    148.500000 MHz
  Detailed Timing Descriptors:
    DTD  1:  1024x600    59.821429 Hz 128:75    37.388 kHz     50.250000 MHz (255 mm x 255 mm)
                  Hfront   44 Hsync  88 Hback  188 Hpol N
                  Vfront    3 Vsync   6 Vback   16 Vpol P
    Display Product Name: 'LEN L1950wD'
    Display Range Limits:
      Monitor ranges (GTF): 50-76 Hz V, 30-81 kHz H, max dotclock 140 MHz
    Display Product Serial Number: ...
  Extension blocks: 1
Checksum: 0xdc

----------------

Block 1, CTA-861 Extension Block:
  Revision: 3
  Basic audio support
  Supports YCbCr 4:4:4
  Supports YCbCr 4:2:2
  Native detailed modes: 1
  Video Data Block:
    VIC   6:  1440x480i   59.940060 Hz   4:3     15.734 kHz     27.000000 MHz
    VIC   7:  1440x480i   59.940060 Hz  16:9     15.734 kHz     27.000000 MHz
    VIC   2:   720x480    59.940060 Hz   4:3     31.469 kHz     27.000000 MHz
    VIC   3:   720x480    59.940060 Hz  16:9     31.469 kHz     27.000000 MHz
    VIC  21:  1440x576i   50.000000 Hz   4:3     15.625 kHz     27.000000 MHz
    VIC  22:  1440x576i   50.000000 Hz  16:9     15.625 kHz     27.000000 MHz (native)
    VIC  17:   720x576    50.000000 Hz   4:3     31.250 kHz     27.000000 MHz
    VIC  18:   720x576    50.000000 Hz  16:9     31.250 kHz     27.000000 MHz
    VIC  19:  1280x720    50.000000 Hz  16:9     37.500 kHz     74.250000 MHz
    VIC   4:  1280x720    60.000000 Hz  16:9     45.000 kHz     74.250000 MHz
    VIC  20:  1920x1080i  50.000000 Hz  16:9     28.125 kHz     74.250000 MHz
    VIC   5:  1920x1080i  60.000000 Hz  16:9     33.750 kHz     74.250000 MHz
    VIC  31:  1920x1080   50.000000 Hz  16:9     56.250 kHz    148.500000 MHz
    VIC  16:  1920x1080   60.000000 Hz  16:9     67.500 kHz    148.500000 MHz (native)
  Audio Data Block:
    Linear PCM:
      Max channels: 2
      Supported sample rates (kHz): 48 44.1 32
      Supported sample sizes (bits): 24 20 16
  Speaker Allocation Data Block:
    FL/FR - Front Left/Right
  Vendor-Specific Data Block (HDMI), OUI 00-0C-03:
    Source physical address: 1.0.0.0
  Detailed Timing Descriptors:
    DTD  2:   720x576    50.000000 Hz   5:4     31.250 kHz     27.000000 MHz (697 mm x 392 mm)
                  Hfront   12 Hsync  64 Hback   68 Hpol N
                  Vfront    5 Vsync   5 Vback   39 Vpol N
    DTD  3:  1920x1080i  60.000000 Hz  16:9     33.750 kHz     74.250000 MHz (697 mm x 392 mm)
                  Hfront   88 Hsync  44 Hback  148 Hpol P
                  Vfront    2 Vsync   5 Vback   15 Vpol P Vfront +0.5 Odd Field
                  Vfront    2 Vsync   5 Vback   15 Vpol P Vback  +0.5 Even Field
    DTD  4:  1920x1080i  50.000000 Hz  16:9     28.125 kHz     74.250000 MHz (697 mm x 392 mm)
                  Hfront  528 Hsync  44 Hback  148 Hpol P
                  Vfront    2 Vsync   5 Vback   15 Vpol P Vfront +0.5 Odd Field
                  Vfront    2 Vsync   5 Vback   15 Vpol P Vback  +0.5 Even Field
    DTD  5:  1280x720    50.000000 Hz  16:9     37.500 kHz     74.250000 MHz (697 mm x 392 mm)
                  Hfront  440 Hsync  40 Hback  220 Hpol P
                  Vfront    5 Vsync   5 Vback   20 Vpol P
    DTD  6:  1920x1080   50.000000 Hz  16:9     56.250 kHz    148.500000 MHz (697 mm x 392 mm)
                  Hfront  528 Hsync  44 Hback  148 Hpol P
                  Vfront    4 Vsync   5 Vback   36 Vpol P
Checksum: 0xd0  Unused space in Extension Block: 4 bytes

----------------

Block 2, Unknown EDID Extension Block 0x00:
  00 ff ff ff ff ff ff 00 30 ae 86 10 01 01 01 01 '........0.......'
  22 15 01 03 80 29 1a 78 ee e5 b5 a3 55 49 99 27 '"....).x....UI.''
  13 50 54 af ef 00 71 4f 81 c0 81 80 81 80 81 80 '.PT...qO........'
  95 00 95 0f d1 c0 a1 13 00 40 41 58 19 20 2c 58 '.........@AX. ,X'
  36 00 ff ff 00 00 00 1c 00 00 00 fc 00 4c 45 4e '6............LEN'
  20 4c 31 39 35 30 77 44 0a 20 00 00 00 fd 00 32 ' L1950wD. .....2'
  4c 1e 51 0e 00 0a 20 20 20 20 20 20 00 00 00 ff 'L.Q...      ....'
  00 42 33 34 33 32 38 34 35 0a 20 20 20 20 01 dc '.B3432845.    ..'
Checksum: 0xdc

----------------

Block 3, CTA-861 Extension Block:
  Revision: 3
  Basic audio support
  Supports YCbCr 4:4:4
  Supports YCbCr 4:2:2
  Native detailed modes: 1
  Video Data Block:
    VIC   6:  1440x480i   59.940060 Hz   4:3     15.734 kHz     27.000000 MHz
    VIC   7:  1440x480i   59.940060 Hz  16:9     15.734 kHz     27.000000 MHz
    VIC   2:   720x480    59.940060 Hz   4:3     31.469 kHz     27.000000 MHz
    VIC   3:   720x480    59.940060 Hz  16:9     31.469 kHz     27.000000 MHz
    VIC  21:  1440x576i   50.000000 Hz   4:3     15.625 kHz     27.000000 MHz
    VIC  22:  1440x576i   50.000000 Hz  16:9     15.625 kHz     27.000000 MHz (native)
    VIC  17:   720x576    50.000000 Hz   4:3     31.250 kHz     27.000000 MHz
    VIC  18:   720x576    50.000000 Hz  16:9     31.250 kHz     27.000000 MHz
    VIC  19:  1280x720    50.000000 Hz  16:9     37.500 kHz     74.250000 MHz
    VIC   4:  1280x720    60.000000 Hz  16:9     45.000 kHz     74.250000 MHz
    VIC  20:  1920x1080i  50.000000 Hz  16:9     28.125 kHz     74.250000 MHz
    VIC   5:  1920x1080i  60.000000 Hz  16:9     33.750 kHz     74.250000 MHz
    VIC  31:  1920x1080   50.000000 Hz  16:9     56.250 kHz    148.500000 MHz
    VIC  16:  1920x1080   60.000000 Hz  16:9     67.500 kHz    148.500000 MHz (native)
  Audio Data Block:
    Linear PCM:
      Max channels: 2
      Supported sample rates (kHz): 48 44.1 32
      Supported sample sizes (bits): 24 20 16
  Speaker Allocation Data Block:
    FL/FR - Front Left/Right
  Vendor-Specific Data Block (HDMI), OUI 00-0C-03:
    Source physical address: 1.0.0.0
  Detailed Timing Descriptors:
    DTD  7:   720x576    50.000000 Hz   5:4     31.250 kHz     27.000000 MHz (697 mm x 392 mm)
                  Hfront   12 Hsync  64 Hback   68 Hpol N
                  Vfront    5 Vsync   5 Vback   39 Vpol N
    DTD  8:  1920x1080i  60.000000 Hz  16:9     33.750 kHz     74.250000 MHz (697 mm x 392 mm)
                  Hfront   88 Hsync  44 Hback  148 Hpol P
                  Vfront    2 Vsync   5 Vback   15 Vpol P Vfront +0.5 Odd Field
                  Vfront    2 Vsync   5 Vback   15 Vpol P Vback  +0.5 Even Field
    DTD  9:  1920x1080i  50.000000 Hz  16:9     28.125 kHz     74.250000 MHz (697 mm x 392 mm)
                  Hfront  528 Hsync  44 Hback  148 Hpol P
                  Vfront    2 Vsync   5 Vback   15 Vpol P Vfront +0.5 Odd Field
                  Vfront    2 Vsync   5 Vback   15 Vpol P Vback  +0.5 Even Field
    DTD 10:  1280x720    50.000000 Hz  16:9     37.500 kHz     74.250000 MHz (697 mm x 392 mm)
                  Hfront  440 Hsync  40 Hback  220 Hpol P
                  Vfront    5 Vsync   5 Vback   20 Vpol P
    DTD 11:  1920x1080   50.000000 Hz  16:9     56.250 kHz    148.500000 MHz (697 mm x 392 mm)
                  Hfront  528 Hsync  44 Hback  148 Hpol P
                  Vfront    4 Vsync   5 Vback   36 Vpol P
Checksum: 0xd0  Unused space in Extension Block: 4 bytes

----------------

Warnings:

Block 1, CTA-861 Extension Block:
  IT Video Formats are overscanned by default, but normally this should be underscanned.
  Display Product Serial Number is set, so the Serial Number in the Base EDID should be 0.
Block 3, CTA-861 Extension Block:
  IT Video Formats are overscanned by default, but normally this should be underscanned.
  Display Product Serial Number is set, so the Serial Number in the Base EDID should be 0.
EDID:
  CTA-861: Multiple native interlaced timings are defined.

Failures:

Block 0, Base EDID:
  Basic Display Parameters & Features: sRGB is signaled, but the chromaticities do not match.
Block 1, CTA-861 Extension Block:
  Detailed Timing Descriptor #2: Mismatch of image size 697x392 mm vs display size 410x260 mm.
  Detailed Timing Descriptor #3: Mismatch of image size 697x392 mm vs display size 410x260 mm.
  Detailed Timing Descriptor #4: Mismatch of image size 697x392 mm vs display size 410x260 mm.
  Detailed Timing Descriptor #5: Mismatch of image size 697x392 mm vs display size 410x260 mm.
  Detailed Timing Descriptor #6: Mismatch of image size 697x392 mm vs display size 410x260 mm.
  Missing VCDB, needed for Set Selectable RGB Quantization to avoid interop issues.
Block 2, Base EDID:
  Unknown Extension Block.
Block 3, CTA-861 Extension Block:
  Video Data Block: Duplicate VIC 6.
  Video Data Block: Duplicate VIC 7.
  Video Data Block: Duplicate VIC 2.
  Video Data Block: Duplicate VIC 3.
  Video Data Block: Duplicate VIC 21.
  Video Data Block: Duplicate VIC 22.
  Video Data Block: Duplicate VIC 17.
  Video Data Block: Duplicate VIC 18.
  Video Data Block: Duplicate VIC 19.
  Video Data Block: Duplicate VIC 4.
  Video Data Block: Duplicate VIC 20.
  Video Data Block: Duplicate VIC 5.
  Video Data Block: Duplicate VIC 31.
  Video Data Block: Duplicate VIC 16.
  Speaker Allocation Data Block: Only one instance of this Data Block is allowed.
  Detailed Timing Descriptor #7: Mismatch of image size 697x392 mm vs display size 410x260 mm.
  Detailed Timing Descriptor #8: Mismatch of image size 697x392 mm vs display size 410x260 mm.
  Detailed Timing Descriptor #9: Mismatch of image size 697x392 mm vs display size 410x260 mm.
  Detailed Timing Descriptor #10: Mismatch of image size 697x392 mm vs display size 410x260 mm.
  Detailed Timing Descriptor #11: Mismatch of image size 697x392 mm vs display size 410x260 mm.
  Missing VCDB, needed for Set Selectable RGB Quantization to avoid interop issues.
EDID:
  Base EDID: Some timings are out of range of the Monitor Ranges:
    Horizontal Freq: 15.625 - 79.976 kHz (Monitor: 30.000 - 81.000 kHz)
    Maximum Clock: 148.500 MHz (Monitor: 140.000 MHz)
  Base EDID: The DTD max image size is 697x392mm, which is larger than the display size 410.0x260.0mm.
  Base EDID: EDID specified 1 extension block(s), but found 3 extension block(s).
  Base EDID: EDID 1.3 requires a Block Map Extension in Block 1 if there are more than 2 blocks in the EDID.
  CTA-861: Native progressive timings are a mix of several resolutions.

EDID conformity: FAIL
