edid-decode (hex):

00 ff ff ff ff ff ff 00 06 af 8a c4 00 00 00 00
00 1d 01 04 a5 22 13 78 03 6e 85 93 58 58 92 28
1e 50 54 00 00 00 01 01 01 01 01 01 01 01 01 01
01 01 01 01 01 01 96 37 80 c8 70 38 26 40 6c 30
aa 00 58 c2 10 00 00 18 0f 25 80 c8 70 38 26 40
6c 30 aa 00 58 c2 10 00 00 18 00 00 00 00 00 00
00 00 00 00 00 00 00 00 00 00 00 00 00 00 00 02
00 10 40 ff 0f 3c 7d 0f 13 28 7d 20 20 20 00 cd

----------------

Block 0, Base EDID:
  EDID Structure Version & Revision: 1.4
  Vendor & Product Identification:
    Manufacturer: AUO
    Model: 50314
    Made in: 2019
  Basic Display Parameters & Features:
    Digital display
    Bits per primary color channel: 8
    DisplayPort interface
    Maximum image size: 34 cm x 19 cm
    Gamma: 2.20
    Supported color formats: RGB 4:4:4
    First detailed timing includes the native pixel format and preferred refresh rate
    Display is continuous frequency
  Color Characteristics:
    Red  : 0.5751, 0.3457
    Green: 0.3466, 0.5722
    Blue : 0.1582, 0.1171
    White: 0.3134, 0.3291
  Established Timings I & II: none
  Standard Timings: none
  Detailed Timing Descriptors:
    DTD 1:  1920x1080   60.038 Hz  16:9    67.123 kHz 142.300 MHz (344 mm x 194 mm)
                 Hfront  108 Hsync  48 Hback  44 Hpol N
                 Vfront   10 Vsync  10 Vback  18 Vpol N
    DTD 2:  1920x1080   40.027 Hz  16:9    44.750 kHz  94.870 MHz (344 mm x 194 mm)
                 Hfront  108 Hsync  48 Hback  44 Hpol N
                 Vfront   10 Vsync  10 Vback  18 Vpol N
    Empty Descriptor
    Manufacturer-Specified Display Descriptor (0x02): 00 02 00 10 40 ff 0f 3c 7d 0f 13 28 7d 20 20 20 '....@..<}..(}   '
Checksum: 0xcd

----------------

Failures:

Block 0, Base EDID:
  Empty Descriptor: Use Dummy Descriptor instead of all zeroes.
  Missing Display Product Name.
  Missing Display Range Limits Descriptor.

EDID conformity: FAIL
