
EDID (hex):
00ffffffffffff004c2dd10100000000
1b100103681009782aee91a3544c9926
0f5054adce0001010101010101010101
010101010101662150b051001b304070
3600a05a0000001e0e1f008051001e30
40803700a05a0000001c000000fd003c
4b1e3d09000a202020202020000000fc
0053414d53554e470a202020202000ba

Extracted contents:
header:          00 ff ff ff ff ff ff 00
serial number:   4c 2d d1 01 00 00 00 00 1b 10
version:         01 03
basic params:    68 10 09 78 2a
chroma info:     ee 91 a3 54 4c 99 26 0f 50 54
established:     ad ce 00
standard:        01 01 01 01 01 01 01 01 01 01 01 01 01 01 01 01
descriptor 1:    66 21 50 b0 51 00 1b 30 40 70 36 00 a0 5a 00 00 00 1e
descriptor 2:    0e 1f 00 80 51 00 1e 30 40 80 37 00 a0 5a 00 00 00 1c
descriptor 3:    00 00 00 fd 00 3c 4b 1e 3d 09 00 0a 20 20 20 20 20 20
descriptor 4:    00 00 00 fc 00 53 41 4d 53 55 4e 47 0a 20 20 20 20 20
extensions:      00
checksum:        ba

EDID version: 1.3
Manufacturer: SAM Model 1d1 Serial Number --
Made in week 27 of 2006
Analog display, Input voltage level: 0.7/0.7 V
Sync: Separate 
Maximum image size: 16 cm x 9 cm
Gamma: 2.20
DPMS levels: Off
RGB color display
First detailed timing is preferred timing
Display x,y Chromaticity:
  Red:   0.6396, 0.3300
  Green: 0.2998, 0.5996
  Blue:  0.1503, 0.0595
  White: 0.3125, 0.3291
Established timings supported:
  720x400@70Hz 9:5 HorFreq: 31469 Hz Clock: 28.320 MHz
  640x480@60Hz 4:3 HorFreq: 31469 Hz Clock: 25.175 MHz
  640x480@72Hz 4:3 HorFreq: 37900 Hz Clock: 31.500 MHz
  640x480@75Hz 4:3 HorFreq: 37500 Hz Clock: 31.500 MHz
  800x600@60Hz 4:3 HorFreq: 37900 Hz Clock: 40.000 MHz
  800x600@72Hz 4:3 HorFreq: 48100 Hz Clock: 50.000 MHz
  800x600@75Hz 4:3 HorFreq: 46900 Hz Clock: 49.500 MHz
  1024x768@60Hz 4:3 HorFreq: 48400 Hz Clock: 65.000 MHz
  1024x768@70Hz 4:3 HorFreq: 56500 Hz Clock: 75.000 MHz
  1024x768@75Hz 4:3 HorFreq: 60000 Hz Clock: 78.750 MHz
Standard timings supported:
Detailed mode: Clock 85.500 MHz, 160 mm x 90 mm
               1360 1424 1536 1792 hborder 0
                768  771  777  795 vborder 0
               +hsync +vsync 
               VertFreq: 60 Hz, HorFreq: 47712 Hz
Detailed mode: Clock 79.500 MHz, 160 mm x 90 mm
               1280 1344 1472 1664 hborder 0
                768  771  778  798 vborder 0
               -hsync +vsync 
               VertFreq: 59 Hz, HorFreq: 47776 Hz
Monitor ranges (GTF): 60-75Hz V, 30-61kHz H, max dotclock 90MHz
Monitor name: SAMSUNG
Checksum: 0xba (valid)
One or more of the timings is out of range of the Monitor Ranges:
  Vertical Freq: 59 - 75 Hz
  Horizontal Freq: 31469 - 60000 Hz
  Maximum Clock: 85.500 MHz
