edid-decode (hex):

00 ff ff ff ff ff ff 00 10 ac 00 50 4a 43 31 37
04 0e 01 03 0e 28 1e 96 2b 0c c9 a0 57 47 9b 27
12 48 4c a4 43 80 a9 59 a9 4f 61 59 71 59 45 59
c2 8f 31 59 01 01 86 3d 00 c0 51 00 30 40 40 a0
13 00 6c 23 11 00 00 1e 00 00 00 fd 00 30 aa 1e
82 1d 00 0a 20 20 20 20 20 20 00 00 00 fc 00 44
45 4c 4c 20 50 31 31 33 30 0a 20 20 00 00 00 ff
00 36 44 32 35 31 34 31 4a 37 31 43 4a 0a 00 51

----------------

Block 0, Base EDID:
  EDID Structure Version & Revision: 1.3
  Vendor & Product Identification:
    Manufacturer: DEL
    Model: 20480
    Serial Number: ...
    Made in: week 4 of 2004
  Basic Display Parameters & Features:
    Analog display
    Signal Level Standard: 0.700 : 0.300 : 1.000 V p-p
    Blank level equals black level
    Sync: Separate Composite SyncOnGreen
    Maximum image size: 40 cm x 30 cm
    Gamma: 2.50
    DPMS levels: Off
    RGB color display
    First detailed timing is the preferred timing
    Supports GTF timings within operating range
  Color Characteristics:
    Red  : 0.6250, 0.3398
    Green: 0.2802, 0.6054
    Blue : 0.1552, 0.0703
    White: 0.2832, 0.2978
  Established Timings I & II:
    IBM     :   720x400    70.081663 Hz   9:5     31.467 kHz     28.320000 MHz
    DMT 0x04:   640x480    59.940476 Hz   4:3     31.469 kHz     25.175000 MHz
    DMT 0x06:   640x480    75.000000 Hz   4:3     37.500 kHz     31.500000 MHz
    DMT 0x0b:   800x600    75.000000 Hz   4:3     46.875 kHz     49.500000 MHz
    DMT 0x12:  1024x768    75.028582 Hz   4:3     60.023 kHz     78.750000 MHz
    DMT 0x24:  1280x1024   75.024675 Hz   5:4     79.976 kHz    135.000000 MHz
    Apple   :  1152x870    75.061550 Hz 192:145   68.681 kHz    100.000000 MHz
  Standard Timings:
    DMT 0x37:  1600x1200   85.000000 Hz   4:3    106.250 kHz    229.500000 MHz
    DMT 0x36:  1600x1200   75.000000 Hz   4:3     93.750 kHz    202.500000 MHz
    DMT 0x13:  1024x768    84.996690 Hz   4:3     68.677 kHz     94.500000 MHz
    GTF     :  1152x864    84.999687 Hz   4:3     77.095 kHz    119.651000 MHz
    DMT 0x0c:   800x600    85.061274 Hz   4:3     53.674 kHz     56.250000 MHz
    GTF     :  1800x1440   74.999946 Hz   5:4    112.725 kHz    278.656000 MHz
    DMT 0x07:   640x480    85.008312 Hz   4:3     43.269 kHz     36.000000 MHz
  Detailed Timing Descriptors:
    DTD 1:  1280x1024   85.024098 Hz   5:4     91.146 kHz    157.500000 MHz (364 mm x 291 mm)
                 Hfront   64 Hsync 160 Hback  224 Hpol P
                 Vfront    1 Vsync   3 Vback   44 Vpol P
    Display Range Limits:
      Monitor ranges (GTF): 48-170 Hz V, 30-130 kHz H, max dotclock 290 MHz
    Display Product Name: 'DELL P1130'
    Display Product Serial Number: ...
Checksum: 0x51

----------------

EDID conformity: PASS
