edid-decode (hex):

00 ff ff ff ff ff ff 00 4c 2d c2 03 32 32 59 4d
29 12 01 03 80 2c 1e 78 2a b5 01 a5 56 4a 9a 25
12 50 54 bf ef 80 b3 00 81 80 81 40 71 4f 01 01
01 01 01 01 01 01 7c 2e 90 a0 60 1a 1e 40 30 20
36 00 cb 28 11 00 00 1a 00 00 00 fd 00 38 4b 1e
51 0e 00 0a 20 20 20 20 20 20 00 00 00 fc 00 53
79 6e 63 4d 61 73 74 65 72 0a 20 20 00 00 00 ff
00 48 4d 44 51 41 30 31 38 36 34 0a 20 20 01 14

02 03 1b 61 43 90 84 02 23 09 07 07 83 01 00 00
67 03 0c 00 20 00 80 28 e2 00 0f 8c 0a d0 8a 20
e0 2d 10 10 3e 96 00 a0 5a 00 00 00 00 00 00 00
00 00 00 00 00 00 00 00 00 00 00 00 00 00 00 00
00 00 00 00 00 00 00 00 00 00 00 00 00 00 00 00
00 00 00 00 00 00 00 00 00 00 00 00 00 00 00 00
00 00 00 00 00 00 00 00 00 00 00 00 00 00 00 00
00 00 00 00 00 00 00 00 00 00 00 00 00 00 00 2e

00 ff ff ff ff ff ff 00 4c 2d c2 03 32 32 59 4d
29 12 01 03 80 2c 1e 78 2a b5 01 a5 56 4a 9a 25
12 50 54 bf ef 80 b3 00 81 80 81 40 71 4f 01 01
01 01 01 01 01 01 7c 2e 90 a0 60 1a 1e 40 30 20
36 00 cb 28 11 00 00 1a 00 00 00 fd 00 38 4b 1e
51 0e 00 0a 20 20 20 20 20 20 00 00 00 fc 00 53
79 6e 63 4d 61 73 74 65 72 0a 20 20 00 00 00 ff
00 48 4d 44 51 41 30 31 38 36 34 0a 20 20 01 14

02 03 1b 61 43 90 84 02 23 09 07 07 83 01 00 00
67 03 0c 00 20 00 80 28 e2 00 0f 8c 0a d0 8a 20
e0 2d 10 10 3e 96 00 a0 5a 00 00 00 00 00 00 00
00 00 00 00 00 00 00 00 00 00 00 00 00 00 00 00
00 00 00 00 00 00 00 00 00 00 00 00 00 00 00 00
00 00 00 00 00 00 00 00 00 00 00 00 00 00 00 00
00 00 00 00 00 00 00 00 00 00 00 00 00 00 00 00
00 00 00 00 00 00 00 00 00 00 00 00 00 00 00 2e

----------------

Block 0, Base EDID:
  EDID Structure Version & Revision: 1.3
  Vendor & Product Identification:
    Manufacturer: SAM
    Model: 962
    Serial Number: ...
    Made in: week 41 of 2008
  Basic Display Parameters & Features:
    Digital display
    Maximum image size: 44 cm x 30 cm
    Gamma: 2.20
    DPMS levels: Off
    RGB color display
    First detailed timing is the preferred timing
  Color Characteristics:
    Red  : 0.6464, 0.3388
    Green: 0.2900, 0.6025
    Blue : 0.1445, 0.0703
    White: 0.3125, 0.3291
  Established Timings I & II:
    IBM     :   720x400    70.081663 Hz   9:5     31.467 kHz     28.320000 MHz
    DMT 0x04:   640x480    59.940476 Hz   4:3     31.469 kHz     25.175000 MHz
    Apple   :   640x480    66.666667 Hz   4:3     35.000 kHz     30.240000 MHz
    DMT 0x05:   640x480    72.808802 Hz   4:3     37.861 kHz     31.500000 MHz
    DMT 0x06:   640x480    75.000000 Hz   4:3     37.500 kHz     31.500000 MHz
    DMT 0x08:   800x600    56.250000 Hz   4:3     35.156 kHz     36.000000 MHz
    DMT 0x09:   800x600    60.316541 Hz   4:3     37.879 kHz     40.000000 MHz
    DMT 0x0a:   800x600    72.187572 Hz   4:3     48.077 kHz     50.000000 MHz
    DMT 0x0b:   800x600    75.000000 Hz   4:3     46.875 kHz     49.500000 MHz
    Apple   :   832x624    74.551266 Hz   4:3     49.726 kHz     57.284000 MHz
    DMT 0x10:  1024x768    60.003840 Hz   4:3     48.363 kHz     65.000000 MHz
    DMT 0x11:  1024x768    70.069359 Hz   4:3     56.476 kHz     75.000000 MHz
    DMT 0x12:  1024x768    75.028582 Hz   4:3     60.023 kHz     78.750000 MHz
    DMT 0x24:  1280x1024   75.024675 Hz   5:4     79.976 kHz    135.000000 MHz
    Apple   :  1152x870    75.061550 Hz 192:145   68.681 kHz    100.000000 MHz
  Standard Timings:
    DMT 0x3a:  1680x1050   59.954250 Hz  16:10    65.290 kHz    146.250000 MHz
    DMT 0x23:  1280x1024   60.019740 Hz   5:4     63.981 kHz    108.000000 MHz
    DMT 0x20:  1280x960    60.000000 Hz   4:3     60.000 kHz    108.000000 MHz
    DMT 0x15:  1152x864    75.000000 Hz   4:3     67.500 kHz    108.000000 MHz
  Detailed Timing Descriptors:
    DTD 1:  1680x1050   59.883253 Hz  16:10    64.674 kHz    119.000000 MHz (459 mm x 296 mm)
                 Hfront   48 Hsync  32 Hback   80 Hpol P
                 Vfront    3 Vsync   6 Vback   21 Vpol N
    Display Range Limits:
      Monitor ranges (GTF): 56-75 Hz V, 30-81 kHz H, max dotclock 140 MHz
    Display Product Name: 'SyncMaster'
    Display Product Serial Number: ...
  Extension blocks: 1
Checksum: 0x14

----------------

Block 1, CTA-861 Extension Block:
  Revision: 3
  Basic audio support
  Supports YCbCr 4:4:4
  Native detailed modes: 1
  Video Data Block:
    VIC  16:  1920x1080   60.000000 Hz  16:9     67.500 kHz    148.500000 MHz (native)
    VIC   4:  1280x720    60.000000 Hz  16:9     45.000 kHz     74.250000 MHz (native)
    VIC   2:   720x480    59.940060 Hz   4:3     31.469 kHz     27.000000 MHz
  Audio Data Block:
    Linear PCM:
      Max channels: 2
      Supported sample rates (kHz): 48 44.1 32
      Supported sample sizes (bits): 24 20 16
  Speaker Allocation Data Block:
    FL/FR - Front Left/Right
  Vendor-Specific Data Block (HDMI), OUI 00-0C-03:
    Source physical address: 2.0.0.0
    Supports_AI
    Maximum TMDS clock: 200 MHz
  Video Capability Data Block:
    YCbCr quantization: No Data
    RGB quantization: No Data
    PT scan behavior: No Data
    IT scan behavior: Supports both over- and underscan
    CE scan behavior: Supports both over- and underscan
  Detailed Timing Descriptors:
    DTD 2:   720x480    59.940060 Hz   3:2     31.469 kHz     27.000000 MHz (analog composite, sync-on-green, 160 mm x 90 mm)
                 Hfront   16 Hsync  62 Hback   60 Hpol N
                 Vfront    9 Vsync   6 Vback   30 Vpol N
Checksum: 0x2e  Unused space in Extension Block: 82 bytes

----------------

Block 2, Unknown EDID Extension Block 0x00:
  00 ff ff ff ff ff ff 00 4c 2d c2 03 32 32 59 4d '........L-..22YM'
  29 12 01 03 80 2c 1e 78 2a b5 01 a5 56 4a 9a 25 ')....,.x*...VJ.%'
  12 50 54 bf ef 80 b3 00 81 80 81 40 71 4f 01 01 '.PT........@qO..'
  01 01 01 01 01 01 7c 2e 90 a0 60 1a 1e 40 30 20 '......|...`..@0 '
  36 00 cb 28 11 00 00 1a 00 00 00 fd 00 38 4b 1e '6..(.........8K.'
  51 0e 00 0a 20 20 20 20 20 20 00 00 00 fc 00 53 'Q...      .....S'
  79 6e 63 4d 61 73 74 65 72 0a 20 20 00 00 00 ff 'yncMaster.  ....'
  00 48 4d 44 51 41 30 31 38 36 34 0a 20 20 01 14 '.HMDQA01864.  ..'
Checksum: 0x14

----------------

Block 3, CTA-861 Extension Block:
  Revision: 3
  Basic audio support
  Supports YCbCr 4:4:4
  Native detailed modes: 1
  Video Data Block:
    VIC  16:  1920x1080   60.000000 Hz  16:9     67.500 kHz    148.500000 MHz (native)
    VIC   4:  1280x720    60.000000 Hz  16:9     45.000 kHz     74.250000 MHz (native)
    VIC   2:   720x480    59.940060 Hz   4:3     31.469 kHz     27.000000 MHz
  Audio Data Block:
    Linear PCM:
      Max channels: 2
      Supported sample rates (kHz): 48 44.1 32
      Supported sample sizes (bits): 24 20 16
  Speaker Allocation Data Block:
    FL/FR - Front Left/Right
  Vendor-Specific Data Block (HDMI), OUI 00-0C-03:
    Source physical address: 2.0.0.0
    Supports_AI
    Maximum TMDS clock: 200 MHz
  Video Capability Data Block:
    YCbCr quantization: No Data
    RGB quantization: No Data
    PT scan behavior: No Data
    IT scan behavior: Supports both over- and underscan
    CE scan behavior: Supports both over- and underscan
  Detailed Timing Descriptors:
    DTD 3:   720x480    59.940060 Hz   3:2     31.469 kHz     27.000000 MHz (analog composite, sync-on-green, 160 mm x 90 mm)
                 Hfront   16 Hsync  62 Hback   60 Hpol N
                 Vfront    9 Vsync   6 Vback   30 Vpol N
Checksum: 0x2e  Unused space in Extension Block: 82 bytes

----------------

Warnings:

Block 1, CTA-861 Extension Block:
  IT Video Formats are overscanned by default, but normally this should be underscanned.
  Video Capability Data Block: Set Selectable YCbCr Quantization to avoid interop issues.
  Display Product Serial Number is set, so the Serial Number in the Base EDID should be 0.
  Add a Colorimetry Data Block with the sRGB colorimetry bit set to avoid interop issues.
Block 3, CTA-861 Extension Block:
  IT Video Formats are overscanned by default, but normally this should be underscanned.
  Video Capability Data Block: Set Selectable YCbCr Quantization to avoid interop issues.
  Display Product Serial Number is set, so the Serial Number in the Base EDID should be 0.
  Add a Colorimetry Data Block with the sRGB colorimetry bit set to avoid interop issues.
EDID:
  Base EDID: Some timings are out of range of the Monitor Ranges:
    Maximum Clock: 148.500 MHz (Monitor: 140.000 MHz)
    Could be due to a Monitor Range off-by-one rounding issue

Failures:

Block 0, Base EDID:
  Detailed Timing Descriptor #1: Mismatch of image size 459x296 mm vs display size 440x300 mm.
Block 1, CTA-861 Extension Block:
  Video Capability Data Block: Set Selectable RGB Quantization to avoid interop issues.
  Detailed Timing Descriptor #2: Mismatch of image size 160x90 mm vs display size 440x300 mm.
Block 2, Base EDID:
  Unknown Extension Block.
Block 3, CTA-861 Extension Block:
  Video Data Block: Duplicate VIC 16.
  Video Data Block: Duplicate VIC 4.
  Video Data Block: Duplicate VIC 2.
  Speaker Allocation Data Block: Only one instance of this Data Block is allowed.
  Video Capability Data Block: Only one instance of this Data Block is allowed.
  Video Capability Data Block: Set Selectable RGB Quantization to avoid interop issues.
  Detailed Timing Descriptor #3: Mismatch of image size 160x90 mm vs display size 440x300 mm.
EDID:
  Base EDID: The DTD max image size is 459x296mm, which is larger than the display size 440.0x300.0mm.
  Base EDID: EDID specified 1 extension block(s), but found 3 extension block(s).
  Base EDID: EDID 1.3 requires a Block Map Extension in Block 1 if there are more than 2 blocks in the EDID.
  CTA-861: Native progressive timings are a mix of several resolutions.

EDID conformity: FAIL
