edid-decode (hex):

00 ff ff ff ff ff ff 00 04 72 4d 06 09 e2 21 95
34 1d 01 04 a5 3c 22 78 3b 0b 75 a6 55 53 9f 28
0e 50 54 23 08 00 81 40 81 80 81 c0 81 00 95 00
b3 00 d1 c0 01 01 fa 7e 80 88 70 38 12 40 18 20
35 00 56 50 21 00 00 1e 86 6f 80 a0 70 38 40 40
30 20 35 00 56 50 21 00 00 1e 00 00 00 fd 00 30
90 b4 b4 3c 01 0a 20 20 20 20 20 20 00 00 00 fc
00 41 63 65 72 20 58 46 32 37 30 48 20 42 01 a7

02 03 1e f1 4b 01 03 04 12 13 05 14 1f 07 90 3f
23 09 07 07 83 01 00 00 65 03 0c 00 10 00 02 3a
80 18 71 38 2d 40 58 2c 45 00 56 50 21 00 00 1e
01 1d 00 72 51 d0 1e 20 6e 28 55 00 56 50 21 00
00 1e 8c 0a d0 8a 20 e0 2d 10 10 3e 96 00 56 50
21 00 00 18 8c 0a d0 90 20 40 31 20 0c 40 55 00
56 50 21 00 00 18 86 6f 80 a0 70 38 40 40 30 20
35 00 56 50 21 00 00 1e 00 00 00 00 00 00 00 0f

----------------

Block 0, Base EDID:
  EDID Structure Version & Revision: 1.4
  Vendor & Product Identification:
    Manufacturer: ACR
    Model: 1613
    Serial Number: ...
    Made in: week 52 of 2019
  Basic Display Parameters & Features:
    Digital display
    Bits per primary color channel: 8
    DisplayPort interface
    Maximum image size: 60 cm x 34 cm
    Gamma: 2.20
    DPMS levels: Off
    Supported color formats: RGB 4:4:4, YCrCb 4:4:4, YCrCb 4:2:2
    First detailed timing includes the native pixel format and preferred refresh rate
    Display is continuous frequency
  Color Characteristics:
    Red  : 0.6484, 0.3320
    Green: 0.3261, 0.6240
    Blue : 0.1572, 0.0576
    White: 0.3134, 0.3291
  Established Timings I & II:
    DMT 0x04:   640x480    59.940 Hz   4:3    31.469 kHz  25.175 MHz
    DMT 0x08:   800x600    56.250 Hz   4:3    35.156 kHz  36.000 MHz
    DMT 0x09:   800x600    60.317 Hz   4:3    37.879 kHz  40.000 MHz
    DMT 0x10:  1024x768    60.004 Hz   4:3    48.363 kHz  65.000 MHz
  Standard Timings:
    DMT 0x20:  1280x960    60.000 Hz   4:3    60.000 kHz 108.000 MHz
    DMT 0x23:  1280x1024   60.020 Hz   5:4    63.981 kHz 108.000 MHz
    DMT 0x55:  1280x720    60.000 Hz  16:9    45.000 kHz  74.250 MHz
    DMT 0x1c:  1280x800    59.810 Hz  16:10   49.702 kHz  83.500 MHz
    DMT 0x2f:  1440x900    59.887 Hz  16:10   55.935 kHz 106.500 MHz
    DMT 0x3a:  1680x1050   59.954 Hz  16:10   65.290 kHz 146.250 MHz
    DMT 0x52:  1920x1080   60.000 Hz  16:9    67.500 kHz 148.500 MHz
  Detailed Timing Descriptors:
    DTD 1:  1920x1080  143.992 Hz  16:9   158.103 kHz 325.060 MHz (598 mm x 336 mm)
                 Hfront   24 Hsync  32 Hback  80 Hpol P
                 Vfront    3 Vsync   5 Vback  10 Vpol P
    DTD 2:  1920x1080  119.982 Hz  16:9   137.260 kHz 285.500 MHz (598 mm x 336 mm)
                 Hfront   48 Hsync  32 Hback  80 Hpol P
                 Vfront    3 Vsync   5 Vback  56 Vpol P
  Display Range Limits:
    Monitor ranges (Bare Limits): 48-144 Hz V, 180-180 kHz H, max dotclock 600 MHz
    Display Product Name: 'Acer XF270H B'
  Extension blocks: 1
Checksum: 0xa7

----------------

Block 1, CTA-861 Extension Block:
  Revision: 3
  Underscans PC formats by default
  Basic audio support
  Supports YCbCr 4:4:4
  Supports YCbCr 4:2:2
  Native detailed modes: 1
  Video Data Block:
    VIC   1:   640x480    59.940 Hz   4:3    31.469 kHz  25.175 MHz
    VIC   3:   720x480    59.940 Hz  16:9    31.469 kHz  27.000 MHz
    VIC   4:  1280x720    60.000 Hz  16:9    45.000 kHz  74.250 MHz
    VIC  18:   720x576    50.000 Hz  16:9    31.250 kHz  27.000 MHz
    VIC  19:  1280x720    50.000 Hz  16:9    37.500 kHz  74.250 MHz
    VIC   5:  1920x1080i  60.000 Hz  16:9    33.750 kHz  74.250 MHz
    VIC  20:  1920x1080i  50.000 Hz  16:9    28.125 kHz  74.250 MHz
    VIC  31:  1920x1080   50.000 Hz  16:9    56.250 kHz 148.500 MHz
    VIC   7:  1440x480i   59.940 Hz  16:9    15.734 kHz  27.000 MHz
    VIC  16:  1920x1080   60.000 Hz  16:9    67.500 kHz 148.500 MHz (native)
    VIC  63:  1920x1080  120.000 Hz  16:9   135.000 kHz 297.000 MHz
  Audio Data Block:
    Linear PCM:
      Max channels: 2
      Supported sample rates (kHz): 48 44.1 32
      Supported sample sizes (bits): 24 20 16
  Speaker Allocation Data Block:
    FL/FR - Front Left/Right
  Vendor-Specific Data Block (HDMI), OUI 00-0C-03:
    Source physical address: 1.0.0.0
  Detailed Timing Descriptors:
    DTD 3:  1920x1080   60.000 Hz  16:9    67.500 kHz 148.500 MHz (598 mm x 336 mm)
                 Hfront   88 Hsync  44 Hback 148 Hpol P
                 Vfront    4 Vsync   5 Vback  36 Vpol P
    DTD 4:  1280x720    60.000 Hz  16:9    45.000 kHz  74.250 MHz (598 mm x 336 mm)
                 Hfront  110 Hsync  40 Hback 220 Hpol P
                 Vfront    5 Vsync   5 Vback  20 Vpol P
    DTD 5:   720x480    59.940 Hz   3:2    31.469 kHz  27.000 MHz (598 mm x 336 mm)
                 Hfront   16 Hsync  62 Hback  60 Hpol N
                 Vfront    9 Vsync   6 Vback  30 Vpol N
    DTD 6:   720x576    50.000 Hz   5:4    31.250 kHz  27.000 MHz (598 mm x 336 mm)
                 Hfront   12 Hsync  64 Hback  68 Hpol N
                 Vfront    5 Vsync   5 Vback  39 Vpol N
    DTD 7:  1920x1080  119.982 Hz  16:9   137.260 kHz 285.500 MHz (598 mm x 336 mm)
                 Hfront   48 Hsync  32 Hback  80 Hpol P
                 Vfront    3 Vsync   5 Vback  56 Vpol P
Checksum: 0xf

----------------

Warnings:

All Blocks:
  Some timings are out of range of the Monitor Ranges:
    Horizontal Freq: 15.734 - 158.103 kHz (Monitor: 180.000 - 180.000 kHz)

Failures:

Block 1, CTA-861 Extension Block:
  Vendor-Specific Data Block (HDMI): The HDMI Specification uses EDID 1.3, not 1.4.

EDID conformity: FAIL
