edid-decode (hex):

00 ff ff ff ff ff ff 00 1e d4 01 04 0d 09 b1 00
10 0b 01 02 68 1d 15 78 2a 63 f8 9e 56 4c 9b 24
19 50 55 21 08 00 01 01 01 01 01 01 01 01 01 01
01 01 01 01 01 01 64 19 00 40 41 00 26 30 18 88
36 00 30 e4 10 00 00 18 00 00 00 fc 00 47 56 69
73 69 6f 6e 0a 20 20 20 20 20 00 00 00 fc 00 20
4c 34 42 58 20 20 20 0a 20 20 20 20 00 00 00 fe
00 44 41 56 49 44 5f 4c 49 4e 0a 20 20 20 00 a0

----------------

Block 0, Base EDID:
  EDID Structure Version & Revision: 1.2
  Vendor & Product Identification:
    Manufacturer: GVT
    Model: 1025
    Serial Number: ...
    Made in: week 16 of 2001
  Basic Display Parameters & Features:
    Analog display
    Input voltage level: 0.7/0.7 V
    Blank level equals black level
    Sync: Separate
    Maximum image size: 29 cm x 21 cm
    Gamma: 2.20
    DPMS levels: Off
    RGB color display
    First detailed timing is the preferred timing
  Color Characteristics:
    Red  : 0.6181, 0.3378
    Green: 0.2968, 0.6083
    Blue : 0.1435, 0.1005
    White: 0.3144, 0.3320
  Established Timings I & II:
    DMT 0x04:   640x480    59.940476 Hz   4:3     31.469 kHz     25.175000 MHz
    DMT 0x09:   800x600    60.316541 Hz   4:3     37.879 kHz     40.000000 MHz
    DMT 0x10:  1024x768    60.003840 Hz   4:3     48.363 kHz     65.000000 MHz
  Standard Timings: none
  Detailed Timing Descriptors:
    DTD 1:  1024x768    60.003840 Hz   4:3     48.363 kHz     65.000000 MHz (304 mm x 228 mm)
                 Hfront   24 Hsync 136 Hback  160 Hpol N
                 Vfront    3 Vsync   6 Vback   29 Vpol N
    Display Product Name: 'GVision'
    Display Product Name: ' L4BX   '
    Alphanumeric Data String: 'DAVID_LIN'
Checksum: 0xa0

----------------

Warnings:

Block 0, Base EDID:
  EDID Structure Version & Revision: EDID 1.2 is deprecated, do not use.

Failures:

Block 0, Base EDID:
  Detailed Timing Descriptor #1: Mismatch of image size 304x228 mm vs display size 290x210 mm.
  Display Product Name: One or more trailing spaces.

EDID conformity: FAIL
