
EDID (hex):
00ffffffffffff000daef51400000000
101c0104951f11780228659759548e27
1e505400000001010101010101010101
010101010101b43b804a713834403020
350035ad10000018000000fe004e3134
3048434e2d4541310a20000000fe0043
4d4e0a202020202020202020000000fe
004e31343048434e2d4541310a20007f

Extracted contents:
header:          00 ff ff ff ff ff ff 00
serial number:   0d ae f5 14 00 00 00 00 10 1c
version:         01 04
basic params:    95 1f 11 78 02
chroma info:     28 65 97 59 54 8e 27 1e 50 54
established:     00 00 00
standard:        01 01 01 01 01 01 01 01 01 01 01 01 01 01 01 01
descriptor 1:    b4 3b 80 4a 71 38 34 40 30 20 35 00 35 ad 10 00 00 18
descriptor 2:    00 00 00 fe 00 4e 31 34 30 48 43 4e 2d 45 41 31 0a 20
descriptor 3:    00 00 00 fe 00 43 4d 4e 0a 20 20 20 20 20 20 20 20 20
descriptor 4:    00 00 00 fe 00 4e 31 34 30 48 43 4e 2d 45 41 31 0a 20
extensions:      00
checksum:        7f

EDID version: 1.4
Manufacturer: CMN Model 14f5 Serial Number --
Made in week 16 of 2018
Digital display
6 bits per primary color channel
DisplayPort interface
Maximum image size: 31 cm x 17 cm
Gamma: 2.20
Supported color formats: RGB 4:4:4
First detailed timing includes the native pixel format and preferred refresh rate
Display x,y Chromaticity:
  Red:   0.5898, 0.3496
  Green: 0.3300, 0.5546
  Blue:  0.1533, 0.1191
  White: 0.3134, 0.3291
Established timings supported:
Standard timings supported:
Detailed mode: Clock 152.840 MHz, 309 mm x 173 mm
               1920 1968 2000 2250 hborder 0
               1080 1083 1088 1132 vborder 0
               -hsync -vsync 
               VertFreq: 60 Hz, HorFreq: 67928 Hz
ASCII string: N140HCN-EA1
ASCII string: CMN
ASCII string: N140HCN-EA1
Checksum: 0x7f (valid)
EDID block does NOT conform to EDID 1.4!
	Missing name descriptor
	Missing monitor ranges
