
EDID (hex):
00ffffffffffff0026cfe60400000000
181b0104a51c1078023f00965a4f8d27
15505400000001010101010101010101
0101010101014f3680a070382240323c
ae00149c100000190000000000000000
00000000000000000000000000fe0049
6e666f566973696f6e0a2020000000fe
004d3132354e574634205230200a00eb

Extracted contents:
header:          00 ff ff ff ff ff ff 00
serial number:   26 cf e6 04 00 00 00 00 18 1b
version:         01 04
basic params:    a5 1c 10 78 02
chroma info:     3f 00 96 5a 4f 8d 27 15 50 54
established:     00 00 00
standard:        01 01 01 01 01 01 01 01 01 01 01 01 01 01 01 01
descriptor 1:    4f 36 80 a0 70 38 22 40 32 3c ae 00 14 9c 10 00 00 19
descriptor 2:    00 00 00 00 00 00 00 00 00 00 00 00 00 00 00 00 00 00
descriptor 3:    00 00 00 fe 00 49 6e 66 6f 56 69 73 69 6f 6e 0a 20 20
descriptor 4:    00 00 00 fe 00 4d 31 32 35 4e 57 46 34 20 52 30 20 0a
extensions:      00
checksum:        eb

EDID version: 1.4
Manufacturer: IVO Model 4e6 Serial Number --
Made in week 24 of 2017
Digital display
8 bits per primary color channel
DisplayPort interface
Maximum image size: 28 cm x 16 cm
Gamma: 2.20
Supported color formats: RGB 4:4:4
First detailed timing includes the native pixel format and preferred refresh rate
Display x,y Chromaticity:
  Red:   0.5859, 0.3544
  Green: 0.3115, 0.5537
  Blue:  0.1523, 0.0820
  White: 0.3125, 0.3281
Established timings supported:
Standard timings supported:
Detailed mode: Clock 139.030 MHz, 276 mm x 156 mm
               1920 1970 2030 2080 hborder 0
               1080 1090 1104 1114 vborder 0
               -hsync -vsync 
               VertFreq: 60 Hz, HorFreq: 66841 Hz
Manufacturer-specified data, tag 0
ASCII string: InfoVision
ASCII string: M125NWF4 R0 
Checksum: 0xeb (valid)
EDID block does NOT conform to EDID 1.4!
	Missing name descriptor
	Missing monitor ranges
