
EDID (hex):
00ffffffffffff0009e5470700000000
121b0104a5231478021bbba658559d26
0e4f5500000001010101010101010101
0101010101019c3b803671383c403020
360059c31000001a0000000000000000
0000000000000000001a000000fe0042
4f452043510a202020202020000000fe
0047313536454130310a202020200058

edid-decode (hex):

00 ff ff ff ff ff ff 00 09 e5 47 07 00 00 00 00
12 1b 01 04 a5 23 14 78 02 1b bb a6 58 55 9d 26
0e 4f 55 00 00 00 01 01 01 01 01 01 01 01 01 01
01 01 01 01 01 01 9c 3b 80 36 71 38 3c 40 30 20
36 00 59 c3 10 00 00 1a 00 00 00 00 00 00 00 00
00 00 00 00 00 00 00 00 00 1a 00 00 00 fe 00 42
4f 45 20 43 51 0a 20 20 20 20 20 20 00 00 00 fe
00 47 31 35 36 45 41 30 31 0a 20 20 20 20 00 58

----------------

Block 0, Base EDID:
  EDID Structure Version & Revision: 1.4
  Vendor & Product Identification:
    Manufacturer: BOE
    Model: 1863
    Made in: week 18 of 2017
  Basic Display Parameters & Features:
    Digital display
    Bits per primary color channel: 8
    DisplayPort interface
    Maximum image size: 35 cm x 20 cm
    Gamma: 2.20
    Supported color formats: RGB 4:4:4
    First detailed timing includes the native pixel format and preferred refresh rate
  Color Characteristics:
    Red  : 0.6484, 0.3447
    Green: 0.3339, 0.6162
    Blue : 0.1503, 0.0576
    White: 0.3105, 0.3349
  Established Timings I & II: none
  Standard Timings: none
  Detailed Timing Descriptors:
    DTD 1:  1920x1080   60.026748 Hz  16:9     68.430 kHz    152.600000 MHz (345 mm x 195 mm)
                 Hfront   48 Hsync  32 Hback  230 Hpol P
                 Vfront    3 Vsync   6 Vback   51 Vpol N
    Manufacturer-Specified Display Descriptor (0x00): 00 00 00 00 00 00 00 00 00 00 00 00 00 00 00 1a '................'
    Alphanumeric Data String: 'BOE CQ'
    Alphanumeric Data String: 'G156EA01'
Checksum: 0x58
