
EDID (hex):
00ffffffffffff000c650021502d3101
11150103002f1a782a3585a656489a24
125054afef00714f8180818a9500950f
b300d1c08100023a805270381e401020
3600dc0c1100000a000000fc00434345
32344c45440a0a0a0a0a000000fd0038
4b1e5315000a202020202020000000ff
00300a0a0a0a0a0a0a0a0a0a0a0a00ae

Extracted contents:
header:          00 ff ff ff ff ff ff 00
serial number:   0c 65 00 21 50 2d 31 01 11 15
version:         01 03
basic params:    00 2f 1a 78 2a
chroma info:     35 85 a6 56 48 9a 24 12 50 54
established:     af ef 00
standard:        71 4f 81 80 81 8a 95 00 95 0f b3 00 d1 c0 81 00
descriptor 1:    02 3a 80 52 70 38 1e 40 10 20 36 00 dc 0c 11 00 00 0a
descriptor 2:    00 00 00 fc 00 43 43 45 32 34 4c 45 44 0a 0a 0a 0a 0a
descriptor 3:    00 00 00 fd 00 38 4b 1e 53 15 00 0a 20 20 20 20 20 20
descriptor 4:    00 00 00 ff 00 30 0a 0a 0a 0a 0a 0a 0a 0a 0a 0a 0a 0a
extensions:      00
checksum:        ae

EDID version: 1.3
Manufacturer: CCE Model 2100 Serial Number --
Made in week 17 of 2011
Analog display, Input voltage level: 0.7/0.3 V
Sync: 
Maximum image size: 47 cm x 26 cm
Gamma: 2.20
DPMS levels: Off
RGB color display
First detailed timing is preferred timing
Display x,y Chromaticity:
  Red:   0.6484, 0.3388
  Green: 0.2822, 0.6025
  Blue:  0.1425, 0.0703
  White: 0.3134, 0.3291
Established timings supported:
  720x400@70Hz 9:5 HorFreq: 31469 Hz Clock: 28.320 MHz
  640x480@60Hz 4:3 HorFreq: 31469 Hz Clock: 25.175 MHz
  640x480@72Hz 4:3 HorFreq: 37900 Hz Clock: 31.500 MHz
  640x480@75Hz 4:3 HorFreq: 37500 Hz Clock: 31.500 MHz
  800x600@56Hz 4:3 HorFreq: 35200 Hz Clock: 36.000 MHz
  800x600@60Hz 4:3 HorFreq: 37900 Hz Clock: 40.000 MHz
  800x600@72Hz 4:3 HorFreq: 48100 Hz Clock: 50.000 MHz
  800x600@75Hz 4:3 HorFreq: 46900 Hz Clock: 49.500 MHz
  832x624@75Hz 4:3 HorFreq: 49726 Hz Clock: 57.284 MHz
  1024x768@60Hz 4:3 HorFreq: 48400 Hz Clock: 65.000 MHz
  1024x768@70Hz 4:3 HorFreq: 56500 Hz Clock: 75.000 MHz
  1024x768@75Hz 4:3 HorFreq: 60000 Hz Clock: 78.750 MHz
  1280x1024@75Hz 5:4 HorFreq: 80000 Hz Clock: 135.000 MHz
Standard timings supported:
  1152x864@75Hz 4:3 HorFreq: 67500 Hz Clock: 108.000 MHz
  1280x1024@60Hz 5:4 HorFreq: 64000 Hz Clock: 108.000 MHz
  1280x1024@70Hz 5:4
  1440x900@60Hz 16:10 HorFreq: 55500 Hz Clock: 88.750 MHz
  1440x900@75Hz 16:10 HorFreq: 82300 Hz Clock: 156.000 MHz
  1680x1050@60Hz 16:10 HorFreq: 64700 Hz Clock: 119.000 MHz
  1920x1080@60Hz 16:9
  1280x800@60Hz 16:10
Detailed mode: Clock 148.500 MHz, 476 mm x 268 mm
               1920 1936 1968 2002 hborder 0
               1080 1083 1089 1110 vborder 0
               +hsync -vsync bipolar analog composite 
               VertFreq: 66 Hz, HorFreq: 74175 Hz
Monitor name: CCE24LED
Monitor ranges (GTF): 56-75Hz V, 30-83kHz H, max dotclock 210MHz
Serial number: --
Checksum: 0xae (valid)
EDID block does NOT conform to EDID 1.3!
	Detailed block string not properly terminated
