edid-decode (hex):

00 ff ff ff ff ff ff 00 38 a3 da 67 01 01 01 01
26 17 01 03 80 3c 22 78 ea c7 25 ad 4f 35 af 26
0b 50 54 bf ef 80 81 c0 81 80 90 40 8b c0 95 00
a9 c0 a9 40 d1 c0 56 5e 00 a0 a0 a0 29 50 30 20
35 00 54 4f 21 00 00 1a 00 00 00 fd 00 32 57 1f
5e 19 00 0a 20 20 20 20 20 20 00 00 00 fc 00 50
41 32 37 31 57 0a 20 20 20 20 20 20 00 00 00 ff
00 33 39 31 30 33 33 36 39 54 42 0a 20 20 00 a2

00 ff ff ff ff ff ff 00 38 a3 da 67 01 01 01 01
26 17 01 03 80 3c 22 78 ea c7 25 ad 4f 35 af 26
0b 50 54 bf ef 80 81 c0 81 80 90 40 8b c0 95 00
a9 c0 a9 40 d1 c0 56 5e 00 a0 a0 a0 29 50 30 20
35 00 54 4f 21 00 00 1a 00 00 00 fd 00 32 57 1f
5e 19 00 0a 20 20 20 20 20 20 00 00 00 fc 00 50
41 32 37 31 57 0a 20 20 20 20 20 20 00 00 00 ff
00 33 39 31 30 33 33 36 39 54 42 0a 20 20 00 a2

----------------

Block 0, Base EDID:
  EDID Structure Version & Revision: 1.3
  Vendor & Product Identification:
    Manufacturer: NEC
    Model: 26586
    Serial Number: ...
    Made in: week 38 of 2013
  Basic Display Parameters & Features:
    Digital display
    Maximum image size: 60 cm x 34 cm
    Gamma: 2.20
    DPMS levels: Standby Suspend Off
    RGB color display
    First detailed timing is the preferred timing
  Color Characteristics:
    Red  : 0.6787, 0.3085
    Green: 0.2080, 0.6865
    Blue : 0.1484, 0.0449
    White: 0.3134, 0.3291
  Established Timings I & II:
    IBM     :   720x400    70.081663 Hz   9:5     31.467 kHz     28.320000 MHz
    DMT 0x04:   640x480    59.940476 Hz   4:3     31.469 kHz     25.175000 MHz
    Apple   :   640x480    66.666667 Hz   4:3     35.000 kHz     30.240000 MHz
    DMT 0x05:   640x480    72.808802 Hz   4:3     37.861 kHz     31.500000 MHz
    DMT 0x06:   640x480    75.000000 Hz   4:3     37.500 kHz     31.500000 MHz
    DMT 0x08:   800x600    56.250000 Hz   4:3     35.156 kHz     36.000000 MHz
    DMT 0x09:   800x600    60.316541 Hz   4:3     37.879 kHz     40.000000 MHz
    DMT 0x0a:   800x600    72.187572 Hz   4:3     48.077 kHz     50.000000 MHz
    DMT 0x0b:   800x600    75.000000 Hz   4:3     46.875 kHz     49.500000 MHz
    Apple   :   832x624    74.551266 Hz   4:3     49.726 kHz     57.284000 MHz
    DMT 0x10:  1024x768    60.003840 Hz   4:3     48.363 kHz     65.000000 MHz
    DMT 0x11:  1024x768    70.069359 Hz   4:3     56.476 kHz     75.000000 MHz
    DMT 0x12:  1024x768    75.028582 Hz   4:3     60.023 kHz     78.750000 MHz
    DMT 0x24:  1280x1024   75.024675 Hz   5:4     79.976 kHz    135.000000 MHz
    Apple   :  1152x870    75.061550 Hz 192:145   68.681 kHz    100.000000 MHz
  Standard Timings:
    DMT 0x55:  1280x720    60.000000 Hz  16:9     45.000 kHz     74.250000 MHz
    DMT 0x23:  1280x1024   60.019740 Hz   5:4     63.981 kHz    108.000000 MHz
    DMT 0x2a:  1400x1050   59.978442 Hz   4:3     65.317 kHz    121.750000 MHz
    GTF     :  1360x765    60.000341 Hz  16:9     47.520 kHz     84.396000 MHz
    DMT 0x2f:  1440x900    59.887445 Hz  16:10    55.935 kHz    106.500000 MHz
    DMT 0x53:  1600x900    60.000000 Hz  16:9     60.000 kHz    108.000000 MHz (RB)
    DMT 0x33:  1600x1200   60.000000 Hz   4:3     75.000 kHz    162.000000 MHz
    DMT 0x52:  1920x1080   60.000000 Hz  16:9     67.500 kHz    148.500000 MHz
  Detailed Timing Descriptors:
    DTD 1:  2560x1440   59.950550 Hz  16:9     88.787 kHz    241.500000 MHz (596 mm x 335 mm)
                 Hfront   48 Hsync  32 Hback   80 Hpol P
                 Vfront    3 Vsync   5 Vback   33 Vpol N
    Display Range Limits:
      Monitor ranges (GTF): 50-87 Hz V, 31-94 kHz H, max dotclock 250 MHz
    Display Product Name: 'PA271W'
    Display Product Serial Number: ...
Checksum: 0xa2

----------------

Block 1, Unknown EDID Extension Block 0x00:
  00 ff ff ff ff ff ff 00 38 a3 da 67 01 01 01 01 '........8..g....'
  26 17 01 03 80 3c 22 78 ea c7 25 ad 4f 35 af 26 '&....<"x..%.O5.&'
  0b 50 54 bf ef 80 81 c0 81 80 90 40 8b c0 95 00 '.PT........@....'
  a9 c0 a9 40 d1 c0 56 5e 00 a0 a0 a0 29 50 30 20 '...@..V^....)P0 '
  35 00 54 4f 21 00 00 1a 00 00 00 fd 00 32 57 1f '5.TO!........2W.'
  5e 19 00 0a 20 20 20 20 20 20 00 00 00 fc 00 50 '^...      .....P'
  41 32 37 31 57 0a 20 20 20 20 20 20 00 00 00 ff 'A271W.      ....'
  00 33 39 31 30 33 33 36 39 54 42 0a 20 20 00 a2 '.39103369TB.  ..'
Checksum: 0xa2

----------------

Warnings:

Block 0, Base EDID:
  Standard Timings: Standard Timing 1360x765 has a dubious odd vertical resolution.

Failures:

Block 1, Base EDID:
  Unknown Extension Block.
EDID:
  Base EDID: EDID specified 0 extension block(s), but found 1 extension block(s).

EDID conformity: FAIL
