edid-decode (hex):

00 ff ff ff ff ff ff 00 38 b8 01 00 01 00 00 00
01 17 01 03 a5 28 20 78 fa ee a6 9e 54 4c 99 26
19 4f 54 af cf 00 81 80 01 01 01 01 01 01 01 01
01 01 01 01 01 01 30 2a 00 98 51 00 2a 40 30 70
13 00 78 2d 11 00 00 1e 00 00 00 fc 00 53 58 47
41 0a 20 20 20 20 20 20 20 20 00 00 00 fd 00 38
4b 1e 51 0e 00 0a 20 20 20 20 20 20 00 00 00 ff
00 30 30 30 30 30 30 30 30 0a 20 20 20 20 01 81

02 03 1e f1 4b 85 10 04 03 06 12 16 11 01 14 1f
23 09 07 01 83 01 00 00 65 03 0c 00 10 00 01 1d
00 72 51 d0 1e 20 6e 28 55 00 26 58 21 00 00 1e
01 1d 80 18 71 1c 16 20 58 2c 25 00 26 58 21 00
00 9e 8c 0a d0 8a 20 e0 2d 10 10 3e 96 00 26 58
21 00 00 18 8c 0a a0 14 51 f0 16 00 26 7c 43 00
26 58 21 00 00 98 00 00 00 00 00 00 00 00 00 00
00 00 00 00 00 00 00 00 00 00 00 00 00 00 00 db

----------------

Block 0, Base EDID:
  EDID Structure Version & Revision: 1.3
  Vendor & Product Identification:
    Manufacturer: NEX
    Model: 1
    Serial Number: ...
    Made in: week 1 of 2013
  Basic Display Parameters & Features:
    Digital display
    DFP 1.x compatible TMDS
    Maximum image size: 40 cm x 32 cm
    Gamma: 2.20
    DPMS levels: Standby Suspend Off
    Undefined display color type
    First detailed timing is the preferred timing
  Color Characteristics:
    Red  : 0.6201, 0.3300
    Green: 0.2998, 0.5996
    Blue : 0.1503, 0.0996
    White: 0.3095, 0.3300
  Established Timings I & II:
    IBM     :   720x400    70.082 Hz   9:5    31.467 kHz  28.320 MHz
    DMT 0x04:   640x480    59.940 Hz   4:3    31.469 kHz  25.175 MHz
    DMT 0x05:   640x480    72.809 Hz   4:3    37.861 kHz  31.500 MHz
    DMT 0x06:   640x480    75.000 Hz   4:3    37.500 kHz  31.500 MHz
    DMT 0x08:   800x600    56.250 Hz   4:3    35.156 kHz  36.000 MHz
    DMT 0x09:   800x600    60.317 Hz   4:3    37.879 kHz  40.000 MHz
    DMT 0x0a:   800x600    72.188 Hz   4:3    48.077 kHz  50.000 MHz
    DMT 0x0b:   800x600    75.000 Hz   4:3    46.875 kHz  49.500 MHz
    DMT 0x10:  1024x768    60.004 Hz   4:3    48.363 kHz  65.000 MHz
    DMT 0x11:  1024x768    70.069 Hz   4:3    56.476 kHz  75.000 MHz
    DMT 0x12:  1024x768    75.029 Hz   4:3    60.023 kHz  78.750 MHz
    DMT 0x24:  1280x1024   75.025 Hz   5:4    79.976 kHz 135.000 MHz
  Standard Timings:
    DMT 0x23:  1280x1024   60.020 Hz   5:4    63.981 kHz 108.000 MHz
  Detailed Timing Descriptors:
    DTD 1:  1280x1024   60.020 Hz   5:4    63.981 kHz 108.000 MHz (376 mm x 301 mm)
                 Hfront   48 Hsync 112 Hback 248 Hpol P
                 Vfront    1 Vsync   3 Vback  38 Vpol P
    Display Product Name: 'SXGA'
  Display Range Limits:
    Monitor ranges (GTF): 56-75 Hz V, 30-81 kHz H, max dotclock 140 MHz
    Display Product Serial Number: ...
  Extension blocks: 1
Checksum: 0x81

----------------

Block 1, CTA-861 Extension Block:
  Revision: 3
  Underscans IT Video Formats by default
  Basic audio support
  Supports YCbCr 4:4:4
  Supports YCbCr 4:2:2
  Native detailed modes: 1
  Video Data Block:
    VIC   5:  1920x1080i  60.000 Hz  16:9    33.750 kHz  74.250 MHz (native)
    VIC  16:  1920x1080   60.000 Hz  16:9    67.500 kHz 148.500 MHz
    VIC   4:  1280x720    60.000 Hz  16:9    45.000 kHz  74.250 MHz
    VIC   3:   720x480    59.940 Hz  16:9    31.469 kHz  27.000 MHz
    VIC   6:  1440x480i   59.940 Hz   4:3    15.734 kHz  27.000 MHz
    VIC  18:   720x576    50.000 Hz  16:9    31.250 kHz  27.000 MHz
    VIC  22:  1440x576i   50.000 Hz  16:9    15.625 kHz  27.000 MHz
    VIC  17:   720x576    50.000 Hz   4:3    31.250 kHz  27.000 MHz
    VIC   1:   640x480    59.940 Hz   4:3    31.469 kHz  25.175 MHz
    VIC  20:  1920x1080i  50.000 Hz  16:9    28.125 kHz  74.250 MHz
    VIC  31:  1920x1080   50.000 Hz  16:9    56.250 kHz 148.500 MHz
  Audio Data Block:
    Linear PCM:
      Max channels: 2
      Supported sample rates (kHz): 48 44.1 32
      Supported sample sizes (bits): 16
  Speaker Allocation Data Block:
    FL/FR - Front Left/Right
  Vendor-Specific Data Block (HDMI), OUI 00-0C-03:
    Source physical address: 1.0.0.0
  Detailed Timing Descriptors:
    DTD 2:  1280x720    60.000 Hz  16:9    45.000 kHz  74.250 MHz (550 mm x 344 mm)
                 Hfront  110 Hsync  40 Hback 220 Hpol P
                 Vfront    5 Vsync   5 Vback  20 Vpol P
    DTD 3:  1920x1080i  60.000 Hz  16:9    33.750 kHz  74.250 MHz (550 mm x 344 mm)
                 Hfront   88 Hsync  44 Hback 148 Hpol P
                 Vfront    2 Vsync   5 Vback  15 Vpol P Vfront +0.5 Odd Field
                 Vfront    2 Vsync   5 Vback  15 Vpol P Vback  +0.5 Even Field
    DTD 4:   720x480    59.940 Hz   3:2    31.469 kHz  27.000 MHz (550 mm x 344 mm)
                 Hfront   16 Hsync  62 Hback  60 Hpol N
                 Vfront    9 Vsync   6 Vback  30 Vpol N
    DTD 5:  1440x480i   59.940 Hz   3:1    15.734 kHz  27.000 MHz (550 mm x 344 mm)
                 Hfront   38 Hsync 124 Hback 114 Hpol N
                 Vfront    4 Vsync   3 Vback  15 Vpol N Vfront +0.5 Odd Field
                 Vfront    4 Vsync   3 Vback  15 Vpol N Vback  +0.5 Even Field
Checksum: 0xdb

----------------

Warnings:

Block 1, CTA-861 Extension Block:
  Display Product Serial Number is set, so the Serial Number in the Base EDID should be 0.
  Missing VCDB, needed for Set Selectable RGB Quantization to avoid interop issues.

Failures:

Block 0, Base EDID:
  Basic Display Parameters & Features: Digital Video Interface Standard set to reserved value 0x24.
  Detailed Timing Descriptor #1: Mismatch of image size 376x301 mm vs display size 400x320 mm.
Block 1, CTA-861 Extension Block:
  Detailed Timing Descriptor #2: Mismatch of image size 550x344 mm vs display size 400x320 mm.
  Detailed Timing Descriptor #3: Mismatch of image size 550x344 mm vs display size 400x320 mm.
  Detailed Timing Descriptor #4: Mismatch of image size 550x344 mm vs display size 400x320 mm.
  Detailed Timing Descriptor #5: Mismatch of image size 550x344 mm vs display size 400x320 mm.
EDID:
  Base EDID: Some timings are out of range of the Monitor Ranges:
    Vertical Freq: 50.000 - 75.029 Hz (Monitor: 56.000 - 75.000 Hz)
    Horizontal Freq: 15.625 - 79.976 kHz (Monitor: 30.000 - 81.000 kHz)
    Maximum Clock: 148.500 MHz (Monitor: 140.000 MHz)

EDID conformity: FAIL
