edid-decode (hex):

00 ff ff ff ff ff ff 00 4c 83 51 47 00 00 00 00
00 16 01 04 90 22 13 78 0a 36 25 93 56 55 93 29
1d 50 54 00 00 00 01 01 01 01 01 01 01 01 01 01
01 01 01 01 01 01 ce 1d 56 f0 50 00 18 30 40 30
25 00 58 c2 10 00 00 19 d8 13 56 f0 50 00 18 30
40 30 25 00 58 c2 10 00 00 19 00 00 00 00 00 00
00 00 00 00 00 00 00 00 00 00 00 00 00 00 00 02
00 0c 4c ff 0a 3c 64 14 15 24 64 00 00 00 00 21

----------------

Block 0, Base EDID:
  EDID Structure Version & Revision: 1.4
  Vendor & Product Identification:
    Manufacturer: SDC
    Model: 18257
    Made in: 2012
  Basic Display Parameters & Features:
    Digital display
    Bits per primary color channel: 6
    Digital interface is not defined
    Maximum image size: 34 cm x 19 cm
    Gamma: 2.20
    Supported color formats: RGB 4:4:4, YCrCb 4:4:4
    First detailed timing includes the native pixel format and preferred refresh rate
  Color Characteristics:
    Red  : 0.5742, 0.3388
    Green: 0.3330, 0.5761
    Blue : 0.1601, 0.1152
    White: 0.3134, 0.3291
  Established Timings I & II: none
  Standard Timings: none
  Detailed Timing Descriptors:
    DTD 1:  1366x768    59.987 Hz 683:384  47.509 kHz  76.300 MHz (344 mm x 194 mm)
                 Hfront   64 Hsync  48 Hback 128 Hpol N
                 Vfront    2 Vsync   5 Vback  17 Vpol N
    DTD 2:  1366x768    39.939 Hz 683:384  31.631 kHz  50.800 MHz (344 mm x 194 mm)
                 Hfront   64 Hsync  48 Hback 128 Hpol N
                 Vfront    2 Vsync   5 Vback  17 Vpol N
    Empty Descriptor
    Manufacturer-Specified Display Descriptor (0x02): 00 02 00 0c 4c ff 0a 3c 64 14 15 24 64 00 00 00 '....L..<d..$d...'
Checksum: 0x21

----------------

Failures:

Block 0, Base EDID:
  Empty Descriptor: Use Dummy Descriptor instead of all zeroes.
  Missing Display Product Name.

EDID conformity: FAIL
