edid-decode (hex):

00 ff ff ff ff ff ff 00 30 ae 67 40 00 00 00 00
00 12 01 03 80 25 17 78 ea 87 f5 94 57 4f 8c 27
27 50 54 00 00 00 01 01 01 01 01 01 01 01 01 01
01 01 01 01 01 01 23 3f 80 20 71 b0 14 40 30 20
26 00 6f e6 10 00 00 19 9c 34 80 20 71 b0 14 40
30 20 26 00 6f e6 10 00 00 19 00 00 00 0f 00 d1
0a 32 d1 0a 28 28 01 00 4c a3 43 54 00 00 00 fe
00 4c 54 4e 31 37 30 43 54 30 31 4c 30 31 00 ce

----------------

Block 0, Base EDID:
  EDID Structure Version & Revision: 1.3
  Vendor & Product Identification:
    Manufacturer: LEN
    Model: 16487
    Made in: 2008
  Basic Display Parameters & Features:
    Digital display
    Maximum image size: 37 cm x 23 cm
    Gamma: 2.20
    DPMS levels: Standby Suspend Off
    RGB color display
    First detailed timing is the preferred timing
  Color Characteristics:
    Red  : 0.5800, 0.3398
    Green: 0.3095, 0.5498
    Blue : 0.1552, 0.1552
    White: 0.3134, 0.3291
  Established Timings I & II: none
  Standard Timings: none
  Detailed Timing Descriptors:
    DTD 1:  1920x1200   60.001633 Hz   8:5     73.202 kHz    161.630000 MHz (367 mm x 230 mm)
                 Hfront   48 Hsync  32 Hback  208 Hpol N
                 Vfront    2 Vsync   6 Vback   12 Vpol N
    DTD 2:  1920x1200   49.997030 Hz   8:5     60.996 kHz    134.680000 MHz (367 mm x 230 mm)
                 Hfront   48 Hsync  32 Hback  208 Hpol N
                 Vfront    2 Vsync   6 Vback   12 Vpol N
    Manufacturer-Specified Display Descriptor (0x0f): 00 0f 00 d1 0a 32 d1 0a 28 28 01 00 4c a3 43 54 '.....2..((..L.CT'
    Alphanumeric Data String: 'LTN170CT01L01'
Checksum: 0xce

----------------

Failures:

Block 0, Base EDID:
  Missing Display Product Name.
  Missing Display Range Limits Descriptor.

EDID conformity: FAIL
