edid-decode (hex):

00 ff ff ff ff ff ff 00 10 ac 4c a0 4d 33 37 33
11 14 01 04 a5 29 17 78 e6 ee 95 a3 54 4c 99 26
0f 50 54 a5 4a 00 01 01 01 01 01 01 01 01 01 01
01 01 01 01 01 01 66 21 56 aa 51 00 1e 30 46 8f
33 00 9a e6 10 00 00 1e 00 00 00 ff 00 47 35 31
30 4e 30 34 49 33 37 33 4d 0a 00 00 00 fc 00 44
45 4c 4c 20 49 4e 31 39 31 30 4e 0a 00 00 00 fd
00 38 4b 1e 53 09 00 0a 20 20 20 20 20 20 00 6e

00 ff ff ff ff ff ff 00 10 ac 4c a0 4d 33 37 33
11 14 01 04 a5 29 17 78 e6 ee 95 a3 54 4c 99 26
0f 50 54 a5 4a 00 01 01 01 01 01 01 01 01 01 01
01 01 01 01 01 01 66 21 56 aa 51 00 1e 30 46 8f
33 00 9a e6 10 00 00 1e 00 00 00 ff 00 47 35 31
30 4e 30 34 49 33 37 33 4d 0a 00 00 00 fc 00 44
45 4c 4c 20 49 4e 31 39 31 30 4e 0a 00 00 00 fd
00 38 4b 1e 53 09 00 0a 20 20 20 20 20 20 00 6e

----------------

Block 0, Base EDID:
  EDID Structure Version & Revision: 1.4
  Vendor & Product Identification:
    Manufacturer: DEL
    Model: 41036
    Serial Number: ...
    Made in: week 17 of 2010
  Basic Display Parameters & Features:
    Digital display
    Bits per primary color channel: 8
    DisplayPort interface
    Maximum image size: 41 cm x 23 cm
    Gamma: 2.20
    DPMS levels: Standby Suspend Off
    Supported color formats: RGB 4:4:4
    Default (sRGB) color space is primary color space
    First detailed timing includes the native pixel format and preferred refresh rate
  Color Characteristics:
    Red  : 0.6396, 0.3300
    Green: 0.2998, 0.5996
    Blue : 0.1503, 0.0595
    White: 0.3134, 0.3291
  Established Timings I & II:
    IBM     :   720x400    70.081663 Hz   9:5     31.467 kHz     28.320000 MHz
    DMT 0x04:   640x480    59.940476 Hz   4:3     31.469 kHz     25.175000 MHz
    DMT 0x06:   640x480    75.000000 Hz   4:3     37.500 kHz     31.500000 MHz
    DMT 0x09:   800x600    60.316541 Hz   4:3     37.879 kHz     40.000000 MHz
    DMT 0x0b:   800x600    75.000000 Hz   4:3     46.875 kHz     49.500000 MHz
    DMT 0x10:  1024x768    60.003840 Hz   4:3     48.363 kHz     65.000000 MHz
    DMT 0x12:  1024x768    75.028582 Hz   4:3     60.023 kHz     78.750000 MHz
  Standard Timings: none
  Detailed Timing Descriptors:
    DTD 1:  1366x768    59.789541 Hz 683:384   47.712 kHz     85.500000 MHz (410 mm x 230 mm)
                 Hfront   70 Hsync 143 Hback  213 Hpol P
                 Vfront    3 Vsync   3 Vback   24 Vpol P
    Display Product Serial Number: ...
    Display Product Name: 'DELL IN1910N'
    Display Range Limits:
      Monitor ranges (GTF): 56-75 Hz V, 30-83 kHz H, max dotclock 90 MHz
Checksum: 0x6e

----------------

Block 1, Unknown EDID Extension Block 0x00:
  00 ff ff ff ff ff ff 00 10 ac 4c a0 4d 33 37 33 '..........L.M373'
  11 14 01 04 a5 29 17 78 e6 ee 95 a3 54 4c 99 26 '.....).x....TL.&'
  0f 50 54 a5 4a 00 01 01 01 01 01 01 01 01 01 01 '.PT.J...........'
  01 01 01 01 01 01 66 21 56 aa 51 00 1e 30 46 8f '......f!V.Q..0F.'
  33 00 9a e6 10 00 00 1e 00 00 00 ff 00 47 35 31 '3............G51'
  30 4e 30 34 49 33 37 33 4d 0a 00 00 00 fc 00 44 '0N04I373M......D'
  45 4c 4c 20 49 4e 31 39 31 30 4e 0a 00 00 00 fd 'ELL IN1910N.....'
  00 38 4b 1e 53 09 00 0a 20 20 20 20 20 20 00 6e '.8K.S...      .n'
Checksum: 0x6e

----------------

Warnings:

Block 0, Base EDID:
  Display Range Limits: GTF support is deprecated in EDID 1.4.

Failures:

Block 0, Base EDID:
  Basic Display Parameters & Features: sRGB is signaled, but the chromaticities do not match.
  Display Range Limits: GTF can't be combined with non-continuous frequencies.
Block 1, Base EDID:
  Unknown Extension Block.
EDID:
  Base EDID: EDID specified 0 extension block(s), but found 1 extension block(s).

EDID conformity: FAIL
