
EDID (hex):
00ffffffffffff000e98192000000000
000f010318221b782ac0f5a3574a9c23
114f54adcf00714f8180010101010101
010101010101bc34009851002a401090
1300510e1100001e000000fc00435458
205337363041000a2020000000fd003b
4b1e500e000a202020202020000000fe
00200a2020202020202020202020000d

Extracted contents:
header:          00 ff ff ff ff ff ff 00
serial number:   0e 98 19 20 00 00 00 00 00 0f
version:         01 03
basic params:    18 22 1b 78 2a
chroma info:     c0 f5 a3 57 4a 9c 23 11 4f 54
established:     ad cf 00
standard:        71 4f 81 80 01 01 01 01 01 01 01 01 01 01 01 01
descriptor 1:    bc 34 00 98 51 00 2a 40 10 90 13 00 51 0e 11 00 00 1e
descriptor 2:    00 00 00 fc 00 43 54 58 20 53 37 36 30 41 00 0a 20 20
descriptor 3:    00 00 00 fd 00 3b 4b 1e 50 0e 00 0a 20 20 20 20 20 20
descriptor 4:    00 00 00 fe 00 20 0a 20 20 20 20 20 20 20 20 20 20 20
extensions:      00
checksum:        0d

EDID version: 1.3
Manufacturer: CTX Model 2019 Serial Number --
Analog display, Input voltage level: 0.7/0.3 V
Configurable signal levels
Sync: Separate 
Maximum image size: 34 cm x 27 cm
Gamma: 2.20
DPMS levels: Off
RGB color display
First detailed timing is preferred timing
Display x,y Chromaticity:
  Red:   0.6396, 0.3398
  Green: 0.2890, 0.6093
  Blue:  0.1396, 0.0693
  White: 0.3095, 0.3291
Established timings supported:
  720x400@70Hz 9:5 HorFreq: 31469 Hz Clock: 28.320 MHz
  640x480@60Hz 4:3 HorFreq: 31469 Hz Clock: 25.175 MHz
  640x480@72Hz 4:3 HorFreq: 37900 Hz Clock: 31.500 MHz
  640x480@75Hz 4:3 HorFreq: 37500 Hz Clock: 31.500 MHz
  800x600@60Hz 4:3 HorFreq: 37900 Hz Clock: 40.000 MHz
  800x600@72Hz 4:3 HorFreq: 48100 Hz Clock: 50.000 MHz
  800x600@75Hz 4:3 HorFreq: 46900 Hz Clock: 49.500 MHz
  1024x768@60Hz 4:3 HorFreq: 48400 Hz Clock: 65.000 MHz
  1024x768@70Hz 4:3 HorFreq: 56500 Hz Clock: 75.000 MHz
  1024x768@75Hz 4:3 HorFreq: 60000 Hz Clock: 78.750 MHz
  1280x1024@75Hz 5:4 HorFreq: 80000 Hz Clock: 135.000 MHz
Standard timings supported:
  1152x864@75Hz 4:3 HorFreq: 67500 Hz Clock: 108.000 MHz
  1280x1024@60Hz 5:4 HorFreq: 64000 Hz Clock: 108.000 MHz
Detailed mode: Clock 135.000 MHz, 337 mm x 270 mm
               1280 1296 1440 1688 hborder 0
               1024 1025 1028 1066 vborder 0
               +hsync +vsync 
               VertFreq: 75 Hz, HorFreq: 79976 Hz
Monitor ranges (GTF): 59-75Hz V, 30-80kHz H, max dotclock 140MHz
ASCII string:  
Checksum: 0xd (valid)
EDID block does NOT conform to EDID 1.3!
	Name descriptor not terminated with a newline
EDID block does not conform at all!
	Bad year of manufacture
