edid-decode (hex):

00 ff ff ff ff ff ff 00 30 e4 00 e4 00 00 00 00
00 11 01 03 80 25 17 78 0a 56 35 9d 5a 52 8f 27
1f 50 54 00 00 00 01 01 01 01 01 01 01 01 01 01
01 01 01 01 01 01 60 3b 80 a0 70 b0 23 40 30 20
36 00 6f e6 10 00 00 19 60 3b 80 a0 70 b0 23 40
30 20 36 00 6f e6 10 00 00 19 00 00 00 fe 00 57
36 36 30 47 80 31 37 31 57 55 31 0a 00 00 00 fe
00 1e 2d 37 3e 5a 77 a3 ff 02 01 0a 20 20 00 24

----------------

Block 0, Base EDID:
  EDID Structure Version & Revision: 1.3
  Vendor & Product Identification:
    Manufacturer: LGD
    Model: 58368
    Made in: 2007
  Basic Display Parameters & Features:
    Digital display
    Maximum image size: 37 cm x 23 cm
    Gamma: 2.20
    RGB color display
    First detailed timing is the preferred timing
  Color Characteristics:
    Red  : 0.6142, 0.3525
    Green: 0.3212, 0.5605
    Blue : 0.1523, 0.1240
    White: 0.3134, 0.3291
  Established Timings I & II: none
  Standard Timings: none
  Detailed Timing Descriptors:
    DTD 1:  1920x1200   59.171598 Hz   8:5     73.077 kHz    152.000000 MHz (DE timing only, 367 mm x 230 mm)
                 Hfront   48 Hsync  32 Hback   80 Hpol N
                 Vfront    3 Vsync   6 Vback   26 Vpol N
    DTD 2:  1920x1200   59.171598 Hz   8:5     73.077 kHz    152.000000 MHz (DE timing only, 367 mm x 230 mm)
                 Hfront   48 Hsync  32 Hback   80 Hpol N
                 Vfront    3 Vsync   6 Vback   26 Vpol N
    SPWG Module Revision: 25
    SPWG Descriptor #3:
      SPWG PC Maker P/N: 'W660G'
      SPWG LCD Supplier EEDID Revision: 128
      SPWG Manufacturer P/N: '171WU1'
    SPWG Descriptor #4:
      SMBUS Values: 0x1e 0x2d 0x37 0x3e 0x5a 0x77 0xa3 0xff
      LVDS Channels: 2
      Panel Self Test Present
Checksum: 0x24

----------------

Failures:

Block 0, Base EDID:
  Missing Display Product Name.
  Missing Display Range Limits Descriptor.

EDID conformity: FAIL
