
EDID (hex):
00ffffffffffff0006af2b2500000000
001c0104a51d117802ee95a3544c9926
0f505400000001010101010101010101
01010101010152d000a0f0703e803020
350025a51000001a52d000a0f0706882
3020350025a51000001a000000fe0036
5652355680423133335a414e00000000
0002410325011000000b010a202000f2

Extracted contents:
header:          00 ff ff ff ff ff ff 00
serial number:   06 af 2b 25 00 00 00 00 00 1c
version:         01 04
basic params:    a5 1d 11 78 02
chroma info:     ee 95 a3 54 4c 99 26 0f 50 54
established:     00 00 00
standard:        01 01 01 01 01 01 01 01 01 01 01 01 01 01 01 01
descriptor 1:    52 d0 00 a0 f0 70 3e 80 30 20 35 00 25 a5 10 00 00 1a
descriptor 2:    52 d0 00 a0 f0 70 68 82 30 20 35 00 25 a5 10 00 00 1a
descriptor 3:    00 00 00 fe 00 36 56 52 35 56 80 42 31 33 33 5a 41 4e
descriptor 4:    00 00 00 00 00 02 41 03 25 01 10 00 00 0b 01 0a 20 20
extensions:      00
checksum:        f2

EDID version: 1.4
Manufacturer: AUO Model 252b Serial Number --
Made in year 2018
Digital display
8 bits per primary color channel
DisplayPort interface
Maximum image size: 29 cm x 17 cm
Gamma: 2.20
Supported color formats: RGB 4:4:4
First detailed timing includes the native pixel format and preferred refresh rate
Display x,y Chromaticity:
  Red:   0.6396, 0.3300
  Green: 0.2998, 0.5996
  Blue:  0.1503, 0.0595
  White: 0.3134, 0.3291
Established timings supported:
Standard timings supported:
Detailed mode: Clock 533.300 MHz, 293 mm x 165 mm
               3840 3888 3920 4000 hborder 0
               2160 2163 2168 2222 vborder 0
               +hsync -vsync 
               VertFreq: 60 Hz, HorFreq: 133325 Hz
Detailed mode: Clock 533.300 MHz, 293 mm x 165 mm
               3840 3888 3920 4000 hborder 0
               2160 2163 2168 2776 vborder 0
               +hsync -vsync 
               VertFreq: 48 Hz, HorFreq: 133325 Hz
ASCII string: 6VR5V
Manufacturer-specified data, tag 0
Checksum: 0xf2 (valid)
EDID block does NOT conform to EDID 1.4!
	Missing name descriptor
	Missing monitor ranges
	Detailed block string not properly terminated
