
EDID (hex):
00ffffffffffff0030e4e20600000000
001f0104a522137807a895a6544b9b26
0f505400000001010101010101010101
010101010101003980a0703859403020
350058c21000001a000000fd003ca5c1
c129010a202020202020000000fe004d
34483356803135365746470a00000000
0002411f9e000100000f410a202001da
7013790000030114b89c00847f079f00
2f801f00370458000200040000000000
00000000000000000000000000000000
00000000000000000000000000000000
00000000000000000000000000000000
00000000000000000000000000000000
00000000000000000000000000000000
0000000000000000000000000000f890

Extracted contents:
header:          00 ff ff ff ff ff ff 00
serial number:   30 e4 e2 06 00 00 00 00 00 1f
version:         01 04
basic params:    a5 22 13 78 07
chroma info:     a8 95 a6 54 4b 9b 26 0f 50 54
established:     00 00 00
standard:        01 01 01 01 01 01 01 01 01 01 01 01 01 01 01 01
descriptor 1:    00 39 80 a0 70 38 59 40 30 20 35 00 58 c2 10 00 00 1a
descriptor 2:    00 00 00 fd 00 3c a5 c1 c1 29 01 0a 20 20 20 20 20 20
descriptor 3:    00 00 00 fe 00 4d 34 48 33 56 80 31 35 36 57 46 47 0a
descriptor 4:    00 00 00 00 00 02 41 1f 9e 00 01 00 00 0f 41 0a 20 20
extensions:      01
checksum:        da

EDID version: 1.4
Manufacturer: LGD Model 6e2 Serial Number --
Made in year 2021
Digital display
8 bits per primary color channel
DisplayPort interface
Maximum image size: 34 cm x 19 cm
Gamma: 2.20
Supported color formats: RGB 4:4:4
Default (sRGB) color space is primary color space
First detailed timing includes the native pixel format and preferred refresh rate
Display is continuous frequency
Display x,y Chromaticity:
  Red:   0.6503, 0.3300
  Green: 0.2949, 0.6054
  Blue:  0.1503, 0.0595
  White: 0.3134, 0.3291
Established timings supported:
Standard timings supported:
Detailed mode: Clock 145.920 MHz, 344 mm x 194 mm
               1920 1968 2000 2080 hborder 0
               1080 1083 1088 1169 vborder 0
               +hsync -vsync 
               VertFreq: 60 Hz, HorFreq: 70153 Hz
Monitor ranges (bare limits): 60-165Hz V, 193-193kHz H, max dotclock 410MHz
ASCII string: M4H3V
Manufacturer-specified data, tag 0
Has 1 extension blocks
Checksum: 0xda (valid)

DisplayID extension block
Extension version: 19
Length 121, version 19, extension count 0
Checksum: 0xf8 (valid)
Type 1 detailed timing: aspect: 16:9, Preferred  
Detailed mode: Clock 401.200 MHz, 0 mm x 0 mm
               1919 1966 1997 2078
               1079 1081 1085 1167
               +hsync -vsync

EDID block does NOT conform to EDID 1.4!
	sRGB is signaled, but the chromaticities do not match
	Missing name descriptor
	Detailed block string not properly terminated
Warning: One or more of the timings is out of range of the Monitor Ranges:
  Vertical Freq: 60 - 60 Hz
  Horizontal Freq: 70153 - 70153 Hz
  Maximum Clock: 145.920 MHz
EDID block does not conform at all!
	Has 637534208 nonconformant extension block(s)
