edid-decode (hex):

00 ff ff ff ff ff ff 00 2c 83 01 00 01 00 00 00
0d 1c 01 04 a5 1a 10 78 0a 1f b5 a0 5d 50 9d 25
0f 50 54 00 00 00 01 01 01 01 01 01 01 01 01 01
01 01 01 01 01 01 b4 3b 80 a7 70 b0 15 40 10 10
f2 00 07 a4 10 00 00 1a 00 00 00 10 00 00 00 00
00 00 00 00 00 00 00 00 00 00 00 00 00 10 00 00
00 00 00 00 00 00 00 00 00 00 00 00 00 00 00 fe
00 4b 44 31 32 32 4e 30 34 33 30 41 31 30 00 c5

----------------

Block 0, Base EDID:
  EDID Structure Version & Revision: 1.4
  Vendor & Product Identification:
    Manufacturer: KDC
    Model: 1
    Serial Number: ...
    Made in: week 13 of 2018
  Basic Display Parameters & Features:
    Digital display
    Bits per primary color channel: 8
    DisplayPort interface
    Maximum image size: 26 cm x 16 cm
    Gamma: 2.20
    Supported color formats: RGB 4:4:4, YCrCb 4:4:4
    First detailed timing includes the native pixel format and preferred refresh rate
  Color Characteristics:
    Red  : 0.6250, 0.3642
    Green: 0.3154, 0.6162
    Blue : 0.1464, 0.0615
    White: 0.3134, 0.3291
  Established Timings I & II: none
  Standard Timings: none
  Detailed Timing Descriptors:
    DTD 1:  1920x1200   59.978958 Hz   8:5     73.234 kHz    152.840000 MHz (263 mm x 164 mm)
                 Hfront   16 Hsync  16 Hback  135 Hpol P
                 Vfront   15 Vsync   2 Vback    4 Vpol N
    Dummy Descriptor:
    Dummy Descriptor:
    Alphanumeric Data String: 'KD122N0430A10'
Checksum: 0xc5

----------------

Failures:

Block 0, Base EDID:
  Missing Display Product Name.

EDID conformity: FAIL
