
EDID (hex):
00ffffffffffff0022f0134201000000
0d15010380331d78ee2884a45650a128
0f505400000001010101010101010101
0101010101011838800071381440582c
4500fe1e1100001e000000fd00324b40
5312000a202020202020000000fc0048
5020416c6c2d696e2d4f6e65000000ff
000a202020202020202020202020004d

edid-decode (hex):

00 ff ff ff ff ff ff 00 22 f0 13 42 01 00 00 00
0d 15 01 03 80 33 1d 78 ee 28 84 a4 56 50 a1 28
0f 50 54 00 00 00 01 01 01 01 01 01 01 01 01 01
01 01 01 01 01 01 18 38 80 00 71 38 14 40 58 2c
45 00 fe 1e 11 00 00 1e 00 00 00 fd 00 32 4b 40
53 12 00 0a 20 20 20 20 20 20 00 00 00 fc 00 48
50 20 41 6c 6c 2d 69 6e 2d 4f 6e 65 00 00 00 ff
00 0a 20 20 20 20 20 20 20 20 20 20 20 20 00 4d

----------------

Block 0, Base EDID:
  EDID Structure Version & Revision: 1.3
  Vendor & Product Identification:
    Manufacturer: HWP
    Model: 16915
    Serial Number: 1
    Made in: week 13 of 2011
  Basic Display Parameters & Features:
    Digital display
    Maximum image size: 51 cm x 29 cm
    Gamma: 2.20
    DPMS levels: Standby Suspend Off
    RGB color display
    Default (sRGB) color space is primary color space
    First detailed timing is the preferred timing
  Color Characteristics:
    Red  : 0.6406, 0.3378
    Green: 0.3144, 0.6289
    Blue : 0.1582, 0.0585
    White: 0.3134, 0.3281
  Established Timings I & II: none
  Standard Timings: none
  Detailed Timing Descriptors:
    DTD 1:  1920x1080   59.993316 Hz  16:9     65.993 kHz    143.600000 MHz (510 mm x 286 mm)
                 Hfront   88 Hsync  44 Hback  124 Hpol P
                 Vfront    4 Vsync   5 Vback   11 Vpol P
    Display Range Limits:
      Monitor ranges (GTF): 50-75 Hz V, 64-83 kHz H, max dotclock 180 MHz
    Display Product Name: 'HP All-in-One'
    Display Product Serial Number: ''
Checksum: 0x4d
