
EDID (hex):
00ffffffffffff0005f0f20c00000000
19220103801d1b782aef65a656529d28
0b5054210800010181c081809500a9c0
b300d1c00101023a801871382d40582c
250059c31000001e000000fc00313650
4d3151420a2020202020000000ff0031
343235303034373733583030000000fd
00303f1e5414000a20202020202001f3
020332f246900102030413e200d5e305
c00023097f078301000067030c001000
1848e6060501626200681a0000010130
3ce6023a801871382d40582c450059c3
1000001e000000000000000000000000
00000000000000000000000000000000
00000000000000000000000000000000
000000000000000000000000000000e0

edid-decode (hex):

00 ff ff ff ff ff ff 00 05 f0 f2 0c 00 00 00 00
19 22 01 03 80 1d 1b 78 2a ef 65 a6 56 52 9d 28
0b 50 54 21 08 00 01 01 81 c0 81 80 95 00 a9 c0
b3 00 d1 c0 01 01 02 3a 80 18 71 38 2d 40 58 2c
25 00 59 c3 10 00 00 1e 00 00 00 fc 00 31 36 50
4d 31 51 42 0a 20 20 20 20 20 00 00 00 ff 00 31
34 32 35 30 30 34 37 37 33 58 30 30 00 00 00 fd
00 30 3f 1e 54 14 00 0a 20 20 20 20 20 20 01 f3

02 03 32 f2 46 90 01 02 03 04 13 e2 00 d5 e3 05
c0 00 23 09 7f 07 83 01 00 00 67 03 0c 00 10 00
18 48 e6 06 05 01 62 62 00 68 1a 00 00 01 01 30
3c e6 02 3a 80 18 71 38 2d 40 58 2c 45 00 59 c3
10 00 00 1e 00 00 00 00 00 00 00 00 00 00 00 00
00 00 00 00 00 00 00 00 00 00 00 00 00 00 00 00
00 00 00 00 00 00 00 00 00 00 00 00 00 00 00 00
00 00 00 00 00 00 00 00 00 00 00 00 00 00 00 e0

----------------

Block 0, Base EDID:
  EDID Structure Version & Revision: 1.3
  Vendor & Product Identification:
    Manufacturer: AOP
    Model: 3314
    Made in: week 25 of 2024
  Basic Display Parameters & Features:
    Digital display
    Maximum image size: 29 cm x 27 cm
    Gamma: 2.20
    DPMS levels: Off
    RGB color display
    First detailed timing is the preferred timing
  Color Characteristics:
    Red  : 0.6513, 0.3378
    Green: 0.3232, 0.6162
    Blue : 0.1572, 0.0449
    White: 0.3134, 0.3291
  Established Timings I & II:
    DMT 0x04:   640x480    59.940476 Hz   4:3     31.469 kHz     25.175000 MHz
    DMT 0x09:   800x600    60.316541 Hz   4:3     37.879 kHz     40.000000 MHz
    DMT 0x10:  1024x768    60.003840 Hz   4:3     48.363 kHz     65.000000 MHz
  Standard Timings:
    DMT 0x55:  1280x720    60.000000 Hz  16:9     45.000 kHz     74.250000 MHz
    DMT 0x23:  1280x1024   60.019740 Hz   5:4     63.981 kHz    108.000000 MHz
    DMT 0x2f:  1440x900    59.887445 Hz  16:10    55.935 kHz    106.500000 MHz
    DMT 0x53:  1600x900    60.000000 Hz  16:9     60.000 kHz    108.000000 MHz (RB)
    DMT 0x3a:  1680x1050   59.954250 Hz  16:10    65.290 kHz    146.250000 MHz
    DMT 0x52:  1920x1080   60.000000 Hz  16:9     67.500 kHz    148.500000 MHz
  Detailed Timing Descriptors:
    DTD 1:  1920x1080   60.000000 Hz  16:9     67.500 kHz    148.500000 MHz (345 mm x 195 mm)
                 Hfront   88 Hsync  44 Hback  148 Hpol P
                 Vfront    2 Vsync   5 Vback   38 Vpol P
    Display Product Name: '16PM1QB'
    Display Product Serial Number: '1425004773X00'
    Display Range Limits:
      Monitor ranges (GTF): 48-63 Hz V, 30-84 kHz H, max dotclock 200 MHz
  Extension blocks: 1
Checksum: 0xf3

----------------

Block 1, CTA-861 Extension Block:
  Revision: 3
  Underscans IT Video Formats by default
  Basic audio support
  Supports YCbCr 4:4:4
  Supports YCbCr 4:2:2
  Native detailed modes: 2
  Video Data Block:
    VIC  16:  1920x1080   60.000000 Hz  16:9     67.500 kHz    148.500000 MHz (native)
    VIC   1:   640x480    59.940476 Hz   4:3     31.469 kHz     25.175000 MHz
    VIC   2:   720x480    59.940060 Hz   4:3     31.469 kHz     27.000000 MHz
    VIC   3:   720x480    59.940060 Hz  16:9     31.469 kHz     27.000000 MHz
    VIC   4:  1280x720    60.000000 Hz  16:9     45.000 kHz     74.250000 MHz
    VIC  19:  1280x720    50.000000 Hz  16:9     37.500 kHz     74.250000 MHz
  Video Capability Data Block:
    YCbCr quantization: Selectable (via AVI YQ)
    RGB quantization: Selectable (via AVI Q)
    PT scan behavior: Always Overscanned
    IT scan behavior: Always Overscanned
    CE scan behavior: Always Overscanned
  Colorimetry Data Block:
    BT2020YCC
    BT2020RGB
  Audio Data Block:
    Linear PCM:
      Max channels: 2
      Supported sample rates (kHz): 192 176.4 96 88.2 48 44.1 32
      Supported sample sizes (bits): 24 20 16
  Speaker Allocation Data Block:
    FL/FR - Front Left/Right
  Vendor-Specific Data Block (HDMI), OUI 00-0C-03:
    Source physical address: 1.0.0.0
    DC_30bit
    DC_Y444
    Maximum TMDS clock: 360 MHz
  HDR Static Metadata Data Block:
    Electro optical transfer functions:
      Traditional gamma - SDR luminance range
      SMPTE ST2084
    Supported static metadata descriptors:
      Static metadata type 1
    Desired content max luminance: 98 (417.710 cd/m^2)
    Desired content max frame-average luminance: 98 (417.710 cd/m^2)
    Desired content min luminance: 0 (0.000 cd/m^2)
  Vendor-Specific Data Block (AMD), OUI 00-00-1A:
    Version: 1.1
    Minimum Refresh Rate: 48 Hz
    Maximum Refresh Rate: 60 Hz
    Flags 1.x: 0xe6 (MCCS)
  Detailed Timing Descriptors:
    DTD 2:  1920x1080   60.000000 Hz  16:9     67.500 kHz    148.500000 MHz (345 mm x 195 mm)
                 Hfront   88 Hsync  44 Hback  148 Hpol P
                 Vfront    4 Vsync   5 Vback   36 Vpol P
Checksum: 0xe0  Unused space in Extension Block: 59 bytes
