
EDID (hex):
00ffffffffffff000e1135145990fb08
100c01036b211b83eac1179f5b499024
194c52adef8081800101010101010101
010101010101302a009851002a403070
1300510e1100001e000000fd00384b1e
500e000a202020202020000000fc0043
4f4d50415120373032300a200000000d
000208c102ae13ca0a4c04a201910056

Extracted contents:
header:          00 ff ff ff ff ff ff 00
serial number:   0e 11 35 14 59 90 fb 08 10 0c
version:         01 03
basic params:    6b 21 1b 83 ea
chroma info:     c1 17 9f 5b 49 90 24 19 4c 52
established:     ad ef 80
standard:        81 80 01 01 01 01 01 01 01 01 01 01 01 01 01 01
descriptor 1:    30 2a 00 98 51 00 2a 40 30 70 13 00 51 0e 11 00 00 1e
descriptor 2:    00 00 00 fd 00 38 4b 1e 50 0e 00 0a 20 20 20 20 20 20
descriptor 3:    00 00 00 fc 00 43 4f 4d 50 41 51 20 37 30 32 30 0a 20
descriptor 4:    00 00 00 0d 00 02 08 c1 02 ae 13 ca 0a 4c 04 a2 01 91
extensions:      00
checksum:        56

EDID version: 1.3
Manufacturer: CPQ Model 1435 Serial Number --
Analog display, Input voltage level: 0.7/0.7 V
Sync: Separate SyncOnGreen Serration 
Maximum image size: 33 cm x 27 cm
Gamma: 2.31
DPMS levels: Standby Suspend Off
RGB color display
First detailed timing is preferred timing
Display x,y Chromaticity:
  Red:   0.6240, 0.3554
  Green: 0.2851, 0.5634
  Blue:  0.1406, 0.0986
  White: 0.2978, 0.3232
Established timings supported:
  720x400@70Hz 9:5 HorFreq: 31469 Hz Clock: 28.320 MHz
  640x480@60Hz 4:3 HorFreq: 31469 Hz Clock: 25.175 MHz
  640x480@72Hz 4:3 HorFreq: 37900 Hz Clock: 31.500 MHz
  640x480@75Hz 4:3 HorFreq: 37500 Hz Clock: 31.500 MHz
  800x600@60Hz 4:3 HorFreq: 37900 Hz Clock: 40.000 MHz
  800x600@72Hz 4:3 HorFreq: 48100 Hz Clock: 50.000 MHz
  800x600@75Hz 4:3 HorFreq: 46900 Hz Clock: 49.500 MHz
  832x624@75Hz 4:3 HorFreq: 49726 Hz Clock: 57.284 MHz
  1024x768@60Hz 4:3 HorFreq: 48400 Hz Clock: 65.000 MHz
  1024x768@70Hz 4:3 HorFreq: 56500 Hz Clock: 75.000 MHz
  1024x768@75Hz 4:3 HorFreq: 60000 Hz Clock: 78.750 MHz
  1280x1024@75Hz 5:4 HorFreq: 80000 Hz Clock: 135.000 MHz
  1152x870@75Hz 192:145 HorFreq: 67500 Hz Clock: 108.000 MHz
Standard timings supported:
  1280x1024@60Hz 5:4 HorFreq: 64000 Hz Clock: 108.000 MHz
Detailed mode: Clock 108.000 MHz, 337 mm x 270 mm
               1280 1328 1440 1688 hborder 0
               1024 1025 1028 1066 vborder 0
               +hsync +vsync 
               VertFreq: 60 Hz, HorFreq: 63981 Hz
Monitor ranges (GTF): 56-75Hz V, 30-80kHz H, max dotclock 140MHz
Monitor name: COMPAQ 7020
Manufacturer-specified data, tag 13
Checksum: 0x56 (valid)
EDID block does not conform at all!
	Bad year of manufacture
