
EDID (hex):
00ffffffffffff0038a3d56101010101
2c0d01030c211878ea68e8a452479a24
0f484cfffe00315945596159714f8140
818001010101ea240060410028303060
13003bec1000001e000000fd0032781e
460c000a202020202020000000fc004e
45432046453737300a202020000000ff
003359373432383159420a20202000bf

Extracted contents:
header:          00 ff ff ff ff ff ff 00
serial number:   38 a3 d5 61 01 01 01 01 2c 0d
version:         01 03
basic params:    0c 21 18 78 ea
chroma info:     68 e8 a4 52 47 9a 24 0f 48 4c
established:     ff fe 00
standard:        31 59 45 59 61 59 71 4f 81 40 81 80 01 01 01 01
descriptor 1:    ea 24 00 60 41 00 28 30 30 60 13 00 3b ec 10 00 00 1e
descriptor 2:    00 00 00 fd 00 32 78 1e 46 0c 00 0a 20 20 20 20 20 20
descriptor 3:    00 00 00 fc 00 4e 45 43 20 46 45 37 37 30 0a 20 20 20
descriptor 4:    00 00 00 ff 00 33 59 37 34 32 38 31 59 42 0a 20 20 20
extensions:      00
checksum:        bf

EDID version: 1.3
Manufacturer: NEC Model 61d5 Serial Number --
Analog display, Input voltage level: 0.7/0.3 V
Sync: Separate Composite 
Maximum image size: 33 cm x 24 cm
Gamma: 2.20
DPMS levels: Standby Suspend Off
RGB color display
First detailed timing is preferred timing
Display x,y Chromaticity:
  Red:   0.6416, 0.3222
  Green: 0.2792, 0.6015
  Blue:  0.1435, 0.0605
  White: 0.2832, 0.2968
Established timings supported:
  720x400@70Hz 9:5 HorFreq: 31469 Hz Clock: 28.320 MHz
  720x400@88Hz 9:5 HorFreq: 39500 Hz Clock: 35.500 MHz
  640x480@60Hz 4:3 HorFreq: 31469 Hz Clock: 25.175 MHz
  640x480@67Hz 4:3 HorFreq: 35000 Hz Clock: 30.240 MHz
  640x480@72Hz 4:3 HorFreq: 37900 Hz Clock: 31.500 MHz
  640x480@75Hz 4:3 HorFreq: 37500 Hz Clock: 31.500 MHz
  800x600@56Hz 4:3 HorFreq: 35200 Hz Clock: 36.000 MHz
  800x600@60Hz 4:3 HorFreq: 37900 Hz Clock: 40.000 MHz
  800x600@72Hz 4:3 HorFreq: 48100 Hz Clock: 50.000 MHz
  800x600@75Hz 4:3 HorFreq: 46900 Hz Clock: 49.500 MHz
  832x624@75Hz 4:3 HorFreq: 49726 Hz Clock: 57.284 MHz
  1280x768i@87Hz 5:3 HorFreq: 35522 Hz Clock: 44.900 MHz
  1024x768@60Hz 4:3 HorFreq: 48400 Hz Clock: 65.000 MHz
  1024x768@70Hz 4:3 HorFreq: 56500 Hz Clock: 75.000 MHz
  1024x768@75Hz 4:3 HorFreq: 60000 Hz Clock: 78.750 MHz
Standard timings supported:
  640x480@85Hz 4:3 HorFreq: 43300 Hz Clock: 36.000 MHz
  800x600@85Hz 4:3 HorFreq: 53700 Hz Clock: 56.250 MHz
  1024x768@85Hz 4:3 HorFreq: 68700 Hz Clock: 94.500 MHz
  1152x864@75Hz 4:3 HorFreq: 67500 Hz Clock: 108.000 MHz
  1280x960@60Hz 4:3 HorFreq: 60000 Hz Clock: 108.000 MHz
  1280x1024@60Hz 5:4 HorFreq: 64000 Hz Clock: 108.000 MHz
Detailed mode: Clock 94.500 MHz, 315 mm x 236 mm
               1024 1072 1168 1376 hborder 0
                768  769  772  808 vborder 0
               +hsync +vsync 
               VertFreq: 84 Hz, HorFreq: 68677 Hz
Monitor ranges (GTF): 50-120Hz V, 30-70kHz H, max dotclock 120MHz
Monitor name: NEC FE770
Serial number: --
Checksum: 0xbf (valid)
EDID block does not conform at all!
	Bad year of manufacture
