
EDID (hex):
00ffffffffffff001e6d4f778c060500
071f010380462878ea7ba1ae4f44a926
0c5054210800d1c00101010101010101
01010101010104740030f2705a80b058
8a00b9882100001e000000fd00283c1e
461e000a202020202020000000fc004c
472048445220344b0a202020000000ff
003130374e54455039503335360a01c7
02031e7123090707830100004b010304
10121f20225f5e5d65030c002000565e
00a0a0a0295030203500b9882100001a
1a3680a070381f402a263500b9882100
001a0000000000000000000000000000
00000000000000000000000000000000
00000000000000000000000000000000
000000000000000000000000000000a4

Extracted contents:
header:          00 ff ff ff ff ff ff 00
serial number:   1e 6d 4f 77 8c 06 05 00 07 1f
version:         01 03
basic params:    80 46 28 78 ea
chroma info:     7b a1 ae 4f 44 a9 26 0c 50 54
established:     21 08 00
standard:        d1 c0 01 01 01 01 01 01 01 01 01 01 01 01 01 01
descriptor 1:    04 74 00 30 f2 70 5a 80 b0 58 8a 00 b9 88 21 00 00 1e
descriptor 2:    00 00 00 fd 00 28 3c 1e 46 1e 00 0a 20 20 20 20 20 20
descriptor 3:    00 00 00 fc 00 4c 47 20 48 44 52 20 34 4b 0a 20 20 20
descriptor 4:    00 00 00 ff 00 31 30 37 4e 54 45 50 39 50 33 35 36 0a
extensions:      01
checksum:        c7

EDID version: 1.3
Manufacturer: GSM Model 774f Serial Number --
Made in week 7 of 2021
Digital display
Maximum image size: 70 cm x 40 cm
Gamma: 2.20
DPMS levels: Standby Suspend Off
RGB color display
First detailed timing is preferred timing
Display x,y Chromaticity:
  Red:   0.6806, 0.3115
  Green: 0.2675, 0.6630
  Blue:  0.1503, 0.0488
  White: 0.3125, 0.3291
Established timings supported:
  640x480@60Hz 4:3 HorFreq: 31469 Hz Clock: 25.175 MHz
  800x600@60Hz 4:3 HorFreq: 37900 Hz Clock: 40.000 MHz
  1024x768@60Hz 4:3 HorFreq: 48400 Hz Clock: 65.000 MHz
Standard timings supported:
  1920x1080@60Hz 16:9
Detailed mode: Clock 297.000 MHz, 697 mm x 392 mm
               3840 4016 4104 4400 hborder 0
               2160 2168 2178 2250 vborder 0
               +hsync +vsync 
               VertFreq: 30 Hz, HorFreq: 67500 Hz
Monitor ranges (GTF): 40-60Hz V, 30-70kHz H, max dotclock 300MHz
Monitor name: LG HDR 4K
Serial number: --
Has 1 extension blocks
Checksum: 0xc7 (valid)

CTA extension block
Extension version: 3
26 bytes of CTA data
  Audio data block
    Linear PCM, max channels 2
      Supported sample rates (kHz): 48 44.1 32
      Supported sample sizes (bits): 24 20 16
  Speaker allocation data block
    Speaker map:
      FL/FR - Front Left/Right
  Video data block
    VIC   1 640x480@60Hz 4:3  HorFreq: 31469 Hz Clock: 25.175 MHz
    VIC   3 720x480@60Hz 16:9  HorFreq: 31469 Hz Clock: 27.000 MHz
    VIC   4 1280x720@60Hz 16:9  HorFreq: 45000 Hz Clock: 74.250 MHz
    VIC  16 1920x1080@60Hz 16:9  HorFreq: 67500 Hz Clock: 148.500 MHz
    VIC  18 720x576@50Hz 16:9  HorFreq: 31250 Hz Clock: 27.000 MHz
    VIC  31 1920x1080@50Hz 16:9  HorFreq: 56250 Hz Clock: 148.500 MHz
    VIC  32 1920x1080@24Hz 16:9  HorFreq: 27000 Hz Clock: 74.250 MHz
    VIC  34 1920x1080@30Hz 16:9  HorFreq: 33750 Hz Clock: 74.250 MHz
    VIC  95 3840x2160@30Hz 16:9  HorFreq: 67500 Hz Clock: 297.000 MHz
    VIC  94 3840x2160@25Hz 16:9  HorFreq: 56250 Hz Clock: 297.000 MHz
    VIC  93 3840x2160@24Hz 16:9  HorFreq: 54000 Hz Clock: 297.000 MHz
  Vendor-specific data block, OUI 000c03 (HDMI)
    Source physical address 2.0.0.0
Basic audio support
Supports YCbCr 4:4:4
Supports YCbCr 4:2:2
1 native detailed modes
Detailed mode: Clock 241.500 MHz, 697 mm x 392 mm
               2560 2608 2640 2720 hborder 0
               1440 1443 1448 1481 vborder 0
               +hsync -vsync 
               VertFreq: 59 Hz, HorFreq: 88786 Hz
Detailed mode: Clock 138.500 MHz, 697 mm x 392 mm
               1920 1962 2000 2080 hborder 0
               1080 1083 1088 1111 vborder 0
               +hsync -vsync 
               VertFreq: 59 Hz, HorFreq: 66586 Hz
Checksum: 0xa4 (valid)

One or more of the timings is out of range of the Monitor Ranges:
  Vertical Freq: 24 - 60 Hz
  Horizontal Freq: 27000 - 88786 Hz
  Maximum Clock: 297.000 MHz
EDID block does not conform at all!
	Both the serial number and the serial string are set
