
EDID (hex):
00ffffffffffff005c854050be180000
08110103803a208c2a088ca355449726
0f4749a1080081c00101010101010101
0101010101019d1c5692500028303020
350040442100001a201c50a050001630
3020250040442100001a000000fd0031
4c0f3108000a202020202020000000fc
00534b2d323648353930440a2020013b
02031771448405030223090707830100
0065030c001000011d007251d01e206e
28550040442100001e011d8018711c16
20582c250040442100009e8c0ad08a20
e02d10103e96004044210000188c0ad0
8a20e02d10103e9600b0441100001800
00000000000000000000000000000000
00000000000000000000000000000061

edid-decode (hex):

00 ff ff ff ff ff ff 00 5c 85 40 50 be 18 00 00
08 11 01 03 80 3a 20 8c 2a 08 8c a3 55 44 97 26
0f 47 49 a1 08 00 81 c0 01 01 01 01 01 01 01 01
01 01 01 01 01 01 9d 1c 56 92 50 00 28 30 30 20
35 00 40 44 21 00 00 1a 20 1c 50 a0 50 00 16 30
30 20 25 00 40 44 21 00 00 1a 00 00 00 fd 00 31
4c 0f 31 08 00 0a 20 20 20 20 20 20 00 00 00 fc
00 53 4b 2d 32 36 48 35 39 30 44 0a 20 20 01 3b

02 03 17 71 44 84 05 03 02 23 09 07 07 83 01 00
00 65 03 0c 00 10 00 01 1d 00 72 51 d0 1e 20 6e
28 55 00 40 44 21 00 00 1e 01 1d 80 18 71 1c 16
20 58 2c 25 00 40 44 21 00 00 9e 8c 0a d0 8a 20
e0 2d 10 10 3e 96 00 40 44 21 00 00 18 8c 0a d0
8a 20 e0 2d 10 10 3e 96 00 b0 44 11 00 00 18 00
00 00 00 00 00 00 00 00 00 00 00 00 00 00 00 00
00 00 00 00 00 00 00 00 00 00 00 00 00 00 00 61

----------------

Block 0, Base EDID:
  EDID Structure Version & Revision: 1.3
  Vendor & Product Identification:
    Manufacturer: WDE
    Model: 20544
    Serial Number: 6334
    Made in: week 8 of 2007
  Basic Display Parameters & Features:
    Digital display
    Maximum image size: 58 cm x 32 cm
    Gamma: 2.40
    DPMS levels: Off
    RGB color display
    First detailed timing is the preferred timing
  Color Characteristics:
    Red  : 0.6367, 0.3320
    Green: 0.2675, 0.5898
    Blue : 0.1503, 0.0585
    White: 0.2802, 0.2851
  Established Timings I & II:
    IBM     :   720x400    70.081663 Hz   9:5     31.467 kHz     28.320000 MHz
    DMT 0x04:   640x480    59.940476 Hz   4:3     31.469 kHz     25.175000 MHz
    DMT 0x09:   800x600    60.316541 Hz   4:3     37.879 kHz     40.000000 MHz
    DMT 0x10:  1024x768    60.003840 Hz   4:3     48.363 kHz     65.000000 MHz
  Standard Timings:
    DMT 0x55:  1280x720    60.000000 Hz  16:9     45.000 kHz     74.250000 MHz
  Detailed Timing Descriptors:
    DTD 1:  1366x768    59.957633 Hz 683:384   48.446 kHz     73.250000 MHz (576 mm x 324 mm)
                 Hfront   48 Hsync  32 Hback   66 Hpol P
                 Vfront    3 Vsync   5 Vback   32 Vpol N
    DTD 2:  1360x768    59.960027 Hz  85:48    47.368 kHz     72.000000 MHz (576 mm x 324 mm)
                 Hfront   48 Hsync  32 Hback   80 Hpol P
                 Vfront    2 Vsync   5 Vback   15 Vpol N
    Display Range Limits:
      Monitor ranges (GTF): 49-76 Hz V, 15-49 kHz H, max dotclock 80 MHz
    Display Product Name: 'SK-26H590D'
  Extension blocks: 1
Checksum: 0x3b

----------------

Block 1, CTA-861 Extension Block:
  Revision: 3
  Basic audio support
  Supports YCbCr 4:4:4
  Supports YCbCr 4:2:2
  Native detailed modes: 1
  Video Data Block:
    VIC   4:  1280x720    60.000000 Hz  16:9     45.000 kHz     74.250000 MHz (native)
    VIC   5:  1920x1080i  60.000000 Hz  16:9     33.750 kHz     74.250000 MHz
    VIC   3:   720x480    59.940060 Hz  16:9     31.469 kHz     27.000000 MHz
    VIC   2:   720x480    59.940060 Hz   4:3     31.469 kHz     27.000000 MHz
  Audio Data Block:
    Linear PCM:
      Max channels: 2
      Supported sample rates (kHz): 48 44.1 32
      Supported sample sizes (bits): 24 20 16
  Speaker Allocation Data Block:
    FL/FR - Front Left/Right
  Vendor-Specific Data Block (HDMI), OUI 00-0C-03:
    Source physical address: 1.0.0.0
  Detailed Timing Descriptors:
    DTD 3:  1280x720    60.000000 Hz  16:9     45.000 kHz     74.250000 MHz (576 mm x 324 mm)
                 Hfront  110 Hsync  40 Hback  220 Hpol P
                 Vfront    5 Vsync   5 Vback   20 Vpol P
    DTD 4:  1920x1080i  60.000000 Hz  16:9     33.750 kHz     74.250000 MHz (576 mm x 324 mm)
                 Hfront   88 Hsync  44 Hback  148 Hpol P
                 Vfront    2 Vsync   5 Vback   15 Vpol P Vfront +0.5 Odd Field
                 Vfront    2 Vsync   5 Vback   15 Vpol P Vback  +0.5 Even Field
    DTD 5:   720x480    59.940060 Hz   3:2     31.469 kHz     27.000000 MHz (576 mm x 324 mm)
                 Hfront   16 Hsync  62 Hback   60 Hpol N
                 Vfront    9 Vsync   6 Vback   30 Vpol N
    DTD 6:   720x480    59.940060 Hz   3:2     31.469 kHz     27.000000 MHz (432 mm x 324 mm)
                 Hfront   16 Hsync  62 Hback   60 Hpol N
                 Vfront    9 Vsync   6 Vback   30 Vpol N
Checksum: 0x61  Unused space in Extension Block: 32 bytes
