
EDID (hex):
00ffffffffffff004c2d570633324459
05140103801009782aee91a3544c9926
0f5054230800a9408180814081009500
b30001010101023a801871382d40582c
4500a05a0000001e011d007251d01e20
6e285500a05a0000001e000000fd0032
3c1b5111000a202020202020000000fc
0053796e634d61737465720a20200140
02031cf34890041f0514130312230907
078301000066030c00100080011d80d0
721c1620102c2580a05a0000009e011d
8018711c1620582c2500a05a0000009e
011d00bc52d01e20b8285540a05a0000
001e011d007251d01e206e285500a05a
0000001e8c0ad090204031200c405500
a05a0000001800000000000000000075

Extracted contents:
header:          00 ff ff ff ff ff ff 00
serial number:   4c 2d 57 06 33 32 44 59 05 14
version:         01 03
basic params:    80 10 09 78 2a
chroma info:     ee 91 a3 54 4c 99 26 0f 50 54
established:     23 08 00
standard:        a9 40 81 80 81 40 81 00 95 00 b3 00 01 01 01 01
descriptor 1:    02 3a 80 18 71 38 2d 40 58 2c 45 00 a0 5a 00 00 00 1e
descriptor 2:    01 1d 00 72 51 d0 1e 20 6e 28 55 00 a0 5a 00 00 00 1e
descriptor 3:    00 00 00 fd 00 32 3c 1b 51 11 00 0a 20 20 20 20 20 20
descriptor 4:    00 00 00 fc 00 53 79 6e 63 4d 61 73 74 65 72 0a 20 20
extensions:      01
checksum:        40

EDID version: 1.3
Manufacturer: SAM Model 657 Serial Number --
Made in week 5 of 2010
Digital display
Maximum image size: 16 cm x 9 cm
Gamma: 2.20
DPMS levels: Off
RGB color display
First detailed timing is preferred timing
Display x,y Chromaticity:
  Red:   0.6396, 0.3300
  Green: 0.2998, 0.5996
  Blue:  0.1503, 0.0595
  White: 0.3125, 0.3291
Established timings supported:
  640x480@60Hz 4:3 HorFreq: 31469 Hz Clock: 25.175 MHz
  800x600@56Hz 4:3 HorFreq: 35200 Hz Clock: 36.000 MHz
  800x600@60Hz 4:3 HorFreq: 37900 Hz Clock: 40.000 MHz
  1024x768@60Hz 4:3 HorFreq: 48400 Hz Clock: 65.000 MHz
Standard timings supported:
  1600x1200@60Hz 4:3 HorFreq: 75000 Hz Clock: 162.000 MHz
  1280x1024@60Hz 5:4 HorFreq: 64000 Hz Clock: 108.000 MHz
  1280x960@60Hz 4:3 HorFreq: 60000 Hz Clock: 108.000 MHz
  1280x800@60Hz 16:10
  1440x900@60Hz 16:10 HorFreq: 55500 Hz Clock: 88.750 MHz
  1680x1050@60Hz 16:10 HorFreq: 64700 Hz Clock: 119.000 MHz
Detailed mode: Clock 148.500 MHz, 160 mm x 90 mm
               1920 2008 2052 2200 hborder 0
               1080 1084 1089 1125 vborder 0
               +hsync +vsync 
               VertFreq: 60 Hz, HorFreq: 67500 Hz
Detailed mode: Clock 74.250 MHz, 160 mm x 90 mm
               1280 1390 1430 1650 hborder 0
                720  725  730  750 vborder 0
               +hsync +vsync 
               VertFreq: 60 Hz, HorFreq: 45000 Hz
Monitor ranges (GTF): 50-60Hz V, 27-81kHz H, max dotclock 170MHz
Monitor name: SyncMaster
Has 1 extension blocks
Checksum: 0x40 (valid)

CTA extension block
Extension version: 3
24 bytes of CTA data
  Video data block
    VIC  16 1920x1080@60Hz 16:9 (native) HorFreq: 67500 Hz Clock: 148.500 MHz
    VIC   4 1280x720@60Hz 16:9  HorFreq: 45000 Hz Clock: 74.250 MHz
    VIC  31 1920x1080@50Hz 16:9  HorFreq: 56250 Hz Clock: 148.500 MHz
    VIC   5 1920x1080i@60Hz 16:9  HorFreq: 33750 Hz Clock: 74.250 MHz
    VIC  20 1920x1080i@50Hz 16:9  HorFreq: 28125 Hz Clock: 74.250 MHz
    VIC  19 1280x720@50Hz 16:9  HorFreq: 37500 Hz Clock: 74.250 MHz
    VIC   3 720x480@60Hz 16:9  HorFreq: 31469 Hz Clock: 27.000 MHz
    VIC  18 720x576@50Hz 16:9  HorFreq: 31250 Hz Clock: 27.000 MHz
  Audio data block
    Linear PCM, max channels 2
      Supported sample rates (kHz): 48 44.1 32
      Supported sample sizes (bits): 24 20 16
  Speaker allocation data block
    Speaker map:
      FL/FR - Front Left/Right
  Vendor-specific data block, OUI 000c03 (HDMI)
    Source physical address 1.0.0.0
    Supports_AI
Underscans PC formats by default
Basic audio support
Supports YCbCr 4:4:4
Supports YCbCr 4:2:2
3 native detailed modes
Detailed mode: Clock 74.250 MHz, 160 mm x 90 mm
               1920 2448 2492 2640 hborder 0
                540  542  547  562 vborder 0
               +hsync +vsync interlaced 
               VertFreq: 50 Hz, HorFreq: 28125 Hz
Detailed mode: Clock 74.250 MHz, 160 mm x 90 mm
               1920 2008 2052 2200 hborder 0
                540  542  547  562 vborder 0
               +hsync +vsync interlaced 
               VertFreq: 60 Hz, HorFreq: 33750 Hz
Detailed mode: Clock 74.250 MHz, 160 mm x 90 mm
               1280 1720 1760 1980 hborder 0
                720  725  730  750 vborder 0
               +hsync +vsync 
               VertFreq: 50 Hz, HorFreq: 37500 Hz
Detailed mode: Clock 74.250 MHz, 160 mm x 90 mm
               1280 1390 1430 1650 hborder 0
                720  725  730  750 vborder 0
               +hsync +vsync 
               VertFreq: 60 Hz, HorFreq: 45000 Hz
Detailed mode: Clock 27.000 MHz, 160 mm x 90 mm
                720  732  796  864 hborder 0
                576  581  586  625 vborder 0
               -hsync -vsync 
               VertFreq: 50 Hz, HorFreq: 31250 Hz
Checksum: 0x75 (valid)
