edid-decode (hex):

00 ff ff ff ff ff ff 00 15 c3 09 19 01 01 01 01
16 12 01 03 80 34 21 78 ea f9 f5 a8 53 37 ae 25
12 50 54 a1 08 00 a9 40 81 80 81 40 b3 00 01 01
01 01 01 01 01 01 28 3c 80 a0 70 b0 23 40 30 20
36 00 07 44 21 00 00 1a 00 00 00 ff 00 33 35 35
32 32 30 35 38 0a 20 20 20 20 00 00 00 fd 00 3b
3d 1f 4c 11 00 0a 20 20 20 20 20 20 00 00 00 fc
00 43 47 32 34 31 57 0a 20 20 20 20 20 20 00 ba

----------------

Block 0, Base EDID:
  EDID Structure Version & Revision: 1.3
  Vendor & Product Identification:
    Manufacturer: ENC
    Model: 6409
    Serial Number: ...
    Made in: week 22 of 2008
  Basic Display Parameters & Features:
    Digital display
    Maximum image size: 52 cm x 33 cm
    Gamma: 2.20
    DPMS levels: Standby Suspend Off
    RGB color display
    First detailed timing is the preferred timing
  Color Characteristics:
    Red  : 0.6591, 0.3271
    Green: 0.2167, 0.6806
    Blue : 0.1474, 0.0732
    White: 0.3134, 0.3291
  Established Timings I & II:
    IBM     :   720x400    70.081663 Hz   9:5     31.467 kHz     28.320000 MHz
    DMT 0x04:   640x480    59.940476 Hz   4:3     31.469 kHz     25.175000 MHz
    DMT 0x09:   800x600    60.316541 Hz   4:3     37.879 kHz     40.000000 MHz
    DMT 0x10:  1024x768    60.003840 Hz   4:3     48.363 kHz     65.000000 MHz
  Standard Timings:
    DMT 0x33:  1600x1200   60.000000 Hz   4:3     75.000 kHz    162.000000 MHz
    DMT 0x23:  1280x1024   60.019740 Hz   5:4     63.981 kHz    108.000000 MHz
    DMT 0x20:  1280x960    60.000000 Hz   4:3     60.000 kHz    108.000000 MHz
    DMT 0x3a:  1680x1050   59.954250 Hz  16:10    65.290 kHz    146.250000 MHz
  Detailed Timing Descriptors:
    DTD 1:  1920x1200   59.950171 Hz   8:5     74.038 kHz    154.000000 MHz (519 mm x 324 mm)
                 Hfront   48 Hsync  32 Hback   80 Hpol P
                 Vfront    3 Vsync   6 Vback   26 Vpol N
    Display Product Serial Number: ...
    Display Range Limits:
      Monitor ranges (GTF): 59-61 Hz V, 31-76 kHz H, max dotclock 170 MHz
    Display Product Name: 'CG241W'
Checksum: 0xba

----------------

Failures:

EDID:
  Base EDID: Some timings are out of range of the Monitor Ranges:
    Vertical Freq: 59.940 - 70.082 Hz (Monitor: 59.000 - 61.000 Hz)

EDID conformity: FAIL
