
EDID (hex):
00ffffffffffff005a8b360200000000
271d0104a52f1b782bbf55ab5047a321
0f5054a54b00714081c081809500a9c0
b300d1c00101023a801871382d40582c
4500dc0b1100001e000000fd003090a2
a224010a202020202020000000fc0047
4656323243420a2020202020000000ff
002020202020202020202020200a0165
02031ce14f900102030405111213141f
292f3f402309070783010000fd8180a0
70381f4030203500dc0c1100001a0000
00000000000000000000000000000000
00000000000000000000000000000000
00000000000000000000000000000000
00000000000000000000000000000000
000000000000000000000000000000d5

Extracted contents:
header:          00 ff ff ff ff ff ff 00
serial number:   5a 8b 36 02 00 00 00 00 27 1d
version:         01 04
basic params:    a5 2f 1b 78 2b
chroma info:     bf 55 ab 50 47 a3 21 0f 50 54
established:     a5 4b 00
standard:        71 40 81 c0 81 80 95 00 a9 c0 b3 00 d1 c0 01 01
descriptor 1:    02 3a 80 18 71 38 2d 40 58 2c 45 00 dc 0b 11 00 00 1e
descriptor 2:    00 00 00 fd 00 30 90 a2 a2 24 01 0a 20 20 20 20 20 20
descriptor 3:    00 00 00 fc 00 47 46 56 32 32 43 42 0a 20 20 20 20 20
descriptor 4:    00 00 00 ff 00 20 20 20 20 20 20 20 20 20 20 20 20 0a
extensions:      01
checksum:        65

EDID version: 1.4
Manufacturer: VTK Model 236 Serial Number --
Made in week 39 of 2019
Digital display
8 bits per primary color channel
DisplayPort interface
Maximum image size: 47 cm x 27 cm
Gamma: 2.20
DPMS levels: Off
Supported color formats: RGB 4:4:4, YCrCb 4:4:4
First detailed timing includes the native pixel format and preferred refresh rate
Display is continuous frequency
Display x,y Chromaticity:
  Red:   0.6699, 0.3154
  Green: 0.2802, 0.6396
  Blue:  0.1298, 0.0595
  White: 0.3134, 0.3291
Established timings supported:
  720x400@70Hz 9:5 HorFreq: 31469 Hz Clock: 28.320 MHz
  640x480@60Hz 4:3 HorFreq: 31469 Hz Clock: 25.175 MHz
  640x480@75Hz 4:3 HorFreq: 37500 Hz Clock: 31.500 MHz
  800x600@60Hz 4:3 HorFreq: 37900 Hz Clock: 40.000 MHz
  800x600@75Hz 4:3 HorFreq: 46900 Hz Clock: 49.500 MHz
  1024x768@60Hz 4:3 HorFreq: 48400 Hz Clock: 65.000 MHz
  1024x768@75Hz 4:3 HorFreq: 60000 Hz Clock: 78.750 MHz
  1280x1024@75Hz 5:4 HorFreq: 80000 Hz Clock: 135.000 MHz
Standard timings supported:
  1152x864@60Hz 4:3
  1280x720@60Hz 16:9
  1280x1024@60Hz 5:4 HorFreq: 64000 Hz Clock: 108.000 MHz
  1440x900@60Hz 16:10 HorFreq: 55500 Hz Clock: 88.750 MHz
  1600x900@60Hz 16:9
  1680x1050@60Hz 16:10 HorFreq: 64700 Hz Clock: 119.000 MHz
  1920x1080@60Hz 16:9
Detailed mode: Clock 148.500 MHz, 476 mm x 267 mm
               1920 2008 2052 2200 hborder 0
               1080 1084 1089 1125 vborder 0
               +hsync +vsync 
               VertFreq: 60 Hz, HorFreq: 67500 Hz
Monitor ranges (bare limits): 48-144Hz V, 162-162kHz H, max dotclock 360MHz
Monitor name: GFV22CB
Serial number:             
-- 1 extension blocks
Checksum: 0x65 (valid)

CTA extension block
Extension version: 3
24 bytes of CTA data
  Video data block
    VIC  16 1920x1080@60Hz 16:9 (native) HorFreq: 67500 Hz Clock: 148.500 MHz
    VIC   1 640x480@60Hz 4:3  HorFreq: 31469 Hz Clock: 25.175 MHz
    VIC   2 720x480@60Hz 4:3  HorFreq: 31469 Hz Clock: 27.000 MHz
    VIC   3 720x480@60Hz 16:9  HorFreq: 31469 Hz Clock: 27.000 MHz
    VIC   4 1280x720@60Hz 16:9  HorFreq: 45000 Hz Clock: 74.250 MHz
    VIC   5 1920x1080i@60Hz 16:9  HorFreq: 33750 Hz Clock: 74.250 MHz
    VIC  17 720x576@50Hz 4:3  HorFreq: 31250 Hz Clock: 27.000 MHz
    VIC  18 720x576@50Hz 16:9  HorFreq: 31250 Hz Clock: 27.000 MHz
    VIC  19 1280x720@50Hz 16:9  HorFreq: 37500 Hz Clock: 74.250 MHz
    VIC  20 1920x1080i@50Hz 16:9  HorFreq: 28125 Hz Clock: 74.250 MHz
    VIC  31 1920x1080@50Hz 16:9  HorFreq: 56250 Hz Clock: 148.500 MHz
    VIC  41 1280x720@100Hz 16:9  HorFreq: 75000 Hz Clock: 148.500 MHz
    VIC  47 1280x720@120Hz 16:9  HorFreq: 90000 Hz Clock: 148.500 MHz
    VIC  63 1920x1080@120Hz 16:9  HorFreq: 135000 Hz Clock: 297.000 MHz
    VIC  64 1920x1080@100Hz 16:9  HorFreq: 112500 Hz Clock: 297.000 MHz
  Audio data block
    Linear PCM, max channels 2
      Supported sample rates (kHz): 48 44.1 32
      Supported sample sizes (bits): 24 20 16
  Speaker allocation data block
    Speaker map:
      FL/FR - Front Left/Right
Underscans PC formats by default
Basic audio support
Supports YCbCr 4:4:4
1 native detailed modes
Detailed mode: Clock 332.770 MHz, 476 mm x 268 mm
               1920 1968 2000 2080 hborder 0
               1080 1083 1088 1111 vborder 0
               +hsync -vsync 
               VertFreq: 144 Hz, HorFreq: 159985 Hz
Checksum: 0xd5 (valid)

Warning: One or more of the timings is out of range of the Monitor Ranges:
  Vertical Freq: 50 - 144 Hz
  Horizontal Freq: 28125 - 159985 Hz
  Maximum Clock: 332.770 MHz
