edid-decode (hex):

00 ff ff ff ff ff ff 00 0d fa 10 00 94 db 32 01
28 16 01 03 80 46 27 78 8f 00 13 a0 57 49 9b 26
10 48 4e a1 08 00 81 00 81 c0 81 80 b3 00 95 00
01 01 81 40 a9 c0 02 3a 80 18 71 38 2d 40 58 2c
45 00 a2 08 32 00 00 06 2f 26 40 a0 60 84 1a 30
30 20 35 00 00 00 00 00 00 1a 00 00 00 fc 00 44
56 49 0a 0a 0a 0a 0a 0a 0a 0a 0a 0a 66 21 56 aa
51 00 1e 30 46 8f 33 00 9a e6 10 00 00 06 00 df

----------------

Block 0, Base EDID:
  EDID Structure Version & Revision: 1.3
  Vendor & Product Identification:
    Manufacturer: COZ
    Model: 16
    Serial Number: ...
    Made in: week 40 of 2012
  Basic Display Parameters & Features:
    Digital display
    Maximum image size: 70 cm x 39 cm
    Gamma: 2.20
    DPMS levels: Standby
    RGB color display
    Default (sRGB) color space is primary color space
    First detailed timing is the preferred timing
    Supports GTF timings within operating range
  Color Characteristics:
    Red  : 0.6250, 0.3398
    Green: 0.2851, 0.6054
    Blue : 0.1484, 0.0634
    White: 0.2812, 0.3076
  Established Timings I & II:
    IBM     :   720x400    70.081663 Hz   9:5     31.467 kHz     28.320000 MHz
    DMT 0x04:   640x480    59.940476 Hz   4:3     31.469 kHz     25.175000 MHz
    DMT 0x09:   800x600    60.316541 Hz   4:3     37.879 kHz     40.000000 MHz
    DMT 0x10:  1024x768    60.003840 Hz   4:3     48.363 kHz     65.000000 MHz
  Standard Timings:
    DMT 0x1c:  1280x800    59.810326 Hz  16:10    49.702 kHz     83.500000 MHz
    DMT 0x55:  1280x720    60.000000 Hz  16:9     45.000 kHz     74.250000 MHz
    DMT 0x23:  1280x1024   60.019740 Hz   5:4     63.981 kHz    108.000000 MHz
    DMT 0x3a:  1680x1050   59.954250 Hz  16:10    65.290 kHz    146.250000 MHz
    DMT 0x2f:  1440x900    59.887445 Hz  16:10    55.935 kHz    106.500000 MHz
    DMT 0x20:  1280x960    60.000000 Hz   4:3     60.000 kHz    108.000000 MHz
    DMT 0x53:  1600x900    60.000000 Hz  16:9     60.000 kHz    108.000000 MHz (RB)
  Detailed Timing Descriptors:
    DTD 1:  1920x1080   60.000000 Hz  16:9     67.500 kHz    148.500000 MHz (analog composite, serrate, 930 mm x 520 mm)
                 Hfront   88 Hsync  44 Hback  148 Hpol N
                 Vfront    4 Vsync   5 Vback   36 Vpol N
    DTD 2:  1600x900    59.978156 Hz  16:9     55.540 kHz     97.750000 MHz
                 Hfront   48 Hsync  32 Hback   80 Hpol P
                 Vfront    3 Vsync   5 Vback   18 Vpol N
    Display Product Name: 'DVI'
    DTD 3:  1366x768    59.789541 Hz 683:384   47.712 kHz     85.500000 MHz (analog composite, serrate, 410 mm x 230 mm)
                 Hfront   70 Hsync 143 Hback  213 Hpol N
                 Vfront    3 Vsync   3 Vback   24 Vpol N
Checksum: 0xdf

----------------

Warnings:

Block 0, Base EDID:
  Detailed Timing Descriptor #1: DTD is similar but not identical to VIC 16.
  Detailed Timing Descriptor #3: DTD is similar but not identical to DMT 0x51.

Failures:

Block 0, Base EDID:
  Basic Display Parameters & Features: sRGB is signaled, but the chromaticities do not match.
  Detailed Timing Descriptor #1: Mismatch of image size 930x520 mm vs display size 700x390 mm.
  Detailed Timing Descriptor #2: Mismatch of image size vs display size: image size is not set, but display size is.
  Display Product Name: Non-space after newline.
  Detailed Timing Descriptor #3: Mismatch of image size 410x230 mm vs display size 700x390 mm.
  Detailed Timing Descriptor #3: Invalid detailed timing descriptor ordering.
  Missing Display Range Limits Descriptor.

EDID conformity: FAIL
