
EDID (hex):
00ffffffffffff0051ca6001fa110000
28100103801e13780a93e59257508d25
1e4f5400000001010101010101010101
010101010101bc1b00a0502017303020
36002fbe10000018000000fe00544431
34315447434b310a2020000000fe0054
4f50504f4c590a2020202020000000fe
0054443134315447434b310a20200094

Extracted contents:
header:          00 ff ff ff ff ff ff 00
serial number:   51 ca 60 01 fa 11 00 00 28 10
version:         01 03
basic params:    80 1e 13 78 0a
chroma info:     93 e5 92 57 50 8d 25 1e 4f 54
established:     00 00 00
standard:        01 01 01 01 01 01 01 01 01 01 01 01 01 01 01 01
descriptor 1:    bc 1b 00 a0 50 20 17 30 30 20 36 00 2f be 10 00 00 18
descriptor 2:    00 00 00 fe 00 54 44 31 34 31 54 47 43 4b 31 0a 20 20
descriptor 3:    00 00 00 fe 00 54 4f 50 50 4f 4c 59 0a 20 20 20 20 20
descriptor 4:    00 00 00 fe 00 54 44 31 34 31 54 47 43 4b 31 0a 20 20
extensions:      00
checksum:        94

EDID version: 1.3
Manufacturer: TNJ Model 160 Serial Number --
Made in week 40 of 2006
Digital display
Maximum image size: 30 cm x 19 cm
Gamma: 2.20
RGB color display
First detailed timing is preferred timing
Display x,y Chromaticity:
  Red:   0.5722, 0.3408
  Green: 0.3125, 0.5537
  Blue:  0.1474, 0.1191
  White: 0.3095, 0.3291
Established timings supported:
Standard timings supported:
Detailed mode: Clock 71.000 MHz, 303 mm x 190 mm
               1280 1328 1360 1440 hborder 0
                800  803  809  823 vborder 0
               -hsync -vsync 
               VertFreq: 59 Hz, HorFreq: 49305 Hz
ASCII string: TD141TGCK1
ASCII string: TOPPOLY
ASCII string: TD141TGCK1
Checksum: 0x94 (valid)
EDID block does NOT conform to EDID 1.3!
	Missing name descriptor
	Missing monitor ranges
