edid-decode (hex):

00 ff ff ff ff ff ff 00 4c 2d 30 06 42 50 30 5a
1a 14 01 03 0e 22 13 78 2a 24 71 a5 58 4b 9a 24
16 50 54 bf ee 00 01 01 01 01 01 01 01 01 01 01
01 01 01 01 01 01 66 21 50 b0 51 00 1b 30 40 70
36 00 58 c2 10 00 00 1e 00 00 00 fd 00 38 4b 1e
3d 09 00 0a 20 20 20 20 20 20 00 00 00 fc 00 53
4d 42 31 36 33 30 4e 0a 20 20 20 20 00 00 00 ff
00 48 58 49 5a 36 30 30 35 31 34 0a 20 20 00 d7

00 ff ff ff ff ff ff 00 4c 2d 30 06 42 50 30 5a
1a 14 01 03 0e 22 13 78 2a 24 71 a5 58 4b 9a 24
16 50 54 bf ee 00 01 01 01 01 01 01 01 01 01 01
01 01 01 01 01 01 66 21 50 b0 51 00 1b 30 40 70
36 00 58 c2 10 00 00 1e 00 00 00 fd 00 38 4b 1e
3d 09 00 0a 20 20 20 20 20 20 00 00 00 fc 00 53
4d 42 31 36 33 30 4e 0a 20 20 20 20 00 00 00 ff
00 48 58 49 5a 36 30 30 35 31 34 0a 20 20 00 d7

----------------

Block 0, Base EDID:
  EDID Structure Version & Revision: 1.3
  Vendor & Product Identification:
    Manufacturer: SAM
    Model: 1584
    Serial Number: ...
    Made in: week 26 of 2010
  Basic Display Parameters & Features:
    Analog display
    Signal Level Standard: 0.700 : 0.300 : 1.000 V p-p
    Blank level equals black level
    Sync: Separate Composite SyncOnGreen
    Maximum image size: 34 cm x 19 cm
    Gamma: 2.20
    DPMS levels: Off
    RGB color display
    First detailed timing is the preferred timing
  Color Characteristics:
    Red  : 0.6445, 0.3457
    Green: 0.2939, 0.6015
    Blue : 0.1416, 0.0888
    White: 0.3125, 0.3291
  Established Timings I & II:
    IBM     :   720x400    70.081663 Hz   9:5     31.467 kHz     28.320000 MHz
    DMT 0x04:   640x480    59.940476 Hz   4:3     31.469 kHz     25.175000 MHz
    Apple   :   640x480    66.666667 Hz   4:3     35.000 kHz     30.240000 MHz
    DMT 0x05:   640x480    72.808802 Hz   4:3     37.861 kHz     31.500000 MHz
    DMT 0x06:   640x480    75.000000 Hz   4:3     37.500 kHz     31.500000 MHz
    DMT 0x08:   800x600    56.250000 Hz   4:3     35.156 kHz     36.000000 MHz
    DMT 0x09:   800x600    60.316541 Hz   4:3     37.879 kHz     40.000000 MHz
    DMT 0x0a:   800x600    72.187572 Hz   4:3     48.077 kHz     50.000000 MHz
    DMT 0x0b:   800x600    75.000000 Hz   4:3     46.875 kHz     49.500000 MHz
    Apple   :   832x624    74.551266 Hz   4:3     49.726 kHz     57.284000 MHz
    DMT 0x10:  1024x768    60.003840 Hz   4:3     48.363 kHz     65.000000 MHz
    DMT 0x11:  1024x768    70.069359 Hz   4:3     56.476 kHz     75.000000 MHz
    DMT 0x12:  1024x768    75.028582 Hz   4:3     60.023 kHz     78.750000 MHz
  Standard Timings: none
  Detailed Timing Descriptors:
    DTD 1:  1360x768    60.015162 Hz  85:48    47.712 kHz     85.500000 MHz (344 mm x 194 mm)
                 Hfront   64 Hsync 112 Hback  256 Hpol P
                 Vfront    3 Vsync   6 Vback   18 Vpol P
    Display Range Limits:
      Monitor ranges (GTF): 56-75 Hz V, 30-61 kHz H, max dotclock 90 MHz
    Display Product Name: 'SMB1630N'
    Display Product Serial Number: ...
Checksum: 0xd7

----------------

Block 1, Unknown EDID Extension Block 0x00:
  00 ff ff ff ff ff ff 00 4c 2d 30 06 42 50 30 5a '........L-0.BP0Z'
  1a 14 01 03 0e 22 13 78 2a 24 71 a5 58 4b 9a 24 '.....".x*$q.XK.$'
  16 50 54 bf ee 00 01 01 01 01 01 01 01 01 01 01 '.PT.............'
  01 01 01 01 01 01 66 21 50 b0 51 00 1b 30 40 70 '......f!P.Q..0@p'
  36 00 58 c2 10 00 00 1e 00 00 00 fd 00 38 4b 1e '6.X..........8K.'
  3d 09 00 0a 20 20 20 20 20 20 00 00 00 fc 00 53 '=...      .....S'
  4d 42 31 36 33 30 4e 0a 20 20 20 20 00 00 00 ff 'MB1630N.    ....'
  00 48 58 49 5a 36 30 30 35 31 34 0a 20 20 00 d7 '.HXIZ600514.  ..'
Checksum: 0xd7

----------------

Failures:

Block 1, Base EDID:
  Unknown Extension Block.
EDID:
  Base EDID: EDID specified 0 extension block(s), but found 1 extension block(s).

EDID conformity: FAIL
