
EDID (hex):
00ffffffffffff0009d1c2763d100000
1d1101036c2b1b78eecfb5a355499925
105054a56f80454f614f81408180818f
714fb300010121399030621a274068b0
3600b10f1100001cd50980a0205e6310
10605208782d1100001a000000fd0038
4c1e5411000a202020202020000000fc
0042656e5120465032303257410a002a

Extracted contents:
header:          00 ff ff ff ff ff ff 00
serial number:   09 d1 c2 76 3d 10 00 00 1d 11
version:         01 03
basic params:    6c 2b 1b 78 ee
chroma info:     cf b5 a3 55 49 99 25 10 50 54
established:     a5 6f 80
standard:        45 4f 61 4f 81 40 81 80 81 8f 71 4f b3 00 01 01
descriptor 1:    21 39 90 30 62 1a 27 40 68 b0 36 00 b1 0f 11 00 00 1c
descriptor 2:    d5 09 80 a0 20 5e 63 10 10 60 52 08 78 2d 11 00 00 1a
descriptor 3:    00 00 00 fd 00 38 4c 1e 54 11 00 0a 20 20 20 20 20 20
descriptor 4:    00 00 00 fc 00 42 65 6e 51 20 46 50 32 30 32 57 41 0a
extensions:      00
checksum:        2a

EDID version: 1.3
Manufacturer: BNQ Model 76c2 Serial Number --
Made in week 29 of 2007
Analog display, Input voltage level: 0.7/0.7 V
Sync: Separate Composite 
Maximum image size: 43 cm x 27 cm
Gamma: 2.20
DPMS levels: Standby Suspend Off
RGB color display
Default (sRGB) color space is primary color space
First detailed timing is preferred timing
Display x,y Chromaticity:
  Red:   0.6396, 0.3320
  Green: 0.2880, 0.6005
  Blue:  0.1464, 0.0654
  White: 0.3134, 0.3291
Established timings supported:
  720x400@70Hz 9:5 HorFreq: 31469 Hz Clock: 28.320 MHz
  640x480@60Hz 4:3 HorFreq: 31469 Hz Clock: 25.175 MHz
  640x480@75Hz 4:3 HorFreq: 37500 Hz Clock: 31.500 MHz
  800x600@60Hz 4:3 HorFreq: 37900 Hz Clock: 40.000 MHz
  800x600@75Hz 4:3 HorFreq: 46900 Hz Clock: 49.500 MHz
  832x624@75Hz 4:3 HorFreq: 49726 Hz Clock: 57.284 MHz
  1024x768@60Hz 4:3 HorFreq: 48400 Hz Clock: 65.000 MHz
  1024x768@70Hz 4:3 HorFreq: 56500 Hz Clock: 75.000 MHz
  1024x768@75Hz 4:3 HorFreq: 60000 Hz Clock: 78.750 MHz
  1280x1024@75Hz 5:4 HorFreq: 80000 Hz Clock: 135.000 MHz
  1152x870@75Hz 192:145 HorFreq: 67500 Hz Clock: 108.000 MHz
Standard timings supported:
  800x600@75Hz 4:3 HorFreq: 46900 Hz Clock: 49.500 MHz
  1024x768@75Hz 4:3 HorFreq: 60000 Hz Clock: 78.750 MHz
  1280x960@60Hz 4:3 HorFreq: 60000 Hz Clock: 108.000 MHz
  1280x1024@60Hz 5:4 HorFreq: 64000 Hz Clock: 108.000 MHz
  1280x1024@75Hz 5:4 HorFreq: 80000 Hz Clock: 135.000 MHz
  1152x864@75Hz 4:3 HorFreq: 67500 Hz Clock: 108.000 MHz
  1680x1050@60Hz 16:10 HorFreq: 64700 Hz Clock: 119.000 MHz
Detailed mode: Clock 146.250 MHz, 433 mm x 271 mm
               1680 1784 1960 2240 hborder 0
               1050 1053 1059 1089 vborder 0
               -hsync +vsync 
               VertFreq: 59 Hz, HorFreq: 65290 Hz
Detailed mode: Clock 25.170 MHz, 376 mm x 301 mm
                640  656  752  800 hborder 0
                350  387  389  449 vborder 0
               +hsync -vsync 
               VertFreq: 70 Hz, HorFreq: 31462 Hz
Monitor ranges (GTF): 56-76Hz V, 30-84kHz H, max dotclock 170MHz
Monitor name: BenQ FP202WA
Checksum: 0x2a (valid)
EDID block does NOT conform to EDID 1.3!
	sRGB is signaled, but the chromaticities do not match
