edid-decode (hex):

00 ff ff ff ff ff ff 00 06 af ee 01 00 00 00 00
01 12 01 03 80 22 13 78 0a e4 e5 a0 59 57 92 26
0d 50 54 00 00 00 01 01 01 01 01 01 01 01 01 01
01 01 01 01 01 01 1c 2a 40 72 61 84 0c 30 40 2a
33 00 58 c1 10 00 00 18 00 00 00 0f 00 00 00 00
00 00 00 00 00 00 00 00 00 20 00 00 00 fe 00 41
55 4f 0a 20 20 20 20 20 20 20 20 20 00 00 00 fe
00 42 31 35 36 52 57 30 31 20 56 31 20 0a 00 98

----------------

Block 0, Base EDID:
  EDID Structure Version & Revision: 1.3
  Vendor & Product Identification:
    Manufacturer: AUO
    Model: 494
    Made in: week 1 of 2008
  Basic Display Parameters & Features:
    Digital display
    Maximum image size: 34 cm x 19 cm
    Gamma: 2.20
    RGB color display
    First detailed timing is the preferred timing
  Color Characteristics:
    Red  : 0.6279, 0.3496
    Green: 0.3408, 0.5703
    Blue : 0.1513, 0.0527
    White: 0.3134, 0.3291
  Established Timings I & II: none
  Standard Timings: none
  Detailed Timing Descriptors:
    DTD 1:  1600x900    60.001 Hz  16:9    54.721 kHz 107.800 MHz (344 mm x 193 mm)
                 Hfront   64 Hsync  42 Hback 264 Hpol N
                 Vfront    3 Vsync   3 Vback   6 Vpol N
    Manufacturer-Specified Display Descriptor (0x0f): 00 0f 00 00 00 00 00 00 00 00 00 00 00 00 00 20 '............... '
    Alphanumeric Data String: 'AUO'
    Alphanumeric Data String: 'B156RW01 V1 '
Checksum: 0x98

----------------

Failures:

Block 0, Base EDID:
  Alphanumeric Data String: One or more trailing spaces.
  Missing Display Product Name.
  Missing Display Range Limits Descriptor.

EDID conformity: FAIL
