edid-decode (hex):

00 ff ff ff ff ff ff 00 5d f2 19 43 b7 03 00 00
1e 13 01 03 0a 25 1e 78 ee 1f 35 a4 56 4d 9e 24
12 50 54 bf ef 80 71 40 71 4f 81 c0 81 00 81 40
81 80 01 01 01 01 30 2a 00 98 51 00 2a 40 30 70
13 00 78 2d 11 00 00 1e 00 00 00 fc 00 54 45 52
52 41 20 4c 43 44 34 33 31 39 00 00 00 ff 00 43
46 31 39 39 33 30 30 30 39 35 31 46 00 00 00 fd
00 32 4c 1f 52 0e 00 0a 20 20 20 20 20 20 00 76

00 ff ff ff ff ff ff 00 5d f2 19 43 b7 03 00 00
1e 13 01 03 0a 25 1e 78 ee 1f 35 a4 56 4d 9e 24
12 50 54 bf ef 80 71 40 71 4f 81 c0 81 00 81 40
81 80 01 01 01 01 30 2a 00 98 51 00 2a 40 30 70
13 00 78 2d 11 00 00 1e 00 00 00 fc 00 54 45 52
52 41 20 4c 43 44 34 33 31 39 00 00 00 ff 00 43
46 31 39 39 33 30 30 30 39 35 31 46 00 00 00 fd
00 32 4c 1f 52 0e 00 0a 20 20 20 20 20 20 00 76

----------------

Block 0, Base EDID:
  EDID Structure Version & Revision: 1.3
  Vendor & Product Identification:
    Manufacturer: WOR
    Model: 17177
    Serial Number: ...
    Made in: week 30 of 2009
  Basic Display Parameters & Features:
    Analog display
    Signal Level Standard: 0.700 : 0.300 : 1.000 V p-p
    Blank level equals black level
    Sync: Separate SyncOnGreen
    Maximum image size: 37 cm x 30 cm
    Gamma: 2.20
    DPMS levels: Standby Suspend Off
    RGB color display
    Default (sRGB) color space is primary color space
    First detailed timing is the preferred timing
  Color Characteristics:
    Red  : 0.6406, 0.3369
    Green: 0.3037, 0.6201
    Blue : 0.1406, 0.0732
    White: 0.3134, 0.3291
  Established Timings I & II:
    IBM     :   720x400    70.081663 Hz   9:5     31.467 kHz     28.320000 MHz
    DMT 0x04:   640x480    59.940476 Hz   4:3     31.469 kHz     25.175000 MHz
    Apple   :   640x480    66.666667 Hz   4:3     35.000 kHz     30.240000 MHz
    DMT 0x05:   640x480    72.808802 Hz   4:3     37.861 kHz     31.500000 MHz
    DMT 0x06:   640x480    75.000000 Hz   4:3     37.500 kHz     31.500000 MHz
    DMT 0x08:   800x600    56.250000 Hz   4:3     35.156 kHz     36.000000 MHz
    DMT 0x09:   800x600    60.316541 Hz   4:3     37.879 kHz     40.000000 MHz
    DMT 0x0a:   800x600    72.187572 Hz   4:3     48.077 kHz     50.000000 MHz
    DMT 0x0b:   800x600    75.000000 Hz   4:3     46.875 kHz     49.500000 MHz
    Apple   :   832x624    74.551266 Hz   4:3     49.726 kHz     57.284000 MHz
    DMT 0x10:  1024x768    60.003840 Hz   4:3     48.363 kHz     65.000000 MHz
    DMT 0x11:  1024x768    70.069359 Hz   4:3     56.476 kHz     75.000000 MHz
    DMT 0x12:  1024x768    75.028582 Hz   4:3     60.023 kHz     78.750000 MHz
    DMT 0x24:  1280x1024   75.024675 Hz   5:4     79.976 kHz    135.000000 MHz
    Apple   :  1152x870    75.061550 Hz 192:145   68.681 kHz    100.000000 MHz
  Standard Timings:
    GTF     :  1152x864    60.000000 Hz   4:3     53.700 kHz     81.624000 MHz
    DMT 0x15:  1152x864    75.000000 Hz   4:3     67.500 kHz    108.000000 MHz
    DMT 0x55:  1280x720    60.000000 Hz  16:9     45.000 kHz     74.250000 MHz
    DMT 0x1c:  1280x800    59.810326 Hz  16:10    49.702 kHz     83.500000 MHz
    DMT 0x20:  1280x960    60.000000 Hz   4:3     60.000 kHz    108.000000 MHz
    DMT 0x23:  1280x1024   60.019740 Hz   5:4     63.981 kHz    108.000000 MHz
  Detailed Timing Descriptors:
    DTD 1:  1280x1024   60.019740 Hz   5:4     63.981 kHz    108.000000 MHz (376 mm x 301 mm)
                 Hfront   48 Hsync 112 Hback  248 Hpol P
                 Vfront    1 Vsync   3 Vback   38 Vpol P
    Display Product Name: 'TERRA LCD4319'
    Display Product Serial Number: ...
    Display Range Limits:
      Monitor ranges (GTF): 50-76 Hz V, 31-82 kHz H, max dotclock 140 MHz
Checksum: 0x76

----------------

Block 1, Unknown EDID Extension Block 0x00:
  00 ff ff ff ff ff ff 00 5d f2 19 43 b7 03 00 00 '........]..C....'
  1e 13 01 03 0a 25 1e 78 ee 1f 35 a4 56 4d 9e 24 '.....%.x..5.VM.$'
  12 50 54 bf ef 80 71 40 71 4f 81 c0 81 00 81 40 '.PT...q@qO.....@'
  81 80 01 01 01 01 30 2a 00 98 51 00 2a 40 30 70 '......0*..Q.*@0p'
  13 00 78 2d 11 00 00 1e 00 00 00 fc 00 54 45 52 '..x-.........TER'
  52 41 20 4c 43 44 34 33 31 39 00 00 00 ff 00 43 'RA LCD4319.....C'
  46 31 39 39 33 30 30 30 39 35 31 46 00 00 00 fd 'F1993000951F....'
  00 32 4c 1f 52 0e 00 0a 20 20 20 20 20 20 00 76 '.2L.R...      .v'
Checksum: 0x76

----------------

Failures:

Block 0, Base EDID:
  Basic Display Parameters & Features: sRGB is signaled, but the chromaticities do not match.
Block 1, Base EDID:
  Unknown Extension Block.
EDID:
  Base EDID: EDID specified 0 extension block(s), but found 1 extension block(s).

EDID conformity: FAIL
