edid-decode (hex):

00 ff ff ff ff ff ff 00 26 cd 1d 61 37 39 32 30
0c 20 01 03 68 34 1d 78 2a af e5 a6 55 51 9b 25
0d 50 54 25 4b 00 d1 c0 81 80 95 00 b3 00 81 40
01 01 01 01 01 01 02 3a 80 18 71 38 2d 40 58 2c
45 00 09 25 21 00 00 1e 00 00 00 fd 00 37 4c 18
55 12 00 0a 20 20 20 20 20 20 00 00 00 ff 00 31
31 33 35 37 32 31 32 32 30 32 39 37 00 00 00 fc
00 50 4c 58 32 34 38 31 48 0a 20 20 20 20 00 c3

00 ff ff ff ff ff ff 00 26 cd 1d 61 37 39 32 30
0c 20 01 03 68 34 1d 78 2a af e5 a6 55 51 9b 25
0d 50 54 25 4b 00 d1 c0 81 80 95 00 b3 00 81 40
01 01 01 01 01 01 02 3a 80 18 71 38 2d 40 58 2c
45 00 09 25 21 00 00 1e 00 00 00 fd 00 37 4c 18
55 12 00 0a 20 20 20 20 20 20 00 00 00 ff 00 31
31 33 35 37 32 31 32 32 30 32 39 37 00 00 00 fc
00 50 4c 58 32 34 38 31 48 0a 20 20 20 20 00 c3

----------------

Block 0, Base EDID:
  EDID Structure Version & Revision: 1.3
  Vendor & Product Identification:
    Manufacturer: IVM
    Model: 24861
    Serial Number: ...
    Made in: week 12 of 2022
  Basic Display Parameters & Features:
    Analog display
    Signal Level Standard: 0.700 : 0.000 : 0.700 V p-p
    Blank level equals black level
    Sync: Separate
    Maximum image size: 52 cm x 29 cm
    Gamma: 2.20
    DPMS levels: Off
    RGB color display
    First detailed timing is the preferred timing
  Color Characteristics:
    Red  : 0.6503, 0.3339
    Green: 0.3193, 0.6083
    Blue : 0.1474, 0.0527
    White: 0.3134, 0.3291
  Established Timings I & II:
    DMT 0x04:   640x480    59.940476 Hz   4:3     31.469 kHz     25.175000 MHz
    DMT 0x06:   640x480    75.000000 Hz   4:3     37.500 kHz     31.500000 MHz
    DMT 0x09:   800x600    60.316541 Hz   4:3     37.879 kHz     40.000000 MHz
    DMT 0x0b:   800x600    75.000000 Hz   4:3     46.875 kHz     49.500000 MHz
    DMT 0x10:  1024x768    60.003840 Hz   4:3     48.363 kHz     65.000000 MHz
    DMT 0x12:  1024x768    75.028582 Hz   4:3     60.023 kHz     78.750000 MHz
    DMT 0x24:  1280x1024   75.024675 Hz   5:4     79.976 kHz    135.000000 MHz
  Standard Timings:
    DMT 0x52:  1920x1080   60.000000 Hz  16:9     67.500 kHz    148.500000 MHz
    DMT 0x23:  1280x1024   60.019740 Hz   5:4     63.981 kHz    108.000000 MHz
    DMT 0x2f:  1440x900    59.887445 Hz  16:10    55.935 kHz    106.500000 MHz
    DMT 0x3a:  1680x1050   59.954250 Hz  16:10    65.290 kHz    146.250000 MHz
    DMT 0x20:  1280x960    60.000000 Hz   4:3     60.000 kHz    108.000000 MHz
  Detailed Timing Descriptors:
    DTD 1:  1920x1080   60.000000 Hz  16:9     67.500 kHz    148.500000 MHz (521 mm x 293 mm)
                 Hfront   88 Hsync  44 Hback  148 Hpol P
                 Vfront    4 Vsync   5 Vback   36 Vpol P
    Display Range Limits:
      Monitor ranges (GTF): 55-76 Hz V, 24-85 kHz H, max dotclock 180 MHz
    Display Product Serial Number: ...
    Display Product Name: 'PLX2481H'
Checksum: 0xc3

----------------

Block 1, Unknown EDID Extension Block 0x00:
  00 ff ff ff ff ff ff 00 26 cd 1d 61 37 39 32 30 '........&..a7920'
  0c 20 01 03 68 34 1d 78 2a af e5 a6 55 51 9b 25 '. ..h4.x*...UQ.%'
  0d 50 54 25 4b 00 d1 c0 81 80 95 00 b3 00 81 40 '.PT%K..........@'
  01 01 01 01 01 01 02 3a 80 18 71 38 2d 40 58 2c '.......:..q8-@X,'
  45 00 09 25 21 00 00 1e 00 00 00 fd 00 37 4c 18 'E..%!........7L.'
  55 12 00 0a 20 20 20 20 20 20 00 00 00 ff 00 31 'U...      .....1'
  31 33 35 37 32 31 32 32 30 32 39 37 00 00 00 fc '135721220297....'
  00 50 4c 58 32 34 38 31 48 0a 20 20 20 20 00 c3 '.PLX2481H.    ..'
Checksum: 0xc3

----------------

Failures:

Block 1, Base EDID:
  Unknown Extension Block.
EDID:
  Base EDID: EDID specified 0 extension block(s), but found 1 extension block(s).

EDID conformity: FAIL
