edid-decode (hex):

00 ff ff ff ff ff ff 00 09 e5 3a 0a 00 00 00 00
16 1f 01 04 a5 1e 13 78 03 86 15 a3 54 4d 9b 27
0f 50 54 00 00 00 01 01 01 01 01 01 01 01 01 01
01 01 01 01 01 01 1a 98 80 a0 70 b0 64 40 30 20
35 00 2e bc 10 00 00 1a 60 3f 80 a0 70 b0 64 40
30 20 35 00 2e bc 10 00 00 1a 00 00 00 fd 00 30
90 bb bb 27 01 0a 20 20 20 20 20 20 00 00 00 fe
00 4e 45 31 34 30 57 55 4d 2d 4e 58 31 0a 00 48

----------------

Block 0, Base EDID:
  EDID Structure Version & Revision: 1.4
  Vendor & Product Identification:
    Manufacturer: BOE
    Model: 2618
    Made in: week 22 of 2021
  Basic Display Parameters & Features:
    Digital display
    Bits per primary color channel: 8
    DisplayPort interface
    Maximum image size: 30 cm x 19 cm
    Gamma: 2.20
    Supported color formats: RGB 4:4:4
    First detailed timing includes the native pixel format and preferred refresh rate
    Display is continuous frequency
  Color Characteristics:
    Red  : 0.6386, 0.3281
    Green: 0.3017, 0.6074
    Blue : 0.1523, 0.0595
    White: 0.3134, 0.3291
  Established Timings I & II: none
  Standard Timings: none
  Detailed Timing Descriptors:
    DTD 1:  1920x1200  144.001479 Hz  16:10   187.202 kHz    389.380000 MHz (302 mm x 188 mm)
                 Hfront   48 Hsync  32 Hback   80 Hpol P
                 Vfront    3 Vsync   5 Vback   92 Vpol N
    DTD 2:  1920x1200   60.000000 Hz  16:10    78.000 kHz    162.240000 MHz (302 mm x 188 mm)
                 Hfront   48 Hsync  32 Hback   80 Hpol P
                 Vfront    3 Vsync   5 Vback   92 Vpol N
    Display Range Limits:
      Monitor ranges (Bare Limits): 48-144 Hz V, 187-187 kHz H, max dotclock 390 MHz
    Alphanumeric Data String: 'NE140WUM-NX1'
Checksum: 0x48

----------------

Warnings:

Block 0, Base EDID:
  Missing Display Product Name.
EDID:
  Base EDID: Some timings are out of range of the Monitor Ranges:
    Horizontal Freq: 78.000 - 187.201 kHz (Monitor: 187.000 - 187.000 kHz)

EDID conformity: PASS
