
EDID (hex):
00ffffffffffff00220e7c3301010101
191a010380351e782a8ef5a755509e26
105054a10800d1c081c0a9c09500b300
810081800101023a801871382d40582c
4500132b2100001e000000fd00324c18
5011000a202020202020000000fc0048
502032346f0a202020202020000000ff
00434e4b363235314342330a20200193

Extracted contents:
header:          00 ff ff ff ff ff ff 00
serial number:   22 0e 7c 33 01 01 01 01 19 1a
version:         01 03
basic params:    80 35 1e 78 2a
chroma info:     8e f5 a7 55 50 9e 26 10 50 54
established:     a1 08 00
standard:        d1 c0 81 c0 a9 c0 95 00 b3 00 81 00 81 80 01 01
descriptor 1:    02 3a 80 18 71 38 2d 40 58 2c 45 00 13 2b 21 00 00 1e
descriptor 2:    00 00 00 fd 00 32 4c 18 50 11 00 0a 20 20 20 20 20 20
descriptor 3:    00 00 00 fc 00 48 50 20 32 34 6f 0a 20 20 20 20 20 20
descriptor 4:    00 00 00 ff 00 43 4e 4b 36 32 35 31 43 42 33 0a 20 20
extensions:      01
checksum:        93

EDID version: 1.3
Manufacturer: HPN Model 337c Serial Number --
Made in week 25 of 2016
Digital display
Maximum image size: 53 cm x 30 cm
Gamma: 2.20
DPMS levels: Off
RGB color display
First detailed timing is preferred timing
Display x,y Chromaticity:
  Red:   0.6542, 0.3320
  Green: 0.3154, 0.6191
  Blue:  0.1513, 0.0654
  White: 0.3134, 0.3291
Established timings supported:
  720x400@70Hz 9:5 HorFreq: 31469 Hz Clock: 28.320 MHz
  640x480@60Hz 4:3 HorFreq: 31469 Hz Clock: 25.175 MHz
  800x600@60Hz 4:3 HorFreq: 37900 Hz Clock: 40.000 MHz
  1024x768@60Hz 4:3 HorFreq: 48400 Hz Clock: 65.000 MHz
Standard timings supported:
  1920x1080@60Hz 16:9
  1280x720@60Hz 16:9
  1600x900@60Hz 16:9
  1440x900@60Hz 16:10 HorFreq: 55500 Hz Clock: 88.750 MHz
  1680x1050@60Hz 16:10 HorFreq: 64700 Hz Clock: 119.000 MHz
  1280x800@60Hz 16:10
  1280x1024@60Hz 5:4 HorFreq: 64000 Hz Clock: 108.000 MHz
Detailed mode: Clock 148.500 MHz, 531 mm x 299 mm
               1920 2008 2052 2200 hborder 0
               1080 1084 1089 1125 vborder 0
               +hsync +vsync 
               VertFreq: 60 Hz, HorFreq: 67500 Hz
Monitor ranges (GTF): 50-76Hz V, 24-80kHz H, max dotclock 170MHz
Monitor name: HP 24o
Serial number: --
Has 1 extension blocks
Checksum: 0x93 (valid)
