edid-decode (hex):

00 ff ff ff ff ff ff 00 38 a3 fa 65 01 01 01 01
30 0d 01 03 0e 1e 17 78 ea b1 45 a1 58 4f 95 26
1d 50 54 bf ee 00 01 01 01 01 01 01 01 01 01 01
01 01 01 01 01 01 c3 1e 00 20 41 00 20 30 10 60
13 00 30 e4 10 00 00 1e 00 00 00 fd 00 37 4b 1f
3c 08 00 0a 20 20 20 20 20 20 00 00 00 fc 00 4e
45 43 20 4c 43 44 31 35 36 30 4e 58 00 00 00 ff
00 33 5a 31 34 31 31 34 34 59 42 0a 20 20 00 91

----------------

Block 0, Base EDID:
  EDID Structure Version & Revision: 1.3
  Vendor & Product Identification:
    Manufacturer: NEC
    Model: 26106
    Serial Number: ...
    Made in: week 48 of 2003
  Basic Display Parameters & Features:
    Analog display
    Input voltage level: 0.7/0.3 V
    Blank level equals black level
    Sync: Separate Composite SyncOnGreen
    Maximum image size: 30 cm x 23 cm
    Gamma: 2.20
    DPMS levels: Standby Suspend Off
    RGB color display
    First detailed timing is the preferred timing
  Color Characteristics:
    Red  : 0.6308, 0.3466
    Green: 0.3085, 0.5830
    Blue : 0.1494, 0.1132
    White: 0.3134, 0.3291
  Established Timings I & II:
    IBM     :   720x400    70.081663 Hz   9:5     31.467 kHz     28.320000 MHz
    DMT 0x04:   640x480    59.940476 Hz   4:3     31.469 kHz     25.175000 MHz
    Apple   :   640x480    66.666667 Hz   4:3     35.000 kHz     30.240000 MHz
    DMT 0x05:   640x480    72.808802 Hz   4:3     37.861 kHz     31.500000 MHz
    DMT 0x06:   640x480    75.000000 Hz   4:3     37.500 kHz     31.500000 MHz
    DMT 0x08:   800x600    56.250000 Hz   4:3     35.156 kHz     36.000000 MHz
    DMT 0x09:   800x600    60.316541 Hz   4:3     37.879 kHz     40.000000 MHz
    DMT 0x0a:   800x600    72.187572 Hz   4:3     48.077 kHz     50.000000 MHz
    DMT 0x0b:   800x600    75.000000 Hz   4:3     46.875 kHz     49.500000 MHz
    Apple   :   832x624    74.551266 Hz   4:3     49.726 kHz     57.284000 MHz
    DMT 0x10:  1024x768    60.003840 Hz   4:3     48.363 kHz     65.000000 MHz
    DMT 0x11:  1024x768    70.069359 Hz   4:3     56.476 kHz     75.000000 MHz
    DMT 0x12:  1024x768    75.028582 Hz   4:3     60.023 kHz     78.750000 MHz
  Standard Timings: none
  Detailed Timing Descriptors:
    DTD 1:  1024x768    75.028582 Hz   4:3     60.023 kHz     78.750000 MHz (304 mm x 228 mm)
                 Hfront   16 Hsync  96 Hback  176 Hpol P
                 Vfront    1 Vsync   3 Vback   28 Vpol P
    Display Range Limits:
      Monitor ranges (GTF): 55-75 Hz V, 31-60 kHz H, max dotclock 80 MHz
    Display Product Name: 'NEC LCD1560NX'
    Display Product Serial Number: ...
Checksum: 0x91

----------------

EDID conformity: PASS
