edid-decode (hex):

00 ff ff ff ff ff ff 00 34 38 6e 07 c0 08 00 00
16 0e 01 03 a8 22 1b 00 e8 e7 3a 9b 57 49 90 24
16 4a 50 bf ef 80 31 40 45 40 61 40 81 80 01 01
01 01 01 01 01 01 30 2a 00 98 51 00 2a 40 30 70
13 00 52 0e 11 00 00 1e 00 00 00 fd 00 38 4b 1e
54 0e 00 0a 20 20 20 20 20 20 00 00 00 fc 00 42
5f 31 30 31 39 32 30 0a 20 20 20 20 00 00 00 10
20 20 20 20 20 20 20 20 20 20 20 20 20 20 00 fd

00 ff ff ff ff ff ff 00 34 38 6e 07 c0 08 00 00
16 0e 01 03 a8 22 1b 00 e8 e7 3a 9b 57 49 90 24
16 4a 50 bf ef 80 31 40 45 40 61 40 81 80 01 01
01 01 01 01 01 01 30 2a 00 98 51 00 2a 40 30 70
13 00 52 0e 11 00 00 1e 00 00 00 fd 00 38 4b 1e
54 0e 00 0a 20 20 20 20 20 20 00 00 00 fc 00 42
5f 31 30 31 39 32 30 0a 20 20 20 20 00 00 00 10
20 20 20 20 20 20 20 20 20 20 20 20 20 20 00 fd

----------------

Block 0, Base EDID:
  EDID Structure Version & Revision: 1.3
  Vendor & Product Identification:
    Manufacturer: MAX
    Model: 1902
    Serial Number: ...
    Made in: week 22 of 2004
  Basic Display Parameters & Features:
    Digital display
    Maximum image size: 34 cm x 27 cm
    Gamma: 1.00
    DPMS levels: Standby Suspend Off
    RGB color display
  Color Characteristics:
    Red  : 0.6083, 0.3417
    Green: 0.2861, 0.5654
    Blue : 0.1406, 0.0888
    White: 0.2910, 0.3144
  Established Timings I & II:
    IBM     :   720x400    70.081663 Hz   9:5     31.467 kHz     28.320000 MHz
    DMT 0x04:   640x480    59.940476 Hz   4:3     31.469 kHz     25.175000 MHz
    Apple   :   640x480    66.666667 Hz   4:3     35.000 kHz     30.240000 MHz
    DMT 0x05:   640x480    72.808802 Hz   4:3     37.861 kHz     31.500000 MHz
    DMT 0x06:   640x480    75.000000 Hz   4:3     37.500 kHz     31.500000 MHz
    DMT 0x08:   800x600    56.250000 Hz   4:3     35.156 kHz     36.000000 MHz
    DMT 0x09:   800x600    60.316541 Hz   4:3     37.879 kHz     40.000000 MHz
    DMT 0x0a:   800x600    72.187572 Hz   4:3     48.077 kHz     50.000000 MHz
    DMT 0x0b:   800x600    75.000000 Hz   4:3     46.875 kHz     49.500000 MHz
    Apple   :   832x624    74.551266 Hz   4:3     49.726 kHz     57.284000 MHz
    DMT 0x10:  1024x768    60.003840 Hz   4:3     48.363 kHz     65.000000 MHz
    DMT 0x11:  1024x768    70.069359 Hz   4:3     56.476 kHz     75.000000 MHz
    DMT 0x12:  1024x768    75.028582 Hz   4:3     60.023 kHz     78.750000 MHz
    DMT 0x24:  1280x1024   75.024675 Hz   5:4     79.976 kHz    135.000000 MHz
    Apple   :  1152x870    75.061550 Hz 192:145   68.681 kHz    100.000000 MHz
  Standard Timings:
    DMT 0x04:   640x480    59.940476 Hz   4:3     31.469 kHz     25.175000 MHz
    DMT 0x09:   800x600    60.316541 Hz   4:3     37.879 kHz     40.000000 MHz
    DMT 0x10:  1024x768    60.003840 Hz   4:3     48.363 kHz     65.000000 MHz
    DMT 0x23:  1280x1024   60.019740 Hz   5:4     63.981 kHz    108.000000 MHz
  Detailed Timing Descriptors:
    DTD 1:  1280x1024   60.019740 Hz   5:4     63.981 kHz    108.000000 MHz (338 mm x 270 mm)
                 Hfront   48 Hsync 112 Hback  248 Hpol P
                 Vfront    1 Vsync   3 Vback   38 Vpol P
    Display Range Limits:
      Monitor ranges (GTF): 56-75 Hz V, 30-84 kHz H, max dotclock 140 MHz
    Display Product Name: 'B_101920'
    Dummy Descriptor:
Checksum: 0xfd

----------------

Block 1, Unknown EDID Extension Block 0x00:
  00 ff ff ff ff ff ff 00 34 38 6e 07 c0 08 00 00 '........48n.....'
  16 0e 01 03 a8 22 1b 00 e8 e7 3a 9b 57 49 90 24 '....."....:.WI.$'
  16 4a 50 bf ef 80 31 40 45 40 61 40 81 80 01 01 '.JP...1@E@a@....'
  01 01 01 01 01 01 30 2a 00 98 51 00 2a 40 30 70 '......0*..Q.*@0p'
  13 00 52 0e 11 00 00 1e 00 00 00 fd 00 38 4b 1e '..R..........8K.'
  54 0e 00 0a 20 20 20 20 20 20 00 00 00 fc 00 42 'T...      .....B'
  5f 31 30 31 39 32 30 0a 20 20 20 20 00 00 00 10 '_101920.    ....'
  20 20 20 20 20 20 20 20 20 20 20 20 20 20 00 fd '              ..'
Checksum: 0xfd

----------------

Failures:

Block 0, Base EDID:
  Basic Display Parameters & Features: Digital Video Interface Standard set to reserved value 0x28.
  Basic Display Parameters & Features: EDID 1.3 requires that the first detailed timing is the preferred timing.
  Display Descriptor #4: Monitor descriptor block has byte 4 nonzero (0x20).
  Dummy Descriptor: Dummy block filled with garbage.
Block 1, Base EDID:
  Unknown Extension Block.
EDID:
  Base EDID: EDID specified 0 extension block(s), but found 1 extension block(s).

EDID conformity: FAIL
