
EDID (hex):
00ffffffffffff003669a83c01010101
301e0104b53c2278eb55b5ab5146ab26
0b50543fcf00d1c00101010101018180
9500b3000101f65b006ea0a01f501720
180455502100001e000000fd0030a5f3
f33c010a202020202020000000fc004d
53492047323733510a202020000000ff
00434138413432304230303336340121
02033d714e020311121304292f901f40
3f615f230917078301000067030c0010
00383c67d85dc4017880036d1a000002
0130a5000000000000e305e30185f800
50a0a016500a3c350055502100001a6f
c200a0a0a05550302035005550210000
1a728d8050703812401e193500555021
00001a0000000000000000000000002d

edid-decode (hex):

00 ff ff ff ff ff ff 00 36 69 a8 3c 01 01 01 01
30 1e 01 04 b5 3c 22 78 eb 55 b5 ab 51 46 ab 26
0b 50 54 3f cf 00 d1 c0 01 01 01 01 01 01 81 80
95 00 b3 00 01 01 f6 5b 00 6e a0 a0 1f 50 17 20
18 04 55 50 21 00 00 1e 00 00 00 fd 00 30 a5 f3
f3 3c 01 0a 20 20 20 20 20 20 00 00 00 fc 00 4d
53 49 20 47 32 37 33 51 0a 20 20 20 00 00 00 ff
00 43 41 38 41 34 32 30 42 30 30 33 36 34 01 21

02 03 3d 71 4e 02 03 11 12 13 04 29 2f 90 1f 40
3f 61 5f 23 09 17 07 83 01 00 00 67 03 0c 00 10
00 38 3c 67 d8 5d c4 01 78 80 03 6d 1a 00 00 02
01 30 a5 00 00 00 00 00 00 e3 05 e3 01 85 f8 00
50 a0 a0 16 50 0a 3c 35 00 55 50 21 00 00 1a 6f
c2 00 a0 a0 a0 55 50 30 20 35 00 55 50 21 00 00
1a 72 8d 80 50 70 38 12 40 1e 19 35 00 55 50 21
00 00 1a 00 00 00 00 00 00 00 00 00 00 00 00 2d

----------------

Block 0, Base EDID:
  EDID Structure Version & Revision: 1.4
  Vendor & Product Identification:
    Manufacturer: MSI
    Model: 15528
    Serial Number: 16843009
    Made in: week 48 of 2020
  Basic Display Parameters & Features:
    Digital display
    Bits per primary color channel: 10
    DisplayPort interface
    Maximum image size: 60 cm x 34 cm
    Gamma: 2.20
    DPMS levels: Standby Suspend Off
    Supported color formats: RGB 4:4:4, YCrCb 4:4:4
    First detailed timing includes the native pixel format and preferred refresh rate
    Display is continuous frequency
  Color Characteristics:
    Red  : 0.6689, 0.3173
    Green: 0.2744, 0.6689
    Blue : 0.1503, 0.0458
    White: 0.3134, 0.3291
  Established Timings I & II:
    DMT 0x04:   640x480    59.940476 Hz   4:3     31.469 kHz     25.175000 MHz
    Apple   :   640x480    66.666667 Hz   4:3     35.000 kHz     30.240000 MHz
    DMT 0x05:   640x480    72.808802 Hz   4:3     37.861 kHz     31.500000 MHz
    DMT 0x06:   640x480    75.000000 Hz   4:3     37.500 kHz     31.500000 MHz
    DMT 0x08:   800x600    56.250000 Hz   4:3     35.156 kHz     36.000000 MHz
    DMT 0x09:   800x600    60.316541 Hz   4:3     37.879 kHz     40.000000 MHz
    DMT 0x0a:   800x600    72.187572 Hz   4:3     48.077 kHz     50.000000 MHz
    DMT 0x0b:   800x600    75.000000 Hz   4:3     46.875 kHz     49.500000 MHz
    DMT 0x10:  1024x768    60.003840 Hz   4:3     48.363 kHz     65.000000 MHz
    DMT 0x11:  1024x768    70.069359 Hz   4:3     56.476 kHz     75.000000 MHz
    DMT 0x12:  1024x768    75.028582 Hz   4:3     60.023 kHz     78.750000 MHz
    DMT 0x24:  1280x1024   75.024675 Hz   5:4     79.976 kHz    135.000000 MHz
  Standard Timings:
    DMT 0x52:  1920x1080   60.000000 Hz  16:9     67.500 kHz    148.500000 MHz
    DMT 0x23:  1280x1024   60.019740 Hz   5:4     63.981 kHz    108.000000 MHz
    DMT 0x2f:  1440x900    59.887445 Hz  16:10    55.935 kHz    106.500000 MHz
    DMT 0x3a:  1680x1050   59.954250 Hz  16:10    65.290 kHz    146.250000 MHz
  Detailed Timing Descriptors:
    DTD 1:  2560x1440   59.940370 Hz  16:9     88.172 kHz    235.420000 MHz (597 mm x 336 mm)
                 Hfront   23 Hsync  32 Hback   55 Hpol P
                 Vfront   17 Vsync   8 Vback    6 Vpol P
    Display Range Limits:
      Monitor ranges (Bare Limits): 48-165 Hz V, 243-243 kHz H, max dotclock 600 MHz
    Display Product Name: 'MSI G273Q'
    Display Product Serial Number: 'CA8A420B00364'
  Extension blocks: 1
Checksum: 0x21

----------------

Block 1, CTA-861 Extension Block:
  Revision: 3
  Basic audio support
  Supports YCbCr 4:4:4
  Supports YCbCr 4:2:2
  Native detailed modes: 1
  Video Data Block:
    VIC   2:   720x480    59.940060 Hz   4:3     31.469 kHz     27.000000 MHz
    VIC   3:   720x480    59.940060 Hz  16:9     31.469 kHz     27.000000 MHz
    VIC  17:   720x576    50.000000 Hz   4:3     31.250 kHz     27.000000 MHz
    VIC  18:   720x576    50.000000 Hz  16:9     31.250 kHz     27.000000 MHz
    VIC  19:  1280x720    50.000000 Hz  16:9     37.500 kHz     74.250000 MHz
    VIC   4:  1280x720    60.000000 Hz  16:9     45.000 kHz     74.250000 MHz
    VIC  41:  1280x720   100.000000 Hz  16:9     75.000 kHz    148.500000 MHz
    VIC  47:  1280x720   120.000000 Hz  16:9     90.000 kHz    148.500000 MHz
    VIC  16:  1920x1080   60.000000 Hz  16:9     67.500 kHz    148.500000 MHz (native)
    VIC  31:  1920x1080   50.000000 Hz  16:9     56.250 kHz    148.500000 MHz
    VIC  64:  1920x1080  100.000000 Hz  16:9    112.500 kHz    297.000000 MHz
    VIC  63:  1920x1080  120.000000 Hz  16:9    135.000 kHz    297.000000 MHz
    VIC  97:  3840x2160   60.000000 Hz  16:9    135.000 kHz    594.000000 MHz
    VIC  95:  3840x2160   30.000000 Hz  16:9     67.500 kHz    297.000000 MHz
  Audio Data Block:
    Linear PCM:
      Max channels: 2
      Supported sample rates (kHz): 96 48 44.1 32
      Supported sample sizes (bits): 24 20 16
  Speaker Allocation Data Block:
    FL/FR - Front Left/Right
  Vendor-Specific Data Block (HDMI), OUI 00-0C-03:
    Source physical address: 1.0.0.0
    DC_36bit
    DC_30bit
    DC_Y444
    Maximum TMDS clock: 300 MHz
  Vendor-Specific Data Block (HDMI Forum), OUI C4-5D-D8:
    Version: 1
    Maximum TMDS Character Rate: 600 MHz
    SCDC Present
    Supports 12-bits/component Deep Color 4:2:0 Pixel Encoding
    Supports 10-bits/component Deep Color 4:2:0 Pixel Encoding
  Vendor-Specific Data Block (AMD), OUI 00-00-1A:
    Version: 2.1
    Minimum Refresh Rate: 48 Hz
    Maximum Refresh Rate: 165 Hz
    Flags 1.x: 0x00
    Flags 2.x: 0x00
    Maximum luminance: 0 (50.000 cd/m^2)
    Minimum luminance: 0 (0.000 cd/m^2)
    Unknown: 0x00 0x00
  Colorimetry Data Block:
    xvYCC601
    xvYCC709
    BT2020cYCC
    BT2020YCC
    BT2020RGB
    Gamut Boundary Description Metadata Profile P0
  Detailed Timing Descriptors:
    DTD 2:  2560x1440  164.834909 Hz  16:9    240.989 kHz    636.210000 MHz (597 mm x 336 mm)
                 Hfront   10 Hsync  60 Hback   10 Hpol P
                 Vfront    3 Vsync   5 Vback   14 Vpol N
    DTD 3:  2560x1440  119.997589 Hz  16:9    182.996 kHz    497.750000 MHz (597 mm x 336 mm)
                 Hfront   48 Hsync  32 Hback   80 Hpol P
                 Vfront    3 Vsync   5 Vback   77 Vpol N
    DTD 4:  1920x1080  164.890710 Hz  16:9    181.050 kHz    362.100000 MHz (597 mm x 336 mm)
                 Hfront   30 Hsync  25 Hback   25 Hpol P
                 Vfront    3 Vsync   5 Vback   10 Vpol N
Checksum: 0x2d  Unused space in Extension Block: 12 bytes


