
EDID (hex):
00ffffffffffff0010ac14f04c523130
0d1601036e342078ee1ec5ae4f34b126
0e5054a54b008180a940d100714f0101
010101010101283c80a070b023403020
360006442100001a000000ff00433539
324d32334d3031524c0a000000fc0044
454c4c2055323431300a2020000000fd
00384c1e5111000a202020202020007e

Extracted contents:
header:          00 ff ff ff ff ff ff 00
serial number:   10 ac 14 f0 4c 52 31 30 0d 16
version:         01 03
basic params:    6e 34 20 78 ee
chroma info:     1e c5 ae 4f 34 b1 26 0e 50 54
established:     a5 4b 00
standard:        81 80 a9 40 d1 00 71 4f 01 01 01 01 01 01 01 01
descriptor 1:    28 3c 80 a0 70 b0 23 40 30 20 36 00 06 44 21 00 00 1a
descriptor 2:    00 00 00 ff 00 43 35 39 32 4d 32 33 4d 30 31 52 4c 0a
descriptor 3:    00 00 00 fc 00 44 45 4c 4c 20 55 32 34 31 30 0a 20 20
descriptor 4:    00 00 00 fd 00 38 4c 1e 51 11 00 0a 20 20 20 20 20 20
extensions:      00
checksum:        7e

EDID version: 1.3
Manufacturer: DEL Model f014 Serial Number --
Made in week 13 of 2012
Analog display, Input voltage level: 0.7/0.7 V
Sync: Separate Composite SyncOnGreen 
Maximum image size: 52 cm x 32 cm
Gamma: 2.20
DPMS levels: Standby Suspend Off
RGB color display
Default (sRGB) color space is primary color space
First detailed timing is preferred timing
Display x,y Chromaticity:
  Red:   0.6796, 0.3095
  Green: 0.2060, 0.6933
  Blue:  0.1513, 0.0546
  White: 0.3134, 0.3291
Established timings supported:
  720x400@70Hz 9:5 HorFreq: 31469 Hz Clock: 28.320 MHz
  640x480@60Hz 4:3 HorFreq: 31469 Hz Clock: 25.175 MHz
  640x480@75Hz 4:3 HorFreq: 37500 Hz Clock: 31.500 MHz
  800x600@60Hz 4:3 HorFreq: 37900 Hz Clock: 40.000 MHz
  800x600@75Hz 4:3 HorFreq: 46900 Hz Clock: 49.500 MHz
  1024x768@60Hz 4:3 HorFreq: 48400 Hz Clock: 65.000 MHz
  1024x768@75Hz 4:3 HorFreq: 60000 Hz Clock: 78.750 MHz
  1280x1024@75Hz 5:4 HorFreq: 80000 Hz Clock: 135.000 MHz
Standard timings supported:
  1280x1024@60Hz 5:4 HorFreq: 64000 Hz Clock: 108.000 MHz
  1600x1200@60Hz 4:3 HorFreq: 75000 Hz Clock: 162.000 MHz
  1920x1200@60Hz 16:10 HorFreq: 74000 Hz Clock: 154.000 MHz
  1152x864@75Hz 4:3 HorFreq: 67500 Hz Clock: 108.000 MHz
Detailed mode: Clock 154.000 MHz, 518 mm x 324 mm
               1920 1968 2000 2080 hborder 0
               1200 1203 1209 1235 vborder 0
               +hsync -vsync 
               VertFreq: 59 Hz, HorFreq: 74038 Hz
Serial number: --
Monitor name: DELL U2410
Monitor ranges (GTF): 56-76Hz V, 30-81kHz H, max dotclock 170MHz
Checksum: 0x7e (valid)
EDID block does NOT conform to EDID 1.3!
	sRGB is signaled, but the chromaticities do not match
