edid-decode (hex):

00 ff ff ff ff ff ff 00 30 ae d2 66 00 00 00 00
01 20 01 03 80 30 1a 78 2a 23 95 a8 54 4f 9d 26
12 50 54 af ef 00 71 4f 81 80 81 8a 95 00 a9 c0
a9 cf b3 00 01 01 02 3a 80 18 71 38 2d 40 58 2c
45 00 de 04 11 00 00 1e 00 00 00 fc 00 44 32 32
65 2d 32 30 0a 20 20 20 20 20 00 00 00 fd 00 30
4b 1e 55 16 00 0a 20 20 20 20 20 20 00 00 00 ff
00 55 4b 48 48 46 47 56 54 0a 20 20 20 20 01 8c

02 03 25 f1 49 90 1f 04 13 12 11 03 02 01 23 09
0f 07 83 01 00 00 65 03 0c 00 10 00 68 1a 00 00
01 01 30 4b e6 66 21 56 aa 51 00 1e 30 46 8f 33
00 de 04 11 00 00 1e 3b 56 80 b0 72 38 32 40 88
d0 35 00 de 04 11 00 00 1a 7c 2e 90 a0 60 1a 1e
40 30 20 36 00 de 04 11 00 00 1a 00 00 00 00 00
00 00 00 00 00 00 00 00 00 00 00 00 00 00 00 00
00 00 00 00 00 00 00 00 00 00 00 00 00 00 00 83

00 ff ff ff ff ff ff 00 30 ae d2 66 00 00 00 00
01 20 01 03 80 30 1a 78 2a 23 95 a8 54 4f 9d 26
12 50 54 af ef 00 71 4f 81 80 81 8a 95 00 a9 c0
a9 cf b3 00 01 01 02 3a 80 18 71 38 2d 40 58 2c
45 00 de 04 11 00 00 1e 00 00 00 fc 00 44 32 32
65 2d 32 30 0a 20 20 20 20 20 00 00 00 fd 00 30
4b 1e 55 16 00 0a 20 20 20 20 20 20 00 00 00 ff
00 55 4b 48 48 46 47 56 54 0a 20 20 20 20 01 8c

02 03 25 f1 49 90 1f 04 13 12 11 03 02 01 23 09
0f 07 83 01 00 00 65 03 0c 00 10 00 68 1a 00 00
01 01 30 4b e6 66 21 56 aa 51 00 1e 30 46 8f 33
00 de 04 11 00 00 1e 3b 56 80 b0 72 38 32 40 88
d0 35 00 de 04 11 00 00 1a 7c 2e 90 a0 60 1a 1e
40 30 20 36 00 de 04 11 00 00 1a 00 00 00 00 00
00 00 00 00 00 00 00 00 00 00 00 00 00 00 00 00
00 00 00 00 00 00 00 00 00 00 00 00 00 00 00 83

----------------

Block 0, Base EDID:
  EDID Structure Version & Revision: 1.3
  Vendor & Product Identification:
    Manufacturer: LEN
    Model: 26322
    Made in: week 1 of 2022
  Basic Display Parameters & Features:
    Digital display
    Maximum image size: 48 cm x 26 cm
    Gamma: 2.20
    DPMS levels: Off
    RGB color display
    First detailed timing is the preferred timing
  Color Characteristics:
    Red  : 0.6562, 0.3300
    Green: 0.3085, 0.6162
    Blue : 0.1503, 0.0712
    White: 0.3134, 0.3291
  Established Timings I & II:
    IBM     :   720x400    70.081663 Hz   9:5     31.467 kHz     28.320000 MHz
    DMT 0x04:   640x480    59.940476 Hz   4:3     31.469 kHz     25.175000 MHz
    DMT 0x05:   640x480    72.808802 Hz   4:3     37.861 kHz     31.500000 MHz
    DMT 0x06:   640x480    75.000000 Hz   4:3     37.500 kHz     31.500000 MHz
    DMT 0x08:   800x600    56.250000 Hz   4:3     35.156 kHz     36.000000 MHz
    DMT 0x09:   800x600    60.316541 Hz   4:3     37.879 kHz     40.000000 MHz
    DMT 0x0a:   800x600    72.187572 Hz   4:3     48.077 kHz     50.000000 MHz
    DMT 0x0b:   800x600    75.000000 Hz   4:3     46.875 kHz     49.500000 MHz
    Apple   :   832x624    74.551266 Hz   4:3     49.726 kHz     57.284000 MHz
    DMT 0x10:  1024x768    60.003840 Hz   4:3     48.363 kHz     65.000000 MHz
    DMT 0x11:  1024x768    70.069359 Hz   4:3     56.476 kHz     75.000000 MHz
    DMT 0x12:  1024x768    75.028582 Hz   4:3     60.023 kHz     78.750000 MHz
    DMT 0x24:  1280x1024   75.024675 Hz   5:4     79.976 kHz    135.000000 MHz
  Standard Timings:
    DMT 0x15:  1152x864    75.000000 Hz   4:3     67.500 kHz    108.000000 MHz
    DMT 0x23:  1280x1024   60.019740 Hz   5:4     63.981 kHz    108.000000 MHz
    GTF     :  1280x1024   69.999805 Hz   5:4     74.620 kHz    128.943000 MHz
    DMT 0x2f:  1440x900    59.887445 Hz  16:10    55.935 kHz    106.500000 MHz
    DMT 0x53:  1600x900    60.000000 Hz  16:9     60.000 kHz    108.000000 MHz (RB)
    GTF     :  1600x900    75.000000 Hz  16:9     70.500 kHz    152.280000 MHz
    DMT 0x3a:  1680x1050   59.954250 Hz  16:10    65.290 kHz    146.250000 MHz
  Detailed Timing Descriptors:
    DTD 1:  1920x1080   60.000000 Hz  16:9     67.500 kHz    148.500000 MHz (478 mm x 260 mm)
                 Hfront   88 Hsync  44 Hback  148 Hpol P
                 Vfront    4 Vsync   5 Vback   36 Vpol P
    Display Product Name: 'D22e-20'
    Display Range Limits:
      Monitor ranges (GTF): 48-75 Hz V, 30-85 kHz H, max dotclock 220 MHz
    Display Product Serial Number: ...
  Extension blocks: 1
Checksum: 0x8c

----------------

Block 1, CTA-861 Extension Block:
  Revision: 3
  Underscans IT Video Formats by default
  Basic audio support
  Supports YCbCr 4:4:4
  Supports YCbCr 4:2:2
  Native detailed modes: 1
  Video Data Block:
    VIC  16:  1920x1080   60.000000 Hz  16:9     67.500 kHz    148.500000 MHz (native)
    VIC  31:  1920x1080   50.000000 Hz  16:9     56.250 kHz    148.500000 MHz
    VIC   4:  1280x720    60.000000 Hz  16:9     45.000 kHz     74.250000 MHz
    VIC  19:  1280x720    50.000000 Hz  16:9     37.500 kHz     74.250000 MHz
    VIC  18:   720x576    50.000000 Hz  16:9     31.250 kHz     27.000000 MHz
    VIC  17:   720x576    50.000000 Hz   4:3     31.250 kHz     27.000000 MHz
    VIC   3:   720x480    59.940060 Hz  16:9     31.469 kHz     27.000000 MHz
    VIC   2:   720x480    59.940060 Hz   4:3     31.469 kHz     27.000000 MHz
    VIC   1:   640x480    59.940476 Hz   4:3     31.469 kHz     25.175000 MHz
  Audio Data Block:
    Linear PCM:
      Max channels: 2
      Supported sample rates (kHz): 88.2 48 44.1 32
      Supported sample sizes (bits): 24 20 16
  Speaker Allocation Data Block:
    FL/FR - Front Left/Right
  Vendor-Specific Data Block (HDMI), OUI 00-0C-03:
    Source physical address: 1.0.0.0
  Vendor-Specific Data Block (AMD), OUI 00-00-1A:
    Version: 1.1
    Minimum Refresh Rate: 48 Hz
    Maximum Refresh Rate: 75 Hz
    Flags 1.x: 0xe6 (MCCS)
  Detailed Timing Descriptors:
    DTD 2:  1366x768    59.789541 Hz 683:384   47.712 kHz     85.500000 MHz (478 mm x 260 mm)
                 Hfront   70 Hsync 143 Hback  213 Hpol P
                 Vfront    3 Vsync   3 Vback   24 Vpol P
    DTD 3:  1920x1080   74.905668 Hz  16:9     84.643 kHz    220.750000 MHz (478 mm x 260 mm)
                 Hfront  136 Hsync 208 Hback  344 Hpol P
                 Vfront    3 Vsync   5 Vback   42 Vpol N
    DTD 4:  1680x1050   59.883253 Hz  16:10    64.674 kHz    119.000000 MHz (478 mm x 260 mm)
                 Hfront   48 Hsync  32 Hback   80 Hpol P
                 Vfront    3 Vsync   6 Vback   21 Vpol N
Checksum: 0x83  Unused space in Extension Block: 36 bytes

----------------

Block 2, Unknown EDID Extension Block 0x00:
  00 ff ff ff ff ff ff 00 30 ae d2 66 00 00 00 00 '........0..f....'
  01 20 01 03 80 30 1a 78 2a 23 95 a8 54 4f 9d 26 '. ...0.x*#..TO.&'
  12 50 54 af ef 00 71 4f 81 80 81 8a 95 00 a9 c0 '.PT...qO........'
  a9 cf b3 00 01 01 02 3a 80 18 71 38 2d 40 58 2c '.......:..q8-@X,'
  45 00 de 04 11 00 00 1e 00 00 00 fc 00 44 32 32 'E............D22'
  65 2d 32 30 0a 20 20 20 20 20 00 00 00 fd 00 30 'e-20.     .....0'
  4b 1e 55 16 00 0a 20 20 20 20 20 20 00 00 00 ff 'K.U...      ....'
  00 55 4b 48 48 46 47 56 54 0a 20 20 20 20 01 8c '.UKHHFGVT.    ..'
Checksum: 0x8c

----------------

Block 3, CTA-861 Extension Block:
  Revision: 3
  Underscans IT Video Formats by default
  Basic audio support
  Supports YCbCr 4:4:4
  Supports YCbCr 4:2:2
  Native detailed modes: 1
  Video Data Block:
    VIC  16:  1920x1080   60.000000 Hz  16:9     67.500 kHz    148.500000 MHz (native)
    VIC  31:  1920x1080   50.000000 Hz  16:9     56.250 kHz    148.500000 MHz
    VIC   4:  1280x720    60.000000 Hz  16:9     45.000 kHz     74.250000 MHz
    VIC  19:  1280x720    50.000000 Hz  16:9     37.500 kHz     74.250000 MHz
    VIC  18:   720x576    50.000000 Hz  16:9     31.250 kHz     27.000000 MHz
    VIC  17:   720x576    50.000000 Hz   4:3     31.250 kHz     27.000000 MHz
    VIC   3:   720x480    59.940060 Hz  16:9     31.469 kHz     27.000000 MHz
    VIC   2:   720x480    59.940060 Hz   4:3     31.469 kHz     27.000000 MHz
    VIC   1:   640x480    59.940476 Hz   4:3     31.469 kHz     25.175000 MHz
  Audio Data Block:
    Linear PCM:
      Max channels: 2
      Supported sample rates (kHz): 88.2 48 44.1 32
      Supported sample sizes (bits): 24 20 16
  Speaker Allocation Data Block:
    FL/FR - Front Left/Right
  Vendor-Specific Data Block (HDMI), OUI 00-0C-03:
    Source physical address: 1.0.0.0
  Vendor-Specific Data Block (AMD), OUI 00-00-1A:
    Version: 1.1
    Minimum Refresh Rate: 48 Hz
    Maximum Refresh Rate: 75 Hz
    Flags 1.x: 0xe6 (MCCS)
  Detailed Timing Descriptors:
    DTD 5:  1366x768    59.789541 Hz 683:384   47.712 kHz     85.500000 MHz (478 mm x 260 mm)
                 Hfront   70 Hsync 143 Hback  213 Hpol P
                 Vfront    3 Vsync   3 Vback   24 Vpol P
    DTD 6:  1920x1080   74.905668 Hz  16:9     84.643 kHz    220.750000 MHz (478 mm x 260 mm)
                 Hfront  136 Hsync 208 Hback  344 Hpol P
                 Vfront    3 Vsync   5 Vback   42 Vpol N
    DTD 7:  1680x1050   59.883253 Hz  16:10    64.674 kHz    119.000000 MHz (478 mm x 260 mm)
                 Hfront   48 Hsync  32 Hback   80 Hpol P
                 Vfront    3 Vsync   6 Vback   21 Vpol N
Checksum: 0x83  Unused space in Extension Block: 36 bytes

----------------

Warnings:

Block 1, CTA-861 Extension Block:
  Add a Colorimetry Data Block with the sRGB colorimetry bit set to avoid interop issues.
Block 3, CTA-861 Extension Block:
  Add a Colorimetry Data Block with the sRGB colorimetry bit set to avoid interop issues.
EDID:
  Base EDID: Some timings are out of range of the Monitor Ranges:
    Maximum Clock: 220.750 MHz (Monitor: 220.000 MHz)
    Could be due to a Monitor Range off-by-one rounding issue
  CTA-861: Multiple native progressive timings are defined.

Failures:

Block 1, CTA-861 Extension Block:
  Missing VCDB, needed for Set Selectable RGB Quantization to avoid interop issues.
Block 2, Base EDID:
  Unknown Extension Block.
Block 3, CTA-861 Extension Block:
  Video Data Block: Duplicate VIC 16.
  Video Data Block: Duplicate VIC 31.
  Video Data Block: Duplicate VIC 4.
  Video Data Block: Duplicate VIC 19.
  Video Data Block: Duplicate VIC 18.
  Video Data Block: Duplicate VIC 17.
  Video Data Block: Duplicate VIC 3.
  Video Data Block: Duplicate VIC 2.
  Video Data Block: Duplicate VIC 1.
  Speaker Allocation Data Block: Only one instance of this Data Block is allowed.
  Missing VCDB, needed for Set Selectable RGB Quantization to avoid interop issues.
EDID:
  Base EDID: EDID specified 1 extension block(s), but found 3 extension block(s).
  Base EDID: EDID 1.3 requires a Block Map Extension in Block 1 if there are more than 2 blocks in the EDID.

EDID conformity: FAIL
