edid-decode (hex):

00 ff ff ff ff ff ff 00 30 e4 54 03 00 00 00 00
00 16 01 03 80 1d 10 78 0a fc 35 96 58 57 8e 29
1f 50 54 00 00 00 01 01 01 01 01 01 01 01 01 01
01 01 01 01 01 01 78 1e 56 12 51 00 19 30 30 24
48 00 25 a5 10 00 00 19 00 00 00 00 00 00 00 00
00 00 00 00 00 00 00 00 00 00 00 00 00 fe 00 4c
47 20 44 69 73 70 6c 61 79 0a 20 20 00 00 00 fe
00 4c 50 31 33 33 57 48 32 2d 54 4c 46 32 00 13

----------------

Block 0, Base EDID:
  EDID Structure Version & Revision: 1.3
  Vendor & Product Identification:
    Manufacturer: LGD
    Model: 852
    Made in: 2012
  Basic Display Parameters & Features:
    Digital display
    Maximum image size: 29 cm x 16 cm
    Gamma: 2.20
    RGB color display
    First detailed timing is the preferred timing
  Color Characteristics:
    Red  : 0.5888, 0.3466
    Green: 0.3427, 0.5546
    Blue : 0.1601, 0.1240
    White: 0.3134, 0.3291
  Established Timings I & II: none
  Standard Timings: none
  Detailed Timing Descriptors:
    DTD 1:  1366x768    59.976010 Hz 683:384   47.561 kHz     78.000000 MHz (293 mm x 165 mm)
                 Hfront   48 Hsync  36 Hback  190 Hpol N
                 Vfront    4 Vsync   8 Vback   13 Vpol N
    Empty Descriptor
    Alphanumeric Data String: 'LG Display'
    Alphanumeric Data String: 'LP133WH2-TLF2'
Checksum: 0x13

----------------

Failures:

Block 0, Base EDID:
  Empty Descriptor: Use Dummy Descriptor instead of all zeroes.
  Missing Display Product Name.
  Missing Display Range Limits Descriptor.

EDID conformity: FAIL
