edid-decode (hex):

00 ff ff ff ff ff ff 00 59 af 06 15 01 00 00 00
31 15 01 03 81 a0 64 78 2a ed ec a6 55 4d 9e 25
0c 4e 53 a1 08 00 01 01 01 01 01 01 01 01 01 01
01 01 01 01 01 01 56 5e 00 a0 a0 a0 29 50 28 20
35 00 55 50 21 00 00 1a 24 36 80 a0 70 38 1f 40
30 20 25 00 30 30 31 00 00 1a 00 00 00 fd 00 38
3d 1e 5b 19 00 0a 20 20 20 20 20 20 00 00 00 fc
00 4c 43 44 20 57 51 48 44 20 48 44 4d 49 01 e8

02 03 1c f1 43 90 04 03 23 09 07 07 83 01 00 00
6b 03 0c 00 10 00 01 32 20 00 20 01 02 3a 80 18
71 38 2d 40 40 20 15 00 76 78 21 00 00 1a 01 1d
00 72 51 d0 1e 20 6e 28 55 00 bc 86 21 00 00 1e
8c 0a d0 8a 20 e0 2d 10 10 3e 96 00 bc 86 21 00
00 18 00 00 00 00 00 00 00 00 00 00 00 00 00 00
00 00 00 00 00 00 00 00 00 00 00 00 00 00 00 00
00 00 00 00 00 00 00 00 00 00 00 00 00 00 00 e9

00 ff ff ff ff ff ff 00 59 af 06 15 01 00 00 00
31 15 01 03 81 a0 64 78 2a ed ec a6 55 4d 9e 25
0c 4e 53 a1 08 00 01 01 01 01 01 01 01 01 01 01
01 01 01 01 01 01 56 5e 00 a0 a0 a0 29 50 28 20
35 00 55 50 21 00 00 1a 24 36 80 a0 70 38 1f 40
30 20 25 00 30 30 31 00 00 1a 00 00 00 fd 00 38
3d 1e 5b 19 00 0a 20 20 20 20 20 20 00 00 00 fc
00 4c 43 44 20 57 51 48 44 20 48 44 4d 49 01 e8

02 03 1c f1 43 90 04 03 23 09 07 07 83 01 00 00
6b 03 0c 00 10 00 01 32 20 00 20 01 02 3a 80 18
71 38 2d 40 40 20 15 00 76 78 21 00 00 1a 01 1d
00 72 51 d0 1e 20 6e 28 55 00 bc 86 21 00 00 1e
8c 0a d0 8a 20 e0 2d 10 10 3e 96 00 bc 86 21 00
00 18 00 00 00 00 00 00 00 00 00 00 00 00 00 00
00 00 00 00 00 00 00 00 00 00 00 00 00 00 00 00
00 00 00 00 00 00 00 00 00 00 00 00 00 00 00 e9

----------------

Block 0, Base EDID:
  EDID Structure Version & Revision: 1.3
  Vendor & Product Identification:
    Manufacturer: VMO
    Model: 5382
    Serial Number: ...
    Made in: week 49 of 2011
  Basic Display Parameters & Features:
    Digital display
    DFP 1.x compatible TMDS
    Maximum image size: 160 cm x 100 cm
    Gamma: 2.20
    DPMS levels: Off
    RGB color display
    First detailed timing is the preferred timing
  Color Characteristics:
    Red  : 0.6513, 0.3339
    Green: 0.3037, 0.6181
    Blue : 0.1474, 0.0488
    White: 0.3076, 0.3242
  Established Timings I & II:
    IBM     :   720x400    70.081663 Hz   9:5     31.467 kHz     28.320000 MHz
    DMT 0x04:   640x480    59.940476 Hz   4:3     31.469 kHz     25.175000 MHz
    DMT 0x09:   800x600    60.316541 Hz   4:3     37.879 kHz     40.000000 MHz
    DMT 0x10:  1024x768    60.003840 Hz   4:3     48.363 kHz     65.000000 MHz
  Standard Timings: none
  Detailed Timing Descriptors:
    DTD 1:  2560x1440   59.950550 Hz  16:9     88.787 kHz    241.500000 MHz (597 mm x 336 mm)
                 Hfront   40 Hsync  32 Hback   88 Hpol P
                 Vfront    3 Vsync   5 Vback   33 Vpol N
    DTD 2:  1920x1080   59.977152 Hz  16:9     66.635 kHz    138.600000 MHz (816 mm x 304 mm)
                 Hfront   48 Hsync  32 Hback   80 Hpol P
                 Vfront    2 Vsync   5 Vback   24 Vpol N
    Display Range Limits:
      Monitor ranges (GTF): 56-61 Hz V, 30-91 kHz H, max dotclock 250 MHz
    Display Product Name: 'LCD WQHD HDMI'
  Extension blocks: 1
Checksum: 0xe8

----------------

Block 1, CTA-861 Extension Block:
  Revision: 3
  Underscans IT Video Formats by default
  Basic audio support
  Supports YCbCr 4:4:4
  Supports YCbCr 4:2:2
  Native detailed modes: 1
  Video Data Block:
    VIC  16:  1920x1080   60.000000 Hz  16:9     67.500 kHz    148.500000 MHz (native)
    VIC   4:  1280x720    60.000000 Hz  16:9     45.000 kHz     74.250000 MHz
    VIC   3:   720x480    59.940060 Hz  16:9     31.469 kHz     27.000000 MHz
  Audio Data Block:
    Linear PCM:
      Max channels: 2
      Supported sample rates (kHz): 48 44.1 32
      Supported sample sizes (bits): 24 20 16
  Speaker Allocation Data Block:
    FL/FR - Front Left/Right
  Vendor-Specific Data Block (HDMI), OUI 00-0C-03:
    Source physical address: 1.0.0.0
    DVI_Dual
    Maximum TMDS clock: 250 MHz
    Extended HDMI video details:
      HDMI VICs:
        HDMI VIC 1:  3840x2160   30.000000 Hz  16:9     67.500 kHz    297.000000 MHz
  Detailed Timing Descriptors:
    DTD 3:  1920x1080   60.000000 Hz  16:9     67.500 kHz    148.500000 MHz (630 mm x 376 mm)
                 Hfront   64 Hsync  32 Hback  184 Hpol P
                 Vfront    1 Vsync   5 Vback   39 Vpol N
    DTD 4:  1280x720    60.000000 Hz  16:9     45.000 kHz     74.250000 MHz (700 mm x 390 mm)
                 Hfront  110 Hsync  40 Hback  220 Hpol P
                 Vfront    5 Vsync   5 Vback   20 Vpol P
    DTD 5:   720x480    59.940060 Hz   3:2     31.469 kHz     27.000000 MHz (700 mm x 390 mm)
                 Hfront   16 Hsync  62 Hback   60 Hpol N
                 Vfront    9 Vsync   6 Vback   30 Vpol N
Checksum: 0xe9  Unused space in Extension Block: 45 bytes

----------------

Block 2, Unknown EDID Extension Block 0x00:
  00 ff ff ff ff ff ff 00 59 af 06 15 01 00 00 00 '........Y.......'
  31 15 01 03 81 a0 64 78 2a ed ec a6 55 4d 9e 25 '1.....dx*...UM.%'
  0c 4e 53 a1 08 00 01 01 01 01 01 01 01 01 01 01 '.NS.............'
  01 01 01 01 01 01 56 5e 00 a0 a0 a0 29 50 28 20 '......V^....)P( '
  35 00 55 50 21 00 00 1a 24 36 80 a0 70 38 1f 40 '5.UP!...$6..p8.@'
  30 20 25 00 30 30 31 00 00 1a 00 00 00 fd 00 38 '0 %.001........8'
  3d 1e 5b 19 00 0a 20 20 20 20 20 20 00 00 00 fc '=.[...      ....'
  00 4c 43 44 20 57 51 48 44 20 48 44 4d 49 01 e8 '.LCD WQHD HDMI..'
Checksum: 0xe8

----------------

Block 3, CTA-861 Extension Block:
  Revision: 3
  Underscans IT Video Formats by default
  Basic audio support
  Supports YCbCr 4:4:4
  Supports YCbCr 4:2:2
  Native detailed modes: 1
  Video Data Block:
    VIC  16:  1920x1080   60.000000 Hz  16:9     67.500 kHz    148.500000 MHz (native)
    VIC   4:  1280x720    60.000000 Hz  16:9     45.000 kHz     74.250000 MHz
    VIC   3:   720x480    59.940060 Hz  16:9     31.469 kHz     27.000000 MHz
  Audio Data Block:
    Linear PCM:
      Max channels: 2
      Supported sample rates (kHz): 48 44.1 32
      Supported sample sizes (bits): 24 20 16
  Speaker Allocation Data Block:
    FL/FR - Front Left/Right
  Vendor-Specific Data Block (HDMI), OUI 00-0C-03:
    Source physical address: 1.0.0.0
    DVI_Dual
    Maximum TMDS clock: 250 MHz
    Extended HDMI video details:
      HDMI VICs:
        HDMI VIC 1:  3840x2160   30.000000 Hz  16:9     67.500 kHz    297.000000 MHz
  Detailed Timing Descriptors:
    DTD 6:  1920x1080   60.000000 Hz  16:9     67.500 kHz    148.500000 MHz (630 mm x 376 mm)
                 Hfront   64 Hsync  32 Hback  184 Hpol P
                 Vfront    1 Vsync   5 Vback   39 Vpol N
    DTD 7:  1280x720    60.000000 Hz  16:9     45.000 kHz     74.250000 MHz (700 mm x 390 mm)
                 Hfront  110 Hsync  40 Hback  220 Hpol P
                 Vfront    5 Vsync   5 Vback   20 Vpol P
    DTD 8:   720x480    59.940060 Hz   3:2     31.469 kHz     27.000000 MHz (700 mm x 390 mm)
                 Hfront   16 Hsync  62 Hback   60 Hpol N
                 Vfront    9 Vsync   6 Vback   30 Vpol N
Checksum: 0xe9  Unused space in Extension Block: 45 bytes

----------------

Warnings:

Block 1, CTA-861 Extension Block:
  Detailed Timing Descriptor #3: DTD is similar but not identical to VIC 16.
  Add a Colorimetry Data Block with the sRGB colorimetry bit set to avoid interop issues.
Block 3, CTA-861 Extension Block:
  Detailed Timing Descriptor #6: DTD is similar but not identical to VIC 16.
  Add a Colorimetry Data Block with the sRGB colorimetry bit set to avoid interop issues.

Failures:

Block 0, Base EDID:
  Detailed Timing Descriptor #1: Mismatch of image size 597x336 mm vs display size 1600x1000 mm.
  Detailed Timing Descriptor #2: Mismatch of image size 816x304 mm vs display size 1600x1000 mm.
Block 1, CTA-861 Extension Block:
  Detailed Timing Descriptor #3: Mismatch of image size 630x376 mm vs display size 1600x1000 mm.
  Detailed Timing Descriptor #4: Mismatch of image size 700x390 mm vs display size 1600x1000 mm.
  Detailed Timing Descriptor #5: Mismatch of image size 700x390 mm vs display size 1600x1000 mm.
  HDMI VIC Codes must have their CTA-861 VIC equivalents in the VSB.
  Missing VCDB, needed for Set Selectable RGB Quantization to avoid interop issues.
Block 2, Base EDID:
  Unknown Extension Block.
Block 3, CTA-861 Extension Block:
  Video Data Block: Duplicate VIC 16.
  Video Data Block: Duplicate VIC 4.
  Video Data Block: Duplicate VIC 3.
  Speaker Allocation Data Block: Only one instance of this Data Block is allowed.
  Detailed Timing Descriptor #6: Mismatch of image size 630x376 mm vs display size 1600x1000 mm.
  Detailed Timing Descriptor #7: Mismatch of image size 700x390 mm vs display size 1600x1000 mm.
  Detailed Timing Descriptor #8: Mismatch of image size 700x390 mm vs display size 1600x1000 mm.
  HDMI VIC Codes must have their CTA-861 VIC equivalents in the VSB.
  Missing VCDB, needed for Set Selectable RGB Quantization to avoid interop issues.
EDID:
  Base EDID: Some timings are out of range of the Monitor Ranges:
    Vertical Freq: 30.000 - 70.082 Hz (Monitor: 56.000 - 61.000 Hz)
    Maximum Clock: 297.000 MHz (Monitor: 250.000 MHz)
  Base EDID: EDID specified 1 extension block(s), but found 3 extension block(s).
  Base EDID: EDID 1.3 requires a Block Map Extension in Block 1 if there are more than 2 blocks in the EDID.
  CTA-861: Native progressive timings are a mix of several resolutions.

EDID conformity: FAIL
