
EDID (hex):
00ffffffffffff004d10a61400000000
301b0104a5150e7806de50a3544c9926
0f505400000001010101010101010101
010101010101a43808a070b023403020
3a00d38d00000018a43808a070b05841
30203a00d38d00000018000000100000
000000000000000000000000000000fc
004c5131303050314a5835310a200031

Extracted contents:
header:          00 ff ff ff ff ff ff 00
serial number:   4d 10 a6 14 00 00 00 00 30 1b
version:         01 04
basic params:    a5 15 0e 78 06
chroma info:     de 50 a3 54 4c 99 26 0f 50 54
established:     00 00 00
standard:        01 01 01 01 01 01 01 01 01 01 01 01 01 01 01 01
descriptor 1:    a4 38 08 a0 70 b0 23 40 30 20 3a 00 d3 8d 00 00 00 18
descriptor 2:    a4 38 08 a0 70 b0 58 41 30 20 3a 00 d3 8d 00 00 00 18
descriptor 3:    00 00 00 10 00 00 00 00 00 00 00 00 00 00 00 00 00 00
descriptor 4:    00 00 00 fc 00 4c 51 31 30 30 50 31 4a 58 35 31 0a 20
extensions:      00
checksum:        31

EDID version: 1.4
Manufacturer: SHP Model 14a6 Serial Number --
Made in week 48 of 2017
Digital display
8 bits per primary color channel
DisplayPort interface
Maximum image size: 21 cm x 14 cm
Gamma: 2.20
Supported color formats: RGB 4:4:4
Default (sRGB) color space is primary color space
First detailed timing includes the native pixel format and preferred refresh rate
Display x,y Chromaticity:
  Red:   0.6396, 0.3291
  Green: 0.2998, 0.5996
  Blue:  0.1494, 0.0595
  White: 0.3125, 0.3281
Established timings supported:
Standard timings supported:
Detailed mode: Clock 145.000 MHz, 211 mm x 141 mm
               1800 1848 1880 1960 hborder 0
               1200 1203 1213 1235 vborder 0
               -hsync -vsync 
               VertFreq: 59 Hz, HorFreq: 73979 Hz
Detailed mode: Clock 145.000 MHz, 211 mm x 141 mm
               1800 1848 1880 1960 hborder 0
               1200 1203 1213 1544 vborder 0
               -hsync -vsync 
               VertFreq: 47 Hz, HorFreq: 73979 Hz
Dummy block
Monitor name: LQ100P1JX51
Checksum: 0x31 (valid)
EDID block does NOT conform to EDID 1.4!
	sRGB is signaled, but the chromaticities do not match
	Missing monitor ranges
