edid-decode (hex):

00 ff ff ff ff ff ff 00 38 a3 50 67 01 01 01 01
27 14 01 03 80 38 23 78 ea 97 b5 a9 54 38 ae 25
13 50 54 bf ef 80 81 c0 81 80 90 40 8b c0 95 00
a9 40 b3 00 d1 00 28 3c 80 a0 70 b0 23 40 30 20
36 00 30 5e 21 00 00 1a 00 00 00 fd 00 32 4c 1a
52 11 00 0a 20 20 20 20 20 20 00 00 00 fc 00 45
41 32 36 31 57 4d 0a 20 20 20 20 20 00 00 00 ff
00 30 39 31 30 39 37 36 33 4e 42 0a 20 20 01 5e

02 01 04 00 01 1d 00 72 51 d0 1e 20 6e 28 55 00
30 5e 21 00 00 1e 01 1d 00 bc 52 d0 1e 20 b8 28
55 40 30 5e 21 00 00 1e 8e 0a d0 8a 20 e0 2d 10
10 3e 96 00 30 5e 21 00 00 18 8c 0a d0 90 20 40
31 20 0c 40 55 00 30 5e 21 00 00 18 02 3a 80 18
71 38 2d 40 58 2c 45 00 30 5e 21 00 00 1e 02 3a
80 d0 72 38 2d 40 10 2c 45 80 30 5e 21 00 00 1e
00 00 00 00 00 00 00 00 00 00 00 00 00 00 00 fc

00 ff ff ff ff ff ff 00 38 a3 50 67 01 01 01 01
27 14 01 03 80 38 23 78 ea 97 b5 a9 54 38 ae 25
13 50 54 bf ef 80 81 c0 81 80 90 40 8b c0 95 00
a9 40 b3 00 d1 00 28 3c 80 a0 70 b0 23 40 30 20
36 00 30 5e 21 00 00 1a 00 00 00 fd 00 32 4c 1a
52 11 00 0a 20 20 20 20 20 20 00 00 00 fc 00 45
41 32 36 31 57 4d 0a 20 20 20 20 20 00 00 00 ff
00 30 39 31 30 39 37 36 33 4e 42 0a 20 20 01 5e

02 01 04 00 01 1d 00 72 51 d0 1e 20 6e 28 55 00
30 5e 21 00 00 1e 01 1d 00 bc 52 d0 1e 20 b8 28
55 40 30 5e 21 00 00 1e 8e 0a d0 8a 20 e0 2d 10
10 3e 96 00 30 5e 21 00 00 18 8c 0a d0 90 20 40
31 20 0c 40 55 00 30 5e 21 00 00 18 02 3a 80 18
71 38 2d 40 58 2c 45 00 30 5e 21 00 00 1e 02 3a
80 d0 72 38 2d 40 10 2c 45 80 30 5e 21 00 00 1e
00 00 00 00 00 00 00 00 00 00 00 00 00 00 00 fc

----------------

Block 0, Base EDID:
  EDID Structure Version & Revision: 1.3
  Vendor & Product Identification:
    Manufacturer: NEC
    Model: 26448
    Serial Number: ...
    Made in: week 39 of 2010
  Basic Display Parameters & Features:
    Digital display
    Maximum image size: 56 cm x 35 cm
    Gamma: 2.20
    DPMS levels: Standby Suspend Off
    RGB color display
    First detailed timing is the preferred timing
  Color Characteristics:
    Red  : 0.6621, 0.3291
    Green: 0.2197, 0.6826
    Blue : 0.1464, 0.0771
    White: 0.3134, 0.3291
  Established Timings I & II:
    IBM     :   720x400    70.081663 Hz   9:5     31.467 kHz     28.320000 MHz
    DMT 0x04:   640x480    59.940476 Hz   4:3     31.469 kHz     25.175000 MHz
    Apple   :   640x480    66.666667 Hz   4:3     35.000 kHz     30.240000 MHz
    DMT 0x05:   640x480    72.808802 Hz   4:3     37.861 kHz     31.500000 MHz
    DMT 0x06:   640x480    75.000000 Hz   4:3     37.500 kHz     31.500000 MHz
    DMT 0x08:   800x600    56.250000 Hz   4:3     35.156 kHz     36.000000 MHz
    DMT 0x09:   800x600    60.316541 Hz   4:3     37.879 kHz     40.000000 MHz
    DMT 0x0a:   800x600    72.187572 Hz   4:3     48.077 kHz     50.000000 MHz
    DMT 0x0b:   800x600    75.000000 Hz   4:3     46.875 kHz     49.500000 MHz
    Apple   :   832x624    74.551266 Hz   4:3     49.726 kHz     57.284000 MHz
    DMT 0x10:  1024x768    60.003840 Hz   4:3     48.363 kHz     65.000000 MHz
    DMT 0x11:  1024x768    70.069359 Hz   4:3     56.476 kHz     75.000000 MHz
    DMT 0x12:  1024x768    75.028582 Hz   4:3     60.023 kHz     78.750000 MHz
    DMT 0x24:  1280x1024   75.024675 Hz   5:4     79.976 kHz    135.000000 MHz
    Apple   :  1152x870    75.061550 Hz 192:145   68.681 kHz    100.000000 MHz
  Standard Timings:
    DMT 0x55:  1280x720    60.000000 Hz  16:9     45.000 kHz     74.250000 MHz
    DMT 0x23:  1280x1024   60.019740 Hz   5:4     63.981 kHz    108.000000 MHz
    DMT 0x2a:  1400x1050   59.978442 Hz   4:3     65.317 kHz    121.750000 MHz
    GTF     :  1360x765    60.000341 Hz  16:9     47.520 kHz     84.396000 MHz
    DMT 0x2f:  1440x900    59.887445 Hz  16:10    55.935 kHz    106.500000 MHz
    DMT 0x33:  1600x1200   60.000000 Hz   4:3     75.000 kHz    162.000000 MHz
    DMT 0x3a:  1680x1050   59.954250 Hz  16:10    65.290 kHz    146.250000 MHz
    DMT 0x45:  1920x1200   59.884600 Hz  16:10    74.556 kHz    193.250000 MHz
  Detailed Timing Descriptors:
    DTD  1:  1920x1200   59.950171 Hz  16:10    74.038 kHz    154.000000 MHz (560 mm x 350 mm)
                  Hfront   48 Hsync  32 Hback   80 Hpol P
                  Vfront    3 Vsync   6 Vback   26 Vpol N
    Display Range Limits:
      Monitor ranges (GTF): 50-76 Hz V, 26-82 kHz H, max dotclock 170 MHz
    Display Product Name: 'EA261WM'
    Display Product Serial Number: ...
  Extension blocks: 1
Checksum: 0x5e

----------------

Block 1, CTA-861 Extension Block:
  Revision: 1
  Detailed Timing Descriptors:
    DTD  2:  1280x720    60.000000 Hz  16:9     45.000 kHz     74.250000 MHz (560 mm x 350 mm)
                  Hfront  110 Hsync  40 Hback  220 Hpol P
                  Vfront    5 Vsync   5 Vback   20 Vpol P
    DTD  3:  1280x720    50.000000 Hz  16:9     37.500 kHz     74.250000 MHz (560 mm x 350 mm)
                  Hfront  440 Hsync  40 Hback  220 Hpol P
                  Vfront    5 Vsync   5 Vback   20 Vpol P
    DTD  4:   720x480    59.984460 Hz   3:2     31.492 kHz     27.020000 MHz (560 mm x 350 mm)
                  Hfront   16 Hsync  62 Hback   60 Hpol N
                  Vfront    9 Vsync   6 Vback   30 Vpol N
    DTD  5:   720x576    50.000000 Hz   5:4     31.250 kHz     27.000000 MHz (560 mm x 350 mm)
                  Hfront   12 Hsync  64 Hback   68 Hpol N
                  Vfront    5 Vsync   5 Vback   39 Vpol N
    DTD  6:  1920x1080   60.000000 Hz  16:9     67.500 kHz    148.500000 MHz (560 mm x 350 mm)
                  Hfront   88 Hsync  44 Hback  148 Hpol P
                  Vfront    4 Vsync   5 Vback   36 Vpol P
    DTD  7:  1920x1080   50.000000 Hz  16:9     56.250 kHz    148.500000 MHz (560 mm x 350 mm)
                  Hfront  528 Hsync  44 Hback  148 Hpol P
                  Vfront    4 Vsync   5 Vback   36 Vpol P
Checksum: 0xfc  Unused space in Extension Block: 15 bytes

----------------

Block 2, Unknown EDID Extension Block 0x00:
  00 ff ff ff ff ff ff 00 38 a3 50 67 01 01 01 01 '........8.Pg....'
  27 14 01 03 80 38 23 78 ea 97 b5 a9 54 38 ae 25 ''....8#x....T8.%'
  13 50 54 bf ef 80 81 c0 81 80 90 40 8b c0 95 00 '.PT........@....'
  a9 40 b3 00 d1 00 28 3c 80 a0 70 b0 23 40 30 20 '.@....(<..p.#@0 '
  36 00 30 5e 21 00 00 1a 00 00 00 fd 00 32 4c 1a '6.0^!........2L.'
  52 11 00 0a 20 20 20 20 20 20 00 00 00 fc 00 45 'R...      .....E'
  41 32 36 31 57 4d 0a 20 20 20 20 20 00 00 00 ff 'A261WM.     ....'
  00 30 39 31 30 39 37 36 33 4e 42 0a 20 20 01 5e '.09109763NB.  .^'
Checksum: 0x5e

----------------

Block 3, CTA-861 Extension Block:
  Revision: 1
  Detailed Timing Descriptors:
    DTD  8:  1280x720    60.000000 Hz  16:9     45.000 kHz     74.250000 MHz (560 mm x 350 mm)
                  Hfront  110 Hsync  40 Hback  220 Hpol P
                  Vfront    5 Vsync   5 Vback   20 Vpol P
    DTD  9:  1280x720    50.000000 Hz  16:9     37.500 kHz     74.250000 MHz (560 mm x 350 mm)
                  Hfront  440 Hsync  40 Hback  220 Hpol P
                  Vfront    5 Vsync   5 Vback   20 Vpol P
    DTD 10:   720x480    59.984460 Hz   3:2     31.492 kHz     27.020000 MHz (560 mm x 350 mm)
                  Hfront   16 Hsync  62 Hback   60 Hpol N
                  Vfront    9 Vsync   6 Vback   30 Vpol N
    DTD 11:   720x576    50.000000 Hz   5:4     31.250 kHz     27.000000 MHz (560 mm x 350 mm)
                  Hfront   12 Hsync  64 Hback   68 Hpol N
                  Vfront    5 Vsync   5 Vback   39 Vpol N
    DTD 12:  1920x1080   60.000000 Hz  16:9     67.500 kHz    148.500000 MHz (560 mm x 350 mm)
                  Hfront   88 Hsync  44 Hback  148 Hpol P
                  Vfront    4 Vsync   5 Vback   36 Vpol P
    DTD 13:  1920x1080   50.000000 Hz  16:9     56.250 kHz    148.500000 MHz (560 mm x 350 mm)
                  Hfront  528 Hsync  44 Hback  148 Hpol P
                  Vfront    4 Vsync   5 Vback   36 Vpol P
Checksum: 0xfc  Unused space in Extension Block: 15 bytes

----------------

Warnings:

Block 0, Base EDID:
  Standard Timings: Standard Timing 1360x765 has a dubious odd vertical resolution.
Block 1, CTA-861 Extension Block:
  Display Product Serial Number is set, so the Serial Number in the Base EDID should be 0.
  Add a Colorimetry Data Block with the sRGB colorimetry bit set to avoid interop issues.
Block 3, CTA-861 Extension Block:
  Display Product Serial Number is set, so the Serial Number in the Base EDID should be 0.
  Add a Colorimetry Data Block with the sRGB colorimetry bit set to avoid interop issues.

Failures:

Block 1, CTA-861 Extension Block:
  Missing VCDB, needed for Set Selectable RGB Quantization to avoid interop issues.
Block 2, Base EDID:
  Unknown Extension Block.
Block 3, CTA-861 Extension Block:
  Missing VCDB, needed for Set Selectable RGB Quantization to avoid interop issues.
EDID:
  Base EDID: Some timings are out of range of the Monitor Ranges:
    Maximum Clock: 193.250 MHz (Monitor: 170.000 MHz)
  Base EDID: EDID specified 1 extension block(s), but found 3 extension block(s).
  Base EDID: EDID 1.3 requires a Block Map Extension in Block 1 if there are more than 2 blocks in the EDID.

EDID conformity: FAIL
