
EDID (hex):
00ffffffffffff0038a3506701010101
2b14010380382378ea97b5a95438ae25
135054bfef8081c0818090408bc09500
a940b300d100283c80a070b023403020
3600305e2100001a000000fd00324c1a
5211000a202020202020000000fc0045
41323631574d0a2020202020000000ff
0030583130393939364e420a20200133
02010400011d007251d01e206e285500
305e2100001e011d00bc52d01e20b828
5540305e2100001e8e0ad08a20e02d10
103e9600305e210000188c0ad0902040
31200c405500305e21000018023a8018
71382d40582c4500305e2100001e023a
80d072382d40102c4580305e2100001e
000000000000000000000000000000fc

Extracted contents:
header:          00 ff ff ff ff ff ff 00
serial number:   38 a3 50 67 01 01 01 01 2b 14
version:         01 03
basic params:    80 38 23 78 ea
chroma info:     97 b5 a9 54 38 ae 25 13 50 54
established:     bf ef 80
standard:        81 c0 81 80 90 40 8b c0 95 00 a9 40 b3 00 d1 00
descriptor 1:    28 3c 80 a0 70 b0 23 40 30 20 36 00 30 5e 21 00 00 1a
descriptor 2:    00 00 00 fd 00 32 4c 1a 52 11 00 0a 20 20 20 20 20 20
descriptor 3:    00 00 00 fc 00 45 41 32 36 31 57 4d 0a 20 20 20 20 20
descriptor 4:    00 00 00 ff 00 30 58 31 30 39 39 39 36 4e 42 0a 20 20
extensions:      01
checksum:        33

EDID version: 1.3
Manufacturer: NEC Model 6750 Serial Number --
Made in week 43 of 2010
Digital display
Maximum image size: 56 cm x 35 cm
Gamma: 2.20
DPMS levels: Standby Suspend Off
RGB color display
First detailed timing is preferred timing
Display x,y Chromaticity:
  Red:   0.6621, 0.3291
  Green: 0.2197, 0.6826
  Blue:  0.1464, 0.0771
  White: 0.3134, 0.3291
Established timings supported:
  720x400@70Hz 9:5 HorFreq: 31469 Hz Clock: 28.320 MHz
  640x480@60Hz 4:3 HorFreq: 31469 Hz Clock: 25.175 MHz
  640x480@67Hz 4:3 HorFreq: 35000 Hz Clock: 30.240 MHz
  640x480@72Hz 4:3 HorFreq: 37900 Hz Clock: 31.500 MHz
  640x480@75Hz 4:3 HorFreq: 37500 Hz Clock: 31.500 MHz
  800x600@56Hz 4:3 HorFreq: 35200 Hz Clock: 36.000 MHz
  800x600@60Hz 4:3 HorFreq: 37900 Hz Clock: 40.000 MHz
  800x600@72Hz 4:3 HorFreq: 48100 Hz Clock: 50.000 MHz
  800x600@75Hz 4:3 HorFreq: 46900 Hz Clock: 49.500 MHz
  832x624@75Hz 4:3 HorFreq: 49726 Hz Clock: 57.284 MHz
  1024x768@60Hz 4:3 HorFreq: 48400 Hz Clock: 65.000 MHz
  1024x768@70Hz 4:3 HorFreq: 56500 Hz Clock: 75.000 MHz
  1024x768@75Hz 4:3 HorFreq: 60000 Hz Clock: 78.750 MHz
  1280x1024@75Hz 5:4 HorFreq: 80000 Hz Clock: 135.000 MHz
  1152x870@75Hz 192:145 HorFreq: 67500 Hz Clock: 108.000 MHz
Standard timings supported:
  1280x720@60Hz 16:9
  1280x1024@60Hz 5:4 HorFreq: 64000 Hz Clock: 108.000 MHz
  1400x1050@60Hz 4:3 HorFreq: 64700 Hz Clock: 101.000 MHz
  1360x765@60Hz 16:9
  1440x900@60Hz 16:10 HorFreq: 55500 Hz Clock: 88.750 MHz
  1600x1200@60Hz 4:3 HorFreq: 75000 Hz Clock: 162.000 MHz
  1680x1050@60Hz 16:10 HorFreq: 64700 Hz Clock: 119.000 MHz
  1920x1200@60Hz 16:10 HorFreq: 74000 Hz Clock: 154.000 MHz
Detailed mode: Clock 154.000 MHz, 560 mm x 350 mm
               1920 1968 2000 2080 hborder 0
               1200 1203 1209 1235 vborder 0
               +hsync -vsync 
               VertFreq: 59 Hz, HorFreq: 74038 Hz
Monitor ranges (GTF): 50-76Hz V, 26-82kHz H, max dotclock 170MHz
Monitor name: EA261WM
Serial number: --
Has 1 extension blocks
Checksum: 0x33 (valid)

CTA extension block
Extension version: 1
0 8-byte timing descriptors
Detailed mode: Clock 74.250 MHz, 560 mm x 350 mm
               1280 1390 1430 1650 hborder 0
                720  725  730  750 vborder 0
               +hsync +vsync 
               VertFreq: 60 Hz, HorFreq: 45000 Hz
Detailed mode: Clock 74.250 MHz, 560 mm x 350 mm
               1280 1720 1760 1980 hborder 0
                720  725  730  750 vborder 0
               +hsync +vsync 
               VertFreq: 50 Hz, HorFreq: 37500 Hz
Detailed mode: Clock 27.020 MHz, 560 mm x 350 mm
                720  736  798  858 hborder 0
                480  489  495  525 vborder 0
               -hsync -vsync 
               VertFreq: 59 Hz, HorFreq: 31491 Hz
Detailed mode: Clock 27.000 MHz, 560 mm x 350 mm
                720  732  796  864 hborder 0
                576  581  586  625 vborder 0
               -hsync -vsync 
               VertFreq: 50 Hz, HorFreq: 31250 Hz
Detailed mode: Clock 148.500 MHz, 560 mm x 350 mm
               1920 2008 2052 2200 hborder 0
               1080 1084 1089 1125 vborder 0
               +hsync +vsync 
               VertFreq: 60 Hz, HorFreq: 67500 Hz
Detailed mode: Clock 148.500 MHz, 560 mm x 350 mm
               1920 2448 2492 2640 hborder 0
               1080 1084 1089 1125 vborder 0
               +hsync +vsync 
               VertFreq: 50 Hz, HorFreq: 56250 Hz
Checksum: 0xfc (valid)

EDID block does not conform at all!
	Both the serial number and the serial string are set


