edid-decode (hex):

00 ff ff ff ff ff ff 00 38 70 0f 00 00 00 00 00
00 19 01 04 a5 1a 0f 78 06 de 50 a3 54 4c 99 26
0f 50 54 00 00 00 01 01 01 01 01 01 01 01 01 01
01 01 01 01 01 01 29 36 80 a0 70 38 1f 40 30 20
35 00 00 90 10 00 00 18 54 2b 80 a0 70 38 1f 40
30 20 35 00 00 90 10 00 00 18 00 00 00 10 00 00
00 00 00 00 00 00 00 00 00 00 00 00 00 00 00 fc
00 4c 43 31 31 36 4c 46 31 4c 30 32 0a 20 00 7e

----------------

Block 0, Base EDID:
  EDID Structure Version & Revision: 1.4
  Vendor & Product Identification:
    Manufacturer: NCP
    Model: 15
    Made in: 2015
  Basic Display Parameters & Features:
    Digital display
    Bits per primary color channel: 8
    DisplayPort interface
    Maximum image size: 26 cm x 15 cm
    Gamma: 2.20
    Supported color formats: RGB 4:4:4
    Default (sRGB) color space is primary color space
    First detailed timing includes the native pixel format and preferred refresh rate
  Color Characteristics:
    Red  : 0.6396, 0.3291
    Green: 0.2998, 0.5996
    Blue : 0.1494, 0.0595
    White: 0.3125, 0.3281
  Established Timings I & II: none
  Standard Timings: none
  Detailed Timing Descriptors:
    DTD 1:  1920x1080   59.999 Hz  16:9    66.659 kHz 138.650 MHz (256 mm x 144 mm)
                 Hfront   48 Hsync  32 Hback  80 Hpol N
                 Vfront    3 Vsync   5 Vback  23 Vpol N
    DTD 2:  1920x1080   47.999 Hz  16:9    53.327 kHz 110.920 MHz (256 mm x 144 mm)
                 Hfront   48 Hsync  32 Hback  80 Hpol N
                 Vfront    3 Vsync   5 Vback  23 Vpol N
    Dummy Descriptor:
    Display Product Name: 'LC116LF1L02'
Checksum: 0x7e

----------------

Failures:

Block 0, Base EDID:
  Basic Display Parameters & Features: sRGB is signaled, but the chromaticities do not match.

EDID conformity: FAIL
