
EDID (hex):
00ffffffffffff0022f0224201000000
30140103802c1978ee5950a5554e9d25
11505400000001010101010101010101
010101010101302a40c8608464301850
1300bbf910000000000000fc00485020
436f6d7061712050726f000000fc0020
343330302041694f0a202020000000fc
000a2020202020202020202020200039

Extracted contents:
header:          00 ff ff ff ff ff ff 00
serial number:   22 f0 22 42 01 00 00 00 30 14
version:         01 03
basic params:    80 2c 19 78 ee
chroma info:     59 50 a5 55 4e 9d 25 11 50 54
established:     00 00 00
standard:        01 01 01 01 01 01 01 01 01 01 01 01 01 01 01 01
descriptor 1:    30 2a 40 c8 60 84 64 30 18 50 13 00 bb f9 10 00 00 00
descriptor 2:    00 00 00 fc 00 48 50 20 43 6f 6d 70 61 71 20 50 72 6f
descriptor 3:    00 00 00 fc 00 20 34 33 30 30 20 41 69 4f 0a 20 20 20
descriptor 4:    00 00 00 fc 00 0a 20 20 20 20 20 20 20 20 20 20 20 20
extensions:      00
checksum:        39

EDID version: 1.3
Manufacturer: HWP Model 4222 Serial Number --
Made in week 48 of 2010
Digital display
Maximum image size: 44 cm x 25 cm
Gamma: 2.20
DPMS levels: Standby Suspend Off
RGB color display
Default (sRGB) color space is primary color space
First detailed timing is preferred timing
Display x,y Chromaticity:
  Red:   0.6455, 0.3330
  Green: 0.3066, 0.6142
  Blue:  0.1455, 0.0673
  White: 0.3125, 0.3281
Established timings supported:
Standard timings supported:
Detailed mode: Clock 108.000 MHz, 443 mm x 249 mm
               1600 1624 1704 1800 hborder 0
                900  901  904 1000 vborder 0
               -hsync -vsync analog composite 
               VertFreq: 60 Hz, HorFreq: 60000 Hz
Monitor name: HP Compaq Pro 4300 AiO
Checksum: 0x39 (valid)
EDID block does NOT conform to EDID 1.3!
	sRGB is signaled, but the chromaticities do not match
	Missing monitor ranges
