
EDID (hex):
00ffffffffffff0026cd105601010101
2013010368341e782aeed5a555489b26
125054bfef80b300a940950001018180
950f714f0101944380907238284080c8
350009252100001c000000ff00313130
33323933323030363030000000fd0037
4c1d5112000a202020202020000000fc
00504c4532343037484453560a200094

Extracted contents:
header:          00 ff ff ff ff ff ff 00
serial number:   26 cd 10 56 01 01 01 01 20 13
version:         01 03
basic params:    68 34 1e 78 2a
chroma info:     ee d5 a5 55 48 9b 26 12 50 54
established:     bf ef 80
standard:        b3 00 a9 40 95 00 01 01 81 80 95 0f 71 4f 01 01
descriptor 1:    94 43 80 90 72 38 28 40 80 c8 35 00 09 25 21 00 00 1c
descriptor 2:    00 00 00 ff 00 31 31 30 33 32 39 33 32 30 30 36 30 30
descriptor 3:    00 00 00 fd 00 37 4c 1d 51 12 00 0a 20 20 20 20 20 20
descriptor 4:    00 00 00 fc 00 50 4c 45 32 34 30 37 48 44 53 56 0a 20
extensions:      00
checksum:        94

EDID version: 1.3
Manufacturer: IVM Model 5610 Serial Number --
Made in week 32 of 2009
Analog display, Input voltage level: 0.7/0.7 V
Sync: Separate 
Maximum image size: 52 cm x 30 cm
Gamma: 2.20
DPMS levels: Off
RGB color display
First detailed timing is preferred timing
Display x,y Chromaticity:
  Red:   0.6474, 0.3339
  Green: 0.2841, 0.6074
  Blue:  0.1513, 0.0712
  White: 0.3134, 0.3291
Established timings supported:
  720x400@70Hz 9:5 HorFreq: 31469 Hz Clock: 28.320 MHz
  640x480@60Hz 4:3 HorFreq: 31469 Hz Clock: 25.175 MHz
  640x480@67Hz 4:3 HorFreq: 35000 Hz Clock: 30.240 MHz
  640x480@72Hz 4:3 HorFreq: 37900 Hz Clock: 31.500 MHz
  640x480@75Hz 4:3 HorFreq: 37500 Hz Clock: 31.500 MHz
  800x600@56Hz 4:3 HorFreq: 35200 Hz Clock: 36.000 MHz
  800x600@60Hz 4:3 HorFreq: 37900 Hz Clock: 40.000 MHz
  800x600@72Hz 4:3 HorFreq: 48100 Hz Clock: 50.000 MHz
  800x600@75Hz 4:3 HorFreq: 46900 Hz Clock: 49.500 MHz
  832x624@75Hz 4:3 HorFreq: 49726 Hz Clock: 57.284 MHz
  1024x768@60Hz 4:3 HorFreq: 48400 Hz Clock: 65.000 MHz
  1024x768@70Hz 4:3 HorFreq: 56500 Hz Clock: 75.000 MHz
  1024x768@75Hz 4:3 HorFreq: 60000 Hz Clock: 78.750 MHz
  1280x1024@75Hz 5:4 HorFreq: 80000 Hz Clock: 135.000 MHz
  1152x870@75Hz 192:145 HorFreq: 67500 Hz Clock: 108.000 MHz
Standard timings supported:
  1680x1050@60Hz 16:10 HorFreq: 64700 Hz Clock: 119.000 MHz
  1600x1200@60Hz 4:3 HorFreq: 75000 Hz Clock: 162.000 MHz
  1440x900@60Hz 16:10 HorFreq: 55500 Hz Clock: 88.750 MHz
  1280x1024@60Hz 5:4 HorFreq: 64000 Hz Clock: 108.000 MHz
  1440x900@75Hz 16:10 HorFreq: 82300 Hz Clock: 156.000 MHz
  1152x864@75Hz 4:3 HorFreq: 67500 Hz Clock: 108.000 MHz
Detailed mode: Clock 173.000 MHz, 521 mm x 293 mm
               1920 2048 2248 2576 hborder 0
               1080 1083 1088 1120 vborder 0
               -hsync +vsync 
               VertFreq: 59 Hz, HorFreq: 67158 Hz
Serial number: --
Monitor ranges (GTF): 55-76Hz V, 29-81kHz H, max dotclock 180MHz
Monitor name: PLE2407HDSV
Checksum: 0x94 (valid)
One or more of the timings is out of range of the Monitor Ranges:
  Vertical Freq: 56 - 75 Hz
  Horizontal Freq: 31469 - 82300 Hz
  Maximum Clock: 173.000 MHz
