edid-decode (hex):

00 ff ff ff ff ff ff 00 3e 83 20 01 00 00 00 00
01 12 01 03 81 2f 1d 64 0a fd 76 a3 54 4c 99 26
0f 48 4f b7 4b 40 31 59 45 59 81 80 81 8a 01 01
01 01 01 01 01 01 d4 30 90 e8 60 1a 27 40 30 20
36 00 da 28 11 00 00 1e 00 00 00 ff 00 30 30 30
30 30 30 30 30 30 30 30 00 0a 00 00 00 fd 00 37
55 1e 50 0f 00 0a 20 20 20 20 20 20 00 00 00 fc
00 32 32 52 54 56 4e 0a 20 20 20 20 20 20 01 c7

02 03 1a 71 47 85 04 03 01 11 13 14 23 09 07 07
83 01 00 00 66 03 0c 00 10 00 01 1d 80 18 71 1c
16 20 58 2c 25 00 24 cd 31 00 00 9e 01 1d 00 72
51 d0 1e 20 6e 28 55 00 34 cd 31 00 00 1e 8c 0a
d0 8a 20 e0 2d 10 10 3e 96 00 34 cd 31 00 00 18
01 1d 80 d0 72 1c 16 20 10 2c 25 80 34 cd 31 00
00 9e 00 00 00 00 00 00 00 00 00 00 00 00 00 00
00 00 00 00 00 00 00 00 00 00 00 00 00 00 00 d7

----------------

Block 0, Base EDID:
  EDID Structure Version & Revision: 1.3
  Vendor & Product Identification:
    Manufacturer: OTC
    Model: 288
    Made in: week 1 of 2008
  Basic Display Parameters & Features:
    Digital display
    DFP 1.x compatible TMDS
    Maximum image size: 47 cm x 29 cm
    Gamma: 2.00
    RGB color display
    First detailed timing is the preferred timing
  Color Characteristics:
    Red  : 0.6396, 0.3310
    Green: 0.2998, 0.5986
    Blue : 0.1494, 0.0615
    White: 0.2822, 0.3105
  Established Timings I & II:
    IBM     :   720x400    70.082 Hz   9:5    31.467 kHz  28.320 MHz
    DMT 0x04:   640x480    59.940 Hz   4:3    31.469 kHz  25.175 MHz
    Apple   :   640x480    66.667 Hz   4:3    35.000 kHz  30.240 MHz
    DMT 0x06:   640x480    75.000 Hz   4:3    37.500 kHz  31.500 MHz
    DMT 0x08:   800x600    56.250 Hz   4:3    35.156 kHz  36.000 MHz
    DMT 0x09:   800x600    60.317 Hz   4:3    37.879 kHz  40.000 MHz
    DMT 0x0b:   800x600    75.000 Hz   4:3    46.875 kHz  49.500 MHz
    DMT 0x10:  1024x768    60.004 Hz   4:3    48.363 kHz  65.000 MHz
    DMT 0x12:  1024x768    75.029 Hz   4:3    60.023 kHz  78.750 MHz
    DMT 0x24:  1280x1024   75.025 Hz   5:4    79.976 kHz 135.000 MHz
  Standard Timings:
    DMT 0x07:   640x480    85.008 Hz   4:3    43.269 kHz  36.000 MHz
    DMT 0x0c:   800x600    85.061 Hz   4:3    53.674 kHz  56.250 MHz
    DMT 0x23:  1280x1024   60.020 Hz   5:4    63.981 kHz 108.000 MHz
    GTF     :  1280x1024   70.000 Hz   5:4    74.620 kHz 128.943 MHz
  Detailed Timing Descriptors:
    DTD 1:  1680x1050   60.034 Hz   8:5    65.377 kHz 125.000 MHz (474 mm x 296 mm)
                 Hfront   48 Hsync  32 Hback 152 Hpol P
                 Vfront    3 Vsync   6 Vback  30 Vpol P
    Display Product Serial Number: ...
  Display Range Limits:
    Monitor ranges (GTF): 55-85 Hz V, 30-80 kHz H, max dotclock 150 MHz
    Display Product Name: '22RTVN'
  Extension blocks: 1
Checksum: 0xc7

----------------

Block 1, CTA-861 Extension Block:
  Revision: 3
  Basic audio support
  Supports YCbCr 4:4:4
  Supports YCbCr 4:2:2
  Native detailed modes: 1
  Video Data Block:
    VIC   5:  1920x1080i  60.000 Hz  16:9    33.750 kHz  74.250 MHz (native)
    VIC   4:  1280x720    60.000 Hz  16:9    45.000 kHz  74.250 MHz
    VIC   3:   720x480    59.940 Hz  16:9    31.469 kHz  27.000 MHz
    VIC   1:   640x480    59.940 Hz   4:3    31.469 kHz  25.175 MHz
    VIC  17:   720x576    50.000 Hz   4:3    31.250 kHz  27.000 MHz
    VIC  19:  1280x720    50.000 Hz  16:9    37.500 kHz  74.250 MHz
    VIC  20:  1920x1080i  50.000 Hz  16:9    28.125 kHz  74.250 MHz
  Audio Data Block:
    Linear PCM:
      Max channels: 2
      Supported sample rates (kHz): 48 44.1 32
      Supported sample sizes (bits): 24 20 16
  Speaker Allocation Data Block:
    FL/FR - Front Left/Right
  Vendor-Specific Data Block (HDMI), OUI 00-0C-03:
    Source physical address: 1.0.0.0
    DVI_Dual
  Detailed Timing Descriptors:
    DTD 2:  1920x1080i  60.000 Hz  16:9    33.750 kHz  74.250 MHz (804 mm x 461 mm)
                 Hfront   88 Hsync  44 Hback 148 Hpol P
                 Vfront    2 Vsync   5 Vback  15 Vpol P Vfront +0.5 Odd Field
                 Vfront    2 Vsync   5 Vback  15 Vpol P Vback  +0.5 Even Field
    DTD 3:  1280x720    60.000 Hz  16:9    45.000 kHz  74.250 MHz (820 mm x 461 mm)
                 Hfront  110 Hsync  40 Hback 220 Hpol P
                 Vfront    5 Vsync   5 Vback  20 Vpol P
    DTD 4:   720x480    59.940 Hz   3:2    31.469 kHz  27.000 MHz (820 mm x 461 mm)
                 Hfront   16 Hsync  62 Hback  60 Hpol N
                 Vfront    9 Vsync   6 Vback  30 Vpol N
    DTD 5:  1920x1080i  50.000 Hz  16:9    28.125 kHz  74.250 MHz (820 mm x 461 mm)
                 Hfront  528 Hsync  44 Hback 148 Hpol P
                 Vfront    2 Vsync   5 Vback  15 Vpol P Vfront +0.5 Odd Field
                 Vfront    2 Vsync   5 Vback  15 Vpol P Vback  +0.5 Even Field
Checksum: 0xd7

----------------

Warnings:

Block 1, CTA-861 Extension Block:
  IT Video Formats are overscanned by default, but normally this should be underscanned.
  Missing VCDB, needed for Set Selectable RGB Quantization to avoid interop issues.

Failures:

Block 0, Base EDID:
  Display Product Serial Number: Non-printable character.
Block 1, CTA-861 Extension Block:
  Offset is 26, but should be 27.
  Detailed Timing Descriptor #2: Mismatch of image size 804x461 mm vs display size 470x290 mm.
  Detailed Timing Descriptor #3: Mismatch of image size 820x461 mm vs display size 470x290 mm.
  Detailed Timing Descriptor #4: Mismatch of image size 820x461 mm vs display size 470x290 mm.
  Detailed Timing Descriptor #5: Mismatch of image size 820x461 mm vs display size 470x290 mm.
EDID:
  Base EDID: Some timings are out of range of the Monitor Ranges:
    Vertical Freq: 50.000 - 85.061 Hz (Monitor: 55.000 - 85.000 Hz)
    Horizontal Freq: 28.125 - 79.976 kHz (Monitor: 30.000 - 80.000 kHz)

EDID conformity: FAIL
