edid-decode (hex):

00 ff ff ff ff ff ff 00 0d ae 01 13 00 00 00 00
2c 1d 01 04 a5 1c 11 78 ea ee 95 a3 54 4c 99 26
0f 50 54 00 00 00 01 01 01 01 01 01 01 01 01 01
01 01 01 01 01 01 50 46 70 2c 80 46 11 50 10 10
81 00 18 af 10 00 00 18 50 23 70 2c 80 46 11 50
10 10 81 00 18 af 10 00 00 18 00 00 00 fe 00 43
4d 4e 0a 20 20 20 20 20 20 20 01 13 00 00 00 fe
00 50 31 30 31 5a 46 5a 2d 42 48 32 20 20 00 e1

----------------

Block 0, Base EDID:
  EDID Structure Version & Revision: 1.4
  Vendor & Product Identification:
    Manufacturer: CMN
    Model: 4865
    Made in: week 44 of 2019
  Basic Display Parameters & Features:
    Digital display
    Bits per primary color channel: 8
    DisplayPort interface
    Maximum image size: 28 cm x 17 cm
    Gamma: 2.20
    DPMS levels: Standby Suspend Off
    Supported color formats: RGB 4:4:4, YCrCb 4:4:4
    First detailed timing includes the native pixel format and preferred refresh rate
  Color Characteristics:
    Red  : 0.6396, 0.3300
    Green: 0.2998, 0.5996
    Blue : 0.1503, 0.0595
    White: 0.3134, 0.3291
  Established Timings I & II: none
  Standard Timings: none
  Detailed Timing Descriptors:
    DTD 1:  2160x1350   59.743739 Hz  16:10    81.670 kHz    180.000000 MHz (280 mm x 175 mm)
                 Hfront   16 Hsync  16 Hback   12 Hpol N
                 Vfront    8 Vsync   1 Vback    8 Vpol N
    DTD 2:  2160x1350   30.004633 Hz  16:10    41.016 kHz     90.400000 MHz (280 mm x 175 mm)
                 Hfront   16 Hsync  16 Hback   12 Hpol N
                 Vfront    8 Vsync   1 Vback    8 Vpol N
    Alphanumeric Data String: 'CMN'
    Alphanumeric Data String: 'P101ZFZ-BH2  '
Checksum: 0xe1

----------------

Warnings:

Block 0, Base EDID:
  Missing Display Product Name.

Failures:

Block 0, Base EDID:
  Alphanumeric Data String: Non-space after newline.
  Alphanumeric Data String: One or more trailing spaces.

EDID conformity: FAIL
