
EDID (hex):
00ffffffffffff001e6d2a776b2b0500
061c0104b54627789f0595a756519c25
155054256b807140818081c0a9c0b300
d1c08100d1cf28de0050a0a038500830
0804b9882100001ab8bc0050a0a05550
0838f80cb9882100001a000000fd0030
90e6e63c010a202020202020000000fc
004c47205148440a202020202020017e
0203087123090607d97600a0a0a03450
30203500b9882100001a565e00a0a0a0
295030203500b9882100001a00000000
00000000000000000000000000000000
00000000000000000000000000000000
00000000000000000000000000000000
00000000000000000000000000000000
00000000000000000000000000000087

Extracted contents:
header:          00 ff ff ff ff ff ff 00
serial number:   1e 6d 2a 77 6b 2b 05 00 06 1c
version:         01 04
basic params:    b5 46 27 78 9f
chroma info:     05 95 a7 56 51 9c 25 15 50 54
established:     25 6b 80
standard:        71 40 81 80 81 c0 a9 c0 b3 00 d1 c0 81 00 d1 cf
descriptor 1:    28 de 00 50 a0 a0 38 50 08 30 08 04 b9 88 21 00 00 1a
descriptor 2:    b8 bc 00 50 a0 a0 55 50 08 38 f8 0c b9 88 21 00 00 1a
descriptor 3:    00 00 00 fd 00 30 90 e6 e6 3c 01 0a 20 20 20 20 20 20
descriptor 4:    00 00 00 fc 00 4c 47 20 51 48 44 0a 20 20 20 20 20 20
extensions:      01
checksum:        7e

EDID version: 1.4
Manufacturer: GSM Model 772a Serial Number --
Made in week 6 of 2018
Digital display
10 bits per primary color channel
DisplayPort interface
Maximum image size: 70 cm x 39 cm
Gamma: 2.20
DPMS levels: Standby
Supported color formats: RGB 4:4:4, YCrCb 4:4:4, YCrCb 4:2:2
Default (sRGB) color space is primary color space
First detailed timing includes the native pixel format and preferred refresh rate
Display is continuous frequency
Display x,y Chromaticity:
  Red:   0.6523, 0.3359
  Green: 0.3173, 0.6103
  Blue:  0.1464, 0.0830
  White: 0.3134, 0.3291
Established timings supported:
  640x480@60Hz 4:3 HorFreq: 31469 Hz Clock: 25.175 MHz
  640x480@75Hz 4:3 HorFreq: 37500 Hz Clock: 31.500 MHz
  800x600@60Hz 4:3 HorFreq: 37900 Hz Clock: 40.000 MHz
  800x600@75Hz 4:3 HorFreq: 46900 Hz Clock: 49.500 MHz
  832x624@75Hz 4:3 HorFreq: 49726 Hz Clock: 57.284 MHz
  1024x768@60Hz 4:3 HorFreq: 48400 Hz Clock: 65.000 MHz
  1024x768@75Hz 4:3 HorFreq: 60000 Hz Clock: 78.750 MHz
  1280x1024@75Hz 5:4 HorFreq: 80000 Hz Clock: 135.000 MHz
  1152x870@75Hz 192:145 HorFreq: 67500 Hz Clock: 108.000 MHz
Standard timings supported:
  1152x864@60Hz 4:3
  1280x1024@60Hz 5:4 HorFreq: 64000 Hz Clock: 108.000 MHz
  1280x720@60Hz 16:9
  1600x900@60Hz 16:9
  1680x1050@60Hz 16:10 HorFreq: 64700 Hz Clock: 119.000 MHz
  1920x1080@60Hz 16:9
  1280x800@60Hz 16:10
  1920x1080@75Hz 16:9
Detailed mode: Clock 568.720 MHz, 697 mm x 392 mm
               2560 2568 2616 2640 hborder 0
               1440 1456 1464 1496 vborder 0
               +hsync -vsync 
               VertFreq: 144 Hz, HorFreq: 215424 Hz
Detailed mode: Clock 483.120 MHz, 697 mm x 392 mm
               2560 2568 2624 2640 hborder 0
               1440 1503 1511 1525 vborder 0
               +hsync -vsync 
               VertFreq: 120 Hz, HorFreq: 183000 Hz
Monitor ranges (bare limits): 48-144Hz V, 230-230kHz H, max dotclock 600MHz
Monitor name: LG QHD
Has 1 extension blocks
Checksum: 0x7e (valid)

CTA extension block
Extension version: 3
4 bytes of CTA data
  Audio data block
    Linear PCM, max channels 2
      Supported sample rates (kHz): 48 44.1
      Supported sample sizes (bits): 24 20 16
Basic audio support
Supports YCbCr 4:4:4
Supports YCbCr 4:2:2
1 native detailed modes
Detailed mode: Clock 304.250 MHz, 697 mm x 392 mm
               2560 2608 2640 2720 hborder 0
               1440 1443 1448 1492 vborder 0
               +hsync -vsync 
               VertFreq: 74 Hz, HorFreq: 111856 Hz
Detailed mode: Clock 241.500 MHz, 697 mm x 392 mm
               2560 2608 2640 2720 hborder 0
               1440 1443 1448 1481 vborder 0
               +hsync -vsync 
               VertFreq: 59 Hz, HorFreq: 88786 Hz
Checksum: 0x87 (valid)

EDID block does NOT conform to EDID 1.4!
	sRGB is signaled, but the chromaticities do not match
Warning: One or more of the timings is out of range of the Monitor Ranges:
  Vertical Freq: 59 - 144 Hz
  Horizontal Freq: 31469 - 215424 Hz
  Maximum Clock: 568.720 MHz
