edid-decode (hex):

00 ff ff ff ff ff ff 00 26 cf 8c 04 00 00 00 00
0a 19 01 04 95 1a 0e 78 0a 96 10 96 54 4d 8e 2d
1a 50 54 00 00 00 01 01 01 01 01 01 01 01 01 01
01 01 01 01 01 01 87 1b 56 88 50 00 0e 30 28 20
55 00 00 90 10 00 00 19 00 00 00 00 00 00 00 00
00 00 00 00 00 00 00 00 00 00 00 00 00 fe 00 49
6e 66 6f 56 69 73 69 6f 6e 0a 20 20 00 00 00 fe
00 4d 31 31 36 4e 57 52 34 20 52 31 20 0a 00 29

----------------

Block 0, Base EDID:
  EDID Structure Version & Revision: 1.4
  Vendor & Product Identification:
    Manufacturer: IVO
    Model: 1164
    Made in: week 10 of 2015
  Basic Display Parameters & Features:
    Digital display
    Bits per primary color channel: 6
    DisplayPort interface
    Maximum image size: 26 cm x 14 cm
    Gamma: 2.20
    Supported color formats: RGB 4:4:4, YCrCb 4:4:4
    First detailed timing includes the native pixel format and preferred refresh rate
  Color Characteristics:
    Red  : 0.5878, 0.3291
    Green: 0.3017, 0.5566
    Blue : 0.1757, 0.1025
    White: 0.3125, 0.3281
  Established Timings I & II: none
  Standard Timings: none
  Detailed Timing Descriptors:
    DTD 1:  1366x768    59.997 Hz 683:384  46.917 kHz  70.470 MHz (256 mm x 144 mm)
                 Hfront   40 Hsync  32 Hback  64 Hpol N
                 Vfront    5 Vsync   5 Vback   4 Vpol N
    Empty Descriptor
    Alphanumeric Data String: 'InfoVision'
    Alphanumeric Data String: 'M116NWR4 R1 '
Checksum: 0x29
