edid-decode (hex):

00 ff ff ff ff ff ff 00 30 64 07 22 37 36 32 38
05 14 01 03 90 1d 12 78 0a 11 a5 97 5a 52 8d 24
23 4e 57 00 00 00 01 01 01 01 01 01 01 01 01 01
01 01 01 01 01 01 3a 20 00 77 51 20 1f 30 48 80
36 00 1f b4 10 00 00 1a fe 15 00 9e 51 20 1f 30
48 80 36 00 1f b4 10 00 00 1a 00 00 00 fe 00 4d
54 32 39 31 80 31 33 33 45 56 33 0a 00 00 00 fe
00 00 00 00 00 00 00 00 00 01 01 0a 20 20 00 26

00 ff ff ff ff ff ff 00 30 64 07 22 37 36 32 38
05 14 01 03 90 1d 12 78 0a 11 a5 97 5a 52 8d 24
23 4e 57 00 00 00 01 01 01 01 01 01 01 01 01 01
01 01 01 01 01 01 3a 20 00 77 51 20 1f 30 48 80
36 00 1f b4 10 00 00 1a fe 15 00 9e 51 20 1f 30
48 80 36 00 1f b4 10 00 00 1a 00 00 00 fe 00 4d
54 32 39 31 80 31 33 33 45 56 33 0a 00 00 00 fe
00 00 00 00 00 00 00 00 00 01 01 0a 20 20 00 26

----------------

Block 0, Base EDID:
  EDID Structure Version & Revision: 1.3
  Vendor & Product Identification:
    Manufacturer: LCD
    Model: 8711
    Serial Number: ...
    Made in: week 5 of 2010
  Basic Display Parameters & Features:
    Digital display
    Maximum image size: 29 cm x 18 cm
    Gamma: 2.20
    RGB color display
    First detailed timing is the preferred timing
  Color Characteristics:
    Red  : 0.5898, 0.3525
    Green: 0.3203, 0.5517
    Blue : 0.1425, 0.1386
    White: 0.3056, 0.3408
  Established Timings I & II: none
  Standard Timings: none
  Detailed Timing Descriptors:
    DTD 1:  1280x800    59.986694 Hz  16:10    49.849 kHz     82.500000 MHz (287 mm x 180 mm)
                 Hfront   72 Hsync 128 Hback  175 Hpol P
                 Vfront    3 Vsync   6 Vback   22 Vpol N
    DTD 2:  1280x800    39.993919 Hz  16:10    33.235 kHz     56.300000 MHz (287 mm x 180 mm)
                 Hfront   72 Hsync 128 Hback  214 Hpol P
                 Vfront    3 Vsync   6 Vback   22 Vpol N
    SPWG Module Revision: 26
    SPWG Descriptor #3:
      SPWG PC Maker P/N: 'MT291'
      SPWG LCD Supplier EEDID Revision: 128
      SPWG Manufacturer P/N: '133EV3'
    SPWG Descriptor #4:
      SMBUS Values: 0x00 0x00 0x00 0x00 0x00 0x00 0x00 0x00
      LVDS Channels: 1
      Panel Self Test Present
Checksum: 0x26

----------------

Block 1, Unknown EDID Extension Block 0x00:
  00 ff ff ff ff ff ff 00 30 64 07 22 37 36 32 38 '........0d."7628'
  05 14 01 03 90 1d 12 78 0a 11 a5 97 5a 52 8d 24 '.......x....ZR.$'
  23 4e 57 00 00 00 01 01 01 01 01 01 01 01 01 01 '#NW.............'
  01 01 01 01 01 01 3a 20 00 77 51 20 1f 30 48 80 '......: .wQ .0H.'
  36 00 1f b4 10 00 00 1a fe 15 00 9e 51 20 1f 30 '6...........Q .0'
  48 80 36 00 1f b4 10 00 00 1a 00 00 00 fe 00 4d 'H.6............M'
  54 32 39 31 80 31 33 33 45 56 33 0a 00 00 00 fe 'T291.133EV3.....'
  00 00 00 00 00 00 00 00 00 01 01 0a 20 20 00 26 '............  .&'
Checksum: 0x26

----------------

Failures:

Block 0, Base EDID:
  Basic Display Parameters & Features: Digital Video Interface Standard set to reserved value 0x10.
  Missing Display Product Name.
  Missing Display Range Limits Descriptor.
Block 1, Base EDID:
  Unknown Extension Block.
EDID:
  Base EDID: EDID specified 0 extension block(s), but found 1 extension block(s).

EDID conformity: FAIL
