edid-decode (hex):

00 ff ff ff ff ff ff 00 41 0c 47 09 c6 37 00 00
23 1e 01 04 a5 3c 22 78 3a d7 05 aa 50 4a a7 27
0c 50 54 bf ef 00 d1 c0 b3 00 95 00 81 80 81 40
81 c0 01 01 01 01 56 5e 00 a0 a0 a0 29 50 30 20
35 00 55 50 21 00 00 1e 00 00 00 ff 00 55 4b 30
32 30 33 35 30 31 34 32 37 38 00 00 00 fc 00 50
48 4c 20 32 37 36 42 31 0a 20 20 20 00 00 00 fd
00 30 4b 1e 72 1e 01 0a 20 20 20 20 20 20 01 92

02 03 18 f1 4b 01 03 05 14 04 13 1f 12 02 11 90
23 09 07 07 83 01 00 00 a0 73 00 6a a0 a0 29 50
08 20 35 00 55 50 21 00 00 1a 2a 44 80 a0 70 38
27 40 30 20 35 00 55 50 21 00 00 1a 02 3a 80 18
71 38 2d 40 58 2c 45 00 55 50 21 00 00 1e 01 1d
00 72 51 d0 1e 20 6e 28 55 00 55 50 21 00 00 1e
f0 3c 00 d0 51 a0 35 50 60 88 3a 00 55 50 21 00
00 1c 00 00 00 00 00 00 00 00 00 00 00 00 00 a1

00 ff ff ff ff ff ff 00 41 0c 47 09 c6 37 00 00
23 1e 01 04 a5 3c 22 78 3a d7 05 aa 50 4a a7 27
0c 50 54 bf ef 00 d1 c0 b3 00 95 00 81 80 81 40
81 c0 01 01 01 01 56 5e 00 a0 a0 a0 29 50 30 20
35 00 55 50 21 00 00 1e 00 00 00 ff 00 55 4b 30
32 30 33 35 30 31 34 32 37 38 00 00 00 fc 00 50
48 4c 20 32 37 36 42 31 0a 20 20 20 00 00 00 fd
00 30 4b 1e 72 1e 01 0a 20 20 20 20 20 20 01 92

02 03 18 f1 4b 01 03 05 14 04 13 1f 12 02 11 90
23 09 07 07 83 01 00 00 a0 73 00 6a a0 a0 29 50
08 20 35 00 55 50 21 00 00 1a 2a 44 80 a0 70 38
27 40 30 20 35 00 55 50 21 00 00 1a 02 3a 80 18
71 38 2d 40 58 2c 45 00 55 50 21 00 00 1e 01 1d
00 72 51 d0 1e 20 6e 28 55 00 55 50 21 00 00 1e
f0 3c 00 d0 51 a0 35 50 60 88 3a 00 55 50 21 00
00 1c 00 00 00 00 00 00 00 00 00 00 00 00 00 a1

----------------

Block 0, Base EDID:
  EDID Structure Version & Revision: 1.4
  Vendor & Product Identification:
    Manufacturer: PHL
    Model: 2375
    Serial Number: ...
    Made in: week 35 of 2020
  Basic Display Parameters & Features:
    Digital display
    Bits per primary color channel: 8
    DisplayPort interface
    Maximum image size: 60 cm x 34 cm
    Gamma: 2.20
    DPMS levels: Off
    Supported color formats: RGB 4:4:4, YCrCb 4:4:4, YCrCb 4:2:2
    First detailed timing includes the native pixel format and preferred refresh rate
  Color Characteristics:
    Red  : 0.6669, 0.3134
    Green: 0.2900, 0.6552
    Blue : 0.1523, 0.0468
    White: 0.3134, 0.3291
  Established Timings I & II:
    IBM     :   720x400    70.081663 Hz   9:5     31.467 kHz     28.320000 MHz
    DMT 0x04:   640x480    59.940476 Hz   4:3     31.469 kHz     25.175000 MHz
    Apple   :   640x480    66.666667 Hz   4:3     35.000 kHz     30.240000 MHz
    DMT 0x05:   640x480    72.808802 Hz   4:3     37.861 kHz     31.500000 MHz
    DMT 0x06:   640x480    75.000000 Hz   4:3     37.500 kHz     31.500000 MHz
    DMT 0x08:   800x600    56.250000 Hz   4:3     35.156 kHz     36.000000 MHz
    DMT 0x09:   800x600    60.316541 Hz   4:3     37.879 kHz     40.000000 MHz
    DMT 0x0a:   800x600    72.187572 Hz   4:3     48.077 kHz     50.000000 MHz
    DMT 0x0b:   800x600    75.000000 Hz   4:3     46.875 kHz     49.500000 MHz
    Apple   :   832x624    74.551266 Hz   4:3     49.726 kHz     57.284000 MHz
    DMT 0x10:  1024x768    60.003840 Hz   4:3     48.363 kHz     65.000000 MHz
    DMT 0x11:  1024x768    70.069359 Hz   4:3     56.476 kHz     75.000000 MHz
    DMT 0x12:  1024x768    75.028582 Hz   4:3     60.023 kHz     78.750000 MHz
    DMT 0x24:  1280x1024   75.024675 Hz   5:4     79.976 kHz    135.000000 MHz
  Standard Timings:
    DMT 0x52:  1920x1080   60.000000 Hz  16:9     67.500 kHz    148.500000 MHz
    DMT 0x3a:  1680x1050   59.954250 Hz  16:10    65.290 kHz    146.250000 MHz
    DMT 0x2f:  1440x900    59.887445 Hz  16:10    55.935 kHz    106.500000 MHz
    DMT 0x23:  1280x1024   60.019740 Hz   5:4     63.981 kHz    108.000000 MHz
    DMT 0x20:  1280x960    60.000000 Hz   4:3     60.000 kHz    108.000000 MHz
    DMT 0x55:  1280x720    60.000000 Hz  16:9     45.000 kHz     74.250000 MHz
  Detailed Timing Descriptors:
    DTD  1:  2560x1440   59.950550 Hz  16:9     88.787 kHz    241.500000 MHz (597 mm x 336 mm)
                  Hfront   48 Hsync  32 Hback   80 Hpol P
                  Vfront    3 Vsync   5 Vback   33 Vpol P
    Display Product Serial Number: ...
    Display Product Name: 'PHL 276B1'
    Display Range Limits:
      Monitor ranges (Bare Limits): 48-75 Hz V, 30-114 kHz H, max dotclock 300 MHz
  Extension blocks: 1
Checksum: 0x92

----------------

Block 1, CTA-861 Extension Block:
  Revision: 3
  Underscans IT Video Formats by default
  Basic audio support
  Supports YCbCr 4:4:4
  Supports YCbCr 4:2:2
  Native detailed modes: 1
  Video Data Block:
    VIC   1:   640x480    59.940476 Hz   4:3     31.469 kHz     25.175000 MHz
    VIC   3:   720x480    59.940060 Hz  16:9     31.469 kHz     27.000000 MHz
    VIC   5:  1920x1080i  60.000000 Hz  16:9     33.750 kHz     74.250000 MHz
    VIC  20:  1920x1080i  50.000000 Hz  16:9     28.125 kHz     74.250000 MHz
    VIC   4:  1280x720    60.000000 Hz  16:9     45.000 kHz     74.250000 MHz
    VIC  19:  1280x720    50.000000 Hz  16:9     37.500 kHz     74.250000 MHz
    VIC  31:  1920x1080   50.000000 Hz  16:9     56.250 kHz    148.500000 MHz
    VIC  18:   720x576    50.000000 Hz  16:9     31.250 kHz     27.000000 MHz
    VIC   2:   720x480    59.940060 Hz   4:3     31.469 kHz     27.000000 MHz
    VIC  17:   720x576    50.000000 Hz   4:3     31.250 kHz     27.000000 MHz
    VIC  16:  1920x1080   60.000000 Hz  16:9     67.500 kHz    148.500000 MHz (native)
  Audio Data Block:
    Linear PCM:
      Max channels: 2
      Supported sample rates (kHz): 48 44.1 32
      Supported sample sizes (bits): 24 20 16
  Speaker Allocation Data Block:
    FL/FR - Front Left/Right
  Detailed Timing Descriptors:
    DTD  2:  2560x1440   74.968101 Hz  16:9    111.028 kHz    296.000000 MHz (597 mm x 336 mm)
                  Hfront    8 Hsync  32 Hback   66 Hpol P
                  Vfront    3 Vsync   5 Vback   33 Vpol N
    DTD  3:  1920x1080   74.972503 Hz  16:9     83.894 kHz    174.500000 MHz (597 mm x 336 mm)
                  Hfront   48 Hsync  32 Hback   80 Hpol P
                  Vfront    3 Vsync   5 Vback   31 Vpol N
    DTD  4:  1920x1080   60.000000 Hz  16:9     67.500 kHz    148.500000 MHz (597 mm x 336 mm)
                  Hfront   88 Hsync  44 Hback  148 Hpol P
                  Vfront    4 Vsync   5 Vback   36 Vpol P
    DTD  5:  1280x720    60.000000 Hz  16:9     45.000 kHz     74.250000 MHz (597 mm x 336 mm)
                  Hfront  110 Hsync  40 Hback  220 Hpol P
                  Vfront    5 Vsync   5 Vback   20 Vpol P
    DTD  6:  1280x1440   59.912620 Hz   8:9     89.450 kHz    156.000000 MHz (597 mm x 336 mm)
                  Hfront   96 Hsync 136 Hback  232 Hpol N
                  Vfront    3 Vsync  10 Vback   40 Vpol P
Checksum: 0xa1  Unused space in Extension Block: 13 bytes

----------------

Block 2, Unknown EDID Extension Block 0x00:
  00 ff ff ff ff ff ff 00 41 0c 47 09 c6 37 00 00 '........A.G..7..'
  23 1e 01 04 a5 3c 22 78 3a d7 05 aa 50 4a a7 27 '#....<"x:...PJ.''
  0c 50 54 bf ef 00 d1 c0 b3 00 95 00 81 80 81 40 '.PT............@'
  81 c0 01 01 01 01 56 5e 00 a0 a0 a0 29 50 30 20 '......V^....)P0 '
  35 00 55 50 21 00 00 1e 00 00 00 ff 00 55 4b 30 '5.UP!........UK0'
  32 30 33 35 30 31 34 32 37 38 00 00 00 fc 00 50 '2035014278.....P'
  48 4c 20 32 37 36 42 31 0a 20 20 20 00 00 00 fd 'HL 276B1.   ....'
  00 30 4b 1e 72 1e 01 0a 20 20 20 20 20 20 01 92 '.0K.r...      ..'
Checksum: 0x92

----------------

Block 3, CTA-861 Extension Block:
  Revision: 3
  Underscans IT Video Formats by default
  Basic audio support
  Supports YCbCr 4:4:4
  Supports YCbCr 4:2:2
  Native detailed modes: 1
  Video Data Block:
    VIC   1:   640x480    59.940476 Hz   4:3     31.469 kHz     25.175000 MHz
    VIC   3:   720x480    59.940060 Hz  16:9     31.469 kHz     27.000000 MHz
    VIC   5:  1920x1080i  60.000000 Hz  16:9     33.750 kHz     74.250000 MHz
    VIC  20:  1920x1080i  50.000000 Hz  16:9     28.125 kHz     74.250000 MHz
    VIC   4:  1280x720    60.000000 Hz  16:9     45.000 kHz     74.250000 MHz
    VIC  19:  1280x720    50.000000 Hz  16:9     37.500 kHz     74.250000 MHz
    VIC  31:  1920x1080   50.000000 Hz  16:9     56.250 kHz    148.500000 MHz
    VIC  18:   720x576    50.000000 Hz  16:9     31.250 kHz     27.000000 MHz
    VIC   2:   720x480    59.940060 Hz   4:3     31.469 kHz     27.000000 MHz
    VIC  17:   720x576    50.000000 Hz   4:3     31.250 kHz     27.000000 MHz
    VIC  16:  1920x1080   60.000000 Hz  16:9     67.500 kHz    148.500000 MHz (native)
  Audio Data Block:
    Linear PCM:
      Max channels: 2
      Supported sample rates (kHz): 48 44.1 32
      Supported sample sizes (bits): 24 20 16
  Speaker Allocation Data Block:
    FL/FR - Front Left/Right
  Detailed Timing Descriptors:
    DTD  7:  2560x1440   74.968101 Hz  16:9    111.028 kHz    296.000000 MHz (597 mm x 336 mm)
                  Hfront    8 Hsync  32 Hback   66 Hpol P
                  Vfront    3 Vsync   5 Vback   33 Vpol N
    DTD  8:  1920x1080   74.972503 Hz  16:9     83.894 kHz    174.500000 MHz (597 mm x 336 mm)
                  Hfront   48 Hsync  32 Hback   80 Hpol P
                  Vfront    3 Vsync   5 Vback   31 Vpol N
    DTD  9:  1920x1080   60.000000 Hz  16:9     67.500 kHz    148.500000 MHz (597 mm x 336 mm)
                  Hfront   88 Hsync  44 Hback  148 Hpol P
                  Vfront    4 Vsync   5 Vback   36 Vpol P
    DTD 10:  1280x720    60.000000 Hz  16:9     45.000 kHz     74.250000 MHz (597 mm x 336 mm)
                  Hfront  110 Hsync  40 Hback  220 Hpol P
                  Vfront    5 Vsync   5 Vback   20 Vpol P
    DTD 11:  1280x1440   59.912620 Hz   8:9     89.450 kHz    156.000000 MHz (597 mm x 336 mm)
                  Hfront   96 Hsync 136 Hback  232 Hpol N
                  Vfront    3 Vsync  10 Vback   40 Vpol P
Checksum: 0xa1  Unused space in Extension Block: 13 bytes

----------------

Warnings:

Block 1, CTA-861 Extension Block:
  Display Product Serial Number is set, so the Serial Number in the Base EDID should be 0.
  Add a Colorimetry Data Block with the sRGB colorimetry bit set to avoid interop issues.
Block 3, CTA-861 Extension Block:
  Display Product Serial Number is set, so the Serial Number in the Base EDID should be 0.
  Add a Colorimetry Data Block with the sRGB colorimetry bit set to avoid interop issues.
EDID:
  Base EDID: Some timings are out of range of the Monitor Ranges:
    Horizontal Freq: 28.125 - 111.027 kHz (Monitor: 30.000 - 114.000 kHz)

Failures:

Block 1, CTA-861 Extension Block:
  Missing VCDB, needed for Set Selectable RGB Quantization to avoid interop issues.
Block 2, Base EDID:
  Unknown Extension Block.
Block 3, CTA-861 Extension Block:
  Video Data Block: Duplicate VIC 1.
  Video Data Block: Duplicate VIC 3.
  Video Data Block: Duplicate VIC 5.
  Video Data Block: Duplicate VIC 20.
  Video Data Block: Duplicate VIC 4.
  Video Data Block: Duplicate VIC 19.
  Video Data Block: Duplicate VIC 31.
  Video Data Block: Duplicate VIC 18.
  Video Data Block: Duplicate VIC 2.
  Video Data Block: Duplicate VIC 17.
  Video Data Block: Duplicate VIC 16.
  Speaker Allocation Data Block: Only one instance of this Data Block is allowed.
  Missing VCDB, needed for Set Selectable RGB Quantization to avoid interop issues.
EDID:
  Base EDID: EDID specified 1 extension block(s), but found 3 extension block(s).
  CTA-861: Native progressive timings are a mix of several resolutions.

EDID conformity: FAIL
