edid-decode (hex):

00 ff ff ff ff ff ff 00 41 0c 50 46 01 01 01 01
07 0e 01 03 68 46 27 78 88 da 70 a3 57 49 99 25
11 49 4b bf ef 00 31 59 45 59 61 59 71 4f 81 40
01 41 01 41 01 41 40 1f 00 70 51 00 2a 30 00 10
16 00 ba 89 21 00 00 18 00 00 00 ff 00 20 20 20
20 20 20 20 20 20 20 20 20 20 00 00 00 fc 00 50
48 4c 20 32 36 50 46 39 39 34 36 0a 00 00 00 fd
00 2f 55 1f 50 0e 00 0a 20 20 20 20 20 20 00 03

00 ff ff ff ff ff ff 00 41 0c 50 46 01 01 01 01
07 0e 01 03 68 46 27 78 88 da 70 a3 57 49 99 25
11 49 4b bf ef 00 31 59 45 59 61 59 71 4f 81 40
01 41 01 41 01 41 40 1f 00 70 51 00 2a 30 00 10
16 00 ba 89 21 00 00 18 00 00 00 ff 00 20 20 20
20 20 20 20 20 20 20 20 20 20 00 00 00 fc 00 50
48 4c 20 32 36 50 46 39 39 34 36 0a 00 00 00 fd
00 2f 55 1f 50 0e 00 0a 20 20 20 20 20 20 00 03

----------------

Block 0, Base EDID:
  EDID Structure Version & Revision: 1.3
  Vendor & Product Identification:
    Manufacturer: PHL
    Model: 18000
    Serial Number: ...
    Made in: week 7 of 2004
  Basic Display Parameters & Features:
    Analog display
    Signal Level Standard: 0.700 : 0.000 : 0.700 V p-p
    Blank level equals black level
    Sync: Separate
    Maximum image size: 70 cm x 39 cm
    Gamma: 2.20
    DPMS levels: Standby
    RGB color display
  Color Characteristics:
    Red  : 0.6396, 0.3408
    Green: 0.2871, 0.5996
    Blue : 0.1455, 0.0693
    White: 0.2851, 0.2929
  Established Timings I & II:
    IBM     :   720x400    70.081663 Hz   9:5     31.467 kHz     28.320000 MHz
    DMT 0x04:   640x480    59.940476 Hz   4:3     31.469 kHz     25.175000 MHz
    Apple   :   640x480    66.666667 Hz   4:3     35.000 kHz     30.240000 MHz
    DMT 0x05:   640x480    72.808802 Hz   4:3     37.861 kHz     31.500000 MHz
    DMT 0x06:   640x480    75.000000 Hz   4:3     37.500 kHz     31.500000 MHz
    DMT 0x08:   800x600    56.250000 Hz   4:3     35.156 kHz     36.000000 MHz
    DMT 0x09:   800x600    60.316541 Hz   4:3     37.879 kHz     40.000000 MHz
    DMT 0x0a:   800x600    72.187572 Hz   4:3     48.077 kHz     50.000000 MHz
    DMT 0x0b:   800x600    75.000000 Hz   4:3     46.875 kHz     49.500000 MHz
    Apple   :   832x624    74.551266 Hz   4:3     49.726 kHz     57.284000 MHz
    DMT 0x10:  1024x768    60.003840 Hz   4:3     48.363 kHz     65.000000 MHz
    DMT 0x11:  1024x768    70.069359 Hz   4:3     56.476 kHz     75.000000 MHz
    DMT 0x12:  1024x768    75.028582 Hz   4:3     60.023 kHz     78.750000 MHz
    DMT 0x24:  1280x1024   75.024675 Hz   5:4     79.976 kHz    135.000000 MHz
  Standard Timings:
    DMT 0x07:   640x480    85.008312 Hz   4:3     43.269 kHz     36.000000 MHz
    DMT 0x0c:   800x600    85.061274 Hz   4:3     53.674 kHz     56.250000 MHz
    DMT 0x13:  1024x768    84.996690 Hz   4:3     68.677 kHz     94.500000 MHz
    DMT 0x15:  1152x864    75.000000 Hz   4:3     67.500 kHz    108.000000 MHz
    DMT 0x20:  1280x960    60.000000 Hz   4:3     60.000 kHz    108.000000 MHz
  Detailed Timing Descriptors:
    DTD 1:  1280x768    59.930481 Hz   5:3     48.544 kHz     80.000000 MHz (698 mm x 393 mm)
                 Hfront    0 Hsync  16 Hback  352 Hpol N
                 Vfront    1 Vsync   6 Vback   35 Vpol N
                   40 1f 00 70 51 00 2a 30 00 10 16 00 ba 89 21 00 00 18 '@..pQ.*0......!...'
    Display Product Serial Number: ...
    Display Product Name: 'PHL 26PF9946'
    Display Range Limits:
      Monitor ranges (GTF): 47-85 Hz V, 31-80 kHz H, max dotclock 140 MHz
Checksum: 0x03

----------------

Block 1, Unknown EDID Extension Block 0x00:
  00 ff ff ff ff ff ff 00 41 0c 50 46 01 01 01 01 '........A.PF....'
  07 0e 01 03 68 46 27 78 88 da 70 a3 57 49 99 25 '....hF'x..p.WI.%'
  11 49 4b bf ef 00 31 59 45 59 61 59 71 4f 81 40 '.IK...1YEYaYqO.@'
  01 41 01 41 01 41 40 1f 00 70 51 00 2a 30 00 10 '.A.A.A@..pQ.*0..'
  16 00 ba 89 21 00 00 18 00 00 00 ff 00 20 20 20 '....!........   '
  20 20 20 20 20 20 20 20 20 20 00 00 00 fc 00 50 '          .....P'
  48 4c 20 32 36 50 46 39 39 34 36 0a 00 00 00 fd 'HL 26PF9946.....'
  00 2f 55 1f 50 0e 00 0a 20 20 20 20 20 20 00 03 './U.P...      ..'
Checksum: 0x03

----------------

Failures:

Block 0, Base EDID:
  Basic Display Parameters & Features: EDID 1.3 requires that the first detailed timing is the preferred timing.
  Standard Timings: Use 0x0101 as the invalid Standard Timings code, not 0x0141.
  Standard Timings: Use 0x0101 as the invalid Standard Timings code, not 0x0141.
  Standard Timings: Use 0x0101 as the invalid Standard Timings code, not 0x0141.
  Detailed Timing Descriptor #1: 0 values in the video timing:
    Horizontal Active/Blanking 1280/368
    Horizontal Frontporch/Sync Width 0/16
    Vertical Active/Blanking 768/42
    Vertical Frontporch/Sync Width 1/6
  Detailed Timing Descriptor #1: 0 or negative horizontal front porch.
  Display Product Serial Number: ...
Block 1, Base EDID:
  Unknown Extension Block.
EDID:
  Base EDID: EDID specified 0 extension block(s), but found 1 extension block(s).

EDID conformity: FAIL
