
EDID (hex):
00ffffffffffff001609412401000000
3219010380341d780af0659857519127
215054a1080001010101010101010101
010101010101011d007251d01e206e28
5500c48e2100001e662150b051001b30
407036000d292100001e000000fc0045
5049323434310a2020202020000000fd
00313d0f3109000a202020202020015d
020321c34e8493101f1f1f031f1f1f01
010101230907078301000065030c0030
00011d00bc52d01e20b8285540c48e21
00001e011d007251d01e206e285500c4
8e2100001e011d007251d01e206e2855
00c48e2100001e011d007251d01e206e
285500c48e21000018011d007251d01e
206e285500c48e21000018000000009f

Extracted contents:
header:          00 ff ff ff ff ff ff 00
serial number:   16 09 41 24 01 00 00 00 32 19
version:         01 03
basic params:    80 34 1d 78 0a
chroma info:     f0 65 98 57 51 91 27 21 50 54
established:     a1 08 00
standard:        01 01 01 01 01 01 01 01 01 01 01 01 01 01 01 01
descriptor 1:    01 1d 00 72 51 d0 1e 20 6e 28 55 00 c4 8e 21 00 00 1e
descriptor 2:    66 21 50 b0 51 00 1b 30 40 70 36 00 0d 29 21 00 00 1e
descriptor 3:    00 00 00 fc 00 45 50 49 32 34 34 31 0a 20 20 20 20 20
descriptor 4:    00 00 00 fd 00 31 3d 0f 31 09 00 0a 20 20 20 20 20 20
extensions:      01
checksum:        5d

EDID version: 1.3
Manufacturer: EPI Model 2441 Serial Number --
Made in week 50 of 2015
Digital display
Maximum image size: 52 cm x 29 cm
Gamma: 2.20
RGB color display
First detailed timing is preferred timing
Display x,y Chromaticity:
  Red:   0.5966, 0.3427
  Green: 0.3164, 0.5664
  Blue:  0.1533, 0.1308
  White: 0.3134, 0.3291
Established timings supported:
  720x400@70Hz 9:5 HorFreq: 31469 Hz Clock: 28.320 MHz
  640x480@60Hz 4:3 HorFreq: 31469 Hz Clock: 25.175 MHz
  800x600@60Hz 4:3 HorFreq: 37900 Hz Clock: 40.000 MHz
  1024x768@60Hz 4:3 HorFreq: 48400 Hz Clock: 65.000 MHz
Standard timings supported:
Detailed mode: Clock 74.250 MHz, 708 mm x 398 mm
               1280 1390 1430 1650 hborder 0
                720  725  730  750 vborder 0
               +hsync +vsync 
               VertFreq: 60 Hz, HorFreq: 45000 Hz
Detailed mode: Clock 85.500 MHz, 525 mm x 297 mm
               1360 1424 1536 1792 hborder 0
                768  771  777  795 vborder 0
               +hsync +vsync 
               VertFreq: 60 Hz, HorFreq: 47712 Hz
Monitor name: EPI2441
Monitor ranges (GTF): 49-61Hz V, 15-49kHz H, max dotclock 90MHz
Has 1 extension blocks
Checksum: 0x5d (valid)

CTA extension block
Extension version: 3
29 bytes of CTA data
  Video data block
    VIC   4 1280x720@60Hz 16:9 (native) HorFreq: 45000 Hz Clock: 74.250 MHz
    VIC  19 1280x720@50Hz 16:9 (native) HorFreq: 37500 Hz Clock: 74.250 MHz
    VIC  16 1920x1080@60Hz 16:9  HorFreq: 67500 Hz Clock: 148.500 MHz
    VIC  31 1920x1080@50Hz 16:9  HorFreq: 56250 Hz Clock: 148.500 MHz
    VIC  31 1920x1080@50Hz 16:9  HorFreq: 56250 Hz Clock: 148.500 MHz
    VIC  31 1920x1080@50Hz 16:9  HorFreq: 56250 Hz Clock: 148.500 MHz
    VIC   3 720x480@60Hz 16:9  HorFreq: 31469 Hz Clock: 27.000 MHz
    VIC  31 1920x1080@50Hz 16:9  HorFreq: 56250 Hz Clock: 148.500 MHz
    VIC  31 1920x1080@50Hz 16:9  HorFreq: 56250 Hz Clock: 148.500 MHz
    VIC  31 1920x1080@50Hz 16:9  HorFreq: 56250 Hz Clock: 148.500 MHz
    VIC   1 640x480@60Hz 4:3  HorFreq: 31469 Hz Clock: 25.175 MHz
    VIC   1 640x480@60Hz 4:3  HorFreq: 31469 Hz Clock: 25.175 MHz
    VIC   1 640x480@60Hz 4:3  HorFreq: 31469 Hz Clock: 25.175 MHz
    VIC   1 640x480@60Hz 4:3  HorFreq: 31469 Hz Clock: 25.175 MHz
  Audio data block
    Linear PCM, max channels 2
      Supported sample rates (kHz): 48 44.1 32
      Supported sample sizes (bits): 24 20 16
  Speaker allocation data block
    Speaker map:
      FL/FR - Front Left/Right
  Vendor-specific data block, OUI 000c03 (HDMI)
    Source physical address 3.0.0.0
Underscans PC formats by default
Basic audio support
3 native detailed modes
Detailed mode: Clock 74.250 MHz, 708 mm x 398 mm
               1280 1720 1760 1980 hborder 0
                720  725  730  750 vborder 0
               +hsync +vsync 
               VertFreq: 50 Hz, HorFreq: 37500 Hz
Detailed mode: Clock 74.250 MHz, 708 mm x 398 mm
               1280 1390 1430 1650 hborder 0
                720  725  730  750 vborder 0
               +hsync +vsync 
               VertFreq: 60 Hz, HorFreq: 45000 Hz
Detailed mode: Clock 74.250 MHz, 708 mm x 398 mm
               1280 1390 1430 1650 hborder 0
                720  725  730  750 vborder 0
               +hsync +vsync 
               VertFreq: 60 Hz, HorFreq: 45000 Hz
Detailed mode: Clock 74.250 MHz, 708 mm x 398 mm
               1280 1390 1430 1650 hborder 0
                720  725  730  750 vborder 0
               -hsync -vsync 
               VertFreq: 60 Hz, HorFreq: 45000 Hz
Detailed mode: Clock 74.250 MHz, 708 mm x 398 mm
               1280 1390 1430 1650 hborder 0
                720  725  730  750 vborder 0
               -hsync -vsync 
               VertFreq: 60 Hz, HorFreq: 45000 Hz
Checksum: 0x9f (valid)

One or more of the timings is out of range of the Monitor Ranges:
  Vertical Freq: 50 - 70 Hz
  Horizontal Freq: 31469 - 67500 Hz
  Maximum Clock: 148.500 MHz


