
EDID (hex):
00ffffffffffff00047225017cd92095
3413010380341d782aeed5a555489b26
125054bfef80714f810081809500950f
b300d1c00101023a801871382d40582c
450009252100001e000000fd0038781e
8c1d000a202020202020000000fc0041
636572204744323335485a0a000000ff
004c4d4e3057303031343330300a01a1
02010400fe5b80a07038354030203500
09252100001aa96580a070383a403020
350009252100001a866f80a070384040
3020350009252100001a000000000000
00000000000000000000000000000000
00000000000000000000000000000000
00000000000000000000000000000000
0000000000000000000000000000000c

Extracted contents:
header:          00 ff ff ff ff ff ff 00
serial number:   04 72 25 01 7c d9 20 95 34 13
version:         01 03
basic params:    80 34 1d 78 2a
chroma info:     ee d5 a5 55 48 9b 26 12 50 54
established:     bf ef 80
standard:        71 4f 81 00 81 80 95 00 95 0f b3 00 d1 c0 01 01
descriptor 1:    02 3a 80 18 71 38 2d 40 58 2c 45 00 09 25 21 00 00 1e
descriptor 2:    00 00 00 fd 00 38 78 1e 8c 1d 00 0a 20 20 20 20 20 20
descriptor 3:    00 00 00 fc 00 41 63 65 72 20 47 44 32 33 35 48 5a 0a
descriptor 4:    00 00 00 ff 00 4c 4d 4e 30 57 30 30 31 34 33 30 30 0a
extensions:      01
checksum:        a1

EDID version: 1.3
Manufacturer: ACR Model 125 Serial Number --
Made in week 52 of 2009
Digital display
Maximum image size: 52 cm x 29 cm
Gamma: 2.20
DPMS levels: Off
RGB color display
First detailed timing is preferred timing
Display x,y Chromaticity:
  Red:   0.6474, 0.3339
  Green: 0.2841, 0.6074
  Blue:  0.1513, 0.0712
  White: 0.3134, 0.3291
Established timings supported:
  720x400@70Hz 9:5 HorFreq: 31469 Hz Clock: 28.320 MHz
  640x480@60Hz 4:3 HorFreq: 31469 Hz Clock: 25.175 MHz
  640x480@67Hz 4:3 HorFreq: 35000 Hz Clock: 30.240 MHz
  640x480@72Hz 4:3 HorFreq: 37900 Hz Clock: 31.500 MHz
  640x480@75Hz 4:3 HorFreq: 37500 Hz Clock: 31.500 MHz
  800x600@56Hz 4:3 HorFreq: 35200 Hz Clock: 36.000 MHz
  800x600@60Hz 4:3 HorFreq: 37900 Hz Clock: 40.000 MHz
  800x600@72Hz 4:3 HorFreq: 48100 Hz Clock: 50.000 MHz
  800x600@75Hz 4:3 HorFreq: 46900 Hz Clock: 49.500 MHz
  832x624@75Hz 4:3 HorFreq: 49726 Hz Clock: 57.284 MHz
  1024x768@60Hz 4:3 HorFreq: 48400 Hz Clock: 65.000 MHz
  1024x768@70Hz 4:3 HorFreq: 56500 Hz Clock: 75.000 MHz
  1024x768@75Hz 4:3 HorFreq: 60000 Hz Clock: 78.750 MHz
  1280x1024@75Hz 5:4 HorFreq: 80000 Hz Clock: 135.000 MHz
  1152x870@75Hz 192:145 HorFreq: 67500 Hz Clock: 108.000 MHz
Standard timings supported:
  1152x864@75Hz 4:3 HorFreq: 67500 Hz Clock: 108.000 MHz
  1280x800@60Hz 16:10
  1280x1024@60Hz 5:4 HorFreq: 64000 Hz Clock: 108.000 MHz
  1440x900@60Hz 16:10 HorFreq: 55500 Hz Clock: 88.750 MHz
  1440x900@75Hz 16:10 HorFreq: 82300 Hz Clock: 156.000 MHz
  1680x1050@60Hz 16:10 HorFreq: 64700 Hz Clock: 119.000 MHz
  1920x1080@60Hz 16:9
Detailed mode: Clock 148.500 MHz, 521 mm x 293 mm
               1920 2008 2052 2200 hborder 0
               1080 1084 1089 1125 vborder 0
               +hsync +vsync 
               VertFreq: 60 Hz, HorFreq: 67500 Hz
Monitor ranges (GTF): 56-120Hz V, 30-140kHz H, max dotclock 290MHz
Monitor name: Acer GD235HZ
Serial number: --
Has 1 extension blocks
Checksum: 0xa1 (valid)

CTA extension block
Extension version: 1
0 8-byte timing descriptors
Detailed mode: Clock 235.500 MHz, 521 mm x 293 mm
               1920 1968 2000 2080 hborder 0
               1080 1083 1088 1133 vborder 0
               +hsync -vsync 
               VertFreq: 99 Hz, HorFreq: 113221 Hz
Detailed mode: Clock 260.250 MHz, 521 mm x 293 mm
               1920 1968 2000 2080 hborder 0
               1080 1083 1088 1138 vborder 0
               +hsync -vsync 
               VertFreq: 109 Hz, HorFreq: 125120 Hz
Detailed mode: Clock 285.500 MHz, 521 mm x 293 mm
               1920 1968 2000 2080 hborder 0
               1080 1083 1088 1144 vborder 0
               +hsync -vsync 
               VertFreq: 119 Hz, HorFreq: 137259 Hz
Checksum: 0xc (valid)

EDID block does not conform at all!
	Both the serial number and the serial string are set
