
EDID (hex):
00ffffffffffff000469a62793560100
32180104a53c22783a4dd5a7554a9d24
0e5054bfef00d1c0814081809500b300
714f81c001014dd000a0f0703e803020
3500544f2100001a04740030f2705a80
b0588a00544f2100001a000000fd001d
5018a03c041100f0f838f03c000000fc
00415355532050423237390a2020018f
020327714f0102031112130414051f90
0e0f1d1e23091707830100006a030c00
00000078200000565e00a0a0a0295030
203500544f2100001ee26800a0a0402e
6030203600544f2100001a011d00bc52
d01e20b8285540544f2100001e8c0ad0
90204031200c405500544f2100001800
000000000000000000000000000000f0

edid-decode (hex):

00 ff ff ff ff ff ff 00 04 69 a6 27 93 56 01 00
32 18 01 04 a5 3c 22 78 3a 4d d5 a7 55 4a 9d 24
0e 50 54 bf ef 00 d1 c0 81 40 81 80 95 00 b3 00
71 4f 81 c0 01 01 4d d0 00 a0 f0 70 3e 80 30 20
35 00 54 4f 21 00 00 1a 04 74 00 30 f2 70 5a 80
b0 58 8a 00 54 4f 21 00 00 1a 00 00 00 fd 00 1d
50 18 a0 3c 04 11 00 f0 f8 38 f0 3c 00 00 00 fc
00 41 53 55 53 20 50 42 32 37 39 0a 20 20 01 8f

02 03 27 71 4f 01 02 03 11 12 13 04 14 05 1f 90
0e 0f 1d 1e 23 09 17 07 83 01 00 00 6a 03 0c 00
00 00 00 78 20 00 00 56 5e 00 a0 a0 a0 29 50 30
20 35 00 54 4f 21 00 00 1e e2 68 00 a0 a0 40 2e
60 30 20 36 00 54 4f 21 00 00 1a 01 1d 00 bc 52
d0 1e 20 b8 28 55 40 54 4f 21 00 00 1e 8c 0a d0
90 20 40 31 20 0c 40 55 00 54 4f 21 00 00 18 00
00 00 00 00 00 00 00 00 00 00 00 00 00 00 00 f0

----------------

Block 0, Base EDID:
  EDID Structure Version & Revision: 1.4
  Vendor & Product Identification:
    Manufacturer: ACI
    Model: 10150
    Serial Number: 87699
    Made in: week 50 of 2014
  Basic Display Parameters & Features:
    Digital display
    Bits per primary color channel: 8
    DisplayPort interface
    Maximum image size: 60 cm x 34 cm
    Gamma: 2.20
    DPMS levels: Off
    Supported color formats: RGB 4:4:4, YCrCb 4:4:4, YCrCb 4:2:2
    First detailed timing includes the native pixel format and preferred refresh rate
  Color Characteristics:
    Red  : 0.6533, 0.3320
    Green: 0.2919, 0.6142
    Blue : 0.1435, 0.0556
    White: 0.3134, 0.3291
  Established Timings I & II:
    IBM     :   720x400    70.081663 Hz   9:5     31.467 kHz     28.320000 MHz
    DMT 0x04:   640x480    59.940476 Hz   4:3     31.469 kHz     25.175000 MHz
    Apple   :   640x480    66.666667 Hz   4:3     35.000 kHz     30.240000 MHz
    DMT 0x05:   640x480    72.808802 Hz   4:3     37.861 kHz     31.500000 MHz
    DMT 0x06:   640x480    75.000000 Hz   4:3     37.500 kHz     31.500000 MHz
    DMT 0x08:   800x600    56.250000 Hz   4:3     35.156 kHz     36.000000 MHz
    DMT 0x09:   800x600    60.316541 Hz   4:3     37.879 kHz     40.000000 MHz
    DMT 0x0a:   800x600    72.187572 Hz   4:3     48.077 kHz     50.000000 MHz
    DMT 0x0b:   800x600    75.000000 Hz   4:3     46.875 kHz     49.500000 MHz
    Apple   :   832x624    74.551266 Hz   4:3     49.726 kHz     57.284000 MHz
    DMT 0x10:  1024x768    60.003840 Hz   4:3     48.363 kHz     65.000000 MHz
    DMT 0x11:  1024x768    70.069359 Hz   4:3     56.476 kHz     75.000000 MHz
    DMT 0x12:  1024x768    75.028582 Hz   4:3     60.023 kHz     78.750000 MHz
    DMT 0x24:  1280x1024   75.024675 Hz   5:4     79.976 kHz    135.000000 MHz
  Standard Timings:
    DMT 0x52:  1920x1080   60.000000 Hz  16:9     67.500 kHz    148.500000 MHz
    DMT 0x20:  1280x960    60.000000 Hz   4:3     60.000 kHz    108.000000 MHz
    DMT 0x23:  1280x1024   60.019740 Hz   5:4     63.981 kHz    108.000000 MHz
    DMT 0x2f:  1440x900    59.887445 Hz  16:10    55.935 kHz    106.500000 MHz
    DMT 0x3a:  1680x1050   59.954250 Hz  16:10    65.290 kHz    146.250000 MHz
    DMT 0x15:  1152x864    75.000000 Hz   4:3     67.500 kHz    108.000000 MHz
    DMT 0x55:  1280x720    60.000000 Hz  16:9     45.000 kHz     74.250000 MHz
  Detailed Timing Descriptors:
    DTD 1:  3840x2160   59.996625 Hz  16:9    133.312 kHz    533.250000 MHz (596 mm x 335 mm)
                 Hfront   48 Hsync  32 Hback   80 Hpol P
                 Vfront    3 Vsync   5 Vback   54 Vpol N
    DTD 2:  3840x2160   30.000000 Hz  16:9     67.500 kHz    297.000000 MHz (596 mm x 335 mm)
                 Hfront  176 Hsync  88 Hback  296 Hpol P
                 Vfront    8 Vsync  10 Vback   72 Vpol N
    Display Range Limits:
      Monitor ranges (CVT): 29-80 Hz V, 24-160 kHz H, max dotclock 600 MHz
      CVT version 1.1
      Max active pixels per line: 1920
      Supported aspect ratios: 4:3 16:9 16:10 5:4 15:9
      Preferred aspect ratio: 16:9
      Supports CVT standard blanking
      Supports CVT reduced blanking
      Supported display scaling:
        Horizontal shrink
        Horizontal stretch
        Vertical shrink
        Vertical stretch
      Preferred vertical refresh: 60 Hz
    Display Product Name: 'ASUS PB279'
  Extension blocks: 1
Checksum: 0x8f

----------------

Block 1, CTA-861 Extension Block:
  Revision: 3
  Basic audio support
  Supports YCbCr 4:4:4
  Supports YCbCr 4:2:2
  Native detailed modes: 1
  Video Data Block:
    VIC   1:   640x480    59.940476 Hz   4:3     31.469 kHz     25.175000 MHz
    VIC   2:   720x480    59.940060 Hz   4:3     31.469 kHz     27.000000 MHz
    VIC   3:   720x480    59.940060 Hz  16:9     31.469 kHz     27.000000 MHz
    VIC  17:   720x576    50.000000 Hz   4:3     31.250 kHz     27.000000 MHz
    VIC  18:   720x576    50.000000 Hz  16:9     31.250 kHz     27.000000 MHz
    VIC  19:  1280x720    50.000000 Hz  16:9     37.500 kHz     74.250000 MHz
    VIC   4:  1280x720    60.000000 Hz  16:9     45.000 kHz     74.250000 MHz
    VIC  20:  1920x1080i  50.000000 Hz  16:9     28.125 kHz     74.250000 MHz
    VIC   5:  1920x1080i  60.000000 Hz  16:9     33.750 kHz     74.250000 MHz
    VIC  31:  1920x1080   50.000000 Hz  16:9     56.250 kHz    148.500000 MHz
    VIC  16:  1920x1080   60.000000 Hz  16:9     67.500 kHz    148.500000 MHz (native)
    VIC  14:  1440x480    59.940060 Hz   4:3     31.469 kHz     54.000000 MHz
    VIC  15:  1440x480    59.940060 Hz  16:9     31.469 kHz     54.000000 MHz
    VIC  29:  1440x576    50.000000 Hz   4:3     31.250 kHz     54.000000 MHz
    VIC  30:  1440x576    50.000000 Hz  16:9     31.250 kHz     54.000000 MHz
  Audio Data Block:
    Linear PCM:
      Max channels: 2
      Supported sample rates (kHz): 96 48 44.1 32
      Supported sample sizes (bits): 24 20 16
  Speaker Allocation Data Block:
    FL/FR - Front Left/Right
  Vendor-Specific Data Block (HDMI), OUI 00-0C-03:
    Source physical address: 0.0.0.0
    Maximum TMDS clock: 600 MHz
    Extended HDMI video details:
  Detailed Timing Descriptors:
    DTD 3:  2560x1440   59.950550 Hz  16:9     88.787 kHz    241.500000 MHz (596 mm x 335 mm)
                 Hfront   48 Hsync  32 Hback   80 Hpol P
                 Vfront    3 Vsync   5 Vback   33 Vpol P
    DTD 4:  2560x1600   59.971589 Hz  16:10    98.713 kHz    268.500000 MHz (596 mm x 335 mm)
                 Hfront   48 Hsync  32 Hback   80 Hpol P
                 Vfront    3 Vsync   6 Vback   37 Vpol N
    DTD 5:  1280x720    50.000000 Hz  16:9     37.500 kHz     74.250000 MHz (596 mm x 335 mm)
                 Hfront  440 Hsync  40 Hback  220 Hpol P
                 Vfront    5 Vsync   5 Vback   20 Vpol P
    DTD 6:   720x576    50.000000 Hz   5:4     31.250 kHz     27.000000 MHz (596 mm x 335 mm)
                 Hfront   12 Hsync  64 Hback   68 Hpol N
                 Vfront    5 Vsync   5 Vback   39 Vpol N
Checksum: 0xf0  Unused space in Extension Block: 16 bytes


