edid-decode (hex):

00 ff ff ff ff ff ff 00 0d ae 51 13 00 00 00 00
0b 17 01 04 95 1d 11 78 02 53 d5 98 58 52 90 27
21 50 54 00 00 00 01 01 01 01 01 01 01 01 01 01
01 01 01 01 01 01 da 1d 56 e2 50 00 20 30 44 2d
47 00 25 a5 10 00 00 1a e7 13 56 e2 50 00 20 30
44 2d 47 00 25 a5 10 00 00 1a 00 00 00 00 00 00
00 00 00 00 00 00 00 00 00 00 00 00 00 00 00 02
00 0c 4c ff 0a 3c 64 0f 0f 19 64 00 00 00 00 f6

----------------

Block 0, Base EDID:
  EDID Structure Version & Revision: 1.4
  Vendor & Product Identification:
    Manufacturer: CMN
    Model: 4945
    Made in: week 11 of 2013
  Basic Display Parameters & Features:
    Digital display
    Bits per primary color channel: 6
    DisplayPort interface
    Maximum image size: 29 cm x 17 cm
    Gamma: 2.20
    Supported color formats: RGB 4:4:4
    First detailed timing includes the native pixel format and preferred refresh rate
  Color Characteristics:
    Red  : 0.5947, 0.3447
    Green: 0.3203, 0.5654
    Blue : 0.1552, 0.1298
    White: 0.3134, 0.3291
  Established Timings I & II: none
  Standard Timings: none
  Detailed Timing Descriptors:
    DTD 1:  1366x768    60.003 Hz 683:384  48.003 kHz  76.420 MHz (293 mm x 165 mm)
                 Hfront   68 Hsync  45 Hback 113 Hpol P
                 Vfront    4 Vsync   7 Vback  21 Vpol N
    DTD 2:  1366x768    40.005 Hz 683:384  32.004 kHz  50.950 MHz (293 mm x 165 mm)
                 Hfront   68 Hsync  45 Hback 113 Hpol P
                 Vfront    4 Vsync   7 Vback  21 Vpol N
    Empty Descriptor
    Manufacturer-Specified Display Descriptor (0x02): 00 02 00 0c 4c ff 0a 3c 64 0f 0f 19 64 00 00 00 '....L..<d...d...'
Checksum: 0xf6
