edid-decode (hex):

00 ff ff ff ff ff ff 00 1c 54 00 32 01 01 01 01
1c 1e 01 04 b5 46 27 78 fb 37 b5 ae 4f 46 a6 26
10 50 54 3f cf 00 d1 c0 01 01 01 01 01 01 81 80
95 00 b3 00 01 01 f6 5b 00 6e a0 a0 1f 50 17 20
18 04 b9 88 21 00 00 1e 00 00 00 fd 00 30 a5 f3
f3 3c 01 0a 20 20 20 20 20 20 00 00 00 fc 00 47
33 32 51 43 0a 20 20 20 20 20 20 20 00 00 00 ff
00 32 30 32 38 30 42 30 30 31 36 37 39 0a 01 48

00 ff ff ff ff ff ff 00 1c 54 00 32 01 01 01 01
1c 1e 01 04 b5 46 27 78 fb 37 b5 ae 4f 46 a6 26
10 50 54 3f cf 00 d1 c0 01 01 01 01 01 01 81 80
95 00 b3 00 01 01 f6 5b 00 6e a0 a0 1f 50 17 20
18 04 b9 88 21 00 00 1e 00 00 00 fd 00 30 a5 f3
f3 3c 01 0a 20 20 20 20 20 20 00 00 00 fc 00 47
33 32 51 43 0a 20 20 20 20 20 20 20 00 00 00 ff
00 32 30 32 38 30 42 30 30 31 36 37 39 0a 01 48

----------------

Block 0, Base EDID:
  EDID Structure Version & Revision: 1.4
  Vendor & Product Identification:
    Manufacturer: GBT
    Model: 12800
    Serial Number: ...
    Made in: week 28 of 2020
  Basic Display Parameters & Features:
    Digital display
    Bits per primary color channel: 10
    DisplayPort interface
    Maximum image size: 70 cm x 39 cm
    Gamma: 2.20
    DPMS levels: Standby Suspend Off
    Supported color formats: RGB 4:4:4, YCrCb 4:4:4, YCrCb 4:2:2
    First detailed timing includes the native pixel format and preferred refresh rate
    Display is continuous frequency
  Color Characteristics:
    Red  : 0.6796, 0.3115
    Green: 0.2744, 0.6513
    Blue : 0.1503, 0.0654
    White: 0.3134, 0.3291
  Established Timings I & II:
    DMT 0x04:   640x480    59.940476 Hz   4:3     31.469 kHz     25.175000 MHz
    Apple   :   640x480    66.666667 Hz   4:3     35.000 kHz     30.240000 MHz
    DMT 0x05:   640x480    72.808802 Hz   4:3     37.861 kHz     31.500000 MHz
    DMT 0x06:   640x480    75.000000 Hz   4:3     37.500 kHz     31.500000 MHz
    DMT 0x08:   800x600    56.250000 Hz   4:3     35.156 kHz     36.000000 MHz
    DMT 0x09:   800x600    60.316541 Hz   4:3     37.879 kHz     40.000000 MHz
    DMT 0x0a:   800x600    72.187572 Hz   4:3     48.077 kHz     50.000000 MHz
    DMT 0x0b:   800x600    75.000000 Hz   4:3     46.875 kHz     49.500000 MHz
    DMT 0x10:  1024x768    60.003840 Hz   4:3     48.363 kHz     65.000000 MHz
    DMT 0x11:  1024x768    70.069359 Hz   4:3     56.476 kHz     75.000000 MHz
    DMT 0x12:  1024x768    75.028582 Hz   4:3     60.023 kHz     78.750000 MHz
    DMT 0x24:  1280x1024   75.024675 Hz   5:4     79.976 kHz    135.000000 MHz
  Standard Timings:
    DMT 0x52:  1920x1080   60.000000 Hz  16:9     67.500 kHz    148.500000 MHz
    DMT 0x23:  1280x1024   60.019740 Hz   5:4     63.981 kHz    108.000000 MHz
    DMT 0x2f:  1440x900    59.887445 Hz  16:10    55.935 kHz    106.500000 MHz
    DMT 0x3a:  1680x1050   59.954250 Hz  16:10    65.290 kHz    146.250000 MHz
  Detailed Timing Descriptors:
    DTD 1:  2560x1440   59.940370 Hz  16:9     88.172 kHz    235.420000 MHz (697 mm x 392 mm)
                 Hfront   23 Hsync  32 Hback   55 Hpol P
                 Vfront   17 Vsync   8 Vback    6 Vpol P
    Display Range Limits:
      Monitor ranges (Bare Limits): 48-165 Hz V, 243-243 kHz H, max dotclock 600 MHz
    Display Product Name: 'G32QC'
    Display Product Serial Number: ...
  Extension blocks: 1
Checksum: 0x48

----------------

Block 1, Unknown EDID Extension Block 0x00:
  00 ff ff ff ff ff ff 00 1c 54 00 32 01 01 01 01 '.........T.2....'
  1c 1e 01 04 b5 46 27 78 fb 37 b5 ae 4f 46 a6 26 '.....F'x.7..OF.&'
  10 50 54 3f cf 00 d1 c0 01 01 01 01 01 01 81 80 '.PT?............'
  95 00 b3 00 01 01 f6 5b 00 6e a0 a0 1f 50 17 20 '.......[.n...P. '
  18 04 b9 88 21 00 00 1e 00 00 00 fd 00 30 a5 f3 '....!........0..'
  f3 3c 01 0a 20 20 20 20 20 20 00 00 00 fc 00 47 '.<..      .....G'
  33 32 51 43 0a 20 20 20 20 20 20 20 00 00 00 ff '32QC.       ....'
  00 32 30 32 38 30 42 30 30 31 36 37 39 0a 01 48 '.20280B001679..H'
Checksum: 0x48

----------------

Warnings:

EDID:
  Base EDID: Some timings are out of range of the Monitor Ranges:
    Horizontal Freq: 31.468 - 88.172 kHz (Monitor: 243.000 - 243.000 kHz)

Failures:

Block 1, Base EDID:
  Unknown Extension Block.

EDID conformity: FAIL
