
EDID (hex):
00ffffffffffff001c54003201010101
1c1e0104b5462778fb37b5ae4f46a626
1050543fcf00d1c00101010101018180
9500b3000101f65b006ea0a01f501720
1804b9882100001e000000fd0030a5f3
f33c010a202020202020000000fc0047
333251430a20202020202020000000ff
003230323830423030373238360a0148
02033f714902031112042f903f052309
17078301000067030c001000383c67d8
5dc4017880036d1a0000020330a5000f
641e641ee305e301e606050164641e00
fa0050a0a01f500a3c3500b988210000
1ef5bd0064a0a055501220f80cb98821
00001ec494806e703839401e192808b9
882100001e00000000000000000000a4

Extracted contents:
header:          00 ff ff ff ff ff ff 00
serial number:   1c 54 00 32 01 01 01 01 1c 1e
version:         01 04
basic params:    b5 46 27 78 fb
chroma info:     37 b5 ae 4f 46 a6 26 10 50 54
established:     3f cf 00
standard:        d1 c0 01 01 01 01 01 01 81 80 95 00 b3 00 01 01
descriptor 1:    f6 5b 00 6e a0 a0 1f 50 17 20 18 04 b9 88 21 00 00 1e
descriptor 2:    00 00 00 fd 00 30 a5 f3 f3 3c 01 0a 20 20 20 20 20 20
descriptor 3:    00 00 00 fc 00 47 33 32 51 43 0a 20 20 20 20 20 20 20
descriptor 4:    00 00 00 ff 00 32 30 32 38 30 42 30 30 37 32 38 36 0a
extensions:      01
checksum:        48

EDID version: 1.4
Manufacturer: GBT Model 3200 Serial Number --
Made in week 28 of 2020
Digital display
10 bits per primary color channel
DisplayPort interface
Maximum image size: 70 cm x 39 cm
Gamma: 2.20
DPMS levels: Standby Suspend Off
Supported color formats: RGB 4:4:4, YCrCb 4:4:4, YCrCb 4:2:2
First detailed timing includes the native pixel format and preferred refresh rate
Display is continuous frequency
Display x,y Chromaticity:
  Red:   0.6796, 0.3115
  Green: 0.2744, 0.6513
  Blue:  0.1503, 0.0654
  White: 0.3134, 0.3291
Established timings supported:
  640x480@60Hz 4:3 HorFreq: 31469 Hz Clock: 25.175 MHz
  640x480@67Hz 4:3 HorFreq: 35000 Hz Clock: 30.240 MHz
  640x480@72Hz 4:3 HorFreq: 37900 Hz Clock: 31.500 MHz
  640x480@75Hz 4:3 HorFreq: 37500 Hz Clock: 31.500 MHz
  800x600@56Hz 4:3 HorFreq: 35200 Hz Clock: 36.000 MHz
  800x600@60Hz 4:3 HorFreq: 37900 Hz Clock: 40.000 MHz
  800x600@72Hz 4:3 HorFreq: 48100 Hz Clock: 50.000 MHz
  800x600@75Hz 4:3 HorFreq: 46900 Hz Clock: 49.500 MHz
  1024x768@60Hz 4:3 HorFreq: 48400 Hz Clock: 65.000 MHz
  1024x768@70Hz 4:3 HorFreq: 56500 Hz Clock: 75.000 MHz
  1024x768@75Hz 4:3 HorFreq: 60000 Hz Clock: 78.750 MHz
  1280x1024@75Hz 5:4 HorFreq: 80000 Hz Clock: 135.000 MHz
Standard timings supported:
  1920x1080@60Hz 16:9
  1280x1024@60Hz 5:4 HorFreq: 64000 Hz Clock: 108.000 MHz
  1440x900@60Hz 16:10 HorFreq: 55500 Hz Clock: 88.750 MHz
  1680x1050@60Hz 16:10 HorFreq: 64700 Hz Clock: 119.000 MHz
Detailed mode: Clock 235.420 MHz, 697 mm x 392 mm
               2560 2583 2615 2670 hborder 0
               1440 1457 1465 1471 vborder 0
               +hsync +vsync 
               VertFreq: 59 Hz, HorFreq: 88172 Hz
Monitor ranges (bare limits): 48-165Hz V, 243-243kHz H, max dotclock 600MHz
Monitor name: G32QC
Serial number: --
Has 1 extension blocks
Checksum: 0x48 (valid)

CTA extension block
Extension version: 3
59 bytes of CTA data
  Video data block
    VIC   2 720x480@60Hz 4:3  HorFreq: 31469 Hz Clock: 27.000 MHz
    VIC   3 720x480@60Hz 16:9  HorFreq: 31469 Hz Clock: 27.000 MHz
    VIC  17 720x576@50Hz 4:3  HorFreq: 31250 Hz Clock: 27.000 MHz
    VIC  18 720x576@50Hz 16:9  HorFreq: 31250 Hz Clock: 27.000 MHz
    VIC   4 1280x720@60Hz 16:9  HorFreq: 45000 Hz Clock: 74.250 MHz
    VIC  47 1280x720@120Hz 16:9  HorFreq: 90000 Hz Clock: 148.500 MHz
    VIC  16 1920x1080@60Hz 16:9 (native) HorFreq: 67500 Hz Clock: 148.500 MHz
    VIC  63 1920x1080@120Hz 16:9  HorFreq: 135000 Hz Clock: 297.000 MHz
    VIC   5 1920x1080i@60Hz 16:9  HorFreq: 33750 Hz Clock: 74.250 MHz
  Audio data block
    Linear PCM, max channels 2
      Supported sample rates (kHz): 96 48 44.1 32
      Supported sample sizes (bits): 24 20 16
  Speaker allocation data block
    Speaker map:
      FL/FR - Front Left/Right
  Vendor-specific data block, OUI 000c03 (HDMI)
    Source physical address 1.0.0.0
    DC_36bit
    DC_30bit
    DC_Y444
    Maximum TMDS clock: 300MHz
  Vendor-specific data block, OUI c45dd8 (HDMI Forum)
    Version: 1
    Maximum TMDS Character Rate: 600MHz
    SCDC Present
    Supports 12-bits/component Deep Color 4:2:0 Pixel Encoding
    Supports 10-bits/component Deep Color 4:2:0 Pixel Encoding
  Vendor-specific data block, OUI 00001a
  Extended tag: Colorimetry data block
    xvYCC601
    xvYCC709
    BT2020cYCC
    BT2020YCC
    BT2020RGB
  Extended tag: HDR static metadata data block
    Electro optical transfer functions:
      Traditional gamma - SDR luminance range
      SMPTE ST2084
    Supported static metadata descriptors:
      Static metadata type 1
    Desired content max luminance: 100 (436.203 cd/m^2)
    Desired content max frame-average luminance: 100 (436.203 cd/m^2)
    Desired content min luminance: 30 (0.060 cd/m^2)
Basic audio support
Supports YCbCr 4:4:4
Supports YCbCr 4:2:2
1 native detailed modes
Detailed mode: Clock 486.290 MHz, 697 mm x 392 mm
               2560 2578 2610 2660 hborder 0
               1440 1503 1511 1525 vborder 0
               +hsync +vsync 
               VertFreq: 119 Hz, HorFreq: 182815 Hz
Detailed mode: Clock 380.840 MHz, 697 mm x 392 mm
               1920 1950 1975 2030 hborder 0
               1080 1114 1122 1137 vborder 0
               +hsync +vsync 
               VertFreq: 165 Hz, HorFreq: 187605 Hz
Checksum: 0xa4 (valid)

Warning: One or more of the timings is out of range of the Monitor Ranges:
  Vertical Freq: 50 - 165 Hz
  Horizontal Freq: 31250 - 187605 Hz
  Maximum Clock: 486.290 MHz
EDID block does not conform at all!
	Both the serial number and the serial string are set
