
EDID (hex):
00ffffffffffff001c54003201010101
231e0104b5462778fb37b5ae4f46a626
1050543fcf00d1c00101010101018180
9500b3000101f65b006ea0a01f501720
1804b9882100001e000000fd0030a5f3
f33c010a202020202020000000fc0047
333251430a20202020202020000000ff
003230333530423031343631330a014b
02033f714902031112042f903f052309
17078301000067030c001000383c67d8
5dc4017880036d1a0000020330a5000f
641e641ee305e301e606050164641e00
fa0050a0a01f500a3c3500b988210000
1ef5bd0064a0a055501220f80cb98821
00001ec494806e703839401e192808b9
882100001e00000000000000000000a4

edid-decode (hex):

00 ff ff ff ff ff ff 00 1c 54 00 32 01 01 01 01
23 1e 01 04 b5 46 27 78 fb 37 b5 ae 4f 46 a6 26
10 50 54 3f cf 00 d1 c0 01 01 01 01 01 01 81 80
95 00 b3 00 01 01 f6 5b 00 6e a0 a0 1f 50 17 20
18 04 b9 88 21 00 00 1e 00 00 00 fd 00 30 a5 f3
f3 3c 01 0a 20 20 20 20 20 20 00 00 00 fc 00 47
33 32 51 43 0a 20 20 20 20 20 20 20 00 00 00 ff
00 32 30 33 35 30 42 30 31 34 36 31 33 0a 01 4b

02 03 3f 71 49 02 03 11 12 04 2f 90 3f 05 23 09
17 07 83 01 00 00 67 03 0c 00 10 00 38 3c 67 d8
5d c4 01 78 80 03 6d 1a 00 00 02 03 30 a5 00 0f
64 1e 64 1e e3 05 e3 01 e6 06 05 01 64 64 1e 00
fa 00 50 a0 a0 1f 50 0a 3c 35 00 b9 88 21 00 00
1e f5 bd 00 64 a0 a0 55 50 12 20 f8 0c b9 88 21
00 00 1e c4 94 80 6e 70 38 39 40 1e 19 28 08 b9
88 21 00 00 1e 00 00 00 00 00 00 00 00 00 00 a4

----------------

Block 0, Base EDID:
  EDID Structure Version & Revision: 1.4
  Vendor & Product Identification:
    Manufacturer: GBT
    Model: 12800
    Serial Number: 16843009
    Made in: week 35 of 2020
  Basic Display Parameters & Features:
    Digital display
    Bits per primary color channel: 10
    DisplayPort interface
    Maximum image size: 70 cm x 39 cm
    Gamma: 2.20
    DPMS levels: Standby Suspend Off
    Supported color formats: RGB 4:4:4, YCrCb 4:4:4, YCrCb 4:2:2
    First detailed timing includes the native pixel format and preferred refresh rate
    Display is continuous frequency
  Color Characteristics:
    Red  : 0.6796, 0.3115
    Green: 0.2744, 0.6513
    Blue : 0.1503, 0.0654
    White: 0.3134, 0.3291
  Established Timings I & II:
    DMT 0x04:   640x480    59.940476 Hz   4:3     31.469 kHz     25.175000 MHz
    Apple   :   640x480    66.666667 Hz   4:3     35.000 kHz     30.240000 MHz
    DMT 0x05:   640x480    72.808802 Hz   4:3     37.861 kHz     31.500000 MHz
    DMT 0x06:   640x480    75.000000 Hz   4:3     37.500 kHz     31.500000 MHz
    DMT 0x08:   800x600    56.250000 Hz   4:3     35.156 kHz     36.000000 MHz
    DMT 0x09:   800x600    60.316541 Hz   4:3     37.879 kHz     40.000000 MHz
    DMT 0x0a:   800x600    72.187572 Hz   4:3     48.077 kHz     50.000000 MHz
    DMT 0x0b:   800x600    75.000000 Hz   4:3     46.875 kHz     49.500000 MHz
    DMT 0x10:  1024x768    60.003840 Hz   4:3     48.363 kHz     65.000000 MHz
    DMT 0x11:  1024x768    70.069359 Hz   4:3     56.476 kHz     75.000000 MHz
    DMT 0x12:  1024x768    75.028582 Hz   4:3     60.023 kHz     78.750000 MHz
    DMT 0x24:  1280x1024   75.024675 Hz   5:4     79.976 kHz    135.000000 MHz
  Standard Timings:
    DMT 0x52:  1920x1080   60.000000 Hz  16:9     67.500 kHz    148.500000 MHz
    DMT 0x23:  1280x1024   60.019740 Hz   5:4     63.981 kHz    108.000000 MHz
    DMT 0x2f:  1440x900    59.887445 Hz  16:10    55.935 kHz    106.500000 MHz
    DMT 0x3a:  1680x1050   59.954250 Hz  16:10    65.290 kHz    146.250000 MHz
  Detailed Timing Descriptors:
    DTD 1:  2560x1440   59.940370 Hz  16:9     88.172 kHz    235.420000 MHz (697 mm x 392 mm)
                 Hfront   23 Hsync  32 Hback   55 Hpol P
                 Vfront   17 Vsync   8 Vback    6 Vpol P
    Display Range Limits:
      Monitor ranges (Bare Limits): 48-165 Hz V, 243-243 kHz H, max dotclock 600 MHz
    Display Product Name: 'G32QC'
    Display Product Serial Number: '20350B014613'
  Extension blocks: 1
Checksum: 0x4b

----------------

Block 1, CTA-861 Extension Block:
  Revision: 3
  Basic audio support
  Supports YCbCr 4:4:4
  Supports YCbCr 4:2:2
  Native detailed modes: 1
  Video Data Block:
    VIC   2:   720x480    59.940060 Hz   4:3     31.469 kHz     27.000000 MHz
    VIC   3:   720x480    59.940060 Hz  16:9     31.469 kHz     27.000000 MHz
    VIC  17:   720x576    50.000000 Hz   4:3     31.250 kHz     27.000000 MHz
    VIC  18:   720x576    50.000000 Hz  16:9     31.250 kHz     27.000000 MHz
    VIC   4:  1280x720    60.000000 Hz  16:9     45.000 kHz     74.250000 MHz
    VIC  47:  1280x720   120.000000 Hz  16:9     90.000 kHz    148.500000 MHz
    VIC  16:  1920x1080   60.000000 Hz  16:9     67.500 kHz    148.500000 MHz (native)
    VIC  63:  1920x1080  120.000000 Hz  16:9    135.000 kHz    297.000000 MHz
    VIC   5:  1920x1080i  60.000000 Hz  16:9     33.750 kHz     74.250000 MHz
  Audio Data Block:
    Linear PCM:
      Max channels: 2
      Supported sample rates (kHz): 96 48 44.1 32
      Supported sample sizes (bits): 24 20 16
  Speaker Allocation Data Block:
    FL/FR - Front Left/Right
  Vendor-Specific Data Block (HDMI), OUI 00-0C-03:
    Source physical address: 1.0.0.0
    DC_36bit
    DC_30bit
    DC_Y444
    Maximum TMDS clock: 300 MHz
  Vendor-Specific Data Block (HDMI Forum), OUI C4-5D-D8:
    Version: 1
    Maximum TMDS Character Rate: 600 MHz
    SCDC Present
    Supports 12-bits/component Deep Color 4:2:0 Pixel Encoding
    Supports 10-bits/component Deep Color 4:2:0 Pixel Encoding
  Vendor-Specific Data Block (AMD), OUI 00-00-1A:
    Version: 2.3
    Minimum Refresh Rate: 48 Hz
    Maximum Refresh Rate: 165 Hz
    Flags 1.x: 0x00
    Flags 2.x: 0x0f
    Maximum luminance: 100 (436.203 cd/m^2)
    Minimum luminance: 30 (0.060 cd/m^2)
    Maximum luminance (without local dimming): 100 (436.203 cd/m^2)
    Minimum luminance (without local dimming): 30 (0.060 cd/m^2)
  Colorimetry Data Block:
    xvYCC601
    xvYCC709
    BT2020cYCC
    BT2020YCC
    BT2020RGB
    Gamut Boundary Description Metadata Profile P0
  HDR Static Metadata Data Block:
    Electro optical transfer functions:
      Traditional gamma - SDR luminance range
      SMPTE ST2084
    Supported static metadata descriptors:
      Static metadata type 1
    Desired content max luminance: 100 (436.203 cd/m^2)
    Desired content max frame-average luminance: 100 (436.203 cd/m^2)
    Desired content min luminance: 30 (0.060 cd/m^2)
  Detailed Timing Descriptors:
    DTD 2:  2560x1440  164.802340 Hz  16:9    242.424 kHz    640.000000 MHz (697 mm x 392 mm)
                 Hfront   10 Hsync  60 Hback   10 Hpol P
                 Vfront    3 Vsync   5 Vback   23 Vpol P
    DTD 3:  2560x1440  119.879206 Hz  16:9    182.816 kHz    486.290000 MHz (697 mm x 392 mm)
                 Hfront   18 Hsync  32 Hback   50 Hpol P
                 Vfront   63 Vsync   8 Vback   14 Vpol P
    DTD 4:  1920x1080  165.000802 Hz  16:9    187.606 kHz    380.840000 MHz (697 mm x 392 mm)
                 Hfront   30 Hsync  25 Hback   55 Hpol P
                 Vfront   34 Vsync   8 Vback   15 Vpol P
Checksum: 0xa4  Unused space in Extension Block: 10 bytes


