
EDID (hex):
00ffffffffffff001710329601000000
000e0104807341782a7c119e59479b27
10505421080001010101010101010101
010101010101023a801871382d40582c
4500ba882100001e8c0ad08a20e02d10
103e9600040300000018000000fc0045
50445031372e313132370000000000fd
003b3d0f2e08000a2020202020200144
02031a71450402031112230907078301
000067030c000000881e000000000000
00000000000000000000000000000000
00000000000000000000000000000000
00000000000000000000000000000000
00000000000000000000000000000000
00000000000000000000000000000000
00000000000000000000000000000025

Extracted contents:
header:          00 ff ff ff ff ff ff 00
serial number:   17 10 32 96 01 00 00 00 00 0e
version:         01 04
basic params:    80 73 41 78 2a
chroma info:     7c 11 9e 59 47 9b 27 10 50 54
established:     21 08 00
standard:        01 01 01 01 01 01 01 01 01 01 01 01 01 01 01 01
descriptor 1:    02 3a 80 18 71 38 2d 40 58 2c 45 00 ba 88 21 00 00 1e
descriptor 2:    8c 0a d0 8a 20 e0 2d 10 10 3e 96 00 04 03 00 00 00 18
descriptor 3:    00 00 00 fc 00 45 50 44 50 31 37 2e 31 31 32 37 00 00
descriptor 4:    00 00 00 fd 00 3b 3d 0f 2e 08 00 0a 20 20 20 20 20 20
extensions:      01
checksum:        44

EDID version: 1.4
Manufacturer: EXP Model 9632 Serial Number --
Digital display
Color depth is undefined
Digital interface is not defined
Maximum image size: 115 cm x 65 cm
Gamma: 2.20
DPMS levels: Off
Supported color formats: RGB 4:4:4, YCrCb 4:4:4
First detailed timing includes the native pixel format and preferred refresh rate
Display x,y Chromaticity:
  Red:   0.6181, 0.3505
  Green: 0.2802, 0.6054
  Blue:  0.1523, 0.0634
  White: 0.3125, 0.3291
Established timings supported:
  640x480@60Hz 4:3 HorFreq: 31469 Hz Clock: 25.175 MHz
  800x600@60Hz 4:3 HorFreq: 37900 Hz Clock: 40.000 MHz
  1024x768@60Hz 4:3 HorFreq: 48400 Hz Clock: 65.000 MHz
Standard timings supported:
Detailed mode: Clock 148.500 MHz, 698 mm x 392 mm
               1920 2008 2052 2200 hborder 0
               1080 1084 1089 1125 vborder 0
               +hsync +vsync 
               VertFreq: 60 Hz, HorFreq: 67500 Hz
Detailed mode: Clock 27.000 MHz, 4 mm x 3 mm
                720  736  798  858 hborder 0
                480  489  495  525 vborder 0
               -hsync -vsync 
               VertFreq: 59 Hz, HorFreq: 31468 Hz
Monitor ranges (GTF): 59-61Hz V, 15-46kHz H, max dotclock 80MHz
Has 1 extension blocks
Checksum: 0x44 (valid)

CTA extension block
Extension version: 3
22 bytes of CTA data
  Video data block
    VIC   4 1280x720@60Hz 16:9  HorFreq: 45000 Hz Clock: 74.250 MHz
    VIC   2 720x480@60Hz 4:3  HorFreq: 31469 Hz Clock: 27.000 MHz
    VIC   3 720x480@60Hz 16:9  HorFreq: 31469 Hz Clock: 27.000 MHz
    VIC  17 720x576@50Hz 4:3  HorFreq: 31250 Hz Clock: 27.000 MHz
    VIC  18 720x576@50Hz 16:9  HorFreq: 31250 Hz Clock: 27.000 MHz
  Audio data block
    Linear PCM, max channels 2
      Supported sample rates (kHz): 48 44.1 32
      Supported sample sizes (bits): 24 20 16
  Speaker allocation data block
    Speaker map:
      FL/FR - Front Left/Right
  Vendor-specific data block, OUI 000c03 (HDMI)
    Source physical address 0.0.0.0
    Supports_AI
    DC_Y444
    Maximum TMDS clock: 150MHz
Basic audio support
Supports YCbCr 4:4:4
Supports YCbCr 4:2:2
1 native detailed modes
Checksum: 0x25 (valid)

EDID block does NOT conform to EDID 1.4!
	Name descriptor not terminated with a newline
Warning: One or more of the timings is out of range of the Monitor Ranges:
  Vertical Freq: 50 - 60 Hz
  Horizontal Freq: 31250 - 67500 Hz
  Maximum Clock: 148.500 MHz
EDID block does not conform at all!
	Bad year of manufacture


