
EDID (hex):
00ffffffffffff005262080101010101
ff140103082917780a3f31a555489a27
135054adcf0081c08180614c01010101
010101010101662150b051001b304070
36009ae61000001e0e1f008051001e30
408037009ae61000001c000000fc0054
4f53484942412d54560a2020000000fd
00384c1f510e000a202020202020002f

Extracted contents:
header:          00 ff ff ff ff ff ff 00
serial number:   52 62 08 01 01 01 01 01 ff 14
version:         01 03
basic params:    08 29 17 78 0a
chroma info:     3f 31 a5 55 48 9a 27 13 50 54
established:     ad cf 00
standard:        81 c0 81 80 61 4c 01 01 01 01 01 01 01 01 01 01
descriptor 1:    66 21 50 b0 51 00 1b 30 40 70 36 00 9a e6 10 00 00 1e
descriptor 2:    0e 1f 00 80 51 00 1e 30 40 80 37 00 9a e6 10 00 00 1c
descriptor 3:    00 00 00 fc 00 54 4f 53 48 49 42 41 2d 54 56 0a 20 20
descriptor 4:    00 00 00 fd 00 38 4c 1f 51 0e 00 0a 20 20 20 20 20 20
extensions:      00
checksum:        2f

EDID version: 1.3
Manufacturer: TSB Model 108 Serial Number --
Analog display, Input voltage level: 0.7/0.3 V
Sync: Separate 
Maximum image size: 41 cm x 23 cm
Gamma: 2.20
RGB color display
First detailed timing is preferred timing
Display x,y Chromaticity:
  Red:   0.6445, 0.3349
  Green: 0.2841, 0.6044
  Blue:  0.1523, 0.0771
  White: 0.3125, 0.3291
Established timings supported:
  720x400@70Hz 9:5 HorFreq: 31469 Hz Clock: 28.320 MHz
  640x480@60Hz 4:3 HorFreq: 31469 Hz Clock: 25.175 MHz
  640x480@72Hz 4:3 HorFreq: 37900 Hz Clock: 31.500 MHz
  640x480@75Hz 4:3 HorFreq: 37500 Hz Clock: 31.500 MHz
  800x600@60Hz 4:3 HorFreq: 37900 Hz Clock: 40.000 MHz
  800x600@72Hz 4:3 HorFreq: 48100 Hz Clock: 50.000 MHz
  800x600@75Hz 4:3 HorFreq: 46900 Hz Clock: 49.500 MHz
  1024x768@60Hz 4:3 HorFreq: 48400 Hz Clock: 65.000 MHz
  1024x768@70Hz 4:3 HorFreq: 56500 Hz Clock: 75.000 MHz
  1024x768@75Hz 4:3 HorFreq: 60000 Hz Clock: 78.750 MHz
  1280x1024@75Hz 5:4 HorFreq: 80000 Hz Clock: 135.000 MHz
Standard timings supported:
  1280x720@60Hz 16:9
  1280x1024@60Hz 5:4 HorFreq: 64000 Hz Clock: 108.000 MHz
  1024x768@72Hz 4:3
Detailed mode: Clock 85.500 MHz, 410 mm x 230 mm
               1360 1424 1536 1792 hborder 0
                768  771  777  795 vborder 0
               +hsync +vsync 
               VertFreq: 60 Hz, HorFreq: 47712 Hz
Detailed mode: Clock 79.500 MHz, 410 mm x 230 mm
               1280 1344 1472 1664 hborder 0
                768  771  778  798 vborder 0
               -hsync +vsync 
               VertFreq: 59 Hz, HorFreq: 47776 Hz
Monitor name: TOSHIBA-TV
Monitor ranges (GTF): 56-76Hz V, 31-81kHz H, max dotclock 140MHz
Checksum: 0x2f (valid)
EDID block does not conform at all!
	Bad year of manufacture
	Bad week of manufacture
