
EDID (hex):
00ffffffffffff00446d010001000000
1b10010380060e780a0dc9a057479827
12484c00000001010101010101010101
010101010101224738d8416020904020
4244000000000000224738d84160e094
40204244000000000000000000000000
000000000000000000000000000000fe
006b372033382030632030622076003b

edid-decode (hex):

00 ff ff ff ff ff ff 00 44 6d 01 00 01 00 00 00
1b 10 01 03 80 06 0e 78 0a 0d c9 a0 57 47 98 27
12 48 4c 00 00 00 01 01 01 01 01 01 01 01 01 01
01 01 01 01 01 01 22 47 38 d8 41 60 20 90 40 20
42 44 00 00 00 00 00 00 22 47 38 d8 41 60 e0 94
40 20 42 44 00 00 00 00 00 00 00 00 00 00 00 00
00 00 00 00 00 00 00 00 00 00 00 00 00 00 00 fe
00 6b 37 20 33 38 20 30 63 20 30 62 20 76 00 3b

----------------

Block 0, Base EDID:
  EDID Structure Version & Revision: 1.3
  Vendor & Product Identification:
    Manufacturer: QCM
    Model: 1
    Serial Number: 1
    Made in: week 27 of 2006
  Basic Display Parameters & Features:
    Digital display
    Maximum image size: 6 cm x 14 cm
    Gamma: 2.20
    RGB color display
    First detailed timing is the preferred timing
  Color Characteristics:
    Red  : 0.6250, 0.3398
    Green: 0.2802, 0.5947
    Blue : 0.1552, 0.0703
    White: 0.2832, 0.2978
  Established Timings I & II: none
  Standard Timings: none
  Detailed Timing Descriptors:
    DTD 1:  1080x2400   48.245261 Hz   9:20   117.332 kHz    182.100000 MHz (analog composite, sync-on-green)
                 Hfront  320 Hsync  32 Hback  120 Hpol N
                 Vfront   20 Vsync   2 Vback   10 Vpol N
    DTD 2:  1080x2400   32.163507 Hz   9:20   117.332 kHz    182.100000 MHz (analog composite, sync-on-green)
                 Hfront  320 Hsync  32 Hback  120 Hpol N
                 Vfront   20 Vsync   2 Vback 1226 Vpol N
    Empty Descriptor
    Alphanumeric Data String: 'k7 38 0c 0b v'
Checksum: 0x3b
