edid-decode (hex):

00 ff ff ff ff ff ff 00 44 6d 01 00 01 00 00 00
1b 10 01 03 80 06 0f 78 0a 0d c9 a0 57 47 98 27
12 48 4c 00 00 00 01 01 01 01 01 01 01 01 01 01
01 01 01 01 01 01 97 47 38 0c 41 60 20 90 78 1c
42 04 00 00 00 00 00 00 97 47 38 0c 41 60 a0 99
78 1c 42 04 00 00 00 00 00 00 3f 46 38 0c 41 60
f2 9f 78 1c 62 08 00 00 00 00 00 00 00 00 00 fe
00 78 69 61 6f 6d 69 20 6b 36 73 20 33 38 00 24

00 ff ff ff ff ff ff 00 44 6d 01 00 01 00 00 00
1b 10 01 03 80 06 0f 78 0a 0d c9 a0 57 47 98 27
12 48 4c 00 00 00 01 01 01 01 01 01 01 01 01 01
01 01 01 01 01 01 97 47 38 0c 41 60 20 90 78 1c
42 04 00 00 00 00 00 00 97 47 38 0c 41 60 a0 99
78 1c 42 04 00 00 00 00 00 00 3f 46 38 0c 41 60
f2 9f 78 1c 62 08 00 00 00 00 00 00 00 00 00 fe
00 78 69 61 6f 6d 69 20 6b 36 73 20 33 38 00 24

----------------

Block 0, Base EDID:
  EDID Structure Version & Revision: 1.3
  Vendor & Product Identification:
    Manufacturer: QCM
    Model: 1
    Serial Number: ...
    Made in: week 27 of 2006
  Basic Display Parameters & Features:
    Digital display
    Maximum image size: 6 cm x 15 cm
    Gamma: 2.20
    RGB color display
    First detailed timing is the preferred timing
  Color Characteristics:
    Red  : 0.6250, 0.3398
    Green: 0.2802, 0.5947
    Blue : 0.1552, 0.0703
    White: 0.2832, 0.2978
  Established Timings I & II: none
  Standard Timings: none
  Detailed Timing Descriptors:
    DTD 1:  1080x2400   55.903361 Hz   9:20   135.957 kHz    183.270000 MHz (analog composite, sync-on-green)
                 Hfront  120 Hsync  28 Hback  120 Hpol N
                 Vfront   20 Vsync   2 Vback   10 Vpol N
    DTD 2:  1080x2400   27.951680 Hz   9:20   135.957 kHz    183.270000 MHz (analog composite, sync-on-green)
                 Hfront  120 Hsync  28 Hback  120 Hpol N
                 Vfront   20 Vsync   2 Vback 2442 Vpol N
    DTD 3:  1080x2400   20.580846 Hz   9:20   133.405 kHz    179.830000 MHz (analog composite, sync-on-green)
                 Hfront  120 Hsync  28 Hback  120 Hpol N
                 Vfront   38 Vsync   2 Vback 4042 Vpol N
    Alphanumeric Data String: 'xiaomi k6s 38'
Checksum: 0x24

----------------

Block 1, Unknown EDID Extension Block 0x00:
  00 ff ff ff ff ff ff 00 44 6d 01 00 01 00 00 00 '........Dm......'
  1b 10 01 03 80 06 0f 78 0a 0d c9 a0 57 47 98 27 '.......x....WG.''
  12 48 4c 00 00 00 01 01 01 01 01 01 01 01 01 01 '.HL.............'
  01 01 01 01 01 01 97 47 38 0c 41 60 20 90 78 1c '.......G8.A` .x.'
  42 04 00 00 00 00 00 00 97 47 38 0c 41 60 a0 99 'B........G8.A`..'
  78 1c 42 04 00 00 00 00 00 00 3f 46 38 0c 41 60 'x.B.......?F8.A`'
  f2 9f 78 1c 62 08 00 00 00 00 00 00 00 00 00 fe '..x.b...........'
  00 78 69 61 6f 6d 69 20 6b 36 73 20 33 38 00 24 '.xiaomi k6s 38.$'
Checksum: 0x24

----------------

Warnings:

Block 0, Base EDID:
  Basic Display Parameters & Features: Dubious maximum image size (6x15 is smaller than 10x10 cm).

Failures:

Block 0, Base EDID:
  Detailed Timing Descriptor #1: Mismatch of image size vs display size: image size is not set, but display size is.
  Detailed Timing Descriptor #2: Mismatch of image size vs display size: image size is not set, but display size is.
  Detailed Timing Descriptor #3: Mismatch of image size vs display size: image size is not set, but display size is.
  Missing Display Product Name.
  Missing Display Range Limits Descriptor.
Block 1, Base EDID:
  Unknown Extension Block.
EDID:
  Base EDID: EDID specified 0 extension block(s), but found 1 extension block(s).

EDID conformity: FAIL
