edid-decode (hex):

00 ff ff ff ff ff ff 00 4c 83 a4 41 00 00 00 00
00 21 01 04 b5 22 16 78 03 0c f1 ae 52 3c b9 23
0c 50 54 00 00 00 01 01 01 01 01 01 01 01 01 01
01 01 01 01 01 01 00 00 00 00 00 00 00 00 00 00
00 00 00 00 00 00 00 00 00 00 00 fd 0c 30 f0 ab
ab 71 01 00 00 00 00 00 00 00 00 00 00 fe 00 41
54 4e 41 36 30 44 4c 30 32 2d 30 20 00 00 00 02
00 01 00 00 19 96 c8 4b 24 76 c8 00 00 00 01 df

70 20 79 02 00 20 00 0c ba 41 59 a4 41 00 00 00
00 00 17 00 21 00 1d 74 0d 69 08 00 0a 40 06 00
e1 fa 51 cb 13 b9 3d d2 0c 01 45 54 40 5e d0 60
18 10 23 78 26 00 09 04 00 00 00 00 00 50 00 00
22 00 14 9a 2b 11 85 ff 09 4f 00 07 00 1f 00 3f
06 af 00 9d 00 07 00 81 00 0b e3 05 80 00 e6 06
05 01 74 60 02 2b 00 06 27 00 3c ef 00 00 00 00
00 00 00 00 00 00 00 00 00 00 00 00 00 00 f8 90

00 ff ff ff ff ff ff 00 4c 83 a4 41 00 00 00 00
00 21 01 04 b5 22 16 78 03 0c f1 ae 52 3c b9 23
0c 50 54 00 00 00 01 01 01 01 01 01 01 01 01 01
01 01 01 01 01 01 00 00 00 00 00 00 00 00 00 00
00 00 00 00 00 00 00 00 00 00 00 fd 0c 30 f0 ab
ab 71 01 00 00 00 00 00 00 00 00 00 00 fe 00 41
54 4e 41 36 30 44 4c 30 32 2d 30 20 00 00 00 02
00 01 00 00 19 96 c8 4b 24 76 c8 00 00 00 01 df

70 20 79 02 00 20 00 0c ba 41 59 a4 41 00 00 00
00 00 17 00 21 00 1d 74 0d 69 08 00 0a 40 06 00
e1 fa 51 cb 13 b9 3d d2 0c 01 45 54 40 5e d0 60
18 10 23 78 26 00 09 04 00 00 00 00 00 50 00 00
22 00 14 9a 2b 11 85 ff 09 4f 00 07 00 1f 00 3f
06 af 00 9d 00 07 00 81 00 0b e3 05 80 00 e6 06
05 01 74 60 02 2b 00 06 27 00 3c ef 00 00 00 00
00 00 00 00 00 00 00 00 00 00 00 00 00 00 f8 90

----------------

Block 0, Base EDID:
  EDID Structure Version & Revision: 1.4
  Vendor & Product Identification:
    Manufacturer: SDC
    Model: 16804
    Made in: 2023
  Basic Display Parameters & Features:
    Digital display
    Bits per primary color channel: 10
    DisplayPort interface
    Maximum image size: 34 cm x 22 cm
    Gamma: 2.20
    Supported color formats: RGB 4:4:4
    First detailed timing includes the native pixel format and preferred refresh rate
    Display is continuous frequency
  Color Characteristics:
    Red  : 0.6796, 0.3203
    Green: 0.2373, 0.7226
    Blue : 0.1396, 0.0498
    White: 0.3125, 0.3291
  Established Timings I & II: none
  Standard Timings: none
  Detailed Timing Descriptors:
    Empty Descriptor
    Display Range Limits:
      Monitor ranges (Bare Limits): 48-240 Hz V, 426-426 kHz H, max dotclock 1130 MHz
    Alphanumeric Data String: 'ATNA60DL02-0 '
    Manufacturer-Specified Display Descriptor (0x02): 00 02 00 01 00 00 19 96 c8 4b 24 76 c8 00 00 00 '.........K$v....'
  Extension blocks: 1
Checksum: 0xdf

----------------

Block 1, DisplayID Extension Block:
  Version: 2.0
  Extension Count: 0
  Display Product Primary Use Case: None of the listed primary use cases; generic display
  Product Identification Data Block (0x20), OUI BA-41-59:
    Product Code: 16804
    Year of Manufacture: 2023
  Display Parameters Data Block (0x21):
    Image size: 344.4 mm x 215.3 mm
    Display native pixel format: 2560x1600
    Scan Orientation: Left to Right, Top to Bottom
    Luminance Information: Minimum guaranteed value
    Color Information: CIE 1931
    Audio Speaker Information: integrated
    Native Color Chromaticity:
      Primary #1:  (0.679932, 0.320068)
      Primary #2:  (0.237061, 0.722900)
      Primary #3:  (0.139893, 0.050049)
      White Point: (0.312744, 0.329102)
    Native Maximum Luminance (Full Coverage): 400.000000 cd/m^2
    Native Maximum Luminance (10% Rectangular Coverage): 616.000000 cd/m^2
    Native Minimum Luminance: 0.000500 cd/m^2
    Native Color Depth: 12 bpc
    Display Device Technology: Organic LED
    Native Gamma EOTF: 2.20
  Display Interface Features Data Block:
    Supported bpc for RGB encoding: 10
    Supported color space and EOTF standard combination 1: DCI-P3, BT.2020/SMPTE ST 2084
  Video Timing Modes Type 7 - Detailed Timings Data Block:
    DTD:  2560x1600  240.000299 Hz  16:10   426.241 kHz   1125.275000 MHz (aspect 16:10, no 3D stereo, preferred)
               Hfront    8 Hsync  32 Hback   40 Hpol N
               Vfront  158 Vsync   8 Vback   10 Vpol N
  CTA-861 DisplayID Data Block:
  Colorimetry Data Block:
    BT2020RGB
  HDR Static Metadata Data Block:
    Electro optical transfer functions:
      Traditional gamma - SDR luminance range
      SMPTE ST2084
    Supported static metadata descriptors:
      Static metadata type 1
    Desired content max luminance: 116 (616.884 cd/m^2)
    Desired content max frame-average luminance: 96 (400.000 cd/m^2)
    Desired content min luminance: 2 (0.000 cd/m^2)
  Adaptive Sync Data Block:
    Descriptor #1:
      Native Panel Range
      Fixed Average V-Total and Adaptive V-Total
      'Max Single Frame Duration Increase' field value without jitter impact
      'Max Single Frame Duration Decrease' field value without jitter impact
      Max Duration Increase: 0.00 ms
      Max Duration Decrease: 0.00 ms
      Min Refresh Rate: 60 Hz
      Max Refresh Rate: 240 Hz
  Checksum: 0xf8
Checksum: 0x90

----------------

Block 2, Unknown EDID Extension Block 0x00:
  00 ff ff ff ff ff ff 00 4c 83 a4 41 00 00 00 00 '........L..A....'
  00 21 01 04 b5 22 16 78 03 0c f1 ae 52 3c b9 23 '.!...".x....R<.#'
  0c 50 54 00 00 00 01 01 01 01 01 01 01 01 01 01 '.PT.............'
  01 01 01 01 01 01 00 00 00 00 00 00 00 00 00 00 '................'
  00 00 00 00 00 00 00 00 00 00 00 fd 0c 30 f0 ab '.............0..'
  ab 71 01 00 00 00 00 00 00 00 00 00 00 fe 00 41 '.q.............A'
  54 4e 41 36 30 44 4c 30 32 2d 30 20 00 00 00 02 'TNA60DL02-0 ....'
  00 01 00 00 19 96 c8 4b 24 76 c8 00 00 00 01 df '.......K$v......'
Checksum: 0xdf

----------------

Block 3, DisplayID Extension Block:
  Version: 2.0
  Extension Count: 0
  Product Identification Data Block (0x20), OUI BA-41-59:
    Product Code: 16804
    Year of Manufacture: 2023
  Display Parameters Data Block (0x21):
    Image size: 344.4 mm x 215.3 mm
    Display native pixel format: 2560x1600
    Scan Orientation: Left to Right, Top to Bottom
    Luminance Information: Minimum guaranteed value
    Color Information: CIE 1931
    Audio Speaker Information: integrated
    Native Color Chromaticity:
      Primary #1:  (0.679932, 0.320068)
      Primary #2:  (0.237061, 0.722900)
      Primary #3:  (0.139893, 0.050049)
      White Point: (0.312744, 0.329102)
    Native Maximum Luminance (Full Coverage): 400.000000 cd/m^2
    Native Maximum Luminance (10% Rectangular Coverage): 616.000000 cd/m^2
    Native Minimum Luminance: 0.000500 cd/m^2
    Native Color Depth: 12 bpc
    Display Device Technology: Organic LED
    Native Gamma EOTF: 2.20
  Display Interface Features Data Block:
    Supported bpc for RGB encoding: 10
    Supported color space and EOTF standard combination 1: DCI-P3, BT.2020/SMPTE ST 2084
  Video Timing Modes Type 7 - Detailed Timings Data Block:
    DTD:  2560x1600  240.000299 Hz  16:10   426.241 kHz   1125.275000 MHz (aspect 16:10, no 3D stereo, preferred)
               Hfront    8 Hsync  32 Hback   40 Hpol N
               Vfront  158 Vsync   8 Vback   10 Vpol N
  CTA-861 DisplayID Data Block:
  Colorimetry Data Block:
    BT2020RGB
  HDR Static Metadata Data Block:
    Electro optical transfer functions:
      Traditional gamma - SDR luminance range
      SMPTE ST2084
    Supported static metadata descriptors:
      Static metadata type 1
    Desired content max luminance: 116 (616.884 cd/m^2)
    Desired content max frame-average luminance: 96 (400.000 cd/m^2)
    Desired content min luminance: 2 (0.000 cd/m^2)
  Adaptive Sync Data Block:
    Descriptor #1:
      Native Panel Range
      Fixed Average V-Total and Adaptive V-Total
      'Max Single Frame Duration Increase' field value without jitter impact
      'Max Single Frame Duration Decrease' field value without jitter impact
      Max Duration Increase: 0.00 ms
      Max Duration Decrease: 0.00 ms
      Min Refresh Rate: 60 Hz
      Max Refresh Rate: 240 Hz
  Checksum: 0xf8
Checksum: 0x90

----------------

Warnings:

Block 0, Base EDID:
  Missing Display Product Name.
Block 1, DisplayID Extension Block:
  Product Identification Data Block (0x20), OUI BA-41-59: Unknown OUI BA-41-59.
  Colorimetry Data Block: Set the sRGB colorimetry bit to avoid interop issues.
Block 3, DisplayID Extension Block:
  Product Identification Data Block (0x20), OUI BA-41-59: Unknown OUI BA-41-59.
  Colorimetry Data Block: Set the sRGB colorimetry bit to avoid interop issues.

Failures:

Block 0, Base EDID:
  Standard Timings: Missing preferred timing.
  Empty Descriptor: Use Dummy Descriptor instead of all zeroes.
  Display Range Limits: Byte 11 is 0x00 instead of 0x0a.
  Display Range Limits: Bytes 12-17 must be 0x20.
  Alphanumeric Data String: One or more trailing spaces.
Block 1, DisplayID Extension Block:
  Expected 0 DisplayID Extension Block, but got 1.
Block 2, Base EDID:
  Unknown Extension Block.
Block 3, DisplayID Extension Block:
  Product Type should be 0 in extension block.
  Product Identification Data Block (0x20), OUI BA-41-59: Product Identification Data Block (0x20), OUI BA-41-59 is required to be the first DisplayID Data Block.
  Display Parameters Data Block (0x21): Duplicate Display Parameters Data Block.
  Colorimetry Data Block: Only one instance of this Data Block is allowed.
  HDR Static Metadata Data Block: Only one instance of this Data Block is allowed.
EDID:
  Base EDID: EDID specified 1 extension block(s), but found 3 extension block(s).

EDID conformity: FAIL
