edid-decode (hex):

00 ff ff ff ff ff ff 00 21 63 21 10 00 00 00 00
16 22 01 04 b5 3c 21 78 3b 26 35 a9 4f 46 a3 28
0e 50 54 a5 4b 00 81 80 95 00 b3 00 01 01 01 01
01 01 01 01 01 01 02 3a 80 18 71 38 2d 40 58 2c
45 00 55 50 21 00 00 1e 00 00 00 ff 00 30 30 30
30 30 30 30 30 30 30 30 30 31 00 00 00 fd 00 64
b4 ca ca 2d 01 0a 20 20 20 20 20 20 00 00 00 fc
00 32 37 45 36 43 41 0a 20 20 20 20 20 20 01 1f

02 03 31 f1 48 90 84 03 01 12 3f 1f 13 23 09 07
07 83 01 00 00 e2 00 7f 6d 1a 00 00 02 01 64 b4
00 00 00 00 00 00 e6 06 07 01 61 5f 00 e3 05 e3
01 04 74 80 18 71 38 2d 40 58 2c 35 00 55 50 21
00 00 1e 28 83 80 a0 70 38 29 40 30 20 35 00 55
50 21 00 00 1e 0b a2 80 a0 70 38 1c 40 30 2c 35
00 55 50 21 00 00 1e 00 00 00 00 00 00 00 00 00
00 00 00 00 00 00 00 00 00 00 00 00 00 00 00 67

00 ff ff ff ff ff ff 00 21 63 21 10 00 00 00 00
16 22 01 04 b5 3c 21 78 3b 26 35 a9 4f 46 a3 28
0e 50 54 a5 4b 00 81 80 95 00 b3 00 01 01 01 01
01 01 01 01 01 01 02 3a 80 18 71 38 2d 40 58 2c
45 00 55 50 21 00 00 1e 00 00 00 ff 00 30 30 30
30 30 30 30 30 30 30 30 30 31 00 00 00 fd 00 64
b4 ca ca 2d 01 0a 20 20 20 20 20 20 00 00 00 fc
00 32 37 45 36 43 41 0a 20 20 20 20 20 20 01 1f

02 03 31 f1 48 90 84 03 01 12 3f 1f 13 23 09 07
07 83 01 00 00 e2 00 7f 6d 1a 00 00 02 01 64 b4
00 00 00 00 00 00 e6 06 07 01 61 5f 00 e3 05 e3
01 04 74 80 18 71 38 2d 40 58 2c 35 00 55 50 21
00 00 1e 28 83 80 a0 70 38 29 40 30 20 35 00 55
50 21 00 00 1e 0b a2 80 a0 70 38 1c 40 30 2c 35
00 55 50 21 00 00 1e 00 00 00 00 00 00 00 00 00
00 00 00 00 00 00 00 00 00 00 00 00 00 00 00 67

----------------

Block 0, Base EDID:
  EDID Structure Version & Revision: 1.4
  Vendor & Product Identification:
    Manufacturer: HKC
    Model: 4129
    Made in: week 22 of 2024
  Basic Display Parameters & Features:
    Digital display
    Bits per primary color channel: 10
    DisplayPort interface
    Maximum image size: 60 cm x 33 cm
    Gamma: 2.20
    DPMS levels: Off
    Supported color formats: RGB 4:4:4, YCrCb 4:4:4, YCrCb 4:2:2
    First detailed timing includes the native pixel format and preferred refresh rate
    Display is continuous frequency
  Color Characteristics:
    Red  : 0.6601, 0.3105
    Green: 0.2744, 0.6386
    Blue : 0.1562, 0.0576
    White: 0.3134, 0.3291
  Established Timings I & II:
    IBM     :   720x400    70.081663 Hz   9:5     31.467 kHz     28.320000 MHz
    DMT 0x04:   640x480    59.940476 Hz   4:3     31.469 kHz     25.175000 MHz
    DMT 0x06:   640x480    75.000000 Hz   4:3     37.500 kHz     31.500000 MHz
    DMT 0x09:   800x600    60.316541 Hz   4:3     37.879 kHz     40.000000 MHz
    DMT 0x0b:   800x600    75.000000 Hz   4:3     46.875 kHz     49.500000 MHz
    DMT 0x10:  1024x768    60.003840 Hz   4:3     48.363 kHz     65.000000 MHz
    DMT 0x12:  1024x768    75.028582 Hz   4:3     60.023 kHz     78.750000 MHz
    DMT 0x24:  1280x1024   75.024675 Hz   5:4     79.976 kHz    135.000000 MHz
  Standard Timings:
    DMT 0x23:  1280x1024   60.019740 Hz   5:4     63.981 kHz    108.000000 MHz
    DMT 0x2f:  1440x900    59.887445 Hz  16:10    55.935 kHz    106.500000 MHz
    DMT 0x3a:  1680x1050   59.954250 Hz  16:10    65.290 kHz    146.250000 MHz
  Detailed Timing Descriptors:
    DTD 1:  1920x1080   60.000000 Hz  16:9     67.500 kHz    148.500000 MHz (597 mm x 336 mm)
                 Hfront   88 Hsync  44 Hback  148 Hpol P
                 Vfront    4 Vsync   5 Vback   36 Vpol P
    Display Product Serial Number: ...
    Display Range Limits:
      Monitor ranges (Bare Limits): 100-180 Hz V, 202-202 kHz H, max dotclock 450 MHz
    Display Product Name: '27E6CA'
  Extension blocks: 1
Checksum: 0x1f

----------------

Block 1, CTA-861 Extension Block:
  Revision: 3
  Underscans IT Video Formats by default
  Basic audio support
  Supports YCbCr 4:4:4
  Supports YCbCr 4:2:2
  Native detailed modes: 1
  Video Data Block:
    VIC  16:  1920x1080   60.000000 Hz  16:9     67.500 kHz    148.500000 MHz (native)
    VIC   4:  1280x720    60.000000 Hz  16:9     45.000 kHz     74.250000 MHz (native)
    VIC   3:   720x480    59.940060 Hz  16:9     31.469 kHz     27.000000 MHz
    VIC   1:   640x480    59.940476 Hz   4:3     31.469 kHz     25.175000 MHz
    VIC  18:   720x576    50.000000 Hz  16:9     31.250 kHz     27.000000 MHz
    VIC  63:  1920x1080  120.000000 Hz  16:9    135.000 kHz    297.000000 MHz
    VIC  31:  1920x1080   50.000000 Hz  16:9     56.250 kHz    148.500000 MHz
    VIC  19:  1280x720    50.000000 Hz  16:9     37.500 kHz     74.250000 MHz
  Audio Data Block:
    Linear PCM:
      Max channels: 2
      Supported sample rates (kHz): 48 44.1 32
      Supported sample sizes (bits): 24 20 16
  Speaker Allocation Data Block:
    FL/FR - Front Left/Right
  Video Capability Data Block:
    YCbCr quantization: No Data
    RGB quantization: Selectable (via AVI Q)
    PT scan behavior: Supports both over- and underscan
    IT scan behavior: Supports both over- and underscan
    CE scan behavior: Supports both over- and underscan
  Vendor-Specific Data Block (AMD), OUI 00-00-1A:
    Version: 2.1
    Minimum Refresh Rate: 100 Hz
    Maximum Refresh Rate: 180 Hz
    Flags 1.x: 0x00
    Flags 2.x: 0x00
    Maximum luminance: 0 (50.000 cd/m^2)
    Minimum luminance: 0 (0.000 cd/m^2)
    Unknown: 0x00 0x00
  HDR Static Metadata Data Block:
    Electro optical transfer functions:
      Traditional gamma - SDR luminance range
      Traditional gamma - HDR luminance range
      SMPTE ST2084
    Supported static metadata descriptors:
      Static metadata type 1
    Desired content max luminance: 97 (408.759 cd/m^2)
    Desired content max frame-average luminance: 95 (391.429 cd/m^2)
    Desired content min luminance: 0 (0.000 cd/m^2)
  Colorimetry Data Block:
    xvYCC601
    xvYCC709
    BT2020cYCC
    BT2020YCC
    BT2020RGB
    Gamut Boundary Description Metadata Profile P0
  Detailed Timing Descriptors:
    DTD 2:  1920x1080  120.000000 Hz  16:9    135.000 kHz    297.000000 MHz (597 mm x 336 mm)
                 Hfront   88 Hsync  44 Hback  148 Hpol P
                 Vfront    3 Vsync   5 Vback   37 Vpol P
    DTD 3:  1920x1080  143.999177 Hz  16:9    161.423 kHz    335.760000 MHz (597 mm x 336 mm)
                 Hfront   48 Hsync  32 Hback   80 Hpol P
                 Vfront    3 Vsync   5 Vback   33 Vpol P
    DTD 4:  1920x1080  179.997744 Hz  16:9    199.438 kHz    414.830000 MHz (597 mm x 336 mm)
                 Hfront   48 Hsync  44 Hback   68 Hpol P
                 Vfront    3 Vsync   5 Vback   20 Vpol P
Checksum: 0x67  Unused space in Extension Block: 24 bytes

----------------

Block 2, Unknown EDID Extension Block 0x00:
  00 ff ff ff ff ff ff 00 21 63 21 10 00 00 00 00 '........!c!.....'
  16 22 01 04 b5 3c 21 78 3b 26 35 a9 4f 46 a3 28 '."...<!x;&5.OF.('
  0e 50 54 a5 4b 00 81 80 95 00 b3 00 01 01 01 01 '.PT.K...........'
  01 01 01 01 01 01 02 3a 80 18 71 38 2d 40 58 2c '.......:..q8-@X,'
  45 00 55 50 21 00 00 1e 00 00 00 ff 00 30 30 30 'E.UP!........000'
  30 30 30 30 30 30 30 30 30 31 00 00 00 fd 00 64 '0000000001.....d'
  b4 ca ca 2d 01 0a 20 20 20 20 20 20 00 00 00 fc '...-..      ....'
  00 32 37 45 36 43 41 0a 20 20 20 20 20 20 01 1f '.27E6CA.      ..'
Checksum: 0x1f

----------------

Block 3, CTA-861 Extension Block:
  Revision: 3
  Underscans IT Video Formats by default
  Basic audio support
  Supports YCbCr 4:4:4
  Supports YCbCr 4:2:2
  Native detailed modes: 1
  Video Data Block:
    VIC  16:  1920x1080   60.000000 Hz  16:9     67.500 kHz    148.500000 MHz (native)
    VIC   4:  1280x720    60.000000 Hz  16:9     45.000 kHz     74.250000 MHz (native)
    VIC   3:   720x480    59.940060 Hz  16:9     31.469 kHz     27.000000 MHz
    VIC   1:   640x480    59.940476 Hz   4:3     31.469 kHz     25.175000 MHz
    VIC  18:   720x576    50.000000 Hz  16:9     31.250 kHz     27.000000 MHz
    VIC  63:  1920x1080  120.000000 Hz  16:9    135.000 kHz    297.000000 MHz
    VIC  31:  1920x1080   50.000000 Hz  16:9     56.250 kHz    148.500000 MHz
    VIC  19:  1280x720    50.000000 Hz  16:9     37.500 kHz     74.250000 MHz
  Audio Data Block:
    Linear PCM:
      Max channels: 2
      Supported sample rates (kHz): 48 44.1 32
      Supported sample sizes (bits): 24 20 16
  Speaker Allocation Data Block:
    FL/FR - Front Left/Right
  Video Capability Data Block:
    YCbCr quantization: No Data
    RGB quantization: Selectable (via AVI Q)
    PT scan behavior: Supports both over- and underscan
    IT scan behavior: Supports both over- and underscan
    CE scan behavior: Supports both over- and underscan
  Vendor-Specific Data Block (AMD), OUI 00-00-1A:
    Version: 2.1
    Minimum Refresh Rate: 100 Hz
    Maximum Refresh Rate: 180 Hz
    Flags 1.x: 0x00
    Flags 2.x: 0x00
    Maximum luminance: 0 (50.000 cd/m^2)
    Minimum luminance: 0 (0.000 cd/m^2)
    Unknown: 0x00 0x00
  HDR Static Metadata Data Block:
    Electro optical transfer functions:
      Traditional gamma - SDR luminance range
      Traditional gamma - HDR luminance range
      SMPTE ST2084
    Supported static metadata descriptors:
      Static metadata type 1
    Desired content max luminance: 97 (408.759 cd/m^2)
    Desired content max frame-average luminance: 95 (391.429 cd/m^2)
    Desired content min luminance: 0 (0.000 cd/m^2)
  Colorimetry Data Block:
    xvYCC601
    xvYCC709
    BT2020cYCC
    BT2020YCC
    BT2020RGB
    Gamut Boundary Description Metadata Profile P0
  Detailed Timing Descriptors:
    DTD 5:  1920x1080  120.000000 Hz  16:9    135.000 kHz    297.000000 MHz (597 mm x 336 mm)
                 Hfront   88 Hsync  44 Hback  148 Hpol P
                 Vfront    3 Vsync   5 Vback   37 Vpol P
    DTD 6:  1920x1080  143.999177 Hz  16:9    161.423 kHz    335.760000 MHz (597 mm x 336 mm)
                 Hfront   48 Hsync  32 Hback   80 Hpol P
                 Vfront    3 Vsync   5 Vback   33 Vpol P
    DTD 7:  1920x1080  179.997744 Hz  16:9    199.438 kHz    414.830000 MHz (597 mm x 336 mm)
                 Hfront   48 Hsync  44 Hback   68 Hpol P
                 Vfront    3 Vsync   5 Vback   20 Vpol P
Checksum: 0x67  Unused space in Extension Block: 24 bytes

----------------

Warnings:

Block 1, CTA-861 Extension Block:
  Video Capability Data Block: Set Selectable YCbCr Quantization to avoid interop issues.
  Video Capability Data Block: S_PT is equal to S_IT and S_CE, so should be set to 0 instead.
  Colorimetry Data Block: Set the sRGB colorimetry bit to avoid interop issues.
  Detailed Timing Descriptor #2: DTD is similar but not identical to VIC 63.
Block 3, CTA-861 Extension Block:
  Video Capability Data Block: Set Selectable YCbCr Quantization to avoid interop issues.
  Video Capability Data Block: S_PT is equal to S_IT and S_CE, so should be set to 0 instead.
  Colorimetry Data Block: Set the sRGB colorimetry bit to avoid interop issues.
  Detailed Timing Descriptor #5: DTD is similar but not identical to VIC 63.
EDID:
  Base EDID: Some timings are out of range of the Monitor Ranges:
    Vertical Freq: 50.000 - 179.998 Hz (Monitor: 100.000 - 180.000 Hz)
    Horizontal Freq: 31.250 - 199.437 kHz (Monitor: 202.000 - 202.000 kHz)

Failures:

Block 2, Base EDID:
  Unknown Extension Block.
Block 3, CTA-861 Extension Block:
  Video Data Block: Duplicate VIC 16.
  Video Data Block: Duplicate VIC 4.
  Video Data Block: Duplicate VIC 3.
  Video Data Block: Duplicate VIC 1.
  Video Data Block: Duplicate VIC 18.
  Video Data Block: Duplicate VIC 63.
  Video Data Block: Duplicate VIC 31.
  Video Data Block: Duplicate VIC 19.
  Speaker Allocation Data Block: Only one instance of this Data Block is allowed.
  Video Capability Data Block: Only one instance of this Data Block is allowed.
  HDR Static Metadata Data Block: Only one instance of this Data Block is allowed.
  Colorimetry Data Block: Only one instance of this Data Block is allowed.
EDID:
  Base EDID: EDID specified 1 extension block(s), but found 3 extension block(s).
  CTA-861: Native progressive timings are a mix of several resolutions.

EDID conformity: FAIL
