edid-decode (hex):

00 ff ff ff ff ff ff 00 08 ef 20 00 50 2d 31 01
0a 17 01 03 80 2c 19 78 2a c9 05 a3 57 4b 9c 25
12 50 54 bf ce 00 95 00 81 00 81 c0 61 40 81 0f
61 4f 45 40 45 4f 7c 2e 40 10 62 84 1c 30 60 a8
13 00 bb f9 10 00 00 1e 00 00 00 ff 00 31 32 33
34 35 36 37 38 39 0a 20 20 20 00 00 00 fd 00 38
4b 1e 51 0e 00 0a 20 20 20 20 20 20 00 00 00 fc
00 45 4c 32 30 38 30 57 4c 0a 20 20 20 20 00 92

00 ff ff ff ff ff ff 00 08 ef 20 00 50 2d 31 01
0a 17 01 03 80 2c 19 78 2a c9 05 a3 57 4b 9c 25
12 50 54 bf ce 00 95 00 81 00 81 c0 61 40 81 0f
61 4f 45 40 45 4f 7c 2e 40 10 62 84 1c 30 60 a8
13 00 bb f9 10 00 00 1e 00 00 00 ff 00 31 32 33
34 35 36 37 38 39 0a 20 20 20 00 00 00 fd 00 38
4b 1e 51 0e 00 0a 20 20 20 20 20 20 00 00 00 fc
00 45 4c 32 30 38 30 57 4c 0a 20 20 20 20 00 92

----------------

Block 0, Base EDID:
  EDID Structure Version & Revision: 1.3
  Vendor & Product Identification:
    Manufacturer: BGO
    Model: 32
    Serial Number: ...
    Made in: week 10 of 2013
  Basic Display Parameters & Features:
    Digital display
    Maximum image size: 44 cm x 25 cm
    Gamma: 2.20
    DPMS levels: Off
    RGB color display
    First detailed timing is the preferred timing
  Color Characteristics:
    Red  : 0.6396, 0.3398
    Green: 0.2949, 0.6103
    Blue : 0.1445, 0.0703
    White: 0.3134, 0.3291
  Established Timings I & II:
    IBM     :   720x400    70.081663 Hz   9:5     31.467 kHz     28.320000 MHz
    DMT 0x04:   640x480    59.940476 Hz   4:3     31.469 kHz     25.175000 MHz
    Apple   :   640x480    66.666667 Hz   4:3     35.000 kHz     30.240000 MHz
    DMT 0x05:   640x480    72.808802 Hz   4:3     37.861 kHz     31.500000 MHz
    DMT 0x06:   640x480    75.000000 Hz   4:3     37.500 kHz     31.500000 MHz
    DMT 0x08:   800x600    56.250000 Hz   4:3     35.156 kHz     36.000000 MHz
    DMT 0x09:   800x600    60.316541 Hz   4:3     37.879 kHz     40.000000 MHz
    DMT 0x0a:   800x600    72.187572 Hz   4:3     48.077 kHz     50.000000 MHz
    DMT 0x0b:   800x600    75.000000 Hz   4:3     46.875 kHz     49.500000 MHz
    DMT 0x10:  1024x768    60.003840 Hz   4:3     48.363 kHz     65.000000 MHz
    DMT 0x11:  1024x768    70.069359 Hz   4:3     56.476 kHz     75.000000 MHz
    DMT 0x12:  1024x768    75.028582 Hz   4:3     60.023 kHz     78.750000 MHz
  Standard Timings:
    DMT 0x2f:  1440x900    59.887445 Hz  16:10    55.935 kHz    106.500000 MHz
    DMT 0x1c:  1280x800    59.810326 Hz  16:10    49.702 kHz     83.500000 MHz
    DMT 0x55:  1280x720    60.000000 Hz  16:9     45.000 kHz     74.250000 MHz
    DMT 0x10:  1024x768    60.003840 Hz   4:3     48.363 kHz     65.000000 MHz
    DMT 0x1d:  1280x800    74.934142 Hz  16:10    62.795 kHz    106.500000 MHz
    DMT 0x12:  1024x768    75.028582 Hz   4:3     60.023 kHz     78.750000 MHz
    DMT 0x09:   800x600    60.316541 Hz   4:3     37.879 kHz     40.000000 MHz
    DMT 0x0b:   800x600    75.000000 Hz   4:3     46.875 kHz     49.500000 MHz
  Detailed Timing Descriptors:
    DTD 1:  1600x900    60.259755 Hz  16:9     55.921 kHz    119.000000 MHz (443 mm x 249 mm)
                 Hfront   96 Hsync 168 Hback  264 Hpol P
                 Vfront    1 Vsync   3 Vback   24 Vpol P
    Display Product Serial Number: ...
    Display Range Limits:
      Monitor ranges (GTF): 56-75 Hz V, 30-81 kHz H, max dotclock 140 MHz
    Display Product Name: 'EL2080WL'
Checksum: 0x92

----------------

Block 1, Unknown EDID Extension Block 0x00:
  00 ff ff ff ff ff ff 00 08 ef 20 00 50 2d 31 01 '.......... .P-1.'
  0a 17 01 03 80 2c 19 78 2a c9 05 a3 57 4b 9c 25 '.....,.x*...WK.%'
  12 50 54 bf ce 00 95 00 81 00 81 c0 61 40 81 0f '.PT.........a@..'
  61 4f 45 40 45 4f 7c 2e 40 10 62 84 1c 30 60 a8 'aOE@EO|.@.b..0`.'
  13 00 bb f9 10 00 00 1e 00 00 00 ff 00 31 32 33 '.............123'
  34 35 36 37 38 39 0a 20 20 20 00 00 00 fd 00 38 '456789.   .....8'
  4b 1e 51 0e 00 0a 20 20 20 20 20 20 00 00 00 fc 'K.Q...      ....'
  00 45 4c 32 30 38 30 57 4c 0a 20 20 20 20 00 92 '.EL2080WL.    ..'
Checksum: 0x92

----------------

Failures:

Block 1, Base EDID:
  Unknown Extension Block.
EDID:
  Base EDID: EDID specified 0 extension block(s), but found 1 extension block(s).

EDID conformity: FAIL
