
EDID (hex):
00ffffffffffff0050c31502502d3101
0718010380301b782e3585a656489a24
125054afef00714f818081009500b300
010101010101023a801871382d40582c
4500dc0c1100001e7c2e401062841c30
60a81300dc0c1100001e000000fd0038
4b1e5112000a202020202020000000fc
0032312e35206d6f6e69746f720a0012

Extracted contents:
header:          00 ff ff ff ff ff ff 00
serial number:   50 c3 15 02 50 2d 31 01 07 18
version:         01 03
basic params:    80 30 1b 78 2e
chroma info:     35 85 a6 56 48 9a 24 12 50 54
established:     af ef 00
standard:        71 4f 81 80 81 00 95 00 b3 00 01 01 01 01 01 01
descriptor 1:    02 3a 80 18 71 38 2d 40 58 2c 45 00 dc 0c 11 00 00 1e
descriptor 2:    7c 2e 40 10 62 84 1c 30 60 a8 13 00 dc 0c 11 00 00 1e
descriptor 3:    00 00 00 fd 00 38 4b 1e 51 12 00 0a 20 20 20 20 20 20
descriptor 4:    00 00 00 fc 00 32 31 2e 35 20 6d 6f 6e 69 74 6f 72 0a
extensions:      00
checksum:        12

EDID version: 1.3
Manufacturer: TFC Model 215 Serial Number --
Made in week 7 of 2014
Digital display
Maximum image size: 48 cm x 27 cm
Gamma: 2.20
DPMS levels: Off
RGB color display
Default (sRGB) color space is primary color space
First detailed timing is preferred timing
Display x,y Chromaticity:
  Red:   0.6484, 0.3388
  Green: 0.2822, 0.6025
  Blue:  0.1425, 0.0703
  White: 0.3134, 0.3291
Established timings supported:
  720x400@70Hz 9:5 HorFreq: 31469 Hz Clock: 28.320 MHz
  640x480@60Hz 4:3 HorFreq: 31469 Hz Clock: 25.175 MHz
  640x480@72Hz 4:3 HorFreq: 37900 Hz Clock: 31.500 MHz
  640x480@75Hz 4:3 HorFreq: 37500 Hz Clock: 31.500 MHz
  800x600@56Hz 4:3 HorFreq: 35200 Hz Clock: 36.000 MHz
  800x600@60Hz 4:3 HorFreq: 37900 Hz Clock: 40.000 MHz
  800x600@72Hz 4:3 HorFreq: 48100 Hz Clock: 50.000 MHz
  800x600@75Hz 4:3 HorFreq: 46900 Hz Clock: 49.500 MHz
  832x624@75Hz 4:3 HorFreq: 49726 Hz Clock: 57.284 MHz
  1024x768@60Hz 4:3 HorFreq: 48400 Hz Clock: 65.000 MHz
  1024x768@70Hz 4:3 HorFreq: 56500 Hz Clock: 75.000 MHz
  1024x768@75Hz 4:3 HorFreq: 60000 Hz Clock: 78.750 MHz
  1280x1024@75Hz 5:4 HorFreq: 80000 Hz Clock: 135.000 MHz
Standard timings supported:
  1152x864@75Hz 4:3 HorFreq: 67500 Hz Clock: 108.000 MHz
  1280x1024@60Hz 5:4 HorFreq: 64000 Hz Clock: 108.000 MHz
  1280x800@60Hz 16:10
  1440x900@60Hz 16:10 HorFreq: 55500 Hz Clock: 88.750 MHz
  1680x1050@60Hz 16:10 HorFreq: 64700 Hz Clock: 119.000 MHz
Detailed mode: Clock 148.500 MHz, 476 mm x 268 mm
               1920 2008 2052 2200 hborder 0
               1080 1084 1089 1125 vborder 0
               +hsync +vsync 
               VertFreq: 60 Hz, HorFreq: 67500 Hz
Detailed mode: Clock 119.000 MHz, 476 mm x 268 mm
               1600 1696 1864 2128 hborder 0
                900  901  904  928 vborder 0
               +hsync +vsync 
               VertFreq: 60 Hz, HorFreq: 55921 Hz
Monitor ranges (GTF): 56-75Hz V, 30-81kHz H, max dotclock 180MHz
Monitor name: 21.5 monitor
Checksum: 0x12 (valid)
EDID block does NOT conform to EDID 1.3!
	sRGB is signaled, but the chromaticities do not match
