edid-decode (hex):

00 ff ff ff ff ff ff 00 30 ae 00 a5 01 00 00 00
01 1a 01 04 a5 33 1d 78 1b 2c c5 a4 56 50 a1 28
0f 50 54 00 00 00 01 01 01 01 01 01 01 01 01 01
01 01 01 01 01 01 02 3a 80 18 71 38 2d 40 58 2c
45 00 dd 0c 11 00 00 1e 00 00 00 fc 00 4c 45 4e
2d 41 35 30 30 2d 42 0a 20 20 00 00 00 fd 00 39
3e 1e 5a 14 35 00 55 50 21 00 00 1a 00 00 00 ff
00 4c 4d 32 33 30 57 46 37 2d 53 53 42 32 00 54

00 ff ff ff ff ff ff 00 30 ae 00 a5 01 00 00 00
01 1a 01 04 a5 33 1d 78 1b 2c c5 a4 56 50 a1 28
0f 50 54 00 00 00 01 01 01 01 01 01 01 01 01 01
01 01 01 01 01 01 02 3a 80 18 71 38 2d 40 58 2c
45 00 dd 0c 11 00 00 1e 00 00 00 fc 00 4c 45 4e
2d 41 35 30 30 2d 42 0a 20 20 00 00 00 fd 00 39
3e 1e 5a 14 35 00 55 50 21 00 00 1a 00 00 00 ff
00 4c 4d 32 33 30 57 46 37 2d 53 53 42 32 00 54

----------------

Block 0, Base EDID:
  EDID Structure Version & Revision: 1.4
  Vendor & Product Identification:
    Manufacturer: LEN
    Model: 42240
    Serial Number: ...
    Made in: week 1 of 2016
  Basic Display Parameters & Features:
    Digital display
    Bits per primary color channel: 8
    DisplayPort interface
    Maximum image size: 51 cm x 29 cm
    Gamma: 2.20
    Supported color formats: RGB 4:4:4, YCrCb 4:4:4, YCrCb 4:2:2
    First detailed timing includes the native pixel format and preferred refresh rate
    Display is continuous frequency
  Color Characteristics:
    Red  : 0.6406, 0.3378
    Green: 0.3154, 0.6289
    Blue : 0.1591, 0.0585
    White: 0.3134, 0.3291
  Established Timings I & II: none
  Standard Timings: none
  Detailed Timing Descriptors:
    DTD 1:  1920x1080   60.000000 Hz  16:9     67.500 kHz    148.500000 MHz (477 mm x 268 mm)
                 Hfront   88 Hsync  44 Hback  148 Hpol P
                 Vfront    4 Vsync   5 Vback   36 Vpol P
    Display Product Name: 'LEN-A500-B'
    Display Range Limits:
      Monitor ranges (Unknown (0x35)): 57-62 Hz V, 30-90 kHz H, max dotclock 200 MHz
    Display Product Serial Number: ...
Checksum: 0x54

----------------

Block 1, Unknown EDID Extension Block 0x00:
  00 ff ff ff ff ff ff 00 30 ae 00 a5 01 00 00 00 '........0.......'
  01 1a 01 04 a5 33 1d 78 1b 2c c5 a4 56 50 a1 28 '.....3.x.,..VP.('
  0f 50 54 00 00 00 01 01 01 01 01 01 01 01 01 01 '.PT.............'
  01 01 01 01 01 01 02 3a 80 18 71 38 2d 40 58 2c '.......:..q8-@X,'
  45 00 dd 0c 11 00 00 1e 00 00 00 fc 00 4c 45 4e 'E............LEN'
  2d 41 35 30 30 2d 42 0a 20 20 00 00 00 fd 00 39 '-A500-B.  .....9'
  3e 1e 5a 14 35 00 55 50 21 00 00 1a 00 00 00 ff '>.Z.5.UP!.......'
  00 4c 4d 32 33 30 57 46 37 2d 53 53 42 32 00 54 '.LM230WF7-SSB2.T'
Checksum: 0x54

----------------

Failures:

Block 0, Base EDID:
  Detailed Timing Descriptor #1: Mismatch of image size 477x268 mm vs display size 510x290 mm.
  Display Range Limits: Unknown range class (0x35).
  Display Range Limits: Byte 11 is 0x00 instead of 0x0a.
  Display Range Limits: Bytes 12-17 must be 0x20.
Block 1, Base EDID:
  Unknown Extension Block.
EDID:
  Base EDID: EDID specified 0 extension block(s), but found 1 extension block(s).

EDID conformity: FAIL
