edid-decode (hex):

00 ff ff ff ff ff ff 00 41 62 8b 00 41 37 31 91
0d 13 01 03 80 2e 1d 78 ea 04 05 a5 56 47 9e 25
15 50 54 af cf 00 81 80 71 4f 95 00 95 0f a9 40
b3 00 01 01 01 01 21 39 90 30 62 1a 27 40 68 b0
36 00 d0 22 11 00 00 1c 00 00 00 fc 00 56 69 73
65 6f 20 32 32 33 57 73 0a 20 00 00 00 fd 00 38
4c 1f 53 10 00 0a 20 20 20 20 20 20 00 00 00 ff
00 44 30 31 30 43 30 30 32 34 30 30 31 0a 00 12

00 ff ff ff ff ff ff 00 41 62 8b 00 41 37 31 91
0d 13 01 03 80 2e 1d 78 ea 04 05 a5 56 47 9e 25
15 50 54 af cf 00 81 80 71 4f 95 00 95 0f a9 40
b3 00 01 01 01 01 21 39 90 30 62 1a 27 40 68 b0
36 00 d0 22 11 00 00 1c 00 00 00 fc 00 56 69 73
65 6f 20 32 32 33 57 73 0a 20 00 00 00 fd 00 38
4c 1f 53 10 00 0a 20 20 20 20 20 20 00 00 00 ff
00 44 30 31 30 43 30 30 32 34 30 30 31 0a 00 12

----------------

Block 0, Base EDID:
  EDID Structure Version & Revision: 1.3
  Vendor & Product Identification:
    Manufacturer: PKB
    Model: 139
    Serial Number: ...
    Made in: week 13 of 2009
  Basic Display Parameters & Features:
    Digital display
    Maximum image size: 46 cm x 29 cm
    Gamma: 2.20
    DPMS levels: Standby Suspend Off
    RGB color display
    First detailed timing is the preferred timing
  Color Characteristics:
    Red  : 0.6445, 0.3359
    Green: 0.2783, 0.6171
    Blue : 0.1445, 0.0820
    White: 0.3134, 0.3291
  Established Timings I & II:
    IBM     :   720x400    70.081663 Hz   9:5     31.467 kHz     28.320000 MHz
    DMT 0x04:   640x480    59.940476 Hz   4:3     31.469 kHz     25.175000 MHz
    DMT 0x05:   640x480    72.808802 Hz   4:3     37.861 kHz     31.500000 MHz
    DMT 0x06:   640x480    75.000000 Hz   4:3     37.500 kHz     31.500000 MHz
    DMT 0x08:   800x600    56.250000 Hz   4:3     35.156 kHz     36.000000 MHz
    DMT 0x09:   800x600    60.316541 Hz   4:3     37.879 kHz     40.000000 MHz
    DMT 0x0a:   800x600    72.187572 Hz   4:3     48.077 kHz     50.000000 MHz
    DMT 0x0b:   800x600    75.000000 Hz   4:3     46.875 kHz     49.500000 MHz
    DMT 0x10:  1024x768    60.003840 Hz   4:3     48.363 kHz     65.000000 MHz
    DMT 0x11:  1024x768    70.069359 Hz   4:3     56.476 kHz     75.000000 MHz
    DMT 0x12:  1024x768    75.028582 Hz   4:3     60.023 kHz     78.750000 MHz
    DMT 0x24:  1280x1024   75.024675 Hz   5:4     79.976 kHz    135.000000 MHz
  Standard Timings:
    DMT 0x23:  1280x1024   60.019740 Hz   5:4     63.981 kHz    108.000000 MHz
    DMT 0x15:  1152x864    75.000000 Hz   4:3     67.500 kHz    108.000000 MHz
    DMT 0x2f:  1440x900    59.887445 Hz  16:10    55.935 kHz    106.500000 MHz
    DMT 0x30:  1440x900    74.984427 Hz  16:10    70.635 kHz    136.750000 MHz
    DMT 0x33:  1600x1200   60.000000 Hz   4:3     75.000 kHz    162.000000 MHz
    DMT 0x3a:  1680x1050   59.954250 Hz  16:10    65.290 kHz    146.250000 MHz
  Detailed Timing Descriptors:
    DTD 1:  1680x1050   59.954250 Hz  16:10    65.290 kHz    146.250000 MHz (464 mm x 290 mm)
                 Hfront  104 Hsync 176 Hback  280 Hpol N
                 Vfront    3 Vsync   6 Vback   30 Vpol P
    Display Product Name: 'Viseo 223Ws'
    Display Range Limits:
      Monitor ranges (GTF): 56-76 Hz V, 31-83 kHz H, max dotclock 160 MHz
    Display Product Serial Number: ...
Checksum: 0x12

----------------

Block 1, Unknown EDID Extension Block 0x00:
  00 ff ff ff ff ff ff 00 41 62 8b 00 41 37 31 91 '........Ab..A71.'
  0d 13 01 03 80 2e 1d 78 ea 04 05 a5 56 47 9e 25 '.......x....VG.%'
  15 50 54 af cf 00 81 80 71 4f 95 00 95 0f a9 40 '.PT.....qO.....@'
  b3 00 01 01 01 01 21 39 90 30 62 1a 27 40 68 b0 '......!9.0b.'@h.'
  36 00 d0 22 11 00 00 1c 00 00 00 fc 00 56 69 73 '6..".........Vis'
  65 6f 20 32 32 33 57 73 0a 20 00 00 00 fd 00 38 'eo 223Ws. .....8'
  4c 1f 53 10 00 0a 20 20 20 20 20 20 00 00 00 ff 'L.S...      ....'
  00 44 30 31 30 43 30 30 32 34 30 30 31 0a 00 12 '.D010C0024001...'
Checksum: 0x12

----------------

Warnings:

EDID:
  Base EDID: Some timings are out of range of the Monitor Ranges:
    Maximum Clock: 162.000 MHz (Monitor: 160.000 MHz)
    Could be due to a Monitor Range off-by-one rounding issue

Failures:

Block 1, Base EDID:
  Unknown Extension Block.
EDID:
  Base EDID: EDID specified 0 extension block(s), but found 1 extension block(s).

EDID conformity: FAIL
