edid-decode (hex):

00 ff ff ff ff ff ff 00 11 a9 00 00 42 00 00 00
11 0e 01 00 18 04 03 9c 8e 00 00 00 00 00 00 00
00 00 00 ff ff f8 81 c0 81 c0 81 80 00 00 00 00
00 00 00 00 00 00 00 00 00 fc 00 4c 43 44 20 4d
75 6c 74 69 2d 4d 65 64 00 00 00 fc 00 69 61 20
44 69 73 70 6c 61 79 20 20 20 00 00 00 fc 00 0a
20 20 20 20 20 20 20 20 20 20 20 20 30 2a 00 98
51 00 2a 40 f8 70 63 08 04 03 00 00 00 78 00 4a

----------------

Block 0, Base EDID:
  EDID Structure Version & Revision: 1.0
  Vendor & Product Identification:
    Manufacturer: DMI
    Model: 0
    Serial Number: ...
    Made in: week 17 of 2004
  Basic Display Parameters & Features:
    Analog display
    Signal Level Standard: 0.700 : 0.300 : 1.000 V p-p
    Blank-to-black setup/pedestal
    Sync: Separate
    Maximum image size: 4 cm x 3 cm
    Gamma: 2.56
    DPMS levels: Standby
    RGB color display
    Default (sRGB) color space is primary color space
    First detailed timing is the preferred timing
  Color Characteristics:
    Red  : 0.0000, 0.0000
    Green: 0.0000, 0.0000
    Blue : 0.0000, 0.0000
    White: 0.0000, 0.0000
  Established Timings I & II:
    IBM     :   720x400    70.081663 Hz   9:5     31.467 kHz     28.320000 MHz
    IBM     :   720x400    87.849542 Hz   9:5     39.444 kHz     35.500000 MHz
    DMT 0x04:   640x480    59.940476 Hz   4:3     31.469 kHz     25.175000 MHz
    Apple   :   640x480    66.666667 Hz   4:3     35.000 kHz     30.240000 MHz
    DMT 0x05:   640x480    72.808802 Hz   4:3     37.861 kHz     31.500000 MHz
    DMT 0x06:   640x480    75.000000 Hz   4:3     37.500 kHz     31.500000 MHz
    DMT 0x08:   800x600    56.250000 Hz   4:3     35.156 kHz     36.000000 MHz
    DMT 0x09:   800x600    60.316541 Hz   4:3     37.879 kHz     40.000000 MHz
    DMT 0x0a:   800x600    72.187572 Hz   4:3     48.077 kHz     50.000000 MHz
    DMT 0x0b:   800x600    75.000000 Hz   4:3     46.875 kHz     49.500000 MHz
    Apple   :   832x624    74.551266 Hz   4:3     49.726 kHz     57.284000 MHz
    DMT 0x0f:  1024x768i   86.957532 Hz   4:3     35.522 kHz     44.900000 MHz
    DMT 0x10:  1024x768    60.003840 Hz   4:3     48.363 kHz     65.000000 MHz
    DMT 0x11:  1024x768    70.069359 Hz   4:3     56.476 kHz     75.000000 MHz
    DMT 0x12:  1024x768    75.028582 Hz   4:3     60.023 kHz     78.750000 MHz
    DMT 0x24:  1280x1024   75.024675 Hz   5:4     79.976 kHz    135.000000 MHz
    Apple   :  1152x870    75.061550 Hz 192:145   68.681 kHz    100.000000 MHz
  Standard Timings:
    DMT 0x55:  1280x720    60.000000 Hz  16:9     45.000 kHz     74.250000 MHz
    DMT 0x55:  1280x720    60.000000 Hz  16:9     45.000 kHz     74.250000 MHz
    DMT 0x23:  1280x1024   60.019740 Hz   5:4     63.981 kHz    108.000000 MHz
  Detailed Timing Descriptors:
    Display Product Name: 'LCD Multi-Med'
    Display Product Name: 'ia Display   '
    Display Product Name: ''
    DTD 1:  1280x1024   60.019740 Hz   5:4     63.981 kHz    108.000000 MHz (four way interleaved, 4 mm x 3 mm)
                 Hfront  248 Hsync 112 Hback   48 Hpol N
                 Vfront   38 Vsync   3 Vback    1 Vpol N
Checksum: 0x4a

----------------

Warnings:

Block 0, Base EDID:
  EDID Structure Version & Revision: EDID 1.0 is deprecated, do not use.
  Basic Display Parameters & Features: Dubious maximum image size (4x3 is smaller than 10x10 cm).
  Basic Display Parameters & Features: sRGB is signaled, but the gamma != 2.2.
  Detailed Timing Descriptor #1: DTD is similar but not identical to DMT 0x23.

Failures:

Block 0, Base EDID:
  Basic Display Parameters & Features: sRGB is signaled, but the chromaticities do not match.
  Standard Timings: Use 0x0101 as the invalid Standard Timings code, not 0x0000.
  Standard Timings: Use 0x0101 as the invalid Standard Timings code, not 0x0000.
  Standard Timings: Use 0x0101 as the invalid Standard Timings code, not 0x0000.
  Standard Timings: Use 0x0101 as the invalid Standard Timings code, not 0x0000.
  Standard Timings: Use 0x0101 as the invalid Standard Timings code, not 0x0000.
  Standard Timings: Missing preferred timing.
  Display Descriptor #1: Has descriptor blocks other than detailed timings.
  Display Descriptor #2: Has descriptor blocks other than detailed timings.
  Display Product Name: One or more trailing spaces.
  Display Descriptor #3: Has descriptor blocks other than detailed timings.
  Display Product Name: Empty string.
  Detailed Timing Descriptor #1: Mismatch of image size 4x3 mm vs display size 40x30 mm.
  Detailed Timing Descriptor #1: Invalid detailed timing descriptor ordering.

EDID conformity: FAIL
