edid-decode (hex):

00 ff ff ff ff ff ff 00 0d ae e2 15 00 00 00 00
12 1a 01 04 95 22 13 78 02 a6 63 8d 56 55 8f 28
20 4c 52 00 00 00 01 01 01 01 01 01 01 01 01 01
01 01 01 01 01 01 5e 35 80 96 70 38 14 40 2c 1c
24 00 58 c1 10 00 00 18 00 00 00 fe 00 4e 31 35
36 48 47 45 2d 44 41 42 0a 20 00 00 00 fe 00 43
4d 4e 0a 20 20 20 20 20 20 20 20 20 00 00 00 fe
00 4e 31 35 36 48 47 45 2d 44 41 42 0a 20 00 0d

----------------

Block 0, Base EDID:
  EDID Structure Version & Revision: 1.4
  Vendor & Product Identification:
    Manufacturer: CMN
    Model: 5602
    Made in: week 18 of 2016
  Basic Display Parameters & Features:
    Digital display
    Bits per primary color channel: 6
    DisplayPort interface
    Maximum image size: 34 cm x 19 cm
    Gamma: 2.20
    Supported color formats: RGB 4:4:4
    First detailed timing includes the native pixel format and preferred refresh rate
  Color Characteristics:
    Red  : 0.5527, 0.3378
    Green: 0.3330, 0.5605
    Blue : 0.1572, 0.1269
    White: 0.2968, 0.3232
  Established Timings I & II: none
  Standard Timings: none
  Detailed Timing Descriptors:
    DTD 1:  1920x1080   60.000 Hz  16:9    66.000 kHz 136.620 MHz (344 mm x 193 mm)
                 Hfront   44 Hsync  28 Hback  78 Hpol N
                 Vfront    2 Vsync   4 Vback  14 Vpol N
    Alphanumeric Data String: 'N156HGE-DAB'
    Alphanumeric Data String: 'CMN'
    Alphanumeric Data String: 'N156HGE-DAB'
Checksum: 0x0d

----------------

Failures:

Block 0, Base EDID:
  Missing Display Product Name.

EDID conformity: FAIL
