edid-decode (hex):

00 ff ff ff ff ff ff 00 5a 63 45 50 e8 67 01 00
01 0a 01 02 18 1c 15 be e8 0f 29 a0 57 4f 98 26
10 48 4c ff fe 00 31 59 45 59 61 59 71 4f 81 40
81 80 01 01 01 01 56 13 20 00 31 58 19 20 10 50
13 00 04 c3 10 00 00 1e 00 00 00 ff 00 47 50 30
30 31 39 32 31 33 36 0a 20 20 00 00 00 fd 00 32
78 1e 46 0b 00 0a 20 20 20 20 20 20 00 00 00 fc
00 47 36 35 35 0a 20 20 02 20 20 20 20 20 00 4a

----------------

Block 0, Base EDID:
  EDID Structure Version & Revision: 1.2
  Vendor & Product Identification:
    Manufacturer: VSC
    Model: 20549
    Serial Number: ...
    Made in: week 1 of 2000
  Basic Display Parameters & Features:
    Analog display
    Signal Level Standard: 0.700 : 0.300 : 1.000 V p-p
    Blank-to-black setup/pedestal
    Sync: Separate
    Maximum image size: 28 cm x 21 cm
    Gamma: 2.90
    DPMS levels: Standby Suspend Off
    RGB color display
  Color Characteristics:
    Red  : 0.6250, 0.3398
    Green: 0.3115, 0.5966
    Blue : 0.1484, 0.0644
    White: 0.2832, 0.2978
  Established Timings I & II:
    IBM     :   720x400    70.081663 Hz   9:5     31.467 kHz     28.320000 MHz
    IBM     :   720x400    87.849542 Hz   9:5     39.444 kHz     35.500000 MHz
    DMT 0x04:   640x480    59.940476 Hz   4:3     31.469 kHz     25.175000 MHz
    Apple   :   640x480    66.666667 Hz   4:3     35.000 kHz     30.240000 MHz
    DMT 0x05:   640x480    72.808802 Hz   4:3     37.861 kHz     31.500000 MHz
    DMT 0x06:   640x480    75.000000 Hz   4:3     37.500 kHz     31.500000 MHz
    DMT 0x08:   800x600    56.250000 Hz   4:3     35.156 kHz     36.000000 MHz
    DMT 0x09:   800x600    60.316541 Hz   4:3     37.879 kHz     40.000000 MHz
    DMT 0x0a:   800x600    72.187572 Hz   4:3     48.077 kHz     50.000000 MHz
    DMT 0x0b:   800x600    75.000000 Hz   4:3     46.875 kHz     49.500000 MHz
    Apple   :   832x624    74.551266 Hz   4:3     49.726 kHz     57.284000 MHz
    DMT 0x0f:  1024x768i   86.957532 Hz   4:3     35.522 kHz     44.900000 MHz
    DMT 0x10:  1024x768    60.003840 Hz   4:3     48.363 kHz     65.000000 MHz
    DMT 0x11:  1024x768    70.069359 Hz   4:3     56.476 kHz     75.000000 MHz
    DMT 0x12:  1024x768    75.028582 Hz   4:3     60.023 kHz     78.750000 MHz
  Standard Timings:
    DMT 0x07:   640x480    85.008312 Hz   4:3     43.269 kHz     36.000000 MHz
    DMT 0x0c:   800x600    85.061274 Hz   4:3     53.674 kHz     56.250000 MHz
    DMT 0x13:  1024x768    84.996690 Hz   4:3     68.677 kHz     94.500000 MHz
    DMT 0x15:  1152x864    75.000000 Hz   4:3     67.500 kHz    108.000000 MHz
    DMT 0x20:  1280x960    60.000000 Hz   4:3     60.000 kHz    108.000000 MHz
    DMT 0x23:  1280x1024   60.019740 Hz   5:4     63.981 kHz    108.000000 MHz
  Detailed Timing Descriptors:
    DTD 1:   800x600    75.000000 Hz   4:3     46.875 kHz     49.500000 MHz (260 mm x 195 mm)
                 Hfront   16 Hsync  80 Hback  160 Hpol P
                 Vfront    1 Vsync   3 Vback   21 Vpol P
    Display Product Serial Number: ...
    Display Range Limits:
      Monitor ranges (GTF): 50-120 Hz V, 30-70 kHz H, max dotclock 110 MHz
    Display Product Name: 'G655'
Checksum: 0x4a

----------------

Warnings:

Block 0, Base EDID:
  EDID Structure Version & Revision: EDID 1.2 is deprecated, do not use.

Failures:

Block 0, Base EDID:
  Detailed Timing Descriptor #1: Mismatch of image size 260x195 mm vs display size 280x210 mm.
  Display Product Name: Non-space after newline.

EDID conformity: FAIL
