
EDID (hex):
00ffffffffffff0022f6022401010101
1f1f010380351e782a1dd5a75650a026
105054a54b008180a9c0714f01010101
010101010101023a801871382d40582c
45000f282100001e000000ff00202020
20202020202020202020000000fd0032
4c0f5311000a202020202020000000fc
00485541574549204144383048570144
020313324801139f129004020365030c
001000023a801871382d40582c45000f
282100001e011d007251d01e206e2855
000f282100001e8c0ad08a20e02d1010
3e96000f282100001800000000000000
00000000000000000000000000000000
00000000000000000000000000000000
00000000000000000000000000000092

Extracted contents:
header:          00 ff ff ff ff ff ff 00
serial number:   22 f6 02 24 01 01 01 01 1f 1f
version:         01 03
basic params:    80 35 1e 78 2a
chroma info:     1d d5 a7 56 50 a0 26 10 50 54
established:     a5 4b 00
standard:        81 80 a9 c0 71 4f 01 01 01 01 01 01 01 01 01 01
descriptor 1:    02 3a 80 18 71 38 2d 40 58 2c 45 00 0f 28 21 00 00 1e
descriptor 2:    00 00 00 ff 00 20 20 20 20 20 20 20 20 20 20 20 20 20
descriptor 3:    00 00 00 fd 00 32 4c 0f 53 11 00 0a 20 20 20 20 20 20
descriptor 4:    00 00 00 fc 00 48 55 41 57 45 49 20 41 44 38 30 48 57
extensions:      01
checksum:        44

EDID version: 1.3
Manufacturer: HWV Model 2402 Serial Number --
Made in week 31 of 2021
Digital display
Maximum image size: 53 cm x 30 cm
Gamma: 2.20
DPMS levels: Off
RGB color display
First detailed timing is preferred timing
Display x,y Chromaticity:
  Red:   0.6523, 0.3369
  Green: 0.3154, 0.6259
  Blue:  0.1513, 0.0634
  White: 0.3134, 0.3291
Established timings supported:
  720x400@70Hz 9:5 HorFreq: 31469 Hz Clock: 28.320 MHz
  640x480@60Hz 4:3 HorFreq: 31469 Hz Clock: 25.175 MHz
  640x480@75Hz 4:3 HorFreq: 37500 Hz Clock: 31.500 MHz
  800x600@60Hz 4:3 HorFreq: 37900 Hz Clock: 40.000 MHz
  800x600@75Hz 4:3 HorFreq: 46900 Hz Clock: 49.500 MHz
  1024x768@60Hz 4:3 HorFreq: 48400 Hz Clock: 65.000 MHz
  1024x768@75Hz 4:3 HorFreq: 60000 Hz Clock: 78.750 MHz
  1280x1024@75Hz 5:4 HorFreq: 80000 Hz Clock: 135.000 MHz
Standard timings supported:
  1280x1024@60Hz 5:4 HorFreq: 64000 Hz Clock: 108.000 MHz
  1600x900@60Hz 16:9
  1152x864@75Hz 4:3 HorFreq: 67500 Hz Clock: 108.000 MHz
Detailed mode: Clock 148.500 MHz, 527 mm x 296 mm
               1920 2008 2052 2200 hborder 0
               1080 1084 1089 1125 vborder 0
               +hsync +vsync 
               VertFreq: 60 Hz, HorFreq: 67500 Hz
Serial number:              
-- ranges (GTF): 50-76Hz V, 15-83kHz H, max dotclock 170MHz
Has 1 extension blocks
Checksum: 0x44 (valid)

CTA extension block
Extension version: 3
15 bytes of CTA data
  Video data block
    VIC   1 640x480@60Hz 4:3  HorFreq: 31469 Hz Clock: 25.175 MHz
    VIC  19 1280x720@50Hz 16:9  HorFreq: 37500 Hz Clock: 74.250 MHz
    VIC  31 1920x1080@50Hz 16:9 (native) HorFreq: 56250 Hz Clock: 148.500 MHz
    VIC  18 720x576@50Hz 16:9  HorFreq: 31250 Hz Clock: 27.000 MHz
    VIC  16 1920x1080@60Hz 16:9 (native) HorFreq: 67500 Hz Clock: 148.500 MHz
    VIC   4 1280x720@60Hz 16:9  HorFreq: 45000 Hz Clock: 74.250 MHz
    VIC   2 720x480@60Hz 4:3  HorFreq: 31469 Hz Clock: 27.000 MHz
    VIC   3 720x480@60Hz 16:9  HorFreq: 31469 Hz Clock: 27.000 MHz
  Vendor-specific data block, OUI 000c03 (HDMI)
    Source physical address 1.0.0.0
Supports YCbCr 4:4:4
Supports YCbCr 4:2:2
2 native detailed modes
Detailed mode: Clock 148.500 MHz, 527 mm x 296 mm
               1920 2008 2052 2200 hborder 0
               1080 1084 1089 1125 vborder 0
               +hsync +vsync 
               VertFreq: 60 Hz, HorFreq: 67500 Hz
Detailed mode: Clock 74.250 MHz, 527 mm x 296 mm
               1280 1390 1430 1650 hborder 0
                720  725  730  750 vborder 0
               +hsync +vsync 
               VertFreq: 60 Hz, HorFreq: 45000 Hz
Detailed mode: Clock 27.000 MHz, 527 mm x 296 mm
                720  736  798  858 hborder 0
                480  489  495  525 vborder 0
               -hsync -vsync 
               VertFreq: 59 Hz, HorFreq: 31468 Hz
Checksum: 0x92 (valid)

EDID block does NOT conform to EDID 1.3!
	Name descriptor not terminated with a newline
EDID block does not conform at all!
	Both the serial number and the serial string are set


