edid-decode (hex):

00 ff ff ff ff ff ff 00 0d af 05 13 00 00 00 00
11 10 01 03 80 1d 12 78 0a 65 21 9f 58 55 87 2a
29 50 54 00 00 00 01 01 01 01 01 01 01 01 01 01
01 01 01 01 01 01 bc 1b 00 a0 50 20 17 30 30 20
36 00 1e b3 10 00 00 18 00 00 00 fe 00 4e 31 33
33 49 31 2d 4c 30 35 0a 20 20 00 00 00 fe 00 43
4d 4f 0a 20 20 20 20 20 20 20 20 20 00 00 00 fe
00 4e 31 33 33 49 31 2d 4c 30 35 0a 20 20 00 be

----------------

Block 0, Base EDID:
  EDID Structure Version & Revision: 1.3
  Vendor & Product Identification:
    Manufacturer: CMO
    Model: 4869
    Made in: week 17 of 2006
  Basic Display Parameters & Features:
    Digital display
    Maximum image size: 29 cm x 18 cm
    Gamma: 2.20
    RGB color display
    First detailed timing is the preferred timing
  Color Characteristics:
    Red  : 0.6220, 0.3457
    Green: 0.3330, 0.5283
    Blue : 0.1640, 0.1621
    White: 0.3125, 0.3291
  Established Timings I & II: none
  Standard Timings: none
  Detailed Timing Descriptors:
    DTD 1:  1280x800    59.910 Hz   8:5    49.306 kHz  71.000 MHz (286 mm x 179 mm)
                 Hfront   48 Hsync  32 Hback  80 Hpol N
                 Vfront    3 Vsync   6 Vback  14 Vpol N
    Alphanumeric Data String: 'N133I1-L05'
    Alphanumeric Data String: 'CMO'
    Alphanumeric Data String: 'N133I1-L05'
Checksum: 0xbe

----------------

Failures:

Block 0, Base EDID:
  Missing Display Product Name.
  Missing Display Range Limits Descriptor.

EDID conformity: FAIL
