edid-decode (hex):

00 ff ff ff ff ff ff 00 30 e4 1c 02 00 00 00 00
00 13 01 03 80 1a 0e 78 0a bf 45 95 58 52 8a 28
25 50 54 00 00 00 01 01 01 01 01 01 01 01 01 01
01 01 01 01 01 01 e2 1d 56 dc 50 00 23 30 38 28
78 00 00 90 10 00 00 1b 00 00 00 00 00 00 00 00
00 00 00 00 00 00 00 00 00 00 00 00 00 fe 00 4c
47 20 44 69 73 70 6c 61 79 0a 20 20 00 00 00 fc
00 4c 50 31 31 36 57 48 31 2d 54 4c 41 31 00 4e

----------------

Block 0, Base EDID:
  EDID Structure Version & Revision: 1.3
  Vendor & Product Identification:
    Manufacturer: LGD
    Model: 540
    Made in: 2009
  Basic Display Parameters & Features:
    Digital display
    Maximum image size: 26 cm x 14 cm
    Gamma: 2.20
    RGB color display
    First detailed timing is the preferred timing
  Color Characteristics:
    Red  : 0.5839, 0.3466
    Green: 0.3232, 0.5419
    Blue : 0.1572, 0.1445
    White: 0.3134, 0.3291
  Established Timings I & II: none
  Standard Timings: none
  Detailed Timing Descriptors:
    DTD 1:  1366x768    60.067936 Hz 683:384   48.235 kHz     76.500000 MHz (256 mm x 144 mm)
                 Hfront   56 Hsync  40 Hback  124 Hpol P
                 Vfront    7 Vsync   8 Vback   20 Vpol N
    Empty Descriptor
    Alphanumeric Data String: 'LG Display'
    Display Product Name: 'LP116WH1-TLA1'
Checksum: 0x4e

----------------

Failures:

Block 0, Base EDID:
  Empty Descriptor: Use Dummy Descriptor instead of all zeroes.
  Missing Display Range Limits Descriptor.

EDID conformity: FAIL
