
EDID (hex):
00ffffffffffff0005e302271b0d0000
2d1e0103803c22782adad5ad5048a625
125054bfef00d1c081803168317c4568
457c6168617c565e00a0a0a029503020
350055502100001e40e7006aa0a06750
0820980455502100001a000000fc0051
323747325747340a20202020000000fd
0030901ee63c000a20202020202001fa
020330f14c101f051404130312021101
3f230907078301000065030c00200067
d85dc401788000681a000001013090e6
6fc200a0a0a055503020350055502100
001e5aa000a0a0a04650302035005550
2100001e023a801871382d40582c4500
55502100001ef03c00d051a035506088
3a0055502100001c00000000000000ed

Extracted contents:
header:          00 ff ff ff ff ff ff 00
serial number:   05 e3 02 27 1b 0d 00 00 2d 1e
version:         01 03
basic params:    80 3c 22 78 2a
chroma info:     da d5 ad 50 48 a6 25 12 50 54
established:     bf ef 00
standard:        d1 c0 81 80 31 68 31 7c 45 68 45 7c 61 68 61 7c
descriptor 1:    56 5e 00 a0 a0 a0 29 50 30 20 35 00 55 50 21 00 00 1e
descriptor 2:    40 e7 00 6a a0 a0 67 50 08 20 98 04 55 50 21 00 00 1a
descriptor 3:    00 00 00 fc 00 51 32 37 47 32 57 47 34 0a 20 20 20 20
descriptor 4:    00 00 00 fd 00 30 90 1e e6 3c 00 0a 20 20 20 20 20 20
extensions:      01
checksum:        fa

EDID version: 1.3
Manufacturer: AOC Model 2702 Serial Number --
Made in week 45 of 2020
Digital display
Maximum image size: 60 cm x 34 cm
Gamma: 2.20
DPMS levels: Off
RGB color display
First detailed timing is preferred timing
Display x,y Chromaticity:
  Red:   0.6787, 0.3134
  Green: 0.2832, 0.6503
  Blue:  0.1474, 0.0712
  White: 0.3134, 0.3291
Established timings supported:
  720x400@70Hz 9:5 HorFreq: 31469 Hz Clock: 28.320 MHz
  640x480@60Hz 4:3 HorFreq: 31469 Hz Clock: 25.175 MHz
  640x480@67Hz 4:3 HorFreq: 35000 Hz Clock: 30.240 MHz
  640x480@72Hz 4:3 HorFreq: 37900 Hz Clock: 31.500 MHz
  640x480@75Hz 4:3 HorFreq: 37500 Hz Clock: 31.500 MHz
  800x600@56Hz 4:3 HorFreq: 35200 Hz Clock: 36.000 MHz
  800x600@60Hz 4:3 HorFreq: 37900 Hz Clock: 40.000 MHz
  800x600@72Hz 4:3 HorFreq: 48100 Hz Clock: 50.000 MHz
  800x600@75Hz 4:3 HorFreq: 46900 Hz Clock: 49.500 MHz
  832x624@75Hz 4:3 HorFreq: 49726 Hz Clock: 57.284 MHz
  1024x768@60Hz 4:3 HorFreq: 48400 Hz Clock: 65.000 MHz
  1024x768@70Hz 4:3 HorFreq: 56500 Hz Clock: 75.000 MHz
  1024x768@75Hz 4:3 HorFreq: 60000 Hz Clock: 78.750 MHz
  1280x1024@75Hz 5:4 HorFreq: 80000 Hz Clock: 135.000 MHz
Standard timings supported:
  1920x1080@60Hz 16:9
  1280x1024@60Hz 5:4 HorFreq: 64000 Hz Clock: 108.000 MHz
  640x480@100Hz 4:3
  640x480@120Hz 4:3
  800x600@100Hz 4:3
  800x600@120Hz 4:3
  1024x768@100Hz 4:3
  1024x768@120Hz 4:3
Detailed mode: Clock 241.500 MHz, 597 mm x 336 mm
               2560 2608 2640 2720 hborder 0
               1440 1443 1448 1481 vborder 0
               +hsync +vsync 
               VertFreq: 59 Hz, HorFreq: 88786 Hz
Detailed mode: Clock 592.000 MHz, 597 mm x 336 mm
               2560 2568 2600 2666 hborder 0
               1440 1465 1473 1543 vborder 0
               +hsync -vsync 
               VertFreq: 143 Hz, HorFreq: 222055 Hz
Monitor name: Q27G2WG4
Monitor ranges (GTF): 48-144Hz V, 30-230kHz H, max dotclock 600MHz
Has 1 extension blocks
Checksum: 0xfa (valid)

CTA extension block
Extension version: 3
44 bytes of CTA data
  Video data block
    VIC  16 1920x1080@60Hz 16:9  HorFreq: 67500 Hz Clock: 148.500 MHz
    VIC  31 1920x1080@50Hz 16:9  HorFreq: 56250 Hz Clock: 148.500 MHz
    VIC   5 1920x1080i@60Hz 16:9  HorFreq: 33750 Hz Clock: 74.250 MHz
    VIC  20 1920x1080i@50Hz 16:9  HorFreq: 28125 Hz Clock: 74.250 MHz
    VIC   4 1280x720@60Hz 16:9  HorFreq: 45000 Hz Clock: 74.250 MHz
    VIC  19 1280x720@50Hz 16:9  HorFreq: 37500 Hz Clock: 74.250 MHz
    VIC   3 720x480@60Hz 16:9  HorFreq: 31469 Hz Clock: 27.000 MHz
    VIC  18 720x576@50Hz 16:9  HorFreq: 31250 Hz Clock: 27.000 MHz
    VIC   2 720x480@60Hz 4:3  HorFreq: 31469 Hz Clock: 27.000 MHz
    VIC  17 720x576@50Hz 4:3  HorFreq: 31250 Hz Clock: 27.000 MHz
    VIC   1 640x480@60Hz 4:3  HorFreq: 31469 Hz Clock: 25.175 MHz
    VIC  63 1920x1080@120Hz 16:9  HorFreq: 135000 Hz Clock: 297.000 MHz
  Audio data block
    Linear PCM, max channels 2
      Supported sample rates (kHz): 48 44.1 32
      Supported sample sizes (bits): 24 20 16
  Speaker allocation data block
    Speaker map:
      FL/FR - Front Left/Right
  Vendor-specific data block, OUI 000c03 (HDMI)
    Source physical address 2.0.0.0
  Vendor-specific data block, OUI c45dd8 (HDMI Forum)
    Version: 1
    Maximum TMDS Character Rate: 600MHz
    SCDC Present
  Vendor-specific data block, OUI 00001a
Underscans PC formats by default
Basic audio support
Supports YCbCr 4:4:4
Supports YCbCr 4:2:2
1 native detailed modes
Detailed mode: Clock 497.750 MHz, 597 mm x 336 mm
               2560 2608 2640 2720 hborder 0
               1440 1443 1448 1525 vborder 0
               +hsync +vsync 
               VertFreq: 119 Hz, HorFreq: 182996 Hz
Detailed mode: Clock 410.500 MHz, 597 mm x 336 mm
               2560 2608 2640 2720 hborder 0
               1440 1443 1448 1510 vborder 0
               +hsync +vsync 
               VertFreq: 99 Hz, HorFreq: 150919 Hz
Detailed mode: Clock 148.500 MHz, 597 mm x 336 mm
               1920 2008 2052 2200 hborder 0
               1080 1084 1089 1125 vborder 0
               +hsync +vsync 
               VertFreq: 60 Hz, HorFreq: 67500 Hz
Detailed mode: Clock 156.000 MHz, 597 mm x 336 mm
               1280 1376 1512 1744 hborder 0
               1440 1443 1453 1493 vborder 0
               -hsync +vsync 
               VertFreq: 59 Hz, HorFreq: 89449 Hz
Checksum: 0xed (valid)

One or more of the timings is out of range of the Monitor Ranges:
  Vertical Freq: 50 - 143 Hz
  Horizontal Freq: 28125 - 222055 Hz
  Maximum Clock: 592.000 MHz
