edid-decode (hex):

00 ff ff ff ff ff ff 00 05 e3 02 27 a3 a8 01 00
12 1e 01 04 a5 3c 22 78 3b da d5 ad 50 48 a6 25
12 50 54 bf ef 00 d1 c0 81 80 31 68 31 7c 45 68
45 7c 61 68 61 7c 56 5e 00 a0 a0 a0 29 50 30 20
35 00 55 50 21 00 00 1e 40 e7 00 6a a0 a0 67 50
08 20 98 04 55 50 21 00 00 1a 00 00 00 fc 00 51
32 37 47 32 57 47 34 0a 20 20 20 20 00 00 00 fd
00 30 90 e6 e6 3c 01 0a 20 20 20 20 20 20 01 f1

----------------

Block 0, Base EDID:
  EDID Structure Version & Revision: 1.4
  Vendor & Product Identification:
    Manufacturer: AOC
    Model: 9986
    Serial Number: ...
    Made in: week 18 of 2020
  Basic Display Parameters & Features:
    Digital display
    Bits per primary color channel: 8
    DisplayPort interface
    Maximum image size: 60 cm x 34 cm
    Gamma: 2.20
    DPMS levels: Off
    Supported color formats: RGB 4:4:4, YCrCb 4:4:4, YCrCb 4:2:2
    First detailed timing includes the native pixel format and preferred refresh rate
    Display is continuous frequency
  Color Characteristics:
    Red  : 0.6787, 0.3134
    Green: 0.2832, 0.6503
    Blue : 0.1474, 0.0712
    White: 0.3134, 0.3291
  Established Timings I & II:
    IBM     :   720x400    70.082 Hz   9:5    31.467 kHz  28.320 MHz
    DMT 0x04:   640x480    59.940 Hz   4:3    31.469 kHz  25.175 MHz
    Apple   :   640x480    66.667 Hz   4:3    35.000 kHz  30.240 MHz
    DMT 0x05:   640x480    72.809 Hz   4:3    37.861 kHz  31.500 MHz
    DMT 0x06:   640x480    75.000 Hz   4:3    37.500 kHz  31.500 MHz
    DMT 0x08:   800x600    56.250 Hz   4:3    35.156 kHz  36.000 MHz
    DMT 0x09:   800x600    60.317 Hz   4:3    37.879 kHz  40.000 MHz
    DMT 0x0a:   800x600    72.188 Hz   4:3    48.077 kHz  50.000 MHz
    DMT 0x0b:   800x600    75.000 Hz   4:3    46.875 kHz  49.500 MHz
    Apple   :   832x624    74.551 Hz   4:3    49.726 kHz  57.284 MHz
    DMT 0x10:  1024x768    60.004 Hz   4:3    48.363 kHz  65.000 MHz
    DMT 0x11:  1024x768    70.069 Hz   4:3    56.476 kHz  75.000 MHz
    DMT 0x12:  1024x768    75.029 Hz   4:3    60.023 kHz  78.750 MHz
    DMT 0x24:  1280x1024   75.025 Hz   5:4    79.976 kHz 135.000 MHz
  Standard Timings:
    DMT 0x52:  1920x1080   60.000 Hz  16:9    67.500 kHz 148.500 MHz
    DMT 0x23:  1280x1024   60.020 Hz   5:4    63.981 kHz 108.000 MHz
    CVT     :   640x480    99.769 Hz   4:3    51.082 kHz  42.500 MHz (EDID 1.4 source)
    GTF     :   640x480   100.000 Hz   4:3    50.900 kHz  43.163 MHz (EDID 1.3 source)
    CVT     :   640x480   119.518 Hz   4:3    61.910 kHz  52.500 MHz (EDID 1.4 source)
    GTF     :   640x480   119.999 Hz   4:3    61.800 kHz  52.406 MHz (EDID 1.3 source)
    CVT     :   800x600    99.662 Hz   4:3    63.684 kHz  67.250 MHz (EDID 1.4 source)
    GTF     :   800x600   100.000 Hz   4:3    63.600 kHz  68.179 MHz (EDID 1.3 source)
    CVT     :   800x600   119.854 Hz   4:3    77.425 kHz  83.000 MHz (EDID 1.4 source)
    GTF     :   800x600   120.000 Hz   4:3    77.160 kHz  83.950 MHz (EDID 1.3 source)
    CVT     :  1024x768    99.972 Hz   4:3    81.577 kHz 112.250 MHz (EDID 1.4 source)
    GTF     :  1024x768   100.000 Hz   4:3    81.400 kHz 113.309 MHz (EDID 1.3 source)
    CVT     :  1024x768   119.804 Hz   4:3    98.958 kHz 137.750 MHz (EDID 1.4 source)
    GTF     :  1024x768   120.000 Hz   4:3    98.760 kHz 139.054 MHz (EDID 1.3 source)
  Detailed Timing Descriptors:
    DTD 1:  2560x1440   59.951 Hz  16:9    88.787 kHz 241.500 MHz (597 mm x 336 mm)
                 Hfront   48 Hsync  32 Hback  80 Hpol P
                 Vfront    3 Vsync   5 Vback  33 Vpol P
    DTD 2:  2560x1440  143.912 Hz  16:9   222.056 kHz 592.000 MHz (597 mm x 336 mm)
                 Hfront    8 Hsync  32 Hback  66 Hpol P
                 Vfront   25 Vsync   8 Vback  70 Vpol N
    Display Product Name: 'Q27G2WG4'
  Display Range Limits:
    Monitor ranges (Bare Limits): 48-144 Hz V, 230-230 kHz H, max dotclock 600 MHz
  Extension blocks: 1
Checksum: 0xf1

----------------

Warnings:

EDID:
  Base EDID: Some timings are out of range of the Monitor Ranges:
    Horizontal Freq: 31.466 - 222.055 kHz (Monitor: 230.000 - 230.000 kHz)

Failures:

Block 0, Base EDID:
  Base EDID: EDID specified 1 extension block(s), but found 0 extension block(s).
EDID:
  Base EDID: GTF timings are used, but the EDID does not signal GTF support.
  Base EDID: CVT timings are used, but the EDID does not signal CVT support.

EDID conformity: FAIL
