
EDID (hex):
00ffffffffffff00061041a000000000
071c0104b51d127802ef91a3544e9f26
0f505400000001010101010101010101
010101010101d9650050a0402e600820
08081eb31000001a000000fc00436f6c
6f72204c43440a202020000000100000
00000000000000000000000000000010
00000000000000000000000000000194
70127903007f813ffa10000301180f28
17000000000000000000000000000000
4c503133335751362d534a41320a2000
474d47303031353031554a4c4d343341
380a20202020207f8129fa1000020100
11000002f1043605d908080af00ecd13
ed1ab523aa2f773efb53596e0a90f5be
90f98c00000000000000000000005590

edid-decode (hex):

00 ff ff ff ff ff ff 00 06 10 41 a0 00 00 00 00
07 1c 01 04 b5 1d 12 78 02 ef 91 a3 54 4e 9f 26
0f 50 54 00 00 00 01 01 01 01 01 01 01 01 01 01
01 01 01 01 01 01 d9 65 00 50 a0 40 2e 60 08 20
08 08 1e b3 10 00 00 1a 00 00 00 fc 00 43 6f 6c
6f 72 20 4c 43 44 0a 20 20 20 00 00 00 10 00 00
00 00 00 00 00 00 00 00 00 00 00 00 00 00 00 10
00 00 00 00 00 00 00 00 00 00 00 00 00 00 01 94

70 12 79 03 00 7f 81 3f fa 10 00 03 01 18 0f 28
17 00 00 00 00 00 00 00 00 00 00 00 00 00 00 00
4c 50 31 33 33 57 51 36 2d 53 4a 41 32 0a 20 00
47 4d 47 30 30 31 35 30 31 55 4a 4c 4d 34 33 41
38 0a 20 20 20 20 20 7f 81 29 fa 10 00 02 01 00
11 00 00 02 f1 04 36 05 d9 08 08 0a f0 0e cd 13
ed 1a b5 23 aa 2f 77 3e fb 53 59 6e 0a 90 f5 be
90 f9 8c 00 00 00 00 00 00 00 00 00 00 00 55 90

----------------

Block 0, Base EDID:
  EDID Structure Version & Revision: 1.4
  Vendor & Product Identification:
    Manufacturer: APP
    Model: 41025
    Made in: week 7 of 2018
  Basic Display Parameters & Features:
    Digital display
    Bits per primary color channel: 10
    DisplayPort interface
    Maximum image size: 29 cm x 18 cm
    Gamma: 2.20
    Supported color formats: RGB 4:4:4
    First detailed timing includes the native pixel format and preferred refresh rate
  Color Characteristics:
    Red  : 0.6396, 0.3300
    Green: 0.3076, 0.6240
    Blue : 0.1503, 0.0595
    White: 0.3125, 0.3291
  Established Timings I & II: none
  Standard Timings: none
  Detailed Timing Descriptors:
    DTD 1:  2560x1600   60.000828 Hz  16:10    98.761 kHz    260.730000 MHz (286 mm x 179 mm)
                 Hfront    8 Hsync  32 Hback   40 Hpol P
                 Vfront   32 Vsync   8 Vback    6 Vpol N
    Display Product Name: 'Color LCD'
    Dummy Descriptor:
    Dummy Descriptor:
  Extension blocks: 1
Checksum: 0x94

----------------

Block 1, DisplayID Extension Block:
  Version: 1.2
  Extension Count: 0
  Display Product Type: Standalone display device
  Vendor-Specific Data Block (0x7f) (Apple), OUI 00-10-FA:
    Type: 3, Version: 1
    18 0f 28 17 00 00 00 00 00 00 00 00 00 00 00 00 '..(.............'
    00 00 00 4c 50 31 33 33 57 51 36 2d 53 4a 41 32 '...LP133WQ6-SJA2'
    0a 20 00 47 4d 47 30 30 31 35 30 31 55 4a 4c 4d '. .GMG001501UJLM'
    34 33 41 38 0a 20 20 20 20 20                   '43A8.     '
  Vendor-Specific Data Block (0x7f) (Apple), OUI 00-10-FA:
    Type: 2, Version: 1
    00 11 00 00 02 f1 04 36 05 d9 08 08 0a f0 0e cd '.......6........'
    13 ed 1a b5 23 aa 2f 77 3e fb 53 59 6e 0a 90 f5 '....#./w>.SYn...'
    be 90 f9 8c                                     '....'
  Checksum: 0x55
Checksum: 0x90
