edid-decode (hex):

00 ff ff ff ff ff ff 00 4c 2d ea 04 32 32 4d 43
0a 13 01 03 80 30 1e 78 2a 78 f1 a6 55 48 9b 26
12 50 54 00 00 00 01 01 01 01 01 01 01 01 01 01
01 01 01 01 01 01 7c 2e 90 a0 60 1a 1e 40 30 20
36 00 de 2c 11 00 00 1a 00 00 00 fd 00 38 7d 1e
be 21 00 0a 20 20 20 20 20 20 00 00 00 fc 00 53
79 6e 63 4d 61 73 74 65 72 0a 20 20 00 00 00 ff
00 48 56 4d 53 33 30 30 32 35 31 0a 20 20 01 ff

02 01 04 00 26 5d 90 a0 60 1a 1e 40 30 20 36 00
de 28 11 00 00 1e 63 55 90 a0 60 1a 1e 40 30 20
36 00 de 28 11 00 00 1e a0 4d 90 a0 60 1a 1e 40
30 20 36 00 de 28 11 00 00 1e 00 00 00 00 00 00
00 00 00 00 00 00 00 00 00 00 00 00 00 00 00 00
00 00 00 00 00 00 00 00 00 00 00 00 00 00 00 00
00 00 00 00 00 00 00 00 00 00 00 00 00 00 00 00
00 00 00 00 00 00 00 00 00 00 00 00 00 00 00 88

00 ff ff ff ff ff ff 00 4c 2d ea 04 32 32 4d 43
0a 13 01 03 80 30 1e 78 2a 78 f1 a6 55 48 9b 26
12 50 54 00 00 00 01 01 01 01 01 01 01 01 01 01
01 01 01 01 01 01 7c 2e 90 a0 60 1a 1e 40 30 20
36 00 de 2c 11 00 00 1a 00 00 00 fd 00 38 7d 1e
be 21 00 0a 20 20 20 20 20 20 00 00 00 fc 00 53
79 6e 63 4d 61 73 74 65 72 0a 20 20 00 00 00 ff
00 48 56 4d 53 33 30 30 32 35 31 0a 20 20 01 ff

02 01 04 00 26 5d 90 a0 60 1a 1e 40 30 20 36 00
de 28 11 00 00 1e 63 55 90 a0 60 1a 1e 40 30 20
36 00 de 28 11 00 00 1e a0 4d 90 a0 60 1a 1e 40
30 20 36 00 de 28 11 00 00 1e 00 00 00 00 00 00
00 00 00 00 00 00 00 00 00 00 00 00 00 00 00 00
00 00 00 00 00 00 00 00 00 00 00 00 00 00 00 00
00 00 00 00 00 00 00 00 00 00 00 00 00 00 00 00
00 00 00 00 00 00 00 00 00 00 00 00 00 00 00 88

----------------

Block 0, Base EDID:
  EDID Structure Version & Revision: 1.3
  Vendor & Product Identification:
    Manufacturer: SAM
    Model: 1258
    Serial Number: ...
    Made in: week 10 of 2009
  Basic Display Parameters & Features:
    Digital display
    Maximum image size: 48 cm x 30 cm
    Gamma: 2.20
    DPMS levels: Off
    RGB color display
    First detailed timing is the preferred timing
  Color Characteristics:
    Red  : 0.6494, 0.3349
    Green: 0.2832, 0.6054
    Blue : 0.1513, 0.0732
    White: 0.3125, 0.3291
  Established Timings I & II: none
  Standard Timings: none
  Detailed Timing Descriptors:
    DTD 1:  1680x1050   59.883253 Hz  16:10    64.674 kHz    119.000000 MHz (478 mm x 300 mm)
                 Hfront   48 Hsync  32 Hback   80 Hpol P
                 Vfront    3 Vsync   6 Vback   21 Vpol N
    Display Range Limits:
      Monitor ranges (GTF): 56-125 Hz V, 30-190 kHz H, max dotclock 330 MHz
    Display Product Name: 'SyncMaster'
    Display Product Serial Number: ...
  Extension blocks: 1
Checksum: 0xff

----------------

Block 1, CTA-861 Extension Block:
  Revision: 1
  Detailed Timing Descriptors:
    DTD 2:  1680x1050  119.997987 Hz  16:10   129.598 kHz    238.460000 MHz (478 mm x 296 mm)
                 Hfront   48 Hsync  32 Hback   80 Hpol P
                 Vfront    3 Vsync   6 Vback   21 Vpol P
    DTD 3:  1680x1050  109.998994 Hz  16:10   118.799 kHz    218.590000 MHz (478 mm x 296 mm)
                 Hfront   48 Hsync  32 Hback   80 Hpol P
                 Vfront    3 Vsync   6 Vback   21 Vpol P
    DTD 4:  1680x1050  100.000000 Hz  16:10   108.000 kHz    198.720000 MHz (478 mm x 296 mm)
                 Hfront   48 Hsync  32 Hback   80 Hpol P
                 Vfront    3 Vsync   6 Vback   21 Vpol P
Checksum: 0x88  Unused space in Extension Block: 69 bytes

----------------

Block 2, Unknown EDID Extension Block 0x00:
  00 ff ff ff ff ff ff 00 4c 2d ea 04 32 32 4d 43 '........L-..22MC'
  0a 13 01 03 80 30 1e 78 2a 78 f1 a6 55 48 9b 26 '.....0.x*x..UH.&'
  12 50 54 00 00 00 01 01 01 01 01 01 01 01 01 01 '.PT.............'
  01 01 01 01 01 01 7c 2e 90 a0 60 1a 1e 40 30 20 '......|...`..@0 '
  36 00 de 2c 11 00 00 1a 00 00 00 fd 00 38 7d 1e '6..,.........8}.'
  be 21 00 0a 20 20 20 20 20 20 00 00 00 fc 00 53 '.!..      .....S'
  79 6e 63 4d 61 73 74 65 72 0a 20 20 00 00 00 ff 'yncMaster.  ....'
  00 48 56 4d 53 33 30 30 32 35 31 0a 20 20 01 ff '.HVMS300251.  ..'
Checksum: 0xff

----------------

Block 3, CTA-861 Extension Block:
  Revision: 1
  Detailed Timing Descriptors:
    DTD 5:  1680x1050  119.997987 Hz  16:10   129.598 kHz    238.460000 MHz (478 mm x 296 mm)
                 Hfront   48 Hsync  32 Hback   80 Hpol P
                 Vfront    3 Vsync   6 Vback   21 Vpol P
    DTD 6:  1680x1050  109.998994 Hz  16:10   118.799 kHz    218.590000 MHz (478 mm x 296 mm)
                 Hfront   48 Hsync  32 Hback   80 Hpol P
                 Vfront    3 Vsync   6 Vback   21 Vpol P
    DTD 7:  1680x1050  100.000000 Hz  16:10   108.000 kHz    198.720000 MHz (478 mm x 296 mm)
                 Hfront   48 Hsync  32 Hback   80 Hpol P
                 Vfront    3 Vsync   6 Vback   21 Vpol P
Checksum: 0x88  Unused space in Extension Block: 69 bytes

----------------

Warnings:

Block 1, CTA-861 Extension Block:
  Display Product Serial Number is set, so the Serial Number in the Base EDID should be 0.
  Add a Colorimetry Data Block with the sRGB colorimetry bit set to avoid interop issues.
Block 3, CTA-861 Extension Block:
  Display Product Serial Number is set, so the Serial Number in the Base EDID should be 0.
  Add a Colorimetry Data Block with the sRGB colorimetry bit set to avoid interop issues.

Failures:

Block 1, CTA-861 Extension Block:
  Required 640x480p60 timings are missing in the established timings and the SVD list (VIC 1).
  Missing VCDB, needed for Set Selectable RGB Quantization to avoid interop issues.
Block 2, Base EDID:
  Unknown Extension Block.
Block 3, CTA-861 Extension Block:
  Required 640x480p60 timings are missing in the established timings and the SVD list (VIC 1).
  Missing VCDB, needed for Set Selectable RGB Quantization to avoid interop issues.
EDID:
  Base EDID: EDID specified 1 extension block(s), but found 3 extension block(s).
  Base EDID: EDID 1.3 requires a Block Map Extension in Block 1 if there are more than 2 blocks in the EDID.

EDID conformity: FAIL
