
EDID (hex):
00ffffffffffff004c2dea0432324d43
1314010380301e782a78f1a655489b26
12505400000001010101010101010101
0101010101017c2e90a0601a1e403020
3600de2c1100001a000000fd00387d1e
be21000a202020202020000000fc0053
796e634d61737465720a2020000000ff
0048564d5a3530313533340a202001e7
02010400265d90a0601a1e4030203600
de281100001e635590a0601a1e403020
3600de281100001ea04d90a0601a1e40
30203600de281100001e000000000000
00000000000000000000000000000000
00000000000000000000000000000000
00000000000000000000000000000000
00000000000000000000000000000088

Extracted contents:
header:          00 ff ff ff ff ff ff 00
serial number:   4c 2d ea 04 32 32 4d 43 13 14
version:         01 03
basic params:    80 30 1e 78 2a
chroma info:     78 f1 a6 55 48 9b 26 12 50 54
established:     00 00 00
standard:        01 01 01 01 01 01 01 01 01 01 01 01 01 01 01 01
descriptor 1:    7c 2e 90 a0 60 1a 1e 40 30 20 36 00 de 2c 11 00 00 1a
descriptor 2:    00 00 00 fd 00 38 7d 1e be 21 00 0a 20 20 20 20 20 20
descriptor 3:    00 00 00 fc 00 53 79 6e 63 4d 61 73 74 65 72 0a 20 20
descriptor 4:    00 00 00 ff 00 48 56 4d 5a 35 30 31 35 33 34 0a 20 20
extensions:      01
checksum:        e7

EDID version: 1.3
Manufacturer: SAM Model 4ea Serial Number --
Made in week 19 of 2010
Digital display
Maximum image size: 48 cm x 30 cm
Gamma: 2.20
DPMS levels: Off
RGB color display
First detailed timing is preferred timing
Display x,y Chromaticity:
  Red:   0.6494, 0.3349
  Green: 0.2832, 0.6054
  Blue:  0.1513, 0.0732
  White: 0.3125, 0.3291
Established timings supported:
Standard timings supported:
Detailed mode: Clock 119.000 MHz, 478 mm x 300 mm
               1680 1728 1760 1840 hborder 0
               1050 1053 1059 1080 vborder 0
               +hsync -vsync 
               VertFreq: 59 Hz, HorFreq: 64673 Hz
Monitor ranges (GTF): 56-125Hz V, 30-190kHz H, max dotclock 330MHz
Monitor name: SyncMaster
Serial number: --
Has 1 extension blocks
Checksum: 0xe7 (valid)

CTA extension block
Extension version: 1
0 8-byte timing descriptors
Detailed mode: Clock 238.460 MHz, 478 mm x 296 mm
               1680 1728 1760 1840 hborder 0
               1050 1053 1059 1080 vborder 0
               +hsync +vsync 
               VertFreq: 119 Hz, HorFreq: 129597 Hz
Detailed mode: Clock 218.590 MHz, 478 mm x 296 mm
               1680 1728 1760 1840 hborder 0
               1050 1053 1059 1080 vborder 0
               +hsync +vsync 
               VertFreq: 109 Hz, HorFreq: 118798 Hz
Detailed mode: Clock 198.720 MHz, 478 mm x 296 mm
               1680 1728 1760 1840 hborder 0
               1050 1053 1059 1080 vborder 0
               +hsync +vsync 
               VertFreq: 100 Hz, HorFreq: 108000 Hz
Checksum: 0x88 (valid)

EDID block does NOT conform to EDID 1.3!
	Required 640x480p60 timings are missing in the established timings
	and/or in the SVD list (VIC 1)
EDID block does not conform at all!
	Both the serial number and the serial string are set
