edid-decode (hex):

00 ff ff ff ff ff ff 00 09 d1 86 78 45 54 00 00
2a 15 01 03 0e 30 1b 78 2e 14 21 a3 59 55 9b 26
0f 50 54 a5 6b 80 61 c0 81 00 81 c0 81 40 81 80
a9 c0 b3 00 d1 c0 02 3a 80 18 71 38 2d 40 58 2c
45 00 dd 0c 11 00 00 1e 00 00 00 ff 00 4d 41 42
30 32 39 30 39 30 31 39 0a 20 00 00 00 fd 00 32
4c 1e 53 15 0a 20 00 00 00 00 00 00 00 00 00 fc
00 42 65 6e 51 20 47 4c 32 32 34 30 0a 20 00 e3

00 ff ff ff ff ff ff 00 09 d1 86 78 45 54 00 00
2a 15 01 03 0e 30 1b 78 2e 14 21 a3 59 55 9b 26
0f 50 54 a5 6b 80 61 c0 81 00 81 c0 81 40 81 80
a9 c0 b3 00 d1 c0 02 3a 80 18 71 38 2d 40 58 2c
45 00 dd 0c 11 00 00 1e 00 00 00 ff 00 4d 41 42
30 32 39 30 39 30 31 39 0a 20 00 00 00 fd 00 32
4c 1e 53 15 0a 20 00 00 00 00 00 00 00 00 00 fc
00 42 65 6e 51 20 47 4c 32 32 34 30 0a 20 00 e3

----------------

Block 0, Base EDID:
  EDID Structure Version & Revision: 1.3
  Vendor & Product Identification:
    Manufacturer: BNQ
    Model: 30854
    Serial Number: ...
    Made in: week 42 of 2011
  Basic Display Parameters & Features:
    Analog display
    Signal Level Standard: 0.700 : 0.300 : 1.000 V p-p
    Blank level equals black level
    Sync: Separate Composite SyncOnGreen
    Maximum image size: 48 cm x 27 cm
    Gamma: 2.20
    DPMS levels: Off
    RGB color display
    Default (sRGB) color space is primary color space
    First detailed timing is the preferred timing
  Color Characteristics:
    Red  : 0.6367, 0.3486
    Green: 0.3330, 0.6054
    Blue : 0.1484, 0.0605
    White: 0.3125, 0.3291
  Established Timings I & II:
    IBM     :   720x400    70.081663 Hz   9:5     31.467 kHz     28.320000 MHz
    DMT 0x04:   640x480    59.940476 Hz   4:3     31.469 kHz     25.175000 MHz
    DMT 0x06:   640x480    75.000000 Hz   4:3     37.500 kHz     31.500000 MHz
    DMT 0x09:   800x600    60.316541 Hz   4:3     37.879 kHz     40.000000 MHz
    DMT 0x0b:   800x600    75.000000 Hz   4:3     46.875 kHz     49.500000 MHz
    Apple   :   832x624    74.551266 Hz   4:3     49.726 kHz     57.284000 MHz
    DMT 0x10:  1024x768    60.003840 Hz   4:3     48.363 kHz     65.000000 MHz
    DMT 0x12:  1024x768    75.028582 Hz   4:3     60.023 kHz     78.750000 MHz
    DMT 0x24:  1280x1024   75.024675 Hz   5:4     79.976 kHz    135.000000 MHz
    Apple   :  1152x870    75.061550 Hz 192:145   68.681 kHz    100.000000 MHz
  Standard Timings:
    GTF     :  1024x576    60.000204 Hz  16:9     35.820 kHz     46.996000 MHz
    DMT 0x1c:  1280x800    59.810326 Hz  16:10    49.702 kHz     83.500000 MHz
    DMT 0x55:  1280x720    60.000000 Hz  16:9     45.000 kHz     74.250000 MHz
    DMT 0x20:  1280x960    60.000000 Hz   4:3     60.000 kHz    108.000000 MHz
    DMT 0x23:  1280x1024   60.019740 Hz   5:4     63.981 kHz    108.000000 MHz
    DMT 0x53:  1600x900    60.000000 Hz  16:9     60.000 kHz    108.000000 MHz (RB)
    DMT 0x3a:  1680x1050   59.954250 Hz  16:10    65.290 kHz    146.250000 MHz
    DMT 0x52:  1920x1080   60.000000 Hz  16:9     67.500 kHz    148.500000 MHz
  Detailed Timing Descriptors:
    DTD 1:  1920x1080   60.000000 Hz  16:9     67.500 kHz    148.500000 MHz (477 mm x 268 mm)
                 Hfront   88 Hsync  44 Hback  148 Hpol P
                 Vfront    4 Vsync   5 Vback   36 Vpol P
    Display Product Serial Number: ...
    Display Range Limits:
      Monitor ranges (Unknown (0x0a)): 50-76 Hz V, 30-83 kHz H, max dotclock 210 MHz
    Display Product Name: 'BenQ GL2240'
Checksum: 0xe3

----------------

Block 1, Unknown EDID Extension Block 0x00:
  00 ff ff ff ff ff ff 00 09 d1 86 78 45 54 00 00 '...........xET..'
  2a 15 01 03 0e 30 1b 78 2e 14 21 a3 59 55 9b 26 '*....0.x..!.YU.&'
  0f 50 54 a5 6b 80 61 c0 81 00 81 c0 81 40 81 80 '.PT.k.a......@..'
  a9 c0 b3 00 d1 c0 02 3a 80 18 71 38 2d 40 58 2c '.......:..q8-@X,'
  45 00 dd 0c 11 00 00 1e 00 00 00 ff 00 4d 41 42 'E............MAB'
  30 32 39 30 39 30 31 39 0a 20 00 00 00 fd 00 32 '02909019. .....2'
  4c 1e 53 15 0a 20 00 00 00 00 00 00 00 00 00 fc 'L.S.. ..........'
  00 42 65 6e 51 20 47 4c 32 32 34 30 0a 20 00 e3 '.BenQ GL2240. ..'
Checksum: 0xe3

----------------

Failures:

Block 0, Base EDID:
  Basic Display Parameters & Features: sRGB is signaled, but the chromaticities do not match.
  Display Range Limits: Unknown range class (0x0a).
  Display Range Limits: Byte 11 is 0x20 instead of 0x0a.
  Display Range Limits: Bytes 12-17 must be 0x20.
Block 1, Base EDID:
  Unknown Extension Block.
EDID:
  Base EDID: EDID specified 0 extension block(s), but found 1 extension block(s).

EDID conformity: FAIL
