edid-decode (hex):

00 ff ff ff ff ff ff 00 06 af d8 1b 00 00 00 00
00 17 01 04 a5 16 0e 78 02 98 25 99 58 54 8e 27
1e 50 54 00 00 00 01 01 01 01 01 01 01 01 01 01
01 01 01 01 01 01 8e 3a 80 90 70 b0 0a 40 2c 20
35 00 d8 88 00 00 00 18 09 27 80 90 70 b0 0a 40
2c 20 35 00 d8 88 00 00 00 18 00 00 00 00 00 00
00 00 00 00 00 00 00 00 00 00 00 00 00 00 00 02
00 01 26 ff 01 3c c8 16 08 1e c8 20 20 20 00 07

----------------

Block 0, Base EDID:
  EDID Structure Version & Revision: 1.4
  Vendor & Product Identification:
    Manufacturer: AUO
    Model: 7128
    Made in: 2013
  Basic Display Parameters & Features:
    Digital display
    Bits per primary color channel: 8
    DisplayPort interface
    Maximum image size: 22 cm x 14 cm
    Gamma: 2.20
    Supported color formats: RGB 4:4:4
    First detailed timing includes the native pixel format and preferred refresh rate
  Color Characteristics:
    Red  : 0.5996, 0.3447
    Green: 0.3300, 0.5546
    Blue : 0.1523, 0.1191
    White: 0.3134, 0.3291
  Established Timings I & II: none
  Standard Timings: none
  Detailed Timing Descriptors:
    DTD 1:  1920x1200   60.021462 Hz   8:5     72.626 kHz    149.900000 MHz (216 mm x 136 mm)
                 Hfront   44 Hsync  32 Hback   68 Hpol N
                 Vfront    3 Vsync   5 Vback    2 Vpol N
    DTD 2:  1920x1200   40.012973 Hz   8:5     48.416 kHz     99.930000 MHz (216 mm x 136 mm)
                 Hfront   44 Hsync  32 Hback   68 Hpol N
                 Vfront    3 Vsync   5 Vback    2 Vpol N
    Empty Descriptor
    Manufacturer-Specified Display Descriptor (0x02): 00 02 00 01 26 ff 01 3c c8 16 08 1e c8 20 20 20 '....&..<.....   '
Checksum: 0x07

----------------

Failures:

Block 0, Base EDID:
  Empty Descriptor: Use Dummy Descriptor instead of all zeroes.
  Missing Display Product Name.

EDID conformity: FAIL
