
EDID (hex):
00ffffffffffff0004727304c32c9153
27190104a53c22783ba595a65650a026
0d5054b7ef00714f95008180d1c00101
010101010101e8e40050a0a067500820
980455502100001e565e00a0a0a02950
3020350055502100001e000000fd0028
90dede3c010a202020202020000000fc
004163657220584632373048550a019a
02031c71491213041f900e0f1d1e2309
07078301000065030c001000909b0050
a0a046500820880c55502100001e011d
007251d01e206e28550055502100001e
011d00bc52d01e20b828554055502100
001e565e00a0a0a02950302035005550
2100001e87bc0050a0a0555008207800
55502100001e000000000000000000ff

Extracted contents:
header:          00 ff ff ff ff ff ff 00
serial number:   04 72 73 04 c3 2c 91 53 27 19
version:         01 04
basic params:    a5 3c 22 78 3b
chroma info:     a5 95 a6 56 50 a0 26 0d 50 54
established:     b7 ef 00
standard:        71 4f 95 00 81 80 d1 c0 01 01 01 01 01 01 01 01
descriptor 1:    e8 e4 00 50 a0 a0 67 50 08 20 98 04 55 50 21 00 00 1e
descriptor 2:    56 5e 00 a0 a0 a0 29 50 30 20 35 00 55 50 21 00 00 1e
descriptor 3:    00 00 00 fd 00 28 90 de de 3c 01 0a 20 20 20 20 20 20
descriptor 4:    00 00 00 fc 00 41 63 65 72 20 58 46 32 37 30 48 55 0a
extensions:      01
checksum:        9a

EDID version: 1.4
Manufacturer: ACR Model 473 Serial Number --
Made in week 39 of 2015
Digital display
8 bits per primary color channel
DisplayPort interface
Maximum image size: 60 cm x 34 cm
Gamma: 2.20
DPMS levels: Off
Supported color formats: RGB 4:4:4, YCrCb 4:4:4, YCrCb 4:2:2
First detailed timing includes the native pixel format and preferred refresh rate
Display is continuous frequency
Display x,y Chromaticity:
  Red:   0.6503, 0.3378
  Green: 0.3134, 0.6259
  Blue:  0.1503, 0.0517
  White: 0.3134, 0.3291
Established timings supported:
  720x400@70Hz 9:5 HorFreq: 31469 Hz Clock: 28.320 MHz
  640x480@60Hz 4:3 HorFreq: 31469 Hz Clock: 25.175 MHz
  640x480@67Hz 4:3 HorFreq: 35000 Hz Clock: 30.240 MHz
  640x480@75Hz 4:3 HorFreq: 37500 Hz Clock: 31.500 MHz
  800x600@56Hz 4:3 HorFreq: 35200 Hz Clock: 36.000 MHz
  800x600@60Hz 4:3 HorFreq: 37900 Hz Clock: 40.000 MHz
  800x600@72Hz 4:3 HorFreq: 48100 Hz Clock: 50.000 MHz
  800x600@75Hz 4:3 HorFreq: 46900 Hz Clock: 49.500 MHz
  832x624@75Hz 4:3 HorFreq: 49726 Hz Clock: 57.284 MHz
  1024x768@60Hz 4:3 HorFreq: 48400 Hz Clock: 65.000 MHz
  1024x768@70Hz 4:3 HorFreq: 56500 Hz Clock: 75.000 MHz
  1024x768@75Hz 4:3 HorFreq: 60000 Hz Clock: 78.750 MHz
  1280x1024@75Hz 5:4 HorFreq: 80000 Hz Clock: 135.000 MHz
Standard timings supported:
  1152x864@75Hz 4:3 HorFreq: 67500 Hz Clock: 108.000 MHz
  1440x900@60Hz 16:10 HorFreq: 55500 Hz Clock: 88.750 MHz
  1280x1024@60Hz 5:4 HorFreq: 64000 Hz Clock: 108.000 MHz
  1920x1080@60Hz 16:9
Detailed mode: Clock 586.000 MHz, 597 mm x 336 mm
               2560 2568 2600 2640 hborder 0
               1440 1465 1473 1543 vborder 0
               +hsync +vsync 
               VertFreq: 143 Hz, HorFreq: 221969 Hz
Detailed mode: Clock 241.500 MHz, 597 mm x 336 mm
               2560 2608 2640 2720 hborder 0
               1440 1443 1448 1481 vborder 0
               +hsync +vsync 
               VertFreq: 59 Hz, HorFreq: 88786 Hz
Monitor ranges (bare limits): 40-144Hz V, 222-222kHz H, max dotclock 600MHz
Monitor name: Acer XF270HU
Has 1 extension blocks
Checksum: 0x9a (valid)

CTA extension block
Extension version: 3
24 bytes of CTA data
  Video data block
    VIC  18 720x576@50Hz 16:9  HorFreq: 31250 Hz Clock: 27.000 MHz
    VIC  19 1280x720@50Hz 16:9  HorFreq: 37500 Hz Clock: 74.250 MHz
    VIC   4 1280x720@60Hz 16:9  HorFreq: 45000 Hz Clock: 74.250 MHz
    VIC  31 1920x1080@50Hz 16:9  HorFreq: 56250 Hz Clock: 148.500 MHz
    VIC  16 1920x1080@60Hz 16:9 (native) HorFreq: 67500 Hz Clock: 148.500 MHz
    VIC  14 1440x480@60Hz 4:3  HorFreq: 31469 Hz Clock: 54.000 MHz
    VIC  15 1440x480@60Hz 16:9  HorFreq: 31469 Hz Clock: 54.000 MHz
    VIC  29 1440x576@50Hz 4:3  HorFreq: 31250 Hz Clock: 54.000 MHz
    VIC  30 1440x576@50Hz 16:9  HorFreq: 31250 Hz Clock: 54.000 MHz
  Audio data block
    Linear PCM, max channels 2
      Supported sample rates (kHz): 48 44.1 32
      Supported sample sizes (bits): 24 20 16
  Speaker allocation data block
    Speaker map:
      FL/FR - Front Left/Right
  Vendor-specific data block, OUI 000c03 (HDMI)
    Source physical address 1.0.0.0
Basic audio support
Supports YCbCr 4:4:4
Supports YCbCr 4:2:2
1 native detailed modes
Detailed mode: Clock 398.240 MHz, 597 mm x 336 mm
               2560 2568 2600 2640 hborder 0
               1440 1496 1504 1510 vborder 0
               +hsync +vsync 
               VertFreq: 99 Hz, HorFreq: 150848 Hz
Detailed mode: Clock 74.250 MHz, 597 mm x 336 mm
               1280 1390 1430 1650 hborder 0
                720  725  730  750 vborder 0
               +hsync +vsync 
               VertFreq: 60 Hz, HorFreq: 45000 Hz
Detailed mode: Clock 74.250 MHz, 597 mm x 336 mm
               1280 1720 1760 1980 hborder 0
                720  725  730  750 vborder 0
               +hsync +vsync 
               VertFreq: 50 Hz, HorFreq: 37500 Hz
Detailed mode: Clock 241.500 MHz, 597 mm x 336 mm
               2560 2608 2640 2720 hborder 0
               1440 1443 1448 1481 vborder 0
               +hsync +vsync 
               VertFreq: 59 Hz, HorFreq: 88786 Hz
Detailed mode: Clock 482.630 MHz, 597 mm x 336 mm
               2560 2568 2600 2640 hborder 0
               1440 1447 1455 1525 vborder 0
               +hsync +vsync 
               VertFreq: 119 Hz, HorFreq: 182814 Hz
Checksum: 0xff (valid)

Warning: One or more of the timings is out of range of the Monitor Ranges:
  Vertical Freq: 50 - 143 Hz
  Horizontal Freq: 31250 - 221969 Hz
  Maximum Clock: 586.000 MHz
