
EDID (hex):
00ffffffffffff0006b3b1288f650000
0e1c0104b53e22783b08a5a2574fa228
0f5054bfef80d1c0814081809500b300
81c0810001014dd000a0f0703e803020
35006d552100001a04740030f2705a80
b0588a006d552100001a000000fd0028
3c86863c010a202020202020000000fc
00415355532056503238550a2020013e
02031c714f02030405900e0f1112131d
1e141f5f2309170783010000565e00a0
a0a02950302035006d552100001ee268
00a0a0402e60302036006d552100001a
d50980a0205e63103060b20c6d552100
001a0000000000000000000000000000
00000000000000000000000000000000
000000000000000000000000000000eb

Extracted contents:
header:          00 ff ff ff ff ff ff 00
serial number:   06 b3 b1 28 8f 65 00 00 0e 1c
version:         01 04
basic params:    b5 3e 22 78 3b
chroma info:     08 a5 a2 57 4f a2 28 0f 50 54
established:     bf ef 80
standard:        d1 c0 81 40 81 80 95 00 b3 00 81 c0 81 00 01 01
descriptor 1:    4d d0 00 a0 f0 70 3e 80 30 20 35 00 6d 55 21 00 00 1a
descriptor 2:    04 74 00 30 f2 70 5a 80 b0 58 8a 00 6d 55 21 00 00 1a
descriptor 3:    00 00 00 fd 00 28 3c 86 86 3c 01 0a 20 20 20 20 20 20
descriptor 4:    00 00 00 fc 00 41 53 55 53 20 56 50 32 38 55 0a 20 20
extensions:      01
checksum:        3e

EDID version: 1.4
Manufacturer: AUS Model 28b1 Serial Number --
Made in week 14 of 2018
Digital display
10 bits per primary color channel
DisplayPort interface
Maximum image size: 62 cm x 34 cm
Gamma: 2.20
DPMS levels: Off
Supported color formats: RGB 4:4:4, YCrCb 4:4:4, YCrCb 4:2:2
First detailed timing includes the native pixel format and preferred refresh rate
Display is continuous frequency
Display x,y Chromaticity:
  Red:   0.6328, 0.3398
  Green: 0.3105, 0.6328
  Blue:  0.1582, 0.0605
  White: 0.3134, 0.3291
Established timings supported:
  720x400@70Hz 9:5 HorFreq: 31469 Hz Clock: 28.320 MHz
  640x480@60Hz 4:3 HorFreq: 31469 Hz Clock: 25.175 MHz
  640x480@67Hz 4:3 HorFreq: 35000 Hz Clock: 30.240 MHz
  640x480@72Hz 4:3 HorFreq: 37900 Hz Clock: 31.500 MHz
  640x480@75Hz 4:3 HorFreq: 37500 Hz Clock: 31.500 MHz
  800x600@56Hz 4:3 HorFreq: 35200 Hz Clock: 36.000 MHz
  800x600@60Hz 4:3 HorFreq: 37900 Hz Clock: 40.000 MHz
  800x600@72Hz 4:3 HorFreq: 48100 Hz Clock: 50.000 MHz
  800x600@75Hz 4:3 HorFreq: 46900 Hz Clock: 49.500 MHz
  832x624@75Hz 4:3 HorFreq: 49726 Hz Clock: 57.284 MHz
  1024x768@60Hz 4:3 HorFreq: 48400 Hz Clock: 65.000 MHz
  1024x768@70Hz 4:3 HorFreq: 56500 Hz Clock: 75.000 MHz
  1024x768@75Hz 4:3 HorFreq: 60000 Hz Clock: 78.750 MHz
  1280x1024@75Hz 5:4 HorFreq: 80000 Hz Clock: 135.000 MHz
  1152x870@75Hz 192:145 HorFreq: 67500 Hz Clock: 108.000 MHz
Standard timings supported:
  1920x1080@60Hz 16:9
  1280x960@60Hz 4:3 HorFreq: 60000 Hz Clock: 108.000 MHz
  1280x1024@60Hz 5:4 HorFreq: 64000 Hz Clock: 108.000 MHz
  1440x900@60Hz 16:10 HorFreq: 55500 Hz Clock: 88.750 MHz
  1680x1050@60Hz 16:10 HorFreq: 64700 Hz Clock: 119.000 MHz
  1280x720@60Hz 16:9
  1280x800@60Hz 16:10
Detailed mode: Clock 533.250 MHz, 621 mm x 341 mm
               3840 3888 3920 4000 hborder 0
               2160 2163 2168 2222 vborder 0
               +hsync -vsync 
               VertFreq: 59 Hz, HorFreq: 133312 Hz
Detailed mode: Clock 297.000 MHz, 621 mm x 341 mm
               3840 4016 4104 4400 hborder 0
               2160 2168 2178 2250 vborder 0
               +hsync -vsync 
               VertFreq: 30 Hz, HorFreq: 67500 Hz
Monitor ranges (bare limits): 40-60Hz V, 134-134kHz H, max dotclock 600MHz
Monitor name: ASUS VP28U
Has 1 extension blocks
Checksum: 0x3e (valid)

CTA extension block
Extension version: 3
24 bytes of CTA data
  Video data block
    VIC   2 720x480@60Hz 4:3  HorFreq: 31469 Hz Clock: 27.000 MHz
    VIC   3 720x480@60Hz 16:9  HorFreq: 31469 Hz Clock: 27.000 MHz
    VIC   4 1280x720@60Hz 16:9  HorFreq: 45000 Hz Clock: 74.250 MHz
    VIC   5 1920x1080i@60Hz 16:9  HorFreq: 33750 Hz Clock: 74.250 MHz
    VIC  16 1920x1080@60Hz 16:9 (native) HorFreq: 67500 Hz Clock: 148.500 MHz
    VIC  14 1440x480@60Hz 4:3  HorFreq: 31469 Hz Clock: 54.000 MHz
    VIC  15 1440x480@60Hz 16:9  HorFreq: 31469 Hz Clock: 54.000 MHz
    VIC  17 720x576@50Hz 4:3  HorFreq: 31250 Hz Clock: 27.000 MHz
    VIC  18 720x576@50Hz 16:9  HorFreq: 31250 Hz Clock: 27.000 MHz
    VIC  19 1280x720@50Hz 16:9  HorFreq: 37500 Hz Clock: 74.250 MHz
    VIC  29 1440x576@50Hz 4:3  HorFreq: 31250 Hz Clock: 54.000 MHz
    VIC  30 1440x576@50Hz 16:9  HorFreq: 31250 Hz Clock: 54.000 MHz
    VIC  20 1920x1080i@50Hz 16:9  HorFreq: 28125 Hz Clock: 74.250 MHz
    VIC  31 1920x1080@50Hz 16:9  HorFreq: 56250 Hz Clock: 148.500 MHz
    VIC  95 3840x2160@30Hz 16:9  HorFreq: 67500 Hz Clock: 297.000 MHz
  Audio data block
    Linear PCM, max channels 2
      Supported sample rates (kHz): 96 48 44.1 32
      Supported sample sizes (bits): 24 20 16
  Speaker allocation data block
    Speaker map:
      FL/FR - Front Left/Right
Basic audio support
Supports YCbCr 4:4:4
Supports YCbCr 4:2:2
1 native detailed modes
Detailed mode: Clock 241.500 MHz, 621 mm x 341 mm
               2560 2608 2640 2720 hborder 0
               1440 1443 1448 1481 vborder 0
               +hsync +vsync 
               VertFreq: 59 Hz, HorFreq: 88786 Hz
Detailed mode: Clock 268.500 MHz, 621 mm x 341 mm
               2560 2608 2640 2720 hborder 0
               1600 1603 1609 1646 vborder 0
               +hsync -vsync 
               VertFreq: 59 Hz, HorFreq: 98713 Hz
Detailed mode: Clock 25.170 MHz, 621 mm x 341 mm
                640  688  784  800 hborder 0
                350  409  411  449 vborder 0
               +hsync -vsync 
               VertFreq: 70 Hz, HorFreq: 31462 Hz
Checksum: 0xeb (valid)

Warning: One or more of the timings is out of range of the Monitor Ranges:
  Vertical Freq: 30 - 75 Hz
  Horizontal Freq: 28125 - 133312 Hz
  Maximum Clock: 533.250 MHz
