
EDID (hex):
00ffffffffffff0009d1048045540000
3014010380301e782e0bb5a258549e27
0f5054a56b8071008100810f8180a9c0
b3000101010121399030621a274068b0
3600de2c1100001c000000fd00324c1e
5311000a202020202020000000fc0042
656e5120424c323230310a20000000ff
0033434130333632303031390a2000dd

Extracted contents:
header:          00 ff ff ff ff ff ff 00
serial number:   09 d1 04 80 45 54 00 00 30 14
version:         01 03
basic params:    80 30 1e 78 2e
chroma info:     0b b5 a2 58 54 9e 27 0f 50 54
established:     a5 6b 80
standard:        71 00 81 00 81 0f 81 80 a9 c0 b3 00 01 01 01 01
descriptor 1:    21 39 90 30 62 1a 27 40 68 b0 36 00 de 2c 11 00 00 1c
descriptor 2:    00 00 00 fd 00 32 4c 1e 53 11 00 0a 20 20 20 20 20 20
descriptor 3:    00 00 00 fc 00 42 65 6e 51 20 42 4c 32 32 30 31 0a 20
descriptor 4:    00 00 00 ff 00 33 43 41 30 33 36 32 30 30 31 39 0a 20
extensions:      00
checksum:        dd

EDID version: 1.3
Manufacturer: BNQ Model 8004 Serial Number --
Made in week 48 of 2010
Digital display
Maximum image size: 48 cm x 30 cm
Gamma: 2.20
DPMS levels: Off
RGB color display
Default (sRGB) color space is primary color space
First detailed timing is preferred timing
Display x,y Chromaticity:
  Red:   0.6328, 0.3437
  Green: 0.3300, 0.6201
  Blue:  0.1542, 0.0615
  White: 0.3134, 0.3291
Established timings supported:
  720x400@70Hz 9:5 HorFreq: 31469 Hz Clock: 28.320 MHz
  640x480@60Hz 4:3 HorFreq: 31469 Hz Clock: 25.175 MHz
  640x480@75Hz 4:3 HorFreq: 37500 Hz Clock: 31.500 MHz
  800x600@60Hz 4:3 HorFreq: 37900 Hz Clock: 40.000 MHz
  800x600@75Hz 4:3 HorFreq: 46900 Hz Clock: 49.500 MHz
  832x624@75Hz 4:3 HorFreq: 49726 Hz Clock: 57.284 MHz
  1024x768@60Hz 4:3 HorFreq: 48400 Hz Clock: 65.000 MHz
  1024x768@75Hz 4:3 HorFreq: 60000 Hz Clock: 78.750 MHz
  1280x1024@75Hz 5:4 HorFreq: 80000 Hz Clock: 135.000 MHz
  1152x870@75Hz 192:145 HorFreq: 67500 Hz Clock: 108.000 MHz
Standard timings supported:
  1152x720@60Hz 16:10
  1280x800@60Hz 16:10
  1280x800@75Hz 16:10
  1280x1024@60Hz 5:4 HorFreq: 64000 Hz Clock: 108.000 MHz
  1600x900@60Hz 16:9
  1680x1050@60Hz 16:10 HorFreq: 64700 Hz Clock: 119.000 MHz
Detailed mode: Clock 146.250 MHz, 478 mm x 300 mm
               1680 1784 1960 2240 hborder 0
               1050 1053 1059 1089 vborder 0
               -hsync +vsync 
               VertFreq: 59 Hz, HorFreq: 65290 Hz
Monitor ranges (GTF): 50-76Hz V, 30-83kHz H, max dotclock 170MHz
Monitor name: BenQ BL2201
Serial number: --
Checksum: 0xdd (valid)
EDID block does NOT conform to EDID 1.3!
	sRGB is signaled, but the chromaticities do not match
