
EDID (hex):
00ffffffffffff004c2d800539314b4d
111401030e261e782a1f35a4564d9e24
125054bfef8081808140714f81000101
010101010101302a009851002a403070
1300782d1100001e000000fd00384b1e
510e000a202020202020000000fc0053
796e634d61737465720a2020000000ff
004839465a3430333738390a202000aa

Extracted contents:
header:          00 ff ff ff ff ff ff 00
serial number:   4c 2d 80 05 39 31 4b 4d 11 14
version:         01 03
basic params:    0e 26 1e 78 2a
chroma info:     1f 35 a4 56 4d 9e 24 12 50 54
established:     bf ef 80
standard:        81 80 81 40 71 4f 81 00 01 01 01 01 01 01 01 01
descriptor 1:    30 2a 00 98 51 00 2a 40 30 70 13 00 78 2d 11 00 00 1e
descriptor 2:    00 00 00 fd 00 38 4b 1e 51 0e 00 0a 20 20 20 20 20 20
descriptor 3:    00 00 00 fc 00 53 79 6e 63 4d 61 73 74 65 72 0a 20 20
descriptor 4:    00 00 00 ff 00 48 39 46 5a 34 30 33 37 38 39 0a 20 20
extensions:      00
checksum:        aa

EDID version: 1.3
Manufacturer: SAM Model 580 Serial Number --
Made in week 17 of 2010
Analog display, Input voltage level: 0.7/0.3 V
Sync: Separate Composite SyncOnGreen 
Maximum image size: 38 cm x 30 cm
Gamma: 2.20
DPMS levels: Off
RGB color display
First detailed timing is preferred timing
Display x,y Chromaticity:
  Red:   0.6406, 0.3369
  Green: 0.3037, 0.6201
  Blue:  0.1406, 0.0732
  White: 0.3134, 0.3291
Established timings supported:
  720x400@70Hz 9:5 HorFreq: 31469 Hz Clock: 28.320 MHz
  640x480@60Hz 4:3 HorFreq: 31469 Hz Clock: 25.175 MHz
  640x480@67Hz 4:3 HorFreq: 35000 Hz Clock: 30.240 MHz
  640x480@72Hz 4:3 HorFreq: 37900 Hz Clock: 31.500 MHz
  640x480@75Hz 4:3 HorFreq: 37500 Hz Clock: 31.500 MHz
  800x600@56Hz 4:3 HorFreq: 35200 Hz Clock: 36.000 MHz
  800x600@60Hz 4:3 HorFreq: 37900 Hz Clock: 40.000 MHz
  800x600@72Hz 4:3 HorFreq: 48100 Hz Clock: 50.000 MHz
  800x600@75Hz 4:3 HorFreq: 46900 Hz Clock: 49.500 MHz
  832x624@75Hz 4:3 HorFreq: 49726 Hz Clock: 57.284 MHz
  1024x768@60Hz 4:3 HorFreq: 48400 Hz Clock: 65.000 MHz
  1024x768@70Hz 4:3 HorFreq: 56500 Hz Clock: 75.000 MHz
  1024x768@75Hz 4:3 HorFreq: 60000 Hz Clock: 78.750 MHz
  1280x1024@75Hz 5:4 HorFreq: 80000 Hz Clock: 135.000 MHz
  1152x870@75Hz 192:145 HorFreq: 67500 Hz Clock: 108.000 MHz
Standard timings supported:
  1280x1024@60Hz 5:4 HorFreq: 64000 Hz Clock: 108.000 MHz
  1280x960@60Hz 4:3 HorFreq: 60000 Hz Clock: 108.000 MHz
  1152x864@75Hz 4:3 HorFreq: 67500 Hz Clock: 108.000 MHz
  1280x800@60Hz 16:10
Detailed mode: Clock 108.000 MHz, 376 mm x 301 mm
               1280 1328 1440 1688 hborder 0
               1024 1025 1028 1066 vborder 0
               +hsync +vsync 
               VertFreq: 60 Hz, HorFreq: 63981 Hz
Monitor ranges (GTF): 56-75Hz V, 30-81kHz H, max dotclock 140MHz
Monitor name: SyncMaster
Serial number: --
Checksum: 0xaa (valid)
