edid-decode (hex):

00 ff ff ff ff ff ff 00 41 0c 23 08 a3 68 03 00
11 0e 01 03 80 26 1e 78 ee dd 15 a3 58 4b 9a 25
11 50 54 bf ef 80 31 4f 45 4f 61 4f 71 4f 81 80
01 01 01 01 01 01 30 2a 00 98 51 00 2a 40 30 70
13 00 78 2d 11 00 00 1e 00 00 00 ff 00 20 42 5a
20 20 32 32 33 33 39 35 0a 20 00 00 00 fc 00 50
68 69 6c 69 70 73 20 31 39 30 42 35 00 00 00 fd
00 38 4c 1e 52 0e 00 0a 20 20 20 20 20 20 00 6e

00 ff ff ff ff ff ff 00 41 0c 23 08 a3 68 03 00
11 0e 01 03 80 26 1e 78 ee dd 15 a3 58 4b 9a 25
11 50 54 bf ef 80 31 4f 45 4f 61 4f 71 4f 81 80
01 01 01 01 01 01 30 2a 00 98 51 00 2a 40 30 70
13 00 78 2d 11 00 00 1e 00 00 00 ff 00 20 42 5a
20 20 32 32 33 33 39 35 0a 20 00 00 00 fc 00 50
68 69 6c 69 70 73 20 31 39 30 42 35 00 00 00 fd
00 38 4c 1e 52 0e 00 0a 20 20 20 20 20 20 00 6e

----------------

Block 0, Base EDID:
  EDID Structure Version & Revision: 1.3
  Vendor & Product Identification:
    Manufacturer: PHL
    Model: 2083
    Serial Number: ...
    Made in: week 17 of 2004
  Basic Display Parameters & Features:
    Digital display
    Maximum image size: 38 cm x 30 cm
    Gamma: 2.20
    DPMS levels: Standby Suspend Off
    RGB color display
    Default (sRGB) color space is primary color space
    First detailed timing is the preferred timing
  Color Characteristics:
    Red  : 0.6396, 0.3447
    Green: 0.2958, 0.6025
    Blue : 0.1445, 0.0673
    White: 0.3134, 0.3291
  Established Timings I & II:
    IBM     :   720x400    70.081663 Hz   9:5     31.467 kHz     28.320000 MHz
    DMT 0x04:   640x480    59.940476 Hz   4:3     31.469 kHz     25.175000 MHz
    Apple   :   640x480    66.666667 Hz   4:3     35.000 kHz     30.240000 MHz
    DMT 0x05:   640x480    72.808802 Hz   4:3     37.861 kHz     31.500000 MHz
    DMT 0x06:   640x480    75.000000 Hz   4:3     37.500 kHz     31.500000 MHz
    DMT 0x08:   800x600    56.250000 Hz   4:3     35.156 kHz     36.000000 MHz
    DMT 0x09:   800x600    60.316541 Hz   4:3     37.879 kHz     40.000000 MHz
    DMT 0x0a:   800x600    72.187572 Hz   4:3     48.077 kHz     50.000000 MHz
    DMT 0x0b:   800x600    75.000000 Hz   4:3     46.875 kHz     49.500000 MHz
    Apple   :   832x624    74.551266 Hz   4:3     49.726 kHz     57.284000 MHz
    DMT 0x10:  1024x768    60.003840 Hz   4:3     48.363 kHz     65.000000 MHz
    DMT 0x11:  1024x768    70.069359 Hz   4:3     56.476 kHz     75.000000 MHz
    DMT 0x12:  1024x768    75.028582 Hz   4:3     60.023 kHz     78.750000 MHz
    DMT 0x24:  1280x1024   75.024675 Hz   5:4     79.976 kHz    135.000000 MHz
    Apple   :  1152x870    75.061550 Hz 192:145   68.681 kHz    100.000000 MHz
  Standard Timings:
    DMT 0x06:   640x480    75.000000 Hz   4:3     37.500 kHz     31.500000 MHz
    DMT 0x0b:   800x600    75.000000 Hz   4:3     46.875 kHz     49.500000 MHz
    DMT 0x12:  1024x768    75.028582 Hz   4:3     60.023 kHz     78.750000 MHz
    DMT 0x15:  1152x864    75.000000 Hz   4:3     67.500 kHz    108.000000 MHz
    DMT 0x23:  1280x1024   60.019740 Hz   5:4     63.981 kHz    108.000000 MHz
  Detailed Timing Descriptors:
    DTD 1:  1280x1024   60.019740 Hz   5:4     63.981 kHz    108.000000 MHz (376 mm x 301 mm)
                 Hfront   48 Hsync 112 Hback  248 Hpol P
                 Vfront    1 Vsync   3 Vback   38 Vpol P
    Display Product Serial Number: ...
    Display Product Name: 'Philips 190B5'
    Display Range Limits:
      Monitor ranges (GTF): 56-76 Hz V, 30-82 kHz H, max dotclock 140 MHz
Checksum: 0x6e

----------------

Block 1, Unknown EDID Extension Block 0x00:
  00 ff ff ff ff ff ff 00 41 0c 23 08 a3 68 03 00 '........A.#..h..'
  11 0e 01 03 80 26 1e 78 ee dd 15 a3 58 4b 9a 25 '.....&.x....XK.%'
  11 50 54 bf ef 80 31 4f 45 4f 61 4f 71 4f 81 80 '.PT...1OEOaOqO..'
  01 01 01 01 01 01 30 2a 00 98 51 00 2a 40 30 70 '......0*..Q.*@0p'
  13 00 78 2d 11 00 00 1e 00 00 00 ff 00 20 42 5a '..x-......... BZ'
  20 20 32 32 33 33 39 35 0a 20 00 00 00 fc 00 50 '  223395. .....P'
  68 69 6c 69 70 73 20 31 39 30 42 35 00 00 00 fd 'hilips 190B5....'
  00 38 4c 1e 52 0e 00 0a 20 20 20 20 20 20 00 6e '.8L.R...      .n'
Checksum: 0x6e

----------------

Failures:

Block 0, Base EDID:
  Basic Display Parameters & Features: sRGB is signaled, but the chromaticities do not match.
Block 1, Base EDID:
  Unknown Extension Block.
EDID:
  Base EDID: EDID specified 0 extension block(s), but found 1 extension block(s).

EDID conformity: FAIL
