edid-decode (hex):

00 ff ff ff ff ff ff 00 09 e5 d2 06 00 00 00 00
01 1a 01 04 95 22 13 78 02 c9 a0 95 5d 59 94 29
24 50 54 00 00 00 01 01 01 01 01 01 01 01 01 01
01 01 01 01 01 01 9c 3b 80 36 71 38 3c 40 30 20
36 00 58 c2 10 00 00 1a fd 2d 80 0e 71 38 28 40
30 20 36 00 58 c2 10 00 00 1a 00 00 00 fe 00 42
4f 45 20 43 51 0a 20 20 20 20 20 20 00 00 00 fe
00 4e 56 31 35 36 46 48 4d 2d 4e 34 37 0a 00 29

----------------

Block 0, Base EDID:
  EDID Structure Version & Revision: 1.4
  Vendor & Product Identification:
    Manufacturer: BOE
    Model: 1746
    Made in: week 1 of 2016
  Basic Display Parameters & Features:
    Digital display
    Bits per primary color channel: 6
    DisplayPort interface
    Maximum image size: 34 cm x 19 cm
    Gamma: 2.20
    Supported color formats: RGB 4:4:4
    First detailed timing includes the native pixel format and preferred refresh rate
  Color Characteristics:
    Red  : 0.5849, 0.3632
    Green: 0.3496, 0.5791
    Blue : 0.1621, 0.1425
    White: 0.3125, 0.3281
  Established Timings I & II: none
  Standard Timings: none
  Detailed Timing Descriptors:
    DTD 1:  1920x1080   60.027 Hz  16:9    68.430 kHz 152.600 MHz (344 mm x 194 mm)
                 Hfront   48 Hsync  32 Hback 230 Hpol P
                 Vfront    3 Vsync   6 Vback  51 Vpol N
    DTD 2:  1920x1080   47.998 Hz  16:9    53.758 kHz 117.730 MHz (344 mm x 194 mm)
                 Hfront   48 Hsync  32 Hback 190 Hpol P
                 Vfront    3 Vsync   6 Vback  31 Vpol N
    Alphanumeric Data String: 'BOE CQ'
    Alphanumeric Data String: 'NV156FHM-N47'
Checksum: 0x29

----------------

Failures:

Block 0, Base EDID:
  Missing Display Product Name.

EDID conformity: FAIL
