edid-decode (hex):

00 ff ff ff ff ff ff 00 37 33 50 19 0a 1a 00 00
32 1f 01 03 80 2c 17 78 2e d7 a5 a2 59 4a 96 24
14 50 54 af cf 00 01 01 81 80 01 01 81 4a 81 4f
01 01 01 01 01 01 2f 26 40 a0 60 84 1a 30 30 20
35 00 b8 e6 10 00 00 1a 9a 29 a0 d0 51 84 22 30
50 98 36 00 b0 f0 10 00 00 1c 00 00 00 10 00 4c
43 44 20 20 20 20 20 20 20 20 20 20 00 00 00 fc
00 0a 20 20 20 20 20 20 20 20 20 20 20 20 00 5d

00 ff ff ff ff ff ff 00 37 33 50 19 0a 1a 00 00
32 1f 01 03 80 2c 17 78 2e d7 a5 a2 59 4a 96 24
14 50 54 af cf 00 01 01 81 80 01 01 81 4a 81 4f
01 01 01 01 01 01 2f 26 40 a0 60 84 1a 30 30 20
35 00 b8 e6 10 00 00 1a 9a 29 a0 d0 51 84 22 30
50 98 36 00 b0 f0 10 00 00 1c 00 00 00 10 00 4c
43 44 20 20 20 20 20 20 20 20 20 20 00 00 00 fc
00 0a 20 20 20 20 20 20 20 20 20 20 20 20 00 5d

----------------

Block 0, Base EDID:
  EDID Structure Version & Revision: 1.3
  Vendor & Product Identification:
    Manufacturer: MYS
    Model: 6480
    Serial Number: ...
    Made in: week 50 of 2021
  Basic Display Parameters & Features:
    Digital display
    Maximum image size: 44 cm x 23 cm
    Gamma: 2.20
    DPMS levels: Off
    RGB color display
    Default (sRGB) color space is primary color space
    First detailed timing is the preferred timing
  Color Characteristics:
    Red  : 0.6357, 0.3486
    Green: 0.2900, 0.5888
    Blue : 0.1425, 0.0800
    White: 0.3134, 0.3291
  Established Timings I & II:
    IBM     :   720x400    70.081663 Hz   9:5     31.467 kHz     28.320000 MHz
    DMT 0x04:   640x480    59.940476 Hz   4:3     31.469 kHz     25.175000 MHz
    DMT 0x05:   640x480    72.808802 Hz   4:3     37.861 kHz     31.500000 MHz
    DMT 0x06:   640x480    75.000000 Hz   4:3     37.500 kHz     31.500000 MHz
    DMT 0x08:   800x600    56.250000 Hz   4:3     35.156 kHz     36.000000 MHz
    DMT 0x09:   800x600    60.316541 Hz   4:3     37.879 kHz     40.000000 MHz
    DMT 0x0a:   800x600    72.187572 Hz   4:3     48.077 kHz     50.000000 MHz
    DMT 0x0b:   800x600    75.000000 Hz   4:3     46.875 kHz     49.500000 MHz
    DMT 0x10:  1024x768    60.003840 Hz   4:3     48.363 kHz     65.000000 MHz
    DMT 0x11:  1024x768    70.069359 Hz   4:3     56.476 kHz     75.000000 MHz
    DMT 0x12:  1024x768    75.028582 Hz   4:3     60.023 kHz     78.750000 MHz
    DMT 0x24:  1280x1024   75.024675 Hz   5:4     79.976 kHz    135.000000 MHz
  Standard Timings:
    DMT 0x23:  1280x1024   60.019740 Hz   5:4     63.981 kHz    108.000000 MHz
    GTF     :  1280x960    69.999977 Hz   4:3     69.930 kHz    120.839000 MHz
    GTF     :  1280x960    74.999884 Hz   4:3     75.150 kHz    129.859000 MHz
  Detailed Timing Descriptors:
    DTD 1:  1600x900    59.978156 Hz  16:9     55.540 kHz     97.750000 MHz (440 mm x 230 mm)
                 Hfront   48 Hsync  32 Hback   80 Hpol P
                 Vfront    3 Vsync   5 Vback   18 Vpol N
    DTD 2:  1440x900    59.887445 Hz  16:10    55.935 kHz    106.500000 MHz (432 mm x 240 mm)
                 Hfront   80 Hsync 152 Hback  232 Hpol N
                 Vfront    3 Vsync   6 Vback   25 Vpol P
    Dummy Descriptor:
    Display Product Name: ''
Checksum: 0x5d

----------------

Block 1, Unknown EDID Extension Block 0x00:
  00 ff ff ff ff ff ff 00 37 33 50 19 0a 1a 00 00 '........73P.....'
  32 1f 01 03 80 2c 17 78 2e d7 a5 a2 59 4a 96 24 '2....,.x....YJ.$'
  14 50 54 af cf 00 01 01 81 80 01 01 81 4a 81 4f '.PT..........J.O'
  01 01 01 01 01 01 2f 26 40 a0 60 84 1a 30 30 20 '....../&@.`..00 '
  35 00 b8 e6 10 00 00 1a 9a 29 a0 d0 51 84 22 30 '5........)..Q."0'
  50 98 36 00 b0 f0 10 00 00 1c 00 00 00 10 00 4c 'P.6............L'
  43 44 20 20 20 20 20 20 20 20 20 20 00 00 00 fc 'CD          ....'
  00 0a 20 20 20 20 20 20 20 20 20 20 20 20 00 5d '..            .]'
Checksum: 0x5d

----------------

Failures:

Block 0, Base EDID:
  Basic Display Parameters & Features: sRGB is signaled, but the chromaticities do not match.
  Detailed Timing Descriptor #2: Mismatch of image size 432x240 mm vs display size 440x230 mm.
  Dummy Descriptor: Dummy block filled with garbage.
  Display Product Name: Empty string.
  Missing Display Range Limits Descriptor.
Block 1, Base EDID:
  Unknown Extension Block.
EDID:
  Base EDID: The DTD max image size is 440x240mm, which is larger than the display size 440.0x230.0mm.
  Base EDID: EDID specified 0 extension block(s), but found 1 extension block(s).

EDID conformity: FAIL
