
EDID (hex):
00ffffffffffff000472b50193342002
16140103682917782a2305a258539c26
115054bfee00810081c0010101010101
010101010101662156aa51001e30468f
33009ae61000001e000000fd00384b1e
530e000a202020202020000000fc0041
636572204131393148514c0a000000ff
004c50443057303136343333310a0039

Extracted contents:
header:          00 ff ff ff ff ff ff 00
serial number:   04 72 b5 01 93 34 20 02 16 14
version:         01 03
basic params:    68 29 17 78 2a
chroma info:     23 05 a2 58 53 9c 26 11 50 54
established:     bf ee 00
standard:        81 00 81 c0 01 01 01 01 01 01 01 01 01 01 01 01
descriptor 1:    66 21 56 aa 51 00 1e 30 46 8f 33 00 9a e6 10 00 00 1e
descriptor 2:    00 00 00 fd 00 38 4b 1e 53 0e 00 0a 20 20 20 20 20 20
descriptor 3:    00 00 00 fc 00 41 63 65 72 20 41 31 39 31 48 51 4c 0a
descriptor 4:    00 00 00 ff 00 4c 50 44 30 57 30 31 36 34 33 33 31 0a
extensions:      00
checksum:        39

EDID version: 1.3
Manufacturer: ACR Model 1b5 Serial Number --
Made in week 22 of 2010
Analog display, Input voltage level: 0.7/0.7 V
Sync: Separate 
Maximum image size: 41 cm x 23 cm
Gamma: 2.20
DPMS levels: Off
RGB color display
First detailed timing is preferred timing
Display x,y Chromaticity:
  Red:   0.6328, 0.3457
  Green: 0.3242, 0.6123
  Blue:  0.1484, 0.0664
  White: 0.3134, 0.3291
Established timings supported:
  720x400@70Hz 9:5 HorFreq: 31469 Hz Clock: 28.320 MHz
  640x480@60Hz 4:3 HorFreq: 31469 Hz Clock: 25.175 MHz
  640x480@67Hz 4:3 HorFreq: 35000 Hz Clock: 30.240 MHz
  640x480@72Hz 4:3 HorFreq: 37900 Hz Clock: 31.500 MHz
  640x480@75Hz 4:3 HorFreq: 37500 Hz Clock: 31.500 MHz
  800x600@56Hz 4:3 HorFreq: 35200 Hz Clock: 36.000 MHz
  800x600@60Hz 4:3 HorFreq: 37900 Hz Clock: 40.000 MHz
  800x600@72Hz 4:3 HorFreq: 48100 Hz Clock: 50.000 MHz
  800x600@75Hz 4:3 HorFreq: 46900 Hz Clock: 49.500 MHz
  832x624@75Hz 4:3 HorFreq: 49726 Hz Clock: 57.284 MHz
  1024x768@60Hz 4:3 HorFreq: 48400 Hz Clock: 65.000 MHz
  1024x768@70Hz 4:3 HorFreq: 56500 Hz Clock: 75.000 MHz
  1024x768@75Hz 4:3 HorFreq: 60000 Hz Clock: 78.750 MHz
Standard timings supported:
  1280x800@60Hz 16:10
  1280x720@60Hz 16:9
Detailed mode: Clock 85.500 MHz, 410 mm x 230 mm
               1366 1436 1579 1792 hborder 0
                768  771  774  798 vborder 0
               +hsync +vsync 
               VertFreq: 59 Hz, HorFreq: 47712 Hz
Monitor ranges (GTF): 56-75Hz V, 30-83kHz H, max dotclock 140MHz
Monitor name: Acer A191HQL
Serial number: --
Checksum: 0x39 (valid)
