edid-decode (hex):

00 ff ff ff ff ff ff 00 21 63 51 2d 00 00 00 00
00 1e 01 04 95 1a 0e 78 0a f7 00 96 5c 58 96 29
21 50 54 00 00 00 01 01 01 01 01 01 01 01 01 01
01 01 01 01 01 01 c4 1d 56 91 50 00 48 30 39 20
3c 00 00 90 10 00 00 18 d4 17 56 91 50 00 48 30
39 20 3c 00 00 90 10 00 00 18 00 00 00 fe 00 57
43 44 4e 48 80 31 31 36 41 4e 30 31 00 00 00 00
00 00 41 21 16 00 10 00 00 09 01 0a 20 20 00 b3

00 ff ff ff ff ff ff 00 21 63 51 2d 00 00 00 00
00 1e 01 04 95 1a 0e 78 0a f7 00 96 5c 58 96 29
21 50 54 00 00 00 01 01 01 01 01 01 01 01 01 01
01 01 01 01 01 01 c4 1d 56 91 50 00 48 30 39 20
3c 00 00 90 10 00 00 18 d4 17 56 91 50 00 48 30
39 20 3c 00 00 90 10 00 00 18 00 00 00 fe 00 57
43 44 4e 48 80 31 31 36 41 4e 30 31 00 00 00 00
00 00 41 21 16 00 10 00 00 09 01 0a 20 20 00 b3

----------------

Block 0, Base EDID:
  EDID Structure Version & Revision: 1.4
  Vendor & Product Identification:
    Manufacturer: HKC
    Model: 11601
    Made in: 2020
  Basic Display Parameters & Features:
    Digital display
    Bits per primary color channel: 6
    DisplayPort interface
    Maximum image size: 26 cm x 14 cm
    Gamma: 2.20
    Supported color formats: RGB 4:4:4, YCrCb 4:4:4
    First detailed timing includes the native pixel format and preferred refresh rate
  Color Characteristics:
    Red  : 0.5888, 0.3623
    Green: 0.3447, 0.5888
    Blue : 0.1601, 0.1289
    White: 0.3125, 0.3281
  Established Timings I & II: none
  Standard Timings: none
  Detailed Timing Descriptors:
    DTD 1:  1366x768    60.035927 Hz 683:384   50.430 kHz     76.200000 MHz (256 mm x 144 mm)
                 Hfront   57 Hsync  32 Hback   56 Hpol N
                 Vfront    3 Vsync  12 Vback   57 Vpol N
    DTD 2:  1366x768    48.060257 Hz 683:384   40.371 kHz     61.000000 MHz (256 mm x 144 mm)
                 Hfront   57 Hsync  32 Hback   56 Hpol N
                 Vfront    3 Vsync  12 Vback   57 Vpol N
    Alphanumeric Data String: 'WCDNH'
    Manufacturer-Specified Display Descriptor (0x00): 00 00 00 00 41 21 16 00 10 00 00 09 01 0a 20 20 '....A!........  '
Checksum: 0xb3

----------------

Block 1, Unknown EDID Extension Block 0x00:
  00 ff ff ff ff ff ff 00 21 63 51 2d 00 00 00 00 '........!cQ-....'
  00 1e 01 04 95 1a 0e 78 0a f7 00 96 5c 58 96 29 '.......x....\X.)'
  21 50 54 00 00 00 01 01 01 01 01 01 01 01 01 01 '!PT.............'
  01 01 01 01 01 01 c4 1d 56 91 50 00 48 30 39 20 '........V.P.H09 '
  3c 00 00 90 10 00 00 18 d4 17 56 91 50 00 48 30 '<.........V.P.H0'
  39 20 3c 00 00 90 10 00 00 18 00 00 00 fe 00 57 '9 <............W'
  43 44 4e 48 80 31 31 36 41 4e 30 31 00 00 00 00 'CDNH.116AN01....'
  00 00 41 21 16 00 10 00 00 09 01 0a 20 20 00 b3 '..A!........  ..'
Checksum: 0xb3

----------------

Warnings:

Block 0, Base EDID:
  Missing Display Product Name.

Failures:

Block 0, Base EDID:
  Alphanumeric Data String: Non-printable character.
Block 1, Base EDID:
  Unknown Extension Block.
EDID:
  Base EDID: EDID specified 0 extension block(s), but found 1 extension block(s).

EDID conformity: FAIL
