
EDID (hex):
00ffffffffffff0004723805a94c9071
131b010380351e782a0ef5a555509e26
105054b30c00714f818081c081009500
b300d1c00101023a801871382d40582c
4500132b2100001e000000fd00374c1e
5311000a202020202020000000ff0054
364e5341303031343230340a000000fc
0041636572204b41323430480a2001dc
02031ef14b9002030411121305141f01
230907078301000065030c001000023a
801871382d40582c4500132b2100001e
8c0ad08a20e02d10103e9600132b2100
0018011d007251d01e206e285500132b
2100001e8c0ad090204031200c405500
132b2100001800000000000000000000
00000000000000000000000000000089

Extracted contents:
header:          00 ff ff ff ff ff ff 00
serial number:   04 72 38 05 a9 4c 90 71 13 1b
version:         01 03
basic params:    80 35 1e 78 2a
chroma info:     0e f5 a5 55 50 9e 26 10 50 54
established:     b3 0c 00
standard:        71 4f 81 80 81 c0 81 00 95 00 b3 00 d1 c0 01 01
descriptor 1:    02 3a 80 18 71 38 2d 40 58 2c 45 00 13 2b 21 00 00 1e
descriptor 2:    00 00 00 fd 00 37 4c 1e 53 11 00 0a 20 20 20 20 20 20
descriptor 3:    00 00 00 ff 00 54 36 4e 53 41 30 30 31 34 32 30 34 0a
descriptor 4:    00 00 00 fc 00 41 63 65 72 20 4b 41 32 34 30 48 0a 20
extensions:      01
checksum:        dc

EDID version: 1.3
Manufacturer: ACR Model 538 Serial Number --
Made in week 19 of 2017
Digital display
Maximum image size: 53 cm x 30 cm
Gamma: 2.20
DPMS levels: Off
RGB color display
First detailed timing is preferred timing
Display x,y Chromaticity:
  Red:   0.6445, 0.3320
  Green: 0.3154, 0.6191
  Blue:  0.1513, 0.0654
  White: 0.3134, 0.3291
Established timings supported:
  720x400@70Hz 9:5 HorFreq: 31469 Hz Clock: 28.320 MHz
  640x480@60Hz 4:3 HorFreq: 31469 Hz Clock: 25.175 MHz
  640x480@67Hz 4:3 HorFreq: 35000 Hz Clock: 30.240 MHz
  800x600@56Hz 4:3 HorFreq: 35200 Hz Clock: 36.000 MHz
  800x600@60Hz 4:3 HorFreq: 37900 Hz Clock: 40.000 MHz
  1024x768@60Hz 4:3 HorFreq: 48400 Hz Clock: 65.000 MHz
  1024x768@70Hz 4:3 HorFreq: 56500 Hz Clock: 75.000 MHz
Standard timings supported:
  1152x864@75Hz 4:3 HorFreq: 67500 Hz Clock: 108.000 MHz
  1280x1024@60Hz 5:4 HorFreq: 64000 Hz Clock: 108.000 MHz
  1280x720@60Hz 16:9
  1280x800@60Hz 16:10
  1440x900@60Hz 16:10 HorFreq: 55500 Hz Clock: 88.750 MHz
  1680x1050@60Hz 16:10 HorFreq: 64700 Hz Clock: 119.000 MHz
  1920x1080@60Hz 16:9
Detailed mode: Clock 148.500 MHz, 531 mm x 299 mm
               1920 2008 2052 2200 hborder 0
               1080 1084 1089 1125 vborder 0
               +hsync +vsync 
               VertFreq: 60 Hz, HorFreq: 67500 Hz
Monitor ranges (GTF): 55-76Hz V, 30-83kHz H, max dotclock 170MHz
Serial number: --
Monitor name: Acer KA240H
Has 1 extension blocks
Checksum: 0xdc (valid)

CTA extension block
Extension version: 3
26 bytes of CTA data
  Video data block
    VIC  16 1920x1080@60Hz 16:9 (native) HorFreq: 67500 Hz Clock: 148.500 MHz
    VIC   2 720x480@60Hz 4:3  HorFreq: 31469 Hz Clock: 27.000 MHz
    VIC   3 720x480@60Hz 16:9  HorFreq: 31469 Hz Clock: 27.000 MHz
    VIC   4 1280x720@60Hz 16:9  HorFreq: 45000 Hz Clock: 74.250 MHz
    VIC  17 720x576@50Hz 4:3  HorFreq: 31250 Hz Clock: 27.000 MHz
    VIC  18 720x576@50Hz 16:9  HorFreq: 31250 Hz Clock: 27.000 MHz
    VIC  19 1280x720@50Hz 16:9  HorFreq: 37500 Hz Clock: 74.250 MHz
    VIC   5 1920x1080i@60Hz 16:9  HorFreq: 33750 Hz Clock: 74.250 MHz
    VIC  20 1920x1080i@50Hz 16:9  HorFreq: 28125 Hz Clock: 74.250 MHz
    VIC  31 1920x1080@50Hz 16:9  HorFreq: 56250 Hz Clock: 148.500 MHz
    VIC   1 640x480@60Hz 4:3  HorFreq: 31469 Hz Clock: 25.175 MHz
  Audio data block
    Linear PCM, max channels 2
      Supported sample rates (kHz): 48 44.1 32
      Supported sample sizes (bits): 24 20 16
  Speaker allocation data block
    Speaker map:
      FL/FR - Front Left/Right
  Vendor-specific data block, OUI 000c03 (HDMI)
    Source physical address 1.0.0.0
Underscans PC formats by default
Basic audio support
Supports YCbCr 4:4:4
Supports YCbCr 4:2:2
1 native detailed modes
Detailed mode: Clock 148.500 MHz, 531 mm x 299 mm
               1920 2008 2052 2200 hborder 0
               1080 1084 1089 1125 vborder 0
               +hsync +vsync 
               VertFreq: 60 Hz, HorFreq: 67500 Hz
Detailed mode: Clock 27.000 MHz, 531 mm x 299 mm
                720  736  798  858 hborder 0
                480  489  495  525 vborder 0
               -hsync -vsync 
               VertFreq: 59 Hz, HorFreq: 31468 Hz
Detailed mode: Clock 74.250 MHz, 531 mm x 299 mm
               1280 1390 1430 1650 hborder 0
                720  725  730  750 vborder 0
               +hsync +vsync 
               VertFreq: 60 Hz, HorFreq: 45000 Hz
Detailed mode: Clock 27.000 MHz, 531 mm x 299 mm
                720  732  796  864 hborder 0
                576  581  586  625 vborder 0
               -hsync -vsync 
               VertFreq: 50 Hz, HorFreq: 31250 Hz
Checksum: 0x89 (valid)

One or more of the timings is out of range of the Monitor Ranges:
  Vertical Freq: 50 - 75 Hz
  Horizontal Freq: 28125 - 67500 Hz
  Maximum Clock: 148.500 MHz
EDID block does not conform at all!
	Both the serial number and the serial string are set
