edid-decode (hex):

00 ff ff ff ff ff ff 00 0d ae 10 15 00 00 00 00
07 1d 01 04 a5 22 13 78 02 ee 95 a3 54 4c 99 26
0f 50 54 00 00 00 01 01 01 01 01 01 01 01 01 01
01 01 01 01 01 01 b4 3b 80 4a 71 38 34 40 30 20
68 00 58 c1 10 00 00 1a b4 3b 80 4a 71 38 4f 41
30 20 68 00 58 c1 10 00 00 1a 00 00 00 fe 00 43
54 33 43 37 80 31 35 36 48 43 41 0a 00 00 00 00
00 01 41 01 9e 00 10 00 00 0a 01 0a 20 20 00 29

----------------

Block 0, Base EDID:
  EDID Structure Version & Revision: 1.4
  Vendor & Product Identification:
    Manufacturer: CMN
    Model: 5392
    Made in: week 7 of 2019
  Basic Display Parameters & Features:
    Digital display
    Bits per primary color channel: 8
    DisplayPort interface
    Maximum image size: 34 cm x 19 cm
    Gamma: 2.20
    Supported color formats: RGB 4:4:4
    First detailed timing includes the native pixel format and preferred refresh rate
  Color Characteristics:
    Red  : 0.6396, 0.3300
    Green: 0.2998, 0.5996
    Blue : 0.1503, 0.0595
    White: 0.3134, 0.3291
  Established Timings I & II: none
  Standard Timings: none
  Detailed Timing Descriptors:
    DTD 1:  1920x1080   60.008 Hz  16:9    67.929 kHz 152.840 MHz (344 mm x 193 mm)
                 Hfront   48 Hsync  32 Hback 250 Hpol P
                 Vfront    6 Vsync   8 Vback  38 Vpol N
    DTD 2:  1920x1080   48.006 Hz  16:9    67.929 kHz 152.840 MHz (344 mm x 193 mm)
                 Hfront   48 Hsync  32 Hback 250 Hpol P
                 Vfront    6 Vsync   8 Vback 321 Vpol N
    Alphanumeric Data String: 'CT3C7'
    Manufacturer-Specified Display Descriptor (0x00): 00 00 00 01 41 01 9e 00 10 00 00 0a 01 0a 20 20 '....A.........  '
Checksum: 0x29
