
EDID (hex):
00ffffffffffff0010ac02d156335430
331f010380502178eab795ac4f46a727
135054a54b008100b300d100714fa940
8180d1c00101e77c70a0d0a029503020
3a001d4e3100001a000000ff00463635
325448330a2020202020000000fc0044
454c4c20533334323244570a000000fd
0030641ea03c000a2020202020200130
020335f14f9005040302071601111213
141f5a4c230907078301000067030c00
1000384067d85dc401788800681a0000
01013064e64ed470a0d0a0465030203a
001d4e3100001a507800a0a038354030
203a001d4e3100001a7e4800e0a0381f
4040403a001d4e3100001a9d6770a0d0
a0225030203a001d4e3100001a0000b0

edid-decode (hex):

00 ff ff ff ff ff ff 00 10 ac 02 d1 56 33 54 30
33 1f 01 03 80 50 21 78 ea b7 95 ac 4f 46 a7 27
13 50 54 a5 4b 00 81 00 b3 00 d1 00 71 4f a9 40
81 80 d1 c0 01 01 e7 7c 70 a0 d0 a0 29 50 30 20
3a 00 1d 4e 31 00 00 1a 00 00 00 ff 00 46 36 35
32 54 48 33 0a 20 20 20 20 20 00 00 00 fc 00 44
45 4c 4c 20 53 33 34 32 32 44 57 0a 00 00 00 fd
00 30 64 1e a0 3c 00 0a 20 20 20 20 20 20 01 30

02 03 35 f1 4f 90 05 04 03 02 07 16 01 11 12 13
14 1f 5a 4c 23 09 07 07 83 01 00 00 67 03 0c 00
10 00 38 40 67 d8 5d c4 01 78 88 00 68 1a 00 00
01 01 30 64 e6 4e d4 70 a0 d0 a0 46 50 30 20 3a
00 1d 4e 31 00 00 1a 50 78 00 a0 a0 38 35 40 30
20 3a 00 1d 4e 31 00 00 1a 7e 48 00 e0 a0 38 1f
40 40 40 3a 00 1d 4e 31 00 00 1a 9d 67 70 a0 d0
a0 22 50 30 20 3a 00 1d 4e 31 00 00 1a 00 00 b0

----------------

Block 0, Base EDID:
  EDID Structure Version & Revision: 1.3
  Vendor & Product Identification:
    Manufacturer: DEL
    Model: 53506
    Serial Number: 810824534
    Made in: week 51 of 2021
  Basic Display Parameters & Features:
    Digital display
    Maximum image size: 80 cm x 33 cm
    Gamma: 2.20
    DPMS levels: Standby Suspend Off
    RGB color display
    First detailed timing is the preferred timing
  Color Characteristics:
    Red  : 0.6738, 0.3115
    Green: 0.2744, 0.6552
    Blue : 0.1542, 0.0751
    White: 0.3134, 0.3291
  Established Timings I & II:
    IBM     :   720x400    70.081663 Hz   9:5     31.467 kHz     28.320000 MHz
    DMT 0x04:   640x480    59.940476 Hz   4:3     31.469 kHz     25.175000 MHz
    DMT 0x06:   640x480    75.000000 Hz   4:3     37.500 kHz     31.500000 MHz
    DMT 0x09:   800x600    60.316541 Hz   4:3     37.879 kHz     40.000000 MHz
    DMT 0x0b:   800x600    75.000000 Hz   4:3     46.875 kHz     49.500000 MHz
    DMT 0x10:  1024x768    60.003840 Hz   4:3     48.363 kHz     65.000000 MHz
    DMT 0x12:  1024x768    75.028582 Hz   4:3     60.023 kHz     78.750000 MHz
    DMT 0x24:  1280x1024   75.024675 Hz   5:4     79.976 kHz    135.000000 MHz
  Standard Timings:
    DMT 0x1c:  1280x800    59.810326 Hz  16:10    49.702 kHz     83.500000 MHz
    DMT 0x3a:  1680x1050   59.954250 Hz  16:10    65.290 kHz    146.250000 MHz
    DMT 0x45:  1920x1200   59.884600 Hz  16:10    74.556 kHz    193.250000 MHz
    DMT 0x15:  1152x864    75.000000 Hz   4:3     67.500 kHz    108.000000 MHz
    DMT 0x33:  1600x1200   60.000000 Hz   4:3     75.000 kHz    162.000000 MHz
    DMT 0x23:  1280x1024   60.019740 Hz   5:4     63.981 kHz    108.000000 MHz
    DMT 0x52:  1920x1080   60.000000 Hz  16:9     67.500 kHz    148.500000 MHz
  Detailed Timing Descriptors:
    DTD 1:  3440x1440   59.972616 Hz  43:18    88.819 kHz    319.750000 MHz (797 mm x 334 mm)
                 Hfront   48 Hsync  32 Hback   80 Hpol P
                 Vfront    3 Vsync  10 Vback   28 Vpol N
    Display Product Serial Number: 'F652TH3'
    Display Product Name: 'DELL S3422DW'
    Display Range Limits:
      Monitor ranges (GTF): 48-100 Hz V, 30-160 kHz H, max dotclock 600 MHz
  Extension blocks: 1
Checksum: 0x30

----------------

Block 1, CTA-861 Extension Block:
  Revision: 3
  Underscans IT Video Formats by default
  Basic audio support
  Supports YCbCr 4:4:4
  Supports YCbCr 4:2:2
  Native detailed modes: 1
  Video Data Block:
    VIC  16:  1920x1080   60.000000 Hz  16:9     67.500 kHz    148.500000 MHz (native)
    VIC   5:  1920x1080i  60.000000 Hz  16:9     33.750 kHz     74.250000 MHz
    VIC   4:  1280x720    60.000000 Hz  16:9     45.000 kHz     74.250000 MHz
    VIC   3:   720x480    59.940060 Hz  16:9     31.469 kHz     27.000000 MHz
    VIC   2:   720x480    59.940060 Hz   4:3     31.469 kHz     27.000000 MHz
    VIC   7:  1440x480i   59.940060 Hz  16:9     15.734 kHz     27.000000 MHz
    VIC  22:  1440x576i   50.000000 Hz  16:9     15.625 kHz     27.000000 MHz
    VIC   1:   640x480    59.940476 Hz   4:3     31.469 kHz     25.175000 MHz
    VIC  17:   720x576    50.000000 Hz   4:3     31.250 kHz     27.000000 MHz
    VIC  18:   720x576    50.000000 Hz  16:9     31.250 kHz     27.000000 MHz
    VIC  19:  1280x720    50.000000 Hz  16:9     37.500 kHz     74.250000 MHz
    VIC  20:  1920x1080i  50.000000 Hz  16:9     28.125 kHz     74.250000 MHz
    VIC  31:  1920x1080   50.000000 Hz  16:9     56.250 kHz    148.500000 MHz
    VIC  90:  2560x1080   60.000000 Hz  64:27    66.000 kHz    198.000000 MHz
    VIC  76:  1920x1080   60.000000 Hz  64:27    67.500 kHz    148.500000 MHz
  Audio Data Block:
    Linear PCM:
      Max channels: 2
      Supported sample rates (kHz): 48 44.1 32
      Supported sample sizes (bits): 24 20 16
  Speaker Allocation Data Block:
    FL/FR - Front Left/Right
  Vendor-Specific Data Block (HDMI), OUI 00-0C-03:
    Source physical address: 1.0.0.0
    DC_36bit
    DC_30bit
    DC_Y444
    Maximum TMDS clock: 320 MHz
  Vendor-Specific Data Block (HDMI Forum), OUI C4-5D-D8:
    Version: 1
    Maximum TMDS Character Rate: 600 MHz
    SCDC Present
    Supports scrambling for <= 340 Mcsc
  Vendor-Specific Data Block (AMD), OUI 00-00-1A:
    Version: 1.1
    Minimum Refresh Rate: 48 Hz
    Maximum Refresh Rate: 100 Hz
    Flags 1.x: 0xe6 (MCCS)
  Detailed Timing Descriptors:
    DTD 2:  3440x1440   99.981604 Hz  43:18   150.972 kHz    543.500000 MHz (797 mm x 334 mm)
                 Hfront   48 Hsync  32 Hback   80 Hpol P
                 Vfront    3 Vsync  10 Vback   57 Vpol N
    DTD 3:  2560x1080   99.942890 Hz  64:27   113.235 kHz    308.000000 MHz (797 mm x 334 mm)
                 Hfront   48 Hsync  32 Hback   80 Hpol P
                 Vfront    3 Vsync  10 Vback   40 Vpol N
    DTD 4:  2560x1080   59.999534 Hz  64:27    66.659 kHz    185.580000 MHz (797 mm x 334 mm)
                 Hfront   64 Hsync  64 Hback   96 Hpol P
                 Vfront    3 Vsync  10 Vback   18 Vpol N
    DTD 5:  3440x1440   49.986808 Hz  43:18    73.681 kHz    265.250000 MHz (797 mm x 334 mm)
                 Hfront   48 Hsync  32 Hback   80 Hpol P
                 Vfront    3 Vsync  10 Vback   21 Vpol N
Checksum: 0xb0  Unused space in Extension Block: 2 bytes
