
EDID (hex):
00ffffffffffff0006af9e1500000000
001501049026157802c4959e57539226
0f505400000001010101010101010101
010101010101102740c660841a303020
36007ed61000001a102740c660841a30
302036007ed61000001a000000fe0044
594d5830804231373352573100000000
00004101960101000002010a20200077

Extracted contents:
header:          00 ff ff ff ff ff ff 00
serial number:   06 af 9e 15 00 00 00 00 00 15
version:         01 04
basic params:    90 26 15 78 02
chroma info:     c4 95 9e 57 53 92 26 0f 50 54
established:     00 00 00
standard:        01 01 01 01 01 01 01 01 01 01 01 01 01 01 01 01
descriptor 1:    10 27 40 c6 60 84 1a 30 30 20 36 00 7e d6 10 00 00 1a
descriptor 2:    10 27 40 c6 60 84 1a 30 30 20 36 00 7e d6 10 00 00 1a
descriptor 3:    00 00 00 fe 00 44 59 4d 58 30 80 42 31 37 33 52 57 31
descriptor 4:    00 00 00 00 00 00 41 01 96 01 01 00 00 02 01 0a 20 20
extensions:      00
checksum:        77

EDID version: 1.4
Manufacturer: AUO Model 159e Serial Number --
Made in year 2011
Digital display
6 bits per primary color channel
Digital interface is not defined
Maximum image size: 38 cm x 21 cm
Gamma: 2.20
Supported color formats: RGB 4:4:4
First detailed timing includes the native pixel format and preferred refresh rate
Display x,y Chromaticity:
  Red:   0.6201, 0.3398
  Green: 0.3251, 0.5703
  Blue:  0.1503, 0.0595
  White: 0.3134, 0.3291
Established timings supported:
Standard timings supported:
Detailed mode: Clock 100.000 MHz, 382 mm x 214 mm
               1600 1648 1680 1798 hborder 0
                900  903  909  926 vborder 0
               +hsync -vsync 
               VertFreq: 60 Hz, HorFreq: 55617 Hz
Detailed mode: Clock 100.000 MHz, 382 mm x 214 mm
               1600 1648 1680 1798 hborder 0
                900  903  909  926 vborder 0
               +hsync -vsync 
               VertFreq: 60 Hz, HorFreq: 55617 Hz
ASCII string: DYMX0
Manufacturer-specified data, tag 0
Checksum: 0x77 (valid)
EDID block does NOT conform to EDID 1.4!
	Missing name descriptor
	Missing monitor ranges
	Detailed block string not properly terminated
