
EDID (hex):
00ffffffffffff00410cb4c01e6b0000
331601036e2c19782afda5a256519e27
0c5054bd4b00a9c0818081c001010101
010101010101302a40c8608464301850
1300bbf91000001e000000ff00554b30
31323531303237343232000000fc0050
68696c697073203230365634000000fd
00384c1e5311000a2020202020200019

Extracted contents:
header:          00 ff ff ff ff ff ff 00
serial number:   41 0c b4 c0 1e 6b 00 00 33 16
version:         01 03
basic params:    6e 2c 19 78 2a
chroma info:     fd a5 a2 56 51 9e 27 0c 50 54
established:     bd 4b 00
standard:        a9 c0 81 80 81 c0 01 01 01 01 01 01 01 01 01 01
descriptor 1:    30 2a 40 c8 60 84 64 30 18 50 13 00 bb f9 10 00 00 1e
descriptor 2:    00 00 00 ff 00 55 4b 30 31 32 35 31 30 32 37 34 32 32
descriptor 3:    00 00 00 fc 00 50 68 69 6c 69 70 73 20 32 30 36 56 34
descriptor 4:    00 00 00 fd 00 38 4c 1e 53 11 00 0a 20 20 20 20 20 20
extensions:      00
checksum:        19

EDID version: 1.3
Manufacturer: PHL Model c0b4 Serial Number --
Made in week 51 of 2012
Analog display, Input voltage level: 0.7/0.7 V
Sync: Separate Composite SyncOnGreen 
Maximum image size: 44 cm x 25 cm
Gamma: 2.20
DPMS levels: Off
RGB color display
First detailed timing is preferred timing
Display x,y Chromaticity:
  Red:   0.6357, 0.3388
  Green: 0.3193, 0.6181
  Blue:  0.1542, 0.0488
  White: 0.3134, 0.3291
Established timings supported:
  720x400@70Hz 9:5 HorFreq: 31469 Hz Clock: 28.320 MHz
  640x480@60Hz 4:3 HorFreq: 31469 Hz Clock: 25.175 MHz
  640x480@67Hz 4:3 HorFreq: 35000 Hz Clock: 30.240 MHz
  640x480@72Hz 4:3 HorFreq: 37900 Hz Clock: 31.500 MHz
  640x480@75Hz 4:3 HorFreq: 37500 Hz Clock: 31.500 MHz
  800x600@60Hz 4:3 HorFreq: 37900 Hz Clock: 40.000 MHz
  800x600@75Hz 4:3 HorFreq: 46900 Hz Clock: 49.500 MHz
  1024x768@60Hz 4:3 HorFreq: 48400 Hz Clock: 65.000 MHz
  1024x768@75Hz 4:3 HorFreq: 60000 Hz Clock: 78.750 MHz
  1280x1024@75Hz 5:4 HorFreq: 80000 Hz Clock: 135.000 MHz
Standard timings supported:
  1600x900@60Hz 16:9
  1280x1024@60Hz 5:4 HorFreq: 64000 Hz Clock: 108.000 MHz
  1280x720@60Hz 16:9
Detailed mode: Clock 108.000 MHz, 443 mm x 249 mm
               1600 1624 1704 1800 hborder 0
                900  901  904 1000 vborder 0
               +hsync +vsync 
               VertFreq: 60 Hz, HorFreq: 60000 Hz
Serial number: --
Monitor ranges (GTF): 56-76Hz V, 30-83kHz H, max dotclock 170MHz
Checksum: 0x19 (valid)
EDID block does NOT conform to EDID 1.3!
	Name descriptor not terminated with a newline
