edid-decode (hex):

00 ff ff ff ff ff ff 00 30 e4 42 02 00 00 00 00
00 13 01 03 80 21 15 78 0a 14 65 98 59 53 8b 28
23 50 54 00 00 00 01 01 01 01 01 01 01 01 01 01
01 01 01 01 01 01 12 1b 00 88 50 20 10 30 30 18
36 00 4b cf 10 00 00 19 00 00 00 00 00 00 00 00
00 00 00 00 00 00 00 00 00 00 00 00 00 fe 00 4c
47 20 44 69 73 70 6c 61 79 0a 20 20 00 00 00 fc
00 4c 50 31 35 34 57 58 34 2d 54 4c 43 43 00 b9

----------------

Block 0, Base EDID:
  EDID Structure Version & Revision: 1.3
  Vendor & Product Identification:
    Manufacturer: LGD
    Model: 578
    Made in: 2009
  Basic Display Parameters & Features:
    Digital display
    Maximum image size: 33 cm x 21 cm
    Gamma: 2.20
    RGB color display
    First detailed timing is the preferred timing
  Color Characteristics:
    Red  : 0.5937, 0.3486
    Green: 0.3251, 0.5429
    Blue : 0.1572, 0.1386
    White: 0.3134, 0.3291
  Established Timings I & II: none
  Standard Timings: none
  Detailed Timing Descriptors:
    DTD 1:  1280x800    59.976321 Hz  16:10    48.941 kHz     69.300000 MHz (331 mm x 207 mm)
                 Hfront   48 Hsync  24 Hback   64 Hpol N
                 Vfront    3 Vsync   6 Vback    7 Vpol N
    Empty Descriptor
    Alphanumeric Data String: 'LG Display'
    Display Product Name: 'LP154WX4-TLCC'
Checksum: 0xb9

----------------

Failures:

Block 0, Base EDID:
  Empty Descriptor: Use Dummy Descriptor instead of all zeroes.
  Missing Display Range Limits Descriptor.

EDID conformity: FAIL
