
EDID (hex):
00ffffffffffff001e6dfc7616450500
0a1b0104b55725789eca95a6554ea126
0f5054256b807140818081c0a9c0b300
d1c08100d1cfd8a40020f14068603020
7a006a6e3100001a85cf0020f1407460
30207a006a6e3100001a000000fd0038
4b1e7d36000a202020202020000000fc
004c4720554c545241574944450a01d7
020316712309060749100403011f1359
da128301000040510020f14050603020
7a006a6e3100001ae4a770b8d1a02450
906084006a6e3100001ae77c70a0d0a0
295030203a006a6e3100001a00000000
00000000000000000000000000000000
00000000000000000000000000000000
00000000000000000000000000000028

Extracted contents:
header:          00 ff ff ff ff ff ff 00
serial number:   1e 6d fc 76 16 45 05 00 0a 1b
version:         01 04
basic params:    b5 57 25 78 9e
chroma info:     ca 95 a6 55 4e a1 26 0f 50 54
established:     25 6b 80
standard:        71 40 81 80 81 c0 a9 c0 b3 00 d1 c0 81 00 d1 cf
descriptor 1:    d8 a4 00 20 f1 40 68 60 30 20 7a 00 6a 6e 31 00 00 1a
descriptor 2:    85 cf 00 20 f1 40 74 60 30 20 7a 00 6a 6e 31 00 00 1a
descriptor 3:    00 00 00 fd 00 38 4b 1e 7d 36 00 0a 20 20 20 20 20 20
descriptor 4:    00 00 00 fc 00 4c 47 20 55 4c 54 52 41 57 49 44 45 0a
extensions:      01
checksum:        d7

EDID version: 1.4
Manufacturer: GSM Model 76fc Serial Number --
Made in week 10 of 2017
Digital display
10 bits per primary color channel
DisplayPort interface
Maximum image size: 87 cm x 37 cm
Gamma: 2.20
DPMS levels: Standby
Supported color formats: RGB 4:4:4, YCrCb 4:4:4, YCrCb 4:2:2
Default (sRGB) color space is primary color space
First detailed timing includes the native pixel format and preferred refresh rate
Display x,y Chromaticity:
  Red:   0.6513, 0.3320
  Green: 0.3066, 0.6308
  Blue:  0.1503, 0.0595
  White: 0.3134, 0.3291
Established timings supported:
  640x480@60Hz 4:3 HorFreq: 31469 Hz Clock: 25.175 MHz
  640x480@75Hz 4:3 HorFreq: 37500 Hz Clock: 31.500 MHz
  800x600@60Hz 4:3 HorFreq: 37900 Hz Clock: 40.000 MHz
  800x600@75Hz 4:3 HorFreq: 46900 Hz Clock: 49.500 MHz
  832x624@75Hz 4:3 HorFreq: 49726 Hz Clock: 57.284 MHz
  1024x768@60Hz 4:3 HorFreq: 48400 Hz Clock: 65.000 MHz
  1024x768@75Hz 4:3 HorFreq: 60000 Hz Clock: 78.750 MHz
  1280x1024@75Hz 5:4 HorFreq: 80000 Hz Clock: 135.000 MHz
  1152x870@75Hz 192:145 HorFreq: 67500 Hz Clock: 108.000 MHz
Standard timings supported:
  1152x864@60Hz 4:3
  1280x1024@60Hz 5:4 HorFreq: 64000 Hz Clock: 108.000 MHz
  1280x720@60Hz 16:9
  1600x900@60Hz 16:9
  1680x1050@60Hz 16:10 HorFreq: 64700 Hz Clock: 119.000 MHz
  1920x1080@60Hz 16:9
  1280x800@60Hz 16:10
  1920x1080@75Hz 16:9
Detailed mode: Clock 422.000 MHz, 874 mm x 366 mm
               3840 3888 3920 4128 hborder 0
               1600 1607 1617 1704 vborder 0
               +hsync -vsync 
               VertFreq: 59 Hz, HorFreq: 102228 Hz
Detailed mode: Clock 531.250 MHz, 874 mm x 366 mm
               3840 3888 3920 4128 hborder 0
               1600 1607 1617 1716 vborder 0
               +hsync -vsync 
               VertFreq: 74 Hz, HorFreq: 128694 Hz
Monitor ranges (GTF): 56-75Hz V, 30-125kHz H, max dotclock 540MHz
Monitor name: LG ULTRAWIDE
Has 1 extension blocks
Checksum: 0xd7 (valid)

CTA extension block
Extension version: 3
18 bytes of CTA data
  Audio data block
    Linear PCM, max channels 2
      Supported sample rates (kHz): 48 44.1
      Supported sample sizes (bits): 24 20 16
  Video data block
    VIC  16 1920x1080@60Hz 16:9  HorFreq: 67500 Hz Clock: 148.500 MHz
    VIC   4 1280x720@60Hz 16:9  HorFreq: 45000 Hz Clock: 74.250 MHz
    VIC   3 720x480@60Hz 16:9  HorFreq: 31469 Hz Clock: 27.000 MHz
    VIC   1 640x480@60Hz 4:3  HorFreq: 31469 Hz Clock: 25.175 MHz
    VIC  31 1920x1080@50Hz 16:9  HorFreq: 56250 Hz Clock: 148.500 MHz
    VIC  19 1280x720@50Hz 16:9  HorFreq: 37500 Hz Clock: 74.250 MHz
    VIC  89 2560x1080@50Hz 64:27  HorFreq: 56250 Hz Clock: 185.625 MHz
    VIC 218 4096x2160@100Hz 256:135  HorFreq: 225000 Hz Clock: 1188.000 MHz
    VIC  18 720x576@50Hz 16:9  HorFreq: 31250 Hz Clock: 27.000 MHz
  Speaker allocation data block
    Speaker map:
      FL/FR - Front Left/Right
Basic audio support
Supports YCbCr 4:4:4
Supports YCbCr 4:2:2
1 native detailed modes
Detailed mode: Clock 208.000 MHz, 874 mm x 366 mm
               3840 3888 3920 4128 hborder 0
               1600 1607 1617 1680 vborder 0
               +hsync -vsync 
               VertFreq: 29 Hz, HorFreq: 50387 Hz
Detailed mode: Clock 429.800 MHz, 874 mm x 366 mm
               3440 3584 3680 3880 hborder 0
               1440 1448 1452 1476 vborder 0
               +hsync -vsync 
               VertFreq: 75 Hz, HorFreq: 110773 Hz
Detailed mode: Clock 319.750 MHz, 874 mm x 366 mm
               3440 3488 3520 3600 hborder 0
               1440 1443 1453 1481 vborder 0
               +hsync -vsync 
               VertFreq: 59 Hz, HorFreq: 88819 Hz
Checksum: 0x28 (valid)

EDID block does NOT conform to EDID 1.4!
	sRGB is signaled, but the chromaticities do not match
Warning: One or more of the timings is out of range of the Monitor Ranges:
  Vertical Freq: 29 - 100 Hz
  Horizontal Freq: 31250 - 225000 Hz
  Maximum Clock: 1188.000 MHz


