
EDID (hex):
00ffffffffffff0010ac13a054555631
02100103681e17782eb060a1584f9526
165054afce0001010101010101010101
01010101010164190040410026301888
360030e410000018000000fd00384c1e
3f08000a202020202020000000ff0044
43333633363141315655540a000000fc
0044454c4c204531353646500a2000bc

Extracted contents:
header:          00 ff ff ff ff ff ff 00
serial number:   10 ac 13 a0 54 55 56 31 02 10
version:         01 03
basic params:    68 1e 17 78 2e
chroma info:     b0 60 a1 58 4f 95 26 16 50 54
established:     af ce 00
standard:        01 01 01 01 01 01 01 01 01 01 01 01 01 01 01 01
descriptor 1:    64 19 00 40 41 00 26 30 18 88 36 00 30 e4 10 00 00 18
descriptor 2:    00 00 00 fd 00 38 4c 1e 3f 08 00 0a 20 20 20 20 20 20
descriptor 3:    00 00 00 ff 00 44 43 33 36 33 36 31 41 31 56 55 54 0a
descriptor 4:    00 00 00 fc 00 44 45 4c 4c 20 45 31 35 36 46 50 0a 20
extensions:      00
checksum:        bc

EDID version: 1.3
Manufacturer: DEL Model a013 Serial Number --
Made in week 2 of 2006
Analog display, Input voltage level: 0.7/0.7 V
Sync: Separate 
Maximum image size: 30 cm x 23 cm
Gamma: 2.20
DPMS levels: Off
RGB color display
Default (sRGB) color space is primary color space
First detailed timing is preferred timing
Display x,y Chromaticity:
  Red:   0.6308, 0.3466
  Green: 0.3085, 0.5820
  Blue:  0.1494, 0.0878
  White: 0.3125, 0.3281
Established timings supported:
  720x400@70Hz 9:5 HorFreq: 31469 Hz Clock: 28.320 MHz
  640x480@60Hz 4:3 HorFreq: 31469 Hz Clock: 25.175 MHz
  640x480@72Hz 4:3 HorFreq: 37900 Hz Clock: 31.500 MHz
  640x480@75Hz 4:3 HorFreq: 37500 Hz Clock: 31.500 MHz
  800x600@56Hz 4:3 HorFreq: 35200 Hz Clock: 36.000 MHz
  800x600@60Hz 4:3 HorFreq: 37900 Hz Clock: 40.000 MHz
  800x600@72Hz 4:3 HorFreq: 48100 Hz Clock: 50.000 MHz
  800x600@75Hz 4:3 HorFreq: 46900 Hz Clock: 49.500 MHz
  1024x768@60Hz 4:3 HorFreq: 48400 Hz Clock: 65.000 MHz
  1024x768@70Hz 4:3 HorFreq: 56500 Hz Clock: 75.000 MHz
  1024x768@75Hz 4:3 HorFreq: 60000 Hz Clock: 78.750 MHz
Standard timings supported:
Detailed mode: Clock 65.000 MHz, 304 mm x 228 mm
               1024 1048 1184 1344 hborder 0
                768  771  777  806 vborder 0
               -hsync -vsync 
               VertFreq: 60 Hz, HorFreq: 48363 Hz
Monitor ranges (GTF): 56-76Hz V, 30-63kHz H, max dotclock 80MHz
Serial number: --
Monitor name: DELL E156FP
Checksum: 0xbc (valid)
EDID block does NOT conform to EDID 1.3!
	sRGB is signaled, but the chromaticities do not match
