edid-decode (hex):

00 ff ff ff ff ff ff 00 10 ac 13 a0 4c 37 4a 30
0a 10 01 03 68 1e 17 78 2e b0 60 a1 58 4f 95 26
16 50 54 af ce 00 01 01 01 01 01 01 01 01 01 01
01 01 01 01 01 01 64 19 00 40 41 00 26 30 18 88
36 00 30 e4 10 00 00 18 00 00 00 fd 00 38 4c 1e
3f 08 00 0a 20 20 20 20 20 20 00 00 00 ff 00 59
39 39 39 38 36 33 41 30 4a 37 4c 0a 00 00 00 fc
00 44 45 4c 4c 20 45 31 35 36 46 50 0a 20 00 ff

00 ff ff ff ff ff ff 00 10 ac 13 a0 4c 37 4a 30
0a 10 01 03 68 1e 17 78 2e b0 60 a1 58 4f 95 26
16 50 54 af ce 00 01 01 01 01 01 01 01 01 01 01
01 01 01 01 01 01 64 19 00 40 41 00 26 30 18 88
36 00 30 e4 10 00 00 18 00 00 00 fd 00 38 4c 1e
3f 08 00 0a 20 20 20 20 20 20 00 00 00 ff 00 59
39 39 39 38 36 33 41 30 4a 37 4c 0a 00 00 00 fc
00 44 45 4c 4c 20 45 31 35 36 46 50 0a 20 00 ff

----------------

Block 0, Base EDID:
  EDID Structure Version & Revision: 1.3
  Vendor & Product Identification:
    Manufacturer: DEL
    Model: 40979
    Serial Number: ...
    Made in: week 10 of 2006
  Basic Display Parameters & Features:
    Analog display
    Signal Level Standard: 0.700 : 0.000 : 0.700 V p-p
    Blank level equals black level
    Sync: Separate
    Maximum image size: 30 cm x 23 cm
    Gamma: 2.20
    DPMS levels: Off
    RGB color display
    Default (sRGB) color space is primary color space
    First detailed timing is the preferred timing
  Color Characteristics:
    Red  : 0.6308, 0.3466
    Green: 0.3085, 0.5820
    Blue : 0.1494, 0.0878
    White: 0.3125, 0.3281
  Established Timings I & II:
    IBM     :   720x400    70.081663 Hz   9:5     31.467 kHz     28.320000 MHz
    DMT 0x04:   640x480    59.940476 Hz   4:3     31.469 kHz     25.175000 MHz
    DMT 0x05:   640x480    72.808802 Hz   4:3     37.861 kHz     31.500000 MHz
    DMT 0x06:   640x480    75.000000 Hz   4:3     37.500 kHz     31.500000 MHz
    DMT 0x08:   800x600    56.250000 Hz   4:3     35.156 kHz     36.000000 MHz
    DMT 0x09:   800x600    60.316541 Hz   4:3     37.879 kHz     40.000000 MHz
    DMT 0x0a:   800x600    72.187572 Hz   4:3     48.077 kHz     50.000000 MHz
    DMT 0x0b:   800x600    75.000000 Hz   4:3     46.875 kHz     49.500000 MHz
    DMT 0x10:  1024x768    60.003840 Hz   4:3     48.363 kHz     65.000000 MHz
    DMT 0x11:  1024x768    70.069359 Hz   4:3     56.476 kHz     75.000000 MHz
    DMT 0x12:  1024x768    75.028582 Hz   4:3     60.023 kHz     78.750000 MHz
  Standard Timings: none
  Detailed Timing Descriptors:
    DTD 1:  1024x768    60.003840 Hz   4:3     48.363 kHz     65.000000 MHz (304 mm x 228 mm)
                 Hfront   24 Hsync 136 Hback  160 Hpol N
                 Vfront    3 Vsync   6 Vback   29 Vpol N
    Display Range Limits:
      Monitor ranges (GTF): 56-76 Hz V, 30-63 kHz H, max dotclock 80 MHz
    Display Product Serial Number: ...
    Display Product Name: 'DELL E156FP'
Checksum: 0xff

----------------

Block 1, Unknown EDID Extension Block 0x00:
  00 ff ff ff ff ff ff 00 10 ac 13 a0 4c 37 4a 30 '............L7J0'
  0a 10 01 03 68 1e 17 78 2e b0 60 a1 58 4f 95 26 '....h..x..`.XO.&'
  16 50 54 af ce 00 01 01 01 01 01 01 01 01 01 01 '.PT.............'
  01 01 01 01 01 01 64 19 00 40 41 00 26 30 18 88 '......d..@A.&0..'
  36 00 30 e4 10 00 00 18 00 00 00 fd 00 38 4c 1e '6.0..........8L.'
  3f 08 00 0a 20 20 20 20 20 20 00 00 00 ff 00 59 '?...      .....Y'
  39 39 39 38 36 33 41 30 4a 37 4c 0a 00 00 00 fc '999863A0J7L.....'
  00 44 45 4c 4c 20 45 31 35 36 46 50 0a 20 00 ff '.DELL E156FP. ..'
Checksum: 0xff

----------------

Failures:

Block 0, Base EDID:
  Basic Display Parameters & Features: sRGB is signaled, but the chromaticities do not match.
Block 1, Base EDID:
  Unknown Extension Block.
EDID:
  Base EDID: EDID specified 0 extension block(s), but found 1 extension block(s).

EDID conformity: FAIL
