edid-decode (hex):

00 ff ff ff ff ff ff 00 30 e4 d8 06 00 00 00 00
00 1f 01 04 b5 22 13 78 07 ef 85 a3 54 4c 9e 26
0e 50 54 00 00 00 01 01 01 01 01 01 01 01 01 01
01 01 01 01 01 01 b9 9c 80 a0 70 38 59 40 30 20
35 00 58 c2 10 00 00 1a 00 00 00 fd 00 3c a5 c1
c1 29 01 0a 20 20 20 20 20 20 00 00 00 fe 00 4c
47 20 44 69 73 70 6c 61 79 0a 20 20 00 00 00 fe
00 4c 50 31 35 36 57 46 47 2d 53 50 54 33 00 35

----------------

Block 0, Base EDID:
  EDID Structure Version & Revision: 1.4
  Vendor & Product Identification:
    Manufacturer: LGD
    Model: 1752
    Made in: 2021
  Basic Display Parameters & Features:
    Digital display
    Bits per primary color channel: 10
    DisplayPort interface
    Maximum image size: 34 cm x 19 cm
    Gamma: 2.20
    Supported color formats: RGB 4:4:4
    Default (sRGB) color space is primary color space
    First detailed timing includes the native pixel format and preferred refresh rate
    Display is continuous frequency
  Color Characteristics:
    Red  : 0.6396, 0.3300
    Green: 0.2998, 0.6201
    Blue : 0.1503, 0.0546
    White: 0.3134, 0.3291
  Established Timings I & II: none
  Standard Timings: none
  Detailed Timing Descriptors:
    DTD 1:  1920x1080  165.003784 Hz  16:9    192.889 kHz    401.210000 MHz (344 mm x 194 mm)
                 Hfront   48 Hsync  32 Hback   80 Hpol P
                 Vfront    3 Vsync   5 Vback   81 Vpol N
    Display Range Limits:
      Monitor ranges (Bare Limits): 60-165 Hz V, 193-193 kHz H, max dotclock 410 MHz
    Alphanumeric Data String: 'LG Display'
    Alphanumeric Data String: 'LP156WFG-SPT3'
Checksum: 0x35

----------------

Warnings:

Block 0, Base EDID:
  Missing Display Product Name.

Failures:

Block 0, Base EDID:
  Basic Display Parameters & Features: sRGB is signaled, but the chromaticities do not match.

EDID conformity: FAIL
