
EDID (hex):
00ffffffffffff00410c2108eb200800
010f01030e1e1778eee925a2584e9325
165054bfee0001010101010101010101
01010101010164190040410026301888
360033e610000018000000ff00204358
20203533323731350a20000000fc0050
68696c69707320313530420a000000fd
00384c1e3f08000a20202020202000ee

Extracted contents:
header:          00 ff ff ff ff ff ff 00
serial number:   41 0c 21 08 eb 20 08 00 01 0f
version:         01 03
basic params:    0e 1e 17 78 ee
chroma info:     e9 25 a2 58 4e 93 25 16 50 54
established:     bf ee 00
standard:        01 01 01 01 01 01 01 01 01 01 01 01 01 01 01 01
descriptor 1:    64 19 00 40 41 00 26 30 18 88 36 00 33 e6 10 00 00 18
descriptor 2:    00 00 00 ff 00 20 43 58 20 20 35 33 32 37 31 35 0a 20
descriptor 3:    00 00 00 fc 00 50 68 69 6c 69 70 73 20 31 35 30 42 0a
descriptor 4:    00 00 00 fd 00 38 4c 1e 3f 08 00 0a 20 20 20 20 20 20
extensions:      00
checksum:        ee

EDID version: 1.3
Manufacturer: PHL Model 821 Serial Number --
Analog display, Input voltage level: 0.7/0.3 V
Sync: Separate Composite SyncOnGreen 
Maximum image size: 30 cm x 23 cm
Gamma: 2.20
DPMS levels: Standby Suspend Off
RGB color display
Default (sRGB) color space is primary color space
First detailed timing is preferred timing
Display x,y Chromaticity:
  Red:   0.6357, 0.3457
  Green: 0.3066, 0.5751
  Blue:  0.1445, 0.0878
  White: 0.3134, 0.3291
Established timings supported:
  720x400@70Hz 9:5 HorFreq: 31469 Hz Clock: 28.320 MHz
  640x480@60Hz 4:3 HorFreq: 31469 Hz Clock: 25.175 MHz
  640x480@67Hz 4:3 HorFreq: 35000 Hz Clock: 30.240 MHz
  640x480@72Hz 4:3 HorFreq: 37900 Hz Clock: 31.500 MHz
  640x480@75Hz 4:3 HorFreq: 37500 Hz Clock: 31.500 MHz
  800x600@56Hz 4:3 HorFreq: 35200 Hz Clock: 36.000 MHz
  800x600@60Hz 4:3 HorFreq: 37900 Hz Clock: 40.000 MHz
  800x600@72Hz 4:3 HorFreq: 48100 Hz Clock: 50.000 MHz
  800x600@75Hz 4:3 HorFreq: 46900 Hz Clock: 49.500 MHz
  832x624@75Hz 4:3 HorFreq: 49726 Hz Clock: 57.284 MHz
  1024x768@60Hz 4:3 HorFreq: 48400 Hz Clock: 65.000 MHz
  1024x768@70Hz 4:3 HorFreq: 56500 Hz Clock: 75.000 MHz
  1024x768@75Hz 4:3 HorFreq: 60000 Hz Clock: 78.750 MHz
Standard timings supported:
Detailed mode: Clock 65.000 MHz, 307 mm x 230 mm
               1024 1048 1184 1344 hborder 0
                768  771  777  806 vborder 0
               -hsync -vsync 
               VertFreq: 60 Hz, HorFreq: 48363 Hz
Serial number:  --  532715
Monitor name: Philips 150B
Monitor ranges (GTF): 56-76Hz V, 30-63kHz H, max dotclock 80MHz
Checksum: 0xee (valid)
EDID block does NOT conform to EDID 1.3!
	sRGB is signaled, but the chromaticities do not match
EDID block does not conform at all!
	Bad year of manufacture
