
EDID (hex):
00ffffffffffff000daec61300000000
191f0104a51d127803ee95a3544c9926
0f505400000001010101010101010101
010101010101743c80a070b028402e1e
a6001eb21000001a4d2880a070b02840
2e1ea6001eb21000001a000000000000
00000000000000000000000000000002
000c26ff143cc80c081ac80000000010

edid-decode (hex):

00 ff ff ff ff ff ff 00 0d ae c6 13 00 00 00 00
19 1f 01 04 a5 1d 12 78 03 ee 95 a3 54 4c 99 26
0f 50 54 00 00 00 01 01 01 01 01 01 01 01 01 01
01 01 01 01 01 01 74 3c 80 a0 70 b0 28 40 2e 1e
a6 00 1e b2 10 00 00 1a 4d 28 80 a0 70 b0 28 40
2e 1e a6 00 1e b2 10 00 00 1a 00 00 00 00 00 00
00 00 00 00 00 00 00 00 00 00 00 00 00 00 00 02
00 0c 26 ff 14 3c c8 0c 08 1a c8 00 00 00 00 10

----------------

Block 0, Base EDID:
  EDID Structure Version & Revision: 1.4
  Vendor & Product Identification:
    Manufacturer: CMN
    Model: 5062
    Made in: week 25 of 2021
  Basic Display Parameters & Features:
    Digital display
    Bits per primary color channel: 8
    DisplayPort interface
    Maximum image size: 29 cm x 18 cm
    Gamma: 2.20
    Supported color formats: RGB 4:4:4
    First detailed timing includes the native pixel format and preferred refresh rate
    Display is continuous frequency
  Color Characteristics:
    Red  : 0.6396, 0.3300
    Green: 0.2998, 0.5996
    Blue : 0.1503, 0.0595
    White: 0.3134, 0.3291
  Established Timings I & II: none
  Standard Timings: none
  Detailed Timing Descriptors:
    DTD 1:  1920x1200   60.003102 Hz  16:10    74.404 kHz    154.760000 MHz (286 mm x 178 mm)
                 Hfront   46 Hsync  30 Hback   84 Hpol P
                 Vfront   10 Vsync   6 Vback   24 Vpol N
    DTD 2:  1920x1200   40.000775 Hz  16:10    49.601 kHz    103.170000 MHz (286 mm x 178 mm)
                 Hfront   46 Hsync  30 Hback   84 Hpol P
                 Vfront   10 Vsync   6 Vback   24 Vpol N
    Empty Descriptor
    Manufacturer-Specified Display Descriptor (0x02): 00 02 00 0c 26 ff 14 3c c8 0c 08 1a c8 00 00 00 '....&..<........'
Checksum: 0x10
