edid-decode (hex):

00 ff ff ff ff ff ff 00 41 0c 8c c0 ac ca 00 00
10 16 01 03 80 2c 19 78 2a ba 21 a6 55 48 9a 27
13 50 54 bd 4a 00 a9 c0 01 01 01 01 01 01 01 01
01 01 01 01 01 01 30 2a 40 c8 60 84 64 30 18 50
13 00 bb f9 10 00 00 1e 00 00 00 ff 00 46 58 42
31 32 31 36 30 35 31 38 38 34 00 00 00 fc 00 50
68 69 6c 69 70 73 20 32 30 36 56 4c 00 00 00 fd
00 38 4c 1e 53 11 00 0a 20 20 20 20 20 20 00 3c

00 ff ff ff ff ff ff 00 41 0c 8c c0 ac ca 00 00
10 16 01 03 80 2c 19 78 2a ba 21 a6 55 48 9a 27
13 50 54 bd 4a 00 a9 c0 01 01 01 01 01 01 01 01
01 01 01 01 01 01 30 2a 40 c8 60 84 64 30 18 50
13 00 bb f9 10 00 00 1e 00 00 00 ff 00 46 58 42
31 32 31 36 30 35 31 38 38 34 00 00 00 fc 00 50
68 69 6c 69 70 73 20 32 30 36 56 4c 00 00 00 fd
00 38 4c 1e 53 11 00 0a 20 20 20 20 20 20 00 3c

----------------

Block 0, Base EDID:
  EDID Structure Version & Revision: 1.3
  Vendor & Product Identification:
    Manufacturer: PHL
    Model: 49292
    Serial Number: ...
    Made in: week 16 of 2012
  Basic Display Parameters & Features:
    Digital display
    Maximum image size: 44 cm x 25 cm
    Gamma: 2.20
    DPMS levels: Off
    RGB color display
    First detailed timing is the preferred timing
  Color Characteristics:
    Red  : 0.6503, 0.3349
    Green: 0.2832, 0.6035
    Blue : 0.1523, 0.0761
    White: 0.3125, 0.3291
  Established Timings I & II:
    IBM     :   720x400    70.081663 Hz   9:5     31.467 kHz     28.320000 MHz
    DMT 0x04:   640x480    59.940476 Hz   4:3     31.469 kHz     25.175000 MHz
    Apple   :   640x480    66.666667 Hz   4:3     35.000 kHz     30.240000 MHz
    DMT 0x05:   640x480    72.808802 Hz   4:3     37.861 kHz     31.500000 MHz
    DMT 0x06:   640x480    75.000000 Hz   4:3     37.500 kHz     31.500000 MHz
    DMT 0x09:   800x600    60.316541 Hz   4:3     37.879 kHz     40.000000 MHz
    DMT 0x0b:   800x600    75.000000 Hz   4:3     46.875 kHz     49.500000 MHz
    DMT 0x10:  1024x768    60.003840 Hz   4:3     48.363 kHz     65.000000 MHz
    DMT 0x12:  1024x768    75.028582 Hz   4:3     60.023 kHz     78.750000 MHz
  Standard Timings:
    DMT 0x53:  1600x900    60.000000 Hz  16:9     60.000 kHz    108.000000 MHz (RB)
  Detailed Timing Descriptors:
    DTD 1:  1600x900    60.000000 Hz  16:9     60.000 kHz    108.000000 MHz (443 mm x 249 mm)
                 Hfront   24 Hsync  80 Hback   96 Hpol P
                 Vfront    1 Vsync   3 Vback   96 Vpol P
    Display Product Serial Number: ...
    Display Product Name: 'Philips 206VL'
    Display Range Limits:
      Monitor ranges (GTF): 56-76 Hz V, 30-83 kHz H, max dotclock 170 MHz
Checksum: 0x3c

----------------

Block 1, Unknown EDID Extension Block 0x00:
  00 ff ff ff ff ff ff 00 41 0c 8c c0 ac ca 00 00 '........A.......'
  10 16 01 03 80 2c 19 78 2a ba 21 a6 55 48 9a 27 '.....,.x*.!.UH.''
  13 50 54 bd 4a 00 a9 c0 01 01 01 01 01 01 01 01 '.PT.J...........'
  01 01 01 01 01 01 30 2a 40 c8 60 84 64 30 18 50 '......0*@.`.d0.P'
  13 00 bb f9 10 00 00 1e 00 00 00 ff 00 46 58 42 '.............FXB'
  31 32 31 36 30 35 31 38 38 34 00 00 00 fc 00 50 '1216051884.....P'
  68 69 6c 69 70 73 20 32 30 36 56 4c 00 00 00 fd 'hilips 206VL....'
  00 38 4c 1e 53 11 00 0a 20 20 20 20 20 20 00 3c '.8L.S...      .<'
Checksum: 0x3c

----------------

Failures:

Block 1, Base EDID:
  Unknown Extension Block.
EDID:
  Base EDID: EDID specified 0 extension block(s), but found 1 extension block(s).

EDID conformity: FAIL
