
EDID (hex):
00ffffffffffff00410c8cc092cc0000
05160104a52c197822ba21a655489a27
135054bd4a00a9c00101010101010101
010101010101302a40c8608464301850
1300bbf91000001e000000ff00414632
31323034303532333730000000fc0050
68696c69707320323036564c000000fd
00384c1e5311000a2020202020200074

Extracted contents:
header:          00 ff ff ff ff ff ff 00
serial number:   41 0c 8c c0 92 cc 00 00 05 16
version:         01 04
basic params:    a5 2c 19 78 22
chroma info:     ba 21 a6 55 48 9a 27 13 50 54
established:     bd 4a 00
standard:        a9 c0 01 01 01 01 01 01 01 01 01 01 01 01 01 01
descriptor 1:    30 2a 40 c8 60 84 64 30 18 50 13 00 bb f9 10 00 00 1e
descriptor 2:    00 00 00 ff 00 41 46 32 31 32 30 34 30 35 32 33 37 30
descriptor 3:    00 00 00 fc 00 50 68 69 6c 69 70 73 20 32 30 36 56 4c
descriptor 4:    00 00 00 fd 00 38 4c 1e 53 11 00 0a 20 20 20 20 20 20
extensions:      00
checksum:        74

EDID version: 1.4
Manufacturer: PHL Model c08c Serial Number --
Made in week 5 of 2012
Digital display
8 bits per primary color channel
DisplayPort interface
Maximum image size: 44 cm x 25 cm
Gamma: 2.20
DPMS levels: Off
Supported color formats: RGB 4:4:4
First detailed timing includes the native pixel format and preferred refresh rate
Display x,y Chromaticity:
  Red:   0.6503, 0.3349
  Green: 0.2832, 0.6035
  Blue:  0.1523, 0.0761
  White: 0.3125, 0.3291
Established timings supported:
  720x400@70Hz 9:5 HorFreq: 31469 Hz Clock: 28.320 MHz
  640x480@60Hz 4:3 HorFreq: 31469 Hz Clock: 25.175 MHz
  640x480@67Hz 4:3 HorFreq: 35000 Hz Clock: 30.240 MHz
  640x480@72Hz 4:3 HorFreq: 37900 Hz Clock: 31.500 MHz
  640x480@75Hz 4:3 HorFreq: 37500 Hz Clock: 31.500 MHz
  800x600@60Hz 4:3 HorFreq: 37900 Hz Clock: 40.000 MHz
  800x600@75Hz 4:3 HorFreq: 46900 Hz Clock: 49.500 MHz
  1024x768@60Hz 4:3 HorFreq: 48400 Hz Clock: 65.000 MHz
  1024x768@75Hz 4:3 HorFreq: 60000 Hz Clock: 78.750 MHz
Standard timings supported:
  1600x900@60Hz 16:9
Detailed mode: Clock 108.000 MHz, 443 mm x 249 mm
               1600 1624 1704 1800 hborder 0
                900  901  904 1000 vborder 0
               +hsync +vsync 
               VertFreq: 60 Hz, HorFreq: 60000 Hz
Serial number: --
Monitor ranges (GTF): 56-76Hz V, 30-83kHz H, max dotclock 170MHz
Checksum: 0x74 (valid)
EDID block does NOT conform to EDID 1.4!
	Name descriptor not terminated with a newline
