edid-decode (hex):

00 ff ff ff ff ff ff 00 41 0c 50 46 20 02 60 86
00 10 01 03 80 29 1f 78 0a 31 83 a1 55 4a 95 24
17 4a 4d bf c0 00 31 d9 31 19 01 01 01 01 01 01
01 01 01 01 01 01 d8 09 80 a0 20 e0 2d 10 10 60
a2 00 98 32 11 00 00 18 00 00 00 fd 00 2f 4b 1f
2f 05 00 00 00 00 00 00 00 00 00 00 00 fc 00 50
48 4c 20 32 30 22 53 56 47 41 54 56 00 00 00 ff
00 00 00 00 00 00 00 00 00 00 00 00 00 00 01 17

02 03 08 01 43 01 02 91 d6 09 80 a0 20 e0 2d 10
08 60 22 00 12 8e 21 08 08 18 8c 0a d0 8a 20 e0
2d 10 10 3e 96 00 13 8e 21 00 00 18 8c 0a d0 90
20 40 31 20 0c 40 55 00 13 8e 21 00 00 18 00 00
00 00 00 00 00 00 00 00 00 00 00 00 00 00 00 00
00 00 00 00 00 00 00 00 00 00 00 00 00 00 00 00
00 00 00 00 00 00 00 00 00 00 00 00 00 00 00 00
00 00 00 00 00 00 00 00 00 00 00 00 00 00 00 5f

----------------

Block 0, Base EDID:
  EDID Structure Version & Revision: 1.3
  Vendor & Product Identification:
    Manufacturer: PHL
    Model: 18000
    Serial Number: ...
    Made in: 2006
  Basic Display Parameters & Features:
    Digital display
    Maximum image size: 41 cm x 31 cm
    Gamma: 2.20
    RGB color display
    First detailed timing is the preferred timing
  Color Characteristics:
    Red  : 0.6289, 0.3349
    Green: 0.2890, 0.5830
    Blue : 0.1425, 0.0898
    White: 0.2890, 0.3037
  Established Timings I & II:
    IBM     :   720x400    70.081663 Hz   9:5     31.467 kHz     28.320000 MHz
    DMT 0x04:   640x480    59.940476 Hz   4:3     31.469 kHz     25.175000 MHz
    Apple   :   640x480    66.666667 Hz   4:3     35.000 kHz     30.240000 MHz
    DMT 0x05:   640x480    72.808802 Hz   4:3     37.861 kHz     31.500000 MHz
    DMT 0x06:   640x480    75.000000 Hz   4:3     37.500 kHz     31.500000 MHz
    DMT 0x08:   800x600    56.250000 Hz   4:3     35.156 kHz     36.000000 MHz
    DMT 0x09:   800x600    60.316541 Hz   4:3     37.879 kHz     40.000000 MHz
    DMT 0x0a:   800x600    72.187572 Hz   4:3     48.077 kHz     50.000000 MHz
    DMT 0x0b:   800x600    75.000000 Hz   4:3     46.875 kHz     49.500000 MHz
  Standard Timings:
    GTF     :   640x360    85.000000 Hz  16:9     32.215 kHz     25.772000 MHz
    DMT 0x02:   640x400    85.079948 Hz  16:10    37.861 kHz     31.500000 MHz
  Detailed Timing Descriptors:
    DTD 1:   640x480    60.000000 Hz   4:3     31.500 kHz     25.200000 MHz (408 mm x 306 mm)
                 Hfront   16 Hsync  96 Hback   48 Hpol N
                 Vfront   10 Vsync   2 Vback   33 Vpol N
    Display Range Limits:
      Monitor ranges (GTF): 47-75 Hz V, 31-47 kHz H, max dotclock 50 MHz
    Display Product Name: 'PHL 20"SVGATV'
    Display Product Serial Number: ...
  Extension blocks: 1
Checksum: 0x17

----------------

Block 1, CTA-861 Extension Block:
  Revision: 3
  Native detailed modes: 1
  Video Data Block:
    VIC   1:   640x480    59.940476 Hz   4:3     31.469 kHz     25.175000 MHz
    VIC   2:   720x480    59.940060 Hz   4:3     31.469 kHz     27.000000 MHz
    VIC  17:   720x576    50.000000 Hz   4:3     31.250 kHz     27.000000 MHz (native)
  Detailed Timing Descriptors:
    DTD 2:   640x480    59.952381 Hz   4:3     31.475 kHz     25.180000 MHz (530 mm x 398 mm)
                 Hfront    8 Hsync  96 Hback   40 Hpol N Hborder 8
                 Vfront    2 Vsync   2 Vback   25 Vpol N Vborder 8
    DTD 3:   720x480    59.940060 Hz   3:2     31.469 kHz     27.000000 MHz (531 mm x 398 mm)
                 Hfront   16 Hsync  62 Hback   60 Hpol N
                 Vfront    9 Vsync   6 Vback   30 Vpol N
    DTD 4:   720x576    50.000000 Hz   5:4     31.250 kHz     27.000000 MHz (531 mm x 398 mm)
                 Hfront   12 Hsync  64 Hback   68 Hpol N
                 Vfront    5 Vsync   5 Vback   39 Vpol N
Checksum: 0x5f

----------------

Warnings:

Block 1, CTA-861 Extension Block:
  IT Video Formats are overscanned by default, but normally this should be underscanned.
  Detailed Timing Descriptor #2: The use of non-zero borders in a DTD is not recommended.
  Display Product Serial Number is set, so the Serial Number in the Base EDID should be 0.

Failures:

Block 0, Base EDID:
  Display Range Limits: Byte 11 is 0x00 instead of 0x0a.
  Display Range Limits: Bytes 12-17 must be 0x20.
  Display Product Serial Number: ...
Block 1, CTA-861 Extension Block:
  Detailed Timing Descriptor #2: Mismatch of image size 530x398 mm vs display size 410x310 mm.
  Detailed Timing Descriptor #3: Mismatch of image size 531x398 mm vs display size 410x310 mm.
  Detailed Timing Descriptor #4: Mismatch of image size 531x398 mm vs display size 410x310 mm.
  Missing VCDB, needed for Set Selectable RGB Quantization to avoid interop issues.
EDID:
  Base EDID: Some timings are out of range of the Monitor Ranges:
    Vertical Freq: 50.000 - 85.080 Hz (Monitor: 47.000 - 75.000 Hz)
    Horizontal Freq: 31.250 - 48.076 kHz (Monitor: 31.000 - 47.000 kHz)
    Maximum Clock: 50.000 MHz (Monitor: 50.000 MHz)
  CTA-861: Native progressive timings are a mix of several resolutions.

EDID conformity: FAIL
