
EDID (hex):
00ffffffffffff0006b35135e51d0100
1d1d0104a55223783b62f5aa524ca326
0f5054bfcf00d1c0b300950081808140
81c0714f01014ed470a0d0a046502030
3a00335a3100001ae77c70a0d0a02950
20303a00335a3100001e000000fd0030
64979737010a202020202020000000fc
00415355532058473335560a20200154
02031af14d010304131f120211900f0e
1d1e23090707830100001ab370a0d0a0
3b5020303a00335a3100001a539d70a0
d0a0345020303a00335a3100001a0000
00000000000000000000000000000000
00000000000000000000000000000000
00000000000000000000000000000000
0000000000000000000000000000000e

Extracted contents:
header:          00 ff ff ff ff ff ff 00
serial number:   06 b3 51 35 e5 1d 01 00 1d 1d
version:         01 04
basic params:    a5 52 23 78 3b
chroma info:     62 f5 aa 52 4c a3 26 0f 50 54
established:     bf cf 00
standard:        d1 c0 b3 00 95 00 81 80 81 40 81 c0 71 4f 01 01
descriptor 1:    4e d4 70 a0 d0 a0 46 50 20 30 3a 00 33 5a 31 00 00 1a
descriptor 2:    e7 7c 70 a0 d0 a0 29 50 20 30 3a 00 33 5a 31 00 00 1e
descriptor 3:    00 00 00 fd 00 30 64 97 97 37 01 0a 20 20 20 20 20 20
descriptor 4:    00 00 00 fc 00 41 53 55 53 20 58 47 33 35 56 0a 20 20
extensions:      01
checksum:        54

EDID version: 1.4
Manufacturer: AUS Model 3551 Serial Number --
Made in week 29 of 2019
Digital display
8 bits per primary color channel
DisplayPort interface
Maximum image size: 82 cm x 35 cm
Gamma: 2.20
DPMS levels: Off
Supported color formats: RGB 4:4:4, YCrCb 4:4:4, YCrCb 4:2:2
First detailed timing includes the native pixel format and preferred refresh rate
Display is continuous frequency
Display x,y Chromaticity:
  Red:   0.6650, 0.3222
  Green: 0.2968, 0.6386
  Blue:  0.1513, 0.0615
  White: 0.3134, 0.3291
Established timings supported:
  720x400@70Hz 9:5 HorFreq: 31469 Hz Clock: 28.320 MHz
  640x480@60Hz 4:3 HorFreq: 31469 Hz Clock: 25.175 MHz
  640x480@67Hz 4:3 HorFreq: 35000 Hz Clock: 30.240 MHz
  640x480@72Hz 4:3 HorFreq: 37900 Hz Clock: 31.500 MHz
  640x480@75Hz 4:3 HorFreq: 37500 Hz Clock: 31.500 MHz
  800x600@56Hz 4:3 HorFreq: 35200 Hz Clock: 36.000 MHz
  800x600@60Hz 4:3 HorFreq: 37900 Hz Clock: 40.000 MHz
  800x600@72Hz 4:3 HorFreq: 48100 Hz Clock: 50.000 MHz
  800x600@75Hz 4:3 HorFreq: 46900 Hz Clock: 49.500 MHz
  1024x768@60Hz 4:3 HorFreq: 48400 Hz Clock: 65.000 MHz
  1024x768@70Hz 4:3 HorFreq: 56500 Hz Clock: 75.000 MHz
  1024x768@75Hz 4:3 HorFreq: 60000 Hz Clock: 78.750 MHz
  1280x1024@75Hz 5:4 HorFreq: 80000 Hz Clock: 135.000 MHz
Standard timings supported:
  1920x1080@60Hz 16:9
  1680x1050@60Hz 16:10 HorFreq: 64700 Hz Clock: 119.000 MHz
  1440x900@60Hz 16:10 HorFreq: 55500 Hz Clock: 88.750 MHz
  1280x1024@60Hz 5:4 HorFreq: 64000 Hz Clock: 108.000 MHz
  1280x960@60Hz 4:3 HorFreq: 60000 Hz Clock: 108.000 MHz
  1280x720@60Hz 16:9
  1152x864@75Hz 4:3 HorFreq: 67500 Hz Clock: 108.000 MHz
Detailed mode: Clock 543.500 MHz, 819 mm x 346 mm
               3440 3472 3520 3600 hborder 0
               1440 1443 1453 1510 vborder 0
               +hsync -vsync 
               VertFreq: 99 Hz, HorFreq: 150972 Hz
Detailed mode: Clock 319.750 MHz, 819 mm x 346 mm
               3440 3472 3520 3600 hborder 0
               1440 1443 1453 1481 vborder 0
               +hsync +vsync 
               VertFreq: 59 Hz, HorFreq: 88819 Hz
Monitor ranges (bare limits): 48-100Hz V, 151-151kHz H, max dotclock 550MHz
Monitor name: ASUS XG35V
Has 1 extension blocks
Checksum: 0x54 (valid)

CTA extension block
Extension version: 3
22 bytes of CTA data
  Video data block
    VIC   1 640x480@60Hz 4:3  HorFreq: 31469 Hz Clock: 25.175 MHz
    VIC   3 720x480@60Hz 16:9  HorFreq: 31469 Hz Clock: 27.000 MHz
    VIC   4 1280x720@60Hz 16:9  HorFreq: 45000 Hz Clock: 74.250 MHz
    VIC  19 1280x720@50Hz 16:9  HorFreq: 37500 Hz Clock: 74.250 MHz
    VIC  31 1920x1080@50Hz 16:9  HorFreq: 56250 Hz Clock: 148.500 MHz
    VIC  18 720x576@50Hz 16:9  HorFreq: 31250 Hz Clock: 27.000 MHz
    VIC   2 720x480@60Hz 4:3  HorFreq: 31469 Hz Clock: 27.000 MHz
    VIC  17 720x576@50Hz 4:3  HorFreq: 31250 Hz Clock: 27.000 MHz
    VIC  16 1920x1080@60Hz 16:9 (native) HorFreq: 67500 Hz Clock: 148.500 MHz
    VIC  15 1440x480@60Hz 16:9  HorFreq: 31469 Hz Clock: 54.000 MHz
    VIC  14 1440x480@60Hz 4:3  HorFreq: 31469 Hz Clock: 54.000 MHz
    VIC  29 1440x576@50Hz 4:3  HorFreq: 31250 Hz Clock: 54.000 MHz
    VIC  30 1440x576@50Hz 16:9  HorFreq: 31250 Hz Clock: 54.000 MHz
  Audio data block
    Linear PCM, max channels 2
      Supported sample rates (kHz): 48 44.1 32
      Supported sample sizes (bits): 24 20 16
  Speaker allocation data block
    Speaker map:
      FL/FR - Front Left/Right
Underscans PC formats by default
Basic audio support
Supports YCbCr 4:4:4
Supports YCbCr 4:2:2
1 native detailed modes
Detailed mode: Clock 458.500 MHz, 819 mm x 346 mm
               3440 3472 3520 3600 hborder 0
               1440 1443 1453 1499 vborder 0
               +hsync -vsync 
               VertFreq: 84 Hz, HorFreq: 127361 Hz
Detailed mode: Clock 402.750 MHz, 819 mm x 346 mm
               3440 3472 3520 3600 hborder 0
               1440 1443 1453 1492 vborder 0
               +hsync -vsync 
               VertFreq: 74 Hz, HorFreq: 111875 Hz
Checksum: 0xe (valid)

Warning: One or more of the timings is out of range of the Monitor Ranges:
  Vertical Freq: 50 - 99 Hz
  Horizontal Freq: 31250 - 150972 Hz
  Maximum Clock: 543.500 MHz
