edid-decode (hex):

00 ff ff ff ff ff ff 00 30 e4 97 04 00 00 00 00
00 19 01 04 95 4f 00 78 02 5d a5 98 5c 55 8f 27
1b 50 54 00 00 00 01 01 01 01 01 01 01 01 01 01
01 01 01 01 01 01 ce 1d 56 f4 50 00 16 30 30 20
35 00 00 90 10 00 00 1b df 13 56 f4 50 00 16 30
30 20 35 00 00 90 10 00 00 1b 00 00 00 00 00 00
00 00 00 00 00 00 00 00 00 00 00 00 00 00 00 02
00 0c 44 ad 0a 3c 4b 19 0e 11 6e 00 00 00 00 b8

----------------

Block 0, Base EDID:
  EDID Structure Version & Revision: 1.4
  Vendor & Product Identification:
    Manufacturer: LGD
    Model: 1175
    Made in: 2015
  Basic Display Parameters & Features:
    Digital display
    Bits per primary color channel: 6
    DisplayPort interface
    Aspect ratio: 1.78 (landscape)
    Gamma: 2.20
    Supported color formats: RGB 4:4:4
    First detailed timing includes the native pixel format and preferred refresh rate
  Color Characteristics:
    Red  : 0.5947, 0.3603
    Green: 0.3349, 0.5595
    Blue : 0.1542, 0.1074
    White: 0.3134, 0.3291
  Established Timings I & II: none
  Standard Timings: none
  Detailed Timing Descriptors:
    DTD 1:  1366x768    59.988993 Hz 683:384   47.391 kHz     76.300000 MHz (256 mm x 144 mm)
                 Hfront   48 Hsync  32 Hback  164 Hpol P
                 Vfront    3 Vsync   5 Vback   14 Vpol N
    DTD 2:  1366x768    39.995283 Hz 683:384   31.596 kHz     50.870000 MHz (256 mm x 144 mm)
                 Hfront   48 Hsync  32 Hback  164 Hpol P
                 Vfront    3 Vsync   5 Vback   14 Vpol N
    Empty Descriptor
    Manufacturer-Specified Display Descriptor (0x02): 00 02 00 0c 44 ad 0a 3c 4b 19 0e 11 6e 00 00 00 '....D..<K...n...'
Checksum: 0xb8

----------------

Failures:

Block 0, Base EDID:
  Empty Descriptor: Use Dummy Descriptor instead of all zeroes.
  Missing Display Product Name.
EDID:
  Base EDID: The DTD max image size is 256x144mm, but the display size is not specified anywhere.

EDID conformity: FAIL
