edid-decode (hex):

00 ff ff ff ff ff ff 00 0d ae c0 14 00 00 00 00
14 19 01 04 95 1f 11 78 02 37 45 9e 55 53 92 29
12 50 54 00 00 00 01 01 01 01 01 01 01 01 01 01
01 01 01 01 01 01 b4 3b 80 4a 71 38 34 40 50 3c
68 00 34 ad 10 00 00 1a cd 27 80 4a 71 38 34 40
50 3c 68 00 34 ad 10 00 00 1a 00 00 00 00 00 00
00 00 00 00 00 00 00 00 00 00 00 00 00 00 00 02
00 0c 33 ff 0f 3c 96 10 0d 22 96 00 00 00 00 1e

----------------

Block 0, Base EDID:
  EDID Structure Version & Revision: 1.4
  Vendor & Product Identification:
    Manufacturer: CMN
    Model: 5312
    Made in: week 20 of 2015
  Basic Display Parameters & Features:
    Digital display
    Bits per primary color channel: 6
    DisplayPort interface
    Maximum image size: 31 cm x 17 cm
    Gamma: 2.20
    Supported color formats: RGB 4:4:4
    First detailed timing includes the native pixel format and preferred refresh rate
  Color Characteristics:
    Red  : 0.6171, 0.3349
    Green: 0.3251, 0.5732
    Blue : 0.1611, 0.0703
    White: 0.3134, 0.3291
  Established Timings I & II: none
  Standard Timings: none
  Detailed Timing Descriptors:
    DTD 1:  1920x1080   60.008 Hz  16:9    67.929 kHz 152.840 MHz (308 mm x 173 mm)
                 Hfront   80 Hsync  60 Hback 190 Hpol P
                 Vfront    6 Vsync   8 Vback  38 Vpol N
    DTD 2:  1920x1080   40.004 Hz  16:9    45.284 kHz 101.890 MHz (308 mm x 173 mm)
                 Hfront   80 Hsync  60 Hback 190 Hpol P
                 Vfront    6 Vsync   8 Vback  38 Vpol N
    Empty Descriptor
    Manufacturer-Specified Display Descriptor (0x02): 00 02 00 0c 33 ff 0f 3c 96 10 0d 22 96 00 00 00 '....3..<..."....'
Checksum: 0x1e
