edid-decode (hex):

00 ff ff ff ff ff ff 00 32 0c 00 a9 00 00 00 00
00 10 01 03 80 21 15 78 0a 0f 10 97 58 52 88 28
23 50 54 00 00 00 01 01 01 01 01 01 01 01 01 01
01 01 01 01 01 01 39 1c 00 a0 50 20 17 30 30 20
26 00 4b cf 10 00 00 19 39 1c 00 a0 50 20 17 30
30 20 26 00 4b cf 10 00 00 00 00 00 00 fe 00 43
44 35 31 36 02 31 35 34 57 30 31 0a 00 00 00 fe
00 2e 3e 4c 57 7a b5 e8 ff 01 01 0a 20 20 00 4d

----------------

Block 0, Base EDID:
  EDID Structure Version & Revision: 1.3
  Vendor & Product Identification:
    Manufacturer: LPL
    Model: 43264
    Made in: 2006
  Basic Display Parameters & Features:
    Digital display
    Maximum image size: 33 cm x 21 cm
    Gamma: 2.20
    RGB color display
    First detailed timing is the preferred timing
  Color Characteristics:
    Red  : 0.5898, 0.3437
    Green: 0.3232, 0.5341
    Blue : 0.1562, 0.1376
    White: 0.3125, 0.3281
  Established Timings I & II: none
  Standard Timings: none
  Detailed Timing Descriptors:
    DTD 1:  1280x800    60.964291 Hz  16:10    50.174 kHz     72.250000 MHz (DE timing only, 331 mm x 207 mm)
                 Hfront   48 Hsync  32 Hback   80 Hpol N
                 Vfront    2 Vsync   6 Vback   15 Vpol N
    DTD 2:  1280x800    60.964291 Hz  16:10    50.174 kHz     72.250000 MHz (DE timing only, 331 mm x 207 mm)
                 Hfront   48 Hsync  32 Hback   80 Hpol N
                 Vfront    2 Vsync   6 Vback   15 Vpol N
    SPWG Module Revision: 0
    SPWG Descriptor #3:
      SPWG PC Maker P/N: 'CD516'
      SPWG LCD Supplier EEDID Revision: 2
      SPWG Manufacturer P/N: '154W01'
    SPWG Descriptor #4:
      SMBUS Values: 0x2e 0x3e 0x4c 0x57 0x7a 0xb5 0xe8 0xff
      LVDS Channels: 1
      Panel Self Test Present
Checksum: 0x4d

----------------

Failures:

Block 0, Base EDID:
  Missing Display Product Name.
  Missing Display Range Limits Descriptor.

EDID conformity: FAIL
