
EDID (hex):
00ffffffffffff002264692401010101
1c130103802f1e78eedc55a359489e24
115054bfef80714fa9409040904f8180
81400101010121399030621a1c4068b0
3600da291100001c000000fd00384c18
5e15000a202020202020000000ff0039
32384d4a3358593133363438000000fc
0048616e6e732e472048693232310019

Extracted contents:
header:          00 ff ff ff ff ff ff 00
serial number:   22 64 69 24 01 01 01 01 1c 13
version:         01 03
basic params:    80 2f 1e 78 ee
chroma info:     dc 55 a3 59 48 9e 24 11 50 54
established:     bf ef 80
standard:        71 4f a9 40 90 40 90 4f 81 80 81 40 01 01 01 01
descriptor 1:    21 39 90 30 62 1a 1c 40 68 b0 36 00 da 29 11 00 00 1c
descriptor 2:    00 00 00 fd 00 38 4c 18 5e 15 00 0a 20 20 20 20 20 20
descriptor 3:    00 00 00 ff 00 39 32 38 4d 4a 33 58 59 31 33 36 34 38
descriptor 4:    00 00 00 fc 00 48 61 6e 6e 73 2e 47 20 48 69 32 32 31
extensions:      00
checksum:        19

EDID version: 1.3
Manufacturer: HSD Model 2469 Serial Number --
Made in week 28 of 2009
Digital display
Maximum image size: 47 cm x 30 cm
Gamma: 2.20
DPMS levels: Standby Suspend Off
RGB color display
Default (sRGB) color space is primary color space
First detailed timing is preferred timing
Display x,y Chromaticity:
  Red:   0.6396, 0.3486
  Green: 0.2841, 0.6171
  Blue:  0.1416, 0.0673
  White: 0.3134, 0.3291
Established timings supported:
  720x400@70Hz 9:5 HorFreq: 31469 Hz Clock: 28.320 MHz
  640x480@60Hz 4:3 HorFreq: 31469 Hz Clock: 25.175 MHz
  640x480@67Hz 4:3 HorFreq: 35000 Hz Clock: 30.240 MHz
  640x480@72Hz 4:3 HorFreq: 37900 Hz Clock: 31.500 MHz
  640x480@75Hz 4:3 HorFreq: 37500 Hz Clock: 31.500 MHz
  800x600@56Hz 4:3 HorFreq: 35200 Hz Clock: 36.000 MHz
  800x600@60Hz 4:3 HorFreq: 37900 Hz Clock: 40.000 MHz
  800x600@72Hz 4:3 HorFreq: 48100 Hz Clock: 50.000 MHz
  800x600@75Hz 4:3 HorFreq: 46900 Hz Clock: 49.500 MHz
  832x624@75Hz 4:3 HorFreq: 49726 Hz Clock: 57.284 MHz
  1024x768@60Hz 4:3 HorFreq: 48400 Hz Clock: 65.000 MHz
  1024x768@70Hz 4:3 HorFreq: 56500 Hz Clock: 75.000 MHz
  1024x768@75Hz 4:3 HorFreq: 60000 Hz Clock: 78.750 MHz
  1280x1024@75Hz 5:4 HorFreq: 80000 Hz Clock: 135.000 MHz
  1152x870@75Hz 192:145 HorFreq: 67500 Hz Clock: 108.000 MHz
Standard timings supported:
  1152x864@75Hz 4:3 HorFreq: 67500 Hz Clock: 108.000 MHz
  1600x1200@60Hz 4:3 HorFreq: 75000 Hz Clock: 162.000 MHz
  1400x1050@60Hz 4:3 HorFreq: 64700 Hz Clock: 101.000 MHz
  1400x1050@75Hz 4:3 HorFreq: 82300 Hz Clock: 156.000 MHz
  1280x1024@60Hz 5:4 HorFreq: 64000 Hz Clock: 108.000 MHz
  1280x960@60Hz 4:3 HorFreq: 60000 Hz Clock: 108.000 MHz
Detailed mode: Clock 146.250 MHz, 474 mm x 297 mm
               1680 1784 1960 2240 hborder 0
               1050 1053 1059 1078 vborder 0
               -hsync +vsync 
               VertFreq: 60 Hz, HorFreq: 65290 Hz
Monitor ranges (GTF): 56-76Hz V, 24-94kHz H, max dotclock 210MHz
Serial number: --
Checksum: 0x19 (valid)
EDID block does NOT conform to EDID 1.3!
	sRGB is signaled, but the chromaticities do not match
	Name descriptor not terminated with a newline
