
EDID (hex):
00ffffffffffff004c835a4100000000
00190104a51d10780a9155a457519e26
13505400000001010101010101010101
010101010101238d8074c00810703020
250025a510000019238d80e0c108f570
3020250025a510000019000000000000
00000000000000000000000000000002
000c33ff0f3c96280b1b96000000006e

Extracted contents:
header:          00 ff ff ff ff ff ff 00
serial number:   4c 83 5a 41 00 00 00 00 00 19
version:         01 04
basic params:    a5 1d 10 78 0a
chroma info:     91 55 a4 57 51 9e 26 13 50 54
established:     00 00 00
standard:        01 01 01 01 01 01 01 01 01 01 01 01 01 01 01 01
descriptor 1:    23 8d 80 74 c0 08 10 70 30 20 25 00 25 a5 10 00 00 19
descriptor 2:    23 8d 80 e0 c1 08 f5 70 30 20 25 00 25 a5 10 00 00 19
descriptor 3:    00 00 00 00 00 00 00 00 00 00 00 00 00 00 00 00 00 00
descriptor 4:    00 00 00 02 00 0c 33 ff 0f 3c 96 28 0b 1b 96 00 00 00
extensions:      00
checksum:        6e

EDID version: 1.4
Manufacturer: SDC Model 415a Serial Number --
Made in year 2015
Digital display
8 bits per primary color channel
DisplayPort interface
Maximum image size: 29 cm x 16 cm
Gamma: 2.20
Supported color formats: RGB 4:4:4, YCrCb 4:4:4
First detailed timing includes the native pixel format and preferred refresh rate
Display x,y Chromaticity:
  Red:   0.6425, 0.3408
  Green: 0.3164, 0.6181
  Blue:  0.1494, 0.0751
  White: 0.3134, 0.3291
Established timings supported:
Standard timings supported:
Detailed mode: Clock 361.310 MHz, 293 mm x 165 mm
               3200 3248 3280 3316 hborder 0
               1800 1802 1807 1816 vborder 0
               -hsync -vsync 
               VertFreq: 59 Hz, HorFreq: 108959 Hz
Detailed mode: Clock 361.310 MHz, 293 mm x 165 mm
               3200 3248 3280 3680 hborder 0
               1800 1802 1807 2045 vborder 0
               -hsync -vsync 
               VertFreq: 48 Hz, HorFreq: 98182 Hz
Manufacturer-specified data, tag 0
Manufacturer-specified data, tag 2
Checksum: 0x6e (valid)
EDID block does NOT conform to EDID 1.4!
	Missing name descriptor
	Missing monitor ranges
