
EDID (hex):
00ffffffffffff0006af361200000000
001a0104a51f117802d1e5a4554e9d26
12505400000001010101010101010101
0101010101011c6100c8a0a03c502820
aa0035ae1000001ab04d00c8a0a03c50
2820aa0035ae1000001a000000fe0035
36345258804231343051414e00000000
00028102a8001100000b010a20200063

Extracted contents:
header:          00 ff ff ff ff ff ff 00
serial number:   06 af 36 12 00 00 00 00 00 1a
version:         01 04
basic params:    a5 1f 11 78 02
chroma info:     d1 e5 a4 55 4e 9d 26 12 50 54
established:     00 00 00
standard:        01 01 01 01 01 01 01 01 01 01 01 01 01 01 01 01
descriptor 1:    1c 61 00 c8 a0 a0 3c 50 28 20 aa 00 35 ae 10 00 00 1a
descriptor 2:    b0 4d 00 c8 a0 a0 3c 50 28 20 aa 00 35 ae 10 00 00 1a
descriptor 3:    00 00 00 fe 00 35 36 34 52 58 80 42 31 34 30 51 41 4e
descriptor 4:    00 00 00 00 00 02 81 02 a8 00 11 00 00 0b 01 0a 20 20
extensions:      00
checksum:        63

EDID version: 1.4
Manufacturer: AUO Model 1236 Serial Number --
Made in year 2016
Digital display
8 bits per primary color channel
DisplayPort interface
Maximum image size: 31 cm x 17 cm
Gamma: 2.20
Supported color formats: RGB 4:4:4
First detailed timing includes the native pixel format and preferred refresh rate
Display x,y Chromaticity:
  Red:   0.6435, 0.3330
  Green: 0.3046, 0.6142
  Blue:  0.1513, 0.0722
  White: 0.3134, 0.3291
Established timings supported:
Standard timings supported:
Detailed mode: Clock 248.600 MHz, 309 mm x 174 mm
               2560 2600 2632 2760 hborder 0
               1440 1450 1460 1500 vborder 0
               +hsync -vsync 
               VertFreq: 60 Hz, HorFreq: 90072 Hz
Detailed mode: Clock 198.880 MHz, 309 mm x 174 mm
               2560 2600 2632 2760 hborder 0
               1440 1450 1460 1500 vborder 0
               +hsync -vsync 
               VertFreq: 48 Hz, HorFreq: 72057 Hz
ASCII string: 564RX
Manufacturer-specified data, tag 0
Checksum: 0x63 (valid)
EDID block does NOT conform to EDID 1.4!
	Missing name descriptor
	Missing monitor ranges
	Detailed block string not properly terminated
