
EDID (hex):
00ffffffffffff0009e5120c00000000
0a210104951f117803f8459657549228
23505400000001010101010101010101
0101010101014b1c56a2500016303020
350035ae1000001add1256a250001630
3020350035ae1000001a000000fe0042
4f452043510a202020202020000000fe
004e5431343057484d2d4e34340a0085

edid-decode (hex):

00 ff ff ff ff ff ff 00 09 e5 12 0c 00 00 00 00
0a 21 01 04 95 1f 11 78 03 f8 45 96 57 54 92 28
23 50 54 00 00 00 01 01 01 01 01 01 01 01 01 01
01 01 01 01 01 01 4b 1c 56 a2 50 00 16 30 30 20
35 00 35 ae 10 00 00 1a dd 12 56 a2 50 00 16 30
30 20 35 00 35 ae 10 00 00 1a 00 00 00 fe 00 42
4f 45 20 43 51 0a 20 20 20 20 20 20 00 00 00 fe
00 4e 54 31 34 30 57 48 4d 2d 4e 34 34 0a 00 85

----------------

Block 0, Base EDID:
  EDID Structure Version & Revision: 1.4
  Vendor & Product Identification:
    Manufacturer: BOE
    Model: 3090
    Made in: week 10 of 2023
  Basic Display Parameters & Features:
    Digital display
    Bits per primary color channel: 6
    DisplayPort interface
    Maximum image size: 31 cm x 17 cm
    Gamma: 2.20
    Supported color formats: RGB 4:4:4
    First detailed timing includes the native pixel format and preferred refresh rate
    Display is continuous frequency
  Color Characteristics:
    Red  : 0.5888, 0.3427
    Green: 0.3300, 0.5703
    Blue : 0.1572, 0.1367
    White: 0.3134, 0.3291
  Established Timings I & II: none
  Standard Timings: none
  Detailed Timing Descriptors:
    DTD 1:  1366x768    60.002320 Hz 683:384   47.402 kHz     72.430000 MHz (309 mm x 174 mm)
                 Hfront   48 Hsync  32 Hback   82 Hpol P
                 Vfront    3 Vsync   5 Vback   14 Vpol N
    DTD 2:  1366x768    40.004308 Hz 683:384   31.603 kHz     48.290000 MHz (309 mm x 174 mm)
                 Hfront   48 Hsync  32 Hback   82 Hpol P
                 Vfront    3 Vsync   5 Vback   14 Vpol N
    Alphanumeric Data String: 'BOE CQ'
    Alphanumeric Data String: 'NT140WHM-N44'
Checksum: 0x85
