edid-decode (hex):

00 ff ff ff ff ff ff 00 30 ae 0b 24 01 01 01 01
25 12 01 03 68 22 1b 78 2a 5d d0 a6 54 4c 0f 23
14 50 54 ad cf 00 81 80 81 8a 31 46 01 01 01 01
01 01 01 01 01 01 bc 34 00 98 51 00 2a 40 10 90
13 00 54 0e 11 00 00 1e 00 00 00 fd 00 37 4b 1e
53 0e 00 0a 20 20 20 20 20 20 00 00 00 ff 00 56
31 4c 41 56 31 32 0a 20 20 20 20 20 00 00 00 fc
00 4c 45 4e 20 4c 31 37 34 0a 20 20 20 20 00 db

00 ff ff ff ff ff ff 00 30 ae 0b 24 01 01 01 01
25 12 01 03 68 22 1b 78 2a 5d d0 a6 54 4c 0f 23
14 50 54 ad cf 00 81 80 81 8a 31 46 01 01 01 01
01 01 01 01 01 01 bc 34 00 98 51 00 2a 40 10 90
13 00 54 0e 11 00 00 1e 00 00 00 fd 00 37 4b 1e
53 0e 00 0a 20 20 20 20 20 20 00 00 00 ff 00 56
31 4c 41 56 31 32 0a 20 20 20 20 20 00 00 00 fc
00 4c 45 4e 20 4c 31 37 34 0a 20 20 20 20 00 db

----------------

Block 0, Base EDID:
  EDID Structure Version & Revision: 1.3
  Vendor & Product Identification:
    Manufacturer: LEN
    Model: 9227
    Serial Number: ...
    Made in: week 37 of 2008
  Basic Display Parameters & Features:
    Analog display
    Signal Level Standard: 0.700 : 0.000 : 0.700 V p-p
    Blank level equals black level
    Sync: Separate
    Maximum image size: 34 cm x 27 cm
    Gamma: 2.20
    DPMS levels: Off
    RGB color display
    First detailed timing is the preferred timing
  Color Characteristics:
    Red  : 0.6494, 0.3291
    Green: 0.2998, 0.0595
    Blue : 0.1396, 0.0791
    White: 0.3125, 0.3281
  Established Timings I & II:
    IBM     :   720x400    70.081663 Hz   9:5     31.467 kHz     28.320000 MHz
    DMT 0x04:   640x480    59.940476 Hz   4:3     31.469 kHz     25.175000 MHz
    DMT 0x05:   640x480    72.808802 Hz   4:3     37.861 kHz     31.500000 MHz
    DMT 0x06:   640x480    75.000000 Hz   4:3     37.500 kHz     31.500000 MHz
    DMT 0x09:   800x600    60.316541 Hz   4:3     37.879 kHz     40.000000 MHz
    DMT 0x0a:   800x600    72.187572 Hz   4:3     48.077 kHz     50.000000 MHz
    DMT 0x0b:   800x600    75.000000 Hz   4:3     46.875 kHz     49.500000 MHz
    DMT 0x10:  1024x768    60.003840 Hz   4:3     48.363 kHz     65.000000 MHz
    DMT 0x11:  1024x768    70.069359 Hz   4:3     56.476 kHz     75.000000 MHz
    DMT 0x12:  1024x768    75.028582 Hz   4:3     60.023 kHz     78.750000 MHz
    DMT 0x24:  1280x1024   75.024675 Hz   5:4     79.976 kHz    135.000000 MHz
  Standard Timings:
    DMT 0x23:  1280x1024   60.019740 Hz   5:4     63.981 kHz    108.000000 MHz
    GTF     :  1280x1024   69.999805 Hz   5:4     74.620 kHz    128.943000 MHz
    GTF     :   640x480    65.999646 Hz   4:3     32.934 kHz     26.874000 MHz
  Detailed Timing Descriptors:
    DTD 1:  1280x1024   75.024675 Hz   5:4     79.976 kHz    135.000000 MHz (340 mm x 270 mm)
                 Hfront   16 Hsync 144 Hback  248 Hpol P
                 Vfront    1 Vsync   3 Vback   38 Vpol P
    Display Range Limits:
      Monitor ranges (GTF): 55-75 Hz V, 30-83 kHz H, max dotclock 140 MHz
    Display Product Serial Number: ...
    Display Product Name: 'LEN L174'
Checksum: 0xdb

----------------

Block 1, Unknown EDID Extension Block 0x00:
  00 ff ff ff ff ff ff 00 30 ae 0b 24 01 01 01 01 '........0..$....'
  25 12 01 03 68 22 1b 78 2a 5d d0 a6 54 4c 0f 23 '%...h".x*]..TL.#'
  14 50 54 ad cf 00 81 80 81 8a 31 46 01 01 01 01 '.PT.......1F....'
  01 01 01 01 01 01 bc 34 00 98 51 00 2a 40 10 90 '.......4..Q.*@..'
  13 00 54 0e 11 00 00 1e 00 00 00 fd 00 37 4b 1e '..T..........7K.'
  53 0e 00 0a 20 20 20 20 20 20 00 00 00 ff 00 56 'S...      .....V'
  31 4c 41 56 31 32 0a 20 20 20 20 20 00 00 00 fc '1LAV12.     ....'
  00 4c 45 4e 20 4c 31 37 34 0a 20 20 20 20 00 db '.LEN L174.    ..'
Checksum: 0xdb

----------------

Failures:

Block 1, Base EDID:
  Unknown Extension Block.
EDID:
  Base EDID: EDID specified 0 extension block(s), but found 1 extension block(s).

EDID conformity: FAIL
