
EDID (hex):
00ffffffffffff0022f06e3200000000
031a0104a5342078224ca5a7554da226
105054210800b30095008100d1c0a9c0
81c0a9408180283c80a070b023403020
360006442100001a000000fd00323c1e
5011010a202020202020000000fc0048
5020453234320a2020202020000000ff
00434e34363033313947420a20200036

Extracted contents:
header:          00 ff ff ff ff ff ff 00
serial number:   22 f0 6e 32 00 00 00 00 03 1a
version:         01 04
basic params:    a5 34 20 78 22
chroma info:     4c a5 a7 55 4d a2 26 10 50 54
established:     21 08 00
standard:        b3 00 95 00 81 00 d1 c0 a9 c0 81 c0 a9 40 81 80
descriptor 1:    28 3c 80 a0 70 b0 23 40 30 20 36 00 06 44 21 00 00 1a
descriptor 2:    00 00 00 fd 00 32 3c 1e 50 11 01 0a 20 20 20 20 20 20
descriptor 3:    00 00 00 fc 00 48 50 20 45 32 34 32 0a 20 20 20 20 20
descriptor 4:    00 00 00 ff 00 43 4e 34 36 30 33 31 39 47 42 0a 20 20
extensions:      00
checksum:        36

EDID version: 1.4
Manufacturer: HWP Model 326e Serial Number --
Made in week 3 of 2016
Digital display
8 bits per primary color channel
DisplayPort interface
Maximum image size: 52 cm x 32 cm
Gamma: 2.20
DPMS levels: Off
Supported color formats: RGB 4:4:4
First detailed timing includes the native pixel format and preferred refresh rate
Display x,y Chromaticity:
  Red:   0.6533, 0.3320
  Green: 0.3037, 0.6328
  Blue:  0.1503, 0.0644
  White: 0.3134, 0.3291
Established timings supported:
  640x480@60Hz 4:3 HorFreq: 31469 Hz Clock: 25.175 MHz
  800x600@60Hz 4:3 HorFreq: 37900 Hz Clock: 40.000 MHz
  1024x768@60Hz 4:3 HorFreq: 48400 Hz Clock: 65.000 MHz
Standard timings supported:
  1680x1050@60Hz 16:10 HorFreq: 64700 Hz Clock: 119.000 MHz
  1440x900@60Hz 16:10 HorFreq: 55500 Hz Clock: 88.750 MHz
  1280x800@60Hz 16:10
  1920x1080@60Hz 16:9
  1600x900@60Hz 16:9
  1280x720@60Hz 16:9
  1600x1200@60Hz 4:3 HorFreq: 75000 Hz Clock: 162.000 MHz
  1280x1024@60Hz 5:4 HorFreq: 64000 Hz Clock: 108.000 MHz
Detailed mode: Clock 154.000 MHz, 518 mm x 324 mm
               1920 1968 2000 2080 hborder 0
               1200 1203 1209 1235 vborder 0
               +hsync -vsync 
               VertFreq: 59 Hz, HorFreq: 74038 Hz
Monitor ranges (bare limits): 50-60Hz V, 30-80kHz H, max dotclock 170MHz
Monitor name: HP E242
Serial number: --
Checksum: 0x36 (valid)
