edid-decode (hex):

00 ff ff ff ff ff ff 00 3e e3 03 00 68 63 65 74
16 19 01 04 80 50 2d 78 0a 0d c9 a0 57 47 98 27
12 48 4c ff ff 00 d1 c0 d1 00 d1 cf d1 0f d1 de
d1 1e 01 01 01 01 66 e8 ff 98 f1 70 2a 80 10 90
13 00 ff 70 f8 00 00 1e 00 00 00 fc 00 4e 54 20
48 45 41 44 4c 45 53 53 0a 20 ab 5e 00 a0 a0 a0
2d 50 10 60 b2 00 00 a0 a5 00 00 1e e8 e3 00 30
f2 70 32 80 40 c0 13 00 00 70 f8 00 00 1e 01 a3

02 03 57 72 5f 6b 64 58 20 60 68 04 13 3e 3c 11
02 03 15 06 01 07 08 09 0a 0b 0c 0d 0e 0f 12 16
17 18 19 1a 5f 1b 1c 1d 1e 21 23 24 25 26 27 28
29 2a 2b 2c 2d 2e 2f 30 31 32 33 34 35 36 37 38
39 3a 3b 3d 43 3f 40 a2 6e 03 0c 00 10 00 39 3c
2a 00 80 01 02 03 04 32 88 00 30 a2 a0 32 50 40
c0 13 00 00 a0 a5 00 00 00 f5 6c 00 30 a2 a0 32
50 40 c0 13 00 00 a0 a5 00 00 00 00 00 00 00 81

----------------

Block 0, Base EDID:
  EDID Structure Version & Revision: 1.4
  Vendor & Product Identification:
    Manufacturer: OWC
    Model: 3
    Serial Number: ...
    Made in: week 22 of 2015
  Basic Display Parameters & Features:
    Digital display
    Color depth is undefined
    Digital interface is not defined
    Maximum image size: 80 cm x 45 cm
    Gamma: 2.20
    Supported color formats: RGB 4:4:4, YCrCb 4:4:4
    First detailed timing includes the native pixel format and preferred refresh rate
  Color Characteristics:
    Red  : 0.6250, 0.3398
    Green: 0.2802, 0.5947
    Blue : 0.1552, 0.0703
    White: 0.2832, 0.2978
  Established Timings I & II:
    IBM     :   720x400    70.081663 Hz   9:5     31.467 kHz     28.320000 MHz
    IBM     :   720x400    87.849542 Hz   9:5     39.444 kHz     35.500000 MHz
    DMT 0x04:   640x480    59.940476 Hz   4:3     31.469 kHz     25.175000 MHz
    Apple   :   640x480    66.666667 Hz   4:3     35.000 kHz     30.240000 MHz
    DMT 0x05:   640x480    72.808802 Hz   4:3     37.861 kHz     31.500000 MHz
    DMT 0x06:   640x480    75.000000 Hz   4:3     37.500 kHz     31.500000 MHz
    DMT 0x08:   800x600    56.250000 Hz   4:3     35.156 kHz     36.000000 MHz
    DMT 0x09:   800x600    60.316541 Hz   4:3     37.879 kHz     40.000000 MHz
    DMT 0x0a:   800x600    72.187572 Hz   4:3     48.077 kHz     50.000000 MHz
    DMT 0x0b:   800x600    75.000000 Hz   4:3     46.875 kHz     49.500000 MHz
    Apple   :   832x624    74.551266 Hz   4:3     49.726 kHz     57.284000 MHz
    DMT 0x0f:  1024x768i   86.957532 Hz   4:3     35.522 kHz     44.900000 MHz
    DMT 0x10:  1024x768    60.003840 Hz   4:3     48.363 kHz     65.000000 MHz
    DMT 0x11:  1024x768    70.069359 Hz   4:3     56.476 kHz     75.000000 MHz
    DMT 0x12:  1024x768    75.028582 Hz   4:3     60.023 kHz     78.750000 MHz
    DMT 0x24:  1280x1024   75.024675 Hz   5:4     79.976 kHz    135.000000 MHz
  Standard Timings:
    DMT 0x52:  1920x1080   60.000000 Hz  16:9     67.500 kHz    148.500000 MHz
    DMT 0x45:  1920x1200   59.884600 Hz  16:10    74.556 kHz    193.250000 MHz
    GTF     :  1920x1080   75.000068 Hz  16:9     84.600 kHz    220.637000 MHz
    DMT 0x46:  1920x1200   74.930340 Hz  16:10    94.038 kHz    245.250000 MHz
    GTF     :  1920x1080   89.999933 Hz  16:9    102.330 kHz    270.151000 MHz
    GTF     :  1920x1200   89.999880 Hz  16:10   113.760 kHz    300.326000 MHz
  Detailed Timing Descriptors:
    DTD 1:  4095x2160   60.000367 Hz  91:48   132.121 kHz    594.940000 MHz (4095 mm x 2160 mm)
                 Hfront   16 Hsync 144 Hback  248 Hpol P
                 Vfront    1 Vsync   3 Vback   38 Vpol P
    Display Product Name: 'NT HEADLESS'
    DTD 2:  2560x1440   59.999505 Hz  16:9     89.099 kHz    242.350000 MHz (2560 mm x 1440 mm)
                 Hfront   16 Hsync  96 Hback   48 Hpol P
                 Vfront   11 Vsync   2 Vback   32 Vpol P
    DTD 3:  3840x2160   60.000000 Hz  16:9    132.600 kHz    583.440000 MHz (3840 mm x 2160 mm)
                 Hfront   64 Hsync 192 Hback  304 Hpol P
                 Vfront    1 Vsync   3 Vback   46 Vpol P
  Extension blocks: 1
Checksum: 0xa3

----------------

Block 1, CTA-861 Extension Block:
  Revision: 3
  Basic audio support
  Supports YCbCr 4:4:4
  Supports YCbCr 4:2:2
  Native detailed modes: 2
  Video Data Block:
    VIC 107:  3840x2160   60.000000 Hz  64:27   135.000 kHz    594.000000 MHz
    VIC 100:  4096x2160   30.000000 Hz 256:135   67.500 kHz    297.000000 MHz
    VIC  88:  2560x1080   30.000000 Hz  64:27    33.750 kHz    118.800000 MHz
    VIC  32:  1920x1080   24.000000 Hz  16:9     27.000 kHz     74.250000 MHz
    VIC  96:  3840x2160   50.000000 Hz  16:9    112.500 kHz    594.000000 MHz
    VIC 104:  3840x2160   25.000000 Hz  64:27    56.250 kHz    297.000000 MHz
    VIC   4:  1280x720    60.000000 Hz  16:9     45.000 kHz     74.250000 MHz
    VIC  19:  1280x720    50.000000 Hz  16:9     37.500 kHz     74.250000 MHz
    VIC  62:  1280x720    30.000000 Hz  16:9     22.500 kHz     74.250000 MHz
    VIC  60:  1280x720    24.000000 Hz  16:9     18.000 kHz     59.400000 MHz
    VIC  17:   720x576    50.000000 Hz   4:3     31.250 kHz     27.000000 MHz
    VIC   2:   720x480    59.940060 Hz   4:3     31.469 kHz     27.000000 MHz
    VIC   3:   720x480    59.940060 Hz  16:9     31.469 kHz     27.000000 MHz
    VIC  21:  1440x576i   50.000000 Hz   4:3     15.625 kHz     27.000000 MHz
    VIC   6:  1440x480i   59.940060 Hz   4:3     15.734 kHz     27.000000 MHz
    VIC   1:   640x480    59.940476 Hz   4:3     31.469 kHz     25.175000 MHz
    VIC   7:  1440x480i   59.940060 Hz  16:9     15.734 kHz     27.000000 MHz
    VIC   8:  1440x240    60.054449 Hz   4:3     15.734 kHz     27.000000 MHz
    VIC   9:  1440x240    60.054449 Hz  16:9     15.734 kHz     27.000000 MHz
    VIC  10:  2880x480i   59.940060 Hz   4:3     15.734 kHz     54.000000 MHz
    VIC  11:  2880x480i   59.940060 Hz  16:9     15.734 kHz     54.000000 MHz
    VIC  12:  2880x240    60.054449 Hz   4:3     15.734 kHz     54.000000 MHz
    VIC  13:  2880x240    60.054449 Hz  16:9     15.734 kHz     54.000000 MHz
    VIC  14:  1440x480    59.940060 Hz   4:3     31.469 kHz     54.000000 MHz
    VIC  15:  1440x480    59.940060 Hz  16:9     31.469 kHz     54.000000 MHz
    VIC  18:   720x576    50.000000 Hz  16:9     31.250 kHz     27.000000 MHz
    VIC  22:  1440x576i   50.000000 Hz  16:9     15.625 kHz     27.000000 MHz
    VIC  23:  1440x288    50.080128 Hz   4:3     15.625 kHz     27.000000 MHz
    VIC  24:  1440x288    50.080128 Hz  16:9     15.625 kHz     27.000000 MHz
    VIC  25:  2880x576i   50.000000 Hz   4:3     15.625 kHz     54.000000 MHz
    VIC  26:  2880x576i   50.000000 Hz  16:9     15.625 kHz     54.000000 MHz
  Video Data Block:
    VIC  27:  2880x288    50.080128 Hz   4:3     15.625 kHz     54.000000 MHz
    VIC  28:  2880x288    50.080128 Hz  16:9     15.625 kHz     54.000000 MHz
    VIC  29:  1440x576    50.000000 Hz   4:3     31.250 kHz     54.000000 MHz
    VIC  30:  1440x576    50.000000 Hz  16:9     31.250 kHz     54.000000 MHz
    VIC  33:  1920x1080   25.000000 Hz  16:9     28.125 kHz     74.250000 MHz
    VIC  35:  2880x480    59.940060 Hz   4:3     31.469 kHz    108.000000 MHz
    VIC  36:  2880x480    59.940060 Hz  16:9     31.469 kHz    108.000000 MHz
    VIC  37:  2880x576    50.000000 Hz   4:3     31.250 kHz    108.000000 MHz
    VIC  38:  2880x576    50.000000 Hz  16:9     31.250 kHz    108.000000 MHz
    VIC  39:  1920x1080i  50.000000 Hz  16:9     31.250 kHz     72.000000 MHz
    VIC  40:  1920x1080i 100.000000 Hz  16:9     56.250 kHz    148.500000 MHz
    VIC  41:  1280x720   100.000000 Hz  16:9     75.000 kHz    148.500000 MHz
    VIC  42:   720x576   100.000000 Hz   4:3     62.500 kHz     54.000000 MHz
    VIC  43:   720x576   100.000000 Hz  16:9     62.500 kHz     54.000000 MHz
    VIC  44:  1440x576i  100.000000 Hz   4:3     31.250 kHz     54.000000 MHz
    VIC  45:  1440x576i  100.000000 Hz  16:9     31.250 kHz     54.000000 MHz
    VIC  46:  1920x1080i 120.000000 Hz  16:9     67.500 kHz    148.500000 MHz
    VIC  47:  1280x720   120.000000 Hz  16:9     90.000 kHz    148.500000 MHz
    VIC  48:   720x480   119.880120 Hz   4:3     62.937 kHz     54.000000 MHz
    VIC  49:   720x480   119.880120 Hz  16:9     62.937 kHz     54.000000 MHz
    VIC  50:  1440x480i  119.880120 Hz   4:3     31.469 kHz     54.000000 MHz
    VIC  51:  1440x480i  119.880120 Hz  16:9     31.469 kHz     54.000000 MHz
    VIC  52:   720x576   200.000000 Hz   4:3    125.000 kHz    108.000000 MHz
    VIC  53:   720x576   200.000000 Hz  16:9    125.000 kHz    108.000000 MHz
    VIC  54:  1440x576i  200.000000 Hz   4:3     62.500 kHz    108.000000 MHz
    VIC  55:  1440x576i  200.000000 Hz  16:9     62.500 kHz    108.000000 MHz
    VIC  56:   720x480   239.760240 Hz   4:3    125.874 kHz    108.000000 MHz
    VIC  57:   720x480   239.760240 Hz  16:9    125.874 kHz    108.000000 MHz
    VIC  58:  1440x480i  239.760240 Hz   4:3     62.937 kHz    108.000000 MHz
    VIC  59:  1440x480i  239.760240 Hz  16:9     62.937 kHz    108.000000 MHz
    VIC  61:  1280x720    25.000000 Hz  16:9     18.750 kHz     74.250000 MHz
  Video Data Block:
    VIC  63:  1920x1080  120.000000 Hz  16:9    135.000 kHz    297.000000 MHz
    VIC  64:  1920x1080  100.000000 Hz  16:9    112.500 kHz    297.000000 MHz
    VIC  34:  1920x1080   30.000000 Hz  16:9     33.750 kHz     74.250000 MHz (native)
  Vendor-Specific Data Block (HDMI), OUI 00-0C-03:
    Source physical address: 1.0.0.0
    DC_36bit
    DC_30bit
    DC_Y444
    DVI_Dual
    Maximum TMDS clock: 300 MHz
    Supported Content Types:
      Photo
      Game
    Extended HDMI video details:
      HDMI VICs:
        HDMI VIC 1:  3840x2160   30.000000 Hz  16:9     67.500 kHz    297.000000 MHz
        HDMI VIC 2:  3840x2160   25.000000 Hz  16:9     56.250 kHz    297.000000 MHz
        HDMI VIC 3:  3840x2160   24.000000 Hz  16:9     54.000 kHz    297.000000 MHz
        HDMI VIC 4:  4096x2160   24.000000 Hz 256:135   54.000 kHz    297.000000 MHz
  Detailed Timing Descriptors:
    DTD 4:  2560x1440   75.000000 Hz  16:9    111.750 kHz    348.660000 MHz (analog composite, sync-on-green, 2560 mm x 1440 mm)
                 Hfront   64 Hsync 192 Hback  304 Hpol N
                 Vfront    1 Vsync   3 Vback   46 Vpol N
    DTD 5:  2560x1440   60.000430 Hz  16:9     89.401 kHz    278.930000 MHz (analog composite, sync-on-green, 2560 mm x 1440 mm)
                 Hfront   64 Hsync 192 Hback  304 Hpol N
                 Vfront    1 Vsync   3 Vback   46 Vpol N
Checksum: 0x81

----------------

Warnings:

Block 1, CTA-861 Extension Block:
  IT Video Formats are overscanned by default, but normally this should be underscanned.

Failures:

Block 0, Base EDID:
  Detailed Timing Descriptor #1: Mismatch of image size 4095x2160 mm vs display size 800x450 mm.
  Detailed Timing Descriptor #2: Mismatch of image size 2560x1440 mm vs display size 800x450 mm.
  Detailed Timing Descriptor #2: Invalid detailed timing descriptor ordering.
  Detailed Timing Descriptor #3: Mismatch of image size 3840x2160 mm vs display size 800x450 mm.
  Detailed Timing Descriptor #3: Invalid detailed timing descriptor ordering.
Block 1, CTA-861 Extension Block:
  Vendor-Specific Data Block (HDMI), OUI 00-0C-03: The HDMI Specification requires EDID 1.3 instead of 1.4.
  Detailed Timing Descriptor #4: Mismatch of image size 2560x1440 mm vs display size 800x450 mm.
  Detailed Timing Descriptor #5: Mismatch of image size 2560x1440 mm vs display size 800x450 mm.
  HDMI VIC Codes must have their CTA-861 VIC equivalents in the VSB.
  Missing VCDB, needed for Set Selectable RGB Quantization to avoid interop issues.
EDID:
  Base EDID: The DTD max image size is 4095x2160mm, which is larger than the display size 800.0x450.0mm.
  CTA-861: Native progressive timings are a mix of several resolutions.

EDID conformity: FAIL
