edid-decode (hex):

00 ff ff ff ff ff ff 00 22 f0 c8 13 1a 4e c7 00
1e 0b 01 04 6c 22 1b 78 ea 6e 66 a1 54 4c 99 26
19 4f 54 a5 6b 00 81 80 01 01 01 01 01 01 01 01
01 01 01 01 01 01 30 2a 00 98 51 00 2a 40 30 70
13 00 67 1f 11 00 00 1e 00 00 00 fd 00 38 4b 1f
50 0d 00 0a 20 20 20 20 20 20 00 00 00 fc 00 68
70 20 4c 31 37 32 30 0a 20 20 20 20 00 00 00 ff
00 54 57 31 33 30 36 31 36 35 38 31 0a 00 00 10

00 ff ff ff ff ff ff 00 22 f0 c8 13 1a 4e c7 00
1e 0b 01 04 6c 22 1b 78 ea 6e 66 a1 54 4c 99 26
19 4f 54 a5 6b 00 81 80 01 01 01 01 01 01 01 01
01 01 01 01 01 01 30 2a 00 98 51 00 2a 40 30 70
13 00 67 1f 11 00 00 1e 00 00 00 fd 00 38 4b 1f
50 0d 00 0a 20 20 20 20 20 20 00 00 00 fc 00 68
70 20 4c 31 37 32 30 0a 20 20 20 20 00 00 00 ff
00 54 57 31 33 30 36 31 36 35 38 31 0a 00 00 10

----------------

Block 0, Base EDID:
  EDID Structure Version & Revision: 1.4
  Vendor & Product Identification:
    Manufacturer: HWP
    Model: 5064
    Serial Number: ...
    Made in: week 30 of 2001
  Basic Display Parameters & Features:
    Analog display
    Signal Level Standard: 0.700 : 0.000 : 0.700 V p-p
    Blank level equals black level
    Sync: Separate Composite
    Maximum image size: 34 cm x 27 cm
    Gamma: 2.20
    DPMS levels: Standby Suspend Off
    RGB color display
    First detailed timing includes the native pixel format and preferred refresh rate
  Color Characteristics:
    Red  : 0.6298, 0.3300
    Green: 0.2998, 0.5996
    Blue : 0.1494, 0.0996
    White: 0.3095, 0.3300
  Established Timings I & II:
    IBM     :   720x400    70.081663 Hz   9:5     31.467 kHz     28.320000 MHz
    DMT 0x04:   640x480    59.940476 Hz   4:3     31.469 kHz     25.175000 MHz
    DMT 0x06:   640x480    75.000000 Hz   4:3     37.500 kHz     31.500000 MHz
    DMT 0x09:   800x600    60.316541 Hz   4:3     37.879 kHz     40.000000 MHz
    DMT 0x0b:   800x600    75.000000 Hz   4:3     46.875 kHz     49.500000 MHz
    Apple   :   832x624    74.551266 Hz   4:3     49.726 kHz     57.284000 MHz
    DMT 0x10:  1024x768    60.003840 Hz   4:3     48.363 kHz     65.000000 MHz
    DMT 0x12:  1024x768    75.028582 Hz   4:3     60.023 kHz     78.750000 MHz
    DMT 0x24:  1280x1024   75.024675 Hz   5:4     79.976 kHz    135.000000 MHz
  Standard Timings:
    DMT 0x23:  1280x1024   60.019740 Hz   5:4     63.981 kHz    108.000000 MHz
  Detailed Timing Descriptors:
    DTD 1:  1280x1024   60.019740 Hz   5:4     63.981 kHz    108.000000 MHz (359 mm x 287 mm)
                 Hfront   48 Hsync 112 Hback  248 Hpol P
                 Vfront    1 Vsync   3 Vback   38 Vpol P
    Display Range Limits:
      Monitor ranges (GTF): 56-75 Hz V, 31-80 kHz H, max dotclock 130 MHz
    Display Product Name: 'hp L1720'
    Display Product Serial Number: ...
Checksum: 0x10

----------------

Block 1, Unknown EDID Extension Block 0x00:
  00 ff ff ff ff ff ff 00 22 f0 c8 13 1a 4e c7 00 '........"....N..'
  1e 0b 01 04 6c 22 1b 78 ea 6e 66 a1 54 4c 99 26 '....l".x.nf.TL.&'
  19 4f 54 a5 6b 00 81 80 01 01 01 01 01 01 01 01 '.OT.k...........'
  01 01 01 01 01 01 30 2a 00 98 51 00 2a 40 30 70 '......0*..Q.*@0p'
  13 00 67 1f 11 00 00 1e 00 00 00 fd 00 38 4b 1f '..g..........8K.'
  50 0d 00 0a 20 20 20 20 20 20 00 00 00 fc 00 68 'P...      .....h'
  70 20 4c 31 37 32 30 0a 20 20 20 20 00 00 00 ff 'p L1720.    ....'
  00 54 57 31 33 30 36 31 36 35 38 31 0a 00 00 10 '.TW130616581....'
Checksum: 0x10

----------------

Warnings:

Block 0, Base EDID:
  Display Range Limits: GTF support is deprecated in EDID 1.4.
EDID:
  Base EDID: Some timings are out of range of the Monitor Ranges:
    Maximum Clock: 135.000 MHz (Monitor: 130.000 MHz)
    Could be due to a Monitor Range off-by-one rounding issue

Failures:

Block 0, Base EDID:
  Detailed Timing Descriptor #1: Mismatch of image size 359x287 mm vs display size 340x270 mm.
  Display Range Limits: GTF can't be combined with non-continuous frequencies.
  Display Product Serial Number: ...
Block 1, Base EDID:
  Unknown Extension Block.
EDID:
  Base EDID: The DTD max image size is 359x287mm, which is larger than the display size 340.0x270.0mm.
  Base EDID: EDID specified 0 extension block(s), but found 1 extension block(s).

EDID conformity: FAIL
