
EDID (hex):
00ffffffffffff0025e4851501010101
2f190103802e1a782e0b75a2574b9e27
0d5054bfef0081808140b300950081c0
010101010101023a801871382d40582c
4500ca021100001e000000fd00374c1f
5310000a202020202020000000ff0047
424d3630303037373947420a000000fc
004c43442d4d46323131580a20200058

Extracted contents:
header:          00 ff ff ff ff ff ff 00
serial number:   25 e4 85 15 01 01 01 01 2f 19
version:         01 03
basic params:    80 2e 1a 78 2e
chroma info:     0b 75 a2 57 4b 9e 27 0d 50 54
established:     bf ef 00
standard:        81 80 81 40 b3 00 95 00 81 c0 01 01 01 01 01 01
descriptor 1:    02 3a 80 18 71 38 2d 40 58 2c 45 00 ca 02 11 00 00 1e
descriptor 2:    00 00 00 fd 00 37 4c 1f 53 10 00 0a 20 20 20 20 20 20
descriptor 3:    00 00 00 ff 00 47 42 4d 36 30 30 30 37 37 39 47 42 0a
descriptor 4:    00 00 00 fc 00 4c 43 44 2d 4d 46 32 31 31 58 0a 20 20
extensions:      00
checksum:        58

EDID version: 1.3
Manufacturer: IOD Model 1585 Serial Number --
Made in week 47 of 2015
Digital display
Maximum image size: 46 cm x 26 cm
Gamma: 2.20
DPMS levels: Off
RGB color display
Default (sRGB) color space is primary color space
First detailed timing is preferred timing
Display x,y Chromaticity:
  Red:   0.6328, 0.3398
  Green: 0.2949, 0.6201
  Blue:  0.1533, 0.0537
  White: 0.3134, 0.3291
Established timings supported:
  720x400@70Hz 9:5 HorFreq: 31469 Hz Clock: 28.320 MHz
  640x480@60Hz 4:3 HorFreq: 31469 Hz Clock: 25.175 MHz
  640x480@67Hz 4:3 HorFreq: 35000 Hz Clock: 30.240 MHz
  640x480@72Hz 4:3 HorFreq: 37900 Hz Clock: 31.500 MHz
  640x480@75Hz 4:3 HorFreq: 37500 Hz Clock: 31.500 MHz
  800x600@56Hz 4:3 HorFreq: 35200 Hz Clock: 36.000 MHz
  800x600@60Hz 4:3 HorFreq: 37900 Hz Clock: 40.000 MHz
  800x600@72Hz 4:3 HorFreq: 48100 Hz Clock: 50.000 MHz
  800x600@75Hz 4:3 HorFreq: 46900 Hz Clock: 49.500 MHz
  832x624@75Hz 4:3 HorFreq: 49726 Hz Clock: 57.284 MHz
  1024x768@60Hz 4:3 HorFreq: 48400 Hz Clock: 65.000 MHz
  1024x768@70Hz 4:3 HorFreq: 56500 Hz Clock: 75.000 MHz
  1024x768@75Hz 4:3 HorFreq: 60000 Hz Clock: 78.750 MHz
  1280x1024@75Hz 5:4 HorFreq: 80000 Hz Clock: 135.000 MHz
Standard timings supported:
  1280x1024@60Hz 5:4 HorFreq: 64000 Hz Clock: 108.000 MHz
  1280x960@60Hz 4:3 HorFreq: 60000 Hz Clock: 108.000 MHz
  1680x1050@60Hz 16:10 HorFreq: 64700 Hz Clock: 119.000 MHz
  1440x900@60Hz 16:10 HorFreq: 55500 Hz Clock: 88.750 MHz
  1280x720@60Hz 16:9
Detailed mode: Clock 148.500 MHz, 458 mm x 258 mm
               1920 2008 2052 2200 hborder 0
               1080 1084 1089 1125 vborder 0
               +hsync +vsync 
               VertFreq: 60 Hz, HorFreq: 67500 Hz
Monitor ranges (GTF): 55-76Hz V, 31-83kHz H, max dotclock 160MHz
Serial number: --
Monitor name: LCD-MF211X
Checksum: 0x58 (valid)
EDID block does NOT conform to EDID 1.3!
	sRGB is signaled, but the chromaticities do not match
