edid-decode (hex):

00 ff ff ff ff ff ff 00 58 b3 00 37 00 38 00 00
01 0a 01 03 80 10 09 78 0a 71 3e a3 55 49 9b 25
10 47 4a 20 00 00 01 01 01 01 01 01 01 01 01 01
01 01 01 01 01 01 01 1d 80 18 71 1c 16 20 58 2c
25 00 10 09 00 00 00 9e 01 1d 00 72 51 d0 1e 20
6e 28 55 00 10 09 00 00 00 1e 00 00 00 fc 00 34
32 20 46 48 44 5f 4c 43 44 2d 54 56 00 00 00 fd
00 31 3d 0f 2e 08 00 0a 20 20 20 20 20 20 01 1f

02 03 25 71 50 01 02 04 85 06 11 13 14 15 03 07
12 16 10 1f 20 23 09 07 01 83 01 00 00 67 03 0c
00 40 00 b8 2d 8c 0a d0 8a 20 e0 2d 10 10 3e 96
00 04 03 00 00 00 18 8c 0a a0 14 51 f0 16 00 26
7c 43 00 04 03 00 00 00 98 01 1d 80 d0 72 1c 16
20 10 2c 25 80 10 09 00 00 00 9e 01 1d 00 bc 52
d0 1e 20 b8 28 55 40 10 09 00 00 00 1e 8c 0a d0
90 20 40 31 20 0c 40 55 00 04 03 00 00 00 18 f6

----------------

Block 0, Base EDID:
  EDID Structure Version & Revision: 1.3
  Vendor & Product Identification:
    Manufacturer: VES
    Model: 14080
    Serial Number: ...
    Made in: week 1 of 2000
  Basic Display Parameters & Features:
    Digital display
    Maximum image size: 16 cm x 9 cm
    Gamma: 2.20
    RGB color display
    First detailed timing is preferred timing
  Color Characteristics:
    Red  : 0.6376, 0.3349
    Green: 0.2851, 0.6064
    Blue : 0.1445, 0.0654
    White: 0.2802, 0.2910
  Established Timings I & II:
    DMT 0x04:   640x480    59.940 Hz   4:3    31.469 kHz  25.175 MHz
  Standard Timings: none
  Detailed Timing Descriptors:
    DTD 1:  1920x1080i  60.000 Hz  16:9    33.750 kHz  74.250 MHz (16 mm x 9 mm)
                 Hfront   88 Hsync  44 Hback 148 Hpol P
                 Vfront    2 Vsync   5 Vback  15 Vpol P Vfront +0.5 Odd Field
                 Vfront    2 Vsync   5 Vback  15 Vpol P Vback  +0.5 Even Field
    DTD 2:  1280x720    60.000 Hz  16:9    45.000 kHz  74.250 MHz (16 mm x 9 mm)
                 Hfront  110 Hsync  40 Hback 220 Hpol P
                 Vfront    5 Vsync   5 Vback  20 Vpol P
    Display Product Name: '42 FHD_LCD-TV'
  Display Range Limits:
    Monitor ranges (GTF): 49-61 Hz V, 15-46 kHz H, max dotclock 80 MHz
  Extension blocks: 1
Checksum: 0x1f

----------------

Block 1, CTA-861 Extension Block:
  Revision: 3
  Basic audio support
  Supports YCbCr 4:4:4
  Supports YCbCr 4:2:2
  Native detailed modes: 1
  Video Data Block:
    VIC   1:   640x480    59.940 Hz   4:3    31.469 kHz  25.175 MHz
    VIC   2:   720x480    59.940 Hz   4:3    31.469 kHz  27.000 MHz
    VIC   4:  1280x720    60.000 Hz  16:9    45.000 kHz  74.250 MHz
    VIC   5:  1920x1080i  60.000 Hz  16:9    33.750 kHz  74.250 MHz (native)
    VIC   6:  1440x480i   59.940 Hz   4:3    15.734 kHz  27.000 MHz
    VIC  17:   720x576    50.000 Hz   4:3    31.250 kHz  27.000 MHz
    VIC  19:  1280x720    50.000 Hz  16:9    37.500 kHz  74.250 MHz
    VIC  20:  1920x1080i  50.000 Hz  16:9    28.125 kHz  74.250 MHz
    VIC  21:  1440x576i   50.000 Hz   4:3    15.625 kHz  27.000 MHz
    VIC   3:   720x480    59.940 Hz  16:9    31.469 kHz  27.000 MHz
    VIC   7:  1440x480i   59.940 Hz  16:9    15.734 kHz  27.000 MHz
    VIC  18:   720x576    50.000 Hz  16:9    31.250 kHz  27.000 MHz
    VIC  22:  1440x576i   50.000 Hz  16:9    15.625 kHz  27.000 MHz
    VIC  16:  1920x1080   60.000 Hz  16:9    67.500 kHz 148.500 MHz
    VIC  31:  1920x1080   50.000 Hz  16:9    56.250 kHz 148.500 MHz
    VIC  32:  1920x1080   24.000 Hz  16:9    27.000 kHz  74.250 MHz
  Audio Data Block:
    Linear PCM:
      Max channels: 2
      Supported sample rates (kHz): 48 44.1 32
      Supported sample sizes (bits): 16
  Speaker Allocation Data Block:
    FL/FR - Front Left/Right
  Vendor-Specific Data Block (HDMI), OUI 00-0C-03:
    Source physical address: 4.0.0.0
    Supports_AI
    DC_36bit
    DC_30bit
    DC_Y444
    Maximum TMDS clock: 225 MHz
  Detailed Timing Descriptors:
    DTD 3:   720x480    59.940 Hz   3:2    31.469 kHz  27.000 MHz (4 mm x 3 mm)
                 Hfront   16 Hsync  62 Hback  60 Hpol N
                 Vfront    9 Vsync   6 Vback  30 Vpol N
    DTD 4:  1440x480i   59.940 Hz   3:1    15.734 kHz  27.000 MHz (4 mm x 3 mm)
                 Hfront   38 Hsync 124 Hback 114 Hpol N
                 Vfront    4 Vsync   3 Vback  15 Vpol N Vfront +0.5 Odd Field
                 Vfront    4 Vsync   3 Vback  15 Vpol N Vback  +0.5 Even Field
    DTD 5:  1920x1080i  50.000 Hz  16:9    28.125 kHz  74.250 MHz (16 mm x 9 mm)
                 Hfront  528 Hsync  44 Hback 148 Hpol P
                 Vfront    2 Vsync   5 Vback  15 Vpol P Vfront +0.5 Odd Field
                 Vfront    2 Vsync   5 Vback  15 Vpol P Vback  +0.5 Even Field
    DTD 6:  1280x720    50.000 Hz  16:9    37.500 kHz  74.250 MHz (16 mm x 9 mm)
                 Hfront  440 Hsync  40 Hback 220 Hpol P
                 Vfront    5 Vsync   5 Vback  20 Vpol P
Checksum: 0xf6

----------------

Warnings:

Block 0, Base EDID:
  Basic Display Parameters & Features: Dubious maximum image size (16x9 is smaller than 10x10 cm).

Failures:

Block 0, Base EDID:
  Detailed Timing Descriptor #1: Mismatch of image size 16x9 mm vs display size 160x90 mm.
  Detailed Timing Descriptor #2: Mismatch of image size 16x9 mm vs display size 160x90 mm.
Block 1, CTA-861 Extension Block:
  Detailed Timing Descriptor #3: Mismatch of image size 4x3 mm vs display size 160x90 mm.
  Detailed Timing Descriptor #4: Mismatch of image size 4x3 mm vs display size 160x90 mm.
  Detailed Timing Descriptor #5: Mismatch of image size 16x9 mm vs display size 160x90 mm.
  Detailed Timing Descriptor #6: Mismatch of image size 16x9 mm vs display size 160x90 mm.
  Padding: CTA-861 padding contains non-zero bytes.
All Blocks:
  Some timings are out of range of the Monitor Ranges:
    Vertical Freq: 24.000 - 60.000 Hz (Monitor: 49.000 - 61.000 Hz)
    Horizontal Freq: 15.625 - 67.500 kHz (Monitor: 15.000 - 46.000 kHz)
    Maximum Clock: 148.500 MHz (Monitor: 80.000 MHz)

EDID conformity: FAIL
