
EDID (hex):
00ffffffffffff0058b3003700000000
01190103804728780a6837a454489a25
0f4a4c2fcf0081800101010101010101
010101010101023a80d072382d40102c
4580c48e2100001e662150b051001b30
40703600c28e2100001e000000fc0033
32575f4c43445f54560a2020000000fd
00314c0f500f000a2020202020200128

Extracted contents:
header:          00 ff ff ff ff ff ff 00
serial number:   58 b3 00 37 00 00 00 00 01 19
version:         01 03
basic params:    80 47 28 78 0a
chroma info:     68 37 a4 54 48 9a 25 0f 4a 4c
established:     2f cf 00
standard:        81 80 01 01 01 01 01 01 01 01 01 01 01 01 01 01
descriptor 1:    02 3a 80 d0 72 38 2d 40 10 2c 45 80 c4 8e 21 00 00 1e
descriptor 2:    66 21 50 b0 51 00 1b 30 40 70 36 00 c2 8e 21 00 00 1e
descriptor 3:    00 00 00 fc 00 33 32 57 5f 4c 43 44 5f 54 56 0a 20 20
descriptor 4:    00 00 00 fd 00 31 4c 0f 50 0f 00 0a 20 20 20 20 20 20
extensions:      01
checksum:        28

EDID version: 1.3
Manufacturer: VES Model 3700 Serial Number --
Made in week 1 of 2015
Digital display
Maximum image size: 71 cm x 40 cm
Gamma: 2.20
RGB color display
First detailed timing is preferred timing
Display x,y Chromaticity:
  Red:   0.6416, 0.3300
  Green: 0.2832, 0.6015
  Blue:  0.1445, 0.0615
  White: 0.2900, 0.2998
Established timings supported:
  640x480@60Hz 4:3 HorFreq: 31469 Hz Clock: 25.175 MHz
  640x480@72Hz 4:3 HorFreq: 37900 Hz Clock: 31.500 MHz
  640x480@75Hz 4:3 HorFreq: 37500 Hz Clock: 31.500 MHz
  800x600@56Hz 4:3 HorFreq: 35200 Hz Clock: 36.000 MHz
  800x600@60Hz 4:3 HorFreq: 37900 Hz Clock: 40.000 MHz
  800x600@72Hz 4:3 HorFreq: 48100 Hz Clock: 50.000 MHz
  800x600@75Hz 4:3 HorFreq: 46900 Hz Clock: 49.500 MHz
  1024x768@60Hz 4:3 HorFreq: 48400 Hz Clock: 65.000 MHz
  1024x768@70Hz 4:3 HorFreq: 56500 Hz Clock: 75.000 MHz
  1024x768@75Hz 4:3 HorFreq: 60000 Hz Clock: 78.750 MHz
  1280x1024@75Hz 5:4 HorFreq: 80000 Hz Clock: 135.000 MHz
Standard timings supported:
  1280x1024@60Hz 5:4 HorFreq: 64000 Hz Clock: 108.000 MHz
Detailed mode: Clock 148.500 MHz, 708 mm x 398 mm
               1920 2448 2492 2640 hborder 0
               1080 1084 1089 1125 vborder 0
               +hsync +vsync 
               VertFreq: 50 Hz, HorFreq: 56250 Hz
Detailed mode: Clock 85.500 MHz, 706 mm x 398 mm
               1360 1424 1536 1792 hborder 0
                768  771  777  795 vborder 0
               +hsync +vsync 
               VertFreq: 60 Hz, HorFreq: 47712 Hz
Monitor name: 32W_LCD_TV
Monitor ranges (GTF): 49-76Hz V, 15-80kHz H, max dotclock 150MHz
Has 1 extension blocks
Checksum: 0x28 (valid)
