
EDID (hex):
00ffffffffffff000daf3f9c00000000
0e0e0103801c15780a34859255539226
20505400080001010101010101010101
01010101010164190040410026301888
36001dd610000018000000fe004e3134
31584220202020202020000000fe004e
313431584220202020202020000000fc
00436f6c6f72204c43440a2020200040

Extracted contents:
header:          00 ff ff ff ff ff ff 00
serial number:   0d af 3f 9c 00 00 00 00 0e 0e
version:         01 03
basic params:    80 1c 15 78 0a
chroma info:     34 85 92 55 53 92 26 20 50 54
established:     00 08 00
standard:        01 01 01 01 01 01 01 01 01 01 01 01 01 01 01 01
descriptor 1:    64 19 00 40 41 00 26 30 18 88 36 00 1d d6 10 00 00 18
descriptor 2:    00 00 00 fe 00 4e 31 34 31 58 42 20 20 20 20 20 20 20
descriptor 3:    00 00 00 fe 00 4e 31 34 31 58 42 20 20 20 20 20 20 20
descriptor 4:    00 00 00 fc 00 43 6f 6c 6f 72 20 4c 43 44 0a 20 20 20
extensions:      00
checksum:        40

EDID version: 1.3
Manufacturer: CMO Model 9c3f Serial Number --
Digital display
Maximum image size: 28 cm x 21 cm
Gamma: 2.20
RGB color display
First detailed timing is preferred timing
Display x,y Chromaticity:
  Red:   0.5703, 0.3349
  Green: 0.3251, 0.5703
  Blue:  0.1503, 0.1250
  White: 0.3134, 0.3291
Established timings supported:
  1024x768@60Hz 4:3 HorFreq: 48400 Hz Clock: 65.000 MHz
Standard timings supported:
Detailed mode: Clock 65.000 MHz, 285 mm x 214 mm
               1024 1048 1184 1344 hborder 0
                768  771  777  806 vborder 0
               -hsync -vsync 
               VertFreq: 60 Hz, HorFreq: 48363 Hz
ASCII string: N141XB       
ASCII string: N141XB       
Monitor name: Color LCD
Checksum: 0x40 (valid)
EDID block does NOT conform to EDID 1.3!
	Missing monitor ranges
EDID block does not conform at all!
	Bad year of manufacture
