edid-decode (hex):

00 ff ff ff ff ff ff 00 22 0e 64 34 01 01 01 01
24 1d 01 03 68 34 20 78 2a 55 95 a9 54 4c 9e 24
0d 50 54 a1 08 00 b3 00 95 00 81 00 d1 c0 a9 c0
81 c0 a9 40 81 80 28 3c 80 a0 70 b0 23 40 30 20
36 00 06 44 21 00 00 1a 00 00 00 fd 00 32 3c 1e
50 11 00 0a 20 20 20 20 20 20 00 00 00 fc 00 48
50 20 45 32 34 33 69 0a 20 20 20 20 00 00 00 ff
00 36 43 4d 39 33 36 30 4b 50 4b 0a 20 20 00 48

00 ff ff ff ff ff ff 00 22 0e 64 34 01 01 01 01
24 1d 01 03 68 34 20 78 2a 55 95 a9 54 4c 9e 24
0d 50 54 a1 08 00 b3 00 95 00 81 00 d1 c0 a9 c0
81 c0 a9 40 81 80 28 3c 80 a0 70 b0 23 40 30 20
36 00 06 44 21 00 00 1a 00 00 00 fd 00 32 3c 1e
50 11 00 0a 20 20 20 20 20 20 00 00 00 fc 00 48
50 20 45 32 34 33 69 0a 20 20 20 20 00 00 00 ff
00 36 43 4d 39 33 36 30 4b 50 4b 0a 20 20 00 48

----------------

Block 0, Base EDID:
  EDID Structure Version & Revision: 1.3
  Vendor & Product Identification:
    Manufacturer: HPN
    Model: 13412
    Serial Number: ...
    Made in: week 36 of 2019
  Basic Display Parameters & Features:
    Analog display
    Signal Level Standard: 0.700 : 0.000 : 0.700 V p-p
    Blank level equals black level
    Sync: Separate
    Maximum image size: 52 cm x 32 cm
    Gamma: 2.20
    DPMS levels: Off
    RGB color display
    First detailed timing is the preferred timing
  Color Characteristics:
    Red  : 0.6611, 0.3291
    Green: 0.2978, 0.6181
    Blue : 0.1425, 0.0517
    White: 0.3134, 0.3291
  Established Timings I & II:
    IBM     :   720x400    70.081663 Hz   9:5     31.467 kHz     28.320000 MHz
    DMT 0x04:   640x480    59.940476 Hz   4:3     31.469 kHz     25.175000 MHz
    DMT 0x09:   800x600    60.316541 Hz   4:3     37.879 kHz     40.000000 MHz
    DMT 0x10:  1024x768    60.003840 Hz   4:3     48.363 kHz     65.000000 MHz
  Standard Timings:
    DMT 0x3a:  1680x1050   59.954250 Hz  16:10    65.290 kHz    146.250000 MHz
    DMT 0x2f:  1440x900    59.887445 Hz  16:10    55.935 kHz    106.500000 MHz
    DMT 0x1c:  1280x800    59.810326 Hz  16:10    49.702 kHz     83.500000 MHz
    DMT 0x52:  1920x1080   60.000000 Hz  16:9     67.500 kHz    148.500000 MHz
    DMT 0x53:  1600x900    60.000000 Hz  16:9     60.000 kHz    108.000000 MHz (RB)
    DMT 0x55:  1280x720    60.000000 Hz  16:9     45.000 kHz     74.250000 MHz
    DMT 0x33:  1600x1200   60.000000 Hz   4:3     75.000 kHz    162.000000 MHz
    DMT 0x23:  1280x1024   60.019740 Hz   5:4     63.981 kHz    108.000000 MHz
  Detailed Timing Descriptors:
    DTD 1:  1920x1200   59.950171 Hz  16:10    74.038 kHz    154.000000 MHz (518 mm x 324 mm)
                 Hfront   48 Hsync  32 Hback   80 Hpol P
                 Vfront    3 Vsync   6 Vback   26 Vpol N
    Display Range Limits:
      Monitor ranges (GTF): 50-60 Hz V, 30-80 kHz H, max dotclock 170 MHz
    Display Product Name: 'HP E243i'
    Display Product Serial Number: ...
Checksum: 0x48

----------------

Block 1, Unknown EDID Extension Block 0x00:
  00 ff ff ff ff ff ff 00 22 0e 64 34 01 01 01 01 '........".d4....'
  24 1d 01 03 68 34 20 78 2a 55 95 a9 54 4c 9e 24 '$...h4 x*U..TL.$'
  0d 50 54 a1 08 00 b3 00 95 00 81 00 d1 c0 a9 c0 '.PT.............'
  81 c0 a9 40 81 80 28 3c 80 a0 70 b0 23 40 30 20 '...@..(<..p.#@0 '
  36 00 06 44 21 00 00 1a 00 00 00 fd 00 32 3c 1e '6..D!........2<.'
  50 11 00 0a 20 20 20 20 20 20 00 00 00 fc 00 48 'P...      .....H'
  50 20 45 32 34 33 69 0a 20 20 20 20 00 00 00 ff 'P E243i.    ....'
  00 36 43 4d 39 33 36 30 4b 50 4b 0a 20 20 00 48 '.6CM9360KPK.  .H'
Checksum: 0x48

----------------

Failures:

Block 1, Base EDID:
  Unknown Extension Block.
EDID:
  Base EDID: Some timings are out of range of the Monitor Ranges:
    Vertical Freq: 59.810 - 70.082 Hz (Monitor: 50.000 - 60.000 Hz)
  Base EDID: EDID specified 0 extension block(s), but found 1 extension block(s).

EDID conformity: FAIL
