
EDID (hex):
00ffffffffffff0006af3c2100000000
00150104901f1178029fe59658538a26
24505400000001010101010101010101
010101010101ce1d56e250001e302616
360035ad100000180000000f00000000
00000000000000000020000000fe0041
554f0a202020202020202020000000fe
004231343058544e30322e31200a0020

Extracted contents:
header:          00 ff ff ff ff ff ff 00
serial number:   06 af 3c 21 00 00 00 00 00 15
version:         01 04
basic params:    90 1f 11 78 02
chroma info:     9f e5 96 58 53 8a 26 24 50 54
established:     00 00 00
standard:        01 01 01 01 01 01 01 01 01 01 01 01 01 01 01 01
descriptor 1:    ce 1d 56 e2 50 00 1e 30 26 16 36 00 35 ad 10 00 00 18
descriptor 2:    00 00 00 0f 00 00 00 00 00 00 00 00 00 00 00 00 00 20
descriptor 3:    00 00 00 fe 00 41 55 4f 0a 20 20 20 20 20 20 20 20 20
descriptor 4:    00 00 00 fe 00 42 31 34 30 58 54 4e 30 32 2e 31 20 0a
extensions:      00
checksum:        20

EDID version: 1.4
Manufacturer: AUO Model 213c Serial Number --
Made in year 2011
Digital display
6 bits per primary color channel
Digital interface is not defined
Maximum image size: 31 cm x 17 cm
Gamma: 2.20
Supported color formats: RGB 4:4:4
First detailed timing includes the native pixel format and preferred refresh rate
Display x,y Chromaticity:
  Red:   0.5878, 0.3447
  Green: 0.3271, 0.5419
  Blue:  0.1513, 0.1425
  White: 0.3134, 0.3291
Established timings supported:
Standard timings supported:
Detailed mode: Clock 76.300 MHz, 309 mm x 173 mm
               1366 1404 1426 1592 hborder 0
                768  771  777  798 vborder 0
               -hsync -vsync 
               VertFreq: 60 Hz, HorFreq: 47927 Hz
Manufacturer-specified data, tag 15
ASCII string: AUO
ASCII string: B140XTN02.1 
Checksum: 0x20 (valid)
EDID block does NOT conform to EDID 1.4!
	Missing name descriptor
	Missing monitor ranges
