
EDID (hex):
00ffffffffffff0030ae004000000000
3310010380191278eacd7591554f8b26
21505421080061400101010101010101
01010101010128150040410026301888
3600f6b900000018ed10004041002630
18883600f6b9000000180000000f0061
433261432812010030640053000000fe
004c5444313231454348420a20200030

Extracted contents:
header:          00 ff ff ff ff ff ff 00
serial number:   30 ae 00 40 00 00 00 00 33 10
version:         01 03
basic params:    80 19 12 78 ea
chroma info:     cd 75 91 55 4f 8b 26 21 50 54
established:     21 08 00
standard:        61 40 01 01 01 01 01 01 01 01 01 01 01 01 01 01
descriptor 1:    28 15 00 40 41 00 26 30 18 88 36 00 f6 b9 00 00 00 18
descriptor 2:    ed 10 00 40 41 00 26 30 18 88 36 00 f6 b9 00 00 00 18
descriptor 3:    00 00 00 0f 00 61 43 32 61 43 28 12 01 00 30 64 00 53
descriptor 4:    00 00 00 fe 00 4c 54 44 31 32 31 45 43 48 42 0a 20 20
extensions:      00
checksum:        30

EDID version: 1.3
Manufacturer: LEN Model 4000 Serial Number --
Made in week 51 of 2006
Digital display
Maximum image size: 25 cm x 18 cm
Gamma: 2.20
DPMS levels: Standby Suspend Off
RGB color display
First detailed timing is preferred timing
Display x,y Chromaticity:
  Red:   0.5693, 0.3320
  Green: 0.3115, 0.5439
  Blue:  0.1494, 0.1318
  White: 0.3134, 0.3291
Established timings supported:
  640x480@60Hz 4:3 HorFreq: 31469 Hz Clock: 25.175 MHz
  800x600@60Hz 4:3 HorFreq: 37900 Hz Clock: 40.000 MHz
  1024x768@60Hz 4:3 HorFreq: 48400 Hz Clock: 65.000 MHz
Standard timings supported:
  1024x768@60Hz 4:3 HorFreq: 48400 Hz Clock: 65.000 MHz
Detailed mode: Clock 54.160 MHz, 246 mm x 185 mm
               1024 1048 1184 1344 hborder 0
                768  771  777  806 vborder 0
               -hsync -vsync 
               VertFreq: 49 Hz, HorFreq: 40297 Hz
Detailed mode: Clock 43.330 MHz, 246 mm x 185 mm
               1024 1048 1184 1344 hborder 0
                768  771  777  806 vborder 0
               -hsync -vsync 
               VertFreq: 39 Hz, HorFreq: 32239 Hz
Manufacturer-specified data, tag 15
ASCII string: LTD121ECHB
Checksum: 0x30 (valid)
EDID block does NOT conform to EDID 1.3!
	Missing name descriptor
	Missing monitor ranges
