
EDID (hex):
00ffffffffffff0009d1028045540000
1015010380351e782eb7d5a456549f27
0c5054210800810081c08180a9c0b300
d1c001010101023a801871382d40582c
4500dd0c1100001e000000ff00323442
3038343539534c300a20000000fd0032
4c1e5311000a202020202020000000fc
0042656e5120424c323430300a200046

Extracted contents:
header:          00 ff ff ff ff ff ff 00
serial number:   09 d1 02 80 45 54 00 00 10 15
version:         01 03
basic params:    80 35 1e 78 2e
chroma info:     b7 d5 a4 56 54 9f 27 0c 50 54
established:     21 08 00
standard:        81 00 81 c0 81 80 a9 c0 b3 00 d1 c0 01 01 01 01
descriptor 1:    02 3a 80 18 71 38 2d 40 58 2c 45 00 dd 0c 11 00 00 1e
descriptor 2:    00 00 00 ff 00 32 34 42 30 38 34 35 39 53 4c 30 0a 20
descriptor 3:    00 00 00 fd 00 32 4c 1e 53 11 00 0a 20 20 20 20 20 20
descriptor 4:    00 00 00 fc 00 42 65 6e 51 20 42 4c 32 34 30 30 0a 20
extensions:      00
checksum:        46

EDID version: 1.3
Manufacturer: BNQ Model 8002 Serial Number --
Made in week 16 of 2011
Digital display
Maximum image size: 53 cm x 30 cm
Gamma: 2.20
DPMS levels: Off
RGB color display
Default (sRGB) color space is primary color space
First detailed timing is preferred timing
Display x,y Chromaticity:
  Red:   0.6425, 0.3388
  Green: 0.3291, 0.6240
  Blue:  0.1552, 0.0478
  White: 0.3134, 0.3291
Established timings supported:
  640x480@60Hz 4:3 HorFreq: 31469 Hz Clock: 25.175 MHz
  800x600@60Hz 4:3 HorFreq: 37900 Hz Clock: 40.000 MHz
  1024x768@60Hz 4:3 HorFreq: 48400 Hz Clock: 65.000 MHz
Standard timings supported:
  1280x800@60Hz 16:10
  1280x720@60Hz 16:9
  1280x1024@60Hz 5:4 HorFreq: 64000 Hz Clock: 108.000 MHz
  1600x900@60Hz 16:9
  1680x1050@60Hz 16:10 HorFreq: 64700 Hz Clock: 119.000 MHz
  1920x1080@60Hz 16:9
Detailed mode: Clock 148.500 MHz, 477 mm x 268 mm
               1920 2008 2052 2200 hborder 0
               1080 1084 1089 1125 vborder 0
               +hsync +vsync 
               VertFreq: 60 Hz, HorFreq: 67500 Hz
Serial number: --
Monitor ranges (GTF): 50-76Hz V, 30-83kHz H, max dotclock 170MHz
Monitor name: BenQ BL2400
Checksum: 0x46 (valid)
EDID block does NOT conform to EDID 1.3!
	sRGB is signaled, but the chromaticities do not match


