edid-decode (hex):

00 ff ff ff ff ff ff 00 30 ae cd 23 01 01 01 01
16 11 01 03 6d 1e 17 78 28 71 d6 a2 56 49 96 24
13 4f 54 bd ce 00 61 40 01 01 01 01 01 01 01 01
01 01 01 01 01 01 64 19 00 40 41 00 26 30 18 88
36 00 30 e4 10 00 00 18 00 00 00 fc 00 4c 45 4e
20 4c 31 35 31 0a 20 20 20 20 00 00 00 fd 00 38
4c 1e 3f 08 00 0a 20 20 20 20 20 20 00 00 00 ff
00 56 36 42 52 41 38 34 0a 20 20 20 20 20 00 a1

00 ff ff ff ff ff ff 00 30 ae cd 23 01 01 01 01
16 11 01 03 6d 1e 17 78 28 71 d6 a2 56 49 96 24
13 4f 54 bd ce 00 61 40 01 01 01 01 01 01 01 01
01 01 01 01 01 01 64 19 00 40 41 00 26 30 18 88
36 00 30 e4 10 00 00 18 00 00 00 fc 00 4c 45 4e
20 4c 31 35 31 0a 20 20 20 20 00 00 00 fd 00 38
4c 1e 3f 08 00 0a 20 20 20 20 20 20 00 00 00 ff
00 56 36 42 52 41 38 34 0a 20 20 20 20 20 00 a1

----------------

Block 0, Base EDID:
  EDID Structure Version & Revision: 1.3
  Vendor & Product Identification:
    Manufacturer: LEN
    Model: 9165
    Serial Number: ...
    Made in: week 22 of 2007
  Basic Display Parameters & Features:
    Analog display
    Signal Level Standard: 0.700 : 0.000 : 0.700 V p-p
    Blank level equals black level
    Sync: Separate Composite Serration
    Maximum image size: 30 cm x 23 cm
    Gamma: 2.20
    DPMS levels: Off
    RGB color display
  Color Characteristics:
    Red  : 0.6337, 0.3388
    Green: 0.2851, 0.5869
    Blue : 0.1435, 0.0751
    White: 0.3095, 0.3300
  Established Timings I & II:
    IBM     :   720x400    70.081663 Hz   9:5     31.467 kHz     28.320000 MHz
    DMT 0x04:   640x480    59.940476 Hz   4:3     31.469 kHz     25.175000 MHz
    Apple   :   640x480    66.666667 Hz   4:3     35.000 kHz     30.240000 MHz
    DMT 0x05:   640x480    72.808802 Hz   4:3     37.861 kHz     31.500000 MHz
    DMT 0x06:   640x480    75.000000 Hz   4:3     37.500 kHz     31.500000 MHz
    DMT 0x09:   800x600    60.316541 Hz   4:3     37.879 kHz     40.000000 MHz
    DMT 0x0a:   800x600    72.187572 Hz   4:3     48.077 kHz     50.000000 MHz
    DMT 0x0b:   800x600    75.000000 Hz   4:3     46.875 kHz     49.500000 MHz
    DMT 0x10:  1024x768    60.003840 Hz   4:3     48.363 kHz     65.000000 MHz
    DMT 0x11:  1024x768    70.069359 Hz   4:3     56.476 kHz     75.000000 MHz
    DMT 0x12:  1024x768    75.028582 Hz   4:3     60.023 kHz     78.750000 MHz
  Standard Timings:
    DMT 0x10:  1024x768    60.003840 Hz   4:3     48.363 kHz     65.000000 MHz
  Detailed Timing Descriptors:
    DTD 1:  1024x768    60.003840 Hz   4:3     48.363 kHz     65.000000 MHz (304 mm x 228 mm)
                 Hfront   24 Hsync 136 Hback  160 Hpol N
                 Vfront    3 Vsync   6 Vback   29 Vpol N
    Display Product Name: 'LEN L151'
    Display Range Limits:
      Monitor ranges (GTF): 56-76 Hz V, 30-63 kHz H, max dotclock 80 MHz
    Display Product Serial Number: ...
Checksum: 0xa1

----------------

Block 1, Unknown EDID Extension Block 0x00:
  00 ff ff ff ff ff ff 00 30 ae cd 23 01 01 01 01 '........0..#....'
  16 11 01 03 6d 1e 17 78 28 71 d6 a2 56 49 96 24 '....m..x(q..VI.$'
  13 4f 54 bd ce 00 61 40 01 01 01 01 01 01 01 01 '.OT...a@........'
  01 01 01 01 01 01 64 19 00 40 41 00 26 30 18 88 '......d..@A.&0..'
  36 00 30 e4 10 00 00 18 00 00 00 fc 00 4c 45 4e '6.0..........LEN'
  20 4c 31 35 31 0a 20 20 20 20 00 00 00 fd 00 38 ' L151.    .....8'
  4c 1e 3f 08 00 0a 20 20 20 20 20 20 00 00 00 ff 'L.?...      ....'
  00 56 36 42 52 41 38 34 0a 20 20 20 20 20 00 a1 '.V6BRA84.     ..'
Checksum: 0xa1

----------------

Failures:

Block 0, Base EDID:
  Basic Display Parameters & Features: EDID 1.3 requires that the first detailed timing is the preferred timing.
Block 1, Base EDID:
  Unknown Extension Block.
EDID:
  Base EDID: EDID specified 0 extension block(s), but found 1 extension block(s).

EDID conformity: FAIL
