edid-decode (hex):

00 ff ff ff ff ff ff 00 09 e5 90 05 00 00 00 00
01 14 01 03 80 1f 11 78 0a 3f a0 93 55 55 95 27
1e 50 54 00 00 00 01 01 01 01 01 01 01 01 01 01
01 01 01 01 01 01 13 1b 56 64 50 00 14 30 30 20
36 00 35 ad 10 00 00 1a 13 1b 56 64 50 00 14 30
30 20 36 00 35 ad 10 00 00 1a 00 00 00 fe 00 42
4f 45 20 4f 54 0a 20 20 20 20 20 20 00 00 00 fe
00 48 54 31 34 30 57 58 42 2d 31 30 31 0a 00 28

----------------

Block 0, Base EDID:
  EDID Structure Version & Revision: 1.3
  Vendor & Product Identification:
    Manufacturer: BOE
    Model: 1424
    Made in: week 1 of 2010
  Basic Display Parameters & Features:
    Digital display
    Maximum image size: 31 cm x 17 cm
    Gamma: 2.20
    RGB color display
    First detailed timing is preferred timing
  Color Characteristics:
    Red  : 0.5742, 0.3349
    Green: 0.3349, 0.5849
    Blue : 0.1542, 0.1191
    White: 0.3125, 0.3281
  Established Timings I & II: none
  Standard Timings: none
  Detailed Timing Descriptors:
    DTD 1:  1366x768    59.998 Hz 683:384  47.278 kHz  69.310 MHz (309 mm x 173 mm)
                 Hfront   48 Hsync  32 Hback  20 Hpol P
                 Vfront    3 Vsync   6 Vback  11 Vpol N
    DTD 2:  1366x768    59.998 Hz 683:384  47.278 kHz  69.310 MHz (309 mm x 173 mm)
                 Hfront   48 Hsync  32 Hback  20 Hpol P
                 Vfront    3 Vsync   6 Vback  11 Vpol N
    Alphanumeric Data String: 'BOE OT'
    Alphanumeric Data String: 'HT140WXB-101'
Checksum: 0x28
