edid-decode (hex):

00 ff ff ff ff ff ff 00 1e 6d 58 9c ea 03 00 00
07 10 01 03 80 46 27 78 ea d9 b0 a3 57 49 9c 25
11 49 4b a5 6e 80 31 40 01 01 01 01 45 40 01 01
61 40 01 01 01 01 1b 21 50 a0 51 00 1e 30 48 88
35 00 bc 88 21 00 00 1c 4e 1f 00 80 51 00 1e 30
40 80 37 00 bc 88 21 00 00 18 00 00 00 fc 00 34
32 4c 43 32 52 2d 5a 48 0a 20 20 20 00 00 00 fd
00 38 4b 1f 3d 09 00 0a 20 20 20 20 20 20 01 1b

02 03 24 f1 49 85 04 02 01 03 11 12 13 14 23 09
07 07 23 09 07 07 23 09 07 07 83 01 00 00 65 03
0c 00 10 00 01 1d 00 80 51 d0 1c 20 40 80 35 00
bc 88 21 00 00 1e 8c 0a d0 8a 20 e0 2d 10 10 3e
96 00 13 8e 21 00 00 18 2a 12 00 10 41 43 17 20
28 60 35 00 00 00 32 00 00 1c 01 1d 80 18 71 1c
16 20 58 2c 25 00 c4 8e 21 00 00 9e 00 00 00 00
00 00 00 00 00 00 00 00 00 00 00 00 00 00 00 6b

00 ff ff ff ff ff ff 00 1e 6d 58 9c ea 03 00 00
07 10 01 03 80 46 27 78 ea d9 b0 a3 57 49 9c 25
11 49 4b a5 6e 80 31 40 01 01 01 01 45 40 01 01
61 40 01 01 01 01 1b 21 50 a0 51 00 1e 30 48 88
35 00 bc 88 21 00 00 1c 4e 1f 00 80 51 00 1e 30
40 80 37 00 bc 88 21 00 00 18 00 00 00 fc 00 34
32 4c 43 32 52 2d 5a 48 0a 20 20 20 00 00 00 fd
00 38 4b 1f 3d 09 00 0a 20 20 20 20 20 20 01 1b

02 03 24 f1 49 85 04 02 01 03 11 12 13 14 23 09
07 07 23 09 07 07 23 09 07 07 83 01 00 00 65 03
0c 00 10 00 01 1d 00 80 51 d0 1c 20 40 80 35 00
bc 88 21 00 00 1e 8c 0a d0 8a 20 e0 2d 10 10 3e
96 00 13 8e 21 00 00 18 2a 12 00 10 41 43 17 20
28 60 35 00 00 00 32 00 00 1c 01 1d 80 18 71 1c
16 20 58 2c 25 00 c4 8e 21 00 00 9e 00 00 00 00
00 00 00 00 00 00 00 00 00 00 00 00 00 00 00 6b

----------------

Block 0, Base EDID:
  EDID Structure Version & Revision: 1.3
  Vendor & Product Identification:
    Manufacturer: GSM
    Model: 40024
    Serial Number: ...
    Made in: week 7 of 2006
  Basic Display Parameters & Features:
    Digital display
    Maximum image size: 70 cm x 39 cm
    Gamma: 2.20
    DPMS levels: Standby Suspend Off
    RGB color display
    First detailed timing is the preferred timing
  Color Characteristics:
    Red  : 0.6396, 0.3408
    Green: 0.2871, 0.6103
    Blue : 0.1464, 0.0693
    White: 0.2851, 0.2929
  Established Timings I & II:
    IBM     :   720x400    70.081663 Hz   9:5     31.467 kHz     28.320000 MHz
    DMT 0x04:   640x480    59.940476 Hz   4:3     31.469 kHz     25.175000 MHz
    DMT 0x06:   640x480    75.000000 Hz   4:3     37.500 kHz     31.500000 MHz
    DMT 0x09:   800x600    60.316541 Hz   4:3     37.879 kHz     40.000000 MHz
    DMT 0x0b:   800x600    75.000000 Hz   4:3     46.875 kHz     49.500000 MHz
    Apple   :   832x624    74.551266 Hz   4:3     49.726 kHz     57.284000 MHz
    DMT 0x10:  1024x768    60.003840 Hz   4:3     48.363 kHz     65.000000 MHz
    DMT 0x11:  1024x768    70.069359 Hz   4:3     56.476 kHz     75.000000 MHz
    DMT 0x12:  1024x768    75.028582 Hz   4:3     60.023 kHz     78.750000 MHz
    Apple   :  1152x870    75.061550 Hz 192:145   68.681 kHz    100.000000 MHz
  Standard Timings:
    DMT 0x04:   640x480    59.940476 Hz   4:3     31.469 kHz     25.175000 MHz
    DMT 0x09:   800x600    60.316541 Hz   4:3     37.879 kHz     40.000000 MHz
    DMT 0x10:  1024x768    60.003840 Hz   4:3     48.363 kHz     65.000000 MHz
  Detailed Timing Descriptors:
    DTD  1:  1360x768    59.798991 Hz  85:48    47.720 kHz     84.750000 MHz (700 mm x 392 mm)
                  Hfront   72 Hsync 136 Hback  208 Hpol N
                  Vfront    3 Vsync   5 Vback   22 Vpol P
    DTD  2:  1280x768    60.352203 Hz   5:3     48.161 kHz     80.140000 MHz (700 mm x 392 mm)
                  Hfront   64 Hsync 128 Hback  192 Hpol N
                  Vfront    3 Vsync   7 Vback   20 Vpol N
    Display Product Name: '42LC2R-ZH'
    Display Range Limits:
      Monitor ranges (GTF): 56-75 Hz V, 31-61 kHz H, max dotclock 90 MHz
  Extension blocks: 1
Checksum: 0x1b

----------------

Block 1, CTA-861 Extension Block:
  Revision: 3
  Underscans IT Video Formats by default
  Basic audio support
  Supports YCbCr 4:4:4
  Supports YCbCr 4:2:2
  Native detailed modes: 1
  Video Data Block:
    VIC   5:  1920x1080i  60.000000 Hz  16:9     33.750 kHz     74.250000 MHz (native)
    VIC   4:  1280x720    60.000000 Hz  16:9     45.000 kHz     74.250000 MHz
    VIC   2:   720x480    59.940060 Hz   4:3     31.469 kHz     27.000000 MHz
    VIC   1:   640x480    59.940476 Hz   4:3     31.469 kHz     25.175000 MHz
    VIC   3:   720x480    59.940060 Hz  16:9     31.469 kHz     27.000000 MHz
    VIC  17:   720x576    50.000000 Hz   4:3     31.250 kHz     27.000000 MHz
    VIC  18:   720x576    50.000000 Hz  16:9     31.250 kHz     27.000000 MHz
    VIC  19:  1280x720    50.000000 Hz  16:9     37.500 kHz     74.250000 MHz
    VIC  20:  1920x1080i  50.000000 Hz  16:9     28.125 kHz     74.250000 MHz
  Audio Data Block:
    Linear PCM:
      Max channels: 2
      Supported sample rates (kHz): 48 44.1 32
      Supported sample sizes (bits): 24 20 16
  Audio Data Block:
    Linear PCM:
      Max channels: 2
      Supported sample rates (kHz): 48 44.1 32
      Supported sample sizes (bits): 24 20 16
  Audio Data Block:
    Linear PCM:
      Max channels: 2
      Supported sample rates (kHz): 48 44.1 32
      Supported sample sizes (bits): 24 20 16
  Speaker Allocation Data Block:
    FL/FR - Front Left/Right
  Vendor-Specific Data Block (HDMI), OUI 00-0C-03:
    Source physical address: 1.0.0.0
  Detailed Timing Descriptors:
    DTD  3:  1280x720    59.654270 Hz  16:9     44.621 kHz     74.250000 MHz (700 mm x 392 mm)
                  Hfront   64 Hsync 128 Hback  192 Hpol P
                  Vfront    3 Vsync   5 Vback   20 Vpol P
    DTD  4:   720x480    59.940060 Hz   3:2     31.469 kHz     27.000000 MHz (531 mm x 398 mm)
                  Hfront   16 Hsync  62 Hback   60 Hpol N
                  Vfront    9 Vsync   6 Vback   30 Vpol N
    DTD  5:  1024x579    59.600714 Hz 1024:579   35.880 kHz     46.500000 MHz (768 mm x 512 mm)
                  Hfront   40 Hsync  96 Hback  136 Hpol N
                  Vfront    3 Vsync   5 Vback   15 Vpol P
    DTD  6:  1920x1080i  60.000000 Hz  16:9     33.750 kHz     74.250000 MHz (708 mm x 398 mm)
                  Hfront   88 Hsync  44 Hback  148 Hpol P
                  Vfront    2 Vsync   5 Vback   15 Vpol P Vfront +0.5 Odd Field
                  Vfront    2 Vsync   5 Vback   15 Vpol P Vback  +0.5 Even Field
Checksum: 0x6b  Unused space in Extension Block: 19 bytes

----------------

Block 2, Unknown EDID Extension Block 0x00:
  00 ff ff ff ff ff ff 00 1e 6d 58 9c ea 03 00 00 '.........mX.....'
  07 10 01 03 80 46 27 78 ea d9 b0 a3 57 49 9c 25 '.....F'x....WI.%'
  11 49 4b a5 6e 80 31 40 01 01 01 01 45 40 01 01 '.IK.n.1@....E@..'
  61 40 01 01 01 01 1b 21 50 a0 51 00 1e 30 48 88 'a@.....!P.Q..0H.'
  35 00 bc 88 21 00 00 1c 4e 1f 00 80 51 00 1e 30 '5...!...N...Q..0'
  40 80 37 00 bc 88 21 00 00 18 00 00 00 fc 00 34 '@.7...!........4'
  32 4c 43 32 52 2d 5a 48 0a 20 20 20 00 00 00 fd '2LC2R-ZH.   ....'
  00 38 4b 1f 3d 09 00 0a 20 20 20 20 20 20 01 1b '.8K.=...      ..'
Checksum: 0x1b

----------------

Block 3, CTA-861 Extension Block:
  Revision: 3
  Underscans IT Video Formats by default
  Basic audio support
  Supports YCbCr 4:4:4
  Supports YCbCr 4:2:2
  Native detailed modes: 1
  Video Data Block:
    VIC   5:  1920x1080i  60.000000 Hz  16:9     33.750 kHz     74.250000 MHz (native)
    VIC   4:  1280x720    60.000000 Hz  16:9     45.000 kHz     74.250000 MHz
    VIC   2:   720x480    59.940060 Hz   4:3     31.469 kHz     27.000000 MHz
    VIC   1:   640x480    59.940476 Hz   4:3     31.469 kHz     25.175000 MHz
    VIC   3:   720x480    59.940060 Hz  16:9     31.469 kHz     27.000000 MHz
    VIC  17:   720x576    50.000000 Hz   4:3     31.250 kHz     27.000000 MHz
    VIC  18:   720x576    50.000000 Hz  16:9     31.250 kHz     27.000000 MHz
    VIC  19:  1280x720    50.000000 Hz  16:9     37.500 kHz     74.250000 MHz
    VIC  20:  1920x1080i  50.000000 Hz  16:9     28.125 kHz     74.250000 MHz
  Audio Data Block:
    Linear PCM:
      Max channels: 2
      Supported sample rates (kHz): 48 44.1 32
      Supported sample sizes (bits): 24 20 16
  Audio Data Block:
    Linear PCM:
      Max channels: 2
      Supported sample rates (kHz): 48 44.1 32
      Supported sample sizes (bits): 24 20 16
  Audio Data Block:
    Linear PCM:
      Max channels: 2
      Supported sample rates (kHz): 48 44.1 32
      Supported sample sizes (bits): 24 20 16
  Speaker Allocation Data Block:
    FL/FR - Front Left/Right
  Vendor-Specific Data Block (HDMI), OUI 00-0C-03:
    Source physical address: 1.0.0.0
  Detailed Timing Descriptors:
    DTD  7:  1280x720    59.654270 Hz  16:9     44.621 kHz     74.250000 MHz (700 mm x 392 mm)
                  Hfront   64 Hsync 128 Hback  192 Hpol P
                  Vfront    3 Vsync   5 Vback   20 Vpol P
    DTD  8:   720x480    59.940060 Hz   3:2     31.469 kHz     27.000000 MHz (531 mm x 398 mm)
                  Hfront   16 Hsync  62 Hback   60 Hpol N
                  Vfront    9 Vsync   6 Vback   30 Vpol N
    DTD  9:  1024x579    59.600714 Hz 1024:579   35.880 kHz     46.500000 MHz (768 mm x 512 mm)
                  Hfront   40 Hsync  96 Hback  136 Hpol N
                  Vfront    3 Vsync   5 Vback   15 Vpol P
    DTD 10:  1920x1080i  60.000000 Hz  16:9     33.750 kHz     74.250000 MHz (708 mm x 398 mm)
                  Hfront   88 Hsync  44 Hback  148 Hpol P
                  Vfront    2 Vsync   5 Vback   15 Vpol P Vfront +0.5 Odd Field
                  Vfront    2 Vsync   5 Vback   15 Vpol P Vback  +0.5 Even Field
Checksum: 0x6b  Unused space in Extension Block: 19 bytes

----------------

Warnings:

Block 1, CTA-861 Extension Block:
  Add a Colorimetry Data Block with the sRGB colorimetry bit set to avoid interop issues.
Block 3, CTA-861 Extension Block:
  Add a Colorimetry Data Block with the sRGB colorimetry bit set to avoid interop issues.
EDID:
  CTA-861: Multiple native interlaced timings are defined.

Failures:

Block 1, CTA-861 Extension Block:
  Detailed Timing Descriptor #5: Mismatch of image size 768x512 mm vs display size 700x390 mm.
  Missing VCDB, needed for Set Selectable RGB Quantization to avoid interop issues.
Block 2, Base EDID:
  Unknown Extension Block.
Block 3, CTA-861 Extension Block:
  Video Data Block: Duplicate VIC 5.
  Video Data Block: Duplicate VIC 4.
  Video Data Block: Duplicate VIC 2.
  Video Data Block: Duplicate VIC 1.
  Video Data Block: Duplicate VIC 3.
  Video Data Block: Duplicate VIC 17.
  Video Data Block: Duplicate VIC 18.
  Video Data Block: Duplicate VIC 19.
  Video Data Block: Duplicate VIC 20.
  Speaker Allocation Data Block: Only one instance of this Data Block is allowed.
  Detailed Timing Descriptor #9: Mismatch of image size 768x512 mm vs display size 700x390 mm.
  Missing VCDB, needed for Set Selectable RGB Quantization to avoid interop issues.
EDID:
  Base EDID: Some timings are out of range of the Monitor Ranges:
    Vertical Freq: 50.000 - 75.062 Hz (Monitor: 56.000 - 75.000 Hz)
    Horizontal Freq: 28.125 - 68.681 kHz (Monitor: 31.000 - 61.000 kHz)
    Maximum Clock: 100.000 MHz (Monitor: 90.000 MHz)
  Base EDID: The DTD max image size is 768x512mm, which is larger than the display size 700.0x390.0mm.
  Base EDID: EDID specified 1 extension block(s), but found 3 extension block(s).
  Base EDID: EDID 1.3 requires a Block Map Extension in Block 1 if there are more than 2 blocks in the EDID.

EDID conformity: FAIL
