edid-decode (hex):

00 ff ff ff ff ff ff 00 04 72 d5 02 56 a2 77 22
1b 16 01 03 80 2c 19 78 2a ec 85 a2 54 4d a1 27
12 50 54 bf ee 80 71 4f 81 00 81 c0 a9 c0 01 01
01 01 01 01 01 01 30 2a 40 c8 60 84 64 30 18 50
13 00 bb f9 10 00 00 1e 00 00 00 fd 00 37 4b 1e
53 10 00 0a 20 20 20 20 20 20 00 00 00 ff 00 4c
56 46 41 41 30 30 37 34 32 30 30 0a 00 00 00 fc
00 41 63 65 72 20 53 32 30 30 48 4c 0a 20 00 2f

00 ff ff ff ff ff ff 00 04 72 d5 02 56 a2 77 22
1b 16 01 03 80 2c 19 78 2a ec 85 a2 54 4d a1 27
12 50 54 bf ee 80 71 4f 81 00 81 c0 a9 c0 01 01
01 01 01 01 01 01 30 2a 40 c8 60 84 64 30 18 50
13 00 bb f9 10 00 00 1e 00 00 00 fd 00 37 4b 1e
53 10 00 0a 20 20 20 20 20 20 00 00 00 ff 00 4c
56 46 41 41 30 30 37 34 32 30 30 0a 00 00 00 fc
00 41 63 65 72 20 53 32 30 30 48 4c 0a 20 00 2f

----------------

Block 0, Base EDID:
  EDID Structure Version & Revision: 1.3
  Vendor & Product Identification:
    Manufacturer: ACR
    Model: 725
    Serial Number: ...
    Made in: week 27 of 2012
  Basic Display Parameters & Features:
    Digital display
    Maximum image size: 44 cm x 25 cm
    Gamma: 2.20
    DPMS levels: Off
    RGB color display
    First detailed timing is the preferred timing
  Color Characteristics:
    Red  : 0.6357, 0.3300
    Green: 0.3037, 0.6289
    Blue : 0.1542, 0.0703
    White: 0.3134, 0.3291
  Established Timings I & II:
    IBM     :   720x400    70.081663 Hz   9:5     31.467 kHz     28.320000 MHz
    DMT 0x04:   640x480    59.940476 Hz   4:3     31.469 kHz     25.175000 MHz
    Apple   :   640x480    66.666667 Hz   4:3     35.000 kHz     30.240000 MHz
    DMT 0x05:   640x480    72.808802 Hz   4:3     37.861 kHz     31.500000 MHz
    DMT 0x06:   640x480    75.000000 Hz   4:3     37.500 kHz     31.500000 MHz
    DMT 0x08:   800x600    56.250000 Hz   4:3     35.156 kHz     36.000000 MHz
    DMT 0x09:   800x600    60.316541 Hz   4:3     37.879 kHz     40.000000 MHz
    DMT 0x0a:   800x600    72.187572 Hz   4:3     48.077 kHz     50.000000 MHz
    DMT 0x0b:   800x600    75.000000 Hz   4:3     46.875 kHz     49.500000 MHz
    Apple   :   832x624    74.551266 Hz   4:3     49.726 kHz     57.284000 MHz
    DMT 0x10:  1024x768    60.003840 Hz   4:3     48.363 kHz     65.000000 MHz
    DMT 0x11:  1024x768    70.069359 Hz   4:3     56.476 kHz     75.000000 MHz
    DMT 0x12:  1024x768    75.028582 Hz   4:3     60.023 kHz     78.750000 MHz
    Apple   :  1152x870    75.061550 Hz 192:145   68.681 kHz    100.000000 MHz
  Standard Timings:
    DMT 0x15:  1152x864    75.000000 Hz   4:3     67.500 kHz    108.000000 MHz
    DMT 0x1c:  1280x800    59.810326 Hz  16:10    49.702 kHz     83.500000 MHz
    DMT 0x55:  1280x720    60.000000 Hz  16:9     45.000 kHz     74.250000 MHz
    DMT 0x53:  1600x900    60.000000 Hz  16:9     60.000 kHz    108.000000 MHz (RB)
  Detailed Timing Descriptors:
    DTD 1:  1600x900    60.000000 Hz  16:9     60.000 kHz    108.000000 MHz (443 mm x 249 mm)
                 Hfront   24 Hsync  80 Hback   96 Hpol P
                 Vfront    1 Vsync   3 Vback   96 Vpol P
    Display Range Limits:
      Monitor ranges (GTF): 55-75 Hz V, 30-83 kHz H, max dotclock 160 MHz
    Display Product Serial Number: ...
    Display Product Name: 'Acer S200HL'
Checksum: 0x2f

----------------

Block 1, Unknown EDID Extension Block 0x00:
  00 ff ff ff ff ff ff 00 04 72 d5 02 56 a2 77 22 '.........r..V.w"'
  1b 16 01 03 80 2c 19 78 2a ec 85 a2 54 4d a1 27 '.....,.x*...TM.''
  12 50 54 bf ee 80 71 4f 81 00 81 c0 a9 c0 01 01 '.PT...qO........'
  01 01 01 01 01 01 30 2a 40 c8 60 84 64 30 18 50 '......0*@.`.d0.P'
  13 00 bb f9 10 00 00 1e 00 00 00 fd 00 37 4b 1e '.............7K.'
  53 10 00 0a 20 20 20 20 20 20 00 00 00 ff 00 4c 'S...      .....L'
  56 46 41 41 30 30 37 34 32 30 30 0a 00 00 00 fc 'VFAA0074200.....'
  00 41 63 65 72 20 53 32 30 30 48 4c 0a 20 00 2f '.Acer S200HL. ./'
Checksum: 0x2f

----------------

Failures:

Block 1, Base EDID:
  Unknown Extension Block.
EDID:
  Base EDID: EDID specified 0 extension block(s), but found 1 extension block(s).

EDID conformity: FAIL
