edid-decode (hex):

00 ff ff ff ff ff ff 00 4c a3 4e 43 00 00 00 00
00 12 01 04 95 1f 11 78 0a 85 95 99 57 4f 8f 26
21 50 54 00 00 00 01 01 01 01 01 01 01 01 01 01
01 01 01 01 01 01 1c 2a 40 4c 61 84 1e 30 30 20
25 00 36 ae 10 00 00 19 13 1c 40 4c 61 84 1e 30
30 20 25 00 36 ae 10 00 00 19 00 00 00 00 00 00
00 00 00 00 00 00 00 00 00 00 00 00 00 00 00 02
00 0c 42 f2 0b 3c 69 2d 10 21 6e 00 00 00 00 90

----------------

Block 0, Base EDID:
  EDID Structure Version & Revision: 1.4
  Vendor & Product Identification:
    Manufacturer: SEC
    Model: 17230
    Made in: 2008
  Basic Display Parameters & Features:
    Digital display
    Bits per primary color channel: 6
    DisplayPort interface
    Maximum image size: 31 cm x 17 cm
    Gamma: 2.20
    Supported color formats: RGB 4:4:4, YCrCb 4:4:4
    First detailed timing includes the native pixel format and preferred refresh rate
  Color Characteristics:
    Red  : 0.5996, 0.3398
    Green: 0.3095, 0.5595
    Blue : 0.1503, 0.1298
    White: 0.3134, 0.3291
  Established Timings I & II: none
  Standard Timings: none
  Detailed Timing Descriptors:
    DTD 1:  1600x900    59.996883 Hz  16:9     55.797 kHz    107.800000 MHz (310 mm x 174 mm)
                 Hfront   48 Hsync  32 Hback  252 Hpol N
                 Vfront    2 Vsync   5 Vback   23 Vpol N
    DTD 2:  1600x900    39.999777 Hz  16:9     37.200 kHz     71.870000 MHz (310 mm x 174 mm)
                 Hfront   48 Hsync  32 Hback  252 Hpol N
                 Vfront    2 Vsync   5 Vback   23 Vpol N
    Empty Descriptor
    Manufacturer-Specified Display Descriptor (0x02): 00 02 00 0c 42 f2 0b 3c 69 2d 10 21 6e 00 00 00 '....B..<i-.!n...'
Checksum: 0x90

----------------

Failures:

Block 0, Base EDID:
  Empty Descriptor: Use Dummy Descriptor instead of all zeroes.
  Missing Display Product Name.

EDID conformity: FAIL
