
EDID (hex):
00ffffffffffff000daf131100000000
09130103801a0e780afe75925b569127
1f505400000001010101010101010101
010101010101121b566c500010302016
2400009010000018000000fe004e3131
364247452d4c34310a20000000fe0043
4d4f0a202020202020202020000000fe
004e3131364247452d4c34310a20008f

Extracted contents:
header:          00 ff ff ff ff ff ff 00
serial number:   0d af 13 11 00 00 00 00 09 13
version:         01 03
basic params:    80 1a 0e 78 0a
chroma info:     fe 75 92 5b 56 91 27 1f 50 54
established:     00 00 00
standard:        01 01 01 01 01 01 01 01 01 01 01 01 01 01 01 01
descriptor 1:    12 1b 56 6c 50 00 10 30 20 16 24 00 00 90 10 00 00 18
descriptor 2:    00 00 00 fe 00 4e 31 31 36 42 47 45 2d 4c 34 31 0a 20
descriptor 3:    00 00 00 fe 00 43 4d 4f 0a 20 20 20 20 20 20 20 20 20
descriptor 4:    00 00 00 fe 00 4e 31 31 36 42 47 45 2d 4c 34 31 0a 20
extensions:      00
checksum:        8f

EDID version: 1.3
Manufacturer: CMO Model 1113 Serial Number --
Made in week 9 of 2009
Digital display
Maximum image size: 26 cm x 14 cm
Gamma: 2.20
RGB color display
First detailed timing is preferred timing
Display x,y Chromaticity:
  Red:   0.5732, 0.3583
  Green: 0.3388, 0.5683
  Blue:  0.1533, 0.1240
  White: 0.3134, 0.3291
Established timings supported:
Standard timings supported:
Detailed mode: Clock 69.300 MHz, 256 mm x 144 mm
               1366 1398 1420 1474 hborder 0
                768  770  774  784 vborder 0
               -hsync -vsync 
               VertFreq: 59 Hz, HorFreq: 47014 Hz
ASCII string: N116BGE-L41
ASCII string: CMO
ASCII string: N116BGE-L41
Checksum: 0x8f (valid)
EDID block does NOT conform to EDID 1.3!
	Missing name descriptor
	Missing monitor ranges
