edid-decode (hex):

00 ff ff ff ff ff ff 00 05 e3 02 19 7c 01 00 00
24 10 01 03 81 29 1a 78 2a d7 a5 a2 59 4a 96 24
14 50 54 bf ef 00 81 80 71 4f 81 40 95 0f 01 01
01 01 01 01 95 00 30 2a a0 d0 51 84 22 30 50 98
36 00 9a 01 11 00 00 1e 00 00 00 ff 00 39 33 31
36 39 43 41 30 30 30 33 38 30 00 00 00 fd 00 32
4c 1e 53 0e 00 0a 20 20 20 20 20 20 00 00 00 fc
00 47 31 39 4c 57 6b 0a 20 20 20 20 20 20 00 6a

00 ff ff ff ff ff ff 00 05 e3 02 19 7c 01 00 00
24 10 01 03 81 29 1a 78 2a d7 a5 a2 59 4a 96 24
14 50 54 bf ef 00 81 80 71 4f 81 40 95 0f 01 01
01 01 01 01 95 00 30 2a a0 d0 51 84 22 30 50 98
36 00 9a 01 11 00 00 1e 00 00 00 ff 00 39 33 31
36 39 43 41 30 30 30 33 38 30 00 00 00 fd 00 32
4c 1e 53 0e 00 0a 20 20 20 20 20 20 00 00 00 fc
00 47 31 39 4c 57 6b 0a 20 20 20 20 20 20 00 6a

----------------

Block 0, Base EDID:
  EDID Structure Version & Revision: 1.3
  Vendor & Product Identification:
    Manufacturer: AOC
    Model: 6402
    Serial Number: ...
    Made in: week 36 of 2006
  Basic Display Parameters & Features:
    Digital display
    DFP 1.x compatible TMDS
    Maximum image size: 41 cm x 26 cm
    Gamma: 2.20
    DPMS levels: Off
    RGB color display
    First detailed timing is the preferred timing
  Color Characteristics:
    Red  : 0.6357, 0.3486
    Green: 0.2900, 0.5888
    Blue : 0.1425, 0.0800
    White: 0.3134, 0.3291
  Established Timings I & II:
    IBM     :   720x400    70.081663 Hz   9:5     31.467 kHz     28.320000 MHz
    DMT 0x04:   640x480    59.940476 Hz   4:3     31.469 kHz     25.175000 MHz
    Apple   :   640x480    66.666667 Hz   4:3     35.000 kHz     30.240000 MHz
    DMT 0x05:   640x480    72.808802 Hz   4:3     37.861 kHz     31.500000 MHz
    DMT 0x06:   640x480    75.000000 Hz   4:3     37.500 kHz     31.500000 MHz
    DMT 0x08:   800x600    56.250000 Hz   4:3     35.156 kHz     36.000000 MHz
    DMT 0x09:   800x600    60.316541 Hz   4:3     37.879 kHz     40.000000 MHz
    DMT 0x0a:   800x600    72.187572 Hz   4:3     48.077 kHz     50.000000 MHz
    DMT 0x0b:   800x600    75.000000 Hz   4:3     46.875 kHz     49.500000 MHz
    Apple   :   832x624    74.551266 Hz   4:3     49.726 kHz     57.284000 MHz
    DMT 0x10:  1024x768    60.003840 Hz   4:3     48.363 kHz     65.000000 MHz
    DMT 0x11:  1024x768    70.069359 Hz   4:3     56.476 kHz     75.000000 MHz
    DMT 0x12:  1024x768    75.028582 Hz   4:3     60.023 kHz     78.750000 MHz
    DMT 0x24:  1280x1024   75.024675 Hz   5:4     79.976 kHz    135.000000 MHz
  Standard Timings:
    DMT 0x23:  1280x1024   60.019740 Hz   5:4     63.981 kHz    108.000000 MHz
    DMT 0x15:  1152x864    75.000000 Hz   4:3     67.500 kHz    108.000000 MHz
    DMT 0x20:  1280x960    60.000000 Hz   4:3     60.000 kHz    108.000000 MHz
    DMT 0x30:  1440x900    74.984427 Hz  16:10    70.635 kHz    136.750000 MHz
    DMT 0x2f:  1440x900    59.887445 Hz  16:10    55.935 kHz    106.500000 MHz
  Detailed Timing Descriptors:
    DTD 1:  1440x900    60.730930 Hz  16:10    56.723 kHz    108.000000 MHz (410 mm x 257 mm)
                 Hfront   80 Hsync 152 Hback  232 Hpol P
                 Vfront    3 Vsync   6 Vback   25 Vpol P
    Display Product Serial Number: ...
    Display Range Limits:
      Monitor ranges (GTF): 50-76 Hz V, 30-83 kHz H, max dotclock 140 MHz
    Display Product Name: 'G19LWk'
Checksum: 0x6a

----------------

Block 1, Unknown EDID Extension Block 0x00:
  00 ff ff ff ff ff ff 00 05 e3 02 19 7c 01 00 00 '............|...'
  24 10 01 03 81 29 1a 78 2a d7 a5 a2 59 4a 96 24 '$....).x*...YJ.$'
  14 50 54 bf ef 00 81 80 71 4f 81 40 95 0f 01 01 '.PT.....qO.@....'
  01 01 01 01 95 00 30 2a a0 d0 51 84 22 30 50 98 '......0*..Q."0P.'
  36 00 9a 01 11 00 00 1e 00 00 00 ff 00 39 33 31 '6............931'
  36 39 43 41 30 30 30 33 38 30 00 00 00 fd 00 32 '69CA000380.....2'
  4c 1e 53 0e 00 0a 20 20 20 20 20 20 00 00 00 fc 'L.S...      ....'
  00 47 31 39 4c 57 6b 0a 20 20 20 20 20 20 00 6a '.G19LWk.      .j'
Checksum: 0x6a

----------------

Failures:

Block 1, Base EDID:
  Unknown Extension Block.
EDID:
  Base EDID: EDID specified 0 extension block(s), but found 1 extension block(s).

EDID conformity: FAIL
