edid-decode (hex):

00 ff ff ff ff ff ff 00 05 e3 02 19 ad 05 00 00
0d 11 01 04 a5 29 1a 78 22 85 85 a6 57 4a 9c 26
12 50 54 bf ef 80 81 80 71 4f 81 40 95 0f 01 c0
01 01 01 01 95 00 9a 29 a0 d0 51 84 22 30 50 98
36 00 9a 01 11 00 00 1c 00 00 00 ff 00 39 37 36
37 33 43 41 30 30 31 34 35 33 00 00 00 fd 00 32
4c 1e 53 0e 00 0a 20 20 20 20 20 20 00 00 00 fc
00 39 31 32 53 77 73 2d 31 0a 20 20 20 20 00 b4

00 ff ff ff ff ff ff 00 05 e3 02 19 ad 05 00 00
0d 11 01 04 a5 29 1a 78 22 85 85 a6 57 4a 9c 26
12 50 54 bf ef 80 81 80 71 4f 81 40 95 0f 01 c0
01 01 01 01 95 00 9a 29 a0 d0 51 84 22 30 50 98
36 00 9a 01 11 00 00 1c 00 00 00 ff 00 39 37 36
37 33 43 41 30 30 31 34 35 33 00 00 00 fd 00 32
4c 1e 53 0e 00 0a 20 20 20 20 20 20 00 00 00 fc
00 39 31 32 53 77 73 2d 31 0a 20 20 20 20 00 b4

----------------

Block 0, Base EDID:
  EDID Structure Version & Revision: 1.4
  Vendor & Product Identification:
    Manufacturer: AOC
    Model: 6402
    Serial Number: ...
    Made in: week 13 of 2007
  Basic Display Parameters & Features:
    Digital display
    Bits per primary color channel: 8
    DisplayPort interface
    Maximum image size: 41 cm x 26 cm
    Gamma: 2.20
    DPMS levels: Off
    Supported color formats: RGB 4:4:4
    First detailed timing includes the native pixel format and preferred refresh rate
  Color Characteristics:
    Red  : 0.6503, 0.3398
    Green: 0.2900, 0.6103
    Blue : 0.1503, 0.0703
    White: 0.3134, 0.3291
  Established Timings I & II:
    IBM     :   720x400    70.081663 Hz   9:5     31.467 kHz     28.320000 MHz
    DMT 0x04:   640x480    59.940476 Hz   4:3     31.469 kHz     25.175000 MHz
    Apple   :   640x480    66.666667 Hz   4:3     35.000 kHz     30.240000 MHz
    DMT 0x05:   640x480    72.808802 Hz   4:3     37.861 kHz     31.500000 MHz
    DMT 0x06:   640x480    75.000000 Hz   4:3     37.500 kHz     31.500000 MHz
    DMT 0x08:   800x600    56.250000 Hz   4:3     35.156 kHz     36.000000 MHz
    DMT 0x09:   800x600    60.316541 Hz   4:3     37.879 kHz     40.000000 MHz
    DMT 0x0a:   800x600    72.187572 Hz   4:3     48.077 kHz     50.000000 MHz
    DMT 0x0b:   800x600    75.000000 Hz   4:3     46.875 kHz     49.500000 MHz
    Apple   :   832x624    74.551266 Hz   4:3     49.726 kHz     57.284000 MHz
    DMT 0x10:  1024x768    60.003840 Hz   4:3     48.363 kHz     65.000000 MHz
    DMT 0x11:  1024x768    70.069359 Hz   4:3     56.476 kHz     75.000000 MHz
    DMT 0x12:  1024x768    75.028582 Hz   4:3     60.023 kHz     78.750000 MHz
    DMT 0x24:  1280x1024   75.024675 Hz   5:4     79.976 kHz    135.000000 MHz
    Apple   :  1152x870    75.061550 Hz 192:145   68.681 kHz    100.000000 MHz
  Standard Timings:
    DMT 0x23:  1280x1024   60.019740 Hz   5:4     63.981 kHz    108.000000 MHz
    DMT 0x15:  1152x864    75.000000 Hz   4:3     67.500 kHz    108.000000 MHz
    DMT 0x20:  1280x960    60.000000 Hz   4:3     60.000 kHz    108.000000 MHz
    DMT 0x30:  1440x900    74.984427 Hz  16:10    70.635 kHz    136.750000 MHz
    DMT 0x2f:  1440x900    59.887445 Hz  16:10    55.935 kHz    106.500000 MHz
  Detailed Timing Descriptors:
    DTD 1:  1440x900    59.887445 Hz  16:10    55.935 kHz    106.500000 MHz (410 mm x 257 mm)
                 Hfront   80 Hsync 152 Hback  232 Hpol N
                 Vfront    3 Vsync   6 Vback   25 Vpol P
    Display Product Serial Number: ...
    Display Range Limits:
      Monitor ranges (GTF): 50-76 Hz V, 30-83 kHz H, max dotclock 140 MHz
    Display Product Name: '912Sws-1'
Checksum: 0xb4

----------------

Block 1, Unknown EDID Extension Block 0x00:
  00 ff ff ff ff ff ff 00 05 e3 02 19 ad 05 00 00 '................'
  0d 11 01 04 a5 29 1a 78 22 85 85 a6 57 4a 9c 26 '.....).x"...WJ.&'
  12 50 54 bf ef 80 81 80 71 4f 81 40 95 0f 01 c0 '.PT.....qO.@....'
  01 01 01 01 95 00 9a 29 a0 d0 51 84 22 30 50 98 '.......)..Q."0P.'
  36 00 9a 01 11 00 00 1c 00 00 00 ff 00 39 37 36 '6............976'
  37 33 43 41 30 30 31 34 35 33 00 00 00 fd 00 32 '73CA001453.....2'
  4c 1e 53 0e 00 0a 20 20 20 20 20 20 00 00 00 fc 'L.S...      ....'
  00 39 31 32 53 77 73 2d 31 0a 20 20 20 20 00 b4 '.912Sws-1.    ..'
Checksum: 0xb4

----------------

Warnings:

Block 0, Base EDID:
  Display Range Limits: GTF support is deprecated in EDID 1.4.

Failures:

Block 0, Base EDID:
  Standard Timings: Use 0x0101 as the invalid Standard Timings code, not 0x01c0.
  Display Range Limits: GTF can't be combined with non-continuous frequencies.
Block 1, Base EDID:
  Unknown Extension Block.
EDID:
  Base EDID: EDID specified 0 extension block(s), but found 1 extension block(s).

EDID conformity: FAIL
