
EDID (hex):
00ffffffffffff001ab3c10749e70000
19140104a5261e7822f7c5a3554c9b25
125054a54b0081800101010101010101
010101010101302a009851002a403070
1300782d1100001e000000fd00384c1e
520e000a202020202020000000fc0050
31392d35502045434f0a2020000000ff
00595631433035393230390a202000cc

edid-decode (hex):

00 ff ff ff ff ff ff 00 1a b3 c1 07 49 e7 00 00
19 14 01 04 a5 26 1e 78 22 f7 c5 a3 55 4c 9b 25
12 50 54 a5 4b 00 81 80 01 01 01 01 01 01 01 01
01 01 01 01 01 01 30 2a 00 98 51 00 2a 40 30 70
13 00 78 2d 11 00 00 1e 00 00 00 fd 00 38 4c 1e
52 0e 00 0a 20 20 20 20 20 20 00 00 00 fc 00 50
31 39 2d 35 50 20 45 43 4f 0a 20 20 00 00 00 ff
00 59 56 31 43 30 35 39 32 30 39 0a 20 20 00 cc

----------------

Block 0, Base EDID:
  EDID Structure Version & Revision: 1.4
  Vendor & Product Identification:
    Manufacturer: FUS
    Model: 1985
    Serial Number: 59209
    Made in: week 25 of 2010
  Basic Display Parameters & Features:
    Digital display
    Bits per primary color channel: 8
    DisplayPort interface
    Maximum image size: 38 cm x 30 cm
    Gamma: 2.20
    DPMS levels: Off
    Supported color formats: RGB 4:4:4
    First detailed timing includes the native pixel format and preferred refresh rate
  Color Characteristics:
    Red  : 0.6396, 0.3349
    Green: 0.2978, 0.6083
    Blue : 0.1474, 0.0703
    White: 0.3134, 0.3291
  Established Timings I & II:
    IBM     :   720x400    70.081663 Hz   9:5     31.467 kHz     28.320000 MHz
    DMT 0x04:   640x480    59.940476 Hz   4:3     31.469 kHz     25.175000 MHz
    DMT 0x06:   640x480    75.000000 Hz   4:3     37.500 kHz     31.500000 MHz
    DMT 0x09:   800x600    60.316541 Hz   4:3     37.879 kHz     40.000000 MHz
    DMT 0x0b:   800x600    75.000000 Hz   4:3     46.875 kHz     49.500000 MHz
    DMT 0x10:  1024x768    60.003840 Hz   4:3     48.363 kHz     65.000000 MHz
    DMT 0x12:  1024x768    75.028582 Hz   4:3     60.023 kHz     78.750000 MHz
    DMT 0x24:  1280x1024   75.024675 Hz   5:4     79.976 kHz    135.000000 MHz
  Standard Timings:
    DMT 0x23:  1280x1024   60.019740 Hz   5:4     63.981 kHz    108.000000 MHz
  Detailed Timing Descriptors:
    DTD 1:  1280x1024   60.019740 Hz   5:4     63.981 kHz    108.000000 MHz (376 mm x 301 mm)
                 Hfront   48 Hsync 112 Hback  248 Hpol P
                 Vfront    1 Vsync   3 Vback   38 Vpol P
    Display Range Limits:
      Monitor ranges (GTF): 56-76 Hz V, 30-82 kHz H, max dotclock 140 MHz
    Display Product Name: 'P19-5P ECO'
    Display Product Serial Number: 'YV1C059209'
Checksum: 0xcc


