
EDID (hex):
00ffffffffffff004c2dde0433324d43
1713010380331d782aee91a3544c9926
0f50542308008100814081809500b300
a940010101011a3680a070381f403020
3500dd0c1100001a000000fd00383d1e
4b11000a202020202020000000fc0053
796e634d61737465720a2020000000ff
0048394e533630313535370a20200087

edid-decode (hex):

00 ff ff ff ff ff ff 00 4c 2d de 04 33 32 4d 43
17 13 01 03 80 33 1d 78 2a ee 91 a3 54 4c 99 26
0f 50 54 23 08 00 81 00 81 40 81 80 95 00 b3 00
a9 40 01 01 01 01 1a 36 80 a0 70 38 1f 40 30 20
35 00 dd 0c 11 00 00 1a 00 00 00 fd 00 38 3d 1e
4b 11 00 0a 20 20 20 20 20 20 00 00 00 fc 00 53
79 6e 63 4d 61 73 74 65 72 0a 20 20 00 00 00 ff
00 48 39 4e 53 36 30 31 35 35 37 0a 20 20 00 87

----------------

Block 0, Base EDID:
  EDID Structure Version & Revision: 1.3
  Vendor & Product Identification:
    Manufacturer: SAM
    Model: 1246
    Serial Number: 1129132595
    Made in: week 23 of 2009
  Basic Display Parameters & Features:
    Digital display
    Maximum image size: 51 cm x 29 cm
    Gamma: 2.20
    DPMS levels: Off
    RGB color display
    First detailed timing is the preferred timing
  Color Characteristics:
    Red  : 0.6396, 0.3300
    Green: 0.2998, 0.5996
    Blue : 0.1503, 0.0595
    White: 0.3125, 0.3291
  Established Timings I & II:
    DMT 0x04:   640x480    59.940476 Hz   4:3     31.469 kHz     25.175000 MHz
    DMT 0x08:   800x600    56.250000 Hz   4:3     35.156 kHz     36.000000 MHz
    DMT 0x09:   800x600    60.316541 Hz   4:3     37.879 kHz     40.000000 MHz
    DMT 0x10:  1024x768    60.003840 Hz   4:3     48.363 kHz     65.000000 MHz
  Standard Timings:
    DMT 0x1c:  1280x800    59.810326 Hz  16:10    49.702 kHz     83.500000 MHz
    DMT 0x20:  1280x960    60.000000 Hz   4:3     60.000 kHz    108.000000 MHz
    DMT 0x23:  1280x1024   60.019740 Hz   5:4     63.981 kHz    108.000000 MHz
    DMT 0x2f:  1440x900    59.887445 Hz  16:10    55.935 kHz    106.500000 MHz
    DMT 0x3a:  1680x1050   59.954250 Hz  16:10    65.290 kHz    146.250000 MHz
    DMT 0x33:  1600x1200   60.000000 Hz   4:3     75.000 kHz    162.000000 MHz
  Detailed Timing Descriptors:
    DTD 1:  1920x1080   59.933878 Hz  16:9     66.587 kHz    138.500000 MHz (477 mm x 268 mm)
                 Hfront   48 Hsync  32 Hback   80 Hpol P
                 Vfront    3 Vsync   5 Vback   23 Vpol N
    Display Range Limits:
      Monitor ranges (GTF): 56-61 Hz V, 30-75 kHz H, max dotclock 170 MHz
    Display Product Name: 'SyncMaster'
    Display Product Serial Number: 'H9NS601557'
Checksum: 0x87


