
EDID (hex):
00ffffffffffff001e6d545b76aa0200
0a1f0104a5301b78e23135a5554ea126
0c5054a54b00714f81809500b300a9c0
810081c09040023a801871382d40582c
4500e00e1100001e000000fd00384b1e
530f000a202020202020000000fc004c
472046554c4c2048440a2020000000ff
003131304d58534b35343731300a00c8

Extracted contents:
header:          00 ff ff ff ff ff ff 00
serial number:   1e 6d 54 5b 76 aa 02 00 0a 1f
version:         01 04
basic params:    a5 30 1b 78 e2
chroma info:     31 35 a5 55 4e a1 26 0c 50 54
established:     a5 4b 00
standard:        71 4f 81 80 95 00 b3 00 a9 c0 81 00 81 c0 90 40
descriptor 1:    02 3a 80 18 71 38 2d 40 58 2c 45 00 e0 0e 11 00 00 1e
descriptor 2:    00 00 00 fd 00 38 4b 1e 53 0f 00 0a 20 20 20 20 20 20
descriptor 3:    00 00 00 fc 00 4c 47 20 46 55 4c 4c 20 48 44 0a 20 20
descriptor 4:    00 00 00 ff 00 31 31 30 4d 58 53 4b 35 34 37 31 30 0a
extensions:      00
checksum:        c8

EDID version: 1.4
Manufacturer: GSM Model 5b54 Serial Number --
Made in week 10 of 2021
Digital display
8 bits per primary color channel
DisplayPort interface
Maximum image size: 48 cm x 27 cm
Gamma: 2.20
DPMS levels: Standby Suspend Off
Supported color formats: RGB 4:4:4
First detailed timing includes the native pixel format and preferred refresh rate
Display x,y Chromaticity:
  Red:   0.6445, 0.3349
  Green: 0.3046, 0.6298
  Blue:  0.1484, 0.0498
  White: 0.3134, 0.3291
Established timings supported:
  720x400@70Hz 9:5 HorFreq: 31469 Hz Clock: 28.320 MHz
  640x480@60Hz 4:3 HorFreq: 31469 Hz Clock: 25.175 MHz
  640x480@75Hz 4:3 HorFreq: 37500 Hz Clock: 31.500 MHz
  800x600@60Hz 4:3 HorFreq: 37900 Hz Clock: 40.000 MHz
  800x600@75Hz 4:3 HorFreq: 46900 Hz Clock: 49.500 MHz
  1024x768@60Hz 4:3 HorFreq: 48400 Hz Clock: 65.000 MHz
  1024x768@75Hz 4:3 HorFreq: 60000 Hz Clock: 78.750 MHz
  1280x1024@75Hz 5:4 HorFreq: 80000 Hz Clock: 135.000 MHz
Standard timings supported:
  1152x864@75Hz 4:3 HorFreq: 67500 Hz Clock: 108.000 MHz
  1280x1024@60Hz 5:4 HorFreq: 64000 Hz Clock: 108.000 MHz
  1440x900@60Hz 16:10 HorFreq: 55500 Hz Clock: 88.750 MHz
  1680x1050@60Hz 16:10 HorFreq: 64700 Hz Clock: 119.000 MHz
  1600x900@60Hz 16:9
  1280x800@60Hz 16:10
  1280x720@60Hz 16:9
  1400x1050@60Hz 4:3 HorFreq: 64700 Hz Clock: 101.000 MHz
Detailed mode: Clock 148.500 MHz, 480 mm x 270 mm
               1920 2008 2052 2200 hborder 0
               1080 1084 1089 1125 vborder 0
               +hsync +vsync 
               VertFreq: 60 Hz, HorFreq: 67500 Hz
Monitor ranges (GTF): 56-75Hz V, 30-83kHz H, max dotclock 150MHz
Monitor name: LG FULL HD
Serial number: --
Checksum: 0xc8 (valid)


