
EDID (hex):
00ffffffffffff00410c32088f970000
081001030e2b1b78eeee35a3584a9e25
125054bfef80714a714f81408180a940
b300b30a010108399030621a274068b0
3600b10f1100001e000000ff0020564e
20203033383739390a20000000fc0050
68696c69707320323030570a000000fd
0038551e5d11000a2020202020200082

Extracted contents:
header:          00 ff ff ff ff ff ff 00
serial number:   41 0c 32 08 8f 97 00 00 08 10
version:         01 03
basic params:    0e 2b 1b 78 ee
chroma info:     ee 35 a3 58 4a 9e 25 12 50 54
established:     bf ef 80
standard:        71 4a 71 4f 81 40 81 80 a9 40 b3 00 b3 0a 01 01
descriptor 1:    08 39 90 30 62 1a 27 40 68 b0 36 00 b1 0f 11 00 00 1e
descriptor 2:    00 00 00 ff 00 20 56 4e 20 20 30 33 38 37 39 39 0a 20
descriptor 3:    00 00 00 fc 00 50 68 69 6c 69 70 73 20 32 30 30 57 0a
descriptor 4:    00 00 00 fd 00 38 55 1e 5d 11 00 0a 20 20 20 20 20 20
extensions:      00
checksum:        82

EDID version: 1.3
Manufacturer: PHL Model 832 Serial Number --
Made in week 8 of 2006
Analog display, Input voltage level: 0.7/0.3 V
Sync: Separate Composite SyncOnGreen 
Maximum image size: 43 cm x 27 cm
Gamma: 2.20
DPMS levels: Standby Suspend Off
RGB color display
Default (sRGB) color space is primary color space
First detailed timing is preferred timing
Display x,y Chromaticity:
  Red:   0.6396, 0.3457
  Green: 0.2919, 0.6191
  Blue:  0.1445, 0.0732
  White: 0.3134, 0.3291
Established timings supported:
  720x400@70Hz 9:5 HorFreq: 31469 Hz Clock: 28.320 MHz
  640x480@60Hz 4:3 HorFreq: 31469 Hz Clock: 25.175 MHz
  640x480@67Hz 4:3 HorFreq: 35000 Hz Clock: 30.240 MHz
  640x480@72Hz 4:3 HorFreq: 37900 Hz Clock: 31.500 MHz
  640x480@75Hz 4:3 HorFreq: 37500 Hz Clock: 31.500 MHz
  800x600@56Hz 4:3 HorFreq: 35200 Hz Clock: 36.000 MHz
  800x600@60Hz 4:3 HorFreq: 37900 Hz Clock: 40.000 MHz
  800x600@72Hz 4:3 HorFreq: 48100 Hz Clock: 50.000 MHz
  800x600@75Hz 4:3 HorFreq: 46900 Hz Clock: 49.500 MHz
  832x624@75Hz 4:3 HorFreq: 49726 Hz Clock: 57.284 MHz
  1024x768@60Hz 4:3 HorFreq: 48400 Hz Clock: 65.000 MHz
  1024x768@70Hz 4:3 HorFreq: 56500 Hz Clock: 75.000 MHz
  1024x768@75Hz 4:3 HorFreq: 60000 Hz Clock: 78.750 MHz
  1280x1024@75Hz 5:4 HorFreq: 80000 Hz Clock: 135.000 MHz
  1152x870@75Hz 192:145 HorFreq: 67500 Hz Clock: 108.000 MHz
Standard timings supported:
  1152x864@70Hz 4:3
  1152x864@75Hz 4:3 HorFreq: 67500 Hz Clock: 108.000 MHz
  1280x960@60Hz 4:3 HorFreq: 60000 Hz Clock: 108.000 MHz
  1280x1024@60Hz 5:4 HorFreq: 64000 Hz Clock: 108.000 MHz
  1600x1200@60Hz 4:3 HorFreq: 75000 Hz Clock: 162.000 MHz
  1680x1050@60Hz 16:10 HorFreq: 64700 Hz Clock: 119.000 MHz
  1680x1050@70Hz 16:10
Detailed mode: Clock 146.000 MHz, 433 mm x 271 mm
               1680 1784 1960 2240 hborder 0
               1050 1053 1059 1089 vborder 0
               +hsync +vsync 
               VertFreq: 59 Hz, HorFreq: 65178 Hz
Serial number:  --  038799
Monitor name: Philips 200W
Monitor ranges (GTF): 56-85Hz V, 30-93kHz H, max dotclock 170MHz
Checksum: 0x82 (valid)
EDID block does NOT conform to EDID 1.3!
	sRGB is signaled, but the chromaticities do not match
