edid-decode (hex):

00 ff ff ff ff ff ff 00 15 c3 03 24 cf a1 7c 01
2c 17 01 04 b5 3c 22 78 e2 8e 05 ad 4f 33 b0 26
0d 50 54 a1 08 00 a9 40 81 80 81 40 d1 c0 01 01
01 01 01 01 01 01 56 5e 00 a0 a0 a0 29 50 30 20
35 00 55 50 21 00 00 1a 28 3c 80 a0 70 b0 23 40
30 20 36 00 55 50 21 00 00 1a 00 00 00 fd 00 3b
3d 1f 59 19 00 0a 20 20 20 20 20 20 00 00 00 fc
00 43 58 32 37 30 0a 20 20 20 20 20 20 20 00 66

00 ff ff ff ff ff ff 00 15 c3 03 24 cf a1 7c 01
2c 17 01 04 b5 3c 22 78 e2 8e 05 ad 4f 33 b0 26
0d 50 54 a1 08 00 a9 40 81 80 81 40 d1 c0 01 01
01 01 01 01 01 01 56 5e 00 a0 a0 a0 29 50 30 20
35 00 55 50 21 00 00 1a 28 3c 80 a0 70 b0 23 40
30 20 36 00 55 50 21 00 00 1a 00 00 00 fd 00 3b
3d 1f 59 19 00 0a 20 20 20 20 20 20 00 00 00 fc
00 43 58 32 37 30 0a 20 20 20 20 20 20 20 00 66

----------------

Block 0, Base EDID:
  EDID Structure Version & Revision: 1.4
  Vendor & Product Identification:
    Manufacturer: ENC
    Model: 9219
    Serial Number: ...
    Made in: week 44 of 2013
  Basic Display Parameters & Features:
    Digital display
    Bits per primary color channel: 10
    DisplayPort interface
    Maximum image size: 60 cm x 34 cm
    Gamma: 2.20
    DPMS levels: Standby Suspend Off
    Supported color formats: RGB 4:4:4
    First detailed timing includes the native pixel format and preferred refresh rate
  Color Characteristics:
    Red  : 0.6777, 0.3085
    Green: 0.2021, 0.6894
    Blue : 0.1484, 0.0507
    White: 0.3134, 0.3291
  Established Timings I & II:
    IBM     :   720x400    70.081663 Hz   9:5     31.467 kHz     28.320000 MHz
    DMT 0x04:   640x480    59.940476 Hz   4:3     31.469 kHz     25.175000 MHz
    DMT 0x09:   800x600    60.316541 Hz   4:3     37.879 kHz     40.000000 MHz
    DMT 0x10:  1024x768    60.003840 Hz   4:3     48.363 kHz     65.000000 MHz
  Standard Timings:
    DMT 0x33:  1600x1200   60.000000 Hz   4:3     75.000 kHz    162.000000 MHz
    DMT 0x23:  1280x1024   60.019740 Hz   5:4     63.981 kHz    108.000000 MHz
    DMT 0x20:  1280x960    60.000000 Hz   4:3     60.000 kHz    108.000000 MHz
    DMT 0x52:  1920x1080   60.000000 Hz  16:9     67.500 kHz    148.500000 MHz
  Detailed Timing Descriptors:
    DTD 1:  2560x1440   59.950550 Hz  16:9     88.787 kHz    241.500000 MHz (597 mm x 336 mm)
                 Hfront   48 Hsync  32 Hback   80 Hpol P
                 Vfront    3 Vsync   5 Vback   33 Vpol N
    DTD 2:  1920x1200   59.950171 Hz  16:10    74.038 kHz    154.000000 MHz (597 mm x 336 mm)
                 Hfront   48 Hsync  32 Hback   80 Hpol P
                 Vfront    3 Vsync   6 Vback   26 Vpol N
    Display Range Limits:
      Monitor ranges (GTF): 59-61 Hz V, 31-89 kHz H, max dotclock 250 MHz
    Display Product Name: 'CX270'
Checksum: 0x66

----------------

Block 1, Unknown EDID Extension Block 0x00:
  00 ff ff ff ff ff ff 00 15 c3 03 24 cf a1 7c 01 '...........$..|.'
  2c 17 01 04 b5 3c 22 78 e2 8e 05 ad 4f 33 b0 26 ',....<"x....O3.&'
  0d 50 54 a1 08 00 a9 40 81 80 81 40 d1 c0 01 01 '.PT....@...@....'
  01 01 01 01 01 01 56 5e 00 a0 a0 a0 29 50 30 20 '......V^....)P0 '
  35 00 55 50 21 00 00 1a 28 3c 80 a0 70 b0 23 40 '5.UP!...(<..p.#@'
  30 20 36 00 55 50 21 00 00 1a 00 00 00 fd 00 3b '0 6.UP!........;'
  3d 1f 59 19 00 0a 20 20 20 20 20 20 00 00 00 fc '=.Y...      ....'
  00 43 58 32 37 30 0a 20 20 20 20 20 20 20 00 66 '.CX270.       .f'
Checksum: 0x66

----------------

Warnings:

Block 0, Base EDID:
  Display Range Limits: GTF support is deprecated in EDID 1.4.
EDID:
  Base EDID: Some timings are out of range of the Monitor Ranges:
    Vertical Freq: 59.940 - 70.082 Hz (Monitor: 59.000 - 61.000 Hz)

Failures:

Block 0, Base EDID:
  Display Range Limits: GTF can't be combined with non-continuous frequencies.
Block 1, Base EDID:
  Unknown Extension Block.
EDID:
  Base EDID: EDID specified 0 extension block(s), but found 1 extension block(s).

EDID conformity: FAIL
