
EDID (hex):
00ffffffffffff000472bc007d1f6092
1a130103803419782eee95a3544c9926
0f5054b30c00d1c0714f810081809500
010101010101023a801871382d40582c
450009252100001c000000fd00374b1e
5010000a202020202020000000fc0045
323131480a20202020202020000000ff
005131373042303031333931302000a9

Extracted contents:
header:          00 ff ff ff ff ff ff 00
serial number:   04 72 bc 00 7d 1f 60 92 1a 13
version:         01 03
basic params:    80 34 19 78 2e
chroma info:     ee 95 a3 54 4c 99 26 0f 50 54
established:     b3 0c 00
standard:        d1 c0 71 4f 81 00 81 80 95 00 01 01 01 01 01 01
descriptor 1:    02 3a 80 18 71 38 2d 40 58 2c 45 00 09 25 21 00 00 1c
descriptor 2:    00 00 00 fd 00 37 4b 1e 50 10 00 0a 20 20 20 20 20 20
descriptor 3:    00 00 00 fc 00 45 32 31 31 48 0a 20 20 20 20 20 20 20
descriptor 4:    00 00 00 ff 00 51 31 37 30 42 30 30 31 33 39 31 30 20
extensions:      00
checksum:        a9

EDID version: 1.3
Manufacturer: ACR Model bc Serial Number --
Made in week 26 of 2009
Digital display
Maximum image size: 52 cm x 25 cm
Gamma: 2.20
DPMS levels: Off
RGB color display
Default (sRGB) color space is primary color space
First detailed timing is preferred timing
Display x,y Chromaticity:
  Red:   0.6396, 0.3300
  Green: 0.2998, 0.5996
  Blue:  0.1503, 0.0595
  White: 0.3134, 0.3291
Established timings supported:
  720x400@70Hz 9:5 HorFreq: 31469 Hz Clock: 28.320 MHz
  640x480@60Hz 4:3 HorFreq: 31469 Hz Clock: 25.175 MHz
  640x480@67Hz 4:3 HorFreq: 35000 Hz Clock: 30.240 MHz
  800x600@56Hz 4:3 HorFreq: 35200 Hz Clock: 36.000 MHz
  800x600@60Hz 4:3 HorFreq: 37900 Hz Clock: 40.000 MHz
  1024x768@60Hz 4:3 HorFreq: 48400 Hz Clock: 65.000 MHz
  1024x768@70Hz 4:3 HorFreq: 56500 Hz Clock: 75.000 MHz
Standard timings supported:
  1920x1080@60Hz 16:9
  1152x864@75Hz 4:3 HorFreq: 67500 Hz Clock: 108.000 MHz
  1280x800@60Hz 16:10
  1280x1024@60Hz 5:4 HorFreq: 64000 Hz Clock: 108.000 MHz
  1440x900@60Hz 16:10 HorFreq: 55500 Hz Clock: 88.750 MHz
Detailed mode: Clock 148.500 MHz, 521 mm x 293 mm
               1920 2008 2052 2200 hborder 0
               1080 1084 1089 1125 vborder 0
               -hsync +vsync 
               VertFreq: 60 Hz, HorFreq: 67500 Hz
Monitor ranges (GTF): 55-75Hz V, 30-80kHz H, max dotclock 160MHz
Monitor name: E211H
Serial number: -- 
Checksum: 0xa9 (valid)
EDID block does NOT conform to EDID 1.3!
	sRGB is signaled, but the chromaticities do not match


