edid-decode (hex):

00 ff ff ff ff ff ff 00 30 e4 08 05 00 00 00 00
00 1a 01 04 95 1f 11 78 0a 33 55 92 58 55 8e 28
1e 50 54 00 00 00 01 01 01 01 01 01 01 01 01 01
01 01 01 01 01 01 d0 1d 56 f4 50 00 16 30 30 20
35 00 35 ae 10 00 00 1b e0 13 56 f4 50 00 16 30
30 20 35 00 35 ae 10 00 00 1b 00 00 00 00 00 00
00 00 00 00 00 00 00 00 00 00 00 00 00 00 00 02
00 0c 44 ff 0b 3c 6e 12 12 1c 6e 00 00 00 00 b6

----------------

Block 0, Base EDID:
  EDID Structure Version & Revision: 1.4
  Vendor & Product Identification:
    Manufacturer: LGD
    Model: 1288
    Made in: 2016
  Basic Display Parameters & Features:
    Digital display
    Bits per primary color channel: 6
    DisplayPort interface
    Maximum image size: 31 cm x 17 cm
    Gamma: 2.20
    Supported color formats: RGB 4:4:4, YCrCb 4:4:4
    First detailed timing includes the native pixel format and preferred refresh rate
  Color Characteristics:
    Red  : 0.5703, 0.3466
    Green: 0.3320, 0.5576
    Blue : 0.1572, 0.1181
    White: 0.3134, 0.3291
  Established Timings I & II: none
  Standard Timings: none
  Detailed Timing Descriptors:
    DTD 1:  1366x768    60.004717 Hz 683:384   47.404 kHz     76.320000 MHz (309 mm x 174 mm)
                 Hfront   48 Hsync  32 Hback  164 Hpol P
                 Vfront    3 Vsync   5 Vback   14 Vpol N
    DTD 2:  1366x768    40.003145 Hz 683:384   31.602 kHz     50.880000 MHz (309 mm x 174 mm)
                 Hfront   48 Hsync  32 Hback  164 Hpol P
                 Vfront    3 Vsync   5 Vback   14 Vpol N
    Empty Descriptor
    Manufacturer-Specified Display Descriptor (0x02): 00 02 00 0c 44 ff 0b 3c 6e 12 12 1c 6e 00 00 00 '....D..<n...n...'
Checksum: 0xb6

----------------

Warnings:

Block 0, Base EDID:
  Missing Display Product Name.

Failures:

Block 0, Base EDID:
  Empty Descriptor: Use Dummy Descriptor instead of all zeroes.

EDID conformity: FAIL
