edid-decode (hex):

00 ff ff ff ff ff ff 00 1e 6d 5e 4a 72 04 00 00
0c 0b 01 03 78 24 1b b0 e8 68 45 a3 53 47 9a 24
10 48 4c ef ff 80 31 59 45 59 61 59 81 99 a9 4f
31 7c 71 68 01 01 87 3d 00 c0 51 00 30 40 40 a0
13 00 5e 06 11 00 00 1e 00 00 00 fd 00 32 a0 1e
60 15 00 0a 20 20 20 20 20 20 00 00 00 fc 00 53
74 75 64 69 6f 57 6f 72 6b 73 20 45 00 00 00 fc
00 39 30 30 42 0a 20 20 20 20 20 20 20 20 00 f6

----------------

Block 0, Base EDID:
  EDID Structure Version & Revision: 1.3
  Vendor & Product Identification:
    Manufacturer: GSM
    Model: 19038
    Serial Number: ...
    Made in: week 12 of 2001
  Basic Display Parameters & Features:
    Analog display
    Input voltage level: 0.7/0.7 V
    Blank-to-black setup/pedestal
    Sync: Separate
    Maximum image size: 36 cm x 27 cm
    Gamma: 2.76
    DPMS levels: Standby Suspend Off
    RGB color display
  Color Characteristics:
    Red  : 0.6376, 0.3261
    Green: 0.2792, 0.6015
    Blue : 0.1416, 0.0625
    White: 0.2822, 0.2978
  Established Timings I & II:
    IBM     :   720x400    70.081663 Hz   9:5     31.467 kHz     28.320000 MHz
    IBM     :   720x400    87.849542 Hz   9:5     39.444 kHz     35.500000 MHz
    DMT 0x04:   640x480    59.940476 Hz   4:3     31.469 kHz     25.175000 MHz
    DMT 0x05:   640x480    72.808802 Hz   4:3     37.861 kHz     31.500000 MHz
    DMT 0x06:   640x480    75.000000 Hz   4:3     37.500 kHz     31.500000 MHz
    DMT 0x08:   800x600    56.250000 Hz   4:3     35.156 kHz     36.000000 MHz
    DMT 0x09:   800x600    60.316541 Hz   4:3     37.879 kHz     40.000000 MHz
    DMT 0x0a:   800x600    72.187572 Hz   4:3     48.077 kHz     50.000000 MHz
    DMT 0x0b:   800x600    75.000000 Hz   4:3     46.875 kHz     49.500000 MHz
    Apple   :   832x624    74.551266 Hz   4:3     49.726 kHz     57.284000 MHz
    DMT 0x0f:  1024x768i   86.957532 Hz   4:3     35.522 kHz     44.900000 MHz
    DMT 0x10:  1024x768    60.003840 Hz   4:3     48.363 kHz     65.000000 MHz
    DMT 0x11:  1024x768    70.069359 Hz   4:3     56.476 kHz     75.000000 MHz
    DMT 0x12:  1024x768    75.028582 Hz   4:3     60.023 kHz     78.750000 MHz
    DMT 0x24:  1280x1024   75.024675 Hz   5:4     79.976 kHz    135.000000 MHz
    Apple   :  1152x870    75.061550 Hz 192:145   68.681 kHz    100.000000 MHz
  Standard Timings:
    DMT 0x07:   640x480    85.008312 Hz   4:3     43.269 kHz     36.000000 MHz
    DMT 0x0c:   800x600    85.061274 Hz   4:3     53.674 kHz     56.250000 MHz
    DMT 0x13:  1024x768    84.996690 Hz   4:3     68.677 kHz     94.500000 MHz
    DMT 0x25:  1280x1024   85.024098 Hz   5:4     91.146 kHz    157.500000 MHz
    DMT 0x36:  1600x1200   75.000000 Hz   4:3     93.750 kHz    202.500000 MHz
    GTF     :   640x480   119.999084 Hz   4:3     61.800 kHz     52.406000 MHz
    GTF     :  1152x864   100.000000 Hz   4:3     91.500 kHz    143.472000 MHz
  Detailed Timing Descriptors:
    DTD 1:  1280x1024   85.029497 Hz   5:4     91.152 kHz    157.510000 MHz (350 mm x 262 mm)
                 Hfront   64 Hsync 160 Hback  224 Hpol P
                 Vfront    1 Vsync   3 Vback   44 Vpol P
    Display Range Limits:
      Monitor ranges (GTF): 50-160 Hz V, 30-96 kHz H, max dotclock 210 MHz
    Display Product Name: 'StudioWorks E'
    Display Product Name: '900B'
Checksum: 0xf6

----------------

Failures:

Block 0, Base EDID:
  Basic Display Parameters & Features: EDID 1.3 requires that the first detailed timing is the preferred timing.

EDID conformity: FAIL
