edid-decode (hex):

00 ff ff ff ff ff ff 00 30 e4 ed 03 00 00 00 00
00 16 01 04 95 1c 10 78 0a 10 a5 96 58 57 8f 28
20 50 54 00 00 00 01 01 01 01 01 01 01 01 01 01
01 01 01 01 01 01 38 1d 56 d4 50 00 16 30 30 20
25 00 15 9c 10 00 00 19 00 00 00 00 00 00 00 00
00 00 00 00 00 00 00 00 00 00 00 00 00 fe 00 4c
47 20 44 69 73 70 6c 61 79 0a 20 20 00 00 00 fe
00 4c 50 31 32 35 57 48 32 2d 53 50 54 31 00 92

----------------

Block 0, Base EDID:
  EDID Structure Version & Revision: 1.4
  Vendor & Product Identification:
    Manufacturer: LGD
    Model: 1005
    Made in: 2012
  Basic Display Parameters & Features:
    Digital display
    Bits per primary color channel: 6
    DisplayPort interface
    Maximum image size: 28 cm x 16 cm
    Gamma: 2.20
    Supported color formats: RGB 4:4:4, YCrCb 4:4:4
    First detailed timing includes the native pixel format and preferred refresh rate
  Color Characteristics:
    Red  : 0.5859, 0.3447
    Green: 0.3398, 0.5585
    Blue : 0.1582, 0.1269
    White: 0.3134, 0.3291
  Established Timings I & II: none
  Standard Timings: none
  Detailed Timing Descriptors:
    DTD 1:  1366x768    60.002 Hz 683:384  47.402 kHz  74.800 MHz (277 mm x 156 mm)
                 Hfront   48 Hsync  32 Hback 132 Hpol N
                 Vfront    2 Vsync   5 Vback  15 Vpol N
    Empty Descriptor
    Alphanumeric Data String: 'LG Display'
    Alphanumeric Data String: 'LP125WH2-SPT1'
Checksum: 0x92
