
EDID (hex):
00ffffffffffff004d10ca1300000000
0000010380211578ca00000000000000
00000000000001010101010101010101
010101010101bc1b00a0502017303020
36004bcf100000190000001000000000
00000000000000000a20000000100000
000000000000000000000a2000000010
004c513135344b314c423142200a0067

Extracted contents:
header:          00 ff ff ff ff ff ff 00
serial number:   4d 10 ca 13 00 00 00 00 00 00
version:         01 03
basic params:    80 21 15 78 ca
chroma info:     00 00 00 00 00 00 00 00 00 00
established:     00 00 00
standard:        01 01 01 01 01 01 01 01 01 01 01 01 01 01 01 01
descriptor 1:    bc 1b 00 a0 50 20 17 30 30 20 36 00 4b cf 10 00 00 19
descriptor 2:    00 00 00 10 00 00 00 00 00 00 00 00 00 00 00 00 0a 20
descriptor 3:    00 00 00 10 00 00 00 00 00 00 00 00 00 00 00 00 0a 20
descriptor 4:    00 00 00 10 00 4c 51 31 35 34 4b 31 4c 42 31 42 20 0a
extensions:      00
checksum:        67

EDID version: 1.3
Manufacturer: SHP Model 13ca Serial Number --
Digital display
Maximum image size: 33 cm x 21 cm
Gamma: 2.20
DPMS levels: Standby Suspend
RGB color display
First detailed timing is preferred timing
Display x,y Chromaticity:
  Red:   0.0000, 0.0000
  Green: 0.0000, 0.0000
  Blue:  0.0000, 0.0000
  White: 0.0000, 0.0000
Established timings supported:
Standard timings supported:
Detailed mode: Clock 71.000 MHz, 331 mm x 207 mm
               1280 1328 1360 1440 hborder 0
                800  803  809  823 vborder 0
               -hsync -vsync 
               VertFreq: 59 Hz, HorFreq: 49305 Hz
Dummy block
Dummy block
Dummy block
Checksum: 0x67 (valid)
EDID block does NOT conform to EDID 1.3!
	Missing name descriptor
	Missing monitor ranges
EDID block does not conform at all!
	Bad year of manufacture
	Dummy block filled with garbage
