edid-decode (hex):

00 ff ff ff ff ff ff 00 59 25 19 19 00 00 00 00
0e 1f 01 03 80 34 1f 78 0a d7 a5 a2 59 4a 96 24
14 50 54 2d cf 00 d1 c0 b3 00 01 01 81 80 81 40
81 c0 01 01 01 01 02 3a 80 18 71 38 2d 40 58 2c
45 00 10 09 00 00 00 1e 37 45 80 b4 70 38 2d 40
30 20 35 00 58 c1 10 00 00 1e 31 2e 40 00 62 84
22 30 58 a8 35 00 10 09 00 00 00 1c 00 00 00 fc
00 4a 32 34 37 35 46 46 48 44 0a 20 20 20 01 fd

02 03 34 f2 4f 00 00 10 06 14 1f 20 21 22 87 48
12 4a 4b 23 e2 00 d5 e3 05 c0 00 23 09 7f 07 83
01 00 00 67 03 0c 00 10 00 38 3c 68 1a 00 00 01
09 28 4b e6 02 3a 80 18 71 38 2d 40 58 2c 25 00
55 50 21 00 00 1e 01 1d 80 18 71 1c 16 20 58 2c
25 00 55 50 21 00 00 9e 00 00 00 00 00 00 00 00
00 00 00 00 00 00 00 00 00 00 00 00 00 00 00 00
00 00 00 00 00 00 00 00 00 00 00 00 00 00 00 d0

00 ff ff ff ff ff ff 00 59 25 19 19 00 00 00 00
0e 1f 01 03 80 34 1f 78 0a d7 a5 a2 59 4a 96 24
14 50 54 2d cf 00 d1 c0 b3 00 01 01 81 80 81 40
81 c0 01 01 01 01 02 3a 80 18 71 38 2d 40 58 2c
45 00 10 09 00 00 00 1e 37 45 80 b4 70 38 2d 40
30 20 35 00 58 c1 10 00 00 1e 31 2e 40 00 62 84
22 30 58 a8 35 00 10 09 00 00 00 1c 00 00 00 fc
00 4a 32 34 37 35 46 46 48 44 0a 20 20 20 01 fd

02 03 34 f2 4f 00 00 10 06 14 1f 20 21 22 87 48
12 4a 4b 23 e2 00 d5 e3 05 c0 00 23 09 7f 07 83
01 00 00 67 03 0c 00 10 00 38 3c 68 1a 00 00 01
09 28 4b e6 02 3a 80 18 71 38 2d 40 58 2c 25 00
55 50 21 00 00 1e 01 1d 80 18 71 1c 16 20 58 2c
25 00 55 50 21 00 00 9e 00 00 00 00 00 00 00 00
00 00 00 00 00 00 00 00 00 00 00 00 00 00 00 00
00 00 00 00 00 00 00 00 00 00 00 00 00 00 00 d0

----------------

Block 0, Base EDID:
  EDID Structure Version & Revision: 1.3
  Vendor & Product Identification:
    Manufacturer: VIE
    Model: 6425
    Made in: week 14 of 2021
  Basic Display Parameters & Features:
    Digital display
    Maximum image size: 52 cm x 31 cm
    Gamma: 2.20
    RGB color display
    First detailed timing is the preferred timing
  Color Characteristics:
    Red  : 0.6357, 0.3486
    Green: 0.2900, 0.5888
    Blue : 0.1425, 0.0800
    White: 0.3134, 0.3291
  Established Timings I & II:
    DMT 0x04:   640x480    59.940476 Hz   4:3     31.469 kHz     25.175000 MHz
    DMT 0x05:   640x480    72.808802 Hz   4:3     37.861 kHz     31.500000 MHz
    DMT 0x06:   640x480    75.000000 Hz   4:3     37.500 kHz     31.500000 MHz
    DMT 0x09:   800x600    60.316541 Hz   4:3     37.879 kHz     40.000000 MHz
    DMT 0x0a:   800x600    72.187572 Hz   4:3     48.077 kHz     50.000000 MHz
    DMT 0x0b:   800x600    75.000000 Hz   4:3     46.875 kHz     49.500000 MHz
    DMT 0x10:  1024x768    60.003840 Hz   4:3     48.363 kHz     65.000000 MHz
    DMT 0x11:  1024x768    70.069359 Hz   4:3     56.476 kHz     75.000000 MHz
    DMT 0x12:  1024x768    75.028582 Hz   4:3     60.023 kHz     78.750000 MHz
    DMT 0x24:  1280x1024   75.024675 Hz   5:4     79.976 kHz    135.000000 MHz
  Standard Timings:
    DMT 0x52:  1920x1080   60.000000 Hz  16:9     67.500 kHz    148.500000 MHz
    DMT 0x3a:  1680x1050   59.954250 Hz  16:10    65.290 kHz    146.250000 MHz
    DMT 0x23:  1280x1024   60.019740 Hz   5:4     63.981 kHz    108.000000 MHz
    DMT 0x20:  1280x960    60.000000 Hz   4:3     60.000 kHz    108.000000 MHz
    DMT 0x55:  1280x720    60.000000 Hz  16:9     45.000 kHz     74.250000 MHz
  Detailed Timing Descriptors:
    DTD 1:  1920x1080   60.000000 Hz  16:9     67.500 kHz    148.500000 MHz (16 mm x 9 mm)
                 Hfront   88 Hsync  44 Hback  148 Hpol P
                 Vfront    4 Vsync   5 Vback   36 Vpol P
    DTD 2:  1920x1080   75.001058 Hz  16:9     84.376 kHz    177.190000 MHz (344 mm x 193 mm)
                 Hfront   48 Hsync  32 Hback  100 Hpol P
                 Vfront    3 Vsync   5 Vback   37 Vpol P
    DTD 3:  1600x900    59.946021 Hz  16:9     55.990 kHz    118.250000 MHz (16 mm x 9 mm)
                 Hfront   88 Hsync 168 Hback  256 Hpol N
                 Vfront    3 Vsync   5 Vback   26 Vpol P
    Display Product Name: 'J2475FFHD'
  Extension blocks: 1
Checksum: 0xfd

----------------

Block 1, CTA-861 Extension Block:
  Revision: 3
  Underscans IT Video Formats by default
  Basic audio support
  Supports YCbCr 4:4:4
  Supports YCbCr 4:2:2
  Native detailed modes: 2
  Video Data Block:
    VIC  16:  1920x1080   60.000000 Hz  16:9     67.500 kHz    148.500000 MHz
    VIC   6:  1440x480i   59.940060 Hz   4:3     15.734 kHz     27.000000 MHz
    VIC  20:  1920x1080i  50.000000 Hz  16:9     28.125 kHz     74.250000 MHz
    VIC  31:  1920x1080   50.000000 Hz  16:9     56.250 kHz    148.500000 MHz
    VIC  32:  1920x1080   24.000000 Hz  16:9     27.000 kHz     74.250000 MHz
    VIC  33:  1920x1080   25.000000 Hz  16:9     28.125 kHz     74.250000 MHz
    VIC  34:  1920x1080   30.000000 Hz  16:9     33.750 kHz     74.250000 MHz
    VIC   7:  1440x480i   59.940060 Hz  16:9     15.734 kHz     27.000000 MHz (native)
    VIC  72:  1920x1080   24.000000 Hz  64:27    27.000 kHz     74.250000 MHz
    VIC  18:   720x576    50.000000 Hz  16:9     31.250 kHz     27.000000 MHz
    VIC  74:  1920x1080   30.000000 Hz  64:27    33.750 kHz     74.250000 MHz
    VIC  75:  1920x1080   50.000000 Hz  64:27    56.250 kHz    148.500000 MHz
    VIC  35:  2880x480    59.940060 Hz   4:3     31.469 kHz    108.000000 MHz
  Video Capability Data Block:
    YCbCr quantization: Selectable (via AVI YQ)
    RGB quantization: Selectable (via AVI Q)
    PT scan behavior: Always Overscanned
    IT scan behavior: Always Overscanned
    CE scan behavior: Always Overscanned
  Colorimetry Data Block:
    BT2020YCC
    BT2020RGB
  Audio Data Block:
    Linear PCM:
      Max channels: 2
      Supported sample rates (kHz): 192 176.4 96 88.2 48 44.1 32
      Supported sample sizes (bits): 24 20 16
  Speaker Allocation Data Block:
    FL/FR - Front Left/Right
  Vendor-Specific Data Block (HDMI), OUI 00-0C-03:
    Source physical address: 1.0.0.0
    DC_36bit
    DC_30bit
    DC_Y444
    Maximum TMDS clock: 300 MHz
  Vendor-Specific Data Block (AMD), OUI 00-00-1A:
    Version: 1.9
    Minimum Refresh Rate: 40 Hz
    Maximum Refresh Rate: 75 Hz
    Flags 1.x: 0xe6 (MCCS)
  Detailed Timing Descriptors:
    DTD 4:  1920x1080   60.000000 Hz  16:9     67.500 kHz    148.500000 MHz (597 mm x 336 mm)
                 Hfront   88 Hsync  44 Hback  148 Hpol P
                 Vfront    2 Vsync   5 Vback   38 Vpol P
    DTD 5:  1920x1080i  60.000000 Hz  16:9     33.750 kHz     74.250000 MHz (597 mm x 336 mm)
                 Hfront   88 Hsync  44 Hback  148 Hpol P
                 Vfront    2 Vsync   5 Vback   15 Vpol P Vfront +0.5 Odd Field
                 Vfront    2 Vsync   5 Vback   15 Vpol P Vback  +0.5 Even Field
Checksum: 0xd0  Unused space in Extension Block: 39 bytes

----------------

Block 2, Unknown EDID Extension Block 0x00:
  00 ff ff ff ff ff ff 00 59 25 19 19 00 00 00 00 '........Y%......'
  0e 1f 01 03 80 34 1f 78 0a d7 a5 a2 59 4a 96 24 '.....4.x....YJ.$'
  14 50 54 2d cf 00 d1 c0 b3 00 01 01 81 80 81 40 '.PT-...........@'
  81 c0 01 01 01 01 02 3a 80 18 71 38 2d 40 58 2c '.......:..q8-@X,'
  45 00 10 09 00 00 00 1e 37 45 80 b4 70 38 2d 40 'E.......7E..p8-@'
  30 20 35 00 58 c1 10 00 00 1e 31 2e 40 00 62 84 '0 5.X.....1.@.b.'
  22 30 58 a8 35 00 10 09 00 00 00 1c 00 00 00 fc '"0X.5...........'
  00 4a 32 34 37 35 46 46 48 44 0a 20 20 20 01 fd '.J2475FFHD.   ..'
Checksum: 0xfd

----------------

Block 3, CTA-861 Extension Block:
  Revision: 3
  Underscans IT Video Formats by default
  Basic audio support
  Supports YCbCr 4:4:4
  Supports YCbCr 4:2:2
  Native detailed modes: 2
  Video Data Block:
    VIC  16:  1920x1080   60.000000 Hz  16:9     67.500 kHz    148.500000 MHz
    VIC   6:  1440x480i   59.940060 Hz   4:3     15.734 kHz     27.000000 MHz
    VIC  20:  1920x1080i  50.000000 Hz  16:9     28.125 kHz     74.250000 MHz
    VIC  31:  1920x1080   50.000000 Hz  16:9     56.250 kHz    148.500000 MHz
    VIC  32:  1920x1080   24.000000 Hz  16:9     27.000 kHz     74.250000 MHz
    VIC  33:  1920x1080   25.000000 Hz  16:9     28.125 kHz     74.250000 MHz
    VIC  34:  1920x1080   30.000000 Hz  16:9     33.750 kHz     74.250000 MHz
    VIC   7:  1440x480i   59.940060 Hz  16:9     15.734 kHz     27.000000 MHz (native)
    VIC  72:  1920x1080   24.000000 Hz  64:27    27.000 kHz     74.250000 MHz
    VIC  18:   720x576    50.000000 Hz  16:9     31.250 kHz     27.000000 MHz
    VIC  74:  1920x1080   30.000000 Hz  64:27    33.750 kHz     74.250000 MHz
    VIC  75:  1920x1080   50.000000 Hz  64:27    56.250 kHz    148.500000 MHz
    VIC  35:  2880x480    59.940060 Hz   4:3     31.469 kHz    108.000000 MHz
  Video Capability Data Block:
    YCbCr quantization: Selectable (via AVI YQ)
    RGB quantization: Selectable (via AVI Q)
    PT scan behavior: Always Overscanned
    IT scan behavior: Always Overscanned
    CE scan behavior: Always Overscanned
  Colorimetry Data Block:
    BT2020YCC
    BT2020RGB
  Audio Data Block:
    Linear PCM:
      Max channels: 2
      Supported sample rates (kHz): 192 176.4 96 88.2 48 44.1 32
      Supported sample sizes (bits): 24 20 16
  Speaker Allocation Data Block:
    FL/FR - Front Left/Right
  Vendor-Specific Data Block (HDMI), OUI 00-0C-03:
    Source physical address: 1.0.0.0
    DC_36bit
    DC_30bit
    DC_Y444
    Maximum TMDS clock: 300 MHz
  Vendor-Specific Data Block (AMD), OUI 00-00-1A:
    Version: 1.9
    Minimum Refresh Rate: 40 Hz
    Maximum Refresh Rate: 75 Hz
    Flags 1.x: 0xe6 (MCCS)
  Detailed Timing Descriptors:
    DTD 6:  1920x1080   60.000000 Hz  16:9     67.500 kHz    148.500000 MHz (597 mm x 336 mm)
                 Hfront   88 Hsync  44 Hback  148 Hpol P
                 Vfront    2 Vsync   5 Vback   38 Vpol P
    DTD 7:  1920x1080i  60.000000 Hz  16:9     33.750 kHz     74.250000 MHz (597 mm x 336 mm)
                 Hfront   88 Hsync  44 Hback  148 Hpol P
                 Vfront    2 Vsync   5 Vback   15 Vpol P Vfront +0.5 Odd Field
                 Vfront    2 Vsync   5 Vback   15 Vpol P Vback  +0.5 Even Field
Checksum: 0xd0  Unused space in Extension Block: 39 bytes

----------------

Warnings:

Block 1, CTA-861 Extension Block:
  Video Capability Data Block: IT scan behavior is expected to support underscanned.
  Video Capability Data Block: S_PT is equal to S_IT and S_CE, so should be set to 0 instead.
  Colorimetry Data Block: Set the sRGB colorimetry bit to avoid interop issues.
  Detailed Timing Descriptor #4: DTD is similar but not identical to VIC 16.
Block 3, CTA-861 Extension Block:
  Video Capability Data Block: IT scan behavior is expected to support underscanned.
  Video Capability Data Block: S_PT is equal to S_IT and S_CE, so should be set to 0 instead.
  Colorimetry Data Block: Set the sRGB colorimetry bit to avoid interop issues.
  Detailed Timing Descriptor #6: DTD is similar but not identical to VIC 16.
EDID:
  CTA-861: Multiple native progressive timings are defined.
  CTA-861: Multiple native interlaced timings are defined.

Failures:

Block 0, Base EDID:
  Detailed Timing Descriptor #1: Mismatch of image size 16x9 mm vs display size 520x310 mm.
  Detailed Timing Descriptor #2: Mismatch of image size 344x193 mm vs display size 520x310 mm.
  Detailed Timing Descriptor #3: Mismatch of image size 16x9 mm vs display size 520x310 mm.
  Missing Display Range Limits Descriptor.
Block 1, CTA-861 Extension Block:
  Video Capability Data Block: IT video formats are always overscanned, but bit 7 of Byte 3 of the CTA-861 Extension header is set to underscanned.
  Detailed Timing Descriptor #4: Mismatch of image size 597x336 mm vs display size 520x310 mm.
  Detailed Timing Descriptor #5: Mismatch of image size 597x336 mm vs display size 520x310 mm.
Block 2, Base EDID:
  Unknown Extension Block.
Block 3, CTA-861 Extension Block:
  Video Data Block: Duplicate VIC 16.
  Video Data Block: Duplicate VIC 6.
  Video Data Block: Duplicate VIC 20.
  Video Data Block: Duplicate VIC 31.
  Video Data Block: Duplicate VIC 32.
  Video Data Block: Duplicate VIC 33.
  Video Data Block: Duplicate VIC 34.
  Video Data Block: Duplicate VIC 7.
  Video Data Block: Duplicate VIC 72.
  Video Data Block: Duplicate VIC 18.
  Video Data Block: Duplicate VIC 74.
  Video Data Block: Duplicate VIC 75.
  Video Data Block: Duplicate VIC 35.
  Video Capability Data Block: Only one instance of this Data Block is allowed.
  Video Capability Data Block: IT video formats are always overscanned, but bit 7 of Byte 3 of the CTA-861 Extension header is set to underscanned.
  Colorimetry Data Block: Only one instance of this Data Block is allowed.
  Speaker Allocation Data Block: Only one instance of this Data Block is allowed.
  Detailed Timing Descriptor #6: Mismatch of image size 597x336 mm vs display size 520x310 mm.
  Detailed Timing Descriptor #7: Mismatch of image size 597x336 mm vs display size 520x310 mm.
EDID:
  Base EDID: The DTD max image size is 597x336mm, which is larger than the display size 520.0x310.0mm.
  Base EDID: EDID specified 1 extension block(s), but found 3 extension block(s).
  Base EDID: EDID 1.3 requires a Block Map Extension in Block 1 if there are more than 2 blocks in the EDID.

EDID conformity: FAIL
