edid-decode (hex):

00 ff ff ff ff ff ff 00 09 d1 2e 80 01 01 01 01
19 20 01 04 b5 3c 22 78 3f 28 95 a7 55 4e a3 26
0f 50 54 a5 6b 80 d1 c0 81 c0 81 00 81 80 a9 c0
b3 00 a9 40 01 01 4d d0 00 a0 f0 70 3e 80 30 20
35 00 55 50 21 00 00 1a 00 00 00 ff 00 45 54 39
36 4e 30 30 33 35 35 53 4c 30 00 00 00 fd 00 28
3c 8c 8c 3c 01 0a 20 20 20 20 20 20 00 00 00 fc
00 42 65 6e 51 20 50 44 32 37 30 30 55 0a 01 e4

02 03 36 f1 56 61 60 5d 5e 5f 10 05 04 03 02 07
06 0f 1f 20 21 22 14 13 12 16 01 23 09 07 07 83
01 00 00 67 03 0c 00 10 00 38 78 e3 05 c0 00 e6
06 05 01 5a 53 44 02 3a 80 18 71 38 2d 40 58 2c
45 00 55 50 21 00 00 1e 56 5e 00 a0 a0 a0 29 50
30 20 35 00 55 50 21 00 00 1a 8c 64 00 50 f0 70
1f 80 08 20 18 04 55 50 21 00 00 1a 00 00 00 00
00 00 00 00 00 00 00 00 00 00 00 00 00 00 00 ac

00 ff ff ff ff ff ff 00 09 d1 2e 80 01 01 01 01
19 20 01 04 b5 3c 22 78 3f 28 95 a7 55 4e a3 26
0f 50 54 a5 6b 80 d1 c0 81 c0 81 00 81 80 a9 c0
b3 00 a9 40 01 01 4d d0 00 a0 f0 70 3e 80 30 20
35 00 55 50 21 00 00 1a 00 00 00 ff 00 45 54 39
36 4e 30 30 33 35 35 53 4c 30 00 00 00 fd 00 28
3c 8c 8c 3c 01 0a 20 20 20 20 20 20 00 00 00 fc
00 42 65 6e 51 20 50 44 32 37 30 30 55 0a 01 e4

02 03 36 f1 56 61 60 5d 5e 5f 10 05 04 03 02 07
06 0f 1f 20 21 22 14 13 12 16 01 23 09 07 07 83
01 00 00 67 03 0c 00 10 00 38 78 e3 05 c0 00 e6
06 05 01 5a 53 44 02 3a 80 18 71 38 2d 40 58 2c
45 00 55 50 21 00 00 1e 56 5e 00 a0 a0 a0 29 50
30 20 35 00 55 50 21 00 00 1a 8c 64 00 50 f0 70
1f 80 08 20 18 04 55 50 21 00 00 1a 00 00 00 00
00 00 00 00 00 00 00 00 00 00 00 00 00 00 00 ac

----------------

Block 0, Base EDID:
  EDID Structure Version & Revision: 1.4
  Vendor & Product Identification:
    Manufacturer: BNQ
    Model: 32814
    Serial Number: ...
    Made in: week 25 of 2022
  Basic Display Parameters & Features:
    Digital display
    Bits per primary color channel: 10
    DisplayPort interface
    Maximum image size: 60 cm x 34 cm
    Gamma: 2.20
    DPMS levels: Off
    Supported color formats: RGB 4:4:4, YCrCb 4:4:4, YCrCb 4:2:2
    Default (sRGB) color space is primary color space
    First detailed timing includes the native pixel format and preferred refresh rate
    Display is continuous frequency
  Color Characteristics:
    Red  : 0.6523, 0.3339
    Green: 0.3066, 0.6367
    Blue : 0.1503, 0.0595
    White: 0.3134, 0.3291
  Established Timings I & II:
    IBM     :   720x400    70.081663 Hz   9:5     31.467 kHz     28.320000 MHz
    DMT 0x04:   640x480    59.940476 Hz   4:3     31.469 kHz     25.175000 MHz
    DMT 0x06:   640x480    75.000000 Hz   4:3     37.500 kHz     31.500000 MHz
    DMT 0x09:   800x600    60.316541 Hz   4:3     37.879 kHz     40.000000 MHz
    DMT 0x0b:   800x600    75.000000 Hz   4:3     46.875 kHz     49.500000 MHz
    Apple   :   832x624    74.551266 Hz   4:3     49.726 kHz     57.284000 MHz
    DMT 0x10:  1024x768    60.003840 Hz   4:3     48.363 kHz     65.000000 MHz
    DMT 0x12:  1024x768    75.028582 Hz   4:3     60.023 kHz     78.750000 MHz
    DMT 0x24:  1280x1024   75.024675 Hz   5:4     79.976 kHz    135.000000 MHz
    Apple   :  1152x870    75.061550 Hz 192:145   68.681 kHz    100.000000 MHz
  Standard Timings:
    DMT 0x52:  1920x1080   60.000000 Hz  16:9     67.500 kHz    148.500000 MHz
    DMT 0x55:  1280x720    60.000000 Hz  16:9     45.000 kHz     74.250000 MHz
    DMT 0x1c:  1280x800    59.810326 Hz  16:10    49.702 kHz     83.500000 MHz
    DMT 0x23:  1280x1024   60.019740 Hz   5:4     63.981 kHz    108.000000 MHz
    DMT 0x53:  1600x900    60.000000 Hz  16:9     60.000 kHz    108.000000 MHz (RB)
    DMT 0x3a:  1680x1050   59.954250 Hz  16:10    65.290 kHz    146.250000 MHz
    DMT 0x33:  1600x1200   60.000000 Hz   4:3     75.000 kHz    162.000000 MHz
  Detailed Timing Descriptors:
    DTD 1:  3840x2160   59.996625 Hz  16:9    133.312 kHz    533.250000 MHz (597 mm x 336 mm)
                 Hfront   48 Hsync  32 Hback   80 Hpol P
                 Vfront    3 Vsync   5 Vback   54 Vpol N
    Display Product Serial Number: ...
    Display Range Limits:
      Monitor ranges (Bare Limits): 40-60 Hz V, 140-140 kHz H, max dotclock 600 MHz
    Display Product Name: 'BenQ PD2700U'
  Extension blocks: 1
Checksum: 0xe4

----------------

Block 1, CTA-861 Extension Block:
  Revision: 3
  Underscans IT Video Formats by default
  Basic audio support
  Supports YCbCr 4:4:4
  Supports YCbCr 4:2:2
  Native detailed modes: 1
  Video Data Block:
    VIC  97:  3840x2160   60.000000 Hz  16:9    135.000 kHz    594.000000 MHz
    VIC  96:  3840x2160   50.000000 Hz  16:9    112.500 kHz    594.000000 MHz
    VIC  93:  3840x2160   24.000000 Hz  16:9     54.000 kHz    297.000000 MHz
    VIC  94:  3840x2160   25.000000 Hz  16:9     56.250 kHz    297.000000 MHz
    VIC  95:  3840x2160   30.000000 Hz  16:9     67.500 kHz    297.000000 MHz
    VIC  16:  1920x1080   60.000000 Hz  16:9     67.500 kHz    148.500000 MHz
    VIC   5:  1920x1080i  60.000000 Hz  16:9     33.750 kHz     74.250000 MHz
    VIC   4:  1280x720    60.000000 Hz  16:9     45.000 kHz     74.250000 MHz
    VIC   3:   720x480    59.940060 Hz  16:9     31.469 kHz     27.000000 MHz
    VIC   2:   720x480    59.940060 Hz   4:3     31.469 kHz     27.000000 MHz
    VIC   7:  1440x480i   59.940060 Hz  16:9     15.734 kHz     27.000000 MHz
    VIC   6:  1440x480i   59.940060 Hz   4:3     15.734 kHz     27.000000 MHz
    VIC  15:  1440x480    59.940060 Hz  16:9     31.469 kHz     54.000000 MHz
    VIC  31:  1920x1080   50.000000 Hz  16:9     56.250 kHz    148.500000 MHz
    VIC  32:  1920x1080   24.000000 Hz  16:9     27.000 kHz     74.250000 MHz
    VIC  33:  1920x1080   25.000000 Hz  16:9     28.125 kHz     74.250000 MHz
    VIC  34:  1920x1080   30.000000 Hz  16:9     33.750 kHz     74.250000 MHz
    VIC  20:  1920x1080i  50.000000 Hz  16:9     28.125 kHz     74.250000 MHz
    VIC  19:  1280x720    50.000000 Hz  16:9     37.500 kHz     74.250000 MHz
    VIC  18:   720x576    50.000000 Hz  16:9     31.250 kHz     27.000000 MHz
    VIC  22:  1440x576i   50.000000 Hz  16:9     15.625 kHz     27.000000 MHz
    VIC   1:   640x480    59.940476 Hz   4:3     31.469 kHz     25.175000 MHz
  Audio Data Block:
    Linear PCM:
      Max channels: 2
      Supported sample rates (kHz): 48 44.1 32
      Supported sample sizes (bits): 24 20 16
  Speaker Allocation Data Block:
    FL/FR - Front Left/Right
  Vendor-Specific Data Block (HDMI), OUI 00-0C-03:
    Source physical address: 1.0.0.0
    DC_36bit
    DC_30bit
    DC_Y444
    Maximum TMDS clock: 600 MHz
  Colorimetry Data Block:
    BT2020YCC
    BT2020RGB
  HDR Static Metadata Data Block:
    Electro optical transfer functions:
      Traditional gamma - SDR luminance range
      SMPTE ST2084
    Supported static metadata descriptors:
      Static metadata type 1
    Desired content max luminance: 90 (351.250 cd/m^2)
    Desired content max frame-average luminance: 83 (301.833 cd/m^2)
    Desired content min luminance: 68 (0.250 cd/m^2)
  Detailed Timing Descriptors:
    DTD 2:  1920x1080   60.000000 Hz  16:9     67.500 kHz    148.500000 MHz (597 mm x 336 mm)
                 Hfront   88 Hsync  44 Hback  148 Hpol P
                 Vfront    4 Vsync   5 Vback   36 Vpol P
    DTD 3:  2560x1440   59.950550 Hz  16:9     88.787 kHz    241.500000 MHz (597 mm x 336 mm)
                 Hfront   48 Hsync  32 Hback   80 Hpol P
                 Vfront    3 Vsync   5 Vback   33 Vpol N
    DTD 4:  3840x2160   29.969541 Hz  16:9     65.663 kHz    257.400000 MHz (597 mm x 336 mm)
                 Hfront    8 Hsync  32 Hback   40 Hpol P
                 Vfront   17 Vsync   8 Vback    6 Vpol N
Checksum: 0xac  Unused space in Extension Block: 19 bytes

----------------

Block 2, Unknown EDID Extension Block 0x00:
  00 ff ff ff ff ff ff 00 09 d1 2e 80 01 01 01 01 '................'
  19 20 01 04 b5 3c 22 78 3f 28 95 a7 55 4e a3 26 '. ...<"x?(..UN.&'
  0f 50 54 a5 6b 80 d1 c0 81 c0 81 00 81 80 a9 c0 '.PT.k...........'
  b3 00 a9 40 01 01 4d d0 00 a0 f0 70 3e 80 30 20 '...@..M....p>.0 '
  35 00 55 50 21 00 00 1a 00 00 00 ff 00 45 54 39 '5.UP!........ET9'
  36 4e 30 30 33 35 35 53 4c 30 00 00 00 fd 00 28 '6N00355SL0.....('
  3c 8c 8c 3c 01 0a 20 20 20 20 20 20 00 00 00 fc '<..<..      ....'
  00 42 65 6e 51 20 50 44 32 37 30 30 55 0a 01 e4 '.BenQ PD2700U...'
Checksum: 0xe4

----------------

Block 3, CTA-861 Extension Block:
  Revision: 3
  Underscans IT Video Formats by default
  Basic audio support
  Supports YCbCr 4:4:4
  Supports YCbCr 4:2:2
  Native detailed modes: 1
  Video Data Block:
    VIC  97:  3840x2160   60.000000 Hz  16:9    135.000 kHz    594.000000 MHz
    VIC  96:  3840x2160   50.000000 Hz  16:9    112.500 kHz    594.000000 MHz
    VIC  93:  3840x2160   24.000000 Hz  16:9     54.000 kHz    297.000000 MHz
    VIC  94:  3840x2160   25.000000 Hz  16:9     56.250 kHz    297.000000 MHz
    VIC  95:  3840x2160   30.000000 Hz  16:9     67.500 kHz    297.000000 MHz
    VIC  16:  1920x1080   60.000000 Hz  16:9     67.500 kHz    148.500000 MHz
    VIC   5:  1920x1080i  60.000000 Hz  16:9     33.750 kHz     74.250000 MHz
    VIC   4:  1280x720    60.000000 Hz  16:9     45.000 kHz     74.250000 MHz
    VIC   3:   720x480    59.940060 Hz  16:9     31.469 kHz     27.000000 MHz
    VIC   2:   720x480    59.940060 Hz   4:3     31.469 kHz     27.000000 MHz
    VIC   7:  1440x480i   59.940060 Hz  16:9     15.734 kHz     27.000000 MHz
    VIC   6:  1440x480i   59.940060 Hz   4:3     15.734 kHz     27.000000 MHz
    VIC  15:  1440x480    59.940060 Hz  16:9     31.469 kHz     54.000000 MHz
    VIC  31:  1920x1080   50.000000 Hz  16:9     56.250 kHz    148.500000 MHz
    VIC  32:  1920x1080   24.000000 Hz  16:9     27.000 kHz     74.250000 MHz
    VIC  33:  1920x1080   25.000000 Hz  16:9     28.125 kHz     74.250000 MHz
    VIC  34:  1920x1080   30.000000 Hz  16:9     33.750 kHz     74.250000 MHz
    VIC  20:  1920x1080i  50.000000 Hz  16:9     28.125 kHz     74.250000 MHz
    VIC  19:  1280x720    50.000000 Hz  16:9     37.500 kHz     74.250000 MHz
    VIC  18:   720x576    50.000000 Hz  16:9     31.250 kHz     27.000000 MHz
    VIC  22:  1440x576i   50.000000 Hz  16:9     15.625 kHz     27.000000 MHz
    VIC   1:   640x480    59.940476 Hz   4:3     31.469 kHz     25.175000 MHz
  Audio Data Block:
    Linear PCM:
      Max channels: 2
      Supported sample rates (kHz): 48 44.1 32
      Supported sample sizes (bits): 24 20 16
  Speaker Allocation Data Block:
    FL/FR - Front Left/Right
  Vendor-Specific Data Block (HDMI), OUI 00-0C-03:
    Source physical address: 1.0.0.0
    DC_36bit
    DC_30bit
    DC_Y444
    Maximum TMDS clock: 600 MHz
  Colorimetry Data Block:
    BT2020YCC
    BT2020RGB
  HDR Static Metadata Data Block:
    Electro optical transfer functions:
      Traditional gamma - SDR luminance range
      SMPTE ST2084
    Supported static metadata descriptors:
      Static metadata type 1
    Desired content max luminance: 90 (351.250 cd/m^2)
    Desired content max frame-average luminance: 83 (301.833 cd/m^2)
    Desired content min luminance: 68 (0.250 cd/m^2)
  Detailed Timing Descriptors:
    DTD 5:  1920x1080   60.000000 Hz  16:9     67.500 kHz    148.500000 MHz (597 mm x 336 mm)
                 Hfront   88 Hsync  44 Hback  148 Hpol P
                 Vfront    4 Vsync   5 Vback   36 Vpol P
    DTD 6:  2560x1440   59.950550 Hz  16:9     88.787 kHz    241.500000 MHz (597 mm x 336 mm)
                 Hfront   48 Hsync  32 Hback   80 Hpol P
                 Vfront    3 Vsync   5 Vback   33 Vpol N
    DTD 7:  3840x2160   29.969541 Hz  16:9     65.663 kHz    257.400000 MHz (597 mm x 336 mm)
                 Hfront    8 Hsync  32 Hback   40 Hpol P
                 Vfront   17 Vsync   8 Vback    6 Vpol N
Checksum: 0xac  Unused space in Extension Block: 19 bytes

----------------

Warnings:

Block 1, CTA-861 Extension Block:
  Display Product Serial Number is set, so the Serial Number in the Base EDID should be 0.
Block 3, CTA-861 Extension Block:
  Display Product Serial Number is set, so the Serial Number in the Base EDID should be 0.
EDID:
  Base EDID: Some timings are out of range of the Monitor Ranges:
    Vertical Freq: 24.000 - 75.062 Hz (Monitor: 40.000 - 60.000 Hz)
    Horizontal Freq: 15.625 - 135.000 kHz (Monitor: 140.000 - 140.000 kHz)

Failures:

Block 0, Base EDID:
  Basic Display Parameters & Features: sRGB is signaled, but the chromaticities do not match.
Block 1, CTA-861 Extension Block:
  Vendor-Specific Data Block (HDMI), OUI 00-0C-03: HDMI VSDB Max TMDS rate is > 340.
  Vendor-Specific Data Block (HDMI), OUI 00-0C-03: The HDMI Specification requires EDID 1.3 instead of 1.4.
  Missing VCDB, needed for Set Selectable RGB Quantization to avoid interop issues.
Block 2, Base EDID:
  Unknown Extension Block.
Block 3, CTA-861 Extension Block:
  Video Data Block: Duplicate VIC 97.
  Video Data Block: Duplicate VIC 96.
  Video Data Block: Duplicate VIC 93.
  Video Data Block: Duplicate VIC 94.
  Video Data Block: Duplicate VIC 95.
  Video Data Block: Duplicate VIC 16.
  Video Data Block: Duplicate VIC 5.
  Video Data Block: Duplicate VIC 4.
  Video Data Block: Duplicate VIC 3.
  Video Data Block: Duplicate VIC 2.
  Video Data Block: Duplicate VIC 7.
  Video Data Block: Duplicate VIC 6.
  Video Data Block: Duplicate VIC 15.
  Video Data Block: Duplicate VIC 31.
  Video Data Block: Duplicate VIC 32.
  Video Data Block: Duplicate VIC 33.
  Video Data Block: Duplicate VIC 34.
  Video Data Block: Duplicate VIC 20.
  Video Data Block: Duplicate VIC 19.
  Video Data Block: Duplicate VIC 18.
  Video Data Block: Duplicate VIC 22.
  Video Data Block: Duplicate VIC 1.
  Speaker Allocation Data Block: Only one instance of this Data Block is allowed.
  Vendor-Specific Data Block (HDMI), OUI 00-0C-03: HDMI VSDB Max TMDS rate is > 340.
  Vendor-Specific Data Block (HDMI), OUI 00-0C-03: The HDMI Specification requires EDID 1.3 instead of 1.4.
  Colorimetry Data Block: Only one instance of this Data Block is allowed.
  HDR Static Metadata Data Block: Only one instance of this Data Block is allowed.
  Missing VCDB, needed for Set Selectable RGB Quantization to avoid interop issues.
EDID:
  Base EDID: EDID specified 1 extension block(s), but found 3 extension block(s).

EDID conformity: FAIL
