
EDID (hex):
00ffffffffffff0022f0002602000000
300d0103681e168cee12e59a574f9326
214e53adee0001010101010101010101
01010101010164190040410026301888
36002cdc10000018000000ff00434e43
33343830324c530a2020000000fd0038
4c1e3d08000a202020202020000000fc
006870204c313530320a2020202000c1

Extracted contents:
header:          00 ff ff ff ff ff ff 00
serial number:   22 f0 00 26 02 00 00 00 30 0d
version:         01 03
basic params:    68 1e 16 8c ee
chroma info:     12 e5 9a 57 4f 93 26 21 4e 53
established:     ad ee 00
standard:        01 01 01 01 01 01 01 01 01 01 01 01 01 01 01 01
descriptor 1:    64 19 00 40 41 00 26 30 18 88 36 00 2c dc 10 00 00 18
descriptor 2:    00 00 00 ff 00 43 4e 43 33 34 38 30 32 4c 53 0a 20 20
descriptor 3:    00 00 00 fd 00 38 4c 1e 3d 08 00 0a 20 20 20 20 20 20
descriptor 4:    00 00 00 fc 00 68 70 20 4c 31 35 30 32 0a 20 20 20 20
extensions:      00
checksum:        c1

EDID version: 1.3
Manufacturer: HWP Model 2600 Serial Number --
Analog display, Input voltage level: 0.7/0.7 V
Sync: Separate 
Maximum image size: 30 cm x 22 cm
Gamma: 2.40
DPMS levels: Standby Suspend Off
RGB color display
Default (sRGB) color space is primary color space
First detailed timing is preferred timing
Display x,y Chromaticity:
  Red:   0.6015, 0.3408
  Green: 0.3085, 0.5761
  Blue:  0.1513, 0.1308
  White: 0.3056, 0.3251
Established timings supported:
  720x400@70Hz 9:5 HorFreq: 31469 Hz Clock: 28.320 MHz
  640x480@60Hz 4:3 HorFreq: 31469 Hz Clock: 25.175 MHz
  640x480@72Hz 4:3 HorFreq: 37900 Hz Clock: 31.500 MHz
  640x480@75Hz 4:3 HorFreq: 37500 Hz Clock: 31.500 MHz
  800x600@60Hz 4:3 HorFreq: 37900 Hz Clock: 40.000 MHz
  800x600@72Hz 4:3 HorFreq: 48100 Hz Clock: 50.000 MHz
  800x600@75Hz 4:3 HorFreq: 46900 Hz Clock: 49.500 MHz
  832x624@75Hz 4:3 HorFreq: 49726 Hz Clock: 57.284 MHz
  1024x768@60Hz 4:3 HorFreq: 48400 Hz Clock: 65.000 MHz
  1024x768@70Hz 4:3 HorFreq: 56500 Hz Clock: 75.000 MHz
  1024x768@75Hz 4:3 HorFreq: 60000 Hz Clock: 78.750 MHz
Standard timings supported:
Detailed mode: Clock 65.000 MHz, 300 mm x 220 mm
               1024 1048 1184 1344 hborder 0
                768  771  777  806 vborder 0
               -hsync -vsync 
               VertFreq: 60 Hz, HorFreq: 48363 Hz
Serial number: --
Monitor ranges (GTF): 56-76Hz V, 30-61kHz H, max dotclock 80MHz
Monitor name: hp L1502
Checksum: 0xc1 (valid)
EDID block does NOT conform to EDID 1.3!
	sRGB is signaled, but the chromaticities do not match
EDID block does not conform at all!
	Bad year of manufacture
