edid-decode (hex):

00 ff ff ff ff ff ff 00 09 e5 89 08 00 00 00 00
01 1d 01 04 b5 22 13 78 0a ce a0 a4 56 4c 9c 26
11 50 54 00 00 00 01 01 01 01 01 01 01 01 01 01
01 01 01 01 01 01 0c 35 80 64 70 38 28 40 30 20
35 00 58 c2 10 00 00 1a 00 00 00 00 00 00 00 00
00 00 00 00 00 00 00 00 00 00 00 00 00 fe 00 42
4f 45 20 48 46 0a 20 20 20 20 20 20 00 00 00 fe
00 4e 45 31 35 36 46 48 4d 2d 4e 35 33 0a 00 7e

----------------

Block 0, Base EDID:
  EDID Structure Version & Revision: 1.4
  Vendor & Product Identification:
    Manufacturer: BOE
    Model: 2185
    Made in: week 1 of 2019
  Basic Display Parameters & Features:
    Digital display
    Bits per primary color channel: 10
    DisplayPort interface
    Maximum image size: 34 cm x 19 cm
    Gamma: 2.20
    Supported color formats: RGB 4:4:4, YCrCb 4:4:4
    First detailed timing includes the native pixel format and preferred refresh rate
  Color Characteristics:
    Red  : 0.6435, 0.3359
    Green: 0.2998, 0.6113
    Blue : 0.1503, 0.0683
    White: 0.3125, 0.3281
  Established Timings I & II: none
  Standard Timings: none
  Detailed Timing Descriptors:
    DTD 1:  1920x1080   60.025 Hz  16:9    67.228 kHz 135.800 MHz (344 mm x 194 mm)
                 Hfront   48 Hsync  32 Hback  20 Hpol P
                 Vfront    3 Vsync   5 Vback  32 Vpol N
    Empty Descriptor
    Alphanumeric Data String: 'BOE HF'
    Alphanumeric Data String: 'NE156FHM-N53'
Checksum: 0x7e

----------------

Failures:

Block 0, Base EDID:
  Empty Descriptor: Use Dummy Descriptor instead of all zeroes.
  Missing Display Product Name.

EDID conformity: FAIL
