
EDID (hex):
00ffffffffffff0009d1e97845540000
1e1f0103a0301b7822b065a656539d28
0c5054a56b80000081c0810081800000
000001010101023a801871382d40582c
4500a05a0000001e000000ff0057374d
30313733393031390a20000000fd0032
4c1e530f000a202020202020000000fc
0042656e51204757323238330a2000f1

Extracted contents:
header:          00 ff ff ff ff ff ff 00
serial number:   09 d1 e9 78 45 54 00 00 1e 1f
version:         01 03
basic params:    a0 30 1b 78 22
chroma info:     b0 65 a6 56 53 9d 28 0c 50 54
established:     a5 6b 80
standard:        00 00 81 c0 81 00 81 80 00 00 00 00 01 01 01 01
descriptor 1:    02 3a 80 18 71 38 2d 40 58 2c 45 00 a0 5a 00 00 00 1e
descriptor 2:    00 00 00 ff 00 57 37 4d 30 31 37 33 39 30 31 39 0a 20
descriptor 3:    00 00 00 fd 00 32 4c 1e 53 0f 00 0a 20 20 20 20 20 20
descriptor 4:    00 00 00 fc 00 42 65 6e 51 20 47 57 32 32 38 33 0a 20
extensions:      00
checksum:        f1

EDID version: 1.3
Manufacturer: BNQ Model 78e9 Serial Number --
Made in week 30 of 2021
Digital display
Maximum image size: 48 cm x 27 cm
Gamma: 2.20
DPMS levels: Off
Monochrome or grayscale display
First detailed timing is preferred timing
Display x,y Chromaticity:
  Red:   0.6503, 0.3388
  Green: 0.3242, 0.6132
  Blue:  0.1572, 0.0488
  White: 0.3134, 0.3291
Established timings supported:
  720x400@70Hz 9:5 HorFreq: 31469 Hz Clock: 28.320 MHz
  640x480@60Hz 4:3 HorFreq: 31469 Hz Clock: 25.175 MHz
  640x480@75Hz 4:3 HorFreq: 37500 Hz Clock: 31.500 MHz
  800x600@60Hz 4:3 HorFreq: 37900 Hz Clock: 40.000 MHz
  800x600@75Hz 4:3 HorFreq: 46900 Hz Clock: 49.500 MHz
  832x624@75Hz 4:3 HorFreq: 49726 Hz Clock: 57.284 MHz
  1024x768@60Hz 4:3 HorFreq: 48400 Hz Clock: 65.000 MHz
  1024x768@75Hz 4:3 HorFreq: 60000 Hz Clock: 78.750 MHz
  1280x1024@75Hz 5:4 HorFreq: 80000 Hz Clock: 135.000 MHz
  1152x870@75Hz 192:145 HorFreq: 67500 Hz Clock: 108.000 MHz
Standard timings supported:
non-conformant standard timing (0 horiz)
  1280x720@60Hz 16:9
  1280x800@60Hz 16:10
  1280x1024@60Hz 5:4 HorFreq: 64000 Hz Clock: 108.000 MHz
non-conformant standard timing (0 horiz)
non-conformant standard timing (0 horiz)
Detailed mode: Clock 148.500 MHz, 160 mm x 90 mm
               1920 2008 2052 2200 hborder 0
               1080 1084 1089 1125 vborder 0
               +hsync +vsync 
               VertFreq: 60 Hz, HorFreq: 67500 Hz
Serial number: --
Monitor ranges (GTF): 50-76Hz V, 30-83kHz H, max dotclock 150MHz
Monitor name: BenQ GW2283
Checksum: 0xf1 (valid)
EDID block does NOT conform to EDID 1.3!
	Digital display field contains garbage: 20
