edid-decode (hex):

00 ff ff ff ff ff ff 00 09 d1 e9 78 45 54 00 00
31 1d 01 04 a5 30 1b 78 26 b0 65 a6 56 53 9d 28
0c 50 54 a5 6b 80 d1 c0 81 c0 81 00 81 80 a9 c0
b3 00 01 01 01 01 02 3a 80 18 71 38 2d 40 58 2c
45 00 dc 0c 11 00 00 1e 00 00 00 ff 00 38 43 4b
30 31 33 31 32 30 31 39 0a 20 00 00 00 fd 00 32
4c 1e 53 15 00 0a 20 20 20 20 20 20 00 00 00 fc
00 42 65 6e 51 20 47 57 32 32 38 33 0a 20 00 46

00 ff ff ff ff ff ff 00 09 d1 e9 78 45 54 00 00
31 1d 01 04 a5 30 1b 78 26 b0 65 a6 56 53 9d 28
0c 50 54 a5 6b 80 d1 c0 81 c0 81 00 81 80 a9 c0
b3 00 01 01 01 01 02 3a 80 18 71 38 2d 40 58 2c
45 00 dc 0c 11 00 00 1e 00 00 00 ff 00 38 43 4b
30 31 33 31 32 30 31 39 0a 20 00 00 00 fd 00 32
4c 1e 53 15 00 0a 20 20 20 20 20 20 00 00 00 fc
00 42 65 6e 51 20 47 57 32 32 38 33 0a 20 00 46

----------------

Block 0, Base EDID:
  EDID Structure Version & Revision: 1.4
  Vendor & Product Identification:
    Manufacturer: BNQ
    Model: 30953
    Serial Number: ...
    Made in: week 49 of 2019
  Basic Display Parameters & Features:
    Digital display
    Bits per primary color channel: 8
    DisplayPort interface
    Maximum image size: 48 cm x 27 cm
    Gamma: 2.20
    DPMS levels: Off
    Supported color formats: RGB 4:4:4
    Default (sRGB) color space is primary color space
    First detailed timing includes the native pixel format and preferred refresh rate
  Color Characteristics:
    Red  : 0.6503, 0.3388
    Green: 0.3242, 0.6132
    Blue : 0.1572, 0.0488
    White: 0.3134, 0.3291
  Established Timings I & II:
    IBM     :   720x400    70.081663 Hz   9:5     31.467 kHz     28.320000 MHz
    DMT 0x04:   640x480    59.940476 Hz   4:3     31.469 kHz     25.175000 MHz
    DMT 0x06:   640x480    75.000000 Hz   4:3     37.500 kHz     31.500000 MHz
    DMT 0x09:   800x600    60.316541 Hz   4:3     37.879 kHz     40.000000 MHz
    DMT 0x0b:   800x600    75.000000 Hz   4:3     46.875 kHz     49.500000 MHz
    Apple   :   832x624    74.551266 Hz   4:3     49.726 kHz     57.284000 MHz
    DMT 0x10:  1024x768    60.003840 Hz   4:3     48.363 kHz     65.000000 MHz
    DMT 0x12:  1024x768    75.028582 Hz   4:3     60.023 kHz     78.750000 MHz
    DMT 0x24:  1280x1024   75.024675 Hz   5:4     79.976 kHz    135.000000 MHz
    Apple   :  1152x870    75.061550 Hz 192:145   68.681 kHz    100.000000 MHz
  Standard Timings:
    DMT 0x52:  1920x1080   60.000000 Hz  16:9     67.500 kHz    148.500000 MHz
    DMT 0x55:  1280x720    60.000000 Hz  16:9     45.000 kHz     74.250000 MHz
    DMT 0x1c:  1280x800    59.810326 Hz  16:10    49.702 kHz     83.500000 MHz
    DMT 0x23:  1280x1024   60.019740 Hz   5:4     63.981 kHz    108.000000 MHz
    DMT 0x53:  1600x900    60.000000 Hz  16:9     60.000 kHz    108.000000 MHz (RB)
    DMT 0x3a:  1680x1050   59.954250 Hz  16:10    65.290 kHz    146.250000 MHz
  Detailed Timing Descriptors:
    DTD 1:  1920x1080   60.000000 Hz  16:9     67.500 kHz    148.500000 MHz (476 mm x 268 mm)
                 Hfront   88 Hsync  44 Hback  148 Hpol P
                 Vfront    4 Vsync   5 Vback   36 Vpol P
    Display Product Serial Number: ...
    Display Range Limits:
      Monitor ranges (GTF): 50-76 Hz V, 30-83 kHz H, max dotclock 210 MHz
    Display Product Name: 'BenQ GW2283'
Checksum: 0x46

----------------

Block 1, Unknown EDID Extension Block 0x00:
  00 ff ff ff ff ff ff 00 09 d1 e9 78 45 54 00 00 '...........xET..'
  31 1d 01 04 a5 30 1b 78 26 b0 65 a6 56 53 9d 28 '1....0.x&.e.VS.('
  0c 50 54 a5 6b 80 d1 c0 81 c0 81 00 81 80 a9 c0 '.PT.k...........'
  b3 00 01 01 01 01 02 3a 80 18 71 38 2d 40 58 2c '.......:..q8-@X,'
  45 00 dc 0c 11 00 00 1e 00 00 00 ff 00 38 43 4b 'E............8CK'
  30 31 33 31 32 30 31 39 0a 20 00 00 00 fd 00 32 '01312019. .....2'
  4c 1e 53 15 00 0a 20 20 20 20 20 20 00 00 00 fc 'L.S...      ....'
  00 42 65 6e 51 20 47 57 32 32 38 33 0a 20 00 46 '.BenQ GW2283. .F'
Checksum: 0x46

----------------

Warnings:

Block 0, Base EDID:
  Display Range Limits: GTF support is deprecated in EDID 1.4.

Failures:

Block 0, Base EDID:
  Basic Display Parameters & Features: sRGB is signaled, but the chromaticities do not match.
  Display Range Limits: GTF can't be combined with non-continuous frequencies.
Block 1, Base EDID:
  Unknown Extension Block.
EDID:
  Base EDID: EDID specified 0 extension block(s), but found 1 extension block(s).

EDID conformity: FAIL
