edid-decode (hex):

00 ff ff ff ff ff ff 00 38 a3 1f 67 01 01 01 01
32 12 01 03 80 2f 1e 78 ee 78 f5 a6 55 48 9b 26
12 50 54 bf ef 80 81 c0 81 80 90 40 8b c0 95 00
a9 40 b3 00 01 01 21 39 90 30 62 1a 27 40 68 b0
36 00 d9 28 11 00 00 1c 01 1d 00 72 51 d0 1e 20
6e 28 55 00 d9 28 11 00 00 1e 00 00 00 fd 00 38
4c 1f 53 11 00 0a 20 20 20 20 20 20 00 00 00 fc
00 4c 43 44 32 32 57 4d 47 58 0a 20 20 20 01 0f

02 03 0f 01 4a 84 13 03 07 12 16 05 14 10 1f 01
1d 00 bc 52 d0 1e 20 b8 28 55 40 d9 28 11 00 00
1e 8c 0a d0 8a 20 e0 2d 10 10 3e 96 00 d9 28 11
00 00 18 8c 0a d0 90 20 40 31 20 0c 40 55 00 d9
28 11 00 00 18 01 1d 80 18 71 1c 16 20 58 2c 25
00 d9 28 11 00 00 9e 00 00 00 01 00 31 30 0a 00
00 00 00 00 00 00 00 00 00 00 00 00 ff 00 38 5a
33 30 33 37 35 36 57 42 0a 20 20 00 00 00 00 1a

----------------

Block 0, Base EDID:
  EDID Structure Version & Revision: 1.3
  Vendor & Product Identification:
    Manufacturer: NEC
    Model: 26399
    Serial Number: ...
    Made in: week 50 of 2008
  Basic Display Parameters & Features:
    Digital display
    Maximum image size: 47 cm x 30 cm
    Gamma: 2.20
    DPMS levels: Standby Suspend Off
    RGB color display
    Default (sRGB) color space is primary color space
    First detailed timing is preferred timing
  Color Characteristics:
    Red  : 0.6494, 0.3349
    Green: 0.2832, 0.6054
    Blue : 0.1513, 0.0732
    White: 0.3134, 0.3291
  Established Timings I & II:
    IBM     :   720x400    70.082 Hz   9:5    31.467 kHz  28.320 MHz
    DMT 0x04:   640x480    59.940 Hz   4:3    31.469 kHz  25.175 MHz
    Apple   :   640x480    66.667 Hz   4:3    35.000 kHz  30.240 MHz
    DMT 0x05:   640x480    72.809 Hz   4:3    37.861 kHz  31.500 MHz
    DMT 0x06:   640x480    75.000 Hz   4:3    37.500 kHz  31.500 MHz
    DMT 0x08:   800x600    56.250 Hz   4:3    35.156 kHz  36.000 MHz
    DMT 0x09:   800x600    60.317 Hz   4:3    37.879 kHz  40.000 MHz
    DMT 0x0a:   800x600    72.188 Hz   4:3    48.077 kHz  50.000 MHz
    DMT 0x0b:   800x600    75.000 Hz   4:3    46.875 kHz  49.500 MHz
    Apple   :   832x624    74.551 Hz   4:3    49.726 kHz  57.284 MHz
    DMT 0x10:  1024x768    60.004 Hz   4:3    48.363 kHz  65.000 MHz
    DMT 0x11:  1024x768    70.069 Hz   4:3    56.476 kHz  75.000 MHz
    DMT 0x12:  1024x768    75.029 Hz   4:3    60.023 kHz  78.750 MHz
    DMT 0x24:  1280x1024   75.025 Hz   5:4    79.976 kHz 135.000 MHz
    Apple   :  1152x870    75.062 Hz 192:145  68.681 kHz 100.000 MHz
  Standard Timings:
    DMT 0x55:  1280x720    60.000 Hz  16:9    45.000 kHz  74.250 MHz
    DMT 0x23:  1280x1024   60.020 Hz   5:4    63.981 kHz 108.000 MHz
    DMT 0x2a:  1400x1050   59.978 Hz   4:3    65.317 kHz 121.750 MHz
    GTF     :  1360x768    60.000 Hz  16:9    47.700 kHz  84.715 MHz
    DMT 0x2f:  1440x900    59.887 Hz  16:10   55.935 kHz 106.500 MHz
    DMT 0x33:  1600x1200   60.000 Hz   4:3    75.000 kHz 162.000 MHz
    DMT 0x3a:  1680x1050   59.954 Hz  16:10   65.290 kHz 146.250 MHz
  Detailed Timing Descriptors:
    DTD 1:  1680x1050   59.954 Hz   8:5    65.290 kHz 146.250 MHz (473 mm x 296 mm)
                 Hfront  104 Hsync 176 Hback 280 Hpol N
                 Vfront    3 Vsync   6 Vback  30 Vpol P
    DTD 2:  1280x720    60.000 Hz  16:9    45.000 kHz  74.250 MHz (473 mm x 296 mm)
                 Hfront  110 Hsync  40 Hback 220 Hpol P
                 Vfront    5 Vsync   5 Vback  20 Vpol P
  Display Range Limits:
    Monitor ranges (GTF): 56-76 Hz V, 31-83 kHz H, max dotclock 170 MHz
    Display Product Name: 'LCD22WMGX'
  Extension blocks: 1
Checksum: 0xf

----------------

Block 1, CTA-861 Extension Block:
  Revision: 3
  Native detailed modes: 1
  Video Data Block:
    VIC   4:  1280x720    60.000 Hz  16:9    45.000 kHz  74.250 MHz (native)
    VIC  19:  1280x720    50.000 Hz  16:9    37.500 kHz  74.250 MHz
    VIC   3:   720x480    59.940 Hz  16:9    31.469 kHz  27.000 MHz
    VIC   7:  1440x480i   59.940 Hz  16:9    15.734 kHz  27.000 MHz
    VIC  18:   720x576    50.000 Hz  16:9    31.250 kHz  27.000 MHz
    VIC  22:  1440x576i   50.000 Hz  16:9    15.625 kHz  27.000 MHz
    VIC   5:  1920x1080i  60.000 Hz  16:9    33.750 kHz  74.250 MHz
    VIC  20:  1920x1080i  50.000 Hz  16:9    28.125 kHz  74.250 MHz
    VIC  16:  1920x1080   60.000 Hz  16:9    67.500 kHz 148.500 MHz
    VIC  31:  1920x1080   50.000 Hz  16:9    56.250 kHz 148.500 MHz
  Detailed Timing Descriptors:
    DTD 3:  1280x720    50.000 Hz  16:9    37.500 kHz  74.250 MHz (473 mm x 296 mm)
                 Hfront  440 Hsync  40 Hback 220 Hpol P
                 Vfront    5 Vsync   5 Vback  20 Vpol P
    DTD 4:   720x480    59.940 Hz   3:2    31.469 kHz  27.000 MHz (473 mm x 296 mm)
                 Hfront   16 Hsync  62 Hback  60 Hpol N
                 Vfront    9 Vsync   6 Vback  30 Vpol N
    DTD 5:   720x576    50.000 Hz   5:4    31.250 kHz  27.000 MHz (473 mm x 296 mm)
                 Hfront   12 Hsync  64 Hback  68 Hpol N
                 Vfront    5 Vsync   5 Vback  39 Vpol N
    DTD 6:  1920x1080i  60.000 Hz  16:9    33.750 kHz  74.250 MHz (473 mm x 296 mm)
                 Hfront   88 Hsync  44 Hback 148 Hpol P
                 Vfront    2 Vsync   5 Vback  15 Vpol P Vfront +0.5 Odd Field
                 Vfront    2 Vsync   5 Vback  15 Vpol P Vback  +0.5 Even Field
    Manufacturer-Specified Display Descriptor (0x01): 00 01 00 31 30 0a 00 00 00 00 00 00 00 00 00 00 '...10...........'
    Display Product Serial Number: ...
Checksum: 0x1a

----------------

Warnings:

Block 1, CTA-861 Extension Block:
  Display Product Serial Number is set, so the Serial Number in the Base EDID should be 0.

Failures:

Block 0, Base EDID:
  Basic Display Parameters & Features: sRGB is signaled, but the chromaticities do not match.
All Blocks:
  Some timings are out of range of the Monitor Ranges:
    Vertical Freq: 50.000 - 75.062 Hz (Monitor: 56.000 - 76.000 Hz)
    Horizontal Freq: 15.625 - 79.976 kHz (Monitor: 31.000 - 83.000 kHz)

EDID conformity: FAIL
