
EDID (hex):
00ffffffffffff001e6df976c1630500
011d010380502278eaca95a6554ea126
0f5054256b807140818081c0a9c0b300
d1c08100d1cfcd4600a0a0381f403020
3a001e4e3100001a003a801871382d40
582c4500132a2100001e000000fd0038
4b1e5a18000a202020202020000000fc
004c4720554c545241574944450a01dd

Extracted contents:
header:          00 ff ff ff ff ff ff 00
serial number:   1e 6d f9 76 c1 63 05 00 01 1d
version:         01 03
basic params:    80 50 22 78 ea
chroma info:     ca 95 a6 55 4e a1 26 0f 50 54
established:     25 6b 80
standard:        71 40 81 80 81 c0 a9 c0 b3 00 d1 c0 81 00 d1 cf
descriptor 1:    cd 46 00 a0 a0 38 1f 40 30 20 3a 00 1e 4e 31 00 00 1a
descriptor 2:    00 3a 80 18 71 38 2d 40 58 2c 45 00 13 2a 21 00 00 1e
descriptor 3:    00 00 00 fd 00 38 4b 1e 5a 18 00 0a 20 20 20 20 20 20
descriptor 4:    00 00 00 fc 00 4c 47 20 55 4c 54 52 41 57 49 44 45 0a
extensions:      01
checksum:        dd

EDID version: 1.3
Manufacturer: GSM Model 76f9 Serial Number --
Made in week 1 of 2019
Digital display
Maximum image size: 80 cm x 34 cm
Gamma: 2.20
DPMS levels: Standby Suspend Off
RGB color display
First detailed timing is preferred timing
Display x,y Chromaticity:
  Red:   0.6513, 0.3320
  Green: 0.3066, 0.6308
  Blue:  0.1503, 0.0595
  White: 0.3134, 0.3291
Established timings supported:
  640x480@60Hz 4:3 HorFreq: 31469 Hz Clock: 25.175 MHz
  640x480@75Hz 4:3 HorFreq: 37500 Hz Clock: 31.500 MHz
  800x600@60Hz 4:3 HorFreq: 37900 Hz Clock: 40.000 MHz
  800x600@75Hz 4:3 HorFreq: 46900 Hz Clock: 49.500 MHz
  832x624@75Hz 4:3 HorFreq: 49726 Hz Clock: 57.284 MHz
  1024x768@60Hz 4:3 HorFreq: 48400 Hz Clock: 65.000 MHz
  1024x768@75Hz 4:3 HorFreq: 60000 Hz Clock: 78.750 MHz
  1280x1024@75Hz 5:4 HorFreq: 80000 Hz Clock: 135.000 MHz
  1152x870@75Hz 192:145 HorFreq: 67500 Hz Clock: 108.000 MHz
Standard timings supported:
  1152x864@60Hz 4:3
  1280x1024@60Hz 5:4 HorFreq: 64000 Hz Clock: 108.000 MHz
  1280x720@60Hz 16:9
  1600x900@60Hz 16:9
  1680x1050@60Hz 16:10 HorFreq: 64700 Hz Clock: 119.000 MHz
  1920x1080@60Hz 16:9
  1280x800@60Hz 16:10
  1920x1080@75Hz 16:9
Detailed mode: Clock 181.250 MHz, 798 mm x 334 mm
               2560 2608 2640 2720 hborder 0
               1080 1083 1093 1111 vborder 0
               +hsync -vsync 
               VertFreq: 59 Hz, HorFreq: 66636 Hz
Detailed mode: Clock 148.480 MHz, 531 mm x 298 mm
               1920 2008 2052 2200 hborder 0
               1080 1084 1089 1125 vborder 0
               +hsync +vsync 
               VertFreq: 59 Hz, HorFreq: 67490 Hz
Monitor ranges (GTF): 56-75Hz V, 30-90kHz H, max dotclock 240MHz
Monitor name: LG ULTRAWIDE
Has 1 extension blocks
Checksum: 0xdd (valid)
