edid-decode (hex):

00 ff ff ff ff ff ff 00 4c a3 45 31 00 00 00 00
00 15 01 03 80 1b 0f 78 0a 09 e5 97 57 54 8a 27
22 50 54 00 00 00 01 01 01 01 01 01 01 01 01 01
01 01 01 01 01 01 9e 1b 56 78 50 00 18 30 30 20
25 00 0c 97 10 00 00 19 00 00 00 0f 00 00 00 00
00 00 00 00 00 1e b4 02 74 00 00 00 00 fe 00 53
41 4d 53 55 4e 47 0a 20 20 20 20 20 00 00 00 fe
00 31 32 35 41 54 30 33 2d 38 30 31 0a 20 00 aa

----------------

Block 0, Base EDID:
  EDID Structure Version & Revision: 1.3
  Vendor & Product Identification:
    Manufacturer: SEC
    Model: 12613
    Made in: 2011
  Basic Display Parameters & Features:
    Digital display
    Maximum image size: 27 cm x 15 cm
    Gamma: 2.20
    RGB color display
    First detailed timing is the preferred timing
  Color Characteristics:
    Red  : 0.5898, 0.3398
    Green: 0.3300, 0.5400
    Blue : 0.1552, 0.1347
    White: 0.3134, 0.3291
  Established Timings I & II: none
  Standard Timings: none
  Detailed Timing Descriptors:
    DTD 1:  1366x768    60.072461 Hz 683:384   47.577 kHz     70.700000 MHz (268 mm x 151 mm)
                 Hfront   48 Hsync  32 Hback   40 Hpol N
                 Vfront    2 Vsync   5 Vback   17 Vpol N
    Manufacturer-Specified Display Descriptor (0x0f): 00 0f 00 00 00 00 00 00 00 00 00 1e b4 02 74 00 '..............t.'
    Alphanumeric Data String: 'SAMSUNG'
    Alphanumeric Data String: '125AT03-801'
Checksum: 0xaa

----------------

Failures:

Block 0, Base EDID:
  Missing Display Product Name.
  Missing Display Range Limits Descriptor.

EDID conformity: FAIL
