edid-decode (hex):

00 ff ff ff ff ff ff 00 34 38 b3 06 ab 04 00 00
1d 0c 01 02 68 22 1c 78 e8 f5 96 a3 58 4d 96 24
19 52 56 bf ef 00 71 4f 81 40 81 80 01 01 01 01
01 01 01 01 01 01 00 00 00 fe 0a 20 20 20 20 20
20 20 20 20 20 20 20 20 00 00 00 fe 0a 20 20 20
20 20 20 20 20 20 20 20 20 20 00 00 00 fe 0a 20
20 20 20 20 20 20 20 20 20 20 20 20 00 00 00 fc
00 4c 37 45 0a 20 20 20 20 20 20 20 20 20 00 92

----------------

Block 0, Base EDID:
  EDID Structure Version & Revision: 1.2
  Vendor & Product Identification:
    Manufacturer: MAX
    Model: 1715
    Serial Number: ...
    Made in: week 29 of 2002
  Basic Display Parameters & Features:
    Analog display
    Input voltage level: 0.7/0.7 V
    Blank level equals black level
    Sync: Separate
    Maximum image size: 34 cm x 28 cm
    Gamma: 2.20
    DPMS levels: Standby Suspend Off
    RGB color display
  Color Characteristics:
    Red  : 0.6396, 0.3466
    Green: 0.3017, 0.5869
    Blue : 0.1425, 0.0986
    White: 0.3212, 0.3378
  Established Timings I & II:
    IBM     :   720x400    70.081663 Hz   9:5     31.467 kHz     28.320000 MHz
    DMT 0x04:   640x480    59.940476 Hz   4:3     31.469 kHz     25.175000 MHz
    Apple   :   640x480    66.666667 Hz   4:3     35.000 kHz     30.240000 MHz
    DMT 0x05:   640x480    72.808802 Hz   4:3     37.861 kHz     31.500000 MHz
    DMT 0x06:   640x480    75.000000 Hz   4:3     37.500 kHz     31.500000 MHz
    DMT 0x08:   800x600    56.250000 Hz   4:3     35.156 kHz     36.000000 MHz
    DMT 0x09:   800x600    60.316541 Hz   4:3     37.879 kHz     40.000000 MHz
    DMT 0x0a:   800x600    72.187572 Hz   4:3     48.077 kHz     50.000000 MHz
    DMT 0x0b:   800x600    75.000000 Hz   4:3     46.875 kHz     49.500000 MHz
    Apple   :   832x624    74.551266 Hz   4:3     49.726 kHz     57.284000 MHz
    DMT 0x10:  1024x768    60.003840 Hz   4:3     48.363 kHz     65.000000 MHz
    DMT 0x11:  1024x768    70.069359 Hz   4:3     56.476 kHz     75.000000 MHz
    DMT 0x12:  1024x768    75.028582 Hz   4:3     60.023 kHz     78.750000 MHz
    DMT 0x24:  1280x1024   75.024675 Hz   5:4     79.976 kHz    135.000000 MHz
  Standard Timings:
    DMT 0x15:  1152x864    75.000000 Hz   4:3     67.500 kHz    108.000000 MHz
    DMT 0x20:  1280x960    60.000000 Hz   4:3     60.000 kHz    108.000000 MHz
    DMT 0x23:  1280x1024   60.019740 Hz   5:4     63.981 kHz    108.000000 MHz
  Detailed Timing Descriptors:
    Alphanumeric Data String: '             '
    Alphanumeric Data String: '             '
    Alphanumeric Data String: '             '
    Display Product Name: 'L7E'
Checksum: 0x92

----------------

Warnings:

Block 0, Base EDID:
  EDID Structure Version & Revision: EDID 1.2 is deprecated, do not use.

Failures:

Block 0, Base EDID:
  Display Descriptor #1: Monitor descriptor block has byte 4 nonzero (0x0a).
  Alphanumeric Data String: One or more trailing spaces.
  Display Descriptor #2: Monitor descriptor block has byte 4 nonzero (0x0a).
  Alphanumeric Data String: One or more trailing spaces.
  Display Descriptor #3: Monitor descriptor block has byte 4 nonzero (0x0a).
  Alphanumeric Data String: One or more trailing spaces.

EDID conformity: FAIL
