
EDID (hex):
00ffffffffffff0030e4010500000000
00190104a51f1178021715a556519c27
0c505400000001010101010101010101
010101010101e45c00a0a0a011503020
230036ae1000001a0000000000000000
00000000000000000000000000fe004c
4720446973706c61790a2020000000fe
004c503134305148312d535045330070

Extracted contents:
header:          00 ff ff ff ff ff ff 00
serial number:   30 e4 01 05 00 00 00 00 00 19
version:         01 04
basic params:    a5 1f 11 78 02
chroma info:     17 15 a5 56 51 9c 27 0c 50 54
established:     00 00 00
standard:        01 01 01 01 01 01 01 01 01 01 01 01 01 01 01 01
descriptor 1:    e4 5c 00 a0 a0 a0 11 50 30 20 23 00 36 ae 10 00 00 1a
descriptor 2:    00 00 00 00 00 00 00 00 00 00 00 00 00 00 00 00 00 00
descriptor 3:    00 00 00 fe 00 4c 47 20 44 69 73 70 6c 61 79 0a 20 20
descriptor 4:    00 00 00 fe 00 4c 50 31 34 30 51 48 31 2d 53 50 45 33
extensions:      00
checksum:        70

EDID version: 1.4
Manufacturer: LGD Model 501 Serial Number --
Made in year 2015
Digital display
8 bits per primary color channel
DisplayPort interface
Maximum image size: 31 cm x 17 cm
Gamma: 2.20
Supported color formats: RGB 4:4:4
First detailed timing includes the native pixel format and preferred refresh rate
Display x,y Chromaticity:
  Red:   0.6445, 0.3369
  Green: 0.3173, 0.6123
  Blue:  0.1523, 0.0478
  White: 0.3134, 0.3291
Established timings supported:
Standard timings supported:
Detailed mode: Clock 237.800 MHz, 310 mm x 174 mm
               2560 2608 2640 2720 hborder 0
               1440 1442 1445 1457 vborder 0
               +hsync -vsync 
               VertFreq: 60 Hz, HorFreq: 87426 Hz
Manufacturer-specified data, tag 0
ASCII string: LG Display
ASCII string: LP140QH1-SPE3
Checksum: 0x70 (valid)
EDID block does NOT conform to EDID 1.4!
	Missing name descriptor
	Missing monitor ranges


