edid-decode (hex):

00 ff ff ff ff ff ff 00 0d af 67 14 00 00 00 00
26 14 01 04 90 1f 12 78 0a 05 35 96 5b 51 90 29
24 50 54 00 00 00 01 01 01 01 01 01 01 01 01 01
01 01 01 01 01 01 12 1b 56 64 50 00 14 30 30 20
14 00 35 ae 10 00 00 1a 0d 12 56 64 50 00 14 30
30 20 14 00 35 ae 10 00 00 1a 00 00 00 00 00 00
00 00 00 00 00 00 00 00 00 00 00 00 00 00 00 02
00 0c 47 ed 0a 3c 64 11 12 1e 6b 00 00 00 00 de

----------------

Block 0, Base EDID:
  EDID Structure Version & Revision: 1.4
  Vendor & Product Identification:
    Manufacturer: CMO
    Model: 5223
    Made in: week 38 of 2010
  Basic Display Parameters & Features:
    Digital display
    Bits per primary color channel: 6
    Digital interface is not defined
    Maximum image size: 31 cm x 18 cm
    Gamma: 2.20
    Supported color formats: RGB 4:4:4, YCrCb 4:4:4
    First detailed timing includes the native pixel format and preferred refresh rate
  Color Characteristics:
    Red  : 0.5859, 0.3554
    Green: 0.3173, 0.5634
    Blue : 0.1601, 0.1435
    White: 0.3134, 0.3291
  Established Timings I & II: none
  Standard Timings: none
  Detailed Timing Descriptors:
    DTD 1:  1366x768    59.989 Hz 683:384  47.271 kHz  69.300 MHz (309 mm x 174 mm)
                 Hfront   48 Hsync  32 Hback  20 Hpol P
                 Vfront    1 Vsync   4 Vback  15 Vpol N
    DTD 2:  1366x768    40.001 Hz 683:384  31.521 kHz  46.210 MHz (309 mm x 174 mm)
                 Hfront   48 Hsync  32 Hback  20 Hpol P
                 Vfront    1 Vsync   4 Vback  15 Vpol N
    Empty Descriptor
    Manufacturer-Specified Display Descriptor (0x02): 00 02 00 0c 47 ed 0a 3c 64 11 12 1e 6b 00 00 00 '....G..<d...k...'
Checksum: 0xde
