
EDID (hex):
00ffffffffffff000daf671400000000
26140103801f12780a0535965b519029
24505400000001010101010101010101
010101010101bc1b5684500016303020
140035ae10000018000000fe004e3134
304247452d4c33310a20000000fe0043
4d4f0a202020202020202020000000fe
004e3134304247452d4c33310a200028

Extracted contents:
header:          00 ff ff ff ff ff ff 00
serial number:   0d af 67 14 00 00 00 00 26 14
version:         01 03
basic params:    80 1f 12 78 0a
chroma info:     05 35 96 5b 51 90 29 24 50 54
established:     00 00 00
standard:        01 01 01 01 01 01 01 01 01 01 01 01 01 01 01 01
descriptor 1:    bc 1b 56 84 50 00 16 30 30 20 14 00 35 ae 10 00 00 18
descriptor 2:    00 00 00 fe 00 4e 31 34 30 42 47 45 2d 4c 33 31 0a 20
descriptor 3:    00 00 00 fe 00 43 4d 4f 0a 20 20 20 20 20 20 20 20 20
descriptor 4:    00 00 00 fe 00 4e 31 34 30 42 47 45 2d 4c 33 31 0a 20
extensions:      00
checksum:        28

EDID version: 1.3
Manufacturer: CMO Model 1467 Serial Number --
Made in week 38 of 2010
Digital display
Maximum image size: 31 cm x 18 cm
Gamma: 2.20
RGB color display
First detailed timing is preferred timing
Display x,y Chromaticity:
  Red:   0.5859, 0.3554
  Green: 0.3173, 0.5634
  Blue:  0.1601, 0.1435
  White: 0.3134, 0.3291
Established timings supported:
Standard timings supported:
Detailed mode: Clock 71.000 MHz, 309 mm x 174 mm
               1366 1414 1446 1498 hborder 0
                768  769  773  790 vborder 0
               -hsync -vsync 
               VertFreq: 59 Hz, HorFreq: 47396 Hz
ASCII string: N140BGE-L31
ASCII string: CMO
ASCII string: N140BGE-L31
Checksum: 0x28 (valid)
EDID block does NOT conform to EDID 1.3!
	Missing name descriptor
	Missing monitor ranges
