
EDID (hex):
00ffffffffffff000472a808145d1015
331f0104083420782a9d81a259549e27
0e5054bfef80714f8140818081c08100
9500b300d1c02a4480a0703827403020
35000f282100001a000000fd00304b18
5611000a202020202020000000fc004b
41323430590a202020202020000000ff
00313135313035443134335730310070

Extracted contents:
header:          00 ff ff ff ff ff ff 00
serial number:   04 72 a8 08 14 5d 10 15 33 1f
version:         01 04
basic params:    08 34 20 78 2a
chroma info:     9d 81 a2 59 54 9e 27 0e 50 54
established:     bf ef 80
standard:        71 4f 81 40 81 80 81 c0 81 00 95 00 b3 00 d1 c0
descriptor 1:    2a 44 80 a0 70 38 27 40 30 20 35 00 0f 28 21 00 00 1a
descriptor 2:    00 00 00 fd 00 30 4b 18 56 11 00 0a 20 20 20 20 20 20
descriptor 3:    00 00 00 fc 00 4b 41 32 34 30 59 0a 20 20 20 20 20 20
descriptor 4:    00 00 00 ff 00 31 31 35 31 30 35 44 31 34 33 57 30 31
extensions:      00
checksum:        70

EDID version: 1.4
Manufacturer: ACR Model 8a8 Serial Number --
Made in week 51 of 2021
Analog display, Input voltage level: 0.7/0.3 V
Blank level equals black level
Sync: Separate 
Maximum image size: 52 cm x 32 cm
Gamma: 2.20
DPMS levels: Off
RGB color display
First detailed timing includes the native pixel format and preferred refresh rate
Display x,y Chromaticity:
  Red:   0.6347, 0.3486
  Green: 0.3310, 0.6181
  Blue:  0.1542, 0.0546
  White: 0.3125, 0.3291
Established timings supported:
  720x400@70Hz 9:5 HorFreq: 31469 Hz Clock: 28.320 MHz
  640x480@60Hz 4:3 HorFreq: 31469 Hz Clock: 25.175 MHz
  640x480@67Hz 4:3 HorFreq: 35000 Hz Clock: 30.240 MHz
  640x480@72Hz 4:3 HorFreq: 37900 Hz Clock: 31.500 MHz
  640x480@75Hz 4:3 HorFreq: 37500 Hz Clock: 31.500 MHz
  800x600@56Hz 4:3 HorFreq: 35200 Hz Clock: 36.000 MHz
  800x600@60Hz 4:3 HorFreq: 37900 Hz Clock: 40.000 MHz
  800x600@72Hz 4:3 HorFreq: 48100 Hz Clock: 50.000 MHz
  800x600@75Hz 4:3 HorFreq: 46900 Hz Clock: 49.500 MHz
  832x624@75Hz 4:3 HorFreq: 49726 Hz Clock: 57.284 MHz
  1024x768@60Hz 4:3 HorFreq: 48400 Hz Clock: 65.000 MHz
  1024x768@70Hz 4:3 HorFreq: 56500 Hz Clock: 75.000 MHz
  1024x768@75Hz 4:3 HorFreq: 60000 Hz Clock: 78.750 MHz
  1280x1024@75Hz 5:4 HorFreq: 80000 Hz Clock: 135.000 MHz
  1152x870@75Hz 192:145 HorFreq: 67500 Hz Clock: 108.000 MHz
Standard timings supported:
  1152x864@75Hz 4:3 HorFreq: 67500 Hz Clock: 108.000 MHz
  1280x960@60Hz 4:3 HorFreq: 60000 Hz Clock: 108.000 MHz
  1280x1024@60Hz 5:4 HorFreq: 64000 Hz Clock: 108.000 MHz
  1280x720@60Hz 16:9
  1280x800@60Hz 16:10
  1440x900@60Hz 16:10 HorFreq: 55500 Hz Clock: 88.750 MHz
  1680x1050@60Hz 16:10 HorFreq: 64700 Hz Clock: 119.000 MHz
  1920x1080@60Hz 16:9
Detailed mode: Clock 174.500 MHz, 527 mm x 296 mm
               1920 1968 2000 2080 hborder 0
               1080 1083 1088 1119 vborder 0
               +hsync -vsync 
               VertFreq: 74 Hz, HorFreq: 83894 Hz
Monitor ranges (GTF): 48-75Hz V, 24-86kHz H, max dotclock 170MHz
Monitor name: KA240Y
Serial number: --
Checksum: 0x70 (valid)
Warning: One or more of the timings is out of range of the Monitor Ranges:
  Vertical Freq: 56 - 75 Hz
  Horizontal Freq: 31469 - 83894 Hz
  Maximum Clock: 174.500 MHz
