
EDID (hex):
00ffffffffffff0009e55d0b00000000
19200104a51e137803a1d5985e599328
20505400000001010101010101010101
010101010101733f80dc70b041403020
36002ebc1000001a0000000000000000
00000000000000000000000000fd0028
3c4c4c10010a202020202020000000fe
004e5631343057554d2d4e34350a0092

edid-decode (hex):

00 ff ff ff ff ff ff 00 09 e5 5d 0b 00 00 00 00
19 20 01 04 a5 1e 13 78 03 a1 d5 98 5e 59 93 28
20 50 54 00 00 00 01 01 01 01 01 01 01 01 01 01
01 01 01 01 01 01 73 3f 80 dc 70 b0 41 40 30 20
36 00 2e bc 10 00 00 1a 00 00 00 00 00 00 00 00
00 00 00 00 00 00 00 00 00 00 00 00 00 fd 00 28
3c 4c 4c 10 01 0a 20 20 20 20 20 20 00 00 00 fe
00 4e 56 31 34 30 57 55 4d 2d 4e 34 35 0a 00 92

----------------

Block 0, Base EDID:
  EDID Structure Version & Revision: 1.4
  Vendor & Product Identification:
    Manufacturer: BOE
    Model: 2909
    Made in: week 25 of 2022
  Basic Display Parameters & Features:
    Digital display
    Bits per primary color channel: 8
    DisplayPort interface
    Maximum image size: 30 cm x 19 cm
    Gamma: 2.20
    Supported color formats: RGB 4:4:4
    First detailed timing includes the native pixel format and preferred refresh rate
    Display is continuous frequency
  Color Characteristics:
    Red  : 0.5957, 0.3691
    Green: 0.3476, 0.5751
    Blue : 0.1591, 0.1259
    White: 0.3134, 0.3291
  Established Timings I & II: none
  Standard Timings: none
  Detailed Timing Descriptors:
    DTD 1:  1920x1200   60.001478 Hz  16:10    75.902 kHz    162.430000 MHz (302 mm x 188 mm)
                 Hfront   48 Hsync  32 Hback  140 Hpol P
                 Vfront    3 Vsync   6 Vback   56 Vpol N
    Empty Descriptor
    Display Range Limits:
      Monitor ranges (Bare Limits): 40-60 Hz V, 76-76 kHz H, max dotclock 160 MHz
    Alphanumeric Data String: 'NV140WUM-N45'
Checksum: 0x92
