edid-decode (hex):

00 ff ff ff ff ff ff 00 30 e4 20 02 00 00 00 00
00 13 01 04 b0 23 13 78 0a bc 25 af 4e 34 b7 25
0b 50 54 00 00 00 01 01 01 01 01 01 01 01 01 01
01 01 01 01 01 01 2e 36 80 a0 70 38 1f 40 30 20
35 00 5e be 10 00 00 19 58 2b 80 a0 70 38 1f 40
30 20 35 00 5e be 10 00 00 19 00 00 00 00 00 00
00 00 00 00 00 00 00 00 00 00 00 00 26 2d 80 a0
70 38 1f 40 30 20 35 00 5e be 10 00 00 19 00 96

----------------

Block 0, Base EDID:
  EDID Structure Version & Revision: 1.4
  Vendor & Product Identification:
    Manufacturer: LGD
    Model: 544
    Made in: 2009
  Basic Display Parameters & Features:
    Digital display
    Bits per primary color channel: 10
    Digital interface is not defined
    Maximum image size: 35 cm x 19 cm
    Gamma: 2.20
    Supported color formats: RGB 4:4:4, YCrCb 4:4:4
    First detailed timing includes the native pixel format and preferred refresh rate
  Color Characteristics:
    Red  : 0.6855, 0.3076
    Green: 0.2060, 0.7148
    Blue : 0.1445, 0.0449
    White: 0.3134, 0.3291
  Established Timings I & II: none
  Standard Timings: none
  Detailed Timing Descriptors:
    DTD 1:  1920x1080   60.020 Hz  16:9    66.683 kHz 138.700 MHz (350 mm x 190 mm)
                 Hfront   48 Hsync  32 Hback  80 Hpol N
                 Vfront    3 Vsync   5 Vback  23 Vpol N
    DTD 2:  1920x1080   48.016 Hz  16:9    53.346 kHz 110.960 MHz (350 mm x 190 mm)
                 Hfront   48 Hsync  32 Hback  80 Hpol N
                 Vfront    3 Vsync   5 Vback  23 Vpol N
    Empty Descriptor
    DTD 3:  1920x1080   50.016 Hz  16:9    55.567 kHz 115.580 MHz (350 mm x 190 mm)
                 Hfront   48 Hsync  32 Hback  80 Hpol N
                 Vfront    3 Vsync   5 Vback  23 Vpol N
Checksum: 0x96
