
EDID (hex):
00ffffffffffff0006af511800000000
010e0102801e17780a12e59152528927
24505400000001010101010101010101
01010101010164190040410026301888
360030e4100000180000000f00067708
ff010f052e2dff053f01000000fe0041
554f0a202020202020202020000000fe
00423135305847303156380a20200083

Extracted contents:
header:          00 ff ff ff ff ff ff 00
serial number:   06 af 51 18 00 00 00 00 01 0e
version:         01 02
basic params:    80 1e 17 78 0a
chroma info:     12 e5 91 52 52 89 27 24 50 54
established:     00 00 00
standard:        01 01 01 01 01 01 01 01 01 01 01 01 01 01 01 01
descriptor 1:    64 19 00 40 41 00 26 30 18 88 36 00 30 e4 10 00 00 18
descriptor 2:    00 00 00 0f 00 06 77 08 ff 01 0f 05 2e 2d ff 05 3f 01
descriptor 3:    00 00 00 fe 00 41 55 4f 0a 20 20 20 20 20 20 20 20 20
descriptor 4:    00 00 00 fe 00 42 31 35 30 58 47 30 31 56 38 0a 20 20
extensions:      00
checksum:        83

EDID version: 1.2
Manufacturer: AUO Model 1851 Serial Number --
Digital display
Maximum image size: 30 cm x 23 cm
Gamma: 2.20
RGB color display
First detailed timing is preferred timing
Display x,y Chromaticity:
  Red:   0.5664, 0.3212
  Green: 0.3203, 0.5371
  Blue:  0.1552, 0.1425
  White: 0.3134, 0.3291
Established timings supported:
Standard timings supported:
Detailed mode: Clock 65.000 MHz, 304 mm x 228 mm
               1024 1048 1184 1344 hborder 0
                768  771  777  806 vborder 0
               -hsync -vsync 
               VertFreq: 60 Hz, HorFreq: 48363 Hz
Manufacturer-specified data, tag 15
ASCII string: AUO
ASCII string: B150XG01V8
Checksum: 0x83 (valid)
EDID block does not conform at all!
	Bad year of manufacture
