
EDID (hex):
00ffffffffffff004ca34a4100000000
00160103801d1178eab6959358569229
1f505400000001010101010101010101
0101010101013b1b5674500010303020
250025a5100000190000000f00000000
000000000025d9066a00000000fe0053
414d53554e470a204ca34154000000fe
004c544e313333415432384c303100ba

Extracted contents:
header:          00 ff ff ff ff ff ff 00
serial number:   4c a3 4a 41 00 00 00 00 00 16
version:         01 03
basic params:    80 1d 11 78 ea
chroma info:     b6 95 93 58 56 92 29 1f 50 54
established:     00 00 00
standard:        01 01 01 01 01 01 01 01 01 01 01 01 01 01 01 01
descriptor 1:    3b 1b 56 74 50 00 10 30 30 20 25 00 25 a5 10 00 00 19
descriptor 2:    00 00 00 0f 00 00 00 00 00 00 00 00 00 25 d9 06 6a 00
descriptor 3:    00 00 00 fe 00 53 41 4d 53 55 4e 47 0a 20 4c a3 41 54
descriptor 4:    00 00 00 fe 00 4c 54 4e 31 33 33 41 54 32 38 4c 30 31
extensions:      00
checksum:        ba

EDID version: 1.3
Manufacturer: SEC Model 414a Serial Number --
Made in year 2012
Digital display
Maximum image size: 29 cm x 17 cm
Gamma: 2.20
DPMS levels: Standby Suspend Off
RGB color display
First detailed timing is preferred timing
Display x,y Chromaticity:
  Red:   0.5761, 0.3466
  Green: 0.3369, 0.5722
  Blue:  0.1621, 0.1220
  White: 0.3134, 0.3291
Established timings supported:
Standard timings supported:
Detailed mode: Clock 69.710 MHz, 293 mm x 165 mm
               1366 1414 1446 1482 hborder 0
                768  770  775  784 vborder 0
               -hsync -vsync 
               VertFreq: 59 Hz, HorFreq: 47037 Hz
Manufacturer-specified data, tag 15
ASCII string: SAMSUNG
ASCII string: LTN133AT28L01
Checksum: 0xba (valid)
EDID block does NOT conform to EDID 1.3!
	Missing name descriptor
	Missing monitor ranges
	Detailed block string not properly terminated
