edid-decode (hex):

00 ff ff ff ff ff ff 00 06 af ed 61 00 00 00 00
00 1c 01 04 95 22 13 78 03 c0 d5 8f 56 58 93 29
20 50 54 00 00 00 01 01 01 01 01 01 01 01 01 01
01 01 01 01 01 01 14 37 80 b4 70 38 26 40 6c 30
aa 00 58 c2 10 00 00 18 b8 24 80 b4 70 38 26 40
6c 30 aa 00 58 c2 10 00 00 18 00 00 00 00 00 00
00 00 00 00 00 00 00 00 00 00 00 00 00 00 00 02
00 10 48 ff 0f 3c 6e 55 13 22 6e 20 20 20 00 16

----------------

Block 0, Base EDID:
  EDID Structure Version & Revision: 1.4
  Vendor & Product Identification:
    Manufacturer: AUO
    Model: 25069
    Made in: 2018
  Basic Display Parameters & Features:
    Digital display
    Bits per primary color channel: 6
    DisplayPort interface
    Maximum image size: 34 cm x 19 cm
    Gamma: 2.20
    Supported color formats: RGB 4:4:4
    First detailed timing includes the native pixel format and preferred refresh rate
    Display is continuous frequency
  Color Characteristics:
    Red  : 0.5615, 0.3359
    Green: 0.3437, 0.5742
    Blue : 0.1630, 0.1259
    White: 0.3134, 0.3291
  Established Timings I & II: none
  Standard Timings: none
  Detailed Timing Descriptors:
    DTD 1:  1920x1080   60.056 Hz  16:9    67.143 kHz 141.000 MHz (344 mm x 194 mm)
                 Hfront  108 Hsync  48 Hback  24 Hpol N
                 Vfront   10 Vsync  10 Vback  18 Vpol N
    DTD 2:  1920x1080   40.037 Hz  16:9    44.762 kHz  94.000 MHz (344 mm x 194 mm)
                 Hfront  108 Hsync  48 Hback  24 Hpol N
                 Vfront   10 Vsync  10 Vback  18 Vpol N
    Empty Descriptor
    Manufacturer-Specified Display Descriptor (0x02): 00 02 00 10 48 ff 0f 3c 6e 55 13 22 6e 20 20 20 '....H..<nU."n   '
Checksum: 0x16
