edid-decode (hex):

00 ff ff ff ff ff ff 00 06 af 99 5a 00 00 00 00
00 1f 01 04 a5 1e 13 78 03 ae ac 93 58 59 91 28
1d 50 54 00 00 00 01 01 01 01 01 01 01 01 01 01
01 01 01 01 01 01 8a 3e 80 b8 70 b0 44 40 10 10
3e 00 2d bc 10 00 00 18 b1 29 80 b8 70 b0 44 40
10 10 3e 00 2d bc 10 00 00 18 00 00 00 00 00 00
00 00 00 00 00 00 00 00 00 00 00 00 00 00 00 02
00 10 48 ff 0f 3c 7d 11 20 1f 7d 20 20 20 00 3b

----------------

Block 0, Base EDID:
  EDID Structure Version & Revision: 1.4
  Vendor & Product Identification:
    Manufacturer: AUO
    Model: 23193
    Made in: 2021
  Basic Display Parameters & Features:
    Digital display
    Bits per primary color channel: 8
    DisplayPort interface
    Maximum image size: 30 cm x 19 cm
    Gamma: 2.20
    Supported color formats: RGB 4:4:4
    First detailed timing includes the native pixel format and preferred refresh rate
    Display is continuous frequency
  Color Characteristics:
    Red  : 0.5761, 0.3457
    Green: 0.3505, 0.5683
    Blue : 0.1582, 0.1152
    White: 0.3154, 0.3281
  Established Timings I & II: none
  Standard Timings: none
  Detailed Timing Descriptors:
    DTD 1:  1920x1200   60.010375 Hz  16:10    76.093 kHz    160.100000 MHz (301 mm x 188 mm)
                 Hfront   16 Hsync  16 Hback  152 Hpol N
                 Vfront    3 Vsync  14 Vback   51 Vpol N
    DTD 2:  1920x1200   40.005667 Hz  16:10    50.727 kHz    106.730000 MHz (301 mm x 188 mm)
                 Hfront   16 Hsync  16 Hback  152 Hpol N
                 Vfront    3 Vsync  14 Vback   51 Vpol N
    Empty Descriptor
    Manufacturer-Specified Display Descriptor (0x02): 00 02 00 10 48 ff 0f 3c 7d 11 20 1f 7d 20 20 20 '....H..<}. .}   '
Checksum: 0x3b

----------------

Warnings:

Block 0, Base EDID:
  Missing Display Product Name.

Failures:

Block 0, Base EDID:
  Empty Descriptor: Use Dummy Descriptor instead of all zeroes.
  Missing Display Range Limits Descriptor.

EDID conformity: FAIL
