edid-decode (hex):

00 ff ff ff ff ff ff 00 10 ac 3c a0 49 4c 50 30
15 14 01 03 0e 29 1a 78 ee ee 95 a3 54 4c 99 26
0f 50 54 bf ef 80 95 00 71 4f 81 80 95 0f 81 00
01 01 01 01 01 01 9a 29 a0 d0 51 84 22 30 50 98
36 00 98 ff 10 00 00 1c 00 00 00 ff 00 33 34 39
31 58 30 35 47 30 50 4c 49 0a 00 00 00 fc 00 44
45 4c 4c 20 31 39 30 39 57 0a 20 20 00 00 00 fd
00 38 4b 1e 53 0e 00 0a 20 20 20 20 20 20 00 e6

00 ff ff ff ff ff ff 00 10 ac 3c a0 49 4c 50 30
15 14 01 03 0e 29 1a 78 ee ee 95 a3 54 4c 99 26
0f 50 54 bf ef 80 95 00 71 4f 81 80 95 0f 81 00
01 01 01 01 01 01 9a 29 a0 d0 51 84 22 30 50 98
36 00 98 ff 10 00 00 1c 00 00 00 ff 00 33 34 39
31 58 30 35 47 30 50 4c 49 0a 00 00 00 fc 00 44
45 4c 4c 20 31 39 30 39 57 0a 20 20 00 00 00 fd
00 38 4b 1e 53 0e 00 0a 20 20 20 20 20 20 00 e6

----------------

Block 0, Base EDID:
  EDID Structure Version & Revision: 1.3
  Vendor & Product Identification:
    Manufacturer: DEL
    Model: 41020
    Serial Number: ...
    Made in: week 21 of 2010
  Basic Display Parameters & Features:
    Analog display
    Signal Level Standard: 0.700 : 0.300 : 1.000 V p-p
    Blank level equals black level
    Sync: Separate Composite SyncOnGreen
    Maximum image size: 41 cm x 26 cm
    Gamma: 2.20
    DPMS levels: Standby Suspend Off
    RGB color display
    Default (sRGB) color space is primary color space
    First detailed timing is the preferred timing
  Color Characteristics:
    Red  : 0.6396, 0.3300
    Green: 0.2998, 0.5996
    Blue : 0.1503, 0.0595
    White: 0.3134, 0.3291
  Established Timings I & II:
    IBM     :   720x400    70.081663 Hz   9:5     31.467 kHz     28.320000 MHz
    DMT 0x04:   640x480    59.940476 Hz   4:3     31.469 kHz     25.175000 MHz
    Apple   :   640x480    66.666667 Hz   4:3     35.000 kHz     30.240000 MHz
    DMT 0x05:   640x480    72.808802 Hz   4:3     37.861 kHz     31.500000 MHz
    DMT 0x06:   640x480    75.000000 Hz   4:3     37.500 kHz     31.500000 MHz
    DMT 0x08:   800x600    56.250000 Hz   4:3     35.156 kHz     36.000000 MHz
    DMT 0x09:   800x600    60.316541 Hz   4:3     37.879 kHz     40.000000 MHz
    DMT 0x0a:   800x600    72.187572 Hz   4:3     48.077 kHz     50.000000 MHz
    DMT 0x0b:   800x600    75.000000 Hz   4:3     46.875 kHz     49.500000 MHz
    Apple   :   832x624    74.551266 Hz   4:3     49.726 kHz     57.284000 MHz
    DMT 0x10:  1024x768    60.003840 Hz   4:3     48.363 kHz     65.000000 MHz
    DMT 0x11:  1024x768    70.069359 Hz   4:3     56.476 kHz     75.000000 MHz
    DMT 0x12:  1024x768    75.028582 Hz   4:3     60.023 kHz     78.750000 MHz
    DMT 0x24:  1280x1024   75.024675 Hz   5:4     79.976 kHz    135.000000 MHz
    Apple   :  1152x870    75.061550 Hz 192:145   68.681 kHz    100.000000 MHz
  Standard Timings:
    DMT 0x2f:  1440x900    59.887445 Hz  16:10    55.935 kHz    106.500000 MHz
    DMT 0x15:  1152x864    75.000000 Hz   4:3     67.500 kHz    108.000000 MHz
    DMT 0x23:  1280x1024   60.019740 Hz   5:4     63.981 kHz    108.000000 MHz
    DMT 0x30:  1440x900    74.984427 Hz  16:10    70.635 kHz    136.750000 MHz
    DMT 0x1c:  1280x800    59.810326 Hz  16:10    49.702 kHz     83.500000 MHz
  Detailed Timing Descriptors:
    DTD 1:  1440x900    59.887445 Hz  16:10    55.935 kHz    106.500000 MHz (408 mm x 255 mm)
                 Hfront   80 Hsync 152 Hback  232 Hpol N
                 Vfront    3 Vsync   6 Vback   25 Vpol P
    Display Product Serial Number: ...
    Display Product Name: 'DELL 1909W'
    Display Range Limits:
      Monitor ranges (GTF): 56-75 Hz V, 30-83 kHz H, max dotclock 140 MHz
Checksum: 0xe6

----------------

Block 1, Unknown EDID Extension Block 0x00:
  00 ff ff ff ff ff ff 00 10 ac 3c a0 49 4c 50 30 '..........<.ILP0'
  15 14 01 03 0e 29 1a 78 ee ee 95 a3 54 4c 99 26 '.....).x....TL.&'
  0f 50 54 bf ef 80 95 00 71 4f 81 80 95 0f 81 00 '.PT.....qO......'
  01 01 01 01 01 01 9a 29 a0 d0 51 84 22 30 50 98 '.......)..Q."0P.'
  36 00 98 ff 10 00 00 1c 00 00 00 ff 00 33 34 39 '6............349'
  31 58 30 35 47 30 50 4c 49 0a 00 00 00 fc 00 44 '1X05G0PLI......D'
  45 4c 4c 20 31 39 30 39 57 0a 20 20 00 00 00 fd 'ELL 1909W.  ....'
  00 38 4b 1e 53 0e 00 0a 20 20 20 20 20 20 00 e6 '.8K.S...      ..'
Checksum: 0xe6

----------------

Failures:

Block 0, Base EDID:
  Basic Display Parameters & Features: sRGB is signaled, but the chromaticities do not match.
Block 1, Base EDID:
  Unknown Extension Block.
EDID:
  Base EDID: EDID specified 0 extension block(s), but found 1 extension block(s).

EDID conformity: FAIL
