
EDID (hex):
00ffffffffffff001ab3df0701000000
2e130103682c19822ad425a455499b27
135054a54a0081c00101010101010101
0101010101012f2640a060841a303020
3500baf91000001a000000fc004c3230
542d312045434f0a2020000000fd0038
4c1e5210000a202020202020000000ff
00595633483031353036360a202000f0

Extracted contents:
header:          00 ff ff ff ff ff ff 00
serial number:   1a b3 df 07 01 00 00 00 2e 13
version:         01 03
basic params:    68 2c 19 82 2a
chroma info:     d4 25 a4 55 49 9b 27 13 50 54
established:     a5 4a 00
standard:        81 c0 01 01 01 01 01 01 01 01 01 01 01 01 01 01
descriptor 1:    2f 26 40 a0 60 84 1a 30 30 20 35 00 ba f9 10 00 00 1a
descriptor 2:    00 00 00 fc 00 4c 32 30 54 2d 31 20 45 43 4f 0a 20 20
descriptor 3:    00 00 00 fd 00 38 4c 1e 52 10 00 0a 20 20 20 20 20 20
descriptor 4:    00 00 00 ff 00 59 56 33 48 30 31 35 30 36 36 0a 20 20
extensions:      00
checksum:        f0

EDID version: 1.3
Manufacturer: FUS Model 7df Serial Number --
Made in week 46 of 2009
Analog display, Input voltage level: 0.7/0.7 V
Sync: Separate 
Maximum image size: 44 cm x 25 cm
Gamma: 2.30
DPMS levels: Off
RGB color display
First detailed timing is preferred timing
Display x,y Chromaticity:
  Red:   0.6435, 0.3330
  Green: 0.2861, 0.6054
  Blue:  0.1523, 0.0761
  White: 0.3134, 0.3291
Established timings supported:
  720x400@70Hz 9:5 HorFreq: 31469 Hz Clock: 28.320 MHz
  640x480@60Hz 4:3 HorFreq: 31469 Hz Clock: 25.175 MHz
  640x480@75Hz 4:3 HorFreq: 37500 Hz Clock: 31.500 MHz
  800x600@60Hz 4:3 HorFreq: 37900 Hz Clock: 40.000 MHz
  800x600@75Hz 4:3 HorFreq: 46900 Hz Clock: 49.500 MHz
  1024x768@60Hz 4:3 HorFreq: 48400 Hz Clock: 65.000 MHz
  1024x768@75Hz 4:3 HorFreq: 60000 Hz Clock: 78.750 MHz
Standard timings supported:
  1280x720@60Hz 16:9
Detailed mode: Clock 97.750 MHz, 442 mm x 249 mm
               1600 1648 1680 1760 hborder 0
                900  903  908  926 vborder 0
               +hsync -vsync 
               VertFreq: 59 Hz, HorFreq: 55539 Hz
Monitor name: L20T-1 ECO
Monitor ranges (GTF): 56-76Hz V, 30-82kHz H, max dotclock 160MHz
Serial number: --
Checksum: 0xf0 (valid)


