edid-decode (hex):

00 ff ff ff ff ff ff 00 0d ae c0 15 00 00 00 00
04 17 01 04 95 22 13 78 02 46 35 9e 57 57 94 27
14 50 54 00 00 00 01 01 01 01 01 01 01 01 01 01
01 01 01 01 01 01 38 3b 80 2c 71 38 3a 40 5a 3c
69 00 58 c2 10 00 00 18 00 00 00 fe 00 4e 31 35
36 48 47 45 2d 45 42 31 0a 20 00 00 00 fe 00 43
4d 4e 0a 20 20 20 20 20 20 20 20 20 00 00 00 fe
00 4e 31 35 36 48 47 45 2d 45 42 31 0a 20 00 a9

----------------

Block 0, Base EDID:
  EDID Structure Version & Revision: 1.4
  Vendor & Product Identification:
    Manufacturer: CMN
    Model: 5568
    Made in: week 4 of 2013
  Basic Display Parameters & Features:
    Digital display
    Bits per primary color channel: 6
    DisplayPort interface
    Maximum image size: 34 cm x 19 cm
    Gamma: 2.20
    Supported color formats: RGB 4:4:4
    First detailed timing includes the native pixel format and preferred refresh rate
  Color Characteristics:
    Red  : 0.6181, 0.3398
    Green: 0.3408, 0.5800
    Blue : 0.1523, 0.0810
    White: 0.3134, 0.3291
  Established Timings I & II: none
  Standard Timings: none
  Detailed Timing Descriptors:
    DTD 1:  1920x1080   60.007 Hz  16:9    68.288 kHz 151.600 MHz (344 mm x 194 mm)
                 Hfront   90 Hsync  60 Hback 150 Hpol N
                 Vfront    6 Vsync   9 Vback  43 Vpol N
    Alphanumeric Data String: 'N156HGE-EB1'
    Alphanumeric Data String: 'CMN'
    Alphanumeric Data String: 'N156HGE-EB1'
Checksum: 0xa9

----------------

Failures:

Block 0, Base EDID:
  Missing Display Product Name.

EDID conformity: FAIL
