
EDID (hex):
00ffffffffffff00410cd7082a1a0000
21180104a53e22783a5525a1574fa028
0f5054bd4b00d1c081808140950f9500
b30081c0010150d000a0f0703e803058
8a006d552100001a023a801871382d40
582c45006d552100001e000000fc0050
68696c697073203238385036000000fd
0017501ea03c010a20202020202001f3
020323f44b010203040590111213141f
23090707830100006a030c0030000078
200000023a80d072382d40102c96806d
5521000018023a801871382d40582c96
006d552100001804740030f2705a80b0
588a006d552100001a011d00bc52d01e
20b82855406d552100001e0000000000
00000000000000000000000000000080

Extracted contents:
header:          00 ff ff ff ff ff ff 00
serial number:   41 0c d7 08 2a 1a 00 00 21 18
version:         01 04
basic params:    a5 3e 22 78 3a
chroma info:     55 25 a1 57 4f a0 28 0f 50 54
established:     bd 4b 00
standard:        d1 c0 81 80 81 40 95 0f 95 00 b3 00 81 c0 01 01
descriptor 1:    50 d0 00 a0 f0 70 3e 80 30 58 8a 00 6d 55 21 00 00 1a
descriptor 2:    02 3a 80 18 71 38 2d 40 58 2c 45 00 6d 55 21 00 00 1e
descriptor 3:    00 00 00 fc 00 50 68 69 6c 69 70 73 20 32 38 38 50 36
descriptor 4:    00 00 00 fd 00 17 50 1e a0 3c 01 0a 20 20 20 20 20 20
extensions:      01
checksum:        f3

EDID version: 1.4
Manufacturer: PHL Model 8d7 Serial Number --
Made in week 33 of 2014
Digital display
8 bits per primary color channel
DisplayPort interface
Maximum image size: 62 cm x 34 cm
Gamma: 2.20
DPMS levels: Off
Supported color formats: RGB 4:4:4, YCrCb 4:4:4, YCrCb 4:2:2
First detailed timing includes the native pixel format and preferred refresh rate
Display x,y Chromaticity:
  Red:   0.6298, 0.3408
  Green: 0.3095, 0.6259
  Blue:  0.1562, 0.0605
  White: 0.3134, 0.3291
Established timings supported:
  720x400@70Hz 9:5 HorFreq: 31469 Hz Clock: 28.320 MHz
  640x480@60Hz 4:3 HorFreq: 31469 Hz Clock: 25.175 MHz
  640x480@67Hz 4:3 HorFreq: 35000 Hz Clock: 30.240 MHz
  640x480@72Hz 4:3 HorFreq: 37900 Hz Clock: 31.500 MHz
  640x480@75Hz 4:3 HorFreq: 37500 Hz Clock: 31.500 MHz
  800x600@60Hz 4:3 HorFreq: 37900 Hz Clock: 40.000 MHz
  800x600@75Hz 4:3 HorFreq: 46900 Hz Clock: 49.500 MHz
  1024x768@60Hz 4:3 HorFreq: 48400 Hz Clock: 65.000 MHz
  1024x768@75Hz 4:3 HorFreq: 60000 Hz Clock: 78.750 MHz
  1280x1024@75Hz 5:4 HorFreq: 80000 Hz Clock: 135.000 MHz
Standard timings supported:
  1920x1080@60Hz 16:9
  1280x1024@60Hz 5:4 HorFreq: 64000 Hz Clock: 108.000 MHz
  1280x960@60Hz 4:3 HorFreq: 60000 Hz Clock: 108.000 MHz
  1440x900@75Hz 16:10 HorFreq: 82300 Hz Clock: 156.000 MHz
  1440x900@60Hz 16:10 HorFreq: 55500 Hz Clock: 88.750 MHz
  1680x1050@60Hz 16:10 HorFreq: 64700 Hz Clock: 119.000 MHz
  1280x720@60Hz 16:9
Detailed mode: Clock 533.280 MHz, 621 mm x 341 mm
               3840 3888 3976 4000 hborder 0
               2160 2168 2178 2222 vborder 0
               +hsync -vsync 
               VertFreq: 60 Hz, HorFreq: 133320 Hz
Detailed mode: Clock 148.500 MHz, 621 mm x 341 mm
               1920 2008 2052 2200 hborder 0
               1080 1084 1089 1125 vborder 0
               +hsync +vsync 
               VertFreq: 60 Hz, HorFreq: 67500 Hz
Monitor ranges (bare limits): 23-80Hz V, 30-160kHz H, max dotclock 600MHz
Has 1 extension blocks
Checksum: 0xf3 (valid)

CTA extension block
Extension version: 3
31 bytes of CTA data
  Video data block
    VIC   1 640x480@60Hz 4:3  HorFreq: 31469 Hz Clock: 25.175 MHz
    VIC   2 720x480@60Hz 4:3  HorFreq: 31469 Hz Clock: 27.000 MHz
    VIC   3 720x480@60Hz 16:9  HorFreq: 31469 Hz Clock: 27.000 MHz
    VIC   4 1280x720@60Hz 16:9  HorFreq: 45000 Hz Clock: 74.250 MHz
    VIC   5 1920x1080i@60Hz 16:9  HorFreq: 33750 Hz Clock: 74.250 MHz
    VIC  16 1920x1080@60Hz 16:9 (native) HorFreq: 67500 Hz Clock: 148.500 MHz
    VIC  17 720x576@50Hz 4:3  HorFreq: 31250 Hz Clock: 27.000 MHz
    VIC  18 720x576@50Hz 16:9  HorFreq: 31250 Hz Clock: 27.000 MHz
    VIC  19 1280x720@50Hz 16:9  HorFreq: 37500 Hz Clock: 74.250 MHz
    VIC  20 1920x1080i@50Hz 16:9  HorFreq: 28125 Hz Clock: 74.250 MHz
    VIC  31 1920x1080@50Hz 16:9  HorFreq: 56250 Hz Clock: 148.500 MHz
  Audio data block
    Linear PCM, max channels 2
      Supported sample rates (kHz): 48 44.1 32
      Supported sample sizes (bits): 24 20 16
  Speaker allocation data block
    Speaker map:
      FL/FR - Front Left/Right
  Vendor-specific data block, OUI 000c03 (HDMI)
    Source physical address 3.0.0.0
    Maximum TMDS clock: 600MHz
    Extended HDMI video details:
Underscans PC formats by default
Basic audio support
Supports YCbCr 4:4:4
Supports YCbCr 4:2:2
4 native detailed modes
Detailed mode: Clock 148.500 MHz, 621 mm x 341 mm
               1920 2448 2492 2640 hborder 0
               1080 1089 1095 1125 vborder 0
               -hsync -vsync 
               VertFreq: 50 Hz, HorFreq: 56250 Hz
Detailed mode: Clock 148.500 MHz, 621 mm x 341 mm
               1920 2008 2052 2200 hborder 0
               1080 1089 1095 1125 vborder 0
               -hsync -vsync 
               VertFreq: 60 Hz, HorFreq: 67500 Hz
Detailed mode: Clock 297.000 MHz, 621 mm x 341 mm
               3840 4016 4104 4400 hborder 0
               2160 2168 2178 2250 vborder 0
               +hsync -vsync 
               VertFreq: 30 Hz, HorFreq: 67500 Hz
Detailed mode: Clock 74.250 MHz, 621 mm x 341 mm
               1280 1720 1760 1980 hborder 0
                720  725  730  750 vborder 0
               +hsync +vsync 
               VertFreq: 50 Hz, HorFreq: 37500 Hz
Checksum: 0x80 (valid)

EDID block does NOT conform to EDID 1.4!
	HDMI VSDB Max TMDS rate is > 340
	Name descriptor not terminated with a newline
Warning: One or more of the timings is out of range of the Monitor Ranges:
  Vertical Freq: 30 - 75 Hz
  Horizontal Freq: 28125 - 133320 Hz
  Maximum Clock: 533.280 MHz


