
EDID (hex):
00ffffffffffff0004723403a57d1090
011d0103802b1878ce94a5a55551a027
0f5054bfee0081c08100010101010101
010101010101662156aa51001e30468f
3300b2ec1000001e000000fd00384c1f
530e000a202020202020000000fc0056
32303648514c0a2020202020000000ff
004c59364141303136383541390a01d0
020318b1440102030465030c00100068
1a00000101304be6662156aa51001e30
468f3300b2ec1000001a000000000000
00000000000000000000000000000000
00000000000000000000000000000000
00000000000000000000000000000000
00000000000000000000000000000000
00000000000000000000000000000085

Extracted contents:
header:          00 ff ff ff ff ff ff 00
serial number:   04 72 34 03 a5 7d 10 90 01 1d
version:         01 03
basic params:    80 2b 18 78 ce
chroma info:     94 a5 a5 55 51 a0 27 0f 50 54
established:     bf ee 00
standard:        81 c0 81 00 01 01 01 01 01 01 01 01 01 01 01 01
descriptor 1:    66 21 56 aa 51 00 1e 30 46 8f 33 00 b2 ec 10 00 00 1e
descriptor 2:    00 00 00 fd 00 38 4c 1f 53 0e 00 0a 20 20 20 20 20 20
descriptor 3:    00 00 00 fc 00 56 32 30 36 48 51 4c 0a 20 20 20 20 20
descriptor 4:    00 00 00 ff 00 4c 59 36 41 41 30 31 36 38 35 41 39 0a
extensions:      01
checksum:        d0

EDID version: 1.3
Manufacturer: ACR Model 334 Serial Number --
Made in week 1 of 2019
Digital display
Maximum image size: 43 cm x 24 cm
Gamma: 2.20
DPMS levels: Standby Suspend
RGB color display
Default (sRGB) color space is primary color space
First detailed timing is preferred timing
Display x,y Chromaticity:
  Red:   0.6464, 0.3330
  Green: 0.3173, 0.6250
  Blue:  0.1542, 0.0605
  White: 0.3134, 0.3291
Established timings supported:
  720x400@70Hz 9:5 HorFreq: 31469 Hz Clock: 28.320 MHz
  640x480@60Hz 4:3 HorFreq: 31469 Hz Clock: 25.175 MHz
  640x480@67Hz 4:3 HorFreq: 35000 Hz Clock: 30.240 MHz
  640x480@72Hz 4:3 HorFreq: 37900 Hz Clock: 31.500 MHz
  640x480@75Hz 4:3 HorFreq: 37500 Hz Clock: 31.500 MHz
  800x600@56Hz 4:3 HorFreq: 35200 Hz Clock: 36.000 MHz
  800x600@60Hz 4:3 HorFreq: 37900 Hz Clock: 40.000 MHz
  800x600@72Hz 4:3 HorFreq: 48100 Hz Clock: 50.000 MHz
  800x600@75Hz 4:3 HorFreq: 46900 Hz Clock: 49.500 MHz
  832x624@75Hz 4:3 HorFreq: 49726 Hz Clock: 57.284 MHz
  1024x768@60Hz 4:3 HorFreq: 48400 Hz Clock: 65.000 MHz
  1024x768@70Hz 4:3 HorFreq: 56500 Hz Clock: 75.000 MHz
  1024x768@75Hz 4:3 HorFreq: 60000 Hz Clock: 78.750 MHz
Standard timings supported:
  1280x720@60Hz 16:9
  1280x800@60Hz 16:10
Detailed mode: Clock 85.500 MHz, 434 mm x 236 mm
               1366 1436 1579 1792 hborder 0
                768  771  774  798 vborder 0
               +hsync +vsync 
               VertFreq: 59 Hz, HorFreq: 47712 Hz
Monitor ranges (GTF): 56-76Hz V, 31-83kHz H, max dotclock 140MHz
Monitor name: V206HQL
Serial number: --
Has 1 extension blocks
Checksum: 0xd0 (valid)

CTA extension block
Extension version: 3
20 bytes of CTA data
  Video data block
    VIC   1 640x480@60Hz 4:3  HorFreq: 31469 Hz Clock: 25.175 MHz
    VIC   2 720x480@60Hz 4:3  HorFreq: 31469 Hz Clock: 27.000 MHz
    VIC   3 720x480@60Hz 16:9  HorFreq: 31469 Hz Clock: 27.000 MHz
    VIC   4 1280x720@60Hz 16:9  HorFreq: 45000 Hz Clock: 74.250 MHz
  Vendor-specific data block, OUI 000c03 (HDMI)
    Source physical address 1.0.0.0
  Vendor-specific data block, OUI 00001a
Underscans PC formats by default
Supports YCbCr 4:4:4
Supports YCbCr 4:2:2
1 native detailed modes
Detailed mode: Clock 85.500 MHz, 434 mm x 236 mm
               1366 1436 1579 1792 hborder 0
                768  771  774  798 vborder 0
               +hsync -vsync 
               VertFreq: 59 Hz, HorFreq: 47712 Hz
Checksum: 0x85 (valid)

EDID block does NOT conform to EDID 1.3!
	sRGB is signaled, but the chromaticities do not match
EDID block does not conform at all!
	Both the serial number and the serial string are set


