
EDID (hex):
00ffffffffffff00410c8208c1250000
21150103682f1e782a78f1a655489b26
125054a54b0081809500b300950f0101
01010101010121399030621a274068b0
3600da281100001c000000ff00415534
31313333303039363635000000fd0038
4c1e5311000a202020202020000000fc
005068696c69707320323230560a00b5

Extracted contents:
header:          00 ff ff ff ff ff ff 00
serial number:   41 0c 82 08 c1 25 00 00 21 15
version:         01 03
basic params:    68 2f 1e 78 2a
chroma info:     78 f1 a6 55 48 9b 26 12 50 54
established:     a5 4b 00
standard:        81 80 95 00 b3 00 95 0f 01 01 01 01 01 01 01 01
descriptor 1:    21 39 90 30 62 1a 27 40 68 b0 36 00 da 28 11 00 00 1c
descriptor 2:    00 00 00 ff 00 41 55 34 31 31 33 33 30 30 39 36 36 35
descriptor 3:    00 00 00 fd 00 38 4c 1e 53 11 00 0a 20 20 20 20 20 20
descriptor 4:    00 00 00 fc 00 50 68 69 6c 69 70 73 20 32 32 30 56 0a
extensions:      00
checksum:        b5

EDID version: 1.3
Manufacturer: PHL Model 882 Serial Number --
Made in week 33 of 2011
Analog display, Input voltage level: 0.7/0.7 V
Sync: Separate 
Maximum image size: 47 cm x 30 cm
Gamma: 2.20
DPMS levels: Off
RGB color display
First detailed timing is preferred timing
Display x,y Chromaticity:
  Red:   0.6494, 0.3349
  Green: 0.2832, 0.6054
  Blue:  0.1513, 0.0732
  White: 0.3125, 0.3291
Established timings supported:
  720x400@70Hz 9:5 HorFreq: 31469 Hz Clock: 28.320 MHz
  640x480@60Hz 4:3 HorFreq: 31469 Hz Clock: 25.175 MHz
  640x480@75Hz 4:3 HorFreq: 37500 Hz Clock: 31.500 MHz
  800x600@60Hz 4:3 HorFreq: 37900 Hz Clock: 40.000 MHz
  800x600@75Hz 4:3 HorFreq: 46900 Hz Clock: 49.500 MHz
  1024x768@60Hz 4:3 HorFreq: 48400 Hz Clock: 65.000 MHz
  1024x768@75Hz 4:3 HorFreq: 60000 Hz Clock: 78.750 MHz
  1280x1024@75Hz 5:4 HorFreq: 80000 Hz Clock: 135.000 MHz
Standard timings supported:
  1280x1024@60Hz 5:4 HorFreq: 64000 Hz Clock: 108.000 MHz
  1440x900@60Hz 16:10 HorFreq: 55500 Hz Clock: 88.750 MHz
  1680x1050@60Hz 16:10 HorFreq: 64700 Hz Clock: 119.000 MHz
  1440x900@75Hz 16:10 HorFreq: 82300 Hz Clock: 156.000 MHz
Detailed mode: Clock 146.250 MHz, 474 mm x 296 mm
               1680 1784 1960 2240 hborder 0
               1050 1053 1059 1089 vborder 0
               -hsync +vsync 
               VertFreq: 59 Hz, HorFreq: 65290 Hz
Serial number: --
Monitor ranges (GTF): 56-76Hz V, 30-83kHz H, max dotclock 170MHz
Monitor name: Philips 220V
Checksum: 0xb5 (valid)
