
EDID (hex):
00ffffffffffff001ab35b0877330000
0219010380351e782a1b45a655509c26
0f5054330800710081408180a940b300
9500d1c00101023a801871382d40582c
4500132b2100001e000000fd00374c1e
5311000a202020202020000000fc0045
3234542d37204c45440a2020000000ff
00595638583031333137350a202000f3

Extracted contents:
header:          00 ff ff ff ff ff ff 00
serial number:   1a b3 5b 08 77 33 00 00 02 19
version:         01 03
basic params:    80 35 1e 78 2a
chroma info:     1b 45 a6 55 50 9c 26 0f 50 54
established:     33 08 00
standard:        71 00 81 40 81 80 a9 40 b3 00 95 00 d1 c0 01 01
descriptor 1:    02 3a 80 18 71 38 2d 40 58 2c 45 00 13 2b 21 00 00 1e
descriptor 2:    00 00 00 fd 00 37 4c 1e 53 11 00 0a 20 20 20 20 20 20
descriptor 3:    00 00 00 fc 00 45 32 34 54 2d 37 20 4c 45 44 0a 20 20
descriptor 4:    00 00 00 ff 00 59 56 38 58 30 31 33 31 37 35 0a 20 20
extensions:      00
checksum:        f3

EDID version: 1.3
Manufacturer: FUS Model 85b Serial Number --
Made in week 2 of 2015
Digital display
Maximum image size: 53 cm x 30 cm
Gamma: 2.20
DPMS levels: Off
RGB color display
First detailed timing is preferred timing
Display x,y Chromaticity:
  Red:   0.6484, 0.3330
  Green: 0.3144, 0.6123
  Blue:  0.1494, 0.0585
  White: 0.3134, 0.3291
Established timings supported:
  640x480@60Hz 4:3 HorFreq: 31469 Hz Clock: 25.175 MHz
  640x480@67Hz 4:3 HorFreq: 35000 Hz Clock: 30.240 MHz
  800x600@56Hz 4:3 HorFreq: 35200 Hz Clock: 36.000 MHz
  800x600@60Hz 4:3 HorFreq: 37900 Hz Clock: 40.000 MHz
  1024x768@60Hz 4:3 HorFreq: 48400 Hz Clock: 65.000 MHz
Standard timings supported:
  1152x720@60Hz 16:10
  1280x960@60Hz 4:3 HorFreq: 60000 Hz Clock: 108.000 MHz
  1280x1024@60Hz 5:4 HorFreq: 64000 Hz Clock: 108.000 MHz
  1600x1200@60Hz 4:3 HorFreq: 75000 Hz Clock: 162.000 MHz
  1680x1050@60Hz 16:10 HorFreq: 64700 Hz Clock: 119.000 MHz
  1440x900@60Hz 16:10 HorFreq: 55500 Hz Clock: 88.750 MHz
  1920x1080@60Hz 16:9
Detailed mode: Clock 148.500 MHz, 531 mm x 299 mm
               1920 2008 2052 2200 hborder 0
               1080 1084 1089 1125 vborder 0
               +hsync +vsync 
               VertFreq: 60 Hz, HorFreq: 67500 Hz
Monitor ranges (GTF): 55-76Hz V, 30-83kHz H, max dotclock 170MHz
Monitor name: E24T-7 LED
Serial number: --
Checksum: 0xf3 (valid)


