
EDID (hex):
00ffffffffffff0009d1567845540000
091401030e2917782e3d85a6564a9a24
125054a56b90710081c081cf810f8140
0101010101019a29a0d0518422305098
630098ff1000001e000000ff00353341
30373332343032360a20000000fd0032
4b183f10000a202020202020000000fc
0042656e512047393230574c0a20008b

edid-decode (hex):

00 ff ff ff ff ff ff 00 09 d1 56 78 45 54 00 00
09 14 01 03 0e 29 17 78 2e 3d 85 a6 56 4a 9a 24
12 50 54 a5 6b 90 71 00 81 c0 81 cf 81 0f 81 40
01 01 01 01 01 01 9a 29 a0 d0 51 84 22 30 50 98
63 00 98 ff 10 00 00 1e 00 00 00 ff 00 35 33 41
30 37 33 32 34 30 32 36 0a 20 00 00 00 fd 00 32
4b 18 3f 10 00 0a 20 20 20 20 20 20 00 00 00 fc
00 42 65 6e 51 20 47 39 32 30 57 4c 0a 20 00 8b

----------------

Block 0, Base EDID:
  EDID Structure Version & Revision: 1.3
  Vendor & Product Identification:
    Manufacturer: BNQ
    Model: 30806
    Serial Number: 21573
    Made in: week 9 of 2010
  Basic Display Parameters & Features:
    Analog display
    Signal Level Standard: 0.700 : 0.300 : 1.000 V p-p
    Blank level equals black level
    Sync: Separate Composite SyncOnGreen
    Maximum image size: 41 cm x 23 cm
    Gamma: 2.20
    DPMS levels: Off
    RGB color display
    Default (sRGB) color space is primary color space
    First detailed timing is the preferred timing
  Color Characteristics:
    Red  : 0.6484, 0.3388
    Green: 0.2919, 0.6025
    Blue : 0.1425, 0.0703
    White: 0.3134, 0.3291
  Established Timings I & II:
    IBM     :   720x400    70.081663 Hz   9:5     31.467 kHz     28.320000 MHz
    DMT 0x04:   640x480    59.940476 Hz   4:3     31.469 kHz     25.175000 MHz
    DMT 0x06:   640x480    75.000000 Hz   4:3     37.500 kHz     31.500000 MHz
    DMT 0x09:   800x600    60.316541 Hz   4:3     37.879 kHz     40.000000 MHz
    DMT 0x0b:   800x600    75.000000 Hz   4:3     46.875 kHz     49.500000 MHz
    Apple   :   832x624    74.551266 Hz   4:3     49.726 kHz     57.284000 MHz
    DMT 0x10:  1024x768    60.003840 Hz   4:3     48.363 kHz     65.000000 MHz
    DMT 0x12:  1024x768    75.028582 Hz   4:3     60.023 kHz     78.750000 MHz
    DMT 0x24:  1280x1024   75.024675 Hz   5:4     79.976 kHz    135.000000 MHz
    Apple   :  1152x870    75.061550 Hz 192:145   68.681 kHz    100.000000 MHz
  Standard Timings:
    GTF     :  1152x720    59.999964 Hz  16:10    44.760 kHz     67.319000 MHz
    DMT 0x55:  1280x720    60.000000 Hz  16:9     45.000 kHz     74.250000 MHz
    GTF     :  1280x720    74.999686 Hz  16:9     56.400 kHz     95.654000 MHz
    DMT 0x1d:  1280x800    74.934142 Hz  16:10    62.795 kHz    106.500000 MHz
    DMT 0x20:  1280x960    60.000000 Hz   4:3     60.000 kHz    108.000000 MHz
  Detailed Timing Descriptors:
    DTD 1:  1440x900    59.887445 Hz  16:10    55.935 kHz    106.500000 MHz (408 mm x 255 mm)
                 Hfront   80 Hsync 152 Hback  232 Hpol P
                 Vfront    6 Vsync   3 Vback   25 Vpol P
    Display Product Serial Number: '53A07324026'
    Display Range Limits:
      Monitor ranges (GTF): 50-75 Hz V, 24-63 kHz H, max dotclock 160 MHz
    Display Product Name: 'BenQ G920WL'
Checksum: 0x8b
