edid-decode (hex):

00 ff ff ff ff ff ff 00 42 93 14 09 37 aa 03 00
2f 0e 01 03 08 1c 15 50 e8 0c 36 8e 54 4b 95 28
21 4f 54 ad ce 00 01 01 01 01 01 01 01 01 01 01
01 01 01 01 01 01 c3 1e 00 20 41 00 20 30 10 60
13 00 1d d6 10 00 00 1e 00 00 00 fc 00 4d 41 2d
34 38 32 0a 20 20 20 20 20 20 00 00 00 fd 00 3c
4b 1e 3c 08 00 0a 20 20 20 20 20 20 00 00 00 ff
00 46 34 4e 43 34 42 30 32 34 30 31 38 33 00 1c

----------------

Block 0, Base EDID:
  EDID Structure Version & Revision: 1.3
  Vendor & Product Identification:
    Manufacturer: PTS
    Model: 2324
    Serial Number: ...
    Made in: week 47 of 2004
  Basic Display Parameters & Features:
    Analog display
    Input voltage level: 0.7/0.3 V
    Blank level equals black level
    Sync: Separate
    Maximum image size: 28 cm x 21 cm
    Gamma: 1.80
    DPMS levels: Standby Suspend Off
    RGB color display
  Color Characteristics:
    Red  : 0.5546, 0.3281
    Green: 0.2958, 0.5820
    Blue : 0.1562, 0.1318
    White: 0.3095, 0.3300
  Established Timings I & II:
    IBM     :   720x400    70.081663 Hz   9:5     31.467 kHz     28.320000 MHz
    DMT 0x04:   640x480    59.940476 Hz   4:3     31.469 kHz     25.175000 MHz
    DMT 0x05:   640x480    72.808802 Hz   4:3     37.861 kHz     31.500000 MHz
    DMT 0x06:   640x480    75.000000 Hz   4:3     37.500 kHz     31.500000 MHz
    DMT 0x09:   800x600    60.316541 Hz   4:3     37.879 kHz     40.000000 MHz
    DMT 0x0a:   800x600    72.187572 Hz   4:3     48.077 kHz     50.000000 MHz
    DMT 0x0b:   800x600    75.000000 Hz   4:3     46.875 kHz     49.500000 MHz
    DMT 0x10:  1024x768    60.003840 Hz   4:3     48.363 kHz     65.000000 MHz
    DMT 0x11:  1024x768    70.069359 Hz   4:3     56.476 kHz     75.000000 MHz
    DMT 0x12:  1024x768    75.028582 Hz   4:3     60.023 kHz     78.750000 MHz
  Standard Timings: none
  Detailed Timing Descriptors:
    DTD 1:  1024x768    75.028582 Hz   4:3     60.023 kHz     78.750000 MHz (285 mm x 214 mm)
                 Hfront   16 Hsync  96 Hback  176 Hpol P
                 Vfront    1 Vsync   3 Vback   28 Vpol P
    Display Product Name: 'MA-482'
    Display Range Limits:
      Monitor ranges (GTF): 60-75 Hz V, 30-60 kHz H, max dotclock 80 MHz
    Display Product Serial Number: ...
Checksum: 0x1c

----------------

Failures:

Block 0, Base EDID:
  Basic Display Parameters & Features: EDID 1.3 requires that the first detailed timing is the preferred timing.

EDID conformity: FAIL
