
EDID (hex):
00ffffffffffff004a8b601501010101
0e1f010380140d783eee91a3544c9926
0f5054210800d1c081c0a9c001010101
0101010101013b3e80d370b02e403020
350068be1000001e000000fc0048444d
490a2020202020202020000000ff0064
656d6f7365742d310a203020000000fd
00303f545415010a2020202020200176
020335f24a04051013141f01021112e2
00d5e305c00023097f07830100006703
0c001000183ce6060501626200681a00
000101303f023a801871382d40580f25
00cb880000009e000000000000000000
00000000000000000000000000000000
00000000000000000000000000000000
00000000000000000000000000000086

edid-decode (hex):

00 ff ff ff ff ff ff 00 4a 8b 60 15 01 01 01 01
0e 1f 01 03 80 14 0d 78 3e ee 91 a3 54 4c 99 26
0f 50 54 21 08 00 d1 c0 81 c0 a9 c0 01 01 01 01
01 01 01 01 01 01 3b 3e 80 d3 70 b0 2e 40 30 20
35 00 68 be 10 00 00 1e 00 00 00 fc 00 48 44 4d
49 0a 20 20 20 20 20 20 20 20 00 00 00 ff 00 64
65 6d 6f 73 65 74 2d 31 0a 20 30 20 00 00 00 fd
00 30 3f 54 54 15 01 0a 20 20 20 20 20 20 01 76

02 03 35 f2 4a 04 05 10 13 14 1f 01 02 11 12 e2
00 d5 e3 05 c0 00 23 09 7f 07 83 01 00 00 67 03
0c 00 10 00 18 3c e6 06 05 01 62 62 00 68 1a 00
00 01 01 30 3f 02 3a 80 18 71 38 2d 40 58 0f 25
00 cb 88 00 00 00 9e 00 00 00 00 00 00 00 00 00
00 00 00 00 00 00 00 00 00 00 00 00 00 00 00 00
00 00 00 00 00 00 00 00 00 00 00 00 00 00 00 00
00 00 00 00 00 00 00 00 00 00 00 00 00 00 00 86

----------------

Block 0, Base EDID:
  EDID Structure Version & Revision: 1.3
  Vendor & Product Identification:
    Manufacturer: RTK
    Model: 5472
    Serial Number: 16843009
    Made in: week 14 of 2021
  Basic Display Parameters & Features:
    Digital display
    Maximum image size: 20 cm x 13 cm
    Gamma: 2.20
    DPMS levels: Off
    Undefined display color type
    Default (sRGB) color space is primary color space
    First detailed timing is the preferred timing
  Color Characteristics:
    Red  : 0.6396, 0.3300
    Green: 0.2998, 0.5996
    Blue : 0.1503, 0.0595
    White: 0.3125, 0.3291
  Established Timings I & II:
    DMT 0x04:   640x480    59.940476 Hz   4:3     31.469 kHz     25.175000 MHz
    DMT 0x09:   800x600    60.316541 Hz   4:3     37.879 kHz     40.000000 MHz
    DMT 0x10:  1024x768    60.003840 Hz   4:3     48.363 kHz     65.000000 MHz
  Standard Timings:
    DMT 0x52:  1920x1080   60.000000 Hz  16:9     67.500 kHz    148.500000 MHz
    DMT 0x55:  1280x720    60.000000 Hz  16:9     45.000 kHz     74.250000 MHz
    DMT 0x53:  1600x900    60.000000 Hz  16:9     60.000 kHz    108.000000 MHz (RB)
  Detailed Timing Descriptors:
    DTD 1:  1920x1200   59.998659 Hz  16:10    74.758 kHz    159.310000 MHz (360 mm x 190 mm)
                 Hfront   48 Hsync  32 Hback  131 Hpol P
                 Vfront    3 Vsync   5 Vback   38 Vpol P
    Display Product Name: 'HDMI'
    Display Product Serial Number: 'demoset-1'
    Display Range Limits:
      Monitor ranges (Bare Limits): 48-63 Hz V, 84-84 kHz H, max dotclock 210 MHz
  Extension blocks: 1
Checksum: 0x76

----------------

Block 1, CTA-861 Extension Block:
  Revision: 3
  Underscans IT Video Formats by default
  Basic audio support
  Supports YCbCr 4:4:4
  Supports YCbCr 4:2:2
  Native detailed modes: 2
  Video Data Block:
    VIC   4:  1280x720    60.000000 Hz  16:9     45.000 kHz     74.250000 MHz
    VIC   5:  1920x1080i  60.000000 Hz  16:9     33.750 kHz     74.250000 MHz
    VIC  16:  1920x1080   60.000000 Hz  16:9     67.500 kHz    148.500000 MHz
    VIC  19:  1280x720    50.000000 Hz  16:9     37.500 kHz     74.250000 MHz
    VIC  20:  1920x1080i  50.000000 Hz  16:9     28.125 kHz     74.250000 MHz
    VIC  31:  1920x1080   50.000000 Hz  16:9     56.250 kHz    148.500000 MHz
    VIC   1:   640x480    59.940476 Hz   4:3     31.469 kHz     25.175000 MHz
    VIC   2:   720x480    59.940060 Hz   4:3     31.469 kHz     27.000000 MHz
    VIC  17:   720x576    50.000000 Hz   4:3     31.250 kHz     27.000000 MHz
    VIC  18:   720x576    50.000000 Hz  16:9     31.250 kHz     27.000000 MHz
  Video Capability Data Block:
    YCbCr quantization: Selectable (via AVI YQ)
    RGB quantization: Selectable (via AVI Q)
    PT scan behavior: Always Overscanned
    IT scan behavior: Always Overscanned
    CE scan behavior: Always Overscanned
  Colorimetry Data Block:
    BT2020YCC
    BT2020RGB
  Audio Data Block:
    Linear PCM:
      Max channels: 2
      Supported sample rates (kHz): 192 176.4 96 88.2 48 44.1 32
      Supported sample sizes (bits): 24 20 16
  Speaker Allocation Data Block:
    FL/FR - Front Left/Right
  Vendor-Specific Data Block (HDMI), OUI 00-0C-03:
    Source physical address: 1.0.0.0
    DC_30bit
    DC_Y444
    Maximum TMDS clock: 300 MHz
  HDR Static Metadata Data Block:
    Electro optical transfer functions:
      Traditional gamma - SDR luminance range
      SMPTE ST2084
    Supported static metadata descriptors:
      Static metadata type 1
    Desired content max luminance: 98 (417.710 cd/m^2)
    Desired content max frame-average luminance: 98 (417.710 cd/m^2)
    Desired content min luminance: 0 (0.000 cd/m^2)
  Vendor-Specific Data Block (AMD), OUI 00-00-1A:
    Version: 1.1
    Minimum Refresh Rate: 48 Hz
    Maximum Refresh Rate: 63 Hz
    Flags 1.x: 0x02 (MCCS)
  Detailed Timing Descriptors:
    DTD 2:  1920x2160i  59.973345 Hz   8:9     67.500 kHz    148.500000 MHz (203 mm x 136 mm)
                 Hfront   88 Hsync  15 Hback  177 Hpol P
                 Vfront    2 Vsync   5 Vback   38 Vpol P Vfront +0.5 Odd Field
                 Vfront    2 Vsync   5 Vback   38 Vpol P Vback  +0.5 Even Field
Checksum: 0x86  Unused space in Extension Block: 56 bytes
