edid-decode (hex):

00 ff ff ff ff ff ff 00 26 13 80 23 00 00 00 00
13 1d 01 03 80 35 1d 78 d2 ab b0 ab 50 47 a3 22
11 50 54 af cf 00 81 c0 81 80 95 00 a9 c0 b3 00
d1 c0 01 01 01 01 04 74 00 30 f2 70 5a 80 30 20
36 00 13 2a 21 00 00 1e 9c e0 00 78 a0 a0 32 50
10 40 35 00 55 50 21 00 00 1e 00 00 00 fd 00 2c
3f 17 a0 3c 01 0a 20 20 20 20 20 20 00 00 00 fc
00 53 4f 32 33 38 30 0a 20 20 20 20 20 20 01 5c

02 03 47 f1 4d 61 60 5a 10 05 04 03 02 1f 13 12
01 5f 23 09 7f 07 83 01 00 00 6d 03 0c 00 10 00
38 3c 20 00 60 01 02 03 67 d8 5d c4 01 78 88 03
68 1a 00 00 01 01 30 40 ed e3 05 e0 01 e2 0f 7f
e6 06 07 01 6b 53 4f 08 e8 00 30 f2 70 5a 80 b0
58 4a 00 ba 89 21 00 00 1a f5 bd 00 a0 a0 a0 32
50 20 40 45 00 55 50 21 00 00 1a 56 5e 00 a0 a0
a0 29 50 30 20 35 00 55 50 21 00 00 1a 00 00 27

00 ff ff ff ff ff ff 00 26 13 80 23 00 00 00 00
13 1d 01 03 80 35 1d 78 d2 ab b0 ab 50 47 a3 22
11 50 54 af cf 00 81 c0 81 80 95 00 a9 c0 b3 00
d1 c0 01 01 01 01 04 74 00 30 f2 70 5a 80 30 20
36 00 13 2a 21 00 00 1e 9c e0 00 78 a0 a0 32 50
10 40 35 00 55 50 21 00 00 1e 00 00 00 fd 00 2c
3f 17 a0 3c 01 0a 20 20 20 20 20 20 00 00 00 fc
00 53 4f 32 33 38 30 0a 20 20 20 20 20 20 01 5c

02 03 47 f1 4d 61 60 5a 10 05 04 03 02 1f 13 12
01 5f 23 09 7f 07 83 01 00 00 6d 03 0c 00 10 00
38 3c 20 00 60 01 02 03 67 d8 5d c4 01 78 88 03
68 1a 00 00 01 01 30 40 ed e3 05 e0 01 e2 0f 7f
e6 06 07 01 6b 53 4f 08 e8 00 30 f2 70 5a 80 b0
58 4a 00 ba 89 21 00 00 1a f5 bd 00 a0 a0 a0 32
50 20 40 45 00 55 50 21 00 00 1a 56 5e 00 a0 a0
a0 29 50 30 20 35 00 55 50 21 00 00 1a 00 00 27

----------------

Block 0, Base EDID:
  EDID Structure Version & Revision: 1.3
  Vendor & Product Identification:
    Manufacturer: IPS
    Model: 9088
    Made in: week 19 of 2019
  Basic Display Parameters & Features:
    Digital display
    Maximum image size: 53 cm x 29 cm
    Gamma: 2.20
    DPMS levels: Standby Suspend
    Non-RGB color display
    First detailed timing is the preferred timing
  Color Characteristics:
    Red  : 0.6699, 0.3144
    Green: 0.2792, 0.6396
    Blue : 0.1347, 0.0693
    White: 0.3125, 0.3281
  Established Timings I & II:
    IBM     :   720x400    70.081663 Hz   9:5     31.467 kHz     28.320000 MHz
    DMT 0x04:   640x480    59.940476 Hz   4:3     31.469 kHz     25.175000 MHz
    DMT 0x05:   640x480    72.808802 Hz   4:3     37.861 kHz     31.500000 MHz
    DMT 0x06:   640x480    75.000000 Hz   4:3     37.500 kHz     31.500000 MHz
    DMT 0x08:   800x600    56.250000 Hz   4:3     35.156 kHz     36.000000 MHz
    DMT 0x09:   800x600    60.316541 Hz   4:3     37.879 kHz     40.000000 MHz
    DMT 0x0a:   800x600    72.187572 Hz   4:3     48.077 kHz     50.000000 MHz
    DMT 0x0b:   800x600    75.000000 Hz   4:3     46.875 kHz     49.500000 MHz
    DMT 0x10:  1024x768    60.003840 Hz   4:3     48.363 kHz     65.000000 MHz
    DMT 0x11:  1024x768    70.069359 Hz   4:3     56.476 kHz     75.000000 MHz
    DMT 0x12:  1024x768    75.028582 Hz   4:3     60.023 kHz     78.750000 MHz
    DMT 0x24:  1280x1024   75.024675 Hz   5:4     79.976 kHz    135.000000 MHz
  Standard Timings:
    DMT 0x55:  1280x720    60.000000 Hz  16:9     45.000 kHz     74.250000 MHz
    DMT 0x23:  1280x1024   60.019740 Hz   5:4     63.981 kHz    108.000000 MHz
    DMT 0x2f:  1440x900    59.887445 Hz  16:10    55.935 kHz    106.500000 MHz
    DMT 0x53:  1600x900    60.000000 Hz  16:9     60.000 kHz    108.000000 MHz (RB)
    DMT 0x3a:  1680x1050   59.954250 Hz  16:10    65.290 kHz    146.250000 MHz
    DMT 0x52:  1920x1080   60.000000 Hz  16:9     67.500 kHz    148.500000 MHz
  Detailed Timing Descriptors:
    DTD 1:  3840x2160   30.000000 Hz  16:9     67.500 kHz    297.000000 MHz (531 mm x 298 mm)
                 Hfront   48 Hsync  32 Hback  480 Hpol P
                 Vfront    3 Vsync   6 Vback   81 Vpol P
    DTD 2:  2560x1440  143.994791 Hz  16:9    214.552 kHz    575.000000 MHz (597 mm x 336 mm)
                 Hfront   16 Hsync  64 Hback   40 Hpol P
                 Vfront    3 Vsync   5 Vback   42 Vpol P
    Display Range Limits:
      Monitor ranges (Bare Limits): 44-63 Hz V, 23-160 kHz H, max dotclock 600 MHz
    Display Product Name: 'SO2380'
  Extension blocks: 1
Checksum: 0x5c

----------------

Block 1, CTA-861 Extension Block:
  Revision: 3
  Underscans IT Video Formats by default
  Basic audio support
  Supports YCbCr 4:4:4
  Supports YCbCr 4:2:2
  Native detailed modes: 1
  Video Data Block:
    VIC  97:  3840x2160   60.000000 Hz  16:9    135.000 kHz    594.000000 MHz
    VIC  96:  3840x2160   50.000000 Hz  16:9    112.500 kHz    594.000000 MHz
    VIC  90:  2560x1080   60.000000 Hz  64:27    66.000 kHz    198.000000 MHz
    VIC  16:  1920x1080   60.000000 Hz  16:9     67.500 kHz    148.500000 MHz
    VIC   5:  1920x1080i  60.000000 Hz  16:9     33.750 kHz     74.250000 MHz
    VIC   4:  1280x720    60.000000 Hz  16:9     45.000 kHz     74.250000 MHz
    VIC   3:   720x480    59.940060 Hz  16:9     31.469 kHz     27.000000 MHz
    VIC   2:   720x480    59.940060 Hz   4:3     31.469 kHz     27.000000 MHz
    VIC  31:  1920x1080   50.000000 Hz  16:9     56.250 kHz    148.500000 MHz
    VIC  19:  1280x720    50.000000 Hz  16:9     37.500 kHz     74.250000 MHz
    VIC  18:   720x576    50.000000 Hz  16:9     31.250 kHz     27.000000 MHz
    VIC   1:   640x480    59.940476 Hz   4:3     31.469 kHz     25.175000 MHz
    VIC  95:  3840x2160   30.000000 Hz  16:9     67.500 kHz    297.000000 MHz
  Audio Data Block:
    Linear PCM:
      Max channels: 2
      Supported sample rates (kHz): 192 176.4 96 88.2 48 44.1 32
      Supported sample sizes (bits): 24 20 16
  Speaker Allocation Data Block:
    FL/FR - Front Left/Right
  Vendor-Specific Data Block (HDMI), OUI 00-0C-03:
    Source physical address: 1.0.0.0
    DC_36bit
    DC_30bit
    DC_Y444
    Maximum TMDS clock: 300 MHz
    Extended HDMI video details:
      HDMI VICs:
        HDMI VIC 1:  3840x2160   30.000000 Hz  16:9     67.500 kHz    297.000000 MHz
        HDMI VIC 2:  3840x2160   25.000000 Hz  16:9     56.250 kHz    297.000000 MHz
        HDMI VIC 3:  3840x2160   24.000000 Hz  16:9     54.000 kHz    297.000000 MHz
  Vendor-Specific Data Block (HDMI Forum), OUI C4-5D-D8:
    Version: 1
    Maximum TMDS Character Rate: 600 MHz
    SCDC Present
    Supports scrambling for <= 340 Mcsc
    Supports 12-bits/component Deep Color 4:2:0 Pixel Encoding
    Supports 10-bits/component Deep Color 4:2:0 Pixel Encoding
  Vendor-Specific Data Block (AMD), OUI 00-00-1A:
    Version: 1.1
    Minimum Refresh Rate: 48 Hz
    Maximum Refresh Rate: 64 Hz
    Flags 1.x: 0xed (MCCS)
  Colorimetry Data Block:
    BT2020cYCC
    BT2020YCC
    BT2020RGB
    Gamut Boundary Description Metadata Profile P0
  YCbCr 4:2:0 Capability Map Data Block:
    VIC  97:  3840x2160   60.000000 Hz  16:9    135.000 kHz    594.000000 MHz
    VIC  96:  3840x2160   50.000000 Hz  16:9    112.500 kHz    594.000000 MHz
    VIC  90:  2560x1080   60.000000 Hz  64:27    66.000 kHz    198.000000 MHz
    VIC  16:  1920x1080   60.000000 Hz  16:9     67.500 kHz    148.500000 MHz
    VIC   5:  1920x1080i  60.000000 Hz  16:9     33.750 kHz     74.250000 MHz
    VIC   4:  1280x720    60.000000 Hz  16:9     45.000 kHz     74.250000 MHz
    VIC   3:   720x480    59.940060 Hz  16:9     31.469 kHz     27.000000 MHz
  HDR Static Metadata Data Block:
    Electro optical transfer functions:
      Traditional gamma - SDR luminance range
      Traditional gamma - HDR luminance range
      SMPTE ST2084
    Supported static metadata descriptors:
      Static metadata type 1
    Desired content max luminance: 107 (507.620 cd/m^2)
    Desired content max frame-average luminance: 83 (301.833 cd/m^2)
    Desired content min luminance: 79 (0.487 cd/m^2)
  Detailed Timing Descriptors:
    DTD 3:  3840x2160   60.000000 Hz  16:9    135.000 kHz    594.000000 MHz (698 mm x 393 mm)
                 Hfront  176 Hsync  88 Hback  296 Hpol P
                 Vfront    4 Vsync  10 Vback   76 Vpol N
    DTD 4:  2560x1440  119.988650 Hz  16:9    178.783 kHz    486.290000 MHz (597 mm x 336 mm)
                 Hfront   32 Hsync  64 Hback   64 Hpol P
                 Vfront    4 Vsync   5 Vback   41 Vpol N
    DTD 5:  2560x1440   59.950550 Hz  16:9     88.787 kHz    241.500000 MHz (597 mm x 336 mm)
                 Hfront   48 Hsync  32 Hback   80 Hpol P
                 Vfront    3 Vsync   5 Vback   33 Vpol N
Checksum: 0x27  Unused space in Extension Block: 2 bytes

----------------

Block 2, Unknown EDID Extension Block 0x00:
  00 ff ff ff ff ff ff 00 26 13 80 23 00 00 00 00 '........&..#....'
  13 1d 01 03 80 35 1d 78 d2 ab b0 ab 50 47 a3 22 '.....5.x....PG."'
  11 50 54 af cf 00 81 c0 81 80 95 00 a9 c0 b3 00 '.PT.............'
  d1 c0 01 01 01 01 04 74 00 30 f2 70 5a 80 30 20 '.......t.0.pZ.0 '
  36 00 13 2a 21 00 00 1e 9c e0 00 78 a0 a0 32 50 '6..*!......x..2P'
  10 40 35 00 55 50 21 00 00 1e 00 00 00 fd 00 2c '.@5.UP!........,'
  3f 17 a0 3c 01 0a 20 20 20 20 20 20 00 00 00 fc '?..<..      ....'
  00 53 4f 32 33 38 30 0a 20 20 20 20 20 20 01 5c '.SO2380.      .\'
Checksum: 0x5c

----------------

Block 3, CTA-861 Extension Block:
  Revision: 3
  Underscans IT Video Formats by default
  Basic audio support
  Supports YCbCr 4:4:4
  Supports YCbCr 4:2:2
  Native detailed modes: 1
  Video Data Block:
    VIC  97:  3840x2160   60.000000 Hz  16:9    135.000 kHz    594.000000 MHz
    VIC  96:  3840x2160   50.000000 Hz  16:9    112.500 kHz    594.000000 MHz
    VIC  90:  2560x1080   60.000000 Hz  64:27    66.000 kHz    198.000000 MHz
    VIC  16:  1920x1080   60.000000 Hz  16:9     67.500 kHz    148.500000 MHz
    VIC   5:  1920x1080i  60.000000 Hz  16:9     33.750 kHz     74.250000 MHz
    VIC   4:  1280x720    60.000000 Hz  16:9     45.000 kHz     74.250000 MHz
    VIC   3:   720x480    59.940060 Hz  16:9     31.469 kHz     27.000000 MHz
    VIC   2:   720x480    59.940060 Hz   4:3     31.469 kHz     27.000000 MHz
    VIC  31:  1920x1080   50.000000 Hz  16:9     56.250 kHz    148.500000 MHz
    VIC  19:  1280x720    50.000000 Hz  16:9     37.500 kHz     74.250000 MHz
    VIC  18:   720x576    50.000000 Hz  16:9     31.250 kHz     27.000000 MHz
    VIC   1:   640x480    59.940476 Hz   4:3     31.469 kHz     25.175000 MHz
    VIC  95:  3840x2160   30.000000 Hz  16:9     67.500 kHz    297.000000 MHz
  Audio Data Block:
    Linear PCM:
      Max channels: 2
      Supported sample rates (kHz): 192 176.4 96 88.2 48 44.1 32
      Supported sample sizes (bits): 24 20 16
  Speaker Allocation Data Block:
    FL/FR - Front Left/Right
  Vendor-Specific Data Block (HDMI), OUI 00-0C-03:
    Source physical address: 1.0.0.0
    DC_36bit
    DC_30bit
    DC_Y444
    Maximum TMDS clock: 300 MHz
    Extended HDMI video details:
      HDMI VICs:
        HDMI VIC 1:  3840x2160   30.000000 Hz  16:9     67.500 kHz    297.000000 MHz
        HDMI VIC 2:  3840x2160   25.000000 Hz  16:9     56.250 kHz    297.000000 MHz
        HDMI VIC 3:  3840x2160   24.000000 Hz  16:9     54.000 kHz    297.000000 MHz
  Vendor-Specific Data Block (HDMI Forum), OUI C4-5D-D8:
    Version: 1
    Maximum TMDS Character Rate: 600 MHz
    SCDC Present
    Supports scrambling for <= 340 Mcsc
    Supports 12-bits/component Deep Color 4:2:0 Pixel Encoding
    Supports 10-bits/component Deep Color 4:2:0 Pixel Encoding
  Vendor-Specific Data Block (AMD), OUI 00-00-1A:
    Version: 1.1
    Minimum Refresh Rate: 48 Hz
    Maximum Refresh Rate: 64 Hz
    Flags 1.x: 0xed (MCCS)
  Colorimetry Data Block:
    BT2020cYCC
    BT2020YCC
    BT2020RGB
    Gamut Boundary Description Metadata Profile P0
  YCbCr 4:2:0 Capability Map Data Block:
    VIC  97:  3840x2160   60.000000 Hz  16:9    135.000 kHz    594.000000 MHz
    VIC  96:  3840x2160   50.000000 Hz  16:9    112.500 kHz    594.000000 MHz
    VIC  90:  2560x1080   60.000000 Hz  64:27    66.000 kHz    198.000000 MHz
    VIC  16:  1920x1080   60.000000 Hz  16:9     67.500 kHz    148.500000 MHz
    VIC   5:  1920x1080i  60.000000 Hz  16:9     33.750 kHz     74.250000 MHz
    VIC   4:  1280x720    60.000000 Hz  16:9     45.000 kHz     74.250000 MHz
    VIC   3:   720x480    59.940060 Hz  16:9     31.469 kHz     27.000000 MHz
  HDR Static Metadata Data Block:
    Electro optical transfer functions:
      Traditional gamma - SDR luminance range
      Traditional gamma - HDR luminance range
      SMPTE ST2084
    Supported static metadata descriptors:
      Static metadata type 1
    Desired content max luminance: 107 (507.620 cd/m^2)
    Desired content max frame-average luminance: 83 (301.833 cd/m^2)
    Desired content min luminance: 79 (0.487 cd/m^2)
  Detailed Timing Descriptors:
    DTD 6:  3840x2160   60.000000 Hz  16:9    135.000 kHz    594.000000 MHz (698 mm x 393 mm)
                 Hfront  176 Hsync  88 Hback  296 Hpol P
                 Vfront    4 Vsync  10 Vback   76 Vpol N
    DTD 7:  2560x1440  119.988650 Hz  16:9    178.783 kHz    486.290000 MHz (597 mm x 336 mm)
                 Hfront   32 Hsync  64 Hback   64 Hpol P
                 Vfront    4 Vsync   5 Vback   41 Vpol N
    DTD 8:  2560x1440   59.950550 Hz  16:9     88.787 kHz    241.500000 MHz (597 mm x 336 mm)
                 Hfront   48 Hsync  32 Hback   80 Hpol P
                 Vfront    3 Vsync   5 Vback   33 Vpol N
Checksum: 0x27  Unused space in Extension Block: 2 bytes

----------------

Warnings:

Block 0, Base EDID:
  Detailed Timing Descriptor #1: DTD is similar but not identical to VIC 95.
Block 1, CTA-861 Extension Block:
  Colorimetry Data Block: Set the sRGB colorimetry bit to avoid interop issues.
  YCbCr 4:2:0 Capability Map Data Block: Some YCbCr 4:2:0 timings are invalid for HDMI 2.1 (which requires an RGB timings pixel rate >= 590 MHz).
  Detailed Timing Descriptor #3: DTD is similar but not identical to VIC 97.
Block 3, CTA-861 Extension Block:
  Colorimetry Data Block: Set the sRGB colorimetry bit to avoid interop issues.
  Detailed Timing Descriptor #6: DTD is similar but not identical to VIC 97.

Failures:

Block 0, Base EDID:
  Detailed Timing Descriptor #2: Mismatch of image size 597x336 mm vs display size 530x290 mm.
  Display Range Limits: 'Bare Limits' is not allowed for EDID < 1.4.
Block 1, CTA-861 Extension Block:
  Detailed Timing Descriptor #3: Mismatch of image size 698x393 mm vs display size 530x290 mm.
  Detailed Timing Descriptor #4: Mismatch of image size 597x336 mm vs display size 530x290 mm.
  Detailed Timing Descriptor #5: Mismatch of image size 597x336 mm vs display size 530x290 mm.
  HDMI VIC Codes must have their CTA-861 VIC equivalents in the VSB.
  Missing VCDB, needed for Set Selectable RGB Quantization to avoid interop issues.
Block 2, Base EDID:
  Unknown Extension Block.
Block 3, CTA-861 Extension Block:
  Video Data Block: Duplicate VIC 97.
  Video Data Block: Duplicate VIC 96.
  Video Data Block: Duplicate VIC 90.
  Video Data Block: Duplicate VIC 16.
  Video Data Block: Duplicate VIC 5.
  Video Data Block: Duplicate VIC 4.
  Video Data Block: Duplicate VIC 3.
  Video Data Block: Duplicate VIC 2.
  Video Data Block: Duplicate VIC 31.
  Video Data Block: Duplicate VIC 19.
  Video Data Block: Duplicate VIC 18.
  Video Data Block: Duplicate VIC 1.
  Video Data Block: Duplicate VIC 95.
  Speaker Allocation Data Block: Only one instance of this Data Block is allowed.
  Vendor-Specific Data Block (HDMI Forum), OUI C4-5D-D8: Duplicate HDMI Forum VSDB/SCDB.
  Colorimetry Data Block: Only one instance of this Data Block is allowed.
  YCbCr 4:2:0 Capability Map Data Block: Only one instance of this Data Block is allowed.
  HDR Static Metadata Data Block: Only one instance of this Data Block is allowed.
  Detailed Timing Descriptor #6: Mismatch of image size 698x393 mm vs display size 530x290 mm.
  Detailed Timing Descriptor #7: Mismatch of image size 597x336 mm vs display size 530x290 mm.
  Detailed Timing Descriptor #8: Mismatch of image size 597x336 mm vs display size 530x290 mm.
  HDMI VIC Codes must have their CTA-861 VIC equivalents in the VSB.
  Missing VCDB, needed for Set Selectable RGB Quantization to avoid interop issues.
EDID:
  Base EDID: Some timings are out of range of the Monitor Ranges:
    Vertical Freq: 24.000 - 143.995 Hz (Monitor: 44.000 - 63.000 Hz)
    Horizontal Freq: 15.734 - 214.552 kHz (Monitor: 23.000 - 160.000 kHz)
  Base EDID: The DTD max image size is 698x393mm, which is larger than the display size 530.0x290.0mm.
  Base EDID: EDID specified 1 extension block(s), but found 3 extension block(s).
  Base EDID: EDID 1.3 requires a Block Map Extension in Block 1 if there are more than 2 blocks in the EDID.

EDID conformity: FAIL
