
EDID (hex):
00ffffffffffff0022f04a2801010101
1414010468342078ee9ec5a6564b9a25
135054210800814081809500a940b300
d1c0010101017d4b80a072b02d4088c8
360006442100001c000000fd00323f18
4c14000a202020202020000000fc004c
41323430350a202020202020000000ff
00434e34303230304b57330a20200067

edid-decode (hex):

00 ff ff ff ff ff ff 00 22 f0 4a 28 01 01 01 01
14 14 01 04 68 34 20 78 ee 9e c5 a6 56 4b 9a 25
13 50 54 21 08 00 81 40 81 80 95 00 a9 40 b3 00
d1 c0 01 01 01 01 7d 4b 80 a0 72 b0 2d 40 88 c8
36 00 06 44 21 00 00 1c 00 00 00 fd 00 32 3f 18
4c 14 00 0a 20 20 20 20 20 20 00 00 00 fc 00 4c
41 32 34 30 35 0a 20 20 20 20 20 20 00 00 00 ff
00 43 4e 34 30 32 30 30 4b 57 33 0a 20 20 00 67

----------------

Block 0, Base EDID:
  EDID Structure Version & Revision: 1.4
  Vendor & Product Identification:
    Manufacturer: HWP
    Model: 10314
    Serial Number: 16843009
    Made in: week 20 of 2010
  Basic Display Parameters & Features:
    Analog display
    Signal Level Standard: 0.700 : 0.000 : 0.700 V p-p
    Blank level equals black level
    Sync: Separate
    Maximum image size: 52 cm x 32 cm
    Gamma: 2.20
    DPMS levels: Standby Suspend Off
    RGB color display
    Default (sRGB) color space is primary color space
    First detailed timing includes the native pixel format and preferred refresh rate
  Color Characteristics:
    Red  : 0.6503, 0.3369
    Green: 0.2958, 0.6035
    Blue : 0.1474, 0.0742
    White: 0.3134, 0.3291
  Established Timings I & II:
    DMT 0x04:   640x480    59.940476 Hz   4:3     31.469 kHz     25.175000 MHz
    DMT 0x09:   800x600    60.316541 Hz   4:3     37.879 kHz     40.000000 MHz
    DMT 0x10:  1024x768    60.003840 Hz   4:3     48.363 kHz     65.000000 MHz
  Standard Timings:
    DMT 0x20:  1280x960    60.000000 Hz   4:3     60.000 kHz    108.000000 MHz
    DMT 0x23:  1280x1024   60.019740 Hz   5:4     63.981 kHz    108.000000 MHz
    DMT 0x2f:  1440x900    59.887445 Hz  16:10    55.935 kHz    106.500000 MHz
    DMT 0x33:  1600x1200   60.000000 Hz   4:3     75.000 kHz    162.000000 MHz
    DMT 0x3a:  1680x1050   59.954250 Hz  16:10    65.290 kHz    146.250000 MHz
    DMT 0x52:  1920x1080   60.000000 Hz  16:9     67.500 kHz    148.500000 MHz
  Detailed Timing Descriptors:
    DTD 1:  1920x1200   59.884600 Hz  16:10    74.556 kHz    193.250000 MHz (518 mm x 324 mm)
                 Hfront  136 Hsync 200 Hback  336 Hpol N
                 Vfront    3 Vsync   6 Vback   36 Vpol P
    Display Range Limits:
      Monitor ranges (GTF): 50-63 Hz V, 24-76 kHz H, max dotclock 200 MHz
    Display Product Name: 'LA2405'
    Display Product Serial Number: 'CN40200KW3'
Checksum: 0x67
