
EDID (hex):
00ffffffffffff0004722b014c414012
1815010380341d782aeed5a555489b26
125054bfef80714f810081809500950f
b300d1c00101023a801871382d40582c
450009252100001e000000fd00384b1e
5311000a202020202020000000fc0041
636572204732343548510a20000000ff
004c4b4b3057303134343330300a0080

Extracted contents:
header:          00 ff ff ff ff ff ff 00
serial number:   04 72 2b 01 4c 41 40 12 18 15
version:         01 03
basic params:    80 34 1d 78 2a
chroma info:     ee d5 a5 55 48 9b 26 12 50 54
established:     bf ef 80
standard:        71 4f 81 00 81 80 95 00 95 0f b3 00 d1 c0 01 01
descriptor 1:    02 3a 80 18 71 38 2d 40 58 2c 45 00 09 25 21 00 00 1e
descriptor 2:    00 00 00 fd 00 38 4b 1e 53 11 00 0a 20 20 20 20 20 20
descriptor 3:    00 00 00 fc 00 41 63 65 72 20 47 32 34 35 48 51 0a 20
descriptor 4:    00 00 00 ff 00 4c 4b 4b 30 57 30 31 34 34 33 30 30 0a
extensions:      00
checksum:        80

EDID version: 1.3
Manufacturer: ACR Model 12b Serial Number --
Made in week 24 of 2011
Digital display
Maximum image size: 52 cm x 29 cm
Gamma: 2.20
DPMS levels: Off
RGB color display
First detailed timing is preferred timing
Display x,y Chromaticity:
  Red:   0.6474, 0.3339
  Green: 0.2841, 0.6074
  Blue:  0.1513, 0.0712
  White: 0.3134, 0.3291
Established timings supported:
  720x400@70Hz 9:5 HorFreq: 31469 Hz Clock: 28.320 MHz
  640x480@60Hz 4:3 HorFreq: 31469 Hz Clock: 25.175 MHz
  640x480@67Hz 4:3 HorFreq: 35000 Hz Clock: 30.240 MHz
  640x480@72Hz 4:3 HorFreq: 37900 Hz Clock: 31.500 MHz
  640x480@75Hz 4:3 HorFreq: 37500 Hz Clock: 31.500 MHz
  800x600@56Hz 4:3 HorFreq: 35200 Hz Clock: 36.000 MHz
  800x600@60Hz 4:3 HorFreq: 37900 Hz Clock: 40.000 MHz
  800x600@72Hz 4:3 HorFreq: 48100 Hz Clock: 50.000 MHz
  800x600@75Hz 4:3 HorFreq: 46900 Hz Clock: 49.500 MHz
  832x624@75Hz 4:3 HorFreq: 49726 Hz Clock: 57.284 MHz
  1024x768@60Hz 4:3 HorFreq: 48400 Hz Clock: 65.000 MHz
  1024x768@70Hz 4:3 HorFreq: 56500 Hz Clock: 75.000 MHz
  1024x768@75Hz 4:3 HorFreq: 60000 Hz Clock: 78.750 MHz
  1280x1024@75Hz 5:4 HorFreq: 80000 Hz Clock: 135.000 MHz
  1152x870@75Hz 192:145 HorFreq: 67500 Hz Clock: 108.000 MHz
Standard timings supported:
  1152x864@75Hz 4:3 HorFreq: 67500 Hz Clock: 108.000 MHz
  1280x800@60Hz 16:10
  1280x1024@60Hz 5:4 HorFreq: 64000 Hz Clock: 108.000 MHz
  1440x900@60Hz 16:10 HorFreq: 55500 Hz Clock: 88.750 MHz
  1440x900@75Hz 16:10 HorFreq: 82300 Hz Clock: 156.000 MHz
  1680x1050@60Hz 16:10 HorFreq: 64700 Hz Clock: 119.000 MHz
  1920x1080@60Hz 16:9
Detailed mode: Clock 148.500 MHz, 521 mm x 293 mm
               1920 2008 2052 2200 hborder 0
               1080 1084 1089 1125 vborder 0
               +hsync +vsync 
               VertFreq: 60 Hz, HorFreq: 67500 Hz
Monitor ranges (GTF): 56-75Hz V, 30-83kHz H, max dotclock 170MHz
Monitor name: Acer G245HQ
Serial number: --
Checksum: 0x80 (valid)


