edid-decode (hex):

00 ff ff ff ff ff ff 00 34 a9 45 a0 62 34 00 55
22 10 01 03 80 00 00 78 0a da ff a3 58 4a a2 29
17 49 4b 00 00 00 01 01 01 01 01 01 01 01 01 01
01 01 01 01 01 01 01 1d 00 72 51 d0 1e 20 6e 28
55 00 98 06 32 00 00 1e 01 1d 80 18 71 1c 16 20
58 2c 25 00 98 06 32 00 00 9e 00 00 00 fc 00 50
41 4e 41 53 4f 4e 49 43 2d 54 56 20 00 00 00 fd
00 3b 3d 0f 44 0f 00 0a 20 20 20 20 20 20 01 f4

02 03 18 71 48 84 05 03 02 07 06 01 10 23 09 07
01 66 03 0c 00 20 00 80 8c 0a d0 8a 20 e0 2d 10
10 3e 96 00 98 06 32 00 00 18 8c 0a d0 8a 20 e0
2d 10 10 3e 96 00 b2 06 22 00 00 18 8c 0a a0 14
51 f0 16 00 26 7c 43 00 98 06 32 00 00 98 8c 0a
a0 14 51 f0 16 00 26 7c 43 00 b2 06 22 00 00 98
02 3a 80 18 71 38 2d 40 58 2c 45 00 98 06 32 00
00 1e 00 00 00 00 00 00 00 00 00 00 00 00 00 b2

00 ff ff ff ff ff ff 00 34 a9 45 a0 62 34 00 55
22 10 01 03 80 00 00 78 0a da ff a3 58 4a a2 29
17 49 4b 00 00 00 01 01 01 01 01 01 01 01 01 01
01 01 01 01 01 01 01 1d 00 72 51 d0 1e 20 6e 28
55 00 98 06 32 00 00 1e 01 1d 80 18 71 1c 16 20
58 2c 25 00 98 06 32 00 00 9e 00 00 00 fc 00 50
41 4e 41 53 4f 4e 49 43 2d 54 56 20 00 00 00 fd
00 3b 3d 0f 44 0f 00 0a 20 20 20 20 20 20 01 f4

02 03 18 71 48 84 05 03 02 07 06 01 10 23 09 07
01 66 03 0c 00 20 00 80 8c 0a d0 8a 20 e0 2d 10
10 3e 96 00 98 06 32 00 00 18 8c 0a d0 8a 20 e0
2d 10 10 3e 96 00 b2 06 22 00 00 18 8c 0a a0 14
51 f0 16 00 26 7c 43 00 98 06 32 00 00 98 8c 0a
a0 14 51 f0 16 00 26 7c 43 00 b2 06 22 00 00 98
02 3a 80 18 71 38 2d 40 58 2c 45 00 98 06 32 00
00 1e 00 00 00 00 00 00 00 00 00 00 00 00 00 b2

----------------

Block 0, Base EDID:
  EDID Structure Version & Revision: 1.3
  Vendor & Product Identification:
    Manufacturer: MEI
    Model: 41029
    Serial Number: ...
    Made in: week 34 of 2006
  Basic Display Parameters & Features:
    Digital display
    Image size is variable
    Gamma: 2.20
    RGB color display
    First detailed timing is the preferred timing
  Color Characteristics:
    Red  : 0.6396, 0.3447
    Green: 0.2910, 0.6347
    Blue : 0.1630, 0.0927
    White: 0.2880, 0.2958
  Established Timings I & II: none
  Standard Timings: none
  Detailed Timing Descriptors:
    DTD  1:  1280x720    60.000000 Hz  16:9     45.000 kHz     74.250000 MHz (920 mm x 518 mm)
                  Hfront  110 Hsync  40 Hback  220 Hpol P
                  Vfront    5 Vsync   5 Vback   20 Vpol P
    DTD  2:  1920x1080i  60.000000 Hz  16:9     33.750 kHz     74.250000 MHz (920 mm x 518 mm)
                  Hfront   88 Hsync  44 Hback  148 Hpol P
                  Vfront    2 Vsync   5 Vback   15 Vpol P Vfront +0.5 Odd Field
                  Vfront    2 Vsync   5 Vback   15 Vpol P Vback  +0.5 Even Field
    Display Product Name: 'PANASONIC-TV '
    Display Range Limits:
      Monitor ranges (GTF): 59-61 Hz V, 15-68 kHz H, max dotclock 150 MHz
  Extension blocks: 1
Checksum: 0xf4

----------------

Block 1, CTA-861 Extension Block:
  Revision: 3
  Basic audio support
  Supports YCbCr 4:4:4
  Supports YCbCr 4:2:2
  Native detailed modes: 1
  Video Data Block:
    VIC   4:  1280x720    60.000000 Hz  16:9     45.000 kHz     74.250000 MHz (native)
    VIC   5:  1920x1080i  60.000000 Hz  16:9     33.750 kHz     74.250000 MHz
    VIC   3:   720x480    59.940060 Hz  16:9     31.469 kHz     27.000000 MHz
    VIC   2:   720x480    59.940060 Hz   4:3     31.469 kHz     27.000000 MHz
    VIC   7:  1440x480i   59.940060 Hz  16:9     15.734 kHz     27.000000 MHz
    VIC   6:  1440x480i   59.940060 Hz   4:3     15.734 kHz     27.000000 MHz
    VIC   1:   640x480    59.940476 Hz   4:3     31.469 kHz     25.175000 MHz
    VIC  16:  1920x1080   60.000000 Hz  16:9     67.500 kHz    148.500000 MHz
  Audio Data Block:
    Linear PCM:
      Max channels: 2
      Supported sample rates (kHz): 48 44.1 32
      Supported sample sizes (bits): 16
  Vendor-Specific Data Block (HDMI), OUI 00-0C-03:
    Source physical address: 2.0.0.0
    Supports_AI
  Detailed Timing Descriptors:
    DTD  3:   720x480    59.940060 Hz   3:2     31.469 kHz     27.000000 MHz (920 mm x 518 mm)
                  Hfront   16 Hsync  62 Hback   60 Hpol N
                  Vfront    9 Vsync   6 Vback   30 Vpol N
    DTD  4:   720x480    59.940060 Hz   3:2     31.469 kHz     27.000000 MHz (690 mm x 518 mm)
                  Hfront   16 Hsync  62 Hback   60 Hpol N
                  Vfront    9 Vsync   6 Vback   30 Vpol N
    DTD  5:  1440x480i   59.940060 Hz   3:1     15.734 kHz     27.000000 MHz (920 mm x 518 mm)
                  Hfront   38 Hsync 124 Hback  114 Hpol N
                  Vfront    4 Vsync   3 Vback   15 Vpol N Vfront +0.5 Odd Field
                  Vfront    4 Vsync   3 Vback   15 Vpol N Vback  +0.5 Even Field
    DTD  6:  1440x480i   59.940060 Hz   3:1     15.734 kHz     27.000000 MHz (690 mm x 518 mm)
                  Hfront   38 Hsync 124 Hback  114 Hpol N
                  Vfront    4 Vsync   3 Vback   15 Vpol N Vfront +0.5 Odd Field
                  Vfront    4 Vsync   3 Vback   15 Vpol N Vback  +0.5 Even Field
    DTD  7:  1920x1080   60.000000 Hz  16:9     67.500 kHz    148.500000 MHz (920 mm x 518 mm)
                  Hfront   88 Hsync  44 Hback  148 Hpol P
                  Vfront    4 Vsync   5 Vback   36 Vpol P
Checksum: 0xb2  Unused space in Extension Block: 13 bytes

----------------

Block 2, Unknown EDID Extension Block 0x00:
  00 ff ff ff ff ff ff 00 34 a9 45 a0 62 34 00 55 '........4.E.b4.U'
  22 10 01 03 80 00 00 78 0a da ff a3 58 4a a2 29 '"......x....XJ.)'
  17 49 4b 00 00 00 01 01 01 01 01 01 01 01 01 01 '.IK.............'
  01 01 01 01 01 01 01 1d 00 72 51 d0 1e 20 6e 28 '.........rQ.. n('
  55 00 98 06 32 00 00 1e 01 1d 80 18 71 1c 16 20 'U...2.......q.. '
  58 2c 25 00 98 06 32 00 00 9e 00 00 00 fc 00 50 'X,%...2........P'
  41 4e 41 53 4f 4e 49 43 2d 54 56 20 00 00 00 fd 'ANASONIC-TV ....'
  00 3b 3d 0f 44 0f 00 0a 20 20 20 20 20 20 01 f4 '.;=.D...      ..'
Checksum: 0xf4

----------------

Block 3, CTA-861 Extension Block:
  Revision: 3
  Basic audio support
  Supports YCbCr 4:4:4
  Supports YCbCr 4:2:2
  Native detailed modes: 1
  Video Data Block:
    VIC   4:  1280x720    60.000000 Hz  16:9     45.000 kHz     74.250000 MHz (native)
    VIC   5:  1920x1080i  60.000000 Hz  16:9     33.750 kHz     74.250000 MHz
    VIC   3:   720x480    59.940060 Hz  16:9     31.469 kHz     27.000000 MHz
    VIC   2:   720x480    59.940060 Hz   4:3     31.469 kHz     27.000000 MHz
    VIC   7:  1440x480i   59.940060 Hz  16:9     15.734 kHz     27.000000 MHz
    VIC   6:  1440x480i   59.940060 Hz   4:3     15.734 kHz     27.000000 MHz
    VIC   1:   640x480    59.940476 Hz   4:3     31.469 kHz     25.175000 MHz
    VIC  16:  1920x1080   60.000000 Hz  16:9     67.500 kHz    148.500000 MHz
  Audio Data Block:
    Linear PCM:
      Max channels: 2
      Supported sample rates (kHz): 48 44.1 32
      Supported sample sizes (bits): 16
  Vendor-Specific Data Block (HDMI), OUI 00-0C-03:
    Source physical address: 2.0.0.0
    Supports_AI
  Detailed Timing Descriptors:
    DTD  8:   720x480    59.940060 Hz   3:2     31.469 kHz     27.000000 MHz (920 mm x 518 mm)
                  Hfront   16 Hsync  62 Hback   60 Hpol N
                  Vfront    9 Vsync   6 Vback   30 Vpol N
    DTD  9:   720x480    59.940060 Hz   3:2     31.469 kHz     27.000000 MHz (690 mm x 518 mm)
                  Hfront   16 Hsync  62 Hback   60 Hpol N
                  Vfront    9 Vsync   6 Vback   30 Vpol N
    DTD 10:  1440x480i   59.940060 Hz   3:1     15.734 kHz     27.000000 MHz (920 mm x 518 mm)
                  Hfront   38 Hsync 124 Hback  114 Hpol N
                  Vfront    4 Vsync   3 Vback   15 Vpol N Vfront +0.5 Odd Field
                  Vfront    4 Vsync   3 Vback   15 Vpol N Vback  +0.5 Even Field
    DTD 11:  1440x480i   59.940060 Hz   3:1     15.734 kHz     27.000000 MHz (690 mm x 518 mm)
                  Hfront   38 Hsync 124 Hback  114 Hpol N
                  Vfront    4 Vsync   3 Vback   15 Vpol N Vfront +0.5 Odd Field
                  Vfront    4 Vsync   3 Vback   15 Vpol N Vback  +0.5 Even Field
    DTD 12:  1920x1080   60.000000 Hz  16:9     67.500 kHz    148.500000 MHz (920 mm x 518 mm)
                  Hfront   88 Hsync  44 Hback  148 Hpol P
                  Vfront    4 Vsync   5 Vback   36 Vpol P
Checksum: 0xb2  Unused space in Extension Block: 13 bytes

----------------

Warnings:

Block 1, CTA-861 Extension Block:
  IT Video Formats are overscanned by default, but normally this should be underscanned.
  Add a Colorimetry Data Block with the sRGB colorimetry bit set to avoid interop issues.
Block 3, CTA-861 Extension Block:
  IT Video Formats are overscanned by default, but normally this should be underscanned.
  Add a Colorimetry Data Block with the sRGB colorimetry bit set to avoid interop issues.
EDID:
  CTA-861: Multiple native progressive timings are defined.

Failures:

Block 0, Base EDID:
  Display Product Name: One or more trailing spaces.
Block 1, CTA-861 Extension Block:
  Missing VCDB, needed for Set Selectable RGB Quantization to avoid interop issues.
Block 2, Base EDID:
  Unknown Extension Block.
Block 3, CTA-861 Extension Block:
  Video Data Block: Duplicate VIC 4.
  Video Data Block: Duplicate VIC 5.
  Video Data Block: Duplicate VIC 3.
  Video Data Block: Duplicate VIC 2.
  Video Data Block: Duplicate VIC 7.
  Video Data Block: Duplicate VIC 6.
  Video Data Block: Duplicate VIC 1.
  Video Data Block: Duplicate VIC 16.
  Missing VCDB, needed for Set Selectable RGB Quantization to avoid interop issues.
EDID:
  Base EDID: The DTD max image size is 920x518mm, but the display size is not specified anywhere.
  Base EDID: EDID specified 1 extension block(s), but found 3 extension block(s).
  Base EDID: EDID 1.3 requires a Block Map Extension in Block 1 if there are more than 2 blocks in the EDID.

EDID conformity: FAIL
