edid-decode (hex):

00 ff ff ff ff ff ff 00 32 0c 79 14 00 00 00 00
00 0f 01 02 80 21 15 78 0a 19 45 97 58 53 8b 28
24 50 54 00 00 00 01 01 01 01 01 01 01 01 01 01
01 01 01 01 01 01 a8 2f 90 e0 60 1a 10 40 20 40
13 00 4b cf 10 00 00 19 00 00 00 00 00 00 00 00
00 00 00 00 00 00 00 00 00 00 00 00 00 fe 00 4c
47 50 68 69 6c 69 70 73 4c 43 44 0a 00 00 00 fe
00 4c 50 31 35 34 57 30 32 2d 54 4c 30 39 00 95

----------------

Block 0, Base EDID:
  EDID Structure Version & Revision: 1.2
  Vendor & Product Identification:
    Manufacturer: LPL
    Model: 5241
    Made in: 2005
  Basic Display Parameters & Features:
    Digital display
    Maximum image size: 33 cm x 21 cm
    Gamma: 2.20
    RGB color display
    First detailed timing is the preferred timing
  Color Characteristics:
    Red  : 0.5898, 0.3447
    Green: 0.3261, 0.5439
    Blue : 0.1572, 0.1406
    White: 0.3134, 0.3291
  Established Timings I & II: none
  Standard Timings: none
  Detailed Timing Descriptors:
    DTD 1:  1680x1050   60.108471 Hz  16:10    64.076 kHz    122.000000 MHz (331 mm x 207 mm)
                 Hfront   32 Hsync  64 Hback  128 Hpol N
                 Vfront    1 Vsync   3 Vback   12 Vpol N
    Empty Descriptor
    Alphanumeric Data String: 'LGPhilipsLCD'
    Alphanumeric Data String: 'LP154W02-TL09'
Checksum: 0x95

----------------

Warnings:

Block 0, Base EDID:
  EDID Structure Version & Revision: EDID 1.2 is deprecated, do not use.

Failures:

Block 0, Base EDID:
  Empty Descriptor: Use Dummy Descriptor instead of all zeroes.

EDID conformity: FAIL
