edid-decode (hex):

00 ff ff ff ff ff ff 00 0c a1 00 00 00 00 00 00
2a 11 01 03 08 50 2d 78 0a 0d c9 a0 57 47 98 27
12 48 4c a3 08 00 31 40 45 40 61 40 4b c0 01 01
01 01 01 01 01 01 66 21 50 b0 51 00 1b 30 46 70
36 00 20 c2 31 00 00 1e 0e 1f 00 80 51 00 1e 30
46 80 37 00 20 c2 31 00 00 1c 00 00 00 fd 00 3b
3d 1e 31 09 00 0a 20 20 20 20 20 20 00 00 00 fc
00 44 54 56 2d 43 34 55 53 0a 20 20 20 20 00 36

----------------

Block 0, Base EDID:
  EDID Structure Version & Revision: 1.3
  Vendor & Product Identification:
    Manufacturer: CEA
    Model: 0
    Made in: week 42 of 2007
  Basic Display Parameters & Features:
    Analog display
    Input voltage level: 0.7/0.3 V
    Blank level equals black level
    Sync: Separate
    Maximum image size: 80 cm x 45 cm
    Gamma: 2.20
    RGB color display
    First detailed timing is the preferred timing
  Color Characteristics:
    Red  : 0.6250, 0.3398
    Green: 0.2802, 0.5947
    Blue : 0.1552, 0.0703
    White: 0.2832, 0.2978
  Established Timings I & II:
    IBM     :   720x400    70.081663 Hz   9:5     31.467 kHz     28.320000 MHz
    DMT 0x04:   640x480    59.940476 Hz   4:3     31.469 kHz     25.175000 MHz
    DMT 0x08:   800x600    56.250000 Hz   4:3     35.156 kHz     36.000000 MHz
    DMT 0x09:   800x600    60.316541 Hz   4:3     37.879 kHz     40.000000 MHz
    DMT 0x10:  1024x768    60.003840 Hz   4:3     48.363 kHz     65.000000 MHz
  Standard Timings:
    DMT 0x04:   640x480    59.940476 Hz   4:3     31.469 kHz     25.175000 MHz
    DMT 0x09:   800x600    60.316541 Hz   4:3     37.879 kHz     40.000000 MHz
    DMT 0x10:  1024x768    60.003840 Hz   4:3     48.363 kHz     65.000000 MHz
    GTF     :   848x477    60.000307 Hz  16:9     29.640 kHz     31.300000 MHz
  Detailed Timing Descriptors:
    DTD 1:  1360x768    60.015162 Hz  85:48    47.712 kHz     85.500000 MHz (800 mm x 450 mm)
                 Hfront   70 Hsync 112 Hback  250 Hpol P
                 Vfront    3 Vsync   6 Vback   18 Vpol P
    DTD 2:  1280x768    59.870228 Hz   5:3     47.776 kHz     79.500000 MHz (800 mm x 450 mm)
                 Hfront   70 Hsync 128 Hback  186 Hpol N
                 Vfront    3 Vsync   7 Vback   20 Vpol P
    Display Range Limits:
      Monitor ranges (GTF): 59-61 Hz V, 30-49 kHz H, max dotclock 90 MHz
    Display Product Name: 'DTV-C4US'
Checksum: 0x36

----------------

Warnings:

Block 0, Base EDID:
  Standard Timings: Standard Timing 848x477 has a dubious odd vertical resolution.
  Detailed Timing Descriptor #1: DTD is similar but not identical to DMT 0x27.
  Detailed Timing Descriptor #2: DTD is similar but not identical to DMT 0x17.

Failures:

EDID:
  Base EDID: Some timings are out of range of the Monitor Ranges:
    Vertical Freq: 56.250 - 70.082 Hz (Monitor: 59.000 - 61.000 Hz)

EDID conformity: FAIL
