
EDID (hex):
00ffffffffffff000ca1000000000000
2a11010308502d780a0dc9a057479827
12484ca308003140454061404bc00101
010101010101662150b051001b304670
360020c23100001e0e1f008051001e30
4680370020c23100001c000000fd003b
3d1e3109000a202020202020000000fc
0052533836410a2020202020202000bc

Extracted contents:
header:          00 ff ff ff ff ff ff 00
serial number:   0c a1 00 00 00 00 00 00 2a 11
version:         01 03
basic params:    08 50 2d 78 0a
chroma info:     0d c9 a0 57 47 98 27 12 48 4c
established:     a3 08 00
standard:        31 40 45 40 61 40 4b c0 01 01 01 01 01 01 01 01
descriptor 1:    66 21 50 b0 51 00 1b 30 46 70 36 00 20 c2 31 00 00 1e
descriptor 2:    0e 1f 00 80 51 00 1e 30 46 80 37 00 20 c2 31 00 00 1c
descriptor 3:    00 00 00 fd 00 3b 3d 1e 31 09 00 0a 20 20 20 20 20 20
descriptor 4:    00 00 00 fc 00 52 53 38 36 41 0a 20 20 20 20 20 20 20
extensions:      00
checksum:        bc

EDID version: 1.3
Manufacturer: CEA Model 0 Serial Number --
Made in week 42 of 2007
Analog display, Input voltage level: 0.7/0.3 V
Sync: Separate 
Maximum image size: 80 cm x 45 cm
Gamma: 2.20
RGB color display
First detailed timing is preferred timing
Display x,y Chromaticity:
  Red:   0.6250, 0.3398
  Green: 0.2802, 0.5947
  Blue:  0.1552, 0.0703
  White: 0.2832, 0.2978
Established timings supported:
  720x400@70Hz 9:5 HorFreq: 31469 Hz Clock: 28.320 MHz
  640x480@60Hz 4:3 HorFreq: 31469 Hz Clock: 25.175 MHz
  800x600@56Hz 4:3 HorFreq: 35200 Hz Clock: 36.000 MHz
  800x600@60Hz 4:3 HorFreq: 37900 Hz Clock: 40.000 MHz
  1024x768@60Hz 4:3 HorFreq: 48400 Hz Clock: 65.000 MHz
Standard timings supported:
  640x480@60Hz 4:3 HorFreq: 31469 Hz Clock: 25.175 MHz
  800x600@60Hz 4:3 HorFreq: 37900 Hz Clock: 40.000 MHz
  1024x768@60Hz 4:3 HorFreq: 48400 Hz Clock: 65.000 MHz
  848x477@60Hz 16:9
Detailed mode: Clock 85.500 MHz, 800 mm x 450 mm
               1360 1430 1542 1792 hborder 0
                768  771  777  795 vborder 0
               +hsync +vsync 
               VertFreq: 60 Hz, HorFreq: 47712 Hz
Detailed mode: Clock 79.500 MHz, 800 mm x 450 mm
               1280 1350 1478 1664 hborder 0
                768  771  778  798 vborder 0
               -hsync +vsync 
               VertFreq: 59 Hz, HorFreq: 47776 Hz
Monitor ranges (GTF): 59-61Hz V, 30-49kHz H, max dotclock 90MHz
Monitor name: RS86A
Checksum: 0xbc (valid)
One or more of the timings is out of range of the Monitor Ranges:
  Vertical Freq: 56 - 70 Hz
  Horizontal Freq: 31469 - 48400 Hz
  Maximum Clock: 85.500 MHz
