edid-decode (hex):

00 ff ff ff ff ff ff 00 0d ae 5c 17 00 00 00 00
16 1c 01 04 a5 26 15 78 02 ee 95 a3 54 4c 99 26
0f 50 54 00 00 00 01 01 01 01 01 01 01 01 01 01
01 01 01 01 01 01 9e 85 80 a0 70 38 3e 40 30 20
a5 00 7d d6 10 00 00 18 9e 85 80 a0 70 38 7c 46
30 20 a5 00 7d d6 10 00 00 18 00 00 00 fe 00 43
4d 4e 0a 20 20 20 20 20 20 20 20 20 00 00 00 fe
00 4e 31 37 33 48 43 45 2d 47 33 33 0a 20 00 48

----------------

Block 0, Base EDID:
  EDID Structure Version & Revision: 1.4
  Vendor & Product Identification:
    Manufacturer: CMN
    Model: 5980
    Made in: week 22 of 2018
  Basic Display Parameters & Features:
    Digital display
    Bits per primary color channel: 8
    DisplayPort interface
    Maximum image size: 38 cm x 21 cm
    Gamma: 2.20
    Supported color formats: RGB 4:4:4
    First detailed timing includes the native pixel format and preferred refresh rate
  Color Characteristics:
    Red  : 0.6396, 0.3300
    Green: 0.2998, 0.5996
    Blue : 0.1503, 0.0595
    White: 0.3134, 0.3291
  Established Timings I & II: none
  Standard Timings: none
  Detailed Timing Descriptors:
    DTD 1:  1920x1080  144.003435 Hz  16:9    164.452 kHz    342.060000 MHz (381 mm x 214 mm)
                 Hfront   48 Hsync  32 Hback   80 Hpol N
                 Vfront   10 Vsync   5 Vback   47 Vpol N
    DTD 2:  1920x1080   60.018950 Hz  16:9    164.452 kHz    342.060000 MHz (381 mm x 214 mm)
                 Hfront   48 Hsync  32 Hback   80 Hpol N
                 Vfront   10 Vsync   5 Vback 1645 Vpol N
    Alphanumeric Data String: 'CMN'
    Alphanumeric Data String: 'N173HCE-G33'
Checksum: 0x48

----------------

Warnings:

Block 0, Base EDID:
  Missing Display Product Name.

EDID conformity: PASS
