edid-decode (hex):

00 ff ff ff ff ff ff 00 21 63 0c 33 01 00 00 00
1e 17 01 03 08 5d 35 78 ea aa aa a0 54 46 98 24
0e 48 4c a1 08 00 81 80 01 01 01 01 01 01 01 01
01 01 01 01 01 01 66 21 50 b0 51 00 1b 30 40 70
36 00 b9 88 21 00 00 1e 00 00 00 fd 00 38 55 1f
4b 11 00 0a 20 20 20 20 20 20 00 00 00 fc 00 4c
45 33 32 42 37 30 30 30 43 0a 20 20 00 00 00 ff
00 53 4e 2d 30 30 30 30 30 30 30 30 31 0a 00 01

----------------

Block 0, Base EDID:
  EDID Structure Version & Revision: 1.3
  Vendor & Product Identification:
    Manufacturer: HKC
    Model: 13068
    Serial Number: ...
    Made in: week 30 of 2013
  Basic Display Parameters & Features:
    Analog display
    Input voltage level: 0.7/0.3 V
    Sync: Separate
    Maximum image size: 93 cm x 53 cm
    Gamma: 2.20
    DPMS levels: Standby Suspend Off
    RGB color display
    First detailed timing is preferred timing
  Color Characteristics:
    Red  : 0.6269, 0.3300
    Green: 0.2753, 0.5957
    Blue : 0.1425, 0.0566
    White: 0.2832, 0.2988
  Established Timings I & II:
    IBM     :   720x400    70.082 Hz   9:5    31.467 kHz  28.320 MHz
    DMT 0x04:   640x480    59.940 Hz   4:3    31.469 kHz  25.175 MHz
    DMT 0x09:   800x600    60.317 Hz   4:3    37.879 kHz  40.000 MHz
    DMT 0x10:  1024x768    60.004 Hz   4:3    48.363 kHz  65.000 MHz
  Standard Timings:
    DMT 0x23:  1280x1024   60.020 Hz   5:4    63.981 kHz 108.000 MHz
  Detailed Timing Descriptors:
    DTD 1:  1360x768    60.015 Hz  85:48   47.712 kHz  85.500 MHz (697 mm x 392 mm)
                 Hfront   64 Hsync 112 Hback 256 Hpol P
                 Vfront    3 Vsync   6 Vback  18 Vpol P
  Display Range Limits:
    Monitor ranges (GTF): 56-85 Hz V, 31-75 kHz H, max dotclock 170 MHz
    Display Product Name: 'LE32B7000C'
    Display Product Serial Number: ...
Checksum: 0x1
