
EDID (hex):
00ffffffffffff004e84010001000000
2e1a0104a51e17008600000000000000
000000adce0000000000000000000000
00000000000064190040410026301888
360004030000001800000010004c4344
20202020202020202020000000100000
000000000000000000000000000000fc
004c45440a0a0a0a0a0a0a0a0a0a0059

edid-decode (hex):

00 ff ff ff ff ff ff 00 4e 84 01 00 01 00 00 00
2e 1a 01 04 a5 1e 17 00 86 00 00 00 00 00 00 00
00 00 00 ad ce 00 00 00 00 00 00 00 00 00 00 00
00 00 00 00 00 00 64 19 00 40 41 00 26 30 18 88
36 00 04 03 00 00 00 18 00 00 00 10 00 4c 43 44
20 20 20 20 20 20 20 20 20 20 00 00 00 10 00 00
00 00 00 00 00 00 00 00 00 00 00 00 00 00 00 fc
00 4c 45 44 0a 0a 0a 0a 0a 0a 0a 0a 0a 0a 00 59

----------------

Block 0, Base EDID:
  EDID Structure Version & Revision: 1.4
  Vendor & Product Identification:
    Manufacturer: STD
    Model: 1
    Serial Number: 1
    Made in: week 46 of 2016
  Basic Display Parameters & Features:
    Digital display
    Bits per primary color channel: 8
    DisplayPort interface
    Maximum image size: 30 cm x 23 cm
    Gamma: 1.00
    DPMS levels: Standby
    Supported color formats: RGB 4:4:4
    Default (sRGB) color space is primary color space
    First detailed timing includes the native pixel format and preferred refresh rate
  Color Characteristics:
    Red  : 0.0000, 0.0000
    Green: 0.0000, 0.0000
    Blue : 0.0000, 0.0000
    White: 0.0000, 0.0000
  Established Timings I & II:
    IBM     :   720x400    70.081663 Hz   9:5     31.467 kHz     28.320000 MHz
    DMT 0x04:   640x480    59.940476 Hz   4:3     31.469 kHz     25.175000 MHz
    DMT 0x05:   640x480    72.808802 Hz   4:3     37.861 kHz     31.500000 MHz
    DMT 0x06:   640x480    75.000000 Hz   4:3     37.500 kHz     31.500000 MHz
    DMT 0x09:   800x600    60.316541 Hz   4:3     37.879 kHz     40.000000 MHz
    DMT 0x0a:   800x600    72.187572 Hz   4:3     48.077 kHz     50.000000 MHz
    DMT 0x0b:   800x600    75.000000 Hz   4:3     46.875 kHz     49.500000 MHz
    DMT 0x10:  1024x768    60.003840 Hz   4:3     48.363 kHz     65.000000 MHz
    DMT 0x11:  1024x768    70.069359 Hz   4:3     56.476 kHz     75.000000 MHz
    DMT 0x12:  1024x768    75.028582 Hz   4:3     60.023 kHz     78.750000 MHz
  Standard Timings:
  Detailed Timing Descriptors:
    DTD 1:  1024x768    60.003840 Hz   4:3     48.363 kHz     65.000000 MHz (4 mm x 3 mm)
                 Hfront   24 Hsync 136 Hback  160 Hpol N
                 Vfront    3 Vsync   6 Vback   29 Vpol N
    Dummy Descriptor:
    Dummy Descriptor:
    Display Product Name: 'LED'
Checksum: 0x59


