edid-decode (hex):

00 ff ff ff ff ff ff 00 0d ae 02 78 00 00 00 00
1e 1c 01 04 a5 19 11 78 02 53 d0 ac 52 49 a3 26
0f 4c 51 00 00 00 01 01 01 01 01 01 01 01 01 01
01 01 01 01 01 01 7a 50 70 a0 80 a0 28 50 30 20
3a 00 fe a9 00 00 00 18 00 00 00 00 00 00 00 00
00 00 00 00 00 00 00 00 00 00 00 00 00 00 00 00
00 00 00 00 00 00 00 00 00 00 00 00 00 00 00 fc
00 50 31 32 30 5a 44 47 2d 42 46 31 0a 0a 00 e1

00 ff ff ff ff ff ff 00 0d ae 02 78 00 00 00 00
1e 1c 01 04 a5 19 11 78 02 53 d0 ac 52 49 a3 26
0f 4c 51 00 00 00 01 01 01 01 01 01 01 01 01 01
01 01 01 01 01 01 7a 50 70 a0 80 a0 28 50 30 20
3a 00 fe a9 00 00 00 18 00 00 00 00 00 00 00 00
00 00 00 00 00 00 00 00 00 00 00 00 00 00 00 00
00 00 00 00 00 00 00 00 00 00 00 00 00 00 00 fc
00 50 31 32 30 5a 44 47 2d 42 46 31 0a 0a 00 e1

----------------

Block 0, Base EDID:
  EDID Structure Version & Revision: 1.4
  Vendor & Product Identification:
    Manufacturer: CMN
    Model: 30722
    Made in: week 30 of 2018
  Basic Display Parameters & Features:
    Digital display
    Bits per primary color channel: 8
    DisplayPort interface
    Maximum image size: 25 cm x 17 cm
    Gamma: 2.20
    Supported color formats: RGB 4:4:4
    First detailed timing includes the native pixel format and preferred refresh rate
  Color Characteristics:
    Red  : 0.6728, 0.3212
    Green: 0.2851, 0.6396
    Blue : 0.1513, 0.0595
    White: 0.2968, 0.3164
  Established Timings I & II: none
  Standard Timings: none
  Detailed Timing Descriptors:
    DTD 1:  2160x1440   60.001165 Hz   3:2     88.802 kHz    206.020000 MHz (254 mm x 169 mm)
                 Hfront   48 Hsync  32 Hback   80 Hpol N
                 Vfront    3 Vsync  10 Vback   27 Vpol N
    Empty Descriptor
    Empty Descriptor
    Display Product Name: 'P120ZDG-BF1'
Checksum: 0xe1

----------------

Block 1, Unknown EDID Extension Block 0x00:
  00 ff ff ff ff ff ff 00 0d ae 02 78 00 00 00 00 '...........x....'
  1e 1c 01 04 a5 19 11 78 02 53 d0 ac 52 49 a3 26 '.......x.S..RI.&'
  0f 4c 51 00 00 00 01 01 01 01 01 01 01 01 01 01 '.LQ.............'
  01 01 01 01 01 01 7a 50 70 a0 80 a0 28 50 30 20 '......zPp...(P0 '
  3a 00 fe a9 00 00 00 18 00 00 00 00 00 00 00 00 ':...............'
  00 00 00 00 00 00 00 00 00 00 00 00 00 00 00 00 '................'
  00 00 00 00 00 00 00 00 00 00 00 00 00 00 00 fc '................'
  00 50 31 32 30 5a 44 47 2d 42 46 31 0a 0a 00 e1 '.P120ZDG-BF1....'
Checksum: 0xe1

----------------

Failures:

Block 0, Base EDID:
  Empty Descriptor: Use Dummy Descriptor instead of all zeroes.
  Empty Descriptor: Use Dummy Descriptor instead of all zeroes.
  Display Product Name: Non-space after newline.
Block 1, Base EDID:
  Unknown Extension Block.
EDID:
  Base EDID: EDID specified 0 extension block(s), but found 1 extension block(s).

EDID conformity: FAIL
