
EDID (hex):
00ffffffffffff001ab3590877340600
1c1b0103802b1878eadaf5a455529f27
0e5054a56f80614f81c0818001010101
010101010101302a40c8608464301850
1300b2ec1000001e000000fd00374c1e
5311000a202020202020000000fc0045
3230542d37204c45440a2020000000ff
00595642423430363634370a20200067

Extracted contents:
header:          00 ff ff ff ff ff ff 00
serial number:   1a b3 59 08 77 34 06 00 1c 1b
version:         01 03
basic params:    80 2b 18 78 ea
chroma info:     da f5 a4 55 52 9f 27 0e 50 54
established:     a5 6f 80
standard:        61 4f 81 c0 81 80 01 01 01 01 01 01 01 01 01 01
descriptor 1:    30 2a 40 c8 60 84 64 30 18 50 13 00 b2 ec 10 00 00 1e
descriptor 2:    00 00 00 fd 00 37 4c 1e 53 11 00 0a 20 20 20 20 20 20
descriptor 3:    00 00 00 fc 00 45 32 30 54 2d 37 20 4c 45 44 0a 20 20
descriptor 4:    00 00 00 ff 00 59 56 42 42 34 30 36 36 34 37 0a 20 20
extensions:      00
checksum:        67

EDID version: 1.3
Manufacturer: FUS Model 859 Serial Number --
Made in week 28 of 2017
Digital display
Maximum image size: 43 cm x 24 cm
Gamma: 2.20
DPMS levels: Standby Suspend Off
RGB color display
First detailed timing is preferred timing
Display x,y Chromaticity:
  Red:   0.6435, 0.3330
  Green: 0.3222, 0.6230
  Blue:  0.1552, 0.0576
  White: 0.3134, 0.3291
Established timings supported:
  720x400@70Hz 9:5 HorFreq: 31469 Hz Clock: 28.320 MHz
  640x480@60Hz 4:3 HorFreq: 31469 Hz Clock: 25.175 MHz
  640x480@75Hz 4:3 HorFreq: 37500 Hz Clock: 31.500 MHz
  800x600@60Hz 4:3 HorFreq: 37900 Hz Clock: 40.000 MHz
  800x600@75Hz 4:3 HorFreq: 46900 Hz Clock: 49.500 MHz
  832x624@75Hz 4:3 HorFreq: 49726 Hz Clock: 57.284 MHz
  1024x768@60Hz 4:3 HorFreq: 48400 Hz Clock: 65.000 MHz
  1024x768@70Hz 4:3 HorFreq: 56500 Hz Clock: 75.000 MHz
  1024x768@75Hz 4:3 HorFreq: 60000 Hz Clock: 78.750 MHz
  1280x1024@75Hz 5:4 HorFreq: 80000 Hz Clock: 135.000 MHz
  1152x870@75Hz 192:145 HorFreq: 67500 Hz Clock: 108.000 MHz
Standard timings supported:
  1024x768@75Hz 4:3 HorFreq: 60000 Hz Clock: 78.750 MHz
  1280x720@60Hz 16:9
  1280x1024@60Hz 5:4 HorFreq: 64000 Hz Clock: 108.000 MHz
Detailed mode: Clock 108.000 MHz, 434 mm x 236 mm
               1600 1624 1704 1800 hborder 0
                900  901  904 1000 vborder 0
               +hsync +vsync 
               VertFreq: 60 Hz, HorFreq: 60000 Hz
Monitor ranges (GTF): 55-76Hz V, 30-83kHz H, max dotclock 170MHz
Monitor name: E20T-7 LED
Serial number: --
Checksum: 0x67 (valid)
