
EDID (hex):
00ffffffffffff001e6d085bda250300
031b0103803c2278ea3035a7554ea326
0f50542108007140818081c0a9c0d1c0
81000101010104740030f2705a80b058
8a0058542100001e565e00a0a0a02950
3020350058542100001a000000fd0038
3d1e871e000a202020202020000000fc
004c4720556c7472612048440a200187
02031d7146902205040301230907076d
030c001000b83c200060010203023a80
1871382d40582c450058542100001e00
0000ff003730334e5458523632323938
0a000000000000000000000000000000
00000000000000000000000000000000
00000000000000000000000000000000
00000000000000000000000000000090

Extracted contents:
header:          00 ff ff ff ff ff ff 00
serial number:   1e 6d 08 5b da 25 03 00 03 1b
version:         01 03
basic params:    80 3c 22 78 ea
chroma info:     30 35 a7 55 4e a3 26 0f 50 54
established:     21 08 00
standard:        71 40 81 80 81 c0 a9 c0 d1 c0 81 00 01 01 01 01
descriptor 1:    04 74 00 30 f2 70 5a 80 b0 58 8a 00 58 54 21 00 00 1e
descriptor 2:    56 5e 00 a0 a0 a0 29 50 30 20 35 00 58 54 21 00 00 1a
descriptor 3:    00 00 00 fd 00 38 3d 1e 87 1e 00 0a 20 20 20 20 20 20
descriptor 4:    00 00 00 fc 00 4c 47 20 55 6c 74 72 61 20 48 44 0a 20
extensions:      01
checksum:        87

EDID version: 1.3
Manufacturer: GSM Model 5b08 Serial Number --
Made in week 3 of 2017
Digital display
Maximum image size: 60 cm x 34 cm
Gamma: 2.20
DPMS levels: Standby Suspend Off
RGB color display
First detailed timing is preferred timing
Display x,y Chromaticity:
  Red:   0.6523, 0.3349
  Green: 0.3046, 0.6367
  Blue:  0.1484, 0.0615
  White: 0.3134, 0.3291
Established timings supported:
  640x480@60Hz 4:3 HorFreq: 31469 Hz Clock: 25.175 MHz
  800x600@60Hz 4:3 HorFreq: 37900 Hz Clock: 40.000 MHz
  1024x768@60Hz 4:3 HorFreq: 48400 Hz Clock: 65.000 MHz
Standard timings supported:
  1152x864@60Hz 4:3
  1280x1024@60Hz 5:4 HorFreq: 64000 Hz Clock: 108.000 MHz
  1280x720@60Hz 16:9
  1600x900@60Hz 16:9
  1920x1080@60Hz 16:9
  1280x800@60Hz 16:10
Detailed mode: Clock 297.000 MHz, 600 mm x 340 mm
               3840 4016 4104 4400 hborder 0
               2160 2168 2178 2250 vborder 0
               +hsync +vsync 
               VertFreq: 30 Hz, HorFreq: 67500 Hz
Detailed mode: Clock 241.500 MHz, 600 mm x 340 mm
               2560 2608 2640 2720 hborder 0
               1440 1443 1448 1481 vborder 0
               +hsync -vsync 
               VertFreq: 59 Hz, HorFreq: 88786 Hz
Monitor ranges (GTF): 56-61Hz V, 30-135kHz H, max dotclock 300MHz
Monitor name: LG Ultra HD
Has 1 extension blocks
Checksum: 0x87 (valid)

CTA extension block
Extension version: 3
25 bytes of CTA data
  Video data block
    VIC  16 1920x1080@60Hz 16:9 (native) HorFreq: 67500 Hz Clock: 148.500 MHz
    VIC  34 1920x1080@30Hz 16:9  HorFreq: 33750 Hz Clock: 74.250 MHz
    VIC   5 1920x1080i@60Hz 16:9  HorFreq: 33750 Hz Clock: 74.250 MHz
    VIC   4 1280x720@60Hz 16:9  HorFreq: 45000 Hz Clock: 74.250 MHz
    VIC   3 720x480@60Hz 16:9  HorFreq: 31469 Hz Clock: 27.000 MHz
    VIC   1 640x480@60Hz 4:3  HorFreq: 31469 Hz Clock: 25.175 MHz
  Audio data block
    Linear PCM, max channels 2
      Supported sample rates (kHz): 48 44.1 32
      Supported sample sizes (bits): 24 20 16
  Vendor-specific data block, OUI 000c03 (HDMI)
    Source physical address 1.0.0.0
    Supports_AI
    DC_36bit
    DC_30bit
    DC_Y444
    Maximum TMDS clock: 300MHz
    Extended HDMI video details:
      HDMI VIC 1 3840x2160@30Hz 16:9 HorFreq: 67500 Hz Clock: 297.000 MHz
      HDMI VIC 2 3840x2160@25Hz 16:9 HorFreq: 56250 Hz Clock: 297.000 MHz
      HDMI VIC 3 3840x2160@24Hz 16:9 HorFreq: 54000 Hz Clock: 297.000 MHz
Basic audio support
Supports YCbCr 4:4:4
Supports YCbCr 4:2:2
1 native detailed modes
Detailed mode: Clock 148.500 MHz, 600 mm x 340 mm
               1920 2008 2052 2200 hborder 0
               1080 1084 1089 1125 vborder 0
               +hsync +vsync 
               VertFreq: 60 Hz, HorFreq: 67500 Hz
Checksum: 0x90 (valid)

One or more of the timings is out of range of the Monitor Ranges:
  Vertical Freq: 24 - 60 Hz
  Horizontal Freq: 31469 - 88786 Hz
  Maximum Clock: 297.000 MHz
Warning: HDMI VIC Codes must have their CTA-861 VIC equivalents in the VSB


