
EDID (hex):
00ffffffffffff000469f116fc3c0200
1e1c010380221378ea82059256539529
245054bfee0081c00101010101010101
010101010101662156aa51001e30468f
330058c21000001e000000fd00324c1e
500f000a202020202020000000fc0041
5355532056543136380a2020000000ff
004a374c4d54463134363638340a00a2

Extracted contents:
header:          00 ff ff ff ff ff ff 00
serial number:   04 69 f1 16 fc 3c 02 00 1e 1c
version:         01 03
basic params:    80 22 13 78 ea
chroma info:     82 05 92 56 53 95 29 24 50 54
established:     bf ee 00
standard:        81 c0 01 01 01 01 01 01 01 01 01 01 01 01 01 01
descriptor 1:    66 21 56 aa 51 00 1e 30 46 8f 33 00 58 c2 10 00 00 1e
descriptor 2:    00 00 00 fd 00 32 4c 1e 50 0f 00 0a 20 20 20 20 20 20
descriptor 3:    00 00 00 fc 00 41 53 55 53 20 56 54 31 36 38 0a 20 20
descriptor 4:    00 00 00 ff 00 4a 37 4c 4d 54 46 31 34 36 36 38 34 0a
extensions:      00
checksum:        a2

EDID version: 1.3
Manufacturer: ACI Model 16f1 Serial Number --
Made in week 30 of 2018
Digital display
Maximum image size: 34 cm x 19 cm
Gamma: 2.20
DPMS levels: Standby Suspend Off
RGB color display
First detailed timing is preferred timing
Display x,y Chromaticity:
  Red:   0.5722, 0.3359
  Green: 0.3242, 0.5839
  Blue:  0.1601, 0.1406
  White: 0.3134, 0.3291
Established timings supported:
  720x400@70Hz 9:5 HorFreq: 31469 Hz Clock: 28.320 MHz
  640x480@60Hz 4:3 HorFreq: 31469 Hz Clock: 25.175 MHz
  640x480@67Hz 4:3 HorFreq: 35000 Hz Clock: 30.240 MHz
  640x480@72Hz 4:3 HorFreq: 37900 Hz Clock: 31.500 MHz
  640x480@75Hz 4:3 HorFreq: 37500 Hz Clock: 31.500 MHz
  800x600@56Hz 4:3 HorFreq: 35200 Hz Clock: 36.000 MHz
  800x600@60Hz 4:3 HorFreq: 37900 Hz Clock: 40.000 MHz
  800x600@72Hz 4:3 HorFreq: 48100 Hz Clock: 50.000 MHz
  800x600@75Hz 4:3 HorFreq: 46900 Hz Clock: 49.500 MHz
  832x624@75Hz 4:3 HorFreq: 49726 Hz Clock: 57.284 MHz
  1024x768@60Hz 4:3 HorFreq: 48400 Hz Clock: 65.000 MHz
  1024x768@70Hz 4:3 HorFreq: 56500 Hz Clock: 75.000 MHz
  1024x768@75Hz 4:3 HorFreq: 60000 Hz Clock: 78.750 MHz
Standard timings supported:
  1280x720@60Hz 16:9
Detailed mode: Clock 85.500 MHz, 344 mm x 194 mm
               1366 1436 1579 1792 hborder 0
                768  771  774  798 vborder 0
               +hsync +vsync 
               VertFreq: 59 Hz, HorFreq: 47712 Hz
Monitor ranges (GTF): 50-76Hz V, 30-80kHz H, max dotclock 150MHz
Monitor name: ASUS VT168
Serial number: --
Checksum: 0xa2 (valid)
