edid-decode (hex):

00 ff ff ff ff ff ff 00 08 59 50 00 00 00 00 00
26 1e 01 03 80 5e 35 78 0a 36 77 a3 57 51 9d 26
0d 47 4b af ce 00 81 c0 81 00 81 0f 81 40 81 80
95 00 b3 00 01 01 02 3a 80 18 71 38 2d 40 58 2c
45 00 3f 43 21 00 00 1a a9 1a 00 a0 50 00 16 30
30 20 37 00 c4 8e 21 00 00 1a 00 00 00 fc 00 4e
53 2d 34 33 44 34 32 30 4e 41 32 30 00 00 00 fd
00 38 4b 20 44 11 00 0a 20 20 20 20 20 20 01 0a

02 03 20 71 4c 90 03 04 05 12 13 14 1f 20 07 16
01 26 15 07 50 09 07 01 67 03 0c 00 30 00 00 1e
01 1d 00 83 51 00 00 20 6e 28 55 00 c4 8e 21 00
00 1e 01 1d 80 18 71 1c 16 20 58 2c 25 00 c4 8e
21 00 00 9e 8c 0a d0 8a 20 e0 2d 10 10 3e 96 00
c4 8e 21 00 00 18 01 1d 80 3e 73 38 2d 40 7e 2c
45 80 c4 8e 21 00 00 1e 1a 36 80 a0 70 38 1f 40
30 20 25 00 c4 8e 21 00 00 1a 00 00 00 00 00 bb

00 ff ff ff ff ff ff 00 08 59 50 00 00 00 00 00
26 1e 01 03 80 5e 35 78 0a 36 77 a3 57 51 9d 26
0d 47 4b af ce 00 81 c0 81 00 81 0f 81 40 81 80
95 00 b3 00 01 01 02 3a 80 18 71 38 2d 40 58 2c
45 00 3f 43 21 00 00 1a a9 1a 00 a0 50 00 16 30
30 20 37 00 c4 8e 21 00 00 1a 00 00 00 fc 00 4e
53 2d 34 33 44 34 32 30 4e 41 32 30 00 00 00 fd
00 38 4b 20 44 11 00 0a 20 20 20 20 20 20 01 0a

02 03 20 71 4c 90 03 04 05 12 13 14 1f 20 07 16
01 26 15 07 50 09 07 01 67 03 0c 00 30 00 00 1e
01 1d 00 83 51 00 00 20 6e 28 55 00 c4 8e 21 00
00 1e 01 1d 80 18 71 1c 16 20 58 2c 25 00 c4 8e
21 00 00 9e 8c 0a d0 8a 20 e0 2d 10 10 3e 96 00
c4 8e 21 00 00 18 01 1d 80 3e 73 38 2d 40 7e 2c
45 80 c4 8e 21 00 00 1e 1a 36 80 a0 70 38 1f 40
30 20 25 00 c4 8e 21 00 00 1a 00 00 00 00 00 bb

----------------

Block 0, Base EDID:
  EDID Structure Version & Revision: 1.3
  Vendor & Product Identification:
    Manufacturer: BBY
    Model: 80
    Made in: week 38 of 2020
  Basic Display Parameters & Features:
    Digital display
    Maximum image size: 94 cm x 53 cm
    Gamma: 2.20
    RGB color display
    First detailed timing is the preferred timing
  Color Characteristics:
    Red  : 0.6367, 0.3427
    Green: 0.3173, 0.6152
    Blue : 0.1494, 0.0537
    White: 0.2783, 0.2958
  Established Timings I & II:
    IBM     :   720x400    70.081663 Hz   9:5     31.467 kHz     28.320000 MHz
    DMT 0x04:   640x480    59.940476 Hz   4:3     31.469 kHz     25.175000 MHz
    DMT 0x05:   640x480    72.808802 Hz   4:3     37.861 kHz     31.500000 MHz
    DMT 0x06:   640x480    75.000000 Hz   4:3     37.500 kHz     31.500000 MHz
    DMT 0x08:   800x600    56.250000 Hz   4:3     35.156 kHz     36.000000 MHz
    DMT 0x09:   800x600    60.316541 Hz   4:3     37.879 kHz     40.000000 MHz
    DMT 0x0a:   800x600    72.187572 Hz   4:3     48.077 kHz     50.000000 MHz
    DMT 0x0b:   800x600    75.000000 Hz   4:3     46.875 kHz     49.500000 MHz
    DMT 0x10:  1024x768    60.003840 Hz   4:3     48.363 kHz     65.000000 MHz
    DMT 0x11:  1024x768    70.069359 Hz   4:3     56.476 kHz     75.000000 MHz
    DMT 0x12:  1024x768    75.028582 Hz   4:3     60.023 kHz     78.750000 MHz
  Standard Timings:
    DMT 0x55:  1280x720    60.000000 Hz  16:9     45.000 kHz     74.250000 MHz
    DMT 0x1c:  1280x800    59.810326 Hz  16:10    49.702 kHz     83.500000 MHz
    DMT 0x1d:  1280x800    74.934142 Hz  16:10    62.795 kHz    106.500000 MHz
    DMT 0x20:  1280x960    60.000000 Hz   4:3     60.000 kHz    108.000000 MHz
    DMT 0x23:  1280x1024   60.019740 Hz   5:4     63.981 kHz    108.000000 MHz
    DMT 0x2f:  1440x900    59.887445 Hz  16:10    55.935 kHz    106.500000 MHz
    DMT 0x3a:  1680x1050   59.954250 Hz  16:10    65.290 kHz    146.250000 MHz
  Detailed Timing Descriptors:
    DTD  1:  1920x1080   60.000000 Hz  16:9     67.500 kHz    148.500000 MHz (575 mm x 323 mm)
                  Hfront   88 Hsync  44 Hback  148 Hpol P
                  Vfront    4 Vsync   5 Vback   36 Vpol N
    DTD  2:  1280x768    59.994726 Hz   5:3     47.396 kHz     68.250000 MHz (708 mm x 398 mm)
                  Hfront   48 Hsync  32 Hback   80 Hpol P
                  Vfront    3 Vsync   7 Vback   12 Vpol N
    Display Product Name: 'NS-43D420NA20'
    Display Range Limits:
      Monitor ranges (GTF): 56-75 Hz V, 32-68 kHz H, max dotclock 170 MHz
  Extension blocks: 1
Checksum: 0x0a

----------------

Block 1, CTA-861 Extension Block:
  Revision: 3
  Basic audio support
  Supports YCbCr 4:4:4
  Supports YCbCr 4:2:2
  Native detailed modes: 1
  Video Data Block:
    VIC  16:  1920x1080   60.000000 Hz  16:9     67.500 kHz    148.500000 MHz (native)
    VIC   3:   720x480    59.940060 Hz  16:9     31.469 kHz     27.000000 MHz
    VIC   4:  1280x720    60.000000 Hz  16:9     45.000 kHz     74.250000 MHz
    VIC   5:  1920x1080i  60.000000 Hz  16:9     33.750 kHz     74.250000 MHz
    VIC  18:   720x576    50.000000 Hz  16:9     31.250 kHz     27.000000 MHz
    VIC  19:  1280x720    50.000000 Hz  16:9     37.500 kHz     74.250000 MHz
    VIC  20:  1920x1080i  50.000000 Hz  16:9     28.125 kHz     74.250000 MHz
    VIC  31:  1920x1080   50.000000 Hz  16:9     56.250 kHz    148.500000 MHz
    VIC  32:  1920x1080   24.000000 Hz  16:9     27.000 kHz     74.250000 MHz
    VIC   7:  1440x480i   59.940060 Hz  16:9     15.734 kHz     27.000000 MHz
    VIC  22:  1440x576i   50.000000 Hz  16:9     15.625 kHz     27.000000 MHz
    VIC   1:   640x480    59.940476 Hz   4:3     31.469 kHz     25.175000 MHz
  Audio Data Block:
    AC-3:
      Max channels: 6
      Supported sample rates (kHz): 48 44.1 32
      Maximum bit rate: 640 kb/s
    Linear PCM:
      Max channels: 2
      Supported sample rates (kHz): 48 44.1 32
      Supported sample sizes (bits): 16
  Vendor-Specific Data Block (HDMI), OUI 00-0C-03:
    Source physical address: 3.0.0.0
    Maximum TMDS clock: 150 MHz
  Detailed Timing Descriptors:
    DTD  3:  1280x512    86.994320 Hz   5:2     44.541 kHz     74.250000 MHz (708 mm x 398 mm)
                  Hfront  110 Hsync  40 Hback  237 Hpol P
                  Vfront    5 Vsync   5 Vback  -10 Vpol P
                   01 1d 00 83 51 00 00 20 6e 28 55 00 c4 8e 21 00 00 1e '....Q.. n(U...!...'
    DTD  4:  1920x1080i  60.000000 Hz  16:9     33.750 kHz     74.250000 MHz (708 mm x 398 mm)
                  Hfront   88 Hsync  44 Hback  148 Hpol P
                  Vfront    2 Vsync   5 Vback   15 Vpol P Vfront +0.5 Odd Field
                  Vfront    2 Vsync   5 Vback   15 Vpol P Vback  +0.5 Even Field
    DTD  5:   720x480    59.940060 Hz   3:2     31.469 kHz     27.000000 MHz (708 mm x 398 mm)
                  Hfront   16 Hsync  62 Hback   60 Hpol N
                  Vfront    9 Vsync   6 Vback   30 Vpol N
    DTD  6:  1920x1080   24.000000 Hz  16:9     27.000 kHz     74.250000 MHz (708 mm x 398 mm)
                  Hfront  638 Hsync  44 Hback  148 Hpol P
                  Vfront    4 Vsync   5 Vback   36 Vpol P
    DTD  7:  1920x1080   59.933878 Hz  16:9     66.587 kHz    138.500000 MHz (708 mm x 398 mm)
                  Hfront   48 Hsync  32 Hback   80 Hpol P
                  Vfront    2 Vsync   5 Vback   24 Vpol N
Checksum: 0xbb  Unused space in Extension Block: 5 bytes

----------------

Block 2, Unknown EDID Extension Block 0x00:
  00 ff ff ff ff ff ff 00 08 59 50 00 00 00 00 00 '.........YP.....'
  26 1e 01 03 80 5e 35 78 0a 36 77 a3 57 51 9d 26 '&....^5x.6w.WQ.&'
  0d 47 4b af ce 00 81 c0 81 00 81 0f 81 40 81 80 '.GK..........@..'
  95 00 b3 00 01 01 02 3a 80 18 71 38 2d 40 58 2c '.......:..q8-@X,'
  45 00 3f 43 21 00 00 1a a9 1a 00 a0 50 00 16 30 'E.?C!.......P..0'
  30 20 37 00 c4 8e 21 00 00 1a 00 00 00 fc 00 4e '0 7...!........N'
  53 2d 34 33 44 34 32 30 4e 41 32 30 00 00 00 fd 'S-43D420NA20....'
  00 38 4b 20 44 11 00 0a 20 20 20 20 20 20 01 0a '.8K D...      ..'
Checksum: 0x0a

----------------

Block 3, CTA-861 Extension Block:
  Revision: 3
  Basic audio support
  Supports YCbCr 4:4:4
  Supports YCbCr 4:2:2
  Native detailed modes: 1
  Video Data Block:
    VIC  16:  1920x1080   60.000000 Hz  16:9     67.500 kHz    148.500000 MHz (native)
    VIC   3:   720x480    59.940060 Hz  16:9     31.469 kHz     27.000000 MHz
    VIC   4:  1280x720    60.000000 Hz  16:9     45.000 kHz     74.250000 MHz
    VIC   5:  1920x1080i  60.000000 Hz  16:9     33.750 kHz     74.250000 MHz
    VIC  18:   720x576    50.000000 Hz  16:9     31.250 kHz     27.000000 MHz
    VIC  19:  1280x720    50.000000 Hz  16:9     37.500 kHz     74.250000 MHz
    VIC  20:  1920x1080i  50.000000 Hz  16:9     28.125 kHz     74.250000 MHz
    VIC  31:  1920x1080   50.000000 Hz  16:9     56.250 kHz    148.500000 MHz
    VIC  32:  1920x1080   24.000000 Hz  16:9     27.000 kHz     74.250000 MHz
    VIC   7:  1440x480i   59.940060 Hz  16:9     15.734 kHz     27.000000 MHz
    VIC  22:  1440x576i   50.000000 Hz  16:9     15.625 kHz     27.000000 MHz
    VIC   1:   640x480    59.940476 Hz   4:3     31.469 kHz     25.175000 MHz
  Audio Data Block:
    AC-3:
      Max channels: 6
      Supported sample rates (kHz): 48 44.1 32
      Maximum bit rate: 640 kb/s
    Linear PCM:
      Max channels: 2
      Supported sample rates (kHz): 48 44.1 32
      Supported sample sizes (bits): 16
  Vendor-Specific Data Block (HDMI), OUI 00-0C-03:
    Source physical address: 3.0.0.0
    Maximum TMDS clock: 150 MHz
  Detailed Timing Descriptors:
    DTD  8:  1280x512    86.994320 Hz   5:2     44.541 kHz     74.250000 MHz (708 mm x 398 mm)
                  Hfront  110 Hsync  40 Hback  237 Hpol P
                  Vfront    5 Vsync   5 Vback  -10 Vpol P
                   01 1d 00 83 51 00 00 20 6e 28 55 00 c4 8e 21 00 00 1e '....Q.. n(U...!...'
    DTD  9:  1920x1080i  60.000000 Hz  16:9     33.750 kHz     74.250000 MHz (708 mm x 398 mm)
                  Hfront   88 Hsync  44 Hback  148 Hpol P
                  Vfront    2 Vsync   5 Vback   15 Vpol P Vfront +0.5 Odd Field
                  Vfront    2 Vsync   5 Vback   15 Vpol P Vback  +0.5 Even Field
    DTD 10:   720x480    59.940060 Hz   3:2     31.469 kHz     27.000000 MHz (708 mm x 398 mm)
                  Hfront   16 Hsync  62 Hback   60 Hpol N
                  Vfront    9 Vsync   6 Vback   30 Vpol N
    DTD 11:  1920x1080   24.000000 Hz  16:9     27.000 kHz     74.250000 MHz (708 mm x 398 mm)
                  Hfront  638 Hsync  44 Hback  148 Hpol P
                  Vfront    4 Vsync   5 Vback   36 Vpol P
    DTD 12:  1920x1080   59.933878 Hz  16:9     66.587 kHz    138.500000 MHz (708 mm x 398 mm)
                  Hfront   48 Hsync  32 Hback   80 Hpol P
                  Vfront    2 Vsync   5 Vback   24 Vpol N
Checksum: 0xbb  Unused space in Extension Block: 5 bytes

----------------

Warnings:

Block 0, Base EDID:
  Detailed Timing Descriptor #1: DTD is similar but not identical to VIC 16.
Block 1, CTA-861 Extension Block:
  IT Video Formats are overscanned by default, but normally this should be underscanned.
  Add a Colorimetry Data Block with the sRGB colorimetry bit set to avoid interop issues.
Block 3, CTA-861 Extension Block:
  IT Video Formats are overscanned by default, but normally this should be underscanned.
  Add a Colorimetry Data Block with the sRGB colorimetry bit set to avoid interop issues.
EDID:
  CTA-861: Multiple native progressive timings are defined.

Failures:

Block 0, Base EDID:
  Detailed Timing Descriptor #1: Mismatch of image size 575x323 mm vs display size 940x530 mm.
  Detailed Timing Descriptor #2: Mismatch of image size 708x398 mm vs display size 940x530 mm.
Block 1, CTA-861 Extension Block:
  Detailed Timing Descriptor #3: 0 values in the video timing:
    Horizontal Active/Blanking 1280/387
    Horizontal Frontporch/Sync Width 110/40
    Vertical Active/Blanking 512/0
    Vertical Frontporch/Sync Width 5/5
  Detailed Timing Descriptor #3: 0 or negative vertical back porch.
  Detailed Timing Descriptor #3: Mismatch of image size 708x398 mm vs display size 940x530 mm.
  Detailed Timing Descriptor #4: Mismatch of image size 708x398 mm vs display size 940x530 mm.
  Detailed Timing Descriptor #5: Mismatch of image size 708x398 mm vs display size 940x530 mm.
  Detailed Timing Descriptor #6: Mismatch of image size 708x398 mm vs display size 940x530 mm.
  Detailed Timing Descriptor #7: Mismatch of image size 708x398 mm vs display size 940x530 mm.
  Missing VCDB, needed for Set Selectable RGB Quantization to avoid interop issues.
Block 2, Base EDID:
  Unknown Extension Block.
Block 3, CTA-861 Extension Block:
  Video Data Block: Duplicate VIC 16.
  Video Data Block: Duplicate VIC 3.
  Video Data Block: Duplicate VIC 4.
  Video Data Block: Duplicate VIC 5.
  Video Data Block: Duplicate VIC 18.
  Video Data Block: Duplicate VIC 19.
  Video Data Block: Duplicate VIC 20.
  Video Data Block: Duplicate VIC 31.
  Video Data Block: Duplicate VIC 32.
  Video Data Block: Duplicate VIC 7.
  Video Data Block: Duplicate VIC 22.
  Video Data Block: Duplicate VIC 1.
  Detailed Timing Descriptor #8: 0 values in the video timing:
    Horizontal Active/Blanking 1280/387
    Horizontal Frontporch/Sync Width 110/40
    Vertical Active/Blanking 512/0
    Vertical Frontporch/Sync Width 5/5
  Detailed Timing Descriptor #8: 0 or negative vertical back porch.
  Detailed Timing Descriptor #8: Mismatch of image size 708x398 mm vs display size 940x530 mm.
  Detailed Timing Descriptor #9: Mismatch of image size 708x398 mm vs display size 940x530 mm.
  Detailed Timing Descriptor #10: Mismatch of image size 708x398 mm vs display size 940x530 mm.
  Detailed Timing Descriptor #11: Mismatch of image size 708x398 mm vs display size 940x530 mm.
  Detailed Timing Descriptor #12: Mismatch of image size 708x398 mm vs display size 940x530 mm.
  Missing VCDB, needed for Set Selectable RGB Quantization to avoid interop issues.
EDID:
  Base EDID: Some timings are out of range of the Monitor Ranges:
    Vertical Freq: 24.000 - 86.994 Hz (Monitor: 56.000 - 75.000 Hz)
    Horizontal Freq: 15.625 - 67.500 kHz (Monitor: 32.000 - 68.000 kHz)
  Base EDID: EDID specified 1 extension block(s), but found 3 extension block(s).
  Base EDID: EDID 1.3 requires a Block Map Extension in Block 1 if there are more than 2 blocks in the EDID.

EDID conformity: FAIL
