edid-decode (hex):

00 ff ff ff ff ff ff 00 30 64 07 03 01 01 01 01
32 11 01 03 80 1d 12 78 0a a6 86 95 56 52 86 28
28 52 55 00 00 00 01 01 01 01 01 01 01 01 01 01
01 01 01 01 01 01 9e 20 00 90 51 20 1f 30 48 80
36 00 1f b4 10 00 00 18 00 00 00 0f 00 39 40 2e
64 01 04 02 0b 5a 6e 05 0f 00 00 00 00 fe 00 54
4d 44 49 53 50 4c 41 59 0a 20 20 20 00 00 00 fe
00 4c 54 44 31 33 33 45 57 4d 5a 0a 20 20 00 c2

----------------

Block 0, Base EDID:
  EDID Structure Version & Revision: 1.3
  Vendor & Product Identification:
    Manufacturer: LCD
    Model: 775
    Serial Number: ...
    Made in: week 50 of 2007
  Basic Display Parameters & Features:
    Digital display
    Maximum image size: 29 cm x 18 cm
    Gamma: 2.20
    RGB color display
    First detailed timing is the preferred timing
  Color Characteristics:
    Red  : 0.5839, 0.3378
    Green: 0.3212, 0.5253
    Blue : 0.1582, 0.1562
    White: 0.3212, 0.3339
  Established Timings I & II: none
  Standard Timings: none
  Detailed Timing Descriptors:
    DTD 1:  1280x800    59.810326 Hz  16:10    49.702 kHz     83.500000 MHz (287 mm x 180 mm)
                 Hfront   72 Hsync 128 Hback  200 Hpol N
                 Vfront    3 Vsync   6 Vback   22 Vpol N
    Manufacturer-Specified Display Descriptor (0x0f): 00 0f 00 39 40 2e 64 01 04 02 0b 5a 6e 05 0f 00 '...9@.d....Zn...'
    Alphanumeric Data String: 'TMDISPLAY'
    Alphanumeric Data String: 'LTD133EWMZ'
Checksum: 0xc2

----------------

Warnings:

Block 0, Base EDID:
  Detailed Timing Descriptor #1: DTD is similar but not identical to DMT 0x1c.

Failures:

Block 0, Base EDID:
  Missing Display Product Name.
  Missing Display Range Limits Descriptor.

EDID conformity: FAIL
