
EDID (hex):
00ffffffffffff004c2d2c0d4d535a42
1b1e010380341d782a5295a556549d25
0e5054bb8c00b30081c0810081809500
a9c001010101023a801871382d40582c
450009252100001e000000fd0030481e
5216000a202020202020000000fc0043
3234463339300a2020202020000000ff
0048345a4e3730323732380a20200141
020324f14690041f1312032309070783
01000067030c001000802b681a000001
01304800011d00bc52d01e20b8285540
09252100001e8c0ad090204031200c40
55000925210000188c0ad08a20e02d10
103e9600092521000018215280a07238
304088c8350009252100001c00000000
000000000000000000000000000000fa

Extracted contents:
header:          00 ff ff ff ff ff ff 00
serial number:   4c 2d 2c 0d 4d 53 5a 42 1b 1e
version:         01 03
basic params:    80 34 1d 78 2a
chroma info:     52 95 a5 56 54 9d 25 0e 50 54
established:     bb 8c 00
standard:        b3 00 81 c0 81 00 81 80 95 00 a9 c0 01 01 01 01
descriptor 1:    02 3a 80 18 71 38 2d 40 58 2c 45 00 09 25 21 00 00 1e
descriptor 2:    00 00 00 fd 00 30 48 1e 52 16 00 0a 20 20 20 20 20 20
descriptor 3:    00 00 00 fc 00 43 32 34 46 33 39 30 0a 20 20 20 20 20
descriptor 4:    00 00 00 ff 00 48 34 5a 4e 37 30 32 37 32 38 0a 20 20
extensions:      01
checksum:        41

EDID version: 1.3
Manufacturer: SAM Model d2c Serial Number --
Made in week 27 of 2020
Digital display
Maximum image size: 52 cm x 29 cm
Gamma: 2.20
DPMS levels: Off
RGB color display
First detailed timing is preferred timing
Display x,y Chromaticity:
  Red:   0.6455, 0.3369
  Green: 0.3281, 0.6152
  Blue:  0.1464, 0.0556
  White: 0.3134, 0.3291
Established timings supported:
  720x400@70Hz 9:5 HorFreq: 31469 Hz Clock: 28.320 MHz
  640x480@60Hz 4:3 HorFreq: 31469 Hz Clock: 25.175 MHz
  640x480@67Hz 4:3 HorFreq: 35000 Hz Clock: 30.240 MHz
  640x480@72Hz 4:3 HorFreq: 37900 Hz Clock: 31.500 MHz
  800x600@56Hz 4:3 HorFreq: 35200 Hz Clock: 36.000 MHz
  800x600@60Hz 4:3 HorFreq: 37900 Hz Clock: 40.000 MHz
  800x600@72Hz 4:3 HorFreq: 48100 Hz Clock: 50.000 MHz
  1024x768@60Hz 4:3 HorFreq: 48400 Hz Clock: 65.000 MHz
  1024x768@70Hz 4:3 HorFreq: 56500 Hz Clock: 75.000 MHz
Standard timings supported:
  1680x1050@60Hz 16:10 HorFreq: 64700 Hz Clock: 119.000 MHz
  1280x720@60Hz 16:9
  1280x800@60Hz 16:10
  1280x1024@60Hz 5:4 HorFreq: 64000 Hz Clock: 108.000 MHz
  1440x900@60Hz 16:10 HorFreq: 55500 Hz Clock: 88.750 MHz
  1600x900@60Hz 16:9
Detailed mode: Clock 148.500 MHz, 521 mm x 293 mm
               1920 2008 2052 2200 hborder 0
               1080 1084 1089 1125 vborder 0
               +hsync +vsync 
               VertFreq: 60 Hz, HorFreq: 67500 Hz
Monitor ranges (GTF): 48-72Hz V, 30-82kHz H, max dotclock 220MHz
Monitor name: C24F390
Serial number: --
Has 1 extension blocks
Checksum: 0x41 (valid)

CTA extension block
Extension version: 3
32 bytes of CTA data
  Video data block
    VIC  16 1920x1080@60Hz 16:9 (native) HorFreq: 67500 Hz Clock: 148.500 MHz
    VIC   4 1280x720@60Hz 16:9  HorFreq: 45000 Hz Clock: 74.250 MHz
    VIC  31 1920x1080@50Hz 16:9  HorFreq: 56250 Hz Clock: 148.500 MHz
    VIC  19 1280x720@50Hz 16:9  HorFreq: 37500 Hz Clock: 74.250 MHz
    VIC  18 720x576@50Hz 16:9  HorFreq: 31250 Hz Clock: 27.000 MHz
    VIC   3 720x480@60Hz 16:9  HorFreq: 31469 Hz Clock: 27.000 MHz
  Audio data block
    Linear PCM, max channels 2
      Supported sample rates (kHz): 48 44.1 32
      Supported sample sizes (bits): 24 20 16
  Speaker allocation data block
    Speaker map:
      FL/FR - Front Left/Right
  Vendor-specific data block, OUI 000c03 (HDMI)
    Source physical address 1.0.0.0
    Supports_AI
    Maximum TMDS clock: 215MHz
  Vendor-specific data block, OUI 00001a
Underscans PC formats by default
Basic audio support
Supports YCbCr 4:4:4
Supports YCbCr 4:2:2
1 native detailed modes
Detailed mode: Clock 74.250 MHz, 521 mm x 293 mm
               1280 1720 1760 1980 hborder 0
                720  725  730  750 vborder 0
               +hsync +vsync 
               VertFreq: 50 Hz, HorFreq: 37500 Hz
Detailed mode: Clock 27.000 MHz, 521 mm x 293 mm
                720  732  796  864 hborder 0
                576  581  586  625 vborder 0
               -hsync -vsync 
               VertFreq: 50 Hz, HorFreq: 31250 Hz
Detailed mode: Clock 27.000 MHz, 521 mm x 293 mm
                720  736  798  858 hborder 0
                480  489  495  525 vborder 0
               -hsync -vsync 
               VertFreq: 59 Hz, HorFreq: 31468 Hz
Detailed mode: Clock 210.250 MHz, 521 mm x 293 mm
               1920 2056 2256 2592 hborder 0
               1080 1083 1088 1128 vborder 0
               -hsync +vsync 
               VertFreq: 71 Hz, HorFreq: 81114 Hz
Checksum: 0xfa (valid)

EDID block does not conform at all!
	Both the serial number and the serial string are set


