edid-decode (hex):

00 ff ff ff ff ff ff 00 0e 6f 21 14 00 00 00 00
29 21 01 04 a5 1f 11 78 03 2a 15 95 5b 57 91 29
20 50 54 00 00 00 01 01 01 01 01 01 01 01 01 01
01 01 01 01 01 01 c0 39 80 18 71 38 28 40 30 20
36 00 35 ae 10 00 00 1a 00 00 00 10 00 30 3c 43
43 0f 00 0a 20 20 20 20 20 20 00 00 00 fe 00 43
53 4f 54 20 54 39 0a 20 20 20 20 20 00 00 00 fe
00 4d 4e 45 30 30 31 42 53 31 2d 32 0a 20 00 45

00 ff ff ff ff ff ff 00 0e 6f 21 14 00 00 00 00
29 21 01 04 a5 1f 11 78 03 2a 15 95 5b 57 91 29
20 50 54 00 00 00 01 01 01 01 01 01 01 01 01 01
01 01 01 01 01 01 c0 39 80 18 71 38 28 40 30 20
36 00 35 ae 10 00 00 1a 00 00 00 10 00 30 3c 43
43 0f 00 0a 20 20 20 20 20 20 00 00 00 fe 00 43
53 4f 54 20 54 39 0a 20 20 20 20 20 00 00 00 fe
00 4d 4e 45 30 30 31 42 53 31 2d 32 0a 20 00 45

----------------

Block 0, Base EDID:
  EDID Structure Version & Revision: 1.4
  Vendor & Product Identification:
    Manufacturer: CSO
    Model: 5153
    Made in: week 41 of 2023
  Basic Display Parameters & Features:
    Digital display
    Bits per primary color channel: 8
    DisplayPort interface
    Maximum image size: 31 cm x 17 cm
    Gamma: 2.20
    Supported color formats: RGB 4:4:4
    First detailed timing includes the native pixel format and preferred refresh rate
    Display is continuous frequency
  Color Characteristics:
    Red  : 0.5820, 0.3574
    Green: 0.3417, 0.5683
    Blue : 0.1601, 0.1259
    White: 0.3134, 0.3291
  Established Timings I & II: none
  Standard Timings: none
  Detailed Timing Descriptors:
    DTD 1:  1920x1080   60.000000 Hz  16:9     67.200 kHz    147.840000 MHz (309 mm x 174 mm)
                 Hfront   48 Hsync  32 Hback  200 Hpol P
                 Vfront    3 Vsync   6 Vback   31 Vpol N
    Dummy Descriptor:
    Alphanumeric Data String: 'CSOT T9'
    Alphanumeric Data String: 'MNE001BS1-2'
Checksum: 0x45

----------------

Block 1, Unknown EDID Extension Block 0x00:
  00 ff ff ff ff ff ff 00 0e 6f 21 14 00 00 00 00 '.........o!.....'
  29 21 01 04 a5 1f 11 78 03 2a 15 95 5b 57 91 29 ')!.....x.*..[W.)'
  20 50 54 00 00 00 01 01 01 01 01 01 01 01 01 01 ' PT.............'
  01 01 01 01 01 01 c0 39 80 18 71 38 28 40 30 20 '.......9..q8(@0 '
  36 00 35 ae 10 00 00 1a 00 00 00 10 00 30 3c 43 '6.5..........0<C'
  43 0f 00 0a 20 20 20 20 20 20 00 00 00 fe 00 43 'C...      .....C'
  53 4f 54 20 54 39 0a 20 20 20 20 20 00 00 00 fe 'SOT T9.     ....'
  00 4d 4e 45 30 30 31 42 53 31 2d 32 0a 20 00 45 '.MNE001BS1-2. .E'
Checksum: 0x45

----------------

Warnings:

Block 0, Base EDID:
  Missing Display Product Name.

Failures:

Block 0, Base EDID:
  Dummy Descriptor: Dummy block filled with garbage.
  Missing Display Range Limits Descriptor.
Block 1, Base EDID:
  Unknown Extension Block.
EDID:
  Base EDID: EDID specified 0 extension block(s), but found 1 extension block(s).

EDID conformity: FAIL
