
EDID (hex):
00ffffffffffff0009e53c0900000000
011e0104a526157803ff75975e599229
21505400000001010101010101010101
010101010101ed8980a5703860403020
36007ed71000001a783980a570386040
302036007ed71000001a000000000000
00000000000000000000000000000002
000d40ff0a3c7d3e19327d00000000e0

Extracted contents:
header:          00 ff ff ff ff ff ff 00
serial number:   09 e5 3c 09 00 00 00 00 01 1e
version:         01 04
basic params:    a5 26 15 78 03
chroma info:     ff 75 97 5e 59 92 29 21 50 54
established:     00 00 00
standard:        01 01 01 01 01 01 01 01 01 01 01 01 01 01 01 01
descriptor 1:    ed 89 80 a5 70 38 60 40 30 20 36 00 7e d7 10 00 00 1a
descriptor 2:    78 39 80 a5 70 38 60 40 30 20 36 00 7e d7 10 00 00 1a
descriptor 3:    00 00 00 00 00 00 00 00 00 00 00 00 00 00 00 00 00 00
descriptor 4:    00 00 00 02 00 0d 40 ff 0a 3c 7d 3e 19 32 7d 00 00 00
extensions:      00
checksum:        e0

EDID version: 1.4
Manufacturer: BOE Model 93c Serial Number --
Made in week 1 of 2020
Digital display
8 bits per primary color channel
DisplayPort interface
Maximum image size: 38 cm x 21 cm
Gamma: 2.20
Supported color formats: RGB 4:4:4
First detailed timing includes the native pixel format and preferred refresh rate
Display is continuous frequency
Display x,y Chromaticity:
  Red:   0.5927, 0.3701
  Green: 0.3505, 0.5732
  Blue:  0.1611, 0.1318
  White: 0.3134, 0.3291
Established timings supported:
Standard timings supported:
Detailed mode: Clock 353.090 MHz, 382 mm x 215 mm
               1920 1968 2000 2085 hborder 0
               1080 1083 1089 1176 vborder 0
               +hsync -vsync 
               VertFreq: 144 Hz, HorFreq: 169347 Hz
Detailed mode: Clock 147.120 MHz, 382 mm x 215 mm
               1920 1968 2000 2085 hborder 0
               1080 1083 1089 1176 vborder 0
               +hsync -vsync 
               VertFreq: 60 Hz, HorFreq: 70561 Hz
Manufacturer-specified data, tag 0
Manufacturer-specified data, tag 2
Checksum: 0xe0 (valid)
EDID block does NOT conform to EDID 1.4!
	Missing name descriptor
	Missing monitor ranges
