
EDID (hex):
00ffffffffffff00410c18097d590000
0c1d0103803c22782a2031a5544c9f26
0e5054bfef00d1c0b300950081808140
81c001010101565e00a0a0a029503020
350055502100001e000000ff00554b30
31393132303232393039000000fd0030
4c1e721e000a202020202020000000fc
0050484c203237324238510a20200190
020329f14b101f051404130312021101
230907078301000067030c001000383c
681a00000101303e00023a801871382d
40582c450055502100001e8c0ad08a20
e02d10103e96005550210000188c0ad0
90204031200c405500555021000018f0
3c00d051a0355060883a005550210000
1c000000000000000000000000000042

edid-decode (hex):

00 ff ff ff ff ff ff 00 41 0c 18 09 7d 59 00 00
0c 1d 01 03 80 3c 22 78 2a 20 31 a5 54 4c 9f 26
0e 50 54 bf ef 00 d1 c0 b3 00 95 00 81 80 81 40
81 c0 01 01 01 01 56 5e 00 a0 a0 a0 29 50 30 20
35 00 55 50 21 00 00 1e 00 00 00 ff 00 55 4b 30
31 39 31 32 30 32 32 39 30 39 00 00 00 fd 00 30
4c 1e 72 1e 00 0a 20 20 20 20 20 20 00 00 00 fc
00 50 48 4c 20 32 37 32 42 38 51 0a 20 20 01 90

02 03 29 f1 4b 10 1f 05 14 04 13 03 12 02 11 01
23 09 07 07 83 01 00 00 67 03 0c 00 10 00 38 3c
68 1a 00 00 01 01 30 3e 00 02 3a 80 18 71 38 2d
40 58 2c 45 00 55 50 21 00 00 1e 8c 0a d0 8a 20
e0 2d 10 10 3e 96 00 55 50 21 00 00 18 8c 0a d0
90 20 40 31 20 0c 40 55 00 55 50 21 00 00 18 f0
3c 00 d0 51 a0 35 50 60 88 3a 00 55 50 21 00 00
1c 00 00 00 00 00 00 00 00 00 00 00 00 00 00 42

----------------

Block 0, Base EDID:
  EDID Structure Version & Revision: 1.3
  Vendor & Product Identification:
    Manufacturer: PHL
    Model: 2328
    Serial Number: 22909
    Made in: week 12 of 2019
  Basic Display Parameters & Features:
    Digital display
    Maximum image size: 60 cm x 34 cm
    Gamma: 2.20
    DPMS levels: Off
    RGB color display
    First detailed timing is the preferred timing
  Color Characteristics:
    Red  : 0.6445, 0.3300
    Green: 0.2968, 0.6210
    Blue : 0.1484, 0.0576
    White: 0.3125, 0.3291
  Established Timings I & II:
    IBM     :   720x400    70.081663 Hz   9:5     31.467 kHz     28.320000 MHz
    DMT 0x04:   640x480    59.940476 Hz   4:3     31.469 kHz     25.175000 MHz
    Apple   :   640x480    66.666667 Hz   4:3     35.000 kHz     30.240000 MHz
    DMT 0x05:   640x480    72.808802 Hz   4:3     37.861 kHz     31.500000 MHz
    DMT 0x06:   640x480    75.000000 Hz   4:3     37.500 kHz     31.500000 MHz
    DMT 0x08:   800x600    56.250000 Hz   4:3     35.156 kHz     36.000000 MHz
    DMT 0x09:   800x600    60.316541 Hz   4:3     37.879 kHz     40.000000 MHz
    DMT 0x0a:   800x600    72.187572 Hz   4:3     48.077 kHz     50.000000 MHz
    DMT 0x0b:   800x600    75.000000 Hz   4:3     46.875 kHz     49.500000 MHz
    Apple   :   832x624    74.551266 Hz   4:3     49.726 kHz     57.284000 MHz
    DMT 0x10:  1024x768    60.003840 Hz   4:3     48.363 kHz     65.000000 MHz
    DMT 0x11:  1024x768    70.069359 Hz   4:3     56.476 kHz     75.000000 MHz
    DMT 0x12:  1024x768    75.028582 Hz   4:3     60.023 kHz     78.750000 MHz
    DMT 0x24:  1280x1024   75.024675 Hz   5:4     79.976 kHz    135.000000 MHz
  Standard Timings:
    DMT 0x52:  1920x1080   60.000000 Hz  16:9     67.500 kHz    148.500000 MHz
    DMT 0x3a:  1680x1050   59.954250 Hz  16:10    65.290 kHz    146.250000 MHz
    DMT 0x2f:  1440x900    59.887445 Hz  16:10    55.935 kHz    106.500000 MHz
    DMT 0x23:  1280x1024   60.019740 Hz   5:4     63.981 kHz    108.000000 MHz
    DMT 0x20:  1280x960    60.000000 Hz   4:3     60.000 kHz    108.000000 MHz
    DMT 0x55:  1280x720    60.000000 Hz  16:9     45.000 kHz     74.250000 MHz
  Detailed Timing Descriptors:
    DTD 1:  2560x1440   59.950550 Hz  16:9     88.787 kHz    241.500000 MHz (597 mm x 336 mm)
                 Hfront   48 Hsync  32 Hback   80 Hpol P
                 Vfront    3 Vsync   5 Vback   33 Vpol P
    Display Product Serial Number: 'UK01912022909'
    Display Range Limits:
      Monitor ranges (GTF): 48-76 Hz V, 30-114 kHz H, max dotclock 300 MHz
    Display Product Name: 'PHL 272B8Q'
  Extension blocks: 1
Checksum: 0x90

----------------

Block 1, CTA-861 Extension Block:
  Revision: 3
  Underscans IT Video Formats by default
  Basic audio support
  Supports YCbCr 4:4:4
  Supports YCbCr 4:2:2
  Native detailed modes: 1
  Video Data Block:
    VIC  16:  1920x1080   60.000000 Hz  16:9     67.500 kHz    148.500000 MHz
    VIC  31:  1920x1080   50.000000 Hz  16:9     56.250 kHz    148.500000 MHz
    VIC   5:  1920x1080i  60.000000 Hz  16:9     33.750 kHz     74.250000 MHz
    VIC  20:  1920x1080i  50.000000 Hz  16:9     28.125 kHz     74.250000 MHz
    VIC   4:  1280x720    60.000000 Hz  16:9     45.000 kHz     74.250000 MHz
    VIC  19:  1280x720    50.000000 Hz  16:9     37.500 kHz     74.250000 MHz
    VIC   3:   720x480    59.940060 Hz  16:9     31.469 kHz     27.000000 MHz
    VIC  18:   720x576    50.000000 Hz  16:9     31.250 kHz     27.000000 MHz
    VIC   2:   720x480    59.940060 Hz   4:3     31.469 kHz     27.000000 MHz
    VIC  17:   720x576    50.000000 Hz   4:3     31.250 kHz     27.000000 MHz
    VIC   1:   640x480    59.940476 Hz   4:3     31.469 kHz     25.175000 MHz
  Audio Data Block:
    Linear PCM:
      Max channels: 2
      Supported sample rates (kHz): 48 44.1 32
      Supported sample sizes (bits): 24 20 16
  Speaker Allocation Data Block:
    FL/FR - Front Left/Right
  Vendor-Specific Data Block (HDMI), OUI 00-0C-03:
    Source physical address: 1.0.0.0
    DC_36bit
    DC_30bit
    DC_Y444
    Maximum TMDS clock: 300 MHz
  Vendor-Specific Data Block (AMD), OUI 00-00-1A:
    Version: 1.1
    Minimum Refresh Rate: 48 Hz
    Maximum Refresh Rate: 62 Hz
    Flags 1.x: 0x00
  Detailed Timing Descriptors:
    DTD 2:  1920x1080   60.000000 Hz  16:9     67.500 kHz    148.500000 MHz (597 mm x 336 mm)
                 Hfront   88 Hsync  44 Hback  148 Hpol P
                 Vfront    4 Vsync   5 Vback   36 Vpol P
    DTD 3:   720x480    59.940060 Hz   3:2     31.469 kHz     27.000000 MHz (597 mm x 336 mm)
                 Hfront   16 Hsync  62 Hback   60 Hpol N
                 Vfront    9 Vsync   6 Vback   30 Vpol N
    DTD 4:   720x576    50.000000 Hz   5:4     31.250 kHz     27.000000 MHz (597 mm x 336 mm)
                 Hfront   12 Hsync  64 Hback   68 Hpol N
                 Vfront    5 Vsync   5 Vback   39 Vpol N
    DTD 5:  1280x1440   59.912620 Hz   8:9     89.450 kHz    156.000000 MHz (597 mm x 336 mm)
                 Hfront   96 Hsync 136 Hback  232 Hpol N
                 Vfront    3 Vsync  10 Vback   40 Vpol P
Checksum: 0x42  Unused space in Extension Block: 14 bytes
