
EDID (hex):
00ffffffffffff003061c02401000000
0e14010380342078ea8372ac5130b225
105053bfcf80314aa9408180d1c081c0
010101010101343c80a070b023403020
260006442100001e033a801871382d40
2840820806442100001e000000ff0043
4c3234434747325330323732000000fc
004c6143696520333234690a2020008a

Extracted contents:
header:          00 ff ff ff ff ff ff 00
serial number:   30 61 c0 24 01 00 00 00 0e 14
version:         01 03
basic params:    80 34 20 78 ea
chroma info:     83 72 ac 51 30 b2 25 10 50 53
established:     bf cf 80
standard:        31 4a a9 40 81 80 d1 c0 81 c0 01 01 01 01 01 01
descriptor 1:    34 3c 80 a0 70 b0 23 40 30 20 26 00 06 44 21 00 00 1e
descriptor 2:    03 3a 80 18 71 38 2d 40 28 40 82 08 06 44 21 00 00 1e
descriptor 3:    00 00 00 ff 00 43 4c 32 34 43 47 47 32 53 30 32 37 32
descriptor 4:    00 00 00 fc 00 4c 61 43 69 65 20 33 32 34 69 0a 20 20
extensions:      00
checksum:        8a

EDID version: 1.3
Manufacturer: LCA Model 24c0 Serial Number --
Made in week 14 of 2010
Digital display
Maximum image size: 52 cm x 32 cm
Gamma: 2.20
DPMS levels: Standby Suspend Off
RGB color display
First detailed timing is preferred timing
Display x,y Chromaticity:
  Red:   0.6738, 0.3164
  Green: 0.1875, 0.6982
  Blue:  0.1455, 0.0654
  White: 0.3125, 0.3261
Established timings supported:
  720x400@70Hz 9:5 HorFreq: 31469 Hz Clock: 28.320 MHz
  640x480@60Hz 4:3 HorFreq: 31469 Hz Clock: 25.175 MHz
  640x480@67Hz 4:3 HorFreq: 35000 Hz Clock: 30.240 MHz
  640x480@72Hz 4:3 HorFreq: 37900 Hz Clock: 31.500 MHz
  640x480@75Hz 4:3 HorFreq: 37500 Hz Clock: 31.500 MHz
  800x600@56Hz 4:3 HorFreq: 35200 Hz Clock: 36.000 MHz
  800x600@60Hz 4:3 HorFreq: 37900 Hz Clock: 40.000 MHz
  800x600@72Hz 4:3 HorFreq: 48100 Hz Clock: 50.000 MHz
  800x600@75Hz 4:3 HorFreq: 46900 Hz Clock: 49.500 MHz
  1024x768@60Hz 4:3 HorFreq: 48400 Hz Clock: 65.000 MHz
  1024x768@70Hz 4:3 HorFreq: 56500 Hz Clock: 75.000 MHz
  1024x768@75Hz 4:3 HorFreq: 60000 Hz Clock: 78.750 MHz
  1280x1024@75Hz 5:4 HorFreq: 80000 Hz Clock: 135.000 MHz
  1152x870@75Hz 192:145 HorFreq: 67500 Hz Clock: 108.000 MHz
Standard timings supported:
  640x480@70Hz 4:3
  1600x1200@60Hz 4:3 HorFreq: 75000 Hz Clock: 162.000 MHz
  1280x1024@60Hz 5:4 HorFreq: 64000 Hz Clock: 108.000 MHz
  1920x1080@60Hz 16:9
  1280x720@60Hz 16:9
Detailed mode: Clock 154.120 MHz, 518 mm x 324 mm
               1920 1968 2000 2080 hborder 0
               1200 1202 1208 1235 vborder 0
               +hsync +vsync 
               VertFreq: 59 Hz, HorFreq: 74096 Hz
Detailed mode: Clock 148.510 MHz, 518 mm x 324 mm
               1920 1960 2024 2200 hborder 0
               1080 1120 1122 1125 vborder 0
               +hsync +vsync 
               VertFreq: 60 Hz, HorFreq: 67504 Hz
Serial number: --
Monitor name: LaCie 324i
Checksum: 0x8a (valid)
EDID block does NOT conform to EDID 1.3!
	Missing monitor ranges
