
EDID (hex):
00ffffffffffff005a63213201010101
261201030e3722782e0685a556489b26
125054bfef80d100d1c0b30095008180
814081c0714f283c80a070b023403020
360026582100001a000000ff00515832
3038333832313135390a000000fd0032
4b185210000a202020202020000000fc
00564132363136772d320a202020006a

Extracted contents:
header:          00 ff ff ff ff ff ff 00
serial number:   5a 63 21 32 01 01 01 01 26 12
version:         01 03
basic params:    0e 37 22 78 2e
chroma info:     06 85 a5 56 48 9b 26 12 50 54
established:     bf ef 80
standard:        d1 00 d1 c0 b3 00 95 00 81 80 81 40 81 c0 71 4f
descriptor 1:    28 3c 80 a0 70 b0 23 40 30 20 36 00 26 58 21 00 00 1a
descriptor 2:    00 00 00 ff 00 51 58 32 30 38 33 38 32 31 31 35 39 0a
descriptor 3:    00 00 00 fd 00 32 4b 18 52 10 00 0a 20 20 20 20 20 20
descriptor 4:    00 00 00 fc 00 56 41 32 36 31 36 77 2d 32 0a 20 20 20
extensions:      00
checksum:        6a

EDID version: 1.3
Manufacturer: VSC Model 3221 Serial Number --
Made in week 38 of 2008
Analog display, Input voltage level: 0.7/0.3 V
Sync: Separate Composite SyncOnGreen 
Maximum image size: 55 cm x 34 cm
Gamma: 2.20
DPMS levels: Off
RGB color display
Default (sRGB) color space is primary color space
First detailed timing is preferred timing
Display x,y Chromaticity:
  Red:   0.6445, 0.3359
  Green: 0.2822, 0.6074
  Blue:  0.1503, 0.0703
  White: 0.3134, 0.3291
Established timings supported:
  720x400@70Hz 9:5 HorFreq: 31469 Hz Clock: 28.320 MHz
  640x480@60Hz 4:3 HorFreq: 31469 Hz Clock: 25.175 MHz
  640x480@67Hz 4:3 HorFreq: 35000 Hz Clock: 30.240 MHz
  640x480@72Hz 4:3 HorFreq: 37900 Hz Clock: 31.500 MHz
  640x480@75Hz 4:3 HorFreq: 37500 Hz Clock: 31.500 MHz
  800x600@56Hz 4:3 HorFreq: 35200 Hz Clock: 36.000 MHz
  800x600@60Hz 4:3 HorFreq: 37900 Hz Clock: 40.000 MHz
  800x600@72Hz 4:3 HorFreq: 48100 Hz Clock: 50.000 MHz
  800x600@75Hz 4:3 HorFreq: 46900 Hz Clock: 49.500 MHz
  832x624@75Hz 4:3 HorFreq: 49726 Hz Clock: 57.284 MHz
  1024x768@60Hz 4:3 HorFreq: 48400 Hz Clock: 65.000 MHz
  1024x768@70Hz 4:3 HorFreq: 56500 Hz Clock: 75.000 MHz
  1024x768@75Hz 4:3 HorFreq: 60000 Hz Clock: 78.750 MHz
  1280x1024@75Hz 5:4 HorFreq: 80000 Hz Clock: 135.000 MHz
  1152x870@75Hz 192:145 HorFreq: 67500 Hz Clock: 108.000 MHz
Standard timings supported:
  1920x1200@60Hz 16:10 HorFreq: 74000 Hz Clock: 154.000 MHz
  1920x1080@60Hz 16:9
  1680x1050@60Hz 16:10 HorFreq: 64700 Hz Clock: 119.000 MHz
  1440x900@60Hz 16:10 HorFreq: 55500 Hz Clock: 88.750 MHz
  1280x1024@60Hz 5:4 HorFreq: 64000 Hz Clock: 108.000 MHz
  1280x960@60Hz 4:3 HorFreq: 60000 Hz Clock: 108.000 MHz
  1280x720@60Hz 16:9
  1152x864@75Hz 4:3 HorFreq: 67500 Hz Clock: 108.000 MHz
Detailed mode: Clock 154.000 MHz, 550 mm x 344 mm
               1920 1968 2000 2080 hborder 0
               1200 1203 1209 1235 vborder 0
               +hsync -vsync 
               VertFreq: 59 Hz, HorFreq: 74038 Hz
Serial number: --
Monitor ranges (GTF): 50-75Hz V, 24-82kHz H, max dotclock 160MHz
Monitor name: VA2616w-2
Checksum: 0x6a (valid)
EDID block does NOT conform to EDID 1.3!
	sRGB is signaled, but the chromaticities do not match
