
EDID (hex):
00ffffffffffff000469a327e1ad0100
32160104a53c22783aa595aa544fa126
0a5054b7ef00d1c0b300950081808140
810081c0714f565e00a0a0a029503020
350055502100001a000000ff0043434c
4d54463131303034390a000000fd0018
4c18631e04110140f838f03c000000fc
00415355532050423237380a2020019a

Extracted contents:
header:          00 ff ff ff ff ff ff 00
serial number:   04 69 a3 27 e1 ad 01 00 32 16
version:         01 04
basic params:    a5 3c 22 78 3a
chroma info:     a5 95 aa 54 4f a1 26 0a 50 54
established:     b7 ef 00
standard:        d1 c0 b3 00 95 00 81 80 81 40 81 00 81 c0 71 4f
descriptor 1:    56 5e 00 a0 a0 a0 29 50 30 20 35 00 55 50 21 00 00 1a
descriptor 2:    00 00 00 ff 00 43 43 4c 4d 54 46 31 31 30 30 34 39 0a
descriptor 3:    00 00 00 fd 00 18 4c 18 63 1e 04 11 01 40 f8 38 f0 3c
descriptor 4:    00 00 00 fc 00 41 53 55 53 20 50 42 32 37 38 0a 20 20
extensions:      01
checksum:        9a

EDID version: 1.4
Manufacturer: ACI Model 27a3 Serial Number --
Made in week 50 of 2012
Digital display
8 bits per primary color channel
DisplayPort interface
Maximum image size: 60 cm x 34 cm
Gamma: 2.20
DPMS levels: Off
Supported color formats: RGB 4:4:4, YCrCb 4:4:4, YCrCb 4:2:2
First detailed timing includes the native pixel format and preferred refresh rate
Display x,y Chromaticity:
  Red:   0.6660, 0.3300
  Green: 0.3095, 0.6298
  Blue:  0.1503, 0.0400
  White: 0.3134, 0.3291
Established timings supported:
  720x400@70Hz 9:5 HorFreq: 31469 Hz Clock: 28.320 MHz
  640x480@60Hz 4:3 HorFreq: 31469 Hz Clock: 25.175 MHz
  640x480@67Hz 4:3 HorFreq: 35000 Hz Clock: 30.240 MHz
  640x480@75Hz 4:3 HorFreq: 37500 Hz Clock: 31.500 MHz
  800x600@56Hz 4:3 HorFreq: 35200 Hz Clock: 36.000 MHz
  800x600@60Hz 4:3 HorFreq: 37900 Hz Clock: 40.000 MHz
  800x600@72Hz 4:3 HorFreq: 48100 Hz Clock: 50.000 MHz
  800x600@75Hz 4:3 HorFreq: 46900 Hz Clock: 49.500 MHz
  832x624@75Hz 4:3 HorFreq: 49726 Hz Clock: 57.284 MHz
  1024x768@60Hz 4:3 HorFreq: 48400 Hz Clock: 65.000 MHz
  1024x768@70Hz 4:3 HorFreq: 56500 Hz Clock: 75.000 MHz
  1024x768@75Hz 4:3 HorFreq: 60000 Hz Clock: 78.750 MHz
  1280x1024@75Hz 5:4 HorFreq: 80000 Hz Clock: 135.000 MHz
Standard timings supported:
  1920x1080@60Hz 16:9
  1680x1050@60Hz 16:10 HorFreq: 64700 Hz Clock: 119.000 MHz
  1440x900@60Hz 16:10 HorFreq: 55500 Hz Clock: 88.750 MHz
  1280x1024@60Hz 5:4 HorFreq: 64000 Hz Clock: 108.000 MHz
  1280x960@60Hz 4:3 HorFreq: 60000 Hz Clock: 108.000 MHz
  1280x800@60Hz 16:10
  1280x720@60Hz 16:9
  1152x864@75Hz 4:3 HorFreq: 67500 Hz Clock: 108.000 MHz
Detailed mode: Clock 241.500 MHz, 597 mm x 336 mm
               2560 2608 2640 2720 hborder 0
               1440 1443 1448 1481 vborder 0
               +hsync -vsync 
               VertFreq: 59 Hz, HorFreq: 88786 Hz
Serial number: --
Monitor ranges (CVT): 24-76Hz V, 24-99kHz H, max dotclock 300MHz
CVT version 1.1
Max active pixels per line: 2560
Supported aspect ratios: 4:3 16:9 16:10 5:4 15:9
Preferred aspect ratio: 16:9
Supports CVT standard blanking
Supports CVT reduced blanking
Supported display scaling:
    Horizontal shrink
    Horizontal stretch
    Vertical shrink
    Vertical stretch
Preferred vertical refresh: 60 Hz
Monitor name: ASUS PB278
Has 1 extension blocks
Checksum: 0x9a (valid)
