edid-decode (hex):

00 ff ff ff ff ff ff 00 09 d1 02 7f 45 54 00 00
0c 15 01 03 80 34 1d 78 2e 2c c1 a4 56 50 a1 28
0f 50 54 a5 6b 80 31 68 31 7c 45 68 45 7c 61 68
81 bc 95 3c d1 e8 02 3a 80 18 71 38 2d 40 58 2c
45 00 09 25 21 00 00 1a 00 00 00 ff 00 50 33 42
30 31 35 37 38 53 4c 30 0a 20 00 00 00 fd 00 38
78 1e 8c 21 00 0a 20 20 20 20 20 20 00 00 00 fc
00 42 65 6e 51 20 58 4c 32 34 31 30 54 0a 01 83

02 01 04 00 fe 5b 80 a0 70 38 35 40 30 20 35 00
09 25 21 00 00 1a a9 65 80 a0 70 38 3a 40 30 20
35 00 09 25 21 00 00 1a 86 6f 80 a0 70 38 40 40
30 20 35 00 09 25 21 00 00 1a 00 00 00 00 00 00
00 00 00 00 00 00 00 00 00 00 00 00 00 00 00 00
00 00 00 00 00 00 00 00 00 00 00 00 00 00 00 00
00 00 00 00 00 00 00 00 00 00 00 00 00 00 00 00
00 00 00 00 00 00 00 00 00 00 00 00 00 00 00 0c

00 ff ff ff ff ff ff 00 09 d1 02 7f 45 54 00 00
0c 15 01 03 80 34 1d 78 2e 2c c1 a4 56 50 a1 28
0f 50 54 a5 6b 80 31 68 31 7c 45 68 45 7c 61 68
81 bc 95 3c d1 e8 02 3a 80 18 71 38 2d 40 58 2c
45 00 09 25 21 00 00 1a 00 00 00 ff 00 50 33 42
30 31 35 37 38 53 4c 30 0a 20 00 00 00 fd 00 38
78 1e 8c 21 00 0a 20 20 20 20 20 20 00 00 00 fc
00 42 65 6e 51 20 58 4c 32 34 31 30 54 0a 01 83

02 01 04 00 fe 5b 80 a0 70 38 35 40 30 20 35 00
09 25 21 00 00 1a a9 65 80 a0 70 38 3a 40 30 20
35 00 09 25 21 00 00 1a 86 6f 80 a0 70 38 40 40
30 20 35 00 09 25 21 00 00 1a 00 00 00 00 00 00
00 00 00 00 00 00 00 00 00 00 00 00 00 00 00 00
00 00 00 00 00 00 00 00 00 00 00 00 00 00 00 00
00 00 00 00 00 00 00 00 00 00 00 00 00 00 00 00
00 00 00 00 00 00 00 00 00 00 00 00 00 00 00 0c

----------------

Block 0, Base EDID:
  EDID Structure Version & Revision: 1.3
  Vendor & Product Identification:
    Manufacturer: BNQ
    Model: 32514
    Serial Number: ...
    Made in: week 12 of 2011
  Basic Display Parameters & Features:
    Digital display
    Maximum image size: 52 cm x 29 cm
    Gamma: 2.20
    DPMS levels: Off
    RGB color display
    Default (sRGB) color space is primary color space
    First detailed timing is the preferred timing
  Color Characteristics:
    Red  : 0.6406, 0.3378
    Green: 0.3154, 0.6289
    Blue : 0.1591, 0.0585
    White: 0.3125, 0.3291
  Established Timings I & II:
    IBM     :   720x400    70.081663 Hz   9:5     31.467 kHz     28.320000 MHz
    DMT 0x04:   640x480    59.940476 Hz   4:3     31.469 kHz     25.175000 MHz
    DMT 0x06:   640x480    75.000000 Hz   4:3     37.500 kHz     31.500000 MHz
    DMT 0x09:   800x600    60.316541 Hz   4:3     37.879 kHz     40.000000 MHz
    DMT 0x0b:   800x600    75.000000 Hz   4:3     46.875 kHz     49.500000 MHz
    Apple   :   832x624    74.551266 Hz   4:3     49.726 kHz     57.284000 MHz
    DMT 0x10:  1024x768    60.003840 Hz   4:3     48.363 kHz     65.000000 MHz
    DMT 0x12:  1024x768    75.028582 Hz   4:3     60.023 kHz     78.750000 MHz
    DMT 0x24:  1280x1024   75.024675 Hz   5:4     79.976 kHz    135.000000 MHz
    Apple   :  1152x870    75.061550 Hz 192:145   68.681 kHz    100.000000 MHz
  Standard Timings:
    GTF     :   640x480    99.999537 Hz   4:3     50.900 kHz     43.163000 MHz
    GTF     :   640x480   119.999084 Hz   4:3     61.800 kHz     52.406000 MHz
    GTF     :   800x600    99.999707 Hz   4:3     63.600 kHz     68.179000 MHz
    GTF     :   800x600   119.999886 Hz   4:3     77.160 kHz     83.950000 MHz
    GTF     :  1024x768   100.000177 Hz   4:3     81.400 kHz    113.309000 MHz
    GTF     :  1280x1024  120.000185 Hz   5:4    131.640 kHz    233.793000 MHz
    GTF     :  1440x900   119.999896 Hz  16:10   115.800 kHz    229.747000 MHz
    GTF     :  1920x1080  100.000000 Hz  16:9    114.400 kHz    302.016000 MHz
  Detailed Timing Descriptors:
    DTD 1:  1920x1080   60.000000 Hz  16:9     67.500 kHz    148.500000 MHz (521 mm x 293 mm)
                 Hfront   88 Hsync  44 Hback  148 Hpol P
                 Vfront    4 Vsync   5 Vback   36 Vpol N
    Display Product Serial Number: ...
    Display Range Limits:
      Monitor ranges (GTF): 56-120 Hz V, 30-140 kHz H, max dotclock 330 MHz
    Display Product Name: 'BenQ XL2410T'
  Extension blocks: 1
Checksum: 0x83

----------------

Block 1, CTA-861 Extension Block:
  Revision: 1
  Detailed Timing Descriptors:
    DTD 2:  1920x1080   99.930409 Hz  16:9    113.221 kHz    235.500000 MHz (521 mm x 293 mm)
                 Hfront   48 Hsync  32 Hback   80 Hpol P
                 Vfront    3 Vsync   5 Vback   45 Vpol N
    DTD 3:  1920x1080  109.947445 Hz  16:9    125.120 kHz    260.250000 MHz (521 mm x 293 mm)
                 Hfront   48 Hsync  32 Hback   80 Hpol P
                 Vfront    3 Vsync   5 Vback   50 Vpol N
    DTD 4:  1920x1080  119.982181 Hz  16:9    137.260 kHz    285.500000 MHz (521 mm x 293 mm)
                 Hfront   48 Hsync  32 Hback   80 Hpol P
                 Vfront    3 Vsync   5 Vback   56 Vpol N
Checksum: 0x0c  Unused space in Extension Block: 69 bytes

----------------

Block 2, Unknown EDID Extension Block 0x00:
  00 ff ff ff ff ff ff 00 09 d1 02 7f 45 54 00 00 '............ET..'
  0c 15 01 03 80 34 1d 78 2e 2c c1 a4 56 50 a1 28 '.....4.x.,..VP.('
  0f 50 54 a5 6b 80 31 68 31 7c 45 68 45 7c 61 68 '.PT.k.1h1|EhE|ah'
  81 bc 95 3c d1 e8 02 3a 80 18 71 38 2d 40 58 2c '...<...:..q8-@X,'
  45 00 09 25 21 00 00 1a 00 00 00 ff 00 50 33 42 'E..%!........P3B'
  30 31 35 37 38 53 4c 30 0a 20 00 00 00 fd 00 38 '01578SL0. .....8'
  78 1e 8c 21 00 0a 20 20 20 20 20 20 00 00 00 fc 'x..!..      ....'
  00 42 65 6e 51 20 58 4c 32 34 31 30 54 0a 01 83 '.BenQ XL2410T...'
Checksum: 0x83

----------------

Block 3, CTA-861 Extension Block:
  Revision: 1
  Detailed Timing Descriptors:
    DTD 5:  1920x1080   99.930409 Hz  16:9    113.221 kHz    235.500000 MHz (521 mm x 293 mm)
                 Hfront   48 Hsync  32 Hback   80 Hpol P
                 Vfront    3 Vsync   5 Vback   45 Vpol N
    DTD 6:  1920x1080  109.947445 Hz  16:9    125.120 kHz    260.250000 MHz (521 mm x 293 mm)
                 Hfront   48 Hsync  32 Hback   80 Hpol P
                 Vfront    3 Vsync   5 Vback   50 Vpol N
    DTD 7:  1920x1080  119.982181 Hz  16:9    137.260 kHz    285.500000 MHz (521 mm x 293 mm)
                 Hfront   48 Hsync  32 Hback   80 Hpol P
                 Vfront    3 Vsync   5 Vback   56 Vpol N
Checksum: 0x0c  Unused space in Extension Block: 69 bytes

----------------

Warnings:

Block 0, Base EDID:
  Detailed Timing Descriptor #1: DTD is similar but not identical to VIC 16.
Block 1, CTA-861 Extension Block:
  Display Product Serial Number is set, so the Serial Number in the Base EDID should be 0.
Block 3, CTA-861 Extension Block:
  Display Product Serial Number is set, so the Serial Number in the Base EDID should be 0.

Failures:

Block 0, Base EDID:
  Basic Display Parameters & Features: sRGB is signaled, but the chromaticities do not match.
Block 1, CTA-861 Extension Block:
  Missing VCDB, needed for Set Selectable RGB Quantization to avoid interop issues.
Block 2, Base EDID:
  Unknown Extension Block.
Block 3, CTA-861 Extension Block:
  Missing VCDB, needed for Set Selectable RGB Quantization to avoid interop issues.
EDID:
  Base EDID: EDID specified 1 extension block(s), but found 3 extension block(s).
  Base EDID: EDID 1.3 requires a Block Map Extension in Block 1 if there are more than 2 blocks in the EDID.

EDID conformity: FAIL
