
EDID (hex):
00ffffffffffff001ed40705a2f8aa00
0c0b0102681e17782a63f89e564c9824
195055bfce0001010101010101010101
01010101010164190040410026301888
360030e410000000000000fc00475669
73696f6e0a2020202020000000fc0020
4c3545585f54410120202020000000fe
0050415241444953450a202020200086

Extracted contents:
header:          00 ff ff ff ff ff ff 00
serial number:   1e d4 07 05 a2 f8 aa 00 0c 0b
version:         01 02
basic params:    68 1e 17 78 2a
chroma info:     63 f8 9e 56 4c 98 24 19 50 55
established:     bf ce 00
standard:        01 01 01 01 01 01 01 01 01 01 01 01 01 01 01 01
descriptor 1:    64 19 00 40 41 00 26 30 18 88 36 00 30 e4 10 00 00 00
descriptor 2:    00 00 00 fc 00 47 56 69 73 69 6f 6e 0a 20 20 20 20 20
descriptor 3:    00 00 00 fc 00 20 4c 35 45 58 5f 54 41 01 20 20 20 20
descriptor 4:    00 00 00 fe 00 50 41 52 41 44 49 53 45 0a 20 20 20 20
extensions:      00
checksum:        86

EDID version: 1.2
Manufacturer: GVT Model 507 Serial Number --
Analog display, Input voltage level: 0.7/0.7 V
Sync: Separate 
Maximum image size: 30 cm x 23 cm
Gamma: 2.20
DPMS levels: Off
RGB color display
First detailed timing is preferred timing
Display x,y Chromaticity:
  Red:   0.6181, 0.3378
  Green: 0.2968, 0.5966
  Blue:  0.1435, 0.1005
  White: 0.3144, 0.3320
Established timings supported:
  720x400@70Hz 9:5 HorFreq: 31469 Hz Clock: 28.320 MHz
  640x480@60Hz 4:3 HorFreq: 31469 Hz Clock: 25.175 MHz
  640x480@67Hz 4:3 HorFreq: 35000 Hz Clock: 30.240 MHz
  640x480@72Hz 4:3 HorFreq: 37900 Hz Clock: 31.500 MHz
  640x480@75Hz 4:3 HorFreq: 37500 Hz Clock: 31.500 MHz
  800x600@56Hz 4:3 HorFreq: 35200 Hz Clock: 36.000 MHz
  800x600@60Hz 4:3 HorFreq: 37900 Hz Clock: 40.000 MHz
  800x600@72Hz 4:3 HorFreq: 48100 Hz Clock: 50.000 MHz
  800x600@75Hz 4:3 HorFreq: 46900 Hz Clock: 49.500 MHz
  1024x768@60Hz 4:3 HorFreq: 48400 Hz Clock: 65.000 MHz
  1024x768@70Hz 4:3 HorFreq: 56500 Hz Clock: 75.000 MHz
  1024x768@75Hz 4:3 HorFreq: 60000 Hz Clock: 78.750 MHz
Standard timings supported:
Detailed mode: Clock 65.000 MHz, 304 mm x 228 mm
               1024 1048 1184 1344 hborder 0
                768  771  777  806 vborder 0
               -hsync -vsync analog composite 
               VertFreq: 60 Hz, HorFreq: 48363 Hz
Monitor name: GVision
ASCII string: PARADISE
Checksum: 0x86 (valid)
EDID block does not conform at all!
	Bad year of manufacture
