edid-decode (hex):

00 ff ff ff ff ff ff 00 09 e5 9a 08 00 00 00 00
00 10 01 03 80 1a 10 78 0a 86 85 95 57 4d 8d 25
24 50 54 00 00 00 01 01 01 01 01 01 01 01 01 01
01 01 01 01 01 01 c6 1b 00 a0 50 20 17 30 30 20
36 00 05 a3 10 00 00 19 00 00 00 fe 00 0a 20 20
20 20 20 20 20 20 20 20 20 20 00 00 00 fe 00 42
4f 45 20 48 59 44 49 53 0a 20 20 20 00 00 00 fe
00 48 56 31 32 31 57 58 34 2d 31 31 30 0a 00 96

----------------

Block 0, Base EDID:
  EDID Structure Version & Revision: 1.3
  Vendor & Product Identification:
    Manufacturer: BOE
    Model: 2202
    Made in: 2006
  Basic Display Parameters & Features:
    Digital display
    Maximum image size: 26 cm x 16 cm
    Gamma: 2.20
    RGB color display
    First detailed timing is preferred timing
  Color Characteristics:
    Red  : 0.5839, 0.3398
    Green: 0.3017, 0.5527
    Blue : 0.1464, 0.1406
    White: 0.3134, 0.3291
  Established Timings I & II: none
  Standard Timings: none
  Detailed Timing Descriptors:
    DTD 1:  1280x800    59.994 Hz   8:5    49.375 kHz  71.100 MHz (261 mm x 163 mm)
                 Hfront   48 Hsync  32 Hback  80 Hpol N
                 Vfront    3 Vsync   6 Vback  14 Vpol N
    Alphanumeric Data String: ''
    Alphanumeric Data String: 'BOE HYDIS'
    Alphanumeric Data String: 'HV121WX4-110'
Checksum: 0x96

----------------

Failures:

Block 0, Base EDID:
  Alphanumeric Data String: Empty string.
  Missing Display Product Name.
  Missing Display Range Limits Descriptor.

EDID conformity: FAIL
