edid-decode (hex):

00 ff ff ff ff ff ff 00 42 88 00 00 00 00 00 00
01 0e 01 03 68 22 1b 71 2a 6e a6 a1 54 4c 99 26
19 4f 54 af ee 00 81 80 01 01 01 01 01 01 01 01
01 01 01 01 01 01 30 2a 00 98 51 00 2a 40 30 70
13 00 68 22 11 00 00 18 00 00 00 fd 00 38 4b 20
50 0e 00 0a 20 20 20 20 20 20 00 00 00 ff 00 38
30 38 34 36 34 36 38 38 0a 20 20 20 00 00 00 fc
00 4c 43 50 2d 31 37 57 30 31 0a 20 0a 20 00 c9

----------------

Block 0, Base EDID:
  EDID Structure Version & Revision: 1.3
  Vendor & Product Identification:
    Manufacturer: PTH
    Model: 0
    Made in: week 1 of 2004
  Basic Display Parameters & Features:
    Analog display
    Input voltage level: 0.7/0.7 V
    Blank level equals black level
    Sync: Separate
    Maximum image size: 34 cm x 27 cm
    Gamma: 2.13
    DPMS levels: Off
    RGB color display
    First detailed timing is the preferred timing
  Color Characteristics:
    Red  : 0.6298, 0.3300
    Green: 0.2998, 0.5996
    Blue : 0.1503, 0.0996
    White: 0.3095, 0.3300
  Established Timings I & II:
    IBM     :   720x400    70.082 Hz   9:5    31.467 kHz  28.320 MHz
    DMT 0x04:   640x480    59.940 Hz   4:3    31.469 kHz  25.175 MHz
    DMT 0x05:   640x480    72.809 Hz   4:3    37.861 kHz  31.500 MHz
    DMT 0x06:   640x480    75.000 Hz   4:3    37.500 kHz  31.500 MHz
    DMT 0x08:   800x600    56.250 Hz   4:3    35.156 kHz  36.000 MHz
    DMT 0x09:   800x600    60.317 Hz   4:3    37.879 kHz  40.000 MHz
    DMT 0x0a:   800x600    72.188 Hz   4:3    48.077 kHz  50.000 MHz
    DMT 0x0b:   800x600    75.000 Hz   4:3    46.875 kHz  49.500 MHz
    Apple   :   832x624    74.551 Hz   4:3    49.726 kHz  57.284 MHz
    DMT 0x10:  1024x768    60.004 Hz   4:3    48.363 kHz  65.000 MHz
    DMT 0x11:  1024x768    70.069 Hz   4:3    56.476 kHz  75.000 MHz
    DMT 0x12:  1024x768    75.029 Hz   4:3    60.023 kHz  78.750 MHz
  Standard Timings:
    DMT 0x23:  1280x1024   60.020 Hz   5:4    63.981 kHz 108.000 MHz
  Detailed Timing Descriptors:
    DTD 1:  1280x1024   60.020 Hz   5:4    63.981 kHz 108.000 MHz (360 mm x 290 mm)
                 Hfront   48 Hsync 112 Hback 248 Hpol N
                 Vfront    1 Vsync   3 Vback  38 Vpol N
  Display Range Limits:
    Monitor ranges (GTF): 56-75 Hz V, 32-80 kHz H, max dotclock 140 MHz
    Display Product Serial Number: ...
    Display Product Name: 'LCP-17W01'
Checksum: 0xc9

----------------

Warnings:

EDID:
  Base EDID: Some timings are out of range of the Monitor Ranges:
    Horizontal Freq: 31.466 - 63.981 kHz (Monitor: 32.000 - 80.000 kHz)
    Could be due to a Monitor Range off-by-one rounding issue

Failures:

Block 0, Base EDID:
  Detailed Timing Descriptor #1: Mismatch of image size 360x290 mm vs display size 340x270 mm.
  Display Product Name: Non-space after newline.

EDID conformity: FAIL
