edid-decode (hex):

00 ff ff ff ff ff ff 00 30 e4 ac 02 00 00 00 00
00 14 01 03 80 22 13 78 0a c1 25 9d 5f 5b 9b 27
19 50 54 00 00 00 01 01 01 01 01 01 01 01 01 01
01 01 01 01 01 01 12 1b 56 78 50 00 0e 30 20 20
24 00 58 c2 10 00 00 19 00 00 00 00 00 00 00 00
00 00 00 00 00 00 00 00 00 00 00 00 00 fe 00 4c
47 20 44 69 73 70 6c 61 79 0a 20 20 00 00 00 fe
00 4c 50 31 35 36 57 48 32 2d 54 4c 51 42 00 c1

----------------

Block 0, Base EDID:
  EDID Structure Version & Revision: 1.3
  Vendor & Product Identification:
    Manufacturer: LGD
    Model: 684
    Made in: 2010
  Basic Display Parameters & Features:
    Digital display
    Maximum image size: 34 cm x 19 cm
    Gamma: 2.20
    RGB color display
    First detailed timing is preferred timing
  Color Characteristics:
    Red  : 0.6162, 0.3710
    Green: 0.3554, 0.6064
    Blue : 0.1523, 0.0996
    White: 0.3134, 0.3291
  Established Timings I & II: none
  Standard Timings: none
  Detailed Timing Descriptors:
    DTD 1:  1366x768    59.636 Hz 683:384  46.635 kHz  69.300 MHz (344 mm x 194 mm)
                 Hfront   32 Hsync  32 Hback  56 Hpol N
                 Vfront    2 Vsync   4 Vback   8 Vpol N
    Empty Descriptor
    Alphanumeric Data String: 'LG Display'
    Alphanumeric Data String: 'LP156WH2-TLQB'
Checksum: 0xc1
