edid-decode (hex):

00 ff ff ff ff ff ff 00 30 ae a0 40 00 00 00 00
00 12 01 03 80 1f 11 78 ea 4a 05 9e 5b 54 95 25
18 50 54 00 00 00 01 01 01 01 01 01 01 01 01 01
01 01 01 01 01 01 3e 1c 56 a0 50 00 16 30 30 20
35 00 35 ae 10 00 00 19 8e 17 56 a0 50 00 16 30
30 20 35 00 35 ae 10 00 00 19 00 00 00 0f 00 8c
09 32 8c 09 28 16 09 00 30 e4 cc 01 00 00 00 fe
00 4c 50 31 34 30 57 48 31 2d 54 4c 41 31 00 f4

----------------

Block 0, Base EDID:
  EDID Structure Version & Revision: 1.3
  Vendor & Product Identification:
    Manufacturer: LEN
    Model: 16544
    Made in: 2008
  Basic Display Parameters & Features:
    Digital display
    Maximum image size: 31 cm x 17 cm
    Gamma: 2.20
    DPMS levels: Standby Suspend Off
    RGB color display
    First detailed timing is the preferred timing
  Color Characteristics:
    Red  : 0.6181, 0.3554
    Green: 0.3300, 0.5839
    Blue : 0.1445, 0.0937
    White: 0.3134, 0.3291
  Established Timings I & II: none
  Standard Timings: none
  Detailed Timing Descriptors:
    DTD 1:  1366x768    59.973124 Hz 683:384   47.379 kHz     72.300000 MHz (309 mm x 174 mm)
                 Hfront   48 Hsync  32 Hback   80 Hpol N
                 Vfront    3 Vsync   5 Vback   14 Vpol N
    DTD 2:  1366x768    50.019079 Hz 683:384   39.515 kHz     60.300000 MHz (309 mm x 174 mm)
                 Hfront   48 Hsync  32 Hback   80 Hpol N
                 Vfront    3 Vsync   5 Vback   14 Vpol N
    Manufacturer-Specified Display Descriptor (0x0f): 00 0f 00 8c 09 32 8c 09 28 16 09 00 30 e4 cc 01 '.....2..(...0...'
    Alphanumeric Data String: 'LP140WH1-TLA1'
Checksum: 0xf4

----------------

Failures:

Block 0, Base EDID:
  Missing Display Product Name.
  Missing Display Range Limits Descriptor.

EDID conformity: FAIL
