edid-decode (hex):

00 ff ff ff ff ff ff 00 30 ae a0 40 00 00 00 00
01 13 01 03 80 1f 11 78 ea c8 a5 9e 57 54 92 26
99 50 54 00 00 00 01 01 01 01 01 01 01 01 01 01
01 01 01 01 01 01 f9 1a 56 46 50 00 21 30 26 16
36 00 35 ad 10 00 00 18 7a 16 56 46 50 00 21 30
26 16 36 00 35 ad 10 00 00 18 00 00 00 0f 00 8c
09 32 8c 09 28 16 09 00 06 af 56 37 00 00 00 fe
00 42 31 34 30 58 57 30 31 20 56 37 20 0a 00 9e

----------------

Block 0, Base EDID:
  EDID Structure Version & Revision: 1.3
  Vendor & Product Identification:
    Manufacturer: LEN
    Model: 16544
    Made in: week 1 of 2009
  Basic Display Parameters & Features:
    Digital display
    Maximum image size: 31 cm x 17 cm
    Gamma: 2.20
    DPMS levels: Standby Suspend Off
    RGB color display
    First detailed timing is preferred timing
  Color Characteristics:
    Red  : 0.6201, 0.3398
    Green: 0.3300, 0.5703
    Blue : 0.1503, 0.5996
    White: 0.3134, 0.3291
  Established Timings I & II: none
  Standard Timings: none
  Detailed Timing Descriptors:
    DTD 1:  1366x768    60.031 Hz 683:384  48.085 kHz  69.050 MHz (309 mm x 173 mm)
                 Hfront   38 Hsync  22 Hback  10 Hpol N
                 Vfront    3 Vsync   6 Vback  24 Vpol N
    DTD 2:  1366x768    50.025 Hz 683:384  40.070 kHz  57.540 MHz (309 mm x 173 mm)
                 Hfront   38 Hsync  22 Hback  10 Hpol N
                 Vfront    3 Vsync   6 Vback  24 Vpol N
    Manufacturer-Specified Display Descriptor (0x0f): 00 0f 00 8c 09 32 8c 09 28 16 09 00 06 af 56 37 '.....2..(.....V7'
    Alphanumeric Data String: 'B140XW01 V7 '
Checksum: 0x9e

----------------

Failures:

Block 0, Base EDID:
  Alphanumeric Data String: One or more trailing spaces.
  Missing Display Product Name.
  Missing Display Range Limits Descriptor.

EDID conformity: FAIL
