edid-decode (hex):

00 ff ff ff ff ff ff 00 30 ae a0 40 00 00 00 00
00 14 01 03 80 1f 11 78 ea 69 45 9b 5a 55 99 28
17 50 54 00 00 00 01 01 01 01 01 01 01 01 01 01
01 01 01 01 01 01 12 1b 56 68 50 00 11 30 20 18
34 00 35 ae 10 00 00 19 8a 16 56 68 50 00 11 30
20 18 34 00 35 ae 10 00 00 19 00 00 00 0f 00 8c
09 32 8c 09 28 16 09 00 30 e4 ae 02 00 00 00 fe
00 4c 50 31 34 30 57 48 31 2d 54 4c 42 33 00 88

----------------

Block 0, Base EDID:
  EDID Structure Version & Revision: 1.3
  Vendor & Product Identification:
    Manufacturer: LEN
    Model: 16544
    Made in: 2010
  Basic Display Parameters & Features:
    Digital display
    Maximum image size: 31 cm x 17 cm
    Gamma: 2.20
    DPMS levels: Standby Suspend Off
    RGB color display
    First detailed timing is preferred timing
  Color Characteristics:
    Red  : 0.6064, 0.3535
    Green: 0.3339, 0.5986
    Blue : 0.1572, 0.0898
    White: 0.3134, 0.3291
  Established Timings I & II: none
  Standard Timings: none
  Detailed Timing Descriptors:
    DTD 1:  1366x768    60.055 Hz 683:384  47.143 kHz  69.300 MHz (309 mm x 174 mm)
                 Hfront   32 Hsync  24 Hback  48 Hpol N
                 Vfront    3 Vsync   4 Vback  10 Vpol N
    DTD 2:  1366x768    50.002 Hz 683:384  39.252 kHz  57.700 MHz (309 mm x 174 mm)
                 Hfront   32 Hsync  24 Hback  48 Hpol N
                 Vfront    3 Vsync   4 Vback  10 Vpol N
    Manufacturer-Specified Display Descriptor (0x0f): 00 0f 00 8c 09 32 8c 09 28 16 09 00 30 e4 ae 02 '.....2..(...0...'
    Alphanumeric Data String: 'LP140WH1-TLB3'
Checksum: 0x88
