
EDID (hex):
00ffffffffffff0030ae114000000000
00130103801a1078ea5cd5935c5e8e27
1c505400000001010101010101010101
010101010101ee1a0080502010301030
130005a310000019d01700c650201930
3020360005a3100000190000000f0081
0a3c810a321609004ca34154000000fe
004c544e313231415430374c30320038

Extracted contents:
header:          00 ff ff ff ff ff ff 00
serial number:   30 ae 11 40 00 00 00 00 00 13
version:         01 03
basic params:    80 1a 10 78 ea
chroma info:     5c d5 93 5c 5e 8e 27 1c 50 54
established:     00 00 00
standard:        01 01 01 01 01 01 01 01 01 01 01 01 01 01 01 01
descriptor 1:    ee 1a 00 80 50 20 10 30 10 30 13 00 05 a3 10 00 00 19
descriptor 2:    d0 17 00 c6 50 20 19 30 30 20 36 00 05 a3 10 00 00 19
descriptor 3:    00 00 00 0f 00 81 0a 3c 81 0a 32 16 09 00 4c a3 41 54
descriptor 4:    00 00 00 fe 00 4c 54 4e 31 32 31 41 54 30 37 4c 30 32
extensions:      00
checksum:        38

EDID version: 1.3
Manufacturer: LEN Model 4011 Serial Number --
Made in year 2009
Digital display
Maximum image size: 26 cm x 16 cm
Gamma: 2.20
DPMS levels: Standby Suspend Off
RGB color display
First detailed timing is preferred timing
Display x,y Chromaticity:
  Red:   0.5751, 0.3603
  Green: 0.3701, 0.5546
  Blue:  0.1552, 0.1103
  White: 0.3134, 0.3291
Established timings supported:
Standard timings supported:
Detailed mode: Clock 68.940 MHz, 261 mm x 163 mm
               1280 1296 1344 1408 hborder 0
                800  801  804  816 vborder 0
               -hsync -vsync 
               VertFreq: 60 Hz, HorFreq: 48963 Hz
Detailed mode: Clock 60.960 MHz, 261 mm x 163 mm
               1280 1328 1360 1478 hborder 0
                800  803  809  825 vborder 0
               -hsync -vsync 
               VertFreq: 49 Hz, HorFreq: 41244 Hz
Manufacturer-specified data, tag 15
ASCII string: LTN121AT07L02
Checksum: 0x38 (valid)
EDID block does NOT conform to EDID 1.3!
	Missing name descriptor
	Missing monitor ranges
