edid-decode (hex):

00 ff ff ff ff ff ff 00 4c 83 43 41 00 00 00 00
19 1d 01 04 b5 22 13 78 02 38 d1 ae 51 3b b8 23
0b 50 54 00 00 00 01 01 01 01 01 01 01 01 01 01
01 01 01 01 01 01 48 d7 00 40 f1 70 30 80 30 20
44 00 58 c2 10 00 00 1b 48 d7 00 40 f1 70 30 80
30 20 44 00 58 c2 10 00 00 1b 00 00 00 0f 00 ff
09 3c ff 09 3c 2c 80 00 00 00 00 00 00 00 00 fe
00 41 54 4e 41 35 36 57 52 31 34 2d 30 20 01 49

02 03 0f 00 e3 05 80 00 e6 06 05 01 73 6d 07 00
00 00 00 00 00 00 00 00 00 00 00 00 00 00 00 00
00 00 00 00 00 00 00 00 00 00 00 00 00 00 00 00
00 00 00 00 00 00 00 00 00 00 00 00 00 00 00 00
00 00 00 00 00 00 00 00 00 00 00 00 00 00 00 00
00 00 00 00 00 00 00 00 00 00 00 00 00 00 00 00
00 00 00 00 00 00 00 00 00 00 00 00 00 00 00 00
00 00 00 00 00 00 00 00 00 00 00 00 00 00 00 ab

----------------

Block 0, Base EDID:
  EDID Structure Version & Revision: 1.4
  Vendor & Product Identification:
    Manufacturer: SDC
    Model: 16707
    Made in: week 25 of 2019
  Basic Display Parameters & Features:
    Digital display
    Bits per primary color channel: 10
    DisplayPort interface
    Maximum image size: 34 cm x 19 cm
    Gamma: 2.20
    Supported color formats: RGB 4:4:4
    First detailed timing includes the native pixel format and preferred refresh rate
  Color Characteristics:
    Red  : 0.6796, 0.3193
    Green: 0.2324, 0.7187
    Blue : 0.1396, 0.0439
    White: 0.3125, 0.3291
  Established Timings I & II: none
  Standard Timings: none
  Detailed Timing Descriptors:
    DTD 1:  3840x2160   60.000348 Hz  16:9    132.481 kHz    551.120000 MHz (344 mm x 194 mm)
                 Hfront   48 Hsync  32 Hback  240 Hpol P
                 Vfront    4 Vsync   4 Vback   40 Vpol N
    DTD 2:  3840x2160   60.000348 Hz  16:9    132.481 kHz    551.120000 MHz (344 mm x 194 mm)
                 Hfront   48 Hsync  32 Hback  240 Hpol P
                 Vfront    4 Vsync   4 Vback   40 Vpol N
    Manufacturer-Specified Display Descriptor (0x0f): 00 0f 00 ff 09 3c ff 09 3c 2c 80 00 00 00 00 00 '.....<..<,......'
    Alphanumeric Data String: 'ATNA56WR14-0 '
  Extension blocks: 1
Checksum: 0x49

----------------

Block 1, CTA-861 Extension Block:
  Revision: 3
  Native detailed modes: 0
  Colorimetry Data Block:
    BT2020RGB
  HDR Static Metadata Data Block:
    Electro optical transfer functions:
      Traditional gamma - SDR luminance range
      SMPTE ST2084
    Supported static metadata descriptors:
      Static metadata type 1
    Desired content max luminance: 115 (603.666 cd/m^2)
    Desired content max frame-average luminance: 109 (530.095 cd/m^2)
    Desired content min luminance: 7 (0.005 cd/m^2)
Checksum: 0xab  Unused space in Extension Block: 112 bytes

----------------

Warnings:

Block 0, Base EDID:
  Missing Display Product Name.
Block 1, CTA-861 Extension Block:
  IT Video Formats are overscanned by default, but normally this should be underscanned.
  Colorimetry Data Block: Set the sRGB colorimetry bit to avoid interop issues.

Failures:

Block 0, Base EDID:
  Alphanumeric Data String: One or more trailing spaces.
Block 1, CTA-861 Extension Block:
  Required 640x480p60 timings are missing in the established timings and the SVD list (VIC 1).
  Missing VCDB, needed for Set Selectable RGB Quantization to avoid interop issues.

EDID conformity: FAIL
