
EDID (hex):
00ffffffffffff003064e15801010101
20110103801a10780a87ae99574f8c26
22505400000001010101010101010101
0101010101019e20009051201f304880
360005a3100000180000000f0002d304
d500170118b9d7041900000000fe0054
4d444953504c41590a202020000000fe
004c5444313231455845560a2020004b

Extracted contents:
header:          00 ff ff ff ff ff ff 00
serial number:   30 64 e1 58 01 01 01 01 20 11
version:         01 03
basic params:    80 1a 10 78 0a
chroma info:     87 ae 99 57 4f 8c 26 22 50 54
established:     00 00 00
standard:        01 01 01 01 01 01 01 01 01 01 01 01 01 01 01 01
descriptor 1:    9e 20 00 90 51 20 1f 30 48 80 36 00 05 a3 10 00 00 18
descriptor 2:    00 00 00 0f 00 02 d3 04 d5 00 17 01 18 b9 d7 04 19 00
descriptor 3:    00 00 00 fe 00 54 4d 44 49 53 50 4c 41 59 0a 20 20 20
descriptor 4:    00 00 00 fe 00 4c 54 44 31 32 31 45 58 45 56 0a 20 20
extensions:      00
checksum:        4b

EDID version: 1.3
Manufacturer: LCD Model 58e1 Serial Number --
Made in week 32 of 2007
Digital display
Maximum image size: 26 cm x 16 cm
Gamma: 2.20
RGB color display
First detailed timing is preferred timing
Display x,y Chromaticity:
  Red:   0.5996, 0.3398
  Green: 0.3095, 0.5498
  Blue:  0.1503, 0.1347
  White: 0.3154, 0.3300
Established timings supported:
Standard timings supported:
Detailed mode: Clock 83.500 MHz, 261 mm x 163 mm
               1280 1352 1480 1680 hborder 0
                800  803  809  831 vborder 0
               -hsync -vsync 
               VertFreq: 59 Hz, HorFreq: 49702 Hz
Manufacturer-specified data, tag 15
ASCII string: TMDISPLAY
ASCII string: LTD121EXEV
Checksum: 0x4b (valid)
EDID block does NOT conform to EDID 1.3!
	Missing name descriptor
	Missing monitor ranges
