edid-decode (hex):

00 ff ff ff ff ff ff 00 22 f0 78 26 01 01 01 01
21 10 01 03 68 28 19 78 ee d6 a5 a2 59 4a 95 24
14 50 54 a5 6b 80 81 00 81 40 81 80 95 00 01 01
01 01 01 01 01 01 9a 29 a0 d0 51 84 22 30 50 98
36 00 9a 00 10 00 00 1c 00 00 00 fd 00 30 4b 1e
53 11 00 0a 20 20 20 20 20 20 00 00 00 fc 00 48
50 20 77 31 39 0a 20 20 20 20 20 20 00 00 00 ff
00 43 4e 43 36 33 33 51 4d 48 58 0a 20 20 00 15

----------------

Block 0, Base EDID:
  EDID Structure Version & Revision: 1.3
  Vendor & Product Identification:
    Manufacturer: HWP
    Model: 9848
    Serial Number: ...
    Made in: week 33 of 2006
  Basic Display Parameters & Features:
    Analog display
    Input voltage level: 0.7/0.7 V
    Sync: Separate
    Maximum image size: 40 cm x 25 cm
    Gamma: 2.20
    DPMS levels: Standby Suspend Off
    RGB color display
    Default (sRGB) color space is primary color space
    First detailed timing is preferred timing
  Color Characteristics:
    Red  : 0.6357, 0.3486
    Green: 0.2900, 0.5839
    Blue : 0.1425, 0.0800
    White: 0.3134, 0.3291
  Established Timings I & II:
    IBM     :   720x400    70.082 Hz   9:5    31.467 kHz  28.320 MHz
    DMT 0x04:   640x480    59.940 Hz   4:3    31.469 kHz  25.175 MHz
    DMT 0x06:   640x480    75.000 Hz   4:3    37.500 kHz  31.500 MHz
    DMT 0x09:   800x600    60.317 Hz   4:3    37.879 kHz  40.000 MHz
    DMT 0x0b:   800x600    75.000 Hz   4:3    46.875 kHz  49.500 MHz
    Apple   :   832x624    74.551 Hz   4:3    49.726 kHz  57.284 MHz
    DMT 0x10:  1024x768    60.004 Hz   4:3    48.363 kHz  65.000 MHz
    DMT 0x12:  1024x768    75.029 Hz   4:3    60.023 kHz  78.750 MHz
    DMT 0x24:  1280x1024   75.025 Hz   5:4    79.976 kHz 135.000 MHz
    Apple   :  1152x870    75.062 Hz 192:145  68.681 kHz 100.000 MHz
  Standard Timings:
    DMT 0x1c:  1280x800    59.810 Hz  16:10   49.702 kHz  83.500 MHz
    DMT 0x20:  1280x960    60.000 Hz   4:3    60.000 kHz 108.000 MHz
    DMT 0x23:  1280x1024   60.020 Hz   5:4    63.981 kHz 108.000 MHz
    DMT 0x2f:  1440x900    59.887 Hz  16:10   55.935 kHz 106.500 MHz
  Detailed Timing Descriptors:
    DTD 1:  1440x900    59.887 Hz   8:5    55.935 kHz 106.500 MHz (410 mm x 0 mm)
                 Hfront   80 Hsync 152 Hback 232 Hpol N
                 Vfront    3 Vsync   6 Vback  25 Vpol P
  Display Range Limits:
    Monitor ranges (GTF): 48-75 Hz V, 30-83 kHz H, max dotclock 170 MHz
    Display Product Name: 'HP w19'
    Display Product Serial Number: ...
Checksum: 0x15

----------------

Failures:

Block 0, Base EDID:
  Basic Display Parameters & Features: sRGB is signaled, but the chromaticities do not match.
  Detailed Timing Descriptor #1: Mismatch of image size 410x0 mm vs display size 400x250 mm.
  Detailed Timing Descriptor #1: Mismatch of image size vs display size: image size is not set, but display size is.

EDID conformity: FAIL
