edid-decode (hex):

00 ff ff ff ff ff ff 00 c1 d0 10 00 00 00 00 00
00 ff 01 03 80 00 00 78 0a 0d c9 a0 57 47 98 27
12 48 4c 01 08 00 45 40 61 40 01 01 01 01 01 01
01 01 01 01 01 01 01 1d 00 bc 52 d0 1e 20 b8 28
55 40 00 00 00 00 00 1e c0 12 00 00 51 80 62 40
15 70 55 00 00 00 00 00 00 9e 20 1c 50 a0 50 00
16 30 30 20 35 00 00 00 00 50 0e 1e 00 00 00 fd
00 3b 3d 00 2e 08 00 00 00 00 00 00 00 00 01 b3

02 03 1f 71 4c 84 02 03 05 06 07 11 12 13 14 15
16 23 09 07 07 83 01 00 00 65 03 0c 00 00 00 01
1d 00 bc 52 d0 1e 20 b8 28 55 40 00 00 00 00 00
1e 01 1d 00 bc 52 d0 1e 20 b8 28 55 40 00 00 00
00 00 1e 01 1d 00 bc 52 d0 1e 20 b8 28 55 40 00
00 00 00 00 1e 01 1d 00 bc 52 d0 1e 20 b8 28 55
40 00 00 00 00 00 1e 01 1d 00 bc 52 d0 1e 20 b8
28 55 40 00 00 00 00 00 1e 00 00 00 00 00 00 dc

----------------

Block 0, Base EDID:
  EDID Structure Version & Revision: 1.3
  Vendor & Product Identification:
    Manufacturer: PNP
    Model: 16
    Made in: 2245
  Basic Display Parameters & Features:
    Digital display
    Image size is variable
    Gamma: 2.20
    RGB color display
    First detailed timing is the preferred timing
  Color Characteristics:
    Red  : 0.6250, 0.3398
    Green: 0.2802, 0.5947
    Blue : 0.1552, 0.0703
    White: 0.2832, 0.2978
  Established Timings I & II:
    DMT 0x09:   800x600    60.316541 Hz   4:3     37.879 kHz     40.000000 MHz
    DMT 0x10:  1024x768    60.003840 Hz   4:3     48.363 kHz     65.000000 MHz
  Standard Timings:
    DMT 0x09:   800x600    60.316541 Hz   4:3     37.879 kHz     40.000000 MHz
    DMT 0x10:  1024x768    60.003840 Hz   4:3     48.363 kHz     65.000000 MHz
  Detailed Timing Descriptors:
    DTD 1:  1280x720    50.000000 Hz  16:9     37.500 kHz     74.250000 MHz
                 Hfront  440 Hsync  40 Hback  220 Hpol P
                 Vfront    5 Vsync   5 Vback   20 Vpol P
    DTD 2:  1280x2304i  24.990004 Hz   5:9     31.250 kHz     48.000000 MHz
                 Hfront   21 Hsync 112 Hback  123 Hpol P
                 Vfront    5 Vsync   5 Vback   88 Vpol P Vfront +0.5 Odd Field
                 Vfront    5 Vsync   5 Vback   88 Vpol P Vback  +0.5 Even Field
    DTD 3:  1360x768    59.960027 Hz  85:48    47.368 kHz     72.000000 MHz
                 Hfront   48 Hsync  32 Hback  -80 Hpol P Hborder 80
                 Vfront    3 Vsync   5 Vback  -14 Vpol P Vborder 14
    Display Range Limits:
      Monitor ranges (GTF): 59-61 Hz V, 0-46 kHz H, max dotclock 80 MHz
  Extension blocks: 1
Checksum: 0xb3

----------------

Block 1, CTA-861 Extension Block:
  Revision: 3
  Basic audio support
  Supports YCbCr 4:4:4
  Supports YCbCr 4:2:2
  Native detailed modes: 1
  Video Data Block:
    VIC   4:  1280x720    60.000000 Hz  16:9     45.000 kHz     74.250000 MHz (native)
    VIC   2:   720x480    59.940060 Hz   4:3     31.469 kHz     27.000000 MHz
    VIC   3:   720x480    59.940060 Hz  16:9     31.469 kHz     27.000000 MHz
    VIC   5:  1920x1080i  60.000000 Hz  16:9     33.750 kHz     74.250000 MHz
    VIC   6:  1440x480i   59.940060 Hz   4:3     15.734 kHz     27.000000 MHz
    VIC   7:  1440x480i   59.940060 Hz  16:9     15.734 kHz     27.000000 MHz
    VIC  17:   720x576    50.000000 Hz   4:3     31.250 kHz     27.000000 MHz
    VIC  18:   720x576    50.000000 Hz  16:9     31.250 kHz     27.000000 MHz
    VIC  19:  1280x720    50.000000 Hz  16:9     37.500 kHz     74.250000 MHz
    VIC  20:  1920x1080i  50.000000 Hz  16:9     28.125 kHz     74.250000 MHz
    VIC  21:  1440x576i   50.000000 Hz   4:3     15.625 kHz     27.000000 MHz
    VIC  22:  1440x576i   50.000000 Hz  16:9     15.625 kHz     27.000000 MHz
  Audio Data Block:
    Linear PCM:
      Max channels: 2
      Supported sample rates (kHz): 48 44.1 32
      Supported sample sizes (bits): 24 20 16
  Speaker Allocation Data Block:
    FL/FR - Front Left/Right
  Vendor-Specific Data Block (HDMI), OUI 00-0C-03:
    Source physical address: 0.0.0.0
  Detailed Timing Descriptors:
    DTD 4:  1280x720    50.000000 Hz  16:9     37.500 kHz     74.250000 MHz
                 Hfront  440 Hsync  40 Hback  220 Hpol P
                 Vfront    5 Vsync   5 Vback   20 Vpol P
    DTD 5:  1280x720    50.000000 Hz  16:9     37.500 kHz     74.250000 MHz
                 Hfront  440 Hsync  40 Hback  220 Hpol P
                 Vfront    5 Vsync   5 Vback   20 Vpol P
    DTD 6:  1280x720    50.000000 Hz  16:9     37.500 kHz     74.250000 MHz
                 Hfront  440 Hsync  40 Hback  220 Hpol P
                 Vfront    5 Vsync   5 Vback   20 Vpol P
    DTD 7:  1280x720    50.000000 Hz  16:9     37.500 kHz     74.250000 MHz
                 Hfront  440 Hsync  40 Hback  220 Hpol P
                 Vfront    5 Vsync   5 Vback   20 Vpol P
    DTD 8:  1280x720    50.000000 Hz  16:9     37.500 kHz     74.250000 MHz
                 Hfront  440 Hsync  40 Hback  220 Hpol P
                 Vfront    5 Vsync   5 Vback   20 Vpol P
Checksum: 0xdc

----------------

Warnings:

Block 0, Base EDID:
  Detailed Timing Descriptor #3: The use of non-zero borders in a DTD is not recommended.
Block 1, CTA-861 Extension Block:
  IT Video Formats are overscanned by default, but normally this should be underscanned.
EDID:
  CTA-861: Multiple native progressive timings are defined.

Failures:

Block 0, Base EDID:
  Vendor & Product Identification: The year 2245 is more than one year in the future.
  Detailed Timing Descriptor #3: 0 or negative horizontal back porch.
  Detailed Timing Descriptor #3: 0 or negative vertical back porch.
  Display Range Limits: Byte 11 is 0x00 instead of 0x0a.
  Display Range Limits: Bytes 12-17 must be 0x20.
  Missing Display Product Name.
Block 1, CTA-861 Extension Block:
  Required 640x480p60 timings are missing in the established timings and the SVD list (VIC 1).
  Missing VCDB, needed for Set Selectable RGB Quantization to avoid interop issues.
EDID:
  Base EDID: Some timings are out of range of the Monitor Ranges:
    Vertical Freq: 24.990 - 60.317 Hz (Monitor: 59.000 - 61.000 Hz)
    Horizontal Freq: 15.625 - 48.363 kHz (Monitor: 0.000 - 46.000 kHz)

EDID conformity: FAIL
