
EDID (hex):
00ffffffffffff001ab3110875d40000
31160103683420782a01f5a257529f27
0a5054a54b00a940b30095008180a9c0
d1c001010101283c80a070b023403020
360006442100001a000000fd00384c1e
5211000a202020202020000000fc0042
3234572d36204c45440a2020000000ff
005956354b3035343338390a20200029

Extracted contents:
header:          00 ff ff ff ff ff ff 00
serial number:   1a b3 11 08 75 d4 00 00 31 16
version:         01 03
basic params:    68 34 20 78 2a
chroma info:     01 f5 a2 57 52 9f 27 0a 50 54
established:     a5 4b 00
standard:        a9 40 b3 00 95 00 81 80 a9 c0 d1 c0 01 01 01 01
descriptor 1:    28 3c 80 a0 70 b0 23 40 30 20 36 00 06 44 21 00 00 1a
descriptor 2:    00 00 00 fd 00 38 4c 1e 52 11 00 0a 20 20 20 20 20 20
descriptor 3:    00 00 00 fc 00 42 32 34 57 2d 36 20 4c 45 44 0a 20 20
descriptor 4:    00 00 00 ff 00 59 56 35 4b 30 35 34 33 38 39 0a 20 20
extensions:      00
checksum:        29

EDID version: 1.3
Manufacturer: FUS Model 811 Serial Number --
Made in week 49 of 2012
Analog display, Input voltage level: 0.7/0.7 V
Sync: Separate 
Maximum image size: 52 cm x 32 cm
Gamma: 2.20
DPMS levels: Off
RGB color display
First detailed timing is preferred timing
Display x,y Chromaticity:
  Red:   0.6328, 0.3398
  Green: 0.3203, 0.6220
  Blue:  0.1552, 0.0419
  White: 0.3134, 0.3291
Established timings supported:
  720x400@70Hz 9:5 HorFreq: 31469 Hz Clock: 28.320 MHz
  640x480@60Hz 4:3 HorFreq: 31469 Hz Clock: 25.175 MHz
  640x480@75Hz 4:3 HorFreq: 37500 Hz Clock: 31.500 MHz
  800x600@60Hz 4:3 HorFreq: 37900 Hz Clock: 40.000 MHz
  800x600@75Hz 4:3 HorFreq: 46900 Hz Clock: 49.500 MHz
  1024x768@60Hz 4:3 HorFreq: 48400 Hz Clock: 65.000 MHz
  1024x768@75Hz 4:3 HorFreq: 60000 Hz Clock: 78.750 MHz
  1280x1024@75Hz 5:4 HorFreq: 80000 Hz Clock: 135.000 MHz
Standard timings supported:
  1600x1200@60Hz 4:3 HorFreq: 75000 Hz Clock: 162.000 MHz
  1680x1050@60Hz 16:10 HorFreq: 64700 Hz Clock: 119.000 MHz
  1440x900@60Hz 16:10 HorFreq: 55500 Hz Clock: 88.750 MHz
  1280x1024@60Hz 5:4 HorFreq: 64000 Hz Clock: 108.000 MHz
  1600x900@60Hz 16:9
  1920x1080@60Hz 16:9
Detailed mode: Clock 154.000 MHz, 518 mm x 324 mm
               1920 1968 2000 2080 hborder 0
               1200 1203 1209 1235 vborder 0
               +hsync -vsync 
               VertFreq: 59 Hz, HorFreq: 74038 Hz
Monitor ranges (GTF): 56-76Hz V, 30-82kHz H, max dotclock 170MHz
Monitor name: B24W-6 LED
Serial number: --
Checksum: 0x29 (valid)
