
EDID (hex):
00ffffffffffff001e6d5077dbf71f00
0a210104b5462878fb7ba1ae4f44a926
0c5054210800d1c06140010101010101
01010101010100d200a0f07050803020
3500b9882100001a000000fd00283c87
873c010a202020202020000000fc004c
472048445220344b0a202020000000ff
003331304d414d424a343636370a012f
02031f72230907078301000044010304
10e2006ae305c000e6060501595952a3
6600a0f0701f8030203a00b988210000
1a565e00a0a0a0295030203500b98821
00001a023a801871382d40582c4500b9
882100001a0000000000000000000000
00000000000000000000000000000000
0000000000000000000000000000007b

edid-decode (hex):

00 ff ff ff ff ff ff 00 1e 6d 50 77 db f7 1f 00
0a 21 01 04 b5 46 28 78 fb 7b a1 ae 4f 44 a9 26
0c 50 54 21 08 00 d1 c0 61 40 01 01 01 01 01 01
01 01 01 01 01 01 00 d2 00 a0 f0 70 50 80 30 20
35 00 b9 88 21 00 00 1a 00 00 00 fd 00 28 3c 87
87 3c 01 0a 20 20 20 20 20 20 00 00 00 fc 00 4c
47 20 48 44 52 20 34 4b 0a 20 20 20 00 00 00 ff
00 33 31 30 4d 41 4d 42 4a 34 36 36 37 0a 01 2f

02 03 1f 72 23 09 07 07 83 01 00 00 44 01 03 04
10 e2 00 6a e3 05 c0 00 e6 06 05 01 59 59 52 a3
66 00 a0 f0 70 1f 80 30 20 3a 00 b9 88 21 00 00
1a 56 5e 00 a0 a0 a0 29 50 30 20 35 00 b9 88 21
00 00 1a 02 3a 80 18 71 38 2d 40 58 2c 45 00 b9
88 21 00 00 1a 00 00 00 00 00 00 00 00 00 00 00
00 00 00 00 00 00 00 00 00 00 00 00 00 00 00 00
00 00 00 00 00 00 00 00 00 00 00 00 00 00 00 7b

----------------

Block 0, Base EDID:
  EDID Structure Version & Revision: 1.4
  Vendor & Product Identification:
    Manufacturer: GSM
    Model: 30544
    Serial Number: 2095067
    Made in: week 10 of 2023
  Basic Display Parameters & Features:
    Digital display
    Bits per primary color channel: 10
    DisplayPort interface
    Maximum image size: 70 cm x 40 cm
    Gamma: 2.20
    DPMS levels: Standby Suspend Off
    Supported color formats: RGB 4:4:4, YCrCb 4:4:4, YCrCb 4:2:2
    First detailed timing includes the native pixel format and preferred refresh rate
    Display is continuous frequency
  Color Characteristics:
    Red  : 0.6806, 0.3115
    Green: 0.2675, 0.6630
    Blue : 0.1503, 0.0488
    White: 0.3125, 0.3291
  Established Timings I & II:
    DMT 0x04:   640x480    59.940476 Hz   4:3     31.469 kHz     25.175000 MHz
    DMT 0x09:   800x600    60.316541 Hz   4:3     37.879 kHz     40.000000 MHz
    DMT 0x10:  1024x768    60.003840 Hz   4:3     48.363 kHz     65.000000 MHz
  Standard Timings:
    DMT 0x52:  1920x1080   60.000000 Hz  16:9     67.500 kHz    148.500000 MHz
    DMT 0x10:  1024x768    60.003840 Hz   4:3     48.363 kHz     65.000000 MHz
  Detailed Timing Descriptors:
    DTD 1:  3840x2160   60.000000 Hz  16:9    134.400 kHz    537.600000 MHz (697 mm x 392 mm)
                 Hfront   48 Hsync  32 Hback   80 Hpol P
                 Vfront    3 Vsync   5 Vback   72 Vpol N
    Display Range Limits:
      Monitor ranges (Bare Limits): 40-60 Hz V, 135-135 kHz H, max dotclock 600 MHz
    Display Product Name: 'LG HDR 4K'
    Display Product Serial Number: '310MAMBJ4667'
  Extension blocks: 1
Checksum: 0x2f

----------------

Block 1, CTA-861 Extension Block:
  Revision: 3
  Basic audio support
  Supports YCbCr 4:4:4
  Supports YCbCr 4:2:2
  Native detailed modes: 2
  Audio Data Block:
    Linear PCM:
      Max channels: 2
      Supported sample rates (kHz): 48 44.1 32
      Supported sample sizes (bits): 24 20 16
  Speaker Allocation Data Block:
    FL/FR - Front Left/Right
  Video Data Block:
    VIC   1:   640x480    59.940476 Hz   4:3     31.469 kHz     25.175000 MHz
    VIC   3:   720x480    59.940060 Hz  16:9     31.469 kHz     27.000000 MHz
    VIC   4:  1280x720    60.000000 Hz  16:9     45.000 kHz     74.250000 MHz
    VIC  16:  1920x1080   60.000000 Hz  16:9     67.500 kHz    148.500000 MHz
  Video Capability Data Block:
    YCbCr quantization: No Data
    RGB quantization: Selectable (via AVI Q)
    PT scan behavior: Always Underscanned
    IT scan behavior: Always Underscanned
    CE scan behavior: Always Underscanned
  Colorimetry Data Block:
    BT2020YCC
    BT2020RGB
  HDR Static Metadata Data Block:
    Electro optical transfer functions:
      Traditional gamma - SDR luminance range
      SMPTE ST2084
    Supported static metadata descriptors:
      Static metadata type 1
    Desired content max luminance: 89 (343.724 cd/m^2)
    Desired content max frame-average luminance: 89 (343.724 cd/m^2)
    Desired content min luminance: 82 (0.355 cd/m^2)
  Detailed Timing Descriptors:
    DTD 2:  3840x2160   29.980602 Hz  16:9     65.688 kHz    262.750000 MHz (697 mm x 392 mm)
                 Hfront   48 Hsync  32 Hback   80 Hpol P
                 Vfront    3 Vsync  10 Vback   18 Vpol N
    DTD 3:  2560x1440   59.950550 Hz  16:9     88.787 kHz    241.500000 MHz (697 mm x 392 mm)
                 Hfront   48 Hsync  32 Hback   80 Hpol P
                 Vfront    3 Vsync   5 Vback   33 Vpol N
    DTD 4:  1920x1080   60.000000 Hz  16:9     67.500 kHz    148.500000 MHz (697 mm x 392 mm)
                 Hfront   88 Hsync  44 Hback  148 Hpol P
                 Vfront    4 Vsync   5 Vback   36 Vpol N
Checksum: 0x7b  Unused space in Extension Block: 42 bytes
