
EDID (hex):
00ffffffffffff00220e903401010101
2d1d0104a52e1a7822b755a45951a127
115054a10800d1c081c081809500a9c0
b30081000101023a801871382d40582c
4500ca021100001e000000fd00323c1e
5011000a202020202020000000fc0048
502056323134610a20202020000000ff
00434e4339343532394e4a0a20200001

Extracted contents:
header:          00 ff ff ff ff ff ff 00
serial number:   22 0e 90 34 01 01 01 01 2d 1d
version:         01 04
basic params:    a5 2e 1a 78 22
chroma info:     b7 55 a4 59 51 a1 27 11 50 54
established:     a1 08 00
standard:        d1 c0 81 c0 81 80 95 00 a9 c0 b3 00 81 00 01 01
descriptor 1:    02 3a 80 18 71 38 2d 40 58 2c 45 00 ca 02 11 00 00 1e
descriptor 2:    00 00 00 fd 00 32 3c 1e 50 11 00 0a 20 20 20 20 20 20
descriptor 3:    00 00 00 fc 00 48 50 20 56 32 31 34 61 0a 20 20 20 20
descriptor 4:    00 00 00 ff 00 43 4e 43 39 34 35 32 39 4e 4a 0a 20 20
extensions:      00
checksum:        01

EDID version: 1.4
Manufacturer: HPN Model 3490 Serial Number --
Made in week 45 of 2019
Digital display
8 bits per primary color channel
DisplayPort interface
Maximum image size: 46 cm x 26 cm
Gamma: 2.20
DPMS levels: Off
Supported color formats: RGB 4:4:4
First detailed timing includes the native pixel format and preferred refresh rate
Display x,y Chromaticity:
  Red:   0.6425, 0.3505
  Green: 0.3173, 0.6318
  Blue:  0.1533, 0.0673
  White: 0.3134, 0.3291
Established timings supported:
  720x400@70Hz 9:5 HorFreq: 31469 Hz Clock: 28.320 MHz
  640x480@60Hz 4:3 HorFreq: 31469 Hz Clock: 25.175 MHz
  800x600@60Hz 4:3 HorFreq: 37900 Hz Clock: 40.000 MHz
  1024x768@60Hz 4:3 HorFreq: 48400 Hz Clock: 65.000 MHz
Standard timings supported:
  1920x1080@60Hz 16:9
  1280x720@60Hz 16:9
  1280x1024@60Hz 5:4 HorFreq: 64000 Hz Clock: 108.000 MHz
  1440x900@60Hz 16:10 HorFreq: 55500 Hz Clock: 88.750 MHz
  1600x900@60Hz 16:9
  1680x1050@60Hz 16:10 HorFreq: 64700 Hz Clock: 119.000 MHz
  1280x800@60Hz 16:10
Detailed mode: Clock 148.500 MHz, 458 mm x 258 mm
               1920 2008 2052 2200 hborder 0
               1080 1084 1089 1125 vborder 0
               +hsync +vsync 
               VertFreq: 60 Hz, HorFreq: 67500 Hz
Monitor ranges (GTF): 50-60Hz V, 30-80kHz H, max dotclock 170MHz
Monitor name: HP V214a
Serial number: --
Checksum: 0x1 (valid)
Warning: One or more of the timings is out of range of the Monitor Ranges:
  Vertical Freq: 60 - 70 Hz
  Horizontal Freq: 31469 - 67500 Hz
  Maximum Clock: 148.500 MHz


