edid-decode (hex):

00 ff ff ff ff ff ff 00 30 ae 36 40 00 00 00 00
01 13 01 03 80 1e 13 78 ea fc c5 97 57 56 91 25
20 50 54 00 00 00 01 01 01 01 01 01 01 01 01 01
01 01 01 01 01 01 92 27 a0 8a 51 84 14 30 30 20
36 00 2f bd 10 00 00 18 91 27 a0 d0 51 84 a4 30
30 20 36 00 2f bd 10 00 00 18 00 00 00 0f 00 95
0a 32 95 0a 28 16 09 00 06 af 56 30 00 00 00 fe
00 42 31 34 31 50 57 30 34 20 56 30 20 0a 00 45

----------------

Block 0, Base EDID:
  EDID Structure Version & Revision: 1.3
  Vendor & Product Identification:
    Manufacturer: LEN
    Model: 16438
    Made in: week 1 of 2009
  Basic Display Parameters & Features:
    Digital display
    Maximum image size: 30 cm x 19 cm
    Gamma: 2.20
    DPMS levels: Standby Suspend Off
    RGB color display
    First detailed timing is preferred timing
  Color Characteristics:
    Red  : 0.5927, 0.3427
    Green: 0.3388, 0.5664
    Blue : 0.1474, 0.1250
    White: 0.3134, 0.3291
  Established Timings I & II: none
  Standard Timings: none
  Detailed Timing Descriptors:
    DTD 1:  1440x900    60.037 Hz   8:5    55.234 kHz 101.300 MHz (303 mm x 189 mm)
                 Hfront   48 Hsync  32 Hback 314 Hpol N
                 Vfront    3 Vsync   6 Vback  11 Vpol N
    DTD 2:  1440x900    49.999 Hz   8:5    53.199 kHz 101.290 MHz (303 mm x 189 mm)
                 Hfront   48 Hsync  32 Hback 384 Hpol N
                 Vfront    3 Vsync   6 Vback 155 Vpol N
    Manufacturer-Specified Display Descriptor (0x0f): 00 0f 00 95 0a 32 95 0a 28 16 09 00 06 af 56 30 '.....2..(.....V0'
    Alphanumeric Data String: 'B141PW04 V0 '
Checksum: 0x45
