edid-decode (hex):

00 ff ff ff ff ff ff 00 30 ae 36 40 00 00 00 00
14 14 01 03 80 1e 13 78 ea e5 95 93 56 4f 90 28
28 50 54 00 00 00 01 01 01 01 01 01 01 01 01 01
01 01 01 01 01 01 88 27 a0 6c 51 84 22 30 30 20
36 00 30 be 10 00 00 18 08 20 a0 68 51 84 18 30
30 20 36 00 30 be 10 00 00 18 00 00 00 0f 00 95
0a 32 95 0a 28 1e 09 00 30 64 08 11 00 00 00 fe
00 4c 54 31 34 31 44 45 51 38 42 30 30 0a 00 59

----------------

Block 0, Base EDID:
  EDID Structure Version & Revision: 1.3
  Vendor & Product Identification:
    Manufacturer: LEN
    Model: 16438
    Made in: week 20 of 2010
  Basic Display Parameters & Features:
    Digital display
    Maximum image size: 30 cm x 19 cm
    Gamma: 2.20
    DPMS levels: Standby Suspend Off
    RGB color display
    First detailed timing is the preferred timing
  Color Characteristics:
    Red  : 0.5771, 0.3378
    Green: 0.3095, 0.5634
    Blue : 0.1582, 0.1572
    White: 0.3134, 0.3291
  Established Timings I & II: none
  Standard Timings: none
  Detailed Timing Descriptors:
    DTD 1:  1440x900    60.061628 Hz  16:10    56.098 kHz    101.200000 MHz (304 mm x 190 mm)
                 Hfront   48 Hsync  32 Hback  284 Hpol N
                 Vfront    3 Vsync   6 Vback   25 Vpol N
    DTD 2:  1440x900    49.302549 Hz  16:10    45.556 kHz     82.000000 MHz (304 mm x 190 mm)
                 Hfront   48 Hsync  32 Hback  280 Hpol N
                 Vfront    3 Vsync   6 Vback   15 Vpol N
    Manufacturer-Specified Display Descriptor (0x0f): 00 0f 00 95 0a 32 95 0a 28 1e 09 00 30 64 08 11 '.....2..(...0d..'
    Alphanumeric Data String: 'LT141DEQ8B00'
Checksum: 0x59

----------------

Failures:

Block 0, Base EDID:
  Missing Display Product Name.
  Missing Display Range Limits Descriptor.

EDID conformity: FAIL
