edid-decode (hex):

00 ff ff ff ff ff ff 00 06 af ec 10 00 00 00 00
00 18 01 04 95 22 13 78 02 bb f5 94 55 54 90 27
23 50 54 00 00 00 01 01 01 01 01 01 01 01 01 01
01 01 01 01 01 01 ce 1d 56 be 50 00 30 30 08 0a
36 00 58 c1 10 00 00 18 df 13 56 be 50 00 30 30
08 0a 36 00 58 c1 10 00 00 18 00 00 00 00 00 00
00 00 00 00 00 00 00 00 00 00 00 00 00 00 00 02
00 10 4c ff 0f 3c 64 0f 0b 11 64 20 20 20 00 07

----------------

Block 0, Base EDID:
  EDID Structure Version & Revision: 1.4
  Vendor & Product Identification:
    Manufacturer: AUO
    Model: 4332
    Made in: 2014
  Basic Display Parameters & Features:
    Digital display
    Bits per primary color channel: 6
    DisplayPort interface
    Maximum image size: 34 cm x 19 cm
    Gamma: 2.20
    Supported color formats: RGB 4:4:4
    First detailed timing includes the native pixel format and preferred refresh rate
  Color Characteristics:
    Red  : 0.5800, 0.3349
    Green: 0.3300, 0.5654
    Blue : 0.1552, 0.1396
    White: 0.3134, 0.3291
  Established Timings I & II: none
  Standard Timings: none
  Detailed Timing Descriptors:
    DTD 1:  1366x768    60.093125 Hz 683:384   49.036 kHz     76.300000 MHz (344 mm x 193 mm)
                 Hfront    8 Hsync  10 Hback  172 Hpol N
                 Vfront    3 Vsync   6 Vback   39 Vpol N
    DTD 2:  1366x768    40.064708 Hz 683:384   32.693 kHz     50.870000 MHz (344 mm x 193 mm)
                 Hfront    8 Hsync  10 Hback  172 Hpol N
                 Vfront    3 Vsync   6 Vback   39 Vpol N
    Empty Descriptor
    Manufacturer-Specified Display Descriptor (0x02): 00 02 00 10 4c ff 0f 3c 64 0f 0b 11 64 20 20 20 '....L..<d...d   '
Checksum: 0x07

----------------

Failures:

Block 0, Base EDID:
  Empty Descriptor: Use Dummy Descriptor instead of all zeroes.
  Missing Display Product Name.

EDID conformity: FAIL
