
EDID (hex):
00ffffffffffff0009e59d0800000000
00110103801a10780a6f8c905a548a25
1e4c5200000001010101010101010101
010101010101121b00a0502017303020
360005a310000019000000fe000a2020
20202020202020202020000000fe0042
4f452048594449530a202020000000fe
0048583132315758312d3130300a0062

Extracted contents:
header:          00 ff ff ff ff ff ff 00
serial number:   09 e5 9d 08 00 00 00 00 00 11
version:         01 03
basic params:    80 1a 10 78 0a
chroma info:     6f 8c 90 5a 54 8a 25 1e 4c 52
established:     00 00 00
standard:        01 01 01 01 01 01 01 01 01 01 01 01 01 01 01 01
descriptor 1:    12 1b 00 a0 50 20 17 30 30 20 36 00 05 a3 10 00 00 19
descriptor 2:    00 00 00 fe 00 0a 20 20 20 20 20 20 20 20 20 20 20 20
descriptor 3:    00 00 00 fe 00 42 4f 45 20 48 59 44 49 53 0a 20 20 20
descriptor 4:    00 00 00 fe 00 48 58 31 32 31 57 58 31 2d 31 30 30 0a
extensions:      00
checksum:        62

EDID version: 1.3
Manufacturer: BOE Model 89d Serial Number --
Made in year 2007
Digital display
Maximum image size: 26 cm x 16 cm
Gamma: 2.20
RGB color display
First detailed timing is preferred timing
Display x,y Chromaticity:
  Red:   0.5634, 0.3535
  Green: 0.3310, 0.5419
  Blue:  0.1464, 0.1171
  White: 0.2998, 0.3203
Established timings supported:
Standard timings supported:
Detailed mode: Clock 69.300 MHz, 261 mm x 163 mm
               1280 1328 1360 1440 hborder 0
                800  803  809  823 vborder 0
               -hsync -vsync 
               VertFreq: 58 Hz, HorFreq: 48125 Hz
ASCII string: 
ASCII string: BOE HYDIS
ASCII string: HX121WX1-100
Checksum: 0x62 (valid)
EDID block does NOT conform to EDID 1.3!
	Missing name descriptor
	Missing monitor ranges
