edid-decode (hex):

00 ff ff ff ff ff ff 00 09 e5 9d 08 00 00 00 00
00 12 01 03 80 1a 10 78 0a e7 95 95 5f 58 90 26
23 50 54 00 00 00 01 01 01 01 01 01 01 01 01 01
01 01 01 01 01 01 c7 1b 00 a0 50 20 17 30 30 20
36 00 05 a3 10 00 00 19 00 00 00 fe 00 0a 20 20
20 20 20 20 20 20 20 20 20 20 00 00 00 fe 00 48
59 44 49 53 0a 20 20 20 20 20 20 20 00 00 00 fe
00 48 58 31 32 31 57 58 31 0a 20 20 20 20 00 bf

----------------

Block 0, Base EDID:
  EDID Structure Version & Revision: 1.3
  Vendor & Product Identification:
    Manufacturer: BOE
    Model: 2205
    Made in: 2008
  Basic Display Parameters & Features:
    Digital display
    Maximum image size: 26 cm x 16 cm
    Gamma: 2.20
    RGB color display
    First detailed timing is preferred timing
  Color Characteristics:
    Red  : 0.5849, 0.3730
    Green: 0.3447, 0.5654
    Blue : 0.1503, 0.1376
    White: 0.3134, 0.3291
  Established Timings I & II: none
  Standard Timings: none
  Detailed Timing Descriptors:
    DTD 1:  1280x800    60.002 Hz   8:5    49.382 kHz  71.110 MHz (261 mm x 163 mm)
                 Hfront   48 Hsync  32 Hback  80 Hpol N
                 Vfront    3 Vsync   6 Vback  14 Vpol N
    Alphanumeric Data String: ''
    Alphanumeric Data String: 'HYDIS'
    Alphanumeric Data String: 'HX121WX1'
Checksum: 0xbf

----------------

Failures:

Block 0, Base EDID:
  Alphanumeric Data String: Empty string.
  Missing Display Product Name.
  Missing Display Range Limits Descriptor.

EDID conformity: FAIL
