edid-decode (hex):

00 ff ff ff ff ff ff 00 1e 6d fe 76 38 37 04 00
09 1a 01 04 a5 50 22 78 9f ca 95 a6 55 4e a1 26
0f 50 54 25 6b 80 d1 cf d1 e8 d1 fc a9 fc 81 bc
81 fc 61 7c 71 7c 64 4b 00 f0 a0 38 46 40 30 20
aa 00 1e 4e 31 00 00 1a ec 5e 00 f0 a0 38 4e 40
30 20 aa 00 1e 4e 31 00 00 1a 00 00 00 fd 00 32
90 a4 a4 2d 01 0a 20 20 20 20 20 20 00 00 00 fc
00 4c 47 20 55 4c 54 52 41 57 49 44 45 0a 01 54

02 03 18 71 23 09 06 07 4b 01 02 04 10 29 2f 3f
40 da 5b 5c 83 01 00 00 50 78 00 a0 a0 38 35 40
30 20 ca 00 1e 4e 31 00 00 1a 13 90 00 a0 a0 38
32 40 30 20 ca 00 1e 4e 31 00 00 1a e4 ac 00 a0
a0 38 32 40 30 20 ca 00 1e 4e 31 00 00 1a 02 3a
80 18 71 38 2d 40 58 2c aa 00 13 2a 21 00 00 1e
00 00 00 00 00 00 00 00 00 00 00 00 00 00 00 00
00 00 00 00 00 00 00 00 00 00 00 00 00 00 00 28

----------------

Block 0, Base EDID:
  EDID Structure Version & Revision: 1.4
  Vendor & Product Identification:
    Manufacturer: GSM
    Model: 30462
    Serial Number: ...
    Made in: week 9 of 2016
  Basic Display Parameters & Features:
    Digital display
    Bits per primary color channel: 8
    DisplayPort interface
    Maximum image size: 80 cm x 34 cm
    Gamma: 2.20
    DPMS levels: Standby
    Supported color formats: RGB 4:4:4, YCrCb 4:4:4, YCrCb 4:2:2
    Default (sRGB) color space is primary color space
    First detailed timing includes the native pixel format and preferred refresh rate
    Display is continuous frequency
  Color Characteristics:
    Red  : 0.6513, 0.3320
    Green: 0.3066, 0.6308
    Blue : 0.1503, 0.0595
    White: 0.3134, 0.3291
  Established Timings I & II:
    DMT 0x04:   640x480    59.940 Hz   4:3    31.469 kHz  25.175 MHz
    DMT 0x06:   640x480    75.000 Hz   4:3    37.500 kHz  31.500 MHz
    DMT 0x09:   800x600    60.317 Hz   4:3    37.879 kHz  40.000 MHz
    DMT 0x0b:   800x600    75.000 Hz   4:3    46.875 kHz  49.500 MHz
    Apple   :   832x624    74.551 Hz   4:3    49.726 kHz  57.284 MHz
    DMT 0x10:  1024x768    60.004 Hz   4:3    48.363 kHz  65.000 MHz
    DMT 0x12:  1024x768    75.029 Hz   4:3    60.023 kHz  78.750 MHz
    DMT 0x24:  1280x1024   75.025 Hz   5:4    79.976 kHz 135.000 MHz
    Apple   :  1152x870    75.062 Hz 192:145  68.681 kHz 100.000 MHz
  Standard Timings:
    CVT     :  1920x1080   74.906 Hz  16:9    84.643 kHz 220.750 MHz (EDID 1.4 source)
    GTF     :  1920x1080   75.000 Hz  16:9    84.600 kHz 220.637 MHz (EDID 1.3 source)
    CVT     :  1920x1080   99.898 Hz  16:9   114.583 kHz 302.500 MHz (EDID 1.4 source)
    GTF     :  1920x1080  100.000 Hz  16:9   114.400 kHz 302.016 MHz (EDID 1.3 source)
    CVT     :  1920x1080  119.930 Hz  16:9   139.119 kHz 369.500 MHz (EDID 1.4 source)
    GTF     :  1920x1080  120.000 Hz  16:9   138.840 kHz 368.759 MHz (EDID 1.3 source)
    CVT     :  1600x904   119.801 Hz  16:9   116.446 kHz 255.250 MHz (EDID 1.4 source)
    GTF     :  1600x904   120.000 Hz  16:9   116.280 kHz 256.746 MHz (EDID 1.3 source)
    CVT     :  1280x1024  119.835 Hz   5:4   131.818 kHz 232.000 MHz (EDID 1.4 source)
    GTF     :  1280x1024  120.000 Hz   5:4   131.640 kHz 233.793 MHz (EDID 1.3 source)
    CVT     :  1280x720   119.858 Hz  16:9    92.890 kHz 162.000 MHz (EDID 1.4 source)
    GTF     :  1280x720   120.000 Hz  16:9    92.640 kHz 161.564 MHz (EDID 1.3 source)
    CVT     :  1024x768   119.804 Hz   4:3    98.958 kHz 137.750 MHz (EDID 1.4 source)
    GTF     :  1024x768   120.000 Hz   4:3    98.760 kHz 139.054 MHz (EDID 1.3 source)
    CVT     :  1152x864   119.773 Hz   4:3   111.269 kHz 176.250 MHz (EDID 1.4 source)
    GTF     :  1152x864   120.000 Hz   4:3   111.120 kHz 176.014 MHz (EDID 1.3 source)
  Detailed Timing Descriptors:
    DTD 1:  2560x1080   59.938 Hz  64:27   68.929 kHz 193.000 MHz (798 mm x 334 mm)
                 Hfront   48 Hsync  32 Hback 160 Hpol P
                 Vfront   10 Vsync  10 Vback  50 Vpol N
    DTD 2:  2560x1080   74.944 Hz  64:27   86.786 kHz 243.000 MHz (798 mm x 334 mm)
                 Hfront   48 Hsync  32 Hback 160 Hpol P
                 Vfront   10 Vsync  10 Vback  58 Vpol N
  Display Range Limits:
    Monitor ranges (Bare Limits): 50-144 Hz V, 164-164 kHz H, max dotclock 450 MHz
    Display Product Name: 'LG ULTRAWIDE'
  Extension blocks: 1
Checksum: 0x54

----------------

Block 1, CTA-861 Extension Block:
  Revision: 3
  Basic audio support
  Supports YCbCr 4:4:4
  Supports YCbCr 4:2:2
  Native detailed modes: 1
  Audio Data Block:
    Linear PCM:
      Max channels: 2
      Supported sample rates (kHz): 48 44.1
      Supported sample sizes (bits): 24 20 16
  Video Data Block:
    VIC   1:   640x480    59.940 Hz   4:3    31.469 kHz  25.175 MHz
    VIC   2:   720x480    59.940 Hz   4:3    31.469 kHz  27.000 MHz
    VIC   4:  1280x720    60.000 Hz  16:9    45.000 kHz  74.250 MHz
    VIC  16:  1920x1080   60.000 Hz  16:9    67.500 kHz 148.500 MHz
    VIC  41:  1280x720   100.000 Hz  16:9    75.000 kHz 148.500 MHz
    VIC  47:  1280x720   120.000 Hz  16:9    90.000 kHz 148.500 MHz
    VIC  63:  1920x1080  120.000 Hz  16:9   135.000 kHz 297.000 MHz
    VIC  64:  1920x1080  100.000 Hz  16:9   112.500 kHz 297.000 MHz
    VIC 218:  4096x2160  100.000 Hz 256:135 225.000 kHz 1188.000 MHz
    VIC  91:  2560x1080  100.000 Hz  64:27  125.000 kHz 371.250 MHz
    VIC  92:  2560x1080  120.000 Hz  64:27  150.000 kHz 495.000 MHz
  Speaker Allocation Data Block:
    FL/FR - Front Left/Right
  Detailed Timing Descriptors:
    DTD 3:  2560x1080   99.943 Hz  64:27  113.235 kHz 308.000 MHz (798 mm x 334 mm)
                 Hfront   48 Hsync  32 Hback  80 Hpol P
                 Vfront   12 Vsync  10 Vback  31 Vpol N
    DTD 4:  2560x1080  119.999 Hz  64:27  135.599 kHz 368.830 MHz (798 mm x 334 mm)
                 Hfront   48 Hsync  32 Hback  80 Hpol P
                 Vfront   12 Vsync  10 Vback  28 Vpol N
    DTD 5:  2560x1080  144.001 Hz  64:27  162.721 kHz 442.600 MHz (798 mm x 334 mm)
                 Hfront   48 Hsync  32 Hback  80 Hpol P
                 Vfront   12 Vsync  10 Vback  28 Vpol N
    DTD 6:  1920x1080   60.000 Hz  16:9    67.500 kHz 148.500 MHz (531 mm x 298 mm)
                 Hfront   88 Hsync  44 Hback 148 Hpol P
                 Vfront   10 Vsync  10 Vback  25 Vpol P
Checksum: 0x28
