
EDID (hex):
00ffffffffffff0040a2d60201010101
3012010308251578ea063197574a9426
1e5054afce0081c081cf810001010101
0101010101011a1d008051d01c204080
350074d11000001e000000fd00324b24
390a000a202020202020000000fc0046
5637323641570a2020202020000000ff
003038313135303035303535393200a2

Extracted contents:
header:          00 ff ff ff ff ff ff 00
serial number:   40 a2 d6 02 01 01 01 01 30 12
version:         01 03
basic params:    08 25 15 78 ea
chroma info:     06 31 97 57 4a 94 26 1e 50 54
established:     af ce 00
standard:        81 c0 81 cf 81 00 01 01 01 01 01 01 01 01 01 01
descriptor 1:    1a 1d 00 80 51 d0 1c 20 40 80 35 00 74 d1 10 00 00 1e
descriptor 2:    00 00 00 fd 00 32 4b 24 39 0a 00 0a 20 20 20 20 20 20
descriptor 3:    00 00 00 fc 00 46 56 37 32 36 41 57 0a 20 20 20 20 20
descriptor 4:    00 00 00 ff 00 30 38 31 31 35 30 30 35 30 35 35 39 32
extensions:      00
checksum:        a2

EDID version: 1.3
Manufacturer: PEB Model 2d6 Serial Number --
Made in week 48 of 2008
Analog display, Input voltage level: 0.7/0.3 V
Sync: Separate 
Maximum image size: 37 cm x 21 cm
Gamma: 2.20
DPMS levels: Standby Suspend Off
RGB color display
First detailed timing is preferred timing
Display x,y Chromaticity:
  Red:   0.5898, 0.3398
  Green: 0.2900, 0.5800
  Blue:  0.1484, 0.1201
  White: 0.3125, 0.3291
Established timings supported:
  720x400@70Hz 9:5 HorFreq: 31469 Hz Clock: 28.320 MHz
  640x480@60Hz 4:3 HorFreq: 31469 Hz Clock: 25.175 MHz
  640x480@72Hz 4:3 HorFreq: 37900 Hz Clock: 31.500 MHz
  640x480@75Hz 4:3 HorFreq: 37500 Hz Clock: 31.500 MHz
  800x600@56Hz 4:3 HorFreq: 35200 Hz Clock: 36.000 MHz
  800x600@60Hz 4:3 HorFreq: 37900 Hz Clock: 40.000 MHz
  800x600@72Hz 4:3 HorFreq: 48100 Hz Clock: 50.000 MHz
  800x600@75Hz 4:3 HorFreq: 46900 Hz Clock: 49.500 MHz
  1024x768@60Hz 4:3 HorFreq: 48400 Hz Clock: 65.000 MHz
  1024x768@70Hz 4:3 HorFreq: 56500 Hz Clock: 75.000 MHz
  1024x768@75Hz 4:3 HorFreq: 60000 Hz Clock: 78.750 MHz
Standard timings supported:
  1280x720@60Hz 16:9
  1280x720@75Hz 16:9
  1280x800@60Hz 16:10
Detailed mode: Clock 74.500 MHz, 372 mm x 209 mm
               1280 1344 1472 1664 hborder 0
                720  723  728  748 vborder 0
               +hsync +vsync 
               VertFreq: 59 Hz, HorFreq: 44771 Hz
Monitor ranges (GTF): 50-75Hz V, 36-57kHz H, max dotclock 100MHz
Monitor name: FV726AW
Serial number: --
Checksum: 0xa2 (valid)
One or more of the timings is out of range of the Monitor Ranges:
  Vertical Freq: 56 - 75 Hz
  Horizontal Freq: 31469 - 60000 Hz
  Maximum Clock: 78.750 MHz
