
EDID (hex):
00ffffffffffff0051f303537e030000
1c130103682f1a782a3585a656489a24
125054bfee00818095008140714fb300
010101010101023a801871382d40582c
4500dc0c1100001e000000fd00384b18
5011000a202020202020000000fc0050
41333736380a202020202020000000ff
005453424a39374c3030303839340097

edid-decode (hex):

00 ff ff ff ff ff ff 00 51 f3 03 53 7e 03 00 00
1c 13 01 03 68 2f 1a 78 2a 35 85 a6 56 48 9a 24
12 50 54 bf ee 00 81 80 95 00 81 40 71 4f b3 00
01 01 01 01 01 01 02 3a 80 18 71 38 2d 40 58 2c
45 00 dc 0c 11 00 00 1e 00 00 00 fd 00 38 4b 18
50 11 00 0a 20 20 20 20 20 20 00 00 00 fc 00 50
41 33 37 36 38 0a 20 20 20 20 20 20 00 00 00 ff
00 54 53 42 4a 39 37 4c 30 30 30 38 39 34 00 97

----------------

Block 0, Base EDID:
  EDID Structure Version & Revision: 1.3
  Vendor & Product Identification:
    Manufacturer: TOS
    Model: 21251
    Serial Number: 894
    Made in: week 28 of 2009
  Basic Display Parameters & Features:
    Analog display
    Signal Level Standard: 0.700 : 0.000 : 0.700 V p-p
    Blank level equals black level
    Sync: Separate
    Maximum image size: 47 cm x 26 cm
    Gamma: 2.20
    DPMS levels: Off
    RGB color display
    First detailed timing is the preferred timing
  Color Characteristics:
    Red  : 0.6484, 0.3388
    Green: 0.2822, 0.6025
    Blue : 0.1425, 0.0703
    White: 0.3134, 0.3291
  Established Timings I & II:
    IBM     :   720x400    70.081663 Hz   9:5     31.467 kHz     28.320000 MHz
    DMT 0x04:   640x480    59.940476 Hz   4:3     31.469 kHz     25.175000 MHz
    Apple   :   640x480    66.666667 Hz   4:3     35.000 kHz     30.240000 MHz
    DMT 0x05:   640x480    72.808802 Hz   4:3     37.861 kHz     31.500000 MHz
    DMT 0x06:   640x480    75.000000 Hz   4:3     37.500 kHz     31.500000 MHz
    DMT 0x08:   800x600    56.250000 Hz   4:3     35.156 kHz     36.000000 MHz
    DMT 0x09:   800x600    60.316541 Hz   4:3     37.879 kHz     40.000000 MHz
    DMT 0x0a:   800x600    72.187572 Hz   4:3     48.077 kHz     50.000000 MHz
    DMT 0x0b:   800x600    75.000000 Hz   4:3     46.875 kHz     49.500000 MHz
    Apple   :   832x624    74.551266 Hz   4:3     49.726 kHz     57.284000 MHz
    DMT 0x10:  1024x768    60.003840 Hz   4:3     48.363 kHz     65.000000 MHz
    DMT 0x11:  1024x768    70.069359 Hz   4:3     56.476 kHz     75.000000 MHz
    DMT 0x12:  1024x768    75.028582 Hz   4:3     60.023 kHz     78.750000 MHz
  Standard Timings:
    DMT 0x23:  1280x1024   60.019740 Hz   5:4     63.981 kHz    108.000000 MHz
    DMT 0x2f:  1440x900    59.887445 Hz  16:10    55.935 kHz    106.500000 MHz
    DMT 0x20:  1280x960    60.000000 Hz   4:3     60.000 kHz    108.000000 MHz
    DMT 0x15:  1152x864    75.000000 Hz   4:3     67.500 kHz    108.000000 MHz
    DMT 0x3a:  1680x1050   59.954250 Hz  16:10    65.290 kHz    146.250000 MHz
  Detailed Timing Descriptors:
    DTD 1:  1920x1080   60.000000 Hz  16:9     67.500 kHz    148.500000 MHz (476 mm x 268 mm)
                 Hfront   88 Hsync  44 Hback  148 Hpol P
                 Vfront    4 Vsync   5 Vback   36 Vpol P
    Display Range Limits:
      Monitor ranges (GTF): 56-75 Hz V, 24-80 kHz H, max dotclock 170 MHz
    Display Product Name: 'PA3768'
    Display Product Serial Number: 'TSBJ97L000894'
Checksum: 0x97


