
EDID (hex):
00ffffffffffff000472b4066aec9064
3110010368221b782ace45a6524c9927
1c5054bfef80714f81c0814081800101
010101010101302a009851002a403070
1300520f11000004000000fd00374b1e
510e000a202020202020000000fc0041
4c313731360a202020202020000000fe
004c34383042313537333932462000a9

Extracted contents:
header:          00 ff ff ff ff ff ff 00
serial number:   04 72 b4 06 6a ec 90 64 31 10
version:         01 03
basic params:    68 22 1b 78 2a
chroma info:     ce 45 a6 52 4c 99 27 1c 50 54
established:     bf ef 80
standard:        71 4f 81 c0 81 40 81 80 01 01 01 01 01 01 01 01
descriptor 1:    30 2a 00 98 51 00 2a 40 30 70 13 00 52 0f 11 00 00 04
descriptor 2:    00 00 00 fd 00 37 4b 1e 51 0e 00 0a 20 20 20 20 20 20
descriptor 3:    00 00 00 fc 00 41 4c 31 37 31 36 0a 20 20 20 20 20 20
descriptor 4:    00 00 00 fe 00 4c 34 38 30 42 31 35 37 33 39 32 46 20
extensions:      00
checksum:        a9

EDID version: 1.3
Manufacturer: ACR Model 6b4 Serial Number --
Made in week 49 of 2006
Analog display, Input voltage level: 0.7/0.7 V
Sync: Separate 
Maximum image size: 34 cm x 27 cm
Gamma: 2.20
DPMS levels: Off
RGB color display
First detailed timing is preferred timing
Display x,y Chromaticity:
  Red:   0.6513, 0.3203
  Green: 0.2998, 0.5996
  Blue:  0.1533, 0.1093
  White: 0.3134, 0.3291
Established timings supported:
  720x400@70Hz 9:5 HorFreq: 31469 Hz Clock: 28.320 MHz
  640x480@60Hz 4:3 HorFreq: 31469 Hz Clock: 25.175 MHz
  640x480@67Hz 4:3 HorFreq: 35000 Hz Clock: 30.240 MHz
  640x480@72Hz 4:3 HorFreq: 37900 Hz Clock: 31.500 MHz
  640x480@75Hz 4:3 HorFreq: 37500 Hz Clock: 31.500 MHz
  800x600@56Hz 4:3 HorFreq: 35200 Hz Clock: 36.000 MHz
  800x600@60Hz 4:3 HorFreq: 37900 Hz Clock: 40.000 MHz
  800x600@72Hz 4:3 HorFreq: 48100 Hz Clock: 50.000 MHz
  800x600@75Hz 4:3 HorFreq: 46900 Hz Clock: 49.500 MHz
  832x624@75Hz 4:3 HorFreq: 49726 Hz Clock: 57.284 MHz
  1024x768@60Hz 4:3 HorFreq: 48400 Hz Clock: 65.000 MHz
  1024x768@70Hz 4:3 HorFreq: 56500 Hz Clock: 75.000 MHz
  1024x768@75Hz 4:3 HorFreq: 60000 Hz Clock: 78.750 MHz
  1280x1024@75Hz 5:4 HorFreq: 80000 Hz Clock: 135.000 MHz
  1152x870@75Hz 192:145 HorFreq: 67500 Hz Clock: 108.000 MHz
Standard timings supported:
  1152x864@75Hz 4:3 HorFreq: 67500 Hz Clock: 108.000 MHz
  1280x720@60Hz 16:9
  1280x960@60Hz 4:3 HorFreq: 60000 Hz Clock: 108.000 MHz
  1280x1024@60Hz 5:4 HorFreq: 64000 Hz Clock: 108.000 MHz
Detailed mode: Clock 108.000 MHz, 338 mm x 271 mm
               1280 1328 1440 1688 hborder 0
               1024 1025 1028 1066 vborder 0
               -hsync +vsync analog composite 
               VertFreq: 60 Hz, HorFreq: 63981 Hz
Monitor ranges (GTF): 55-75Hz V, 30-81kHz H, max dotclock 140MHz
Monitor name: AL1716
ASCII string: L480B157392F 
Checksum: 0xa9 (valid)
