
EDID (hex):
00ffffffffffff0009d1337f45540000
331e0104a5351e783e9de1a654549f26
0d5054a56b80d1c081c081008180b300
a9c0617c81bc023a801871382d40582c
4500132a2100001e000000ff0053434c
3034393734534c300a20000000fd0038
901ea023000a202020202020000000fc
005a4f57494520584c204c43440a01b4
020319f14c010203040590111213141f
4823090707830100000f330050400037
3008209808132a2100001c866f80a070
38404030203500132a2100001ad65300
50500049400820b80c132a2100001cfe
5b80a07038354030203500132a210000
1afc7e80887038124018203500132a21
00001e00000000000000000000000032

Extracted contents:
header:          00 ff ff ff ff ff ff 00
serial number:   09 d1 33 7f 45 54 00 00 33 1e
version:         01 04
basic params:    a5 35 1e 78 3e
chroma info:     9d e1 a6 54 54 9f 26 0d 50 54
established:     a5 6b 80
standard:        d1 c0 81 c0 81 00 81 80 b3 00 a9 c0 61 7c 81 bc
descriptor 1:    02 3a 80 18 71 38 2d 40 58 2c 45 00 13 2a 21 00 00 1e
descriptor 2:    00 00 00 ff 00 53 43 4c 30 34 39 37 34 53 4c 30 0a 20
descriptor 3:    00 00 00 fd 00 38 90 1e a0 23 00 0a 20 20 20 20 20 20
descriptor 4:    00 00 00 fc 00 5a 4f 57 49 45 20 58 4c 20 4c 43 44 0a
extensions:      01
checksum:        b4

EDID version: 1.4
Manufacturer: BNQ Model 7f33 Serial Number --
Made in week 51 of 2020
Digital display
8 bits per primary color channel
DisplayPort interface
Maximum image size: 53 cm x 30 cm
Gamma: 2.20
DPMS levels: Off
Supported color formats: RGB 4:4:4, YCrCb 4:4:4, YCrCb 4:2:2
Default (sRGB) color space is primary color space
First detailed timing includes the native pixel format and preferred refresh rate
Display x,y Chromaticity:
  Red:   0.6503, 0.3291
  Green: 0.3310, 0.6220
  Blue:  0.1513, 0.0527
  White: 0.3125, 0.3291
Established timings supported:
  720x400@70Hz 9:5 HorFreq: 31469 Hz Clock: 28.320 MHz
  640x480@60Hz 4:3 HorFreq: 31469 Hz Clock: 25.175 MHz
  640x480@75Hz 4:3 HorFreq: 37500 Hz Clock: 31.500 MHz
  800x600@60Hz 4:3 HorFreq: 37900 Hz Clock: 40.000 MHz
  800x600@75Hz 4:3 HorFreq: 46900 Hz Clock: 49.500 MHz
  832x624@75Hz 4:3 HorFreq: 49726 Hz Clock: 57.284 MHz
  1024x768@60Hz 4:3 HorFreq: 48400 Hz Clock: 65.000 MHz
  1024x768@75Hz 4:3 HorFreq: 60000 Hz Clock: 78.750 MHz
  1280x1024@75Hz 5:4 HorFreq: 80000 Hz Clock: 135.000 MHz
  1152x870@75Hz 192:145 HorFreq: 67500 Hz Clock: 108.000 MHz
Standard timings supported:
  1920x1080@60Hz 16:9
  1280x720@60Hz 16:9
  1280x800@60Hz 16:10
  1280x1024@60Hz 5:4 HorFreq: 64000 Hz Clock: 108.000 MHz
  1680x1050@60Hz 16:10 HorFreq: 64700 Hz Clock: 119.000 MHz
  1600x900@60Hz 16:9
  1024x768@120Hz 4:3
  1280x1024@120Hz 5:4
Detailed mode: Clock 148.500 MHz, 531 mm x 298 mm
               1920 2008 2052 2200 hborder 0
               1080 1084 1089 1125 vborder 0
               +hsync +vsync 
               VertFreq: 60 Hz, HorFreq: 67500 Hz
Serial number: --
Monitor ranges (GTF): 56-144Hz V, 30-160kHz H, max dotclock 350MHz
Monitor name: ZOWIE XL LCD
Has 1 extension blocks
Checksum: 0xb4 (valid)

CTA extension block
Extension version: 3
21 bytes of CTA data
  Video data block
    VIC   1 640x480@60Hz 4:3  HorFreq: 31469 Hz Clock: 25.175 MHz
    VIC   2 720x480@60Hz 4:3  HorFreq: 31469 Hz Clock: 27.000 MHz
    VIC   3 720x480@60Hz 16:9  HorFreq: 31469 Hz Clock: 27.000 MHz
    VIC   4 1280x720@60Hz 16:9  HorFreq: 45000 Hz Clock: 74.250 MHz
    VIC   5 1920x1080i@60Hz 16:9  HorFreq: 33750 Hz Clock: 74.250 MHz
    VIC  16 1920x1080@60Hz 16:9 (native) HorFreq: 67500 Hz Clock: 148.500 MHz
    VIC  17 720x576@50Hz 4:3  HorFreq: 31250 Hz Clock: 27.000 MHz
    VIC  18 720x576@50Hz 16:9  HorFreq: 31250 Hz Clock: 27.000 MHz
    VIC  19 1280x720@50Hz 16:9  HorFreq: 37500 Hz Clock: 74.250 MHz
    VIC  20 1920x1080i@50Hz 16:9  HorFreq: 28125 Hz Clock: 74.250 MHz
    VIC  31 1920x1080@50Hz 16:9  HorFreq: 56250 Hz Clock: 148.500 MHz
    VIC  72 1920x1080@24Hz 64:27  HorFreq: 27000 Hz Clock: 74.250 MHz
  Audio data block
    Linear PCM, max channels 2
      Supported sample rates (kHz): 48 44.1 32
      Supported sample sizes (bits): 24 20 16
  Speaker allocation data block
    Speaker map:
      FL/FR - Front Left/Right
Underscans PC formats by default
Basic audio support
Supports YCbCr 4:4:4
Supports YCbCr 4:2:2
1 native detailed modes
Detailed mode: Clock 130.710 MHz, 531 mm x 298 mm
               1024 1032 1064 1104 hborder 0
                768  809  817  823 vborder 0
               -hsync +vsync 
               VertFreq: 143 Hz, HorFreq: 118396 Hz
Detailed mode: Clock 285.500 MHz, 531 mm x 298 mm
               1920 1968 2000 2080 hborder 0
               1080 1083 1088 1144 vborder 0
               +hsync -vsync 
               VertFreq: 119 Hz, HorFreq: 137259 Hz
Detailed mode: Clock 214.620 MHz, 531 mm x 298 mm
               1280 1288 1320 1360 hborder 0
               1024 1083 1091 1097 vborder 0
               -hsync +vsync 
               VertFreq: 143 Hz, HorFreq: 157808 Hz
Detailed mode: Clock 235.500 MHz, 531 mm x 298 mm
               1920 1968 2000 2080 hborder 0
               1080 1083 1088 1133 vborder 0
               +hsync -vsync 
               VertFreq: 99 Hz, HorFreq: 113221 Hz
Detailed mode: Clock 325.080 MHz, 531 mm x 298 mm
               1920 1944 1976 2056 hborder 0
               1080 1083 1088 1098 vborder 0
               +hsync +vsync 
               VertFreq: 144 Hz, HorFreq: 158112 Hz
Checksum: 0x32 (valid)

EDID block does NOT conform to EDID 1.4!
	sRGB is signaled, but the chromaticities do not match
Warning: One or more of the timings is out of range of the Monitor Ranges:
  Vertical Freq: 24 - 144 Hz
  Horizontal Freq: 27000 - 158112 Hz
  Maximum Clock: 325.080 MHz
EDID block does not conform at all!
	Both the serial number and the serial string are set


