edid-decode (hex):

00 ff ff ff ff ff ff 00 09 e5 b3 08 00 00 00 00
01 1d 01 04 a5 23 13 78 02 de 50 a3 54 4c 99 26
0f 50 54 00 00 00 01 01 01 01 01 01 01 01 01 01
01 01 01 01 01 01 9e 85 80 a0 70 38 3e 40 6c 30
aa 00 58 c1 10 00 00 1a 9e 85 80 a0 70 38 7d 46
6c 30 aa 00 58 c1 10 00 00 00 00 00 00 fe 00 42
4f 45 20 48 46 0a 20 20 20 20 20 20 00 00 00 fe
00 4e 56 31 35 36 46 48 4d 2d 4e 34 4b 0a 00 7a

----------------

Block 0, Base EDID:
  EDID Structure Version & Revision: 1.4
  Vendor & Product Identification:
    Manufacturer: BOE
    Model: 2227
    Made in: week 1 of 2019
  Basic Display Parameters & Features:
    Digital display
    Bits per primary color channel: 8
    DisplayPort interface
    Maximum image size: 35 cm x 19 cm
    Gamma: 2.20
    Supported color formats: RGB 4:4:4
    First detailed timing includes the native pixel format and preferred refresh rate
  Color Characteristics:
    Red  : 0.6396, 0.3291
    Green: 0.2998, 0.5996
    Blue : 0.1494, 0.0595
    White: 0.3125, 0.3281
  Established Timings I & II: none
  Standard Timings: none
  Detailed Timing Descriptors:
    DTD 1:  1920x1080  144.003435 Hz  16:9    164.452 kHz    342.060000 MHz (344 mm x 193 mm)
                 Hfront  108 Hsync  48 Hback    4 Hpol P
                 Vfront   10 Vsync  10 Vback   42 Vpol N
    DTD 2:  1920x1080   59.997053 Hz  16:9    164.452 kHz    342.060000 MHz (analog composite, sync-on-green, 344 mm x 193 mm)
                 Hfront  108 Hsync  48 Hback    4 Hpol N
                 Vfront   10 Vsync  10 Vback 1641 Vpol N
    Alphanumeric Data String: 'BOE HF'
    Alphanumeric Data String: 'NV156FHM-N4K'
Checksum: 0x7a

----------------

Failures:

Block 0, Base EDID:
  Missing Display Product Name.

EDID conformity: FAIL
