
EDID (hex):
00ffffffffffff000daf261400000000
0c110103801e13780a47a094574f8c27
27505400000001010101010101010101
010101010101e41b00a5502017303020
36002fbe100000190000000000000000
00000000000000000000000000fe0047
52353531374e31343149330a000000fe
002c404d567a9fdbff01010a202000f7

Extracted contents:
header:          00 ff ff ff ff ff ff 00
serial number:   0d af 26 14 00 00 00 00 0c 11
version:         01 03
basic params:    80 1e 13 78 0a
chroma info:     47 a0 94 57 4f 8c 27 27 50 54
established:     00 00 00
standard:        01 01 01 01 01 01 01 01 01 01 01 01 01 01 01 01
descriptor 1:    e4 1b 00 a5 50 20 17 30 30 20 36 00 2f be 10 00 00 19
descriptor 2:    00 00 00 00 00 00 00 00 00 00 00 00 00 00 00 00 00 00
descriptor 3:    00 00 00 fe 00 47 52 35 35 31 37 4e 31 34 31 49 33 0a
descriptor 4:    00 00 00 fe 00 2c 40 4d 56 7a 9f db ff 01 01 0a 20 20
extensions:      00
checksum:        f7

EDID version: 1.3
Manufacturer: CMO Model 1426 Serial Number --
Made in week 12 of 2007
Digital display
Maximum image size: 30 cm x 19 cm
Gamma: 2.20
RGB color display
First detailed timing is preferred timing
Display x,y Chromaticity:
  Red:   0.5791, 0.3398
  Green: 0.3095, 0.5498
  Blue:  0.1542, 0.1542
  White: 0.3125, 0.3281
Established timings supported:
Standard timings supported:
Detailed mode: Clock 71.400 MHz, 303 mm x 190 mm
               1280 1328 1360 1445 hborder 0
                800  803  809  823 vborder 0
               -hsync -vsync 
               VertFreq: 60 Hz, HorFreq: 49411 Hz
Manufacturer-specified data, tag 0
ASCII string: GR5517N141I3
ASCII string: ,@MVz
Checksum: 0xf7 (valid)
EDID block does NOT conform to EDID 1.3!
	Missing name descriptor
	Missing monitor ranges
	Detailed block string not properly terminated
