
EDID (hex):
00ffffffffffff004ee4000000000000
00160103806036782ad7b3ae51509423
0c4a4700000001010101010101010101
010101010101662150b051001b304070
36004e6c4200001e011d8018711c1620
582c2500b8183200009e000000fc0052
3830370a2020202020202020000000fd
00173d0f450f000a202020202020016a
020338724f8594020304060710111213
15161f0138097f070f7f071507503e1e
c0492a005706005f7f01677f00834f00
0066030c00100080011d8018711c1620
582c2500c48e2100009e011d80d0721c
1620102c2580c48e2100009e00000000
00000000000000000000000000000000
0000000000000000000000000000009b

Extracted contents:
header:          00 ff ff ff ff ff ff 00
serial number:   4e e4 00 00 00 00 00 00 00 16
version:         01 03
basic params:    80 60 36 78 2a
chroma info:     d7 b3 ae 51 50 94 23 0c 4a 47
established:     00 00 00
standard:        01 01 01 01 01 01 01 01 01 01 01 01 01 01 01 01
descriptor 1:    66 21 50 b0 51 00 1b 30 40 70 36 00 4e 6c 42 00 00 1e
descriptor 2:    01 1d 80 18 71 1c 16 20 58 2c 25 00 b8 18 32 00 00 9e
descriptor 3:    00 00 00 fc 00 52 38 30 37 0a 20 20 20 20 20 20 20 20
descriptor 4:    00 00 00 fd 00 17 3d 0f 45 0f 00 0a 20 20 20 20 20 20
extensions:      01
checksum:        6a

EDID version: 1.3
Manufacturer: SWD Model 0 Serial Number --
Made in year 2012
Digital display
Maximum image size: 96 cm x 54 cm
Gamma: 2.20
DPMS levels: Off
RGB color display
First detailed timing is preferred timing
Display x,y Chromaticity:
  Red:   0.6826, 0.3173
  Green: 0.3134, 0.5810
  Blue:  0.1386, 0.0498
  White: 0.2890, 0.2802
Established timings supported:
Standard timings supported:
Detailed mode: Clock 85.500 MHz, 1102 mm x 620 mm
               1360 1424 1536 1792 hborder 0
                768  771  777  795 vborder 0
               +hsync +vsync 
               VertFreq: 60 Hz, HorFreq: 47712 Hz
Detailed mode: Clock 74.250 MHz, 952 mm x 536 mm
               1920 2008 2052 2200 hborder 0
                540  542  547  562 vborder 0
               +hsync +vsync interlaced 
               VertFreq: 60 Hz, HorFreq: 33750 Hz
Monitor name: R807
Monitor ranges (GTF): 23-61Hz V, 15-69kHz H, max dotclock 150MHz
Has 1 extension blocks
Checksum: 0x6a (valid)

CTA extension block
Extension version: 3
52 bytes of CTA data
  Video data block
    VIC   5 1920x1080i@60Hz 16:9 (native) HorFreq: 33750 Hz Clock: 74.250 MHz
    VIC  20 1920x1080i@50Hz 16:9 (native) HorFreq: 28125 Hz Clock: 74.250 MHz
    VIC   2 720x480@60Hz 4:3  HorFreq: 31469 Hz Clock: 27.000 MHz
    VIC   3 720x480@60Hz 16:9  HorFreq: 31469 Hz Clock: 27.000 MHz
    VIC   4 1280x720@60Hz 16:9  HorFreq: 45000 Hz Clock: 74.250 MHz
    VIC   6 1440x480i@60Hz 4:3  HorFreq: 15734 Hz Clock: 27.000 MHz
    VIC   7 1440x480i@60Hz 16:9  HorFreq: 15734 Hz Clock: 27.000 MHz
    VIC  16 1920x1080@60Hz 16:9  HorFreq: 67500 Hz Clock: 148.500 MHz
    VIC  17 720x576@50Hz 4:3  HorFreq: 31250 Hz Clock: 27.000 MHz
    VIC  18 720x576@50Hz 16:9  HorFreq: 31250 Hz Clock: 27.000 MHz
    VIC  19 1280x720@50Hz 16:9  HorFreq: 37500 Hz Clock: 74.250 MHz
    VIC  21 1440x576i@50Hz 4:3  HorFreq: 15625 Hz Clock: 27.000 MHz
    VIC  22 1440x576i@50Hz 16:9  HorFreq: 15625 Hz Clock: 27.000 MHz
    VIC  31 1920x1080@50Hz 16:9  HorFreq: 56250 Hz Clock: 148.500 MHz
    VIC   1 640x480@60Hz 4:3  HorFreq: 31469 Hz Clock: 25.175 MHz
  Audio data block
    Linear PCM, max channels 2
      Supported sample rates (kHz): 192 176.4 96 88.2 48 44.1 32
      Supported sample sizes (bits): 24 20 16
    Linear PCM, max channels 8
      Supported sample rates (kHz): 192 176.4 96 88.2 48 44.1 32
      Supported sample sizes (bits): 24 20 16
    AC-3, max channels 6
      Supported sample rates (kHz): 48 44.1 32
      Maximum bit rate: 640 kHz
    DTS, max channels 7
      Supported sample rates (kHz): 96 88.2 48 44.1
      Maximum bit rate: 1536 kHz
    One Bit Audio, max channels 2
      Supported sample rates (kHz): 176.4 88.2 44.1
    Dolby Digital+, max channels 8
      Supported sample rates (kHz): 48 44.1
    DTS-HD, max channels 8
      Supported sample rates (kHz): 192 176.4 96 88.2 48 44.1 32
    MAT (MLP), max channels 8
      Supported sample rates (kHz): 192 176.4 96 88.2 48 44.1 32
  Speaker allocation data block
    Speaker map:
      FL/FR - Front Left/Right
      LFE - Low Frequency Effects
      FC - Front Center
      BL/BR - Back Left/Right
      RLC/RRC - Rear Left/Right of Center
  Vendor-specific data block, OUI 000c03 (HDMI)
    Source physical address 1.0.0.0
    Supports_AI
Basic audio support
Supports YCbCr 4:4:4
Supports YCbCr 4:2:2
2 native detailed modes
Detailed mode: Clock 74.250 MHz, 708 mm x 398 mm
               1920 2008 2052 2200 hborder 0
                540  542  547  562 vborder 0
               +hsync +vsync interlaced 
               VertFreq: 60 Hz, HorFreq: 33750 Hz
Detailed mode: Clock 74.250 MHz, 708 mm x 398 mm
               1920 2448 2492 2640 hborder 0
                540  542  547  562 vborder 0
               +hsync +vsync interlaced 
               VertFreq: 50 Hz, HorFreq: 28125 Hz
Checksum: 0x9b (valid)
