
EDID (hex):
00ffffffffffff0038a3bc6601010101
1d150103802b2078eaee95a3544c9926
0f5054bfef80315945596159714f8159
8199a9408180483f403062b0324040c0
1300b0441100001e000000fd0032551f
5c11000a202020202020000000fc004c
4344323139305558700a2020000000ff
00313731313834303455420a202000b5

Extracted contents:
header:          00 ff ff ff ff ff ff 00
serial number:   38 a3 bc 66 01 01 01 01 1d 15
version:         01 03
basic params:    80 2b 20 78 ea
chroma info:     ee 95 a3 54 4c 99 26 0f 50 54
established:     bf ef 80
standard:        31 59 45 59 61 59 71 4f 81 59 81 99 a9 40 81 80
descriptor 1:    48 3f 40 30 62 b0 32 40 40 c0 13 00 b0 44 11 00 00 1e
descriptor 2:    00 00 00 fd 00 32 55 1f 5c 11 00 0a 20 20 20 20 20 20
descriptor 3:    00 00 00 fc 00 4c 43 44 32 31 39 30 55 58 70 0a 20 20
descriptor 4:    00 00 00 ff 00 31 37 31 31 38 34 30 34 55 42 0a 20 20
extensions:      00
checksum:        b5

EDID version: 1.3
Manufacturer: NEC Model 66bc Serial Number --
Made in week 29 of 2011
Digital display
Maximum image size: 43 cm x 32 cm
Gamma: 2.20
DPMS levels: Standby Suspend Off
RGB color display
First detailed timing is preferred timing
Display x,y Chromaticity:
  Red:   0.6396, 0.3300
  Green: 0.2998, 0.5996
  Blue:  0.1503, 0.0595
  White: 0.3134, 0.3291
Established timings supported:
  720x400@70Hz 9:5 HorFreq: 31469 Hz Clock: 28.320 MHz
  640x480@60Hz 4:3 HorFreq: 31469 Hz Clock: 25.175 MHz
  640x480@67Hz 4:3 HorFreq: 35000 Hz Clock: 30.240 MHz
  640x480@72Hz 4:3 HorFreq: 37900 Hz Clock: 31.500 MHz
  640x480@75Hz 4:3 HorFreq: 37500 Hz Clock: 31.500 MHz
  800x600@56Hz 4:3 HorFreq: 35200 Hz Clock: 36.000 MHz
  800x600@60Hz 4:3 HorFreq: 37900 Hz Clock: 40.000 MHz
  800x600@72Hz 4:3 HorFreq: 48100 Hz Clock: 50.000 MHz
  800x600@75Hz 4:3 HorFreq: 46900 Hz Clock: 49.500 MHz
  832x624@75Hz 4:3 HorFreq: 49726 Hz Clock: 57.284 MHz
  1024x768@60Hz 4:3 HorFreq: 48400 Hz Clock: 65.000 MHz
  1024x768@70Hz 4:3 HorFreq: 56500 Hz Clock: 75.000 MHz
  1024x768@75Hz 4:3 HorFreq: 60000 Hz Clock: 78.750 MHz
  1280x1024@75Hz 5:4 HorFreq: 80000 Hz Clock: 135.000 MHz
  1152x870@75Hz 192:145 HorFreq: 67500 Hz Clock: 108.000 MHz
Standard timings supported:
  640x480@85Hz 4:3 HorFreq: 43300 Hz Clock: 36.000 MHz
  800x600@85Hz 4:3 HorFreq: 53700 Hz Clock: 56.250 MHz
  1024x768@85Hz 4:3 HorFreq: 68700 Hz Clock: 94.500 MHz
  1152x864@75Hz 4:3 HorFreq: 67500 Hz Clock: 108.000 MHz
  1280x960@85Hz 4:3 HorFreq: 85900 Hz Clock: 148.500 MHz
  1280x1024@85Hz 5:4 HorFreq: 91100 Hz Clock: 157.500 MHz
  1600x1200@60Hz 4:3 HorFreq: 75000 Hz Clock: 162.000 MHz
  1280x1024@60Hz 5:4 HorFreq: 64000 Hz Clock: 108.000 MHz
Detailed mode: Clock 162.000 MHz, 432 mm x 324 mm
               1600 1664 1856 2160 hborder 0
               1200 1201 1204 1250 vborder 0
               +hsync +vsync 
               VertFreq: 60 Hz, HorFreq: 75000 Hz
Monitor ranges (GTF): 50-85Hz V, 31-92kHz H, max dotclock 170MHz
Monitor name: LCD2190UXp
Serial number: --
Checksum: 0xb5 (valid)
