edid-decode (hex):

00 ff ff ff ff ff ff 00 0e 6f 08 13 00 00 00 00
1b 1e 01 04 a5 1d 12 78 03 c1 75 a5 54 4d 9a 24
0d 50 54 00 00 00 01 01 01 01 01 01 01 01 01 01
01 01 01 01 01 01 ef 68 00 a0 a0 40 2e 60 30 20
36 00 1e b3 10 00 00 18 f0 53 00 a0 a0 40 2e 60
30 20 36 00 1e b3 10 00 00 18 00 00 00 fe 00 43
53 4f 54 20 54 33 0a 20 20 20 20 20 00 00 00 fe
00 53 4e 44 33 30 37 44 41 31 2d 34 0a 20 00 ec

----------------

Block 0, Base EDID:
  EDID Structure Version & Revision: 1.4
  Vendor & Product Identification:
    Manufacturer: CSO
    Model: 4872
    Made in: week 27 of 2020
  Basic Display Parameters & Features:
    Digital display
    Bits per primary color channel: 8
    DisplayPort interface
    Maximum image size: 29 cm x 18 cm
    Gamma: 2.20
    Supported color formats: RGB 4:4:4
    First detailed timing includes the native pixel format and preferred refresh rate
    Display is continuous frequency
  Color Characteristics:
    Red  : 0.6474, 0.3281
    Green: 0.3007, 0.6025
    Blue : 0.1416, 0.0537
    White: 0.3134, 0.3291
  Established Timings I & II: none
  Standard Timings: none
  Detailed Timing Descriptors:
    DTD 1:  2560x1600   60.000625 Hz   8:5     98.761 kHz    268.630000 MHz (286 mm x 179 mm)
                 Hfront   48 Hsync  32 Hback   80 Hpol N
                 Vfront    3 Vsync   6 Vback   37 Vpol N
    DTD 2:  2560x1600   47.995140 Hz   8:5     79.000 kHz    214.880000 MHz (286 mm x 179 mm)
                 Hfront   48 Hsync  32 Hback   80 Hpol N
                 Vfront    3 Vsync   6 Vback   37 Vpol N
    Alphanumeric Data String: 'CSOT T3'
    Alphanumeric Data String: 'SND307DA1-4'
Checksum: 0xec

----------------

Failures:

Block 0, Base EDID:
  Missing Display Product Name.
  Missing Display Range Limits Descriptor.

EDID conformity: FAIL
