
EDID (hex):
00ffffffffffff004d10e01400000000
011e0104a51a11780fde50a3544c9926
0f505400000001010101010101010101
010101010101294080a0700024503020
3a0003ad10000018543380a070002450
30203a0003ad10000018000000fe0036
52334632804c513132334e3100000000
0002410328011200000a010a20200052

Extracted contents:
header:          00 ff ff ff ff ff ff 00
serial number:   4d 10 e0 14 00 00 00 00 01 1e
version:         01 04
basic params:    a5 1a 11 78 0f
chroma info:     de 50 a3 54 4c 99 26 0f 50 54
established:     00 00 00
standard:        01 01 01 01 01 01 01 01 01 01 01 01 01 01 01 01
descriptor 1:    29 40 80 a0 70 00 24 50 30 20 3a 00 03 ad 10 00 00 18
descriptor 2:    54 33 80 a0 70 00 24 50 30 20 3a 00 03 ad 10 00 00 18
descriptor 3:    00 00 00 fe 00 36 52 33 46 32 80 4c 51 31 32 33 4e 31
descriptor 4:    00 00 00 00 00 02 41 03 28 01 12 00 00 0a 01 0a 20 20
extensions:      00
checksum:        52

EDID version: 1.4
Manufacturer: SHP Model 14e0 Serial Number --
Made in week 1 of 2020
Digital display
8 bits per primary color channel
DisplayPort interface
Maximum image size: 26 cm x 17 cm
Gamma: 2.20
Supported color formats: RGB 4:4:4, YCrCb 4:4:4
Default (sRGB) color space is primary color space
First detailed timing includes the native pixel format and preferred refresh rate
Display is continuous frequency
Display x,y Chromaticity:
  Red:   0.6396, 0.3291
  Green: 0.2998, 0.5996
  Blue:  0.1494, 0.0595
  White: 0.3125, 0.3281
Established timings supported:
Standard timings supported:
Detailed mode: Clock 164.250 MHz, 259 mm x 173 mm
               1920 1968 2000 2080 hborder 0
               1280 1283 1293 1316 vborder 0
               -hsync -vsync 
               VertFreq: 60 Hz, HorFreq: 78966 Hz
Detailed mode: Clock 131.400 MHz, 259 mm x 173 mm
               1920 1968 2000 2080 hborder 0
               1280 1283 1293 1316 vborder 0
               -hsync -vsync 
               VertFreq: 48 Hz, HorFreq: 63173 Hz
ASCII string: 6R3F2
Manufacturer-specified data, tag 0
Checksum: 0x52 (valid)
EDID block does NOT conform to EDID 1.4!
	sRGB is signaled, but the chromaticities do not match
	Missing name descriptor
	Missing monitor ranges
	Detailed block string not properly terminated
