edid-decode (hex):

00 ff ff ff ff ff ff 00 30 e4 f5 05 00 00 00 00
00 1c 01 04 95 1f 11 78 e2 aa 95 95 5e 59 8e 27
1b 50 54 00 00 00 01 01 01 01 01 01 01 01 01 01
01 01 01 01 01 01 2e 36 80 a0 70 38 1f 40 30 20
35 00 35 ae 10 00 00 1a 58 2b 80 a0 70 38 1f 40
30 20 35 00 35 ae 10 00 00 1a 00 00 00 fe 00 4d
56 56 34 4a 80 31 34 30 57 46 41 0a 00 00 00 00
00 00 41 31 96 00 10 00 00 0a 01 0a 20 20 00 71

----------------

Block 0, Base EDID:
  EDID Structure Version & Revision: 1.4
  Vendor & Product Identification:
    Manufacturer: LGD
    Model: 1525
    Made in: 2018
  Basic Display Parameters & Features:
    Digital display
    Bits per primary color channel: 6
    DisplayPort interface
    Maximum image size: 31 cm x 17 cm
    Gamma: 2.20
    DPMS levels: Standby Suspend Off
    Supported color formats: RGB 4:4:4
    First detailed timing includes the native pixel format and preferred refresh rate
  Color Characteristics:
    Red  : 0.5839, 0.3691
    Green: 0.3496, 0.5566
    Blue : 0.1542, 0.1064
    White: 0.3134, 0.3291
  Established Timings I & II: none
  Standard Timings: none
  Detailed Timing Descriptors:
    DTD 1:  1920x1080   60.020 Hz  16:9    66.683 kHz 138.700 MHz (309 mm x 174 mm)
                 Hfront   48 Hsync  32 Hback  80 Hpol P
                 Vfront    3 Vsync   5 Vback  23 Vpol N
    DTD 2:  1920x1080   48.016 Hz  16:9    53.346 kHz 110.960 MHz (309 mm x 174 mm)
                 Hfront   48 Hsync  32 Hback  80 Hpol P
                 Vfront    3 Vsync   5 Vback  23 Vpol N
    Alphanumeric Data String: 'MVV4J'
    Manufacturer-Specified Display Descriptor (0x00): 00 00 00 00 41 31 96 00 10 00 00 0a 01 0a 20 20 '....A1........  '
Checksum: 0x71

----------------

Failures:

Block 0, Base EDID:
  Alphanumeric Data String: Non-printable character.
  Missing Display Product Name.

EDID conformity: FAIL
