
EDID (hex):
00ffffffffffff00410c000001010101
051c0103804024780af9aba2554a9a25
0f474a21080001010101010101010101
0101010101011b2150a051001e304888
3500806821000018023a801871382d40
582c450080682100001e000000fc0050
48494c495053204654560a20000000fd
00384c1e5311000a20202020202001c5
02032c704e13041f1021222014051102
1506012c0907031507503d07c0550700
8301000067030c001000b82d023a80d0
72382d40102c458080682100001e011d
80d0721c1620102c258080682100009e
011d8018711c1620582c250080682100
009e011d00bc52d01e20b82855408068
2100001e000000000000000000000002

Extracted contents:
header:          00 ff ff ff ff ff ff 00
serial number:   41 0c 00 00 01 01 01 01 05 1c
version:         01 03
basic params:    80 40 24 78 0a
chroma info:     f9 ab a2 55 4a 9a 25 0f 47 4a
established:     21 08 00
standard:        01 01 01 01 01 01 01 01 01 01 01 01 01 01 01 01
descriptor 1:    1b 21 50 a0 51 00 1e 30 48 88 35 00 80 68 21 00 00 18
descriptor 2:    02 3a 80 18 71 38 2d 40 58 2c 45 00 80 68 21 00 00 1e
descriptor 3:    00 00 00 fc 00 50 48 49 4c 49 50 53 20 46 54 56 0a 20
descriptor 4:    00 00 00 fd 00 38 4c 1e 53 11 00 0a 20 20 20 20 20 20
extensions:      01
checksum:        c5

EDID version: 1.3
Manufacturer: PHL Model 0 Serial Number --
Made in week 5 of 2018
Digital display
Maximum image size: 64 cm x 36 cm
Gamma: 2.20
RGB color display
First detailed timing is preferred timing
Display x,y Chromaticity:
  Red:   0.6357, 0.3349
  Green: 0.2910, 0.6025
  Blue:  0.1464, 0.0605
  White: 0.2792, 0.2919
Established timings supported:
  640x480@60Hz 4:3 HorFreq: 31469 Hz Clock: 25.175 MHz
  800x600@60Hz 4:3 HorFreq: 37900 Hz Clock: 40.000 MHz
  1024x768@60Hz 4:3 HorFreq: 48400 Hz Clock: 65.000 MHz
Standard timings supported:
Detailed mode: Clock 84.750 MHz, 640 mm x 360 mm
               1360 1432 1568 1776 hborder 0
                768  771  776  798 vborder 0
               -hsync -vsync 
               VertFreq: 59 Hz, HorFreq: 47719 Hz
Detailed mode: Clock 148.500 MHz, 640 mm x 360 mm
               1920 2008 2052 2200 hborder 0
               1080 1084 1089 1125 vborder 0
               +hsync +vsync 
               VertFreq: 60 Hz, HorFreq: 67500 Hz
Monitor name: PHILIPS FTV
Monitor ranges (GTF): 56-76Hz V, 30-83kHz H, max dotclock 170MHz
Has 1 extension blocks
Checksum: 0xc5 (valid)

CTA extension block
Extension version: 3
40 bytes of CTA data
  Video data block
    VIC  19 1280x720@50Hz 16:9  HorFreq: 37500 Hz Clock: 74.250 MHz
    VIC   4 1280x720@60Hz 16:9  HorFreq: 45000 Hz Clock: 74.250 MHz
    VIC  31 1920x1080@50Hz 16:9  HorFreq: 56250 Hz Clock: 148.500 MHz
    VIC  16 1920x1080@60Hz 16:9  HorFreq: 67500 Hz Clock: 148.500 MHz
    VIC  33 1920x1080@25Hz 16:9  HorFreq: 28125 Hz Clock: 74.250 MHz
    VIC  34 1920x1080@30Hz 16:9  HorFreq: 33750 Hz Clock: 74.250 MHz
    VIC  32 1920x1080@24Hz 16:9  HorFreq: 27000 Hz Clock: 74.250 MHz
    VIC  20 1920x1080i@50Hz 16:9  HorFreq: 28125 Hz Clock: 74.250 MHz
    VIC   5 1920x1080i@60Hz 16:9  HorFreq: 33750 Hz Clock: 74.250 MHz
    VIC  17 720x576@50Hz 4:3  HorFreq: 31250 Hz Clock: 27.000 MHz
    VIC   2 720x480@60Hz 4:3  HorFreq: 31469 Hz Clock: 27.000 MHz
    VIC  21 1440x576i@50Hz 4:3  HorFreq: 15625 Hz Clock: 27.000 MHz
    VIC   6 1440x480i@60Hz 4:3  HorFreq: 15734 Hz Clock: 27.000 MHz
    VIC   1 640x480@60Hz 4:3  HorFreq: 31469 Hz Clock: 25.175 MHz
  Audio data block
    Linear PCM, max channels 2
      Supported sample rates (kHz): 48 44.1 32
      Supported sample sizes (bits): 20 16
    AC-3, max channels 6
      Supported sample rates (kHz): 48 44.1 32
      Maximum bit rate: 640 kHz
    DTS, max channels 6
      Supported sample rates (kHz): 48 44.1 32
      Maximum bit rate: 1536 kHz
    Dolby Digital+, max channels 6
      Supported sample rates (kHz): 48 44.1 32
  Speaker allocation data block
    Speaker map:
      FL/FR - Front Left/Right
  Vendor-specific data block, OUI 000c03 (HDMI)
    Source physical address 1.0.0.0
    Supports_AI
    DC_36bit
    DC_30bit
    DC_Y444
    Maximum TMDS clock: 225MHz
Basic audio support
Supports YCbCr 4:4:4
Supports YCbCr 4:2:2
0 native detailed modes
Detailed mode: Clock 148.500 MHz, 640 mm x 360 mm
               1920 2448 2492 2640 hborder 0
               1080 1084 1089 1125 vborder 0
               +hsync +vsync 
               VertFreq: 50 Hz, HorFreq: 56250 Hz
Detailed mode: Clock 74.250 MHz, 640 mm x 360 mm
               1920 2448 2492 2640 hborder 0
                540  542  547  562 vborder 0
               +hsync +vsync interlaced 
               VertFreq: 50 Hz, HorFreq: 28125 Hz
Detailed mode: Clock 74.250 MHz, 640 mm x 360 mm
               1920 2008 2052 2200 hborder 0
                540  542  547  562 vborder 0
               +hsync +vsync interlaced 
               VertFreq: 60 Hz, HorFreq: 33750 Hz
Detailed mode: Clock 74.250 MHz, 640 mm x 360 mm
               1280 1720 1760 1980 hborder 0
                720  725  730  750 vborder 0
               +hsync +vsync 
               VertFreq: 50 Hz, HorFreq: 37500 Hz
Checksum: 0x2 (valid)

One or more of the timings is out of range of the Monitor Ranges:
  Vertical Freq: 24 - 60 Hz
  Horizontal Freq: 15625 - 67500 Hz
  Maximum Clock: 148.500 MHz
