
EDID (hex):
00ffffffffffff00410c000001010101
2f140103804627780ae692a3544a9926
0f4a4c2108008bc08180a94001010101
010101010101023a801871382d40582c
450000d05200001e023a80d072382d40
102c458000d05200001e000000fc0050
68696c697073204654560a20000000fd
00303e0f4611000a20202020202001f8

Extracted contents:
header:          00 ff ff ff ff ff ff 00
serial number:   41 0c 00 00 01 01 01 01 2f 14
version:         01 03
basic params:    80 46 27 78 0a
chroma info:     e6 92 a3 54 4a 99 26 0f 4a 4c
established:     21 08 00
standard:        8b c0 81 80 a9 40 01 01 01 01 01 01 01 01 01 01
descriptor 1:    02 3a 80 18 71 38 2d 40 58 2c 45 00 00 d0 52 00 00 1e
descriptor 2:    02 3a 80 d0 72 38 2d 40 10 2c 45 80 00 d0 52 00 00 1e
descriptor 3:    00 00 00 fc 00 50 68 69 6c 69 70 73 20 46 54 56 0a 20
descriptor 4:    00 00 00 fd 00 30 3e 0f 46 11 00 0a 20 20 20 20 20 20
extensions:      01
checksum:        f8

EDID version: 1.3
Manufacturer: PHL Model 0 Serial Number --
Made in week 47 of 2010
Digital display
Maximum image size: 70 cm x 39 cm
Gamma: 2.20
RGB color display
First detailed timing is preferred timing
Display x,y Chromaticity:
  Red:   0.6396, 0.3300
  Green: 0.2900, 0.5996
  Blue:  0.1503, 0.0595
  White: 0.2890, 0.2988
Established timings supported:
  640x480@60Hz 4:3 HorFreq: 31469 Hz Clock: 25.175 MHz
  800x600@60Hz 4:3 HorFreq: 37900 Hz Clock: 40.000 MHz
  1024x768@60Hz 4:3 HorFreq: 48400 Hz Clock: 65.000 MHz
Standard timings supported:
  1360x765@60Hz 16:9
  1280x1024@60Hz 5:4 HorFreq: 64000 Hz Clock: 108.000 MHz
  1600x1200@60Hz 4:3 HorFreq: 75000 Hz Clock: 162.000 MHz
Detailed mode: Clock 148.500 MHz, 1280 mm x 720 mm
               1920 2008 2052 2200 hborder 0
               1080 1084 1089 1125 vborder 0
               +hsync +vsync 
               VertFreq: 60 Hz, HorFreq: 67500 Hz
Detailed mode: Clock 148.500 MHz, 1280 mm x 720 mm
               1920 2448 2492 2640 hborder 0
               1080 1084 1089 1125 vborder 0
               +hsync +vsync 
               VertFreq: 50 Hz, HorFreq: 56250 Hz
Monitor name: Philips FTV
Monitor ranges (GTF): 48-62Hz V, 15-70kHz H, max dotclock 170MHz
Has 1 extension blocks
Checksum: 0xf8 (valid)
One or more of the timings is out of range of the Monitor Ranges:
  Vertical Freq: 50 - 60 Hz
  Horizontal Freq: 31469 - 75000 Hz
  Maximum Clock: 162.000 MHz
