edid-decode (hex):

00 ff ff ff ff ff ff 00 41 0c 00 00 01 01 01 01
12 12 01 03 80 29 1a 78 0a 0d c9 a0 57 47 98 27
12 48 4c 21 08 00 01 01 01 01 01 01 01 01 01 01
01 01 01 01 01 01 01 1d 00 72 51 d0 1e 20 6e 28
55 00 9a 04 11 00 00 1e 00 00 00 00 00 00 00 00
00 00 00 00 00 00 00 00 00 00 00 00 00 fc 00 50
48 49 4c 49 50 53 20 46 54 56 0a 20 00 00 00 fd
00 30 3e 0e 46 10 00 0a 20 20 20 20 20 20 01 06

----------------

Block 0, Base EDID:
  EDID Structure Version & Revision: 1.3
  Vendor & Product Identification:
    Manufacturer: PHL
    Model: 0
    Serial Number: ...
    Made in: week 18 of 2008
  Basic Display Parameters & Features:
    Digital display
    Maximum image size: 41 cm x 26 cm
    Gamma: 2.20
    RGB color display
    First detailed timing is the preferred timing
  Color Characteristics:
    Red  : 0.6250, 0.3398
    Green: 0.2802, 0.5947
    Blue : 0.1552, 0.0703
    White: 0.2832, 0.2978
  Established Timings I & II:
    DMT 0x04:   640x480    59.940476 Hz   4:3     31.469 kHz     25.175000 MHz
    DMT 0x09:   800x600    60.316541 Hz   4:3     37.879 kHz     40.000000 MHz
    DMT 0x10:  1024x768    60.003840 Hz   4:3     48.363 kHz     65.000000 MHz
  Standard Timings: none
  Detailed Timing Descriptors:
    DTD 1:  1280x720    60.000000 Hz  16:9     45.000 kHz     74.250000 MHz (410 mm x 260 mm)
                 Hfront  110 Hsync  40 Hback  220 Hpol P
                 Vfront    5 Vsync   5 Vback   20 Vpol P
    Empty Descriptor
    Display Product Name: 'PHILIPS FTV'
    Display Range Limits:
      Monitor ranges (GTF): 48-62 Hz V, 14-70 kHz H, max dotclock 160 MHz
  Extension blocks: 1
Checksum: 0x06

----------------

Failures:

Block 0, Base EDID:
  Empty Descriptor: Use Dummy Descriptor instead of all zeroes.
EDID:
  Base EDID: EDID specified 1 extension block(s), but found 0 extension block(s).

EDID conformity: FAIL
