
EDID (hex):
00ffffffffffff0006af8d2e00000000
001d0104a5221378036e859358589228
1e505400000001010101010101010101
0101010101018b5280b4703826406c30
aa0058c210000018143780b470382640
6c30aa0058c210000018000000fd003c
5a4464150100000000000000000000fe
004231353648414e30322e31200a00b2

Extracted contents:
header:          00 ff ff ff ff ff ff 00
serial number:   06 af 8d 2e 00 00 00 00 00 1d
version:         01 04
basic params:    a5 22 13 78 03
chroma info:     6e 85 93 58 58 92 28 1e 50 54
established:     00 00 00
standard:        01 01 01 01 01 01 01 01 01 01 01 01 01 01 01 01
descriptor 1:    8b 52 80 b4 70 38 26 40 6c 30 aa 00 58 c2 10 00 00 18
descriptor 2:    14 37 80 b4 70 38 26 40 6c 30 aa 00 58 c2 10 00 00 18
descriptor 3:    00 00 00 fd 00 3c 5a 44 64 15 01 00 00 00 00 00 00 00
descriptor 4:    00 00 00 fe 00 42 31 35 36 48 41 4e 30 32 2e 31 20 0a
extensions:      00
checksum:        b2

EDID version: 1.4
Manufacturer: AUO Model 2e8d Serial Number --
Made in year 2019
Digital display
8 bits per primary color channel
DisplayPort interface
Maximum image size: 34 cm x 19 cm
Gamma: 2.20
Supported color formats: RGB 4:4:4
First detailed timing includes the native pixel format and preferred refresh rate
Display is continuous frequency
Display x,y Chromaticity:
  Red:   0.5751, 0.3457
  Green: 0.3466, 0.5722
  Blue:  0.1582, 0.1171
  White: 0.3134, 0.3291
Established timings supported:
Standard timings supported:
Detailed mode: Clock 211.310 MHz, 344 mm x 194 mm
               1920 2028 2076 2100 hborder 0
               1080 1090 1100 1118 vborder 0
               -hsync -vsync 
               VertFreq: 90 Hz, HorFreq: 100623 Hz
Detailed mode: Clock 141.000 MHz, 344 mm x 194 mm
               1920 2028 2076 2100 hborder 0
               1080 1090 1100 1118 vborder 0
               -hsync -vsync 
               VertFreq: 60 Hz, HorFreq: 67142 Hz
Monitor ranges (bare limits): 60-90Hz V, 68-100kHz H, max dotclock 210MHz
ASCII string: B156HAN02.1 
Checksum: 0xb2 (valid)
EDID block does NOT conform to EDID 1.4!
	Missing name descriptor
Warning: One or more of the timings is out of range of the Monitor Ranges:
  Vertical Freq: 60 - 90 Hz
  Horizontal Freq: 67142 - 100623 Hz
  Maximum Clock: 211.310 MHz
