
EDID (hex):
00ffffffffffff001e6df159361c0300
051b010380431c78eaca95a6554ea126
0f5054a54b80714f818081c0a9c0b300
010101010101295900a0a03827403020
3a00a5222100001a023a801871382d40
582c4500a11c2100001e000000fc004c
4720554c545241574944450a000000fd
00284b5a5a18000a20202020202001b4
020325f1499004031412051f01132309
07078301000065030c001000681a0000
01012d4b00023a801871382d40582c45
0056512100001e011d8018711c162058
2c250056512100009e011d007251d01e
206e28550056512100001e8c0ad08a20
e02d10103e9600565121000018000000
00000000000000000000000000000097

Extracted contents:
header:          00 ff ff ff ff ff ff 00
serial number:   1e 6d f1 59 36 1c 03 00 05 1b
version:         01 03
basic params:    80 43 1c 78 ea
chroma info:     ca 95 a6 55 4e a1 26 0f 50 54
established:     a5 4b 80
standard:        71 4f 81 80 81 c0 a9 c0 b3 00 01 01 01 01 01 01
descriptor 1:    29 59 00 a0 a0 38 27 40 30 20 3a 00 a5 22 21 00 00 1a
descriptor 2:    02 3a 80 18 71 38 2d 40 58 2c 45 00 a1 1c 21 00 00 1e
descriptor 3:    00 00 00 fc 00 4c 47 20 55 4c 54 52 41 57 49 44 45 0a
descriptor 4:    00 00 00 fd 00 28 4b 5a 5a 18 00 0a 20 20 20 20 20 20
extensions:      01
checksum:        b4

EDID version: 1.3
Manufacturer: GSM Model 59f1 Serial Number --
Made in week 5 of 2017
Digital display
Maximum image size: 67 cm x 28 cm
Gamma: 2.20
DPMS levels: Standby Suspend Off
RGB color display
First detailed timing is preferred timing
Display x,y Chromaticity:
  Red:   0.6513, 0.3320
  Green: 0.3066, 0.6308
  Blue:  0.1503, 0.0595
  White: 0.3134, 0.3291
Established timings supported:
  720x400@70Hz 9:5 HorFreq: 31469 Hz Clock: 28.320 MHz
  640x480@60Hz 4:3 HorFreq: 31469 Hz Clock: 25.175 MHz
  640x480@75Hz 4:3 HorFreq: 37500 Hz Clock: 31.500 MHz
  800x600@60Hz 4:3 HorFreq: 37900 Hz Clock: 40.000 MHz
  800x600@75Hz 4:3 HorFreq: 46900 Hz Clock: 49.500 MHz
  1024x768@60Hz 4:3 HorFreq: 48400 Hz Clock: 65.000 MHz
  1024x768@75Hz 4:3 HorFreq: 60000 Hz Clock: 78.750 MHz
  1280x1024@75Hz 5:4 HorFreq: 80000 Hz Clock: 135.000 MHz
  1152x870@75Hz 192:145 HorFreq: 67500 Hz Clock: 108.000 MHz
Standard timings supported:
  1152x864@75Hz 4:3 HorFreq: 67500 Hz Clock: 108.000 MHz
  1280x1024@60Hz 5:4 HorFreq: 64000 Hz Clock: 108.000 MHz
  1280x720@60Hz 16:9
  1600x900@60Hz 16:9
  1680x1050@60Hz 16:10 HorFreq: 64700 Hz Clock: 119.000 MHz
Detailed mode: Clock 228.250 MHz, 677 mm x 290 mm
               2560 2608 2640 2720 hborder 0
               1080 1083 1093 1119 vborder 0
               +hsync -vsync 
               VertFreq: 74 Hz, HorFreq: 83915 Hz
Detailed mode: Clock 148.500 MHz, 673 mm x 284 mm
               1920 2008 2052 2200 hborder 0
               1080 1084 1089 1125 vborder 0
               +hsync +vsync 
               VertFreq: 60 Hz, HorFreq: 67500 Hz
Monitor name: LG ULTRAWIDE
Monitor ranges (GTF): 40-75Hz V, 90-90kHz H, max dotclock 240MHz
Has 1 extension blocks
Checksum: 0xb4 (valid)

CTA extension block
Extension version: 3
33 bytes of CTA data
  Video data block
    VIC  16 1920x1080@60Hz 16:9 (native) HorFreq: 67500 Hz Clock: 148.500 MHz
    VIC   4 1280x720@60Hz 16:9  HorFreq: 45000 Hz Clock: 74.250 MHz
    VIC   3 720x480@60Hz 16:9  HorFreq: 31469 Hz Clock: 27.000 MHz
    VIC  20 1920x1080i@50Hz 16:9  HorFreq: 28125 Hz Clock: 74.250 MHz
    VIC  18 720x576@50Hz 16:9  HorFreq: 31250 Hz Clock: 27.000 MHz
    VIC   5 1920x1080i@60Hz 16:9  HorFreq: 33750 Hz Clock: 74.250 MHz
    VIC  31 1920x1080@50Hz 16:9  HorFreq: 56250 Hz Clock: 148.500 MHz
    VIC   1 640x480@60Hz 4:3  HorFreq: 31469 Hz Clock: 25.175 MHz
    VIC  19 1280x720@50Hz 16:9  HorFreq: 37500 Hz Clock: 74.250 MHz
  Audio data block
    Linear PCM, max channels 2
      Supported sample rates (kHz): 48 44.1 32
      Supported sample sizes (bits): 24 20 16
  Speaker allocation data block
    Speaker map:
      FL/FR - Front Left/Right
  Vendor-specific data block, OUI 000c03 (HDMI)
    Source physical address 1.0.0.0
  Vendor-specific data block, OUI 00001a
Underscans PC formats by default
Basic audio support
Supports YCbCr 4:4:4
Supports YCbCr 4:2:2
1 native detailed modes
Detailed mode: Clock 148.500 MHz, 598 mm x 337 mm
               1920 2008 2052 2200 hborder 0
               1080 1084 1089 1125 vborder 0
               +hsync +vsync 
               VertFreq: 60 Hz, HorFreq: 67500 Hz
Detailed mode: Clock 74.250 MHz, 598 mm x 337 mm
               1920 2008 2052 2200 hborder 0
                540  542  547  562 vborder 0
               +hsync +vsync interlaced 
               VertFreq: 60 Hz, HorFreq: 33750 Hz
Detailed mode: Clock 74.250 MHz, 598 mm x 337 mm
               1280 1390 1430 1650 hborder 0
                720  725  730  750 vborder 0
               +hsync +vsync 
               VertFreq: 60 Hz, HorFreq: 45000 Hz
Detailed mode: Clock 27.000 MHz, 598 mm x 337 mm
                720  736  798  858 hborder 0
                480  489  495  525 vborder 0
               -hsync -vsync 
               VertFreq: 59 Hz, HorFreq: 31468 Hz
Checksum: 0x97 (valid)

One or more of the timings is out of range of the Monitor Ranges:
  Vertical Freq: 50 - 75 Hz
  Horizontal Freq: 28125 - 83915 Hz
  Maximum Clock: 228.250 MHz


