
EDID (hex):
00ffffffffffff001e6df159ec770600
0b1b010380431c78eaca95a6554ea126
0f5054a54b80714f818081c0a9c0b300
0101010101017e4800e0a0381f404040
3a00a11c21000018023a801871382d40
582c4500a11c2100001e000000fc004c
4720554c545241574944450a000000fd
00384b1e5a18000a2020202020200126

Extracted contents:
header:          00 ff ff ff ff ff ff 00
serial number:   1e 6d f1 59 ec 77 06 00 0b 1b
version:         01 03
basic params:    80 43 1c 78 ea
chroma info:     ca 95 a6 55 4e a1 26 0f 50 54
established:     a5 4b 80
standard:        71 4f 81 80 81 c0 a9 c0 b3 00 01 01 01 01 01 01
descriptor 1:    7e 48 00 e0 a0 38 1f 40 40 40 3a 00 a1 1c 21 00 00 18
descriptor 2:    02 3a 80 18 71 38 2d 40 58 2c 45 00 a1 1c 21 00 00 1e
descriptor 3:    00 00 00 fc 00 4c 47 20 55 4c 54 52 41 57 49 44 45 0a
descriptor 4:    00 00 00 fd 00 38 4b 1e 5a 18 00 0a 20 20 20 20 20 20
extensions:      01
checksum:        26

EDID version: 1.3
Manufacturer: GSM Model 59f1 Serial Number --
Made in week 11 of 2017
Digital display
Maximum image size: 67 cm x 28 cm
Gamma: 2.20
DPMS levels: Standby Suspend Off
RGB color display
First detailed timing is preferred timing
Display x,y Chromaticity:
  Red:   0.6513, 0.3320
  Green: 0.3066, 0.6308
  Blue:  0.1503, 0.0595
  White: 0.3134, 0.3291
Established timings supported:
  720x400@70Hz 9:5 HorFreq: 31469 Hz Clock: 28.320 MHz
  640x480@60Hz 4:3 HorFreq: 31469 Hz Clock: 25.175 MHz
  640x480@75Hz 4:3 HorFreq: 37500 Hz Clock: 31.500 MHz
  800x600@60Hz 4:3 HorFreq: 37900 Hz Clock: 40.000 MHz
  800x600@75Hz 4:3 HorFreq: 46900 Hz Clock: 49.500 MHz
  1024x768@60Hz 4:3 HorFreq: 48400 Hz Clock: 65.000 MHz
  1024x768@75Hz 4:3 HorFreq: 60000 Hz Clock: 78.750 MHz
  1280x1024@75Hz 5:4 HorFreq: 80000 Hz Clock: 135.000 MHz
  1152x870@75Hz 192:145 HorFreq: 67500 Hz Clock: 108.000 MHz
Standard timings supported:
  1152x864@75Hz 4:3 HorFreq: 67500 Hz Clock: 108.000 MHz
  1280x1024@60Hz 5:4 HorFreq: 64000 Hz Clock: 108.000 MHz
  1280x720@60Hz 16:9
  1600x900@60Hz 16:9
  1680x1050@60Hz 16:10 HorFreq: 64700 Hz Clock: 119.000 MHz
Detailed mode: Clock 185.580 MHz, 673 mm x 284 mm
               2560 2624 2688 2784 hborder 0
               1080 1083 1093 1111 vborder 0
               -hsync -vsync 
               VertFreq: 59 Hz, HorFreq: 66659 Hz
Detailed mode: Clock 148.500 MHz, 673 mm x 284 mm
               1920 2008 2052 2200 hborder 0
               1080 1084 1089 1125 vborder 0
               +hsync +vsync 
               VertFreq: 60 Hz, HorFreq: 67500 Hz
Monitor name: LG ULTRAWIDE
Monitor ranges (GTF): 56-75Hz V, 30-90kHz H, max dotclock 240MHz
Has 1 extension blocks
Checksum: 0x26 (valid)
