edid-decode (hex):

00 ff ff ff ff ff ff 00 1e 6d f1 59 88 0b 02 00
07 18 01 03 80 3a 18 78 ea ca 95 a6 55 4e a1 26
0f 50 54 a5 4b 80 71 4f 81 80 81 c0 a9 c0 b3 00
01 01 01 01 01 01 7e 48 00 e0 a0 38 1f 40 40 40
3a 00 a5 22 21 00 00 18 02 3a 80 18 71 38 2d 40
58 2c 45 00 a5 22 21 00 00 1e 00 00 00 fc 00 4c
47 20 55 4c 54 52 41 57 49 44 45 0a 00 00 00 fd
00 38 4b 1e 5a 18 00 0a 20 20 20 20 20 20 01 fa

02 03 1d f1 4a 90 04 03 22 14 12 05 1f 01 13 23
09 07 07 83 01 00 00 65 03 0c 00 10 00 02 3a 80
18 71 38 2d 40 58 2c 45 00 56 51 21 00 00 1e 01
1d 80 18 71 1c 16 20 58 2c 25 00 56 51 21 00 00
9e 01 1d 00 72 51 d0 1e 20 6e 28 55 00 56 51 21
00 00 1e 8c 0a d0 8a 20 e0 2d 10 10 3e 96 00 56
51 21 00 00 18 00 00 00 ff 00 34 30 37 4e 44 41
59 33 59 30 32 34 0a 00 00 00 00 00 00 00 00 86

----------------

Block 0, Base EDID:
  EDID Structure Version & Revision: 1.3
  Vendor & Product Identification:
    Manufacturer: GSM
    Model: 23025
    Serial Number: ...
    Made in: week 7 of 2014
  Basic Display Parameters & Features:
    Digital display
    Maximum image size: 58 cm x 24 cm
    Gamma: 2.20
    DPMS levels: Standby Suspend Off
    RGB color display
    First detailed timing is the preferred timing
  Color Characteristics:
    Red  : 0.6513, 0.3320
    Green: 0.3066, 0.6308
    Blue : 0.1503, 0.0595
    White: 0.3134, 0.3291
  Established Timings I & II:
    IBM     :   720x400    70.082 Hz   9:5    31.467 kHz  28.320 MHz
    DMT 0x04:   640x480    59.940 Hz   4:3    31.469 kHz  25.175 MHz
    DMT 0x06:   640x480    75.000 Hz   4:3    37.500 kHz  31.500 MHz
    DMT 0x09:   800x600    60.317 Hz   4:3    37.879 kHz  40.000 MHz
    DMT 0x0b:   800x600    75.000 Hz   4:3    46.875 kHz  49.500 MHz
    DMT 0x10:  1024x768    60.004 Hz   4:3    48.363 kHz  65.000 MHz
    DMT 0x12:  1024x768    75.029 Hz   4:3    60.023 kHz  78.750 MHz
    DMT 0x24:  1280x1024   75.025 Hz   5:4    79.976 kHz 135.000 MHz
    Apple   :  1152x870    75.062 Hz 192:145  68.681 kHz 100.000 MHz
  Standard Timings:
    DMT 0x15:  1152x864    75.000 Hz   4:3    67.500 kHz 108.000 MHz
    DMT 0x23:  1280x1024   60.020 Hz   5:4    63.981 kHz 108.000 MHz
    DMT 0x55:  1280x720    60.000 Hz  16:9    45.000 kHz  74.250 MHz
    DMT 0x53:  1600x900    60.000 Hz  16:9    60.000 kHz 108.000 MHz (RB)
    DMT 0x3a:  1680x1050   59.954 Hz  16:10   65.290 kHz 146.250 MHz
  Detailed Timing Descriptors:
    DTD 1:  2560x1080   60.000 Hz  64:27   66.659 kHz 185.580 MHz (677 mm x 290 mm)
                 Hfront   64 Hsync  64 Hback  96 Hpol N
                 Vfront    3 Vsync  10 Vback  18 Vpol N
    DTD 2:  1920x1080   60.000 Hz  16:9    67.500 kHz 148.500 MHz (677 mm x 290 mm)
                 Hfront   88 Hsync  44 Hback 148 Hpol P
                 Vfront    4 Vsync   5 Vback  36 Vpol P
    Display Product Name: 'LG ULTRAWIDE'
  Display Range Limits:
    Monitor ranges (GTF): 56-75 Hz V, 30-90 kHz H, max dotclock 240 MHz
  Extension blocks: 1
Checksum: 0xfa

----------------

Block 1, CTA-861 Extension Block:
  Revision: 3
  Underscans IT Video Formats by default
  Basic audio support
  Supports YCbCr 4:4:4
  Supports YCbCr 4:2:2
  Native detailed modes: 1
  Video Data Block:
    VIC  16:  1920x1080   60.000 Hz  16:9    67.500 kHz 148.500 MHz (native)
    VIC   4:  1280x720    60.000 Hz  16:9    45.000 kHz  74.250 MHz
    VIC   3:   720x480    59.940 Hz  16:9    31.469 kHz  27.000 MHz
    VIC  34:  1920x1080   30.000 Hz  16:9    33.750 kHz  74.250 MHz
    VIC  20:  1920x1080i  50.000 Hz  16:9    28.125 kHz  74.250 MHz
    VIC  18:   720x576    50.000 Hz  16:9    31.250 kHz  27.000 MHz
    VIC   5:  1920x1080i  60.000 Hz  16:9    33.750 kHz  74.250 MHz
    VIC  31:  1920x1080   50.000 Hz  16:9    56.250 kHz 148.500 MHz
    VIC   1:   640x480    59.940 Hz   4:3    31.469 kHz  25.175 MHz
    VIC  19:  1280x720    50.000 Hz  16:9    37.500 kHz  74.250 MHz
  Audio Data Block:
    Linear PCM:
      Max channels: 2
      Supported sample rates (kHz): 48 44.1 32
      Supported sample sizes (bits): 24 20 16
  Speaker Allocation Data Block:
    FL/FR - Front Left/Right
  Vendor-Specific Data Block (HDMI), OUI 00-0C-03:
    Source physical address: 1.0.0.0
  Detailed Timing Descriptors:
    DTD 3:  1920x1080   60.000 Hz  16:9    67.500 kHz 148.500 MHz (598 mm x 337 mm)
                 Hfront   88 Hsync  44 Hback 148 Hpol P
                 Vfront    4 Vsync   5 Vback  36 Vpol P
    DTD 4:  1920x1080i  60.000 Hz  16:9    33.750 kHz  74.250 MHz (598 mm x 337 mm)
                 Hfront   88 Hsync  44 Hback 148 Hpol P
                 Vfront    2 Vsync   5 Vback  15 Vpol P Vfront +0.5 Odd Field
                 Vfront    2 Vsync   5 Vback  15 Vpol P Vback  +0.5 Even Field
    DTD 5:  1280x720    60.000 Hz  16:9    45.000 kHz  74.250 MHz (598 mm x 337 mm)
                 Hfront  110 Hsync  40 Hback 220 Hpol P
                 Vfront    5 Vsync   5 Vback  20 Vpol P
    DTD 6:   720x480    59.940 Hz   3:2    31.469 kHz  27.000 MHz (598 mm x 337 mm)
                 Hfront   16 Hsync  62 Hback  60 Hpol N
                 Vfront    9 Vsync   6 Vback  30 Vpol N
    Display Product Serial Number: ...
Checksum: 0x86

----------------

Warnings:

Block 1, CTA-861 Extension Block:
  Display Product Serial Number is set, so the Serial Number in the Base EDID should be 0.
  Missing VCDB, needed for Set Selectable RGB Quantization to avoid interop issues.

Failures:

Block 0, Base EDID:
  Detailed Timing Descriptor #1: Mismatch of image size 677x290 mm vs display size 580x240 mm.
  Detailed Timing Descriptor #2: Mismatch of image size 677x290 mm vs display size 580x240 mm.
Block 1, CTA-861 Extension Block:
  Detailed Timing Descriptor #3: Mismatch of image size 598x337 mm vs display size 580x240 mm.
  Detailed Timing Descriptor #4: Mismatch of image size 598x337 mm vs display size 580x240 mm.
  Detailed Timing Descriptor #5: Mismatch of image size 598x337 mm vs display size 580x240 mm.
  Detailed Timing Descriptor #6: Mismatch of image size 598x337 mm vs display size 580x240 mm.
EDID:
  Base EDID: Some timings are out of range of the Monitor Ranges:
    Vertical Freq: 30.000 - 75.062 Hz (Monitor: 56.000 - 75.000 Hz)
    Horizontal Freq: 28.125 - 79.976 kHz (Monitor: 30.000 - 90.000 kHz)
  CTA-861: Native progressive timings are a mix of several resolutions.

EDID conformity: FAIL
