edid-decode (hex):

00 ff ff ff ff ff ff 00 0d ae 16 14 00 00 00 00
10 1e 01 04 a5 1f 11 78 02 ee 95 a3 54 4c 99 26
0f 50 54 00 00 00 01 01 01 01 01 01 01 01 01 01
01 01 01 01 01 01 36 36 80 a0 70 38 20 40 2e 1e
24 00 35 ad 10 00 00 1a 60 2b 80 a0 70 38 20 40
2e 1e 24 00 35 ad 10 00 00 1a 00 00 00 fe 00 43
48 46 30 37 80 31 34 30 48 43 47 0a 00 00 00 00
00 02 41 01 a8 00 10 00 00 0a 01 0a 20 20 00 a0

----------------

Block 0, Base EDID:
  EDID Structure Version & Revision: 1.4
  Vendor & Product Identification:
    Manufacturer: CMN
    Model: 5142
    Made in: week 16 of 2020
  Basic Display Parameters & Features:
    Digital display
    Bits per primary color channel: 8
    DisplayPort interface
    Maximum image size: 31 cm x 17 cm
    Gamma: 2.20
    Supported color formats: RGB 4:4:4
    First detailed timing includes the native pixel format and preferred refresh rate
  Color Characteristics:
    Red  : 0.6396, 0.3300
    Green: 0.2998, 0.5996
    Blue : 0.1503, 0.0595
    White: 0.3134, 0.3291
  Established Timings I & II: none
  Standard Timings: none
  Detailed Timing Descriptors:
    DTD 1:  1920x1080   60.001038 Hz  16:9     66.721 kHz    138.780000 MHz (309 mm x 173 mm)
                 Hfront   46 Hsync  30 Hback   84 Hpol P
                 Vfront    2 Vsync   4 Vback   26 Vpol N
    DTD 2:  1920x1080   48.007748 Hz  16:9     53.385 kHz    111.040000 MHz (309 mm x 173 mm)
                 Hfront   46 Hsync  30 Hback   84 Hpol P
                 Vfront    2 Vsync   4 Vback   26 Vpol N
    Alphanumeric Data String: 'CHF07'
    Manufacturer-Specified Display Descriptor (0x00): 00 00 00 02 41 01 a8 00 10 00 00 0a 01 0a 20 20 '....A.........  '
Checksum: 0xa0

----------------

Failures:

Block 0, Base EDID:
  Alphanumeric Data String: Non-printable character.
  Missing Display Product Name.

EDID conformity: FAIL
