edid-decode (hex):

00 ff ff ff ff ff ff 00 16 c5 01 00 01 01 01 01
22 1f 01 04 b5 3c 22 78 3b 63 f5 ac 50 44 af 26
0b 50 54 a7 08 00 d1 c0 b3 00 31 0a 81 80 81 40
81 c0 81 e8 01 01 08 e8 00 30 f2 70 5a 80 b0 58
8a 00 54 4f 21 00 00 1e 00 00 00 fd 0c 30 90 45
45 82 01 0a 20 20 20 20 20 20 00 00 00 fc 00 45
53 30 37 44 30 33 0a 20 20 20 20 20 00 00 00 ff
00 45 56 45 32 31 33 34 30 30 38 35 30 0a 02 f4

02 03 39 71 53 76 10 04 29 1f 13 01 75 2f 5d 60
61 05 07 14 3f 5f 5e 40 23 09 07 07 83 01 00 00
6d 1a 00 00 02 0b 30 90 00 05 78 13 7a 12 e3 05
c3 81 e6 06 07 01 7b 7b 18 08 e8 00 30 f2 70 5a
80 b0 58 8a 00 54 4f 21 00 00 1a 56 5e 00 a0 a0
a0 29 50 30 20 35 00 54 4f 21 00 00 1a 02 3a 80
18 71 38 2d 40 58 2c 45 00 54 4f 21 00 00 1e 00
00 00 00 00 00 00 00 00 00 00 00 00 00 00 00 cd

70 12 79 03 00 03 01 64 e2 f3 01 84 ff 0e 9f 00
2f 80 3f 00 6f 08 3d 00 02 00 04 00 9b 45 00 04
ff 04 71 01 6d 80 27 00 cf 02 1d 00 04 80 04 00
37 8b 00 04 7f 07 17 01 57 80 2b 00 37 04 2c 00
03 00 04 00 7d e5 00 04 ff 09 9f 00 2f 80 37 00
9f 05 3b 00 02 00 07 00 99 a0 01 04 ff 0e 9f 00
2f 80 3f 00 6f 08 3d 00 02 00 04 00 00 00 00 00
00 00 00 00 00 00 00 00 00 00 00 00 00 00 38 90

00 ff ff ff ff ff ff 00 16 c5 01 00 01 01 01 01
22 1f 01 04 b5 3c 22 78 3b 63 f5 ac 50 44 af 26
0b 50 54 a7 08 00 d1 c0 b3 00 31 0a 81 80 81 40
81 c0 81 e8 01 01 08 e8 00 30 f2 70 5a 80 b0 58
8a 00 54 4f 21 00 00 1e 00 00 00 fd 0c 30 90 45
45 82 01 0a 20 20 20 20 20 20 00 00 00 fc 00 45
53 30 37 44 30 33 0a 20 20 20 20 20 00 00 00 ff
00 45 56 45 32 31 33 34 30 30 38 35 30 0a 02 f4

02 03 39 71 53 76 10 04 29 1f 13 01 75 2f 5d 60
61 05 07 14 3f 5f 5e 40 23 09 07 07 83 01 00 00
6d 1a 00 00 02 0b 30 90 00 05 78 13 7a 12 e3 05
c3 81 e6 06 07 01 7b 7b 18 08 e8 00 30 f2 70 5a
80 b0 58 8a 00 54 4f 21 00 00 1a 56 5e 00 a0 a0
a0 29 50 30 20 35 00 54 4f 21 00 00 1a 02 3a 80
18 71 38 2d 40 58 2c 45 00 54 4f 21 00 00 1e 00
00 00 00 00 00 00 00 00 00 00 00 00 00 00 00 cd

70 12 79 03 00 03 01 64 e2 f3 01 84 ff 0e 9f 00
2f 80 3f 00 6f 08 3d 00 02 00 04 00 9b 45 00 04
ff 04 71 01 6d 80 27 00 cf 02 1d 00 04 80 04 00
37 8b 00 04 7f 07 17 01 57 80 2b 00 37 04 2c 00
03 00 04 00 7d e5 00 04 ff 09 9f 00 2f 80 37 00
9f 05 3b 00 02 00 07 00 99 a0 01 04 ff 0e 9f 00
2f 80 3f 00 6f 08 3d 00 02 00 04 00 00 00 00 00
00 00 00 00 00 00 00 00 00 00 00 00 00 00 38 90

----------------

Block 0, Base EDID:
  EDID Structure Version & Revision: 1.4
  Vendor & Product Identification:
    Manufacturer: EVE
    Model: 1
    Serial Number: ...
    Made in: week 34 of 2021
  Basic Display Parameters & Features:
    Digital display
    Bits per primary color channel: 10
    DisplayPort interface
    Maximum image size: 60 cm x 34 cm
    Gamma: 2.20
    DPMS levels: Off
    Supported color formats: RGB 4:4:4, YCrCb 4:4:4, YCrCb 4:2:2
    First detailed timing includes the native pixel format and preferred refresh rate
    Display is continuous frequency
  Color Characteristics:
    Red  : 0.6728, 0.3144
    Green: 0.2656, 0.6865
    Blue : 0.1513, 0.0458
    White: 0.3134, 0.3291
  Established Timings I & II:
    IBM     :   720x400    70.081663 Hz   9:5     31.467 kHz     28.320000 MHz
    DMT 0x04:   640x480    59.940476 Hz   4:3     31.469 kHz     25.175000 MHz
    DMT 0x06:   640x480    75.000000 Hz   4:3     37.500 kHz     31.500000 MHz
    DMT 0x08:   800x600    56.250000 Hz   4:3     35.156 kHz     36.000000 MHz
    DMT 0x09:   800x600    60.316541 Hz   4:3     37.879 kHz     40.000000 MHz
    DMT 0x10:  1024x768    60.003840 Hz   4:3     48.363 kHz     65.000000 MHz
  Standard Timings:
    DMT 0x52:  1920x1080   60.000000 Hz  16:9     67.500 kHz    148.500000 MHz
    DMT 0x3a:  1680x1050   59.954250 Hz  16:10    65.290 kHz    146.250000 MHz
    GTF     :   640x400    70.000000 Hz  16:10    29.190 kHz     23.352000 MHz
    DMT 0x23:  1280x1024   60.019740 Hz   5:4     63.981 kHz    108.000000 MHz
    DMT 0x20:  1280x960    60.000000 Hz   4:3     60.000 kHz    108.000000 MHz
    DMT 0x55:  1280x720    60.000000 Hz  16:9     45.000 kHz     74.250000 MHz
    GTF     :  1280x720    99.999697 Hz  16:9     76.300 kHz    131.846000 MHz
  Detailed Timing Descriptors:
    DTD 1:  3840x2160   60.000000 Hz  16:9    135.000 kHz    594.000000 MHz (596 mm x 335 mm)
                 Hfront  176 Hsync  88 Hback  296 Hpol P
                 Vfront    8 Vsync  10 Vback   72 Vpol P
    Display Range Limits:
      Monitor ranges (Bare Limits): 48-144 Hz V, 324-324 kHz H, max dotclock 1300 MHz
    Display Product Name: 'ES07D03'
    Display Product Serial Number: ...
  Extension blocks: 2
Checksum: 0xf4

----------------

Block 1, CTA-861 Extension Block:
  Revision: 3
  Basic audio support
  Supports YCbCr 4:4:4
  Supports YCbCr 4:2:2
  Native detailed modes: 1
  Video Data Block:
    VIC 118:  3840x2160  120.000000 Hz  16:9    270.000 kHz   1188.000000 MHz
    VIC  16:  1920x1080   60.000000 Hz  16:9     67.500 kHz    148.500000 MHz
    VIC   4:  1280x720    60.000000 Hz  16:9     45.000 kHz     74.250000 MHz
    VIC  41:  1280x720   100.000000 Hz  16:9     75.000 kHz    148.500000 MHz
    VIC  31:  1920x1080   50.000000 Hz  16:9     56.250 kHz    148.500000 MHz
    VIC  19:  1280x720    50.000000 Hz  16:9     37.500 kHz     74.250000 MHz
    VIC   1:   640x480    59.940476 Hz   4:3     31.469 kHz     25.175000 MHz
    VIC 117:  3840x2160  100.000000 Hz  16:9    225.000 kHz   1188.000000 MHz
    VIC  47:  1280x720   120.000000 Hz  16:9     90.000 kHz    148.500000 MHz
    VIC  93:  3840x2160   24.000000 Hz  16:9     54.000 kHz    297.000000 MHz
    VIC  96:  3840x2160   50.000000 Hz  16:9    112.500 kHz    594.000000 MHz
    VIC  97:  3840x2160   60.000000 Hz  16:9    135.000 kHz    594.000000 MHz
    VIC   5:  1920x1080i  60.000000 Hz  16:9     33.750 kHz     74.250000 MHz
    VIC   7:  1440x480i   59.940060 Hz  16:9     15.734 kHz     27.000000 MHz
    VIC  20:  1920x1080i  50.000000 Hz  16:9     28.125 kHz     74.250000 MHz
    VIC  63:  1920x1080  120.000000 Hz  16:9    135.000 kHz    297.000000 MHz
    VIC  95:  3840x2160   30.000000 Hz  16:9     67.500 kHz    297.000000 MHz
    VIC  94:  3840x2160   25.000000 Hz  16:9     56.250 kHz    297.000000 MHz
    VIC  64:  1920x1080  100.000000 Hz  16:9    112.500 kHz    297.000000 MHz
  Audio Data Block:
    Linear PCM:
      Max channels: 2
      Supported sample rates (kHz): 48 44.1 32
      Supported sample sizes (bits): 24 20 16
  Speaker Allocation Data Block:
    FL/FR - Front Left/Right
  Vendor-Specific Data Block (AMD), OUI 00-00-1A:
    Version: 2.11
    Minimum Refresh Rate: 48 Hz
    Maximum Refresh Rate: 144 Hz
    Flags 1.x: 0x00
    Flags 2.x: 0x05
    Maximum luminance: 120 (672.717 cd/m^2)
    Minimum luminance: 19 (0.037 cd/m^2)
    Maximum luminance (without local dimming): 122 (702.501 cd/m^2)
    Minimum luminance (without local dimming): 18 (0.035 cd/m^2)
  Colorimetry Data Block:
    xvYCC601
    xvYCC709
    BT2020YCC
    BT2020RGB
    Gamut Boundary Description Metadata Profile P0
    ST2113RGB
  HDR Static Metadata Data Block:
    Electro optical transfer functions:
      Traditional gamma - SDR luminance range
      Traditional gamma - HDR luminance range
      SMPTE ST2084
    Supported static metadata descriptors:
      Static metadata type 1
    Desired content max luminance: 123 (717.884 cd/m^2)
    Desired content max frame-average luminance: 123 (717.884 cd/m^2)
    Desired content min luminance: 24 (0.064 cd/m^2)
  Detailed Timing Descriptors:
    DTD 2:  3840x2160   60.000000 Hz  16:9    135.000 kHz    594.000000 MHz (596 mm x 335 mm)
                 Hfront  176 Hsync  88 Hback  296 Hpol P
                 Vfront    8 Vsync  10 Vback   72 Vpol N
    DTD 3:  2560x1440   59.950550 Hz  16:9     88.787 kHz    241.500000 MHz (596 mm x 335 mm)
                 Hfront   48 Hsync  32 Hback   80 Hpol P
                 Vfront    3 Vsync   5 Vback   33 Vpol N
    DTD 4:  1920x1080   60.000000 Hz  16:9     67.500 kHz    148.500000 MHz (596 mm x 335 mm)
                 Hfront   88 Hsync  44 Hback  148 Hpol P
                 Vfront    4 Vsync   5 Vback   36 Vpol P
Checksum: 0xcd  Unused space in Extension Block: 16 bytes

----------------

Block 2, DisplayID Extension Block:
  Version: 1.2
  Extension Count: 0
  Display Product Type: Standalone display device
  Video Timing Modes Type 1 - Detailed Timings Data Block:
    DTD:  3840x2160  143.981773 Hz  16:9    319.928 kHz   1279.710000 MHz (aspect 16:9, no 3D stereo, preferred)
               Hfront   48 Hsync  64 Hback   48 Hpol P
               Vfront    3 Vsync   5 Vback   54 Vpol N
    DTD:  1280x720   144.000000 Hz  16:9    108.000 kHz    178.200000 MHz (aspect 16:9, no 3D stereo)
               Hfront  110 Hsync  40 Hback  220 Hpol P
               Vfront    5 Vsync   5 Vback   20 Vpol P
    DTD:  1920x1080  144.000000 Hz  16:9    162.000 kHz    356.400000 MHz (aspect 16:9, no 3D stereo)
               Hfront   88 Hsync  44 Hback  148 Hpol P
               Vfront    4 Vsync   5 Vback   36 Vpol N
    DTD:  2560x1440  143.995098 Hz  16:9    215.993 kHz    587.500000 MHz (aspect 16:9, no 3D stereo)
               Hfront   48 Hsync  56 Hback   56 Hpol P
               Vfront    3 Vsync   8 Vback   49 Vpol N
    DTD:  3840x2160  119.993249 Hz  16:9    266.625 kHz   1066.500000 MHz (aspect 16:9, no 3D stereo)
               Hfront   48 Hsync  64 Hback   48 Hpol P
               Vfront    3 Vsync   5 Vback   54 Vpol N
  Checksum: 0x38
Checksum: 0x90

----------------

Block 3, Unknown EDID Extension Block 0x00:
  00 ff ff ff ff ff ff 00 16 c5 01 00 01 01 01 01 '................'
  22 1f 01 04 b5 3c 22 78 3b 63 f5 ac 50 44 af 26 '"....<"x;c..PD.&'
  0b 50 54 a7 08 00 d1 c0 b3 00 31 0a 81 80 81 40 '.PT.......1....@'
  81 c0 81 e8 01 01 08 e8 00 30 f2 70 5a 80 b0 58 '.........0.pZ..X'
  8a 00 54 4f 21 00 00 1e 00 00 00 fd 0c 30 90 45 '..TO!........0.E'
  45 82 01 0a 20 20 20 20 20 20 00 00 00 fc 00 45 'E...      .....E'
  53 30 37 44 30 33 0a 20 20 20 20 20 00 00 00 ff 'S07D03.     ....'
  00 45 56 45 32 31 33 34 30 30 38 35 30 0a 02 f4 '.EVE213400850...'
Checksum: 0xf4

----------------

Block 4, CTA-861 Extension Block:
  Revision: 3
  Basic audio support
  Supports YCbCr 4:4:4
  Supports YCbCr 4:2:2
  Native detailed modes: 1
  Video Data Block:
    VIC 118:  3840x2160  120.000000 Hz  16:9    270.000 kHz   1188.000000 MHz
    VIC  16:  1920x1080   60.000000 Hz  16:9     67.500 kHz    148.500000 MHz
    VIC   4:  1280x720    60.000000 Hz  16:9     45.000 kHz     74.250000 MHz
    VIC  41:  1280x720   100.000000 Hz  16:9     75.000 kHz    148.500000 MHz
    VIC  31:  1920x1080   50.000000 Hz  16:9     56.250 kHz    148.500000 MHz
    VIC  19:  1280x720    50.000000 Hz  16:9     37.500 kHz     74.250000 MHz
    VIC   1:   640x480    59.940476 Hz   4:3     31.469 kHz     25.175000 MHz
    VIC 117:  3840x2160  100.000000 Hz  16:9    225.000 kHz   1188.000000 MHz
    VIC  47:  1280x720   120.000000 Hz  16:9     90.000 kHz    148.500000 MHz
    VIC  93:  3840x2160   24.000000 Hz  16:9     54.000 kHz    297.000000 MHz
    VIC  96:  3840x2160   50.000000 Hz  16:9    112.500 kHz    594.000000 MHz
    VIC  97:  3840x2160   60.000000 Hz  16:9    135.000 kHz    594.000000 MHz
    VIC   5:  1920x1080i  60.000000 Hz  16:9     33.750 kHz     74.250000 MHz
    VIC   7:  1440x480i   59.940060 Hz  16:9     15.734 kHz     27.000000 MHz
    VIC  20:  1920x1080i  50.000000 Hz  16:9     28.125 kHz     74.250000 MHz
    VIC  63:  1920x1080  120.000000 Hz  16:9    135.000 kHz    297.000000 MHz
    VIC  95:  3840x2160   30.000000 Hz  16:9     67.500 kHz    297.000000 MHz
    VIC  94:  3840x2160   25.000000 Hz  16:9     56.250 kHz    297.000000 MHz
    VIC  64:  1920x1080  100.000000 Hz  16:9    112.500 kHz    297.000000 MHz
  Audio Data Block:
    Linear PCM:
      Max channels: 2
      Supported sample rates (kHz): 48 44.1 32
      Supported sample sizes (bits): 24 20 16
  Speaker Allocation Data Block:
    FL/FR - Front Left/Right
  Vendor-Specific Data Block (AMD), OUI 00-00-1A:
    Version: 2.11
    Minimum Refresh Rate: 48 Hz
    Maximum Refresh Rate: 144 Hz
    Flags 1.x: 0x00
    Flags 2.x: 0x05
    Maximum luminance: 120 (672.717 cd/m^2)
    Minimum luminance: 19 (0.037 cd/m^2)
    Maximum luminance (without local dimming): 122 (702.501 cd/m^2)
    Minimum luminance (without local dimming): 18 (0.035 cd/m^2)
  Colorimetry Data Block:
    xvYCC601
    xvYCC709
    BT2020YCC
    BT2020RGB
    Gamut Boundary Description Metadata Profile P0
    ST2113RGB
  HDR Static Metadata Data Block:
    Electro optical transfer functions:
      Traditional gamma - SDR luminance range
      Traditional gamma - HDR luminance range
      SMPTE ST2084
    Supported static metadata descriptors:
      Static metadata type 1
    Desired content max luminance: 123 (717.884 cd/m^2)
    Desired content max frame-average luminance: 123 (717.884 cd/m^2)
    Desired content min luminance: 24 (0.064 cd/m^2)
  Detailed Timing Descriptors:
    DTD 5:  3840x2160   60.000000 Hz  16:9    135.000 kHz    594.000000 MHz (596 mm x 335 mm)
                 Hfront  176 Hsync  88 Hback  296 Hpol P
                 Vfront    8 Vsync  10 Vback   72 Vpol N
    DTD 6:  2560x1440   59.950550 Hz  16:9     88.787 kHz    241.500000 MHz (596 mm x 335 mm)
                 Hfront   48 Hsync  32 Hback   80 Hpol P
                 Vfront    3 Vsync   5 Vback   33 Vpol N
    DTD 7:  1920x1080   60.000000 Hz  16:9     67.500 kHz    148.500000 MHz (596 mm x 335 mm)
                 Hfront   88 Hsync  44 Hback  148 Hpol P
                 Vfront    4 Vsync   5 Vback   36 Vpol P
Checksum: 0xcd  Unused space in Extension Block: 16 bytes

----------------

Block 5, DisplayID Extension Block:
  Version: 1.2
  Extension Count: 0
  Video Timing Modes Type 1 - Detailed Timings Data Block:
    DTD:  3840x2160  143.981773 Hz  16:9    319.928 kHz   1279.710000 MHz (aspect 16:9, no 3D stereo, preferred)
               Hfront   48 Hsync  64 Hback   48 Hpol P
               Vfront    3 Vsync   5 Vback   54 Vpol N
    DTD:  1280x720   144.000000 Hz  16:9    108.000 kHz    178.200000 MHz (aspect 16:9, no 3D stereo)
               Hfront  110 Hsync  40 Hback  220 Hpol P
               Vfront    5 Vsync   5 Vback   20 Vpol P
    DTD:  1920x1080  144.000000 Hz  16:9    162.000 kHz    356.400000 MHz (aspect 16:9, no 3D stereo)
               Hfront   88 Hsync  44 Hback  148 Hpol P
               Vfront    4 Vsync   5 Vback   36 Vpol N
    DTD:  2560x1440  143.995098 Hz  16:9    215.993 kHz    587.500000 MHz (aspect 16:9, no 3D stereo)
               Hfront   48 Hsync  56 Hback   56 Hpol P
               Vfront    3 Vsync   8 Vback   49 Vpol N
    DTD:  3840x2160  119.993249 Hz  16:9    266.625 kHz   1066.500000 MHz (aspect 16:9, no 3D stereo)
               Hfront   48 Hsync  64 Hback   48 Hpol P
               Vfront    3 Vsync   5 Vback   54 Vpol N
  Checksum: 0x38
Checksum: 0x90

----------------

Warnings:

Block 1, CTA-861 Extension Block:
  IT Video Formats are overscanned by default, but normally this should be underscanned.
  Colorimetry Data Block: Set the sRGB colorimetry bit to avoid interop issues.
  Detailed Timing Descriptor #2: DTD is similar but not identical to VIC 97.
  Display Product Serial Number is set, so the Serial Number in the Base EDID should be 0.
Block 4, CTA-861 Extension Block:
  IT Video Formats are overscanned by default, but normally this should be underscanned.
  Colorimetry Data Block: Set the sRGB colorimetry bit to avoid interop issues.
  Detailed Timing Descriptor #5: DTD is similar but not identical to VIC 97.
  Display Product Serial Number is set, so the Serial Number in the Base EDID should be 0.
EDID:
  Base EDID: Some timings are out of range of the Monitor Ranges:
    Vertical Freq: 24.000 - 144.000 Hz (Monitor: 48.000 - 144.000 Hz)
    Horizontal Freq: 15.734 - 319.927 kHz (Monitor: 324.000 - 324.000 kHz)

Failures:

Block 1, CTA-861 Extension Block:
  Missing VCDB, needed for Set Selectable RGB Quantization to avoid interop issues.
Block 2, DisplayID Extension Block:
  Expected 0 DisplayID Extension Block, but got 1.
Block 3, Base EDID:
  Unknown Extension Block.
Block 4, CTA-861 Extension Block:
  Video Data Block: Duplicate VIC 118.
  Video Data Block: Duplicate VIC 16.
  Video Data Block: Duplicate VIC 4.
  Video Data Block: Duplicate VIC 41.
  Video Data Block: Duplicate VIC 31.
  Video Data Block: Duplicate VIC 19.
  Video Data Block: Duplicate VIC 1.
  Video Data Block: Duplicate VIC 117.
  Video Data Block: Duplicate VIC 47.
  Video Data Block: Duplicate VIC 93.
  Video Data Block: Duplicate VIC 96.
  Video Data Block: Duplicate VIC 97.
  Video Data Block: Duplicate VIC 5.
  Video Data Block: Duplicate VIC 7.
  Video Data Block: Duplicate VIC 20.
  Video Data Block: Duplicate VIC 63.
  Video Data Block: Duplicate VIC 95.
  Video Data Block: Duplicate VIC 94.
  Video Data Block: Duplicate VIC 64.
  Speaker Allocation Data Block: Only one instance of this Data Block is allowed.
  Colorimetry Data Block: Only one instance of this Data Block is allowed.
  HDR Static Metadata Data Block: Only one instance of this Data Block is allowed.
  Missing VCDB, needed for Set Selectable RGB Quantization to avoid interop issues.
Block 5, DisplayID Extension Block:
  Product Type should be 0 in extension block.
EDID:
  Base EDID: EDID specified 2 extension block(s), but found 5 extension block(s).
  DisplayID: Missing DisplayID Product Identification Data Block.
  DisplayID: Missing DisplayID Display Parameters Data Block.
  DisplayID: Missing DisplayID Display Interface Features Data Block.

EDID conformity: FAIL
