edid-decode (hex):

00 ff ff ff ff ff ff 00 24 89 11 33 27 8d 34 01
34 20 01 03 81 14 0c 78 2a 45 d2 a1 57 4f a1 23
0f 45 54 00 00 00 01 01 01 01 01 01 01 01 01 01
01 01 01 01 01 01 0a 14 00 40 41 58 23 20 28 2d
3a 00 c5 72 00 00 00 1e 00 00 00 ff 00 0a 0a 0a
0a 0a 0a 0a 0a 0a 0a 0a 0a 0a 00 00 00 fd 00 0f
f0 0f 7f 11 00 0a 20 20 20 20 20 20 00 00 00 fc
00 45 6c 67 61 74 6f 20 50 72 6f 6d 2e 0a 00 65

00 ff ff ff ff ff ff 00 24 89 11 33 27 8d 34 01
34 20 01 03 81 14 0c 78 2a 45 d2 a1 57 4f a1 23
0f 45 54 00 00 00 01 01 01 01 01 01 01 01 01 01
01 01 01 01 01 01 0a 14 00 40 41 58 23 20 28 2d
3a 00 c5 72 00 00 00 1e 00 00 00 ff 00 0a 0a 0a
0a 0a 0a 0a 0a 0a 0a 0a 0a 0a 00 00 00 fd 00 0f
f0 0f 7f 11 00 0a 20 20 20 20 20 20 00 00 00 fc
00 45 6c 67 61 74 6f 20 50 72 6f 6d 2e 0a 00 65

----------------

Block 0, Base EDID:
  EDID Structure Version & Revision: 1.3
  Vendor & Product Identification:
    Manufacturer: IDI
    Model: 13073
    Serial Number: ...
    Made in: week 52 of 2022
  Basic Display Parameters & Features:
    Digital display
    DFP 1.x compatible TMDS
    Maximum image size: 20 cm x 12 cm
    Gamma: 2.20
    DPMS levels: Off
    RGB color display
    First detailed timing is the preferred timing
  Color Characteristics:
    Red  : 0.6298, 0.3398
    Green: 0.3095, 0.6298
    Blue : 0.1396, 0.0595
    White: 0.2695, 0.3300
  Established Timings I & II: none
  Standard Timings: none
  Detailed Timing Descriptors:
    DTD 1:  1024x600    60.109674 Hz 128:75    38.170 kHz     51.300000 MHz (197 mm x 114 mm)
                 Hfront   40 Hsync  45 Hback  235 Hpol P
                 Vfront    3 Vsync  10 Vback   22 Vpol P
    Display Product Serial Number: ...
    Display Range Limits:
      Monitor ranges (GTF): 15-240 Hz V, 15-127 kHz H, max dotclock 170 MHz
    Display Product Name: 'Elgato Prom.'
Checksum: 0x65

----------------

Block 1, Unknown EDID Extension Block 0x00:
  00 ff ff ff ff ff ff 00 24 89 11 33 27 8d 34 01 '........$..3'.4.'
  34 20 01 03 81 14 0c 78 2a 45 d2 a1 57 4f a1 23 '4 .....x*E..WO.#'
  0f 45 54 00 00 00 01 01 01 01 01 01 01 01 01 01 '.ET.............'
  01 01 01 01 01 01 0a 14 00 40 41 58 23 20 28 2d '.........@AX# (-'
  3a 00 c5 72 00 00 00 1e 00 00 00 ff 00 0a 0a 0a ':..r............'
  0a 0a 0a 0a 0a 0a 0a 0a 0a 0a 00 00 00 fd 00 0f '................'
  f0 0f 7f 11 00 0a 20 20 20 20 20 20 00 00 00 fc '......      ....'
  00 45 6c 67 61 74 6f 20 50 72 6f 6d 2e 0a 00 65 '.Elgato Prom...e'
Checksum: 0x65

----------------

Failures:

Block 0, Base EDID:
  Display Product Serial Number: ...
  Display Product Serial Number: ...
Block 1, Base EDID:
  Unknown Extension Block.
EDID:
  Base EDID: EDID specified 0 extension block(s), but found 1 extension block(s).

EDID conformity: FAIL
