edid-decode (hex):

00 ff ff ff ff ff ff 00 34 a4 b4 36 01 01 01 01
05 18 01 03 68 34 1d 78 2a a7 25 a4 57 51 a0 26
10 50 54 bf ef 80 b3 00 a9 40 95 00 81 40 81 80
95 0f 71 4f 90 40 02 3a 80 18 71 38 2d 40 58 2c
45 00 09 25 21 00 00 1e 00 00 00 ff 00 56 34 30
35 4c 53 44 30 30 38 34 34 0a 00 00 00 fd 00 37
4c 1d 51 11 00 0a 20 20 20 20 20 20 00 00 00 fc
00 4d 44 32 30 34 33 33 0a 20 20 20 20 20 00 e6

00 ff ff ff ff ff ff 00 34 a4 b4 36 01 01 01 01
05 18 01 03 68 34 1d 78 2a a7 25 a4 57 51 a0 26
10 50 54 bf ef 80 b3 00 a9 40 95 00 81 40 81 80
95 0f 71 4f 90 40 02 3a 80 18 71 38 2d 40 58 2c
45 00 09 25 21 00 00 1e 00 00 00 ff 00 56 34 30
35 4c 53 44 30 30 38 34 34 0a 00 00 00 fd 00 37
4c 1d 51 11 00 0a 20 20 20 20 20 20 00 00 00 fc
00 4d 44 32 30 34 33 33 0a 20 20 20 20 20 00 e6

----------------

Block 0, Base EDID:
  EDID Structure Version & Revision: 1.3
  Vendor & Product Identification:
    Manufacturer: MED
    Model: 14004
    Serial Number: ...
    Made in: week 5 of 2014
  Basic Display Parameters & Features:
    Analog display
    Signal Level Standard: 0.700 : 0.000 : 0.700 V p-p
    Blank level equals black level
    Sync: Separate
    Maximum image size: 52 cm x 29 cm
    Gamma: 2.20
    DPMS levels: Off
    RGB color display
    First detailed timing is the preferred timing
  Color Characteristics:
    Red  : 0.6425, 0.3417
    Green: 0.3173, 0.6279
    Blue : 0.1484, 0.0644
    White: 0.3134, 0.3291
  Established Timings I & II:
    IBM     :   720x400    70.081663 Hz   9:5     31.467 kHz     28.320000 MHz
    DMT 0x04:   640x480    59.940476 Hz   4:3     31.469 kHz     25.175000 MHz
    Apple   :   640x480    66.666667 Hz   4:3     35.000 kHz     30.240000 MHz
    DMT 0x05:   640x480    72.808802 Hz   4:3     37.861 kHz     31.500000 MHz
    DMT 0x06:   640x480    75.000000 Hz   4:3     37.500 kHz     31.500000 MHz
    DMT 0x08:   800x600    56.250000 Hz   4:3     35.156 kHz     36.000000 MHz
    DMT 0x09:   800x600    60.316541 Hz   4:3     37.879 kHz     40.000000 MHz
    DMT 0x0a:   800x600    72.187572 Hz   4:3     48.077 kHz     50.000000 MHz
    DMT 0x0b:   800x600    75.000000 Hz   4:3     46.875 kHz     49.500000 MHz
    Apple   :   832x624    74.551266 Hz   4:3     49.726 kHz     57.284000 MHz
    DMT 0x10:  1024x768    60.003840 Hz   4:3     48.363 kHz     65.000000 MHz
    DMT 0x11:  1024x768    70.069359 Hz   4:3     56.476 kHz     75.000000 MHz
    DMT 0x12:  1024x768    75.028582 Hz   4:3     60.023 kHz     78.750000 MHz
    DMT 0x24:  1280x1024   75.024675 Hz   5:4     79.976 kHz    135.000000 MHz
    Apple   :  1152x870    75.061550 Hz 192:145   68.681 kHz    100.000000 MHz
  Standard Timings:
    DMT 0x3a:  1680x1050   59.954250 Hz  16:10    65.290 kHz    146.250000 MHz
    DMT 0x33:  1600x1200   60.000000 Hz   4:3     75.000 kHz    162.000000 MHz
    DMT 0x2f:  1440x900    59.887445 Hz  16:10    55.935 kHz    106.500000 MHz
    DMT 0x20:  1280x960    60.000000 Hz   4:3     60.000 kHz    108.000000 MHz
    DMT 0x23:  1280x1024   60.019740 Hz   5:4     63.981 kHz    108.000000 MHz
    DMT 0x30:  1440x900    74.984427 Hz  16:10    70.635 kHz    136.750000 MHz
    DMT 0x15:  1152x864    75.000000 Hz   4:3     67.500 kHz    108.000000 MHz
    DMT 0x2a:  1400x1050   59.978442 Hz   4:3     65.317 kHz    121.750000 MHz
  Detailed Timing Descriptors:
    DTD 1:  1920x1080   60.000000 Hz  16:9     67.500 kHz    148.500000 MHz (521 mm x 293 mm)
                 Hfront   88 Hsync  44 Hback  148 Hpol P
                 Vfront    4 Vsync   5 Vback   36 Vpol P
    Display Product Serial Number: ...
    Display Range Limits:
      Monitor ranges (GTF): 55-76 Hz V, 29-81 kHz H, max dotclock 170 MHz
    Display Product Name: 'MD20433'
Checksum: 0xe6

----------------

Block 1, Unknown EDID Extension Block 0x00:
  00 ff ff ff ff ff ff 00 34 a4 b4 36 01 01 01 01 '........4..6....'
  05 18 01 03 68 34 1d 78 2a a7 25 a4 57 51 a0 26 '....h4.x*.%.WQ.&'
  10 50 54 bf ef 80 b3 00 a9 40 95 00 81 40 81 80 '.PT......@...@..'
  95 0f 71 4f 90 40 02 3a 80 18 71 38 2d 40 58 2c '..qO.@.:..q8-@X,'
  45 00 09 25 21 00 00 1e 00 00 00 ff 00 56 34 30 'E..%!........V40'
  35 4c 53 44 30 30 38 34 34 0a 00 00 00 fd 00 37 '5LSD00844......7'
  4c 1d 51 11 00 0a 20 20 20 20 20 20 00 00 00 fc 'L.Q...      ....'
  00 4d 44 32 30 34 33 33 0a 20 20 20 20 20 00 e6 '.MD20433.     ..'
Checksum: 0xe6

----------------

Failures:

Block 1, Base EDID:
  Unknown Extension Block.
EDID:
  Base EDID: EDID specified 0 extension block(s), but found 1 extension block(s).

EDID conformity: FAIL
