edid-decode (hex):

00 ff ff ff ff ff ff 00 4d 10 b4 14 a0 25 22 33
05 1d 01 04 a5 20 15 78 07 de 50 a3 54 4c 99 26
0f 50 54 00 00 00 01 01 01 01 01 01 01 01 01 01
01 01 01 01 01 01 8b 6a c0 a0 90 80 30 60 30 20
3a 00 3d d3 10 00 00 18 00 00 00 fd 00 14 3c 70
70 1c 01 00 00 00 00 00 00 00 00 00 00 10 00 00
00 00 00 00 00 00 00 00 00 00 00 00 00 00 00 fc
00 4c 51 31 35 30 50 31 4a 58 35 31 0a 20 00 61

00 ff ff ff ff ff ff 00 4d 10 b4 14 a0 25 22 33
05 1d 01 04 a5 20 15 78 07 de 50 a3 54 4c 99 26
0f 50 54 00 00 00 01 01 01 01 01 01 01 01 01 01
01 01 01 01 01 01 8b 6a c0 a0 90 80 30 60 30 20
3a 00 3d d3 10 00 00 18 00 00 00 fd 00 14 3c 70
70 1c 01 00 00 00 00 00 00 00 00 00 00 10 00 00
00 00 00 00 00 00 00 00 00 00 00 00 00 00 00 fc
00 4c 51 31 35 30 50 31 4a 58 35 31 0a 20 00 61

----------------

Block 0, Base EDID:
  EDID Structure Version & Revision: 1.4
  Vendor & Product Identification:
    Manufacturer: SHP
    Model: 5300
    Serial Number: ...
    Made in: week 5 of 2019
  Basic Display Parameters & Features:
    Digital display
    Bits per primary color channel: 8
    DisplayPort interface
    Maximum image size: 32 cm x 21 cm
    Gamma: 2.20
    Supported color formats: RGB 4:4:4
    Default (sRGB) color space is primary color space
    First detailed timing includes the native pixel format and preferred refresh rate
    Display is continuous frequency
  Color Characteristics:
    Red  : 0.6396, 0.3291
    Green: 0.2998, 0.5996
    Blue : 0.1494, 0.0595
    White: 0.3125, 0.3281
  Established Timings I & II: none
  Standard Timings: none
  Detailed Timing Descriptors:
    DTD 1:  2496x1664   59.983655 Hz   3:2    102.692 kHz    272.750000 MHz (317 mm x 211 mm)
                 Hfront   48 Hsync  32 Hback   80 Hpol N
                 Vfront    3 Vsync  10 Vback   35 Vpol N
    Display Range Limits:
      Monitor ranges (Bare Limits): 20-60 Hz V, 112-112 kHz H, max dotclock 280 MHz
    Dummy Descriptor:
    Display Product Name: 'LQ150P1JX51'
Checksum: 0x61

----------------

Block 1, Unknown EDID Extension Block 0x00:
  00 ff ff ff ff ff ff 00 4d 10 b4 14 a0 25 22 33 '........M....%"3'
  05 1d 01 04 a5 20 15 78 07 de 50 a3 54 4c 99 26 '..... .x..P.TL.&'
  0f 50 54 00 00 00 01 01 01 01 01 01 01 01 01 01 '.PT.............'
  01 01 01 01 01 01 8b 6a c0 a0 90 80 30 60 30 20 '.......j....0`0 '
  3a 00 3d d3 10 00 00 18 00 00 00 fd 00 14 3c 70 ':.=...........<p'
  70 1c 01 00 00 00 00 00 00 00 00 00 00 10 00 00 'p...............'
  00 00 00 00 00 00 00 00 00 00 00 00 00 00 00 fc '................'
  00 4c 51 31 35 30 50 31 4a 58 35 31 0a 20 00 61 '.LQ150P1JX51. .a'
Checksum: 0x61

----------------

Warnings:

EDID:
  Base EDID: Some timings are out of range of the Monitor Ranges:
    Horizontal Freq: 102.692 - 102.692 kHz (Monitor: 112.000 - 112.000 kHz)

Failures:

Block 0, Base EDID:
  Basic Display Parameters & Features: sRGB is signaled, but the chromaticities do not match.
  Display Range Limits: Byte 11 is 0x00 instead of 0x0a.
  Display Range Limits: Bytes 12-17 must be 0x20.
Block 1, Base EDID:
  Unknown Extension Block.
EDID:
  Base EDID: EDID specified 0 extension block(s), but found 1 extension block(s).

EDID conformity: FAIL
