edid-decode (hex):

00 ff ff ff ff ff ff 00 1e 6d 14 56 9b e5 00 00
08 10 01 03 ee 32 1e 78 ea fe d0 a3 57 4a 9b 25
11 49 4b a5 6a 80 81 80 61 59 45 59 31 59 01 01
01 01 01 01 01 01 1b 21 50 a0 51 00 1e 30 48 88
35 00 a2 0b 32 00 00 1c 00 00 00 fd 00 38 55 1e
48 0b 00 0a 20 20 20 20 20 20 00 00 00 fc 00 4c
32 33 30 30 43 0a 20 20 20 20 20 20 00 00 00 fc
00 0a 20 20 20 20 20 20 20 20 20 20 20 20 00 b4

----------------

Block 0, Base EDID:
  EDID Structure Version & Revision: 1.3
  Vendor & Product Identification:
    Manufacturer: GSM
    Model: 22036
    Serial Number: ...
    Made in: week 8 of 2006
  Basic Display Parameters & Features:
    Digital display
    Maximum image size: 50 cm x 30 cm
    Gamma: 2.20
    DPMS levels: Standby Suspend Off
    RGB color display
    First detailed timing is the preferred timing
  Color Characteristics:
    Red  : 0.6396, 0.3427
    Green: 0.2919, 0.6074
    Blue : 0.1474, 0.0673
    White: 0.2851, 0.2929
  Established Timings I & II:
    IBM     :   720x400    70.082 Hz   9:5    31.467 kHz  28.320 MHz
    DMT 0x04:   640x480    59.940 Hz   4:3    31.469 kHz  25.175 MHz
    DMT 0x06:   640x480    75.000 Hz   4:3    37.500 kHz  31.500 MHz
    DMT 0x09:   800x600    60.317 Hz   4:3    37.879 kHz  40.000 MHz
    DMT 0x0b:   800x600    75.000 Hz   4:3    46.875 kHz  49.500 MHz
    Apple   :   832x624    74.551 Hz   4:3    49.726 kHz  57.284 MHz
    DMT 0x10:  1024x768    60.004 Hz   4:3    48.363 kHz  65.000 MHz
    DMT 0x12:  1024x768    75.029 Hz   4:3    60.023 kHz  78.750 MHz
    Apple   :  1152x870    75.062 Hz 192:145  68.681 kHz 100.000 MHz
  Standard Timings:
    DMT 0x23:  1280x1024   60.020 Hz   5:4    63.981 kHz 108.000 MHz
    DMT 0x13:  1024x768    84.997 Hz   4:3    68.677 kHz  94.500 MHz
    DMT 0x0c:   800x600    85.061 Hz   4:3    53.674 kHz  56.250 MHz
    DMT 0x07:   640x480    85.008 Hz   4:3    43.269 kHz  36.000 MHz
  Detailed Timing Descriptors:
    DTD 1:  1360x768    59.799 Hz  85:48   47.720 kHz  84.750 MHz (930 mm x 523 mm)
                 Hfront   72 Hsync 136 Hback 208 Hpol N
                 Vfront    3 Vsync   5 Vback  22 Vpol P
  Display Range Limits:
    Monitor ranges (GTF): 56-85 Hz V, 30-72 kHz H, max dotclock 110 MHz
    Display Product Name: 'L2300C'
    Display Product Name: ''
Checksum: 0xb4

----------------

Failures:

Block 0, Base EDID:
  Basic Display Parameters & Features: Digital Video Interface Standard set to reserved value 0x6e.
  Detailed Timing Descriptor #1: Mismatch of image size 930x523 mm vs display size 500x300 mm.
  Display Product Name: Empty string.

EDID conformity: FAIL
