
EDID (hex):
00ffffffffffff000472700072e56091
10130104082f1b78eade95a3544c9926
0f5054bfef90a940714f8140d1c09500
b30001010101023a801871382d40582c
4500dd0c1100001f000000fd00384b1f
5411000a202020202020000000ff004c
45533043303032343031310a000000fc
005632323348510a20202020202000b1

Extracted contents:
header:          00 ff ff ff ff ff ff 00
serial number:   04 72 70 00 72 e5 60 91 10 13
version:         01 04
basic params:    08 2f 1b 78 ea
chroma info:     de 95 a3 54 4c 99 26 0f 50 54
established:     bf ef 90
standard:        a9 40 71 4f 81 40 d1 c0 95 00 b3 00 01 01 01 01
descriptor 1:    02 3a 80 18 71 38 2d 40 58 2c 45 00 dd 0c 11 00 00 1f
descriptor 2:    00 00 00 fd 00 38 4b 1f 54 11 00 0a 20 20 20 20 20 20
descriptor 3:    00 00 00 ff 00 4c 45 53 30 43 30 30 32 34 30 31 31 0a
descriptor 4:    00 00 00 fc 00 56 32 32 33 48 51 0a 20 20 20 20 20 20
extensions:      00
checksum:        b1

EDID version: 1.4
Manufacturer: ACR Model 70 Serial Number --
Made in week 16 of 2009
Analog display, Input voltage level: 0.7/0.3 V
Blank level equals black level
Sync: Separate 
Maximum image size: 47 cm x 27 cm
Gamma: 2.20
DPMS levels: Standby Suspend Off
RGB color display
First detailed timing includes the native pixel format and preferred refresh rate
Display x,y Chromaticity:
  Red:   0.6396, 0.3291
  Green: 0.2998, 0.5996
  Blue:  0.1503, 0.0595
  White: 0.3134, 0.3291
Established timings supported:
  720x400@70Hz 9:5 HorFreq: 31469 Hz Clock: 28.320 MHz
  640x480@60Hz 4:3 HorFreq: 31469 Hz Clock: 25.175 MHz
  640x480@67Hz 4:3 HorFreq: 35000 Hz Clock: 30.240 MHz
  640x480@72Hz 4:3 HorFreq: 37900 Hz Clock: 31.500 MHz
  640x480@75Hz 4:3 HorFreq: 37500 Hz Clock: 31.500 MHz
  800x600@56Hz 4:3 HorFreq: 35200 Hz Clock: 36.000 MHz
  800x600@60Hz 4:3 HorFreq: 37900 Hz Clock: 40.000 MHz
  800x600@72Hz 4:3 HorFreq: 48100 Hz Clock: 50.000 MHz
  800x600@75Hz 4:3 HorFreq: 46900 Hz Clock: 49.500 MHz
  832x624@75Hz 4:3 HorFreq: 49726 Hz Clock: 57.284 MHz
  1024x768@60Hz 4:3 HorFreq: 48400 Hz Clock: 65.000 MHz
  1024x768@70Hz 4:3 HorFreq: 56500 Hz Clock: 75.000 MHz
  1024x768@75Hz 4:3 HorFreq: 60000 Hz Clock: 78.750 MHz
  1280x1024@75Hz 5:4 HorFreq: 80000 Hz Clock: 135.000 MHz
  1152x870@75Hz 192:145 HorFreq: 67500 Hz Clock: 108.000 MHz
Standard timings supported:
  1600x1200@60Hz 4:3 HorFreq: 75000 Hz Clock: 162.000 MHz
  1152x864@75Hz 4:3 HorFreq: 67500 Hz Clock: 108.000 MHz
  1280x960@60Hz 4:3 HorFreq: 60000 Hz Clock: 108.000 MHz
  1920x1080@60Hz 16:9
  1440x900@60Hz 16:10 HorFreq: 55500 Hz Clock: 88.750 MHz
  1680x1050@60Hz 16:10 HorFreq: 64700 Hz Clock: 119.000 MHz
Detailed mode: Clock 148.500 MHz, 477 mm x 268 mm
               1920 2008 2052 2200 hborder 0
               1080 1084 1089 1125 vborder 0
               +hsync +vsync 
               VertFreq: 60 Hz, HorFreq: 67500 Hz
Monitor ranges (GTF): 56-75Hz V, 31-84kHz H, max dotclock 170MHz
Serial number: --
Monitor name: V223HQ
Checksum: 0xb1 (valid)


