
EDID (hex):
00ffffffffffff0025cc0d0000000000
0013010380160c780a40859359569327
1b505400000001010101010101010101
010101010101e41600e3415830203020
3600de7d000000180000000000000000
00000000000000000000000000fe0049
4e4c0a202020202020202020000000fc
0042543130314957303356310a20009b

Extracted contents:
header:          00 ff ff ff ff ff ff 00
serial number:   25 cc 0d 00 00 00 00 00 00 13
version:         01 03
basic params:    80 16 0c 78 0a
chroma info:     40 85 93 59 56 93 27 1b 50 54
established:     00 00 00
standard:        01 01 01 01 01 01 01 01 01 01 01 01 01 01 01 01
descriptor 1:    e4 16 00 e3 41 58 30 20 30 20 36 00 de 7d 00 00 00 18
descriptor 2:    00 00 00 00 00 00 00 00 00 00 00 00 00 00 00 00 00 00
descriptor 3:    00 00 00 fe 00 49 4e 4c 0a 20 20 20 20 20 20 20 20 20
descriptor 4:    00 00 00 fc 00 42 54 31 30 31 49 57 30 33 56 31 0a 20
extensions:      00
checksum:        9b

EDID version: 1.3
Manufacturer: INL Model d Serial Number --
Made in year 2009
Digital display
Maximum image size: 22 cm x 12 cm
Gamma: 2.20
RGB color display
First detailed timing is preferred timing
Display x,y Chromaticity:
  Red:   0.5751, 0.3476
  Green: 0.3359, 0.5742
  Blue:  0.1542, 0.1054
  White: 0.3134, 0.3291
Established timings supported:
Standard timings supported:
Detailed mode: Clock 58.600 MHz, 222 mm x 125 mm
               1024 1072 1104 1507 hborder 0
                600  603  609  648 vborder 0
               -hsync -vsync 
               VertFreq: 60 Hz, HorFreq: 38885 Hz
Manufacturer-specified data, tag 0
ASCII string: INL
Monitor name: BT101IW03V1
Checksum: 0x9b (valid)
EDID block does NOT conform to EDID 1.3!
	Missing monitor ranges
