edid-decode (hex):

00 ff ff ff ff ff ff 00 59 3a 26 00 01 01 01 01
21 22 01 03 80 3a 20 78 2a 98 6c a3 55 44 98 26
0e 47 49 21 08 00 01 01 01 01 01 01 01 01 01 01
01 01 01 01 01 01 66 21 50 b0 51 00 1b 30 40 70
36 00 48 80 42 00 00 1e 00 00 00 fd 00 32 55 1f
46 0b 00 0a 20 20 20 20 20 20 00 00 00 ff 00 46
4d 42 41 41 48 33 33 39 36 39 36 39 00 00 00 fc
00 56 57 32 36 4c 20 48 44 54 56 31 30 46 01 4c

02 03 18 71 45 85 01 03 04 07 23 09 07 07 83 01
00 00 65 03 0c 00 20 00 8c 0a d0 8a 20 e0 2d 10
10 3e 96 00 c4 8e 21 00 00 18 01 1d 00 72 51 d0
1e 20 6e 28 55 00 c4 8e 21 00 00 1e 01 1d 80 18
71 1c 16 20 58 2c 25 00 c4 8e 21 00 00 9e 8c 0a
a0 14 51 f0 16 00 26 7c 43 00 c4 8e 21 00 00 98
00 00 00 00 00 00 00 00 00 00 00 00 00 00 00 00
00 00 00 00 00 00 00 00 00 00 00 00 00 00 00 7c

----------------

Block 0, Base EDID:
  EDID Structure Version & Revision: 1.3
  Vendor & Product Identification:
    Manufacturer: VIZ
    Model: 38
    Serial Number: ...
    Made in: week 33 of 2024
  Basic Display Parameters & Features:
    Digital display
    Maximum image size: 58 cm x 32 cm
    Gamma: 2.20
    DPMS levels: Off
    RGB color display
    First detailed timing is the preferred timing
  Color Characteristics:
    Red  : 0.6386, 0.3330
    Green: 0.2675, 0.5937
    Blue : 0.1494, 0.0566
    White: 0.2802, 0.2851
  Established Timings I & II:
    DMT 0x04:   640x480    59.940476 Hz   4:3     31.469 kHz     25.175000 MHz
    DMT 0x09:   800x600    60.316541 Hz   4:3     37.879 kHz     40.000000 MHz
    DMT 0x10:  1024x768    60.003840 Hz   4:3     48.363 kHz     65.000000 MHz
  Standard Timings: none
  Detailed Timing Descriptors:
    DTD 1:  1360x768    60.015162 Hz  85:48    47.712 kHz     85.500000 MHz (1096 mm x 640 mm)
                 Hfront   64 Hsync 112 Hback  256 Hpol P
                 Vfront    3 Vsync   6 Vback   18 Vpol P
    Display Range Limits:
      Monitor ranges (GTF): 50-85 Hz V, 31-70 kHz H, max dotclock 110 MHz
    Display Product Serial Number: ...
    Display Product Name: 'VW26L HDTV10F'
  Extension blocks: 1
Checksum: 0x4c

----------------

Block 1, CTA-861 Extension Block:
  Revision: 3
  Basic audio support
  Supports YCbCr 4:4:4
  Supports YCbCr 4:2:2
  Native detailed modes: 1
  Video Data Block:
    VIC   5:  1920x1080i  60.000000 Hz  16:9     33.750 kHz     74.250000 MHz (native)
    VIC   1:   640x480    59.940476 Hz   4:3     31.469 kHz     25.175000 MHz
    VIC   3:   720x480    59.940060 Hz  16:9     31.469 kHz     27.000000 MHz
    VIC   4:  1280x720    60.000000 Hz  16:9     45.000 kHz     74.250000 MHz
    VIC   7:  1440x480i   59.940060 Hz  16:9     15.734 kHz     27.000000 MHz
  Audio Data Block:
    Linear PCM:
      Max channels: 2
      Supported sample rates (kHz): 48 44.1 32
      Supported sample sizes (bits): 24 20 16
  Speaker Allocation Data Block:
    FL/FR - Front Left/Right
  Vendor-Specific Data Block (HDMI), OUI 00-0C-03:
    Source physical address: 2.0.0.0
  Detailed Timing Descriptors:
    DTD 2:   720x480    59.940060 Hz   3:2     31.469 kHz     27.000000 MHz (708 mm x 398 mm)
                 Hfront   16 Hsync  62 Hback   60 Hpol N
                 Vfront    9 Vsync   6 Vback   30 Vpol N
    DTD 3:  1280x720    60.000000 Hz  16:9     45.000 kHz     74.250000 MHz (708 mm x 398 mm)
                 Hfront  110 Hsync  40 Hback  220 Hpol P
                 Vfront    5 Vsync   5 Vback   20 Vpol P
    DTD 4:  1920x1080i  60.000000 Hz  16:9     33.750 kHz     74.250000 MHz (708 mm x 398 mm)
                 Hfront   88 Hsync  44 Hback  148 Hpol P
                 Vfront    2 Vsync   5 Vback   15 Vpol P Vfront +0.5 Odd Field
                 Vfront    2 Vsync   5 Vback   15 Vpol P Vback  +0.5 Even Field
    DTD 5:  1440x480i   59.940060 Hz   3:1     15.734 kHz     27.000000 MHz (708 mm x 398 mm)
                 Hfront   38 Hsync 124 Hback  114 Hpol N
                 Vfront    4 Vsync   3 Vback   15 Vpol N Vfront +0.5 Odd Field
                 Vfront    4 Vsync   3 Vback   15 Vpol N Vback  +0.5 Even Field
Checksum: 0x7c

----------------

Warnings:

Block 1, CTA-861 Extension Block:
  IT Video Formats are overscanned by default, but normally this should be underscanned.
  Display Product Serial Number is set, so the Serial Number in the Base EDID should be 0.

Failures:

Block 0, Base EDID:
  Vendor & Product Identification: The year 2024 is more than one year in the future.
  Detailed Timing Descriptor #1: Mismatch of image size 1096x640 mm vs display size 580x320 mm.
Block 1, CTA-861 Extension Block:
  Detailed Timing Descriptor #2: Mismatch of image size 708x398 mm vs display size 580x320 mm.
  Detailed Timing Descriptor #3: Mismatch of image size 708x398 mm vs display size 580x320 mm.
  Detailed Timing Descriptor #4: Mismatch of image size 708x398 mm vs display size 580x320 mm.
  Detailed Timing Descriptor #5: Mismatch of image size 708x398 mm vs display size 580x320 mm.
  Missing VCDB, needed for Set Selectable RGB Quantization to avoid interop issues.
EDID:
  Base EDID: Some timings are out of range of the Monitor Ranges:
    Horizontal Freq: 15.734 - 48.363 kHz (Monitor: 31.000 - 70.000 kHz)

EDID conformity: FAIL
