
EDID (hex):
00ffffffffffff005c948d190f000000
2b150103805932780a01c1a057479827
124c4c21080031404540614081800101
010101010101023a801871382d40582c
460040846300001e000000ff00363534
31483134333032363936000000fc004c
442d343036350a2020202020000000fd
00303e0e440f000a20202020202001e6
02032670520102030405060710111213
1415161f202122230907078301000066
030c001000b8011d80d0721c1620102c
258040846300009f011d8018711c1620
582c2500408463000099011d00bc52d0
1e20b828554040846300001e023a80d0
72382d40102c458040846300001e0000
0000000000000000000000000000005d

Extracted contents:
header:          00 ff ff ff ff ff ff 00
serial number:   5c 94 8d 19 0f 00 00 00 2b 15
version:         01 03
basic params:    80 59 32 78 0a
chroma info:     01 c1 a0 57 47 98 27 12 4c 4c
established:     21 08 00
standard:        31 40 45 40 61 40 81 80 01 01 01 01 01 01 01 01
descriptor 1:    02 3a 80 18 71 38 2d 40 58 2c 46 00 40 84 63 00 00 1e
descriptor 2:    00 00 00 ff 00 36 35 34 31 48 31 34 33 30 32 36 39 36
descriptor 3:    00 00 00 fc 00 4c 44 2d 34 30 36 35 0a 20 20 20 20 20
descriptor 4:    00 00 00 fd 00 30 3e 0e 44 0f 00 0a 20 20 20 20 20 20
extensions:      01
checksum:        e6

EDID version: 1.3
Manufacturer: WDT Model 198d Serial Number --
Made in week 43 of 2011
Digital display
Maximum image size: 89 cm x 50 cm
Gamma: 2.20
RGB color display
First detailed timing is preferred timing
Display x,y Chromaticity:
  Red:   0.6250, 0.3398
  Green: 0.2773, 0.5947
  Blue:  0.1552, 0.0703
  White: 0.2968, 0.2978
Established timings supported:
  640x480@60Hz 4:3 HorFreq: 31469 Hz Clock: 25.175 MHz
  800x600@60Hz 4:3 HorFreq: 37900 Hz Clock: 40.000 MHz
  1024x768@60Hz 4:3 HorFreq: 48400 Hz Clock: 65.000 MHz
Standard timings supported:
  640x480@60Hz 4:3 HorFreq: 31469 Hz Clock: 25.175 MHz
  800x600@60Hz 4:3 HorFreq: 37900 Hz Clock: 40.000 MHz
  1024x768@60Hz 4:3 HorFreq: 48400 Hz Clock: 65.000 MHz
  1280x1024@60Hz 5:4 HorFreq: 64000 Hz Clock: 108.000 MHz
Detailed mode: Clock 148.500 MHz, 1600 mm x 900 mm
               1920 2008 2052 2200 hborder 0
               1080 1084 1090 1125 vborder 0
               +hsync +vsync 
               VertFreq: 60 Hz, HorFreq: 67500 Hz
Serial number: --
Monitor name: LD-4065
Monitor ranges (GTF): 48-62Hz V, 14-68kHz H, max dotclock 150MHz
Has 1 extension blocks
Checksum: 0xe6 (valid)

CTA extension block
Extension version: 3
34 bytes of CTA data
  Video data block
    VIC   1 640x480@60Hz 4:3  HorFreq: 31469 Hz Clock: 25.175 MHz
    VIC   2 720x480@60Hz 4:3  HorFreq: 31469 Hz Clock: 27.000 MHz
    VIC   3 720x480@60Hz 16:9  HorFreq: 31469 Hz Clock: 27.000 MHz
    VIC   4 1280x720@60Hz 16:9  HorFreq: 45000 Hz Clock: 74.250 MHz
    VIC   5 1920x1080i@60Hz 16:9  HorFreq: 33750 Hz Clock: 74.250 MHz
    VIC   6 1440x480i@60Hz 4:3  HorFreq: 15734 Hz Clock: 27.000 MHz
    VIC   7 1440x480i@60Hz 16:9  HorFreq: 15734 Hz Clock: 27.000 MHz
    VIC  16 1920x1080@60Hz 16:9  HorFreq: 67500 Hz Clock: 148.500 MHz
    VIC  17 720x576@50Hz 4:3  HorFreq: 31250 Hz Clock: 27.000 MHz
    VIC  18 720x576@50Hz 16:9  HorFreq: 31250 Hz Clock: 27.000 MHz
    VIC  19 1280x720@50Hz 16:9  HorFreq: 37500 Hz Clock: 74.250 MHz
    VIC  20 1920x1080i@50Hz 16:9  HorFreq: 28125 Hz Clock: 74.250 MHz
    VIC  21 1440x576i@50Hz 4:3  HorFreq: 15625 Hz Clock: 27.000 MHz
    VIC  22 1440x576i@50Hz 16:9  HorFreq: 15625 Hz Clock: 27.000 MHz
    VIC  31 1920x1080@50Hz 16:9  HorFreq: 56250 Hz Clock: 148.500 MHz
    VIC  32 1920x1080@24Hz 16:9  HorFreq: 27000 Hz Clock: 74.250 MHz
    VIC  33 1920x1080@25Hz 16:9  HorFreq: 28125 Hz Clock: 74.250 MHz
    VIC  34 1920x1080@30Hz 16:9  HorFreq: 33750 Hz Clock: 74.250 MHz
  Audio data block
    Linear PCM, max channels 2
      Supported sample rates (kHz): 48 44.1 32
      Supported sample sizes (bits): 24 20 16
  Speaker allocation data block
    Speaker map:
      FL/FR - Front Left/Right
  Vendor-specific data block, OUI 000c03 (HDMI)
    Source physical address 1.0.0.0
    Supports_AI
    DC_36bit
    DC_30bit
    DC_Y444
Basic audio support
Supports YCbCr 4:4:4
Supports YCbCr 4:2:2
0 native detailed modes
Detailed mode: Clock 74.250 MHz, 1600 mm x 900 mm
               1920 2448 2492 2640 hborder 0
                540  542  547  562 vborder 0
               +hsync +vsync interlaced 
               VertFreq: 50 Hz, HorFreq: 28125 Hz
Detailed mode: Clock 74.250 MHz, 1600 mm x 900 mm
               1920 2008 2052 2200 hborder 0
                540  542  547  562 vborder 0
               -hsync -vsync interlaced 
               VertFreq: 60 Hz, HorFreq: 33750 Hz
Detailed mode: Clock 74.250 MHz, 1600 mm x 900 mm
               1280 1720 1760 1980 hborder 0
                720  725  730  750 vborder 0
               +hsync +vsync 
               VertFreq: 50 Hz, HorFreq: 37500 Hz
Detailed mode: Clock 148.500 MHz, 1600 mm x 900 mm
               1920 2448 2492 2640 hborder 0
               1080 1084 1089 1125 vborder 0
               +hsync +vsync 
               VertFreq: 50 Hz, HorFreq: 56250 Hz
Checksum: 0x5d (valid)

One or more of the timings is out of range of the Monitor Ranges:
  Vertical Freq: 24 - 60 Hz
  Horizontal Freq: 15625 - 67500 Hz
  Maximum Clock: 148.500 MHz
EDID block does not conform at all!
	Both the serial number and the serial string are set
