edid-decode (hex):

00 ff ff ff ff ff ff 00 06 af 9d 11 00 00 00 00
00 18 01 04 90 26 15 78 02 c8 95 9e 57 54 92 26
0f 50 54 00 00 00 01 01 01 01 01 01 01 01 01 01
01 01 01 01 01 01 84 3a 80 34 71 38 28 40 30 64
31 00 7d d6 10 00 00 1a 88 2c 80 c8 70 38 28 40
30 64 31 00 7d d6 10 00 00 1a 00 00 00 fe 00 4d
4d 37 37 48 80 42 31 37 33 48 54 4e 00 00 00 00
00 00 41 21 96 01 11 00 00 02 01 0a 20 20 00 21

----------------

Block 0, Base EDID:
  EDID Structure Version & Revision: 1.4
  Vendor & Product Identification:
    Manufacturer: AUO
    Model: 4509
    Made in: 2014
  Basic Display Parameters & Features:
    Digital display
    Bits per primary color channel: 6
    Digital interface is not defined
    Maximum image size: 38 cm x 21 cm
    Gamma: 2.20
    Supported color formats: RGB 4:4:4
    First detailed timing includes the native pixel format and preferred refresh rate
  Color Characteristics:
    Red  : 0.6201, 0.3398
    Green: 0.3300, 0.5703
    Blue : 0.1503, 0.0595
    White: 0.3134, 0.3291
  Established Timings I & II: none
  Standard Timings: none
  Detailed Timing Descriptors:
    DTD 1:  1920x1080   60.031418 Hz  16:9     67.235 kHz    149.800000 MHz (381 mm x 214 mm)
                 Hfront   48 Hsync 100 Hback  160 Hpol P
                 Vfront    3 Vsync   1 Vback   36 Vpol N
    DTD 2:  1920x1080   48.012129 Hz  16:9     53.774 kHz    114.000000 MHz (381 mm x 214 mm)
                 Hfront   48 Hsync 100 Hback   52 Hpol P
                 Vfront    3 Vsync   1 Vback   36 Vpol N
    Alphanumeric Data String: 'MM77H'
    Manufacturer-Specified Display Descriptor (0x00): 00 00 00 00 41 21 96 01 11 00 00 02 01 0a 20 20 '....A!........  '
Checksum: 0x21

----------------

Failures:

Block 0, Base EDID:
  Alphanumeric Data String: Non-printable character.
  Missing Display Product Name.

EDID conformity: FAIL
