
EDID (hex):
00ffffffffffff0026cfdd3200000000
001d0104a51b12780ade50a3544c9926
0f505400000001010101010101010101
010101010101384080a0700025501830
3c0010b610000019000000fe004d3133
304e563432205231200a000000030003
26a2042c5c1607079d00000000000003
001951ff64a0f4160830c20101000062

edid-decode (hex):

00 ff ff ff ff ff ff 00 26 cf dd 32 00 00 00 00
00 1d 01 04 a5 1b 12 78 0a de 50 a3 54 4c 99 26
0f 50 54 00 00 00 01 01 01 01 01 01 01 01 01 01
01 01 01 01 01 01 38 40 80 a0 70 00 25 50 18 30
3c 00 10 b6 10 00 00 19 00 00 00 fe 00 4d 31 33
30 4e 56 34 32 20 52 31 20 0a 00 00 00 03 00 03
26 a2 04 2c 5c 16 07 07 9d 00 00 00 00 00 00 03
00 19 51 ff 64 a0 f4 16 08 30 c2 01 01 00 00 62

----------------

Block 0, Base EDID:
  EDID Structure Version & Revision: 1.4
  Vendor & Product Identification:
    Manufacturer: IVO
    Model: 13021
    Made in: 2019
  Basic Display Parameters & Features:
    Digital display
    Bits per primary color channel: 8
    DisplayPort interface
    Maximum image size: 27 cm x 18 cm
    Gamma: 2.20
    Supported color formats: RGB 4:4:4, YCrCb 4:4:4
    First detailed timing includes the native pixel format and preferred refresh rate
  Color Characteristics:
    Red  : 0.6396, 0.3291
    Green: 0.2998, 0.5996
    Blue : 0.1494, 0.0595
    White: 0.3125, 0.3281
  Established Timings I & II: none
  Standard Timings: none
  Detailed Timing Descriptors:
    DTD 1:  1920x1280   60.014018 Hz   3:2     79.038 kHz    164.400000 MHz (272 mm x 182 mm)
                 Hfront   24 Hsync  48 Hback   88 Hpol N
                 Vfront    3 Vsync  12 Vback   22 Vpol N
    Alphanumeric Data String: 'M130NV42 R1 '
    Manufacturer-Specified Display Descriptor (0x03): 00 03 00 03 26 a2 04 2c 5c 16 07 07 9d 00 00 00 '....&..,\.......'
    Manufacturer-Specified Display Descriptor (0x03): 00 03 00 19 51 ff 64 a0 f4 16 08 30 c2 01 01 00 '....Q.d....0....'
Checksum: 0x62
