edid-decode (hex):

00 ff ff ff ff ff ff 00 1e 6d 48 4e 8b 1c 03 00
0b 10 01 03 ea 2b 1b 78 ea d1 05 a6 55 47 9d 25
15 50 54 a7 6b 80 95 0f 95 00 81 80 81 40 71 4f
01 01 01 01 01 01 7c 2e 90 a0 60 1a 1e 40 30 20
36 00 b2 0e 11 00 00 1a 21 39 90 30 62 1a 27 40
68 b0 36 00 b2 0e 11 00 00 14 00 00 00 fd 00 38
4b 1c 53 0f 00 0a 20 20 20 20 20 20 00 00 00 fc
00 4c 32 30 34 57 54 0a 20 20 20 20 20 20 00 36

----------------

Block 0, Base EDID:
  EDID Structure Version & Revision: 1.3
  Vendor & Product Identification:
    Manufacturer: GSM
    Model: 20040
    Serial Number: ...
    Made in: week 11 of 2006
  Basic Display Parameters & Features:
    Digital display
    Maximum image size: 43 cm x 27 cm
    Gamma: 2.20
    DPMS levels: Standby Suspend Off
    RGB color display
    First detailed timing is preferred timing
  Color Characteristics:
    Red  : 0.6513, 0.3330
    Green: 0.2773, 0.6142
    Blue : 0.1445, 0.0820
    White: 0.3134, 0.3291
  Established Timings I & II:
    IBM     :   720x400    70.082 Hz   9:5    31.467 kHz  28.320 MHz
    DMT 0x04:   640x480    59.940 Hz   4:3    31.469 kHz  25.175 MHz
    DMT 0x06:   640x480    75.000 Hz   4:3    37.500 kHz  31.500 MHz
    DMT 0x08:   800x600    56.250 Hz   4:3    35.156 kHz  36.000 MHz
    DMT 0x09:   800x600    60.317 Hz   4:3    37.879 kHz  40.000 MHz
    DMT 0x0b:   800x600    75.000 Hz   4:3    46.875 kHz  49.500 MHz
    Apple   :   832x624    74.551 Hz   4:3    49.726 kHz  57.284 MHz
    DMT 0x10:  1024x768    60.004 Hz   4:3    48.363 kHz  65.000 MHz
    DMT 0x12:  1024x768    75.029 Hz   4:3    60.023 kHz  78.750 MHz
    DMT 0x24:  1280x1024   75.025 Hz   5:4    79.976 kHz 135.000 MHz
    Apple   :  1152x870    75.062 Hz 192:145  68.681 kHz 100.000 MHz
  Standard Timings:
    DMT 0x30:  1440x900    74.984 Hz  16:10   70.635 kHz 136.750 MHz
    DMT 0x2f:  1440x900    59.887 Hz  16:10   55.935 kHz 106.500 MHz
    DMT 0x23:  1280x1024   60.020 Hz   5:4    63.981 kHz 108.000 MHz
    DMT 0x20:  1280x960    60.000 Hz   4:3    60.000 kHz 108.000 MHz
    DMT 0x15:  1152x864    75.000 Hz   4:3    67.500 kHz 108.000 MHz
  Detailed Timing Descriptors:
    DTD 1:  1680x1050   59.883 Hz   8:5    64.674 kHz 119.000 MHz (434 mm x 270 mm)
                 Hfront   48 Hsync  32 Hback  80 Hpol P
                 Vfront    3 Vsync   6 Vback  21 Vpol N
    DTD 2:  1680x1050   59.954 Hz   8:5    65.290 kHz 146.250 MHz (digital composite, serrate, 434 mm x 270 mm)
                 Hfront  104 Hsync 176 Hback 280 Hpol N
                 Vfront    3 Vsync   6 Vback  30
  Display Range Limits:
    Monitor ranges (GTF): 56-75 Hz V, 28-83 kHz H, max dotclock 150 MHz
    Display Product Name: 'L204WT'
Checksum: 0x36

----------------

Failures:

Block 0, Base EDID:
  Basic Display Parameters & Features: Digital Video Interface Standard set to reserved value 0x6a.

EDID conformity: FAIL
