
EDID (hex):
00ffffffffffff0010ac06424c333132
0a1f0104b55d27783a52f5b04f42ab25
0f5054a54b00714f81008180a940b300
d1c0d100e1c0cd4600a0a0381f403020
3a00a1883100001a000000ff00435448
4b5138330a2020202020000000fc0044
454c4c20553430323151570a000000fd
001856198c49010a2020202020200283
020319f14c101f200514041312110302
0123090707830100004dd000a0f0703e
8030203500a1883100001a565e00a0a0
a0295030203500a1883100001a023a80
1871382d40582c4500a1883100001e01
1d007251d01e206e285500a188310000
1e000000000000000000000000000000
000000000000000000000000000000e8
701279030001000c4d24500f00147008
10788999030128e6120186ff139f002f
801f006f083d00020009008b870006ff
139f002f801f006f081e000200090000
00000000000000000000000000000000
00000000000000000000000000000000
00000000000000000000000000000000
00000000000000000000000000003f90

Extracted contents:
header:          00 ff ff ff ff ff ff 00
serial number:   10 ac 06 42 4c 33 31 32 0a 1f
version:         01 04
basic params:    b5 5d 27 78 3a
chroma info:     52 f5 b0 4f 42 ab 25 0f 50 54
established:     a5 4b 00
standard:        71 4f 81 00 81 80 a9 40 b3 00 d1 c0 d1 00 e1 c0
descriptor 1:    cd 46 00 a0 a0 38 1f 40 30 20 3a 00 a1 88 31 00 00 1a
descriptor 2:    00 00 00 ff 00 43 54 48 4b 51 38 33 0a 20 20 20 20 20
descriptor 3:    00 00 00 fc 00 44 45 4c 4c 20 55 34 30 32 31 51 57 0a
descriptor 4:    00 00 00 fd 00 18 56 19 8c 49 01 0a 20 20 20 20 20 20
extensions:      02
checksum:        83

EDID version: 1.4
Manufacturer: DEL Model 4206 Serial Number --
Made in week 10 of 2021
Digital display
10 bits per primary color channel
DisplayPort interface
Maximum image size: 93 cm x 39 cm
Gamma: 2.20
DPMS levels: Off
Supported color formats: RGB 4:4:4, YCrCb 4:4:4, YCrCb 4:2:2
First detailed timing includes the native pixel format and preferred refresh rate
Display x,y Chromaticity:
  Red:   0.6884, 0.3095
  Green: 0.2578, 0.6699
  Blue:  0.1474, 0.0615
  White: 0.3134, 0.3291
Established timings supported:
  720x400@70Hz 9:5 HorFreq: 31469 Hz Clock: 28.320 MHz
  640x480@60Hz 4:3 HorFreq: 31469 Hz Clock: 25.175 MHz
  640x480@75Hz 4:3 HorFreq: 37500 Hz Clock: 31.500 MHz
  800x600@60Hz 4:3 HorFreq: 37900 Hz Clock: 40.000 MHz
  800x600@75Hz 4:3 HorFreq: 46900 Hz Clock: 49.500 MHz
  1024x768@60Hz 4:3 HorFreq: 48400 Hz Clock: 65.000 MHz
  1024x768@75Hz 4:3 HorFreq: 60000 Hz Clock: 78.750 MHz
  1280x1024@75Hz 5:4 HorFreq: 80000 Hz Clock: 135.000 MHz
Standard timings supported:
  1152x864@75Hz 4:3 HorFreq: 67500 Hz Clock: 108.000 MHz
  1280x800@60Hz 16:10
  1280x1024@60Hz 5:4 HorFreq: 64000 Hz Clock: 108.000 MHz
  1600x1200@60Hz 4:3 HorFreq: 75000 Hz Clock: 162.000 MHz
  1680x1050@60Hz 16:10 HorFreq: 64700 Hz Clock: 119.000 MHz
  1920x1080@60Hz 16:9
  1920x1200@60Hz 16:10 HorFreq: 74000 Hz Clock: 154.000 MHz
  2048x1152@60Hz 16:9
Detailed mode: Clock 181.250 MHz, 929 mm x 392 mm
               2560 2608 2640 2720 hborder 0
               1080 1083 1093 1111 vborder 0
               +hsync -vsync 
               VertFreq: 59 Hz, HorFreq: 66636 Hz
Serial number: --
Monitor name: DELL U4021QW
Monitor ranges (bare limits): 24-86Hz V, 25-140kHz H, max dotclock 730MHz
Has 2 extension blocks
Checksum: 0x83 (valid)

CTA extension block
Extension version: 3
21 bytes of CTA data
  Video data block
    VIC  16 1920x1080@60Hz 16:9  HorFreq: 67500 Hz Clock: 148.500 MHz
    VIC  31 1920x1080@50Hz 16:9  HorFreq: 56250 Hz Clock: 148.500 MHz
    VIC  32 1920x1080@24Hz 16:9  HorFreq: 27000 Hz Clock: 74.250 MHz
    VIC   5 1920x1080i@60Hz 16:9  HorFreq: 33750 Hz Clock: 74.250 MHz
    VIC  20 1920x1080i@50Hz 16:9  HorFreq: 28125 Hz Clock: 74.250 MHz
    VIC   4 1280x720@60Hz 16:9  HorFreq: 45000 Hz Clock: 74.250 MHz
    VIC  19 1280x720@50Hz 16:9  HorFreq: 37500 Hz Clock: 74.250 MHz
    VIC  18 720x576@50Hz 16:9  HorFreq: 31250 Hz Clock: 27.000 MHz
    VIC  17 720x576@50Hz 4:3  HorFreq: 31250 Hz Clock: 27.000 MHz
    VIC   3 720x480@60Hz 16:9  HorFreq: 31469 Hz Clock: 27.000 MHz
    VIC   2 720x480@60Hz 4:3  HorFreq: 31469 Hz Clock: 27.000 MHz
    VIC   1 640x480@60Hz 4:3  HorFreq: 31469 Hz Clock: 25.175 MHz
  Audio data block
    Linear PCM, max channels 2
      Supported sample rates (kHz): 48 44.1 32
      Supported sample sizes (bits): 24 20 16
  Speaker allocation data block
    Speaker map:
      FL/FR - Front Left/Right
Underscans PC formats by default
Basic audio support
Supports YCbCr 4:4:4
Supports YCbCr 4:2:2
1 native detailed modes
Detailed mode: Clock 533.250 MHz, 929 mm x 392 mm
               3840 3888 3920 4000 hborder 0
               2160 2163 2168 2222 vborder 0
               +hsync -vsync 
               VertFreq: 59 Hz, HorFreq: 133312 Hz
Detailed mode: Clock 241.500 MHz, 929 mm x 392 mm
               2560 2608 2640 2720 hborder 0
               1440 1443 1448 1481 vborder 0
               +hsync -vsync 
               VertFreq: 59 Hz, HorFreq: 88786 Hz
Detailed mode: Clock 148.500 MHz, 929 mm x 392 mm
               1920 2008 2052 2200 hborder 0
               1080 1084 1089 1125 vborder 0
               +hsync +vsync 
               VertFreq: 60 Hz, HorFreq: 67500 Hz
Detailed mode: Clock 74.250 MHz, 929 mm x 392 mm
               1280 1390 1430 1650 hborder 0
                720  725  730  750 vborder 0
               +hsync +vsync 
               VertFreq: 60 Hz, HorFreq: 45000 Hz
Checksum: 0xe8 (valid)


DisplayID extension block
Extension version: 18
Length 121, version 18, extension count 0
Checksum: 0x3f (valid)
Display Parameters block
Type 1 detailed timing: aspect: 64:27, Preferred  
Detailed mode: Clock 703.740 MHz, 0 mm x 0 mm
               5119 5166 5197 5278
               2159 2161 2170 2220
               +hsync -vsync
Type 1 detailed timing: aspect: 64:27,  
Detailed mode: Clock 346.990 MHz, 0 mm x 0 mm
               5119 5166 5197 5278
               2159 2161 2170 2189
               +hsync -vsync

EDID block does not conform at all!
	Both the serial number and the serial string are set
