edid-decode (hex):

00 ff ff ff ff ff ff 00 04 72 06 04 ff ff ff ff
ff 17 01 04 a5 3c 22 78 06 ee 91 a3 54 4c 99 26
0f 50 54 00 00 00 01 01 01 01 01 01 01 01 01 01
01 01 01 01 01 01 02 3a 80 18 71 38 2d 40 58 2c
45 00 56 50 21 00 00 1e 00 00 00 ff 00 23 41 53
4e 51 52 75 52 6f 78 4d 50 64 00 00 00 fd 00 1e
96 1e a0 21 01 0a 20 20 20 20 20 20 00 00 00 fc
00 41 63 65 72 20 58 42 32 37 30 48 20 41 01 ed

02 03 0a 01 65 4b 04 00 01 01 8a 4d 80 a0 70 38
2c 40 30 20 35 00 56 50 21 00 00 1a fe 5b 80 a0
70 38 35 40 30 20 35 00 56 50 21 00 00 1a 86 6f
80 a0 70 38 40 40 30 20 35 00 56 50 21 00 00 1a
fc 7e 80 88 70 38 12 40 18 20 35 00 56 50 21 00
00 1e 00 00 00 00 00 00 00 00 00 00 00 00 00 00
00 00 00 00 00 00 00 00 00 00 00 00 00 00 00 00
00 00 00 00 00 00 00 00 00 00 00 00 00 00 00 5c

----------------

Block 0, Base EDID:
  EDID Structure Version & Revision: 1.4
  Vendor & Product Identification:
    Manufacturer: ACR
    Model: 1030
    Serial Number: ...
    Model year: 2013
  Basic Display Parameters & Features:
    Digital display
    Bits per primary color channel: 8
    DisplayPort interface
    Maximum image size: 60 cm x 34 cm
    Gamma: 2.20
    Supported color formats: RGB 4:4:4
    Default (sRGB) color space is primary color space
    First detailed timing includes the native pixel format and preferred refresh rate
  Color Characteristics:
    Red  : 0.6396, 0.3300
    Green: 0.2998, 0.5996
    Blue : 0.1503, 0.0595
    White: 0.3125, 0.3291
  Established Timings I & II: none
  Standard Timings: none
  Detailed Timing Descriptors:
    DTD 1:  1920x1080   60.000000 Hz  16:9     67.500 kHz    148.500000 MHz (598 mm x 336 mm)
                 Hfront   88 Hsync  44 Hback  148 Hpol P
                 Vfront    4 Vsync   5 Vback   36 Vpol P
    Display Product Serial Number: ...
    Display Range Limits:
      Monitor ranges (Bare Limits): 30-150 Hz V, 30-160 kHz H, max dotclock 330 MHz
    Display Product Name: 'Acer XB270H A'
  Extension blocks: 1
Checksum: 0xed

----------------

Block 1, CTA-861 Extension Block:
  Revision: 3
  Native detailed modes: 1
  Vendor-Specific Data Block (NVIDIA), OUI 00-04-4B:
    01 01                                           '..'
  Detailed Timing Descriptors:
    DTD 2:  1920x1080   84.904531 Hz  16:9     95.433 kHz    198.500000 MHz (598 mm x 336 mm)
                 Hfront   48 Hsync  32 Hback   80 Hpol P
                 Vfront    3 Vsync   5 Vback   36 Vpol N
    DTD 3:  1920x1080   99.930409 Hz  16:9    113.221 kHz    235.500000 MHz (598 mm x 336 mm)
                 Hfront   48 Hsync  32 Hback   80 Hpol P
                 Vfront    3 Vsync   5 Vback   45 Vpol N
    DTD 4:  1920x1080  119.982181 Hz  16:9    137.260 kHz    285.500000 MHz (598 mm x 336 mm)
                 Hfront   48 Hsync  32 Hback   80 Hpol P
                 Vfront    3 Vsync   5 Vback   56 Vpol N
    DTD 5:  1920x1080  144.000765 Hz  16:9    158.113 kHz    325.080000 MHz (598 mm x 336 mm)
                 Hfront   24 Hsync  32 Hback   80 Hpol P
                 Vfront    3 Vsync   5 Vback   10 Vpol P
Checksum: 0x5c

----------------

Warnings:

Block 1, CTA-861 Extension Block:
  IT Video Formats are overscanned by default, but normally this should be underscanned.
  Display Product Serial Number is set, so the Serial Number in the Base EDID should be 0.

Failures:

Block 1, CTA-861 Extension Block:
  Required 640x480p60 timings are missing in the established timings and the SVD list (VIC 1).
  Missing VCDB, needed for Set Selectable RGB Quantization to avoid interop issues.

EDID conformity: FAIL
