
EDID (hex):
00ffffffffffff001e6d5c776eaf0200
071f0104b54627789f4395aa544e9e26
0f5054254b00d1c06140317c457c617c
d1fc454001015e9780a0703832403028
3500ba892100001a023a801871382d40
582c4500ba892100001e000000fd0030
a5c8c82a010a202020202020000000fc
004c4720554c545241474541520a0122
0203287123090707e305c000e6060501
52522e46100403011f136d1a00000205
30a50004522e522e8048801871382d40
582c4500ba892100001e866f80a07038
404030203500ba892100001e5a8780a0
70384d4030203500ba892100001a011d
007251d01e206e285500ba892100001e
1e00000000000000000000000000000d

Extracted contents:
header:          00 ff ff ff ff ff ff 00
serial number:   1e 6d 5c 77 6e af 02 00 07 1f
version:         01 04
basic params:    b5 46 27 78 9f
chroma info:     43 95 aa 54 4e 9e 26 0f 50 54
established:     25 4b 00
standard:        d1 c0 61 40 31 7c 45 7c 61 7c d1 fc 45 40 01 01
descriptor 1:    5e 97 80 a0 70 38 32 40 30 28 35 00 ba 89 21 00 00 1a
descriptor 2:    02 3a 80 18 71 38 2d 40 58 2c 45 00 ba 89 21 00 00 1e
descriptor 3:    00 00 00 fd 00 30 a5 c8 c8 2a 01 0a 20 20 20 20 20 20
descriptor 4:    00 00 00 fc 00 4c 47 20 55 4c 54 52 41 47 45 41 52 0a
extensions:      01
checksum:        22

EDID version: 1.4
Manufacturer: GSM Model 775c Serial Number --
Made in week 7 of 2021
Digital display
10 bits per primary color channel
DisplayPort interface
Maximum image size: 70 cm x 39 cm
Gamma: 2.20
DPMS levels: Standby
Supported color formats: RGB 4:4:4, YCrCb 4:4:4, YCrCb 4:2:2
Default (sRGB) color space is primary color space
First detailed timing includes the native pixel format and preferred refresh rate
Display is continuous frequency
Display x,y Chromaticity:
  Red:   0.6650, 0.3281
  Green: 0.3046, 0.6201
  Blue:  0.1503, 0.0595
  White: 0.3134, 0.3291
Established timings supported:
  640x480@60Hz 4:3 HorFreq: 31469 Hz Clock: 25.175 MHz
  640x480@75Hz 4:3 HorFreq: 37500 Hz Clock: 31.500 MHz
  800x600@60Hz 4:3 HorFreq: 37900 Hz Clock: 40.000 MHz
  800x600@75Hz 4:3 HorFreq: 46900 Hz Clock: 49.500 MHz
  1024x768@60Hz 4:3 HorFreq: 48400 Hz Clock: 65.000 MHz
  1024x768@75Hz 4:3 HorFreq: 60000 Hz Clock: 78.750 MHz
  1280x1024@75Hz 5:4 HorFreq: 80000 Hz Clock: 135.000 MHz
Standard timings supported:
  1920x1080@60Hz 16:9
  1024x768@60Hz 4:3 HorFreq: 48400 Hz Clock: 65.000 MHz
  640x480@120Hz 4:3
  800x600@120Hz 4:3
  1024x768@120Hz 4:3
  1920x1080@120Hz 16:9
  800x600@60Hz 4:3 HorFreq: 37900 Hz Clock: 40.000 MHz
Detailed mode: Clock 387.500 MHz, 698 mm x 393 mm
               1920 1968 2008 2080 hborder 0
               1080 1083 1088 1130 vborder 0
               +hsync -vsync 
               VertFreq: 164 Hz, HorFreq: 186298 Hz
Detailed mode: Clock 148.500 MHz, 698 mm x 393 mm
               1920 2008 2052 2200 hborder 0
               1080 1084 1089 1125 vborder 0
               +hsync +vsync 
               VertFreq: 60 Hz, HorFreq: 67500 Hz
Monitor ranges (bare limits): 48-165Hz V, 200-200kHz H, max dotclock 420MHz
Monitor name: LG ULTRAGEAR
Has 1 extension blocks
Checksum: 0x22 (valid)

CTA extension block
Extension version: 3
36 bytes of CTA data
  Audio data block
    Linear PCM, max channels 2
      Supported sample rates (kHz): 48 44.1 32
      Supported sample sizes (bits): 24 20 16
  Extended tag: Colorimetry data block
    BT2020YCC
    BT2020RGB
  Extended tag: HDR static metadata data block
    Electro optical transfer functions:
      Traditional gamma - SDR luminance range
      SMPTE ST2084
    Supported static metadata descriptors:
      Static metadata type 1
    Desired content max luminance: 82 (295.365 cd/m^2)
    Desired content max frame-average luminance: 82 (295.365 cd/m^2)
    Desired content min luminance: 46 (0.096 cd/m^2)
  Video data block
    VIC  16 1920x1080@60Hz 16:9  HorFreq: 67500 Hz Clock: 148.500 MHz
    VIC   4 1280x720@60Hz 16:9  HorFreq: 45000 Hz Clock: 74.250 MHz
    VIC   3 720x480@60Hz 16:9  HorFreq: 31469 Hz Clock: 27.000 MHz
    VIC   1 640x480@60Hz 4:3  HorFreq: 31469 Hz Clock: 25.175 MHz
    VIC  31 1920x1080@50Hz 16:9  HorFreq: 56250 Hz Clock: 148.500 MHz
    VIC  19 1280x720@50Hz 16:9  HorFreq: 37500 Hz Clock: 74.250 MHz
  Vendor-specific data block, OUI 00001a
Basic audio support
Supports YCbCr 4:4:4
Supports YCbCr 4:2:2
1 native detailed modes
Detailed mode: Clock 185.600 MHz, 698 mm x 393 mm
               1920 2008 2052 2200 hborder 0
               1080 1084 1089 1125 vborder 0
               +hsync +vsync 
               VertFreq: 74 Hz, HorFreq: 84363 Hz
Detailed mode: Clock 285.500 MHz, 698 mm x 393 mm
               1920 1968 2000 2080 hborder 0
               1080 1083 1088 1144 vborder 0
               +hsync +vsync 
               VertFreq: 119 Hz, HorFreq: 137259 Hz
Detailed mode: Clock 346.500 MHz, 698 mm x 393 mm
               1920 1968 2000 2080 hborder 0
               1080 1083 1088 1157 vborder 0
               +hsync -vsync 
               VertFreq: 143 Hz, HorFreq: 166586 Hz
Detailed mode: Clock 74.250 MHz, 698 mm x 393 mm
               1280 1390 1430 1650 hborder 0
                720  725  730  750 vborder 0
               +hsync +vsync 
               VertFreq: 60 Hz, HorFreq: 45000 Hz
Checksum: 0xd (valid)

EDID block does NOT conform to EDID 1.4!
	sRGB is signaled, but the chromaticities do not match
Warning: One or more of the timings is out of range of the Monitor Ranges:
  Vertical Freq: 50 - 164 Hz
  Horizontal Freq: 31469 - 186298 Hz
  Maximum Clock: 387.500 MHz
