edid-decode (hex):

00 ff ff ff ff ff ff 00 06 b3 b8 32 01 01 01 01
09 22 01 04 b5 46 27 78 3b 2f 45 a9 53 4c 9e 27
13 50 54 bf ef 00 71 4f 81 80 95 00 d1 c0 d1 e8
d1 fc 01 01 01 01 56 5e 00 a0 a0 a0 29 50 30 20
35 00 b9 88 21 00 00 1a 00 00 00 fd 00 30 aa fa
fa 42 01 0a 20 20 20 20 20 20 00 00 00 fc 00 56
47 33 32 41 51 41 31 41 0a 20 20 20 00 00 00 ff
00 53 32 4c 4d 51 53 30 38 39 31 34 30 0a 02 6d

02 03 2e f1 45 90 04 0f 0e 3f 23 09 07 07 83 01
00 00 e2 00 6a e3 05 e0 01 e6 06 07 01 53 53 00
6d 1a 00 00 02 01 30 aa 00 00 00 00 00 00 99 fc
00 6a a0 a0 1e 50 08 20 35 00 b9 88 21 00 00 1c
6f c2 00 a0 a0 a0 55 50 30 20 35 00 b9 88 21 00
00 1a 5a a0 00 a0 a0 a0 46 50 30 20 35 00 b9 88
21 00 00 1a ea e7 00 70 a0 a0 67 50 08 20 98 04
b9 88 21 00 00 1a 00 00 00 00 00 00 00 00 00 ae

70 12 79 03 00 01 00 0c 3a 1b 50 0f 00 0a a0 05
10 78 ff 99 03 01 3c fc ff 00 88 ff 09 4f 00 09
80 3b 00 9f 05 13 00 02 00 04 00 15 f9 00 08 ff
09 69 00 14 80 1f 00 9f 05 66 00 02 00 04 00 27
f8 00 08 ff 09 4f 00 07 80 1f 00 9f 05 3f 00 02
80 09 00 00 00 00 00 00 00 00 00 00 00 00 00 00
00 00 00 00 00 00 00 00 00 00 00 00 00 00 00 00
00 00 00 00 00 00 00 00 00 00 00 00 00 00 6b 90

00 ff ff ff ff ff ff 00 06 b3 b8 32 01 01 01 01
09 22 01 04 b5 46 27 78 3b 2f 45 a9 53 4c 9e 27
13 50 54 bf ef 00 71 4f 81 80 95 00 d1 c0 d1 e8
d1 fc 01 01 01 01 56 5e 00 a0 a0 a0 29 50 30 20
35 00 b9 88 21 00 00 1a 00 00 00 fd 00 30 aa fa
fa 42 01 0a 20 20 20 20 20 20 00 00 00 fc 00 56
47 33 32 41 51 41 31 41 0a 20 20 20 00 00 00 ff
00 53 32 4c 4d 51 53 30 38 39 31 34 30 0a 02 6d

02 03 2e f1 45 90 04 0f 0e 3f 23 09 07 07 83 01
00 00 e2 00 6a e3 05 e0 01 e6 06 07 01 53 53 00
6d 1a 00 00 02 01 30 aa 00 00 00 00 00 00 99 fc
00 6a a0 a0 1e 50 08 20 35 00 b9 88 21 00 00 1c
6f c2 00 a0 a0 a0 55 50 30 20 35 00 b9 88 21 00
00 1a 5a a0 00 a0 a0 a0 46 50 30 20 35 00 b9 88
21 00 00 1a ea e7 00 70 a0 a0 67 50 08 20 98 04
b9 88 21 00 00 1a 00 00 00 00 00 00 00 00 00 ae

70 12 79 03 00 01 00 0c 3a 1b 50 0f 00 0a a0 05
10 78 ff 99 03 01 3c fc ff 00 88 ff 09 4f 00 09
80 3b 00 9f 05 13 00 02 00 04 00 15 f9 00 08 ff
09 69 00 14 80 1f 00 9f 05 66 00 02 00 04 00 27
f8 00 08 ff 09 4f 00 07 80 1f 00 9f 05 3f 00 02
80 09 00 00 00 00 00 00 00 00 00 00 00 00 00 00
00 00 00 00 00 00 00 00 00 00 00 00 00 00 00 00
00 00 00 00 00 00 00 00 00 00 00 00 00 00 6b 90

----------------

Block 0, Base EDID:
  EDID Structure Version & Revision: 1.4
  Vendor & Product Identification:
    Manufacturer: AUS
    Model: 12984
    Serial Number: ...
    Made in: week 9 of 2024
  Basic Display Parameters & Features:
    Digital display
    Bits per primary color channel: 10
    DisplayPort interface
    Maximum image size: 70 cm x 39 cm
    Gamma: 2.20
    DPMS levels: Off
    Supported color formats: RGB 4:4:4, YCrCb 4:4:4, YCrCb 4:2:2
    First detailed timing includes the native pixel format and preferred refresh rate
    Display is continuous frequency
  Color Characteristics:
    Red  : 0.6601, 0.3261
    Green: 0.2998, 0.6201
    Blue : 0.1533, 0.0742
    White: 0.3134, 0.3291
  Established Timings I & II:
    IBM     :   720x400    70.081663 Hz   9:5     31.467 kHz     28.320000 MHz
    DMT 0x04:   640x480    59.940476 Hz   4:3     31.469 kHz     25.175000 MHz
    Apple   :   640x480    66.666667 Hz   4:3     35.000 kHz     30.240000 MHz
    DMT 0x05:   640x480    72.808802 Hz   4:3     37.861 kHz     31.500000 MHz
    DMT 0x06:   640x480    75.000000 Hz   4:3     37.500 kHz     31.500000 MHz
    DMT 0x08:   800x600    56.250000 Hz   4:3     35.156 kHz     36.000000 MHz
    DMT 0x09:   800x600    60.316541 Hz   4:3     37.879 kHz     40.000000 MHz
    DMT 0x0a:   800x600    72.187572 Hz   4:3     48.077 kHz     50.000000 MHz
    DMT 0x0b:   800x600    75.000000 Hz   4:3     46.875 kHz     49.500000 MHz
    Apple   :   832x624    74.551266 Hz   4:3     49.726 kHz     57.284000 MHz
    DMT 0x10:  1024x768    60.003840 Hz   4:3     48.363 kHz     65.000000 MHz
    DMT 0x11:  1024x768    70.069359 Hz   4:3     56.476 kHz     75.000000 MHz
    DMT 0x12:  1024x768    75.028582 Hz   4:3     60.023 kHz     78.750000 MHz
    DMT 0x24:  1280x1024   75.024675 Hz   5:4     79.976 kHz    135.000000 MHz
  Standard Timings:
    DMT 0x15:  1152x864    75.000000 Hz   4:3     67.500 kHz    108.000000 MHz
    DMT 0x23:  1280x1024   60.019740 Hz   5:4     63.981 kHz    108.000000 MHz
    DMT 0x2f:  1440x900    59.887445 Hz  16:10    55.935 kHz    106.500000 MHz
    DMT 0x52:  1920x1080   60.000000 Hz  16:9     67.500 kHz    148.500000 MHz
    GTF     :  1920x1080  100.000000 Hz  16:9    114.400 kHz    302.016000 MHz
    GTF     :  1920x1080  119.999987 Hz  16:9    138.840 kHz    368.759000 MHz
  Detailed Timing Descriptors:
    DTD 1:  2560x1440   59.950550 Hz  16:9     88.787 kHz    241.500000 MHz (697 mm x 392 mm)
                 Hfront   48 Hsync  32 Hback   80 Hpol P
                 Vfront    3 Vsync   5 Vback   33 Vpol N
    Display Range Limits:
      Monitor ranges (Bare Limits): 48-170 Hz V, 250-250 kHz H, max dotclock 660 MHz
    Display Product Name: 'VG32AQA1A'
    Display Product Serial Number: ...
  Extension blocks: 2
Checksum: 0x6d

----------------

Block 1, CTA-861 Extension Block:
  Revision: 3
  Underscans IT Video Formats by default
  Basic audio support
  Supports YCbCr 4:4:4
  Supports YCbCr 4:2:2
  Native detailed modes: 1
  Video Data Block:
    VIC  16:  1920x1080   60.000000 Hz  16:9     67.500 kHz    148.500000 MHz (native)
    VIC   4:  1280x720    60.000000 Hz  16:9     45.000 kHz     74.250000 MHz
    VIC  15:  1440x480    59.940060 Hz  16:9     31.469 kHz     54.000000 MHz
    VIC  14:  1440x480    59.940060 Hz   4:3     31.469 kHz     54.000000 MHz
    VIC  63:  1920x1080  120.000000 Hz  16:9    135.000 kHz    297.000000 MHz
  Audio Data Block:
    Linear PCM:
      Max channels: 2
      Supported sample rates (kHz): 48 44.1 32
      Supported sample sizes (bits): 24 20 16
  Speaker Allocation Data Block:
    FL/FR - Front Left/Right
  Video Capability Data Block:
    YCbCr quantization: No Data
    RGB quantization: Selectable (via AVI Q)
    PT scan behavior: Always Underscanned
    IT scan behavior: Always Underscanned
    CE scan behavior: Always Underscanned
  Colorimetry Data Block:
    BT2020cYCC
    BT2020YCC
    BT2020RGB
    Gamut Boundary Description Metadata Profile P0
  HDR Static Metadata Data Block:
    Electro optical transfer functions:
      Traditional gamma - SDR luminance range
      Traditional gamma - HDR luminance range
      SMPTE ST2084
    Supported static metadata descriptors:
      Static metadata type 1
    Desired content max luminance: 83 (301.833 cd/m^2)
    Desired content max frame-average luminance: 83 (301.833 cd/m^2)
    Desired content min luminance: 0 (0.000 cd/m^2)
  Vendor-Specific Data Block (AMD), OUI 00-00-1A:
    Version: 2.1
    Minimum Refresh Rate: 48 Hz
    Maximum Refresh Rate: 170 Hz
    Flags 1.x: 0x00
    Flags 2.x: 0x00
    Maximum luminance: 0 (50.000 cd/m^2)
    Minimum luminance: 0 (0.000 cd/m^2)
    Unknown: 0x00 0x00
  Detailed Timing Descriptors:
    DTD 2:  2560x1440  165.002985 Hz  16:9    242.554 kHz    646.650000 MHz (697 mm x 392 mm)
                 Hfront    8 Hsync  32 Hback   66 Hpol N
                 Vfront    3 Vsync   5 Vback   22 Vpol P
    DTD 3:  2560x1440  119.997589 Hz  16:9    182.996 kHz    497.750000 MHz (697 mm x 392 mm)
                 Hfront   48 Hsync  32 Hback   80 Hpol P
                 Vfront    3 Vsync   5 Vback   77 Vpol N
    DTD 4:  2560x1440   99.946436 Hz  16:9    150.919 kHz    410.500000 MHz (697 mm x 392 mm)
                 Hfront   48 Hsync  32 Hback   80 Hpol P
                 Vfront    3 Vsync   5 Vback   62 Vpol N
    DTD 5:  2560x1440  144.000722 Hz  16:9    222.193 kHz    593.700000 MHz (697 mm x 392 mm)
                 Hfront    8 Hsync  32 Hback   72 Hpol P
                 Vfront   25 Vsync   8 Vback   70 Vpol N
Checksum: 0xae  Unused space in Extension Block: 9 bytes

----------------

Block 2, DisplayID Extension Block:
  Version: 1.2
  Extension Count: 0
  Display Product Type: Standalone display device
  Display Parameters Data Block (0x01):
    Image size: 697.0 mm x 392.0 mm
    Display native pixel format: 2560x1440
    Feature support flags:
      Power management (DPM)
    Gamma: 2.20
    Aspect ratio: 3.55
    Dynamic bpc native: 10
    Dynamic bpc overall: 10
  Video Timing Modes Type 1 - Detailed Timings Data Block:
    DTD:  2560x1440  170.021274 Hz   0:0    248.231 kHz    655.330000 MHz (aspect undefined, no 3D stereo, preferred)
               Hfront   10 Hsync  60 Hback   10 Hpol P
               Vfront    3 Vsync   5 Vback   12 Vpol N
    DTD:  2560x1440  155.011209 Hz   0:0    239.182 kHz    637.660000 MHz (aspect undefined, no 3D stereo)
               Hfront   21 Hsync  32 Hback   53 Hpol P
               Vfront    3 Vsync   5 Vback   95 Vpol N
    DTD:  2560x1440  159.997582 Hz   0:0    240.636 kHz    635.280000 MHz (aspect undefined, no 3D stereo)
               Hfront    8 Hsync  32 Hback   40 Hpol P
               Vfront    3 Vsync  10 Vback   51 Vpol P
  Checksum: 0x6b
Checksum: 0x90

----------------

Block 3, Unknown EDID Extension Block 0x00:
  00 ff ff ff ff ff ff 00 06 b3 b8 32 01 01 01 01 '...........2....'
  09 22 01 04 b5 46 27 78 3b 2f 45 a9 53 4c 9e 27 '."...F'x;/E.SL.''
  13 50 54 bf ef 00 71 4f 81 80 95 00 d1 c0 d1 e8 '.PT...qO........'
  d1 fc 01 01 01 01 56 5e 00 a0 a0 a0 29 50 30 20 '......V^....)P0 '
  35 00 b9 88 21 00 00 1a 00 00 00 fd 00 30 aa fa '5...!........0..'
  fa 42 01 0a 20 20 20 20 20 20 00 00 00 fc 00 56 '.B..      .....V'
  47 33 32 41 51 41 31 41 0a 20 20 20 00 00 00 ff 'G32AQA1A.   ....'
  00 53 32 4c 4d 51 53 30 38 39 31 34 30 0a 02 6d '.S2LMQS089140..m'
Checksum: 0x6d

----------------

Block 4, CTA-861 Extension Block:
  Revision: 3
  Underscans IT Video Formats by default
  Basic audio support
  Supports YCbCr 4:4:4
  Supports YCbCr 4:2:2
  Native detailed modes: 1
  Video Data Block:
    VIC  16:  1920x1080   60.000000 Hz  16:9     67.500 kHz    148.500000 MHz (native)
    VIC   4:  1280x720    60.000000 Hz  16:9     45.000 kHz     74.250000 MHz
    VIC  15:  1440x480    59.940060 Hz  16:9     31.469 kHz     54.000000 MHz
    VIC  14:  1440x480    59.940060 Hz   4:3     31.469 kHz     54.000000 MHz
    VIC  63:  1920x1080  120.000000 Hz  16:9    135.000 kHz    297.000000 MHz
  Audio Data Block:
    Linear PCM:
      Max channels: 2
      Supported sample rates (kHz): 48 44.1 32
      Supported sample sizes (bits): 24 20 16
  Speaker Allocation Data Block:
    FL/FR - Front Left/Right
  Video Capability Data Block:
    YCbCr quantization: No Data
    RGB quantization: Selectable (via AVI Q)
    PT scan behavior: Always Underscanned
    IT scan behavior: Always Underscanned
    CE scan behavior: Always Underscanned
  Colorimetry Data Block:
    BT2020cYCC
    BT2020YCC
    BT2020RGB
    Gamut Boundary Description Metadata Profile P0
  HDR Static Metadata Data Block:
    Electro optical transfer functions:
      Traditional gamma - SDR luminance range
      Traditional gamma - HDR luminance range
      SMPTE ST2084
    Supported static metadata descriptors:
      Static metadata type 1
    Desired content max luminance: 83 (301.833 cd/m^2)
    Desired content max frame-average luminance: 83 (301.833 cd/m^2)
    Desired content min luminance: 0 (0.000 cd/m^2)
  Vendor-Specific Data Block (AMD), OUI 00-00-1A:
    Version: 2.1
    Minimum Refresh Rate: 48 Hz
    Maximum Refresh Rate: 170 Hz
    Flags 1.x: 0x00
    Flags 2.x: 0x00
    Maximum luminance: 0 (50.000 cd/m^2)
    Minimum luminance: 0 (0.000 cd/m^2)
    Unknown: 0x00 0x00
  Detailed Timing Descriptors:
    DTD 6:  2560x1440  165.002985 Hz  16:9    242.554 kHz    646.650000 MHz (697 mm x 392 mm)
                 Hfront    8 Hsync  32 Hback   66 Hpol N
                 Vfront    3 Vsync   5 Vback   22 Vpol P
    DTD 7:  2560x1440  119.997589 Hz  16:9    182.996 kHz    497.750000 MHz (697 mm x 392 mm)
                 Hfront   48 Hsync  32 Hback   80 Hpol P
                 Vfront    3 Vsync   5 Vback   77 Vpol N
    DTD 8:  2560x1440   99.946436 Hz  16:9    150.919 kHz    410.500000 MHz (697 mm x 392 mm)
                 Hfront   48 Hsync  32 Hback   80 Hpol P
                 Vfront    3 Vsync   5 Vback   62 Vpol N
    DTD 9:  2560x1440  144.000722 Hz  16:9    222.193 kHz    593.700000 MHz (697 mm x 392 mm)
                 Hfront    8 Hsync  32 Hback   72 Hpol P
                 Vfront   25 Vsync   8 Vback   70 Vpol N
Checksum: 0xae  Unused space in Extension Block: 9 bytes

----------------

Block 5, DisplayID Extension Block:
  Version: 1.2
  Extension Count: 0
  Display Parameters Data Block (0x01):
    Image size: 697.0 mm x 392.0 mm
    Display native pixel format: 2560x1440
    Feature support flags:
      Power management (DPM)
    Gamma: 2.20
    Aspect ratio: 3.55
    Dynamic bpc native: 10
    Dynamic bpc overall: 10
  Video Timing Modes Type 1 - Detailed Timings Data Block:
    DTD:  2560x1440  170.021274 Hz   0:0    248.231 kHz    655.330000 MHz (aspect undefined, no 3D stereo, preferred)
               Hfront   10 Hsync  60 Hback   10 Hpol P
               Vfront    3 Vsync   5 Vback   12 Vpol N
    DTD:  2560x1440  155.011209 Hz   0:0    239.182 kHz    637.660000 MHz (aspect undefined, no 3D stereo)
               Hfront   21 Hsync  32 Hback   53 Hpol P
               Vfront    3 Vsync   5 Vback   95 Vpol N
    DTD:  2560x1440  159.997582 Hz   0:0    240.636 kHz    635.280000 MHz (aspect undefined, no 3D stereo)
               Hfront    8 Hsync  32 Hback   40 Hpol P
               Vfront    3 Vsync  10 Vback   51 Vpol P
  Checksum: 0x6b
Checksum: 0x90

----------------

Warnings:

Block 1, CTA-861 Extension Block:
  Video Capability Data Block: Set Selectable YCbCr Quantization to avoid interop issues.
  Video Capability Data Block: S_PT is equal to S_IT and S_CE, so should be set to 0 instead.
  Colorimetry Data Block: Set the sRGB colorimetry bit to avoid interop issues.
  Display Product Serial Number is set, so the Serial Number in the Base EDID should be 0.
Block 4, CTA-861 Extension Block:
  Video Capability Data Block: Set Selectable YCbCr Quantization to avoid interop issues.
  Video Capability Data Block: S_PT is equal to S_IT and S_CE, so should be set to 0 instead.
  Colorimetry Data Block: Set the sRGB colorimetry bit to avoid interop issues.
  Display Product Serial Number is set, so the Serial Number in the Base EDID should be 0.
EDID:
  Base EDID: Some timings are out of range of the Monitor Ranges:
    Horizontal Freq: 31.466 - 248.231 kHz (Monitor: 250.000 - 250.000 kHz)

Failures:

Block 2, DisplayID Extension Block:
  Expected 0 DisplayID Extension Block, but got 1.
Block 3, Base EDID:
  Unknown Extension Block.
Block 4, CTA-861 Extension Block:
  Video Data Block: Duplicate VIC 16.
  Video Data Block: Duplicate VIC 4.
  Video Data Block: Duplicate VIC 15.
  Video Data Block: Duplicate VIC 14.
  Video Data Block: Duplicate VIC 63.
  Speaker Allocation Data Block: Only one instance of this Data Block is allowed.
  Video Capability Data Block: Only one instance of this Data Block is allowed.
  Colorimetry Data Block: Only one instance of this Data Block is allowed.
  HDR Static Metadata Data Block: Only one instance of this Data Block is allowed.
Block 5, DisplayID Extension Block:
  Product Type should be 0 in extension block.
  Display Parameters Data Block (0x01): Duplicate Display Parameters Data Block.
EDID:
  Base EDID: EDID specified 2 extension block(s), but found 5 extension block(s).
  CTA-861: Native progressive timings are a mix of several resolutions.
  DisplayID: Missing DisplayID Product Identification Data Block.
  DisplayID: Missing DisplayID Display Interface Features Data Block.

EDID conformity: FAIL
