edid-decode (hex):

00 ff ff ff ff ff ff 00 0d ae 38 15 00 00 00 00
2b 1e 01 04 a5 22 13 78 03 28 65 97 59 54 8e 27
1e 50 54 00 00 00 01 01 01 01 01 01 01 01 01 01
01 01 01 01 01 01 36 36 80 a0 70 38 20 40 30 20
35 00 58 c1 10 00 00 1a 24 24 80 a0 70 38 20 40
30 20 35 00 58 c1 10 00 00 1a 00 00 00 00 00 00
00 00 00 00 00 00 00 00 00 00 00 00 00 00 00 02
00 0c 3d ff 0d 3c 7d 12 12 26 7d 00 00 00 00 98

00 ff ff ff ff ff ff 00 0d ae 38 15 00 00 00 00
2b 1e 01 04 a5 22 13 78 03 28 65 97 59 54 8e 27
1e 50 54 00 00 00 01 01 01 01 01 01 01 01 01 01
01 01 01 01 01 01 36 36 80 a0 70 38 20 40 30 20
35 00 58 c1 10 00 00 1a 24 24 80 a0 70 38 20 40
30 20 35 00 58 c1 10 00 00 1a 00 00 00 00 00 00
00 00 00 00 00 00 00 00 00 00 00 00 00 00 00 02
00 0c 3d ff 0d 3c 7d 12 12 26 7d 00 00 00 00 98

----------------

Block 0, Base EDID:
  EDID Structure Version & Revision: 1.4
  Vendor & Product Identification:
    Manufacturer: CMN
    Model: 5432
    Made in: week 43 of 2020
  Basic Display Parameters & Features:
    Digital display
    Bits per primary color channel: 8
    DisplayPort interface
    Maximum image size: 34 cm x 19 cm
    Gamma: 2.20
    Supported color formats: RGB 4:4:4
    First detailed timing includes the native pixel format and preferred refresh rate
    Display is continuous frequency
  Color Characteristics:
    Red  : 0.5898, 0.3496
    Green: 0.3300, 0.5546
    Blue : 0.1533, 0.1191
    White: 0.3134, 0.3291
  Established Timings I & II: none
  Standard Timings: none
  Detailed Timing Descriptors:
    DTD 1:  1920x1080   60.001038 Hz  16:9     66.721 kHz    138.780000 MHz (344 mm x 193 mm)
                 Hfront   48 Hsync  32 Hback   80 Hpol P
                 Vfront    3 Vsync   5 Vback   24 Vpol N
    DTD 2:  1920x1080   40.000692 Hz  16:9     44.481 kHz     92.520000 MHz (344 mm x 193 mm)
                 Hfront   48 Hsync  32 Hback   80 Hpol P
                 Vfront    3 Vsync   5 Vback   24 Vpol N
    Empty Descriptor
    Manufacturer-Specified Display Descriptor (0x02): 00 02 00 0c 3d ff 0d 3c 7d 12 12 26 7d 00 00 00 '....=..<}..&}...'
Checksum: 0x98

----------------

Block 1, Unknown EDID Extension Block 0x00:
  00 ff ff ff ff ff ff 00 0d ae 38 15 00 00 00 00 '..........8.....'
  2b 1e 01 04 a5 22 13 78 03 28 65 97 59 54 8e 27 '+....".x.(e.YT.''
  1e 50 54 00 00 00 01 01 01 01 01 01 01 01 01 01 '.PT.............'
  01 01 01 01 01 01 36 36 80 a0 70 38 20 40 30 20 '......66..p8 @0 '
  35 00 58 c1 10 00 00 1a 24 24 80 a0 70 38 20 40 '5.X.....$$..p8 @'
  30 20 35 00 58 c1 10 00 00 1a 00 00 00 00 00 00 '0 5.X...........'
  00 00 00 00 00 00 00 00 00 00 00 00 00 00 00 02 '................'
  00 0c 3d ff 0d 3c 7d 12 12 26 7d 00 00 00 00 98 '..=..<}..&}.....'
Checksum: 0x98

----------------

Warnings:

Block 0, Base EDID:
  Missing Display Product Name.

Failures:

Block 0, Base EDID:
  Empty Descriptor: Use Dummy Descriptor instead of all zeroes.
  Missing Display Range Limits Descriptor.
Block 1, Base EDID:
  Unknown Extension Block.
EDID:
  Base EDID: EDID specified 0 extension block(s), but found 1 extension block(s).

EDID conformity: FAIL
