edid-decode (hex):

00 ff ff ff ff ff ff 00 41 d0 01 08 00 00 00 00
01 14 01 03 08 00 00 ff 0a 00 00 00 00 00 00 00
00 00 00 bf ef 80 a9 40 81 80 81 40 71 4f 61 59
45 59 31 59 31 19 64 19 00 40 41 00 26 30 18 88
36 00 00 00 00 00 00 18 00 00 00 fd 00 3c 55 1e
41 12 00 0a 20 20 20 20 20 20 00 00 00 fc 00 4c
61 6e 74 72 6f 6e 69 78 20 53 4c 53 00 00 00 10
00 00 2a 40 30 70 13 00 52 0e 11 00 00 1e 00 69

----------------

Block 0, Base EDID:
  EDID Structure Version & Revision: 1.3
  Vendor & Product Identification:
    Manufacturer: PNP
    Model: 2049
    Made in: week 1 of 2010
  Basic Display Parameters & Features:
    Analog display
    Input voltage level: 0.7/0.3 V
    Sync: Separate
    Image size is variable
    Gamma: 1.0
    RGB color display
    First detailed timing is preferred timing
  Color Characteristics:
    Red  : 0.0000, 0.0000
    Green: 0.0000, 0.0000
    Blue : 0.0000, 0.0000
    White: 0.0000, 0.0000
  Established Timings I & II:
    IBM     :   720x400    70.082 Hz   9:5    31.467 kHz  28.320 MHz
    DMT 0x04:   640x480    59.940 Hz   4:3    31.469 kHz  25.175 MHz
    Apple   :   640x480    66.667 Hz   4:3    35.000 kHz  30.240 MHz
    DMT 0x05:   640x480    72.809 Hz   4:3    37.861 kHz  31.500 MHz
    DMT 0x06:   640x480    75.000 Hz   4:3    37.500 kHz  31.500 MHz
    DMT 0x08:   800x600    56.250 Hz   4:3    35.156 kHz  36.000 MHz
    DMT 0x09:   800x600    60.317 Hz   4:3    37.879 kHz  40.000 MHz
    DMT 0x0a:   800x600    72.188 Hz   4:3    48.077 kHz  50.000 MHz
    DMT 0x0b:   800x600    75.000 Hz   4:3    46.875 kHz  49.500 MHz
    Apple   :   832x624    74.551 Hz   4:3    49.726 kHz  57.284 MHz
    DMT 0x10:  1024x768    60.004 Hz   4:3    48.363 kHz  65.000 MHz
    DMT 0x11:  1024x768    70.069 Hz   4:3    56.476 kHz  75.000 MHz
    DMT 0x12:  1024x768    75.029 Hz   4:3    60.023 kHz  78.750 MHz
    DMT 0x24:  1280x1024   75.025 Hz   5:4    79.976 kHz 135.000 MHz
    Apple   :  1152x870    75.062 Hz 192:145  68.681 kHz 100.000 MHz
  Standard Timings:
    DMT 0x33:  1600x1200   60.000 Hz   4:3    75.000 kHz 162.000 MHz
    DMT 0x23:  1280x1024   60.020 Hz   5:4    63.981 kHz 108.000 MHz
    DMT 0x20:  1280x960    60.000 Hz   4:3    60.000 kHz 108.000 MHz
    DMT 0x15:  1152x864    75.000 Hz   4:3    67.500 kHz 108.000 MHz
    DMT 0x13:  1024x768    84.997 Hz   4:3    68.677 kHz  94.500 MHz
    DMT 0x0c:   800x600    85.061 Hz   4:3    53.674 kHz  56.250 MHz
    DMT 0x07:   640x480    85.008 Hz   4:3    43.269 kHz  36.000 MHz
    DMT 0x02:   640x400    85.080 Hz  16:10   37.861 kHz  31.500 MHz
  Detailed Timing Descriptors:
    DTD 1:  1024x768    60.004 Hz   4:3    48.363 kHz  65.000 MHz
                 Hfront   24 Hsync 136 Hback 160 Hpol N
                 Vfront    3 Vsync   6 Vback  29 Vpol N
  Display Range Limits:
    Monitor ranges (GTF): 60-85 Hz V, 30-65 kHz H, max dotclock 180 MHz
    Display Product Name: 'Lantronix SLS'
    Dummy Descriptor:
Checksum: 0x69

----------------

Failures:

Block 0, Base EDID:
  Dummy Descriptor: Dummy block filled with garbage.
All Blocks:
  Some timings are out of range of the Monitor Ranges:
    Vertical Freq: 56.250 - 85.080 Hz (Monitor: 60.000 - 85.000 Hz)
    Horizontal Freq: 31.466 - 79.976 kHz (Monitor: 30.000 - 65.000 kHz)

EDID conformity: FAIL
