
EDID (hex):
00ffffffffffff0009d1037a45540000
071201030e291a782e80c5a657499b23
125054a56b80710081009500950f8180
81408bc081c09a29a0d0518420305098
360098ff1000001c000000ff004d3238
3036363735534c300a20000000fd0037
4c1f530e000a202020202020000000fc
0042656e512058393030570a0a0a0058

Extracted contents:
header:          00 ff ff ff ff ff ff 00
serial number:   09 d1 03 7a 45 54 00 00 07 12
version:         01 03
basic params:    0e 29 1a 78 2e
chroma info:     80 c5 a6 57 49 9b 23 12 50 54
established:     a5 6b 80
standard:        71 00 81 00 95 00 95 0f 81 80 81 40 8b c0 81 c0
descriptor 1:    9a 29 a0 d0 51 84 20 30 50 98 36 00 98 ff 10 00 00 1c
descriptor 2:    00 00 00 ff 00 4d 32 38 30 36 36 37 35 53 4c 30 0a 20
descriptor 3:    00 00 00 fd 00 37 4c 1f 53 0e 00 0a 20 20 20 20 20 20
descriptor 4:    00 00 00 fc 00 42 65 6e 51 20 58 39 30 30 57 0a 0a 0a
extensions:      00
checksum:        58

EDID version: 1.3
Manufacturer: BNQ Model 7a03 Serial Number --
Made in week 7 of 2008
Analog display, Input voltage level: 0.7/0.3 V
Sync: Separate Composite SyncOnGreen 
Maximum image size: 41 cm x 26 cm
Gamma: 2.20
DPMS levels: Off
RGB color display
Default (sRGB) color space is primary color space
First detailed timing is preferred timing
Display x,y Chromaticity:
  Red:   0.6503, 0.3398
  Green: 0.2851, 0.6054
  Blue:  0.1396, 0.0703
  White: 0.3134, 0.3291
Established timings supported:
  720x400@70Hz 9:5 HorFreq: 31469 Hz Clock: 28.320 MHz
  640x480@60Hz 4:3 HorFreq: 31469 Hz Clock: 25.175 MHz
  640x480@75Hz 4:3 HorFreq: 37500 Hz Clock: 31.500 MHz
  800x600@60Hz 4:3 HorFreq: 37900 Hz Clock: 40.000 MHz
  800x600@75Hz 4:3 HorFreq: 46900 Hz Clock: 49.500 MHz
  832x624@75Hz 4:3 HorFreq: 49726 Hz Clock: 57.284 MHz
  1024x768@60Hz 4:3 HorFreq: 48400 Hz Clock: 65.000 MHz
  1024x768@75Hz 4:3 HorFreq: 60000 Hz Clock: 78.750 MHz
  1280x1024@75Hz 5:4 HorFreq: 80000 Hz Clock: 135.000 MHz
  1152x870@75Hz 192:145 HorFreq: 67500 Hz Clock: 108.000 MHz
Standard timings supported:
  1152x720@60Hz 16:10
  1280x800@60Hz 16:10
  1440x900@60Hz 16:10 HorFreq: 55500 Hz Clock: 88.750 MHz
  1440x900@75Hz 16:10 HorFreq: 82300 Hz Clock: 156.000 MHz
  1280x1024@60Hz 5:4 HorFreq: 64000 Hz Clock: 108.000 MHz
  1280x960@60Hz 4:3 HorFreq: 60000 Hz Clock: 108.000 MHz
  1360x765@60Hz 16:9
  1280x720@60Hz 16:9
Detailed mode: Clock 106.500 MHz, 408 mm x 255 mm
               1440 1520 1672 1904 hborder 0
                900  903  909  932 vborder 0
               -hsync +vsync 
               VertFreq: 60 Hz, HorFreq: 55934 Hz
Serial number: --
Monitor ranges (GTF): 55-76Hz V, 31-83kHz H, max dotclock 140MHz
Monitor name: BenQ X900W
Checksum: 0x58 (valid)
EDID block does NOT conform to EDID 1.3!
	sRGB is signaled, but the chromaticities do not match
	Detailed block string not properly terminated
One or more of the timings is out of range of the Monitor Ranges:
  Vertical Freq: 60 - 75 Hz
  Horizontal Freq: 31469 - 82300 Hz
  Maximum Clock: 156.000 MHz
