edid-decode (hex):

00 ff ff ff ff ff ff 00 1a b3 fe 07 fa 3e 06 00
04 17 01 03 68 33 1d 78 2a c9 a5 a4 56 4b 9d 25
12 50 54 a5 4b 00 81 80 a9 40 95 00 b3 00 01 01
01 01 01 01 01 01 02 3a 80 18 71 38 2d 40 58 2c
45 00 fd 1e 11 00 00 1e 00 00 00 fd 00 32 4c 1c
52 11 00 0a 20 20 20 20 20 20 00 00 00 fc 00 45
32 33 54 2d 36 20 4c 45 44 0a 20 20 00 00 00 ff
00 59 56 34 46 34 30 39 33 33 38 0a 20 20 00 1e

00 ff ff ff ff ff ff 00 1a b3 fe 07 fa 3e 06 00
04 17 01 03 68 33 1d 78 2a c9 a5 a4 56 4b 9d 25
12 50 54 a5 4b 00 81 80 a9 40 95 00 b3 00 01 01
01 01 01 01 01 01 02 3a 80 18 71 38 2d 40 58 2c
45 00 fd 1e 11 00 00 1e 00 00 00 fd 00 32 4c 1c
52 11 00 0a 20 20 20 20 20 20 00 00 00 fc 00 45
32 33 54 2d 36 20 4c 45 44 0a 20 20 00 00 00 ff
00 59 56 34 46 34 30 39 33 33 38 0a 20 20 00 1e

----------------

Block 0, Base EDID:
  EDID Structure Version & Revision: 1.3
  Vendor & Product Identification:
    Manufacturer: FUS
    Model: 2046
    Serial Number: ...
    Made in: week 4 of 2013
  Basic Display Parameters & Features:
    Analog display
    Signal Level Standard: 0.700 : 0.000 : 0.700 V p-p
    Blank level equals black level
    Sync: Separate
    Maximum image size: 51 cm x 29 cm
    Gamma: 2.20
    DPMS levels: Off
    RGB color display
    First detailed timing is the preferred timing
  Color Characteristics:
    Red  : 0.6435, 0.3359
    Green: 0.2949, 0.6142
    Blue : 0.1464, 0.0722
    White: 0.3134, 0.3291
  Established Timings I & II:
    IBM     :   720x400    70.081663 Hz   9:5     31.467 kHz     28.320000 MHz
    DMT 0x04:   640x480    59.940476 Hz   4:3     31.469 kHz     25.175000 MHz
    DMT 0x06:   640x480    75.000000 Hz   4:3     37.500 kHz     31.500000 MHz
    DMT 0x09:   800x600    60.316541 Hz   4:3     37.879 kHz     40.000000 MHz
    DMT 0x0b:   800x600    75.000000 Hz   4:3     46.875 kHz     49.500000 MHz
    DMT 0x10:  1024x768    60.003840 Hz   4:3     48.363 kHz     65.000000 MHz
    DMT 0x12:  1024x768    75.028582 Hz   4:3     60.023 kHz     78.750000 MHz
    DMT 0x24:  1280x1024   75.024675 Hz   5:4     79.976 kHz    135.000000 MHz
  Standard Timings:
    DMT 0x23:  1280x1024   60.019740 Hz   5:4     63.981 kHz    108.000000 MHz
    DMT 0x33:  1600x1200   60.000000 Hz   4:3     75.000 kHz    162.000000 MHz
    DMT 0x2f:  1440x900    59.887445 Hz  16:10    55.935 kHz    106.500000 MHz
    DMT 0x3a:  1680x1050   59.954250 Hz  16:10    65.290 kHz    146.250000 MHz
  Detailed Timing Descriptors:
    DTD 1:  1920x1080   60.000000 Hz  16:9     67.500 kHz    148.500000 MHz (509 mm x 286 mm)
                 Hfront   88 Hsync  44 Hback  148 Hpol P
                 Vfront    4 Vsync   5 Vback   36 Vpol P
    Display Range Limits:
      Monitor ranges (GTF): 50-76 Hz V, 28-82 kHz H, max dotclock 170 MHz
    Display Product Name: 'E23T-6 LED'
    Display Product Serial Number: ...
Checksum: 0x1e

----------------

Block 1, Unknown EDID Extension Block 0x00:
  00 ff ff ff ff ff ff 00 1a b3 fe 07 fa 3e 06 00 '.............>..'
  04 17 01 03 68 33 1d 78 2a c9 a5 a4 56 4b 9d 25 '....h3.x*...VK.%'
  12 50 54 a5 4b 00 81 80 a9 40 95 00 b3 00 01 01 '.PT.K....@......'
  01 01 01 01 01 01 02 3a 80 18 71 38 2d 40 58 2c '.......:..q8-@X,'
  45 00 fd 1e 11 00 00 1e 00 00 00 fd 00 32 4c 1c 'E............2L.'
  52 11 00 0a 20 20 20 20 20 20 00 00 00 fc 00 45 'R...      .....E'
  32 33 54 2d 36 20 4c 45 44 0a 20 20 00 00 00 ff '23T-6 LED.  ....'
  00 59 56 34 46 34 30 39 33 33 38 0a 20 20 00 1e '.YV4F409338.  ..'
Checksum: 0x1e

----------------

Failures:

Block 1, Base EDID:
  Unknown Extension Block.
EDID:
  Base EDID: EDID specified 0 extension block(s), but found 1 extension block(s).

EDID conformity: FAIL
