
EDID (hex):
00ffffffffffff0022f00941a1860100
1e14010481331d78efde51a3544c9926
0f505400000001010101010101010101
0101010101017c2e40006284223058a8
3500bbf910000018000000fd0032550a
6e10010a202020202020000000fc0048
502041494f0a202020202020000000ff
004c544d3230304b540a202020200017

Extracted contents:
header:          00 ff ff ff ff ff ff 00
serial number:   22 f0 09 41 a1 86 01 00 1e 14
version:         01 04
basic params:    81 33 1d 78 ef
chroma info:     de 51 a3 54 4c 99 26 0f 50 54
established:     00 00 00
standard:        01 01 01 01 01 01 01 01 01 01 01 01 01 01 01 01
descriptor 1:    7c 2e 40 00 62 84 22 30 58 a8 35 00 bb f9 10 00 00 18
descriptor 2:    00 00 00 fd 00 32 55 0a 6e 10 01 0a 20 20 20 20 20 20
descriptor 3:    00 00 00 fc 00 48 50 20 41 49 4f 0a 20 20 20 20 20 20
descriptor 4:    00 00 00 ff 00 4c 54 4d 32 30 30 4b 54 0a 20 20 20 20
extensions:      00
checksum:        17

EDID version: 1.4
Manufacturer: HWP Model 4109 Serial Number --
Made in week 30 of 2010
Digital display
Color depth is undefined
DVI interface
Maximum image size: 51 cm x 29 cm
Gamma: 2.20
DPMS levels: Standby Suspend Off
Supported color formats: RGB 4:4:4, YCrCb 4:4:4
Default (sRGB) color space is primary color space
First detailed timing includes the native pixel format and preferred refresh rate
Display is continuous frequency
Display x,y Chromaticity:
  Red:   0.6396, 0.3291
  Green: 0.2998, 0.5996
  Blue:  0.1494, 0.0595
  White: 0.3125, 0.3291
Established timings supported:
Standard timings supported:
Detailed mode: Clock 119.000 MHz, 443 mm x 249 mm
               1600 1688 1856 2112 hborder 0
                900  903  908  934 vborder 0
               -hsync -vsync 
               VertFreq: 60 Hz, HorFreq: 56344 Hz
Monitor ranges (bare limits): 50-85Hz V, 10-110kHz H, max dotclock 160MHz
Monitor name: HP AIO
Serial number: --
Checksum: 0x17 (valid)
EDID block does NOT conform to EDID 1.4!
	sRGB is signaled, but the chromaticities do not match
