edid-decode (hex):

00 ff ff ff ff ff ff 00 22 f0 09 41 01 01 00 00
1e 13 01 03 80 2c 19 78 0a b8 15 a6 55 4b 9b 25
13 50 54 00 00 00 01 01 01 01 01 01 01 01 01 01
01 01 01 01 01 01 30 2a 40 c8 60 84 64 30 b4 50
a3 00 b8 fa 10 00 00 18 00 00 00 fe 00 53 41 4d
53 55 4e 47 0a 20 20 20 20 20 00 00 00 fc 00 48
50 20 54 6f 75 63 68 53 6d 61 72 74 00 00 00 fe
00 4c 54 4d 32 30 30 4b 54 30 33 0a 20 20 00 ea

----------------

Block 0, Base EDID:
  EDID Structure Version & Revision: 1.3
  Vendor & Product Identification:
    Manufacturer: HWP
    Model: 16649
    Serial Number: ...
    Made in: week 30 of 2009
  Basic Display Parameters & Features:
    Digital display
    Maximum image size: 44 cm x 25 cm
    Gamma: 2.20
    RGB color display
    First detailed timing is the preferred timing
  Color Characteristics:
    Red  : 0.6503, 0.3349
    Green: 0.2949, 0.6054
    Blue : 0.1445, 0.0751
    White: 0.3134, 0.3291
  Established Timings I & II: none
  Standard Timings: none
  Detailed Timing Descriptors:
    DTD 1:  1600x900    60.000 Hz  16:9    60.000 kHz 108.000 MHz (440 mm x 250 mm)
                 Hfront  180 Hsync  80 Hback -60 Hpol N
                 Vfront   10 Vsync   3 Vback  87 Vpol N
    Alphanumeric Data String: 'SAMSUNG'
    Display Product Name: 'HP TouchSmart'
    Alphanumeric Data String: 'LTM200KT03'
Checksum: 0xea

----------------

Failures:

Block 0, Base EDID:
  Detailed Timing Descriptor #1: 0 or negative horizontal back porch.
  Missing Display Range Limits Descriptor.

EDID conformity: FAIL
