edid-decode (hex):

00 ff ff ff ff ff ff 00 09 e5 bd 05 00 00 00 00
01 16 01 03 80 22 13 78 0a f8 90 9e 59 55 9c 26
1a 50 54 00 00 00 01 01 01 01 01 01 01 01 01 01
01 01 01 01 01 01 3e 1c 56 a0 50 00 16 30 30 20
36 00 58 c1 10 00 00 1a 3e 1c 56 a0 50 00 16 30
30 20 36 00 58 c1 10 00 00 1a 00 00 00 fe 00 42
4f 45 20 48 46 0a 20 20 20 20 20 20 00 00 00 fe
00 48 42 31 35 36 57 58 31 2d 32 30 30 0a 00 29

----------------

Block 0, Base EDID:
  EDID Structure Version & Revision: 1.3
  Vendor & Product Identification:
    Manufacturer: BOE
    Model: 1469
    Made in: week 1 of 2012
  Basic Display Parameters & Features:
    Digital display
    Maximum image size: 34 cm x 19 cm
    Gamma: 2.20
    RGB color display
    First detailed timing is the preferred timing
  Color Characteristics:
    Red  : 0.6201, 0.3505
    Green: 0.3339, 0.6093
    Blue : 0.1503, 0.1025
    White: 0.3125, 0.3281
  Established Timings I & II: none
  Standard Timings: none
  Detailed Timing Descriptors:
    DTD 1:  1366x768    59.973124 Hz 683:384   47.379 kHz     72.300000 MHz (344 mm x 193 mm)
                 Hfront   48 Hsync  32 Hback   80 Hpol P
                 Vfront    3 Vsync   6 Vback   13 Vpol N
    DTD 2:  1366x768    59.973124 Hz 683:384   47.379 kHz     72.300000 MHz (344 mm x 193 mm)
                 Hfront   48 Hsync  32 Hback   80 Hpol P
                 Vfront    3 Vsync   6 Vback   13 Vpol N
    Alphanumeric Data String: 'BOE HF'
    Alphanumeric Data String: 'HB156WX1-200'
Checksum: 0x29

----------------

Failures:

Block 0, Base EDID:
  Missing Display Product Name.
  Missing Display Range Limits Descriptor.

EDID conformity: FAIL
