edid-decode (hex):

00 ff ff ff ff ff ff 00 1e 6d 96 43 52 d0 03 00
0a 0e 01 03 18 21 19 b9 e8 5a d9 9e 54 4b 99 24
12 48 4c ff fe 80 31 4f 31 59 45 4f 45 59 71 4f
61 4f 61 59 81 80 ea 24 00 60 41 00 28 30 30 60
13 00 36 e6 10 00 00 1e 30 2a 00 98 51 00 2a 40
30 70 13 00 36 e6 10 00 00 1e 00 00 00 fd 00 32
a0 1e 47 0b 00 0a 20 20 20 20 20 20 00 00 00 fc
00 46 37 32 30 42 0a 20 20 20 20 20 20 20 00 09

00 ff ff ff ff ff ff 00 1e 6d 96 43 52 d0 03 00
0a 0e 01 03 18 21 19 b9 e8 5a d9 9e 54 4b 99 24
12 48 4c ff fe 80 31 4f 31 59 45 4f 45 59 71 4f
61 4f 61 59 81 80 ea 24 00 60 41 00 28 30 30 60
13 00 36 e6 10 00 00 1e 30 2a 00 98 51 00 2a 40
30 70 13 00 36 e6 10 00 00 1e 00 00 00 fd 00 32
a0 1e 47 0b 00 0a 20 20 20 20 20 20 00 00 00 fc
00 46 37 32 30 42 0a 20 20 20 20 20 20 20 00 09

----------------

Block 0, Base EDID:
  EDID Structure Version & Revision: 1.3
  Vendor & Product Identification:
    Manufacturer: GSM
    Model: 17302
    Serial Number: ...
    Made in: week 10 of 2004
  Basic Display Parameters & Features:
    Analog display
    Signal Level Standard: 0.700 : 0.300 : 1.000 V p-p
    Blank-to-black setup/pedestal
    Sync: Separate
    Maximum image size: 33 cm x 25 cm
    Gamma: 2.85
    DPMS levels: Standby Suspend Off
    RGB color display
  Color Characteristics:
    Red  : 0.6181, 0.3291
    Green: 0.2949, 0.5996
    Blue : 0.1435, 0.0712
    White: 0.2832, 0.2978
  Established Timings I & II:
    IBM     :   720x400    70.081663 Hz   9:5     31.467 kHz     28.320000 MHz
    IBM     :   720x400    87.849542 Hz   9:5     39.444 kHz     35.500000 MHz
    DMT 0x04:   640x480    59.940476 Hz   4:3     31.469 kHz     25.175000 MHz
    Apple   :   640x480    66.666667 Hz   4:3     35.000 kHz     30.240000 MHz
    DMT 0x05:   640x480    72.808802 Hz   4:3     37.861 kHz     31.500000 MHz
    DMT 0x06:   640x480    75.000000 Hz   4:3     37.500 kHz     31.500000 MHz
    DMT 0x08:   800x600    56.250000 Hz   4:3     35.156 kHz     36.000000 MHz
    DMT 0x09:   800x600    60.316541 Hz   4:3     37.879 kHz     40.000000 MHz
    DMT 0x0a:   800x600    72.187572 Hz   4:3     48.077 kHz     50.000000 MHz
    DMT 0x0b:   800x600    75.000000 Hz   4:3     46.875 kHz     49.500000 MHz
    Apple   :   832x624    74.551266 Hz   4:3     49.726 kHz     57.284000 MHz
    DMT 0x0f:  1024x768i   86.957532 Hz   4:3     35.522 kHz     44.900000 MHz
    DMT 0x10:  1024x768    60.003840 Hz   4:3     48.363 kHz     65.000000 MHz
    DMT 0x11:  1024x768    70.069359 Hz   4:3     56.476 kHz     75.000000 MHz
    DMT 0x12:  1024x768    75.028582 Hz   4:3     60.023 kHz     78.750000 MHz
    Apple   :  1152x870    75.061550 Hz 192:145   68.681 kHz    100.000000 MHz
  Standard Timings:
    DMT 0x06:   640x480    75.000000 Hz   4:3     37.500 kHz     31.500000 MHz
    DMT 0x07:   640x480    85.008312 Hz   4:3     43.269 kHz     36.000000 MHz
    DMT 0x0b:   800x600    75.000000 Hz   4:3     46.875 kHz     49.500000 MHz
    DMT 0x0c:   800x600    85.061274 Hz   4:3     53.674 kHz     56.250000 MHz
    DMT 0x15:  1152x864    75.000000 Hz   4:3     67.500 kHz    108.000000 MHz
    DMT 0x12:  1024x768    75.028582 Hz   4:3     60.023 kHz     78.750000 MHz
    DMT 0x13:  1024x768    84.996690 Hz   4:3     68.677 kHz     94.500000 MHz
    DMT 0x23:  1280x1024   60.019740 Hz   5:4     63.981 kHz    108.000000 MHz
  Detailed Timing Descriptors:
    DTD 1:  1024x768    84.996690 Hz   4:3     68.677 kHz     94.500000 MHz (310 mm x 230 mm)
                 Hfront   48 Hsync  96 Hback  208 Hpol P
                 Vfront    1 Vsync   3 Vback   36 Vpol P
    DTD 2:  1280x1024   60.019740 Hz   5:4     63.981 kHz    108.000000 MHz (310 mm x 230 mm)
                 Hfront   48 Hsync 112 Hback  248 Hpol P
                 Vfront    1 Vsync   3 Vback   38 Vpol P
    Display Range Limits:
      Monitor ranges (GTF): 50-160 Hz V, 30-71 kHz H, max dotclock 110 MHz
    Display Product Name: 'F720B'
Checksum: 0x09

----------------

Block 1, Unknown EDID Extension Block 0x00:
  00 ff ff ff ff ff ff 00 1e 6d 96 43 52 d0 03 00 '.........m.CR...'
  0a 0e 01 03 18 21 19 b9 e8 5a d9 9e 54 4b 99 24 '.....!...Z..TK.$'
  12 48 4c ff fe 80 31 4f 31 59 45 4f 45 59 71 4f '.HL...1O1YEOEYqO'
  61 4f 61 59 81 80 ea 24 00 60 41 00 28 30 30 60 'aOaY...$.`A.(00`'
  13 00 36 e6 10 00 00 1e 30 2a 00 98 51 00 2a 40 '..6.....0*..Q.*@'
  30 70 13 00 36 e6 10 00 00 1e 00 00 00 fd 00 32 '0p..6..........2'
  a0 1e 47 0b 00 0a 20 20 20 20 20 20 00 00 00 fc '..G...      ....'
  00 46 37 32 30 42 0a 20 20 20 20 20 20 20 00 09 '.F720B.       ..'
Checksum: 0x09

----------------

Failures:

Block 0, Base EDID:
  Basic Display Parameters & Features: EDID 1.3 requires that the first detailed timing is the preferred timing.
  Detailed Timing Descriptor #1: Mismatch of image size 310x230 mm vs display size 330x250 mm.
  Detailed Timing Descriptor #2: Mismatch of image size 310x230 mm vs display size 330x250 mm.
Block 1, Base EDID:
  Unknown Extension Block.
EDID:
  Base EDID: EDID specified 0 extension block(s), but found 1 extension block(s).

EDID conformity: FAIL
