edid-decode (hex):

00 ff ff ff ff ff ff 00 05 e3 59 16 bd 61 bc 00
0d 17 01 03 81 22 13 78 2a ef 05 90 54 52 93 29
25 50 54 21 08 00 01 01 01 01 01 01 01 01 01 01
01 01 01 01 01 01 5e 35 80 96 70 38 14 40 2c 1c
24 00 58 c1 10 00 00 1e 00 00 00 ff 00 31 32 33
34 35 36 37 20 20 20 20 20 20 00 00 00 fd 00 0f
f0 0f 7f 11 00 0a 20 20 20 20 20 20 00 00 00 fc
00 31 36 35 39 57 20 20 20 20 20 20 20 20 00 5d

----------------

Block 0, Base EDID:
  EDID Structure Version & Revision: 1.3
  Vendor & Product Identification:
    Manufacturer: AOC
    Model: 5721
    Serial Number: ...
    Made in: week 13 of 2013
  Basic Display Parameters & Features:
    Digital display
    DFP 1.x compatible TMDS
    Maximum image size: 34 cm x 19 cm
    Gamma: 2.20
    DPMS levels: Off
    RGB color display
    First detailed timing is the preferred timing
  Color Characteristics:
    Red  : 0.5654, 0.3300
    Green: 0.3232, 0.5771
    Blue : 0.1601, 0.1445
    White: 0.3134, 0.3291
  Established Timings I & II:
    DMT 0x04:   640x480    59.940476 Hz   4:3     31.469 kHz     25.175000 MHz
    DMT 0x09:   800x600    60.316541 Hz   4:3     37.879 kHz     40.000000 MHz
    DMT 0x10:  1024x768    60.003840 Hz   4:3     48.363 kHz     65.000000 MHz
  Standard Timings: none
  Detailed Timing Descriptors:
    DTD 1:  1920x1080   60.000000 Hz  16:9     66.000 kHz    136.620000 MHz (344 mm x 193 mm)
                 Hfront   44 Hsync  28 Hback   78 Hpol P
                 Vfront    2 Vsync   4 Vback   14 Vpol P
    Display Product Serial Number: ...
    Display Range Limits:
      Monitor ranges (GTF): 15-240 Hz V, 15-127 kHz H, max dotclock 170 MHz
    Display Product Name: '1659W        '
Checksum: 0x5d

----------------

Failures:

Block 0, Base EDID:
  Display Product Serial Number: ...
  Display Product Name: One or more trailing spaces.

EDID conformity: FAIL
