edid-decode (hex):

00 ff ff ff ff ff ff 00 05 e3 59 16 bd 61 bc 00
2e 19 01 03 81 22 13 78 2a 28 65 97 59 54 8e 27
1e 50 54 21 08 00 01 01 01 01 01 01 01 01 01 01
01 01 01 01 01 01 3e 1c 56 a0 50 00 16 30 30 20
36 00 58 c2 10 00 00 1e 00 00 00 ff 00 31 32 33
34 35 36 37 20 20 20 20 20 20 00 00 00 fd 00 0f
f0 0f 7f 11 00 0a 20 20 20 20 20 20 00 00 00 fc
00 31 36 35 39 57 20 20 20 20 20 20 20 20 00 45

----------------

Block 0, Base EDID:
  EDID Structure Version & Revision: 1.3
  Vendor & Product Identification:
    Manufacturer: AOC
    Model: 5721
    Serial Number: ...
    Made in: week 46 of 2015
  Basic Display Parameters & Features:
    Digital display
    DFP 1.x compatible TMDS
    Maximum image size: 34 cm x 19 cm
    Gamma: 2.20
    DPMS levels: Off
    RGB color display
    First detailed timing is preferred timing
  Color Characteristics:
    Red  : 0.5898, 0.3496
    Green: 0.3300, 0.5546
    Blue : 0.1533, 0.1191
    White: 0.3134, 0.3291
  Established Timings I & II:
    DMT 0x04:   640x480    59.940 Hz   4:3    31.469 kHz  25.175 MHz
    DMT 0x09:   800x600    60.317 Hz   4:3    37.879 kHz  40.000 MHz
    DMT 0x10:  1024x768    60.004 Hz   4:3    48.363 kHz  65.000 MHz
  Standard Timings: none
  Detailed Timing Descriptors:
    DTD 1:  1366x768    59.973 Hz 683:384  47.379 kHz  72.300 MHz (344 mm x 194 mm)
                 Hfront   48 Hsync  32 Hback  80 Hpol P
                 Vfront    3 Vsync   6 Vback  13 Vpol P
    Display Product Serial Number: ...
  Display Range Limits:
    Monitor ranges (GTF): 15-240 Hz V, 15-127 kHz H, max dotclock 170 MHz
    Display Product Name: '1659W        '
Checksum: 0x45

----------------

Failures:

Block 0, Base EDID:
  Display Product Serial Number: One or more trailing spaces.
  Display Product Name: One or more trailing spaces.

EDID conformity: FAIL
