
EDID (hex):
00ffffffffffff0030e4180400000000
00170103a01f1178024295a15a579427
0d505400000001010101010101010101
010101010101e45c00a0a0a011503020
230036ae1000001a0000000000000000
00000000000000000000000000fe004c
4720446973706c61790a2020000000fe
004c503134305148312d5350413200bd

Extracted contents:
header:          00 ff ff ff ff ff ff 00
serial number:   30 e4 18 04 00 00 00 00 00 17
version:         01 03
basic params:    a0 1f 11 78 02
chroma info:     42 95 a1 5a 57 94 27 0d 50 54
established:     00 00 00
standard:        01 01 01 01 01 01 01 01 01 01 01 01 01 01 01 01
descriptor 1:    e4 5c 00 a0 a0 a0 11 50 30 20 23 00 36 ae 10 00 00 1a
descriptor 2:    00 00 00 00 00 00 00 00 00 00 00 00 00 00 00 00 00 00
descriptor 3:    00 00 00 fe 00 4c 47 20 44 69 73 70 6c 61 79 0a 20 20
descriptor 4:    00 00 00 fe 00 4c 50 31 34 30 51 48 31 2d 53 50 41 32
extensions:      00
checksum:        bd

EDID version: 1.3
Manufacturer: LGD Model 418 Serial Number --
Made in year 2013
Digital display
Maximum image size: 31 cm x 17 cm
Gamma: 2.20
Monochrome or grayscale display
First detailed timing is preferred timing
Display x,y Chromaticity:
  Red:   0.6298, 0.3515
  Green: 0.3398, 0.5800
  Blue:  0.1542, 0.0517
  White: 0.3134, 0.3291
Established timings supported:
Standard timings supported:
Detailed mode: Clock 237.800 MHz, 310 mm x 174 mm
               2560 2608 2640 2720 hborder 0
               1440 1442 1445 1457 vborder 0
               +hsync -vsync 
               VertFreq: 60 Hz, HorFreq: 87426 Hz
Manufacturer-specified data, tag 0
ASCII string: LG Display
ASCII string: LP140QH1-SPA2
Checksum: 0xbd (valid)
EDID block does NOT conform to EDID 1.3!
	Digital display field contains garbage: 20
	Missing name descriptor
	Missing monitor ranges
