
EDID (hex):
00ffffffffffff0030e4ef0300000000
00160104a0160d7802ede5985a559126
1e505400000001010101010101010101
010101010101201c56a0500016303020
3500df7d000000190000000000000000
00000000000000000000000000fe004c
4720446973706c61790a2020000000fe
004c503130315748342d534c41420025

edid-decode (hex):

00 ff ff ff ff ff ff 00 30 e4 ef 03 00 00 00 00
00 16 01 04 a0 16 0d 78 02 ed e5 98 5a 55 91 26
1e 50 54 00 00 00 01 01 01 01 01 01 01 01 01 01
01 01 01 01 01 01 20 1c 56 a0 50 00 16 30 30 20
35 00 df 7d 00 00 00 19 00 00 00 00 00 00 00 00
00 00 00 00 00 00 00 00 00 00 00 00 00 fe 00 4c
47 20 44 69 73 70 6c 61 79 0a 20 20 00 00 00 fe
00 4c 50 31 30 31 57 48 34 2d 53 4c 41 42 00 25

----------------

Block 0, Base EDID:
  EDID Structure Version & Revision: 1.4
  Vendor & Product Identification:
    Manufacturer: LGD
    Model: 1007
    Made in: 2012
  Basic Display Parameters & Features:
    Digital display
    Bits per primary color channel: 8
    Digital interface is not defined
    Maximum image size: 22 cm x 13 cm
    Gamma: 2.20
    Supported color formats: RGB 4:4:4
    First detailed timing includes the native pixel format and preferred refresh rate
  Color Characteristics:
    Red  : 0.5966, 0.3535
    Green: 0.3349, 0.5673
    Blue : 0.1513, 0.1191
    White: 0.3134, 0.3291
  Established Timings I & II: none
  Standard Timings: none
  Detailed Timing Descriptors:
    DTD 1:  1366x768    59.724273 Hz 683:384   47.182 kHz     72.000000 MHz (223 mm x 125 mm)
                 Hfront   48 Hsync  32 Hback   80 Hpol N
                 Vfront    3 Vsync   5 Vback   14 Vpol N
    Empty Descriptor
    Alphanumeric Data String: 'LG Display'
    Alphanumeric Data String: 'LP101WH4-SLAB'
Checksum: 0x25
