edid-decode (hex):

00 ff ff ff ff ff ff 00 0d ae e8 15 00 00 00 00
1f 1c 01 04 95 22 13 78 03 ee 95 a3 54 4c 99 26
0f 50 54 00 00 00 01 01 01 01 01 01 01 01 01 01
01 01 01 01 01 01 b4 3b 80 4a 71 38 34 40 50 36
68 00 58 c1 10 00 00 1a cd 27 80 4a 71 38 34 40
50 36 68 00 58 c1 10 00 00 1a 00 00 00 00 00 00
00 00 00 00 00 00 00 00 00 00 00 00 00 00 00 02
00 0c 33 ff 0f 3c 96 14 0f 25 96 00 00 00 00 6f

----------------

Block 0, Base EDID:
  EDID Structure Version & Revision: 1.4
  Vendor & Product Identification:
    Manufacturer: CMN
    Model: 5608
    Made in: week 31 of 2018
  Basic Display Parameters & Features:
    Digital display
    Bits per primary color channel: 6
    DisplayPort interface
    Maximum image size: 34 cm x 19 cm
    Gamma: 2.20
    Supported color formats: RGB 4:4:4
    First detailed timing includes the native pixel format and preferred refresh rate
    Display is continuous frequency
  Color Characteristics:
    Red  : 0.6396, 0.3300
    Green: 0.2998, 0.5996
    Blue : 0.1503, 0.0595
    White: 0.3134, 0.3291
  Established Timings I & II: none
  Standard Timings: none
  Detailed Timing Descriptors:
    DTD 1:  1920x1080   60.007852 Hz  16:9     67.929 kHz    152.840000 MHz (344 mm x 193 mm)
                 Hfront   80 Hsync  54 Hback  196 Hpol P
                 Vfront    6 Vsync   8 Vback   38 Vpol N
    DTD 2:  1920x1080   40.003926 Hz  16:9     45.284 kHz    101.890000 MHz (344 mm x 193 mm)
                 Hfront   80 Hsync  54 Hback  196 Hpol P
                 Vfront    6 Vsync   8 Vback   38 Vpol N
    Empty Descriptor
    Manufacturer-Specified Display Descriptor (0x02): 00 02 00 0c 33 ff 0f 3c 96 14 0f 25 96 00 00 00 '....3..<...%....'
Checksum: 0x6f

----------------

Warnings:

Block 0, Base EDID:
  Missing Display Product Name.

Failures:

Block 0, Base EDID:
  Empty Descriptor: Use Dummy Descriptor instead of all zeroes.
  Missing Display Range Limits Descriptor.

EDID conformity: FAIL
