edid-decode (hex):

00 ff ff ff ff ff ff 00 22 0e 3a 37 00 00 00 00
01 20 01 04 b5 3c 22 78 3b 10 85 ae 50 49 a5 26
12 50 54 a5 4b 00 d1 c0 a9 c0 81 c0 d1 00 b3 00
95 00 81 00 a9 40 56 5e 00 a0 a0 a0 29 50 30 20
35 00 55 50 21 00 00 1a 00 00 00 fd 0c 3c f0 6b
6b 6a 01 0a 20 20 20 20 20 20 00 00 00 fc 00 4f
4d 45 4e 20 32 37 63 0a 20 20 20 20 00 00 00 ff
00 43 4e 4b 32 30 31 30 48 58 56 0a 20 20 02 3b

02 03 38 f1 47 10 3f 40 04 03 02 01 23 09 07 07
83 01 00 00 6d 1a 00 00 02 0b 3c f0 00 07 6a 0b
6c 19 e6 06 07 01 6a 6c 2f e3 05 e3 81 e2 00 eb
67 03 0c 00 10 00 38 d3 5a a0 00 a0 a0 a0 46 50
30 20 35 00 55 50 21 00 00 1a 6f c2 00 a0 a0 a0
55 50 30 20 35 00 55 50 21 00 00 1a e8 e4 00 50
a0 a0 67 50 30 20 98 04 55 50 21 00 00 1a 00 00
00 00 00 00 00 00 00 00 00 00 00 00 00 00 00 01

70 12 79 00 00 03 01 64 9e 96 01 88 ff 09 3f 01
7f 80 1f 00 9f 05 41 00 06 00 08 00 3d 11 01 88
ff 09 9f 00 2f 80 1f 00 9f 05 76 00 02 00 04 00
a0 dd 00 88 7f 07 77 00 1b 80 1f 00 37 04 4f 00
38 00 07 00 69 6b 00 88 ff 09 4f 00 07 80 1f 00
9f 05 2f 00 21 00 07 00 a3 9c 00 88 7f 07 9f 00
2f 80 1f 00 37 04 58 00 02 00 04 00 00 00 00 00
00 00 00 00 00 00 00 00 00 00 00 00 00 00 5f 90

00 ff ff ff ff ff ff 00 22 0e 3a 37 00 00 00 00
01 20 01 04 b5 3c 22 78 3b 10 85 ae 50 49 a5 26
12 50 54 a5 4b 00 d1 c0 a9 c0 81 c0 d1 00 b3 00
95 00 81 00 a9 40 56 5e 00 a0 a0 a0 29 50 30 20
35 00 55 50 21 00 00 1a 00 00 00 fd 0c 3c f0 6b
6b 6a 01 0a 20 20 20 20 20 20 00 00 00 fc 00 4f
4d 45 4e 20 32 37 63 0a 20 20 20 20 00 00 00 ff
00 43 4e 4b 32 30 31 30 48 58 56 0a 20 20 02 3b

02 03 38 f1 47 10 3f 40 04 03 02 01 23 09 07 07
83 01 00 00 6d 1a 00 00 02 0b 3c f0 00 07 6a 0b
6c 19 e6 06 07 01 6a 6c 2f e3 05 e3 81 e2 00 eb
67 03 0c 00 10 00 38 d3 5a a0 00 a0 a0 a0 46 50
30 20 35 00 55 50 21 00 00 1a 6f c2 00 a0 a0 a0
55 50 30 20 35 00 55 50 21 00 00 1a e8 e4 00 50
a0 a0 67 50 30 20 98 04 55 50 21 00 00 1a 00 00
00 00 00 00 00 00 00 00 00 00 00 00 00 00 00 01

70 12 79 00 00 03 01 64 9e 96 01 88 ff 09 3f 01
7f 80 1f 00 9f 05 41 00 06 00 08 00 3d 11 01 88
ff 09 9f 00 2f 80 1f 00 9f 05 76 00 02 00 04 00
a0 dd 00 88 7f 07 77 00 1b 80 1f 00 37 04 4f 00
38 00 07 00 69 6b 00 88 ff 09 4f 00 07 80 1f 00
9f 05 2f 00 21 00 07 00 a3 9c 00 88 7f 07 9f 00
2f 80 1f 00 37 04 58 00 02 00 04 00 00 00 00 00
00 00 00 00 00 00 00 00 00 00 00 00 00 00 5f 90

----------------

Block 0, Base EDID:
  EDID Structure Version & Revision: 1.4
  Vendor & Product Identification:
    Manufacturer: HPN
    Model: 14138
    Made in: week 1 of 2022
  Basic Display Parameters & Features:
    Digital display
    Bits per primary color channel: 10
    DisplayPort interface
    Maximum image size: 60 cm x 34 cm
    Gamma: 2.20
    DPMS levels: Off
    Supported color formats: RGB 4:4:4, YCrCb 4:4:4, YCrCb 4:2:2
    First detailed timing includes the native pixel format and preferred refresh rate
    Display is continuous frequency
  Color Characteristics:
    Red  : 0.6796, 0.3134
    Green: 0.2851, 0.6445
    Blue : 0.1503, 0.0703
    White: 0.3134, 0.3291
  Established Timings I & II:
    IBM     :   720x400    70.081663 Hz   9:5     31.467 kHz     28.320000 MHz
    DMT 0x04:   640x480    59.940476 Hz   4:3     31.469 kHz     25.175000 MHz
    DMT 0x06:   640x480    75.000000 Hz   4:3     37.500 kHz     31.500000 MHz
    DMT 0x09:   800x600    60.316541 Hz   4:3     37.879 kHz     40.000000 MHz
    DMT 0x0b:   800x600    75.000000 Hz   4:3     46.875 kHz     49.500000 MHz
    DMT 0x10:  1024x768    60.003840 Hz   4:3     48.363 kHz     65.000000 MHz
    DMT 0x12:  1024x768    75.028582 Hz   4:3     60.023 kHz     78.750000 MHz
    DMT 0x24:  1280x1024   75.024675 Hz   5:4     79.976 kHz    135.000000 MHz
  Standard Timings:
    DMT 0x52:  1920x1080   60.000000 Hz  16:9     67.500 kHz    148.500000 MHz
    DMT 0x53:  1600x900    60.000000 Hz  16:9     60.000 kHz    108.000000 MHz (RB)
    DMT 0x55:  1280x720    60.000000 Hz  16:9     45.000 kHz     74.250000 MHz
    DMT 0x45:  1920x1200   59.884600 Hz  16:10    74.556 kHz    193.250000 MHz
    DMT 0x3a:  1680x1050   59.954250 Hz  16:10    65.290 kHz    146.250000 MHz
    DMT 0x2f:  1440x900    59.887445 Hz  16:10    55.935 kHz    106.500000 MHz
    DMT 0x1c:  1280x800    59.810326 Hz  16:10    49.702 kHz     83.500000 MHz
    DMT 0x33:  1600x1200   60.000000 Hz   4:3     75.000 kHz    162.000000 MHz
  Detailed Timing Descriptors:
    DTD 1:  2560x1440   59.950550 Hz  16:9     88.787 kHz    241.500000 MHz (597 mm x 336 mm)
                 Hfront   48 Hsync  32 Hback   80 Hpol P
                 Vfront    3 Vsync   5 Vback   33 Vpol N
    Display Range Limits:
      Monitor ranges (Bare Limits): 60-240 Hz V, 362-362 kHz H, max dotclock 1060 MHz
    Display Product Name: 'OMEN 27c'
    Display Product Serial Number: ...
  Extension blocks: 2
Checksum: 0x3b

----------------

Block 1, CTA-861 Extension Block:
  Revision: 3
  Underscans IT Video Formats by default
  Basic audio support
  Supports YCbCr 4:4:4
  Supports YCbCr 4:2:2
  Native detailed modes: 1
  Video Data Block:
    VIC  16:  1920x1080   60.000000 Hz  16:9     67.500 kHz    148.500000 MHz
    VIC  63:  1920x1080  120.000000 Hz  16:9    135.000 kHz    297.000000 MHz
    VIC  64:  1920x1080  100.000000 Hz  16:9    112.500 kHz    297.000000 MHz
    VIC   4:  1280x720    60.000000 Hz  16:9     45.000 kHz     74.250000 MHz
    VIC   3:   720x480    59.940060 Hz  16:9     31.469 kHz     27.000000 MHz
    VIC   2:   720x480    59.940060 Hz   4:3     31.469 kHz     27.000000 MHz
    VIC   1:   640x480    59.940476 Hz   4:3     31.469 kHz     25.175000 MHz
  Audio Data Block:
    Linear PCM:
      Max channels: 2
      Supported sample rates (kHz): 48 44.1 32
      Supported sample sizes (bits): 24 20 16
  Speaker Allocation Data Block:
    FL/FR - Front Left/Right
  Vendor-Specific Data Block (AMD), OUI 00-00-1A:
    Version: 2.11
    Minimum Refresh Rate: 60 Hz
    Maximum Refresh Rate: 240 Hz
    Flags 1.x: 0x00
    Flags 2.x: 0x07
    Maximum luminance: 106 (496.743 cd/m^2)
    Minimum luminance: 11 (0.009 cd/m^2)
    Maximum luminance (without local dimming): 108 (518.736 cd/m^2)
    Minimum luminance (without local dimming): 25 (0.050 cd/m^2)
  HDR Static Metadata Data Block:
    Electro optical transfer functions:
      Traditional gamma - SDR luminance range
      Traditional gamma - HDR luminance range
      SMPTE ST2084
    Supported static metadata descriptors:
      Static metadata type 1
    Desired content max luminance: 106 (496.743 cd/m^2)
    Desired content max frame-average luminance: 108 (518.736 cd/m^2)
    Desired content min luminance: 47 (0.169 cd/m^2)
  Colorimetry Data Block:
    xvYCC601
    xvYCC709
    BT2020cYCC
    BT2020YCC
    BT2020RGB
    Gamut Boundary Description Metadata Profile P0
    ST2113RGB
  Video Capability Data Block:
    YCbCr quantization: Selectable (via AVI YQ)
    RGB quantization: Selectable (via AVI Q)
    PT scan behavior: Always Underscanned
    IT scan behavior: Always Underscanned
    CE scan behavior: Supports both over- and underscan
  Vendor-Specific Data Block (HDMI), OUI 00-0C-03:
    Source physical address: 1.0.0.0
    DC_36bit
    DC_30bit
    DC_Y444
    Maximum TMDS clock: 1055 MHz
  Detailed Timing Descriptors:
    DTD 2:  2560x1440   99.946436 Hz  16:9    150.919 kHz    410.500000 MHz (597 mm x 336 mm)
                 Hfront   48 Hsync  32 Hback   80 Hpol P
                 Vfront    3 Vsync   5 Vback   62 Vpol N
    DTD 3:  2560x1440  119.997589 Hz  16:9    182.996 kHz    497.750000 MHz (597 mm x 336 mm)
                 Hfront   48 Hsync  32 Hback   80 Hpol P
                 Vfront    3 Vsync   5 Vback   77 Vpol N
    DTD 4:  2560x1440  143.855928 Hz  16:9    221.970 kHz    586.000000 MHz (597 mm x 336 mm)
                 Hfront   48 Hsync  32 Hback    0 Hpol P
                 Vfront   25 Vsync   8 Vback   70 Vpol N
Checksum: 0x01  Unused space in Extension Block: 17 bytes

----------------

Block 2, DisplayID Extension Block:
  Version: 1.2
  Extension Count: 0
  Display Product Type: Extension Section
  Video Timing Modes Type 1 - Detailed Timings Data Block:
    DTD:  2560x1440  240.000646 Hz   0:0    361.441 kHz   1040.950000 MHz (aspect undefined, no 3D stereo, preferred)
               Hfront  128 Hsync  32 Hback  160 Hpol P
               Vfront    7 Vsync   9 Vback   50 Vpol N
    DTD:  2560x1440  164.957741 Hz   0:0    257.169 kHz    699.500000 MHz (aspect undefined, no 3D stereo, preferred)
               Hfront   48 Hsync  32 Hback   80 Hpol P
               Vfront    3 Vsync   5 Vback  111 Vpol N
    DTD:  1920x1080  239.760818 Hz   0:0    278.123 kHz    567.370000 MHz (aspect undefined, no 3D stereo, preferred)
               Hfront   28 Hsync  32 Hback   60 Hpol P
               Vfront   57 Vsync   8 Vback   15 Vpol N
    DTD:  2560x1440   69.999389 Hz   0:0    104.159 kHz    274.980000 MHz (aspect undefined, no 3D stereo, preferred)
               Hfront    8 Hsync  32 Hback   40 Hpol P
               Vfront   34 Vsync   8 Vback    6 Vpol N
    DTD:  1920x1080  164.917418 Hz   0:0    192.788 kHz    401.000000 MHz (aspect undefined, no 3D stereo, preferred)
               Hfront   48 Hsync  32 Hback   80 Hpol P
               Vfront    3 Vsync   5 Vback   81 Vpol N
  Checksum: 0x5f
Checksum: 0x90

----------------

Block 3, Unknown EDID Extension Block 0x00:
  00 ff ff ff ff ff ff 00 22 0e 3a 37 00 00 00 00 '........".:7....'
  01 20 01 04 b5 3c 22 78 3b 10 85 ae 50 49 a5 26 '. ...<"x;...PI.&'
  12 50 54 a5 4b 00 d1 c0 a9 c0 81 c0 d1 00 b3 00 '.PT.K...........'
  95 00 81 00 a9 40 56 5e 00 a0 a0 a0 29 50 30 20 '.....@V^....)P0 '
  35 00 55 50 21 00 00 1a 00 00 00 fd 0c 3c f0 6b '5.UP!........<.k'
  6b 6a 01 0a 20 20 20 20 20 20 00 00 00 fc 00 4f 'kj..      .....O'
  4d 45 4e 20 32 37 63 0a 20 20 20 20 00 00 00 ff 'MEN 27c.    ....'
  00 43 4e 4b 32 30 31 30 48 58 56 0a 20 20 02 3b '.CNK2010HXV.  .;'
Checksum: 0x3b

----------------

Block 4, CTA-861 Extension Block:
  Revision: 3
  Underscans IT Video Formats by default
  Basic audio support
  Supports YCbCr 4:4:4
  Supports YCbCr 4:2:2
  Native detailed modes: 1
  Video Data Block:
    VIC  16:  1920x1080   60.000000 Hz  16:9     67.500 kHz    148.500000 MHz
    VIC  63:  1920x1080  120.000000 Hz  16:9    135.000 kHz    297.000000 MHz
    VIC  64:  1920x1080  100.000000 Hz  16:9    112.500 kHz    297.000000 MHz
    VIC   4:  1280x720    60.000000 Hz  16:9     45.000 kHz     74.250000 MHz
    VIC   3:   720x480    59.940060 Hz  16:9     31.469 kHz     27.000000 MHz
    VIC   2:   720x480    59.940060 Hz   4:3     31.469 kHz     27.000000 MHz
    VIC   1:   640x480    59.940476 Hz   4:3     31.469 kHz     25.175000 MHz
  Audio Data Block:
    Linear PCM:
      Max channels: 2
      Supported sample rates (kHz): 48 44.1 32
      Supported sample sizes (bits): 24 20 16
  Speaker Allocation Data Block:
    FL/FR - Front Left/Right
  Vendor-Specific Data Block (AMD), OUI 00-00-1A:
    Version: 2.11
    Minimum Refresh Rate: 60 Hz
    Maximum Refresh Rate: 240 Hz
    Flags 1.x: 0x00
    Flags 2.x: 0x07
    Maximum luminance: 106 (496.743 cd/m^2)
    Minimum luminance: 11 (0.009 cd/m^2)
    Maximum luminance (without local dimming): 108 (518.736 cd/m^2)
    Minimum luminance (without local dimming): 25 (0.050 cd/m^2)
  HDR Static Metadata Data Block:
    Electro optical transfer functions:
      Traditional gamma - SDR luminance range
      Traditional gamma - HDR luminance range
      SMPTE ST2084
    Supported static metadata descriptors:
      Static metadata type 1
    Desired content max luminance: 106 (496.743 cd/m^2)
    Desired content max frame-average luminance: 108 (518.736 cd/m^2)
    Desired content min luminance: 47 (0.169 cd/m^2)
  Colorimetry Data Block:
    xvYCC601
    xvYCC709
    BT2020cYCC
    BT2020YCC
    BT2020RGB
    Gamut Boundary Description Metadata Profile P0
    ST2113RGB
  Video Capability Data Block:
    YCbCr quantization: Selectable (via AVI YQ)
    RGB quantization: Selectable (via AVI Q)
    PT scan behavior: Always Underscanned
    IT scan behavior: Always Underscanned
    CE scan behavior: Supports both over- and underscan
  Vendor-Specific Data Block (HDMI), OUI 00-0C-03:
    Source physical address: 1.0.0.0
    DC_36bit
    DC_30bit
    DC_Y444
    Maximum TMDS clock: 1055 MHz
  Detailed Timing Descriptors:
    DTD 5:  2560x1440   99.946436 Hz  16:9    150.919 kHz    410.500000 MHz (597 mm x 336 mm)
                 Hfront   48 Hsync  32 Hback   80 Hpol P
                 Vfront    3 Vsync   5 Vback   62 Vpol N
    DTD 6:  2560x1440  119.997589 Hz  16:9    182.996 kHz    497.750000 MHz (597 mm x 336 mm)
                 Hfront   48 Hsync  32 Hback   80 Hpol P
                 Vfront    3 Vsync   5 Vback   77 Vpol N
    DTD 7:  2560x1440  143.855928 Hz  16:9    221.970 kHz    586.000000 MHz (597 mm x 336 mm)
                 Hfront   48 Hsync  32 Hback    0 Hpol P
                 Vfront   25 Vsync   8 Vback   70 Vpol N
Checksum: 0x01  Unused space in Extension Block: 17 bytes

----------------

Block 5, DisplayID Extension Block:
  Version: 1.2
  Extension Count: 0
  Video Timing Modes Type 1 - Detailed Timings Data Block:
    DTD:  2560x1440  240.000646 Hz   0:0    361.441 kHz   1040.950000 MHz (aspect undefined, no 3D stereo, preferred)
               Hfront  128 Hsync  32 Hback  160 Hpol P
               Vfront    7 Vsync   9 Vback   50 Vpol N
    DTD:  2560x1440  164.957741 Hz   0:0    257.169 kHz    699.500000 MHz (aspect undefined, no 3D stereo, preferred)
               Hfront   48 Hsync  32 Hback   80 Hpol P
               Vfront    3 Vsync   5 Vback  111 Vpol N
    DTD:  1920x1080  239.760818 Hz   0:0    278.123 kHz    567.370000 MHz (aspect undefined, no 3D stereo, preferred)
               Hfront   28 Hsync  32 Hback   60 Hpol P
               Vfront   57 Vsync   8 Vback   15 Vpol N
    DTD:  2560x1440   69.999389 Hz   0:0    104.159 kHz    274.980000 MHz (aspect undefined, no 3D stereo, preferred)
               Hfront    8 Hsync  32 Hback   40 Hpol P
               Vfront   34 Vsync   8 Vback    6 Vpol N
    DTD:  1920x1080  164.917418 Hz   0:0    192.788 kHz    401.000000 MHz (aspect undefined, no 3D stereo, preferred)
               Hfront   48 Hsync  32 Hback   80 Hpol P
               Vfront    3 Vsync   5 Vback   81 Vpol N
  Checksum: 0x5f
Checksum: 0x90

----------------

Warnings:

Block 1, CTA-861 Extension Block:
  Colorimetry Data Block: Set the sRGB colorimetry bit to avoid interop issues.
Block 4, CTA-861 Extension Block:
  Colorimetry Data Block: Set the sRGB colorimetry bit to avoid interop issues.
EDID:
  Base EDID: Some timings are out of range of the Monitor Ranges:
    Horizontal Freq: 31.466 - 361.440 kHz (Monitor: 362.000 - 362.000 kHz)

Failures:

Block 1, CTA-861 Extension Block:
  Vendor-Specific Data Block (HDMI), OUI 00-0C-03: HDMI VSDB Max TMDS rate is > 340.
  Vendor-Specific Data Block (HDMI), OUI 00-0C-03: The HDMI Specification requires EDID 1.3 instead of 1.4.
  Detailed Timing Descriptor #4: 0 or negative horizontal back porch.
Block 2, DisplayID Extension Block:
  DisplayID Base Block has no product type.
  Expected 0 DisplayID Extension Block, but got 1.
Block 3, Base EDID:
  Unknown Extension Block.
Block 4, CTA-861 Extension Block:
  Video Data Block: Duplicate VIC 16.
  Video Data Block: Duplicate VIC 63.
  Video Data Block: Duplicate VIC 64.
  Video Data Block: Duplicate VIC 4.
  Video Data Block: Duplicate VIC 3.
  Video Data Block: Duplicate VIC 2.
  Video Data Block: Duplicate VIC 1.
  Speaker Allocation Data Block: Only one instance of this Data Block is allowed.
  HDR Static Metadata Data Block: Only one instance of this Data Block is allowed.
  Colorimetry Data Block: Only one instance of this Data Block is allowed.
  Video Capability Data Block: Only one instance of this Data Block is allowed.
  Vendor-Specific Data Block (HDMI), OUI 00-0C-03: HDMI VSDB Max TMDS rate is > 340.
  Vendor-Specific Data Block (HDMI), OUI 00-0C-03: The HDMI Specification requires EDID 1.3 instead of 1.4.
  Detailed Timing Descriptor #7: 0 or negative horizontal back porch.
EDID:
  Base EDID: EDID specified 2 extension block(s), but found 5 extension block(s).
  DisplayID: Missing DisplayID Product Identification Data Block.

EDID conformity: FAIL
