
EDID (hex):
00ffffffffffff00367f3c0000000000
141f0102951f11780ea0149d53578926
28525800000001010101010101010101
010101010101ce1d56e250001e303020
360035ad10000019000000fe00485344
20313930332d41303020000000fe0048
534420313930332d41303020000000fe
0048534420313930332d41303020008e

edid-decode (hex):

00 ff ff ff ff ff ff 00 36 7f 3c 00 00 00 00 00
14 1f 01 02 95 1f 11 78 0e a0 14 9d 53 57 89 26
28 52 58 00 00 00 01 01 01 01 01 01 01 01 01 01
01 01 01 01 01 01 ce 1d 56 e2 50 00 1e 30 30 20
36 00 35 ad 10 00 00 19 00 00 00 fe 00 48 53 44
20 31 39 30 33 2d 41 30 30 20 00 00 00 fe 00 48
53 44 20 31 39 30 33 2d 41 30 30 20 00 00 00 fe
00 48 53 44 20 31 39 30 33 2d 41 30 30 20 00 8e

----------------

Block 0, Base EDID:
  EDID Structure Version & Revision: 1.2
  Vendor & Product Identification:
    Manufacturer: MS_
    Model: 60
    Made in: week 20 of 2021
  Basic Display Parameters & Features:
    Digital display
    DFP 1.x compatible TMDS
    Maximum image size: 31 cm x 17 cm
    Gamma: 2.20
    RGB color display
    Default (sRGB) color space is primary color space
    First detailed timing is the preferred timing
  Color Characteristics:
    Red  : 0.6152, 0.3261
    Green: 0.3398, 0.5351
    Blue : 0.1484, 0.1572
    White: 0.3212, 0.3437
  Established Timings I & II: none
  Standard Timings: none
  Detailed Timing Descriptors:
    DTD 1:  1366x768    60.059067 Hz 683:384   47.927 kHz     76.300000 MHz (309 mm x 173 mm)
                 Hfront   48 Hsync  32 Hback  146 Hpol N
                 Vfront    3 Vsync   6 Vback   21 Vpol N
    Alphanumeric Data String: 'HSD 1903-A00 '
    Alphanumeric Data String: 'HSD 1903-A00 '
    Alphanumeric Data String: 'HSD 1903-A00 '
Checksum: 0x8e
