
EDID (hex):
00ffffffffffff0015c3892301010101
3017010368342178ea01f5a257529f27
0a5054210800a94081808140b30081c0
0101010101017d4b80a072b02d4088c8
360007442100001c000000ff00363431
38363131330a20202020000000fd0037
3d1f4c15000a202020202020000000fc
00455632343136570a202020202000c5

Extracted contents:
header:          00 ff ff ff ff ff ff 00
serial number:   15 c3 89 23 01 01 01 01 30 17
version:         01 03
basic params:    68 34 21 78 ea
chroma info:     01 f5 a2 57 52 9f 27 0a 50 54
established:     21 08 00
standard:        a9 40 81 80 81 40 b3 00 81 c0 01 01 01 01 01 01
descriptor 1:    7d 4b 80 a0 72 b0 2d 40 88 c8 36 00 07 44 21 00 00 1c
descriptor 2:    00 00 00 ff 00 36 34 31 38 36 31 31 33 0a 20 20 20 20
descriptor 3:    00 00 00 fd 00 37 3d 1f 4c 15 00 0a 20 20 20 20 20 20
descriptor 4:    00 00 00 fc 00 45 56 32 34 31 36 57 0a 20 20 20 20 20
extensions:      00
checksum:        c5

EDID version: 1.3
Manufacturer: ENC Model 2389 Serial Number --
Made in week 48 of 2013
Analog display, Input voltage level: 0.7/0.7 V
Sync: Separate 
Maximum image size: 52 cm x 33 cm
Gamma: 2.20
DPMS levels: Standby Suspend Off
RGB color display
First detailed timing is preferred timing
Display x,y Chromaticity:
  Red:   0.6328, 0.3398
  Green: 0.3203, 0.6220
  Blue:  0.1552, 0.0419
  White: 0.3134, 0.3291
Established timings supported:
  640x480@60Hz 4:3 HorFreq: 31469 Hz Clock: 25.175 MHz
  800x600@60Hz 4:3 HorFreq: 37900 Hz Clock: 40.000 MHz
  1024x768@60Hz 4:3 HorFreq: 48400 Hz Clock: 65.000 MHz
Standard timings supported:
  1600x1200@60Hz 4:3 HorFreq: 75000 Hz Clock: 162.000 MHz
  1280x1024@60Hz 5:4 HorFreq: 64000 Hz Clock: 108.000 MHz
  1280x960@60Hz 4:3 HorFreq: 60000 Hz Clock: 108.000 MHz
  1680x1050@60Hz 16:10 HorFreq: 64700 Hz Clock: 119.000 MHz
  1280x720@60Hz 16:9
Detailed mode: Clock 193.250 MHz, 519 mm x 324 mm
               1920 2056 2256 2592 hborder 0
               1200 1203 1209 1245 vborder 0
               -hsync +vsync 
               VertFreq: 59 Hz, HorFreq: 74556 Hz
Serial number: --
Monitor ranges (GTF): 55-61Hz V, 31-76kHz H, max dotclock 210MHz
Monitor name: EV2416W
Checksum: 0xc5 (valid)


