edid-decode (hex):

00 ff ff ff ff ff ff 00 2d cb 40 15 01 00 00 00
28 1b 01 03 08 1e 1a 78 2e 3d 85 a6 56 4a 9a 24
12 50 54 21 08 00 81 c0 81 00 81 00 81 00 61 40
45 40 01 01 01 01 9e 20 00 90 51 20 1f 30 2a 80
36 00 96 5e 00 00 00 1e 0e 1f 00 80 51 00 1e 30
40 80 37 00 96 5e 00 00 00 1e 64 19 00 40 41 00
26 30 18 88 36 00 96 5e 00 00 00 1e 00 00 00 fc
00 4c 50 31 35 34 0a 20 20 20 20 20 20 20 00 4b

----------------

Block 0, Base EDID:
  EDID Structure Version & Revision: 1.3
  Vendor & Product Identification:
    Manufacturer: KNK
    Model: 5440
    Serial Number: ...
    Made in: week 40 of 2017
  Basic Display Parameters & Features:
    Analog display
    Input voltage level: 0.7/0.3 V
    Sync: Separate
    Maximum image size: 30 cm x 26 cm
    Gamma: 2.20
    DPMS levels: Off
    RGB color display
    Default (sRGB) color space is primary color space
    First detailed timing is preferred timing
  Color Characteristics:
    Red  : 0.6484, 0.3388
    Green: 0.2919, 0.6025
    Blue : 0.1425, 0.0703
    White: 0.3134, 0.3291
  Established Timings I & II:
    DMT 0x04:   640x480    59.940 Hz   4:3    31.469 kHz  25.175 MHz
    DMT 0x09:   800x600    60.317 Hz   4:3    37.879 kHz  40.000 MHz
    DMT 0x10:  1024x768    60.004 Hz   4:3    48.363 kHz  65.000 MHz
  Standard Timings:
    DMT 0x55:  1280x720    60.000 Hz  16:9    45.000 kHz  74.250 MHz
    DMT 0x1c:  1280x800    59.810 Hz  16:10   49.702 kHz  83.500 MHz
    DMT 0x1c:  1280x800    59.810 Hz  16:10   49.702 kHz  83.500 MHz
    DMT 0x1c:  1280x800    59.810 Hz  16:10   49.702 kHz  83.500 MHz
    DMT 0x10:  1024x768    60.004 Hz   4:3    48.363 kHz  65.000 MHz
    DMT 0x09:   800x600    60.317 Hz   4:3    37.879 kHz  40.000 MHz
  Detailed Timing Descriptors:
    DTD 1:  1280x800    59.810 Hz   8:5    49.702 kHz  83.500 MHz (150 mm x 94 mm)
                 Hfront   42 Hsync 128 Hback 230 Hpol P
                 Vfront    3 Vsync   6 Vback  22 Vpol P
    DTD 2:  1280x768    59.870 Hz   5:3    47.776 kHz  79.500 MHz (150 mm x 94 mm)
                 Hfront   64 Hsync 128 Hback 192 Hpol P
                 Vfront    3 Vsync   7 Vback  20 Vpol P
    DTD 3:  1024x768    60.004 Hz   4:3    48.363 kHz  65.000 MHz (150 mm x 94 mm)
                 Hfront   24 Hsync 136 Hback 160 Hpol P
                 Vfront    3 Vsync   6 Vback  29 Vpol P
    Display Product Name: 'LP154'
Checksum: 0x4b

----------------

Failures:

Block 0, Base EDID:
  Basic Display Parameters & Features: sRGB is signaled, but the chromaticities do not match.
  Detailed Timing Descriptor #1: Mismatch of image size 150x94 mm vs display size 300x260 mm.
  Detailed Timing Descriptor #2: Mismatch of image size 150x94 mm vs display size 300x260 mm.
  Detailed Timing Descriptor #3: Mismatch of image size 150x94 mm vs display size 300x260 mm.
  Missing Display Range Limits Descriptor.

EDID conformity: FAIL
