
EDID (hex):
00ffffffffffff0022f0a62600000080
13120103682b1b78eecfc5a35a49a025
125054a56b807100814081809500b300
01010101010121399030621a274068b0
3600b10f1100001c000000ff00434e43
3831394c37585a0a2020000000fd0037
4c185311000a202020202020000000fc
0048502077323030370a202020200095

Extracted contents:
header:          00 ff ff ff ff ff ff 00
serial number:   22 f0 a6 26 00 00 00 80 13 12
version:         01 03
basic params:    68 2b 1b 78 ee
chroma info:     cf c5 a3 5a 49 a0 25 12 50 54
established:     a5 6b 80
standard:        71 00 81 40 81 80 95 00 b3 00 01 01 01 01 01 01
descriptor 1:    21 39 90 30 62 1a 27 40 68 b0 36 00 b1 0f 11 00 00 1c
descriptor 2:    00 00 00 ff 00 43 4e 43 38 31 39 4c 37 58 5a 0a 20 20
descriptor 3:    00 00 00 fd 00 37 4c 18 53 11 00 0a 20 20 20 20 20 20
descriptor 4:    00 00 00 fc 00 48 50 20 77 32 30 30 37 0a 20 20 20 20
extensions:      00
checksum:        95

EDID version: 1.3
Manufacturer: HWP Model 26a6 Serial Number --
Made in week 19 of 2008
Analog display, Input voltage level: 0.7/0.7 V
Sync: Separate 
Maximum image size: 43 cm x 27 cm
Gamma: 2.20
DPMS levels: Standby Suspend Off
RGB color display
Default (sRGB) color space is primary color space
First detailed timing is preferred timing
Display x,y Chromaticity:
  Red:   0.6396, 0.3515
  Green: 0.2880, 0.6279
  Blue:  0.1474, 0.0703
  White: 0.3134, 0.3291
Established timings supported:
  720x400@70Hz 9:5 HorFreq: 31469 Hz Clock: 28.320 MHz
  640x480@60Hz 4:3 HorFreq: 31469 Hz Clock: 25.175 MHz
  640x480@75Hz 4:3 HorFreq: 37500 Hz Clock: 31.500 MHz
  800x600@60Hz 4:3 HorFreq: 37900 Hz Clock: 40.000 MHz
  800x600@75Hz 4:3 HorFreq: 46900 Hz Clock: 49.500 MHz
  832x624@75Hz 4:3 HorFreq: 49726 Hz Clock: 57.284 MHz
  1024x768@60Hz 4:3 HorFreq: 48400 Hz Clock: 65.000 MHz
  1024x768@75Hz 4:3 HorFreq: 60000 Hz Clock: 78.750 MHz
  1280x1024@75Hz 5:4 HorFreq: 80000 Hz Clock: 135.000 MHz
  1152x870@75Hz 192:145 HorFreq: 67500 Hz Clock: 108.000 MHz
Standard timings supported:
  1152x720@60Hz 16:10
  1280x960@60Hz 4:3 HorFreq: 60000 Hz Clock: 108.000 MHz
  1280x1024@60Hz 5:4 HorFreq: 64000 Hz Clock: 108.000 MHz
  1440x900@60Hz 16:10 HorFreq: 55500 Hz Clock: 88.750 MHz
  1680x1050@60Hz 16:10 HorFreq: 64700 Hz Clock: 119.000 MHz
Detailed mode: Clock 146.250 MHz, 433 mm x 271 mm
               1680 1784 1960 2240 hborder 0
               1050 1053 1059 1089 vborder 0
               -hsync +vsync 
               VertFreq: 59 Hz, HorFreq: 65290 Hz
Serial number: --
Monitor ranges (GTF): 55-76Hz V, 24-83kHz H, max dotclock 170MHz
Monitor name: HP w2007
Checksum: 0x95 (valid)
EDID block does NOT conform to EDID 1.3!
	sRGB is signaled, but the chromaticities do not match
