
EDID (hex):
00ffffffffffff00410cafc0be320000
23190103802917782abe05a156529d27
0c5054bd4b00818081c0010101010101
010101010101662156aa51001e30468f
33009ae61000001e000000ff00554b30
31353335303132393930000000fc0050
68696c697073203139365634000000fd
00384c1e530e000a202020202020004b

Extracted contents:
header:          00 ff ff ff ff ff ff 00
serial number:   41 0c af c0 be 32 00 00 23 19
version:         01 03
basic params:    80 29 17 78 2a
chroma info:     be 05 a1 56 52 9d 27 0c 50 54
established:     bd 4b 00
standard:        81 80 81 c0 01 01 01 01 01 01 01 01 01 01 01 01
descriptor 1:    66 21 56 aa 51 00 1e 30 46 8f 33 00 9a e6 10 00 00 1e
descriptor 2:    00 00 00 ff 00 55 4b 30 31 35 33 35 30 31 32 39 39 30
descriptor 3:    00 00 00 fc 00 50 68 69 6c 69 70 73 20 31 39 36 56 34
descriptor 4:    00 00 00 fd 00 38 4c 1e 53 0e 00 0a 20 20 20 20 20 20
extensions:      00
checksum:        4b

EDID version: 1.3
Manufacturer: PHL Model c0af Serial Number --
Made in week 35 of 2015
Digital display
Maximum image size: 41 cm x 23 cm
Gamma: 2.20
DPMS levels: Off
RGB color display
First detailed timing is preferred timing
Display x,y Chromaticity:
  Red:   0.6308, 0.3388
  Green: 0.3232, 0.6152
  Blue:  0.1523, 0.0468
  White: 0.3134, 0.3291
Established timings supported:
  720x400@70Hz 9:5 HorFreq: 31469 Hz Clock: 28.320 MHz
  640x480@60Hz 4:3 HorFreq: 31469 Hz Clock: 25.175 MHz
  640x480@67Hz 4:3 HorFreq: 35000 Hz Clock: 30.240 MHz
  640x480@72Hz 4:3 HorFreq: 37900 Hz Clock: 31.500 MHz
  640x480@75Hz 4:3 HorFreq: 37500 Hz Clock: 31.500 MHz
  800x600@60Hz 4:3 HorFreq: 37900 Hz Clock: 40.000 MHz
  800x600@75Hz 4:3 HorFreq: 46900 Hz Clock: 49.500 MHz
  1024x768@60Hz 4:3 HorFreq: 48400 Hz Clock: 65.000 MHz
  1024x768@75Hz 4:3 HorFreq: 60000 Hz Clock: 78.750 MHz
  1280x1024@75Hz 5:4 HorFreq: 80000 Hz Clock: 135.000 MHz
Standard timings supported:
  1280x1024@60Hz 5:4 HorFreq: 64000 Hz Clock: 108.000 MHz
  1280x720@60Hz 16:9
Detailed mode: Clock 85.500 MHz, 410 mm x 230 mm
               1366 1436 1579 1792 hborder 0
                768  771  774  798 vborder 0
               +hsync +vsync 
               VertFreq: 59 Hz, HorFreq: 47712 Hz
Serial number: --
Monitor ranges (GTF): 56-76Hz V, 30-83kHz H, max dotclock 140MHz
Checksum: 0x4b (valid)
EDID block does NOT conform to EDID 1.3!
	Name descriptor not terminated with a newline
