
EDID (hex):
00ffffffffffff004c2d0b1055325743
241d0103804627782a5a95a556539d25
0e5054230800b30081c0810081809500
a9c001010101023a801871382d40582c
4500ba892100001e000000fd00323c1e
5111000a202020202020000000fc0043
33324633394d0a2020202020000000ff
0048345a4d3930313231340a20200154
02031af14690041f1303122309070783
01000066030c00200080011d00bc52d0
1e20b8285540ba892100001e8c0ad090
204031200c405500ba89210000188c0a
d08a20e02d10103e9600ba8921000018
023a80d072382d40102c4580ba892100
001e0000000000000000000000000000
00000000000000000000000000000054

Extracted contents:
header:          00 ff ff ff ff ff ff 00
serial number:   4c 2d 0b 10 55 32 57 43 24 1d
version:         01 03
basic params:    80 46 27 78 2a
chroma info:     5a 95 a5 56 53 9d 25 0e 50 54
established:     23 08 00
standard:        b3 00 81 c0 81 00 81 80 95 00 a9 c0 01 01 01 01
descriptor 1:    02 3a 80 18 71 38 2d 40 58 2c 45 00 ba 89 21 00 00 1e
descriptor 2:    00 00 00 fd 00 32 3c 1e 51 11 00 0a 20 20 20 20 20 20
descriptor 3:    00 00 00 fc 00 43 33 32 46 33 39 4d 0a 20 20 20 20 20
descriptor 4:    00 00 00 ff 00 48 34 5a 4d 39 30 31 32 31 34 0a 20 20
extensions:      01
checksum:        54

EDID version: 1.3
Manufacturer: SAM Model 100b Serial Number --
Made in week 36 of 2019
Digital display
Maximum image size: 70 cm x 39 cm
Gamma: 2.20
DPMS levels: Off
RGB color display
First detailed timing is preferred timing
Display x,y Chromaticity:
  Red:   0.6455, 0.3369
  Green: 0.3261, 0.6152
  Blue:  0.1464, 0.0556
  White: 0.3134, 0.3291
Established timings supported:
  640x480@60Hz 4:3 HorFreq: 31469 Hz Clock: 25.175 MHz
  800x600@56Hz 4:3 HorFreq: 35200 Hz Clock: 36.000 MHz
  800x600@60Hz 4:3 HorFreq: 37900 Hz Clock: 40.000 MHz
  1024x768@60Hz 4:3 HorFreq: 48400 Hz Clock: 65.000 MHz
Standard timings supported:
  1680x1050@60Hz 16:10 HorFreq: 64700 Hz Clock: 119.000 MHz
  1280x720@60Hz 16:9
  1280x800@60Hz 16:10
  1280x1024@60Hz 5:4 HorFreq: 64000 Hz Clock: 108.000 MHz
  1440x900@60Hz 16:10 HorFreq: 55500 Hz Clock: 88.750 MHz
  1600x900@60Hz 16:9
Detailed mode: Clock 148.500 MHz, 698 mm x 393 mm
               1920 2008 2052 2200 hborder 0
               1080 1084 1089 1125 vborder 0
               +hsync +vsync 
               VertFreq: 60 Hz, HorFreq: 67500 Hz
Monitor ranges (GTF): 50-60Hz V, 30-81kHz H, max dotclock 170MHz
Monitor name: C32F39M
Serial number: --
Has 1 extension blocks
Checksum: 0x54 (valid)

CTA extension block
Extension version: 3
22 bytes of CTA data
  Video data block
    VIC  16 1920x1080@60Hz 16:9 (native) HorFreq: 67500 Hz Clock: 148.500 MHz
    VIC   4 1280x720@60Hz 16:9  HorFreq: 45000 Hz Clock: 74.250 MHz
    VIC  31 1920x1080@50Hz 16:9  HorFreq: 56250 Hz Clock: 148.500 MHz
    VIC  19 1280x720@50Hz 16:9  HorFreq: 37500 Hz Clock: 74.250 MHz
    VIC   3 720x480@60Hz 16:9  HorFreq: 31469 Hz Clock: 27.000 MHz
    VIC  18 720x576@50Hz 16:9  HorFreq: 31250 Hz Clock: 27.000 MHz
  Audio data block
    Linear PCM, max channels 2
      Supported sample rates (kHz): 48 44.1 32
      Supported sample sizes (bits): 24 20 16
  Speaker allocation data block
    Speaker map:
      FL/FR - Front Left/Right
  Vendor-specific data block, OUI 000c03 (HDMI)
    Source physical address 2.0.0.0
    Supports_AI
Underscans PC formats by default
Basic audio support
Supports YCbCr 4:4:4
Supports YCbCr 4:2:2
1 native detailed modes
Detailed mode: Clock 74.250 MHz, 698 mm x 393 mm
               1280 1720 1760 1980 hborder 0
                720  725  730  750 vborder 0
               +hsync +vsync 
               VertFreq: 50 Hz, HorFreq: 37500 Hz
Detailed mode: Clock 27.000 MHz, 698 mm x 393 mm
                720  732  796  864 hborder 0
                576  581  586  625 vborder 0
               -hsync -vsync 
               VertFreq: 50 Hz, HorFreq: 31250 Hz
Detailed mode: Clock 27.000 MHz, 698 mm x 393 mm
                720  736  798  858 hborder 0
                480  489  495  525 vborder 0
               -hsync -vsync 
               VertFreq: 59 Hz, HorFreq: 31468 Hz
Detailed mode: Clock 148.500 MHz, 698 mm x 393 mm
               1920 2448 2492 2640 hborder 0
               1080 1084 1089 1125 vborder 0
               +hsync +vsync 
               VertFreq: 50 Hz, HorFreq: 56250 Hz
Checksum: 0x54 (valid)

EDID block does not conform at all!
	Both the serial number and the serial string are set
