edid-decode (hex):

00 ff ff ff ff ff ff 00 04 72 97 00 39 39 32 91
0d 13 01 03 68 2c 19 78 2a ee 91 a3 54 4c 99 26
0f 50 54 bf cf 80 71 4f 81 40 81 80 81 c0 81 00
01 01 01 01 01 01 2f 26 40 a0 60 84 1a 30 30 20
35 00 bb f9 10 00 00 1a 00 00 00 fd 00 38 4b 1f
50 10 00 0a 20 20 20 20 20 20 00 00 00 ff 00 4c
46 4b 30 38 30 31 31 34 32 30 31 0a 00 00 00 fc
00 41 43 45 52 20 58 32 30 33 48 0a 20 20 00 d9

00 ff ff ff ff ff ff 00 04 72 97 00 39 39 32 91
0d 13 01 03 68 2c 19 78 2a ee 91 a3 54 4c 99 26
0f 50 54 bf cf 80 71 4f 81 40 81 80 81 c0 81 00
01 01 01 01 01 01 2f 26 40 a0 60 84 1a 30 30 20
35 00 bb f9 10 00 00 1a 00 00 00 fd 00 38 4b 1f
50 10 00 0a 20 20 20 20 20 20 00 00 00 ff 00 4c
46 4b 30 38 30 31 31 34 32 30 31 0a 00 00 00 fc
00 41 43 45 52 20 58 32 30 33 48 0a 20 20 00 d9

----------------

Block 0, Base EDID:
  EDID Structure Version & Revision: 1.3
  Vendor & Product Identification:
    Manufacturer: ACR
    Model: 151
    Serial Number: ...
    Made in: week 13 of 2009
  Basic Display Parameters & Features:
    Analog display
    Signal Level Standard: 0.700 : 0.000 : 0.700 V p-p
    Blank level equals black level
    Sync: Separate
    Maximum image size: 44 cm x 25 cm
    Gamma: 2.20
    DPMS levels: Off
    RGB color display
    First detailed timing is the preferred timing
  Color Characteristics:
    Red  : 0.6396, 0.3300
    Green: 0.2998, 0.5996
    Blue : 0.1503, 0.0595
    White: 0.3125, 0.3291
  Established Timings I & II:
    IBM     :   720x400    70.081663 Hz   9:5     31.467 kHz     28.320000 MHz
    DMT 0x04:   640x480    59.940476 Hz   4:3     31.469 kHz     25.175000 MHz
    Apple   :   640x480    66.666667 Hz   4:3     35.000 kHz     30.240000 MHz
    DMT 0x05:   640x480    72.808802 Hz   4:3     37.861 kHz     31.500000 MHz
    DMT 0x06:   640x480    75.000000 Hz   4:3     37.500 kHz     31.500000 MHz
    DMT 0x08:   800x600    56.250000 Hz   4:3     35.156 kHz     36.000000 MHz
    DMT 0x09:   800x600    60.316541 Hz   4:3     37.879 kHz     40.000000 MHz
    DMT 0x0a:   800x600    72.187572 Hz   4:3     48.077 kHz     50.000000 MHz
    DMT 0x0b:   800x600    75.000000 Hz   4:3     46.875 kHz     49.500000 MHz
    DMT 0x10:  1024x768    60.003840 Hz   4:3     48.363 kHz     65.000000 MHz
    DMT 0x11:  1024x768    70.069359 Hz   4:3     56.476 kHz     75.000000 MHz
    DMT 0x12:  1024x768    75.028582 Hz   4:3     60.023 kHz     78.750000 MHz
    DMT 0x24:  1280x1024   75.024675 Hz   5:4     79.976 kHz    135.000000 MHz
    Apple   :  1152x870    75.061550 Hz 192:145   68.681 kHz    100.000000 MHz
  Standard Timings:
    DMT 0x15:  1152x864    75.000000 Hz   4:3     67.500 kHz    108.000000 MHz
    DMT 0x20:  1280x960    60.000000 Hz   4:3     60.000 kHz    108.000000 MHz
    DMT 0x23:  1280x1024   60.019740 Hz   5:4     63.981 kHz    108.000000 MHz
    DMT 0x55:  1280x720    60.000000 Hz  16:9     45.000 kHz     74.250000 MHz
    DMT 0x1c:  1280x800    59.810326 Hz  16:10    49.702 kHz     83.500000 MHz
  Detailed Timing Descriptors:
    DTD 1:  1600x900    59.978156 Hz  16:9     55.540 kHz     97.750000 MHz (443 mm x 249 mm)
                 Hfront   48 Hsync  32 Hback   80 Hpol P
                 Vfront    3 Vsync   5 Vback   18 Vpol N
    Display Range Limits:
      Monitor ranges (GTF): 56-75 Hz V, 31-80 kHz H, max dotclock 160 MHz
    Display Product Serial Number: ...
    Display Product Name: 'ACER X203H'
Checksum: 0xd9

----------------

Block 1, Unknown EDID Extension Block 0x00:
  00 ff ff ff ff ff ff 00 04 72 97 00 39 39 32 91 '.........r..992.'
  0d 13 01 03 68 2c 19 78 2a ee 91 a3 54 4c 99 26 '....h,.x*...TL.&'
  0f 50 54 bf cf 80 71 4f 81 40 81 80 81 c0 81 00 '.PT...qO.@......'
  01 01 01 01 01 01 2f 26 40 a0 60 84 1a 30 30 20 '....../&@.`..00 '
  35 00 bb f9 10 00 00 1a 00 00 00 fd 00 38 4b 1f '5............8K.'
  50 10 00 0a 20 20 20 20 20 20 00 00 00 ff 00 4c 'P...      .....L'
  46 4b 30 38 30 31 31 34 32 30 31 0a 00 00 00 fc 'FK080114201.....'
  00 41 43 45 52 20 58 32 30 33 48 0a 20 20 00 d9 '.ACER X203H.  ..'
Checksum: 0xd9

----------------

Failures:

Block 0, Base EDID:
  Basic Display Parameters & Features: The chromaticities match sRGB, but sRGB is not signaled.
Block 1, Base EDID:
  Unknown Extension Block.
EDID:
  Base EDID: EDID specified 0 extension block(s), but found 1 extension block(s).

EDID conformity: FAIL
