
EDID (hex):
00ffffffffffff001e6d524e79cd0500
021101036a291f78eab345a754499622
135054ad6b808180714f614f454f3140
a94001010101483f403062b0324040c0
130098321100001e000000fd00384b1c
5311000a202020202020000000fc004c
32303030434e0a2020202020000000fc
000a20202020202020202020202000a3

Extracted contents:
header:          00 ff ff ff ff ff ff 00
serial number:   1e 6d 52 4e 79 cd 05 00 02 11
version:         01 03
basic params:    6a 29 1f 78 ea
chroma info:     b3 45 a7 54 49 96 22 13 50 54
established:     ad 6b 80
standard:        81 80 71 4f 61 4f 45 4f 31 40 a9 40 01 01 01 01
descriptor 1:    48 3f 40 30 62 b0 32 40 40 c0 13 00 98 32 11 00 00 1e
descriptor 2:    00 00 00 fd 00 38 4b 1c 53 11 00 0a 20 20 20 20 20 20
descriptor 3:    00 00 00 fc 00 4c 32 30 30 30 43 4e 0a 20 20 20 20 20
descriptor 4:    00 00 00 fc 00 0a 20 20 20 20 20 20 20 20 20 20 20 20
extensions:      00
checksum:        a3

EDID version: 1.3
Manufacturer: GSM Model 4e52 Serial Number --
Made in week 2 of 2007
Analog display, Input voltage level: 0.7/0.7 V
Sync: Separate SyncOnGreen 
Maximum image size: 41 cm x 31 cm
Gamma: 2.20
DPMS levels: Standby Suspend Off
RGB color display
First detailed timing is preferred timing
Display x,y Chromaticity:
  Red:   0.6542, 0.3310
  Green: 0.2851, 0.5888
  Blue:  0.1337, 0.0742
  White: 0.3134, 0.3291
Established timings supported:
  720x400@70Hz 9:5 HorFreq: 31469 Hz Clock: 28.320 MHz
  640x480@60Hz 4:3 HorFreq: 31469 Hz Clock: 25.175 MHz
  640x480@72Hz 4:3 HorFreq: 37900 Hz Clock: 31.500 MHz
  640x480@75Hz 4:3 HorFreq: 37500 Hz Clock: 31.500 MHz
  800x600@60Hz 4:3 HorFreq: 37900 Hz Clock: 40.000 MHz
  800x600@75Hz 4:3 HorFreq: 46900 Hz Clock: 49.500 MHz
  832x624@75Hz 4:3 HorFreq: 49726 Hz Clock: 57.284 MHz
  1024x768@60Hz 4:3 HorFreq: 48400 Hz Clock: 65.000 MHz
  1024x768@75Hz 4:3 HorFreq: 60000 Hz Clock: 78.750 MHz
  1280x1024@75Hz 5:4 HorFreq: 80000 Hz Clock: 135.000 MHz
  1152x870@75Hz 192:145 HorFreq: 67500 Hz Clock: 108.000 MHz
Standard timings supported:
  1280x1024@60Hz 5:4 HorFreq: 64000 Hz Clock: 108.000 MHz
  1152x864@75Hz 4:3 HorFreq: 67500 Hz Clock: 108.000 MHz
  1024x768@75Hz 4:3 HorFreq: 60000 Hz Clock: 78.750 MHz
  800x600@75Hz 4:3 HorFreq: 46900 Hz Clock: 49.500 MHz
  640x480@60Hz 4:3 HorFreq: 31469 Hz Clock: 25.175 MHz
  1600x1200@60Hz 4:3 HorFreq: 75000 Hz Clock: 162.000 MHz
Detailed mode: Clock 162.000 MHz, 408 mm x 306 mm
               1600 1664 1856 2160 hborder 0
               1200 1201 1204 1250 vborder 0
               +hsync +vsync 
               VertFreq: 60 Hz, HorFreq: 75000 Hz
Monitor ranges (GTF): 56-75Hz V, 28-83kHz H, max dotclock 170MHz
Monitor name: L2000CN
Checksum: 0xa3 (valid)
