
EDID (hex):
00ffffffffffff00047223249a027082
1b120103803420782e8a019a58528b28
1e5054bfef80d100714081c081408180
a940b3009500283c80a070b023403020
360006442100001a000000fd00374b1e
5310340a20696465200a000000fc0041
4c32343233570a2020202020000000ff
004c3638304231323138313735200013

Extracted contents:
header:          00 ff ff ff ff ff ff 00
serial number:   04 72 23 24 9a 02 70 82 1b 12
version:         01 03
basic params:    80 34 20 78 2e
chroma info:     8a 01 9a 58 52 8b 28 1e 50 54
established:     bf ef 80
standard:        d1 00 71 40 81 c0 81 40 81 80 a9 40 b3 00 95 00
descriptor 1:    28 3c 80 a0 70 b0 23 40 30 20 36 00 06 44 21 00 00 1a
descriptor 2:    00 00 00 fd 00 37 4b 1e 53 10 34 0a 20 69 64 65 20 0a
descriptor 3:    00 00 00 fc 00 41 4c 32 34 32 33 57 0a 20 20 20 20 20
descriptor 4:    00 00 00 ff 00 4c 36 38 30 42 31 32 31 38 31 37 35 20
extensions:      00
checksum:        13

EDID version: 1.3
Manufacturer: ACR Model 2423 Serial Number --
Made in week 27 of 2008
Digital display
Maximum image size: 52 cm x 32 cm
Gamma: 2.20
DPMS levels: Off
RGB color display
Default (sRGB) color space is primary color space
First detailed timing is preferred timing
Display x,y Chromaticity:
  Red:   0.6035, 0.3437
  Green: 0.3222, 0.5449
  Blue:  0.1562, 0.1171
  White: 0.3125, 0.3291
Established timings supported:
  720x400@70Hz 9:5 HorFreq: 31469 Hz Clock: 28.320 MHz
  640x480@60Hz 4:3 HorFreq: 31469 Hz Clock: 25.175 MHz
  640x480@67Hz 4:3 HorFreq: 35000 Hz Clock: 30.240 MHz
  640x480@72Hz 4:3 HorFreq: 37900 Hz Clock: 31.500 MHz
  640x480@75Hz 4:3 HorFreq: 37500 Hz Clock: 31.500 MHz
  800x600@56Hz 4:3 HorFreq: 35200 Hz Clock: 36.000 MHz
  800x600@60Hz 4:3 HorFreq: 37900 Hz Clock: 40.000 MHz
  800x600@72Hz 4:3 HorFreq: 48100 Hz Clock: 50.000 MHz
  800x600@75Hz 4:3 HorFreq: 46900 Hz Clock: 49.500 MHz
  832x624@75Hz 4:3 HorFreq: 49726 Hz Clock: 57.284 MHz
  1024x768@60Hz 4:3 HorFreq: 48400 Hz Clock: 65.000 MHz
  1024x768@70Hz 4:3 HorFreq: 56500 Hz Clock: 75.000 MHz
  1024x768@75Hz 4:3 HorFreq: 60000 Hz Clock: 78.750 MHz
  1280x1024@75Hz 5:4 HorFreq: 80000 Hz Clock: 135.000 MHz
  1152x870@75Hz 192:145 HorFreq: 67500 Hz Clock: 108.000 MHz
Standard timings supported:
  1920x1200@60Hz 16:10 HorFreq: 74000 Hz Clock: 154.000 MHz
  1152x864@60Hz 4:3
  1280x720@60Hz 16:9
  1280x960@60Hz 4:3 HorFreq: 60000 Hz Clock: 108.000 MHz
  1280x1024@60Hz 5:4 HorFreq: 64000 Hz Clock: 108.000 MHz
  1600x1200@60Hz 4:3 HorFreq: 75000 Hz Clock: 162.000 MHz
  1680x1050@60Hz 16:10 HorFreq: 64700 Hz Clock: 119.000 MHz
  1440x900@60Hz 16:10 HorFreq: 55500 Hz Clock: 88.750 MHz
Detailed mode: Clock 154.000 MHz, 518 mm x 324 mm
               1920 1968 2000 2080 hborder 0
               1200 1203 1209 1235 vborder 0
               +hsync -vsync 
               VertFreq: 59 Hz, HorFreq: 74038 Hz
Monitor ranges (invalid): 55-75Hz V, 30-83kHz H, max dotclock 160MHz
Monitor name: AL2423W
Serial number: -- 
Checksum: 0x13 (valid)
EDID block does NOT conform to EDID 1.3!
	sRGB is signaled, but the chromaticities do not match
EDID block does not conform at all!
	Detailed blocks filled with garbage
	Range descriptor contains garbage
