edid-decode (hex):

00 ff ff ff ff ff ff 00 3a 93 00 00 01 00 00 00
1e 10 01 03 08 29 1e 78 0a 91 75 a3 59 48 9a 24
11 50 54 a7 cf 00 81 80 81 8a 01 01 90 40 01 01
01 01 01 01 01 01 a8 2f 78 d0 51 1a 27 40 58 90
34 00 98 2e 11 00 00 18 00 00 00 fd 00 30 4b 1e
53 10 00 0a 20 20 20 20 20 20 00 00 00 fc 00 53
58 47 41 2b 0a 20 20 20 20 20 20 20 00 00 00 ff
00 0a 20 20 20 20 20 20 20 20 20 20 20 20 00 90

----------------

Block 0, Base EDID:
  EDID Structure Version & Revision: 1.3
  Vendor & Product Identification:
    Manufacturer: NTS
    Model: 0
    Serial Number: ...
    Made in: week 30 of 2006
  Basic Display Parameters & Features:
    Analog display
    Signal Level Standard: 0.700 : 0.300 : 1.000 V p-p
    Blank level equals black level
    Sync: Separate
    Maximum image size: 41 cm x 30 cm
    Gamma: 2.20
    RGB color display
    First detailed timing is the preferred timing
  Color Characteristics:
    Red  : 0.6386, 0.3486
    Green: 0.2812, 0.6025
    Blue : 0.1416, 0.0693
    White: 0.3134, 0.3291
  Established Timings I & II:
    IBM     :   720x400    70.081663 Hz   9:5     31.467 kHz     28.320000 MHz
    DMT 0x04:   640x480    59.940476 Hz   4:3     31.469 kHz     25.175000 MHz
    DMT 0x06:   640x480    75.000000 Hz   4:3     37.500 kHz     31.500000 MHz
    DMT 0x08:   800x600    56.250000 Hz   4:3     35.156 kHz     36.000000 MHz
    DMT 0x09:   800x600    60.316541 Hz   4:3     37.879 kHz     40.000000 MHz
    DMT 0x0a:   800x600    72.187572 Hz   4:3     48.077 kHz     50.000000 MHz
    DMT 0x0b:   800x600    75.000000 Hz   4:3     46.875 kHz     49.500000 MHz
    DMT 0x10:  1024x768    60.003840 Hz   4:3     48.363 kHz     65.000000 MHz
    DMT 0x11:  1024x768    70.069359 Hz   4:3     56.476 kHz     75.000000 MHz
    DMT 0x12:  1024x768    75.028582 Hz   4:3     60.023 kHz     78.750000 MHz
    DMT 0x24:  1280x1024   75.024675 Hz   5:4     79.976 kHz    135.000000 MHz
  Standard Timings:
    DMT 0x23:  1280x1024   60.019740 Hz   5:4     63.981 kHz    108.000000 MHz
    GTF     :  1280x1024   69.999805 Hz   5:4     74.620 kHz    128.943000 MHz
    DMT 0x2a:  1400x1050   59.978442 Hz   4:3     65.317 kHz    121.750000 MHz
  Detailed Timing Descriptors:
    DTD 1:  1400x1050   60.101601 Hz   4:3     65.451 kHz    122.000000 MHz (408 mm x 302 mm)
                 Hfront   88 Hsync 144 Hback  232 Hpol N
                 Vfront    3 Vsync   4 Vback   32 Vpol N
    Display Range Limits:
      Monitor ranges (GTF): 48-75 Hz V, 30-83 kHz H, max dotclock 160 MHz
    Display Product Name: 'SXGA+'
    Display Product Serial Number: ...
Checksum: 0x90

----------------

Failures:

Block 0, Base EDID:
  Display Product Serial Number: ...

EDID conformity: FAIL
