
EDID (hex):
00ffffffffffff00593a071001010101
121a0103804627780a6f4da455519826
11474aa5ce0001010101010101010101
010101010101662156b051001b308082
2600b9882100001e000000fd00324d1f
460f000a202020202020000000ff004c
415553554b44533030303030000000fc
00443332686e2d44300a202020200143
020324714b010384051020151213141f
29090705155750000700830100006503
0c002000023a801871382d40582c5500
b9882100001e011d007251d01e206e28
5500b9882100001e0000000000000000
00000000000000000000000000000000
00000000000000000000000000000000
0000000000000000000000000000003b

Extracted contents:
header:          00 ff ff ff ff ff ff 00
serial number:   59 3a 07 10 01 01 01 01 12 1a
version:         01 03
basic params:    80 46 27 78 0a
chroma info:     6f 4d a4 55 51 98 26 11 47 4a
established:     a5 ce 00
standard:        01 01 01 01 01 01 01 01 01 01 01 01 01 01 01 01
descriptor 1:    66 21 56 b0 51 00 1b 30 80 82 26 00 b9 88 21 00 00 1e
descriptor 2:    00 00 00 fd 00 32 4d 1f 46 0f 00 0a 20 20 20 20 20 20
descriptor 3:    00 00 00 ff 00 4c 41 55 53 55 4b 44 53 30 30 30 30 30
descriptor 4:    00 00 00 fc 00 44 33 32 68 6e 2d 44 30 0a 20 20 20 20
extensions:      01
checksum:        43

EDID version: 1.3
Manufacturer: VIZ Model 1007 Serial Number --
Made in week 18 of 2016
Digital display
Maximum image size: 70 cm x 39 cm
Gamma: 2.20
RGB color display
First detailed timing is preferred timing
Display x,y Chromaticity:
  Red:   0.6416, 0.3339
  Green: 0.3193, 0.5966
  Blue:  0.1494, 0.0664
  White: 0.2802, 0.2900
Established timings supported:
  720x400@70Hz 9:5 HorFreq: 31469 Hz Clock: 28.320 MHz
  640x480@60Hz 4:3 HorFreq: 31469 Hz Clock: 25.175 MHz
  640x480@75Hz 4:3 HorFreq: 37500 Hz Clock: 31.500 MHz
  800x600@60Hz 4:3 HorFreq: 37900 Hz Clock: 40.000 MHz
  800x600@72Hz 4:3 HorFreq: 48100 Hz Clock: 50.000 MHz
  800x600@75Hz 4:3 HorFreq: 46900 Hz Clock: 49.500 MHz
  1024x768@60Hz 4:3 HorFreq: 48400 Hz Clock: 65.000 MHz
  1024x768@70Hz 4:3 HorFreq: 56500 Hz Clock: 75.000 MHz
  1024x768@75Hz 4:3 HorFreq: 60000 Hz Clock: 78.750 MHz
Standard timings supported:
Detailed mode: Clock 85.500 MHz, 697 mm x 392 mm
               1366 1494 1624 1798 hborder 0
                768  770  776  795 vborder 0
               +hsync +vsync 
               VertFreq: 59 Hz, HorFreq: 47552 Hz
Monitor ranges (GTF): 50-77Hz V, 31-70kHz H, max dotclock 150MHz
Serial number: --
Monitor name: D32hn-D0
Has 1 extension blocks
Checksum: 0x43 (valid)

CTA extension block
Extension version: 3
32 bytes of CTA data
  Video data block
    VIC   1 640x480@60Hz 4:3  HorFreq: 31469 Hz Clock: 25.175 MHz
    VIC   3 720x480@60Hz 16:9  HorFreq: 31469 Hz Clock: 27.000 MHz
    VIC   4 1280x720@60Hz 16:9 (native) HorFreq: 45000 Hz Clock: 74.250 MHz
    VIC   5 1920x1080i@60Hz 16:9  HorFreq: 33750 Hz Clock: 74.250 MHz
    VIC  16 1920x1080@60Hz 16:9  HorFreq: 67500 Hz Clock: 148.500 MHz
    VIC  32 1920x1080@24Hz 16:9  HorFreq: 27000 Hz Clock: 74.250 MHz
    VIC  21 1440x576i@50Hz 4:3  HorFreq: 15625 Hz Clock: 27.000 MHz
    VIC  18 720x576@50Hz 16:9  HorFreq: 31250 Hz Clock: 27.000 MHz
    VIC  19 1280x720@50Hz 16:9  HorFreq: 37500 Hz Clock: 74.250 MHz
    VIC  20 1920x1080i@50Hz 16:9  HorFreq: 28125 Hz Clock: 74.250 MHz
    VIC  31 1920x1080@50Hz 16:9  HorFreq: 56250 Hz Clock: 148.500 MHz
  Audio data block
    Linear PCM, max channels 2
      Supported sample rates (kHz): 48 44.1 32
      Supported sample sizes (bits): 24 16
    AC-3, max channels 6
      Supported sample rates (kHz): 192 96 48 44.1 32
      Maximum bit rate: 640 kHz
    RESERVED, max channels 1
      Supported sample rates (kHz): 48 44.1 32
      Maximum bit rate: 0 kHz
  Speaker allocation data block
    Speaker map:
      FL/FR - Front Left/Right
  Vendor-specific data block, OUI 000c03 (HDMI)
    Source physical address 2.0.0.0
Basic audio support
Supports YCbCr 4:4:4
Supports YCbCr 4:2:2
1 native detailed modes
Detailed mode: Clock 148.500 MHz, 697 mm x 392 mm
               1920 2008 2052 2200 hborder 0
               1080 1085 1090 1125 vborder 0
               +hsync +vsync 
               VertFreq: 60 Hz, HorFreq: 67500 Hz
Detailed mode: Clock 74.250 MHz, 697 mm x 392 mm
               1280 1390 1430 1650 hborder 0
                720  725  730  750 vborder 0
               +hsync +vsync 
               VertFreq: 60 Hz, HorFreq: 45000 Hz
Checksum: 0x3b (valid)

One or more of the timings is out of range of the Monitor Ranges:
  Vertical Freq: 24 - 75 Hz
  Horizontal Freq: 15625 - 67500 Hz
  Maximum Clock: 148.500 MHz
EDID block does not conform at all!
	Both the serial number and the serial string are set


