edid-decode (hex):

00 ff ff ff ff ff ff 00 42 93 12 03 d1 8f 01 00
29 0a 01 01 08 20 18 1b e8 5c 11 9e 59 47 9b 27
10 48 4f a5 4b 00 31 59 31 68 45 59 45 68 61 59
01 00 01 00 01 00 d2 0f 80 a0 20 e0 1a 10 10 40
13 00 36 e6 10 00 00 18 f9 15 20 f8 30 58 1f 20
20 40 13 00 36 e6 10 00 00 1e 00 00 00 fd 00 32
96 1e 55 0f 00 0a 20 20 20 20 20 20 00 00 00 fe
00 66 70 69 6a 30 61 30 31 30 32 33 35 33 00 f1

----------------

Block 0, Base EDID:
  EDID Structure Version & Revision: 1.1
  Vendor & Product Identification:
    Manufacturer: PTS
    Model: 786
    Serial Number: ...
    Made in: week 41 of 2000
  Basic Display Parameters & Features:
    Analog display
    Input voltage level: 0.7/0.3 V
    Blank level equals black level
    Sync: Separate
    Maximum image size: 32 cm x 24 cm
    Gamma: 1.27
    DPMS levels: Standby Suspend Off
    RGB color display
  Color Characteristics:
    Red  : 0.6181, 0.3486
    Green: 0.2802, 0.6054
    Blue : 0.1523, 0.0634
    White: 0.2812, 0.3095
  Established Timings I & II:
    IBM     :   720x400    70.081663 Hz   9:5     31.467 kHz     28.320000 MHz
    DMT 0x04:   640x480    59.940476 Hz   4:3     31.469 kHz     25.175000 MHz
    DMT 0x06:   640x480    75.000000 Hz   4:3     37.500 kHz     31.500000 MHz
    DMT 0x09:   800x600    60.316541 Hz   4:3     37.879 kHz     40.000000 MHz
    DMT 0x0b:   800x600    75.000000 Hz   4:3     46.875 kHz     49.500000 MHz
    DMT 0x10:  1024x768    60.003840 Hz   4:3     48.363 kHz     65.000000 MHz
    DMT 0x12:  1024x768    75.028582 Hz   4:3     60.023 kHz     78.750000 MHz
    DMT 0x24:  1280x1024   75.024675 Hz   5:4     79.976 kHz    135.000000 MHz
  Standard Timings:
    DMT 0x07:   640x480    85.008312 Hz   4:3     43.269 kHz     36.000000 MHz
    Unknown :   640x480   100.000 Hz   4:3
    DMT 0x0c:   800x600    85.061274 Hz   4:3     53.674 kHz     56.250000 MHz
    Unknown :   800x600   100.000 Hz   4:3
    DMT 0x13:  1024x768    84.996690 Hz   4:3     68.677 kHz     94.500000 MHz
  Detailed Timing Descriptors:
    DTD 1:   640x480   100.049407 Hz   4:3     50.625 kHz     40.500000 MHz (310 mm x 230 mm)
                 Hfront   16 Hsync  64 Hback   80 Hpol N
                 Vfront    1 Vsync   3 Vback   22 Vpol N
    DTD 2:   800x600    85.061274 Hz   4:3     53.674 kHz     56.250000 MHz (310 mm x 230 mm)
                 Hfront   32 Hsync  64 Hback  152 Hpol P
                 Vfront    1 Vsync   3 Vback   27 Vpol P
    Display Range Limits:
      Monitor ranges (GTF): 50-150 Hz V, 30-85 kHz H, max dotclock 150 MHz
    Alphanumeric Data String: 'fpij0a0102353'
Checksum: 0xf1

----------------

Warnings:

Block 0, Base EDID:
  EDID Structure Version & Revision: EDID 1.1 is deprecated, do not use.

Failures:

Block 0, Base EDID:
  Standard Timings: Use 0x0101 as the invalid Standard Timings code, not 0x0100.
  Standard Timings: Use 0x0101 as the invalid Standard Timings code, not 0x0100.
  Standard Timings: Use 0x0101 as the invalid Standard Timings code, not 0x0100.
  Detailed Timing Descriptor #1: Mismatch of image size 310x230 mm vs display size 320x240 mm.
  Detailed Timing Descriptor #2: Mismatch of image size 310x230 mm vs display size 320x240 mm.

EDID conformity: FAIL
