edid-decode (hex):

00 ff ff ff ff ff ff 00 30 e4 03 05 00 00 00 00
00 19 01 04 95 22 13 78 0a 42 e5 91 58 55 8f 28
1e 50 54 00 00 00 01 01 01 01 01 01 01 01 01 01
01 01 01 01 01 01 d0 1d 56 f4 50 00 16 30 30 20
35 00 58 c2 10 00 00 1b e0 13 56 f4 50 00 16 30
30 20 35 00 58 c2 10 00 00 1b 00 00 00 00 00 00
00 00 00 00 00 00 00 00 00 00 00 00 00 00 00 02
00 0c 47 ff 0a 3c 6e 12 14 1d 6e 00 00 00 00 a5

----------------

Block 0, Base EDID:
  EDID Structure Version & Revision: 1.4
  Vendor & Product Identification:
    Manufacturer: LGD
    Model: 1283
    Made in: 2015
  Basic Display Parameters & Features:
    Digital display
    Bits per primary color channel: 6
    DisplayPort interface
    Maximum image size: 34 cm x 19 cm
    Gamma: 2.20
    Supported color formats: RGB 4:4:4, YCrCb 4:4:4
    First detailed timing includes the native pixel format and preferred refresh rate
  Color Characteristics:
    Red  : 0.5673, 0.3437
    Green: 0.3320, 0.5605
    Blue : 0.1591, 0.1191
    White: 0.3134, 0.3291
  Established Timings I & II: none
  Standard Timings: none
  Detailed Timing Descriptors:
    DTD 1:  1366x768    60.005 Hz 683:384  47.404 kHz  76.320 MHz (344 mm x 194 mm)
                 Hfront   48 Hsync  32 Hback 164 Hpol P
                 Vfront    3 Vsync   5 Vback  14 Vpol N
    DTD 2:  1366x768    40.003 Hz 683:384  31.602 kHz  50.880 MHz (344 mm x 194 mm)
                 Hfront   48 Hsync  32 Hback 164 Hpol P
                 Vfront    3 Vsync   5 Vback  14 Vpol N
    Empty Descriptor
    Manufacturer-Specified Display Descriptor (0x02): 00 02 00 0c 47 ff 0a 3c 6e 12 14 1d 6e 00 00 00 '....G..<n...n...'
Checksum: 0xa5

----------------

Failures:

Block 0, Base EDID:
  Empty Descriptor: Use Dummy Descriptor instead of all zeroes.
  Missing Display Product Name.

EDID conformity: FAIL
