
EDID (hex):
00ffffffffffff005a6325cb01010101
3314010380301b782e50f5a458529728
135054bfef80b300a940a9c095009040
81808100714f023a801871382d40582c
4500dd0c1100001e000000ff00525753
3130353130303334390a000000fd0032
4b185215000a202020202020000000fc
005658323235302053455249455300fe

Extracted contents:
header:          00 ff ff ff ff ff ff 00
serial number:   5a 63 25 cb 01 01 01 01 33 14
version:         01 03
basic params:    80 30 1b 78 2e
chroma info:     50 f5 a4 58 52 97 28 13 50 54
established:     bf ef 80
standard:        b3 00 a9 40 a9 c0 95 00 90 40 81 80 81 00 71 4f
descriptor 1:    02 3a 80 18 71 38 2d 40 58 2c 45 00 dd 0c 11 00 00 1e
descriptor 2:    00 00 00 ff 00 52 57 53 31 30 35 31 30 30 33 34 39 0a
descriptor 3:    00 00 00 fd 00 32 4b 18 52 15 00 0a 20 20 20 20 20 20
descriptor 4:    00 00 00 fc 00 56 58 32 32 35 30 20 53 45 52 49 45 53
extensions:      00
checksum:        fe

EDID version: 1.3
Manufacturer: VSC Model cb25 Serial Number --
Made in week 51 of 2010
Digital display
Maximum image size: 48 cm x 27 cm
Gamma: 2.20
DPMS levels: Off
RGB color display
Default (sRGB) color space is primary color space
First detailed timing is preferred timing
Display x,y Chromaticity:
  Red:   0.6416, 0.3447
  Green: 0.3203, 0.5898
  Blue:  0.1591, 0.0771
  White: 0.3134, 0.3291
Established timings supported:
  720x400@70Hz 9:5 HorFreq: 31469 Hz Clock: 28.320 MHz
  640x480@60Hz 4:3 HorFreq: 31469 Hz Clock: 25.175 MHz
  640x480@67Hz 4:3 HorFreq: 35000 Hz Clock: 30.240 MHz
  640x480@72Hz 4:3 HorFreq: 37900 Hz Clock: 31.500 MHz
  640x480@75Hz 4:3 HorFreq: 37500 Hz Clock: 31.500 MHz
  800x600@56Hz 4:3 HorFreq: 35200 Hz Clock: 36.000 MHz
  800x600@60Hz 4:3 HorFreq: 37900 Hz Clock: 40.000 MHz
  800x600@72Hz 4:3 HorFreq: 48100 Hz Clock: 50.000 MHz
  800x600@75Hz 4:3 HorFreq: 46900 Hz Clock: 49.500 MHz
  832x624@75Hz 4:3 HorFreq: 49726 Hz Clock: 57.284 MHz
  1024x768@60Hz 4:3 HorFreq: 48400 Hz Clock: 65.000 MHz
  1024x768@70Hz 4:3 HorFreq: 56500 Hz Clock: 75.000 MHz
  1024x768@75Hz 4:3 HorFreq: 60000 Hz Clock: 78.750 MHz
  1280x1024@75Hz 5:4 HorFreq: 80000 Hz Clock: 135.000 MHz
  1152x870@75Hz 192:145 HorFreq: 67500 Hz Clock: 108.000 MHz
Standard timings supported:
  1680x1050@60Hz 16:10 HorFreq: 64700 Hz Clock: 119.000 MHz
  1600x1200@60Hz 4:3 HorFreq: 75000 Hz Clock: 162.000 MHz
  1600x900@60Hz 16:9
  1440x900@60Hz 16:10 HorFreq: 55500 Hz Clock: 88.750 MHz
  1400x1050@60Hz 4:3 HorFreq: 64700 Hz Clock: 101.000 MHz
  1280x1024@60Hz 5:4 HorFreq: 64000 Hz Clock: 108.000 MHz
  1280x800@60Hz 16:10
  1152x864@75Hz 4:3 HorFreq: 67500 Hz Clock: 108.000 MHz
Detailed mode: Clock 148.500 MHz, 477 mm x 268 mm
               1920 2008 2052 2200 hborder 0
               1080 1084 1089 1125 vborder 0
               +hsync +vsync 
               VertFreq: 60 Hz, HorFreq: 67500 Hz
Serial number: --
Monitor ranges (GTF): 50-75Hz V, 24-82kHz H, max dotclock 210MHz
Checksum: 0xfe (valid)
EDID block does NOT conform to EDID 1.3!
	sRGB is signaled, but the chromaticities do not match
	Name descriptor not terminated with a newline
