edid-decode (hex):

00 ff ff ff ff ff ff 00 5a 63 25 cb 01 01 01 01
19 14 01 03 80 30 1b 78 2e 50 f5 a4 58 52 97 28
13 50 54 bf ef 80 b3 00 a9 40 a9 c0 95 00 90 40
81 80 81 00 71 4f 02 3a 80 18 71 38 2d 40 58 2c
45 00 dd 0c 11 00 00 1e 00 00 00 ff 00 52 57 53
31 30 32 35 30 34 31 35 35 0a 00 00 00 fd 00 32
4b 18 52 15 00 0a 20 20 20 20 20 20 00 00 00 fc
00 56 58 32 32 35 30 20 53 45 52 49 45 53 00 18

00 ff ff ff ff ff ff 00 5a 63 25 cb 01 01 01 01
19 14 01 03 80 30 1b 78 2e 50 f5 a4 58 52 97 28
13 50 54 bf ef 80 b3 00 a9 40 a9 c0 95 00 90 40
81 80 81 00 71 4f 02 3a 80 18 71 38 2d 40 58 2c
45 00 dd 0c 11 00 00 1e 00 00 00 ff 00 52 57 53
31 30 32 35 30 34 31 35 35 0a 00 00 00 fd 00 32
4b 18 52 15 00 0a 20 20 20 20 20 20 00 00 00 fc
00 56 58 32 32 35 30 20 53 45 52 49 45 53 00 18

----------------

Block 0, Base EDID:
  EDID Structure Version & Revision: 1.3
  Vendor & Product Identification:
    Manufacturer: VSC
    Model: 52005
    Serial Number: ...
    Made in: week 25 of 2010
  Basic Display Parameters & Features:
    Digital display
    Maximum image size: 48 cm x 27 cm
    Gamma: 2.20
    DPMS levels: Off
    RGB color display
    Default (sRGB) color space is primary color space
    First detailed timing is the preferred timing
  Color Characteristics:
    Red  : 0.6416, 0.3447
    Green: 0.3203, 0.5898
    Blue : 0.1591, 0.0771
    White: 0.3134, 0.3291
  Established Timings I & II:
    IBM     :   720x400    70.081663 Hz   9:5     31.467 kHz     28.320000 MHz
    DMT 0x04:   640x480    59.940476 Hz   4:3     31.469 kHz     25.175000 MHz
    Apple   :   640x480    66.666667 Hz   4:3     35.000 kHz     30.240000 MHz
    DMT 0x05:   640x480    72.808802 Hz   4:3     37.861 kHz     31.500000 MHz
    DMT 0x06:   640x480    75.000000 Hz   4:3     37.500 kHz     31.500000 MHz
    DMT 0x08:   800x600    56.250000 Hz   4:3     35.156 kHz     36.000000 MHz
    DMT 0x09:   800x600    60.316541 Hz   4:3     37.879 kHz     40.000000 MHz
    DMT 0x0a:   800x600    72.187572 Hz   4:3     48.077 kHz     50.000000 MHz
    DMT 0x0b:   800x600    75.000000 Hz   4:3     46.875 kHz     49.500000 MHz
    Apple   :   832x624    74.551266 Hz   4:3     49.726 kHz     57.284000 MHz
    DMT 0x10:  1024x768    60.003840 Hz   4:3     48.363 kHz     65.000000 MHz
    DMT 0x11:  1024x768    70.069359 Hz   4:3     56.476 kHz     75.000000 MHz
    DMT 0x12:  1024x768    75.028582 Hz   4:3     60.023 kHz     78.750000 MHz
    DMT 0x24:  1280x1024   75.024675 Hz   5:4     79.976 kHz    135.000000 MHz
    Apple   :  1152x870    75.061550 Hz 192:145   68.681 kHz    100.000000 MHz
  Standard Timings:
    DMT 0x3a:  1680x1050   59.954250 Hz  16:10    65.290 kHz    146.250000 MHz
    DMT 0x33:  1600x1200   60.000000 Hz   4:3     75.000 kHz    162.000000 MHz
    DMT 0x53:  1600x900    60.000000 Hz  16:9     60.000 kHz    108.000000 MHz (RB)
    DMT 0x2f:  1440x900    59.887445 Hz  16:10    55.935 kHz    106.500000 MHz
    DMT 0x2a:  1400x1050   59.978442 Hz   4:3     65.317 kHz    121.750000 MHz
    DMT 0x23:  1280x1024   60.019740 Hz   5:4     63.981 kHz    108.000000 MHz
    DMT 0x1c:  1280x800    59.810326 Hz  16:10    49.702 kHz     83.500000 MHz
    DMT 0x15:  1152x864    75.000000 Hz   4:3     67.500 kHz    108.000000 MHz
  Detailed Timing Descriptors:
    DTD 1:  1920x1080   60.000000 Hz  16:9     67.500 kHz    148.500000 MHz (477 mm x 268 mm)
                 Hfront   88 Hsync  44 Hback  148 Hpol P
                 Vfront    4 Vsync   5 Vback   36 Vpol P
    Display Product Serial Number: ...
    Display Range Limits:
      Monitor ranges (GTF): 50-75 Hz V, 24-82 kHz H, max dotclock 210 MHz
    Display Product Name: 'VX2250 SERIES'
Checksum: 0x18

----------------

Block 1, Unknown EDID Extension Block 0x00:
  00 ff ff ff ff ff ff 00 5a 63 25 cb 01 01 01 01 '........Zc%.....'
  19 14 01 03 80 30 1b 78 2e 50 f5 a4 58 52 97 28 '.....0.x.P..XR.('
  13 50 54 bf ef 80 b3 00 a9 40 a9 c0 95 00 90 40 '.PT......@.....@'
  81 80 81 00 71 4f 02 3a 80 18 71 38 2d 40 58 2c '....qO.:..q8-@X,'
  45 00 dd 0c 11 00 00 1e 00 00 00 ff 00 52 57 53 'E............RWS'
  31 30 32 35 30 34 31 35 35 0a 00 00 00 fd 00 32 '102504155......2'
  4b 18 52 15 00 0a 20 20 20 20 20 20 00 00 00 fc 'K.R...      ....'
  00 56 58 32 32 35 30 20 53 45 52 49 45 53 00 18 '.VX2250 SERIES..'
Checksum: 0x18

----------------

Failures:

Block 0, Base EDID:
  Basic Display Parameters & Features: sRGB is signaled, but the chromaticities do not match.
Block 1, Base EDID:
  Unknown Extension Block.
EDID:
  Base EDID: EDID specified 0 extension block(s), but found 1 extension block(s).

EDID conformity: FAIL
