
EDID (hex):
00ffffffffffff00410c56d001010101
1a1201031c291a782ae5b5a355499927
135054bdcf80950fa9409040904f8140
814f8180714a9a29a0d0518422305098
36009a041100001c000000ff00545935
30373039313233343536000000fc0031
3950464c333430334445550a000000fd
00384b1f5011000a202020202020008a

Extracted contents:
header:          00 ff ff ff ff ff ff 00
serial number:   41 0c 56 d0 01 01 01 01 1a 12
version:         01 03
basic params:    1c 29 1a 78 2a
chroma info:     e5 b5 a3 55 49 99 27 13 50 54
established:     bd cf 80
standard:        95 0f a9 40 90 40 90 4f 81 40 81 4f 81 80 71 4a
descriptor 1:    9a 29 a0 d0 51 84 22 30 50 98 36 00 9a 04 11 00 00 1c
descriptor 2:    00 00 00 ff 00 54 59 35 30 37 30 39 31 32 33 34 35 36
descriptor 3:    00 00 00 fc 00 31 39 50 46 4c 33 34 30 33 44 45 55 0a
descriptor 4:    00 00 00 fd 00 38 4b 1f 50 11 00 0a 20 20 20 20 20 20
extensions:      00
checksum:        8a

EDID version: 1.3
Manufacturer: PHL Model d056 Serial Number --
Made in week 26 of 2008
Analog display, Input voltage level: 0.7/0.3 V
Configurable signal levels
Sync: Separate Composite 
Maximum image size: 41 cm x 26 cm
Gamma: 2.20
DPMS levels: Off
RGB color display
First detailed timing is preferred timing
Display x,y Chromaticity:
  Red:   0.6396, 0.3339
  Green: 0.2861, 0.5986
  Blue:  0.1542, 0.0771
  White: 0.3134, 0.3291
Established timings supported:
  720x400@70Hz 9:5 HorFreq: 31469 Hz Clock: 28.320 MHz
  640x480@60Hz 4:3 HorFreq: 31469 Hz Clock: 25.175 MHz
  640x480@67Hz 4:3 HorFreq: 35000 Hz Clock: 30.240 MHz
  640x480@72Hz 4:3 HorFreq: 37900 Hz Clock: 31.500 MHz
  640x480@75Hz 4:3 HorFreq: 37500 Hz Clock: 31.500 MHz
  800x600@60Hz 4:3 HorFreq: 37900 Hz Clock: 40.000 MHz
  800x600@72Hz 4:3 HorFreq: 48100 Hz Clock: 50.000 MHz
  800x600@75Hz 4:3 HorFreq: 46900 Hz Clock: 49.500 MHz
  1024x768@60Hz 4:3 HorFreq: 48400 Hz Clock: 65.000 MHz
  1024x768@70Hz 4:3 HorFreq: 56500 Hz Clock: 75.000 MHz
  1024x768@75Hz 4:3 HorFreq: 60000 Hz Clock: 78.750 MHz
  1280x1024@75Hz 5:4 HorFreq: 80000 Hz Clock: 135.000 MHz
  1152x870@75Hz 192:145 HorFreq: 67500 Hz Clock: 108.000 MHz
Standard timings supported:
  1440x900@75Hz 16:10 HorFreq: 82300 Hz Clock: 156.000 MHz
  1600x1200@60Hz 4:3 HorFreq: 75000 Hz Clock: 162.000 MHz
  1400x1050@60Hz 4:3 HorFreq: 64700 Hz Clock: 101.000 MHz
  1400x1050@75Hz 4:3 HorFreq: 82300 Hz Clock: 156.000 MHz
  1280x960@60Hz 4:3 HorFreq: 60000 Hz Clock: 108.000 MHz
  1280x960@75Hz 4:3
  1280x1024@60Hz 5:4 HorFreq: 64000 Hz Clock: 108.000 MHz
  1152x864@70Hz 4:3
Detailed mode: Clock 106.500 MHz, 410 mm x 260 mm
               1440 1520 1672 1904 hborder 0
                900  903  909  934 vborder 0
               -hsync +vsync 
               VertFreq: 59 Hz, HorFreq: 55934 Hz
Serial number: --
Monitor name: 19PFL3403DEU
Monitor ranges (GTF): 56-75Hz V, 31-80kHz H, max dotclock 170MHz
Checksum: 0x8a (valid)
One or more of the timings is out of range of the Monitor Ranges:
  Vertical Freq: 59 - 75 Hz
  Horizontal Freq: 31469 - 82300 Hz
  Maximum Clock: 162.000 MHz
