
EDID (hex):
00ffffffffffff0022f0993101010101
2d1c0103a03c22782a53a5a756529c26
115054a10800d1c081c0a9c0b3009500
818081000101023a801871382d40582c
450056502100001e000000fd00323c1e
5011000a202020202020000000fc0048
5020323778770a2020202020000000ff
0036434d383435314b53320a20200117
02031b6223097f078301000067030c00
2000802d43011004e2000f0000360040
e86300001a1a1d008051d01c20408035
0040846300001c000000000000000000
00000000000000000000000000000000
00000000000000000000000000000000
00000000000000000000000000000000
00000000000000000000000000000095

edid-decode (hex):

00 ff ff ff ff ff ff 00 22 f0 99 31 01 01 01 01
2d 1c 01 03 a0 3c 22 78 2a 53 a5 a7 56 52 9c 26
11 50 54 a1 08 00 d1 c0 81 c0 a9 c0 b3 00 95 00
81 80 81 00 01 01 02 3a 80 18 71 38 2d 40 58 2c
45 00 56 50 21 00 00 1e 00 00 00 fd 00 32 3c 1e
50 11 00 0a 20 20 20 20 20 20 00 00 00 fc 00 48
50 20 32 37 78 77 0a 20 20 20 20 20 00 00 00 ff
00 36 43 4d 38 34 35 31 4b 53 32 0a 20 20 01 17

02 03 1b 62 23 09 7f 07 83 01 00 00 67 03 0c 00
20 00 80 2d 43 01 10 04 e2 00 0f 00 00 36 00 40
e8 63 00 00 1a 1a 1d 00 80 51 d0 1c 20 40 80 35
00 40 84 63 00 00 1c 00 00 00 00 00 00 00 00 00
00 00 00 00 00 00 00 00 00 00 00 00 00 00 00 00
00 00 00 00 00 00 00 00 00 00 00 00 00 00 00 00
00 00 00 00 00 00 00 00 00 00 00 00 00 00 00 00
00 00 00 00 00 00 00 00 00 00 00 00 00 00 00 95

----------------

Block 0, Base EDID:
  EDID Structure Version & Revision: 1.3
  Vendor & Product Identification:
    Manufacturer: HWP
    Model: 12697
    Serial Number: 16843009
    Made in: week 45 of 2018
  Basic Display Parameters & Features:
    Digital display
    Maximum image size: 60 cm x 34 cm
    Gamma: 2.20
    DPMS levels: Off
    RGB color display
    First detailed timing is the preferred timing
  Color Characteristics:
    Red  : 0.6533, 0.3369
    Green: 0.3203, 0.6123
    Blue : 0.1503, 0.0683
    White: 0.3134, 0.3291
  Established Timings I & II:
    IBM     :   720x400    70.081663 Hz   9:5     31.467 kHz     28.320000 MHz
    DMT 0x04:   640x480    59.940476 Hz   4:3     31.469 kHz     25.175000 MHz
    DMT 0x09:   800x600    60.316541 Hz   4:3     37.879 kHz     40.000000 MHz
    DMT 0x10:  1024x768    60.003840 Hz   4:3     48.363 kHz     65.000000 MHz
  Standard Timings:
    DMT 0x52:  1920x1080   60.000000 Hz  16:9     67.500 kHz    148.500000 MHz
    DMT 0x55:  1280x720    60.000000 Hz  16:9     45.000 kHz     74.250000 MHz
    DMT 0x53:  1600x900    60.000000 Hz  16:9     60.000 kHz    108.000000 MHz (RB)
    DMT 0x3a:  1680x1050   59.954250 Hz  16:10    65.290 kHz    146.250000 MHz
    DMT 0x2f:  1440x900    59.887445 Hz  16:10    55.935 kHz    106.500000 MHz
    DMT 0x23:  1280x1024   60.019740 Hz   5:4     63.981 kHz    108.000000 MHz
    DMT 0x1c:  1280x800    59.810326 Hz  16:10    49.702 kHz     83.500000 MHz
  Detailed Timing Descriptors:
    DTD 1:  1920x1080   60.000000 Hz  16:9     67.500 kHz    148.500000 MHz (598 mm x 336 mm)
                 Hfront   88 Hsync  44 Hback  148 Hpol P
                 Vfront    4 Vsync   5 Vback   36 Vpol P
    Display Range Limits:
      Monitor ranges (GTF): 50-60 Hz V, 30-80 kHz H, max dotclock 170 MHz
    Display Product Name: 'HP 27xw'
    Display Product Serial Number: '6CM8451KS2'
  Extension blocks: 1
Checksum: 0x17

----------------

Block 1, CTA-861 Extension Block:
  Revision: 3
  Basic audio support
  Supports YCbCr 4:4:4
  Native detailed modes: 2
  Audio Data Block:
    Linear PCM:
      Max channels: 2
      Supported sample rates (kHz): 192 176.4 96 88.2 48 44.1 32
      Supported sample sizes (bits): 24 20 16
  Speaker Allocation Data Block:
    FL/FR - Front Left/Right
  Vendor-Specific Data Block (HDMI), OUI 00-0C-03:
    Source physical address: 2.0.0.0
    Supports_AI
    Maximum TMDS clock: 225 MHz
  Video Data Block:
    VIC   1:   640x480    59.940476 Hz   4:3     31.469 kHz     25.175000 MHz
    VIC  16:  1920x1080   60.000000 Hz  16:9     67.500 kHz    148.500000 MHz
    VIC   4:  1280x720    60.000000 Hz  16:9     45.000 kHz     74.250000 MHz
  Video Capability Data Block:
    YCbCr quantization: No Data
    RGB quantization: No Data
    PT scan behavior: No Data
    IT scan behavior: Supports both over- and underscan
    CE scan behavior: Supports both over- and underscan
  Detailed Timing Descriptors:
    Manufacturer-Specified Display Descriptor (0x00): 36 00 40 e8 63 00 00 1a 1a 1d 00 80 51 d0 1c 20 '6.@.c.......Q.. '
    DTD 2:  1077x132   1319.683102 Hz 359:44   304.847 kHz    328.320000 MHz (analog composite, sync-on-green)
                 Hfront    0 Hsync  28 Hback  -28 Hpol N
                 Vfront    0 Vsync   0 Vback   99 Vpol N
                   40 80 35 00 40 84 63 00 00 1c 00 00 00 00 00 00 00 00 '@.5.@.c...........'
Checksum: 0x95  Unused space in Extension Block: 64 bytes


