edid-decode (hex):

00 ff ff ff ff ff ff 00 4d 67 70 27 01 00 00 00
31 22 01 04 b5 3c 21 78 3f fa 65 ac 51 3e a3 24
0f 50 54 a5 4f 00 b3 00 a9 c0 95 00 81 00 81 40
81 80 90 40 71 40 56 5e 00 a0 a0 a0 29 50 30 20
35 00 55 50 21 00 00 1a 02 3a 80 18 71 38 2d 40
58 2c 45 00 12 18 21 00 00 1e 00 00 00 fd 00 30
b4 fa fa 44 01 0a 20 20 20 20 20 20 00 00 00 fc
00 48 32 37 54 32 32 43 0a 20 20 20 20 20 02 56

02 03 1b 75 43 01 90 1f 23 09 07 07 83 01 00 00
e3 05 e3 01 e6 06 07 01 5d 49 03 f5 bd 00 a0 a0
a0 32 50 20 40 45 00 56 50 21 00 00 1e 04 76 00
a0 a0 a0 29 50 30 20 36 00 bc 86 21 00 00 1a f8
e3 00 a0 a0 a0 32 50 30 20 35 00 56 50 21 00 00
1a 00 00 00 00 00 00 00 00 00 00 00 00 00 00 00
00 00 00 00 00 00 00 00 00 00 00 00 00 00 00 00
00 00 00 00 00 00 00 00 00 00 00 00 00 00 00 3a

70 12 79 00 00 03 00 28 f5 16 01 04 ff 09 95 00
2f 00 3f 00 9f 05 17 00 02 80 04 00 a7 00 01 04
ff 09 9f 00 2f 00 3f 00 9f 05 17 00 02 80 04 00
07 00 0a 08 81 00 08 04 00 04 02 10 00 00 00 00
00 00 00 00 00 00 00 00 00 00 00 00 00 00 00 00
00 00 00 00 00 00 00 00 00 00 00 00 00 00 00 00
00 00 00 00 00 00 00 00 00 00 00 00 00 00 00 00
00 00 00 00 00 00 00 00 00 00 00 00 00 00 30 90

00 ff ff ff ff ff ff 00 4d 67 70 27 01 00 00 00
31 22 01 04 b5 3c 21 78 3f fa 65 ac 51 3e a3 24
0f 50 54 a5 4f 00 b3 00 a9 c0 95 00 81 00 81 40
81 80 90 40 71 40 56 5e 00 a0 a0 a0 29 50 30 20
35 00 55 50 21 00 00 1a 02 3a 80 18 71 38 2d 40
58 2c 45 00 12 18 21 00 00 1e 00 00 00 fd 00 30
b4 fa fa 44 01 0a 20 20 20 20 20 20 00 00 00 fc
00 48 32 37 54 32 32 43 0a 20 20 20 20 20 02 56

02 03 1b 75 43 01 90 1f 23 09 07 07 83 01 00 00
e3 05 e3 01 e6 06 07 01 5d 49 03 f5 bd 00 a0 a0
a0 32 50 20 40 45 00 56 50 21 00 00 1e 04 76 00
a0 a0 a0 29 50 30 20 36 00 bc 86 21 00 00 1a f8
e3 00 a0 a0 a0 32 50 30 20 35 00 56 50 21 00 00
1a 00 00 00 00 00 00 00 00 00 00 00 00 00 00 00
00 00 00 00 00 00 00 00 00 00 00 00 00 00 00 00
00 00 00 00 00 00 00 00 00 00 00 00 00 00 00 3a

70 12 79 00 00 03 00 28 f5 16 01 04 ff 09 95 00
2f 00 3f 00 9f 05 17 00 02 80 04 00 a7 00 01 04
ff 09 9f 00 2f 00 3f 00 9f 05 17 00 02 80 04 00
07 00 0a 08 81 00 08 04 00 04 02 10 00 00 00 00
00 00 00 00 00 00 00 00 00 00 00 00 00 00 00 00
00 00 00 00 00 00 00 00 00 00 00 00 00 00 00 00
00 00 00 00 00 00 00 00 00 00 00 00 00 00 00 00
00 00 00 00 00 00 00 00 00 00 00 00 00 00 30 90

----------------

Block 0, Base EDID:
  EDID Structure Version & Revision: 1.4
  Vendor & Product Identification:
    Manufacturer: SKG
    Model: 10096
    Serial Number: ...
    Made in: week 49 of 2024
  Basic Display Parameters & Features:
    Digital display
    Bits per primary color channel: 10
    DisplayPort interface
    Maximum image size: 60 cm x 33 cm
    Gamma: 2.20
    DPMS levels: Off
    Supported color formats: RGB 4:4:4, YCrCb 4:4:4, YCrCb 4:2:2
    Default (sRGB) color space is primary color space
    First detailed timing includes the native pixel format and preferred refresh rate
    Display is continuous frequency
  Color Characteristics:
    Red  : 0.6748, 0.3193
    Green: 0.2441, 0.6386
    Blue : 0.1416, 0.0605
    White: 0.3134, 0.3291
  Established Timings I & II:
    IBM     :   720x400    70.081663 Hz   9:5     31.467 kHz     28.320000 MHz
    DMT 0x04:   640x480    59.940476 Hz   4:3     31.469 kHz     25.175000 MHz
    DMT 0x06:   640x480    75.000000 Hz   4:3     37.500 kHz     31.500000 MHz
    DMT 0x09:   800x600    60.316541 Hz   4:3     37.879 kHz     40.000000 MHz
    DMT 0x0b:   800x600    75.000000 Hz   4:3     46.875 kHz     49.500000 MHz
    DMT 0x10:  1024x768    60.003840 Hz   4:3     48.363 kHz     65.000000 MHz
    DMT 0x11:  1024x768    70.069359 Hz   4:3     56.476 kHz     75.000000 MHz
    DMT 0x12:  1024x768    75.028582 Hz   4:3     60.023 kHz     78.750000 MHz
    DMT 0x24:  1280x1024   75.024675 Hz   5:4     79.976 kHz    135.000000 MHz
  Standard Timings:
    DMT 0x3a:  1680x1050   59.954250 Hz  16:10    65.290 kHz    146.250000 MHz
    DMT 0x53:  1600x900    60.000000 Hz  16:9     60.000 kHz    108.000000 MHz (RB)
    DMT 0x2f:  1440x900    59.887445 Hz  16:10    55.935 kHz    106.500000 MHz
    DMT 0x1c:  1280x800    59.810326 Hz  16:10    49.702 kHz     83.500000 MHz
    DMT 0x20:  1280x960    60.000000 Hz   4:3     60.000 kHz    108.000000 MHz
    DMT 0x23:  1280x1024   60.019740 Hz   5:4     63.981 kHz    108.000000 MHz
    DMT 0x2a:  1400x1050   59.978442 Hz   4:3     65.317 kHz    121.750000 MHz
    GTF     :  1152x864    60.000000 Hz   4:3     53.700 kHz     81.624000 MHz
  Detailed Timing Descriptors:
    DTD 1:  2560x1440   59.950550 Hz  16:9     88.787 kHz    241.500000 MHz (597 mm x 336 mm)
                 Hfront   48 Hsync  32 Hback   80 Hpol P
                 Vfront    3 Vsync   5 Vback   33 Vpol N
    DTD 2:  1920x1080   60.000000 Hz  16:9     67.500 kHz    148.500000 MHz (530 mm x 280 mm)
                 Hfront   88 Hsync  44 Hback  148 Hpol P
                 Vfront    4 Vsync   5 Vback   36 Vpol P
    Display Range Limits:
      Monitor ranges (Bare Limits): 48-180 Hz V, 250-250 kHz H, max dotclock 680 MHz
    Display Product Name: 'H27T22C'
  Extension blocks: 2
Checksum: 0x56

----------------

Block 1, CTA-861 Extension Block:
  Revision: 3
  Basic audio support
  Supports YCbCr 4:4:4
  Supports YCbCr 4:2:2
  Native detailed modes: 5
  Video Data Block:
    VIC   1:   640x480    59.940476 Hz   4:3     31.469 kHz     25.175000 MHz
    VIC  16:  1920x1080   60.000000 Hz  16:9     67.500 kHz    148.500000 MHz (native)
    VIC  31:  1920x1080   50.000000 Hz  16:9     56.250 kHz    148.500000 MHz
  Audio Data Block:
    Linear PCM:
      Max channels: 2
      Supported sample rates (kHz): 48 44.1 32
      Supported sample sizes (bits): 24 20 16
  Speaker Allocation Data Block:
    FL/FR - Front Left/Right
  Colorimetry Data Block:
    xvYCC601
    xvYCC709
    BT2020cYCC
    BT2020YCC
    BT2020RGB
    Gamut Boundary Description Metadata Profile P0
  HDR Static Metadata Data Block:
    Electro optical transfer functions:
      Traditional gamma - SDR luminance range
      Traditional gamma - HDR luminance range
      SMPTE ST2084
    Supported static metadata descriptors:
      Static metadata type 1
    Desired content max luminance: 93 (374.834 cd/m^2)
    Desired content max frame-average luminance: 73 (243.049 cd/m^2)
    Desired content min luminance: 3 (0.001 cd/m^2)
  Detailed Timing Descriptors:
    DTD 3:  2560x1440  119.988650 Hz  16:9    178.783 kHz    486.290000 MHz (598 mm x 336 mm)
                 Hfront   32 Hsync  64 Hback   64 Hpol P
                 Vfront    4 Vsync   5 Vback   41 Vpol P
    DTD 4:  2560x1440   74.999007 Hz  16:9    111.074 kHz    302.120000 MHz (700 mm x 390 mm)
                 Hfront   48 Hsync  32 Hback   80 Hpol P
                 Vfront    3 Vsync   6 Vback   32 Vpol N
    DTD 5:  2560x1440  143.999210 Hz  16:9    214.559 kHz    583.600000 MHz (598 mm x 336 mm)
                 Hfront   48 Hsync  32 Hback   80 Hpol P
                 Vfront    3 Vsync   5 Vback   42 Vpol N
Checksum: 0x3a  Unused space in Extension Block: 46 bytes

----------------

Block 2, DisplayID Extension Block:
  Version: 1.2
  Extension Count: 0
  Display Product Type: Extension Section
  Video Timing Modes Type 1 - Detailed Timings Data Block:
    DTD:  2560x1440  180.000202 Hz  16:9    263.520 kHz    714.140000 MHz (aspect 16:9, no 3D stereo)
               Hfront   48 Hsync  64 Hback   38 Hpol N
               Vfront    3 Vsync   5 Vback   16 Vpol P
    DTD:  2560x1440  164.999196 Hz  16:9    241.559 kHz    657.040000 MHz (aspect 16:9, no 3D stereo)
               Hfront   48 Hsync  64 Hback   48 Hpol N
               Vfront    3 Vsync   5 Vback   16 Vpol P
  Supported Timing Modes Type 1 - VESA DMT Timings Data Block:
    DMT 0x04:   640x480    59.940476 Hz   4:3     31.469 kHz     25.175000 MHz
    DMT 0x09:   800x600    60.316541 Hz   4:3     37.879 kHz     40.000000 MHz
    DMT 0x10:  1024x768    60.003840 Hz   4:3     48.363 kHz     65.000000 MHz
    DMT 0x1c:  1280x800    59.810326 Hz  16:10    49.702 kHz     83.500000 MHz
    DMT 0x23:  1280x1024   60.019740 Hz   5:4     63.981 kHz    108.000000 MHz
    DMT 0x33:  1600x1200   60.000000 Hz   4:3     75.000 kHz    162.000000 MHz
    DMT 0x3a:  1680x1050   59.954250 Hz  16:10    65.290 kHz    146.250000 MHz
    DMT 0x45:  1920x1200   59.884600 Hz  16:10    74.556 kHz    193.250000 MHz
  Checksum: 0x30
Checksum: 0x90

----------------

Block 3, Unknown EDID Extension Block 0x00:
  00 ff ff ff ff ff ff 00 4d 67 70 27 01 00 00 00 '........Mgp'....'
  31 22 01 04 b5 3c 21 78 3f fa 65 ac 51 3e a3 24 '1"...<!x?.e.Q>.$'
  0f 50 54 a5 4f 00 b3 00 a9 c0 95 00 81 00 81 40 '.PT.O..........@'
  81 80 90 40 71 40 56 5e 00 a0 a0 a0 29 50 30 20 '...@q@V^....)P0 '
  35 00 55 50 21 00 00 1a 02 3a 80 18 71 38 2d 40 '5.UP!....:..q8-@'
  58 2c 45 00 12 18 21 00 00 1e 00 00 00 fd 00 30 'X,E...!........0'
  b4 fa fa 44 01 0a 20 20 20 20 20 20 00 00 00 fc '...D..      ....'
  00 48 32 37 54 32 32 43 0a 20 20 20 20 20 02 56 '.H27T22C.     .V'
Checksum: 0x56

----------------

Block 4, CTA-861 Extension Block:
  Revision: 3
  Basic audio support
  Supports YCbCr 4:4:4
  Supports YCbCr 4:2:2
  Native detailed modes: 5
  Video Data Block:
    VIC   1:   640x480    59.940476 Hz   4:3     31.469 kHz     25.175000 MHz
    VIC  16:  1920x1080   60.000000 Hz  16:9     67.500 kHz    148.500000 MHz (native)
    VIC  31:  1920x1080   50.000000 Hz  16:9     56.250 kHz    148.500000 MHz
  Audio Data Block:
    Linear PCM:
      Max channels: 2
      Supported sample rates (kHz): 48 44.1 32
      Supported sample sizes (bits): 24 20 16
  Speaker Allocation Data Block:
    FL/FR - Front Left/Right
  Colorimetry Data Block:
    xvYCC601
    xvYCC709
    BT2020cYCC
    BT2020YCC
    BT2020RGB
    Gamut Boundary Description Metadata Profile P0
  HDR Static Metadata Data Block:
    Electro optical transfer functions:
      Traditional gamma - SDR luminance range
      Traditional gamma - HDR luminance range
      SMPTE ST2084
    Supported static metadata descriptors:
      Static metadata type 1
    Desired content max luminance: 93 (374.834 cd/m^2)
    Desired content max frame-average luminance: 73 (243.049 cd/m^2)
    Desired content min luminance: 3 (0.001 cd/m^2)
  Detailed Timing Descriptors:
    DTD 6:  2560x1440  119.988650 Hz  16:9    178.783 kHz    486.290000 MHz (598 mm x 336 mm)
                 Hfront   32 Hsync  64 Hback   64 Hpol P
                 Vfront    4 Vsync   5 Vback   41 Vpol P
    DTD 7:  2560x1440   74.999007 Hz  16:9    111.074 kHz    302.120000 MHz (700 mm x 390 mm)
                 Hfront   48 Hsync  32 Hback   80 Hpol P
                 Vfront    3 Vsync   6 Vback   32 Vpol N
    DTD 8:  2560x1440  143.999210 Hz  16:9    214.559 kHz    583.600000 MHz (598 mm x 336 mm)
                 Hfront   48 Hsync  32 Hback   80 Hpol P
                 Vfront    3 Vsync   5 Vback   42 Vpol N
Checksum: 0x3a  Unused space in Extension Block: 46 bytes

----------------

Block 5, DisplayID Extension Block:
  Version: 1.2
  Extension Count: 0
  Video Timing Modes Type 1 - Detailed Timings Data Block:
    DTD:  2560x1440  180.000202 Hz  16:9    263.520 kHz    714.140000 MHz (aspect 16:9, no 3D stereo)
               Hfront   48 Hsync  64 Hback   38 Hpol N
               Vfront    3 Vsync   5 Vback   16 Vpol P
    DTD:  2560x1440  164.999196 Hz  16:9    241.559 kHz    657.040000 MHz (aspect 16:9, no 3D stereo)
               Hfront   48 Hsync  64 Hback   48 Hpol N
               Vfront    3 Vsync   5 Vback   16 Vpol P
  Supported Timing Modes Type 1 - VESA DMT Timings Data Block:
    DMT 0x04:   640x480    59.940476 Hz   4:3     31.469 kHz     25.175000 MHz
    DMT 0x09:   800x600    60.316541 Hz   4:3     37.879 kHz     40.000000 MHz
    DMT 0x10:  1024x768    60.003840 Hz   4:3     48.363 kHz     65.000000 MHz
    DMT 0x1c:  1280x800    59.810326 Hz  16:10    49.702 kHz     83.500000 MHz
    DMT 0x23:  1280x1024   60.019740 Hz   5:4     63.981 kHz    108.000000 MHz
    DMT 0x33:  1600x1200   60.000000 Hz   4:3     75.000 kHz    162.000000 MHz
    DMT 0x3a:  1680x1050   59.954250 Hz  16:10    65.290 kHz    146.250000 MHz
    DMT 0x45:  1920x1200   59.884600 Hz  16:10    74.556 kHz    193.250000 MHz
  Checksum: 0x30
Checksum: 0x90

----------------

Warnings:

Block 1, CTA-861 Extension Block:
  IT Video Formats are overscanned by default, but normally this should be underscanned.
Block 4, CTA-861 Extension Block:
  IT Video Formats are overscanned by default, but normally this should be underscanned.
EDID:
  Base EDID: Some timings are out of range of the Monitor Ranges:
    Horizontal Freq: 31.466 - 263.520 kHz (Monitor: 250.000 - 250.000 kHz)
    Maximum Clock: 714.140 MHz (Monitor: 680.000 MHz)

Failures:

Block 0, Base EDID:
  Basic Display Parameters & Features: sRGB is signaled, but the chromaticities do not match.
  Detailed Timing Descriptor #2: Mismatch of image size 530x280 mm vs display size 600x330 mm.
Block 1, CTA-861 Extension Block:
  Detailed Timing Descriptor #4: Mismatch of image size 700x390 mm vs display size 600x330 mm.
  Missing VCDB, needed for Set Selectable RGB Quantization to avoid interop issues.
Block 2, DisplayID Extension Block:
  DisplayID Base Block has no product type.
  Expected 0 DisplayID Extension Block, but got 1.
Block 3, Base EDID:
  Unknown Extension Block.
Block 4, CTA-861 Extension Block:
  Video Data Block: Duplicate VIC 1.
  Video Data Block: Duplicate VIC 16.
  Video Data Block: Duplicate VIC 31.
  Speaker Allocation Data Block: Only one instance of this Data Block is allowed.
  Colorimetry Data Block: Only one instance of this Data Block is allowed.
  HDR Static Metadata Data Block: Only one instance of this Data Block is allowed.
  Detailed Timing Descriptor #7: Mismatch of image size 700x390 mm vs display size 600x330 mm.
  Missing VCDB, needed for Set Selectable RGB Quantization to avoid interop issues.
EDID:
  Base EDID: The DTD max image size is 700x390mm, which is larger than the display size 600.0x330.0mm.
  Base EDID: EDID specified 2 extension block(s), but found 5 extension block(s).
  CTA-861: Native progressive timings are a mix of several resolutions.
  DisplayID: Missing DisplayID Product Identification Data Block.
  DisplayID: DisplayID expects at least one preferred timing.

EDID conformity: FAIL
