
EDID (hex):
00ffffffffffff004a8b362178563412
01160103852f1d78ea64b5ab5238ab25
13505400000001010101010101010101
010101010101c51b00a050201730582c
4500d9281100001c0000001000000000
00000000000000000000000000100048
5020416c6c2d496e2d4f6e6500000010
00384c1e53100a0a0a0a0a0a0a0a00dc

Extracted contents:
header:          00 ff ff ff ff ff ff 00
serial number:   4a 8b 36 21 78 56 34 12 01 16
version:         01 03
basic params:    85 2f 1d 78 ea
chroma info:     64 b5 ab 52 38 ab 25 13 50 54
established:     00 00 00
standard:        01 01 01 01 01 01 01 01 01 01 01 01 01 01 01 01
descriptor 1:    c5 1b 00 a0 50 20 17 30 58 2c 45 00 d9 28 11 00 00 1c
descriptor 2:    00 00 00 10 00 00 00 00 00 00 00 00 00 00 00 00 00 00
descriptor 3:    00 00 00 10 00 48 50 20 41 6c 6c 2d 49 6e 2d 4f 6e 65
descriptor 4:    00 00 00 10 00 38 4c 1e 53 10 0a 0a 0a 0a 0a 0a 0a 0a
extensions:      00
checksum:        dc

EDID version: 1.3
Manufacturer: RTK Model 2136 Serial Number --
Made in week 1 of 2012
Digital display
DFP 1.x compatible TMDS
Maximum image size: 47 cm x 29 cm
Gamma: 2.20
DPMS levels: Standby Suspend Off
RGB color display
First detailed timing is preferred timing
Display x,y Chromaticity:
  Red:   0.6689, 0.3222
  Green: 0.2197, 0.6679
  Blue:  0.1464, 0.0771
  White: 0.3134, 0.3291
Established timings supported:
Standard timings supported:
Detailed mode: Clock 71.090 MHz, 473 mm x 296 mm
               1280 1368 1412 1440 hborder 0
                800  804  809  823 vborder 0
               -hsync +vsync 
               VertFreq: 59 Hz, HorFreq: 49368 Hz
Dummy block
Dummy block
Dummy block
Checksum: 0xdc (valid)
EDID block does NOT conform to EDID 1.3!
	Digital display field contains garbage: 4
	Missing name descriptor
	Missing monitor ranges
EDID block does not conform at all!
	Dummy block filled with garbage
