
EDID (hex):
00ffffffffffff004a8b362118012120
041f0104a5351d78e25460ab5238ab25
13505400000001010101010101010101
010101010101023a801871382d40582c
45000f282100001a0000001000504b35
3733374147353735550a000000fc0050
524f2041503234310a202020000000fd
00383c1e460f000a202020202020000c

Extracted contents:
header:          00 ff ff ff ff ff ff 00
serial number:   4a 8b 36 21 18 01 21 20 04 1f
version:         01 04
basic params:    a5 35 1d 78 e2
chroma info:     54 60 ab 52 38 ab 25 13 50 54
established:     00 00 00
standard:        01 01 01 01 01 01 01 01 01 01 01 01 01 01 01 01
descriptor 1:    02 3a 80 18 71 38 2d 40 58 2c 45 00 0f 28 21 00 00 1a
descriptor 2:    00 00 00 10 00 50 4b 35 37 33 37 41 47 35 37 35 55 0a
descriptor 3:    00 00 00 fc 00 50 52 4f 20 41 50 32 34 31 0a 20 20 20
descriptor 4:    00 00 00 fd 00 38 3c 1e 46 0f 00 0a 20 20 20 20 20 20
extensions:      00
checksum:        0c

EDID version: 1.4
Manufacturer: RTK Model 2136 Serial Number --
Made in week 4 of 2021
Digital display
8 bits per primary color channel
DisplayPort interface
Maximum image size: 53 cm x 29 cm
Gamma: 2.20
DPMS levels: Standby Suspend Off
Supported color formats: RGB 4:4:4
First detailed timing includes the native pixel format and preferred refresh rate
Display x,y Chromaticity:
  Red:   0.6689, 0.3212
  Green: 0.2197, 0.6679
  Blue:  0.1455, 0.0761
  White: 0.3125, 0.3281
Established timings supported:
Standard timings supported:
Detailed mode: Clock 148.500 MHz, 527 mm x 296 mm
               1920 2008 2052 2200 hborder 0
               1080 1084 1089 1125 vborder 0
               +hsync -vsync 
               VertFreq: 60 Hz, HorFreq: 67500 Hz
Dummy block
Monitor name: PRO AP241
Monitor ranges (GTF): 56-60Hz V, 30-70kHz H, max dotclock 150MHz
Checksum: 0xc (valid)
EDID block does not conform at all!
	Dummy block filled with garbage


