
EDID (hex):
00ffffffffffff005034000065070000
0810010381221b78280c55a559479b24
125054a1080081800101010101010101
010101010101302a009851002a403070
1300510e1100001e000000fd00384b1f
500e000a202020202020000000ff0045
474c3630383242313839330a000000fc
005441545f4c31374e4344540a200001

Extracted contents:
header:          00 ff ff ff ff ff ff 00
serial number:   50 34 00 00 65 07 00 00 08 10
version:         01 03
basic params:    81 22 1b 78 28
chroma info:     0c 55 a5 59 47 9b 24 12 50 54
established:     a1 08 00
standard:        81 80 01 01 01 01 01 01 01 01 01 01 01 01 01 01
descriptor 1:    30 2a 00 98 51 00 2a 40 30 70 13 00 51 0e 11 00 00 1e
descriptor 2:    00 00 00 fd 00 38 4b 1f 50 0e 00 0a 20 20 20 20 20 20
descriptor 3:    00 00 00 ff 00 45 47 4c 36 30 38 32 42 31 38 39 33 0a
descriptor 4:    00 00 00 fc 00 54 41 54 5f 4c 31 37 4e 43 44 54 0a 20
extensions:      00
checksum:        01

EDID version: 1.3
Manufacturer: TAT Model 0 Serial Number --
Made in week 8 of 2006
Digital display
DFP 1.x compatible TMDS
Maximum image size: 34 cm x 27 cm
Gamma: 2.20
DPMS levels: Off
RGB color display
Display x,y Chromaticity:
  Red:   0.6445, 0.3476
  Green: 0.2802, 0.6054
  Blue:  0.1416, 0.0712
  White: 0.3134, 0.3291
Established timings supported:
  720x400@70Hz 9:5 HorFreq: 31469 Hz Clock: 28.320 MHz
  640x480@60Hz 4:3 HorFreq: 31469 Hz Clock: 25.175 MHz
  800x600@60Hz 4:3 HorFreq: 37900 Hz Clock: 40.000 MHz
  1024x768@60Hz 4:3 HorFreq: 48400 Hz Clock: 65.000 MHz
Standard timings supported:
  1280x1024@60Hz 5:4 HorFreq: 64000 Hz Clock: 108.000 MHz
Detailed mode: Clock 108.000 MHz, 337 mm x 270 mm
               1280 1328 1440 1688 hborder 0
               1024 1025 1028 1066 vborder 0
               +hsync +vsync 
               VertFreq: 60 Hz, HorFreq: 63981 Hz
Monitor ranges (GTF): 56-75Hz V, 31-80kHz H, max dotclock 140MHz
Serial number: --
Monitor name: TAT_L17NCDT
Checksum: 0x1 (valid)
EDID block does NOT conform to EDID 1.3!
	Missing preferred timing
