
EDID (hex):
00ffffffffffff004d10464101010101
ff130103684728782a9eada455459826
10474a2d8e0001010101010101010101
0101010101011b2150a051001e304888
3500806821000018000000ff000a2020
20202020202020202020000000fc0053
48415250204c43440a202020000000fd
00384c1e410c000a20202020202000d5

Extracted contents:
header:          00 ff ff ff ff ff ff 00
serial number:   4d 10 46 41 01 01 01 01 ff 13
version:         01 03
basic params:    68 47 28 78 2a
chroma info:     9e ad a4 55 45 98 26 10 47 4a
established:     2d 8e 00
standard:        01 01 01 01 01 01 01 01 01 01 01 01 01 01 01 01
descriptor 1:    1b 21 50 a0 51 00 1e 30 48 88 35 00 80 68 21 00 00 18
descriptor 2:    00 00 00 ff 00 0a 20 20 20 20 20 20 20 20 20 20 20 20
descriptor 3:    00 00 00 fc 00 53 48 41 52 50 20 4c 43 44 0a 20 20 20
descriptor 4:    00 00 00 fd 00 38 4c 1e 41 0c 00 0a 20 20 20 20 20 20
extensions:      00
checksum:        d5

EDID version: 1.3
Manufacturer: SHP Model 4146 Serial Number --
Analog display, Input voltage level: 0.7/0.7 V
Sync: Separate 
Maximum image size: 71 cm x 40 cm
Gamma: 2.20
DPMS levels: Off
RGB color display
First detailed timing is preferred timing
Display x,y Chromaticity:
  Red:   0.6425, 0.3330
  Green: 0.2724, 0.5957
  Blue:  0.1503, 0.0644
  White: 0.2802, 0.2900
Established timings supported:
  640x480@60Hz 4:3 HorFreq: 31469 Hz Clock: 25.175 MHz
  640x480@72Hz 4:3 HorFreq: 37900 Hz Clock: 31.500 MHz
  640x480@75Hz 4:3 HorFreq: 37500 Hz Clock: 31.500 MHz
  800x600@60Hz 4:3 HorFreq: 37900 Hz Clock: 40.000 MHz
  800x600@72Hz 4:3 HorFreq: 48100 Hz Clock: 50.000 MHz
  1024x768@60Hz 4:3 HorFreq: 48400 Hz Clock: 65.000 MHz
  1024x768@70Hz 4:3 HorFreq: 56500 Hz Clock: 75.000 MHz
  1024x768@75Hz 4:3 HorFreq: 60000 Hz Clock: 78.750 MHz
Standard timings supported:
Detailed mode: Clock 84.750 MHz, 640 mm x 360 mm
               1360 1432 1568 1776 hborder 0
                768  771  776  798 vborder 0
               -hsync -vsync 
               VertFreq: 59 Hz, HorFreq: 47719 Hz
Serial number: 
-- name: SHARP LCD
Monitor ranges (GTF): 56-76Hz V, 30-65kHz H, max dotclock 120MHz
Checksum: 0xd5 (valid)
EDID block does not conform at all!
	Bad year of manufacture
	Bad week of manufacture
