
EDID (hex):
00ffffffffffff00320c00e400000000
00110103802517780a56359d5a528f27
1f505400000001010101010101010101
010101010101283c80a070b023403020
36006fe610000019283c80a070b02340
302036006fe610000000000000fe004d
46373730003137315755310a000000fe
00263c485878aed0ff02010a20200046

Extracted contents:
header:          00 ff ff ff ff ff ff 00
serial number:   32 0c 00 e4 00 00 00 00 00 11
version:         01 03
basic params:    80 25 17 78 0a
chroma info:     56 35 9d 5a 52 8f 27 1f 50 54
established:     00 00 00
standard:        01 01 01 01 01 01 01 01 01 01 01 01 01 01 01 01
descriptor 1:    28 3c 80 a0 70 b0 23 40 30 20 36 00 6f e6 10 00 00 19
descriptor 2:    28 3c 80 a0 70 b0 23 40 30 20 36 00 6f e6 10 00 00 00
descriptor 3:    00 00 00 fe 00 4d 46 37 37 30 00 31 37 31 57 55 31 0a
descriptor 4:    00 00 00 fe 00 26 3c 48 58 78 ae d0 ff 02 01 0a 20 20
extensions:      00
checksum:        46

EDID version: 1.3
Manufacturer: LPL Model e400 Serial Number --
Made in year 2007
Digital display
Maximum image size: 37 cm x 23 cm
Gamma: 2.20
RGB color display
First detailed timing is preferred timing
Display x,y Chromaticity:
  Red:   0.6142, 0.3525
  Green: 0.3212, 0.5605
  Blue:  0.1523, 0.1240
  White: 0.3134, 0.3291
Established timings supported:
Standard timings supported:
Detailed mode: Clock 154.000 MHz, 367 mm x 230 mm
               1920 1968 2000 2080 hborder 0
               1200 1203 1209 1235 vborder 0
               -hsync -vsync 
               VertFreq: 59 Hz, HorFreq: 74038 Hz
Detailed mode: Clock 154.000 MHz, 367 mm x 230 mm
               1920 1968 2000 2080 hborder 0
               1200 1203 1209 1235 vborder 0
               -hsync -vsync analog composite 
               VertFreq: 59 Hz, HorFreq: 74038 Hz
ASCII string: MF770
ASCII string: &<HXx
Checksum: 0x46 (valid)
EDID block does NOT conform to EDID 1.3!
	Missing name descriptor
	Missing monitor ranges
	Detailed block string not properly terminated
