
EDID (hex):
00ffffffffffff00320c00e400000000
00110103802517780a56359d5a528f27
1f505400000001010101010101010101
010101010101603b80a070b023403020
36006fe610000019603b80a070b02340
302036006fe610000000000000fe0052
50363136003137315755310a000000fe
001e2d373e5a77a3ff02010a2020008e

Extracted contents:
header:          00 ff ff ff ff ff ff 00
serial number:   32 0c 00 e4 00 00 00 00 00 11
version:         01 03
basic params:    80 25 17 78 0a
chroma info:     56 35 9d 5a 52 8f 27 1f 50 54
established:     00 00 00
standard:        01 01 01 01 01 01 01 01 01 01 01 01 01 01 01 01
descriptor 1:    60 3b 80 a0 70 b0 23 40 30 20 36 00 6f e6 10 00 00 19
descriptor 2:    60 3b 80 a0 70 b0 23 40 30 20 36 00 6f e6 10 00 00 00
descriptor 3:    00 00 00 fe 00 52 50 36 31 36 00 31 37 31 57 55 31 0a
descriptor 4:    00 00 00 fe 00 1e 2d 37 3e 5a 77 a3 ff 02 01 0a 20 20
extensions:      00
checksum:        8e

EDID version: 1.3
Manufacturer: LPL Model e400 Serial Number --
Made in year 2007
Digital display
Maximum image size: 37 cm x 23 cm
Gamma: 2.20
RGB color display
First detailed timing is preferred timing
Display x,y Chromaticity:
  Red:   0.6142, 0.3525
  Green: 0.3212, 0.5605
  Blue:  0.1523, 0.1240
  White: 0.3134, 0.3291
Established timings supported:
Standard timings supported:
Detailed mode: Clock 152.000 MHz, 367 mm x 230 mm
               1920 1968 2000 2080 hborder 0
               1200 1203 1209 1235 vborder 0
               -hsync -vsync 
               VertFreq: 59 Hz, HorFreq: 73076 Hz
Detailed mode: Clock 152.000 MHz, 367 mm x 230 mm
               1920 1968 2000 2080 hborder 0
               1200 1203 1209 1235 vborder 0
               -hsync -vsync analog composite 
               VertFreq: 59 Hz, HorFreq: 73076 Hz
ASCII string: RP616
ASCII string: 
Checksum: 0x8e (valid)
EDID block does NOT conform to EDID 1.3!
	Missing name descriptor
	Missing monitor ranges
	Detailed block string not properly terminated
