
EDID (hex):
00ffffffffffff0030ae334000000000
00110103801e1378ea24e597544f9227
22505400000001010101010101010101
0101010101011027a068518416303020
340030be100000180320a04851841a30
3020360030be100000180000000f0095
0a32950a2814010006af5125000000fe
0041554f4231343150573033563000cf

Extracted contents:
header:          00 ff ff ff ff ff ff 00
serial number:   30 ae 33 40 00 00 00 00 00 11
version:         01 03
basic params:    80 1e 13 78 ea
chroma info:     24 e5 97 54 4f 92 27 22 50 54
established:     00 00 00
standard:        01 01 01 01 01 01 01 01 01 01 01 01 01 01 01 01
descriptor 1:    10 27 a0 68 51 84 16 30 30 20 34 00 30 be 10 00 00 18
descriptor 2:    03 20 a0 48 51 84 1a 30 30 20 36 00 30 be 10 00 00 18
descriptor 3:    00 00 00 0f 00 95 0a 32 95 0a 28 14 01 00 06 af 51 25
descriptor 4:    00 00 00 fe 00 41 55 4f 42 31 34 31 50 57 30 33 56 30
extensions:      00
checksum:        cf

EDID version: 1.3
Manufacturer: LEN Model 4033 Serial Number --
Made in year 2007
Digital display
Maximum image size: 30 cm x 19 cm
Gamma: 2.20
DPMS levels: Standby Suspend Off
RGB color display
First detailed timing is preferred timing
Display x,y Chromaticity:
  Red:   0.5898, 0.3300
  Green: 0.3095, 0.5703
  Blue:  0.1552, 0.1347
  White: 0.3134, 0.3291
Established timings supported:
Standard timings supported:
Detailed mode: Clock 100.000 MHz, 304 mm x 190 mm
               1440 1488 1520 1800 hborder 0
                900  903  907  922 vborder 0
               -hsync -vsync 
               VertFreq: 60 Hz, HorFreq: 55555 Hz
Detailed mode: Clock 81.950 MHz, 304 mm x 190 mm
               1440 1488 1520 1768 hborder 0
                900  903  909  926 vborder 0
               -hsync -vsync 
               VertFreq: 50 Hz, HorFreq: 46351 Hz
Manufacturer-specified data, tag 15
ASCII string: AUOB141PW03V0
Checksum: 0xcf (valid)
EDID block does NOT conform to EDID 1.3!
	Missing name descriptor
	Missing monitor ranges
