
EDID (hex):
00ffffffffffff0030ae334000000000
00110103801e1378eaae109658538c28
24505400000001010101010101010101
010101010101d827a08851841a303020
360030be100000192221a08851841a30
3020360030be100000190000000f0090
0a32900a28140100320c0101000000fe
004c503134315750312d544c423800b7

Extracted contents:
header:          00 ff ff ff ff ff ff 00
serial number:   30 ae 33 40 00 00 00 00 00 11
version:         01 03
basic params:    80 1e 13 78 ea
chroma info:     ae 10 96 58 53 8c 28 24 50 54
established:     00 00 00
standard:        01 01 01 01 01 01 01 01 01 01 01 01 01 01 01 01
descriptor 1:    d8 27 a0 88 51 84 1a 30 30 20 36 00 30 be 10 00 00 19
descriptor 2:    22 21 a0 88 51 84 1a 30 30 20 36 00 30 be 10 00 00 19
descriptor 3:    00 00 00 0f 00 90 0a 32 90 0a 28 14 01 00 32 0c 01 01
descriptor 4:    00 00 00 fe 00 4c 50 31 34 31 57 50 31 2d 54 4c 42 38
extensions:      00
checksum:        b7

EDID version: 1.3
Manufacturer: LEN Model 4033 Serial Number --
Made in year 2007
Digital display
Maximum image size: 30 cm x 19 cm
Gamma: 2.20
DPMS levels: Standby Suspend Off
RGB color display
First detailed timing is preferred timing
Display x,y Chromaticity:
  Red:   0.5878, 0.3457
  Green: 0.3271, 0.5488
  Blue:  0.1562, 0.1416
  White: 0.3125, 0.3281
Established timings supported:
Standard timings supported:
Detailed mode: Clock 102.000 MHz, 304 mm x 190 mm
               1440 1488 1520 1832 hborder 0
                900  903  909  926 vborder 0
               -hsync -vsync 
               VertFreq: 60 Hz, HorFreq: 55676 Hz
Detailed mode: Clock 84.820 MHz, 304 mm x 190 mm
               1440 1488 1520 1832 hborder 0
                900  903  909  926 vborder 0
               -hsync -vsync 
               VertFreq: 49 Hz, HorFreq: 46299 Hz
Manufacturer-specified data, tag 15
ASCII string: LP141WP1-TLB8
Checksum: 0xb7 (valid)
EDID block does NOT conform to EDID 1.3!
	Missing name descriptor
	Missing monitor ranges
