edid-decode (hex):

00 ff ff ff ff ff ff 00 30 ae 33 40 00 00 00 00
00 0f 01 03 80 1e 13 78 ea cd 75 91 55 4f 8b 26
21 50 54 00 00 00 01 01 01 01 01 01 01 01 01 01
01 01 01 01 01 01 b0 27 a0 60 51 84 2d 30 30 20
36 00 2f be 10 00 00 19 d5 1f a0 40 51 84 1a 30
30 20 36 00 2f be 10 00 00 19 00 00 00 0f 00 90
0a 32 90 0a 28 14 01 00 4c a3 42 44 00 00 00 fe
00 4c 54 4e 31 34 31 57 44 2d 4c 30 35 0a 00 32

----------------

Block 0, Base EDID:
  EDID Structure Version & Revision: 1.3
  Vendor & Product Identification:
    Manufacturer: LEN
    Model: 16435
    Made in: 2005
  Basic Display Parameters & Features:
    Digital display
    Maximum image size: 30 cm x 19 cm
    Gamma: 2.20
    DPMS levels: Standby Suspend Off
    RGB color display
    First detailed timing is the preferred timing
  Color Characteristics:
    Red  : 0.5693, 0.3320
    Green: 0.3115, 0.5439
    Blue : 0.1494, 0.1318
    White: 0.3134, 0.3291
  Established Timings I & II: none
  Standard Timings: none
  Detailed Timing Descriptors:
    DTD 1:  1440x900    59.996221 Hz  16:10    56.696 kHz    101.600000 MHz (303 mm x 190 mm)
                 Hfront   48 Hsync  32 Hback  272 Hpol N
                 Vfront    3 Vsync   6 Vback   36 Vpol N
    DTD 2:  1440x900    50.001227 Hz  16:10    46.301 kHz     81.490000 MHz (303 mm x 190 mm)
                 Hfront   48 Hsync  32 Hback  240 Hpol N
                 Vfront    3 Vsync   6 Vback   17 Vpol N
    Manufacturer-Specified Display Descriptor (0x0f): 00 0f 00 90 0a 32 90 0a 28 14 01 00 4c a3 42 44 '.....2..(...L.BD'
    Alphanumeric Data String: 'LTN141WD-L05'
Checksum: 0x32

----------------

Failures:

Block 0, Base EDID:
  Missing Display Product Name.
  Missing Display Range Limits Descriptor.

EDID conformity: FAIL
