edid-decode (hex):

00 ff ff ff ff ff ff 00 30 ae 33 40 00 00 00 00
14 12 01 03 80 1e 13 78 ea 87 f5 94 57 4f 8c 27
27 50 54 00 00 00 01 01 01 01 01 01 01 01 01 01
01 01 01 01 01 01 e3 29 a0 9a 51 84 42 30 7b 52
8f 00 2f be 10 00 00 18 12 20 a0 24 51 84 30 30
58 3a 6b 00 2f be 10 00 00 18 00 00 00 0f 00 95
0a 32 95 0a 28 14 01 00 0d af 39 14 00 00 00 fe
00 4e 31 34 31 43 33 2d 4c 30 37 0a 20 20 00 b2

----------------

Block 0, Base EDID:
  EDID Structure Version & Revision: 1.3
  Vendor & Product Identification:
    Manufacturer: LEN
    Model: 16435
    Made in: week 20 of 2008
  Basic Display Parameters & Features:
    Digital display
    Maximum image size: 30 cm x 19 cm
    Gamma: 2.20
    DPMS levels: Standby Suspend Off
    RGB color display
    First detailed timing is preferred timing
  Color Characteristics:
    Red  : 0.5800, 0.3398
    Green: 0.3095, 0.5498
    Blue : 0.1552, 0.1552
    White: 0.3134, 0.3291
  Established Timings I & II: none
  Standard Timings: none
  Detailed Timing Descriptors:
    DTD 1:  1440x900    60.002 Hz   8:5    57.962 kHz 107.230 MHz (303 mm x 190 mm)
                 Hfront  123 Hsync  82 Hback 205 Hpol N
                 Vfront    8 Vsync  15 Vback  43 Vpol N
    DTD 2:  1440x900    50.002 Hz   8:5    47.402 kHz  82.100 MHz (303 mm x 190 mm)
                 Hfront   88 Hsync  58 Hback 146 Hpol N
                 Vfront    6 Vsync  11 Vback  31 Vpol N
    Manufacturer-Specified Display Descriptor (0x0f): 00 0f 00 95 0a 32 95 0a 28 14 01 00 0d af 39 14 '.....2..(.....9.'
    Alphanumeric Data String: 'N141C3-L07'
Checksum: 0xb2
