
EDID (hex):
00ffffffffffff002a59150200000000
0617010300301b78ead6a5a2594a9524
145054afcf00818081407140a9c08100
81c00101a940023a801871382d40582c
450070cf1000001a21399030621a2740
68b0360055001100001c9a29a0c95184
22305098360054ff1000001c000000fc
00416e616c6f670a2020202020200075

Extracted contents:
header:          00 ff ff ff ff ff ff 00
serial number:   2a 59 15 02 00 00 00 00 06 17
version:         01 03
basic params:    00 30 1b 78 ea
chroma info:     d6 a5 a2 59 4a 95 24 14 50 54
established:     af cf 00
standard:        81 80 81 40 71 40 a9 c0 81 00 81 c0 01 01 a9 40
descriptor 1:    02 3a 80 18 71 38 2d 40 58 2c 45 00 70 cf 10 00 00 1a
descriptor 2:    21 39 90 30 62 1a 27 40 68 b0 36 00 55 00 11 00 00 1c
descriptor 3:    9a 29 a0 c9 51 84 22 30 50 98 36 00 54 ff 10 00 00 1c
descriptor 4:    00 00 00 fc 00 41 6e 61 6c 6f 67 0a 20 20 20 20 20 20
extensions:      00
checksum:        75

EDID version: 1.3
Manufacturer: JRY Model 215 Serial Number --
Made in week 6 of 2013
Analog display, Input voltage level: 0.7/0.3 V
Sync: 
Maximum image size: 48 cm x 27 cm
Gamma: 2.20
DPMS levels: Standby Suspend Off
RGB color display
First detailed timing is preferred timing
Display x,y Chromaticity:
  Red:   0.6357, 0.3486
  Green: 0.2900, 0.5839
  Blue:  0.1425, 0.0800
  White: 0.3134, 0.3291
Established timings supported:
  720x400@70Hz 9:5 HorFreq: 31469 Hz Clock: 28.320 MHz
  640x480@60Hz 4:3 HorFreq: 31469 Hz Clock: 25.175 MHz
  640x480@72Hz 4:3 HorFreq: 37900 Hz Clock: 31.500 MHz
  640x480@75Hz 4:3 HorFreq: 37500 Hz Clock: 31.500 MHz
  800x600@56Hz 4:3 HorFreq: 35200 Hz Clock: 36.000 MHz
  800x600@60Hz 4:3 HorFreq: 37900 Hz Clock: 40.000 MHz
  800x600@72Hz 4:3 HorFreq: 48100 Hz Clock: 50.000 MHz
  800x600@75Hz 4:3 HorFreq: 46900 Hz Clock: 49.500 MHz
  1024x768@60Hz 4:3 HorFreq: 48400 Hz Clock: 65.000 MHz
  1024x768@70Hz 4:3 HorFreq: 56500 Hz Clock: 75.000 MHz
  1024x768@75Hz 4:3 HorFreq: 60000 Hz Clock: 78.750 MHz
  1280x1024@75Hz 5:4 HorFreq: 80000 Hz Clock: 135.000 MHz
Standard timings supported:
  1280x1024@60Hz 5:4 HorFreq: 64000 Hz Clock: 108.000 MHz
  1280x960@60Hz 4:3 HorFreq: 60000 Hz Clock: 108.000 MHz
  1152x864@60Hz 4:3
  1600x900@60Hz 16:9
  1280x800@60Hz 16:10
  1280x720@60Hz 16:9
  1600x1200@60Hz 4:3 HorFreq: 75000 Hz Clock: 162.000 MHz
Detailed mode: Clock 148.500 MHz, 368 mm x 207 mm
               1920 2008 2052 2200 hborder 0
               1080 1084 1089 1125 vborder 0
               +hsync -vsync 
               VertFreq: 60 Hz, HorFreq: 67500 Hz
Detailed mode: Clock 146.250 MHz, 341 mm x 256 mm
               1680 1784 1960 2240 hborder 0
               1050 1053 1059 1089 vborder 0
               -hsync +vsync 
               VertFreq: 59 Hz, HorFreq: 65290 Hz
Detailed mode: Clock 106.500 MHz, 340 mm x 255 mm
               1440 1520 1672 1897 hborder 0
                900  903  909  934 vborder 0
               -hsync +vsync 
               VertFreq: 60 Hz, HorFreq: 56141 Hz
Monitor name: Analog
Checksum: 0x75 (valid)
EDID block does NOT conform to EDID 1.3!
	Missing monitor ranges
