edid-decode (hex):

00 ff ff ff ff ff ff 00 4c 83 43 34 00 00 00 00
00 19 01 03 80 1a 0e 78 ea 1d 85 91 56 59 8f 26
18 50 54 00 00 00 01 01 01 01 01 01 01 01 01 01
01 01 01 01 01 01 3e 1c 56 a0 50 00 16 30 30 20
25 00 00 90 10 00 00 19 00 00 00 0f 00 00 00 00
00 00 00 00 00 25 bf 06 15 00 00 00 00 fe 00 53
41 4d 53 55 4e 47 0a 20 4c 83 41 4c 00 00 00 fe
00 4c 54 4e 31 31 36 41 4c 30 32 39 30 31 00 65

----------------

Block 0, Base EDID:
  EDID Structure Version & Revision: 1.3
  Vendor & Product Identification:
    Manufacturer: SDC
    Model: 13379
    Made in: 2015
  Basic Display Parameters & Features:
    Digital display
    Maximum image size: 26 cm x 14 cm
    Gamma: 2.20
    DPMS levels: Standby Suspend Off
    RGB color display
    First detailed timing is the preferred timing
  Color Characteristics:
    Red  : 0.5664, 0.3369
    Green: 0.3505, 0.5595
    Blue : 0.1503, 0.0937
    White: 0.3134, 0.3291
  Established Timings I & II: none
  Standard Timings: none
  Detailed Timing Descriptors:
    DTD 1:  1366x768    59.973124 Hz 683:384   47.379 kHz     72.300000 MHz (256 mm x 144 mm)
                 Hfront   48 Hsync  32 Hback   80 Hpol N
                 Vfront    2 Vsync   5 Vback   15 Vpol N
    Manufacturer-Specified Display Descriptor (0x0f): 00 0f 00 00 00 00 00 00 00 00 00 25 bf 06 15 00 '...........%....'
    Alphanumeric Data String: 'SAMSUNG'
    Alphanumeric Data String: 'LTN116AL02901'
Checksum: 0x65

----------------

Failures:

Block 0, Base EDID:
  Alphanumeric Data String: Non-space after newline.
  Missing Display Product Name.
  Missing Display Range Limits Descriptor.

EDID conformity: FAIL
