
EDID (hex):
00ffffffffffff0010acd1a051573430
0b1b0104a53c227806ee91a3544c9926
0f505421080001010101010101010101
010101010101565e00a0a0a029503020
350056502100001a000000ff00234153
507575694770646a4c64000000fd001e
9022d139010a202020202020000000fc
0044656c6c20533237313644470a01bb
020312412309070183010000654b0400
01015a8700a0a0a03b50302035005650
2100001a5aa000a0a0a0465030203500
56502100001a6fc200a0a0a055503020
350056502100001a8fde00a0a0a00f50
3020350056502100001e1c2500a0a0a0
11503020350056502100001a00000000
00000000000000000000000000000098

Extracted contents:
header:          00 ff ff ff ff ff ff 00
serial number:   10 ac d1 a0 51 57 34 30 0b 1b
version:         01 04
basic params:    a5 3c 22 78 06
chroma info:     ee 91 a3 54 4c 99 26 0f 50 54
established:     21 08 00
standard:        01 01 01 01 01 01 01 01 01 01 01 01 01 01 01 01
descriptor 1:    56 5e 00 a0 a0 a0 29 50 30 20 35 00 56 50 21 00 00 1a
descriptor 2:    00 00 00 ff 00 23 41 53 50 75 75 69 47 70 64 6a 4c 64
descriptor 3:    00 00 00 fd 00 1e 90 22 d1 39 01 0a 20 20 20 20 20 20
descriptor 4:    00 00 00 fc 00 44 65 6c 6c 20 53 32 37 31 36 44 47 0a
extensions:      01
checksum:        bb

EDID version: 1.4
Manufacturer: DEL Model a0d1 Serial Number --
Made in week 11 of 2017
Digital display
8 bits per primary color channel
DisplayPort interface
Maximum image size: 60 cm x 34 cm
Gamma: 2.20
Supported color formats: RGB 4:4:4
Default (sRGB) color space is primary color space
First detailed timing includes the native pixel format and preferred refresh rate
Display x,y Chromaticity:
  Red:   0.6396, 0.3300
  Green: 0.2998, 0.5996
  Blue:  0.1503, 0.0595
  White: 0.3125, 0.3291
Established timings supported:
  640x480@60Hz 4:3 HorFreq: 31469 Hz Clock: 25.175 MHz
  800x600@60Hz 4:3 HorFreq: 37900 Hz Clock: 40.000 MHz
  1024x768@60Hz 4:3 HorFreq: 48400 Hz Clock: 65.000 MHz
Standard timings supported:
Detailed mode: Clock 241.500 MHz, 598 mm x 336 mm
               2560 2608 2640 2720 hborder 0
               1440 1443 1448 1481 vborder 0
               +hsync -vsync 
               VertFreq: 59 Hz, HorFreq: 88786 Hz
Serial number: --
Monitor ranges (bare limits): 30-144Hz V, 34-209kHz H, max dotclock 570MHz
Monitor name: Dell S2716DG
Has 1 extension blocks
Checksum: 0xbb (valid)

CTA extension block
Extension version: 3
14 bytes of CTA data
  Audio data block
    Linear PCM, max channels 2
      Supported sample rates (kHz): 48 44.1 32
      Supported sample sizes (bits): 16
  Speaker allocation data block
    Speaker map:
      FL/FR - Front Left/Right
  Vendor-specific data block, OUI 00044b
Basic audio support
1 native detailed modes
Detailed mode: Clock 346.500 MHz, 598 mm x 336 mm
               2560 2608 2640 2720 hborder 0
               1440 1443 1448 1499 vborder 0
               +hsync -vsync 
               VertFreq: 84 Hz, HorFreq: 127389 Hz
Detailed mode: Clock 410.500 MHz, 598 mm x 336 mm
               2560 2608 2640 2720 hborder 0
               1440 1443 1448 1510 vborder 0
               +hsync -vsync 
               VertFreq: 99 Hz, HorFreq: 150919 Hz
Detailed mode: Clock 497.750 MHz, 598 mm x 336 mm
               2560 2608 2640 2720 hborder 0
               1440 1443 1448 1525 vborder 0
               +hsync -vsync 
               VertFreq: 119 Hz, HorFreq: 182996 Hz
Detailed mode: Clock 569.750 MHz, 598 mm x 336 mm
               2560 2608 2640 2720 hborder 0
               1440 1443 1448 1455 vborder 0
               +hsync +vsync 
               VertFreq: 143 Hz, HorFreq: 209466 Hz
Detailed mode: Clock 95.000 MHz, 598 mm x 336 mm
               2560 2608 2640 2720 hborder 0
               1440 1443 1448 1457 vborder 0
               +hsync -vsync 
               VertFreq: 23 Hz, HorFreq: 34926 Hz
Checksum: 0x98 (valid)

Warning: One or more of the timings is out of range of the Monitor Ranges:
  Vertical Freq: 23 - 143 Hz
  Horizontal Freq: 31469 - 209466 Hz
  Maximum Clock: 569.750 MHz
EDID block does not conform at all!
	Both the serial number and the serial string are set
