
EDID (hex):
00ffffffffffff0030ae667845540000
05140103002c19782e9535a159579f27
0e5054a10800950081c0010101010101
010101010101302a40c8608464301850
1300bbf91000001e000000fd00324c1e
5311000a202020202020000000fc004c
454e4f564f20423330300a20000000ff
0032313233313332313233330a20004f

Extracted contents:
header:          00 ff ff ff ff ff ff 00
serial number:   30 ae 66 78 45 54 00 00 05 14
version:         01 03
basic params:    00 2c 19 78 2e
chroma info:     95 35 a1 59 57 9f 27 0e 50 54
established:     a1 08 00
standard:        95 00 81 c0 01 01 01 01 01 01 01 01 01 01 01 01
descriptor 1:    30 2a 40 c8 60 84 64 30 18 50 13 00 bb f9 10 00 00 1e
descriptor 2:    00 00 00 fd 00 32 4c 1e 53 11 00 0a 20 20 20 20 20 20
descriptor 3:    00 00 00 fc 00 4c 45 4e 4f 56 4f 20 42 33 30 30 0a 20
descriptor 4:    00 00 00 ff 00 32 31 32 33 31 33 32 31 32 33 33 0a 20
extensions:      00
checksum:        4f

EDID version: 1.3
Manufacturer: LEN Model 7866 Serial Number --
Made in week 5 of 2010
Analog display, Input voltage level: 0.7/0.3 V
Sync: 
Maximum image size: 44 cm x 25 cm
Gamma: 2.20
DPMS levels: Off
RGB color display
Default (sRGB) color space is primary color space
First detailed timing is preferred timing
Display x,y Chromaticity:
  Red:   0.6308, 0.3486
  Green: 0.3408, 0.6220
  Blue:  0.1523, 0.0576
  White: 0.3134, 0.3291
Established timings supported:
  720x400@70Hz 9:5 HorFreq: 31469 Hz Clock: 28.320 MHz
  640x480@60Hz 4:3 HorFreq: 31469 Hz Clock: 25.175 MHz
  800x600@60Hz 4:3 HorFreq: 37900 Hz Clock: 40.000 MHz
  1024x768@60Hz 4:3 HorFreq: 48400 Hz Clock: 65.000 MHz
Standard timings supported:
  1440x900@60Hz 16:10 HorFreq: 55500 Hz Clock: 88.750 MHz
  1280x720@60Hz 16:9
Detailed mode: Clock 108.000 MHz, 443 mm x 249 mm
               1600 1624 1704 1800 hborder 0
                900  901  904 1000 vborder 0
               +hsync +vsync 
               VertFreq: 60 Hz, HorFreq: 60000 Hz
Monitor ranges (GTF): 50-76Hz V, 30-83kHz H, max dotclock 170MHz
Monitor name: LENOVO B300
Serial number: --
Checksum: 0x4f (valid)
EDID block does NOT conform to EDID 1.3!
	sRGB is signaled, but the chromaticities do not match
