edid-decode (hex):

00 ff ff ff ff ff ff 00 4c 2e 74 0b 01 01 01 01
00 13 01 02 08 39 20 78 2a 97 7d a4 56 4b 98 1d
10 47 4a af ce 00 01 01 01 01 01 01 01 01 01 01
01 01 01 01 01 01 66 21 50 b0 51 00 1b 30 40 70
36 00 3a 40 21 00 00 1e 00 00 00 fd 00 38 56 1e
46 0b 00 0a 20 20 20 20 20 20 00 00 00 fc 00 53
41 4e 59 4f 20 4c 43 44 0a 20 20 20 00 00 00 fe
00 0a 20 20 20 20 20 20 20 20 20 20 20 20 00 c3

----------------

Block 0, Base EDID:
  EDID Structure Version & Revision: 1.2
  Vendor & Product Identification:
    Manufacturer: SAN
    Model: 2932
    Serial Number: ...
    Made in: 2009
  Basic Display Parameters & Features:
    Analog display
    Signal Level Standard: 0.700 : 0.300 : 1.000 V p-p
    Blank level equals black level
    Sync: Separate
    Maximum image size: 57 cm x 32 cm
    Gamma: 2.20
    DPMS levels: Off
    RGB color display
    First detailed timing is the preferred timing
  Color Characteristics:
    Red  : 0.6425, 0.3369
    Green: 0.2939, 0.5966
    Blue : 0.1142, 0.0654
    White: 0.2802, 0.2900
  Established Timings I & II:
    IBM     :   720x400    70.081663 Hz   9:5     31.467 kHz     28.320000 MHz
    DMT 0x04:   640x480    59.940476 Hz   4:3     31.469 kHz     25.175000 MHz
    DMT 0x05:   640x480    72.808802 Hz   4:3     37.861 kHz     31.500000 MHz
    DMT 0x06:   640x480    75.000000 Hz   4:3     37.500 kHz     31.500000 MHz
    DMT 0x08:   800x600    56.250000 Hz   4:3     35.156 kHz     36.000000 MHz
    DMT 0x09:   800x600    60.316541 Hz   4:3     37.879 kHz     40.000000 MHz
    DMT 0x0a:   800x600    72.187572 Hz   4:3     48.077 kHz     50.000000 MHz
    DMT 0x0b:   800x600    75.000000 Hz   4:3     46.875 kHz     49.500000 MHz
    DMT 0x10:  1024x768    60.003840 Hz   4:3     48.363 kHz     65.000000 MHz
    DMT 0x11:  1024x768    70.069359 Hz   4:3     56.476 kHz     75.000000 MHz
    DMT 0x12:  1024x768    75.028582 Hz   4:3     60.023 kHz     78.750000 MHz
  Standard Timings: none
  Detailed Timing Descriptors:
    DTD 1:  1360x768    60.015162 Hz  85:48    47.712 kHz     85.500000 MHz (570 mm x 320 mm)
                 Hfront   64 Hsync 112 Hback  256 Hpol P
                 Vfront    3 Vsync   6 Vback   18 Vpol P
    Display Range Limits:
      Monitor ranges (GTF): 56-86 Hz V, 30-70 kHz H, max dotclock 110 MHz
    Display Product Name: 'SANYO LCD'
    Alphanumeric Data String: ''
Checksum: 0xc3

----------------

Warnings:

Block 0, Base EDID:
  EDID Structure Version & Revision: EDID 1.2 is deprecated, do not use.

Failures:

Block 0, Base EDID:
  Alphanumeric Data String: Empty string.

EDID conformity: FAIL
