edid-decode (hex):

00 ff ff ff ff ff ff 00 41 0c e4 c0 bf 50 00 00
2f 18 01 03 6e 3c 22 78 2a 48 15 a7 56 52 9c 27
0f 50 54 bd 4b 00 d1 c0 95 00 95 0f b3 00 81 c0
81 80 01 01 01 01 02 3a 80 18 71 38 2d 40 58 2c
45 00 56 50 21 00 00 1e 00 00 00 ff 00 55 48 42
31 34 34 37 30 32 30 36 37 31 00 00 00 fc 00 50
48 4c 20 32 37 35 43 35 0a 20 20 20 00 00 00 fd
00 38 4c 1e 53 11 00 0a 20 20 20 20 20 20 00 9d

00 ff ff ff ff ff ff 00 41 0c e4 c0 bf 50 00 00
2f 18 01 03 6e 3c 22 78 2a 48 15 a7 56 52 9c 27
0f 50 54 bd 4b 00 d1 c0 95 00 95 0f b3 00 81 c0
81 80 01 01 01 01 02 3a 80 18 71 38 2d 40 58 2c
45 00 56 50 21 00 00 1e 00 00 00 ff 00 55 48 42
31 34 34 37 30 32 30 36 37 31 00 00 00 fc 00 50
48 4c 20 32 37 35 43 35 0a 20 20 20 00 00 00 fd
00 38 4c 1e 53 11 00 0a 20 20 20 20 20 20 00 9d

----------------

Block 0, Base EDID:
  EDID Structure Version & Revision: 1.3
  Vendor & Product Identification:
    Manufacturer: PHL
    Model: 49380
    Serial Number: ...
    Made in: week 47 of 2014
  Basic Display Parameters & Features:
    Analog display
    Signal Level Standard: 0.700 : 0.000 : 0.700 V p-p
    Blank level equals black level
    Sync: Separate Composite SyncOnGreen
    Maximum image size: 60 cm x 34 cm
    Gamma: 2.20
    DPMS levels: Off
    RGB color display
    First detailed timing is the preferred timing
  Color Characteristics:
    Red  : 0.6533, 0.3359
    Green: 0.3222, 0.6093
    Blue : 0.1523, 0.0595
    White: 0.3134, 0.3291
  Established Timings I & II:
    IBM     :   720x400    70.081663 Hz   9:5     31.467 kHz     28.320000 MHz
    DMT 0x04:   640x480    59.940476 Hz   4:3     31.469 kHz     25.175000 MHz
    Apple   :   640x480    66.666667 Hz   4:3     35.000 kHz     30.240000 MHz
    DMT 0x05:   640x480    72.808802 Hz   4:3     37.861 kHz     31.500000 MHz
    DMT 0x06:   640x480    75.000000 Hz   4:3     37.500 kHz     31.500000 MHz
    DMT 0x09:   800x600    60.316541 Hz   4:3     37.879 kHz     40.000000 MHz
    DMT 0x0b:   800x600    75.000000 Hz   4:3     46.875 kHz     49.500000 MHz
    DMT 0x10:  1024x768    60.003840 Hz   4:3     48.363 kHz     65.000000 MHz
    DMT 0x12:  1024x768    75.028582 Hz   4:3     60.023 kHz     78.750000 MHz
    DMT 0x24:  1280x1024   75.024675 Hz   5:4     79.976 kHz    135.000000 MHz
  Standard Timings:
    DMT 0x52:  1920x1080   60.000000 Hz  16:9     67.500 kHz    148.500000 MHz
    DMT 0x2f:  1440x900    59.887445 Hz  16:10    55.935 kHz    106.500000 MHz
    DMT 0x30:  1440x900    74.984427 Hz  16:10    70.635 kHz    136.750000 MHz
    DMT 0x3a:  1680x1050   59.954250 Hz  16:10    65.290 kHz    146.250000 MHz
    DMT 0x55:  1280x720    60.000000 Hz  16:9     45.000 kHz     74.250000 MHz
    DMT 0x23:  1280x1024   60.019740 Hz   5:4     63.981 kHz    108.000000 MHz
  Detailed Timing Descriptors:
    DTD 1:  1920x1080   60.000000 Hz  16:9     67.500 kHz    148.500000 MHz (598 mm x 336 mm)
                 Hfront   88 Hsync  44 Hback  148 Hpol P
                 Vfront    4 Vsync   5 Vback   36 Vpol P
    Display Product Serial Number: ...
    Display Product Name: 'PHL 275C5'
    Display Range Limits:
      Monitor ranges (GTF): 56-76 Hz V, 30-83 kHz H, max dotclock 170 MHz
Checksum: 0x9d

----------------

Block 1, Unknown EDID Extension Block 0x00:
  00 ff ff ff ff ff ff 00 41 0c e4 c0 bf 50 00 00 '........A....P..'
  2f 18 01 03 6e 3c 22 78 2a 48 15 a7 56 52 9c 27 '/...n<"x*H..VR.''
  0f 50 54 bd 4b 00 d1 c0 95 00 95 0f b3 00 81 c0 '.PT.K...........'
  81 80 01 01 01 01 02 3a 80 18 71 38 2d 40 58 2c '.......:..q8-@X,'
  45 00 56 50 21 00 00 1e 00 00 00 ff 00 55 48 42 'E.VP!........UHB'
  31 34 34 37 30 32 30 36 37 31 00 00 00 fc 00 50 '1447020671.....P'
  48 4c 20 32 37 35 43 35 0a 20 20 20 00 00 00 fd 'HL 275C5.   ....'
  00 38 4c 1e 53 11 00 0a 20 20 20 20 20 20 00 9d '.8L.S...      ..'
Checksum: 0x9d

----------------

Failures:

Block 1, Base EDID:
  Unknown Extension Block.
EDID:
  Base EDID: EDID specified 0 extension block(s), but found 1 extension block(s).

EDID conformity: FAIL
