
EDID (hex):
00ffffffffffff0022f0eb2601010101
0212010368221b8cee5e50a6544c9926
145054adef8081800101010101010101
010101010101302a009851002a403070
1300540e1100001e000000fd00324d18
530e000a202020202020000000fc0048
50204c313731300a20202020000000ff
00434e43383032504350310a20200044

Extracted contents:
header:          00 ff ff ff ff ff ff 00
serial number:   22 f0 eb 26 01 01 01 01 02 12
version:         01 03
basic params:    68 22 1b 8c ee
chroma info:     5e 50 a6 54 4c 99 26 14 50 54
established:     ad ef 80
standard:        81 80 01 01 01 01 01 01 01 01 01 01 01 01 01 01
descriptor 1:    30 2a 00 98 51 00 2a 40 30 70 13 00 54 0e 11 00 00 1e
descriptor 2:    00 00 00 fd 00 32 4d 18 53 0e 00 0a 20 20 20 20 20 20
descriptor 3:    00 00 00 fc 00 48 50 20 4c 31 37 31 30 0a 20 20 20 20
descriptor 4:    00 00 00 ff 00 43 4e 43 38 30 32 50 43 50 31 0a 20 20
extensions:      00
checksum:        44

EDID version: 1.3
Manufacturer: HWP Model 26eb Serial Number --
Made in week 2 of 2008
Analog display, Input voltage level: 0.7/0.7 V
Sync: Separate 
Maximum image size: 34 cm x 27 cm
Gamma: 2.40
DPMS levels: Standby Suspend Off
RGB color display
Default (sRGB) color space is primary color space
First detailed timing is preferred timing
Display x,y Chromaticity:
  Red:   0.6494, 0.3291
  Green: 0.2998, 0.5996
  Blue:  0.1494, 0.0791
  White: 0.3125, 0.3281
Established timings supported:
  720x400@70Hz 9:5 HorFreq: 31469 Hz Clock: 28.320 MHz
  640x480@60Hz 4:3 HorFreq: 31469 Hz Clock: 25.175 MHz
  640x480@72Hz 4:3 HorFreq: 37900 Hz Clock: 31.500 MHz
  640x480@75Hz 4:3 HorFreq: 37500 Hz Clock: 31.500 MHz
  800x600@60Hz 4:3 HorFreq: 37900 Hz Clock: 40.000 MHz
  800x600@72Hz 4:3 HorFreq: 48100 Hz Clock: 50.000 MHz
  800x600@75Hz 4:3 HorFreq: 46900 Hz Clock: 49.500 MHz
  832x624@75Hz 4:3 HorFreq: 49726 Hz Clock: 57.284 MHz
  1024x768@60Hz 4:3 HorFreq: 48400 Hz Clock: 65.000 MHz
  1024x768@70Hz 4:3 HorFreq: 56500 Hz Clock: 75.000 MHz
  1024x768@75Hz 4:3 HorFreq: 60000 Hz Clock: 78.750 MHz
  1280x1024@75Hz 5:4 HorFreq: 80000 Hz Clock: 135.000 MHz
  1152x870@75Hz 192:145 HorFreq: 67500 Hz Clock: 108.000 MHz
Standard timings supported:
  1280x1024@60Hz 5:4 HorFreq: 64000 Hz Clock: 108.000 MHz
Detailed mode: Clock 108.000 MHz, 340 mm x 270 mm
               1280 1328 1440 1688 hborder 0
               1024 1025 1028 1066 vborder 0
               +hsync +vsync 
               VertFreq: 60 Hz, HorFreq: 63981 Hz
Monitor ranges (GTF): 50-77Hz V, 24-83kHz H, max dotclock 140MHz
Monitor name: HP L1710
Serial number: --
Checksum: 0x44 (valid)
EDID block does NOT conform to EDID 1.3!
	sRGB is signaled, but the chromaticities do not match
