edid-decode (hex):

00 ff ff ff ff ff ff 00 06 af 9d 13 00 00 00 00
01 19 01 04 a5 26 15 78 02 59 d5 a3 56 52 9c 26
0c 50 54 00 00 00 01 01 01 01 01 01 01 01 01 01
01 01 01 01 01 01 fa 37 80 dc 70 38 24 40 10 10
3e 00 7d d6 10 00 00 18 d8 2c 80 dc 70 38 24 40
10 10 3e 00 7d d6 10 00 00 1a 00 00 00 fe 00 41
55 4f 0a 20 20 20 20 20 20 20 20 20 00 00 00 fe
00 42 31 37 33 48 41 4e 30 31 2e 33 20 0a 00 c9

----------------

Block 0, Base EDID:
  EDID Structure Version & Revision: 1.4
  Vendor & Product Identification:
    Manufacturer: AUO
    Model: 5021
    Made in: week 1 of 2015
  Basic Display Parameters & Features:
    Digital display
    Bits per primary color channel: 8
    DisplayPort interface
    Maximum image size: 38 cm x 21 cm
    Gamma: 2.20
    Supported color formats: RGB 4:4:4
    First detailed timing includes the native pixel format and preferred refresh rate
  Color Characteristics:
    Red  : 0.6376, 0.3369
    Green: 0.3222, 0.6103
    Blue : 0.1513, 0.0478
    White: 0.3134, 0.3291
  Established Timings I & II: none
  Standard Timings: none
  Detailed Timing Descriptors:
    DTD 1:  1920x1080   60.002 Hz  16:9    66.963 kHz 143.300 MHz (381 mm x 214 mm)
                 Hfront   16 Hsync  16 Hback 188 Hpol N
                 Vfront    3 Vsync  14 Vback  19 Vpol N
    DTD 2:  1920x1080   48.069 Hz  16:9    53.645 kHz 114.800 MHz (381 mm x 214 mm)
                 Hfront   16 Hsync  16 Hback 188 Hpol P
                 Vfront    3 Vsync  14 Vback  19 Vpol N
    Alphanumeric Data String: 'AUO'
    Alphanumeric Data String: 'B173HAN01.3 '
Checksum: 0xc9

----------------

Failures:

Block 0, Base EDID:
  Alphanumeric Data String: One or more trailing spaces.
  Missing Display Product Name.

EDID conformity: FAIL
