edid-decode (hex):

00 ff ff ff ff ff ff 00 4d 10 83 14 00 00 00 00
05 1b 01 04 a5 1d 11 78 06 de 50 a3 54 4c 99 26
0f 50 54 00 00 00 01 01 01 01 01 01 01 01 01 01
01 01 01 01 01 01 ad 36 80 62 70 38 4c 40 09 09
05 0c 26 a5 10 00 00 18 ad 36 80 62 70 38 6d 41
09 09 05 0c 26 a5 10 00 00 18 00 00 00 10 00 00
00 00 00 00 00 00 00 00 00 00 00 00 00 00 00 fc
00 4c 51 31 33 33 4d 31 4a 57 32 38 0a 20 00 76

----------------

Block 0, Base EDID:
  EDID Structure Version & Revision: 1.4
  Vendor & Product Identification:
    Manufacturer: SHP
    Model: 5251
    Made in: week 5 of 2017
  Basic Display Parameters & Features:
    Digital display
    Bits per primary color channel: 8
    DisplayPort interface
    Maximum image size: 29 cm x 17 cm
    Gamma: 2.20
    Supported color formats: RGB 4:4:4
    Default (sRGB) color space is primary color space
    First detailed timing includes the native pixel format and preferred refresh rate
  Color Characteristics:
    Red  : 0.6396, 0.3291
    Green: 0.2998, 0.5996
    Blue : 0.1494, 0.0595
    White: 0.3125, 0.3281
  Established Timings I & II: none
  Standard Timings: none
  Detailed Timing Descriptors:
    DTD 1:  1920x1080   60.001 Hz  16:9    69.361 kHz 139.970 MHz (294 mm x 165 mm)
                 Hfront    9 Hsync   9 Hback  80 Hpol N
                 Vfront   48 Vsync   5 Vback  23 Vpol N
    DTD 2:  1920x1080   48.001 Hz  16:9    69.361 kHz 139.970 MHz (294 mm x 165 mm)
                 Hfront    9 Hsync   9 Hback  80 Hpol N
                 Vfront   48 Vsync   5 Vback 312 Vpol N
    Dummy Descriptor:
    Display Product Name: 'LQ133M1JW28'
Checksum: 0x76
