edid-decode (hex):

00 ff ff ff ff ff ff 00 04 72 d5 06 c5 00 00 00
16 1d 01 03 80 78 22 78 2a 86 e1 ae 4f 44 ab 24
0f 50 54 bf ef 80 d1 c0 b3 00 95 00 81 80 71 4f
81 c0 81 40 a9 40 93 69 00 c8 f0 38 23 40 30 20
35 00 ac 50 41 00 00 1a 00 00 00 fd 00 30 44 36
a0 1e 00 0a 20 20 20 20 20 20 00 00 00 fc 00 45
49 34 39 31 43 52 0a 20 20 20 20 20 00 00 00 ff
00 54 46 55 41 41 30 30 31 33 5a 30 31 0a 01 65

02 03 2e f1 4c 1f 01 02 03 04 05 90 11 12 13 14
3f 23 09 7f 07 83 01 00 00 6d 03 0c 00 30 00 38
3c 20 00 60 01 02 03 e3 05 e3 01 e2 0e 1f 02 3a
80 18 71 38 2d 40 58 2c 96 00 ac 50 41 00 00 1e
56 5e 00 a0 a0 a0 29 50 30 20 35 00 ac 50 41 00
00 1e 00 00 00 00 00 00 00 00 00 00 00 00 00 00
00 00 00 00 00 00 00 00 00 00 00 00 00 00 00 00
00 00 00 00 00 00 00 00 00 00 00 00 00 00 00 46

----------------

Block 0, Base EDID:
  EDID Structure Version & Revision: 1.3
  Vendor & Product Identification:
    Manufacturer: ACR
    Model: 1749
    Serial Number: ...
    Made in: week 22 of 2019
  Basic Display Parameters & Features:
    Digital display
    Maximum image size: 120 cm x 34 cm
    Gamma: 2.20
    DPMS levels: Off
    RGB color display
    First detailed timing is the preferred timing
  Color Characteristics:
    Red  : 0.6816, 0.3085
    Green: 0.2666, 0.6699
    Blue : 0.1435, 0.0605
    White: 0.3125, 0.3291
  Established Timings I & II:
    IBM     :   720x400    70.082 Hz   9:5    31.467 kHz  28.320 MHz
    DMT 0x04:   640x480    59.940 Hz   4:3    31.469 kHz  25.175 MHz
    Apple   :   640x480    66.667 Hz   4:3    35.000 kHz  30.240 MHz
    DMT 0x05:   640x480    72.809 Hz   4:3    37.861 kHz  31.500 MHz
    DMT 0x06:   640x480    75.000 Hz   4:3    37.500 kHz  31.500 MHz
    DMT 0x08:   800x600    56.250 Hz   4:3    35.156 kHz  36.000 MHz
    DMT 0x09:   800x600    60.317 Hz   4:3    37.879 kHz  40.000 MHz
    DMT 0x0a:   800x600    72.188 Hz   4:3    48.077 kHz  50.000 MHz
    DMT 0x0b:   800x600    75.000 Hz   4:3    46.875 kHz  49.500 MHz
    Apple   :   832x624    74.551 Hz   4:3    49.726 kHz  57.284 MHz
    DMT 0x10:  1024x768    60.004 Hz   4:3    48.363 kHz  65.000 MHz
    DMT 0x11:  1024x768    70.069 Hz   4:3    56.476 kHz  75.000 MHz
    DMT 0x12:  1024x768    75.029 Hz   4:3    60.023 kHz  78.750 MHz
    DMT 0x24:  1280x1024   75.025 Hz   5:4    79.976 kHz 135.000 MHz
    Apple   :  1152x870    75.062 Hz 192:145  68.681 kHz 100.000 MHz
  Standard Timings:
    DMT 0x52:  1920x1080   60.000 Hz  16:9    67.500 kHz 148.500 MHz
    DMT 0x3a:  1680x1050   59.954 Hz  16:10   65.290 kHz 146.250 MHz
    DMT 0x2f:  1440x900    59.887 Hz  16:10   55.935 kHz 106.500 MHz
    DMT 0x23:  1280x1024   60.020 Hz   5:4    63.981 kHz 108.000 MHz
    DMT 0x15:  1152x864    75.000 Hz   4:3    67.500 kHz 108.000 MHz
    DMT 0x55:  1280x720    60.000 Hz  16:9    45.000 kHz  74.250 MHz
    DMT 0x20:  1280x960    60.000 Hz   4:3    60.000 kHz 108.000 MHz
    DMT 0x33:  1600x1200   60.000 Hz   4:3    75.000 kHz 162.000 MHz
  Detailed Timing Descriptors:
    DTD 1:  3840x1080   59.999 Hz  32:9    66.899 kHz 270.270 MHz (1196 mm x 336 mm)
                 Hfront   48 Hsync  32 Hback 120 Hpol P
                 Vfront    3 Vsync   5 Vback  27 Vpol N
  Display Range Limits:
    Monitor ranges (GTF): 48-68 Hz V, 54-160 kHz H, max dotclock 300 MHz
    Display Product Name: 'EI491CR'
    Display Product Serial Number: ...
  Extension blocks: 1
Checksum: 0x65

----------------

Block 1, CTA-861 Extension Block:
  Revision: 3
  Underscans IT Video Formats by default
  Basic audio support
  Supports YCbCr 4:4:4
  Supports YCbCr 4:2:2
  Native detailed modes: 1
  Video Data Block:
    VIC  31:  1920x1080   50.000 Hz  16:9    56.250 kHz 148.500 MHz
    VIC   1:   640x480    59.940 Hz   4:3    31.469 kHz  25.175 MHz
    VIC   2:   720x480    59.940 Hz   4:3    31.469 kHz  27.000 MHz
    VIC   3:   720x480    59.940 Hz  16:9    31.469 kHz  27.000 MHz
    VIC   4:  1280x720    60.000 Hz  16:9    45.000 kHz  74.250 MHz
    VIC   5:  1920x1080i  60.000 Hz  16:9    33.750 kHz  74.250 MHz
    VIC  16:  1920x1080   60.000 Hz  16:9    67.500 kHz 148.500 MHz (native)
    VIC  17:   720x576    50.000 Hz   4:3    31.250 kHz  27.000 MHz
    VIC  18:   720x576    50.000 Hz  16:9    31.250 kHz  27.000 MHz
    VIC  19:  1280x720    50.000 Hz  16:9    37.500 kHz  74.250 MHz
    VIC  20:  1920x1080i  50.000 Hz  16:9    28.125 kHz  74.250 MHz
    VIC  63:  1920x1080  120.000 Hz  16:9   135.000 kHz 297.000 MHz
  Audio Data Block:
    Linear PCM:
      Max channels: 2
      Supported sample rates (kHz): 192 176.4 96 88.2 48 44.1 32
      Supported sample sizes (bits): 24 20 16
  Speaker Allocation Data Block:
    FL/FR - Front Left/Right
  Vendor-Specific Data Block (HDMI), OUI 00-0C-03:
    Source physical address: 3.0.0.0
    DC_36bit
    DC_30bit
    DC_Y444
    Maximum TMDS clock: 300 MHz
    Extended HDMI video details:
      HDMI VICs:
        HDMI VIC 1:  3840x2160   30.000 Hz  16:9    67.500 kHz 297.000 MHz
        HDMI VIC 2:  3840x2160   25.000 Hz  16:9    56.250 kHz 297.000 MHz
        HDMI VIC 3:  3840x2160   24.000 Hz  16:9    54.000 kHz 297.000 MHz
  Colorimetry Data Block:
    xvYCC601
    xvYCC709
    BT2020cYCC
    BT2020YCC
    BT2020RGB
  YCbCr 4:2:0 Video Data Block:
    VIC  31:  1920x1080   50.000 Hz  16:9    28.125 kHz  74.250 MHz
  Detailed Timing Descriptors:
    DTD 2:  1920x1080   60.000 Hz  16:9    67.500 kHz 148.500 MHz (1196 mm x 336 mm)
                 Hfront   88 Hsync  44 Hback 148 Hpol P
                 Vfront    9 Vsync   6 Vback  30 Vpol P
    DTD 3:  2560x1440   59.951 Hz  16:9    88.787 kHz 241.500 MHz (1196 mm x 336 mm)
                 Hfront   48 Hsync  32 Hback  80 Hpol P
                 Vfront    3 Vsync   5 Vback  33 Vpol P
Checksum: 0x46

----------------

Warnings:

Block 1, CTA-861 Extension Block:
  YCbCr 4:2:0 Video Data Block: Some YCbCr 4:2:0 timings are invalid for HDMI (which requires an RGB timings pixel rate >= 590 MHz).
  Display Product Serial Number is set, so the Serial Number in the Base EDID should be 0.
  Missing VCDB, needed for Set Selectable RGB Quantization to avoid interop issues.

Failures:

Block 1, CTA-861 Extension Block:
  YCbCr 4:2:0 Video Data Block: YCbCr 4:2:0-only VIC 31 is also a regular VIC.
  HDMI VIC Codes must have their CTA-861 VIC equivalents in the VSB.
EDID:
  Base EDID: Some timings are out of range of the Monitor Ranges:
    Vertical Freq: 24.000 - 120.000 Hz (Monitor: 48.000 - 68.000 Hz)
    Horizontal Freq: 28.125 - 135.000 kHz (Monitor: 54.000 - 160.000 kHz)
  CTA-861: Native progressive timings are a mix of several resolutions.

EDID conformity: FAIL
