
EDID (hex):
00ffffffffffff0004720705350e0000
2f1e0103804627782aa0b59d5952a026
0d5054bfef808180e1c0d1c0a940b300
d100a9c08100565e00a0a0a029503020
3500bb892100001a000000ff00544743
5341303031335030300a000000fd0037
4c1e671f000a202020202020000000fc
00454233323148515520430a202001f2
02010400b47640a0b0542e6030203500
bb892100001a00000000000000000000
00000000000000000000000000000000
00000000000000000000000000000000
00000000000000000000000000000000
00000000000000000000000000000000
00000000000000000000000000000000
00000000000000000000000000000059

Extracted contents:
header:          00 ff ff ff ff ff ff 00
serial number:   04 72 07 05 35 0e 00 00 2f 1e
version:         01 03
basic params:    80 46 27 78 2a
chroma info:     a0 b5 9d 59 52 a0 26 0d 50 54
established:     bf ef 80
standard:        81 80 e1 c0 d1 c0 a9 40 b3 00 d1 00 a9 c0 81 00
descriptor 1:    56 5e 00 a0 a0 a0 29 50 30 20 35 00 bb 89 21 00 00 1a
descriptor 2:    00 00 00 ff 00 54 47 43 53 41 30 30 31 33 50 30 30 0a
descriptor 3:    00 00 00 fd 00 37 4c 1e 67 1f 00 0a 20 20 20 20 20 20
descriptor 4:    00 00 00 fc 00 45 42 33 32 31 48 51 55 20 43 0a 20 20
extensions:      01
checksum:        f2

EDID version: 1.3
Manufacturer: ACR Model 507 Serial Number --
Made in week 47 of 2020
Digital display
Maximum image size: 70 cm x 39 cm
Gamma: 2.20
DPMS levels: Off
RGB color display
First detailed timing is preferred timing
Display x,y Chromaticity:
  Red:   0.6152, 0.3496
  Green: 0.3203, 0.6250
  Blue:  0.1503, 0.0537
  White: 0.3134, 0.3291
Established timings supported:
  720x400@70Hz 9:5 HorFreq: 31469 Hz Clock: 28.320 MHz
  640x480@60Hz 4:3 HorFreq: 31469 Hz Clock: 25.175 MHz
  640x480@67Hz 4:3 HorFreq: 35000 Hz Clock: 30.240 MHz
  640x480@72Hz 4:3 HorFreq: 37900 Hz Clock: 31.500 MHz
  640x480@75Hz 4:3 HorFreq: 37500 Hz Clock: 31.500 MHz
  800x600@56Hz 4:3 HorFreq: 35200 Hz Clock: 36.000 MHz
  800x600@60Hz 4:3 HorFreq: 37900 Hz Clock: 40.000 MHz
  800x600@72Hz 4:3 HorFreq: 48100 Hz Clock: 50.000 MHz
  800x600@75Hz 4:3 HorFreq: 46900 Hz Clock: 49.500 MHz
  832x624@75Hz 4:3 HorFreq: 49726 Hz Clock: 57.284 MHz
  1024x768@60Hz 4:3 HorFreq: 48400 Hz Clock: 65.000 MHz
  1024x768@70Hz 4:3 HorFreq: 56500 Hz Clock: 75.000 MHz
  1024x768@75Hz 4:3 HorFreq: 60000 Hz Clock: 78.750 MHz
  1280x1024@75Hz 5:4 HorFreq: 80000 Hz Clock: 135.000 MHz
  1152x870@75Hz 192:145 HorFreq: 67500 Hz Clock: 108.000 MHz
Standard timings supported:
  1280x1024@60Hz 5:4 HorFreq: 64000 Hz Clock: 108.000 MHz
  2048x1152@60Hz 16:9
  1920x1080@60Hz 16:9
  1600x1200@60Hz 4:3 HorFreq: 75000 Hz Clock: 162.000 MHz
  1680x1050@60Hz 16:10 HorFreq: 64700 Hz Clock: 119.000 MHz
  1920x1200@60Hz 16:10 HorFreq: 74000 Hz Clock: 154.000 MHz
  1600x900@60Hz 16:9
  1280x800@60Hz 16:10
Detailed mode: Clock 241.500 MHz, 699 mm x 393 mm
               2560 2608 2640 2720 hborder 0
               1440 1443 1448 1481 vborder 0
               +hsync -vsync 
               VertFreq: 59 Hz, HorFreq: 88786 Hz
Serial number: --
Monitor ranges (GTF): 55-76Hz V, 30-103kHz H, max dotclock 310MHz
Monitor name: EB321HQU C
Has 1 extension blocks
Checksum: 0xf2 (valid)

CTA extension block
Extension version: 1
0 8-byte timing descriptors
Detailed mode: Clock 303.880 MHz, 699 mm x 393 mm
               2880 2928 2960 3040 hborder 0
               1620 1623 1628 1666 vborder 0
               +hsync -vsync 
               VertFreq: 60 Hz, HorFreq: 99960 Hz
Checksum: 0x59 (valid)

EDID block does not conform at all!
	Both the serial number and the serial string are set
