
EDID (hex):
00ffffffffffff0030e49b0300000000
00160103801c10780adce5975a559227
1d505400000001010101010101010101
010101010101241d56d4500016303020
2500159c1000001b0000000000000000
00000000000000000000000000fe004c
4720446973706c61790a2020000000fe
004c503132355748322d534c54330002

Extracted contents:
header:          00 ff ff ff ff ff ff 00
serial number:   30 e4 9b 03 00 00 00 00 00 16
version:         01 03
basic params:    80 1c 10 78 0a
chroma info:     dc e5 97 5a 55 92 27 1d 50 54
established:     00 00 00
standard:        01 01 01 01 01 01 01 01 01 01 01 01 01 01 01 01
descriptor 1:    24 1d 56 d4 50 00 16 30 30 20 25 00 15 9c 10 00 00 1b
descriptor 2:    00 00 00 00 00 00 00 00 00 00 00 00 00 00 00 00 00 00
descriptor 3:    00 00 00 fe 00 4c 47 20 44 69 73 70 6c 61 79 0a 20 20
descriptor 4:    00 00 00 fe 00 4c 50 31 32 35 57 48 32 2d 53 4c 54 33
extensions:      00
checksum:        02

EDID version: 1.3
Manufacturer: LGD Model 39b Serial Number --
Made in year 2012
Digital display
Maximum image size: 28 cm x 16 cm
Gamma: 2.20
RGB color display
First detailed timing is preferred timing
Display x,y Chromaticity:
  Red:   0.5927, 0.3525
  Green: 0.3349, 0.5703
  Blue:  0.1552, 0.1152
  White: 0.3134, 0.3291
Established timings supported:
Standard timings supported:
Detailed mode: Clock 74.600 MHz, 277 mm x 156 mm
               1366 1414 1446 1578 hborder 0
                768  770  775  790 vborder 0
               +hsync -vsync 
               VertFreq: 59 Hz, HorFreq: 47275 Hz
Manufacturer-specified data, tag 0
ASCII string: LG Display
ASCII string: LP125WH2-SLT3
Checksum: 0x2 (valid)
EDID block does NOT conform to EDID 1.3!
	Missing name descriptor
	Missing monitor ranges
