
EDID (hex):
00ffffffffffff000e11262801010101
1c13010368291778eeee95a3544c9926
0f5054a1080081408180010101010101
010101010101662156aa51001e30468f
33009ae61000001f000000fd00304c18
530e000a202020202020000000fc0043
6f6d7061712051313835390a000000ff
00334351393238334856330a202000a6

Extracted contents:
header:          00 ff ff ff ff ff ff 00
serial number:   0e 11 26 28 01 01 01 01 1c 13
version:         01 03
basic params:    68 29 17 78 ee
chroma info:     ee 95 a3 54 4c 99 26 0f 50 54
established:     a1 08 00
standard:        81 40 81 80 01 01 01 01 01 01 01 01 01 01 01 01
descriptor 1:    66 21 56 aa 51 00 1e 30 46 8f 33 00 9a e6 10 00 00 1f
descriptor 2:    00 00 00 fd 00 30 4c 18 53 0e 00 0a 20 20 20 20 20 20
descriptor 3:    00 00 00 fc 00 43 6f 6d 70 61 71 20 51 31 38 35 39 0a
descriptor 4:    00 00 00 ff 00 33 43 51 39 32 38 33 48 56 33 0a 20 20
extensions:      00
checksum:        a6

EDID version: 1.3
Manufacturer: CPQ Model 2826 Serial Number --
Made in week 28 of 2009
Analog display, Input voltage level: 0.7/0.7 V
Sync: Separate 
Maximum image size: 41 cm x 23 cm
Gamma: 2.20
DPMS levels: Standby Suspend Off
RGB color display
Default (sRGB) color space is primary color space
First detailed timing is preferred timing
Display x,y Chromaticity:
  Red:   0.6396, 0.3300
  Green: 0.2998, 0.5996
  Blue:  0.1503, 0.0595
  White: 0.3134, 0.3291
Established timings supported:
  720x400@70Hz 9:5 HorFreq: 31469 Hz Clock: 28.320 MHz
  640x480@60Hz 4:3 HorFreq: 31469 Hz Clock: 25.175 MHz
  800x600@60Hz 4:3 HorFreq: 37900 Hz Clock: 40.000 MHz
  1024x768@60Hz 4:3 HorFreq: 48400 Hz Clock: 65.000 MHz
Standard timings supported:
  1280x960@60Hz 4:3 HorFreq: 60000 Hz Clock: 108.000 MHz
  1280x1024@60Hz 5:4 HorFreq: 64000 Hz Clock: 108.000 MHz
Detailed mode: Clock 85.500 MHz, 410 mm x 230 mm
               1366 1436 1579 1792 hborder 0
                768  771  774  798 vborder 0
               +hsync +vsync 
               VertFreq: 59 Hz, HorFreq: 47712 Hz
Monitor ranges (GTF): 48-76Hz V, 24-83kHz H, max dotclock 140MHz
Monitor name: Compaq Q1859
Serial number: --
Checksum: 0xa6 (valid)
EDID block does NOT conform to EDID 1.3!
	sRGB is signaled, but the chromaticities do not match
