
EDID (hex):
00ffffffffffff004dd9700501010101
051e0103808048780adaffa3584aa229
17494b20000001010101010101010101
010101010101023a80d072382d40102c
4580ba882100001e023a801871382d40
582c4500ba882100001e000000fc0050
616e61736f6e69632d54560a000000fd
00173d0f440f000a2020202020200162
020336f04b1f10140520212213041203
350f7f071507503d1fc05704035f7e03
5f7e01677e03835f000068030c002100
b8260fe2004b023a80d072382d40102c
458010090000001e023a801871382d40
582c450010090000001e011d80d0721c
1620102c258010090000009e011d8018
711c1620582c250010090000009e0061

Extracted contents:
header:          00 ff ff ff ff ff ff 00
serial number:   4d d9 70 05 01 01 01 01 05 1e
version:         01 03
basic params:    80 80 48 78 0a
chroma info:     da ff a3 58 4a a2 29 17 49 4b
established:     20 00 00
standard:        01 01 01 01 01 01 01 01 01 01 01 01 01 01 01 01
descriptor 1:    02 3a 80 d0 72 38 2d 40 10 2c 45 80 ba 88 21 00 00 1e
descriptor 2:    02 3a 80 18 71 38 2d 40 58 2c 45 00 ba 88 21 00 00 1e
descriptor 3:    00 00 00 fc 00 50 61 6e 61 73 6f 6e 69 63 2d 54 56 0a
descriptor 4:    00 00 00 fd 00 17 3d 0f 44 0f 00 0a 20 20 20 20 20 20
extensions:      01
checksum:        62

EDID version: 1.3
Manufacturer: SNY Model 570 Serial Number --
Made in week 5 of 2020
Digital display
Maximum image size: 128 cm x 72 cm
Gamma: 2.20
RGB color display
First detailed timing is preferred timing
Display x,y Chromaticity:
  Red:   0.6396, 0.3447
  Green: 0.2910, 0.6347
  Blue:  0.1630, 0.0927
  White: 0.2880, 0.2958
Established timings supported:
  640x480@60Hz 4:3 HorFreq: 31469 Hz Clock: 25.175 MHz
Standard timings supported:
Detailed mode: Clock 148.500 MHz, 698 mm x 392 mm
               1920 2448 2492 2640 hborder 0
               1080 1084 1089 1125 vborder 0
               +hsync +vsync 
               VertFreq: 50 Hz, HorFreq: 56250 Hz
Detailed mode: Clock 148.500 MHz, 698 mm x 392 mm
               1920 2008 2052 2200 hborder 0
               1080 1084 1089 1125 vborder 0
               +hsync +vsync 
               VertFreq: 60 Hz, HorFreq: 67500 Hz
Monitor name: Panasonic-TV
Monitor ranges (GTF): 23-61Hz V, 15-68kHz H, max dotclock 150MHz
Has 1 extension blocks
Checksum: 0x62 (valid)

CTA extension block
Extension version: 3
50 bytes of CTA data
  Video data block
    VIC  31 1920x1080@50Hz 16:9  HorFreq: 56250 Hz Clock: 148.500 MHz
    VIC  16 1920x1080@60Hz 16:9  HorFreq: 67500 Hz Clock: 148.500 MHz
    VIC  20 1920x1080i@50Hz 16:9  HorFreq: 28125 Hz Clock: 74.250 MHz
    VIC   5 1920x1080i@60Hz 16:9  HorFreq: 33750 Hz Clock: 74.250 MHz
    VIC  32 1920x1080@24Hz 16:9  HorFreq: 27000 Hz Clock: 74.250 MHz
    VIC  33 1920x1080@25Hz 16:9  HorFreq: 28125 Hz Clock: 74.250 MHz
    VIC  34 1920x1080@30Hz 16:9  HorFreq: 33750 Hz Clock: 74.250 MHz
    VIC  19 1280x720@50Hz 16:9  HorFreq: 37500 Hz Clock: 74.250 MHz
    VIC   4 1280x720@60Hz 16:9  HorFreq: 45000 Hz Clock: 74.250 MHz
    VIC  18 720x576@50Hz 16:9  HorFreq: 31250 Hz Clock: 27.000 MHz
    VIC   3 720x480@60Hz 16:9  HorFreq: 31469 Hz Clock: 27.000 MHz
  Audio data block
    Linear PCM, max channels 8
      Supported sample rates (kHz): 192 176.4 96 88.2 48 44.1 32
      Supported sample sizes (bits): 24 20 16
    AC-3, max channels 6
      Supported sample rates (kHz): 48 44.1 32
      Maximum bit rate: 640 kHz
    DTS, max channels 6
      Supported sample rates (kHz): 96 88.2 48 44.1 32
      Maximum bit rate: 1536 kHz
    Dolby Digital+, max channels 8
      Supported sample rates (kHz): 48
    DTS-HD, max channels 8
      Supported sample rates (kHz): 192 176.4 96 88.2 48 44.1
    DTS-HD, max channels 8
      Supported sample rates (kHz): 192 176.4 96 88.2 48 44.1
    MAT (MLP), max channels 8
      Supported sample rates (kHz): 192 176.4 96 88.2 48 44.1
  Speaker allocation data block
    Speaker map:
      FL/FR - Front Left/Right
      LFE - Low Frequency Effects
      FC - Front Center
      BL/BR - Back Left/Right
      BC - Back Center
      RLC/RRC - Rear Left/Right of Center
  Vendor-specific data block, OUI 000c03 (HDMI)
    Source physical address 2.1.0.0
    Supports_AI
    DC_36bit
    DC_30bit
    DC_Y444
    Maximum TMDS clock: 190MHz
  Extended tag: Video capability data block
    YCbCr quantization: No Data (0)
    RGB quantization: Selectable (via AVI Q) (1)
    PT scan behaviour: No Data (0)
    IT scan behaviour: Always Underscanned (2)
    CE scan behaviour: Support both over- and underscan (3)
Underscans PC formats by default
Basic audio support
Supports YCbCr 4:4:4
Supports YCbCr 4:2:2
0 native detailed modes
Detailed mode: Clock 148.500 MHz, 16 mm x 9 mm
               1920 2448 2492 2640 hborder 0
               1080 1084 1089 1125 vborder 0
               +hsync +vsync 
               VertFreq: 50 Hz, HorFreq: 56250 Hz
Detailed mode: Clock 148.500 MHz, 16 mm x 9 mm
               1920 2008 2052 2200 hborder 0
               1080 1084 1089 1125 vborder 0
               +hsync +vsync 
               VertFreq: 60 Hz, HorFreq: 67500 Hz
Detailed mode: Clock 74.250 MHz, 16 mm x 9 mm
               1920 2448 2492 2640 hborder 0
                540  542  547  562 vborder 0
               +hsync +vsync interlaced 
               VertFreq: 50 Hz, HorFreq: 28125 Hz
Detailed mode: Clock 74.250 MHz, 16 mm x 9 mm
               1920 2008 2052 2200 hborder 0
                540  542  547  562 vborder 0
               +hsync +vsync interlaced 
               VertFreq: 60 Hz, HorFreq: 33750 Hz
Checksum: 0x61 (valid)
