edid-decode (hex):

00 ff ff ff ff ff ff 00 0d ae b6 14 00 00 00 00
1e 18 01 04 95 1f 11 78 02 ff 35 92 55 52 95 29
25 50 54 00 00 00 01 01 01 01 01 01 01 01 01 01
01 01 01 01 01 01 5e 35 80 96 70 38 14 40 2c 1c
24 00 34 ad 10 00 00 18 00 00 00 fe 00 4e 31 34
30 48 43 45 2d 45 42 41 0a 20 00 00 00 fe 00 43
4d 4e 0a 20 20 20 20 20 20 20 20 20 00 00 00 fe
00 4e 31 34 30 48 43 45 2d 45 42 41 0a 20 00 43

----------------

Block 0, Base EDID:
  EDID Structure Version & Revision: 1.4
  Vendor & Product Identification:
    Manufacturer: CMN
    Model: 5302
    Made in: week 30 of 2014
  Basic Display Parameters & Features:
    Digital display
    Bits per primary color channel: 6
    DisplayPort interface
    Maximum image size: 31 cm x 17 cm
    Gamma: 2.20
    Supported color formats: RGB 4:4:4
    First detailed timing includes the native pixel format and preferred refresh rate
  Color Characteristics:
    Red  : 0.5732, 0.3349
    Green: 0.3232, 0.5849
    Blue : 0.1601, 0.1474
    White: 0.3134, 0.3291
  Established Timings I & II: none
  Standard Timings: none
  Detailed Timing Descriptors:
    DTD 1:  1920x1080   60.000000 Hz  16:9     66.000 kHz    136.620000 MHz (308 mm x 173 mm)
                 Hfront   44 Hsync  28 Hback   78 Hpol N
                 Vfront    2 Vsync   4 Vback   14 Vpol N
    Alphanumeric Data String: 'N140HCE-EBA'
    Alphanumeric Data String: 'CMN'
    Alphanumeric Data String: 'N140HCE-EBA'
Checksum: 0x43

----------------

Warnings:

Block 0, Base EDID:
  Missing Display Product Name.

EDID conformity: PASS
