
EDID (hex):
00ffffffffffff0026cf190600000000
00120103802213780a7360a5564e9326
20505400000001010101010101010101
010101010101781d56c2500026303020
3c0058c1100000180000000f00000000
00000000000000000001000000fe0049
6e666f566973696f6e0a2020000000fe
004d3135364e5752312052300a2000a5

Extracted contents:
header:          00 ff ff ff ff ff ff 00
serial number:   26 cf 19 06 00 00 00 00 00 12
version:         01 03
basic params:    80 22 13 78 0a
chroma info:     73 60 a5 56 4e 93 26 20 50 54
established:     00 00 00
standard:        01 01 01 01 01 01 01 01 01 01 01 01 01 01 01 01
descriptor 1:    78 1d 56 c2 50 00 26 30 30 20 3c 00 58 c1 10 00 00 18
descriptor 2:    00 00 00 0f 00 00 00 00 00 00 00 00 00 00 00 00 00 01
descriptor 3:    00 00 00 fe 00 49 6e 66 6f 56 69 73 69 6f 6e 0a 20 20
descriptor 4:    00 00 00 fe 00 4d 31 35 36 4e 57 52 31 20 52 30 0a 20
extensions:      00
checksum:        a5

EDID version: 1.3
Manufacturer: IVO Model 619 Serial Number --
Made in year 2008
Digital display
Maximum image size: 34 cm x 19 cm
Gamma: 2.20
RGB color display
First detailed timing is preferred timing
Display x,y Chromaticity:
  Red:   0.6455, 0.3388
  Green: 0.3046, 0.5771
  Blue:  0.1494, 0.1269
  White: 0.3125, 0.3281
Established timings supported:
Standard timings supported:
Detailed mode: Clock 75.440 MHz, 344 mm x 193 mm
               1366 1414 1446 1560 hborder 0
                768  771  783  806 vborder 0
               -hsync -vsync 
               VertFreq: 59 Hz, HorFreq: 48358 Hz
Manufacturer-specified data, tag 15
ASCII string: InfoVision
ASCII string: M156NWR1 R0
Checksum: 0xa5 (valid)
EDID block does NOT conform to EDID 1.3!
	Missing name descriptor
	Missing monitor ranges
