
EDID (hex):
00ffffffffffff0030ae574000000000
0012010380211578eaba959759558c27
21505400000001010101010101010101
010101010101121b0080502014301820
44004bcf100000199416008050201430
182044004bcf100000190000000f0081
0a32810a2815090030ea0172000000fe
003135345758372d544c41320a200078

Extracted contents:
header:          00 ff ff ff ff ff ff 00
serial number:   30 ae 57 40 00 00 00 00 00 12
version:         01 03
basic params:    80 21 15 78 ea
chroma info:     ba 95 97 59 55 8c 27 21 50 54
established:     00 00 00
standard:        01 01 01 01 01 01 01 01 01 01 01 01 01 01 01 01
descriptor 1:    12 1b 00 80 50 20 14 30 18 20 44 00 4b cf 10 00 00 19
descriptor 2:    94 16 00 80 50 20 14 30 18 20 44 00 4b cf 10 00 00 19
descriptor 3:    00 00 00 0f 00 81 0a 32 81 0a 28 15 09 00 30 ea 01 72
descriptor 4:    00 00 00 fe 00 31 35 34 57 58 37 2d 54 4c 41 32 0a 20
extensions:      00
checksum:        78

EDID version: 1.3
Manufacturer: LEN Model 4057 Serial Number --
Made in year 2008
Digital display
Maximum image size: 33 cm x 21 cm
Gamma: 2.20
DPMS levels: Standby Suspend Off
RGB color display
First detailed timing is preferred timing
Display x,y Chromaticity:
  Red:   0.5917, 0.3505
  Green: 0.3339, 0.5488
  Blue:  0.1542, 0.1298
  White: 0.3134, 0.3291
Established timings supported:
Standard timings supported:
Detailed mode: Clock 69.300 MHz, 331 mm x 207 mm
               1280 1304 1336 1408 hborder 0
                800  804  808  820 vborder 0
               -hsync -vsync 
               VertFreq: 60 Hz, HorFreq: 49218 Hz
Detailed mode: Clock 57.800 MHz, 331 mm x 207 mm
               1280 1304 1336 1408 hborder 0
                800  804  808  820 vborder 0
               -hsync -vsync 
               VertFreq: 50 Hz, HorFreq: 41051 Hz
Manufacturer-specified data, tag 15
ASCII string: 154WX7-TLA2
Checksum: 0x78 (valid)
EDID block does NOT conform to EDID 1.3!
	Missing name descriptor
	Missing monitor ranges
