edid-decode (hex):

00 ff ff ff ff ff ff 00 09 e5 c5 09 00 00 00 00
16 21 01 04 a5 22 15 78 03 9f d5 ab 54 35 b5 23
14 54 54 00 00 00 01 01 01 01 01 01 01 01 01 01
01 01 01 01 01 01 8d 68 00 a0 a0 40 28 60 30 20
36 00 57 d6 10 00 00 1a 8d 68 00 a0 a0 40 28 60
30 20 36 00 57 d6 10 00 00 1a 00 00 00 fe 00 42
4f 45 20 42 33 0a 20 20 20 20 20 20 00 00 00 fe
00 47 56 31 35 39 51 44 42 2d 4e 38 30 0a 00 86

00 ff ff ff ff ff ff 00 09 e5 c5 09 00 00 00 00
16 21 01 04 a5 22 15 78 03 9f d5 ab 54 35 b5 23
14 54 54 00 00 00 01 01 01 01 01 01 01 01 01 01
01 01 01 01 01 01 8d 68 00 a0 a0 40 28 60 30 20
36 00 57 d6 10 00 00 1a 8d 68 00 a0 a0 40 28 60
30 20 36 00 57 d6 10 00 00 1a 00 00 00 fe 00 42
4f 45 20 42 33 0a 20 20 20 20 20 20 00 00 00 fe
00 47 56 31 35 39 51 44 42 2d 4e 38 30 0a 00 86

----------------

Block 0, Base EDID:
  EDID Structure Version & Revision: 1.4
  Vendor & Product Identification:
    Manufacturer: BOE
    Model: 2501
    Made in: week 22 of 2023
  Basic Display Parameters & Features:
    Digital display
    Bits per primary color channel: 8
    DisplayPort interface
    Maximum image size: 34 cm x 21 cm
    Gamma: 2.20
    Supported color formats: RGB 4:4:4
    First detailed timing includes the native pixel format and preferred refresh rate
    Display is continuous frequency
  Color Characteristics:
    Red  : 0.6699, 0.3291
    Green: 0.2099, 0.7099
    Blue : 0.1396, 0.0791
    White: 0.3291, 0.3291
  Established Timings I & II: none
  Standard Timings: none
  Detailed Timing Descriptors:
    DTD 1:  2560x1600   60.000448 Hz  16:10    98.401 kHz    267.650000 MHz (343 mm x 214 mm)
                 Hfront   48 Hsync  32 Hback   80 Hpol P
                 Vfront    3 Vsync   6 Vback   31 Vpol N
    DTD 2:  2560x1600   60.000448 Hz  16:10    98.401 kHz    267.650000 MHz (343 mm x 214 mm)
                 Hfront   48 Hsync  32 Hback   80 Hpol P
                 Vfront    3 Vsync   6 Vback   31 Vpol N
    Alphanumeric Data String: 'BOE B3'
    Alphanumeric Data String: 'GV159QDB-N80'
Checksum: 0x86

----------------

Block 1, Unknown EDID Extension Block 0x00:
  00 ff ff ff ff ff ff 00 09 e5 c5 09 00 00 00 00 '................'
  16 21 01 04 a5 22 15 78 03 9f d5 ab 54 35 b5 23 '.!...".x....T5.#'
  14 54 54 00 00 00 01 01 01 01 01 01 01 01 01 01 '.TT.............'
  01 01 01 01 01 01 8d 68 00 a0 a0 40 28 60 30 20 '.......h...@(`0 '
  36 00 57 d6 10 00 00 1a 8d 68 00 a0 a0 40 28 60 '6.W......h...@(`'
  30 20 36 00 57 d6 10 00 00 1a 00 00 00 fe 00 42 '0 6.W..........B'
  4f 45 20 42 33 0a 20 20 20 20 20 20 00 00 00 fe 'OE B3.      ....'
  00 47 56 31 35 39 51 44 42 2d 4e 38 30 0a 00 86 '.GV159QDB-N80...'
Checksum: 0x86

----------------

Warnings:

Block 0, Base EDID:
  Missing Display Product Name.

Failures:

Block 0, Base EDID:
  Missing Display Range Limits Descriptor.
Block 1, Base EDID:
  Unknown Extension Block.
EDID:
  Base EDID: EDID specified 0 extension block(s), but found 1 extension block(s).

EDID conformity: FAIL
