edid-decode (hex):

00 ff ff ff ff ff ff 00 09 e5 c5 09 00 00 00 00
2d 1e 01 04 a5 23 14 78 03 d4 8f aa 4e 3e b2 26
0e 49 46 00 00 00 01 01 01 01 01 01 01 01 01 01
01 01 01 01 01 01 74 3c 80 a0 70 38 a0 40 30 20
36 00 59 c3 10 00 00 1a 5d 30 80 a0 70 38 a0 40
30 20 36 00 59 c3 10 00 00 1a 00 00 00 fe 00 42
4f 45 20 44 54 0a 20 20 20 20 20 20 00 00 00 fe
00 54 56 31 35 36 46 48 42 2d 4e 57 30 0a 00 ea

----------------

Block 0, Base EDID:
  EDID Structure Version & Revision: 1.4
  Vendor & Product Identification:
    Manufacturer: BOE
    Model: 2501
    Made in: week 45 of 2020
  Basic Display Parameters & Features:
    Digital display
    Bits per primary color channel: 8
    DisplayPort interface
    Maximum image size: 35 cm x 20 cm
    Gamma: 2.20
    Supported color formats: RGB 4:4:4
    First detailed timing includes the native pixel format and preferred refresh rate
    Display is continuous frequency
  Color Characteristics:
    Red  : 0.6669, 0.3056
    Green: 0.2431, 0.6953
    Blue : 0.1503, 0.0546
    White: 0.2880, 0.2763
  Established Timings I & II: none
  Standard Timings: none
  Detailed Timing Descriptors:
    DTD 1:  1920x1080   60.003102 Hz  16:9     74.404 kHz    154.760000 MHz (345 mm x 195 mm)
                 Hfront   48 Hsync  32 Hback   80 Hpol P
                 Vfront    3 Vsync   6 Vback  151 Vpol N
    DTD 2:  1920x1080   48.003257 Hz  16:9     59.524 kHz    123.810000 MHz (345 mm x 195 mm)
                 Hfront   48 Hsync  32 Hback   80 Hpol P
                 Vfront    3 Vsync   6 Vback  151 Vpol N
    Alphanumeric Data String: 'BOE DT'
    Alphanumeric Data String: 'TV156FHB-NW0'
Checksum: 0xea

----------------

Failures:

Block 0, Base EDID:
  Missing Display Product Name.
  Missing Display Range Limits Descriptor.

EDID conformity: FAIL
