
EDID (hex):
00ffffffffffff0006af873400000000
010f0103802517780a6df29c594c8f23
23525400000001010101010101010101
0101010101019e25a04051840c304020
33006fe6100000180000000f00000000
00000000000000000020000000fe0041
554f0a202020202020202020000000fe
004231373050573033205634200a0063

Extracted contents:
header:          00 ff ff ff ff ff ff 00
serial number:   06 af 87 34 00 00 00 00 01 0f
version:         01 03
basic params:    80 25 17 78 0a
chroma info:     6d f2 9c 59 4c 8f 23 23 52 54
established:     00 00 00
standard:        01 01 01 01 01 01 01 01 01 01 01 01 01 01 01 01
descriptor 1:    9e 25 a0 40 51 84 0c 30 40 20 33 00 6f e6 10 00 00 18
descriptor 2:    00 00 00 0f 00 00 00 00 00 00 00 00 00 00 00 00 00 20
descriptor 3:    00 00 00 fe 00 41 55 4f 0a 20 20 20 20 20 20 20 20 20
descriptor 4:    00 00 00 fe 00 42 31 37 30 50 57 30 33 20 56 34 20 0a
extensions:      00
checksum:        63

EDID version: 1.3
Manufacturer: AUO Model 3487 Serial Number --
Digital display
Maximum image size: 37 cm x 23 cm
Gamma: 2.20
RGB color display
First detailed timing is preferred timing
Display x,y Chromaticity:
  Red:   0.6103, 0.3496
  Green: 0.2998, 0.5595
  Blue:  0.1396, 0.1396
  White: 0.3203, 0.3300
Established timings supported:
Standard timings supported:
Detailed mode: Clock 96.300 MHz, 367 mm x 230 mm
               1440 1504 1536 1760 hborder 0
                900  903  906  912 vborder 0
               -hsync -vsync 
               VertFreq: 59 Hz, HorFreq: 54715 Hz
Manufacturer-specified data, tag 15
ASCII string: AUO
ASCII string: B170PW03 V4 
Checksum: 0x63 (valid)
EDID block does NOT conform to EDID 1.3!
	Missing name descriptor
	Missing monitor ranges
EDID block does not conform at all!
	Bad year of manufacture
