
EDID (hex):
00ffffffffffff004c2d091059345743
351e010380351e782a2fada454479926
0f474abfef8081c0810081809500a9c0
b300714f0101023a801871382d40582c
450014302100001e000000fd0032f01e
ff3c000a202020202020000000fc004c
433237524735300a20202020000000ff
0048345a4e4330313334370a202001ff
020325f14890403f1f04130312230907
078301000067030c001000803c67d85d
c401788000047480d072382d40102c45
8014302100001e23e88078703887401c
20980c14302100001a011d007251d01e
206e28550014302100001e5a8780a070
384d403020350014302100001a047480
1871382d40582c450014302100001ead

Extracted contents:
header:          00 ff ff ff ff ff ff 00
serial number:   4c 2d 09 10 59 34 57 43 35 1e
version:         01 03
basic params:    80 35 1e 78 2a
chroma info:     2f ad a4 54 47 99 26 0f 47 4a
established:     bf ef 80
standard:        81 c0 81 00 81 80 95 00 a9 c0 b3 00 71 4f 01 01
descriptor 1:    02 3a 80 18 71 38 2d 40 58 2c 45 00 14 30 21 00 00 1e
descriptor 2:    00 00 00 fd 00 32 f0 1e ff 3c 00 0a 20 20 20 20 20 20
descriptor 3:    00 00 00 fc 00 4c 43 32 37 52 47 35 30 0a 20 20 20 20
descriptor 4:    00 00 00 ff 00 48 34 5a 4e 43 30 31 33 34 37 0a 20 20
extensions:      01
checksum:        ff

EDID version: 1.3
Manufacturer: SAM Model 1009 Serial Number --
Made in week 53 of 2020
Digital display
Maximum image size: 53 cm x 30 cm
Gamma: 2.20
DPMS levels: Off
RGB color display
First detailed timing is preferred timing
Display x,y Chromaticity:
  Red:   0.6406, 0.3300
  Green: 0.2802, 0.6005
  Blue:  0.1503, 0.0605
  White: 0.2802, 0.2900
Established timings supported:
  720x400@70Hz 9:5 HorFreq: 31469 Hz Clock: 28.320 MHz
  640x480@60Hz 4:3 HorFreq: 31469 Hz Clock: 25.175 MHz
  640x480@67Hz 4:3 HorFreq: 35000 Hz Clock: 30.240 MHz
  640x480@72Hz 4:3 HorFreq: 37900 Hz Clock: 31.500 MHz
  640x480@75Hz 4:3 HorFreq: 37500 Hz Clock: 31.500 MHz
  800x600@56Hz 4:3 HorFreq: 35200 Hz Clock: 36.000 MHz
  800x600@60Hz 4:3 HorFreq: 37900 Hz Clock: 40.000 MHz
  800x600@72Hz 4:3 HorFreq: 48100 Hz Clock: 50.000 MHz
  800x600@75Hz 4:3 HorFreq: 46900 Hz Clock: 49.500 MHz
  832x624@75Hz 4:3 HorFreq: 49726 Hz Clock: 57.284 MHz
  1024x768@60Hz 4:3 HorFreq: 48400 Hz Clock: 65.000 MHz
  1024x768@70Hz 4:3 HorFreq: 56500 Hz Clock: 75.000 MHz
  1024x768@75Hz 4:3 HorFreq: 60000 Hz Clock: 78.750 MHz
  1280x1024@75Hz 5:4 HorFreq: 80000 Hz Clock: 135.000 MHz
  1152x870@75Hz 192:145 HorFreq: 67500 Hz Clock: 108.000 MHz
Standard timings supported:
  1280x720@60Hz 16:9
  1280x800@60Hz 16:10
  1280x1024@60Hz 5:4 HorFreq: 64000 Hz Clock: 108.000 MHz
  1440x900@60Hz 16:10 HorFreq: 55500 Hz Clock: 88.750 MHz
  1600x900@60Hz 16:9
  1680x1050@60Hz 16:10 HorFreq: 64700 Hz Clock: 119.000 MHz
  1152x864@75Hz 4:3 HorFreq: 67500 Hz Clock: 108.000 MHz
Detailed mode: Clock 148.500 MHz, 532 mm x 304 mm
               1920 2008 2052 2200 hborder 0
               1080 1084 1089 1125 vborder 0
               +hsync +vsync 
               VertFreq: 60 Hz, HorFreq: 67500 Hz
Monitor ranges (GTF): 50-240Hz V, 30-255kHz H, max dotclock 600MHz
Monitor name: LC27RG50
Serial number: --
Has 1 extension blocks
Checksum: 0xff (valid)

CTA extension block
Extension version: 3
33 bytes of CTA data
  Video data block
    VIC  16 1920x1080@60Hz 16:9 (native) HorFreq: 67500 Hz Clock: 148.500 MHz
    VIC  64 1920x1080@100Hz 16:9  HorFreq: 112500 Hz Clock: 297.000 MHz
    VIC  63 1920x1080@120Hz 16:9  HorFreq: 135000 Hz Clock: 297.000 MHz
    VIC  31 1920x1080@50Hz 16:9  HorFreq: 56250 Hz Clock: 148.500 MHz
    VIC   4 1280x720@60Hz 16:9  HorFreq: 45000 Hz Clock: 74.250 MHz
    VIC  19 1280x720@50Hz 16:9  HorFreq: 37500 Hz Clock: 74.250 MHz
    VIC   3 720x480@60Hz 16:9  HorFreq: 31469 Hz Clock: 27.000 MHz
    VIC  18 720x576@50Hz 16:9  HorFreq: 31250 Hz Clock: 27.000 MHz
  Audio data block
    Linear PCM, max channels 2
      Supported sample rates (kHz): 48 44.1 32
      Supported sample sizes (bits): 24 20 16
  Speaker allocation data block
    Speaker map:
      FL/FR - Front Left/Right
  Vendor-specific data block, OUI 000c03 (HDMI)
    Source physical address 1.0.0.0
    Supports_AI
    Maximum TMDS clock: 300MHz
  Vendor-specific data block, OUI c45dd8 (HDMI Forum)
    Version: 1
    Maximum TMDS Character Rate: 600MHz
    SCDC Present
Underscans PC formats by default
Basic audio support
Supports YCbCr 4:4:4
Supports YCbCr 4:2:2
1 native detailed modes
Detailed mode: Clock 297.000 MHz, 532 mm x 304 mm
               1920 2448 2492 2640 hborder 0
               1080 1084 1089 1125 vborder 0
               +hsync +vsync 
               VertFreq: 100 Hz, HorFreq: 112500 Hz
Detailed mode: Clock 594.270 MHz, 532 mm x 304 mm
               1920 1948 1980 2040 hborder 0
               1080 1137 1145 1215 vborder 0
               +hsync -vsync 
               VertFreq: 239 Hz, HorFreq: 291308 Hz
Detailed mode: Clock 74.250 MHz, 532 mm x 304 mm
               1280 1390 1430 1650 hborder 0
                720  725  730  750 vborder 0
               +hsync +vsync 
               VertFreq: 60 Hz, HorFreq: 45000 Hz
Detailed mode: Clock 346.500 MHz, 532 mm x 304 mm
               1920 1968 2000 2080 hborder 0
               1080 1083 1088 1157 vborder 0
               +hsync -vsync 
               VertFreq: 143 Hz, HorFreq: 166586 Hz
Checksum: 0xad (valid)

One or more of the timings is out of range of the Monitor Ranges:
  Vertical Freq: 50 - 239 Hz
  Horizontal Freq: 31250 - 291308 Hz
  Maximum Clock: 594.270 MHz
EDID block does not conform at all!
	Both the serial number and the serial string are set
