edid-decode (hex):

00 ff ff ff ff ff ff 00 34 a9 32 0c 68 08 00 00
10 06 01 00 0f 20 18 8a e8 9d 19 a2 55 47 98 27
10 48 4c ff fe 80 81 80 61 4f 61 4a 49 4f 45 4f
31 4f 31 40 81 80 30 2a 00 98 51 00 2a 40 30 70
13 00 1e e5 10 00 00 1e 40 1f 00 30 41 00 24 30
20 60 33 00 2c e1 10 00 00 18 c3 1e 00 20 41 00
20 30 10 60 13 00 2c e1 10 00 00 1e 4c 1d 00 30
41 00 26 30 18 88 36 00 2c e1 10 00 00 18 00 35

----------------

Block 0, Base EDID:
  EDID Structure Version & Revision: 1.0
  Vendor & Product Identification:
    Manufacturer: MEI
    Model: 3122
    Serial Number: ...
    Made in: week 16 of 1996
  Basic Display Parameters & Features:
    Analog display
    Input voltage level: 0.7/0.3 V
    Blank level equals black level
    Sync: Separate Composite SyncOnGreen Serration
    Maximum image size: 32 cm x 24 cm
    Gamma: 2.38
    DPMS levels: Standby Suspend Off
    RGB color display
  Color Characteristics:
    Red  : 0.6347, 0.3330
    Green: 0.2802, 0.5947
    Blue : 0.1523, 0.0634
    White: 0.2832, 0.2978
  Established Timings I & II:
    IBM     :   720x400    70.081663 Hz   9:5     31.467 kHz     28.320000 MHz
    IBM     :   720x400    87.849542 Hz   9:5     39.444 kHz     35.500000 MHz
    DMT 0x04:   640x480    59.940476 Hz   4:3     31.469 kHz     25.175000 MHz
    Apple   :   640x480    66.666667 Hz   4:3     35.000 kHz     30.240000 MHz
    DMT 0x05:   640x480    72.808802 Hz   4:3     37.861 kHz     31.500000 MHz
    DMT 0x06:   640x480    75.000000 Hz   4:3     37.500 kHz     31.500000 MHz
    DMT 0x08:   800x600    56.250000 Hz   4:3     35.156 kHz     36.000000 MHz
    DMT 0x09:   800x600    60.316541 Hz   4:3     37.879 kHz     40.000000 MHz
    DMT 0x0a:   800x600    72.187572 Hz   4:3     48.077 kHz     50.000000 MHz
    DMT 0x0b:   800x600    75.000000 Hz   4:3     46.875 kHz     49.500000 MHz
    Apple   :   832x624    74.551266 Hz   4:3     49.726 kHz     57.284000 MHz
    DMT 0x0f:  1024x768i   86.957532 Hz   4:3     35.522 kHz     44.900000 MHz
    DMT 0x10:  1024x768    60.003840 Hz   4:3     48.363 kHz     65.000000 MHz
    DMT 0x11:  1024x768    70.069359 Hz   4:3     56.476 kHz     75.000000 MHz
    DMT 0x12:  1024x768    75.028582 Hz   4:3     60.023 kHz     78.750000 MHz
    Apple   :  1152x870    75.061550 Hz 192:145   68.681 kHz    100.000000 MHz
  Standard Timings:
    DMT 0x23:  1280x1024   60.019740 Hz   5:4     63.981 kHz    108.000000 MHz
    DMT 0x12:  1024x768    75.028582 Hz   4:3     60.023 kHz     78.750000 MHz
    Unknown :  1024x768    70.000 Hz   4:3
    Unknown :   832x624    75.000 Hz   4:3
    DMT 0x0b:   800x600    75.000000 Hz   4:3     46.875 kHz     49.500000 MHz
    DMT 0x06:   640x480    75.000000 Hz   4:3     37.500 kHz     31.500000 MHz
    DMT 0x04:   640x480    59.940476 Hz   4:3     31.469 kHz     25.175000 MHz
    DMT 0x23:  1280x1024   60.019740 Hz   5:4     63.981 kHz    108.000000 MHz
  Detailed Timing Descriptors:
    DTD 1:  1280x1024   60.019740 Hz   5:4     63.981 kHz    108.000000 MHz (286 mm x 229 mm)
                 Hfront   48 Hsync 112 Hback  248 Hpol P
                 Vfront    1 Vsync   3 Vback   38 Vpol P
    DTD 2:  1024x768    74.926572 Hz   4:3     60.241 kHz     80.000000 MHz (300 mm x 225 mm)
                 Hfront   32 Hsync  96 Hback  176 Hpol N
                 Vfront    3 Vsync   3 Vback   30 Vpol N
    DTD 3:  1024x768    75.028582 Hz   4:3     60.023 kHz     78.750000 MHz (300 mm x 225 mm)
                 Hfront   16 Hsync  96 Hback  176 Hpol P
                 Vfront    1 Vsync   3 Vback   28 Vpol P
    DTD 4:  1024x768    70.069359 Hz   4:3     56.476 kHz     75.000000 MHz (300 mm x 225 mm)
                 Hfront   24 Hsync 136 Hback  144 Hpol N
                 Vfront    3 Vsync   6 Vback   29 Vpol N
Checksum: 0x35

----------------

Warnings:

Block 0, Base EDID:
  EDID Structure Version & Revision: EDID 1.0 is deprecated, do not use.

Failures:

Block 0, Base EDID:
  Detailed Timing Descriptor #1: Mismatch of image size 286x229 mm vs display size 320x240 mm.
  Detailed Timing Descriptor #2: Mismatch of image size 300x225 mm vs display size 320x240 mm.
  Detailed Timing Descriptor #3: Mismatch of image size 300x225 mm vs display size 320x240 mm.
  Detailed Timing Descriptor #4: Mismatch of image size 300x225 mm vs display size 320x240 mm.

EDID conformity: FAIL
