edid-decode (hex):

00 ff ff ff ff ff ff 00 09 e5 bc 07 00 00 00 00
12 1c 01 04 95 1f 11 78 02 0e a0 a6 57 52 9f 27
10 50 54 00 00 00 01 01 01 01 01 01 01 01 01 01
01 01 01 01 01 01 d9 38 80 b4 70 38 4b 40 30 20
36 00 35 ad 10 00 00 1a 00 00 00 00 00 00 00 00
00 00 00 00 00 00 00 00 00 1a 00 00 00 fe 00 33
33 38 58 47 80 4e 45 31 34 4e 34 34 00 00 00 00
00 00 41 01 9e 00 10 00 00 0a 01 0a 20 20 00 8a

----------------

Block 0, Base EDID:
  EDID Structure Version & Revision: 1.4
  Vendor & Product Identification:
    Manufacturer: BOE
    Model: 1980
    Made in: week 18 of 2018
  Basic Display Parameters & Features:
    Digital display
    Bits per primary color channel: 6
    DisplayPort interface
    Maximum image size: 31 cm x 17 cm
    Gamma: 2.20
    Supported color formats: RGB 4:4:4
    First detailed timing includes the native pixel format and preferred refresh rate
  Color Characteristics:
    Red  : 0.6484, 0.3398
    Green: 0.3232, 0.6230
    Blue : 0.1542, 0.0644
    White: 0.3125, 0.3281
  Established Timings I & II: none
  Standard Timings: none
  Detailed Timing Descriptors:
    DTD 1:  1920x1080   60.000 Hz  16:9    69.300 kHz 145.530 MHz (309 mm x 173 mm)
                 Hfront   48 Hsync  32 Hback 100 Hpol P
                 Vfront    3 Vsync   6 Vback  66 Vpol N
    Manufacturer-Specified Display Descriptor (0x00): 00 00 00 00 00 00 00 00 00 00 00 00 00 00 00 1a '................'
    Alphanumeric Data String: '338XG'
    Manufacturer-Specified Display Descriptor (0x00): 00 00 00 00 41 01 9e 00 10 00 00 0a 01 0a 20 20 '....A.........  '
Checksum: 0x8a

----------------

Failures:

Block 0, Base EDID:
  Alphanumeric Data String: Non-printable character.
  Missing Display Product Name.

EDID conformity: FAIL
