edid-decode (hex):

00 ff ff ff ff ff ff 00 4e 14 ab 09 00 00 00 00
10 21 01 03 08 35 1d 78 08 ee 91 a3 54 4c 99 26
0f 50 54 21 08 00 81 cf a9 cf 61 40 81 c0 81 80
95 00 b3 00 a9 c0 02 3a 80 18 71 38 2d 40 58 2c
45 00 12 22 21 00 00 1e 4f 44 80 a0 70 38 29 40
30 20 35 00 00 00 00 00 00 1e ac 26 80 18 71 38
2d 40 30 20 35 00 00 00 00 00 00 1e 00 00 00 fc
00 53 63 65 70 74 72 65 20 46 32 34 0a 20 00 b0

00 ff ff ff ff ff ff 00 4e 14 ab 09 00 00 00 00
10 21 01 03 08 35 1d 78 08 ee 91 a3 54 4c 99 26
0f 50 54 21 08 00 81 cf a9 cf 61 40 81 c0 81 80
95 00 b3 00 a9 c0 02 3a 80 18 71 38 2d 40 58 2c
45 00 12 22 21 00 00 1e 4f 44 80 a0 70 38 29 40
30 20 35 00 00 00 00 00 00 1e ac 26 80 18 71 38
2d 40 30 20 35 00 00 00 00 00 00 1e 00 00 00 fc
00 53 63 65 70 74 72 65 20 46 32 34 0a 20 00 b0

----------------

Block 0, Base EDID:
  EDID Structure Version & Revision: 1.3
  Vendor & Product Identification:
    Manufacturer: SPT
    Model: 2475
    Made in: week 16 of 2023
  Basic Display Parameters & Features:
    Analog display
    Signal Level Standard: 0.700 : 0.300 : 1.000 V p-p
    Blank level equals black level
    Sync: Separate
    Maximum image size: 53 cm x 29 cm
    Gamma: 2.20
    RGB color display
  Color Characteristics:
    Red  : 0.6396, 0.3300
    Green: 0.2998, 0.5996
    Blue : 0.1503, 0.0595
    White: 0.3125, 0.3291
  Established Timings I & II:
    DMT 0x04:   640x480    59.940476 Hz   4:3     31.469 kHz     25.175000 MHz
    DMT 0x09:   800x600    60.316541 Hz   4:3     37.879 kHz     40.000000 MHz
    DMT 0x10:  1024x768    60.003840 Hz   4:3     48.363 kHz     65.000000 MHz
  Standard Timings:
    GTF     :  1280x720    74.999686 Hz  16:9     56.400 kHz     95.654000 MHz
    GTF     :  1600x900    75.000000 Hz  16:9     70.500 kHz    152.280000 MHz
    DMT 0x10:  1024x768    60.003840 Hz   4:3     48.363 kHz     65.000000 MHz
    DMT 0x55:  1280x720    60.000000 Hz  16:9     45.000 kHz     74.250000 MHz
    DMT 0x23:  1280x1024   60.019740 Hz   5:4     63.981 kHz    108.000000 MHz
    DMT 0x2f:  1440x900    59.887445 Hz  16:10    55.935 kHz    106.500000 MHz
    DMT 0x3a:  1680x1050   59.954250 Hz  16:10    65.290 kHz    146.250000 MHz
    DMT 0x53:  1600x900    60.000000 Hz  16:9     60.000 kHz    108.000000 MHz (RB)
  Detailed Timing Descriptors:
    DTD 1:  1920x1080   60.000000 Hz  16:9     67.500 kHz    148.500000 MHz (530 mm x 290 mm)
                 Hfront   88 Hsync  44 Hback  148 Hpol P
                 Vfront    4 Vsync   5 Vback   36 Vpol P
    DTD 2:  1920x1080   74.997427 Hz  16:9     84.072 kHz    174.870000 MHz
                 Hfront   48 Hsync  32 Hback   80 Hpol P
                 Vfront    3 Vsync   5 Vback   33 Vpol P
    DTD 3:  1920x1080   40.000000 Hz  16:9     45.000 kHz     99.000000 MHz
                 Hfront   48 Hsync  32 Hback  200 Hpol P
                 Vfront    3 Vsync   5 Vback   37 Vpol P
    Display Product Name: 'Sceptre F24'
Checksum: 0xb0

----------------

Block 1, Unknown EDID Extension Block 0x00:
  00 ff ff ff ff ff ff 00 4e 14 ab 09 00 00 00 00 '........N.......'
  10 21 01 03 08 35 1d 78 08 ee 91 a3 54 4c 99 26 '.!...5.x....TL.&'
  0f 50 54 21 08 00 81 cf a9 cf 61 40 81 c0 81 80 '.PT!......a@....'
  95 00 b3 00 a9 c0 02 3a 80 18 71 38 2d 40 58 2c '.......:..q8-@X,'
  45 00 12 22 21 00 00 1e 4f 44 80 a0 70 38 29 40 'E.."!...OD..p8)@'
  30 20 35 00 00 00 00 00 00 1e ac 26 80 18 71 38 '0 5........&..q8'
  2d 40 30 20 35 00 00 00 00 00 00 1e 00 00 00 fc '-@0 5...........'
  00 53 63 65 70 74 72 65 20 46 32 34 0a 20 00 b0 '.Sceptre F24. ..'
Checksum: 0xb0

----------------

Failures:

Block 0, Base EDID:
  Basic Display Parameters & Features: The chromaticities match sRGB, but sRGB is not signaled.
  Basic Display Parameters & Features: EDID 1.3 requires that the first detailed timing is the preferred timing.
  Detailed Timing Descriptor #2: Mismatch of image size vs display size: image size is not set, but display size is.
  Detailed Timing Descriptor #3: Mismatch of image size vs display size: image size is not set, but display size is.
  Missing Display Range Limits Descriptor.
Block 1, Base EDID:
  Unknown Extension Block.
EDID:
  Base EDID: EDID specified 0 extension block(s), but found 1 extension block(s).

EDID conformity: FAIL
