edid-decode (hex):

00 ff ff ff ff ff ff 00 4d 10 76 41 01 01 01 01
ff 14 01 03 80 5d 34 78 0a c1 ec a1 53 46 97 24
11 47 49 af ce 00 d1 c0 a9 40 90 40 81 80 01 01
01 01 01 01 01 01 02 3a 80 d0 72 38 2d 40 10 2c
45 80 80 68 21 00 00 1e 1b 21 50 a0 51 00 1e 30
48 88 35 00 80 68 21 00 00 18 00 00 00 fc 00 53
48 41 52 50 20 4c 43 44 0a 20 20 20 00 00 00 fd
00 37 4c 0f 4b 11 00 0a 20 20 20 20 20 20 01 e8

02 03 23 71 4d 9f 10 21 22 14 05 13 04 11 02 15
06 01 26 09 07 03 15 07 50 83 01 00 00 65 03 0c
00 10 00 02 3a 80 18 71 38 2d 40 58 2c 45 00 80
68 21 00 00 1e 01 1d 80 d0 72 1c 16 20 10 2c 25
80 80 68 21 00 00 9e 01 1d 80 18 71 1c 16 20 58
2c 25 00 80 68 21 00 00 9e 01 1d 00 bc 52 d0 1e
20 b8 28 55 40 80 68 21 00 00 1e 01 1d 00 72 51
d0 1e 20 6e 28 55 00 80 68 21 00 00 1e 00 00 e8

----------------

Block 0, Base EDID:
  EDID Structure Version & Revision: 1.3
  Vendor & Product Identification:
    Manufacturer: SHP
    Model: 16758
    Serial Number: ...
    Model year: 2010
  Basic Display Parameters & Features:
    Digital display
    Maximum image size: 93 cm x 52 cm
    Gamma: 2.20
    RGB color display
    First detailed timing is the preferred timing
  Color Characteristics:
    Red  : 0.6318, 0.3242
    Green: 0.2734, 0.5908
    Blue : 0.1435, 0.0683
    White: 0.2802, 0.2851
  Established Timings I & II:
    IBM     :   720x400    70.081663 Hz   9:5     31.467 kHz     28.320000 MHz
    DMT 0x04:   640x480    59.940476 Hz   4:3     31.469 kHz     25.175000 MHz
    DMT 0x05:   640x480    72.808802 Hz   4:3     37.861 kHz     31.500000 MHz
    DMT 0x06:   640x480    75.000000 Hz   4:3     37.500 kHz     31.500000 MHz
    DMT 0x08:   800x600    56.250000 Hz   4:3     35.156 kHz     36.000000 MHz
    DMT 0x09:   800x600    60.316541 Hz   4:3     37.879 kHz     40.000000 MHz
    DMT 0x0a:   800x600    72.187572 Hz   4:3     48.077 kHz     50.000000 MHz
    DMT 0x0b:   800x600    75.000000 Hz   4:3     46.875 kHz     49.500000 MHz
    DMT 0x10:  1024x768    60.003840 Hz   4:3     48.363 kHz     65.000000 MHz
    DMT 0x11:  1024x768    70.069359 Hz   4:3     56.476 kHz     75.000000 MHz
    DMT 0x12:  1024x768    75.028582 Hz   4:3     60.023 kHz     78.750000 MHz
  Standard Timings:
    DMT 0x52:  1920x1080   60.000000 Hz  16:9     67.500 kHz    148.500000 MHz
    DMT 0x33:  1600x1200   60.000000 Hz   4:3     75.000 kHz    162.000000 MHz
    DMT 0x2a:  1400x1050   59.978442 Hz   4:3     65.317 kHz    121.750000 MHz
    DMT 0x23:  1280x1024   60.019740 Hz   5:4     63.981 kHz    108.000000 MHz
  Detailed Timing Descriptors:
    DTD 1:  1920x1080   50.000000 Hz  16:9     56.250 kHz    148.500000 MHz (640 mm x 360 mm)
                 Hfront  528 Hsync  44 Hback  148 Hpol P
                 Vfront    4 Vsync   5 Vback   36 Vpol P
    DTD 2:  1360x768    59.798991 Hz  85:48    47.720 kHz     84.750000 MHz (640 mm x 360 mm)
                 Hfront   72 Hsync 136 Hback  208 Hpol N
                 Vfront    3 Vsync   5 Vback   22 Vpol N
    Display Product Name: 'SHARP LCD'
    Display Range Limits:
      Monitor ranges (GTF): 55-76 Hz V, 15-75 kHz H, max dotclock 170 MHz
  Extension blocks: 1
Checksum: 0xe8

----------------

Block 1, CTA-861 Extension Block:
  Revision: 3
  Basic audio support
  Supports YCbCr 4:4:4
  Supports YCbCr 4:2:2
  Native detailed modes: 1
  Video Data Block:
    VIC  31:  1920x1080   50.000000 Hz  16:9     56.250 kHz    148.500000 MHz (native)
    VIC  16:  1920x1080   60.000000 Hz  16:9     67.500 kHz    148.500000 MHz
    VIC  33:  1920x1080   25.000000 Hz  16:9     28.125 kHz     74.250000 MHz
    VIC  34:  1920x1080   30.000000 Hz  16:9     33.750 kHz     74.250000 MHz
    VIC  20:  1920x1080i  50.000000 Hz  16:9     28.125 kHz     74.250000 MHz
    VIC   5:  1920x1080i  60.000000 Hz  16:9     33.750 kHz     74.250000 MHz
    VIC  19:  1280x720    50.000000 Hz  16:9     37.500 kHz     74.250000 MHz
    VIC   4:  1280x720    60.000000 Hz  16:9     45.000 kHz     74.250000 MHz
    VIC  17:   720x576    50.000000 Hz   4:3     31.250 kHz     27.000000 MHz
    VIC   2:   720x480    59.940060 Hz   4:3     31.469 kHz     27.000000 MHz
    VIC  21:  1440x576i   50.000000 Hz   4:3     15.625 kHz     27.000000 MHz
    VIC   6:  1440x480i   59.940060 Hz   4:3     15.734 kHz     27.000000 MHz
    VIC   1:   640x480    59.940476 Hz   4:3     31.469 kHz     25.175000 MHz
  Audio Data Block:
    Linear PCM:
      Max channels: 2
      Supported sample rates (kHz): 48 44.1 32
      Supported sample sizes (bits): 20 16
    AC-3:
      Max channels: 6
      Supported sample rates (kHz): 48 44.1 32
      Maximum bit rate: 640 kb/s
  Speaker Allocation Data Block:
    FL/FR - Front Left/Right
  Vendor-Specific Data Block (HDMI), OUI 00-0C-03:
    Source physical address: 1.0.0.0
  Detailed Timing Descriptors:
    DTD 3:  1920x1080   60.000000 Hz  16:9     67.500 kHz    148.500000 MHz (640 mm x 360 mm)
                 Hfront   88 Hsync  44 Hback  148 Hpol P
                 Vfront    4 Vsync   5 Vback   36 Vpol P
    DTD 4:  1920x1080i  50.000000 Hz  16:9     28.125 kHz     74.250000 MHz (640 mm x 360 mm)
                 Hfront  528 Hsync  44 Hback  148 Hpol P
                 Vfront    2 Vsync   5 Vback   15 Vpol P Vfront +0.5 Odd Field
                 Vfront    2 Vsync   5 Vback   15 Vpol P Vback  +0.5 Even Field
    DTD 5:  1920x1080i  60.000000 Hz  16:9     33.750 kHz     74.250000 MHz (640 mm x 360 mm)
                 Hfront   88 Hsync  44 Hback  148 Hpol P
                 Vfront    2 Vsync   5 Vback   15 Vpol P Vfront +0.5 Odd Field
                 Vfront    2 Vsync   5 Vback   15 Vpol P Vback  +0.5 Even Field
    DTD 6:  1280x720    50.000000 Hz  16:9     37.500 kHz     74.250000 MHz (640 mm x 360 mm)
                 Hfront  440 Hsync  40 Hback  220 Hpol P
                 Vfront    5 Vsync   5 Vback   20 Vpol P
    DTD 7:  1280x720    60.000000 Hz  16:9     45.000 kHz     74.250000 MHz (640 mm x 360 mm)
                 Hfront  110 Hsync  40 Hback  220 Hpol P
                 Vfront    5 Vsync   5 Vback   20 Vpol P
Checksum: 0xe8  Unused space in Extension Block: 2 bytes

----------------

Warnings:

Block 1, CTA-861 Extension Block:
  IT Video Formats are overscanned by default, but normally this should be underscanned.
  Add a Colorimetry Data Block with the sRGB colorimetry bit set to avoid interop issues.
EDID:
  CTA-861: Multiple native progressive timings are defined.

Failures:

Block 0, Base EDID:
  Vendor & Product Identification: EDID 1.3 does not support week 0xff.
  Detailed Timing Descriptor #1: Mismatch of image size 640x360 mm vs display size 930x520 mm.
  Detailed Timing Descriptor #2: Mismatch of image size 640x360 mm vs display size 930x520 mm.
Block 1, CTA-861 Extension Block:
  Detailed Timing Descriptor #3: Mismatch of image size 640x360 mm vs display size 930x520 mm.
  Detailed Timing Descriptor #4: Mismatch of image size 640x360 mm vs display size 930x520 mm.
  Detailed Timing Descriptor #5: Mismatch of image size 640x360 mm vs display size 930x520 mm.
  Detailed Timing Descriptor #6: Mismatch of image size 640x360 mm vs display size 930x520 mm.
  Detailed Timing Descriptor #7: Mismatch of image size 640x360 mm vs display size 930x520 mm.
  Missing VCDB, needed for Set Selectable RGB Quantization to avoid interop issues.
EDID:
  Base EDID: Some timings are out of range of the Monitor Ranges:
    Vertical Freq: 25.000 - 75.029 Hz (Monitor: 55.000 - 76.000 Hz)

EDID conformity: FAIL
