
EDID (hex):
00ffffffffffff0035045d6601010101
01130103810f0978ea6e66a1544c9926
194f54bdef80714f8180818c81900101
010101010101483f403062b0324040c0
1300d69d0000001ed50980a0205e6310
10605208520e1108061a000000fd0038
4b1f5111000a202020202020000000fc
004d48443730300a20202020202000de

Extracted contents:
header:          00 ff ff ff ff ff ff 00
serial number:   35 04 5d 66 01 01 01 01 01 13
version:         01 03
basic params:    81 0f 09 78 ea
chroma info:     6e 66 a1 54 4c 99 26 19 4f 54
established:     bd ef 80
standard:        71 4f 81 80 81 8c 81 90 01 01 01 01 01 01 01 01
descriptor 1:    48 3f 40 30 62 b0 32 40 40 c0 13 00 d6 9d 00 00 00 1e
descriptor 2:    d5 09 80 a0 20 5e 63 10 10 60 52 08 52 0e 11 08 06 1a
descriptor 3:    00 00 00 fd 00 38 4b 1f 51 11 00 0a 20 20 20 20 20 20
descriptor 4:    00 00 00 fc 00 4d 48 44 37 30 30 0a 20 20 20 20 20 20
extensions:      00
checksum:        de

EDID version: 1.3
Manufacturer: MHD Model 665d Serial Number --
Made in week 1 of 2009
Digital display
DFP 1.x compatible TMDS
Maximum image size: 15 cm x 9 cm
Gamma: 2.20
DPMS levels: Standby Suspend Off
RGB color display
First detailed timing is preferred timing
Display x,y Chromaticity:
  Red:   0.6298, 0.3300
  Green: 0.2998, 0.5996
  Blue:  0.1494, 0.0996
  White: 0.3095, 0.3300
Established timings supported:
  720x400@70Hz 9:5 HorFreq: 31469 Hz Clock: 28.320 MHz
  640x480@60Hz 4:3 HorFreq: 31469 Hz Clock: 25.175 MHz
  640x480@67Hz 4:3 HorFreq: 35000 Hz Clock: 30.240 MHz
  640x480@72Hz 4:3 HorFreq: 37900 Hz Clock: 31.500 MHz
  640x480@75Hz 4:3 HorFreq: 37500 Hz Clock: 31.500 MHz
  800x600@60Hz 4:3 HorFreq: 37900 Hz Clock: 40.000 MHz
  800x600@72Hz 4:3 HorFreq: 48100 Hz Clock: 50.000 MHz
  800x600@75Hz 4:3 HorFreq: 46900 Hz Clock: 49.500 MHz
  832x624@75Hz 4:3 HorFreq: 49726 Hz Clock: 57.284 MHz
  1024x768@60Hz 4:3 HorFreq: 48400 Hz Clock: 65.000 MHz
  1024x768@70Hz 4:3 HorFreq: 56500 Hz Clock: 75.000 MHz
  1024x768@75Hz 4:3 HorFreq: 60000 Hz Clock: 78.750 MHz
  1280x1024@75Hz 5:4 HorFreq: 80000 Hz Clock: 135.000 MHz
  1152x870@75Hz 192:145 HorFreq: 67500 Hz Clock: 108.000 MHz
Standard timings supported:
  1152x864@75Hz 4:3 HorFreq: 67500 Hz Clock: 108.000 MHz
  1280x1024@60Hz 5:4 HorFreq: 64000 Hz Clock: 108.000 MHz
  1280x1024@72Hz 5:4
  1280x1024@76Hz 5:4
Detailed mode: Clock 162.000 MHz, 214 mm x 157 mm
               1600 1664 1856 2160 hborder 0
               1200 1201 1204 1250 vborder 0
               +hsync +vsync 
               VertFreq: 60 Hz, HorFreq: 75000 Hz
Detailed mode: Clock 25.170 MHz, 338 mm x 270 mm
                640  656  752  800 hborder 8
                350  387  389  449 vborder 6
               +hsync -vsync 
               VertFreq: 70 Hz, HorFreq: 31462 Hz
Monitor ranges (GTF): 56-75Hz V, 31-81kHz H, max dotclock 170MHz
Monitor name: MHD700
Checksum: 0xde (valid)
One or more of the timings is out of range of the Monitor Ranges:
  Vertical Freq: 60 - 76 Hz
  Horizontal Freq: 31462 - 80000 Hz
  Maximum Clock: 162.000 MHz


