edid-decode (hex):

00 ff ff ff ff ff ff 00 06 af 14 30 00 00 00 00
01 10 01 03 80 1a 10 78 0a 87 fe 94 57 4f 8c 27
27 50 54 00 00 00 01 01 01 01 01 01 01 01 01 01
01 01 01 01 01 01 90 1a 00 70 50 20 10 30 15 20
44 00 05 a3 10 00 00 18 00 00 00 00 00 00 00 00
00 00 00 00 00 00 00 00 00 00 00 00 00 fe 00 44
46 38 39 32 04 42 31 32 31 45 57 33 00 00 00 fe
00 2b 3a 46 4f 6e 90 ac e6 01 01 0a 20 20 00 c4

----------------

Block 0, Base EDID:
  EDID Structure Version & Revision: 1.3
  Vendor & Product Identification:
    Manufacturer: AUO
    Model: 12308
    Made in: week 1 of 2006
  Basic Display Parameters & Features:
    Digital display
    Maximum image size: 26 cm x 16 cm
    Gamma: 2.20
    RGB color display
    First detailed timing is the preferred timing
  Color Characteristics:
    Red  : 0.5800, 0.3398
    Green: 0.3095, 0.5498
    Blue : 0.1552, 0.1552
    White: 0.3154, 0.3300
  Established Timings I & II: none
  Standard Timings: none
  Detailed Timing Descriptors:
    DTD 1:  1280x800    59.865900 Hz  16:10    48.851 kHz     68.000000 MHz (261 mm x 163 mm)
                 Hfront   21 Hsync  32 Hback   59 Hpol N
                 Vfront    4 Vsync   4 Vback    8 Vpol N
    Empty Descriptor
    Alphanumeric Data String: 'DF892'
    Alphanumeric Data String: '+:FOn'
Checksum: 0xc4

----------------

Failures:

Block 0, Base EDID:
  Empty Descriptor: Use Dummy Descriptor instead of all zeroes.
  Alphanumeric Data String: Non-printable character.
  Alphanumeric Data String: Non-printable character.
  Missing Display Product Name.
  Missing Display Range Limits Descriptor.

EDID conformity: FAIL
