
EDID (hex):
00ffffffffffff00410cf20896ca0000
261b01036e3e22782a5525a1574fa028
0f5054bd4b00d1c081808140950f9500
b30081c00101023a801871382d40582c
45006d552100001e000000ff00414635
31373338303531383632000000fc0050
484c2032383850364c0a2020000000fd
0038501e6315000a20202020202000c9

Extracted contents:
header:          00 ff ff ff ff ff ff 00
serial number:   41 0c f2 08 96 ca 00 00 26 1b
version:         01 03
basic params:    6e 3e 22 78 2a
chroma info:     55 25 a1 57 4f a0 28 0f 50 54
established:     bd 4b 00
standard:        d1 c0 81 80 81 40 95 0f 95 00 b3 00 81 c0 01 01
descriptor 1:    02 3a 80 18 71 38 2d 40 58 2c 45 00 6d 55 21 00 00 1e
descriptor 2:    00 00 00 ff 00 41 46 35 31 37 33 38 30 35 31 38 36 32
descriptor 3:    00 00 00 fc 00 50 48 4c 20 32 38 38 50 36 4c 0a 20 20
descriptor 4:    00 00 00 fd 00 38 50 1e 63 15 00 0a 20 20 20 20 20 20
extensions:      00
checksum:        c9

EDID version: 1.3
Manufacturer: PHL Model 8f2 Serial Number --
Made in week 38 of 2017
Analog display, Input voltage level: 0.7/0.7 V
Sync: Separate Composite SyncOnGreen 
Maximum image size: 62 cm x 34 cm
Gamma: 2.20
DPMS levels: Off
RGB color display
First detailed timing is preferred timing
Display x,y Chromaticity:
  Red:   0.6298, 0.3408
  Green: 0.3095, 0.6259
  Blue:  0.1562, 0.0605
  White: 0.3134, 0.3291
Established timings supported:
  720x400@70Hz 9:5 HorFreq: 31469 Hz Clock: 28.320 MHz
  640x480@60Hz 4:3 HorFreq: 31469 Hz Clock: 25.175 MHz
  640x480@67Hz 4:3 HorFreq: 35000 Hz Clock: 30.240 MHz
  640x480@72Hz 4:3 HorFreq: 37900 Hz Clock: 31.500 MHz
  640x480@75Hz 4:3 HorFreq: 37500 Hz Clock: 31.500 MHz
  800x600@60Hz 4:3 HorFreq: 37900 Hz Clock: 40.000 MHz
  800x600@75Hz 4:3 HorFreq: 46900 Hz Clock: 49.500 MHz
  1024x768@60Hz 4:3 HorFreq: 48400 Hz Clock: 65.000 MHz
  1024x768@75Hz 4:3 HorFreq: 60000 Hz Clock: 78.750 MHz
  1280x1024@75Hz 5:4 HorFreq: 80000 Hz Clock: 135.000 MHz
Standard timings supported:
  1920x1080@60Hz 16:9
  1280x1024@60Hz 5:4 HorFreq: 64000 Hz Clock: 108.000 MHz
  1280x960@60Hz 4:3 HorFreq: 60000 Hz Clock: 108.000 MHz
  1440x900@75Hz 16:10 HorFreq: 82300 Hz Clock: 156.000 MHz
  1440x900@60Hz 16:10 HorFreq: 55500 Hz Clock: 88.750 MHz
  1680x1050@60Hz 16:10 HorFreq: 64700 Hz Clock: 119.000 MHz
  1280x720@60Hz 16:9
Detailed mode: Clock 148.500 MHz, 621 mm x 341 mm
               1920 2008 2052 2200 hborder 0
               1080 1084 1089 1125 vborder 0
               +hsync +vsync 
               VertFreq: 60 Hz, HorFreq: 67500 Hz
Serial number: --
Monitor name: PHL 288P6L
Monitor ranges (GTF): 56-80Hz V, 30-99kHz H, max dotclock 210MHz
Checksum: 0xc9 (valid)
