
EDID (hex):
00ffffffffffff001ab373050fc00000
160f010368261e6b2a241fa15a499925
1a4c55a54f00818f8180614f6140454f
454001010101302a009851002a403070
1300782d1100001e000000ff00594548
4d3034393136370a2020000000fd0037
4c1e530e000a202020202020000000fc
004331392d340a20202020202020006d

Extracted contents:
header:          00 ff ff ff ff ff ff 00
serial number:   1a b3 73 05 0f c0 00 00 16 0f
version:         01 03
basic params:    68 26 1e 6b 2a
chroma info:     24 1f a1 5a 49 99 25 1a 4c 55
established:     a5 4f 00
standard:        81 8f 81 80 61 4f 61 40 45 4f 45 40 01 01 01 01
descriptor 1:    30 2a 00 98 51 00 2a 40 30 70 13 00 78 2d 11 00 00 1e
descriptor 2:    00 00 00 ff 00 59 45 48 4d 30 34 39 31 36 37 0a 20 20
descriptor 3:    00 00 00 fd 00 37 4c 1e 53 0e 00 0a 20 20 20 20 20 20
descriptor 4:    00 00 00 fc 00 43 31 39 2d 34 0a 20 20 20 20 20 20 20
extensions:      00
checksum:        6d

EDID version: 1.3
Manufacturer: FUS Model 573 Serial Number --
Analog display, Input voltage level: 0.7/0.7 V
Sync: Separate 
Maximum image size: 38 cm x 30 cm
Gamma: 2.07
DPMS levels: Off
RGB color display
First detailed timing is preferred timing
Display x,y Chromaticity:
  Red:   0.6289, 0.3535
  Green: 0.2861, 0.5976
  Blue:  0.1445, 0.1025
  White: 0.2998, 0.3349
Established timings supported:
  720x400@70Hz 9:5 HorFreq: 31469 Hz Clock: 28.320 MHz
  640x480@60Hz 4:3 HorFreq: 31469 Hz Clock: 25.175 MHz
  640x480@75Hz 4:3 HorFreq: 37500 Hz Clock: 31.500 MHz
  800x600@60Hz 4:3 HorFreq: 37900 Hz Clock: 40.000 MHz
  800x600@75Hz 4:3 HorFreq: 46900 Hz Clock: 49.500 MHz
  1024x768@60Hz 4:3 HorFreq: 48400 Hz Clock: 65.000 MHz
  1024x768@70Hz 4:3 HorFreq: 56500 Hz Clock: 75.000 MHz
  1024x768@75Hz 4:3 HorFreq: 60000 Hz Clock: 78.750 MHz
  1280x1024@75Hz 5:4 HorFreq: 80000 Hz Clock: 135.000 MHz
Standard timings supported:
  1280x1024@75Hz 5:4 HorFreq: 80000 Hz Clock: 135.000 MHz
  1280x1024@60Hz 5:4 HorFreq: 64000 Hz Clock: 108.000 MHz
  1024x768@75Hz 4:3 HorFreq: 60000 Hz Clock: 78.750 MHz
  1024x768@60Hz 4:3 HorFreq: 48400 Hz Clock: 65.000 MHz
  800x600@75Hz 4:3 HorFreq: 46900 Hz Clock: 49.500 MHz
  800x600@60Hz 4:3 HorFreq: 37900 Hz Clock: 40.000 MHz
Detailed mode: Clock 108.000 MHz, 376 mm x 301 mm
               1280 1328 1440 1688 hborder 0
               1024 1025 1028 1066 vborder 0
               +hsync +vsync 
               VertFreq: 60 Hz, HorFreq: 63981 Hz
Serial number: --
Monitor ranges (GTF): 55-76Hz V, 30-83kHz H, max dotclock 140MHz
Monitor name: C19-4
Checksum: 0x6d (valid)
EDID block does not conform at all!
	Bad year of manufacture
