
EDID (hex):
00ffffffffffff003669621401000000
131e0104a55021783b8e05ad4f33b026
0d5054afcf00818081a895009528b300
b328d1e8d1c043d070a0d0a029503020
35001d4d3100001a000000fd003064a2
a202010a202020202020000000fc004d
5349204d414733343143510a000000ff
004d4130483033303138303131330117
020318754b909f859404130312010211
2309070783010000023a80d072382d40
102c35801d4d31000018fe7c70a0d0a0
2950302035001d4d31000018565e00a0
a0a02950302035001d4d3100001e3a9d
00a0a0a02950304035001d4d3100001e
ae60801871382d40302c35001d4d3100
00180000000000000000000000000012

Extracted contents:
header:          00 ff ff ff ff ff ff 00
serial number:   36 69 62 14 01 00 00 00 13 1e
version:         01 04
basic params:    a5 50 21 78 3b
chroma info:     8e 05 ad 4f 33 b0 26 0d 50 54
established:     af cf 00
standard:        81 80 81 a8 95 00 95 28 b3 00 b3 28 d1 e8 d1 c0
descriptor 1:    43 d0 70 a0 d0 a0 29 50 30 20 35 00 1d 4d 31 00 00 1a
descriptor 2:    00 00 00 fd 00 30 64 a2 a2 02 01 0a 20 20 20 20 20 20
descriptor 3:    00 00 00 fc 00 4d 53 49 20 4d 41 47 33 34 31 43 51 0a
descriptor 4:    00 00 00 ff 00 4d 41 30 48 30 33 30 31 38 30 31 31 33
extensions:      01
checksum:        17

EDID version: 1.4
Manufacturer: MSI Model 1462 Serial Number --
Made in week 19 of 2020
Digital display
8 bits per primary color channel
DisplayPort interface
Maximum image size: 80 cm x 33 cm
Gamma: 2.20
DPMS levels: Off
Supported color formats: RGB 4:4:4, YCrCb 4:4:4, YCrCb 4:2:2
First detailed timing includes the native pixel format and preferred refresh rate
Display is continuous frequency
Display x,y Chromaticity:
  Red:   0.6777, 0.3085
  Green: 0.2021, 0.6894
  Blue:  0.1484, 0.0507
  White: 0.3134, 0.3291
Established timings supported:
  720x400@70Hz 9:5 HorFreq: 31469 Hz Clock: 28.320 MHz
  640x480@60Hz 4:3 HorFreq: 31469 Hz Clock: 25.175 MHz
  640x480@72Hz 4:3 HorFreq: 37900 Hz Clock: 31.500 MHz
  640x480@75Hz 4:3 HorFreq: 37500 Hz Clock: 31.500 MHz
  800x600@56Hz 4:3 HorFreq: 35200 Hz Clock: 36.000 MHz
  800x600@60Hz 4:3 HorFreq: 37900 Hz Clock: 40.000 MHz
  800x600@72Hz 4:3 HorFreq: 48100 Hz Clock: 50.000 MHz
  800x600@75Hz 4:3 HorFreq: 46900 Hz Clock: 49.500 MHz
  1024x768@60Hz 4:3 HorFreq: 48400 Hz Clock: 65.000 MHz
  1024x768@70Hz 4:3 HorFreq: 56500 Hz Clock: 75.000 MHz
  1024x768@75Hz 4:3 HorFreq: 60000 Hz Clock: 78.750 MHz
  1280x1024@75Hz 5:4 HorFreq: 80000 Hz Clock: 135.000 MHz
Standard timings supported:
  1280x1024@60Hz 5:4 HorFreq: 64000 Hz Clock: 108.000 MHz
  1280x1024@100Hz 5:4
  1440x900@60Hz 16:10 HorFreq: 55500 Hz Clock: 88.750 MHz
  1440x900@100Hz 16:10
  1680x1050@60Hz 16:10 HorFreq: 64700 Hz Clock: 119.000 MHz
  1680x1050@100Hz 16:10
  1920x1080@100Hz 16:9
  1920x1080@60Hz 16:9
Detailed mode: Clock 533.150 MHz, 797 mm x 333 mm
               3440 3488 3520 3600 hborder 0
               1440 1443 1448 1481 vborder 0
               +hsync -vsync 
               VertFreq: 99 Hz, HorFreq: 148097 Hz
Monitor ranges (bare limits): 48-100Hz V, 162-162kHz H, max dotclock 20MHz
Monitor name: MSI MAG341CQ
Serial number: --
Has 1 extension blocks
Checksum: 0x17 (valid)

CTA extension block
Extension version: 3
20 bytes of CTA data
  Video data block
    VIC  16 1920x1080@60Hz 16:9 (native) HorFreq: 67500 Hz Clock: 148.500 MHz
    VIC  31 1920x1080@50Hz 16:9 (native) HorFreq: 56250 Hz Clock: 148.500 MHz
    VIC   5 1920x1080i@60Hz 16:9 (native) HorFreq: 33750 Hz Clock: 74.250 MHz
    VIC  20 1920x1080i@50Hz 16:9 (native) HorFreq: 28125 Hz Clock: 74.250 MHz
    VIC   4 1280x720@60Hz 16:9  HorFreq: 45000 Hz Clock: 74.250 MHz
    VIC  19 1280x720@50Hz 16:9  HorFreq: 37500 Hz Clock: 74.250 MHz
    VIC   3 720x480@60Hz 16:9  HorFreq: 31469 Hz Clock: 27.000 MHz
    VIC  18 720x576@50Hz 16:9  HorFreq: 31250 Hz Clock: 27.000 MHz
    VIC   1 640x480@60Hz 4:3  HorFreq: 31469 Hz Clock: 25.175 MHz
    VIC   2 720x480@60Hz 4:3  HorFreq: 31469 Hz Clock: 27.000 MHz
    VIC  17 720x576@50Hz 4:3  HorFreq: 31250 Hz Clock: 27.000 MHz
  Audio data block
    Linear PCM, max channels 2
      Supported sample rates (kHz): 48 44.1 32
      Supported sample sizes (bits): 24 20 16
  Speaker allocation data block
    Speaker map:
      FL/FR - Front Left/Right
Basic audio support
Supports YCbCr 4:4:4
Supports YCbCr 4:2:2
5 native detailed modes
Detailed mode: Clock 148.500 MHz, 797 mm x 333 mm
               1920 2448 2492 2640 hborder 0
               1080 1083 1088 1125 vborder 0
               -hsync -vsync 
               VertFreq: 50 Hz, HorFreq: 56250 Hz
Detailed mode: Clock 319.980 MHz, 797 mm x 333 mm
               3440 3488 3520 3600 hborder 0
               1440 1443 1448 1481 vborder 0
               -hsync -vsync 
               VertFreq: 60 Hz, HorFreq: 88883 Hz
Detailed mode: Clock 241.500 MHz, 797 mm x 333 mm
               2560 2608 2640 2720 hborder 0
               1440 1443 1448 1481 vborder 0
               +hsync +vsync 
               VertFreq: 59 Hz, HorFreq: 88786 Hz
Detailed mode: Clock 402.500 MHz, 797 mm x 333 mm
               2560 2608 2672 2720 hborder 0
               1440 1443 1448 1481 vborder 0
               +hsync +vsync 
               VertFreq: 99 Hz, HorFreq: 147977 Hz
Detailed mode: Clock 247.500 MHz, 797 mm x 333 mm
               1920 1968 2012 2200 hborder 0
               1080 1083 1088 1125 vborder 0
               -hsync -vsync 
               VertFreq: 100 Hz, HorFreq: 112500 Hz
Checksum: 0x12 (valid)

Warning: One or more of the timings is out of range of the Monitor Ranges:
  Vertical Freq: 50 - 100 Hz
  Horizontal Freq: 28125 - 148097 Hz
  Maximum Clock: 533.150 MHz
EDID block does not conform at all!
	Both the serial number and the serial string are set


