
EDID (hex):
00ffffffffffff003669621401000000
0a1b0104a5341d783387e5a456509e26
0d5054afcf008180617c81bc9500953c
b300b33cd1fc023a801871382d40582c
450009252100001e378b801871382d40
582c450009252100001e000000fd005a
90a2a2240100202020202020000000fc
004f7074697820473234430a2020014b
020313c1230907078301000000000000
0000002a82805070384d400820f80c53
502100001a0000000000000000000000
00000000000000000000000000000000
00000000000000000000000000000000
00000000000000000000000000000000
00000000000000000000000000000000
000000000000000000000000000000ae

Extracted contents:
header:          00 ff ff ff ff ff ff 00
serial number:   36 69 62 14 01 00 00 00 0a 1b
version:         01 04
basic params:    a5 34 1d 78 33
chroma info:     87 e5 a4 56 50 9e 26 0d 50 54
established:     af cf 00
standard:        81 80 61 7c 81 bc 95 00 95 3c b3 00 b3 3c d1 fc
descriptor 1:    02 3a 80 18 71 38 2d 40 58 2c 45 00 09 25 21 00 00 1e
descriptor 2:    37 8b 80 18 71 38 2d 40 58 2c 45 00 09 25 21 00 00 1e
descriptor 3:    00 00 00 fd 00 5a 90 a2 a2 24 01 00 20 20 20 20 20 20
descriptor 4:    00 00 00 fc 00 4f 70 74 69 78 20 47 32 34 43 0a 20 20
extensions:      01
checksum:        4b

EDID version: 1.4
Manufacturer: MSI Model 1462 Serial Number --
Made in week 10 of 2017
Digital display
8 bits per primary color channel
DisplayPort interface
Maximum image size: 52 cm x 29 cm
Gamma: 2.20
DPMS levels: Off
Supported color formats: RGB 4:4:4, YCrCb 4:2:2
First detailed timing includes the native pixel format and preferred refresh rate
Display is continuous frequency
Display x,y Chromaticity:
  Red:   0.6425, 0.3359
  Green: 0.3134, 0.6201
  Blue:  0.1513, 0.0527
  White: 0.3134, 0.3291
Established timings supported:
  720x400@70Hz 9:5 HorFreq: 31469 Hz Clock: 28.320 MHz
  640x480@60Hz 4:3 HorFreq: 31469 Hz Clock: 25.175 MHz
  640x480@72Hz 4:3 HorFreq: 37900 Hz Clock: 31.500 MHz
  640x480@75Hz 4:3 HorFreq: 37500 Hz Clock: 31.500 MHz
  800x600@56Hz 4:3 HorFreq: 35200 Hz Clock: 36.000 MHz
  800x600@60Hz 4:3 HorFreq: 37900 Hz Clock: 40.000 MHz
  800x600@72Hz 4:3 HorFreq: 48100 Hz Clock: 50.000 MHz
  800x600@75Hz 4:3 HorFreq: 46900 Hz Clock: 49.500 MHz
  1024x768@60Hz 4:3 HorFreq: 48400 Hz Clock: 65.000 MHz
  1024x768@70Hz 4:3 HorFreq: 56500 Hz Clock: 75.000 MHz
  1024x768@75Hz 4:3 HorFreq: 60000 Hz Clock: 78.750 MHz
  1280x1024@75Hz 5:4 HorFreq: 80000 Hz Clock: 135.000 MHz
Standard timings supported:
  1280x1024@60Hz 5:4 HorFreq: 64000 Hz Clock: 108.000 MHz
  1024x768@120Hz 4:3
  1280x1024@120Hz 5:4
  1440x900@60Hz 16:10 HorFreq: 55500 Hz Clock: 88.750 MHz
  1440x900@120Hz 16:10
  1680x1050@60Hz 16:10 HorFreq: 64700 Hz Clock: 119.000 MHz
  1680x1050@120Hz 16:10
  1920x1080@120Hz 16:9
Detailed mode: Clock 148.500 MHz, 521 mm x 293 mm
               1920 2008 2052 2200 hborder 0
               1080 1084 1089 1125 vborder 0
               +hsync +vsync 
               VertFreq: 60 Hz, HorFreq: 67500 Hz
Detailed mode: Clock 356.390 MHz, 521 mm x 293 mm
               1920 2008 2052 2200 hborder 0
               1080 1084 1089 1125 vborder 0
               +hsync +vsync 
               VertFreq: 143 Hz, HorFreq: 161995 Hz
Monitor ranges (bare limits): 90-144Hz V, 162-162kHz H, max dotclock 360MHz
Monitor name: Optix G24C
Has 1 extension blocks
Checksum: 0x4b (valid)

CTA extension block
Extension version: 3
15 bytes of CTA data
  Audio data block
    Linear PCM, max channels 2
      Supported sample rates (kHz): 48 44.1 32
      Supported sample sizes (bits): 24 20 16
  Speaker allocation data block
    Speaker map:
      FL/FR - Front Left/Right
  Unknown tag 0, length 0 (raw 00)
  Unknown tag 0, length 0 (raw 00)
  Unknown tag 0, length 0 (raw 00)
  Unknown tag 0, length 0 (raw 00)
  Unknown tag 0, length 0 (raw 00)
  Unknown tag 0, length 0 (raw 00)
  Unknown tag 0, length 0 (raw 00)
Underscans PC formats by default
Basic audio support
1 native detailed modes
Detailed mode: Clock 333.220 MHz, 595 mm x 336 mm
               1920 1928 1960 2000 hborder 0
               1080 1143 1151 1157 vborder 0
               +hsync -vsync 
               VertFreq: 144 Hz, HorFreq: 166610 Hz
Checksum: 0xae (valid)

Warning: One or more of the timings is out of range of the Monitor Ranges:
  Vertical Freq: 56 - 144 Hz
  Horizontal Freq: 31469 - 166610 Hz
  Maximum Clock: 356.390 MHz
