
EDID (hex):
00ffffffffffff003669621401000000
0b1c0104a53b23783bdc5ba3544c9926
0f4749afcf0081c0617c81bc9500953c
b300b33cd1fcfb7e8088703812401820
450056502100001e000000fc004f7074
6978204d41473237430a000000fd0030
90a2a221010a202020202020000000ff
00303030303030303030303030310192
02030cc12309070783010000fe5b80a0
703835403020350009252100001e866f
80a0703840403020350009252100001e
023a801871382d40582c350009252100
001e0000000000000000000000000000
00000000000000000000000000000000
00000000000000000000000000000000
000000000000000000000000000000a9

Extracted contents:
header:          00 ff ff ff ff ff ff 00
serial number:   36 69 62 14 01 00 00 00 0b 1c
version:         01 04
basic params:    a5 3b 23 78 3b
chroma info:     dc 5b a3 54 4c 99 26 0f 47 49
established:     af cf 00
standard:        81 c0 61 7c 81 bc 95 00 95 3c b3 00 b3 3c d1 fc
descriptor 1:    fb 7e 80 88 70 38 12 40 18 20 45 00 56 50 21 00 00 1e
descriptor 2:    00 00 00 fc 00 4f 70 74 69 78 20 4d 41 47 32 37 43 0a
descriptor 3:    00 00 00 fd 00 30 90 a2 a2 21 01 0a 20 20 20 20 20 20
descriptor 4:    00 00 00 ff 00 30 30 30 30 30 30 30 30 30 30 30 30 31
extensions:      01
checksum:        92

EDID version: 1.4
Manufacturer: MSI Model 1462 Serial Number --
Made in week 11 of 2018
Digital display
8 bits per primary color channel
DisplayPort interface
Maximum image size: 59 cm x 35 cm
Gamma: 2.20
DPMS levels: Off
Supported color formats: RGB 4:4:4, YCrCb 4:4:4, YCrCb 4:2:2
First detailed timing includes the native pixel format and preferred refresh rate
Display is continuous frequency
Display x,y Chromaticity:
  Red:   0.6396, 0.3291
  Green: 0.2998, 0.5976
  Blue:  0.1494, 0.0595
  White: 0.2792, 0.2880
Established timings supported:
  720x400@70Hz 9:5 HorFreq: 31469 Hz Clock: 28.320 MHz
  640x480@60Hz 4:3 HorFreq: 31469 Hz Clock: 25.175 MHz
  640x480@72Hz 4:3 HorFreq: 37900 Hz Clock: 31.500 MHz
  640x480@75Hz 4:3 HorFreq: 37500 Hz Clock: 31.500 MHz
  800x600@56Hz 4:3 HorFreq: 35200 Hz Clock: 36.000 MHz
  800x600@60Hz 4:3 HorFreq: 37900 Hz Clock: 40.000 MHz
  800x600@72Hz 4:3 HorFreq: 48100 Hz Clock: 50.000 MHz
  800x600@75Hz 4:3 HorFreq: 46900 Hz Clock: 49.500 MHz
  1024x768@60Hz 4:3 HorFreq: 48400 Hz Clock: 65.000 MHz
  1024x768@70Hz 4:3 HorFreq: 56500 Hz Clock: 75.000 MHz
  1024x768@75Hz 4:3 HorFreq: 60000 Hz Clock: 78.750 MHz
  1280x1024@75Hz 5:4 HorFreq: 80000 Hz Clock: 135.000 MHz
Standard timings supported:
  1280x720@60Hz 16:9
  1024x768@120Hz 4:3
  1280x1024@120Hz 5:4
  1440x900@60Hz 16:10 HorFreq: 55500 Hz Clock: 88.750 MHz
  1440x900@120Hz 16:10
  1680x1050@60Hz 16:10 HorFreq: 64700 Hz Clock: 119.000 MHz
  1680x1050@120Hz 16:10
  1920x1080@120Hz 16:9
Detailed mode: Clock 325.070 MHz, 598 mm x 336 mm
               1920 1944 1976 2056 hborder 0
               1080 1084 1089 1098 vborder 0
               +hsync +vsync 
               VertFreq: 143 Hz, HorFreq: 158107 Hz
Monitor name: Optix MAG27C
Monitor ranges (bare limits): 48-144Hz V, 162-162kHz H, max dotclock 330MHz
Serial number: --
Has 1 extension blocks
Checksum: 0x92 (valid)

CTA extension block
Extension version: 3
8 bytes of CTA data
  Audio data block
    Linear PCM, max channels 2
      Supported sample rates (kHz): 48 44.1 32
      Supported sample sizes (bits): 24 20 16
  Speaker allocation data block
    Speaker map:
      FL/FR - Front Left/Right
Underscans PC formats by default
Basic audio support
1 native detailed modes
Detailed mode: Clock 235.500 MHz, 521 mm x 293 mm
               1920 1968 2000 2080 hborder 0
               1080 1083 1088 1133 vborder 0
               +hsync +vsync 
               VertFreq: 99 Hz, HorFreq: 113221 Hz
Detailed mode: Clock 285.500 MHz, 521 mm x 293 mm
               1920 1968 2000 2080 hborder 0
               1080 1083 1088 1144 vborder 0
               +hsync +vsync 
               VertFreq: 119 Hz, HorFreq: 137259 Hz
Detailed mode: Clock 148.500 MHz, 521 mm x 293 mm
               1920 2008 2052 2200 hborder 0
               1080 1083 1088 1125 vborder 0
               +hsync +vsync 
               VertFreq: 60 Hz, HorFreq: 67500 Hz
Checksum: 0xa9 (valid)

Warning: One or more of the timings is out of range of the Monitor Ranges:
  Vertical Freq: 56 - 143 Hz
  Horizontal Freq: 31469 - 158107 Hz
  Maximum Clock: 325.070 MHz
EDID block does not conform at all!
	Both the serial number and the serial string are set


