
EDID (hex):
00ffffffffffff003669621401000000
141c0103803b23782e2d1fa6564fa026
0d4f53afef80617c818081bc9500953c
b300b33cd1c0565e00a0a0a029503020
350055502100001a000000fc004f7074
6978204d414732374351000000fd0032
78dede32000a202020202020000000ff
00303030303030303030303030310116
020333f14f9005040302011112131406
0715161f230907078301000065030c00
100067d85dc40178c000681a00000100
309000f6bd00a0a0a032502040450056
502100001ae28180a070381f40204045
0056502100001a866f80a07038404030
20350056502100001a1a1d007251d01e
200a2855005650210000ff0000000087

Extracted contents:
header:          00 ff ff ff ff ff ff 00
serial number:   36 69 62 14 01 00 00 00 14 1c
version:         01 03
basic params:    80 3b 23 78 2e
chroma info:     2d 1f a6 56 4f a0 26 0d 4f 53
established:     af ef 80
standard:        61 7c 81 80 81 bc 95 00 95 3c b3 00 b3 3c d1 c0
descriptor 1:    56 5e 00 a0 a0 a0 29 50 30 20 35 00 55 50 21 00 00 1a
descriptor 2:    00 00 00 fc 00 4f 70 74 69 78 20 4d 41 47 32 37 43 51
descriptor 3:    00 00 00 fd 00 32 78 de de 32 00 0a 20 20 20 20 20 20
descriptor 4:    00 00 00 ff 00 30 30 30 30 30 30 30 30 30 30 30 30 31
extensions:      01
checksum:        16

EDID version: 1.3
Manufacturer: MSI Model 1462 Serial Number --
Made in week 20 of 2018
Digital display
Maximum image size: 59 cm x 35 cm
Gamma: 2.20
DPMS levels: Off
RGB color display
Default (sRGB) color space is primary color space
First detailed timing is preferred timing
Display x,y Chromaticity:
  Red:   0.6484, 0.3378
  Green: 0.3115, 0.6259
  Blue:  0.1484, 0.0517
  White: 0.3115, 0.3271
Established timings supported:
  720x400@70Hz 9:5 HorFreq: 31469 Hz Clock: 28.320 MHz
  640x480@60Hz 4:3 HorFreq: 31469 Hz Clock: 25.175 MHz
  640x480@72Hz 4:3 HorFreq: 37900 Hz Clock: 31.500 MHz
  640x480@75Hz 4:3 HorFreq: 37500 Hz Clock: 31.500 MHz
  800x600@56Hz 4:3 HorFreq: 35200 Hz Clock: 36.000 MHz
  800x600@60Hz 4:3 HorFreq: 37900 Hz Clock: 40.000 MHz
  800x600@72Hz 4:3 HorFreq: 48100 Hz Clock: 50.000 MHz
  800x600@75Hz 4:3 HorFreq: 46900 Hz Clock: 49.500 MHz
  832x624@75Hz 4:3 HorFreq: 49726 Hz Clock: 57.284 MHz
  1024x768@60Hz 4:3 HorFreq: 48400 Hz Clock: 65.000 MHz
  1024x768@70Hz 4:3 HorFreq: 56500 Hz Clock: 75.000 MHz
  1024x768@75Hz 4:3 HorFreq: 60000 Hz Clock: 78.750 MHz
  1280x1024@75Hz 5:4 HorFreq: 80000 Hz Clock: 135.000 MHz
  1152x870@75Hz 192:145 HorFreq: 67500 Hz Clock: 108.000 MHz
Standard timings supported:
  1024x768@120Hz 4:3
  1280x1024@60Hz 5:4 HorFreq: 64000 Hz Clock: 108.000 MHz
  1280x1024@120Hz 5:4
  1440x900@60Hz 16:10 HorFreq: 55500 Hz Clock: 88.750 MHz
  1440x900@120Hz 16:10
  1680x1050@60Hz 16:10 HorFreq: 64700 Hz Clock: 119.000 MHz
  1680x1050@120Hz 16:10
  1920x1080@60Hz 16:9
Detailed mode: Clock 241.500 MHz, 597 mm x 336 mm
               2560 2608 2640 2720 hborder 0
               1440 1443 1448 1481 vborder 0
               +hsync -vsync 
               VertFreq: 59 Hz, HorFreq: 88786 Hz
Monitor ranges (GTF): 50-120Hz V, 222-222kHz H, max dotclock 500MHz
Serial number: --
Has 1 extension blocks
Checksum: 0x16 (valid)

CTA extension block
Extension version: 3
47 bytes of CTA data
  Video data block
    VIC  16 1920x1080@60Hz 16:9 (native) HorFreq: 67500 Hz Clock: 148.500 MHz
    VIC   5 1920x1080i@60Hz 16:9  HorFreq: 33750 Hz Clock: 74.250 MHz
    VIC   4 1280x720@60Hz 16:9  HorFreq: 45000 Hz Clock: 74.250 MHz
    VIC   3 720x480@60Hz 16:9  HorFreq: 31469 Hz Clock: 27.000 MHz
    VIC   2 720x480@60Hz 4:3  HorFreq: 31469 Hz Clock: 27.000 MHz
    VIC   1 640x480@60Hz 4:3  HorFreq: 31469 Hz Clock: 25.175 MHz
    VIC  17 720x576@50Hz 4:3  HorFreq: 31250 Hz Clock: 27.000 MHz
    VIC  18 720x576@50Hz 16:9  HorFreq: 31250 Hz Clock: 27.000 MHz
    VIC  19 1280x720@50Hz 16:9  HorFreq: 37500 Hz Clock: 74.250 MHz
    VIC  20 1920x1080i@50Hz 16:9  HorFreq: 28125 Hz Clock: 74.250 MHz
    VIC   6 1440x480i@60Hz 4:3  HorFreq: 15734 Hz Clock: 27.000 MHz
    VIC   7 1440x480i@60Hz 16:9  HorFreq: 15734 Hz Clock: 27.000 MHz
    VIC  21 1440x576i@50Hz 4:3  HorFreq: 15625 Hz Clock: 27.000 MHz
    VIC  22 1440x576i@50Hz 16:9  HorFreq: 15625 Hz Clock: 27.000 MHz
    VIC  31 1920x1080@50Hz 16:9  HorFreq: 56250 Hz Clock: 148.500 MHz
  Audio data block
    Linear PCM, max channels 2
      Supported sample rates (kHz): 48 44.1 32
      Supported sample sizes (bits): 24 20 16
  Speaker allocation data block
    Speaker map:
      FL/FR - Front Left/Right
  Vendor-specific data block, OUI 000c03 (HDMI)
    Source physical address 1.0.0.0
  Vendor-specific data block, OUI c45dd8 (HDMI Forum)
    Version: 1
    Maximum TMDS Character Rate: 600MHz
    SCDC Present
    SCDC Read Request Capable
  Vendor-specific data block, OUI 00001a
Underscans PC formats by default
Basic audio support
Supports YCbCr 4:4:4
Supports YCbCr 4:2:2
1 native detailed modes
Detailed mode: Clock 486.300 MHz, 598 mm x 336 mm
               2560 2592 2656 2720 hborder 0
               1440 1444 1449 1490 vborder 0
               +hsync -vsync 
               VertFreq: 119 Hz, HorFreq: 178786 Hz
Detailed mode: Clock 332.500 MHz, 598 mm x 336 mm
               1920 1952 2016 2080 hborder 0
               1080 1084 1089 1111 vborder 0
               +hsync -vsync 
               VertFreq: 143 Hz, HorFreq: 159855 Hz
Detailed mode: Clock 285.500 MHz, 598 mm x 336 mm
               1920 1968 2000 2080 hborder 0
               1080 1083 1088 1144 vborder 0
               +hsync -vsync 
               VertFreq: 119 Hz, HorFreq: 137259 Hz
Detailed mode: Clock 74.500 MHz, 598 mm x 336 mm
               1280 1290 1330 1650 hborder 0
                720  725  730  750 vborder 0
               +hsync +vsync interlaced side by side interleaved
               VertFreq: 60 Hz, HorFreq: 45151 Hz
Checksum: 0x87 (valid)

EDID block does NOT conform to EDID 1.3!
	sRGB is signaled, but the chromaticities do not match
	Name descriptor not terminated with a newline
One or more of the timings is out of range of the Monitor Ranges:
  Vertical Freq: 50 - 143 Hz
  Horizontal Freq: 15625 - 178786 Hz
  Maximum Clock: 486.300 MHz
EDID block does not conform at all!
	Both the serial number and the serial string are set


