edid-decode (hex):

00 ff ff ff ff ff ff 00 36 69 62 14 01 00 00 00
1d 1e 01 04 a5 46 27 78 3b 8e 05 ad 4f 33 b0 26
0d 50 54 af cf 00 81 80 81 bc 95 00 95 fc b3 00
b3 3c d1 fc d1 c0 41 df 00 78 a0 a0 29 50 30 20
35 00 ba 89 21 00 00 1a 00 00 00 fd 00 30 92 df
df 08 01 0a 20 20 20 20 20 20 00 00 00 fc 00 4f
70 74 69 78 20 41 47 33 32 43 51 0a 00 00 00 ff
00 4b 41 31 48 31 35 30 37 30 31 30 30 36 01 98

02 03 18 75 4b 90 9f 85 94 04 13 03 12 01 02 11
23 09 07 07 83 01 00 00 02 3a 80 d0 72 38 2d 40
10 2c 96 80 56 50 21 00 00 18 04 74 80 18 71 38
2d 40 58 2c 96 00 56 50 21 00 00 18 56 5e 00 a0
a0 a0 29 50 30 20 35 00 ba ef 21 00 00 1e d3 bc
00 a0 a0 a0 29 50 30 40 35 00 56 50 21 00 00 1a
37 8b 80 18 71 38 2d 40 30 2c 45 00 ba 89 21 00
00 1a 00 00 00 00 00 00 00 00 00 00 00 00 00 73

00 ff ff ff ff ff ff 00 36 69 62 14 01 00 00 00
1d 1e 01 04 a5 46 27 78 3b 8e 05 ad 4f 33 b0 26
0d 50 54 af cf 00 81 80 81 bc 95 00 95 fc b3 00
b3 3c d1 fc d1 c0 41 df 00 78 a0 a0 29 50 30 20
35 00 ba 89 21 00 00 1a 00 00 00 fd 00 30 92 df
df 08 01 0a 20 20 20 20 20 20 00 00 00 fc 00 4f
70 74 69 78 20 41 47 33 32 43 51 0a 00 00 00 ff
00 4b 41 31 48 31 35 30 37 30 31 30 30 36 01 98

02 03 18 75 4b 90 9f 85 94 04 13 03 12 01 02 11
23 09 07 07 83 01 00 00 02 3a 80 d0 72 38 2d 40
10 2c 96 80 56 50 21 00 00 18 04 74 80 18 71 38
2d 40 58 2c 96 00 56 50 21 00 00 18 56 5e 00 a0
a0 a0 29 50 30 20 35 00 ba ef 21 00 00 1e d3 bc
00 a0 a0 a0 29 50 30 40 35 00 56 50 21 00 00 1a
37 8b 80 18 71 38 2d 40 30 2c 45 00 ba 89 21 00
00 1a 00 00 00 00 00 00 00 00 00 00 00 00 00 73

----------------

Block 0, Base EDID:
  EDID Structure Version & Revision: 1.4
  Vendor & Product Identification:
    Manufacturer: MSI
    Model: 5218
    Serial Number: ...
    Made in: week 29 of 2020
  Basic Display Parameters & Features:
    Digital display
    Bits per primary color channel: 8
    DisplayPort interface
    Maximum image size: 70 cm x 39 cm
    Gamma: 2.20
    DPMS levels: Off
    Supported color formats: RGB 4:4:4, YCrCb 4:4:4, YCrCb 4:2:2
    First detailed timing includes the native pixel format and preferred refresh rate
    Display is continuous frequency
  Color Characteristics:
    Red  : 0.6777, 0.3085
    Green: 0.2021, 0.6894
    Blue : 0.1484, 0.0507
    White: 0.3134, 0.3291
  Established Timings I & II:
    IBM     :   720x400    70.081663 Hz   9:5     31.467 kHz     28.320000 MHz
    DMT 0x04:   640x480    59.940476 Hz   4:3     31.469 kHz     25.175000 MHz
    DMT 0x05:   640x480    72.808802 Hz   4:3     37.861 kHz     31.500000 MHz
    DMT 0x06:   640x480    75.000000 Hz   4:3     37.500 kHz     31.500000 MHz
    DMT 0x08:   800x600    56.250000 Hz   4:3     35.156 kHz     36.000000 MHz
    DMT 0x09:   800x600    60.316541 Hz   4:3     37.879 kHz     40.000000 MHz
    DMT 0x0a:   800x600    72.187572 Hz   4:3     48.077 kHz     50.000000 MHz
    DMT 0x0b:   800x600    75.000000 Hz   4:3     46.875 kHz     49.500000 MHz
    DMT 0x10:  1024x768    60.003840 Hz   4:3     48.363 kHz     65.000000 MHz
    DMT 0x11:  1024x768    70.069359 Hz   4:3     56.476 kHz     75.000000 MHz
    DMT 0x12:  1024x768    75.028582 Hz   4:3     60.023 kHz     78.750000 MHz
    DMT 0x24:  1280x1024   75.024675 Hz   5:4     79.976 kHz    135.000000 MHz
  Standard Timings:
    DMT 0x23:  1280x1024   60.019740 Hz   5:4     63.981 kHz    108.000000 MHz
    GTF     :  1280x1024  120.000185 Hz   5:4    131.640 kHz    233.793000 MHz
    DMT 0x2f:  1440x900    59.887445 Hz  16:10    55.935 kHz    106.500000 MHz
    GTF     :  1440x810   120.000070 Hz  16:9    104.160 kHz    204.987000 MHz
    DMT 0x3a:  1680x1050   59.954250 Hz  16:10    65.290 kHz    146.250000 MHz
    GTF     :  1680x1050  120.000000 Hz  16:10   135.000 kHz    313.200000 MHz
    GTF     :  1920x1080  119.999987 Hz  16:9    138.840 kHz    368.759000 MHz
    DMT 0x52:  1920x1080   60.000000 Hz  16:9     67.500 kHz    148.500000 MHz
  Detailed Timing Descriptors:
    DTD  1:  2560x1440  143.995586 Hz  16:9    213.257 kHz    571.530000 MHz (698 mm x 393 mm)
                  Hfront   48 Hsync  32 Hback   40 Hpol P
                  Vfront    3 Vsync   5 Vback   33 Vpol N
    Display Range Limits:
      Monitor ranges (Bare Limits): 48-146 Hz V, 223-223 kHz H, max dotclock 80 MHz
    Display Product Name: 'Optix AG32CQ'
    Display Product Serial Number: ...
  Extension blocks: 1
Checksum: 0x98

----------------

Block 1, CTA-861 Extension Block:
  Revision: 3
  Basic audio support
  Supports YCbCr 4:4:4
  Supports YCbCr 4:2:2
  Native detailed modes: 5
  Video Data Block:
    VIC  16:  1920x1080   60.000000 Hz  16:9     67.500 kHz    148.500000 MHz (native)
    VIC  31:  1920x1080   50.000000 Hz  16:9     56.250 kHz    148.500000 MHz (native)
    VIC   5:  1920x1080i  60.000000 Hz  16:9     33.750 kHz     74.250000 MHz (native)
    VIC  20:  1920x1080i  50.000000 Hz  16:9     28.125 kHz     74.250000 MHz (native)
    VIC   4:  1280x720    60.000000 Hz  16:9     45.000 kHz     74.250000 MHz
    VIC  19:  1280x720    50.000000 Hz  16:9     37.500 kHz     74.250000 MHz
    VIC   3:   720x480    59.940060 Hz  16:9     31.469 kHz     27.000000 MHz
    VIC  18:   720x576    50.000000 Hz  16:9     31.250 kHz     27.000000 MHz
    VIC   1:   640x480    59.940476 Hz   4:3     31.469 kHz     25.175000 MHz
    VIC   2:   720x480    59.940060 Hz   4:3     31.469 kHz     27.000000 MHz
    VIC  17:   720x576    50.000000 Hz   4:3     31.250 kHz     27.000000 MHz
  Audio Data Block:
    Linear PCM:
      Max channels: 2
      Supported sample rates (kHz): 48 44.1 32
      Supported sample sizes (bits): 24 20 16
  Speaker Allocation Data Block:
    FL/FR - Front Left/Right
  Detailed Timing Descriptors:
    DTD  2:  1920x1080   50.000000 Hz  16:9     56.250 kHz    148.500000 MHz (598 mm x 336 mm)
                  Hfront  528 Hsync  44 Hback  148 Hpol N
                  Vfront    9 Vsync   6 Vback   30 Vpol N
    DTD  3:  1920x1080  120.000000 Hz  16:9    135.000 kHz    297.000000 MHz (598 mm x 336 mm)
                  Hfront   88 Hsync  44 Hback  148 Hpol N
                  Vfront    9 Vsync   6 Vback   30 Vpol N
    DTD  4:  2560x1440   59.950550 Hz  16:9     88.787 kHz    241.500000 MHz (698 mm x 495 mm)
                  Hfront   48 Hsync  32 Hback   80 Hpol P
                  Vfront    3 Vsync   5 Vback   33 Vpol P
    DTD  5:  2560x1440  119.997915 Hz  16:9    177.717 kHz    483.390000 MHz (598 mm x 336 mm)
                  Hfront   48 Hsync  64 Hback   48 Hpol P
                  Vfront    3 Vsync   5 Vback   33 Vpol N
    DTD  6:  1920x1080  143.995960 Hz  16:9    161.995 kHz    356.390000 MHz (698 mm x 393 mm)
                  Hfront   48 Hsync  44 Hback  188 Hpol P
                  Vfront    4 Vsync   5 Vback   36 Vpol N
Checksum: 0x73  Unused space in Extension Block: 13 bytes

----------------

Block 2, Unknown EDID Extension Block 0x00:
  00 ff ff ff ff ff ff 00 36 69 62 14 01 00 00 00 '........6ib.....'
  1d 1e 01 04 a5 46 27 78 3b 8e 05 ad 4f 33 b0 26 '.....F'x;...O3.&'
  0d 50 54 af cf 00 81 80 81 bc 95 00 95 fc b3 00 '.PT.............'
  b3 3c d1 fc d1 c0 41 df 00 78 a0 a0 29 50 30 20 '.<....A..x..)P0 '
  35 00 ba 89 21 00 00 1a 00 00 00 fd 00 30 92 df '5...!........0..'
  df 08 01 0a 20 20 20 20 20 20 00 00 00 fc 00 4f '....      .....O'
  70 74 69 78 20 41 47 33 32 43 51 0a 00 00 00 ff 'ptix AG32CQ.....'
  00 4b 41 31 48 31 35 30 37 30 31 30 30 36 01 98 '.KA1H150701006..'
Checksum: 0x98

----------------

Block 3, CTA-861 Extension Block:
  Revision: 3
  Basic audio support
  Supports YCbCr 4:4:4
  Supports YCbCr 4:2:2
  Native detailed modes: 5
  Video Data Block:
    VIC  16:  1920x1080   60.000000 Hz  16:9     67.500 kHz    148.500000 MHz (native)
    VIC  31:  1920x1080   50.000000 Hz  16:9     56.250 kHz    148.500000 MHz (native)
    VIC   5:  1920x1080i  60.000000 Hz  16:9     33.750 kHz     74.250000 MHz (native)
    VIC  20:  1920x1080i  50.000000 Hz  16:9     28.125 kHz     74.250000 MHz (native)
    VIC   4:  1280x720    60.000000 Hz  16:9     45.000 kHz     74.250000 MHz
    VIC  19:  1280x720    50.000000 Hz  16:9     37.500 kHz     74.250000 MHz
    VIC   3:   720x480    59.940060 Hz  16:9     31.469 kHz     27.000000 MHz
    VIC  18:   720x576    50.000000 Hz  16:9     31.250 kHz     27.000000 MHz
    VIC   1:   640x480    59.940476 Hz   4:3     31.469 kHz     25.175000 MHz
    VIC   2:   720x480    59.940060 Hz   4:3     31.469 kHz     27.000000 MHz
    VIC  17:   720x576    50.000000 Hz   4:3     31.250 kHz     27.000000 MHz
  Audio Data Block:
    Linear PCM:
      Max channels: 2
      Supported sample rates (kHz): 48 44.1 32
      Supported sample sizes (bits): 24 20 16
  Speaker Allocation Data Block:
    FL/FR - Front Left/Right
  Detailed Timing Descriptors:
    DTD  7:  1920x1080   50.000000 Hz  16:9     56.250 kHz    148.500000 MHz (598 mm x 336 mm)
                  Hfront  528 Hsync  44 Hback  148 Hpol N
                  Vfront    9 Vsync   6 Vback   30 Vpol N
    DTD  8:  1920x1080  120.000000 Hz  16:9    135.000 kHz    297.000000 MHz (598 mm x 336 mm)
                  Hfront   88 Hsync  44 Hback  148 Hpol N
                  Vfront    9 Vsync   6 Vback   30 Vpol N
    DTD  9:  2560x1440   59.950550 Hz  16:9     88.787 kHz    241.500000 MHz (698 mm x 495 mm)
                  Hfront   48 Hsync  32 Hback   80 Hpol P
                  Vfront    3 Vsync   5 Vback   33 Vpol P
    DTD 10:  2560x1440  119.997915 Hz  16:9    177.717 kHz    483.390000 MHz (598 mm x 336 mm)
                  Hfront   48 Hsync  64 Hback   48 Hpol P
                  Vfront    3 Vsync   5 Vback   33 Vpol N
    DTD 11:  1920x1080  143.995960 Hz  16:9    161.995 kHz    356.390000 MHz (698 mm x 393 mm)
                  Hfront   48 Hsync  44 Hback  188 Hpol P
                  Vfront    4 Vsync   5 Vback   36 Vpol N
Checksum: 0x73  Unused space in Extension Block: 13 bytes

----------------

Warnings:

Block 1, CTA-861 Extension Block:
  IT Video Formats are overscanned by default, but normally this should be underscanned.
  Detailed Timing Descriptor #2: DTD is similar but not identical to VIC 31.
  Detailed Timing Descriptor #3: DTD is similar but not identical to VIC 63.
  Display Product Serial Number is set, so the Serial Number in the Base EDID should be 0.
  Add a Colorimetry Data Block with the sRGB colorimetry bit set to avoid interop issues.
Block 3, CTA-861 Extension Block:
  IT Video Formats are overscanned by default, but normally this should be underscanned.
  Detailed Timing Descriptor #7: DTD is similar but not identical to VIC 31.
  Detailed Timing Descriptor #8: DTD is similar but not identical to VIC 63.
  Display Product Serial Number is set, so the Serial Number in the Base EDID should be 0.
  Add a Colorimetry Data Block with the sRGB colorimetry bit set to avoid interop issues.
EDID:
  Base EDID: Some timings are out of range of the Monitor Ranges:
    Horizontal Freq: 28.125 - 213.257 kHz (Monitor: 223.000 - 223.000 kHz)
    Maximum Clock: 571.530 MHz (Monitor: 80.000 MHz)
  CTA-861: Multiple native interlaced timings are defined.

Failures:

Block 1, CTA-861 Extension Block:
  Detailed Timing Descriptor #2: Mismatch of image size 598x336 mm vs display size 700x390 mm.
  Detailed Timing Descriptor #3: Mismatch of image size 598x336 mm vs display size 700x390 mm.
  Detailed Timing Descriptor #4: Mismatch of image size 698x495 mm vs display size 700x390 mm.
  Detailed Timing Descriptor #5: Mismatch of image size 598x336 mm vs display size 700x390 mm.
  Missing VCDB, needed for Set Selectable RGB Quantization to avoid interop issues.
Block 2, Base EDID:
  Unknown Extension Block.
Block 3, CTA-861 Extension Block:
  Video Data Block: Duplicate VIC 16.
  Video Data Block: Duplicate VIC 31.
  Video Data Block: Duplicate VIC 5.
  Video Data Block: Duplicate VIC 20.
  Video Data Block: Duplicate VIC 4.
  Video Data Block: Duplicate VIC 19.
  Video Data Block: Duplicate VIC 3.
  Video Data Block: Duplicate VIC 18.
  Video Data Block: Duplicate VIC 1.
  Video Data Block: Duplicate VIC 2.
  Video Data Block: Duplicate VIC 17.
  Speaker Allocation Data Block: Only one instance of this Data Block is allowed.
  Detailed Timing Descriptor #7: Mismatch of image size 598x336 mm vs display size 700x390 mm.
  Detailed Timing Descriptor #8: Mismatch of image size 598x336 mm vs display size 700x390 mm.
  Detailed Timing Descriptor #9: Mismatch of image size 698x495 mm vs display size 700x390 mm.
  Detailed Timing Descriptor #10: Mismatch of image size 598x336 mm vs display size 700x390 mm.
  Missing VCDB, needed for Set Selectable RGB Quantization to avoid interop issues.
EDID:
  Base EDID: The DTD max image size is 698x495mm, which is larger than the display size 700.0x390.0mm.
  Base EDID: EDID specified 1 extension block(s), but found 3 extension block(s).
  CTA-861: Native progressive timings are a mix of several resolutions.

EDID conformity: FAIL
