edid-decode (hex):

00 ff ff ff ff ff ff 00 36 69 62 14 01 00 00 00
0c 1e 01 04 a5 50 21 78 3b 8e 05 ad 4f 33 b0 26
0d 50 54 af cf 00 81 80 81 a8 95 00 95 28 b3 00
b3 28 d1 e8 d1 c0 43 d0 70 a0 d0 a0 29 50 30 20
35 00 1d 4d 31 00 00 1a 00 00 00 fd 00 30 64 a2
a2 02 01 0a 20 20 20 20 20 20 00 00 00 fc 00 4d
53 49 20 4d 41 47 33 34 31 43 51 0a 00 00 00 ff
00 4d 41 30 48 30 35 30 31 32 30 31 33 33 01 20

02 03 18 75 4b 90 9f 85 94 04 13 03 12 01 02 11
23 09 07 07 83 01 00 00 02 3a 80 d0 72 38 2d 40
10 2c 35 80 1d 4d 31 00 00 18 fe 7c 70 a0 d0 a0
29 50 30 20 35 00 1d 4d 31 00 00 18 56 5e 00 a0
a0 a0 29 50 30 20 35 00 1d 4d 31 00 00 1e 3a 9d
00 a0 a0 a0 29 50 30 40 35 00 1d 4d 31 00 00 1e
ae 60 80 18 71 38 2d 40 30 2c 35 00 1d 4d 31 00
00 18 00 00 00 00 00 00 00 00 00 00 00 00 00 12

00 ff ff ff ff ff ff 00 36 69 62 14 01 00 00 00
0c 1e 01 04 a5 50 21 78 3b 8e 05 ad 4f 33 b0 26
0d 50 54 af cf 00 81 80 81 a8 95 00 95 28 b3 00
b3 28 d1 e8 d1 c0 43 d0 70 a0 d0 a0 29 50 30 20
35 00 1d 4d 31 00 00 1a 00 00 00 fd 00 30 64 a2
a2 02 01 0a 20 20 20 20 20 20 00 00 00 fc 00 4d
53 49 20 4d 41 47 33 34 31 43 51 0a 00 00 00 ff
00 4d 41 30 48 30 35 30 31 32 30 31 33 33 01 20

02 03 18 75 4b 90 9f 85 94 04 13 03 12 01 02 11
23 09 07 07 83 01 00 00 02 3a 80 d0 72 38 2d 40
10 2c 35 80 1d 4d 31 00 00 18 fe 7c 70 a0 d0 a0
29 50 30 20 35 00 1d 4d 31 00 00 18 56 5e 00 a0
a0 a0 29 50 30 20 35 00 1d 4d 31 00 00 1e 3a 9d
00 a0 a0 a0 29 50 30 40 35 00 1d 4d 31 00 00 1e
ae 60 80 18 71 38 2d 40 30 2c 35 00 1d 4d 31 00
00 18 00 00 00 00 00 00 00 00 00 00 00 00 00 12

----------------

Block 0, Base EDID:
  EDID Structure Version & Revision: 1.4
  Vendor & Product Identification:
    Manufacturer: MSI
    Model: 5218
    Serial Number: ...
    Made in: week 12 of 2020
  Basic Display Parameters & Features:
    Digital display
    Bits per primary color channel: 8
    DisplayPort interface
    Maximum image size: 80 cm x 33 cm
    Gamma: 2.20
    DPMS levels: Off
    Supported color formats: RGB 4:4:4, YCrCb 4:4:4, YCrCb 4:2:2
    First detailed timing includes the native pixel format and preferred refresh rate
    Display is continuous frequency
  Color Characteristics:
    Red  : 0.6777, 0.3085
    Green: 0.2021, 0.6894
    Blue : 0.1484, 0.0507
    White: 0.3134, 0.3291
  Established Timings I & II:
    IBM     :   720x400    70.081663 Hz   9:5     31.467 kHz     28.320000 MHz
    DMT 0x04:   640x480    59.940476 Hz   4:3     31.469 kHz     25.175000 MHz
    DMT 0x05:   640x480    72.808802 Hz   4:3     37.861 kHz     31.500000 MHz
    DMT 0x06:   640x480    75.000000 Hz   4:3     37.500 kHz     31.500000 MHz
    DMT 0x08:   800x600    56.250000 Hz   4:3     35.156 kHz     36.000000 MHz
    DMT 0x09:   800x600    60.316541 Hz   4:3     37.879 kHz     40.000000 MHz
    DMT 0x0a:   800x600    72.187572 Hz   4:3     48.077 kHz     50.000000 MHz
    DMT 0x0b:   800x600    75.000000 Hz   4:3     46.875 kHz     49.500000 MHz
    DMT 0x10:  1024x768    60.003840 Hz   4:3     48.363 kHz     65.000000 MHz
    DMT 0x11:  1024x768    70.069359 Hz   4:3     56.476 kHz     75.000000 MHz
    DMT 0x12:  1024x768    75.028582 Hz   4:3     60.023 kHz     78.750000 MHz
    DMT 0x24:  1280x1024   75.024675 Hz   5:4     79.976 kHz    135.000000 MHz
  Standard Timings:
    DMT 0x23:  1280x1024   60.019740 Hz   5:4     63.981 kHz    108.000000 MHz
    GTF     :  1280x1024  100.000000 Hz   5:4    108.500 kHz    190.960000 MHz
    DMT 0x2f:  1440x900    59.887445 Hz  16:10    55.935 kHz    106.500000 MHz
    GTF     :  1440x900    99.999787 Hz  16:10    95.300 kHz    187.550000 MHz
    DMT 0x3a:  1680x1050   59.954250 Hz  16:10    65.290 kHz    146.250000 MHz
    GTF     :  1680x1050  100.000078 Hz  16:10   111.200 kHz    256.205000 MHz
    GTF     :  1920x1080  100.000000 Hz  16:9    114.400 kHz    302.016000 MHz
    DMT 0x52:  1920x1080   60.000000 Hz  16:9     67.500 kHz    148.500000 MHz
  Detailed Timing Descriptors:
    DTD  1:  3440x1440   99.998124 Hz  43:18   148.097 kHz    533.150000 MHz (797 mm x 333 mm)
                  Hfront   48 Hsync  32 Hback   80 Hpol P
                  Vfront    3 Vsync   5 Vback   33 Vpol N
    Display Range Limits:
      Monitor ranges (Bare Limits): 48-100 Hz V, 162-162 kHz H, max dotclock 20 MHz
    Display Product Name: 'MSI MAG341CQ'
    Display Product Serial Number: ...
  Extension blocks: 1
Checksum: 0x20

----------------

Block 1, CTA-861 Extension Block:
  Revision: 3
  Basic audio support
  Supports YCbCr 4:4:4
  Supports YCbCr 4:2:2
  Native detailed modes: 5
  Video Data Block:
    VIC  16:  1920x1080   60.000000 Hz  16:9     67.500 kHz    148.500000 MHz (native)
    VIC  31:  1920x1080   50.000000 Hz  16:9     56.250 kHz    148.500000 MHz (native)
    VIC   5:  1920x1080i  60.000000 Hz  16:9     33.750 kHz     74.250000 MHz (native)
    VIC  20:  1920x1080i  50.000000 Hz  16:9     28.125 kHz     74.250000 MHz (native)
    VIC   4:  1280x720    60.000000 Hz  16:9     45.000 kHz     74.250000 MHz
    VIC  19:  1280x720    50.000000 Hz  16:9     37.500 kHz     74.250000 MHz
    VIC   3:   720x480    59.940060 Hz  16:9     31.469 kHz     27.000000 MHz
    VIC  18:   720x576    50.000000 Hz  16:9     31.250 kHz     27.000000 MHz
    VIC   1:   640x480    59.940476 Hz   4:3     31.469 kHz     25.175000 MHz
    VIC   2:   720x480    59.940060 Hz   4:3     31.469 kHz     27.000000 MHz
    VIC  17:   720x576    50.000000 Hz   4:3     31.250 kHz     27.000000 MHz
  Audio Data Block:
    Linear PCM:
      Max channels: 2
      Supported sample rates (kHz): 48 44.1 32
      Supported sample sizes (bits): 24 20 16
  Speaker Allocation Data Block:
    FL/FR - Front Left/Right
  Detailed Timing Descriptors:
    DTD  2:  1920x1080   50.000000 Hz  16:9     56.250 kHz    148.500000 MHz (797 mm x 333 mm)
                  Hfront  528 Hsync  44 Hback  148 Hpol N
                  Vfront    3 Vsync   5 Vback   37 Vpol N
    DTD  3:  3440x1440   60.015755 Hz  43:18    88.883 kHz    319.980000 MHz (797 mm x 333 mm)
                  Hfront   48 Hsync  32 Hback   80 Hpol N
                  Vfront    3 Vsync   5 Vback   33 Vpol N
    DTD  4:  2560x1440   59.950550 Hz  16:9     88.787 kHz    241.500000 MHz (797 mm x 333 mm)
                  Hfront   48 Hsync  32 Hback   80 Hpol P
                  Vfront    3 Vsync   5 Vback   33 Vpol P
    DTD  5:  2560x1440   99.917584 Hz  16:9    147.978 kHz    402.500000 MHz (797 mm x 333 mm)
                  Hfront   48 Hsync  64 Hback   48 Hpol P
                  Vfront    3 Vsync   5 Vback   33 Vpol P
    DTD  6:  1920x1080  100.000000 Hz  16:9    112.500 kHz    247.500000 MHz (797 mm x 333 mm)
                  Hfront   48 Hsync  44 Hback  188 Hpol N
                  Vfront    3 Vsync   5 Vback   37 Vpol N
Checksum: 0x12  Unused space in Extension Block: 13 bytes

----------------

Block 2, Unknown EDID Extension Block 0x00:
  00 ff ff ff ff ff ff 00 36 69 62 14 01 00 00 00 '........6ib.....'
  0c 1e 01 04 a5 50 21 78 3b 8e 05 ad 4f 33 b0 26 '.....P!x;...O3.&'
  0d 50 54 af cf 00 81 80 81 a8 95 00 95 28 b3 00 '.PT..........(..'
  b3 28 d1 e8 d1 c0 43 d0 70 a0 d0 a0 29 50 30 20 '.(....C.p...)P0 '
  35 00 1d 4d 31 00 00 1a 00 00 00 fd 00 30 64 a2 '5..M1........0d.'
  a2 02 01 0a 20 20 20 20 20 20 00 00 00 fc 00 4d '....      .....M'
  53 49 20 4d 41 47 33 34 31 43 51 0a 00 00 00 ff 'SI MAG341CQ.....'
  00 4d 41 30 48 30 35 30 31 32 30 31 33 33 01 20 '.MA0H050120133. '
Checksum: 0x20

----------------

Block 3, CTA-861 Extension Block:
  Revision: 3
  Basic audio support
  Supports YCbCr 4:4:4
  Supports YCbCr 4:2:2
  Native detailed modes: 5
  Video Data Block:
    VIC  16:  1920x1080   60.000000 Hz  16:9     67.500 kHz    148.500000 MHz (native)
    VIC  31:  1920x1080   50.000000 Hz  16:9     56.250 kHz    148.500000 MHz (native)
    VIC   5:  1920x1080i  60.000000 Hz  16:9     33.750 kHz     74.250000 MHz (native)
    VIC  20:  1920x1080i  50.000000 Hz  16:9     28.125 kHz     74.250000 MHz (native)
    VIC   4:  1280x720    60.000000 Hz  16:9     45.000 kHz     74.250000 MHz
    VIC  19:  1280x720    50.000000 Hz  16:9     37.500 kHz     74.250000 MHz
    VIC   3:   720x480    59.940060 Hz  16:9     31.469 kHz     27.000000 MHz
    VIC  18:   720x576    50.000000 Hz  16:9     31.250 kHz     27.000000 MHz
    VIC   1:   640x480    59.940476 Hz   4:3     31.469 kHz     25.175000 MHz
    VIC   2:   720x480    59.940060 Hz   4:3     31.469 kHz     27.000000 MHz
    VIC  17:   720x576    50.000000 Hz   4:3     31.250 kHz     27.000000 MHz
  Audio Data Block:
    Linear PCM:
      Max channels: 2
      Supported sample rates (kHz): 48 44.1 32
      Supported sample sizes (bits): 24 20 16
  Speaker Allocation Data Block:
    FL/FR - Front Left/Right
  Detailed Timing Descriptors:
    DTD  7:  1920x1080   50.000000 Hz  16:9     56.250 kHz    148.500000 MHz (797 mm x 333 mm)
                  Hfront  528 Hsync  44 Hback  148 Hpol N
                  Vfront    3 Vsync   5 Vback   37 Vpol N
    DTD  8:  3440x1440   60.015755 Hz  43:18    88.883 kHz    319.980000 MHz (797 mm x 333 mm)
                  Hfront   48 Hsync  32 Hback   80 Hpol N
                  Vfront    3 Vsync   5 Vback   33 Vpol N
    DTD  9:  2560x1440   59.950550 Hz  16:9     88.787 kHz    241.500000 MHz (797 mm x 333 mm)
                  Hfront   48 Hsync  32 Hback   80 Hpol P
                  Vfront    3 Vsync   5 Vback   33 Vpol P
    DTD 10:  2560x1440   99.917584 Hz  16:9    147.978 kHz    402.500000 MHz (797 mm x 333 mm)
                  Hfront   48 Hsync  64 Hback   48 Hpol P
                  Vfront    3 Vsync   5 Vback   33 Vpol P
    DTD 11:  1920x1080  100.000000 Hz  16:9    112.500 kHz    247.500000 MHz (797 mm x 333 mm)
                  Hfront   48 Hsync  44 Hback  188 Hpol N
                  Vfront    3 Vsync   5 Vback   37 Vpol N
Checksum: 0x12  Unused space in Extension Block: 13 bytes

----------------

Warnings:

Block 1, CTA-861 Extension Block:
  IT Video Formats are overscanned by default, but normally this should be underscanned.
  Detailed Timing Descriptor #2: DTD is similar but not identical to VIC 31.
  Display Product Serial Number is set, so the Serial Number in the Base EDID should be 0.
  Add a Colorimetry Data Block with the sRGB colorimetry bit set to avoid interop issues.
Block 3, CTA-861 Extension Block:
  IT Video Formats are overscanned by default, but normally this should be underscanned.
  Detailed Timing Descriptor #7: DTD is similar but not identical to VIC 31.
  Display Product Serial Number is set, so the Serial Number in the Base EDID should be 0.
  Add a Colorimetry Data Block with the sRGB colorimetry bit set to avoid interop issues.
EDID:
  Base EDID: Some timings are out of range of the Monitor Ranges:
    Horizontal Freq: 28.125 - 148.097 kHz (Monitor: 162.000 - 162.000 kHz)
    Maximum Clock: 533.150 MHz (Monitor: 20.000 MHz)
  CTA-861: Multiple native interlaced timings are defined.

Failures:

Block 1, CTA-861 Extension Block:
  Missing VCDB, needed for Set Selectable RGB Quantization to avoid interop issues.
Block 2, Base EDID:
  Unknown Extension Block.
Block 3, CTA-861 Extension Block:
  Video Data Block: Duplicate VIC 16.
  Video Data Block: Duplicate VIC 31.
  Video Data Block: Duplicate VIC 5.
  Video Data Block: Duplicate VIC 20.
  Video Data Block: Duplicate VIC 4.
  Video Data Block: Duplicate VIC 19.
  Video Data Block: Duplicate VIC 3.
  Video Data Block: Duplicate VIC 18.
  Video Data Block: Duplicate VIC 1.
  Video Data Block: Duplicate VIC 2.
  Video Data Block: Duplicate VIC 17.
  Speaker Allocation Data Block: Only one instance of this Data Block is allowed.
  Missing VCDB, needed for Set Selectable RGB Quantization to avoid interop issues.
EDID:
  Base EDID: EDID specified 1 extension block(s), but found 3 extension block(s).
  CTA-861: Native progressive timings are a mix of several resolutions.

EDID conformity: FAIL
