edid-decode (hex):

00 ff ff ff ff ff ff 00 36 69 62 14 01 00 00 00
13 1d 01 03 80 50 21 78 2e 61 50 a6 56 50 a0 26
0d 50 54 af ef 80 61 68 81 80 95 28 95 00 b3 00
b3 28 d1 c0 d1 e8 f5 7c 70 a0 d0 a0 29 50 30 20
35 00 1d 4d 31 00 00 1a 00 00 00 fd 00 30 4c 1e
58 04 00 0a 20 20 20 20 20 20 00 00 00 fc 00 4d
53 49 20 4d 41 47 33 34 31 43 51 0a 00 00 00 ff
00 4d 41 30 48 30 35 39 31 39 30 31 33 33 00 5a

----------------

Block 0, Base EDID:
  EDID Structure Version & Revision: 1.3
  Vendor & Product Identification:
    Manufacturer: MSI
    Model: 5218
    Serial Number: ...
    Made in: week 19 of 2019
  Basic Display Parameters & Features:
    Digital display
    Maximum image size: 80 cm x 33 cm
    Gamma: 2.20
    DPMS levels: Off
    RGB color display
    Default (sRGB) color space is primary color space
    First detailed timing is the preferred timing
  Color Characteristics:
    Red  : 0.6494, 0.3378
    Green: 0.3125, 0.6259
    Blue : 0.1494, 0.0517
    White: 0.3125, 0.3281
  Established Timings I & II:
    IBM     :   720x400    70.082 Hz   9:5    31.467 kHz  28.320 MHz
    DMT 0x04:   640x480    59.940 Hz   4:3    31.469 kHz  25.175 MHz
    DMT 0x05:   640x480    72.809 Hz   4:3    37.861 kHz  31.500 MHz
    DMT 0x06:   640x480    75.000 Hz   4:3    37.500 kHz  31.500 MHz
    DMT 0x08:   800x600    56.250 Hz   4:3    35.156 kHz  36.000 MHz
    DMT 0x09:   800x600    60.317 Hz   4:3    37.879 kHz  40.000 MHz
    DMT 0x0a:   800x600    72.188 Hz   4:3    48.077 kHz  50.000 MHz
    DMT 0x0b:   800x600    75.000 Hz   4:3    46.875 kHz  49.500 MHz
    Apple   :   832x624    74.551 Hz   4:3    49.726 kHz  57.284 MHz
    DMT 0x10:  1024x768    60.004 Hz   4:3    48.363 kHz  65.000 MHz
    DMT 0x11:  1024x768    70.069 Hz   4:3    56.476 kHz  75.000 MHz
    DMT 0x12:  1024x768    75.029 Hz   4:3    60.023 kHz  78.750 MHz
    DMT 0x24:  1280x1024   75.025 Hz   5:4    79.976 kHz 135.000 MHz
    Apple   :  1152x870    75.062 Hz 192:145  68.681 kHz 100.000 MHz
  Standard Timings:
    GTF     :  1024x768   100.000 Hz   4:3    81.400 kHz 113.309 MHz
    DMT 0x23:  1280x1024   60.020 Hz   5:4    63.981 kHz 108.000 MHz
    GTF     :  1440x904   100.000 Hz  16:10   95.800 kHz 188.534 MHz
    DMT 0x2f:  1440x900    59.887 Hz  16:10   55.935 kHz 106.500 MHz
    DMT 0x3a:  1680x1050   59.954 Hz  16:10   65.290 kHz 146.250 MHz
    GTF     :  1680x1056  100.000 Hz  16:10  111.900 kHz 257.818 MHz
    DMT 0x52:  1920x1080   60.000 Hz  16:9    67.500 kHz 148.500 MHz
    GTF     :  1920x1080  100.000 Hz  16:9   114.400 kHz 302.016 MHz
  Detailed Timing Descriptors:
    DTD 1:  3440x1440   59.999 Hz  43:18   88.858 kHz 319.890 MHz (797 mm x 333 mm)
                 Hfront   48 Hsync  32 Hback  80 Hpol P
                 Vfront    3 Vsync   5 Vback  33 Vpol N
  Display Range Limits:
    Monitor ranges (GTF): 48-76 Hz V, 30-88 kHz H, max dotclock 40 MHz
    Display Product Name: 'MSI MAG341CQ'
    Display Product Serial Number: ...
Checksum: 0x5a

----------------

Failures:

Block 0, Base EDID:
  Basic Display Parameters & Features: sRGB is signaled, but the chromaticities do not match.
EDID:
  Base EDID: Some timings are out of range of the Monitor Ranges:
    Vertical Freq: 56.250 - 100.000 Hz (Monitor: 48.000 - 76.000 Hz)
    Horizontal Freq: 31.466 - 114.400 kHz (Monitor: 30.000 - 88.000 kHz)
    Maximum Clock: 319.890 MHz (Monitor: 40.000 MHz)

EDID conformity: FAIL
