edid-decode (hex):

00 ff ff ff ff ff ff 00 1c 54 14 27 01 01 01 01
20 21 01 04 b5 3c 22 78 fb 91 e5 a8 54 43 b0 27
0b 50 54 25 4a 00 d1 c0 81 c0 01 01 01 01 01 01
01 01 01 01 01 01 56 5e 00 a0 a0 a0 29 50 30 20
35 00 54 4f 21 00 00 1a 00 00 00 fd 0c 30 f0 87
87 67 01 0a 20 20 20 20 20 20 00 00 00 fc 00 4d
32 37 51 20 58 0a 20 20 20 20 20 20 00 00 00 ff
00 32 33 33 32 30 42 30 30 35 30 30 38 0a 02 71

02 03 30 71 4a 02 03 11 12 13 04 2f 1f 10 3f 23
09 07 07 83 01 00 00 6d 1a 00 00 02 03 30 f0 00
04 62 4c 62 4c e3 05 c3 01 e6 06 0d 01 62 62 4c
b7 8c 80 c8 70 38 64 40 18 10 25 00 54 4f 21 00
00 1a 6f c2 00 a0 a0 a0 55 50 30 20 35 00 54 4f
21 00 00 1a 22 e5 00 50 a0 a0 67 50 08 20 f8 0c
54 4f 21 00 00 1a 00 00 00 00 00 00 00 00 00 00
00 00 00 00 00 00 00 00 00 00 00 00 00 00 00 41

70 12 79 00 00 03 01 3c 45 09 01 04 ff 09 4f 00
2f 00 1f 00 9f 05 76 00 02 00 04 00 5f 38 01 04
ff 09 9f 00 2f 00 1f 00 9f 05 1d 00 02 00 04 00
86 86 01 04 ff 09 a7 00 2f 00 1f 00 9f 05 56 00
02 00 04 00 00 00 00 00 00 00 00 00 00 00 00 00
00 00 00 00 00 00 00 00 00 00 00 00 00 00 00 00
00 00 00 00 00 00 00 00 00 00 00 00 00 00 00 00
00 00 00 00 00 00 00 00 00 00 00 00 00 00 b7 90

00 ff ff ff ff ff ff 00 1c 54 14 27 01 01 01 01
20 21 01 04 b5 3c 22 78 fb 91 e5 a8 54 43 b0 27
0b 50 54 25 4a 00 d1 c0 81 c0 01 01 01 01 01 01
01 01 01 01 01 01 56 5e 00 a0 a0 a0 29 50 30 20
35 00 54 4f 21 00 00 1a 00 00 00 fd 0c 30 f0 87
87 67 01 0a 20 20 20 20 20 20 00 00 00 fc 00 4d
32 37 51 20 58 0a 20 20 20 20 20 20 00 00 00 ff
00 32 33 33 32 30 42 30 30 35 30 30 38 0a 02 71

02 03 30 71 4a 02 03 11 12 13 04 2f 1f 10 3f 23
09 07 07 83 01 00 00 6d 1a 00 00 02 03 30 f0 00
04 62 4c 62 4c e3 05 c3 01 e6 06 0d 01 62 62 4c
b7 8c 80 c8 70 38 64 40 18 10 25 00 54 4f 21 00
00 1a 6f c2 00 a0 a0 a0 55 50 30 20 35 00 54 4f
21 00 00 1a 22 e5 00 50 a0 a0 67 50 08 20 f8 0c
54 4f 21 00 00 1a 00 00 00 00 00 00 00 00 00 00
00 00 00 00 00 00 00 00 00 00 00 00 00 00 00 41

70 12 79 00 00 03 01 3c 45 09 01 04 ff 09 4f 00
2f 00 1f 00 9f 05 76 00 02 00 04 00 5f 38 01 04
ff 09 9f 00 2f 00 1f 00 9f 05 1d 00 02 00 04 00
86 86 01 04 ff 09 a7 00 2f 00 1f 00 9f 05 56 00
02 00 04 00 00 00 00 00 00 00 00 00 00 00 00 00
00 00 00 00 00 00 00 00 00 00 00 00 00 00 00 00
00 00 00 00 00 00 00 00 00 00 00 00 00 00 00 00
00 00 00 00 00 00 00 00 00 00 00 00 00 00 b7 90

----------------

Block 0, Base EDID:
  EDID Structure Version & Revision: 1.4
  Vendor & Product Identification:
    Manufacturer: GBT
    Model: 10004
    Serial Number: ...
    Made in: week 32 of 2023
  Basic Display Parameters & Features:
    Digital display
    Bits per primary color channel: 10
    DisplayPort interface
    Maximum image size: 60 cm x 34 cm
    Gamma: 2.20
    DPMS levels: Standby Suspend Off
    Supported color formats: RGB 4:4:4, YCrCb 4:4:4, YCrCb 4:2:2
    First detailed timing includes the native pixel format and preferred refresh rate
    Display is continuous frequency
  Color Characteristics:
    Red  : 0.6582, 0.3291
    Green: 0.2617, 0.6884
    Blue : 0.1552, 0.0449
    White: 0.3134, 0.3291
  Established Timings I & II:
    DMT 0x04:   640x480    59.940476 Hz   4:3     31.469 kHz     25.175000 MHz
    DMT 0x06:   640x480    75.000000 Hz   4:3     37.500 kHz     31.500000 MHz
    DMT 0x09:   800x600    60.316541 Hz   4:3     37.879 kHz     40.000000 MHz
    DMT 0x0b:   800x600    75.000000 Hz   4:3     46.875 kHz     49.500000 MHz
    DMT 0x10:  1024x768    60.003840 Hz   4:3     48.363 kHz     65.000000 MHz
    DMT 0x12:  1024x768    75.028582 Hz   4:3     60.023 kHz     78.750000 MHz
  Standard Timings:
    DMT 0x52:  1920x1080   60.000000 Hz  16:9     67.500 kHz    148.500000 MHz
    DMT 0x55:  1280x720    60.000000 Hz  16:9     45.000 kHz     74.250000 MHz
  Detailed Timing Descriptors:
    DTD 1:  2560x1440   59.950550 Hz  16:9     88.787 kHz    241.500000 MHz (596 mm x 335 mm)
                 Hfront   48 Hsync  32 Hback   80 Hpol P
                 Vfront    3 Vsync   5 Vback   33 Vpol N
    Display Range Limits:
      Monitor ranges (Bare Limits): 48-240 Hz V, 390-390 kHz H, max dotclock 1030 MHz
    Display Product Name: 'M27Q X'
    Display Product Serial Number: ...
  Extension blocks: 2
Checksum: 0x71

----------------

Block 1, CTA-861 Extension Block:
  Revision: 3
  Basic audio support
  Supports YCbCr 4:4:4
  Supports YCbCr 4:2:2
  Native detailed modes: 1
  Video Data Block:
    VIC   2:   720x480    59.940060 Hz   4:3     31.469 kHz     27.000000 MHz
    VIC   3:   720x480    59.940060 Hz  16:9     31.469 kHz     27.000000 MHz
    VIC  17:   720x576    50.000000 Hz   4:3     31.250 kHz     27.000000 MHz
    VIC  18:   720x576    50.000000 Hz  16:9     31.250 kHz     27.000000 MHz
    VIC  19:  1280x720    50.000000 Hz  16:9     37.500 kHz     74.250000 MHz
    VIC   4:  1280x720    60.000000 Hz  16:9     45.000 kHz     74.250000 MHz
    VIC  47:  1280x720   120.000000 Hz  16:9     90.000 kHz    148.500000 MHz
    VIC  31:  1920x1080   50.000000 Hz  16:9     56.250 kHz    148.500000 MHz
    VIC  16:  1920x1080   60.000000 Hz  16:9     67.500 kHz    148.500000 MHz
    VIC  63:  1920x1080  120.000000 Hz  16:9    135.000 kHz    297.000000 MHz
  Audio Data Block:
    Linear PCM:
      Max channels: 2
      Supported sample rates (kHz): 48 44.1 32
      Supported sample sizes (bits): 24 20 16
  Speaker Allocation Data Block:
    FL/FR - Front Left/Right
  Vendor-Specific Data Block (AMD), OUI 00-00-1A:
    Version: 2.3
    Minimum Refresh Rate: 48 Hz
    Maximum Refresh Rate: 240 Hz
    Flags 1.x: 0x00
    Flags 2.x: 0x04
    Maximum luminance: 98 (417.710 cd/m^2)
    Minimum luminance: 76 (0.371 cd/m^2)
    Maximum luminance (without local dimming): 98 (417.710 cd/m^2)
    Minimum luminance (without local dimming): 76 (0.371 cd/m^2)
  Colorimetry Data Block:
    xvYCC601
    xvYCC709
    BT2020YCC
    BT2020RGB
    Gamut Boundary Description Metadata Profile P0
  HDR Static Metadata Data Block:
    Electro optical transfer functions:
      Traditional gamma - SDR luminance range
      SMPTE ST2084
      Hybrid Log-Gamma
    Supported static metadata descriptors:
      Static metadata type 1
    Desired content max luminance: 98 (417.710 cd/m^2)
    Desired content max frame-average luminance: 98 (417.710 cd/m^2)
    Desired content min luminance: 76 (0.371 cd/m^2)
  Detailed Timing Descriptors:
    DTD 2:  1920x1080  143.999840 Hz  16:9    169.920 kHz    360.230000 MHz (596 mm x 335 mm)
                 Hfront   24 Hsync  16 Hback  160 Hpol P
                 Vfront    2 Vsync   5 Vback   93 Vpol N
    DTD 3:  2560x1440  119.997589 Hz  16:9    182.996 kHz    497.750000 MHz (596 mm x 335 mm)
                 Hfront   48 Hsync  32 Hback   80 Hpol P
                 Vfront    3 Vsync   5 Vback   77 Vpol N
    DTD 4:  2560x1440  143.998311 Hz  16:9    222.189 kHz    586.580000 MHz (596 mm x 335 mm)
                 Hfront    8 Hsync  32 Hback   40 Hpol P
                 Vfront   63 Vsync   8 Vback   32 Vpol N
Checksum: 0x41  Unused space in Extension Block: 25 bytes

----------------

Block 2, DisplayID Extension Block:
  Version: 1.2
  Extension Count: 0
  Display Product Type: Extension Section
  Video Timing Modes Type 1 - Detailed Timings Data Block:
    DTD:  2560x1440  164.999903 Hz  16:9    257.235 kHz    679.100000 MHz (aspect 16:9, no 3D stereo)
               Hfront   48 Hsync  32 Hback    0 Hpol N
               Vfront    3 Vsync   5 Vback  111 Vpol N
    DTD:  2560x1440  200.000000 Hz  16:9    294.000 kHz    799.680000 MHz (aspect 16:9, no 3D stereo)
               Hfront   48 Hsync  32 Hback   80 Hpol N
               Vfront    3 Vsync   5 Vback   22 Vpol N
    DTD:  2560x1440  239.998214 Hz  16:9    366.477 kHz    999.750000 MHz (aspect 16:9, no 3D stereo)
               Hfront   48 Hsync  32 Hback   88 Hpol N
               Vfront    3 Vsync   5 Vback   79 Vpol N
  Checksum: 0xb7
Checksum: 0x90

----------------

Block 3, Unknown EDID Extension Block 0x00:
  00 ff ff ff ff ff ff 00 1c 54 14 27 01 01 01 01 '.........T.'....'
  20 21 01 04 b5 3c 22 78 fb 91 e5 a8 54 43 b0 27 ' !...<"x....TC.''
  0b 50 54 25 4a 00 d1 c0 81 c0 01 01 01 01 01 01 '.PT%J...........'
  01 01 01 01 01 01 56 5e 00 a0 a0 a0 29 50 30 20 '......V^....)P0 '
  35 00 54 4f 21 00 00 1a 00 00 00 fd 0c 30 f0 87 '5.TO!........0..'
  87 67 01 0a 20 20 20 20 20 20 00 00 00 fc 00 4d '.g..      .....M'
  32 37 51 20 58 0a 20 20 20 20 20 20 00 00 00 ff '27Q X.      ....'
  00 32 33 33 32 30 42 30 30 35 30 30 38 0a 02 71 '.23320B005008..q'
Checksum: 0x71

----------------

Block 4, CTA-861 Extension Block:
  Revision: 3
  Basic audio support
  Supports YCbCr 4:4:4
  Supports YCbCr 4:2:2
  Native detailed modes: 1
  Video Data Block:
    VIC   2:   720x480    59.940060 Hz   4:3     31.469 kHz     27.000000 MHz
    VIC   3:   720x480    59.940060 Hz  16:9     31.469 kHz     27.000000 MHz
    VIC  17:   720x576    50.000000 Hz   4:3     31.250 kHz     27.000000 MHz
    VIC  18:   720x576    50.000000 Hz  16:9     31.250 kHz     27.000000 MHz
    VIC  19:  1280x720    50.000000 Hz  16:9     37.500 kHz     74.250000 MHz
    VIC   4:  1280x720    60.000000 Hz  16:9     45.000 kHz     74.250000 MHz
    VIC  47:  1280x720   120.000000 Hz  16:9     90.000 kHz    148.500000 MHz
    VIC  31:  1920x1080   50.000000 Hz  16:9     56.250 kHz    148.500000 MHz
    VIC  16:  1920x1080   60.000000 Hz  16:9     67.500 kHz    148.500000 MHz
    VIC  63:  1920x1080  120.000000 Hz  16:9    135.000 kHz    297.000000 MHz
  Audio Data Block:
    Linear PCM:
      Max channels: 2
      Supported sample rates (kHz): 48 44.1 32
      Supported sample sizes (bits): 24 20 16
  Speaker Allocation Data Block:
    FL/FR - Front Left/Right
  Vendor-Specific Data Block (AMD), OUI 00-00-1A:
    Version: 2.3
    Minimum Refresh Rate: 48 Hz
    Maximum Refresh Rate: 240 Hz
    Flags 1.x: 0x00
    Flags 2.x: 0x04
    Maximum luminance: 98 (417.710 cd/m^2)
    Minimum luminance: 76 (0.371 cd/m^2)
    Maximum luminance (without local dimming): 98 (417.710 cd/m^2)
    Minimum luminance (without local dimming): 76 (0.371 cd/m^2)
  Colorimetry Data Block:
    xvYCC601
    xvYCC709
    BT2020YCC
    BT2020RGB
    Gamut Boundary Description Metadata Profile P0
  HDR Static Metadata Data Block:
    Electro optical transfer functions:
      Traditional gamma - SDR luminance range
      SMPTE ST2084
      Hybrid Log-Gamma
    Supported static metadata descriptors:
      Static metadata type 1
    Desired content max luminance: 98 (417.710 cd/m^2)
    Desired content max frame-average luminance: 98 (417.710 cd/m^2)
    Desired content min luminance: 76 (0.371 cd/m^2)
  Detailed Timing Descriptors:
    DTD 5:  1920x1080  143.999840 Hz  16:9    169.920 kHz    360.230000 MHz (596 mm x 335 mm)
                 Hfront   24 Hsync  16 Hback  160 Hpol P
                 Vfront    2 Vsync   5 Vback   93 Vpol N
    DTD 6:  2560x1440  119.997589 Hz  16:9    182.996 kHz    497.750000 MHz (596 mm x 335 mm)
                 Hfront   48 Hsync  32 Hback   80 Hpol P
                 Vfront    3 Vsync   5 Vback   77 Vpol N
    DTD 7:  2560x1440  143.998311 Hz  16:9    222.189 kHz    586.580000 MHz (596 mm x 335 mm)
                 Hfront    8 Hsync  32 Hback   40 Hpol P
                 Vfront   63 Vsync   8 Vback   32 Vpol N
Checksum: 0x41  Unused space in Extension Block: 25 bytes

----------------

Block 5, DisplayID Extension Block:
  Version: 1.2
  Extension Count: 0
  Video Timing Modes Type 1 - Detailed Timings Data Block:
    DTD:  2560x1440  164.999903 Hz  16:9    257.235 kHz    679.100000 MHz (aspect 16:9, no 3D stereo)
               Hfront   48 Hsync  32 Hback    0 Hpol N
               Vfront    3 Vsync   5 Vback  111 Vpol N
    DTD:  2560x1440  200.000000 Hz  16:9    294.000 kHz    799.680000 MHz (aspect 16:9, no 3D stereo)
               Hfront   48 Hsync  32 Hback   80 Hpol N
               Vfront    3 Vsync   5 Vback   22 Vpol N
    DTD:  2560x1440  239.998214 Hz  16:9    366.477 kHz    999.750000 MHz (aspect 16:9, no 3D stereo)
               Hfront   48 Hsync  32 Hback   88 Hpol N
               Vfront    3 Vsync   5 Vback   79 Vpol N
  Checksum: 0xb7
Checksum: 0x90

----------------

Warnings:

Block 1, CTA-861 Extension Block:
  IT Video Formats are overscanned by default, but normally this should be underscanned.
  Colorimetry Data Block: Set the sRGB colorimetry bit to avoid interop issues.
  Display Product Serial Number is set, so the Serial Number in the Base EDID should be 0.
Block 4, CTA-861 Extension Block:
  IT Video Formats are overscanned by default, but normally this should be underscanned.
  Colorimetry Data Block: Set the sRGB colorimetry bit to avoid interop issues.
  Display Product Serial Number is set, so the Serial Number in the Base EDID should be 0.
EDID:
  Base EDID: Some timings are out of range of the Monitor Ranges:
    Horizontal Freq: 31.250 - 366.477 kHz (Monitor: 390.000 - 390.000 kHz)

Failures:

Block 1, CTA-861 Extension Block:
  Missing VCDB, needed for Set Selectable RGB Quantization to avoid interop issues.
Block 2, DisplayID Extension Block:
  DisplayID Base Block has no product type.
  Expected 0 DisplayID Extension Block, but got 1.
  Video Timing Modes Type 1 - Detailed Timings Data Block: 0 or negative horizontal back porch.
Block 3, Base EDID:
  Unknown Extension Block.
Block 4, CTA-861 Extension Block:
  Video Data Block: Duplicate VIC 2.
  Video Data Block: Duplicate VIC 3.
  Video Data Block: Duplicate VIC 17.
  Video Data Block: Duplicate VIC 18.
  Video Data Block: Duplicate VIC 19.
  Video Data Block: Duplicate VIC 4.
  Video Data Block: Duplicate VIC 47.
  Video Data Block: Duplicate VIC 31.
  Video Data Block: Duplicate VIC 16.
  Video Data Block: Duplicate VIC 63.
  Speaker Allocation Data Block: Only one instance of this Data Block is allowed.
  Colorimetry Data Block: Only one instance of this Data Block is allowed.
  HDR Static Metadata Data Block: Only one instance of this Data Block is allowed.
  Missing VCDB, needed for Set Selectable RGB Quantization to avoid interop issues.
Block 5, DisplayID Extension Block:
  Video Timing Modes Type 1 - Detailed Timings Data Block: 0 or negative horizontal back porch.
EDID:
  Base EDID: EDID specified 2 extension block(s), but found 5 extension block(s).
  DisplayID: Missing DisplayID Product Identification Data Block.
  DisplayID: DisplayID expects at least one preferred timing.

EDID conformity: FAIL
