edid-decode (hex):

00 ff ff ff ff ff ff 00 06 af 24 14 00 00 00 00
01 11 01 03 80 1d 12 78 0a 87 f5 94 57 4f 8c 27
27 50 54 00 00 00 01 01 01 01 01 01 01 01 01 01
01 01 01 01 01 01 ee 1b 00 a8 50 20 17 30 30 20
36 00 22 b4 10 00 00 19 ee 1b 00 a8 50 20 17 30
30 20 36 00 22 b4 10 00 00 00 00 00 00 fe 00 44
57 39 30 39 00 42 31 33 33 45 57 31 00 00 00 fe
00 2a 3a 47 50 72 90 bc eb 01 01 0a 20 20 00 fe

----------------

Block 0, Base EDID:
  EDID Structure Version & Revision: 1.3
  Vendor & Product Identification:
    Manufacturer: AUO
    Model: 5156
    Made in: week 1 of 2007
  Basic Display Parameters & Features:
    Digital display
    Maximum image size: 29 cm x 18 cm
    Gamma: 2.20
    RGB color display
    First detailed timing is preferred timing
  Color Characteristics:
    Red  : 0.5800, 0.3398
    Green: 0.3095, 0.5498
    Blue : 0.1552, 0.1552
    White: 0.3134, 0.3291
  Established Timings I & II: none
  Standard Timings: none
  Detailed Timing Descriptors:
    DTD 1:  1280x800    59.998 Hz   8:5    49.378 kHz  71.500 MHz (DE timing only, 290 mm x 180 mm)
                 Hfront   48 Hsync  32 Hback  88 Hpol N
                 Vfront    3 Vsync   6 Vback  14 Vpol N
    DTD 2:  1280x800    59.998 Hz   8:5    49.378 kHz  71.500 MHz (DE timing only, 290 mm x 180 mm)
                 Hfront   48 Hsync  32 Hback  88 Hpol N
                 Vfront    3 Vsync   6 Vback  14 Vpol N
    SPWG Module Revision: 0
    SPWG Descriptor #3:
      SPWG PC Maker P/N: 'DW909'
      SPWG LCD Supplier EEDID Revision: 0
      SPWG Manufacturer P/N: 'B133EW1'
    SPWG Descriptor #4:
      SMBUS Values: 0x2a 0x3a 0x47 0x50 0x72 0x90 0xbc 0xeb
      LVDS Channels: 1
      Panel Self Test Present
Checksum: 0xfe

----------------

Failures:

Block 0, Base EDID:
  Missing Display Product Name.
  Missing Display Range Limits Descriptor.

EDID conformity: FAIL
