edid-decode (hex):

00 ff ff ff ff ff ff 00 06 af 24 14 00 00 00 00
01 12 01 03 90 1d 12 78 0a 87 f5 94 57 4f 8c 27
27 50 54 00 00 00 01 01 01 01 01 01 01 01 01 01
01 01 01 01 01 01 62 1b 00 8b 50 20 17 30 30 20
36 00 22 b4 10 00 00 1a 62 1b 00 8b 50 20 17 30
30 20 36 00 22 b4 10 00 00 1a 00 00 00 fe 00 4d
54 36 37 39 80 42 31 33 33 45 57 31 00 00 00 00
00 00 00 00 00 00 00 00 00 01 01 0a 20 20 00 3c

----------------

Block 0, Base EDID:
  EDID Structure Version & Revision: 1.3
  Vendor & Product Identification:
    Manufacturer: AUO
    Model: 5156
    Made in: week 1 of 2008
  Basic Display Parameters & Features:
    Digital display
    Maximum image size: 29 cm x 18 cm
    Gamma: 2.20
    RGB color display
    First detailed timing is the preferred timing
  Color Characteristics:
    Red  : 0.5800, 0.3398
    Green: 0.3095, 0.5498
    Blue : 0.1552, 0.1552
    White: 0.3134, 0.3291
  Established Timings I & II: none
  Standard Timings: none
  Detailed Timing Descriptors:
    DTD 1:  1280x800    60.025500 Hz  16:10    49.401 kHz     70.100000 MHz (290 mm x 180 mm)
                 Hfront   48 Hsync  32 Hback   59 Hpol P
                 Vfront    3 Vsync   6 Vback   14 Vpol N
    DTD 2:  1280x800    60.025500 Hz  16:10    49.401 kHz     70.100000 MHz (290 mm x 180 mm)
                 Hfront   48 Hsync  32 Hback   59 Hpol P
                 Vfront    3 Vsync   6 Vback   14 Vpol N
    Alphanumeric Data String: 'MT679'
    Manufacturer-Specified Display Descriptor (0x00): 00 00 00 00 00 00 00 00 00 00 00 01 01 0a 20 20 '..............  '
Checksum: 0x3c

----------------

Failures:

Block 0, Base EDID:
  Basic Display Parameters & Features: Digital Video Interface Standard set to reserved value 0x10.
  Alphanumeric Data String: Non-printable character.
  Missing Display Product Name.
  Missing Display Range Limits Descriptor.

EDID conformity: FAIL
