edid-decode (hex):

00 ff ff ff ff ff ff 00 1e 6d 29 57 23 04 07 00
01 14 01 03 80 35 1e 78 0a 3f 35 a2 59 55 9b 25
0e 50 54 21 08 00 b3 00 81 80 81 40 71 40 01 01
01 01 01 01 01 01 1a 36 80 a0 70 38 1f 40 30 20
35 00 13 2b 21 00 00 1a 02 3a 80 18 71 38 2d 40
58 2c 45 00 13 2b 21 00 00 1e 00 00 00 fd 00 30
3d 1c 53 0f 00 0a 20 20 20 20 20 20 00 00 00 fc
00 57 32 34 38 36 0a 20 20 20 20 20 20 20 01 69

----------------

Block 0, Base EDID:
  EDID Structure Version & Revision: 1.3
  Vendor & Product Identification:
    Manufacturer: GSM
    Model: 22313
    Serial Number: ...
    Made in: week 1 of 2010
  Basic Display Parameters & Features:
    Digital display
    Maximum image size: 53 cm x 30 cm
    Gamma: 2.20
    RGB color display
    First detailed timing is the preferred timing
  Color Characteristics:
    Red  : 0.6328, 0.3505
    Green: 0.3349, 0.6083
    Blue : 0.1445, 0.0576
    White: 0.3134, 0.3291
  Established Timings I & II:
    DMT 0x04:   640x480    59.940 Hz   4:3    31.469 kHz  25.175 MHz
    DMT 0x09:   800x600    60.317 Hz   4:3    37.879 kHz  40.000 MHz
    DMT 0x10:  1024x768    60.004 Hz   4:3    48.363 kHz  65.000 MHz
  Standard Timings:
    DMT 0x3a:  1680x1050   59.954 Hz  16:10   65.290 kHz 146.250 MHz
    DMT 0x23:  1280x1024   60.020 Hz   5:4    63.981 kHz 108.000 MHz
    DMT 0x20:  1280x960    60.000 Hz   4:3    60.000 kHz 108.000 MHz
    GTF     :  1152x864    60.000 Hz   4:3    53.700 kHz  81.624 MHz
  Detailed Timing Descriptors:
    DTD 1:  1920x1080   59.934 Hz  16:9    66.587 kHz 138.500 MHz (531 mm x 299 mm)
                 Hfront   48 Hsync  32 Hback  80 Hpol P
                 Vfront    3 Vsync   5 Vback  23 Vpol N
    DTD 2:  1920x1080   60.000 Hz  16:9    67.500 kHz 148.500 MHz (531 mm x 299 mm)
                 Hfront   88 Hsync  44 Hback 148 Hpol P
                 Vfront    4 Vsync   5 Vback  36 Vpol P
  Display Range Limits:
    Monitor ranges (GTF): 48-61 Hz V, 28-83 kHz H, max dotclock 150 MHz
    Display Product Name: 'W2486'
  Extension blocks: 1
Checksum: 0x69

----------------

Failures:

Block 0, Base EDID:
  Base EDID: EDID specified 1 extension block(s), but found 0 extension block(s).

EDID conformity: FAIL
