edid-decode (hex):

00 ff ff ff ff ff ff 00 10 ac 77 40 4d 30 34 41
13 17 01 03 80 33 1d 78 ea b9 65 a2 59 4f a1 26
0d 50 54 a5 4b 00 71 4f 81 80 d1 c0 01 01 01 01
01 01 01 01 01 01 02 3a 80 18 71 38 2d 40 58 2c
45 00 fe 1f 11 00 00 1e 00 00 00 ff 00 47 46 58
4e 34 33 35 36 41 34 30 4d 0a 00 00 00 fc 00 44
45 4c 4c 20 50 32 33 31 32 48 0a 20 00 00 00 fd
00 38 4c 1e 53 11 00 0a 20 20 20 20 20 20 00 82

00 ff ff ff ff ff ff 00 10 ac 77 40 4d 30 34 41
13 17 01 03 80 33 1d 78 ea b9 65 a2 59 4f a1 26
0d 50 54 a5 4b 00 71 4f 81 80 d1 c0 01 01 01 01
01 01 01 01 01 01 02 3a 80 18 71 38 2d 40 58 2c
45 00 fe 1f 11 00 00 1e 00 00 00 ff 00 47 46 58
4e 34 33 35 36 41 34 30 4d 0a 00 00 00 fc 00 44
45 4c 4c 20 50 32 33 31 32 48 0a 20 00 00 00 fd
00 38 4c 1e 53 11 00 0a 20 20 20 20 20 20 00 82

----------------

Block 0, Base EDID:
  EDID Structure Version & Revision: 1.3
  Vendor & Product Identification:
    Manufacturer: DEL
    Model: 16503
    Serial Number: ...
    Made in: week 19 of 2013
  Basic Display Parameters & Features:
    Digital display
    Maximum image size: 51 cm x 29 cm
    Gamma: 2.20
    DPMS levels: Standby Suspend Off
    RGB color display
    First detailed timing is the preferred timing
  Color Characteristics:
    Red  : 0.6347, 0.3505
    Green: 0.3105, 0.6298
    Blue : 0.1494, 0.0527
    White: 0.3134, 0.3291
  Established Timings I & II:
    IBM     :   720x400    70.081663 Hz   9:5     31.467 kHz     28.320000 MHz
    DMT 0x04:   640x480    59.940476 Hz   4:3     31.469 kHz     25.175000 MHz
    DMT 0x06:   640x480    75.000000 Hz   4:3     37.500 kHz     31.500000 MHz
    DMT 0x09:   800x600    60.316541 Hz   4:3     37.879 kHz     40.000000 MHz
    DMT 0x0b:   800x600    75.000000 Hz   4:3     46.875 kHz     49.500000 MHz
    DMT 0x10:  1024x768    60.003840 Hz   4:3     48.363 kHz     65.000000 MHz
    DMT 0x12:  1024x768    75.028582 Hz   4:3     60.023 kHz     78.750000 MHz
    DMT 0x24:  1280x1024   75.024675 Hz   5:4     79.976 kHz    135.000000 MHz
  Standard Timings:
    DMT 0x15:  1152x864    75.000000 Hz   4:3     67.500 kHz    108.000000 MHz
    DMT 0x23:  1280x1024   60.019740 Hz   5:4     63.981 kHz    108.000000 MHz
    DMT 0x52:  1920x1080   60.000000 Hz  16:9     67.500 kHz    148.500000 MHz
  Detailed Timing Descriptors:
    DTD 1:  1920x1080   60.000000 Hz  16:9     67.500 kHz    148.500000 MHz (510 mm x 287 mm)
                 Hfront   88 Hsync  44 Hback  148 Hpol P
                 Vfront    4 Vsync   5 Vback   36 Vpol P
    Display Product Serial Number: ...
    Display Product Name: 'DELL P2312H'
    Display Range Limits:
      Monitor ranges (GTF): 56-76 Hz V, 30-83 kHz H, max dotclock 170 MHz
Checksum: 0x82

----------------

Block 1, Unknown EDID Extension Block 0x00:
  00 ff ff ff ff ff ff 00 10 ac 77 40 4d 30 34 41 '..........w@M04A'
  13 17 01 03 80 33 1d 78 ea b9 65 a2 59 4f a1 26 '.....3.x..e.YO.&'
  0d 50 54 a5 4b 00 71 4f 81 80 d1 c0 01 01 01 01 '.PT.K.qO........'
  01 01 01 01 01 01 02 3a 80 18 71 38 2d 40 58 2c '.......:..q8-@X,'
  45 00 fe 1f 11 00 00 1e 00 00 00 ff 00 47 46 58 'E............GFX'
  4e 34 33 35 36 41 34 30 4d 0a 00 00 00 fc 00 44 'N4356A40M......D'
  45 4c 4c 20 50 32 33 31 32 48 0a 20 00 00 00 fd 'ELL P2312H. ....'
  00 38 4c 1e 53 11 00 0a 20 20 20 20 20 20 00 82 '.8L.S...      ..'
Checksum: 0x82

----------------

Failures:

Block 1, Base EDID:
  Unknown Extension Block.
EDID:
  Base EDID: EDID specified 0 extension block(s), but found 1 extension block(s).

EDID conformity: FAIL
