
EDID (hex):
00ffffffffffff0022f0562801010101
1d15010368221b8ceef7c5a3554c9b25
125054a1080081408180010101010101
010101010101302a009851002a403070
1300540e1100001e000000fd00324c18
530e000a202020202020000000fc004c
45313731310a202020202020000000ff
0033435131323942434a380a202000ad

Extracted contents:
header:          00 ff ff ff ff ff ff 00
serial number:   22 f0 56 28 01 01 01 01 1d 15
version:         01 03
basic params:    68 22 1b 8c ee
chroma info:     f7 c5 a3 55 4c 9b 25 12 50 54
established:     a1 08 00
standard:        81 40 81 80 01 01 01 01 01 01 01 01 01 01 01 01
descriptor 1:    30 2a 00 98 51 00 2a 40 30 70 13 00 54 0e 11 00 00 1e
descriptor 2:    00 00 00 fd 00 32 4c 18 53 0e 00 0a 20 20 20 20 20 20
descriptor 3:    00 00 00 fc 00 4c 45 31 37 31 31 0a 20 20 20 20 20 20
descriptor 4:    00 00 00 ff 00 33 43 51 31 32 39 42 43 4a 38 0a 20 20
extensions:      00
checksum:        ad

EDID version: 1.3
Manufacturer: HWP Model 2856 Serial Number --
Made in week 29 of 2011
Analog display, Input voltage level: 0.7/0.7 V
Sync: Separate 
Maximum image size: 34 cm x 27 cm
Gamma: 2.40
DPMS levels: Standby Suspend Off
RGB color display
Default (sRGB) color space is primary color space
First detailed timing is preferred timing
Display x,y Chromaticity:
  Red:   0.6396, 0.3349
  Green: 0.2978, 0.6083
  Blue:  0.1474, 0.0703
  White: 0.3134, 0.3291
Established timings supported:
  720x400@70Hz 9:5 HorFreq: 31469 Hz Clock: 28.320 MHz
  640x480@60Hz 4:3 HorFreq: 31469 Hz Clock: 25.175 MHz
  800x600@60Hz 4:3 HorFreq: 37900 Hz Clock: 40.000 MHz
  1024x768@60Hz 4:3 HorFreq: 48400 Hz Clock: 65.000 MHz
Standard timings supported:
  1280x960@60Hz 4:3 HorFreq: 60000 Hz Clock: 108.000 MHz
  1280x1024@60Hz 5:4 HorFreq: 64000 Hz Clock: 108.000 MHz
Detailed mode: Clock 108.000 MHz, 340 mm x 270 mm
               1280 1328 1440 1688 hborder 0
               1024 1025 1028 1066 vborder 0
               +hsync +vsync 
               VertFreq: 60 Hz, HorFreq: 63981 Hz
Monitor ranges (GTF): 50-76Hz V, 24-83kHz H, max dotclock 140MHz
Monitor name: LE1711
Serial number: --
Checksum: 0xad (valid)
EDID block does NOT conform to EDID 1.3!
	sRGB is signaled, but the chromaticities do not match
