
EDID (hex):
00ffffffffffff0022f0142901010101
1414010368301b78ee1425a359559b26
0f5054a1080081c0814081809500a940
b30001010101023a801871382d40582c
4500dd0c1100001e000000fd00324b18
5311000a202020202020000000ff0043
4e433032303037524d0a2020000000fc
004850207832324c45440a2020200080

Extracted contents:
header:          00 ff ff ff ff ff ff 00
serial number:   22 f0 14 29 01 01 01 01 14 14
version:         01 03
basic params:    68 30 1b 78 ee
chroma info:     14 25 a3 59 55 9b 26 0f 50 54
established:     a1 08 00
standard:        81 c0 81 40 81 80 95 00 a9 40 b3 00 01 01 01 01
descriptor 1:    02 3a 80 18 71 38 2d 40 58 2c 45 00 dd 0c 11 00 00 1e
descriptor 2:    00 00 00 fd 00 32 4b 18 53 11 00 0a 20 20 20 20 20 20
descriptor 3:    00 00 00 ff 00 43 4e 43 30 32 30 30 37 52 4d 0a 20 20
descriptor 4:    00 00 00 fc 00 48 50 20 78 32 32 4c 45 44 0a 20 20 20
extensions:      00
checksum:        80

EDID version: 1.3
Manufacturer: HWP Model 2914 Serial Number --
Made in week 20 of 2010
Analog display, Input voltage level: 0.7/0.7 V
Sync: Separate 
Maximum image size: 48 cm x 27 cm
Gamma: 2.20
DPMS levels: Standby Suspend Off
RGB color display
Default (sRGB) color space is primary color space
First detailed timing is preferred timing
Display x,y Chromaticity:
  Red:   0.6367, 0.3486
  Green: 0.3330, 0.6054
  Blue:  0.1484, 0.0605
  White: 0.3134, 0.3291
Established timings supported:
  720x400@70Hz 9:5 HorFreq: 31469 Hz Clock: 28.320 MHz
  640x480@60Hz 4:3 HorFreq: 31469 Hz Clock: 25.175 MHz
  800x600@60Hz 4:3 HorFreq: 37900 Hz Clock: 40.000 MHz
  1024x768@60Hz 4:3 HorFreq: 48400 Hz Clock: 65.000 MHz
Standard timings supported:
  1280x720@60Hz 16:9
  1280x960@60Hz 4:3 HorFreq: 60000 Hz Clock: 108.000 MHz
  1280x1024@60Hz 5:4 HorFreq: 64000 Hz Clock: 108.000 MHz
  1440x900@60Hz 16:10 HorFreq: 55500 Hz Clock: 88.750 MHz
  1600x1200@60Hz 4:3 HorFreq: 75000 Hz Clock: 162.000 MHz
  1680x1050@60Hz 16:10 HorFreq: 64700 Hz Clock: 119.000 MHz
Detailed mode: Clock 148.500 MHz, 477 mm x 268 mm
               1920 2008 2052 2200 hborder 0
               1080 1084 1089 1125 vborder 0
               +hsync +vsync 
               VertFreq: 60 Hz, HorFreq: 67500 Hz
Monitor ranges (GTF): 50-75Hz V, 24-83kHz H, max dotclock 170MHz
Serial number: --
Monitor name: HP x22LED
Checksum: 0x80 (valid)
EDID block does NOT conform to EDID 1.3!
	sRGB is signaled, but the chromaticities do not match


