edid-decode (hex):

00 ff ff ff ff ff ff 00 4d d9 fa 05 00 00 00 00
2d 0c 01 04 90 1d 11 00 ea a8 e0 99 57 4b 92 25
1c 50 54 00 00 00 01 01 01 01 01 01 01 01 01 01
01 01 01 01 01 01 87 1d 56 da 50 00 1c 30 0c 30
3a 00 22 aa 10 00 00 18 8f 18 56 c2 50 00 26 30
0c 30 3a 00 22 aa 10 00 00 18 00 00 00 fc 00 4e
76 69 64 69 61 20 44 65 66 61 75 6c 00 00 00 fd
00 00 3d 1d 2f 08 00 00 20 20 20 20 20 00 00 12

----------------

Block 0, Base EDID:
  EDID Structure Version & Revision: 1.4
  Vendor & Product Identification:
    Manufacturer: SNY
    Model: 1530
    Made in: week 45 of 2002
  Basic Display Parameters & Features:
    Digital display
    Bits per primary color channel: 6
    Digital interface is not defined
    Maximum image size: 29 cm x 17 cm
    Gamma: 1.00
    DPMS levels: Standby Suspend Off
    Supported color formats: RGB 4:4:4, YCrCb 4:4:4
    First detailed timing includes the native pixel format and preferred refresh rate
  Color Characteristics:
    Red  : 0.5996, 0.3417
    Green: 0.2949, 0.5703
    Blue : 0.1474, 0.1113
    White: 0.3125, 0.3281
  Established Timings I & II: none
  Standard Timings: none
  Detailed Timing Descriptors:
    DTD 1:  1366x768    59.950954 Hz 683:384   47.721 kHz     75.590000 MHz (290 mm x 170 mm)
                 Hfront   12 Hsync  48 Hback  158 Hpol N
                 Vfront    3 Vsync  10 Vback   15 Vpol N
    DTD 2:  1366x768    50.001591 Hz 683:384   40.301 kHz     62.870000 MHz (290 mm x 170 mm)
                 Hfront   12 Hsync  48 Hback  134 Hpol N
                 Vfront    3 Vsync  10 Vback   25 Vpol N
    Display Product Name: 'Nvidia Defaul'
    Display Range Limits:
      Monitor ranges (GTF): 0-61 Hz V, 29-47 kHz H, max dotclock 80 MHz
Checksum: 0x12

----------------

Warnings:

Block 0, Base EDID:
  Display Range Limits: GTF support is deprecated in EDID 1.4.
EDID:
  Base EDID: Some timings are out of range of the Monitor Ranges:
    Horizontal Freq: 40.301 - 47.720 kHz (Monitor: 29.000 - 47.000 kHz)
    Could be due to a Monitor Range off-by-one rounding issue

Failures:

Block 0, Base EDID:
  Display Range Limits: GTF can't be combined with non-continuous frequencies.
  Display Range Limits: Byte 11 is 0x00 instead of 0x0a.
  Display Range Limits: Bytes 12-17 must be 0x20.

EDID conformity: FAIL
