edid-decode (hex):

00 ff ff ff ff ff ff 00 4d d9 fa 05 00 00 00 00
2d 0c 01 04 90 1f 11 00 ea a8 e0 99 57 4b 92 25
1c 50 54 00 00 00 01 01 01 01 01 01 01 01 01 01
01 01 01 01 01 01 20 1c 56 5a 50 00 39 30 1e 1e
33 00 35 ae 10 00 00 18 00 00 00 fc 00 4e 76 69
64 69 61 20 44 65 66 61 75 6c 00 00 00 fc 00 74
20 46 6c 61 74 20 50 61 6e 65 6c 00 00 00 00 fd
00 00 3d 1d 32 08 00 00 20 20 20 20 20 00 00 70

----------------

Block 0, Base EDID:
  EDID Structure Version & Revision: 1.4
  Vendor & Product Identification:
    Manufacturer: SNY
    Model: 1530
    Made in: week 45 of 2002
  Basic Display Parameters & Features:
    Digital display
    Bits per primary color channel: 6
    Digital interface is not defined
    Maximum image size: 31 cm x 17 cm
    Gamma: 1.00
    DPMS levels: Standby Suspend Off
    Supported color formats: RGB 4:4:4, YCrCb 4:4:4
    First detailed timing includes the native pixel format and preferred refresh rate
  Color Characteristics:
    Red  : 0.5996, 0.3417
    Green: 0.2949, 0.5703
    Blue : 0.1474, 0.1113
    White: 0.3125, 0.3281
  Established Timings I & II: none
  Standard Timings: none
  Detailed Timing Descriptors:
    DTD 1:  1366x768    59.940 Hz 683:384  49.451 kHz  72.000 MHz (309 mm x 174 mm)
                 Hfront   30 Hsync  30 Hback  30 Hpol N
                 Vfront    3 Vsync   3 Vback  51 Vpol N
    Display Product Name: 'Nvidia Defaul'
    Display Product Name: 't Flat Panel'
  Display Range Limits:
    Monitor ranges (GTF): 0-61 Hz V, 29-50 kHz H, max dotclock 80 MHz
Checksum: 0x70

----------------

Failures:

Block 0, Base EDID:
  Display Product Name: Non-printable character.
  Display Range Limits: GTF can't be combined with non-continuous frequencies.
  Display Range Limits: Byte 11 is 0x00 instead of 0x0a.
  Display Range Limits: Bytes 12-17 must be 0x20.

EDID conformity: FAIL
