edid-decode (hex):

00 ff ff ff ff ff ff 00 4d d9 fa 05 00 00 00 00
04 13 01 03 80 1f 11 78 f2 ce 50 a3 57 4c 99 26
0f 50 54 00 00 00 01 01 01 01 01 01 01 01 01 01
01 01 01 01 01 01 20 1c 56 ae 50 00 0c 30 1d 3a
24 00 36 aa 10 00 00 00 8e 17 56 a0 50 00 16 30
1a 35 37 00 36 aa 10 00 00 00 00 00 00 00 00 00
00 00 00 00 00 00 00 00 00 00 00 00 00 00 00 00
00 00 00 00 00 00 00 00 00 00 00 00 00 00 00 e8

----------------

Block 0, Base EDID:
  EDID Structure Version & Revision: 1.3
  Vendor & Product Identification:
    Manufacturer: SNY
    Model: 1530
    Made in: week 4 of 2009
  Basic Display Parameters & Features:
    Digital display
    Maximum image size: 31 cm x 17 cm
    Gamma: 2.20
    DPMS levels: Standby Suspend Off
    Non-RGB color display
    First detailed timing is preferred timing
  Color Characteristics:
    Red  : 0.6396, 0.3398
    Green: 0.2998, 0.5996
    Blue : 0.1494, 0.0595
    White: 0.3125, 0.3281
  Established Timings I & II: none
  Standard Timings: none
  Detailed Timing Descriptors:
    DTD 1:  1366x768    59.940 Hz 683:384  46.753 kHz  72.000 MHz (analog composite, sync-on-green, 310 mm x 170 mm)
                 Hfront   29 Hsync  58 Hback  87 Hpol N
                 Vfront    2 Vsync   4 Vback   6 Vpol N
    DTD 2:  1366x768    50.019 Hz 683:384  39.515 kHz  60.300 MHz (analog composite, sync-on-green, 310 mm x 170 mm)
                 Hfront   26 Hsync  53 Hback  81 Hpol N
                 Vfront    3 Vsync   7 Vback  12 Vpol N
    Empty Descriptor
    Empty Descriptor
Checksum: 0xe8

----------------

Failures:

Block 0, Base EDID:
  Empty Descriptor: Use Dummy Descriptor instead of all zeroes.
  Empty Descriptor: Use Dummy Descriptor instead of all zeroes.
  Missing Display Product Name.
  Missing Display Range Limits Descriptor.

EDID conformity: FAIL
