
EDID (hex):
00ffffffffffff0005010100dcf03301
311c010381150d78ae00000000000000
00000000000001010101010101010101
0101010101012c1a00a0502026303a1e
1604d88700000018000000fd002d411e
3708000a202020202020000000ff0031
0a202020202020202020202000000010
00000000000000000000000000000004

edid-decode (hex):

00 ff ff ff ff ff ff 00 05 01 01 00 dc f0 33 01
31 1c 01 03 81 15 0d 78 ae 00 00 00 00 00 00 00
00 00 00 00 00 00 01 01 01 01 01 01 01 01 01 01
01 01 01 01 01 01 2c 1a 00 a0 50 20 26 30 3a 1e
16 04 d8 87 00 00 00 18 00 00 00 fd 00 2d 41 1e
37 08 00 0a 20 20 20 20 20 20 00 00 00 ff 00 31
0a 20 20 20 20 20 20 20 20 20 20 20 00 00 00 10
00 00 00 00 00 00 00 00 00 00 00 00 00 00 00 04

----------------

Block 0, Base EDID:
  EDID Structure Version & Revision: 1.3
  Vendor & Product Identification:
    Manufacturer: AHA
    Model: 1
    Serial Number: 20181212
    Made in: week 49 of 2018
  Basic Display Parameters & Features:
    Digital display
    DFP 1.x compatible TMDS
    Maximum image size: 21 cm x 13 cm
    Gamma: 2.20
    DPMS levels: Standby Off
    RGB color display
    Default (sRGB) color space is primary color space
    First detailed timing is the preferred timing
  Color Characteristics:
    Red  : 0.0000, 0.0000
    Green: 0.0000, 0.0000
    Blue : 0.0000, 0.0000
    White: 0.0000, 0.0000
  Established Timings I & II: none
  Standard Timings: none
  Detailed Timing Descriptors:
    DTD 1:  1280x800    55.522408 Hz  16:10    46.528 kHz     67.000000 MHz (216 mm x 135 mm)
                 Hfront   58 Hsync  30 Hback   72 Hpol N
                 Vfront   17 Vsync   6 Vback   15 Vpol N
    Display Range Limits:
      Monitor ranges (GTF): 45-65 Hz V, 30-55 kHz H, max dotclock 80 MHz
    Display Product Serial Number: '1'
    Dummy Descriptor:
Checksum: 0x04
