
EDID (hex):
00ffffffffffff0006af3d2000000000
00190104951f117802c32592575a942a
22505400000001010101010101010101
010101010101843a8034713828403064
310035ad10000018d41756e250001e30
2616360035ad10000018000000fe0041
554f0a202020202020202020000000fe
004231343048415430322e30200a00a0

Extracted contents:
header:          00 ff ff ff ff ff ff 00
serial number:   06 af 3d 20 00 00 00 00 00 19
version:         01 04
basic params:    95 1f 11 78 02
chroma info:     c3 25 92 57 5a 94 2a 22 50 54
established:     00 00 00
standard:        01 01 01 01 01 01 01 01 01 01 01 01 01 01 01 01
descriptor 1:    84 3a 80 34 71 38 28 40 30 64 31 00 35 ad 10 00 00 18
descriptor 2:    d4 17 56 e2 50 00 1e 30 26 16 36 00 35 ad 10 00 00 18
descriptor 3:    00 00 00 fe 00 41 55 4f 0a 20 20 20 20 20 20 20 20 20
descriptor 4:    00 00 00 fe 00 42 31 34 30 48 41 54 30 32 2e 30 20 0a
extensions:      00
checksum:        a0

EDID version: 1.4
Manufacturer: AUO Model 203d Serial Number --
Made in year 2015
Digital display
6 bits per primary color channel
DisplayPort interface
Maximum image size: 31 cm x 17 cm
Gamma: 2.20
Supported color formats: RGB 4:4:4
First detailed timing includes the native pixel format and preferred refresh rate
Display x,y Chromaticity:
  Red:   0.5732, 0.3398
  Green: 0.3515, 0.5810
  Blue:  0.1640, 0.1347
  White: 0.3134, 0.3291
Established timings supported:
Standard timings supported:
Detailed mode: Clock 149.800 MHz, 309 mm x 173 mm
               1920 1968 2068 2228 hborder 0
               1080 1083 1084 1120 vborder 0
               -hsync -vsync 
               VertFreq: 60 Hz, HorFreq: 67235 Hz
Detailed mode: Clock 61.000 MHz, 309 mm x 173 mm
               1366 1404 1426 1592 hborder 0
                768  771  777  798 vborder 0
               -hsync -vsync 
               VertFreq: 48 Hz, HorFreq: 38316 Hz
ASCII string: AUO
ASCII string: B140HAT02.0 
Checksum: 0xa0 (valid)
EDID block does NOT conform to EDID 1.4!
	Missing name descriptor
	Missing monitor ranges


