
EDID (hex):
00ffffffffffff00410cadc0182c0000
2f1601036e331d782a6e95a3544f9f26
115054bd4b00d1c08180950f9500b300
81c001010101023a801871382d40582c
4500fd1e1100001e000000ff00554842
31323437303131323838000000fc0032
333745340a20202020202020000000fd
00384c1e5311000a202020202020002c

Extracted contents:
header:          00 ff ff ff ff ff ff 00
serial number:   41 0c ad c0 18 2c 00 00 2f 16
version:         01 03
basic params:    6e 33 1d 78 2a
chroma info:     6e 95 a3 54 4f 9f 26 11 50 54
established:     bd 4b 00
standard:        d1 c0 81 80 95 0f 95 00 b3 00 81 c0 01 01 01 01
descriptor 1:    02 3a 80 18 71 38 2d 40 58 2c 45 00 fd 1e 11 00 00 1e
descriptor 2:    00 00 00 ff 00 55 48 42 31 32 34 37 30 31 31 32 38 38
descriptor 3:    00 00 00 fc 00 32 33 37 45 34 0a 20 20 20 20 20 20 20
descriptor 4:    00 00 00 fd 00 38 4c 1e 53 11 00 0a 20 20 20 20 20 20
extensions:      00
checksum:        2c

EDID version: 1.3
Manufacturer: PHL Model c0ad Serial Number --
Made in week 47 of 2012
Analog display, Input voltage level: 0.7/0.7 V
Sync: Separate Composite SyncOnGreen 
Maximum image size: 51 cm x 29 cm
Gamma: 2.20
DPMS levels: Off
RGB color display
First detailed timing is preferred timing
Display x,y Chromaticity:
  Red:   0.6376, 0.3300
  Green: 0.3115, 0.6230
  Blue:  0.1503, 0.0673
  White: 0.3134, 0.3291
Established timings supported:
  720x400@70Hz 9:5 HorFreq: 31469 Hz Clock: 28.320 MHz
  640x480@60Hz 4:3 HorFreq: 31469 Hz Clock: 25.175 MHz
  640x480@67Hz 4:3 HorFreq: 35000 Hz Clock: 30.240 MHz
  640x480@72Hz 4:3 HorFreq: 37900 Hz Clock: 31.500 MHz
  640x480@75Hz 4:3 HorFreq: 37500 Hz Clock: 31.500 MHz
  800x600@60Hz 4:3 HorFreq: 37900 Hz Clock: 40.000 MHz
  800x600@75Hz 4:3 HorFreq: 46900 Hz Clock: 49.500 MHz
  1024x768@60Hz 4:3 HorFreq: 48400 Hz Clock: 65.000 MHz
  1024x768@75Hz 4:3 HorFreq: 60000 Hz Clock: 78.750 MHz
  1280x1024@75Hz 5:4 HorFreq: 80000 Hz Clock: 135.000 MHz
Standard timings supported:
  1920x1080@60Hz 16:9
  1280x1024@60Hz 5:4 HorFreq: 64000 Hz Clock: 108.000 MHz
  1440x900@75Hz 16:10 HorFreq: 82300 Hz Clock: 156.000 MHz
  1440x900@60Hz 16:10 HorFreq: 55500 Hz Clock: 88.750 MHz
  1680x1050@60Hz 16:10 HorFreq: 64700 Hz Clock: 119.000 MHz
  1280x720@60Hz 16:9
Detailed mode: Clock 148.500 MHz, 509 mm x 286 mm
               1920 2008 2052 2200 hborder 0
               1080 1084 1089 1125 vborder 0
               +hsync +vsync 
               VertFreq: 60 Hz, HorFreq: 67500 Hz
Serial number: --
Monitor name: 237E4
Monitor ranges (GTF): 56-76Hz V, 30-83kHz H, max dotclock 170MHz
Checksum: 0x2c (valid)
