
EDID (hex):
00ffffffffffff001e6d5643f1130100
020d010380221b78ea241fa15a499925
1a4c55a56a80314f454f614f81800101
010101010101302a009851002a403070
1300671f1100001e000000fd00384b1e
470b000a202020202020000000fc004c
3137313042200a2020202020000000fc
00200a202020202020202020202000dd

Extracted contents:
header:          00 ff ff ff ff ff ff 00
serial number:   1e 6d 56 43 f1 13 01 00 02 0d
version:         01 03
basic params:    80 22 1b 78 ea
chroma info:     24 1f a1 5a 49 99 25 1a 4c 55
established:     a5 6a 80
standard:        31 4f 45 4f 61 4f 81 80 01 01 01 01 01 01 01 01
descriptor 1:    30 2a 00 98 51 00 2a 40 30 70 13 00 67 1f 11 00 00 1e
descriptor 2:    00 00 00 fd 00 38 4b 1e 47 0b 00 0a 20 20 20 20 20 20
descriptor 3:    00 00 00 fc 00 4c 31 37 31 30 42 20 0a 20 20 20 20 20
descriptor 4:    00 00 00 fc 00 20 0a 20 20 20 20 20 20 20 20 20 20 20
extensions:      00
checksum:        dd

EDID version: 1.3
Manufacturer: GSM Model 4356 Serial Number --
Digital display
Maximum image size: 34 cm x 27 cm
Gamma: 2.20
DPMS levels: Standby Suspend Off
RGB color display
First detailed timing is preferred timing
Display x,y Chromaticity:
  Red:   0.6289, 0.3535
  Green: 0.2861, 0.5976
  Blue:  0.1445, 0.1025
  White: 0.2998, 0.3349
Established timings supported:
  720x400@70Hz 9:5 HorFreq: 31469 Hz Clock: 28.320 MHz
  640x480@60Hz 4:3 HorFreq: 31469 Hz Clock: 25.175 MHz
  640x480@75Hz 4:3 HorFreq: 37500 Hz Clock: 31.500 MHz
  800x600@60Hz 4:3 HorFreq: 37900 Hz Clock: 40.000 MHz
  800x600@75Hz 4:3 HorFreq: 46900 Hz Clock: 49.500 MHz
  832x624@75Hz 4:3 HorFreq: 49726 Hz Clock: 57.284 MHz
  1024x768@60Hz 4:3 HorFreq: 48400 Hz Clock: 65.000 MHz
  1024x768@75Hz 4:3 HorFreq: 60000 Hz Clock: 78.750 MHz
  1152x870@75Hz 192:145 HorFreq: 67500 Hz Clock: 108.000 MHz
Standard timings supported:
  640x480@75Hz 4:3 HorFreq: 37500 Hz Clock: 31.500 MHz
  800x600@75Hz 4:3 HorFreq: 46900 Hz Clock: 49.500 MHz
  1024x768@75Hz 4:3 HorFreq: 60000 Hz Clock: 78.750 MHz
  1280x1024@60Hz 5:4 HorFreq: 64000 Hz Clock: 108.000 MHz
Detailed mode: Clock 108.000 MHz, 359 mm x 287 mm
               1280 1328 1440 1688 hborder 0
               1024 1025 1028 1066 vborder 0
               +hsync +vsync 
               VertFreq: 60 Hz, HorFreq: 63981 Hz
Monitor ranges (GTF): 56-75Hz V, 30-71kHz H, max dotclock 110MHz
Monitor name: L1710B 
Checksum: 0xdd (valid)
EDID block does not conform at all!
	Bad year of manufacture


