
EDID (hex):
00ffffffffffff0009e5410700000000
011b010495190e780a5d40945b579429
1c505400000001010101010101010101
010101010101381d56c850001c303020
360000901000001a0000000000000000
0000000000000000001a000000000000
000000000000000000000000000000fe
004e5431313657484d2d4e34340a0087

Extracted contents:
header:          00 ff ff ff ff ff ff 00
serial number:   09 e5 41 07 00 00 00 00 01 1b
version:         01 04
basic params:    95 19 0e 78 0a
chroma info:     5d 40 94 5b 57 94 29 1c 50 54
established:     00 00 00
standard:        01 01 01 01 01 01 01 01 01 01 01 01 01 01 01 01
descriptor 1:    38 1d 56 c8 50 00 1c 30 30 20 36 00 00 90 10 00 00 1a
descriptor 2:    00 00 00 00 00 00 00 00 00 00 00 00 00 00 00 00 00 1a
descriptor 3:    00 00 00 00 00 00 00 00 00 00 00 00 00 00 00 00 00 00
descriptor 4:    00 00 00 fe 00 4e 54 31 31 36 57 48 4d 2d 4e 34 34 0a
extensions:      00
checksum:        87

EDID version: 1.4
Manufacturer: BOE Model 741 Serial Number --
Made in week 1 of 2017
Digital display
6 bits per primary color channel
DisplayPort interface
Maximum image size: 25 cm x 14 cm
Gamma: 2.20
Supported color formats: RGB 4:4:4, YCrCb 4:4:4
First detailed timing includes the native pixel format and preferred refresh rate
Display x,y Chromaticity:
  Red:   0.5791, 0.3564
  Green: 0.3427, 0.5791
  Blue:  0.1611, 0.1093
  White: 0.3125, 0.3281
Established timings supported:
Standard timings supported:
Detailed mode: Clock 74.800 MHz, 256 mm x 144 mm
               1366 1414 1446 1566 hborder 0
                768  771  777  796 vborder 0
               +hsync -vsync 
               VertFreq: 60 Hz, HorFreq: 47765 Hz
Manufacturer-specified data, tag 0
Manufacturer-specified data, tag 0
ASCII string: NT116WHM-N44
Checksum: 0x87 (valid)
EDID block does NOT conform to EDID 1.4!
	Missing name descriptor
	Missing monitor ranges
