
EDID (hex):
00ffffffffffff0030e4230300000000
00150103802313780ab6259e5e589b26
1d505400000001010101010101010101
010101010101543880e4703828403048
350059c2100000190000000000000000
00000000000000000000000000fe004c
4720446973706c61790a2020000000fe
004c503135365746342d534c423100b2

Extracted contents:
header:          00 ff ff ff ff ff ff 00
serial number:   30 e4 23 03 00 00 00 00 00 15
version:         01 03
basic params:    80 23 13 78 0a
chroma info:     b6 25 9e 5e 58 9b 26 1d 50 54
established:     00 00 00
standard:        01 01 01 01 01 01 01 01 01 01 01 01 01 01 01 01
descriptor 1:    54 38 80 e4 70 38 28 40 30 48 35 00 59 c2 10 00 00 19
descriptor 2:    00 00 00 00 00 00 00 00 00 00 00 00 00 00 00 00 00 00
descriptor 3:    00 00 00 fe 00 4c 47 20 44 69 73 70 6c 61 79 0a 20 20
descriptor 4:    00 00 00 fe 00 4c 50 31 35 36 57 46 34 2d 53 4c 42 31
extensions:      00
checksum:        b2

EDID version: 1.3
Manufacturer: LGD Model 323 Serial Number --
Made in year 2011
Digital display
Maximum image size: 35 cm x 19 cm
Gamma: 2.20
RGB color display
First detailed timing is preferred timing
Display x,y Chromaticity:
  Red:   0.6191, 0.3701
  Green: 0.3447, 0.6074
  Blue:  0.1484, 0.1152
  White: 0.3134, 0.3291
Established timings supported:
Standard timings supported:
Detailed mode: Clock 144.200 MHz, 345 mm x 194 mm
               1920 1968 2040 2148 hborder 0
               1080 1083 1088 1120 vborder 0
               -hsync -vsync 
               VertFreq: 59 Hz, HorFreq: 67132 Hz
Manufacturer-specified data, tag 0
ASCII string: LG Display
ASCII string: LP156WF4-SLB1
Checksum: 0xb2 (valid)
EDID block does NOT conform to EDID 1.3!
	Missing name descriptor
	Missing monitor ranges
