edid-decode (hex):

00 ff ff ff ff ff ff 00 30 e4 23 03 00 00 00 00
00 16 01 04 95 23 13 78 0a 25 b5 a1 59 59 9d 27
1c 50 54 00 00 00 01 01 01 01 01 01 01 01 01 01
01 01 01 01 01 01 e8 35 80 a8 70 38 16 40 20 24
55 00 59 c2 10 00 00 18 00 00 00 00 00 00 00 00
00 00 00 00 00 00 00 00 00 00 00 00 00 fe 00 4c
47 20 44 69 73 70 6c 61 79 0a 20 20 00 00 00 fe
00 4c 50 31 35 36 57 46 34 2d 53 50 42 31 00 69

----------------

Block 0, Base EDID:
  EDID Structure Version & Revision: 1.4
  Vendor & Product Identification:
    Manufacturer: LGD
    Model: 803
    Made in: 2012
  Basic Display Parameters & Features:
    Digital display
    Bits per primary color channel: 6
    DisplayPort interface
    Maximum image size: 35 cm x 19 cm
    Gamma: 2.20
    Supported color formats: RGB 4:4:4, YCrCb 4:4:4
    First detailed timing includes the native pixel format and preferred refresh rate
  Color Characteristics:
    Red  : 0.6289, 0.3496
    Green: 0.3486, 0.6142
    Blue : 0.1542, 0.1123
    White: 0.3134, 0.3291
  Established Timings I & II: none
  Standard Timings: none
  Detailed Timing Descriptors:
    DTD 1:  1920x1080   59.975 Hz  16:9    66.092 kHz 138.000 MHz (345 mm x 194 mm)
                 Hfront   32 Hsync  36 Hback 100 Hpol N
                 Vfront    5 Vsync   5 Vback  12 Vpol N
    Empty Descriptor
    Alphanumeric Data String: 'LG Display'
    Alphanumeric Data String: 'LP156WF4-SPB1'
Checksum: 0x69
