edid-decode (hex):

00 ff ff ff ff ff ff 00 30 e4 a4 05 00 00 00 00
00 1b 01 04 b5 1f 11 78 ea f6 e5 a7 52 35 b4 25
0d 50 54 00 00 00 01 01 01 01 01 01 01 01 01 01
01 01 01 01 01 01 4d d0 00 a0 f0 70 3e 80 30 20
35 00 35 ae 10 00 00 1b de 8a 00 a0 f0 70 3e 80
30 20 35 00 35 ae 10 00 00 1b 00 00 00 00 00 00
00 00 00 00 00 00 00 00 00 00 00 00 00 00 00 02
00 0f 2d ff 14 3c af 29 13 40 af 00 00 00 00 b1

----------------

Block 0, Base EDID:
  EDID Structure Version & Revision: 1.4
  Vendor & Product Identification:
    Manufacturer: LGD
    Model: 1444
    Made in: 2017
  Basic Display Parameters & Features:
    Digital display
    Bits per primary color channel: 10
    DisplayPort interface
    Maximum image size: 31 cm x 17 cm
    Gamma: 2.20
    DPMS levels: Standby Suspend Off
    Supported color formats: RGB 4:4:4, YCrCb 4:4:4
    First detailed timing includes the native pixel format and preferred refresh rate
  Color Characteristics:
    Red  : 0.6552, 0.3232
    Green: 0.2080, 0.7050
    Blue : 0.1474, 0.0527
    White: 0.3134, 0.3291
  Established Timings I & II: none
  Standard Timings: none
  Detailed Timing Descriptors:
    DTD 1:  3840x2160   59.997 Hz  16:9   133.312 kHz 533.250 MHz (309 mm x 174 mm)
                 Hfront   48 Hsync  32 Hback  80 Hpol P
                 Vfront    3 Vsync   5 Vback  54 Vpol N
    DTD 2:  3840x2160   39.998 Hz  16:9    88.875 kHz 355.500 MHz (309 mm x 174 mm)
                 Hfront   48 Hsync  32 Hback  80 Hpol P
                 Vfront    3 Vsync   5 Vback  54 Vpol N
    Empty Descriptor
    Manufacturer-Specified Display Descriptor (0x02): 00 02 00 0f 2d ff 14 3c af 29 13 40 af 00 00 00 '....-..<.).@....'
Checksum: 0xb1

----------------

Failures:

Block 0, Base EDID:
  Empty Descriptor: Use Dummy Descriptor instead of all zeroes.
  Missing Display Product Name.

EDID conformity: FAIL
