
EDID (hex):
00ffffffffffff001e6dbe58a1700400
091601036c301b78ea9535a159579f27
0e5054a54b00714f81809500a9c08100
81c09040b300023a801871382d40582c
4500dd0c1100001e000000fd00384b1e
530f000a202020202020000000fc0045
323234320a20202020202020000000ff
0032303952415759384a3937370a00f3

Extracted contents:
header:          00 ff ff ff ff ff ff 00
serial number:   1e 6d be 58 a1 70 04 00 09 16
version:         01 03
basic params:    6c 30 1b 78 ea
chroma info:     95 35 a1 59 57 9f 27 0e 50 54
established:     a5 4b 00
standard:        71 4f 81 80 95 00 a9 c0 81 00 81 c0 90 40 b3 00
descriptor 1:    02 3a 80 18 71 38 2d 40 58 2c 45 00 dd 0c 11 00 00 1e
descriptor 2:    00 00 00 fd 00 38 4b 1e 53 0f 00 0a 20 20 20 20 20 20
descriptor 3:    00 00 00 fc 00 45 32 32 34 32 0a 20 20 20 20 20 20 20
descriptor 4:    00 00 00 ff 00 32 30 39 52 41 57 59 38 4a 39 37 37 0a
extensions:      00
checksum:        f3

EDID version: 1.3
Manufacturer: GSM Model 58be Serial Number --
Made in week 9 of 2012
Analog display, Input voltage level: 0.7/0.7 V
Sync: Separate Composite 
Maximum image size: 48 cm x 27 cm
Gamma: 2.20
DPMS levels: Standby Suspend Off
RGB color display
First detailed timing is preferred timing
Display x,y Chromaticity:
  Red:   0.6308, 0.3486
  Green: 0.3408, 0.6220
  Blue:  0.1523, 0.0576
  White: 0.3134, 0.3291
Established timings supported:
  720x400@70Hz 9:5 HorFreq: 31469 Hz Clock: 28.320 MHz
  640x480@60Hz 4:3 HorFreq: 31469 Hz Clock: 25.175 MHz
  640x480@75Hz 4:3 HorFreq: 37500 Hz Clock: 31.500 MHz
  800x600@60Hz 4:3 HorFreq: 37900 Hz Clock: 40.000 MHz
  800x600@75Hz 4:3 HorFreq: 46900 Hz Clock: 49.500 MHz
  1024x768@60Hz 4:3 HorFreq: 48400 Hz Clock: 65.000 MHz
  1024x768@75Hz 4:3 HorFreq: 60000 Hz Clock: 78.750 MHz
  1280x1024@75Hz 5:4 HorFreq: 80000 Hz Clock: 135.000 MHz
Standard timings supported:
  1152x864@75Hz 4:3 HorFreq: 67500 Hz Clock: 108.000 MHz
  1280x1024@60Hz 5:4 HorFreq: 64000 Hz Clock: 108.000 MHz
  1440x900@60Hz 16:10 HorFreq: 55500 Hz Clock: 88.750 MHz
  1600x900@60Hz 16:9
  1280x800@60Hz 16:10
  1280x720@60Hz 16:9
  1400x1050@60Hz 4:3 HorFreq: 64700 Hz Clock: 101.000 MHz
  1680x1050@60Hz 16:10 HorFreq: 64700 Hz Clock: 119.000 MHz
Detailed mode: Clock 148.500 MHz, 477 mm x 268 mm
               1920 2008 2052 2200 hborder 0
               1080 1084 1089 1125 vborder 0
               +hsync +vsync 
               VertFreq: 60 Hz, HorFreq: 67500 Hz
Monitor ranges (GTF): 56-75Hz V, 30-83kHz H, max dotclock 150MHz
Monitor name: E2242
Serial number: --
Checksum: 0xf3 (valid)
