edid-decode (hex):

00 ff ff ff ff ff ff 00 26 cf 7c 05 00 00 00 00
00 17 01 04 95 1f 11 78 0a 21 d0 94 58 56 8f 27
1f 50 54 00 00 00 01 01 01 01 01 01 01 01 01 01
01 01 01 01 01 01 bd 1b 56 88 50 00 14 30 22 28
46 00 35 ae 10 00 00 19 00 00 00 00 00 00 00 00
00 00 00 00 00 00 00 00 00 00 00 00 00 fe 00 49
6e 66 6f 56 69 73 69 6f 6e 0a 20 20 00 00 00 fe
00 4d 31 34 30 4e 57 52 34 20 52 31 20 0a 00 67

----------------

Block 0, Base EDID:
  EDID Structure Version & Revision: 1.4
  Vendor & Product Identification:
    Manufacturer: IVO
    Model: 1404
    Made in: 2013
  Basic Display Parameters & Features:
    Digital display
    Bits per primary color channel: 6
    DisplayPort interface
    Maximum image size: 31 cm x 17 cm
    Gamma: 2.20
    Supported color formats: RGB 4:4:4, YCrCb 4:4:4
    First detailed timing includes the native pixel format and preferred refresh rate
  Color Characteristics:
    Red  : 0.5781, 0.3457
    Green: 0.3359, 0.5595
    Blue : 0.1552, 0.1220
    White: 0.3125, 0.3281
  Established Timings I & II: none
  Standard Timings: none
  Detailed Timing Descriptors:
    DTD 1:  1366x768    59.996 Hz 683:384  47.277 kHz  71.010 MHz (309 mm x 174 mm)
                 Hfront   34 Hsync  40 Hback  62 Hpol N
                 Vfront    4 Vsync   6 Vback  10 Vpol N
    Empty Descriptor
    Alphanumeric Data String: 'InfoVision'
    Alphanumeric Data String: 'M140NWR4 R1 '
Checksum: 0x67

----------------

Failures:

Block 0, Base EDID:
  Empty Descriptor: Use Dummy Descriptor instead of all zeroes.
  Alphanumeric Data String: One or more trailing spaces.
  Missing Display Product Name.

EDID conformity: FAIL
