
EDID (hex):
00ffffffffffff0009d11f7845540000
20150103802c19782e3d85a6564a9a24
125054a56a0061c081c081cfa9cf0101
0101010101012f2640a060841a303020
3500bbf91000001a000000ff00393842
30373134333031390a20000000fd0032
4c185311000a202020202020000000fc
0042656e5120473230323048440a007c

Extracted contents:
header:          00 ff ff ff ff ff ff 00
serial number:   09 d1 1f 78 45 54 00 00 20 15
version:         01 03
basic params:    80 2c 19 78 2e
chroma info:     3d 85 a6 56 4a 9a 24 12 50 54
established:     a5 6a 00
standard:        61 c0 81 c0 81 cf a9 cf 01 01 01 01 01 01 01 01
descriptor 1:    2f 26 40 a0 60 84 1a 30 30 20 35 00 bb f9 10 00 00 1a
descriptor 2:    00 00 00 ff 00 39 38 42 30 37 31 34 33 30 31 39 0a 20
descriptor 3:    00 00 00 fd 00 32 4c 18 53 11 00 0a 20 20 20 20 20 20
descriptor 4:    00 00 00 fc 00 42 65 6e 51 20 47 32 30 32 30 48 44 0a
extensions:      00
checksum:        7c

EDID version: 1.3
Manufacturer: BNQ Model 781f Serial Number --
Made in week 32 of 2011
Digital display
Maximum image size: 44 cm x 25 cm
Gamma: 2.20
DPMS levels: Off
RGB color display
Default (sRGB) color space is primary color space
First detailed timing is preferred timing
Display x,y Chromaticity:
  Red:   0.6484, 0.3388
  Green: 0.2919, 0.6025
  Blue:  0.1425, 0.0703
  White: 0.3134, 0.3291
Established timings supported:
  720x400@70Hz 9:5 HorFreq: 31469 Hz Clock: 28.320 MHz
  640x480@60Hz 4:3 HorFreq: 31469 Hz Clock: 25.175 MHz
  640x480@75Hz 4:3 HorFreq: 37500 Hz Clock: 31.500 MHz
  800x600@60Hz 4:3 HorFreq: 37900 Hz Clock: 40.000 MHz
  800x600@75Hz 4:3 HorFreq: 46900 Hz Clock: 49.500 MHz
  832x624@75Hz 4:3 HorFreq: 49726 Hz Clock: 57.284 MHz
  1024x768@60Hz 4:3 HorFreq: 48400 Hz Clock: 65.000 MHz
  1024x768@75Hz 4:3 HorFreq: 60000 Hz Clock: 78.750 MHz
Standard timings supported:
  1024x576@60Hz 16:9
  1280x720@60Hz 16:9
  1280x720@75Hz 16:9
  1600x900@75Hz 16:9
Detailed mode: Clock 97.750 MHz, 443 mm x 249 mm
               1600 1648 1680 1760 hborder 0
                900  903  908  926 vborder 0
               +hsync -vsync 
               VertFreq: 59 Hz, HorFreq: 55539 Hz
Serial number: --
Monitor ranges (GTF): 50-76Hz V, 24-83kHz H, max dotclock 170MHz
Monitor name: BenQ G2020HD
Checksum: 0x7c (valid)
EDID block does NOT conform to EDID 1.3!
	sRGB is signaled, but the chromaticities do not match


