edid-decode (hex):

00 ff ff ff ff ff ff 00 1e 6d 65 77 d7 d7 06 00
0c 1f 01 03 80 46 27 78 ea cd b4 a5 56 50 a1 27
13 50 54 21 08 00 d1 c0 61 40 01 01 01 01 01 01
01 01 01 01 01 01 6f c2 00 a0 a0 a0 55 50 30 20
35 00 b9 88 21 00 00 1a 00 00 00 fd 00 3c 90 1e
fa 41 00 0a 20 20 20 20 20 20 00 00 00 fc 00 4c
47 20 55 4c 54 52 41 47 45 41 52 0a 00 00 00 ff
00 31 31 32 4e 54 47 59 44 36 34 37 31 0a 01 c2

02 03 62 f1 35 09 7f 07 0f 7f 07 17 07 50 3f 1e
c0 5f 7e 01 57 06 00 67 7e 07 83 4f 00 00 1f 13
12 5d 5e 5f 60 61 3f 83 01 00 00 6d 03 0c 00 10
00 b8 3c 20 00 60 01 02 03 68 d8 5d c4 01 78 80
03 00 e3 0f 00 06 6d 1a 00 00 02 05 3c 90 00 04
5a 50 5a 50 e3 05 c0 00 e2 00 6a e6 06 05 01 5a
5a 50 e9 e8 00 a0 a0 a0 53 50 30 20 35 00 ba 88
21 00 00 1a 00 00 00 00 00 00 00 00 00 00 00 9c

00 ff ff ff ff ff ff 00 1e 6d 65 77 d7 d7 06 00
0c 1f 01 03 80 46 27 78 ea cd b4 a5 56 50 a1 27
13 50 54 21 08 00 d1 c0 61 40 01 01 01 01 01 01
01 01 01 01 01 01 6f c2 00 a0 a0 a0 55 50 30 20
35 00 b9 88 21 00 00 1a 00 00 00 fd 00 3c 90 1e
fa 41 00 0a 20 20 20 20 20 20 00 00 00 fc 00 4c
47 20 55 4c 54 52 41 47 45 41 52 0a 00 00 00 ff
00 31 31 32 4e 54 47 59 44 36 34 37 31 0a 01 c2

02 03 62 f1 35 09 7f 07 0f 7f 07 17 07 50 3f 1e
c0 5f 7e 01 57 06 00 67 7e 07 83 4f 00 00 1f 13
12 5d 5e 5f 60 61 3f 83 01 00 00 6d 03 0c 00 10
00 b8 3c 20 00 60 01 02 03 68 d8 5d c4 01 78 80
03 00 e3 0f 00 06 6d 1a 00 00 02 05 3c 90 00 04
5a 50 5a 50 e3 05 c0 00 e2 00 6a e6 06 05 01 5a
5a 50 e9 e8 00 a0 a0 a0 53 50 30 20 35 00 ba 88
21 00 00 1a 00 00 00 00 00 00 00 00 00 00 00 9c

----------------

Block 0, Base EDID:
  EDID Structure Version & Revision: 1.3
  Vendor & Product Identification:
    Manufacturer: GSM
    Model: 30565
    Serial Number: ...
    Made in: week 12 of 2021
  Basic Display Parameters & Features:
    Digital display
    Maximum image size: 70 cm x 39 cm
    Gamma: 2.20
    DPMS levels: Standby Suspend Off
    RGB color display
    First detailed timing is the preferred timing
  Color Characteristics:
    Red  : 0.6474, 0.3359
    Green: 0.3154, 0.6298
    Blue : 0.1542, 0.0771
    White: 0.3134, 0.3281
  Established Timings I & II:
    DMT 0x04:   640x480    59.940476 Hz   4:3     31.469 kHz     25.175000 MHz
    DMT 0x09:   800x600    60.316541 Hz   4:3     37.879 kHz     40.000000 MHz
    DMT 0x10:  1024x768    60.003840 Hz   4:3     48.363 kHz     65.000000 MHz
  Standard Timings:
    DMT 0x52:  1920x1080   60.000000 Hz  16:9     67.500 kHz    148.500000 MHz
    DMT 0x10:  1024x768    60.003840 Hz   4:3     48.363 kHz     65.000000 MHz
  Detailed Timing Descriptors:
    DTD 1:  2560x1440  119.997589 Hz  16:9    182.996 kHz    497.750000 MHz (697 mm x 392 mm)
                 Hfront   48 Hsync  32 Hback   80 Hpol P
                 Vfront    3 Vsync   5 Vback   77 Vpol N
    Display Range Limits:
      Monitor ranges (GTF): 60-144 Hz V, 30-250 kHz H, max dotclock 650 MHz
    Display Product Name: 'LG ULTRAGEAR'
    Display Product Serial Number: ...
  Extension blocks: 1
Checksum: 0xc2

----------------

Block 1, CTA-861 Extension Block:
  Revision: 3
  Underscans IT Video Formats by default
  Basic audio support
  Supports YCbCr 4:4:4
  Supports YCbCr 4:2:2
  Native detailed modes: 1
  Audio Data Block:
    Linear PCM:
      Max channels: 2
      Supported sample rates (kHz): 192 176.4 96 88.2 48 44.1 32
      Supported sample sizes (bits): 24 20 16
    Linear PCM:
      Max channels: 8
      Supported sample rates (kHz): 192 176.4 96 88.2 48 44.1 32
      Supported sample sizes (bits): 24 20 16
    AC-3:
      Max channels: 8
      Supported sample rates (kHz): 48 44.1 32
      Maximum bit rate: 640 kb/s
    DTS:
      Max channels: 8
      Supported sample rates (kHz): 96 88.2 48 44.1
      Maximum bit rate: 1536 kb/s
    DTS-HD:
      Max channels: 8
      Supported sample rates (kHz): 192 176.4 96 88.2 48 44.1
      Audio Format Code dependent value: 0x01
    Enhanced AC-3 (DD+):
      Max channels: 8
      Supported sample rates (kHz): 48 44.1
    MAT (MLP):
      Max channels: 8
      Supported sample rates (kHz): 192 176.4 96 88.2 48 44.1
      Supports Dolby TrueHD, object audio PCM and channel-based PCM
      Hash calculation not required for object audio PCM or channel-based PCM
  Speaker Allocation Data Block:
    FL/FR - Front Left/Right
    LFE1 - Low Frequency Effects 1
    FC - Front Center
    BL/BR - Back Left/Right
    RLC/RRC - Rear Left/Right of Center (Deprecated)
  Unknown CTA-861 Data Block (tag 0x00, length 31):
    13 12 5d 5e 5f 60 61 3f 83 01 00 00 6d 03 0c 00 '..]^_`a?....m...'
    10 00 b8 3c 20 00 60 01 02 03 68 d8 5d c4 01    '...< .`...h.]..'
  Vendor-Specific Data Block, OUI 00-03-80:
    e3 0f 00 06 6d 1a 00 00 02 05 3c 90 00 04 5a 50 '....m.....<...ZP'
    5a 50 e3 05 c0                                  'ZP...'
  Unknown CTA-861 Data Block (tag 0x00, length 0):
  Video Capability Data Block:
    YCbCr quantization: No Data
    RGB quantization: Selectable (via AVI Q)
    PT scan behavior: Always Underscanned
    IT scan behavior: Always Underscanned
    CE scan behavior: Always Underscanned
  HDR Static Metadata Data Block:
    Electro optical transfer functions:
      Traditional gamma - SDR luminance range
      SMPTE ST2084
    Supported static metadata descriptors:
      Static metadata type 1
    Desired content max luminance: 90 (351.250 cd/m^2)
    Desired content max frame-average luminance: 90 (351.250 cd/m^2)
    Desired content min luminance: 80 (0.346 cd/m^2)
  Detailed Timing Descriptors:
    DTD 2:  2560x1440  143.932737 Hz  16:9    219.210 kHz    596.250000 MHz (698 mm x 392 mm)
                 Hfront   48 Hsync  32 Hback   80 Hpol P
                 Vfront    3 Vsync   5 Vback   75 Vpol N
Checksum: 0x9c  Unused space in Extension Block: 11 bytes

----------------

Block 2, Unknown EDID Extension Block 0x00:
  00 ff ff ff ff ff ff 00 1e 6d 65 77 d7 d7 06 00 '.........mew....'
  0c 1f 01 03 80 46 27 78 ea cd b4 a5 56 50 a1 27 '.....F'x....VP.''
  13 50 54 21 08 00 d1 c0 61 40 01 01 01 01 01 01 '.PT!....a@......'
  01 01 01 01 01 01 6f c2 00 a0 a0 a0 55 50 30 20 '......o.....UP0 '
  35 00 b9 88 21 00 00 1a 00 00 00 fd 00 3c 90 1e '5...!........<..'
  fa 41 00 0a 20 20 20 20 20 20 00 00 00 fc 00 4c '.A..      .....L'
  47 20 55 4c 54 52 41 47 45 41 52 0a 00 00 00 ff 'G ULTRAGEAR.....'
  00 31 31 32 4e 54 47 59 44 36 34 37 31 0a 01 c2 '.112NTGYD6471...'
Checksum: 0xc2

----------------

Block 3, CTA-861 Extension Block:
  Revision: 3
  Underscans IT Video Formats by default
  Basic audio support
  Supports YCbCr 4:4:4
  Supports YCbCr 4:2:2
  Native detailed modes: 1
  Audio Data Block:
    Linear PCM:
      Max channels: 2
      Supported sample rates (kHz): 192 176.4 96 88.2 48 44.1 32
      Supported sample sizes (bits): 24 20 16
    Linear PCM:
      Max channels: 8
      Supported sample rates (kHz): 192 176.4 96 88.2 48 44.1 32
      Supported sample sizes (bits): 24 20 16
    AC-3:
      Max channels: 8
      Supported sample rates (kHz): 48 44.1 32
      Maximum bit rate: 640 kb/s
    DTS:
      Max channels: 8
      Supported sample rates (kHz): 96 88.2 48 44.1
      Maximum bit rate: 1536 kb/s
    DTS-HD:
      Max channels: 8
      Supported sample rates (kHz): 192 176.4 96 88.2 48 44.1
      Audio Format Code dependent value: 0x01
    Enhanced AC-3 (DD+):
      Max channels: 8
      Supported sample rates (kHz): 48 44.1
    MAT (MLP):
      Max channels: 8
      Supported sample rates (kHz): 192 176.4 96 88.2 48 44.1
      Supports Dolby TrueHD, object audio PCM and channel-based PCM
      Hash calculation not required for object audio PCM or channel-based PCM
  Speaker Allocation Data Block:
    FL/FR - Front Left/Right
    LFE1 - Low Frequency Effects 1
    FC - Front Center
    BL/BR - Back Left/Right
    RLC/RRC - Rear Left/Right of Center (Deprecated)
  Unknown CTA-861 Data Block (tag 0x00, length 31):
    13 12 5d 5e 5f 60 61 3f 83 01 00 00 6d 03 0c 00 '..]^_`a?....m...'
    10 00 b8 3c 20 00 60 01 02 03 68 d8 5d c4 01    '...< .`...h.]..'
  Vendor-Specific Data Block, OUI 00-03-80:
    e3 0f 00 06 6d 1a 00 00 02 05 3c 90 00 04 5a 50 '....m.....<...ZP'
    5a 50 e3 05 c0                                  'ZP...'
  Unknown CTA-861 Data Block (tag 0x00, length 0):
  Video Capability Data Block:
    YCbCr quantization: No Data
    RGB quantization: Selectable (via AVI Q)
    PT scan behavior: Always Underscanned
    IT scan behavior: Always Underscanned
    CE scan behavior: Always Underscanned
  HDR Static Metadata Data Block:
    Electro optical transfer functions:
      Traditional gamma - SDR luminance range
      SMPTE ST2084
    Supported static metadata descriptors:
      Static metadata type 1
    Desired content max luminance: 90 (351.250 cd/m^2)
    Desired content max frame-average luminance: 90 (351.250 cd/m^2)
    Desired content min luminance: 80 (0.346 cd/m^2)
  Detailed Timing Descriptors:
    DTD 3:  2560x1440  143.932737 Hz  16:9    219.210 kHz    596.250000 MHz (698 mm x 392 mm)
                 Hfront   48 Hsync  32 Hback   80 Hpol P
                 Vfront    3 Vsync   5 Vback   75 Vpol N
Checksum: 0x9c  Unused space in Extension Block: 11 bytes

----------------

Warnings:

Block 1, CTA-861 Extension Block:
  Unknown CTA-861 Data Block (tag 0x00, length 31).
  Vendor-Specific Data Block, OUI 00-03-80: Unknown OUI 00-03-80.
  Unknown CTA-861 Data Block (tag 0x00, length 0).
  Video Capability Data Block: Set Selectable YCbCr Quantization to avoid interop issues.
  Video Capability Data Block: S_PT is equal to S_IT and S_CE, so should be set to 0 instead.
  Display Product Serial Number is set, so the Serial Number in the Base EDID should be 0.
  Add a Colorimetry Data Block with the sRGB colorimetry bit set to avoid interop issues.
Block 3, CTA-861 Extension Block:
  Unknown CTA-861 Data Block (tag 0x00, length 31).
  Vendor-Specific Data Block, OUI 00-03-80: Unknown OUI 00-03-80.
  Unknown CTA-861 Data Block (tag 0x00, length 0).
  Video Capability Data Block: Set Selectable YCbCr Quantization to avoid interop issues.
  Video Capability Data Block: S_PT is equal to S_IT and S_CE, so should be set to 0 instead.
  Display Product Serial Number is set, so the Serial Number in the Base EDID should be 0.
  Add a Colorimetry Data Block with the sRGB colorimetry bit set to avoid interop issues.

Failures:

Block 2, Base EDID:
  Unknown Extension Block.
Block 3, CTA-861 Extension Block:
  Speaker Allocation Data Block: Only one instance of this Data Block is allowed.
  Video Capability Data Block: Only one instance of this Data Block is allowed.
  HDR Static Metadata Data Block: Only one instance of this Data Block is allowed.
EDID:
  Base EDID: EDID specified 1 extension block(s), but found 3 extension block(s).
  Base EDID: EDID 1.3 requires a Block Map Extension in Block 1 if there are more than 2 blocks in the EDID.

EDID conformity: FAIL
