
EDID (hex):
00ffffffffffff001609751401000000
221b0103804627780af0659857519127
215054a1080001010101010101010101
010101010101011d007251d01e206e28
5500c48e2100001e662150b051001b30
40703600ba882100001e000000fc004c
4533324d313437350a202020000000fd
00313d0f3109000a20202020202001f4
020321734e8493101f05140312071601
06151123090f078301000065030c0020
00011d00bc52d01e20b8285540c48e21
00001e011d8018711c1620582c2500c4
8e2100009e011d80d0721c1620102c25
80c48e2100009e8c0ad08a20e02d1010
3e9600c48e210000188c0ad090204031
200c405500c48e2100001800000000fb

Extracted contents:
header:          00 ff ff ff ff ff ff 00
serial number:   16 09 75 14 01 00 00 00 22 1b
version:         01 03
basic params:    80 46 27 78 0a
chroma info:     f0 65 98 57 51 91 27 21 50 54
established:     a1 08 00
standard:        01 01 01 01 01 01 01 01 01 01 01 01 01 01 01 01
descriptor 1:    01 1d 00 72 51 d0 1e 20 6e 28 55 00 c4 8e 21 00 00 1e
descriptor 2:    66 21 50 b0 51 00 1b 30 40 70 36 00 ba 88 21 00 00 1e
descriptor 3:    00 00 00 fc 00 4c 45 33 32 4d 31 34 37 35 0a 20 20 20
descriptor 4:    00 00 00 fd 00 31 3d 0f 31 09 00 0a 20 20 20 20 20 20
extensions:      01
checksum:        f4

EDID version: 1.3
Manufacturer: EPI Model 1475 Serial Number --
Made in week 34 of 2017
Digital display
Maximum image size: 70 cm x 39 cm
Gamma: 2.20
RGB color display
First detailed timing is preferred timing
Display x,y Chromaticity:
  Red:   0.5966, 0.3427
  Green: 0.3164, 0.5664
  Blue:  0.1533, 0.1308
  White: 0.3134, 0.3291
Established timings supported:
  720x400@70Hz 9:5 HorFreq: 31469 Hz Clock: 28.320 MHz
  640x480@60Hz 4:3 HorFreq: 31469 Hz Clock: 25.175 MHz
  800x600@60Hz 4:3 HorFreq: 37900 Hz Clock: 40.000 MHz
  1024x768@60Hz 4:3 HorFreq: 48400 Hz Clock: 65.000 MHz
Standard timings supported:
Detailed mode: Clock 74.250 MHz, 708 mm x 398 mm
               1280 1390 1430 1650 hborder 0
                720  725  730  750 vborder 0
               +hsync +vsync 
               VertFreq: 60 Hz, HorFreq: 45000 Hz
Detailed mode: Clock 85.500 MHz, 698 mm x 392 mm
               1360 1424 1536 1792 hborder 0
                768  771  777  795 vborder 0
               +hsync +vsync 
               VertFreq: 60 Hz, HorFreq: 47712 Hz
Monitor name: LE32M1475
Monitor ranges (GTF): 49-61Hz V, 15-49kHz H, max dotclock 90MHz
Has 1 extension blocks
Checksum: 0xf4 (valid)

CTA extension block
Extension version: 3
29 bytes of CTA data
  Video data block
    VIC   4 1280x720@60Hz 16:9 (native) HorFreq: 45000 Hz Clock: 74.250 MHz
    VIC  19 1280x720@50Hz 16:9 (native) HorFreq: 37500 Hz Clock: 74.250 MHz
    VIC  16 1920x1080@60Hz 16:9  HorFreq: 67500 Hz Clock: 148.500 MHz
    VIC  31 1920x1080@50Hz 16:9  HorFreq: 56250 Hz Clock: 148.500 MHz
    VIC   5 1920x1080i@60Hz 16:9  HorFreq: 33750 Hz Clock: 74.250 MHz
    VIC  20 1920x1080i@50Hz 16:9  HorFreq: 28125 Hz Clock: 74.250 MHz
    VIC   3 720x480@60Hz 16:9  HorFreq: 31469 Hz Clock: 27.000 MHz
    VIC  18 720x576@50Hz 16:9  HorFreq: 31250 Hz Clock: 27.000 MHz
    VIC   7 1440x480i@60Hz 16:9  HorFreq: 15734 Hz Clock: 27.000 MHz
    VIC  22 1440x576i@50Hz 16:9  HorFreq: 15625 Hz Clock: 27.000 MHz
    VIC   1 640x480@60Hz 4:3  HorFreq: 31469 Hz Clock: 25.175 MHz
    VIC   6 1440x480i@60Hz 4:3  HorFreq: 15734 Hz Clock: 27.000 MHz
    VIC  21 1440x576i@50Hz 4:3  HorFreq: 15625 Hz Clock: 27.000 MHz
    VIC  17 720x576@50Hz 4:3  HorFreq: 31250 Hz Clock: 27.000 MHz
  Audio data block
    Linear PCM, max channels 2
      Supported sample rates (kHz): 88.2 48 44.1 32
      Supported sample sizes (bits): 24 20 16
  Speaker allocation data block
    Speaker map:
      FL/FR - Front Left/Right
  Vendor-specific data block, OUI 000c03 (HDMI)
    Source physical address 2.0.0.0
Basic audio support
Supports YCbCr 4:4:4
Supports YCbCr 4:2:2
3 native detailed modes
Detailed mode: Clock 74.250 MHz, 708 mm x 398 mm
               1280 1720 1760 1980 hborder 0
                720  725  730  750 vborder 0
               +hsync +vsync 
               VertFreq: 50 Hz, HorFreq: 37500 Hz
Detailed mode: Clock 74.250 MHz, 708 mm x 398 mm
               1920 2008 2052 2200 hborder 0
                540  542  547  562 vborder 0
               +hsync +vsync interlaced 
               VertFreq: 60 Hz, HorFreq: 33750 Hz
Detailed mode: Clock 74.250 MHz, 708 mm x 398 mm
               1920 2448 2492 2640 hborder 0
                540  542  547  562 vborder 0
               +hsync +vsync interlaced 
               VertFreq: 50 Hz, HorFreq: 28125 Hz
Detailed mode: Clock 27.000 MHz, 708 mm x 398 mm
                720  736  798  858 hborder 0
                480  489  495  525 vborder 0
               -hsync -vsync 
               VertFreq: 59 Hz, HorFreq: 31468 Hz
Detailed mode: Clock 27.000 MHz, 708 mm x 398 mm
                720  732  796  864 hborder 0
                576  581  586  625 vborder 0
               -hsync -vsync 
               VertFreq: 50 Hz, HorFreq: 31250 Hz
Checksum: 0xfb (valid)

One or more of the timings is out of range of the Monitor Ranges:
  Vertical Freq: 50 - 70 Hz
  Horizontal Freq: 15625 - 67500 Hz
  Maximum Clock: 148.500 MHz
