edid-decode (hex):

00 ff ff ff ff ff ff 00 4c a3 4b 31 00 00 00 00
00 12 01 03 80 29 17 78 0a 8a d5 96 57 54 89 26
1f 50 54 00 00 00 01 01 01 01 01 01 01 01 01 01
01 01 01 01 01 01 88 2f 90 90 61 b1 1e 30 30 20
26 00 99 e6 10 00 00 19 00 00 00 0f 00 00 00 00
00 00 00 00 00 32 a0 05 1b 00 00 00 00 fe 00 53
41 4d 53 55 4e 47 0a 20 20 20 20 20 00 00 00 fe
00 4c 54 4e 31 38 34 4b 54 30 31 31 30 31 00 ea

----------------

Block 0, Base EDID:
  EDID Structure Version & Revision: 1.3
  Vendor & Product Identification:
    Manufacturer: SEC
    Model: 12619
    Made in: 2008
  Basic Display Parameters & Features:
    Digital display
    Maximum image size: 41 cm x 23 cm
    Gamma: 2.20
    RGB color display
    First detailed timing is preferred timing
  Color Characteristics:
    Red  : 0.5878, 0.3398
    Green: 0.3300, 0.5371
    Blue : 0.1513, 0.1220
    White: 0.3134, 0.3291
  Established Timings I & II: none
  Standard Timings: none
  Detailed Timing Descriptors:
    DTD 1:  1680x945    60.000 Hz  16:9    58.500 kHz 121.680 MHz (409 mm x 230 mm)
                 Hfront   48 Hsync  32 Hback 320 Hpol N
                 Vfront    2 Vsync   6 Vback  22 Vpol N
    Manufacturer-Specified Display Descriptor (0x0f): 00 0f 00 00 00 00 00 00 00 00 00 32 a0 05 1b 00 '...........2....'
    Alphanumeric Data String: 'SAMSUNG'
    Alphanumeric Data String: 'LTN184KT01101'
Checksum: 0xea

----------------

Failures:

Block 0, Base EDID:
  Missing Display Product Name.
  Missing Display Range Limits Descriptor.

EDID conformity: FAIL
