edid-decode (hex):

00 ff ff ff ff ff ff 00 4c a3 4b 31 00 00 00 00
00 15 01 03 80 22 13 78 0a cc 95 9f 57 53 94 27
0f 50 54 00 00 00 01 01 01 01 01 01 01 01 01 01
01 01 01 01 01 01 38 27 40 c0 60 84 20 30 30 20
25 00 58 c2 10 00 00 19 00 00 00 0f 00 00 00 00
00 00 00 00 00 40 80 09 16 00 00 00 00 fe 00 53
41 4d 53 55 4e 47 0a 20 20 20 20 20 00 00 00 fe
00 4c 54 4e 31 35 36 4b 54 30 36 38 0a 20 00 35

----------------

Block 0, Base EDID:
  EDID Structure Version & Revision: 1.3
  Vendor & Product Identification:
    Manufacturer: SEC
    Model: 12619
    Made in: 2011
  Basic Display Parameters & Features:
    Digital display
    Maximum image size: 34 cm x 19 cm
    Gamma: 2.20
    RGB color display
    First detailed timing is the preferred timing
  Color Characteristics:
    Red  : 0.6240, 0.3398
    Green: 0.3271, 0.5781
    Blue : 0.1542, 0.0595
    White: 0.3134, 0.3291
  Established Timings I & II: none
  Standard Timings: none
  Detailed Timing Descriptors:
    DTD 1:  1600x900    60.114577 Hz  16:9     56.027 kHz    100.400000 MHz (344 mm x 194 mm)
                 Hfront   48 Hsync  32 Hback  112 Hpol N
                 Vfront    2 Vsync   5 Vback   25 Vpol N
    Manufacturer-Specified Display Descriptor (0x0f): 00 0f 00 00 00 00 00 00 00 00 00 40 80 09 16 00 '...........@....'
    Alphanumeric Data String: 'SAMSUNG'
    Alphanumeric Data String: 'LTN156KT068'
Checksum: 0x35

----------------

Failures:

Block 0, Base EDID:
  Missing Display Product Name.
  Missing Display Range Limits Descriptor.

EDID conformity: FAIL
