
EDID (hex):
00ffffffffffff005a631c7101010101
15100104a5291a7826d7a5a2594a9624
145054bfef00950081808140714f6159
4559315901019a29a0d0518422305098
36009a001100001c000000ff00505736
3036323131313433300a000000fd0032
551e520e000a202020202020000000fc
005641313931327753455249455300d7

Extracted contents:
header:          00 ff ff ff ff ff ff 00
serial number:   5a 63 1c 71 01 01 01 01 15 10
version:         01 04
basic params:    a5 29 1a 78 26
chroma info:     d7 a5 a2 59 4a 96 24 14 50 54
established:     bf ef 00
standard:        95 00 81 80 81 40 71 4f 61 59 45 59 31 59 01 01
descriptor 1:    9a 29 a0 d0 51 84 22 30 50 98 36 00 9a 00 11 00 00 1c
descriptor 2:    00 00 00 ff 00 50 57 36 30 36 32 31 31 31 34 33 30 0a
descriptor 3:    00 00 00 fd 00 32 55 1e 52 0e 00 0a 20 20 20 20 20 20
descriptor 4:    00 00 00 fc 00 56 41 31 39 31 32 77 53 45 52 49 45 53
extensions:      00
checksum:        d7

EDID version: 1.4
Manufacturer: VSC Model 711c Serial Number --
Made in week 21 of 2006
Digital display
8 bits per primary color channel
DisplayPort interface
Maximum image size: 41 cm x 26 cm
Gamma: 2.20
DPMS levels: Off
Supported color formats: RGB 4:4:4
Default (sRGB) color space is primary color space
First detailed timing includes the native pixel format and preferred refresh rate
Display x,y Chromaticity:
  Red:   0.6357, 0.3486
  Green: 0.2900, 0.5888
  Blue:  0.1425, 0.0800
  White: 0.3134, 0.3291
Established timings supported:
  720x400@70Hz 9:5 HorFreq: 31469 Hz Clock: 28.320 MHz
  640x480@60Hz 4:3 HorFreq: 31469 Hz Clock: 25.175 MHz
  640x480@67Hz 4:3 HorFreq: 35000 Hz Clock: 30.240 MHz
  640x480@72Hz 4:3 HorFreq: 37900 Hz Clock: 31.500 MHz
  640x480@75Hz 4:3 HorFreq: 37500 Hz Clock: 31.500 MHz
  800x600@56Hz 4:3 HorFreq: 35200 Hz Clock: 36.000 MHz
  800x600@60Hz 4:3 HorFreq: 37900 Hz Clock: 40.000 MHz
  800x600@72Hz 4:3 HorFreq: 48100 Hz Clock: 50.000 MHz
  800x600@75Hz 4:3 HorFreq: 46900 Hz Clock: 49.500 MHz
  832x624@75Hz 4:3 HorFreq: 49726 Hz Clock: 57.284 MHz
  1024x768@60Hz 4:3 HorFreq: 48400 Hz Clock: 65.000 MHz
  1024x768@70Hz 4:3 HorFreq: 56500 Hz Clock: 75.000 MHz
  1024x768@75Hz 4:3 HorFreq: 60000 Hz Clock: 78.750 MHz
  1280x1024@75Hz 5:4 HorFreq: 80000 Hz Clock: 135.000 MHz
Standard timings supported:
  1440x900@60Hz 16:10 HorFreq: 55500 Hz Clock: 88.750 MHz
  1280x1024@60Hz 5:4 HorFreq: 64000 Hz Clock: 108.000 MHz
  1280x960@60Hz 4:3 HorFreq: 60000 Hz Clock: 108.000 MHz
  1152x864@75Hz 4:3 HorFreq: 67500 Hz Clock: 108.000 MHz
  1024x768@85Hz 4:3 HorFreq: 68700 Hz Clock: 94.500 MHz
  800x600@85Hz 4:3 HorFreq: 53700 Hz Clock: 56.250 MHz
  640x480@85Hz 4:3 HorFreq: 43300 Hz Clock: 36.000 MHz
Detailed mode: Clock 106.500 MHz, 410 mm x 256 mm
               1440 1520 1672 1904 hborder 0
                900  903  909  934 vborder 0
               -hsync +vsync 
               VertFreq: 59 Hz, HorFreq: 55934 Hz
Serial number: --
Monitor ranges (GTF): 50-85Hz V, 30-82kHz H, max dotclock 140MHz
Checksum: 0xd7 (valid)
EDID block does NOT conform to EDID 1.4!
	sRGB is signaled, but the chromaticities do not match
	Name descriptor not terminated with a newline


