edid-decode (hex):

00 ff ff ff ff ff ff 00 06 af 18 17 00 00 00 00
1a 1d 01 04 a5 22 13 78 03 91 05 a3 54 4b 99 27
0f 50 54 00 00 00 01 01 01 01 01 01 01 01 01 01
01 01 01 01 01 01 64 d2 00 a0 f0 70 54 80 30 20
35 00 58 c1 10 00 00 18 43 8c 00 a0 f0 70 54 80
30 20 35 00 58 c1 10 00 00 18 00 00 00 00 00 00
00 00 00 00 00 00 00 00 00 00 00 00 00 00 00 02
00 0c 2d ff 10 3c c8 5c 0a 1f c8 20 20 20 00 02

----------------

Block 0, Base EDID:
  EDID Structure Version & Revision: 1.4
  Vendor & Product Identification:
    Manufacturer: AUO
    Model: 5912
    Made in: week 26 of 2019
  Basic Display Parameters & Features:
    Digital display
    Bits per primary color channel: 8
    DisplayPort interface
    Maximum image size: 34 cm x 19 cm
    Gamma: 2.20
    Supported color formats: RGB 4:4:4
    First detailed timing includes the native pixel format and preferred refresh rate
    Display is continuous frequency
  Color Characteristics:
    Red  : 0.6386, 0.3291
    Green: 0.2929, 0.5986
    Blue : 0.1523, 0.0585
    White: 0.3134, 0.3291
  Established Timings I & II: none
  Standard Timings: none
  Detailed Timing Descriptors:
    DTD 1:  3840x2160   60.004 Hz  16:9   134.650 kHz 538.600 MHz (344 mm x 193 mm)
                 Hfront   48 Hsync  32 Hback  80 Hpol N
                 Vfront    3 Vsync   5 Vback  76 Vpol N
    DTD 2:  3840x2160   40.003 Hz  16:9    89.767 kHz 359.070 MHz (344 mm x 193 mm)
                 Hfront   48 Hsync  32 Hback  80 Hpol N
                 Vfront    3 Vsync   5 Vback  76 Vpol N
    Empty Descriptor
    Manufacturer-Specified Display Descriptor (0x02): 00 02 00 0c 2d ff 10 3c c8 5c 0a 1f c8 20 20 20 '....-..<.\...   '
Checksum: 0x02

----------------

Failures:

Block 0, Base EDID:
  Empty Descriptor: Use Dummy Descriptor instead of all zeroes.
  Missing Display Product Name.
  Missing Display Range Limits Descriptor.

EDID conformity: FAIL
