
EDID (hex):
00ffffffffffff0006b3002701010101
191f0104a53c22783bff15a6534a9826
0f5054bf4f00714f818081409500a940
b300d100e1c0565e00a0a0a029503020
350055502100001a000000fd002e4b70
701e010a202020202020000000fc0050
4132373851560a2020202020000000ff
004d364c4d51533131303132310a0114
02031af14a900403021112131f051423
09070783010000e2006a0e1f00805100
1e304080370055502100001c9774006e
a0a034501720680855502100001a9e20
009051201f304880360055502100001c
cd4600a0a0381f4030203a0055502100
001a0000000000000000000000000000
0000000000000000000000000000006a

edid-decode (hex):

00 ff ff ff ff ff ff 00 06 b3 00 27 01 01 01 01
19 1f 01 04 a5 3c 22 78 3b ff 15 a6 53 4a 98 26
0f 50 54 bf 4f 00 71 4f 81 80 81 40 95 00 a9 40
b3 00 d1 00 e1 c0 56 5e 00 a0 a0 a0 29 50 30 20
35 00 55 50 21 00 00 1a 00 00 00 fd 00 2e 4b 70
70 1e 01 0a 20 20 20 20 20 20 00 00 00 fc 00 50
41 32 37 38 51 56 0a 20 20 20 20 20 00 00 00 ff
00 4d 36 4c 4d 51 53 31 31 30 31 32 31 0a 01 14

02 03 1a f1 4a 90 04 03 02 11 12 13 1f 05 14 23
09 07 07 83 01 00 00 e2 00 6a 0e 1f 00 80 51 00
1e 30 40 80 37 00 55 50 21 00 00 1c 97 74 00 6e
a0 a0 34 50 17 20 68 08 55 50 21 00 00 1a 9e 20
00 90 51 20 1f 30 48 80 36 00 55 50 21 00 00 1c
cd 46 00 a0 a0 38 1f 40 30 20 3a 00 55 50 21 00
00 1a 00 00 00 00 00 00 00 00 00 00 00 00 00 00
00 00 00 00 00 00 00 00 00 00 00 00 00 00 00 6a

----------------

Block 0, Base EDID:
  EDID Structure Version & Revision: 1.4
  Vendor & Product Identification:
    Manufacturer: AUS
    Model: 9984
    Serial Number: 16843009
    Made in: week 25 of 2021
  Basic Display Parameters & Features:
    Digital display
    Bits per primary color channel: 8
    DisplayPort interface
    Maximum image size: 60 cm x 34 cm
    Gamma: 2.20
    DPMS levels: Off
    Supported color formats: RGB 4:4:4, YCrCb 4:4:4, YCrCb 4:2:2
    First detailed timing includes the native pixel format and preferred refresh rate
    Display is continuous frequency
  Color Characteristics:
    Red  : 0.6513, 0.3271
    Green: 0.2919, 0.5966
    Blue : 0.1484, 0.0595
    White: 0.3134, 0.3291
  Established Timings I & II:
    IBM     :   720x400    70.081663 Hz   9:5     31.467 kHz     28.320000 MHz
    DMT 0x04:   640x480    59.940476 Hz   4:3     31.469 kHz     25.175000 MHz
    Apple   :   640x480    66.666667 Hz   4:3     35.000 kHz     30.240000 MHz
    DMT 0x05:   640x480    72.808802 Hz   4:3     37.861 kHz     31.500000 MHz
    DMT 0x06:   640x480    75.000000 Hz   4:3     37.500 kHz     31.500000 MHz
    DMT 0x08:   800x600    56.250000 Hz   4:3     35.156 kHz     36.000000 MHz
    DMT 0x09:   800x600    60.316541 Hz   4:3     37.879 kHz     40.000000 MHz
    DMT 0x0b:   800x600    75.000000 Hz   4:3     46.875 kHz     49.500000 MHz
    DMT 0x10:  1024x768    60.003840 Hz   4:3     48.363 kHz     65.000000 MHz
    DMT 0x11:  1024x768    70.069359 Hz   4:3     56.476 kHz     75.000000 MHz
    DMT 0x12:  1024x768    75.028582 Hz   4:3     60.023 kHz     78.750000 MHz
    DMT 0x24:  1280x1024   75.024675 Hz   5:4     79.976 kHz    135.000000 MHz
  Standard Timings:
    DMT 0x15:  1152x864    75.000000 Hz   4:3     67.500 kHz    108.000000 MHz
    DMT 0x23:  1280x1024   60.019740 Hz   5:4     63.981 kHz    108.000000 MHz
    DMT 0x20:  1280x960    60.000000 Hz   4:3     60.000 kHz    108.000000 MHz
    DMT 0x2f:  1440x900    59.887445 Hz  16:10    55.935 kHz    106.500000 MHz
    DMT 0x33:  1600x1200   60.000000 Hz   4:3     75.000 kHz    162.000000 MHz
    DMT 0x3a:  1680x1050   59.954250 Hz  16:10    65.290 kHz    146.250000 MHz
    DMT 0x45:  1920x1200   59.884600 Hz  16:10    74.556 kHz    193.250000 MHz
    DMT 0x54:  2048x1152   60.000000 Hz  16:9     72.000 kHz    162.000000 MHz (RB)
  Detailed Timing Descriptors:
    DTD 1:  2560x1440   59.950550 Hz  16:9     88.787 kHz    241.500000 MHz (597 mm x 336 mm)
                 Hfront   48 Hsync  32 Hback   80 Hpol P
                 Vfront    3 Vsync   5 Vback   33 Vpol N
    Display Range Limits:
      Monitor ranges (Bare Limits): 46-75 Hz V, 112-112 kHz H, max dotclock 300 MHz
    Display Product Name: 'PA278QV'
    Display Product Serial Number: 'M6LMQS110121'
  Extension blocks: 1
Checksum: 0x14

----------------

Block 1, CTA-861 Extension Block:
  Revision: 3
  Underscans IT Video Formats by default
  Basic audio support
  Supports YCbCr 4:4:4
  Supports YCbCr 4:2:2
  Native detailed modes: 1
  Video Data Block:
    VIC  16:  1920x1080   60.000000 Hz  16:9     67.500 kHz    148.500000 MHz (native)
    VIC   4:  1280x720    60.000000 Hz  16:9     45.000 kHz     74.250000 MHz
    VIC   3:   720x480    59.940060 Hz  16:9     31.469 kHz     27.000000 MHz
    VIC   2:   720x480    59.940060 Hz   4:3     31.469 kHz     27.000000 MHz
    VIC  17:   720x576    50.000000 Hz   4:3     31.250 kHz     27.000000 MHz
    VIC  18:   720x576    50.000000 Hz  16:9     31.250 kHz     27.000000 MHz
    VIC  19:  1280x720    50.000000 Hz  16:9     37.500 kHz     74.250000 MHz
    VIC  31:  1920x1080   50.000000 Hz  16:9     56.250 kHz    148.500000 MHz
    VIC   5:  1920x1080i  60.000000 Hz  16:9     33.750 kHz     74.250000 MHz
    VIC  20:  1920x1080i  50.000000 Hz  16:9     28.125 kHz     74.250000 MHz
  Audio Data Block:
    Linear PCM:
      Max channels: 2
      Supported sample rates (kHz): 48 44.1 32
      Supported sample sizes (bits): 24 20 16
  Speaker Allocation Data Block:
    FL/FR - Front Left/Right
  Video Capability Data Block:
    YCbCr quantization: No Data
    RGB quantization: Selectable (via AVI Q)
    PT scan behavior: Always Underscanned
    IT scan behavior: Always Underscanned
    CE scan behavior: Always Underscanned
  Detailed Timing Descriptors:
    DTD 2:  1280x768    59.870228 Hz   5:3     47.776 kHz     79.500000 MHz (597 mm x 336 mm)
                 Hfront   64 Hsync 128 Hback  192 Hpol N
                 Vfront    3 Vsync   7 Vback   20 Vpol P
    DTD 3:  2560x1440   74.923939 Hz  16:9    111.787 kHz    298.470000 MHz (597 mm x 336 mm)
                 Hfront   23 Hsync  32 Hback   55 Hpol P
                 Vfront   38 Vsync   8 Vback    6 Vpol N
    DTD 4:  1280x800    59.810326 Hz  16:10    49.702 kHz     83.500000 MHz (597 mm x 336 mm)
                 Hfront   72 Hsync 128 Hback  200 Hpol N
                 Vfront    3 Vsync   6 Vback   22 Vpol P
    DTD 5:  2560x1080   59.978424 Hz  64:27    66.636 kHz    181.250000 MHz (597 mm x 336 mm)
                 Hfront   48 Hsync  32 Hback   80 Hpol P
                 Vfront    3 Vsync  10 Vback   18 Vpol N
Checksum: 0x6a  Unused space in Extension Block: 29 bytes
