
EDID (hex):
00ffffffffffff0022f0633001010101
0c180104a5331d7826dd45a3554fa027
125054a1080081c081809500a9c0b300
d1c001010101023a801871382d40582c
4500fd1e1100001e000000fd00324c18
5e14000a202020202020000000fc0048
5020453233310a2020202020000000ff
0033435134313230514c4b0a202000c6

Extracted contents:
header:          00 ff ff ff ff ff ff 00
serial number:   22 f0 63 30 01 01 01 01 0c 18
version:         01 04
basic params:    a5 33 1d 78 26
chroma info:     dd 45 a3 55 4f a0 27 12 50 54
established:     a1 08 00
standard:        81 c0 81 80 95 00 a9 c0 b3 00 d1 c0 01 01 01 01
descriptor 1:    02 3a 80 18 71 38 2d 40 58 2c 45 00 fd 1e 11 00 00 1e
descriptor 2:    00 00 00 fd 00 32 4c 18 5e 14 00 0a 20 20 20 20 20 20
descriptor 3:    00 00 00 fc 00 48 50 20 45 32 33 31 0a 20 20 20 20 20
descriptor 4:    00 00 00 ff 00 33 43 51 34 31 32 30 51 4c 4b 0a 20 20
extensions:      00
checksum:        c6

EDID version: 1.4
Manufacturer: HWP Model 3063 Serial Number --
Made in week 12 of 2014
Digital display
8 bits per primary color channel
DisplayPort interface
Maximum image size: 51 cm x 29 cm
Gamma: 2.20
DPMS levels: Off
Supported color formats: RGB 4:4:4
Default (sRGB) color space is primary color space
First detailed timing includes the native pixel format and preferred refresh rate
Display x,y Chromaticity:
  Red:   0.6396, 0.3330
  Green: 0.3115, 0.6259
  Blue:  0.1533, 0.0703
  White: 0.3134, 0.3291
Established timings supported:
  720x400@70Hz 9:5 HorFreq: 31469 Hz Clock: 28.320 MHz
  640x480@60Hz 4:3 HorFreq: 31469 Hz Clock: 25.175 MHz
  800x600@60Hz 4:3 HorFreq: 37900 Hz Clock: 40.000 MHz
  1024x768@60Hz 4:3 HorFreq: 48400 Hz Clock: 65.000 MHz
Standard timings supported:
  1280x720@60Hz 16:9
  1280x1024@60Hz 5:4 HorFreq: 64000 Hz Clock: 108.000 MHz
  1440x900@60Hz 16:10 HorFreq: 55500 Hz Clock: 88.750 MHz
  1600x900@60Hz 16:9
  1680x1050@60Hz 16:10 HorFreq: 64700 Hz Clock: 119.000 MHz
  1920x1080@60Hz 16:9
Detailed mode: Clock 148.500 MHz, 509 mm x 286 mm
               1920 2008 2052 2200 hborder 0
               1080 1084 1089 1125 vborder 0
               +hsync +vsync 
               VertFreq: 60 Hz, HorFreq: 67500 Hz
Monitor ranges (GTF): 50-76Hz V, 24-94kHz H, max dotclock 200MHz
Monitor name: HP E231
Serial number: --
Checksum: 0xc6 (valid)
EDID block does NOT conform to EDID 1.4!
	sRGB is signaled, but the chromaticities do not match
