edid-decode (hex):

00 ff ff ff ff ff ff 00 04 72 27 00 9b 89 60 94
2e 13 01 03 68 2f 1e 78 2a c7 20 a4 55 49 99 27
13 50 54 bf ef 80 71 4f 81 80 95 0f 95 00 a9 40
b3 00 81 00 01 01 21 39 90 30 62 1a 27 40 18 b0
36 40 d9 28 11 00 00 1c 00 00 00 ff 00 4c 43 33
30 38 31 31 33 34 32 31 37 0a 00 00 00 fd 00 38
4c 1e 53 11 00 0a 20 20 20 20 20 20 00 00 00 fc
00 41 63 65 72 20 56 32 32 33 57 0a 20 20 00 dd

00 ff ff ff ff ff ff 00 04 72 27 00 9b 89 60 94
2e 13 01 03 68 2f 1e 78 2a c7 20 a4 55 49 99 27
13 50 54 bf ef 80 71 4f 81 80 95 0f 95 00 a9 40
b3 00 81 00 01 01 21 39 90 30 62 1a 27 40 18 b0
36 40 d9 28 11 00 00 1c 00 00 00 ff 00 4c 43 33
30 38 31 31 33 34 32 31 37 0a 00 00 00 fd 00 38
4c 1e 53 11 00 0a 20 20 20 20 20 20 00 00 00 fc
00 41 63 65 72 20 56 32 32 33 57 0a 20 20 00 dd

----------------

Block 0, Base EDID:
  EDID Structure Version & Revision: 1.3
  Vendor & Product Identification:
    Manufacturer: ACR
    Model: 39
    Serial Number: ...
    Made in: week 46 of 2009
  Basic Display Parameters & Features:
    Analog display
    Signal Level Standard: 0.700 : 0.000 : 0.700 V p-p
    Blank level equals black level
    Sync: Separate
    Maximum image size: 47 cm x 30 cm
    Gamma: 2.20
    DPMS levels: Off
    RGB color display
    First detailed timing is the preferred timing
  Color Characteristics:
    Red  : 0.6435, 0.3320
    Green: 0.2861, 0.6005
    Blue : 0.1523, 0.0761
    White: 0.3125, 0.3281
  Established Timings I & II:
    IBM     :   720x400    70.081663 Hz   9:5     31.467 kHz     28.320000 MHz
    DMT 0x04:   640x480    59.940476 Hz   4:3     31.469 kHz     25.175000 MHz
    Apple   :   640x480    66.666667 Hz   4:3     35.000 kHz     30.240000 MHz
    DMT 0x05:   640x480    72.808802 Hz   4:3     37.861 kHz     31.500000 MHz
    DMT 0x06:   640x480    75.000000 Hz   4:3     37.500 kHz     31.500000 MHz
    DMT 0x08:   800x600    56.250000 Hz   4:3     35.156 kHz     36.000000 MHz
    DMT 0x09:   800x600    60.316541 Hz   4:3     37.879 kHz     40.000000 MHz
    DMT 0x0a:   800x600    72.187572 Hz   4:3     48.077 kHz     50.000000 MHz
    DMT 0x0b:   800x600    75.000000 Hz   4:3     46.875 kHz     49.500000 MHz
    Apple   :   832x624    74.551266 Hz   4:3     49.726 kHz     57.284000 MHz
    DMT 0x10:  1024x768    60.003840 Hz   4:3     48.363 kHz     65.000000 MHz
    DMT 0x11:  1024x768    70.069359 Hz   4:3     56.476 kHz     75.000000 MHz
    DMT 0x12:  1024x768    75.028582 Hz   4:3     60.023 kHz     78.750000 MHz
    DMT 0x24:  1280x1024   75.024675 Hz   5:4     79.976 kHz    135.000000 MHz
    Apple   :  1152x870    75.061550 Hz 192:145   68.681 kHz    100.000000 MHz
  Standard Timings:
    DMT 0x15:  1152x864    75.000000 Hz   4:3     67.500 kHz    108.000000 MHz
    DMT 0x23:  1280x1024   60.019740 Hz   5:4     63.981 kHz    108.000000 MHz
    DMT 0x30:  1440x900    74.984427 Hz  16:10    70.635 kHz    136.750000 MHz
    DMT 0x2f:  1440x900    59.887445 Hz  16:10    55.935 kHz    106.500000 MHz
    DMT 0x33:  1600x1200   60.000000 Hz   4:3     75.000 kHz    162.000000 MHz
    DMT 0x3a:  1680x1050   59.954250 Hz  16:10    65.290 kHz    146.250000 MHz
    DMT 0x1c:  1280x800    59.810326 Hz  16:10    49.702 kHz     83.500000 MHz
  Detailed Timing Descriptors:
    DTD 1:  1680x1050   59.954250 Hz  16:10    65.290 kHz    146.250000 MHz (473 mm x 296 mm)
                 Hfront  280 Hsync 176 Hback  104 Hpol N
                 Vfront    3 Vsync   6 Vback   30 Vpol P
    Display Product Serial Number: ...
    Display Range Limits:
      Monitor ranges (GTF): 56-76 Hz V, 30-83 kHz H, max dotclock 170 MHz
    Display Product Name: 'Acer V223W'
Checksum: 0xdd

----------------

Block 1, Unknown EDID Extension Block 0x00:
  00 ff ff ff ff ff ff 00 04 72 27 00 9b 89 60 94 '.........r'...`.'
  2e 13 01 03 68 2f 1e 78 2a c7 20 a4 55 49 99 27 '....h/.x*. .UI.''
  13 50 54 bf ef 80 71 4f 81 80 95 0f 95 00 a9 40 '.PT...qO.......@'
  b3 00 81 00 01 01 21 39 90 30 62 1a 27 40 18 b0 '......!9.0b.'@..'
  36 40 d9 28 11 00 00 1c 00 00 00 ff 00 4c 43 33 '6@.(.........LC3'
  30 38 31 31 33 34 32 31 37 0a 00 00 00 fd 00 38 '081134217......8'
  4c 1e 53 11 00 0a 20 20 20 20 20 20 00 00 00 fc 'L.S...      ....'
  00 41 63 65 72 20 56 32 32 33 57 0a 20 20 00 dd '.Acer V223W.  ..'
Checksum: 0xdd

----------------

Warnings:

Block 0, Base EDID:
  Detailed Timing Descriptor #1: DTD is similar but not identical to DMT 0x3a.

Failures:

Block 1, Base EDID:
  Unknown Extension Block.
EDID:
  Base EDID: EDID specified 0 extension block(s), but found 1 extension block(s).

EDID conformity: FAIL
