
EDID (hex):
00ffffffffffff0006afec2300000000
001401049022137802c8959e57549226
0f505400000001010101010101010101
010101010101261b5646500026302018
340058c11000001a261b56fe51009e30
2018340058c11000001a000000fe0033
584a4447804231353658573200000000
00004122960111000001010a20200040

Extracted contents:
header:          00 ff ff ff ff ff ff 00
serial number:   06 af ec 23 00 00 00 00 00 14
version:         01 04
basic params:    90 22 13 78 02
chroma info:     c8 95 9e 57 54 92 26 0f 50 54
established:     00 00 00
standard:        01 01 01 01 01 01 01 01 01 01 01 01 01 01 01 01
descriptor 1:    26 1b 56 46 50 00 26 30 20 18 34 00 58 c1 10 00 00 1a
descriptor 2:    26 1b 56 fe 51 00 9e 30 20 18 34 00 58 c1 10 00 00 1a
descriptor 3:    00 00 00 fe 00 33 58 4a 44 47 80 42 31 35 36 58 57 32
descriptor 4:    00 00 00 00 00 00 41 22 96 01 11 00 00 01 01 0a 20 20
extensions:      00
checksum:        40

EDID version: 1.4
Manufacturer: AUO Model 23ec Serial Number --
Made in year 2010
Digital display
6 bits per primary color channel
Digital interface is not defined
Maximum image size: 34 cm x 19 cm
Gamma: 2.20
Supported color formats: RGB 4:4:4
First detailed timing includes the native pixel format and preferred refresh rate
Display x,y Chromaticity:
  Red:   0.6201, 0.3398
  Green: 0.3300, 0.5703
  Blue:  0.1503, 0.0595
  White: 0.3134, 0.3291
Established timings supported:
Standard timings supported:
Detailed mode: Clock 69.500 MHz, 344 mm x 193 mm
               1366 1398 1422 1436 hborder 0
                768  771  775  806 vborder 0
               +hsync -vsync 
               VertFreq: 60 Hz, HorFreq: 48398 Hz
Detailed mode: Clock 69.500 MHz, 344 mm x 193 mm
               1366 1398 1422 1876 hborder 0
                768  771  775  926 vborder 0
               +hsync -vsync 
               VertFreq: 40 Hz, HorFreq: 37046 Hz
ASCII string: 3XJDG
Manufacturer-specified data, tag 0
Checksum: 0x40 (valid)
EDID block does NOT conform to EDID 1.4!
	Missing name descriptor
	Missing monitor ranges
	Detailed block string not properly terminated


