
EDID (hex):
00ffffffffffff000daf161000000000
3313010380160c780a0ac5925a569127
20505400000001010101010101010101
0101010101012d1100a0405813203020
3a00de7d00000018000000fe004e3130
314c362d4c30420a2020000000fe0043
4d4f0a202020202020202020000000fe
004e3130314c362d4c30420a20200042

Extracted contents:
header:          00 ff ff ff ff ff ff 00
serial number:   0d af 16 10 00 00 00 00 33 13
version:         01 03
basic params:    80 16 0c 78 0a
chroma info:     0a c5 92 5a 56 91 27 20 50 54
established:     00 00 00
standard:        01 01 01 01 01 01 01 01 01 01 01 01 01 01 01 01
descriptor 1:    2d 11 00 a0 40 58 13 20 30 20 3a 00 de 7d 00 00 00 18
descriptor 2:    00 00 00 fe 00 4e 31 30 31 4c 36 2d 4c 30 42 0a 20 20
descriptor 3:    00 00 00 fe 00 43 4d 4f 0a 20 20 20 20 20 20 20 20 20
descriptor 4:    00 00 00 fe 00 4e 31 30 31 4c 36 2d 4c 30 42 0a 20 20
extensions:      00
checksum:        42

EDID version: 1.3
Manufacturer: CMO Model 1016 Serial Number --
Made in week 51 of 2009
Digital display
Maximum image size: 22 cm x 12 cm
Gamma: 2.20
RGB color display
First detailed timing is preferred timing
Display x,y Chromaticity:
  Red:   0.5703, 0.3515
  Green: 0.3378, 0.5683
  Blue:  0.1552, 0.1250
  White: 0.3134, 0.3291
Established timings supported:
Standard timings supported:
Detailed mode: Clock 43.970 MHz, 222 mm x 125 mm
               1024 1072 1104 1184 hborder 0
                600  603  613  619 vborder 0
               -hsync -vsync 
               VertFreq: 59 Hz, HorFreq: 37136 Hz
ASCII string: N101L6-L0B
ASCII string: CMO
ASCII string: N101L6-L0B
Checksum: 0x42 (valid)
EDID block does NOT conform to EDID 1.3!
	Missing name descriptor
	Missing monitor ranges
