
EDID (hex):
00ffffffffffff001ab3f30701010101
0b160103682f1e782ac665a059589d27
0e5054a54b0081809500010101010101
01010101010121399030621a274068b0
3600da281100001c000000fc00423232
572d36204c45440a2020000000fd0038
4c1e5210000a202020202020000000ff
00595633553138373034300a202000a7

Extracted contents:
header:          00 ff ff ff ff ff ff 00
serial number:   1a b3 f3 07 01 01 01 01 0b 16
version:         01 03
basic params:    68 2f 1e 78 2a
chroma info:     c6 65 a0 59 58 9d 27 0e 50 54
established:     a5 4b 00
standard:        81 80 95 00 01 01 01 01 01 01 01 01 01 01 01 01
descriptor 1:    21 39 90 30 62 1a 27 40 68 b0 36 00 da 28 11 00 00 1c
descriptor 2:    00 00 00 fc 00 42 32 32 57 2d 36 20 4c 45 44 0a 20 20
descriptor 3:    00 00 00 fd 00 38 4c 1e 52 10 00 0a 20 20 20 20 20 20
descriptor 4:    00 00 00 ff 00 59 56 33 55 31 38 37 30 34 30 0a 20 20
extensions:      00
checksum:        a7

EDID version: 1.3
Manufacturer: FUS Model 7f3 Serial Number --
Made in week 11 of 2012
Analog display, Input voltage level: 0.7/0.7 V
Sync: Separate 
Maximum image size: 47 cm x 30 cm
Gamma: 2.20
DPMS levels: Off
RGB color display
First detailed timing is preferred timing
Display x,y Chromaticity:
  Red:   0.6279, 0.3476
  Green: 0.3447, 0.6152
  Blue:  0.1533, 0.0566
  White: 0.3134, 0.3291
Established timings supported:
  720x400@70Hz 9:5 HorFreq: 31469 Hz Clock: 28.320 MHz
  640x480@60Hz 4:3 HorFreq: 31469 Hz Clock: 25.175 MHz
  640x480@75Hz 4:3 HorFreq: 37500 Hz Clock: 31.500 MHz
  800x600@60Hz 4:3 HorFreq: 37900 Hz Clock: 40.000 MHz
  800x600@75Hz 4:3 HorFreq: 46900 Hz Clock: 49.500 MHz
  1024x768@60Hz 4:3 HorFreq: 48400 Hz Clock: 65.000 MHz
  1024x768@75Hz 4:3 HorFreq: 60000 Hz Clock: 78.750 MHz
  1280x1024@75Hz 5:4 HorFreq: 80000 Hz Clock: 135.000 MHz
Standard timings supported:
  1280x1024@60Hz 5:4 HorFreq: 64000 Hz Clock: 108.000 MHz
  1440x900@60Hz 16:10 HorFreq: 55500 Hz Clock: 88.750 MHz
Detailed mode: Clock 146.250 MHz, 474 mm x 296 mm
               1680 1784 1960 2240 hborder 0
               1050 1053 1059 1089 vborder 0
               -hsync +vsync 
               VertFreq: 59 Hz, HorFreq: 65290 Hz
Monitor name: B22W-6 LED
Monitor ranges (GTF): 56-76Hz V, 30-82kHz H, max dotclock 160MHz
Serial number: --
Checksum: 0xa7 (valid)


