edid-decode (hex):

00 ff ff ff ff ff ff 00 20 34 53 19 00 00 00 00
2d 1c 01 03 80 2b 18 78 ea d6 a5 a2 59 4a 95 24
14 50 54 af cf 00 81 00 81 40 90 40 a9 c0 81 80
81 c0 95 00 b3 00 02 3a 80 18 71 38 2d 40 58 2c
45 00 b0 f3 10 00 00 1c 0e 1f 00 80 51 00 1e 30
30 20 37 00 90 0e 11 00 00 1c 66 21 56 aa 51 00
1e 30 46 8f 33 00 aa ef 10 00 00 1e 00 00 00 fc
00 47 54 2d 31 39 31 0a 20 20 20 20 20 20 00 e2

----------------

Block 0, Base EDID:
  EDID Structure Version & Revision: 1.3
  Vendor & Product Identification:
    Manufacturer: HAT
    Model: 6483
    Made in: week 45 of 2018
  Basic Display Parameters & Features:
    Digital display
    Maximum image size: 43 cm x 24 cm
    Gamma: 2.20
    DPMS levels: Standby Suspend Off
    RGB color display
    First detailed timing is the preferred timing
  Color Characteristics:
    Red  : 0.6357, 0.3486
    Green: 0.2900, 0.5839
    Blue : 0.1425, 0.0800
    White: 0.3134, 0.3291
  Established Timings I & II:
    IBM     :   720x400    70.081663 Hz   9:5     31.467 kHz     28.320000 MHz
    DMT 0x04:   640x480    59.940476 Hz   4:3     31.469 kHz     25.175000 MHz
    DMT 0x05:   640x480    72.808802 Hz   4:3     37.861 kHz     31.500000 MHz
    DMT 0x06:   640x480    75.000000 Hz   4:3     37.500 kHz     31.500000 MHz
    DMT 0x08:   800x600    56.250000 Hz   4:3     35.156 kHz     36.000000 MHz
    DMT 0x09:   800x600    60.316541 Hz   4:3     37.879 kHz     40.000000 MHz
    DMT 0x0a:   800x600    72.187572 Hz   4:3     48.077 kHz     50.000000 MHz
    DMT 0x0b:   800x600    75.000000 Hz   4:3     46.875 kHz     49.500000 MHz
    DMT 0x10:  1024x768    60.003840 Hz   4:3     48.363 kHz     65.000000 MHz
    DMT 0x11:  1024x768    70.069359 Hz   4:3     56.476 kHz     75.000000 MHz
    DMT 0x12:  1024x768    75.028582 Hz   4:3     60.023 kHz     78.750000 MHz
    DMT 0x24:  1280x1024   75.024675 Hz   5:4     79.976 kHz    135.000000 MHz
  Standard Timings:
    DMT 0x1c:  1280x800    59.810326 Hz  16:10    49.702 kHz     83.500000 MHz
    DMT 0x20:  1280x960    60.000000 Hz   4:3     60.000 kHz    108.000000 MHz
    DMT 0x2a:  1400x1050   59.978442 Hz   4:3     65.317 kHz    121.750000 MHz
    DMT 0x53:  1600x900    60.000000 Hz  16:9     60.000 kHz    108.000000 MHz (RB)
    DMT 0x23:  1280x1024   60.019740 Hz   5:4     63.981 kHz    108.000000 MHz
    DMT 0x55:  1280x720    60.000000 Hz  16:9     45.000 kHz     74.250000 MHz
    DMT 0x2f:  1440x900    59.887445 Hz  16:10    55.935 kHz    106.500000 MHz
    DMT 0x3a:  1680x1050   59.954250 Hz  16:10    65.290 kHz    146.250000 MHz
  Detailed Timing Descriptors:
    DTD 1:  1920x1080   60.000000 Hz  16:9     67.500 kHz    148.500000 MHz (432 mm x 243 mm)
                 Hfront   88 Hsync  44 Hback  148 Hpol N
                 Vfront    4 Vsync   5 Vback   36 Vpol P
    DTD 2:  1280x768    59.870228 Hz   5:3     47.776 kHz     79.500000 MHz (400 mm x 270 mm)
                 Hfront   48 Hsync  32 Hback  304 Hpol N
                 Vfront    3 Vsync   7 Vback   20 Vpol P
    DTD 3:  1366x768    59.789541 Hz 683:384   47.712 kHz     85.500000 MHz (426 mm x 239 mm)
                 Hfront   70 Hsync 143 Hback  213 Hpol P
                 Vfront    3 Vsync   3 Vback   24 Vpol P
    Display Product Name: 'GT-191'
Checksum: 0xe2

----------------

Warnings:

Block 0, Base EDID:
  Detailed Timing Descriptor #1: DTD is similar but not identical to VIC 16.
  Detailed Timing Descriptor #2: DTD is similar but not identical to DMT 0x17.

Failures:

Block 0, Base EDID:
  Detailed Timing Descriptor #2: Mismatch of image size 400x270 mm vs display size 430x240 mm.
  Missing Display Range Limits Descriptor.

EDID conformity: FAIL
