edid-decode (hex):

00 ff ff ff ff ff ff 00 24 4d ef 19 17 00 00 00
2b 0b 01 03 0e 21 18 96 2b 0c c9 a0 57 47 9b 27
12 48 4c ef cf 80 31 59 45 59 61 59 71 59 81 99
a9 4f 01 01 01 01 86 3d 00 c0 51 00 30 40 40 a0
13 00 38 ea 10 00 00 1e 00 00 00 fd 00 30 aa 1e
5e 18 00 0a 20 20 20 20 20 20 00 00 00 fc 00 49
42 4d 20 36 36 33 39 20 50 37 37 0a 00 00 00 ff
00 32 33 48 31 30 35 34 00 20 20 20 20 20 00 33

----------------

Block 0, Base EDID:
  EDID Structure Version & Revision: 1.3
  Vendor & Product Identification:
    Manufacturer: IBM
    Model: 6639
    Serial Number: ...
    Made in: week 43 of 2001
  Basic Display Parameters & Features:
    Analog display
    Input voltage level: 0.7/0.3 V
    Blank level equals black level
    Sync: Separate Composite SyncOnGreen
    Maximum image size: 33 cm x 24 cm
    Gamma: 2.50
    DPMS levels: Off
    RGB color display
    First detailed timing is the preferred timing
    Supports GTF timings within operating range
  Color Characteristics:
    Red  : 0.6250, 0.3398
    Green: 0.2802, 0.6054
    Blue : 0.1552, 0.0703
    White: 0.2832, 0.2978
  Established Timings I & II:
    IBM     :   720x400    70.082 Hz   9:5    31.467 kHz  28.320 MHz
    IBM     :   720x400    87.850 Hz   9:5    39.444 kHz  35.500 MHz
    DMT 0x04:   640x480    59.940 Hz   4:3    31.469 kHz  25.175 MHz
    DMT 0x05:   640x480    72.809 Hz   4:3    37.861 kHz  31.500 MHz
    DMT 0x06:   640x480    75.000 Hz   4:3    37.500 kHz  31.500 MHz
    DMT 0x08:   800x600    56.250 Hz   4:3    35.156 kHz  36.000 MHz
    DMT 0x09:   800x600    60.317 Hz   4:3    37.879 kHz  40.000 MHz
    DMT 0x0a:   800x600    72.188 Hz   4:3    48.077 kHz  50.000 MHz
    DMT 0x0b:   800x600    75.000 Hz   4:3    46.875 kHz  49.500 MHz
    DMT 0x10:  1024x768    60.004 Hz   4:3    48.363 kHz  65.000 MHz
    DMT 0x11:  1024x768    70.069 Hz   4:3    56.476 kHz  75.000 MHz
    DMT 0x12:  1024x768    75.029 Hz   4:3    60.023 kHz  78.750 MHz
    DMT 0x24:  1280x1024   75.025 Hz   5:4    79.976 kHz 135.000 MHz
    Apple   :  1152x870    75.062 Hz 192:145  68.681 kHz 100.000 MHz
  Standard Timings:
    DMT 0x07:   640x480    85.008 Hz   4:3    43.269 kHz  36.000 MHz
    DMT 0x0c:   800x600    85.061 Hz   4:3    53.674 kHz  56.250 MHz
    DMT 0x13:  1024x768    84.997 Hz   4:3    68.677 kHz  94.500 MHz
    GTF     :  1152x864    85.000 Hz   4:3    77.095 kHz 119.651 MHz
    DMT 0x25:  1280x1024   85.024 Hz   5:4    91.146 kHz 157.500 MHz
    DMT 0x36:  1600x1200   75.000 Hz   4:3    93.750 kHz 202.500 MHz
  Detailed Timing Descriptors:
    DTD 1:  1280x1024   85.024 Hz   5:4    91.146 kHz 157.500 MHz (312 mm x 234 mm)
                 Hfront   64 Hsync 160 Hback 224 Hpol P
                 Vfront    1 Vsync   3 Vback  44 Vpol P
  Display Range Limits:
    Monitor ranges (GTF): 48-170 Hz V, 30-94 kHz H, max dotclock 240 MHz
    Display Product Name: 'IBM 6639 P77'
    Display Product Serial Number: ...
Checksum: 0x33

----------------

Failures:

Block 0, Base EDID:
  Display Product Serial Number: Non-printable character.

EDID conformity: FAIL
