
EDID (hex):
00ffffffffffff0006af3d1e00000000
00190104951f11780267759357588e29
21505400000001010101010101010101
010101010101b03680ae703822403064
310035ad100000180000000f00000000
00000000000000000020000000fe0041
554f0a202020202020202020000000fe
004231343048544e30312e45200a0009

Extracted contents:
header:          00 ff ff ff ff ff ff 00
serial number:   06 af 3d 1e 00 00 00 00 00 19
version:         01 04
basic params:    95 1f 11 78 02
chroma info:     67 75 93 57 58 8e 29 21 50 54
established:     00 00 00
standard:        01 01 01 01 01 01 01 01 01 01 01 01 01 01 01 01
descriptor 1:    b0 36 80 ae 70 38 22 40 30 64 31 00 35 ad 10 00 00 18
descriptor 2:    00 00 00 0f 00 00 00 00 00 00 00 00 00 00 00 00 00 20
descriptor 3:    00 00 00 fe 00 41 55 4f 0a 20 20 20 20 20 20 20 20 20
descriptor 4:    00 00 00 fe 00 42 31 34 30 48 54 4e 30 31 2e 45 20 0a
extensions:      00
checksum:        09

EDID version: 1.4
Manufacturer: AUO Model 1e3d Serial Number --
Made in year 2015
Digital display
6 bits per primary color channel
DisplayPort interface
Maximum image size: 31 cm x 17 cm
Gamma: 2.20
Supported color formats: RGB 4:4:4
First detailed timing includes the native pixel format and preferred refresh rate
Display x,y Chromaticity:
  Red:   0.5751, 0.3417
  Green: 0.3447, 0.5576
  Blue:  0.1611, 0.1318
  White: 0.3134, 0.3291
Established timings supported:
Standard timings supported:
Detailed mode: Clock 140.000 MHz, 309 mm x 173 mm
               1920 1968 2068 2094 hborder 0
               1080 1083 1084 1114 vborder 0
               -hsync -vsync 
               VertFreq: 60 Hz, HorFreq: 66857 Hz
Manufacturer-specified data, tag 15
ASCII string: AUO
ASCII string: B140HTN01.E 
Checksum: 0x9 (valid)
EDID block does NOT conform to EDID 1.4!
	Missing name descriptor
	Missing monitor ranges


