edid-decode (hex):

00 ff ff ff ff ff ff 00 10 ac c9 a0 55 4e 44 30
26 1a 01 03 a0 35 1e 78 ba 0e f5 a5 55 50 9e 26
10 50 54 a5 4b 00 71 4f 81 80 a9 c0 d1 c0 01 01
01 01 01 01 01 01 02 3a 80 18 71 38 2d 40 58 2c
45 00 13 2b 21 00 00 1e 00 00 00 ff 00 47 30 52
48 31 36 39 42 30 44 4e 55 0a 00 00 00 fc 00 44
45 4c 4c 20 45 32 34 31 36 48 0a 20 00 00 00 fd
00 32 4c 1e 53 11 00 0a 20 20 20 20 20 20 01 1d

02 03 1b 71 23 09 07 07 83 01 00 00 67 03 0c 00
10 00 80 21 43 01 10 84 e2 00 0f 01 1d 00 72 51
d0 1e 20 6e 28 55 00 81 49 00 00 00 1e 00 00 00
10 00 00 00 00 00 00 00 00 00 00 00 00 00 00 00
00 00 10 00 00 00 00 00 00 00 00 00 00 00 00 00
00 00 00 00 10 00 00 00 00 00 00 00 00 00 00 00
00 00 00 00 00 00 10 00 00 00 00 00 00 00 00 00
00 00 00 00 00 00 00 00 00 00 00 00 00 00 00 bf

00 ff ff ff ff ff ff 00 10 ac c9 a0 55 4e 44 30
26 1a 01 03 a0 35 1e 78 ba 0e f5 a5 55 50 9e 26
10 50 54 a5 4b 00 71 4f 81 80 a9 c0 d1 c0 01 01
01 01 01 01 01 01 02 3a 80 18 71 38 2d 40 58 2c
45 00 13 2b 21 00 00 1e 00 00 00 ff 00 47 30 52
48 31 36 39 42 30 44 4e 55 0a 00 00 00 fc 00 44
45 4c 4c 20 45 32 34 31 36 48 0a 20 00 00 00 fd
00 32 4c 1e 53 11 00 0a 20 20 20 20 20 20 01 1d

02 03 1b 71 23 09 07 07 83 01 00 00 67 03 0c 00
10 00 80 21 43 01 10 84 e2 00 0f 01 1d 00 72 51
d0 1e 20 6e 28 55 00 81 49 00 00 00 1e 00 00 00
10 00 00 00 00 00 00 00 00 00 00 00 00 00 00 00
00 00 10 00 00 00 00 00 00 00 00 00 00 00 00 00
00 00 00 00 10 00 00 00 00 00 00 00 00 00 00 00
00 00 00 00 00 00 10 00 00 00 00 00 00 00 00 00
00 00 00 00 00 00 00 00 00 00 00 00 00 00 00 bf

----------------

Block 0, Base EDID:
  EDID Structure Version & Revision: 1.3
  Vendor & Product Identification:
    Manufacturer: DEL
    Model: 41161
    Serial Number: ...
    Made in: week 38 of 2016
  Basic Display Parameters & Features:
    Digital display
    Maximum image size: 53 cm x 30 cm
    Gamma: 2.20
    DPMS levels: Standby Off
    Undefined display color type
    First detailed timing is the preferred timing
  Color Characteristics:
    Red  : 0.6445, 0.3320
    Green: 0.3154, 0.6191
    Blue : 0.1513, 0.0654
    White: 0.3134, 0.3291
  Established Timings I & II:
    IBM     :   720x400    70.081663 Hz   9:5     31.467 kHz     28.320000 MHz
    DMT 0x04:   640x480    59.940476 Hz   4:3     31.469 kHz     25.175000 MHz
    DMT 0x06:   640x480    75.000000 Hz   4:3     37.500 kHz     31.500000 MHz
    DMT 0x09:   800x600    60.316541 Hz   4:3     37.879 kHz     40.000000 MHz
    DMT 0x0b:   800x600    75.000000 Hz   4:3     46.875 kHz     49.500000 MHz
    DMT 0x10:  1024x768    60.003840 Hz   4:3     48.363 kHz     65.000000 MHz
    DMT 0x12:  1024x768    75.028582 Hz   4:3     60.023 kHz     78.750000 MHz
    DMT 0x24:  1280x1024   75.024675 Hz   5:4     79.976 kHz    135.000000 MHz
  Standard Timings:
    DMT 0x15:  1152x864    75.000000 Hz   4:3     67.500 kHz    108.000000 MHz
    DMT 0x23:  1280x1024   60.019740 Hz   5:4     63.981 kHz    108.000000 MHz
    DMT 0x53:  1600x900    60.000000 Hz  16:9     60.000 kHz    108.000000 MHz (RB)
    DMT 0x52:  1920x1080   60.000000 Hz  16:9     67.500 kHz    148.500000 MHz
  Detailed Timing Descriptors:
    DTD 1:  1920x1080   60.000000 Hz  16:9     67.500 kHz    148.500000 MHz (531 mm x 299 mm)
                 Hfront   88 Hsync  44 Hback  148 Hpol P
                 Vfront    4 Vsync   5 Vback   36 Vpol P
    Display Product Serial Number: ...
    Display Product Name: 'DELL E2416H'
    Display Range Limits:
      Monitor ranges (GTF): 50-76 Hz V, 30-83 kHz H, max dotclock 170 MHz
  Extension blocks: 1
Checksum: 0x1d

----------------

Block 1, CTA-861 Extension Block:
  Revision: 3
  Basic audio support
  Supports YCbCr 4:4:4
  Supports YCbCr 4:2:2
  Native detailed modes: 1
  Audio Data Block:
    Linear PCM:
      Max channels: 2
      Supported sample rates (kHz): 48 44.1 32
      Supported sample sizes (bits): 24 20 16
  Speaker Allocation Data Block:
    FL/FR - Front Left/Right
  Vendor-Specific Data Block (HDMI), OUI 00-0C-03:
    Source physical address: 1.0.0.0
    Supports_AI
    Maximum TMDS clock: 165 MHz
  Video Data Block:
    VIC   1:   640x480    59.940476 Hz   4:3     31.469 kHz     25.175000 MHz
    VIC  16:  1920x1080   60.000000 Hz  16:9     67.500 kHz    148.500000 MHz
    VIC   4:  1280x720    60.000000 Hz  16:9     45.000 kHz     74.250000 MHz (native)
  Video Capability Data Block:
    YCbCr quantization: No Data
    RGB quantization: No Data
    PT scan behavior: No Data
    IT scan behavior: Supports both over- and underscan
    CE scan behavior: Supports both over- and underscan
  Detailed Timing Descriptors:
    DTD 2:  1280x720    60.000000 Hz  16:9     45.000 kHz     74.250000 MHz (129 mm x 73 mm)
                 Hfront  110 Hsync  40 Hback  220 Hpol P
                 Vfront    5 Vsync   5 Vback   20 Vpol P
    Dummy Descriptor:
    Dummy Descriptor:
    Dummy Descriptor:
    Dummy Descriptor:
Checksum: 0xbf  Unused space in Extension Block: 10 bytes

----------------

Block 2, Unknown EDID Extension Block 0x00:
  00 ff ff ff ff ff ff 00 10 ac c9 a0 55 4e 44 30 '............UND0'
  26 1a 01 03 a0 35 1e 78 ba 0e f5 a5 55 50 9e 26 '&....5.x....UP.&'
  10 50 54 a5 4b 00 71 4f 81 80 a9 c0 d1 c0 01 01 '.PT.K.qO........'
  01 01 01 01 01 01 02 3a 80 18 71 38 2d 40 58 2c '.......:..q8-@X,'
  45 00 13 2b 21 00 00 1e 00 00 00 ff 00 47 30 52 'E..+!........G0R'
  48 31 36 39 42 30 44 4e 55 0a 00 00 00 fc 00 44 'H169B0DNU......D'
  45 4c 4c 20 45 32 34 31 36 48 0a 20 00 00 00 fd 'ELL E2416H. ....'
  00 32 4c 1e 53 11 00 0a 20 20 20 20 20 20 01 1d '.2L.S...      ..'
Checksum: 0x1d

----------------

Block 3, CTA-861 Extension Block:
  Revision: 3
  Basic audio support
  Supports YCbCr 4:4:4
  Supports YCbCr 4:2:2
  Native detailed modes: 1
  Audio Data Block:
    Linear PCM:
      Max channels: 2
      Supported sample rates (kHz): 48 44.1 32
      Supported sample sizes (bits): 24 20 16
  Speaker Allocation Data Block:
    FL/FR - Front Left/Right
  Vendor-Specific Data Block (HDMI), OUI 00-0C-03:
    Source physical address: 1.0.0.0
    Supports_AI
    Maximum TMDS clock: 165 MHz
  Video Data Block:
    VIC   1:   640x480    59.940476 Hz   4:3     31.469 kHz     25.175000 MHz
    VIC  16:  1920x1080   60.000000 Hz  16:9     67.500 kHz    148.500000 MHz
    VIC   4:  1280x720    60.000000 Hz  16:9     45.000 kHz     74.250000 MHz (native)
  Video Capability Data Block:
    YCbCr quantization: No Data
    RGB quantization: No Data
    PT scan behavior: No Data
    IT scan behavior: Supports both over- and underscan
    CE scan behavior: Supports both over- and underscan
  Detailed Timing Descriptors:
    DTD 3:  1280x720    60.000000 Hz  16:9     45.000 kHz     74.250000 MHz (129 mm x 73 mm)
                 Hfront  110 Hsync  40 Hback  220 Hpol P
                 Vfront    5 Vsync   5 Vback   20 Vpol P
    Dummy Descriptor:
    Dummy Descriptor:
    Dummy Descriptor:
    Dummy Descriptor:
Checksum: 0xbf  Unused space in Extension Block: 10 bytes

----------------

Warnings:

Block 1, CTA-861 Extension Block:
  IT Video Formats are overscanned by default, but normally this should be underscanned.
  Video Capability Data Block: Set Selectable YCbCr Quantization to avoid interop issues.
  Display Product Serial Number is set, so the Serial Number in the Base EDID should be 0.
  Add a Colorimetry Data Block with the sRGB colorimetry bit set to avoid interop issues.
Block 3, CTA-861 Extension Block:
  IT Video Formats are overscanned by default, but normally this should be underscanned.
  Video Capability Data Block: Set Selectable YCbCr Quantization to avoid interop issues.
  Display Product Serial Number is set, so the Serial Number in the Base EDID should be 0.
  Add a Colorimetry Data Block with the sRGB colorimetry bit set to avoid interop issues.

Failures:

Block 0, Base EDID:
  Basic Display Parameters & Features: Digital Video Interface Standard set to reserved value 0x20.
Block 1, CTA-861 Extension Block:
  Video Capability Data Block: Set Selectable RGB Quantization to avoid interop issues.
  Detailed Timing Descriptor #2: Mismatch of image size 129x73 mm vs display size 530x300 mm.
Block 2, Base EDID:
  Unknown Extension Block.
Block 3, CTA-861 Extension Block:
  Speaker Allocation Data Block: Only one instance of this Data Block is allowed.
  Video Data Block: Duplicate VIC 1.
  Video Data Block: Duplicate VIC 16.
  Video Data Block: Duplicate VIC 4.
  Video Capability Data Block: Only one instance of this Data Block is allowed.
  Video Capability Data Block: Set Selectable RGB Quantization to avoid interop issues.
  Detailed Timing Descriptor #3: Mismatch of image size 129x73 mm vs display size 530x300 mm.
EDID:
  Base EDID: EDID specified 1 extension block(s), but found 3 extension block(s).
  Base EDID: EDID 1.3 requires a Block Map Extension in Block 1 if there are more than 2 blocks in the EDID.
  CTA-861: Native progressive timings are a mix of several resolutions.

EDID conformity: FAIL
