
EDID (hex):
00ffffffffffff004ca3474c00000000
00120103802517780a87f594574f8c27
27505400000001010101010101010101
010101010101ab2f90a4601a35403020
26006fe5100000190000000f00000000
0000000000415f051900000000fe0053
414d53554e470a2020202020000000fe
003137304d5430332d3030310a2000e7

Extracted contents:
header:          00 ff ff ff ff ff ff 00
serial number:   4c a3 47 4c 00 00 00 00 00 12
version:         01 03
basic params:    80 25 17 78 0a
chroma info:     87 f5 94 57 4f 8c 27 27 50 54
established:     00 00 00
standard:        01 01 01 01 01 01 01 01 01 01 01 01 01 01 01 01
descriptor 1:    ab 2f 90 a4 60 1a 35 40 30 20 26 00 6f e5 10 00 00 19
descriptor 2:    00 00 00 0f 00 00 00 00 00 00 00 00 00 41 5f 05 19 00
descriptor 3:    00 00 00 fe 00 53 41 4d 53 55 4e 47 0a 20 20 20 20 20
descriptor 4:    00 00 00 fe 00 31 37 30 4d 54 30 33 2d 30 30 31 0a 20
extensions:      00
checksum:        e7

EDID version: 1.3
Manufacturer: SEC Model 4c47 Serial Number --
Made in year 2008
Digital display
Maximum image size: 37 cm x 23 cm
Gamma: 2.20
RGB color display
First detailed timing is preferred timing
Display x,y Chromaticity:
  Red:   0.5800, 0.3398
  Green: 0.3095, 0.5498
  Blue:  0.1552, 0.1552
  White: 0.3134, 0.3291
Established timings supported:
Standard timings supported:
Detailed mode: Clock 122.030 MHz, 367 mm x 229 mm
               1680 1728 1760 1844 hborder 0
               1050 1052 1058 1103 vborder 0
               -hsync -vsync 
               VertFreq: 59 Hz, HorFreq: 66176 Hz
Manufacturer-specified data, tag 15
ASCII string: SAMSUNG
ASCII string: 170MT03-001
Checksum: 0xe7 (valid)
EDID block does NOT conform to EDID 1.3!
	Missing name descriptor
	Missing monitor ranges
