edid-decode (hex):

00 ff ff ff ff ff ff 00 16 74 80 b7 bf 00 00 00
2c 14 01 03 80 66 39 78 ea 41 c7 9c 57 4c 91 26
23 4f 54 bf ef 00 31 40 45 40 61 40 81 c0 81 80
a9 40 01 01 01 01 27 36 80 a0 70 38 1f 40 50 20
85 04 fc 3d 32 00 00 1a 8a 21 56 b0 51 00 1b 30
48 bc 13 00 ba 88 21 00 00 1c 00 00 00 fd 00 37
4c 1e 50 11 00 0a 00 00 00 00 00 00 00 00 00 fc
00 45 53 54 45 43 4f 4d 0a 20 20 20 20 20 00 e5

----------------

Block 0, Base EDID:
  EDID Structure Version & Revision: 1.3
  Vendor & Product Identification:
    Manufacturer: EST
    Model: 46976
    Serial Number: ...
    Made in: week 44 of 2010
  Basic Display Parameters & Features:
    Digital display
    Maximum image size: 102 cm x 57 cm
    Gamma: 2.20
    DPMS levels: Standby Suspend Off
    RGB color display
    First detailed timing is the preferred timing
  Color Characteristics:
    Red  : 0.6103, 0.3398
    Green: 0.2968, 0.5673
    Blue : 0.1513, 0.1367
    White: 0.3095, 0.3310
  Established Timings I & II:
    IBM     :   720x400    70.081663 Hz   9:5     31.467 kHz     28.320000 MHz
    DMT 0x04:   640x480    59.940476 Hz   4:3     31.469 kHz     25.175000 MHz
    Apple   :   640x480    66.666667 Hz   4:3     35.000 kHz     30.240000 MHz
    DMT 0x05:   640x480    72.808802 Hz   4:3     37.861 kHz     31.500000 MHz
    DMT 0x06:   640x480    75.000000 Hz   4:3     37.500 kHz     31.500000 MHz
    DMT 0x08:   800x600    56.250000 Hz   4:3     35.156 kHz     36.000000 MHz
    DMT 0x09:   800x600    60.316541 Hz   4:3     37.879 kHz     40.000000 MHz
    DMT 0x0a:   800x600    72.187572 Hz   4:3     48.077 kHz     50.000000 MHz
    DMT 0x0b:   800x600    75.000000 Hz   4:3     46.875 kHz     49.500000 MHz
    Apple   :   832x624    74.551266 Hz   4:3     49.726 kHz     57.284000 MHz
    DMT 0x10:  1024x768    60.003840 Hz   4:3     48.363 kHz     65.000000 MHz
    DMT 0x11:  1024x768    70.069359 Hz   4:3     56.476 kHz     75.000000 MHz
    DMT 0x12:  1024x768    75.028582 Hz   4:3     60.023 kHz     78.750000 MHz
    DMT 0x24:  1280x1024   75.024675 Hz   5:4     79.976 kHz    135.000000 MHz
  Standard Timings:
    DMT 0x04:   640x480    59.940476 Hz   4:3     31.469 kHz     25.175000 MHz
    DMT 0x09:   800x600    60.316541 Hz   4:3     37.879 kHz     40.000000 MHz
    DMT 0x10:  1024x768    60.003840 Hz   4:3     48.363 kHz     65.000000 MHz
    DMT 0x55:  1280x720    60.000000 Hz  16:9     45.000 kHz     74.250000 MHz
    DMT 0x23:  1280x1024   60.019740 Hz   5:4     63.981 kHz    108.000000 MHz
    DMT 0x33:  1600x1200   60.000000 Hz   4:3     75.000 kHz    162.000000 MHz
  Detailed Timing Descriptors:
    DTD 1:  1920x1080   59.990134 Hz  16:9     66.649 kHz    138.630000 MHz (1020 mm x 573 mm)
                 Hfront   80 Hsync  32 Hback   48 Hpol P
                 Vfront   24 Vsync   5 Vback    2 Vpol N
    DTD 2:  1366x768    60.066741 Hz 683:384   47.753 kHz     85.860000 MHz (698 mm x 392 mm)
                 Hfront   72 Hsync 188 Hback  172 Hpol N
                 Vfront    1 Vsync   3 Vback   23 Vpol P
    Display Range Limits:
      Monitor ranges (GTF): 55-76 Hz V, 30-80 kHz H, max dotclock 170 MHz
    Display Product Name: 'ESTECOM'
Checksum: 0xe5

----------------

Failures:

Block 0, Base EDID:
  Detailed Timing Descriptor #2: Mismatch of image size 698x392 mm vs display size 1020x570 mm.
  Display Range Limits: Bytes 12-17 must be 0x20.

EDID conformity: FAIL
