
EDID (hex):
00ffffffffffff0010ac19f053415731
06140103802c1978eeee95a3544c9926
0f5054a54b00714f8180a9c001010101
0101010101012f2640a060841a303020
3500bbf91000001a000000ff0035504e
3148303233315741530a000000fc0044
454c4c205354323031300a20000000fd
00384c1e5311000a2020202020200115
020317b14c90020301071612041f1314
0565030c0010008c0ad08a20e02d1010
3e9600bbf9100000188c0ad090204031
200c405500bbf910000018011d801871
1c1620582c2500bbf91000009e011d80
d0721c1620102c2580bbf91000009e00
00000000000000000000000000000000
00000000000000000000000000000045

Extracted contents:
header:          00 ff ff ff ff ff ff 00
serial number:   10 ac 19 f0 53 41 57 31 06 14
version:         01 03
basic params:    80 2c 19 78 ee
chroma info:     ee 95 a3 54 4c 99 26 0f 50 54
established:     a5 4b 00
standard:        71 4f 81 80 a9 c0 01 01 01 01 01 01 01 01 01 01
descriptor 1:    2f 26 40 a0 60 84 1a 30 30 20 35 00 bb f9 10 00 00 1a
descriptor 2:    00 00 00 ff 00 35 50 4e 31 48 30 32 33 31 57 41 53 0a
descriptor 3:    00 00 00 fc 00 44 45 4c 4c 20 53 54 32 30 31 30 0a 20
descriptor 4:    00 00 00 fd 00 38 4c 1e 53 11 00 0a 20 20 20 20 20 20
extensions:      01
checksum:        15

EDID version: 1.3
Manufacturer: DEL Model f019 Serial Number --
Made in week 6 of 2010
Digital display
Maximum image size: 44 cm x 25 cm
Gamma: 2.20
DPMS levels: Standby Suspend Off
RGB color display
Default (sRGB) color space is primary color space
First detailed timing is preferred timing
Display x,y Chromaticity:
  Red:   0.6396, 0.3300
  Green: 0.2998, 0.5996
  Blue:  0.1503, 0.0595
  White: 0.3134, 0.3291
Established timings supported:
  720x400@70Hz 9:5 HorFreq: 31469 Hz Clock: 28.320 MHz
  640x480@60Hz 4:3 HorFreq: 31469 Hz Clock: 25.175 MHz
  640x480@75Hz 4:3 HorFreq: 37500 Hz Clock: 31.500 MHz
  800x600@60Hz 4:3 HorFreq: 37900 Hz Clock: 40.000 MHz
  800x600@75Hz 4:3 HorFreq: 46900 Hz Clock: 49.500 MHz
  1024x768@60Hz 4:3 HorFreq: 48400 Hz Clock: 65.000 MHz
  1024x768@75Hz 4:3 HorFreq: 60000 Hz Clock: 78.750 MHz
  1280x1024@75Hz 5:4 HorFreq: 80000 Hz Clock: 135.000 MHz
Standard timings supported:
  1152x864@75Hz 4:3 HorFreq: 67500 Hz Clock: 108.000 MHz
  1280x1024@60Hz 5:4 HorFreq: 64000 Hz Clock: 108.000 MHz
  1600x900@60Hz 16:9
Detailed mode: Clock 97.750 MHz, 443 mm x 249 mm
               1600 1648 1680 1760 hborder 0
                900  903  908  926 vborder 0
               +hsync -vsync 
               VertFreq: 59 Hz, HorFreq: 55539 Hz
Serial number: --
Monitor name: DELL ST2010
Monitor ranges (GTF): 56-76Hz V, 30-83kHz H, max dotclock 170MHz
Has 1 extension blocks
Checksum: 0x15 (valid)

CTA extension block
Extension version: 3
19 bytes of CTA data
  Video data block
    VIC  16 1920x1080@60Hz 16:9 (native) HorFreq: 67500 Hz Clock: 148.500 MHz
    VIC   2 720x480@60Hz 4:3  HorFreq: 31469 Hz Clock: 27.000 MHz
    VIC   3 720x480@60Hz 16:9  HorFreq: 31469 Hz Clock: 27.000 MHz
    VIC   1 640x480@60Hz 4:3  HorFreq: 31469 Hz Clock: 25.175 MHz
    VIC   7 1440x480i@60Hz 16:9  HorFreq: 15734 Hz Clock: 27.000 MHz
    VIC  22 1440x576i@50Hz 16:9  HorFreq: 15625 Hz Clock: 27.000 MHz
    VIC  18 720x576@50Hz 16:9  HorFreq: 31250 Hz Clock: 27.000 MHz
    VIC   4 1280x720@60Hz 16:9  HorFreq: 45000 Hz Clock: 74.250 MHz
    VIC  31 1920x1080@50Hz 16:9  HorFreq: 56250 Hz Clock: 148.500 MHz
    VIC  19 1280x720@50Hz 16:9  HorFreq: 37500 Hz Clock: 74.250 MHz
    VIC  20 1920x1080i@50Hz 16:9  HorFreq: 28125 Hz Clock: 74.250 MHz
    VIC   5 1920x1080i@60Hz 16:9  HorFreq: 33750 Hz Clock: 74.250 MHz
  Vendor-specific data block, OUI 000c03 (HDMI)
    Source physical address 1.0.0.0
Underscans PC formats by default
Supports YCbCr 4:4:4
Supports YCbCr 4:2:2
1 native detailed modes
Detailed mode: Clock 27.000 MHz, 443 mm x 249 mm
                720  736  798  858 hborder 0
                480  489  495  525 vborder 0
               -hsync -vsync 
               VertFreq: 59 Hz, HorFreq: 31468 Hz
Detailed mode: Clock 27.000 MHz, 443 mm x 249 mm
                720  732  796  864 hborder 0
                576  581  586  625 vborder 0
               -hsync -vsync 
               VertFreq: 50 Hz, HorFreq: 31250 Hz
Detailed mode: Clock 74.250 MHz, 443 mm x 249 mm
               1920 2008 2052 2200 hborder 0
                540  542  547  562 vborder 0
               +hsync +vsync interlaced 
               VertFreq: 60 Hz, HorFreq: 33750 Hz
Detailed mode: Clock 74.250 MHz, 443 mm x 249 mm
               1920 2448 2492 2640 hborder 0
                540  542  547  562 vborder 0
               +hsync +vsync interlaced 
               VertFreq: 50 Hz, HorFreq: 28125 Hz
Checksum: 0x45 (valid)

EDID block does NOT conform to EDID 1.3!
	sRGB is signaled, but the chromaticities do not match
One or more of the timings is out of range of the Monitor Ranges:
  Vertical Freq: 50 - 75 Hz
  Horizontal Freq: 15625 - 80000 Hz
  Maximum Clock: 148.500 MHz
EDID block does not conform at all!
	Both the serial number and the serial string are set
