
EDID (hex):
00ffffffffffff001e6dc4584f3f0300
0a16010368351e78ea3f35a259559b25
0e5054a76b80b30081809500714fa9c0
810081c09040023a801871382d40582c
4500132b2100001e000000fd00384b1e
530f000a202020202020000000fc0045
323434320a20202020202020000000ff
003231304e444e5536383831350a00f3

Extracted contents:
header:          00 ff ff ff ff ff ff 00
serial number:   1e 6d c4 58 4f 3f 03 00 0a 16
version:         01 03
basic params:    68 35 1e 78 ea
chroma info:     3f 35 a2 59 55 9b 25 0e 50 54
established:     a7 6b 80
standard:        b3 00 81 80 95 00 71 4f a9 c0 81 00 81 c0 90 40
descriptor 1:    02 3a 80 18 71 38 2d 40 58 2c 45 00 13 2b 21 00 00 1e
descriptor 2:    00 00 00 fd 00 38 4b 1e 53 0f 00 0a 20 20 20 20 20 20
descriptor 3:    00 00 00 fc 00 45 32 34 34 32 0a 20 20 20 20 20 20 20
descriptor 4:    00 00 00 ff 00 32 31 30 4e 44 4e 55 36 38 38 31 35 0a
extensions:      00
checksum:        f3

EDID version: 1.3
Manufacturer: GSM Model 58c4 Serial Number --
Made in week 10 of 2012
Analog display, Input voltage level: 0.7/0.7 V
Sync: Separate 
Maximum image size: 53 cm x 30 cm
Gamma: 2.20
DPMS levels: Standby Suspend Off
RGB color display
First detailed timing is preferred timing
Display x,y Chromaticity:
  Red:   0.6328, 0.3505
  Green: 0.3349, 0.6083
  Blue:  0.1445, 0.0576
  White: 0.3134, 0.3291
Established timings supported:
  720x400@70Hz 9:5 HorFreq: 31469 Hz Clock: 28.320 MHz
  640x480@60Hz 4:3 HorFreq: 31469 Hz Clock: 25.175 MHz
  640x480@75Hz 4:3 HorFreq: 37500 Hz Clock: 31.500 MHz
  800x600@56Hz 4:3 HorFreq: 35200 Hz Clock: 36.000 MHz
  800x600@60Hz 4:3 HorFreq: 37900 Hz Clock: 40.000 MHz
  800x600@75Hz 4:3 HorFreq: 46900 Hz Clock: 49.500 MHz
  832x624@75Hz 4:3 HorFreq: 49726 Hz Clock: 57.284 MHz
  1024x768@60Hz 4:3 HorFreq: 48400 Hz Clock: 65.000 MHz
  1024x768@75Hz 4:3 HorFreq: 60000 Hz Clock: 78.750 MHz
  1280x1024@75Hz 5:4 HorFreq: 80000 Hz Clock: 135.000 MHz
  1152x870@75Hz 192:145 HorFreq: 67500 Hz Clock: 108.000 MHz
Standard timings supported:
  1680x1050@60Hz 16:10 HorFreq: 64700 Hz Clock: 119.000 MHz
  1280x1024@60Hz 5:4 HorFreq: 64000 Hz Clock: 108.000 MHz
  1440x900@60Hz 16:10 HorFreq: 55500 Hz Clock: 88.750 MHz
  1152x864@75Hz 4:3 HorFreq: 67500 Hz Clock: 108.000 MHz
  1600x900@60Hz 16:9
  1280x800@60Hz 16:10
  1280x720@60Hz 16:9
  1400x1050@60Hz 4:3 HorFreq: 64700 Hz Clock: 101.000 MHz
Detailed mode: Clock 148.500 MHz, 531 mm x 299 mm
               1920 2008 2052 2200 hborder 0
               1080 1084 1089 1125 vborder 0
               +hsync +vsync 
               VertFreq: 60 Hz, HorFreq: 67500 Hz
Monitor ranges (GTF): 56-75Hz V, 30-83kHz H, max dotclock 150MHz
Monitor name: E2442
Serial number: --
Checksum: 0xf3 (valid)


