edid-decode (hex):

00 ff ff ff ff ff ff 00 06 af ed 21 00 00 00 00
2c 1c 01 04 a5 22 13 78 03 6e 85 93 58 58 92 28
1e 50 54 00 00 00 01 01 01 01 01 01 01 01 01 01
01 01 01 01 01 01 14 37 80 a6 70 38 2e 40 6c 30
aa 00 58 c1 10 00 00 18 00 00 00 0f 00 00 00 00
00 00 00 00 00 00 00 00 00 20 00 00 00 fe 00 41
55 4f 0a 20 20 20 20 20 20 20 20 20 00 00 00 fe
00 42 31 35 36 48 41 4e 30 32 2e 31 20 0a 00 f7

00 ff ff ff ff ff ff 00 06 af ed 21 00 00 00 00
2c 1c 01 04 a5 22 13 78 03 6e 85 93 58 58 92 28
1e 50 54 00 00 00 01 01 01 01 01 01 01 01 01 01
01 01 01 01 01 01 14 37 80 a6 70 38 2e 40 6c 30
aa 00 58 c1 10 00 00 18 00 00 00 0f 00 00 00 00
00 00 00 00 00 00 00 00 00 20 00 00 00 fe 00 41
55 4f 0a 20 20 20 20 20 20 20 20 20 00 00 00 fe
00 42 31 35 36 48 41 4e 30 32 2e 31 20 0a 00 f7

----------------

Block 0, Base EDID:
  EDID Structure Version & Revision: 1.4
  Vendor & Product Identification:
    Manufacturer: AUO
    Model: 8685
    Made in: week 44 of 2018
  Basic Display Parameters & Features:
    Digital display
    Bits per primary color channel: 8
    DisplayPort interface
    Maximum image size: 34 cm x 19 cm
    Gamma: 2.20
    Supported color formats: RGB 4:4:4
    First detailed timing includes the native pixel format and preferred refresh rate
    Display is continuous frequency
  Color Characteristics:
    Red  : 0.5751, 0.3457
    Green: 0.3466, 0.5722
    Blue : 0.1582, 0.1171
    White: 0.3134, 0.3291
  Established Timings I & II: none
  Standard Timings: none
  Detailed Timing Descriptors:
    DTD 1:  1920x1080   60.029734 Hz  16:9     67.593 kHz    141.000000 MHz (344 mm x 193 mm)
                 Hfront  108 Hsync  48 Hback   10 Hpol N
                 Vfront   10 Vsync  10 Vback   26 Vpol N
    Manufacturer-Specified Display Descriptor (0x0f): 00 0f 00 00 00 00 00 00 00 00 00 00 00 00 00 20 '............... '
    Alphanumeric Data String: 'AUO'
    Alphanumeric Data String: 'B156HAN02.1 '
Checksum: 0xf7

----------------

Block 1, Unknown EDID Extension Block 0x00:
  00 ff ff ff ff ff ff 00 06 af ed 21 00 00 00 00 '...........!....'
  2c 1c 01 04 a5 22 13 78 03 6e 85 93 58 58 92 28 ',....".x.n..XX.('
  1e 50 54 00 00 00 01 01 01 01 01 01 01 01 01 01 '.PT.............'
  01 01 01 01 01 01 14 37 80 a6 70 38 2e 40 6c 30 '.......7..p8.@l0'
  aa 00 58 c1 10 00 00 18 00 00 00 0f 00 00 00 00 '..X.............'
  00 00 00 00 00 00 00 00 00 20 00 00 00 fe 00 41 '......... .....A'
  55 4f 0a 20 20 20 20 20 20 20 20 20 00 00 00 fe 'UO.         ....'
  00 42 31 35 36 48 41 4e 30 32 2e 31 20 0a 00 f7 '.B156HAN02.1 ...'
Checksum: 0xf7

----------------

Warnings:

Block 0, Base EDID:
  Missing Display Product Name.

Failures:

Block 0, Base EDID:
  Alphanumeric Data String: One or more trailing spaces.
  Missing Display Range Limits Descriptor.
Block 1, Base EDID:
  Unknown Extension Block.
EDID:
  Base EDID: EDID specified 0 extension block(s), but found 1 extension block(s).

EDID conformity: FAIL
