
EDID (hex):
00ffffffffffff0009d1027a45540000
3211010380261e782ecc15a557499b25
125054a56b8071007140814081808100
810f01010101302a009851002a403070
1300782d1100001e000000ff00374337
3031393131534c304c30000000fd0037
4c1f530e000a202020202020000000fc
0042656e5120583930300a0a0a0a00b1

Extracted contents:
header:          00 ff ff ff ff ff ff 00
serial number:   09 d1 02 7a 45 54 00 00 32 11
version:         01 03
basic params:    80 26 1e 78 2e
chroma info:     cc 15 a5 57 49 9b 25 12 50 54
established:     a5 6b 80
standard:        71 00 71 40 81 40 81 80 81 00 81 0f 01 01 01 01
descriptor 1:    30 2a 00 98 51 00 2a 40 30 70 13 00 78 2d 11 00 00 1e
descriptor 2:    00 00 00 ff 00 37 43 37 30 31 39 31 31 53 4c 30 4c 30
descriptor 3:    00 00 00 fd 00 37 4c 1f 53 0e 00 0a 20 20 20 20 20 20
descriptor 4:    00 00 00 fc 00 42 65 6e 51 20 58 39 30 30 0a 0a 0a 0a
extensions:      00
checksum:        b1

EDID version: 1.3
Manufacturer: BNQ Model 7a02 Serial Number --
Made in week 50 of 2007
Digital display
Maximum image size: 38 cm x 30 cm
Gamma: 2.20
DPMS levels: Off
RGB color display
Default (sRGB) color space is primary color space
First detailed timing is preferred timing
Display x,y Chromaticity:
  Red:   0.6474, 0.3398
  Green: 0.2880, 0.6054
  Blue:  0.1445, 0.0712
  White: 0.3134, 0.3291
Established timings supported:
  720x400@70Hz 9:5 HorFreq: 31469 Hz Clock: 28.320 MHz
  640x480@60Hz 4:3 HorFreq: 31469 Hz Clock: 25.175 MHz
  640x480@75Hz 4:3 HorFreq: 37500 Hz Clock: 31.500 MHz
  800x600@60Hz 4:3 HorFreq: 37900 Hz Clock: 40.000 MHz
  800x600@75Hz 4:3 HorFreq: 46900 Hz Clock: 49.500 MHz
  832x624@75Hz 4:3 HorFreq: 49726 Hz Clock: 57.284 MHz
  1024x768@60Hz 4:3 HorFreq: 48400 Hz Clock: 65.000 MHz
  1024x768@75Hz 4:3 HorFreq: 60000 Hz Clock: 78.750 MHz
  1280x1024@75Hz 5:4 HorFreq: 80000 Hz Clock: 135.000 MHz
  1152x870@75Hz 192:145 HorFreq: 67500 Hz Clock: 108.000 MHz
Standard timings supported:
  1152x720@60Hz 16:10
  1152x864@60Hz 4:3
  1280x960@60Hz 4:3 HorFreq: 60000 Hz Clock: 108.000 MHz
  1280x1024@60Hz 5:4 HorFreq: 64000 Hz Clock: 108.000 MHz
  1280x800@60Hz 16:10
  1280x800@75Hz 16:10
Detailed mode: Clock 108.000 MHz, 376 mm x 301 mm
               1280 1328 1440 1688 hborder 0
               1024 1025 1028 1066 vborder 0
               +hsync +vsync 
               VertFreq: 60 Hz, HorFreq: 63981 Hz
Serial number: --
Monitor ranges (GTF): 55-76Hz V, 31-83kHz H, max dotclock 140MHz
Monitor name: BenQ X900
Checksum: 0xb1 (valid)
EDID block does NOT conform to EDID 1.3!
	sRGB is signaled, but the chromaticities do not match
	Detailed block string not properly terminated
