
EDID (hex):
00ffffffffffff004dd9502501010101
240d0103801e1778eab149a1584f9526
1d484ca1080001010101010101010101
01010101010164190040410026301888
360030e410000018000000fd00393f1c
3408000a202020202020000000fc0053
444d2d5835330a2020202020000000ff
00393330393437340a20202020200023

Extracted contents:
header:          00 ff ff ff ff ff ff 00
serial number:   4d d9 50 25 01 01 01 01 24 0d
version:         01 03
basic params:    80 1e 17 78 ea
chroma info:     b1 49 a1 58 4f 95 26 1d 48 4c
established:     a1 08 00
standard:        01 01 01 01 01 01 01 01 01 01 01 01 01 01 01 01
descriptor 1:    64 19 00 40 41 00 26 30 18 88 36 00 30 e4 10 00 00 18
descriptor 2:    00 00 00 fd 00 39 3f 1c 34 08 00 0a 20 20 20 20 20 20
descriptor 3:    00 00 00 fc 00 53 44 4d 2d 58 35 33 0a 20 20 20 20 20
descriptor 4:    00 00 00 ff 00 39 33 30 39 34 37 34 0a 20 20 20 20 20
extensions:      00
checksum:        23

EDID version: 1.3
Manufacturer: SNY Model 2550 Serial Number --
Digital display
Maximum image size: 30 cm x 23 cm
Gamma: 2.20
DPMS levels: Standby Suspend Off
RGB color display
First detailed timing is preferred timing
Display x,y Chromaticity:
  Red:   0.6308, 0.3466
  Green: 0.3085, 0.5830
  Blue:  0.1494, 0.1132
  White: 0.2832, 0.2978
Established timings supported:
  720x400@70Hz 9:5 HorFreq: 31469 Hz Clock: 28.320 MHz
  640x480@60Hz 4:3 HorFreq: 31469 Hz Clock: 25.175 MHz
  800x600@60Hz 4:3 HorFreq: 37900 Hz Clock: 40.000 MHz
  1024x768@60Hz 4:3 HorFreq: 48400 Hz Clock: 65.000 MHz
Standard timings supported:
Detailed mode: Clock 65.000 MHz, 304 mm x 228 mm
               1024 1048 1184 1344 hborder 0
                768  771  777  806 vborder 0
               -hsync -vsync 
               VertFreq: 60 Hz, HorFreq: 48363 Hz
Monitor ranges (GTF): 57-63Hz V, 28-52kHz H, max dotclock 80MHz
Monitor name: SDM-X53
Serial number: --
Checksum: 0x23 (valid)
One or more of the timings is out of range of the Monitor Ranges:
  Vertical Freq: 60 - 70 Hz
  Horizontal Freq: 31469 - 48400 Hz
  Maximum Clock: 65.000 MHz
EDID block does not conform at all!
	Bad year of manufacture
