edid-decode (hex):

00 ff ff ff ff ff ff 00 42 03 01 00 02 00 00 00
01 0f 01 03 80 22 1b ff 0a 00 00 00 00 00 00 00
00 00 00 bf ee 07 61 4f 01 01 01 01 01 01 01 01
01 01 01 01 01 01 30 2a 00 98 51 00 2a 40 30 70
13 00 78 2d 11 00 00 00 52 62 80 a0 20 5e 63 10
10 60 52 08 78 2d 11 00 00 00 00 00 00 fd 00 38
4c 1f 53 0f 00 00 00 00 00 00 00 00 00 00 00 fc
00 4b 49 52 41 0a 20 20 20 20 20 20 00 00 00 28

----------------

Block 0, Base EDID:
  EDID Structure Version & Revision: 1.3
  Vendor & Product Identification:
    Manufacturer: PPC
    Model: 1
    Serial Number: ...
    Made in: week 1 of 2005
  Basic Display Parameters & Features:
    Digital display
    Maximum image size: 34 cm x 27 cm
    Gamma is defined in an extension block
    RGB color display
    First detailed timing is the preferred timing
  Color Characteristics:
    Red  : 0.0000, 0.0000
    Green: 0.0000, 0.0000
    Blue : 0.0000, 0.0000
    White: 0.0000, 0.0000
  Established Timings I & II:
    IBM     :   720x400    70.082 Hz   9:5    31.467 kHz  28.320 MHz
    DMT 0x04:   640x480    59.940 Hz   4:3    31.469 kHz  25.175 MHz
    Apple   :   640x480    66.667 Hz   4:3    35.000 kHz  30.240 MHz
    DMT 0x05:   640x480    72.809 Hz   4:3    37.861 kHz  31.500 MHz
    DMT 0x06:   640x480    75.000 Hz   4:3    37.500 kHz  31.500 MHz
    DMT 0x08:   800x600    56.250 Hz   4:3    35.156 kHz  36.000 MHz
    DMT 0x09:   800x600    60.317 Hz   4:3    37.879 kHz  40.000 MHz
    DMT 0x0a:   800x600    72.188 Hz   4:3    48.077 kHz  50.000 MHz
    DMT 0x0b:   800x600    75.000 Hz   4:3    46.875 kHz  49.500 MHz
    Apple   :   832x624    74.551 Hz   4:3    49.726 kHz  57.284 MHz
    DMT 0x10:  1024x768    60.004 Hz   4:3    48.363 kHz  65.000 MHz
    DMT 0x11:  1024x768    70.069 Hz   4:3    56.476 kHz  75.000 MHz
    DMT 0x12:  1024x768    75.029 Hz   4:3    60.023 kHz  78.750 MHz
  Standard Timings:
    DMT 0x12:  1024x768    75.029 Hz   4:3    60.023 kHz  78.750 MHz
  Detailed Timing Descriptors:
    DTD 1:  1280x1024   60.020 Hz   5:4    63.981 kHz 108.000 MHz (analog composite, sync-on-green, 376 mm x 301 mm)
                 Hfront   48 Hsync 112 Hback 248 Hpol N
                 Vfront    1 Vsync   3 Vback  38 Vpol N
    DTD 2:   640x350   700.724 Hz  64:35  314.625 kHz 251.700 MHz (analog composite, sync-on-green, 376 mm x 301 mm)
                 Hfront   16 Hsync  96 Hback  48 Hpol N
                 Vfront   37 Vsync   2 Vback  60 Vpol N
  Display Range Limits:
    Monitor ranges (GTF): 56-76 Hz V, 31-83 kHz H, max dotclock 150 MHz
    Display Product Name: 'KIRA'
Checksum: 0x28

----------------

Failures:

Block 0, Base EDID:
  Detailed Timing Descriptor #1: Mismatch of image size 376x301 mm vs display size 340x270 mm.
  Detailed Timing Descriptor #2: Mismatch of image size 376x301 mm vs display size 340x270 mm.
  Display Range Limits: Byte 11 is 0x00 instead of 0x0a.
  Display Range Limits: Bytes 12-17 must be 0x20.
  Display Product Name: Non-space after newline.
EDID:
  Base EDID: Some timings are out of range of the Monitor Ranges:
    Vertical Freq: 56.250 - 700.724 Hz (Monitor: 56.000 - 76.000 Hz)
    Horizontal Freq: 31.466 - 314.625 kHz (Monitor: 31.000 - 83.000 kHz)
    Maximum Clock: 251.700 MHz (Monitor: 150.000 MHz)

EDID conformity: FAIL
