edid-decode (hex):

00 ff ff ff ff ff ff 00 04 72 46 ad 00 00 00 00
16 10 01 04 08 22 1b 78 e8 dc 55 a3 59 48 9e 24
11 50 54 bf ef 00 01 01 01 01 01 01 01 01 01 01
01 01 01 01 01 01 30 2a 00 98 51 00 2a 40 30 70
13 00 52 0e 11 00 00 1e 00 00 00 fd 00 38 4b 1e
53 0e 00 0a 20 20 20 20 20 20 00 00 00 ff 00 36
32 32 30 42 44 41 36 34 30 31 38 0a 00 00 00 fc
00 41 4c 31 37 31 36 41 0a 20 20 20 20 20 00 8b

----------------

Block 0, Base EDID:
  EDID Structure Version & Revision: 1.4
  Vendor & Product Identification:
    Manufacturer: ACR
    Model: 44358
    Made in: week 22 of 2006
  Basic Display Parameters & Features:
    Analog display
    Input voltage level: 0.7/0.3 V
    Blank level equals black level
    Sync: Separate
    Maximum image size: 34 cm x 27 cm
    Gamma: 2.20
    DPMS levels: Standby Suspend Off
    RGB color display
    First detailed timing does not include the native pixel format and preferred refresh rate
  Color Characteristics:
    Red  : 0.6396, 0.3486
    Green: 0.2841, 0.6171
    Blue : 0.1416, 0.0673
    White: 0.3134, 0.3291
  Established Timings I & II:
    IBM     :   720x400    70.082 Hz   9:5    31.467 kHz  28.320 MHz
    DMT 0x04:   640x480    59.940 Hz   4:3    31.469 kHz  25.175 MHz
    Apple   :   640x480    66.667 Hz   4:3    35.000 kHz  30.240 MHz
    DMT 0x05:   640x480    72.809 Hz   4:3    37.861 kHz  31.500 MHz
    DMT 0x06:   640x480    75.000 Hz   4:3    37.500 kHz  31.500 MHz
    DMT 0x08:   800x600    56.250 Hz   4:3    35.156 kHz  36.000 MHz
    DMT 0x09:   800x600    60.317 Hz   4:3    37.879 kHz  40.000 MHz
    DMT 0x0a:   800x600    72.188 Hz   4:3    48.077 kHz  50.000 MHz
    DMT 0x0b:   800x600    75.000 Hz   4:3    46.875 kHz  49.500 MHz
    Apple   :   832x624    74.551 Hz   4:3    49.726 kHz  57.284 MHz
    DMT 0x10:  1024x768    60.004 Hz   4:3    48.363 kHz  65.000 MHz
    DMT 0x11:  1024x768    70.069 Hz   4:3    56.476 kHz  75.000 MHz
    DMT 0x12:  1024x768    75.029 Hz   4:3    60.023 kHz  78.750 MHz
    DMT 0x24:  1280x1024   75.025 Hz   5:4    79.976 kHz 135.000 MHz
  Standard Timings: none
  Detailed Timing Descriptors:
    DTD 1:  1280x1024   60.020 Hz   5:4    63.981 kHz 108.000 MHz (338 mm x 270 mm)
                 Hfront   48 Hsync 112 Hback 248 Hpol P
                 Vfront    1 Vsync   3 Vback  38 Vpol P
  Display Range Limits:
    Monitor ranges (GTF): 56-75 Hz V, 30-83 kHz H, max dotclock 140 MHz
    Display Product Serial Number: ...
    Display Product Name: 'AL1716A'
Checksum: 0x8b

----------------

Failures:

Block 0, Base EDID:
  Display Range Limits: GTF can't be combined with non-continuous frequencies.

EDID conformity: FAIL
