
EDID (hex):
00ffffffffffff00047246ad00000000
240f010308221b78e8dc55a359489e24
115054bfef0001010101010101010101
010101010101302a009851002a403070
1300520e1100001e000000fd00384b1e
530e000a202020202020000000ff0035
33353039463738505931310a000000fc
00414c313731360a202020202020006e

Extracted contents:
header:          00 ff ff ff ff ff ff 00
serial number:   04 72 46 ad 00 00 00 00 24 0f
version:         01 03
basic params:    08 22 1b 78 e8
chroma info:     dc 55 a3 59 48 9e 24 11 50 54
established:     bf ef 00
standard:        01 01 01 01 01 01 01 01 01 01 01 01 01 01 01 01
descriptor 1:    30 2a 00 98 51 00 2a 40 30 70 13 00 52 0e 11 00 00 1e
descriptor 2:    00 00 00 fd 00 38 4b 1e 53 0e 00 0a 20 20 20 20 20 20
descriptor 3:    00 00 00 ff 00 35 33 35 30 39 46 37 38 50 59 31 31 0a
descriptor 4:    00 00 00 fc 00 41 4c 31 37 31 36 0a 20 20 20 20 20 20
extensions:      00
checksum:        6e

EDID version: 1.3
Manufacturer: ACR Model ad46 Serial Number --
Analog display, Input voltage level: 0.7/0.3 V
Sync: Separate 
Maximum image size: 34 cm x 27 cm
Gamma: 2.20
DPMS levels: Standby Suspend Off
RGB color display
Display x,y Chromaticity:
  Red:   0.6396, 0.3486
  Green: 0.2841, 0.6171
  Blue:  0.1416, 0.0673
  White: 0.3134, 0.3291
Established timings supported:
  720x400@70Hz 9:5 HorFreq: 31469 Hz Clock: 28.320 MHz
  640x480@60Hz 4:3 HorFreq: 31469 Hz Clock: 25.175 MHz
  640x480@67Hz 4:3 HorFreq: 35000 Hz Clock: 30.240 MHz
  640x480@72Hz 4:3 HorFreq: 37900 Hz Clock: 31.500 MHz
  640x480@75Hz 4:3 HorFreq: 37500 Hz Clock: 31.500 MHz
  800x600@56Hz 4:3 HorFreq: 35200 Hz Clock: 36.000 MHz
  800x600@60Hz 4:3 HorFreq: 37900 Hz Clock: 40.000 MHz
  800x600@72Hz 4:3 HorFreq: 48100 Hz Clock: 50.000 MHz
  800x600@75Hz 4:3 HorFreq: 46900 Hz Clock: 49.500 MHz
  832x624@75Hz 4:3 HorFreq: 49726 Hz Clock: 57.284 MHz
  1024x768@60Hz 4:3 HorFreq: 48400 Hz Clock: 65.000 MHz
  1024x768@70Hz 4:3 HorFreq: 56500 Hz Clock: 75.000 MHz
  1024x768@75Hz 4:3 HorFreq: 60000 Hz Clock: 78.750 MHz
  1280x1024@75Hz 5:4 HorFreq: 80000 Hz Clock: 135.000 MHz
Standard timings supported:
Detailed mode: Clock 108.000 MHz, 338 mm x 270 mm
               1280 1328 1440 1688 hborder 0
               1024 1025 1028 1066 vborder 0
               +hsync +vsync 
               VertFreq: 60 Hz, HorFreq: 63981 Hz
Monitor ranges (GTF): 56-75Hz V, 30-83kHz H, max dotclock 140MHz
Serial number: --
Monitor name: AL1716
Checksum: 0x6e (valid)
EDID block does NOT conform to EDID 1.3!
	Missing preferred timing
EDID block does not conform at all!
	Bad year of manufacture
