edid-decode (hex):

00 ff ff ff ff ff ff 00 24 62 00 27 00 00 00 00
14 1c 01 04 a5 3c 22 78 33 87 e5 a4 56 50 9e 26
0d 50 54 af cf 00 b3 00 95 00 81 80 81 c0 71 4f
a9 c0 8b c0 01 00 40 83 80 a0 70 38 2a 40 30 20
35 00 40 44 21 00 00 1e 00 00 00 fd 00 28 90 a7
a7 22 01 0a 20 20 20 20 20 20 86 6f 80 a0 70 38
40 40 30 20 35 00 40 44 21 00 00 1e 00 00 00 fc
00 44 50 0a 20 20 20 20 20 20 20 20 20 20 01 41

02 03 0c c2 23 09 07 07 83 01 00 00 29 36 80 a0
70 38 1f 40 30 20 35 00 40 44 21 00 00 1a c5 58
00 a0 50 00 49 40 30 20 37 00 80 33 11 00 00 1a
c9 36 00 a0 40 00 37 30 30 20 34 00 33 e6 10 00
00 00 ab 22 20 a0 30 58 2b 20 30 20 34 00 f0 b4
00 00 00 00 00 00 00 00 00 00 00 00 00 00 00 00
00 00 00 00 00 00 00 00 00 00 00 00 00 00 00 00
00 00 00 00 00 00 00 00 00 00 00 00 00 00 00 2f

00 ff ff ff ff ff ff 00 24 62 00 27 00 00 00 00
14 1c 01 04 a5 3c 22 78 33 87 e5 a4 56 50 9e 26
0d 50 54 af cf 00 b3 00 95 00 81 80 81 c0 71 4f
a9 c0 8b c0 01 00 40 83 80 a0 70 38 2a 40 30 20
35 00 40 44 21 00 00 1e 00 00 00 fd 00 28 90 a7
a7 22 01 0a 20 20 20 20 20 20 86 6f 80 a0 70 38
40 40 30 20 35 00 40 44 21 00 00 1e 00 00 00 fc
00 44 50 0a 20 20 20 20 20 20 20 20 20 20 01 41

02 03 0c c2 23 09 07 07 83 01 00 00 29 36 80 a0
70 38 1f 40 30 20 35 00 40 44 21 00 00 1a c5 58
00 a0 50 00 49 40 30 20 37 00 80 33 11 00 00 1a
c9 36 00 a0 40 00 37 30 30 20 34 00 33 e6 10 00
00 00 ab 22 20 a0 30 58 2b 20 30 20 34 00 f0 b4
00 00 00 00 00 00 00 00 00 00 00 00 00 00 00 00
00 00 00 00 00 00 00 00 00 00 00 00 00 00 00 00
00 00 00 00 00 00 00 00 00 00 00 00 00 00 00 2f

----------------

Block 0, Base EDID:
  EDID Structure Version & Revision: 1.4
  Vendor & Product Identification:
    Manufacturer: ICB
    Model: 9984
    Made in: week 20 of 2018
  Basic Display Parameters & Features:
    Digital display
    Bits per primary color channel: 8
    DisplayPort interface
    Maximum image size: 60 cm x 34 cm
    Gamma: 2.20
    DPMS levels: Off
    Supported color formats: RGB 4:4:4, YCrCb 4:2:2
    First detailed timing includes the native pixel format and preferred refresh rate
    Display is continuous frequency
  Color Characteristics:
    Red  : 0.6425, 0.3359
    Green: 0.3134, 0.6201
    Blue : 0.1513, 0.0527
    White: 0.3134, 0.3291
  Established Timings I & II:
    IBM     :   720x400    70.081663 Hz   9:5     31.467 kHz     28.320000 MHz
    DMT 0x04:   640x480    59.940476 Hz   4:3     31.469 kHz     25.175000 MHz
    DMT 0x05:   640x480    72.808802 Hz   4:3     37.861 kHz     31.500000 MHz
    DMT 0x06:   640x480    75.000000 Hz   4:3     37.500 kHz     31.500000 MHz
    DMT 0x08:   800x600    56.250000 Hz   4:3     35.156 kHz     36.000000 MHz
    DMT 0x09:   800x600    60.316541 Hz   4:3     37.879 kHz     40.000000 MHz
    DMT 0x0a:   800x600    72.187572 Hz   4:3     48.077 kHz     50.000000 MHz
    DMT 0x0b:   800x600    75.000000 Hz   4:3     46.875 kHz     49.500000 MHz
    DMT 0x10:  1024x768    60.003840 Hz   4:3     48.363 kHz     65.000000 MHz
    DMT 0x11:  1024x768    70.069359 Hz   4:3     56.476 kHz     75.000000 MHz
    DMT 0x12:  1024x768    75.028582 Hz   4:3     60.023 kHz     78.750000 MHz
    DMT 0x24:  1280x1024   75.024675 Hz   5:4     79.976 kHz    135.000000 MHz
  Standard Timings:
    DMT 0x3a:  1680x1050   59.954250 Hz  16:10    65.290 kHz    146.250000 MHz
    DMT 0x2f:  1440x900    59.887445 Hz  16:10    55.935 kHz    106.500000 MHz
    DMT 0x23:  1280x1024   60.019740 Hz   5:4     63.981 kHz    108.000000 MHz
    DMT 0x55:  1280x720    60.000000 Hz  16:9     45.000 kHz     74.250000 MHz
    DMT 0x15:  1152x864    75.000000 Hz   4:3     67.500 kHz    108.000000 MHz
    DMT 0x53:  1600x900    60.000000 Hz  16:9     60.000 kHz    108.000000 MHz (RB)
    GTF     :  1360x765    60.000341 Hz  16:9     47.520 kHz     84.396000 MHz
  Detailed Timing Descriptors:
    DTD  1:  1920x1080  143.973673 Hz  16:9    161.538 kHz    336.000000 MHz (576 mm x 324 mm)
                  Hfront   48 Hsync  32 Hback   80 Hpol P
                  Vfront    3 Vsync   5 Vback   34 Vpol P
    Display Range Limits:
      Monitor ranges (Bare Limits): 40-144 Hz V, 167-167 kHz H, max dotclock 340 MHz
    DTD  2:  1920x1080  119.982181 Hz  16:9    137.260 kHz    285.500000 MHz (576 mm x 324 mm)
                  Hfront   48 Hsync  32 Hback   80 Hpol P
                  Vfront    3 Vsync   5 Vback   56 Vpol P
    Display Product Name: 'DP'
  Extension blocks: 1
Checksum: 0x41

----------------

Block 1, CTA-861 Extension Block:
  Revision: 3
  Underscans IT Video Formats by default
  Basic audio support
  Native detailed modes: 2
  Audio Data Block:
    Linear PCM:
      Max channels: 2
      Supported sample rates (kHz): 48 44.1 32
      Supported sample sizes (bits): 24 20 16
  Speaker Allocation Data Block:
    FL/FR - Front Left/Right
  Detailed Timing Descriptors:
    DTD  3:  1920x1080   59.998788 Hz  16:9     66.659 kHz    138.650000 MHz (576 mm x 324 mm)
                  Hfront   48 Hsync  32 Hback   80 Hpol P
                  Vfront    3 Vsync   5 Vback   23 Vpol N
    DTD  4:  1280x1024  143.858250 Hz   5:4    157.812 kHz    227.250000 MHz (384 mm x 307 mm)
                  Hfront   48 Hsync  32 Hback   80 Hpol P
                  Vfront    3 Vsync   7 Vback   63 Vpol N
    DTD  5:  1024x768   143.930002 Hz   4:3    118.454 kHz    140.250000 MHz (analog composite, sync-on-green, 307 mm x 230 mm)
                  Hfront   48 Hsync  32 Hback   80 Hpol N
                  Vfront    3 Vsync   4 Vback   48 Vpol N
    DTD  6:   800x600   143.775920 Hz   4:3     92.448 kHz     88.750000 MHz (analog composite, sync-on-green, 240 mm x 180 mm)
                  Hfront   48 Hsync  32 Hback   80 Hpol N
                  Vfront    3 Vsync   4 Vback   36 Vpol N
Checksum: 0x2f  Unused space in Extension Block: 43 bytes

----------------

Block 2, Unknown EDID Extension Block 0x00:
  00 ff ff ff ff ff ff 00 24 62 00 27 00 00 00 00 '........$b.'....'
  14 1c 01 04 a5 3c 22 78 33 87 e5 a4 56 50 9e 26 '.....<"x3...VP.&'
  0d 50 54 af cf 00 b3 00 95 00 81 80 81 c0 71 4f '.PT...........qO'
  a9 c0 8b c0 01 00 40 83 80 a0 70 38 2a 40 30 20 '......@...p8*@0 '
  35 00 40 44 21 00 00 1e 00 00 00 fd 00 28 90 a7 '5.@D!........(..'
  a7 22 01 0a 20 20 20 20 20 20 86 6f 80 a0 70 38 '."..      .o..p8'
  40 40 30 20 35 00 40 44 21 00 00 1e 00 00 00 fc '@@0 5.@D!.......'
  00 44 50 0a 20 20 20 20 20 20 20 20 20 20 01 41 '.DP.          .A'
Checksum: 0x41

----------------

Block 3, CTA-861 Extension Block:
  Revision: 3
  Underscans IT Video Formats by default
  Basic audio support
  Native detailed modes: 2
  Audio Data Block:
    Linear PCM:
      Max channels: 2
      Supported sample rates (kHz): 48 44.1 32
      Supported sample sizes (bits): 24 20 16
  Speaker Allocation Data Block:
    FL/FR - Front Left/Right
  Detailed Timing Descriptors:
    DTD  7:  1920x1080   59.998788 Hz  16:9     66.659 kHz    138.650000 MHz (576 mm x 324 mm)
                  Hfront   48 Hsync  32 Hback   80 Hpol P
                  Vfront    3 Vsync   5 Vback   23 Vpol N
    DTD  8:  1280x1024  143.858250 Hz   5:4    157.812 kHz    227.250000 MHz (384 mm x 307 mm)
                  Hfront   48 Hsync  32 Hback   80 Hpol P
                  Vfront    3 Vsync   7 Vback   63 Vpol N
    DTD  9:  1024x768   143.930002 Hz   4:3    118.454 kHz    140.250000 MHz (analog composite, sync-on-green, 307 mm x 230 mm)
                  Hfront   48 Hsync  32 Hback   80 Hpol N
                  Vfront    3 Vsync   4 Vback   48 Vpol N
    DTD 10:   800x600   143.775920 Hz   4:3     92.448 kHz     88.750000 MHz (analog composite, sync-on-green, 240 mm x 180 mm)
                  Hfront   48 Hsync  32 Hback   80 Hpol N
                  Vfront    3 Vsync   4 Vback   36 Vpol N
Checksum: 0x2f  Unused space in Extension Block: 43 bytes

----------------

Warnings:

Block 0, Base EDID:
  Standard Timings: Standard Timing 1360x765 has a dubious odd vertical resolution.
Block 1, CTA-861 Extension Block:
  Add a Colorimetry Data Block with the sRGB colorimetry bit set to avoid interop issues.
Block 3, CTA-861 Extension Block:
  Add a Colorimetry Data Block with the sRGB colorimetry bit set to avoid interop issues.
EDID:
  Base EDID: Some timings are out of range of the Monitor Ranges:
    Horizontal Freq: 31.466 - 161.538 kHz (Monitor: 167.000 - 167.000 kHz)
  CTA-861: Multiple native progressive timings are defined.

Failures:

Block 0, Base EDID:
  Standard Timings: Use 0x0101 as the invalid Standard Timings code, not 0x0100.
  Detailed Timing Descriptor #1: Mismatch of image size 576x324 mm vs display size 600x340 mm.
  Detailed Timing Descriptor #2: Mismatch of image size 576x324 mm vs display size 600x340 mm.
  Detailed Timing Descriptor #2: Invalid detailed timing descriptor ordering.
Block 1, CTA-861 Extension Block:
  Detailed Timing Descriptor #3: Mismatch of image size 576x324 mm vs display size 600x340 mm.
  Detailed Timing Descriptor #4: Mismatch of image size 384x307 mm vs display size 600x340 mm.
  Detailed Timing Descriptor #5: Mismatch of image size 307x230 mm vs display size 600x340 mm.
  Detailed Timing Descriptor #6: Mismatch of image size 240x180 mm vs display size 600x340 mm.
  Missing VCDB, needed for Set Selectable RGB Quantization to avoid interop issues.
Block 2, Base EDID:
  Unknown Extension Block.
Block 3, CTA-861 Extension Block:
  Speaker Allocation Data Block: Only one instance of this Data Block is allowed.
  Detailed Timing Descriptor #7: Mismatch of image size 576x324 mm vs display size 600x340 mm.
  Detailed Timing Descriptor #8: Mismatch of image size 384x307 mm vs display size 600x340 mm.
  Detailed Timing Descriptor #9: Mismatch of image size 307x230 mm vs display size 600x340 mm.
  Detailed Timing Descriptor #10: Mismatch of image size 240x180 mm vs display size 600x340 mm.
  Missing VCDB, needed for Set Selectable RGB Quantization to avoid interop issues.
EDID:
  Base EDID: EDID specified 1 extension block(s), but found 3 extension block(s).

EDID conformity: FAIL
