edid-decode (hex):

00 ff ff ff ff ff ff 00 09 d1 05 79 45 54 00 00
26 11 01 03 0e 29 1a 78 2e e5 b5 a3 55 49 99 27
13 50 54 a5 6b 80 71 00 81 00 95 00 95 0f 81 80
81 40 01 01 01 01 9a 29 a0 d0 51 84 20 30 50 98
36 00 9a 00 11 00 00 1c 00 00 00 ff 00 4c 39 37
30 31 36 32 33 30 32 36 0a 20 00 00 00 fd 00 37
4c 1f 53 0f 00 0a 20 20 20 20 20 20 00 00 00 fc
00 42 65 6e 51 20 45 39 30 30 57 0a 20 20 00 8e

00 ff ff ff ff ff ff 00 09 d1 05 79 45 54 00 00
26 11 01 03 0e 29 1a 78 2e e5 b5 a3 55 49 99 27
13 50 54 a5 6b 80 71 00 81 00 95 00 95 0f 81 80
81 40 01 01 01 01 9a 29 a0 d0 51 84 20 30 50 98
36 00 9a 00 11 00 00 1c 00 00 00 ff 00 4c 39 37
30 31 36 32 33 30 32 36 0a 20 00 00 00 fd 00 37
4c 1f 53 0f 00 0a 20 20 20 20 20 20 00 00 00 fc
00 42 65 6e 51 20 45 39 30 30 57 0a 20 20 00 8e

----------------

Block 0, Base EDID:
  EDID Structure Version & Revision: 1.3
  Vendor & Product Identification:
    Manufacturer: BNQ
    Model: 30981
    Serial Number: ...
    Made in: week 38 of 2007
  Basic Display Parameters & Features:
    Analog display
    Signal Level Standard: 0.700 : 0.300 : 1.000 V p-p
    Blank level equals black level
    Sync: Separate Composite SyncOnGreen
    Maximum image size: 41 cm x 26 cm
    Gamma: 2.20
    DPMS levels: Off
    RGB color display
    Default (sRGB) color space is primary color space
    First detailed timing is the preferred timing
  Color Characteristics:
    Red  : 0.6396, 0.3339
    Green: 0.2861, 0.5986
    Blue : 0.1542, 0.0771
    White: 0.3134, 0.3291
  Established Timings I & II:
    IBM     :   720x400    70.081663 Hz   9:5     31.467 kHz     28.320000 MHz
    DMT 0x04:   640x480    59.940476 Hz   4:3     31.469 kHz     25.175000 MHz
    DMT 0x06:   640x480    75.000000 Hz   4:3     37.500 kHz     31.500000 MHz
    DMT 0x09:   800x600    60.316541 Hz   4:3     37.879 kHz     40.000000 MHz
    DMT 0x0b:   800x600    75.000000 Hz   4:3     46.875 kHz     49.500000 MHz
    Apple   :   832x624    74.551266 Hz   4:3     49.726 kHz     57.284000 MHz
    DMT 0x10:  1024x768    60.003840 Hz   4:3     48.363 kHz     65.000000 MHz
    DMT 0x12:  1024x768    75.028582 Hz   4:3     60.023 kHz     78.750000 MHz
    DMT 0x24:  1280x1024   75.024675 Hz   5:4     79.976 kHz    135.000000 MHz
    Apple   :  1152x870    75.061550 Hz 192:145   68.681 kHz    100.000000 MHz
  Standard Timings:
    GTF     :  1152x720    59.999964 Hz  16:10    44.760 kHz     67.319000 MHz
    DMT 0x1c:  1280x800    59.810326 Hz  16:10    49.702 kHz     83.500000 MHz
    DMT 0x2f:  1440x900    59.887445 Hz  16:10    55.935 kHz    106.500000 MHz
    DMT 0x30:  1440x900    74.984427 Hz  16:10    70.635 kHz    136.750000 MHz
    DMT 0x23:  1280x1024   60.019740 Hz   5:4     63.981 kHz    108.000000 MHz
    DMT 0x20:  1280x960    60.000000 Hz   4:3     60.000 kHz    108.000000 MHz
  Detailed Timing Descriptors:
    DTD 1:  1440x900    60.015959 Hz  16:10    55.935 kHz    106.500000 MHz (410 mm x 256 mm)
                 Hfront   80 Hsync 152 Hback  232 Hpol N
                 Vfront    3 Vsync   6 Vback   23 Vpol P
    Display Product Serial Number: ...
    Display Range Limits:
      Monitor ranges (GTF): 55-76 Hz V, 31-83 kHz H, max dotclock 150 MHz
    Display Product Name: 'BenQ E900W'
Checksum: 0x8e

----------------

Block 1, Unknown EDID Extension Block 0x00:
  00 ff ff ff ff ff ff 00 09 d1 05 79 45 54 00 00 '...........yET..'
  26 11 01 03 0e 29 1a 78 2e e5 b5 a3 55 49 99 27 '&....).x....UI.''
  13 50 54 a5 6b 80 71 00 81 00 95 00 95 0f 81 80 '.PT.k.q.........'
  81 40 01 01 01 01 9a 29 a0 d0 51 84 20 30 50 98 '.@.....)..Q. 0P.'
  36 00 9a 00 11 00 00 1c 00 00 00 ff 00 4c 39 37 '6............L97'
  30 31 36 32 33 30 32 36 0a 20 00 00 00 fd 00 37 '01623026. .....7'
  4c 1f 53 0f 00 0a 20 20 20 20 20 20 00 00 00 fc 'L.S...      ....'
  00 42 65 6e 51 20 45 39 30 30 57 0a 20 20 00 8e '.BenQ E900W.  ..'
Checksum: 0x8e

----------------

Failures:

Block 0, Base EDID:
  Basic Display Parameters & Features: sRGB is signaled, but the chromaticities do not match.
Block 1, Base EDID:
  Unknown Extension Block.
EDID:
  Base EDID: EDID specified 0 extension block(s), but found 1 extension block(s).

EDID conformity: FAIL
