edid-decode (hex):

00 ff ff ff ff ff ff 00 34 ac 22 48 01 01 01 01
15 14 01 03 08 33 1d 78 ea f8 05 a4 55 4d 9d 25
12 50 54 bf ef 80 71 4f 81 80 81 4f 8b c0 a9 c0
b3 00 01 01 01 01 02 3a 80 18 71 38 2d 40 58 2c
45 00 fd 1e 11 00 00 1e 00 00 00 fd 00 38 4c 1f
52 10 00 0a 20 20 20 20 20 20 00 00 00 fc 00 52
44 54 32 33 32 57 58 0a 20 20 20 20 00 00 00 ff
00 30 35 32 30 33 32 36 30 41 4a 0a 20 20 00 07

00 ff ff ff ff ff ff 00 34 ac 22 48 01 01 01 01
15 14 01 03 08 33 1d 78 ea f8 05 a4 55 4d 9d 25
12 50 54 bf ef 80 71 4f 81 80 81 4f 8b c0 a9 c0
b3 00 01 01 01 01 02 3a 80 18 71 38 2d 40 58 2c
45 00 fd 1e 11 00 00 1e 00 00 00 fd 00 38 4c 1f
52 10 00 0a 20 20 20 20 20 20 00 00 00 fc 00 52
44 54 32 33 32 57 58 0a 20 20 20 20 00 00 00 ff
00 30 35 32 30 33 32 36 30 41 4a 0a 20 20 00 07

----------------

Block 0, Base EDID:
  EDID Structure Version & Revision: 1.3
  Vendor & Product Identification:
    Manufacturer: MEL
    Model: 18466
    Serial Number: ...
    Made in: week 21 of 2010
  Basic Display Parameters & Features:
    Analog display
    Signal Level Standard: 0.700 : 0.300 : 1.000 V p-p
    Blank level equals black level
    Sync: Separate
    Maximum image size: 51 cm x 29 cm
    Gamma: 2.20
    DPMS levels: Standby Suspend Off
    RGB color display
    First detailed timing is the preferred timing
  Color Characteristics:
    Red  : 0.6435, 0.3349
    Green: 0.3027, 0.6132
    Blue : 0.1445, 0.0703
    White: 0.3134, 0.3291
  Established Timings I & II:
    IBM     :   720x400    70.081663 Hz   9:5     31.467 kHz     28.320000 MHz
    DMT 0x04:   640x480    59.940476 Hz   4:3     31.469 kHz     25.175000 MHz
    Apple   :   640x480    66.666667 Hz   4:3     35.000 kHz     30.240000 MHz
    DMT 0x05:   640x480    72.808802 Hz   4:3     37.861 kHz     31.500000 MHz
    DMT 0x06:   640x480    75.000000 Hz   4:3     37.500 kHz     31.500000 MHz
    DMT 0x08:   800x600    56.250000 Hz   4:3     35.156 kHz     36.000000 MHz
    DMT 0x09:   800x600    60.316541 Hz   4:3     37.879 kHz     40.000000 MHz
    DMT 0x0a:   800x600    72.187572 Hz   4:3     48.077 kHz     50.000000 MHz
    DMT 0x0b:   800x600    75.000000 Hz   4:3     46.875 kHz     49.500000 MHz
    Apple   :   832x624    74.551266 Hz   4:3     49.726 kHz     57.284000 MHz
    DMT 0x10:  1024x768    60.003840 Hz   4:3     48.363 kHz     65.000000 MHz
    DMT 0x11:  1024x768    70.069359 Hz   4:3     56.476 kHz     75.000000 MHz
    DMT 0x12:  1024x768    75.028582 Hz   4:3     60.023 kHz     78.750000 MHz
    DMT 0x24:  1280x1024   75.024675 Hz   5:4     79.976 kHz    135.000000 MHz
    Apple   :  1152x870    75.061550 Hz 192:145   68.681 kHz    100.000000 MHz
  Standard Timings:
    DMT 0x15:  1152x864    75.000000 Hz   4:3     67.500 kHz    108.000000 MHz
    DMT 0x23:  1280x1024   60.019740 Hz   5:4     63.981 kHz    108.000000 MHz
    GTF     :  1280x960    74.999884 Hz   4:3     75.150 kHz    129.859000 MHz
    GTF     :  1360x765    60.000341 Hz  16:9     47.520 kHz     84.396000 MHz
    DMT 0x53:  1600x900    60.000000 Hz  16:9     60.000 kHz    108.000000 MHz (RB)
    DMT 0x3a:  1680x1050   59.954250 Hz  16:10    65.290 kHz    146.250000 MHz
  Detailed Timing Descriptors:
    DTD 1:  1920x1080   60.000000 Hz  16:9     67.500 kHz    148.500000 MHz (509 mm x 286 mm)
                 Hfront   88 Hsync  44 Hback  148 Hpol P
                 Vfront    4 Vsync   5 Vback   36 Vpol P
    Display Range Limits:
      Monitor ranges (GTF): 56-76 Hz V, 31-82 kHz H, max dotclock 160 MHz
    Display Product Name: 'RDT232WX'
    Display Product Serial Number: ...
Checksum: 0x07

----------------

Block 1, Unknown EDID Extension Block 0x00:
  00 ff ff ff ff ff ff 00 34 ac 22 48 01 01 01 01 '........4."H....'
  15 14 01 03 08 33 1d 78 ea f8 05 a4 55 4d 9d 25 '.....3.x....UM.%'
  12 50 54 bf ef 80 71 4f 81 80 81 4f 8b c0 a9 c0 '.PT...qO...O....'
  b3 00 01 01 01 01 02 3a 80 18 71 38 2d 40 58 2c '.......:..q8-@X,'
  45 00 fd 1e 11 00 00 1e 00 00 00 fd 00 38 4c 1f 'E............8L.'
  52 10 00 0a 20 20 20 20 20 20 00 00 00 fc 00 52 'R...      .....R'
  44 54 32 33 32 57 58 0a 20 20 20 20 00 00 00 ff 'DT232WX.    ....'
  00 30 35 32 30 33 32 36 30 41 4a 0a 20 20 00 07 '.05203260AJ.  ..'
Checksum: 0x07

----------------

Warnings:

Block 0, Base EDID:
  Standard Timings: Standard Timing 1360x765 has a dubious odd vertical resolution.

Failures:

Block 1, Base EDID:
  Unknown Extension Block.
EDID:
  Base EDID: EDID specified 0 extension block(s), but found 1 extension block(s).

EDID conformity: FAIL
