
EDID (hex):
00ffffffffffff004dd9500158306100
140701012e1c15a0e80dc9a057479827
12484cfffe8045598180615901010101
010101010101d60980a020e02d101060
0a020eca10000018d60980a020e02d10
10600a020eca10000018d60980a020e0
2d1010600a020eca10000018d60980a0
20e02d1010600a020eca100000180069

Extracted contents:
header:          00 ff ff ff ff ff ff 00
serial number:   4d d9 50 01 58 30 61 00 14 07
version:         01 01
basic params:    2e 1c 15 a0 e8
chroma info:     0d c9 a0 57 47 98 27 12 48 4c
established:     ff fe 80
standard:        45 59 81 80 61 59 01 01 01 01 01 01 01 01 01 01
descriptor 1:    d6 09 80 a0 20 e0 2d 10 10 60 0a 02 0e ca 10 00 00 18
descriptor 2:    d6 09 80 a0 20 e0 2d 10 10 60 0a 02 0e ca 10 00 00 18
descriptor 3:    d6 09 80 a0 20 e0 2d 10 10 60 0a 02 0e ca 10 00 00 18
descriptor 4:    d6 09 80 a0 20 e0 2d 10 10 60 0a 02 0e ca 10 00 00 18
extensions:      00
checksum:        69

EDID version: 1.1
Manufacturer: SNY Model 150 Serial Number --
Analog display, Input voltage level: 0.714/0.286 V
Sync: Separate Composite SyncOnGreen 
Maximum image size: 28 cm x 21 cm
Gamma: 2.60
DPMS levels: Standby Suspend Off
RGB color display
Display x,y Chromaticity:
  Red:   0.6250, 0.3398
  Green: 0.2802, 0.5947
  Blue:  0.1552, 0.0703
  White: 0.2832, 0.2978
Established timings supported:
  720x400@70Hz 9:5 HorFreq: 31469 Hz Clock: 28.320 MHz
  720x400@88Hz 9:5 HorFreq: 39500 Hz Clock: 35.500 MHz
  640x480@60Hz 4:3 HorFreq: 31469 Hz Clock: 25.175 MHz
  640x480@67Hz 4:3 HorFreq: 35000 Hz Clock: 30.240 MHz
  640x480@72Hz 4:3 HorFreq: 37900 Hz Clock: 31.500 MHz
  640x480@75Hz 4:3 HorFreq: 37500 Hz Clock: 31.500 MHz
  800x600@56Hz 4:3 HorFreq: 35200 Hz Clock: 36.000 MHz
  800x600@60Hz 4:3 HorFreq: 37900 Hz Clock: 40.000 MHz
  800x600@72Hz 4:3 HorFreq: 48100 Hz Clock: 50.000 MHz
  800x600@75Hz 4:3 HorFreq: 46900 Hz Clock: 49.500 MHz
  832x624@75Hz 4:3 HorFreq: 49726 Hz Clock: 57.284 MHz
  1280x768i@87Hz 5:3 HorFreq: 35522 Hz Clock: 44.900 MHz
  1024x768@60Hz 4:3 HorFreq: 48400 Hz Clock: 65.000 MHz
  1024x768@70Hz 4:3 HorFreq: 56500 Hz Clock: 75.000 MHz
  1024x768@75Hz 4:3 HorFreq: 60000 Hz Clock: 78.750 MHz
  1152x870@75Hz 192:145 HorFreq: 67500 Hz Clock: 108.000 MHz
Standard timings supported:
  800x600@85Hz 4:3 HorFreq: 53700 Hz Clock: 56.250 MHz
  1280x1024@60Hz 5:4 HorFreq: 64000 Hz Clock: 108.000 MHz
  1024x768@85Hz 4:3 HorFreq: 68700 Hz Clock: 94.500 MHz
Detailed mode: Clock 25.180 MHz, 270 mm x 202 mm
                640  656  752  800 hborder 0
                480  480  522  525 vborder 0
               -hsync -vsync 
               VertFreq: 59 Hz, HorFreq: 31475 Hz
Detailed mode: Clock 25.180 MHz, 270 mm x 202 mm
                640  656  752  800 hborder 0
                480  480  522  525 vborder 0
               -hsync -vsync 
               VertFreq: 59 Hz, HorFreq: 31475 Hz
Detailed mode: Clock 25.180 MHz, 270 mm x 202 mm
                640  656  752  800 hborder 0
                480  480  522  525 vborder 0
               -hsync -vsync 
               VertFreq: 59 Hz, HorFreq: 31475 Hz
Detailed mode: Clock 25.180 MHz, 270 mm x 202 mm
                640  656  752  800 hborder 0
                480  480  522  525 vborder 0
               -hsync -vsync 
               VertFreq: 59 Hz, HorFreq: 31475 Hz
Checksum: 0x69 (valid)
EDID block does not conform at all!
	Bad year of manufacture
