
EDID (hex):
00ffffffffffff000472040732fe7012
1b1f0104b5351e783b51b5a4544fa026
0d5054bfef80714f8140818081c08100
9500b300d1c00882805070384d400820
f80c0f282100001c023a801871382d40
582c45000f282100001e000000fd0030
90b4b422010a202020202020000000fc
0056473234305920500a2020202001dd
02032ef14b010304121305143f1f9007
2309070783010000e200d567030c0010
003842e305c000e606050161561c023a
801871382d40582c45000f282100001e
011d007251d01e206e2855000f282100
001e246b8050703840400820280c0f28
2100001c000000000000000000000000
000000000000000000000000000000a4

Extracted contents:
header:          00 ff ff ff ff ff ff 00
serial number:   04 72 04 07 32 fe 70 12 1b 1f
version:         01 04
basic params:    b5 35 1e 78 3b
chroma info:     51 b5 a4 54 4f a0 26 0d 50 54
established:     bf ef 80
standard:        71 4f 81 40 81 80 81 c0 81 00 95 00 b3 00 d1 c0
descriptor 1:    08 82 80 50 70 38 4d 40 08 20 f8 0c 0f 28 21 00 00 1c
descriptor 2:    02 3a 80 18 71 38 2d 40 58 2c 45 00 0f 28 21 00 00 1e
descriptor 3:    00 00 00 fd 00 30 90 b4 b4 22 01 0a 20 20 20 20 20 20
descriptor 4:    00 00 00 fc 00 56 47 32 34 30 59 20 50 0a 20 20 20 20
extensions:      01
checksum:        dd

EDID version: 1.4
Manufacturer: ACR Model 704 Serial Number --
Made in week 27 of 2021
Digital display
10 bits per primary color channel
DisplayPort interface
Maximum image size: 53 cm x 30 cm
Gamma: 2.20
DPMS levels: Off
Supported color formats: RGB 4:4:4, YCrCb 4:4:4, YCrCb 4:2:2
First detailed timing includes the native pixel format and preferred refresh rate
Display is continuous frequency
Display x,y Chromaticity:
  Red:   0.6416, 0.3291
  Green: 0.3085, 0.6259
  Blue:  0.1503, 0.0537
  White: 0.3134, 0.3291
Established timings supported:
  720x400@70Hz 9:5 HorFreq: 31469 Hz Clock: 28.320 MHz
  640x480@60Hz 4:3 HorFreq: 31469 Hz Clock: 25.175 MHz
  640x480@67Hz 4:3 HorFreq: 35000 Hz Clock: 30.240 MHz
  640x480@72Hz 4:3 HorFreq: 37900 Hz Clock: 31.500 MHz
  640x480@75Hz 4:3 HorFreq: 37500 Hz Clock: 31.500 MHz
  800x600@56Hz 4:3 HorFreq: 35200 Hz Clock: 36.000 MHz
  800x600@60Hz 4:3 HorFreq: 37900 Hz Clock: 40.000 MHz
  800x600@72Hz 4:3 HorFreq: 48100 Hz Clock: 50.000 MHz
  800x600@75Hz 4:3 HorFreq: 46900 Hz Clock: 49.500 MHz
  832x624@75Hz 4:3 HorFreq: 49726 Hz Clock: 57.284 MHz
  1024x768@60Hz 4:3 HorFreq: 48400 Hz Clock: 65.000 MHz
  1024x768@70Hz 4:3 HorFreq: 56500 Hz Clock: 75.000 MHz
  1024x768@75Hz 4:3 HorFreq: 60000 Hz Clock: 78.750 MHz
  1280x1024@75Hz 5:4 HorFreq: 80000 Hz Clock: 135.000 MHz
  1152x870@75Hz 192:145 HorFreq: 67500 Hz Clock: 108.000 MHz
Standard timings supported:
  1152x864@75Hz 4:3 HorFreq: 67500 Hz Clock: 108.000 MHz
  1280x960@60Hz 4:3 HorFreq: 60000 Hz Clock: 108.000 MHz
  1280x1024@60Hz 5:4 HorFreq: 64000 Hz Clock: 108.000 MHz
  1280x720@60Hz 16:9
  1280x800@60Hz 16:10
  1440x900@60Hz 16:10 HorFreq: 55500 Hz Clock: 88.750 MHz
  1680x1050@60Hz 16:10 HorFreq: 64700 Hz Clock: 119.000 MHz
  1920x1080@60Hz 16:9
Detailed mode: Clock 332.880 MHz, 527 mm x 296 mm
               1920 1928 1960 2000 hborder 0
               1080 1143 1151 1157 vborder 0
               -hsync +vsync 
               VertFreq: 143 Hz, HorFreq: 166440 Hz
Detailed mode: Clock 148.500 MHz, 527 mm x 296 mm
               1920 2008 2052 2200 hborder 0
               1080 1084 1089 1125 vborder 0
               +hsync +vsync 
               VertFreq: 60 Hz, HorFreq: 67500 Hz
Monitor ranges (bare limits): 48-144Hz V, 180-180kHz H, max dotclock 340MHz
Monitor name: VG240Y P
Has 1 extension blocks
Checksum: 0xdd (valid)

CTA extension block
Extension version: 3
42 bytes of CTA data
  Video data block
    VIC   1 640x480@60Hz 4:3  HorFreq: 31469 Hz Clock: 25.175 MHz
    VIC   3 720x480@60Hz 16:9  HorFreq: 31469 Hz Clock: 27.000 MHz
    VIC   4 1280x720@60Hz 16:9  HorFreq: 45000 Hz Clock: 74.250 MHz
    VIC  18 720x576@50Hz 16:9  HorFreq: 31250 Hz Clock: 27.000 MHz
    VIC  19 1280x720@50Hz 16:9  HorFreq: 37500 Hz Clock: 74.250 MHz
    VIC   5 1920x1080i@60Hz 16:9  HorFreq: 33750 Hz Clock: 74.250 MHz
    VIC  20 1920x1080i@50Hz 16:9  HorFreq: 28125 Hz Clock: 74.250 MHz
    VIC  63 1920x1080@120Hz 16:9  HorFreq: 135000 Hz Clock: 297.000 MHz
    VIC  31 1920x1080@50Hz 16:9  HorFreq: 56250 Hz Clock: 148.500 MHz
    VIC  16 1920x1080@60Hz 16:9 (native) HorFreq: 67500 Hz Clock: 148.500 MHz
    VIC   7 1440x480i@60Hz 16:9  HorFreq: 15734 Hz Clock: 27.000 MHz
  Audio data block
    Linear PCM, max channels 2
      Supported sample rates (kHz): 48 44.1 32
      Supported sample sizes (bits): 24 20 16
  Speaker allocation data block
    Speaker map:
      FL/FR - Front Left/Right
  Extended tag: Video capability data block
    YCbCr quantization: Selectable (via AVI YQ) (1)
    RGB quantization: Selectable (via AVI Q) (1)
    PT scan behaviour: Always Overscannned (1)
    IT scan behaviour: Always Overscannned (1)
    CE scan behaviour: Always Overscannned (1)
  Vendor-specific data block, OUI 000c03 (HDMI)
    Source physical address 1.0.0.0
    DC_36bit
    DC_30bit
    DC_Y444
    Maximum TMDS clock: 330MHz
  Extended tag: Colorimetry data block
    BT2020YCC
    BT2020RGB
  Extended tag: HDR static metadata data block
    Electro optical transfer functions:
      Traditional gamma - SDR luminance range
      SMPTE ST2084
    Supported static metadata descriptors:
      Static metadata type 1
    Desired content max luminance: 97 (408.759 cd/m^2)
    Desired content max frame-average luminance: 86 (322.098 cd/m^2)
    Desired content min luminance: 28 (0.049 cd/m^2)
Underscans PC formats by default
Basic audio support
Supports YCbCr 4:4:4
Supports YCbCr 4:2:2
1 native detailed modes
Detailed mode: Clock 148.500 MHz, 527 mm x 296 mm
               1920 2008 2052 2200 hborder 0
               1080 1084 1089 1125 vborder 0
               +hsync +vsync 
               VertFreq: 60 Hz, HorFreq: 67500 Hz
Detailed mode: Clock 74.250 MHz, 527 mm x 296 mm
               1280 1390 1430 1650 hborder 0
                720  725  730  750 vborder 0
               +hsync +vsync 
               VertFreq: 60 Hz, HorFreq: 45000 Hz
Detailed mode: Clock 274.280 MHz, 527 mm x 296 mm
               1920 1928 1960 2000 hborder 0
               1080 1130 1138 1144 vborder 0
               -hsync +vsync 
               VertFreq: 119 Hz, HorFreq: 137140 Hz
Checksum: 0xa4 (valid)

Warning: One or more of the timings is out of range of the Monitor Ranges:
  Vertical Freq: 50 - 143 Hz
  Horizontal Freq: 15734 - 166440 Hz
  Maximum Clock: 332.880 MHz
