
EDID (hex):
00ffffffffffff000469a42401010101
0d170104a5351e783a9de5a654549f26
0d5054b7ef00714f8180814081c08100
9500b3000101023a801871382d40582c
4500132b2100001e000000fd0032961e
a021000a202020202020000000fc0056
473234380a20202020202020000000ff
0044334c4d51533039383030350a01cd
020318f14b900504030201111213141f
2309070783010000023a801871382d40
582c4500132b2100001e8a4d80a07038
2c4030203500132b2100001afe5b80a0
7038354030203500132b2100001a866f
80a07038404030203500132b2100001a
057c80587038124018203500132b2100
001e000000000000000000000000009c

Extracted contents:
header:          00 ff ff ff ff ff ff 00
serial number:   04 69 a4 24 01 01 01 01 0d 17
version:         01 04
basic params:    a5 35 1e 78 3a
chroma info:     9d e5 a6 54 54 9f 26 0d 50 54
established:     b7 ef 00
standard:        71 4f 81 80 81 40 81 c0 81 00 95 00 b3 00 01 01
descriptor 1:    02 3a 80 18 71 38 2d 40 58 2c 45 00 13 2b 21 00 00 1e
descriptor 2:    00 00 00 fd 00 32 96 1e a0 21 00 0a 20 20 20 20 20 20
descriptor 3:    00 00 00 fc 00 56 47 32 34 38 0a 20 20 20 20 20 20 20
descriptor 4:    00 00 00 ff 00 44 33 4c 4d 51 53 30 39 38 30 30 35 0a
extensions:      01
checksum:        cd

EDID version: 1.4
Manufacturer: ACI Model 24a4 Serial Number --
Made in week 13 of 2013
Digital display
8 bits per primary color channel
DisplayPort interface
Maximum image size: 53 cm x 30 cm
Gamma: 2.20
DPMS levels: Off
Supported color formats: RGB 4:4:4, YCrCb 4:4:4, YCrCb 4:2:2
First detailed timing includes the native pixel format and preferred refresh rate
Display x,y Chromaticity:
  Red:   0.6503, 0.3291
  Green: 0.3310, 0.6220
  Blue:  0.1513, 0.0527
  White: 0.3134, 0.3291
Established timings supported:
  720x400@70Hz 9:5 HorFreq: 31469 Hz Clock: 28.320 MHz
  640x480@60Hz 4:3 HorFreq: 31469 Hz Clock: 25.175 MHz
  640x480@67Hz 4:3 HorFreq: 35000 Hz Clock: 30.240 MHz
  640x480@75Hz 4:3 HorFreq: 37500 Hz Clock: 31.500 MHz
  800x600@56Hz 4:3 HorFreq: 35200 Hz Clock: 36.000 MHz
  800x600@60Hz 4:3 HorFreq: 37900 Hz Clock: 40.000 MHz
  800x600@72Hz 4:3 HorFreq: 48100 Hz Clock: 50.000 MHz
  800x600@75Hz 4:3 HorFreq: 46900 Hz Clock: 49.500 MHz
  832x624@75Hz 4:3 HorFreq: 49726 Hz Clock: 57.284 MHz
  1024x768@60Hz 4:3 HorFreq: 48400 Hz Clock: 65.000 MHz
  1024x768@70Hz 4:3 HorFreq: 56500 Hz Clock: 75.000 MHz
  1024x768@75Hz 4:3 HorFreq: 60000 Hz Clock: 78.750 MHz
  1280x1024@75Hz 5:4 HorFreq: 80000 Hz Clock: 135.000 MHz
Standard timings supported:
  1152x864@75Hz 4:3 HorFreq: 67500 Hz Clock: 108.000 MHz
  1280x1024@60Hz 5:4 HorFreq: 64000 Hz Clock: 108.000 MHz
  1280x960@60Hz 4:3 HorFreq: 60000 Hz Clock: 108.000 MHz
  1280x720@60Hz 16:9
  1280x800@60Hz 16:10
  1440x900@60Hz 16:10 HorFreq: 55500 Hz Clock: 88.750 MHz
  1680x1050@60Hz 16:10 HorFreq: 64700 Hz Clock: 119.000 MHz
Detailed mode: Clock 148.500 MHz, 531 mm x 299 mm
               1920 2008 2052 2200 hborder 0
               1080 1084 1089 1125 vborder 0
               +hsync +vsync 
               VertFreq: 60 Hz, HorFreq: 67500 Hz
Monitor ranges (GTF): 50-150Hz V, 30-160kHz H, max dotclock 330MHz
Monitor name: VG248
Serial number: --
Has 1 extension blocks
Checksum: 0xcd (valid)

CTA extension block
Extension version: 3
20 bytes of CTA data
  Video data block
    VIC  16 1920x1080@60Hz 16:9 (native) HorFreq: 67500 Hz Clock: 148.500 MHz
    VIC   5 1920x1080i@60Hz 16:9  HorFreq: 33750 Hz Clock: 74.250 MHz
    VIC   4 1280x720@60Hz 16:9  HorFreq: 45000 Hz Clock: 74.250 MHz
    VIC   3 720x480@60Hz 16:9  HorFreq: 31469 Hz Clock: 27.000 MHz
    VIC   2 720x480@60Hz 4:3  HorFreq: 31469 Hz Clock: 27.000 MHz
    VIC   1 640x480@60Hz 4:3  HorFreq: 31469 Hz Clock: 25.175 MHz
    VIC  17 720x576@50Hz 4:3  HorFreq: 31250 Hz Clock: 27.000 MHz
    VIC  18 720x576@50Hz 16:9  HorFreq: 31250 Hz Clock: 27.000 MHz
    VIC  19 1280x720@50Hz 16:9  HorFreq: 37500 Hz Clock: 74.250 MHz
    VIC  20 1920x1080i@50Hz 16:9  HorFreq: 28125 Hz Clock: 74.250 MHz
    VIC  31 1920x1080@50Hz 16:9  HorFreq: 56250 Hz Clock: 148.500 MHz
  Audio data block
    Linear PCM, max channels 2
      Supported sample rates (kHz): 48 44.1 32
      Supported sample sizes (bits): 24 20 16
  Speaker allocation data block
    Speaker map:
      FL/FR - Front Left/Right
Underscans PC formats by default
Basic audio support
Supports YCbCr 4:4:4
Supports YCbCr 4:2:2
1 native detailed modes
Detailed mode: Clock 148.500 MHz, 531 mm x 299 mm
               1920 2008 2052 2200 hborder 0
               1080 1084 1089 1125 vborder 0
               +hsync +vsync 
               VertFreq: 60 Hz, HorFreq: 67500 Hz
Detailed mode: Clock 198.500 MHz, 531 mm x 299 mm
               1920 1968 2000 2080 hborder 0
               1080 1083 1088 1124 vborder 0
               +hsync -vsync 
               VertFreq: 84 Hz, HorFreq: 95432 Hz
Detailed mode: Clock 235.500 MHz, 531 mm x 299 mm
               1920 1968 2000 2080 hborder 0
               1080 1083 1088 1133 vborder 0
               +hsync -vsync 
               VertFreq: 99 Hz, HorFreq: 113221 Hz
Detailed mode: Clock 285.500 MHz, 531 mm x 299 mm
               1920 1968 2000 2080 hborder 0
               1080 1083 1088 1144 vborder 0
               +hsync -vsync 
               VertFreq: 119 Hz, HorFreq: 137259 Hz
Detailed mode: Clock 317.490 MHz, 531 mm x 299 mm
               1920 1944 1976 2008 hborder 0
               1080 1083 1088 1098 vborder 0
               +hsync +vsync 
               VertFreq: 144 Hz, HorFreq: 158112 Hz
Checksum: 0x9c (valid)

Warning: One or more of the timings is out of range of the Monitor Ranges:
  Vertical Freq: 50 - 144 Hz
  Horizontal Freq: 28125 - 158112 Hz
  Maximum Clock: 317.490 MHz
EDID block does not conform at all!
	Both the serial number and the serial string are set


