edid-decode (hex):

00 ff ff ff ff ff ff 00 50 54 01 27 01 00 00 00
18 0e 01 03 0f 1f 17 6b ea 0d 90 a0 57 47 98 26
10 45 45 bf ee 00 31 5e 45 5e 61 5e 81 80 01 01
01 01 01 01 01 01 30 2a 00 98 51 00 2a 40 30 70
13 00 4a 40 11 00 00 1e 64 19 00 40 41 00 26 30
18 88 36 00 4a 40 11 00 00 18 a0 0f 20 00 31 58
1c 20 28 80 14 00 4a 40 11 00 00 1e 00 00 00 fd
00 38 55 1e 55 0d 00 0a 20 20 20 20 20 20 00 c8

----------------

Block 0, Base EDID:
  EDID Structure Version & Revision: 1.3
  Vendor & Product Identification:
    Manufacturer: TBT
    Model: 9985
    Serial Number: ...
    Made in: week 24 of 2004
  Basic Display Parameters & Features:
    Analog display
    Input voltage level: 0.7/0.3 V
    Blank level equals black level
    Sync: Separate Composite SyncOnGreen Serration
    Maximum image size: 31 cm x 23 cm
    Gamma: 2.07
    DPMS levels: Standby Suspend Off
    RGB color display
    First detailed timing is the preferred timing
  Color Characteristics:
    Red  : 0.6250, 0.3398
    Green: 0.2802, 0.5947
    Blue : 0.1503, 0.0634
    White: 0.2695, 0.2695
  Established Timings I & II:
    IBM     :   720x400    70.081663 Hz   9:5     31.467 kHz     28.320000 MHz
    DMT 0x04:   640x480    59.940476 Hz   4:3     31.469 kHz     25.175000 MHz
    Apple   :   640x480    66.666667 Hz   4:3     35.000 kHz     30.240000 MHz
    DMT 0x05:   640x480    72.808802 Hz   4:3     37.861 kHz     31.500000 MHz
    DMT 0x06:   640x480    75.000000 Hz   4:3     37.500 kHz     31.500000 MHz
    DMT 0x08:   800x600    56.250000 Hz   4:3     35.156 kHz     36.000000 MHz
    DMT 0x09:   800x600    60.316541 Hz   4:3     37.879 kHz     40.000000 MHz
    DMT 0x0a:   800x600    72.187572 Hz   4:3     48.077 kHz     50.000000 MHz
    DMT 0x0b:   800x600    75.000000 Hz   4:3     46.875 kHz     49.500000 MHz
    Apple   :   832x624    74.551266 Hz   4:3     49.726 kHz     57.284000 MHz
    DMT 0x10:  1024x768    60.003840 Hz   4:3     48.363 kHz     65.000000 MHz
    DMT 0x11:  1024x768    70.069359 Hz   4:3     56.476 kHz     75.000000 MHz
    DMT 0x12:  1024x768    75.028582 Hz   4:3     60.023 kHz     78.750000 MHz
  Standard Timings:
    GTF     :   640x480    89.999335 Hz   4:3     45.540 kHz     37.889000 MHz
    GTF     :   800x600    89.999580 Hz   4:3     56.880 kHz     60.065000 MHz
    GTF     :  1024x768    90.000395 Hz   4:3     72.810 kHz    100.187000 MHz
    DMT 0x23:  1280x1024   60.019740 Hz   5:4     63.981 kHz    108.000000 MHz
  Detailed Timing Descriptors:
    DTD 1:  1280x1024   60.019740 Hz   5:4     63.981 kHz    108.000000 MHz (330 mm x 320 mm)
                 Hfront   48 Hsync 112 Hback  248 Hpol P
                 Vfront    1 Vsync   3 Vback   38 Vpol P
    DTD 2:  1024x768    60.003840 Hz   4:3     48.363 kHz     65.000000 MHz (330 mm x 320 mm)
                 Hfront   24 Hsync 136 Hback  160 Hpol N
                 Vfront    3 Vsync   6 Vback   29 Vpol N
    DTD 3:   800x600    60.316541 Hz   4:3     37.879 kHz     40.000000 MHz (330 mm x 320 mm)
                 Hfront   40 Hsync 128 Hback   88 Hpol P
                 Vfront    1 Vsync   4 Vback   23 Vpol P
    Display Range Limits:
      Monitor ranges (GTF): 56-85 Hz V, 30-85 kHz H, max dotclock 130 MHz
Checksum: 0xc8

----------------

Failures:

Block 0, Base EDID:
  Detailed Timing Descriptor #1: Mismatch of image size 330x320 mm vs display size 310x230 mm.
  Detailed Timing Descriptor #2: Mismatch of image size 330x320 mm vs display size 310x230 mm.
  Detailed Timing Descriptor #3: Mismatch of image size 330x320 mm vs display size 310x230 mm.
  Missing Display Product Name.
EDID:
  Base EDID: Some timings are out of range of the Monitor Ranges:
    Vertical Freq: 56.250 - 90.000 Hz (Monitor: 56.000 - 85.000 Hz)

EDID conformity: FAIL
