edid-decode (hex):

00 ff ff ff ff ff ff 00 06 af 6c 20 00 00 00 00
00 14 01 04 90 1c 10 78 02 20 e5 92 55 54 92 28
25 50 54 00 00 00 01 01 01 01 01 01 01 01 01 01
01 01 01 01 01 01 8a 1b 56 72 50 00 19 30 30 20
36 00 15 9c 10 00 00 18 5c 12 56 72 50 00 19 30
30 20 36 00 15 9c 10 00 00 18 00 00 00 00 00 00
00 00 00 00 00 00 00 00 00 00 00 00 00 00 00 02
00 09 4f ff 0a 3c 64 0f 0e 1c 88 20 20 20 00 ec

----------------

Block 0, Base EDID:
  EDID Structure Version & Revision: 1.4
  Vendor & Product Identification:
    Manufacturer: AUO
    Model: 8300
    Made in: 2010
  Basic Display Parameters & Features:
    Digital display
    Bits per primary color channel: 6
    Digital interface is not defined
    Maximum image size: 28 cm x 16 cm
    Gamma: 2.20
    Supported color formats: RGB 4:4:4
    First detailed timing includes the native pixel format and preferred refresh rate
  Color Characteristics:
    Red  : 0.5703, 0.3339
    Green: 0.3281, 0.5703
    Blue : 0.1591, 0.1464
    White: 0.3134, 0.3291
  Established Timings I & II: none
  Standard Timings: none
  Detailed Timing Descriptors:
    DTD 1:  1366x768    60.069527 Hz 683:384   47.635 kHz     70.500000 MHz (277 mm x 156 mm)
                 Hfront   48 Hsync  32 Hback   34 Hpol N
                 Vfront    3 Vsync   6 Vback   16 Vpol N
    DTD 2:  1366x768    40.046352 Hz 683:384   31.757 kHz     47.000000 MHz (277 mm x 156 mm)
                 Hfront   48 Hsync  32 Hback   34 Hpol N
                 Vfront    3 Vsync   6 Vback   16 Vpol N
    Empty Descriptor
    Manufacturer-Specified Display Descriptor (0x02): 00 02 00 09 4f ff 0a 3c 64 0f 0e 1c 88 20 20 20 '....O..<d....   '
Checksum: 0xec

----------------

Warnings:

Block 0, Base EDID:
  Missing Display Product Name.

Failures:

Block 0, Base EDID:
  Empty Descriptor: Use Dummy Descriptor instead of all zeroes.

EDID conformity: FAIL
