edid-decode (hex):

00 ff ff ff ff ff ff 00 0d af 01 17 00 00 00 00
00 00 01 03 80 25 17 78 0a fa 1d a5 58 48 9c 24
12 51 55 00 00 00 01 01 01 01 01 01 01 01 01 01
01 01 01 01 01 01 95 25 a0 40 51 84 0c 30 40 20
33 00 6f e6 10 00 00 18 00 00 00 fe 00 4e 31 37
30 43 31 2d 4c 30 32 0a 20 20 00 00 00 fe 00 43
4d 4f 0a 20 20 20 20 20 20 20 20 20 00 00 00 fe
00 4e 31 37 30 43 31 2d 4c 30 32 0a 20 20 00 50

----------------

Block 0, Base EDID:
  EDID Structure Version & Revision: 1.3
  Vendor & Product Identification:
    Manufacturer: CMO
    Model: 5889
    Made in: 1990
  Basic Display Parameters & Features:
    Digital display
    Maximum image size: 37 cm x 23 cm
    Gamma: 2.20
    RGB color display
    First detailed timing is the preferred timing
  Color Characteristics:
    Red  : 0.6474, 0.3466
    Green: 0.2832, 0.6113
    Blue : 0.1406, 0.0712
    White: 0.3193, 0.3330
  Established Timings I & II: none
  Standard Timings: none
  Detailed Timing Descriptors:
    DTD 1:  1440x900    59.939444 Hz   8:5     54.665 kHz     96.210000 MHz (367 mm x 230 mm)
                 Hfront   64 Hsync  32 Hback  224 Hpol N
                 Vfront    3 Vsync   3 Vback    6 Vpol N
    Alphanumeric Data String: 'N170C1-L02'
    Alphanumeric Data String: 'CMO'
    Alphanumeric Data String: 'N170C1-L02'
Checksum: 0x50

----------------

Failures:

Block 0, Base EDID:
  Missing Display Product Name.
  Missing Display Range Limits Descriptor.

EDID conformity: FAIL
