
EDID (hex):
00ffffffffffff004c2d350f565a5a42
191f0104b54627783baea5af4f42af26
0f5054bfef80714f810081c08180a9c0
b300950001014dd000a0f0703e803020
3500b9882100001a000000fd00283c86
863c010a202020202020000000fc0055
33324a3539780a2020202020000000ff
0048345a523630303237370a202001e4
02030ff042105f230907078301000002
3a801871382d40582c4500b988210000
1e565e00a0a0a0295030203500b98821
00001a04740030f2705a80b0588a00b9
882100001e0000000000000000000000
00000000000000000000000000000000
00000000000000000000000000000000
00000000000000000000000000000056

Extracted contents:
header:          00 ff ff ff ff ff ff 00
serial number:   4c 2d 35 0f 56 5a 5a 42 19 1f
version:         01 04
basic params:    b5 46 27 78 3b
chroma info:     ae a5 af 4f 42 af 26 0f 50 54
established:     bf ef 80
standard:        71 4f 81 00 81 c0 81 80 a9 c0 b3 00 95 00 01 01
descriptor 1:    4d d0 00 a0 f0 70 3e 80 30 20 35 00 b9 88 21 00 00 1a
descriptor 2:    00 00 00 fd 00 28 3c 86 86 3c 01 0a 20 20 20 20 20 20
descriptor 3:    00 00 00 fc 00 55 33 32 4a 35 39 78 0a 20 20 20 20 20
descriptor 4:    00 00 00 ff 00 48 34 5a 52 36 30 30 32 37 37 0a 20 20
extensions:      01
checksum:        e4

EDID version: 1.4
Manufacturer: SAM Model f35 Serial Number --
Made in week 25 of 2021
Digital display
10 bits per primary color channel
DisplayPort interface
Maximum image size: 70 cm x 39 cm
Gamma: 2.20
DPMS levels: Off
Supported color formats: RGB 4:4:4, YCrCb 4:4:4, YCrCb 4:2:2
First detailed timing includes the native pixel format and preferred refresh rate
Display is continuous frequency
Display x,y Chromaticity:
  Red:   0.6855, 0.3105
  Green: 0.2607, 0.6855
  Blue:  0.1503, 0.0605
  White: 0.3134, 0.3291
Established timings supported:
  720x400@70Hz 9:5 HorFreq: 31469 Hz Clock: 28.320 MHz
  640x480@60Hz 4:3 HorFreq: 31469 Hz Clock: 25.175 MHz
  640x480@67Hz 4:3 HorFreq: 35000 Hz Clock: 30.240 MHz
  640x480@72Hz 4:3 HorFreq: 37900 Hz Clock: 31.500 MHz
  640x480@75Hz 4:3 HorFreq: 37500 Hz Clock: 31.500 MHz
  800x600@56Hz 4:3 HorFreq: 35200 Hz Clock: 36.000 MHz
  800x600@60Hz 4:3 HorFreq: 37900 Hz Clock: 40.000 MHz
  800x600@72Hz 4:3 HorFreq: 48100 Hz Clock: 50.000 MHz
  800x600@75Hz 4:3 HorFreq: 46900 Hz Clock: 49.500 MHz
  832x624@75Hz 4:3 HorFreq: 49726 Hz Clock: 57.284 MHz
  1024x768@60Hz 4:3 HorFreq: 48400 Hz Clock: 65.000 MHz
  1024x768@70Hz 4:3 HorFreq: 56500 Hz Clock: 75.000 MHz
  1024x768@75Hz 4:3 HorFreq: 60000 Hz Clock: 78.750 MHz
  1280x1024@75Hz 5:4 HorFreq: 80000 Hz Clock: 135.000 MHz
  1152x870@75Hz 192:145 HorFreq: 67500 Hz Clock: 108.000 MHz
Standard timings supported:
  1152x864@75Hz 4:3 HorFreq: 67500 Hz Clock: 108.000 MHz
  1280x800@60Hz 16:10
  1280x720@60Hz 16:9
  1280x1024@60Hz 5:4 HorFreq: 64000 Hz Clock: 108.000 MHz
  1600x900@60Hz 16:9
  1680x1050@60Hz 16:10 HorFreq: 64700 Hz Clock: 119.000 MHz
  1440x900@60Hz 16:10 HorFreq: 55500 Hz Clock: 88.750 MHz
Detailed mode: Clock 533.250 MHz, 697 mm x 392 mm
               3840 3888 3920 4000 hborder 0
               2160 2163 2168 2222 vborder 0
               +hsync -vsync 
               VertFreq: 59 Hz, HorFreq: 133312 Hz
Monitor ranges (bare limits): 40-60Hz V, 134-134kHz H, max dotclock 600MHz
Monitor name: U32J59x
Serial number: --
Has 1 extension blocks
Checksum: 0xe4 (valid)

CTA extension block
Extension version: 3
11 bytes of CTA data
  Video data block
    VIC  16 1920x1080@60Hz 16:9  HorFreq: 67500 Hz Clock: 148.500 MHz
    VIC  95 3840x2160@30Hz 16:9  HorFreq: 67500 Hz Clock: 297.000 MHz
  Audio data block
    Linear PCM, max channels 2
      Supported sample rates (kHz): 48 44.1 32
      Supported sample sizes (bits): 24 20 16
  Speaker allocation data block
    Speaker map:
      FL/FR - Front Left/Right
Underscans PC formats by default
Basic audio support
Supports YCbCr 4:4:4
Supports YCbCr 4:2:2
0 native detailed modes
Detailed mode: Clock 148.500 MHz, 697 mm x 392 mm
               1920 2008 2052 2200 hborder 0
               1080 1084 1089 1125 vborder 0
               +hsync +vsync 
               VertFreq: 60 Hz, HorFreq: 67500 Hz
Detailed mode: Clock 241.500 MHz, 697 mm x 392 mm
               2560 2608 2640 2720 hborder 0
               1440 1443 1448 1481 vborder 0
               +hsync -vsync 
               VertFreq: 59 Hz, HorFreq: 88786 Hz
Detailed mode: Clock 297.000 MHz, 697 mm x 392 mm
               3840 4016 4104 4400 hborder 0
               2160 2168 2178 2250 vborder 0
               +hsync +vsync 
               VertFreq: 30 Hz, HorFreq: 67500 Hz
Checksum: 0x56 (valid)

Warning: One or more of the timings is out of range of the Monitor Ranges:
  Vertical Freq: 30 - 75 Hz
  Horizontal Freq: 31469 - 133312 Hz
  Maximum Clock: 533.250 MHz
EDID block does not conform at all!
	Both the serial number and the serial string are set
