edid-decode (hex):

00 ff ff ff ff ff ff 00 0d af 41 15 00 00 00 00
32 10 01 03 80 21 14 78 0a 6c e5 97 56 51 89 26
20 50 54 00 00 00 01 01 01 01 01 01 01 01 01 01
01 01 01 01 01 01 ab 22 a0 a0 50 84 1a 30 30 20
36 00 4c cf 10 00 00 18 00 00 00 fe 00 4e 31 35
34 43 33 2d 4c 30 32 0a 20 20 00 00 00 fe 00 43
4d 4f 0a 20 20 20 20 20 20 20 20 20 00 00 00 fe
00 4e 31 35 34 43 33 2d 4c 30 32 0a 20 20 00 68

----------------

Block 0, Base EDID:
  EDID Structure Version & Revision: 1.3
  Vendor & Product Identification:
    Manufacturer: CMO
    Model: 5441
    Made in: week 50 of 2006
  Basic Display Parameters & Features:
    Digital display
    Maximum image size: 33 cm x 20 cm
    Gamma: 2.20
    RGB color display
    First detailed timing is the preferred timing
  Color Characteristics:
    Red  : 0.5908, 0.3378
    Green: 0.3193, 0.5351
    Blue : 0.1513, 0.1269
    White: 0.3134, 0.3291
  Established Timings I & II: none
  Standard Timings: none
  Detailed Timing Descriptors:
    DTD 1:  1440x900    59.901 Hz   8:5    55.469 kHz  88.750 MHz (332 mm x 207 mm)
                 Hfront   48 Hsync  32 Hback  80 Hpol N
                 Vfront    3 Vsync   6 Vback  17 Vpol N
    Alphanumeric Data String: 'N154C3-L02'
    Alphanumeric Data String: 'CMO'
    Alphanumeric Data String: 'N154C3-L02'
Checksum: 0x68

----------------

Failures:

Block 0, Base EDID:
  Missing Display Product Name.
  Missing Display Range Limits Descriptor.

EDID conformity: FAIL
