
EDID (hex):
00ffffffffffff004b140a8100000000
3014010368000078ef8bc5a45a489b25
1a505421080061400101010101010101
01010101010164190040410026301888
360015d010000018000000fd0037411e
3707000a202020202020000000fc0056
5f3256313030372d30310a20000000ff
0a002020202020202020202020200005

edid-decode (hex):

00 ff ff ff ff ff ff 00 4b 14 0a 81 00 00 00 00
30 14 01 03 68 00 00 78 ef 8b c5 a4 5a 48 9b 25
1a 50 54 21 08 00 61 40 01 01 01 01 01 01 01 01
01 01 01 01 01 01 64 19 00 40 41 00 26 30 18 88
36 00 15 d0 10 00 00 18 00 00 00 fd 00 37 41 1e
37 07 00 0a 20 20 20 20 20 20 00 00 00 fc 00 56
5f 32 56 31 30 30 37 2d 30 31 0a 20 00 00 00 ff
0a 00 20 20 20 20 20 20 20 20 20 20 20 20 00 05

----------------

Block 0, Base EDID:
  EDID Structure Version & Revision: 1.3
  Vendor & Product Identification:
    Manufacturer: RXT
    Model: 33034
    Made in: week 48 of 2010
  Basic Display Parameters & Features:
    Analog display
    Signal Level Standard: 0.700 : 0.000 : 0.700 V p-p
    Blank level equals black level
    Sync: Separate
    Image size is variable
    Gamma: 2.20
    DPMS levels: Standby Suspend Off
    RGB color display
    Default (sRGB) color space is primary color space
    First detailed timing is the preferred timing
    Supports GTF timings within operating range
  Color Characteristics:
    Red  : 0.6425, 0.3515
    Green: 0.2832, 0.6083
    Blue : 0.1474, 0.1015
    White: 0.3134, 0.3291
  Established Timings I & II:
    DMT 0x04:   640x480    59.940476 Hz   4:3     31.469 kHz     25.175000 MHz
    DMT 0x09:   800x600    60.316541 Hz   4:3     37.879 kHz     40.000000 MHz
    DMT 0x10:  1024x768    60.003840 Hz   4:3     48.363 kHz     65.000000 MHz
  Standard Timings:
    DMT 0x10:  1024x768    60.003840 Hz   4:3     48.363 kHz     65.000000 MHz
  Detailed Timing Descriptors:
    DTD 1:  1024x768    60.003840 Hz   4:3     48.363 kHz     65.000000 MHz (277 mm x 208 mm)
                 Hfront   24 Hsync 136 Hback  160 Hpol N
                 Vfront    3 Vsync   6 Vback   29 Vpol N
    Display Range Limits:
      Monitor ranges (GTF): 55-65 Hz V, 30-55 kHz H, max dotclock 70 MHz
    Display Product Name: 'V_2V1007-01'
    Display Product Serial Number: ''
Checksum: 0x05
