edid-decode (hex):

00 ff ff ff ff ff ff 00 51 a1 36 20 00 a0 00 00
01 22 01 04 b5 21 15 78 03 25 5b ad 52 44 af 26
0f 50 54 00 00 00 01 01 01 01 01 01 01 01 01 01
01 01 01 01 01 01 01 00 40 a0 b0 08 80 77 30 20
36 00 4a ce 10 00 00 1a 00 00 00 fd 00 1e 78 df
df 44 01 0a 20 20 20 20 20 20 00 00 00 fe 00 54
4d 41 2d 58 4d 0a 20 20 20 20 20 20 00 00 00 fe
00 54 4c 31 35 33 41 44 4d 53 30 31 20 0a 02 18

02 03 0f 00 e3 05 80 80 e6 06 05 01 6a 6a 42 00
00 00 00 00 00 00 00 00 00 00 00 00 00 00 00 00
00 00 00 00 00 00 00 00 00 00 00 00 00 00 00 00
00 00 00 00 00 00 00 00 00 00 00 00 00 00 00 00
00 00 00 00 00 00 00 00 00 00 00 00 00 00 00 00
00 00 00 00 00 00 00 00 00 00 00 00 00 00 00 00
00 00 00 00 00 00 00 00 00 00 00 00 00 00 00 00
00 00 00 00 00 00 00 00 00 00 00 00 00 00 00 fc

70 20 79 02 00 22 00 28 81 5a 0a 05 3f 0b 9f 00
2f 00 1f 00 07 07 3b 00 02 00 05 00 81 5a 0a 85
3f 0b 9f 00 2f 00 1f 00 07 07 7f 07 02 00 05 00
2b 00 0c 27 00 1e 77 00 00 27 00 1e 3b 00 00 81
00 13 72 1a 00 00 03 01 1e 78 00 04 6a 42 6a 42
78 00 00 00 00 00 00 00 00 00 00 00 00 00 00 00
00 00 00 00 00 00 00 00 00 00 00 00 00 00 00 00
00 00 00 00 00 00 00 00 00 00 00 00 00 00 6d 90

00 ff ff ff ff ff ff 00 51 a1 36 20 00 a0 00 00
01 22 01 04 b5 21 15 78 03 25 5b ad 52 44 af 26
0f 50 54 00 00 00 01 01 01 01 01 01 01 01 01 01
01 01 01 01 01 01 01 00 40 a0 b0 08 80 77 30 20
36 00 4a ce 10 00 00 1a 00 00 00 fd 00 1e 78 df
df 44 01 0a 20 20 20 20 20 20 00 00 00 fe 00 54
4d 41 2d 58 4d 0a 20 20 20 20 20 20 00 00 00 fe
00 54 4c 31 35 33 41 44 4d 53 30 31 20 0a 02 18

02 03 0f 00 e3 05 80 80 e6 06 05 01 6a 6a 42 00
00 00 00 00 00 00 00 00 00 00 00 00 00 00 00 00
00 00 00 00 00 00 00 00 00 00 00 00 00 00 00 00
00 00 00 00 00 00 00 00 00 00 00 00 00 00 00 00
00 00 00 00 00 00 00 00 00 00 00 00 00 00 00 00
00 00 00 00 00 00 00 00 00 00 00 00 00 00 00 00
00 00 00 00 00 00 00 00 00 00 00 00 00 00 00 00
00 00 00 00 00 00 00 00 00 00 00 00 00 00 00 fc

70 20 79 02 00 22 00 28 81 5a 0a 05 3f 0b 9f 00
2f 00 1f 00 07 07 3b 00 02 00 05 00 81 5a 0a 85
3f 0b 9f 00 2f 00 1f 00 07 07 7f 07 02 00 05 00
2b 00 0c 27 00 1e 77 00 00 27 00 1e 3b 00 00 81
00 13 72 1a 00 00 03 01 1e 78 00 04 6a 42 6a 42
78 00 00 00 00 00 00 00 00 00 00 00 00 00 00 00
00 00 00 00 00 00 00 00 00 00 00 00 00 00 00 00
00 00 00 00 00 00 00 00 00 00 00 00 00 00 6d 90

----------------

Block 0, Base EDID:
  EDID Structure Version & Revision: 1.4
  Vendor & Product Identification:
    Manufacturer: TMA
    Model: 8246
    Serial Number: ...
    Made in: week 1 of 2024
  Basic Display Parameters & Features:
    Digital display
    Bits per primary color channel: 10
    DisplayPort interface
    Maximum image size: 33 cm x 21 cm
    Gamma: 2.20
    Supported color formats: RGB 4:4:4
    First detailed timing includes the native pixel format and preferred refresh rate
    Display is continuous frequency
  Color Characteristics:
    Red  : 0.6757, 0.3222
    Green: 0.2666, 0.6845
    Blue : 0.1494, 0.0595
    White: 0.3144, 0.3310
  Established Timings I & II: none
  Standard Timings: none
  Detailed Timing Descriptors:
    Detailed mode: 01 00 40 a0 b0 08 80 77 30 20 36 00 4a ce 10 00 00 1a '..@....w0 6.J.....'
    Display Range Limits:
      Monitor ranges (Bare Limits): 30-120 Hz V, 223-223 kHz H, max dotclock 680 MHz
    Alphanumeric Data String: 'TMA-XM'
    Alphanumeric Data String: 'TL153ADMS01 '
  Extension blocks: 2
Checksum: 0x18

----------------

Block 1, CTA-861 Extension Block:
  Revision: 3
  Native detailed modes: 0
  Colorimetry Data Block:
    BT2020RGB
    ST2113RGB
  HDR Static Metadata Data Block:
    Electro optical transfer functions:
      Traditional gamma - SDR luminance range
      SMPTE ST2084
    Supported static metadata descriptors:
      Static metadata type 1
    Desired content max luminance: 106 (496.743 cd/m^2)
    Desired content max frame-average luminance: 106 (496.743 cd/m^2)
    Desired content min luminance: 66 (0.333 cd/m^2)
Checksum: 0xfc  Unused space in Extension Block: 112 bytes

----------------

Block 2, DisplayID Extension Block:
  Version: 2.0
  Extension Count: 0
  Display Product Primary Use Case: None of the listed primary use cases; generic display
  Video Timing Modes Type 7 - Detailed Timings Data Block:
    DTD:  2880x1800  120.000354 Hz  16:10   223.201 kHz    678.530000 MHz (aspect 16:10, no 3D stereo)
               Hfront   48 Hsync  32 Hback   80 Hpol N
               Vfront    3 Vsync   6 Vback   51 Vpol N
    DTD:  2880x1800   60.000177 Hz  16:10   223.201 kHz    678.530000 MHz (aspect 16:10, no 3D stereo, preferred)
               Hfront   48 Hsync  32 Hback   80 Hpol N
               Vfront    3 Vsync   6 Vback 1911 Vpol N
  Adaptive Sync Data Block:
    Descriptor #1:
      Native Panel Range
      Fixed Average V-Total and Adaptive V-Total
      'Max Single Frame Duration Increase' field value without jitter impact
      'Max Single Frame Duration Decrease' field value without jitter impact
      Max Duration Increase: 0.00 ms
      Max Duration Decrease: 0.00 ms
      Min Refresh Rate: 30 Hz
      Max Refresh Rate: 120 Hz
    Descriptor #2:
      Native Panel Range
      Fixed Average V-Total and Adaptive V-Total
      'Max Single Frame Duration Increase' field value without jitter impact
      'Max Single Frame Duration Decrease' field value without jitter impact
      Max Duration Increase: 0.00 ms
      Max Duration Decrease: 0.00 ms
      Min Refresh Rate: 30 Hz
      Max Refresh Rate: 60 Hz
  CTA-861 DisplayID Data Block:
  Vendor-Specific Data Block (AMD), OUI 00-00-1A:
    Version: 3.1
    Minimum Refresh Rate: 30 Hz
    Maximum Refresh Rate: 120 Hz
    Flags 1.x: 0x00
    Flags 2.x: 0x04
    Maximum luminance: 106 (496.743 cd/m^2)
    Minimum luminance: 66 (0.333 cd/m^2)
    Maximum luminance (without local dimming): 106 (496.743 cd/m^2)
    Minimum luminance (without local dimming): 66 (0.333 cd/m^2)
  Checksum: 0x6d
Checksum: 0x90

----------------

Block 3, Unknown EDID Extension Block 0x00:
  00 ff ff ff ff ff ff 00 51 a1 36 20 00 a0 00 00 '........Q.6 ....'
  01 22 01 04 b5 21 15 78 03 25 5b ad 52 44 af 26 '."...!.x.%[.RD.&'
  0f 50 54 00 00 00 01 01 01 01 01 01 01 01 01 01 '.PT.............'
  01 01 01 01 01 01 01 00 40 a0 b0 08 80 77 30 20 '........@....w0 '
  36 00 4a ce 10 00 00 1a 00 00 00 fd 00 1e 78 df '6.J...........x.'
  df 44 01 0a 20 20 20 20 20 20 00 00 00 fe 00 54 '.D..      .....T'
  4d 41 2d 58 4d 0a 20 20 20 20 20 20 00 00 00 fe 'MA-XM.      ....'
  00 54 4c 31 35 33 41 44 4d 53 30 31 20 0a 02 18 '.TL153ADMS01 ...'
Checksum: 0x18

----------------

Block 4, CTA-861 Extension Block:
  Revision: 3
  Native detailed modes: 0
  Colorimetry Data Block:
    BT2020RGB
    ST2113RGB
  HDR Static Metadata Data Block:
    Electro optical transfer functions:
      Traditional gamma - SDR luminance range
      SMPTE ST2084
    Supported static metadata descriptors:
      Static metadata type 1
    Desired content max luminance: 106 (496.743 cd/m^2)
    Desired content max frame-average luminance: 106 (496.743 cd/m^2)
    Desired content min luminance: 66 (0.333 cd/m^2)
Checksum: 0xfc  Unused space in Extension Block: 112 bytes

----------------

Block 5, DisplayID Extension Block:
  Version: 2.0
  Extension Count: 0
  Video Timing Modes Type 7 - Detailed Timings Data Block:
    DTD:  2880x1800  120.000354 Hz  16:10   223.201 kHz    678.530000 MHz (aspect 16:10, no 3D stereo)
               Hfront   48 Hsync  32 Hback   80 Hpol N
               Vfront    3 Vsync   6 Vback   51 Vpol N
    DTD:  2880x1800   60.000177 Hz  16:10   223.201 kHz    678.530000 MHz (aspect 16:10, no 3D stereo, preferred)
               Hfront   48 Hsync  32 Hback   80 Hpol N
               Vfront    3 Vsync   6 Vback 1911 Vpol N
  Adaptive Sync Data Block:
    Descriptor #1:
      Native Panel Range
      Fixed Average V-Total and Adaptive V-Total
      'Max Single Frame Duration Increase' field value without jitter impact
      'Max Single Frame Duration Decrease' field value without jitter impact
      Max Duration Increase: 0.00 ms
      Max Duration Decrease: 0.00 ms
      Min Refresh Rate: 30 Hz
      Max Refresh Rate: 120 Hz
    Descriptor #2:
      Native Panel Range
      Fixed Average V-Total and Adaptive V-Total
      'Max Single Frame Duration Increase' field value without jitter impact
      'Max Single Frame Duration Decrease' field value without jitter impact
      Max Duration Increase: 0.00 ms
      Max Duration Decrease: 0.00 ms
      Min Refresh Rate: 30 Hz
      Max Refresh Rate: 60 Hz
  CTA-861 DisplayID Data Block:
  Vendor-Specific Data Block (AMD), OUI 00-00-1A:
    Version: 3.1
    Minimum Refresh Rate: 30 Hz
    Maximum Refresh Rate: 120 Hz
    Flags 1.x: 0x00
    Flags 2.x: 0x04
    Maximum luminance: 106 (496.743 cd/m^2)
    Minimum luminance: 66 (0.333 cd/m^2)
    Maximum luminance (without local dimming): 106 (496.743 cd/m^2)
    Minimum luminance (without local dimming): 66 (0.333 cd/m^2)
  Checksum: 0x6d
Checksum: 0x90

----------------

Warnings:

Block 0, Base EDID:
  Missing Display Product Name.
Block 1, CTA-861 Extension Block:
  IT Video Formats are overscanned by default, but normally this should be underscanned.
  Colorimetry Data Block: Set the sRGB colorimetry bit to avoid interop issues.
Block 4, CTA-861 Extension Block:
  IT Video Formats are overscanned by default, but normally this should be underscanned.
  Colorimetry Data Block: Set the sRGB colorimetry bit to avoid interop issues.

Failures:

Block 0, Base EDID:
  Detailed Timing Descriptor #1: Pixelclock < 10 MHz, assuming invalid data 0x01 0x00.
  Alphanumeric Data String: One or more trailing spaces.
Block 1, CTA-861 Extension Block:
  Required 640x480p60 timings are missing in the established timings and the SVD list (VIC 1).
  Missing VCDB, needed for Set Selectable RGB Quantization to avoid interop issues.
Block 2, DisplayID Extension Block:
  Expected 0 DisplayID Extension Block, but got 1.
Block 3, Base EDID:
  Unknown Extension Block.
Block 4, CTA-861 Extension Block:
  Colorimetry Data Block: Only one instance of this Data Block is allowed.
  HDR Static Metadata Data Block: Only one instance of this Data Block is allowed.
  Required 640x480p60 timings are missing in the established timings and the SVD list (VIC 1).
  Missing VCDB, needed for Set Selectable RGB Quantization to avoid interop issues.
Block 5, DisplayID Extension Block:
  Product Type should be 0 in extension block.
EDID:
  Base EDID: EDID specified 2 extension block(s), but found 5 extension block(s).
  DisplayID: Missing DisplayID Product Identification Data Block.
  DisplayID: Missing DisplayID Display Parameters Data Block.
  DisplayID: Missing DisplayID Display Interface Features Data Block.

EDID conformity: FAIL
