
EDID (hex):
00ffffffffffff0010ac79a053355431
29170103a0342078baee95a3544c9926
0f5054a1080081408180a940b300d1c0
010101010101283c80a070b023403020
360006442100001a000000ff00304646
5844334141315435530a000000fc0044
454c4c2055323431324d0a20000000fd
00323d1e5311000a2020202020200124
02031b71230907078301000067030c00
1000802143011084e2000f011d007251
d01e206e28550081490000001e000000
10000000000000000000000000000000
00001000000000000000000000000000
00000000100000000000000000000000
00000000000010000000000000000000
000000000000000000000000000000bf

Extracted contents:
header:          00 ff ff ff ff ff ff 00
serial number:   10 ac 79 a0 53 35 54 31 29 17
version:         01 03
basic params:    a0 34 20 78 ba
chroma info:     ee 95 a3 54 4c 99 26 0f 50 54
established:     a1 08 00
standard:        81 40 81 80 a9 40 b3 00 d1 c0 01 01 01 01 01 01
descriptor 1:    28 3c 80 a0 70 b0 23 40 30 20 36 00 06 44 21 00 00 1a
descriptor 2:    00 00 00 ff 00 30 46 46 58 44 33 41 41 31 54 35 53 0a
descriptor 3:    00 00 00 fc 00 44 45 4c 4c 20 55 32 34 31 32 4d 0a 20
descriptor 4:    00 00 00 fd 00 32 3d 1e 53 11 00 0a 20 20 20 20 20 20
extensions:      01
checksum:        24

EDID version: 1.3
Manufacturer: DEL Model a079 Serial Number --
Made in week 41 of 2013
Digital display
Maximum image size: 52 cm x 32 cm
Gamma: 2.20
DPMS levels: Standby Off
Undefined display color type
First detailed timing is preferred timing
Display x,y Chromaticity:
  Red:   0.6396, 0.3300
  Green: 0.2998, 0.5996
  Blue:  0.1503, 0.0595
  White: 0.3134, 0.3291
Established timings supported:
  720x400@70Hz 9:5 HorFreq: 31469 Hz Clock: 28.320 MHz
  640x480@60Hz 4:3 HorFreq: 31469 Hz Clock: 25.175 MHz
  800x600@60Hz 4:3 HorFreq: 37900 Hz Clock: 40.000 MHz
  1024x768@60Hz 4:3 HorFreq: 48400 Hz Clock: 65.000 MHz
Standard timings supported:
  1280x960@60Hz 4:3 HorFreq: 60000 Hz Clock: 108.000 MHz
  1280x1024@60Hz 5:4 HorFreq: 64000 Hz Clock: 108.000 MHz
  1600x1200@60Hz 4:3 HorFreq: 75000 Hz Clock: 162.000 MHz
  1680x1050@60Hz 16:10 HorFreq: 64700 Hz Clock: 119.000 MHz
  1920x1080@60Hz 16:9
Detailed mode: Clock 154.000 MHz, 518 mm x 324 mm
               1920 1968 2000 2080 hborder 0
               1200 1203 1209 1235 vborder 0
               +hsync -vsync 
               VertFreq: 59 Hz, HorFreq: 74038 Hz
Serial number: --
Monitor name: DELL U2412M
Monitor ranges (GTF): 50-61Hz V, 30-83kHz H, max dotclock 170MHz
Has 1 extension blocks
Checksum: 0x24 (valid)

CTA extension block
Extension version: 3
23 bytes of CTA data
  Audio data block
    Linear PCM, max channels 2
      Supported sample rates (kHz): 48 44.1 32
      Supported sample sizes (bits): 24 20 16
  Speaker allocation data block
    Speaker map:
      FL/FR - Front Left/Right
  Vendor-specific data block, OUI 000c03 (HDMI)
    Source physical address 1.0.0.0
    Supports_AI
    Maximum TMDS clock: 165MHz
  Video data block
    VIC   1 640x480@60Hz 4:3  HorFreq: 31469 Hz Clock: 25.175 MHz
    VIC  16 1920x1080@60Hz 16:9  HorFreq: 67500 Hz Clock: 148.500 MHz
    VIC   4 1280x720@60Hz 16:9 (native) HorFreq: 45000 Hz Clock: 74.250 MHz
  Extended tag: Video capability data block
    YCbCr quantization: No Data (0)
    RGB quantization: No Data (0)
    PT scan behaviour: No Data (0)
    IT scan behaviour: Support both over- and underscan (3)
    CE scan behaviour: Support both over- and underscan (3)
Basic audio support
Supports YCbCr 4:4:4
Supports YCbCr 4:2:2
1 native detailed modes
Detailed mode: Clock 74.250 MHz, 129 mm x 73 mm
               1280 1390 1430 1650 hborder 0
                720  725  730  750 vborder 0
               +hsync +vsync 
               VertFreq: 60 Hz, HorFreq: 45000 Hz
Checksum: 0xbf (valid)

EDID block does NOT conform to EDID 1.3!
	Digital display field contains garbage: 20
One or more of the timings is out of range of the Monitor Ranges:
  Vertical Freq: 59 - 70 Hz
  Horizontal Freq: 31469 - 75000 Hz
  Maximum Clock: 162.000 MHz
EDID block does not conform at all!
	Both the serial number and the serial string are set
