
EDID (hex):
00ffffffffffff0010acce7fe0450d35
0f1b0103800605781eee91a3544c9926
0f505400000000000000000000000000
000000000000689c4050b0a03f500820
180c3c32000000188c694074b0a03f50
1820180c3c3200000018000000fc004d
520a20202020202020202020000000fd
003c5a1f873c000a202020202020013f
0203280265030c00100067d85dc40151
8000755c12ca01075df58c17b8025683
92d0b1785b08a148689c4050b0a03f50
0820180c3c32000000188c694074b0a0
3f501820180c3c320000001800000000
00000000000000000000000000000000
00000000000000000000000000000000
00000000000000000000000000000058

Extracted contents:
header:          00 ff ff ff ff ff ff 00
serial number:   10 ac ce 7f e0 45 0d 35 0f 1b
version:         01 03
basic params:    80 06 05 78 1e
chroma info:     ee 91 a3 54 4c 99 26 0f 50 54
established:     00 00 00
standard:        00 00 00 00 00 00 00 00 00 00 00 00 00 00 00 00
descriptor 1:    68 9c 40 50 b0 a0 3f 50 08 20 18 0c 3c 32 00 00 00 18
descriptor 2:    8c 69 40 74 b0 a0 3f 50 18 20 18 0c 3c 32 00 00 00 18
descriptor 3:    00 00 00 fc 00 4d 52 0a 20 20 20 20 20 20 20 20 20 20
descriptor 4:    00 00 00 fd 00 3c 5a 1f 87 3c 00 0a 20 20 20 20 20 20
extensions:      01
checksum:        3f

EDID version: 1.3
Manufacturer: DEL Model 7fce Serial Number --
Made in week 15 of 2017
Digital display
Maximum image size: 6 cm x 5 cm
Gamma: 2.20
Undefined display color type
Default (sRGB) color space is primary color space
First detailed timing is preferred timing
Display x,y Chromaticity:
  Red:   0.6396, 0.3300
  Green: 0.2998, 0.5996
  Blue:  0.1503, 0.0595
  White: 0.3125, 0.3291
Established timings supported:
Standard timings supported:
non-conformant standard timing (0 horiz)
non-conformant standard timing (0 horiz)
non-conformant standard timing (0 horiz)
non-conformant standard timing (0 horiz)
non-conformant standard timing (0 horiz)
non-conformant standard timing (0 horiz)
non-conformant standard timing (0 horiz)
non-conformant standard timing (0 horiz)
Detailed mode: Clock 400.400 MHz, 60 mm x 50 mm
               2880 2888 2920 2960 hborder 0
               1440 1489 1497 1503 vborder 0
               -hsync -vsync 
               VertFreq: 90 Hz, HorFreq: 135270 Hz
Detailed mode: Clock 270.200 MHz, 60 mm x 50 mm
               2880 2904 2936 2996 hborder 0
               1440 1489 1497 1503 vborder 0
               -hsync -vsync 
               VertFreq: 60 Hz, HorFreq: 90186 Hz
Monitor name: MR
Monitor ranges (GTF): 60-90Hz V, 31-135kHz H, max dotclock 600MHz
Has 1 extension blocks
Checksum: 0x3f (valid)

CTA extension block
Extension version: 3
36 bytes of CTA data
  Vendor-specific data block, OUI 000c03 (HDMI)
    Source physical address 1.0.0.0
  Vendor-specific data block, OUI c45dd8 (HDMI Forum)
    Version: 1
    Maximum TMDS Character Rate: 405MHz
    SCDC Present
  Vendor-specific data block, OUI ca125c
2 native detailed modes
Detailed mode: Clock 400.400 MHz, 60 mm x 50 mm
               2880 2888 2920 2960 hborder 0
               1440 1489 1497 1503 vborder 0
               -hsync -vsync 
               VertFreq: 90 Hz, HorFreq: 135270 Hz
Detailed mode: Clock 270.200 MHz, 60 mm x 50 mm
               2880 2904 2936 2996 hborder 0
               1440 1489 1497 1503 vborder 0
               -hsync -vsync 
               VertFreq: 60 Hz, HorFreq: 90186 Hz
Checksum: 0x58 (valid)

EDID block does NOT conform to EDID 1.3!
	Required 640x480p60 timings are missing in the established timings
	and/or in the SVD list (VIC 1)
One or more of the timings is out of range of the Monitor Ranges:
  Vertical Freq: 60 - 90 Hz
  Horizontal Freq: 90186 - 135270 Hz
  Maximum Clock: 400.400 MHz
