edid-decode (hex):

00 ff ff ff ff ff ff 00 09 e5 ef 08 00 00 00 00
01 1d 01 04 95 22 13 78 02 02 45 94 5c 58 92 29
21 50 54 00 00 00 01 01 01 01 01 01 01 01 01 01
01 01 01 01 01 01 c7 1d 56 e2 50 00 1e 30 30 20
36 00 58 c2 10 00 00 1a 00 00 00 00 00 00 00 00
00 00 00 00 00 00 00 00 00 1a 00 00 00 fe 00 42
4f 45 20 43 51 0a 20 20 20 20 20 20 00 00 00 fe
00 4e 54 31 35 36 57 48 4d 2d 4e 34 34 0a 00 96

----------------

Block 0, Base EDID:
  EDID Structure Version & Revision: 1.4
  Vendor & Product Identification:
    Manufacturer: BOE
    Model: 2287
    Made in: week 1 of 2019
  Basic Display Parameters & Features:
    Digital display
    Bits per primary color channel: 6
    DisplayPort interface
    Maximum image size: 34 cm x 19 cm
    Gamma: 2.20
    Supported color formats: RGB 4:4:4
    First detailed timing includes the native pixel format and preferred refresh rate
  Color Characteristics:
    Red  : 0.5781, 0.3593
    Green: 0.3437, 0.5722
    Blue : 0.1611, 0.1289
    White: 0.3134, 0.3291
  Established Timings I & II: none
  Standard Timings: none
  Detailed Timing Descriptors:
    DTD 1:  1366x768    60.004 Hz 683:384  47.883 kHz  76.230 MHz (344 mm x 194 mm)
                 Hfront   48 Hsync  32 Hback 146 Hpol P
                 Vfront    3 Vsync   6 Vback  21 Vpol N
    Manufacturer-Specified Display Descriptor (0x00): 00 00 00 00 00 00 00 00 00 00 00 00 00 00 00 1a '................'
    Alphanumeric Data String: 'BOE CQ'
    Alphanumeric Data String: 'NT156WHM-N44'
Checksum: 0x96

----------------

Failures:

Block 0, Base EDID:
  Missing Display Product Name.

EDID conformity: FAIL
