edid-decode (hex):

00 ff ff ff ff ff ff 00 1c 54 0d 27 01 01 01 01
1d 22 01 04 c5 46 27 78 fb 6b f5 ad 51 45 ab 26
0b 50 54 ff ff 80 71 4f 81 c0 81 00 81 40 81 80
95 00 a9 c0 b3 00 66 5c 00 78 a0 a0 1f 50 17 20
18 04 55 50 21 00 00 1e 00 00 00 fd 00 30 aa f6
f6 44 01 0a 20 20 20 20 20 20 00 00 00 fc 00 4d
32 37 51 0a 20 20 20 20 20 20 20 20 00 00 00 ff
00 32 34 32 39 30 42 30 30 32 32 31 34 0a 02 69

02 03 32 71 4c 03 02 13 04 29 0f 0e 1f 90 40 3f
61 23 09 17 07 83 01 00 00 6d 1a 00 00 02 01 30
aa 00 00 00 00 00 00 e3 05 e3 01 e6 06 05 01 62
62 2c 17 fe 00 78 a0 a0 1f 50 18 10 35 00 55 50
21 00 00 1e 6f c2 00 a0 a0 a0 55 50 30 20 35 00
55 50 21 00 00 1e 96 7f 80 78 70 38 21 40 1c 20
38 04 55 50 21 00 00 1e 00 00 00 00 00 00 00 00
00 00 00 00 00 00 00 00 00 00 00 00 00 00 00 2d

70 12 79 03 00 03 01 28 5f e8 00 04 ff 09 77 00
1b 80 1f 00 9f 05 66 00 08 80 07 00 ca 05 01 04
ff 09 77 00 17 80 0f 00 9f 05 1e 00 02 80 04 00
00 00 00 00 00 00 00 00 00 00 00 00 00 00 00 00
00 00 00 00 00 00 00 00 00 00 00 00 00 00 00 00
00 00 00 00 00 00 00 00 00 00 00 00 00 00 00 00
00 00 00 00 00 00 00 00 00 00 00 00 00 00 00 00
00 00 00 00 00 00 00 00 00 00 00 00 00 00 e8 90

00 ff ff ff ff ff ff 00 1c 54 0d 27 01 01 01 01
1d 22 01 04 c5 46 27 78 fb 6b f5 ad 51 45 ab 26
0b 50 54 ff ff 80 71 4f 81 c0 81 00 81 40 81 80
95 00 a9 c0 b3 00 66 5c 00 78 a0 a0 1f 50 17 20
18 04 55 50 21 00 00 1e 00 00 00 fd 00 30 aa f6
f6 44 01 0a 20 20 20 20 20 20 00 00 00 fc 00 4d
32 37 51 0a 20 20 20 20 20 20 20 20 00 00 00 ff
00 32 34 32 39 30 42 30 30 32 32 31 34 0a 02 69

02 03 32 71 4c 03 02 13 04 29 0f 0e 1f 90 40 3f
61 23 09 17 07 83 01 00 00 6d 1a 00 00 02 01 30
aa 00 00 00 00 00 00 e3 05 e3 01 e6 06 05 01 62
62 2c 17 fe 00 78 a0 a0 1f 50 18 10 35 00 55 50
21 00 00 1e 6f c2 00 a0 a0 a0 55 50 30 20 35 00
55 50 21 00 00 1e 96 7f 80 78 70 38 21 40 1c 20
38 04 55 50 21 00 00 1e 00 00 00 00 00 00 00 00
00 00 00 00 00 00 00 00 00 00 00 00 00 00 00 2d

70 12 79 03 00 03 01 28 5f e8 00 04 ff 09 77 00
1b 80 1f 00 9f 05 66 00 08 80 07 00 ca 05 01 04
ff 09 77 00 17 80 0f 00 9f 05 1e 00 02 80 04 00
00 00 00 00 00 00 00 00 00 00 00 00 00 00 00 00
00 00 00 00 00 00 00 00 00 00 00 00 00 00 00 00
00 00 00 00 00 00 00 00 00 00 00 00 00 00 00 00
00 00 00 00 00 00 00 00 00 00 00 00 00 00 00 00
00 00 00 00 00 00 00 00 00 00 00 00 00 00 e8 90

----------------

Block 0, Base EDID:
  EDID Structure Version & Revision: 1.4
  Vendor & Product Identification:
    Manufacturer: GBT
    Model: 9997
    Serial Number: ...
    Made in: week 29 of 2024
  Basic Display Parameters & Features:
    Digital display
    Bits per primary color channel: 12
    DisplayPort interface
    Maximum image size: 70 cm x 39 cm
    Gamma: 2.20
    DPMS levels: Standby Suspend Off
    Supported color formats: RGB 4:4:4, YCrCb 4:4:4, YCrCb 4:2:2
    First detailed timing includes the native pixel format and preferred refresh rate
    Display is continuous frequency
  Color Characteristics:
    Red  : 0.6767, 0.3183
    Green: 0.2714, 0.6708
    Blue : 0.1513, 0.0458
    White: 0.3134, 0.3291
  Established Timings I & II:
    IBM     :   720x400    70.081663 Hz   9:5     31.467 kHz     28.320000 MHz
    IBM     :   720x400    87.849542 Hz   9:5     39.444 kHz     35.500000 MHz
    DMT 0x04:   640x480    59.940476 Hz   4:3     31.469 kHz     25.175000 MHz
    Apple   :   640x480    66.666667 Hz   4:3     35.000 kHz     30.240000 MHz
    DMT 0x05:   640x480    72.808802 Hz   4:3     37.861 kHz     31.500000 MHz
    DMT 0x06:   640x480    75.000000 Hz   4:3     37.500 kHz     31.500000 MHz
    DMT 0x08:   800x600    56.250000 Hz   4:3     35.156 kHz     36.000000 MHz
    DMT 0x09:   800x600    60.316541 Hz   4:3     37.879 kHz     40.000000 MHz
    DMT 0x0a:   800x600    72.187572 Hz   4:3     48.077 kHz     50.000000 MHz
    DMT 0x0b:   800x600    75.000000 Hz   4:3     46.875 kHz     49.500000 MHz
    Apple   :   832x624    74.551266 Hz   4:3     49.726 kHz     57.284000 MHz
    DMT 0x0f:  1024x768i   86.957532 Hz   4:3     35.522 kHz     44.900000 MHz
    DMT 0x10:  1024x768    60.003840 Hz   4:3     48.363 kHz     65.000000 MHz
    DMT 0x11:  1024x768    70.069359 Hz   4:3     56.476 kHz     75.000000 MHz
    DMT 0x12:  1024x768    75.028582 Hz   4:3     60.023 kHz     78.750000 MHz
    DMT 0x24:  1280x1024   75.024675 Hz   5:4     79.976 kHz    135.000000 MHz
    Apple   :  1152x870    75.061550 Hz 192:145   68.681 kHz    100.000000 MHz
  Standard Timings:
    DMT 0x15:  1152x864    75.000000 Hz   4:3     67.500 kHz    108.000000 MHz
    DMT 0x55:  1280x720    60.000000 Hz  16:9     45.000 kHz     74.250000 MHz
    DMT 0x1c:  1280x800    59.810326 Hz  16:10    49.702 kHz     83.500000 MHz
    DMT 0x20:  1280x960    60.000000 Hz   4:3     60.000 kHz    108.000000 MHz
    DMT 0x23:  1280x1024   60.019740 Hz   5:4     63.981 kHz    108.000000 MHz
    DMT 0x2f:  1440x900    59.887445 Hz  16:10    55.935 kHz    106.500000 MHz
    DMT 0x53:  1600x900    60.000000 Hz  16:9     60.000 kHz    108.000000 MHz (RB)
    DMT 0x3a:  1680x1050   59.954250 Hz  16:10    65.290 kHz    146.250000 MHz
  Detailed Timing Descriptors:
    DTD 1:  2560x1440   60.000812 Hz  16:9     88.261 kHz    236.540000 MHz (597 mm x 336 mm)
                 Hfront   23 Hsync  32 Hback   65 Hpol P
                 Vfront   17 Vsync   8 Vback    6 Vpol P
    Display Range Limits:
      Monitor ranges (Bare Limits): 48-170 Hz V, 246-246 kHz H, max dotclock 680 MHz
    Display Product Name: 'M27Q'
    Display Product Serial Number: ...
  Extension blocks: 2
Checksum: 0x69

----------------

Block 1, CTA-861 Extension Block:
  Revision: 3
  Basic audio support
  Supports YCbCr 4:4:4
  Supports YCbCr 4:2:2
  Native detailed modes: 1
  Video Data Block:
    VIC   3:   720x480    59.940060 Hz  16:9     31.469 kHz     27.000000 MHz
    VIC   2:   720x480    59.940060 Hz   4:3     31.469 kHz     27.000000 MHz
    VIC  19:  1280x720    50.000000 Hz  16:9     37.500 kHz     74.250000 MHz
    VIC   4:  1280x720    60.000000 Hz  16:9     45.000 kHz     74.250000 MHz
    VIC  41:  1280x720   100.000000 Hz  16:9     75.000 kHz    148.500000 MHz
    VIC  15:  1440x480    59.940060 Hz  16:9     31.469 kHz     54.000000 MHz
    VIC  14:  1440x480    59.940060 Hz   4:3     31.469 kHz     54.000000 MHz
    VIC  31:  1920x1080   50.000000 Hz  16:9     56.250 kHz    148.500000 MHz
    VIC  16:  1920x1080   60.000000 Hz  16:9     67.500 kHz    148.500000 MHz (native)
    VIC  64:  1920x1080  100.000000 Hz  16:9    112.500 kHz    297.000000 MHz
    VIC  63:  1920x1080  120.000000 Hz  16:9    135.000 kHz    297.000000 MHz
    VIC  97:  3840x2160   60.000000 Hz  16:9    135.000 kHz    594.000000 MHz
  Audio Data Block:
    Linear PCM:
      Max channels: 2
      Supported sample rates (kHz): 96 48 44.1 32
      Supported sample sizes (bits): 24 20 16
  Speaker Allocation Data Block:
    FL/FR - Front Left/Right
  Vendor-Specific Data Block (AMD), OUI 00-00-1A:
    Version: 2.1
    Minimum Refresh Rate: 48 Hz
    Maximum Refresh Rate: 170 Hz
    Flags 1.x: 0x00
    Flags 2.x: 0x00
    Maximum luminance: 0 (50.000 cd/m^2)
    Minimum luminance: 0 (0.000 cd/m^2)
    Unknown: 0x00 0x00
  Colorimetry Data Block:
    xvYCC601
    xvYCC709
    BT2020cYCC
    BT2020YCC
    BT2020RGB
    Gamut Boundary Description Metadata Profile P0
  HDR Static Metadata Data Block:
    Electro optical transfer functions:
      Traditional gamma - SDR luminance range
      SMPTE ST2084
    Supported static metadata descriptors:
      Static metadata type 1
    Desired content max luminance: 98 (417.710 cd/m^2)
    Desired content max frame-average luminance: 98 (417.710 cd/m^2)
    Desired content min luminance: 44 (0.124 cd/m^2)
  Detailed Timing Descriptors:
    DTD 2:  2560x1440  164.998427 Hz  16:9    242.713 kHz    650.470000 MHz (597 mm x 336 mm)
                 Hfront   24 Hsync  16 Hback   80 Hpol P
                 Vfront    3 Vsync   5 Vback   23 Vpol P
    DTD 3:  2560x1440  119.997589 Hz  16:9    182.996 kHz    497.750000 MHz (597 mm x 336 mm)
                 Hfront   48 Hsync  32 Hback   80 Hpol P
                 Vfront    3 Vsync   5 Vback   77 Vpol P
    DTD 4:  1920x1080  143.852510 Hz  16:9    160.108 kHz    326.620000 MHz (597 mm x 336 mm)
                 Hfront   28 Hsync  32 Hback   60 Hpol P
                 Vfront   19 Vsync   8 Vback    6 Vpol P
Checksum: 0x2d  Unused space in Extension Block: 23 bytes

----------------

Block 2, DisplayID Extension Block:
  Version: 1.2
  Extension Count: 0
  Display Product Type: Standalone display device
  Video Timing Modes Type 1 - Detailed Timings Data Block:
    DTD:  2560x1440  143.856221 Hz  16:9    221.970 kHz    594.880000 MHz (aspect 16:9, no 3D stereo)
               Hfront   28 Hsync  32 Hback   60 Hpol P
               Vfront    9 Vsync   8 Vback   86 Vpol P
    DTD:  2560x1440  170.000609 Hz  16:9    250.071 kHz    670.190000 MHz (aspect 16:9, no 3D stereo)
               Hfront   24 Hsync  16 Hback   80 Hpol P
               Vfront    3 Vsync   5 Vback   23 Vpol P
  Checksum: 0xe8
Checksum: 0x90

----------------

Block 3, Unknown EDID Extension Block 0x00:
  00 ff ff ff ff ff ff 00 1c 54 0d 27 01 01 01 01 '.........T.'....'
  1d 22 01 04 c5 46 27 78 fb 6b f5 ad 51 45 ab 26 '."...F'x.k..QE.&'
  0b 50 54 ff ff 80 71 4f 81 c0 81 00 81 40 81 80 '.PT...qO.....@..'
  95 00 a9 c0 b3 00 66 5c 00 78 a0 a0 1f 50 17 20 '......f\.x...P. '
  18 04 55 50 21 00 00 1e 00 00 00 fd 00 30 aa f6 '..UP!........0..'
  f6 44 01 0a 20 20 20 20 20 20 00 00 00 fc 00 4d '.D..      .....M'
  32 37 51 0a 20 20 20 20 20 20 20 20 00 00 00 ff '27Q.        ....'
  00 32 34 32 39 30 42 30 30 32 32 31 34 0a 02 69 '.24290B002214..i'
Checksum: 0x69

----------------

Block 4, CTA-861 Extension Block:
  Revision: 3
  Basic audio support
  Supports YCbCr 4:4:4
  Supports YCbCr 4:2:2
  Native detailed modes: 1
  Video Data Block:
    VIC   3:   720x480    59.940060 Hz  16:9     31.469 kHz     27.000000 MHz
    VIC   2:   720x480    59.940060 Hz   4:3     31.469 kHz     27.000000 MHz
    VIC  19:  1280x720    50.000000 Hz  16:9     37.500 kHz     74.250000 MHz
    VIC   4:  1280x720    60.000000 Hz  16:9     45.000 kHz     74.250000 MHz
    VIC  41:  1280x720   100.000000 Hz  16:9     75.000 kHz    148.500000 MHz
    VIC  15:  1440x480    59.940060 Hz  16:9     31.469 kHz     54.000000 MHz
    VIC  14:  1440x480    59.940060 Hz   4:3     31.469 kHz     54.000000 MHz
    VIC  31:  1920x1080   50.000000 Hz  16:9     56.250 kHz    148.500000 MHz
    VIC  16:  1920x1080   60.000000 Hz  16:9     67.500 kHz    148.500000 MHz (native)
    VIC  64:  1920x1080  100.000000 Hz  16:9    112.500 kHz    297.000000 MHz
    VIC  63:  1920x1080  120.000000 Hz  16:9    135.000 kHz    297.000000 MHz
    VIC  97:  3840x2160   60.000000 Hz  16:9    135.000 kHz    594.000000 MHz
  Audio Data Block:
    Linear PCM:
      Max channels: 2
      Supported sample rates (kHz): 96 48 44.1 32
      Supported sample sizes (bits): 24 20 16
  Speaker Allocation Data Block:
    FL/FR - Front Left/Right
  Vendor-Specific Data Block (AMD), OUI 00-00-1A:
    Version: 2.1
    Minimum Refresh Rate: 48 Hz
    Maximum Refresh Rate: 170 Hz
    Flags 1.x: 0x00
    Flags 2.x: 0x00
    Maximum luminance: 0 (50.000 cd/m^2)
    Minimum luminance: 0 (0.000 cd/m^2)
    Unknown: 0x00 0x00
  Colorimetry Data Block:
    xvYCC601
    xvYCC709
    BT2020cYCC
    BT2020YCC
    BT2020RGB
    Gamut Boundary Description Metadata Profile P0
  HDR Static Metadata Data Block:
    Electro optical transfer functions:
      Traditional gamma - SDR luminance range
      SMPTE ST2084
    Supported static metadata descriptors:
      Static metadata type 1
    Desired content max luminance: 98 (417.710 cd/m^2)
    Desired content max frame-average luminance: 98 (417.710 cd/m^2)
    Desired content min luminance: 44 (0.124 cd/m^2)
  Detailed Timing Descriptors:
    DTD 5:  2560x1440  164.998427 Hz  16:9    242.713 kHz    650.470000 MHz (597 mm x 336 mm)
                 Hfront   24 Hsync  16 Hback   80 Hpol P
                 Vfront    3 Vsync   5 Vback   23 Vpol P
    DTD 6:  2560x1440  119.997589 Hz  16:9    182.996 kHz    497.750000 MHz (597 mm x 336 mm)
                 Hfront   48 Hsync  32 Hback   80 Hpol P
                 Vfront    3 Vsync   5 Vback   77 Vpol P
    DTD 7:  1920x1080  143.852510 Hz  16:9    160.108 kHz    326.620000 MHz (597 mm x 336 mm)
                 Hfront   28 Hsync  32 Hback   60 Hpol P
                 Vfront   19 Vsync   8 Vback    6 Vpol P
Checksum: 0x2d  Unused space in Extension Block: 23 bytes

----------------

Block 5, DisplayID Extension Block:
  Version: 1.2
  Extension Count: 0
  Video Timing Modes Type 1 - Detailed Timings Data Block:
    DTD:  2560x1440  143.856221 Hz  16:9    221.970 kHz    594.880000 MHz (aspect 16:9, no 3D stereo)
               Hfront   28 Hsync  32 Hback   60 Hpol P
               Vfront    9 Vsync   8 Vback   86 Vpol P
    DTD:  2560x1440  170.000609 Hz  16:9    250.071 kHz    670.190000 MHz (aspect 16:9, no 3D stereo)
               Hfront   24 Hsync  16 Hback   80 Hpol P
               Vfront    3 Vsync   5 Vback   23 Vpol P
  Checksum: 0xe8
Checksum: 0x90

----------------

Warnings:

Block 1, CTA-861 Extension Block:
  IT Video Formats are overscanned by default, but normally this should be underscanned.
  Colorimetry Data Block: Set the sRGB colorimetry bit to avoid interop issues.
  Display Product Serial Number is set, so the Serial Number in the Base EDID should be 0.
Block 4, CTA-861 Extension Block:
  IT Video Formats are overscanned by default, but normally this should be underscanned.
  Colorimetry Data Block: Set the sRGB colorimetry bit to avoid interop issues.
  Display Product Serial Number is set, so the Serial Number in the Base EDID should be 0.
EDID:
  Base EDID: Some timings are out of range of the Monitor Ranges:
    Horizontal Freq: 31.466 - 250.070 kHz (Monitor: 246.000 - 246.000 kHz)

Failures:

Block 0, Base EDID:
  Detailed Timing Descriptor #1: Mismatch of image size 597x336 mm vs display size 700x390 mm.
Block 1, CTA-861 Extension Block:
  Detailed Timing Descriptor #2: Mismatch of image size 597x336 mm vs display size 700x390 mm.
  Detailed Timing Descriptor #3: Mismatch of image size 597x336 mm vs display size 700x390 mm.
  Detailed Timing Descriptor #4: Mismatch of image size 597x336 mm vs display size 700x390 mm.
  Missing VCDB, needed for Set Selectable RGB Quantization to avoid interop issues.
Block 2, DisplayID Extension Block:
  Expected 0 DisplayID Extension Block, but got 1.
Block 3, Base EDID:
  Unknown Extension Block.
Block 4, CTA-861 Extension Block:
  Video Data Block: Duplicate VIC 3.
  Video Data Block: Duplicate VIC 2.
  Video Data Block: Duplicate VIC 19.
  Video Data Block: Duplicate VIC 4.
  Video Data Block: Duplicate VIC 41.
  Video Data Block: Duplicate VIC 15.
  Video Data Block: Duplicate VIC 14.
  Video Data Block: Duplicate VIC 31.
  Video Data Block: Duplicate VIC 16.
  Video Data Block: Duplicate VIC 64.
  Video Data Block: Duplicate VIC 63.
  Video Data Block: Duplicate VIC 97.
  Speaker Allocation Data Block: Only one instance of this Data Block is allowed.
  Colorimetry Data Block: Only one instance of this Data Block is allowed.
  HDR Static Metadata Data Block: Only one instance of this Data Block is allowed.
  Detailed Timing Descriptor #5: Mismatch of image size 597x336 mm vs display size 700x390 mm.
  Detailed Timing Descriptor #6: Mismatch of image size 597x336 mm vs display size 700x390 mm.
  Detailed Timing Descriptor #7: Mismatch of image size 597x336 mm vs display size 700x390 mm.
  Missing VCDB, needed for Set Selectable RGB Quantization to avoid interop issues.
Block 5, DisplayID Extension Block:
  Product Type should be 0 in extension block.
EDID:
  Base EDID: EDID specified 2 extension block(s), but found 5 extension block(s).
  CTA-861: Native progressive timings are a mix of several resolutions.
  DisplayID: Missing DisplayID Product Identification Data Block.
  DisplayID: Missing DisplayID Display Parameters Data Block.
  DisplayID: Missing DisplayID Display Interface Features Data Block.
  DisplayID: DisplayID expects at least one preferred timing.

EDID conformity: FAIL
