edid-decode (hex):

00 ff ff ff ff ff ff 00 0d af 08 14 00 00 00 00
15 0f 01 03 80 1e 13 78 0a 04 85 97 57 51 89 26
1f 50 54 00 00 00 01 01 01 01 01 01 01 01 01 01
01 01 01 01 01 01 bc 1b 00 a0 50 20 17 30 30 20
36 00 2f be 10 00 00 18 00 00 00 fe 00 4e 31 34
31 49 31 2d 4c 30 32 0a 20 20 00 00 00 fe 00 43
4d 4f 0a 20 20 20 20 20 20 20 20 20 00 00 00 fe
00 4e 31 34 31 49 31 2d 4c 30 32 0a 20 20 00 b7

----------------

Block 0, Base EDID:
  EDID Structure Version & Revision: 1.3
  Vendor & Product Identification:
    Manufacturer: CMO
    Model: 5128
    Made in: week 21 of 2005
  Basic Display Parameters & Features:
    Digital display
    Maximum image size: 30 cm x 19 cm
    Gamma: 2.20
    RGB color display
    First detailed timing is the preferred timing
  Color Characteristics:
    Red  : 0.5898, 0.3398
    Green: 0.3173, 0.5351
    Blue : 0.1503, 0.1210
    White: 0.3134, 0.3291
  Established Timings I & II: none
  Standard Timings: none
  Detailed Timing Descriptors:
    DTD 1:  1280x800    59.910 Hz   8:5    49.306 kHz  71.000 MHz (303 mm x 190 mm)
                 Hfront   48 Hsync  32 Hback  80 Hpol N
                 Vfront    3 Vsync   6 Vback  14 Vpol N
    Alphanumeric Data String: 'N141I1-L02'
    Alphanumeric Data String: 'CMO'
    Alphanumeric Data String: 'N141I1-L02'
Checksum: 0xb7

----------------

Failures:

Block 0, Base EDID:
  Missing Display Product Name.
  Missing Display Range Limits Descriptor.

EDID conformity: FAIL
