edid-decode (hex):

00 ff ff ff ff ff ff 00 41 0c 43 d0 81 0f 00 00
2a 12 01 03 68 29 1a 78 2a 80 c5 a6 57 49 9b 23
12 50 54 23 08 00 01 01 01 01 01 01 01 01 01 01
01 01 01 01 01 01 9a 29 a0 d0 51 84 22 30 50 98
36 00 98 ff 10 00 00 1a 00 00 00 ff 00 30 30 33
39 36 39 0a 20 20 20 20 20 20 00 00 00 fc 00 31
39 4d 46 33 33 38 42 0a 20 20 20 20 00 00 00 fd
00 38 3e 1e 38 0b 00 0a 20 20 20 20 20 20 00 11

----------------

Block 0, Base EDID:
  EDID Structure Version & Revision: 1.3
  Vendor & Product Identification:
    Manufacturer: PHL
    Model: 53315
    Serial Number: ...
    Made in: week 42 of 2008
  Basic Display Parameters & Features:
    Analog display
    Input voltage level: 0.7/0.7 V
    Blank level equals black level
    Sync: Separate
    Maximum image size: 41 cm x 26 cm
    Gamma: 2.20
    DPMS levels: Off
    RGB color display
    First detailed timing is the preferred timing
  Color Characteristics:
    Red  : 0.6503, 0.3398
    Green: 0.2851, 0.6054
    Blue : 0.1396, 0.0703
    White: 0.3134, 0.3291
  Established Timings I & II:
    DMT 0x04:   640x480    59.940 Hz   4:3    31.469 kHz  25.175 MHz
    DMT 0x08:   800x600    56.250 Hz   4:3    35.156 kHz  36.000 MHz
    DMT 0x09:   800x600    60.317 Hz   4:3    37.879 kHz  40.000 MHz
    DMT 0x10:  1024x768    60.004 Hz   4:3    48.363 kHz  65.000 MHz
  Standard Timings: none
  Detailed Timing Descriptors:
    DTD 1:  1440x900    59.887 Hz   8:5    55.935 kHz 106.500 MHz (408 mm x 255 mm)
                 Hfront   80 Hsync 152 Hback 232 Hpol P
                 Vfront    3 Vsync   6 Vback  25 Vpol N
    Display Product Serial Number: ...
    Display Product Name: '19MF338B'
  Display Range Limits:
    Monitor ranges (GTF): 56-62 Hz V, 30-56 kHz H, max dotclock 110 MHz
Checksum: 0x11

----------------

EDID conformity: PASS
