edid-decode (hex):

00 ff ff ff ff ff ff 00 22 64 91 89 3e 05 00 00
31 14 01 03 0a 29 1a 78 ea 9b b6 a4 53 4b 9d 24
14 4f 54 bf ef 80 81 80 81 c0 81 40 71 4f 61 46
90 4f 95 0f 01 01 9a 29 a0 d0 51 84 22 30 50 98
36 00 98 ff 10 00 00 1e 00 00 00 fd 00 31 4b 1e
53 0e 00 0a 20 20 20 20 20 20 00 00 00 ff 00 30
34 39 47 48 33 42 59 30 31 33 34 32 00 00 00 fc
00 48 61 6e 6e 73 2e 47 20 48 57 31 39 31 00 4e

00 ff ff ff ff ff ff 00 22 64 91 89 3e 05 00 00
31 14 01 03 0a 29 1a 78 ea 9b b6 a4 53 4b 9d 24
14 4f 54 bf ef 80 81 80 81 c0 81 40 71 4f 61 46
90 4f 95 0f 01 01 9a 29 a0 d0 51 84 22 30 50 98
36 00 98 ff 10 00 00 1e 00 00 00 fd 00 31 4b 1e
53 0e 00 0a 20 20 20 20 20 20 00 00 00 ff 00 30
34 39 47 48 33 42 59 30 31 33 34 32 00 00 00 fc
00 48 61 6e 6e 73 2e 47 20 48 57 31 39 31 00 4e

----------------

Block 0, Base EDID:
  EDID Structure Version & Revision: 1.3
  Vendor & Product Identification:
    Manufacturer: HSD
    Model: 35217
    Serial Number: ...
    Made in: week 49 of 2010
  Basic Display Parameters & Features:
    Analog display
    Signal Level Standard: 0.700 : 0.300 : 1.000 V p-p
    Blank level equals black level
    Sync: Separate SyncOnGreen
    Maximum image size: 41 cm x 26 cm
    Gamma: 2.20
    DPMS levels: Standby Suspend Off
    RGB color display
    First detailed timing is the preferred timing
  Color Characteristics:
    Red  : 0.6425, 0.3251
    Green: 0.2949, 0.6162
    Blue : 0.1425, 0.0810
    White: 0.3095, 0.3300
  Established Timings I & II:
    IBM     :   720x400    70.081663 Hz   9:5     31.467 kHz     28.320000 MHz
    DMT 0x04:   640x480    59.940476 Hz   4:3     31.469 kHz     25.175000 MHz
    Apple   :   640x480    66.666667 Hz   4:3     35.000 kHz     30.240000 MHz
    DMT 0x05:   640x480    72.808802 Hz   4:3     37.861 kHz     31.500000 MHz
    DMT 0x06:   640x480    75.000000 Hz   4:3     37.500 kHz     31.500000 MHz
    DMT 0x08:   800x600    56.250000 Hz   4:3     35.156 kHz     36.000000 MHz
    DMT 0x09:   800x600    60.316541 Hz   4:3     37.879 kHz     40.000000 MHz
    DMT 0x0a:   800x600    72.187572 Hz   4:3     48.077 kHz     50.000000 MHz
    DMT 0x0b:   800x600    75.000000 Hz   4:3     46.875 kHz     49.500000 MHz
    Apple   :   832x624    74.551266 Hz   4:3     49.726 kHz     57.284000 MHz
    DMT 0x10:  1024x768    60.003840 Hz   4:3     48.363 kHz     65.000000 MHz
    DMT 0x11:  1024x768    70.069359 Hz   4:3     56.476 kHz     75.000000 MHz
    DMT 0x12:  1024x768    75.028582 Hz   4:3     60.023 kHz     78.750000 MHz
    DMT 0x24:  1280x1024   75.024675 Hz   5:4     79.976 kHz    135.000000 MHz
    Apple   :  1152x870    75.061550 Hz 192:145   68.681 kHz    100.000000 MHz
  Standard Timings:
    DMT 0x23:  1280x1024   60.019740 Hz   5:4     63.981 kHz    108.000000 MHz
    DMT 0x55:  1280x720    60.000000 Hz  16:9     45.000 kHz     74.250000 MHz
    DMT 0x20:  1280x960    60.000000 Hz   4:3     60.000 kHz    108.000000 MHz
    DMT 0x15:  1152x864    75.000000 Hz   4:3     67.500 kHz    108.000000 MHz
    GTF     :  1024x768    65.999558 Hz   4:3     52.668 kHz     71.628000 MHz
    DMT 0x2b:  1400x1050   74.866680 Hz   4:3     82.278 kHz    156.000000 MHz
    DMT 0x30:  1440x900    74.984427 Hz  16:10    70.635 kHz    136.750000 MHz
  Detailed Timing Descriptors:
    DTD 1:  1440x900    59.887445 Hz  16:10    55.935 kHz    106.500000 MHz (408 mm x 255 mm)
                 Hfront   80 Hsync 152 Hback  232 Hpol P
                 Vfront    3 Vsync   6 Vback   25 Vpol P
    Display Range Limits:
      Monitor ranges (GTF): 49-75 Hz V, 30-83 kHz H, max dotclock 140 MHz
    Display Product Serial Number: ...
    Display Product Name: 'Hanns.G HW191'
Checksum: 0x4e

----------------

Block 1, Unknown EDID Extension Block 0x00:
  00 ff ff ff ff ff ff 00 22 64 91 89 3e 05 00 00 '........"d..>...'
  31 14 01 03 0a 29 1a 78 ea 9b b6 a4 53 4b 9d 24 '1....).x....SK.$'
  14 4f 54 bf ef 80 81 80 81 c0 81 40 71 4f 61 46 '.OT........@qOaF'
  90 4f 95 0f 01 01 9a 29 a0 d0 51 84 22 30 50 98 '.O.....)..Q."0P.'
  36 00 98 ff 10 00 00 1e 00 00 00 fd 00 31 4b 1e '6............1K.'
  53 0e 00 0a 20 20 20 20 20 20 00 00 00 ff 00 30 'S...      .....0'
  34 39 47 48 33 42 59 30 31 33 34 32 00 00 00 fc '49GH3BY01342....'
  00 48 61 6e 6e 73 2e 47 20 48 57 31 39 31 00 4e '.Hanns.G HW191.N'
Checksum: 0x4e

----------------

Warnings:

Block 0, Base EDID:
  Detailed Timing Descriptor #1: DTD is similar but not identical to DMT 0x2f.

Failures:

Block 1, Base EDID:
  Unknown Extension Block.
EDID:
  Base EDID: Some timings are out of range of the Monitor Ranges:
    Maximum Clock: 156.000 MHz (Monitor: 140.000 MHz)
  Base EDID: EDID specified 0 extension block(s), but found 1 extension block(s).

EDID conformity: FAIL
