edid-decode (hex):

00 ff ff ff ff ff ff 00 5a 63 08 42 01 01 01 01
23 0d 01 04 0e 29 1f 78 2a e5 95 a5 58 4c 97 26
1e 50 54 bf ef 80 a9 40 81 80 71 4f 61 59 45 59
31 59 01 01 01 01 48 3f 40 30 62 b0 32 40 40 c0
13 00 98 32 11 00 00 1e 00 00 00 ff 00 41 31 37
30 33 33 35 30 30 38 37 35 0a 00 00 00 fd 00 32
55 1e 52 11 00 0a 20 20 20 20 20 20 00 00 00 fc
00 56 58 32 30 30 30 0a 20 20 20 20 20 20 00 c1

00 ff ff ff ff ff ff 00 5a 63 08 42 01 01 01 01
23 0d 01 04 0e 29 1f 78 2a e5 95 a5 58 4c 97 26
1e 50 54 bf ef 80 a9 40 81 80 71 4f 61 59 45 59
31 59 01 01 01 01 48 3f 40 30 62 b0 32 40 40 c0
13 00 98 32 11 00 00 1e 00 00 00 ff 00 41 31 37
30 33 33 35 30 30 38 37 35 0a 00 00 00 fd 00 32
55 1e 52 11 00 0a 20 20 20 20 20 20 00 00 00 fc
00 56 58 32 30 30 30 0a 20 20 20 20 20 20 00 c1

----------------

Block 0, Base EDID:
  EDID Structure Version & Revision: 1.4
  Vendor & Product Identification:
    Manufacturer: VSC
    Model: 16904
    Serial Number: ...
    Made in: week 35 of 2003
  Basic Display Parameters & Features:
    Analog display
    Signal Level Standard: 0.700 : 0.300 : 1.000 V p-p
    Blank level equals black level
    Sync: Separate Composite SyncOnGreen
    Maximum image size: 41 cm x 31 cm
    Gamma: 2.20
    DPMS levels: Off
    RGB color display
    First detailed timing includes the native pixel format and preferred refresh rate
  Color Characteristics:
    Red  : 0.6474, 0.3457
    Green: 0.2978, 0.5908
    Blue : 0.1503, 0.1181
    White: 0.3134, 0.3291
  Established Timings I & II:
    IBM     :   720x400    70.081663 Hz   9:5     31.467 kHz     28.320000 MHz
    DMT 0x04:   640x480    59.940476 Hz   4:3     31.469 kHz     25.175000 MHz
    Apple   :   640x480    66.666667 Hz   4:3     35.000 kHz     30.240000 MHz
    DMT 0x05:   640x480    72.808802 Hz   4:3     37.861 kHz     31.500000 MHz
    DMT 0x06:   640x480    75.000000 Hz   4:3     37.500 kHz     31.500000 MHz
    DMT 0x08:   800x600    56.250000 Hz   4:3     35.156 kHz     36.000000 MHz
    DMT 0x09:   800x600    60.316541 Hz   4:3     37.879 kHz     40.000000 MHz
    DMT 0x0a:   800x600    72.187572 Hz   4:3     48.077 kHz     50.000000 MHz
    DMT 0x0b:   800x600    75.000000 Hz   4:3     46.875 kHz     49.500000 MHz
    Apple   :   832x624    74.551266 Hz   4:3     49.726 kHz     57.284000 MHz
    DMT 0x10:  1024x768    60.003840 Hz   4:3     48.363 kHz     65.000000 MHz
    DMT 0x11:  1024x768    70.069359 Hz   4:3     56.476 kHz     75.000000 MHz
    DMT 0x12:  1024x768    75.028582 Hz   4:3     60.023 kHz     78.750000 MHz
    DMT 0x24:  1280x1024   75.024675 Hz   5:4     79.976 kHz    135.000000 MHz
    Apple   :  1152x870    75.061550 Hz 192:145   68.681 kHz    100.000000 MHz
  Standard Timings:
    DMT 0x33:  1600x1200   60.000000 Hz   4:3     75.000 kHz    162.000000 MHz
    DMT 0x23:  1280x1024   60.019740 Hz   5:4     63.981 kHz    108.000000 MHz
    DMT 0x15:  1152x864    75.000000 Hz   4:3     67.500 kHz    108.000000 MHz
    DMT 0x13:  1024x768    84.996690 Hz   4:3     68.677 kHz     94.500000 MHz
    DMT 0x0c:   800x600    85.061274 Hz   4:3     53.674 kHz     56.250000 MHz
    DMT 0x07:   640x480    85.008312 Hz   4:3     43.269 kHz     36.000000 MHz
  Detailed Timing Descriptors:
    DTD 1:  1600x1200   60.000000 Hz   4:3     75.000 kHz    162.000000 MHz (408 mm x 306 mm)
                 Hfront   64 Hsync 192 Hback  304 Hpol P
                 Vfront    1 Vsync   3 Vback   46 Vpol P
    Display Product Serial Number: ...
    Display Range Limits:
      Monitor ranges (GTF): 50-85 Hz V, 30-82 kHz H, max dotclock 170 MHz
    Display Product Name: 'VX2000'
Checksum: 0xc1

----------------

Block 1, Unknown EDID Extension Block 0x00:
  00 ff ff ff ff ff ff 00 5a 63 08 42 01 01 01 01 '........Zc.B....'
  23 0d 01 04 0e 29 1f 78 2a e5 95 a5 58 4c 97 26 '#....).x*...XL.&'
  1e 50 54 bf ef 80 a9 40 81 80 71 4f 61 59 45 59 '.PT....@..qOaYEY'
  31 59 01 01 01 01 48 3f 40 30 62 b0 32 40 40 c0 '1Y....H?@0b.2@@.'
  13 00 98 32 11 00 00 1e 00 00 00 ff 00 41 31 37 '...2.........A17'
  30 33 33 35 30 30 38 37 35 0a 00 00 00 fd 00 32 '033500875......2'
  55 1e 52 11 00 0a 20 20 20 20 20 20 00 00 00 fc 'U.R...      ....'
  00 56 58 32 30 30 30 0a 20 20 20 20 20 20 00 c1 '.VX2000.      ..'
Checksum: 0xc1

----------------

Warnings:

Block 0, Base EDID:
  Display Range Limits: GTF support is deprecated in EDID 1.4.

Failures:

Block 0, Base EDID:
  Display Range Limits: GTF can't be combined with non-continuous frequencies.
Block 1, Base EDID:
  Unknown Extension Block.
EDID:
  Base EDID: EDID specified 0 extension block(s), but found 1 extension block(s).

EDID conformity: FAIL
