
EDID (hex):
00ffffffffffff0038a3656601010101
230f010380221b78ee2ee5a4574a9c25
115054bfee80714f8180010101010101
010101010101302a009851002a403070
1300520e1100001e000000fd00384b1f
450b000a202020202020000000fc004c
4344313737304e580a202020000000ff
00353938353339323854420a20200055

Extracted contents:
header:          00 ff ff ff ff ff ff 00
serial number:   38 a3 65 66 01 01 01 01 23 0f
version:         01 03
basic params:    80 22 1b 78 ee
chroma info:     2e e5 a4 57 4a 9c 25 11 50 54
established:     bf ee 80
standard:        71 4f 81 80 01 01 01 01 01 01 01 01 01 01 01 01
descriptor 1:    30 2a 00 98 51 00 2a 40 30 70 13 00 52 0e 11 00 00 1e
descriptor 2:    00 00 00 fd 00 38 4b 1f 45 0b 00 0a 20 20 20 20 20 20
descriptor 3:    00 00 00 fc 00 4c 43 44 31 37 37 30 4e 58 0a 20 20 20
descriptor 4:    00 00 00 ff 00 35 39 38 35 33 39 32 38 54 42 0a 20 20
extensions:      00
checksum:        55

EDID version: 1.3
Manufacturer: NEC Model 6665 Serial Number --
Digital display
Maximum image size: 34 cm x 27 cm
Gamma: 2.20
DPMS levels: Standby Suspend Off
RGB color display
Default (sRGB) color space is primary color space
First detailed timing is preferred timing
Display x,y Chromaticity:
  Red:   0.6406, 0.3417
  Green: 0.2919, 0.6113
  Blue:  0.1474, 0.0683
  White: 0.3134, 0.3291
Established timings supported:
  720x400@70Hz 9:5 HorFreq: 31469 Hz Clock: 28.320 MHz
  640x480@60Hz 4:3 HorFreq: 31469 Hz Clock: 25.175 MHz
  640x480@67Hz 4:3 HorFreq: 35000 Hz Clock: 30.240 MHz
  640x480@72Hz 4:3 HorFreq: 37900 Hz Clock: 31.500 MHz
  640x480@75Hz 4:3 HorFreq: 37500 Hz Clock: 31.500 MHz
  800x600@56Hz 4:3 HorFreq: 35200 Hz Clock: 36.000 MHz
  800x600@60Hz 4:3 HorFreq: 37900 Hz Clock: 40.000 MHz
  800x600@72Hz 4:3 HorFreq: 48100 Hz Clock: 50.000 MHz
  800x600@75Hz 4:3 HorFreq: 46900 Hz Clock: 49.500 MHz
  832x624@75Hz 4:3 HorFreq: 49726 Hz Clock: 57.284 MHz
  1024x768@60Hz 4:3 HorFreq: 48400 Hz Clock: 65.000 MHz
  1024x768@70Hz 4:3 HorFreq: 56500 Hz Clock: 75.000 MHz
  1024x768@75Hz 4:3 HorFreq: 60000 Hz Clock: 78.750 MHz
  1152x870@75Hz 192:145 HorFreq: 67500 Hz Clock: 108.000 MHz
Standard timings supported:
  1152x864@75Hz 4:3 HorFreq: 67500 Hz Clock: 108.000 MHz
  1280x1024@60Hz 5:4 HorFreq: 64000 Hz Clock: 108.000 MHz
Detailed mode: Clock 108.000 MHz, 338 mm x 270 mm
               1280 1328 1440 1688 hborder 0
               1024 1025 1028 1066 vborder 0
               +hsync +vsync 
               VertFreq: 60 Hz, HorFreq: 63981 Hz
Monitor ranges (GTF): 56-75Hz V, 31-69kHz H, max dotclock 110MHz
Monitor name: LCD1770NX
Serial number: --
Checksum: 0x55 (valid)
EDID block does NOT conform to EDID 1.3!
	sRGB is signaled, but the chromaticities do not match
EDID block does not conform at all!
	Bad year of manufacture
