
EDID (hex):
00ffffffffffff00220ec23600000000
301e0104b53c22783b2891a7554ea326
0f5054a10800d1c0a9c081c0d100b300
9500810081804dd000a0f0703e803030
350055502100001a000000fd00283c87
873c010a202020202020000000fc0048
502055323720346b20574c0a000000ff
0033434d30343831324b470a20200165
020321f15161605f5e5d101f22212004
1312110302012309070783010000e200
6b08e80030f2705a80b0588a00555021
00001e565e00a0a0a029503020350055
502100001a023a801871382d40582c45
0055502100001e201c5686500020300e
38130055502100001e9a2900a0512026
305080360055502100001c00000000fe

edid-decode (hex):

00 ff ff ff ff ff ff 00 22 0e c2 36 00 00 00 00
30 1e 01 04 b5 3c 22 78 3b 28 91 a7 55 4e a3 26
0f 50 54 a1 08 00 d1 c0 a9 c0 81 c0 d1 00 b3 00
95 00 81 00 81 80 4d d0 00 a0 f0 70 3e 80 30 30
35 00 55 50 21 00 00 1a 00 00 00 fd 00 28 3c 87
87 3c 01 0a 20 20 20 20 20 20 00 00 00 fc 00 48
50 20 55 32 37 20 34 6b 20 57 4c 0a 00 00 00 ff
00 33 43 4d 30 34 38 31 32 4b 47 0a 20 20 01 65

02 03 21 f1 51 61 60 5f 5e 5d 10 1f 22 21 20 04
13 12 11 03 02 01 23 09 07 07 83 01 00 00 e2 00
6b 08 e8 00 30 f2 70 5a 80 b0 58 8a 00 55 50 21
00 00 1e 56 5e 00 a0 a0 a0 29 50 30 20 35 00 55
50 21 00 00 1a 02 3a 80 18 71 38 2d 40 58 2c 45
00 55 50 21 00 00 1e 20 1c 56 86 50 00 20 30 0e
38 13 00 55 50 21 00 00 1e 9a 29 00 a0 51 20 26
30 50 80 36 00 55 50 21 00 00 1c 00 00 00 00 fe

----------------

Block 0, Base EDID:
  EDID Structure Version & Revision: 1.4
  Vendor & Product Identification:
    Manufacturer: HPN
    Model: 14018
    Made in: week 48 of 2020
  Basic Display Parameters & Features:
    Digital display
    Bits per primary color channel: 10
    DisplayPort interface
    Maximum image size: 60 cm x 34 cm
    Gamma: 2.20
    DPMS levels: Off
    Supported color formats: RGB 4:4:4, YCrCb 4:4:4, YCrCb 4:2:2
    First detailed timing includes the native pixel format and preferred refresh rate
    Display is continuous frequency
  Color Characteristics:
    Red  : 0.6523, 0.3339
    Green: 0.3066, 0.6367
    Blue : 0.1503, 0.0595
    White: 0.3125, 0.3291
  Established Timings I & II:
    IBM     :   720x400    70.081663 Hz   9:5     31.467 kHz     28.320000 MHz
    DMT 0x04:   640x480    59.940476 Hz   4:3     31.469 kHz     25.175000 MHz
    DMT 0x09:   800x600    60.316541 Hz   4:3     37.879 kHz     40.000000 MHz
    DMT 0x10:  1024x768    60.003840 Hz   4:3     48.363 kHz     65.000000 MHz
  Standard Timings:
    DMT 0x52:  1920x1080   60.000000 Hz  16:9     67.500 kHz    148.500000 MHz
    DMT 0x53:  1600x900    60.000000 Hz  16:9     60.000 kHz    108.000000 MHz (RB)
    DMT 0x55:  1280x720    60.000000 Hz  16:9     45.000 kHz     74.250000 MHz
    DMT 0x45:  1920x1200   59.884600 Hz  16:10    74.556 kHz    193.250000 MHz
    DMT 0x3a:  1680x1050   59.954250 Hz  16:10    65.290 kHz    146.250000 MHz
    DMT 0x2f:  1440x900    59.887445 Hz  16:10    55.935 kHz    106.500000 MHz
    DMT 0x1c:  1280x800    59.810326 Hz  16:10    49.702 kHz     83.500000 MHz
    DMT 0x23:  1280x1024   60.019740 Hz   5:4     63.981 kHz    108.000000 MHz
  Detailed Timing Descriptors:
    DTD 1:  3840x2160   59.996625 Hz  16:9    133.312 kHz    533.250000 MHz (597 mm x 336 mm)
                 Hfront   48 Hsync  48 Hback   64 Hpol P
                 Vfront    3 Vsync   5 Vback   54 Vpol N
    Display Range Limits:
      Monitor ranges (Bare Limits): 40-60 Hz V, 135-135 kHz H, max dotclock 600 MHz
    Display Product Name: 'HP U27 4k WL'
    Display Product Serial Number: '3CM04812KG'
  Extension blocks: 1
Checksum: 0x65

----------------

Block 1, CTA-861 Extension Block:
  Revision: 3
  Underscans IT Video Formats by default
  Basic audio support
  Supports YCbCr 4:4:4
  Supports YCbCr 4:2:2
  Native detailed modes: 1
  Video Data Block:
    VIC  97:  3840x2160   60.000000 Hz  16:9    135.000 kHz    594.000000 MHz
    VIC  96:  3840x2160   50.000000 Hz  16:9    112.500 kHz    594.000000 MHz
    VIC  95:  3840x2160   30.000000 Hz  16:9     67.500 kHz    297.000000 MHz
    VIC  94:  3840x2160   25.000000 Hz  16:9     56.250 kHz    297.000000 MHz
    VIC  93:  3840x2160   24.000000 Hz  16:9     54.000 kHz    297.000000 MHz
    VIC  16:  1920x1080   60.000000 Hz  16:9     67.500 kHz    148.500000 MHz
    VIC  31:  1920x1080   50.000000 Hz  16:9     56.250 kHz    148.500000 MHz
    VIC  34:  1920x1080   30.000000 Hz  16:9     33.750 kHz     74.250000 MHz
    VIC  33:  1920x1080   25.000000 Hz  16:9     28.125 kHz     74.250000 MHz
    VIC  32:  1920x1080   24.000000 Hz  16:9     27.000 kHz     74.250000 MHz
    VIC   4:  1280x720    60.000000 Hz  16:9     45.000 kHz     74.250000 MHz
    VIC  19:  1280x720    50.000000 Hz  16:9     37.500 kHz     74.250000 MHz
    VIC  18:   720x576    50.000000 Hz  16:9     31.250 kHz     27.000000 MHz
    VIC  17:   720x576    50.000000 Hz   4:3     31.250 kHz     27.000000 MHz
    VIC   3:   720x480    59.940060 Hz  16:9     31.469 kHz     27.000000 MHz
    VIC   2:   720x480    59.940060 Hz   4:3     31.469 kHz     27.000000 MHz
    VIC   1:   640x480    59.940476 Hz   4:3     31.469 kHz     25.175000 MHz
  Audio Data Block:
    Linear PCM:
      Max channels: 2
      Supported sample rates (kHz): 48 44.1 32
      Supported sample sizes (bits): 24 20 16
  Speaker Allocation Data Block:
    FL/FR - Front Left/Right
  Video Capability Data Block:
    YCbCr quantization: No Data
    RGB quantization: Selectable (via AVI Q)
    PT scan behavior: Always Underscanned
    IT scan behavior: Always Underscanned
    CE scan behavior: Supports both over- and underscan
  Detailed Timing Descriptors:
    DTD 2:  3840x2160   60.000000 Hz  16:9    135.000 kHz    594.000000 MHz (597 mm x 336 mm)
                 Hfront  176 Hsync  88 Hback  296 Hpol P
                 Vfront    8 Vsync  10 Vback   72 Vpol P
    DTD 3:  2560x1440   59.950550 Hz  16:9     88.787 kHz    241.500000 MHz (597 mm x 336 mm)
                 Hfront   48 Hsync  32 Hback   80 Hpol P
                 Vfront    3 Vsync   5 Vback   33 Vpol N
    DTD 4:  1920x1080   60.000000 Hz  16:9     67.500 kHz    148.500000 MHz (597 mm x 336 mm)
                 Hfront   88 Hsync  44 Hback  148 Hpol P
                 Vfront    4 Vsync   5 Vback   36 Vpol P
    DTD 5:  1366x768    60.000000 Hz 683:384   48.000 kHz     72.000000 MHz (597 mm x 336 mm)
                 Hfront   14 Hsync  56 Hback   64 Hpol P
                 Vfront    1 Vsync   3 Vback   28 Vpol P
    DTD 6:  1280x800    74.934142 Hz  16:10    62.795 kHz    106.500000 MHz (597 mm x 336 mm)
                 Hfront   80 Hsync 128 Hback  208 Hpol N
                 Vfront    3 Vsync   6 Vback   29 Vpol P
Checksum: 0xfe  Unused space in Extension Block: 4 bytes


