edid-decode (hex):

00 ff ff ff ff ff ff 00 4d d9 d0 01 4f 84 75 00
12 0d 01 03 80 32 1f 78 ea ce a9 a3 57 4c 99 26
19 48 4c a1 08 00 a9 40 81 80 81 40 01 01 01 01
01 01 01 01 01 01 28 3c 80 c8 70 b0 0c 40 40 20
33 00 ef 35 11 00 00 1e 48 3f 40 30 62 b0 32 40
40 c0 13 00 ef 35 11 00 00 1e 00 00 00 fd 00 37
41 1e 5c 11 00 0a 20 20 20 20 20 20 00 00 00 fc
00 53 44 4d 2d 50 32 33 32 57 0a 20 20 20 00 8c

00 ff ff ff ff ff ff 00 4d d9 d0 01 4f 84 75 00
12 0d 01 03 80 32 1f 78 ea ce a9 a3 57 4c 99 26
19 48 4c a1 08 00 a9 40 81 80 81 40 01 01 01 01
01 01 01 01 01 01 28 3c 80 c8 70 b0 0c 40 40 20
33 00 ef 35 11 00 00 1e 48 3f 40 30 62 b0 32 40
40 c0 13 00 ef 35 11 00 00 1e 00 00 00 fd 00 37
41 1e 5c 11 00 0a 20 20 20 20 20 20 00 00 00 fc
00 53 44 4d 2d 50 32 33 32 57 0a 20 20 20 00 8c

----------------

Block 0, Base EDID:
  EDID Structure Version & Revision: 1.3
  Vendor & Product Identification:
    Manufacturer: SNY
    Model: 464
    Serial Number: ...
    Made in: week 18 of 2003
  Basic Display Parameters & Features:
    Digital display
    Maximum image size: 50 cm x 31 cm
    Gamma: 2.20
    DPMS levels: Standby Suspend Off
    RGB color display
    First detailed timing is the preferred timing
  Color Characteristics:
    Red  : 0.6396, 0.3398
    Green: 0.2998, 0.5996
    Blue : 0.1503, 0.0996
    White: 0.2832, 0.2978
  Established Timings I & II:
    IBM     :   720x400    70.081663 Hz   9:5     31.467 kHz     28.320000 MHz
    DMT 0x04:   640x480    59.940476 Hz   4:3     31.469 kHz     25.175000 MHz
    DMT 0x09:   800x600    60.316541 Hz   4:3     37.879 kHz     40.000000 MHz
    DMT 0x10:  1024x768    60.003840 Hz   4:3     48.363 kHz     65.000000 MHz
  Standard Timings:
    DMT 0x33:  1600x1200   60.000000 Hz   4:3     75.000 kHz    162.000000 MHz
    DMT 0x23:  1280x1024   60.019740 Hz   5:4     63.981 kHz    108.000000 MHz
    DMT 0x20:  1280x960    60.000000 Hz   4:3     60.000 kHz    108.000000 MHz
  Detailed Timing Descriptors:
    DTD 1:  1920x1200   59.935239 Hz  16:10    72.642 kHz    154.000000 MHz (495 mm x 309 mm)
                 Hfront   64 Hsync  32 Hback  104 Hpol P
                 Vfront    3 Vsync   3 Vback    6 Vpol P
    DTD 2:  1600x1200   60.000000 Hz   4:3     75.000 kHz    162.000000 MHz (495 mm x 309 mm)
                 Hfront   64 Hsync 192 Hback  304 Hpol P
                 Vfront    1 Vsync   3 Vback   46 Vpol P
    Display Range Limits:
      Monitor ranges (GTF): 55-65 Hz V, 30-92 kHz H, max dotclock 170 MHz
    Display Product Name: 'SDM-P232W'
Checksum: 0x8c

----------------

Block 1, Unknown EDID Extension Block 0x00:
  00 ff ff ff ff ff ff 00 4d d9 d0 01 4f 84 75 00 '........M...O.u.'
  12 0d 01 03 80 32 1f 78 ea ce a9 a3 57 4c 99 26 '.....2.x....WL.&'
  19 48 4c a1 08 00 a9 40 81 80 81 40 01 01 01 01 '.HL....@...@....'
  01 01 01 01 01 01 28 3c 80 c8 70 b0 0c 40 40 20 '......(<..p..@@ '
  33 00 ef 35 11 00 00 1e 48 3f 40 30 62 b0 32 40 '3..5....H?@0b.2@'
  40 c0 13 00 ef 35 11 00 00 1e 00 00 00 fd 00 37 '@....5.........7'
  41 1e 5c 11 00 0a 20 20 20 20 20 20 00 00 00 fc 'A.\...      ....'
  00 53 44 4d 2d 50 32 33 32 57 0a 20 20 20 00 8c '.SDM-P232W.   ..'
Checksum: 0x8c

----------------

Failures:

Block 1, Base EDID:
  Unknown Extension Block.
EDID:
  Base EDID: Some timings are out of range of the Monitor Ranges:
    Vertical Freq: 59.935 - 70.082 Hz (Monitor: 55.000 - 65.000 Hz)
  Base EDID: EDID specified 0 extension block(s), but found 1 extension block(s).

EDID conformity: FAIL
