
EDID (hex):
00ffffffffffff001e6d68779ef20100
0a1f0104b5502178fd9c65a6534d9f25
0f5054210800d1c06140010101010101
01010101010148d570b0d0a046503020
3a00204e3100001a000000fd0030a0fa
fa5a010a202020202020000000fc004c
4720554c545241574944450a000000ff
003131304e54535533523634360a023b
02032e7223090707453f100403018301
0000e305c000e2006ae606050153532e
6d1a0000020530a00004532e532e7d7d
70b0d0a0295030203a00204e3100001a
00000000000000000000000000000000
00000000000000000000000000000000
00000000000000000000000000000000
0000000000000000000000000000009d
7012790000030128c43901066f0daf00
2f801f009f0566000200090004590186
6f0daf002f801f009f05560002000900
00000000000000000000000000000000
00000000000000000000000000000000
00000000000000000000000000000000
00000000000000000000000000000000
00000000000000000000000000005590

Extracted contents:
header:          00 ff ff ff ff ff ff 00
serial number:   1e 6d 68 77 9e f2 01 00 0a 1f
version:         01 04
basic params:    b5 50 21 78 fd
chroma info:     9c 65 a6 53 4d 9f 25 0f 50 54
established:     21 08 00
standard:        d1 c0 61 40 01 01 01 01 01 01 01 01 01 01 01 01
descriptor 1:    48 d5 70 b0 d0 a0 46 50 30 20 3a 00 20 4e 31 00 00 1a
descriptor 2:    00 00 00 fd 00 30 a0 fa fa 5a 01 0a 20 20 20 20 20 20
descriptor 3:    00 00 00 fc 00 4c 47 20 55 4c 54 52 41 57 49 44 45 0a
descriptor 4:    00 00 00 ff 00 31 31 30 4e 54 53 55 33 52 36 34 36 0a
extensions:      02
checksum:        3b

EDID version: 1.4
Manufacturer: GSM Model 7768 Serial Number --
Made in week 10 of 2021
Digital display
10 bits per primary color channel
DisplayPort interface
Maximum image size: 80 cm x 33 cm
Gamma: 2.20
DPMS levels: Standby Suspend Off
Supported color formats: RGB 4:4:4, YCrCb 4:4:4, YCrCb 4:2:2
Default (sRGB) color space is primary color space
Display is continuous frequency
Display x,y Chromaticity:
  Red:   0.6503, 0.3251
  Green: 0.3037, 0.6210
  Blue:  0.1455, 0.0605
  White: 0.3134, 0.3291
Established timings supported:
  640x480@60Hz 4:3 HorFreq: 31469 Hz Clock: 25.175 MHz
  800x600@60Hz 4:3 HorFreq: 37900 Hz Clock: 40.000 MHz
  1024x768@60Hz 4:3 HorFreq: 48400 Hz Clock: 65.000 MHz
Standard timings supported:
  1920x1080@60Hz 16:9
  1024x768@60Hz 4:3 HorFreq: 48400 Hz Clock: 65.000 MHz
Detailed mode: Clock 546.000 MHz, 800 mm x 334 mm
               3440 3488 3520 3616 hborder 0
               1440 1443 1453 1510 vborder 0
               +hsync -vsync 
               VertFreq: 99 Hz, HorFreq: 150995 Hz
Monitor ranges (bare limits): 48-160Hz V, 250-250kHz H, max dotclock 900MHz
Monitor name: LG ULTRAWIDE
Serial number: --
Has 2 extension blocks
Checksum: 0x3b (valid)

CTA extension block
Extension version: 3
42 bytes of CTA data
  Audio data block
    Linear PCM, max channels 2
      Supported sample rates (kHz): 48 44.1 32
      Supported sample sizes (bits): 24 20 16
  Video data block
    VIC  63 1920x1080@120Hz 16:9  HorFreq: 135000 Hz Clock: 297.000 MHz
    VIC  16 1920x1080@60Hz 16:9  HorFreq: 67500 Hz Clock: 148.500 MHz
    VIC   4 1280x720@60Hz 16:9  HorFreq: 45000 Hz Clock: 74.250 MHz
    VIC   3 720x480@60Hz 16:9  HorFreq: 31469 Hz Clock: 27.000 MHz
    VIC   1 640x480@60Hz 4:3  HorFreq: 31469 Hz Clock: 25.175 MHz
  Speaker allocation data block
    Speaker map:
      FL/FR - Front Left/Right
  Extended tag: Colorimetry data block
    BT2020YCC
    BT2020RGB
  Extended tag: Video capability data block
    YCbCr quantization: No Data (0)
    RGB quantization: Selectable (via AVI Q) (1)
    PT scan behaviour: Always Underscanned (2)
    IT scan behaviour: Always Underscanned (2)
    CE scan behaviour: Always Underscanned (2)
  Extended tag: HDR static metadata data block
    Electro optical transfer functions:
      Traditional gamma - SDR luminance range
      SMPTE ST2084
    Supported static metadata descriptors:
      Static metadata type 1
    Desired content max luminance: 83 (301.833 cd/m^2)
    Desired content max frame-average luminance: 83 (301.833 cd/m^2)
    Desired content min luminance: 46 (0.098 cd/m^2)
  Vendor-specific data block, OUI 00001a
Basic audio support
Supports YCbCr 4:4:4
Supports YCbCr 4:2:2
2 native detailed modes
Detailed mode: Clock 321.250 MHz, 800 mm x 334 mm
               3440 3488 3520 3616 hborder 0
               1440 1443 1453 1481 vborder 0
               +hsync -vsync 
               VertFreq: 59 Hz, HorFreq: 88841 Hz
Checksum: 0x9d (valid)


DisplayID extension block
Extension version: 18
Length 121, version 18, extension count 0
Checksum: 0x55 (valid)
Type 1 detailed timing: aspect: 64:27,  
Detailed mode: Clock 803.240 MHz, 0 mm x 0 mm
               3439 3486 3517 3614
               1439 1441 1450 1541
               +hsync -vsync
Type 1 detailed timing: aspect: 64:27, Preferred  
Detailed mode: Clock 883.240 MHz, 0 mm x 0 mm
               3439 3486 3517 3614
               1439 1441 1450 1525
               +hsync -vsync

EDID block does NOT conform to EDID 1.4!
	sRGB is signaled, but the chromaticities do not match
Warning: One or more of the timings is out of range of the Monitor Ranges:
  Vertical Freq: 59 - 120 Hz
  Horizontal Freq: 31469 - 150995 Hz
  Maximum Clock: 546.000 MHz
EDID block does not conform at all!
	Both the serial number and the serial string are set


