edid-decode (hex):

00 ff ff ff ff ff ff 00 0d ae a4 3e 00 00 00 00
0e 22 01 04 a5 22 16 78 02 ab c1 97 57 4f 7f 23
1c 50 52 00 00 00 01 01 01 01 01 01 01 01 01 01
01 01 01 01 01 01 41 3c 80 a0 70 b0 24 40 30 20
36 00 59 d7 10 00 00 1a 00 00 00 00 00 00 00 00
00 00 00 00 00 00 00 00 00 1a 00 00 00 00 00 00
00 00 00 00 00 00 00 00 00 00 00 00 00 00 00 fe
00 48 45 31 36 30 42 42 2d 30 32 41 0a 0a 00 1f

00 ff ff ff ff ff ff 00 0d ae a4 3e 00 00 00 00
0e 22 01 04 a5 22 16 78 02 ab c1 97 57 4f 7f 23
1c 50 52 00 00 00 01 01 01 01 01 01 01 01 01 01
01 01 01 01 01 01 41 3c 80 a0 70 b0 24 40 30 20
36 00 59 d7 10 00 00 1a 00 00 00 00 00 00 00 00
00 00 00 00 00 00 00 00 00 1a 00 00 00 00 00 00
00 00 00 00 00 00 00 00 00 00 00 00 00 00 00 fe
00 48 45 31 36 30 42 42 2d 30 32 41 0a 0a 00 1f

----------------

Block 0, Base EDID:
  EDID Structure Version & Revision: 1.4
  Vendor & Product Identification:
    Manufacturer: CMN
    Model: 16036
    Made in: week 14 of 2024
  Basic Display Parameters & Features:
    Digital display
    Bits per primary color channel: 8
    DisplayPort interface
    Maximum image size: 34 cm x 22 cm
    Gamma: 2.20
    Supported color formats: RGB 4:4:4
    First detailed timing includes the native pixel format and preferred refresh rate
  Color Characteristics:
    Red  : 0.5917, 0.3417
    Green: 0.3105, 0.4990
    Blue : 0.1396, 0.1093
    White: 0.3125, 0.3212
  Established Timings I & II: none
  Standard Timings: none
  Detailed Timing Descriptors:
    DTD 1:  1920x1200   59.998911 Hz  16:10    74.159 kHz    154.250000 MHz (345 mm x 215 mm)
                 Hfront   48 Hsync  32 Hback   80 Hpol P
                 Vfront    3 Vsync   6 Vback   27 Vpol N
    Manufacturer-Specified Display Descriptor (0x00): 00 00 00 00 00 00 00 00 00 00 00 00 00 00 00 1a '................'
    Empty Descriptor
    Alphanumeric Data String: 'HE160BB-02A'
Checksum: 0x1f

----------------

Block 1, Unknown EDID Extension Block 0x00:
  00 ff ff ff ff ff ff 00 0d ae a4 3e 00 00 00 00 '...........>....'
  0e 22 01 04 a5 22 16 78 02 ab c1 97 57 4f 7f 23 '."...".x....WO.#'
  1c 50 52 00 00 00 01 01 01 01 01 01 01 01 01 01 '.PR.............'
  01 01 01 01 01 01 41 3c 80 a0 70 b0 24 40 30 20 '......A<..p.$@0 '
  36 00 59 d7 10 00 00 1a 00 00 00 00 00 00 00 00 '6.Y.............'
  00 00 00 00 00 00 00 00 00 1a 00 00 00 00 00 00 '................'
  00 00 00 00 00 00 00 00 00 00 00 00 00 00 00 fe '................'
  00 48 45 31 36 30 42 42 2d 30 32 41 0a 0a 00 1f '.HE160BB-02A....'
Checksum: 0x1f

----------------

Warnings:

Block 0, Base EDID:
  Missing Display Product Name.

Failures:

Block 0, Base EDID:
  Empty Descriptor: Use Dummy Descriptor instead of all zeroes.
  Alphanumeric Data String: Non-space after newline.
Block 1, Base EDID:
  Unknown Extension Block.
EDID:
  Base EDID: EDID specified 0 extension block(s), but found 1 extension block(s).

EDID conformity: FAIL
