
EDID (hex):
00ffffffffffff005d34fa0000000000
28150103a53c2278226fb1a7554c9e25
0c505400000001010101010101010101
010101010101b06800a0a0402e603020
36009eae2100001a000000fc00445649
0a202020202020202020000000fc000a
202020202020202020202020000000fc
000a2020202020202020202020200169
ffffffffffffffffffffffffffffffff
ffffffffffffffffffffffffffffffff
ffffffffffffffffffffffffffffffff
ffffffffffffffffffffffffffffffff
ffffffffffffffffffffffffffffffff
ffffffffffffffffffffffffffffffff
ffffffffffffffffffffffffffffffff
ffffffffffffffffffffffffffffffff

edid-decode (hex):

00 ff ff ff ff ff ff 00 5d 34 fa 00 00 00 00 00
28 15 01 03 a5 3c 22 78 22 6f b1 a7 55 4c 9e 25
0c 50 54 00 00 00 01 01 01 01 01 01 01 01 01 01
01 01 01 01 01 01 b0 68 00 a0 a0 40 2e 60 30 20
36 00 9e ae 21 00 00 1a 00 00 00 fc 00 44 56 49
0a 20 20 20 20 20 20 20 20 20 00 00 00 fc 00 0a
20 20 20 20 20 20 20 20 20 20 20 20 00 00 00 fc
00 0a 20 20 20 20 20 20 20 20 20 20 20 20 01 69

ff ff ff ff ff ff ff ff ff ff ff ff ff ff ff ff
ff ff ff ff ff ff ff ff ff ff ff ff ff ff ff ff
ff ff ff ff ff ff ff ff ff ff ff ff ff ff ff ff
ff ff ff ff ff ff ff ff ff ff ff ff ff ff ff ff
ff ff ff ff ff ff ff ff ff ff ff ff ff ff ff ff
ff ff ff ff ff ff ff ff ff ff ff ff ff ff ff ff
ff ff ff ff ff ff ff ff ff ff ff ff ff ff ff ff
ff ff ff ff ff ff ff ff ff ff ff ff ff ff ff ff

----------------

Block 0, Base EDID:
  EDID Structure Version & Revision: 1.3
  Vendor & Product Identification:
    Manufacturer: WIT
    Model: 250
    Made in: week 40 of 2011
  Basic Display Parameters & Features:
    Digital display
    DFP 1.x compatible TMDS
    Maximum image size: 60 cm x 34 cm
    Gamma: 2.20
    DPMS levels: Off
    Monochrome or grayscale display
    First detailed timing is the preferred timing
  Color Characteristics:
    Red  : 0.6533, 0.3339
    Green: 0.2998, 0.6201
    Blue : 0.1464, 0.0498
    White: 0.3125, 0.3291
  Established Timings I & II: none
  Standard Timings: none
  Detailed Timing Descriptors:
    DTD 1:  2560x1600   59.859910 Hz  16:10    98.529 kHz    268.000000 MHz (670 mm x 430 mm)
                 Hfront   48 Hsync  32 Hback   80 Hpol P
                 Vfront    3 Vsync   6 Vback   37 Vpol N
    Display Product Name: 'DVI'
    Display Product Name: ''
    Display Product Name: ''
  Extension blocks: 1
Checksum: 0x69

----------------

Block 1, Manufacturer-Specific Extension Block:
  ff ff ff ff ff ff ff ff ff ff ff ff ff ff ff ff '................'
  ff ff ff ff ff ff ff ff ff ff ff ff ff ff ff ff '................'
  ff ff ff ff ff ff ff ff ff ff ff ff ff ff ff ff '................'
  ff ff ff ff ff ff ff ff ff ff ff ff ff ff ff ff '................'
  ff ff ff ff ff ff ff ff ff ff ff ff ff ff ff ff '................'
  ff ff ff ff ff ff ff ff ff ff ff ff ff ff ff ff '................'
  ff ff ff ff ff ff ff ff ff ff ff ff ff ff ff ff '................'
  ff ff ff ff ff ff ff ff ff ff ff ff ff ff ff ff '................'
Checksum: 0xff (should be 0x7f)
