
EDID (hex):
00ffffffffffff00410c510801010101
2b110103802f1e782e9345a3554a9827
155054bfef00b300a940950f950081c0
8140714f81807c2e90a0601a1e403020
3600b20e1100001c000000ff00435531
30373433303037353233000000fc0050
68696c697073203232305753000000fd
00384c1e5d11700a20323230575300cd

Extracted contents:
header:          00 ff ff ff ff ff ff 00
serial number:   41 0c 51 08 01 01 01 01 2b 11
version:         01 03
basic params:    80 2f 1e 78 2e
chroma info:     93 45 a3 55 4a 98 27 15 50 54
established:     bf ef 00
standard:        b3 00 a9 40 95 0f 95 00 81 c0 81 40 71 4f 81 80
descriptor 1:    7c 2e 90 a0 60 1a 1e 40 30 20 36 00 b2 0e 11 00 00 1c
descriptor 2:    00 00 00 ff 00 43 55 31 30 37 34 33 30 30 37 35 32 33
descriptor 3:    00 00 00 fc 00 50 68 69 6c 69 70 73 20 32 32 30 57 53
descriptor 4:    00 00 00 fd 00 38 4c 1e 5d 11 70 0a 20 32 32 30 57 53
extensions:      00
checksum:        cd

EDID version: 1.3
Manufacturer: PHL Model 851 Serial Number --
Made in week 43 of 2007
Digital display
Maximum image size: 47 cm x 30 cm
Gamma: 2.20
DPMS levels: Off
RGB color display
Default (sRGB) color space is primary color space
First detailed timing is preferred timing
Display x,y Chromaticity:
  Red:   0.6386, 0.3330
  Green: 0.2890, 0.5966
  Blue:  0.1533, 0.0820
  White: 0.3134, 0.3291
Established timings supported:
  720x400@70Hz 9:5 HorFreq: 31469 Hz Clock: 28.320 MHz
  640x480@60Hz 4:3 HorFreq: 31469 Hz Clock: 25.175 MHz
  640x480@67Hz 4:3 HorFreq: 35000 Hz Clock: 30.240 MHz
  640x480@72Hz 4:3 HorFreq: 37900 Hz Clock: 31.500 MHz
  640x480@75Hz 4:3 HorFreq: 37500 Hz Clock: 31.500 MHz
  800x600@56Hz 4:3 HorFreq: 35200 Hz Clock: 36.000 MHz
  800x600@60Hz 4:3 HorFreq: 37900 Hz Clock: 40.000 MHz
  800x600@72Hz 4:3 HorFreq: 48100 Hz Clock: 50.000 MHz
  800x600@75Hz 4:3 HorFreq: 46900 Hz Clock: 49.500 MHz
  832x624@75Hz 4:3 HorFreq: 49726 Hz Clock: 57.284 MHz
  1024x768@60Hz 4:3 HorFreq: 48400 Hz Clock: 65.000 MHz
  1024x768@70Hz 4:3 HorFreq: 56500 Hz Clock: 75.000 MHz
  1024x768@75Hz 4:3 HorFreq: 60000 Hz Clock: 78.750 MHz
  1280x1024@75Hz 5:4 HorFreq: 80000 Hz Clock: 135.000 MHz
Standard timings supported:
  1680x1050@60Hz 16:10 HorFreq: 64700 Hz Clock: 119.000 MHz
  1600x1200@60Hz 4:3 HorFreq: 75000 Hz Clock: 162.000 MHz
  1440x900@75Hz 16:10 HorFreq: 82300 Hz Clock: 156.000 MHz
  1440x900@60Hz 16:10 HorFreq: 55500 Hz Clock: 88.750 MHz
  1280x720@60Hz 16:9
  1280x960@60Hz 4:3 HorFreq: 60000 Hz Clock: 108.000 MHz
  1152x864@75Hz 4:3 HorFreq: 67500 Hz Clock: 108.000 MHz
  1280x1024@60Hz 5:4 HorFreq: 64000 Hz Clock: 108.000 MHz
Detailed mode: Clock 119.000 MHz, 434 mm x 270 mm
               1680 1728 1760 1840 hborder 0
               1050 1053 1059 1080 vborder 0
               -hsync +vsync 
               VertFreq: 59 Hz, HorFreq: 64673 Hz
Serial number: --
Monitor ranges (invalid): 56-76Hz V, 30-93kHz H, max dotclock 170MHz
Checksum: 0xcd (valid)
EDID block does NOT conform to EDID 1.3!
	sRGB is signaled, but the chromaticities do not match
	Name descriptor not terminated with a newline
EDID block does not conform at all!
	Detailed blocks filled with garbage
	Range descriptor contains garbage
