edid-decode (hex):

00 ff ff ff ff ff ff 00 0e d4 01 00 01 00 00 00
0d 13 01 03 08 22 13 78 2e 1e 95 a3 55 48 98 27
15 50 54 bf ee 00 71 4f 81 c0 01 01 01 01 01 01
01 01 01 01 01 01 83 21 56 b2 51 00 1b 30 40 70
36 00 00 00 00 00 00 18 34 21 50 b0 51 00 1b 30
40 70 36 00 20 56 00 00 00 1a 40 1f 00 90 51 00
1c 30 50 98 36 00 9a 00 11 00 00 1c 00 00 00 fc
00 42 31 35 36 57 30 31 0a 20 20 20 20 20 00 9c

----------------

Block 0, Base EDID:
  EDID Structure Version & Revision: 1.3
  Vendor & Product Identification:
    Manufacturer: CVT
    Model: 1
    Serial Number: ...
    Made in: week 13 of 2009
  Basic Display Parameters & Features:
    Analog display
    Input voltage level: 0.7/0.3 V
    Blank level equals black level
    Sync: Separate
    Maximum image size: 34 cm x 19 cm
    Gamma: 2.20
    DPMS levels: Off
    RGB color display
    Default (sRGB) color space is primary color space
    First detailed timing is the preferred timing
  Color Characteristics:
    Red  : 0.6367, 0.3330
    Green: 0.2841, 0.5957
    Blue : 0.1542, 0.0830
    White: 0.3134, 0.3291
  Established Timings I & II:
    IBM     :   720x400    70.081663 Hz   9:5     31.467 kHz     28.320000 MHz
    DMT 0x04:   640x480    59.940476 Hz   4:3     31.469 kHz     25.175000 MHz
    Apple   :   640x480    66.666667 Hz   4:3     35.000 kHz     30.240000 MHz
    DMT 0x05:   640x480    72.808802 Hz   4:3     37.861 kHz     31.500000 MHz
    DMT 0x06:   640x480    75.000000 Hz   4:3     37.500 kHz     31.500000 MHz
    DMT 0x08:   800x600    56.250000 Hz   4:3     35.156 kHz     36.000000 MHz
    DMT 0x09:   800x600    60.316541 Hz   4:3     37.879 kHz     40.000000 MHz
    DMT 0x0a:   800x600    72.187572 Hz   4:3     48.077 kHz     50.000000 MHz
    DMT 0x0b:   800x600    75.000000 Hz   4:3     46.875 kHz     49.500000 MHz
    Apple   :   832x624    74.551266 Hz   4:3     49.726 kHz     57.284000 MHz
    DMT 0x10:  1024x768    60.003840 Hz   4:3     48.363 kHz     65.000000 MHz
    DMT 0x11:  1024x768    70.069359 Hz   4:3     56.476 kHz     75.000000 MHz
    DMT 0x12:  1024x768    75.028582 Hz   4:3     60.023 kHz     78.750000 MHz
  Standard Timings:
    DMT 0x15:  1152x864    75.000000 Hz   4:3     67.500 kHz    108.000000 MHz
    DMT 0x55:  1280x720    60.000000 Hz  16:9     45.000 kHz     74.250000 MHz
  Detailed Timing Descriptors:
    DTD 1:  1366x768    59.951083 Hz 683:384   47.661 kHz     85.790000 MHz
                 Hfront   64 Hsync 112 Hback  258 Hpol N
                 Vfront    3 Vsync   6 Vback   18 Vpol N
    DTD 2:  1360x768    59.664196 Hz  85:48    47.433 kHz     85.000000 MHz (32 mm x 86 mm)
                 Hfront   64 Hsync 112 Hback  256 Hpol P
                 Vfront    3 Vsync   6 Vback   18 Vpol N
    DTD 3:  1280x768    59.822924 Hz   5:3     47.619 kHz     80.000000 MHz (410 mm x 256 mm)
                 Hfront   80 Hsync 152 Hback  168 Hpol N
                 Vfront    3 Vsync   6 Vback   19 Vpol P
    Display Product Name: 'B156W01'
Checksum: 0x9c

----------------

Failures:

Block 0, Base EDID:
  Basic Display Parameters & Features: sRGB is signaled, but the chromaticities do not match.
  Detailed Timing Descriptor #1: Mismatch of image size vs display size: image size is not set, but display size is.
  Detailed Timing Descriptor #2: Mismatch of image size 32x86 mm vs display size 340x190 mm.
  Detailed Timing Descriptor #3: Mismatch of image size 410x256 mm vs display size 340x190 mm.
  Missing Display Range Limits Descriptor.

EDID conformity: FAIL
