edid-decode (hex):

00 ff ff ff ff ff ff 00 0e d4 01 00 01 00 00 00
1d 10 01 03 08 00 00 00 8a 00 13 a0 57 49 9b 26
10 48 4e af cf 00 01 01 01 01 81 80 01 01 01 01
01 01 01 01 01 01 7c 2e 90 a0 60 1a 1e 40 50 20
56 04 9a 00 11 00 00 1c 00 00 00 fc 00 4c 4d 32
30 31 58 58 0a 0a 0a 0a 0a 0a 00 00 00 ff 00 52
6f 77 61 72 64 5f 30 36 30 37 31 38 00 00 00 10
00 0a 0a 0a 0a 0a 0a 0a 0a 0a 0a 0a 0a 0a 00 2c

----------------

Block 0, Base EDID:
  EDID Structure Version & Revision: 1.3
  Vendor & Product Identification:
    Manufacturer: CVT
    Model: 1
    Serial Number: ...
    Made in: week 29 of 2006
  Basic Display Parameters & Features:
    Analog display
    Input voltage level: 0.7/0.3 V
    Blank level equals black level
    Sync: Separate
    Image size is variable
    Gamma: 1.00
    DPMS levels: Standby
    RGB color display
    First detailed timing is the preferred timing
  Color Characteristics:
    Red  : 0.6250, 0.3398
    Green: 0.2851, 0.6054
    Blue : 0.1484, 0.0634
    White: 0.2812, 0.3076
  Established Timings I & II:
    IBM     :   720x400    70.082 Hz   9:5    31.467 kHz  28.320 MHz
    DMT 0x04:   640x480    59.940 Hz   4:3    31.469 kHz  25.175 MHz
    DMT 0x05:   640x480    72.809 Hz   4:3    37.861 kHz  31.500 MHz
    DMT 0x06:   640x480    75.000 Hz   4:3    37.500 kHz  31.500 MHz
    DMT 0x08:   800x600    56.250 Hz   4:3    35.156 kHz  36.000 MHz
    DMT 0x09:   800x600    60.317 Hz   4:3    37.879 kHz  40.000 MHz
    DMT 0x0a:   800x600    72.188 Hz   4:3    48.077 kHz  50.000 MHz
    DMT 0x0b:   800x600    75.000 Hz   4:3    46.875 kHz  49.500 MHz
    DMT 0x10:  1024x768    60.004 Hz   4:3    48.363 kHz  65.000 MHz
    DMT 0x11:  1024x768    70.069 Hz   4:3    56.476 kHz  75.000 MHz
    DMT 0x12:  1024x768    75.029 Hz   4:3    60.023 kHz  78.750 MHz
    DMT 0x24:  1280x1024   75.025 Hz   5:4    79.976 kHz 135.000 MHz
  Standard Timings:
    DMT 0x23:  1280x1024   60.020 Hz   5:4    63.981 kHz 108.000 MHz
  Detailed Timing Descriptors:
    DTD 1:  1680x1050   59.883 Hz   8:5    64.674 kHz 119.000 MHz (410 mm x 256 mm)
                 Hfront   80 Hsync  32 Hback  48 Hpol N
                 Vfront   21 Vsync   6 Vback   3 Vpol P
    Display Product Name: 'LM201XX'
    Display Product Serial Number: ...
    Dummy Descriptor:
Checksum: 0x2c

----------------

Failures:

Block 0, Base EDID:
  Detailed Timing Descriptor #1: Mismatch of image size vs display size: image size is set, but not display size.
  Display Product Name: Non-space after newline.
  Dummy Descriptor: Dummy block filled with garbage.
  Missing Display Range Limits Descriptor.

EDID conformity: FAIL
