
EDID (hex):
00ffffffffffff0010ac34f158593343
012001030e351e78ea15c5a75650a026
115054a54b00714f8180a9c0d1c00101
010101010101023a801871382d40582c
45000f282100001e000000ff0036354b
39544b330a2020202020000000fc0044
454c4c204532343232484e0a000000fd
00324b1e5311000a202020202020007c

Extracted contents:
header:          00 ff ff ff ff ff ff 00
serial number:   10 ac 34 f1 58 59 33 43 01 20
version:         01 03
basic params:    0e 35 1e 78 ea
chroma info:     15 c5 a7 56 50 a0 26 11 50 54
established:     a5 4b 00
standard:        71 4f 81 80 a9 c0 d1 c0 01 01 01 01 01 01 01 01
descriptor 1:    02 3a 80 18 71 38 2d 40 58 2c 45 00 0f 28 21 00 00 1e
descriptor 2:    00 00 00 ff 00 36 35 4b 39 54 4b 33 0a 20 20 20 20 20
descriptor 3:    00 00 00 fc 00 44 45 4c 4c 20 45 32 34 32 32 48 4e 0a
descriptor 4:    00 00 00 fd 00 32 4b 1e 53 11 00 0a 20 20 20 20 20 20
extensions:      00
checksum:        7c

EDID version: 1.3
Manufacturer: DEL Model f134 Serial Number --
Made in week 1 of 2022
Analog display, Input voltage level: 0.7/0.3 V
Sync: Separate Composite SyncOnGreen 
Maximum image size: 53 cm x 30 cm
Gamma: 2.20
DPMS levels: Standby Suspend Off
RGB color display
First detailed timing is preferred timing
Display x,y Chromaticity:
  Red:   0.6523, 0.3369
  Green: 0.3134, 0.6259
  Blue:  0.1513, 0.0664
  White: 0.3134, 0.3291
Established timings supported:
  720x400@70Hz 9:5 HorFreq: 31469 Hz Clock: 28.320 MHz
  640x480@60Hz 4:3 HorFreq: 31469 Hz Clock: 25.175 MHz
  640x480@75Hz 4:3 HorFreq: 37500 Hz Clock: 31.500 MHz
  800x600@60Hz 4:3 HorFreq: 37900 Hz Clock: 40.000 MHz
  800x600@75Hz 4:3 HorFreq: 46900 Hz Clock: 49.500 MHz
  1024x768@60Hz 4:3 HorFreq: 48400 Hz Clock: 65.000 MHz
  1024x768@75Hz 4:3 HorFreq: 60000 Hz Clock: 78.750 MHz
  1280x1024@75Hz 5:4 HorFreq: 80000 Hz Clock: 135.000 MHz
Standard timings supported:
  1152x864@75Hz 4:3 HorFreq: 67500 Hz Clock: 108.000 MHz
  1280x1024@60Hz 5:4 HorFreq: 64000 Hz Clock: 108.000 MHz
  1600x900@60Hz 16:9
  1920x1080@60Hz 16:9
Detailed mode: Clock 148.500 MHz, 527 mm x 296 mm
               1920 2008 2052 2200 hborder 0
               1080 1084 1089 1125 vborder 0
               +hsync +vsync 
               VertFreq: 60 Hz, HorFreq: 67500 Hz
Serial number: --
Monitor name: DELL E2422HN
Monitor ranges (GTF): 50-75Hz V, 30-83kHz H, max dotclock 170MHz
Checksum: 0x7c (valid)
