
EDID (hex):
00ffffffffffff0010ac6d424c524d41
1d200104b53c22783adf15ad5044ad25
0f5054a54b00d100d1c0b300a9408180
8100714fe1c04dd000a0f0703e803020
350055502100001a000000ff00355154
33584e330a2020202020000000fc0044
454c4c20553237323351450a000000fd
0017560f8c36010a2020202020200107
020322f14a101f200413121103020123
09070783010000e305c000e606050162
6238a36600a0f0701f80302035005550
2100001a565e00a0a0a0295030203500
55502100001a114400a080001f503020
360055502100001abf1600a080381340
30203a0055502100001a000000000000
00000000000000000000000000000008

Extracted contents:
header:          00 ff ff ff ff ff ff 00
serial number:   10 ac 6d 42 4c 52 4d 41 1d 20
version:         01 04
basic params:    b5 3c 22 78 3a
chroma info:     df 15 ad 50 44 ad 25 0f 50 54
established:     a5 4b 00
standard:        d1 00 d1 c0 b3 00 a9 40 81 80 81 00 71 4f e1 c0
descriptor 1:    4d d0 00 a0 f0 70 3e 80 30 20 35 00 55 50 21 00 00 1a
descriptor 2:    00 00 00 ff 00 35 51 54 33 58 4e 33 0a 20 20 20 20 20
descriptor 3:    00 00 00 fc 00 44 45 4c 4c 20 55 32 37 32 33 51 45 0a
descriptor 4:    00 00 00 fd 00 17 56 0f 8c 36 01 0a 20 20 20 20 20 20
extensions:      01
checksum:        07

EDID version: 1.4
Manufacturer: DEL Model 426d Serial Number --
Made in week 29 of 2022
Digital display
10 bits per primary color channel
DisplayPort interface
Maximum image size: 60 cm x 34 cm
Gamma: 2.20
DPMS levels: Off
Supported color formats: RGB 4:4:4, YCrCb 4:4:4, YCrCb 4:2:2
First detailed timing includes the native pixel format and preferred refresh rate
Display x,y Chromaticity:
  Red:   0.6787, 0.3134
  Green: 0.2685, 0.6787
  Blue:  0.1445, 0.0595
  White: 0.3134, 0.3291
Established timings supported:
  720x400@70Hz 9:5 HorFreq: 31469 Hz Clock: 28.320 MHz
  640x480@60Hz 4:3 HorFreq: 31469 Hz Clock: 25.175 MHz
  640x480@75Hz 4:3 HorFreq: 37500 Hz Clock: 31.500 MHz
  800x600@60Hz 4:3 HorFreq: 37900 Hz Clock: 40.000 MHz
  800x600@75Hz 4:3 HorFreq: 46900 Hz Clock: 49.500 MHz
  1024x768@60Hz 4:3 HorFreq: 48400 Hz Clock: 65.000 MHz
  1024x768@75Hz 4:3 HorFreq: 60000 Hz Clock: 78.750 MHz
  1280x1024@75Hz 5:4 HorFreq: 80000 Hz Clock: 135.000 MHz
Standard timings supported:
  1920x1200@60Hz 16:10 HorFreq: 74000 Hz Clock: 154.000 MHz
  1920x1080@60Hz 16:9
  1680x1050@60Hz 16:10 HorFreq: 64700 Hz Clock: 119.000 MHz
  1600x1200@60Hz 4:3 HorFreq: 75000 Hz Clock: 162.000 MHz
  1280x1024@60Hz 5:4 HorFreq: 64000 Hz Clock: 108.000 MHz
  1280x800@60Hz 16:10
  1152x864@75Hz 4:3 HorFreq: 67500 Hz Clock: 108.000 MHz
  2048x1152@60Hz 16:9
Detailed mode: Clock 533.250 MHz, 597 mm x 336 mm
               3840 3888 3920 4000 hborder 0
               2160 2163 2168 2222 vborder 0
               +hsync -vsync 
               VertFreq: 59 Hz, HorFreq: 133312 Hz
Serial number: --
Monitor name: DELL U2723QE
Monitor ranges (bare limits): 23-86Hz V, 15-140kHz H, max dotclock 540MHz
Has 1 extension blocks
Checksum: 0x7 (valid)

CTA extension block
Extension version: 3
30 bytes of CTA data
  Video data block
    VIC  16 1920x1080@60Hz 16:9  HorFreq: 67500 Hz Clock: 148.500 MHz
    VIC  31 1920x1080@50Hz 16:9  HorFreq: 56250 Hz Clock: 148.500 MHz
    VIC  32 1920x1080@24Hz 16:9  HorFreq: 27000 Hz Clock: 74.250 MHz
    VIC   4 1280x720@60Hz 16:9  HorFreq: 45000 Hz Clock: 74.250 MHz
    VIC  19 1280x720@50Hz 16:9  HorFreq: 37500 Hz Clock: 74.250 MHz
    VIC  18 720x576@50Hz 16:9  HorFreq: 31250 Hz Clock: 27.000 MHz
    VIC  17 720x576@50Hz 4:3  HorFreq: 31250 Hz Clock: 27.000 MHz
    VIC   3 720x480@60Hz 16:9  HorFreq: 31469 Hz Clock: 27.000 MHz
    VIC   2 720x480@60Hz 4:3  HorFreq: 31469 Hz Clock: 27.000 MHz
    VIC   1 640x480@60Hz 4:3  HorFreq: 31469 Hz Clock: 25.175 MHz
  Audio data block
    Linear PCM, max channels 2
      Supported sample rates (kHz): 48 44.1 32
      Supported sample sizes (bits): 24 20 16
  Speaker allocation data block
    Speaker map:
      FL/FR - Front Left/Right
  Extended tag: Colorimetry data block
    BT2020YCC
    BT2020RGB
  Extended tag: HDR static metadata data block
    Electro optical transfer functions:
      Traditional gamma - SDR luminance range
      SMPTE ST2084
    Supported static metadata descriptors:
      Static metadata type 1
    Desired content max luminance: 98 (417.710 cd/m^2)
    Desired content max frame-average luminance: 98 (417.710 cd/m^2)
    Desired content min luminance: 56 (0.201 cd/m^2)
Underscans PC formats by default
Basic audio support
Supports YCbCr 4:4:4
Supports YCbCr 4:2:2
1 native detailed modes
Detailed mode: Clock 262.750 MHz, 597 mm x 336 mm
               3840 3888 3920 4000 hborder 0
               2160 2163 2168 2191 vborder 0
               +hsync -vsync 
               VertFreq: 29 Hz, HorFreq: 65687 Hz
Detailed mode: Clock 241.500 MHz, 597 mm x 336 mm
               2560 2608 2640 2720 hborder 0
               1440 1443 1448 1481 vborder 0
               +hsync -vsync 
               VertFreq: 59 Hz, HorFreq: 88786 Hz
Detailed mode: Clock 174.250 MHz, 597 mm x 336 mm
               2048 2096 2128 2208 hborder 0
               1280 1283 1289 1311 vborder 0
               +hsync -vsync 
               VertFreq: 60 Hz, HorFreq: 78917 Hz
Detailed mode: Clock 58.230 MHz, 597 mm x 336 mm
               2048 2096 2128 2208 hborder 0
               1080 1083 1093 1099 vborder 0
               +hsync -vsync 
               VertFreq: 23 Hz, HorFreq: 26372 Hz
Checksum: 0x8 (valid)

EDID block does not conform at all!
	Both the serial number and the serial string are set


