
EDID (hex):
00ffffffffffff004c2d22003731424c
260f0103682018522abbb9a352469824
0f484ca4000031403159455961598180
010101010101ea240060410028303060
130038ea1000001e000000fd0032a01e
470b000a202020202020000000fc0053
796e634d61737465720a2020000000ff
0048394b593934303832300a2020001d

Extracted contents:
header:          00 ff ff ff ff ff ff 00
serial number:   4c 2d 22 00 37 31 42 4c 26 0f
version:         01 03
basic params:    68 20 18 52 2a
chroma info:     bb b9 a3 52 46 98 24 0f 48 4c
established:     a4 00 00
standard:        31 40 31 59 45 59 61 59 81 80 01 01 01 01 01 01
descriptor 1:    ea 24 00 60 41 00 28 30 30 60 13 00 38 ea 10 00 00 1e
descriptor 2:    00 00 00 fd 00 32 a0 1e 47 0b 00 0a 20 20 20 20 20 20
descriptor 3:    00 00 00 fc 00 53 79 6e 63 4d 61 73 74 65 72 0a 20 20
descriptor 4:    00 00 00 ff 00 48 39 4b 59 39 34 30 38 32 30 0a 20 20
extensions:      00
checksum:        1d

EDID version: 1.3
Manufacturer: SAM Model 22 Serial Number --
Analog display, Input voltage level: 0.7/0.7 V
Sync: Separate 
Maximum image size: 32 cm x 24 cm
Gamma: 1.82
DPMS levels: Off
RGB color display
First detailed timing is preferred timing
Display x,y Chromaticity:
  Red:   0.6386, 0.3232
  Green: 0.2753, 0.5966
  Blue:  0.1425, 0.0615
  White: 0.2832, 0.2978
Established timings supported:
  720x400@70Hz 9:5 HorFreq: 31469 Hz Clock: 28.320 MHz
  640x480@60Hz 4:3 HorFreq: 31469 Hz Clock: 25.175 MHz
  640x480@75Hz 4:3 HorFreq: 37500 Hz Clock: 31.500 MHz
Standard timings supported:
  640x480@60Hz 4:3 HorFreq: 31469 Hz Clock: 25.175 MHz
  640x480@85Hz 4:3 HorFreq: 43300 Hz Clock: 36.000 MHz
  800x600@85Hz 4:3 HorFreq: 53700 Hz Clock: 56.250 MHz
  1024x768@85Hz 4:3 HorFreq: 68700 Hz Clock: 94.500 MHz
  1280x1024@60Hz 5:4 HorFreq: 64000 Hz Clock: 108.000 MHz
Detailed mode: Clock 94.500 MHz, 312 mm x 234 mm
               1024 1072 1168 1376 hborder 0
                768  769  772  808 vborder 0
               +hsync +vsync 
               VertFreq: 84 Hz, HorFreq: 68677 Hz
Monitor ranges (GTF): 50-160Hz V, 30-71kHz H, max dotclock 110MHz
Monitor name: SyncMaster
Serial number: --
Checksum: 0x1d (valid)
EDID block does not conform at all!
	Bad year of manufacture
