edid-decode (hex):

00 ff ff ff ff ff ff 00 4d 79 38 02 01 00 00 00
22 22 01 03 08 35 1d 78 ea 14 15 ac 51 49 a3 25
10 50 54 a5 4b 00 71 4f 81 c0 81 00 81 80 a9 c0
b3 00 81 40 d1 c0 02 3a 80 18 71 38 2d 40 58 2c
45 00 0f 28 21 00 00 1e 31 44 80 a0 70 38 27 40
30 2c 45 00 00 00 00 00 00 1e 00 00 00 fd 00 30
4b 0f 63 13 00 0a 20 20 20 20 20 20 00 00 00 fc
00 32 33 38 44 41 32 33 46 2d 42 0a 20 20 00 60

00 ff ff ff ff ff ff 00 4d 79 38 02 01 00 00 00
22 22 01 03 08 35 1d 78 ea 14 15 ac 51 49 a3 25
10 50 54 a5 4b 00 71 4f 81 c0 81 00 81 80 a9 c0
b3 00 81 40 d1 c0 02 3a 80 18 71 38 2d 40 58 2c
45 00 0f 28 21 00 00 1e 31 44 80 a0 70 38 27 40
30 2c 45 00 00 00 00 00 00 1e 00 00 00 fd 00 30
4b 0f 63 13 00 0a 20 20 20 20 20 20 00 00 00 fc
00 32 33 38 44 41 32 33 46 2d 42 0a 20 20 00 60

----------------

Block 0, Base EDID:
  EDID Structure Version & Revision: 1.3
  Vendor & Product Identification:
    Manufacturer: SKY
    Model: 568
    Serial Number: ...
    Made in: week 34 of 2024
  Basic Display Parameters & Features:
    Analog display
    Signal Level Standard: 0.700 : 0.300 : 1.000 V p-p
    Blank level equals black level
    Sync: Separate
    Maximum image size: 53 cm x 29 cm
    Gamma: 2.20
    DPMS levels: Standby Suspend Off
    RGB color display
    First detailed timing is the preferred timing
  Color Characteristics:
    Red  : 0.6718, 0.3173
    Green: 0.2861, 0.6367
    Blue : 0.1445, 0.0634
    White: 0.3134, 0.3291
  Established Timings I & II:
    IBM     :   720x400    70.081663 Hz   9:5     31.467 kHz     28.320000 MHz
    DMT 0x04:   640x480    59.940476 Hz   4:3     31.469 kHz     25.175000 MHz
    DMT 0x06:   640x480    75.000000 Hz   4:3     37.500 kHz     31.500000 MHz
    DMT 0x09:   800x600    60.316541 Hz   4:3     37.879 kHz     40.000000 MHz
    DMT 0x0b:   800x600    75.000000 Hz   4:3     46.875 kHz     49.500000 MHz
    DMT 0x10:  1024x768    60.003840 Hz   4:3     48.363 kHz     65.000000 MHz
    DMT 0x12:  1024x768    75.028582 Hz   4:3     60.023 kHz     78.750000 MHz
    DMT 0x24:  1280x1024   75.024675 Hz   5:4     79.976 kHz    135.000000 MHz
  Standard Timings:
    DMT 0x15:  1152x864    75.000000 Hz   4:3     67.500 kHz    108.000000 MHz
    DMT 0x55:  1280x720    60.000000 Hz  16:9     45.000 kHz     74.250000 MHz
    DMT 0x1c:  1280x800    59.810326 Hz  16:10    49.702 kHz     83.500000 MHz
    DMT 0x23:  1280x1024   60.019740 Hz   5:4     63.981 kHz    108.000000 MHz
    DMT 0x53:  1600x900    60.000000 Hz  16:9     60.000 kHz    108.000000 MHz (RB)
    DMT 0x3a:  1680x1050   59.954250 Hz  16:10    65.290 kHz    146.250000 MHz
    DMT 0x20:  1280x960    60.000000 Hz   4:3     60.000 kHz    108.000000 MHz
    DMT 0x52:  1920x1080   60.000000 Hz  16:9     67.500 kHz    148.500000 MHz
  Detailed Timing Descriptors:
    DTD 1:  1920x1080   60.000000 Hz  16:9     67.500 kHz    148.500000 MHz (527 mm x 296 mm)
                 Hfront   88 Hsync  44 Hback  148 Hpol P
                 Vfront    4 Vsync   5 Vback   36 Vpol P
    DTD 2:  1920x1080   75.002578 Hz  16:9     83.928 kHz    174.570000 MHz
                 Hfront   48 Hsync  44 Hback   68 Hpol P
                 Vfront    4 Vsync   5 Vback   30 Vpol P
    Display Range Limits:
      Monitor ranges (GTF): 48-75 Hz V, 15-99 kHz H, max dotclock 190 MHz
    Display Product Name: '238DA23F-B'
Checksum: 0x60

----------------

Block 1, Unknown EDID Extension Block 0x00:
  00 ff ff ff ff ff ff 00 4d 79 38 02 01 00 00 00 '........My8.....'
  22 22 01 03 08 35 1d 78 ea 14 15 ac 51 49 a3 25 '""...5.x....QI.%'
  10 50 54 a5 4b 00 71 4f 81 c0 81 00 81 80 a9 c0 '.PT.K.qO........'
  b3 00 81 40 d1 c0 02 3a 80 18 71 38 2d 40 58 2c '...@...:..q8-@X,'
  45 00 0f 28 21 00 00 1e 31 44 80 a0 70 38 27 40 'E..(!...1D..p8'@'
  30 2c 45 00 00 00 00 00 00 1e 00 00 00 fd 00 30 '0,E............0'
  4b 0f 63 13 00 0a 20 20 20 20 20 20 00 00 00 fc 'K.c...      ....'
  00 32 33 38 44 41 32 33 46 2d 42 0a 20 20 00 60 '.238DA23F-B.  .`'
Checksum: 0x60

----------------

Failures:

Block 0, Base EDID:
  Detailed Timing Descriptor #2: Mismatch of image size vs display size: image size is not set, but display size is.
Block 1, Base EDID:
  Unknown Extension Block.
EDID:
  Base EDID: EDID specified 0 extension block(s), but found 1 extension block(s).

EDID conformity: FAIL
