edid-decode (hex):

00 ff ff ff ff ff ff 00 0e 14 b6 14 00 00 00 00
34 14 01 03 80 22 13 78 0a 4e 4d 9e 57 54 91 26
0f 50 54 00 00 00 01 01 01 01 01 01 01 01 01 01
01 01 01 01 01 01 aa 37 56 68 50 00 28 30 14 14
36 00 58 c1 10 00 00 18 04 33 56 68 50 00 28 30
14 14 36 00 58 c1 10 00 00 18 68 2e 56 68 50 00
28 30 14 14 36 00 58 c1 10 00 00 18 64 1b 56 54
50 00 26 30 3b 27 5a 00 58 c1 10 00 00 18 00 b0

----------------

Block 0, Base EDID:
  EDID Structure Version & Revision: 1.3
  Vendor & Product Identification:
    Manufacturer: CPT
    Model: 5302
    Made in: week 52 of 2010
  Basic Display Parameters & Features:
    Digital display
    Maximum image size: 34 cm x 19 cm
    Gamma: 2.20
    RGB color display
    First detailed timing is the preferred timing
  Color Characteristics:
    Red  : 0.6181, 0.3398
    Green: 0.3310, 0.5683
    Blue : 0.1494, 0.0585
    White: 0.3154, 0.3291
  Established Timings I & II: none
  Standard Timings: none
  Detailed Timing Descriptors:
    DTD 1:  1366x768   119.974 Hz 683:384  96.939 kHz 142.500 MHz (344 mm x 193 mm)
                 Hfront   20 Hsync  20 Hback  64 Hpol N
                 Vfront    3 Vsync   6 Vback  31 Vpol N
    DTD 2:  1366x768   109.955 Hz 683:384  88.844 kHz 130.600 MHz (344 mm x 193 mm)
                 Hfront   20 Hsync  20 Hback  64 Hpol N
                 Vfront    3 Vsync   6 Vback  31 Vpol N
    DTD 3:  1366x768   100.020 Hz 683:384  80.816 kHz 118.800 MHz (344 mm x 193 mm)
                 Hfront   20 Hsync  20 Hback  64 Hpol N
                 Vfront    3 Vsync   6 Vback  31 Vpol N
    DTD 4:  1366x768    59.998 Hz 683:384  48.359 kHz  70.120 MHz (344 mm x 193 mm)
                 Hfront   59 Hsync  39 Hback -14 Hpol N
                 Vfront    5 Vsync  10 Vback  23 Vpol N
Checksum: 0xb0

----------------

Failures:

Block 0, Base EDID:
  Detailed Timing Descriptor #4: 0 or negative horizontal back porch.
  Missing Display Product Name.
  Missing Display Range Limits Descriptor.

EDID conformity: FAIL
