edid-decode (hex):

00 ff ff ff ff ff ff 00 04 72 58 00 89 9a 10 01
0b 14 01 03 08 23 14 78 ea 55 45 a3 55 4a 97 27
15 50 54 b3 0c 00 61 46 81 40 81 c0 81 00 01 01
01 01 01 01 01 01 8a 21 56 b0 51 00 1b 30 48 90
13 00 58 c1 10 00 00 1c 00 00 00 fd 00 38 46 1f
39 09 00 0a 20 20 20 20 20 20 00 00 00 ff 00 4c
45 35 30 43 30 30 36 34 30 30 30 0a 00 00 00 fc
00 58 31 36 33 57 0a 20 20 20 20 20 20 20 00 0e

00 ff ff ff ff ff ff 00 04 72 58 00 89 9a 10 01
0b 14 01 03 08 23 14 78 ea 55 45 a3 55 4a 97 27
15 50 54 b3 0c 00 61 46 81 40 81 c0 81 00 01 01
01 01 01 01 01 01 8a 21 56 b0 51 00 1b 30 48 90
13 00 58 c1 10 00 00 1c 00 00 00 fd 00 38 46 1f
39 09 00 0a 20 20 20 20 20 20 00 00 00 ff 00 4c
45 35 30 43 30 30 36 34 30 30 30 0a 00 00 00 fc
00 58 31 36 33 57 0a 20 20 20 20 20 20 20 00 0e

----------------

Block 0, Base EDID:
  EDID Structure Version & Revision: 1.3
  Vendor & Product Identification:
    Manufacturer: ACR
    Model: 88
    Serial Number: ...
    Made in: week 11 of 2010
  Basic Display Parameters & Features:
    Analog display
    Signal Level Standard: 0.700 : 0.300 : 1.000 V p-p
    Blank level equals black level
    Sync: Separate
    Maximum image size: 35 cm x 20 cm
    Gamma: 2.20
    DPMS levels: Standby Suspend Off
    RGB color display
    First detailed timing is the preferred timing
  Color Characteristics:
    Red  : 0.6376, 0.3330
    Green: 0.2900, 0.5908
    Blue : 0.1533, 0.0820
    White: 0.3134, 0.3291
  Established Timings I & II:
    IBM     :   720x400    70.081663 Hz   9:5     31.467 kHz     28.320000 MHz
    DMT 0x04:   640x480    59.940476 Hz   4:3     31.469 kHz     25.175000 MHz
    Apple   :   640x480    66.666667 Hz   4:3     35.000 kHz     30.240000 MHz
    DMT 0x08:   800x600    56.250000 Hz   4:3     35.156 kHz     36.000000 MHz
    DMT 0x09:   800x600    60.316541 Hz   4:3     37.879 kHz     40.000000 MHz
    DMT 0x10:  1024x768    60.003840 Hz   4:3     48.363 kHz     65.000000 MHz
    DMT 0x11:  1024x768    70.069359 Hz   4:3     56.476 kHz     75.000000 MHz
  Standard Timings:
    GTF     :  1024x768    65.999558 Hz   4:3     52.668 kHz     71.628000 MHz
    DMT 0x20:  1280x960    60.000000 Hz   4:3     60.000 kHz    108.000000 MHz
    DMT 0x55:  1280x720    60.000000 Hz  16:9     45.000 kHz     74.250000 MHz
    DMT 0x1c:  1280x800    59.810326 Hz  16:10    49.702 kHz     83.500000 MHz
  Detailed Timing Descriptors:
    DTD 1:  1366x768    60.066741 Hz 683:384   47.753 kHz     85.860000 MHz (344 mm x 193 mm)
                 Hfront   72 Hsync 144 Hback  216 Hpol N
                 Vfront    1 Vsync   3 Vback   23 Vpol P
    Display Range Limits:
      Monitor ranges (GTF): 56-70 Hz V, 31-57 kHz H, max dotclock 90 MHz
    Display Product Serial Number: ...
    Display Product Name: 'X163W'
Checksum: 0x0e

----------------

Block 1, Unknown EDID Extension Block 0x00:
  00 ff ff ff ff ff ff 00 04 72 58 00 89 9a 10 01 '.........rX.....'
  0b 14 01 03 08 23 14 78 ea 55 45 a3 55 4a 97 27 '.....#.x.UE.UJ.''
  15 50 54 b3 0c 00 61 46 81 40 81 c0 81 00 01 01 '.PT...aF.@......'
  01 01 01 01 01 01 8a 21 56 b0 51 00 1b 30 48 90 '.......!V.Q..0H.'
  13 00 58 c1 10 00 00 1c 00 00 00 fd 00 38 46 1f '..X..........8F.'
  39 09 00 0a 20 20 20 20 20 20 00 00 00 ff 00 4c '9...      .....L'
  45 35 30 43 30 30 36 34 30 30 30 0a 00 00 00 fc 'E50C0064000.....'
  00 58 31 36 33 57 0a 20 20 20 20 20 20 20 00 0e '.X163W.       ..'
Checksum: 0x0e

----------------

Failures:

Block 1, Base EDID:
  Unknown Extension Block.
EDID:
  Base EDID: Some timings are out of range of the Monitor Ranges:
    Horizontal Freq: 31.466 - 60.000 kHz (Monitor: 31.000 - 57.000 kHz)
    Maximum Clock: 108.000 MHz (Monitor: 90.000 MHz)
  Base EDID: EDID specified 0 extension block(s), but found 1 extension block(s).

EDID conformity: FAIL
