
EDID (hex):
00ffffffffffff0010ac7e404c363531
14170103803c2278ea4bb5a7564ba325
0a5054a54b008100b300d100714fa940
8180d1c00101565e00a0a0a029503020
350055502100001a000000ff00474b30
4b443335443135364c0a000000fc0044
454c4c205532373133484d0a000000fd
0031561d711c000a20202020202000ef

Extracted contents:
header:          00 ff ff ff ff ff ff 00
serial number:   10 ac 7e 40 4c 36 35 31 14 17
version:         01 03
basic params:    80 3c 22 78 ea
chroma info:     4b b5 a7 56 4b a3 25 0a 50 54
established:     a5 4b 00
standard:        81 00 b3 00 d1 00 71 4f a9 40 81 80 d1 c0 01 01
descriptor 1:    56 5e 00 a0 a0 a0 29 50 30 20 35 00 55 50 21 00 00 1a
descriptor 2:    00 00 00 ff 00 47 4b 30 4b 44 33 35 44 31 35 36 4c 0a
descriptor 3:    00 00 00 fc 00 44 45 4c 4c 20 55 32 37 31 33 48 4d 0a
descriptor 4:    00 00 00 fd 00 31 56 1d 71 1c 00 0a 20 20 20 20 20 20
extensions:      00
checksum:        ef

EDID version: 1.3
Manufacturer: DEL Model 407e Serial Number --
Made in week 20 of 2013
Digital display
Maximum image size: 60 cm x 34 cm
Gamma: 2.20
DPMS levels: Standby Suspend Off
RGB color display
First detailed timing is preferred timing
Display x,y Chromaticity:
  Red:   0.6533, 0.3359
  Green: 0.2949, 0.6396
  Blue:  0.1464, 0.0419
  White: 0.3134, 0.3291
Established timings supported:
  720x400@70Hz 9:5 HorFreq: 31469 Hz Clock: 28.320 MHz
  640x480@60Hz 4:3 HorFreq: 31469 Hz Clock: 25.175 MHz
  640x480@75Hz 4:3 HorFreq: 37500 Hz Clock: 31.500 MHz
  800x600@60Hz 4:3 HorFreq: 37900 Hz Clock: 40.000 MHz
  800x600@75Hz 4:3 HorFreq: 46900 Hz Clock: 49.500 MHz
  1024x768@60Hz 4:3 HorFreq: 48400 Hz Clock: 65.000 MHz
  1024x768@75Hz 4:3 HorFreq: 60000 Hz Clock: 78.750 MHz
  1280x1024@75Hz 5:4 HorFreq: 80000 Hz Clock: 135.000 MHz
Standard timings supported:
  1280x800@60Hz 16:10
  1680x1050@60Hz 16:10 HorFreq: 64700 Hz Clock: 119.000 MHz
  1920x1200@60Hz 16:10 HorFreq: 74000 Hz Clock: 154.000 MHz
  1152x864@75Hz 4:3 HorFreq: 67500 Hz Clock: 108.000 MHz
  1600x1200@60Hz 4:3 HorFreq: 75000 Hz Clock: 162.000 MHz
  1280x1024@60Hz 5:4 HorFreq: 64000 Hz Clock: 108.000 MHz
  1920x1080@60Hz 16:9
Detailed mode: Clock 241.500 MHz, 597 mm x 336 mm
               2560 2608 2640 2720 hborder 0
               1440 1443 1448 1481 vborder 0
               +hsync -vsync 
               VertFreq: 59 Hz, HorFreq: 88786 Hz
Serial number: --
Monitor name: DELL U2713HM
Monitor ranges (GTF): 49-86Hz V, 29-113kHz H, max dotclock 280MHz
Checksum: 0xef (valid)
