
EDID (hex):
00ffffffffffff0010ac89404c373231
2c19010380431c78eeee95a3544c9926
0f5054a54b008100b300714f8180d1c0
0101010101017e4800e0a0381f404040
3a00a11c2100001a000000ff00355944
38433541513132374c0a000000fc0044
454c4c205532393133574d0a000000fd
0031561d5e13000a20202020202000dc

Extracted contents:
header:          00 ff ff ff ff ff ff 00
serial number:   10 ac 89 40 4c 37 32 31 2c 19
version:         01 03
basic params:    80 43 1c 78 ee
chroma info:     ee 95 a3 54 4c 99 26 0f 50 54
established:     a5 4b 00
standard:        81 00 b3 00 71 4f 81 80 d1 c0 01 01 01 01 01 01
descriptor 1:    7e 48 00 e0 a0 38 1f 40 40 40 3a 00 a1 1c 21 00 00 1a
descriptor 2:    00 00 00 ff 00 35 59 44 38 43 35 41 51 31 32 37 4c 0a
descriptor 3:    00 00 00 fc 00 44 45 4c 4c 20 55 32 39 31 33 57 4d 0a
descriptor 4:    00 00 00 fd 00 31 56 1d 5e 13 00 0a 20 20 20 20 20 20
extensions:      00
checksum:        dc

EDID version: 1.3
Manufacturer: DEL Model 4089 Serial Number --
Made in week 44 of 2015
Digital display
Maximum image size: 67 cm x 28 cm
Gamma: 2.20
DPMS levels: Standby Suspend Off
RGB color display
Default (sRGB) color space is primary color space
First detailed timing is preferred timing
Display x,y Chromaticity:
  Red:   0.6396, 0.3300
  Green: 0.2998, 0.5996
  Blue:  0.1503, 0.0595
  White: 0.3134, 0.3291
Established timings supported:
  720x400@70Hz 9:5 HorFreq: 31469 Hz Clock: 28.320 MHz
  640x480@60Hz 4:3 HorFreq: 31469 Hz Clock: 25.175 MHz
  640x480@75Hz 4:3 HorFreq: 37500 Hz Clock: 31.500 MHz
  800x600@60Hz 4:3 HorFreq: 37900 Hz Clock: 40.000 MHz
  800x600@75Hz 4:3 HorFreq: 46900 Hz Clock: 49.500 MHz
  1024x768@60Hz 4:3 HorFreq: 48400 Hz Clock: 65.000 MHz
  1024x768@75Hz 4:3 HorFreq: 60000 Hz Clock: 78.750 MHz
  1280x1024@75Hz 5:4 HorFreq: 80000 Hz Clock: 135.000 MHz
Standard timings supported:
  1280x800@60Hz 16:10
  1680x1050@60Hz 16:10 HorFreq: 64700 Hz Clock: 119.000 MHz
  1152x864@75Hz 4:3 HorFreq: 67500 Hz Clock: 108.000 MHz
  1280x1024@60Hz 5:4 HorFreq: 64000 Hz Clock: 108.000 MHz
  1920x1080@60Hz 16:9
Detailed mode: Clock 185.580 MHz, 673 mm x 284 mm
               2560 2624 2688 2784 hborder 0
               1080 1083 1093 1111 vborder 0
               +hsync -vsync 
               VertFreq: 59 Hz, HorFreq: 66659 Hz
Serial number: --
Monitor name: DELL U2913WM
Monitor ranges (GTF): 49-86Hz V, 29-94kHz H, max dotclock 190MHz
Checksum: 0xdc (valid)
EDID block does NOT conform to EDID 1.3!
	sRGB is signaled, but the chromaticities do not match
