
EDID (hex):
00ffffffffffff0010ac89404c353631
2217010380431c78eeee95a3544c9926
0f5054a54b008100b300714f8180d1c0
0101010101017e4800e0a0381f404040
3a00a11c2100001a000000ff00355944
384333384b3136354c0a000000fc0044
454c4c205532393133574d0a000000fd
0031561d5e13000a20202020202000f5

edid-decode (hex):

00 ff ff ff ff ff ff 00 10 ac 89 40 4c 35 36 31
22 17 01 03 80 43 1c 78 ee ee 95 a3 54 4c 99 26
0f 50 54 a5 4b 00 81 00 b3 00 71 4f 81 80 d1 c0
01 01 01 01 01 01 7e 48 00 e0 a0 38 1f 40 40 40
3a 00 a1 1c 21 00 00 1a 00 00 00 ff 00 35 59 44
38 43 33 38 4b 31 36 35 4c 0a 00 00 00 fc 00 44
45 4c 4c 20 55 32 39 31 33 57 4d 0a 00 00 00 fd
00 31 56 1d 5e 13 00 0a 20 20 20 20 20 20 00 f5

----------------

Block 0, Base EDID:
  EDID Structure Version & Revision: 1.3
  Vendor & Product Identification:
    Manufacturer: DEL
    Model: 16521
    Serial Number: 825636172
    Made in: week 34 of 2013
  Basic Display Parameters & Features:
    Digital display
    Maximum image size: 67 cm x 28 cm
    Gamma: 2.20
    DPMS levels: Standby Suspend Off
    RGB color display
    Default (sRGB) color space is primary color space
    First detailed timing is the preferred timing
  Color Characteristics:
    Red  : 0.6396, 0.3300
    Green: 0.2998, 0.5996
    Blue : 0.1503, 0.0595
    White: 0.3134, 0.3291
  Established Timings I & II:
    IBM     :   720x400    70.081663 Hz   9:5     31.467 kHz     28.320000 MHz
    DMT 0x04:   640x480    59.940476 Hz   4:3     31.469 kHz     25.175000 MHz
    DMT 0x06:   640x480    75.000000 Hz   4:3     37.500 kHz     31.500000 MHz
    DMT 0x09:   800x600    60.316541 Hz   4:3     37.879 kHz     40.000000 MHz
    DMT 0x0b:   800x600    75.000000 Hz   4:3     46.875 kHz     49.500000 MHz
    DMT 0x10:  1024x768    60.003840 Hz   4:3     48.363 kHz     65.000000 MHz
    DMT 0x12:  1024x768    75.028582 Hz   4:3     60.023 kHz     78.750000 MHz
    DMT 0x24:  1280x1024   75.024675 Hz   5:4     79.976 kHz    135.000000 MHz
  Standard Timings:
    DMT 0x1c:  1280x800    59.810326 Hz  16:10    49.702 kHz     83.500000 MHz
    DMT 0x3a:  1680x1050   59.954250 Hz  16:10    65.290 kHz    146.250000 MHz
    DMT 0x15:  1152x864    75.000000 Hz   4:3     67.500 kHz    108.000000 MHz
    DMT 0x23:  1280x1024   60.019740 Hz   5:4     63.981 kHz    108.000000 MHz
    DMT 0x52:  1920x1080   60.000000 Hz  16:9     67.500 kHz    148.500000 MHz
  Detailed Timing Descriptors:
    DTD 1:  2560x1080   59.999534 Hz  64:27    66.659 kHz    185.580000 MHz (673 mm x 284 mm)
                 Hfront   64 Hsync  64 Hback   96 Hpol P
                 Vfront    3 Vsync  10 Vback   18 Vpol N
    Display Product Serial Number: '5YD8C38K165L'
    Display Product Name: 'DELL U2913WM'
    Display Range Limits:
      Monitor ranges (GTF): 49-86 Hz V, 29-94 kHz H, max dotclock 190 MHz
Checksum: 0xf5
