
EDID (hex):
00ffffffffffff00158f0222c46b0000
151c010380301b782ad435a456519e27
0d5054a30800450081008180b3009500
310a81c00101023a801871382d40582c
4500dd0c1100001e662156aa51001e30
468f3300dd0c1100001e000000fc0045
4c4f204554323230324c0a20000000fd
00324b1e520f000a20202020202001c5
02031bf14890010203041f1113230907
078301000065030c001000023a801871
382d40582c4500dd0c1100001e662156
aa51001e30468f3300dd0c1100001e9a
29a0d05184223050983600dd0c110000
1c21399030621a274068b03600dd0c11
00001c00000000000000000000000000
00000000000000000000000000000088

Extracted contents:
header:          00 ff ff ff ff ff ff 00
serial number:   15 8f 02 22 c4 6b 00 00 15 1c
version:         01 03
basic params:    80 30 1b 78 2a
chroma info:     d4 35 a4 56 51 9e 27 0d 50 54
established:     a3 08 00
standard:        45 00 81 00 81 80 b3 00 95 00 31 0a 81 c0 01 01
descriptor 1:    02 3a 80 18 71 38 2d 40 58 2c 45 00 dd 0c 11 00 00 1e
descriptor 2:    66 21 56 aa 51 00 1e 30 46 8f 33 00 dd 0c 11 00 00 1e
descriptor 3:    00 00 00 fc 00 45 4c 4f 20 45 54 32 32 30 32 4c 0a 20
descriptor 4:    00 00 00 fd 00 32 4b 1e 52 0f 00 0a 20 20 20 20 20 20
extensions:      01
checksum:        c5

EDID version: 1.3
Manufacturer: ELO Model 2202 Serial Number --
Made in week 21 of 2018
Digital display
Maximum image size: 48 cm x 27 cm
Gamma: 2.20
DPMS levels: Off
RGB color display
First detailed timing is preferred timing
Display x,y Chromaticity:
  Red:   0.6435, 0.3369
  Green: 0.3173, 0.6171
  Blue:  0.1523, 0.0537
  White: 0.3134, 0.3291
Established timings supported:
  720x400@70Hz 9:5 HorFreq: 31469 Hz Clock: 28.320 MHz
  640x480@60Hz 4:3 HorFreq: 31469 Hz Clock: 25.175 MHz
  800x600@56Hz 4:3 HorFreq: 35200 Hz Clock: 36.000 MHz
  800x600@60Hz 4:3 HorFreq: 37900 Hz Clock: 40.000 MHz
  1024x768@60Hz 4:3 HorFreq: 48400 Hz Clock: 65.000 MHz
Standard timings supported:
  800x500@60Hz 16:10
  1280x800@60Hz 16:10
  1280x1024@60Hz 5:4 HorFreq: 64000 Hz Clock: 108.000 MHz
  1680x1050@60Hz 16:10 HorFreq: 64700 Hz Clock: 119.000 MHz
  1440x900@60Hz 16:10 HorFreq: 55500 Hz Clock: 88.750 MHz
  640x400@70Hz 16:10
  1280x720@60Hz 16:9
Detailed mode: Clock 148.500 MHz, 477 mm x 268 mm
               1920 2008 2052 2200 hborder 0
               1080 1084 1089 1125 vborder 0
               +hsync +vsync 
               VertFreq: 60 Hz, HorFreq: 67500 Hz
Detailed mode: Clock 85.500 MHz, 477 mm x 268 mm
               1366 1436 1579 1792 hborder 0
                768  771  774  798 vborder 0
               +hsync +vsync 
               VertFreq: 59 Hz, HorFreq: 47712 Hz
Monitor name: ELO ET2202L
Monitor ranges (GTF): 50-75Hz V, 30-82kHz H, max dotclock 150MHz
Has 1 extension blocks
Checksum: 0xc5 (valid)

CTA extension block
Extension version: 3
23 bytes of CTA data
  Video data block
    VIC  16 1920x1080@60Hz 16:9 (native) HorFreq: 67500 Hz Clock: 148.500 MHz
    VIC   1 640x480@60Hz 4:3  HorFreq: 31469 Hz Clock: 25.175 MHz
    VIC   2 720x480@60Hz 4:3  HorFreq: 31469 Hz Clock: 27.000 MHz
    VIC   3 720x480@60Hz 16:9  HorFreq: 31469 Hz Clock: 27.000 MHz
    VIC   4 1280x720@60Hz 16:9  HorFreq: 45000 Hz Clock: 74.250 MHz
    VIC  31 1920x1080@50Hz 16:9  HorFreq: 56250 Hz Clock: 148.500 MHz
    VIC  17 720x576@50Hz 4:3  HorFreq: 31250 Hz Clock: 27.000 MHz
    VIC  19 1280x720@50Hz 16:9  HorFreq: 37500 Hz Clock: 74.250 MHz
  Audio data block
    Linear PCM, max channels 2
      Supported sample rates (kHz): 48 44.1 32
      Supported sample sizes (bits): 24 20 16
  Speaker allocation data block
    Speaker map:
      FL/FR - Front Left/Right
  Vendor-specific data block, OUI 000c03 (HDMI)
    Source physical address 1.0.0.0
Underscans PC formats by default
Basic audio support
Supports YCbCr 4:4:4
Supports YCbCr 4:2:2
1 native detailed modes
Detailed mode: Clock 148.500 MHz, 477 mm x 268 mm
               1920 2008 2052 2200 hborder 0
               1080 1084 1089 1125 vborder 0
               +hsync +vsync 
               VertFreq: 60 Hz, HorFreq: 67500 Hz
Detailed mode: Clock 85.500 MHz, 477 mm x 268 mm
               1366 1436 1579 1792 hborder 0
                768  771  774  798 vborder 0
               +hsync +vsync 
               VertFreq: 59 Hz, HorFreq: 47712 Hz
Detailed mode: Clock 106.500 MHz, 477 mm x 268 mm
               1440 1520 1672 1904 hborder 0
                900  903  909  934 vborder 0
               -hsync +vsync 
               VertFreq: 59 Hz, HorFreq: 55934 Hz
Detailed mode: Clock 146.250 MHz, 477 mm x 268 mm
               1680 1784 1960 2240 hborder 0
               1050 1053 1059 1089 vborder 0
               -hsync +vsync 
               VertFreq: 59 Hz, HorFreq: 65290 Hz
Checksum: 0x88 (valid)



