edid-decode (hex):

00 ff ff ff ff ff ff 00 30 e4 83 02 00 00 00 00
00 14 01 03 90 26 16 78 0a f1 95 a3 55 52 a1 26
0f 50 54 00 00 00 01 01 01 01 01 01 01 01 01 01
01 01 01 01 01 01 84 3a 80 42 71 38 21 40 40 60
36 00 7f d7 10 00 00 19 00 00 00 00 00 00 00 00
00 00 00 00 00 00 00 00 00 00 00 00 00 fe 00 4c
47 20 44 69 73 70 6c 61 79 0a 20 20 00 00 00 fe
00 4c 50 31 37 33 57 46 31 2d 54 4c 42 35 00 b6

----------------

Block 0, Base EDID:
  EDID Structure Version & Revision: 1.3
  Vendor & Product Identification:
    Manufacturer: LGD
    Model: 643
    Made in: 2010
  Basic Display Parameters & Features:
    Digital display
    Maximum image size: 38 cm x 22 cm
    Gamma: 2.20
    RGB color display
    First detailed timing is preferred timing
  Color Characteristics:
    Red  : 0.6396, 0.3349
    Green: 0.3203, 0.6298
    Blue : 0.1503, 0.0595
    White: 0.3134, 0.3291
  Established Timings I & II: none
  Standard Timings: none
  Detailed Timing Descriptors:
    DTD 1:  1920x1080   60.032 Hz  16:9    66.815 kHz 149.800 MHz (383 mm x 215 mm)
                 Hfront   64 Hsync  96 Hback 162 Hpol N
                 Vfront    3 Vsync   6 Vback  24 Vpol N
    Empty Descriptor
    Alphanumeric Data String: 'LG Display'
    Alphanumeric Data String: 'LP173WF1-TLB5'
Checksum: 0xb6
