edid-decode (hex):

00 ff ff ff ff ff ff 00 4d d9 52 1a 01 01 01 01
34 0f 01 03 08 1e 17 78 6a 9d 9e 99 58 4c 93 26
21 4c 54 a1 08 00 01 01 01 01 01 01 01 01 01 01
01 01 01 01 01 01 64 19 00 40 41 00 26 30 18 88
36 00 30 e4 10 00 00 18 00 00 00 fd 00 3b 3d 1e
32 08 00 0a 20 20 20 20 20 20 00 00 00 fc 00 50
43 56 44 2d 31 35 58 41 31 0a 20 20 00 00 00 fe
00 0a 20 20 20 20 20 20 20 20 20 20 20 20 00 0a

00 ff ff ff ff ff ff 00 4d d9 52 1a 01 01 01 01
34 0f 01 03 08 1e 17 78 6a 9d 9e 99 58 4c 93 26
21 4c 54 a1 08 00 01 01 01 01 01 01 01 01 01 01
01 01 01 01 01 01 64 19 00 40 41 00 26 30 18 88
36 00 30 e4 10 00 00 18 00 00 00 fd 00 3b 3d 1e
32 08 00 0a 20 20 20 20 20 20 00 00 00 fc 00 50
43 56 44 2d 31 35 58 41 31 0a 20 20 00 00 00 fe
00 0a 20 20 20 20 20 20 20 20 20 20 20 20 00 0a

----------------

Block 0, Base EDID:
  EDID Structure Version & Revision: 1.3
  Vendor & Product Identification:
    Manufacturer: SNY
    Model: 6738
    Serial Number: ...
    Made in: week 52 of 2005
  Basic Display Parameters & Features:
    Analog display
    Signal Level Standard: 0.700 : 0.300 : 1.000 V p-p
    Blank level equals black level
    Sync: Separate
    Maximum image size: 30 cm x 23 cm
    Gamma: 2.20
    DPMS levels: Suspend Off
    RGB color display
    First detailed timing is the preferred timing
  Color Characteristics:
    Red  : 0.5996, 0.3447
    Green: 0.2998, 0.5751
    Blue : 0.1503, 0.1298
    White: 0.2998, 0.3300
  Established Timings I & II:
    IBM     :   720x400    70.081663 Hz   9:5     31.467 kHz     28.320000 MHz
    DMT 0x04:   640x480    59.940476 Hz   4:3     31.469 kHz     25.175000 MHz
    DMT 0x09:   800x600    60.316541 Hz   4:3     37.879 kHz     40.000000 MHz
    DMT 0x10:  1024x768    60.003840 Hz   4:3     48.363 kHz     65.000000 MHz
  Standard Timings: none
  Detailed Timing Descriptors:
    DTD 1:  1024x768    60.003840 Hz   4:3     48.363 kHz     65.000000 MHz (304 mm x 228 mm)
                 Hfront   24 Hsync 136 Hback  160 Hpol N
                 Vfront    3 Vsync   6 Vback   29 Vpol N
    Display Range Limits:
      Monitor ranges (GTF): 59-61 Hz V, 30-50 kHz H, max dotclock 80 MHz
    Display Product Name: 'PCVD-15XA1'
    Alphanumeric Data String: ''
Checksum: 0x0a

----------------

Block 1, Unknown EDID Extension Block 0x00:
  00 ff ff ff ff ff ff 00 4d d9 52 1a 01 01 01 01 '........M.R.....'
  34 0f 01 03 08 1e 17 78 6a 9d 9e 99 58 4c 93 26 '4......xj...XL.&'
  21 4c 54 a1 08 00 01 01 01 01 01 01 01 01 01 01 '!LT.............'
  01 01 01 01 01 01 64 19 00 40 41 00 26 30 18 88 '......d..@A.&0..'
  36 00 30 e4 10 00 00 18 00 00 00 fd 00 3b 3d 1e '6.0..........;=.'
  32 08 00 0a 20 20 20 20 20 20 00 00 00 fc 00 50 '2...      .....P'
  43 56 44 2d 31 35 58 41 31 0a 20 20 00 00 00 fe 'CVD-15XA1.  ....'
  00 0a 20 20 20 20 20 20 20 20 20 20 20 20 00 0a '..            ..'
Checksum: 0x0a

----------------

Failures:

Block 0, Base EDID:
  Alphanumeric Data String: Empty string.
Block 1, Base EDID:
  Unknown Extension Block.
EDID:
  Base EDID: Some timings are out of range of the Monitor Ranges:
    Vertical Freq: 59.940 - 70.082 Hz (Monitor: 59.000 - 61.000 Hz)
  Base EDID: EDID specified 0 extension block(s), but found 1 extension block(s).

EDID conformity: FAIL
