
EDID (hex):
00ffffffffffff0022f08e2801010101
1d14010380331d782e9085a358539f26
0f5054a1080081c0814081809500a940
b300d1c00101023a801871382d40582c
4500fe1f1100001e000000fd00324c18
5e11000a202020202020000000fc0048
502032333130650a20202020000000ff
00334351303239345331470a20200066

Extracted contents:
header:          00 ff ff ff ff ff ff 00
serial number:   22 f0 8e 28 01 01 01 01 1d 14
version:         01 03
basic params:    80 33 1d 78 2e
chroma info:     90 85 a3 58 53 9f 26 0f 50 54
established:     a1 08 00
standard:        81 c0 81 40 81 80 95 00 a9 40 b3 00 d1 c0 01 01
descriptor 1:    02 3a 80 18 71 38 2d 40 58 2c 45 00 fe 1f 11 00 00 1e
descriptor 2:    00 00 00 fd 00 32 4c 18 5e 11 00 0a 20 20 20 20 20 20
descriptor 3:    00 00 00 fc 00 48 50 20 32 33 31 30 65 0a 20 20 20 20
descriptor 4:    00 00 00 ff 00 33 43 51 30 32 39 34 53 31 47 0a 20 20
extensions:      00
checksum:        66

EDID version: 1.3
Manufacturer: HWP Model 288e Serial Number --
Made in week 29 of 2010
Digital display
Maximum image size: 51 cm x 29 cm
Gamma: 2.20
DPMS levels: Off
RGB color display
Default (sRGB) color space is primary color space
First detailed timing is preferred timing
Display x,y Chromaticity:
  Red:   0.6386, 0.3447
  Green: 0.3242, 0.6210
  Blue:  0.1503, 0.0585
  White: 0.3134, 0.3291
Established timings supported:
  720x400@70Hz 9:5 HorFreq: 31469 Hz Clock: 28.320 MHz
  640x480@60Hz 4:3 HorFreq: 31469 Hz Clock: 25.175 MHz
  800x600@60Hz 4:3 HorFreq: 37900 Hz Clock: 40.000 MHz
  1024x768@60Hz 4:3 HorFreq: 48400 Hz Clock: 65.000 MHz
Standard timings supported:
  1280x720@60Hz 16:9
  1280x960@60Hz 4:3 HorFreq: 60000 Hz Clock: 108.000 MHz
  1280x1024@60Hz 5:4 HorFreq: 64000 Hz Clock: 108.000 MHz
  1440x900@60Hz 16:10 HorFreq: 55500 Hz Clock: 88.750 MHz
  1600x1200@60Hz 4:3 HorFreq: 75000 Hz Clock: 162.000 MHz
  1680x1050@60Hz 16:10 HorFreq: 64700 Hz Clock: 119.000 MHz
  1920x1080@60Hz 16:9
Detailed mode: Clock 148.500 MHz, 510 mm x 287 mm
               1920 2008 2052 2200 hborder 0
               1080 1084 1089 1125 vborder 0
               +hsync +vsync 
               VertFreq: 60 Hz, HorFreq: 67500 Hz
Monitor ranges (GTF): 50-76Hz V, 24-94kHz H, max dotclock 170MHz
Monitor name: HP 2310e
Serial number: --
Checksum: 0x66 (valid)
EDID block does NOT conform to EDID 1.3!
	sRGB is signaled, but the chromaticities do not match


