edid-decode (hex):

00 ff ff ff ff ff ff 00 0d ae 53 15 00 00 00 00
0f 20 01 04 a5 22 13 78 02 28 65 97 59 54 8e 27
1e 50 54 00 00 00 01 01 01 01 01 01 01 01 01 01
01 01 01 01 01 01 36 36 80 a0 70 38 20 40 30 20
a6 00 58 c1 10 00 00 18 00 00 00 fe 00 4e 31 35
36 48 47 41 2d 45 41 33 0a 20 00 00 00 fe 00 43
4d 4e 0a 20 20 20 20 20 20 20 20 20 00 00 00 fe
00 4e 31 35 36 48 47 41 2d 45 41 33 0a 20 00 a2

00 ff ff ff ff ff ff 00 0d ae 53 15 00 00 00 00
0f 20 01 04 a5 22 13 78 02 28 65 97 59 54 8e 27
1e 50 54 00 00 00 01 01 01 01 01 01 01 01 01 01
01 01 01 01 01 01 36 36 80 a0 70 38 20 40 30 20
a6 00 58 c1 10 00 00 18 00 00 00 fe 00 4e 31 35
36 48 47 41 2d 45 41 33 0a 20 00 00 00 fe 00 43
4d 4e 0a 20 20 20 20 20 20 20 20 20 00 00 00 fe
00 4e 31 35 36 48 47 41 2d 45 41 33 0a 20 00 a2

----------------

Block 0, Base EDID:
  EDID Structure Version & Revision: 1.4
  Vendor & Product Identification:
    Manufacturer: CMN
    Model: 5459
    Made in: week 15 of 2022
  Basic Display Parameters & Features:
    Digital display
    Bits per primary color channel: 8
    DisplayPort interface
    Maximum image size: 34 cm x 19 cm
    Gamma: 2.20
    Supported color formats: RGB 4:4:4
    First detailed timing includes the native pixel format and preferred refresh rate
  Color Characteristics:
    Red  : 0.5898, 0.3496
    Green: 0.3300, 0.5546
    Blue : 0.1533, 0.1191
    White: 0.3134, 0.3291
  Established Timings I & II: none
  Standard Timings: none
  Detailed Timing Descriptors:
    DTD 1:  1920x1080   60.001038 Hz  16:9     66.721 kHz    138.780000 MHz (344 mm x 193 mm)
                 Hfront   48 Hsync  32 Hback   80 Hpol N
                 Vfront   10 Vsync   6 Vback   16 Vpol N
    Alphanumeric Data String: 'N156HGA-EA3'
    Alphanumeric Data String: 'CMN'
    Alphanumeric Data String: 'N156HGA-EA3'
Checksum: 0xa2

----------------

Block 1, Unknown EDID Extension Block 0x00:
  00 ff ff ff ff ff ff 00 0d ae 53 15 00 00 00 00 '..........S.....'
  0f 20 01 04 a5 22 13 78 02 28 65 97 59 54 8e 27 '. ...".x.(e.YT.''
  1e 50 54 00 00 00 01 01 01 01 01 01 01 01 01 01 '.PT.............'
  01 01 01 01 01 01 36 36 80 a0 70 38 20 40 30 20 '......66..p8 @0 '
  a6 00 58 c1 10 00 00 18 00 00 00 fe 00 4e 31 35 '..X..........N15'
  36 48 47 41 2d 45 41 33 0a 20 00 00 00 fe 00 43 '6HGA-EA3. .....C'
  4d 4e 0a 20 20 20 20 20 20 20 20 20 00 00 00 fe 'MN.         ....'
  00 4e 31 35 36 48 47 41 2d 45 41 33 0a 20 00 a2 '.N156HGA-EA3. ..'
Checksum: 0xa2

----------------

Warnings:

Block 0, Base EDID:
  Missing Display Product Name.

Failures:

Block 1, Base EDID:
  Unknown Extension Block.
EDID:
  Base EDID: EDID specified 0 extension block(s), but found 1 extension block(s).

EDID conformity: FAIL
