
EDID (hex):
00ffffffffffff004c6501036ec11100
2815010380341e780aee95a3544c9926
0f505421080081800101010101010101
010101010101023a801871382d40582c
45000a262100001e011d007251d01e20
6e2855000a262100001e000000fd003a
3e1e5011000a202020202020000000fc
0053434549204d4f4e49544f520a0170
02033bf050101f051404130302121107
061615200123090705830100007a030c
0010000021e815151515900c28103810
48105810e8100616e2006a011d801871
1c1620582c25000a262100009e011d80
d0721c1620102c25800a262100009e02
3a80d072382d40102c45800a26210000
1e00000000000000000000000000008c

Extracted contents:
header:          00 ff ff ff ff ff ff 00
serial number:   4c 65 01 03 6e c1 11 00 28 15
version:         01 03
basic params:    80 34 1e 78 0a
chroma info:     ee 95 a3 54 4c 99 26 0f 50 54
established:     21 08 00
standard:        81 80 01 01 01 01 01 01 01 01 01 01 01 01 01 01
descriptor 1:    02 3a 80 18 71 38 2d 40 58 2c 45 00 0a 26 21 00 00 1e
descriptor 2:    01 1d 00 72 51 d0 1e 20 6e 28 55 00 0a 26 21 00 00 1e
descriptor 3:    00 00 00 fd 00 3a 3e 1e 50 11 00 0a 20 20 20 20 20 20
descriptor 4:    00 00 00 fc 00 53 43 45 49 20 4d 4f 4e 49 54 4f 52 0a
extensions:      01
checksum:        70

EDID version: 1.3
Manufacturer: SCE Model 301 Serial Number --
Made in week 40 of 2011
Digital display
Maximum image size: 52 cm x 30 cm
Gamma: 2.20
RGB color display
First detailed timing is preferred timing
Display x,y Chromaticity:
  Red:   0.6396, 0.3300
  Green: 0.2998, 0.5996
  Blue:  0.1503, 0.0595
  White: 0.3134, 0.3291
Established timings supported:
  640x480@60Hz 4:3 HorFreq: 31469 Hz Clock: 25.175 MHz
  800x600@60Hz 4:3 HorFreq: 37900 Hz Clock: 40.000 MHz
  1024x768@60Hz 4:3 HorFreq: 48400 Hz Clock: 65.000 MHz
Standard timings supported:
  1280x1024@60Hz 5:4 HorFreq: 64000 Hz Clock: 108.000 MHz
Detailed mode: Clock 148.500 MHz, 522 mm x 294 mm
               1920 2008 2052 2200 hborder 0
               1080 1084 1089 1125 vborder 0
               +hsync +vsync 
               VertFreq: 60 Hz, HorFreq: 67500 Hz
Detailed mode: Clock 74.250 MHz, 522 mm x 294 mm
               1280 1390 1430 1650 hborder 0
                720  725  730  750 vborder 0
               +hsync +vsync 
               VertFreq: 60 Hz, HorFreq: 45000 Hz
Monitor ranges (GTF): 58-62Hz V, 30-80kHz H, max dotclock 170MHz
Monitor name: SCEI MONITOR
Has 1 extension blocks
Checksum: 0x70 (valid)

CTA extension block
Extension version: 3
55 bytes of CTA data
  Video data block
    VIC  16 1920x1080@60Hz 16:9  HorFreq: 67500 Hz Clock: 148.500 MHz
    VIC  31 1920x1080@50Hz 16:9  HorFreq: 56250 Hz Clock: 148.500 MHz
    VIC   5 1920x1080i@60Hz 16:9  HorFreq: 33750 Hz Clock: 74.250 MHz
    VIC  20 1920x1080i@50Hz 16:9  HorFreq: 28125 Hz Clock: 74.250 MHz
    VIC   4 1280x720@60Hz 16:9  HorFreq: 45000 Hz Clock: 74.250 MHz
    VIC  19 1280x720@50Hz 16:9  HorFreq: 37500 Hz Clock: 74.250 MHz
    VIC   3 720x480@60Hz 16:9  HorFreq: 31469 Hz Clock: 27.000 MHz
    VIC   2 720x480@60Hz 4:3  HorFreq: 31469 Hz Clock: 27.000 MHz
    VIC  18 720x576@50Hz 16:9  HorFreq: 31250 Hz Clock: 27.000 MHz
    VIC  17 720x576@50Hz 4:3  HorFreq: 31250 Hz Clock: 27.000 MHz
    VIC   7 1440x480i@60Hz 16:9  HorFreq: 15734 Hz Clock: 27.000 MHz
    VIC   6 1440x480i@60Hz 4:3  HorFreq: 15734 Hz Clock: 27.000 MHz
    VIC  22 1440x576i@50Hz 16:9  HorFreq: 15625 Hz Clock: 27.000 MHz
    VIC  21 1440x576i@50Hz 4:3  HorFreq: 15625 Hz Clock: 27.000 MHz
    VIC  32 1920x1080@24Hz 16:9  HorFreq: 27000 Hz Clock: 74.250 MHz
    VIC   1 640x480@60Hz 4:3  HorFreq: 31469 Hz Clock: 25.175 MHz
  Audio data block
    Linear PCM, max channels 2
      Supported sample rates (kHz): 48 44.1 32
      Supported sample sizes (bits): 24 16
  Speaker allocation data block
    Speaker map:
      FL/FR - Front Left/Right
  Vendor-specific data block, OUI 000c03 (HDMI)
    Source physical address 1.0.0.0
    Maximum TMDS clock: 165MHz
    Video latency: 21
    Audio latency: 21
    Interlaced video latency: 21
    Interlaced audio latency: 21
    Extended HDMI video details:
      3D present
      Base EDID image size is in units of 1cm
      VIC index 2 supports side-by-side (half, horizontal)
      VIC index 3 supports side-by-side (half, horizontal)
      VIC index 4 supports side-by-side (half, horizontal)
      VIC index 5 supports side-by-side (half, horizontal)
      VIC index 14 supports side-by-side (half, horizontal)
      VIC index 0 supports top-and-bottom
      VIC index 1 supports top-and-bottom
  Extended tag: Video capability data block
    YCbCr quantization: No Data (0)
    RGB quantization: Selectable (via AVI Q) (1)
    PT scan behaviour: Always Underscanned (2)
    IT scan behaviour: Always Underscanned (2)
    CE scan behaviour: Always Underscanned (2)
Underscans PC formats by default
Basic audio support
Supports YCbCr 4:4:4
Supports YCbCr 4:2:2
0 native detailed modes
Detailed mode: Clock 74.250 MHz, 522 mm x 294 mm
               1920 2008 2052 2200 hborder 0
                540  542  547  562 vborder 0
               +hsync +vsync interlaced 
               VertFreq: 60 Hz, HorFreq: 33750 Hz
Detailed mode: Clock 74.250 MHz, 522 mm x 294 mm
               1920 2448 2492 2640 hborder 0
                540  542  547  562 vborder 0
               +hsync +vsync interlaced 
               VertFreq: 50 Hz, HorFreq: 28125 Hz
Detailed mode: Clock 148.500 MHz, 522 mm x 294 mm
               1920 2448 2492 2640 hborder 0
               1080 1084 1089 1125 vborder 0
               +hsync +vsync 
               VertFreq: 50 Hz, HorFreq: 56250 Hz
Checksum: 0x8c (valid)

One or more of the timings is out of range of the Monitor Ranges:
  Vertical Freq: 24 - 60 Hz
  Horizontal Freq: 15625 - 67500 Hz
  Maximum Clock: 148.500 MHz


