edid-decode (hex):

00 ff ff ff ff ff ff 00 3b 10 60 34 84 0d 00 00
26 15 01 03 80 17 0d 78 0a 87 f5 94 57 4f 8c 27
27 50 54 00 00 00 01 01 01 01 01 01 01 01 01 01
01 01 01 01 01 01 3e 1c 56 a0 50 00 16 30 30 20
25 00 99 e6 10 00 00 19 00 00 00 0f 00 00 00 00
00 00 00 00 00 1b e8 04 5a 00 00 00 00 fe 00 4e
58 50 20 20 20 20 20 20 20 20 20 20 00 00 00 fe
00 41 49 4f 20 50 43 0a 20 20 20 20 20 20 00 f2

----------------

Block 0, Base EDID:
  EDID Structure Version & Revision: 1.3
  Vendor & Product Identification:
    Manufacturer: NXP
    Model: 13408
    Serial Number: ...
    Made in: week 38 of 2011
  Basic Display Parameters & Features:
    Digital display
    Maximum image size: 23 cm x 13 cm
    Gamma: 2.20
    RGB color display
    First detailed timing is the preferred timing
  Color Characteristics:
    Red  : 0.5800, 0.3398
    Green: 0.3095, 0.5498
    Blue : 0.1552, 0.1552
    White: 0.3134, 0.3291
  Established Timings I & II: none
  Standard Timings: none
  Detailed Timing Descriptors:
    DTD 1:  1366x768    59.973124 Hz 683:384   47.379 kHz     72.300000 MHz (409 mm x 230 mm)
                 Hfront   48 Hsync  32 Hback   80 Hpol N
                 Vfront    2 Vsync   5 Vback   15 Vpol N
    Manufacturer-Specified Display Descriptor (0x0f): 00 0f 00 00 00 00 00 00 00 00 00 1b e8 04 5a 00 '..............Z.'
    Alphanumeric Data String: 'NXP          '
    Alphanumeric Data String: 'AIO PC'
Checksum: 0xf2

----------------

Failures:

Block 0, Base EDID:
  Detailed Timing Descriptor #1: Mismatch of image size 409x230 mm vs display size 230x130 mm.
  Alphanumeric Data String: One or more trailing spaces.
  Missing Display Product Name.
  Missing Display Range Limits Descriptor.
EDID:
  Base EDID: The DTD max image size is 409x230mm, which is larger than the display size 230.0x130.0mm.

EDID conformity: FAIL
