edid-decode (hex):

00 ff ff ff ff ff ff 00 09 e5 b9 05 00 00 00 00
01 16 01 03 80 16 0d 78 0a ab d0 93 57 56 9b 29
21 50 54 00 00 00 01 01 01 01 01 01 01 01 01 01
01 01 01 01 01 01 00 14 00 40 41 58 23 20 30 70
cc 00 df 7d 00 00 00 1a 00 14 00 40 41 58 23 20
30 70 cc 00 df 7d 00 00 00 1a 00 00 00 fe 00 42
4f 45 20 48 46 0a 20 20 20 20 20 20 00 00 00 fe
00 42 41 31 30 31 57 53 31 2d 31 30 30 0a 00 a0

----------------

Block 0, Base EDID:
  EDID Structure Version & Revision: 1.3
  Vendor & Product Identification:
    Manufacturer: BOE
    Model: 1465
    Made in: week 1 of 2012
  Basic Display Parameters & Features:
    Digital display
    Maximum image size: 22 cm x 13 cm
    Gamma: 2.20
    RGB color display
    First detailed timing is preferred timing
  Color Characteristics:
    Red  : 0.5761, 0.3417
    Green: 0.3378, 0.6083
    Blue : 0.1630, 0.1298
    White: 0.3125, 0.3281
  Established Timings I & II: none
  Standard Timings: none
  Detailed Timing Descriptors:
    DTD 1:  1024x600    59.993 Hz 128:75   38.095 kHz  51.200 MHz (223 mm x 125 mm)
                 Hfront   48 Hsync 112 Hback 160 Hpol P
                 Vfront   12 Vsync  12 Vback  11 Vpol N
    DTD 2:  1024x600    59.993 Hz 128:75   38.095 kHz  51.200 MHz (223 mm x 125 mm)
                 Hfront   48 Hsync 112 Hback 160 Hpol P
                 Vfront   12 Vsync  12 Vback  11 Vpol N
    Alphanumeric Data String: 'BOE HF'
    Alphanumeric Data String: 'BA101WS1-100'
Checksum: 0xa0
