
EDID (hex):
00ffffffffffff000469b22701010101
2a170103803c2278ea1df5ae4f35b325
0d5054bfef00714f818081409500a940
b300d1c0d100565e00a0a0a029503020
350055502100001a000000fd0031561d
711c000a202020202020000000fc0050
413237390a20202020202020000000ff
0044414c4d51533036353038350a0021

Extracted contents:
header:          00 ff ff ff ff ff ff 00
serial number:   04 69 b2 27 01 01 01 01 2a 17
version:         01 03
basic params:    80 3c 22 78 ea
chroma info:     1d f5 ae 4f 35 b3 25 0d 50 54
established:     bf ef 00
standard:        71 4f 81 80 81 40 95 00 a9 40 b3 00 d1 c0 d1 00
descriptor 1:    56 5e 00 a0 a0 a0 29 50 30 20 35 00 55 50 21 00 00 1a
descriptor 2:    00 00 00 fd 00 31 56 1d 71 1c 00 0a 20 20 20 20 20 20
descriptor 3:    00 00 00 fc 00 50 41 32 37 39 0a 20 20 20 20 20 20 20
descriptor 4:    00 00 00 ff 00 44 41 4c 4d 51 53 30 36 35 30 38 35 0a
extensions:      00
checksum:        21

EDID version: 1.3
Manufacturer: ACI Model 27b2 Serial Number --
Made in week 42 of 2013
Digital display
Maximum image size: 60 cm x 34 cm
Gamma: 2.20
DPMS levels: Standby Suspend Off
RGB color display
First detailed timing is preferred timing
Display x,y Chromaticity:
  Red:   0.6796, 0.3095
  Green: 0.2099, 0.7001
  Blue:  0.1474, 0.0537
  White: 0.3134, 0.3291
Established timings supported:
  720x400@70Hz 9:5 HorFreq: 31469 Hz Clock: 28.320 MHz
  640x480@60Hz 4:3 HorFreq: 31469 Hz Clock: 25.175 MHz
  640x480@67Hz 4:3 HorFreq: 35000 Hz Clock: 30.240 MHz
  640x480@72Hz 4:3 HorFreq: 37900 Hz Clock: 31.500 MHz
  640x480@75Hz 4:3 HorFreq: 37500 Hz Clock: 31.500 MHz
  800x600@56Hz 4:3 HorFreq: 35200 Hz Clock: 36.000 MHz
  800x600@60Hz 4:3 HorFreq: 37900 Hz Clock: 40.000 MHz
  800x600@72Hz 4:3 HorFreq: 48100 Hz Clock: 50.000 MHz
  800x600@75Hz 4:3 HorFreq: 46900 Hz Clock: 49.500 MHz
  832x624@75Hz 4:3 HorFreq: 49726 Hz Clock: 57.284 MHz
  1024x768@60Hz 4:3 HorFreq: 48400 Hz Clock: 65.000 MHz
  1024x768@70Hz 4:3 HorFreq: 56500 Hz Clock: 75.000 MHz
  1024x768@75Hz 4:3 HorFreq: 60000 Hz Clock: 78.750 MHz
  1280x1024@75Hz 5:4 HorFreq: 80000 Hz Clock: 135.000 MHz
Standard timings supported:
  1152x864@75Hz 4:3 HorFreq: 67500 Hz Clock: 108.000 MHz
  1280x1024@60Hz 5:4 HorFreq: 64000 Hz Clock: 108.000 MHz
  1280x960@60Hz 4:3 HorFreq: 60000 Hz Clock: 108.000 MHz
  1440x900@60Hz 16:10 HorFreq: 55500 Hz Clock: 88.750 MHz
  1600x1200@60Hz 4:3 HorFreq: 75000 Hz Clock: 162.000 MHz
  1680x1050@60Hz 16:10 HorFreq: 64700 Hz Clock: 119.000 MHz
  1920x1080@60Hz 16:9
  1920x1200@60Hz 16:10 HorFreq: 74000 Hz Clock: 154.000 MHz
Detailed mode: Clock 241.500 MHz, 597 mm x 336 mm
               2560 2608 2640 2720 hborder 0
               1440 1443 1448 1481 vborder 0
               +hsync -vsync 
               VertFreq: 59 Hz, HorFreq: 88786 Hz
Monitor ranges (GTF): 49-86Hz V, 29-113kHz H, max dotclock 280MHz
Monitor name: PA279
Serial number: --
Checksum: 0x21 (valid)
