
EDID (hex):
00ffffffffffff0066abf44054513030
2c1d0104b51d11783aef65a656529d28
0b5054000800d1c0818081c001010101
010101010101333680a070381f403020
350025a51000001e000000ff00385233
333932364f3030510a20000000fc004e
6578446f636b0a2020202020000000fd
0038411e530f010a2020202020200103
020326f245101f4a212023097f078301
000065030c001000e305c000e6060501
626200e200c0333680a070381f403020
350025a51000001e0000000000000000
00000000000000000000000000000000
00000000000000000000000000000000
00000000000000000000000000000000
0000000000000000000000000000001d

Extracted contents:
header:          00 ff ff ff ff ff ff 00
serial number:   66 ab f4 40 54 51 30 30 2c 1d
version:         01 04
basic params:    b5 1d 11 78 3a
chroma info:     ef 65 a6 56 52 9d 28 0b 50 54
established:     00 08 00
standard:        d1 c0 81 80 81 c0 01 01 01 01 01 01 01 01 01 01
descriptor 1:    33 36 80 a0 70 38 1f 40 30 20 35 00 25 a5 10 00 00 1e
descriptor 2:    00 00 00 ff 00 38 52 33 33 39 32 36 4f 30 30 51 0a 20
descriptor 3:    00 00 00 fc 00 4e 65 78 44 6f 63 6b 0a 20 20 20 20 20
descriptor 4:    00 00 00 fd 00 38 41 1e 53 0f 01 0a 20 20 20 20 20 20
extensions:      01
checksum:        03

EDID version: 1.4
Manufacturer: YUK Model 40f4 Serial Number --
Made in week 44 of 2019
Digital display
10 bits per primary color channel
DisplayPort interface
Maximum image size: 29 cm x 17 cm
Gamma: 2.20
DPMS levels: Off
Supported color formats: RGB 4:4:4, YCrCb 4:4:4, YCrCb 4:2:2
First detailed timing includes the native pixel format and preferred refresh rate
Display x,y Chromaticity:
  Red:   0.6513, 0.3378
  Green: 0.3232, 0.6162
  Blue:  0.1572, 0.0449
  White: 0.3134, 0.3291
Established timings supported:
  1024x768@60Hz 4:3 HorFreq: 48400 Hz Clock: 65.000 MHz
Standard timings supported:
  1920x1080@60Hz 16:9
  1280x1024@60Hz 5:4 HorFreq: 64000 Hz Clock: 108.000 MHz
  1280x720@60Hz 16:9
Detailed mode: Clock 138.750 MHz, 293 mm x 165 mm
               1920 1968 2000 2080 hborder 0
               1080 1083 1088 1111 vborder 0
               +hsync +vsync 
               VertFreq: 60 Hz, HorFreq: 66706 Hz
Serial number: --
Monitor name: NexDock
Monitor ranges (bare limits): 56-65Hz V, 30-83kHz H, max dotclock 150MHz
Has 1 extension blocks
Checksum: 0x3 (valid)

CTA extension block
Extension version: 3
34 bytes of CTA data
  Video data block
    VIC  16 1920x1080@60Hz 16:9  HorFreq: 67500 Hz Clock: 148.500 MHz
    VIC  31 1920x1080@50Hz 16:9  HorFreq: 56250 Hz Clock: 148.500 MHz
    VIC  74 1920x1080@30Hz 64:27  HorFreq: 33750 Hz Clock: 74.250 MHz
    VIC  33 1920x1080@25Hz 16:9  HorFreq: 28125 Hz Clock: 74.250 MHz
    VIC  32 1920x1080@24Hz 16:9  HorFreq: 27000 Hz Clock: 74.250 MHz
  Audio data block
    Linear PCM, max channels 2
      Supported sample rates (kHz): 192 176.4 96 88.2 48 44.1 32
      Supported sample sizes (bits): 24 20 16
  Speaker allocation data block
    Speaker map:
      FL/FR - Front Left/Right
  Vendor-specific data block, OUI 000c03 (HDMI)
    Source physical address 1.0.0.0
  Extended tag: Colorimetry data block
    BT2020YCC
    BT2020RGB
  Extended tag: HDR static metadata data block
    Electro optical transfer functions:
      Traditional gamma - SDR luminance range
      SMPTE ST2084
    Supported static metadata descriptors:
      Static metadata type 1
    Desired content max luminance: 98 (417.710 cd/m^2)
    Desired content max frame-average luminance: 98 (417.710 cd/m^2)
    Desired content min luminance: 0 (0.000 cd/m^2)
  Extended tag: Video capability data block
    YCbCr quantization: Selectable (via AVI YQ) (1)
    RGB quantization: Selectable (via AVI Q) (1)
    PT scan behaviour: No Data (0)
    IT scan behaviour: IT video formats not supported (0)
    CE scan behaviour: CE video formats not supported (0)
Underscans PC formats by default
Basic audio support
Supports YCbCr 4:4:4
Supports YCbCr 4:2:2
2 native detailed modes
Detailed mode: Clock 138.750 MHz, 293 mm x 165 mm
               1920 1968 2000 2080 hborder 0
               1080 1083 1088 1111 vborder 0
               +hsync +vsync 
               VertFreq: 60 Hz, HorFreq: 66706 Hz
Checksum: 0x1d (valid)

EDID block does NOT conform to EDID 1.4!
	Required 640x480p60 timings are missing in the established timings
	and/or in the SVD list (VIC 1)
Warning: One or more of the timings is out of range of the Monitor Ranges:
  Vertical Freq: 24 - 60 Hz
  Horizontal Freq: 27000 - 67500 Hz
  Maximum Clock: 148.500 MHz
EDID block does not conform at all!
	Both the serial number and the serial string are set


