edid-decode (hex):

00 ff ff ff ff ff ff 00 22 70 b1 18 01 01 01 01
20 14 01 03 0a 2c 19 78 ea b8 15 a6 55 4b 9b 25
13 50 54 bf ee 80 a9 c0 95 00 90 40 81 80 81 40
81 c0 71 4f 61 46 30 2a 40 c8 60 84 64 30 18 50
13 00 bb f9 10 00 00 1e 00 00 00 fc 00 48 46 32
30 35 0a 20 20 20 20 20 20 20 00 00 00 fd 00 38
4c 18 53 10 00 0a 20 20 20 20 20 20 00 00 00 ff
00 30 33 32 58 4a 33 4c 59 30 32 34 32 37 00 ba

----------------

Block 0, Base EDID:
  EDID Structure Version & Revision: 1.3
  Vendor & Product Identification:
    Manufacturer: HSP
    Model: 6321
    Serial Number: ...
    Made in: week 32 of 2010
  Basic Display Parameters & Features:
    Analog display
    Input voltage level: 0.7/0.3 V
    Blank level equals black level
    Sync: Separate SyncOnGreen
    Maximum image size: 44 cm x 25 cm
    Gamma: 2.20
    DPMS levels: Standby Suspend Off
    RGB color display
    First detailed timing is the preferred timing
  Color Characteristics:
    Red  : 0.6503, 0.3349
    Green: 0.2949, 0.6054
    Blue : 0.1445, 0.0751
    White: 0.3134, 0.3291
  Established Timings I & II:
    IBM     :   720x400    70.082 Hz   9:5    31.467 kHz  28.320 MHz
    DMT 0x04:   640x480    59.940 Hz   4:3    31.469 kHz  25.175 MHz
    Apple   :   640x480    66.667 Hz   4:3    35.000 kHz  30.240 MHz
    DMT 0x05:   640x480    72.809 Hz   4:3    37.861 kHz  31.500 MHz
    DMT 0x06:   640x480    75.000 Hz   4:3    37.500 kHz  31.500 MHz
    DMT 0x08:   800x600    56.250 Hz   4:3    35.156 kHz  36.000 MHz
    DMT 0x09:   800x600    60.317 Hz   4:3    37.879 kHz  40.000 MHz
    DMT 0x0a:   800x600    72.188 Hz   4:3    48.077 kHz  50.000 MHz
    DMT 0x0b:   800x600    75.000 Hz   4:3    46.875 kHz  49.500 MHz
    Apple   :   832x624    74.551 Hz   4:3    49.726 kHz  57.284 MHz
    DMT 0x10:  1024x768    60.004 Hz   4:3    48.363 kHz  65.000 MHz
    DMT 0x11:  1024x768    70.069 Hz   4:3    56.476 kHz  75.000 MHz
    DMT 0x12:  1024x768    75.029 Hz   4:3    60.023 kHz  78.750 MHz
    Apple   :  1152x870    75.062 Hz 192:145  68.681 kHz 100.000 MHz
  Standard Timings:
    DMT 0x53:  1600x900    60.000 Hz  16:9    60.000 kHz 108.000 MHz (RB)
    DMT 0x2f:  1440x900    59.887 Hz  16:10   55.935 kHz 106.500 MHz
    DMT 0x2a:  1400x1050   59.978 Hz   4:3    65.317 kHz 121.750 MHz
    DMT 0x23:  1280x1024   60.020 Hz   5:4    63.981 kHz 108.000 MHz
    DMT 0x20:  1280x960    60.000 Hz   4:3    60.000 kHz 108.000 MHz
    DMT 0x55:  1280x720    60.000 Hz  16:9    45.000 kHz  74.250 MHz
    DMT 0x15:  1152x864    75.000 Hz   4:3    67.500 kHz 108.000 MHz
    GTF     :  1024x768    66.000 Hz   4:3    52.668 kHz  71.628 MHz
  Detailed Timing Descriptors:
    DTD 1:  1600x900    60.000 Hz  16:9    60.000 kHz 108.000 MHz (443 mm x 249 mm)
                 Hfront   24 Hsync  80 Hback  96 Hpol P
                 Vfront    1 Vsync   3 Vback  96 Vpol P
    Display Product Name: 'HF205'
  Display Range Limits:
    Monitor ranges (GTF): 56-76 Hz V, 24-83 kHz H, max dotclock 160 MHz
    Display Product Serial Number: ...
Checksum: 0xba

----------------

EDID conformity: PASS
