edid-decode (hex):

00 ff ff ff ff ff ff 00 52 62 00 02 00 00 00 00
10 14 01 03 08 35 1e ff 2a ba 45 a1 59 55 9d 28
0d 50 54 21 08 00 81 80 81 00 95 00 b3 00 d1 c0
01 01 01 01 01 01 02 3a 80 18 71 38 2d 40 58 2c
45 00 12 2c 21 00 00 3e 66 21 50 b0 51 00 1b 30
40 70 36 00 12 2c 21 00 00 1e 00 00 00 fc 00 54
4f 53 48 49 42 41 2d 54 56 0a 20 20 00 00 00 fd
00 3c 4b 1f 44 0f 00 0a 20 20 20 20 20 20 00 99

----------------

Block 0, Base EDID:
  EDID Structure Version & Revision: 1.3
  Vendor & Product Identification:
    Manufacturer: TSB
    Model: 512
    Made in: week 16 of 2010
  Basic Display Parameters & Features:
    Analog display
    Input voltage level: 0.7/0.3 V
    Sync: Separate
    Maximum image size: 53 cm x 30 cm
    Gamma: 1.0
    DPMS levels: Off
    RGB color display
    First detailed timing is preferred timing
  Color Characteristics:
    Red  : 0.6308, 0.3505
    Green: 0.3339, 0.6152
    Blue : 0.1572, 0.0507
    White: 0.3134, 0.3291
  Established Timings I & II:
    DMT 0x04:   640x480    59.940 Hz   4:3    31.469 kHz  25.175 MHz
    DMT 0x09:   800x600    60.317 Hz   4:3    37.879 kHz  40.000 MHz
    DMT 0x10:  1024x768    60.004 Hz   4:3    48.363 kHz  65.000 MHz
  Standard Timings:
    DMT 0x23:  1280x1024   60.020 Hz   5:4    63.981 kHz 108.000 MHz
    DMT 0x1c:  1280x800    59.810 Hz  16:10   49.702 kHz  83.500 MHz
    DMT 0x2f:  1440x900    59.887 Hz  16:10   55.935 kHz 106.500 MHz
    DMT 0x3a:  1680x1050   59.954 Hz  16:10   65.290 kHz 146.250 MHz
    DMT 0x52:  1920x1080   60.000 Hz  16:9    67.500 kHz 148.500 MHz
  Detailed Timing Descriptors:
    DTD 1:  1920x1080   60.000 Hz  16:9    67.500 kHz 148.500 MHz (field sequential L/R, 530 mm x 300 mm)
                 Hfront   88 Hsync  44 Hback 148 Hpol P
                 Vfront    4 Vsync   5 Vback  36 Vpol P
    DTD 2:  1360x768    60.015 Hz  85:48   47.712 kHz  85.500 MHz (530 mm x 300 mm)
                 Hfront   64 Hsync 112 Hback 256 Hpol P
                 Vfront    3 Vsync   6 Vback  18 Vpol P
    Display Product Name: 'TOSHIBA-TV'
  Display Range Limits:
    Monitor ranges (GTF): 60-75 Hz V, 31-68 kHz H, max dotclock 150 MHz
Checksum: 0x99

----------------

EDID conformity: PASS
