
EDID (hex):
00ffffffffffff000dae451700000000
041a010495261578029405a056519428
13505400000001010101010101010101
0101010101011c2a405461841a303020
35007ed61000001a131c405461841a30
302035007ed61000001a000000000000
00000000000000000000000000000002
000c3fef0b3c6e1b101e75000000006f

Extracted contents:
header:          00 ff ff ff ff ff ff 00
serial number:   0d ae 45 17 00 00 00 00 04 1a
version:         01 04
basic params:    95 26 15 78 02
chroma info:     94 05 a0 56 51 94 28 13 50 54
established:     00 00 00
standard:        01 01 01 01 01 01 01 01 01 01 01 01 01 01 01 01
descriptor 1:    1c 2a 40 54 61 84 1a 30 30 20 35 00 7e d6 10 00 00 1a
descriptor 2:    13 1c 40 54 61 84 1a 30 30 20 35 00 7e d6 10 00 00 1a
descriptor 3:    00 00 00 00 00 00 00 00 00 00 00 00 00 00 00 00 00 00
descriptor 4:    00 00 00 02 00 0c 3f ef 0b 3c 6e 1b 10 1e 75 00 00 00
extensions:      00
checksum:        6f

EDID version: 1.4
Manufacturer: CMN Model 1745 Serial Number --
Made in week 4 of 2016
Digital display
6 bits per primary color channel
DisplayPort interface
Maximum image size: 38 cm x 21 cm
Gamma: 2.20
Supported color formats: RGB 4:4:4
First detailed timing includes the native pixel format and preferred refresh rate
Display x,y Chromaticity:
  Red:   0.6269, 0.3369
  Green: 0.3173, 0.5781
  Blue:  0.1562, 0.0742
  White: 0.3134, 0.3291
Established timings supported:
Standard timings supported:
Detailed mode: Clock 107.800 MHz, 382 mm x 214 mm
               1600 1648 1680 1940 hborder 0
                900  903  908  926 vborder 0
               +hsync -vsync 
               VertFreq: 60 Hz, HorFreq: 55567 Hz
Detailed mode: Clock 71.870 MHz, 382 mm x 214 mm
               1600 1648 1680 1940 hborder 0
                900  903  908  926 vborder 0
               +hsync -vsync 
               VertFreq: 40 Hz, HorFreq: 37046 Hz
Manufacturer-specified data, tag 0
Manufacturer-specified data, tag 2
Checksum: 0x6f (valid)
EDID block does NOT conform to EDID 1.4!
	Missing name descriptor
	Missing monitor ranges
