
EDID (hex):
00ffffffffffff001ef9cb06651a0100
0b0e010368221b78ea2ee5a4574a9c25
115054a56b0081800101010101010101
010101010101302a009851002a403070
1300520e1100001e000000fe00474154
455741590a2020202020000000fc0046
5044313733300a2020202020000000fd
00384b1e530e000a20202020202000d0

Extracted contents:
header:          00 ff ff ff ff ff ff 00
serial number:   1e f9 cb 06 65 1a 01 00 0b 0e
version:         01 03
basic params:    68 22 1b 78 ea
chroma info:     2e e5 a4 57 4a 9c 25 11 50 54
established:     a5 6b 00
standard:        81 80 01 01 01 01 01 01 01 01 01 01 01 01 01 01
descriptor 1:    30 2a 00 98 51 00 2a 40 30 70 13 00 52 0e 11 00 00 1e
descriptor 2:    00 00 00 fe 00 47 41 54 45 57 41 59 0a 20 20 20 20 20
descriptor 3:    00 00 00 fc 00 46 50 44 31 37 33 30 0a 20 20 20 20 20
descriptor 4:    00 00 00 fd 00 38 4b 1e 53 0e 00 0a 20 20 20 20 20 20
extensions:      00
checksum:        d0

EDID version: 1.3
Manufacturer: GWY Model 6cb Serial Number --
Analog display, Input voltage level: 0.7/0.7 V
Sync: Separate 
Maximum image size: 34 cm x 27 cm
Gamma: 2.20
DPMS levels: Standby Suspend Off
RGB color display
First detailed timing is preferred timing
Display x,y Chromaticity:
  Red:   0.6406, 0.3417
  Green: 0.2919, 0.6113
  Blue:  0.1474, 0.0683
  White: 0.3134, 0.3291
Established timings supported:
  720x400@70Hz 9:5 HorFreq: 31469 Hz Clock: 28.320 MHz
  640x480@60Hz 4:3 HorFreq: 31469 Hz Clock: 25.175 MHz
  640x480@75Hz 4:3 HorFreq: 37500 Hz Clock: 31.500 MHz
  800x600@60Hz 4:3 HorFreq: 37900 Hz Clock: 40.000 MHz
  800x600@75Hz 4:3 HorFreq: 46900 Hz Clock: 49.500 MHz
  832x624@75Hz 4:3 HorFreq: 49726 Hz Clock: 57.284 MHz
  1024x768@60Hz 4:3 HorFreq: 48400 Hz Clock: 65.000 MHz
  1024x768@75Hz 4:3 HorFreq: 60000 Hz Clock: 78.750 MHz
  1280x1024@75Hz 5:4 HorFreq: 80000 Hz Clock: 135.000 MHz
Standard timings supported:
  1280x1024@60Hz 5:4 HorFreq: 64000 Hz Clock: 108.000 MHz
Detailed mode: Clock 108.000 MHz, 338 mm x 270 mm
               1280 1328 1440 1688 hborder 0
               1024 1025 1028 1066 vborder 0
               +hsync +vsync 
               VertFreq: 60 Hz, HorFreq: 63981 Hz
ASCII string: GATEWAY
Monitor name: FPD1730
Monitor ranges (GTF): 56-75Hz V, 30-83kHz H, max dotclock 140MHz
Checksum: 0xd0 (valid)
EDID block does not conform at all!
	Bad year of manufacture


