edid-decode (hex):

00 ff ff ff ff ff ff 00 0d 12 11 75 21 05 13 20
14 17 01 04 a5 2b 1d 78 e2 80 42 ac 51 30 b4 25
10 50 53 00 00 00 01 01 01 01 01 01 01 01 01 01
01 01 01 01 01 01 d6 2d 40 00 62 84 1a 30 58 a8
48 00 06 4d 21 00 00 1c 32 26 40 00 62 84 1a 30
58 a8 48 00 06 4d 21 00 00 1c 00 00 00 fd 00 38
4c 1e 53 11 00 0a 20 20 20 20 20 20 00 00 00 fc
00 45 54 32 30 32 30 41 0a 20 20 20 20 20 00 0a

----------------

Block 0, Base EDID:
  EDID Structure Version & Revision: 1.4
  Vendor & Product Identification:
    Manufacturer: CHR
    Model: 29969
    Serial Number: ...
    Made in: week 20 of 2013
  Basic Display Parameters & Features:
    Digital display
    Bits per primary color channel: 8
    DisplayPort interface
    Maximum image size: 43 cm x 29 cm
    Gamma: 2.20
    DPMS levels: Standby Suspend Off
    Supported color formats: RGB 4:4:4
    First detailed timing includes the native pixel format and preferred refresh rate
  Color Characteristics:
    Red  : 0.6738, 0.3164
    Green: 0.1875, 0.7031
    Blue : 0.1455, 0.0625
    White: 0.3125, 0.3261
  Established Timings I & II: none
  Standard Timings: none
  Detailed Timing Descriptors:
    DTD 1:  1600x900    59.999 Hz  16:9    55.559 kHz 117.340 MHz (518 mm x 333 mm)
                 Hfront   88 Hsync 168 Hback 256 Hpol N
                 Vfront    4 Vsync   8 Vback  14 Vpol P
    DTD 2:  1600x900    49.997 Hz  16:9    46.297 kHz  97.780 MHz (518 mm x 333 mm)
                 Hfront   88 Hsync 168 Hback 256 Hpol N
                 Vfront    4 Vsync   8 Vback  14 Vpol P
  Display Range Limits:
    Monitor ranges (GTF): 56-76 Hz V, 30-83 kHz H, max dotclock 170 MHz
    Display Product Name: 'ET2020A'
Checksum: 0x0a

----------------

Warnings:

EDID:
  Base EDID: Some timings are out of range of the Monitor Ranges:
    Vertical Freq: 49.997 - 59.999 Hz (Monitor: 56.000 - 76.000 Hz)

Failures:

Block 0, Base EDID:
  Detailed Timing Descriptor #1: Mismatch of image size 518x333 mm vs display size 430x290 mm.
  Detailed Timing Descriptor #2: Mismatch of image size 518x333 mm vs display size 430x290 mm.
  Display Range Limits: GTF can't be combined with non-continuous frequencies.

EDID conformity: FAIL
