edid-decode (hex):

00 ff ff ff ff ff ff 00 0d 12 11 75 70 03 00 00
28 16 01 04 a5 00 00 78 e2 80 42 ac 51 30 b4 25
10 50 53 00 00 00 01 01 01 01 01 01 01 01 01 01
01 01 01 01 01 01 3a 39 80 fa 70 38 2d 40 2a 53
8f 00 00 00 00 00 00 1a b0 2f 80 fa 70 38 2d 40
2a 53 8f 00 00 00 00 00 00 1a 00 00 00 fd 00 38
4c 1e 53 11 00 0a 20 20 20 20 20 20 00 00 00 fc
00 46 55 4c 4c 2d 48 44 2d 30 30 0a 20 20 00 d9

----------------

Block 0, Base EDID:
  EDID Structure Version & Revision: 1.4
  Vendor & Product Identification:
    Manufacturer: CHR
    Model: 29969
    Serial Number: ...
    Made in: week 40 of 2012
  Basic Display Parameters & Features:
    Digital display
    Bits per primary color channel: 8
    DisplayPort interface
    Image size is variable
    Gamma: 2.20
    DPMS levels: Standby Suspend Off
    Supported color formats: RGB 4:4:4
    First detailed timing includes the native pixel format and preferred refresh rate
  Color Characteristics:
    Red  : 0.6738, 0.3164
    Green: 0.1875, 0.7031
    Blue : 0.1455, 0.0625
    White: 0.3125, 0.3261
  Established Timings I & II: none
  Standard Timings: none
  Detailed Timing Descriptors:
    DTD 1:  1920x1080   60.010 Hz  16:9    67.512 kHz 146.500 MHz
                 Hfront   42 Hsync  83 Hback 125 Hpol P
                 Vfront    8 Vsync  15 Vback  22 Vpol N
    DTD 2:  1920x1080   50.007 Hz  16:9    56.258 kHz 122.080 MHz
                 Hfront   42 Hsync  83 Hback 125 Hpol P
                 Vfront    8 Vsync  15 Vback  22 Vpol N
  Display Range Limits:
    Monitor ranges (GTF): 56-76 Hz V, 30-83 kHz H, max dotclock 170 MHz
    Display Product Name: 'FULL-HD-00'
Checksum: 0xd9
