
EDID (hex):
00ffffffffffff006318721700000000
14110101682019a0e800bda057499b26
10444afffe0045593159615981800101
010101010101000000fd0032821e480b
000a202020202020000000fc00313737
3245440a202020202020000000ff0036
37323034433133333031323501010101
010101010101010101010101010100ac

Extracted contents:
header:          00 ff ff ff ff ff ff 00
serial number:   63 18 72 17 00 00 00 00 14 11
version:         01 01
basic params:    68 20 19 a0 e8
chroma info:     00 bd a0 57 49 9b 26 10 44 4a
established:     ff fe 00
standard:        45 59 31 59 61 59 81 80 01 01 01 01 01 01 01 01
descriptor 1:    00 00 00 fd 00 32 82 1e 48 0b 00 0a 20 20 20 20 20 20
descriptor 2:    00 00 00 fc 00 31 37 37 32 45 44 0a 20 20 20 20 20 20
descriptor 3:    00 00 00 ff 00 36 37 32 30 34 43 31 33 33 30 31 32 35
descriptor 4:    01 01 01 01 01 01 01 01 01 01 01 01 01 01 01 01 01 01
extensions:      00
checksum:        ac

EDID version: 1.1
Manufacturer: XXX Model 1772 Serial Number --
Made in week 20 of 2007
Analog display, Input voltage level: 0.7/0.7 V
Sync: Separate 
Maximum image size: 32 cm x 25 cm
Gamma: 2.60
DPMS levels: Standby Suspend Off
RGB color display
Display x,y Chromaticity:
  Red:   0.6250, 0.3398
  Green: 0.2851, 0.6054
  Blue:  0.1503, 0.0654
  White: 0.2685, 0.2900
Established timings supported:
  720x400@70Hz 9:5 HorFreq: 31469 Hz Clock: 28.320 MHz
  720x400@88Hz 9:5 HorFreq: 39500 Hz Clock: 35.500 MHz
  640x480@60Hz 4:3 HorFreq: 31469 Hz Clock: 25.175 MHz
  640x480@67Hz 4:3 HorFreq: 35000 Hz Clock: 30.240 MHz
  640x480@72Hz 4:3 HorFreq: 37900 Hz Clock: 31.500 MHz
  640x480@75Hz 4:3 HorFreq: 37500 Hz Clock: 31.500 MHz
  800x600@56Hz 4:3 HorFreq: 35200 Hz Clock: 36.000 MHz
  800x600@60Hz 4:3 HorFreq: 37900 Hz Clock: 40.000 MHz
  800x600@72Hz 4:3 HorFreq: 48100 Hz Clock: 50.000 MHz
  800x600@75Hz 4:3 HorFreq: 46900 Hz Clock: 49.500 MHz
  832x624@75Hz 4:3 HorFreq: 49726 Hz Clock: 57.284 MHz
  1280x768i@87Hz 5:3 HorFreq: 35522 Hz Clock: 44.900 MHz
  1024x768@60Hz 4:3 HorFreq: 48400 Hz Clock: 65.000 MHz
  1024x768@70Hz 4:3 HorFreq: 56500 Hz Clock: 75.000 MHz
  1024x768@75Hz 4:3 HorFreq: 60000 Hz Clock: 78.750 MHz
Standard timings supported:
  800x600@85Hz 4:3 HorFreq: 53700 Hz Clock: 56.250 MHz
  640x480@85Hz 4:3 HorFreq: 43300 Hz Clock: 36.000 MHz
  1024x768@85Hz 4:3 HorFreq: 68700 Hz Clock: 94.500 MHz
  1280x1024@60Hz 5:4 HorFreq: 64000 Hz Clock: 108.000 MHz
Monitor ranges (GTF): 50-130Hz V, 30-72kHz H, max dotclock 110MHz
Monitor name: 1772ED
Serial number: --
Detailed mode: Clock 2.570 MHz, 1 mm x 257 mm
                  1    2    3  258 hborder 1
                  1    1   18  258 vborder 1
               -hsync -vsync analog composite 
               VertFreq: 38 Hz, HorFreq: 9961 Hz
Checksum: 0xac (valid)
EDID block does NOT conform to EDID 1.0!
	Has descriptor blocks other than detailed timings
One or more of the timings is out of range of the Monitor Ranges:
  Vertical Freq: 38 - 88 Hz
  Horizontal Freq: 9961 - 68700 Hz
  Maximum Clock: 108.000 MHz
EDID block does not conform at all!
	Invalid detailed timing descriptor ordering
