edid-decode (hex):

00 ff ff ff ff ff ff 00 06 af 3c 14 00 00 00 00
00 13 01 04 95 1f 11 78 02 45 25 9c 5b 55 9c 27
19 50 54 00 00 00 01 01 01 01 01 01 01 01 01 01
01 01 01 01 01 01 12 1b 56 46 50 00 23 30 26 16
36 00 35 ad 10 00 00 18 0c 12 56 46 50 00 23 30
26 16 36 00 35 ad 10 00 00 18 00 00 00 00 00 00
00 00 00 00 00 00 00 00 00 00 00 00 00 00 00 02
00 0c 45 e8 0b 3c 64 12 12 1d 6e 20 20 20 00 ae

----------------

Block 0, Base EDID:
  EDID Structure Version & Revision: 1.4
  Vendor & Product Identification:
    Manufacturer: AUO
    Model: 5180
    Made in: 2009
  Basic Display Parameters & Features:
    Digital display
    Bits per primary color channel: 6
    DisplayPort interface
    Maximum image size: 31 cm x 17 cm
    Gamma: 2.20
    Supported color formats: RGB 4:4:4
    First detailed timing includes the native pixel format and preferred refresh rate
  Color Characteristics:
    Red  : 0.6103, 0.3554
    Green: 0.3330, 0.6103
    Blue : 0.1523, 0.0996
    White: 0.3134, 0.3291
  Established Timings I & II: none
  Standard Timings: none
  Detailed Timing Descriptors:
    DTD 1:  1366x768    60.098447 Hz 683:384   48.259 kHz     69.300000 MHz (309 mm x 173 mm)
                 Hfront   38 Hsync  22 Hback   10 Hpol N
                 Vfront    3 Vsync   6 Vback   26 Vpol N
    DTD 2:  1366x768    40.065631 Hz 683:384   32.173 kHz     46.200000 MHz (309 mm x 173 mm)
                 Hfront   38 Hsync  22 Hback   10 Hpol N
                 Vfront    3 Vsync   6 Vback   26 Vpol N
    Empty Descriptor
    Manufacturer-Specified Display Descriptor (0x02): 00 02 00 0c 45 e8 0b 3c 64 12 12 1d 6e 20 20 20 '....E..<d...n   '
Checksum: 0xae

----------------

Failures:

Block 0, Base EDID:
  Empty Descriptor: Use Dummy Descriptor instead of all zeroes.
  Missing Display Product Name.

EDID conformity: FAIL
