
EDID (hex):
00ffffffffffff0010acf893eaf48f04
231b010380331d780ac665a059589d27
0e5054210800d1c081c081809500b300
010101010101023a801871382d40942c
4508fe1f1100001e662150b051001b30
40703600fe1f1100001e000000fc0049
6e737069726f6e2035343737000000fd
00314b1c5f09000a20202120202001d8

Extracted contents:
header:          00 ff ff ff ff ff ff 00
serial number:   10 ac f8 93 ea f4 8f 04 23 1b
version:         01 03
basic params:    80 33 1d 78 0a
chroma info:     c6 65 a0 59 58 9d 27 0e 50 54
established:     21 08 00
standard:        d1 c0 81 c0 81 80 95 00 b3 00 01 01 01 01 01 01
descriptor 1:    02 3a 80 18 71 38 2d 40 94 2c 45 08 fe 1f 11 00 00 1e
descriptor 2:    66 21 50 b0 51 00 1b 30 40 70 36 00 fe 1f 11 00 00 1e
descriptor 3:    00 00 00 fc 00 49 6e 73 70 69 72 6f 6e 20 35 34 37 37
descriptor 4:    00 00 00 fd 00 31 4b 1c 5f 09 00 0a 20 20 21 20 20 20
extensions:      01
checksum:        d8

EDID version: 1.3
Manufacturer: DEL Model 93f8 Serial Number --
Made in week 35 of 2017
Digital display
Maximum image size: 51 cm x 29 cm
Gamma: 2.20
RGB color display
First detailed timing is preferred timing
Display x,y Chromaticity:
  Red:   0.6279, 0.3476
  Green: 0.3447, 0.6152
  Blue:  0.1533, 0.0566
  White: 0.3134, 0.3291
Established timings supported:
  640x480@60Hz 4:3 HorFreq: 31469 Hz Clock: 25.175 MHz
  800x600@60Hz 4:3 HorFreq: 37900 Hz Clock: 40.000 MHz
  1024x768@60Hz 4:3 HorFreq: 48400 Hz Clock: 65.000 MHz
Standard timings supported:
  1920x1080@60Hz 16:9
  1280x720@60Hz 16:9
  1280x1024@60Hz 5:4 HorFreq: 64000 Hz Clock: 108.000 MHz
  1440x900@60Hz 16:10 HorFreq: 55500 Hz Clock: 88.750 MHz
  1680x1050@60Hz 16:10 HorFreq: 64700 Hz Clock: 119.000 MHz
Detailed mode: Clock 148.500 MHz, 510 mm x 287 mm
               1920 2068 2112 2200 hborder 0
               1080 1116 1121 1125 vborder 0
               +hsync +vsync 
               VertFreq: 60 Hz, HorFreq: 67500 Hz
Detailed mode: Clock 85.500 MHz, 510 mm x 287 mm
               1360 1424 1536 1792 hborder 0
                768  771  777  795 vborder 0
               +hsync +vsync 
               VertFreq: 60 Hz, HorFreq: 47712 Hz
Monitor ranges (GTF): 49-75Hz V, 28-95kHz H, max dotclock 90MHz
Has 1 extension blocks
Checksum: 0xd8 (valid)
EDID block does NOT conform to EDID 1.3!
	Name descriptor not terminated with a newline
One or more of the timings is out of range of the Monitor Ranges:
  Vertical Freq: 60 - 60 Hz
  Horizontal Freq: 31469 - 67500 Hz
  Maximum Clock: 148.500 MHz
