edid-decode (hex):

00 ff ff ff ff ff ff 00 32 8e 2a 02 01 01 01 01
2d 0d 01 03 68 25 17 8c 2a 8c b5 a6 57 4c 97 26
23 50 54 bf ee 00 01 01 01 01 01 01 01 01 01 01
01 01 01 01 01 01 0e 1f 00 80 51 00 1e 30 40 80
37 00 71 dd 10 00 00 1a 00 00 00 fd 00 38 4c 1f
3d 0b 04 00 00 30 00 00 00 00 00 00 00 fc 00 42
31 37 4d 54 46 0a 20 20 20 20 20 20 00 00 00 ff
00 33 34 35 34 31 30 30 38 35 0a 20 20 20 00 4e

----------------

Block 0, Base EDID:
  EDID Structure Version & Revision: 1.3
  Vendor & Product Identification:
    Manufacturer: LTN
    Model: 554
    Serial Number: ...
    Made in: week 45 of 2003
  Basic Display Parameters & Features:
    Analog display
    Signal Level Standard: 0.700 : 0.000 : 0.700 V p-p
    Blank level equals black level
    Sync: Separate
    Maximum image size: 37 cm x 23 cm
    Gamma: 2.40
    DPMS levels: Off
    RGB color display
    First detailed timing is the preferred timing
  Color Characteristics:
    Red  : 0.6503, 0.3398
    Green: 0.2998, 0.5898
    Blue : 0.1503, 0.1396
    White: 0.3134, 0.3291
  Established Timings I & II:
    IBM     :   720x400    70.081663 Hz   9:5     31.467 kHz     28.320000 MHz
    DMT 0x04:   640x480    59.940476 Hz   4:3     31.469 kHz     25.175000 MHz
    Apple   :   640x480    66.666667 Hz   4:3     35.000 kHz     30.240000 MHz
    DMT 0x05:   640x480    72.808802 Hz   4:3     37.861 kHz     31.500000 MHz
    DMT 0x06:   640x480    75.000000 Hz   4:3     37.500 kHz     31.500000 MHz
    DMT 0x08:   800x600    56.250000 Hz   4:3     35.156 kHz     36.000000 MHz
    DMT 0x09:   800x600    60.316541 Hz   4:3     37.879 kHz     40.000000 MHz
    DMT 0x0a:   800x600    72.187572 Hz   4:3     48.077 kHz     50.000000 MHz
    DMT 0x0b:   800x600    75.000000 Hz   4:3     46.875 kHz     49.500000 MHz
    Apple   :   832x624    74.551266 Hz   4:3     49.726 kHz     57.284000 MHz
    DMT 0x10:  1024x768    60.003840 Hz   4:3     48.363 kHz     65.000000 MHz
    DMT 0x11:  1024x768    70.069359 Hz   4:3     56.476 kHz     75.000000 MHz
    DMT 0x12:  1024x768    75.028582 Hz   4:3     60.023 kHz     78.750000 MHz
  Standard Timings: none
  Detailed Timing Descriptors:
    DTD 1:  1280x768    59.870228 Hz   5:3     47.776 kHz     79.500000 MHz (369 mm x 221 mm)
                 Hfront   64 Hsync 128 Hback  192 Hpol P
                 Vfront    3 Vsync   7 Vback   20 Vpol N
    Display Range Limits:
      Monitor ranges (CVT): 56-76 Hz V, 31-61 kHz H, max dotclock 110 MHz
      CVT version 0.0
      Max active pixels per line: 384
      Supported aspect ratios:
      Preferred aspect ratio: 4:3
    Display Product Name: 'B17MTF'
    Display Product Serial Number: ...
Checksum: 0x4e

----------------

Warnings:

Block 0, Base EDID:
  Detailed Timing Descriptor #1: DTD is similar but not identical to DMT 0x17.
  Display Range Limits: CVT block does not set preferred refresh rate.

Failures:

Block 0, Base EDID:
  Display Range Limits: 'CVT' is not allowed for EDID < 1.4.

EDID conformity: FAIL
