edid-decode (hex):

00 ff ff ff ff ff ff 00 06 af a2 41 00 00 00 00
08 20 01 04 b5 26 15 78 03 ce 99 b0 4f 38 bb 23
0f 54 57 00 00 00 01 01 01 01 01 01 01 01 01 01
01 01 01 01 01 01 7c ce 00 a0 f0 70 28 80 30 20
35 00 7d d6 10 00 00 18 00 00 00 0f 00 00 00 00
00 00 00 00 00 00 00 00 00 20 00 00 00 fd 0c 30
90 3e 3e 7f 01 0a 20 20 20 20 20 20 00 00 00 fe
00 42 31 37 33 5a 41 4e 30 36 2e 43 20 0a 02 19

02 03 0f 00 e3 05 80 00 e6 06 05 01 8b 8b 11 00
00 00 00 00 00 00 00 00 00 00 00 00 00 00 00 00
00 00 00 00 00 00 00 00 00 00 00 00 00 00 00 00
00 00 00 00 00 00 00 00 00 00 00 00 00 00 00 00
00 00 00 00 00 00 00 00 00 00 00 00 00 00 00 00
00 00 00 00 00 00 00 00 00 00 00 00 00 00 00 00
00 00 00 00 00 00 00 00 00 00 00 00 00 00 00 00
00 00 00 00 00 00 00 00 00 00 00 00 00 00 00 6b

70 13 79 00 00 03 01 14 00 ef 01 84 ff 0e 9f 00
2f 00 1f 00 6f 08 27 00 02 00 04 00 00 00 00 00
00 00 00 00 00 00 00 00 00 00 00 00 00 00 00 00
00 00 00 00 00 00 00 00 00 00 00 00 00 00 00 00
00 00 00 00 00 00 00 00 00 00 00 00 00 00 00 00
00 00 00 00 00 00 00 00 00 00 00 00 00 00 00 00
00 00 00 00 00 00 00 00 00 00 00 00 00 00 00 00
00 00 00 00 00 00 00 00 00 00 00 00 00 00 4a 90

00 ff ff ff ff ff ff 00 06 af a2 41 00 00 00 00
08 20 01 04 b5 26 15 78 03 ce 99 b0 4f 38 bb 23
0f 54 57 00 00 00 01 01 01 01 01 01 01 01 01 01
01 01 01 01 01 01 7c ce 00 a0 f0 70 28 80 30 20
35 00 7d d6 10 00 00 18 00 00 00 0f 00 00 00 00
00 00 00 00 00 00 00 00 00 20 00 00 00 fd 0c 30
90 3e 3e 7f 01 0a 20 20 20 20 20 20 00 00 00 fe
00 42 31 37 33 5a 41 4e 30 36 2e 43 20 0a 02 19

02 03 0f 00 e3 05 80 00 e6 06 05 01 8b 8b 11 00
00 00 00 00 00 00 00 00 00 00 00 00 00 00 00 00
00 00 00 00 00 00 00 00 00 00 00 00 00 00 00 00
00 00 00 00 00 00 00 00 00 00 00 00 00 00 00 00
00 00 00 00 00 00 00 00 00 00 00 00 00 00 00 00
00 00 00 00 00 00 00 00 00 00 00 00 00 00 00 00
00 00 00 00 00 00 00 00 00 00 00 00 00 00 00 00
00 00 00 00 00 00 00 00 00 00 00 00 00 00 00 6b

70 13 79 00 00 03 01 14 00 ef 01 84 ff 0e 9f 00
2f 00 1f 00 6f 08 27 00 02 00 04 00 00 00 00 00
00 00 00 00 00 00 00 00 00 00 00 00 00 00 00 00
00 00 00 00 00 00 00 00 00 00 00 00 00 00 00 00
00 00 00 00 00 00 00 00 00 00 00 00 00 00 00 00
00 00 00 00 00 00 00 00 00 00 00 00 00 00 00 00
00 00 00 00 00 00 00 00 00 00 00 00 00 00 00 00
00 00 00 00 00 00 00 00 00 00 00 00 00 00 4a 90

----------------

Block 0, Base EDID:
  EDID Structure Version & Revision: 1.4
  Vendor & Product Identification:
    Manufacturer: AUO
    Model: 16802
    Made in: week 8 of 2022
  Basic Display Parameters & Features:
    Digital display
    Bits per primary color channel: 10
    DisplayPort interface
    Maximum image size: 38 cm x 21 cm
    Gamma: 2.20
    Supported color formats: RGB 4:4:4
    First detailed timing includes the native pixel format and preferred refresh rate
    Display is continuous frequency
  Color Characteristics:
    Red  : 0.6904, 0.3085
    Green: 0.2216, 0.7324
    Blue : 0.1386, 0.0595
    White: 0.3300, 0.3408
  Established Timings I & II: none
  Standard Timings: none
  Detailed Timing Descriptors:
    DTD 1:  3840x2160   60.068182 Hz  16:9    132.150 kHz    528.600000 MHz (381 mm x 214 mm)
                 Hfront   48 Hsync  32 Hback   80 Hpol N
                 Vfront    3 Vsync   5 Vback   32 Vpol N
    Manufacturer-Specified Display Descriptor (0x0f): 00 0f 00 00 00 00 00 00 00 00 00 00 00 00 00 20 '............... '
    Display Range Limits:
      Monitor ranges (Bare Limits): 48-144 Hz V, 317-317 kHz H, max dotclock 1270 MHz
    Alphanumeric Data String: 'B173ZAN06.C '
  Extension blocks: 2
Checksum: 0x19

----------------

Block 1, CTA-861 Extension Block:
  Revision: 3
  Native detailed modes: 0
  Colorimetry Data Block:
    BT2020RGB
  HDR Static Metadata Data Block:
    Electro optical transfer functions:
      Traditional gamma - SDR luminance range
      SMPTE ST2084
    Supported static metadata descriptors:
      Static metadata type 1
    Desired content max luminance: 139 (1015.241 cd/m^2)
    Desired content max frame-average luminance: 139 (1015.241 cd/m^2)
    Desired content min luminance: 17 (0.045 cd/m^2)
Checksum: 0x6b  Unused space in Extension Block: 112 bytes

----------------

Block 2, DisplayID Extension Block:
  Version: 1.3
  Extension Count: 0
  Display Product Type: Extension Section
  Video Timing Modes Type 1 - Detailed Timings Data Block:
    DTD:  3840x2160  144.001136 Hz  16:9    316.803 kHz   1267.210000 MHz (aspect 16:9, no 3D stereo, preferred)
               Hfront   48 Hsync  32 Hback   80 Hpol N
               Vfront    3 Vsync   5 Vback   32 Vpol N
  Checksum: 0x4a
Checksum: 0x90

----------------

Block 3, Unknown EDID Extension Block 0x00:
  00 ff ff ff ff ff ff 00 06 af a2 41 00 00 00 00 '...........A....'
  08 20 01 04 b5 26 15 78 03 ce 99 b0 4f 38 bb 23 '. ...&.x....O8.#'
  0f 54 57 00 00 00 01 01 01 01 01 01 01 01 01 01 '.TW.............'
  01 01 01 01 01 01 7c ce 00 a0 f0 70 28 80 30 20 '......|....p(.0 '
  35 00 7d d6 10 00 00 18 00 00 00 0f 00 00 00 00 '5.}.............'
  00 00 00 00 00 00 00 00 00 20 00 00 00 fd 0c 30 '......... .....0'
  90 3e 3e 7f 01 0a 20 20 20 20 20 20 00 00 00 fe '.>>...      ....'
  00 42 31 37 33 5a 41 4e 30 36 2e 43 20 0a 02 19 '.B173ZAN06.C ...'
Checksum: 0x19

----------------

Block 4, CTA-861 Extension Block:
  Revision: 3
  Native detailed modes: 0
  Colorimetry Data Block:
    BT2020RGB
  HDR Static Metadata Data Block:
    Electro optical transfer functions:
      Traditional gamma - SDR luminance range
      SMPTE ST2084
    Supported static metadata descriptors:
      Static metadata type 1
    Desired content max luminance: 139 (1015.241 cd/m^2)
    Desired content max frame-average luminance: 139 (1015.241 cd/m^2)
    Desired content min luminance: 17 (0.045 cd/m^2)
Checksum: 0x6b  Unused space in Extension Block: 112 bytes

----------------

Block 5, DisplayID Extension Block:
  Version: 1.3
  Extension Count: 0
  Video Timing Modes Type 1 - Detailed Timings Data Block:
    DTD:  3840x2160  144.001136 Hz  16:9    316.803 kHz   1267.210000 MHz (aspect 16:9, no 3D stereo, preferred)
               Hfront   48 Hsync  32 Hback   80 Hpol N
               Vfront    3 Vsync   5 Vback   32 Vpol N
  Checksum: 0x4a
Checksum: 0x90

----------------

Warnings:

Block 0, Base EDID:
  Missing Display Product Name.
Block 1, CTA-861 Extension Block:
  IT Video Formats are overscanned by default, but normally this should be underscanned.
  Colorimetry Data Block: Set the sRGB colorimetry bit to avoid interop issues.
Block 4, CTA-861 Extension Block:
  IT Video Formats are overscanned by default, but normally this should be underscanned.
  Colorimetry Data Block: Set the sRGB colorimetry bit to avoid interop issues.
EDID:
  Base EDID: Some timings are out of range of the Monitor Ranges:
    Horizontal Freq: 132.150 - 316.802 kHz (Monitor: 317.000 - 317.000 kHz)

Failures:

Block 0, Base EDID:
  Alphanumeric Data String: One or more trailing spaces.
Block 1, CTA-861 Extension Block:
  Required 640x480p60 timings are missing in the established timings and the SVD list (VIC 1).
  Missing VCDB, needed for Set Selectable RGB Quantization to avoid interop issues.
Block 2, DisplayID Extension Block:
  DisplayID Base Block has no product type.
  Expected 0 DisplayID Extension Block, but got 1.
Block 3, Base EDID:
  Unknown Extension Block.
Block 4, CTA-861 Extension Block:
  Colorimetry Data Block: Only one instance of this Data Block is allowed.
  HDR Static Metadata Data Block: Only one instance of this Data Block is allowed.
  Required 640x480p60 timings are missing in the established timings and the SVD list (VIC 1).
  Missing VCDB, needed for Set Selectable RGB Quantization to avoid interop issues.
EDID:
  Base EDID: EDID specified 2 extension block(s), but found 5 extension block(s).
  DisplayID: Missing DisplayID Product Identification Data Block.

EDID conformity: FAIL
