
EDID (hex):
00ffffffffffff0010ace9a04c463630
1f1d0103803d2378eeee95a3544c9926
0f5054a54b00714f8180a9c0a940d1c0
e1000101010108e80030f2705a80b058
8a00615d2100001a000000ff00344b38
58373937563036464c0a000000fc0044
454c4c205532373138510a20000000fd
0031560a893c000a20202020202001a1
02033ef15861605f5e5d100504020716
01141f1213272021220306111523091f
07830100006d030c0010003078200060
03020167d85dc40178c003e20f03565e
00a0a0a0295030203500615d2100001a
04740030f2705a80b0588a00615d2100
001ebf1600a08038134030203a00615d
2100001a00000000000000000000002e

Extracted contents:
header:          00 ff ff ff ff ff ff 00
serial number:   10 ac e9 a0 4c 46 36 30 1f 1d
version:         01 03
basic params:    80 3d 23 78 ee
chroma info:     ee 95 a3 54 4c 99 26 0f 50 54
established:     a5 4b 00
standard:        71 4f 81 80 a9 c0 a9 40 d1 c0 e1 00 01 01 01 01
descriptor 1:    08 e8 00 30 f2 70 5a 80 b0 58 8a 00 61 5d 21 00 00 1a
descriptor 2:    00 00 00 ff 00 34 4b 38 58 37 39 37 56 30 36 46 4c 0a
descriptor 3:    00 00 00 fc 00 44 45 4c 4c 20 55 32 37 31 38 51 0a 20
descriptor 4:    00 00 00 fd 00 31 56 0a 89 3c 00 0a 20 20 20 20 20 20
extensions:      01
checksum:        a1

EDID version: 1.3
Manufacturer: DEL Model a0e9 Serial Number --
Made in week 31 of 2019
Digital display
Maximum image size: 61 cm x 35 cm
Gamma: 2.20
DPMS levels: Standby Suspend Off
RGB color display
Default (sRGB) color space is primary color space
First detailed timing is preferred timing
Display x,y Chromaticity:
  Red:   0.6396, 0.3300
  Green: 0.2998, 0.5996
  Blue:  0.1503, 0.0595
  White: 0.3134, 0.3291
Established timings supported:
  720x400@70Hz 9:5 HorFreq: 31469 Hz Clock: 28.320 MHz
  640x480@60Hz 4:3 HorFreq: 31469 Hz Clock: 25.175 MHz
  640x480@75Hz 4:3 HorFreq: 37500 Hz Clock: 31.500 MHz
  800x600@60Hz 4:3 HorFreq: 37900 Hz Clock: 40.000 MHz
  800x600@75Hz 4:3 HorFreq: 46900 Hz Clock: 49.500 MHz
  1024x768@60Hz 4:3 HorFreq: 48400 Hz Clock: 65.000 MHz
  1024x768@75Hz 4:3 HorFreq: 60000 Hz Clock: 78.750 MHz
  1280x1024@75Hz 5:4 HorFreq: 80000 Hz Clock: 135.000 MHz
Standard timings supported:
  1152x864@75Hz 4:3 HorFreq: 67500 Hz Clock: 108.000 MHz
  1280x1024@60Hz 5:4 HorFreq: 64000 Hz Clock: 108.000 MHz
  1600x900@60Hz 16:9
  1600x1200@60Hz 4:3 HorFreq: 75000 Hz Clock: 162.000 MHz
  1920x1080@60Hz 16:9
  2048x1280@60Hz 16:10
Detailed mode: Clock 594.000 MHz, 609 mm x 349 mm
               3840 4016 4104 4400 hborder 0
               2160 2168 2178 2250 vborder 0
               +hsync -vsync 
               VertFreq: 60 Hz, HorFreq: 135000 Hz
Serial number: --
Monitor name: DELL U2718Q
Monitor ranges (GTF): 49-86Hz V, 10-137kHz H, max dotclock 600MHz
Has 1 extension blocks
Checksum: 0xa1 (valid)

CTA extension block
Extension version: 3
58 bytes of CTA data
  Video data block
    VIC  97 3840x2160@60Hz 16:9  HorFreq: 135000 Hz Clock: 594.000 MHz
    VIC  96 3840x2160@50Hz 16:9  HorFreq: 112500 Hz Clock: 594.000 MHz
    VIC  95 3840x2160@30Hz 16:9  HorFreq: 67500 Hz Clock: 297.000 MHz
    VIC  94 3840x2160@25Hz 16:9  HorFreq: 56250 Hz Clock: 297.000 MHz
    VIC  93 3840x2160@24Hz 16:9  HorFreq: 54000 Hz Clock: 297.000 MHz
    VIC  16 1920x1080@60Hz 16:9  HorFreq: 67500 Hz Clock: 148.500 MHz
    VIC   5 1920x1080i@60Hz 16:9  HorFreq: 33750 Hz Clock: 74.250 MHz
    VIC   4 1280x720@60Hz 16:9  HorFreq: 45000 Hz Clock: 74.250 MHz
    VIC   2 720x480@60Hz 4:3  HorFreq: 31469 Hz Clock: 27.000 MHz
    VIC   7 1440x480i@60Hz 16:9  HorFreq: 15734 Hz Clock: 27.000 MHz
    VIC  22 1440x576i@50Hz 16:9  HorFreq: 15625 Hz Clock: 27.000 MHz
    VIC   1 640x480@60Hz 4:3  HorFreq: 31469 Hz Clock: 25.175 MHz
    VIC  20 1920x1080i@50Hz 16:9  HorFreq: 28125 Hz Clock: 74.250 MHz
    VIC  31 1920x1080@50Hz 16:9  HorFreq: 56250 Hz Clock: 148.500 MHz
    VIC  18 720x576@50Hz 16:9  HorFreq: 31250 Hz Clock: 27.000 MHz
    VIC  19 1280x720@50Hz 16:9  HorFreq: 37500 Hz Clock: 74.250 MHz
    VIC  39 1920x1080i@50Hz 16:9  HorFreq: 31250 Hz Clock: 72.000 MHz
    VIC  32 1920x1080@24Hz 16:9  HorFreq: 27000 Hz Clock: 74.250 MHz
    VIC  33 1920x1080@25Hz 16:9  HorFreq: 28125 Hz Clock: 74.250 MHz
    VIC  34 1920x1080@30Hz 16:9  HorFreq: 33750 Hz Clock: 74.250 MHz
    VIC   3 720x480@60Hz 16:9  HorFreq: 31469 Hz Clock: 27.000 MHz
    VIC   6 1440x480i@60Hz 4:3  HorFreq: 15734 Hz Clock: 27.000 MHz
    VIC  17 720x576@50Hz 4:3  HorFreq: 31250 Hz Clock: 27.000 MHz
    VIC  21 1440x576i@50Hz 4:3  HorFreq: 15625 Hz Clock: 27.000 MHz
  Audio data block
    Linear PCM, max channels 2
      Supported sample rates (kHz): 96 88.2 48 44.1 32
      Supported sample sizes (bits): 24 20 16
  Speaker allocation data block
    Speaker map:
      FL/FR - Front Left/Right
  Vendor-specific data block, OUI 000c03 (HDMI)
    Source physical address 1.0.0.0
    DC_36bit
    DC_30bit
    Maximum TMDS clock: 600MHz
    Extended HDMI video details:
      HDMI VIC 3 3840x2160@24Hz 16:9 HorFreq: 54000 Hz Clock: 297.000 MHz
      HDMI VIC 2 3840x2160@25Hz 16:9 HorFreq: 56250 Hz Clock: 297.000 MHz
      HDMI VIC 1 3840x2160@30Hz 16:9 HorFreq: 67500 Hz Clock: 297.000 MHz
  Vendor-specific data block, OUI c45dd8 (HDMI Forum)
    Version: 1
    Maximum TMDS Character Rate: 600MHz
    SCDC Present
    SCDC Read Request Capable
    Supports 12-bits/component Deep Color 4:2:0 Pixel Encoding
    Supports 10-bits/component Deep Color 4:2:0 Pixel Encoding
  Extended tag: YCbCr 4:2:0 capability map data block
    VSD Index 0
    VSD Index 1
Underscans PC formats by default
Basic audio support
Supports YCbCr 4:4:4
Supports YCbCr 4:2:2
1 native detailed modes
Detailed mode: Clock 241.500 MHz, 609 mm x 349 mm
               2560 2608 2640 2720 hborder 0
               1440 1443 1448 1481 vborder 0
               +hsync -vsync 
               VertFreq: 59 Hz, HorFreq: 88786 Hz
Detailed mode: Clock 297.000 MHz, 609 mm x 349 mm
               3840 4016 4104 4400 hborder 0
               2160 2168 2178 2250 vborder 0
               +hsync +vsync 
               VertFreq: 30 Hz, HorFreq: 67500 Hz
Detailed mode: Clock 58.230 MHz, 609 mm x 349 mm
               2048 2096 2128 2208 hborder 0
               1080 1083 1093 1099 vborder 0
               +hsync -vsync 
               VertFreq: 23 Hz, HorFreq: 26372 Hz
Checksum: 0x2e (valid)

EDID block does NOT conform to EDID 1.3!
	sRGB is signaled, but the chromaticities do not match
	HDMI VSDB Max TMDS rate is > 340
One or more of the timings is out of range of the Monitor Ranges:
  Vertical Freq: 23 - 75 Hz
  Horizontal Freq: 15625 - 135000 Hz
  Maximum Clock: 594.000 MHz
EDID block does not conform at all!
	Both the serial number and the serial string are set
