
EDID (hex):
00ffffffffffff00220e5f3400000000
011d0104a5331d783aa575a856529e28
0b5054a10800d1c0a9c081c0b3009500
810081800101023a801871382d40582c
4500fe221100001e000000fd00323c1e
5011010a202020202020000000fc0048
5020453233330a2020202020000000ff
00334351393031303035360a20200083

Extracted contents:
header:          00 ff ff ff ff ff ff 00
serial number:   22 0e 5f 34 00 00 00 00 01 1d
version:         01 04
basic params:    a5 33 1d 78 3a
chroma info:     a5 75 a8 56 52 9e 28 0b 50 54
established:     a1 08 00
standard:        d1 c0 a9 c0 81 c0 b3 00 95 00 81 00 81 80 01 01
descriptor 1:    02 3a 80 18 71 38 2d 40 58 2c 45 00 fe 22 11 00 00 1e
descriptor 2:    00 00 00 fd 00 32 3c 1e 50 11 01 0a 20 20 20 20 20 20
descriptor 3:    00 00 00 fc 00 48 50 20 45 32 33 33 0a 20 20 20 20 20
descriptor 4:    00 00 00 ff 00 33 43 51 39 30 31 30 30 35 36 0a 20 20
extensions:      00
checksum:        83

EDID version: 1.4
Manufacturer: HPN Model 345f Serial Number --
Made in week 1 of 2019
Digital display
8 bits per primary color channel
DisplayPort interface
Maximum image size: 51 cm x 29 cm
Gamma: 2.20
DPMS levels: Off
Supported color formats: RGB 4:4:4, YCrCb 4:4:4, YCrCb 4:2:2
First detailed timing includes the native pixel format and preferred refresh rate
Display x,y Chromaticity:
  Red:   0.6582, 0.3378
  Green: 0.3212, 0.6181
  Blue:  0.1572, 0.0458
  White: 0.3134, 0.3291
Established timings supported:
  720x400@70Hz 9:5 HorFreq: 31469 Hz Clock: 28.320 MHz
  640x480@60Hz 4:3 HorFreq: 31469 Hz Clock: 25.175 MHz
  800x600@60Hz 4:3 HorFreq: 37900 Hz Clock: 40.000 MHz
  1024x768@60Hz 4:3 HorFreq: 48400 Hz Clock: 65.000 MHz
Standard timings supported:
  1920x1080@60Hz 16:9
  1600x900@60Hz 16:9
  1280x720@60Hz 16:9
  1680x1050@60Hz 16:10 HorFreq: 64700 Hz Clock: 119.000 MHz
  1440x900@60Hz 16:10 HorFreq: 55500 Hz Clock: 88.750 MHz
  1280x800@60Hz 16:10
  1280x1024@60Hz 5:4 HorFreq: 64000 Hz Clock: 108.000 MHz
Detailed mode: Clock 148.500 MHz, 510 mm x 290 mm
               1920 2008 2052 2200 hborder 0
               1080 1084 1089 1125 vborder 0
               +hsync +vsync 
               VertFreq: 60 Hz, HorFreq: 67500 Hz
Monitor ranges (bare limits): 50-60Hz V, 30-80kHz H, max dotclock 170MHz
Monitor name: HP E233
Serial number: --
Checksum: 0x83 (valid)
Warning: One or more of the timings is out of range of the Monitor Ranges:
  Vertical Freq: 60 - 70 Hz
  Horizontal Freq: 31469 - 67500 Hz
  Maximum Clock: 148.500 MHz


