edid-decode (hex):

00 ff ff ff ff ff ff 00 21 63 19 27 00 00 00 00
25 21 01 03 80 3c 21 78 2a ab b0 ab 50 47 a3 22
11 50 54 ad cf 00 81 80 81 8f 95 00 95 0f b3 0f
b3 00 d1 c0 d1 cf 6a 5e 00 a0 a0 a0 29 50 30 20
35 00 55 50 21 00 00 1a 00 00 00 fd 00 30 4b 1e
73 22 00 0a 20 20 20 20 20 20 00 00 00 fc 00 53
32 37 31 36 51 0a 20 20 20 20 20 20 00 00 00 ff
00 30 30 30 30 30 30 30 30 30 30 30 30 31 01 d0

02 03 22 f1 4a 90 04 03 02 01 1f 13 12 11 5a 23
09 07 07 83 01 00 00 67 03 0c 00 10 00 38 44 e2
00 ff bb 76 00 a0 a0 a0 32 50 10 40 35 00 55 50
21 00 00 1e 00 00 00 00 00 00 00 00 00 00 00 00
00 00 00 00 00 00 00 00 00 00 00 00 00 00 00 00
00 00 00 00 00 00 00 00 00 00 00 00 00 00 00 00
00 00 00 00 00 00 00 00 00 00 00 00 00 00 00 00
00 00 00 00 00 00 00 00 00 00 00 00 00 00 00 b8

00 ff ff ff ff ff ff 00 21 63 19 27 00 00 00 00
25 21 01 03 80 3c 21 78 2a ab b0 ab 50 47 a3 22
11 50 54 ad cf 00 81 80 81 8f 95 00 95 0f b3 0f
b3 00 d1 c0 d1 cf 6a 5e 00 a0 a0 a0 29 50 30 20
35 00 55 50 21 00 00 1a 00 00 00 fd 00 30 4b 1e
73 22 00 0a 20 20 20 20 20 20 00 00 00 fc 00 53
32 37 31 36 51 0a 20 20 20 20 20 20 00 00 00 ff
00 30 30 30 30 30 30 30 30 30 30 30 30 31 01 d0

02 03 22 f1 4a 90 04 03 02 01 1f 13 12 11 5a 23
09 07 07 83 01 00 00 67 03 0c 00 10 00 38 44 e2
00 ff bb 76 00 a0 a0 a0 32 50 10 40 35 00 55 50
21 00 00 1e 00 00 00 00 00 00 00 00 00 00 00 00
00 00 00 00 00 00 00 00 00 00 00 00 00 00 00 00
00 00 00 00 00 00 00 00 00 00 00 00 00 00 00 00
00 00 00 00 00 00 00 00 00 00 00 00 00 00 00 00
00 00 00 00 00 00 00 00 00 00 00 00 00 00 00 b8

----------------

Block 0, Base EDID:
  EDID Structure Version & Revision: 1.3
  Vendor & Product Identification:
    Manufacturer: HKC
    Model: 10009
    Made in: week 37 of 2023
  Basic Display Parameters & Features:
    Digital display
    Maximum image size: 60 cm x 33 cm
    Gamma: 2.20
    DPMS levels: Off
    RGB color display
    First detailed timing is the preferred timing
  Color Characteristics:
    Red  : 0.6699, 0.3144
    Green: 0.2792, 0.6396
    Blue : 0.1347, 0.0693
    White: 0.3125, 0.3281
  Established Timings I & II:
    IBM     :   720x400    70.081663 Hz   9:5     31.467 kHz     28.320000 MHz
    DMT 0x04:   640x480    59.940476 Hz   4:3     31.469 kHz     25.175000 MHz
    DMT 0x05:   640x480    72.808802 Hz   4:3     37.861 kHz     31.500000 MHz
    DMT 0x06:   640x480    75.000000 Hz   4:3     37.500 kHz     31.500000 MHz
    DMT 0x09:   800x600    60.316541 Hz   4:3     37.879 kHz     40.000000 MHz
    DMT 0x0a:   800x600    72.187572 Hz   4:3     48.077 kHz     50.000000 MHz
    DMT 0x0b:   800x600    75.000000 Hz   4:3     46.875 kHz     49.500000 MHz
    DMT 0x10:  1024x768    60.003840 Hz   4:3     48.363 kHz     65.000000 MHz
    DMT 0x11:  1024x768    70.069359 Hz   4:3     56.476 kHz     75.000000 MHz
    DMT 0x12:  1024x768    75.028582 Hz   4:3     60.023 kHz     78.750000 MHz
    DMT 0x24:  1280x1024   75.024675 Hz   5:4     79.976 kHz    135.000000 MHz
  Standard Timings:
    DMT 0x23:  1280x1024   60.019740 Hz   5:4     63.981 kHz    108.000000 MHz
    DMT 0x24:  1280x1024   75.024675 Hz   5:4     79.976 kHz    135.000000 MHz
    DMT 0x2f:  1440x900    59.887445 Hz  16:10    55.935 kHz    106.500000 MHz
    DMT 0x30:  1440x900    74.984427 Hz  16:10    70.635 kHz    136.750000 MHz
    DMT 0x3b:  1680x1050   74.892027 Hz  16:10    82.306 kHz    187.000000 MHz
    DMT 0x3a:  1680x1050   59.954250 Hz  16:10    65.290 kHz    146.250000 MHz
    DMT 0x52:  1920x1080   60.000000 Hz  16:9     67.500 kHz    148.500000 MHz
    GTF     :  1920x1080   75.000068 Hz  16:9     84.600 kHz    220.637000 MHz
  Detailed Timing Descriptors:
    DTD 1:  2560x1440   60.000199 Hz  16:9     88.860 kHz    241.700000 MHz (597 mm x 336 mm)
                 Hfront   48 Hsync  32 Hback   80 Hpol P
                 Vfront    3 Vsync   5 Vback   33 Vpol N
    Display Range Limits:
      Monitor ranges (GTF): 48-75 Hz V, 30-115 kHz H, max dotclock 340 MHz
    Display Product Name: 'S2716Q'
    Display Product Serial Number: ...
  Extension blocks: 1
Checksum: 0xd0

----------------

Block 1, CTA-861 Extension Block:
  Revision: 3
  Underscans IT Video Formats by default
  Basic audio support
  Supports YCbCr 4:4:4
  Supports YCbCr 4:2:2
  Native detailed modes: 1
  Video Data Block:
    VIC  16:  1920x1080   60.000000 Hz  16:9     67.500 kHz    148.500000 MHz (native)
    VIC   4:  1280x720    60.000000 Hz  16:9     45.000 kHz     74.250000 MHz
    VIC   3:   720x480    59.940060 Hz  16:9     31.469 kHz     27.000000 MHz
    VIC   2:   720x480    59.940060 Hz   4:3     31.469 kHz     27.000000 MHz
    VIC   1:   640x480    59.940476 Hz   4:3     31.469 kHz     25.175000 MHz
    VIC  31:  1920x1080   50.000000 Hz  16:9     56.250 kHz    148.500000 MHz
    VIC  19:  1280x720    50.000000 Hz  16:9     37.500 kHz     74.250000 MHz
    VIC  18:   720x576    50.000000 Hz  16:9     31.250 kHz     27.000000 MHz
    VIC  17:   720x576    50.000000 Hz   4:3     31.250 kHz     27.000000 MHz
    VIC  90:  2560x1080   60.000000 Hz  64:27    66.000 kHz    198.000000 MHz
  Audio Data Block:
    Linear PCM:
      Max channels: 2
      Supported sample rates (kHz): 48 44.1 32
      Supported sample sizes (bits): 24 20 16
  Speaker Allocation Data Block:
    FL/FR - Front Left/Right
  Vendor-Specific Data Block (HDMI), OUI 00-0C-03:
    Source physical address: 1.0.0.0
    DC_36bit
    DC_30bit
    DC_Y444
    Maximum TMDS clock: 340 MHz
  Video Capability Data Block:
    YCbCr quantization: Selectable (via AVI YQ)
    RGB quantization: Selectable (via AVI Q)
    PT scan behavior: Supports both over- and underscan
    IT scan behavior: Supports both over- and underscan
    CE scan behavior: Supports both over- and underscan
  Detailed Timing Descriptors:
    DTD 2:  2560x1440   74.997533 Hz  16:9    111.746 kHz    303.950000 MHz (597 mm x 336 mm)
                 Hfront   16 Hsync  64 Hback   80 Hpol P
                 Vfront    3 Vsync   5 Vback   42 Vpol P
Checksum: 0xb8  Unused space in Extension Block: 75 bytes

----------------

Block 2, Unknown EDID Extension Block 0x00:
  00 ff ff ff ff ff ff 00 21 63 19 27 00 00 00 00 '........!c.'....'
  25 21 01 03 80 3c 21 78 2a ab b0 ab 50 47 a3 22 '%!...<!x*...PG."'
  11 50 54 ad cf 00 81 80 81 8f 95 00 95 0f b3 0f '.PT.............'
  b3 00 d1 c0 d1 cf 6a 5e 00 a0 a0 a0 29 50 30 20 '......j^....)P0 '
  35 00 55 50 21 00 00 1a 00 00 00 fd 00 30 4b 1e '5.UP!........0K.'
  73 22 00 0a 20 20 20 20 20 20 00 00 00 fc 00 53 's"..      .....S'
  32 37 31 36 51 0a 20 20 20 20 20 20 00 00 00 ff '2716Q.      ....'
  00 30 30 30 30 30 30 30 30 30 30 30 30 31 01 d0 '.0000000000001..'
Checksum: 0xd0

----------------

Block 3, CTA-861 Extension Block:
  Revision: 3
  Underscans IT Video Formats by default
  Basic audio support
  Supports YCbCr 4:4:4
  Supports YCbCr 4:2:2
  Native detailed modes: 1
  Video Data Block:
    VIC  16:  1920x1080   60.000000 Hz  16:9     67.500 kHz    148.500000 MHz (native)
    VIC   4:  1280x720    60.000000 Hz  16:9     45.000 kHz     74.250000 MHz
    VIC   3:   720x480    59.940060 Hz  16:9     31.469 kHz     27.000000 MHz
    VIC   2:   720x480    59.940060 Hz   4:3     31.469 kHz     27.000000 MHz
    VIC   1:   640x480    59.940476 Hz   4:3     31.469 kHz     25.175000 MHz
    VIC  31:  1920x1080   50.000000 Hz  16:9     56.250 kHz    148.500000 MHz
    VIC  19:  1280x720    50.000000 Hz  16:9     37.500 kHz     74.250000 MHz
    VIC  18:   720x576    50.000000 Hz  16:9     31.250 kHz     27.000000 MHz
    VIC  17:   720x576    50.000000 Hz   4:3     31.250 kHz     27.000000 MHz
    VIC  90:  2560x1080   60.000000 Hz  64:27    66.000 kHz    198.000000 MHz
  Audio Data Block:
    Linear PCM:
      Max channels: 2
      Supported sample rates (kHz): 48 44.1 32
      Supported sample sizes (bits): 24 20 16
  Speaker Allocation Data Block:
    FL/FR - Front Left/Right
  Vendor-Specific Data Block (HDMI), OUI 00-0C-03:
    Source physical address: 1.0.0.0
    DC_36bit
    DC_30bit
    DC_Y444
    Maximum TMDS clock: 340 MHz
  Video Capability Data Block:
    YCbCr quantization: Selectable (via AVI YQ)
    RGB quantization: Selectable (via AVI Q)
    PT scan behavior: Supports both over- and underscan
    IT scan behavior: Supports both over- and underscan
    CE scan behavior: Supports both over- and underscan
  Detailed Timing Descriptors:
    DTD 3:  2560x1440   74.997533 Hz  16:9    111.746 kHz    303.950000 MHz (597 mm x 336 mm)
                 Hfront   16 Hsync  64 Hback   80 Hpol P
                 Vfront    3 Vsync   5 Vback   42 Vpol P
Checksum: 0xb8  Unused space in Extension Block: 75 bytes

----------------

Warnings:

Block 1, CTA-861 Extension Block:
  Video Capability Data Block: S_PT is equal to S_IT and S_CE, so should be set to 0 instead.
  Add a Colorimetry Data Block with the sRGB colorimetry bit set to avoid interop issues.
Block 3, CTA-861 Extension Block:
  Video Capability Data Block: S_PT is equal to S_IT and S_CE, so should be set to 0 instead.
  Add a Colorimetry Data Block with the sRGB colorimetry bit set to avoid interop issues.

Failures:

Block 2, Base EDID:
  Unknown Extension Block.
Block 3, CTA-861 Extension Block:
  Video Data Block: Duplicate VIC 16.
  Video Data Block: Duplicate VIC 4.
  Video Data Block: Duplicate VIC 3.
  Video Data Block: Duplicate VIC 2.
  Video Data Block: Duplicate VIC 1.
  Video Data Block: Duplicate VIC 31.
  Video Data Block: Duplicate VIC 19.
  Video Data Block: Duplicate VIC 18.
  Video Data Block: Duplicate VIC 17.
  Video Data Block: Duplicate VIC 90.
  Speaker Allocation Data Block: Only one instance of this Data Block is allowed.
  Video Capability Data Block: Only one instance of this Data Block is allowed.
EDID:
  Base EDID: EDID specified 1 extension block(s), but found 3 extension block(s).
  Base EDID: EDID 1.3 requires a Block Map Extension in Block 1 if there are more than 2 blocks in the EDID.
  CTA-861: Native progressive timings are a mix of several resolutions.

EDID conformity: FAIL
