
EDID (hex):
00ffffffffffff0030e4270300000000
28150104901f11780a37459658578e28
1e505400000001010101010101010101
010101010101581b567e50000e302430
350035ae10000019de12569a50001a30
2430350035ae10000019000000fe0044
37305056803134305748360a00000000
00004131940100000001010a202000ec

Extracted contents:
header:          00 ff ff ff ff ff ff 00
serial number:   30 e4 27 03 00 00 00 00 28 15
version:         01 04
basic params:    90 1f 11 78 0a
chroma info:     37 45 96 58 57 8e 28 1e 50 54
established:     00 00 00
standard:        01 01 01 01 01 01 01 01 01 01 01 01 01 01 01 01
descriptor 1:    58 1b 56 7e 50 00 0e 30 24 30 35 00 35 ae 10 00 00 19
descriptor 2:    de 12 56 9a 50 00 1a 30 24 30 35 00 35 ae 10 00 00 19
descriptor 3:    00 00 00 fe 00 44 37 30 50 56 80 31 34 30 57 48 36 0a
descriptor 4:    00 00 00 00 00 00 41 31 94 01 00 00 00 01 01 0a 20 20
extensions:      00
checksum:        ec

EDID version: 1.4
Manufacturer: LGD Model 327 Serial Number --
Made in week 40 of 2011
Digital display
6 bits per primary color channel
Digital interface is not defined
Maximum image size: 31 cm x 17 cm
Gamma: 2.20
Supported color formats: RGB 4:4:4, YCrCb 4:4:4
First detailed timing includes the native pixel format and preferred refresh rate
Display x,y Chromaticity:
  Red:   0.5859, 0.3466
  Green: 0.3408, 0.5576
  Blue:  0.1572, 0.1171
  White: 0.3134, 0.3291
Established timings supported:
Standard timings supported:
Detailed mode: Clock 70.000 MHz, 309 mm x 174 mm
               1366 1402 1450 1492 hborder 0
                768  771  776  782 vborder 0
               -hsync -vsync 
               VertFreq: 59 Hz, HorFreq: 46916 Hz
Detailed mode: Clock 48.300 MHz, 309 mm x 174 mm
               1366 1402 1450 1520 hborder 0
                768  771  776  794 vborder 0
               -hsync -vsync 
               VertFreq: 40 Hz, HorFreq: 31776 Hz
ASCII string: D70PV
Manufacturer-specified data, tag 0
Checksum: 0xec (valid)
EDID block does NOT conform to EDID 1.4!
	Missing name descriptor
	Missing monitor ranges
	Detailed block string not properly terminated
