edid-decode (hex):

00 ff ff ff ff ff ff 00 06 af ed 13 00 00 00 00
00 12 01 04 90 22 13 78 02 c8 95 9e 57 54 92 26
0f 50 54 00 00 00 01 01 01 01 01 01 01 01 01 01
01 01 01 01 01 01 14 37 80 b2 70 38 28 40 18 10
24 00 58 c1 10 00 00 18 b8 24 80 b2 70 38 28 40
18 10 24 00 58 c1 10 00 00 18 00 00 00 00 00 00
00 00 00 00 00 00 00 00 00 00 00 00 00 00 00 02
00 0c 35 f9 0f 3c 8c 1a 18 3c 93 20 20 20 00 a1

----------------

Block 0, Base EDID:
  EDID Structure Version & Revision: 1.4
  Vendor & Product Identification:
    Manufacturer: AUO
    Model: 5101
    Made in: 2008
  Basic Display Parameters & Features:
    Digital display
    Bits per primary color channel: 6
    Digital interface is not defined
    Maximum image size: 34 cm x 19 cm
    Gamma: 2.20
    Supported color formats: RGB 4:4:4
    First detailed timing includes the native pixel format and preferred refresh rate
  Color Characteristics:
    Red  : 0.6201, 0.3398
    Green: 0.3300, 0.5703
    Blue : 0.1503, 0.0595
    White: 0.3134, 0.3291
  Established Timings I & II: none
  Standard Timings: none
  Detailed Timing Descriptors:
    DTD 1:  1920x1080   60.006128 Hz  16:9     67.207 kHz    141.000000 MHz (344 mm x 193 mm)
                 Hfront   24 Hsync  16 Hback  138 Hpol N
                 Vfront    2 Vsync   4 Vback   34 Vpol N
    DTD 2:  1920x1080   40.004086 Hz  16:9     44.805 kHz     94.000000 MHz (344 mm x 193 mm)
                 Hfront   24 Hsync  16 Hback  138 Hpol N
                 Vfront    2 Vsync   4 Vback   34 Vpol N
    Empty Descriptor
    Manufacturer-Specified Display Descriptor (0x02): 00 02 00 0c 35 f9 0f 3c 8c 1a 18 3c 93 20 20 20 '....5..<...<.   '
Checksum: 0xa1

----------------

Warnings:

Block 0, Base EDID:
  Missing Display Product Name.

Failures:

Block 0, Base EDID:
  Empty Descriptor: Use Dummy Descriptor instead of all zeroes.

EDID conformity: FAIL
