edid-decode (hex):

00 ff ff ff ff ff ff 00 22 f0 01 41 01 01 00 00
1a 14 01 03 80 2f 1b 78 0a 14 25 a3 59 55 9b 26
0f 50 54 00 00 00 01 01 01 01 01 01 01 01 01 01
01 01 01 01 01 01 20 35 80 8c 70 38 14 40 3c 3c
a8 00 d6 0e 11 00 00 18 00 00 00 fe 00 52 68 69
6e 65 0a 20 20 20 20 20 20 20 00 00 00 fc 00 48
50 20 4f 6d 6e 69 2f 50 72 6f 0a 20 00 00 00 fe
00 4d 32 31 35 48 57 30 31 20 56 36 0a 20 00 32

----------------

Block 0, Base EDID:
  EDID Structure Version & Revision: 1.3
  Vendor & Product Identification:
    Manufacturer: HWP
    Model: 16641
    Serial Number: ...
    Made in: week 26 of 2010
  Basic Display Parameters & Features:
    Digital display
    Maximum image size: 47 cm x 27 cm
    Gamma: 2.20
    RGB color display
    First detailed timing is the preferred timing
  Color Characteristics:
    Red  : 0.6367, 0.3486
    Green: 0.3330, 0.6054
    Blue : 0.1484, 0.0605
    White: 0.3134, 0.3291
  Established Timings I & II: none
  Standard Timings: none
  Detailed Timing Descriptors:
    DTD 1:  1920x1080   60.017652 Hz  16:9     66.019 kHz    136.000000 MHz (470 mm x 270 mm)
                 Hfront   60 Hsync  60 Hback   20 Hpol N
                 Vfront   10 Vsync   8 Vback    2 Vpol N
    Alphanumeric Data String: 'Rhine'
    Display Product Name: 'HP Omni/Pro'
    Alphanumeric Data String: 'M215HW01 V6'
Checksum: 0x32

----------------

Failures:

Block 0, Base EDID:
  Missing Display Range Limits Descriptor.

EDID conformity: FAIL
