edid-decode (hex):

00 ff ff ff ff ff ff 00 22 f0 01 41 00 00 00 00
00 14 01 03 80 30 1b 78 2e 35 85 a6 56 48 9a 24
12 50 54 01 0a 00 d1 c0 b3 00 a9 40 a9 c0 95 00
8b c0 81 00 81 c0 02 3a 80 18 71 38 2d 40 58 2c
45 00 dd 0c 11 00 00 1e 00 00 00 fe 00 4d 32 31
35 48 57 30 31 20 56 36 0a 0a 00 00 00 fe 00 54
6f 6e 67 61 2d 65 0a 0a 0a 0a 0a 0a 00 00 00 fc
00 36 30 30 30 20 50 72 6f 20 41 69 4f 0a 00 0b

----------------

Block 0, Base EDID:
  EDID Structure Version & Revision: 1.3
  Vendor & Product Identification:
    Manufacturer: HWP
    Model: 16641
    Made in: 2010
  Basic Display Parameters & Features:
    Digital display
    Maximum image size: 48 cm x 27 cm
    Gamma: 2.20
    DPMS levels: Off
    RGB color display
    Default (sRGB) color space is primary color space
    First detailed timing is the preferred timing
  Color Characteristics:
    Red  : 0.6484, 0.3388
    Green: 0.2822, 0.6025
    Blue : 0.1425, 0.0703
    White: 0.3134, 0.3291
  Established Timings I & II:
    DMT 0x09:   800x600    60.317 Hz   4:3    37.879 kHz  40.000 MHz
    DMT 0x10:  1024x768    60.004 Hz   4:3    48.363 kHz  65.000 MHz
    DMT 0x12:  1024x768    75.029 Hz   4:3    60.023 kHz  78.750 MHz
  Standard Timings:
    DMT 0x52:  1920x1080   60.000 Hz  16:9    67.500 kHz 148.500 MHz
    DMT 0x3a:  1680x1050   59.954 Hz  16:10   65.290 kHz 146.250 MHz
    DMT 0x33:  1600x1200   60.000 Hz   4:3    75.000 kHz 162.000 MHz
    DMT 0x53:  1600x900    60.000 Hz  16:9    60.000 kHz 108.000 MHz (RB)
    DMT 0x2f:  1440x900    59.887 Hz  16:10   55.935 kHz 106.500 MHz
    GTF     :  1360x768    60.000 Hz  16:9    47.700 kHz  84.715 MHz
    DMT 0x1c:  1280x800    59.810 Hz  16:10   49.702 kHz  83.500 MHz
    DMT 0x55:  1280x720    60.000 Hz  16:9    45.000 kHz  74.250 MHz
  Detailed Timing Descriptors:
    DTD 1:  1920x1080   60.000 Hz  16:9    67.500 kHz 148.500 MHz (477 mm x 268 mm)
                 Hfront   88 Hsync  44 Hback 148 Hpol P
                 Vfront    4 Vsync   5 Vback  36 Vpol P
    Alphanumeric Data String: 'M215HW01 V6'
    Alphanumeric Data String: 'Tonga-e'
    Display Product Name: '6000 Pro AiO'
Checksum: 0x0b

----------------

Failures:

Block 0, Base EDID:
  Basic Display Parameters & Features: sRGB is signaled, but the chromaticities do not match.
  Alphanumeric Data String: Non-space after newline.
  Alphanumeric Data String: Non-space after newline.
  Missing Display Range Limits Descriptor.
EDID:
  Base EDID: GTF timings are used, but the EDID does not signal GTF support.

EDID conformity: FAIL
