
EDID (hex):
00ffffffffffff0038a31b6801010101
1216010380351e782e4ba5a359559b26
0e5054bfee00614c8180818a818c9500
8140714fb300023a801871382d40582c
4500132b2100001e000000fd00384b1f
5011000a202020202020000000fc0056
4532343032580a2020202020000000ff
0032353130383335334e430a2020003f

Extracted contents:
header:          00 ff ff ff ff ff ff 00
serial number:   38 a3 1b 68 01 01 01 01 12 16
version:         01 03
basic params:    80 35 1e 78 2e
chroma info:     4b a5 a3 59 55 9b 26 0e 50 54
established:     bf ee 00
standard:        61 4c 81 80 81 8a 81 8c 95 00 81 40 71 4f b3 00
descriptor 1:    02 3a 80 18 71 38 2d 40 58 2c 45 00 13 2b 21 00 00 1e
descriptor 2:    00 00 00 fd 00 38 4b 1f 50 11 00 0a 20 20 20 20 20 20
descriptor 3:    00 00 00 fc 00 56 45 32 34 30 32 58 0a 20 20 20 20 20
descriptor 4:    00 00 00 ff 00 32 35 31 30 38 33 35 33 4e 43 0a 20 20
extensions:      00
checksum:        3f

EDID version: 1.3
Manufacturer: NEC Model 681b Serial Number --
Made in week 18 of 2012
Digital display
Maximum image size: 53 cm x 30 cm
Gamma: 2.20
DPMS levels: Off
RGB color display
Default (sRGB) color space is primary color space
First detailed timing is preferred timing
Display x,y Chromaticity:
  Red:   0.6376, 0.3476
  Green: 0.3339, 0.6083
  Blue:  0.1503, 0.0566
  White: 0.3134, 0.3291
Established timings supported:
  720x400@70Hz 9:5 HorFreq: 31469 Hz Clock: 28.320 MHz
  640x480@60Hz 4:3 HorFreq: 31469 Hz Clock: 25.175 MHz
  640x480@67Hz 4:3 HorFreq: 35000 Hz Clock: 30.240 MHz
  640x480@72Hz 4:3 HorFreq: 37900 Hz Clock: 31.500 MHz
  640x480@75Hz 4:3 HorFreq: 37500 Hz Clock: 31.500 MHz
  800x600@56Hz 4:3 HorFreq: 35200 Hz Clock: 36.000 MHz
  800x600@60Hz 4:3 HorFreq: 37900 Hz Clock: 40.000 MHz
  800x600@72Hz 4:3 HorFreq: 48100 Hz Clock: 50.000 MHz
  800x600@75Hz 4:3 HorFreq: 46900 Hz Clock: 49.500 MHz
  832x624@75Hz 4:3 HorFreq: 49726 Hz Clock: 57.284 MHz
  1024x768@60Hz 4:3 HorFreq: 48400 Hz Clock: 65.000 MHz
  1024x768@70Hz 4:3 HorFreq: 56500 Hz Clock: 75.000 MHz
  1024x768@75Hz 4:3 HorFreq: 60000 Hz Clock: 78.750 MHz
Standard timings supported:
  1024x768@72Hz 4:3
  1280x1024@60Hz 5:4 HorFreq: 64000 Hz Clock: 108.000 MHz
  1280x1024@70Hz 5:4
  1280x1024@72Hz 5:4
  1440x900@60Hz 16:10 HorFreq: 55500 Hz Clock: 88.750 MHz
  1280x960@60Hz 4:3 HorFreq: 60000 Hz Clock: 108.000 MHz
  1152x864@75Hz 4:3 HorFreq: 67500 Hz Clock: 108.000 MHz
  1680x1050@60Hz 16:10 HorFreq: 64700 Hz Clock: 119.000 MHz
Detailed mode: Clock 148.500 MHz, 531 mm x 299 mm
               1920 2008 2052 2200 hborder 0
               1080 1084 1089 1125 vborder 0
               +hsync +vsync 
               VertFreq: 60 Hz, HorFreq: 67500 Hz
Monitor ranges (GTF): 56-75Hz V, 31-80kHz H, max dotclock 170MHz
Monitor name: VE2402X
Serial number: --
Checksum: 0x3f (valid)
EDID block does NOT conform to EDID 1.3!
	sRGB is signaled, but the chromaticities do not match
