edid-decode (hex):

00 ff ff ff ff ff ff 00 49 4e 00 19 65 02 00 00
32 1c 01 04 68 2a 1a 78 2a ee d5 a5 55 48 9b 26
12 50 54 bf ef 00 95 00 81 80 81 c0 01 01 01 01
01 01 01 01 01 01 ab 22 a0 a0 50 84 1a 30 30 20
36 00 a2 06 11 00 00 1a 00 00 00 fd 00 32 4c 1e
53 11 00 0a 20 20 20 20 20 20 00 00 00 fc 00 52
47 2d 43 50 4d 31 39 30 30 0a 20 20 00 00 00 ff
00 47 31 4d 57 43 31 35 30 30 36 31 33 36 00 4e

00 ff ff ff ff ff ff 00 49 4e 00 19 65 02 00 00
32 1c 01 04 68 2a 1a 78 2a ee d5 a5 55 48 9b 26
12 50 54 bf ef 00 95 00 81 80 81 c0 01 01 01 01
01 01 01 01 01 01 ab 22 a0 a0 50 84 1a 30 30 20
36 00 a2 06 11 00 00 1a 00 00 00 fd 00 32 4c 1e
53 11 00 0a 20 20 20 20 20 20 00 00 00 fc 00 52
47 2d 43 50 4d 31 39 30 30 0a 20 20 00 00 00 ff
00 47 31 4d 57 43 31 35 30 30 36 31 33 36 00 4e

----------------

Block 0, Base EDID:
  EDID Structure Version & Revision: 1.4
  Vendor & Product Identification:
    Manufacturer: RJN
    Model: 6400
    Serial Number: ...
    Made in: week 50 of 2018
  Basic Display Parameters & Features:
    Analog display
    Signal Level Standard: 0.700 : 0.000 : 0.700 V p-p
    Blank level equals black level
    Sync: Separate
    Maximum image size: 42 cm x 26 cm
    Gamma: 2.20
    DPMS levels: Off
    RGB color display
    First detailed timing includes the native pixel format and preferred refresh rate
  Color Characteristics:
    Red  : 0.6474, 0.3339
    Green: 0.2841, 0.6074
    Blue : 0.1513, 0.0712
    White: 0.3134, 0.3291
  Established Timings I & II:
    IBM     :   720x400    70.081663 Hz   9:5     31.467 kHz     28.320000 MHz
    DMT 0x04:   640x480    59.940476 Hz   4:3     31.469 kHz     25.175000 MHz
    Apple   :   640x480    66.666667 Hz   4:3     35.000 kHz     30.240000 MHz
    DMT 0x05:   640x480    72.808802 Hz   4:3     37.861 kHz     31.500000 MHz
    DMT 0x06:   640x480    75.000000 Hz   4:3     37.500 kHz     31.500000 MHz
    DMT 0x08:   800x600    56.250000 Hz   4:3     35.156 kHz     36.000000 MHz
    DMT 0x09:   800x600    60.316541 Hz   4:3     37.879 kHz     40.000000 MHz
    DMT 0x0a:   800x600    72.187572 Hz   4:3     48.077 kHz     50.000000 MHz
    DMT 0x0b:   800x600    75.000000 Hz   4:3     46.875 kHz     49.500000 MHz
    Apple   :   832x624    74.551266 Hz   4:3     49.726 kHz     57.284000 MHz
    DMT 0x10:  1024x768    60.003840 Hz   4:3     48.363 kHz     65.000000 MHz
    DMT 0x11:  1024x768    70.069359 Hz   4:3     56.476 kHz     75.000000 MHz
    DMT 0x12:  1024x768    75.028582 Hz   4:3     60.023 kHz     78.750000 MHz
    DMT 0x24:  1280x1024   75.024675 Hz   5:4     79.976 kHz    135.000000 MHz
  Standard Timings:
    DMT 0x2f:  1440x900    59.887445 Hz  16:10    55.935 kHz    106.500000 MHz
    DMT 0x23:  1280x1024   60.019740 Hz   5:4     63.981 kHz    108.000000 MHz
    DMT 0x55:  1280x720    60.000000 Hz  16:9     45.000 kHz     74.250000 MHz
  Detailed Timing Descriptors:
    DTD 1:  1440x900    59.901458 Hz  16:10    55.469 kHz     88.750000 MHz (418 mm x 262 mm)
                 Hfront   48 Hsync  32 Hback   80 Hpol P
                 Vfront    3 Vsync   6 Vback   17 Vpol N
    Display Range Limits:
      Monitor ranges (GTF): 50-76 Hz V, 30-83 kHz H, max dotclock 170 MHz
    Display Product Name: 'RG-CPM1900'
    Display Product Serial Number: ...
Checksum: 0x4e

----------------

Block 1, Unknown EDID Extension Block 0x00:
  00 ff ff ff ff ff ff 00 49 4e 00 19 65 02 00 00 '........IN..e...'
  32 1c 01 04 68 2a 1a 78 2a ee d5 a5 55 48 9b 26 '2...h*.x*...UH.&'
  12 50 54 bf ef 00 95 00 81 80 81 c0 01 01 01 01 '.PT.............'
  01 01 01 01 01 01 ab 22 a0 a0 50 84 1a 30 30 20 '......."..P..00 '
  36 00 a2 06 11 00 00 1a 00 00 00 fd 00 32 4c 1e '6............2L.'
  53 11 00 0a 20 20 20 20 20 20 00 00 00 fc 00 52 'S...      .....R'
  47 2d 43 50 4d 31 39 30 30 0a 20 20 00 00 00 ff 'G-CPM1900.  ....'
  00 47 31 4d 57 43 31 35 30 30 36 31 33 36 00 4e '.G1MWC15006136.N'
Checksum: 0x4e

----------------

Warnings:

Block 0, Base EDID:
  Display Range Limits: GTF support is deprecated in EDID 1.4.

Failures:

Block 0, Base EDID:
  Display Range Limits: GTF can't be combined with non-continuous frequencies.
Block 1, Base EDID:
  Unknown Extension Block.
EDID:
  Base EDID: EDID specified 0 extension block(s), but found 1 extension block(s).

EDID conformity: FAIL
