
EDID (hex):
00ffffffffffff00320c00d800000000
00100103802115780ab3409959538d27
25505400000001010101010101010101
010101010101bc1b00a0502017303020
36004bcf100000190000000000000000
00000000000000000000000000fe004c
475068696c6970734c43440a000000fe
004c503135345758342d544c43320048

Extracted contents:
header:          00 ff ff ff ff ff ff 00
serial number:   32 0c 00 d8 00 00 00 00 00 10
version:         01 03
basic params:    80 21 15 78 0a
chroma info:     b3 40 99 59 53 8d 27 25 50 54
established:     00 00 00
standard:        01 01 01 01 01 01 01 01 01 01 01 01 01 01 01 01
descriptor 1:    bc 1b 00 a0 50 20 17 30 30 20 36 00 4b cf 10 00 00 19
descriptor 2:    00 00 00 00 00 00 00 00 00 00 00 00 00 00 00 00 00 00
descriptor 3:    00 00 00 fe 00 4c 47 50 68 69 6c 69 70 73 4c 43 44 0a
descriptor 4:    00 00 00 fe 00 4c 50 31 35 34 57 58 34 2d 54 4c 43 32
extensions:      00
checksum:        48

EDID version: 1.3
Manufacturer: LPL Model d800 Serial Number --
Made in year 2006
Digital display
Maximum image size: 33 cm x 21 cm
Gamma: 2.20
RGB color display
First detailed timing is preferred timing
Display x,y Chromaticity:
  Red:   0.5996, 0.3505
  Green: 0.3242, 0.5537
  Blue:  0.1533, 0.1445
  White: 0.3125, 0.3281
Established timings supported:
Standard timings supported:
Detailed mode: Clock 71.000 MHz, 331 mm x 207 mm
               1280 1328 1360 1440 hborder 0
                800  803  809  823 vborder 0
               -hsync -vsync 
               VertFreq: 59 Hz, HorFreq: 49305 Hz
Manufacturer-specified data, tag 0
ASCII string: LGPhilipsLCD
ASCII string: LP154WX4-TLC2
Checksum: 0x48 (valid)
EDID block does NOT conform to EDID 1.3!
	Missing name descriptor
	Missing monitor ranges
