
EDID (hex):
00ffffffffffff0034a4024600000000
3217010380341d782aa3d0a45751a025
105054afef00714f818081009500b300
010101010101023a801871382d40582c
450009252100001e302a40c860846430
1850130009252100001e000000fd0038
4b1e5112000a202020202020000000fc
004d4432303436310a202020202000df

Extracted contents:
header:          00 ff ff ff ff ff ff 00
serial number:   34 a4 02 46 00 00 00 00 32 17
version:         01 03
basic params:    80 34 1d 78 2a
chroma info:     a3 d0 a4 57 51 a0 25 10 50 54
established:     af ef 00
standard:        71 4f 81 80 81 00 95 00 b3 00 01 01 01 01 01 01
descriptor 1:    02 3a 80 18 71 38 2d 40 58 2c 45 00 09 25 21 00 00 1e
descriptor 2:    30 2a 40 c8 60 84 64 30 18 50 13 00 09 25 21 00 00 1e
descriptor 3:    00 00 00 fd 00 38 4b 1e 51 12 00 0a 20 20 20 20 20 20
descriptor 4:    00 00 00 fc 00 4d 44 32 30 34 36 31 0a 20 20 20 20 20
extensions:      00
checksum:        df

EDID version: 1.3
Manufacturer: MED Model 4602 Serial Number --
Made in week 50 of 2013
Digital display
Maximum image size: 52 cm x 29 cm
Gamma: 2.20
DPMS levels: Off
RGB color display
First detailed timing is preferred timing
Display x,y Chromaticity:
  Red:   0.6425, 0.3417
  Green: 0.3164, 0.6279
  Blue:  0.1474, 0.0634
  White: 0.3125, 0.3281
Established timings supported:
  720x400@70Hz 9:5 HorFreq: 31469 Hz Clock: 28.320 MHz
  640x480@60Hz 4:3 HorFreq: 31469 Hz Clock: 25.175 MHz
  640x480@72Hz 4:3 HorFreq: 37900 Hz Clock: 31.500 MHz
  640x480@75Hz 4:3 HorFreq: 37500 Hz Clock: 31.500 MHz
  800x600@56Hz 4:3 HorFreq: 35200 Hz Clock: 36.000 MHz
  800x600@60Hz 4:3 HorFreq: 37900 Hz Clock: 40.000 MHz
  800x600@72Hz 4:3 HorFreq: 48100 Hz Clock: 50.000 MHz
  800x600@75Hz 4:3 HorFreq: 46900 Hz Clock: 49.500 MHz
  832x624@75Hz 4:3 HorFreq: 49726 Hz Clock: 57.284 MHz
  1024x768@60Hz 4:3 HorFreq: 48400 Hz Clock: 65.000 MHz
  1024x768@70Hz 4:3 HorFreq: 56500 Hz Clock: 75.000 MHz
  1024x768@75Hz 4:3 HorFreq: 60000 Hz Clock: 78.750 MHz
  1280x1024@75Hz 5:4 HorFreq: 80000 Hz Clock: 135.000 MHz
Standard timings supported:
  1152x864@75Hz 4:3 HorFreq: 67500 Hz Clock: 108.000 MHz
  1280x1024@60Hz 5:4 HorFreq: 64000 Hz Clock: 108.000 MHz
  1280x800@60Hz 16:10
  1440x900@60Hz 16:10 HorFreq: 55500 Hz Clock: 88.750 MHz
  1680x1050@60Hz 16:10 HorFreq: 64700 Hz Clock: 119.000 MHz
Detailed mode: Clock 148.500 MHz, 521 mm x 293 mm
               1920 2008 2052 2200 hborder 0
               1080 1084 1089 1125 vborder 0
               +hsync +vsync 
               VertFreq: 60 Hz, HorFreq: 67500 Hz
Detailed mode: Clock 108.000 MHz, 521 mm x 293 mm
               1600 1624 1704 1800 hborder 0
                900  901  904 1000 vborder 0
               +hsync +vsync 
               VertFreq: 60 Hz, HorFreq: 60000 Hz
Monitor ranges (GTF): 56-75Hz V, 30-81kHz H, max dotclock 180MHz
Monitor name: MD20461
Checksum: 0xdf (valid)
