edid-decode (hex):

00 ff ff ff ff ff ff 00 0e 6f 18 14 00 00 00 00
00 20 01 04 b5 1f 14 78 03 05 55 ab 51 44 b0 26
0f 50 54 00 00 00 01 01 01 01 01 01 01 01 01 01
01 01 01 01 01 01 69 9d 00 a0 c0 80 9e 70 30 20
36 00 38 c3 10 00 00 18 00 00 00 fd 0c 30 a5 58
58 6f 01 0a 20 20 20 20 20 20 00 00 00 fe 00 43
53 4f 54 20 54 33 0a 20 20 20 20 20 00 00 00 fe
00 4d 4e 45 35 30 37 48 5a 32 2d 31 0a 20 02 dd

02 03 1d 00 e3 05 80 00 e6 06 05 01 93 93 11 6d
1a 00 00 02 0b 30 a5 00 04 93 11 93 11 00 00 00
00 00 00 00 00 00 00 00 00 00 00 00 00 00 00 00
00 00 00 00 00 00 00 00 00 00 00 00 00 00 00 00
00 00 00 00 00 00 00 00 00 00 00 00 00 00 00 00
00 00 00 00 00 00 00 00 00 00 00 00 00 00 00 00
00 00 00 00 00 00 00 00 00 00 00 00 00 00 00 00
00 00 00 00 00 00 00 00 00 00 00 00 00 00 9a fe

70 12 79 00 00 03 01 14 e0 b0 01 05 ff 0b 9f 00
2f 00 1f 00 7f 07 9d 00 02 00 05 00 00 00 00 00
00 00 00 00 00 00 00 00 00 00 00 00 00 00 00 00
00 00 00 00 00 00 00 00 00 00 00 00 00 00 00 00
00 00 00 00 00 00 00 00 00 00 00 00 00 00 00 00
00 00 00 00 00 00 00 00 00 00 00 00 00 00 00 00
00 00 00 00 00 00 00 00 00 00 00 00 00 00 00 00
00 00 00 00 00 00 00 00 00 00 00 00 00 00 a6 90

00 ff ff ff ff ff ff 00 0e 6f 18 14 00 00 00 00
00 20 01 04 b5 1f 14 78 03 05 55 ab 51 44 b0 26
0f 50 54 00 00 00 01 01 01 01 01 01 01 01 01 01
01 01 01 01 01 01 69 9d 00 a0 c0 80 9e 70 30 20
36 00 38 c3 10 00 00 18 00 00 00 fd 0c 30 a5 58
58 6f 01 0a 20 20 20 20 20 20 00 00 00 fe 00 43
53 4f 54 20 54 33 0a 20 20 20 20 20 00 00 00 fe
00 4d 4e 45 35 30 37 48 5a 32 2d 31 0a 20 02 dd

02 03 1d 00 e3 05 80 00 e6 06 05 01 93 93 11 6d
1a 00 00 02 0b 30 a5 00 04 93 11 93 11 00 00 00
00 00 00 00 00 00 00 00 00 00 00 00 00 00 00 00
00 00 00 00 00 00 00 00 00 00 00 00 00 00 00 00
00 00 00 00 00 00 00 00 00 00 00 00 00 00 00 00
00 00 00 00 00 00 00 00 00 00 00 00 00 00 00 00
00 00 00 00 00 00 00 00 00 00 00 00 00 00 00 00
00 00 00 00 00 00 00 00 00 00 00 00 00 00 9a fe

70 12 79 00 00 03 01 14 e0 b0 01 05 ff 0b 9f 00
2f 00 1f 00 7f 07 9d 00 02 00 05 00 00 00 00 00
00 00 00 00 00 00 00 00 00 00 00 00 00 00 00 00
00 00 00 00 00 00 00 00 00 00 00 00 00 00 00 00
00 00 00 00 00 00 00 00 00 00 00 00 00 00 00 00
00 00 00 00 00 00 00 00 00 00 00 00 00 00 00 00
00 00 00 00 00 00 00 00 00 00 00 00 00 00 00 00
00 00 00 00 00 00 00 00 00 00 00 00 00 00 a6 90

----------------

Block 0, Base EDID:
  EDID Structure Version & Revision: 1.4
  Vendor & Product Identification:
    Manufacturer: CSO
    Model: 5144
    Made in: 2022
  Basic Display Parameters & Features:
    Digital display
    Bits per primary color channel: 10
    DisplayPort interface
    Maximum image size: 31 cm x 20 cm
    Gamma: 2.20
    Supported color formats: RGB 4:4:4
    First detailed timing includes the native pixel format and preferred refresh rate
    Display is continuous frequency
  Color Characteristics:
    Red  : 0.6679, 0.3164
    Green: 0.2666, 0.6884
    Blue : 0.1494, 0.0595
    White: 0.3134, 0.3291
  Established Timings I & II: none
  Standard Timings: none
  Detailed Timing Descriptors:
    DTD 1:  3072x1920   60.000631 Hz  16:10   124.681 kHz    402.970000 MHz (312 mm x 195 mm)
                 Hfront   48 Hsync  32 Hback   80 Hpol N
                 Vfront    3 Vsync   6 Vback  149 Vpol N
    Display Range Limits:
      Monitor ranges (Bare Limits): 48-165 Hz V, 343-343 kHz H, max dotclock 1110 MHz
    Alphanumeric Data String: 'CSOT T3'
    Alphanumeric Data String: 'MNE507HZ2-1'
  Extension blocks: 2
Checksum: 0xdd

----------------

Block 1, CTA-861 Extension Block:
  Revision: 3
  Native detailed modes: 0
  Colorimetry Data Block:
    BT2020RGB
  HDR Static Metadata Data Block:
    Electro optical transfer functions:
      Traditional gamma - SDR luminance range
      SMPTE ST2084
    Supported static metadata descriptors:
      Static metadata type 1
    Desired content max luminance: 147 (1207.332 cd/m^2)
    Desired content max frame-average luminance: 147 (1207.332 cd/m^2)
    Desired content min luminance: 17 (0.054 cd/m^2)
  Vendor-Specific Data Block (AMD), OUI 00-00-1A:
    Version: 2.11
    Minimum Refresh Rate: 48 Hz
    Maximum Refresh Rate: 165 Hz
    Flags 1.x: 0x00
    Flags 2.x: 0x04
    Maximum luminance: 147 (1207.332 cd/m^2)
    Minimum luminance: 17 (0.054 cd/m^2)
    Maximum luminance (without local dimming): 147 (1207.332 cd/m^2)
    Minimum luminance (without local dimming): 17 (0.054 cd/m^2)
Checksum: 0xfe  Unused space in Extension Block: 98 bytes

----------------

Block 2, DisplayID Extension Block:
  Version: 1.2
  Extension Count: 0
  Display Product Type: Extension Section
  Video Timing Modes Type 1 - Detailed Timings Data Block:
    DTD:  3072x1920  165.002108 Hz  16:10   342.874 kHz   1108.170000 MHz (aspect 16:10, no 3D stereo)
               Hfront   48 Hsync  32 Hback   80 Hpol N
               Vfront    3 Vsync   6 Vback  149 Vpol N
  Checksum: 0xa6
Checksum: 0x90

----------------

Block 3, Unknown EDID Extension Block 0x00:
  00 ff ff ff ff ff ff 00 0e 6f 18 14 00 00 00 00 '.........o......'
  00 20 01 04 b5 1f 14 78 03 05 55 ab 51 44 b0 26 '. .....x..U.QD.&'
  0f 50 54 00 00 00 01 01 01 01 01 01 01 01 01 01 '.PT.............'
  01 01 01 01 01 01 69 9d 00 a0 c0 80 9e 70 30 20 '......i......p0 '
  36 00 38 c3 10 00 00 18 00 00 00 fd 0c 30 a5 58 '6.8..........0.X'
  58 6f 01 0a 20 20 20 20 20 20 00 00 00 fe 00 43 'Xo..      .....C'
  53 4f 54 20 54 33 0a 20 20 20 20 20 00 00 00 fe 'SOT T3.     ....'
  00 4d 4e 45 35 30 37 48 5a 32 2d 31 0a 20 02 dd '.MNE507HZ2-1. ..'
Checksum: 0xdd

----------------

Block 4, CTA-861 Extension Block:
  Revision: 3
  Native detailed modes: 0
  Colorimetry Data Block:
    BT2020RGB
  HDR Static Metadata Data Block:
    Electro optical transfer functions:
      Traditional gamma - SDR luminance range
      SMPTE ST2084
    Supported static metadata descriptors:
      Static metadata type 1
    Desired content max luminance: 147 (1207.332 cd/m^2)
    Desired content max frame-average luminance: 147 (1207.332 cd/m^2)
    Desired content min luminance: 17 (0.054 cd/m^2)
  Vendor-Specific Data Block (AMD), OUI 00-00-1A:
    Version: 2.11
    Minimum Refresh Rate: 48 Hz
    Maximum Refresh Rate: 165 Hz
    Flags 1.x: 0x00
    Flags 2.x: 0x04
    Maximum luminance: 147 (1207.332 cd/m^2)
    Minimum luminance: 17 (0.054 cd/m^2)
    Maximum luminance (without local dimming): 147 (1207.332 cd/m^2)
    Minimum luminance (without local dimming): 17 (0.054 cd/m^2)
Checksum: 0xfe  Unused space in Extension Block: 98 bytes

----------------

Block 5, DisplayID Extension Block:
  Version: 1.2
  Extension Count: 0
  Video Timing Modes Type 1 - Detailed Timings Data Block:
    DTD:  3072x1920  165.002108 Hz  16:10   342.874 kHz   1108.170000 MHz (aspect 16:10, no 3D stereo)
               Hfront   48 Hsync  32 Hback   80 Hpol N
               Vfront    3 Vsync   6 Vback  149 Vpol N
  Checksum: 0xa6
Checksum: 0x90

----------------

Warnings:

Block 0, Base EDID:
  Missing Display Product Name.
Block 1, CTA-861 Extension Block:
  IT Video Formats are overscanned by default, but normally this should be underscanned.
  Colorimetry Data Block: Set the sRGB colorimetry bit to avoid interop issues.
Block 4, CTA-861 Extension Block:
  IT Video Formats are overscanned by default, but normally this should be underscanned.
  Colorimetry Data Block: Set the sRGB colorimetry bit to avoid interop issues.
EDID:
  Base EDID: Some timings are out of range of the Monitor Ranges:
    Horizontal Freq: 124.681 - 342.874 kHz (Monitor: 343.000 - 343.000 kHz)

Failures:

Block 1, CTA-861 Extension Block:
  Padding: Contains non-zero bytes.
  Required 640x480p60 timings are missing in the established timings and the SVD list (VIC 1).
  Missing VCDB, needed for Set Selectable RGB Quantization to avoid interop issues.
Block 2, DisplayID Extension Block:
  DisplayID Base Block has no product type.
  Expected 0 DisplayID Extension Block, but got 1.
Block 3, Base EDID:
  Unknown Extension Block.
Block 4, CTA-861 Extension Block:
  Colorimetry Data Block: Only one instance of this Data Block is allowed.
  HDR Static Metadata Data Block: Only one instance of this Data Block is allowed.
  Padding: Contains non-zero bytes.
  Required 640x480p60 timings are missing in the established timings and the SVD list (VIC 1).
  Missing VCDB, needed for Set Selectable RGB Quantization to avoid interop issues.
EDID:
  Base EDID: EDID specified 2 extension block(s), but found 5 extension block(s).
  DisplayID: Missing DisplayID Product Identification Data Block.
  DisplayID: DisplayID expects at least one preferred timing.

EDID conformity: FAIL
