edid-decode (hex):

00 ff ff ff ff ff ff 00 4d 10 2c 14 00 00 00 00
30 18 01 04 a5 1c 10 78 06 de 50 a3 54 4c 99 26
0f 50 54 00 00 00 01 01 01 01 01 01 01 01 01 01
01 01 01 01 01 01 56 5e 00 a0 a0 a0 28 50 30 20
25 00 15 9b 10 00 00 18 7a 4b 00 a0 a0 a0 28 50
30 20 25 00 15 9b 10 00 00 18 00 00 00 10 00 00
00 00 00 00 00 00 00 00 00 00 00 00 00 00 00 fc
00 4c 51 31 32 35 54 31 4a 58 30 33 0a 20 00 22

----------------

Block 0, Base EDID:
  EDID Structure Version & Revision: 1.4
  Vendor & Product Identification:
    Manufacturer: SHP
    Model: 5164
    Made in: week 48 of 2014
  Basic Display Parameters & Features:
    Digital display
    Bits per primary color channel: 8
    DisplayPort interface
    Maximum image size: 28 cm x 16 cm
    Gamma: 2.20
    Supported color formats: RGB 4:4:4
    Default (sRGB) color space is primary color space
    First detailed timing includes the native pixel format and preferred refresh rate
  Color Characteristics:
    Red  : 0.6396, 0.3291
    Green: 0.2998, 0.5996
    Blue : 0.1494, 0.0595
    White: 0.3125, 0.3281
  Established Timings I & II: none
  Standard Timings: none
  Detailed Timing Descriptors:
    DTD 1:  2560x1440   59.991057 Hz  16:9     88.787 kHz    241.500000 MHz (277 mm x 155 mm)
                 Hfront   48 Hsync  32 Hback   80 Hpol N
                 Vfront    2 Vsync   5 Vback   33 Vpol N
    DTD 2:  2560x1440   47.997814 Hz  16:9     71.037 kHz    193.220000 MHz (277 mm x 155 mm)
                 Hfront   48 Hsync  32 Hback   80 Hpol N
                 Vfront    2 Vsync   5 Vback   33 Vpol N
    Dummy Descriptor:
    Display Product Name: 'LQ125T1JX03'
Checksum: 0x22

----------------

Failures:

Block 0, Base EDID:
  Basic Display Parameters & Features: sRGB is signaled, but the chromaticities do not match.

EDID conformity: FAIL
