edid-decode (hex):

00 ff ff ff ff ff ff 00 09 e5 d7 07 00 00 00 00
01 1c 01 04 a5 1d 11 78 0a 1d b0 a6 58 54 9e 26
0f 50 54 00 00 00 01 01 01 01 01 01 01 01 01 01
01 01 01 01 01 01 bc 39 80 18 71 38 28 40 30 20
36 00 26 a5 10 00 00 1a 00 00 00 00 00 00 00 00
00 00 00 00 00 00 00 00 00 1a 00 00 00 fe 00 42
4f 45 20 43 51 0a 20 20 20 20 20 20 00 00 00 fe
00 4e 56 31 33 33 46 48 4d 2d 4e 36 41 0a 00 88

----------------

Block 0, Base EDID:
  EDID Structure Version & Revision: 1.4
  Vendor & Product Identification:
    Manufacturer: BOE
    Model: 2007
    Made in: week 1 of 2018
  Basic Display Parameters & Features:
    Digital display
    Bits per primary color channel: 8
    DisplayPort interface
    Maximum image size: 29 cm x 17 cm
    Gamma: 2.20
    Supported color formats: RGB 4:4:4, YCrCb 4:4:4
    First detailed timing includes the native pixel format and preferred refresh rate
  Color Characteristics:
    Red  : 0.6484, 0.3447
    Green: 0.3310, 0.6181
    Blue : 0.1503, 0.0615
    White: 0.3125, 0.3281
  Established Timings I & II: none
  Standard Timings: none
  Detailed Timing Descriptors:
    DTD 1:  1920x1080   59.984 Hz  16:9    67.182 kHz 147.800 MHz (294 mm x 165 mm)
                 Hfront   48 Hsync  32 Hback 200 Hpol P
                 Vfront    3 Vsync   6 Vback  31 Vpol N
    Manufacturer-Specified Display Descriptor (0x00): 00 00 00 00 00 00 00 00 00 00 00 00 00 00 00 1a '................'
    Alphanumeric Data String: 'BOE CQ'
    Alphanumeric Data String: 'NV133FHM-N6A'
Checksum: 0x88
