
EDID (hex):
00ffffffffffff001e6da84ba3a60300
091301036a291a78ea8585a6574a9c26
125054a76f80950f9500818071470101
0101010101019a29a0d0518422305098
360098ff1000001c000000fd00384b1e
530e000a202020202020000000fc0057
313935340a20202020202020000000fc
000a202020202020202020202020001a

Extracted contents:
header:          00 ff ff ff ff ff ff 00
serial number:   1e 6d a8 4b a3 a6 03 00 09 13
version:         01 03
basic params:    6a 29 1a 78 ea
chroma info:     85 85 a6 57 4a 9c 26 12 50 54
established:     a7 6f 80
standard:        95 0f 95 00 81 80 71 47 01 01 01 01 01 01 01 01
descriptor 1:    9a 29 a0 d0 51 84 22 30 50 98 36 00 98 ff 10 00 00 1c
descriptor 2:    00 00 00 fd 00 38 4b 1e 53 0e 00 0a 20 20 20 20 20 20
descriptor 3:    00 00 00 fc 00 57 31 39 35 34 0a 20 20 20 20 20 20 20
descriptor 4:    00 00 00 fc 00 0a 20 20 20 20 20 20 20 20 20 20 20 20
extensions:      00
checksum:        1a

EDID version: 1.3
Manufacturer: GSM Model 4ba8 Serial Number --
Made in week 9 of 2009
Analog display, Input voltage level: 0.7/0.7 V
Sync: Separate SyncOnGreen 
Maximum image size: 41 cm x 26 cm
Gamma: 2.20
DPMS levels: Standby Suspend Off
RGB color display
First detailed timing is preferred timing
Display x,y Chromaticity:
  Red:   0.6503, 0.3398
  Green: 0.2900, 0.6103
  Blue:  0.1503, 0.0703
  White: 0.3134, 0.3291
Established timings supported:
  720x400@70Hz 9:5 HorFreq: 31469 Hz Clock: 28.320 MHz
  640x480@60Hz 4:3 HorFreq: 31469 Hz Clock: 25.175 MHz
  640x480@75Hz 4:3 HorFreq: 37500 Hz Clock: 31.500 MHz
  800x600@56Hz 4:3 HorFreq: 35200 Hz Clock: 36.000 MHz
  800x600@60Hz 4:3 HorFreq: 37900 Hz Clock: 40.000 MHz
  800x600@75Hz 4:3 HorFreq: 46900 Hz Clock: 49.500 MHz
  832x624@75Hz 4:3 HorFreq: 49726 Hz Clock: 57.284 MHz
  1024x768@60Hz 4:3 HorFreq: 48400 Hz Clock: 65.000 MHz
  1024x768@70Hz 4:3 HorFreq: 56500 Hz Clock: 75.000 MHz
  1024x768@75Hz 4:3 HorFreq: 60000 Hz Clock: 78.750 MHz
  1280x1024@75Hz 5:4 HorFreq: 80000 Hz Clock: 135.000 MHz
  1152x870@75Hz 192:145 HorFreq: 67500 Hz Clock: 108.000 MHz
Standard timings supported:
  1440x900@75Hz 16:10 HorFreq: 82300 Hz Clock: 156.000 MHz
  1440x900@60Hz 16:10 HorFreq: 55500 Hz Clock: 88.750 MHz
  1280x1024@60Hz 5:4 HorFreq: 64000 Hz Clock: 108.000 MHz
  1152x864@67Hz 4:3
Detailed mode: Clock 106.500 MHz, 408 mm x 255 mm
               1440 1520 1672 1904 hborder 0
                900  903  909  934 vborder 0
               -hsync +vsync 
               VertFreq: 59 Hz, HorFreq: 55934 Hz
Monitor ranges (GTF): 56-75Hz V, 30-83kHz H, max dotclock 140MHz
Monitor name: W1954
Checksum: 0x1a (valid)
One or more of the timings is out of range of the Monitor Ranges:
  Vertical Freq: 56 - 75 Hz
  Horizontal Freq: 31469 - 82300 Hz
  Maximum Clock: 156.000 MHz
