
EDID (hex):
00ffffffffffff005c54002800000000
13210104c53f217829ea15ac50459f26
0e5054bfef00d1c0b300a9c095008180
810081c0d1cf50d000a0f0703e803020
3500764a2100001e000000fc00474f50
3238554844313434490a000000fd0030
90ffff8c010a202020202020000000ff
000a202020202020202020202020020d
02032af24f610102030410131f292f3f
4060101fe200c023097f0783010000e3
05c000e6060501626200023a80187138
2d40582c2500764a2100001e565e00a0
a0a0295030203500764a2100001e0476
00a0a0a0295030203500764a2100001e
00000000000000000000000000000000
000000000000000000000000000000cd
70123f000003003c11f90104ff0e0301
57002b006f081d0002000f004b7a0104
ff0e2f02af0057006f08280002000f00
9fa00104ff0ec7002f001f006f082700
02000f00560000000000000000000000
00000000000000000000000000000000
00000000000000000000000000000000
00000000000000000000000000000090

edid-decode (hex):

00 ff ff ff ff ff ff 00 5c 54 00 28 00 00 00 00
13 21 01 04 c5 3f 21 78 29 ea 15 ac 50 45 9f 26
0e 50 54 bf ef 00 d1 c0 b3 00 a9 c0 95 00 81 80
81 00 81 c0 d1 cf 50 d0 00 a0 f0 70 3e 80 30 20
35 00 76 4a 21 00 00 1e 00 00 00 fc 00 47 4f 50
32 38 55 48 44 31 34 34 49 0a 00 00 00 fd 00 30
90 ff ff 8c 01 0a 20 20 20 20 20 20 00 00 00 ff
00 0a 20 20 20 20 20 20 20 20 20 20 20 20 02 0d

02 03 2a f2 4f 61 01 02 03 04 10 13 1f 29 2f 3f
40 60 10 1f e2 00 c0 23 09 7f 07 83 01 00 00 e3
05 c0 00 e6 06 05 01 62 62 00 02 3a 80 18 71 38
2d 40 58 2c 25 00 76 4a 21 00 00 1e 56 5e 00 a0
a0 a0 29 50 30 20 35 00 76 4a 21 00 00 1e 04 76
00 a0 a0 a0 29 50 30 20 35 00 76 4a 21 00 00 1e
00 00 00 00 00 00 00 00 00 00 00 00 00 00 00 00
00 00 00 00 00 00 00 00 00 00 00 00 00 00 00 cd

70 12 3f 00 00 03 00 3c 11 f9 01 04 ff 0e 03 01
57 00 2b 00 6f 08 1d 00 02 00 0f 00 4b 7a 01 04
ff 0e 2f 02 af 00 57 00 6f 08 28 00 02 00 0f 00
9f a0 01 04 ff 0e c7 00 2f 00 1f 00 6f 08 27 00
02 00 0f 00 56 00 00 00 00 00 00 00 00 00 00 00
00 00 00 00 00 00 00 00 00 00 00 00 00 00 00 00
00 00 00 00 00 00 00 00 00 00 00 00 00 00 00 00
00 00 00 00 00 00 00 00 00 00 00 00 00 00 00 90

----------------

Block 0, Base EDID:
  EDID Structure Version & Revision: 1.4
  Vendor & Product Identification:
    Manufacturer: WBT
    Model: 10240
    Made in: week 19 of 2023
  Basic Display Parameters & Features:
    Digital display
    Bits per primary color channel: 12
    DisplayPort interface
    Maximum image size: 63 cm x 33 cm
    Gamma: 2.20
    DPMS levels: Off
    Supported color formats: RGB 4:4:4, YCrCb 4:4:4
    First detailed timing does not include the native pixel format and preferred refresh rate
    Display is continuous frequency
  Color Characteristics:
    Red  : 0.6748, 0.3144
    Green: 0.2714, 0.6230
    Blue : 0.1484, 0.0556
    White: 0.3134, 0.3291
  Established Timings I & II:
    IBM     :   720x400    70.081663 Hz   9:5     31.467 kHz     28.320000 MHz
    DMT 0x04:   640x480    59.940476 Hz   4:3     31.469 kHz     25.175000 MHz
    Apple   :   640x480    66.666667 Hz   4:3     35.000 kHz     30.240000 MHz
    DMT 0x05:   640x480    72.808802 Hz   4:3     37.861 kHz     31.500000 MHz
    DMT 0x06:   640x480    75.000000 Hz   4:3     37.500 kHz     31.500000 MHz
    DMT 0x08:   800x600    56.250000 Hz   4:3     35.156 kHz     36.000000 MHz
    DMT 0x09:   800x600    60.316541 Hz   4:3     37.879 kHz     40.000000 MHz
    DMT 0x0a:   800x600    72.187572 Hz   4:3     48.077 kHz     50.000000 MHz
    DMT 0x0b:   800x600    75.000000 Hz   4:3     46.875 kHz     49.500000 MHz
    Apple   :   832x624    74.551266 Hz   4:3     49.726 kHz     57.284000 MHz
    DMT 0x10:  1024x768    60.003840 Hz   4:3     48.363 kHz     65.000000 MHz
    DMT 0x11:  1024x768    70.069359 Hz   4:3     56.476 kHz     75.000000 MHz
    DMT 0x12:  1024x768    75.028582 Hz   4:3     60.023 kHz     78.750000 MHz
    DMT 0x24:  1280x1024   75.024675 Hz   5:4     79.976 kHz    135.000000 MHz
  Standard Timings:
    DMT 0x52:  1920x1080   60.000000 Hz  16:9     67.500 kHz    148.500000 MHz
    DMT 0x3a:  1680x1050   59.954250 Hz  16:10    65.290 kHz    146.250000 MHz
    DMT 0x53:  1600x900    60.000000 Hz  16:9     60.000 kHz    108.000000 MHz (RB)
    DMT 0x2f:  1440x900    59.887445 Hz  16:10    55.935 kHz    106.500000 MHz
    DMT 0x23:  1280x1024   60.019740 Hz   5:4     63.981 kHz    108.000000 MHz
    DMT 0x1c:  1280x800    59.810326 Hz  16:10    49.702 kHz     83.500000 MHz
    DMT 0x55:  1280x720    60.000000 Hz  16:9     45.000 kHz     74.250000 MHz
    GTF     :  1920x1080   75.000068 Hz  16:9     84.600 kHz    220.637000 MHz
  Detailed Timing Descriptors:
    DTD 1:  3840x2160   60.000000 Hz  16:9    133.320 kHz    533.280000 MHz (630 mm x 330 mm)
                 Hfront   48 Hsync  32 Hback   80 Hpol P
                 Vfront    3 Vsync   5 Vback   54 Vpol P
    Display Product Name: 'GOP28UHD144I'
    Display Range Limits:
      Monitor ranges (Bare Limits): 48-144 Hz V, 255-255 kHz H, max dotclock 1400 MHz
    Display Product Serial Number: ''
  Extension blocks: 2
Checksum: 0x0d

----------------

Block 1, CTA-861 Extension Block:
  Revision: 3
  Underscans IT Video Formats by default
  Basic audio support
  Supports YCbCr 4:4:4
  Supports YCbCr 4:2:2
  Native detailed modes: 2
  Video Data Block:
    VIC  97:  3840x2160   60.000000 Hz  16:9    135.000 kHz    594.000000 MHz
    VIC   1:   640x480    59.940476 Hz   4:3     31.469 kHz     25.175000 MHz
    VIC   2:   720x480    59.940060 Hz   4:3     31.469 kHz     27.000000 MHz
    VIC   3:   720x480    59.940060 Hz  16:9     31.469 kHz     27.000000 MHz
    VIC   4:  1280x720    60.000000 Hz  16:9     45.000 kHz     74.250000 MHz
    VIC  16:  1920x1080   60.000000 Hz  16:9     67.500 kHz    148.500000 MHz
    VIC  19:  1280x720    50.000000 Hz  16:9     37.500 kHz     74.250000 MHz
    VIC  31:  1920x1080   50.000000 Hz  16:9     56.250 kHz    148.500000 MHz
    VIC  41:  1280x720   100.000000 Hz  16:9     75.000 kHz    148.500000 MHz
    VIC  47:  1280x720   120.000000 Hz  16:9     90.000 kHz    148.500000 MHz
    VIC  63:  1920x1080  120.000000 Hz  16:9    135.000 kHz    297.000000 MHz
    VIC  64:  1920x1080  100.000000 Hz  16:9    112.500 kHz    297.000000 MHz
    VIC  96:  3840x2160   50.000000 Hz  16:9    112.500 kHz    594.000000 MHz
    VIC  16:  1920x1080   60.000000 Hz  16:9     67.500 kHz    148.500000 MHz
    VIC  31:  1920x1080   50.000000 Hz  16:9     56.250 kHz    148.500000 MHz
  Video Capability Data Block:
    YCbCr quantization: Selectable (via AVI YQ)
    RGB quantization: Selectable (via AVI Q)
    PT scan behavior: No Data
    IT scan behavior: IT video formats not supported
    CE scan behavior: CE video formats not supported
  Audio Data Block:
    Linear PCM:
      Max channels: 2
      Supported sample rates (kHz): 192 176.4 96 88.2 48 44.1 32
      Supported sample sizes (bits): 24 20 16
  Speaker Allocation Data Block:
    FL/FR - Front Left/Right
  Colorimetry Data Block:
    BT2020YCC
    BT2020RGB
  HDR Static Metadata Data Block:
    Electro optical transfer functions:
      Traditional gamma - SDR luminance range
      SMPTE ST2084
    Supported static metadata descriptors:
      Static metadata type 1
    Desired content max luminance: 98 (417.710 cd/m^2)
    Desired content max frame-average luminance: 98 (417.710 cd/m^2)
    Desired content min luminance: 0 (0.000 cd/m^2)
  Detailed Timing Descriptors:
    DTD 2:  1920x1080   60.000000 Hz  16:9     67.500 kHz    148.500000 MHz (630 mm x 330 mm)
                 Hfront   88 Hsync  44 Hback  148 Hpol P
                 Vfront    2 Vsync   5 Vback   38 Vpol P
    DTD 3:  2560x1440   59.950550 Hz  16:9     88.787 kHz    241.500000 MHz (630 mm x 330 mm)
                 Hfront   48 Hsync  32 Hback   80 Hpol P
                 Vfront    3 Vsync   5 Vback   33 Vpol P
    DTD 4:  2560x1440   74.999007 Hz  16:9    111.074 kHz    302.120000 MHz (630 mm x 330 mm)
                 Hfront   48 Hsync  32 Hback   80 Hpol P
                 Vfront    3 Vsync   5 Vback   33 Vpol P
Checksum: 0xcd  Unused space in Extension Block: 31 bytes

----------------

Block 2, DisplayID Extension Block:
  Version: 1.2
  Extension Count: 0
  Display Product Type: Extension Section
  Video Timing Modes Type 1 - Detailed Timings Data Block:
    DTD:  3840x2160  144.000445 Hz  16:9    315.361 kHz   1292.980000 MHz (aspect 16:9, no 3D stereo)
               Hfront   88 Hsync  44 Hback  128 Hpol N
               Vfront    3 Vsync  16 Vback   11 Vpol N
    DTD:  3840x2160  100.000000 Hz  16:9    220.100 kHz    968.440000 MHz (aspect 16:9, no 3D stereo)
               Hfront  176 Hsync  88 Hback  296 Hpol N
               Vfront    3 Vsync  16 Vback   22 Vpol N
    DTD:  3840x2160  120.000000 Hz  16:9    264.000 kHz   1066.560000 MHz (aspect 16:9, no 3D stereo)
               Hfront   48 Hsync  32 Hback  120 Hpol N
               Vfront    3 Vsync  16 Vback   21 Vpol N
  Checksum: 0x56
Checksum: 0x90  Unused space in Extension Block: 58 bytes


