edid-decode (hex):

00 ff ff ff ff ff ff 00 30 ae c3 61 00 00 00 00
15 1e 01 03 6c 31 1e 78 ee 3a 65 a7 55 52 9c 27
0f 50 54 31 0c 00 81 00 95 00 a9 4a b3 00 d1 c0
d1 00 81 80 a9 40 28 3c 80 a0 70 b0 23 40 30 20
36 00 06 44 21 00 00 1a 00 00 00 fc 00 54 32 33
64 2d 31 30 0a 20 20 20 20 20 00 00 00 fd 00 32
4b 1e 51 14 00 0a 20 20 20 20 20 20 00 00 00 ff
00 56 39 30 36 34 42 32 48 0a ff ff ff ff 00 f0

00 ff ff ff ff ff ff 00 30 ae c3 61 00 00 00 00
15 1e 01 03 6c 31 1e 78 ee 3a 65 a7 55 52 9c 27
0f 50 54 31 0c 00 81 00 95 00 a9 4a b3 00 d1 c0
d1 00 81 80 a9 40 28 3c 80 a0 70 b0 23 40 30 20
36 00 06 44 21 00 00 1a 00 00 00 fc 00 54 32 33
64 2d 31 30 0a 20 20 20 20 20 00 00 00 fd 00 32
4b 1e 51 14 00 0a 20 20 20 20 20 20 00 00 00 ff
00 56 39 30 36 34 42 32 48 0a ff ff ff ff 00 f0

----------------

Block 0, Base EDID:
  EDID Structure Version & Revision: 1.3
  Vendor & Product Identification:
    Manufacturer: LEN
    Model: 25027
    Made in: week 21 of 2020
  Basic Display Parameters & Features:
    Analog display
    Signal Level Standard: 0.700 : 0.000 : 0.700 V p-p
    Blank level equals black level
    Sync: Separate Composite
    Maximum image size: 49 cm x 30 cm
    Gamma: 2.20
    DPMS levels: Standby Suspend Off
    RGB color display
    Default (sRGB) color space is primary color space
    First detailed timing is the preferred timing
  Color Characteristics:
    Red  : 0.6523, 0.3349
    Green: 0.3222, 0.6113
    Blue : 0.1533, 0.0605
    White: 0.3134, 0.3291
  Established Timings I & II:
    DMT 0x04:   640x480    59.940476 Hz   4:3     31.469 kHz     25.175000 MHz
    Apple   :   640x480    66.666667 Hz   4:3     35.000 kHz     30.240000 MHz
    DMT 0x09:   800x600    60.316541 Hz   4:3     37.879 kHz     40.000000 MHz
    DMT 0x10:  1024x768    60.003840 Hz   4:3     48.363 kHz     65.000000 MHz
    DMT 0x11:  1024x768    70.069359 Hz   4:3     56.476 kHz     75.000000 MHz
  Standard Timings:
    DMT 0x1c:  1280x800    59.810326 Hz  16:10    49.702 kHz     83.500000 MHz
    DMT 0x2f:  1440x900    59.887445 Hz  16:10    55.935 kHz    106.500000 MHz
    DMT 0x35:  1600x1200   70.000000 Hz   4:3     87.500 kHz    189.000000 MHz
    DMT 0x3a:  1680x1050   59.954250 Hz  16:10    65.290 kHz    146.250000 MHz
    DMT 0x52:  1920x1080   60.000000 Hz  16:9     67.500 kHz    148.500000 MHz
    DMT 0x45:  1920x1200   59.884600 Hz  16:10    74.556 kHz    193.250000 MHz
    DMT 0x23:  1280x1024   60.019740 Hz   5:4     63.981 kHz    108.000000 MHz
    DMT 0x33:  1600x1200   60.000000 Hz   4:3     75.000 kHz    162.000000 MHz
  Detailed Timing Descriptors:
    DTD 1:  1920x1200   59.950171 Hz  16:10    74.038 kHz    154.000000 MHz (518 mm x 324 mm)
                 Hfront   48 Hsync  32 Hback   80 Hpol P
                 Vfront    3 Vsync   6 Vback   26 Vpol N
    Display Product Name: 'T23d-10'
    Display Range Limits:
      Monitor ranges (GTF): 50-75 Hz V, 30-81 kHz H, max dotclock 200 MHz
    Display Product Serial Number: ...
Checksum: 0xf0

----------------

Block 1, Unknown EDID Extension Block 0x00:
  00 ff ff ff ff ff ff 00 30 ae c3 61 00 00 00 00 '........0..a....'
  15 1e 01 03 6c 31 1e 78 ee 3a 65 a7 55 52 9c 27 '....l1.x.:e.UR.''
  0f 50 54 31 0c 00 81 00 95 00 a9 4a b3 00 d1 c0 '.PT1.......J....'
  d1 00 81 80 a9 40 28 3c 80 a0 70 b0 23 40 30 20 '.....@(<..p.#@0 '
  36 00 06 44 21 00 00 1a 00 00 00 fc 00 54 32 33 '6..D!........T23'
  64 2d 31 30 0a 20 20 20 20 20 00 00 00 fd 00 32 'd-10.     .....2'
  4b 1e 51 14 00 0a 20 20 20 20 20 20 00 00 00 ff 'K.Q...      ....'
  00 56 39 30 36 34 42 32 48 0a ff ff ff ff 00 f0 '.V9064B2H.......'
Checksum: 0xf0

----------------

Failures:

Block 0, Base EDID:
  Basic Display Parameters & Features: sRGB is signaled, but the chromaticities do not match.
  Detailed Timing Descriptor #1: Mismatch of image size 518x324 mm vs display size 490x300 mm.
  Display Product Serial Number: ...
Block 1, Base EDID:
  Unknown Extension Block.
EDID:
  Base EDID: Some timings are out of range of the Monitor Ranges:
    Horizontal Freq: 31.468 - 87.500 kHz (Monitor: 30.000 - 81.000 kHz)
  Base EDID: The DTD max image size is 518x324mm, which is larger than the display size 490.0x300.0mm.
  Base EDID: EDID specified 0 extension block(s), but found 1 extension block(s).

EDID conformity: FAIL
