edid-decode (hex):

00 ff ff ff ff ff ff 00 30 ae a6 40 00 00 00 00
22 1d 01 04 a5 1f 11 78 e2 34 c5 95 5c 5a 92 29
1d 50 54 00 00 00 01 01 01 01 01 01 01 01 01 01
01 01 01 01 01 01 8b 39 80 10 71 38 28 40 30 20
36 00 35 ae 10 00 00 1a 8b 39 80 10 71 38 28 40
30 20 36 00 35 ae 10 00 00 1a 00 00 00 0f 00 d1
09 3c d1 09 30 19 09 00 09 e5 c9 08 00 00 00 fe
00 4e 54 31 34 30 46 48 4d 2d 4e 34 35 0a 00 01

00 ff ff ff ff ff ff 00 30 ae a6 40 00 00 00 00
22 1d 01 04 a5 1f 11 78 e2 34 c5 95 5c 5a 92 29
1d 50 54 00 00 00 01 01 01 01 01 01 01 01 01 01
01 01 01 01 01 01 8b 39 80 10 71 38 28 40 30 20
36 00 35 ae 10 00 00 1a 8b 39 80 10 71 38 28 40
30 20 36 00 35 ae 10 00 00 1a 00 00 00 0f 00 d1
09 3c d1 09 30 19 09 00 09 e5 c9 08 00 00 00 fe
00 4e 54 31 34 30 46 48 4d 2d 4e 34 35 0a 00 01

----------------

Block 0, Base EDID:
  EDID Structure Version & Revision: 1.4
  Vendor & Product Identification:
    Manufacturer: LEN
    Model: 16550
    Made in: week 34 of 2019
  Basic Display Parameters & Features:
    Digital display
    Bits per primary color channel: 8
    DisplayPort interface
    Maximum image size: 31 cm x 17 cm
    Gamma: 2.20
    DPMS levels: Standby Suspend Off
    Supported color formats: RGB 4:4:4
    First detailed timing includes the native pixel format and preferred refresh rate
  Color Characteristics:
    Red  : 0.5820, 0.3623
    Green: 0.3525, 0.5703
    Blue : 0.1630, 0.1132
    White: 0.3134, 0.3291
  Established Timings I & II: none
  Standard Timings: none
  Detailed Timing Descriptors:
    DTD 1:  1920x1080   60.003096 Hz  16:9     67.203 kHz    147.310000 MHz (309 mm x 174 mm)
                 Hfront   48 Hsync  32 Hback  192 Hpol P
                 Vfront    3 Vsync   6 Vback   31 Vpol N
    DTD 2:  1920x1080   60.003096 Hz  16:9     67.203 kHz    147.310000 MHz (309 mm x 174 mm)
                 Hfront   48 Hsync  32 Hback  192 Hpol P
                 Vfront    3 Vsync   6 Vback   31 Vpol N
    Manufacturer-Specified Display Descriptor (0x0f): 00 0f 00 d1 09 3c d1 09 30 19 09 00 09 e5 c9 08 '.....<..0.......'
    Alphanumeric Data String: 'NT140FHM-N45'
Checksum: 0x01

----------------

Block 1, Unknown EDID Extension Block 0x00:
  00 ff ff ff ff ff ff 00 30 ae a6 40 00 00 00 00 '........0..@....'
  22 1d 01 04 a5 1f 11 78 e2 34 c5 95 5c 5a 92 29 '"......x.4..\Z.)'
  1d 50 54 00 00 00 01 01 01 01 01 01 01 01 01 01 '.PT.............'
  01 01 01 01 01 01 8b 39 80 10 71 38 28 40 30 20 '.......9..q8(@0 '
  36 00 35 ae 10 00 00 1a 8b 39 80 10 71 38 28 40 '6.5......9..q8(@'
  30 20 36 00 35 ae 10 00 00 1a 00 00 00 0f 00 d1 '0 6.5...........'
  09 3c d1 09 30 19 09 00 09 e5 c9 08 00 00 00 fe '.<..0...........'
  00 4e 54 31 34 30 46 48 4d 2d 4e 34 35 0a 00 01 '.NT140FHM-N45...'
Checksum: 0x01

----------------

Warnings:

Block 0, Base EDID:
  Missing Display Product Name.

Failures:

Block 1, Base EDID:
  Unknown Extension Block.
EDID:
  Base EDID: EDID specified 0 extension block(s), but found 1 extension block(s).

EDID conformity: FAIL
