
EDID (hex):
00ffffffffffff001e6d7556aecd0400
0213010380372278eafe25a85337ae24
115054a54b80a940818fb300814f8180
010101010101283c80a070b023403020
360026572100001a483f403062b03240
40c0130026572100001e000000fd0038
4b1e5311000a202020202020000000fc
0057323630300a2020202020202000ae

Extracted contents:
header:          00 ff ff ff ff ff ff 00
serial number:   1e 6d 75 56 ae cd 04 00 02 13
version:         01 03
basic params:    80 37 22 78 ea
chroma info:     fe 25 a8 53 37 ae 24 11 50 54
established:     a5 4b 80
standard:        a9 40 81 8f b3 00 81 4f 81 80 01 01 01 01 01 01
descriptor 1:    28 3c 80 a0 70 b0 23 40 30 20 36 00 26 57 21 00 00 1a
descriptor 2:    48 3f 40 30 62 b0 32 40 40 c0 13 00 26 57 21 00 00 1e
descriptor 3:    00 00 00 fd 00 38 4b 1e 53 11 00 0a 20 20 20 20 20 20
descriptor 4:    00 00 00 fc 00 57 32 36 30 30 0a 20 20 20 20 20 20 20
extensions:      00
checksum:        ae

EDID version: 1.3
Manufacturer: GSM Model 5675 Serial Number --
Made in week 2 of 2009
Digital display
Maximum image size: 55 cm x 34 cm
Gamma: 2.20
DPMS levels: Standby Suspend Off
RGB color display
First detailed timing is preferred timing
Display x,y Chromaticity:
  Red:   0.6591, 0.3271
  Green: 0.2177, 0.6816
  Blue:  0.1406, 0.0683
  White: 0.3134, 0.3291
Established timings supported:
  720x400@70Hz 9:5 HorFreq: 31469 Hz Clock: 28.320 MHz
  640x480@60Hz 4:3 HorFreq: 31469 Hz Clock: 25.175 MHz
  640x480@75Hz 4:3 HorFreq: 37500 Hz Clock: 31.500 MHz
  800x600@60Hz 4:3 HorFreq: 37900 Hz Clock: 40.000 MHz
  800x600@75Hz 4:3 HorFreq: 46900 Hz Clock: 49.500 MHz
  1024x768@60Hz 4:3 HorFreq: 48400 Hz Clock: 65.000 MHz
  1024x768@75Hz 4:3 HorFreq: 60000 Hz Clock: 78.750 MHz
  1280x1024@75Hz 5:4 HorFreq: 80000 Hz Clock: 135.000 MHz
  1152x870@75Hz 192:145 HorFreq: 67500 Hz Clock: 108.000 MHz
Standard timings supported:
  1600x1200@60Hz 4:3 HorFreq: 75000 Hz Clock: 162.000 MHz
  1280x1024@75Hz 5:4 HorFreq: 80000 Hz Clock: 135.000 MHz
  1680x1050@60Hz 16:10 HorFreq: 64700 Hz Clock: 119.000 MHz
  1280x960@75Hz 4:3
  1280x1024@60Hz 5:4 HorFreq: 64000 Hz Clock: 108.000 MHz
Detailed mode: Clock 154.000 MHz, 550 mm x 343 mm
               1920 1968 2000 2080 hborder 0
               1200 1203 1209 1235 vborder 0
               +hsync -vsync 
               VertFreq: 59 Hz, HorFreq: 74038 Hz
Detailed mode: Clock 162.000 MHz, 550 mm x 343 mm
               1600 1664 1856 2160 hborder 0
               1200 1201 1204 1250 vborder 0
               +hsync +vsync 
               VertFreq: 60 Hz, HorFreq: 75000 Hz
Monitor ranges (GTF): 56-75Hz V, 30-83kHz H, max dotclock 170MHz
Monitor name: W2600
Checksum: 0xae (valid)
