
EDID (hex):
00ffffffffffff0026cd0066dc060000
2f140103803c22782a3585a656489a24
125054bfef00814081809500a940b300
d1c0714f950f023a801871382d40582c
450056502100001e000000fd00374c1e
5311000a202020202020000000ff0031
313034394130423031373536000000fc
00504c3237313048440a20202020016b
020308004312131f8c0ad08a20e02d10
103e9600565021000018011d007251d0
1e206e28550056502100001e011d00bc
52d01e20b828554056502100001e8c0a
d090204031200c405500565021000018
00000000000000000000000000000000
00000000000000000000000000000000
00000000000000000000000000000002

Extracted contents:
header:          00 ff ff ff ff ff ff 00
serial number:   26 cd 00 66 dc 06 00 00 2f 14
version:         01 03
basic params:    80 3c 22 78 2a
chroma info:     35 85 a6 56 48 9a 24 12 50 54
established:     bf ef 00
standard:        81 40 81 80 95 00 a9 40 b3 00 d1 c0 71 4f 95 0f
descriptor 1:    02 3a 80 18 71 38 2d 40 58 2c 45 00 56 50 21 00 00 1e
descriptor 2:    00 00 00 fd 00 37 4c 1e 53 11 00 0a 20 20 20 20 20 20
descriptor 3:    00 00 00 ff 00 31 31 30 34 39 41 30 42 30 31 37 35 36
descriptor 4:    00 00 00 fc 00 50 4c 32 37 31 30 48 44 0a 20 20 20 20
extensions:      01
checksum:        6b

EDID version: 1.3
Manufacturer: IVM Model 6600 Serial Number --
Made in week 47 of 2010
Digital display
Maximum image size: 60 cm x 34 cm
Gamma: 2.20
DPMS levels: Off
RGB color display
First detailed timing is preferred timing
Display x,y Chromaticity:
  Red:   0.6484, 0.3388
  Green: 0.2822, 0.6025
  Blue:  0.1425, 0.0703
  White: 0.3134, 0.3291
Established timings supported:
  720x400@70Hz 9:5 HorFreq: 31469 Hz Clock: 28.320 MHz
  640x480@60Hz 4:3 HorFreq: 31469 Hz Clock: 25.175 MHz
  640x480@67Hz 4:3 HorFreq: 35000 Hz Clock: 30.240 MHz
  640x480@72Hz 4:3 HorFreq: 37900 Hz Clock: 31.500 MHz
  640x480@75Hz 4:3 HorFreq: 37500 Hz Clock: 31.500 MHz
  800x600@56Hz 4:3 HorFreq: 35200 Hz Clock: 36.000 MHz
  800x600@60Hz 4:3 HorFreq: 37900 Hz Clock: 40.000 MHz
  800x600@72Hz 4:3 HorFreq: 48100 Hz Clock: 50.000 MHz
  800x600@75Hz 4:3 HorFreq: 46900 Hz Clock: 49.500 MHz
  832x624@75Hz 4:3 HorFreq: 49726 Hz Clock: 57.284 MHz
  1024x768@60Hz 4:3 HorFreq: 48400 Hz Clock: 65.000 MHz
  1024x768@70Hz 4:3 HorFreq: 56500 Hz Clock: 75.000 MHz
  1024x768@75Hz 4:3 HorFreq: 60000 Hz Clock: 78.750 MHz
  1280x1024@75Hz 5:4 HorFreq: 80000 Hz Clock: 135.000 MHz
Standard timings supported:
  1280x960@60Hz 4:3 HorFreq: 60000 Hz Clock: 108.000 MHz
  1280x1024@60Hz 5:4 HorFreq: 64000 Hz Clock: 108.000 MHz
  1440x900@60Hz 16:10 HorFreq: 55500 Hz Clock: 88.750 MHz
  1600x1200@60Hz 4:3 HorFreq: 75000 Hz Clock: 162.000 MHz
  1680x1050@60Hz 16:10 HorFreq: 64700 Hz Clock: 119.000 MHz
  1920x1080@60Hz 16:9
  1152x864@75Hz 4:3 HorFreq: 67500 Hz Clock: 108.000 MHz
  1440x900@75Hz 16:10 HorFreq: 82300 Hz Clock: 156.000 MHz
Detailed mode: Clock 148.500 MHz, 598 mm x 336 mm
               1920 2008 2052 2200 hborder 0
               1080 1084 1089 1125 vborder 0
               +hsync +vsync 
               VertFreq: 60 Hz, HorFreq: 67500 Hz
Monitor ranges (GTF): 55-76Hz V, 30-83kHz H, max dotclock 170MHz
Serial number: --
Monitor name: PL2710HD
Has 1 extension blocks
Checksum: 0x6b (valid)

CTA extension block
Extension version: 3
4 bytes of CTA data
  Video data block
    VIC  18 720x576@50Hz 16:9  HorFreq: 31250 Hz Clock: 27.000 MHz
    VIC  19 1280x720@50Hz 16:9  HorFreq: 37500 Hz Clock: 74.250 MHz
    VIC  31 1920x1080@50Hz 16:9  HorFreq: 56250 Hz Clock: 148.500 MHz
0 native detailed modes
Detailed mode: Clock 27.000 MHz, 598 mm x 336 mm
                720  736  798  858 hborder 0
                480  489  495  525 vborder 0
               -hsync -vsync 
               VertFreq: 59 Hz, HorFreq: 31468 Hz
Detailed mode: Clock 74.250 MHz, 598 mm x 336 mm
               1280 1390 1430 1650 hborder 0
                720  725  730  750 vborder 0
               +hsync +vsync 
               VertFreq: 60 Hz, HorFreq: 45000 Hz
Detailed mode: Clock 74.250 MHz, 598 mm x 336 mm
               1280 1720 1760 1980 hborder 0
                720  725  730  750 vborder 0
               +hsync +vsync 
               VertFreq: 50 Hz, HorFreq: 37500 Hz
Detailed mode: Clock 27.000 MHz, 598 mm x 336 mm
                720  732  796  864 hborder 0
                576  581  586  625 vborder 0
               -hsync -vsync 
               VertFreq: 50 Hz, HorFreq: 31250 Hz
Checksum: 0x2 (valid)

One or more of the timings is out of range of the Monitor Ranges:
  Vertical Freq: 50 - 75 Hz
  Horizontal Freq: 31250 - 82300 Hz
  Maximum Clock: 162.000 MHz
EDID block does not conform at all!
	Both the serial number and the serial string are set
