edid-decode (hex):

00 ff ff ff ff ff ff 00 09 d1 88 76 ad 01 00 00
08 0f 01 03 6c 22 1b 78 ea c4 f6 a3 57 4a 9c 23
11 4f 54 bd ef 80 71 4f 81 90 81 80 81 8c 01 01
01 01 01 01 01 01 30 2a 00 98 51 00 2a 40 30 70
13 00 78 2d 11 00 00 1e d5 09 80 a0 20 5e 63 10
10 60 52 08 78 2d 11 00 00 1a 00 00 00 fd 00 38
4c 1f 53 0e 00 0a 20 20 20 20 20 20 00 00 00 fc
00 42 65 6e 51 20 46 50 37 31 47 0a 20 20 00 3d

----------------

Block 0, Base EDID:
  EDID Structure Version & Revision: 1.3
  Vendor & Product Identification:
    Manufacturer: BNQ
    Model: 30344
    Serial Number: ...
    Made in: week 8 of 2005
  Basic Display Parameters & Features:
    Analog display
    Input voltage level: 0.7/0.7 V
    Blank level equals black level
    Sync: Separate Composite
    Maximum image size: 34 cm x 27 cm
    Gamma: 2.20
    DPMS levels: Standby Suspend Off
    RGB color display
    First detailed timing is the preferred timing
  Color Characteristics:
    Red  : 0.6396, 0.3398
    Green: 0.2900, 0.6093
    Blue : 0.1396, 0.0693
    White: 0.3095, 0.3300
  Established Timings I & II:
    IBM     :   720x400    70.082 Hz   9:5    31.467 kHz  28.320 MHz
    DMT 0x04:   640x480    59.940 Hz   4:3    31.469 kHz  25.175 MHz
    Apple   :   640x480    66.667 Hz   4:3    35.000 kHz  30.240 MHz
    DMT 0x05:   640x480    72.809 Hz   4:3    37.861 kHz  31.500 MHz
    DMT 0x06:   640x480    75.000 Hz   4:3    37.500 kHz  31.500 MHz
    DMT 0x09:   800x600    60.317 Hz   4:3    37.879 kHz  40.000 MHz
    DMT 0x0a:   800x600    72.188 Hz   4:3    48.077 kHz  50.000 MHz
    DMT 0x0b:   800x600    75.000 Hz   4:3    46.875 kHz  49.500 MHz
    Apple   :   832x624    74.551 Hz   4:3    49.726 kHz  57.284 MHz
    DMT 0x10:  1024x768    60.004 Hz   4:3    48.363 kHz  65.000 MHz
    DMT 0x11:  1024x768    70.069 Hz   4:3    56.476 kHz  75.000 MHz
    DMT 0x12:  1024x768    75.029 Hz   4:3    60.023 kHz  78.750 MHz
    DMT 0x24:  1280x1024   75.025 Hz   5:4    79.976 kHz 135.000 MHz
    Apple   :  1152x870    75.062 Hz 192:145  68.681 kHz 100.000 MHz
  Standard Timings:
    DMT 0x15:  1152x864    75.000 Hz   4:3    67.500 kHz 108.000 MHz
    GTF     :  1280x1024   76.000 Hz   5:4    81.320 kHz 141.822 MHz
    DMT 0x23:  1280x1024   60.020 Hz   5:4    63.981 kHz 108.000 MHz
    GTF     :  1280x1024   72.000 Hz   5:4    76.824 kHz 132.752 MHz
  Detailed Timing Descriptors:
    DTD 1:  1280x1024   60.020 Hz   5:4    63.981 kHz 108.000 MHz (376 mm x 301 mm)
                 Hfront   48 Hsync 112 Hback 248 Hpol P
                 Vfront    1 Vsync   3 Vback  38 Vpol P
    DTD 2:   640x350    70.072 Hz  64:35   31.462 kHz  25.170 MHz (376 mm x 301 mm)
                 Hfront   16 Hsync  96 Hback  48 Hpol P
                 Vfront   37 Vsync   2 Vback  60 Vpol N
  Display Range Limits:
    Monitor ranges (GTF): 56-76 Hz V, 31-83 kHz H, max dotclock 140 MHz
    Display Product Name: 'BenQ FP71G'
Checksum: 0x3d

----------------

Warnings:

EDID:
  Base EDID: Some timings are out of range of the Monitor Ranges:
    Maximum Clock: 141.822 MHz (Monitor: 140.000 MHz)
    Could be due to a Monitor Range off-by-one rounding issue

Failures:

Block 0, Base EDID:
  Detailed Timing Descriptor #1: Mismatch of image size 376x301 mm vs display size 340x270 mm.
  Detailed Timing Descriptor #2: Mismatch of image size 376x301 mm vs display size 340x270 mm.

EDID conformity: FAIL
