
EDID (hex):
00ffffffffffff0022f0463301010101
191a0103682917782a62a5a25653a127
0a5054a1080081c00101010101010101
010101010101662156aa51001e30468f
33009ae61000001e000000fd00323c1e
500b000a202020202020000000fc0048
5020563139340a2020202020000000ff
003343513632353234444d0a202000b6

Extracted contents:
header:          00 ff ff ff ff ff ff 00
serial number:   22 f0 46 33 01 01 01 01 19 1a
version:         01 03
basic params:    68 29 17 78 2a
chroma info:     62 a5 a2 56 53 a1 27 0a 50 54
established:     a1 08 00
standard:        81 c0 01 01 01 01 01 01 01 01 01 01 01 01 01 01
descriptor 1:    66 21 56 aa 51 00 1e 30 46 8f 33 00 9a e6 10 00 00 1e
descriptor 2:    00 00 00 fd 00 32 3c 1e 50 0b 00 0a 20 20 20 20 20 20
descriptor 3:    00 00 00 fc 00 48 50 20 56 31 39 34 0a 20 20 20 20 20
descriptor 4:    00 00 00 ff 00 33 43 51 36 32 35 32 34 44 4d 0a 20 20
extensions:      00
checksum:        b6

EDID version: 1.3
Manufacturer: HWP Model 3346 Serial Number --
Made in week 25 of 2016
Analog display, Input voltage level: 0.7/0.7 V
Sync: Separate 
Maximum image size: 41 cm x 23 cm
Gamma: 2.20
DPMS levels: Off
RGB color display
First detailed timing is preferred timing
Display x,y Chromaticity:
  Red:   0.6337, 0.3378
  Green: 0.3242, 0.6308
  Blue:  0.1542, 0.0410
  White: 0.3134, 0.3291
Established timings supported:
  720x400@70Hz 9:5 HorFreq: 31469 Hz Clock: 28.320 MHz
  640x480@60Hz 4:3 HorFreq: 31469 Hz Clock: 25.175 MHz
  800x600@60Hz 4:3 HorFreq: 37900 Hz Clock: 40.000 MHz
  1024x768@60Hz 4:3 HorFreq: 48400 Hz Clock: 65.000 MHz
Standard timings supported:
  1280x720@60Hz 16:9
Detailed mode: Clock 85.500 MHz, 410 mm x 230 mm
               1366 1436 1579 1792 hborder 0
                768  771  774  798 vborder 0
               +hsync +vsync 
               VertFreq: 59 Hz, HorFreq: 47712 Hz
Monitor ranges (GTF): 50-60Hz V, 30-80kHz H, max dotclock 110MHz
Monitor name: HP V194
Serial number: --
Checksum: 0xb6 (valid)
One or more of the timings is out of range of the Monitor Ranges:
  Vertical Freq: 59 - 70 Hz
  Horizontal Freq: 31469 - 48400 Hz
  Maximum Clock: 85.500 MHz
