
EDID (hex):
00ffffffffffff001e6d4d5cb2f00100
0b210104b53c22789d8cb5af4f43ab26
0e5054210800d1c06140010101010101
01010101010109ec00a0a0a067503020
3a0058542100001a000000fd0c30a503
0346010a202020202020000000fc004c
4720554c545241474541520a000000ff
003331314e54585233523135340a020d
0203317123090607e2006a83010000e3
05c000e606050153532e48100403011f
133f406d1a0000020530a50004532e53
2e565e00a0a0a0295030203500585421
00001a5aa000a0a0a0465030203a0058
54210000006fc200a0a0a0555030203a
0058542100001a000000000000000000
00000000000000000000000000000001
70127903000300143d110184ff099f00
2f801f009f0576000200040000000000
00000000000000000000000000000000
00000000000000000000000000000000
00000000000000000000000000000000
00000000000000000000000000000000
00000000000000000000000000000000
0000000000000000000000000000f390

edid-decode (hex):

00 ff ff ff ff ff ff 00 1e 6d 4d 5c b2 f0 01 00
0b 21 01 04 b5 3c 22 78 9d 8c b5 af 4f 43 ab 26
0e 50 54 21 08 00 d1 c0 61 40 01 01 01 01 01 01
01 01 01 01 01 01 09 ec 00 a0 a0 a0 67 50 30 20
3a 00 58 54 21 00 00 1a 00 00 00 fd 0c 30 a5 03
03 46 01 0a 20 20 20 20 20 20 00 00 00 fc 00 4c
47 20 55 4c 54 52 41 47 45 41 52 0a 00 00 00 ff
00 33 31 31 4e 54 58 52 33 52 31 35 34 0a 02 0d

02 03 31 71 23 09 06 07 e2 00 6a 83 01 00 00 e3
05 c0 00 e6 06 05 01 53 53 2e 48 10 04 03 01 1f
13 3f 40 6d 1a 00 00 02 05 30 a5 00 04 53 2e 53
2e 56 5e 00 a0 a0 a0 29 50 30 20 35 00 58 54 21
00 00 1a 5a a0 00 a0 a0 a0 46 50 30 20 3a 00 58
54 21 00 00 00 6f c2 00 a0 a0 a0 55 50 30 20 3a
00 58 54 21 00 00 1a 00 00 00 00 00 00 00 00 00
00 00 00 00 00 00 00 00 00 00 00 00 00 00 00 01

70 12 79 03 00 03 00 14 3d 11 01 84 ff 09 9f 00
2f 80 1f 00 9f 05 76 00 02 00 04 00 00 00 00 00
00 00 00 00 00 00 00 00 00 00 00 00 00 00 00 00
00 00 00 00 00 00 00 00 00 00 00 00 00 00 00 00
00 00 00 00 00 00 00 00 00 00 00 00 00 00 00 00
00 00 00 00 00 00 00 00 00 00 00 00 00 00 00 00
00 00 00 00 00 00 00 00 00 00 00 00 00 00 00 00
00 00 00 00 00 00 00 00 00 00 00 00 00 00 f3 90

----------------

Block 0, Base EDID:
  EDID Structure Version & Revision: 1.4
  Vendor & Product Identification:
    Manufacturer: GSM
    Model: 23629
    Serial Number: 127154
    Made in: week 11 of 2023
  Basic Display Parameters & Features:
    Digital display
    Bits per primary color channel: 10
    DisplayPort interface
    Maximum image size: 60 cm x 34 cm
    Gamma: 2.20
    DPMS levels: Standby
    Supported color formats: RGB 4:4:4, YCrCb 4:4:4, YCrCb 4:2:2
    Default (sRGB) color space is primary color space
    First detailed timing does not include the native pixel format and preferred refresh rate
    Display is continuous frequency
  Color Characteristics:
    Red  : 0.6855, 0.3085
    Green: 0.2646, 0.6679
    Blue : 0.1503, 0.0576
    White: 0.3134, 0.3291
  Established Timings I & II:
    DMT 0x04:   640x480    59.940476 Hz   4:3     31.469 kHz     25.175000 MHz
    DMT 0x09:   800x600    60.316541 Hz   4:3     37.879 kHz     40.000000 MHz
    DMT 0x10:  1024x768    60.003840 Hz   4:3     48.363 kHz     65.000000 MHz
  Standard Timings:
    DMT 0x52:  1920x1080   60.000000 Hz  16:9     67.500 kHz    148.500000 MHz
    DMT 0x10:  1024x768    60.003840 Hz   4:3     48.363 kHz     65.000000 MHz
  Detailed Timing Descriptors:
    DTD 1:  2560x1440  143.973257 Hz  16:9    222.151 kHz    604.250000 MHz (600 mm x 340 mm)
                 Hfront   48 Hsync  32 Hback   80 Hpol P
                 Vfront    3 Vsync  10 Vback   90 Vpol N
    Display Range Limits:
      Monitor ranges (Bare Limits): 48-165 Hz V, 258-258 kHz H, max dotclock 700 MHz
    Display Product Name: 'LG ULTRAGEAR'
    Display Product Serial Number: '311NTXR3R154'
  Extension blocks: 2
Checksum: 0x0d

----------------

Block 1, CTA-861 Extension Block:
  Revision: 3
  Basic audio support
  Supports YCbCr 4:4:4
  Supports YCbCr 4:2:2
  Native detailed modes: 1
  Audio Data Block:
    Linear PCM:
      Max channels: 2
      Supported sample rates (kHz): 48 44.1
      Supported sample sizes (bits): 24 20 16
  Video Capability Data Block:
    YCbCr quantization: No Data
    RGB quantization: Selectable (via AVI Q)
    PT scan behavior: Always Underscanned
    IT scan behavior: Always Underscanned
    CE scan behavior: Always Underscanned
  Speaker Allocation Data Block:
    FL/FR - Front Left/Right
  Colorimetry Data Block:
    BT2020YCC
    BT2020RGB
  HDR Static Metadata Data Block:
    Electro optical transfer functions:
      Traditional gamma - SDR luminance range
      SMPTE ST2084
    Supported static metadata descriptors:
      Static metadata type 1
    Desired content max luminance: 83 (301.833 cd/m^2)
    Desired content max frame-average luminance: 83 (301.833 cd/m^2)
    Desired content min luminance: 46 (0.098 cd/m^2)
  Video Data Block:
    VIC  16:  1920x1080   60.000000 Hz  16:9     67.500 kHz    148.500000 MHz
    VIC   4:  1280x720    60.000000 Hz  16:9     45.000 kHz     74.250000 MHz
    VIC   3:   720x480    59.940060 Hz  16:9     31.469 kHz     27.000000 MHz
    VIC   1:   640x480    59.940476 Hz   4:3     31.469 kHz     25.175000 MHz
    VIC  31:  1920x1080   50.000000 Hz  16:9     56.250 kHz    148.500000 MHz
    VIC  19:  1280x720    50.000000 Hz  16:9     37.500 kHz     74.250000 MHz
    VIC  63:  1920x1080  120.000000 Hz  16:9    135.000 kHz    297.000000 MHz
    VIC  64:  1920x1080  100.000000 Hz  16:9    112.500 kHz    297.000000 MHz
  Vendor-Specific Data Block (AMD), OUI 00-00-1A:
    Version: 2.5
    Minimum Refresh Rate: 48 Hz
    Maximum Refresh Rate: 165 Hz
    Flags 1.x: 0x00
    Flags 2.x: 0x04
    Maximum luminance: 83 (301.833 cd/m^2)
    Minimum luminance: 46 (0.098 cd/m^2)
    Maximum luminance (without local dimming): 83 (301.833 cd/m^2)
    Minimum luminance (without local dimming): 46 (0.098 cd/m^2)
  Detailed Timing Descriptors:
    DTD 2:  2560x1440   59.950550 Hz  16:9     88.787 kHz    241.500000 MHz (600 mm x 340 mm)
                 Hfront   48 Hsync  32 Hback   80 Hpol P
                 Vfront    3 Vsync   5 Vback   33 Vpol N
    DTD 3:  2560x1440   99.946436 Hz  16:9    150.919 kHz    410.500000 MHz (analog composite, sync-on-green, 600 mm x 340 mm)
                 Hfront   48 Hsync  32 Hback   80 Hpol N
                 Vfront    3 Vsync  10 Vback   57 Vpol N
    DTD 4:  2560x1440  119.997589 Hz  16:9    182.996 kHz    497.750000 MHz (600 mm x 340 mm)
                 Hfront   48 Hsync  32 Hback   80 Hpol P
                 Vfront    3 Vsync  10 Vback   72 Vpol N
Checksum: 0x01  Unused space in Extension Block: 24 bytes

----------------

Block 2, DisplayID Extension Block:
  Version: 1.2
  Extension Count: 0
  Display Product Type: Standalone display device
  Video Timing Modes Type 1 - Detailed Timings Data Block:
    DTD:  2560x1440  164.957741 Hz  16:9    257.169 kHz    699.500000 MHz (aspect 16:9, no 3D stereo, preferred)
               Hfront   48 Hsync  32 Hback   80 Hpol P
               Vfront    3 Vsync   5 Vback  111 Vpol N
  Checksum: 0xf3
Checksum: 0x90


