
EDID (hex):
00ffffffffffff004c2dca09484c585a
021701040e351e782a4ba1a359559b26
0e5054bfef80714f81c0810081809500
a9c0b3000101023a801871382d40582c
4500132b2100001e000000fd00384b1e
5111000a202020202020000000fc0053
3234433435300a2020202020000000ff
0048544e443130303530320a2020006b

Extracted contents:
header:          00 ff ff ff ff ff ff 00
serial number:   4c 2d ca 09 48 4c 58 5a 02 17
version:         01 04
basic params:    0e 35 1e 78 2a
chroma info:     4b a1 a3 59 55 9b 26 0e 50 54
established:     bf ef 80
standard:        71 4f 81 c0 81 00 81 80 95 00 a9 c0 b3 00 01 01
descriptor 1:    02 3a 80 18 71 38 2d 40 58 2c 45 00 13 2b 21 00 00 1e
descriptor 2:    00 00 00 fd 00 38 4b 1e 51 11 00 0a 20 20 20 20 20 20
descriptor 3:    00 00 00 fc 00 53 32 34 43 34 35 30 0a 20 20 20 20 20
descriptor 4:    00 00 00 ff 00 48 54 4e 44 31 30 30 35 30 32 0a 20 20
extensions:      00
checksum:        6b

EDID version: 1.4
Manufacturer: SAM Model 9ca Serial Number --
Made in week 2 of 2013
Analog display, Input voltage level: 0.7/0.3 V
Blank level equals black level
Sync: Separate Composite SyncOnGreen 
Maximum image size: 53 cm x 30 cm
Gamma: 2.20
DPMS levels: Off
RGB color display
First detailed timing includes the native pixel format and preferred refresh rate
Display x,y Chromaticity:
  Red:   0.6376, 0.3476
  Green: 0.3339, 0.6083
  Blue:  0.1503, 0.0566
  White: 0.3125, 0.3291
Established timings supported:
  720x400@70Hz 9:5 HorFreq: 31469 Hz Clock: 28.320 MHz
  640x480@60Hz 4:3 HorFreq: 31469 Hz Clock: 25.175 MHz
  640x480@67Hz 4:3 HorFreq: 35000 Hz Clock: 30.240 MHz
  640x480@72Hz 4:3 HorFreq: 37900 Hz Clock: 31.500 MHz
  640x480@75Hz 4:3 HorFreq: 37500 Hz Clock: 31.500 MHz
  800x600@56Hz 4:3 HorFreq: 35200 Hz Clock: 36.000 MHz
  800x600@60Hz 4:3 HorFreq: 37900 Hz Clock: 40.000 MHz
  800x600@72Hz 4:3 HorFreq: 48100 Hz Clock: 50.000 MHz
  800x600@75Hz 4:3 HorFreq: 46900 Hz Clock: 49.500 MHz
  832x624@75Hz 4:3 HorFreq: 49726 Hz Clock: 57.284 MHz
  1024x768@60Hz 4:3 HorFreq: 48400 Hz Clock: 65.000 MHz
  1024x768@70Hz 4:3 HorFreq: 56500 Hz Clock: 75.000 MHz
  1024x768@75Hz 4:3 HorFreq: 60000 Hz Clock: 78.750 MHz
  1280x1024@75Hz 5:4 HorFreq: 80000 Hz Clock: 135.000 MHz
  1152x870@75Hz 192:145 HorFreq: 67500 Hz Clock: 108.000 MHz
Standard timings supported:
  1152x864@75Hz 4:3 HorFreq: 67500 Hz Clock: 108.000 MHz
  1280x720@60Hz 16:9
  1280x800@60Hz 16:10
  1280x1024@60Hz 5:4 HorFreq: 64000 Hz Clock: 108.000 MHz
  1440x900@60Hz 16:10 HorFreq: 55500 Hz Clock: 88.750 MHz
  1600x900@60Hz 16:9
  1680x1050@60Hz 16:10 HorFreq: 64700 Hz Clock: 119.000 MHz
Detailed mode: Clock 148.500 MHz, 531 mm x 299 mm
               1920 2008 2052 2200 hborder 0
               1080 1084 1089 1125 vborder 0
               +hsync +vsync 
               VertFreq: 60 Hz, HorFreq: 67500 Hz
Monitor ranges (GTF): 56-75Hz V, 30-81kHz H, max dotclock 170MHz
Monitor name: S24C450
Serial number: --
Checksum: 0x6b (valid)
