
EDID (hex):
00ffffffffffff000469ac1901010101
0c120103a0291a78baeed5a555489b26
125054afcf008180714f950081c08100
8bc09500950f6b35a0f051842a306098
360098ff1000001c000000fd00374b1e
500e000a202020202020000000ff0038
334c4d4d533033303037390a000000fc
00564b3139310a2020202020202001eb

Extracted contents:
header:          00 ff ff ff ff ff ff 00
serial number:   04 69 ac 19 01 01 01 01 0c 12
version:         01 03
basic params:    a0 29 1a 78 ba
chroma info:     ee d5 a5 55 48 9b 26 12 50 54
established:     af cf 00
standard:        81 80 71 4f 95 00 81 c0 81 00 8b c0 95 00 95 0f
descriptor 1:    6b 35 a0 f0 51 84 2a 30 60 98 36 00 98 ff 10 00 00 1c
descriptor 2:    00 00 00 fd 00 37 4b 1e 50 0e 00 0a 20 20 20 20 20 20
descriptor 3:    00 00 00 ff 00 38 33 4c 4d 4d 53 30 33 30 30 37 39 0a
descriptor 4:    00 00 00 fc 00 56 4b 31 39 31 0a 20 20 20 20 20 20 20
extensions:      01
checksum:        eb

EDID version: 1.3
Manufacturer: ACI Model 19ac Serial Number --
Made in week 12 of 2008
Digital display
Maximum image size: 41 cm x 26 cm
Gamma: 2.20
DPMS levels: Standby Off
Undefined display color type
First detailed timing is preferred timing
Display x,y Chromaticity:
  Red:   0.6474, 0.3339
  Green: 0.2841, 0.6074
  Blue:  0.1513, 0.0712
  White: 0.3134, 0.3291
Established timings supported:
  720x400@70Hz 9:5 HorFreq: 31469 Hz Clock: 28.320 MHz
  640x480@60Hz 4:3 HorFreq: 31469 Hz Clock: 25.175 MHz
  640x480@72Hz 4:3 HorFreq: 37900 Hz Clock: 31.500 MHz
  640x480@75Hz 4:3 HorFreq: 37500 Hz Clock: 31.500 MHz
  800x600@56Hz 4:3 HorFreq: 35200 Hz Clock: 36.000 MHz
  800x600@60Hz 4:3 HorFreq: 37900 Hz Clock: 40.000 MHz
  800x600@72Hz 4:3 HorFreq: 48100 Hz Clock: 50.000 MHz
  800x600@75Hz 4:3 HorFreq: 46900 Hz Clock: 49.500 MHz
  1024x768@60Hz 4:3 HorFreq: 48400 Hz Clock: 65.000 MHz
  1024x768@70Hz 4:3 HorFreq: 56500 Hz Clock: 75.000 MHz
  1024x768@75Hz 4:3 HorFreq: 60000 Hz Clock: 78.750 MHz
  1280x1024@75Hz 5:4 HorFreq: 80000 Hz Clock: 135.000 MHz
Standard timings supported:
  1280x1024@60Hz 5:4 HorFreq: 64000 Hz Clock: 108.000 MHz
  1152x864@75Hz 4:3 HorFreq: 67500 Hz Clock: 108.000 MHz
  1440x900@60Hz 16:10 HorFreq: 55500 Hz Clock: 88.750 MHz
  1280x720@60Hz 16:9
  1280x800@60Hz 16:10
  1360x765@60Hz 16:9
  1440x900@60Hz 16:10 HorFreq: 55500 Hz Clock: 88.750 MHz
  1440x900@75Hz 16:10 HorFreq: 82300 Hz Clock: 156.000 MHz
Detailed mode: Clock 136.750 MHz, 408 mm x 255 mm
               1440 1536 1688 1936 hborder 0
                900  903  909  942 vborder 0
               -hsync +vsync 
               VertFreq: 74 Hz, HorFreq: 70635 Hz
Monitor ranges (GTF): 55-75Hz V, 30-80kHz H, max dotclock 140MHz
Serial number: --
Monitor name: VK191
Has 1 extension blocks
Checksum: 0xeb (valid)
EDID block does NOT conform to EDID 1.3!
	Digital display field contains garbage: 20
One or more of the timings is out of range of the Monitor Ranges:
  Vertical Freq: 56 - 75 Hz
  Horizontal Freq: 31469 - 82300 Hz
  Maximum Clock: 156.000 MHz
