
EDID (hex):
00ffffffffffff0030e4540200000000
00130103801f11780a05859b5b549426
0e505400000001010101010101010101
0101010101011c2a4040618424303020
350036ae1000001b0000000000000000
00000000000000000000000000fe004c
4720446973706c61790a2020000000fe
004c503134305744312d544c44320061

Extracted contents:
header:          00 ff ff ff ff ff ff 00
serial number:   30 e4 54 02 00 00 00 00 00 13
version:         01 03
basic params:    80 1f 11 78 0a
chroma info:     05 85 9b 5b 54 94 26 0e 50 54
established:     00 00 00
standard:        01 01 01 01 01 01 01 01 01 01 01 01 01 01 01 01
descriptor 1:    1c 2a 40 40 61 84 24 30 30 20 35 00 36 ae 10 00 00 1b
descriptor 2:    00 00 00 00 00 00 00 00 00 00 00 00 00 00 00 00 00 00
descriptor 3:    00 00 00 fe 00 4c 47 20 44 69 73 70 6c 61 79 0a 20 20
descriptor 4:    00 00 00 fe 00 4c 50 31 34 30 57 44 31 2d 54 4c 44 32
extensions:      00
checksum:        61

EDID version: 1.3
Manufacturer: LGD Model 254 Serial Number --
Made in year 2009
Digital display
Maximum image size: 31 cm x 17 cm
Gamma: 2.20
RGB color display
First detailed timing is preferred timing
Display x,y Chromaticity:
  Red:   0.6054, 0.3554
  Green: 0.3291, 0.5791
  Blue:  0.1503, 0.0546
  White: 0.3134, 0.3291
Established timings supported:
Standard timings supported:
Detailed mode: Clock 107.800 MHz, 310 mm x 174 mm
               1600 1648 1680 1920 hborder 0
                900  903  908  936 vborder 0
               +hsync -vsync 
               VertFreq: 59 Hz, HorFreq: 56145 Hz
Manufacturer-specified data, tag 0
ASCII string: LG Display
ASCII string: LP140WD1-TLD2
Checksum: 0x61 (valid)
EDID block does NOT conform to EDID 1.3!
	Missing name descriptor
	Missing monitor ranges
