edid-decode (hex):

00 ff ff ff ff ff ff 00 10 ac 5b 40 4c 50 44 4a
12 14 01 03 80 26 1e 78 ee ee 95 a3 54 4c 99 26
0f 50 54 a5 4b 00 71 4f 81 80 01 01 01 01 01 01
01 01 01 01 01 01 30 2a 00 98 51 00 2a 40 30 70
13 00 78 2d 11 00 00 1e 00 00 00 ff 00 39 4d 36
32 43 30 34 52 4a 44 50 4c 0a 00 00 00 fc 00 44
45 4c 4c 20 50 31 39 30 53 0a 20 20 00 00 00 fd
00 38 4c 1e 51 0e 00 0a 20 20 20 20 20 20 00 62

00 ff ff ff ff ff ff 00 10 ac 5b 40 4c 50 44 4a
12 14 01 03 80 26 1e 78 ee ee 95 a3 54 4c 99 26
0f 50 54 a5 4b 00 71 4f 81 80 01 01 01 01 01 01
01 01 01 01 01 01 30 2a 00 98 51 00 2a 40 30 70
13 00 78 2d 11 00 00 1e 00 00 00 ff 00 39 4d 36
32 43 30 34 52 4a 44 50 4c 0a 00 00 00 fc 00 44
45 4c 4c 20 50 31 39 30 53 0a 20 20 00 00 00 fd
00 38 4c 1e 51 0e 00 0a 20 20 20 20 20 20 00 62

----------------

Block 0, Base EDID:
  EDID Structure Version & Revision: 1.3
  Vendor & Product Identification:
    Manufacturer: DEL
    Model: 16475
    Serial Number: ...
    Made in: week 18 of 2010
  Basic Display Parameters & Features:
    Digital display
    Maximum image size: 38 cm x 30 cm
    Gamma: 2.20
    DPMS levels: Standby Suspend Off
    RGB color display
    Default (sRGB) color space is primary color space
    First detailed timing is the preferred timing
  Color Characteristics:
    Red  : 0.6396, 0.3300
    Green: 0.2998, 0.5996
    Blue : 0.1503, 0.0595
    White: 0.3134, 0.3291
  Established Timings I & II:
    IBM     :   720x400    70.081663 Hz   9:5     31.467 kHz     28.320000 MHz
    DMT 0x04:   640x480    59.940476 Hz   4:3     31.469 kHz     25.175000 MHz
    DMT 0x06:   640x480    75.000000 Hz   4:3     37.500 kHz     31.500000 MHz
    DMT 0x09:   800x600    60.316541 Hz   4:3     37.879 kHz     40.000000 MHz
    DMT 0x0b:   800x600    75.000000 Hz   4:3     46.875 kHz     49.500000 MHz
    DMT 0x10:  1024x768    60.003840 Hz   4:3     48.363 kHz     65.000000 MHz
    DMT 0x12:  1024x768    75.028582 Hz   4:3     60.023 kHz     78.750000 MHz
    DMT 0x24:  1280x1024   75.024675 Hz   5:4     79.976 kHz    135.000000 MHz
  Standard Timings:
    DMT 0x15:  1152x864    75.000000 Hz   4:3     67.500 kHz    108.000000 MHz
    DMT 0x23:  1280x1024   60.019740 Hz   5:4     63.981 kHz    108.000000 MHz
  Detailed Timing Descriptors:
    DTD 1:  1280x1024   60.019740 Hz   5:4     63.981 kHz    108.000000 MHz (376 mm x 301 mm)
                 Hfront   48 Hsync 112 Hback  248 Hpol P
                 Vfront    1 Vsync   3 Vback   38 Vpol P
    Display Product Serial Number: ...
    Display Product Name: 'DELL P190S'
    Display Range Limits:
      Monitor ranges (GTF): 56-76 Hz V, 30-81 kHz H, max dotclock 140 MHz
Checksum: 0x62

----------------

Block 1, Unknown EDID Extension Block 0x00:
  00 ff ff ff ff ff ff 00 10 ac 5b 40 4c 50 44 4a '..........[@LPDJ'
  12 14 01 03 80 26 1e 78 ee ee 95 a3 54 4c 99 26 '.....&.x....TL.&'
  0f 50 54 a5 4b 00 71 4f 81 80 01 01 01 01 01 01 '.PT.K.qO........'
  01 01 01 01 01 01 30 2a 00 98 51 00 2a 40 30 70 '......0*..Q.*@0p'
  13 00 78 2d 11 00 00 1e 00 00 00 ff 00 39 4d 36 '..x-.........9M6'
  32 43 30 34 52 4a 44 50 4c 0a 00 00 00 fc 00 44 '2C04RJDPL......D'
  45 4c 4c 20 50 31 39 30 53 0a 20 20 00 00 00 fd 'ELL P190S.  ....'
  00 38 4c 1e 51 0e 00 0a 20 20 20 20 20 20 00 62 '.8L.Q...      .b'
Checksum: 0x62

----------------

Failures:

Block 0, Base EDID:
  Basic Display Parameters & Features: sRGB is signaled, but the chromaticities do not match.
Block 1, Base EDID:
  Unknown Extension Block.
EDID:
  Base EDID: EDID specified 0 extension block(s), but found 1 extension block(s).

EDID conformity: FAIL
