
EDID (hex):
00ffffffffffff0006af9e1300000000
01130103802615780ac4959e57539226
0f505400000001010101010101010101
010101010101f82a409061840c303020
36007ed6100000180000000f00000000
00000000000000000020000000fe0041
554f0a202020202020202020000000fe
004231373352573031205633200a0026

Extracted contents:
header:          00 ff ff ff ff ff ff 00
serial number:   06 af 9e 13 00 00 00 00 01 13
version:         01 03
basic params:    80 26 15 78 0a
chroma info:     c4 95 9e 57 53 92 26 0f 50 54
established:     00 00 00
standard:        01 01 01 01 01 01 01 01 01 01 01 01 01 01 01 01
descriptor 1:    f8 2a 40 90 61 84 0c 30 30 20 36 00 7e d6 10 00 00 18
descriptor 2:    00 00 00 0f 00 00 00 00 00 00 00 00 00 00 00 00 00 20
descriptor 3:    00 00 00 fe 00 41 55 4f 0a 20 20 20 20 20 20 20 20 20
descriptor 4:    00 00 00 fe 00 42 31 37 33 52 57 30 31 20 56 33 20 0a
extensions:      00
checksum:        26

EDID version: 1.3
Manufacturer: AUO Model 139e Serial Number --
Made in week 1 of 2009
Digital display
Maximum image size: 38 cm x 21 cm
Gamma: 2.20
RGB color display
First detailed timing is preferred timing
Display x,y Chromaticity:
  Red:   0.6201, 0.3398
  Green: 0.3251, 0.5703
  Blue:  0.1503, 0.0595
  White: 0.3134, 0.3291
Established timings supported:
Standard timings supported:
Detailed mode: Clock 110.000 MHz, 382 mm x 214 mm
               1600 1648 1680 2000 hborder 0
                900  903  909  912 vborder 0
               -hsync -vsync 
               VertFreq: 60 Hz, HorFreq: 55000 Hz
Manufacturer-specified data, tag 15
ASCII string: AUO
ASCII string: B173RW01 V3 
Checksum: 0x26 (valid)
EDID block does NOT conform to EDID 1.3!
	Missing name descriptor
	Missing monitor ranges
