
EDID (hex):
00ffffffffffff0009d1767f45540000
2f1d0104b53c22783b9325ad4f44a926
0d5054a56b80d1fcd1e8d1c0b300a9c0
8180810081c0f8e300a0a0a032500820
980455502100001e000000ff0052424b
30313539343031390a20000000fd0028
90dede3c010a202020202020000000fc
0042656e5120455832373830510a013b
020334f1515d5e5f60613f40101f2221
2004131203012309070783010000e200
cf67030c0010003844e305c301e60605
016262216fc200a0a0a0555030203500
55502100001e565e00a0a0a029502f20
350055502100001a0000000000000000
00000000000000000000000000000000
000000000000000000000000000000e8

Extracted contents:
header:          00 ff ff ff ff ff ff 00
serial number:   09 d1 76 7f 45 54 00 00 2f 1d
version:         01 04
basic params:    b5 3c 22 78 3b
chroma info:     93 25 ad 4f 44 a9 26 0d 50 54
established:     a5 6b 80
standard:        d1 fc d1 e8 d1 c0 b3 00 a9 c0 81 80 81 00 81 c0
descriptor 1:    f8 e3 00 a0 a0 a0 32 50 08 20 98 04 55 50 21 00 00 1e
descriptor 2:    00 00 00 ff 00 52 42 4b 30 31 35 39 34 30 31 39 0a 20
descriptor 3:    00 00 00 fd 00 28 90 de de 3c 01 0a 20 20 20 20 20 20
descriptor 4:    00 00 00 fc 00 42 65 6e 51 20 45 58 32 37 38 30 51 0a
extensions:      01
checksum:        3b

EDID version: 1.4
Manufacturer: BNQ Model 7f76 Serial Number --
Made in week 47 of 2019
Digital display
10 bits per primary color channel
DisplayPort interface
Maximum image size: 60 cm x 34 cm
Gamma: 2.20
DPMS levels: Off
Supported color formats: RGB 4:4:4, YCrCb 4:4:4, YCrCb 4:2:2
First detailed timing includes the native pixel format and preferred refresh rate
Display is continuous frequency
Display x,y Chromaticity:
  Red:   0.6777, 0.3095
  Green: 0.2656, 0.6630
  Blue:  0.1484, 0.0527
  White: 0.3134, 0.3291
Established timings supported:
  720x400@70Hz 9:5 HorFreq: 31469 Hz Clock: 28.320 MHz
  640x480@60Hz 4:3 HorFreq: 31469 Hz Clock: 25.175 MHz
  640x480@75Hz 4:3 HorFreq: 37500 Hz Clock: 31.500 MHz
  800x600@60Hz 4:3 HorFreq: 37900 Hz Clock: 40.000 MHz
  800x600@75Hz 4:3 HorFreq: 46900 Hz Clock: 49.500 MHz
  832x624@75Hz 4:3 HorFreq: 49726 Hz Clock: 57.284 MHz
  1024x768@60Hz 4:3 HorFreq: 48400 Hz Clock: 65.000 MHz
  1024x768@75Hz 4:3 HorFreq: 60000 Hz Clock: 78.750 MHz
  1280x1024@75Hz 5:4 HorFreq: 80000 Hz Clock: 135.000 MHz
  1152x870@75Hz 192:145 HorFreq: 67500 Hz Clock: 108.000 MHz
Standard timings supported:
  1920x1080@120Hz 16:9
  1920x1080@100Hz 16:9
  1920x1080@60Hz 16:9
  1680x1050@60Hz 16:10 HorFreq: 64700 Hz Clock: 119.000 MHz
  1600x900@60Hz 16:9
  1280x1024@60Hz 5:4 HorFreq: 64000 Hz Clock: 108.000 MHz
  1280x800@60Hz 16:10
  1280x720@60Hz 16:9
Detailed mode: Clock 583.600 MHz, 597 mm x 336 mm
               2560 2568 2600 2720 hborder 0
               1440 1465 1473 1490 vborder 0
               +hsync +vsync 
               VertFreq: 143 Hz, HorFreq: 214558 Hz
Serial number: --
Monitor ranges (bare limits): 40-144Hz V, 222-222kHz H, max dotclock 600MHz
Monitor name: BenQ EX2780Q
Has 1 extension blocks
Checksum: 0x3b (valid)

CTA extension block
Extension version: 3
48 bytes of CTA data
  Video data block
    VIC  93 3840x2160@24Hz 16:9  HorFreq: 54000 Hz Clock: 297.000 MHz
    VIC  94 3840x2160@25Hz 16:9  HorFreq: 56250 Hz Clock: 297.000 MHz
    VIC  95 3840x2160@30Hz 16:9  HorFreq: 67500 Hz Clock: 297.000 MHz
    VIC  96 3840x2160@50Hz 16:9  HorFreq: 112500 Hz Clock: 594.000 MHz
    VIC  97 3840x2160@60Hz 16:9  HorFreq: 135000 Hz Clock: 594.000 MHz
    VIC  63 1920x1080@120Hz 16:9  HorFreq: 135000 Hz Clock: 297.000 MHz
    VIC  64 1920x1080@100Hz 16:9  HorFreq: 112500 Hz Clock: 297.000 MHz
    VIC  16 1920x1080@60Hz 16:9  HorFreq: 67500 Hz Clock: 148.500 MHz
    VIC  31 1920x1080@50Hz 16:9  HorFreq: 56250 Hz Clock: 148.500 MHz
    VIC  34 1920x1080@30Hz 16:9  HorFreq: 33750 Hz Clock: 74.250 MHz
    VIC  33 1920x1080@25Hz 16:9  HorFreq: 28125 Hz Clock: 74.250 MHz
    VIC  32 1920x1080@24Hz 16:9  HorFreq: 27000 Hz Clock: 74.250 MHz
    VIC   4 1280x720@60Hz 16:9  HorFreq: 45000 Hz Clock: 74.250 MHz
    VIC  19 1280x720@50Hz 16:9  HorFreq: 37500 Hz Clock: 74.250 MHz
    VIC  18 720x576@50Hz 16:9  HorFreq: 31250 Hz Clock: 27.000 MHz
    VIC   3 720x480@60Hz 16:9  HorFreq: 31469 Hz Clock: 27.000 MHz
    VIC   1 640x480@60Hz 4:3  HorFreq: 31469 Hz Clock: 25.175 MHz
  Audio data block
    Linear PCM, max channels 2
      Supported sample rates (kHz): 48 44.1 32
      Supported sample sizes (bits): 24 20 16
  Speaker allocation data block
    Speaker map:
      FL/FR - Front Left/Right
  Extended tag: Video capability data block
    YCbCr quantization: Selectable (via AVI YQ) (1)
    RGB quantization: Selectable (via AVI Q) (1)
    PT scan behaviour: No Data (0)
    IT scan behaviour: Support both over- and underscan (3)
    CE scan behaviour: Support both over- and underscan (3)
  Vendor-specific data block, OUI 000c03 (HDMI)
    Source physical address 1.0.0.0
    DC_36bit
    DC_30bit
    DC_Y444
    Maximum TMDS clock: 340MHz
  Extended tag: Colorimetry data block
    xvYCC601
    xvYCC709
    BT2020YCC
    BT2020RGB
  Extended tag: HDR static metadata data block
    Electro optical transfer functions:
      Traditional gamma - SDR luminance range
      SMPTE ST2084
    Supported static metadata descriptors:
      Static metadata type 1
    Desired content max luminance: 98 (417.710 cd/m^2)
    Desired content max frame-average luminance: 98 (417.710 cd/m^2)
    Desired content min luminance: 33 (0.070 cd/m^2)
Underscans PC formats by default
Basic audio support
Supports YCbCr 4:4:4
Supports YCbCr 4:2:2
1 native detailed modes
Detailed mode: Clock 497.750 MHz, 597 mm x 336 mm
               2560 2608 2640 2720 hborder 0
               1440 1443 1448 1525 vborder 0
               +hsync +vsync 
               VertFreq: 119 Hz, HorFreq: 182996 Hz
Detailed mode: Clock 241.500 MHz, 597 mm x 336 mm
               2560 2607 2639 2720 hborder 0
               1440 1443 1448 1481 vborder 0
               +hsync -vsync 
               VertFreq: 59 Hz, HorFreq: 88786 Hz
Checksum: 0xe8 (valid)

Warning: One or more of the timings is out of range of the Monitor Ranges:
  Vertical Freq: 24 - 143 Hz
  Horizontal Freq: 27000 - 214558 Hz
  Maximum Clock: 594.000 MHz
EDID block does not conform at all!
	Both the serial number and the serial string are set
