
EDID (hex):
00ffffffffffff001e6d175885cf0700
0315010380331d78ea3265a2554da026
115054210800714081808140b3000101
010101010101023a801871382d40582c
4500fe221100001e000000fd00384b1e
530f000a202020202020000000fc0049
505332333120202020202020000000ff
003130334e44425046313837370a00ae

Extracted contents:
header:          00 ff ff ff ff ff ff 00
serial number:   1e 6d 17 58 85 cf 07 00 03 15
version:         01 03
basic params:    80 33 1d 78 ea
chroma info:     32 65 a2 55 4d a0 26 11 50 54
established:     21 08 00
standard:        71 40 81 80 81 40 b3 00 01 01 01 01 01 01 01 01
descriptor 1:    02 3a 80 18 71 38 2d 40 58 2c 45 00 fe 22 11 00 00 1e
descriptor 2:    00 00 00 fd 00 38 4b 1e 53 0f 00 0a 20 20 20 20 20 20
descriptor 3:    00 00 00 fc 00 49 50 53 32 33 31 20 20 20 20 20 20 20
descriptor 4:    00 00 00 ff 00 31 30 33 4e 44 42 50 46 31 38 37 37 0a
extensions:      00
checksum:        ae

EDID version: 1.3
Manufacturer: GSM Model 5817 Serial Number --
Made in week 3 of 2011
Digital display
Maximum image size: 51 cm x 29 cm
Gamma: 2.20
DPMS levels: Standby Suspend Off
RGB color display
First detailed timing is preferred timing
Display x,y Chromaticity:
  Red:   0.6328, 0.3349
  Green: 0.3007, 0.6269
  Blue:  0.1494, 0.0683
  White: 0.3134, 0.3291
Established timings supported:
  640x480@60Hz 4:3 HorFreq: 31469 Hz Clock: 25.175 MHz
  800x600@60Hz 4:3 HorFreq: 37900 Hz Clock: 40.000 MHz
  1024x768@60Hz 4:3 HorFreq: 48400 Hz Clock: 65.000 MHz
Standard timings supported:
  1152x864@60Hz 4:3
  1280x1024@60Hz 5:4 HorFreq: 64000 Hz Clock: 108.000 MHz
  1280x960@60Hz 4:3 HorFreq: 60000 Hz Clock: 108.000 MHz
  1680x1050@60Hz 16:10 HorFreq: 64700 Hz Clock: 119.000 MHz
Detailed mode: Clock 148.500 MHz, 510 mm x 290 mm
               1920 2008 2052 2200 hborder 0
               1080 1084 1089 1125 vborder 0
               +hsync +vsync 
               VertFreq: 60 Hz, HorFreq: 67500 Hz
Monitor ranges (GTF): 56-75Hz V, 30-83kHz H, max dotclock 150MHz
Serial number: --
Checksum: 0xae (valid)
EDID block does NOT conform to EDID 1.3!
	Name descriptor not terminated with a newline
