
EDID (hex):
00ffffffffffff000472a901492c3031
0d17010368301b78ca3585a656489a24
125054b30d00714f818081009500d1c0
010101010101023a801871382d40582c
4500dd0c1100001e000000fd00384c1f
5311000a202020202020000000fc0053
32323148514c0a2020202020000000ff
004c50323044303237383531360a008f

Extracted contents:
header:          00 ff ff ff ff ff ff 00
serial number:   04 72 a9 01 49 2c 30 31 0d 17
version:         01 03
basic params:    68 30 1b 78 ca
chroma info:     35 85 a6 56 48 9a 24 12 50 54
established:     b3 0d 00
standard:        71 4f 81 80 81 00 95 00 d1 c0 01 01 01 01 01 01
descriptor 1:    02 3a 80 18 71 38 2d 40 58 2c 45 00 dd 0c 11 00 00 1e
descriptor 2:    00 00 00 fd 00 38 4c 1f 53 11 00 0a 20 20 20 20 20 20
descriptor 3:    00 00 00 fc 00 53 32 32 31 48 51 4c 0a 20 20 20 20 20
descriptor 4:    00 00 00 ff 00 4c 50 32 30 44 30 32 37 38 35 31 36 0a
extensions:      00
checksum:        8f

EDID version: 1.3
Manufacturer: ACR Model 1a9 Serial Number --
Made in week 13 of 2013
Analog display, Input voltage level: 0.7/0.7 V
Sync: Separate 
Maximum image size: 48 cm x 27 cm
Gamma: 2.20
DPMS levels: Standby Suspend
RGB color display
First detailed timing is preferred timing
Display x,y Chromaticity:
  Red:   0.6484, 0.3388
  Green: 0.2822, 0.6025
  Blue:  0.1425, 0.0703
  White: 0.3134, 0.3291
Established timings supported:
  720x400@70Hz 9:5 HorFreq: 31469 Hz Clock: 28.320 MHz
  640x480@60Hz 4:3 HorFreq: 31469 Hz Clock: 25.175 MHz
  640x480@67Hz 4:3 HorFreq: 35000 Hz Clock: 30.240 MHz
  800x600@56Hz 4:3 HorFreq: 35200 Hz Clock: 36.000 MHz
  800x600@60Hz 4:3 HorFreq: 37900 Hz Clock: 40.000 MHz
  1024x768@60Hz 4:3 HorFreq: 48400 Hz Clock: 65.000 MHz
  1024x768@70Hz 4:3 HorFreq: 56500 Hz Clock: 75.000 MHz
  1280x1024@75Hz 5:4 HorFreq: 80000 Hz Clock: 135.000 MHz
Standard timings supported:
  1152x864@75Hz 4:3 HorFreq: 67500 Hz Clock: 108.000 MHz
  1280x1024@60Hz 5:4 HorFreq: 64000 Hz Clock: 108.000 MHz
  1280x800@60Hz 16:10
  1440x900@60Hz 16:10 HorFreq: 55500 Hz Clock: 88.750 MHz
  1920x1080@60Hz 16:9
Detailed mode: Clock 148.500 MHz, 477 mm x 268 mm
               1920 2008 2052 2200 hborder 0
               1080 1084 1089 1125 vborder 0
               +hsync +vsync 
               VertFreq: 60 Hz, HorFreq: 67500 Hz
Monitor ranges (GTF): 56-76Hz V, 31-83kHz H, max dotclock 170MHz
Monitor name: S221HQL
Serial number: --
Checksum: 0x8f (valid)
