
EDID (hex):
00ffffffffffff0006afec4600000000
0f15010490221378020bb59757548c26
23505400000001010101010101010101
010101010101121b566050001630080a
310058c1100000180c12566050001630
080a310058c110000018000000000000
00000000000000000000000000000002
000d48ff0a3c64140e1a68202020003d

edid-decode (hex):

00 ff ff ff ff ff ff 00 06 af ec 46 00 00 00 00
0f 15 01 04 90 22 13 78 02 0b b5 97 57 54 8c 26
23 50 54 00 00 00 01 01 01 01 01 01 01 01 01 01
01 01 01 01 01 01 12 1b 56 60 50 00 16 30 08 0a
31 00 58 c1 10 00 00 18 0c 12 56 60 50 00 16 30
08 0a 31 00 58 c1 10 00 00 18 00 00 00 00 00 00
00 00 00 00 00 00 00 00 00 00 00 00 00 00 00 02
00 0d 48 ff 0a 3c 64 14 0e 1a 68 20 20 20 00 3d

----------------

Block 0, Base EDID:
  EDID Structure Version & Revision: 1.4
  Vendor & Product Identification:
    Manufacturer: AUO
    Model: 18156
    Made in: week 15 of 2011
  Basic Display Parameters & Features:
    Digital display
    Bits per primary color channel: 6
    Digital interface is not defined
    Maximum image size: 34 cm x 19 cm
    Gamma: 2.20
    Supported color formats: RGB 4:4:4
    First detailed timing includes the native pixel format and preferred refresh rate
  Color Characteristics:
    Red  : 0.5898, 0.3398
    Green: 0.3300, 0.5498
    Blue : 0.1503, 0.1396
    White: 0.3134, 0.3291
  Established Timings I & II: none
  Standard Timings: none
  Detailed Timing Descriptors:
    DTD 1:  1366x768    60.001039 Hz 683:384   47.401 kHz     69.300000 MHz (344 mm x 193 mm)
                 Hfront    8 Hsync  10 Hback   78 Hpol N
                 Vfront    3 Vsync   1 Vback   18 Vpol N
    DTD 2:  1366x768    40.000693 Hz 683:384   31.601 kHz     46.200000 MHz (344 mm x 193 mm)
                 Hfront    8 Hsync  10 Hback   78 Hpol N
                 Vfront    3 Vsync   1 Vback   18 Vpol N
    Empty Descriptor
    Manufacturer-Specified Display Descriptor (0x02): 00 02 00 0d 48 ff 0a 3c 64 14 0e 1a 68 20 20 20 '....H..<d...h   '
Checksum: 0x3d
