
EDID (hex):
00ffffffffffff0006afec4601000000
01140103802213780a0bb59757548c26
23505400000001010101010101010101
010101010101121b566050001630080a
310058c1100000180000000f00000000
00000000000000000020000000fe0041
554f0a202020202020202020000000fe
004231353658573034205636200a0045

Extracted contents:
header:          00 ff ff ff ff ff ff 00
serial number:   06 af ec 46 01 00 00 00 01 14
version:         01 03
basic params:    80 22 13 78 0a
chroma info:     0b b5 97 57 54 8c 26 23 50 54
established:     00 00 00
standard:        01 01 01 01 01 01 01 01 01 01 01 01 01 01 01 01
descriptor 1:    12 1b 56 60 50 00 16 30 08 0a 31 00 58 c1 10 00 00 18
descriptor 2:    00 00 00 0f 00 00 00 00 00 00 00 00 00 00 00 00 00 20
descriptor 3:    00 00 00 fe 00 41 55 4f 0a 20 20 20 20 20 20 20 20 20
descriptor 4:    00 00 00 fe 00 42 31 35 36 58 57 30 34 20 56 36 20 0a
extensions:      00
checksum:        45

EDID version: 1.3
Manufacturer: AUO Model 46ec Serial Number --
Made in week 1 of 2010
Digital display
Maximum image size: 34 cm x 19 cm
Gamma: 2.20
RGB color display
First detailed timing is preferred timing
Display x,y Chromaticity:
  Red:   0.5898, 0.3398
  Green: 0.3300, 0.5498
  Blue:  0.1503, 0.1396
  White: 0.3134, 0.3291
Established timings supported:
Standard timings supported:
Detailed mode: Clock 69.300 MHz, 344 mm x 193 mm
               1366 1374 1384 1462 hborder 0
                768  771  772  790 vborder 0
               -hsync -vsync 
               VertFreq: 60 Hz, HorFreq: 47400 Hz
Manufacturer-specified data, tag 15
ASCII string: AUO
ASCII string: B156XW04 V6 
Checksum: 0x45 (valid)
EDID block does NOT conform to EDID 1.3!
	Missing name descriptor
	Missing monitor ranges
