edid-decode (hex):

00 ff ff ff ff ff ff 00 06 af ec 46 00 00 00 00
0f 15 01 04 90 22 13 78 02 0b b5 97 57 54 8c 26
23 50 54 00 00 00 01 01 01 01 01 01 01 01 01 01
01 01 01 01 01 01 38 1d 56 c4 50 00 1e 30 26 16
36 00 58 c1 10 00 00 18 7b 13 56 c4 50 00 1e 30
26 16 36 00 58 c1 10 00 00 18 00 00 00 00 00 00
00 00 00 00 00 00 00 00 00 00 00 00 00 00 00 02
00 0d 48 ff 0a 3c 64 14 0e 1a 68 20 20 20 00 6f

----------------

Block 0, Base EDID:
  EDID Structure Version & Revision: 1.4
  Vendor & Product Identification:
    Manufacturer: AUO
    Model: 18156
    Made in: week 15 of 2011
  Basic Display Parameters & Features:
    Digital display
    Bits per primary color channel: 6
    Digital interface is not defined
    Maximum image size: 34 cm x 19 cm
    Gamma: 2.20
    Supported color formats: RGB 4:4:4
    First detailed timing includes the native pixel format and preferred refresh rate
  Color Characteristics:
    Red  : 0.5898, 0.3398
    Green: 0.3300, 0.5498
    Blue : 0.1503, 0.1396
    White: 0.3134, 0.3291
  Established Timings I & II: none
  Standard Timings: none
  Detailed Timing Descriptors:
    DTD 1:  1366x768    60.009 Hz 683:384  47.887 kHz  74.800 MHz (344 mm x 193 mm)
                 Hfront   38 Hsync  22 Hback 136 Hpol N
                 Vfront    3 Vsync   6 Vback  21 Vpol N
    DTD 2:  1366x768    40.009 Hz 683:384  31.927 kHz  49.870 MHz (344 mm x 193 mm)
                 Hfront   38 Hsync  22 Hback 136 Hpol N
                 Vfront    3 Vsync   6 Vback  21 Vpol N
    Empty Descriptor
    Manufacturer-Specified Display Descriptor (0x02): 00 02 00 0d 48 ff 0a 3c 64 14 0e 1a 68 20 20 20 '....H..<d...h   '
Checksum: 0x6f
