edid-decode (hex):

00 ff ff ff ff ff ff 00 12 96 00 00 01 01 01 01
05 17 01 03 08 00 00 78 8a de bd a3 55 47 99 26
0c 47 4a a1 08 00 d1 c0 01 01 01 01 01 01 01 01
01 01 01 01 01 01 02 3a 80 18 71 38 2d 40 58 2c
45 00 a2 12 32 00 00 1e 66 21 50 b0 51 00 1b 30
40 70 36 00 f8 ae 21 00 00 1e 00 00 00 fd 00 32
4c 1f 4b 10 00 0a 20 20 20 20 20 20 00 00 00 fc
00 44 69 67 69 74 61 6c 20 54 56 0a 20 20 00 80

00 ff ff ff ff ff ff 00 12 96 00 00 01 01 01 01
05 17 01 03 08 00 00 78 8a de bd a3 55 47 99 26
0c 47 4a a1 08 00 d1 c0 01 01 01 01 01 01 01 01
01 01 01 01 01 01 02 3a 80 18 71 38 2d 40 58 2c
45 00 a2 12 32 00 00 1e 66 21 50 b0 51 00 1b 30
40 70 36 00 f8 ae 21 00 00 1e 00 00 00 fd 00 32
4c 1f 4b 10 00 0a 20 20 20 20 20 20 00 00 00 fc
00 44 69 67 69 74 61 6c 20 54 56 0a 20 20 00 80

----------------

Block 0, Base EDID:
  EDID Structure Version & Revision: 1.3
  Vendor & Product Identification:
    Manufacturer: DTV
    Model: 0
    Serial Number: ...
    Made in: week 5 of 2013
  Basic Display Parameters & Features:
    Analog display
    Signal Level Standard: 0.700 : 0.300 : 1.000 V p-p
    Blank level equals black level
    Sync: Separate
    Image size is variable
    Gamma: 2.20
    DPMS levels: Standby
    RGB color display
    First detailed timing is the preferred timing
  Color Characteristics:
    Red  : 0.6396, 0.3330
    Green: 0.2802, 0.5996
    Blue : 0.1503, 0.0498
    White: 0.2802, 0.2900
  Established Timings I & II:
    IBM     :   720x400    70.081663 Hz   9:5     31.467 kHz     28.320000 MHz
    DMT 0x04:   640x480    59.940476 Hz   4:3     31.469 kHz     25.175000 MHz
    DMT 0x09:   800x600    60.316541 Hz   4:3     37.879 kHz     40.000000 MHz
    DMT 0x10:  1024x768    60.003840 Hz   4:3     48.363 kHz     65.000000 MHz
  Standard Timings:
    DMT 0x52:  1920x1080   60.000000 Hz  16:9     67.500 kHz    148.500000 MHz
  Detailed Timing Descriptors:
    DTD 1:  1920x1080   60.000000 Hz  16:9     67.500 kHz    148.500000 MHz (930 mm x 530 mm)
                 Hfront   88 Hsync  44 Hback  148 Hpol P
                 Vfront    4 Vsync   5 Vback   36 Vpol P
    DTD 2:  1360x768    60.015162 Hz  85:48    47.712 kHz     85.500000 MHz (760 mm x 430 mm)
                 Hfront   64 Hsync 112 Hback  256 Hpol P
                 Vfront    3 Vsync   6 Vback   18 Vpol P
    Display Range Limits:
      Monitor ranges (GTF): 50-76 Hz V, 31-75 kHz H, max dotclock 160 MHz
    Display Product Name: 'Digital TV'
Checksum: 0x80

----------------

Block 1, Unknown EDID Extension Block 0x00:
  00 ff ff ff ff ff ff 00 12 96 00 00 01 01 01 01 '................'
  05 17 01 03 08 00 00 78 8a de bd a3 55 47 99 26 '.......x....UG.&'
  0c 47 4a a1 08 00 d1 c0 01 01 01 01 01 01 01 01 '.GJ.............'
  01 01 01 01 01 01 02 3a 80 18 71 38 2d 40 58 2c '.......:..q8-@X,'
  45 00 a2 12 32 00 00 1e 66 21 50 b0 51 00 1b 30 'E...2...f!P.Q..0'
  40 70 36 00 f8 ae 21 00 00 1e 00 00 00 fd 00 32 '@p6...!........2'
  4c 1f 4b 10 00 0a 20 20 20 20 20 20 00 00 00 fc 'L.K...      ....'
  00 44 69 67 69 74 61 6c 20 54 56 0a 20 20 00 80 '.Digital TV.  ..'
Checksum: 0x80

----------------

Failures:

Block 1, Base EDID:
  Unknown Extension Block.
EDID:
  Base EDID: The DTD max image size is 930x530mm, but the display size is not specified anywhere.
  Base EDID: EDID specified 0 extension block(s), but found 1 extension block(s).

EDID conformity: FAIL
