edid-decode (hex):

00 ff ff ff ff ff ff 00 34 38 bf 06 b1 1c 06 00
27 0e 01 03 08 22 1b 96 28 c0 f5 a3 57 4a 9c 23
11 4f 54 bf ef 00 01 01 01 01 01 01 81 80 71 4f
01 01 01 01 01 01 30 2a 00 98 51 00 2a 40 30 70
13 00 51 0e 11 00 00 1e 00 00 00 ff 00 34 33 39
41 41 30 31 34 30 30 35 36 31 00 00 00 fc 00 31
30 31 37 32 35 0a 20 20 20 20 20 20 00 00 00 fd
00 38 4b 1f 50 0e 00 0a 20 20 20 20 20 20 00 82

----------------

Block 0, Base EDID:
  EDID Structure Version & Revision: 1.3
  Vendor & Product Identification:
    Manufacturer: MAX
    Model: 1727
    Serial Number: ...
    Made in: week 39 of 2004
  Basic Display Parameters & Features:
    Analog display
    Input voltage level: 0.7/0.3 V
    Sync: Separate
    Maximum image size: 34 cm x 27 cm
    Gamma: 2.50
    DPMS levels: Off
    RGB color display
  Color Characteristics:
    Red  : 0.6396, 0.3398
    Green: 0.2890, 0.6093
    Blue : 0.1396, 0.0693
    White: 0.3095, 0.3291
  Established Timings I & II:
    IBM     :   720x400    70.082 Hz   9:5    31.467 kHz  28.320 MHz
    DMT 0x04:   640x480    59.940 Hz   4:3    31.469 kHz  25.175 MHz
    Apple   :   640x480    66.667 Hz   4:3    35.000 kHz  30.240 MHz
    DMT 0x05:   640x480    72.809 Hz   4:3    37.861 kHz  31.500 MHz
    DMT 0x06:   640x480    75.000 Hz   4:3    37.500 kHz  31.500 MHz
    DMT 0x08:   800x600    56.250 Hz   4:3    35.156 kHz  36.000 MHz
    DMT 0x09:   800x600    60.317 Hz   4:3    37.879 kHz  40.000 MHz
    DMT 0x0a:   800x600    72.188 Hz   4:3    48.077 kHz  50.000 MHz
    DMT 0x0b:   800x600    75.000 Hz   4:3    46.875 kHz  49.500 MHz
    Apple   :   832x624    74.551 Hz   4:3    49.726 kHz  57.284 MHz
    DMT 0x10:  1024x768    60.004 Hz   4:3    48.363 kHz  65.000 MHz
    DMT 0x11:  1024x768    70.069 Hz   4:3    56.476 kHz  75.000 MHz
    DMT 0x12:  1024x768    75.029 Hz   4:3    60.023 kHz  78.750 MHz
    DMT 0x24:  1280x1024   75.025 Hz   5:4    79.976 kHz 135.000 MHz
  Standard Timings:
    DMT 0x23:  1280x1024   60.020 Hz   5:4    63.981 kHz 108.000 MHz
    DMT 0x15:  1152x864    75.000 Hz   4:3    67.500 kHz 108.000 MHz
  Detailed Timing Descriptors:
    DTD 1:  1280x1024   60.020 Hz   5:4    63.981 kHz 108.000 MHz (337 mm x 270 mm)
                 Hfront   48 Hsync 112 Hback 248 Hpol P
                 Vfront    1 Vsync   3 Vback  38 Vpol P
    Display Product Serial Number: ...
    Display Product Name: '101725'
  Display Range Limits:
    Monitor ranges (GTF): 56-75 Hz V, 31-80 kHz H, max dotclock 140 MHz
Checksum: 0x82

----------------

Failures:

Block 0, Base EDID:
  Basic Display Parameters & Features: EDID 1.3 requires that the first detailed timing is the preferred timing

EDID conformity: FAIL
