
EDID (hex):
00ffffffffffff0022f01e2601010101
110e010368261e78eea150a3574c9d25
115054adef8081800101010101010101
010101010101302a009851002a403070
1300540e1100001e000000ff00434e43
3431373059484a0a2020000000fd0032
4c1e530e000a202020202020000000fc
006870204c313930320a20202020007f

Extracted contents:
header:          00 ff ff ff ff ff ff 00
serial number:   22 f0 1e 26 01 01 01 01 11 0e
version:         01 03
basic params:    68 26 1e 78 ee
chroma info:     a1 50 a3 57 4c 9d 25 11 50 54
established:     ad ef 80
standard:        81 80 01 01 01 01 01 01 01 01 01 01 01 01 01 01
descriptor 1:    30 2a 00 98 51 00 2a 40 30 70 13 00 54 0e 11 00 00 1e
descriptor 2:    00 00 00 ff 00 43 4e 43 34 31 37 30 59 48 4a 0a 20 20
descriptor 3:    00 00 00 fd 00 32 4c 1e 53 0e 00 0a 20 20 20 20 20 20
descriptor 4:    00 00 00 fc 00 68 70 20 4c 31 39 30 32 0a 20 20 20 20
extensions:      00
checksum:        7f

EDID version: 1.3
Manufacturer: HWP Model 261e Serial Number --
Analog display, Input voltage level: 0.7/0.7 V
Sync: Separate 
Maximum image size: 38 cm x 30 cm
Gamma: 2.20
DPMS levels: Standby Suspend Off
RGB color display
Default (sRGB) color space is primary color space
First detailed timing is preferred timing
Display x,y Chromaticity:
  Red:   0.6386, 0.3417
  Green: 0.2968, 0.6142
  Blue:  0.1455, 0.0673
  White: 0.3125, 0.3281
Established timings supported:
  720x400@70Hz 9:5 HorFreq: 31469 Hz Clock: 28.320 MHz
  640x480@60Hz 4:3 HorFreq: 31469 Hz Clock: 25.175 MHz
  640x480@72Hz 4:3 HorFreq: 37900 Hz Clock: 31.500 MHz
  640x480@75Hz 4:3 HorFreq: 37500 Hz Clock: 31.500 MHz
  800x600@60Hz 4:3 HorFreq: 37900 Hz Clock: 40.000 MHz
  800x600@72Hz 4:3 HorFreq: 48100 Hz Clock: 50.000 MHz
  800x600@75Hz 4:3 HorFreq: 46900 Hz Clock: 49.500 MHz
  832x624@75Hz 4:3 HorFreq: 49726 Hz Clock: 57.284 MHz
  1024x768@60Hz 4:3 HorFreq: 48400 Hz Clock: 65.000 MHz
  1024x768@70Hz 4:3 HorFreq: 56500 Hz Clock: 75.000 MHz
  1024x768@75Hz 4:3 HorFreq: 60000 Hz Clock: 78.750 MHz
  1280x1024@75Hz 5:4 HorFreq: 80000 Hz Clock: 135.000 MHz
  1152x870@75Hz 192:145 HorFreq: 67500 Hz Clock: 108.000 MHz
Standard timings supported:
  1280x1024@60Hz 5:4 HorFreq: 64000 Hz Clock: 108.000 MHz
Detailed mode: Clock 108.000 MHz, 340 mm x 270 mm
               1280 1328 1440 1688 hborder 0
               1024 1025 1028 1066 vborder 0
               +hsync +vsync 
               VertFreq: 60 Hz, HorFreq: 63981 Hz
Serial number: --
Monitor ranges (GTF): 50-76Hz V, 30-83kHz H, max dotclock 140MHz
Monitor name: hp L1902
Checksum: 0x7f (valid)
EDID block does NOT conform to EDID 1.3!
	sRGB is signaled, but the chromaticities do not match
EDID block does not conform at all!
	Bad year of manufacture


