edid-decode (hex):

00 ff ff ff ff ff ff 00 30 e4 e2 02 00 00 00 00
00 14 01 03 80 1f 11 78 0a 43 45 97 59 57 8e 28
21 50 54 00 00 00 01 01 01 01 01 01 01 01 01 01
01 01 01 01 01 01 80 25 40 80 60 84 1a 30 30 20
35 00 36 ae 10 00 00 19 00 00 00 00 00 00 00 00
00 00 00 00 00 00 00 00 00 00 00 00 00 fe 00 4c
47 20 44 69 73 70 6c 61 79 0a 20 20 00 00 00 fe
00 4c 50 31 34 30 57 44 32 2d 54 4c 42 31 00 38

----------------

Block 0, Base EDID:
  EDID Structure Version & Revision: 1.3
  Vendor & Product Identification:
    Manufacturer: LGD
    Model: 738
    Made in: 2010
  Basic Display Parameters & Features:
    Digital display
    Maximum image size: 31 cm x 17 cm
    Gamma: 2.20
    RGB color display
    First detailed timing is preferred timing
  Color Characteristics:
    Red  : 0.5908, 0.3476
    Green: 0.3398, 0.5576
    Blue : 0.1572, 0.1289
    White: 0.3134, 0.3291
  Established Timings I & II: none
  Standard Timings: none
  Detailed Timing Descriptors:
    DTD 1:  1600x900    59.995 Hz  16:9    55.556 kHz  96.000 MHz (310 mm x 174 mm)
                 Hfront   48 Hsync  32 Hback  48 Hpol N
                 Vfront    3 Vsync   5 Vback  18 Vpol N
    Empty Descriptor
    Alphanumeric Data String: 'LG Display'
    Alphanumeric Data String: 'LP140WD2-TLB1'
Checksum: 0x38
