edid-decode (hex):

00 ff ff ff ff ff ff 00 25 cc 16 00 00 00 00 00
00 14 01 03 80 1f 12 78 0a 87 f5 94 57 4f 8c 27
27 50 54 00 00 00 01 01 01 01 01 01 01 01 01 01
01 01 01 01 01 01 bc 1b 56 84 50 00 16 30 30 20
14 00 35 ae 10 00 00 18 00 00 00 00 00 00 00 00
00 00 00 00 00 00 00 00 00 00 00 00 00 fe 00 49
4e 4c 0a 20 20 20 20 20 20 20 20 20 00 00 00 fe
00 42 54 31 34 30 47 57 30 31 56 36 0a 20 00 d1

----------------

Block 0, Base EDID:
  EDID Structure Version & Revision: 1.3
  Vendor & Product Identification:
    Manufacturer: INL
    Model: 22
    Made in: 2010
  Basic Display Parameters & Features:
    Digital display
    Maximum image size: 31 cm x 18 cm
    Gamma: 2.20
    RGB color display
    First detailed timing is the preferred timing
  Color Characteristics:
    Red  : 0.5800, 0.3398
    Green: 0.3095, 0.5498
    Blue : 0.1552, 0.1552
    White: 0.3134, 0.3291
  Established Timings I & II: none
  Standard Timings: none
  Detailed Timing Descriptors:
    DTD 1:  1366x768    59.995606 Hz 683:384   47.397 kHz     71.000000 MHz (309 mm x 174 mm)
                 Hfront   48 Hsync  32 Hback   52 Hpol N
                 Vfront    1 Vsync   4 Vback   17 Vpol N
    Empty Descriptor
    Alphanumeric Data String: 'INL'
    Alphanumeric Data String: 'BT140GW01V6'
Checksum: 0xd1

----------------

Failures:

Block 0, Base EDID:
  Empty Descriptor: Use Dummy Descriptor instead of all zeroes.
  Missing Display Product Name.
  Missing Display Range Limits Descriptor.

EDID conformity: FAIL
