edid-decode (hex):

00 ff ff ff ff ff ff 00 4c a3 4e 36 00 00 00 00
00 12 01 03 80 16 0d 78 0a d9 25 92 58 55 8f 29
1f 50 54 00 00 00 01 01 01 01 01 01 01 01 01 01
01 01 01 01 01 01 1b 15 00 40 41 58 46 20 18 88
36 00 df 7d 00 00 00 19 00 00 00 0f 00 00 00 00
00 00 00 00 00 58 fd 13 6e 00 00 00 00 fe 00 53
41 4d 53 55 4e 47 0a 20 20 20 20 20 00 00 00 fe
00 31 30 31 4e 54 30 36 2d 54 30 31 0a 20 00 87

----------------

Block 0, Base EDID:
  EDID Structure Version & Revision: 1.3
  Vendor & Product Identification:
    Manufacturer: SEC
    Model: 13902
    Made in: 2008
  Basic Display Parameters & Features:
    Digital display
    Maximum image size: 22 cm x 13 cm
    Gamma: 2.20
    RGB color display
    First detailed timing is preferred timing
  Color Characteristics:
    Red  : 0.5732, 0.3447
    Green: 0.3339, 0.5595
    Blue : 0.1601, 0.1230
    White: 0.3134, 0.3291
  Established Timings I & II: none
  Standard Timings: none
  Detailed Timing Descriptors:
    DTD 1:  1024x600    60.001 Hz 128:75   40.201 kHz  54.030 MHz (223 mm x 125 mm)
                 Hfront   24 Hsync 136 Hback 160 Hpol N
                 Vfront    3 Vsync   6 Vback  61 Vpol N
    Manufacturer-Specified Display Descriptor (0x0f): 00 0f 00 00 00 00 00 00 00 00 00 58 fd 13 6e 00 '...........X..n.'
    Alphanumeric Data String: 'SAMSUNG'
    Alphanumeric Data String: '101NT06-T01'
Checksum: 0x87
