edid-decode (hex):

00 ff ff ff ff ff ff 00 4c f4 32 bc 01 01 01 01
29 1e 01 04 b5 22 14 78 2f 57 a1 b3 33 33 cc 14
14 50 54 21 08 00 d1 00 b3 00 95 00 81 00 01 01
01 01 01 01 01 01 c3 80 40 50 b0 08 38 70 30 20
35 00 58 c4 10 00 00 1a 00 00 00 ff a0 0a 20 20
20 20 20 20 20 20 20 20 20 20 00 00 00 fc 00 44
50 0a 20 20 20 20 20 20 20 20 20 20 00 00 00 fd
00 30 3c 6e 6e 28 01 0a 20 20 20 20 20 20 01 48

02 03 18 b2 45 90 01 02 03 20 e2 00 c0 e3 05 c0
00 e6 06 07 01 62 62 00 c3 80 40 50 b0 08 38 70
30 20 35 00 58 c4 10 00 00 1e 02 3a 80 18 71 38
2d 40 30 20 35 00 58 c4 10 00 00 9e 00 00 00 00
00 00 00 00 00 00 00 00 00 00 00 00 00 00 00 00
00 00 00 00 00 00 00 00 00 00 00 00 00 00 00 00
00 00 00 00 00 00 00 00 00 00 00 00 00 00 00 00
00 00 00 00 00 00 00 00 00 00 00 00 00 00 00 f9

00 ff ff ff ff ff ff 00 4c f4 32 bc 01 01 01 01
29 1e 01 04 b5 22 14 78 2f 57 a1 b3 33 33 cc 14
14 50 54 21 08 00 d1 00 b3 00 95 00 81 00 01 01
01 01 01 01 01 01 c3 80 40 50 b0 08 38 70 30 20
35 00 58 c4 10 00 00 1a 00 00 00 ff a0 0a 20 20
20 20 20 20 20 20 20 20 20 20 00 00 00 fc 00 44
50 0a 20 20 20 20 20 20 20 20 20 20 00 00 00 fd
00 30 3c 6e 6e 28 01 0a 20 20 20 20 20 20 01 48

02 03 18 b2 45 90 01 02 03 20 e2 00 c0 e3 05 c0
00 e6 06 07 01 62 62 00 c3 80 40 50 b0 08 38 70
30 20 35 00 58 c4 10 00 00 1e 02 3a 80 18 71 38
2d 40 30 20 35 00 58 c4 10 00 00 9e 00 00 00 00
00 00 00 00 00 00 00 00 00 00 00 00 00 00 00 00
00 00 00 00 00 00 00 00 00 00 00 00 00 00 00 00
00 00 00 00 00 00 00 00 00 00 00 00 00 00 00 00
00 00 00 00 00 00 00 00 00 00 00 00 00 00 00 f9

----------------

Block 0, Base EDID:
  EDID Structure Version & Revision: 1.4
  Vendor & Product Identification:
    Manufacturer: SGT
    Model: 48178
    Serial Number: ...
    Made in: week 41 of 2020
  Basic Display Parameters & Features:
    Digital display
    Bits per primary color channel: 10
    DisplayPort interface
    Maximum image size: 34 cm x 20 cm
    Gamma: 2.20
    DPMS levels: Off
    Supported color formats: RGB 4:4:4, YCrCb 4:4:4
    Default (sRGB) color space is primary color space
    First detailed timing includes the native pixel format and preferred refresh rate
    Display is continuous frequency
  Color Characteristics:
    Red  : 0.7001, 0.2001
    Green: 0.2001, 0.7998
    Blue : 0.0800, 0.0800
    White: 0.3125, 0.3291
  Established Timings I & II:
    DMT 0x04:   640x480    59.940476 Hz   4:3     31.469 kHz     25.175000 MHz
    DMT 0x09:   800x600    60.316541 Hz   4:3     37.879 kHz     40.000000 MHz
    DMT 0x10:  1024x768    60.003840 Hz   4:3     48.363 kHz     65.000000 MHz
  Standard Timings:
    DMT 0x45:  1920x1200   59.884600 Hz  16:10    74.556 kHz    193.250000 MHz
    DMT 0x3a:  1680x1050   59.954250 Hz  16:10    65.290 kHz    146.250000 MHz
    DMT 0x2f:  1440x900    59.887445 Hz  16:10    55.935 kHz    106.500000 MHz
    DMT 0x1c:  1280x800    59.810326 Hz  16:10    49.702 kHz     83.500000 MHz
  Detailed Timing Descriptors:
    DTD 1:  2880x1800   60.000801 Hz  16:10   111.361 kHz    329.630000 MHz (344 mm x 196 mm)
                 Hfront   48 Hsync  32 Hback    0 Hpol P
                 Vfront    3 Vsync   5 Vback   48 Vpol N
    Display Product Serial Number: ...
    Display Product Name: 'DP'
    Display Range Limits:
      Monitor ranges (Bare Limits): 48-60 Hz V, 110-110 kHz H, max dotclock 400 MHz
  Extension blocks: 1
Checksum: 0x48

----------------

Block 1, CTA-861 Extension Block:
  Revision: 3
  Underscans IT Video Formats by default
  Supports YCbCr 4:4:4
  Supports YCbCr 4:2:2
  Native detailed modes: 2
  Video Data Block:
    VIC  16:  1920x1080   60.000000 Hz  16:9     67.500 kHz    148.500000 MHz (native)
    VIC   1:   640x480    59.940476 Hz   4:3     31.469 kHz     25.175000 MHz
    VIC   2:   720x480    59.940060 Hz   4:3     31.469 kHz     27.000000 MHz
    VIC   3:   720x480    59.940060 Hz  16:9     31.469 kHz     27.000000 MHz
    VIC  32:  1920x1080   24.000000 Hz  16:9     27.000 kHz     74.250000 MHz
  Video Capability Data Block:
    YCbCr quantization: Selectable (via AVI YQ)
    RGB quantization: Selectable (via AVI Q)
    PT scan behavior: No Data
    IT scan behavior: IT video formats not supported
    CE scan behavior: CE video formats not supported
  Colorimetry Data Block:
    BT2020YCC
    BT2020RGB
  HDR Static Metadata Data Block:
    Electro optical transfer functions:
      Traditional gamma - SDR luminance range
      Traditional gamma - HDR luminance range
      SMPTE ST2084
    Supported static metadata descriptors:
      Static metadata type 1
    Desired content max luminance: 98 (417.710 cd/m^2)
    Desired content max frame-average luminance: 98 (417.710 cd/m^2)
    Desired content min luminance: 0 (0.000 cd/m^2)
  Detailed Timing Descriptors:
    DTD 2:  2880x1800   60.000801 Hz  16:10   111.361 kHz    329.630000 MHz (344 mm x 196 mm)
                 Hfront   48 Hsync  32 Hback    0 Hpol P
                 Vfront    3 Vsync   5 Vback   48 Vpol P
    DTD 3:  1920x2160i  59.973345 Hz   8:9     67.500 kHz    148.500000 MHz (344 mm x 196 mm)
                 Hfront   48 Hsync  32 Hback  200 Hpol P
                 Vfront    3 Vsync   5 Vback   37 Vpol P Vfront +0.5 Odd Field
                 Vfront    3 Vsync   5 Vback   37 Vpol P Vback  +0.5 Even Field
Checksum: 0xf9  Unused space in Extension Block: 67 bytes

----------------

Block 2, Unknown EDID Extension Block 0x00:
  00 ff ff ff ff ff ff 00 4c f4 32 bc 01 01 01 01 '........L.2.....'
  29 1e 01 04 b5 22 14 78 2f 57 a1 b3 33 33 cc 14 ')....".x/W..33..'
  14 50 54 21 08 00 d1 00 b3 00 95 00 81 00 01 01 '.PT!............'
  01 01 01 01 01 01 c3 80 40 50 b0 08 38 70 30 20 '........@P..8p0 '
  35 00 58 c4 10 00 00 1a 00 00 00 ff a0 0a 20 20 '5.X...........  '
  20 20 20 20 20 20 20 20 20 20 00 00 00 fc 00 44 '          .....D'
  50 0a 20 20 20 20 20 20 20 20 20 20 00 00 00 fd 'P.          ....'
  00 30 3c 6e 6e 28 01 0a 20 20 20 20 20 20 01 48 '.0<nn(..      .H'
Checksum: 0x48

----------------

Block 3, CTA-861 Extension Block:
  Revision: 3
  Underscans IT Video Formats by default
  Supports YCbCr 4:4:4
  Supports YCbCr 4:2:2
  Native detailed modes: 2
  Video Data Block:
    VIC  16:  1920x1080   60.000000 Hz  16:9     67.500 kHz    148.500000 MHz (native)
    VIC   1:   640x480    59.940476 Hz   4:3     31.469 kHz     25.175000 MHz
    VIC   2:   720x480    59.940060 Hz   4:3     31.469 kHz     27.000000 MHz
    VIC   3:   720x480    59.940060 Hz  16:9     31.469 kHz     27.000000 MHz
    VIC  32:  1920x1080   24.000000 Hz  16:9     27.000 kHz     74.250000 MHz
  Video Capability Data Block:
    YCbCr quantization: Selectable (via AVI YQ)
    RGB quantization: Selectable (via AVI Q)
    PT scan behavior: No Data
    IT scan behavior: IT video formats not supported
    CE scan behavior: CE video formats not supported
  Colorimetry Data Block:
    BT2020YCC
    BT2020RGB
  HDR Static Metadata Data Block:
    Electro optical transfer functions:
      Traditional gamma - SDR luminance range
      Traditional gamma - HDR luminance range
      SMPTE ST2084
    Supported static metadata descriptors:
      Static metadata type 1
    Desired content max luminance: 98 (417.710 cd/m^2)
    Desired content max frame-average luminance: 98 (417.710 cd/m^2)
    Desired content min luminance: 0 (0.000 cd/m^2)
  Detailed Timing Descriptors:
    DTD 4:  2880x1800   60.000801 Hz  16:10   111.361 kHz    329.630000 MHz (344 mm x 196 mm)
                 Hfront   48 Hsync  32 Hback    0 Hpol P
                 Vfront    3 Vsync   5 Vback   48 Vpol P
    DTD 5:  1920x2160i  59.973345 Hz   8:9     67.500 kHz    148.500000 MHz (344 mm x 196 mm)
                 Hfront   48 Hsync  32 Hback  200 Hpol P
                 Vfront    3 Vsync   5 Vback   37 Vpol P Vfront +0.5 Odd Field
                 Vfront    3 Vsync   5 Vback   37 Vpol P Vback  +0.5 Even Field
Checksum: 0xf9  Unused space in Extension Block: 67 bytes

----------------

Warnings:

Block 1, CTA-861 Extension Block:
  Video Capability Data Block: IT scan behavior is expected to support underscanned.
  Video Capability Data Block: 'CE video formats not supported' makes no sense.
  Display Product Serial Number is set, so the Serial Number in the Base EDID should be 0.
Block 3, CTA-861 Extension Block:
  Video Capability Data Block: IT scan behavior is expected to support underscanned.
  Video Capability Data Block: 'CE video formats not supported' makes no sense.
  Display Product Serial Number is set, so the Serial Number in the Base EDID should be 0.
EDID:
  Base EDID: Some timings are out of range of the Monitor Ranges:
    Vertical Freq: 24.000 - 60.317 Hz (Monitor: 48.000 - 60.000 Hz)
    Horizontal Freq: 27.000 - 111.361 kHz (Monitor: 110.000 - 110.000 kHz)

Failures:

Block 0, Base EDID:
  Basic Display Parameters & Features: sRGB is signaled, but the chromaticities do not match.
  Detailed Timing Descriptor #1: 0 or negative horizontal back porch.
  Display Descriptor #2: Monitor descriptor block has byte 4 nonzero (0xa0).
  Display Product Serial Number: ...
Block 1, CTA-861 Extension Block:
  Detailed Timing Descriptor #2: 0 or negative horizontal back porch.
Block 2, Base EDID:
  Unknown Extension Block.
Block 3, CTA-861 Extension Block:
  Video Data Block: Duplicate VIC 16.
  Video Data Block: Duplicate VIC 1.
  Video Data Block: Duplicate VIC 2.
  Video Data Block: Duplicate VIC 3.
  Video Data Block: Duplicate VIC 32.
  Video Capability Data Block: Only one instance of this Data Block is allowed.
  Colorimetry Data Block: Only one instance of this Data Block is allowed.
  HDR Static Metadata Data Block: Only one instance of this Data Block is allowed.
  Detailed Timing Descriptor #4: 0 or negative horizontal back porch.
EDID:
  Base EDID: EDID specified 1 extension block(s), but found 3 extension block(s).
  CTA-861: Native progressive timings are a mix of several resolutions.

EDID conformity: FAIL
