
EDID (hex):
00ffffffffffff00410c8608230c0000
14160103802f1e782a78f1a655489b26
125054b74b0081809500950fb3000101
01010101010121399030621a274068b0
3600d9281100001c000000ff00415534
31323230303033313037000000fc0050
68696c69707320323230530a000000fd
00384c1e5311000a2020202020200060

edid-decode (hex):

00 ff ff ff ff ff ff 00 41 0c 86 08 23 0c 00 00
14 16 01 03 80 2f 1e 78 2a 78 f1 a6 55 48 9b 26
12 50 54 b7 4b 00 81 80 95 00 95 0f b3 00 01 01
01 01 01 01 01 01 21 39 90 30 62 1a 27 40 68 b0
36 00 d9 28 11 00 00 1c 00 00 00 ff 00 41 55 34
31 32 32 30 30 30 33 31 30 37 00 00 00 fc 00 50
68 69 6c 69 70 73 20 32 32 30 53 0a 00 00 00 fd
00 38 4c 1e 53 11 00 0a 20 20 20 20 20 20 00 60

----------------

Block 0, Base EDID:
  EDID Structure Version & Revision: 1.3
  Vendor & Product Identification:
    Manufacturer: PHL
    Model: 2182
    Serial Number: 3107
    Made in: week 20 of 2012
  Basic Display Parameters & Features:
    Digital display
    Maximum image size: 47 cm x 30 cm
    Gamma: 2.20
    DPMS levels: Off
    RGB color display
    First detailed timing is the preferred timing
  Color Characteristics:
    Red  : 0.6494, 0.3349
    Green: 0.2832, 0.6054
    Blue : 0.1513, 0.0732
    White: 0.3125, 0.3291
  Established Timings I & II:
    IBM     :   720x400    70.081663 Hz   9:5     31.467 kHz     28.320000 MHz
    DMT 0x04:   640x480    59.940476 Hz   4:3     31.469 kHz     25.175000 MHz
    Apple   :   640x480    66.666667 Hz   4:3     35.000 kHz     30.240000 MHz
    DMT 0x06:   640x480    75.000000 Hz   4:3     37.500 kHz     31.500000 MHz
    DMT 0x08:   800x600    56.250000 Hz   4:3     35.156 kHz     36.000000 MHz
    DMT 0x09:   800x600    60.316541 Hz   4:3     37.879 kHz     40.000000 MHz
    DMT 0x0b:   800x600    75.000000 Hz   4:3     46.875 kHz     49.500000 MHz
    DMT 0x10:  1024x768    60.003840 Hz   4:3     48.363 kHz     65.000000 MHz
    DMT 0x12:  1024x768    75.028582 Hz   4:3     60.023 kHz     78.750000 MHz
    DMT 0x24:  1280x1024   75.024675 Hz   5:4     79.976 kHz    135.000000 MHz
  Standard Timings:
    DMT 0x23:  1280x1024   60.019740 Hz   5:4     63.981 kHz    108.000000 MHz
    DMT 0x2f:  1440x900    59.887445 Hz  16:10    55.935 kHz    106.500000 MHz
    DMT 0x30:  1440x900    74.984427 Hz  16:10    70.635 kHz    136.750000 MHz
    DMT 0x3a:  1680x1050   59.954250 Hz  16:10    65.290 kHz    146.250000 MHz
  Detailed Timing Descriptors:
    DTD 1:  1680x1050   59.954250 Hz  16:10    65.290 kHz    146.250000 MHz (473 mm x 296 mm)
                 Hfront  104 Hsync 176 Hback  280 Hpol N
                 Vfront    3 Vsync   6 Vback   30 Vpol P
    Display Product Serial Number: 'AU41220003107'
    Display Product Name: 'Philips 220S'
    Display Range Limits:
      Monitor ranges (GTF): 56-76 Hz V, 30-83 kHz H, max dotclock 170 MHz
Checksum: 0x60


