edid-decode (hex):

00 ff ff ff ff ff ff 00 06 10 44 a0 00 00 00 00
24 1d 01 04 b5 22 16 78 02 0f 51 ae 52 43 b0 26
0e 50 54 00 00 00 01 01 01 01 01 01 01 01 01 01
01 01 01 01 01 01 e7 91 00 50 c0 80 37 70 08 20
98 08 59 d7 10 00 00 1a 00 00 00 fc 00 43 6f 6c
6f 72 20 4c 43 44 0a 20 20 20 00 00 00 10 00 00
00 00 00 00 00 00 00 00 00 00 00 00 00 00 00 10
00 00 00 00 00 00 00 00 00 00 00 00 00 00 01 da

70 12 79 03 00 7f 81 3f fa 10 00 03 01 18 0f 28
17 00 00 00 00 00 00 00 00 00 00 00 00 00 00 00
4c 50 31 36 30 57 54 31 2d 53 4a 41 34 0a 20 00
46 30 59 30 32 36 37 30 31 4b 41 50 4c 56 37 41
4b 0a 20 20 20 20 20 7f 81 29 fa 10 00 02 01 00
11 00 00 02 90 03 3f 04 33 05 80 07 47 09 b5 0d
0c 11 a4 17 fd 20 c9 2d 03 3e 10 55 e8 77 5a a6
64 e8 ba 00 00 00 00 00 00 00 00 00 00 00 77 90

----------------

Block 0, Base EDID:
  EDID Structure Version & Revision: 1.4
  Vendor & Product Identification:
    Manufacturer: APP
    Model: 41028
    Made in: week 36 of 2019
  Basic Display Parameters & Features:
    Digital display
    Bits per primary color channel: 10
    DisplayPort interface
    Maximum image size: 34 cm x 22 cm
    Gamma: 2.20
    Supported color formats: RGB 4:4:4
    First detailed timing includes the native pixel format and preferred refresh rate
  Color Characteristics:
    Red  : 0.6796, 0.3203
    Green: 0.2646, 0.6904
    Blue : 0.1494, 0.0556
    White: 0.3125, 0.3291
  Established Timings I & II: none
  Standard Timings: none
  Detailed Timing Descriptors:
    DTD 1:  3072x1920   59.999679 Hz   8:5    118.499 kHz    373.510000 MHz (345 mm x 215 mm)
                 Hfront    8 Hsync  32 Hback   40 Hpol P
                 Vfront   41 Vsync   8 Vback    6 Vpol N
    Display Product Name: 'Color LCD'
    Dummy Descriptor:
    Dummy Descriptor:
  Extension blocks: 1
Checksum: 0xda

----------------

Block 1, DisplayID Extension Block:
  Version: 1.2
  Extension Count: 0
  Display Product Type: Standalone display device
  Vendor-Specific Data Block (0x7f) (Apple), OUI 00-10-FA:
    03 01 18 0f 28 17 00 00 00 00 00 00 00 00 00 00 '....(...........'
    00 00 00 00 00 4c 50 31 36 30 57 54 31 2d 53 4a '.....LP160WT1-SJ'
    41 34 0a 20 00 46 30 59 30 32 36 37 30 31 4b 41 'A4. .F0Y026701KA'
    50 4c 56 37 41 4b 0a 20 20 20 20 20             'PLV7AK.     '
  Vendor-Specific Data Block (0x7f) (Apple), OUI 00-10-FA:
    02 01 00 11 00 00 02 90 03 3f 04 33 05 80 07 47 '.........?.3...G'
    09 b5 0d 0c 11 a4 17 fd 20 c9 2d 03 3e 10 55 e8 '........ .-.>.U.'
    77 5a a6 64 e8 ba                               'wZ.d..'
  Checksum: 0x77
Checksum: 0x90

----------------

Warnings:

Block 1, DisplayID Extension Block:
  Vendor-Specific Data Block (0x7f) (Apple), OUI 00-10-FA: Expected PNP ID but found OUI.
  Vendor-Specific Data Block (0x7f) (Apple), OUI 00-10-FA: Expected PNP ID but found OUI.

Failures:

Block 1, DisplayID Extension Block:
  Vendor-Specific Data Block (0x7f) (Apple), OUI 00-10-FA: Endian-ness (le) of OUI is different than expected (be).
  Vendor-Specific Data Block (0x7f) (Apple), OUI 00-10-FA: Endian-ness (le) of OUI is different than expected (be).
EDID:
  DisplayID: Missing DisplayID Product Identification Data Block.
  DisplayID: Missing DisplayID Display Parameters Data Block.
  DisplayID: Missing DisplayID Display Interface Features Data Block.
  DisplayID: Missing DisplayID Type I Detailed Timing Data Block.
  DisplayID: DisplayID expects at least one preferred timing.

EDID conformity: FAIL
