edid-decode (hex):

00 ff ff ff ff ff ff 00 04 72 9b 00 45 51 91 92
1d 13 01 03 80 35 1d 78 ea 60 85 a6 56 4a 9c 25
12 50 54 af cf 00 81 80 71 4f 95 00 95 0f a9 40
b3 00 01 01 01 01 1a 36 80 a0 70 38 1f 40 30 20
25 00 13 2a 21 00 00 1a 00 00 00 fc 00 58 32 34
33 48 0a 20 20 20 20 20 20 20 00 00 00 fd 00 38
4c 1f 53 12 00 0a 20 20 20 20 20 20 00 00 00 ff
00 4c 46 48 30 43 30 31 33 34 30 4d 30 0a 00 fd

00 ff ff ff ff ff ff 00 04 72 9b 00 45 51 91 92
1d 13 01 03 80 35 1d 78 ea 60 85 a6 56 4a 9c 25
12 50 54 af cf 00 81 80 71 4f 95 00 95 0f a9 40
b3 00 01 01 01 01 1a 36 80 a0 70 38 1f 40 30 20
25 00 13 2a 21 00 00 1a 00 00 00 fc 00 58 32 34
33 48 0a 20 20 20 20 20 20 20 00 00 00 fd 00 38
4c 1f 53 12 00 0a 20 20 20 20 20 20 00 00 00 ff
00 4c 46 48 30 43 30 31 33 34 30 4d 30 0a 00 fd

----------------

Block 0, Base EDID:
  EDID Structure Version & Revision: 1.3
  Vendor & Product Identification:
    Manufacturer: ACR
    Model: 155
    Serial Number: ...
    Made in: week 29 of 2009
  Basic Display Parameters & Features:
    Digital display
    Maximum image size: 53 cm x 29 cm
    Gamma: 2.20
    DPMS levels: Standby Suspend Off
    RGB color display
    First detailed timing is the preferred timing
  Color Characteristics:
    Red  : 0.6494, 0.3378
    Green: 0.2890, 0.6093
    Blue : 0.1464, 0.0703
    White: 0.3134, 0.3291
  Established Timings I & II:
    IBM     :   720x400    70.081663 Hz   9:5     31.467 kHz     28.320000 MHz
    DMT 0x04:   640x480    59.940476 Hz   4:3     31.469 kHz     25.175000 MHz
    DMT 0x05:   640x480    72.808802 Hz   4:3     37.861 kHz     31.500000 MHz
    DMT 0x06:   640x480    75.000000 Hz   4:3     37.500 kHz     31.500000 MHz
    DMT 0x08:   800x600    56.250000 Hz   4:3     35.156 kHz     36.000000 MHz
    DMT 0x09:   800x600    60.316541 Hz   4:3     37.879 kHz     40.000000 MHz
    DMT 0x0a:   800x600    72.187572 Hz   4:3     48.077 kHz     50.000000 MHz
    DMT 0x0b:   800x600    75.000000 Hz   4:3     46.875 kHz     49.500000 MHz
    DMT 0x10:  1024x768    60.003840 Hz   4:3     48.363 kHz     65.000000 MHz
    DMT 0x11:  1024x768    70.069359 Hz   4:3     56.476 kHz     75.000000 MHz
    DMT 0x12:  1024x768    75.028582 Hz   4:3     60.023 kHz     78.750000 MHz
    DMT 0x24:  1280x1024   75.024675 Hz   5:4     79.976 kHz    135.000000 MHz
  Standard Timings:
    DMT 0x23:  1280x1024   60.019740 Hz   5:4     63.981 kHz    108.000000 MHz
    DMT 0x15:  1152x864    75.000000 Hz   4:3     67.500 kHz    108.000000 MHz
    DMT 0x2f:  1440x900    59.887445 Hz  16:10    55.935 kHz    106.500000 MHz
    DMT 0x30:  1440x900    74.984427 Hz  16:10    70.635 kHz    136.750000 MHz
    DMT 0x33:  1600x1200   60.000000 Hz   4:3     75.000 kHz    162.000000 MHz
    DMT 0x3a:  1680x1050   59.954250 Hz  16:10    65.290 kHz    146.250000 MHz
  Detailed Timing Descriptors:
    DTD 1:  1920x1080   59.933878 Hz  16:9     66.587 kHz    138.500000 MHz (531 mm x 298 mm)
                 Hfront   48 Hsync  32 Hback   80 Hpol P
                 Vfront    2 Vsync   5 Vback   24 Vpol N
    Display Product Name: 'X243H'
    Display Range Limits:
      Monitor ranges (GTF): 56-76 Hz V, 31-83 kHz H, max dotclock 180 MHz
    Display Product Serial Number: ...
Checksum: 0xfd

----------------

Block 1, Unknown EDID Extension Block 0x00:
  00 ff ff ff ff ff ff 00 04 72 9b 00 45 51 91 92 '.........r..EQ..'
  1d 13 01 03 80 35 1d 78 ea 60 85 a6 56 4a 9c 25 '.....5.x.`..VJ.%'
  12 50 54 af cf 00 81 80 71 4f 95 00 95 0f a9 40 '.PT.....qO.....@'
  b3 00 01 01 01 01 1a 36 80 a0 70 38 1f 40 30 20 '.......6..p8.@0 '
  25 00 13 2a 21 00 00 1a 00 00 00 fc 00 58 32 34 '%..*!........X24'
  33 48 0a 20 20 20 20 20 20 20 00 00 00 fd 00 38 '3H.       .....8'
  4c 1f 53 12 00 0a 20 20 20 20 20 20 00 00 00 ff 'L.S...      ....'
  00 4c 46 48 30 43 30 31 33 34 30 4d 30 0a 00 fd '.LFH0C01340M0...'
Checksum: 0xfd

----------------

Failures:

Block 1, Base EDID:
  Unknown Extension Block.
EDID:
  Base EDID: EDID specified 0 extension block(s), but found 1 extension block(s).

EDID conformity: FAIL
