edid-decode (hex):

00 ff ff ff ff ff ff 00 30 e4 94 04 00 00 00 00
00 18 01 04 95 1d 11 78 0a 86 e5 95 59 57 8f 27
1e 50 54 00 00 00 01 01 01 01 01 01 01 01 01 01
01 01 01 01 01 01 ce 1d 56 f2 50 00 16 30 30 20
35 00 25 a5 10 00 00 19 d8 17 56 f2 50 00 16 30
30 20 35 00 25 a5 10 00 00 19 00 00 00 00 00 00
00 00 00 00 00 00 00 00 00 00 00 00 00 00 00 02
00 0a 3d ff 0a 3c 7d 18 0e 20 7d 00 00 00 00 6c

----------------

Block 0, Base EDID:
  EDID Structure Version & Revision: 1.4
  Vendor & Product Identification:
    Manufacturer: LGD
    Model: 1172
    Made in: 2014
  Basic Display Parameters & Features:
    Digital display
    Bits per primary color channel: 6
    DisplayPort interface
    Maximum image size: 29 cm x 17 cm
    Gamma: 2.20
    Supported color formats: RGB 4:4:4, YCrCb 4:4:4
    First detailed timing includes the native pixel format and preferred refresh rate
  Color Characteristics:
    Red  : 0.5839, 0.3476
    Green: 0.3408, 0.5605
    Blue : 0.1552, 0.1191
    White: 0.3134, 0.3291
  Established Timings I & II: none
  Standard Timings: none
  Detailed Timing Descriptors:
    DTD 1:  1366x768    60.063606 Hz 683:384   47.450 kHz     76.300000 MHz (293 mm x 165 mm)
                 Hfront   48 Hsync  32 Hback  162 Hpol N
                 Vfront    3 Vsync   5 Vback   14 Vpol N
    DTD 2:  1366x768    48.050885 Hz 683:384   37.960 kHz     61.040000 MHz (293 mm x 165 mm)
                 Hfront   48 Hsync  32 Hback  162 Hpol N
                 Vfront    3 Vsync   5 Vback   14 Vpol N
    Empty Descriptor
    Manufacturer-Specified Display Descriptor (0x02): 00 02 00 0a 3d ff 0a 3c 7d 18 0e 20 7d 00 00 00 '....=..<}.. }...'
Checksum: 0x6c

----------------

Warnings:

Block 0, Base EDID:
  Missing Display Product Name.

Failures:

Block 0, Base EDID:
  Empty Descriptor: Use Dummy Descriptor instead of all zeroes.

EDID conformity: FAIL
