edid-decode (hex):

00 ff ff ff ff ff ff 00 32 0c 00 b9 00 00 00 00
00 10 01 02 80 21 15 78 0a 0f 10 97 58 52 88 28
23 50 54 00 00 00 01 01 01 01 01 01 01 01 01 01
01 01 01 01 01 01 d5 1b 00 a0 50 20 17 30 30 20
26 00 21 15 10 00 00 19 00 00 00 00 00 00 00 00
00 00 00 00 00 00 00 00 00 00 00 00 00 fe 00 4c
47 50 68 69 6c 69 70 73 4c 43 44 0a 00 00 00 fe
00 4c 50 31 35 34 57 30 31 2d 54 4c 41 4a 00 36

----------------

Block 0, Base EDID:
  EDID Structure Version & Revision: 1.2
  Vendor & Product Identification:
    Manufacturer: LPL
    Model: 47360
    Made in: 2006
  Basic Display Parameters & Features:
    Digital display
    Maximum image size: 33 cm x 21 cm
    Gamma: 2.20
    RGB color display
    First detailed timing is preferred timing
  Color Characteristics:
    Red  : 0.5898, 0.3437
    Green: 0.3232, 0.5341
    Blue : 0.1562, 0.1376
    White: 0.3125, 0.3281
  Established Timings I & II: none
  Standard Timings: none
  Detailed Timing Descriptors:
    DTD 1:  1280x800    60.120 Hz   8:5    49.479 kHz  71.250 MHz (289 mm x 21 mm)
                 Hfront   48 Hsync  32 Hback  80 Hpol N
                 Vfront    2 Vsync   6 Vback  15 Vpol N
    Empty Descriptor
    Alphanumeric Data String: 'LGPhilipsLCD'
    Alphanumeric Data String: 'LP154W01-TLAJ'
Checksum: 0x36
