edid-decode (hex):

00 ff ff ff ff ff ff 00 41 0c 50 08 01 01 01 01
17 11 01 03 80 2f 1e 78 2e 93 45 a3 55 4a 98 27
15 50 54 bf ef 00 b3 00 a9 40 95 0f 95 00 81 c0
81 40 71 4f 81 80 7c 2e 90 a0 60 1a 1e 40 30 20
36 00 b2 0e 11 00 00 1c 00 00 00 ff 00 43 55 31
30 37 32 33 30 32 30 30 38 34 00 00 00 fc 00 50
68 69 6c 69 70 73 20 32 30 30 57 53 00 00 00 fd
00 38 4c 1e 5d 11 70 0a 20 32 30 30 57 53 00 eb

00 ff ff ff ff ff ff 00 41 0c 50 08 01 01 01 01
17 11 01 03 80 2f 1e 78 2e 93 45 a3 55 4a 98 27
15 50 54 bf ef 00 b3 00 a9 40 95 0f 95 00 81 c0
81 40 71 4f 81 80 7c 2e 90 a0 60 1a 1e 40 30 20
36 00 b2 0e 11 00 00 1c 00 00 00 ff 00 43 55 31
30 37 32 33 30 32 30 30 38 34 00 00 00 fc 00 50
68 69 6c 69 70 73 20 32 30 30 57 53 00 00 00 fd
00 38 4c 1e 5d 11 70 0a 20 32 30 30 57 53 00 eb

----------------

Block 0, Base EDID:
  EDID Structure Version & Revision: 1.3
  Vendor & Product Identification:
    Manufacturer: PHL
    Model: 2128
    Serial Number: ...
    Made in: week 23 of 2007
  Basic Display Parameters & Features:
    Digital display
    Maximum image size: 47 cm x 30 cm
    Gamma: 2.20
    DPMS levels: Off
    RGB color display
    Default (sRGB) color space is primary color space
    First detailed timing is the preferred timing
  Color Characteristics:
    Red  : 0.6386, 0.3330
    Green: 0.2890, 0.5966
    Blue : 0.1533, 0.0820
    White: 0.3134, 0.3291
  Established Timings I & II:
    IBM     :   720x400    70.081663 Hz   9:5     31.467 kHz     28.320000 MHz
    DMT 0x04:   640x480    59.940476 Hz   4:3     31.469 kHz     25.175000 MHz
    Apple   :   640x480    66.666667 Hz   4:3     35.000 kHz     30.240000 MHz
    DMT 0x05:   640x480    72.808802 Hz   4:3     37.861 kHz     31.500000 MHz
    DMT 0x06:   640x480    75.000000 Hz   4:3     37.500 kHz     31.500000 MHz
    DMT 0x08:   800x600    56.250000 Hz   4:3     35.156 kHz     36.000000 MHz
    DMT 0x09:   800x600    60.316541 Hz   4:3     37.879 kHz     40.000000 MHz
    DMT 0x0a:   800x600    72.187572 Hz   4:3     48.077 kHz     50.000000 MHz
    DMT 0x0b:   800x600    75.000000 Hz   4:3     46.875 kHz     49.500000 MHz
    Apple   :   832x624    74.551266 Hz   4:3     49.726 kHz     57.284000 MHz
    DMT 0x10:  1024x768    60.003840 Hz   4:3     48.363 kHz     65.000000 MHz
    DMT 0x11:  1024x768    70.069359 Hz   4:3     56.476 kHz     75.000000 MHz
    DMT 0x12:  1024x768    75.028582 Hz   4:3     60.023 kHz     78.750000 MHz
    DMT 0x24:  1280x1024   75.024675 Hz   5:4     79.976 kHz    135.000000 MHz
  Standard Timings:
    DMT 0x3a:  1680x1050   59.954250 Hz  16:10    65.290 kHz    146.250000 MHz
    DMT 0x33:  1600x1200   60.000000 Hz   4:3     75.000 kHz    162.000000 MHz
    DMT 0x30:  1440x900    74.984427 Hz  16:10    70.635 kHz    136.750000 MHz
    DMT 0x2f:  1440x900    59.887445 Hz  16:10    55.935 kHz    106.500000 MHz
    DMT 0x55:  1280x720    60.000000 Hz  16:9     45.000 kHz     74.250000 MHz
    DMT 0x20:  1280x960    60.000000 Hz   4:3     60.000 kHz    108.000000 MHz
    DMT 0x15:  1152x864    75.000000 Hz   4:3     67.500 kHz    108.000000 MHz
    DMT 0x23:  1280x1024   60.019740 Hz   5:4     63.981 kHz    108.000000 MHz
  Detailed Timing Descriptors:
    DTD 1:  1680x1050   59.883253 Hz  16:10    64.674 kHz    119.000000 MHz (434 mm x 270 mm)
                 Hfront   48 Hsync  32 Hback   80 Hpol N
                 Vfront    3 Vsync   6 Vback   21 Vpol P
    Display Product Serial Number: ...
    Display Product Name: 'Philips 200WS'
    Display Range Limits:
      Monitor ranges (Unknown (0x70)): 56-76 Hz V, 30-93 kHz H, max dotclock 170 MHz
Checksum: 0xeb

----------------

Block 1, Unknown EDID Extension Block 0x00:
  00 ff ff ff ff ff ff 00 41 0c 50 08 01 01 01 01 '........A.P.....'
  17 11 01 03 80 2f 1e 78 2e 93 45 a3 55 4a 98 27 '...../.x..E.UJ.''
  15 50 54 bf ef 00 b3 00 a9 40 95 0f 95 00 81 c0 '.PT......@......'
  81 40 71 4f 81 80 7c 2e 90 a0 60 1a 1e 40 30 20 '.@qO..|...`..@0 '
  36 00 b2 0e 11 00 00 1c 00 00 00 ff 00 43 55 31 '6............CU1'
  30 37 32 33 30 32 30 30 38 34 00 00 00 fc 00 50 '0723020084.....P'
  68 69 6c 69 70 73 20 32 30 30 57 53 00 00 00 fd 'hilips 200WS....'
  00 38 4c 1e 5d 11 70 0a 20 32 30 30 57 53 00 eb '.8L.].p. 200WS..'
Checksum: 0xeb

----------------

Warnings:

Block 0, Base EDID:
  Detailed Timing Descriptor #1: DTD is similar but not identical to DMT 0x39.

Failures:

Block 0, Base EDID:
  Basic Display Parameters & Features: sRGB is signaled, but the chromaticities do not match.
  Detailed Timing Descriptor #1: Mismatch of image size 434x270 mm vs display size 470x300 mm.
  Display Range Limits: Unknown range class (0x70).
  Display Range Limits: Bytes 12-17 must be 0x20.
Block 1, Base EDID:
  Unknown Extension Block.
EDID:
  Base EDID: EDID specified 0 extension block(s), but found 1 extension block(s).

EDID conformity: FAIL
