
EDID (hex):
00ffffffffffff0009d102414c050000
2f180103800000780aee03a4574d9a25
0e4b62bdef8061c081c0810081809500
a940617c813c023a801871382d40582c
450000000000001e000000fd0017780f
660f000a202020202020000000fe0042
454e510a2020202020202020000000fc
0042656e5120504a0a202020202001d0
020335754f15061f9003040511131402
12202122230907078301000078030c00
2200182d20c00e0100712c26366696d6
e620306090023a801871382d40582c45
0000000000001e011d8018711c162058
2c250000000000009e011d80d0721c16
20102c258000000000009e011d00bc52
d01e20b828554000000000001e0000e2

Extracted contents:
header:          00 ff ff ff ff ff ff 00
serial number:   09 d1 02 41 4c 05 00 00 2f 18
version:         01 03
basic params:    80 00 00 78 0a
chroma info:     ee 03 a4 57 4d 9a 25 0e 4b 62
established:     bd ef 80
standard:        61 c0 81 c0 81 00 81 80 95 00 a9 40 61 7c 81 3c
descriptor 1:    02 3a 80 18 71 38 2d 40 58 2c 45 00 00 00 00 00 00 1e
descriptor 2:    00 00 00 fd 00 17 78 0f 66 0f 00 0a 20 20 20 20 20 20
descriptor 3:    00 00 00 fe 00 42 45 4e 51 0a 20 20 20 20 20 20 20 20
descriptor 4:    00 00 00 fc 00 42 65 6e 51 20 50 4a 0a 20 20 20 20 20
extensions:      01
checksum:        d0

EDID version: 1.3
Manufacturer: BNQ Model 4102 Serial Number --
Made in week 47 of 2014
Digital display
Image size is variable
Gamma: 2.20
RGB color display
First detailed timing is preferred timing
Display x,y Chromaticity:
  Red:   0.6435, 0.3417
  Green: 0.3037, 0.6035
  Blue:  0.1445, 0.0546
  White: 0.2929, 0.3857
Established timings supported:
  720x400@70Hz 9:5 HorFreq: 31469 Hz Clock: 28.320 MHz
  640x480@60Hz 4:3 HorFreq: 31469 Hz Clock: 25.175 MHz
  640x480@67Hz 4:3 HorFreq: 35000 Hz Clock: 30.240 MHz
  640x480@72Hz 4:3 HorFreq: 37900 Hz Clock: 31.500 MHz
  640x480@75Hz 4:3 HorFreq: 37500 Hz Clock: 31.500 MHz
  800x600@60Hz 4:3 HorFreq: 37900 Hz Clock: 40.000 MHz
  800x600@72Hz 4:3 HorFreq: 48100 Hz Clock: 50.000 MHz
  800x600@75Hz 4:3 HorFreq: 46900 Hz Clock: 49.500 MHz
  832x624@75Hz 4:3 HorFreq: 49726 Hz Clock: 57.284 MHz
  1024x768@60Hz 4:3 HorFreq: 48400 Hz Clock: 65.000 MHz
  1024x768@70Hz 4:3 HorFreq: 56500 Hz Clock: 75.000 MHz
  1024x768@75Hz 4:3 HorFreq: 60000 Hz Clock: 78.750 MHz
  1280x1024@75Hz 5:4 HorFreq: 80000 Hz Clock: 135.000 MHz
  1152x870@75Hz 192:145 HorFreq: 67500 Hz Clock: 108.000 MHz
Standard timings supported:
  1024x576@60Hz 16:9
  1280x720@60Hz 16:9
  1280x800@60Hz 16:10
  1280x1024@60Hz 5:4 HorFreq: 64000 Hz Clock: 108.000 MHz
  1440x900@60Hz 16:10 HorFreq: 55500 Hz Clock: 88.750 MHz
  1600x1200@60Hz 4:3 HorFreq: 75000 Hz Clock: 162.000 MHz
  1024x768@120Hz 4:3
  1280x800@120Hz 16:10
Detailed mode: Clock 148.500 MHz, 0 mm x 0 mm
               1920 2008 2052 2200 hborder 0
               1080 1084 1089 1125 vborder 0
               +hsync +vsync 
               VertFreq: 60 Hz, HorFreq: 67500 Hz
Monitor ranges (GTF): 23-120Hz V, 15-102kHz H, max dotclock 150MHz
ASCII string: BENQ
Monitor name: BenQ PJ
Has 1 extension blocks
Checksum: 0xd0 (valid)

CTA extension block
Extension version: 3
49 bytes of CTA data
  Video data block
    VIC  21 1440x576i@50Hz 4:3  HorFreq: 15625 Hz Clock: 27.000 MHz
    VIC   6 1440x480i@60Hz 4:3  HorFreq: 15734 Hz Clock: 27.000 MHz
    VIC  31 1920x1080@50Hz 16:9  HorFreq: 56250 Hz Clock: 148.500 MHz
    VIC  16 1920x1080@60Hz 16:9 (native) HorFreq: 67500 Hz Clock: 148.500 MHz
    VIC   3 720x480@60Hz 16:9  HorFreq: 31469 Hz Clock: 27.000 MHz
    VIC   4 1280x720@60Hz 16:9  HorFreq: 45000 Hz Clock: 74.250 MHz
    VIC   5 1920x1080i@60Hz 16:9  HorFreq: 33750 Hz Clock: 74.250 MHz
    VIC  17 720x576@50Hz 4:3  HorFreq: 31250 Hz Clock: 27.000 MHz
    VIC  19 1280x720@50Hz 16:9  HorFreq: 37500 Hz Clock: 74.250 MHz
    VIC  20 1920x1080i@50Hz 16:9  HorFreq: 28125 Hz Clock: 74.250 MHz
    VIC   2 720x480@60Hz 4:3  HorFreq: 31469 Hz Clock: 27.000 MHz
    VIC  18 720x576@50Hz 16:9  HorFreq: 31250 Hz Clock: 27.000 MHz
    VIC  32 1920x1080@24Hz 16:9  HorFreq: 27000 Hz Clock: 74.250 MHz
    VIC  33 1920x1080@25Hz 16:9  HorFreq: 28125 Hz Clock: 74.250 MHz
    VIC  34 1920x1080@30Hz 16:9  HorFreq: 33750 Hz Clock: 74.250 MHz
  Audio data block
    Linear PCM, max channels 2
      Supported sample rates (kHz): 48 44.1 32
      Supported sample sizes (bits): 24 20 16
  Speaker allocation data block
    Speaker map:
      FL/FR - Front Left/Right
  Vendor-specific data block, OUI 000c03 (HDMI)
    Source physical address 2.2.0.0
    DC_30bit
    DC_Y444
    Maximum TMDS clock: 225MHz
    Extended HDMI video details:
      3D present
      3D-capable-VIC mask present
      3D: Side-by-side (half, horizontal)
      3D VIC indices: 2 3 5 8 12 13 14
      VIC index 2 supports top-and-bottom
      VIC index 3 supports top-and-bottom
      VIC index 6 supports top-and-bottom
      VIC index 9 supports top-and-bottom
      VIC index 13 supports top-and-bottom
      VIC index 14 supports top-and-bottom
      VIC index 2 supports frame packing
      VIC index 3 supports frame packing
      VIC index 6 supports frame packing
      VIC index 9 supports frame packing
Basic audio support
Supports YCbCr 4:4:4
Supports YCbCr 4:2:2
5 native detailed modes
Detailed mode: Clock 148.500 MHz, 0 mm x 0 mm
               1920 2008 2052 2200 hborder 0
               1080 1084 1089 1125 vborder 0
               +hsync +vsync 
               VertFreq: 60 Hz, HorFreq: 67500 Hz
Detailed mode: Clock 74.250 MHz, 0 mm x 0 mm
               1920 2008 2052 2200 hborder 0
                540  542  547  562 vborder 0
               +hsync +vsync interlaced 
               VertFreq: 60 Hz, HorFreq: 33750 Hz
Detailed mode: Clock 74.250 MHz, 0 mm x 0 mm
               1920 2448 2492 2640 hborder 0
                540  542  547  562 vborder 0
               +hsync +vsync interlaced 
               VertFreq: 50 Hz, HorFreq: 28125 Hz
Detailed mode: Clock 74.250 MHz, 0 mm x 0 mm
               1280 1720 1760 1980 hborder 0
                720  725  730  750 vborder 0
               +hsync +vsync 
               VertFreq: 50 Hz, HorFreq: 37500 Hz
Checksum: 0xe2 (valid)

One or more of the timings is out of range of the Monitor Ranges:
  Vertical Freq: 24 - 120 Hz
  Horizontal Freq: 15625 - 80000 Hz
  Maximum Clock: 162.000 MHz
