
EDID (hex):
00ffffffffffff001ef96b0901010101
2511010380342078ea4995a95437ad25
135054afcf0081809500950f9040b300
b30f01010101283c80a070b023403020
360006442100001a000000fc00464844
323430300a2020202020000000fd0038
4c1f5310000a202020202020000000ff
004d4559373944304e3038363333002e

Extracted contents:
header:          00 ff ff ff ff ff ff 00
serial number:   1e f9 6b 09 01 01 01 01 25 11
version:         01 03
basic params:    80 34 20 78 ea
chroma info:     49 95 a9 54 37 ad 25 13 50 54
established:     af cf 00
standard:        81 80 95 00 95 0f 90 40 b3 00 b3 0f 01 01 01 01
descriptor 1:    28 3c 80 a0 70 b0 23 40 30 20 36 00 06 44 21 00 00 1a
descriptor 2:    00 00 00 fc 00 46 48 44 32 34 30 30 0a 20 20 20 20 20
descriptor 3:    00 00 00 fd 00 38 4c 1f 53 10 00 0a 20 20 20 20 20 20
descriptor 4:    00 00 00 ff 00 4d 45 59 37 39 44 30 4e 30 38 36 33 33
extensions:      00
checksum:        2e

EDID version: 1.3
Manufacturer: GWY Model 96b Serial Number --
Made in week 37 of 2007
Digital display
Maximum image size: 52 cm x 32 cm
Gamma: 2.20
DPMS levels: Standby Suspend Off
RGB color display
First detailed timing is preferred timing
Display x,y Chromaticity:
  Red:   0.6611, 0.3281
  Green: 0.2167, 0.6767
  Blue:  0.1464, 0.0751
  White: 0.3134, 0.3291
Established timings supported:
  720x400@70Hz 9:5 HorFreq: 31469 Hz Clock: 28.320 MHz
  640x480@60Hz 4:3 HorFreq: 31469 Hz Clock: 25.175 MHz
  640x480@72Hz 4:3 HorFreq: 37900 Hz Clock: 31.500 MHz
  640x480@75Hz 4:3 HorFreq: 37500 Hz Clock: 31.500 MHz
  800x600@56Hz 4:3 HorFreq: 35200 Hz Clock: 36.000 MHz
  800x600@60Hz 4:3 HorFreq: 37900 Hz Clock: 40.000 MHz
  800x600@72Hz 4:3 HorFreq: 48100 Hz Clock: 50.000 MHz
  800x600@75Hz 4:3 HorFreq: 46900 Hz Clock: 49.500 MHz
  1024x768@60Hz 4:3 HorFreq: 48400 Hz Clock: 65.000 MHz
  1024x768@70Hz 4:3 HorFreq: 56500 Hz Clock: 75.000 MHz
  1024x768@75Hz 4:3 HorFreq: 60000 Hz Clock: 78.750 MHz
  1280x1024@75Hz 5:4 HorFreq: 80000 Hz Clock: 135.000 MHz
Standard timings supported:
  1280x1024@60Hz 5:4 HorFreq: 64000 Hz Clock: 108.000 MHz
  1440x900@60Hz 16:10 HorFreq: 55500 Hz Clock: 88.750 MHz
  1440x900@75Hz 16:10 HorFreq: 82300 Hz Clock: 156.000 MHz
  1400x1050@60Hz 4:3 HorFreq: 64700 Hz Clock: 101.000 MHz
  1680x1050@60Hz 16:10 HorFreq: 64700 Hz Clock: 119.000 MHz
  1680x1050@75Hz 16:10 HorFreq: 82300 Hz Clock: 187.000 MHz
Detailed mode: Clock 154.000 MHz, 518 mm x 324 mm
               1920 1968 2000 2080 hborder 0
               1200 1203 1209 1235 vborder 0
               +hsync -vsync 
               VertFreq: 59 Hz, HorFreq: 74038 Hz
Monitor name: FHD2400
Monitor ranges (GTF): 56-76Hz V, 31-83kHz H, max dotclock 160MHz
Serial number: --
Checksum: 0x2e (valid)
One or more of the timings is out of range of the Monitor Ranges:
  Vertical Freq: 56 - 75 Hz
  Horizontal Freq: 31469 - 82300 Hz
  Maximum Clock: 187.000 MHz
