
EDID (hex):
00ffffffffffff00226413001b020000
1f1201030a261e78eafd56a5534a9d24
144f54bfef80818081c08140714f6146
010101010101302a009851002a403070
1300782d1100001e000000fd00384b1e
500e000a202020202020000000ff0038
33314752334b413030353339000000fc
0048616e6e732e47204858313931000e

Extracted contents:
header:          00 ff ff ff ff ff ff 00
serial number:   22 64 13 00 1b 02 00 00 1f 12
version:         01 03
basic params:    0a 26 1e 78 ea
chroma info:     fd 56 a5 53 4a 9d 24 14 4f 54
established:     bf ef 80
standard:        81 80 81 c0 81 40 71 4f 61 46 01 01 01 01 01 01
descriptor 1:    30 2a 00 98 51 00 2a 40 30 70 13 00 78 2d 11 00 00 1e
descriptor 2:    00 00 00 fd 00 38 4b 1e 50 0e 00 0a 20 20 20 20 20 20
descriptor 3:    00 00 00 ff 00 38 33 31 47 52 33 4b 41 30 30 35 33 39
descriptor 4:    00 00 00 fc 00 48 61 6e 6e 73 2e 47 20 48 58 31 39 31
extensions:      00
checksum:        0e

EDID version: 1.3
Manufacturer: HSD Model 13 Serial Number --
Made in week 31 of 2008
Analog display, Input voltage level: 0.7/0.3 V
Sync: Separate SyncOnGreen 
Maximum image size: 38 cm x 30 cm
Gamma: 2.20
DPMS levels: Standby Suspend Off
RGB color display
First detailed timing is preferred timing
Display x,y Chromaticity:
  Red:   0.6474, 0.3271
  Green: 0.2919, 0.6142
  Blue:  0.1416, 0.0791
  White: 0.3095, 0.3300
Established timings supported:
  720x400@70Hz 9:5 HorFreq: 31469 Hz Clock: 28.320 MHz
  640x480@60Hz 4:3 HorFreq: 31469 Hz Clock: 25.175 MHz
  640x480@67Hz 4:3 HorFreq: 35000 Hz Clock: 30.240 MHz
  640x480@72Hz 4:3 HorFreq: 37900 Hz Clock: 31.500 MHz
  640x480@75Hz 4:3 HorFreq: 37500 Hz Clock: 31.500 MHz
  800x600@56Hz 4:3 HorFreq: 35200 Hz Clock: 36.000 MHz
  800x600@60Hz 4:3 HorFreq: 37900 Hz Clock: 40.000 MHz
  800x600@72Hz 4:3 HorFreq: 48100 Hz Clock: 50.000 MHz
  800x600@75Hz 4:3 HorFreq: 46900 Hz Clock: 49.500 MHz
  832x624@75Hz 4:3 HorFreq: 49726 Hz Clock: 57.284 MHz
  1024x768@60Hz 4:3 HorFreq: 48400 Hz Clock: 65.000 MHz
  1024x768@70Hz 4:3 HorFreq: 56500 Hz Clock: 75.000 MHz
  1024x768@75Hz 4:3 HorFreq: 60000 Hz Clock: 78.750 MHz
  1280x1024@75Hz 5:4 HorFreq: 80000 Hz Clock: 135.000 MHz
  1152x870@75Hz 192:145 HorFreq: 67500 Hz Clock: 108.000 MHz
Standard timings supported:
  1280x1024@60Hz 5:4 HorFreq: 64000 Hz Clock: 108.000 MHz
  1280x720@60Hz 16:9
  1280x960@60Hz 4:3 HorFreq: 60000 Hz Clock: 108.000 MHz
  1152x864@75Hz 4:3 HorFreq: 67500 Hz Clock: 108.000 MHz
  1024x768@66Hz 4:3
Detailed mode: Clock 108.000 MHz, 376 mm x 301 mm
               1280 1328 1440 1688 hborder 0
               1024 1025 1028 1066 vborder 0
               +hsync +vsync 
               VertFreq: 60 Hz, HorFreq: 63981 Hz
Monitor ranges (GTF): 56-75Hz V, 30-80kHz H, max dotclock 140MHz
Serial number: --
Checksum: 0xe (valid)
EDID block does NOT conform to EDID 1.3!
	Name descriptor not terminated with a newline
