edid-decode (hex):

00 ff ff ff ff ff ff 00 1e 6d f0 4b c4 4f 00 00
02 16 01 03 a0 29 17 78 ba d0 25 a2 58 55 9c 28
0f 50 54 a7 6a 00 31 4f 45 4f 61 4f 01 01 01 01
01 01 01 01 01 01 66 21 56 aa 51 00 1e 30 46 8f
33 00 9a e6 10 00 00 1e 00 00 00 fd 00 38 4b 1e
3d 09 00 0a 20 20 20 20 20 20 00 00 00 fc 00 45
31 39 34 31 0a 20 20 20 20 20 20 20 00 00 00 ff
00 0a 20 20 20 20 20 20 20 20 20 20 20 20 01 57

02 03 1b 62 23 09 7f 07 83 01 00 00 67 03 0c 00
20 00 80 2d 43 01 10 84 e2 00 0f 00 00 36 00 40
e8 63 00 00 1a 1a 1d 00 80 51 d0 1c 20 40 80 35
00 40 84 63 00 00 1c 00 00 00 00 00 00 00 00 00
00 00 55 00 00 00 00 00 00 00 00 00 00 00 00 00
00 00 00 00 00 00 00 00 00 00 00 00 00 00 00 00
00 00 00 00 00 00 00 00 00 00 00 00 00 00 00 00
00 00 00 00 00 00 00 00 00 00 00 00 00 00 00 c0

----------------

Block 0, Base EDID:
  EDID Structure Version & Revision: 1.3
  Vendor & Product Identification:
    Manufacturer: GSM
    Model: 19440
    Serial Number: ...
    Made in: week 2 of 2012
  Basic Display Parameters & Features:
    Digital display
    Maximum image size: 41 cm x 23 cm
    Gamma: 2.20
    DPMS levels: Standby Off
    Undefined display color type
    First detailed timing is the preferred timing
  Color Characteristics:
    Red  : 0.6357, 0.3447
    Green: 0.3320, 0.6093
    Blue : 0.1562, 0.0605
    White: 0.3134, 0.3291
  Established Timings I & II:
    IBM     :   720x400    70.081663 Hz   9:5     31.467 kHz     28.320000 MHz
    DMT 0x04:   640x480    59.940476 Hz   4:3     31.469 kHz     25.175000 MHz
    DMT 0x06:   640x480    75.000000 Hz   4:3     37.500 kHz     31.500000 MHz
    DMT 0x08:   800x600    56.250000 Hz   4:3     35.156 kHz     36.000000 MHz
    DMT 0x09:   800x600    60.316541 Hz   4:3     37.879 kHz     40.000000 MHz
    DMT 0x0b:   800x600    75.000000 Hz   4:3     46.875 kHz     49.500000 MHz
    Apple   :   832x624    74.551266 Hz   4:3     49.726 kHz     57.284000 MHz
    DMT 0x10:  1024x768    60.003840 Hz   4:3     48.363 kHz     65.000000 MHz
    DMT 0x12:  1024x768    75.028582 Hz   4:3     60.023 kHz     78.750000 MHz
  Standard Timings:
    DMT 0x06:   640x480    75.000000 Hz   4:3     37.500 kHz     31.500000 MHz
    DMT 0x0b:   800x600    75.000000 Hz   4:3     46.875 kHz     49.500000 MHz
    DMT 0x12:  1024x768    75.028582 Hz   4:3     60.023 kHz     78.750000 MHz
  Detailed Timing Descriptors:
    DTD 1:  1366x768    59.789541 Hz 683:384   47.712 kHz     85.500000 MHz (410 mm x 230 mm)
                 Hfront   70 Hsync 143 Hback  213 Hpol P
                 Vfront    3 Vsync   3 Vback   24 Vpol P
    Display Range Limits:
      Monitor ranges (GTF): 56-75 Hz V, 30-61 kHz H, max dotclock 90 MHz
    Display Product Name: 'E1941'
    Display Product Serial Number: ...
  Extension blocks: 1
Checksum: 0x57

----------------

Block 1, CTA-861 Extension Block:
  Revision: 3
  Basic audio support
  Supports YCbCr 4:4:4
  Native detailed modes: 2
  Audio Data Block:
    Linear PCM:
      Max channels: 2
      Supported sample rates (kHz): 192 176.4 96 88.2 48 44.1 32
      Supported sample sizes (bits): 24 20 16
  Speaker Allocation Data Block:
    FL/FR - Front Left/Right
  Vendor-Specific Data Block (HDMI), OUI 00-0C-03:
    Source physical address: 2.0.0.0
    Supports_AI
    Maximum TMDS clock: 225 MHz
  Video Data Block:
    VIC   1:   640x480    59.940476 Hz   4:3     31.469 kHz     25.175000 MHz
    VIC  16:  1920x1080   60.000000 Hz  16:9     67.500 kHz    148.500000 MHz
    VIC   4:  1280x720    60.000000 Hz  16:9     45.000 kHz     74.250000 MHz (native)
  Video Capability Data Block:
    YCbCr quantization: No Data
    RGB quantization: No Data
    PT scan behavior: No Data
    IT scan behavior: Supports both over- and underscan
    CE scan behavior: Supports both over- and underscan
  Detailed Timing Descriptors:
    Manufacturer-Specified Display Descriptor (0x00): 36 00 40 e8 63 00 00 1a 1a 1d 00 80 51 d0 1c 20 '6.@.c.......Q.. '
    DTD 2:  1077x132   1319.683102 Hz 359:44   304.847 kHz    328.320000 MHz (analog composite, sync-on-green)
                 Hfront    0 Hsync  28 Hback  -28 Hpol N
                 Vfront    0 Vsync   0 Vback   99 Vpol N
                   40 80 35 00 40 84 63 00 00 1c 00 00 00 00 00 00 00 00 '@.5.@.c...........'
    Unknown Display Descriptor (0x55): 00 55 00 00 00 00 00 00 00 00 00 00 00 00 00 00 '.U..............'
Checksum: 0xc0

----------------

Warnings:

Block 1, CTA-861 Extension Block:
  IT Video Formats are overscanned by default, but normally this should be underscanned.
  Video Capability Data Block: Set Selectable YCbCr Quantization to avoid interop issues.
  Display Product Serial Number is set, so the Serial Number in the Base EDID should be 0.

Failures:

Block 0, Base EDID:
  Basic Display Parameters & Features: Digital Video Interface Standard set to reserved value 0x20.
  Display Product Serial Number: ...
Block 1, CTA-861 Extension Block:
  Video Capability Data Block: Set Selectable RGB Quantization to avoid interop issues.
  Display Descriptor #5: Monitor descriptor block has byte 2 nonzero (0x36).
  Display Descriptor #5: Monitor descriptor block has byte 4 nonzero (0x40).
  Detailed Timing Descriptor #2: 0 values in the video timing:
    Horizontal Active/Blanking 1077/0
    Horizontal Frontporch/Sync Width 0/28
    Vertical Active/Blanking 132/99
    Vertical Frontporch/Sync Width 0/0
  Detailed Timing Descriptor #2: 0 or negative horizontal front porch.
  Detailed Timing Descriptor #2: 0 or negative horizontal back porch.
  Detailed Timing Descriptor #2: Mismatch of image size vs display size: image size is not set, but display size is.
  Detailed Timing Descriptor #2: Invalid detailed timing descriptor ordering.
  Display Descriptor #7: Unknown Type 0x55.
EDID:
  Base EDID: Some timings are out of range of the Monitor Ranges:
    Vertical Freq: 56.250 - 1319.683 Hz (Monitor: 56.000 - 75.000 Hz)
    Horizontal Freq: 31.466 - 304.846 kHz (Monitor: 30.000 - 61.000 kHz)
    Maximum Clock: 328.320 MHz (Monitor: 90.000 MHz)
  CTA-861: Native progressive timings are a mix of several resolutions.

EDID conformity: FAIL
