edid-decode (hex):

00 ff ff ff ff ff ff 00 0d ae 71 14 00 00 00 00
23 15 01 03 80 1f 11 78 0a d1 45 9b 59 57 8e 2b
23 50 54 00 00 00 01 01 01 01 01 01 01 01 01 01
01 01 01 01 01 01 12 1b 56 64 50 00 14 30 30 20
14 00 35 ae 10 00 00 18 00 00 00 fe 00 4e 31 34
30 42 47 45 2d 4c 33 32 0a 20 00 00 00 fe 00 43
4d 4e 0a 20 20 20 20 20 20 20 20 20 00 00 00 fe
00 4e 31 34 30 42 47 45 2d 4c 33 32 0a 20 00 09

----------------

Block 0, Base EDID:
  EDID Structure Version & Revision: 1.3
  Vendor & Product Identification:
    Manufacturer: CMN
    Model: 5233
    Made in: week 35 of 2011
  Basic Display Parameters & Features:
    Digital display
    Maximum image size: 31 cm x 17 cm
    Gamma: 2.20
    RGB color display
    First detailed timing is preferred timing
  Color Characteristics:
    Red  : 0.6083, 0.3486
    Green: 0.3398, 0.5556
    Blue : 0.1689, 0.1367
    White: 0.3134, 0.3291
  Established Timings I & II: none
  Standard Timings: none
  Detailed Timing Descriptors:
    DTD 1:  1366x768    59.989 Hz 683:384  47.271 kHz  69.300 MHz (309 mm x 174 mm)
                 Hfront   48 Hsync  32 Hback  20 Hpol N
                 Vfront    1 Vsync   4 Vback  15 Vpol N
    Alphanumeric Data String: 'N140BGE-L32'
    Alphanumeric Data String: 'CMN'
    Alphanumeric Data String: 'N140BGE-L32'
Checksum: 0x9

----------------

Failures:

Block 0, Base EDID:
  Missing Display Product Name.
  Missing Display Range Limits Descriptor.

EDID conformity: FAIL
