edid-decode (hex):

00 ff ff ff ff ff ff 00 1e 6d 33 5b ab b7 03 00
0b 1f 01 03 6c 30 1b 78 ea 31 35 a5 55 4e a1 26
0c 50 54 a5 4b 00 71 4f 81 80 95 00 b3 00 a9 c0
81 00 81 c0 90 40 02 3a 80 18 71 38 2d 40 58 2c
45 00 e0 0e 11 00 00 1e 00 00 00 fd 00 28 4b 1e
55 12 00 0a 20 20 20 20 20 20 00 00 00 fc 00 4d
50 35 39 47 0a 20 20 20 20 20 20 20 00 00 00 ff
00 31 31 31 4e 54 4d 58 37 35 36 32 37 0a 00 73

00 ff ff ff ff ff ff 00 1e 6d 33 5b ab b7 03 00
0b 1f 01 03 6c 30 1b 78 ea 31 35 a5 55 4e a1 26
0c 50 54 a5 4b 00 71 4f 81 80 95 00 b3 00 a9 c0
81 00 81 c0 90 40 02 3a 80 18 71 38 2d 40 58 2c
45 00 e0 0e 11 00 00 1e 00 00 00 fd 00 28 4b 1e
55 12 00 0a 20 20 20 20 20 20 00 00 00 fc 00 4d
50 35 39 47 0a 20 20 20 20 20 20 20 00 00 00 ff
00 31 31 31 4e 54 4d 58 37 35 36 32 37 0a 00 73

----------------

Block 0, Base EDID:
  EDID Structure Version & Revision: 1.3
  Vendor & Product Identification:
    Manufacturer: GSM
    Model: 23347
    Serial Number: ...
    Made in: week 11 of 2021
  Basic Display Parameters & Features:
    Analog display
    Signal Level Standard: 0.700 : 0.000 : 0.700 V p-p
    Blank level equals black level
    Sync: Separate Composite
    Maximum image size: 48 cm x 27 cm
    Gamma: 2.20
    DPMS levels: Standby Suspend Off
    RGB color display
    First detailed timing is the preferred timing
  Color Characteristics:
    Red  : 0.6445, 0.3349
    Green: 0.3046, 0.6298
    Blue : 0.1484, 0.0498
    White: 0.3134, 0.3291
  Established Timings I & II:
    IBM     :   720x400    70.081663 Hz   9:5     31.467 kHz     28.320000 MHz
    DMT 0x04:   640x480    59.940476 Hz   4:3     31.469 kHz     25.175000 MHz
    DMT 0x06:   640x480    75.000000 Hz   4:3     37.500 kHz     31.500000 MHz
    DMT 0x09:   800x600    60.316541 Hz   4:3     37.879 kHz     40.000000 MHz
    DMT 0x0b:   800x600    75.000000 Hz   4:3     46.875 kHz     49.500000 MHz
    DMT 0x10:  1024x768    60.003840 Hz   4:3     48.363 kHz     65.000000 MHz
    DMT 0x12:  1024x768    75.028582 Hz   4:3     60.023 kHz     78.750000 MHz
    DMT 0x24:  1280x1024   75.024675 Hz   5:4     79.976 kHz    135.000000 MHz
  Standard Timings:
    DMT 0x15:  1152x864    75.000000 Hz   4:3     67.500 kHz    108.000000 MHz
    DMT 0x23:  1280x1024   60.019740 Hz   5:4     63.981 kHz    108.000000 MHz
    DMT 0x2f:  1440x900    59.887445 Hz  16:10    55.935 kHz    106.500000 MHz
    DMT 0x3a:  1680x1050   59.954250 Hz  16:10    65.290 kHz    146.250000 MHz
    DMT 0x53:  1600x900    60.000000 Hz  16:9     60.000 kHz    108.000000 MHz (RB)
    DMT 0x1c:  1280x800    59.810326 Hz  16:10    49.702 kHz     83.500000 MHz
    DMT 0x55:  1280x720    60.000000 Hz  16:9     45.000 kHz     74.250000 MHz
    DMT 0x2a:  1400x1050   59.978442 Hz   4:3     65.317 kHz    121.750000 MHz
  Detailed Timing Descriptors:
    DTD 1:  1920x1080   60.000000 Hz  16:9     67.500 kHz    148.500000 MHz (480 mm x 270 mm)
                 Hfront   88 Hsync  44 Hback  148 Hpol P
                 Vfront    4 Vsync   5 Vback   36 Vpol P
    Display Range Limits:
      Monitor ranges (GTF): 40-75 Hz V, 30-85 kHz H, max dotclock 180 MHz
    Display Product Name: 'MP59G'
    Display Product Serial Number: ...
Checksum: 0x73

----------------

Block 1, Unknown EDID Extension Block 0x00:
  00 ff ff ff ff ff ff 00 1e 6d 33 5b ab b7 03 00 '.........m3[....'
  0b 1f 01 03 6c 30 1b 78 ea 31 35 a5 55 4e a1 26 '....l0.x.15.UN.&'
  0c 50 54 a5 4b 00 71 4f 81 80 95 00 b3 00 a9 c0 '.PT.K.qO........'
  81 00 81 c0 90 40 02 3a 80 18 71 38 2d 40 58 2c '.....@.:..q8-@X,'
  45 00 e0 0e 11 00 00 1e 00 00 00 fd 00 28 4b 1e 'E............(K.'
  55 12 00 0a 20 20 20 20 20 20 00 00 00 fc 00 4d 'U...      .....M'
  50 35 39 47 0a 20 20 20 20 20 20 20 00 00 00 ff 'P59G.       ....'
  00 31 31 31 4e 54 4d 58 37 35 36 32 37 0a 00 73 '.111NTMX75627..s'
Checksum: 0x73

----------------

Failures:

Block 1, Base EDID:
  Unknown Extension Block.
EDID:
  Base EDID: EDID specified 0 extension block(s), but found 1 extension block(s).

EDID conformity: FAIL
