edid-decode (hex):

00 ff ff ff ff ff ff 00 06 af a7 f3 00 00 00 00
25 20 01 04 a5 1f 14 78 03 ee 95 a3 54 4c 99 26
0f 50 54 00 00 00 01 01 01 01 01 01 01 01 01 01
01 01 01 01 01 01 fd d7 00 a0 a0 40 fc 66 30 20
35 00 38 c3 10 00 00 18 00 00 00 0f 00 00 00 00
00 00 00 00 00 00 00 00 00 20 00 00 00 fd 00 30
78 cc cc 37 01 0a 20 20 20 20 20 20 00 00 00 fe
00 42 31 34 35 51 41 4e 30 31 2e 4a 20 0a 01 48

70 20 79 02 00 20 00 13 4f 55 41 a7 f3 00 00 00
00 25 16 07 42 31 34 35 51 41 4e 21 00 1d 31 0c
9f 07 00 0a 40 06 88 3d 7a 54 cc 94 99 66 52 0f
02 35 54 b0 5c b0 5c cc 34 12 78 22 00 14 e1 6f
08 85 ff 09 9f 00 2f 80 1f 00 3f 06 5d 00 02 00
04 00 25 01 09 e1 6f 08 e1 6f 08 30 78 80 26 00
09 02 00 00 00 00 00 00 00 00 2b 00 0c 27 00 32
77 00 00 27 00 30 3b 00 00 00 00 00 00 00 c3 90

00 ff ff ff ff ff ff 00 06 af a7 f3 00 00 00 00
25 20 01 04 a5 1f 14 78 03 ee 95 a3 54 4c 99 26
0f 50 54 00 00 00 01 01 01 01 01 01 01 01 01 01
01 01 01 01 01 01 fd d7 00 a0 a0 40 fc 66 30 20
35 00 38 c3 10 00 00 18 00 00 00 0f 00 00 00 00
00 00 00 00 00 00 00 00 00 20 00 00 00 fd 00 30
78 cc cc 37 01 0a 20 20 20 20 20 20 00 00 00 fe
00 42 31 34 35 51 41 4e 30 31 2e 4a 20 0a 01 48

70 20 79 02 00 20 00 13 4f 55 41 a7 f3 00 00 00
00 25 16 07 42 31 34 35 51 41 4e 21 00 1d 31 0c
9f 07 00 0a 40 06 88 3d 7a 54 cc 94 99 66 52 0f
02 35 54 b0 5c b0 5c cc 34 12 78 22 00 14 e1 6f
08 85 ff 09 9f 00 2f 80 1f 00 3f 06 5d 00 02 00
04 00 25 01 09 e1 6f 08 e1 6f 08 30 78 80 26 00
09 02 00 00 00 00 00 00 00 00 2b 00 0c 27 00 32
77 00 00 27 00 30 3b 00 00 00 00 00 00 00 c3 90

----------------

Block 0, Base EDID:
  EDID Structure Version & Revision: 1.4
  Vendor & Product Identification:
    Manufacturer: AUO
    Model: 62375
    Made in: week 37 of 2022
  Basic Display Parameters & Features:
    Digital display
    Bits per primary color channel: 8
    DisplayPort interface
    Maximum image size: 31 cm x 20 cm
    Gamma: 2.20
    Supported color formats: RGB 4:4:4
    First detailed timing includes the native pixel format and preferred refresh rate
    Display is continuous frequency
  Color Characteristics:
    Red  : 0.6396, 0.3300
    Green: 0.2998, 0.5996
    Blue : 0.1503, 0.0595
    White: 0.3134, 0.3291
  Established Timings I & II: none
  Standard Timings: none
  Detailed Timing Descriptors:
    DTD 1:  2560x1600   60.000912 Hz  16:10   203.283 kHz    552.930000 MHz (312 mm x 195 mm)
                 Hfront   48 Hsync  32 Hback   80 Hpol N
                 Vfront    3 Vsync   5 Vback 1780 Vpol N
    Manufacturer-Specified Display Descriptor (0x0f): 00 0f 00 00 00 00 00 00 00 00 00 00 00 00 00 20 '............... '
    Display Range Limits:
      Monitor ranges (Bare Limits): 48-120 Hz V, 204-204 kHz H, max dotclock 550 MHz
    Alphanumeric Data String: 'B145QAN01.J '
  Extension blocks: 1
Checksum: 0x48

----------------

Block 1, DisplayID Extension Block:
  Version: 2.0
  Extension Count: 0
  Display Product Primary Use Case: None of the listed primary use cases; generic display
  Product Identification Data Block (0x20), OUI 4F-55-41:
    Product Code: 62375
    Year of Manufacture: 2022, Week 37
    Product ID: B145QAN
  Display Parameters Data Block (0x21):
    Image size: 312.1 mm x 195.1 mm
    Display native pixel format: 2560x1600
    Scan Orientation: Left to Right, Top to Bottom
    Luminance Information: Guidance for the Source device
    Color Information: CIE 1931
    Audio Speaker Information: not integrated
    Native Color Chromaticity:
      Primary #1:  (0.639893, 0.329834)
      Primary #2:  (0.299805, 0.599854)
      Primary #3:  (0.149902, 0.059814)
      White Point: (0.312988, 0.328857)
    Native Maximum Luminance (Full Coverage): 300.000000 cd/m^2
    Native Maximum Luminance (10% Rectangular Coverage): 300.000000 cd/m^2
    Native Minimum Luminance: 0.299805 cd/m^2
    Native Color Depth: 10 bpc
    Display Device Technology: Active Matrix LCD
    Native Gamma EOTF: 2.20
  Video Timing Modes Type 7 - Detailed Timings Data Block:
    DTD:  2560x1600  120.001823 Hz  16:10   203.283 kHz    552.930000 MHz (aspect 16:10, no 3D stereo, preferred)
               Hfront   48 Hsync  32 Hback   80 Hpol P
               Vfront    3 Vsync   5 Vback   86 Vpol N
  Dynamic Video Timing Range Limits Data Block:
    Minimum Pixel Clock: 552930 kHz
    Maximum Pixel Clock: 552930 kHz
    Minimum Vertical Refresh Rate: 48 Hz
    Maximum Vertical Refresh Rate: 120 Hz
    Seamless Dynamic Video Timing Support: Yes
  Display Interface Features Data Block:
    Supported bpc for RGB encoding: 8
  Adaptive Sync Data Block:
    Descriptor #1:
      Native Panel Range
      Fixed Average V-Total and Adaptive V-Total
      'Max Single Frame Duration Increase' field value without jitter impact
      'Max Single Frame Duration Decrease' field value without jitter impact
      Max Duration Increase: 0.00 ms
      Max Duration Decrease: 0.00 ms
      Min Refresh Rate: 50 Hz
      Max Refresh Rate: 120 Hz
    Descriptor #2:
      Native Panel Range
      Fixed Average V-Total and Adaptive V-Total
      'Max Single Frame Duration Increase' field value without jitter impact
      'Max Single Frame Duration Decrease' field value without jitter impact
      Max Duration Increase: 0.00 ms
      Max Duration Decrease: 0.00 ms
      Min Refresh Rate: 48 Hz
      Max Refresh Rate: 60 Hz
  Checksum: 0xc3
Checksum: 0x90

----------------

Block 2, Unknown EDID Extension Block 0x00:
  00 ff ff ff ff ff ff 00 06 af a7 f3 00 00 00 00 '................'
  25 20 01 04 a5 1f 14 78 03 ee 95 a3 54 4c 99 26 '% .....x....TL.&'
  0f 50 54 00 00 00 01 01 01 01 01 01 01 01 01 01 '.PT.............'
  01 01 01 01 01 01 fd d7 00 a0 a0 40 fc 66 30 20 '...........@.f0 '
  35 00 38 c3 10 00 00 18 00 00 00 0f 00 00 00 00 '5.8.............'
  00 00 00 00 00 00 00 00 00 20 00 00 00 fd 00 30 '......... .....0'
  78 cc cc 37 01 0a 20 20 20 20 20 20 00 00 00 fe 'x..7..      ....'
  00 42 31 34 35 51 41 4e 30 31 2e 4a 20 0a 01 48 '.B145QAN01.J ..H'
Checksum: 0x48

----------------

Block 3, DisplayID Extension Block:
  Version: 2.0
  Extension Count: 0
  Product Identification Data Block (0x20), OUI 4F-55-41:
    Product Code: 62375
    Year of Manufacture: 2022, Week 37
    Product ID: B145QAN
  Display Parameters Data Block (0x21):
    Image size: 312.1 mm x 195.1 mm
    Display native pixel format: 2560x1600
    Scan Orientation: Left to Right, Top to Bottom
    Luminance Information: Guidance for the Source device
    Color Information: CIE 1931
    Audio Speaker Information: not integrated
    Native Color Chromaticity:
      Primary #1:  (0.639893, 0.329834)
      Primary #2:  (0.299805, 0.599854)
      Primary #3:  (0.149902, 0.059814)
      White Point: (0.312988, 0.328857)
    Native Maximum Luminance (Full Coverage): 300.000000 cd/m^2
    Native Maximum Luminance (10% Rectangular Coverage): 300.000000 cd/m^2
    Native Minimum Luminance: 0.299805 cd/m^2
    Native Color Depth: 10 bpc
    Display Device Technology: Active Matrix LCD
    Native Gamma EOTF: 2.20
  Video Timing Modes Type 7 - Detailed Timings Data Block:
    DTD:  2560x1600  120.001823 Hz  16:10   203.283 kHz    552.930000 MHz (aspect 16:10, no 3D stereo, preferred)
               Hfront   48 Hsync  32 Hback   80 Hpol P
               Vfront    3 Vsync   5 Vback   86 Vpol N
  Dynamic Video Timing Range Limits Data Block:
    Minimum Pixel Clock: 552930 kHz
    Maximum Pixel Clock: 552930 kHz
    Minimum Vertical Refresh Rate: 48 Hz
    Maximum Vertical Refresh Rate: 120 Hz
    Seamless Dynamic Video Timing Support: Yes
  Display Interface Features Data Block:
    Supported bpc for RGB encoding: 8
  Adaptive Sync Data Block:
    Descriptor #1:
      Native Panel Range
      Fixed Average V-Total and Adaptive V-Total
      'Max Single Frame Duration Increase' field value without jitter impact
      'Max Single Frame Duration Decrease' field value without jitter impact
      Max Duration Increase: 0.00 ms
      Max Duration Decrease: 0.00 ms
      Min Refresh Rate: 50 Hz
      Max Refresh Rate: 120 Hz
    Descriptor #2:
      Native Panel Range
      Fixed Average V-Total and Adaptive V-Total
      'Max Single Frame Duration Increase' field value without jitter impact
      'Max Single Frame Duration Decrease' field value without jitter impact
      Max Duration Increase: 0.00 ms
      Max Duration Decrease: 0.00 ms
      Min Refresh Rate: 48 Hz
      Max Refresh Rate: 60 Hz
  Checksum: 0xc3
Checksum: 0x90

----------------

Warnings:

Block 0, Base EDID:
  Missing Display Product Name.
Block 1, DisplayID Extension Block:
  Product Identification Data Block (0x20), OUI 4F-55-41: Unknown OUI 4F-55-41 (possible PNP OUA).
Block 3, DisplayID Extension Block:
  Product Identification Data Block (0x20), OUI 4F-55-41: Unknown OUI 4F-55-41 (possible PNP OUA).
EDID:
  Base EDID: Some timings are out of range of the Monitor Ranges:
    Horizontal Freq: 203.283 - 203.283 kHz (Monitor: 204.000 - 204.000 kHz)
    Maximum Clock: 552.930 MHz (Monitor: 550.000 MHz)
    Could be due to a Monitor Range off-by-one rounding issue

Failures:

Block 0, Base EDID:
  Alphanumeric Data String: One or more trailing spaces.
Block 1, DisplayID Extension Block:
  Expected 0 DisplayID Extension Block, but got 1.
Block 2, Base EDID:
  Unknown Extension Block.
Block 3, DisplayID Extension Block:
  Product Type should be 0 in extension block.
  Product Identification Data Block (0x20), OUI 4F-55-41: Product Identification Data Block (0x20), OUI 4F-55-41 is required to be the first DisplayID Data Block.
  Display Parameters Data Block (0x21): Duplicate Display Parameters Data Block.
EDID:
  Base EDID: EDID specified 1 extension block(s), but found 3 extension block(s).

EDID conformity: FAIL
