
EDID (hex):
00ffffffffffff0015c3552401010101
2b170104a5351e78fa219da35a52a026
144b54a54b003168317c4568457c6168
617c8180d1c0023a801871382d40582c
45000a262100001e000000ff00323539
34303130330a20202020000000fd0031
7a1f8a1d000a202020202020000000fc
004647323432310a2020202020200106
020315f148901f041303120211230907
0783010000fe5b80a070383540302035
000a262100001a866f80a07038404030
2035000a262100001a00000000000000
00000000000000000000000000000000
00000000000000000000000000000000
00000000000000000000000000000000
0000000000000000000000000000004e

Extracted contents:
header:          00 ff ff ff ff ff ff 00
serial number:   15 c3 55 24 01 01 01 01 2b 17
version:         01 04
basic params:    a5 35 1e 78 fa
chroma info:     21 9d a3 5a 52 a0 26 14 4b 54
established:     a5 4b 00
standard:        31 68 31 7c 45 68 45 7c 61 68 61 7c 81 80 d1 c0
descriptor 1:    02 3a 80 18 71 38 2d 40 58 2c 45 00 0a 26 21 00 00 1e
descriptor 2:    00 00 00 ff 00 32 35 39 34 30 31 30 33 0a 20 20 20 20
descriptor 3:    00 00 00 fd 00 31 7a 1f 8a 1d 00 0a 20 20 20 20 20 20
descriptor 4:    00 00 00 fc 00 46 47 32 34 32 31 0a 20 20 20 20 20 20
extensions:      01
checksum:        06

EDID version: 1.4
Manufacturer: ENC Model 2455 Serial Number --
Made in week 43 of 2013
Digital display
8 bits per primary color channel
DisplayPort interface
Maximum image size: 53 cm x 30 cm
Gamma: 2.20
DPMS levels: Standby Suspend Off
Supported color formats: RGB 4:4:4, YCrCb 4:4:4, YCrCb 4:2:2
First detailed timing includes the native pixel format and preferred refresh rate
Display x,y Chromaticity:
  Red:   0.6367, 0.3535
  Green: 0.3203, 0.6259
  Blue:  0.1503, 0.0791
  White: 0.2958, 0.3291
Established timings supported:
  720x400@70Hz 9:5 HorFreq: 31469 Hz Clock: 28.320 MHz
  640x480@60Hz 4:3 HorFreq: 31469 Hz Clock: 25.175 MHz
  640x480@75Hz 4:3 HorFreq: 37500 Hz Clock: 31.500 MHz
  800x600@60Hz 4:3 HorFreq: 37900 Hz Clock: 40.000 MHz
  800x600@75Hz 4:3 HorFreq: 46900 Hz Clock: 49.500 MHz
  1024x768@60Hz 4:3 HorFreq: 48400 Hz Clock: 65.000 MHz
  1024x768@75Hz 4:3 HorFreq: 60000 Hz Clock: 78.750 MHz
  1280x1024@75Hz 5:4 HorFreq: 80000 Hz Clock: 135.000 MHz
Standard timings supported:
  640x480@100Hz 4:3
  640x480@120Hz 4:3
  800x600@100Hz 4:3
  800x600@120Hz 4:3
  1024x768@100Hz 4:3
  1024x768@120Hz 4:3
  1280x1024@60Hz 5:4 HorFreq: 64000 Hz Clock: 108.000 MHz
  1920x1080@60Hz 16:9
Detailed mode: Clock 148.500 MHz, 522 mm x 294 mm
               1920 2008 2052 2200 hborder 0
               1080 1084 1089 1125 vborder 0
               +hsync +vsync 
               VertFreq: 60 Hz, HorFreq: 67500 Hz
Serial number: --
Monitor ranges (GTF): 49-122Hz V, 31-138kHz H, max dotclock 290MHz
Monitor name: FG2421
Has 1 extension blocks
Checksum: 0x6 (valid)

CTA extension block
Extension version: 3
17 bytes of CTA data
  Video data block
    VIC  16 1920x1080@60Hz 16:9 (native) HorFreq: 67500 Hz Clock: 148.500 MHz
    VIC  31 1920x1080@50Hz 16:9  HorFreq: 56250 Hz Clock: 148.500 MHz
    VIC   4 1280x720@60Hz 16:9  HorFreq: 45000 Hz Clock: 74.250 MHz
    VIC  19 1280x720@50Hz 16:9  HorFreq: 37500 Hz Clock: 74.250 MHz
    VIC   3 720x480@60Hz 16:9  HorFreq: 31469 Hz Clock: 27.000 MHz
    VIC  18 720x576@50Hz 16:9  HorFreq: 31250 Hz Clock: 27.000 MHz
    VIC   2 720x480@60Hz 4:3  HorFreq: 31469 Hz Clock: 27.000 MHz
    VIC  17 720x576@50Hz 4:3  HorFreq: 31250 Hz Clock: 27.000 MHz
  Audio data block
    Linear PCM, max channels 2
      Supported sample rates (kHz): 48 44.1 32
      Supported sample sizes (bits): 24 20 16
  Speaker allocation data block
    Speaker map:
      FL/FR - Front Left/Right
Underscans PC formats by default
Basic audio support
Supports YCbCr 4:4:4
Supports YCbCr 4:2:2
1 native detailed modes
Detailed mode: Clock 235.500 MHz, 522 mm x 294 mm
               1920 1968 2000 2080 hborder 0
               1080 1083 1088 1133 vborder 0
               +hsync -vsync 
               VertFreq: 99 Hz, HorFreq: 113221 Hz
Detailed mode: Clock 285.500 MHz, 522 mm x 294 mm
               1920 1968 2000 2080 hborder 0
               1080 1083 1088 1144 vborder 0
               +hsync -vsync 
               VertFreq: 119 Hz, HorFreq: 137259 Hz
Checksum: 0x4e (valid)

EDID block does not conform at all!
	Both the serial number and the serial string are set
