edid-decode (hex):

00 ff ff ff ff ff ff 00 09 e5 07 06 00 00 00 00
01 18 01 04 95 1a 0f 78 0a 5d 40 94 5b 57 94 29
1c 50 54 00 00 00 01 01 01 01 01 01 01 01 01 01
01 01 01 01 01 01 ce 1d 56 f4 50 00 16 30 30 20
36 00 58 c1 10 00 00 1a e2 13 56 f4 50 00 16 30
30 20 36 00 58 c1 10 00 00 00 00 00 00 00 00 00
00 00 00 00 00 00 00 00 00 00 00 00 00 00 00 02
00 0a 3c e2 0a 3c 6e 1c 0b 12 78 00 00 00 00 96

----------------

Block 0, Base EDID:
  EDID Structure Version & Revision: 1.4
  Vendor & Product Identification:
    Manufacturer: BOE
    Model: 1543
    Made in: week 1 of 2014
  Basic Display Parameters & Features:
    Digital display
    Bits per primary color channel: 6
    DisplayPort interface
    Maximum image size: 26 cm x 15 cm
    Gamma: 2.20
    Supported color formats: RGB 4:4:4, YCrCb 4:4:4
    First detailed timing includes the native pixel format and preferred refresh rate
  Color Characteristics:
    Red  : 0.5791, 0.3564
    Green: 0.3427, 0.5791
    Blue : 0.1611, 0.1093
    White: 0.3125, 0.3281
  Established Timings I & II: none
  Standard Timings: none
  Detailed Timing Descriptors:
    DTD 1:  1366x768    59.988993 Hz 683:384   47.391 kHz     76.300000 MHz (344 mm x 193 mm)
                 Hfront   48 Hsync  32 Hback  164 Hpol P
                 Vfront    3 Vsync   6 Vback   13 Vpol N
    DTD 2:  1366x768    40.018869 Hz 683:384   31.615 kHz     50.900000 MHz (analog composite, sync-on-green, 344 mm x 193 mm)
                 Hfront   48 Hsync  32 Hback  164 Hpol N
                 Vfront    3 Vsync   6 Vback   13 Vpol N
    Empty Descriptor
    Manufacturer-Specified Display Descriptor (0x02): 00 02 00 0a 3c e2 0a 3c 6e 1c 0b 12 78 00 00 00 '....<..<n...x...'
Checksum: 0x96

----------------

Failures:

Block 0, Base EDID:
  Detailed Timing Descriptor #1: Mismatch of image size 344x193 mm vs display size 260x150 mm.
  Detailed Timing Descriptor #2: Mismatch of image size 344x193 mm vs display size 260x150 mm.
  Empty Descriptor: Use Dummy Descriptor instead of all zeroes.
  Missing Display Product Name.
EDID:
  Base EDID: The DTD max image size is 344x193mm, which is larger than the display size 260.0x150.0mm.

EDID conformity: FAIL
