edid-decode (hex):

00 ff ff ff ff ff ff 00 41 0c bf 08 d5 03 00 00
0c 18 01 03 80 2f 1e 78 2a fd a5 a2 56 51 9e 27
0c 50 54 bd 4b 00 b3 00 95 00 95 0f 81 c0 81 80
01 01 01 01 01 01 7c 2e 90 a0 60 1a 1e 40 30 20
36 00 da 28 11 00 00 1a 00 00 00 ff 00 41 55 34
31 34 31 32 30 30 30 39 38 31 00 00 00 fd 00 38
4c 1e 53 11 00 0a 20 20 20 20 20 20 00 00 00 fc
00 32 32 30 42 4c 50 0a 20 20 20 20 20 20 00 ba

00 ff ff ff ff ff ff 00 41 0c bf 08 d5 03 00 00
0c 18 01 03 80 2f 1e 78 2a fd a5 a2 56 51 9e 27
0c 50 54 bd 4b 00 b3 00 95 00 95 0f 81 c0 81 80
01 01 01 01 01 01 7c 2e 90 a0 60 1a 1e 40 30 20
36 00 da 28 11 00 00 1a 00 00 00 ff 00 41 55 34
31 34 31 32 30 30 30 39 38 31 00 00 00 fd 00 38
4c 1e 53 11 00 0a 20 20 20 20 20 20 00 00 00 fc
00 32 32 30 42 4c 50 0a 20 20 20 20 20 20 00 ba

----------------

Block 0, Base EDID:
  EDID Structure Version & Revision: 1.3
  Vendor & Product Identification:
    Manufacturer: PHL
    Model: 2239
    Serial Number: ...
    Made in: week 12 of 2014
  Basic Display Parameters & Features:
    Digital display
    Maximum image size: 47 cm x 30 cm
    Gamma: 2.20
    DPMS levels: Off
    RGB color display
    First detailed timing is the preferred timing
  Color Characteristics:
    Red  : 0.6357, 0.3388
    Green: 0.3193, 0.6181
    Blue : 0.1542, 0.0488
    White: 0.3134, 0.3291
  Established Timings I & II:
    IBM     :   720x400    70.081663 Hz   9:5     31.467 kHz     28.320000 MHz
    DMT 0x04:   640x480    59.940476 Hz   4:3     31.469 kHz     25.175000 MHz
    Apple   :   640x480    66.666667 Hz   4:3     35.000 kHz     30.240000 MHz
    DMT 0x05:   640x480    72.808802 Hz   4:3     37.861 kHz     31.500000 MHz
    DMT 0x06:   640x480    75.000000 Hz   4:3     37.500 kHz     31.500000 MHz
    DMT 0x09:   800x600    60.316541 Hz   4:3     37.879 kHz     40.000000 MHz
    DMT 0x0b:   800x600    75.000000 Hz   4:3     46.875 kHz     49.500000 MHz
    DMT 0x10:  1024x768    60.003840 Hz   4:3     48.363 kHz     65.000000 MHz
    DMT 0x12:  1024x768    75.028582 Hz   4:3     60.023 kHz     78.750000 MHz
    DMT 0x24:  1280x1024   75.024675 Hz   5:4     79.976 kHz    135.000000 MHz
  Standard Timings:
    DMT 0x3a:  1680x1050   59.954250 Hz  16:10    65.290 kHz    146.250000 MHz
    DMT 0x2f:  1440x900    59.887445 Hz  16:10    55.935 kHz    106.500000 MHz
    DMT 0x30:  1440x900    74.984427 Hz  16:10    70.635 kHz    136.750000 MHz
    DMT 0x55:  1280x720    60.000000 Hz  16:9     45.000 kHz     74.250000 MHz
    DMT 0x23:  1280x1024   60.019740 Hz   5:4     63.981 kHz    108.000000 MHz
  Detailed Timing Descriptors:
    DTD 1:  1680x1050   59.883253 Hz  16:10    64.674 kHz    119.000000 MHz (474 mm x 296 mm)
                 Hfront   48 Hsync  32 Hback   80 Hpol P
                 Vfront    3 Vsync   6 Vback   21 Vpol N
    Display Product Serial Number: ...
    Display Range Limits:
      Monitor ranges (GTF): 56-76 Hz V, 30-83 kHz H, max dotclock 170 MHz
    Display Product Name: '220BLP'
Checksum: 0xba

----------------

Block 1, Unknown EDID Extension Block 0x00:
  00 ff ff ff ff ff ff 00 41 0c bf 08 d5 03 00 00 '........A.......'
  0c 18 01 03 80 2f 1e 78 2a fd a5 a2 56 51 9e 27 '...../.x*...VQ.''
  0c 50 54 bd 4b 00 b3 00 95 00 95 0f 81 c0 81 80 '.PT.K...........'
  01 01 01 01 01 01 7c 2e 90 a0 60 1a 1e 40 30 20 '......|...`..@0 '
  36 00 da 28 11 00 00 1a 00 00 00 ff 00 41 55 34 '6..(.........AU4'
  31 34 31 32 30 30 30 39 38 31 00 00 00 fd 00 38 '1412000981.....8'
  4c 1e 53 11 00 0a 20 20 20 20 20 20 00 00 00 fc 'L.S...      ....'
  00 32 32 30 42 4c 50 0a 20 20 20 20 20 20 00 ba '.220BLP.      ..'
Checksum: 0xba

----------------

Failures:

Block 1, Base EDID:
  Unknown Extension Block.
EDID:
  Base EDID: EDID specified 0 extension block(s), but found 1 extension block(s).

EDID conformity: FAIL
