edid-decode (hex):

00 ff ff ff ff ff ff 00 1c 54 00 28 01 01 01 01
23 1f 01 03 80 3f 24 78 ee a8 15 ad 50 45 a2 26
0e 50 54 25 4a 00 d1 c0 01 01 01 01 01 01 01 01
01 01 01 01 01 01 08 e8 00 30 f2 70 5a 80 b0 58
8a 00 b9 88 21 00 00 1e 00 00 00 fd 00 30 90 1e
87 3c 00 0a 20 20 20 20 20 20 00 00 00 fc 00 4d
32 38 55 0a 20 20 20 20 20 20 20 20 00 00 00 ff
00 32 31 33 35 30 42 30 30 30 36 34 36 0a 02 f4

02 03 55 f2 4a 61 76 5f 03 04 2f 10 3f 5d 20 23
09 07 07 83 01 00 00 6c 03 0c 00 10 00 38 44 20
00 40 03 01 6d d8 5d c4 01 78 88 33 02 30 90 c3
35 0c 6d 1a 00 00 02 0b 30 90 ec 0f 66 1f 66 1f
e3 05 c3 01 e2 0f 03 e3 0e 61 76 e6 06 05 01 66
66 1f e2 00 d5 56 c2 00 a0 a0 a0 55 50 30 20 35
00 b9 88 21 00 00 1e 56 5e 00 a0 a0 a0 29 50 30
20 35 00 b9 88 21 00 00 1e 00 00 00 00 00 00 a0

70 12 79 00 00 03 01 3c ba e9 01 04 ff 0e 4f 00
07 80 1f 00 6f 08 3c 00 09 80 07 00 c1 b0 00 04
7f 07 ef 02 a7 80 cf 00 37 04 61 00 02 80 04 00
2f e7 00 04 ff 09 b3 00 1b 80 1f 00 9f 05 3b 00
08 80 07 00 00 00 00 00 00 00 00 00 00 00 00 00
00 00 00 00 00 00 00 00 00 00 00 00 00 00 00 00
00 00 00 00 00 00 00 00 00 00 00 00 00 00 00 00
00 00 00 00 00 00 00 00 00 00 00 00 00 00 47 90

00 ff ff ff ff ff ff 00 1c 54 00 28 01 01 01 01
23 1f 01 03 80 3f 24 78 ee a8 15 ad 50 45 a2 26
0e 50 54 25 4a 00 d1 c0 01 01 01 01 01 01 01 01
01 01 01 01 01 01 08 e8 00 30 f2 70 5a 80 b0 58
8a 00 b9 88 21 00 00 1e 00 00 00 fd 00 30 90 1e
87 3c 00 0a 20 20 20 20 20 20 00 00 00 fc 00 4d
32 38 55 0a 20 20 20 20 20 20 20 20 00 00 00 ff
00 32 31 33 35 30 42 30 30 30 36 34 36 0a 02 f4

02 03 55 f2 4a 61 76 5f 03 04 2f 10 3f 5d 20 23
09 07 07 83 01 00 00 6c 03 0c 00 10 00 38 44 20
00 40 03 01 6d d8 5d c4 01 78 88 33 02 30 90 c3
35 0c 6d 1a 00 00 02 0b 30 90 ec 0f 66 1f 66 1f
e3 05 c3 01 e2 0f 03 e3 0e 61 76 e6 06 05 01 66
66 1f e2 00 d5 56 c2 00 a0 a0 a0 55 50 30 20 35
00 b9 88 21 00 00 1e 56 5e 00 a0 a0 a0 29 50 30
20 35 00 b9 88 21 00 00 1e 00 00 00 00 00 00 a0

70 12 79 00 00 03 01 3c ba e9 01 04 ff 0e 4f 00
07 80 1f 00 6f 08 3c 00 09 80 07 00 c1 b0 00 04
7f 07 ef 02 a7 80 cf 00 37 04 61 00 02 80 04 00
2f e7 00 04 ff 09 b3 00 1b 80 1f 00 9f 05 3b 00
08 80 07 00 00 00 00 00 00 00 00 00 00 00 00 00
00 00 00 00 00 00 00 00 00 00 00 00 00 00 00 00
00 00 00 00 00 00 00 00 00 00 00 00 00 00 00 00
00 00 00 00 00 00 00 00 00 00 00 00 00 00 47 90

----------------

Block 0, Base EDID:
  EDID Structure Version & Revision: 1.3
  Vendor & Product Identification:
    Manufacturer: GBT
    Model: 10240
    Serial Number: ...
    Made in: week 35 of 2021
  Basic Display Parameters & Features:
    Digital display
    Maximum image size: 63 cm x 36 cm
    Gamma: 2.20
    DPMS levels: Standby Suspend Off
    RGB color display
    Default (sRGB) color space is primary color space
    First detailed timing is the preferred timing
  Color Characteristics:
    Red  : 0.6777, 0.3144
    Green: 0.2714, 0.6328
    Blue : 0.1484, 0.0556
    White: 0.3134, 0.3291
  Established Timings I & II:
    DMT 0x04:   640x480    59.940476 Hz   4:3     31.469 kHz     25.175000 MHz
    DMT 0x06:   640x480    75.000000 Hz   4:3     37.500 kHz     31.500000 MHz
    DMT 0x09:   800x600    60.316541 Hz   4:3     37.879 kHz     40.000000 MHz
    DMT 0x0b:   800x600    75.000000 Hz   4:3     46.875 kHz     49.500000 MHz
    DMT 0x10:  1024x768    60.003840 Hz   4:3     48.363 kHz     65.000000 MHz
    DMT 0x12:  1024x768    75.028582 Hz   4:3     60.023 kHz     78.750000 MHz
  Standard Timings:
    DMT 0x52:  1920x1080   60.000000 Hz  16:9     67.500 kHz    148.500000 MHz
  Detailed Timing Descriptors:
    DTD 1:  3840x2160   60.000000 Hz  16:9    135.000 kHz    594.000000 MHz (697 mm x 392 mm)
                 Hfront  176 Hsync  88 Hback  296 Hpol P
                 Vfront    8 Vsync  10 Vback   72 Vpol P
    Display Range Limits:
      Monitor ranges (GTF): 48-144 Hz V, 30-135 kHz H, max dotclock 600 MHz
    Display Product Name: 'M28U'
    Display Product Serial Number: ...
  Extension blocks: 2
Checksum: 0xf4

----------------

Block 1, CTA-861 Extension Block:
  Revision: 3
  Underscans IT Video Formats by default
  Basic audio support
  Supports YCbCr 4:4:4
  Supports YCbCr 4:2:2
  Native detailed modes: 2
  Video Data Block:
    VIC  97:  3840x2160   60.000000 Hz  16:9    135.000 kHz    594.000000 MHz
    VIC 118:  3840x2160  120.000000 Hz  16:9    270.000 kHz   1188.000000 MHz
    VIC  95:  3840x2160   30.000000 Hz  16:9     67.500 kHz    297.000000 MHz
    VIC   3:   720x480    59.940060 Hz  16:9     31.469 kHz     27.000000 MHz
    VIC   4:  1280x720    60.000000 Hz  16:9     45.000 kHz     74.250000 MHz
    VIC  47:  1280x720   120.000000 Hz  16:9     90.000 kHz    148.500000 MHz
    VIC  16:  1920x1080   60.000000 Hz  16:9     67.500 kHz    148.500000 MHz
    VIC  63:  1920x1080  120.000000 Hz  16:9    135.000 kHz    297.000000 MHz
    VIC  93:  3840x2160   24.000000 Hz  16:9     54.000 kHz    297.000000 MHz
    VIC  32:  1920x1080   24.000000 Hz  16:9     27.000 kHz     74.250000 MHz
  Audio Data Block:
    Linear PCM:
      Max channels: 2
      Supported sample rates (kHz): 48 44.1 32
      Supported sample sizes (bits): 24 20 16
  Speaker Allocation Data Block:
    FL/FR - Front Left/Right
  Vendor-Specific Data Block (HDMI), OUI 00-0C-03:
    Source physical address: 1.0.0.0
    DC_36bit
    DC_30bit
    DC_Y444
    Maximum TMDS clock: 340 MHz
    Extended HDMI video details:
      HDMI VICs:
        HDMI VIC 3:  3840x2160   24.000000 Hz  16:9     54.000 kHz    297.000000 MHz
        HDMI VIC 1:  3840x2160   30.000000 Hz  16:9     67.500 kHz    297.000000 MHz
  Vendor-Specific Data Block (HDMI Forum), OUI C4-5D-D8:
    Version: 1
    Maximum TMDS Character Rate: 600 MHz
    SCDC Present
    Supports scrambling for <= 340 Mcsc
    Max Fixed Rate Link: 3 and 6 Gbps per lane on 3 lanes, 6 Gbps on 4 lanes
    Supports 12-bits/component Deep Color 4:2:0 Pixel Encoding
    Supports 10-bits/component Deep Color 4:2:0 Pixel Encoding
    Supports Auto Low-Latency Mode
    VRRmin: 48 Hz
    VRRmax: 144 Hz
    Supports VESA DSC 1.2a compression
    Supports Compressed Video Transport for 4:2:0 Pixel Encoding
    Supports 12 bpc Compressed Video Transport
    Supports 10 bpc Compressed Video Transport
    DSC Max Slices: up to 8 slices and up to (400 MHz/Ksliceadjust) pixel clock per slice
    DSC Max Fixed Rate Link: 3 and 6 Gbps per lane on 3 lanes, 6 Gbps on 4 lanes
    Maximum number of bytes in a line of chunks: 13312
  Vendor-Specific Data Block (AMD), OUI 00-00-1A:
    Version: 2.11
    Minimum Refresh Rate: 48 Hz
    Maximum Refresh Rate: 144 Hz
    Flags 1.x: 0xec (MCCS)
    Flags 2.x: 0x0f
    Maximum luminance: 102 (455.515 cd/m^2)
    Minimum luminance: 31 (0.067 cd/m^2)
    Maximum luminance (without local dimming): 102 (455.515 cd/m^2)
    Minimum luminance (without local dimming): 31 (0.067 cd/m^2)
  Colorimetry Data Block:
    xvYCC601
    xvYCC709
    BT2020YCC
    BT2020RGB
    Gamut Boundary Description Metadata Profile P0
  YCbCr 4:2:0 Capability Map Data Block:
    VIC  97:  3840x2160   60.000000 Hz  16:9    135.000 kHz    594.000000 MHz
    VIC 118:  3840x2160  120.000000 Hz  16:9    270.000 kHz   1188.000000 MHz
  YCbCr 4:2:0 Video Data Block:
    VIC  97:  3840x2160   60.000000 Hz  16:9    135.000 kHz    594.000000 MHz
    VIC 118:  3840x2160  120.000000 Hz  16:9    270.000 kHz   1188.000000 MHz
  HDR Static Metadata Data Block:
    Electro optical transfer functions:
      Traditional gamma - SDR luminance range
      SMPTE ST2084
    Supported static metadata descriptors:
      Static metadata type 1
    Desired content max luminance: 102 (455.515 cd/m^2)
    Desired content max frame-average luminance: 102 (455.515 cd/m^2)
    Desired content min luminance: 31 (0.067 cd/m^2)
  Video Capability Data Block:
    YCbCr quantization: Selectable (via AVI YQ)
    RGB quantization: Selectable (via AVI Q)
    PT scan behavior: Always Overscanned
    IT scan behavior: Always Overscanned
    CE scan behavior: Always Overscanned
  Detailed Timing Descriptors:
    DTD 2:  2560x1440  119.937319 Hz  16:9    182.904 kHz    497.500000 MHz (697 mm x 392 mm)
                 Hfront   48 Hsync  32 Hback   80 Hpol P
                 Vfront    3 Vsync   5 Vback   77 Vpol P
    DTD 3:  2560x1440   59.950550 Hz  16:9     88.787 kHz    241.500000 MHz (697 mm x 392 mm)
                 Hfront   48 Hsync  32 Hback   80 Hpol P
                 Vfront    3 Vsync   5 Vback   33 Vpol P
Checksum: 0xa0  Unused space in Extension Block: 6 bytes

----------------

Block 2, DisplayID Extension Block:
  Version: 1.2
  Extension Count: 0
  Display Product Type: Extension Section
  Video Timing Modes Type 1 - Detailed Timings Data Block:
    DTD:  3840x2160  143.999991 Hz  16:9    319.824 kHz   1253.710000 MHz (aspect 16:9, no 3D stereo)
               Hfront    8 Hsync  32 Hback   40 Hpol P
               Vfront   10 Vsync   8 Vback   43 Vpol P
    DTD:  1920x1080  143.759595 Hz  16:9    169.349 kHz    452.500000 MHz (aspect 16:9, no 3D stereo)
               Hfront  168 Hsync 208 Hback  376 Hpol P
               Vfront    3 Vsync   5 Vback   90 Vpol P
    DTD:  2560x1440  144.000000 Hz  16:9    216.000 kHz    591.840000 MHz (aspect 16:9, no 3D stereo)
               Hfront   28 Hsync  32 Hback  120 Hpol P
               Vfront    9 Vsync   8 Vback   43 Vpol P
  Checksum: 0x47
Checksum: 0x90

----------------

Block 3, Unknown EDID Extension Block 0x00:
  00 ff ff ff ff ff ff 00 1c 54 00 28 01 01 01 01 '.........T.(....'
  23 1f 01 03 80 3f 24 78 ee a8 15 ad 50 45 a2 26 '#....?$x....PE.&'
  0e 50 54 25 4a 00 d1 c0 01 01 01 01 01 01 01 01 '.PT%J...........'
  01 01 01 01 01 01 08 e8 00 30 f2 70 5a 80 b0 58 '.........0.pZ..X'
  8a 00 b9 88 21 00 00 1e 00 00 00 fd 00 30 90 1e '....!........0..'
  87 3c 00 0a 20 20 20 20 20 20 00 00 00 fc 00 4d '.<..      .....M'
  32 38 55 0a 20 20 20 20 20 20 20 20 00 00 00 ff '28U.        ....'
  00 32 31 33 35 30 42 30 30 30 36 34 36 0a 02 f4 '.21350B000646...'
Checksum: 0xf4

----------------

Block 4, CTA-861 Extension Block:
  Revision: 3
  Underscans IT Video Formats by default
  Basic audio support
  Supports YCbCr 4:4:4
  Supports YCbCr 4:2:2
  Native detailed modes: 2
  Video Data Block:
    VIC  97:  3840x2160   60.000000 Hz  16:9    135.000 kHz    594.000000 MHz
    VIC 118:  3840x2160  120.000000 Hz  16:9    270.000 kHz   1188.000000 MHz
    VIC  95:  3840x2160   30.000000 Hz  16:9     67.500 kHz    297.000000 MHz
    VIC   3:   720x480    59.940060 Hz  16:9     31.469 kHz     27.000000 MHz
    VIC   4:  1280x720    60.000000 Hz  16:9     45.000 kHz     74.250000 MHz
    VIC  47:  1280x720   120.000000 Hz  16:9     90.000 kHz    148.500000 MHz
    VIC  16:  1920x1080   60.000000 Hz  16:9     67.500 kHz    148.500000 MHz
    VIC  63:  1920x1080  120.000000 Hz  16:9    135.000 kHz    297.000000 MHz
    VIC  93:  3840x2160   24.000000 Hz  16:9     54.000 kHz    297.000000 MHz
    VIC  32:  1920x1080   24.000000 Hz  16:9     27.000 kHz     74.250000 MHz
  Audio Data Block:
    Linear PCM:
      Max channels: 2
      Supported sample rates (kHz): 48 44.1 32
      Supported sample sizes (bits): 24 20 16
  Speaker Allocation Data Block:
    FL/FR - Front Left/Right
  Vendor-Specific Data Block (HDMI), OUI 00-0C-03:
    Source physical address: 1.0.0.0
    DC_36bit
    DC_30bit
    DC_Y444
    Maximum TMDS clock: 340 MHz
    Extended HDMI video details:
      HDMI VICs:
        HDMI VIC 3:  3840x2160   24.000000 Hz  16:9     54.000 kHz    297.000000 MHz
        HDMI VIC 1:  3840x2160   30.000000 Hz  16:9     67.500 kHz    297.000000 MHz
  Vendor-Specific Data Block (HDMI Forum), OUI C4-5D-D8:
    Version: 1
    Maximum TMDS Character Rate: 600 MHz
    SCDC Present
    Supports scrambling for <= 340 Mcsc
    Max Fixed Rate Link: 3 and 6 Gbps per lane on 3 lanes, 6 Gbps on 4 lanes
    Supports 12-bits/component Deep Color 4:2:0 Pixel Encoding
    Supports 10-bits/component Deep Color 4:2:0 Pixel Encoding
    Supports Auto Low-Latency Mode
    VRRmin: 48 Hz
    VRRmax: 144 Hz
    Supports VESA DSC 1.2a compression
    Supports Compressed Video Transport for 4:2:0 Pixel Encoding
    Supports 12 bpc Compressed Video Transport
    Supports 10 bpc Compressed Video Transport
    DSC Max Slices: up to 8 slices and up to (400 MHz/Ksliceadjust) pixel clock per slice
    DSC Max Fixed Rate Link: 3 and 6 Gbps per lane on 3 lanes, 6 Gbps on 4 lanes
    Maximum number of bytes in a line of chunks: 13312
  Vendor-Specific Data Block (AMD), OUI 00-00-1A:
    Version: 2.11
    Minimum Refresh Rate: 48 Hz
    Maximum Refresh Rate: 144 Hz
    Flags 1.x: 0xec (MCCS)
    Flags 2.x: 0x0f
    Maximum luminance: 102 (455.515 cd/m^2)
    Minimum luminance: 31 (0.067 cd/m^2)
    Maximum luminance (without local dimming): 102 (455.515 cd/m^2)
    Minimum luminance (without local dimming): 31 (0.067 cd/m^2)
  Colorimetry Data Block:
    xvYCC601
    xvYCC709
    BT2020YCC
    BT2020RGB
    Gamut Boundary Description Metadata Profile P0
  YCbCr 4:2:0 Capability Map Data Block:
    VIC  97:  3840x2160   60.000000 Hz  16:9    135.000 kHz    594.000000 MHz
    VIC 118:  3840x2160  120.000000 Hz  16:9    270.000 kHz   1188.000000 MHz
  YCbCr 4:2:0 Video Data Block:
    VIC  97:  3840x2160   60.000000 Hz  16:9    135.000 kHz    594.000000 MHz
    VIC 118:  3840x2160  120.000000 Hz  16:9    270.000 kHz   1188.000000 MHz
  HDR Static Metadata Data Block:
    Electro optical transfer functions:
      Traditional gamma - SDR luminance range
      SMPTE ST2084
    Supported static metadata descriptors:
      Static metadata type 1
    Desired content max luminance: 102 (455.515 cd/m^2)
    Desired content max frame-average luminance: 102 (455.515 cd/m^2)
    Desired content min luminance: 31 (0.067 cd/m^2)
  Video Capability Data Block:
    YCbCr quantization: Selectable (via AVI YQ)
    RGB quantization: Selectable (via AVI Q)
    PT scan behavior: Always Overscanned
    IT scan behavior: Always Overscanned
    CE scan behavior: Always Overscanned
  Detailed Timing Descriptors:
    DTD 4:  2560x1440  119.937319 Hz  16:9    182.904 kHz    497.500000 MHz (697 mm x 392 mm)
                 Hfront   48 Hsync  32 Hback   80 Hpol P
                 Vfront    3 Vsync   5 Vback   77 Vpol P
    DTD 5:  2560x1440   59.950550 Hz  16:9     88.787 kHz    241.500000 MHz (697 mm x 392 mm)
                 Hfront   48 Hsync  32 Hback   80 Hpol P
                 Vfront    3 Vsync   5 Vback   33 Vpol P
Checksum: 0xa0  Unused space in Extension Block: 6 bytes

----------------

Block 5, DisplayID Extension Block:
  Version: 1.2
  Extension Count: 0
  Video Timing Modes Type 1 - Detailed Timings Data Block:
    DTD:  3840x2160  143.999991 Hz  16:9    319.824 kHz   1253.710000 MHz (aspect 16:9, no 3D stereo)
               Hfront    8 Hsync  32 Hback   40 Hpol P
               Vfront   10 Vsync   8 Vback   43 Vpol P
    DTD:  1920x1080  143.759595 Hz  16:9    169.349 kHz    452.500000 MHz (aspect 16:9, no 3D stereo)
               Hfront  168 Hsync 208 Hback  376 Hpol P
               Vfront    3 Vsync   5 Vback   90 Vpol P
    DTD:  2560x1440  144.000000 Hz  16:9    216.000 kHz    591.840000 MHz (aspect 16:9, no 3D stereo)
               Hfront   28 Hsync  32 Hback  120 Hpol P
               Vfront    9 Vsync   8 Vback   43 Vpol P
  Checksum: 0x47
Checksum: 0x90

----------------

Warnings:

Block 1, CTA-861 Extension Block:
  Video Capability Data Block: IT scan behavior is expected to support underscanned.
  Video Capability Data Block: S_PT is equal to S_IT and S_CE, so should be set to 0 instead.
  Display Product Serial Number is set, so the Serial Number in the Base EDID should be 0.
Block 4, CTA-861 Extension Block:
  Video Capability Data Block: IT scan behavior is expected to support underscanned.
  Video Capability Data Block: S_PT is equal to S_IT and S_CE, so should be set to 0 instead.
  Display Product Serial Number is set, so the Serial Number in the Base EDID should be 0.

Failures:

Block 0, Base EDID:
  Basic Display Parameters & Features: sRGB is signaled, but the chromaticities do not match.
  Detailed Timing Descriptor #1: Mismatch of image size 697x392 mm vs display size 630x360 mm.
Block 1, CTA-861 Extension Block:
  YCbCr 4:2:0 Capability Map Data Block: VIC 97 is also a YCbCr 4:2:0-only VIC.
  YCbCr 4:2:0 Capability Map Data Block: VIC 118 is also a YCbCr 4:2:0-only VIC.
  YCbCr 4:2:0 Video Data Block: YCbCr 4:2:0-only VIC 97 is also a regular VIC.
  YCbCr 4:2:0 Video Data Block: YCbCr 4:2:0-only VIC 118 is also a regular VIC.
  Video Capability Data Block: IT video formats are always overscanned, but bit 7 of Byte 3 of the CTA-861 Extension header is set to underscanned.
  Detailed Timing Descriptor #2: Mismatch of image size 697x392 mm vs display size 630x360 mm.
  Detailed Timing Descriptor #3: Mismatch of image size 697x392 mm vs display size 630x360 mm.
Block 2, DisplayID Extension Block:
  DisplayID Base Block has no product type.
  Expected 0 DisplayID Extension Block, but got 1.
Block 3, Base EDID:
  Unknown Extension Block.
Block 4, CTA-861 Extension Block:
  Video Data Block: Duplicate VIC 97.
  Video Data Block: Duplicate VIC 118.
  Video Data Block: Duplicate VIC 95.
  Video Data Block: Duplicate VIC 3.
  Video Data Block: Duplicate VIC 4.
  Video Data Block: Duplicate VIC 47.
  Video Data Block: Duplicate VIC 16.
  Video Data Block: Duplicate VIC 63.
  Video Data Block: Duplicate VIC 93.
  Video Data Block: Duplicate VIC 32.
  Speaker Allocation Data Block: Only one instance of this Data Block is allowed.
  Vendor-Specific Data Block (HDMI Forum), OUI C4-5D-D8: Duplicate HDMI Forum VSDB/SCDB.
  Colorimetry Data Block: Only one instance of this Data Block is allowed.
  YCbCr 4:2:0 Capability Map Data Block: Only one instance of this Data Block is allowed.
  YCbCr 4:2:0 Capability Map Data Block: VIC 97 is also a YCbCr 4:2:0-only VIC.
  YCbCr 4:2:0 Capability Map Data Block: VIC 118 is also a YCbCr 4:2:0-only VIC.
  YCbCr 4:2:0 Video Data Block: Duplicate YCbCr 4:2:0 VIC 97.
  YCbCr 4:2:0 Video Data Block: YCbCr 4:2:0-only VIC 97 is also a regular VIC.
  YCbCr 4:2:0 Video Data Block: Duplicate YCbCr 4:2:0 VIC 118.
  YCbCr 4:2:0 Video Data Block: YCbCr 4:2:0-only VIC 118 is also a regular VIC.
  HDR Static Metadata Data Block: Only one instance of this Data Block is allowed.
  Video Capability Data Block: Only one instance of this Data Block is allowed.
  Video Capability Data Block: IT video formats are always overscanned, but bit 7 of Byte 3 of the CTA-861 Extension header is set to underscanned.
  Detailed Timing Descriptor #4: Mismatch of image size 697x392 mm vs display size 630x360 mm.
  Detailed Timing Descriptor #5: Mismatch of image size 697x392 mm vs display size 630x360 mm.
EDID:
  Base EDID: Some timings are out of range of the Monitor Ranges:
    Vertical Freq: 24.000 - 144.000 Hz (Monitor: 48.000 - 144.000 Hz)
    Horizontal Freq: 27.000 - 319.823 kHz (Monitor: 30.000 - 135.000 kHz)
    Maximum Clock: 1253.710 MHz (Monitor: 600.000 MHz)
  Base EDID: The DTD max image size is 697x392mm, which is larger than the display size 630.0x360.0mm.
  Base EDID: EDID specified 2 extension block(s), but found 5 extension block(s).
  Base EDID: EDID 1.3 requires a Block Map Extension in Block 1 if there are more than 2 blocks in the EDID.
  CTA-861: Native progressive timings are a mix of several resolutions.
  DisplayID: Missing DisplayID Product Identification Data Block.
  DisplayID: DisplayID expects at least one preferred timing.

EDID conformity: FAIL
