
EDID (hex):
00ffffffffffff001e6d010001010101
0114010380a05a780ad9b0a357499c25
11494ba10800314045406140d1c00101
0101010101011b2150a051001e304888
3500bc862100001c1a3680a070381f40
30203500e8263200001a000000fd0038
3e1c5312000a202020202020000000fc
004c472054560a2020202020202001af
020329f1510102030607151611121384
140520221f1026150750097f0767030c
001000b82de3050301011d008051d01c
2040803500bc882100001e4e1f008051
001e3040803700bc8821000018023a80
1871382d40582c450006442100001e01
1d8018711c1620582c2500c48e210000
9e0000000000000000000000000000b4

Extracted contents:
header:          00 ff ff ff ff ff ff 00
serial number:   1e 6d 01 00 01 01 01 01 01 14
version:         01 03
basic params:    80 a0 5a 78 0a
chroma info:     d9 b0 a3 57 49 9c 25 11 49 4b
established:     a1 08 00
standard:        31 40 45 40 61 40 d1 c0 01 01 01 01 01 01 01 01
descriptor 1:    1b 21 50 a0 51 00 1e 30 48 88 35 00 bc 86 21 00 00 1c
descriptor 2:    1a 36 80 a0 70 38 1f 40 30 20 35 00 e8 26 32 00 00 1a
descriptor 3:    00 00 00 fd 00 38 3e 1c 53 12 00 0a 20 20 20 20 20 20
descriptor 4:    00 00 00 fc 00 4c 47 20 54 56 0a 20 20 20 20 20 20 20
extensions:      01
checksum:        af

EDID version: 1.3
Manufacturer: GSM Model 1 Serial Number --
Made in week 1 of 2010
Digital display
Maximum image size: 160 cm x 90 cm
Gamma: 2.20
RGB color display
First detailed timing is preferred timing
Display x,y Chromaticity:
  Red:   0.6396, 0.3408
  Green: 0.2871, 0.6103
  Blue:  0.1464, 0.0693
  White: 0.2851, 0.2929
Established timings supported:
  720x400@70Hz 9:5 HorFreq: 31469 Hz Clock: 28.320 MHz
  640x480@60Hz 4:3 HorFreq: 31469 Hz Clock: 25.175 MHz
  800x600@60Hz 4:3 HorFreq: 37900 Hz Clock: 40.000 MHz
  1024x768@60Hz 4:3 HorFreq: 48400 Hz Clock: 65.000 MHz
Standard timings supported:
  640x480@60Hz 4:3 HorFreq: 31469 Hz Clock: 25.175 MHz
  800x600@60Hz 4:3 HorFreq: 37900 Hz Clock: 40.000 MHz
  1024x768@60Hz 4:3 HorFreq: 48400 Hz Clock: 65.000 MHz
  1920x1080@60Hz 16:9
Detailed mode: Clock 84.750 MHz, 700 mm x 390 mm
               1360 1432 1568 1776 hborder 0
                768  771  776  798 vborder 0
               -hsync +vsync 
               VertFreq: 59 Hz, HorFreq: 47719 Hz
Detailed mode: Clock 138.500 MHz, 1000 mm x 550 mm
               1920 1968 2000 2080 hborder 0
               1080 1083 1088 1111 vborder 0
               +hsync -vsync 
               VertFreq: 59 Hz, HorFreq: 66586 Hz
Monitor ranges (GTF): 56-62Hz V, 28-83kHz H, max dotclock 180MHz
Monitor name: LG TV
Has 1 extension blocks
Checksum: 0xaf (valid)

CTA extension block
Extension version: 3
37 bytes of CTA data
  Video data block
    VIC   1 640x480@60Hz 4:3  HorFreq: 31469 Hz Clock: 25.175 MHz
    VIC   2 720x480@60Hz 4:3  HorFreq: 31469 Hz Clock: 27.000 MHz
    VIC   3 720x480@60Hz 16:9  HorFreq: 31469 Hz Clock: 27.000 MHz
    VIC   6 1440x480i@60Hz 4:3  HorFreq: 15734 Hz Clock: 27.000 MHz
    VIC   7 1440x480i@60Hz 16:9  HorFreq: 15734 Hz Clock: 27.000 MHz
    VIC  21 1440x576i@50Hz 4:3  HorFreq: 15625 Hz Clock: 27.000 MHz
    VIC  22 1440x576i@50Hz 16:9  HorFreq: 15625 Hz Clock: 27.000 MHz
    VIC  17 720x576@50Hz 4:3  HorFreq: 31250 Hz Clock: 27.000 MHz
    VIC  18 720x576@50Hz 16:9  HorFreq: 31250 Hz Clock: 27.000 MHz
    VIC  19 1280x720@50Hz 16:9  HorFreq: 37500 Hz Clock: 74.250 MHz
    VIC   4 1280x720@60Hz 16:9 (native) HorFreq: 45000 Hz Clock: 74.250 MHz
    VIC  20 1920x1080i@50Hz 16:9  HorFreq: 28125 Hz Clock: 74.250 MHz
    VIC   5 1920x1080i@60Hz 16:9  HorFreq: 33750 Hz Clock: 74.250 MHz
    VIC  32 1920x1080@24Hz 16:9  HorFreq: 27000 Hz Clock: 74.250 MHz
    VIC  34 1920x1080@30Hz 16:9  HorFreq: 33750 Hz Clock: 74.250 MHz
    VIC  31 1920x1080@50Hz 16:9  HorFreq: 56250 Hz Clock: 148.500 MHz
    VIC  16 1920x1080@60Hz 16:9  HorFreq: 67500 Hz Clock: 148.500 MHz
  Audio data block
    AC-3, max channels 6
      Supported sample rates (kHz): 48 44.1 32
      Maximum bit rate: 640 kHz
    Linear PCM, max channels 2
      Supported sample rates (kHz): 192 176.4 96 88.2 48 44.1 32
      Supported sample sizes (bits): 24 20 16
  Vendor-specific data block, OUI 000c03 (HDMI)
    Source physical address 1.0.0.0
    Supports_AI
    DC_36bit
    DC_30bit
    DC_Y444
    Maximum TMDS clock: 225MHz
  Extended tag: Colorimetry data block
    xvYCC601
    xvYCC709
Underscans PC formats by default
Basic audio support
Supports YCbCr 4:4:4
Supports YCbCr 4:2:2
1 native detailed modes
Detailed mode: Clock 74.250 MHz, 700 mm x 392 mm
               1280 1344 1472 1664 hborder 0
                720  723  728  748 vborder 0
               +hsync +vsync 
               VertFreq: 59 Hz, HorFreq: 44621 Hz
Detailed mode: Clock 80.140 MHz, 700 mm x 392 mm
               1280 1344 1472 1664 hborder 0
                768  771  778  798 vborder 0
               -hsync -vsync 
               VertFreq: 60 Hz, HorFreq: 48161 Hz
Detailed mode: Clock 148.500 MHz, 518 mm x 324 mm
               1920 2008 2052 2200 hborder 0
               1080 1084 1089 1125 vborder 0
               +hsync +vsync 
               VertFreq: 60 Hz, HorFreq: 67500 Hz
Detailed mode: Clock 74.250 MHz, 708 mm x 398 mm
               1920 2008 2052 2200 hborder 0
                540  542  547  562 vborder 0
               +hsync +vsync interlaced 
               VertFreq: 60 Hz, HorFreq: 33750 Hz
Checksum: 0xb4 (valid)

One or more of the timings is out of range of the Monitor Ranges:
  Vertical Freq: 24 - 70 Hz
  Horizontal Freq: 15625 - 67500 Hz
  Maximum Clock: 148.500 MHz
