
EDID (hex):
00ffffffffffff001e6d010001010101
0116010380a05a780aee91a3544c9926
0f5054a1080031404540614071408180
010101010101023a801871382d40582c
4500a05a0000001e023a801871382d40
582c4500a05a0000001e000000fd003a
3e1e530f000a202020202020000000fc
004c472054560a20202020202020019a
020348f44e109f041305140302122021
22150138097f070f7f071507503e1fc0
4d02005706006754005f540177030c00
1100802d20c00d01000e0f06164656a6
b6104050835f0000011d8018711c1620
582c2500a05a0000009e011d007251d0
1e206e285500a05a0000001e00000000
00000000000000000000000000000071

Extracted contents:
header:          00 ff ff ff ff ff ff 00
serial number:   1e 6d 01 00 01 01 01 01 01 16
version:         01 03
basic params:    80 a0 5a 78 0a
chroma info:     ee 91 a3 54 4c 99 26 0f 50 54
established:     a1 08 00
standard:        31 40 45 40 61 40 71 40 81 80 01 01 01 01 01 01
descriptor 1:    02 3a 80 18 71 38 2d 40 58 2c 45 00 a0 5a 00 00 00 1e
descriptor 2:    02 3a 80 18 71 38 2d 40 58 2c 45 00 a0 5a 00 00 00 1e
descriptor 3:    00 00 00 fd 00 3a 3e 1e 53 0f 00 0a 20 20 20 20 20 20
descriptor 4:    00 00 00 fc 00 4c 47 20 54 56 0a 20 20 20 20 20 20 20
extensions:      01
checksum:        9a

EDID version: 1.3
Manufacturer: GSM Model 1 Serial Number --
Made in week 1 of 2012
Digital display
Maximum image size: 160 cm x 90 cm
Gamma: 2.20
RGB color display
First detailed timing is preferred timing
Display x,y Chromaticity:
  Red:   0.6396, 0.3300
  Green: 0.2998, 0.5996
  Blue:  0.1503, 0.0595
  White: 0.3125, 0.3291
Established timings supported:
  720x400@70Hz 9:5 HorFreq: 31469 Hz Clock: 28.320 MHz
  640x480@60Hz 4:3 HorFreq: 31469 Hz Clock: 25.175 MHz
  800x600@60Hz 4:3 HorFreq: 37900 Hz Clock: 40.000 MHz
  1024x768@60Hz 4:3 HorFreq: 48400 Hz Clock: 65.000 MHz
Standard timings supported:
  640x480@60Hz 4:3 HorFreq: 31469 Hz Clock: 25.175 MHz
  800x600@60Hz 4:3 HorFreq: 37900 Hz Clock: 40.000 MHz
  1024x768@60Hz 4:3 HorFreq: 48400 Hz Clock: 65.000 MHz
  1152x864@60Hz 4:3
  1280x1024@60Hz 5:4 HorFreq: 64000 Hz Clock: 108.000 MHz
Detailed mode: Clock 148.500 MHz, 160 mm x 90 mm
               1920 2008 2052 2200 hborder 0
               1080 1084 1089 1125 vborder 0
               +hsync +vsync 
               VertFreq: 60 Hz, HorFreq: 67500 Hz
Detailed mode: Clock 148.500 MHz, 160 mm x 90 mm
               1920 2008 2052 2200 hborder 0
               1080 1084 1089 1125 vborder 0
               +hsync +vsync 
               VertFreq: 60 Hz, HorFreq: 67500 Hz
Monitor ranges (GTF): 58-62Hz V, 30-83kHz H, max dotclock 150MHz
Monitor name: LG TV
Has 1 extension blocks
Checksum: 0x9a (valid)

CTA extension block
Extension version: 3
68 bytes of CTA data
  Video data block
    VIC  16 1920x1080@60Hz 16:9  HorFreq: 67500 Hz Clock: 148.500 MHz
    VIC  31 1920x1080@50Hz 16:9 (native) HorFreq: 56250 Hz Clock: 148.500 MHz
    VIC   4 1280x720@60Hz 16:9  HorFreq: 45000 Hz Clock: 74.250 MHz
    VIC  19 1280x720@50Hz 16:9  HorFreq: 37500 Hz Clock: 74.250 MHz
    VIC   5 1920x1080i@60Hz 16:9  HorFreq: 33750 Hz Clock: 74.250 MHz
    VIC  20 1920x1080i@50Hz 16:9  HorFreq: 28125 Hz Clock: 74.250 MHz
    VIC   3 720x480@60Hz 16:9  HorFreq: 31469 Hz Clock: 27.000 MHz
    VIC   2 720x480@60Hz 4:3  HorFreq: 31469 Hz Clock: 27.000 MHz
    VIC  18 720x576@50Hz 16:9  HorFreq: 31250 Hz Clock: 27.000 MHz
    VIC  32 1920x1080@24Hz 16:9  HorFreq: 27000 Hz Clock: 74.250 MHz
    VIC  33 1920x1080@25Hz 16:9  HorFreq: 28125 Hz Clock: 74.250 MHz
    VIC  34 1920x1080@30Hz 16:9  HorFreq: 33750 Hz Clock: 74.250 MHz
    VIC  21 1440x576i@50Hz 4:3  HorFreq: 15625 Hz Clock: 27.000 MHz
    VIC   1 640x480@60Hz 4:3  HorFreq: 31469 Hz Clock: 25.175 MHz
  Audio data block
    Linear PCM, max channels 2
      Supported sample rates (kHz): 192 176.4 96 88.2 48 44.1 32
      Supported sample sizes (bits): 24 20 16
    Linear PCM, max channels 8
      Supported sample rates (kHz): 192 176.4 96 88.2 48 44.1 32
      Supported sample sizes (bits): 24 20 16
    AC-3, max channels 6
      Supported sample rates (kHz): 48 44.1 32
      Maximum bit rate: 640 kHz
    DTS, max channels 7
      Supported sample rates (kHz): 96 88.2 48 44.1 32
      Maximum bit rate: 1536 kHz
    One Bit Audio, max channels 6
      Supported sample rates (kHz): 44.1
    Dolby Digital+, max channels 8
      Supported sample rates (kHz): 48 44.1
    MAT (MLP), max channels 8
      Supported sample rates (kHz): 192 96 48
    DTS-HD, max channels 8
      Supported sample rates (kHz): 192 96 48
  Vendor-specific data block, OUI 000c03 (HDMI)
    Source physical address 1.1.0.0
    Supports_AI
    Maximum TMDS clock: 225MHz
    Extended HDMI video details:
      3D present
      3D-capable-VIC mask present
      3D: Side-by-side (half, horizontal)
      3D VIC indices: 0 1 2 3 9 10 11
      VIC index 0 supports top-and-bottom
      VIC index 1 supports top-and-bottom
      VIC index 4 supports top-and-bottom
      VIC index 5 supports top-and-bottom
      VIC index 10 supports top-and-bottom
      VIC index 11 supports top-and-bottom
      VIC index 1 supports frame packing
      VIC index 4 supports frame packing
      VIC index 5 supports frame packing
  Speaker allocation data block
    Speaker map:
      FL/FR - Front Left/Right
      LFE - Low Frequency Effects
      FC - Front Center
      BL/BR - Back Left/Right
      BC - Back Center
      RLC/RRC - Rear Left/Right of Center
Underscans PC formats by default
Basic audio support
Supports YCbCr 4:4:4
Supports YCbCr 4:2:2
4 native detailed modes
Detailed mode: Clock 74.250 MHz, 160 mm x 90 mm
               1920 2008 2052 2200 hborder 0
                540  542  547  562 vborder 0
               +hsync +vsync interlaced 
               VertFreq: 60 Hz, HorFreq: 33750 Hz
Detailed mode: Clock 74.250 MHz, 160 mm x 90 mm
               1280 1390 1430 1650 hborder 0
                720  725  730  750 vborder 0
               +hsync +vsync 
               VertFreq: 60 Hz, HorFreq: 45000 Hz
Checksum: 0x71 (valid)

One or more of the timings is out of range of the Monitor Ranges:
  Vertical Freq: 24 - 70 Hz
  Horizontal Freq: 15625 - 67500 Hz
  Maximum Clock: 148.500 MHz
