
EDID (hex):
00ffffffffffff001e6d010001010101
011f010380a05a780aee91a3544c9926
0f5054a1080031404540614071408180
d1c00101010131ce0046f0705a800820
8a0040846300001e6fc200a0a0a05550
3020350040846300001e000000fd0018
781eff77000a202020202020000000fc
004c472054562053534352320a2001a9
020368f15e767676757676dbda101f04
13051403021220212215015d5e5f6263
643f402c095707150750570701095707
6e030c003000b83c2c00800102030468
d85dc40178806b02e200cfe305c000e3
060d01e20f00eb0146d000484b469e42
3fb4e50e616066650000000000000000
000000000000000000000000000000ca

Extracted contents:
header:          00 ff ff ff ff ff ff 00
serial number:   1e 6d 01 00 01 01 01 01 01 1f
version:         01 03
basic params:    80 a0 5a 78 0a
chroma info:     ee 91 a3 54 4c 99 26 0f 50 54
established:     a1 08 00
standard:        31 40 45 40 61 40 71 40 81 80 d1 c0 01 01 01 01
descriptor 1:    31 ce 00 46 f0 70 5a 80 08 20 8a 00 40 84 63 00 00 1e
descriptor 2:    6f c2 00 a0 a0 a0 55 50 30 20 35 00 40 84 63 00 00 1e
descriptor 3:    00 00 00 fd 00 18 78 1e ff 77 00 0a 20 20 20 20 20 20
descriptor 4:    00 00 00 fc 00 4c 47 20 54 56 20 53 53 43 52 32 0a 20
extensions:      01
checksum:        a9

EDID version: 1.3
Manufacturer: GSM Model 1 Serial Number --
Made in week 1 of 2021
Digital display
Maximum image size: 160 cm x 90 cm
Gamma: 2.20
RGB color display
First detailed timing is preferred timing
Display x,y Chromaticity:
  Red:   0.6396, 0.3300
  Green: 0.2998, 0.5996
  Blue:  0.1503, 0.0595
  White: 0.3125, 0.3291
Established timings supported:
  720x400@70Hz 9:5 HorFreq: 31469 Hz Clock: 28.320 MHz
  640x480@60Hz 4:3 HorFreq: 31469 Hz Clock: 25.175 MHz
  800x600@60Hz 4:3 HorFreq: 37900 Hz Clock: 40.000 MHz
  1024x768@60Hz 4:3 HorFreq: 48400 Hz Clock: 65.000 MHz
Standard timings supported:
  640x480@60Hz 4:3 HorFreq: 31469 Hz Clock: 25.175 MHz
  800x600@60Hz 4:3 HorFreq: 37900 Hz Clock: 40.000 MHz
  1024x768@60Hz 4:3 HorFreq: 48400 Hz Clock: 65.000 MHz
  1152x864@60Hz 4:3
  1280x1024@60Hz 5:4 HorFreq: 64000 Hz Clock: 108.000 MHz
  1920x1080@60Hz 16:9
Detailed mode: Clock 527.850 MHz, 1600 mm x 900 mm
               3840 3848 3880 3910 hborder 0
               2160 2168 2178 2250 vborder 0
               +hsync +vsync 
               VertFreq: 60 Hz, HorFreq: 135000 Hz
Detailed mode: Clock 497.750 MHz, 1600 mm x 900 mm
               2560 2608 2640 2720 hborder 0
               1440 1443 1448 1525 vborder 0
               +hsync +vsync 
               VertFreq: 119 Hz, HorFreq: 182996 Hz
Monitor ranges (GTF): 24-120Hz V, 30-255kHz H, max dotclock 1190MHz
Monitor name: LG TV SSCR2
Has 1 extension blocks
Checksum: 0xa9 (valid)

CTA extension block
Extension version: 3
100 bytes of CTA data
  Video data block
    VIC 118 3840x2160@120Hz 16:9  HorFreq: 270000 Hz Clock: 1188.000 MHz
    VIC 118 3840x2160@120Hz 16:9  HorFreq: 270000 Hz Clock: 1188.000 MHz
    VIC 118 3840x2160@120Hz 16:9  HorFreq: 270000 Hz Clock: 1188.000 MHz
    VIC 117 3840x2160@100Hz 16:9  HorFreq: 225000 Hz Clock: 1188.000 MHz
    VIC 118 3840x2160@120Hz 16:9  HorFreq: 270000 Hz Clock: 1188.000 MHz
    VIC 118 3840x2160@120Hz 16:9  HorFreq: 270000 Hz Clock: 1188.000 MHz
    VIC 219 4096x2160@120Hz 256:135  HorFreq: 270000 Hz Clock: 1188.000 MHz
    VIC 218 4096x2160@100Hz 256:135  HorFreq: 225000 Hz Clock: 1188.000 MHz
    VIC  16 1920x1080@60Hz 16:9  HorFreq: 67500 Hz Clock: 148.500 MHz
    VIC  31 1920x1080@50Hz 16:9  HorFreq: 56250 Hz Clock: 148.500 MHz
    VIC   4 1280x720@60Hz 16:9  HorFreq: 45000 Hz Clock: 74.250 MHz
    VIC  19 1280x720@50Hz 16:9  HorFreq: 37500 Hz Clock: 74.250 MHz
    VIC   5 1920x1080i@60Hz 16:9  HorFreq: 33750 Hz Clock: 74.250 MHz
    VIC  20 1920x1080i@50Hz 16:9  HorFreq: 28125 Hz Clock: 74.250 MHz
    VIC   3 720x480@60Hz 16:9  HorFreq: 31469 Hz Clock: 27.000 MHz
    VIC   2 720x480@60Hz 4:3  HorFreq: 31469 Hz Clock: 27.000 MHz
    VIC  18 720x576@50Hz 16:9  HorFreq: 31250 Hz Clock: 27.000 MHz
    VIC  32 1920x1080@24Hz 16:9  HorFreq: 27000 Hz Clock: 74.250 MHz
    VIC  33 1920x1080@25Hz 16:9  HorFreq: 28125 Hz Clock: 74.250 MHz
    VIC  34 1920x1080@30Hz 16:9  HorFreq: 33750 Hz Clock: 74.250 MHz
    VIC  21 1440x576i@50Hz 4:3  HorFreq: 15625 Hz Clock: 27.000 MHz
    VIC   1 640x480@60Hz 4:3  HorFreq: 31469 Hz Clock: 25.175 MHz
    VIC  93 3840x2160@24Hz 16:9  HorFreq: 54000 Hz Clock: 297.000 MHz
    VIC  94 3840x2160@25Hz 16:9  HorFreq: 56250 Hz Clock: 297.000 MHz
    VIC  95 3840x2160@30Hz 16:9  HorFreq: 67500 Hz Clock: 297.000 MHz
    VIC  98 4096x2160@24Hz 256:135  HorFreq: 54000 Hz Clock: 297.000 MHz
    VIC  99 4096x2160@25Hz 256:135  HorFreq: 56250 Hz Clock: 297.000 MHz
    VIC 100 4096x2160@30Hz 256:135  HorFreq: 67500 Hz Clock: 297.000 MHz
    VIC  63 1920x1080@120Hz 16:9  HorFreq: 135000 Hz Clock: 297.000 MHz
    VIC  64 1920x1080@100Hz 16:9  HorFreq: 112500 Hz Clock: 297.000 MHz
  Audio data block
    Linear PCM, max channels 2
      Supported sample rates (kHz): 192 96 48 44.1 32
      Supported sample sizes (bits): 24 20 16
    AC-3, max channels 6
      Supported sample rates (kHz): 48 44.1 32
      Maximum bit rate: 640 kHz
    Dolby Digital+, max channels 8
      Supported sample rates (kHz): 48 44.1 32
    Linear PCM, max channels 2
      Supported sample rates (kHz): 192 96 48 44.1 32
      Supported sample sizes (bits): 24 20 16
  Vendor-specific data block, OUI 000c03 (HDMI)
    Source physical address 3.0.0.0
    Supports_AI
    DC_36bit
    DC_30bit
    DC_Y444
    Maximum TMDS clock: 300MHz
    Extended HDMI video details:
      HDMI VIC 1 3840x2160@30Hz 16:9 HorFreq: 67500 Hz Clock: 297.000 MHz
      HDMI VIC 2 3840x2160@25Hz 16:9 HorFreq: 56250 Hz Clock: 297.000 MHz
      HDMI VIC 3 3840x2160@24Hz 16:9 HorFreq: 54000 Hz Clock: 297.000 MHz
      HDMI VIC 4 4096x2160@24Hz 256:135 HorFreq: 54000 Hz Clock: 297.000 MHz
  Vendor-specific data block, OUI c45dd8 (HDMI Forum)
    Version: 1
    Maximum TMDS Character Rate: 600MHz
    SCDC Present
    Supports 12-bits/component Deep Color 4:2:0 Pixel Encoding
    Supports 10-bits/component Deep Color 4:2:0 Pixel Encoding
  Extended tag: Video capability data block
    YCbCr quantization: Selectable (via AVI YQ) (1)
    RGB quantization: Selectable (via AVI Q) (1)
    PT scan behaviour: No Data (0)
    IT scan behaviour: Support both over- and underscan (3)
    CE scan behaviour: Support both over- and underscan (3)
  Extended tag: Colorimetry data block
    BT2020YCC
    BT2020RGB
  Extended tag: HDR static metadata data block
    Electro optical transfer functions:
      Traditional gamma - SDR luminance range
      SMPTE ST2084
      Hybrid Log-Gamma
    Supported static metadata descriptors:
      Static metadata type 1
  Extended tag: YCbCr 4:2:0 capability map data block
  Extended tag: Vendor-specific video data block
  Extended tag: YCbCr 4:2:0 video data block
    VIC  97 3840x2160@60Hz 16:9  HorFreq: 135000 Hz Clock: 297.000 MHz
    VIC  96 3840x2160@50Hz 16:9  HorFreq: 112500 Hz Clock: 297.000 MHz
    VIC 102 4096x2160@60Hz 256:135  HorFreq: 135000 Hz Clock: 297.000 MHz
    VIC 101 4096x2160@50Hz 256:135  HorFreq: 112500 Hz Clock: 297.000 MHz
Underscans PC formats by default
Basic audio support
Supports YCbCr 4:4:4
Supports YCbCr 4:2:2
1 native detailed modes
Checksum: 0xca (valid)

One or more of the timings is out of range of the Monitor Ranges:
  Vertical Freq: 24 - 120 Hz
  Horizontal Freq: 15625 - 270000 Hz
  Maximum Clock: 1188.000 MHz


