
EDID (hex):
00ffffffffffff001e6d010001010101
01130103807341780acf74a3574cb023
09484ca1080081c00101010101010101
010101010101662150b051001b304070
36007e8a4200001e011d007251d01e20
6e2855007e8a4200001e000000fd0039
3f1f3c09000a202020202020000000fc
004c472054560a20202020202020011d
02031bf1471022200584030226150750
09070767030c001000b82d023a801871
382d40582c04057e8a4200001e011d80
18711c1620582c25007e8a4200009e01
1d007251d01e206e2855007e8a420000
1e8c0ad08a20e02d10103e96007e8a42
000018263680a070381f40302025007e
8a4200001a00000000000000000000ba

Extracted contents:
header:          00 ff ff ff ff ff ff 00
serial number:   1e 6d 01 00 01 01 01 01 01 13
version:         01 03
basic params:    80 73 41 78 0a
chroma info:     cf 74 a3 57 4c b0 23 09 48 4c
established:     a1 08 00
standard:        81 c0 01 01 01 01 01 01 01 01 01 01 01 01 01 01
descriptor 1:    66 21 50 b0 51 00 1b 30 40 70 36 00 7e 8a 42 00 00 1e
descriptor 2:    01 1d 00 72 51 d0 1e 20 6e 28 55 00 7e 8a 42 00 00 1e
descriptor 3:    00 00 00 fd 00 39 3f 1f 3c 09 00 0a 20 20 20 20 20 20
descriptor 4:    00 00 00 fc 00 4c 47 20 54 56 0a 20 20 20 20 20 20 20
extensions:      01
checksum:        1d

EDID version: 1.3
Manufacturer: GSM Model 1 Serial Number --
Made in week 1 of 2009
Digital display
Maximum image size: 115 cm x 65 cm
Gamma: 2.20
RGB color display
First detailed timing is preferred timing
Display x,y Chromaticity:
  Red:   0.6396, 0.3398
  Green: 0.2998, 0.6904
  Blue:  0.1376, 0.0380
  White: 0.2822, 0.2968
Established timings supported:
  720x400@70Hz 9:5 HorFreq: 31469 Hz Clock: 28.320 MHz
  640x480@60Hz 4:3 HorFreq: 31469 Hz Clock: 25.175 MHz
  800x600@60Hz 4:3 HorFreq: 37900 Hz Clock: 40.000 MHz
  1024x768@60Hz 4:3 HorFreq: 48400 Hz Clock: 65.000 MHz
Standard timings supported:
  1280x720@60Hz 16:9
Detailed mode: Clock 85.500 MHz, 1150 mm x 650 mm
               1360 1424 1536 1792 hborder 0
                768  771  777  795 vborder 0
               +hsync +vsync 
               VertFreq: 60 Hz, HorFreq: 47712 Hz
Detailed mode: Clock 74.250 MHz, 1150 mm x 650 mm
               1280 1390 1430 1650 hborder 0
                720  725  730  750 vborder 0
               +hsync +vsync 
               VertFreq: 60 Hz, HorFreq: 45000 Hz
Monitor ranges (GTF): 57-63Hz V, 31-60kHz H, max dotclock 90MHz
Monitor name: LG TV
Has 1 extension blocks
Checksum: 0x1d (valid)

CTA extension block
Extension version: 3
23 bytes of CTA data
  Video data block
    VIC  16 1920x1080@60Hz 16:9  HorFreq: 67500 Hz Clock: 148.500 MHz
    VIC  34 1920x1080@30Hz 16:9  HorFreq: 33750 Hz Clock: 74.250 MHz
    VIC  32 1920x1080@24Hz 16:9  HorFreq: 27000 Hz Clock: 74.250 MHz
    VIC   5 1920x1080i@60Hz 16:9  HorFreq: 33750 Hz Clock: 74.250 MHz
    VIC   4 1280x720@60Hz 16:9 (native) HorFreq: 45000 Hz Clock: 74.250 MHz
    VIC   3 720x480@60Hz 16:9  HorFreq: 31469 Hz Clock: 27.000 MHz
    VIC   2 720x480@60Hz 4:3  HorFreq: 31469 Hz Clock: 27.000 MHz
  Audio data block
    AC-3, max channels 6
      Supported sample rates (kHz): 48 44.1 32
      Maximum bit rate: 640 kHz
    Linear PCM, max channels 2
      Supported sample rates (kHz): 48 44.1 32
      Supported sample sizes (bits): 24 20 16
  Vendor-specific data block, OUI 000c03 (HDMI)
    Source physical address 1.0.0.0
    Supports_AI
    DC_36bit
    DC_30bit
    DC_Y444
    Maximum TMDS clock: 225MHz
Underscans PC formats by default
Basic audio support
Supports YCbCr 4:4:4
Supports YCbCr 4:2:2
1 native detailed modes
Detailed mode: Clock 148.500 MHz, 1150 mm x 650 mm
               1920 2008 2052 2200 hborder 0
               1080 1096 1116 1125 vborder 0
               +hsync +vsync 
               VertFreq: 60 Hz, HorFreq: 67500 Hz
Detailed mode: Clock 74.250 MHz, 1150 mm x 650 mm
               1920 2008 2052 2200 hborder 0
                540  542  547  562 vborder 0
               +hsync +vsync interlaced 
               VertFreq: 60 Hz, HorFreq: 33750 Hz
Detailed mode: Clock 74.250 MHz, 1150 mm x 650 mm
               1280 1390 1430 1650 hborder 0
                720  725  730  750 vborder 0
               +hsync +vsync 
               VertFreq: 60 Hz, HorFreq: 45000 Hz
Detailed mode: Clock 27.000 MHz, 1150 mm x 650 mm
                720  736  798  858 hborder 0
                480  489  495  525 vborder 0
               -hsync -vsync 
               VertFreq: 59 Hz, HorFreq: 31468 Hz
Detailed mode: Clock 138.620 MHz, 1150 mm x 650 mm
               1920 1968 2000 2080 hborder 0
               1080 1082 1087 1111 vborder 0
               +hsync -vsync 
               VertFreq: 59 Hz, HorFreq: 66644 Hz
Checksum: 0xba (valid)

One or more of the timings is out of range of the Monitor Ranges:
  Vertical Freq: 24 - 70 Hz
  Horizontal Freq: 27000 - 67500 Hz
  Maximum Clock: 148.500 MHz


