edid-decode (hex):

00 ff ff ff ff ff ff 00 1e 6d 01 00 fb de 00 00
07 10 01 03 80 52 2e 78 0a d4 6c a3 57 49 9c 25
11 48 4b af ce 00 31 4f 45 4f 61 4f 01 01 01 01
01 01 01 01 01 01 64 19 00 40 41 00 26 30 18 88
36 00 ba 88 21 00 00 18 00 00 00 fd 00 38 4b 1e
3d 08 00 0a 20 20 20 20 20 20 00 00 00 fc 00 34
32 4c 43 32 44 2d 55 44 0a 20 20 20 00 00 00 00
00 00 00 00 00 00 00 00 00 00 00 00 00 00 01 e7

02 03 13 f1 44 84 05 03 02 23 15 07 50 65 03 0c
00 10 00 01 1d 00 72 51 d0 1e 20 dc 28 45 04 ba
88 21 00 00 1e 01 1d 80 18 71 1c 16 20 94 2c f5
00 ba 88 21 00 00 1e 8c 0a d0 8a 20 e0 2d 10 3c
3e e6 04 ba 88 21 00 00 18 8c 0a d0 8a 20 e0 2d
10 3c 3e e6 04 ba 88 21 00 00 18 00 00 00 00 00
00 00 00 00 00 00 00 00 00 00 00 00 00 00 00 00
00 00 00 00 00 00 00 00 00 00 00 00 00 00 00 8e

00 ff ff ff ff ff ff 00 1e 6d 01 00 fb de 00 00
07 10 01 03 80 52 2e 78 0a d4 6c a3 57 49 9c 25
11 48 4b af ce 00 31 4f 45 4f 61 4f 01 01 01 01
01 01 01 01 01 01 64 19 00 40 41 00 26 30 18 88
36 00 ba 88 21 00 00 18 00 00 00 fd 00 38 4b 1e
3d 08 00 0a 20 20 20 20 20 20 00 00 00 fc 00 34
32 4c 43 32 44 2d 55 44 0a 20 20 20 00 00 00 00
00 00 00 00 00 00 00 00 00 00 00 00 00 00 01 e7

02 03 13 f1 44 84 05 03 02 23 15 07 50 65 03 0c
00 10 00 01 1d 00 72 51 d0 1e 20 dc 28 45 04 ba
88 21 00 00 1e 01 1d 80 18 71 1c 16 20 94 2c f5
00 ba 88 21 00 00 1e 8c 0a d0 8a 20 e0 2d 10 3c
3e e6 04 ba 88 21 00 00 18 8c 0a d0 8a 20 e0 2d
10 3c 3e e6 04 ba 88 21 00 00 18 00 00 00 00 00
00 00 00 00 00 00 00 00 00 00 00 00 00 00 00 00
00 00 00 00 00 00 00 00 00 00 00 00 00 00 00 8e

----------------

Block 0, Base EDID:
  EDID Structure Version & Revision: 1.3
  Vendor & Product Identification:
    Manufacturer: GSM
    Model: 1
    Serial Number: ...
    Made in: week 7 of 2006
  Basic Display Parameters & Features:
    Digital display
    Maximum image size: 82 cm x 46 cm
    Gamma: 2.20
    RGB color display
    First detailed timing is the preferred timing
  Color Characteristics:
    Red  : 0.6396, 0.3408
    Green: 0.2861, 0.6093
    Blue : 0.1455, 0.0683
    White: 0.2841, 0.2929
  Established Timings I & II:
    IBM     :   720x400    70.081663 Hz   9:5     31.467 kHz     28.320000 MHz
    DMT 0x04:   640x480    59.940476 Hz   4:3     31.469 kHz     25.175000 MHz
    DMT 0x05:   640x480    72.808802 Hz   4:3     37.861 kHz     31.500000 MHz
    DMT 0x06:   640x480    75.000000 Hz   4:3     37.500 kHz     31.500000 MHz
    DMT 0x08:   800x600    56.250000 Hz   4:3     35.156 kHz     36.000000 MHz
    DMT 0x09:   800x600    60.316541 Hz   4:3     37.879 kHz     40.000000 MHz
    DMT 0x0a:   800x600    72.187572 Hz   4:3     48.077 kHz     50.000000 MHz
    DMT 0x0b:   800x600    75.000000 Hz   4:3     46.875 kHz     49.500000 MHz
    DMT 0x10:  1024x768    60.003840 Hz   4:3     48.363 kHz     65.000000 MHz
    DMT 0x11:  1024x768    70.069359 Hz   4:3     56.476 kHz     75.000000 MHz
    DMT 0x12:  1024x768    75.028582 Hz   4:3     60.023 kHz     78.750000 MHz
  Standard Timings:
    DMT 0x06:   640x480    75.000000 Hz   4:3     37.500 kHz     31.500000 MHz
    DMT 0x0b:   800x600    75.000000 Hz   4:3     46.875 kHz     49.500000 MHz
    DMT 0x12:  1024x768    75.028582 Hz   4:3     60.023 kHz     78.750000 MHz
  Detailed Timing Descriptors:
    DTD 1:  1024x768    60.003840 Hz   4:3     48.363 kHz     65.000000 MHz (698 mm x 392 mm)
                 Hfront   24 Hsync 136 Hback  160 Hpol N
                 Vfront    3 Vsync   6 Vback   29 Vpol N
    Display Range Limits:
      Monitor ranges (GTF): 56-75 Hz V, 30-61 kHz H, max dotclock 80 MHz
    Display Product Name: '42LC2D-UD'
    Empty Descriptor
  Extension blocks: 1
Checksum: 0xe7

----------------

Block 1, CTA-861 Extension Block:
  Revision: 3
  Underscans IT Video Formats by default
  Basic audio support
  Supports YCbCr 4:4:4
  Supports YCbCr 4:2:2
  Native detailed modes: 1
  Video Data Block:
    VIC   4:  1280x720    60.000000 Hz  16:9     45.000 kHz     74.250000 MHz (native)
    VIC   5:  1920x1080i  60.000000 Hz  16:9     33.750 kHz     74.250000 MHz
    VIC   3:   720x480    59.940060 Hz  16:9     31.469 kHz     27.000000 MHz
    VIC   2:   720x480    59.940060 Hz   4:3     31.469 kHz     27.000000 MHz
  Audio Data Block:
    AC-3:
      Max channels: 6
      Supported sample rates (kHz): 48 44.1 32
      Maximum bit rate: 640 kb/s
  Vendor-Specific Data Block (HDMI), OUI 00-0C-03:
    Source physical address: 1.0.0.0
  Detailed Timing Descriptors:
    DTD 2:  1280x720    60.000000 Hz  16:9     45.000 kHz     74.250000 MHz (698 mm x 392 mm)
                 Hfront  220 Hsync  40 Hback  110 Hpol P
                 Vfront   20 Vsync   5 Vback    5 Vpol P
    DTD 3:  1920x540    60.053381 Hz  32:9     33.750 kHz     74.250000 MHz (698 mm x 392 mm)
                 Hfront  148 Hsync  44 Hback   88 Hpol P
                 Vfront   15 Vsync   5 Vback    2 Vpol P
    DTD 4:   720x480    59.940060 Hz   3:2     31.469 kHz     27.000000 MHz (698 mm x 392 mm)
                 Hfront   60 Hsync  62 Hback   16 Hpol N
                 Vfront   30 Vsync   6 Vback    9 Vpol N
    DTD 5:   720x480    59.940060 Hz   3:2     31.469 kHz     27.000000 MHz (698 mm x 392 mm)
                 Hfront   60 Hsync  62 Hback   16 Hpol N
                 Vfront   30 Vsync   6 Vback    9 Vpol N
Checksum: 0x8e  Unused space in Extension Block: 36 bytes

----------------

Block 2, Unknown EDID Extension Block 0x00:
  00 ff ff ff ff ff ff 00 1e 6d 01 00 fb de 00 00 '.........m......'
  07 10 01 03 80 52 2e 78 0a d4 6c a3 57 49 9c 25 '.....R.x..l.WI.%'
  11 48 4b af ce 00 31 4f 45 4f 61 4f 01 01 01 01 '.HK...1OEOaO....'
  01 01 01 01 01 01 64 19 00 40 41 00 26 30 18 88 '......d..@A.&0..'
  36 00 ba 88 21 00 00 18 00 00 00 fd 00 38 4b 1e '6...!........8K.'
  3d 08 00 0a 20 20 20 20 20 20 00 00 00 fc 00 34 '=...      .....4'
  32 4c 43 32 44 2d 55 44 0a 20 20 20 00 00 00 00 '2LC2D-UD.   ....'
  00 00 00 00 00 00 00 00 00 00 00 00 00 00 01 e7 '................'
Checksum: 0xe7

----------------

Block 3, CTA-861 Extension Block:
  Revision: 3
  Underscans IT Video Formats by default
  Basic audio support
  Supports YCbCr 4:4:4
  Supports YCbCr 4:2:2
  Native detailed modes: 1
  Video Data Block:
    VIC   4:  1280x720    60.000000 Hz  16:9     45.000 kHz     74.250000 MHz (native)
    VIC   5:  1920x1080i  60.000000 Hz  16:9     33.750 kHz     74.250000 MHz
    VIC   3:   720x480    59.940060 Hz  16:9     31.469 kHz     27.000000 MHz
    VIC   2:   720x480    59.940060 Hz   4:3     31.469 kHz     27.000000 MHz
  Audio Data Block:
    AC-3:
      Max channels: 6
      Supported sample rates (kHz): 48 44.1 32
      Maximum bit rate: 640 kb/s
  Vendor-Specific Data Block (HDMI), OUI 00-0C-03:
    Source physical address: 1.0.0.0
  Detailed Timing Descriptors:
    DTD 6:  1280x720    60.000000 Hz  16:9     45.000 kHz     74.250000 MHz (698 mm x 392 mm)
                 Hfront  220 Hsync  40 Hback  110 Hpol P
                 Vfront   20 Vsync   5 Vback    5 Vpol P
    DTD 7:  1920x540    60.053381 Hz  32:9     33.750 kHz     74.250000 MHz (698 mm x 392 mm)
                 Hfront  148 Hsync  44 Hback   88 Hpol P
                 Vfront   15 Vsync   5 Vback    2 Vpol P
    DTD 8:   720x480    59.940060 Hz   3:2     31.469 kHz     27.000000 MHz (698 mm x 392 mm)
                 Hfront   60 Hsync  62 Hback   16 Hpol N
                 Vfront   30 Vsync   6 Vback    9 Vpol N
    DTD 9:   720x480    59.940060 Hz   3:2     31.469 kHz     27.000000 MHz (698 mm x 392 mm)
                 Hfront   60 Hsync  62 Hback   16 Hpol N
                 Vfront   30 Vsync   6 Vback    9 Vpol N
Checksum: 0x8e  Unused space in Extension Block: 36 bytes

----------------

Warnings:

Block 1, CTA-861 Extension Block:
  Detailed Timing Descriptor #2: DTD is similar but not identical to VIC 4.
  Detailed Timing Descriptor #4: DTD is similar but not identical to VIC 2.
  Detailed Timing Descriptor #5: DTD is similar but not identical to VIC 2.
  Add a Colorimetry Data Block with the sRGB colorimetry bit set to avoid interop issues.
Block 3, CTA-861 Extension Block:
  Detailed Timing Descriptor #6: DTD is similar but not identical to VIC 4.
  Detailed Timing Descriptor #8: DTD is similar but not identical to VIC 2.
  Detailed Timing Descriptor #9: DTD is similar but not identical to VIC 2.
  Add a Colorimetry Data Block with the sRGB colorimetry bit set to avoid interop issues.

Failures:

Block 0, Base EDID:
  Detailed Timing Descriptor #1: Mismatch of image size 698x392 mm vs display size 820x460 mm.
  Empty Descriptor: Use Dummy Descriptor instead of all zeroes.
Block 1, CTA-861 Extension Block:
  Detailed Timing Descriptor #2: Mismatch of image size 698x392 mm vs display size 820x460 mm.
  Detailed Timing Descriptor #3: Mismatch of image size 698x392 mm vs display size 820x460 mm.
  Detailed Timing Descriptor #4: Mismatch of image size 698x392 mm vs display size 820x460 mm.
  Detailed Timing Descriptor #5: Mismatch of image size 698x392 mm vs display size 820x460 mm.
  Missing VCDB, needed for Set Selectable RGB Quantization to avoid interop issues.
Block 2, Base EDID:
  Unknown Extension Block.
Block 3, CTA-861 Extension Block:
  Video Data Block: Duplicate VIC 4.
  Video Data Block: Duplicate VIC 5.
  Video Data Block: Duplicate VIC 3.
  Video Data Block: Duplicate VIC 2.
  Detailed Timing Descriptor #6: Mismatch of image size 698x392 mm vs display size 820x460 mm.
  Detailed Timing Descriptor #7: Mismatch of image size 698x392 mm vs display size 820x460 mm.
  Detailed Timing Descriptor #8: Mismatch of image size 698x392 mm vs display size 820x460 mm.
  Detailed Timing Descriptor #9: Mismatch of image size 698x392 mm vs display size 820x460 mm.
  Missing VCDB, needed for Set Selectable RGB Quantization to avoid interop issues.
EDID:
  Base EDID: EDID specified 1 extension block(s), but found 3 extension block(s).
  Base EDID: EDID 1.3 requires a Block Map Extension in Block 1 if there are more than 2 blocks in the EDID.
  CTA-861: Native progressive timings are a mix of several resolutions.

EDID conformity: FAIL
