
EDID (hex):
00ffffffffffff0031d60f0600000000
0d1f0103801c117802ee95a3544c9926
0f50549ef7809500818f818c01010101
010101010101684270a0804622503020
360018af10000018000000fd00283c1e
8c1e000a202020202020000000fc0059
4f4741205061642050726f0a000000ff
00593133324b534e520a2020202001bd
020322f149040302011f121311102309
070167030c001000382d83010000e305
0301023a801871382d40582c45005550
2100001e000000000000000000000000
00000000000000000000000000000000
00000000000000000000000000000000
00000000000000000000000000000000
0000000000000000000000000000000a

Extracted contents:
header:          00 ff ff ff ff ff ff 00
serial number:   31 d6 0f 06 00 00 00 00 0d 1f
version:         01 03
basic params:    80 1c 11 78 02
chroma info:     ee 95 a3 54 4c 99 26 0f 50 54
established:     9e f7 80
standard:        95 00 81 8f 81 8c 01 01 01 01 01 01 01 01 01 01
descriptor 1:    68 42 70 a0 80 46 22 50 30 20 36 00 18 af 10 00 00 18
descriptor 2:    00 00 00 fd 00 28 3c 1e 8c 1e 00 0a 20 20 20 20 20 20
descriptor 3:    00 00 00 fc 00 59 4f 47 41 20 50 61 64 20 50 72 6f 0a
descriptor 4:    00 00 00 ff 00 59 31 33 32 4b 53 4e 52 0a 20 20 20 20
extensions:      01
checksum:        bd

EDID version: 1.3
Manufacturer: LNV Model 60f Serial Number --
Made in week 13 of 2021
Digital display
Maximum image size: 28 cm x 17 cm
Gamma: 2.20
Monochrome or grayscale display
First detailed timing is preferred timing
Display x,y Chromaticity:
  Red:   0.6396, 0.3300
  Green: 0.2998, 0.5996
  Blue:  0.1503, 0.0595
  White: 0.3134, 0.3291
Established timings supported:
  720x400@70Hz 9:5 HorFreq: 31469 Hz Clock: 28.320 MHz
  640x480@67Hz 4:3 HorFreq: 35000 Hz Clock: 30.240 MHz
  640x480@72Hz 4:3 HorFreq: 37900 Hz Clock: 31.500 MHz
  640x480@75Hz 4:3 HorFreq: 37500 Hz Clock: 31.500 MHz
  800x600@56Hz 4:3 HorFreq: 35200 Hz Clock: 36.000 MHz
  800x600@72Hz 4:3 HorFreq: 48100 Hz Clock: 50.000 MHz
  800x600@75Hz 4:3 HorFreq: 46900 Hz Clock: 49.500 MHz
  832x624@75Hz 4:3 HorFreq: 49726 Hz Clock: 57.284 MHz
  1280x768i@87Hz 5:3 HorFreq: 35522 Hz Clock: 44.900 MHz
  1024x768@70Hz 4:3 HorFreq: 56500 Hz Clock: 75.000 MHz
  1024x768@75Hz 4:3 HorFreq: 60000 Hz Clock: 78.750 MHz
  1280x1024@75Hz 5:4 HorFreq: 80000 Hz Clock: 135.000 MHz
  1152x870@75Hz 192:145 HorFreq: 67500 Hz Clock: 108.000 MHz
Standard timings supported:
  1440x900@60Hz 16:10 HorFreq: 55500 Hz Clock: 88.750 MHz
  1280x1024@75Hz 5:4 HorFreq: 80000 Hz Clock: 135.000 MHz
  1280x1024@72Hz 5:4
Detailed mode: Clock 170.000 MHz, 280 mm x 175 mm
               2160 2208 2240 2320 hborder 0
               1350 1353 1359 1384 vborder 0
               -hsync -vsync 
               VertFreq: 52 Hz, HorFreq: 73275 Hz
Monitor ranges (GTF): 40-60Hz V, 30-140kHz H, max dotclock 300MHz
Monitor name: YOGA Pad Pro
Serial number: --
Has 1 extension blocks
Checksum: 0xbd (valid)

CTA extension block
Extension version: 3
30 bytes of CTA data
  Video data block
    VIC   4 1280x720@60Hz 16:9  HorFreq: 45000 Hz Clock: 74.250 MHz
    VIC   3 720x480@60Hz 16:9  HorFreq: 31469 Hz Clock: 27.000 MHz
    VIC   2 720x480@60Hz 4:3  HorFreq: 31469 Hz Clock: 27.000 MHz
    VIC   1 640x480@60Hz 4:3  HorFreq: 31469 Hz Clock: 25.175 MHz
    VIC  31 1920x1080@50Hz 16:9  HorFreq: 56250 Hz Clock: 148.500 MHz
    VIC  18 720x576@50Hz 16:9  HorFreq: 31250 Hz Clock: 27.000 MHz
    VIC  19 1280x720@50Hz 16:9  HorFreq: 37500 Hz Clock: 74.250 MHz
    VIC  17 720x576@50Hz 4:3  HorFreq: 31250 Hz Clock: 27.000 MHz
    VIC  16 1920x1080@60Hz 16:9  HorFreq: 67500 Hz Clock: 148.500 MHz
  Audio data block
    Linear PCM, max channels 2
      Supported sample rates (kHz): 48 44.1 32
      Supported sample sizes (bits): 16
  Vendor-specific data block, OUI 000c03 (HDMI)
    Source physical address 1.0.0.0
    DC_36bit
    DC_30bit
    DC_Y444
    Maximum TMDS clock: 225MHz
  Speaker allocation data block
    Speaker map:
      FL/FR - Front Left/Right
  Extended tag: Colorimetry data block
    xvYCC601
    xvYCC709
Underscans PC formats by default
Basic audio support
Supports YCbCr 4:4:4
Supports YCbCr 4:2:2
1 native detailed modes
Detailed mode: Clock 148.500 MHz, 597 mm x 336 mm
               1920 2008 2052 2200 hborder 0
               1080 1084 1089 1125 vborder 0
               +hsync +vsync 
               VertFreq: 60 Hz, HorFreq: 67500 Hz
Checksum: 0xa (valid)

One or more of the timings is out of range of the Monitor Ranges:
  Vertical Freq: 50 - 87 Hz
  Horizontal Freq: 31250 - 80000 Hz
  Maximum Clock: 170.000 MHz
