edid-decode (hex):

00 ff ff ff ff ff ff 00 06 af 3e 22 00 00 00 00
22 14 01 03 80 1f 11 78 0a 61 95 9c 59 52 8f 26
21 50 54 00 00 00 01 01 01 01 01 01 01 01 01 01
01 01 01 01 01 01 1c 2a 40 72 61 84 0c 30 40 2a
33 00 35 ae 10 00 00 18 13 1c 40 72 61 84 0c 30
40 2a 33 00 35 ae 10 00 00 18 00 00 00 00 00 00
00 00 00 00 00 00 00 00 00 00 00 00 00 00 00 02
00 0b 48 f5 0a 3c 64 14 0e 1a 68 20 20 20 00 5b

----------------

Block 0, Base EDID:
  EDID Structure Version & Revision: 1.3
  Vendor & Product Identification:
    Manufacturer: AUO
    Model: 8766
    Made in: week 34 of 2010
  Basic Display Parameters & Features:
    Digital display
    Maximum image size: 31 cm x 17 cm
    Gamma: 2.20
    RGB color display
    First detailed timing is preferred timing
  Color Characteristics:
    Red  : 0.6103, 0.3496
    Green: 0.3203, 0.5595
    Blue : 0.1503, 0.1298
    White: 0.3134, 0.3291
  Established Timings I & II: none
  Standard Timings: none
  Detailed Timing Descriptors:
    DTD 1:  1600x900    60.001 Hz  16:9    54.721 kHz 107.800 MHz (309 mm x 174 mm)
                 Hfront   64 Hsync  42 Hback 264 Hpol N
                 Vfront    3 Vsync   3 Vback   6 Vpol N
    DTD 2:  1600x900    40.002 Hz  16:9    36.482 kHz  71.870 MHz (309 mm x 174 mm)
                 Hfront   64 Hsync  42 Hback 264 Hpol N
                 Vfront    3 Vsync   3 Vback   6 Vpol N
    Empty Descriptor
    Manufacturer-Specified Display Descriptor (0x02): 00 02 00 0b 48 f5 0a 3c 64 14 0e 1a 68 20 20 20 '....H..<d...h   '
Checksum: 0x5b
