edid-decode (hex):

00 ff ff ff ff ff ff 00 0e 6f 01 13 00 00 00 00
00 1d 01 04 a5 1c 11 78 02 ee 95 a3 54 4c 99 26
0f 50 54 00 00 00 01 01 01 01 01 01 01 01 01 01
01 01 01 01 01 01 50 46 70 2c 80 46 11 50 10 10
81 00 18 af 10 00 00 18 00 00 00 00 00 00 00 00
00 00 00 00 00 00 00 00 00 18 00 00 00 fe 00 43
53 4f 54 20 54 33 0a 20 20 20 20 20 00 00 00 fe
00 4d 4e 44 30 30 37 5a 41 31 2d 31 0a 20 00 6e

00 ff ff ff ff ff ff 00 0e 6f 01 13 00 00 00 00
00 1d 01 04 a5 1c 11 78 02 ee 95 a3 54 4c 99 26
0f 50 54 00 00 00 01 01 01 01 01 01 01 01 01 01
01 01 01 01 01 01 50 46 70 2c 80 46 11 50 10 10
81 00 18 af 10 00 00 18 00 00 00 00 00 00 00 00
00 00 00 00 00 00 00 00 00 18 00 00 00 fe 00 43
53 4f 54 20 54 33 0a 20 20 20 20 20 00 00 00 fe
00 4d 4e 44 30 30 37 5a 41 31 2d 31 0a 20 00 6e

----------------

Block 0, Base EDID:
  EDID Structure Version & Revision: 1.4
  Vendor & Product Identification:
    Manufacturer: CSO
    Model: 4865
    Made in: 2019
  Basic Display Parameters & Features:
    Digital display
    Bits per primary color channel: 8
    DisplayPort interface
    Maximum image size: 28 cm x 17 cm
    Gamma: 2.20
    Supported color formats: RGB 4:4:4
    First detailed timing includes the native pixel format and preferred refresh rate
  Color Characteristics:
    Red  : 0.6396, 0.3300
    Green: 0.2998, 0.5996
    Blue : 0.1503, 0.0595
    White: 0.3134, 0.3291
  Established Timings I & II: none
  Standard Timings: none
  Detailed Timing Descriptors:
    DTD 1:  2160x1350   59.743739 Hz  16:10    81.670 kHz    180.000000 MHz (280 mm x 175 mm)
                 Hfront   16 Hsync  16 Hback   12 Hpol N
                 Vfront    8 Vsync   1 Vback    8 Vpol N
    Manufacturer-Specified Display Descriptor (0x00): 00 00 00 00 00 00 00 00 00 00 00 00 00 00 00 18 '................'
    Alphanumeric Data String: 'CSOT T3'
    Alphanumeric Data String: 'MND007ZA1-1'
Checksum: 0x6e

----------------

Block 1, Unknown EDID Extension Block 0x00:
  00 ff ff ff ff ff ff 00 0e 6f 01 13 00 00 00 00 '.........o......'
  00 1d 01 04 a5 1c 11 78 02 ee 95 a3 54 4c 99 26 '.......x....TL.&'
  0f 50 54 00 00 00 01 01 01 01 01 01 01 01 01 01 '.PT.............'
  01 01 01 01 01 01 50 46 70 2c 80 46 11 50 10 10 '......PFp,.F.P..'
  81 00 18 af 10 00 00 18 00 00 00 00 00 00 00 00 '................'
  00 00 00 00 00 00 00 00 00 18 00 00 00 fe 00 43 '...............C'
  53 4f 54 20 54 33 0a 20 20 20 20 20 00 00 00 fe 'SOT T3.     ....'
  00 4d 4e 44 30 30 37 5a 41 31 2d 31 0a 20 00 6e '.MND007ZA1-1. .n'
Checksum: 0x6e

----------------

Warnings:

Block 0, Base EDID:
  Missing Display Product Name.

Failures:

Block 1, Base EDID:
  Unknown Extension Block.
EDID:
  Base EDID: EDID specified 0 extension block(s), but found 1 extension block(s).

EDID conformity: FAIL
