edid-decode (hex):

00 ff ff ff ff ff ff 00 09 e5 e7 07 00 00 00 01
0e 1d 01 04 a5 1d 11 78 02 ad 70 a7 52 4a 9a 27
11 4f 53 00 00 00 01 01 01 01 01 01 01 01 01 01
01 01 01 01 01 01 c6 39 80 18 71 38 28 40 30 20
36 00 26 a5 10 00 00 1a 00 00 00 00 00 00 00 00
00 00 00 00 00 00 00 00 00 00 00 00 00 fc 00 42
4f 45 20 4c 43 44 20 20 20 20 20 20 00 00 00 fe
00 54 45 31 33 33 46 48 45 2d 54 53 30 0a 00 11

----------------

Block 0, Base EDID:
  EDID Structure Version & Revision: 1.4
  Vendor & Product Identification:
    Manufacturer: BOE
    Model: 2023
    Serial Number: ...
    Made in: week 14 of 2019
  Basic Display Parameters & Features:
    Digital display
    Bits per primary color channel: 8
    DisplayPort interface
    Maximum image size: 29 cm x 17 cm
    Gamma: 2.20
    Supported color formats: RGB 4:4:4
    First detailed timing includes the native pixel format and preferred refresh rate
  Color Characteristics:
    Red  : 0.6542, 0.3222
    Green: 0.2919, 0.6025
    Blue : 0.1533, 0.0693
    White: 0.3085, 0.3242
  Established Timings I & II: none
  Standard Timings: none
  Detailed Timing Descriptors:
    DTD 1:  1920x1080   60.024351 Hz  16:9     67.227 kHz    147.900000 MHz (294 mm x 165 mm)
                 Hfront   48 Hsync  32 Hback  200 Hpol P
                 Vfront    3 Vsync   6 Vback   31 Vpol N
    Empty Descriptor
    Display Product Name: 'BOE LCD      '
    Alphanumeric Data String: 'TE133FHE-TS0'
Checksum: 0x11

----------------

Failures:

Block 0, Base EDID:
  Empty Descriptor: Use Dummy Descriptor instead of all zeroes.
  Display Product Name: One or more trailing spaces.

EDID conformity: FAIL
