edid-decode (hex):

00 ff ff ff ff ff ff 00 09 d1 db 78 45 54 00 00
34 1c 01 03 0e 30 1b 78 2e f0 03 a6 55 52 a0 27
11 50 53 a5 6b 80 d1 c0 81 c0 81 00 81 80 a9 c0
b3 00 01 01 01 01 02 3a 80 18 71 38 2d 40 58 2c
45 00 dc 0c 11 00 00 1e 00 00 00 ff 00 56 43 4a
30 33 32 31 30 30 31 39 0a 20 00 00 00 fd 00 32
4c 1e 53 15 00 0a 20 20 20 20 20 20 00 00 00 fc
00 42 65 6e 51 20 47 57 32 32 37 30 0a 20 00 e8

00 ff ff ff ff ff ff 00 09 d1 db 78 45 54 00 00
34 1c 01 03 0e 30 1b 78 2e f0 03 a6 55 52 a0 27
11 50 53 a5 6b 80 d1 c0 81 c0 81 00 81 80 a9 c0
b3 00 01 01 01 01 02 3a 80 18 71 38 2d 40 58 2c
45 00 dc 0c 11 00 00 1e 00 00 00 ff 00 56 43 4a
30 33 32 31 30 30 31 39 0a 20 00 00 00 fd 00 32
4c 1e 53 15 00 0a 20 20 20 20 20 20 00 00 00 fc
00 42 65 6e 51 20 47 57 32 32 37 30 0a 20 00 e8

----------------

Block 0, Base EDID:
  EDID Structure Version & Revision: 1.3
  Vendor & Product Identification:
    Manufacturer: BNQ
    Model: 30939
    Serial Number: ...
    Made in: week 52 of 2018
  Basic Display Parameters & Features:
    Analog display
    Signal Level Standard: 0.700 : 0.300 : 1.000 V p-p
    Blank level equals black level
    Sync: Separate Composite SyncOnGreen
    Maximum image size: 48 cm x 27 cm
    Gamma: 2.20
    DPMS levels: Off
    RGB color display
    Default (sRGB) color space is primary color space
    First detailed timing is the preferred timing
  Color Characteristics:
    Red  : 0.6513, 0.3349
    Green: 0.3203, 0.6250
    Blue : 0.1523, 0.0664
    White: 0.3125, 0.3271
  Established Timings I & II:
    IBM     :   720x400    70.081663 Hz   9:5     31.467 kHz     28.320000 MHz
    DMT 0x04:   640x480    59.940476 Hz   4:3     31.469 kHz     25.175000 MHz
    DMT 0x06:   640x480    75.000000 Hz   4:3     37.500 kHz     31.500000 MHz
    DMT 0x09:   800x600    60.316541 Hz   4:3     37.879 kHz     40.000000 MHz
    DMT 0x0b:   800x600    75.000000 Hz   4:3     46.875 kHz     49.500000 MHz
    Apple   :   832x624    74.551266 Hz   4:3     49.726 kHz     57.284000 MHz
    DMT 0x10:  1024x768    60.003840 Hz   4:3     48.363 kHz     65.000000 MHz
    DMT 0x12:  1024x768    75.028582 Hz   4:3     60.023 kHz     78.750000 MHz
    DMT 0x24:  1280x1024   75.024675 Hz   5:4     79.976 kHz    135.000000 MHz
    Apple   :  1152x870    75.061550 Hz 192:145   68.681 kHz    100.000000 MHz
  Standard Timings:
    DMT 0x52:  1920x1080   60.000000 Hz  16:9     67.500 kHz    148.500000 MHz
    DMT 0x55:  1280x720    60.000000 Hz  16:9     45.000 kHz     74.250000 MHz
    DMT 0x1c:  1280x800    59.810326 Hz  16:10    49.702 kHz     83.500000 MHz
    DMT 0x23:  1280x1024   60.019740 Hz   5:4     63.981 kHz    108.000000 MHz
    DMT 0x53:  1600x900    60.000000 Hz  16:9     60.000 kHz    108.000000 MHz (RB)
    DMT 0x3a:  1680x1050   59.954250 Hz  16:10    65.290 kHz    146.250000 MHz
  Detailed Timing Descriptors:
    DTD 1:  1920x1080   60.000000 Hz  16:9     67.500 kHz    148.500000 MHz (476 mm x 268 mm)
                 Hfront   88 Hsync  44 Hback  148 Hpol P
                 Vfront    4 Vsync   5 Vback   36 Vpol P
    Display Product Serial Number: ...
    Display Range Limits:
      Monitor ranges (GTF): 50-76 Hz V, 30-83 kHz H, max dotclock 210 MHz
    Display Product Name: 'BenQ GW2270'
Checksum: 0xe8

----------------

Block 1, Unknown EDID Extension Block 0x00:
  00 ff ff ff ff ff ff 00 09 d1 db 78 45 54 00 00 '...........xET..'
  34 1c 01 03 0e 30 1b 78 2e f0 03 a6 55 52 a0 27 '4....0.x....UR.''
  11 50 53 a5 6b 80 d1 c0 81 c0 81 00 81 80 a9 c0 '.PS.k...........'
  b3 00 01 01 01 01 02 3a 80 18 71 38 2d 40 58 2c '.......:..q8-@X,'
  45 00 dc 0c 11 00 00 1e 00 00 00 ff 00 56 43 4a 'E............VCJ'
  30 33 32 31 30 30 31 39 0a 20 00 00 00 fd 00 32 '03210019. .....2'
  4c 1e 53 15 00 0a 20 20 20 20 20 20 00 00 00 fc 'L.S...      ....'
  00 42 65 6e 51 20 47 57 32 32 37 30 0a 20 00 e8 '.BenQ GW2270. ..'
Checksum: 0xe8

----------------

Failures:

Block 0, Base EDID:
  Basic Display Parameters & Features: sRGB is signaled, but the chromaticities do not match.
Block 1, Base EDID:
  Unknown Extension Block.
EDID:
  Base EDID: EDID specified 0 extension block(s), but found 1 extension block(s).

EDID conformity: FAIL
