
EDID (hex):
00ffffffffffff000e1145147609845c
070d0103682018632ac611a154499e25
0d474aa4420031594559615981800101
010101010101ea240060410028303060
130038ea1000001e000000fd00328c1e
460b000a202020202020000000fc0043
4f4d50415120373530300a200000000d
00020080070ffc4c1da3ff4d03e10005

edid-decode (hex):

00 ff ff ff ff ff ff 00 0e 11 45 14 76 09 84 5c
07 0d 01 03 68 20 18 63 2a c6 11 a1 54 49 9e 25
0d 47 4a a4 42 00 31 59 45 59 61 59 81 80 01 01
01 01 01 01 01 01 ea 24 00 60 41 00 28 30 30 60
13 00 38 ea 10 00 00 1e 00 00 00 fd 00 32 8c 1e
46 0b 00 0a 20 20 20 20 20 20 00 00 00 fc 00 43
4f 4d 50 41 51 20 37 35 30 30 0a 20 00 00 00 0d
00 02 00 80 07 0f fc 4c 1d a3 ff 4d 03 e1 00 05

----------------

Block 0, Base EDID:
  EDID Structure Version & Revision: 1.3
  Vendor & Product Identification:
    Manufacturer: CPQ
    Model: 5189
    Serial Number: 1552157046
    Made in: week 7 of 2003
  Basic Display Parameters & Features:
    Analog display
    Signal Level Standard: 0.700 : 0.000 : 0.700 V p-p
    Blank level equals black level
    Sync: Separate
    Maximum image size: 32 cm x 24 cm
    Gamma: 1.99
    DPMS levels: Off
    RGB color display
    First detailed timing is the preferred timing
  Color Characteristics:
    Red  : 0.6318, 0.3281
    Green: 0.2861, 0.6191
    Blue : 0.1445, 0.0517
    White: 0.2773, 0.2900
  Established Timings I & II:
    IBM     :   720x400    70.081663 Hz   9:5     31.467 kHz     28.320000 MHz
    DMT 0x04:   640x480    59.940476 Hz   4:3     31.469 kHz     25.175000 MHz
    DMT 0x06:   640x480    75.000000 Hz   4:3     37.500 kHz     31.500000 MHz
    DMT 0x0b:   800x600    75.000000 Hz   4:3     46.875 kHz     49.500000 MHz
    DMT 0x12:  1024x768    75.028582 Hz   4:3     60.023 kHz     78.750000 MHz
  Standard Timings:
    DMT 0x07:   640x480    85.008312 Hz   4:3     43.269 kHz     36.000000 MHz
    DMT 0x0c:   800x600    85.061274 Hz   4:3     53.674 kHz     56.250000 MHz
    DMT 0x13:  1024x768    84.996690 Hz   4:3     68.677 kHz     94.500000 MHz
    DMT 0x23:  1280x1024   60.019740 Hz   5:4     63.981 kHz    108.000000 MHz
  Detailed Timing Descriptors:
    DTD 1:  1024x768    84.996690 Hz   4:3     68.677 kHz     94.500000 MHz (312 mm x 234 mm)
                 Hfront   48 Hsync  96 Hback  208 Hpol P
                 Vfront    1 Vsync   3 Vback   36 Vpol P
    Display Range Limits:
      Monitor ranges (GTF): 50-140 Hz V, 30-70 kHz H, max dotclock 110 MHz
    Display Product Name: 'COMPAQ 7500'
    Manufacturer-Specified Display Descriptor (0x0d): 00 0d 00 02 00 80 07 0f fc 4c 1d a3 ff 4d 03 e1 '.........L...M..'
Checksum: 0x05
