edid-decode (hex):

00 ff ff ff ff ff ff 00 40 6b 01 22 01 01 01 01
1b 11 01 03 80 2f 1e 78 2a ee 95 a3 54 4c 99 26
0f 50 54 bf ef 00 81 80 71 4f 81 c0 81 40 01 01
01 01 01 01 01 01 21 39 90 fa 61 1a 27 40 68 b0
36 00 b8 0e 11 00 00 1e 21 39 90 30 62 1a 27 40
68 b0 36 00 da 28 11 00 00 00 00 00 00 fc 00 50
42 4d 5f 56 32 32 30 57 0a 20 20 20 00 00 00 ff
00 59 45 4e 56 30 30 30 30 30 31 0a 20 20 00 ec

----------------

Block 0, Base EDID:
  EDID Structure Version & Revision: 1.3
  Vendor & Product Identification:
    Manufacturer: PCK
    Model: 8705
    Serial Number: ...
    Made in: week 27 of 2007
  Basic Display Parameters & Features:
    Digital display
    Maximum image size: 47 cm x 30 cm
    Gamma: 2.20
    DPMS levels: Off
    RGB color display
    First detailed timing is the preferred timing
  Color Characteristics:
    Red  : 0.6396, 0.3300
    Green: 0.2998, 0.5996
    Blue : 0.1503, 0.0595
    White: 0.3134, 0.3291
  Established Timings I & II:
    IBM     :   720x400    70.081663 Hz   9:5     31.467 kHz     28.320000 MHz
    DMT 0x04:   640x480    59.940476 Hz   4:3     31.469 kHz     25.175000 MHz
    Apple   :   640x480    66.666667 Hz   4:3     35.000 kHz     30.240000 MHz
    DMT 0x05:   640x480    72.808802 Hz   4:3     37.861 kHz     31.500000 MHz
    DMT 0x06:   640x480    75.000000 Hz   4:3     37.500 kHz     31.500000 MHz
    DMT 0x08:   800x600    56.250000 Hz   4:3     35.156 kHz     36.000000 MHz
    DMT 0x09:   800x600    60.316541 Hz   4:3     37.879 kHz     40.000000 MHz
    DMT 0x0a:   800x600    72.187572 Hz   4:3     48.077 kHz     50.000000 MHz
    DMT 0x0b:   800x600    75.000000 Hz   4:3     46.875 kHz     49.500000 MHz
    Apple   :   832x624    74.551266 Hz   4:3     49.726 kHz     57.284000 MHz
    DMT 0x10:  1024x768    60.003840 Hz   4:3     48.363 kHz     65.000000 MHz
    DMT 0x11:  1024x768    70.069359 Hz   4:3     56.476 kHz     75.000000 MHz
    DMT 0x12:  1024x768    75.028582 Hz   4:3     60.023 kHz     78.750000 MHz
    DMT 0x24:  1280x1024   75.024675 Hz   5:4     79.976 kHz    135.000000 MHz
  Standard Timings:
    DMT 0x23:  1280x1024   60.019740 Hz   5:4     63.981 kHz    108.000000 MHz
    DMT 0x15:  1152x864    75.000000 Hz   4:3     67.500 kHz    108.000000 MHz
    DMT 0x55:  1280x720    60.000000 Hz  16:9     45.000 kHz     74.250000 MHz
    DMT 0x20:  1280x960    60.000000 Hz   4:3     60.000 kHz    108.000000 MHz
  Detailed Timing Descriptors:
    DTD 1:  1680x1050   61.435279 Hz  16:10    66.903 kHz    146.250000 MHz (440 mm x 270 mm)
                 Hfront  104 Hsync 176 Hback  226 Hpol P
                 Vfront    3 Vsync   6 Vback   30 Vpol P
    DTD 2:  1680x1050   59.954250 Hz  16:10    65.290 kHz    146.250000 MHz (analog composite, sync-on-green, 474 mm x 296 mm)
                 Hfront  104 Hsync 176 Hback  280 Hpol N
                 Vfront    3 Vsync   6 Vback   30 Vpol N
    Display Product Name: 'PBM_V220W'
    Display Product Serial Number: ...
Checksum: 0xec

----------------

Warnings:

Block 0, Base EDID:
  Detailed Timing Descriptor #2: DTD is similar but not identical to DMT 0x3a.

Failures:

Block 0, Base EDID:
  Detailed Timing Descriptor #1: Mismatch of image size 440x270 mm vs display size 470x300 mm.
  Missing Display Range Limits Descriptor.

EDID conformity: FAIL
