edid-decode (hex):

00 ff ff ff ff ff ff 00 06 b3 cc 22 01 01 01 01
27 1c 01 03 80 30 1b 78 ea 5a 65 a7 56 52 9c 27
0f 50 54 af cf 80 71 4f 81 80 81 8f b3 00 81 40
95 00 a9 40 8b c0 02 3a 80 18 71 38 2d 40 58 2c
45 00 dc 0c 11 00 00 1e 00 00 00 fd 00 30 4c 1e
55 11 00 0a 20 20 20 20 20 20 00 00 00 fc 00 56
5a 32 32 39 0a 20 20 20 20 20 20 20 00 00 00 ff
00 4a 39 4c 4d 52 53 30 34 38 35 38 34 0a 01 8b

02 03 1d f1 4a 90 04 03 01 14 12 05 1f 10 13 23
09 07 07 83 01 00 00 65 03 0c 00 10 00 02 3a 80
18 71 38 2d 40 58 2c 45 00 dc 0c 11 00 00 1e 01
1d 80 18 71 1c 16 20 58 2c 25 00 dc 0c 11 00 00
9e 01 1d 00 72 51 d0 1e 20 6e 28 55 00 dc 0c 11
00 00 1e 8c 0a d0 8a 20 e0 2d 10 10 3e 96 00 dc
0c 11 00 00 18 00 00 00 00 00 00 00 00 00 00 00
00 00 00 00 00 00 00 00 00 00 00 00 00 00 00 c6

00 ff ff ff ff ff ff 00 59 96 a8 91 27 1e 66 3b
ff 1c 01 03 80 00 00 78 0a 48 97 a1 5b 54 a0 26
13 4a 50 00 00 00 01 01 01 01 01 01 01 01 01 01
01 01 01 01 01 01 00 00 00 10 00 00 00 00 00 00
00 00 00 00 00 00 00 00 00 00 00 fc 00 49 6e 64
65 78 20 48 4d 44 0a 20 20 20 00 00 00 10 00 00
00 00 00 00 00 00 00 00 00 00 00 00 00 00 00 10
00 00 00 00 00 00 00 00 00 00 00 00 00 00 01 9d

70 12 5a 00 00 03 01 50 f7 0b 01 80 3f 0b 4f 00
07 00 1f 00 3f 06 ce 03 c4 03 05 00 f7 0b 01 00
3f 0b 4f 00 07 00 1f 00 3f 06 10 05 06 05 05 00
f7 0b 01 00 3f 0b 4f 00 07 00 1f 00 3f 06 4a 01
40 01 05 00 65 0c 01 00 3f 0b 4f 00 07 00 1f 00
3f 06 0b 00 02 00 05 00 81 03 04 23 09 04 01 17
00 00 00 00 00 00 00 00 00 00 00 00 00 00 00 00
00 00 00 00 00 00 00 00 00 00 00 00 00 00 00 90

00 ff ff ff ff ff ff 00 06 b3 cc 22 01 01 01 01
27 1c 01 03 80 30 1b 78 ea 5a 65 a7 56 52 9c 27
0f 50 54 af cf 80 71 4f 81 80 81 8f b3 00 81 40
95 00 a9 40 8b c0 02 3a 80 18 71 38 2d 40 58 2c
45 00 dc 0c 11 00 00 1e 00 00 00 fd 00 30 4c 1e
55 11 00 0a 20 20 20 20 20 20 00 00 00 fc 00 56
5a 32 32 39 0a 20 20 20 20 20 20 20 00 00 00 ff
00 4a 39 4c 4d 52 53 30 34 38 35 38 34 0a 01 8b

02 03 1d f1 4a 90 04 03 01 14 12 05 1f 10 13 23
09 07 07 83 01 00 00 65 03 0c 00 10 00 02 3a 80
18 71 38 2d 40 58 2c 45 00 dc 0c 11 00 00 1e 01
1d 80 18 71 1c 16 20 58 2c 25 00 dc 0c 11 00 00
9e 01 1d 00 72 51 d0 1e 20 6e 28 55 00 dc 0c 11
00 00 1e 8c 0a d0 8a 20 e0 2d 10 10 3e 96 00 dc
0c 11 00 00 18 00 00 00 00 00 00 00 00 00 00 00
00 00 00 00 00 00 00 00 00 00 00 00 00 00 00 c6

00 ff ff ff ff ff ff 00 59 96 a8 91 27 1e 66 3b
ff 1c 01 03 80 00 00 78 0a 48 97 a1 5b 54 a0 26
13 4a 50 00 00 00 01 01 01 01 01 01 01 01 01 01
01 01 01 01 01 01 00 00 00 10 00 00 00 00 00 00
00 00 00 00 00 00 00 00 00 00 00 fc 00 49 6e 64
65 78 20 48 4d 44 0a 20 20 20 00 00 00 10 00 00
00 00 00 00 00 00 00 00 00 00 00 00 00 00 00 10
00 00 00 00 00 00 00 00 00 00 00 00 00 00 01 9d

70 12 5a 00 00 03 01 50 f7 0b 01 80 3f 0b 4f 00
07 00 1f 00 3f 06 ce 03 c4 03 05 00 f7 0b 01 00
3f 0b 4f 00 07 00 1f 00 3f 06 10 05 06 05 05 00
f7 0b 01 00 3f 0b 4f 00 07 00 1f 00 3f 06 4a 01
40 01 05 00 65 0c 01 00 3f 0b 4f 00 07 00 1f 00
3f 06 0b 00 02 00 05 00 81 03 04 23 09 04 01 17
00 00 00 00 00 00 00 00 00 00 00 00 00 00 00 00
00 00 00 00 00 00 00 00 00 00 00 00 00 00 00 90

----------------

Block 0, Base EDID:
  EDID Structure Version & Revision: 1.3
  Vendor & Product Identification:
    Manufacturer: AUS
    Model: 8908
    Serial Number: ...
    Made in: week 39 of 2018
  Basic Display Parameters & Features:
    Digital display
    Maximum image size: 48 cm x 27 cm
    Gamma: 2.20
    DPMS levels: Standby Suspend Off
    RGB color display
    First detailed timing is the preferred timing
  Color Characteristics:
    Red  : 0.6533, 0.3369
    Green: 0.3222, 0.6113
    Blue : 0.1533, 0.0605
    White: 0.3134, 0.3291
  Established Timings I & II:
    IBM     :   720x400    70.081663 Hz   9:5     31.467 kHz     28.320000 MHz
    DMT 0x04:   640x480    59.940476 Hz   4:3     31.469 kHz     25.175000 MHz
    DMT 0x05:   640x480    72.808802 Hz   4:3     37.861 kHz     31.500000 MHz
    DMT 0x06:   640x480    75.000000 Hz   4:3     37.500 kHz     31.500000 MHz
    DMT 0x08:   800x600    56.250000 Hz   4:3     35.156 kHz     36.000000 MHz
    DMT 0x09:   800x600    60.316541 Hz   4:3     37.879 kHz     40.000000 MHz
    DMT 0x0a:   800x600    72.187572 Hz   4:3     48.077 kHz     50.000000 MHz
    DMT 0x0b:   800x600    75.000000 Hz   4:3     46.875 kHz     49.500000 MHz
    DMT 0x10:  1024x768    60.003840 Hz   4:3     48.363 kHz     65.000000 MHz
    DMT 0x11:  1024x768    70.069359 Hz   4:3     56.476 kHz     75.000000 MHz
    DMT 0x12:  1024x768    75.028582 Hz   4:3     60.023 kHz     78.750000 MHz
    DMT 0x24:  1280x1024   75.024675 Hz   5:4     79.976 kHz    135.000000 MHz
    Apple   :  1152x870    75.061550 Hz 192:145   68.681 kHz    100.000000 MHz
  Standard Timings:
    DMT 0x15:  1152x864    75.000000 Hz   4:3     67.500 kHz    108.000000 MHz
    DMT 0x23:  1280x1024   60.019740 Hz   5:4     63.981 kHz    108.000000 MHz
    DMT 0x24:  1280x1024   75.024675 Hz   5:4     79.976 kHz    135.000000 MHz
    DMT 0x3a:  1680x1050   59.954250 Hz  16:10    65.290 kHz    146.250000 MHz
    DMT 0x20:  1280x960    60.000000 Hz   4:3     60.000 kHz    108.000000 MHz
    DMT 0x2f:  1440x900    59.887445 Hz  16:10    55.935 kHz    106.500000 MHz
    DMT 0x33:  1600x1200   60.000000 Hz   4:3     75.000 kHz    162.000000 MHz
    GTF     :  1360x765    60.000341 Hz  16:9     47.520 kHz     84.396000 MHz
  Detailed Timing Descriptors:
    DTD 1:  1920x1080   60.000000 Hz  16:9     67.500 kHz    148.500000 MHz (476 mm x 268 mm)
                 Hfront   88 Hsync  44 Hback  148 Hpol P
                 Vfront    4 Vsync   5 Vback   36 Vpol P
    Display Range Limits:
      Monitor ranges (GTF): 48-76 Hz V, 30-85 kHz H, max dotclock 170 MHz
    Display Product Name: 'VZ229'
    Display Product Serial Number: ...
  Extension blocks: 1
Checksum: 0x8b

----------------

Block 1, CTA-861 Extension Block:
  Revision: 3
  Underscans IT Video Formats by default
  Basic audio support
  Supports YCbCr 4:4:4
  Supports YCbCr 4:2:2
  Native detailed modes: 1
  Video Data Block:
    VIC  16:  1920x1080   60.000000 Hz  16:9     67.500 kHz    148.500000 MHz (native)
    VIC   4:  1280x720    60.000000 Hz  16:9     45.000 kHz     74.250000 MHz
    VIC   3:   720x480    59.940060 Hz  16:9     31.469 kHz     27.000000 MHz
    VIC   1:   640x480    59.940476 Hz   4:3     31.469 kHz     25.175000 MHz
    VIC  20:  1920x1080i  50.000000 Hz  16:9     28.125 kHz     74.250000 MHz
    VIC  18:   720x576    50.000000 Hz  16:9     31.250 kHz     27.000000 MHz
    VIC   5:  1920x1080i  60.000000 Hz  16:9     33.750 kHz     74.250000 MHz
    VIC  31:  1920x1080   50.000000 Hz  16:9     56.250 kHz    148.500000 MHz
    VIC  16:  1920x1080   60.000000 Hz  16:9     67.500 kHz    148.500000 MHz
    VIC  19:  1280x720    50.000000 Hz  16:9     37.500 kHz     74.250000 MHz
  Audio Data Block:
    Linear PCM:
      Max channels: 2
      Supported sample rates (kHz): 48 44.1 32
      Supported sample sizes (bits): 24 20 16
  Speaker Allocation Data Block:
    FL/FR - Front Left/Right
  Vendor-Specific Data Block (HDMI), OUI 00-0C-03:
    Source physical address: 1.0.0.0
  Detailed Timing Descriptors:
    DTD 2:  1920x1080   60.000000 Hz  16:9     67.500 kHz    148.500000 MHz (476 mm x 268 mm)
                 Hfront   88 Hsync  44 Hback  148 Hpol P
                 Vfront    4 Vsync   5 Vback   36 Vpol P
    DTD 3:  1920x1080i  60.000000 Hz  16:9     33.750 kHz     74.250000 MHz (476 mm x 268 mm)
                 Hfront   88 Hsync  44 Hback  148 Hpol P
                 Vfront    2 Vsync   5 Vback   15 Vpol P Vfront +0.5 Odd Field
                 Vfront    2 Vsync   5 Vback   15 Vpol P Vback  +0.5 Even Field
    DTD 4:  1280x720    60.000000 Hz  16:9     45.000 kHz     74.250000 MHz (476 mm x 268 mm)
                 Hfront  110 Hsync  40 Hback  220 Hpol P
                 Vfront    5 Vsync   5 Vback   20 Vpol P
    DTD 5:   720x480    59.940060 Hz   3:2     31.469 kHz     27.000000 MHz (476 mm x 268 mm)
                 Hfront   16 Hsync  62 Hback   60 Hpol N
                 Vfront    9 Vsync   6 Vback   30 Vpol N
Checksum: 0xc6  Unused space in Extension Block: 26 bytes

----------------

Block 2, Unknown EDID Extension Block 0x00:
  00 ff ff ff ff ff ff 00 59 96 a8 91 27 1e 66 3b '........Y...'.f;'
  ff 1c 01 03 80 00 00 78 0a 48 97 a1 5b 54 a0 26 '.......x.H..[T.&'
  13 4a 50 00 00 00 01 01 01 01 01 01 01 01 01 01 '.JP.............'
  01 01 01 01 01 01 00 00 00 10 00 00 00 00 00 00 '................'
  00 00 00 00 00 00 00 00 00 00 00 fc 00 49 6e 64 '.............Ind'
  65 78 20 48 4d 44 0a 20 20 20 00 00 00 10 00 00 'ex HMD.   ......'
  00 00 00 00 00 00 00 00 00 00 00 00 00 00 00 10 '................'
  00 00 00 00 00 00 00 00 00 00 00 00 00 00 01 9d '................'
Checksum: 0x9d

----------------

Block 3, DisplayID Extension Block:
  Version: 1.2
  Extension Count: 0
  Display Product Type: Extension Section
  Video Timing Modes Type 1 - Detailed Timings Data Block:
    DTD:  2880x1600   90.002624 Hz   1:1    231.757 kHz    686.000000 MHz (aspect 1:1, no 3D stereo, preferred)
               Hfront    8 Hsync  32 Hback   40 Hpol N
               Vfront  965 Vsync   6 Vback    4 Vpol N
    DTD:  2880x1600   79.998880 Hz   1:1    231.757 kHz    686.000000 MHz (aspect 1:1, no 3D stereo)
               Hfront    8 Hsync  32 Hback   40 Hpol N
               Vfront 1287 Vsync   6 Vback    4 Vpol N
    DTD:  2880x1600  120.019035 Hz   1:1    231.757 kHz    686.000000 MHz (aspect 1:1, no 3D stereo)
               Hfront    8 Hsync  32 Hback   40 Hpol N
               Vfront  321 Vsync   6 Vback    4 Vpol N
    DTD:  2880x1600  144.000235 Hz   1:1    232.128 kHz    687.100000 MHz (aspect 1:1, no 3D stereo)
               Hfront    8 Hsync  32 Hback   40 Hpol N
               Vfront    3 Vsync   6 Vback    3 Vpol N
  CTA-861 DisplayID Data Block:
  Audio Data Block:
    Linear PCM:
      Max channels: 2
      Supported sample rates (kHz): 48
      Supported sample sizes (bits): 16
  Checksum: 0x17
Checksum: 0x90  Unused space in Extension Block: 31 bytes

----------------

Block 4, Unknown EDID Extension Block 0x00:
  00 ff ff ff ff ff ff 00 06 b3 cc 22 01 01 01 01 '..........."....'
  27 1c 01 03 80 30 1b 78 ea 5a 65 a7 56 52 9c 27 ''....0.x.Ze.VR.''
  0f 50 54 af cf 80 71 4f 81 80 81 8f b3 00 81 40 '.PT...qO.......@'
  95 00 a9 40 8b c0 02 3a 80 18 71 38 2d 40 58 2c '...@...:..q8-@X,'
  45 00 dc 0c 11 00 00 1e 00 00 00 fd 00 30 4c 1e 'E............0L.'
  55 11 00 0a 20 20 20 20 20 20 00 00 00 fc 00 56 'U...      .....V'
  5a 32 32 39 0a 20 20 20 20 20 20 20 00 00 00 ff 'Z229.       ....'
  00 4a 39 4c 4d 52 53 30 34 38 35 38 34 0a 01 8b '.J9LMRS048584...'
Checksum: 0x8b

----------------

Block 5, CTA-861 Extension Block:
  Revision: 3
  Underscans IT Video Formats by default
  Basic audio support
  Supports YCbCr 4:4:4
  Supports YCbCr 4:2:2
  Native detailed modes: 1
  Video Data Block:
    VIC  16:  1920x1080   60.000000 Hz  16:9     67.500 kHz    148.500000 MHz (native)
    VIC   4:  1280x720    60.000000 Hz  16:9     45.000 kHz     74.250000 MHz
    VIC   3:   720x480    59.940060 Hz  16:9     31.469 kHz     27.000000 MHz
    VIC   1:   640x480    59.940476 Hz   4:3     31.469 kHz     25.175000 MHz
    VIC  20:  1920x1080i  50.000000 Hz  16:9     28.125 kHz     74.250000 MHz
    VIC  18:   720x576    50.000000 Hz  16:9     31.250 kHz     27.000000 MHz
    VIC   5:  1920x1080i  60.000000 Hz  16:9     33.750 kHz     74.250000 MHz
    VIC  31:  1920x1080   50.000000 Hz  16:9     56.250 kHz    148.500000 MHz
    VIC  16:  1920x1080   60.000000 Hz  16:9     67.500 kHz    148.500000 MHz
    VIC  19:  1280x720    50.000000 Hz  16:9     37.500 kHz     74.250000 MHz
  Audio Data Block:
    Linear PCM:
      Max channels: 2
      Supported sample rates (kHz): 48 44.1 32
      Supported sample sizes (bits): 24 20 16
  Speaker Allocation Data Block:
    FL/FR - Front Left/Right
  Vendor-Specific Data Block (HDMI), OUI 00-0C-03:
    Source physical address: 1.0.0.0
  Detailed Timing Descriptors:
    DTD 6:  1920x1080   60.000000 Hz  16:9     67.500 kHz    148.500000 MHz (476 mm x 268 mm)
                 Hfront   88 Hsync  44 Hback  148 Hpol P
                 Vfront    4 Vsync   5 Vback   36 Vpol P
    DTD 7:  1920x1080i  60.000000 Hz  16:9     33.750 kHz     74.250000 MHz (476 mm x 268 mm)
                 Hfront   88 Hsync  44 Hback  148 Hpol P
                 Vfront    2 Vsync   5 Vback   15 Vpol P Vfront +0.5 Odd Field
                 Vfront    2 Vsync   5 Vback   15 Vpol P Vback  +0.5 Even Field
    DTD 8:  1280x720    60.000000 Hz  16:9     45.000 kHz     74.250000 MHz (476 mm x 268 mm)
                 Hfront  110 Hsync  40 Hback  220 Hpol P
                 Vfront    5 Vsync   5 Vback   20 Vpol P
    DTD 9:   720x480    59.940060 Hz   3:2     31.469 kHz     27.000000 MHz (476 mm x 268 mm)
                 Hfront   16 Hsync  62 Hback   60 Hpol N
                 Vfront    9 Vsync   6 Vback   30 Vpol N
Checksum: 0xc6  Unused space in Extension Block: 26 bytes

----------------

Block 6, Unknown EDID Extension Block 0x00:
  00 ff ff ff ff ff ff 00 59 96 a8 91 27 1e 66 3b '........Y...'.f;'
  ff 1c 01 03 80 00 00 78 0a 48 97 a1 5b 54 a0 26 '.......x.H..[T.&'
  13 4a 50 00 00 00 01 01 01 01 01 01 01 01 01 01 '.JP.............'
  01 01 01 01 01 01 00 00 00 10 00 00 00 00 00 00 '................'
  00 00 00 00 00 00 00 00 00 00 00 fc 00 49 6e 64 '.............Ind'
  65 78 20 48 4d 44 0a 20 20 20 00 00 00 10 00 00 'ex HMD.   ......'
  00 00 00 00 00 00 00 00 00 00 00 00 00 00 00 10 '................'
  00 00 00 00 00 00 00 00 00 00 00 00 00 00 01 9d '................'
Checksum: 0x9d

----------------

Block 7, DisplayID Extension Block:
  Version: 1.2
  Extension Count: 0
  Video Timing Modes Type 1 - Detailed Timings Data Block:
    DTD:  2880x1600   90.002624 Hz   1:1    231.757 kHz    686.000000 MHz (aspect 1:1, no 3D stereo, preferred)
               Hfront    8 Hsync  32 Hback   40 Hpol N
               Vfront  965 Vsync   6 Vback    4 Vpol N
    DTD:  2880x1600   79.998880 Hz   1:1    231.757 kHz    686.000000 MHz (aspect 1:1, no 3D stereo)
               Hfront    8 Hsync  32 Hback   40 Hpol N
               Vfront 1287 Vsync   6 Vback    4 Vpol N
    DTD:  2880x1600  120.019035 Hz   1:1    231.757 kHz    686.000000 MHz (aspect 1:1, no 3D stereo)
               Hfront    8 Hsync  32 Hback   40 Hpol N
               Vfront  321 Vsync   6 Vback    4 Vpol N
    DTD:  2880x1600  144.000235 Hz   1:1    232.128 kHz    687.100000 MHz (aspect 1:1, no 3D stereo)
               Hfront    8 Hsync  32 Hback   40 Hpol N
               Vfront    3 Vsync   6 Vback    3 Vpol N
  CTA-861 DisplayID Data Block:
  Audio Data Block:
    Linear PCM:
      Max channels: 2
      Supported sample rates (kHz): 48
      Supported sample sizes (bits): 16
  Checksum: 0x17
Checksum: 0x90  Unused space in Extension Block: 31 bytes

----------------

Warnings:

Block 0, Base EDID:
  Standard Timings: Standard Timing 1360x765 has a dubious odd vertical resolution.
Block 1, CTA-861 Extension Block:
  Display Product Serial Number is set, so the Serial Number in the Base EDID should be 0.
  Add a Colorimetry Data Block with the sRGB colorimetry bit set to avoid interop issues.
Block 3, DisplayID Extension Block:
  CTA-861 DisplayID Data Block: Unexpected revision (3 != 0).
Block 5, CTA-861 Extension Block:
  Display Product Serial Number is set, so the Serial Number in the Base EDID should be 0.
  Add a Colorimetry Data Block with the sRGB colorimetry bit set to avoid interop issues.
Block 7, DisplayID Extension Block:
  CTA-861 DisplayID Data Block: Unexpected revision (3 != 0).
EDID:
  CTA-861: Multiple native progressive timings are defined.

Failures:

Block 1, CTA-861 Extension Block:
  Video Data Block: Duplicate VIC 16.
  Missing VCDB, needed for Set Selectable RGB Quantization to avoid interop issues.
Block 2, Base EDID:
  Unknown Extension Block.
Block 3, DisplayID Extension Block:
  DisplayID Base Block has no product type.
  Expected 0 DisplayID Extension Block, but got 1.
Block 4, Base EDID:
  Unknown Extension Block.
Block 5, CTA-861 Extension Block:
  Video Data Block: Duplicate VIC 4.
  Video Data Block: Duplicate VIC 3.
  Video Data Block: Duplicate VIC 1.
  Video Data Block: Duplicate VIC 20.
  Video Data Block: Duplicate VIC 18.
  Video Data Block: Duplicate VIC 5.
  Video Data Block: Duplicate VIC 31.
  Video Data Block: Duplicate VIC 19.
  Speaker Allocation Data Block: Only one instance of this Data Block is allowed.
  Missing VCDB, needed for Set Selectable RGB Quantization to avoid interop issues.
Block 6, Base EDID:
  Unknown Extension Block.
EDID:
  Base EDID: Some timings are out of range of the Monitor Ranges:
    Vertical Freq: 50.000 - 144.000 Hz (Monitor: 48.000 - 76.000 Hz)
    Horizontal Freq: 28.125 - 232.128 kHz (Monitor: 30.000 - 85.000 kHz)
    Maximum Clock: 687.100 MHz (Monitor: 170.000 MHz)
  Base EDID: EDID specified 1 extension block(s), but found 7 extension block(s).
  Base EDID: EDID 1.3 requires a Block Map Extension in Block 1 if there are more than 2 blocks in the EDID.
  DisplayID: Missing DisplayID Product Identification Data Block.

EDID conformity: FAIL
