
EDID (hex):
00ffffffffffff00410c080884400000
2f0c01030f241daaea4dcca157479c23
174c52bfef80314f454f614f81800101
010101010101302a009851002a403070
1300671f1100001e000000ff00204844
20203031363531360a20000000fc0050
68696c697073203138305032000000fd
00384c1e520e000a20202020202000c5

Extracted contents:
header:          00 ff ff ff ff ff ff 00
serial number:   41 0c 08 08 84 40 00 00 2f 0c
version:         01 03
basic params:    0f 24 1d aa ea
chroma info:     4d cc a1 57 47 9c 23 17 4c 52
established:     bf ef 80
standard:        31 4f 45 4f 61 4f 81 80 01 01 01 01 01 01 01 01
descriptor 1:    30 2a 00 98 51 00 2a 40 30 70 13 00 67 1f 11 00 00 1e
descriptor 2:    00 00 00 ff 00 20 48 44 20 20 30 31 36 35 31 36 0a 20
descriptor 3:    00 00 00 fc 00 50 68 69 6c 69 70 73 20 31 38 30 50 32
descriptor 4:    00 00 00 fd 00 38 4c 1e 52 0e 00 0a 20 20 20 20 20 20
extensions:      00
checksum:        c5

EDID version: 1.3
Manufacturer: PHL Model 808 Serial Number --
Analog display, Input voltage level: 0.7/0.3 V
Sync: Separate Composite SyncOnGreen Serration 
Maximum image size: 36 cm x 29 cm
Gamma: 2.70
DPMS levels: Standby Suspend Off
RGB color display
First detailed timing is preferred timing
Display x,y Chromaticity:
  Red:   0.6298, 0.3398
  Green: 0.2802, 0.6103
  Blue:  0.1396, 0.0898
  White: 0.2998, 0.3203
Established timings supported:
  720x400@70Hz 9:5 HorFreq: 31469 Hz Clock: 28.320 MHz
  640x480@60Hz 4:3 HorFreq: 31469 Hz Clock: 25.175 MHz
  640x480@67Hz 4:3 HorFreq: 35000 Hz Clock: 30.240 MHz
  640x480@72Hz 4:3 HorFreq: 37900 Hz Clock: 31.500 MHz
  640x480@75Hz 4:3 HorFreq: 37500 Hz Clock: 31.500 MHz
  800x600@56Hz 4:3 HorFreq: 35200 Hz Clock: 36.000 MHz
  800x600@60Hz 4:3 HorFreq: 37900 Hz Clock: 40.000 MHz
  800x600@72Hz 4:3 HorFreq: 48100 Hz Clock: 50.000 MHz
  800x600@75Hz 4:3 HorFreq: 46900 Hz Clock: 49.500 MHz
  832x624@75Hz 4:3 HorFreq: 49726 Hz Clock: 57.284 MHz
  1024x768@60Hz 4:3 HorFreq: 48400 Hz Clock: 65.000 MHz
  1024x768@70Hz 4:3 HorFreq: 56500 Hz Clock: 75.000 MHz
  1024x768@75Hz 4:3 HorFreq: 60000 Hz Clock: 78.750 MHz
  1280x1024@75Hz 5:4 HorFreq: 80000 Hz Clock: 135.000 MHz
  1152x870@75Hz 192:145 HorFreq: 67500 Hz Clock: 108.000 MHz
Standard timings supported:
  640x480@75Hz 4:3 HorFreq: 37500 Hz Clock: 31.500 MHz
  800x600@75Hz 4:3 HorFreq: 46900 Hz Clock: 49.500 MHz
  1024x768@75Hz 4:3 HorFreq: 60000 Hz Clock: 78.750 MHz
  1280x1024@60Hz 5:4 HorFreq: 64000 Hz Clock: 108.000 MHz
Detailed mode: Clock 108.000 MHz, 359 mm x 287 mm
               1280 1328 1440 1688 hborder 0
               1024 1025 1028 1066 vborder 0
               +hsync +vsync 
               VertFreq: 60 Hz, HorFreq: 63981 Hz
Serial number:  --  016516
Monitor ranges (GTF): 56-76Hz V, 30-82kHz H, max dotclock 140MHz
Checksum: 0xc5 (valid)
EDID block does NOT conform to EDID 1.3!
	Name descriptor not terminated with a newline
EDID block does not conform at all!
	Bad year of manufacture
