
EDID (hex):
00ffffffffffff000859320001000000
01150103812415780ade58a3544c9926
0f4547af4e0001010101010101010101
010101010101662150b051001b300070
2644c48e2100001ef12700a051002530
5080370080802100001c000000fc004e
532d3135453732304131320a000000fd
00304c0f440f000a20202020202001aa
02032073488504030201060710260907
071107508301000067030c001000b82d
011d007251d01e206e285500c48e2100
001e8c0ad08a20e02d10103e9600138e
21000018011d8018711c1620582c2500
c48e2100009e00000000000000000000
00000000000000000000000000000000
00000000000000000000000000000057

Extracted contents:
header:          00 ff ff ff ff ff ff 00
serial number:   08 59 32 00 01 00 00 00 01 15
version:         01 03
basic params:    81 24 15 78 0a
chroma info:     de 58 a3 54 4c 99 26 0f 45 47
established:     af 4e 00
standard:        01 01 01 01 01 01 01 01 01 01 01 01 01 01 01 01
descriptor 1:    66 21 50 b0 51 00 1b 30 00 70 26 44 c4 8e 21 00 00 1e
descriptor 2:    f1 27 00 a0 51 00 25 30 50 80 37 00 80 80 21 00 00 1c
descriptor 3:    00 00 00 fc 00 4e 53 2d 31 35 45 37 32 30 41 31 32 0a
descriptor 4:    00 00 00 fd 00 30 4c 0f 44 0f 00 0a 20 20 20 20 20 20
extensions:      01
checksum:        aa

EDID version: 1.3
Manufacturer: BBY Model 32 Serial Number --
Made in week 1 of 2011
Digital display
DFP 1.x compatible TMDS
Maximum image size: 36 cm x 21 cm
Gamma: 2.20
RGB color display
First detailed timing is preferred timing
Display x,y Chromaticity:
  Red:   0.6396, 0.3291
  Green: 0.2998, 0.5996
  Blue:  0.1494, 0.0595
  White: 0.2714, 0.2773
Established timings supported:
  720x400@70Hz 9:5 HorFreq: 31469 Hz Clock: 28.320 MHz
  640x480@60Hz 4:3 HorFreq: 31469 Hz Clock: 25.175 MHz
  640x480@72Hz 4:3 HorFreq: 37900 Hz Clock: 31.500 MHz
  640x480@75Hz 4:3 HorFreq: 37500 Hz Clock: 31.500 MHz
  800x600@56Hz 4:3 HorFreq: 35200 Hz Clock: 36.000 MHz
  800x600@60Hz 4:3 HorFreq: 37900 Hz Clock: 40.000 MHz
  800x600@75Hz 4:3 HorFreq: 46900 Hz Clock: 49.500 MHz
  1024x768@60Hz 4:3 HorFreq: 48400 Hz Clock: 65.000 MHz
  1024x768@70Hz 4:3 HorFreq: 56500 Hz Clock: 75.000 MHz
  1024x768@75Hz 4:3 HorFreq: 60000 Hz Clock: 78.750 MHz
Standard timings supported:
Detailed mode: Clock 85.500 MHz, 708 mm x 398 mm
               1360 1616 1728 1792 hborder 0
                768  786  792  795 vborder 0
               +hsync +vsync 
               VertFreq: 60 Hz, HorFreq: 47712 Hz
Detailed mode: Clock 102.250 MHz, 640 mm x 384 mm
               1280 1360 1488 1696 hborder 0
                768  771  778  805 vborder 0
               -hsync +vsync 
               VertFreq: 74 Hz, HorFreq: 60288 Hz
Monitor name: NS-15E720A12
Monitor ranges (GTF): 48-76Hz V, 15-68kHz H, max dotclock 150MHz
Has 1 extension blocks
Checksum: 0xaa (valid)

CTA extension block
Extension version: 3
28 bytes of CTA data
  Video data block
    VIC   5 1920x1080i@60Hz 16:9 (native) HorFreq: 33750 Hz Clock: 74.250 MHz
    VIC   4 1280x720@60Hz 16:9  HorFreq: 45000 Hz Clock: 74.250 MHz
    VIC   3 720x480@60Hz 16:9  HorFreq: 31469 Hz Clock: 27.000 MHz
    VIC   2 720x480@60Hz 4:3  HorFreq: 31469 Hz Clock: 27.000 MHz
    VIC   1 640x480@60Hz 4:3  HorFreq: 31469 Hz Clock: 25.175 MHz
    VIC   6 1440x480i@60Hz 4:3  HorFreq: 15734 Hz Clock: 27.000 MHz
    VIC   7 1440x480i@60Hz 16:9  HorFreq: 15734 Hz Clock: 27.000 MHz
    VIC  16 1920x1080@60Hz 16:9  HorFreq: 67500 Hz Clock: 148.500 MHz
  Audio data block
    Linear PCM, max channels 2
      Supported sample rates (kHz): 48 44.1 32
      Supported sample sizes (bits): 24 20 16
    AC-3, max channels 2
      Supported sample rates (kHz): 48 44.1 32
      Maximum bit rate: 640 kHz
  Speaker allocation data block
    Speaker map:
      FL/FR - Front Left/Right
  Vendor-specific data block, OUI 000c03 (HDMI)
    Source physical address 1.0.0.0
    Supports_AI
    DC_36bit
    DC_30bit
    DC_Y444
    Maximum TMDS clock: 225MHz
Basic audio support
Supports YCbCr 4:4:4
Supports YCbCr 4:2:2
3 native detailed modes
Detailed mode: Clock 74.250 MHz, 708 mm x 398 mm
               1280 1390 1430 1650 hborder 0
                720  725  730  750 vborder 0
               +hsync +vsync 
               VertFreq: 60 Hz, HorFreq: 45000 Hz
Detailed mode: Clock 27.000 MHz, 531 mm x 398 mm
                720  736  798  858 hborder 0
                480  489  495  525 vborder 0
               -hsync -vsync 
               VertFreq: 59 Hz, HorFreq: 31468 Hz
Detailed mode: Clock 74.250 MHz, 708 mm x 398 mm
               1920 2008 2052 2200 hborder 0
                540  542  547  562 vborder 0
               +hsync +vsync interlaced 
               VertFreq: 60 Hz, HorFreq: 33750 Hz
Checksum: 0x57 (valid)
