
EDID (hex):
00ffffffffffff000859320001000000
01160103802917780ad0dda953499d23
11474aa3080081c08100810f81408180
9500b3000101662150b051001b300070
2644e4101100001e462000a451002a30
5080370080802100001c000000fc004e
532d3139453332304131330a000000fd
00374c1e5011000a2020202020200118

Extracted contents:
header:          00 ff ff ff ff ff ff 00
serial number:   08 59 32 00 01 00 00 00 01 16
version:         01 03
basic params:    80 29 17 78 0a
chroma info:     d0 dd a9 53 49 9d 23 11 47 4a
established:     a3 08 00
standard:        81 c0 81 00 81 0f 81 40 81 80 95 00 b3 00 01 01
descriptor 1:    66 21 50 b0 51 00 1b 30 00 70 26 44 e4 10 11 00 00 1e
descriptor 2:    46 20 00 a4 51 00 2a 30 50 80 37 00 80 80 21 00 00 1c
descriptor 3:    00 00 00 fc 00 4e 53 2d 31 39 45 33 32 30 41 31 33 0a
descriptor 4:    00 00 00 fd 00 37 4c 1e 50 11 00 0a 20 20 20 20 20 20
extensions:      01
checksum:        18

EDID version: 1.3
Manufacturer: BBY Model 32 Serial Number --
Made in week 1 of 2012
Digital display
Maximum image size: 41 cm x 23 cm
Gamma: 2.20
RGB color display
First detailed timing is preferred timing
Display x,y Chromaticity:
  Red:   0.6630, 0.3251
  Green: 0.2851, 0.6132
  Blue:  0.1396, 0.0673
  White: 0.2802, 0.2900
Established timings supported:
  720x400@70Hz 9:5 HorFreq: 31469 Hz Clock: 28.320 MHz
  640x480@60Hz 4:3 HorFreq: 31469 Hz Clock: 25.175 MHz
  800x600@56Hz 4:3 HorFreq: 35200 Hz Clock: 36.000 MHz
  800x600@60Hz 4:3 HorFreq: 37900 Hz Clock: 40.000 MHz
  1024x768@60Hz 4:3 HorFreq: 48400 Hz Clock: 65.000 MHz
Standard timings supported:
  1280x720@60Hz 16:9
  1280x800@60Hz 16:10
  1280x800@75Hz 16:10
  1280x960@60Hz 4:3 HorFreq: 60000 Hz Clock: 108.000 MHz
  1280x1024@60Hz 5:4 HorFreq: 64000 Hz Clock: 108.000 MHz
  1440x900@60Hz 16:10 HorFreq: 55500 Hz Clock: 88.750 MHz
  1680x1050@60Hz 16:10 HorFreq: 64700 Hz Clock: 119.000 MHz
Detailed mode: Clock 85.500 MHz, 484 mm x 272 mm
               1360 1616 1728 1792 hborder 0
                768  786  792  795 vborder 0
               +hsync +vsync 
               VertFreq: 60 Hz, HorFreq: 47712 Hz
Detailed mode: Clock 82.620 MHz, 640 mm x 384 mm
               1280 1360 1488 1700 hborder 0
                768  771  778  810 vborder 0
               -hsync +vsync 
               VertFreq: 60 Hz, HorFreq: 48600 Hz
Monitor name: NS-19E320A13
Monitor ranges (GTF): 55-76Hz V, 30-80kHz H, max dotclock 170MHz
Has 1 extension blocks
Checksum: 0x18 (valid)
