
EDID (hex):
00ffffffffffff001e6d365612010100
0a1101036a2f1d78ead425a455499b27
135054a76b80950f950081808140714f
01010101010121399030621a274068b0
3600d9281100001c000000fd00384b1c
530f000a202020202020000000fc004c
32323657410a202020202020000000fc
000a2020202020202020202020200092

Extracted contents:
header:          00 ff ff ff ff ff ff 00
serial number:   1e 6d 36 56 12 01 01 00 0a 11
version:         01 03
basic params:    6a 2f 1d 78 ea
chroma info:     d4 25 a4 55 49 9b 27 13 50 54
established:     a7 6b 80
standard:        95 0f 95 00 81 80 81 40 71 4f 01 01 01 01 01 01
descriptor 1:    21 39 90 30 62 1a 27 40 68 b0 36 00 d9 28 11 00 00 1c
descriptor 2:    00 00 00 fd 00 38 4b 1c 53 0f 00 0a 20 20 20 20 20 20
descriptor 3:    00 00 00 fc 00 4c 32 32 36 57 41 0a 20 20 20 20 20 20
descriptor 4:    00 00 00 fc 00 0a 20 20 20 20 20 20 20 20 20 20 20 20
extensions:      00
checksum:        92

EDID version: 1.3
Manufacturer: GSM Model 5636 Serial Number --
Made in week 10 of 2007
Analog display, Input voltage level: 0.7/0.7 V
Sync: Separate SyncOnGreen 
Maximum image size: 47 cm x 29 cm
Gamma: 2.20
DPMS levels: Standby Suspend Off
RGB color display
First detailed timing is preferred timing
Display x,y Chromaticity:
  Red:   0.6435, 0.3330
  Green: 0.2861, 0.6054
  Blue:  0.1523, 0.0761
  White: 0.3134, 0.3291
Established timings supported:
  720x400@70Hz 9:5 HorFreq: 31469 Hz Clock: 28.320 MHz
  640x480@60Hz 4:3 HorFreq: 31469 Hz Clock: 25.175 MHz
  640x480@75Hz 4:3 HorFreq: 37500 Hz Clock: 31.500 MHz
  800x600@56Hz 4:3 HorFreq: 35200 Hz Clock: 36.000 MHz
  800x600@60Hz 4:3 HorFreq: 37900 Hz Clock: 40.000 MHz
  800x600@75Hz 4:3 HorFreq: 46900 Hz Clock: 49.500 MHz
  832x624@75Hz 4:3 HorFreq: 49726 Hz Clock: 57.284 MHz
  1024x768@60Hz 4:3 HorFreq: 48400 Hz Clock: 65.000 MHz
  1024x768@75Hz 4:3 HorFreq: 60000 Hz Clock: 78.750 MHz
  1280x1024@75Hz 5:4 HorFreq: 80000 Hz Clock: 135.000 MHz
  1152x870@75Hz 192:145 HorFreq: 67500 Hz Clock: 108.000 MHz
Standard timings supported:
  1440x900@75Hz 16:10 HorFreq: 82300 Hz Clock: 156.000 MHz
  1440x900@60Hz 16:10 HorFreq: 55500 Hz Clock: 88.750 MHz
  1280x1024@60Hz 5:4 HorFreq: 64000 Hz Clock: 108.000 MHz
  1280x960@60Hz 4:3 HorFreq: 60000 Hz Clock: 108.000 MHz
  1152x864@75Hz 4:3 HorFreq: 67500 Hz Clock: 108.000 MHz
Detailed mode: Clock 146.250 MHz, 473 mm x 296 mm
               1680 1784 1960 2240 hborder 0
               1050 1053 1059 1089 vborder 0
               -hsync +vsync 
               VertFreq: 59 Hz, HorFreq: 65290 Hz
Monitor ranges (GTF): 56-75Hz V, 28-83kHz H, max dotclock 150MHz
Monitor name: L226WA
Checksum: 0x92 (valid)
One or more of the timings is out of range of the Monitor Ranges:
  Vertical Freq: 56 - 75 Hz
  Horizontal Freq: 31469 - 82300 Hz
  Maximum Clock: 156.000 MHz
