
EDID (hex):
00ffffffffffff004ca3574400000000
00100103801e13780a87f594574f8c27
27505400000001010101010101010101
0101010101014825a03051840c304020
33002fbe100000190000000f00000000
000000000078e6022300000000fe0044
523530350031343157440a20000000fe
001726313853698bc802010a202000df

Extracted contents:
header:          00 ff ff ff ff ff ff 00
serial number:   4c a3 57 44 00 00 00 00 00 10
version:         01 03
basic params:    80 1e 13 78 0a
chroma info:     87 f5 94 57 4f 8c 27 27 50 54
established:     00 00 00
standard:        01 01 01 01 01 01 01 01 01 01 01 01 01 01 01 01
descriptor 1:    48 25 a0 30 51 84 0c 30 40 20 33 00 2f be 10 00 00 19
descriptor 2:    00 00 00 0f 00 00 00 00 00 00 00 00 00 78 e6 02 23 00
descriptor 3:    00 00 00 fe 00 44 52 35 30 35 00 31 34 31 57 44 0a 20
descriptor 4:    00 00 00 fe 00 17 26 31 38 53 69 8b c8 02 01 0a 20 20
extensions:      00
checksum:        df

EDID version: 1.3
Manufacturer: SEC Model 4457 Serial Number --
Made in year 2006
Digital display
Maximum image size: 30 cm x 19 cm
Gamma: 2.20
RGB color display
First detailed timing is preferred timing
Display x,y Chromaticity:
  Red:   0.5800, 0.3398
  Green: 0.3095, 0.5498
  Blue:  0.1552, 0.1552
  White: 0.3134, 0.3291
Established timings supported:
Standard timings supported:
Detailed mode: Clock 95.440 MHz, 303 mm x 190 mm
               1440 1504 1536 1744 hborder 0
                900  903  906  912 vborder 0
               -hsync -vsync 
               VertFreq: 60 Hz, HorFreq: 54724 Hz
Manufacturer-specified data, tag 15
ASCII string: DR505
ASCII string: 
Checksum: 0xdf (valid)
EDID block does NOT conform to EDID 1.3!
	Missing name descriptor
	Missing monitor ranges
	Detailed block string not properly terminated
