
EDID (hex):
00ffffffffffff0042d41df04c375930
0f16010380331d78eeee95a3544c9926
0f5054a54b00714f8180d1c001010101
010101010101023a801871382d40582c
4500fe1f1100001e000000ff00354d4b
4b4b3034413059374c0a000000fc0048
444d492053706c6974746572000000fd
00384c1e5311000a2020202020200175
02031ff14c90020301071612041f1314
0523097f078301000065030c00100002
3a801871382d40582c45001009000000
1e8c0ad08a20e02d10103e9600040300
0000188c0ad08a20e02d10103e960010
09000000188c0aa01451f01600267c43
001009000000988c0aa0205120181018
7e2300100900000098000000000000e5

Extracted contents:
header:          00 ff ff ff ff ff ff 00
serial number:   42 d4 1d f0 4c 37 59 30 0f 16
version:         01 03
basic params:    80 33 1d 78 ee
chroma info:     ee 95 a3 54 4c 99 26 0f 50 54
established:     a5 4b 00
standard:        71 4f 81 80 d1 c0 01 01 01 01 01 01 01 01 01 01
descriptor 1:    02 3a 80 18 71 38 2d 40 58 2c 45 00 fe 1f 11 00 00 1e
descriptor 2:    00 00 00 ff 00 35 4d 4b 4b 4b 30 34 41 30 59 37 4c 0a
descriptor 3:    00 00 00 fc 00 48 44 4d 49 20 53 70 6c 69 74 74 65 72
descriptor 4:    00 00 00 fd 00 38 4c 1e 53 11 00 0a 20 20 20 20 20 20
extensions:      01
checksum:        75

EDID version: 1.3
Manufacturer: PVT Model f01d Serial Number --
Made in week 15 of 2012
Digital display
Maximum image size: 51 cm x 29 cm
Gamma: 2.20
DPMS levels: Standby Suspend Off
RGB color display
Default (sRGB) color space is primary color space
First detailed timing is preferred timing
Display x,y Chromaticity:
  Red:   0.6396, 0.3300
  Green: 0.2998, 0.5996
  Blue:  0.1503, 0.0595
  White: 0.3134, 0.3291
Established timings supported:
  720x400@70Hz 9:5 HorFreq: 31469 Hz Clock: 28.320 MHz
  640x480@60Hz 4:3 HorFreq: 31469 Hz Clock: 25.175 MHz
  640x480@75Hz 4:3 HorFreq: 37500 Hz Clock: 31.500 MHz
  800x600@60Hz 4:3 HorFreq: 37900 Hz Clock: 40.000 MHz
  800x600@75Hz 4:3 HorFreq: 46900 Hz Clock: 49.500 MHz
  1024x768@60Hz 4:3 HorFreq: 48400 Hz Clock: 65.000 MHz
  1024x768@75Hz 4:3 HorFreq: 60000 Hz Clock: 78.750 MHz
  1280x1024@75Hz 5:4 HorFreq: 80000 Hz Clock: 135.000 MHz
Standard timings supported:
  1152x864@75Hz 4:3 HorFreq: 67500 Hz Clock: 108.000 MHz
  1280x1024@60Hz 5:4 HorFreq: 64000 Hz Clock: 108.000 MHz
  1920x1080@60Hz 16:9
Detailed mode: Clock 148.500 MHz, 510 mm x 287 mm
               1920 2008 2052 2200 hborder 0
               1080 1084 1089 1125 vborder 0
               +hsync +vsync 
               VertFreq: 60 Hz, HorFreq: 67500 Hz
Serial number: --
Monitor ranges (GTF): 56-76Hz V, 30-83kHz H, max dotclock 170MHz
Has 1 extension blocks
Checksum: 0x75 (valid)

CTA extension block
Extension version: 3
27 bytes of CTA data
  Video data block
    VIC  16 1920x1080@60Hz 16:9 (native) HorFreq: 67500 Hz Clock: 148.500 MHz
    VIC   2 720x480@60Hz 4:3  HorFreq: 31469 Hz Clock: 27.000 MHz
    VIC   3 720x480@60Hz 16:9  HorFreq: 31469 Hz Clock: 27.000 MHz
    VIC   1 640x480@60Hz 4:3  HorFreq: 31469 Hz Clock: 25.175 MHz
    VIC   7 1440x480i@60Hz 16:9  HorFreq: 15734 Hz Clock: 27.000 MHz
    VIC  22 1440x576i@50Hz 16:9  HorFreq: 15625 Hz Clock: 27.000 MHz
    VIC  18 720x576@50Hz 16:9  HorFreq: 31250 Hz Clock: 27.000 MHz
    VIC   4 1280x720@60Hz 16:9  HorFreq: 45000 Hz Clock: 74.250 MHz
    VIC  31 1920x1080@50Hz 16:9  HorFreq: 56250 Hz Clock: 148.500 MHz
    VIC  19 1280x720@50Hz 16:9  HorFreq: 37500 Hz Clock: 74.250 MHz
    VIC  20 1920x1080i@50Hz 16:9  HorFreq: 28125 Hz Clock: 74.250 MHz
    VIC   5 1920x1080i@60Hz 16:9  HorFreq: 33750 Hz Clock: 74.250 MHz
  Audio data block
    Linear PCM, max channels 2
      Supported sample rates (kHz): 192 176.4 96 88.2 48 44.1 32
      Supported sample sizes (bits): 24 20 16
  Speaker allocation data block
    Speaker map:
      FL/FR - Front Left/Right
  Vendor-specific data block, OUI 000c03 (HDMI)
    Source physical address 1.0.0.0
Underscans PC formats by default
Basic audio support
Supports YCbCr 4:4:4
Supports YCbCr 4:2:2
1 native detailed modes
Detailed mode: Clock 148.500 MHz, 16 mm x 9 mm
               1920 2008 2052 2200 hborder 0
               1080 1084 1089 1125 vborder 0
               +hsync +vsync 
               VertFreq: 60 Hz, HorFreq: 67500 Hz
Detailed mode: Clock 27.000 MHz, 4 mm x 3 mm
                720  736  798  858 hborder 0
                480  489  495  525 vborder 0
               -hsync -vsync 
               VertFreq: 59 Hz, HorFreq: 31468 Hz
Detailed mode: Clock 27.000 MHz, 16 mm x 9 mm
                720  736  798  858 hborder 0
                480  489  495  525 vborder 0
               -hsync -vsync 
               VertFreq: 59 Hz, HorFreq: 31468 Hz
Detailed mode: Clock 27.000 MHz, 16 mm x 9 mm
               1440 1478 1602 1716 hborder 0
                240  244  247  262 vborder 0
               -hsync -vsync interlaced 
               VertFreq: 60 Hz, HorFreq: 15734 Hz
Detailed mode: Clock 27.000 MHz, 16 mm x 9 mm
               1440 1464 1590 1728 hborder 0
                288  290  293  312 vborder 0
               -hsync -vsync interlaced 
               VertFreq: 50 Hz, HorFreq: 15625 Hz
Checksum: 0xe5 (valid)

EDID block does NOT conform to EDID 1.3!
	sRGB is signaled, but the chromaticities do not match
	Name descriptor not terminated with a newline
One or more of the timings is out of range of the Monitor Ranges:
  Vertical Freq: 50 - 75 Hz
  Horizontal Freq: 15625 - 80000 Hz
  Maximum Clock: 148.500 MHz
EDID block does not conform at all!
	Both the serial number and the serial string are set
