
EDID (hex):
00ffffffffffff0022f0993000000000
011a0104a54028783a1df5ae4f35b325
0d5054a10800d100b30095008100a940
8180d1c081c0e26800a0a0402e603020
360081902100001a000000fd00324618
621b000a202020202020000000fc0048
50205a3330690a2020202020000000ff
00434e343630313146324b0a20200164
020316f149900403021f131211012309
070783010000023a801871382d40582c
450081902100001e023a80d072382d40
102c458081902100001e011d007251d0
1e206e28550081902100001e011d00bc
52d01e20b828554081902100001e8c0a
d08a20e02d10103e9600819021000018
00000000000000000000000000000083

edid-decode (hex):

00 ff ff ff ff ff ff 00 22 f0 99 30 00 00 00 00
01 1a 01 04 a5 40 28 78 3a 1d f5 ae 4f 35 b3 25
0d 50 54 a1 08 00 d1 00 b3 00 95 00 81 00 a9 40
81 80 d1 c0 81 c0 e2 68 00 a0 a0 40 2e 60 30 20
36 00 81 90 21 00 00 1a 00 00 00 fd 00 32 46 18
62 1b 00 0a 20 20 20 20 20 20 00 00 00 fc 00 48
50 20 5a 33 30 69 0a 20 20 20 20 20 00 00 00 ff
00 43 4e 34 36 30 31 31 46 32 4b 0a 20 20 01 64

02 03 16 f1 49 90 04 03 02 1f 13 12 11 01 23 09
07 07 83 01 00 00 02 3a 80 18 71 38 2d 40 58 2c
45 00 81 90 21 00 00 1e 02 3a 80 d0 72 38 2d 40
10 2c 45 80 81 90 21 00 00 1e 01 1d 00 72 51 d0
1e 20 6e 28 55 00 81 90 21 00 00 1e 01 1d 00 bc
52 d0 1e 20 b8 28 55 40 81 90 21 00 00 1e 8c 0a
d0 8a 20 e0 2d 10 10 3e 96 00 81 90 21 00 00 18
00 00 00 00 00 00 00 00 00 00 00 00 00 00 00 83

----------------

Block 0, Base EDID:
  EDID Structure Version & Revision: 1.4
  Vendor & Product Identification:
    Manufacturer: HWP
    Model: 12441
    Made in: week 1 of 2016
  Basic Display Parameters & Features:
    Digital display
    Bits per primary color channel: 8
    DisplayPort interface
    Maximum image size: 64 cm x 40 cm
    Gamma: 2.20
    DPMS levels: Off
    Supported color formats: RGB 4:4:4, YCrCb 4:4:4, YCrCb 4:2:2
    First detailed timing includes the native pixel format and preferred refresh rate
  Color Characteristics:
    Red  : 0.6796, 0.3095
    Green: 0.2099, 0.7001
    Blue : 0.1474, 0.0537
    White: 0.3134, 0.3291
  Established Timings I & II:
    IBM     :   720x400    70.081663 Hz   9:5     31.467 kHz     28.320000 MHz
    DMT 0x04:   640x480    59.940476 Hz   4:3     31.469 kHz     25.175000 MHz
    DMT 0x09:   800x600    60.316541 Hz   4:3     37.879 kHz     40.000000 MHz
    DMT 0x10:  1024x768    60.003840 Hz   4:3     48.363 kHz     65.000000 MHz
  Standard Timings:
    DMT 0x45:  1920x1200   59.884600 Hz  16:10    74.556 kHz    193.250000 MHz
    DMT 0x3a:  1680x1050   59.954250 Hz  16:10    65.290 kHz    146.250000 MHz
    DMT 0x2f:  1440x900    59.887445 Hz  16:10    55.935 kHz    106.500000 MHz
    DMT 0x1c:  1280x800    59.810326 Hz  16:10    49.702 kHz     83.500000 MHz
    DMT 0x33:  1600x1200   60.000000 Hz   4:3     75.000 kHz    162.000000 MHz
    DMT 0x23:  1280x1024   60.019740 Hz   5:4     63.981 kHz    108.000000 MHz
    DMT 0x52:  1920x1080   60.000000 Hz  16:9     67.500 kHz    148.500000 MHz
    DMT 0x55:  1280x720    60.000000 Hz  16:9     45.000 kHz     74.250000 MHz
  Detailed Timing Descriptors:
    DTD 1:  2560x1600   59.971589 Hz  16:10    98.713 kHz    268.500000 MHz (641 mm x 400 mm)
                 Hfront   48 Hsync  32 Hback   80 Hpol P
                 Vfront    3 Vsync   6 Vback   37 Vpol N
    Display Range Limits:
      Monitor ranges (GTF): 50-70 Hz V, 24-98 kHz H, max dotclock 270 MHz
    Display Product Name: 'HP Z30i'
    Display Product Serial Number: 'CN46011F2K'
  Extension blocks: 1
Checksum: 0x64

----------------

Block 1, CTA-861 Extension Block:
  Revision: 3
  Underscans IT Video Formats by default
  Basic audio support
  Supports YCbCr 4:4:4
  Supports YCbCr 4:2:2
  Native detailed modes: 1
  Video Data Block:
    VIC  16:  1920x1080   60.000000 Hz  16:9     67.500 kHz    148.500000 MHz (native)
    VIC   4:  1280x720    60.000000 Hz  16:9     45.000 kHz     74.250000 MHz
    VIC   3:   720x480    59.940060 Hz  16:9     31.469 kHz     27.000000 MHz
    VIC   2:   720x480    59.940060 Hz   4:3     31.469 kHz     27.000000 MHz
    VIC  31:  1920x1080   50.000000 Hz  16:9     56.250 kHz    148.500000 MHz
    VIC  19:  1280x720    50.000000 Hz  16:9     37.500 kHz     74.250000 MHz
    VIC  18:   720x576    50.000000 Hz  16:9     31.250 kHz     27.000000 MHz
    VIC  17:   720x576    50.000000 Hz   4:3     31.250 kHz     27.000000 MHz
    VIC   1:   640x480    59.940476 Hz   4:3     31.469 kHz     25.175000 MHz
  Audio Data Block:
    Linear PCM:
      Max channels: 2
      Supported sample rates (kHz): 48 44.1 32
      Supported sample sizes (bits): 24 20 16
  Speaker Allocation Data Block:
    FL/FR - Front Left/Right
  Detailed Timing Descriptors:
    DTD 2:  1920x1080   60.000000 Hz  16:9     67.500 kHz    148.500000 MHz (641 mm x 400 mm)
                 Hfront   88 Hsync  44 Hback  148 Hpol P
                 Vfront    4 Vsync   5 Vback   36 Vpol P
    DTD 3:  1920x1080   50.000000 Hz  16:9     56.250 kHz    148.500000 MHz (641 mm x 400 mm)
                 Hfront  528 Hsync  44 Hback  148 Hpol P
                 Vfront    4 Vsync   5 Vback   36 Vpol P
    DTD 4:  1280x720    60.000000 Hz  16:9     45.000 kHz     74.250000 MHz (641 mm x 400 mm)
                 Hfront  110 Hsync  40 Hback  220 Hpol P
                 Vfront    5 Vsync   5 Vback   20 Vpol P
    DTD 5:  1280x720    50.000000 Hz  16:9     37.500 kHz     74.250000 MHz (641 mm x 400 mm)
                 Hfront  440 Hsync  40 Hback  220 Hpol P
                 Vfront    5 Vsync   5 Vback   20 Vpol P
    DTD 6:   720x480    59.940060 Hz   3:2     31.469 kHz     27.000000 MHz (641 mm x 400 mm)
                 Hfront   16 Hsync  62 Hback   60 Hpol N
                 Vfront    9 Vsync   6 Vback   30 Vpol N
Checksum: 0x83  Unused space in Extension Block: 15 bytes


