edid-decode (hex):

00 ff ff ff ff ff ff 00 1e 6d fb 5a 87 4f 05 00
0a 19 01 04 a5 50 22 78 9f ca 95 a6 55 4e a1 26
0f 50 54 a5 4b 80 71 4f 81 80 81 c0 a9 c0 b3 00
a9 cf b3 0f d1 cf 7e 48 00 e0 a0 38 1f 40 40 40
3a 00 1e 4e 31 00 00 18 02 3a 80 18 71 38 2d 40
58 2c 45 00 1e 4e 31 00 00 1a 00 00 00 fc 00 4c
47 20 55 4c 54 52 41 57 49 44 45 0a 00 00 00 fd
00 28 4b 55 55 18 01 0a 20 20 20 20 20 20 01 4d

02 03 1c 71 49 90 04 03 00 12 00 1f 01 13 23 09
07 07 83 01 00 00 00 00 00 00 10 00 02 3a 80 18
71 38 2d 40 58 2c 45 00 a5 22 21 00 00 1e 01 1d
80 18 71 1c 16 20 58 2c 25 00 a5 22 21 00 00 9e
01 1d 00 72 51 d0 1e 20 6e 28 55 00 a5 22 21 00
00 1e 8c 0a d0 8a 20 e0 2d 10 10 3e 96 00 a5 22
21 00 00 18 29 59 00 a0 a0 38 27 40 30 20 3a 00
a5 22 21 00 00 1a 00 00 00 00 00 00 00 00 00 3c

00 ff ff ff ff ff ff 00 1e 6d fb 5a 87 4f 05 00
0a 19 01 04 a5 50 22 78 9f ca 95 a6 55 4e a1 26
0f 50 54 a5 4b 80 71 4f 81 80 81 c0 a9 c0 b3 00
a9 cf b3 0f d1 cf 7e 48 00 e0 a0 38 1f 40 40 40
3a 00 1e 4e 31 00 00 18 02 3a 80 18 71 38 2d 40
58 2c 45 00 1e 4e 31 00 00 1a 00 00 00 fc 00 4c
47 20 55 4c 54 52 41 57 49 44 45 0a 00 00 00 fd
00 28 4b 55 55 18 01 0a 20 20 20 20 20 20 01 4d

02 03 1c 71 49 90 04 03 00 12 00 1f 01 13 23 09
07 07 83 01 00 00 00 00 00 00 10 00 02 3a 80 18
71 38 2d 40 58 2c 45 00 a5 22 21 00 00 1e 01 1d
80 18 71 1c 16 20 58 2c 25 00 a5 22 21 00 00 9e
01 1d 00 72 51 d0 1e 20 6e 28 55 00 a5 22 21 00
00 1e 8c 0a d0 8a 20 e0 2d 10 10 3e 96 00 a5 22
21 00 00 18 29 59 00 a0 a0 38 27 40 30 20 3a 00
a5 22 21 00 00 1a 00 00 00 00 00 00 00 00 00 3c

----------------

Block 0, Base EDID:
  EDID Structure Version & Revision: 1.4
  Vendor & Product Identification:
    Manufacturer: GSM
    Model: 23291
    Serial Number: ...
    Made in: week 10 of 2015
  Basic Display Parameters & Features:
    Digital display
    Bits per primary color channel: 8
    DisplayPort interface
    Maximum image size: 80 cm x 34 cm
    Gamma: 2.20
    DPMS levels: Standby
    Supported color formats: RGB 4:4:4, YCrCb 4:4:4, YCrCb 4:2:2
    Default (sRGB) color space is primary color space
    First detailed timing includes the native pixel format and preferred refresh rate
    Display is continuous frequency
  Color Characteristics:
    Red  : 0.6513, 0.3320
    Green: 0.3066, 0.6308
    Blue : 0.1503, 0.0595
    White: 0.3134, 0.3291
  Established Timings I & II:
    IBM     :   720x400    70.081663 Hz   9:5     31.467 kHz     28.320000 MHz
    DMT 0x04:   640x480    59.940476 Hz   4:3     31.469 kHz     25.175000 MHz
    DMT 0x06:   640x480    75.000000 Hz   4:3     37.500 kHz     31.500000 MHz
    DMT 0x09:   800x600    60.316541 Hz   4:3     37.879 kHz     40.000000 MHz
    DMT 0x0b:   800x600    75.000000 Hz   4:3     46.875 kHz     49.500000 MHz
    DMT 0x10:  1024x768    60.003840 Hz   4:3     48.363 kHz     65.000000 MHz
    DMT 0x12:  1024x768    75.028582 Hz   4:3     60.023 kHz     78.750000 MHz
    DMT 0x24:  1280x1024   75.024675 Hz   5:4     79.976 kHz    135.000000 MHz
    Apple   :  1152x870    75.061550 Hz 192:145   68.681 kHz    100.000000 MHz
  Standard Timings:
    DMT 0x15:  1152x864    75.000000 Hz   4:3     67.500 kHz    108.000000 MHz
    DMT 0x23:  1280x1024   60.019740 Hz   5:4     63.981 kHz    108.000000 MHz
    DMT 0x55:  1280x720    60.000000 Hz  16:9     45.000 kHz     74.250000 MHz
    DMT 0x53:  1600x900    60.000000 Hz  16:9     60.000 kHz    108.000000 MHz (RB)
    DMT 0x3a:  1680x1050   59.954250 Hz  16:10    65.290 kHz    146.250000 MHz
    GTF     :  1600x900    75.000000 Hz  16:9     70.500 kHz    152.280000 MHz
    DMT 0x3b:  1680x1050   74.892027 Hz  16:10    82.306 kHz    187.000000 MHz
    GTF     :  1920x1080   75.000068 Hz  16:9     84.600 kHz    220.637000 MHz
  Detailed Timing Descriptors:
    DTD  1:  2560x1080   59.999534 Hz  64:27    66.659 kHz    185.580000 MHz (798 mm x 334 mm)
                  Hfront   64 Hsync  64 Hback   96 Hpol N
                  Vfront    3 Vsync  10 Vback   18 Vpol N
    DTD  2:  1920x1080   60.000000 Hz  16:9     67.500 kHz    148.500000 MHz (798 mm x 334 mm)
                  Hfront   88 Hsync  44 Hback  148 Hpol P
                  Vfront    4 Vsync   5 Vback   36 Vpol N
    Display Product Name: 'LG ULTRAWIDE'
    Display Range Limits:
      Monitor ranges (Bare Limits): 40-75 Hz V, 85-85 kHz H, max dotclock 240 MHz
  Extension blocks: 1
Checksum: 0x4d

----------------

Block 1, CTA-861 Extension Block:
  Revision: 3
  Basic audio support
  Supports YCbCr 4:4:4
  Supports YCbCr 4:2:2
  Native detailed modes: 1
  Video Data Block:
    VIC  16:  1920x1080   60.000000 Hz  16:9     67.500 kHz    148.500000 MHz (native)
    VIC   4:  1280x720    60.000000 Hz  16:9     45.000 kHz     74.250000 MHz
    VIC   3:   720x480    59.940060 Hz  16:9     31.469 kHz     27.000000 MHz
    VIC  18:   720x576    50.000000 Hz  16:9     31.250 kHz     27.000000 MHz
    VIC  31:  1920x1080   50.000000 Hz  16:9     56.250 kHz    148.500000 MHz
    VIC   1:   640x480    59.940476 Hz   4:3     31.469 kHz     25.175000 MHz
    VIC  19:  1280x720    50.000000 Hz  16:9     37.500 kHz     74.250000 MHz
  Audio Data Block:
    Linear PCM:
      Max channels: 2
      Supported sample rates (kHz): 48 44.1 32
      Supported sample sizes (bits): 24 20 16
  Speaker Allocation Data Block:
    FL/FR - Front Left/Right
  Unknown CTA-861 Data Block (tag 0x00, length 0):
  Unknown CTA-861 Data Block (tag 0x00, length 0):
  Unknown CTA-861 Data Block (tag 0x00, length 0):
  Unknown CTA-861 Data Block (tag 0x00, length 0):
  Unknown CTA-861 Data Block (tag 0x00, length 16):
    00 02 3a 80 18 71 38 2d 40 58 2c 45 00 a5 22 21 '..:..q8-@X,E.."!'
  Detailed Timing Descriptors:
    DTD  3:  1920x1080   60.000000 Hz  16:9     67.500 kHz    148.500000 MHz (677 mm x 290 mm)
                  Hfront   88 Hsync  44 Hback  148 Hpol P
                  Vfront    4 Vsync   5 Vback   36 Vpol P
    DTD  4:  1920x1080i  60.000000 Hz  16:9     33.750 kHz     74.250000 MHz (677 mm x 290 mm)
                  Hfront   88 Hsync  44 Hback  148 Hpol P
                  Vfront    2 Vsync   5 Vback   15 Vpol P Vfront +0.5 Odd Field
                  Vfront    2 Vsync   5 Vback   15 Vpol P Vback  +0.5 Even Field
    DTD  5:  1280x720    60.000000 Hz  16:9     45.000 kHz     74.250000 MHz (677 mm x 290 mm)
                  Hfront  110 Hsync  40 Hback  220 Hpol P
                  Vfront    5 Vsync   5 Vback   20 Vpol P
    DTD  6:   720x480    59.940060 Hz   3:2     31.469 kHz     27.000000 MHz (677 mm x 290 mm)
                  Hfront   16 Hsync  62 Hback   60 Hpol N
                  Vfront    9 Vsync   6 Vback   30 Vpol N
    DTD  7:  2560x1080   74.991458 Hz  64:27    83.915 kHz    228.250000 MHz (677 mm x 290 mm)
                  Hfront   48 Hsync  32 Hback   80 Hpol P
                  Vfront    3 Vsync  10 Vback   26 Vpol N
Checksum: 0x3c  Unused space in Extension Block: 9 bytes

----------------

Block 2, Unknown EDID Extension Block 0x00:
  00 ff ff ff ff ff ff 00 1e 6d fb 5a 87 4f 05 00 '.........m.Z.O..'
  0a 19 01 04 a5 50 22 78 9f ca 95 a6 55 4e a1 26 '.....P"x....UN.&'
  0f 50 54 a5 4b 80 71 4f 81 80 81 c0 a9 c0 b3 00 '.PT.K.qO........'
  a9 cf b3 0f d1 cf 7e 48 00 e0 a0 38 1f 40 40 40 '......~H...8.@@@'
  3a 00 1e 4e 31 00 00 18 02 3a 80 18 71 38 2d 40 ':..N1....:..q8-@'
  58 2c 45 00 1e 4e 31 00 00 1a 00 00 00 fc 00 4c 'X,E..N1........L'
  47 20 55 4c 54 52 41 57 49 44 45 0a 00 00 00 fd 'G ULTRAWIDE.....'
  00 28 4b 55 55 18 01 0a 20 20 20 20 20 20 01 4d '.(KUU...      .M'
Checksum: 0x4d

----------------

Block 3, CTA-861 Extension Block:
  Revision: 3
  Basic audio support
  Supports YCbCr 4:4:4
  Supports YCbCr 4:2:2
  Native detailed modes: 1
  Video Data Block:
    VIC  16:  1920x1080   60.000000 Hz  16:9     67.500 kHz    148.500000 MHz (native)
    VIC   4:  1280x720    60.000000 Hz  16:9     45.000 kHz     74.250000 MHz
    VIC   3:   720x480    59.940060 Hz  16:9     31.469 kHz     27.000000 MHz
    VIC  18:   720x576    50.000000 Hz  16:9     31.250 kHz     27.000000 MHz
    VIC  31:  1920x1080   50.000000 Hz  16:9     56.250 kHz    148.500000 MHz
    VIC   1:   640x480    59.940476 Hz   4:3     31.469 kHz     25.175000 MHz
    VIC  19:  1280x720    50.000000 Hz  16:9     37.500 kHz     74.250000 MHz
  Audio Data Block:
    Linear PCM:
      Max channels: 2
      Supported sample rates (kHz): 48 44.1 32
      Supported sample sizes (bits): 24 20 16
  Speaker Allocation Data Block:
    FL/FR - Front Left/Right
  Unknown CTA-861 Data Block (tag 0x00, length 0):
  Unknown CTA-861 Data Block (tag 0x00, length 0):
  Unknown CTA-861 Data Block (tag 0x00, length 0):
  Unknown CTA-861 Data Block (tag 0x00, length 0):
  Unknown CTA-861 Data Block (tag 0x00, length 16):
    00 02 3a 80 18 71 38 2d 40 58 2c 45 00 a5 22 21 '..:..q8-@X,E.."!'
  Detailed Timing Descriptors:
    DTD  8:  1920x1080   60.000000 Hz  16:9     67.500 kHz    148.500000 MHz (677 mm x 290 mm)
                  Hfront   88 Hsync  44 Hback  148 Hpol P
                  Vfront    4 Vsync   5 Vback   36 Vpol P
    DTD  9:  1920x1080i  60.000000 Hz  16:9     33.750 kHz     74.250000 MHz (677 mm x 290 mm)
                  Hfront   88 Hsync  44 Hback  148 Hpol P
                  Vfront    2 Vsync   5 Vback   15 Vpol P Vfront +0.5 Odd Field
                  Vfront    2 Vsync   5 Vback   15 Vpol P Vback  +0.5 Even Field
    DTD 10:  1280x720    60.000000 Hz  16:9     45.000 kHz     74.250000 MHz (677 mm x 290 mm)
                  Hfront  110 Hsync  40 Hback  220 Hpol P
                  Vfront    5 Vsync   5 Vback   20 Vpol P
    DTD 11:   720x480    59.940060 Hz   3:2     31.469 kHz     27.000000 MHz (677 mm x 290 mm)
                  Hfront   16 Hsync  62 Hback   60 Hpol N
                  Vfront    9 Vsync   6 Vback   30 Vpol N
    DTD 12:  2560x1080   74.991458 Hz  64:27    83.915 kHz    228.250000 MHz (677 mm x 290 mm)
                  Hfront   48 Hsync  32 Hback   80 Hpol P
                  Vfront    3 Vsync  10 Vback   26 Vpol N
Checksum: 0x3c  Unused space in Extension Block: 9 bytes

----------------

Warnings:

Block 0, Base EDID:
  Detailed Timing Descriptor #2: DTD is similar but not identical to VIC 16.
Block 1, CTA-861 Extension Block:
  IT Video Formats are overscanned by default, but normally this should be underscanned.
  Unknown CTA-861 Data Block (tag 0x00, length 0).
  Unknown CTA-861 Data Block (tag 0x00, length 0).
  Unknown CTA-861 Data Block (tag 0x00, length 0).
  Unknown CTA-861 Data Block (tag 0x00, length 0).
  Unknown CTA-861 Data Block (tag 0x00, length 16).
Block 3, CTA-861 Extension Block:
  IT Video Formats are overscanned by default, but normally this should be underscanned.
  Unknown CTA-861 Data Block (tag 0x00, length 0).
  Unknown CTA-861 Data Block (tag 0x00, length 0).
  Unknown CTA-861 Data Block (tag 0x00, length 0).
  Unknown CTA-861 Data Block (tag 0x00, length 0).
  Unknown CTA-861 Data Block (tag 0x00, length 16).
EDID:
  Base EDID: Some timings are out of range of the Monitor Ranges:
    Horizontal Freq: 31.250 - 84.600 kHz (Monitor: 85.000 - 85.000 kHz)

Failures:

Block 0, Base EDID:
  Basic Display Parameters & Features: sRGB is signaled, but the chromaticities do not match.
Block 1, CTA-861 Extension Block:
  Offset is 28, but should be 43.
  Detailed Timing Descriptor #3: Mismatch of image size 677x290 mm vs display size 800x340 mm.
  Detailed Timing Descriptor #4: Mismatch of image size 677x290 mm vs display size 800x340 mm.
  Detailed Timing Descriptor #5: Mismatch of image size 677x290 mm vs display size 800x340 mm.
  Detailed Timing Descriptor #6: Mismatch of image size 677x290 mm vs display size 800x340 mm.
  Detailed Timing Descriptor #7: Mismatch of image size 677x290 mm vs display size 800x340 mm.
  Missing VCDB, needed for Set Selectable RGB Quantization to avoid interop issues.
Block 2, Base EDID:
  Unknown Extension Block.
Block 3, CTA-861 Extension Block:
  Video Data Block: Duplicate VIC 16.
  Video Data Block: Duplicate VIC 4.
  Video Data Block: Duplicate VIC 3.
  Video Data Block: Duplicate VIC 18.
  Video Data Block: Duplicate VIC 31.
  Video Data Block: Duplicate VIC 1.
  Video Data Block: Duplicate VIC 19.
  Speaker Allocation Data Block: Only one instance of this Data Block is allowed.
  Offset is 28, but should be 43.
  Detailed Timing Descriptor #8: Mismatch of image size 677x290 mm vs display size 800x340 mm.
  Detailed Timing Descriptor #9: Mismatch of image size 677x290 mm vs display size 800x340 mm.
  Detailed Timing Descriptor #10: Mismatch of image size 677x290 mm vs display size 800x340 mm.
  Detailed Timing Descriptor #11: Mismatch of image size 677x290 mm vs display size 800x340 mm.
  Detailed Timing Descriptor #12: Mismatch of image size 677x290 mm vs display size 800x340 mm.
  Missing VCDB, needed for Set Selectable RGB Quantization to avoid interop issues.
EDID:
  Base EDID: EDID specified 1 extension block(s), but found 3 extension block(s).
  CTA-861: Native progressive timings are a mix of several resolutions.

EDID conformity: FAIL
