
EDID (hex):
00ffffffffffff0005e37928a5000000
2d1e0104b53e22783b08a5a2574fa228
0f5054230800d1c0818081409500b300
81c00101010122cc0050f0703e801810
35006d552100001a565e00a0a0a02950
302035006d552100001e000000fc0055
3238373947360a2020202020000000fd
00283e8c8c3c010a2020202020200125
020326f14b101f041303120211010514
23090707830100006d030c0020001978
2000600102034d6c80a070703e803020
3a006d552100001a011d007251d01e20
6e2855006d552100001e023a80d07238
2d40102c96806d55210000188c0ad08a
20e02d10103e96006d55210000180000
000000000000000000000000000000cb

edid-decode (hex):

00 ff ff ff ff ff ff 00 05 e3 79 28 a5 00 00 00
2d 1e 01 04 b5 3e 22 78 3b 08 a5 a2 57 4f a2 28
0f 50 54 23 08 00 d1 c0 81 80 81 40 95 00 b3 00
81 c0 01 01 01 01 22 cc 00 50 f0 70 3e 80 18 10
35 00 6d 55 21 00 00 1a 56 5e 00 a0 a0 a0 29 50
30 20 35 00 6d 55 21 00 00 1e 00 00 00 fc 00 55
32 38 37 39 47 36 0a 20 20 20 20 20 00 00 00 fd
00 28 3e 8c 8c 3c 01 0a 20 20 20 20 20 20 01 25

02 03 26 f1 4b 10 1f 04 13 03 12 02 11 01 05 14
23 09 07 07 83 01 00 00 6d 03 0c 00 20 00 19 78
20 00 60 01 02 03 4d 6c 80 a0 70 70 3e 80 30 20
3a 00 6d 55 21 00 00 1a 01 1d 00 72 51 d0 1e 20
6e 28 55 00 6d 55 21 00 00 1e 02 3a 80 d0 72 38
2d 40 10 2c 96 80 6d 55 21 00 00 18 8c 0a d0 8a
20 e0 2d 10 10 3e 96 00 6d 55 21 00 00 18 00 00
00 00 00 00 00 00 00 00 00 00 00 00 00 00 00 cb

----------------

Block 0, Base EDID:
  EDID Structure Version & Revision: 1.4
  Vendor & Product Identification:
    Manufacturer: AOC
    Model: 10361
    Serial Number: 165
    Made in: week 45 of 2020
  Basic Display Parameters & Features:
    Digital display
    Bits per primary color channel: 10
    DisplayPort interface
    Maximum image size: 62 cm x 34 cm
    Gamma: 2.20
    DPMS levels: Off
    Supported color formats: RGB 4:4:4, YCrCb 4:4:4, YCrCb 4:2:2
    First detailed timing includes the native pixel format and preferred refresh rate
    Display is continuous frequency
  Color Characteristics:
    Red  : 0.6328, 0.3398
    Green: 0.3105, 0.6328
    Blue : 0.1582, 0.0605
    White: 0.3134, 0.3291
  Established Timings I & II:
    DMT 0x04:   640x480    59.940476 Hz   4:3     31.469 kHz     25.175000 MHz
    DMT 0x08:   800x600    56.250000 Hz   4:3     35.156 kHz     36.000000 MHz
    DMT 0x09:   800x600    60.316541 Hz   4:3     37.879 kHz     40.000000 MHz
    DMT 0x10:  1024x768    60.003840 Hz   4:3     48.363 kHz     65.000000 MHz
  Standard Timings:
    DMT 0x52:  1920x1080   60.000000 Hz  16:9     67.500 kHz    148.500000 MHz
    DMT 0x23:  1280x1024   60.019740 Hz   5:4     63.981 kHz    108.000000 MHz
    DMT 0x20:  1280x960    60.000000 Hz   4:3     60.000 kHz    108.000000 MHz
    DMT 0x2f:  1440x900    59.887445 Hz  16:10    55.935 kHz    106.500000 MHz
    DMT 0x3a:  1680x1050   59.954250 Hz  16:10    65.290 kHz    146.250000 MHz
    DMT 0x55:  1280x720    60.000000 Hz  16:9     45.000 kHz     74.250000 MHz
  Detailed Timing Descriptors:
    DTD 1:  3840x2160   59.996051 Hz  16:9    133.311 kHz    522.580000 MHz (621 mm x 341 mm)
                 Hfront   24 Hsync  16 Hback   40 Hpol P
                 Vfront    3 Vsync   5 Vback   54 Vpol N
    DTD 2:  2560x1440   59.950550 Hz  16:9     88.787 kHz    241.500000 MHz (621 mm x 341 mm)
                 Hfront   48 Hsync  32 Hback   80 Hpol P
                 Vfront    3 Vsync   5 Vback   33 Vpol P
    Display Product Name: 'U2879G6'
    Display Range Limits:
      Monitor ranges (Bare Limits): 40-62 Hz V, 140-140 kHz H, max dotclock 600 MHz
  Extension blocks: 1
Checksum: 0x25

----------------

Block 1, CTA-861 Extension Block:
  Revision: 3
  Underscans IT Video Formats by default
  Basic audio support
  Supports YCbCr 4:4:4
  Supports YCbCr 4:2:2
  Native detailed modes: 1
  Video Data Block:
    VIC  16:  1920x1080   60.000000 Hz  16:9     67.500 kHz    148.500000 MHz
    VIC  31:  1920x1080   50.000000 Hz  16:9     56.250 kHz    148.500000 MHz
    VIC   4:  1280x720    60.000000 Hz  16:9     45.000 kHz     74.250000 MHz
    VIC  19:  1280x720    50.000000 Hz  16:9     37.500 kHz     74.250000 MHz
    VIC   3:   720x480    59.940060 Hz  16:9     31.469 kHz     27.000000 MHz
    VIC  18:   720x576    50.000000 Hz  16:9     31.250 kHz     27.000000 MHz
    VIC   2:   720x480    59.940060 Hz   4:3     31.469 kHz     27.000000 MHz
    VIC  17:   720x576    50.000000 Hz   4:3     31.250 kHz     27.000000 MHz
    VIC   1:   640x480    59.940476 Hz   4:3     31.469 kHz     25.175000 MHz
    VIC   5:  1920x1080i  60.000000 Hz  16:9     33.750 kHz     74.250000 MHz
    VIC  20:  1920x1080i  50.000000 Hz  16:9     28.125 kHz     74.250000 MHz
  Audio Data Block:
    Linear PCM:
      Max channels: 2
      Supported sample rates (kHz): 48 44.1 32
      Supported sample sizes (bits): 24 20 16
  Speaker Allocation Data Block:
    FL/FR - Front Left/Right
  Vendor-Specific Data Block (HDMI), OUI 00-0C-03:
    Source physical address: 2.0.0.0
    DC_30bit
    DC_Y444
    DVI_Dual
    Maximum TMDS clock: 600 MHz
    Extended HDMI video details:
      HDMI VICs:
        HDMI VIC 1:  3840x2160   30.000000 Hz  16:9     67.500 kHz    297.000000 MHz
        HDMI VIC 2:  3840x2160   25.000000 Hz  16:9     56.250 kHz    297.000000 MHz
        HDMI VIC 3:  3840x2160   24.000000 Hz  16:9     54.000 kHz    297.000000 MHz
  Detailed Timing Descriptors:
    DTD 3:  1920x2160   59.987970 Hz   8:9    133.293 kHz    277.250000 MHz (621 mm x 341 mm)
                 Hfront   48 Hsync  32 Hback   80 Hpol P
                 Vfront    3 Vsync  10 Vback   49 Vpol N
    DTD 4:  1280x720    60.000000 Hz  16:9     45.000 kHz     74.250000 MHz (621 mm x 341 mm)
                 Hfront  110 Hsync  40 Hback  220 Hpol P
                 Vfront    5 Vsync   5 Vback   20 Vpol P
    DTD 5:  1920x1080   50.000000 Hz  16:9     56.250 kHz    148.500000 MHz (621 mm x 341 mm)
                 Hfront  528 Hsync  44 Hback  148 Hpol N
                 Vfront    9 Vsync   6 Vback   30 Vpol N
    DTD 6:   720x480    59.940060 Hz   3:2     31.469 kHz     27.000000 MHz (621 mm x 341 mm)
                 Hfront   16 Hsync  62 Hback   60 Hpol N
                 Vfront    9 Vsync   6 Vback   30 Vpol N
Checksum: 0xcb  Unused space in Extension Block: 17 bytes


