
EDID (hex):
00ffffffffffff0005e3792895010000
1b1b0103803e22782a08a5a2574fa228
0f5054bfef00d1c0b300950081808140
81c0010101014dd000a0f0703e803020
35006d552100001aa36600a0f0701f80
302035006d552100001a000000fc0055
3238373947360a2020202020000000fd
0017501e8c3c000a202020202020013d
020333f14c9004031f1301125d5e5f60
6123090707830100006d030c00100039
7820006001020367d85dc401788003e3
0f000c011d007251d01e206e2855006d
552100001e8c0ad08a20e02d10103e96
006d55210000184d6c80a070703e8030
203a006d552100001aa36600a0f0701f
80302035006d552100001a00000000ea

Extracted contents:
header:          00 ff ff ff ff ff ff 00
serial number:   05 e3 79 28 95 01 00 00 1b 1b
version:         01 03
basic params:    80 3e 22 78 2a
chroma info:     08 a5 a2 57 4f a2 28 0f 50 54
established:     bf ef 00
standard:        d1 c0 b3 00 95 00 81 80 81 40 81 c0 01 01 01 01
descriptor 1:    4d d0 00 a0 f0 70 3e 80 30 20 35 00 6d 55 21 00 00 1a
descriptor 2:    a3 66 00 a0 f0 70 1f 80 30 20 35 00 6d 55 21 00 00 1a
descriptor 3:    00 00 00 fc 00 55 32 38 37 39 47 36 0a 20 20 20 20 20
descriptor 4:    00 00 00 fd 00 17 50 1e 8c 3c 00 0a 20 20 20 20 20 20
extensions:      01
checksum:        3d

EDID version: 1.3
Manufacturer: AOC Model 2879 Serial Number --
Made in week 27 of 2017
Digital display
Maximum image size: 62 cm x 34 cm
Gamma: 2.20
DPMS levels: Off
RGB color display
First detailed timing is preferred timing
Display x,y Chromaticity:
  Red:   0.6328, 0.3398
  Green: 0.3105, 0.6328
  Blue:  0.1582, 0.0605
  White: 0.3134, 0.3291
Established timings supported:
  720x400@70Hz 9:5 HorFreq: 31469 Hz Clock: 28.320 MHz
  640x480@60Hz 4:3 HorFreq: 31469 Hz Clock: 25.175 MHz
  640x480@67Hz 4:3 HorFreq: 35000 Hz Clock: 30.240 MHz
  640x480@72Hz 4:3 HorFreq: 37900 Hz Clock: 31.500 MHz
  640x480@75Hz 4:3 HorFreq: 37500 Hz Clock: 31.500 MHz
  800x600@56Hz 4:3 HorFreq: 35200 Hz Clock: 36.000 MHz
  800x600@60Hz 4:3 HorFreq: 37900 Hz Clock: 40.000 MHz
  800x600@72Hz 4:3 HorFreq: 48100 Hz Clock: 50.000 MHz
  800x600@75Hz 4:3 HorFreq: 46900 Hz Clock: 49.500 MHz
  832x624@75Hz 4:3 HorFreq: 49726 Hz Clock: 57.284 MHz
  1024x768@60Hz 4:3 HorFreq: 48400 Hz Clock: 65.000 MHz
  1024x768@70Hz 4:3 HorFreq: 56500 Hz Clock: 75.000 MHz
  1024x768@75Hz 4:3 HorFreq: 60000 Hz Clock: 78.750 MHz
  1280x1024@75Hz 5:4 HorFreq: 80000 Hz Clock: 135.000 MHz
Standard timings supported:
  1920x1080@60Hz 16:9
  1680x1050@60Hz 16:10 HorFreq: 64700 Hz Clock: 119.000 MHz
  1440x900@60Hz 16:10 HorFreq: 55500 Hz Clock: 88.750 MHz
  1280x1024@60Hz 5:4 HorFreq: 64000 Hz Clock: 108.000 MHz
  1280x960@60Hz 4:3 HorFreq: 60000 Hz Clock: 108.000 MHz
  1280x720@60Hz 16:9
Detailed mode: Clock 533.250 MHz, 621 mm x 341 mm
               3840 3888 3920 4000 hborder 0
               2160 2163 2168 2222 vborder 0
               +hsync -vsync 
               VertFreq: 59 Hz, HorFreq: 133312 Hz
Detailed mode: Clock 262.750 MHz, 621 mm x 341 mm
               3840 3888 3920 4000 hborder 0
               2160 2163 2168 2191 vborder 0
               +hsync -vsync 
               VertFreq: 29 Hz, HorFreq: 65687 Hz
Monitor name: U2879G6
Monitor ranges (GTF): 23-80Hz V, 30-140kHz H, max dotclock 600MHz
Has 1 extension blocks
Checksum: 0x3d (valid)

CTA extension block
Extension version: 3
47 bytes of CTA data
  Video data block
    VIC  16 1920x1080@60Hz 16:9 (native) HorFreq: 67500 Hz Clock: 148.500 MHz
    VIC   4 1280x720@60Hz 16:9  HorFreq: 45000 Hz Clock: 74.250 MHz
    VIC   3 720x480@60Hz 16:9  HorFreq: 31469 Hz Clock: 27.000 MHz
    VIC  31 1920x1080@50Hz 16:9  HorFreq: 56250 Hz Clock: 148.500 MHz
    VIC  19 1280x720@50Hz 16:9  HorFreq: 37500 Hz Clock: 74.250 MHz
    VIC   1 640x480@60Hz 4:3  HorFreq: 31469 Hz Clock: 25.175 MHz
    VIC  18 720x576@50Hz 16:9  HorFreq: 31250 Hz Clock: 27.000 MHz
    VIC  93 3840x2160@24Hz 16:9  HorFreq: 54000 Hz Clock: 297.000 MHz
    VIC  94 3840x2160@25Hz 16:9  HorFreq: 56250 Hz Clock: 297.000 MHz
    VIC  95 3840x2160@30Hz 16:9  HorFreq: 67500 Hz Clock: 297.000 MHz
    VIC  96 3840x2160@50Hz 16:9  HorFreq: 112500 Hz Clock: 594.000 MHz
    VIC  97 3840x2160@60Hz 16:9  HorFreq: 135000 Hz Clock: 594.000 MHz
  Audio data block
    Linear PCM, max channels 2
      Supported sample rates (kHz): 48 44.1 32
      Supported sample sizes (bits): 24 20 16
  Speaker allocation data block
    Speaker map:
      FL/FR - Front Left/Right
  Vendor-specific data block, OUI 000c03 (HDMI)
    Source physical address 1.0.0.0
    DC_36bit
    DC_30bit
    DC_Y444
    DVI_Dual
    Maximum TMDS clock: 600MHz
    Extended HDMI video details:
      HDMI VIC 1 3840x2160@30Hz 16:9 HorFreq: 67500 Hz Clock: 297.000 MHz
      HDMI VIC 2 3840x2160@25Hz 16:9 HorFreq: 56250 Hz Clock: 297.000 MHz
      HDMI VIC 3 3840x2160@24Hz 16:9 HorFreq: 54000 Hz Clock: 297.000 MHz
  Vendor-specific data block, OUI c45dd8 (HDMI Forum)
    Version: 1
    Maximum TMDS Character Rate: 600MHz
    SCDC Present
    Supports 12-bits/component Deep Color 4:2:0 Pixel Encoding
    Supports 10-bits/component Deep Color 4:2:0 Pixel Encoding
  Extended tag: YCbCr 4:2:0 capability map data block
    VSD Index 10
    VSD Index 11
Underscans PC formats by default
Basic audio support
Supports YCbCr 4:4:4
Supports YCbCr 4:2:2
1 native detailed modes
Detailed mode: Clock 74.250 MHz, 621 mm x 341 mm
               1280 1390 1430 1650 hborder 0
                720  725  730  750 vborder 0
               +hsync +vsync 
               VertFreq: 60 Hz, HorFreq: 45000 Hz
Detailed mode: Clock 27.000 MHz, 621 mm x 341 mm
                720  736  798  858 hborder 0
                480  489  495  525 vborder 0
               -hsync -vsync 
               VertFreq: 59 Hz, HorFreq: 31468 Hz
Detailed mode: Clock 277.250 MHz, 621 mm x 341 mm
               1920 1968 2000 2080 hborder 0
               2160 2163 2173 2222 vborder 0
               +hsync -vsync 
               VertFreq: 59 Hz, HorFreq: 133293 Hz
Detailed mode: Clock 262.750 MHz, 621 mm x 341 mm
               3840 3888 3920 4000 hborder 0
               2160 2163 2168 2191 vborder 0
               +hsync -vsync 
               VertFreq: 29 Hz, HorFreq: 65687 Hz
Checksum: 0xea (valid)

EDID block does NOT conform to EDID 1.3!
	HDMI VSDB Max TMDS rate is > 340


