
EDID (hex):
00ffffffffffff0026cd6a6630060000
0d1f0103803c22782af615a6564da426
0c5054254b00a9c0e100a940b3009500
d100d1c00101565e00a0a0a029503020
350055502100001a000000ff00313137
39393131333031353834000000fd0037
4c1e781e000a202020202020000000fc
00504c3237393651530a202020200190
02032df14f9005040302011112131406
0715161f230907078301000067030c00
1000383c681a00000101304be6023a80
1871382d40582c450055502100001ed8
4c0070a0a02250182048045550210000
1a9774006ea0a0345017206808555021
00001e00000000000000000000000000
000000000000000000000000000000a8

Extracted contents:
header:          00 ff ff ff ff ff ff 00
serial number:   26 cd 6a 66 30 06 00 00 0d 1f
version:         01 03
basic params:    80 3c 22 78 2a
chroma info:     f6 15 a6 56 4d a4 26 0c 50 54
established:     25 4b 00
standard:        a9 c0 e1 00 a9 40 b3 00 95 00 d1 00 d1 c0 01 01
descriptor 1:    56 5e 00 a0 a0 a0 29 50 30 20 35 00 55 50 21 00 00 1a
descriptor 2:    00 00 00 ff 00 31 31 37 39 39 31 31 33 30 31 35 38 34
descriptor 3:    00 00 00 fd 00 37 4c 1e 78 1e 00 0a 20 20 20 20 20 20
descriptor 4:    00 00 00 fc 00 50 4c 32 37 39 36 51 53 0a 20 20 20 20
extensions:      01
checksum:        90

EDID version: 1.3
Manufacturer: IVM Model 666a Serial Number --
Made in week 13 of 2021
Digital display
Maximum image size: 60 cm x 34 cm
Gamma: 2.20
DPMS levels: Off
RGB color display
First detailed timing is preferred timing
Display x,y Chromaticity:
  Red:   0.6513, 0.3388
  Green: 0.3017, 0.6425
  Blue:  0.1484, 0.0478
  White: 0.3134, 0.3291
Established timings supported:
  640x480@60Hz 4:3 HorFreq: 31469 Hz Clock: 25.175 MHz
  640x480@75Hz 4:3 HorFreq: 37500 Hz Clock: 31.500 MHz
  800x600@60Hz 4:3 HorFreq: 37900 Hz Clock: 40.000 MHz
  800x600@75Hz 4:3 HorFreq: 46900 Hz Clock: 49.500 MHz
  1024x768@60Hz 4:3 HorFreq: 48400 Hz Clock: 65.000 MHz
  1024x768@75Hz 4:3 HorFreq: 60000 Hz Clock: 78.750 MHz
  1280x1024@75Hz 5:4 HorFreq: 80000 Hz Clock: 135.000 MHz
Standard timings supported:
  1600x900@60Hz 16:9
  2048x1280@60Hz 16:10
  1600x1200@60Hz 4:3 HorFreq: 75000 Hz Clock: 162.000 MHz
  1680x1050@60Hz 16:10 HorFreq: 64700 Hz Clock: 119.000 MHz
  1440x900@60Hz 16:10 HorFreq: 55500 Hz Clock: 88.750 MHz
  1920x1200@60Hz 16:10 HorFreq: 74000 Hz Clock: 154.000 MHz
  1920x1080@60Hz 16:9
Detailed mode: Clock 241.500 MHz, 597 mm x 336 mm
               2560 2608 2640 2720 hborder 0
               1440 1443 1448 1481 vborder 0
               +hsync -vsync 
               VertFreq: 59 Hz, HorFreq: 88786 Hz
Serial number: --
Monitor ranges (GTF): 55-76Hz V, 30-120kHz H, max dotclock 300MHz
Monitor name: PL2796QS
Has 1 extension blocks
Checksum: 0x90 (valid)

CTA extension block
Extension version: 3
41 bytes of CTA data
  Video data block
    VIC  16 1920x1080@60Hz 16:9 (native) HorFreq: 67500 Hz Clock: 148.500 MHz
    VIC   5 1920x1080i@60Hz 16:9  HorFreq: 33750 Hz Clock: 74.250 MHz
    VIC   4 1280x720@60Hz 16:9  HorFreq: 45000 Hz Clock: 74.250 MHz
    VIC   3 720x480@60Hz 16:9  HorFreq: 31469 Hz Clock: 27.000 MHz
    VIC   2 720x480@60Hz 4:3  HorFreq: 31469 Hz Clock: 27.000 MHz
    VIC   1 640x480@60Hz 4:3  HorFreq: 31469 Hz Clock: 25.175 MHz
    VIC  17 720x576@50Hz 4:3  HorFreq: 31250 Hz Clock: 27.000 MHz
    VIC  18 720x576@50Hz 16:9  HorFreq: 31250 Hz Clock: 27.000 MHz
    VIC  19 1280x720@50Hz 16:9  HorFreq: 37500 Hz Clock: 74.250 MHz
    VIC  20 1920x1080i@50Hz 16:9  HorFreq: 28125 Hz Clock: 74.250 MHz
    VIC   6 1440x480i@60Hz 4:3  HorFreq: 15734 Hz Clock: 27.000 MHz
    VIC   7 1440x480i@60Hz 16:9  HorFreq: 15734 Hz Clock: 27.000 MHz
    VIC  21 1440x576i@50Hz 4:3  HorFreq: 15625 Hz Clock: 27.000 MHz
    VIC  22 1440x576i@50Hz 16:9  HorFreq: 15625 Hz Clock: 27.000 MHz
    VIC  31 1920x1080@50Hz 16:9  HorFreq: 56250 Hz Clock: 148.500 MHz
  Audio data block
    Linear PCM, max channels 2
      Supported sample rates (kHz): 48 44.1 32
      Supported sample sizes (bits): 24 20 16
  Speaker allocation data block
    Speaker map:
      FL/FR - Front Left/Right
  Vendor-specific data block, OUI 000c03 (HDMI)
    Source physical address 1.0.0.0
    DC_36bit
    DC_30bit
    DC_Y444
    Maximum TMDS clock: 300MHz
  Vendor-specific data block, OUI 00001a
Underscans PC formats by default
Basic audio support
Supports YCbCr 4:4:4
Supports YCbCr 4:2:2
1 native detailed modes
Detailed mode: Clock 148.500 MHz, 597 mm x 336 mm
               1920 2008 2052 2200 hborder 0
               1080 1084 1089 1125 vborder 0
               +hsync +vsync 
               VertFreq: 60 Hz, HorFreq: 67500 Hz
Detailed mode: Clock 196.720 MHz, 597 mm x 336 mm
               2560 2584 2616 2672 hborder 0
               1440 1460 1468 1474 vborder 0
               +hsync -vsync 
               VertFreq: 49 Hz, HorFreq: 73622 Hz
Detailed mode: Clock 298.470 MHz, 597 mm x 336 mm
               2560 2583 2615 2670 hborder 0
               1440 1478 1486 1492 vborder 0
               +hsync +vsync 
               VertFreq: 74 Hz, HorFreq: 111786 Hz
Checksum: 0xa8 (valid)

One or more of the timings is out of range of the Monitor Ranges:
  Vertical Freq: 49 - 75 Hz
  Horizontal Freq: 15625 - 111786 Hz
  Maximum Clock: 298.470 MHz
EDID block does not conform at all!
	Both the serial number and the serial string are set
