edid-decode (hex):

00 ff ff ff ff ff ff 00 51 b8 60 15 00 00 00 00
2c 1e 01 04 a5 22 13 78 07 ee 91 a3 54 4c 99 26
0f 50 54 00 00 00 01 01 01 01 01 01 01 01 01 01
01 01 01 01 01 01 14 34 80 50 70 38 1f 40 2b 20
75 04 58 c2 10 00 00 18 00 00 00 fd 0e 30 69 9b
9b 52 00 0a 20 20 20 20 20 20 00 00 00 10 00 0a
20 20 20 20 20 20 20 20 20 20 20 20 00 00 00 fc
00 54 4c 31 35 36 56 44 58 50 30 32 2d 30 01 ad

70 13 79 00 00 03 01 28 77 38 01 84 7f 07 4f 00
2a 00 1f 00 37 04 1e 00 16 00 04 00 00 00 00 00
00 00 00 00 00 00 00 00 00 00 00 00 00 00 00 00
00 00 00 00 00 00 00 00 00 00 00 00 00 00 00 00
00 00 00 00 00 00 00 00 00 00 00 00 00 00 00 00
00 00 00 00 00 00 00 00 00 00 00 00 00 00 00 00
00 00 00 00 00 00 00 00 00 00 00 00 00 00 00 00
00 00 00 00 00 00 00 00 00 00 00 00 00 00 97 7c

----------------

Block 0, Base EDID:
  EDID Structure Version & Revision: 1.4
  Vendor & Product Identification:
    Manufacturer: TMX
    Model: 5472
    Made in: week 44 of 2020
  Basic Display Parameters & Features:
    Digital display
    Bits per primary color channel: 8
    DisplayPort interface
    Maximum image size: 34 cm x 19 cm
    Gamma: 2.20
    Supported color formats: RGB 4:4:4
    Default (sRGB) color space is primary color space
    First detailed timing includes the native pixel format and preferred refresh rate
    Display is continuous frequency
  Color Characteristics:
    Red  : 0.6396, 0.3300
    Green: 0.2998, 0.5996
    Blue : 0.1503, 0.0595
    White: 0.3125, 0.3291
  Established Timings I & II: none
  Standard Timings: none
  Detailed Timing Descriptors:
    DTD 1:  1920x1080   60.000000 Hz  16:9     66.660 kHz    133.320000 MHz (344 mm x 194 mm)
                 Hfront   43 Hsync  32 Hback    5 Hpol N
                 Vfront   23 Vsync   5 Vback    3 Vpol N
    Display Range Limits:
      Monitor ranges (GTF): 48-360 Hz V, 410-410 kHz H, max dotclock 820 MHz
    Dummy Descriptor:
    Display Product Name: 'TL156VDXP02-0'
  Extension blocks: 1
Checksum: 0xad

----------------

Block 1, DisplayID Extension Block:
  Version: 1.3
  Extension Count: 0
  Display Product Type: Extension Section
  Video Timing Modes Type 1 - Detailed Timings Data Block:
    DTD:  1920x1080  360.000000 Hz  16:9    399.960 kHz    799.920000 MHz (aspect 16:9, no 3D stereo, preferred)
               Hfront   43 Hsync  32 Hback    5 Hpol N
               Vfront   23 Vsync   5 Vback    3 Vpol N
    DTD:     1x1     2500.000000 Hz   1:1      5.000 kHz      0.010000 MHz (aspect 1:1, no 3D stereo)
               Hfront    1 Hsync   1 Hback   -1 Hpol N
               Vfront    1 Vsync   1 Vback   -1 Vpol N
  Checksum: 0x97 (should be 0x83)
Checksum: 0x7c

----------------

Warnings:

Block 0, Base EDID:
  Display Range Limits: GTF support is deprecated in EDID 1.4.
EDID:
  Base EDID: Some timings are out of range of the Monitor Ranges:
    Vertical Freq: 60.000 - 2500.000 Hz (Monitor: 48.000 - 360.000 Hz)
    Horizontal Freq: 5.000 - 399.960 kHz (Monitor: 410.000 - 410.000 kHz)

Failures:

Block 0, Base EDID:
  Dummy Descriptor: Dummy block filled with garbage.
Block 1, DisplayID Extension Block:
  DisplayID Base Block has no product type.
  Video Timing Modes Type 1 - Detailed Timings Data Block: 0 or negative horizontal back porch.
  Video Timing Modes Type 1 - Detailed Timings Data Block: 0 or negative vertical back porch.
  Invalid checksum 0x97 (should be 0x83).
EDID:
  DisplayID: Missing DisplayID Product Identification Data Block.

EDID conformity: FAIL
