edid-decode (hex):

00 ff ff ff ff ff ff 00 06 af 88 11 00 00 00 00
01 11 01 03 80 25 17 78 0a 07 e5 97 57 4f 8c 27
22 50 54 00 00 00 01 01 01 01 01 01 01 01 01 01
01 01 01 01 01 01 54 3d 80 a0 70 b0 17 40 30 20
36 00 6f e5 10 00 00 18 00 00 00 0f 00 00 00 00
00 00 00 00 00 00 00 00 00 20 00 00 00 fe 00 41
55 4f 0a 20 20 20 20 20 20 20 20 20 00 00 00 fe
00 42 31 37 30 55 57 30 31 20 56 31 20 0a 00 96

00 ff ff ff ff ff ff 00 06 af 88 11 00 00 00 00
01 11 01 03 80 25 17 78 0a 07 e5 97 57 4f 8c 27
22 50 54 00 00 00 01 01 01 01 01 01 01 01 01 01
01 01 01 01 01 01 54 3d 80 a0 70 b0 17 40 30 20
36 00 6f e5 10 00 00 18 00 00 00 0f 00 00 00 00
00 00 00 00 00 00 00 00 00 20 00 00 00 fe 00 41
55 4f 0a 20 20 20 20 20 20 20 20 20 00 00 00 fe
00 42 31 37 30 55 57 30 31 20 56 31 20 0a 00 96

----------------

Block 0, Base EDID:
  EDID Structure Version & Revision: 1.3
  Vendor & Product Identification:
    Manufacturer: AUO
    Model: 4488
    Made in: week 1 of 2007
  Basic Display Parameters & Features:
    Digital display
    Maximum image size: 37 cm x 23 cm
    Gamma: 2.20
    RGB color display
    First detailed timing is the preferred timing
  Color Characteristics:
    Red  : 0.5898, 0.3398
    Green: 0.3095, 0.5498
    Blue : 0.1552, 0.1347
    White: 0.3134, 0.3291
  Established Timings I & II: none
  Standard Timings: none
  Detailed Timing Descriptors:
    DTD 1:  1920x1200   61.717718 Hz  16:10    75.481 kHz    157.000000 MHz (367 mm x 229 mm)
                 Hfront   48 Hsync  32 Hback   80 Hpol N
                 Vfront    3 Vsync   6 Vback   14 Vpol N
    Manufacturer-Specified Display Descriptor (0x0f): 00 0f 00 00 00 00 00 00 00 00 00 00 00 00 00 20 '............... '
    Alphanumeric Data String: 'AUO'
    Alphanumeric Data String: 'B170UW01 V1 '
Checksum: 0x96

----------------

Block 1, Unknown EDID Extension Block 0x00:
  00 ff ff ff ff ff ff 00 06 af 88 11 00 00 00 00 '................'
  01 11 01 03 80 25 17 78 0a 07 e5 97 57 4f 8c 27 '.....%.x....WO.''
  22 50 54 00 00 00 01 01 01 01 01 01 01 01 01 01 '"PT.............'
  01 01 01 01 01 01 54 3d 80 a0 70 b0 17 40 30 20 '......T=..p..@0 '
  36 00 6f e5 10 00 00 18 00 00 00 0f 00 00 00 00 '6.o.............'
  00 00 00 00 00 00 00 00 00 20 00 00 00 fe 00 41 '......... .....A'
  55 4f 0a 20 20 20 20 20 20 20 20 20 00 00 00 fe 'UO.         ....'
  00 42 31 37 30 55 57 30 31 20 56 31 20 0a 00 96 '.B170UW01 V1 ...'
Checksum: 0x96

----------------

Failures:

Block 0, Base EDID:
  Alphanumeric Data String: One or more trailing spaces.
  Missing Display Product Name.
  Missing Display Range Limits Descriptor.
Block 1, Base EDID:
  Unknown Extension Block.
EDID:
  Base EDID: EDID specified 0 extension block(s), but found 1 extension block(s).

EDID conformity: FAIL
