
EDID (hex):
00ffffffffffff0006af881100000000
01110103802517780a87f594574f8c27
27505400000001010101010101010101
010101010101543d80b470b02e403020
36006fe5100000180000000f00000000
00000000000000000020000000fe0041
554f0a202020202020202020000000fe
004231373055573031205631200a00d9

Extracted contents:
header:          00 ff ff ff ff ff ff 00
serial number:   06 af 88 11 00 00 00 00 01 11
version:         01 03
basic params:    80 25 17 78 0a
chroma info:     87 f5 94 57 4f 8c 27 27 50 54
established:     00 00 00
standard:        01 01 01 01 01 01 01 01 01 01 01 01 01 01 01 01
descriptor 1:    54 3d 80 b4 70 b0 2e 40 30 20 36 00 6f e5 10 00 00 18
descriptor 2:    00 00 00 0f 00 00 00 00 00 00 00 00 00 00 00 00 00 20
descriptor 3:    00 00 00 fe 00 41 55 4f 0a 20 20 20 20 20 20 20 20 20
descriptor 4:    00 00 00 fe 00 42 31 37 30 55 57 30 31 20 56 31 20 0a
extensions:      00
checksum:        d9

EDID version: 1.3
Manufacturer: AUO Model 1188 Serial Number --
Made in week 1 of 2007
Digital display
Maximum image size: 37 cm x 23 cm
Gamma: 2.20
RGB color display
First detailed timing is preferred timing
Display x,y Chromaticity:
  Red:   0.5800, 0.3398
  Green: 0.3095, 0.5498
  Blue:  0.1552, 0.1552
  White: 0.3134, 0.3291
Established timings supported:
Standard timings supported:
Detailed mode: Clock 157.000 MHz, 367 mm x 229 mm
               1920 1968 2000 2100 hborder 0
               1200 1203 1209 1246 vborder 0
               -hsync -vsync 
               VertFreq: 60 Hz, HorFreq: 74761 Hz
Manufacturer-specified data, tag 15
ASCII string: AUO
ASCII string: B170UW01 V1 
Checksum: 0xd9 (valid)
EDID block does NOT conform to EDID 1.3!
	Missing name descriptor
	Missing monitor ranges
