edid-decode (hex):

00 ff ff ff ff ff ff 00 04 72 a1 ad 03 be 20 73
20 11 01 03 08 2f 1e 78 ea de 95 a3 54 4c 99 26
0f 50 54 bf ef 90 a9 40 71 4f 81 40 8b c0 95 00
95 0f 90 40 01 01 21 39 90 30 62 1a 27 40 68 b0
36 00 da 28 11 00 00 19 00 00 00 fd 00 38 4d 1f
54 11 00 0a 20 20 20 20 20 20 00 00 00 ff 00 4c
41 31 30 43 30 36 31 34 30 33 31 0a 00 00 00 fc
00 41 4c 32 32 31 36 57 0a 20 20 20 20 20 00 a7

00 ff ff ff ff ff ff 00 04 72 a1 ad 03 be 20 73
20 11 01 03 08 2f 1e 78 ea de 95 a3 54 4c 99 26
0f 50 54 bf ef 90 a9 40 71 4f 81 40 8b c0 95 00
95 0f 90 40 01 01 21 39 90 30 62 1a 27 40 68 b0
36 00 da 28 11 00 00 19 00 00 00 fd 00 38 4d 1f
54 11 00 0a 20 20 20 20 20 20 00 00 00 ff 00 4c
41 31 30 43 30 36 31 34 30 33 31 0a 00 00 00 fc
00 41 4c 32 32 31 36 57 0a 20 20 20 20 20 00 a7

----------------

Block 0, Base EDID:
  EDID Structure Version & Revision: 1.3
  Vendor & Product Identification:
    Manufacturer: ACR
    Model: 44449
    Serial Number: ...
    Made in: week 32 of 2007
  Basic Display Parameters & Features:
    Analog display
    Signal Level Standard: 0.700 : 0.300 : 1.000 V p-p
    Blank level equals black level
    Sync: Separate
    Maximum image size: 47 cm x 30 cm
    Gamma: 2.20
    DPMS levels: Standby Suspend Off
    RGB color display
    First detailed timing is the preferred timing
  Color Characteristics:
    Red  : 0.6396, 0.3291
    Green: 0.2998, 0.5996
    Blue : 0.1503, 0.0595
    White: 0.3134, 0.3291
  Established Timings I & II:
    IBM     :   720x400    70.081663 Hz   9:5     31.467 kHz     28.320000 MHz
    DMT 0x04:   640x480    59.940476 Hz   4:3     31.469 kHz     25.175000 MHz
    Apple   :   640x480    66.666667 Hz   4:3     35.000 kHz     30.240000 MHz
    DMT 0x05:   640x480    72.808802 Hz   4:3     37.861 kHz     31.500000 MHz
    DMT 0x06:   640x480    75.000000 Hz   4:3     37.500 kHz     31.500000 MHz
    DMT 0x08:   800x600    56.250000 Hz   4:3     35.156 kHz     36.000000 MHz
    DMT 0x09:   800x600    60.316541 Hz   4:3     37.879 kHz     40.000000 MHz
    DMT 0x0a:   800x600    72.187572 Hz   4:3     48.077 kHz     50.000000 MHz
    DMT 0x0b:   800x600    75.000000 Hz   4:3     46.875 kHz     49.500000 MHz
    Apple   :   832x624    74.551266 Hz   4:3     49.726 kHz     57.284000 MHz
    DMT 0x10:  1024x768    60.003840 Hz   4:3     48.363 kHz     65.000000 MHz
    DMT 0x11:  1024x768    70.069359 Hz   4:3     56.476 kHz     75.000000 MHz
    DMT 0x12:  1024x768    75.028582 Hz   4:3     60.023 kHz     78.750000 MHz
    DMT 0x24:  1280x1024   75.024675 Hz   5:4     79.976 kHz    135.000000 MHz
    Apple   :  1152x870    75.061550 Hz 192:145   68.681 kHz    100.000000 MHz
  Standard Timings:
    DMT 0x33:  1600x1200   60.000000 Hz   4:3     75.000 kHz    162.000000 MHz
    DMT 0x15:  1152x864    75.000000 Hz   4:3     67.500 kHz    108.000000 MHz
    DMT 0x20:  1280x960    60.000000 Hz   4:3     60.000 kHz    108.000000 MHz
    GTF     :  1360x765    60.000341 Hz  16:9     47.520 kHz     84.396000 MHz
    DMT 0x2f:  1440x900    59.887445 Hz  16:10    55.935 kHz    106.500000 MHz
    DMT 0x30:  1440x900    74.984427 Hz  16:10    70.635 kHz    136.750000 MHz
    DMT 0x2a:  1400x1050   59.978442 Hz   4:3     65.317 kHz    121.750000 MHz
  Detailed Timing Descriptors:
    DTD 1:  1680x1050   59.954250 Hz  16:10    65.290 kHz    146.250000 MHz (474 mm x 296 mm)
                 Hfront  104 Hsync 176 Hback  280 Hpol N
                 Vfront    3 Vsync   6 Vback   30 Vpol N
    Display Range Limits:
      Monitor ranges (GTF): 56-77 Hz V, 31-84 kHz H, max dotclock 170 MHz
    Display Product Serial Number: ...
    Display Product Name: 'AL2216W'
Checksum: 0xa7

----------------

Block 1, Unknown EDID Extension Block 0x00:
  00 ff ff ff ff ff ff 00 04 72 a1 ad 03 be 20 73 '.........r.... s'
  20 11 01 03 08 2f 1e 78 ea de 95 a3 54 4c 99 26 ' ..../.x....TL.&'
  0f 50 54 bf ef 90 a9 40 71 4f 81 40 8b c0 95 00 '.PT....@qO.@....'
  95 0f 90 40 01 01 21 39 90 30 62 1a 27 40 68 b0 '...@..!9.0b.'@h.'
  36 00 da 28 11 00 00 19 00 00 00 fd 00 38 4d 1f '6..(.........8M.'
  54 11 00 0a 20 20 20 20 20 20 00 00 00 ff 00 4c 'T...      .....L'
  41 31 30 43 30 36 31 34 30 33 31 0a 00 00 00 fc 'A10C0614031.....'
  00 41 4c 32 32 31 36 57 0a 20 20 20 20 20 00 a7 '.AL2216W.     ..'
Checksum: 0xa7

----------------

Warnings:

Block 0, Base EDID:
  Standard Timings: Standard Timing 1360x765 has a dubious odd vertical resolution.
  Detailed Timing Descriptor #1: DTD is similar but not identical to DMT 0x3a.

Failures:

Block 1, Base EDID:
  Unknown Extension Block.
EDID:
  Base EDID: EDID specified 0 extension block(s), but found 1 extension block(s).

EDID conformity: FAIL
