edid-decode (hex):

00 ff ff ff ff ff ff 00 05 e3 10 24 01 01 01 01
00 14 01 03 68 34 1d 78 2a ee d5 a5 55 48 9b 26
12 50 54 af ce 00 81 c0 81 80 95 00 b3 00 01 01
01 01 01 01 01 01 02 3a 80 18 71 38 2d 40 58 2c
45 00 09 25 21 00 00 1e a9 1a 00 a0 50 00 16 30
30 20 37 00 09 25 21 00 00 1a 00 00 00 fd 00 37
4c 1e 4c 0f 00 0a 20 20 20 20 20 20 00 00 00 fc
00 4c 45 32 34 48 30 36 37 0a 20 20 20 20 00 ba

----------------

Block 0, Base EDID:
  EDID Structure Version & Revision: 1.3
  Vendor & Product Identification:
    Manufacturer: AOC
    Model: 9232
    Serial Number: ...
    Made in: 2010
  Basic Display Parameters & Features:
    Analog display
    Signal Level Standard: 0.700 : 0.000 : 0.700 V p-p
    Blank level equals black level
    Sync: Separate
    Maximum image size: 52 cm x 29 cm
    Gamma: 2.20
    DPMS levels: Off
    RGB color display
    First detailed timing is the preferred timing
  Color Characteristics:
    Red  : 0.6474, 0.3339
    Green: 0.2841, 0.6074
    Blue : 0.1513, 0.0712
    White: 0.3134, 0.3291
  Established Timings I & II:
    IBM     :   720x400    70.081663 Hz   9:5     31.467 kHz     28.320000 MHz
    DMT 0x04:   640x480    59.940476 Hz   4:3     31.469 kHz     25.175000 MHz
    DMT 0x05:   640x480    72.808802 Hz   4:3     37.861 kHz     31.500000 MHz
    DMT 0x06:   640x480    75.000000 Hz   4:3     37.500 kHz     31.500000 MHz
    DMT 0x08:   800x600    56.250000 Hz   4:3     35.156 kHz     36.000000 MHz
    DMT 0x09:   800x600    60.316541 Hz   4:3     37.879 kHz     40.000000 MHz
    DMT 0x0a:   800x600    72.187572 Hz   4:3     48.077 kHz     50.000000 MHz
    DMT 0x0b:   800x600    75.000000 Hz   4:3     46.875 kHz     49.500000 MHz
    DMT 0x10:  1024x768    60.003840 Hz   4:3     48.363 kHz     65.000000 MHz
    DMT 0x11:  1024x768    70.069359 Hz   4:3     56.476 kHz     75.000000 MHz
    DMT 0x12:  1024x768    75.028582 Hz   4:3     60.023 kHz     78.750000 MHz
  Standard Timings:
    DMT 0x55:  1280x720    60.000000 Hz  16:9     45.000 kHz     74.250000 MHz
    DMT 0x23:  1280x1024   60.019740 Hz   5:4     63.981 kHz    108.000000 MHz
    DMT 0x2f:  1440x900    59.887445 Hz  16:10    55.935 kHz    106.500000 MHz
    DMT 0x3a:  1680x1050   59.954250 Hz  16:10    65.290 kHz    146.250000 MHz
  Detailed Timing Descriptors:
    DTD 1:  1920x1080   60.000000 Hz  16:9     67.500 kHz    148.500000 MHz (521 mm x 293 mm)
                 Hfront   88 Hsync  44 Hback  148 Hpol P
                 Vfront    4 Vsync   5 Vback   36 Vpol P
    DTD 2:  1280x768    59.994726 Hz   5:3     47.396 kHz     68.250000 MHz (521 mm x 293 mm)
                 Hfront   48 Hsync  32 Hback   80 Hpol P
                 Vfront    3 Vsync   7 Vback   12 Vpol N
    Display Range Limits:
      Monitor ranges (GTF): 55-76 Hz V, 30-76 kHz H, max dotclock 150 MHz
    Display Product Name: 'LE24H067'
Checksum: 0xba

----------------

EDID conformity: PASS
