
EDID (hex):
00ffffffffffff000dae611300000000
07180104a51d117802ce85a3574e9d26
12505400000001010101010101010101
010101010101363680a0703820402e1e
240025a510000018242480a070382040
2e1e240025a510000018000000fe0043
4d4e0a202020202020202020000000fe
004e3133334853452d4541330a2000a1

Extracted contents:
header:          00 ff ff ff ff ff ff 00
serial number:   0d ae 61 13 00 00 00 00 07 18
version:         01 04
basic params:    a5 1d 11 78 02
chroma info:     ce 85 a3 57 4e 9d 26 12 50 54
established:     00 00 00
standard:        01 01 01 01 01 01 01 01 01 01 01 01 01 01 01 01
descriptor 1:    36 36 80 a0 70 38 20 40 2e 1e 24 00 25 a5 10 00 00 18
descriptor 2:    24 24 80 a0 70 38 20 40 2e 1e 24 00 25 a5 10 00 00 18
descriptor 3:    00 00 00 fe 00 43 4d 4e 0a 20 20 20 20 20 20 20 20 20
descriptor 4:    00 00 00 fe 00 4e 31 33 33 48 53 45 2d 45 41 33 0a 20
extensions:      00
checksum:        a1

EDID version: 1.4
Manufacturer: CMN Model 1361 Serial Number --
Made in week 7 of 2014
Digital display
8 bits per primary color channel
DisplayPort interface
Maximum image size: 29 cm x 17 cm
Gamma: 2.20
Supported color formats: RGB 4:4:4
First detailed timing includes the native pixel format and preferred refresh rate
Display x,y Chromaticity:
  Red:   0.6396, 0.3398
  Green: 0.3076, 0.6152
  Blue:  0.1503, 0.0703
  White: 0.3134, 0.3291
Established timings supported:
Standard timings supported:
Detailed mode: Clock 138.780 MHz, 293 mm x 165 mm
               1920 1966 1996 2080 hborder 0
               1080 1082 1086 1112 vborder 0
               -hsync -vsync 
               VertFreq: 60 Hz, HorFreq: 66721 Hz
Detailed mode: Clock 92.520 MHz, 293 mm x 165 mm
               1920 1966 1996 2080 hborder 0
               1080 1082 1086 1112 vborder 0
               -hsync -vsync 
               VertFreq: 40 Hz, HorFreq: 44480 Hz
ASCII string: CMN
ASCII string: N133HSE-EA3
Checksum: 0xa1 (valid)
EDID block does NOT conform to EDID 1.4!
	Missing name descriptor
	Missing monitor ranges
