
EDID (hex):
00ffffffffffff002264156400000000
351501040a392078ead858a354479726
0f474a230800d1c0b300a94095009040
818081400101023a801871382d40582c
450040442100001e000000ff00313233
34353637383930313233000000fd0038
3c1e4b11000a202020202020000000fc
00484c3236394450420a202020200049

Extracted contents:
header:          00 ff ff ff ff ff ff 00
serial number:   22 64 15 64 00 00 00 00 35 15
version:         01 04
basic params:    0a 39 20 78 ea
chroma info:     d8 58 a3 54 47 97 26 0f 47 4a
established:     23 08 00
standard:        d1 c0 b3 00 a9 40 95 00 90 40 81 80 81 40 01 01
descriptor 1:    02 3a 80 18 71 38 2d 40 58 2c 45 00 40 44 21 00 00 1e
descriptor 2:    00 00 00 ff 00 31 32 33 34 35 36 37 38 39 30 31 32 33
descriptor 3:    00 00 00 fd 00 38 3c 1e 4b 11 00 0a 20 20 20 20 20 20
descriptor 4:    00 00 00 fc 00 48 4c 32 36 39 44 50 42 0a 20 20 20 20
extensions:      00
checksum:        49

EDID version: 1.4
Manufacturer: HSD Model 6415 Serial Number --
Made in week 53 of 2011
Analog display, Input voltage level: 0.7/0.3 V
Blank level equals black level
Sync: Separate SyncOnGreen 
Maximum image size: 57 cm x 32 cm
Gamma: 2.20
DPMS levels: Standby Suspend Off
RGB color display
First detailed timing includes the native pixel format and preferred refresh rate
Display x,y Chromaticity:
  Red:   0.6396, 0.3291
  Green: 0.2792, 0.5898
  Blue:  0.1494, 0.0595
  White: 0.2792, 0.2890
Established timings supported:
  640x480@60Hz 4:3 HorFreq: 31469 Hz Clock: 25.175 MHz
  800x600@56Hz 4:3 HorFreq: 35200 Hz Clock: 36.000 MHz
  800x600@60Hz 4:3 HorFreq: 37900 Hz Clock: 40.000 MHz
  1024x768@60Hz 4:3 HorFreq: 48400 Hz Clock: 65.000 MHz
Standard timings supported:
  1920x1080@60Hz 16:9
  1680x1050@60Hz 16:10 HorFreq: 64700 Hz Clock: 119.000 MHz
  1600x1200@60Hz 4:3 HorFreq: 75000 Hz Clock: 162.000 MHz
  1440x900@60Hz 16:10 HorFreq: 55500 Hz Clock: 88.750 MHz
  1400x1050@60Hz 4:3 HorFreq: 64700 Hz Clock: 101.000 MHz
  1280x1024@60Hz 5:4 HorFreq: 64000 Hz Clock: 108.000 MHz
  1280x960@60Hz 4:3 HorFreq: 60000 Hz Clock: 108.000 MHz
Detailed mode: Clock 148.500 MHz, 576 mm x 324 mm
               1920 2008 2052 2200 hborder 0
               1080 1084 1089 1125 vborder 0
               +hsync +vsync 
               VertFreq: 60 Hz, HorFreq: 67500 Hz
Serial number: --
Monitor ranges (GTF): 56-60Hz V, 30-75kHz H, max dotclock 170MHz
Monitor name: HL269DPB
Checksum: 0x49 (valid)
