edid-decode (hex):

00 ff ff ff ff ff ff 00 4c 2d 56 72 48 5a 4b 30
1c 20 01 04 b5 46 28 78 3b 4e d5 ae 4e 45 aa 27
0e 50 54 21 08 00 81 c0 81 00 81 80 95 00 a9 c0
b3 00 01 01 01 01 08 e8 00 30 f2 70 5a 80 b0 58
8a 00 b9 88 21 00 00 1e 00 00 00 fd 0c 44 f0 ff
ff ee 01 0a 20 20 20 20 20 20 00 00 00 fc 00 4f
64 79 73 73 65 79 20 47 38 0a 20 20 00 00 00 ff
00 48 4e 54 54 37 30 30 32 34 38 0a 20 20 02 14

02 03 34 f0 48 61 5f 10 1f 3f 04 03 76 23 09 07
07 83 01 00 00 e3 05 c0 00 6d 1a 00 00 02 0f 44
f0 00 04 8b 06 5a 0a e6 06 05 01 8b 5a 00 e5 01
8b 84 90 79 56 5e 00 a0 a0 a0 29 50 30 20 35 00
b9 88 21 00 00 1a 6f c2 00 a0 a0 a0 55 50 30 20
35 00 b9 88 21 00 00 1a 02 3a 80 18 71 38 2d 40
58 2c 45 00 b9 88 21 00 00 1e 00 00 00 00 00 00
00 00 00 00 00 00 00 00 00 00 00 00 00 00 00 ec

70 12 79 00 00 03 01 64 1f a0 03 84 ff 0e 2f 02
f7 80 1f 00 6f 08 59 00 02 00 04 00 0f d0 01 84
ff 0e 2f 02 af 80 57 00 6f 08 59 00 07 80 09 00
af 94 01 04 ff 09 3f 01 7f 80 1f 00 9f 05 3a 00
02 00 04 00 33 e9 00 04 7f 07 17 01 6b 80 1f 00
37 04 32 00 02 00 04 00 03 74 00 04 7f 07 17 01
57 80 2b 00 37 04 2c 00 03 80 04 00 00 00 00 00
00 00 00 00 00 00 00 00 00 00 00 00 00 00 bf 90

00 ff ff ff ff ff ff 00 4c 2d 56 72 48 5a 4b 30
1c 20 01 04 b5 46 28 78 3b 4e d5 ae 4e 45 aa 27
0e 50 54 21 08 00 81 c0 81 00 81 80 95 00 a9 c0
b3 00 01 01 01 01 08 e8 00 30 f2 70 5a 80 b0 58
8a 00 b9 88 21 00 00 1e 00 00 00 fd 0c 44 f0 ff
ff ee 01 0a 20 20 20 20 20 20 00 00 00 fc 00 4f
64 79 73 73 65 79 20 47 38 0a 20 20 00 00 00 ff
00 48 4e 54 54 37 30 30 32 34 38 0a 20 20 02 14

02 03 34 f0 48 61 5f 10 1f 3f 04 03 76 23 09 07
07 83 01 00 00 e3 05 c0 00 6d 1a 00 00 02 0f 44
f0 00 04 8b 06 5a 0a e6 06 05 01 8b 5a 00 e5 01
8b 84 90 79 56 5e 00 a0 a0 a0 29 50 30 20 35 00
b9 88 21 00 00 1a 6f c2 00 a0 a0 a0 55 50 30 20
35 00 b9 88 21 00 00 1a 02 3a 80 18 71 38 2d 40
58 2c 45 00 b9 88 21 00 00 1e 00 00 00 00 00 00
00 00 00 00 00 00 00 00 00 00 00 00 00 00 00 ec

70 12 79 00 00 03 01 64 1f a0 03 84 ff 0e 2f 02
f7 80 1f 00 6f 08 59 00 02 00 04 00 0f d0 01 84
ff 0e 2f 02 af 80 57 00 6f 08 59 00 07 80 09 00
af 94 01 04 ff 09 3f 01 7f 80 1f 00 9f 05 3a 00
02 00 04 00 33 e9 00 04 7f 07 17 01 6b 80 1f 00
37 04 32 00 02 00 04 00 03 74 00 04 7f 07 17 01
57 80 2b 00 37 04 2c 00 03 80 04 00 00 00 00 00
00 00 00 00 00 00 00 00 00 00 00 00 00 00 bf 90

----------------

Block 0, Base EDID:
  EDID Structure Version & Revision: 1.4
  Vendor & Product Identification:
    Manufacturer: SAM
    Model: 29270
    Serial Number: ...
    Made in: week 28 of 2022
  Basic Display Parameters & Features:
    Digital display
    Bits per primary color channel: 10
    DisplayPort interface
    Maximum image size: 70 cm x 40 cm
    Gamma: 2.20
    DPMS levels: Off
    Supported color formats: RGB 4:4:4, YCrCb 4:4:4, YCrCb 4:2:2
    First detailed timing includes the native pixel format and preferred refresh rate
    Display is continuous frequency
  Color Characteristics:
    Red  : 0.6806, 0.3046
    Green: 0.2724, 0.6660
    Blue : 0.1552, 0.0556
    White: 0.3134, 0.3291
  Established Timings I & II:
    DMT 0x04:   640x480    59.940476 Hz   4:3     31.469 kHz     25.175000 MHz
    DMT 0x09:   800x600    60.316541 Hz   4:3     37.879 kHz     40.000000 MHz
    DMT 0x10:  1024x768    60.003840 Hz   4:3     48.363 kHz     65.000000 MHz
  Standard Timings:
    DMT 0x55:  1280x720    60.000000 Hz  16:9     45.000 kHz     74.250000 MHz
    DMT 0x1c:  1280x800    59.810326 Hz  16:10    49.702 kHz     83.500000 MHz
    DMT 0x23:  1280x1024   60.019740 Hz   5:4     63.981 kHz    108.000000 MHz
    DMT 0x2f:  1440x900    59.887445 Hz  16:10    55.935 kHz    106.500000 MHz
    DMT 0x53:  1600x900    60.000000 Hz  16:9     60.000 kHz    108.000000 MHz (RB)
    DMT 0x3a:  1680x1050   59.954250 Hz  16:10    65.290 kHz    146.250000 MHz
  Detailed Timing Descriptors:
    DTD 1:  3840x2160   60.000000 Hz  16:9    135.000 kHz    594.000000 MHz (697 mm x 392 mm)
                 Hfront  176 Hsync  88 Hback  296 Hpol P
                 Vfront    8 Vsync  10 Vback   72 Vpol P
    Display Range Limits:
      Monitor ranges (Bare Limits): 68-240 Hz V, 510-510 kHz H, max dotclock 2380 MHz
    Display Product Name: 'Odyssey G8'
    Display Product Serial Number: ...
  Extension blocks: 2
Checksum: 0x14

----------------

Block 1, CTA-861 Extension Block:
  Revision: 3
  Underscans IT Video Formats by default
  Basic audio support
  Supports YCbCr 4:4:4
  Supports YCbCr 4:2:2
  Native detailed modes: 0
  Video Data Block:
    VIC  97:  3840x2160   60.000000 Hz  16:9    135.000 kHz    594.000000 MHz
    VIC  95:  3840x2160   30.000000 Hz  16:9     67.500 kHz    297.000000 MHz
    VIC  16:  1920x1080   60.000000 Hz  16:9     67.500 kHz    148.500000 MHz
    VIC  31:  1920x1080   50.000000 Hz  16:9     56.250 kHz    148.500000 MHz
    VIC  63:  1920x1080  120.000000 Hz  16:9    135.000 kHz    297.000000 MHz
    VIC   4:  1280x720    60.000000 Hz  16:9     45.000 kHz     74.250000 MHz
    VIC   3:   720x480    59.940060 Hz  16:9     31.469 kHz     27.000000 MHz
    VIC 118:  3840x2160  120.000000 Hz  16:9    270.000 kHz   1188.000000 MHz
  Audio Data Block:
    Linear PCM:
      Max channels: 2
      Supported sample rates (kHz): 48 44.1 32
      Supported sample sizes (bits): 24 20 16
  Speaker Allocation Data Block:
    FL/FR - Front Left/Right
  Colorimetry Data Block:
    BT2020YCC
    BT2020RGB
  Vendor-Specific Data Block (AMD), OUI 00-00-1A:
    Version: 2.15
    Minimum Refresh Rate: 68 Hz
    Maximum Refresh Rate: 240 Hz
    Flags 1.x: 0x00
    Flags 2.x: 0x04
    Maximum luminance: 139 (1015.241 cd/m^2)
    Minimum luminance: 6 (0.006 cd/m^2)
    Maximum luminance (without local dimming): 90 (351.250 cd/m^2)
    Minimum luminance (without local dimming): 10 (0.005 cd/m^2)
  HDR Static Metadata Data Block:
    Electro optical transfer functions:
      Traditional gamma - SDR luminance range
      SMPTE ST2084
    Supported static metadata descriptors:
      Static metadata type 1
    Desired content max luminance: 139 (1015.241 cd/m^2)
    Desired content max frame-average luminance: 90 (351.250 cd/m^2)
    Desired content min luminance: 0 (0.000 cd/m^2)
  Vendor-Specific Video Data Block (HDR10+), OUI 90-84-8B:
    Application Version: 121
  Detailed Timing Descriptors:
    DTD 2:  2560x1440   59.950550 Hz  16:9     88.787 kHz    241.500000 MHz (697 mm x 392 mm)
                 Hfront   48 Hsync  32 Hback   80 Hpol P
                 Vfront    3 Vsync   5 Vback   33 Vpol N
    DTD 3:  2560x1440  119.997589 Hz  16:9    182.996 kHz    497.750000 MHz (697 mm x 392 mm)
                 Hfront   48 Hsync  32 Hback   80 Hpol P
                 Vfront    3 Vsync   5 Vback   77 Vpol N
    DTD 4:  1920x1080   60.000000 Hz  16:9     67.500 kHz    148.500000 MHz (697 mm x 392 mm)
                 Hfront   88 Hsync  44 Hback  148 Hpol P
                 Vfront    4 Vsync   5 Vback   36 Vpol P
Checksum: 0xec  Unused space in Extension Block: 21 bytes

----------------

Block 2, DisplayID Extension Block:
  Version: 1.2
  Extension Count: 0
  Display Product Type: Extension Section
  Video Timing Modes Type 1 - Detailed Timings Data Block:
    DTD:  3840x2160  240.000000 Hz  16:9    540.000 kHz   2376.000000 MHz (aspect 16:9, no 3D stereo, preferred)
               Hfront  248 Hsync  32 Hback  280 Hpol P
               Vfront    3 Vsync   5 Vback   82 Vpol N
    DTD:  3840x2160  120.000000 Hz  16:9    270.000 kHz   1188.000000 MHz (aspect 16:9, no 3D stereo, preferred)
               Hfront  176 Hsync  88 Hback  296 Hpol P
               Vfront    8 Vsync  10 Vback   72 Vpol P
    DTD:  2560x1440  239.974798 Hz  16:9    359.722 kHz   1036.000000 MHz (aspect 16:9, no 3D stereo)
               Hfront  128 Hsync  32 Hback  160 Hpol P
               Vfront    3 Vsync   5 Vback   51 Vpol N
    DTD:  1920x1080  239.932481 Hz  16:9    271.364 kHz    597.000000 MHz (aspect 16:9, no 3D stereo)
               Hfront  108 Hsync  32 Hback  140 Hpol P
               Vfront    3 Vsync   5 Vback   43 Vpol N
    DTD:  1920x1080  120.000000 Hz  16:9    135.000 kHz    297.000000 MHz (aspect 16:9, no 3D stereo)
               Hfront   88 Hsync  44 Hback  148 Hpol P
               Vfront    4 Vsync   5 Vback   36 Vpol P
  Checksum: 0xbf
Checksum: 0x90

----------------

Block 3, Unknown EDID Extension Block 0x00:
  00 ff ff ff ff ff ff 00 4c 2d 56 72 48 5a 4b 30 '........L-VrHZK0'
  1c 20 01 04 b5 46 28 78 3b 4e d5 ae 4e 45 aa 27 '. ...F(x;N..NE.''
  0e 50 54 21 08 00 81 c0 81 00 81 80 95 00 a9 c0 '.PT!............'
  b3 00 01 01 01 01 08 e8 00 30 f2 70 5a 80 b0 58 '.........0.pZ..X'
  8a 00 b9 88 21 00 00 1e 00 00 00 fd 0c 44 f0 ff '....!........D..'
  ff ee 01 0a 20 20 20 20 20 20 00 00 00 fc 00 4f '....      .....O'
  64 79 73 73 65 79 20 47 38 0a 20 20 00 00 00 ff 'dyssey G8.  ....'
  00 48 4e 54 54 37 30 30 32 34 38 0a 20 20 02 14 '.HNTT700248.  ..'
Checksum: 0x14

----------------

Block 4, CTA-861 Extension Block:
  Revision: 3
  Underscans IT Video Formats by default
  Basic audio support
  Supports YCbCr 4:4:4
  Supports YCbCr 4:2:2
  Native detailed modes: 0
  Video Data Block:
    VIC  97:  3840x2160   60.000000 Hz  16:9    135.000 kHz    594.000000 MHz
    VIC  95:  3840x2160   30.000000 Hz  16:9     67.500 kHz    297.000000 MHz
    VIC  16:  1920x1080   60.000000 Hz  16:9     67.500 kHz    148.500000 MHz
    VIC  31:  1920x1080   50.000000 Hz  16:9     56.250 kHz    148.500000 MHz
    VIC  63:  1920x1080  120.000000 Hz  16:9    135.000 kHz    297.000000 MHz
    VIC   4:  1280x720    60.000000 Hz  16:9     45.000 kHz     74.250000 MHz
    VIC   3:   720x480    59.940060 Hz  16:9     31.469 kHz     27.000000 MHz
    VIC 118:  3840x2160  120.000000 Hz  16:9    270.000 kHz   1188.000000 MHz
  Audio Data Block:
    Linear PCM:
      Max channels: 2
      Supported sample rates (kHz): 48 44.1 32
      Supported sample sizes (bits): 24 20 16
  Speaker Allocation Data Block:
    FL/FR - Front Left/Right
  Colorimetry Data Block:
    BT2020YCC
    BT2020RGB
  Vendor-Specific Data Block (AMD), OUI 00-00-1A:
    Version: 2.15
    Minimum Refresh Rate: 68 Hz
    Maximum Refresh Rate: 240 Hz
    Flags 1.x: 0x00
    Flags 2.x: 0x04
    Maximum luminance: 139 (1015.241 cd/m^2)
    Minimum luminance: 6 (0.006 cd/m^2)
    Maximum luminance (without local dimming): 90 (351.250 cd/m^2)
    Minimum luminance (without local dimming): 10 (0.005 cd/m^2)
  HDR Static Metadata Data Block:
    Electro optical transfer functions:
      Traditional gamma - SDR luminance range
      SMPTE ST2084
    Supported static metadata descriptors:
      Static metadata type 1
    Desired content max luminance: 139 (1015.241 cd/m^2)
    Desired content max frame-average luminance: 90 (351.250 cd/m^2)
    Desired content min luminance: 0 (0.000 cd/m^2)
  Vendor-Specific Video Data Block (HDR10+), OUI 90-84-8B:
    Application Version: 121
  Detailed Timing Descriptors:
    DTD 5:  2560x1440   59.950550 Hz  16:9     88.787 kHz    241.500000 MHz (697 mm x 392 mm)
                 Hfront   48 Hsync  32 Hback   80 Hpol P
                 Vfront    3 Vsync   5 Vback   33 Vpol N
    DTD 6:  2560x1440  119.997589 Hz  16:9    182.996 kHz    497.750000 MHz (697 mm x 392 mm)
                 Hfront   48 Hsync  32 Hback   80 Hpol P
                 Vfront    3 Vsync   5 Vback   77 Vpol N
    DTD 7:  1920x1080   60.000000 Hz  16:9     67.500 kHz    148.500000 MHz (697 mm x 392 mm)
                 Hfront   88 Hsync  44 Hback  148 Hpol P
                 Vfront    4 Vsync   5 Vback   36 Vpol P
Checksum: 0xec  Unused space in Extension Block: 21 bytes

----------------

Block 5, DisplayID Extension Block:
  Version: 1.2
  Extension Count: 0
  Video Timing Modes Type 1 - Detailed Timings Data Block:
    DTD:  3840x2160  240.000000 Hz  16:9    540.000 kHz   2376.000000 MHz (aspect 16:9, no 3D stereo, preferred)
               Hfront  248 Hsync  32 Hback  280 Hpol P
               Vfront    3 Vsync   5 Vback   82 Vpol N
    DTD:  3840x2160  120.000000 Hz  16:9    270.000 kHz   1188.000000 MHz (aspect 16:9, no 3D stereo, preferred)
               Hfront  176 Hsync  88 Hback  296 Hpol P
               Vfront    8 Vsync  10 Vback   72 Vpol P
    DTD:  2560x1440  239.974798 Hz  16:9    359.722 kHz   1036.000000 MHz (aspect 16:9, no 3D stereo)
               Hfront  128 Hsync  32 Hback  160 Hpol P
               Vfront    3 Vsync   5 Vback   51 Vpol N
    DTD:  1920x1080  239.932481 Hz  16:9    271.364 kHz    597.000000 MHz (aspect 16:9, no 3D stereo)
               Hfront  108 Hsync  32 Hback  140 Hpol P
               Vfront    3 Vsync   5 Vback   43 Vpol N
    DTD:  1920x1080  120.000000 Hz  16:9    135.000 kHz    297.000000 MHz (aspect 16:9, no 3D stereo)
               Hfront   88 Hsync  44 Hback  148 Hpol P
               Vfront    4 Vsync   5 Vback   36 Vpol P
  Checksum: 0xbf
Checksum: 0x90

----------------

Warnings:

Block 1, CTA-861 Extension Block:
  Video Data Block: For improved preferred timing interoperability, set 'Native detailed modes' to 1.
  Colorimetry Data Block: Set the sRGB colorimetry bit to avoid interop issues.
  Display Product Serial Number is set, so the Serial Number in the Base EDID should be 0.
Block 4, CTA-861 Extension Block:
  Colorimetry Data Block: Set the sRGB colorimetry bit to avoid interop issues.
  Display Product Serial Number is set, so the Serial Number in the Base EDID should be 0.
EDID:
  Base EDID: Some timings are out of range of the Monitor Ranges:
    Vertical Freq: 30.000 - 240.000 Hz (Monitor: 68.000 - 240.000 Hz)
    Horizontal Freq: 31.468 - 540.000 kHz (Monitor: 510.000 - 510.000 kHz)

Failures:

Block 1, CTA-861 Extension Block:
  Missing VCDB, needed for Set Selectable RGB Quantization to avoid interop issues.
Block 2, DisplayID Extension Block:
  DisplayID Base Block has no product type.
  Expected 0 DisplayID Extension Block, but got 1.
Block 3, Base EDID:
  Unknown Extension Block.
Block 4, CTA-861 Extension Block:
  Video Data Block: Duplicate VIC 97.
  Video Data Block: Duplicate VIC 95.
  Video Data Block: Duplicate VIC 16.
  Video Data Block: Duplicate VIC 31.
  Video Data Block: Duplicate VIC 63.
  Video Data Block: Duplicate VIC 4.
  Video Data Block: Duplicate VIC 3.
  Video Data Block: Duplicate VIC 118.
  Speaker Allocation Data Block: Only one instance of this Data Block is allowed.
  Colorimetry Data Block: Only one instance of this Data Block is allowed.
  HDR Static Metadata Data Block: Only one instance of this Data Block is allowed.
  Missing VCDB, needed for Set Selectable RGB Quantization to avoid interop issues.
EDID:
  Base EDID: EDID specified 2 extension block(s), but found 5 extension block(s).
  DisplayID: Missing DisplayID Product Identification Data Block.

EDID conformity: FAIL
