edid-decode (hex):

00 ff ff ff ff ff ff 00 0d af 31 10 00 00 00 00
33 13 01 03 80 16 0c 78 0a 4f 05 95 5b 55 8f 27
22 50 54 00 00 00 01 01 01 01 01 01 01 01 01 01
01 01 01 01 01 01 2c 15 00 6a 41 58 34 20 6d 48
7d 00 de 7d 00 00 00 18 00 00 00 fe 00 4e 31 30
31 4c 47 45 2d 4c 34 31 0a 20 00 00 00 fe 00 43
4d 4f 0a 20 20 20 20 20 20 20 20 20 00 00 00 fe
00 4e 31 30 31 4c 47 45 2d 4c 34 31 0a 20 00 b6

----------------

Block 0, Base EDID:
  EDID Structure Version & Revision: 1.3
  Vendor & Product Identification:
    Manufacturer: CMO
    Model: 4145
    Made in: week 51 of 2009
  Basic Display Parameters & Features:
    Digital display
    Maximum image size: 22 cm x 12 cm
    Gamma: 2.20
    RGB color display
    First detailed timing is the preferred timing
  Color Characteristics:
    Red  : 0.5830, 0.3554
    Green: 0.3349, 0.5615
    Blue : 0.1523, 0.1328
    White: 0.3134, 0.3291
  Established Timings I & II: none
  Standard Timings: none
  Detailed Timing Descriptors:
    DTD 1:  1024x600    59.977514 Hz 128:75    39.105 kHz     54.200000 MHz (222 mm x 125 mm)
                 Hfront  109 Hsync  72 Hback  181 Hpol N
                 Vfront    7 Vsync  13 Vback   32 Vpol N
    Alphanumeric Data String: 'N101LGE-L41'
    Alphanumeric Data String: 'CMO'
    Alphanumeric Data String: 'N101LGE-L41'
Checksum: 0xb6

----------------

Failures:

Block 0, Base EDID:
  Missing Display Product Name.
  Missing Display Range Limits Descriptor.

EDID conformity: FAIL
