edid-decode (hex):

00 ff ff ff ff ff ff 00 30 ae 1d 11 35 30 4d 54
1b 1f 01 04 a5 35 1e 78 3e 15 c5 a7 56 50 a0 26
11 50 54 bd cf 00 71 4f 81 00 81 80 81 8c 95 00
95 0f b3 00 a9 40 02 3a 80 18 71 38 2d 40 58 2c
45 00 0f 28 21 00 00 1e 00 00 00 ff 00 56 33 30
37 54 4d 30 35 0a 20 20 20 20 00 00 00 fd 00 1e
4b 1e 53 15 00 0a 20 20 20 20 20 20 00 00 00 fc
00 54 49 4f 32 34 47 65 6e 34 0a 20 20 20 01 50

02 03 1c f1 49 01 02 03 04 11 12 13 90 1f 23 09
07 07 83 01 00 00 65 03 0c 00 10 00 d6 09 80 a0
20 5e 63 10 30 60 b2 0c 0f 28 21 00 00 1a 0e 1f
00 80 51 00 1e 30 40 80 37 00 0f 28 21 00 00 1e
66 21 56 aa 51 00 1e 30 46 8f 33 00 0f 28 21 00
00 1e d4 49 40 30 62 b0 32 40 40 c0 13 00 0f 28
21 00 00 1e 2a 44 80 a0 70 38 27 40 30 20 35 00
0f 28 21 00 00 1a 00 00 00 00 20 05 09 03 00 08

00 ff ff ff ff ff ff 00 30 ae 1d 11 35 30 4d 54
1b 1f 01 04 a5 35 1e 78 3e 15 c5 a7 56 50 a0 26
11 50 54 bd cf 00 71 4f 81 00 81 80 81 8c 95 00
95 0f b3 00 a9 40 02 3a 80 18 71 38 2d 40 58 2c
45 00 0f 28 21 00 00 1e 00 00 00 ff 00 56 33 30
37 54 4d 30 35 0a 20 20 20 20 00 00 00 fd 00 1e
4b 1e 53 15 00 0a 20 20 20 20 20 20 00 00 00 fc
00 54 49 4f 32 34 47 65 6e 34 0a 20 20 20 01 50

02 03 1c f1 49 01 02 03 04 11 12 13 90 1f 23 09
07 07 83 01 00 00 65 03 0c 00 10 00 d6 09 80 a0
20 5e 63 10 30 60 b2 0c 0f 28 21 00 00 1a 0e 1f
00 80 51 00 1e 30 40 80 37 00 0f 28 21 00 00 1e
66 21 56 aa 51 00 1e 30 46 8f 33 00 0f 28 21 00
00 1e d4 49 40 30 62 b0 32 40 40 c0 13 00 0f 28
21 00 00 1e 2a 44 80 a0 70 38 27 40 30 20 35 00
0f 28 21 00 00 1a 00 00 00 00 20 05 09 03 00 08

----------------

Block 0, Base EDID:
  EDID Structure Version & Revision: 1.4
  Vendor & Product Identification:
    Manufacturer: LEN
    Model: 4381
    Serial Number: ...
    Made in: week 27 of 2021
  Basic Display Parameters & Features:
    Digital display
    Bits per primary color channel: 8
    DisplayPort interface
    Maximum image size: 53 cm x 30 cm
    Gamma: 2.20
    DPMS levels: Off
    Supported color formats: RGB 4:4:4, YCrCb 4:4:4, YCrCb 4:2:2
    Default (sRGB) color space is primary color space
    First detailed timing includes the native pixel format and preferred refresh rate
  Color Characteristics:
    Red  : 0.6523, 0.3369
    Green: 0.3134, 0.6259
    Blue : 0.1513, 0.0664
    White: 0.3134, 0.3291
  Established Timings I & II:
    IBM     :   720x400    70.081663 Hz   9:5     31.467 kHz     28.320000 MHz
    DMT 0x04:   640x480    59.940476 Hz   4:3     31.469 kHz     25.175000 MHz
    Apple   :   640x480    66.666667 Hz   4:3     35.000 kHz     30.240000 MHz
    DMT 0x05:   640x480    72.808802 Hz   4:3     37.861 kHz     31.500000 MHz
    DMT 0x06:   640x480    75.000000 Hz   4:3     37.500 kHz     31.500000 MHz
    DMT 0x09:   800x600    60.316541 Hz   4:3     37.879 kHz     40.000000 MHz
    DMT 0x0a:   800x600    72.187572 Hz   4:3     48.077 kHz     50.000000 MHz
    DMT 0x0b:   800x600    75.000000 Hz   4:3     46.875 kHz     49.500000 MHz
    DMT 0x10:  1024x768    60.003840 Hz   4:3     48.363 kHz     65.000000 MHz
    DMT 0x11:  1024x768    70.069359 Hz   4:3     56.476 kHz     75.000000 MHz
    DMT 0x12:  1024x768    75.028582 Hz   4:3     60.023 kHz     78.750000 MHz
    DMT 0x24:  1280x1024   75.024675 Hz   5:4     79.976 kHz    135.000000 MHz
  Standard Timings:
    DMT 0x15:  1152x864    75.000000 Hz   4:3     67.500 kHz    108.000000 MHz
    DMT 0x1c:  1280x800    59.810326 Hz  16:10    49.702 kHz     83.500000 MHz
    DMT 0x23:  1280x1024   60.019740 Hz   5:4     63.981 kHz    108.000000 MHz
    GTF     :  1280x1024   72.000069 Hz   5:4     76.824 kHz    132.752000 MHz
    DMT 0x2f:  1440x900    59.887445 Hz  16:10    55.935 kHz    106.500000 MHz
    DMT 0x30:  1440x900    74.984427 Hz  16:10    70.635 kHz    136.750000 MHz
    DMT 0x3a:  1680x1050   59.954250 Hz  16:10    65.290 kHz    146.250000 MHz
    DMT 0x33:  1600x1200   60.000000 Hz   4:3     75.000 kHz    162.000000 MHz
  Detailed Timing Descriptors:
    DTD  1:  1920x1080   60.000000 Hz  16:9     67.500 kHz    148.500000 MHz (527 mm x 296 mm)
                  Hfront   88 Hsync  44 Hback  148 Hpol P
                  Vfront    4 Vsync   5 Vback   36 Vpol P
    Display Product Serial Number: ...
    Display Range Limits:
      Monitor ranges (GTF): 30-75 Hz V, 30-83 kHz H, max dotclock 210 MHz
    Display Product Name: 'TIO24Gen4'
  Extension blocks: 1
Checksum: 0x50

----------------

Block 1, CTA-861 Extension Block:
  Revision: 3
  Underscans IT Video Formats by default
  Basic audio support
  Supports YCbCr 4:4:4
  Supports YCbCr 4:2:2
  Native detailed modes: 1
  Video Data Block:
    VIC   1:   640x480    59.940476 Hz   4:3     31.469 kHz     25.175000 MHz
    VIC   2:   720x480    59.940060 Hz   4:3     31.469 kHz     27.000000 MHz
    VIC   3:   720x480    59.940060 Hz  16:9     31.469 kHz     27.000000 MHz
    VIC   4:  1280x720    60.000000 Hz  16:9     45.000 kHz     74.250000 MHz
    VIC  17:   720x576    50.000000 Hz   4:3     31.250 kHz     27.000000 MHz
    VIC  18:   720x576    50.000000 Hz  16:9     31.250 kHz     27.000000 MHz
    VIC  19:  1280x720    50.000000 Hz  16:9     37.500 kHz     74.250000 MHz
    VIC  16:  1920x1080   60.000000 Hz  16:9     67.500 kHz    148.500000 MHz (native)
    VIC  31:  1920x1080   50.000000 Hz  16:9     56.250 kHz    148.500000 MHz
  Audio Data Block:
    Linear PCM:
      Max channels: 2
      Supported sample rates (kHz): 48 44.1 32
      Supported sample sizes (bits): 24 20 16
  Speaker Allocation Data Block:
    FL/FR - Front Left/Right
  Vendor-Specific Data Block (HDMI), OUI 00-0C-03:
    Source physical address: 1.0.0.0
  Detailed Timing Descriptors:
    DTD  2:   640x350    70.100223 Hz  64:35    31.475 kHz     25.180000 MHz (527 mm x 296 mm)
                  Hfront   48 Hsync  96 Hback   16 Hpol P
                  Vfront   59 Vsync   2 Vback   38 Vpol N
    DTD  3:  1280x768    59.870228 Hz   5:3     47.776 kHz     79.500000 MHz (527 mm x 296 mm)
                  Hfront   64 Hsync 128 Hback  192 Hpol P
                  Vfront    3 Vsync   7 Vback   20 Vpol P
    DTD  4:  1366x768    59.789541 Hz 683:384   47.712 kHz     85.500000 MHz (527 mm x 296 mm)
                  Hfront   70 Hsync 143 Hback  213 Hpol P
                  Vfront    3 Vsync   3 Vback   24 Vpol P
    DTD  5:  1600x1200   70.000000 Hz   4:3     87.500 kHz    189.000000 MHz (527 mm x 296 mm)
                  Hfront   64 Hsync 192 Hback  304 Hpol P
                  Vfront    1 Vsync   3 Vback   46 Vpol P
    DTD  6:  1920x1080   74.972503 Hz  16:9     83.894 kHz    174.500000 MHz (527 mm x 296 mm)
                  Hfront   48 Hsync  32 Hback   80 Hpol P
                  Vfront    3 Vsync   5 Vback   31 Vpol N
Checksum: 0x08  Unused space in Extension Block: 9 bytes

----------------

Block 2, Unknown EDID Extension Block 0x00:
  00 ff ff ff ff ff ff 00 30 ae 1d 11 35 30 4d 54 '........0...50MT'
  1b 1f 01 04 a5 35 1e 78 3e 15 c5 a7 56 50 a0 26 '.....5.x>...VP.&'
  11 50 54 bd cf 00 71 4f 81 00 81 80 81 8c 95 00 '.PT...qO........'
  95 0f b3 00 a9 40 02 3a 80 18 71 38 2d 40 58 2c '.....@.:..q8-@X,'
  45 00 0f 28 21 00 00 1e 00 00 00 ff 00 56 33 30 'E..(!........V30'
  37 54 4d 30 35 0a 20 20 20 20 00 00 00 fd 00 1e '7TM05.    ......'
  4b 1e 53 15 00 0a 20 20 20 20 20 20 00 00 00 fc 'K.S...      ....'
  00 54 49 4f 32 34 47 65 6e 34 0a 20 20 20 01 50 '.TIO24Gen4.   .P'
Checksum: 0x50

----------------

Block 3, CTA-861 Extension Block:
  Revision: 3
  Underscans IT Video Formats by default
  Basic audio support
  Supports YCbCr 4:4:4
  Supports YCbCr 4:2:2
  Native detailed modes: 1
  Video Data Block:
    VIC   1:   640x480    59.940476 Hz   4:3     31.469 kHz     25.175000 MHz
    VIC   2:   720x480    59.940060 Hz   4:3     31.469 kHz     27.000000 MHz
    VIC   3:   720x480    59.940060 Hz  16:9     31.469 kHz     27.000000 MHz
    VIC   4:  1280x720    60.000000 Hz  16:9     45.000 kHz     74.250000 MHz
    VIC  17:   720x576    50.000000 Hz   4:3     31.250 kHz     27.000000 MHz
    VIC  18:   720x576    50.000000 Hz  16:9     31.250 kHz     27.000000 MHz
    VIC  19:  1280x720    50.000000 Hz  16:9     37.500 kHz     74.250000 MHz
    VIC  16:  1920x1080   60.000000 Hz  16:9     67.500 kHz    148.500000 MHz (native)
    VIC  31:  1920x1080   50.000000 Hz  16:9     56.250 kHz    148.500000 MHz
  Audio Data Block:
    Linear PCM:
      Max channels: 2
      Supported sample rates (kHz): 48 44.1 32
      Supported sample sizes (bits): 24 20 16
  Speaker Allocation Data Block:
    FL/FR - Front Left/Right
  Vendor-Specific Data Block (HDMI), OUI 00-0C-03:
    Source physical address: 1.0.0.0
  Detailed Timing Descriptors:
    DTD  7:   640x350    70.100223 Hz  64:35    31.475 kHz     25.180000 MHz (527 mm x 296 mm)
                  Hfront   48 Hsync  96 Hback   16 Hpol P
                  Vfront   59 Vsync   2 Vback   38 Vpol N
    DTD  8:  1280x768    59.870228 Hz   5:3     47.776 kHz     79.500000 MHz (527 mm x 296 mm)
                  Hfront   64 Hsync 128 Hback  192 Hpol P
                  Vfront    3 Vsync   7 Vback   20 Vpol P
    DTD  9:  1366x768    59.789541 Hz 683:384   47.712 kHz     85.500000 MHz (527 mm x 296 mm)
                  Hfront   70 Hsync 143 Hback  213 Hpol P
                  Vfront    3 Vsync   3 Vback   24 Vpol P
    DTD 10:  1600x1200   70.000000 Hz   4:3     87.500 kHz    189.000000 MHz (527 mm x 296 mm)
                  Hfront   64 Hsync 192 Hback  304 Hpol P
                  Vfront    1 Vsync   3 Vback   46 Vpol P
    DTD 11:  1920x1080   74.972503 Hz  16:9     83.894 kHz    174.500000 MHz (527 mm x 296 mm)
                  Hfront   48 Hsync  32 Hback   80 Hpol P
                  Vfront    3 Vsync   5 Vback   31 Vpol N
Checksum: 0x08  Unused space in Extension Block: 9 bytes

----------------

Warnings:

Block 0, Base EDID:
  Display Range Limits: GTF support is deprecated in EDID 1.4.
Block 1, CTA-861 Extension Block:
  Detailed Timing Descriptor #3: DTD is similar but not identical to DMT 0x17.
  Display Product Serial Number is set, so the Serial Number in the Base EDID should be 0.
Block 3, CTA-861 Extension Block:
  Detailed Timing Descriptor #8: DTD is similar but not identical to DMT 0x17.
  Display Product Serial Number is set, so the Serial Number in the Base EDID should be 0.
EDID:
  Base EDID: Some timings are out of range of the Monitor Ranges:
    Horizontal Freq: 31.250 - 87.500 kHz (Monitor: 30.000 - 83.000 kHz)
  CTA-861: Multiple native progressive timings are defined.

Failures:

Block 0, Base EDID:
  Basic Display Parameters & Features: sRGB is signaled, but the chromaticities do not match.
  Display Range Limits: GTF can't be combined with non-continuous frequencies.
Block 1, CTA-861 Extension Block:
  Vendor-Specific Data Block (HDMI), OUI 00-0C-03: The HDMI Specification requires EDID 1.3 instead of 1.4.
  Padding: Contains non-zero bytes.
  Missing VCDB, needed for Set Selectable RGB Quantization to avoid interop issues.
Block 2, Base EDID:
  Unknown Extension Block.
Block 3, CTA-861 Extension Block:
  Video Data Block: Duplicate VIC 1.
  Video Data Block: Duplicate VIC 2.
  Video Data Block: Duplicate VIC 3.
  Video Data Block: Duplicate VIC 4.
  Video Data Block: Duplicate VIC 17.
  Video Data Block: Duplicate VIC 18.
  Video Data Block: Duplicate VIC 19.
  Video Data Block: Duplicate VIC 16.
  Video Data Block: Duplicate VIC 31.
  Speaker Allocation Data Block: Only one instance of this Data Block is allowed.
  Vendor-Specific Data Block (HDMI), OUI 00-0C-03: The HDMI Specification requires EDID 1.3 instead of 1.4.
  Padding: Contains non-zero bytes.
  Missing VCDB, needed for Set Selectable RGB Quantization to avoid interop issues.
EDID:
  Base EDID: EDID specified 1 extension block(s), but found 3 extension block(s).

EDID conformity: FAIL
