
EDID (hex):
00ffffffffffff000472a4ad95191073
1f110103802f1d78caee95a3544c9926
0f5054a54b00714f8180b30001010101
01010101010121399030621a274018b0
3640da281100001c000000fd00384b1f
5311000a202020202020000000fc0041
63657220414c32323032570a000000ff
004c41343034303239343331310a0012

Extracted contents:
header:          00 ff ff ff ff ff ff 00
serial number:   04 72 a4 ad 95 19 10 73 1f 11
version:         01 03
basic params:    80 2f 1d 78 ca
chroma info:     ee 95 a3 54 4c 99 26 0f 50 54
established:     a5 4b 00
standard:        71 4f 81 80 b3 00 01 01 01 01 01 01 01 01 01 01
descriptor 1:    21 39 90 30 62 1a 27 40 18 b0 36 40 da 28 11 00 00 1c
descriptor 2:    00 00 00 fd 00 38 4b 1f 53 11 00 0a 20 20 20 20 20 20
descriptor 3:    00 00 00 fc 00 41 63 65 72 20 41 4c 32 32 30 32 57 0a
descriptor 4:    00 00 00 ff 00 4c 41 34 30 34 30 32 39 34 33 31 31 0a
extensions:      00
checksum:        12

EDID version: 1.3
Manufacturer: ACR Model ada4 Serial Number --
Made in week 31 of 2007
Digital display
Maximum image size: 47 cm x 29 cm
Gamma: 2.20
DPMS levels: Standby Suspend
RGB color display
First detailed timing is preferred timing
Display x,y Chromaticity:
  Red:   0.6396, 0.3300
  Green: 0.2998, 0.5996
  Blue:  0.1503, 0.0595
  White: 0.3134, 0.3291
Established timings supported:
  720x400@70Hz 9:5 HorFreq: 31469 Hz Clock: 28.320 MHz
  640x480@60Hz 4:3 HorFreq: 31469 Hz Clock: 25.175 MHz
  640x480@75Hz 4:3 HorFreq: 37500 Hz Clock: 31.500 MHz
  800x600@60Hz 4:3 HorFreq: 37900 Hz Clock: 40.000 MHz
  800x600@75Hz 4:3 HorFreq: 46900 Hz Clock: 49.500 MHz
  1024x768@60Hz 4:3 HorFreq: 48400 Hz Clock: 65.000 MHz
  1024x768@75Hz 4:3 HorFreq: 60000 Hz Clock: 78.750 MHz
  1280x1024@75Hz 5:4 HorFreq: 80000 Hz Clock: 135.000 MHz
Standard timings supported:
  1152x864@75Hz 4:3 HorFreq: 67500 Hz Clock: 108.000 MHz
  1280x1024@60Hz 5:4 HorFreq: 64000 Hz Clock: 108.000 MHz
  1680x1050@60Hz 16:10 HorFreq: 64700 Hz Clock: 119.000 MHz
Detailed mode: Clock 146.250 MHz, 474 mm x 296 mm
               1680 1960 2136 2240 hborder 0
               1050 1053 1059 1089 vborder 0
               -hsync +vsync 
               VertFreq: 59 Hz, HorFreq: 65290 Hz
Monitor ranges (GTF): 56-75Hz V, 31-83kHz H, max dotclock 170MHz
Monitor name: Acer AL2202W
Serial number: --
Checksum: 0x12 (valid)
