
EDID (hex):
00ffffffffffff0012e51502502d3101
2014010380301b782a81f5a357539f27
0a5054bfce00d1c0b300a9c095008180
8140714f0101023a801871382d40582c
4500dd0c1100001e000000ff00303030
30303030303030303030000000fd0038
4b185312000a202020202020000000fc
0032312e3557206d6f6e69746f7200d8

Extracted contents:
header:          00 ff ff ff ff ff ff 00
serial number:   12 e5 15 02 50 2d 31 01 20 14
version:         01 03
basic params:    80 30 1b 78 2a
chroma info:     81 f5 a3 57 53 9f 27 0a 50 54
established:     bf ce 00
standard:        d1 c0 b3 00 a9 c0 95 00 81 80 81 40 71 4f 01 01
descriptor 1:    02 3a 80 18 71 38 2d 40 58 2c 45 00 dd 0c 11 00 00 1e
descriptor 2:    00 00 00 ff 00 30 30 30 30 30 30 30 30 30 30 30 30 30
descriptor 3:    00 00 00 fd 00 38 4b 18 53 12 00 0a 20 20 20 20 20 20
descriptor 4:    00 00 00 fc 00 32 31 2e 35 57 20 6d 6f 6e 69 74 6f 72
extensions:      00
checksum:        d8

EDID version: 1.3
Manufacturer: DWE Model 215 Serial Number --
Made in week 32 of 2010
Digital display
Maximum image size: 48 cm x 27 cm
Gamma: 2.20
DPMS levels: Off
RGB color display
First detailed timing is preferred timing
Display x,y Chromaticity:
  Red:   0.6386, 0.3398
  Green: 0.3242, 0.6220
  Blue:  0.1552, 0.0419
  White: 0.3134, 0.3291
Established timings supported:
  720x400@70Hz 9:5 HorFreq: 31469 Hz Clock: 28.320 MHz
  640x480@60Hz 4:3 HorFreq: 31469 Hz Clock: 25.175 MHz
  640x480@67Hz 4:3 HorFreq: 35000 Hz Clock: 30.240 MHz
  640x480@72Hz 4:3 HorFreq: 37900 Hz Clock: 31.500 MHz
  640x480@75Hz 4:3 HorFreq: 37500 Hz Clock: 31.500 MHz
  800x600@56Hz 4:3 HorFreq: 35200 Hz Clock: 36.000 MHz
  800x600@60Hz 4:3 HorFreq: 37900 Hz Clock: 40.000 MHz
  800x600@72Hz 4:3 HorFreq: 48100 Hz Clock: 50.000 MHz
  800x600@75Hz 4:3 HorFreq: 46900 Hz Clock: 49.500 MHz
  1024x768@60Hz 4:3 HorFreq: 48400 Hz Clock: 65.000 MHz
  1024x768@70Hz 4:3 HorFreq: 56500 Hz Clock: 75.000 MHz
  1024x768@75Hz 4:3 HorFreq: 60000 Hz Clock: 78.750 MHz
Standard timings supported:
  1920x1080@60Hz 16:9
  1680x1050@60Hz 16:10 HorFreq: 64700 Hz Clock: 119.000 MHz
  1600x900@60Hz 16:9
  1440x900@60Hz 16:10 HorFreq: 55500 Hz Clock: 88.750 MHz
  1280x1024@60Hz 5:4 HorFreq: 64000 Hz Clock: 108.000 MHz
  1280x960@60Hz 4:3 HorFreq: 60000 Hz Clock: 108.000 MHz
  1152x864@75Hz 4:3 HorFreq: 67500 Hz Clock: 108.000 MHz
Detailed mode: Clock 148.500 MHz, 477 mm x 268 mm
               1920 2008 2052 2200 hborder 0
               1080 1084 1089 1125 vborder 0
               +hsync +vsync 
               VertFreq: 60 Hz, HorFreq: 67500 Hz
Serial number: --
Monitor ranges (GTF): 56-75Hz V, 24-83kHz H, max dotclock 180MHz
Checksum: 0xd8 (valid)
EDID block does NOT conform to EDID 1.3!
	Name descriptor not terminated with a newline
