
EDID (hex):
00ffffffffffff0015c3351601000000
190c0102801e1778ea94f9a355479924
0d4d50a1080001010101010101010101
01010101010164190040410026301888
360030e410000018000000ff00503339
37383036320a20202020000000fd003b
3d1f3107000a202020202020000000fc
004c3336350a2020202020202020007f

Extracted contents:
header:          00 ff ff ff ff ff ff 00
serial number:   15 c3 35 16 01 00 00 00 19 0c
version:         01 02
basic params:    80 1e 17 78 ea
chroma info:     94 f9 a3 55 47 99 24 0d 4d 50
established:     a1 08 00
standard:        01 01 01 01 01 01 01 01 01 01 01 01 01 01 01 01
descriptor 1:    64 19 00 40 41 00 26 30 18 88 36 00 30 e4 10 00 00 18
descriptor 2:    00 00 00 ff 00 50 33 39 37 38 30 36 32 0a 20 20 20 20
descriptor 3:    00 00 00 fd 00 3b 3d 1f 31 07 00 0a 20 20 20 20 20 20
descriptor 4:    00 00 00 fc 00 4c 33 36 35 0a 20 20 20 20 20 20 20 20
extensions:      00
checksum:        7f

EDID version: 1.2
Manufacturer: ENC Model 1635 Serial Number --
Digital display
Maximum image size: 30 cm x 23 cm
Gamma: 2.20
DPMS levels: Standby Suspend Off
RGB color display
First detailed timing is preferred timing
Display x,y Chromaticity:
  Red:   0.6386, 0.3330
  Green: 0.2783, 0.5976
  Blue:  0.1435, 0.0537
  White: 0.3027, 0.3134
Established timings supported:
  720x400@70Hz 9:5 HorFreq: 31469 Hz Clock: 28.320 MHz
  640x480@60Hz 4:3 HorFreq: 31469 Hz Clock: 25.175 MHz
  800x600@60Hz 4:3 HorFreq: 37900 Hz Clock: 40.000 MHz
  1024x768@60Hz 4:3 HorFreq: 48400 Hz Clock: 65.000 MHz
Standard timings supported:
Detailed mode: Clock 65.000 MHz, 304 mm x 228 mm
               1024 1048 1184 1344 hborder 0
                768  771  777  806 vborder 0
               -hsync -vsync 
               VertFreq: 60 Hz, HorFreq: 48363 Hz
Serial number: --
Monitor ranges (GTF): 59-61Hz V, 31-49kHz H, max dotclock 70MHz
Monitor name: L365
Checksum: 0x7f (valid)
One or more of the timings is out of range of the Monitor Ranges:
  Vertical Freq: 60 - 70 Hz
  Horizontal Freq: 31469 - 48400 Hz
  Maximum Clock: 65.000 MHz
EDID block does not conform at all!
	Bad year of manufacture
