
EDID (hex):
00ffffffffffff0030ae0b5210000000
081501030e2c1878eade50a3544c9926
0f5054254a00a9c09500950f810081c0
010101010101302a40c8608464301850
1300bbf91000001e662156aa51001e30
468f33009ae61000001e000000fd003c
4b2f4610000a202020202020000000fc
004c656e6f766f204836310a202000bc

Extracted contents:
header:          00 ff ff ff ff ff ff 00
serial number:   30 ae 0b 52 10 00 00 00 08 15
version:         01 03
basic params:    0e 2c 18 78 ea
chroma info:     de 50 a3 54 4c 99 26 0f 50 54
established:     25 4a 00
standard:        a9 c0 95 00 95 0f 81 00 81 c0 01 01 01 01 01 01
descriptor 1:    30 2a 40 c8 60 84 64 30 18 50 13 00 bb f9 10 00 00 1e
descriptor 2:    66 21 56 aa 51 00 1e 30 46 8f 33 00 9a e6 10 00 00 1e
descriptor 3:    00 00 00 fd 00 3c 4b 2f 46 10 00 0a 20 20 20 20 20 20
descriptor 4:    00 00 00 fc 00 4c 65 6e 6f 76 6f 20 48 36 31 0a 20 20
extensions:      00
checksum:        bc

EDID version: 1.3
Manufacturer: LEN Model 520b Serial Number --
Made in week 8 of 2011
Analog display, Input voltage level: 0.7/0.3 V
Sync: Separate Composite SyncOnGreen 
Maximum image size: 44 cm x 24 cm
Gamma: 2.20
DPMS levels: Standby Suspend Off
RGB color display
First detailed timing is preferred timing
Display x,y Chromaticity:
  Red:   0.6396, 0.3291
  Green: 0.2998, 0.5996
  Blue:  0.1494, 0.0595
  White: 0.3125, 0.3281
Established timings supported:
  640x480@60Hz 4:3 HorFreq: 31469 Hz Clock: 25.175 MHz
  640x480@75Hz 4:3 HorFreq: 37500 Hz Clock: 31.500 MHz
  800x600@60Hz 4:3 HorFreq: 37900 Hz Clock: 40.000 MHz
  800x600@75Hz 4:3 HorFreq: 46900 Hz Clock: 49.500 MHz
  1024x768@60Hz 4:3 HorFreq: 48400 Hz Clock: 65.000 MHz
  1024x768@75Hz 4:3 HorFreq: 60000 Hz Clock: 78.750 MHz
Standard timings supported:
  1600x900@60Hz 16:9
  1440x900@60Hz 16:10 HorFreq: 55500 Hz Clock: 88.750 MHz
  1440x900@75Hz 16:10 HorFreq: 82300 Hz Clock: 156.000 MHz
  1280x800@60Hz 16:10
  1280x720@60Hz 16:9
Detailed mode: Clock 108.000 MHz, 443 mm x 249 mm
               1600 1624 1704 1800 hborder 0
                900  901  904 1000 vborder 0
               +hsync +vsync 
               VertFreq: 60 Hz, HorFreq: 60000 Hz
Detailed mode: Clock 85.500 MHz, 410 mm x 230 mm
               1366 1436 1579 1792 hborder 0
                768  771  774  798 vborder 0
               +hsync +vsync 
               VertFreq: 59 Hz, HorFreq: 47712 Hz
Monitor ranges (GTF): 60-75Hz V, 47-70kHz H, max dotclock 160MHz
Monitor name: Lenovo H61
Checksum: 0xbc (valid)
One or more of the timings is out of range of the Monitor Ranges:
  Vertical Freq: 59 - 75 Hz
  Horizontal Freq: 31469 - 82300 Hz
  Maximum Clock: 156.000 MHz
