
EDID (hex):
00ffffffffffff000daf081500000000
350e0103801e17780a0560975751894c
1e505400080001010101010101010101
010101010101302a7820511a10403070
340030e410000018000000fe004e3135
3050350a202020202020000000fe0043
4d4f0a202020202020202020000000fc
004e31353050352d4c30310a202000de

Extracted contents:
header:          00 ff ff ff ff ff ff 00
serial number:   0d af 08 15 00 00 00 00 35 0e
version:         01 03
basic params:    80 1e 17 78 0a
chroma info:     05 60 97 57 51 89 4c 1e 50 54
established:     00 08 00
standard:        01 01 01 01 01 01 01 01 01 01 01 01 01 01 01 01
descriptor 1:    30 2a 78 20 51 1a 10 40 30 70 34 00 30 e4 10 00 00 18
descriptor 2:    00 00 00 fe 00 4e 31 35 30 50 35 0a 20 20 20 20 20 20
descriptor 3:    00 00 00 fe 00 43 4d 4f 0a 20 20 20 20 20 20 20 20 20
descriptor 4:    00 00 00 fc 00 4e 31 35 30 50 35 2d 4c 30 31 0a 20 20
extensions:      00
checksum:        de

EDID version: 1.3
Manufacturer: CMO Model 1508 Serial Number --
Digital display
Maximum image size: 30 cm x 23 cm
Gamma: 2.20
RGB color display
First detailed timing is preferred timing
Display x,y Chromaticity:
  Red:   0.5898, 0.3398
  Green: 0.3173, 0.5361
  Blue:  0.2978, 0.1191
  White: 0.3125, 0.3281
Established timings supported:
  1024x768@60Hz 4:3 HorFreq: 48400 Hz Clock: 65.000 MHz
Standard timings supported:
Detailed mode: Clock 108.000 MHz, 304 mm x 228 mm
               1400 1448 1560 1688 hborder 0
               1050 1053 1057 1066 vborder 0
               -hsync -vsync 
               VertFreq: 60 Hz, HorFreq: 63981 Hz
ASCII string: N150P5
ASCII string: CMO
Monitor name: N150P5-L01
Checksum: 0xde (valid)
EDID block does NOT conform to EDID 1.3!
	Missing monitor ranges
EDID block does not conform at all!
	Bad year of manufacture
