edid-decode (hex):

00 ff ff ff ff ff ff 00 06 10 df 9c 00 00 00 00
23 14 01 03 80 1d 12 78 0a ef 05 97 57 54 92 27
22 50 54 00 00 00 01 01 01 01 01 01 01 01 01 01
01 01 01 01 01 01 c2 23 a0 d4 50 84 1a 30 40 2a
36 00 1e b3 10 00 00 18 00 00 00 01 00 06 10 30
00 00 00 00 00 00 00 00 0a 20 00 00 00 fe 00 4c
50 31 33 33 57 50 31 2d 54 50 41 31 00 00 00 fc
00 43 6f 6c 6f 72 20 4c 43 44 0a 20 20 20 00 1f

----------------

Block 0, Base EDID:
  EDID Structure Version & Revision: 1.3
  Vendor & Product Identification:
    Manufacturer: APP
    Model: 40159
    Made in: week 35 of 2010
  Basic Display Parameters & Features:
    Digital display
    Maximum image size: 29 cm x 18 cm
    Gamma: 2.20
    RGB color display
    First detailed timing is the preferred timing
  Color Characteristics:
    Red  : 0.5927, 0.3417
    Green: 0.3310, 0.5732
    Blue : 0.1523, 0.1328
    White: 0.3134, 0.3291
  Established Timings I & II: none
  Standard Timings: none
  Detailed Timing Descriptors:
    DTD 1:  1440x900    59.839765 Hz  16:10    55.412 kHz     91.540000 MHz (286 mm x 179 mm)
                 Hfront   64 Hsync  42 Hback  106 Hpol N
                 Vfront    3 Vsync   6 Vback   17 Vpol N
    Manufacturer-Specified Display Descriptor (0x01): 00 01 00 06 10 30 00 00 00 00 00 00 00 00 0a 20 '.....0......... '
    Alphanumeric Data String: 'LP133WP1-TPA1'
    Display Product Name: 'Color LCD'
Checksum: 0x1f

----------------

Failures:

Block 0, Base EDID:
  Missing Display Range Limits Descriptor.

EDID conformity: FAIL
