
EDID (hex):
00ffffffffffff0015c356297f5d9102
201b0104b5342178e213b5b14e35bb26
095054a10800a94081808140b3000101
010101010101283c80a070b023403020
360007442100001a1a3680a070381f40
3020350007442100001a000000fd0017
3f1a4e11000a202020202020000000fc
004353323432300a20202020202000b4

edid-decode (hex):

00 ff ff ff ff ff ff 00 15 c3 56 29 7f 5d 91 02
20 1b 01 04 b5 34 21 78 e2 13 b5 b1 4e 35 bb 26
09 50 54 a1 08 00 a9 40 81 80 81 40 b3 00 01 01
01 01 01 01 01 01 28 3c 80 a0 70 b0 23 40 30 20
36 00 07 44 21 00 00 1a 1a 36 80 a0 70 38 1f 40
30 20 35 00 07 44 21 00 00 1a 00 00 00 fd 00 17
3f 1a 4e 11 00 0a 20 20 20 20 20 20 00 00 00 fc
00 43 53 32 34 32 30 0a 20 20 20 20 20 20 00 b4

----------------

Block 0, Base EDID:
  EDID Structure Version & Revision: 1.4
  Vendor & Product Identification:
    Manufacturer: ENC
    Model: 10582
    Serial Number: 43081087
    Made in: week 32 of 2017
  Basic Display Parameters & Features:
    Digital display
    Bits per primary color channel: 10
    DisplayPort interface
    Maximum image size: 52 cm x 33 cm
    Gamma: 2.20
    DPMS levels: Standby Suspend Off
    Supported color formats: RGB 4:4:4
    First detailed timing includes the native pixel format and preferred refresh rate
  Color Characteristics:
    Red  : 0.6914, 0.3056
    Green: 0.2070, 0.7333
    Blue : 0.1503, 0.0380
    White: 0.3134, 0.3291
  Established Timings I & II:
    IBM     :   720x400    70.081663 Hz   9:5     31.467 kHz     28.320000 MHz
    DMT 0x04:   640x480    59.940476 Hz   4:3     31.469 kHz     25.175000 MHz
    DMT 0x09:   800x600    60.316541 Hz   4:3     37.879 kHz     40.000000 MHz
    DMT 0x10:  1024x768    60.003840 Hz   4:3     48.363 kHz     65.000000 MHz
  Standard Timings:
    DMT 0x33:  1600x1200   60.000000 Hz   4:3     75.000 kHz    162.000000 MHz
    DMT 0x23:  1280x1024   60.019740 Hz   5:4     63.981 kHz    108.000000 MHz
    DMT 0x20:  1280x960    60.000000 Hz   4:3     60.000 kHz    108.000000 MHz
    DMT 0x3a:  1680x1050   59.954250 Hz  16:10    65.290 kHz    146.250000 MHz
  Detailed Timing Descriptors:
    DTD 1:  1920x1200   59.950171 Hz  16:10    74.038 kHz    154.000000 MHz (519 mm x 324 mm)
                 Hfront   48 Hsync  32 Hback   80 Hpol P
                 Vfront    3 Vsync   6 Vback   26 Vpol N
    DTD 2:  1920x1080   59.933878 Hz  16:9     66.587 kHz    138.500000 MHz (519 mm x 324 mm)
                 Hfront   48 Hsync  32 Hback   80 Hpol P
                 Vfront    3 Vsync   5 Vback   23 Vpol N
    Display Range Limits:
      Monitor ranges (GTF): 23-63 Hz V, 26-78 kHz H, max dotclock 170 MHz
    Display Product Name: 'CS2420'
Checksum: 0xb4


