edid-decode (hex):

00 ff ff ff ff ff ff 00 0e 6f 05 16 00 00 00 00
00 1e 01 04 a5 22 16 78 03 ee 95 a3 54 4c 99 26
0f 50 54 00 00 00 01 01 01 01 01 01 01 01 01 01
01 01 01 01 01 01 6e 6e 00 a0 a0 40 84 60 30 20
36 00 59 d7 10 00 00 18 00 00 00 fd 0c 3c a5 1f
1f 4e 01 0a 20 20 20 20 20 20 00 00 00 fe 00 43
53 4f 54 20 54 33 0a 20 20 20 20 20 00 00 00 fe
00 53 4e 47 30 30 37 44 41 31 2d 31 0a 20 01 08

70 13 79 00 00 03 01 14 ac 2f 01 85 ff 09 9f 00
2f 00 1f 00 3f 06 83 00 02 00 05 00 00 00 00 00
00 00 00 00 00 00 00 00 00 00 00 00 00 00 00 00
00 00 00 00 00 00 00 00 00 00 00 00 00 00 00 00
00 00 00 00 00 00 00 00 00 00 00 00 00 00 00 00
00 00 00 00 00 00 00 00 00 00 00 00 00 00 00 00
00 00 00 00 00 00 00 00 00 00 00 00 00 00 00 00
00 00 00 00 00 00 00 00 00 00 00 00 00 00 37 90

00 ff ff ff ff ff ff 00 0e 6f 05 16 00 00 00 00
00 1e 01 04 a5 22 16 78 03 ee 95 a3 54 4c 99 26
0f 50 54 00 00 00 01 01 01 01 01 01 01 01 01 01
01 01 01 01 01 01 6e 6e 00 a0 a0 40 84 60 30 20
36 00 59 d7 10 00 00 18 00 00 00 fd 0c 3c a5 1f
1f 4e 01 0a 20 20 20 20 20 20 00 00 00 fe 00 43
53 4f 54 20 54 33 0a 20 20 20 20 20 00 00 00 fe
00 53 4e 47 30 30 37 44 41 31 2d 31 0a 20 01 08

70 13 79 00 00 03 01 14 ac 2f 01 85 ff 09 9f 00
2f 00 1f 00 3f 06 83 00 02 00 05 00 00 00 00 00
00 00 00 00 00 00 00 00 00 00 00 00 00 00 00 00
00 00 00 00 00 00 00 00 00 00 00 00 00 00 00 00
00 00 00 00 00 00 00 00 00 00 00 00 00 00 00 00
00 00 00 00 00 00 00 00 00 00 00 00 00 00 00 00
00 00 00 00 00 00 00 00 00 00 00 00 00 00 00 00
00 00 00 00 00 00 00 00 00 00 00 00 00 00 37 90

----------------

Block 0, Base EDID:
  EDID Structure Version & Revision: 1.4
  Vendor & Product Identification:
    Manufacturer: CSO
    Model: 5637
    Made in: 2020
  Basic Display Parameters & Features:
    Digital display
    Bits per primary color channel: 8
    DisplayPort interface
    Maximum image size: 34 cm x 22 cm
    Gamma: 2.20
    Supported color formats: RGB 4:4:4
    First detailed timing includes the native pixel format and preferred refresh rate
    Display is continuous frequency
  Color Characteristics:
    Red  : 0.6396, 0.3300
    Green: 0.2998, 0.5996
    Blue : 0.1503, 0.0595
    White: 0.3134, 0.3291
  Established Timings I & II: none
  Standard Timings: none
  Detailed Timing Descriptors:
    DTD 1:  2560x1600   60.007981 Hz  16:10   103.934 kHz    282.700000 MHz (345 mm x 215 mm)
                 Hfront   48 Hsync  32 Hback   80 Hpol N
                 Vfront    3 Vsync   6 Vback  123 Vpol N
    Display Range Limits:
      Monitor ranges (Bare Limits): 60-165 Hz V, 286-286 kHz H, max dotclock 780 MHz
    Alphanumeric Data String: 'CSOT T3'
    Alphanumeric Data String: 'SNG007DA1-1'
  Extension blocks: 1
Checksum: 0x08

----------------

Block 1, DisplayID Extension Block:
  Version: 1.3
  Extension Count: 0
  Display Product Type: Extension Section
  Video Timing Modes Type 1 - Detailed Timings Data Block:
    DTD:  2560x1600  165.018764 Hz  16:10   285.812 kHz    777.410000 MHz (aspect 16:10, no 3D stereo, preferred)
               Hfront   48 Hsync  32 Hback   80 Hpol N
               Vfront    3 Vsync   6 Vback  123 Vpol N
  Checksum: 0x37
Checksum: 0x90

----------------

Block 2, Unknown EDID Extension Block 0x00:
  00 ff ff ff ff ff ff 00 0e 6f 05 16 00 00 00 00 '.........o......'
  00 1e 01 04 a5 22 16 78 03 ee 95 a3 54 4c 99 26 '.....".x....TL.&'
  0f 50 54 00 00 00 01 01 01 01 01 01 01 01 01 01 '.PT.............'
  01 01 01 01 01 01 6e 6e 00 a0 a0 40 84 60 30 20 '......nn...@.`0 '
  36 00 59 d7 10 00 00 18 00 00 00 fd 0c 3c a5 1f '6.Y..........<..'
  1f 4e 01 0a 20 20 20 20 20 20 00 00 00 fe 00 43 '.N..      .....C'
  53 4f 54 20 54 33 0a 20 20 20 20 20 00 00 00 fe 'SOT T3.     ....'
  00 53 4e 47 30 30 37 44 41 31 2d 31 0a 20 01 08 '.SNG007DA1-1. ..'
Checksum: 0x08

----------------

Block 3, DisplayID Extension Block:
  Version: 1.3
  Extension Count: 0
  Video Timing Modes Type 1 - Detailed Timings Data Block:
    DTD:  2560x1600  165.018764 Hz  16:10   285.812 kHz    777.410000 MHz (aspect 16:10, no 3D stereo, preferred)
               Hfront   48 Hsync  32 Hback   80 Hpol N
               Vfront    3 Vsync   6 Vback  123 Vpol N
  Checksum: 0x37
Checksum: 0x90

----------------

Warnings:

Block 0, Base EDID:
  Missing Display Product Name.
EDID:
  Base EDID: Some timings are out of range of the Monitor Ranges:
    Horizontal Freq: 103.933 - 285.812 kHz (Monitor: 286.000 - 286.000 kHz)

Failures:

Block 1, DisplayID Extension Block:
  DisplayID Base Block has no product type.
  Expected 0 DisplayID Extension Block, but got 1.
Block 2, Base EDID:
  Unknown Extension Block.
EDID:
  Base EDID: EDID specified 1 extension block(s), but found 3 extension block(s).
  DisplayID: Missing DisplayID Product Identification Data Block.

EDID conformity: FAIL
