edid-decode (hex):

00 ff ff ff ff ff ff 00 22 64 e9 03 19 75 00 00
21 16 01 03 80 16 0d 78 0a 8c 85 97 5b 53 8e 27
18 50 54 00 00 00 01 01 01 01 01 01 01 01 01 01
01 01 01 01 01 01 2d 11 00 9c 40 58 15 20 35 23
45 00 de 7d 00 00 00 19 00 00 00 fe 00 00 00 00
00 00 00 00 00 00 00 00 00 00 00 00 00 fc 00 48
53 44 31 30 31 50 46 57 32 41 0a 20 00 00 00 10
00 0a 20 20 20 20 20 20 20 20 20 20 20 20 00 88

----------------

Block 0, Base EDID:
  EDID Structure Version & Revision: 1.3
  Vendor & Product Identification:
    Manufacturer: HSD
    Model: 1001
    Serial Number: ...
    Made in: week 33 of 2012
  Basic Display Parameters & Features:
    Digital display
    Maximum image size: 22 cm x 13 cm
    Gamma: 2.20
    RGB color display
    First detailed timing is the preferred timing
  Color Characteristics:
    Red  : 0.5917, 0.3554
    Green: 0.3271, 0.5546
    Blue : 0.1542, 0.0937
    White: 0.3134, 0.3291
  Established Timings I & II: none
  Standard Timings: none
  Detailed Timing Descriptors:
    DTD 1:  1024x600    60.004367 Hz 128:75    37.263 kHz     43.970000 MHz (222 mm x 125 mm)
                 Hfront   53 Hsync  35 Hback   68 Hpol N
                 Vfront    4 Vsync   5 Vback   12 Vpol N
    Alphanumeric Data String: ''
    Display Product Name: 'HSD101PFW2A'
    Dummy Descriptor:
Checksum: 0x88

----------------

Failures:

Block 0, Base EDID:
  Alphanumeric Data String: Non-printable character.
  Dummy Descriptor: Dummy block filled with garbage.
  Missing Display Range Limits Descriptor.

EDID conformity: FAIL
