edid-decode (hex):

00 ff ff ff ff ff ff 00 22 64 e9 03 74 80 00 00
0a 13 01 03 80 16 0d 78 0a 86 26 94 57 51 90 27
21 4f 54 00 00 00 01 01 01 01 01 01 01 01 01 01
01 01 01 01 01 01 94 11 00 b0 40 58 19 20 35 23
45 00 dc 81 00 00 00 19 16 14 00 d8 40 58 26 20
5d 23 15 04 dc 81 00 00 00 00 00 00 00 fe 00 00
00 00 00 00 00 00 00 00 00 00 00 00 00 00 00 fe
00 00 00 00 00 00 00 00 00 01 00 00 00 00 00 db

00 ff ff ff ff ff ff 00 22 64 e9 03 74 80 00 00
0a 13 01 03 80 16 0d 78 0a 86 26 94 57 51 90 27
21 4f 54 00 00 00 01 01 01 01 01 01 01 01 01 01
01 01 01 01 01 01 94 11 00 b0 40 58 19 20 35 23
45 00 dc 81 00 00 00 19 16 14 00 d8 40 58 26 20
5d 23 15 04 dc 81 00 00 00 00 00 00 00 fe 00 00
00 00 00 00 00 00 00 00 00 00 00 00 00 00 00 fe
00 00 00 00 00 00 00 00 00 01 00 00 00 00 00 db

----------------

Block 0, Base EDID:
  EDID Structure Version & Revision: 1.3
  Vendor & Product Identification:
    Manufacturer: HSD
    Model: 1001
    Serial Number: ...
    Made in: week 10 of 2009
  Basic Display Parameters & Features:
    Digital display
    Maximum image size: 22 cm x 13 cm
    Gamma: 2.20
    RGB color display
    First detailed timing is the preferred timing
  Color Characteristics:
    Red  : 0.5800, 0.3398
    Green: 0.3173, 0.5644
    Blue : 0.1523, 0.1308
    White: 0.3095, 0.3300
  Established Timings I & II: none
  Standard Timings: none
  Detailed Timing Descriptors:
    DTD 1:  1024x600    60.000000 Hz 128:75    37.500 kHz     45.000000 MHz (DE timing only, 220 mm x 129 mm)
                 Hfront   53 Hsync  35 Hback   88 Hpol N
                 Vfront    4 Vsync   5 Vback   16 Vpol N
    DTD 2:  1024x600    64.996461 Hz 128:75    41.468 kHz     51.420000 MHz (DE timing only, 220 mm x 129 mm)
                 Hfront   93 Hsync  35 Hback   88 Hpol N
                 Vfront   17 Vsync   5 Vback   16 Vpol N
    SPWG Module Revision: 0
    SPWG Descriptor #3:
      SPWG PC Maker P/N: ''
      SPWG LCD Supplier EEDID Revision: 0
      SPWG Manufacturer P/N: ''
    SPWG Descriptor #4:
      SMBUS Values: 0x00 0x00 0x00 0x00 0x00 0x00 0x00 0x00
      LVDS Channels: 1
      Panel Self Test Not Present
Checksum: 0xdb

----------------

Block 1, Unknown EDID Extension Block 0x00:
  00 ff ff ff ff ff ff 00 22 64 e9 03 74 80 00 00 '........"d..t...'
  0a 13 01 03 80 16 0d 78 0a 86 26 94 57 51 90 27 '.......x..&.WQ.''
  21 4f 54 00 00 00 01 01 01 01 01 01 01 01 01 01 '!OT.............'
  01 01 01 01 01 01 94 11 00 b0 40 58 19 20 35 23 '..........@X. 5#'
  45 00 dc 81 00 00 00 19 16 14 00 d8 40 58 26 20 'E...........@X& '
  5d 23 15 04 dc 81 00 00 00 00 00 00 00 fe 00 00 ']#..............'
  00 00 00 00 00 00 00 00 00 00 00 00 00 00 00 fe '................'
  00 00 00 00 00 00 00 00 00 01 00 00 00 00 00 db '................'
Checksum: 0xdb

----------------

Failures:

Block 0, Base EDID:
  SPWG Descriptor #3: Invalid PC Maker P/N length.
  SPWG Descriptor #3: Non-printable character.
  SPWG Descriptor #4: Invalid trailing data.
  Missing Display Product Name.
  Missing Display Range Limits Descriptor.
Block 1, Base EDID:
  Unknown Extension Block.
EDID:
  Base EDID: EDID specified 0 extension block(s), but found 1 extension block(s).

EDID conformity: FAIL
