edid-decode (hex):

00 ff ff ff ff ff ff 00 22 64 e9 03 91 13 01 00
15 13 01 03 80 16 0d 78 0a 80 36 9a 5e 5d 91 28
20 4f 54 00 00 00 01 01 01 01 01 01 01 01 01 01
01 01 01 01 01 01 ec 13 00 ce 40 58 26 20 5d 23
15 04 dc 81 00 00 00 19 00 00 00 fd 00 37 41 22
29 05 00 0a 20 20 20 20 20 20 00 00 00 fc 00 48
53 44 31 30 30 49 46 57 31 0a 20 20 00 00 00 10
00 0a 20 20 20 20 20 20 20 20 20 20 20 20 00 57

----------------

Block 0, Base EDID:
  EDID Structure Version & Revision: 1.3
  Vendor & Product Identification:
    Manufacturer: HSD
    Model: 1001
    Serial Number: ...
    Made in: week 21 of 2009
  Basic Display Parameters & Features:
    Digital display
    Maximum image size: 22 cm x 13 cm
    Gamma: 2.20
    RGB color display
    First detailed timing is the preferred timing
  Color Characteristics:
    Red  : 0.6035, 0.3671
    Green: 0.3632, 0.5664
    Blue : 0.1562, 0.1279
    White: 0.3095, 0.3300
  Established Timings I & II: none
  Standard Timings: none
  Detailed Timing Descriptors:
    DTD 1:  1024x600    64.990 Hz 128:75   41.463 kHz  51.000 MHz (220 mm x 129 mm)
                 Hfront   93 Hsync  35 Hback  78 Hpol N
                 Vfront   17 Vsync   5 Vback  16 Vpol N
  Display Range Limits:
    Monitor ranges (GTF): 55-65 Hz V, 34-41 kHz H, max dotclock 50 MHz
    Display Product Name: 'HSD100IFW1'
    Dummy Descriptor:
Checksum: 0x57

----------------

Warnings:

EDID:
  Base EDID: Some timings are out of range of the Monitor Ranges:
    Maximum Clock: 51.000 MHz (Monitor: 50.000 MHz)
    Could be due to a Monitor Range off-by-one rounding issue

Failures:

Block 0, Base EDID:
  Dummy Descriptor: Dummy block filled with garbage.

EDID conformity: FAIL
