
EDID (hex):
00ffffffffffff002264e90307c10300
1614010380160d780a80369a5e5d9128
204f5400000001010101010101010101
010101010101ec1300e2405850205d23
1504dc8100000019000000fe00000000
00000000000000000000000000fc0048
5344313030494657310a202000000010
000a2020202020202020202020200082

Extracted contents:
header:          00 ff ff ff ff ff ff 00
serial number:   22 64 e9 03 07 c1 03 00 16 14
version:         01 03
basic params:    80 16 0d 78 0a
chroma info:     80 36 9a 5e 5d 91 28 20 4f 54
established:     00 00 00
standard:        01 01 01 01 01 01 01 01 01 01 01 01 01 01 01 01
descriptor 1:    ec 13 00 e2 40 58 50 20 5d 23 15 04 dc 81 00 00 00 19
descriptor 2:    00 00 00 fe 00 00 00 00 00 00 00 00 00 00 00 00 00 00
descriptor 3:    00 00 00 fc 00 48 53 44 31 30 30 49 46 57 31 0a 20 20
descriptor 4:    00 00 00 10 00 0a 20 20 20 20 20 20 20 20 20 20 20 20
extensions:      00
checksum:        82

EDID version: 1.3
Manufacturer: HSD Model 3e9 Serial Number --
Made in week 22 of 2010
Digital display
Maximum image size: 22 cm x 13 cm
Gamma: 2.20
RGB color display
First detailed timing is preferred timing
Display x,y Chromaticity:
  Red:   0.6035, 0.3671
  Green: 0.3632, 0.5664
  Blue:  0.1562, 0.1279
  White: 0.3095, 0.3300
Established timings supported:
Standard timings supported:
Detailed mode: Clock 51.000 MHz, 220 mm x 129 mm
               1024 1117 1152 1250 hborder 0
                600  617  622  680 vborder 0
               -hsync -vsync 
               VertFreq: 60 Hz, HorFreq: 40800 Hz
ASCII string: 
Monitor name: HSD100IFW1
Dummy block
Checksum: 0x82 (valid)
EDID block does NOT conform to EDID 1.3!
	Missing monitor ranges
	Detailed block string not properly terminated
EDID block does not conform at all!
	Dummy block filled with garbage
