
EDID (hex):
00ffffffffffff002264e903cea40000
1115010380160d780a8c85975b538e27
18505400000001010101010101010101
0101010101012c150030415850205d23
9508de7d00000019000000fe00000000
00000000000000000000000000fc0048
5344313031504657320a202000000010
000a2020202020202020202020200083

Extracted contents:
header:          00 ff ff ff ff ff ff 00
serial number:   22 64 e9 03 ce a4 00 00 11 15
version:         01 03
basic params:    80 16 0d 78 0a
chroma info:     8c 85 97 5b 53 8e 27 18 50 54
established:     00 00 00
standard:        01 01 01 01 01 01 01 01 01 01 01 01 01 01 01 01
descriptor 1:    2c 15 00 30 41 58 50 20 5d 23 95 08 de 7d 00 00 00 19
descriptor 2:    00 00 00 fe 00 00 00 00 00 00 00 00 00 00 00 00 00 00
descriptor 3:    00 00 00 fc 00 48 53 44 31 30 31 50 46 57 32 0a 20 20
descriptor 4:    00 00 00 10 00 0a 20 20 20 20 20 20 20 20 20 20 20 20
extensions:      00
checksum:        83

EDID version: 1.3
Manufacturer: HSD Model 3e9 Serial Number --
Made in week 17 of 2011
Digital display
Maximum image size: 22 cm x 13 cm
Gamma: 2.20
RGB color display
First detailed timing is preferred timing
Display x,y Chromaticity:
  Red:   0.5917, 0.3554
  Green: 0.3271, 0.5546
  Blue:  0.1542, 0.0937
  White: 0.3134, 0.3291
Established timings supported:
Standard timings supported:
Detailed mode: Clock 54.200 MHz, 222 mm x 125 mm
               1024 1117 1152 1328 hborder 0
                600  641  646  680 vborder 0
               -hsync -vsync 
               VertFreq: 60 Hz, HorFreq: 40813 Hz
ASCII string: 
Monitor name: HSD101PFW2
Dummy block
Checksum: 0x83 (valid)
EDID block does NOT conform to EDID 1.3!
	Missing monitor ranges
	Detailed block string not properly terminated
EDID block does not conform at all!
	Dummy block filled with garbage
