edid-decode (hex):

00 ff ff ff ff ff ff 00 22 64 e9 03 c4 bc 00 00
1d 14 01 03 80 16 0d 78 0a 8c 85 97 5b 53 8e 27
18 50 54 00 00 00 01 01 01 01 01 01 01 01 01 01
01 01 01 01 01 01 2c 15 00 30 41 58 50 20 5d 23
95 08 de 7d 00 00 00 19 00 00 00 fe 00 00 00 00
00 00 00 00 00 00 00 00 00 00 00 00 00 fc 00 48
53 44 31 30 31 50 46 57 32 0a 20 20 00 00 00 10
00 0a 20 20 20 20 20 20 20 20 20 20 20 20 00 6a

00 ff ff ff ff ff ff 00 22 64 e9 03 c4 bc 00 00
1d 14 01 03 80 16 0d 78 0a 8c 85 97 5b 53 8e 27
18 50 54 00 00 00 01 01 01 01 01 01 01 01 01 01
01 01 01 01 01 01 2c 15 00 30 41 58 50 20 5d 23
95 08 de 7d 00 00 00 19 00 00 00 fe 00 00 00 00
00 00 00 00 00 00 00 00 00 00 00 00 00 fc 00 48
53 44 31 30 31 50 46 57 32 0a 20 20 00 00 00 10
00 0a 20 20 20 20 20 20 20 20 20 20 20 20 00 6a

----------------

Block 0, Base EDID:
  EDID Structure Version & Revision: 1.3
  Vendor & Product Identification:
    Manufacturer: HSD
    Model: 1001
    Serial Number: ...
    Made in: week 29 of 2010
  Basic Display Parameters & Features:
    Digital display
    Maximum image size: 22 cm x 13 cm
    Gamma: 2.20
    RGB color display
    First detailed timing is the preferred timing
  Color Characteristics:
    Red  : 0.5917, 0.3554
    Green: 0.3271, 0.5546
    Blue : 0.1542, 0.0937
    White: 0.3134, 0.3291
  Established Timings I & II: none
  Standard Timings: none
  Detailed Timing Descriptors:
    DTD 1:  1024x600    60.019490 Hz 128:75    40.813 kHz     54.200000 MHz (222 mm x 125 mm)
                 Hfront   93 Hsync  35 Hback  176 Hpol N
                 Vfront   41 Vsync   5 Vback   34 Vpol N
    Alphanumeric Data String: ''
    Display Product Name: 'HSD101PFW2'
    Dummy Descriptor:
Checksum: 0x6a

----------------

Block 1, Unknown EDID Extension Block 0x00:
  00 ff ff ff ff ff ff 00 22 64 e9 03 c4 bc 00 00 '........"d......'
  1d 14 01 03 80 16 0d 78 0a 8c 85 97 5b 53 8e 27 '.......x....[S.''
  18 50 54 00 00 00 01 01 01 01 01 01 01 01 01 01 '.PT.............'
  01 01 01 01 01 01 2c 15 00 30 41 58 50 20 5d 23 '......,..0AXP ]#'
  95 08 de 7d 00 00 00 19 00 00 00 fe 00 00 00 00 '...}............'
  00 00 00 00 00 00 00 00 00 00 00 00 00 fc 00 48 '...............H'
  53 44 31 30 31 50 46 57 32 0a 20 20 00 00 00 10 'SD101PFW2.  ....'
  00 0a 20 20 20 20 20 20 20 20 20 20 20 20 00 6a '..            .j'
Checksum: 0x6a

----------------

Failures:

Block 0, Base EDID:
  Alphanumeric Data String: Non-printable character.
  Dummy Descriptor: Dummy block filled with garbage.
  Missing Display Range Limits Descriptor.
Block 1, Base EDID:
  Unknown Extension Block.
EDID:
  Base EDID: EDID specified 0 extension block(s), but found 1 extension block(s).

EDID conformity: FAIL
