
EDID (hex):
00ffffffffffff002264e903216e0100
2612010380160d780a80369a5e5d9128
204f5400000001010101010101010101
010101010101941100b0405819203523
4500dc8100000019000000fd00374122
2905000a202020202020000000fc0048
5344313030494657310a202000000010
000a20202020202020202020202000dd

Extracted contents:
header:          00 ff ff ff ff ff ff 00
serial number:   22 64 e9 03 21 6e 01 00 26 12
version:         01 03
basic params:    80 16 0d 78 0a
chroma info:     80 36 9a 5e 5d 91 28 20 4f 54
established:     00 00 00
standard:        01 01 01 01 01 01 01 01 01 01 01 01 01 01 01 01
descriptor 1:    94 11 00 b0 40 58 19 20 35 23 45 00 dc 81 00 00 00 19
descriptor 2:    00 00 00 fd 00 37 41 22 29 05 00 0a 20 20 20 20 20 20
descriptor 3:    00 00 00 fc 00 48 53 44 31 30 30 49 46 57 31 0a 20 20
descriptor 4:    00 00 00 10 00 0a 20 20 20 20 20 20 20 20 20 20 20 20
extensions:      00
checksum:        dd

EDID version: 1.3
Manufacturer: HSD Model 3e9 Serial Number --
Made in week 38 of 2008
Digital display
Maximum image size: 22 cm x 13 cm
Gamma: 2.20
RGB color display
First detailed timing is preferred timing
Display x,y Chromaticity:
  Red:   0.6035, 0.3671
  Green: 0.3632, 0.5664
  Blue:  0.1562, 0.1279
  White: 0.3095, 0.3300
Established timings supported:
Standard timings supported:
Detailed mode: Clock 45.000 MHz, 220 mm x 129 mm
               1024 1077 1112 1200 hborder 0
                600  604  609  625 vborder 0
               -hsync -vsync 
               VertFreq: 60 Hz, HorFreq: 37500 Hz
Monitor ranges (GTF): 55-65Hz V, 34-41kHz H, max dotclock 50MHz
Monitor name: HSD100IFW1
Dummy block
Checksum: 0xdd (valid)
EDID block does not conform at all!
	Dummy block filled with garbage


