
EDID (hex):
00ffffffffffff002264e9038a4c0000
1f15010380160d780a86269457519027
214f5400000001010101010101010101
010101010101941100b0405819203523
4500dc8100000019161400d840582620
5d231504dc8100000000000000fe0000
000000000000000000000000000000fe
000000000000000000010000000000e2

Extracted contents:
header:          00 ff ff ff ff ff ff 00
serial number:   22 64 e9 03 8a 4c 00 00 1f 15
version:         01 03
basic params:    80 16 0d 78 0a
chroma info:     86 26 94 57 51 90 27 21 4f 54
established:     00 00 00
standard:        01 01 01 01 01 01 01 01 01 01 01 01 01 01 01 01
descriptor 1:    94 11 00 b0 40 58 19 20 35 23 45 00 dc 81 00 00 00 19
descriptor 2:    16 14 00 d8 40 58 26 20 5d 23 15 04 dc 81 00 00 00 00
descriptor 3:    00 00 00 fe 00 00 00 00 00 00 00 00 00 00 00 00 00 00
descriptor 4:    00 00 00 fe 00 00 00 00 00 00 00 00 00 01 00 00 00 00
extensions:      00
checksum:        e2

EDID version: 1.3
Manufacturer: HSD Model 3e9 Serial Number --
Made in week 31 of 2011
Digital display
Maximum image size: 22 cm x 13 cm
Gamma: 2.20
RGB color display
First detailed timing is preferred timing
Display x,y Chromaticity:
  Red:   0.5800, 0.3398
  Green: 0.3173, 0.5644
  Blue:  0.1523, 0.1308
  White: 0.3095, 0.3300
Established timings supported:
Standard timings supported:
Detailed mode: Clock 45.000 MHz, 220 mm x 129 mm
               1024 1077 1112 1200 hborder 0
                600  604  609  625 vborder 0
               -hsync -vsync 
               VertFreq: 60 Hz, HorFreq: 37500 Hz
Detailed mode: Clock 51.420 MHz, 220 mm x 129 mm
               1024 1117 1152 1240 hborder 0
                600  617  622  638 vborder 0
               -hsync -vsync analog composite 
               VertFreq: 64 Hz, HorFreq: 41467 Hz
ASCII string: 
ASCII string: 
Checksum: 0xe2 (valid)
EDID block does NOT conform to EDID 1.3!
	Missing name descriptor
	Missing monitor ranges
	Detailed block string not properly terminated
