
EDID (hex):
00ffffffffffff004c834a4300000000
00180103951d1178eab5959358568d29
1f505400000001010101010101010101
010101010101238d8074c00810703020
250025a510000019238d80e0c108f570
3020250025a510000019000000fe0053
414d53554e470a204c83594c000000fe
004c544e313333594c30334c30310069

Extracted contents:
header:          00 ff ff ff ff ff ff 00
serial number:   4c 83 4a 43 00 00 00 00 00 18
version:         01 03
basic params:    95 1d 11 78 ea
chroma info:     b5 95 93 58 56 8d 29 1f 50 54
established:     00 00 00
standard:        01 01 01 01 01 01 01 01 01 01 01 01 01 01 01 01
descriptor 1:    23 8d 80 74 c0 08 10 70 30 20 25 00 25 a5 10 00 00 19
descriptor 2:    23 8d 80 e0 c1 08 f5 70 30 20 25 00 25 a5 10 00 00 19
descriptor 3:    00 00 00 fe 00 53 41 4d 53 55 4e 47 0a 20 4c 83 59 4c
descriptor 4:    00 00 00 fe 00 4c 54 4e 31 33 33 59 4c 30 33 4c 30 31
extensions:      00
checksum:        69

EDID version: 1.3
Manufacturer: SDC Model 434a Serial Number --
Made in year 2014
Digital display
DFP 1.x compatible TMDS
Maximum image size: 29 cm x 17 cm
Gamma: 2.20
DPMS levels: Standby Suspend Off
RGB color display
First detailed timing is preferred timing
Display x,y Chromaticity:
  Red:   0.5761, 0.3466
  Green: 0.3369, 0.5517
  Blue:  0.1621, 0.1220
  White: 0.3134, 0.3291
Established timings supported:
Standard timings supported:
Detailed mode: Clock 361.310 MHz, 293 mm x 165 mm
               3200 3248 3280 3316 hborder 0
               1800 1802 1807 1816 vborder 0
               -hsync -vsync 
               VertFreq: 59 Hz, HorFreq: 108959 Hz
Detailed mode: Clock 361.310 MHz, 293 mm x 165 mm
               3200 3248 3280 3680 hborder 0
               1800 1802 1807 2045 vborder 0
               -hsync -vsync 
               VertFreq: 48 Hz, HorFreq: 98182 Hz
ASCII string: SAMSUNG
ASCII string: LTN133YL03L01
Checksum: 0x69 (valid)
EDID block does NOT conform to EDID 1.3!
	Digital display field contains garbage: 14
	Missing name descriptor
	Missing monitor ranges
	Detailed block string not properly terminated
