
EDID (hex):
00ffffffffffff0010ac0ba14c483630
271e0103803c2278eeee91a3544c9926
0f5054a54b00714f81008180a940d1c0
010101010101565e00a0a0a029503020
3500ae514100001a000000ff00333242
5a5459320a2020202020000000fc0044
656c6c20553439313944570a000000fd
001856197319000a2020202020200173
020315b14890040302011f121367030c
0020003844023a801871382d40582c45
00ae514100001e565e00a0a0a0295030
203500ae514100001a011d007251d01e
206e285500aee24000001e0000000000
00000000000000000000000000000000
00000000000000000000000000000000
00000000000000000000000000000038

Extracted contents:
header:          00 ff ff ff ff ff ff 00
serial number:   10 ac 0b a1 4c 48 36 30 27 1e
version:         01 03
basic params:    80 3c 22 78 ee
chroma info:     ee 91 a3 54 4c 99 26 0f 50 54
established:     a5 4b 00
standard:        71 4f 81 00 81 80 a9 40 d1 c0 01 01 01 01 01 01
descriptor 1:    56 5e 00 a0 a0 a0 29 50 30 20 35 00 ae 51 41 00 00 1a
descriptor 2:    00 00 00 ff 00 33 32 42 5a 54 59 32 0a 20 20 20 20 20
descriptor 3:    00 00 00 fc 00 44 65 6c 6c 20 55 34 39 31 39 44 57 0a
descriptor 4:    00 00 00 fd 00 18 56 19 73 19 00 0a 20 20 20 20 20 20
extensions:      01
checksum:        73

EDID version: 1.3
Manufacturer: DEL Model a10b Serial Number --
Made in week 39 of 2020
Digital display
Maximum image size: 60 cm x 34 cm
Gamma: 2.20
DPMS levels: Standby Suspend Off
RGB color display
Default (sRGB) color space is primary color space
First detailed timing is preferred timing
Display x,y Chromaticity:
  Red:   0.6396, 0.3300
  Green: 0.2998, 0.5996
  Blue:  0.1503, 0.0595
  White: 0.3125, 0.3291
Established timings supported:
  720x400@70Hz 9:5 HorFreq: 31469 Hz Clock: 28.320 MHz
  640x480@60Hz 4:3 HorFreq: 31469 Hz Clock: 25.175 MHz
  640x480@75Hz 4:3 HorFreq: 37500 Hz Clock: 31.500 MHz
  800x600@60Hz 4:3 HorFreq: 37900 Hz Clock: 40.000 MHz
  800x600@75Hz 4:3 HorFreq: 46900 Hz Clock: 49.500 MHz
  1024x768@60Hz 4:3 HorFreq: 48400 Hz Clock: 65.000 MHz
  1024x768@75Hz 4:3 HorFreq: 60000 Hz Clock: 78.750 MHz
  1280x1024@75Hz 5:4 HorFreq: 80000 Hz Clock: 135.000 MHz
Standard timings supported:
  1152x864@75Hz 4:3 HorFreq: 67500 Hz Clock: 108.000 MHz
  1280x800@60Hz 16:10
  1280x1024@60Hz 5:4 HorFreq: 64000 Hz Clock: 108.000 MHz
  1600x1200@60Hz 4:3 HorFreq: 75000 Hz Clock: 162.000 MHz
  1920x1080@60Hz 16:9
Detailed mode: Clock 241.500 MHz, 1198 mm x 337 mm
               2560 2608 2640 2720 hborder 0
               1440 1443 1448 1481 vborder 0
               +hsync -vsync 
               VertFreq: 59 Hz, HorFreq: 88786 Hz
Serial number: --
Monitor name: Dell U4919DW
Monitor ranges (GTF): 24-86Hz V, 25-115kHz H, max dotclock 250MHz
Has 1 extension blocks
Checksum: 0x73 (valid)

CTA extension block
Extension version: 3
17 bytes of CTA data
  Video data block
    VIC  16 1920x1080@60Hz 16:9 (native) HorFreq: 67500 Hz Clock: 148.500 MHz
    VIC   4 1280x720@60Hz 16:9  HorFreq: 45000 Hz Clock: 74.250 MHz
    VIC   3 720x480@60Hz 16:9  HorFreq: 31469 Hz Clock: 27.000 MHz
    VIC   2 720x480@60Hz 4:3  HorFreq: 31469 Hz Clock: 27.000 MHz
    VIC   1 640x480@60Hz 4:3  HorFreq: 31469 Hz Clock: 25.175 MHz
    VIC  31 1920x1080@50Hz 16:9  HorFreq: 56250 Hz Clock: 148.500 MHz
    VIC  18 720x576@50Hz 16:9  HorFreq: 31250 Hz Clock: 27.000 MHz
    VIC  19 1280x720@50Hz 16:9  HorFreq: 37500 Hz Clock: 74.250 MHz
  Vendor-specific data block, OUI 000c03 (HDMI)
    Source physical address 2.0.0.0
    DC_36bit
    DC_30bit
    DC_Y444
    Maximum TMDS clock: 340MHz
Underscans PC formats by default
Supports YCbCr 4:4:4
Supports YCbCr 4:2:2
1 native detailed modes
Detailed mode: Clock 148.500 MHz, 1198 mm x 337 mm
               1920 2008 2052 2200 hborder 0
               1080 1084 1089 1125 vborder 0
               +hsync +vsync 
               VertFreq: 60 Hz, HorFreq: 67500 Hz
Detailed mode: Clock 241.500 MHz, 1198 mm x 337 mm
               2560 2608 2640 2720 hborder 0
               1440 1443 1448 1481 vborder 0
               +hsync -vsync 
               VertFreq: 59 Hz, HorFreq: 88786 Hz
Detailed mode: Clock 74.250 MHz, 1198 mm x 226 mm
               1280 1390 1430 1650 hborder 0
                720  725  730  750 vborder 0
               +hsync +vsync 
               VertFreq: 60 Hz, HorFreq: 45000 Hz
Checksum: 0x38 (valid)

EDID block does not conform at all!
	Both the serial number and the serial string are set
