edid-decode (hex):

00 ff ff ff ff ff ff 00 4c 2d 56 60 00 00 00 00
04 09 01 01 0f 1e 17 61 e8 b5 a5 9e 57 4c 98 25
1a 4b 53 b7 6e 00 31 4f 45 4f 61 4f 01 01 01 01
01 01 01 01 01 01 4e 0c 80 c8 20 e0 14 10 10 40
13 00 30 e4 10 00 00 18 56 13 20 00 31 58 19 20
10 50 13 00 30 e4 10 00 00 1e c3 1e 00 20 41 00
20 30 10 60 13 00 30 e4 10 00 00 1e 00 00 00 fd
00 32 4b 1e 3d 08 00 0a 20 20 20 20 20 20 00 d5

----------------

Block 0, Base EDID:
  EDID Structure Version & Revision: 1.1
  Vendor & Product Identification:
    Manufacturer: SAM
    Model: 24662
    Made in: week 4 of 1999
  Basic Display Parameters & Features:
    Analog display
    Input voltage level: 0.7/0.3 V
    Blank level equals black level
    Sync: Separate Composite SyncOnGreen Serration
    Maximum image size: 30 cm x 23 cm
    Gamma: 1.97
    DPMS levels: Standby Suspend Off
    RGB color display
  Color Characteristics:
    Red  : 0.6191, 0.3427
    Green: 0.2978, 0.5947
    Blue : 0.1464, 0.1035
    White: 0.2939, 0.3251
  Established Timings I & II:
    IBM     :   720x400    70.082 Hz   9:5    31.467 kHz  28.320 MHz
    DMT 0x04:   640x480    59.940 Hz   4:3    31.469 kHz  25.175 MHz
    Apple   :   640x480    66.667 Hz   4:3    35.000 kHz  30.240 MHz
    DMT 0x06:   640x480    75.000 Hz   4:3    37.500 kHz  31.500 MHz
    DMT 0x08:   800x600    56.250 Hz   4:3    35.156 kHz  36.000 MHz
    DMT 0x09:   800x600    60.317 Hz   4:3    37.879 kHz  40.000 MHz
    DMT 0x0b:   800x600    75.000 Hz   4:3    46.875 kHz  49.500 MHz
    Apple   :   832x624    74.551 Hz   4:3    49.726 kHz  57.284 MHz
    DMT 0x10:  1024x768    60.004 Hz   4:3    48.363 kHz  65.000 MHz
    DMT 0x11:  1024x768    70.069 Hz   4:3    56.476 kHz  75.000 MHz
    DMT 0x12:  1024x768    75.029 Hz   4:3    60.023 kHz  78.750 MHz
  Standard Timings:
    DMT 0x06:   640x480    75.000 Hz   4:3    37.500 kHz  31.500 MHz
    DMT 0x0b:   800x600    75.000 Hz   4:3    46.875 kHz  49.500 MHz
    DMT 0x12:  1024x768    75.029 Hz   4:3    60.023 kHz  78.750 MHz
  Detailed Timing Descriptors:
    DTD 1:   640x480    75.000 Hz   4:3    37.500 kHz  31.500 MHz (304 mm x 228 mm)
                 Hfront   16 Hsync  64 Hback 120 Hpol N
                 Vfront    1 Vsync   3 Vback  16 Vpol N
    DTD 2:   800x600    75.000 Hz   4:3    46.875 kHz  49.500 MHz (304 mm x 228 mm)
                 Hfront   16 Hsync  80 Hback 160 Hpol P
                 Vfront    1 Vsync   3 Vback  21 Vpol P
    DTD 3:  1024x768    75.029 Hz   4:3    60.023 kHz  78.750 MHz (304 mm x 228 mm)
                 Hfront   16 Hsync  96 Hback 176 Hpol P
                 Vfront    1 Vsync   3 Vback  28 Vpol P
  Display Range Limits:
    Monitor ranges (GTF): 50-75 Hz V, 30-61 kHz H, max dotclock 80 MHz
Checksum: 0xd5

----------------

Warnings:

Block 0, Base EDID:
  EDID Structure Version & Revision: EDID 1.1 is deprecated, do not use.

EDID conformity: PASS
