edid-decode (hex):

00 ff ff ff ff ff ff 00 30 ae b0 66 48 54 4c 37
22 1e 01 03 6c 35 1e 78 2e 64 f5 a8 54 51 9d 26
15 50 54 ad cf 00 81 80 81 8a 81 00 95 00 a9 c0
b3 00 d1 c0 01 01 02 3a 80 18 71 38 2d 40 58 2c
45 00 0f 28 21 00 00 1e 00 00 00 ff 00 55 37 36
30 37 4c 54 48 0a 20 20 20 20 00 00 00 fd 00 30
4b 1e 53 15 00 0a 20 20 20 20 20 20 00 00 00 fc
00 43 32 34 2d 32 35 0a 20 20 20 20 20 20 00 4d

00 ff ff ff ff ff ff 00 30 ae b0 66 48 54 4c 37
22 1e 01 03 6c 35 1e 78 2e 64 f5 a8 54 51 9d 26
15 50 54 ad cf 00 81 80 81 8a 81 00 95 00 a9 c0
b3 00 d1 c0 01 01 02 3a 80 18 71 38 2d 40 58 2c
45 00 0f 28 21 00 00 1e 00 00 00 ff 00 55 37 36
30 37 4c 54 48 0a 20 20 20 20 00 00 00 fd 00 30
4b 1e 53 15 00 0a 20 20 20 20 20 20 00 00 00 fc
00 43 32 34 2d 32 35 0a 20 20 20 20 20 20 00 4d

----------------

Block 0, Base EDID:
  EDID Structure Version & Revision: 1.3
  Vendor & Product Identification:
    Manufacturer: LEN
    Model: 26288
    Serial Number: ...
    Made in: week 34 of 2020
  Basic Display Parameters & Features:
    Analog display
    Signal Level Standard: 0.700 : 0.000 : 0.700 V p-p
    Blank level equals black level
    Sync: Separate Composite
    Maximum image size: 53 cm x 30 cm
    Gamma: 2.20
    DPMS levels: Off
    RGB color display
    Default (sRGB) color space is primary color space
    First detailed timing is the preferred timing
  Color Characteristics:
    Red  : 0.6572, 0.3300
    Green: 0.3173, 0.6132
    Blue : 0.1513, 0.0849
    White: 0.3134, 0.3291
  Established Timings I & II:
    IBM     :   720x400    70.081663 Hz   9:5     31.467 kHz     28.320000 MHz
    DMT 0x04:   640x480    59.940476 Hz   4:3     31.469 kHz     25.175000 MHz
    DMT 0x05:   640x480    72.808802 Hz   4:3     37.861 kHz     31.500000 MHz
    DMT 0x06:   640x480    75.000000 Hz   4:3     37.500 kHz     31.500000 MHz
    DMT 0x09:   800x600    60.316541 Hz   4:3     37.879 kHz     40.000000 MHz
    DMT 0x0a:   800x600    72.187572 Hz   4:3     48.077 kHz     50.000000 MHz
    DMT 0x0b:   800x600    75.000000 Hz   4:3     46.875 kHz     49.500000 MHz
    DMT 0x10:  1024x768    60.003840 Hz   4:3     48.363 kHz     65.000000 MHz
    DMT 0x11:  1024x768    70.069359 Hz   4:3     56.476 kHz     75.000000 MHz
    DMT 0x12:  1024x768    75.028582 Hz   4:3     60.023 kHz     78.750000 MHz
    DMT 0x24:  1280x1024   75.024675 Hz   5:4     79.976 kHz    135.000000 MHz
  Standard Timings:
    DMT 0x23:  1280x1024   60.019740 Hz   5:4     63.981 kHz    108.000000 MHz
    GTF     :  1280x1024   69.999805 Hz   5:4     74.620 kHz    128.943000 MHz
    DMT 0x1c:  1280x800    59.810326 Hz  16:10    49.702 kHz     83.500000 MHz
    DMT 0x2f:  1440x900    59.887445 Hz  16:10    55.935 kHz    106.500000 MHz
    DMT 0x53:  1600x900    60.000000 Hz  16:9     60.000 kHz    108.000000 MHz (RB)
    DMT 0x3a:  1680x1050   59.954250 Hz  16:10    65.290 kHz    146.250000 MHz
    DMT 0x52:  1920x1080   60.000000 Hz  16:9     67.500 kHz    148.500000 MHz
  Detailed Timing Descriptors:
    DTD 1:  1920x1080   60.000000 Hz  16:9     67.500 kHz    148.500000 MHz (527 mm x 296 mm)
                 Hfront   88 Hsync  44 Hback  148 Hpol P
                 Vfront    4 Vsync   5 Vback   36 Vpol P
    Display Product Serial Number: ...
    Display Range Limits:
      Monitor ranges (GTF): 48-75 Hz V, 30-83 kHz H, max dotclock 210 MHz
    Display Product Name: 'C24-25'
Checksum: 0x4d

----------------

Block 1, Unknown EDID Extension Block 0x00:
  00 ff ff ff ff ff ff 00 30 ae b0 66 48 54 4c 37 '........0..fHTL7'
  22 1e 01 03 6c 35 1e 78 2e 64 f5 a8 54 51 9d 26 '"...l5.x.d..TQ.&'
  15 50 54 ad cf 00 81 80 81 8a 81 00 95 00 a9 c0 '.PT.............'
  b3 00 d1 c0 01 01 02 3a 80 18 71 38 2d 40 58 2c '.......:..q8-@X,'
  45 00 0f 28 21 00 00 1e 00 00 00 ff 00 55 37 36 'E..(!........U76'
  30 37 4c 54 48 0a 20 20 20 20 00 00 00 fd 00 30 '07LTH.    .....0'
  4b 1e 53 15 00 0a 20 20 20 20 20 20 00 00 00 fc 'K.S...      ....'
  00 43 32 34 2d 32 35 0a 20 20 20 20 20 20 00 4d '.C24-25.      .M'
Checksum: 0x4d

----------------

Failures:

Block 0, Base EDID:
  Basic Display Parameters & Features: sRGB is signaled, but the chromaticities do not match.
Block 1, Base EDID:
  Unknown Extension Block.
EDID:
  Base EDID: EDID specified 0 extension block(s), but found 1 extension block(s).

EDID conformity: FAIL
