
EDID (hex):
00ffffffffffff0006b3212427ee0000
241e0104a5351e783b51b5a4544fa026
0d5054bfcf00814081809500714f81c0
b30001010101023a801871382d40582c
45000f282100001e0882805070384d40
0820f80c0f282100001a000000fd0030
90b4b422010a202020202020000000fc
00415355532056473234390a20200159
020330f14d010304131f120211900e0f
1d1e230907078301000067030c001000
00446d1a000002013090000000000000
fe5b80a070383540302035000f282100
001a866f80a070384040302035000f28
2100001a000000000000000000000000
00000000000000000000000000000000
000000000000000000000000000000b3

Extracted contents:
header:          00 ff ff ff ff ff ff 00
serial number:   06 b3 21 24 27 ee 00 00 24 1e
version:         01 04
basic params:    a5 35 1e 78 3b
chroma info:     51 b5 a4 54 4f a0 26 0d 50 54
established:     bf cf 00
standard:        81 40 81 80 95 00 71 4f 81 c0 b3 00 01 01 01 01
descriptor 1:    02 3a 80 18 71 38 2d 40 58 2c 45 00 0f 28 21 00 00 1e
descriptor 2:    08 82 80 50 70 38 4d 40 08 20 f8 0c 0f 28 21 00 00 1a
descriptor 3:    00 00 00 fd 00 30 90 b4 b4 22 01 0a 20 20 20 20 20 20
descriptor 4:    00 00 00 fc 00 41 53 55 53 20 56 47 32 34 39 0a 20 20
extensions:      01
checksum:        59

EDID version: 1.4
Manufacturer: AUS Model 2421 Serial Number --
Made in week 36 of 2020
Digital display
8 bits per primary color channel
DisplayPort interface
Maximum image size: 53 cm x 30 cm
Gamma: 2.20
DPMS levels: Off
Supported color formats: RGB 4:4:4, YCrCb 4:4:4, YCrCb 4:2:2
First detailed timing includes the native pixel format and preferred refresh rate
Display is continuous frequency
Display x,y Chromaticity:
  Red:   0.6416, 0.3291
  Green: 0.3085, 0.6259
  Blue:  0.1503, 0.0537
  White: 0.3134, 0.3291
Established timings supported:
  720x400@70Hz 9:5 HorFreq: 31469 Hz Clock: 28.320 MHz
  640x480@60Hz 4:3 HorFreq: 31469 Hz Clock: 25.175 MHz
  640x480@67Hz 4:3 HorFreq: 35000 Hz Clock: 30.240 MHz
  640x480@72Hz 4:3 HorFreq: 37900 Hz Clock: 31.500 MHz
  640x480@75Hz 4:3 HorFreq: 37500 Hz Clock: 31.500 MHz
  800x600@56Hz 4:3 HorFreq: 35200 Hz Clock: 36.000 MHz
  800x600@60Hz 4:3 HorFreq: 37900 Hz Clock: 40.000 MHz
  800x600@72Hz 4:3 HorFreq: 48100 Hz Clock: 50.000 MHz
  800x600@75Hz 4:3 HorFreq: 46900 Hz Clock: 49.500 MHz
  1024x768@60Hz 4:3 HorFreq: 48400 Hz Clock: 65.000 MHz
  1024x768@70Hz 4:3 HorFreq: 56500 Hz Clock: 75.000 MHz
  1024x768@75Hz 4:3 HorFreq: 60000 Hz Clock: 78.750 MHz
  1280x1024@75Hz 5:4 HorFreq: 80000 Hz Clock: 135.000 MHz
Standard timings supported:
  1280x960@60Hz 4:3 HorFreq: 60000 Hz Clock: 108.000 MHz
  1280x1024@60Hz 5:4 HorFreq: 64000 Hz Clock: 108.000 MHz
  1440x900@60Hz 16:10 HorFreq: 55500 Hz Clock: 88.750 MHz
  1152x864@75Hz 4:3 HorFreq: 67500 Hz Clock: 108.000 MHz
  1280x720@60Hz 16:9
  1680x1050@60Hz 16:10 HorFreq: 64700 Hz Clock: 119.000 MHz
Detailed mode: Clock 148.500 MHz, 527 mm x 296 mm
               1920 2008 2052 2200 hborder 0
               1080 1084 1089 1125 vborder 0
               +hsync +vsync 
               VertFreq: 60 Hz, HorFreq: 67500 Hz
Detailed mode: Clock 332.880 MHz, 527 mm x 296 mm
               1920 1928 1960 2000 hborder 0
               1080 1143 1151 1157 vborder 0
               +hsync -vsync 
               VertFreq: 143 Hz, HorFreq: 166440 Hz
Monitor ranges (bare limits): 48-144Hz V, 180-180kHz H, max dotclock 340MHz
Monitor name: ASUS VG249
Has 1 extension blocks
Checksum: 0x59 (valid)

CTA extension block
Extension version: 3
44 bytes of CTA data
  Video data block
    VIC   1 640x480@60Hz 4:3  HorFreq: 31469 Hz Clock: 25.175 MHz
    VIC   3 720x480@60Hz 16:9  HorFreq: 31469 Hz Clock: 27.000 MHz
    VIC   4 1280x720@60Hz 16:9  HorFreq: 45000 Hz Clock: 74.250 MHz
    VIC  19 1280x720@50Hz 16:9  HorFreq: 37500 Hz Clock: 74.250 MHz
    VIC  31 1920x1080@50Hz 16:9  HorFreq: 56250 Hz Clock: 148.500 MHz
    VIC  18 720x576@50Hz 16:9  HorFreq: 31250 Hz Clock: 27.000 MHz
    VIC   2 720x480@60Hz 4:3  HorFreq: 31469 Hz Clock: 27.000 MHz
    VIC  17 720x576@50Hz 4:3  HorFreq: 31250 Hz Clock: 27.000 MHz
    VIC  16 1920x1080@60Hz 16:9 (native) HorFreq: 67500 Hz Clock: 148.500 MHz
    VIC  14 1440x480@60Hz 4:3  HorFreq: 31469 Hz Clock: 54.000 MHz
    VIC  15 1440x480@60Hz 16:9  HorFreq: 31469 Hz Clock: 54.000 MHz
    VIC  29 1440x576@50Hz 4:3  HorFreq: 31250 Hz Clock: 54.000 MHz
    VIC  30 1440x576@50Hz 16:9  HorFreq: 31250 Hz Clock: 54.000 MHz
  Audio data block
    Linear PCM, max channels 2
      Supported sample rates (kHz): 48 44.1 32
      Supported sample sizes (bits): 24 20 16
  Speaker allocation data block
    Speaker map:
      FL/FR - Front Left/Right
  Vendor-specific data block, OUI 000c03 (HDMI)
    Source physical address 1.0.0.0
    Maximum TMDS clock: 340MHz
  Vendor-specific data block, OUI 00001a
Underscans PC formats by default
Basic audio support
Supports YCbCr 4:4:4
Supports YCbCr 4:2:2
1 native detailed modes
Detailed mode: Clock 235.500 MHz, 527 mm x 296 mm
               1920 1968 2000 2080 hborder 0
               1080 1083 1088 1133 vborder 0
               +hsync -vsync 
               VertFreq: 99 Hz, HorFreq: 113221 Hz
Detailed mode: Clock 285.500 MHz, 527 mm x 296 mm
               1920 1968 2000 2080 hborder 0
               1080 1083 1088 1144 vborder 0
               +hsync -vsync 
               VertFreq: 119 Hz, HorFreq: 137259 Hz
Checksum: 0xb3 (valid)

Warning: One or more of the timings is out of range of the Monitor Ranges:
  Vertical Freq: 50 - 143 Hz
  Horizontal Freq: 31250 - 166440 Hz
  Maximum Clock: 332.880 MHz


