
EDID (hex):
00ffffffffffff004eae38008a1b0000
0e1301030e291a878ad7a5a2594a9624
145054afcf0001010101818001010101
0101010101019a29a0d0518422305098
36009a011100001c000000fd00374c33
9b0d000a202020202020000000fc0053
554e504c55530a2020202020000000ff
004b4d3536414b0a2020202020200049

Extracted contents:
header:          00 ff ff ff ff ff ff 00
serial number:   4e ae 38 00 8a 1b 00 00 0e 13
version:         01 03
basic params:    0e 29 1a 87 8a
chroma info:     d7 a5 a2 59 4a 96 24 14 50 54
established:     af cf 00
standard:        01 01 01 01 81 80 01 01 01 01 01 01 01 01 01 01
descriptor 1:    9a 29 a0 d0 51 84 22 30 50 98 36 00 9a 01 11 00 00 1c
descriptor 2:    00 00 00 fd 00 37 4c 33 9b 0d 00 0a 20 20 20 20 20 20
descriptor 3:    00 00 00 fc 00 53 55 4e 50 4c 55 53 0a 20 20 20 20 20
descriptor 4:    00 00 00 ff 00 4b 4d 35 36 41 4b 0a 20 20 20 20 20 20
extensions:      00
checksum:        49

EDID version: 1.3
Manufacturer: SUN Model 38 Serial Number --
Made in week 14 of 2009
Analog display, Input voltage level: 0.7/0.3 V
Sync: Separate Composite SyncOnGreen 
Maximum image size: 41 cm x 26 cm
Gamma: 2.35
DPMS levels: Standby
RGB color display
First detailed timing is preferred timing
Display x,y Chromaticity:
  Red:   0.6357, 0.3486
  Green: 0.2900, 0.5888
  Blue:  0.1425, 0.0800
  White: 0.3134, 0.3291
Established timings supported:
  720x400@70Hz 9:5 HorFreq: 31469 Hz Clock: 28.320 MHz
  640x480@60Hz 4:3 HorFreq: 31469 Hz Clock: 25.175 MHz
  640x480@72Hz 4:3 HorFreq: 37900 Hz Clock: 31.500 MHz
  640x480@75Hz 4:3 HorFreq: 37500 Hz Clock: 31.500 MHz
  800x600@56Hz 4:3 HorFreq: 35200 Hz Clock: 36.000 MHz
  800x600@60Hz 4:3 HorFreq: 37900 Hz Clock: 40.000 MHz
  800x600@72Hz 4:3 HorFreq: 48100 Hz Clock: 50.000 MHz
  800x600@75Hz 4:3 HorFreq: 46900 Hz Clock: 49.500 MHz
  1024x768@60Hz 4:3 HorFreq: 48400 Hz Clock: 65.000 MHz
  1024x768@70Hz 4:3 HorFreq: 56500 Hz Clock: 75.000 MHz
  1024x768@75Hz 4:3 HorFreq: 60000 Hz Clock: 78.750 MHz
  1280x1024@75Hz 5:4 HorFreq: 80000 Hz Clock: 135.000 MHz
Standard timings supported:
  1280x1024@60Hz 5:4 HorFreq: 64000 Hz Clock: 108.000 MHz
Detailed mode: Clock 106.500 MHz, 410 mm x 257 mm
               1440 1520 1672 1904 hborder 0
                900  903  909  934 vborder 0
               -hsync +vsync 
               VertFreq: 59 Hz, HorFreq: 55934 Hz
Monitor ranges (GTF): 55-76Hz V, 51-155kHz H, max dotclock 130MHz
Monitor name: SUNPLUS
Serial number: --
Checksum: 0x49 (valid)
One or more of the timings is out of range of the Monitor Ranges:
  Vertical Freq: 56 - 75 Hz
  Horizontal Freq: 31469 - 80000 Hz
  Maximum Clock: 135.000 MHz
