
EDID (hex):
00ffffffffffff00410c5cc0c1170000
32140103682c19782a9535a159579f27
0e5054bd4b0081c081008180a9c00101
010101010101302a40c8608464301850
1300bbf91000001e000000ff00415533
31303530303036303831000000fc0050
68696c69707320323032454c000000fd
00384c1e5311000a2020202020200082

Extracted contents:
header:          00 ff ff ff ff ff ff 00
serial number:   41 0c 5c c0 c1 17 00 00 32 14
version:         01 03
basic params:    68 2c 19 78 2a
chroma info:     95 35 a1 59 57 9f 27 0e 50 54
established:     bd 4b 00
standard:        81 c0 81 00 81 80 a9 c0 01 01 01 01 01 01 01 01
descriptor 1:    30 2a 40 c8 60 84 64 30 18 50 13 00 bb f9 10 00 00 1e
descriptor 2:    00 00 00 ff 00 41 55 33 31 30 35 30 30 30 36 30 38 31
descriptor 3:    00 00 00 fc 00 50 68 69 6c 69 70 73 20 32 30 32 45 4c
descriptor 4:    00 00 00 fd 00 38 4c 1e 53 11 00 0a 20 20 20 20 20 20
extensions:      00
checksum:        82

EDID version: 1.3
Manufacturer: PHL Model c05c Serial Number --
Made in week 50 of 2010
Analog display, Input voltage level: 0.7/0.7 V
Sync: Separate 
Maximum image size: 44 cm x 25 cm
Gamma: 2.20
DPMS levels: Off
RGB color display
First detailed timing is preferred timing
Display x,y Chromaticity:
  Red:   0.6308, 0.3486
  Green: 0.3408, 0.6220
  Blue:  0.1523, 0.0576
  White: 0.3134, 0.3291
Established timings supported:
  720x400@70Hz 9:5 HorFreq: 31469 Hz Clock: 28.320 MHz
  640x480@60Hz 4:3 HorFreq: 31469 Hz Clock: 25.175 MHz
  640x480@67Hz 4:3 HorFreq: 35000 Hz Clock: 30.240 MHz
  640x480@72Hz 4:3 HorFreq: 37900 Hz Clock: 31.500 MHz
  640x480@75Hz 4:3 HorFreq: 37500 Hz Clock: 31.500 MHz
  800x600@60Hz 4:3 HorFreq: 37900 Hz Clock: 40.000 MHz
  800x600@75Hz 4:3 HorFreq: 46900 Hz Clock: 49.500 MHz
  1024x768@60Hz 4:3 HorFreq: 48400 Hz Clock: 65.000 MHz
  1024x768@75Hz 4:3 HorFreq: 60000 Hz Clock: 78.750 MHz
  1280x1024@75Hz 5:4 HorFreq: 80000 Hz Clock: 135.000 MHz
Standard timings supported:
  1280x720@60Hz 16:9
  1280x800@60Hz 16:10
  1280x1024@60Hz 5:4 HorFreq: 64000 Hz Clock: 108.000 MHz
  1600x900@60Hz 16:9
Detailed mode: Clock 108.000 MHz, 443 mm x 249 mm
               1600 1624 1704 1800 hborder 0
                900  901  904 1000 vborder 0
               +hsync +vsync 
               VertFreq: 60 Hz, HorFreq: 60000 Hz
Serial number: --
Monitor ranges (GTF): 56-76Hz V, 30-83kHz H, max dotclock 170MHz
Checksum: 0x82 (valid)
EDID block does NOT conform to EDID 1.3!
	Name descriptor not terminated with a newline


