edid-decode (hex):

00 ff ff ff ff ff ff 00 22 0e 40 13 00 00 00 00
00 1d 01 04 a5 35 1e 78 0a 45 95 a7 56 52 9c 27
0f 50 54 00 00 00 01 01 01 01 01 01 01 01 01 01
01 01 01 01 01 01 40 38 80 00 71 38 14 40 30 20
84 00 0f 28 21 00 00 1e 00 00 00 ff 00 38 43 4e
32 33 36 30 36 39 59 0d 0a 00 00 00 00 10 00 00
00 00 00 00 00 00 00 00 00 00 00 00 00 00 00 fc
00 48 50 20 34 30 30 20 47 36 20 41 69 4f 00 79

00 ff ff ff ff ff ff 00 22 0e 40 13 00 00 00 00
00 1d 01 04 a5 35 1e 78 0a 45 95 a7 56 52 9c 27
0f 50 54 00 00 00 01 01 01 01 01 01 01 01 01 01
01 01 01 01 01 01 40 38 80 00 71 38 14 40 30 20
84 00 0f 28 21 00 00 1e 00 00 00 ff 00 38 43 4e
32 33 36 30 36 39 59 0d 0a 00 00 00 00 10 00 00
00 00 00 00 00 00 00 00 00 00 00 00 00 00 00 fc
00 48 50 20 34 30 30 20 47 36 20 41 69 4f 00 79

----------------

Block 0, Base EDID:
  EDID Structure Version & Revision: 1.4
  Vendor & Product Identification:
    Manufacturer: HPN
    Model: 4928
    Made in: 2019
  Basic Display Parameters & Features:
    Digital display
    Bits per primary color channel: 8
    DisplayPort interface
    Maximum image size: 53 cm x 30 cm
    Gamma: 2.20
    Supported color formats: RGB 4:4:4, YCrCb 4:4:4
    First detailed timing includes the native pixel format and preferred refresh rate
  Color Characteristics:
    Red  : 0.6533, 0.3359
    Green: 0.3212, 0.6103
    Blue : 0.1542, 0.0595
    White: 0.3134, 0.3291
  Established Timings I & II: none
  Standard Timings: none
  Detailed Timing Descriptors:
    DTD 1:  1920x1080   60.160428 Hz  16:9     66.176 kHz    144.000000 MHz (527 mm x 296 mm)
                 Hfront   48 Hsync  32 Hback  176 Hpol P
                 Vfront    8 Vsync   4 Vback    8 Vpol P
    Display Product Serial Number: ...
    Dummy Descriptor:
    Display Product Name: 'HP 400 G6 AiO'
Checksum: 0x79

----------------

Block 1, Unknown EDID Extension Block 0x00:
  00 ff ff ff ff ff ff 00 22 0e 40 13 00 00 00 00 '........".@.....'
  00 1d 01 04 a5 35 1e 78 0a 45 95 a7 56 52 9c 27 '.....5.x.E..VR.''
  0f 50 54 00 00 00 01 01 01 01 01 01 01 01 01 01 '.PT.............'
  01 01 01 01 01 01 40 38 80 00 71 38 14 40 30 20 '......@8..q8.@0 '
  84 00 0f 28 21 00 00 1e 00 00 00 ff 00 38 43 4e '...(!........8CN'
  32 33 36 30 36 39 59 0d 0a 00 00 00 00 10 00 00 '236069Y.........'
  00 00 00 00 00 00 00 00 00 00 00 00 00 00 00 fc '................'
  00 48 50 20 34 30 30 20 47 36 20 41 69 4f 00 79 '.HP 400 G6 AiO.y'
Checksum: 0x79

----------------

Failures:

Block 0, Base EDID:
  Display Product Serial Number: ...
Block 1, Base EDID:
  Unknown Extension Block.
EDID:
  Base EDID: EDID specified 0 extension block(s), but found 1 extension block(s).

EDID conformity: FAIL
