
EDID (hex):
00ffffffffffff000469d3230d3f0200
1f16010368351f782a6ea5a3544f9f26
115054bfef00714f8140818095008100
81c0b300d1c0023a801871382d40582c
450015382100001e000000ff0043374c
4d54463134373231330a000000fd0032
551c5311000a202020202020000000fc
00415355532056473233410a20200046

Extracted contents:
header:          00 ff ff ff ff ff ff 00
serial number:   04 69 d3 23 0d 3f 02 00 1f 16
version:         01 03
basic params:    68 35 1f 78 2a
chroma info:     6e a5 a3 54 4f 9f 26 11 50 54
established:     bf ef 00
standard:        71 4f 81 40 81 80 95 00 81 00 81 c0 b3 00 d1 c0
descriptor 1:    02 3a 80 18 71 38 2d 40 58 2c 45 00 15 38 21 00 00 1e
descriptor 2:    00 00 00 ff 00 43 37 4c 4d 54 46 31 34 37 32 31 33 0a
descriptor 3:    00 00 00 fd 00 32 55 1c 53 11 00 0a 20 20 20 20 20 20
descriptor 4:    00 00 00 fc 00 41 53 55 53 20 56 47 32 33 41 0a 20 20
extensions:      00
checksum:        46

EDID version: 1.3
Manufacturer: ACI Model 23d3 Serial Number --
Made in week 31 of 2012
Analog display, Input voltage level: 0.7/0.7 V
Sync: Separate 
Maximum image size: 53 cm x 31 cm
Gamma: 2.20
DPMS levels: Off
RGB color display
First detailed timing is preferred timing
Display x,y Chromaticity:
  Red:   0.6376, 0.3300
  Green: 0.3115, 0.6230
  Blue:  0.1503, 0.0683
  White: 0.3134, 0.3291
Established timings supported:
  720x400@70Hz 9:5 HorFreq: 31469 Hz Clock: 28.320 MHz
  640x480@60Hz 4:3 HorFreq: 31469 Hz Clock: 25.175 MHz
  640x480@67Hz 4:3 HorFreq: 35000 Hz Clock: 30.240 MHz
  640x480@72Hz 4:3 HorFreq: 37900 Hz Clock: 31.500 MHz
  640x480@75Hz 4:3 HorFreq: 37500 Hz Clock: 31.500 MHz
  800x600@56Hz 4:3 HorFreq: 35200 Hz Clock: 36.000 MHz
  800x600@60Hz 4:3 HorFreq: 37900 Hz Clock: 40.000 MHz
  800x600@72Hz 4:3 HorFreq: 48100 Hz Clock: 50.000 MHz
  800x600@75Hz 4:3 HorFreq: 46900 Hz Clock: 49.500 MHz
  832x624@75Hz 4:3 HorFreq: 49726 Hz Clock: 57.284 MHz
  1024x768@60Hz 4:3 HorFreq: 48400 Hz Clock: 65.000 MHz
  1024x768@70Hz 4:3 HorFreq: 56500 Hz Clock: 75.000 MHz
  1024x768@75Hz 4:3 HorFreq: 60000 Hz Clock: 78.750 MHz
  1280x1024@75Hz 5:4 HorFreq: 80000 Hz Clock: 135.000 MHz
Standard timings supported:
  1152x864@75Hz 4:3 HorFreq: 67500 Hz Clock: 108.000 MHz
  1280x960@60Hz 4:3 HorFreq: 60000 Hz Clock: 108.000 MHz
  1280x1024@60Hz 5:4 HorFreq: 64000 Hz Clock: 108.000 MHz
  1440x900@60Hz 16:10 HorFreq: 55500 Hz Clock: 88.750 MHz
  1280x800@60Hz 16:10
  1280x720@60Hz 16:9
  1680x1050@60Hz 16:10 HorFreq: 64700 Hz Clock: 119.000 MHz
  1920x1080@60Hz 16:9
Detailed mode: Clock 148.500 MHz, 533 mm x 312 mm
               1920 2008 2052 2200 hborder 0
               1080 1084 1089 1125 vborder 0
               +hsync +vsync 
               VertFreq: 60 Hz, HorFreq: 67500 Hz
Serial number: --
Monitor ranges (GTF): 50-85Hz V, 28-83kHz H, max dotclock 170MHz
Monitor name: ASUS VG23A
Checksum: 0x46 (valid)


