edid-decode (hex):

00 ff ff ff ff ff ff 00 30 ae 44 11 44 44 47 46
01 17 01 03 80 34 20 78 ee f9 15 a3 54 50 9e 27
12 50 54 ad cf 00 31 46 81 80 81 8c 95 00 95 0f
b3 00 a9 40 d1 c0 28 3c 80 a0 70 b0 23 40 30 20
36 00 06 44 21 00 00 1a 1a 36 80 a0 70 38 1f 40
30 20 35 00 06 44 21 00 00 1a 00 00 00 fd 00 32
4b 1e 4b 11 00 0a 20 20 20 20 20 20 00 00 00 fc
00 4c 45 4e 20 4c 54 32 34 35 32 70 77 43 00 4e

----------------

Block 0, Base EDID:
  EDID Structure Version & Revision: 1.3
  Vendor & Product Identification:
    Manufacturer: LEN
    Model: 4420
    Serial Number: ...
    Made in: week 1 of 2013
  Basic Display Parameters & Features:
    Digital display
    Maximum image size: 52 cm x 32 cm
    Gamma: 2.20
    DPMS levels: Standby Suspend Off
    RGB color display
    Default (sRGB) color space is primary color space
    First detailed timing is preferred timing
  Color Characteristics:
    Red  : 0.6396, 0.3310
    Green: 0.3144, 0.6181
    Blue : 0.1523, 0.0712
    White: 0.3134, 0.3291
  Established Timings I & II:
    IBM     :   720x400    70.082 Hz   9:5    31.467 kHz  28.320 MHz
    DMT 0x04:   640x480    59.940 Hz   4:3    31.469 kHz  25.175 MHz
    DMT 0x05:   640x480    72.809 Hz   4:3    37.861 kHz  31.500 MHz
    DMT 0x06:   640x480    75.000 Hz   4:3    37.500 kHz  31.500 MHz
    DMT 0x09:   800x600    60.317 Hz   4:3    37.879 kHz  40.000 MHz
    DMT 0x0a:   800x600    72.188 Hz   4:3    48.077 kHz  50.000 MHz
    DMT 0x0b:   800x600    75.000 Hz   4:3    46.875 kHz  49.500 MHz
    DMT 0x10:  1024x768    60.004 Hz   4:3    48.363 kHz  65.000 MHz
    DMT 0x11:  1024x768    70.069 Hz   4:3    56.476 kHz  75.000 MHz
    DMT 0x12:  1024x768    75.029 Hz   4:3    60.023 kHz  78.750 MHz
    DMT 0x24:  1280x1024   75.025 Hz   5:4    79.976 kHz 135.000 MHz
  Standard Timings:
    GTF     :   640x480    66.000 Hz   4:3    32.934 kHz  26.874 MHz
    DMT 0x23:  1280x1024   60.020 Hz   5:4    63.981 kHz 108.000 MHz
    GTF     :  1280x1024   72.000 Hz   5:4    76.824 kHz 132.752 MHz
    DMT 0x2f:  1440x900    59.887 Hz  16:10   55.935 kHz 106.500 MHz
    DMT 0x30:  1440x900    74.984 Hz  16:10   70.635 kHz 136.750 MHz
    DMT 0x3a:  1680x1050   59.954 Hz  16:10   65.290 kHz 146.250 MHz
    DMT 0x33:  1600x1200   60.000 Hz   4:3    75.000 kHz 162.000 MHz
    DMT 0x52:  1920x1080   60.000 Hz  16:9    67.500 kHz 148.500 MHz
  Detailed Timing Descriptors:
    DTD 1:  1920x1200   59.950 Hz   8:5    74.038 kHz 154.000 MHz (518 mm x 324 mm)
                 Hfront   48 Hsync  32 Hback  80 Hpol P
                 Vfront    3 Vsync   6 Vback  26 Vpol N
    DTD 2:  1920x1080   59.934 Hz  16:9    66.587 kHz 138.500 MHz (518 mm x 324 mm)
                 Hfront   48 Hsync  32 Hback  80 Hpol P
                 Vfront    3 Vsync   5 Vback  23 Vpol N
  Display Range Limits:
    Monitor ranges (GTF): 50-75 Hz V, 30-75 kHz H, max dotclock 170 MHz
    Display Product Name: 'LEN LT2452pwC'
Checksum: 0x4e

----------------

Failures:

Block 0, Base EDID:
  Basic Display Parameters & Features: sRGB is signaled, but the chromaticities do not match.
All Blocks:
  Some timings are out of range of the Monitor Ranges:
    Horizontal Freq: 31.466 - 79.976 kHz (Monitor: 30.000 - 75.000 kHz)

EDID conformity: FAIL
