
EDID (hex):
00ffffffffffff0030ae441101010101
2d18010380342078eef915a354509e27
125054adcf0031468180818c9500950f
b300a940d1c0283c80a070b023403020
360006442100001a000000fd00324b1e
4b11000a202020202020000000fc004c
454e204c5432343532707743000000ff
00564e2d3839333536350a2020200134
020104001a3680a070381f4030203500
06442100001a00000000000000000000
00000000000000000000000000000000
00000000000000000000000000000000
00000000000000000000000000000000
00000000000000000000000000000000
00000000000000000000000000000000
00000000000000000000000000000078

Extracted contents:
header:          00 ff ff ff ff ff ff 00
serial number:   30 ae 44 11 01 01 01 01 2d 18
version:         01 03
basic params:    80 34 20 78 ee
chroma info:     f9 15 a3 54 50 9e 27 12 50 54
established:     ad cf 00
standard:        31 46 81 80 81 8c 95 00 95 0f b3 00 a9 40 d1 c0
descriptor 1:    28 3c 80 a0 70 b0 23 40 30 20 36 00 06 44 21 00 00 1a
descriptor 2:    00 00 00 fd 00 32 4b 1e 4b 11 00 0a 20 20 20 20 20 20
descriptor 3:    00 00 00 fc 00 4c 45 4e 20 4c 54 32 34 35 32 70 77 43
descriptor 4:    00 00 00 ff 00 56 4e 2d 38 39 33 35 36 35 0a 20 20 20
extensions:      01
checksum:        34

EDID version: 1.3
Manufacturer: LEN Model 1144 Serial Number --
Made in week 45 of 2014
Digital display
Maximum image size: 52 cm x 32 cm
Gamma: 2.20
DPMS levels: Standby Suspend Off
RGB color display
Default (sRGB) color space is primary color space
First detailed timing is preferred timing
Display x,y Chromaticity:
  Red:   0.6396, 0.3310
  Green: 0.3144, 0.6181
  Blue:  0.1523, 0.0712
  White: 0.3134, 0.3291
Established timings supported:
  720x400@70Hz 9:5 HorFreq: 31469 Hz Clock: 28.320 MHz
  640x480@60Hz 4:3 HorFreq: 31469 Hz Clock: 25.175 MHz
  640x480@72Hz 4:3 HorFreq: 37900 Hz Clock: 31.500 MHz
  640x480@75Hz 4:3 HorFreq: 37500 Hz Clock: 31.500 MHz
  800x600@60Hz 4:3 HorFreq: 37900 Hz Clock: 40.000 MHz
  800x600@72Hz 4:3 HorFreq: 48100 Hz Clock: 50.000 MHz
  800x600@75Hz 4:3 HorFreq: 46900 Hz Clock: 49.500 MHz
  1024x768@60Hz 4:3 HorFreq: 48400 Hz Clock: 65.000 MHz
  1024x768@70Hz 4:3 HorFreq: 56500 Hz Clock: 75.000 MHz
  1024x768@75Hz 4:3 HorFreq: 60000 Hz Clock: 78.750 MHz
  1280x1024@75Hz 5:4 HorFreq: 80000 Hz Clock: 135.000 MHz
Standard timings supported:
  640x480@66Hz 4:3
  1280x1024@60Hz 5:4 HorFreq: 64000 Hz Clock: 108.000 MHz
  1280x1024@72Hz 5:4
  1440x900@60Hz 16:10 HorFreq: 55500 Hz Clock: 88.750 MHz
  1440x900@75Hz 16:10 HorFreq: 82300 Hz Clock: 156.000 MHz
  1680x1050@60Hz 16:10 HorFreq: 64700 Hz Clock: 119.000 MHz
  1600x1200@60Hz 4:3 HorFreq: 75000 Hz Clock: 162.000 MHz
  1920x1080@60Hz 16:9
Detailed mode: Clock 154.000 MHz, 518 mm x 324 mm
               1920 1968 2000 2080 hborder 0
               1200 1203 1209 1235 vborder 0
               +hsync -vsync 
               VertFreq: 59 Hz, HorFreq: 74038 Hz
Monitor ranges (GTF): 50-75Hz V, 30-75kHz H, max dotclock 170MHz
Serial number: --
Has 1 extension blocks
Checksum: 0x34 (valid)

CTA extension block
Extension version: 1
0 8-byte timing descriptors
Detailed mode: Clock 138.500 MHz, 518 mm x 324 mm
               1920 1968 2000 2080 hborder 0
               1080 1083 1088 1111 vborder 0
               +hsync -vsync 
               VertFreq: 59 Hz, HorFreq: 66586 Hz
Checksum: 0x78 (valid)

EDID block does NOT conform to EDID 1.3!
	sRGB is signaled, but the chromaticities do not match
	Name descriptor not terminated with a newline
One or more of the timings is out of range of the Monitor Ranges:
  Vertical Freq: 59 - 75 Hz
  Horizontal Freq: 31469 - 82300 Hz
  Maximum Clock: 162.000 MHz
EDID block does not conform at all!
	Both the serial number and the serial string are set
