edid-decode (hex):

00 ff ff ff ff ff ff 00 05 e3 79 32 67 04 00 00
2f 1e 01 04 b5 49 2b 78 3b 79 e5 ac 51 44 ac 26
0f 50 54 bf ef 00 d1 c0 b3 00 95 00 81 80 81 40
81 c0 01 01 01 01 56 5e 00 a0 a0 a0 29 50 30 20
35 00 d5 ac 21 00 00 1e a0 73 00 6a a0 a0 29 50
08 20 35 00 d5 ac 21 00 00 1a 00 00 00 fd 00 30
4c 72 72 1e 01 0a 20 20 20 20 20 20 00 00 00 fc
00 51 33 32 37 39 57 47 35 42 0a 20 20 20 01 9f

00 ff ff ff ff ff ff 00 05 e3 79 32 67 04 00 00
2f 1e 01 04 b5 49 2b 78 3b 79 e5 ac 51 44 ac 26
0f 50 54 bf ef 00 d1 c0 b3 00 95 00 81 80 81 40
81 c0 01 01 01 01 56 5e 00 a0 a0 a0 29 50 30 20
35 00 d5 ac 21 00 00 1e a0 73 00 6a a0 a0 29 50
08 20 35 00 d5 ac 21 00 00 1a 00 00 00 fd 00 30
4c 72 72 1e 01 0a 20 20 20 20 20 20 00 00 00 fc
00 51 33 32 37 39 57 47 35 42 0a 20 20 20 01 9f

----------------

Block 0, Base EDID:
  EDID Structure Version & Revision: 1.4
  Vendor & Product Identification:
    Manufacturer: AOC
    Model: 12921
    Serial Number: ...
    Made in: week 47 of 2020
  Basic Display Parameters & Features:
    Digital display
    Bits per primary color channel: 10
    DisplayPort interface
    Maximum image size: 73 cm x 43 cm
    Gamma: 2.20
    DPMS levels: Off
    Supported color formats: RGB 4:4:4, YCrCb 4:4:4, YCrCb 4:2:2
    First detailed timing includes the native pixel format and preferred refresh rate
    Display is continuous frequency
  Color Characteristics:
    Red  : 0.6728, 0.3193
    Green: 0.2675, 0.6728
    Blue : 0.1513, 0.0605
    White: 0.3134, 0.3291
  Established Timings I & II:
    IBM     :   720x400    70.081663 Hz   9:5     31.467 kHz     28.320000 MHz
    DMT 0x04:   640x480    59.940476 Hz   4:3     31.469 kHz     25.175000 MHz
    Apple   :   640x480    66.666667 Hz   4:3     35.000 kHz     30.240000 MHz
    DMT 0x05:   640x480    72.808802 Hz   4:3     37.861 kHz     31.500000 MHz
    DMT 0x06:   640x480    75.000000 Hz   4:3     37.500 kHz     31.500000 MHz
    DMT 0x08:   800x600    56.250000 Hz   4:3     35.156 kHz     36.000000 MHz
    DMT 0x09:   800x600    60.316541 Hz   4:3     37.879 kHz     40.000000 MHz
    DMT 0x0a:   800x600    72.187572 Hz   4:3     48.077 kHz     50.000000 MHz
    DMT 0x0b:   800x600    75.000000 Hz   4:3     46.875 kHz     49.500000 MHz
    Apple   :   832x624    74.551266 Hz   4:3     49.726 kHz     57.284000 MHz
    DMT 0x10:  1024x768    60.003840 Hz   4:3     48.363 kHz     65.000000 MHz
    DMT 0x11:  1024x768    70.069359 Hz   4:3     56.476 kHz     75.000000 MHz
    DMT 0x12:  1024x768    75.028582 Hz   4:3     60.023 kHz     78.750000 MHz
    DMT 0x24:  1280x1024   75.024675 Hz   5:4     79.976 kHz    135.000000 MHz
  Standard Timings:
    DMT 0x52:  1920x1080   60.000000 Hz  16:9     67.500 kHz    148.500000 MHz
    DMT 0x3a:  1680x1050   59.954250 Hz  16:10    65.290 kHz    146.250000 MHz
    DMT 0x2f:  1440x900    59.887445 Hz  16:10    55.935 kHz    106.500000 MHz
    DMT 0x23:  1280x1024   60.019740 Hz   5:4     63.981 kHz    108.000000 MHz
    DMT 0x20:  1280x960    60.000000 Hz   4:3     60.000 kHz    108.000000 MHz
    DMT 0x55:  1280x720    60.000000 Hz  16:9     45.000 kHz     74.250000 MHz
  Detailed Timing Descriptors:
    DTD 1:  2560x1440   59.950550 Hz  16:9     88.787 kHz    241.500000 MHz (725 mm x 428 mm)
                 Hfront   48 Hsync  32 Hback   80 Hpol P
                 Vfront    3 Vsync   5 Vback   33 Vpol P
    DTD 2:  2560x1440   74.968101 Hz  16:9    111.028 kHz    296.000000 MHz (725 mm x 428 mm)
                 Hfront    8 Hsync  32 Hback   66 Hpol P
                 Vfront    3 Vsync   5 Vback   33 Vpol N
    Display Range Limits:
      Monitor ranges (Bare Limits): 48-76 Hz V, 114-114 kHz H, max dotclock 300 MHz
    Display Product Name: 'Q3279WG5B'
  Extension blocks: 1
Checksum: 0x9f

----------------

Block 1, Unknown EDID Extension Block 0x00:
  00 ff ff ff ff ff ff 00 05 e3 79 32 67 04 00 00 '..........y2g...'
  2f 1e 01 04 b5 49 2b 78 3b 79 e5 ac 51 44 ac 26 '/....I+x;y..QD.&'
  0f 50 54 bf ef 00 d1 c0 b3 00 95 00 81 80 81 40 '.PT............@'
  81 c0 01 01 01 01 56 5e 00 a0 a0 a0 29 50 30 20 '......V^....)P0 '
  35 00 d5 ac 21 00 00 1e a0 73 00 6a a0 a0 29 50 '5...!....s.j..)P'
  08 20 35 00 d5 ac 21 00 00 1a 00 00 00 fd 00 30 '. 5...!........0'
  4c 72 72 1e 01 0a 20 20 20 20 20 20 00 00 00 fc 'Lrr...      ....'
  00 51 33 32 37 39 57 47 35 42 0a 20 20 20 01 9f '.Q3279WG5B.   ..'
Checksum: 0x9f

----------------

Warnings:

EDID:
  Base EDID: Some timings are out of range of the Monitor Ranges:
    Horizontal Freq: 31.466 - 111.027 kHz (Monitor: 114.000 - 114.000 kHz)

Failures:

Block 1, Base EDID:
  Unknown Extension Block.

EDID conformity: FAIL
