
EDID (hex):
00ffffffffffff0038a3056601010101
240d010380291f78ee4e95a1574c9426
1c5054bfef80315945596159714f814f
81808199a940483f403062b0324040c0
130098321100001e000000fd0030571e
6011000a202020202020000000fc004c
43443230383055580a202020000000ff
00333931353236353759410a20200077

Extracted contents:
header:          00 ff ff ff ff ff ff 00
serial number:   38 a3 05 66 01 01 01 01 24 0d
version:         01 03
basic params:    80 29 1f 78 ee
chroma info:     4e 95 a1 57 4c 94 26 1c 50 54
established:     bf ef 80
standard:        31 59 45 59 61 59 71 4f 81 4f 81 80 81 99 a9 40
descriptor 1:    48 3f 40 30 62 b0 32 40 40 c0 13 00 98 32 11 00 00 1e
descriptor 2:    00 00 00 fd 00 30 57 1e 60 11 00 0a 20 20 20 20 20 20
descriptor 3:    00 00 00 fc 00 4c 43 44 32 30 38 30 55 58 0a 20 20 20
descriptor 4:    00 00 00 ff 00 33 39 31 35 32 36 35 37 59 41 0a 20 20
extensions:      00
checksum:        77

EDID version: 1.3
Manufacturer: NEC Model 6605 Serial Number --
Digital display
Maximum image size: 41 cm x 31 cm
Gamma: 2.20
DPMS levels: Standby Suspend Off
RGB color display
Default (sRGB) color space is primary color space
First detailed timing is preferred timing
Display x,y Chromaticity:
  Red:   0.6298, 0.3398
  Green: 0.2998, 0.5800
  Blue:  0.1503, 0.1103
  White: 0.3134, 0.3291
Established timings supported:
  720x400@70Hz 9:5 HorFreq: 31469 Hz Clock: 28.320 MHz
  640x480@60Hz 4:3 HorFreq: 31469 Hz Clock: 25.175 MHz
  640x480@67Hz 4:3 HorFreq: 35000 Hz Clock: 30.240 MHz
  640x480@72Hz 4:3 HorFreq: 37900 Hz Clock: 31.500 MHz
  640x480@75Hz 4:3 HorFreq: 37500 Hz Clock: 31.500 MHz
  800x600@56Hz 4:3 HorFreq: 35200 Hz Clock: 36.000 MHz
  800x600@60Hz 4:3 HorFreq: 37900 Hz Clock: 40.000 MHz
  800x600@72Hz 4:3 HorFreq: 48100 Hz Clock: 50.000 MHz
  800x600@75Hz 4:3 HorFreq: 46900 Hz Clock: 49.500 MHz
  832x624@75Hz 4:3 HorFreq: 49726 Hz Clock: 57.284 MHz
  1024x768@60Hz 4:3 HorFreq: 48400 Hz Clock: 65.000 MHz
  1024x768@70Hz 4:3 HorFreq: 56500 Hz Clock: 75.000 MHz
  1024x768@75Hz 4:3 HorFreq: 60000 Hz Clock: 78.750 MHz
  1280x1024@75Hz 5:4 HorFreq: 80000 Hz Clock: 135.000 MHz
  1152x870@75Hz 192:145 HorFreq: 67500 Hz Clock: 108.000 MHz
Standard timings supported:
  640x480@85Hz 4:3 HorFreq: 43300 Hz Clock: 36.000 MHz
  800x600@85Hz 4:3 HorFreq: 53700 Hz Clock: 56.250 MHz
  1024x768@85Hz 4:3 HorFreq: 68700 Hz Clock: 94.500 MHz
  1152x864@75Hz 4:3 HorFreq: 67500 Hz Clock: 108.000 MHz
  1280x960@75Hz 4:3
  1280x1024@60Hz 5:4 HorFreq: 64000 Hz Clock: 108.000 MHz
  1280x1024@85Hz 5:4 HorFreq: 91100 Hz Clock: 157.500 MHz
  1600x1200@60Hz 4:3 HorFreq: 75000 Hz Clock: 162.000 MHz
Detailed mode: Clock 162.000 MHz, 408 mm x 306 mm
               1600 1664 1856 2160 hborder 0
               1200 1201 1204 1250 vborder 0
               +hsync +vsync 
               VertFreq: 60 Hz, HorFreq: 75000 Hz
Monitor ranges (GTF): 48-87Hz V, 30-96kHz H, max dotclock 170MHz
Monitor name: LCD2080UX
Serial number: --
Checksum: 0x77 (valid)
EDID block does NOT conform to EDID 1.3!
	sRGB is signaled, but the chromaticities do not match
EDID block does not conform at all!
	Bad year of manufacture
