edid-decode (hex):

00 ff ff ff ff ff ff 00 41 0c e7 08 ac 3f 00 00
24 19 01 04 b5 47 28 78 3a 91 45 a7 55 4e a0 25
0c 50 54 bd 4b 00 d1 c0 81 80 81 40 95 0f 95 00
b3 00 81 c0 01 01 56 5e 00 a0 a0 a0 29 50 30 20
35 00 c4 8e 21 00 00 1e 00 00 00 ff 00 41 55 31
31 35 33 36 30 31 36 33 30 30 00 00 00 fc 00 50
48 4c 20 42 44 4d 33 32 37 30 0a 20 00 00 00 fd
00 17 4c 0f 63 1e 01 0a 20 20 20 20 20 20 01 41

02 03 20 f4 4b 01 02 03 04 05 90 11 12 13 14 1f
23 09 07 07 83 01 00 00 67 03 0c 00 10 00 18 3c
02 3a 80 d0 72 38 2d 40 10 2c 96 80 c4 8e 21 00
00 18 02 3a 80 18 71 38 2d 40 58 2c 96 00 c4 8e
21 00 00 18 28 3c 80 a0 70 b0 23 40 30 20 36 00
c4 8e 21 00 00 1a 01 1d 00 bc 52 d0 1e 20 b8 28
55 40 c4 8e 21 00 00 1e 8c 0a d0 90 20 40 31 20
0c 40 55 00 c4 8e 21 00 00 18 00 00 00 00 00 c0

----------------

Block 0, Base EDID:
  EDID Structure Version & Revision: 1.4
  Vendor & Product Identification:
    Manufacturer: PHL
    Model: 2279
    Serial Number: ...
    Made in: week 36 of 2015
  Basic Display Parameters & Features:
    Digital display
    Bits per primary color channel: 10
    DisplayPort interface
    Maximum image size: 71 cm x 40 cm
    Gamma: 2.20
    DPMS levels: Off
    Supported color formats: RGB 4:4:4, YCrCb 4:4:4, YCrCb 4:2:2
    First detailed timing includes the native pixel format and preferred refresh rate
  Color Characteristics:
    Red  : 0.6542, 0.3330
    Green: 0.3046, 0.6259
    Blue : 0.1455, 0.0468
    White: 0.3134, 0.3291
  Established Timings I & II:
    IBM     :   720x400    70.082 Hz   9:5    31.467 kHz  28.320 MHz
    DMT 0x04:   640x480    59.940 Hz   4:3    31.469 kHz  25.175 MHz
    Apple   :   640x480    66.667 Hz   4:3    35.000 kHz  30.240 MHz
    DMT 0x05:   640x480    72.809 Hz   4:3    37.861 kHz  31.500 MHz
    DMT 0x06:   640x480    75.000 Hz   4:3    37.500 kHz  31.500 MHz
    DMT 0x09:   800x600    60.317 Hz   4:3    37.879 kHz  40.000 MHz
    DMT 0x0b:   800x600    75.000 Hz   4:3    46.875 kHz  49.500 MHz
    DMT 0x10:  1024x768    60.004 Hz   4:3    48.363 kHz  65.000 MHz
    DMT 0x12:  1024x768    75.029 Hz   4:3    60.023 kHz  78.750 MHz
    DMT 0x24:  1280x1024   75.025 Hz   5:4    79.976 kHz 135.000 MHz
  Standard Timings:
    DMT 0x52:  1920x1080   60.000 Hz  16:9    67.500 kHz 148.500 MHz
    DMT 0x23:  1280x1024   60.020 Hz   5:4    63.981 kHz 108.000 MHz
    DMT 0x20:  1280x960    60.000 Hz   4:3    60.000 kHz 108.000 MHz
    DMT 0x30:  1440x900    74.984 Hz  16:10   70.635 kHz 136.750 MHz
    DMT 0x2f:  1440x900    59.887 Hz  16:10   55.935 kHz 106.500 MHz
    DMT 0x3a:  1680x1050   59.954 Hz  16:10   65.290 kHz 146.250 MHz
    DMT 0x55:  1280x720    60.000 Hz  16:9    45.000 kHz  74.250 MHz
  Detailed Timing Descriptors:
    DTD 1:  2560x1440   59.951 Hz  16:9    88.787 kHz 241.500 MHz (708 mm x 398 mm)
                 Hfront   48 Hsync  32 Hback  80 Hpol P
                 Vfront    3 Vsync   5 Vback  33 Vpol P
    Display Product Serial Number: ...
    Display Product Name: 'PHL BDM3270'
  Display Range Limits:
    Monitor ranges (Bare Limits): 23-76 Hz V, 15-99 kHz H, max dotclock 300 MHz
  Extension blocks: 1
Checksum: 0x41

----------------

Block 1, CTA-861 Extension Block:
  Revision: 3
  Underscans IT Video Formats by default
  Basic audio support
  Supports YCbCr 4:4:4
  Supports YCbCr 4:2:2
  Native detailed modes: 4
  Video Data Block:
    VIC   1:   640x480    59.940 Hz   4:3    31.469 kHz  25.175 MHz
    VIC   2:   720x480    59.940 Hz   4:3    31.469 kHz  27.000 MHz
    VIC   3:   720x480    59.940 Hz  16:9    31.469 kHz  27.000 MHz
    VIC   4:  1280x720    60.000 Hz  16:9    45.000 kHz  74.250 MHz
    VIC   5:  1920x1080i  60.000 Hz  16:9    33.750 kHz  74.250 MHz
    VIC  16:  1920x1080   60.000 Hz  16:9    67.500 kHz 148.500 MHz (native)
    VIC  17:   720x576    50.000 Hz   4:3    31.250 kHz  27.000 MHz
    VIC  18:   720x576    50.000 Hz  16:9    31.250 kHz  27.000 MHz
    VIC  19:  1280x720    50.000 Hz  16:9    37.500 kHz  74.250 MHz
    VIC  20:  1920x1080i  50.000 Hz  16:9    28.125 kHz  74.250 MHz
    VIC  31:  1920x1080   50.000 Hz  16:9    56.250 kHz 148.500 MHz
  Audio Data Block:
    Linear PCM:
      Max channels: 2
      Supported sample rates (kHz): 48 44.1 32
      Supported sample sizes (bits): 24 20 16
  Speaker Allocation Data Block:
    FL/FR - Front Left/Right
  Vendor-Specific Data Block (HDMI), OUI 00-0C-03:
    Source physical address: 1.0.0.0
    DC_30bit
    DC_Y444
    Maximum TMDS clock: 300 MHz
  Detailed Timing Descriptors:
    DTD 2:  1920x1080   50.000 Hz  16:9    56.250 kHz 148.500 MHz (708 mm x 398 mm)
                 Hfront  528 Hsync  44 Hback 148 Hpol N
                 Vfront    9 Vsync   6 Vback  30 Vpol N
    DTD 3:  1920x1080   60.000 Hz  16:9    67.500 kHz 148.500 MHz (708 mm x 398 mm)
                 Hfront   88 Hsync  44 Hback 148 Hpol N
                 Vfront    9 Vsync   6 Vback  30 Vpol N
    DTD 4:  1920x1200   59.950 Hz   8:5    74.038 kHz 154.000 MHz (708 mm x 398 mm)
                 Hfront   48 Hsync  32 Hback  80 Hpol P
                 Vfront    3 Vsync   6 Vback  26 Vpol N
    DTD 5:  1280x720    50.000 Hz  16:9    37.500 kHz  74.250 MHz (708 mm x 398 mm)
                 Hfront  440 Hsync  40 Hback 220 Hpol P
                 Vfront    5 Vsync   5 Vback  20 Vpol P
    DTD 6:   720x576    50.000 Hz   5:4    31.250 kHz  27.000 MHz (708 mm x 398 mm)
                 Hfront   12 Hsync  64 Hback  68 Hpol N
                 Vfront    5 Vsync   5 Vback  39 Vpol N
Checksum: 0xc0

----------------

Warnings:

Block 1, CTA-861 Extension Block:
  Display Product Serial Number is set, so the Serial Number in the Base EDID should be 0.
  Missing VCDB, needed for Set Selectable RGB Quantization to avoid interop issues.

Failures:

Block 1, CTA-861 Extension Block:
  Vendor-Specific Data Block (HDMI): The HDMI Specification uses EDID 1.3, not 1.4.
EDID:
  CTA-861: Native progressive timings are a mix of several resolutions.

EDID conformity: FAIL
