
EDID (hex):
00ffffffffffff004c2d590c43464d30
0f190103804627782a23ada4544d9926
0f474abfef8081c0810081809500a9c0
b300714f0101023a801871382d40582c
4500ba882100001e000000fd00324b1e
5111000a202020202020000000fc0053
333245353930430a20202020000000ff
00485448473430303936370a20200184
02031bf14690041f1303122309070783
01000067030c0010008022011d00bc52
d01e20b8285540ba882100001e8c0ad0
90204031200c405500ba88210000188c
0ad08a20e02d10103e9600ba88210000
18011d007251d01e206e285500ba8821
00001e00000000000000000000000000
0000000000000000000000000000000e

Extracted contents:
header:          00 ff ff ff ff ff ff 00
serial number:   4c 2d 59 0c 43 46 4d 30 0f 19
version:         01 03
basic params:    80 46 27 78 2a
chroma info:     23 ad a4 54 4d 99 26 0f 47 4a
established:     bf ef 80
standard:        81 c0 81 00 81 80 95 00 a9 c0 b3 00 71 4f 01 01
descriptor 1:    02 3a 80 18 71 38 2d 40 58 2c 45 00 ba 88 21 00 00 1e
descriptor 2:    00 00 00 fd 00 32 4b 1e 51 11 00 0a 20 20 20 20 20 20
descriptor 3:    00 00 00 fc 00 53 33 32 45 35 39 30 43 0a 20 20 20 20
descriptor 4:    00 00 00 ff 00 48 54 48 47 34 30 30 39 36 37 0a 20 20
extensions:      01
checksum:        84

EDID version: 1.3
Manufacturer: SAM Model c59 Serial Number --
Made in week 15 of 2015
Digital display
Maximum image size: 70 cm x 39 cm
Gamma: 2.20
DPMS levels: Off
RGB color display
First detailed timing is preferred timing
Display x,y Chromaticity:
  Red:   0.6406, 0.3300
  Green: 0.3007, 0.6005
  Blue:  0.1503, 0.0605
  White: 0.2802, 0.2900
Established timings supported:
  720x400@70Hz 9:5 HorFreq: 31469 Hz Clock: 28.320 MHz
  640x480@60Hz 4:3 HorFreq: 31469 Hz Clock: 25.175 MHz
  640x480@67Hz 4:3 HorFreq: 35000 Hz Clock: 30.240 MHz
  640x480@72Hz 4:3 HorFreq: 37900 Hz Clock: 31.500 MHz
  640x480@75Hz 4:3 HorFreq: 37500 Hz Clock: 31.500 MHz
  800x600@56Hz 4:3 HorFreq: 35200 Hz Clock: 36.000 MHz
  800x600@60Hz 4:3 HorFreq: 37900 Hz Clock: 40.000 MHz
  800x600@72Hz 4:3 HorFreq: 48100 Hz Clock: 50.000 MHz
  800x600@75Hz 4:3 HorFreq: 46900 Hz Clock: 49.500 MHz
  832x624@75Hz 4:3 HorFreq: 49726 Hz Clock: 57.284 MHz
  1024x768@60Hz 4:3 HorFreq: 48400 Hz Clock: 65.000 MHz
  1024x768@70Hz 4:3 HorFreq: 56500 Hz Clock: 75.000 MHz
  1024x768@75Hz 4:3 HorFreq: 60000 Hz Clock: 78.750 MHz
  1280x1024@75Hz 5:4 HorFreq: 80000 Hz Clock: 135.000 MHz
  1152x870@75Hz 192:145 HorFreq: 67500 Hz Clock: 108.000 MHz
Standard timings supported:
  1280x720@60Hz 16:9
  1280x800@60Hz 16:10
  1280x1024@60Hz 5:4 HorFreq: 64000 Hz Clock: 108.000 MHz
  1440x900@60Hz 16:10 HorFreq: 55500 Hz Clock: 88.750 MHz
  1600x900@60Hz 16:9
  1680x1050@60Hz 16:10 HorFreq: 64700 Hz Clock: 119.000 MHz
  1152x864@75Hz 4:3 HorFreq: 67500 Hz Clock: 108.000 MHz
Detailed mode: Clock 148.500 MHz, 698 mm x 392 mm
               1920 2008 2052 2200 hborder 0
               1080 1084 1089 1125 vborder 0
               +hsync +vsync 
               VertFreq: 60 Hz, HorFreq: 67500 Hz
Monitor ranges (GTF): 50-75Hz V, 30-81kHz H, max dotclock 170MHz
Monitor name: S32E590C
Serial number: --
Has 1 extension blocks
Checksum: 0x84 (valid)

CTA extension block
Extension version: 3
23 bytes of CTA data
  Video data block
    VIC  16 1920x1080@60Hz 16:9 (native) HorFreq: 67500 Hz Clock: 148.500 MHz
    VIC   4 1280x720@60Hz 16:9  HorFreq: 45000 Hz Clock: 74.250 MHz
    VIC  31 1920x1080@50Hz 16:9  HorFreq: 56250 Hz Clock: 148.500 MHz
    VIC  19 1280x720@50Hz 16:9  HorFreq: 37500 Hz Clock: 74.250 MHz
    VIC   3 720x480@60Hz 16:9  HorFreq: 31469 Hz Clock: 27.000 MHz
    VIC  18 720x576@50Hz 16:9  HorFreq: 31250 Hz Clock: 27.000 MHz
  Audio data block
    Linear PCM, max channels 2
      Supported sample rates (kHz): 48 44.1 32
      Supported sample sizes (bits): 24 20 16
  Speaker allocation data block
    Speaker map:
      FL/FR - Front Left/Right
  Vendor-specific data block, OUI 000c03 (HDMI)
    Source physical address 1.0.0.0
    Supports_AI
    Maximum TMDS clock: 170MHz
Underscans PC formats by default
Basic audio support
Supports YCbCr 4:4:4
Supports YCbCr 4:2:2
1 native detailed modes
Detailed mode: Clock 74.250 MHz, 698 mm x 392 mm
               1280 1720 1760 1980 hborder 0
                720  725  730  750 vborder 0
               +hsync +vsync 
               VertFreq: 50 Hz, HorFreq: 37500 Hz
Detailed mode: Clock 27.000 MHz, 698 mm x 392 mm
                720  732  796  864 hborder 0
                576  581  586  625 vborder 0
               -hsync -vsync 
               VertFreq: 50 Hz, HorFreq: 31250 Hz
Detailed mode: Clock 27.000 MHz, 698 mm x 392 mm
                720  736  798  858 hborder 0
                480  489  495  525 vborder 0
               -hsync -vsync 
               VertFreq: 59 Hz, HorFreq: 31468 Hz
Detailed mode: Clock 74.250 MHz, 698 mm x 392 mm
               1280 1390 1430 1650 hborder 0
                720  725  730  750 vborder 0
               +hsync +vsync 
               VertFreq: 60 Hz, HorFreq: 45000 Hz
Checksum: 0xe (valid)

EDID block does not conform at all!
	Both the serial number and the serial string are set
