edid-decode (hex):

00 ff ff ff ff ff ff 00 4c 2d 51 70 37 44 58 43
24 1e 01 03 80 77 22 78 2a c7 25 b1 4b 46 a8 26
0e 50 54 bf ef 80 71 4f 81 00 81 c0 81 80 a9 c0
b3 00 95 00 d1 c0 56 5e 00 a0 a0 a0 29 50 30 20
35 00 a9 50 41 00 00 1a 00 00 00 fd 00 32 78 1e
b7 32 00 0a 20 20 20 20 20 20 00 00 00 fc 00 4c
43 34 39 47 39 35 54 0a 20 20 20 20 00 00 00 ff
00 48 34 5a 4e 39 30 31 32 33 31 0a 20 20 01 8d

02 03 22 f1 46 90 5a 59 1f 04 13 23 09 07 07 83
01 00 00 67 03 0c 00 10 00 b8 3c 66 d8 5d c4 01
64 80 02 3a 80 18 71 38 2d 40 58 2c 45 00 a9 50
41 00 00 1e 58 4d 00 b8 a1 38 14 40 f8 2c 45 00
a9 50 41 00 00 1e 6f c2 00 a0 a0 a0 55 50 30 20
35 00 a9 50 41 00 00 1a 00 00 00 00 00 00 00 00
00 00 00 00 00 00 00 00 00 00 00 00 00 00 00 00
00 00 00 00 00 00 00 00 00 00 00 00 00 00 00 c8

00 ff ff ff ff ff ff 00 4c 2d 51 70 37 44 58 43
24 1e 01 03 80 77 22 78 2a c7 25 b1 4b 46 a8 26
0e 50 54 bf ef 80 71 4f 81 00 81 c0 81 80 a9 c0
b3 00 95 00 d1 c0 56 5e 00 a0 a0 a0 29 50 30 20
35 00 a9 50 41 00 00 1a 00 00 00 fd 00 32 78 1e
b7 32 00 0a 20 20 20 20 20 20 00 00 00 fc 00 4c
43 34 39 47 39 35 54 0a 20 20 20 20 00 00 00 ff
00 48 34 5a 4e 39 30 31 32 33 31 0a 20 20 01 8d

02 03 22 f1 46 90 5a 59 1f 04 13 23 09 07 07 83
01 00 00 67 03 0c 00 10 00 b8 3c 66 d8 5d c4 01
64 80 02 3a 80 18 71 38 2d 40 58 2c 45 00 a9 50
41 00 00 1e 58 4d 00 b8 a1 38 14 40 f8 2c 45 00
a9 50 41 00 00 1e 6f c2 00 a0 a0 a0 55 50 30 20
35 00 a9 50 41 00 00 1a 00 00 00 00 00 00 00 00
00 00 00 00 00 00 00 00 00 00 00 00 00 00 00 00
00 00 00 00 00 00 00 00 00 00 00 00 00 00 00 c8

----------------

Block 0, Base EDID:
  EDID Structure Version & Revision: 1.3
  Vendor & Product Identification:
    Manufacturer: SAM
    Model: 28753
    Serial Number: ...
    Made in: week 36 of 2020
  Basic Display Parameters & Features:
    Digital display
    Maximum image size: 119 cm x 34 cm
    Gamma: 2.20
    DPMS levels: Off
    RGB color display
    First detailed timing is the preferred timing
  Color Characteristics:
    Red  : 0.6943, 0.2929
    Green: 0.2744, 0.6591
    Blue : 0.1484, 0.0566
    White: 0.3134, 0.3291
  Established Timings I & II:
    IBM     :   720x400    70.081663 Hz   9:5     31.467 kHz     28.320000 MHz
    DMT 0x04:   640x480    59.940476 Hz   4:3     31.469 kHz     25.175000 MHz
    Apple   :   640x480    66.666667 Hz   4:3     35.000 kHz     30.240000 MHz
    DMT 0x05:   640x480    72.808802 Hz   4:3     37.861 kHz     31.500000 MHz
    DMT 0x06:   640x480    75.000000 Hz   4:3     37.500 kHz     31.500000 MHz
    DMT 0x08:   800x600    56.250000 Hz   4:3     35.156 kHz     36.000000 MHz
    DMT 0x09:   800x600    60.316541 Hz   4:3     37.879 kHz     40.000000 MHz
    DMT 0x0a:   800x600    72.187572 Hz   4:3     48.077 kHz     50.000000 MHz
    DMT 0x0b:   800x600    75.000000 Hz   4:3     46.875 kHz     49.500000 MHz
    Apple   :   832x624    74.551266 Hz   4:3     49.726 kHz     57.284000 MHz
    DMT 0x10:  1024x768    60.003840 Hz   4:3     48.363 kHz     65.000000 MHz
    DMT 0x11:  1024x768    70.069359 Hz   4:3     56.476 kHz     75.000000 MHz
    DMT 0x12:  1024x768    75.028582 Hz   4:3     60.023 kHz     78.750000 MHz
    DMT 0x24:  1280x1024   75.024675 Hz   5:4     79.976 kHz    135.000000 MHz
    Apple   :  1152x870    75.061550 Hz 192:145   68.681 kHz    100.000000 MHz
  Standard Timings:
    DMT 0x15:  1152x864    75.000000 Hz   4:3     67.500 kHz    108.000000 MHz
    DMT 0x1c:  1280x800    59.810326 Hz  16:10    49.702 kHz     83.500000 MHz
    DMT 0x55:  1280x720    60.000000 Hz  16:9     45.000 kHz     74.250000 MHz
    DMT 0x23:  1280x1024   60.019740 Hz   5:4     63.981 kHz    108.000000 MHz
    DMT 0x53:  1600x900    60.000000 Hz  16:9     60.000 kHz    108.000000 MHz (RB)
    DMT 0x3a:  1680x1050   59.954250 Hz  16:10    65.290 kHz    146.250000 MHz
    DMT 0x2f:  1440x900    59.887445 Hz  16:10    55.935 kHz    106.500000 MHz
    DMT 0x52:  1920x1080   60.000000 Hz  16:9     67.500 kHz    148.500000 MHz
  Detailed Timing Descriptors:
    DTD 1:  2560x1440   59.950550 Hz  16:9     88.787 kHz    241.500000 MHz (1193 mm x 336 mm)
                 Hfront   48 Hsync  32 Hback   80 Hpol P
                 Vfront    3 Vsync   5 Vback   33 Vpol N
    Display Range Limits:
      Monitor ranges (GTF): 50-120 Hz V, 30-183 kHz H, max dotclock 500 MHz
    Display Product Name: 'LC49G95T'
    Display Product Serial Number: ...
  Extension blocks: 1
Checksum: 0x8d

----------------

Block 1, CTA-861 Extension Block:
  Revision: 3
  Underscans IT Video Formats by default
  Basic audio support
  Supports YCbCr 4:4:4
  Supports YCbCr 4:2:2
  Native detailed modes: 1
  Video Data Block:
    VIC  16:  1920x1080   60.000000 Hz  16:9     67.500 kHz    148.500000 MHz (native)
    VIC  90:  2560x1080   60.000000 Hz  64:27    66.000 kHz    198.000000 MHz
    VIC  89:  2560x1080   50.000000 Hz  64:27    56.250 kHz    185.625000 MHz
    VIC  31:  1920x1080   50.000000 Hz  16:9     56.250 kHz    148.500000 MHz
    VIC   4:  1280x720    60.000000 Hz  16:9     45.000 kHz     74.250000 MHz
    VIC  19:  1280x720    50.000000 Hz  16:9     37.500 kHz     74.250000 MHz
  Audio Data Block:
    Linear PCM:
      Max channels: 2
      Supported sample rates (kHz): 48 44.1 32
      Supported sample sizes (bits): 24 20 16
  Speaker Allocation Data Block:
    FL/FR - Front Left/Right
  Vendor-Specific Data Block (HDMI), OUI 00-0C-03:
    Source physical address: 1.0.0.0
    Supports_AI
    DC_36bit
    DC_30bit
    DC_Y444
    Maximum TMDS clock: 300 MHz
  Vendor-Specific Data Block (HDMI Forum), OUI C4-5D-D8:
    Version: 1
    Maximum TMDS Character Rate: 500 MHz
    SCDC Present
    Supports 12-bits/component Deep Color 4:2:0 Pixel Encoding
  Detailed Timing Descriptors:
    DTD 2:  1920x1080   60.000000 Hz  16:9     67.500 kHz    148.500000 MHz (1193 mm x 336 mm)
                 Hfront   88 Hsync  44 Hback  148 Hpol P
                 Vfront    4 Vsync   5 Vback   36 Vpol P
    DTD 3:  2560x1080   60.000000 Hz  64:27    66.000 kHz    198.000000 MHz (1193 mm x 336 mm)
                 Hfront  248 Hsync  44 Hback  148 Hpol P
                 Vfront    4 Vsync   5 Vback   11 Vpol P
    DTD 4:  2560x1440  119.997589 Hz  16:9    182.996 kHz    497.750000 MHz (1193 mm x 336 mm)
                 Hfront   48 Hsync  32 Hback   80 Hpol P
                 Vfront    3 Vsync   5 Vback   77 Vpol N
Checksum: 0xc8  Unused space in Extension Block: 39 bytes

----------------

Block 2, Unknown EDID Extension Block 0x00:
  00 ff ff ff ff ff ff 00 4c 2d 51 70 37 44 58 43 '........L-Qp7DXC'
  24 1e 01 03 80 77 22 78 2a c7 25 b1 4b 46 a8 26 '$....w"x*.%.KF.&'
  0e 50 54 bf ef 80 71 4f 81 00 81 c0 81 80 a9 c0 '.PT...qO........'
  b3 00 95 00 d1 c0 56 5e 00 a0 a0 a0 29 50 30 20 '......V^....)P0 '
  35 00 a9 50 41 00 00 1a 00 00 00 fd 00 32 78 1e '5..PA........2x.'
  b7 32 00 0a 20 20 20 20 20 20 00 00 00 fc 00 4c '.2..      .....L'
  43 34 39 47 39 35 54 0a 20 20 20 20 00 00 00 ff 'C49G95T.    ....'
  00 48 34 5a 4e 39 30 31 32 33 31 0a 20 20 01 8d '.H4ZN901231.  ..'
Checksum: 0x8d

----------------

Block 3, CTA-861 Extension Block:
  Revision: 3
  Underscans IT Video Formats by default
  Basic audio support
  Supports YCbCr 4:4:4
  Supports YCbCr 4:2:2
  Native detailed modes: 1
  Video Data Block:
    VIC  16:  1920x1080   60.000000 Hz  16:9     67.500 kHz    148.500000 MHz (native)
    VIC  90:  2560x1080   60.000000 Hz  64:27    66.000 kHz    198.000000 MHz
    VIC  89:  2560x1080   50.000000 Hz  64:27    56.250 kHz    185.625000 MHz
    VIC  31:  1920x1080   50.000000 Hz  16:9     56.250 kHz    148.500000 MHz
    VIC   4:  1280x720    60.000000 Hz  16:9     45.000 kHz     74.250000 MHz
    VIC  19:  1280x720    50.000000 Hz  16:9     37.500 kHz     74.250000 MHz
  Audio Data Block:
    Linear PCM:
      Max channels: 2
      Supported sample rates (kHz): 48 44.1 32
      Supported sample sizes (bits): 24 20 16
  Speaker Allocation Data Block:
    FL/FR - Front Left/Right
  Vendor-Specific Data Block (HDMI), OUI 00-0C-03:
    Source physical address: 1.0.0.0
    Supports_AI
    DC_36bit
    DC_30bit
    DC_Y444
    Maximum TMDS clock: 300 MHz
  Vendor-Specific Data Block (HDMI Forum), OUI C4-5D-D8:
    Version: 1
    Maximum TMDS Character Rate: 500 MHz
    SCDC Present
    Supports 12-bits/component Deep Color 4:2:0 Pixel Encoding
  Detailed Timing Descriptors:
    DTD 5:  1920x1080   60.000000 Hz  16:9     67.500 kHz    148.500000 MHz (1193 mm x 336 mm)
                 Hfront   88 Hsync  44 Hback  148 Hpol P
                 Vfront    4 Vsync   5 Vback   36 Vpol P
    DTD 6:  2560x1080   60.000000 Hz  64:27    66.000 kHz    198.000000 MHz (1193 mm x 336 mm)
                 Hfront  248 Hsync  44 Hback  148 Hpol P
                 Vfront    4 Vsync   5 Vback   11 Vpol P
    DTD 7:  2560x1440  119.997589 Hz  16:9    182.996 kHz    497.750000 MHz (1193 mm x 336 mm)
                 Hfront   48 Hsync  32 Hback   80 Hpol P
                 Vfront    3 Vsync   5 Vback   77 Vpol N
Checksum: 0xc8  Unused space in Extension Block: 39 bytes

----------------

Warnings:

Block 1, CTA-861 Extension Block:
  Display Product Serial Number is set, so the Serial Number in the Base EDID should be 0.
  Add a Colorimetry Data Block with the sRGB colorimetry bit set to avoid interop issues.
Block 3, CTA-861 Extension Block:
  Display Product Serial Number is set, so the Serial Number in the Base EDID should be 0.
  Add a Colorimetry Data Block with the sRGB colorimetry bit set to avoid interop issues.

Failures:

Block 1, CTA-861 Extension Block:
  Missing VCDB, needed for Set Selectable RGB Quantization to avoid interop issues.
Block 2, Base EDID:
  Unknown Extension Block.
Block 3, CTA-861 Extension Block:
  Video Data Block: Duplicate VIC 16.
  Video Data Block: Duplicate VIC 90.
  Video Data Block: Duplicate VIC 89.
  Video Data Block: Duplicate VIC 31.
  Video Data Block: Duplicate VIC 4.
  Video Data Block: Duplicate VIC 19.
  Speaker Allocation Data Block: Only one instance of this Data Block is allowed.
  Vendor-Specific Data Block (HDMI Forum), OUI C4-5D-D8: Duplicate HDMI Forum VSDB/SCDB.
  Missing VCDB, needed for Set Selectable RGB Quantization to avoid interop issues.
EDID:
  Base EDID: EDID specified 1 extension block(s), but found 3 extension block(s).
  Base EDID: EDID 1.3 requires a Block Map Extension in Block 1 if there are more than 2 blocks in the EDID.
  CTA-861: Native progressive timings are a mix of several resolutions.

EDID conformity: FAIL
