
EDID (hex):
00ffffffffffff004d10171500000000
2d1f0104b52517780b9a73ae512fbe24
0b505700000001010101010101010101
01010101010172e700a0f06045903020
36006ee51000001828b900a0f0604590
302036006ee510000018000000fe0054
334d5739804c51313730523100000000
0002410332011200000b010a20200197
02030f00e3058000e60605016b6b2800
00000000000000000000000000000000
00000000000000000000000000000000
00000000000000000000000000000000
00000000000000000000000000000000
00000000000000000000000000000000
00000000000000000000000000000000
00000000000000000000000000000094

edid-decode (hex):

00 ff ff ff ff ff ff 00 4d 10 17 15 00 00 00 00
2d 1f 01 04 b5 25 17 78 0b 9a 73 ae 51 2f be 24
0b 50 57 00 00 00 01 01 01 01 01 01 01 01 01 01
01 01 01 01 01 01 72 e7 00 a0 f0 60 45 90 30 20
36 00 6e e5 10 00 00 18 28 b9 00 a0 f0 60 45 90
30 20 36 00 6e e5 10 00 00 18 00 00 00 fe 00 54
33 4d 57 39 80 4c 51 31 37 30 52 31 00 00 00 00
00 02 41 03 32 01 12 00 00 0b 01 0a 20 20 01 97

02 03 0f 00 e3 05 80 00 e6 06 05 01 6b 6b 28 00
00 00 00 00 00 00 00 00 00 00 00 00 00 00 00 00
00 00 00 00 00 00 00 00 00 00 00 00 00 00 00 00
00 00 00 00 00 00 00 00 00 00 00 00 00 00 00 00
00 00 00 00 00 00 00 00 00 00 00 00 00 00 00 00
00 00 00 00 00 00 00 00 00 00 00 00 00 00 00 00
00 00 00 00 00 00 00 00 00 00 00 00 00 00 00 00
00 00 00 00 00 00 00 00 00 00 00 00 00 00 00 94

----------------

Block 0, Base EDID:
  EDID Structure Version & Revision: 1.4
  Vendor & Product Identification:
    Manufacturer: SHP
    Model: 5399
    Made in: week 45 of 2021
  Basic Display Parameters & Features:
    Digital display
    Bits per primary color channel: 10
    DisplayPort interface
    Maximum image size: 37 cm x 23 cm
    Gamma: 2.20
    Supported color formats: RGB 4:4:4, YCrCb 4:4:4
    First detailed timing includes the native pixel format and preferred refresh rate
    Display is continuous frequency
  Color Characteristics:
    Red  : 0.6816, 0.3173
    Green: 0.1855, 0.7441
    Blue : 0.1416, 0.0458
    White: 0.3125, 0.3427
  Established Timings I & II: none
  Standard Timings: none
  Detailed Timing Descriptors:
    DTD 1:  3840x2400   59.993925 Hz  16:10   148.125 kHz    592.500000 MHz (366 mm x 229 mm)
                 Hfront   48 Hsync  32 Hback   80 Hpol N
                 Vfront    3 Vsync   6 Vback   60 Vpol N
    DTD 2:  3840x2400   47.995140 Hz  16:10   118.500 kHz    474.000000 MHz (366 mm x 229 mm)
                 Hfront   48 Hsync  32 Hback   80 Hpol N
                 Vfront    3 Vsync   6 Vback   60 Vpol N
    Alphanumeric Data String: 'T3MW9'
    Manufacturer-Specified Display Descriptor (0x00): 00 00 00 02 41 03 32 01 12 00 00 0b 01 0a 20 20 '....A.2.......  '
  Extension blocks: 1
Checksum: 0x97

----------------

Block 1, CTA-861 Extension Block:
  Revision: 3
  Native detailed modes: 0
  Colorimetry Data Block:
    BT2020RGB
  HDR Static Metadata Data Block:
    Electro optical transfer functions:
      Traditional gamma - SDR luminance range
      SMPTE ST2084
    Supported static metadata descriptors:
      Static metadata type 1
    Desired content max luminance: 107 (507.620 cd/m^2)
    Desired content max frame-average luminance: 107 (507.620 cd/m^2)
    Desired content min luminance: 40 (0.125 cd/m^2)
Checksum: 0x94  Unused space in Extension Block: 112 bytes
