
EDID (hex):
00ffffffffffff0012b3002701000000
231f0103803c21782a3d85a6564a9a24
125054a54f0081c081408180b300a9c0
d1c08bc00101565e00a0a0a029503020
350055502100001ed3800068a1a04250
3020250055502100001e023a80187138
2d40582c450055502100001e000000fc
0044323751500a2020202020202000bf

Extracted contents:
header:          00 ff ff ff ff ff ff 00
serial number:   12 b3 00 27 01 00 00 00 23 1f
version:         01 03
basic params:    80 3c 21 78 2a
chroma info:     3d 85 a6 56 4a 9a 24 12 50 54
established:     a5 4f 00
standard:        81 c0 81 40 81 80 b3 00 a9 c0 d1 c0 8b c0 01 01
descriptor 1:    56 5e 00 a0 a0 a0 29 50 30 20 35 00 55 50 21 00 00 1e
descriptor 2:    d3 80 00 68 a1 a0 42 50 30 20 25 00 55 50 21 00 00 1e
descriptor 3:    02 3a 80 18 71 38 2d 40 58 2c 45 00 55 50 21 00 00 1e
descriptor 4:    00 00 00 fc 00 44 32 37 51 50 0a 20 20 20 20 20 20 20
extensions:      00
checksum:        bf

EDID version: 1.3
Manufacturer: DUS Model 2700 Serial Number --
Made in week 35 of 2021
Digital display
Maximum image size: 60 cm x 33 cm
Gamma: 2.20
DPMS levels: Off
RGB color display
First detailed timing is preferred timing
Display x,y Chromaticity:
  Red:   0.6484, 0.3388
  Green: 0.2919, 0.6025
  Blue:  0.1425, 0.0703
  White: 0.3134, 0.3291
Established timings supported:
  720x400@70Hz 9:5 HorFreq: 31469 Hz Clock: 28.320 MHz
  640x480@60Hz 4:3 HorFreq: 31469 Hz Clock: 25.175 MHz
  640x480@75Hz 4:3 HorFreq: 37500 Hz Clock: 31.500 MHz
  800x600@60Hz 4:3 HorFreq: 37900 Hz Clock: 40.000 MHz
  800x600@75Hz 4:3 HorFreq: 46900 Hz Clock: 49.500 MHz
  1024x768@60Hz 4:3 HorFreq: 48400 Hz Clock: 65.000 MHz
  1024x768@70Hz 4:3 HorFreq: 56500 Hz Clock: 75.000 MHz
  1024x768@75Hz 4:3 HorFreq: 60000 Hz Clock: 78.750 MHz
  1280x1024@75Hz 5:4 HorFreq: 80000 Hz Clock: 135.000 MHz
Standard timings supported:
  1280x720@60Hz 16:9
  1280x960@60Hz 4:3 HorFreq: 60000 Hz Clock: 108.000 MHz
  1280x1024@60Hz 5:4 HorFreq: 64000 Hz Clock: 108.000 MHz
  1680x1050@60Hz 16:10 HorFreq: 64700 Hz Clock: 119.000 MHz
  1600x900@60Hz 16:9
  1920x1080@60Hz 16:9
  1360x765@60Hz 16:9
Detailed mode: Clock 241.500 MHz, 597 mm x 336 mm
               2560 2608 2640 2720 hborder 0
               1440 1443 1448 1481 vborder 0
               +hsync +vsync 
               VertFreq: 59 Hz, HorFreq: 88786 Hz
Detailed mode: Clock 329.790 MHz, 597 mm x 336 mm
               2560 2608 2640 2920 hborder 0
               1440 1442 1447 1506 vborder 0
               +hsync +vsync 
               VertFreq: 74 Hz, HorFreq: 112941 Hz
Detailed mode: Clock 148.500 MHz, 597 mm x 336 mm
               1920 2008 2052 2200 hborder 0
               1080 1084 1089 1125 vborder 0
               +hsync +vsync 
               VertFreq: 60 Hz, HorFreq: 67500 Hz
Monitor name: D27QP
Checksum: 0xbf (valid)
EDID block does NOT conform to EDID 1.3!
	Missing monitor ranges
