
EDID (hex):
00ffffffffffff0010acc8a14c534332
341f010380351e78ea5625ab534f9d25
105054a54b00714f8180a9c0d1c081c0
81cf01010101023a801871382d40582c
45000f282100001e000000ff00334436
335a42330a2020202020000000fc0044
454c4c20503234323248450a000000fd
00384c1e5311000a2020202020200186
020315b14a900504030201141f121365
030c001000023a801871382d40582c45
000f282100001e011d8018711c162058
2c25000f282100009e011d007251d01e
206e2855000f282100001e8c0ad08a20
e02d10103e96000f2821000018000000
00000000000000000000000000000000
0000000000000000000000000000005e

Extracted contents:
header:          00 ff ff ff ff ff ff 00
serial number:   10 ac c8 a1 4c 53 43 32 34 1f
version:         01 03
basic params:    80 35 1e 78 ea
chroma info:     56 25 ab 53 4f 9d 25 10 50 54
established:     a5 4b 00
standard:        71 4f 81 80 a9 c0 d1 c0 81 c0 81 cf 01 01 01 01
descriptor 1:    02 3a 80 18 71 38 2d 40 58 2c 45 00 0f 28 21 00 00 1e
descriptor 2:    00 00 00 ff 00 33 44 36 33 5a 42 33 0a 20 20 20 20 20
descriptor 3:    00 00 00 fc 00 44 45 4c 4c 20 50 32 34 32 32 48 45 0a
descriptor 4:    00 00 00 fd 00 38 4c 1e 53 11 00 0a 20 20 20 20 20 20
extensions:      01
checksum:        86

EDID version: 1.3
Manufacturer: DEL Model a1c8 Serial Number --
Made in week 52 of 2021
Digital display
Maximum image size: 53 cm x 30 cm
Gamma: 2.20
DPMS levels: Standby Suspend Off
RGB color display
First detailed timing is preferred timing
Display x,y Chromaticity:
  Red:   0.6689, 0.3251
  Green: 0.3095, 0.6152
  Blue:  0.1445, 0.0644
  White: 0.3134, 0.3291
Established timings supported:
  720x400@70Hz 9:5 HorFreq: 31469 Hz Clock: 28.320 MHz
  640x480@60Hz 4:3 HorFreq: 31469 Hz Clock: 25.175 MHz
  640x480@75Hz 4:3 HorFreq: 37500 Hz Clock: 31.500 MHz
  800x600@60Hz 4:3 HorFreq: 37900 Hz Clock: 40.000 MHz
  800x600@75Hz 4:3 HorFreq: 46900 Hz Clock: 49.500 MHz
  1024x768@60Hz 4:3 HorFreq: 48400 Hz Clock: 65.000 MHz
  1024x768@75Hz 4:3 HorFreq: 60000 Hz Clock: 78.750 MHz
  1280x1024@75Hz 5:4 HorFreq: 80000 Hz Clock: 135.000 MHz
Standard timings supported:
  1152x864@75Hz 4:3 HorFreq: 67500 Hz Clock: 108.000 MHz
  1280x1024@60Hz 5:4 HorFreq: 64000 Hz Clock: 108.000 MHz
  1600x900@60Hz 16:9
  1920x1080@60Hz 16:9
  1280x720@60Hz 16:9
  1280x720@75Hz 16:9
Detailed mode: Clock 148.500 MHz, 527 mm x 296 mm
               1920 2008 2052 2200 hborder 0
               1080 1084 1089 1125 vborder 0
               +hsync +vsync 
               VertFreq: 60 Hz, HorFreq: 67500 Hz
Serial number: --
Monitor name: DELL P2422HE
Monitor ranges (GTF): 56-76Hz V, 30-83kHz H, max dotclock 170MHz
Has 1 extension blocks
Checksum: 0x86 (valid)

CTA extension block
Extension version: 3
17 bytes of CTA data
  Video data block
    VIC  16 1920x1080@60Hz 16:9 (native) HorFreq: 67500 Hz Clock: 148.500 MHz
    VIC   5 1920x1080i@60Hz 16:9  HorFreq: 33750 Hz Clock: 74.250 MHz
    VIC   4 1280x720@60Hz 16:9  HorFreq: 45000 Hz Clock: 74.250 MHz
    VIC   3 720x480@60Hz 16:9  HorFreq: 31469 Hz Clock: 27.000 MHz
    VIC   2 720x480@60Hz 4:3  HorFreq: 31469 Hz Clock: 27.000 MHz
    VIC   1 640x480@60Hz 4:3  HorFreq: 31469 Hz Clock: 25.175 MHz
    VIC  20 1920x1080i@50Hz 16:9  HorFreq: 28125 Hz Clock: 74.250 MHz
    VIC  31 1920x1080@50Hz 16:9  HorFreq: 56250 Hz Clock: 148.500 MHz
    VIC  18 720x576@50Hz 16:9  HorFreq: 31250 Hz Clock: 27.000 MHz
    VIC  19 1280x720@50Hz 16:9  HorFreq: 37500 Hz Clock: 74.250 MHz
  Vendor-specific data block, OUI 000c03 (HDMI)
    Source physical address 1.0.0.0
Underscans PC formats by default
Supports YCbCr 4:4:4
Supports YCbCr 4:2:2
1 native detailed modes
Detailed mode: Clock 148.500 MHz, 527 mm x 296 mm
               1920 2008 2052 2200 hborder 0
               1080 1084 1089 1125 vborder 0
               +hsync +vsync 
               VertFreq: 60 Hz, HorFreq: 67500 Hz
Detailed mode: Clock 74.250 MHz, 527 mm x 296 mm
               1920 2008 2052 2200 hborder 0
                540  542  547  562 vborder 0
               +hsync +vsync interlaced 
               VertFreq: 60 Hz, HorFreq: 33750 Hz
Detailed mode: Clock 74.250 MHz, 527 mm x 296 mm
               1280 1390 1430 1650 hborder 0
                720  725  730  750 vborder 0
               +hsync +vsync 
               VertFreq: 60 Hz, HorFreq: 45000 Hz
Detailed mode: Clock 27.000 MHz, 527 mm x 296 mm
                720  736  798  858 hborder 0
                480  489  495  525 vborder 0
               -hsync -vsync 
               VertFreq: 59 Hz, HorFreq: 31468 Hz
Checksum: 0x5e (valid)

One or more of the timings is out of range of the Monitor Ranges:
  Vertical Freq: 50 - 75 Hz
  Horizontal Freq: 28125 - 80000 Hz
  Maximum Clock: 148.500 MHz
EDID block does not conform at all!
	Both the serial number and the serial string are set


