edid-decode (hex):

00 ff ff ff ff ff ff 00 30 ae 04 24 01 01 01 01
30 10 01 03 80 28 1e 78 ea de 50 a3 54 4c 99 26
0f 50 54 af ef 80 01 01 31 46 31 59 61 59 81 80
81 8a 81 90 a9 40 21 33 40 b4 60 b0 19 40 14 50
13 00 90 2c 11 00 00 1e 00 00 00 fd 00 37 55 1e
53 11 00 0a 20 20 20 20 20 20 00 00 00 ff 00 56
31 41 31 34 31 36 0a 20 20 20 20 20 00 00 00 fc
00 4c 45 4e 20 4c 32 30 31 70 0a 20 20 20 00 f3

00 ff ff ff ff ff ff 00 30 ae 04 24 01 01 01 01
30 10 01 03 80 28 1e 78 ea de 50 a3 54 4c 99 26
0f 50 54 af ef 80 01 01 31 46 31 59 61 59 81 80
81 8a 81 90 a9 40 21 33 40 b4 60 b0 19 40 14 50
13 00 90 2c 11 00 00 1e 00 00 00 fd 00 37 55 1e
53 11 00 0a 20 20 20 20 20 20 00 00 00 ff 00 56
31 41 31 34 31 36 0a 20 20 20 20 20 00 00 00 fc
00 4c 45 4e 20 4c 32 30 31 70 0a 20 20 20 00 f3

----------------

Block 0, Base EDID:
  EDID Structure Version & Revision: 1.3
  Vendor & Product Identification:
    Manufacturer: LEN
    Model: 9220
    Serial Number: ...
    Made in: week 48 of 2006
  Basic Display Parameters & Features:
    Digital display
    Maximum image size: 40 cm x 30 cm
    Gamma: 2.20
    DPMS levels: Standby Suspend Off
    RGB color display
    First detailed timing is the preferred timing
  Color Characteristics:
    Red  : 0.6396, 0.3291
    Green: 0.2998, 0.5996
    Blue : 0.1494, 0.0595
    White: 0.3125, 0.3281
  Established Timings I & II:
    IBM     :   720x400    70.081663 Hz   9:5     31.467 kHz     28.320000 MHz
    DMT 0x04:   640x480    59.940476 Hz   4:3     31.469 kHz     25.175000 MHz
    DMT 0x05:   640x480    72.808802 Hz   4:3     37.861 kHz     31.500000 MHz
    DMT 0x06:   640x480    75.000000 Hz   4:3     37.500 kHz     31.500000 MHz
    DMT 0x08:   800x600    56.250000 Hz   4:3     35.156 kHz     36.000000 MHz
    DMT 0x09:   800x600    60.316541 Hz   4:3     37.879 kHz     40.000000 MHz
    DMT 0x0a:   800x600    72.187572 Hz   4:3     48.077 kHz     50.000000 MHz
    DMT 0x0b:   800x600    75.000000 Hz   4:3     46.875 kHz     49.500000 MHz
    Apple   :   832x624    74.551266 Hz   4:3     49.726 kHz     57.284000 MHz
    DMT 0x10:  1024x768    60.003840 Hz   4:3     48.363 kHz     65.000000 MHz
    DMT 0x11:  1024x768    70.069359 Hz   4:3     56.476 kHz     75.000000 MHz
    DMT 0x12:  1024x768    75.028582 Hz   4:3     60.023 kHz     78.750000 MHz
    DMT 0x24:  1280x1024   75.024675 Hz   5:4     79.976 kHz    135.000000 MHz
    Apple   :  1152x870    75.061550 Hz 192:145   68.681 kHz    100.000000 MHz
  Standard Timings:
    GTF     :   640x480    65.999646 Hz   4:3     32.934 kHz     26.874000 MHz
    DMT 0x07:   640x480    85.008312 Hz   4:3     43.269 kHz     36.000000 MHz
    DMT 0x13:  1024x768    84.996690 Hz   4:3     68.677 kHz     94.500000 MHz
    DMT 0x23:  1280x1024   60.019740 Hz   5:4     63.981 kHz    108.000000 MHz
    GTF     :  1280x1024   69.999805 Hz   5:4     74.620 kHz    128.943000 MHz
    GTF     :  1280x1024   75.999957 Hz   5:4     81.320 kHz    141.822000 MHz
    DMT 0x33:  1600x1200   60.000000 Hz   4:3     75.000 kHz    162.000000 MHz
  Detailed Timing Descriptors:
    DTD 1:  1600x1200   60.027517 Hz   4:3     73.534 kHz    130.890000 MHz (400 mm x 300 mm)
                 Hfront   20 Hsync  80 Hback   80 Hpol P
                 Vfront    1 Vsync   3 Vback   21 Vpol P
    Display Range Limits:
      Monitor ranges (GTF): 55-85 Hz V, 30-83 kHz H, max dotclock 170 MHz
    Display Product Serial Number: ...
    Display Product Name: 'LEN L201p'
Checksum: 0xf3

----------------

Block 1, Unknown EDID Extension Block 0x00:
  00 ff ff ff ff ff ff 00 30 ae 04 24 01 01 01 01 '........0..$....'
  30 10 01 03 80 28 1e 78 ea de 50 a3 54 4c 99 26 '0....(.x..P.TL.&'
  0f 50 54 af ef 80 01 01 31 46 31 59 61 59 81 80 '.PT.....1F1YaY..'
  81 8a 81 90 a9 40 21 33 40 b4 60 b0 19 40 14 50 '.....@!3@.`..@.P'
  13 00 90 2c 11 00 00 1e 00 00 00 fd 00 37 55 1e '...,.........7U.'
  53 11 00 0a 20 20 20 20 20 20 00 00 00 ff 00 56 'S...      .....V'
  31 41 31 34 31 36 0a 20 20 20 20 20 00 00 00 fc '1A1416.     ....'
  00 4c 45 4e 20 4c 32 30 31 70 0a 20 20 20 00 f3 '.LEN L201p.   ..'
Checksum: 0xf3

----------------

Failures:

Block 1, Base EDID:
  Unknown Extension Block.
EDID:
  Base EDID: EDID specified 0 extension block(s), but found 1 extension block(s).

EDID conformity: FAIL
