
EDID (hex):
00ffffffffffff004e14012219080000
0f110103082f1e782b82d2a35a49a024
135053bfcf80714081c0810081408180
8bc09500d1c008399030621a274068b0
3600da281100001c000000fd00184d0f
5e11000a202020202020000000fc0053
6365707472650a2020202020000000fc
0058323257472d31303830500a20002f

Extracted contents:
header:          00 ff ff ff ff ff ff 00
serial number:   4e 14 01 22 19 08 00 00 0f 11
version:         01 03
basic params:    08 2f 1e 78 2b
chroma info:     82 d2 a3 5a 49 a0 24 13 50 53
established:     bf cf 80
standard:        71 40 81 c0 81 00 81 40 81 80 8b c0 95 00 d1 c0
descriptor 1:    08 39 90 30 62 1a 27 40 68 b0 36 00 da 28 11 00 00 1c
descriptor 2:    00 00 00 fd 00 18 4d 0f 5e 11 00 0a 20 20 20 20 20 20
descriptor 3:    00 00 00 fc 00 53 63 65 70 74 72 65 0a 20 20 20 20 20
descriptor 4:    00 00 00 fc 00 58 32 32 57 47 2d 31 30 38 30 50 0a 20
extensions:      00
checksum:        2f

EDID version: 1.3
Manufacturer: SPT Model 2201 Serial Number --
Made in week 15 of 2007
Analog display, Input voltage level: 0.7/0.3 V
Sync: Separate 
Maximum image size: 47 cm x 30 cm
Gamma: 2.20
DPMS levels: Off
RGB color display
First detailed timing is preferred timing
Supports GTF timings within operating range
Display x,y Chromaticity:
  Red:   0.6386, 0.3515
  Green: 0.2851, 0.6269
  Blue:  0.1435, 0.0751
  White: 0.3125, 0.3261
Established timings supported:
  720x400@70Hz 9:5 HorFreq: 31469 Hz Clock: 28.320 MHz
  640x480@60Hz 4:3 HorFreq: 31469 Hz Clock: 25.175 MHz
  640x480@67Hz 4:3 HorFreq: 35000 Hz Clock: 30.240 MHz
  640x480@72Hz 4:3 HorFreq: 37900 Hz Clock: 31.500 MHz
  640x480@75Hz 4:3 HorFreq: 37500 Hz Clock: 31.500 MHz
  800x600@56Hz 4:3 HorFreq: 35200 Hz Clock: 36.000 MHz
  800x600@60Hz 4:3 HorFreq: 37900 Hz Clock: 40.000 MHz
  800x600@72Hz 4:3 HorFreq: 48100 Hz Clock: 50.000 MHz
  800x600@75Hz 4:3 HorFreq: 46900 Hz Clock: 49.500 MHz
  1024x768@60Hz 4:3 HorFreq: 48400 Hz Clock: 65.000 MHz
  1024x768@70Hz 4:3 HorFreq: 56500 Hz Clock: 75.000 MHz
  1024x768@75Hz 4:3 HorFreq: 60000 Hz Clock: 78.750 MHz
  1280x1024@75Hz 5:4 HorFreq: 80000 Hz Clock: 135.000 MHz
  1152x870@75Hz 192:145 HorFreq: 67500 Hz Clock: 108.000 MHz
Standard timings supported:
  1152x864@60Hz 4:3
  1280x720@60Hz 16:9
  1280x800@60Hz 16:10
  1280x960@60Hz 4:3 HorFreq: 60000 Hz Clock: 108.000 MHz
  1280x1024@60Hz 5:4 HorFreq: 64000 Hz Clock: 108.000 MHz
  1360x765@60Hz 16:9
  1440x900@60Hz 16:10 HorFreq: 55500 Hz Clock: 88.750 MHz
  1920x1080@60Hz 16:9
Detailed mode: Clock 146.000 MHz, 474 mm x 296 mm
               1680 1784 1960 2240 hborder 0
               1050 1053 1059 1089 vborder 0
               -hsync +vsync 
               VertFreq: 59 Hz, HorFreq: 65178 Hz
Monitor ranges (GTF): 24-77Hz V, 15-94kHz H, max dotclock 170MHz
Monitor name: Sceptre
Checksum: 0x2f (valid)
