
EDID (hex):
00ffffffffffff001e6de4764d3a0600
051b0104b55022789fca95a6554ea126
0f5054256b807140818081c0a9c0b300
d1c081000101e77c70a0d0a029503020
3a00204f3100001ae4a770b8d1a02450
90608400204f3100001a000000fd0037
4b5a5a2b010a202020202020000000fc
004c4720554c545241574944450a01e2

Extracted contents:
header:          00 ff ff ff ff ff ff 00
serial number:   1e 6d e4 76 4d 3a 06 00 05 1b
version:         01 04
basic params:    b5 50 22 78 9f
chroma info:     ca 95 a6 55 4e a1 26 0f 50 54
established:     25 6b 80
standard:        71 40 81 80 81 c0 a9 c0 b3 00 d1 c0 81 00 01 01
descriptor 1:    e7 7c 70 a0 d0 a0 29 50 30 20 3a 00 20 4f 31 00 00 1a
descriptor 2:    e4 a7 70 b8 d1 a0 24 50 90 60 84 00 20 4f 31 00 00 1a
descriptor 3:    00 00 00 fd 00 37 4b 5a 5a 2b 01 0a 20 20 20 20 20 20
descriptor 4:    00 00 00 fc 00 4c 47 20 55 4c 54 52 41 57 49 44 45 0a
extensions:      01
checksum:        e2

EDID version: 1.4
Manufacturer: GSM Model 76e4 Serial Number --
Made in week 5 of 2017
Digital display
10 bits per primary color channel
DisplayPort interface
Maximum image size: 80 cm x 34 cm
Gamma: 2.20
DPMS levels: Standby
Supported color formats: RGB 4:4:4, YCrCb 4:4:4, YCrCb 4:2:2
Default (sRGB) color space is primary color space
First detailed timing includes the native pixel format and preferred refresh rate
Display is continuous frequency
Display x,y Chromaticity:
  Red:   0.6513, 0.3320
  Green: 0.3066, 0.6308
  Blue:  0.1503, 0.0595
  White: 0.3134, 0.3291
Established timings supported:
  640x480@60Hz 4:3 HorFreq: 31469 Hz Clock: 25.175 MHz
  640x480@75Hz 4:3 HorFreq: 37500 Hz Clock: 31.500 MHz
  800x600@60Hz 4:3 HorFreq: 37900 Hz Clock: 40.000 MHz
  800x600@75Hz 4:3 HorFreq: 46900 Hz Clock: 49.500 MHz
  832x624@75Hz 4:3 HorFreq: 49726 Hz Clock: 57.284 MHz
  1024x768@60Hz 4:3 HorFreq: 48400 Hz Clock: 65.000 MHz
  1024x768@75Hz 4:3 HorFreq: 60000 Hz Clock: 78.750 MHz
  1280x1024@75Hz 5:4 HorFreq: 80000 Hz Clock: 135.000 MHz
  1152x870@75Hz 192:145 HorFreq: 67500 Hz Clock: 108.000 MHz
Standard timings supported:
  1152x864@60Hz 4:3
  1280x1024@60Hz 5:4 HorFreq: 64000 Hz Clock: 108.000 MHz
  1280x720@60Hz 16:9
  1600x900@60Hz 16:9
  1680x1050@60Hz 16:10 HorFreq: 64700 Hz Clock: 119.000 MHz
  1920x1080@60Hz 16:9
  1280x800@60Hz 16:10
Detailed mode: Clock 319.750 MHz, 800 mm x 335 mm
               3440 3488 3520 3600 hborder 0
               1440 1443 1453 1481 vborder 0
               +hsync -vsync 
               VertFreq: 59 Hz, HorFreq: 88819 Hz
Detailed mode: Clock 429.800 MHz, 800 mm x 335 mm
               3440 3584 3680 3880 hborder 0
               1440 1448 1452 1476 vborder 0
               +hsync -vsync 
               VertFreq: 75 Hz, HorFreq: 110773 Hz
Monitor ranges (bare limits): 55-75Hz V, 90-90kHz H, max dotclock 430MHz
Monitor name: LG ULTRAWIDE
Has 1 extension blocks
Checksum: 0xe2 (valid)
EDID block does NOT conform to EDID 1.4!
	sRGB is signaled, but the chromaticities do not match
Warning: One or more of the timings is out of range of the Monitor Ranges:
  Vertical Freq: 59 - 75 Hz
  Horizontal Freq: 31469 - 110773 Hz
  Maximum Clock: 429.800 MHz
