edid-decode (hex):

00 ff ff ff ff ff ff 00 06 af 00 41 00 00 00 00
01 17 01 04 80 16 0e 78 ea 98 25 99 58 54 8e 27
1e 50 54 00 00 00 01 01 01 01 01 01 01 01 01 01
01 01 01 01 01 01 8e 3a 80 90 70 b0 0a 40 2c 20
35 00 d8 88 00 00 00 18 00 00 00 00 00 00 00 00
00 00 00 00 00 00 00 00 00 00 00 00 00 fe 00 41
55 4f 5e 20 20 20 20 20 20 20 20 20 00 00 00 fe
00 42 31 30 31 55 41 4e 30 31 2e 43 20 0a 00 16

----------------

Block 0, Base EDID:
  EDID Structure Version & Revision: 1.4
  Vendor & Product Identification:
    Manufacturer: AUO
    Model: 16640
    Made in: week 1 of 2013
  Basic Display Parameters & Features:
    Digital display
    Color depth is undefined
    Digital interface is not defined
    Maximum image size: 22 cm x 14 cm
    Gamma: 2.20
    DPMS levels: Standby Suspend Off
    Supported color formats: RGB 4:4:4, YCrCb 4:4:4
    First detailed timing includes the native pixel format and preferred refresh rate
  Color Characteristics:
    Red  : 0.5996, 0.3447
    Green: 0.3300, 0.5546
    Blue : 0.1523, 0.1191
    White: 0.3134, 0.3291
  Established Timings I & II: none
  Standard Timings: none
  Detailed Timing Descriptors:
    DTD 1:  1920x1200   60.021 Hz   8:5    72.626 kHz 149.900 MHz (216 mm x 136 mm)
                 Hfront   44 Hsync  32 Hback  68 Hpol N
                 Vfront    3 Vsync   5 Vback   2 Vpol N
    Empty Descriptor
    Alphanumeric Data String: 'AUO^         '
    Alphanumeric Data String: 'B101UAN01.C '
Checksum: 0x16

----------------

Failures:

Block 0, Base EDID:
  Empty Descriptor: Use Dummy Descriptor instead of all zeroes.
  Alphanumeric Data String: One or more trailing spaces.
  Alphanumeric Data String: One or more trailing spaces.
  Missing Display Product Name.

EDID conformity: FAIL
