edid-decode (hex):

00 ff ff ff ff ff ff 00 06 af ed 60 00 00 00 00
00 1a 01 04 95 22 13 78 02 32 a5 a5 55 52 9d 26
0b 50 54 00 00 00 01 01 01 01 01 01 01 01 01 01
01 01 01 01 01 01 14 37 80 a6 70 38 2e 40 6c 30
aa 00 58 c1 10 00 00 1a 10 2c 80 a6 70 38 2e 40
6c 30 aa 00 58 c1 10 00 00 1a 00 00 00 fe 00 59
35 30 32 58 81 42 31 35 36 48 41 4e 00 00 00 00
00 00 41 02 9e 00 10 00 00 0a 01 0a 20 20 00 29

----------------

Block 0, Base EDID:
  EDID Structure Version & Revision: 1.4
  Vendor & Product Identification:
    Manufacturer: AUO
    Model: 24813
    Made in: 2016
  Basic Display Parameters & Features:
    Digital display
    Bits per primary color channel: 6
    DisplayPort interface
    Maximum image size: 34 cm x 19 cm
    Gamma: 2.20
    Supported color formats: RGB 4:4:4
    First detailed timing includes the native pixel format and preferred refresh rate
  Color Characteristics:
    Red  : 0.6445, 0.3349
    Green: 0.3203, 0.6152
    Blue : 0.1503, 0.0449
    White: 0.3134, 0.3291
  Established Timings I & II: none
  Standard Timings: none
  Detailed Timing Descriptors:
    DTD 1:  1920x1080   60.029734 Hz  16:9     67.593 kHz    141.000000 MHz (344 mm x 193 mm)
                 Hfront  108 Hsync  48 Hback   10 Hpol P
                 Vfront   10 Vsync  10 Vback   26 Vpol N
    DTD 2:  1920x1080   48.023787 Hz  16:9     54.075 kHz    112.800000 MHz (344 mm x 193 mm)
                 Hfront  108 Hsync  48 Hback   10 Hpol P
                 Vfront   10 Vsync  10 Vback   26 Vpol N
    Alphanumeric Data String: 'Y502X'
    Manufacturer-Specified Display Descriptor (0x00): 00 00 00 00 41 02 9e 00 10 00 00 0a 01 0a 20 20 '....A.........  '
Checksum: 0x29

----------------

Warnings:

Block 0, Base EDID:
  Missing Display Product Name.

Failures:

Block 0, Base EDID:
  Alphanumeric Data String: Non-printable character.

EDID conformity: FAIL
