
EDID (hex):
00ffffffffffff001e6db13b01010101
021301036a211378eadd8596564f8d28
255054a56a0081cf6140454001010101
0101010101011a1d008051d01c204080
35004cbb1000001c000000fd00384b1e
460a000a202020202020000000fc0057
313534320a20202020202020000000fc
000a2020202020202020202020200045

Extracted contents:
header:          00 ff ff ff ff ff ff 00
serial number:   1e 6d b1 3b 01 01 01 01 02 13
version:         01 03
basic params:    6a 21 13 78 ea
chroma info:     dd 85 96 56 4f 8d 28 25 50 54
established:     a5 6a 00
standard:        81 cf 61 40 45 40 01 01 01 01 01 01 01 01 01 01
descriptor 1:    1a 1d 00 80 51 d0 1c 20 40 80 35 00 4c bb 10 00 00 1c
descriptor 2:    00 00 00 fd 00 38 4b 1e 46 0a 00 0a 20 20 20 20 20 20
descriptor 3:    00 00 00 fc 00 57 31 35 34 32 0a 20 20 20 20 20 20 20
descriptor 4:    00 00 00 fc 00 0a 20 20 20 20 20 20 20 20 20 20 20 20
extensions:      00
checksum:        45

EDID version: 1.3
Manufacturer: GSM Model 3bb1 Serial Number --
Made in week 2 of 2009
Analog display, Input voltage level: 0.7/0.7 V
Sync: Separate SyncOnGreen 
Maximum image size: 33 cm x 19 cm
Gamma: 2.20
DPMS levels: Standby Suspend Off
RGB color display
First detailed timing is preferred timing
Display x,y Chromaticity:
  Red:   0.5888, 0.3369
  Green: 0.3115, 0.5517
  Blue:  0.1582, 0.1445
  White: 0.3134, 0.3291
Established timings supported:
  720x400@70Hz 9:5 HorFreq: 31469 Hz Clock: 28.320 MHz
  640x480@60Hz 4:3 HorFreq: 31469 Hz Clock: 25.175 MHz
  640x480@75Hz 4:3 HorFreq: 37500 Hz Clock: 31.500 MHz
  800x600@60Hz 4:3 HorFreq: 37900 Hz Clock: 40.000 MHz
  800x600@75Hz 4:3 HorFreq: 46900 Hz Clock: 49.500 MHz
  832x624@75Hz 4:3 HorFreq: 49726 Hz Clock: 57.284 MHz
  1024x768@60Hz 4:3 HorFreq: 48400 Hz Clock: 65.000 MHz
  1024x768@75Hz 4:3 HorFreq: 60000 Hz Clock: 78.750 MHz
Standard timings supported:
  1280x720@75Hz 16:9
  1024x768@60Hz 4:3 HorFreq: 48400 Hz Clock: 65.000 MHz
  800x600@60Hz 4:3 HorFreq: 37900 Hz Clock: 40.000 MHz
Detailed mode: Clock 74.500 MHz, 332 mm x 187 mm
               1280 1344 1472 1664 hborder 0
                720  723  728  748 vborder 0
               -hsync +vsync 
               VertFreq: 59 Hz, HorFreq: 44771 Hz
Monitor ranges (GTF): 56-75Hz V, 30-70kHz H, max dotclock 100MHz
Monitor name: W1542
Checksum: 0x45 (valid)
