
EDID (hex):
00ffffffffffff001e6dc94ed4290300
061501036c2d1978eaeba5a359529f25
0e5054a76a80714f8180a9c301010101
010101010101302a40c8608464301850
1300bbf91000001e000000fd00384b1e
530d000a202020202020000000fc0045
323034310a20202020202020000000ff
00313036494e515536333331360a0044

Extracted contents:
header:          00 ff ff ff ff ff ff 00
serial number:   1e 6d c9 4e d4 29 03 00 06 15
version:         01 03
basic params:    6c 2d 19 78 ea
chroma info:     eb a5 a3 59 52 9f 25 0e 50 54
established:     a7 6a 80
standard:        71 4f 81 80 a9 c3 01 01 01 01 01 01 01 01 01 01
descriptor 1:    30 2a 40 c8 60 84 64 30 18 50 13 00 bb f9 10 00 00 1e
descriptor 2:    00 00 00 fd 00 38 4b 1e 53 0d 00 0a 20 20 20 20 20 20
descriptor 3:    00 00 00 fc 00 45 32 30 34 31 0a 20 20 20 20 20 20 20
descriptor 4:    00 00 00 ff 00 31 30 36 49 4e 51 55 36 33 33 31 36 0a
extensions:      00
checksum:        44

EDID version: 1.3
Manufacturer: GSM Model 4ec9 Serial Number --
Made in week 6 of 2011
Analog display, Input voltage level: 0.7/0.7 V
Sync: Separate Composite 
Maximum image size: 45 cm x 25 cm
Gamma: 2.20
DPMS levels: Standby Suspend Off
RGB color display
First detailed timing is preferred timing
Display x,y Chromaticity:
  Red:   0.6396, 0.3496
  Green: 0.3222, 0.6240
  Blue:  0.1464, 0.0566
  White: 0.3134, 0.3291
Established timings supported:
  720x400@70Hz 9:5 HorFreq: 31469 Hz Clock: 28.320 MHz
  640x480@60Hz 4:3 HorFreq: 31469 Hz Clock: 25.175 MHz
  640x480@75Hz 4:3 HorFreq: 37500 Hz Clock: 31.500 MHz
  800x600@56Hz 4:3 HorFreq: 35200 Hz Clock: 36.000 MHz
  800x600@60Hz 4:3 HorFreq: 37900 Hz Clock: 40.000 MHz
  800x600@75Hz 4:3 HorFreq: 46900 Hz Clock: 49.500 MHz
  832x624@75Hz 4:3 HorFreq: 49726 Hz Clock: 57.284 MHz
  1024x768@60Hz 4:3 HorFreq: 48400 Hz Clock: 65.000 MHz
  1024x768@75Hz 4:3 HorFreq: 60000 Hz Clock: 78.750 MHz
  1152x870@75Hz 192:145 HorFreq: 67500 Hz Clock: 108.000 MHz
Standard timings supported:
  1152x864@75Hz 4:3 HorFreq: 67500 Hz Clock: 108.000 MHz
  1280x1024@60Hz 5:4 HorFreq: 64000 Hz Clock: 108.000 MHz
  1600x900@63Hz 16:9
Detailed mode: Clock 108.000 MHz, 443 mm x 249 mm
               1600 1624 1704 1800 hborder 0
                900  901  904 1000 vborder 0
               +hsync +vsync 
               VertFreq: 60 Hz, HorFreq: 60000 Hz
Monitor ranges (GTF): 56-75Hz V, 30-83kHz H, max dotclock 130MHz
Monitor name: E2041
Serial number: --
Checksum: 0x44 (valid)
