
EDID (hex):
00ffffffffffff0010ac2ba0534e5243
08120104a534207822b325ac5130b426
105054a54b008180a940714f01010101
010101010101283c80a070b023403020
360007402100001a000000ff00435832
363838324d43524e530a000000fc0044
454c4c20323430385746500a000000fd
00384c1e5311010a2020202020200050

Extracted contents:
header:          00 ff ff ff ff ff ff 00
serial number:   10 ac 2b a0 53 4e 52 43 08 12
version:         01 04
basic params:    a5 34 20 78 22
chroma info:     b3 25 ac 51 30 b4 26 10 50 54
established:     a5 4b 00
standard:        81 80 a9 40 71 4f 01 01 01 01 01 01 01 01 01 01
descriptor 1:    28 3c 80 a0 70 b0 23 40 30 20 36 00 07 40 21 00 00 1a
descriptor 2:    00 00 00 ff 00 43 58 32 36 38 38 32 4d 43 52 4e 53 0a
descriptor 3:    00 00 00 fc 00 44 45 4c 4c 20 32 34 30 38 57 46 50 0a
descriptor 4:    00 00 00 fd 00 38 4c 1e 53 11 01 0a 20 20 20 20 20 20
extensions:      00
checksum:        50

EDID version: 1.4
Manufacturer: DEL Model a02b Serial Number --
Made in week 8 of 2008
Digital display
8 bits per primary color channel
DisplayPort interface
Maximum image size: 52 cm x 32 cm
Gamma: 2.20
DPMS levels: Off
Supported color formats: RGB 4:4:4
First detailed timing includes the native pixel format and preferred refresh rate
Display x,y Chromaticity:
  Red:   0.6738, 0.3193
  Green: 0.1875, 0.7060
  Blue:  0.1484, 0.0644
  White: 0.3134, 0.3291
Established timings supported:
  720x400@70Hz 9:5 HorFreq: 31469 Hz Clock: 28.320 MHz
  640x480@60Hz 4:3 HorFreq: 31469 Hz Clock: 25.175 MHz
  640x480@75Hz 4:3 HorFreq: 37500 Hz Clock: 31.500 MHz
  800x600@60Hz 4:3 HorFreq: 37900 Hz Clock: 40.000 MHz
  800x600@75Hz 4:3 HorFreq: 46900 Hz Clock: 49.500 MHz
  1024x768@60Hz 4:3 HorFreq: 48400 Hz Clock: 65.000 MHz
  1024x768@75Hz 4:3 HorFreq: 60000 Hz Clock: 78.750 MHz
  1280x1024@75Hz 5:4 HorFreq: 80000 Hz Clock: 135.000 MHz
Standard timings supported:
  1280x1024@60Hz 5:4 HorFreq: 64000 Hz Clock: 108.000 MHz
  1600x1200@60Hz 4:3 HorFreq: 75000 Hz Clock: 162.000 MHz
  1152x864@75Hz 4:3 HorFreq: 67500 Hz Clock: 108.000 MHz
Detailed mode: Clock 154.000 MHz, 519 mm x 320 mm
               1920 1968 2000 2080 hborder 0
               1200 1203 1209 1235 vborder 0
               +hsync -vsync 
               VertFreq: 59 Hz, HorFreq: 74038 Hz
Serial number: --
Monitor name: DELL 2408WFP
Monitor ranges (bare limits): 56-76Hz V, 30-83kHz H, max dotclock 170MHz
Checksum: 0x50 (valid)


