edid-decode (hex):

00 ff ff ff ff ff ff 00 4c a3 46 38 00 00 00 00
00 12 01 03 80 21 15 78 0a 87 f5 94 57 4f 8c 27
27 50 54 00 00 00 01 01 01 01 01 01 01 01 01 01
01 01 01 01 01 01 78 33 90 7e 61 1a 0f 40 18 58
13 00 4b cf 10 00 00 19 00 00 00 0f 00 00 00 00
00 00 00 00 00 3c d2 02 64 00 00 00 00 fe 00 53
41 4d 53 55 4e 47 0a 20 20 20 20 20 00 00 00 fe
00 31 35 34 4d 54 30 32 2d 46 30 31 0a 20 00 dc

00 ff ff ff ff ff ff 00 4c a3 46 38 00 00 00 00
00 12 01 03 80 21 15 78 0a 87 f5 94 57 4f 8c 27
27 50 54 00 00 00 01 01 01 01 01 01 01 01 01 01
01 01 01 01 01 01 78 33 90 7e 61 1a 0f 40 18 58
13 00 4b cf 10 00 00 19 00 00 00 0f 00 00 00 00
00 00 00 00 00 3c d2 02 64 00 00 00 00 fe 00 53
41 4d 53 55 4e 47 0a 20 20 20 20 20 00 00 00 fe
00 31 35 34 4d 54 30 32 2d 46 30 31 0a 20 00 dc

----------------

Block 0, Base EDID:
  EDID Structure Version & Revision: 1.3
  Vendor & Product Identification:
    Manufacturer: SEC
    Model: 14406
    Made in: 2008
  Basic Display Parameters & Features:
    Digital display
    Maximum image size: 33 cm x 21 cm
    Gamma: 2.20
    RGB color display
    First detailed timing is the preferred timing
  Color Characteristics:
    Red  : 0.5800, 0.3398
    Green: 0.3095, 0.5498
    Blue : 0.1552, 0.1552
    White: 0.3134, 0.3291
  Established Timings I & II: none
  Standard Timings: none
  Detailed Timing Descriptors:
    DTD 1:  1680x1050   59.999180 Hz  16:10    63.899 kHz    131.760000 MHz (331 mm x 207 mm)
                 Hfront   24 Hsync  88 Hback  270 Hpol N
                 Vfront    1 Vsync   3 Vback   11 Vpol N
    Manufacturer-Specified Display Descriptor (0x0f): 00 0f 00 00 00 00 00 00 00 00 00 3c d2 02 64 00 '...........<..d.'
    Alphanumeric Data String: 'SAMSUNG'
    Alphanumeric Data String: '154MT02-F01'
Checksum: 0xdc

----------------

Block 1, Unknown EDID Extension Block 0x00:
  00 ff ff ff ff ff ff 00 4c a3 46 38 00 00 00 00 '........L.F8....'
  00 12 01 03 80 21 15 78 0a 87 f5 94 57 4f 8c 27 '.....!.x....WO.''
  27 50 54 00 00 00 01 01 01 01 01 01 01 01 01 01 ''PT.............'
  01 01 01 01 01 01 78 33 90 7e 61 1a 0f 40 18 58 '......x3.~a..@.X'
  13 00 4b cf 10 00 00 19 00 00 00 0f 00 00 00 00 '..K.............'
  00 00 00 00 00 3c d2 02 64 00 00 00 00 fe 00 53 '.....<..d......S'
  41 4d 53 55 4e 47 0a 20 20 20 20 20 00 00 00 fe 'AMSUNG.     ....'
  00 31 35 34 4d 54 30 32 2d 46 30 31 0a 20 00 dc '.154MT02-F01. ..'
Checksum: 0xdc

----------------

Failures:

Block 0, Base EDID:
  Missing Display Product Name.
  Missing Display Range Limits Descriptor.
Block 1, Base EDID:
  Unknown Extension Block.
EDID:
  Base EDID: EDID specified 0 extension block(s), but found 1 extension block(s).

EDID conformity: FAIL
