
EDID (hex):
00ffffffffffff0026cd090001010101
00190104b55831783a0d4dab4f42a626
0e474abfef80e1c0d100d1c0b300a940
a9c0818081004dd000a0f0703e803020
35006ee53100001a0474801871705a80
582c8a006ee53100001e000000fd0017
4c0f8a3c000a202020202020000000fc
00504c3430373155480a20202020013b
02032ef353101f051404130302121107
0616152001dddedf23097f0783010000
6db914000400b86e2000600102030474
0030f2705a80b0588a006ee53100001e
565e00a0a0a02950302035006ee53100
001a023a801871382d40582c45006ee5
3100001e011d007251d01e206e285500
6ee53100001e000000000000000000d4

Extracted contents:
header:          00 ff ff ff ff ff ff 00
serial number:   26 cd 09 00 01 01 01 01 00 19
version:         01 04
basic params:    b5 58 31 78 3a
chroma info:     0d 4d ab 4f 42 a6 26 0e 47 4a
established:     bf ef 80
standard:        e1 c0 d1 00 d1 c0 b3 00 a9 40 a9 c0 81 80 81 00
descriptor 1:    4d d0 00 a0 f0 70 3e 80 30 20 35 00 6e e5 31 00 00 1a
descriptor 2:    04 74 80 18 71 70 5a 80 58 2c 8a 00 6e e5 31 00 00 1e
descriptor 3:    00 00 00 fd 00 17 4c 0f 8a 3c 00 0a 20 20 20 20 20 20
descriptor 4:    00 00 00 fc 00 50 4c 34 30 37 31 55 48 0a 20 20 20 20
extensions:      01
checksum:        3b

EDID version: 1.4
Manufacturer: IVM Model 9 Serial Number --
Made in year 2015
Digital display
10 bits per primary color channel
DisplayPort interface
Maximum image size: 88 cm x 49 cm
Gamma: 2.20
DPMS levels: Off
Supported color formats: RGB 4:4:4, YCrCb 4:4:4, YCrCb 4:2:2
First detailed timing includes the native pixel format and preferred refresh rate
Display x,y Chromaticity:
  Red:   0.6679, 0.3085
  Green: 0.2607, 0.6494
  Blue:  0.1494, 0.0546
  White: 0.2802, 0.2900
Established timings supported:
  720x400@70Hz 9:5 HorFreq: 31469 Hz Clock: 28.320 MHz
  640x480@60Hz 4:3 HorFreq: 31469 Hz Clock: 25.175 MHz
  640x480@67Hz 4:3 HorFreq: 35000 Hz Clock: 30.240 MHz
  640x480@72Hz 4:3 HorFreq: 37900 Hz Clock: 31.500 MHz
  640x480@75Hz 4:3 HorFreq: 37500 Hz Clock: 31.500 MHz
  800x600@56Hz 4:3 HorFreq: 35200 Hz Clock: 36.000 MHz
  800x600@60Hz 4:3 HorFreq: 37900 Hz Clock: 40.000 MHz
  800x600@72Hz 4:3 HorFreq: 48100 Hz Clock: 50.000 MHz
  800x600@75Hz 4:3 HorFreq: 46900 Hz Clock: 49.500 MHz
  832x624@75Hz 4:3 HorFreq: 49726 Hz Clock: 57.284 MHz
  1024x768@60Hz 4:3 HorFreq: 48400 Hz Clock: 65.000 MHz
  1024x768@70Hz 4:3 HorFreq: 56500 Hz Clock: 75.000 MHz
  1024x768@75Hz 4:3 HorFreq: 60000 Hz Clock: 78.750 MHz
  1280x1024@75Hz 5:4 HorFreq: 80000 Hz Clock: 135.000 MHz
  1152x870@75Hz 192:145 HorFreq: 67500 Hz Clock: 108.000 MHz
Standard timings supported:
  2048x1152@60Hz 16:9
  1920x1200@60Hz 16:10 HorFreq: 74000 Hz Clock: 154.000 MHz
  1920x1080@60Hz 16:9
  1680x1050@60Hz 16:10 HorFreq: 64700 Hz Clock: 119.000 MHz
  1600x1200@60Hz 4:3 HorFreq: 75000 Hz Clock: 162.000 MHz
  1600x900@60Hz 16:9
  1280x1024@60Hz 5:4 HorFreq: 64000 Hz Clock: 108.000 MHz
  1280x800@60Hz 16:10
Detailed mode: Clock 533.250 MHz, 878 mm x 485 mm
               3840 3888 3920 4000 hborder 0
               2160 2163 2168 2222 vborder 0
               +hsync -vsync 
               VertFreq: 59 Hz, HorFreq: 133312 Hz
Detailed mode: Clock 297.000 MHz, 878 mm x 485 mm
               1920 2008 2052 2200 hborder 0
               2160 2168 2178 2250 vborder 0
               +hsync +vsync 
               VertFreq: 60 Hz, HorFreq: 135000 Hz
Monitor ranges (GTF): 23-76Hz V, 15-138kHz H, max dotclock 600MHz
Monitor name: PL4071UH
Has 1 extension blocks
Checksum: 0x3b (valid)

CTA extension block
Extension version: 3
42 bytes of CTA data
  Video data block
    VIC  16 1920x1080@60Hz 16:9  HorFreq: 67500 Hz Clock: 148.500 MHz
    VIC  31 1920x1080@50Hz 16:9  HorFreq: 56250 Hz Clock: 148.500 MHz
    VIC   5 1920x1080i@60Hz 16:9  HorFreq: 33750 Hz Clock: 74.250 MHz
    VIC  20 1920x1080i@50Hz 16:9  HorFreq: 28125 Hz Clock: 74.250 MHz
    VIC   4 1280x720@60Hz 16:9  HorFreq: 45000 Hz Clock: 74.250 MHz
    VIC  19 1280x720@50Hz 16:9  HorFreq: 37500 Hz Clock: 74.250 MHz
    VIC   3 720x480@60Hz 16:9  HorFreq: 31469 Hz Clock: 27.000 MHz
    VIC   2 720x480@60Hz 4:3  HorFreq: 31469 Hz Clock: 27.000 MHz
    VIC  18 720x576@50Hz 16:9  HorFreq: 31250 Hz Clock: 27.000 MHz
    VIC  17 720x576@50Hz 4:3  HorFreq: 31250 Hz Clock: 27.000 MHz
    VIC   7 1440x480i@60Hz 16:9  HorFreq: 15734 Hz Clock: 27.000 MHz
    VIC   6 1440x480i@60Hz 4:3  HorFreq: 15734 Hz Clock: 27.000 MHz
    VIC  22 1440x576i@50Hz 16:9  HorFreq: 15625 Hz Clock: 27.000 MHz
    VIC  21 1440x576i@50Hz 4:3  HorFreq: 15625 Hz Clock: 27.000 MHz
    VIC  32 1920x1080@24Hz 16:9  HorFreq: 27000 Hz Clock: 74.250 MHz
    VIC   1 640x480@60Hz 4:3  HorFreq: 31469 Hz Clock: 25.175 MHz
    VIC 221 Unknown mode  HorFreq: 0 Hz Clock: 0.000 MHz
    VIC 222 Unknown mode  HorFreq: 0 Hz Clock: 0.000 MHz
    VIC 223 Unknown mode  HorFreq: 0 Hz Clock: 0.000 MHz
  Audio data block
    Linear PCM, max channels 2
      Supported sample rates (kHz): 192 176.4 96 88.2 48 44.1 32
      Supported sample sizes (bits): 24 20 16
  Speaker allocation data block
    Speaker map:
      FL/FR - Front Left/Right
  Vendor-specific data block, OUI 0014b9
Underscans PC formats by default
Basic audio support
Supports YCbCr 4:4:4
Supports YCbCr 4:2:2
3 native detailed modes
Detailed mode: Clock 297.000 MHz, 878 mm x 485 mm
               3840 4016 4104 4400 hborder 0
               2160 2168 2178 2250 vborder 0
               +hsync +vsync 
               VertFreq: 30 Hz, HorFreq: 67500 Hz
Detailed mode: Clock 241.500 MHz, 878 mm x 485 mm
               2560 2608 2640 2720 hborder 0
               1440 1443 1448 1481 vborder 0
               +hsync -vsync 
               VertFreq: 59 Hz, HorFreq: 88786 Hz
Detailed mode: Clock 148.500 MHz, 878 mm x 485 mm
               1920 2008 2052 2200 hborder 0
               1080 1084 1089 1125 vborder 0
               +hsync +vsync 
               VertFreq: 60 Hz, HorFreq: 67500 Hz
Detailed mode: Clock 74.250 MHz, 878 mm x 485 mm
               1280 1390 1430 1650 hborder 0
                720  725  730  750 vborder 0
               +hsync +vsync 
               VertFreq: 60 Hz, HorFreq: 45000 Hz
Checksum: 0xd4 (valid)



