edid-decode (hex):

00 ff ff ff ff ff ff 00 63 18 70 09 00 00 00 00
14 1d 01 03 80 34 1f 78 ee 44 55 a9 55 4d 9d 26
0f 50 54 ad cf 00 b3 00 d1 c0 a9 c0 95 00 71 40
81 00 81 c0 81 40 1c 57 00 e0 80 00 64 60 30 20
34 00 c5 93 00 00 00 1a 7f 21 56 aa 51 00 1e 30
46 8f 33 00 c5 93 00 00 00 1a 66 21 50 b0 51 00
1b 30 40 70 36 00 c5 93 00 00 00 1a 00 00 00 fc
00 48 44 4d 49 0a 20 20 20 20 20 20 20 20 01 6e

02 03 28 f1 4f 10 05 04 03 02 07 16 01 14 1f 12
13 03 21 22 23 09 07 07 83 01 00 00 67 03 0c 00
10 00 38 3d e3 05 03 01 02 3a 80 18 71 38 2d 40
58 2c 25 00 c5 93 00 00 00 1e 01 1d 80 18 71 1c
16 20 58 2c 25 00 c5 93 00 00 00 1e 01 1d 00 72
51 d0 1e 20 6e 28 55 00 c5 93 00 00 00 1e 8c 0a
d0 8a 20 e0 2d 10 10 3e 96 00 c5 93 00 00 00 18
00 00 00 00 00 00 00 00 00 00 00 00 00 00 00 a2

00 ff ff ff ff ff ff 00 63 18 70 09 00 00 00 00
14 1d 01 03 80 34 1f 78 ee 44 55 a9 55 4d 9d 26
0f 50 54 ad cf 00 b3 00 d1 c0 a9 c0 95 00 71 40
81 00 81 c0 81 40 1c 57 00 e0 80 00 64 60 30 20
34 00 c5 93 00 00 00 1a 7f 21 56 aa 51 00 1e 30
46 8f 33 00 c5 93 00 00 00 1a 66 21 50 b0 51 00
1b 30 40 70 36 00 c5 93 00 00 00 1a 00 00 00 fc
00 48 44 4d 49 0a 20 20 20 20 20 20 20 20 01 6e

02 03 28 f1 4f 10 05 04 03 02 07 16 01 14 1f 12
13 03 21 22 23 09 07 07 83 01 00 00 67 03 0c 00
10 00 38 3d e3 05 03 01 02 3a 80 18 71 38 2d 40
58 2c 25 00 c5 93 00 00 00 1e 01 1d 80 18 71 1c
16 20 58 2c 25 00 c5 93 00 00 00 1e 01 1d 00 72
51 d0 1e 20 6e 28 55 00 c5 93 00 00 00 1e 8c 0a
d0 8a 20 e0 2d 10 10 3e 96 00 c5 93 00 00 00 18
00 00 00 00 00 00 00 00 00 00 00 00 00 00 00 a2

----------------

Block 0, Base EDID:
  EDID Structure Version & Revision: 1.3
  Vendor & Product Identification:
    Manufacturer: XXX
    Model: 2416
    Made in: week 20 of 2019
  Basic Display Parameters & Features:
    Digital display
    Maximum image size: 52 cm x 31 cm
    Gamma: 2.20
    DPMS levels: Standby Suspend Off
    RGB color display
    Default (sRGB) color space is primary color space
    First detailed timing is the preferred timing
  Color Characteristics:
    Red  : 0.6611, 0.3320
    Green: 0.3017, 0.6132
    Blue : 0.1494, 0.0595
    White: 0.3134, 0.3291
  Established Timings I & II:
    IBM     :   720x400    70.081663 Hz   9:5     31.467 kHz     28.320000 MHz
    DMT 0x04:   640x480    59.940476 Hz   4:3     31.469 kHz     25.175000 MHz
    DMT 0x05:   640x480    72.808802 Hz   4:3     37.861 kHz     31.500000 MHz
    DMT 0x06:   640x480    75.000000 Hz   4:3     37.500 kHz     31.500000 MHz
    DMT 0x09:   800x600    60.316541 Hz   4:3     37.879 kHz     40.000000 MHz
    DMT 0x0a:   800x600    72.187572 Hz   4:3     48.077 kHz     50.000000 MHz
    DMT 0x0b:   800x600    75.000000 Hz   4:3     46.875 kHz     49.500000 MHz
    DMT 0x10:  1024x768    60.003840 Hz   4:3     48.363 kHz     65.000000 MHz
    DMT 0x11:  1024x768    70.069359 Hz   4:3     56.476 kHz     75.000000 MHz
    DMT 0x12:  1024x768    75.028582 Hz   4:3     60.023 kHz     78.750000 MHz
    DMT 0x24:  1280x1024   75.024675 Hz   5:4     79.976 kHz    135.000000 MHz
  Standard Timings:
    DMT 0x3a:  1680x1050   59.954250 Hz  16:10    65.290 kHz    146.250000 MHz
    DMT 0x52:  1920x1080   60.000000 Hz  16:9     67.500 kHz    148.500000 MHz
    DMT 0x53:  1600x900    60.000000 Hz  16:9     60.000 kHz    108.000000 MHz (RB)
    DMT 0x2f:  1440x900    59.887445 Hz  16:10    55.935 kHz    106.500000 MHz
    GTF     :  1152x864    60.000000 Hz   4:3     53.700 kHz     81.624000 MHz
    DMT 0x1c:  1280x800    59.810326 Hz  16:10    49.702 kHz     83.500000 MHz
    DMT 0x55:  1280x720    60.000000 Hz  16:9     45.000 kHz     74.250000 MHz
    DMT 0x20:  1280x960    60.000000 Hz   4:3     60.000 kHz    108.000000 MHz
  Detailed Timing Descriptors:
    DTD  1:  2048x1536   59.994748 Hz   4:3     98.151 kHz    223.000000 MHz (197 mm x 147 mm)
                  Hfront   48 Hsync  32 Hback  144 Hpol P
                  Vfront    3 Vsync   4 Vback   93 Vpol N
    DTD  2:  1366x768    59.964364 Hz 683:384   47.852 kHz     85.750000 MHz (197 mm x 147 mm)
                  Hfront   70 Hsync 143 Hback  213 Hpol P
                  Vfront    3 Vsync   3 Vback   24 Vpol N
    DTD  3:  1360x768    60.015162 Hz  85:48    47.712 kHz     85.500000 MHz (197 mm x 147 mm)
                  Hfront   64 Hsync 112 Hback  256 Hpol P
                  Vfront    3 Vsync   6 Vback   18 Vpol N
    Display Product Name: 'HDMI'
  Extension blocks: 1
Checksum: 0x6e

----------------

Block 1, CTA-861 Extension Block:
  Revision: 3
  Underscans IT Video Formats by default
  Basic audio support
  Supports YCbCr 4:4:4
  Supports YCbCr 4:2:2
  Native detailed modes: 1
  Video Data Block:
    VIC  16:  1920x1080   60.000000 Hz  16:9     67.500 kHz    148.500000 MHz
    VIC   5:  1920x1080i  60.000000 Hz  16:9     33.750 kHz     74.250000 MHz
    VIC   4:  1280x720    60.000000 Hz  16:9     45.000 kHz     74.250000 MHz
    VIC   3:   720x480    59.940060 Hz  16:9     31.469 kHz     27.000000 MHz
    VIC   2:   720x480    59.940060 Hz   4:3     31.469 kHz     27.000000 MHz
    VIC   7:  1440x480i   59.940060 Hz  16:9     15.734 kHz     27.000000 MHz
    VIC  22:  1440x576i   50.000000 Hz  16:9     15.625 kHz     27.000000 MHz
    VIC   1:   640x480    59.940476 Hz   4:3     31.469 kHz     25.175000 MHz
    VIC  20:  1920x1080i  50.000000 Hz  16:9     28.125 kHz     74.250000 MHz
    VIC  31:  1920x1080   50.000000 Hz  16:9     56.250 kHz    148.500000 MHz
    VIC  18:   720x576    50.000000 Hz  16:9     31.250 kHz     27.000000 MHz
    VIC  19:  1280x720    50.000000 Hz  16:9     37.500 kHz     74.250000 MHz
    VIC   3:   720x480    59.940060 Hz  16:9     31.469 kHz     27.000000 MHz
    VIC  33:  1920x1080   25.000000 Hz  16:9     28.125 kHz     74.250000 MHz
    VIC  34:  1920x1080   30.000000 Hz  16:9     33.750 kHz     74.250000 MHz
  Audio Data Block:
    Linear PCM:
      Max channels: 2
      Supported sample rates (kHz): 48 44.1 32
      Supported sample sizes (bits): 24 20 16
  Speaker Allocation Data Block:
    FL/FR - Front Left/Right
  Vendor-Specific Data Block (HDMI), OUI 00-0C-03:
    Source physical address: 1.0.0.0
    DC_36bit
    DC_30bit
    DC_Y444
    Maximum TMDS clock: 305 MHz
  Colorimetry Data Block:
    xvYCC601
    xvYCC709
    Gamut Boundary Description Metadata Profile P0
  Detailed Timing Descriptors:
    DTD  4:  1920x1080   60.000000 Hz  16:9     67.500 kHz    148.500000 MHz (197 mm x 147 mm)
                  Hfront   88 Hsync  44 Hback  148 Hpol P
                  Vfront    2 Vsync   5 Vback   38 Vpol P
    DTD  5:  1920x540    60.053381 Hz  32:9     33.750 kHz     74.250000 MHz (197 mm x 147 mm)
                  Hfront   88 Hsync  44 Hback  148 Hpol P
                  Vfront    2 Vsync   5 Vback   15 Vpol P
    DTD  6:  1280x720    60.000000 Hz  16:9     45.000 kHz     74.250000 MHz (197 mm x 147 mm)
                  Hfront  110 Hsync  40 Hback  220 Hpol P
                  Vfront    5 Vsync   5 Vback   20 Vpol P
    DTD  7:   720x480    59.940060 Hz   3:2     31.469 kHz     27.000000 MHz (197 mm x 147 mm)
                  Hfront   16 Hsync  62 Hback   60 Hpol N
                  Vfront    9 Vsync   6 Vback   30 Vpol N
Checksum: 0xa2  Unused space in Extension Block: 15 bytes

----------------

Block 2, Unknown EDID Extension Block 0x00:
  00 ff ff ff ff ff ff 00 63 18 70 09 00 00 00 00 '........c.p.....'
  14 1d 01 03 80 34 1f 78 ee 44 55 a9 55 4d 9d 26 '.....4.x.DU.UM.&'
  0f 50 54 ad cf 00 b3 00 d1 c0 a9 c0 95 00 71 40 '.PT...........q@'
  81 00 81 c0 81 40 1c 57 00 e0 80 00 64 60 30 20 '.....@.W....d`0 '
  34 00 c5 93 00 00 00 1a 7f 21 56 aa 51 00 1e 30 '4........!V.Q..0'
  46 8f 33 00 c5 93 00 00 00 1a 66 21 50 b0 51 00 'F.3.......f!P.Q.'
  1b 30 40 70 36 00 c5 93 00 00 00 1a 00 00 00 fc '.0@p6...........'
  00 48 44 4d 49 0a 20 20 20 20 20 20 20 20 01 6e '.HDMI.        .n'
Checksum: 0x6e

----------------

Block 3, CTA-861 Extension Block:
  Revision: 3
  Underscans IT Video Formats by default
  Basic audio support
  Supports YCbCr 4:4:4
  Supports YCbCr 4:2:2
  Native detailed modes: 1
  Video Data Block:
    VIC  16:  1920x1080   60.000000 Hz  16:9     67.500 kHz    148.500000 MHz
    VIC   5:  1920x1080i  60.000000 Hz  16:9     33.750 kHz     74.250000 MHz
    VIC   4:  1280x720    60.000000 Hz  16:9     45.000 kHz     74.250000 MHz
    VIC   3:   720x480    59.940060 Hz  16:9     31.469 kHz     27.000000 MHz
    VIC   2:   720x480    59.940060 Hz   4:3     31.469 kHz     27.000000 MHz
    VIC   7:  1440x480i   59.940060 Hz  16:9     15.734 kHz     27.000000 MHz
    VIC  22:  1440x576i   50.000000 Hz  16:9     15.625 kHz     27.000000 MHz
    VIC   1:   640x480    59.940476 Hz   4:3     31.469 kHz     25.175000 MHz
    VIC  20:  1920x1080i  50.000000 Hz  16:9     28.125 kHz     74.250000 MHz
    VIC  31:  1920x1080   50.000000 Hz  16:9     56.250 kHz    148.500000 MHz
    VIC  18:   720x576    50.000000 Hz  16:9     31.250 kHz     27.000000 MHz
    VIC  19:  1280x720    50.000000 Hz  16:9     37.500 kHz     74.250000 MHz
    VIC   3:   720x480    59.940060 Hz  16:9     31.469 kHz     27.000000 MHz
    VIC  33:  1920x1080   25.000000 Hz  16:9     28.125 kHz     74.250000 MHz
    VIC  34:  1920x1080   30.000000 Hz  16:9     33.750 kHz     74.250000 MHz
  Audio Data Block:
    Linear PCM:
      Max channels: 2
      Supported sample rates (kHz): 48 44.1 32
      Supported sample sizes (bits): 24 20 16
  Speaker Allocation Data Block:
    FL/FR - Front Left/Right
  Vendor-Specific Data Block (HDMI), OUI 00-0C-03:
    Source physical address: 1.0.0.0
    DC_36bit
    DC_30bit
    DC_Y444
    Maximum TMDS clock: 305 MHz
  Colorimetry Data Block:
    xvYCC601
    xvYCC709
    Gamut Boundary Description Metadata Profile P0
  Detailed Timing Descriptors:
    DTD  8:  1920x1080   60.000000 Hz  16:9     67.500 kHz    148.500000 MHz (197 mm x 147 mm)
                  Hfront   88 Hsync  44 Hback  148 Hpol P
                  Vfront    2 Vsync   5 Vback   38 Vpol P
    DTD  9:  1920x540    60.053381 Hz  32:9     33.750 kHz     74.250000 MHz (197 mm x 147 mm)
                  Hfront   88 Hsync  44 Hback  148 Hpol P
                  Vfront    2 Vsync   5 Vback   15 Vpol P
    DTD 10:  1280x720    60.000000 Hz  16:9     45.000 kHz     74.250000 MHz (197 mm x 147 mm)
                  Hfront  110 Hsync  40 Hback  220 Hpol P
                  Vfront    5 Vsync   5 Vback   20 Vpol P
    DTD 11:   720x480    59.940060 Hz   3:2     31.469 kHz     27.000000 MHz (197 mm x 147 mm)
                  Hfront   16 Hsync  62 Hback   60 Hpol N
                  Vfront    9 Vsync   6 Vback   30 Vpol N
Checksum: 0xa2  Unused space in Extension Block: 15 bytes

----------------

Warnings:

Block 0, Base EDID:
  Detailed Timing Descriptor #3: DTD is similar but not identical to DMT 0x27.
Block 1, CTA-861 Extension Block:
  Detailed Timing Descriptor #4: DTD is similar but not identical to VIC 16.
Block 3, CTA-861 Extension Block:
  Detailed Timing Descriptor #8: DTD is similar but not identical to VIC 16.

Failures:

Block 0, Base EDID:
  Basic Display Parameters & Features: sRGB is signaled, but the chromaticities do not match.
  Detailed Timing Descriptor #1: Mismatch of image size 197x147 mm vs display size 520x310 mm.
  Detailed Timing Descriptor #2: Mismatch of image size 197x147 mm vs display size 520x310 mm.
  Detailed Timing Descriptor #3: Mismatch of image size 197x147 mm vs display size 520x310 mm.
  Missing Display Range Limits Descriptor.
Block 1, CTA-861 Extension Block:
  Video Data Block: Duplicate VIC 3.
  Detailed Timing Descriptor #4: Mismatch of image size 197x147 mm vs display size 520x310 mm.
  Detailed Timing Descriptor #5: Mismatch of image size 197x147 mm vs display size 520x310 mm.
  Detailed Timing Descriptor #6: Mismatch of image size 197x147 mm vs display size 520x310 mm.
  Detailed Timing Descriptor #7: Mismatch of image size 197x147 mm vs display size 520x310 mm.
  Missing VCDB, needed for Set Selectable RGB Quantization to avoid interop issues.
Block 2, Base EDID:
  Unknown Extension Block.
Block 3, CTA-861 Extension Block:
  Video Data Block: Duplicate VIC 16.
  Video Data Block: Duplicate VIC 5.
  Video Data Block: Duplicate VIC 4.
  Video Data Block: Duplicate VIC 2.
  Video Data Block: Duplicate VIC 7.
  Video Data Block: Duplicate VIC 22.
  Video Data Block: Duplicate VIC 1.
  Video Data Block: Duplicate VIC 20.
  Video Data Block: Duplicate VIC 31.
  Video Data Block: Duplicate VIC 18.
  Video Data Block: Duplicate VIC 19.
  Video Data Block: Duplicate VIC 33.
  Video Data Block: Duplicate VIC 34.
  Speaker Allocation Data Block: Only one instance of this Data Block is allowed.
  Colorimetry Data Block: Only one instance of this Data Block is allowed.
  Detailed Timing Descriptor #8: Mismatch of image size 197x147 mm vs display size 520x310 mm.
  Detailed Timing Descriptor #9: Mismatch of image size 197x147 mm vs display size 520x310 mm.
  Detailed Timing Descriptor #10: Mismatch of image size 197x147 mm vs display size 520x310 mm.
  Detailed Timing Descriptor #11: Mismatch of image size 197x147 mm vs display size 520x310 mm.
  Missing VCDB, needed for Set Selectable RGB Quantization to avoid interop issues.
EDID:
  Base EDID: EDID specified 1 extension block(s), but found 3 extension block(s).
  Base EDID: EDID 1.3 requires a Block Map Extension in Block 1 if there are more than 2 blocks in the EDID.

EDID conformity: FAIL
