edid-decode (hex):

00 ff ff ff ff ff ff 00 0d af 00 15 00 00 00 00
02 0d 01 03 80 21 15 78 0a ca a5 95 5b 4c 95 27
22 50 54 00 00 00 01 01 01 01 01 01 01 01 01 01
01 01 01 01 01 01 bc 1b 00 a0 50 20 17 30 30 20
26 00 4b cf 10 00 00 1c 00 00 00 fd 00 3b 3d 30
32 08 00 0a 20 20 20 20 20 20 00 00 00 fe 00 4e
31 35 34 49 31 0a 20 20 20 20 20 20 00 00 00 fc
00 43 6f 6c 6f 72 20 4c 43 44 0a 20 20 20 00 98

----------------

Block 0, Base EDID:
  EDID Structure Version & Revision: 1.3
  Vendor & Product Identification:
    Manufacturer: CMO
    Model: 5376
    Made in: week 2 of 2003
  Basic Display Parameters & Features:
    Digital display
    Maximum image size: 33 cm x 21 cm
    Gamma: 2.20
    RGB color display
    First detailed timing is the preferred timing
  Color Characteristics:
    Red  : 0.5849, 0.3554
    Green: 0.2988, 0.5839
    Blue : 0.1542, 0.1347
    White: 0.3134, 0.3291
  Established Timings I & II: none
  Standard Timings: none
  Detailed Timing Descriptors:
    DTD 1:  1280x800    59.909545 Hz  16:10    49.306 kHz     71.000000 MHz (331 mm x 207 mm)
                 Hfront   48 Hsync  32 Hback   80 Hpol N
                 Vfront    2 Vsync   6 Vback   15 Vpol P
    Display Range Limits:
      Monitor ranges (GTF): 59-61 Hz V, 48-50 kHz H, max dotclock 80 MHz
    Alphanumeric Data String: 'N154I1'
    Display Product Name: 'Color LCD'
Checksum: 0x98

----------------

Warnings:

Block 0, Base EDID:
  Detailed Timing Descriptor #1: DTD is similar but not identical to DMT 0x1b.

EDID conformity: PASS
