
EDID (hex):
00ffffffffffff004d10000000000000
07170103084527000ac69c964e428d22
1041443fef00d100d1c0811990590101
010101010101662150b051001b304070
360050005300001e302a009851002a40
3070130000005400001e0e1f00805100
1e304080370000005300001c000000fc
005348415250204c43440a20202000fd

Extracted contents:
header:          00 ff ff ff ff ff ff 00
serial number:   4d 10 00 00 00 00 00 00 07 17
version:         01 03
basic params:    08 45 27 00 0a
chroma info:     c6 9c 96 4e 42 8d 22 10 41 44
established:     3f ef 00
standard:        d1 00 d1 c0 81 19 90 59 01 01 01 01 01 01 01 01
descriptor 1:    66 21 50 b0 51 00 1b 30 40 70 36 00 50 00 53 00 00 1e
descriptor 2:    30 2a 00 98 51 00 2a 40 30 70 13 00 00 00 54 00 00 1e
descriptor 3:    0e 1f 00 80 51 00 1e 30 40 80 37 00 00 00 53 00 00 1c
descriptor 4:    00 00 00 fc 00 53 48 41 52 50 20 4c 43 44 0a 20 20 20
extensions:      00
checksum:        fd

EDID version: 1.3
Manufacturer: SHP Model 0 Serial Number --
Made in week 7 of 2013
Analog display, Input voltage level: 0.7/0.3 V
Sync: Separate 
Maximum image size: 69 cm x 39 cm
Gamma: 1.00
RGB color display
First detailed timing is preferred timing
Display x,y Chromaticity:
  Red:   0.5888, 0.3046
  Green: 0.2587, 0.5527
  Blue:  0.1347, 0.0634
  White: 0.2568, 0.2656
Established timings supported:
  640x480@60Hz 4:3 HorFreq: 31469 Hz Clock: 25.175 MHz
  640x480@67Hz 4:3 HorFreq: 35000 Hz Clock: 30.240 MHz
  640x480@72Hz 4:3 HorFreq: 37900 Hz Clock: 31.500 MHz
  640x480@75Hz 4:3 HorFreq: 37500 Hz Clock: 31.500 MHz
  800x600@56Hz 4:3 HorFreq: 35200 Hz Clock: 36.000 MHz
  800x600@60Hz 4:3 HorFreq: 37900 Hz Clock: 40.000 MHz
  800x600@72Hz 4:3 HorFreq: 48100 Hz Clock: 50.000 MHz
  800x600@75Hz 4:3 HorFreq: 46900 Hz Clock: 49.500 MHz
  832x624@75Hz 4:3 HorFreq: 49726 Hz Clock: 57.284 MHz
  1024x768@60Hz 4:3 HorFreq: 48400 Hz Clock: 65.000 MHz
  1024x768@70Hz 4:3 HorFreq: 56500 Hz Clock: 75.000 MHz
  1024x768@75Hz 4:3 HorFreq: 60000 Hz Clock: 78.750 MHz
  1280x1024@75Hz 5:4 HorFreq: 80000 Hz Clock: 135.000 MHz
Standard timings supported:
  1920x1200@60Hz 16:10 HorFreq: 74000 Hz Clock: 154.000 MHz
  1920x1080@60Hz 16:9
  1280x800@85Hz 16:10
  1400x1050@85Hz 4:3 HorFreq: 93900 Hz Clock: 179.500 MHz
Detailed mode: Clock 85.500 MHz, 1360 mm x 768 mm
               1360 1424 1536 1792 hborder 0
                768  771  777  795 vborder 0
               +hsync +vsync 
               VertFreq: 60 Hz, HorFreq: 47712 Hz
Detailed mode: Clock 108.000 MHz, 1280 mm x 1024 mm
               1280 1328 1440 1688 hborder 0
               1024 1025 1028 1066 vborder 0
               +hsync +vsync 
               VertFreq: 60 Hz, HorFreq: 63981 Hz
Detailed mode: Clock 79.500 MHz, 1280 mm x 768 mm
               1280 1344 1472 1664 hborder 0
                768  771  778  798 vborder 0
               -hsync +vsync 
               VertFreq: 59 Hz, HorFreq: 47776 Hz
Monitor name: SHARP LCD
Checksum: 0xfd (valid)
EDID block does NOT conform to EDID 1.3!
	Missing monitor ranges
