
EDID (hex):
00ffffffffffff0022641100f9040000
151101030a251778ea9bb6a4534b9d24
144f54bfef80818081c08140714f6146
904f950f01019a29a0d0518422305098
360098ff1000001e000000fd00374b1e
530e0101010101010101000000ff0037
32314459334e413031323733000000fc
0048616e6e732e47204857313733007d

Extracted contents:
header:          00 ff ff ff ff ff ff 00
serial number:   22 64 11 00 f9 04 00 00 15 11
version:         01 03
basic params:    0a 25 17 78 ea
chroma info:     9b b6 a4 53 4b 9d 24 14 4f 54
established:     bf ef 80
standard:        81 80 81 c0 81 40 71 4f 61 46 90 4f 95 0f 01 01
descriptor 1:    9a 29 a0 d0 51 84 22 30 50 98 36 00 98 ff 10 00 00 1e
descriptor 2:    00 00 00 fd 00 37 4b 1e 53 0e 01 01 01 01 01 01 01 01
descriptor 3:    00 00 00 ff 00 37 32 31 44 59 33 4e 41 30 31 32 37 33
descriptor 4:    00 00 00 fc 00 48 61 6e 6e 73 2e 47 20 48 57 31 37 33
extensions:      00
checksum:        7d

EDID version: 1.3
Manufacturer: HSD Model 11 Serial Number --
Made in week 21 of 2007
Analog display, Input voltage level: 0.7/0.3 V
Sync: Separate SyncOnGreen 
Maximum image size: 37 cm x 23 cm
Gamma: 2.20
DPMS levels: Standby Suspend Off
RGB color display
First detailed timing is preferred timing
Display x,y Chromaticity:
  Red:   0.6425, 0.3251
  Green: 0.2949, 0.6162
  Blue:  0.1425, 0.0810
  White: 0.3095, 0.3300
Established timings supported:
  720x400@70Hz 9:5 HorFreq: 31469 Hz Clock: 28.320 MHz
  640x480@60Hz 4:3 HorFreq: 31469 Hz Clock: 25.175 MHz
  640x480@67Hz 4:3 HorFreq: 35000 Hz Clock: 30.240 MHz
  640x480@72Hz 4:3 HorFreq: 37900 Hz Clock: 31.500 MHz
  640x480@75Hz 4:3 HorFreq: 37500 Hz Clock: 31.500 MHz
  800x600@56Hz 4:3 HorFreq: 35200 Hz Clock: 36.000 MHz
  800x600@60Hz 4:3 HorFreq: 37900 Hz Clock: 40.000 MHz
  800x600@72Hz 4:3 HorFreq: 48100 Hz Clock: 50.000 MHz
  800x600@75Hz 4:3 HorFreq: 46900 Hz Clock: 49.500 MHz
  832x624@75Hz 4:3 HorFreq: 49726 Hz Clock: 57.284 MHz
  1024x768@60Hz 4:3 HorFreq: 48400 Hz Clock: 65.000 MHz
  1024x768@70Hz 4:3 HorFreq: 56500 Hz Clock: 75.000 MHz
  1024x768@75Hz 4:3 HorFreq: 60000 Hz Clock: 78.750 MHz
  1280x1024@75Hz 5:4 HorFreq: 80000 Hz Clock: 135.000 MHz
  1152x870@75Hz 192:145 HorFreq: 67500 Hz Clock: 108.000 MHz
Standard timings supported:
  1280x1024@60Hz 5:4 HorFreq: 64000 Hz Clock: 108.000 MHz
  1280x720@60Hz 16:9
  1280x960@60Hz 4:3 HorFreq: 60000 Hz Clock: 108.000 MHz
  1152x864@75Hz 4:3 HorFreq: 67500 Hz Clock: 108.000 MHz
  1024x768@66Hz 4:3
  1400x1050@75Hz 4:3 HorFreq: 82300 Hz Clock: 156.000 MHz
  1440x900@75Hz 16:10 HorFreq: 82300 Hz Clock: 156.000 MHz
Detailed mode: Clock 106.500 MHz, 408 mm x 255 mm
               1440 1520 1672 1904 hborder 0
                900  903  909  934 vborder 0
               +hsync +vsync 
               VertFreq: 59 Hz, HorFreq: 55934 Hz
Monitor ranges (bare limits): 55-75Hz V, 30-83kHz H, max dotclock 140MHz
Serial number: --
Checksum: 0x7d (valid)
EDID block does NOT conform to EDID 1.3!
	Name descriptor not terminated with a newline
EDID block does not conform at all!
	Detailed blocks filled with garbage
	Range descriptor contains garbage
