edid-decode (hex):

00 ff ff ff ff ff ff 00 22 f0 20 28 01 01 01 01
06 13 01 03 68 29 17 78 ee b7 b5 a6 55 48 9d 25
15 50 54 ad ee 00 81 c0 01 01 01 01 01 01 01 01
01 01 01 01 01 01 66 21 56 a8 51 00 1e 30 45 8f
3a 00 9a e6 10 00 00 1c 00 00 00 fd 00 32 4c 1e
40 09 00 0a 20 20 20 20 20 20 00 00 00 fc 00 48
50 20 76 31 38 35 77 0a 20 20 20 20 00 00 00 ff
00 43 4e 54 39 30 36 57 33 48 4a 0a 20 20 00 2d

00 ff ff ff ff ff ff 00 22 f0 20 28 01 01 01 01
06 13 01 03 68 29 17 78 ee b7 b5 a6 55 48 9d 25
15 50 54 ad ee 00 81 c0 01 01 01 01 01 01 01 01
01 01 01 01 01 01 66 21 56 a8 51 00 1e 30 45 8f
3a 00 9a e6 10 00 00 1c 00 00 00 fd 00 32 4c 1e
40 09 00 0a 20 20 20 20 20 20 00 00 00 fc 00 48
50 20 76 31 38 35 77 0a 20 20 20 20 00 00 00 ff
00 43 4e 54 39 30 36 57 33 48 4a 0a 20 20 00 2d

----------------

Block 0, Base EDID:
  EDID Structure Version & Revision: 1.3
  Vendor & Product Identification:
    Manufacturer: HWP
    Model: 10272
    Serial Number: ...
    Made in: week 6 of 2009
  Basic Display Parameters & Features:
    Analog display
    Signal Level Standard: 0.700 : 0.000 : 0.700 V p-p
    Blank level equals black level
    Sync: Separate
    Maximum image size: 41 cm x 23 cm
    Gamma: 2.20
    DPMS levels: Standby Suspend Off
    RGB color display
    Default (sRGB) color space is primary color space
    First detailed timing is the preferred timing
  Color Characteristics:
    Red  : 0.6503, 0.3349
    Green: 0.2822, 0.6162
    Blue : 0.1464, 0.0849
    White: 0.3134, 0.3291
  Established Timings I & II:
    IBM     :   720x400    70.081663 Hz   9:5     31.467 kHz     28.320000 MHz
    DMT 0x04:   640x480    59.940476 Hz   4:3     31.469 kHz     25.175000 MHz
    DMT 0x05:   640x480    72.808802 Hz   4:3     37.861 kHz     31.500000 MHz
    DMT 0x06:   640x480    75.000000 Hz   4:3     37.500 kHz     31.500000 MHz
    DMT 0x09:   800x600    60.316541 Hz   4:3     37.879 kHz     40.000000 MHz
    DMT 0x0a:   800x600    72.187572 Hz   4:3     48.077 kHz     50.000000 MHz
    DMT 0x0b:   800x600    75.000000 Hz   4:3     46.875 kHz     49.500000 MHz
    Apple   :   832x624    74.551266 Hz   4:3     49.726 kHz     57.284000 MHz
    DMT 0x10:  1024x768    60.003840 Hz   4:3     48.363 kHz     65.000000 MHz
    DMT 0x11:  1024x768    70.069359 Hz   4:3     56.476 kHz     75.000000 MHz
    DMT 0x12:  1024x768    75.028582 Hz   4:3     60.023 kHz     78.750000 MHz
  Standard Timings:
    DMT 0x55:  1280x720    60.000000 Hz  16:9     45.000 kHz     74.250000 MHz
  Detailed Timing Descriptors:
    DTD 1:  1366x768    59.856345 Hz 683:384   47.765 kHz     85.500000 MHz (410 mm x 230 mm)
                 Hfront   69 Hsync 143 Hback  212 Hpol N
                 Vfront    3 Vsync  10 Vback   17 Vpol P
    Display Range Limits:
      Monitor ranges (GTF): 50-76 Hz V, 30-64 kHz H, max dotclock 90 MHz
    Display Product Name: 'HP v185w'
    Display Product Serial Number: ...
Checksum: 0x2d

----------------

Block 1, Unknown EDID Extension Block 0x00:
  00 ff ff ff ff ff ff 00 22 f0 20 28 01 01 01 01 '........". (....'
  06 13 01 03 68 29 17 78 ee b7 b5 a6 55 48 9d 25 '....h).x....UH.%'
  15 50 54 ad ee 00 81 c0 01 01 01 01 01 01 01 01 '.PT.............'
  01 01 01 01 01 01 66 21 56 a8 51 00 1e 30 45 8f '......f!V.Q..0E.'
  3a 00 9a e6 10 00 00 1c 00 00 00 fd 00 32 4c 1e ':............2L.'
  40 09 00 0a 20 20 20 20 20 20 00 00 00 fc 00 48 '@...      .....H'
  50 20 76 31 38 35 77 0a 20 20 20 20 00 00 00 ff 'P v185w.    ....'
  00 43 4e 54 39 30 36 57 33 48 4a 0a 20 20 00 2d '.CNT906W3HJ.  .-'
Checksum: 0x2d

----------------

Failures:

Block 0, Base EDID:
  Basic Display Parameters & Features: sRGB is signaled, but the chromaticities do not match.
Block 1, Base EDID:
  Unknown Extension Block.
EDID:
  Base EDID: EDID specified 0 extension block(s), but found 1 extension block(s).

EDID conformity: FAIL
