edid-decode (hex):

00 ff ff ff ff ff ff 00 09 e5 95 07 00 00 00 00
01 1b 01 04 95 22 13 78 02 24 10 97 59 54 8e 27
1e 50 54 00 00 00 01 01 01 01 01 01 01 01 01 01
01 01 01 01 01 01 20 37 80 b4 70 38 28 40 30 20
36 00 58 c1 10 00 00 1a c0 24 80 b4 70 38 28 40
64 64 44 05 58 c1 10 00 00 1a 00 00 00 00 00 00
00 00 00 00 00 00 00 00 00 00 00 00 00 00 00 02
00 0c 47 f9 0a 3c 6e 16 12 22 70 00 00 00 00 7c

----------------

Block 0, Base EDID:
  EDID Structure Version & Revision: 1.4
  Vendor & Product Identification:
    Manufacturer: BOE
    Model: 1941
    Made in: week 1 of 2017
  Basic Display Parameters & Features:
    Digital display
    Bits per primary color channel: 6
    DisplayPort interface
    Maximum image size: 34 cm x 19 cm
    Gamma: 2.20
    Supported color formats: RGB 4:4:4
    First detailed timing includes the native pixel format and preferred refresh rate
  Color Characteristics:
    Red  : 0.5898, 0.3496
    Green: 0.3291, 0.5546
    Blue : 0.1523, 0.1181
    White: 0.3125, 0.3281
  Established Timings I & II: none
  Standard Timings: none
  Detailed Timing Descriptors:
    DTD 1:  1920x1080   60.000 Hz  16:9    67.200 kHz 141.120 MHz (344 mm x 193 mm)
                 Hfront   48 Hsync  32 Hback 100 Hpol P
                 Vfront    3 Vsync   6 Vback  31 Vpol N
    DTD 2:  1920x1080   40.000 Hz  16:9    44.800 kHz  94.080 MHz (344 mm x 193 mm)
                 Hfront  100 Hsync 100 Hback -20 Hpol P
                 Vfront   20 Vsync  20 Vback   0 Vpol N
    Empty Descriptor
    Manufacturer-Specified Display Descriptor (0x02): 00 02 00 0c 47 f9 0a 3c 6e 16 12 22 70 00 00 00 '....G..<n.."p...'
Checksum: 0x7c
