
EDID (hex):
00ffffffffffff0015d6811981000000
0716010368281b782ac905a3574b9c25
125054bfef0095008140814f81c07141
0101010101019a29a0d0518422305098
360098ff1000001c000000ff00454539
32303747303133373620000000fd0038
4b1e510e000a202020202020000000fc
004c454420483938314c0a20202000e5

Extracted contents:
header:          00 ff ff ff ff ff ff 00
serial number:   15 d6 81 19 81 00 00 00 07 16
version:         01 03
basic params:    68 28 1b 78 2a
chroma info:     c9 05 a3 57 4b 9c 25 12 50 54
established:     bf ef 00
standard:        95 00 81 40 81 4f 81 c0 71 41 01 01 01 01 01 01
descriptor 1:    9a 29 a0 d0 51 84 22 30 50 98 36 00 98 ff 10 00 00 1c
descriptor 2:    00 00 00 ff 00 45 45 39 32 30 37 47 30 31 33 37 36 20
descriptor 3:    00 00 00 fd 00 38 4b 1e 51 0e 00 0a 20 20 20 20 20 20
descriptor 4:    00 00 00 fc 00 4c 45 44 20 48 39 38 31 4c 0a 20 20 20
extensions:      00
checksum:        e5

EDID version: 1.3
Manufacturer: ENV Model 1981 Serial Number --
Made in week 7 of 2012
Analog display, Input voltage level: 0.7/0.7 V
Sync: Separate 
Maximum image size: 40 cm x 27 cm
Gamma: 2.20
DPMS levels: Off
RGB color display
First detailed timing is preferred timing
Display x,y Chromaticity:
  Red:   0.6396, 0.3398
  Green: 0.2949, 0.6103
  Blue:  0.1445, 0.0703
  White: 0.3134, 0.3291
Established timings supported:
  720x400@70Hz 9:5 HorFreq: 31469 Hz Clock: 28.320 MHz
  640x480@60Hz 4:3 HorFreq: 31469 Hz Clock: 25.175 MHz
  640x480@67Hz 4:3 HorFreq: 35000 Hz Clock: 30.240 MHz
  640x480@72Hz 4:3 HorFreq: 37900 Hz Clock: 31.500 MHz
  640x480@75Hz 4:3 HorFreq: 37500 Hz Clock: 31.500 MHz
  800x600@56Hz 4:3 HorFreq: 35200 Hz Clock: 36.000 MHz
  800x600@60Hz 4:3 HorFreq: 37900 Hz Clock: 40.000 MHz
  800x600@72Hz 4:3 HorFreq: 48100 Hz Clock: 50.000 MHz
  800x600@75Hz 4:3 HorFreq: 46900 Hz Clock: 49.500 MHz
  832x624@75Hz 4:3 HorFreq: 49726 Hz Clock: 57.284 MHz
  1024x768@60Hz 4:3 HorFreq: 48400 Hz Clock: 65.000 MHz
  1024x768@70Hz 4:3 HorFreq: 56500 Hz Clock: 75.000 MHz
  1024x768@75Hz 4:3 HorFreq: 60000 Hz Clock: 78.750 MHz
  1280x1024@75Hz 5:4 HorFreq: 80000 Hz Clock: 135.000 MHz
Standard timings supported:
  1440x900@60Hz 16:10 HorFreq: 55500 Hz Clock: 88.750 MHz
  1280x960@60Hz 4:3 HorFreq: 60000 Hz Clock: 108.000 MHz
  1280x960@75Hz 4:3
  1280x720@60Hz 16:9
  1152x864@61Hz 4:3
Detailed mode: Clock 106.500 MHz, 408 mm x 255 mm
               1440 1520 1672 1904 hborder 0
                900  903  909  934 vborder 0
               -hsync +vsync 
               VertFreq: 59 Hz, HorFreq: 55934 Hz
Serial number: -- 
Monitor ranges (GTF): 56-75Hz V, 30-81kHz H, max dotclock 140MHz
Monitor name: LED H981L
Checksum: 0xe5 (valid)
