
EDID (hex):
00ffffffffffff0006b3872700000000
021f0103803c2278ea84b5a854529e26
0d5054b7ef00714f8180814081c08100
9500b300d1c0866f80a0703840403020
350056502100001a000000fd0030901e
a021000a202020202020000000ff004d
314c4d44573030313034390a000000fc
005647323756510a2020202020200115
020104002a4480a07038274030203500
56502100001afe5b80a0703835403020
350056502100001afc7e808870381240
1820350056502100001a023a80187138
2d40582c450056502100001e00000000
00000000000000000000000000000000
00000000000000000000000000000000
00000000000000000000000000000098

Extracted contents:
header:          00 ff ff ff ff ff ff 00
serial number:   06 b3 87 27 00 00 00 00 02 1f
version:         01 03
basic params:    80 3c 22 78 ea
chroma info:     84 b5 a8 54 52 9e 26 0d 50 54
established:     b7 ef 00
standard:        71 4f 81 80 81 40 81 c0 81 00 95 00 b3 00 d1 c0
descriptor 1:    86 6f 80 a0 70 38 40 40 30 20 35 00 56 50 21 00 00 1a
descriptor 2:    00 00 00 fd 00 30 90 1e a0 21 00 0a 20 20 20 20 20 20
descriptor 3:    00 00 00 ff 00 4d 31 4c 4d 44 57 30 30 31 30 34 39 0a
descriptor 4:    00 00 00 fc 00 56 47 32 37 56 51 0a 20 20 20 20 20 20
extensions:      01
checksum:        15

EDID version: 1.3
Manufacturer: AUS Model 2787 Serial Number --
Made in week 2 of 2021
Digital display
Maximum image size: 60 cm x 34 cm
Gamma: 2.20
DPMS levels: Standby Suspend Off
RGB color display
First detailed timing is preferred timing
Display x,y Chromaticity:
  Red:   0.6582, 0.3281
  Green: 0.3212, 0.6171
  Blue:  0.1503, 0.0537
  White: 0.3134, 0.3291
Established timings supported:
  720x400@70Hz 9:5 HorFreq: 31469 Hz Clock: 28.320 MHz
  640x480@60Hz 4:3 HorFreq: 31469 Hz Clock: 25.175 MHz
  640x480@67Hz 4:3 HorFreq: 35000 Hz Clock: 30.240 MHz
  640x480@75Hz 4:3 HorFreq: 37500 Hz Clock: 31.500 MHz
  800x600@56Hz 4:3 HorFreq: 35200 Hz Clock: 36.000 MHz
  800x600@60Hz 4:3 HorFreq: 37900 Hz Clock: 40.000 MHz
  800x600@72Hz 4:3 HorFreq: 48100 Hz Clock: 50.000 MHz
  800x600@75Hz 4:3 HorFreq: 46900 Hz Clock: 49.500 MHz
  832x624@75Hz 4:3 HorFreq: 49726 Hz Clock: 57.284 MHz
  1024x768@60Hz 4:3 HorFreq: 48400 Hz Clock: 65.000 MHz
  1024x768@70Hz 4:3 HorFreq: 56500 Hz Clock: 75.000 MHz
  1024x768@75Hz 4:3 HorFreq: 60000 Hz Clock: 78.750 MHz
  1280x1024@75Hz 5:4 HorFreq: 80000 Hz Clock: 135.000 MHz
Standard timings supported:
  1152x864@75Hz 4:3 HorFreq: 67500 Hz Clock: 108.000 MHz
  1280x1024@60Hz 5:4 HorFreq: 64000 Hz Clock: 108.000 MHz
  1280x960@60Hz 4:3 HorFreq: 60000 Hz Clock: 108.000 MHz
  1280x720@60Hz 16:9
  1280x800@60Hz 16:10
  1440x900@60Hz 16:10 HorFreq: 55500 Hz Clock: 88.750 MHz
  1680x1050@60Hz 16:10 HorFreq: 64700 Hz Clock: 119.000 MHz
  1920x1080@60Hz 16:9
Detailed mode: Clock 285.500 MHz, 598 mm x 336 mm
               1920 1968 2000 2080 hborder 0
               1080 1083 1088 1144 vborder 0
               +hsync -vsync 
               VertFreq: 119 Hz, HorFreq: 137259 Hz
Monitor ranges (GTF): 48-144Hz V, 30-160kHz H, max dotclock 330MHz
Serial number: --
Monitor name: VG27VQ
Has 1 extension blocks
Checksum: 0x15 (valid)

CTA extension block
Extension version: 1
0 8-byte timing descriptors
Detailed mode: Clock 174.500 MHz, 598 mm x 336 mm
               1920 1968 2000 2080 hborder 0
               1080 1083 1088 1119 vborder 0
               +hsync -vsync 
               VertFreq: 74 Hz, HorFreq: 83894 Hz
Detailed mode: Clock 235.500 MHz, 598 mm x 336 mm
               1920 1968 2000 2080 hborder 0
               1080 1083 1088 1133 vborder 0
               +hsync -vsync 
               VertFreq: 99 Hz, HorFreq: 113221 Hz
Detailed mode: Clock 325.080 MHz, 598 mm x 336 mm
               1920 1944 1976 2056 hborder 0
               1080 1083 1088 1098 vborder 0
               +hsync -vsync 
               VertFreq: 144 Hz, HorFreq: 158112 Hz
Detailed mode: Clock 148.500 MHz, 598 mm x 336 mm
               1920 2008 2052 2200 hborder 0
               1080 1084 1089 1125 vborder 0
               +hsync +vsync 
               VertFreq: 60 Hz, HorFreq: 67500 Hz
Checksum: 0x98 (valid)
