edid-decode (hex):

00 ff ff ff ff ff ff 00 06 b3 cc 23 01 01 01 01
18 1f 01 03 6c 33 1d 78 ea d9 05 a5 57 51 9e 27
0f 50 54 bf ef 80 81 00 81 40 81 80 95 00 b3 00
8c c0 a9 40 d1 c0 02 3a 80 18 71 38 2d 40 58 2c
45 00 fd 1e 11 00 00 1e 00 00 00 fd 00 30 4c 1e
55 11 00 0a 20 20 20 20 20 20 00 00 00 fc 00 56
5a 32 33 39 0a 20 20 20 20 20 20 20 00 00 00 ff
00 4d 36 4c 4d 52 53 30 30 32 38 30 33 0a 00 f0

00 ff ff ff ff ff ff 00 06 b3 cc 23 01 01 01 01
18 1f 01 03 6c 33 1d 78 ea d9 05 a5 57 51 9e 27
0f 50 54 bf ef 80 81 00 81 40 81 80 95 00 b3 00
8c c0 a9 40 d1 c0 02 3a 80 18 71 38 2d 40 58 2c
45 00 fd 1e 11 00 00 1e 00 00 00 fd 00 30 4c 1e
55 11 00 0a 20 20 20 20 20 20 00 00 00 fc 00 56
5a 32 33 39 0a 20 20 20 20 20 20 20 00 00 00 ff
00 4d 36 4c 4d 52 53 30 30 32 38 30 33 0a 00 f0

----------------

Block 0, Base EDID:
  EDID Structure Version & Revision: 1.3
  Vendor & Product Identification:
    Manufacturer: AUS
    Model: 9164
    Serial Number: ...
    Made in: week 24 of 2021
  Basic Display Parameters & Features:
    Analog display
    Signal Level Standard: 0.700 : 0.000 : 0.700 V p-p
    Blank level equals black level
    Sync: Separate Composite
    Maximum image size: 51 cm x 29 cm
    Gamma: 2.20
    DPMS levels: Standby Suspend Off
    RGB color display
    First detailed timing is the preferred timing
  Color Characteristics:
    Red  : 0.6474, 0.3408
    Green: 0.3183, 0.6181
    Blue : 0.1523, 0.0585
    White: 0.3134, 0.3291
  Established Timings I & II:
    IBM     :   720x400    70.081663 Hz   9:5     31.467 kHz     28.320000 MHz
    DMT 0x04:   640x480    59.940476 Hz   4:3     31.469 kHz     25.175000 MHz
    Apple   :   640x480    66.666667 Hz   4:3     35.000 kHz     30.240000 MHz
    DMT 0x05:   640x480    72.808802 Hz   4:3     37.861 kHz     31.500000 MHz
    DMT 0x06:   640x480    75.000000 Hz   4:3     37.500 kHz     31.500000 MHz
    DMT 0x08:   800x600    56.250000 Hz   4:3     35.156 kHz     36.000000 MHz
    DMT 0x09:   800x600    60.316541 Hz   4:3     37.879 kHz     40.000000 MHz
    DMT 0x0a:   800x600    72.187572 Hz   4:3     48.077 kHz     50.000000 MHz
    DMT 0x0b:   800x600    75.000000 Hz   4:3     46.875 kHz     49.500000 MHz
    Apple   :   832x624    74.551266 Hz   4:3     49.726 kHz     57.284000 MHz
    DMT 0x10:  1024x768    60.003840 Hz   4:3     48.363 kHz     65.000000 MHz
    DMT 0x11:  1024x768    70.069359 Hz   4:3     56.476 kHz     75.000000 MHz
    DMT 0x12:  1024x768    75.028582 Hz   4:3     60.023 kHz     78.750000 MHz
    DMT 0x24:  1280x1024   75.024675 Hz   5:4     79.976 kHz    135.000000 MHz
    Apple   :  1152x870    75.061550 Hz 192:145   68.681 kHz    100.000000 MHz
  Standard Timings:
    DMT 0x1c:  1280x800    59.810326 Hz  16:10    49.702 kHz     83.500000 MHz
    DMT 0x20:  1280x960    60.000000 Hz   4:3     60.000 kHz    108.000000 MHz
    DMT 0x23:  1280x1024   60.019740 Hz   5:4     63.981 kHz    108.000000 MHz
    DMT 0x2f:  1440x900    59.887445 Hz  16:10    55.935 kHz    106.500000 MHz
    DMT 0x3a:  1680x1050   59.954250 Hz  16:10    65.290 kHz    146.250000 MHz
    GTF     :  1368x769    60.000000 Hz  16:9     47.760 kHz     85.968000 MHz
    DMT 0x33:  1600x1200   60.000000 Hz   4:3     75.000 kHz    162.000000 MHz
    DMT 0x52:  1920x1080   60.000000 Hz  16:9     67.500 kHz    148.500000 MHz
  Detailed Timing Descriptors:
    DTD 1:  1920x1080   60.000000 Hz  16:9     67.500 kHz    148.500000 MHz (509 mm x 286 mm)
                 Hfront   88 Hsync  44 Hback  148 Hpol P
                 Vfront    4 Vsync   5 Vback   36 Vpol P
    Display Range Limits:
      Monitor ranges (GTF): 48-76 Hz V, 30-85 kHz H, max dotclock 170 MHz
    Display Product Name: 'VZ239'
    Display Product Serial Number: ...
Checksum: 0xf0

----------------

Block 1, Unknown EDID Extension Block 0x00:
  00 ff ff ff ff ff ff 00 06 b3 cc 23 01 01 01 01 '...........#....'
  18 1f 01 03 6c 33 1d 78 ea d9 05 a5 57 51 9e 27 '....l3.x....WQ.''
  0f 50 54 bf ef 80 81 00 81 40 81 80 95 00 b3 00 '.PT......@......'
  8c c0 a9 40 d1 c0 02 3a 80 18 71 38 2d 40 58 2c '...@...:..q8-@X,'
  45 00 fd 1e 11 00 00 1e 00 00 00 fd 00 30 4c 1e 'E............0L.'
  55 11 00 0a 20 20 20 20 20 20 00 00 00 fc 00 56 'U...      .....V'
  5a 32 33 39 0a 20 20 20 20 20 20 20 00 00 00 ff 'Z239.       ....'
  00 4d 36 4c 4d 52 53 30 30 32 38 30 33 0a 00 f0 '.M6LMRS002803...'
Checksum: 0xf0

----------------

Warnings:

Block 0, Base EDID:
  Standard Timings: Standard Timing 1368x769 has a dubious odd vertical resolution.

Failures:

Block 1, Base EDID:
  Unknown Extension Block.
EDID:
  Base EDID: EDID specified 0 extension block(s), but found 1 extension block(s).

EDID conformity: FAIL
