
EDID (hex):
00ffffffffffff001683000000000000
1a160104a50f147806ef05a3544c9926
0f505400000001010101010101010101
010101010101204e005360000b80100f
710094c5000000180000001000000000
00000000000000000000000000fe004c
503039375158322d53504156000000fc
00436f6c6f72204c43440a20202000a8

Extracted contents:
header:          00 ff ff ff ff ff ff 00
serial number:   16 83 00 00 00 00 00 00 1a 16
version:         01 04
basic params:    a5 0f 14 78 06
chroma info:     ef 05 a3 54 4c 99 26 0f 50 54
established:     00 00 00
standard:        01 01 01 01 01 01 01 01 01 01 01 01 01 01 01 01
descriptor 1:    20 4e 00 53 60 00 0b 80 10 0f 71 00 94 c5 00 00 00 18
descriptor 2:    00 00 00 10 00 00 00 00 00 00 00 00 00 00 00 00 00 00
descriptor 3:    00 00 00 fe 00 4c 50 30 39 37 51 58 32 2d 53 50 41 56
descriptor 4:    00 00 00 fc 00 43 6f 6c 6f 72 20 4c 43 44 0a 20 20 20
extensions:      00
checksum:        a8

EDID version: 1.4
Manufacturer: ETC Model 0 Serial Number --
Made in week 26 of 2012
Digital display
8 bits per primary color channel
DisplayPort interface
Maximum image size: 15 cm x 20 cm
Gamma: 2.20
Supported color formats: RGB 4:4:4
Default (sRGB) color space is primary color space
First detailed timing includes the native pixel format and preferred refresh rate
Display x,y Chromaticity:
  Red:   0.6396, 0.3300
  Green: 0.2998, 0.6005
  Blue:  0.1484, 0.0585
  White: 0.3134, 0.3291
Established timings supported:
Standard timings supported:
Detailed mode: Clock 200.000 MHz, 148 mm x 197 mm
               1536 1552 1567 1619 hborder 0
               2048 2055 2056 2059 vborder 0
               -hsync -vsync 
               VertFreq: 59 Hz, HorFreq: 123533 Hz
Dummy block
ASCII string: LP097QX2-SPAV
Monitor name: Color LCD
Checksum: 0xa8 (valid)
EDID block does NOT conform to EDID 1.4!
	sRGB is signaled, but the chromaticities do not match
	Missing monitor ranges
