edid-decode (hex):

00 ff ff ff ff ff ff 00 15 c3 00 22 01 01 01 01
23 14 01 03 80 22 1c 78 ea ee 95 a3 54 4c 99 26
0f 50 54 a1 08 00 81 80 01 01 01 01 01 01 01 01
01 01 01 01 01 01 30 2a 00 98 51 00 2a 40 30 70
13 00 52 0f 11 00 00 1e 00 00 00 ff 00 32 33 34
35 33 30 38 30 0a 20 20 20 20 00 00 00 fd 00 3b
3d 1f 40 0b 00 0a 20 20 20 20 20 20 00 00 00 fc
00 53 31 37 32 31 2d 58 0a 20 20 20 20 20 00 b9

00 ff ff ff ff ff ff 00 15 c3 00 22 01 01 01 01
23 14 01 03 80 22 1c 78 ea ee 95 a3 54 4c 99 26
0f 50 54 a1 08 00 81 80 01 01 01 01 01 01 01 01
01 01 01 01 01 01 30 2a 00 98 51 00 2a 40 30 70
13 00 52 0f 11 00 00 1e 00 00 00 ff 00 32 33 34
35 33 30 38 30 0a 20 20 20 20 00 00 00 fd 00 3b
3d 1f 40 0b 00 0a 20 20 20 20 20 20 00 00 00 fc
00 53 31 37 32 31 2d 58 0a 20 20 20 20 20 00 b9

----------------

Block 0, Base EDID:
  EDID Structure Version & Revision: 1.3
  Vendor & Product Identification:
    Manufacturer: ENC
    Model: 8704
    Serial Number: ...
    Made in: week 35 of 2010
  Basic Display Parameters & Features:
    Digital display
    Maximum image size: 34 cm x 28 cm
    Gamma: 2.20
    DPMS levels: Standby Suspend Off
    RGB color display
    First detailed timing is the preferred timing
  Color Characteristics:
    Red  : 0.6396, 0.3300
    Green: 0.2998, 0.5996
    Blue : 0.1503, 0.0595
    White: 0.3134, 0.3291
  Established Timings I & II:
    IBM     :   720x400    70.081663 Hz   9:5     31.467 kHz     28.320000 MHz
    DMT 0x04:   640x480    59.940476 Hz   4:3     31.469 kHz     25.175000 MHz
    DMT 0x09:   800x600    60.316541 Hz   4:3     37.879 kHz     40.000000 MHz
    DMT 0x10:  1024x768    60.003840 Hz   4:3     48.363 kHz     65.000000 MHz
  Standard Timings:
    DMT 0x23:  1280x1024   60.019740 Hz   5:4     63.981 kHz    108.000000 MHz
  Detailed Timing Descriptors:
    DTD 1:  1280x1024   60.019740 Hz   5:4     63.981 kHz    108.000000 MHz (338 mm x 271 mm)
                 Hfront   48 Hsync 112 Hback  248 Hpol P
                 Vfront    1 Vsync   3 Vback   38 Vpol P
    Display Product Serial Number: ...
    Display Range Limits:
      Monitor ranges (GTF): 59-61 Hz V, 31-64 kHz H, max dotclock 110 MHz
    Display Product Name: 'S1721-X'
Checksum: 0xb9

----------------

Block 1, Unknown EDID Extension Block 0x00:
  00 ff ff ff ff ff ff 00 15 c3 00 22 01 01 01 01 '..........."....'
  23 14 01 03 80 22 1c 78 ea ee 95 a3 54 4c 99 26 '#....".x....TL.&'
  0f 50 54 a1 08 00 81 80 01 01 01 01 01 01 01 01 '.PT.............'
  01 01 01 01 01 01 30 2a 00 98 51 00 2a 40 30 70 '......0*..Q.*@0p'
  13 00 52 0f 11 00 00 1e 00 00 00 ff 00 32 33 34 '..R..........234'
  35 33 30 38 30 0a 20 20 20 20 00 00 00 fd 00 3b '53080.    .....;'
  3d 1f 40 0b 00 0a 20 20 20 20 20 20 00 00 00 fc '=.@...      ....'
  00 53 31 37 32 31 2d 58 0a 20 20 20 20 20 00 b9 '.S1721-X.     ..'
Checksum: 0xb9

----------------

Failures:

Block 1, Base EDID:
  Unknown Extension Block.
EDID:
  Base EDID: Some timings are out of range of the Monitor Ranges:
    Vertical Freq: 59.940 - 70.082 Hz (Monitor: 59.000 - 61.000 Hz)
  Base EDID: EDID specified 0 extension block(s), but found 1 extension block(s).

EDID conformity: FAIL
