edid-decode (hex):

00 ff ff ff ff ff ff 00 1c 54 04 24 00 00 00 00
09 23 01 03 80 36 1f 78 ee ee 91 a3 54 4c 99 26
0f 50 54 bf ef 80 71 4f 81 c0 81 00 81 40 81 80
95 00 a9 c0 b3 00 02 3a 80 18 71 38 2d 40 58 2c
45 00 1f 2e 21 00 00 18 00 00 00 fd 00 30 c8 1e
de 32 00 0a 20 20 20 20 20 20 00 00 00 fc 00 47
53 32 35 46 32 0a 20 20 20 20 20 20 00 00 00 ff
00 32 35 30 39 35 42 30 30 36 35 34 39 0a 01 be

02 03 41 f1 48 90 9f 03 04 0e 13 3f 40 23 09 07
07 83 01 00 00 e2 00 ca e3 05 e3 01 67 03 0c 00
10 00 38 44 67 d8 5d c4 01 78 80 00 6d 1a 00 00
02 01 30 c8 e0 00 73 22 59 2c e6 06 07 01 58 58
23 a4 9c 80 a0 70 38 59 40 30 20 35 00 1f 2e 21
00 00 18 56 a2 80 a0 70 38 1e 40 30 20 35 00 1f
2e 21 00 00 18 60 b4 80 a0 70 38 1e 40 30 20 35
00 1f 2e 21 00 00 18 00 00 00 00 00 00 00 00 bd

00 ff ff ff ff ff ff 00 1c 54 04 24 00 00 00 00
09 23 01 03 80 36 1f 78 ee ee 91 a3 54 4c 99 26
0f 50 54 bf ef 80 71 4f 81 c0 81 00 81 40 81 80
95 00 a9 c0 b3 00 02 3a 80 18 71 38 2d 40 58 2c
45 00 1f 2e 21 00 00 18 00 00 00 fd 00 30 c8 1e
de 32 00 0a 20 20 20 20 20 20 00 00 00 fc 00 47
53 32 35 46 32 0a 20 20 20 20 20 20 00 00 00 ff
00 32 35 30 39 35 42 30 30 36 35 34 39 0a 01 be

02 03 41 f1 48 90 9f 03 04 0e 13 3f 40 23 09 07
07 83 01 00 00 e2 00 ca e3 05 e3 01 67 03 0c 00
10 00 38 44 67 d8 5d c4 01 78 80 00 6d 1a 00 00
02 01 30 c8 e0 00 73 22 59 2c e6 06 07 01 58 58
23 a4 9c 80 a0 70 38 59 40 30 20 35 00 1f 2e 21
00 00 18 56 a2 80 a0 70 38 1e 40 30 20 35 00 1f
2e 21 00 00 18 60 b4 80 a0 70 38 1e 40 30 20 35
00 1f 2e 21 00 00 18 00 00 00 00 00 00 00 00 bd

----------------

Block 0, Base EDID:
  EDID Structure Version & Revision: 1.3
  Vendor & Product Identification:
    Manufacturer: GBT
    Model: 9220
    Made in: week 9 of 2025
  Basic Display Parameters & Features:
    Digital display
    Maximum image size: 54 cm x 31 cm
    Gamma: 2.20
    DPMS levels: Standby Suspend Off
    RGB color display
    Default (sRGB) color space is primary color space
    First detailed timing is the preferred timing
  Color Characteristics:
    Red  : 0.6396, 0.3300
    Green: 0.2998, 0.5996
    Blue : 0.1503, 0.0595
    White: 0.3125, 0.3291
  Established Timings I & II:
    IBM     :   720x400    70.081663 Hz   9:5     31.467 kHz     28.320000 MHz
    DMT 0x04:   640x480    59.940476 Hz   4:3     31.469 kHz     25.175000 MHz
    Apple   :   640x480    66.666667 Hz   4:3     35.000 kHz     30.240000 MHz
    DMT 0x05:   640x480    72.808802 Hz   4:3     37.861 kHz     31.500000 MHz
    DMT 0x06:   640x480    75.000000 Hz   4:3     37.500 kHz     31.500000 MHz
    DMT 0x08:   800x600    56.250000 Hz   4:3     35.156 kHz     36.000000 MHz
    DMT 0x09:   800x600    60.316541 Hz   4:3     37.879 kHz     40.000000 MHz
    DMT 0x0a:   800x600    72.187572 Hz   4:3     48.077 kHz     50.000000 MHz
    DMT 0x0b:   800x600    75.000000 Hz   4:3     46.875 kHz     49.500000 MHz
    Apple   :   832x624    74.551266 Hz   4:3     49.726 kHz     57.284000 MHz
    DMT 0x10:  1024x768    60.003840 Hz   4:3     48.363 kHz     65.000000 MHz
    DMT 0x11:  1024x768    70.069359 Hz   4:3     56.476 kHz     75.000000 MHz
    DMT 0x12:  1024x768    75.028582 Hz   4:3     60.023 kHz     78.750000 MHz
    DMT 0x24:  1280x1024   75.024675 Hz   5:4     79.976 kHz    135.000000 MHz
    Apple   :  1152x870    75.061550 Hz 192:145   68.681 kHz    100.000000 MHz
  Standard Timings:
    DMT 0x15:  1152x864    75.000000 Hz   4:3     67.500 kHz    108.000000 MHz
    DMT 0x55:  1280x720    60.000000 Hz  16:9     45.000 kHz     74.250000 MHz
    DMT 0x1c:  1280x800    59.810326 Hz  16:10    49.702 kHz     83.500000 MHz
    DMT 0x20:  1280x960    60.000000 Hz   4:3     60.000 kHz    108.000000 MHz
    DMT 0x23:  1280x1024   60.019740 Hz   5:4     63.981 kHz    108.000000 MHz
    DMT 0x2f:  1440x900    59.887445 Hz  16:10    55.935 kHz    106.500000 MHz
    DMT 0x53:  1600x900    60.000000 Hz  16:9     60.000 kHz    108.000000 MHz (RB)
    DMT 0x3a:  1680x1050   59.954250 Hz  16:10    65.290 kHz    146.250000 MHz
  Detailed Timing Descriptors:
    DTD 1:  1920x1080   60.000000 Hz  16:9     67.500 kHz    148.500000 MHz (543 mm x 302 mm)
                 Hfront   88 Hsync  44 Hback  148 Hpol N
                 Vfront    4 Vsync   5 Vback   36 Vpol N
    Display Range Limits:
      Monitor ranges (GTF): 48-200 Hz V, 30-222 kHz H, max dotclock 500 MHz
    Display Product Name: 'GS25F2'
    Display Product Serial Number: ...
  Extension blocks: 1
Checksum: 0xbe

----------------

Block 1, CTA-861 Extension Block:
  Revision: 3
  Underscans IT Video Formats by default
  Basic audio support
  Supports YCbCr 4:4:4
  Supports YCbCr 4:2:2
  Native detailed modes: 1
  Video Data Block:
    VIC  16:  1920x1080   60.000000 Hz  16:9     67.500 kHz    148.500000 MHz (native)
    VIC  31:  1920x1080   50.000000 Hz  16:9     56.250 kHz    148.500000 MHz (native)
    VIC   3:   720x480    59.940060 Hz  16:9     31.469 kHz     27.000000 MHz
    VIC   4:  1280x720    60.000000 Hz  16:9     45.000 kHz     74.250000 MHz
    VIC  14:  1440x480    59.940060 Hz   4:3     31.469 kHz     54.000000 MHz
    VIC  19:  1280x720    50.000000 Hz  16:9     37.500 kHz     74.250000 MHz
    VIC  63:  1920x1080  120.000000 Hz  16:9    135.000 kHz    297.000000 MHz
    VIC  64:  1920x1080  100.000000 Hz  16:9    112.500 kHz    297.000000 MHz
  Audio Data Block:
    Linear PCM:
      Max channels: 2
      Supported sample rates (kHz): 48 44.1 32
      Supported sample sizes (bits): 24 20 16
  Speaker Allocation Data Block:
    FL/FR - Front Left/Right
  Video Capability Data Block:
    YCbCr quantization: Selectable (via AVI YQ)
    RGB quantization: Selectable (via AVI Q)
    PT scan behavior: No Data
    IT scan behavior: Always Underscanned
    CE scan behavior: Always Underscanned
  Colorimetry Data Block:
    xvYCC601
    xvYCC709
    BT2020cYCC
    BT2020YCC
    BT2020RGB
    Gamut Boundary Description Metadata Profile P0
  Vendor-Specific Data Block (HDMI), OUI 00-0C-03:
    Source physical address: 1.0.0.0
    DC_36bit
    DC_30bit
    DC_Y444
    Maximum TMDS clock: 340 MHz
  Vendor-Specific Data Block (HDMI Forum), OUI C4-5D-D8:
    Version: 1
    Maximum TMDS Character Rate: 600 MHz
    SCDC Present
  Vendor-Specific Data Block (AMD), OUI 00-00-1A:
    Version: 2.1
    Minimum Refresh Rate: 48 Hz
    Maximum Refresh Rate: 200 Hz
    Flags 1.x: 0xe0 (MCCS)
    Flags 2.x: 0x00
    Maximum luminance: 115 (603.666 cd/m^2)
    Minimum luminance: 34 (0.107 cd/m^2)
    Unknown: 0x59 0x2c
  HDR Static Metadata Data Block:
    Electro optical transfer functions:
      Traditional gamma - SDR luminance range
      Traditional gamma - HDR luminance range
      SMPTE ST2084
    Supported static metadata descriptors:
      Static metadata type 1
    Desired content max luminance: 88 (336.359 cd/m^2)
    Desired content max frame-average luminance: 88 (336.359 cd/m^2)
    Desired content min luminance: 35 (0.063 cd/m^2)
  Detailed Timing Descriptors:
    DTD 2:  1920x1080  164.917418 Hz  16:9    192.788 kHz    401.000000 MHz (543 mm x 302 mm)
                 Hfront   48 Hsync  32 Hback   80 Hpol N
                 Vfront    3 Vsync   5 Vback   81 Vpol N
    DTD 3:  1920x1080  179.998267 Hz  16:9    199.798 kHz    415.580000 MHz (543 mm x 302 mm)
                 Hfront   48 Hsync  32 Hback   80 Hpol N
                 Vfront    3 Vsync   5 Vback   22 Vpol N
    DTD 4:  1920x1080  200.000000 Hz  16:9    222.000 kHz    461.760000 MHz (543 mm x 302 mm)
                 Hfront   48 Hsync  32 Hback   80 Hpol N
                 Vfront    3 Vsync   5 Vback   22 Vpol N
Checksum: 0xbd  Unused space in Extension Block: 8 bytes

----------------

Block 2, Unknown EDID Extension Block 0x00:
  00 ff ff ff ff ff ff 00 1c 54 04 24 00 00 00 00 '.........T.$....'
  09 23 01 03 80 36 1f 78 ee ee 91 a3 54 4c 99 26 '.#...6.x....TL.&'
  0f 50 54 bf ef 80 71 4f 81 c0 81 00 81 40 81 80 '.PT...qO.....@..'
  95 00 a9 c0 b3 00 02 3a 80 18 71 38 2d 40 58 2c '.......:..q8-@X,'
  45 00 1f 2e 21 00 00 18 00 00 00 fd 00 30 c8 1e 'E...!........0..'
  de 32 00 0a 20 20 20 20 20 20 00 00 00 fc 00 47 '.2..      .....G'
  53 32 35 46 32 0a 20 20 20 20 20 20 00 00 00 ff 'S25F2.      ....'
  00 32 35 30 39 35 42 30 30 36 35 34 39 0a 01 be '.25095B006549...'
Checksum: 0xbe

----------------

Block 3, CTA-861 Extension Block:
  Revision: 3
  Underscans IT Video Formats by default
  Basic audio support
  Supports YCbCr 4:4:4
  Supports YCbCr 4:2:2
  Native detailed modes: 1
  Video Data Block:
    VIC  16:  1920x1080   60.000000 Hz  16:9     67.500 kHz    148.500000 MHz (native)
    VIC  31:  1920x1080   50.000000 Hz  16:9     56.250 kHz    148.500000 MHz (native)
    VIC   3:   720x480    59.940060 Hz  16:9     31.469 kHz     27.000000 MHz
    VIC   4:  1280x720    60.000000 Hz  16:9     45.000 kHz     74.250000 MHz
    VIC  14:  1440x480    59.940060 Hz   4:3     31.469 kHz     54.000000 MHz
    VIC  19:  1280x720    50.000000 Hz  16:9     37.500 kHz     74.250000 MHz
    VIC  63:  1920x1080  120.000000 Hz  16:9    135.000 kHz    297.000000 MHz
    VIC  64:  1920x1080  100.000000 Hz  16:9    112.500 kHz    297.000000 MHz
  Audio Data Block:
    Linear PCM:
      Max channels: 2
      Supported sample rates (kHz): 48 44.1 32
      Supported sample sizes (bits): 24 20 16
  Speaker Allocation Data Block:
    FL/FR - Front Left/Right
  Video Capability Data Block:
    YCbCr quantization: Selectable (via AVI YQ)
    RGB quantization: Selectable (via AVI Q)
    PT scan behavior: No Data
    IT scan behavior: Always Underscanned
    CE scan behavior: Always Underscanned
  Colorimetry Data Block:
    xvYCC601
    xvYCC709
    BT2020cYCC
    BT2020YCC
    BT2020RGB
    Gamut Boundary Description Metadata Profile P0
  Vendor-Specific Data Block (HDMI), OUI 00-0C-03:
    Source physical address: 1.0.0.0
    DC_36bit
    DC_30bit
    DC_Y444
    Maximum TMDS clock: 340 MHz
  Vendor-Specific Data Block (HDMI Forum), OUI C4-5D-D8:
    Version: 1
    Maximum TMDS Character Rate: 600 MHz
    SCDC Present
  Vendor-Specific Data Block (AMD), OUI 00-00-1A:
    Version: 2.1
    Minimum Refresh Rate: 48 Hz
    Maximum Refresh Rate: 200 Hz
    Flags 1.x: 0xe0 (MCCS)
    Flags 2.x: 0x00
    Maximum luminance: 115 (603.666 cd/m^2)
    Minimum luminance: 34 (0.107 cd/m^2)
    Unknown: 0x59 0x2c
  HDR Static Metadata Data Block:
    Electro optical transfer functions:
      Traditional gamma - SDR luminance range
      Traditional gamma - HDR luminance range
      SMPTE ST2084
    Supported static metadata descriptors:
      Static metadata type 1
    Desired content max luminance: 88 (336.359 cd/m^2)
    Desired content max frame-average luminance: 88 (336.359 cd/m^2)
    Desired content min luminance: 35 (0.063 cd/m^2)
  Detailed Timing Descriptors:
    DTD 5:  1920x1080  164.917418 Hz  16:9    192.788 kHz    401.000000 MHz (543 mm x 302 mm)
                 Hfront   48 Hsync  32 Hback   80 Hpol N
                 Vfront    3 Vsync   5 Vback   81 Vpol N
    DTD 6:  1920x1080  179.998267 Hz  16:9    199.798 kHz    415.580000 MHz (543 mm x 302 mm)
                 Hfront   48 Hsync  32 Hback   80 Hpol N
                 Vfront    3 Vsync   5 Vback   22 Vpol N
    DTD 7:  1920x1080  200.000000 Hz  16:9    222.000 kHz    461.760000 MHz (543 mm x 302 mm)
                 Hfront   48 Hsync  32 Hback   80 Hpol N
                 Vfront    3 Vsync   5 Vback   22 Vpol N
Checksum: 0xbd  Unused space in Extension Block: 8 bytes

----------------

Warnings:

Block 0, Base EDID:
  Detailed Timing Descriptor #1: DTD is similar but not identical to VIC 16.
EDID:
  CTA-861: Multiple native progressive timings are defined.

Failures:

Block 2, Base EDID:
  Unknown Extension Block.
Block 3, CTA-861 Extension Block:
  Video Data Block: Duplicate VIC 16.
  Video Data Block: Duplicate VIC 31.
  Video Data Block: Duplicate VIC 3.
  Video Data Block: Duplicate VIC 4.
  Video Data Block: Duplicate VIC 14.
  Video Data Block: Duplicate VIC 19.
  Video Data Block: Duplicate VIC 63.
  Video Data Block: Duplicate VIC 64.
  Speaker Allocation Data Block: Only one instance of this Data Block is allowed.
  Video Capability Data Block: Only one instance of this Data Block is allowed.
  Colorimetry Data Block: Only one instance of this Data Block is allowed.
  Vendor-Specific Data Block (HDMI Forum), OUI C4-5D-D8: Duplicate HDMI Forum VSDB/SCDB.
  HDR Static Metadata Data Block: Only one instance of this Data Block is allowed.
EDID:
  Base EDID: EDID specified 1 extension block(s), but found 3 extension block(s).
  Base EDID: EDID 1.3 requires a Block Map Extension in Block 1 if there are more than 2 blocks in the EDID.

EDID conformity: FAIL
