
EDID (hex):
00ffffffffffff000e14bf1400000000
0f140103802213780a4e4d9e57549126
0f505400000001010101010101010101
010101010101781d56c2500026303b27
5a0058c1100000180000000f00202020
2020202020206e050f00000000fe0043
50540a202020202020202020000000fe
00434c4141313536574131314120003f

Extracted contents:
header:          00 ff ff ff ff ff ff 00
serial number:   0e 14 bf 14 00 00 00 00 0f 14
version:         01 03
basic params:    80 22 13 78 0a
chroma info:     4e 4d 9e 57 54 91 26 0f 50 54
established:     00 00 00
standard:        01 01 01 01 01 01 01 01 01 01 01 01 01 01 01 01
descriptor 1:    78 1d 56 c2 50 00 26 30 3b 27 5a 00 58 c1 10 00 00 18
descriptor 2:    00 00 00 0f 00 20 20 20 20 20 20 20 20 20 6e 05 0f 00
descriptor 3:    00 00 00 fe 00 43 50 54 0a 20 20 20 20 20 20 20 20 20
descriptor 4:    00 00 00 fe 00 43 4c 41 41 31 35 36 57 41 31 31 41 20
extensions:      00
checksum:        3f

EDID version: 1.3
Manufacturer: CPT Model 14bf Serial Number --
Made in week 15 of 2010
Digital display
Maximum image size: 34 cm x 19 cm
Gamma: 2.20
RGB color display
First detailed timing is preferred timing
Display x,y Chromaticity:
  Red:   0.6181, 0.3398
  Green: 0.3310, 0.5683
  Blue:  0.1494, 0.0585
  White: 0.3154, 0.3291
Established timings supported:
Standard timings supported:
Detailed mode: Clock 75.440 MHz, 344 mm x 193 mm
               1366 1425 1464 1560 hborder 0
                768  773  783  806 vborder 0
               -hsync -vsync 
               VertFreq: 59 Hz, HorFreq: 48358 Hz
Manufacturer-specified data, tag 15
ASCII string: CPT
ASCII string: CLAA156WA11A 
Checksum: 0x3f (valid)
EDID block does NOT conform to EDID 1.3!
	Missing name descriptor
	Missing monitor ranges
