edid-decode (hex):

00 ff ff ff ff ff ff 00 41 0c 9e c2 af 15 00 00
15 21 01 04 b5 5c 34 78 3f f8 33 ac 52 43 ad 25
0c 48 49 bf ef 00 d1 c0 81 80 31 68 31 7c 45 68
45 7c 61 68 61 7c 4d d0 00 a0 f0 70 3e 80 30 40
35 00 98 05 32 00 00 1a 00 00 00 ff 00 55 48 42
32 33 32 31 30 30 35 35 35 31 00 00 00 fc 00 50
48 4c 20 34 32 4d 32 4e 38 39 30 30 00 00 00 fd
00 30 8a ff ff 95 01 0a 20 20 20 20 20 20 02 8f

02 03 32 f1 4c 01 03 05 14 04 13 1f 12 02 11 90
3f 23 09 07 07 83 01 00 00 e3 05 e3 01 e6 06 07
01 62 62 00 6d 1a 00 00 02 01 30 8a 00 00 00 00
00 00 a3 66 00 a0 f0 70 1f 80 30 20 35 00 98 05
32 00 00 1a 6f c2 00 a0 a0 a0 55 50 30 20 35 00
98 05 32 00 00 1e 56 5e 00 a0 a0 a0 29 50 30 20
35 00 98 05 32 00 00 1e 4d 6c 80 a0 70 70 3e 80
30 20 3a 00 98 05 32 00 00 1a 00 00 00 00 00 18

70 12 79 03 00 03 01 64 0f d0 01 84 ff 0e 2f 02
2f 80 3f 00 6f 08 59 00 02 00 04 00 30 5b 01 04
ff 0e 9f 00 2f 80 3f 00 6f 08 3d 00 02 00 04 00
1b 27 01 04 ff 0e 9f 00 2f 80 3f 00 6f 08 3d 00
02 00 04 00 64 04 01 04 ff 0e 9f 00 2f 80 3f 00
6f 08 3d 00 02 00 04 00 01 f3 01 04 ff 0e ff 00
2f 80 3f 00 6f 08 63 00 55 00 07 00 00 00 00 00
00 00 00 00 00 00 00 00 00 00 00 00 00 00 3b 90

00 ff ff ff ff ff ff 00 41 0c 9e c2 af 15 00 00
15 21 01 04 b5 5c 34 78 3f f8 33 ac 52 43 ad 25
0c 48 49 bf ef 00 d1 c0 81 80 31 68 31 7c 45 68
45 7c 61 68 61 7c 4d d0 00 a0 f0 70 3e 80 30 40
35 00 98 05 32 00 00 1a 00 00 00 ff 00 55 48 42
32 33 32 31 30 30 35 35 35 31 00 00 00 fc 00 50
48 4c 20 34 32 4d 32 4e 38 39 30 30 00 00 00 fd
00 30 8a ff ff 95 01 0a 20 20 20 20 20 20 02 8f

02 03 32 f1 4c 01 03 05 14 04 13 1f 12 02 11 90
3f 23 09 07 07 83 01 00 00 e3 05 e3 01 e6 06 07
01 62 62 00 6d 1a 00 00 02 01 30 8a 00 00 00 00
00 00 a3 66 00 a0 f0 70 1f 80 30 20 35 00 98 05
32 00 00 1a 6f c2 00 a0 a0 a0 55 50 30 20 35 00
98 05 32 00 00 1e 56 5e 00 a0 a0 a0 29 50 30 20
35 00 98 05 32 00 00 1e 4d 6c 80 a0 70 70 3e 80
30 20 3a 00 98 05 32 00 00 1a 00 00 00 00 00 18

70 12 79 03 00 03 01 64 0f d0 01 84 ff 0e 2f 02
2f 80 3f 00 6f 08 59 00 02 00 04 00 30 5b 01 04
ff 0e 9f 00 2f 80 3f 00 6f 08 3d 00 02 00 04 00
1b 27 01 04 ff 0e 9f 00 2f 80 3f 00 6f 08 3d 00
02 00 04 00 64 04 01 04 ff 0e 9f 00 2f 80 3f 00
6f 08 3d 00 02 00 04 00 01 f3 01 04 ff 0e ff 00
2f 80 3f 00 6f 08 63 00 55 00 07 00 00 00 00 00
00 00 00 00 00 00 00 00 00 00 00 00 00 00 3b 90

----------------

Block 0, Base EDID:
  EDID Structure Version & Revision: 1.4
  Vendor & Product Identification:
    Manufacturer: PHL
    Model: 49822
    Serial Number: ...
    Made in: week 21 of 2023
  Basic Display Parameters & Features:
    Digital display
    Bits per primary color channel: 10
    DisplayPort interface
    Maximum image size: 92 cm x 52 cm
    Gamma: 2.20
    DPMS levels: Off
    Supported color formats: RGB 4:4:4, YCrCb 4:4:4, YCrCb 4:2:2
    Default (sRGB) color space is primary color space
    First detailed timing includes the native pixel format and preferred refresh rate
    Display is continuous frequency
  Color Characteristics:
    Red  : 0.6748, 0.3232
    Green: 0.2636, 0.6757
    Blue : 0.1445, 0.0498
    White: 0.2812, 0.2880
  Established Timings I & II:
    IBM     :   720x400    70.081663 Hz   9:5     31.467 kHz     28.320000 MHz
    DMT 0x04:   640x480    59.940476 Hz   4:3     31.469 kHz     25.175000 MHz
    Apple   :   640x480    66.666667 Hz   4:3     35.000 kHz     30.240000 MHz
    DMT 0x05:   640x480    72.808802 Hz   4:3     37.861 kHz     31.500000 MHz
    DMT 0x06:   640x480    75.000000 Hz   4:3     37.500 kHz     31.500000 MHz
    DMT 0x08:   800x600    56.250000 Hz   4:3     35.156 kHz     36.000000 MHz
    DMT 0x09:   800x600    60.316541 Hz   4:3     37.879 kHz     40.000000 MHz
    DMT 0x0a:   800x600    72.187572 Hz   4:3     48.077 kHz     50.000000 MHz
    DMT 0x0b:   800x600    75.000000 Hz   4:3     46.875 kHz     49.500000 MHz
    Apple   :   832x624    74.551266 Hz   4:3     49.726 kHz     57.284000 MHz
    DMT 0x10:  1024x768    60.003840 Hz   4:3     48.363 kHz     65.000000 MHz
    DMT 0x11:  1024x768    70.069359 Hz   4:3     56.476 kHz     75.000000 MHz
    DMT 0x12:  1024x768    75.028582 Hz   4:3     60.023 kHz     78.750000 MHz
    DMT 0x24:  1280x1024   75.024675 Hz   5:4     79.976 kHz    135.000000 MHz
  Standard Timings:
    DMT 0x52:  1920x1080   60.000000 Hz  16:9     67.500 kHz    148.500000 MHz
    DMT 0x23:  1280x1024   60.019740 Hz   5:4     63.981 kHz    108.000000 MHz
    GTF     :   640x480    99.999537 Hz   4:3     50.900 kHz     43.163000 MHz
    GTF     :   640x480   119.999084 Hz   4:3     61.800 kHz     52.406000 MHz
    GTF     :   800x600    99.999707 Hz   4:3     63.600 kHz     68.179000 MHz
    GTF     :   800x600   119.999886 Hz   4:3     77.160 kHz     83.950000 MHz
    GTF     :  1024x768   100.000177 Hz   4:3     81.400 kHz    113.309000 MHz
    GTF     :  1024x768   119.999931 Hz   4:3     98.760 kHz    139.054000 MHz
  Detailed Timing Descriptors:
    DTD 1:  3840x2160   59.996625 Hz  16:9    133.312 kHz    533.250000 MHz (920 mm x 517 mm)
                 Hfront   48 Hsync  64 Hback   48 Hpol P
                 Vfront    3 Vsync   5 Vback   54 Vpol N
    Display Product Serial Number: ...
    Display Product Name: 'PHL 42M2N8900'
    Display Range Limits:
      Monitor ranges (Bare Limits): 48-138 Hz V, 255-255 kHz H, max dotclock 1490 MHz
  Extension blocks: 2
Checksum: 0x8f

----------------

Block 1, CTA-861 Extension Block:
  Revision: 3
  Underscans IT Video Formats by default
  Basic audio support
  Supports YCbCr 4:4:4
  Supports YCbCr 4:2:2
  Native detailed modes: 1
  Video Data Block:
    VIC   1:   640x480    59.940476 Hz   4:3     31.469 kHz     25.175000 MHz
    VIC   3:   720x480    59.940060 Hz  16:9     31.469 kHz     27.000000 MHz
    VIC   5:  1920x1080i  60.000000 Hz  16:9     33.750 kHz     74.250000 MHz
    VIC  20:  1920x1080i  50.000000 Hz  16:9     28.125 kHz     74.250000 MHz
    VIC   4:  1280x720    60.000000 Hz  16:9     45.000 kHz     74.250000 MHz
    VIC  19:  1280x720    50.000000 Hz  16:9     37.500 kHz     74.250000 MHz
    VIC  31:  1920x1080   50.000000 Hz  16:9     56.250 kHz    148.500000 MHz
    VIC  18:   720x576    50.000000 Hz  16:9     31.250 kHz     27.000000 MHz
    VIC   2:   720x480    59.940060 Hz   4:3     31.469 kHz     27.000000 MHz
    VIC  17:   720x576    50.000000 Hz   4:3     31.250 kHz     27.000000 MHz
    VIC  16:  1920x1080   60.000000 Hz  16:9     67.500 kHz    148.500000 MHz (native)
    VIC  63:  1920x1080  120.000000 Hz  16:9    135.000 kHz    297.000000 MHz
  Audio Data Block:
    Linear PCM:
      Max channels: 2
      Supported sample rates (kHz): 48 44.1 32
      Supported sample sizes (bits): 24 20 16
  Speaker Allocation Data Block:
    FL/FR - Front Left/Right
  Colorimetry Data Block:
    xvYCC601
    xvYCC709
    BT2020cYCC
    BT2020YCC
    BT2020RGB
    Gamut Boundary Description Metadata Profile P0
  HDR Static Metadata Data Block:
    Electro optical transfer functions:
      Traditional gamma - SDR luminance range
      Traditional gamma - HDR luminance range
      SMPTE ST2084
    Supported static metadata descriptors:
      Static metadata type 1
    Desired content max luminance: 98 (417.710 cd/m^2)
    Desired content max frame-average luminance: 98 (417.710 cd/m^2)
    Desired content min luminance: 0 (0.000 cd/m^2)
  Vendor-Specific Data Block (AMD), OUI 00-00-1A:
    Version: 2.1
    Minimum Refresh Rate: 48 Hz
    Maximum Refresh Rate: 138 Hz
    Flags 1.x: 0x00
    Flags 2.x: 0x00
    Maximum luminance: 0 (50.000 cd/m^2)
    Minimum luminance: 0 (0.000 cd/m^2)
    Unknown: 0x00 0x00
  Detailed Timing Descriptors:
    DTD 2:  3840x2160   29.980602 Hz  16:9     65.688 kHz    262.750000 MHz (920 mm x 517 mm)
                 Hfront   48 Hsync  32 Hback   80 Hpol P
                 Vfront    3 Vsync   5 Vback   23 Vpol N
    DTD 3:  2560x1440  119.997589 Hz  16:9    182.996 kHz    497.750000 MHz (920 mm x 517 mm)
                 Hfront   48 Hsync  32 Hback   80 Hpol P
                 Vfront    3 Vsync   5 Vback   77 Vpol P
    DTD 4:  2560x1440   59.950550 Hz  16:9     88.787 kHz    241.500000 MHz (920 mm x 517 mm)
                 Hfront   48 Hsync  32 Hback   80 Hpol P
                 Vfront    3 Vsync   5 Vback   33 Vpol P
    DTD 5:  1920x2160   59.987970 Hz   8:9    133.293 kHz    277.250000 MHz (920 mm x 517 mm)
                 Hfront   48 Hsync  32 Hback   80 Hpol P
                 Vfront    3 Vsync  10 Vback   49 Vpol N
Checksum: 0x18  Unused space in Extension Block: 5 bytes

----------------

Block 2, DisplayID Extension Block:
  Version: 1.2
  Extension Count: 0
  Display Product Type: Standalone display device
  Video Timing Modes Type 1 - Detailed Timings Data Block:
    DTD:  3840x2160  120.000000 Hz  16:9    270.000 kHz   1188.000000 MHz (aspect 16:9, no 3D stereo, preferred)
               Hfront   48 Hsync  64 Hback  448 Hpol P
               Vfront    3 Vsync   5 Vback   82 Vpol N
    DTD:  3840x2160  100.001125 Hz  16:9    222.202 kHz    888.810000 MHz (aspect 16:9, no 3D stereo)
               Hfront   48 Hsync  64 Hback   48 Hpol P
               Vfront    3 Vsync   5 Vback   54 Vpol N
    DTD:  3840x2160   85.000000 Hz  16:9    188.870 kHz    755.480000 MHz (aspect 16:9, no 3D stereo)
               Hfront   48 Hsync  64 Hback   48 Hpol P
               Vfront    3 Vsync   5 Vback   54 Vpol N
    DTD:  3840x2160   75.001125 Hz  16:9    166.653 kHz    666.610000 MHz (aspect 16:9, no 3D stereo)
               Hfront   48 Hsync  64 Hback   48 Hpol P
               Vfront    3 Vsync   5 Vback   54 Vpol N
    DTD:  3840x2160  137.999948 Hz  16:9    311.880 kHz   1277.460000 MHz (aspect 16:9, no 3D stereo)
               Hfront   48 Hsync  64 Hback  144 Hpol P
               Vfront   86 Vsync   8 Vback    6 Vpol N
  Checksum: 0x3b
Checksum: 0x90

----------------

Block 3, Unknown EDID Extension Block 0x00:
  00 ff ff ff ff ff ff 00 41 0c 9e c2 af 15 00 00 '........A.......'
  15 21 01 04 b5 5c 34 78 3f f8 33 ac 52 43 ad 25 '.!...\4x?.3.RC.%'
  0c 48 49 bf ef 00 d1 c0 81 80 31 68 31 7c 45 68 '.HI.......1h1|Eh'
  45 7c 61 68 61 7c 4d d0 00 a0 f0 70 3e 80 30 40 'E|aha|M....p>.0@'
  35 00 98 05 32 00 00 1a 00 00 00 ff 00 55 48 42 '5...2........UHB'
  32 33 32 31 30 30 35 35 35 31 00 00 00 fc 00 50 '2321005551.....P'
  48 4c 20 34 32 4d 32 4e 38 39 30 30 00 00 00 fd 'HL 42M2N8900....'
  00 30 8a ff ff 95 01 0a 20 20 20 20 20 20 02 8f '.0......      ..'
Checksum: 0x8f

----------------

Block 4, CTA-861 Extension Block:
  Revision: 3
  Underscans IT Video Formats by default
  Basic audio support
  Supports YCbCr 4:4:4
  Supports YCbCr 4:2:2
  Native detailed modes: 1
  Video Data Block:
    VIC   1:   640x480    59.940476 Hz   4:3     31.469 kHz     25.175000 MHz
    VIC   3:   720x480    59.940060 Hz  16:9     31.469 kHz     27.000000 MHz
    VIC   5:  1920x1080i  60.000000 Hz  16:9     33.750 kHz     74.250000 MHz
    VIC  20:  1920x1080i  50.000000 Hz  16:9     28.125 kHz     74.250000 MHz
    VIC   4:  1280x720    60.000000 Hz  16:9     45.000 kHz     74.250000 MHz
    VIC  19:  1280x720    50.000000 Hz  16:9     37.500 kHz     74.250000 MHz
    VIC  31:  1920x1080   50.000000 Hz  16:9     56.250 kHz    148.500000 MHz
    VIC  18:   720x576    50.000000 Hz  16:9     31.250 kHz     27.000000 MHz
    VIC   2:   720x480    59.940060 Hz   4:3     31.469 kHz     27.000000 MHz
    VIC  17:   720x576    50.000000 Hz   4:3     31.250 kHz     27.000000 MHz
    VIC  16:  1920x1080   60.000000 Hz  16:9     67.500 kHz    148.500000 MHz (native)
    VIC  63:  1920x1080  120.000000 Hz  16:9    135.000 kHz    297.000000 MHz
  Audio Data Block:
    Linear PCM:
      Max channels: 2
      Supported sample rates (kHz): 48 44.1 32
      Supported sample sizes (bits): 24 20 16
  Speaker Allocation Data Block:
    FL/FR - Front Left/Right
  Colorimetry Data Block:
    xvYCC601
    xvYCC709
    BT2020cYCC
    BT2020YCC
    BT2020RGB
    Gamut Boundary Description Metadata Profile P0
  HDR Static Metadata Data Block:
    Electro optical transfer functions:
      Traditional gamma - SDR luminance range
      Traditional gamma - HDR luminance range
      SMPTE ST2084
    Supported static metadata descriptors:
      Static metadata type 1
    Desired content max luminance: 98 (417.710 cd/m^2)
    Desired content max frame-average luminance: 98 (417.710 cd/m^2)
    Desired content min luminance: 0 (0.000 cd/m^2)
  Vendor-Specific Data Block (AMD), OUI 00-00-1A:
    Version: 2.1
    Minimum Refresh Rate: 48 Hz
    Maximum Refresh Rate: 138 Hz
    Flags 1.x: 0x00
    Flags 2.x: 0x00
    Maximum luminance: 0 (50.000 cd/m^2)
    Minimum luminance: 0 (0.000 cd/m^2)
    Unknown: 0x00 0x00
  Detailed Timing Descriptors:
    DTD 6:  3840x2160   29.980602 Hz  16:9     65.688 kHz    262.750000 MHz (920 mm x 517 mm)
                 Hfront   48 Hsync  32 Hback   80 Hpol P
                 Vfront    3 Vsync   5 Vback   23 Vpol N
    DTD 7:  2560x1440  119.997589 Hz  16:9    182.996 kHz    497.750000 MHz (920 mm x 517 mm)
                 Hfront   48 Hsync  32 Hback   80 Hpol P
                 Vfront    3 Vsync   5 Vback   77 Vpol P
    DTD 8:  2560x1440   59.950550 Hz  16:9     88.787 kHz    241.500000 MHz (920 mm x 517 mm)
                 Hfront   48 Hsync  32 Hback   80 Hpol P
                 Vfront    3 Vsync   5 Vback   33 Vpol P
    DTD 9:  1920x2160   59.987970 Hz   8:9    133.293 kHz    277.250000 MHz (920 mm x 517 mm)
                 Hfront   48 Hsync  32 Hback   80 Hpol P
                 Vfront    3 Vsync  10 Vback   49 Vpol N
Checksum: 0x18  Unused space in Extension Block: 5 bytes

----------------

Block 5, DisplayID Extension Block:
  Version: 1.2
  Extension Count: 0
  Video Timing Modes Type 1 - Detailed Timings Data Block:
    DTD:  3840x2160  120.000000 Hz  16:9    270.000 kHz   1188.000000 MHz (aspect 16:9, no 3D stereo, preferred)
               Hfront   48 Hsync  64 Hback  448 Hpol P
               Vfront    3 Vsync   5 Vback   82 Vpol N
    DTD:  3840x2160  100.001125 Hz  16:9    222.202 kHz    888.810000 MHz (aspect 16:9, no 3D stereo)
               Hfront   48 Hsync  64 Hback   48 Hpol P
               Vfront    3 Vsync   5 Vback   54 Vpol N
    DTD:  3840x2160   85.000000 Hz  16:9    188.870 kHz    755.480000 MHz (aspect 16:9, no 3D stereo)
               Hfront   48 Hsync  64 Hback   48 Hpol P
               Vfront    3 Vsync   5 Vback   54 Vpol N
    DTD:  3840x2160   75.001125 Hz  16:9    166.653 kHz    666.610000 MHz (aspect 16:9, no 3D stereo)
               Hfront   48 Hsync  64 Hback   48 Hpol P
               Vfront    3 Vsync   5 Vback   54 Vpol N
    DTD:  3840x2160  137.999948 Hz  16:9    311.880 kHz   1277.460000 MHz (aspect 16:9, no 3D stereo)
               Hfront   48 Hsync  64 Hback  144 Hpol P
               Vfront   86 Vsync   8 Vback    6 Vpol N
  Checksum: 0x3b
Checksum: 0x90

----------------

Warnings:

Block 1, CTA-861 Extension Block:
  Display Product Serial Number is set, so the Serial Number in the Base EDID should be 0.
Block 2, DisplayID Extension Block:
  Video Timing Modes Type 1 - Detailed Timings Data Block: DTD is similar but not identical to VIC 118.
Block 4, CTA-861 Extension Block:
  Display Product Serial Number is set, so the Serial Number in the Base EDID should be 0.
Block 5, DisplayID Extension Block:
  Video Timing Modes Type 1 - Detailed Timings Data Block: DTD is similar but not identical to VIC 118.
EDID:
  Base EDID: Some timings are out of range of the Monitor Ranges:
    Vertical Freq: 29.981 - 138.000 Hz (Monitor: 48.000 - 138.000 Hz)
    Horizontal Freq: 28.125 - 311.879 kHz (Monitor: 255.000 - 255.000 kHz)

Failures:

Block 0, Base EDID:
  Basic Display Parameters & Features: sRGB is signaled, but the chromaticities do not match.
Block 1, CTA-861 Extension Block:
  Missing VCDB, needed for Set Selectable RGB Quantization to avoid interop issues.
Block 2, DisplayID Extension Block:
  Expected 0 DisplayID Extension Block, but got 1.
Block 3, Base EDID:
  Unknown Extension Block.
Block 4, CTA-861 Extension Block:
  Video Data Block: Duplicate VIC 1.
  Video Data Block: Duplicate VIC 3.
  Video Data Block: Duplicate VIC 5.
  Video Data Block: Duplicate VIC 20.
  Video Data Block: Duplicate VIC 4.
  Video Data Block: Duplicate VIC 19.
  Video Data Block: Duplicate VIC 31.
  Video Data Block: Duplicate VIC 18.
  Video Data Block: Duplicate VIC 2.
  Video Data Block: Duplicate VIC 17.
  Video Data Block: Duplicate VIC 16.
  Video Data Block: Duplicate VIC 63.
  Speaker Allocation Data Block: Only one instance of this Data Block is allowed.
  Colorimetry Data Block: Only one instance of this Data Block is allowed.
  HDR Static Metadata Data Block: Only one instance of this Data Block is allowed.
  Missing VCDB, needed for Set Selectable RGB Quantization to avoid interop issues.
Block 5, DisplayID Extension Block:
  Product Type should be 0 in extension block.
EDID:
  Base EDID: EDID specified 2 extension block(s), but found 5 extension block(s).
  CTA-861: Native progressive timings are a mix of several resolutions.
  DisplayID: Missing DisplayID Product Identification Data Block.
  DisplayID: Missing DisplayID Display Parameters Data Block.
  DisplayID: Missing DisplayID Display Interface Features Data Block.

EDID conformity: FAIL
