
EDID (hex):
00ffffffffffff000472c5005fb45092
19130103802c1978eaee95a3544c9926
0f5054bfef80714f81c0810081408180
8bc0a9c0a9cf2f2640a060841a303020
3500bbf91000001a000000fd00384b1f
530f000a202020202020000000fc0041
6365722050323035480a2020000000ff
004c474c3057303038343332300a0038

Extracted contents:
header:          00 ff ff ff ff ff ff 00
serial number:   04 72 c5 00 5f b4 50 92 19 13
version:         01 03
basic params:    80 2c 19 78 ea
chroma info:     ee 95 a3 54 4c 99 26 0f 50 54
established:     bf ef 80
standard:        71 4f 81 c0 81 00 81 40 81 80 8b c0 a9 c0 a9 cf
descriptor 1:    2f 26 40 a0 60 84 1a 30 30 20 35 00 bb f9 10 00 00 1a
descriptor 2:    00 00 00 fd 00 38 4b 1f 53 0f 00 0a 20 20 20 20 20 20
descriptor 3:    00 00 00 fc 00 41 63 65 72 20 50 32 30 35 48 0a 20 20
descriptor 4:    00 00 00 ff 00 4c 47 4c 30 57 30 30 38 34 33 32 30 0a
extensions:      00
checksum:        38

EDID version: 1.3
Manufacturer: ACR Model c5 Serial Number --
Made in week 25 of 2009
Digital display
Maximum image size: 44 cm x 25 cm
Gamma: 2.20
DPMS levels: Standby Suspend Off
RGB color display
First detailed timing is preferred timing
Display x,y Chromaticity:
  Red:   0.6396, 0.3300
  Green: 0.2998, 0.5996
  Blue:  0.1503, 0.0595
  White: 0.3134, 0.3291
Established timings supported:
  720x400@70Hz 9:5 HorFreq: 31469 Hz Clock: 28.320 MHz
  640x480@60Hz 4:3 HorFreq: 31469 Hz Clock: 25.175 MHz
  640x480@67Hz 4:3 HorFreq: 35000 Hz Clock: 30.240 MHz
  640x480@72Hz 4:3 HorFreq: 37900 Hz Clock: 31.500 MHz
  640x480@75Hz 4:3 HorFreq: 37500 Hz Clock: 31.500 MHz
  800x600@56Hz 4:3 HorFreq: 35200 Hz Clock: 36.000 MHz
  800x600@60Hz 4:3 HorFreq: 37900 Hz Clock: 40.000 MHz
  800x600@72Hz 4:3 HorFreq: 48100 Hz Clock: 50.000 MHz
  800x600@75Hz 4:3 HorFreq: 46900 Hz Clock: 49.500 MHz
  832x624@75Hz 4:3 HorFreq: 49726 Hz Clock: 57.284 MHz
  1024x768@60Hz 4:3 HorFreq: 48400 Hz Clock: 65.000 MHz
  1024x768@70Hz 4:3 HorFreq: 56500 Hz Clock: 75.000 MHz
  1024x768@75Hz 4:3 HorFreq: 60000 Hz Clock: 78.750 MHz
  1280x1024@75Hz 5:4 HorFreq: 80000 Hz Clock: 135.000 MHz
  1152x870@75Hz 192:145 HorFreq: 67500 Hz Clock: 108.000 MHz
Standard timings supported:
  1152x864@75Hz 4:3 HorFreq: 67500 Hz Clock: 108.000 MHz
  1280x720@60Hz 16:9
  1280x800@60Hz 16:10
  1280x960@60Hz 4:3 HorFreq: 60000 Hz Clock: 108.000 MHz
  1280x1024@60Hz 5:4 HorFreq: 64000 Hz Clock: 108.000 MHz
  1360x765@60Hz 16:9
  1600x900@60Hz 16:9
  1600x900@75Hz 16:9
Detailed mode: Clock 97.750 MHz, 443 mm x 249 mm
               1600 1648 1680 1760 hborder 0
                900  903  908  926 vborder 0
               +hsync -vsync 
               VertFreq: 59 Hz, HorFreq: 55539 Hz
Monitor ranges (GTF): 56-75Hz V, 31-83kHz H, max dotclock 150MHz
Monitor name: Acer P205H
Serial number: --
Checksum: 0x38 (valid)
