
EDID (hex):
00ffffffffffff0034a41c4600000000
201d0104b53c21783b8a75a954469722
1f5054a74b0081c081809500a9c0b300
d1c001010101565e00a0a0a029503020
350055502100001a40df0078a0a02950
0840350055502100001a000000fd0030
92f0f03c010a202020202020000000fc
004d4432313437330a2020202020018f
020318754b909f859404130312010211
2309070783010000023a80d072382d40
102c9680555021000018023a80187138
2d40582c9600555021000018011d00bc
52d01e20b828554055502100001ef7bd
00a0a0a032500840350055502100001a
0474801871382d403040350055502100
001a0000000000000000000000000077

Extracted contents:
header:          00 ff ff ff ff ff ff 00
serial number:   34 a4 1c 46 00 00 00 00 20 1d
version:         01 04
basic params:    b5 3c 21 78 3b
chroma info:     8a 75 a9 54 46 97 22 1f 50 54
established:     a7 4b 00
standard:        81 c0 81 80 95 00 a9 c0 b3 00 d1 c0 01 01 01 01
descriptor 1:    56 5e 00 a0 a0 a0 29 50 30 20 35 00 55 50 21 00 00 1a
descriptor 2:    40 df 00 78 a0 a0 29 50 08 40 35 00 55 50 21 00 00 1a
descriptor 3:    00 00 00 fd 00 30 92 f0 f0 3c 01 0a 20 20 20 20 20 20
descriptor 4:    00 00 00 fc 00 4d 44 32 31 34 37 33 0a 20 20 20 20 20
extensions:      01
checksum:        8f

EDID version: 1.4
Manufacturer: MED Model 461c Serial Number --
Made in week 32 of 2019
Digital display
10 bits per primary color channel
DisplayPort interface
Maximum image size: 60 cm x 33 cm
Gamma: 2.20
DPMS levels: Off
Supported color formats: RGB 4:4:4, YCrCb 4:4:4, YCrCb 4:2:2
First detailed timing includes the native pixel format and preferred refresh rate
Display is continuous frequency
Display x,y Chromaticity:
  Red:   0.6621, 0.3281
  Green: 0.2753, 0.5917
  Blue:  0.1337, 0.1240
  White: 0.3134, 0.3291
Established timings supported:
  720x400@70Hz 9:5 HorFreq: 31469 Hz Clock: 28.320 MHz
  640x480@60Hz 4:3 HorFreq: 31469 Hz Clock: 25.175 MHz
  640x480@75Hz 4:3 HorFreq: 37500 Hz Clock: 31.500 MHz
  800x600@56Hz 4:3 HorFreq: 35200 Hz Clock: 36.000 MHz
  800x600@60Hz 4:3 HorFreq: 37900 Hz Clock: 40.000 MHz
  800x600@75Hz 4:3 HorFreq: 46900 Hz Clock: 49.500 MHz
  1024x768@60Hz 4:3 HorFreq: 48400 Hz Clock: 65.000 MHz
  1024x768@75Hz 4:3 HorFreq: 60000 Hz Clock: 78.750 MHz
  1280x1024@75Hz 5:4 HorFreq: 80000 Hz Clock: 135.000 MHz
Standard timings supported:
  1280x720@60Hz 16:9
  1280x1024@60Hz 5:4 HorFreq: 64000 Hz Clock: 108.000 MHz
  1440x900@60Hz 16:10 HorFreq: 55500 Hz Clock: 88.750 MHz
  1600x900@60Hz 16:9
  1680x1050@60Hz 16:10 HorFreq: 64700 Hz Clock: 119.000 MHz
  1920x1080@60Hz 16:9
Detailed mode: Clock 241.500 MHz, 597 mm x 336 mm
               2560 2608 2640 2720 hborder 0
               1440 1443 1448 1481 vborder 0
               +hsync -vsync 
               VertFreq: 59 Hz, HorFreq: 88786 Hz
Detailed mode: Clock 571.520 MHz, 597 mm x 336 mm
               2560 2568 2632 2680 hborder 0
               1440 1443 1448 1481 vborder 0
               +hsync -vsync 
               VertFreq: 143 Hz, HorFreq: 213253 Hz
Monitor ranges (bare limits): 48-146Hz V, 240-240kHz H, max dotclock 600MHz
Monitor name: MD21473
Has 1 extension blocks
Checksum: 0x8f (valid)

CTA extension block
Extension version: 3
20 bytes of CTA data
  Video data block
    VIC  16 1920x1080@60Hz 16:9 (native) HorFreq: 67500 Hz Clock: 148.500 MHz
    VIC  31 1920x1080@50Hz 16:9 (native) HorFreq: 56250 Hz Clock: 148.500 MHz
    VIC   5 1920x1080i@60Hz 16:9 (native) HorFreq: 33750 Hz Clock: 74.250 MHz
    VIC  20 1920x1080i@50Hz 16:9 (native) HorFreq: 28125 Hz Clock: 74.250 MHz
    VIC   4 1280x720@60Hz 16:9  HorFreq: 45000 Hz Clock: 74.250 MHz
    VIC  19 1280x720@50Hz 16:9  HorFreq: 37500 Hz Clock: 74.250 MHz
    VIC   3 720x480@60Hz 16:9  HorFreq: 31469 Hz Clock: 27.000 MHz
    VIC  18 720x576@50Hz 16:9  HorFreq: 31250 Hz Clock: 27.000 MHz
    VIC   1 640x480@60Hz 4:3  HorFreq: 31469 Hz Clock: 25.175 MHz
    VIC   2 720x480@60Hz 4:3  HorFreq: 31469 Hz Clock: 27.000 MHz
    VIC  17 720x576@50Hz 4:3  HorFreq: 31250 Hz Clock: 27.000 MHz
  Audio data block
    Linear PCM, max channels 2
      Supported sample rates (kHz): 48 44.1 32
      Supported sample sizes (bits): 24 20 16
  Speaker allocation data block
    Speaker map:
      FL/FR - Front Left/Right
Basic audio support
Supports YCbCr 4:4:4
Supports YCbCr 4:2:2
5 native detailed modes
Detailed mode: Clock 148.500 MHz, 597 mm x 336 mm
               1920 2448 2492 2640 hborder 0
               1080 1089 1095 1125 vborder 0
               -hsync -vsync 
               VertFreq: 50 Hz, HorFreq: 56250 Hz
Detailed mode: Clock 148.500 MHz, 597 mm x 336 mm
               1920 2008 2052 2200 hborder 0
               1080 1089 1095 1125 vborder 0
               -hsync -vsync 
               VertFreq: 60 Hz, HorFreq: 67500 Hz
Detailed mode: Clock 74.250 MHz, 597 mm x 336 mm
               1280 1720 1760 1980 hborder 0
                720  725  730  750 vborder 0
               +hsync +vsync 
               VertFreq: 50 Hz, HorFreq: 37500 Hz
Detailed mode: Clock 486.310 MHz, 597 mm x 336 mm
               2560 2568 2632 2720 hborder 0
               1440 1443 1448 1490 vborder 0
               +hsync -vsync 
               VertFreq: 119 Hz, HorFreq: 178790 Hz
Detailed mode: Clock 297.000 MHz, 597 mm x 336 mm
               1920 1968 2032 2200 hborder 0
               1080 1083 1088 1125 vborder 0
               +hsync -vsync 
               VertFreq: 120 Hz, HorFreq: 135000 Hz
Checksum: 0x77 (valid)

Warning: One or more of the timings is out of range of the Monitor Ranges:
  Vertical Freq: 50 - 143 Hz
  Horizontal Freq: 28125 - 213253 Hz
  Maximum Clock: 571.520 MHz
