edid-decode (hex):

00 ff ff ff ff ff ff 00 06 af ec 21 00 00 00 00
00 15 01 04 90 22 13 78 02 c8 95 9e 57 54 92 26
0f 50 54 00 00 00 01 01 01 01 01 01 01 01 01 01
01 01 01 01 01 01 e2 1d 56 d6 50 00 26 30 10 10
3e 00 58 c1 10 00 00 1a e2 1d 56 18 52 00 ec 30
10 10 3e 00 58 c1 10 00 00 1a 00 00 00 fe 00 38
39 59 4d 54 80 42 31 35 36 58 54 4e 00 00 00 00
00 00 41 21 96 00 00 00 00 01 01 0a 20 20 00 d7

----------------

Block 0, Base EDID:
  EDID Structure Version & Revision: 1.4
  Vendor & Product Identification:
    Manufacturer: AUO
    Model: 8684
    Made in: 2011
  Basic Display Parameters & Features:
    Digital display
    Bits per primary color channel: 6
    Digital interface is not defined
    Maximum image size: 34 cm x 19 cm
    Gamma: 2.20
    Supported color formats: RGB 4:4:4
    First detailed timing includes the native pixel format and preferred refresh rate
  Color Characteristics:
    Red  : 0.6201, 0.3398
    Green: 0.3300, 0.5703
    Blue : 0.1503, 0.0595
    White: 0.3134, 0.3291
  Established Timings I & II: none
  Standard Timings: none
  Detailed Timing Descriptors:
    DTD 1:  1366x768    60.072 Hz 683:384  48.418 kHz  76.500 MHz (344 mm x 193 mm)
                 Hfront   16 Hsync  16 Hback 182 Hpol P
                 Vfront    3 Vsync  14 Vback  21 Vpol N
    DTD 2:  1366x768    40.061 Hz 683:384  40.221 kHz  76.500 MHz (344 mm x 193 mm)
                 Hfront   16 Hsync  16 Hback 504 Hpol P
                 Vfront    3 Vsync  14 Vback 219 Vpol N
    Alphanumeric Data String: '89YMT'
    Manufacturer-Specified Display Descriptor (0x00): 00 00 00 00 41 21 96 00 00 00 00 01 01 0a 20 20 '....A!........  '
Checksum: 0xd7
