edid-decode (hex):

00 ff ff ff ff ff ff 00 44 93 24 00 00 00 00 00
00 0f 01 03 80 1d 15 78 0a d0 e0 91 54 50 8e 27
26 50 54 00 08 00 01 01 01 01 01 01 01 01 01 01
01 01 01 01 01 01 64 19 00 40 41 00 26 30 18 88
36 00 1e d6 10 00 00 18 00 00 00 00 00 04 c0 2e
c0 02 11 12 12 76 c0 12 63 01 00 00 00 fe 00 51
55 41 4e 54 41 44 49 53 50 4c 41 59 00 00 00 fe
00 51 44 31 34 58 4c 32 30 35 0a 20 20 20 00 f2

----------------

Block 0, Base EDID:
  EDID Structure Version & Revision: 1.3
  Vendor & Product Identification:
    Manufacturer: QDS
    Model: 36
    Made in: 2005
  Basic Display Parameters & Features:
    Digital display
    Maximum image size: 29 cm x 21 cm
    Gamma: 2.20
    RGB color display
    First detailed timing is preferred timing
  Color Characteristics:
    Red  : 0.5693, 0.3291
    Green: 0.3125, 0.5546
    Blue : 0.1552, 0.1503
    White: 0.3125, 0.3281
  Established Timings I & II:
    DMT 0x10:  1024x768    60.004 Hz   4:3    48.363 kHz  65.000 MHz
  Standard Timings: none
  Detailed Timing Descriptors:
    DTD 1:  1024x768    60.004 Hz   4:3    48.363 kHz  65.000 MHz (286 mm x 214 mm)
                 Hfront   24 Hsync 136 Hback 160 Hpol N
                 Vfront    3 Vsync   6 Vback  29 Vpol N
    Manufacturer-Specified Display Descriptor (0x00): 00 00 00 04 c0 2e c0 02 11 12 12 76 c0 12 63 01 '...........v..c.'
    Alphanumeric Data String: 'QUANTADISPLAY'
    Alphanumeric Data String: 'QD14XL205'
Checksum: 0xf2
