edid-decode (hex):

00 ff ff ff ff ff ff 00 22 d2 01 aa 00 00 00 00
ff 1a 01 03 80 00 00 78 02 60 bc aa 55 40 b6 23
0c 4c 52 00 00 00 01 01 01 01 01 01 01 01 01 01
01 01 01 01 01 01 04 74 70 6a 80 b0 08 41 28 14
c2 04 7a 44 00 00 00 18 04 74 70 6a 80 b0 08 41
28 14 c2 04 7a 44 00 00 00 18 00 00 00 fc 00 48
54 43 2d 56 49 56 45 0a 20 20 20 20 00 00 00 fd
00 14 78 01 ff 1d 01 0a 20 20 20 20 20 20 01 de

02 03 15 40 42 01 02 23 09 07 01 83 01 00 00 65
03 0c 00 10 00 04 74 70 6a 80 b0 08 41 28 14 c2
04 c0 78 00 00 00 18 04 74 70 6a 80 b0 08 41 28
14 c2 04 c0 78 00 00 00 18 04 74 70 6a 80 b0 08
41 28 14 c2 04 c0 78 00 00 00 18 04 74 70 6a 80
b0 08 41 28 14 c2 04 c0 78 00 00 00 18 00 00 00
00 00 00 00 00 00 00 00 00 00 00 00 00 00 00 00
00 00 00 00 00 00 00 00 00 00 00 00 00 00 00 b1

----------------

Block 0, Base EDID:
  EDID Structure Version & Revision: 1.3
  Vendor & Product Identification:
    Manufacturer: HVR
    Model: 43521
    Model year: 2016
  Basic Display Parameters & Features:
    Digital display
    Image size is variable
    Gamma: 2.20
    Monochrome or grayscale display
    First detailed timing is the preferred timing
  Color Characteristics:
    Red  : 0.6650, 0.3339
    Green: 0.2500, 0.7109
    Blue : 0.1386, 0.0498
    White: 0.2998, 0.3203
  Established Timings I & II: none
  Standard Timings: none
  Detailed Timing Descriptors:
    DTD 1:  2160x1200   89.527296 Hz   9:5    131.068 kHz    297.000000 MHz (122 mm x 68 mm)
                 Hfront   40 Hsync  20 Hback   46 Hpol N
                 Vfront   28 Vsync   2 Vback  234 Vpol N
    DTD 2:  2160x1200   89.527296 Hz   9:5    131.068 kHz    297.000000 MHz (122 mm x 68 mm)
                 Hfront   40 Hsync  20 Hback   46 Hpol N
                 Vfront   28 Vsync   2 Vback  234 Vpol N
    Display Product Name: 'HTC-VIVE'
    Display Range Limits:
      Monitor ranges (Bare Limits): 20-120 Hz V, 1-255 kHz H, max dotclock 290 MHz
  Extension blocks: 1
Checksum: 0xde

----------------

Block 1, CTA-861 Extension Block:
  Revision: 3
  Basic audio support
  Native detailed modes: 0
  Video Data Block:
    VIC   1:   640x480    59.940476 Hz   4:3     31.469 kHz     25.175000 MHz
    VIC   2:   720x480    59.940060 Hz   4:3     31.469 kHz     27.000000 MHz
  Audio Data Block:
    Linear PCM:
      Max channels: 2
      Supported sample rates (kHz): 48 44.1 32
      Supported sample sizes (bits): 16
  Speaker Allocation Data Block:
    FL/FR - Front Left/Right
  Vendor-Specific Data Block (HDMI), OUI 00-0C-03:
    Source physical address: 1.0.0.0
  Detailed Timing Descriptors:
    DTD 3:  2160x1200   89.527296 Hz   9:5    131.068 kHz    297.000000 MHz (192 mm x 120 mm)
                 Hfront   40 Hsync  20 Hback   46 Hpol N
                 Vfront   28 Vsync   2 Vback  234 Vpol N
    DTD 4:  2160x1200   89.527296 Hz   9:5    131.068 kHz    297.000000 MHz (192 mm x 120 mm)
                 Hfront   40 Hsync  20 Hback   46 Hpol N
                 Vfront   28 Vsync   2 Vback  234 Vpol N
    DTD 5:  2160x1200   89.527296 Hz   9:5    131.068 kHz    297.000000 MHz (192 mm x 120 mm)
                 Hfront   40 Hsync  20 Hback   46 Hpol N
                 Vfront   28 Vsync   2 Vback  234 Vpol N
    DTD 6:  2160x1200   89.527296 Hz   9:5    131.068 kHz    297.000000 MHz (192 mm x 120 mm)
                 Hfront   40 Hsync  20 Hback   46 Hpol N
                 Vfront   28 Vsync   2 Vback  234 Vpol N
Checksum: 0xb1

----------------

Warnings:

Block 1, CTA-861 Extension Block:
  IT Video Formats are overscanned by default, but normally this should be underscanned.
  Video Data Block: VIC 1 is the preferred timing, overriding the first detailed timings. Is this intended?
EDID:
  Base EDID: Some timings are out of range of the Monitor Ranges:
    Maximum Clock: 297.000 MHz (Monitor: 290.000 MHz)
    Could be due to a Monitor Range off-by-one rounding issue

Failures:

Block 0, Base EDID:
  Vendor & Product Identification: EDID 1.3 does not support week 0xff.
  Display Range Limits: 'Bare Limits' is not allowed for EDID < 1.4.
Block 1, CTA-861 Extension Block:
  Missing VCDB, needed for Set Selectable RGB Quantization to avoid interop issues.
EDID:
  Base EDID: The DTD image sizes all fit inside 255x255cm, but no display size was set.

EDID conformity: FAIL
