edid-decode (hex):

00 ff ff ff ff ff ff 00 20 32 06 22 01 01 01 01
2a 14 01 03 80 30 1b 78 2a 18 15 a4 5d 53 a4 27
13 50 54 a7 ce 00 81 80 95 00 01 01 01 01 01 01
01 01 01 01 01 01 02 3a 80 18 71 38 2d 40 58 2c
45 00 dc 0c 11 00 00 1e 66 21 50 b0 51 00 1b 30
40 70 36 00 dc 0c 11 00 00 18 00 00 00 fd 00 38
4c 1e 53 0f 00 0a 20 20 20 20 20 20 00 00 00 fc
00 4c 45 32 32 5a 36 0a 20 20 20 20 20 20 01 c4

02 03 29 f1 4f 9f 10 14 05 13 04 02 03 11 01 12
06 07 15 16 23 09 07 03 83 01 00 00 6c 03 0c 00
10 00 00 1e c0 01 01 01 01 8c 0a d0 8a 20 e0 2d
10 10 3e 96 00 dc 0c 11 00 00 18 02 3a 80 18 71
38 2d 40 58 2c 25 00 dc 0c 11 00 00 1e 01 1d 80
18 71 1c 16 20 58 2c 25 00 dc 0c 11 00 00 9e 8c
0a a0 14 51 f0 16 00 26 7c 43 00 dc 0c 11 00 00
98 00 00 00 00 00 00 00 00 00 00 00 00 00 00 8f

----------------

Block 0, Base EDID:
  EDID Structure Version & Revision: 1.3
  Vendor & Product Identification:
    Manufacturer: HAR
    Model: 8710
    Serial Number: ...
    Made in: week 42 of 2010
  Basic Display Parameters & Features:
    Digital display
    Maximum image size: 48 cm x 27 cm
    Gamma: 2.20
    DPMS levels: Off
    RGB color display
    First detailed timing is the preferred timing
  Color Characteristics:
    Red  : 0.6406, 0.3642
    Green: 0.3261, 0.6406
    Blue : 0.1523, 0.0751
    White: 0.3134, 0.3291
  Established Timings I & II:
    IBM     :   720x400    70.082 Hz   9:5    31.467 kHz  28.320 MHz
    DMT 0x04:   640x480    59.940 Hz   4:3    31.469 kHz  25.175 MHz
    DMT 0x06:   640x480    75.000 Hz   4:3    37.500 kHz  31.500 MHz
    DMT 0x08:   800x600    56.250 Hz   4:3    35.156 kHz  36.000 MHz
    DMT 0x09:   800x600    60.317 Hz   4:3    37.879 kHz  40.000 MHz
    DMT 0x0a:   800x600    72.188 Hz   4:3    48.077 kHz  50.000 MHz
    DMT 0x0b:   800x600    75.000 Hz   4:3    46.875 kHz  49.500 MHz
    DMT 0x10:  1024x768    60.004 Hz   4:3    48.363 kHz  65.000 MHz
    DMT 0x11:  1024x768    70.069 Hz   4:3    56.476 kHz  75.000 MHz
    DMT 0x12:  1024x768    75.029 Hz   4:3    60.023 kHz  78.750 MHz
  Standard Timings:
    DMT 0x23:  1280x1024   60.020 Hz   5:4    63.981 kHz 108.000 MHz
    DMT 0x2f:  1440x900    59.887 Hz  16:10   55.935 kHz 106.500 MHz
  Detailed Timing Descriptors:
    DTD 1:  1920x1080   60.000 Hz  16:9    67.500 kHz 148.500 MHz (476 mm x 268 mm)
                 Hfront   88 Hsync  44 Hback 148 Hpol P
                 Vfront    4 Vsync   5 Vback  36 Vpol P
    DTD 2:  1360x768    60.015 Hz  85:48   47.712 kHz  85.500 MHz (476 mm x 268 mm)
                 Hfront   64 Hsync 112 Hback 256 Hpol N
                 Vfront    3 Vsync   6 Vback  18 Vpol N
  Display Range Limits:
    Monitor ranges (GTF): 56-76 Hz V, 30-83 kHz H, max dotclock 150 MHz
    Display Product Name: 'LE22Z6'
  Extension blocks: 1
Checksum: 0xc4

----------------

Block 1, CTA-861 Extension Block:
  Revision: 3
  Underscans IT Video Formats by default
  Basic audio support
  Supports YCbCr 4:4:4
  Supports YCbCr 4:2:2
  Native detailed modes: 1
  Video Data Block:
    VIC  31:  1920x1080   50.000 Hz  16:9    56.250 kHz 148.500 MHz (native)
    VIC  16:  1920x1080   60.000 Hz  16:9    67.500 kHz 148.500 MHz
    VIC  20:  1920x1080i  50.000 Hz  16:9    28.125 kHz  74.250 MHz
    VIC   5:  1920x1080i  60.000 Hz  16:9    33.750 kHz  74.250 MHz
    VIC  19:  1280x720    50.000 Hz  16:9    37.500 kHz  74.250 MHz
    VIC   4:  1280x720    60.000 Hz  16:9    45.000 kHz  74.250 MHz
    VIC   2:   720x480    59.940 Hz   4:3    31.469 kHz  27.000 MHz
    VIC   3:   720x480    59.940 Hz  16:9    31.469 kHz  27.000 MHz
    VIC  17:   720x576    50.000 Hz   4:3    31.250 kHz  27.000 MHz
    VIC   1:   640x480    59.940 Hz   4:3    31.469 kHz  25.175 MHz
    VIC  18:   720x576    50.000 Hz  16:9    31.250 kHz  27.000 MHz
    VIC   6:  1440x480i   59.940 Hz   4:3    15.734 kHz  27.000 MHz
    VIC   7:  1440x480i   59.940 Hz  16:9    15.734 kHz  27.000 MHz
    VIC  21:  1440x576i   50.000 Hz   4:3    15.625 kHz  27.000 MHz
    VIC  22:  1440x576i   50.000 Hz  16:9    15.625 kHz  27.000 MHz
  Audio Data Block:
    Linear PCM:
      Max channels: 2
      Supported sample rates (kHz): 48 44.1 32
      Supported sample sizes (bits): 20 16
  Speaker Allocation Data Block:
    FL/FR - Front Left/Right
  Vendor-Specific Data Block (HDMI), OUI 00-0C-03:
    Source physical address: 1.0.0.0
    Maximum TMDS clock: 150 MHz
    Video latency: 3 ms
    Audio latency: 3 ms
    Interlaced video latency: 3 ms
    Interlaced audio latency: 3 ms
  Detailed Timing Descriptors:
    DTD 3:   720x480    59.940 Hz   3:2    31.469 kHz  27.000 MHz (476 mm x 268 mm)
                 Hfront   16 Hsync  62 Hback  60 Hpol N
                 Vfront    9 Vsync   6 Vback  30 Vpol N
    DTD 4:  1920x1080   60.000 Hz  16:9    67.500 kHz 148.500 MHz (476 mm x 268 mm)
                 Hfront   88 Hsync  44 Hback 148 Hpol P
                 Vfront    2 Vsync   5 Vback  38 Vpol P
    DTD 5:  1920x1080i  60.000 Hz  16:9    33.750 kHz  74.250 MHz (476 mm x 268 mm)
                 Hfront   88 Hsync  44 Hback 148 Hpol P
                 Vfront    2 Vsync   5 Vback  15 Vpol P Vfront +0.5 Odd Field
                 Vfront    2 Vsync   5 Vback  15 Vpol P Vback  +0.5 Even Field
    DTD 6:  1440x480i   59.940 Hz   3:1    15.734 kHz  27.000 MHz (476 mm x 268 mm)
                 Hfront   38 Hsync 124 Hback 114 Hpol N
                 Vfront    4 Vsync   3 Vback  15 Vpol N Vfront +0.5 Odd Field
                 Vfront    4 Vsync   3 Vback  15 Vpol N Vback  +0.5 Even Field
Checksum: 0x8f

----------------

Warnings:

Block 1, CTA-861 Extension Block:
  Missing VCDB, needed for Set Selectable RGB Quantization to avoid interop issues.
EDID:
  CTA-861: Multiple native progressive timings are defined.

Failures:

EDID:
  Base EDID: Some timings are out of range of the Monitor Ranges:
    Vertical Freq: 50.000 - 75.029 Hz (Monitor: 56.000 - 76.000 Hz)
    Horizontal Freq: 15.625 - 67.500 kHz (Monitor: 30.000 - 83.000 kHz)

EDID conformity: FAIL
