edid-decode (hex):

00 ff ff ff ff ff ff 00 0c 92 00 17 00 00 00 00
02 15 01 03 60 30 1b 78 ae b1 a5 a1 58 4f 95 26
16 50 54 a1 08 00 31 40 45 40 61 40 81 80 01 01
01 01 01 01 01 01 66 21 50 b0 51 00 1b 30 40 70
36 00 c4 fe 10 00 00 1e 00 00 00 fc 00 56 47 41
5f 4c 45 44 31 38 2e 35 22 0a 00 00 00 fd 00 38
3e 1e 51 09 00 0a 20 20 20 20 20 20 00 00 00 fc
00 4c 43 44 20 4d 4f 4e 49 54 4f 52 0a 20 00 14

----------------

Block 0, Base EDID:
  EDID Structure Version & Revision: 1.3
  Vendor & Product Identification:
    Manufacturer: CDR
    Model: 5888
    Made in: week 2 of 2011
  Basic Display Parameters & Features:
    Analog display
    Input voltage level: 0.7/0.7 V
    Maximum image size: 48 cm x 27 cm
    Gamma: 2.20
    DPMS levels: Standby Off
    RGB color display
    Default (sRGB) color space is primary color space
    First detailed timing is preferred timing
  Color Characteristics:
    Red  : 0.6308, 0.3466
    Green: 0.3085, 0.5830
    Blue : 0.1503, 0.0878
    White: 0.3134, 0.3291
  Established Timings I & II:
    IBM     :   720x400    70.082 Hz   9:5    31.467 kHz  28.320 MHz
    DMT 0x04:   640x480    59.940 Hz   4:3    31.469 kHz  25.175 MHz
    DMT 0x09:   800x600    60.317 Hz   4:3    37.879 kHz  40.000 MHz
    DMT 0x10:  1024x768    60.004 Hz   4:3    48.363 kHz  65.000 MHz
  Standard Timings:
    DMT 0x04:   640x480    59.940 Hz   4:3    31.469 kHz  25.175 MHz
    DMT 0x09:   800x600    60.317 Hz   4:3    37.879 kHz  40.000 MHz
    DMT 0x10:  1024x768    60.004 Hz   4:3    48.363 kHz  65.000 MHz
    DMT 0x23:  1280x1024   60.020 Hz   5:4    63.981 kHz 108.000 MHz
  Detailed Timing Descriptors:
    DTD 1:  1360x768    60.015 Hz  85:48   47.712 kHz  85.500 MHz (452 mm x 254 mm)
                 Hfront   64 Hsync 112 Hback 256 Hpol P
                 Vfront    3 Vsync   6 Vback  18 Vpol P
    Display Product Name: 'VGA_LED18.5"'
  Display Range Limits:
    Monitor ranges (GTF): 56-62 Hz V, 30-81 kHz H, max dotclock 90 MHz
    Display Product Name: 'LCD MONITOR'
Checksum: 0x14
