
EDID (hex):
00ffffffffffff0022f0e82601010101
1212010380261e8cee8b00a557499a25
125054adef8081800101010101010101
010101010101302a009851002a403070
13007c2c1100001e000000fd00324d18
530e000a202020202020000000fc0048
50204c313935300a20202020000000ff
00434e4338313850465a370a202000d8

Extracted contents:
header:          00 ff ff ff ff ff ff 00
serial number:   22 f0 e8 26 01 01 01 01 12 12
version:         01 03
basic params:    80 26 1e 8c ee
chroma info:     8b 00 a5 57 49 9a 25 12 50 54
established:     ad ef 80
standard:        81 80 01 01 01 01 01 01 01 01 01 01 01 01 01 01
descriptor 1:    30 2a 00 98 51 00 2a 40 30 70 13 00 7c 2c 11 00 00 1e
descriptor 2:    00 00 00 fd 00 32 4d 18 53 0e 00 0a 20 20 20 20 20 20
descriptor 3:    00 00 00 fc 00 48 50 20 4c 31 39 35 30 0a 20 20 20 20
descriptor 4:    00 00 00 ff 00 43 4e 43 38 31 38 50 46 5a 37 0a 20 20
extensions:      00
checksum:        d8

EDID version: 1.3
Manufacturer: HWP Model 26e8 Serial Number --
Made in week 18 of 2008
Digital display
Maximum image size: 38 cm x 30 cm
Gamma: 2.40
DPMS levels: Standby Suspend Off
RGB color display
Default (sRGB) color space is primary color space
First detailed timing is preferred timing
Display x,y Chromaticity:
  Red:   0.6464, 0.3398
  Green: 0.2871, 0.6044
  Blue:  0.1445, 0.0703
  White: 0.3125, 0.3281
Established timings supported:
  720x400@70Hz 9:5 HorFreq: 31469 Hz Clock: 28.320 MHz
  640x480@60Hz 4:3 HorFreq: 31469 Hz Clock: 25.175 MHz
  640x480@72Hz 4:3 HorFreq: 37900 Hz Clock: 31.500 MHz
  640x480@75Hz 4:3 HorFreq: 37500 Hz Clock: 31.500 MHz
  800x600@60Hz 4:3 HorFreq: 37900 Hz Clock: 40.000 MHz
  800x600@72Hz 4:3 HorFreq: 48100 Hz Clock: 50.000 MHz
  800x600@75Hz 4:3 HorFreq: 46900 Hz Clock: 49.500 MHz
  832x624@75Hz 4:3 HorFreq: 49726 Hz Clock: 57.284 MHz
  1024x768@60Hz 4:3 HorFreq: 48400 Hz Clock: 65.000 MHz
  1024x768@70Hz 4:3 HorFreq: 56500 Hz Clock: 75.000 MHz
  1024x768@75Hz 4:3 HorFreq: 60000 Hz Clock: 78.750 MHz
  1280x1024@75Hz 5:4 HorFreq: 80000 Hz Clock: 135.000 MHz
  1152x870@75Hz 192:145 HorFreq: 67500 Hz Clock: 108.000 MHz
Standard timings supported:
  1280x1024@60Hz 5:4 HorFreq: 64000 Hz Clock: 108.000 MHz
Detailed mode: Clock 108.000 MHz, 380 mm x 300 mm
               1280 1328 1440 1688 hborder 0
               1024 1025 1028 1066 vborder 0
               +hsync +vsync 
               VertFreq: 60 Hz, HorFreq: 63981 Hz
Monitor ranges (GTF): 50-77Hz V, 24-83kHz H, max dotclock 140MHz
Monitor name: HP L1950
Serial number: --
Checksum: 0xd8 (valid)
EDID block does NOT conform to EDID 1.3!
	sRGB is signaled, but the chromaticities do not match


