edid-decode (hex):

00 ff ff ff ff ff ff 00 39 e4 01 00 01 00 00 00
1e 15 01 03 0a 33 1d 78 ef ee 91 a3 54 4c 99 26
0f 50 54 ef ef 80 81 c0 a9 c0 d1 c0 95 00 81 40
81 80 90 40 a9 40 02 3a 80 18 71 38 2d 40 58 2c
45 00 fe 1f 11 00 00 18 00 00 00 fd 00 32 4b 3c
50 10 00 0a 20 20 20 20 20 20 00 00 00 10 00 0a
0a 0a 0a 0a 0a 0a 0a 0a 0a 0a 0a 0a 00 00 00 ff
00 4e 4f 44 30 30 30 35 0a 0a 0a 0a 0a 0a 01 c5

00 ff ff ff ff ff ff 00 39 e4 01 00 01 00 00 00
1e 15 01 03 0a 33 1d 78 ef ee 91 a3 54 4c 99 26
0f 50 54 ef ef 80 81 c0 a9 c0 d1 c0 95 00 81 40
81 80 90 40 a9 40 02 3a 80 18 71 38 2d 40 58 2c
45 00 fe 1f 11 00 00 18 00 00 00 fd 00 32 4b 3c
50 10 00 0a 20 20 20 20 20 20 00 00 00 10 00 0a
0a 0a 0a 0a 0a 0a 0a 0a 0a 0a 0a 0a 00 00 00 ff
00 4e 4f 44 30 30 30 35 0a 0a 0a 0a 0a 0a 01 c5

00 ff ff ff ff ff ff 00 39 e4 01 00 01 00 00 00
1e 15 01 03 0a 33 1d 78 ef ee 91 a3 54 4c 99 26
0f 50 54 ef ef 80 81 c0 a9 c0 d1 c0 95 00 81 40
81 80 90 40 a9 40 02 3a 80 18 71 38 2d 40 58 2c
45 00 fe 1f 11 00 00 18 00 00 00 fd 00 32 4b 3c
50 10 00 0a 20 20 20 20 20 20 00 00 00 10 00 0a
0a 0a 0a 0a 0a 0a 0a 0a 0a 0a 0a 0a 00 00 00 ff
00 4e 4f 44 30 30 30 35 0a 0a 0a 0a 0a 0a 01 c5

00 ff ff ff ff ff ff 00 39 e4 01 00 01 00 00 00
1e 15 01 03 0a 33 1d 78 ef ee 91 a3 54 4c 99 26
0f 50 54 ef ef 80 81 c0 a9 c0 d1 c0 95 00 81 40
81 80 90 40 a9 40 02 3a 80 18 71 38 2d 40 58 2c
45 00 fe 1f 11 00 00 18 00 00 00 fd 00 32 4b 3c
50 10 00 0a 20 20 20 20 20 20 00 00 00 10 00 0a
0a 0a 0a 0a 0a 0a 0a 0a 0a 0a 0a 0a 00 00 00 ff
00 4e 4f 44 30 30 30 35 0a 0a 0a 0a 0a 0a 01 c5

----------------

Block 0, Base EDID:
  EDID Structure Version & Revision: 1.3
  Vendor & Product Identification:
    Manufacturer: NOD
    Model: 1
    Serial Number: ...
    Made in: week 30 of 2011
  Basic Display Parameters & Features:
    Analog display
    Signal Level Standard: 0.700 : 0.300 : 1.000 V p-p
    Blank level equals black level
    Sync: Separate SyncOnGreen
    Maximum image size: 51 cm x 29 cm
    Gamma: 2.20
    DPMS levels: Standby Suspend Off
    RGB color display
    Default (sRGB) color space is primary color space
    First detailed timing is the preferred timing
    Supports GTF timings within operating range
  Color Characteristics:
    Red  : 0.6396, 0.3300
    Green: 0.2998, 0.5996
    Blue : 0.1503, 0.0595
    White: 0.3125, 0.3291
  Established Timings I & II:
    IBM     :   720x400    70.081663 Hz   9:5     31.467 kHz     28.320000 MHz
    IBM     :   720x400    87.849542 Hz   9:5     39.444 kHz     35.500000 MHz
    DMT 0x04:   640x480    59.940476 Hz   4:3     31.469 kHz     25.175000 MHz
    DMT 0x05:   640x480    72.808802 Hz   4:3     37.861 kHz     31.500000 MHz
    DMT 0x06:   640x480    75.000000 Hz   4:3     37.500 kHz     31.500000 MHz
    DMT 0x08:   800x600    56.250000 Hz   4:3     35.156 kHz     36.000000 MHz
    DMT 0x09:   800x600    60.316541 Hz   4:3     37.879 kHz     40.000000 MHz
    DMT 0x0a:   800x600    72.187572 Hz   4:3     48.077 kHz     50.000000 MHz
    DMT 0x0b:   800x600    75.000000 Hz   4:3     46.875 kHz     49.500000 MHz
    Apple   :   832x624    74.551266 Hz   4:3     49.726 kHz     57.284000 MHz
    DMT 0x10:  1024x768    60.003840 Hz   4:3     48.363 kHz     65.000000 MHz
    DMT 0x11:  1024x768    70.069359 Hz   4:3     56.476 kHz     75.000000 MHz
    DMT 0x12:  1024x768    75.028582 Hz   4:3     60.023 kHz     78.750000 MHz
    DMT 0x24:  1280x1024   75.024675 Hz   5:4     79.976 kHz    135.000000 MHz
    Apple   :  1152x870    75.061550 Hz 192:145   68.681 kHz    100.000000 MHz
  Standard Timings:
    DMT 0x55:  1280x720    60.000000 Hz  16:9     45.000 kHz     74.250000 MHz
    DMT 0x53:  1600x900    60.000000 Hz  16:9     60.000 kHz    108.000000 MHz (RB)
    DMT 0x52:  1920x1080   60.000000 Hz  16:9     67.500 kHz    148.500000 MHz
    DMT 0x2f:  1440x900    59.887445 Hz  16:10    55.935 kHz    106.500000 MHz
    DMT 0x20:  1280x960    60.000000 Hz   4:3     60.000 kHz    108.000000 MHz
    DMT 0x23:  1280x1024   60.019740 Hz   5:4     63.981 kHz    108.000000 MHz
    DMT 0x2a:  1400x1050   59.978442 Hz   4:3     65.317 kHz    121.750000 MHz
    DMT 0x33:  1600x1200   60.000000 Hz   4:3     75.000 kHz    162.000000 MHz
  Detailed Timing Descriptors:
    DTD 1:  1920x1080   60.000000 Hz  16:9     67.500 kHz    148.500000 MHz (510 mm x 287 mm)
                 Hfront   88 Hsync  44 Hback  148 Hpol N
                 Vfront    4 Vsync   5 Vback   36 Vpol N
    Display Range Limits:
      Monitor ranges (GTF): 50-75 Hz V, 60-80 kHz H, max dotclock 160 MHz
    Dummy Descriptor:
    Display Product Serial Number: ...
  Extension blocks: 1
Checksum: 0xc5

----------------

Block 1, Unknown EDID Extension Block 0x00:
  00 ff ff ff ff ff ff 00 39 e4 01 00 01 00 00 00 '........9.......'
  1e 15 01 03 0a 33 1d 78 ef ee 91 a3 54 4c 99 26 '.....3.x....TL.&'
  0f 50 54 ef ef 80 81 c0 a9 c0 d1 c0 95 00 81 40 '.PT............@'
  81 80 90 40 a9 40 02 3a 80 18 71 38 2d 40 58 2c '...@.@.:..q8-@X,'
  45 00 fe 1f 11 00 00 18 00 00 00 fd 00 32 4b 3c 'E............2K<'
  50 10 00 0a 20 20 20 20 20 20 00 00 00 10 00 0a 'P...      ......'
  0a 0a 0a 0a 0a 0a 0a 0a 0a 0a 0a 0a 00 00 00 ff '................'
  00 4e 4f 44 30 30 30 35 0a 0a 0a 0a 0a 0a 01 c5 '.NOD0005........'
Checksum: 0xc5

----------------

Block 2, Unknown EDID Extension Block 0x00:
  00 ff ff ff ff ff ff 00 39 e4 01 00 01 00 00 00 '........9.......'
  1e 15 01 03 0a 33 1d 78 ef ee 91 a3 54 4c 99 26 '.....3.x....TL.&'
  0f 50 54 ef ef 80 81 c0 a9 c0 d1 c0 95 00 81 40 '.PT............@'
  81 80 90 40 a9 40 02 3a 80 18 71 38 2d 40 58 2c '...@.@.:..q8-@X,'
  45 00 fe 1f 11 00 00 18 00 00 00 fd 00 32 4b 3c 'E............2K<'
  50 10 00 0a 20 20 20 20 20 20 00 00 00 10 00 0a 'P...      ......'
  0a 0a 0a 0a 0a 0a 0a 0a 0a 0a 0a 0a 00 00 00 ff '................'
  00 4e 4f 44 30 30 30 35 0a 0a 0a 0a 0a 0a 01 c5 '.NOD0005........'
Checksum: 0xc5

----------------

Block 3, Unknown EDID Extension Block 0x00:
  00 ff ff ff ff ff ff 00 39 e4 01 00 01 00 00 00 '........9.......'
  1e 15 01 03 0a 33 1d 78 ef ee 91 a3 54 4c 99 26 '.....3.x....TL.&'
  0f 50 54 ef ef 80 81 c0 a9 c0 d1 c0 95 00 81 40 '.PT............@'
  81 80 90 40 a9 40 02 3a 80 18 71 38 2d 40 58 2c '...@.@.:..q8-@X,'
  45 00 fe 1f 11 00 00 18 00 00 00 fd 00 32 4b 3c 'E............2K<'
  50 10 00 0a 20 20 20 20 20 20 00 00 00 10 00 0a 'P...      ......'
  0a 0a 0a 0a 0a 0a 0a 0a 0a 0a 0a 0a 00 00 00 ff '................'
  00 4e 4f 44 30 30 30 35 0a 0a 0a 0a 0a 0a 01 c5 '.NOD0005........'
Checksum: 0xc5

----------------

Warnings:

Block 0, Base EDID:
  Detailed Timing Descriptor #1: DTD is similar but not identical to VIC 16.

Failures:

Block 0, Base EDID:
  Dummy Descriptor: Dummy block filled with garbage.
  Display Product Serial Number: ...
  Missing Display Product Name.
Block 1, Base EDID:
  Unknown Extension Block.
Block 2, Base EDID:
  Unknown Extension Block.
Block 3, Base EDID:
  Unknown Extension Block.
EDID:
  Base EDID: Some timings are out of range of the Monitor Ranges:
    Vertical Freq: 56.250 - 87.850 Hz (Monitor: 50.000 - 75.000 Hz)
    Horizontal Freq: 31.466 - 79.976 kHz (Monitor: 60.000 - 80.000 kHz)
    Maximum Clock: 162.000 MHz (Monitor: 160.000 MHz)
  Base EDID: EDID specified 1 extension block(s), but found 3 extension block(s).
  Base EDID: EDID 1.3 requires a Block Map Extension in Block 1 if there are more than 2 blocks in the EDID.

EDID conformity: FAIL
