
EDID (hex):
00ffffffffffff0015c3842301010101
12190104a5342178e2f915a354509e27
125054a10800a94081808140b30081c0
010101010101283c80a070b023403020
360007442100001a000000ff00343231
36333034350a20202020000000fd003b
3d1f4c11000a202020202020000000fc
00455632343336570a20202020200189
020311c0440403020123091f07830100
00011d007251d01e206e285500074421
00001e8c0ad08a20e02d10103e960007
44210000188c0ad08a20e02d10103e96
00074421000018d50980a020e02d1010
60a20007442100001800000000000000
00000000000000000000000000000000
000000000000000000000000000000a7

edid-decode (hex):

00 ff ff ff ff ff ff 00 15 c3 84 23 01 01 01 01
12 19 01 04 a5 34 21 78 e2 f9 15 a3 54 50 9e 27
12 50 54 a1 08 00 a9 40 81 80 81 40 b3 00 81 c0
01 01 01 01 01 01 28 3c 80 a0 70 b0 23 40 30 20
36 00 07 44 21 00 00 1a 00 00 00 ff 00 34 32 31
36 33 30 34 35 0a 20 20 20 20 00 00 00 fd 00 3b
3d 1f 4c 11 00 0a 20 20 20 20 20 20 00 00 00 fc
00 45 56 32 34 33 36 57 0a 20 20 20 20 20 01 89

02 03 11 c0 44 04 03 02 01 23 09 1f 07 83 01 00
00 01 1d 00 72 51 d0 1e 20 6e 28 55 00 07 44 21
00 00 1e 8c 0a d0 8a 20 e0 2d 10 10 3e 96 00 07
44 21 00 00 18 8c 0a d0 8a 20 e0 2d 10 10 3e 96
00 07 44 21 00 00 18 d5 09 80 a0 20 e0 2d 10 10
60 a2 00 07 44 21 00 00 18 00 00 00 00 00 00 00
00 00 00 00 00 00 00 00 00 00 00 00 00 00 00 00
00 00 00 00 00 00 00 00 00 00 00 00 00 00 00 a7

----------------

Block 0, Base EDID:
  EDID Structure Version & Revision: 1.4
  Vendor & Product Identification:
    Manufacturer: ENC
    Model: 9092
    Serial Number: 16843009
    Made in: week 18 of 2015
  Basic Display Parameters & Features:
    Digital display
    Bits per primary color channel: 8
    DisplayPort interface
    Maximum image size: 52 cm x 33 cm
    Gamma: 2.20
    DPMS levels: Standby Suspend Off
    Supported color formats: RGB 4:4:4
    First detailed timing includes the native pixel format and preferred refresh rate
  Color Characteristics:
    Red  : 0.6396, 0.3310
    Green: 0.3144, 0.6181
    Blue : 0.1523, 0.0712
    White: 0.3134, 0.3291
  Established Timings I & II:
    IBM     :   720x400    70.081663 Hz   9:5     31.467 kHz     28.320000 MHz
    DMT 0x04:   640x480    59.940476 Hz   4:3     31.469 kHz     25.175000 MHz
    DMT 0x09:   800x600    60.316541 Hz   4:3     37.879 kHz     40.000000 MHz
    DMT 0x10:  1024x768    60.003840 Hz   4:3     48.363 kHz     65.000000 MHz
  Standard Timings:
    DMT 0x33:  1600x1200   60.000000 Hz   4:3     75.000 kHz    162.000000 MHz
    DMT 0x23:  1280x1024   60.019740 Hz   5:4     63.981 kHz    108.000000 MHz
    DMT 0x20:  1280x960    60.000000 Hz   4:3     60.000 kHz    108.000000 MHz
    DMT 0x3a:  1680x1050   59.954250 Hz  16:10    65.290 kHz    146.250000 MHz
    DMT 0x55:  1280x720    60.000000 Hz  16:9     45.000 kHz     74.250000 MHz
  Detailed Timing Descriptors:
    DTD 1:  1920x1200   59.950171 Hz  16:10    74.038 kHz    154.000000 MHz (519 mm x 324 mm)
                 Hfront   48 Hsync  32 Hback   80 Hpol P
                 Vfront    3 Vsync   6 Vback   26 Vpol N
    Display Product Serial Number: '42163045'
    Display Range Limits:
      Monitor ranges (GTF): 59-61 Hz V, 31-76 kHz H, max dotclock 170 MHz
    Display Product Name: 'EV2436W'
  Extension blocks: 1
Checksum: 0x89

----------------

Block 1, CTA-861 Extension Block:
  Revision: 3
  Underscans IT Video Formats by default
  Basic audio support
  Native detailed modes: 0
  Video Data Block:
    VIC   4:  1280x720    60.000000 Hz  16:9     45.000 kHz     74.250000 MHz
    VIC   3:   720x480    59.940060 Hz  16:9     31.469 kHz     27.000000 MHz
    VIC   2:   720x480    59.940060 Hz   4:3     31.469 kHz     27.000000 MHz
    VIC   1:   640x480    59.940476 Hz   4:3     31.469 kHz     25.175000 MHz
  Audio Data Block:
    Linear PCM:
      Max channels: 2
      Supported sample rates (kHz): 96 88.2 48 44.1 32
      Supported sample sizes (bits): 24 20 16
  Speaker Allocation Data Block:
    FL/FR - Front Left/Right
  Detailed Timing Descriptors:
    DTD 2:  1280x720    60.000000 Hz  16:9     45.000 kHz     74.250000 MHz (519 mm x 324 mm)
                 Hfront  110 Hsync  40 Hback  220 Hpol P
                 Vfront    5 Vsync   5 Vback   20 Vpol P
    DTD 3:   720x480    59.940060 Hz   3:2     31.469 kHz     27.000000 MHz (519 mm x 324 mm)
                 Hfront   16 Hsync  62 Hback   60 Hpol N
                 Vfront    9 Vsync   6 Vback   30 Vpol N
    DTD 4:   720x480    59.940060 Hz   3:2     31.469 kHz     27.000000 MHz (519 mm x 324 mm)
                 Hfront   16 Hsync  62 Hback   60 Hpol N
                 Vfront    9 Vsync   6 Vback   30 Vpol N
    DTD 5:   640x480    59.928571 Hz   4:3     31.462 kHz     25.170000 MHz (519 mm x 324 mm)
                 Hfront   16 Hsync  96 Hback   48 Hpol N
                 Vfront   10 Vsync   2 Vback   33 Vpol N
Checksum: 0xa7  Unused space in Extension Block: 38 bytes
