
EDID (hex):
00ffffffffffff000e96010be9030000
0a190103684627780a1990a755469824
10494ba1090081800101010101010101
010101010101662156aa51001e30468f
3300ba892100001e011d007251d01b20
6e285500ba892100001e000000fc0043
54560a202020202020202020000000fd
0038460e5b0d000a2020202020200011

Extracted contents:
header:          00 ff ff ff ff ff ff 00
serial number:   0e 96 01 0b e9 03 00 00 0a 19
version:         01 03
basic params:    68 46 27 78 0a
chroma info:     19 90 a7 55 46 98 24 10 49 4b
established:     a1 09 00
standard:        81 80 01 01 01 01 01 01 01 01 01 01 01 01 01 01
descriptor 1:    66 21 56 aa 51 00 1e 30 46 8f 33 00 ba 89 21 00 00 1e
descriptor 2:    01 1d 00 72 51 d0 1b 20 6e 28 55 00 ba 89 21 00 00 1e
descriptor 3:    00 00 00 fc 00 43 54 56 0a 20 20 20 20 20 20 20 20 20
descriptor 4:    00 00 00 fd 00 38 46 0e 5b 0d 00 0a 20 20 20 20 20 20
extensions:      00
checksum:        11

EDID version: 1.3
Manufacturer: CTV Model b01 Serial Number --
Made in week 10 of 2015
Analog display, Input voltage level: 0.7/0.7 V
Sync: Separate 
Maximum image size: 70 cm x 39 cm
Gamma: 2.20
RGB color display
First detailed timing is preferred timing
Display x,y Chromaticity:
  Red:   0.6523, 0.3330
  Green: 0.2753, 0.5947
  Blue:  0.1425, 0.0634
  White: 0.2851, 0.2929
Established timings supported:
  720x400@70Hz 9:5 HorFreq: 31469 Hz Clock: 28.320 MHz
  640x480@60Hz 4:3 HorFreq: 31469 Hz Clock: 25.175 MHz
  800x600@60Hz 4:3 HorFreq: 37900 Hz Clock: 40.000 MHz
  1024x768@60Hz 4:3 HorFreq: 48400 Hz Clock: 65.000 MHz
  1280x1024@75Hz 5:4 HorFreq: 80000 Hz Clock: 135.000 MHz
Standard timings supported:
  1280x1024@60Hz 5:4 HorFreq: 64000 Hz Clock: 108.000 MHz
Detailed mode: Clock 85.500 MHz, 698 mm x 393 mm
               1366 1436 1579 1792 hborder 0
                768  771  774  798 vborder 0
               +hsync +vsync 
               VertFreq: 59 Hz, HorFreq: 47712 Hz
Detailed mode: Clock 74.250 MHz, 698 mm x 393 mm
               1280 1390 1430 1650 hborder 0
                720  725  730  747 vborder 0
               +hsync +vsync 
               VertFreq: 60 Hz, HorFreq: 45000 Hz
Monitor name: CTV
Monitor ranges (GTF): 56-70Hz V, 14-91kHz H, max dotclock 130MHz
Checksum: 0x11 (valid)
One or more of the timings is out of range of the Monitor Ranges:
  Vertical Freq: 59 - 75 Hz
  Horizontal Freq: 31469 - 80000 Hz
  Maximum Clock: 135.000 MHz
