edid-decode (hex):

00 ff ff ff ff ff ff 00 09 e5 14 14 00 00 00 00
18 19 01 04 a5 35 1e 78 06 d7 80 a6 56 4a 9e 24
0f 50 54 00 00 00 01 01 01 01 01 01 01 01 01 01
01 01 01 01 01 01 4d d0 00 a0 f0 70 3e 80 30 20
35 00 0f 28 21 00 00 18 00 00 00 10 00 00 00 00
00 00 00 00 00 00 00 00 00 00 00 00 00 10 00 47
44 52 47 33 14 4d 56 32 33 38 51 4d 00 00 00 00
00 4c 51 31 35 36 44 31 4a 58 31 31 0a 20 00 0d

----------------

Block 0, Base EDID:
  EDID Structure Version & Revision: 1.4
  Vendor & Product Identification:
    Manufacturer: BOE
    Model: 5140
    Made in: week 24 of 2015
  Basic Display Parameters & Features:
    Digital display
    Bits per primary color channel: 8
    DisplayPort interface
    Maximum image size: 53 cm x 30 cm
    Gamma: 2.20
    Supported color formats: RGB 4:4:4
    Default (sRGB) color space is primary color space
    First detailed timing includes the native pixel format and preferred refresh rate
  Color Characteristics:
    Red  : 0.6513, 0.3369
    Green: 0.2900, 0.6201
    Blue : 0.1425, 0.0585
    White: 0.3125, 0.3281
  Established Timings I & II: none
  Standard Timings: none
  Detailed Timing Descriptors:
    DTD 1:  3840x2160   59.996625 Hz  16:9    133.312 kHz    533.250000 MHz (527 mm x 296 mm)
                 Hfront   48 Hsync  32 Hback   80 Hpol N
                 Vfront    3 Vsync   5 Vback   54 Vpol N
    Dummy Descriptor:
    Dummy Descriptor:
    Manufacturer-Specified Display Descriptor (0x00): 00 00 00 4c 51 31 35 36 44 31 4a 58 31 31 0a 20 '...LQ156D1JX11. '
Checksum: 0x0d

----------------

Failures:

Block 0, Base EDID:
  Basic Display Parameters & Features: sRGB is signaled, but the chromaticities do not match.
  Dummy Descriptor: Dummy block filled with garbage.
  Missing Display Product Name.

EDID conformity: FAIL
