edid-decode (hex):

00 ff ff ff ff ff ff 00 06 10 84 9c 00 00 00 00
00 12 01 03 80 21 15 78 0a 50 c5 98 58 52 8e 27
25 50 54 00 00 00 01 01 01 01 01 01 01 01 01 01
01 01 01 01 01 01 ab 22 a0 a0 50 84 1a 30 30 20
36 00 4b cf 10 00 00 18 00 00 00 01 00 06 10 30
00 00 00 00 00 00 00 00 0a 20 00 00 00 fe 00 4c
50 31 35 34 57 50 33 2d 54 4c 41 31 00 00 00 fe
00 43 6f 6c 6f 72 20 4c 43 44 0a 20 20 20 00 92

----------------

Block 0, Base EDID:
  EDID Structure Version & Revision: 1.3
  Vendor & Product Identification:
    Manufacturer: APP
    Model: 40068
    Made in: 2008
  Basic Display Parameters & Features:
    Digital display
    Maximum image size: 33 cm x 21 cm
    Gamma: 2.20
    RGB color display
    First detailed timing is the preferred timing
  Color Characteristics:
    Red  : 0.5947, 0.3447
    Green: 0.3203, 0.5546
    Blue : 0.1552, 0.1445
    White: 0.3134, 0.3291
  Established Timings I & II: none
  Standard Timings: none
  Detailed Timing Descriptors:
    DTD 1:  1440x900    59.901 Hz   8:5    55.469 kHz  88.750 MHz (331 mm x 207 mm)
                 Hfront   48 Hsync  32 Hback  80 Hpol N
                 Vfront    3 Vsync   6 Vback  17 Vpol N
    Manufacturer-Specified Display Descriptor (0x01): 00 01 00 06 10 30 00 00 00 00 00 00 00 00 0a 20 '.....0......... '
    Alphanumeric Data String: 'LP154WP3-TLA1'
    Alphanumeric Data String: 'Color LCD'
Checksum: 0x92

----------------

Failures:

Block 0, Base EDID:
  Missing Display Product Name.
  Missing Display Range Limits Descriptor.

EDID conformity: FAIL
