edid-decode (hex):

00 ff ff ff ff ff ff 00 09 d1 c9 78 45 54 00 00
34 16 01 03 0e 2f 1e 78 2e 3c f5 a4 55 4c 9b 25
0e 50 54 a5 6b 80 b3 00 95 00 81 00 81 c0 81 80
01 01 01 01 01 01 21 39 90 30 62 1a 27 40 68 b0
36 00 da 28 11 00 00 1c 00 00 00 fd 00 32 4c 1e
53 11 00 0a 20 20 20 20 20 20 00 00 00 fc 00 42
65 6e 51 20 47 4c 32 32 35 31 0a 20 00 00 00 ff
00 52 43 43 31 32 36 36 31 30 31 39 0a 20 00 95

----------------

Block 0, Base EDID:
  EDID Structure Version & Revision: 1.3
  Vendor & Product Identification:
    Manufacturer: BNQ
    Model: 30921
    Serial Number: ...
    Made in: week 52 of 2012
  Basic Display Parameters & Features:
    Analog display
    Input voltage level: 0.7/0.3 V
    Blank level equals black level
    Sync: Separate Composite SyncOnGreen
    Maximum image size: 47 cm x 30 cm
    Gamma: 2.20
    DPMS levels: Off
    RGB color display
    Default (sRGB) color space is primary color space
    First detailed timing is the preferred timing
  Color Characteristics:
    Red  : 0.6406, 0.3349
    Green: 0.2998, 0.6054
    Blue : 0.1474, 0.0576
    White: 0.3134, 0.3291
  Established Timings I & II:
    IBM     :   720x400    70.082 Hz   9:5    31.467 kHz  28.320 MHz
    DMT 0x04:   640x480    59.940 Hz   4:3    31.469 kHz  25.175 MHz
    DMT 0x06:   640x480    75.000 Hz   4:3    37.500 kHz  31.500 MHz
    DMT 0x09:   800x600    60.317 Hz   4:3    37.879 kHz  40.000 MHz
    DMT 0x0b:   800x600    75.000 Hz   4:3    46.875 kHz  49.500 MHz
    Apple   :   832x624    74.551 Hz   4:3    49.726 kHz  57.284 MHz
    DMT 0x10:  1024x768    60.004 Hz   4:3    48.363 kHz  65.000 MHz
    DMT 0x12:  1024x768    75.029 Hz   4:3    60.023 kHz  78.750 MHz
    DMT 0x24:  1280x1024   75.025 Hz   5:4    79.976 kHz 135.000 MHz
    Apple   :  1152x870    75.062 Hz 192:145  68.681 kHz 100.000 MHz
  Standard Timings:
    DMT 0x3a:  1680x1050   59.954 Hz  16:10   65.290 kHz 146.250 MHz
    DMT 0x2f:  1440x900    59.887 Hz  16:10   55.935 kHz 106.500 MHz
    DMT 0x1c:  1280x800    59.810 Hz  16:10   49.702 kHz  83.500 MHz
    DMT 0x55:  1280x720    60.000 Hz  16:9    45.000 kHz  74.250 MHz
    DMT 0x23:  1280x1024   60.020 Hz   5:4    63.981 kHz 108.000 MHz
  Detailed Timing Descriptors:
    DTD 1:  1680x1050   59.954 Hz   8:5    65.290 kHz 146.250 MHz (474 mm x 296 mm)
                 Hfront  104 Hsync 176 Hback 280 Hpol N
                 Vfront    3 Vsync   6 Vback  30 Vpol P
  Display Range Limits:
    Monitor ranges (GTF): 50-76 Hz V, 30-83 kHz H, max dotclock 170 MHz
    Display Product Name: 'BenQ GL2251'
    Display Product Serial Number: ...
Checksum: 0x95

----------------

Failures:

Block 0, Base EDID:
  Basic Display Parameters & Features: sRGB is signaled, but the chromaticities do not match.

EDID conformity: FAIL
