edid-decode (hex):

00 ff ff ff ff ff ff 00 04 69 20 e3 01 01 01 01
1c 14 01 03 80 34 1d 78 ee ff f5 a5 56 49 9d 24
16 50 54 00 00 00 d1 c0 01 01 01 01 01 01 01 01
01 01 01 01 01 01 fc 3a 80 18 71 38 2d 40 58 2c
45 00 30 e4 10 00 00 1e 00 00 00 fd 00 3b 3d 01
a0 10 00 0a 20 20 20 20 20 20 00 00 00 fc 00 45
54 32 32 33 30 41 0a 20 20 20 20 20 00 00 00 ff
00 30 30 30 30 30 30 30 30 30 31 0a 20 20 00 85

----------------

Block 0, Base EDID:
  EDID Structure Version & Revision: 1.3
  Vendor & Product Identification:
    Manufacturer: ACI
    Model: 58144
    Serial Number: ...
    Made in: week 28 of 2010
  Basic Display Parameters & Features:
    Digital display
    Maximum image size: 52 cm x 29 cm
    Gamma: 2.20
    DPMS levels: Standby Suspend Off
    RGB color display
    Default (sRGB) color space is primary color space
    First detailed timing is the preferred timing
  Color Characteristics:
    Red  : 0.6474, 0.3388
    Green: 0.2880, 0.6162
    Blue : 0.1435, 0.0888
    White: 0.3134, 0.3291
  Established Timings I & II: none
  Standard Timings:
    DMT 0x52:  1920x1080   60.000 Hz  16:9    67.500 kHz 148.500 MHz
  Detailed Timing Descriptors:
    DTD 1:  1920x1080   61.010 Hz  16:9    68.636 kHz 151.000 MHz (304 mm x 228 mm)
                 Hfront   88 Hsync  44 Hback 148 Hpol P
                 Vfront    4 Vsync   5 Vback  36 Vpol P
  Display Range Limits:
    Monitor ranges (GTF): 59-61 Hz V, 1-160 kHz H, max dotclock 160 MHz
    Display Product Name: 'ET2230A'
    Display Product Serial Number: ...
Checksum: 0x85

----------------

Failures:

Block 0, Base EDID:
  Basic Display Parameters & Features: sRGB is signaled, but the chromaticities do not match.
  Detailed Timing Descriptor #1: Mismatch of image size 304x228 mm vs display size 520x290 mm.

EDID conformity: FAIL
