
EDID (hex):
00ffffffffffff0004722702e53a5014
2d15010368301b782ec585a459499a24
125054bfef8081c08140714f81808100
010101010101023a801871382d40582c
4500dd0c1100001e000000fd00374b1e
5010000a202020202020000000ff004c
524e3038303032343232300a000000fc
0041636572204732313548560a200042

Extracted contents:
header:          00 ff ff ff ff ff ff 00
serial number:   04 72 27 02 e5 3a 50 14 2d 15
version:         01 03
basic params:    68 30 1b 78 2e
chroma info:     c5 85 a4 59 49 9a 24 12 50 54
established:     bf ef 80
standard:        81 c0 81 40 71 4f 81 80 81 00 01 01 01 01 01 01
descriptor 1:    02 3a 80 18 71 38 2d 40 58 2c 45 00 dd 0c 11 00 00 1e
descriptor 2:    00 00 00 fd 00 37 4b 1e 50 10 00 0a 20 20 20 20 20 20
descriptor 3:    00 00 00 ff 00 4c 52 4e 30 38 30 30 32 34 32 32 30 0a
descriptor 4:    00 00 00 fc 00 41 63 65 72 20 47 32 31 35 48 56 0a 20
extensions:      00
checksum:        42

EDID version: 1.3
Manufacturer: ACR Model 227 Serial Number --
Made in week 45 of 2011
Analog display, Input voltage level: 0.7/0.7 V
Sync: Separate 
Maximum image size: 48 cm x 27 cm
Gamma: 2.20
DPMS levels: Off
RGB color display
Default (sRGB) color space is primary color space
First detailed timing is preferred timing
Display x,y Chromaticity:
  Red:   0.6435, 0.3476
  Green: 0.2861, 0.6025
  Blue:  0.1425, 0.0703
  White: 0.3134, 0.3291
Established timings supported:
  720x400@70Hz 9:5 HorFreq: 31469 Hz Clock: 28.320 MHz
  640x480@60Hz 4:3 HorFreq: 31469 Hz Clock: 25.175 MHz
  640x480@67Hz 4:3 HorFreq: 35000 Hz Clock: 30.240 MHz
  640x480@72Hz 4:3 HorFreq: 37900 Hz Clock: 31.500 MHz
  640x480@75Hz 4:3 HorFreq: 37500 Hz Clock: 31.500 MHz
  800x600@56Hz 4:3 HorFreq: 35200 Hz Clock: 36.000 MHz
  800x600@60Hz 4:3 HorFreq: 37900 Hz Clock: 40.000 MHz
  800x600@72Hz 4:3 HorFreq: 48100 Hz Clock: 50.000 MHz
  800x600@75Hz 4:3 HorFreq: 46900 Hz Clock: 49.500 MHz
  832x624@75Hz 4:3 HorFreq: 49726 Hz Clock: 57.284 MHz
  1024x768@60Hz 4:3 HorFreq: 48400 Hz Clock: 65.000 MHz
  1024x768@70Hz 4:3 HorFreq: 56500 Hz Clock: 75.000 MHz
  1024x768@75Hz 4:3 HorFreq: 60000 Hz Clock: 78.750 MHz
  1280x1024@75Hz 5:4 HorFreq: 80000 Hz Clock: 135.000 MHz
  1152x870@75Hz 192:145 HorFreq: 67500 Hz Clock: 108.000 MHz
Standard timings supported:
  1280x720@60Hz 16:9
  1280x960@60Hz 4:3 HorFreq: 60000 Hz Clock: 108.000 MHz
  1152x864@75Hz 4:3 HorFreq: 67500 Hz Clock: 108.000 MHz
  1280x1024@60Hz 5:4 HorFreq: 64000 Hz Clock: 108.000 MHz
  1280x800@60Hz 16:10
Detailed mode: Clock 148.500 MHz, 477 mm x 268 mm
               1920 2008 2052 2200 hborder 0
               1080 1084 1089 1125 vborder 0
               +hsync +vsync 
               VertFreq: 60 Hz, HorFreq: 67500 Hz
Monitor ranges (GTF): 55-75Hz V, 30-80kHz H, max dotclock 160MHz
Serial number: --
Monitor name: Acer G215HV
Checksum: 0x42 (valid)
EDID block does NOT conform to EDID 1.3!
	sRGB is signaled, but the chromaticities do not match
