edid-decode (hex):

00 ff ff ff ff ff ff 00 06 af b2 45 00 00 00 00
08 22 01 04 a5 1e 13 78 03 3c 85 a9 53 4b a2 26
0e 50 54 00 00 00 01 01 01 01 01 01 01 01 01 01
01 01 01 01 01 01 f4 3c 80 b8 70 b0 24 40 10 10
3e 00 2d bc 10 00 00 1a c3 30 80 b8 70 b0 24 40
10 10 3e 00 2d bc 10 00 00 1a 00 00 00 fe 00 4b
46 56 36 43 80 42 31 34 30 55 41 4b 00 00 00 00
00 01 41 22 9e 00 10 00 00 0a 01 0a 20 20 00 ce

00 ff ff ff ff ff ff 00 06 af b2 45 00 00 00 00
08 22 01 04 a5 1e 13 78 03 3c 85 a9 53 4b a2 26
0e 50 54 00 00 00 01 01 01 01 01 01 01 01 01 01
01 01 01 01 01 01 f4 3c 80 b8 70 b0 24 40 10 10
3e 00 2d bc 10 00 00 1a c3 30 80 b8 70 b0 24 40
10 10 3e 00 2d bc 10 00 00 1a 00 00 00 fe 00 4b
46 56 36 43 80 42 31 34 30 55 41 4b 00 00 00 00
00 01 41 22 9e 00 10 00 00 0a 01 0a 20 20 00 ce

----------------

Block 0, Base EDID:
  EDID Structure Version & Revision: 1.4
  Vendor & Product Identification:
    Manufacturer: AUO
    Model: 17842
    Made in: week 8 of 2024
  Basic Display Parameters & Features:
    Digital display
    Bits per primary color channel: 8
    DisplayPort interface
    Maximum image size: 30 cm x 19 cm
    Gamma: 2.20
    Supported color formats: RGB 4:4:4
    First detailed timing includes the native pixel format and preferred refresh rate
    Display is continuous frequency
  Color Characteristics:
    Red  : 0.6601, 0.3271
    Green: 0.2958, 0.6328
    Blue : 0.1503, 0.0546
    White: 0.3134, 0.3291
  Established Timings I & II: none
  Standard Timings: none
  Detailed Timing Descriptors:
    DTD 1:  1920x1200   60.002830 Hz  16:10    74.163 kHz    156.040000 MHz (301 mm x 188 mm)
                 Hfront   16 Hsync  16 Hback  152 Hpol P
                 Vfront    3 Vsync  14 Vback   19 Vpol N
    DTD 2:  1920x1200   48.001495 Hz  16:10    59.330 kHz    124.830000 MHz (301 mm x 188 mm)
                 Hfront   16 Hsync  16 Hback  152 Hpol P
                 Vfront    3 Vsync  14 Vback   19 Vpol N
    Alphanumeric Data String: 'KFV6C'
    Manufacturer-Specified Display Descriptor (0x00): 00 00 00 01 41 22 9e 00 10 00 00 0a 01 0a 20 20 '....A"........  '
Checksum: 0xce

----------------

Block 1, Unknown EDID Extension Block 0x00:
  00 ff ff ff ff ff ff 00 06 af b2 45 00 00 00 00 '...........E....'
  08 22 01 04 a5 1e 13 78 03 3c 85 a9 53 4b a2 26 '.".....x.<..SK.&'
  0e 50 54 00 00 00 01 01 01 01 01 01 01 01 01 01 '.PT.............'
  01 01 01 01 01 01 f4 3c 80 b8 70 b0 24 40 10 10 '.......<..p.$@..'
  3e 00 2d bc 10 00 00 1a c3 30 80 b8 70 b0 24 40 '>.-......0..p.$@'
  10 10 3e 00 2d bc 10 00 00 1a 00 00 00 fe 00 4b '..>.-..........K'
  46 56 36 43 80 42 31 34 30 55 41 4b 00 00 00 00 'FV6C.B140UAK....'
  00 01 41 22 9e 00 10 00 00 0a 01 0a 20 20 00 ce '..A"........  ..'
Checksum: 0xce

----------------

Warnings:

Block 0, Base EDID:
  Missing Display Product Name.

Failures:

Block 0, Base EDID:
  Alphanumeric Data String: Non-printable character.
  Missing Display Range Limits Descriptor.
Block 1, Base EDID:
  Unknown Extension Block.
EDID:
  Base EDID: EDID specified 0 extension block(s), but found 1 extension block(s).

EDID conformity: FAIL
