edid-decode (hex):

00 ff ff ff ff ff ff 00 4e 14 d5 08 00 00 00 00
2f 1c 01 03 0e 2f 1c 78 2a 35 81 a6 56 48 9a 24
12 50 54 af cf 00 81 00 81 40 81 80 95 00 a9 40
b3 00 d1 c0 01 01 80 48 80 18 71 38 2d 40 58 2c
45 00 dd 0c 11 00 00 1e 79 2e 40 10 62 84 20 30
70 98 13 00 bb f9 10 00 00 1c 00 00 00 fd 00 38
4b 1e 5f 12 00 0a 20 20 20 20 20 20 00 00 00 fc
00 45 32 32 35 57 2d 31 39 32 30 0a 20 20 00 be

00 ff ff ff ff ff ff 00 4e 14 d5 08 00 00 00 00
2f 1c 01 03 0e 2f 1c 78 2a 35 81 a6 56 48 9a 24
12 50 54 af cf 00 81 00 81 40 81 80 95 00 a9 40
b3 00 d1 c0 01 01 80 48 80 18 71 38 2d 40 58 2c
45 00 dd 0c 11 00 00 1e 79 2e 40 10 62 84 20 30
70 98 13 00 bb f9 10 00 00 1c 00 00 00 fd 00 38
4b 1e 5f 12 00 0a 20 20 20 20 20 20 00 00 00 fc
00 45 32 32 35 57 2d 31 39 32 30 0a 20 20 00 be

----------------

Block 0, Base EDID:
  EDID Structure Version & Revision: 1.3
  Vendor & Product Identification:
    Manufacturer: SPT
    Model: 2261
    Made in: week 47 of 2018
  Basic Display Parameters & Features:
    Analog display
    Signal Level Standard: 0.700 : 0.300 : 1.000 V p-p
    Blank level equals black level
    Sync: Separate Composite SyncOnGreen
    Maximum image size: 47 cm x 28 cm
    Gamma: 2.20
    DPMS levels: Off
    RGB color display
    First detailed timing is the preferred timing
  Color Characteristics:
    Red  : 0.6484, 0.3388
    Green: 0.2822, 0.6025
    Blue : 0.1425, 0.0703
    White: 0.3125, 0.3291
  Established Timings I & II:
    IBM     :   720x400    70.081663 Hz   9:5     31.467 kHz     28.320000 MHz
    DMT 0x04:   640x480    59.940476 Hz   4:3     31.469 kHz     25.175000 MHz
    DMT 0x05:   640x480    72.808802 Hz   4:3     37.861 kHz     31.500000 MHz
    DMT 0x06:   640x480    75.000000 Hz   4:3     37.500 kHz     31.500000 MHz
    DMT 0x08:   800x600    56.250000 Hz   4:3     35.156 kHz     36.000000 MHz
    DMT 0x09:   800x600    60.316541 Hz   4:3     37.879 kHz     40.000000 MHz
    DMT 0x0a:   800x600    72.187572 Hz   4:3     48.077 kHz     50.000000 MHz
    DMT 0x0b:   800x600    75.000000 Hz   4:3     46.875 kHz     49.500000 MHz
    DMT 0x10:  1024x768    60.003840 Hz   4:3     48.363 kHz     65.000000 MHz
    DMT 0x11:  1024x768    70.069359 Hz   4:3     56.476 kHz     75.000000 MHz
    DMT 0x12:  1024x768    75.028582 Hz   4:3     60.023 kHz     78.750000 MHz
    DMT 0x24:  1280x1024   75.024675 Hz   5:4     79.976 kHz    135.000000 MHz
  Standard Timings:
    DMT 0x1c:  1280x800    59.810326 Hz  16:10    49.702 kHz     83.500000 MHz
    DMT 0x20:  1280x960    60.000000 Hz   4:3     60.000 kHz    108.000000 MHz
    DMT 0x23:  1280x1024   60.019740 Hz   5:4     63.981 kHz    108.000000 MHz
    DMT 0x2f:  1440x900    59.887445 Hz  16:10    55.935 kHz    106.500000 MHz
    DMT 0x33:  1600x1200   60.000000 Hz   4:3     75.000 kHz    162.000000 MHz
    DMT 0x3a:  1680x1050   59.954250 Hz  16:10    65.290 kHz    146.250000 MHz
    DMT 0x52:  1920x1080   60.000000 Hz  16:9     67.500 kHz    148.500000 MHz
  Detailed Timing Descriptors:
    DTD 1:  1920x1080   74.989899 Hz  16:9     84.364 kHz    185.600000 MHz (477 mm x 268 mm)
                 Hfront   88 Hsync  44 Hback  148 Hpol P
                 Vfront    4 Vsync   5 Vback   36 Vpol P
    DTD 2:  1600x900    59.986003 Hz  16:9     55.907 kHz    118.970000 MHz (443 mm x 249 mm)
                 Hfront  112 Hsync 152 Hback  264 Hpol N
                 Vfront    1 Vsync   3 Vback   28 Vpol P
    Display Range Limits:
      Monitor ranges (GTF): 56-75 Hz V, 30-95 kHz H, max dotclock 180 MHz
    Display Product Name: 'E225W-1920'
Checksum: 0xbe

----------------

Block 1, Unknown EDID Extension Block 0x00:
  00 ff ff ff ff ff ff 00 4e 14 d5 08 00 00 00 00 '........N.......'
  2f 1c 01 03 0e 2f 1c 78 2a 35 81 a6 56 48 9a 24 '/..../.x*5..VH.$'
  12 50 54 af cf 00 81 00 81 40 81 80 95 00 a9 40 '.PT......@.....@'
  b3 00 d1 c0 01 01 80 48 80 18 71 38 2d 40 58 2c '.......H..q8-@X,'
  45 00 dd 0c 11 00 00 1e 79 2e 40 10 62 84 20 30 'E.......y.@.b. 0'
  70 98 13 00 bb f9 10 00 00 1c 00 00 00 fd 00 38 'p..............8'
  4b 1e 5f 12 00 0a 20 20 20 20 20 20 00 00 00 fc 'K._...      ....'
  00 45 32 32 35 57 2d 31 39 32 30 0a 20 20 00 be '.E225W-1920.  ..'
Checksum: 0xbe

----------------

Warnings:

EDID:
  Base EDID: Some timings are out of range of the Monitor Ranges:
    Maximum Clock: 185.600 MHz (Monitor: 180.000 MHz)
    Could be due to a Monitor Range off-by-one rounding issue

Failures:

Block 0, Base EDID:
  Detailed Timing Descriptor #2: Mismatch of image size 443x249 mm vs display size 470x280 mm.
Block 1, Base EDID:
  Unknown Extension Block.
EDID:
  Base EDID: EDID specified 0 extension block(s), but found 1 extension block(s).

EDID conformity: FAIL
