
EDID (hex):
00ffffffffffff004c2d5e0e31373930
251e0104b57822783bcff5ae4f45a826
0e5054bfef80714f810081c081809500
a9c0b30001011eff0050f0384d400820
f80cac504100001a000000fd003090a7
a742010a202020202020000000fc0043
3439484739780a2020202020000000ff
00484e4b4e3930333738370a2020010e
02032ff149901f041303125a3f402309
070783010000e305c0006d1a0000020f
3090000473175a1ee6060501735a171a
6800a0f0381f4030203a00ac50410000
1a023a801871382d40582c4500ac5041
00001ef4b000a0f038354030203a00ac
504100001a74d600a0f038404030203a
00ac504100001a000000000000000077

edid-decode (hex):

00 ff ff ff ff ff ff 00 4c 2d 5e 0e 31 37 39 30
25 1e 01 04 b5 78 22 78 3b cf f5 ae 4f 45 a8 26
0e 50 54 bf ef 80 71 4f 81 00 81 c0 81 80 95 00
a9 c0 b3 00 01 01 1e ff 00 50 f0 38 4d 40 08 20
f8 0c ac 50 41 00 00 1a 00 00 00 fd 00 30 90 a7
a7 42 01 0a 20 20 20 20 20 20 00 00 00 fc 00 43
34 39 48 47 39 78 0a 20 20 20 20 20 00 00 00 ff
00 48 4e 4b 4e 39 30 33 37 38 37 0a 20 20 01 0e

02 03 2f f1 49 90 1f 04 13 03 12 5a 3f 40 23 09
07 07 83 01 00 00 e3 05 c0 00 6d 1a 00 00 02 0f
30 90 00 04 73 17 5a 1e e6 06 05 01 73 5a 17 1a
68 00 a0 f0 38 1f 40 30 20 3a 00 ac 50 41 00 00
1a 02 3a 80 18 71 38 2d 40 58 2c 45 00 ac 50 41
00 00 1e f4 b0 00 a0 f0 38 35 40 30 20 3a 00 ac
50 41 00 00 1a 74 d6 00 a0 f0 38 40 40 30 20 3a
00 ac 50 41 00 00 1a 00 00 00 00 00 00 00 00 77

----------------

Block 0, Base EDID:
  EDID Structure Version & Revision: 1.4
  Vendor & Product Identification:
    Manufacturer: SAM
    Model: 3678
    Serial Number: 809056049
    Made in: week 37 of 2020
  Basic Display Parameters & Features:
    Digital display
    Bits per primary color channel: 10
    DisplayPort interface
    Maximum image size: 120 cm x 34 cm
    Gamma: 2.20
    DPMS levels: Off
    Supported color formats: RGB 4:4:4, YCrCb 4:4:4, YCrCb 4:2:2
    First detailed timing includes the native pixel format and preferred refresh rate
    Display is continuous frequency
  Color Characteristics:
    Red  : 0.6826, 0.3085
    Green: 0.2724, 0.6591
    Blue : 0.1513, 0.0576
    White: 0.3134, 0.3291
  Established Timings I & II:
    IBM     :   720x400    70.081663 Hz   9:5     31.467 kHz     28.320000 MHz
    DMT 0x04:   640x480    59.940476 Hz   4:3     31.469 kHz     25.175000 MHz
    Apple   :   640x480    66.666667 Hz   4:3     35.000 kHz     30.240000 MHz
    DMT 0x05:   640x480    72.808802 Hz   4:3     37.861 kHz     31.500000 MHz
    DMT 0x06:   640x480    75.000000 Hz   4:3     37.500 kHz     31.500000 MHz
    DMT 0x08:   800x600    56.250000 Hz   4:3     35.156 kHz     36.000000 MHz
    DMT 0x09:   800x600    60.316541 Hz   4:3     37.879 kHz     40.000000 MHz
    DMT 0x0a:   800x600    72.187572 Hz   4:3     48.077 kHz     50.000000 MHz
    DMT 0x0b:   800x600    75.000000 Hz   4:3     46.875 kHz     49.500000 MHz
    Apple   :   832x624    74.551266 Hz   4:3     49.726 kHz     57.284000 MHz
    DMT 0x10:  1024x768    60.003840 Hz   4:3     48.363 kHz     65.000000 MHz
    DMT 0x11:  1024x768    70.069359 Hz   4:3     56.476 kHz     75.000000 MHz
    DMT 0x12:  1024x768    75.028582 Hz   4:3     60.023 kHz     78.750000 MHz
    DMT 0x24:  1280x1024   75.024675 Hz   5:4     79.976 kHz    135.000000 MHz
    Apple   :  1152x870    75.061550 Hz 192:145   68.681 kHz    100.000000 MHz
  Standard Timings:
    DMT 0x15:  1152x864    75.000000 Hz   4:3     67.500 kHz    108.000000 MHz
    DMT 0x1c:  1280x800    59.810326 Hz  16:10    49.702 kHz     83.500000 MHz
    DMT 0x55:  1280x720    60.000000 Hz  16:9     45.000 kHz     74.250000 MHz
    DMT 0x23:  1280x1024   60.019740 Hz   5:4     63.981 kHz    108.000000 MHz
    DMT 0x2f:  1440x900    59.887445 Hz  16:10    55.935 kHz    106.500000 MHz
    DMT 0x53:  1600x900    60.000000 Hz  16:9     60.000 kHz    108.000000 MHz (RB)
    DMT 0x3a:  1680x1050   59.954250 Hz  16:10    65.290 kHz    146.250000 MHz
  Detailed Timing Descriptors:
    DTD 1:  3840x1080  143.999259 Hz  32:9    166.607 kHz    653.100000 MHz (1196 mm x 336 mm)
                 Hfront    8 Hsync  32 Hback   40 Hpol P
                 Vfront   63 Vsync   8 Vback    6 Vpol N
    Display Range Limits:
      Monitor ranges (Bare Limits): 48-144 Hz V, 167-167 kHz H, max dotclock 660 MHz
    Display Product Name: 'C49HG9x'
    Display Product Serial Number: 'HNKN903787'
  Extension blocks: 1
Checksum: 0x0e

----------------

Block 1, CTA-861 Extension Block:
  Revision: 3
  Underscans IT Video Formats by default
  Basic audio support
  Supports YCbCr 4:4:4
  Supports YCbCr 4:2:2
  Native detailed modes: 1
  Video Data Block:
    VIC  16:  1920x1080   60.000000 Hz  16:9     67.500 kHz    148.500000 MHz (native)
    VIC  31:  1920x1080   50.000000 Hz  16:9     56.250 kHz    148.500000 MHz
    VIC   4:  1280x720    60.000000 Hz  16:9     45.000 kHz     74.250000 MHz
    VIC  19:  1280x720    50.000000 Hz  16:9     37.500 kHz     74.250000 MHz
    VIC   3:   720x480    59.940060 Hz  16:9     31.469 kHz     27.000000 MHz
    VIC  18:   720x576    50.000000 Hz  16:9     31.250 kHz     27.000000 MHz
    VIC  90:  2560x1080   60.000000 Hz  64:27    66.000 kHz    198.000000 MHz
    VIC  63:  1920x1080  120.000000 Hz  16:9    135.000 kHz    297.000000 MHz
    VIC  64:  1920x1080  100.000000 Hz  16:9    112.500 kHz    297.000000 MHz
  Audio Data Block:
    Linear PCM:
      Max channels: 2
      Supported sample rates (kHz): 48 44.1 32
      Supported sample sizes (bits): 24 20 16
  Speaker Allocation Data Block:
    FL/FR - Front Left/Right
  Colorimetry Data Block:
    BT2020YCC
    BT2020RGB
  Vendor-Specific Data Block (AMD), OUI 00-00-1A:
    Version: 2.15
    Minimum Refresh Rate: 48 Hz
    Maximum Refresh Rate: 144 Hz
    Flags 1.x: 0x00
    Flags 2.x: 0x04
    Maximum luminance: 115 (603.666 cd/m^2)
    Minimum luminance: 23 (0.049 cd/m^2)
    Maximum luminance (without local dimming): 90 (351.250 cd/m^2)
    Minimum luminance (without local dimming): 30 (0.049 cd/m^2)
  HDR Static Metadata Data Block:
    Electro optical transfer functions:
      Traditional gamma - SDR luminance range
      SMPTE ST2084
    Supported static metadata descriptors:
      Static metadata type 1
    Desired content max luminance: 115 (603.666 cd/m^2)
    Desired content max frame-average luminance: 90 (351.250 cd/m^2)
    Desired content min luminance: 23 (0.049 cd/m^2)
  Detailed Timing Descriptors:
    DTD 2:  3840x1080   59.968497 Hz  32:9     66.625 kHz    266.500000 MHz (1196 mm x 336 mm)
                 Hfront   48 Hsync  32 Hback   80 Hpol P
                 Vfront    3 Vsync  10 Vback   18 Vpol N
    DTD 3:  1920x1080   60.000000 Hz  16:9     67.500 kHz    148.500000 MHz (1196 mm x 336 mm)
                 Hfront   88 Hsync  44 Hback  148 Hpol P
                 Vfront    4 Vsync   5 Vback   36 Vpol P
    DTD 4:  3840x1080   99.955869 Hz  32:9    113.250 kHz    453.000000 MHz (1196 mm x 336 mm)
                 Hfront   48 Hsync  32 Hback   80 Hpol P
                 Vfront    3 Vsync  10 Vback   40 Vpol N
    DTD 5:  3840x1080  119.973776 Hz  32:9    137.250 kHz    549.000000 MHz (1196 mm x 336 mm)
                 Hfront   48 Hsync  32 Hback   80 Hpol P
                 Vfront    3 Vsync  10 Vback   51 Vpol N
Checksum: 0x77  Unused space in Extension Block: 8 bytes
