
EDID (hex):
00ffffffffffff004c2d5e0e30303030
27180104b57822783acff5ae4f45a826
0e5054bfef80714f810081c081809500
a9c0b3000101f4b000a0f03835403020
3a00ac504100001a000000fd0032641e
782e000a202020202020000000fc0043
3439484739780a2020202020000000ff
004831414b3530303030300a20200145
02031ff147901f041303125a23090707
83010000e305c000e6060501735a171a
6800a0f0381f4030203a00ac50410000
1a023a801871382d40582c4500ac5041
00001e00000000000000000000000000
00000000000000000000000000000000
00000000000000000000000000000000
0000000000000000000000000000009b

Extracted contents:
header:          00 ff ff ff ff ff ff 00
serial number:   4c 2d 5e 0e 30 30 30 30 27 18
version:         01 04
basic params:    b5 78 22 78 3a
chroma info:     cf f5 ae 4f 45 a8 26 0e 50 54
established:     bf ef 80
standard:        71 4f 81 00 81 c0 81 80 95 00 a9 c0 b3 00 01 01
descriptor 1:    f4 b0 00 a0 f0 38 35 40 30 20 3a 00 ac 50 41 00 00 1a
descriptor 2:    00 00 00 fd 00 32 64 1e 78 2e 00 0a 20 20 20 20 20 20
descriptor 3:    00 00 00 fc 00 43 34 39 48 47 39 78 0a 20 20 20 20 20
descriptor 4:    00 00 00 ff 00 48 31 41 4b 35 30 30 30 30 30 0a 20 20
extensions:      01
checksum:        45

EDID version: 1.4
Manufacturer: SAM Model e5e Serial Number --
Made in week 39 of 2014
Digital display
10 bits per primary color channel
DisplayPort interface
Maximum image size: 120 cm x 34 cm
Gamma: 2.20
DPMS levels: Off
Supported color formats: RGB 4:4:4, YCrCb 4:4:4, YCrCb 4:2:2
First detailed timing includes the native pixel format and preferred refresh rate
Display x,y Chromaticity:
  Red:   0.6826, 0.3085
  Green: 0.2724, 0.6591
  Blue:  0.1513, 0.0576
  White: 0.3134, 0.3291
Established timings supported:
  720x400@70Hz 9:5 HorFreq: 31469 Hz Clock: 28.320 MHz
  640x480@60Hz 4:3 HorFreq: 31469 Hz Clock: 25.175 MHz
  640x480@67Hz 4:3 HorFreq: 35000 Hz Clock: 30.240 MHz
  640x480@72Hz 4:3 HorFreq: 37900 Hz Clock: 31.500 MHz
  640x480@75Hz 4:3 HorFreq: 37500 Hz Clock: 31.500 MHz
  800x600@56Hz 4:3 HorFreq: 35200 Hz Clock: 36.000 MHz
  800x600@60Hz 4:3 HorFreq: 37900 Hz Clock: 40.000 MHz
  800x600@72Hz 4:3 HorFreq: 48100 Hz Clock: 50.000 MHz
  800x600@75Hz 4:3 HorFreq: 46900 Hz Clock: 49.500 MHz
  832x624@75Hz 4:3 HorFreq: 49726 Hz Clock: 57.284 MHz
  1024x768@60Hz 4:3 HorFreq: 48400 Hz Clock: 65.000 MHz
  1024x768@70Hz 4:3 HorFreq: 56500 Hz Clock: 75.000 MHz
  1024x768@75Hz 4:3 HorFreq: 60000 Hz Clock: 78.750 MHz
  1280x1024@75Hz 5:4 HorFreq: 80000 Hz Clock: 135.000 MHz
  1152x870@75Hz 192:145 HorFreq: 67500 Hz Clock: 108.000 MHz
Standard timings supported:
  1152x864@75Hz 4:3 HorFreq: 67500 Hz Clock: 108.000 MHz
  1280x800@60Hz 16:10
  1280x720@60Hz 16:9
  1280x1024@60Hz 5:4 HorFreq: 64000 Hz Clock: 108.000 MHz
  1440x900@60Hz 16:10 HorFreq: 55500 Hz Clock: 88.750 MHz
  1600x900@60Hz 16:9
  1680x1050@60Hz 16:10 HorFreq: 64700 Hz Clock: 119.000 MHz
Detailed mode: Clock 453.000 MHz, 1196 mm x 336 mm
               3840 3888 3920 4000 hborder 0
               1080 1083 1093 1133 vborder 0
               +hsync -vsync 
               VertFreq: 99 Hz, HorFreq: 113250 Hz
Monitor ranges (GTF): 50-100Hz V, 30-120kHz H, max dotclock 460MHz
Monitor name: C49HG9x
Serial number: --
Has 1 extension blocks
Checksum: 0x45 (valid)

CTA extension block
Extension version: 3
27 bytes of CTA data
  Video data block
    VIC  16 1920x1080@60Hz 16:9 (native) HorFreq: 67500 Hz Clock: 148.500 MHz
    VIC  31 1920x1080@50Hz 16:9  HorFreq: 56250 Hz Clock: 148.500 MHz
    VIC   4 1280x720@60Hz 16:9  HorFreq: 45000 Hz Clock: 74.250 MHz
    VIC  19 1280x720@50Hz 16:9  HorFreq: 37500 Hz Clock: 74.250 MHz
    VIC   3 720x480@60Hz 16:9  HorFreq: 31469 Hz Clock: 27.000 MHz
    VIC  18 720x576@50Hz 16:9  HorFreq: 31250 Hz Clock: 27.000 MHz
    VIC  90 2560x1080@60Hz 64:27  HorFreq: 66000 Hz Clock: 198.000 MHz
  Audio data block
    Linear PCM, max channels 2
      Supported sample rates (kHz): 48 44.1 32
      Supported sample sizes (bits): 24 20 16
  Speaker allocation data block
    Speaker map:
      FL/FR - Front Left/Right
  Extended tag: Colorimetry data block
    BT2020YCC
    BT2020RGB
  Extended tag: HDR static metadata data block
    Electro optical transfer functions:
      Traditional gamma - SDR luminance range
      SMPTE ST2084
    Supported static metadata descriptors:
      Static metadata type 1
    Desired content max luminance: 115 (603.666 cd/m^2)
    Desired content max frame-average luminance: 90 (351.250 cd/m^2)
    Desired content min luminance: 23 (0.049 cd/m^2)
Underscans PC formats by default
Basic audio support
Supports YCbCr 4:4:4
Supports YCbCr 4:2:2
1 native detailed modes
Detailed mode: Clock 266.500 MHz, 1196 mm x 336 mm
               3840 3888 3920 4000 hborder 0
               1080 1083 1093 1111 vborder 0
               +hsync -vsync 
               VertFreq: 59 Hz, HorFreq: 66625 Hz
Detailed mode: Clock 148.500 MHz, 1196 mm x 336 mm
               1920 2008 2052 2200 hborder 0
               1080 1084 1089 1125 vborder 0
               +hsync +vsync 
               VertFreq: 60 Hz, HorFreq: 67500 Hz
Checksum: 0x9b (valid)

EDID block does not conform at all!
	Both the serial number and the serial string are set
