
EDID (hex):
00ffffffffffff000472b000de685013
2315010368341d782aeed1a555489b26
125054b30c00714f818095008100d1c0
010101010101023a801871382d40582c
450009252100001e000000fd00384b1e
5312000a202020202020000000ff004c
47383038303332343230310a000000fc
0041434552205632343348510a20008d

Extracted contents:
header:          00 ff ff ff ff ff ff 00
serial number:   04 72 b0 00 de 68 50 13 23 15
version:         01 03
basic params:    68 34 1d 78 2a
chroma info:     ee d1 a5 55 48 9b 26 12 50 54
established:     b3 0c 00
standard:        71 4f 81 80 95 00 81 00 d1 c0 01 01 01 01 01 01
descriptor 1:    02 3a 80 18 71 38 2d 40 58 2c 45 00 09 25 21 00 00 1e
descriptor 2:    00 00 00 fd 00 38 4b 1e 53 12 00 0a 20 20 20 20 20 20
descriptor 3:    00 00 00 ff 00 4c 47 38 30 38 30 33 32 34 32 30 31 0a
descriptor 4:    00 00 00 fc 00 41 43 45 52 20 56 32 34 33 48 51 0a 20
extensions:      00
checksum:        8d

EDID version: 1.3
Manufacturer: ACR Model b0 Serial Number --
Made in week 35 of 2011
Analog display, Input voltage level: 0.7/0.7 V
Sync: Separate 
Maximum image size: 52 cm x 29 cm
Gamma: 2.20
DPMS levels: Off
RGB color display
First detailed timing is preferred timing
Display x,y Chromaticity:
  Red:   0.6474, 0.3339
  Green: 0.2841, 0.6074
  Blue:  0.1513, 0.0712
  White: 0.3125, 0.3291
Established timings supported:
  720x400@70Hz 9:5 HorFreq: 31469 Hz Clock: 28.320 MHz
  640x480@60Hz 4:3 HorFreq: 31469 Hz Clock: 25.175 MHz
  640x480@67Hz 4:3 HorFreq: 35000 Hz Clock: 30.240 MHz
  800x600@56Hz 4:3 HorFreq: 35200 Hz Clock: 36.000 MHz
  800x600@60Hz 4:3 HorFreq: 37900 Hz Clock: 40.000 MHz
  1024x768@60Hz 4:3 HorFreq: 48400 Hz Clock: 65.000 MHz
  1024x768@70Hz 4:3 HorFreq: 56500 Hz Clock: 75.000 MHz
Standard timings supported:
  1152x864@75Hz 4:3 HorFreq: 67500 Hz Clock: 108.000 MHz
  1280x1024@60Hz 5:4 HorFreq: 64000 Hz Clock: 108.000 MHz
  1440x900@60Hz 16:10 HorFreq: 55500 Hz Clock: 88.750 MHz
  1280x800@60Hz 16:10
  1920x1080@60Hz 16:9
Detailed mode: Clock 148.500 MHz, 521 mm x 293 mm
               1920 2008 2052 2200 hborder 0
               1080 1084 1089 1125 vborder 0
               +hsync +vsync 
               VertFreq: 60 Hz, HorFreq: 67500 Hz
Monitor ranges (GTF): 56-75Hz V, 30-83kHz H, max dotclock 180MHz
Serial number: --
Monitor name: ACER V243HQ
Checksum: 0x8d (valid)
