edid-decode (hex):

00 ff ff ff ff ff ff 00 4c f4 00 27 0a 1a 00 00
34 1f 01 04 b5 3c 21 78 2b 64 35 a5 54 4f 9e 27
12 50 54 a5 4b 00 71 40 81 80 81 00 81 c0 95 00
95 c0 a9 c0 b3 00 02 3a 80 18 71 38 2d 40 58 2c
45 00 6c 71 21 00 00 1e 00 00 00 fd 00 30 a6 c8
c8 28 01 0a 20 20 20 20 20 20 00 00 00 fc 00 4d
55 43 41 49 0a 20 20 20 20 20 20 20 00 00 00 ff
00 20 20 20 20 20 20 20 20 20 20 20 20 0a 01 a4

02 03 29 f1 4d 90 01 02 03 04 11 12 13 1f 29 2f
40 3f 23 09 7f 07 83 01 00 00 e3 05 e3 01 e3 0f
01 00 e6 06 05 01 69 69 00 fd 81 80 a0 70 38 1f
40 30 20 35 00 56 50 21 00 00 1e 78 6e 80 a0 70
38 35 40 30 20 36 00 56 50 21 00 00 1a c4 90 80
78 70 38 15 40 30 20 36 00 56 50 21 00 00 1a 00
00 00 00 00 00 00 00 00 00 00 00 00 00 00 00 00
00 00 00 00 00 00 00 00 00 00 00 00 00 00 00 cc

00 ff ff ff ff ff ff 00 4c f4 00 27 0a 1a 00 00
34 1f 01 04 b5 3c 21 78 2b 64 35 a5 54 4f 9e 27
12 50 54 a5 4b 00 71 40 81 80 81 00 81 c0 95 00
95 c0 a9 c0 b3 00 02 3a 80 18 71 38 2d 40 58 2c
45 00 6c 71 21 00 00 1e 00 00 00 fd 00 30 a6 c8
c8 28 01 0a 20 20 20 20 20 20 00 00 00 fc 00 4d
55 43 41 49 0a 20 20 20 20 20 20 20 00 00 00 ff
00 20 20 20 20 20 20 20 20 20 20 20 20 0a 01 a4

02 03 29 f1 4d 90 01 02 03 04 11 12 13 1f 29 2f
40 3f 23 09 7f 07 83 01 00 00 e3 05 e3 01 e3 0f
01 00 e6 06 05 01 69 69 00 fd 81 80 a0 70 38 1f
40 30 20 35 00 56 50 21 00 00 1e 78 6e 80 a0 70
38 35 40 30 20 36 00 56 50 21 00 00 1a c4 90 80
78 70 38 15 40 30 20 36 00 56 50 21 00 00 1a 00
00 00 00 00 00 00 00 00 00 00 00 00 00 00 00 00
00 00 00 00 00 00 00 00 00 00 00 00 00 00 00 cc

----------------

Block 0, Base EDID:
  EDID Structure Version & Revision: 1.4
  Vendor & Product Identification:
    Manufacturer: SGT
    Model: 9984
    Serial Number: ...
    Made in: week 52 of 2021
  Basic Display Parameters & Features:
    Digital display
    Bits per primary color channel: 10
    DisplayPort interface
    Maximum image size: 60 cm x 33 cm
    Gamma: 2.20
    DPMS levels: Off
    Supported color formats: RGB 4:4:4, YCrCb 4:4:4
    First detailed timing includes the native pixel format and preferred refresh rate
    Display is continuous frequency
  Color Characteristics:
    Red  : 0.6455, 0.3300
    Green: 0.3095, 0.6171
    Blue : 0.1523, 0.0732
    White: 0.3134, 0.3291
  Established Timings I & II:
    IBM     :   720x400    70.081663 Hz   9:5     31.467 kHz     28.320000 MHz
    DMT 0x04:   640x480    59.940476 Hz   4:3     31.469 kHz     25.175000 MHz
    DMT 0x06:   640x480    75.000000 Hz   4:3     37.500 kHz     31.500000 MHz
    DMT 0x09:   800x600    60.316541 Hz   4:3     37.879 kHz     40.000000 MHz
    DMT 0x0b:   800x600    75.000000 Hz   4:3     46.875 kHz     49.500000 MHz
    DMT 0x10:  1024x768    60.003840 Hz   4:3     48.363 kHz     65.000000 MHz
    DMT 0x12:  1024x768    75.028582 Hz   4:3     60.023 kHz     78.750000 MHz
    DMT 0x24:  1280x1024   75.024675 Hz   5:4     79.976 kHz    135.000000 MHz
  Standard Timings:
    GTF     :  1152x864    60.000000 Hz   4:3     53.700 kHz     81.624000 MHz
    DMT 0x23:  1280x1024   60.019740 Hz   5:4     63.981 kHz    108.000000 MHz
    DMT 0x1c:  1280x800    59.810326 Hz  16:10    49.702 kHz     83.500000 MHz
    DMT 0x55:  1280x720    60.000000 Hz  16:9     45.000 kHz     74.250000 MHz
    DMT 0x2f:  1440x900    59.887445 Hz  16:10    55.935 kHz    106.500000 MHz
    GTF     :  1440x810    60.000051 Hz  16:9     50.340 kHz     95.042000 MHz
    DMT 0x53:  1600x900    60.000000 Hz  16:9     60.000 kHz    108.000000 MHz (RB)
    DMT 0x3a:  1680x1050   59.954250 Hz  16:10    65.290 kHz    146.250000 MHz
  Detailed Timing Descriptors:
    DTD 1:  1920x1080   60.000000 Hz  16:9     67.500 kHz    148.500000 MHz (620 mm x 369 mm)
                 Hfront   88 Hsync  44 Hback  148 Hpol P
                 Vfront    4 Vsync   5 Vback   36 Vpol P
    Display Range Limits:
      Monitor ranges (Bare Limits): 48-166 Hz V, 200-200 kHz H, max dotclock 400 MHz
    Display Product Name: 'MUCAI'
    Display Product Serial Number: ...
  Extension blocks: 1
Checksum: 0xa4

----------------

Block 1, CTA-861 Extension Block:
  Revision: 3
  Underscans IT Video Formats by default
  Basic audio support
  Supports YCbCr 4:4:4
  Supports YCbCr 4:2:2
  Native detailed modes: 1
  Video Data Block:
    VIC  16:  1920x1080   60.000000 Hz  16:9     67.500 kHz    148.500000 MHz (native)
    VIC   1:   640x480    59.940476 Hz   4:3     31.469 kHz     25.175000 MHz
    VIC   2:   720x480    59.940060 Hz   4:3     31.469 kHz     27.000000 MHz
    VIC   3:   720x480    59.940060 Hz  16:9     31.469 kHz     27.000000 MHz
    VIC   4:  1280x720    60.000000 Hz  16:9     45.000 kHz     74.250000 MHz
    VIC  17:   720x576    50.000000 Hz   4:3     31.250 kHz     27.000000 MHz
    VIC  18:   720x576    50.000000 Hz  16:9     31.250 kHz     27.000000 MHz
    VIC  19:  1280x720    50.000000 Hz  16:9     37.500 kHz     74.250000 MHz
    VIC  31:  1920x1080   50.000000 Hz  16:9     56.250 kHz    148.500000 MHz
    VIC  41:  1280x720   100.000000 Hz  16:9     75.000 kHz    148.500000 MHz
    VIC  47:  1280x720   120.000000 Hz  16:9     90.000 kHz    148.500000 MHz
    VIC  64:  1920x1080  100.000000 Hz  16:9    112.500 kHz    297.000000 MHz
    VIC  63:  1920x1080  120.000000 Hz  16:9    135.000 kHz    297.000000 MHz
  Audio Data Block:
    Linear PCM:
      Max channels: 2
      Supported sample rates (kHz): 192 176.4 96 88.2 48 44.1 32
      Supported sample sizes (bits): 24 20 16
  Speaker Allocation Data Block:
    FL/FR - Front Left/Right
  Colorimetry Data Block:
    xvYCC601
    xvYCC709
    BT2020cYCC
    BT2020YCC
    BT2020RGB
    Gamut Boundary Description Metadata Profile P0
  YCbCr 4:2:0 Capability Map Data Block:
    VIC  16:  1920x1080   60.000000 Hz  16:9     67.500 kHz    148.500000 MHz
  HDR Static Metadata Data Block:
    Electro optical transfer functions:
      Traditional gamma - SDR luminance range
      SMPTE ST2084
    Supported static metadata descriptors:
      Static metadata type 1
    Desired content max luminance: 105 (486.099 cd/m^2)
    Desired content max frame-average luminance: 105 (486.099 cd/m^2)
    Desired content min luminance: 0 (0.000 cd/m^2)
  Detailed Timing Descriptors:
    DTD 2:  1920x1080  144.001419 Hz  16:9    159.986 kHz    332.770000 MHz (598 mm x 336 mm)
                 Hfront   48 Hsync  32 Hback   80 Hpol P
                 Vfront    3 Vsync   5 Vback   23 Vpol P
    DTD 3:  1920x1080  120.001358 Hz  16:9    135.962 kHz    282.800000 MHz (598 mm x 336 mm)
                 Hfront   48 Hsync  32 Hback   80 Hpol P
                 Vfront    3 Vsync   6 Vback   44 Vpol N
    DTD 4:  1920x1080  165.001514 Hz  16:9    181.667 kHz    370.600000 MHz (598 mm x 336 mm)
                 Hfront   48 Hsync  32 Hback   40 Hpol P
                 Vfront    3 Vsync   6 Vback   12 Vpol N
Checksum: 0xcc  Unused space in Extension Block: 32 bytes

----------------

Block 2, Unknown EDID Extension Block 0x00:
  00 ff ff ff ff ff ff 00 4c f4 00 27 0a 1a 00 00 '........L..'....'
  34 1f 01 04 b5 3c 21 78 2b 64 35 a5 54 4f 9e 27 '4....<!x+d5.TO.''
  12 50 54 a5 4b 00 71 40 81 80 81 00 81 c0 95 00 '.PT.K.q@........'
  95 c0 a9 c0 b3 00 02 3a 80 18 71 38 2d 40 58 2c '.......:..q8-@X,'
  45 00 6c 71 21 00 00 1e 00 00 00 fd 00 30 a6 c8 'E.lq!........0..'
  c8 28 01 0a 20 20 20 20 20 20 00 00 00 fc 00 4d '.(..      .....M'
  55 43 41 49 0a 20 20 20 20 20 20 20 00 00 00 ff 'UCAI.       ....'
  00 20 20 20 20 20 20 20 20 20 20 20 20 0a 01 a4 '.            ...'
Checksum: 0xa4

----------------

Block 3, CTA-861 Extension Block:
  Revision: 3
  Underscans IT Video Formats by default
  Basic audio support
  Supports YCbCr 4:4:4
  Supports YCbCr 4:2:2
  Native detailed modes: 1
  Video Data Block:
    VIC  16:  1920x1080   60.000000 Hz  16:9     67.500 kHz    148.500000 MHz (native)
    VIC   1:   640x480    59.940476 Hz   4:3     31.469 kHz     25.175000 MHz
    VIC   2:   720x480    59.940060 Hz   4:3     31.469 kHz     27.000000 MHz
    VIC   3:   720x480    59.940060 Hz  16:9     31.469 kHz     27.000000 MHz
    VIC   4:  1280x720    60.000000 Hz  16:9     45.000 kHz     74.250000 MHz
    VIC  17:   720x576    50.000000 Hz   4:3     31.250 kHz     27.000000 MHz
    VIC  18:   720x576    50.000000 Hz  16:9     31.250 kHz     27.000000 MHz
    VIC  19:  1280x720    50.000000 Hz  16:9     37.500 kHz     74.250000 MHz
    VIC  31:  1920x1080   50.000000 Hz  16:9     56.250 kHz    148.500000 MHz
    VIC  41:  1280x720   100.000000 Hz  16:9     75.000 kHz    148.500000 MHz
    VIC  47:  1280x720   120.000000 Hz  16:9     90.000 kHz    148.500000 MHz
    VIC  64:  1920x1080  100.000000 Hz  16:9    112.500 kHz    297.000000 MHz
    VIC  63:  1920x1080  120.000000 Hz  16:9    135.000 kHz    297.000000 MHz
  Audio Data Block:
    Linear PCM:
      Max channels: 2
      Supported sample rates (kHz): 192 176.4 96 88.2 48 44.1 32
      Supported sample sizes (bits): 24 20 16
  Speaker Allocation Data Block:
    FL/FR - Front Left/Right
  Colorimetry Data Block:
    xvYCC601
    xvYCC709
    BT2020cYCC
    BT2020YCC
    BT2020RGB
    Gamut Boundary Description Metadata Profile P0
  YCbCr 4:2:0 Capability Map Data Block:
    VIC  16:  1920x1080   60.000000 Hz  16:9     67.500 kHz    148.500000 MHz
  HDR Static Metadata Data Block:
    Electro optical transfer functions:
      Traditional gamma - SDR luminance range
      SMPTE ST2084
    Supported static metadata descriptors:
      Static metadata type 1
    Desired content max luminance: 105 (486.099 cd/m^2)
    Desired content max frame-average luminance: 105 (486.099 cd/m^2)
    Desired content min luminance: 0 (0.000 cd/m^2)
  Detailed Timing Descriptors:
    DTD 5:  1920x1080  144.001419 Hz  16:9    159.986 kHz    332.770000 MHz (598 mm x 336 mm)
                 Hfront   48 Hsync  32 Hback   80 Hpol P
                 Vfront    3 Vsync   5 Vback   23 Vpol P
    DTD 6:  1920x1080  120.001358 Hz  16:9    135.962 kHz    282.800000 MHz (598 mm x 336 mm)
                 Hfront   48 Hsync  32 Hback   80 Hpol P
                 Vfront    3 Vsync   6 Vback   44 Vpol N
    DTD 7:  1920x1080  165.001514 Hz  16:9    181.667 kHz    370.600000 MHz (598 mm x 336 mm)
                 Hfront   48 Hsync  32 Hback   40 Hpol P
                 Vfront    3 Vsync   6 Vback   12 Vpol N
Checksum: 0xcc  Unused space in Extension Block: 32 bytes

----------------

Warnings:

Block 1, CTA-861 Extension Block:
  Colorimetry Data Block: Set the sRGB colorimetry bit to avoid interop issues.
  YCbCr 4:2:0 Capability Map Data Block: Some YCbCr 4:2:0 timings are invalid for HDMI 2.1 (which requires an RGB timings pixel rate >= 590 MHz).
  Display Product Serial Number is set, so the Serial Number in the Base EDID should be 0.
Block 3, CTA-861 Extension Block:
  Colorimetry Data Block: Set the sRGB colorimetry bit to avoid interop issues.
  Display Product Serial Number is set, so the Serial Number in the Base EDID should be 0.
EDID:
  Base EDID: Some timings are out of range of the Monitor Ranges:
    Horizontal Freq: 31.250 - 181.666 kHz (Monitor: 200.000 - 200.000 kHz)
  CTA-861: Multiple native progressive timings are defined.

Failures:

Block 0, Base EDID:
  Detailed Timing Descriptor #1: Mismatch of image size 620x369 mm vs display size 600x330 mm.
  Display Product Serial Number: ...
Block 1, CTA-861 Extension Block:
  Missing VCDB, needed for Set Selectable RGB Quantization to avoid interop issues.
Block 2, Base EDID:
  Unknown Extension Block.
Block 3, CTA-861 Extension Block:
  Video Data Block: Duplicate VIC 16.
  Video Data Block: Duplicate VIC 1.
  Video Data Block: Duplicate VIC 2.
  Video Data Block: Duplicate VIC 3.
  Video Data Block: Duplicate VIC 4.
  Video Data Block: Duplicate VIC 17.
  Video Data Block: Duplicate VIC 18.
  Video Data Block: Duplicate VIC 19.
  Video Data Block: Duplicate VIC 31.
  Video Data Block: Duplicate VIC 41.
  Video Data Block: Duplicate VIC 47.
  Video Data Block: Duplicate VIC 64.
  Video Data Block: Duplicate VIC 63.
  Speaker Allocation Data Block: Only one instance of this Data Block is allowed.
  Colorimetry Data Block: Only one instance of this Data Block is allowed.
  YCbCr 4:2:0 Capability Map Data Block: Only one instance of this Data Block is allowed.
  HDR Static Metadata Data Block: Only one instance of this Data Block is allowed.
  Missing VCDB, needed for Set Selectable RGB Quantization to avoid interop issues.
EDID:
  Base EDID: The DTD max image size is 620x369mm, which is larger than the display size 600.0x330.0mm.
  Base EDID: EDID specified 1 extension block(s), but found 3 extension block(s).

EDID conformity: FAIL
