
EDID (hex):
00ffffffffffff001ef9260718390000
0f0d010368241d78ea0925a2574b9924
185054a56b0081800101010101010101
010101010101302a009851002a403070
1300671f1100001e000000fe00474154
455741590a2020202020000000fc0046
5044313833300a2020202020000000fd
00384b1e530e000a2020202020200058

Extracted contents:
header:          00 ff ff ff ff ff ff 00
serial number:   1e f9 26 07 18 39 00 00 0f 0d
version:         01 03
basic params:    68 24 1d 78 ea
chroma info:     09 25 a2 57 4b 99 24 18 50 54
established:     a5 6b 00
standard:        81 80 01 01 01 01 01 01 01 01 01 01 01 01 01 01
descriptor 1:    30 2a 00 98 51 00 2a 40 30 70 13 00 67 1f 11 00 00 1e
descriptor 2:    00 00 00 fe 00 47 41 54 45 57 41 59 0a 20 20 20 20 20
descriptor 3:    00 00 00 fc 00 46 50 44 31 38 33 30 0a 20 20 20 20 20
descriptor 4:    00 00 00 fd 00 38 4b 1e 53 0e 00 0a 20 20 20 20 20 20
extensions:      00
checksum:        58

EDID version: 1.3
Manufacturer: GWY Model 726 Serial Number --
Analog display, Input voltage level: 0.7/0.7 V
Sync: Separate 
Maximum image size: 36 cm x 29 cm
Gamma: 2.20
DPMS levels: Standby Suspend Off
RGB color display
First detailed timing is preferred timing
Display x,y Chromaticity:
  Red:   0.6328, 0.3398
  Green: 0.2949, 0.5986
  Blue:  0.1406, 0.0957
  White: 0.3134, 0.3291
Established timings supported:
  720x400@70Hz 9:5 HorFreq: 31469 Hz Clock: 28.320 MHz
  640x480@60Hz 4:3 HorFreq: 31469 Hz Clock: 25.175 MHz
  640x480@75Hz 4:3 HorFreq: 37500 Hz Clock: 31.500 MHz
  800x600@60Hz 4:3 HorFreq: 37900 Hz Clock: 40.000 MHz
  800x600@75Hz 4:3 HorFreq: 46900 Hz Clock: 49.500 MHz
  832x624@75Hz 4:3 HorFreq: 49726 Hz Clock: 57.284 MHz
  1024x768@60Hz 4:3 HorFreq: 48400 Hz Clock: 65.000 MHz
  1024x768@75Hz 4:3 HorFreq: 60000 Hz Clock: 78.750 MHz
  1280x1024@75Hz 5:4 HorFreq: 80000 Hz Clock: 135.000 MHz
Standard timings supported:
  1280x1024@60Hz 5:4 HorFreq: 64000 Hz Clock: 108.000 MHz
Detailed mode: Clock 108.000 MHz, 359 mm x 287 mm
               1280 1328 1440 1688 hborder 0
               1024 1025 1028 1066 vborder 0
               +hsync +vsync 
               VertFreq: 60 Hz, HorFreq: 63981 Hz
ASCII string: GATEWAY
Monitor name: FPD1830
Monitor ranges (GTF): 56-75Hz V, 30-83kHz H, max dotclock 140MHz
Checksum: 0x58 (valid)
EDID block does not conform at all!
	Bad year of manufacture
