edid-decode (hex):

00 ff ff ff ff ff ff 00 06 af 2c 31 00 00 00 00
00 15 01 03 80 1d 10 78 0a 15 85 97 58 53 8a 26
25 50 54 00 00 00 01 01 01 01 01 01 01 01 01 01
01 01 01 01 01 01 12 1b 56 5a 50 00 19 30 30 20
36 00 25 a4 10 00 00 18 00 00 00 0f 00 00 00 00
00 00 00 00 00 00 00 00 00 20 00 00 00 fe 00 41
55 4f 0a 20 20 20 20 20 20 20 20 20 00 00 00 fe
00 42 31 33 33 58 57 30 33 20 56 31 20 0a 00 64

----------------

Block 0, Base EDID:
  EDID Structure Version & Revision: 1.3
  Vendor & Product Identification:
    Manufacturer: AUO
    Model: 12588
    Made in: 2011
  Basic Display Parameters & Features:
    Digital display
    Maximum image size: 29 cm x 16 cm
    Gamma: 2.20
    RGB color display
    First detailed timing is preferred timing
  Color Characteristics:
    Red  : 0.5898, 0.3447
    Green: 0.3251, 0.5400
    Blue : 0.1503, 0.1445
    White: 0.3134, 0.3291
  Established Timings I & II: none
  Standard Timings: none
  Detailed Timing Descriptors:
    DTD 1:  1366x768    60.020 Hz 683:384  47.596 kHz  69.300 MHz (293 mm x 164 mm)
                 Hfront   48 Hsync  32 Hback  10 Hpol N
                 Vfront    3 Vsync   6 Vback  16 Vpol N
    Manufacturer-Specified Display Descriptor (0x0f): 00 0f 00 00 00 00 00 00 00 00 00 00 00 00 00 20 '............... '
    Alphanumeric Data String: 'AUO'
    Alphanumeric Data String: 'B133XW03 V1 '
Checksum: 0x64
