edid-decode (hex):

00 ff ff ff ff ff ff 00 0d ae b8 15 00 00 00 00
18 16 01 03 80 22 13 78 0a d1 f5 93 5d 59 90 26
1d 50 54 00 00 00 01 01 01 01 01 01 01 01 01 01
01 01 01 01 01 01 79 1d 56 c2 50 00 26 30 1f 41
4c 00 58 c2 10 00 00 18 a6 00 00 fe 00 4e 31 35
36 42 47 45 2d 4c 33 31 0a 20 00 00 00 fe 00 43
4d 4e 0a 20 20 20 20 20 20 20 20 20 00 00 00 fe
00 4e 31 35 36 42 47 45 2d 4c 33 31 0a 20 00 17

----------------

Block 0, Base EDID:
  EDID Structure Version & Revision: 1.3
  Vendor & Product Identification:
    Manufacturer: CMN
    Model: 5560
    Made in: week 24 of 2012
  Basic Display Parameters & Features:
    Digital display
    Maximum image size: 34 cm x 19 cm
    Gamma: 2.20
    RGB color display
    First detailed timing is the preferred timing
  Color Characteristics:
    Red  : 0.5771, 0.3642
    Green: 0.3476, 0.5634
    Blue : 0.1513, 0.1162
    White: 0.3134, 0.3291
  Established Timings I & II: none
  Standard Timings: none
  Detailed Timing Descriptors:
    DTD 1:  1366x768    60.007 Hz 683:384  48.365 kHz  75.450 MHz (344 mm x 194 mm)
                 Hfront   31 Hsync  65 Hback  98 Hpol N
                 Vfront    4 Vsync  12 Vback  22 Vpol N
    Detailed mode: a6 00 00 fe 00 4e 31 35 36 42 47 45 2d 4c 33 31 0a 20 '.....N156BGE-L31. '
    Alphanumeric Data String: 'CMN'
    Alphanumeric Data String: 'N156BGE-L31'
Checksum: 0x17

----------------

Failures:

Block 0, Base EDID:
  Detailed Timing Descriptor #2: Pixelclock < 10 MHz, assuming invalid data 0xa6 0x00.
  Missing Display Product Name.
  Missing Display Range Limits Descriptor.

EDID conformity: FAIL
