
EDID (hex):
00ffffffffffff0030ae239100000000
001e0104b51e137803d405a754489e25
0e505400000001010101010101010101
010101010101428640a0b00854703020
35002dbc100000185ec940a0b0085470
302035002dbc10000018000000fd003c
5aaaaa34010a202020202020000000fe
004c454e31343057515847412b200051

edid-decode (hex):

00 ff ff ff ff ff ff 00 30 ae 23 91 00 00 00 00
00 1e 01 04 b5 1e 13 78 03 d4 05 a7 54 48 9e 25
0e 50 54 00 00 00 01 01 01 01 01 01 01 01 01 01
01 01 01 01 01 01 42 86 40 a0 b0 08 54 70 30 20
35 00 2d bc 10 00 00 18 5e c9 40 a0 b0 08 54 70
30 20 35 00 2d bc 10 00 00 18 00 00 00 fd 00 3c
5a aa aa 34 01 0a 20 20 20 20 20 20 00 00 00 fe
00 4c 45 4e 31 34 30 57 51 58 47 41 2b 20 00 51

----------------

Block 0, Base EDID:
  EDID Structure Version & Revision: 1.4
  Vendor & Product Identification:
    Manufacturer: LEN
    Model: 37155
    Made in: 2020
  Basic Display Parameters & Features:
    Digital display
    Bits per primary color channel: 10
    DisplayPort interface
    Maximum image size: 30 cm x 19 cm
    Gamma: 2.20
    Supported color formats: RGB 4:4:4
    First detailed timing includes the native pixel format and preferred refresh rate
    Display is continuous frequency
  Color Characteristics:
    Red  : 0.6552, 0.3291
    Green: 0.2822, 0.6171
    Blue : 0.1445, 0.0546
    White: 0.3134, 0.3291
  Established Timings I & II: none
  Standard Timings: none
  Detailed Timing Descriptors:
    DTD 1:  2880x1800   60.010197 Hz  16:10   113.059 kHz    343.700000 MHz (301 mm x 188 mm)
                 Hfront   48 Hsync  32 Hback   80 Hpol N
                 Vfront    3 Vsync   5 Vback   76 Vpol N
    DTD 2:  2880x1800   90.006565 Hz  16:10   169.572 kHz    515.500000 MHz (301 mm x 188 mm)
                 Hfront   48 Hsync  32 Hback   80 Hpol N
                 Vfront    3 Vsync   5 Vback   76 Vpol N
    Display Range Limits:
      Monitor ranges (Bare Limits): 60-90 Hz V, 170-170 kHz H, max dotclock 520 MHz
    Alphanumeric Data String: 'LEN140WQXGA+ '
Checksum: 0x51


