
EDID (hex):
00ffffffffffff005ca8000000000000
2b1d0104a54627783b8e05ad4f33b026
0d5054afcf0095008180953cb300d1c0
457c81bcb33c565e00a0a0a029503020
3500ba892100001a000000ff00303030
30303030303030303031000000fd0030
92dfdf3c010a202020202020000000fc
00574d33324458393031390a202001ce
020318754b909f859404130312010211
2309070783010000fb7e807270381e40
18203500ba8921000018023a80187138
2d40582c9600ba8921000018866f80a0
7038404030203500ba892100001e84bc
0050a0a0555008207800ba892100001a
9ce00078a0a0325030403500ba892100
001e000000000000000000000000004f

edid-decode (hex):

00 ff ff ff ff ff ff 00 5c a8 00 00 00 00 00 00
2b 1d 01 04 a5 46 27 78 3b 8e 05 ad 4f 33 b0 26
0d 50 54 af cf 00 95 00 81 80 95 3c b3 00 d1 c0
45 7c 81 bc b3 3c 56 5e 00 a0 a0 a0 29 50 30 20
35 00 ba 89 21 00 00 1a 00 00 00 ff 00 30 30 30
30 30 30 30 30 30 30 30 30 31 00 00 00 fd 00 30
92 df df 3c 01 0a 20 20 20 20 20 20 00 00 00 fc
00 57 4d 33 32 44 58 39 30 31 39 0a 20 20 01 ce

02 03 18 75 4b 90 9f 85 94 04 13 03 12 01 02 11
23 09 07 07 83 01 00 00 fb 7e 80 72 70 38 1e 40
18 20 35 00 ba 89 21 00 00 18 02 3a 80 18 71 38
2d 40 58 2c 96 00 ba 89 21 00 00 18 86 6f 80 a0
70 38 40 40 30 20 35 00 ba 89 21 00 00 1e 84 bc
00 50 a0 a0 55 50 08 20 78 00 ba 89 21 00 00 1a
9c e0 00 78 a0 a0 32 50 30 40 35 00 ba 89 21 00
00 1e 00 00 00 00 00 00 00 00 00 00 00 00 00 4f

----------------

Block 0, Base EDID:
  EDID Structure Version & Revision: 1.4
  Vendor & Product Identification:
    Manufacturer: WEH
    Model: 0
    Made in: week 43 of 2019
  Basic Display Parameters & Features:
    Digital display
    Bits per primary color channel: 8
    DisplayPort interface
    Maximum image size: 70 cm x 39 cm
    Gamma: 2.20
    DPMS levels: Off
    Supported color formats: RGB 4:4:4, YCrCb 4:4:4, YCrCb 4:2:2
    First detailed timing includes the native pixel format and preferred refresh rate
    Display is continuous frequency
  Color Characteristics:
    Red  : 0.6777, 0.3085
    Green: 0.2021, 0.6894
    Blue : 0.1484, 0.0507
    White: 0.3134, 0.3291
  Established Timings I & II:
    IBM     :   720x400    70.081663 Hz   9:5     31.467 kHz     28.320000 MHz
    DMT 0x04:   640x480    59.940476 Hz   4:3     31.469 kHz     25.175000 MHz
    DMT 0x05:   640x480    72.808802 Hz   4:3     37.861 kHz     31.500000 MHz
    DMT 0x06:   640x480    75.000000 Hz   4:3     37.500 kHz     31.500000 MHz
    DMT 0x08:   800x600    56.250000 Hz   4:3     35.156 kHz     36.000000 MHz
    DMT 0x09:   800x600    60.316541 Hz   4:3     37.879 kHz     40.000000 MHz
    DMT 0x0a:   800x600    72.187572 Hz   4:3     48.077 kHz     50.000000 MHz
    DMT 0x0b:   800x600    75.000000 Hz   4:3     46.875 kHz     49.500000 MHz
    DMT 0x10:  1024x768    60.003840 Hz   4:3     48.363 kHz     65.000000 MHz
    DMT 0x11:  1024x768    70.069359 Hz   4:3     56.476 kHz     75.000000 MHz
    DMT 0x12:  1024x768    75.028582 Hz   4:3     60.023 kHz     78.750000 MHz
    DMT 0x24:  1280x1024   75.024675 Hz   5:4     79.976 kHz    135.000000 MHz
  Standard Timings:
    DMT 0x2f:  1440x900    59.887445 Hz  16:10    55.935 kHz    106.500000 MHz
    DMT 0x23:  1280x1024   60.019740 Hz   5:4     63.981 kHz    108.000000 MHz
    GTF     :  1440x900   119.999896 Hz  16:10   115.800 kHz    229.747000 MHz
    DMT 0x3a:  1680x1050   59.954250 Hz  16:10    65.290 kHz    146.250000 MHz
    DMT 0x52:  1920x1080   60.000000 Hz  16:9     67.500 kHz    148.500000 MHz
    GTF     :   800x600   119.999886 Hz   4:3     77.160 kHz     83.950000 MHz
    GTF     :  1280x1024  120.000185 Hz   5:4    131.640 kHz    233.793000 MHz
    GTF     :  1680x1050  120.000000 Hz  16:10   135.000 kHz    313.200000 MHz
  Detailed Timing Descriptors:
    DTD 1:  2560x1440   59.950550 Hz  16:9     88.787 kHz    241.500000 MHz (698 mm x 393 mm)
                 Hfront   48 Hsync  32 Hback   80 Hpol P
                 Vfront    3 Vsync   5 Vback   33 Vpol N
    Display Product Serial Number: '0000000000001'
    Display Range Limits:
      Monitor ranges (Bare Limits): 48-146 Hz V, 223-223 kHz H, max dotclock 600 MHz
    Display Product Name: 'WM32DX9019'
  Extension blocks: 1
Checksum: 0xce

----------------

Block 1, CTA-861 Extension Block:
  Revision: 3
  Basic audio support
  Supports YCbCr 4:4:4
  Supports YCbCr 4:2:2
  Native detailed modes: 5
  Video Data Block:
    VIC  16:  1920x1080   60.000000 Hz  16:9     67.500 kHz    148.500000 MHz (native)
    VIC  31:  1920x1080   50.000000 Hz  16:9     56.250 kHz    148.500000 MHz (native)
    VIC   5:  1920x1080i  60.000000 Hz  16:9     33.750 kHz     74.250000 MHz (native)
    VIC  20:  1920x1080i  50.000000 Hz  16:9     28.125 kHz     74.250000 MHz (native)
    VIC   4:  1280x720    60.000000 Hz  16:9     45.000 kHz     74.250000 MHz
    VIC  19:  1280x720    50.000000 Hz  16:9     37.500 kHz     74.250000 MHz
    VIC   3:   720x480    59.940060 Hz  16:9     31.469 kHz     27.000000 MHz
    VIC  18:   720x576    50.000000 Hz  16:9     31.250 kHz     27.000000 MHz
    VIC   1:   640x480    59.940476 Hz   4:3     31.469 kHz     25.175000 MHz
    VIC   2:   720x480    59.940060 Hz   4:3     31.469 kHz     27.000000 MHz
    VIC  17:   720x576    50.000000 Hz   4:3     31.250 kHz     27.000000 MHz
  Audio Data Block:
    Linear PCM:
      Max channels: 2
      Supported sample rates (kHz): 48 44.1 32
      Supported sample sizes (bits): 24 20 16
  Speaker Allocation Data Block:
    FL/FR - Front Left/Right
  Detailed Timing Descriptors:
    DTD 2:  1920x1080  143.980263 Hz  16:9    159.818 kHz    325.070000 MHz (698 mm x 393 mm)
                 Hfront   24 Hsync  32 Hback   58 Hpol N
                 Vfront    3 Vsync   5 Vback   22 Vpol N
    DTD 3:  1920x1080   60.000000 Hz  16:9     67.500 kHz    148.500000 MHz (698 mm x 393 mm)
                 Hfront   88 Hsync  44 Hback  148 Hpol N
                 Vfront    9 Vsync   6 Vback   30 Vpol N
    DTD 4:  1920x1080  119.982181 Hz  16:9    137.260 kHz    285.500000 MHz (698 mm x 393 mm)
                 Hfront   48 Hsync  32 Hback   80 Hpol P
                 Vfront    3 Vsync   5 Vback   56 Vpol P
    DTD 5:  2560x1440  119.870840 Hz  16:9    182.803 kHz    482.600000 MHz (698 mm x 393 mm)
                 Hfront    8 Hsync  32 Hback   40 Hpol P
                 Vfront    7 Vsync   8 Vback   70 Vpol N
    DTD 6:  2560x1440  143.994791 Hz  16:9    214.552 kHz    575.000000 MHz (698 mm x 393 mm)
                 Hfront   48 Hsync  64 Hback    8 Hpol P
                 Vfront    3 Vsync   5 Vback   42 Vpol P
Checksum: 0x4f  Unused space in Extension Block: 13 bytes
