edid-decode (hex):

00 ff ff ff ff ff ff 00 4c a3 47 44 00 00 00 00
00 0f 01 03 80 25 17 78 0a 87 f5 94 57 4f 8c 27
27 50 54 00 00 00 01 01 01 01 01 01 01 01 01 01
01 01 01 01 01 01 7c 2e 90 a0 60 1a 32 40 30 20
26 00 6d e4 10 00 00 19 00 00 00 0f 00 00 00 00
00 00 00 00 00 41 5f 05 19 00 00 00 00 fe 00 53
41 4d 53 55 4e 47 0a 20 20 20 20 20 00 00 00 fe
00 4c 54 4e 31 37 30 57 50 2d 4c 30 32 0a 00 9e

----------------

Block 0, Base EDID:
  EDID Structure Version & Revision: 1.3
  Vendor & Product Identification:
    Manufacturer: SEC
    Model: 17479
    Made in: 2005
  Basic Display Parameters & Features:
    Digital display
    Maximum image size: 37 cm x 23 cm
    Gamma: 2.20
    RGB color display
    First detailed timing is preferred timing
  Color Characteristics:
    Red  : 0.5800, 0.3398
    Green: 0.3095, 0.5498
    Blue : 0.1552, 0.1552
    White: 0.3134, 0.3291
  Established Timings I & II: none
  Standard Timings: none
  Detailed Timing Descriptors:
    DTD 1:  1680x1050   58.794 Hz   8:5    64.674 kHz 119.000 MHz (365 mm x 228 mm)
                 Hfront   48 Hsync  32 Hback  80 Hpol N
                 Vfront    2 Vsync   6 Vback  42 Vpol N
    Manufacturer-Specified Display Descriptor (0x0f): 00 0f 00 00 00 00 00 00 00 00 00 41 5f 05 19 00 '...........A_...'
    Alphanumeric Data String: 'SAMSUNG'
    Alphanumeric Data String: 'LTN170WP-L02'
Checksum: 0x9e
