edid-decode (hex):

00 ff ff ff ff ff ff 00 10 ac 20 a0 4c 35 31 30
23 13 01 03 0e 29 1f 78 ee ee 91 a3 54 4c 99 26
0f 50 54 a5 4b 00 81 80 a9 40 71 4f 01 01 01 01
01 01 01 01 01 01 48 3f 40 30 62 b0 32 40 40 c0
13 00 6f 13 11 00 00 1e 00 00 00 ff 00 47 33 36
30 48 39 38 50 30 31 35 4c 0a 00 00 00 fc 00 44
45 4c 4c 20 32 30 30 37 46 50 0a 20 00 00 00 fd
00 38 4c 1e 53 11 00 0a 20 20 20 20 20 20 00 34

00 ff ff ff ff ff ff 00 10 ac 20 a0 4c 35 31 30
23 13 01 03 0e 29 1f 78 ee ee 91 a3 54 4c 99 26
0f 50 54 a5 4b 00 81 80 a9 40 71 4f 01 01 01 01
01 01 01 01 01 01 48 3f 40 30 62 b0 32 40 40 c0
13 00 6f 13 11 00 00 1e 00 00 00 ff 00 47 33 36
30 48 39 38 50 30 31 35 4c 0a 00 00 00 fc 00 44
45 4c 4c 20 32 30 30 37 46 50 0a 20 00 00 00 fd
00 38 4c 1e 53 11 00 0a 20 20 20 20 20 20 00 34

----------------

Block 0, Base EDID:
  EDID Structure Version & Revision: 1.3
  Vendor & Product Identification:
    Manufacturer: DEL
    Model: 40992
    Serial Number: ...
    Made in: week 35 of 2009
  Basic Display Parameters & Features:
    Analog display
    Signal Level Standard: 0.700 : 0.300 : 1.000 V p-p
    Blank level equals black level
    Sync: Separate Composite SyncOnGreen
    Maximum image size: 41 cm x 31 cm
    Gamma: 2.20
    DPMS levels: Standby Suspend Off
    RGB color display
    Default (sRGB) color space is primary color space
    First detailed timing is the preferred timing
  Color Characteristics:
    Red  : 0.6396, 0.3300
    Green: 0.2998, 0.5996
    Blue : 0.1503, 0.0595
    White: 0.3125, 0.3291
  Established Timings I & II:
    IBM     :   720x400    70.081663 Hz   9:5     31.467 kHz     28.320000 MHz
    DMT 0x04:   640x480    59.940476 Hz   4:3     31.469 kHz     25.175000 MHz
    DMT 0x06:   640x480    75.000000 Hz   4:3     37.500 kHz     31.500000 MHz
    DMT 0x09:   800x600    60.316541 Hz   4:3     37.879 kHz     40.000000 MHz
    DMT 0x0b:   800x600    75.000000 Hz   4:3     46.875 kHz     49.500000 MHz
    DMT 0x10:  1024x768    60.003840 Hz   4:3     48.363 kHz     65.000000 MHz
    DMT 0x12:  1024x768    75.028582 Hz   4:3     60.023 kHz     78.750000 MHz
    DMT 0x24:  1280x1024   75.024675 Hz   5:4     79.976 kHz    135.000000 MHz
  Standard Timings:
    DMT 0x23:  1280x1024   60.019740 Hz   5:4     63.981 kHz    108.000000 MHz
    DMT 0x33:  1600x1200   60.000000 Hz   4:3     75.000 kHz    162.000000 MHz
    DMT 0x15:  1152x864    75.000000 Hz   4:3     67.500 kHz    108.000000 MHz
  Detailed Timing Descriptors:
    DTD 1:  1600x1200   60.000000 Hz   4:3     75.000 kHz    162.000000 MHz (367 mm x 275 mm)
                 Hfront   64 Hsync 192 Hback  304 Hpol P
                 Vfront    1 Vsync   3 Vback   46 Vpol P
    Display Product Serial Number: ...
    Display Product Name: 'DELL 2007FP'
    Display Range Limits:
      Monitor ranges (GTF): 56-76 Hz V, 30-83 kHz H, max dotclock 170 MHz
Checksum: 0x34

----------------

Block 1, Unknown EDID Extension Block 0x00:
  00 ff ff ff ff ff ff 00 10 ac 20 a0 4c 35 31 30 '.......... .L510'
  23 13 01 03 0e 29 1f 78 ee ee 91 a3 54 4c 99 26 '#....).x....TL.&'
  0f 50 54 a5 4b 00 81 80 a9 40 71 4f 01 01 01 01 '.PT.K....@qO....'
  01 01 01 01 01 01 48 3f 40 30 62 b0 32 40 40 c0 '......H?@0b.2@@.'
  13 00 6f 13 11 00 00 1e 00 00 00 ff 00 47 33 36 '..o..........G36'
  30 48 39 38 50 30 31 35 4c 0a 00 00 00 fc 00 44 '0H98P015L......D'
  45 4c 4c 20 32 30 30 37 46 50 0a 20 00 00 00 fd 'ELL 2007FP. ....'
  00 38 4c 1e 53 11 00 0a 20 20 20 20 20 20 00 34 '.8L.S...      .4'
Checksum: 0x34

----------------

Failures:

Block 0, Base EDID:
  Detailed Timing Descriptor #1: Mismatch of image size 367x275 mm vs display size 410x310 mm.
Block 1, Base EDID:
  Unknown Extension Block.
EDID:
  Base EDID: EDID specified 0 extension block(s), but found 1 extension block(s).

EDID conformity: FAIL
