edid-decode (hex):

00 ff ff ff ff ff ff 00 32 0c 50 00 00 00 00 00
00 10 01 03 80 2b 1b 78 0a d6 90 a2 58 4d 9c 25
12 50 54 00 00 00 01 01 01 01 01 01 01 01 01 01
01 01 01 01 01 01 7c 2e 90 a0 60 1a 1c 40 30 20
36 00 b1 0f 11 00 00 19 00 00 00 00 00 00 00 00
00 00 00 00 00 00 00 00 00 00 00 00 00 fe 00 4c
47 50 68 69 6c 69 70 73 4c 43 44 0a 00 00 00 4c
50 32 30 31 57 45 31 2d 54 4c 41 31 0a 20 00 1c

----------------

Block 0, Base EDID:
  EDID Structure Version & Revision: 1.3
  Vendor & Product Identification:
    Manufacturer: LPL
    Model: 80
    Made in: 2006
  Basic Display Parameters & Features:
    Digital display
    Maximum image size: 43 cm x 27 cm
    Gamma: 2.20
    RGB color display
    First detailed timing is preferred timing
  Color Characteristics:
    Red  : 0.6357, 0.3447
    Green: 0.3017, 0.6113
    Blue : 0.1464, 0.0712
    White: 0.3125, 0.3281
  Established Timings I & II: none
  Standard Timings: none
  Detailed Timing Descriptors:
    DTD 1:  1680x1050   59.994 Hz   8:5    64.674 kHz 119.000 MHz (433 mm x 271 mm)
                 Hfront   48 Hsync  32 Hback  80 Hpol N
                 Vfront    3 Vsync   6 Vback  19 Vpol N
    Empty Descriptor
    Alphanumeric Data String: 'LGPhilipsLCD'
    Unknown Display Descriptor (0x4c): 00 4c 50 32 30 31 57 45 31 2d 54 4c 41 31 0a 20 '.LP201WE1-TLA1. '
Checksum: 0x1c
