
EDID (hex):
00ffffffffffff000472fa03bcff0042
1418010380351e78ca3f60a455529e27
0d5054bfef80714f8140818081c08100
9500b300d1c0023a801871382d40582c
4500132b2100001e000000fd00384c1f
5011000a202020202020000000fc0047
323437484c0a202020202020000000ff
005430564141303031383534300a00a6

edid-decode (hex):

00 ff ff ff ff ff ff 00 04 72 fa 03 bc ff 00 42
14 18 01 03 80 35 1e 78 ca 3f 60 a4 55 52 9e 27
0d 50 54 bf ef 80 71 4f 81 40 81 80 81 c0 81 00
95 00 b3 00 d1 c0 02 3a 80 18 71 38 2d 40 58 2c
45 00 13 2b 21 00 00 1e 00 00 00 fd 00 38 4c 1f
50 11 00 0a 20 20 20 20 20 20 00 00 00 fc 00 47
32 34 37 48 4c 0a 20 20 20 20 20 20 00 00 00 ff
00 54 30 56 41 41 30 30 31 38 35 34 30 0a 00 a6

----------------

Block 0, Base EDID:
  EDID Structure Version & Revision: 1.3
  Vendor & Product Identification:
    Manufacturer: ACR
    Model: 1018
    Serial Number: 1107361724
    Made in: week 20 of 2014
  Basic Display Parameters & Features:
    Digital display
    Maximum image size: 53 cm x 30 cm
    Gamma: 2.20
    DPMS levels: Standby Suspend
    RGB color display
    First detailed timing is the preferred timing
  Color Characteristics:
    Red  : 0.6406, 0.3349
    Green: 0.3232, 0.6201
    Blue : 0.1533, 0.0527
    White: 0.3125, 0.3281
  Established Timings I & II:
    IBM     :   720x400    70.081663 Hz   9:5     31.467 kHz     28.320000 MHz
    DMT 0x04:   640x480    59.940476 Hz   4:3     31.469 kHz     25.175000 MHz
    Apple   :   640x480    66.666667 Hz   4:3     35.000 kHz     30.240000 MHz
    DMT 0x05:   640x480    72.808802 Hz   4:3     37.861 kHz     31.500000 MHz
    DMT 0x06:   640x480    75.000000 Hz   4:3     37.500 kHz     31.500000 MHz
    DMT 0x08:   800x600    56.250000 Hz   4:3     35.156 kHz     36.000000 MHz
    DMT 0x09:   800x600    60.316541 Hz   4:3     37.879 kHz     40.000000 MHz
    DMT 0x0a:   800x600    72.187572 Hz   4:3     48.077 kHz     50.000000 MHz
    DMT 0x0b:   800x600    75.000000 Hz   4:3     46.875 kHz     49.500000 MHz
    Apple   :   832x624    74.551266 Hz   4:3     49.726 kHz     57.284000 MHz
    DMT 0x10:  1024x768    60.003840 Hz   4:3     48.363 kHz     65.000000 MHz
    DMT 0x11:  1024x768    70.069359 Hz   4:3     56.476 kHz     75.000000 MHz
    DMT 0x12:  1024x768    75.028582 Hz   4:3     60.023 kHz     78.750000 MHz
    DMT 0x24:  1280x1024   75.024675 Hz   5:4     79.976 kHz    135.000000 MHz
    Apple   :  1152x870    75.061550 Hz 192:145   68.681 kHz    100.000000 MHz
  Standard Timings:
    DMT 0x15:  1152x864    75.000000 Hz   4:3     67.500 kHz    108.000000 MHz
    DMT 0x20:  1280x960    60.000000 Hz   4:3     60.000 kHz    108.000000 MHz
    DMT 0x23:  1280x1024   60.019740 Hz   5:4     63.981 kHz    108.000000 MHz
    DMT 0x55:  1280x720    60.000000 Hz  16:9     45.000 kHz     74.250000 MHz
    DMT 0x1c:  1280x800    59.810326 Hz  16:10    49.702 kHz     83.500000 MHz
    DMT 0x2f:  1440x900    59.887445 Hz  16:10    55.935 kHz    106.500000 MHz
    DMT 0x3a:  1680x1050   59.954250 Hz  16:10    65.290 kHz    146.250000 MHz
    DMT 0x52:  1920x1080   60.000000 Hz  16:9     67.500 kHz    148.500000 MHz
  Detailed Timing Descriptors:
    DTD 1:  1920x1080   60.000000 Hz  16:9     67.500 kHz    148.500000 MHz (531 mm x 299 mm)
                 Hfront   88 Hsync  44 Hback  148 Hpol P
                 Vfront    4 Vsync   5 Vback   36 Vpol P
    Display Range Limits:
      Monitor ranges (GTF): 56-76 Hz V, 31-80 kHz H, max dotclock 170 MHz
    Display Product Name: 'G247HL'
    Display Product Serial Number: 'T0VAA0018540'
Checksum: 0xa6
