edid-decode (hex):

00 ff ff ff ff ff ff 00 4c 2d 45 0c 01 00 00 01
2a 18 01 03 80 69 3b 78 0a 23 ad a4 54 4d 99 26
0f 47 4a bd ef 80 71 4f 81 c0 81 00 81 80 95 00
a9 c0 b3 00 01 01 04 74 00 30 f2 70 5a 80 b0 58
8a 00 50 1d 74 00 00 1e 02 3a 80 18 71 38 2d 40
58 2c 45 00 50 1d 74 00 00 1e 00 00 00 fd 00 18
4b 0f 51 1e 00 0a 20 20 20 20 20 20 00 00 00 fc
00 53 41 4d 53 55 4e 47 0a 20 20 20 20 20 01 e4

----------------

Block 0, Base EDID:
  EDID Structure Version & Revision: 1.3
  Vendor & Product Identification:
    Manufacturer: SAM
    Model: 3141
    Serial Number: ...
    Made in: week 42 of 2014
  Basic Display Parameters & Features:
    Digital display
    Maximum image size: 105 cm x 59 cm
    Gamma: 2.20
    RGB color display
    First detailed timing is the preferred timing
  Color Characteristics:
    Red  : 0.6406, 0.3300
    Green: 0.3007, 0.6005
    Blue : 0.1503, 0.0605
    White: 0.2802, 0.2900
  Established Timings I & II:
    IBM     :   720x400    70.082 Hz   9:5    31.467 kHz  28.320 MHz
    DMT 0x04:   640x480    59.940 Hz   4:3    31.469 kHz  25.175 MHz
    Apple   :   640x480    66.667 Hz   4:3    35.000 kHz  30.240 MHz
    DMT 0x05:   640x480    72.809 Hz   4:3    37.861 kHz  31.500 MHz
    DMT 0x06:   640x480    75.000 Hz   4:3    37.500 kHz  31.500 MHz
    DMT 0x09:   800x600    60.317 Hz   4:3    37.879 kHz  40.000 MHz
    DMT 0x0a:   800x600    72.188 Hz   4:3    48.077 kHz  50.000 MHz
    DMT 0x0b:   800x600    75.000 Hz   4:3    46.875 kHz  49.500 MHz
    Apple   :   832x624    74.551 Hz   4:3    49.726 kHz  57.284 MHz
    DMT 0x10:  1024x768    60.004 Hz   4:3    48.363 kHz  65.000 MHz
    DMT 0x11:  1024x768    70.069 Hz   4:3    56.476 kHz  75.000 MHz
    DMT 0x12:  1024x768    75.029 Hz   4:3    60.023 kHz  78.750 MHz
    DMT 0x24:  1280x1024   75.025 Hz   5:4    79.976 kHz 135.000 MHz
    Apple   :  1152x870    75.062 Hz 192:145  68.681 kHz 100.000 MHz
  Standard Timings:
    DMT 0x15:  1152x864    75.000 Hz   4:3    67.500 kHz 108.000 MHz
    DMT 0x55:  1280x720    60.000 Hz  16:9    45.000 kHz  74.250 MHz
    DMT 0x1c:  1280x800    59.810 Hz  16:10   49.702 kHz  83.500 MHz
    DMT 0x23:  1280x1024   60.020 Hz   5:4    63.981 kHz 108.000 MHz
    DMT 0x2f:  1440x900    59.887 Hz  16:10   55.935 kHz 106.500 MHz
    DMT 0x53:  1600x900    60.000 Hz  16:9    60.000 kHz 108.000 MHz (RB)
    DMT 0x3a:  1680x1050   59.954 Hz  16:10   65.290 kHz 146.250 MHz
  Detailed Timing Descriptors:
    DTD 1:  3840x2160   30.000 Hz  16:9    67.500 kHz 297.000 MHz (1872 mm x 1053 mm)
                 Hfront  176 Hsync  88 Hback 296 Hpol P
                 Vfront    8 Vsync  10 Vback  72 Vpol P
    DTD 2:  1920x1080   60.000 Hz  16:9    67.500 kHz 148.500 MHz (1872 mm x 1053 mm)
                 Hfront   88 Hsync  44 Hback 148 Hpol P
                 Vfront    4 Vsync   5 Vback  36 Vpol P
  Display Range Limits:
    Monitor ranges (GTF): 24-75 Hz V, 15-81 kHz H, max dotclock 300 MHz
    Display Product Name: 'SAMSUNG'
  Extension blocks: 1
Checksum: 0xe4

----------------

Failures:

Block 0, Base EDID:
  Detailed Timing Descriptor #1: Mismatch of image size 1872x1053 mm vs display size 1050x590 mm.
  Detailed Timing Descriptor #2: Mismatch of image size 1872x1053 mm vs display size 1050x590 mm.
  Base EDID: EDID specified 1 extension block(s), but found 0 extension block(s).

EDID conformity: FAIL
