edid-decode (hex):

00 ff ff ff ff ff ff 00 1e 55 48 44 01 00 00 00
15 17 01 03 78 52 2e 78 ef d4 6c a3 57 49 9c 25
19 48 4b 27 cf 80 81 00 81 0f 81 40 81 80 81 8f
8b 00 90 40 a9 40 94 43 80 90 72 38 28 40 48 c8
05 48 10 60 a4 00 00 1c 00 00 00 fd 00 39 3f 41
44 11 00 0a 20 20 20 20 20 20 00 00 00 ff 00 57
55 58 47 41 38 35 41 5f 30 30 30 31 00 00 00 fc
00 47 52 55 4e 44 49 47 0a 20 20 20 20 20 00 80

----------------

Block 0, Base EDID:
  EDID Structure Version & Revision: 1.3
  Vendor & Product Identification:
    Manufacturer: GRU
    Model: 17480
    Serial Number: ...
    Made in: week 21 of 2013
  Basic Display Parameters & Features:
    Analog display
    Input voltage level: 0.7/0.7 V
    Configurable signal levels
    Sync: Separate
    Maximum image size: 82 cm x 46 cm
    Gamma: 2.20
    DPMS levels: Standby Suspend Off
    RGB color display
    Default (sRGB) color space is primary color space
    First detailed timing is preferred timing
    Supports GTF timings within operating range
  Color Characteristics:
    Red  : 0.6396, 0.3408
    Green: 0.2861, 0.6093
    Blue : 0.1455, 0.0996
    White: 0.2841, 0.2929
  Established Timings I & II:
    DMT 0x04:   640x480    59.940 Hz   4:3    31.469 kHz  25.175 MHz
    DMT 0x06:   640x480    75.000 Hz   4:3    37.500 kHz  31.500 MHz
    DMT 0x08:   800x600    56.250 Hz   4:3    35.156 kHz  36.000 MHz
    DMT 0x09:   800x600    60.317 Hz   4:3    37.879 kHz  40.000 MHz
    DMT 0x0a:   800x600    72.188 Hz   4:3    48.077 kHz  50.000 MHz
    DMT 0x0b:   800x600    75.000 Hz   4:3    46.875 kHz  49.500 MHz
    DMT 0x10:  1024x768    60.004 Hz   4:3    48.363 kHz  65.000 MHz
    DMT 0x11:  1024x768    70.069 Hz   4:3    56.476 kHz  75.000 MHz
    DMT 0x12:  1024x768    75.029 Hz   4:3    60.023 kHz  78.750 MHz
    DMT 0x24:  1280x1024   75.025 Hz   5:4    79.976 kHz 135.000 MHz
    Apple   :  1152x870    75.062 Hz 192:145  68.681 kHz 100.000 MHz
  Standard Timings:
    DMT 0x1c:  1280x800    59.810 Hz  16:10   49.702 kHz  83.500 MHz
    DMT 0x1d:  1280x800    74.934 Hz  16:10   62.795 kHz 106.500 MHz
    DMT 0x20:  1280x960    60.000 Hz   4:3    60.000 kHz 108.000 MHz
    DMT 0x23:  1280x1024   60.020 Hz   5:4    63.981 kHz 108.000 MHz
    DMT 0x24:  1280x1024   75.025 Hz   5:4    79.976 kHz 135.000 MHz
    GTF     :  1360x856    60.000 Hz  16:10   53.160 kHz  95.263 MHz
    DMT 0x2a:  1400x1050   59.978 Hz   4:3    65.317 kHz 121.750 MHz
    DMT 0x33:  1600x1200   60.000 Hz   4:3    75.000 kHz 162.000 MHz
  Detailed Timing Descriptors:
    DTD 1:  1920x1080   59.963 Hz  16:9    67.158 kHz 173.000 MHz (2576 mm x 1120 mm)
                 Hfront  328 Hsync 200 Hback 128 Hpol N
                 Vfront   32 Vsync   5 Vback   3 Vpol P
  Display Range Limits:
    Monitor ranges (GTF): 57-63 Hz V, 65-68 kHz H, max dotclock 170 MHz
    Display Product Serial Number: ...
    Display Product Name: 'GRUNDIG'
Checksum: 0x80
