
EDID (hex):
00ffffffffffff0006af3d6100000000
001c0104a51f117803ee95a3544c9926
0f505400000001010101010101010101
010101010101143780b8703824401010
3e0035ae10000018b82480b870382440
10103e0035ae10000018000000000000
00000000000000000000000000000002
001430ff123cc80a0614c820202000d2

Extracted contents:
header:          00 ff ff ff ff ff ff 00
serial number:   06 af 3d 61 00 00 00 00 00 1c
version:         01 04
basic params:    a5 1f 11 78 03
chroma info:     ee 95 a3 54 4c 99 26 0f 50 54
established:     00 00 00
standard:        01 01 01 01 01 01 01 01 01 01 01 01 01 01 01 01
descriptor 1:    14 37 80 b8 70 38 24 40 10 10 3e 00 35 ae 10 00 00 18
descriptor 2:    b8 24 80 b8 70 38 24 40 10 10 3e 00 35 ae 10 00 00 18
descriptor 3:    00 00 00 00 00 00 00 00 00 00 00 00 00 00 00 00 00 00
descriptor 4:    00 00 00 02 00 14 30 ff 12 3c c8 0a 06 14 c8 20 20 20
extensions:      00
checksum:        d2

EDID version: 1.4
Manufacturer: AUO Model 613d Serial Number --
Made in year 2018
Digital display
8 bits per primary color channel
DisplayPort interface
Maximum image size: 31 cm x 17 cm
Gamma: 2.20
Supported color formats: RGB 4:4:4
First detailed timing includes the native pixel format and preferred refresh rate
Display is continuous frequency
Display x,y Chromaticity:
  Red:   0.6396, 0.3300
  Green: 0.2998, 0.5996
  Blue:  0.1503, 0.0595
  White: 0.3134, 0.3291
Established timings supported:
Standard timings supported:
Detailed mode: Clock 141.000 MHz, 309 mm x 174 mm
               1920 1936 1952 2104 hborder 0
               1080 1083 1097 1116 vborder 0
               -hsync -vsync 
               VertFreq: 60 Hz, HorFreq: 67015 Hz
Detailed mode: Clock 94.000 MHz, 309 mm x 174 mm
               1920 1936 1952 2104 hborder 0
               1080 1083 1097 1116 vborder 0
               -hsync -vsync 
               VertFreq: 40 Hz, HorFreq: 44676 Hz
Manufacturer-specified data, tag 0
Manufacturer-specified data, tag 2
Checksum: 0xd2 (valid)
EDID block does NOT conform to EDID 1.4!
	Missing name descriptor
	Missing monitor ranges


