edid-decode (hex):

00 ff ff ff ff ff ff 00 0d ae 45 12 00 00 00 00
2a 1a 01 04 a5 1c 10 78 02 ee 95 a3 54 4c 99 26
0f 50 54 00 00 00 01 01 01 01 01 01 01 01 01 01
01 01 01 01 01 01 36 36 80 a0 70 38 20 40 2e 1e
24 00 14 9b 10 00 00 1a 24 24 80 a0 70 38 20 40
2e 1e 24 00 14 9b 10 00 00 1a 00 00 00 00 00 00
00 00 00 00 00 00 00 00 00 00 00 00 00 00 00 02
00 0c 26 ff 14 3c c8 14 0a 23 c8 00 00 00 00 2e

----------------

Block 0, Base EDID:
  EDID Structure Version & Revision: 1.4
  Vendor & Product Identification:
    Manufacturer: CMN
    Model: 4677
    Made in: week 42 of 2016
  Basic Display Parameters & Features:
    Digital display
    Bits per primary color channel: 8
    DisplayPort interface
    Maximum image size: 28 cm x 16 cm
    Gamma: 2.20
    Supported color formats: RGB 4:4:4
    First detailed timing includes the native pixel format and preferred refresh rate
  Color Characteristics:
    Red  : 0.6396, 0.3300
    Green: 0.2998, 0.5996
    Blue : 0.1503, 0.0595
    White: 0.3134, 0.3291
  Established Timings I & II: none
  Standard Timings: none
  Detailed Timing Descriptors:
    DTD 1:  1920x1080   60.001038 Hz  16:9     66.721 kHz    138.780000 MHz (276 mm x 155 mm)
                 Hfront   46 Hsync  30 Hback   84 Hpol P
                 Vfront    2 Vsync   4 Vback   26 Vpol N
    DTD 2:  1920x1080   40.000692 Hz  16:9     44.481 kHz     92.520000 MHz (276 mm x 155 mm)
                 Hfront   46 Hsync  30 Hback   84 Hpol P
                 Vfront    2 Vsync   4 Vback   26 Vpol N
    Empty Descriptor
    Manufacturer-Specified Display Descriptor (0x02): 00 02 00 0c 26 ff 14 3c c8 14 0a 23 c8 00 00 00 '....&..<...#....'
Checksum: 0x2e

----------------

Warnings:

Block 0, Base EDID:
  Missing Display Product Name.

Failures:

Block 0, Base EDID:
  Empty Descriptor: Use Dummy Descriptor instead of all zeroes.

EDID conformity: FAIL
