
EDID (hex):
00ffffffffffff001e6d8b9e470d0500
0c210104c5692c78f9398cad5241af25
0e4a4d210900d1c06140454001010101
0101010101014ed470a0d0a046503020
3a0018b94100001a000000fd0c30f091
918c010a202020202020000000fc004c
4720554c545241474541522b000000ff
003331324e54475939523037390a0274
02032872230f570783010000e305c000
e606050173330ae2006a6d1a00000201
30f00004730a3315e77c70a0d0a02950
30203a0018b94100001a9d6770a0d0a0
225030203a006f6e3100001a00000000
00000000000000000000000000000000
00000000000000000000000000000000
0000000000000000000000000000008a
701279030001000ceb283d11700da005
9078ffbb0f000aa4140e0e0701230000
00030150622202886f0d9f002f801f00
9f05b20002000900663801086f0d9f00
2f801f009f0566000200090052010106
6f0d9f002f801f009f05540002000900
856f00047f079f002f801f0037043f00
02000400000000000000000000000690

edid-decode (hex):

00 ff ff ff ff ff ff 00 1e 6d 8b 9e 47 0d 05 00
0c 21 01 04 c5 69 2c 78 f9 39 8c ad 52 41 af 25
0e 4a 4d 21 09 00 d1 c0 61 40 45 40 01 01 01 01
01 01 01 01 01 01 4e d4 70 a0 d0 a0 46 50 30 20
3a 00 18 b9 41 00 00 1a 00 00 00 fd 0c 30 f0 91
91 8c 01 0a 20 20 20 20 20 20 00 00 00 fc 00 4c
47 20 55 4c 54 52 41 47 45 41 52 2b 00 00 00 ff
00 33 31 32 4e 54 47 59 39 52 30 37 39 0a 02 74

02 03 28 72 23 0f 57 07 83 01 00 00 e3 05 c0 00
e6 06 05 01 73 33 0a e2 00 6a 6d 1a 00 00 02 01
30 f0 00 04 73 0a 33 15 e7 7c 70 a0 d0 a0 29 50
30 20 3a 00 18 b9 41 00 00 1a 9d 67 70 a0 d0 a0
22 50 30 20 3a 00 6f 6e 31 00 00 1a 00 00 00 00
00 00 00 00 00 00 00 00 00 00 00 00 00 00 00 00
00 00 00 00 00 00 00 00 00 00 00 00 00 00 00 00
00 00 00 00 00 00 00 00 00 00 00 00 00 00 00 8a

70 12 79 03 00 01 00 0c eb 28 3d 11 70 0d a0 05
90 78 ff bb 0f 00 0a a4 14 0e 0e 07 01 23 00 00
00 03 01 50 62 22 02 88 6f 0d 9f 00 2f 80 1f 00
9f 05 b2 00 02 00 09 00 66 38 01 08 6f 0d 9f 00
2f 80 1f 00 9f 05 66 00 02 00 09 00 52 01 01 06
6f 0d 9f 00 2f 80 1f 00 9f 05 54 00 02 00 09 00
85 6f 00 04 7f 07 9f 00 2f 80 1f 00 37 04 3f 00
02 00 04 00 00 00 00 00 00 00 00 00 00 00 06 90

----------------

Block 0, Base EDID:
  EDID Structure Version & Revision: 1.4
  Vendor & Product Identification:
    Manufacturer: GSM
    Model: 40587
    Serial Number: 331079
    Made in: week 12 of 2023
  Basic Display Parameters & Features:
    Digital display
    Bits per primary color channel: 12
    DisplayPort interface
    Maximum image size: 105 cm x 44 cm
    Gamma: 2.20
    DPMS levels: Standby Suspend Off
    Supported color formats: RGB 4:4:4, YCrCb 4:4:4, YCrCb 4:2:2
    First detailed timing does not include the native pixel format and preferred refresh rate
    Display is continuous frequency
  Color Characteristics:
    Red  : 0.6757, 0.3232
    Green: 0.2558, 0.6845
    Blue : 0.1464, 0.0546
    White: 0.2919, 0.3007
  Established Timings I & II:
    DMT 0x04:   640x480    59.940476 Hz   4:3     31.469 kHz     25.175000 MHz
    DMT 0x09:   800x600    60.316541 Hz   4:3     37.879 kHz     40.000000 MHz
    DMT 0x10:  1024x768    60.003840 Hz   4:3     48.363 kHz     65.000000 MHz
    DMT 0x24:  1280x1024   75.024675 Hz   5:4     79.976 kHz    135.000000 MHz
  Standard Timings:
    DMT 0x52:  1920x1080   60.000000 Hz  16:9     67.500 kHz    148.500000 MHz
    DMT 0x10:  1024x768    60.003840 Hz   4:3     48.363 kHz     65.000000 MHz
    DMT 0x09:   800x600    60.316541 Hz   4:3     37.879 kHz     40.000000 MHz
  Detailed Timing Descriptors:
    DTD 1:  3440x1440   99.981604 Hz  43:18   150.972 kHz    543.500000 MHz (1048 mm x 441 mm)
                 Hfront   48 Hsync  32 Hback   80 Hpol P
                 Vfront    3 Vsync  10 Vback   57 Vpol N
    Display Range Limits:
      Monitor ranges (Bare Limits): 48-240 Hz V, 400-400 kHz H, max dotclock 1400 MHz
    Display Product Name: 'LG ULTRAGEAR+'
    Display Product Serial Number: '312NTGY9R079'
  Extension blocks: 2
Checksum: 0x74

----------------

Block 1, CTA-861 Extension Block:
  Revision: 3
  Basic audio support
  Supports YCbCr 4:4:4
  Supports YCbCr 4:2:2
  Native detailed modes: 2
  Audio Data Block:
    Linear PCM:
      Max channels: 8
      Supported sample rates (kHz): 192 96 48 44.1 32
      Supported sample sizes (bits): 24 20 16
  Speaker Allocation Data Block:
    FL/FR - Front Left/Right
  Colorimetry Data Block:
    BT2020YCC
    BT2020RGB
  HDR Static Metadata Data Block:
    Electro optical transfer functions:
      Traditional gamma - SDR luminance range
      SMPTE ST2084
    Supported static metadata descriptors:
      Static metadata type 1
    Desired content max luminance: 115 (603.666 cd/m^2)
    Desired content max frame-average luminance: 51 (150.916 cd/m^2)
    Desired content min luminance: 10 (0.009 cd/m^2)
  Video Capability Data Block:
    YCbCr quantization: No Data
    RGB quantization: Selectable (via AVI Q)
    PT scan behavior: Always Underscanned
    IT scan behavior: Always Underscanned
    CE scan behavior: Always Underscanned
  Vendor-Specific Data Block (AMD), OUI 00-00-1A:
    Version: 2.1
    Minimum Refresh Rate: 48 Hz
    Maximum Refresh Rate: 240 Hz
    Flags 1.x: 0x00
    Flags 2.x: 0x04
    Maximum luminance: 115 (603.666 cd/m^2)
    Minimum luminance: 10 (0.009 cd/m^2)
    Maximum luminance (without local dimming): 51 (150.916 cd/m^2)
    Minimum luminance (without local dimming): 21 (0.010 cd/m^2)
  Detailed Timing Descriptors:
    DTD 2:  3440x1440   59.972616 Hz  43:18    88.819 kHz    319.750000 MHz (1048 mm x 441 mm)
                 Hfront   48 Hsync  32 Hback   80 Hpol P
                 Vfront    3 Vsync  10 Vback   28 Vpol N
    DTD 3:  3440x1440   49.986808 Hz  43:18    73.681 kHz    265.250000 MHz (879 mm x 366 mm)
                 Hfront   48 Hsync  32 Hback   80 Hpol P
                 Vfront    3 Vsync  10 Vback   21 Vpol N
Checksum: 0x8a  Unused space in Extension Block: 51 bytes

----------------

Block 2, DisplayID Extension Block:
  Version: 1.2
  Extension Count: 0
  Display Product Type: Standalone display device
  Display Parameters Data Block (0x01):
    Image size: 1047.5 mm x 441.3 mm
    Display native pixel format: 3440x1440
    Feature support flags:
      Power management (DPM)
      Audio support on video interface
    Gamma: 2.20
    Aspect ratio: 3.55
    Dynamic bpc native: 12
    Dynamic bpc overall: 12
  Display Interface Data Block:
    Interface Type: DisplayPort
    Number of Links: 4
    Interface Standard Version: 1.4
    Supported bpc for RGB encoding: 8, 10, 12
    Supported bpc for YCbCr 4:4:4 encoding: 8, 10, 12
    Supported bpc for YCbCr 4:2:2 encoding: 8, 10, 12
    Supported Content Protection: HDCP 2.3
    Spread Spectrum: None
  Video Timing Modes Type 1 - Detailed Timings Data Block:
    DTD:  3440x1440  239.988676 Hz   0:0    388.542 kHz   1398.750000 MHz (aspect undefined, no 3D stereo, preferred)
               Hfront   48 Hsync  32 Hback   80 Hpol P
               Vfront    3 Vsync  10 Vback  166 Vpol N
    DTD:  3440x1440  143.974581 Hz   0:0    222.153 kHz    799.750000 MHz (aspect undefined, no 3D stereo)
               Hfront   48 Hsync  32 Hback   80 Hpol P
               Vfront    3 Vsync  10 Vback   90 Vpol N
    DTD:  3440x1440  119.990893 Hz  64:27   182.986 kHz    658.750000 MHz (aspect 64:27, no 3D stereo)
               Hfront   48 Hsync  32 Hback   80 Hpol P
               Vfront    3 Vsync  10 Vback   72 Vpol N
    DTD:  1920x1080  119.982181 Hz  16:9    137.260 kHz    285.500000 MHz (aspect 16:9, no 3D stereo)
               Hfront   48 Hsync  32 Hback   80 Hpol P
               Vfront    3 Vsync   5 Vback   56 Vpol N
  Checksum: 0x06
Checksum: 0x90


