
EDID (hex):
00ffffffffffff000472be0946bc8722
1c20010368351e782a7e3fa656529f27
124e55b30c00714f818081c081009500
b300010101012a4480a0703827403020
35000f282100001a023a801871382d40
582c45000f282100001e000000fd0030
4c1e5512000a202020202020000000fc
0053423234315920410a20202020007c

edid-decode (hex):

00 ff ff ff ff ff ff 00 04 72 be 09 46 bc 87 22
1c 20 01 03 68 35 1e 78 2a 7e 3f a6 56 52 9f 27
12 4e 55 b3 0c 00 71 4f 81 80 81 c0 81 00 95 00
b3 00 01 01 01 01 2a 44 80 a0 70 38 27 40 30 20
35 00 0f 28 21 00 00 1a 02 3a 80 18 71 38 2d 40
58 2c 45 00 0f 28 21 00 00 1e 00 00 00 fd 00 30
4c 1e 55 12 00 0a 20 20 20 20 20 20 00 00 00 fc
00 53 42 32 34 31 59 20 41 0a 20 20 20 20 00 7c

----------------

Block 0, Base EDID:
  EDID Structure Version & Revision: 1.3
  Vendor & Product Identification:
    Manufacturer: ACR
    Model: 2494
    Serial Number: 579320902
    Made in: week 28 of 2022
  Basic Display Parameters & Features:
    Analog display
    Signal Level Standard: 0.700 : 0.000 : 0.700 V p-p
    Blank level equals black level
    Sync: Separate
    Maximum image size: 53 cm x 30 cm
    Gamma: 2.20
    DPMS levels: Off
    RGB color display
    First detailed timing is the preferred timing
  Color Characteristics:
    Red  : 0.6494, 0.3388
    Green: 0.3232, 0.6230
    Blue : 0.1523, 0.0732
    White: 0.3076, 0.3349
  Established Timings I & II:
    IBM     :   720x400    70.081663 Hz   9:5     31.467 kHz     28.320000 MHz
    DMT 0x04:   640x480    59.940476 Hz   4:3     31.469 kHz     25.175000 MHz
    Apple   :   640x480    66.666667 Hz   4:3     35.000 kHz     30.240000 MHz
    DMT 0x08:   800x600    56.250000 Hz   4:3     35.156 kHz     36.000000 MHz
    DMT 0x09:   800x600    60.316541 Hz   4:3     37.879 kHz     40.000000 MHz
    DMT 0x10:  1024x768    60.003840 Hz   4:3     48.363 kHz     65.000000 MHz
    DMT 0x11:  1024x768    70.069359 Hz   4:3     56.476 kHz     75.000000 MHz
  Standard Timings:
    DMT 0x15:  1152x864    75.000000 Hz   4:3     67.500 kHz    108.000000 MHz
    DMT 0x23:  1280x1024   60.019740 Hz   5:4     63.981 kHz    108.000000 MHz
    DMT 0x55:  1280x720    60.000000 Hz  16:9     45.000 kHz     74.250000 MHz
    DMT 0x1c:  1280x800    59.810326 Hz  16:10    49.702 kHz     83.500000 MHz
    DMT 0x2f:  1440x900    59.887445 Hz  16:10    55.935 kHz    106.500000 MHz
    DMT 0x3a:  1680x1050   59.954250 Hz  16:10    65.290 kHz    146.250000 MHz
  Detailed Timing Descriptors:
    DTD 1:  1920x1080   74.972503 Hz  16:9     83.894 kHz    174.500000 MHz (527 mm x 296 mm)
                 Hfront   48 Hsync  32 Hback   80 Hpol P
                 Vfront    3 Vsync   5 Vback   31 Vpol N
    DTD 2:  1920x1080   60.000000 Hz  16:9     67.500 kHz    148.500000 MHz (527 mm x 296 mm)
                 Hfront   88 Hsync  44 Hback  148 Hpol P
                 Vfront    4 Vsync   5 Vback   36 Vpol P
    Display Range Limits:
      Monitor ranges (GTF): 48-76 Hz V, 30-85 kHz H, max dotclock 180 MHz
    Display Product Name: 'SB241Y A'
Checksum: 0x7c
