edid-decode (hex):

00 ff ff ff ff ff ff 00 34 a4 21 39 01 01 01 01
1d 14 01 03 68 2c 19 78 2a b8 15 a6 55 4b 9b 25
13 50 54 bf ef 80 81 80 71 4f 81 40 95 0f 95 00
01 01 01 01 01 01 2f 26 40 a0 60 84 1a 30 30 20
35 00 ba f9 10 00 00 1a 00 00 00 ff 00 56 30 32
39 54 58 32 30 32 30 34 33 0a 00 00 00 fd 00 37
4c 1e 52 0f 00 0a 20 20 20 20 20 20 00 00 00 fc
00 4d 44 32 30 32 34 36 0a 20 20 20 20 20 00 3f

00 ff ff ff ff ff ff 00 34 a4 21 39 01 01 01 01
1d 14 01 03 68 2c 19 78 2a b8 15 a6 55 4b 9b 25
13 50 54 bf ef 80 81 80 71 4f 81 40 95 0f 95 00
01 01 01 01 01 01 2f 26 40 a0 60 84 1a 30 30 20
35 00 ba f9 10 00 00 1a 00 00 00 ff 00 56 30 32
39 54 58 32 30 32 30 34 33 0a 00 00 00 fd 00 37
4c 1e 52 0f 00 0a 20 20 20 20 20 20 00 00 00 fc
00 4d 44 32 30 32 34 36 0a 20 20 20 20 20 00 3f

----------------

Block 0, Base EDID:
  EDID Structure Version & Revision: 1.3
  Vendor & Product Identification:
    Manufacturer: MED
    Model: 14625
    Serial Number: ...
    Made in: week 29 of 2010
  Basic Display Parameters & Features:
    Analog display
    Signal Level Standard: 0.700 : 0.000 : 0.700 V p-p
    Blank level equals black level
    Sync: Separate
    Maximum image size: 44 cm x 25 cm
    Gamma: 2.20
    DPMS levels: Off
    RGB color display
    First detailed timing is the preferred timing
  Color Characteristics:
    Red  : 0.6503, 0.3349
    Green: 0.2949, 0.6054
    Blue : 0.1445, 0.0751
    White: 0.3134, 0.3291
  Established Timings I & II:
    IBM     :   720x400    70.081663 Hz   9:5     31.467 kHz     28.320000 MHz
    DMT 0x04:   640x480    59.940476 Hz   4:3     31.469 kHz     25.175000 MHz
    Apple   :   640x480    66.666667 Hz   4:3     35.000 kHz     30.240000 MHz
    DMT 0x05:   640x480    72.808802 Hz   4:3     37.861 kHz     31.500000 MHz
    DMT 0x06:   640x480    75.000000 Hz   4:3     37.500 kHz     31.500000 MHz
    DMT 0x08:   800x600    56.250000 Hz   4:3     35.156 kHz     36.000000 MHz
    DMT 0x09:   800x600    60.316541 Hz   4:3     37.879 kHz     40.000000 MHz
    DMT 0x0a:   800x600    72.187572 Hz   4:3     48.077 kHz     50.000000 MHz
    DMT 0x0b:   800x600    75.000000 Hz   4:3     46.875 kHz     49.500000 MHz
    Apple   :   832x624    74.551266 Hz   4:3     49.726 kHz     57.284000 MHz
    DMT 0x10:  1024x768    60.003840 Hz   4:3     48.363 kHz     65.000000 MHz
    DMT 0x11:  1024x768    70.069359 Hz   4:3     56.476 kHz     75.000000 MHz
    DMT 0x12:  1024x768    75.028582 Hz   4:3     60.023 kHz     78.750000 MHz
    DMT 0x24:  1280x1024   75.024675 Hz   5:4     79.976 kHz    135.000000 MHz
    Apple   :  1152x870    75.061550 Hz 192:145   68.681 kHz    100.000000 MHz
  Standard Timings:
    DMT 0x23:  1280x1024   60.019740 Hz   5:4     63.981 kHz    108.000000 MHz
    DMT 0x15:  1152x864    75.000000 Hz   4:3     67.500 kHz    108.000000 MHz
    DMT 0x20:  1280x960    60.000000 Hz   4:3     60.000 kHz    108.000000 MHz
    DMT 0x30:  1440x900    74.984427 Hz  16:10    70.635 kHz    136.750000 MHz
    DMT 0x2f:  1440x900    59.887445 Hz  16:10    55.935 kHz    106.500000 MHz
  Detailed Timing Descriptors:
    DTD 1:  1600x900    59.978156 Hz  16:9     55.540 kHz     97.750000 MHz (442 mm x 249 mm)
                 Hfront   48 Hsync  32 Hback   80 Hpol P
                 Vfront    3 Vsync   5 Vback   18 Vpol N
    Display Product Serial Number: ...
    Display Range Limits:
      Monitor ranges (GTF): 55-76 Hz V, 30-82 kHz H, max dotclock 150 MHz
    Display Product Name: 'MD20246'
Checksum: 0x3f

----------------

Block 1, Unknown EDID Extension Block 0x00:
  00 ff ff ff ff ff ff 00 34 a4 21 39 01 01 01 01 '........4.!9....'
  1d 14 01 03 68 2c 19 78 2a b8 15 a6 55 4b 9b 25 '....h,.x*...UK.%'
  13 50 54 bf ef 80 81 80 71 4f 81 40 95 0f 95 00 '.PT.....qO.@....'
  01 01 01 01 01 01 2f 26 40 a0 60 84 1a 30 30 20 '....../&@.`..00 '
  35 00 ba f9 10 00 00 1a 00 00 00 ff 00 56 30 32 '5............V02'
  39 54 58 32 30 32 30 34 33 0a 00 00 00 fd 00 37 '9TX202043......7'
  4c 1e 52 0f 00 0a 20 20 20 20 20 20 00 00 00 fc 'L.R...      ....'
  00 4d 44 32 30 32 34 36 0a 20 20 20 20 20 00 3f '.MD20246.     .?'
Checksum: 0x3f

----------------

Failures:

Block 1, Base EDID:
  Unknown Extension Block.
EDID:
  Base EDID: EDID specified 0 extension block(s), but found 1 extension block(s).

EDID conformity: FAIL
