
EDID (hex):
00ffffffffffff0030e4350300000000
00150104951f11780ad1059558578f29
20505400000001010101010101010101
0101010101013e1c56a0500016303020
350036ae10000019d41256a050001630
3020350036ae10000019000000000000
00000000000000000000000000000002
000c4cff0a3c64121422640000000088

Extracted contents:
header:          00 ff ff ff ff ff ff 00
serial number:   30 e4 35 03 00 00 00 00 00 15
version:         01 04
basic params:    95 1f 11 78 0a
chroma info:     d1 05 95 58 57 8f 29 20 50 54
established:     00 00 00
standard:        01 01 01 01 01 01 01 01 01 01 01 01 01 01 01 01
descriptor 1:    3e 1c 56 a0 50 00 16 30 30 20 35 00 36 ae 10 00 00 19
descriptor 2:    d4 12 56 a0 50 00 16 30 30 20 35 00 36 ae 10 00 00 19
descriptor 3:    00 00 00 00 00 00 00 00 00 00 00 00 00 00 00 00 00 00
descriptor 4:    00 00 00 02 00 0c 4c ff 0a 3c 64 12 14 22 64 00 00 00
extensions:      00
checksum:        88

EDID version: 1.4
Manufacturer: LGD Model 335 Serial Number --
Made in year 2011
Digital display
6 bits per primary color channel
DisplayPort interface
Maximum image size: 31 cm x 17 cm
Gamma: 2.20
Supported color formats: RGB 4:4:4, YCrCb 4:4:4
First detailed timing includes the native pixel format and preferred refresh rate
Display x,y Chromaticity:
  Red:   0.5849, 0.3447
  Green: 0.3398, 0.5595
  Blue:  0.1601, 0.1250
  White: 0.3134, 0.3291
Established timings supported:
Standard timings supported:
Detailed mode: Clock 72.300 MHz, 310 mm x 174 mm
               1366 1414 1446 1526 hborder 0
                768  771  776  790 vborder 0
               -hsync -vsync 
               VertFreq: 59 Hz, HorFreq: 47378 Hz
Detailed mode: Clock 48.200 MHz, 310 mm x 174 mm
               1366 1414 1446 1526 hborder 0
                768  771  776  790 vborder 0
               -hsync -vsync 
               VertFreq: 39 Hz, HorFreq: 31585 Hz
Manufacturer-specified data, tag 0
Manufacturer-specified data, tag 2
Checksum: 0x88 (valid)
EDID block does NOT conform to EDID 1.4!
	Missing name descriptor
	Missing monitor ranges
