
EDID (hex):
00ffffffffffff00085920bb01010101
1b160103682c19782a3c25a554559f27
0d5054bfef808180714f8140950f9500
81c0010101012f2640a060841a303020
3500baf91000001a000000ff00423232
374c583730353435380a000000fd0037
4c1e520f000a202020202020000000fc
004e532d3230454d35304131330a00c7

Extracted contents:
header:          00 ff ff ff ff ff ff 00
serial number:   08 59 20 bb 01 01 01 01 1b 16
version:         01 03
basic params:    68 2c 19 78 2a
chroma info:     3c 25 a5 54 55 9f 27 0d 50 54
established:     bf ef 80
standard:        81 80 71 4f 81 40 95 0f 95 00 81 c0 01 01 01 01
descriptor 1:    2f 26 40 a0 60 84 1a 30 30 20 35 00 ba f9 10 00 00 1a
descriptor 2:    00 00 00 ff 00 42 32 32 37 4c 58 37 30 35 34 35 38 0a
descriptor 3:    00 00 00 fd 00 37 4c 1e 52 0f 00 0a 20 20 20 20 20 20
descriptor 4:    00 00 00 fc 00 4e 53 2d 32 30 45 4d 35 30 41 31 33 0a
extensions:      00
checksum:        c7

EDID version: 1.3
Manufacturer: BBY Model bb20 Serial Number --
Made in week 27 of 2012
Analog display, Input voltage level: 0.7/0.7 V
Sync: Separate 
Maximum image size: 44 cm x 25 cm
Gamma: 2.20
DPMS levels: Off
RGB color display
First detailed timing is preferred timing
Display x,y Chromaticity:
  Red:   0.6445, 0.3310
  Green: 0.3349, 0.6210
  Blue:  0.1523, 0.0527
  White: 0.3134, 0.3291
Established timings supported:
  720x400@70Hz 9:5 HorFreq: 31469 Hz Clock: 28.320 MHz
  640x480@60Hz 4:3 HorFreq: 31469 Hz Clock: 25.175 MHz
  640x480@67Hz 4:3 HorFreq: 35000 Hz Clock: 30.240 MHz
  640x480@72Hz 4:3 HorFreq: 37900 Hz Clock: 31.500 MHz
  640x480@75Hz 4:3 HorFreq: 37500 Hz Clock: 31.500 MHz
  800x600@56Hz 4:3 HorFreq: 35200 Hz Clock: 36.000 MHz
  800x600@60Hz 4:3 HorFreq: 37900 Hz Clock: 40.000 MHz
  800x600@72Hz 4:3 HorFreq: 48100 Hz Clock: 50.000 MHz
  800x600@75Hz 4:3 HorFreq: 46900 Hz Clock: 49.500 MHz
  832x624@75Hz 4:3 HorFreq: 49726 Hz Clock: 57.284 MHz
  1024x768@60Hz 4:3 HorFreq: 48400 Hz Clock: 65.000 MHz
  1024x768@70Hz 4:3 HorFreq: 56500 Hz Clock: 75.000 MHz
  1024x768@75Hz 4:3 HorFreq: 60000 Hz Clock: 78.750 MHz
  1280x1024@75Hz 5:4 HorFreq: 80000 Hz Clock: 135.000 MHz
  1152x870@75Hz 192:145 HorFreq: 67500 Hz Clock: 108.000 MHz
Standard timings supported:
  1280x1024@60Hz 5:4 HorFreq: 64000 Hz Clock: 108.000 MHz
  1152x864@75Hz 4:3 HorFreq: 67500 Hz Clock: 108.000 MHz
  1280x960@60Hz 4:3 HorFreq: 60000 Hz Clock: 108.000 MHz
  1440x900@75Hz 16:10 HorFreq: 82300 Hz Clock: 156.000 MHz
  1440x900@60Hz 16:10 HorFreq: 55500 Hz Clock: 88.750 MHz
  1280x720@60Hz 16:9
Detailed mode: Clock 97.750 MHz, 442 mm x 249 mm
               1600 1648 1680 1760 hborder 0
                900  903  908  926 vborder 0
               +hsync -vsync 
               VertFreq: 59 Hz, HorFreq: 55539 Hz
Serial number: --
Monitor ranges (GTF): 55-76Hz V, 30-82kHz H, max dotclock 150MHz
Monitor name: NS-20EM50A13
Checksum: 0xc7 (valid)
One or more of the timings is out of range of the Monitor Ranges:
  Vertical Freq: 56 - 75 Hz
  Horizontal Freq: 31469 - 82300 Hz
  Maximum Clock: 156.000 MHz
