
EDID (hex):
00ffffffffffff005a63399901010101
0a1f01030a351e78ee1160a854488725
1a5054bfef80d1c0b300a94095009040
81808140714f2a4480a0703827403020
35000f282100001e000000ff00573238
3231313032303332320a000000fd0038
4b1e5312000a202020202020000000fc
0056583234373620536572696573002e

Extracted contents:
header:          00 ff ff ff ff ff ff 00
serial number:   5a 63 39 99 01 01 01 01 0a 1f
version:         01 03
basic params:    0a 35 1e 78 ee
chroma info:     11 60 a8 54 48 87 25 1a 50 54
established:     bf ef 80
standard:        d1 c0 b3 00 a9 40 95 00 90 40 81 80 81 40 71 4f
descriptor 1:    2a 44 80 a0 70 38 27 40 30 20 35 00 0f 28 21 00 00 1e
descriptor 2:    00 00 00 ff 00 57 32 38 32 31 31 30 32 30 33 32 32 0a
descriptor 3:    00 00 00 fd 00 38 4b 1e 53 12 00 0a 20 20 20 20 20 20
descriptor 4:    00 00 00 fc 00 56 58 32 34 37 36 20 53 65 72 69 65 73
extensions:      00
checksum:        2e

EDID version: 1.3
Manufacturer: VSC Model 9939 Serial Number --
Made in week 10 of 2021
Analog display, Input voltage level: 0.7/0.3 V
Sync: Separate SyncOnGreen 
Maximum image size: 53 cm x 30 cm
Gamma: 2.20
DPMS levels: Standby Suspend Off
RGB color display
Default (sRGB) color space is primary color space
First detailed timing is preferred timing
Display x,y Chromaticity:
  Red:   0.6562, 0.3291
  Green: 0.2812, 0.5283
  Blue:  0.1455, 0.1035
  White: 0.3125, 0.3281
Established timings supported:
  720x400@70Hz 9:5 HorFreq: 31469 Hz Clock: 28.320 MHz
  640x480@60Hz 4:3 HorFreq: 31469 Hz Clock: 25.175 MHz
  640x480@67Hz 4:3 HorFreq: 35000 Hz Clock: 30.240 MHz
  640x480@72Hz 4:3 HorFreq: 37900 Hz Clock: 31.500 MHz
  640x480@75Hz 4:3 HorFreq: 37500 Hz Clock: 31.500 MHz
  800x600@56Hz 4:3 HorFreq: 35200 Hz Clock: 36.000 MHz
  800x600@60Hz 4:3 HorFreq: 37900 Hz Clock: 40.000 MHz
  800x600@72Hz 4:3 HorFreq: 48100 Hz Clock: 50.000 MHz
  800x600@75Hz 4:3 HorFreq: 46900 Hz Clock: 49.500 MHz
  832x624@75Hz 4:3 HorFreq: 49726 Hz Clock: 57.284 MHz
  1024x768@60Hz 4:3 HorFreq: 48400 Hz Clock: 65.000 MHz
  1024x768@70Hz 4:3 HorFreq: 56500 Hz Clock: 75.000 MHz
  1024x768@75Hz 4:3 HorFreq: 60000 Hz Clock: 78.750 MHz
  1280x1024@75Hz 5:4 HorFreq: 80000 Hz Clock: 135.000 MHz
  1152x870@75Hz 192:145 HorFreq: 67500 Hz Clock: 108.000 MHz
Standard timings supported:
  1920x1080@60Hz 16:9
  1680x1050@60Hz 16:10 HorFreq: 64700 Hz Clock: 119.000 MHz
  1600x1200@60Hz 4:3 HorFreq: 75000 Hz Clock: 162.000 MHz
  1440x900@60Hz 16:10 HorFreq: 55500 Hz Clock: 88.750 MHz
  1400x1050@60Hz 4:3 HorFreq: 64700 Hz Clock: 101.000 MHz
  1280x1024@60Hz 5:4 HorFreq: 64000 Hz Clock: 108.000 MHz
  1280x960@60Hz 4:3 HorFreq: 60000 Hz Clock: 108.000 MHz
  1152x864@75Hz 4:3 HorFreq: 67500 Hz Clock: 108.000 MHz
Detailed mode: Clock 174.500 MHz, 527 mm x 296 mm
               1920 1968 2000 2080 hborder 0
               1080 1083 1088 1119 vborder 0
               +hsync +vsync 
               VertFreq: 74 Hz, HorFreq: 83894 Hz
Serial number: --
Monitor ranges (GTF): 56-75Hz V, 30-83kHz H, max dotclock 180MHz
Checksum: 0x2e (valid)
EDID block does NOT conform to EDID 1.3!
	sRGB is signaled, but the chromaticities do not match
	Name descriptor not terminated with a newline
One or more of the timings is out of range of the Monitor Ranges:
  Vertical Freq: 56 - 75 Hz
  Horizontal Freq: 31469 - 83894 Hz
  Maximum Clock: 174.500 MHz
