edid-decode (hex):

00 ff ff ff ff ff ff 00 0d af 99 15 00 00 00 00
07 14 01 03 80 22 13 78 0a 3d 95 94 56 4f 8e 28
26 50 54 00 00 00 01 01 01 01 01 01 01 01 01 01
01 01 01 01 01 01 7a 1d 56 d2 50 00 1e 30 3c 28
36 00 58 c1 10 00 00 18 00 00 00 fe 00 4e 31 35
36 42 33 2d 4c 30 42 0a 20 20 00 00 00 fe 00 43
4d 4f 0a 20 20 20 20 20 20 20 20 20 00 00 00 fe
00 4e 31 35 36 42 33 2d 4c 30 42 0a 20 20 00 48

----------------

Block 0, Base EDID:
  EDID Structure Version & Revision: 1.3
  Vendor & Product Identification:
    Manufacturer: CMO
    Model: 5529
    Made in: week 7 of 2010
  Basic Display Parameters & Features:
    Digital display
    Maximum image size: 34 cm x 19 cm
    Gamma: 2.20
    RGB color display
    First detailed timing is preferred timing
  Color Characteristics:
    Red  : 0.5781, 0.3388
    Green: 0.3115, 0.5556
    Blue : 0.1582, 0.1494
    White: 0.3134, 0.3291
  Established Timings I & II: none
  Standard Timings: none
  Detailed Timing Descriptors:
    DTD 1:  1366x768    60.001 Hz 683:384  47.881 kHz  75.460 MHz (344 mm x 193 mm)
                 Hfront   60 Hsync  40 Hback 110 Hpol N
                 Vfront    3 Vsync   6 Vback  21 Vpol N
    Alphanumeric Data String: 'N156B3-L0B'
    Alphanumeric Data String: 'CMO'
    Alphanumeric Data String: 'N156B3-L0B'
Checksum: 0x48

----------------

Failures:

Block 0, Base EDID:
  Missing Display Product Name.
  Missing Display Range Limits Descriptor.

EDID conformity: FAIL
