
EDID (hex):
00ffffffffffff000472fc00674e9093
27130103682314782e9c259d534c9225
145054bfee0081c08100010101010101
010101010101662156a851001e30458f
3a0061c71000001c000000fd00324b1e
3c0b000a202020202020000000ff004c
4a313038303032343230330a000000fc
00416365722058313633480a20200075

Extracted contents:
header:          00 ff ff ff ff ff ff 00
serial number:   04 72 fc 00 67 4e 90 93 27 13
version:         01 03
basic params:    68 23 14 78 2e
chroma info:     9c 25 9d 53 4c 92 25 14 50 54
established:     bf ee 00
standard:        81 c0 81 00 01 01 01 01 01 01 01 01 01 01 01 01
descriptor 1:    66 21 56 a8 51 00 1e 30 45 8f 3a 00 61 c7 10 00 00 1c
descriptor 2:    00 00 00 fd 00 32 4b 1e 3c 0b 00 0a 20 20 20 20 20 20
descriptor 3:    00 00 00 ff 00 4c 4a 31 30 38 30 30 32 34 32 30 33 0a
descriptor 4:    00 00 00 fc 00 41 63 65 72 20 58 31 36 33 48 0a 20 20
extensions:      00
checksum:        75

EDID version: 1.3
Manufacturer: ACR Model fc Serial Number --
Made in week 39 of 2009
Analog display, Input voltage level: 0.7/0.7 V
Sync: Separate 
Maximum image size: 35 cm x 20 cm
Gamma: 2.20
DPMS levels: Off
RGB color display
Default (sRGB) color space is primary color space
First detailed timing is preferred timing
Display x,y Chromaticity:
  Red:   0.6152, 0.3251
  Green: 0.2998, 0.5703
  Blue:  0.1445, 0.0800
  White: 0.3134, 0.3291
Established timings supported:
  720x400@70Hz 9:5 HorFreq: 31469 Hz Clock: 28.320 MHz
  640x480@60Hz 4:3 HorFreq: 31469 Hz Clock: 25.175 MHz
  640x480@67Hz 4:3 HorFreq: 35000 Hz Clock: 30.240 MHz
  640x480@72Hz 4:3 HorFreq: 37900 Hz Clock: 31.500 MHz
  640x480@75Hz 4:3 HorFreq: 37500 Hz Clock: 31.500 MHz
  800x600@56Hz 4:3 HorFreq: 35200 Hz Clock: 36.000 MHz
  800x600@60Hz 4:3 HorFreq: 37900 Hz Clock: 40.000 MHz
  800x600@72Hz 4:3 HorFreq: 48100 Hz Clock: 50.000 MHz
  800x600@75Hz 4:3 HorFreq: 46900 Hz Clock: 49.500 MHz
  832x624@75Hz 4:3 HorFreq: 49726 Hz Clock: 57.284 MHz
  1024x768@60Hz 4:3 HorFreq: 48400 Hz Clock: 65.000 MHz
  1024x768@70Hz 4:3 HorFreq: 56500 Hz Clock: 75.000 MHz
  1024x768@75Hz 4:3 HorFreq: 60000 Hz Clock: 78.750 MHz
Standard timings supported:
  1280x720@60Hz 16:9
  1280x800@60Hz 16:10
Detailed mode: Clock 85.500 MHz, 353 mm x 199 mm
               1366 1435 1578 1790 hborder 0
                768  771  781  798 vborder 0
               -hsync +vsync 
               VertFreq: 59 Hz, HorFreq: 47765 Hz
Monitor ranges (GTF): 50-75Hz V, 30-60kHz H, max dotclock 110MHz
Serial number: --
Monitor name: Acer X163H
Checksum: 0x75 (valid)
EDID block does NOT conform to EDID 1.3!
	sRGB is signaled, but the chromaticities do not match
