
EDID (hex):
00ffffffffffff0030e4cb0500000000
001c0104951f11780229059259569329
1e505400000001010101010101010101
0101010101012e3680a070381f403020
350035ae10000019582b80a070381f40
3020350035ae10000019000000fe0037
524a4331803134305746380a00000000
0000413196001000000a010a202000c8

Extracted contents:
header:          00 ff ff ff ff ff ff 00
serial number:   30 e4 cb 05 00 00 00 00 00 1c
version:         01 04
basic params:    95 1f 11 78 02
chroma info:     29 05 92 59 56 93 29 1e 50 54
established:     00 00 00
standard:        01 01 01 01 01 01 01 01 01 01 01 01 01 01 01 01
descriptor 1:    2e 36 80 a0 70 38 1f 40 30 20 35 00 35 ae 10 00 00 19
descriptor 2:    58 2b 80 a0 70 38 1f 40 30 20 35 00 35 ae 10 00 00 19
descriptor 3:    00 00 00 fe 00 37 52 4a 43 31 80 31 34 30 57 46 38 0a
descriptor 4:    00 00 00 00 00 00 41 31 96 00 10 00 00 0a 01 0a 20 20
extensions:      00
checksum:        c8

EDID version: 1.4
Manufacturer: LGD Model 5cb Serial Number --
Made in year 2018
Digital display
6 bits per primary color channel
DisplayPort interface
Maximum image size: 31 cm x 17 cm
Gamma: 2.20
Supported color formats: RGB 4:4:4
First detailed timing includes the native pixel format and preferred refresh rate
Display x,y Chromaticity:
  Red:   0.5703, 0.3496
  Green: 0.3378, 0.5751
  Blue:  0.1601, 0.1171
  White: 0.3134, 0.3291
Established timings supported:
Standard timings supported:
Detailed mode: Clock 138.700 MHz, 309 mm x 174 mm
               1920 1968 2000 2080 hborder 0
               1080 1083 1088 1111 vborder 0
               -hsync -vsync 
               VertFreq: 60 Hz, HorFreq: 66682 Hz
Detailed mode: Clock 110.960 MHz, 309 mm x 174 mm
               1920 1968 2000 2080 hborder 0
               1080 1083 1088 1111 vborder 0
               -hsync -vsync 
               VertFreq: 48 Hz, HorFreq: 53346 Hz
ASCII string: 7RJC1
Manufacturer-specified data, tag 0
Checksum: 0xc8 (valid)
EDID block does NOT conform to EDID 1.4!
	Missing name descriptor
	Missing monitor ranges
	Detailed block string not properly terminated
