edid-decode (hex):

00 ff ff ff ff ff ff 00 31 c7 01 00 00 00 00 00
01 1b 01 04 a5 29 17 78 02 b1 a5 a1 58 4f 95 26
16 50 54 21 08 00 81 c0 81 80 01 01 01 01 01 01
01 01 01 01 01 01 7f 21 56 aa 51 00 1e 30 46 8f
33 00 c4 fe 10 00 00 1e 66 21 50 b0 51 00 1b 30
40 70 36 00 c4 fe 10 00 00 1e 00 00 00 10 00 00
1b 30 40 70 36 00 c4 8e 21 00 00 1e 00 00 00 fc
00 48 44 20 54 56 0a 0a 0a 0a 0a 0a 0a 0a 00 5f

----------------

Block 0, Base EDID:
  EDID Structure Version & Revision: 1.4
  Vendor & Product Identification:
    Manufacturer: LNG
    Model: 1
    Made in: week 1 of 2017
  Basic Display Parameters & Features:
    Digital display
    Bits per primary color channel: 8
    DisplayPort interface
    Maximum image size: 41 cm x 23 cm
    Gamma: 2.20
    Supported color formats: RGB 4:4:4
    First detailed timing includes the native pixel format and preferred refresh rate
  Color Characteristics:
    Red  : 0.6308, 0.3466
    Green: 0.3085, 0.5830
    Blue : 0.1503, 0.0878
    White: 0.3134, 0.3291
  Established Timings I & II:
    DMT 0x04:   640x480    59.940 Hz   4:3    31.469 kHz  25.175 MHz
    DMT 0x09:   800x600    60.317 Hz   4:3    37.879 kHz  40.000 MHz
    DMT 0x10:  1024x768    60.004 Hz   4:3    48.363 kHz  65.000 MHz
  Standard Timings:
    DMT 0x55:  1280x720    60.000 Hz  16:9    45.000 kHz  74.250 MHz
    DMT 0x23:  1280x1024   60.020 Hz   5:4    63.981 kHz 108.000 MHz
  Detailed Timing Descriptors:
    DTD 1:  1366x768    59.964 Hz 683:384  47.852 kHz  85.750 MHz (452 mm x 254 mm)
                 Hfront   70 Hsync 143 Hback 213 Hpol P
                 Vfront    3 Vsync   3 Vback  24 Vpol P
    DTD 2:  1360x768    60.015 Hz  85:48   47.712 kHz  85.500 MHz (452 mm x 254 mm)
                 Hfront   64 Hsync 112 Hback 256 Hpol P
                 Vfront    3 Vsync   6 Vback  18 Vpol P
    Dummy Descriptor:
    Display Product Name: 'HD TV'
Checksum: 0x5f

----------------

Failures:

Block 0, Base EDID:
  Detailed Timing Descriptor #1: Mismatch of image size 452x254 mm vs display size 410x230 mm.
  Detailed Timing Descriptor #2: Mismatch of image size 452x254 mm vs display size 410x230 mm.
  Dummy Descriptor: Dummy block filled with garbage.
  Display Product Name: Non-space after newline.

EDID conformity: FAIL
