edid-decode (hex):

00 ff ff ff ff ff ff 00 0d ae 82 14 00 00 00 00
1f 16 01 04 95 1f 11 78 02 b5 35 94 55 53 93 29
23 50 54 00 00 00 01 01 01 01 01 01 01 01 01 01
01 01 01 01 01 01 1c 2a 40 54 61 84 1a 30 30 20
35 00 35 ae 10 00 00 18 00 00 00 fe 00 4e 31 34
30 46 47 45 2d 45 41 32 0a 20 00 00 00 fe 00 43
4d 4e 0a 20 20 20 20 20 20 20 20 20 00 00 00 fe
00 4e 31 34 30 46 47 45 2d 45 41 32 0a 20 00 60

----------------

Block 0, Base EDID:
  EDID Structure Version & Revision: 1.4
  Vendor & Product Identification:
    Manufacturer: CMN
    Model: 5250
    Made in: week 31 of 2012
  Basic Display Parameters & Features:
    Digital display
    Bits per primary color channel: 6
    DisplayPort interface
    Maximum image size: 31 cm x 17 cm
    Gamma: 2.20
    Supported color formats: RGB 4:4:4
    First detailed timing includes the native pixel format and preferred refresh rate
  Color Characteristics:
    Red  : 0.5800, 0.3349
    Green: 0.3251, 0.5751
    Blue : 0.1601, 0.1396
    White: 0.3134, 0.3291
  Established Timings I & II: none
  Standard Timings: none
  Detailed Timing Descriptors:
    DTD 1:  1600x900    60.007571 Hz  16:9     55.567 kHz    107.800000 MHz (309 mm x 174 mm)
                 Hfront   48 Hsync  32 Hback  260 Hpol N
                 Vfront    3 Vsync   5 Vback   18 Vpol N
    Alphanumeric Data String: 'N140FGE-EA2'
    Alphanumeric Data String: 'CMN'
    Alphanumeric Data String: 'N140FGE-EA2'
Checksum: 0x60

----------------

Failures:

Block 0, Base EDID:
  Missing Display Product Name.

EDID conformity: FAIL
