
EDID (hex):
00ffffffffffff0025cc0817f5110000
130f01030e221b78eadc55a359489e24
1150543fef808180814081878190714f
614001010101302a009851002a403070
1300520e1100001e000000fc004c452d
313730380a2020202020000000fd0037
4d18520e000a202020202020000000ff
0035313930343539370a20202020002c

Extracted contents:
header:          00 ff ff ff ff ff ff 00
serial number:   25 cc 08 17 f5 11 00 00 13 0f
version:         01 03
basic params:    0e 22 1b 78 ea
chroma info:     dc 55 a3 59 48 9e 24 11 50 54
established:     3f ef 80
standard:        81 80 81 40 81 87 81 90 71 4f 61 40 01 01 01 01
descriptor 1:    30 2a 00 98 51 00 2a 40 30 70 13 00 52 0e 11 00 00 1e
descriptor 2:    00 00 00 fc 00 4c 45 2d 31 37 30 38 0a 20 20 20 20 20
descriptor 3:    00 00 00 fd 00 37 4d 18 52 0e 00 0a 20 20 20 20 20 20
descriptor 4:    00 00 00 ff 00 35 31 39 30 34 35 39 37 0a 20 20 20 20
extensions:      00
checksum:        2c

EDID version: 1.3
Manufacturer: INL Model 1708 Serial Number --
Analog display, Input voltage level: 0.7/0.3 V
Sync: Separate Composite SyncOnGreen 
Maximum image size: 34 cm x 27 cm
Gamma: 2.20
DPMS levels: Standby Suspend Off
RGB color display
First detailed timing is preferred timing
Display x,y Chromaticity:
  Red:   0.6396, 0.3486
  Green: 0.2841, 0.6171
  Blue:  0.1416, 0.0673
  White: 0.3134, 0.3291
Established timings supported:
  640x480@60Hz 4:3 HorFreq: 31469 Hz Clock: 25.175 MHz
  640x480@67Hz 4:3 HorFreq: 35000 Hz Clock: 30.240 MHz
  640x480@72Hz 4:3 HorFreq: 37900 Hz Clock: 31.500 MHz
  640x480@75Hz 4:3 HorFreq: 37500 Hz Clock: 31.500 MHz
  800x600@56Hz 4:3 HorFreq: 35200 Hz Clock: 36.000 MHz
  800x600@60Hz 4:3 HorFreq: 37900 Hz Clock: 40.000 MHz
  800x600@72Hz 4:3 HorFreq: 48100 Hz Clock: 50.000 MHz
  800x600@75Hz 4:3 HorFreq: 46900 Hz Clock: 49.500 MHz
  832x624@75Hz 4:3 HorFreq: 49726 Hz Clock: 57.284 MHz
  1024x768@60Hz 4:3 HorFreq: 48400 Hz Clock: 65.000 MHz
  1024x768@70Hz 4:3 HorFreq: 56500 Hz Clock: 75.000 MHz
  1024x768@75Hz 4:3 HorFreq: 60000 Hz Clock: 78.750 MHz
  1280x1024@75Hz 5:4 HorFreq: 80000 Hz Clock: 135.000 MHz
  1152x870@75Hz 192:145 HorFreq: 67500 Hz Clock: 108.000 MHz
Standard timings supported:
  1280x1024@60Hz 5:4 HorFreq: 64000 Hz Clock: 108.000 MHz
  1280x960@60Hz 4:3 HorFreq: 60000 Hz Clock: 108.000 MHz
  1280x1024@67Hz 5:4
  1280x1024@76Hz 5:4
  1152x864@75Hz 4:3 HorFreq: 67500 Hz Clock: 108.000 MHz
  1024x768@60Hz 4:3 HorFreq: 48400 Hz Clock: 65.000 MHz
Detailed mode: Clock 108.000 MHz, 338 mm x 270 mm
               1280 1328 1440 1688 hborder 0
               1024 1025 1028 1066 vborder 0
               +hsync +vsync 
               VertFreq: 60 Hz, HorFreq: 63981 Hz
Monitor name: LE-1708
Monitor ranges (GTF): 55-77Hz V, 24-82kHz H, max dotclock 140MHz
Serial number: --
Checksum: 0x2c (valid)
EDID block does not conform at all!
	Bad year of manufacture
