edid-decode (hex):

00 ff ff ff ff ff ff 00 22 f0 6c 28 01 01 01 01
11 16 01 04 b5 40 28 78 e2 8d 85 ad 4f 35 b1 25
0e 50 54 00 00 00 01 01 01 01 01 01 01 01 01 01
01 01 01 01 01 01 e2 68 00 a0 a0 40 2e 60 30 20
36 00 81 90 21 00 00 1a bc 1b 00 a0 50 20 17 30
30 20 36 00 81 90 21 00 00 1a 00 00 00 fc 00 48
50 20 5a 52 33 30 77 0a 20 20 20 20 00 00 00 ff
00 43 4e 34 32 31 37 30 42 53 51 0a 20 20 00 32

----------------

Block 0, Base EDID:
  EDID Structure Version & Revision: 1.4
  Vendor & Product Identification:
    Manufacturer: HWP
    Model: 10348
    Serial Number: ...
    Made in: week 17 of 2012
  Basic Display Parameters & Features:
    Digital display
    Bits per primary color channel: 10
    DisplayPort interface
    Maximum image size: 64 cm x 40 cm
    Gamma: 2.20
    DPMS levels: Standby Suspend Off
    Supported color formats: RGB 4:4:4
    First detailed timing includes the native pixel format and preferred refresh rate
  Color Characteristics:
    Red  : 0.6777, 0.3085
    Green: 0.2099, 0.6923
    Blue : 0.1464, 0.0546
    White: 0.3134, 0.3291
  Established Timings I & II: none
  Standard Timings: none
  Detailed Timing Descriptors:
    DTD 1:  2560x1600   59.971589 Hz  16:10    98.713 kHz    268.500000 MHz (641 mm x 400 mm)
                 Hfront   48 Hsync  32 Hback   80 Hpol P
                 Vfront    3 Vsync   6 Vback   37 Vpol N
    DTD 2:  1280x800    59.909545 Hz  16:10    49.306 kHz     71.000000 MHz (641 mm x 400 mm)
                 Hfront   48 Hsync  32 Hback   80 Hpol P
                 Vfront    3 Vsync   6 Vback   14 Vpol N
    Display Product Name: 'HP ZR30w'
    Display Product Serial Number: ...
Checksum: 0x32

----------------

EDID conformity: PASS
