edid-decode (hex):

00 ff ff ff ff ff ff 00 09 e5 c5 07 00 00 00 00
0c 1c 01 04 a5 22 13 78 02 f9 a0 95 5d 59 94 29
24 50 54 00 00 00 01 01 01 01 01 01 01 01 01 01
01 01 01 01 01 01 1a 3b 80 24 71 38 3c 40 30 20
36 00 58 c2 10 00 00 1a 48 2f 80 24 71 38 3c 40
30 20 36 00 58 c2 10 00 00 1a 00 00 00 fe 00 42
4f 45 20 43 51 0a 20 20 20 20 20 20 00 00 00 fe
00 4e 56 31 35 36 46 48 4d 2d 4e 34 32 0a 00 0a

----------------

Block 0, Base EDID:
  EDID Structure Version & Revision: 1.4
  Vendor & Product Identification:
    Manufacturer: BOE
    Model: 1989
    Made in: week 12 of 2018
  Basic Display Parameters & Features:
    Digital display
    Bits per primary color channel: 8
    DisplayPort interface
    Maximum image size: 34 cm x 19 cm
    Gamma: 2.20
    Supported color formats: RGB 4:4:4
    First detailed timing includes the native pixel format and preferred refresh rate
  Color Characteristics:
    Red  : 0.5849, 0.3662
    Green: 0.3496, 0.5791
    Blue : 0.1621, 0.1425
    White: 0.3125, 0.3281
  Established Timings I & II: none
  Standard Timings: none
  Detailed Timing Descriptors:
    DTD 1:  1920x1080   60.000 Hz  16:9    68.400 kHz 151.300 MHz (344 mm x 194 mm)
                 Hfront   48 Hsync  32 Hback 212 Hpol P
                 Vfront    3 Vsync   6 Vback  51 Vpol N
    DTD 2:  1920x1080   48.000 Hz  16:9    54.720 kHz 121.040 MHz (344 mm x 194 mm)
                 Hfront   48 Hsync  32 Hback 212 Hpol P
                 Vfront    3 Vsync   6 Vback  51 Vpol N
    Alphanumeric Data String: 'BOE CQ'
    Alphanumeric Data String: 'NV156FHM-N42'
Checksum: 0xa
