
EDID (hex):
00ffffffffffff000472730656305090
051d0104a5351e7822ce65a657519f27
0f5054b30c00714f818081c081009500
b300d1c001016842806a703827400820
98040f282100001a023a801871382d40
582c45000f282100001e000000fd0030
4b1e5512000a202020202020000000fc
0041636572205647323430590a2000cb

Extracted contents:
header:          00 ff ff ff ff ff ff 00
serial number:   04 72 73 06 56 30 50 90 05 1d
version:         01 04
basic params:    a5 35 1e 78 22
chroma info:     ce 65 a6 57 51 9f 27 0f 50 54
established:     b3 0c 00
standard:        71 4f 81 80 81 c0 81 00 95 00 b3 00 d1 c0 01 01
descriptor 1:    68 42 80 6a 70 38 27 40 08 20 98 04 0f 28 21 00 00 1a
descriptor 2:    02 3a 80 18 71 38 2d 40 58 2c 45 00 0f 28 21 00 00 1e
descriptor 3:    00 00 00 fd 00 30 4b 1e 55 12 00 0a 20 20 20 20 20 20
descriptor 4:    00 00 00 fc 00 41 63 65 72 20 56 47 32 34 30 59 0a 20
extensions:      00
checksum:        cb

EDID version: 1.4
Manufacturer: ACR Model 673 Serial Number --
Made in week 5 of 2019
Digital display
8 bits per primary color channel
DisplayPort interface
Maximum image size: 53 cm x 30 cm
Gamma: 2.20
DPMS levels: Off
Supported color formats: RGB 4:4:4
First detailed timing includes the native pixel format and preferred refresh rate
Display x,y Chromaticity:
  Red:   0.6513, 0.3398
  Green: 0.3193, 0.6230
  Blue:  0.1533, 0.0605
  White: 0.3134, 0.3291
Established timings supported:
  720x400@70Hz 9:5 HorFreq: 31469 Hz Clock: 28.320 MHz
  640x480@60Hz 4:3 HorFreq: 31469 Hz Clock: 25.175 MHz
  640x480@67Hz 4:3 HorFreq: 35000 Hz Clock: 30.240 MHz
  800x600@56Hz 4:3 HorFreq: 35200 Hz Clock: 36.000 MHz
  800x600@60Hz 4:3 HorFreq: 37900 Hz Clock: 40.000 MHz
  1024x768@60Hz 4:3 HorFreq: 48400 Hz Clock: 65.000 MHz
  1024x768@70Hz 4:3 HorFreq: 56500 Hz Clock: 75.000 MHz
Standard timings supported:
  1152x864@75Hz 4:3 HorFreq: 67500 Hz Clock: 108.000 MHz
  1280x1024@60Hz 5:4 HorFreq: 64000 Hz Clock: 108.000 MHz
  1280x720@60Hz 16:9
  1280x800@60Hz 16:10
  1440x900@60Hz 16:10 HorFreq: 55500 Hz Clock: 88.750 MHz
  1680x1050@60Hz 16:10 HorFreq: 64700 Hz Clock: 119.000 MHz
  1920x1080@60Hz 16:9
Detailed mode: Clock 170.000 MHz, 527 mm x 296 mm
               1920 1928 1960 2026 hborder 0
               1080 1105 1113 1119 vborder 0
               +hsync -vsync 
               VertFreq: 74 Hz, HorFreq: 83909 Hz
Detailed mode: Clock 148.500 MHz, 527 mm x 296 mm
               1920 2008 2052 2200 hborder 0
               1080 1084 1089 1125 vborder 0
               +hsync +vsync 
               VertFreq: 60 Hz, HorFreq: 67500 Hz
Monitor ranges (GTF): 48-75Hz V, 30-85kHz H, max dotclock 180MHz
Monitor name: Acer VG240Y
Checksum: 0xcb (valid)


