
EDID (hex):
00ffffffffffff0009d1b27845540000
261601036f331d782ed945a2554da027
125054a56b8081c08180b300d1c08100
a9c001010101023a801871382d40582c
4500fe1f1100001e000000fd00324c1e
5315000a202020202020000000fc0047
323332304844424c0a202020000000ff
004c394330343034353031390a200001

Extracted contents:
header:          00 ff ff ff ff ff ff 00
serial number:   09 d1 b2 78 45 54 00 00 26 16
version:         01 03
basic params:    6f 33 1d 78 2e
chroma info:     d9 45 a2 55 4d a0 27 12 50 54
established:     a5 6b 80
standard:        81 c0 81 80 b3 00 d1 c0 81 00 a9 c0 01 01 01 01
descriptor 1:    02 3a 80 18 71 38 2d 40 58 2c 45 00 fe 1f 11 00 00 1e
descriptor 2:    00 00 00 fd 00 32 4c 1e 53 15 00 0a 20 20 20 20 20 20
descriptor 3:    00 00 00 fc 00 47 32 33 32 30 48 44 42 4c 0a 20 20 20
descriptor 4:    00 00 00 ff 00 4c 39 43 30 34 30 34 35 30 31 39 0a 20
extensions:      00
checksum:        01

EDID version: 1.3
Manufacturer: BNQ Model 78b2 Serial Number --
Made in week 38 of 2012
Analog display, Input voltage level: 0.7/0.7 V
Sync: Separate Composite SyncOnGreen Serration 
Maximum image size: 51 cm x 29 cm
Gamma: 2.20
DPMS levels: Off
RGB color display
Default (sRGB) color space is primary color space
First detailed timing is preferred timing
Display x,y Chromaticity:
  Red:   0.6357, 0.3330
  Green: 0.3027, 0.6259
  Blue:  0.1533, 0.0703
  White: 0.3134, 0.3291
Established timings supported:
  720x400@70Hz 9:5 HorFreq: 31469 Hz Clock: 28.320 MHz
  640x480@60Hz 4:3 HorFreq: 31469 Hz Clock: 25.175 MHz
  640x480@75Hz 4:3 HorFreq: 37500 Hz Clock: 31.500 MHz
  800x600@60Hz 4:3 HorFreq: 37900 Hz Clock: 40.000 MHz
  800x600@75Hz 4:3 HorFreq: 46900 Hz Clock: 49.500 MHz
  832x624@75Hz 4:3 HorFreq: 49726 Hz Clock: 57.284 MHz
  1024x768@60Hz 4:3 HorFreq: 48400 Hz Clock: 65.000 MHz
  1024x768@75Hz 4:3 HorFreq: 60000 Hz Clock: 78.750 MHz
  1280x1024@75Hz 5:4 HorFreq: 80000 Hz Clock: 135.000 MHz
  1152x870@75Hz 192:145 HorFreq: 67500 Hz Clock: 108.000 MHz
Standard timings supported:
  1280x720@60Hz 16:9
  1280x1024@60Hz 5:4 HorFreq: 64000 Hz Clock: 108.000 MHz
  1680x1050@60Hz 16:10 HorFreq: 64700 Hz Clock: 119.000 MHz
  1920x1080@60Hz 16:9
  1280x800@60Hz 16:10
  1600x900@60Hz 16:9
Detailed mode: Clock 148.500 MHz, 510 mm x 287 mm
               1920 2008 2052 2200 hborder 0
               1080 1084 1089 1125 vborder 0
               +hsync +vsync 
               VertFreq: 60 Hz, HorFreq: 67500 Hz
Monitor ranges (GTF): 50-76Hz V, 30-83kHz H, max dotclock 210MHz
Monitor name: G2320HDBL
Serial number: --
Checksum: 0x1 (valid)
EDID block does NOT conform to EDID 1.3!
	sRGB is signaled, but the chromaticities do not match
