edid-decode (hex):

00 ff ff ff ff ff ff 00 1e 6d 95 5b eb 69 03 00
06 1e 01 03 80 46 27 78 ea 9f d1 a2 57 4c 9c 24
0c 50 54 25 6b 80 71 40 81 80 81 c0 a9 c0 b3 00
d1 c0 81 00 d1 cf 56 5e 00 a0 a0 a0 29 50 30 20
35 00 ba 88 21 00 00 1a 00 00 00 fd 00 30 4b 1e
70 1f 01 0a 20 20 20 20 20 20 00 00 00 fc 00 4c
47 20 48 44 52 20 51 48 44 0a 20 20 00 00 00 ff
00 30 30 36 4e 54 4d 58 36 4b 37 32 33 0a 01 f0

02 03 31 f1 4b 01 03 04 90 12 13 1f 22 5d 5e 5f
23 09 07 07 83 01 00 00 6d 03 0c 00 10 00 b8 3e
20 00 60 01 02 03 e3 05 c0 00 e6 06 05 01 59 59
28 02 3a 80 18 71 38 2d 40 58 2c 45 00 ba 88 21
00 00 1e 01 1d 00 72 51 d0 1e 20 6e 28 55 00 ba
88 21 00 00 1e 30 75 00 90 a0 a0 28 50 30 20 35
00 ba 88 21 00 00 1a 00 00 00 00 00 00 00 00 00
00 00 ba 00 00 00 00 00 00 00 00 00 00 00 00 04

----------------

Block 0, Base EDID:
  EDID Structure Version & Revision: 1.3
  Vendor & Product Identification:
    Manufacturer: GSM
    Model: 23445
    Serial Number: ...
    Made in: week 6 of 2020
  Basic Display Parameters & Features:
    Digital display
    Maximum image size: 70 cm x 39 cm
    Gamma: 2.20
    DPMS levels: Standby Suspend Off
    RGB color display
    First detailed timing is the preferred timing
  Color Characteristics:
    Red  : 0.6347, 0.3408
    Green: 0.2998, 0.6123
    Blue : 0.1435, 0.0478
    White: 0.3125, 0.3291
  Established Timings I & II:
    DMT 0x04:   640x480    59.940 Hz   4:3    31.469 kHz  25.175 MHz
    DMT 0x06:   640x480    75.000 Hz   4:3    37.500 kHz  31.500 MHz
    DMT 0x09:   800x600    60.317 Hz   4:3    37.879 kHz  40.000 MHz
    DMT 0x0b:   800x600    75.000 Hz   4:3    46.875 kHz  49.500 MHz
    Apple   :   832x624    74.551 Hz   4:3    49.726 kHz  57.284 MHz
    DMT 0x10:  1024x768    60.004 Hz   4:3    48.363 kHz  65.000 MHz
    DMT 0x12:  1024x768    75.029 Hz   4:3    60.023 kHz  78.750 MHz
    DMT 0x24:  1280x1024   75.025 Hz   5:4    79.976 kHz 135.000 MHz
    Apple   :  1152x870    75.062 Hz 192:145  68.681 kHz 100.000 MHz
  Standard Timings:
    GTF     :  1152x864    60.000 Hz   4:3    53.700 kHz  81.624 MHz
    DMT 0x23:  1280x1024   60.020 Hz   5:4    63.981 kHz 108.000 MHz
    DMT 0x55:  1280x720    60.000 Hz  16:9    45.000 kHz  74.250 MHz
    DMT 0x53:  1600x900    60.000 Hz  16:9    60.000 kHz 108.000 MHz (RB)
    DMT 0x3a:  1680x1050   59.954 Hz  16:10   65.290 kHz 146.250 MHz
    DMT 0x52:  1920x1080   60.000 Hz  16:9    67.500 kHz 148.500 MHz
    DMT 0x1c:  1280x800    59.810 Hz  16:10   49.702 kHz  83.500 MHz
    GTF     :  1920x1080   75.000 Hz  16:9    84.600 kHz 220.637 MHz
  Detailed Timing Descriptors:
    DTD 1:  2560x1440   59.951 Hz  16:9    88.787 kHz 241.500 MHz (698 mm x 392 mm)
                 Hfront   48 Hsync  32 Hback  80 Hpol P
                 Vfront    3 Vsync   5 Vback  33 Vpol N
  Display Range Limits:
    Monitor ranges (Bare Limits): 48-75 Hz V, 30-112 kHz H, max dotclock 310 MHz
    Display Product Name: 'LG HDR QHD'
    Display Product Serial Number: ...
  Extension blocks: 1
Checksum: 0xf0

----------------

Block 1, CTA-861 Extension Block:
  Revision: 3
  Underscans IT Video Formats by default
  Basic audio support
  Supports YCbCr 4:4:4
  Supports YCbCr 4:2:2
  Native detailed modes: 1
  Video Data Block:
    VIC   1:   640x480    59.940 Hz   4:3    31.469 kHz  25.175 MHz
    VIC   3:   720x480    59.940 Hz  16:9    31.469 kHz  27.000 MHz
    VIC   4:  1280x720    60.000 Hz  16:9    45.000 kHz  74.250 MHz
    VIC  16:  1920x1080   60.000 Hz  16:9    67.500 kHz 148.500 MHz (native)
    VIC  18:   720x576    50.000 Hz  16:9    31.250 kHz  27.000 MHz
    VIC  19:  1280x720    50.000 Hz  16:9    37.500 kHz  74.250 MHz
    VIC  31:  1920x1080   50.000 Hz  16:9    56.250 kHz 148.500 MHz
    VIC  34:  1920x1080   30.000 Hz  16:9    33.750 kHz  74.250 MHz
    VIC  93:  3840x2160   24.000 Hz  16:9    54.000 kHz 297.000 MHz
    VIC  94:  3840x2160   25.000 Hz  16:9    56.250 kHz 297.000 MHz
    VIC  95:  3840x2160   30.000 Hz  16:9    67.500 kHz 297.000 MHz
  Audio Data Block:
    Linear PCM:
      Max channels: 2
      Supported sample rates (kHz): 48 44.1 32
      Supported sample sizes (bits): 24 20 16
  Speaker Allocation Data Block:
    FL/FR - Front Left/Right
  Vendor-Specific Data Block (HDMI), OUI 00-0C-03:
    Source physical address: 1.0.0.0
    Supports_AI
    DC_36bit
    DC_30bit
    DC_Y444
    Maximum TMDS clock: 310 MHz
    Extended HDMI video details:
      HDMI VICs:
        HDMI VIC 1:  3840x2160   30.000 Hz  16:9    67.500 kHz 297.000 MHz
        HDMI VIC 2:  3840x2160   25.000 Hz  16:9    56.250 kHz 297.000 MHz
        HDMI VIC 3:  3840x2160   24.000 Hz  16:9    54.000 kHz 297.000 MHz
  Colorimetry Data Block:
    BT2020YCC
    BT2020RGB
  HDR Static Metadata Data Block:
    Electro optical transfer functions:
      Traditional gamma - SDR luminance range
      SMPTE ST2084
    Supported static metadata descriptors:
      Static metadata type 1
    Desired content max luminance: 89 (343.724 cd/m^2)
    Desired content max frame-average luminance: 89 (343.724 cd/m^2)
    Desired content min luminance: 40 (0.085 cd/m^2)
  Detailed Timing Descriptors:
    DTD 2:  1920x1080   60.000 Hz  16:9    67.500 kHz 148.500 MHz (698 mm x 392 mm)
                 Hfront   88 Hsync  44 Hback 148 Hpol P
                 Vfront    4 Vsync   5 Vback  36 Vpol P
    DTD 3:  1280x720    60.000 Hz  16:9    45.000 kHz  74.250 MHz (698 mm x 392 mm)
                 Hfront  110 Hsync  40 Hback 220 Hpol P
                 Vfront    5 Vsync   5 Vback  20 Vpol P
    DTD 4:  2560x1440   74.964 Hz  16:9   110.947 kHz 300.000 MHz (698 mm x 392 mm)
                 Hfront   48 Hsync  32 Hback  64 Hpol P
                 Vfront    3 Vsync   5 Vback  32 Vpol N
    Manufacturer-Specified Display Descriptor (0x00): 00 00 00 00 00 00 00 00 00 ba 00 00 00 00 00 00 '................'
Checksum: 0x04

----------------

Warnings:

Block 1, CTA-861 Extension Block:
  Display Product Serial Number is set, so the Serial Number in the Base EDID should be 0.
  Missing VCDB, needed for Set Selectable RGB Quantization to avoid interop issues.

Failures:

Block 0, Base EDID:
  Display Range Limits: 'Bare Limits' is not allowed for EDID < 1.4.
EDID:
  Base EDID: GTF timings are used, but the EDID does not signal GTF support.
  Base EDID: Some timings are out of range of the Monitor Ranges:
    Vertical Freq: 24.000 - 75.062 Hz (Monitor: 48.000 - 75.000 Hz)
  CTA-861: Native progressive timings are a mix of several resolutions.

EDID conformity: FAIL
