
EDID (hex):
00ffffffffffff000472eb02d7127060
071a010380331d78ae2b05a35752a128
0e5054b30c00714f818081009500d1c0
010101010101023a801871382d40582c
4500fd1e1100001e000000fd00384c1e
5012000a202020202020000000fc0047
323336484c0a202020202020000000ff
004c564e534a303033323438320a00ae

Extracted contents:
header:          00 ff ff ff ff ff ff 00
serial number:   04 72 eb 02 d7 12 70 60 07 1a
version:         01 03
basic params:    80 33 1d 78 ae
chroma info:     2b 05 a3 57 52 a1 28 0e 50 54
established:     b3 0c 00
standard:        71 4f 81 80 81 00 95 00 d1 c0 01 01 01 01 01 01
descriptor 1:    02 3a 80 18 71 38 2d 40 58 2c 45 00 fd 1e 11 00 00 1e
descriptor 2:    00 00 00 fd 00 38 4c 1e 50 12 00 0a 20 20 20 20 20 20
descriptor 3:    00 00 00 fc 00 47 32 33 36 48 4c 0a 20 20 20 20 20 20
descriptor 4:    00 00 00 ff 00 4c 56 4e 53 4a 30 30 33 32 34 38 32 0a
extensions:      00
checksum:        ae

EDID version: 1.3
Manufacturer: ACR Model 2eb Serial Number --
Made in week 7 of 2016
Digital display
Maximum image size: 51 cm x 29 cm
Gamma: 2.20
DPMS levels: Standby Off
RGB color display
Default (sRGB) color space is primary color space
First detailed timing is preferred timing
Display x,y Chromaticity:
  Red:   0.6367, 0.3417
  Green: 0.3222, 0.6318
  Blue:  0.1562, 0.0546
  White: 0.3134, 0.3291
Established timings supported:
  720x400@70Hz 9:5 HorFreq: 31469 Hz Clock: 28.320 MHz
  640x480@60Hz 4:3 HorFreq: 31469 Hz Clock: 25.175 MHz
  640x480@67Hz 4:3 HorFreq: 35000 Hz Clock: 30.240 MHz
  800x600@56Hz 4:3 HorFreq: 35200 Hz Clock: 36.000 MHz
  800x600@60Hz 4:3 HorFreq: 37900 Hz Clock: 40.000 MHz
  1024x768@60Hz 4:3 HorFreq: 48400 Hz Clock: 65.000 MHz
  1024x768@70Hz 4:3 HorFreq: 56500 Hz Clock: 75.000 MHz
Standard timings supported:
  1152x864@75Hz 4:3 HorFreq: 67500 Hz Clock: 108.000 MHz
  1280x1024@60Hz 5:4 HorFreq: 64000 Hz Clock: 108.000 MHz
  1280x800@60Hz 16:10
  1440x900@60Hz 16:10 HorFreq: 55500 Hz Clock: 88.750 MHz
  1920x1080@60Hz 16:9
Detailed mode: Clock 148.500 MHz, 509 mm x 286 mm
               1920 2008 2052 2200 hborder 0
               1080 1084 1089 1125 vborder 0
               +hsync +vsync 
               VertFreq: 60 Hz, HorFreq: 67500 Hz
Monitor ranges (GTF): 56-76Hz V, 30-80kHz H, max dotclock 180MHz
Monitor name: G236HL
Serial number: --
Checksum: 0xae (valid)
EDID block does NOT conform to EDID 1.3!
	sRGB is signaled, but the chromaticities do not match
