edid-decode (hex):

00 ff ff ff ff ff ff 00 4c 83 42 49 00 00 00 00
00 16 01 04 90 1f 11 78 0a 81 35 94 5b 57 8f 29
1e 50 54 00 00 00 01 01 01 01 01 01 01 01 01 01
01 01 01 01 01 01 ce 1d 56 f0 50 00 18 30 40 30
25 00 35 ae 10 00 00 19 d8 13 56 f0 50 00 18 30
40 30 25 00 35 ae 10 00 00 19 00 00 00 00 00 00
00 00 00 00 00 00 00 00 00 00 00 00 00 00 00 02
00 0c 4c ff 0a 3c 64 14 14 22 64 00 00 00 00 44

----------------

Block 0, Base EDID:
  EDID Structure Version & Revision: 1.4
  Vendor & Product Identification:
    Manufacturer: SDC
    Model: 18754
    Made in: 2012
  Basic Display Parameters & Features:
    Digital display
    Bits per primary color channel: 6
    Digital interface is not defined
    Maximum image size: 31 cm x 17 cm
    Gamma: 2.20
    Supported color formats: RGB 4:4:4, YCrCb 4:4:4
    First detailed timing includes the native pixel format and preferred refresh rate
  Color Characteristics:
    Red  : 0.5800, 0.3554
    Green: 0.3398, 0.5595
    Blue : 0.1601, 0.1201
    White: 0.3134, 0.3291
  Established Timings I & II: none
  Standard Timings: none
  Detailed Timing Descriptors:
    DTD 1:  1366x768    59.987 Hz 683:384  47.509 kHz  76.300 MHz (309 mm x 174 mm)
                 Hfront   64 Hsync  48 Hback 128 Hpol N
                 Vfront    2 Vsync   5 Vback  17 Vpol N
    DTD 2:  1366x768    39.939 Hz 683:384  31.631 kHz  50.800 MHz (309 mm x 174 mm)
                 Hfront   64 Hsync  48 Hback 128 Hpol N
                 Vfront    2 Vsync   5 Vback  17 Vpol N
    Empty Descriptor
    Manufacturer-Specified Display Descriptor (0x02): 00 02 00 0c 4c ff 0a 3c 64 14 14 22 64 00 00 00 '....L..<d.."d...'
Checksum: 0x44

----------------

Failures:

Block 0, Base EDID:
  Empty Descriptor: Use Dummy Descriptor instead of all zeroes.
  Missing Display Product Name.

EDID conformity: FAIL
