
EDID (hex):
00ffffffffffff0010ac0ca0554b3433
0c0f0103681e17782eb030a1584f9526
1c5054afce0001010101010101010101
01010101010164190040410026301888
360030e410000018000000ff00553439
333835334633344b5543000000fd0038
4c1e3d08000a202020202020000000fc
0044454c4c204531353346500a2000f2

Extracted contents:
header:          00 ff ff ff ff ff ff 00
serial number:   10 ac 0c a0 55 4b 34 33 0c 0f
version:         01 03
basic params:    68 1e 17 78 2e
chroma info:     b0 30 a1 58 4f 95 26 1c 50 54
established:     af ce 00
standard:        01 01 01 01 01 01 01 01 01 01 01 01 01 01 01 01
descriptor 1:    64 19 00 40 41 00 26 30 18 88 36 00 30 e4 10 00 00 18
descriptor 2:    00 00 00 ff 00 55 34 39 33 38 35 33 46 33 34 4b 55 43
descriptor 3:    00 00 00 fd 00 38 4c 1e 3d 08 00 0a 20 20 20 20 20 20
descriptor 4:    00 00 00 fc 00 44 45 4c 4c 20 45 31 35 33 46 50 0a 20
extensions:      00
checksum:        f2

EDID version: 1.3
Manufacturer: DEL Model a00c Serial Number --
Analog display, Input voltage level: 0.7/0.7 V
Sync: Separate 
Maximum image size: 30 cm x 23 cm
Gamma: 2.20
DPMS levels: Off
RGB color display
Default (sRGB) color space is primary color space
First detailed timing is preferred timing
Display x,y Chromaticity:
  Red:   0.6308, 0.3466
  Green: 0.3085, 0.5820
  Blue:  0.1484, 0.1123
  White: 0.3125, 0.3281
Established timings supported:
  720x400@70Hz 9:5 HorFreq: 31469 Hz Clock: 28.320 MHz
  640x480@60Hz 4:3 HorFreq: 31469 Hz Clock: 25.175 MHz
  640x480@72Hz 4:3 HorFreq: 37900 Hz Clock: 31.500 MHz
  640x480@75Hz 4:3 HorFreq: 37500 Hz Clock: 31.500 MHz
  800x600@56Hz 4:3 HorFreq: 35200 Hz Clock: 36.000 MHz
  800x600@60Hz 4:3 HorFreq: 37900 Hz Clock: 40.000 MHz
  800x600@72Hz 4:3 HorFreq: 48100 Hz Clock: 50.000 MHz
  800x600@75Hz 4:3 HorFreq: 46900 Hz Clock: 49.500 MHz
  1024x768@60Hz 4:3 HorFreq: 48400 Hz Clock: 65.000 MHz
  1024x768@70Hz 4:3 HorFreq: 56500 Hz Clock: 75.000 MHz
  1024x768@75Hz 4:3 HorFreq: 60000 Hz Clock: 78.750 MHz
Standard timings supported:
Detailed mode: Clock 65.000 MHz, 304 mm x 228 mm
               1024 1048 1184 1344 hborder 0
                768  771  777  806 vborder 0
               -hsync -vsync 
               VertFreq: 60 Hz, HorFreq: 48363 Hz
Serial number: --
Monitor ranges (GTF): 56-76Hz V, 30-61kHz H, max dotclock 80MHz
Monitor name: DELL E153FP
Checksum: 0xf2 (valid)
EDID block does NOT conform to EDID 1.3!
	sRGB is signaled, but the chromaticities do not match
EDID block does not conform at all!
	Bad year of manufacture
