
EDID (hex):
00ffffffffffff0010ac18a04c344331
151001030e2b1b78eeee91a3544c9926
0f5054a54b008180714f010101010101
01010101010121399030621a274068b0
3600b20e1100001c000000ff00484637
333036354f3143344c0a000000fc0044
454c4c20323030375746500a000000fd
00384c1e530f000a20202020202000eb

Extracted contents:
header:          00 ff ff ff ff ff ff 00
serial number:   10 ac 18 a0 4c 34 43 31 15 10
version:         01 03
basic params:    0e 2b 1b 78 ee
chroma info:     ee 91 a3 54 4c 99 26 0f 50 54
established:     a5 4b 00
standard:        81 80 71 4f 01 01 01 01 01 01 01 01 01 01 01 01
descriptor 1:    21 39 90 30 62 1a 27 40 68 b0 36 00 b2 0e 11 00 00 1c
descriptor 2:    00 00 00 ff 00 48 46 37 33 30 36 35 4f 31 43 34 4c 0a
descriptor 3:    00 00 00 fc 00 44 45 4c 4c 20 32 30 30 37 57 46 50 0a
descriptor 4:    00 00 00 fd 00 38 4c 1e 53 0f 00 0a 20 20 20 20 20 20
extensions:      00
checksum:        eb

EDID version: 1.3
Manufacturer: DEL Model a018 Serial Number --
Made in week 21 of 2006
Analog display, Input voltage level: 0.7/0.3 V
Sync: Separate Composite SyncOnGreen 
Maximum image size: 43 cm x 27 cm
Gamma: 2.20
DPMS levels: Standby Suspend Off
RGB color display
Default (sRGB) color space is primary color space
First detailed timing is preferred timing
Display x,y Chromaticity:
  Red:   0.6396, 0.3300
  Green: 0.2998, 0.5996
  Blue:  0.1503, 0.0595
  White: 0.3125, 0.3291
Established timings supported:
  720x400@70Hz 9:5 HorFreq: 31469 Hz Clock: 28.320 MHz
  640x480@60Hz 4:3 HorFreq: 31469 Hz Clock: 25.175 MHz
  640x480@75Hz 4:3 HorFreq: 37500 Hz Clock: 31.500 MHz
  800x600@60Hz 4:3 HorFreq: 37900 Hz Clock: 40.000 MHz
  800x600@75Hz 4:3 HorFreq: 46900 Hz Clock: 49.500 MHz
  1024x768@60Hz 4:3 HorFreq: 48400 Hz Clock: 65.000 MHz
  1024x768@75Hz 4:3 HorFreq: 60000 Hz Clock: 78.750 MHz
  1280x1024@75Hz 5:4 HorFreq: 80000 Hz Clock: 135.000 MHz
Standard timings supported:
  1280x1024@60Hz 5:4 HorFreq: 64000 Hz Clock: 108.000 MHz
  1152x864@75Hz 4:3 HorFreq: 67500 Hz Clock: 108.000 MHz
Detailed mode: Clock 146.250 MHz, 434 mm x 270 mm
               1680 1784 1960 2240 hborder 0
               1050 1053 1059 1089 vborder 0
               -hsync +vsync 
               VertFreq: 59 Hz, HorFreq: 65290 Hz
Serial number: --
Monitor name: DELL 2007WFP
Monitor ranges (GTF): 56-76Hz V, 30-83kHz H, max dotclock 150MHz
Checksum: 0xeb (valid)
