
EDID (hex):
00ffffffffffff0004723206ffffffff
ff1c0104b53c22783aa891af4e30b325
0d505421080001010101010101010101
0101010101014dd000a0f0703e803020
350056502100001a000000ff00234153
4d58616b344276367a64000000fd0818
9034437f010a202020202020000000fc
0041636572205832370a202020200295
020320f12309070183010000654b0400
0101e305c000e2006ae60605018b7701
a36600a0f0701f803020350056502100
001aef5100a0f0701980302035005650
2100001a000000000000000000000000
00000000000000000000000000000000
00000000000000000000000000000000
00000000000000000000000000000046
70137903000f000aa4140e0e07012045
000002010d31f88a4e0813b358320d01
45540301503a9b0104ff0e4f0007801f
006f084d0002000400154c0104ff0e4f
0007801f006f08340002000400bc1401
04ff0e4f0007801f006f082b00020004
0079ed0104ff0e4f0007801f006f084d
00020004000000000000000000003e90

edid-decode (hex):

00 ff ff ff ff ff ff 00 04 72 32 06 ff ff ff ff
ff 1c 01 04 b5 3c 22 78 3a a8 91 af 4e 30 b3 25
0d 50 54 21 08 00 01 01 01 01 01 01 01 01 01 01
01 01 01 01 01 01 4d d0 00 a0 f0 70 3e 80 30 20
35 00 56 50 21 00 00 1a 00 00 00 ff 00 23 41 53
4d 58 61 6b 34 42 76 36 7a 64 00 00 00 fd 08 18
90 34 43 7f 01 0a 20 20 20 20 20 20 00 00 00 fc
00 41 63 65 72 20 58 32 37 0a 20 20 20 20 02 95

02 03 20 f1 23 09 07 01 83 01 00 00 65 4b 04 00
01 01 e3 05 c0 00 e2 00 6a e6 06 05 01 8b 77 01
a3 66 00 a0 f0 70 1f 80 30 20 35 00 56 50 21 00
00 1a ef 51 00 a0 f0 70 19 80 30 20 35 00 56 50
21 00 00 1a 00 00 00 00 00 00 00 00 00 00 00 00
00 00 00 00 00 00 00 00 00 00 00 00 00 00 00 00
00 00 00 00 00 00 00 00 00 00 00 00 00 00 00 00
00 00 00 00 00 00 00 00 00 00 00 00 00 00 00 46

70 13 79 03 00 0f 00 0a a4 14 0e 0e 07 01 20 45
00 00 02 01 0d 31 f8 8a 4e 08 13 b3 58 32 0d 01
45 54 03 01 50 3a 9b 01 04 ff 0e 4f 00 07 80 1f
00 6f 08 4d 00 02 00 04 00 15 4c 01 04 ff 0e 4f
00 07 80 1f 00 6f 08 34 00 02 00 04 00 bc 14 01
04 ff 0e 4f 00 07 80 1f 00 6f 08 2b 00 02 00 04
00 79 ed 01 04 ff 0e 4f 00 07 80 1f 00 6f 08 4d
00 02 00 04 00 00 00 00 00 00 00 00 00 00 3e 90

----------------

Block 0, Base EDID:
  EDID Structure Version & Revision: 1.4
  Vendor & Product Identification:
    Manufacturer: ACR
    Model: 1586
    Serial Number: 4294967295
    Model year: 2018
  Basic Display Parameters & Features:
    Digital display
    Bits per primary color channel: 10
    DisplayPort interface
    Maximum image size: 60 cm x 34 cm
    Gamma: 2.20
    DPMS levels: Off
    Supported color formats: RGB 4:4:4, YCrCb 4:4:4, YCrCb 4:2:2
    First detailed timing includes the native pixel format and preferred refresh rate
  Color Characteristics:
    Red  : 0.6855, 0.3066
    Green: 0.1894, 0.6992
    Blue : 0.1464, 0.0517
    White: 0.3125, 0.3291
  Established Timings I & II:
    DMT 0x04:   640x480    59.940476 Hz   4:3     31.469 kHz     25.175000 MHz
    DMT 0x09:   800x600    60.316541 Hz   4:3     37.879 kHz     40.000000 MHz
    DMT 0x10:  1024x768    60.003840 Hz   4:3     48.363 kHz     65.000000 MHz
  Standard Timings: none
  Detailed Timing Descriptors:
    DTD 1:  3840x2160   59.996625 Hz  16:9    133.312 kHz    533.250000 MHz (598 mm x 336 mm)
                 Hfront   48 Hsync  32 Hback   80 Hpol P
                 Vfront    3 Vsync   5 Vback   54 Vpol N
    Display Product Serial Number: '#ASMXak4Bv6zd'
    Display Range Limits:
      Monitor ranges (Bare Limits): 24-144 Hz V, 52-322 kHz H, max dotclock 1270 MHz
    Display Product Name: 'Acer X27'
  Extension blocks: 2
Checksum: 0x95

----------------

Block 1, CTA-861 Extension Block:
  Revision: 3
  Underscans IT Video Formats by default
  Basic audio support
  Supports YCbCr 4:4:4
  Supports YCbCr 4:2:2
  Native detailed modes: 1
  Audio Data Block:
    Linear PCM:
      Max channels: 2
      Supported sample rates (kHz): 48 44.1 32
      Supported sample sizes (bits): 16
  Speaker Allocation Data Block:
    FL/FR - Front Left/Right
  Vendor-Specific Data Block (NVIDIA), OUI 00-04-4B:
    01 01                                           '..'
  Colorimetry Data Block:
    BT2020YCC
    BT2020RGB
  Video Capability Data Block:
    YCbCr quantization: No Data
    RGB quantization: Selectable (via AVI Q)
    PT scan behavior: Always Underscanned
    IT scan behavior: Always Underscanned
    CE scan behavior: Always Underscanned
  HDR Static Metadata Data Block:
    Electro optical transfer functions:
      Traditional gamma - SDR luminance range
      SMPTE ST2084
    Supported static metadata descriptors:
      Static metadata type 1
    Desired content max luminance: 139 (1015.241 cd/m^2)
    Desired content max frame-average luminance: 119 (658.302 cd/m^2)
    Desired content min luminance: 1 (0.000 cd/m^2)
  Detailed Timing Descriptors:
    DTD 2:  3840x2160   29.980602 Hz  16:9     65.688 kHz    262.750000 MHz (598 mm x 336 mm)
                 Hfront   48 Hsync  32 Hback   80 Hpol P
                 Vfront    3 Vsync   5 Vback   23 Vpol N
    DTD 3:  3840x2160   23.998856 Hz  16:9     52.438 kHz    209.750000 MHz (598 mm x 336 mm)
                 Hfront   48 Hsync  32 Hback   80 Hpol P
                 Vfront    3 Vsync   5 Vback   17 Vpol N
Checksum: 0x46  Unused space in Extension Block: 59 bytes

----------------

Block 2, DisplayID Extension Block:
  Version: 1.3
  Extension Count: 0
  Display Product Type: Standalone display device
  Display Interface Data Block:
    Interface Type: DisplayPort
    Number of Links: 4
    Interface Standard Version: 1.4
    Supported bpc for RGB encoding: 8, 10, 12
    Supported bpc for YCbCr 4:4:4 encoding: 8, 10, 12
    Supported bpc for YCbCr 4:2:2 encoding: 8, 10, 12
    Supported Content Protection: HDCP 2.0
    Spread Spectrum: Down Spread 0.5%
  Color Characteristics Data Block:
    Uses spatial color
    Uses 1931 CIE (x, y) coordinates
    Primary #0: (0.6855, 0.3066)
    Primary #1: (0.1895, 0.6995)
    Primary #2: (0.1465, 0.0515)
    White point #0: (0.3127, 0.3291)
  Video Timing Modes Type 1 - Detailed Timings Data Block:
    DTD:  3840x2160  119.999407 Hz  16:9    268.559 kHz   1052.750000 MHz (aspect 16:9, no 3D stereo)
               Hfront    8 Hsync  32 Hback   40 Hpol P
               Vfront    3 Vsync   5 Vback   70 Vpol N
    DTD:  3840x2160   97.999299 Hz  16:9    216.872 kHz    850.140000 MHz (aspect 16:9, no 3D stereo)
               Hfront    8 Hsync  32 Hback   40 Hpol P
               Vfront    3 Vsync   5 Vback   45 Vpol N
    DTD:  3840x2160   81.999565 Hz  16:9    180.727 kHz    708.450000 MHz (aspect 16:9, no 3D stereo)
               Hfront    8 Hsync  32 Hback   40 Hpol P
               Vfront    3 Vsync   5 Vback   36 Vpol N
    DTD:  3840x2160  143.999289 Hz  16:9    322.270 kHz   1263.300000 MHz (aspect 16:9, no 3D stereo)
               Hfront    8 Hsync  32 Hback   40 Hpol P
               Vfront    3 Vsync   5 Vback   70 Vpol N
  Checksum: 0x3e
Checksum: 0x90
