edid-decode (hex):

00 ff ff ff ff ff ff 00 06 af 14 42 00 00 00 00
01 11 01 03 80 1a 10 78 0a 89 e5 94 57 54 93 27
22 50 54 00 00 00 01 01 01 01 01 01 01 01 01 01
01 01 01 01 01 01 e9 1b 00 a8 50 20 16 30 30 20
36 00 05 a3 10 00 00 19 00 00 00 00 00 00 00 00
00 00 00 00 00 00 00 00 00 01 00 00 00 fe 00 59
31 36 34 47 04 42 31 32 31 45 57 34 00 00 00 fe
00 0b 13 1b 21 43 7a a6 ff 01 01 0a 20 20 00 d9

----------------

Block 0, Base EDID:
  EDID Structure Version & Revision: 1.3
  Vendor & Product Identification:
    Manufacturer: AUO
    Model: 16916
    Made in: week 1 of 2007
  Basic Display Parameters & Features:
    Digital display
    Maximum image size: 26 cm x 16 cm
    Gamma: 2.20
    RGB color display
    First detailed timing is the preferred timing
  Color Characteristics:
    Red  : 0.5800, 0.3398
    Green: 0.3300, 0.5751
    Blue : 0.1552, 0.1347
    White: 0.3134, 0.3291
  Established Timings I & II: none
  Standard Timings: none
  Detailed Timing Descriptors:
    DTD 1:  1280x800    60.029 Hz   8:5    49.344 kHz  71.450 MHz (261 mm x 163 mm)
                 Hfront   48 Hsync  32 Hback  88 Hpol N
                 Vfront    3 Vsync   6 Vback  13 Vpol N
    Manufacturer-Specified Display Descriptor (0x00): 00 00 00 00 00 00 00 00 00 00 00 00 00 00 00 01 '................'
    Alphanumeric Data String: 'Y164G'
    Alphanumeric Data String: ''
Checksum: 0xd9

----------------

Failures:

Block 0, Base EDID:
  Alphanumeric Data String: Non-printable character.
  Alphanumeric Data String: Non-printable character.
  Missing Display Product Name.
  Missing Display Range Limits Descriptor.

EDID conformity: FAIL
