edid-decode (hex):

00 ff ff ff ff ff ff 00 04 72 31 00 ab 2e 10 82
15 12 01 04 6c 25 1e 78 2a a2 a5 a3 57 4c 9d 25
11 50 54 bf ef 00 61 46 71 40 71 4f 81 00 81 40
81 4a 81 4f 81 80 30 2a 00 98 51 00 2a 40 30 70
13 00 77 2d 11 00 00 1e 00 00 00 fd 00 31 4b 1e
50 0e 00 0a 20 20 20 20 20 20 00 00 00 fc 00 41
63 65 72 20 56 31 39 33 0a 20 20 20 00 00 00 ff
00 4c 43 43 30 32 30 30 31 34 31 30 30 0a 00 56

----------------

Block 0, Base EDID:
  EDID Structure Version & Revision: 1.4
  Vendor & Product Identification:
    Manufacturer: ACR
    Model: 49
    Serial Number: ...
    Made in: week 21 of 2008
  Basic Display Parameters & Features:
    Analog display
    Input voltage level: 0.7/0.7 V
    Blank level equals black level
    Sync: Separate Composite
    Maximum image size: 37 cm x 30 cm
    Gamma: 2.20
    DPMS levels: Off
    RGB color display
    First detailed timing includes the native pixel format and preferred refresh rate
  Color Characteristics:
    Red  : 0.6386, 0.3417
    Green: 0.2968, 0.6152
    Blue : 0.1464, 0.0683
    White: 0.3134, 0.3291
  Established Timings I & II:
    IBM     :   720x400    70.082 Hz   9:5    31.467 kHz  28.320 MHz
    DMT 0x04:   640x480    59.940 Hz   4:3    31.469 kHz  25.175 MHz
    Apple   :   640x480    66.667 Hz   4:3    35.000 kHz  30.240 MHz
    DMT 0x05:   640x480    72.809 Hz   4:3    37.861 kHz  31.500 MHz
    DMT 0x06:   640x480    75.000 Hz   4:3    37.500 kHz  31.500 MHz
    DMT 0x08:   800x600    56.250 Hz   4:3    35.156 kHz  36.000 MHz
    DMT 0x09:   800x600    60.317 Hz   4:3    37.879 kHz  40.000 MHz
    DMT 0x0a:   800x600    72.188 Hz   4:3    48.077 kHz  50.000 MHz
    DMT 0x0b:   800x600    75.000 Hz   4:3    46.875 kHz  49.500 MHz
    Apple   :   832x624    74.551 Hz   4:3    49.726 kHz  57.284 MHz
    DMT 0x10:  1024x768    60.004 Hz   4:3    48.363 kHz  65.000 MHz
    DMT 0x11:  1024x768    70.069 Hz   4:3    56.476 kHz  75.000 MHz
    DMT 0x12:  1024x768    75.029 Hz   4:3    60.023 kHz  78.750 MHz
    DMT 0x24:  1280x1024   75.025 Hz   5:4    79.976 kHz 135.000 MHz
  Standard Timings:
    CVT     :  1024x768    65.720 Hz   4:3    52.641 kHz  70.750 MHz (EDID 1.4 source)
    GTF     :  1024x768    66.000 Hz   4:3    52.668 kHz  71.628 MHz (EDID 1.3 source)
    CVT     :  1152x864    59.959 Hz   4:3    53.783 kHz  81.750 MHz (EDID 1.4 source)
    GTF     :  1152x864    60.000 Hz   4:3    53.700 kHz  81.624 MHz (EDID 1.3 source)
    DMT 0x15:  1152x864    75.000 Hz   4:3    67.500 kHz 108.000 MHz
    DMT 0x1c:  1280x800    59.810 Hz  16:10   49.702 kHz  83.500 MHz
    DMT 0x20:  1280x960    60.000 Hz   4:3    60.000 kHz 108.000 MHz
    CVT     :  1280x960    69.954 Hz   4:3    70.093 kHz 120.000 MHz (EDID 1.4 source)
    GTF     :  1280x960    70.000 Hz   4:3    69.930 kHz 120.839 MHz (EDID 1.3 source)
    CVT     :  1280x960    74.857 Hz   4:3    75.231 kHz 130.000 MHz (EDID 1.4 source)
    GTF     :  1280x960    75.000 Hz   4:3    75.150 kHz 129.859 MHz (EDID 1.3 source)
    DMT 0x23:  1280x1024   60.020 Hz   5:4    63.981 kHz 108.000 MHz
  Detailed Timing Descriptors:
    DTD 1:  1280x1024   60.020 Hz   5:4    63.981 kHz 108.000 MHz (375 mm x 301 mm)
                 Hfront   48 Hsync 112 Hback 248 Hpol P
                 Vfront    1 Vsync   3 Vback  38 Vpol P
  Display Range Limits:
    Monitor ranges (GTF): 49-75 Hz V, 30-80 kHz H, max dotclock 140 MHz
    Display Product Name: 'Acer V193'
    Display Product Serial Number: ...
Checksum: 0x56
