
EDID (hex):
00ffffffffffff000472abada9039080
09120103802b1b78cacfc5a35a49a025
125054a54b00714f8180b30001010101
01010101010121399030621a274018b0
3640b10e1100001c000000fd00384b1f
5311000a202020202020000000fc0041
6365722050323033570a2020000000ff
004c41423034303036373233300a00e3

edid-decode (hex):

00 ff ff ff ff ff ff 00 04 72 ab ad a9 03 90 80
09 12 01 03 80 2b 1b 78 ca cf c5 a3 5a 49 a0 25
12 50 54 a5 4b 00 71 4f 81 80 b3 00 01 01 01 01
01 01 01 01 01 01 21 39 90 30 62 1a 27 40 18 b0
36 40 b1 0e 11 00 00 1c 00 00 00 fd 00 38 4b 1f
53 11 00 0a 20 20 20 20 20 20 00 00 00 fc 00 41
63 65 72 20 50 32 30 33 57 0a 20 20 00 00 00 ff
00 4c 41 42 30 34 30 30 36 37 32 33 30 0a 00 e3

----------------

Block 0, Base EDID:
  EDID Structure Version & Revision: 1.3
  Vendor & Product Identification:
    Manufacturer: ACR
    Model: 44459
    Serial Number: 2156921769
    Made in: week 9 of 2008
  Basic Display Parameters & Features:
    Digital display
    Maximum image size: 43 cm x 27 cm
    Gamma: 2.20
    DPMS levels: Standby Suspend
    RGB color display
    First detailed timing is the preferred timing
  Color Characteristics:
    Red  : 0.6396, 0.3515
    Green: 0.2880, 0.6279
    Blue : 0.1474, 0.0703
    White: 0.3134, 0.3291
  Established Timings I & II:
    IBM     :   720x400    70.081663 Hz   9:5     31.467 kHz     28.320000 MHz
    DMT 0x04:   640x480    59.940476 Hz   4:3     31.469 kHz     25.175000 MHz
    DMT 0x06:   640x480    75.000000 Hz   4:3     37.500 kHz     31.500000 MHz
    DMT 0x09:   800x600    60.316541 Hz   4:3     37.879 kHz     40.000000 MHz
    DMT 0x0b:   800x600    75.000000 Hz   4:3     46.875 kHz     49.500000 MHz
    DMT 0x10:  1024x768    60.003840 Hz   4:3     48.363 kHz     65.000000 MHz
    DMT 0x12:  1024x768    75.028582 Hz   4:3     60.023 kHz     78.750000 MHz
    DMT 0x24:  1280x1024   75.024675 Hz   5:4     79.976 kHz    135.000000 MHz
  Standard Timings:
    DMT 0x15:  1152x864    75.000000 Hz   4:3     67.500 kHz    108.000000 MHz
    DMT 0x23:  1280x1024   60.019740 Hz   5:4     63.981 kHz    108.000000 MHz
    DMT 0x3a:  1680x1050   59.954250 Hz  16:10    65.290 kHz    146.250000 MHz
  Detailed Timing Descriptors:
    DTD 1:  1680x1050   59.954250 Hz  16:10    65.290 kHz    146.250000 MHz (433 mm x 270 mm)
                 Hfront  280 Hsync 176 Hback  104 Hpol N
                 Vfront    3 Vsync   6 Vback   30 Vpol P
    Display Range Limits:
      Monitor ranges (GTF): 56-75 Hz V, 31-83 kHz H, max dotclock 170 MHz
    Display Product Name: 'Acer P203W'
    Display Product Serial Number: 'LAB040067230'
Checksum: 0xe3


