
EDID (hex):
00ffffffffffff000469a12401010101
0b12010380372378ef4955a95437ad25
135054afcf00714f81809500b300a940
d1008bc08140283c80a070b023403020
360006442100001a000000fd00374b1e
50110200205058028028000000ff0038
334c4d4d533031353734350a000000fc
0041535553204d4b3234310a2020008e

edid-decode (hex):

00 ff ff ff ff ff ff 00 04 69 a1 24 01 01 01 01
0b 12 01 03 80 37 23 78 ef 49 55 a9 54 37 ad 25
13 50 54 af cf 00 71 4f 81 80 95 00 b3 00 a9 40
d1 00 8b c0 81 40 28 3c 80 a0 70 b0 23 40 30 20
36 00 06 44 21 00 00 1a 00 00 00 fd 00 37 4b 1e
50 11 02 00 20 50 58 02 80 28 00 00 00 ff 00 38
33 4c 4d 4d 53 30 31 35 37 34 35 0a 00 00 00 fc
00 41 53 55 53 20 4d 4b 32 34 31 0a 20 20 00 8e

----------------

Block 0, Base EDID:
  EDID Structure Version & Revision: 1.3
  Vendor & Product Identification:
    Manufacturer: ACI
    Model: 9377
    Serial Number: 16843009
    Made in: week 11 of 2008
  Basic Display Parameters & Features:
    Digital display
    Maximum image size: 55 cm x 35 cm
    Gamma: 2.20
    DPMS levels: Standby Suspend Off
    RGB color display
    Default (sRGB) color space is primary color space
    First detailed timing is the preferred timing
    Supports GTF timings within operating range
  Color Characteristics:
    Red  : 0.6611, 0.3281
    Green: 0.2167, 0.6767
    Blue : 0.1455, 0.0751
    White: 0.3134, 0.3291
  Established Timings I & II:
    IBM     :   720x400    70.081663 Hz   9:5     31.467 kHz     28.320000 MHz
    DMT 0x04:   640x480    59.940476 Hz   4:3     31.469 kHz     25.175000 MHz
    DMT 0x05:   640x480    72.808802 Hz   4:3     37.861 kHz     31.500000 MHz
    DMT 0x06:   640x480    75.000000 Hz   4:3     37.500 kHz     31.500000 MHz
    DMT 0x08:   800x600    56.250000 Hz   4:3     35.156 kHz     36.000000 MHz
    DMT 0x09:   800x600    60.316541 Hz   4:3     37.879 kHz     40.000000 MHz
    DMT 0x0a:   800x600    72.187572 Hz   4:3     48.077 kHz     50.000000 MHz
    DMT 0x0b:   800x600    75.000000 Hz   4:3     46.875 kHz     49.500000 MHz
    DMT 0x10:  1024x768    60.003840 Hz   4:3     48.363 kHz     65.000000 MHz
    DMT 0x11:  1024x768    70.069359 Hz   4:3     56.476 kHz     75.000000 MHz
    DMT 0x12:  1024x768    75.028582 Hz   4:3     60.023 kHz     78.750000 MHz
    DMT 0x24:  1280x1024   75.024675 Hz   5:4     79.976 kHz    135.000000 MHz
  Standard Timings:
    DMT 0x15:  1152x864    75.000000 Hz   4:3     67.500 kHz    108.000000 MHz
    DMT 0x23:  1280x1024   60.019740 Hz   5:4     63.981 kHz    108.000000 MHz
    DMT 0x2f:  1440x900    59.887445 Hz  16:10    55.935 kHz    106.500000 MHz
    DMT 0x3a:  1680x1050   59.954250 Hz  16:10    65.290 kHz    146.250000 MHz
    DMT 0x33:  1600x1200   60.000000 Hz   4:3     75.000 kHz    162.000000 MHz
    DMT 0x45:  1920x1200   59.884600 Hz  16:10    74.556 kHz    193.250000 MHz
    GTF     :  1360x765    60.000341 Hz  16:9     47.520 kHz     84.396000 MHz
    DMT 0x20:  1280x960    60.000000 Hz   4:3     60.000 kHz    108.000000 MHz
  Detailed Timing Descriptors:
    DTD 1:  1920x1200   59.950171 Hz  16:10    74.038 kHz    154.000000 MHz (518 mm x 324 mm)
                 Hfront   48 Hsync  32 Hback   80 Hpol P
                 Vfront    3 Vsync   6 Vback   26 Vpol N
    Display Range Limits:
      Monitor ranges (Secondary GTF): 55-75 Hz V, 30-80 kHz H, max dotclock 170 MHz
      GTF Secondary Curve Block:
        Start frequency: 64 kHz
        C: 40.0%
        M: 600%/kHz
        K: 128
        J: 20.0%
    Display Product Serial Number: '83LMMS015745'
    Display Product Name: 'ASUS MK241'
Checksum: 0x8e


