
EDID (hex):
00ffffffffffff000469a12401010101
0d12010380372378ef4955a95437ad25
135054afcf00714f81809500b300a940
d1008bc08140283c80a070b023403020
360006442100001a000000fd00374b1e
50110200205058028028000000ff0038
334c4d4d533033363336390a000000fc
0041535553204d4b3234310a20200087

Extracted contents:
header:          00 ff ff ff ff ff ff 00
serial number:   04 69 a1 24 01 01 01 01 0d 12
version:         01 03
basic params:    80 37 23 78 ef
chroma info:     49 55 a9 54 37 ad 25 13 50 54
established:     af cf 00
standard:        71 4f 81 80 95 00 b3 00 a9 40 d1 00 8b c0 81 40
descriptor 1:    28 3c 80 a0 70 b0 23 40 30 20 36 00 06 44 21 00 00 1a
descriptor 2:    00 00 00 fd 00 37 4b 1e 50 11 02 00 20 50 58 02 80 28
descriptor 3:    00 00 00 ff 00 38 33 4c 4d 4d 53 30 33 36 33 36 39 0a
descriptor 4:    00 00 00 fc 00 41 53 55 53 20 4d 4b 32 34 31 0a 20 20
extensions:      00
checksum:        87

EDID version: 1.3
Manufacturer: ACI Model 24a1 Serial Number --
Made in week 13 of 2008
Digital display
Maximum image size: 55 cm x 35 cm
Gamma: 2.20
DPMS levels: Standby Suspend Off
RGB color display
Default (sRGB) color space is primary color space
First detailed timing is preferred timing
Supports GTF timings within operating range
Display x,y Chromaticity:
  Red:   0.6611, 0.3281
  Green: 0.2167, 0.6767
  Blue:  0.1455, 0.0751
  White: 0.3134, 0.3291
Established timings supported:
  720x400@70Hz 9:5 HorFreq: 31469 Hz Clock: 28.320 MHz
  640x480@60Hz 4:3 HorFreq: 31469 Hz Clock: 25.175 MHz
  640x480@72Hz 4:3 HorFreq: 37900 Hz Clock: 31.500 MHz
  640x480@75Hz 4:3 HorFreq: 37500 Hz Clock: 31.500 MHz
  800x600@56Hz 4:3 HorFreq: 35200 Hz Clock: 36.000 MHz
  800x600@60Hz 4:3 HorFreq: 37900 Hz Clock: 40.000 MHz
  800x600@72Hz 4:3 HorFreq: 48100 Hz Clock: 50.000 MHz
  800x600@75Hz 4:3 HorFreq: 46900 Hz Clock: 49.500 MHz
  1024x768@60Hz 4:3 HorFreq: 48400 Hz Clock: 65.000 MHz
  1024x768@70Hz 4:3 HorFreq: 56500 Hz Clock: 75.000 MHz
  1024x768@75Hz 4:3 HorFreq: 60000 Hz Clock: 78.750 MHz
  1280x1024@75Hz 5:4 HorFreq: 80000 Hz Clock: 135.000 MHz
Standard timings supported:
  1152x864@75Hz 4:3 HorFreq: 67500 Hz Clock: 108.000 MHz
  1280x1024@60Hz 5:4 HorFreq: 64000 Hz Clock: 108.000 MHz
  1440x900@60Hz 16:10 HorFreq: 55500 Hz Clock: 88.750 MHz
  1680x1050@60Hz 16:10 HorFreq: 64700 Hz Clock: 119.000 MHz
  1600x1200@60Hz 4:3 HorFreq: 75000 Hz Clock: 162.000 MHz
  1920x1200@60Hz 16:10 HorFreq: 74000 Hz Clock: 154.000 MHz
  1360x765@60Hz 16:9
  1280x960@60Hz 4:3 HorFreq: 60000 Hz Clock: 108.000 MHz
Detailed mode: Clock 154.000 MHz, 518 mm x 324 mm
               1920 1968 2000 2080 hborder 0
               1200 1203 1209 1235 vborder 0
               +hsync -vsync 
               VertFreq: 59 Hz, HorFreq: 74038 Hz
Monitor ranges (GTF with icing): 55-75Hz V, 30-80kHz H, max dotclock 170MHz
Serial number: --
Monitor name: ASUS MK241
Checksum: 0x87 (valid)
EDID block does NOT conform to EDID 1.3!
	sRGB is signaled, but the chromaticities do not match


