
EDID (hex):
00ffffffffffff0009e5cf0500000000
01160104951f117802b0909758549226
1d505400000001010101010101010101
0101010101013e1c56a0500016303020
360035ad1000001a3e1c56a050001630
3020360035ad1000001a000000fe0042
4f452048460a202020202020000000fe
0048423134305758312d3430310a00d8

Extracted contents:
header:          00 ff ff ff ff ff ff 00
serial number:   09 e5 cf 05 00 00 00 00 01 16
version:         01 04
basic params:    95 1f 11 78 02
chroma info:     b0 90 97 58 54 92 26 1d 50 54
established:     00 00 00
standard:        01 01 01 01 01 01 01 01 01 01 01 01 01 01 01 01
descriptor 1:    3e 1c 56 a0 50 00 16 30 30 20 36 00 35 ad 10 00 00 1a
descriptor 2:    3e 1c 56 a0 50 00 16 30 30 20 36 00 35 ad 10 00 00 1a
descriptor 3:    00 00 00 fe 00 42 4f 45 20 48 46 0a 20 20 20 20 20 20
descriptor 4:    00 00 00 fe 00 48 42 31 34 30 57 58 31 2d 34 30 31 0a
extensions:      00
checksum:        d8

EDID version: 1.4
Manufacturer: BOE Model 5cf Serial Number --
Made in week 1 of 2012
Digital display
6 bits per primary color channel
DisplayPort interface
Maximum image size: 31 cm x 17 cm
Gamma: 2.20
Supported color formats: RGB 4:4:4
First detailed timing includes the native pixel format and preferred refresh rate
Display x,y Chromaticity:
  Red:   0.5917, 0.3466
  Green: 0.3281, 0.5703
  Blue:  0.1503, 0.1142
  White: 0.3125, 0.3281
Established timings supported:
Standard timings supported:
Detailed mode: Clock 72.300 MHz, 309 mm x 173 mm
               1366 1414 1446 1526 hborder 0
                768  771  777  790 vborder 0
               +hsync -vsync 
               VertFreq: 59 Hz, HorFreq: 47378 Hz
Detailed mode: Clock 72.300 MHz, 309 mm x 173 mm
               1366 1414 1446 1526 hborder 0
                768  771  777  790 vborder 0
               +hsync -vsync 
               VertFreq: 59 Hz, HorFreq: 47378 Hz
ASCII string: BOE HF
ASCII string: HB140WX1-401
Checksum: 0xd8 (valid)
EDID block does NOT conform to EDID 1.4!
	Missing name descriptor
	Missing monitor ranges
